projects/hipblaslt/library/src/amd_detail/rocblaslt/src/Tensile/Logic/asm_full/aquavanjaram/gfx942_38cu/GridBased/aquavanjaram_Cijk_Alik_Bljk_HSS_BH_Bias_HAS_SAV_UserArgs.yaml
- {MinimumRequiredVersion: 5.0.0}
- aquavanjaram
- {Architecture: gfx942, CUCount: 38}
- [Device 0049, Device 0050]
    SolutionIndex: 0
    SolutionNameMin: Cijk_Alik_Bljk_HSS_BH_Bias_S_HA_S_SAV_UserArgs_MT16x16x256_MI16x16x1_SN_LDSB0_AFC1_AFEM1_AFEM1_ASEM1_CLR1_CADS0_DTVA0_DTVB0_EPS0_FDSI0_GRPM1_GRVWA8_GRVWB8_GSUn1_GSUAMBSK_GSUC1_GSUWGMRR1_GLS0_ISA942_IU1_K1_LBSPPA512_LBSPPB512_LBSPPM0_LPA16_LPB16_LPM0_LRVW8_LWPMn1_MIAV0_MIWT1_1_MO40_NTn1_NTA0_NTB0_NTC0_NTD4_NTM0_NEPBS8_NLCA1_NLCB1_ONLL1_PGR2_PLR1_PKA1_SIA3_SS1_SU16_SUM1_SUS512_SPO0_SRVW0_SSO0_SVW1_SK0_SKXCCM0_TLDS1_ULSGRO0_USL1_UIOFGRO0_USFGROn1_VSn1_VWA1_VWB1_WSGRA0_WSGRB0_WS64_WG16_4_4_WGM1_WGMXCC4_WGMXCCGn1
    SolutionIndex: 1
    SolutionNameMin: Cijk_Alik_Bljk_HSS_BH_Bias_S_HA_S_SAV_UserArgs_MT16x16x512_MI16x16x1_SN_LDSB1_AFC1_AFEM1_AFEM1_ASEM1_CLR1_CADS0_DTVA0_DTVB0_EPS0_FDSI0_GRPM1_GRVWA8_GRVWB8_GSUn1_GSUAMBSK_GSUC1_GSUWGMRR1_GLS0_ISA942_IU1_K1_LBSPPA1024_LBSPPB1024_LBSPPM0_LPA16_LPB16_LPM0_LRVW8_LWPMn1_MIAV0_MIWT1_1_MO40_NTn1_NTA0_NTB0_NTC0_NTD4_NTM0_NEPBS8_NLCA1_NLCB1_ONLL1_PGR2_PLR1_PKA1_SIA3_SS1_SU16_SUM1_SUS1024_SPO0_SRVW0_SSO0_SVW1_SK0_SKXCCM0_TLDS1_ULSGRO0_USL1_UIOFGRO0_USFGROn1_VSn1_VWA1_VWB1_WSGRA0_WSGRB0_WS64_WG16_4_4_WGM1_WGMXCC4_WGMXCCGn1
    SolutionIndex: 2
    SolutionNameMin: Cijk_Alik_Bljk_HSS_BH_Bias_S_HA_S_SAV_UserArgs_MT16x16x256_MI16x16x1_SN_LDSB0_AFC1_AFEM1_AFEM1_ASEM1_CLR1_CADS0_DTVA0_DTVB0_EPS0_FDSI0_GRPM1_GRVWA8_GRVWB8_GSUn1_GSUAMBSK_GSUC1_GSUWGMRR1_GLS0_ISA942_IU1_K1_LBSPPA512_LBSPPB512_LBSPPM0_LPA16_LPB16_LPM0_LRVW8_LWPMn1_MIAV0_MIWT1_1_MO40_NTn1_NTA0_NTB0_NTC0_NTD4_NTM0_NEPBS8_NLCA1_NLCB1_ONLL1_PGR2_PLR1_PKA1_SIA3_SS1_SU16_SUM1_SUS512_SPO0_SRVW0_SSO0_SVW1_SK0_SKXCCM0_TLDS1_ULSGRO0_USL1_UIOFGRO0_USFGROn1_VSn1_VWA1_VWB1_WSGRA0_WSGRB0_WS64_WG16_4_2_WGM1_WGMXCC4_WGMXCCGn1
    SolutionIndex: 3
    SolutionNameMin: Cijk_Alik_Bljk_HSS_BH_Bias_S_HA_S_SAV_UserArgs_MT32x16x256_MI16x16x1_SN_LDSB0_AFC1_AFEM1_AFEM1_ASEM1_CLR1_CADS0_DTVA0_DTVB0_EPS0_FDSI0_GRPM1_GRVWA8_GRVWB8_GSUn1_GSUAMBSK_GSUC1_GSUWGMRR1_GLS0_ISA942_IU1_K1_LBSPPA512_LBSPPB512_LBSPPM0_LPA16_LPB16_LPM0_LRVW8_LWPMn1_MIAV0_MIWT1_1_MO40_NTn1_NTA0_NTB0_NTC0_NTD4_NTM0_NEPBS8_NLCA1_NLCB1_ONLL1_PGR2_PLR1_PKA1_SIA3_SS1_SU16_SUM1_SUS512_SPO0_SRVW0_SSO0_SVW1_SK0_SKXCCM0_TLDS1_ULSGRO0_USL1_UIOFGRO0_USFGROn1_VSn1_VWA1_VWB1_WSGRA0_WSGRB0_WS64_WG32_4_1_WGM1_WGMXCC4_WGMXCCGn1
    SolutionIndex: 4
    SolutionNameMin: Cijk_Alik_Bljk_HSS_BH_Bias_S_HA_S_SAV_UserArgs_MT32x16x512_MI16x16x1_SN_LDSB1_AFC1_AFEM1_AFEM1_ASEM1_CLR1_CADS0_DTVA0_DTVB0_EPS0_FDSI0_GRPM1_GRVWA8_GRVWB8_GSUn1_GSUAMBSK_GSUC1_GSUWGMRR1_GLS0_ISA942_IU1_K1_LBSPPA2048_LBSPPB1024_LBSPPM0_LPA16_LPB16_LPM0_LRVW8_LWPMn1_MIAV0_MIWT2_1_MO40_NTn1_NTA0_NTB0_NTC0_NTD4_NTM0_NEPBS8_NLCA1_NLCB1_ONLL1_PGR2_PLR1_PKA1_SIA3_SS1_SU16_SUM1_SUS1024_SPO0_SRVW0_SSO0_SVW2_SK0_SKXCCM0_TLDS1_ULSGRO0_USL1_UIOFGRO0_USFGROn1_VSn1_VWA2_VWB1_WSGRA0_WSGRB0_WS64_WG16_4_4_WGM1_WGMXCC4_WGMXCCGn1
    SolutionIndex: 5
    SolutionNameMin: Cijk_Alik_Bljk_HSS_BH_Bias_S_HA_S_SAV_UserArgs_MT32x16x256_MI16x16x1_SN_LDSB0_AFC1_AFEM1_AFEM1_ASEM1_CLR1_CADS0_DTVA0_DTVB0_EPS0_FDSI0_GRPM1_GRVWA8_GRVWB8_GSUn1_GSUAMBSK_GSUC1_GSUWGMRR1_GLS0_ISA942_IU1_K1_LBSPPA512_LBSPPB512_LBSPPM0_LPA16_LPB16_LPM0_LRVW8_LWPMn1_MIAV0_MIWT1_1_MO40_NTn1_NTA0_NTB0_NTC0_NTD4_NTM0_NEPBS8_NLCA1_NLCB1_ONLL1_PGR2_PLR1_PKA1_SIA3_SS1_SU16_SUM1_SUS512_SPO0_SRVW0_SSO0_SVW1_SK0_SKXCCM0_TLDS1_ULSGRO0_USL1_UIOFGRO0_USFGROn1_VSn1_VWA1_VWB1_WSGRA0_WSGRB0_WS64_WG32_4_2_WGM1_WGMXCC4_WGMXCCGn1
    SolutionIndex: 6
    SolutionNameMin: Cijk_Alik_Bljk_HSS_BH_Bias_S_HA_S_SAV_UserArgs_MT32x16x256_MI16x16x1_SN_LDSB1_AFC1_AFEM1_AFEM1_ASEM1_CLR1_CADS0_DTVA0_DTVB0_EPS0_FDSI0_GRPM1_GRVWA8_GRVWB8_GSUn1_GSUAMBSK_GSUC1_GSUWGMRR1_GLS0_ISA942_IU1_K1_LBSPPA512_LBSPPB512_LBSPPM0_LPA16_LPB16_LPM0_LRVW8_LWPMn1_MIAV0_MIWT1_1_MO40_NTn1_NTA0_NTB0_NTC0_NTD4_NTM0_NEPBS8_NLCA1_NLCB1_ONLL1_PGR2_PLR1_PKA1_SIA3_SS1_SU16_SUM1_SUS512_SPO0_SRVW0_SSO0_SVW1_SK0_SKXCCM0_TLDS1_ULSGRO0_USL1_UIOFGRO0_USFGROn1_VSn1_VWA1_VWB1_WSGRA0_WSGRB0_WS64_WG32_4_1_WGM1_WGMXCC4_WGMXCCGn1
    SolutionIndex: 7
    SolutionNameMin: Cijk_Alik_Bljk_HSS_BH_Bias_S_HA_S_SAV_UserArgs_MT16x16x512_MI16x16x1_SN_LDSB1_AFC1_AFEM1_AFEM1_ASEM1_CLR1_CADS0_DTVA0_DTVB0_EPS0_FDSI0_GRPM1_GRVWA8_GRVWB8_GSUn1_GSUAMBSK_GSUC1_GSUWGMRR1_GLS0_ISA942_IU1_K1_LBSPPA1024_LBSPPB1024_LBSPPM0_LPA16_LPB16_LPM0_LRVW8_LWPMn1_MIAV0_MIWT1_1_MO40_NTn1_NTA0_NTB0_NTC0_NTD4_NTM0_NEPBS8_NLCA1_NLCB1_ONLL1_PGR2_PLR1_PKA1_SIA3_SS1_SU16_SUM1_SUS1024_SPO0_SRVW0_SSO0_SVW1_SK0_SKXCCM0_TLDS1_ULSGRO0_USL1_UIOFGRO0_USFGROn1_VSn1_VWA1_VWB1_WSGRA0_WSGRB0_WS64_WG16_4_2_WGM1_WGMXCC4_WGMXCCGn1
    SolutionIndex: 8
    SolutionNameMin: Cijk_Alik_Bljk_HSS_BH_Bias_S_HA_S_SAV_UserArgs_MT64x16x256_MI16x16x1_SN_LDSB1_AFC1_AFEM1_AFEM1_ASEM1_CLR1_CADS0_DTVA0_DTVB0_EPS0_FDSI0_GRPM1_GRVWA8_GRVWB8_GSUn1_GSUAMBSK_GSUC1_GSUWGMRR1_GLS0_ISA942_IU1_K1_LBSPPA512_LBSPPB512_LBSPPM0_LPA16_LPB16_LPM0_LRVW8_LWPMn1_MIAV0_MIWT1_1_MO40_NTn1_NTA0_NTB0_NTC0_NTD4_NTM0_NEPBS8_NLCA1_NLCB1_ONLL1_PGR2_PLR1_PKA1_SIA3_SS1_SU16_SUM1_SUS512_SPO0_SRVW0_SSO0_SVW1_SK0_SKXCCM0_TLDS1_ULSGRO0_USL1_UIOFGRO0_USFGROn1_VSn1_VWA1_VWB1_WSGRA0_WSGRB0_WS64_WG64_4_1_WGM1_WGMXCC4_WGMXCCGn1
    SolutionIndex: 9
    SolutionNameMin: Cijk_Alik_Bljk_HSS_BH_Bias_S_HA_S_SAV_UserArgs_MT32x16x512_MI16x16x1_SN_LDSB1_AFC1_AFEM1_AFEM1_ASEM1_CLR1_CADS0_DTVA0_DTVB0_EPS0_FDSI0_GRPM1_GRVWA8_GRVWB8_GSUn1_GSUAMBSK_GSUC1_GSUWGMRR1_GLS0_ISA942_IU1_K1_LBSPPA1024_LBSPPB1024_LBSPPM0_LPA16_LPB16_LPM0_LRVW8_LWPMn1_MIAV0_MIWT1_1_MO40_NTn1_NTA0_NTB0_NTC0_NTD4_NTM0_NEPBS8_NLCA1_NLCB1_ONLL1_PGR2_PLR1_PKA1_SIA3_SS1_SU16_SUM1_SUS1024_SPO0_SRVW0_SSO0_SVW1_SK0_SKXCCM0_TLDS1_ULSGRO0_USL1_UIOFGRO0_USFGROn1_VSn1_VWA1_VWB1_WSGRA0_WSGRB0_WS64_WG32_4_2_WGM1_WGMXCC4_WGMXCCGn1
    SolutionIndex: 10
    SolutionNameMin: Cijk_Alik_Bljk_HSS_BH_Bias_S_HA_S_SAV_UserArgs_MT32x16x512_MI16x16x1_SN_LDSB1_AFC1_AFEM1_AFEM1_ASEM1_CLR1_CADS0_DTVA0_DTVB0_EPS0_FDSI0_GRPM1_GRVWA8_GRVWB8_GSUn1_GSUAMBSK_GSUC1_GSUWGMRR1_GLS0_ISA942_IU1_K1_LBSPPA1024_LBSPPB1024_LBSPPM0_LPA16_LPB16_LPM0_LRVW8_LWPMn1_MIAV0_MIWT1_1_MO40_NTn1_NTA0_NTB0_NTC0_NTD4_NTM0_NEPBS8_NLCA1_NLCB1_ONLL1_PGR2_PLR1_PKA1_SIA3_SS1_SU16_SUM1_SUS1024_SPO0_SRVW0_SSO0_SVW1_SK0_SKXCCM0_TLDS1_ULSGRO0_USL1_UIOFGRO0_USFGROn1_VSn1_VWA1_VWB1_WSGRA0_WSGRB0_WS64_WG32_4_1_WGM1_WGMXCC4_WGMXCCGn1
    SolutionIndex: 11
    SolutionNameMin: Cijk_Alik_Bljk_HSS_BH_Bias_S_HA_S_SAV_UserArgs_MT64x16x256_MI16x16x1_SN_LDSB1_AFC1_AFEM1_AFEM1_ASEM1_CLR1_CADS0_DTVA0_DTVB0_EPS0_FDSI0_GRPM1_GRVWA8_GRVWB8_GSUn1_GSUAMBSK_GSUC1_GSUWGMRR1_GLS0_ISA942_IU1_K1_LBSPPA1024_LBSPPB512_LBSPPM0_LPA16_LPB16_LPM0_LRVW8_LWPMn1_MIAV0_MIWT2_1_MO40_NTn1_NTA0_NTB0_NTC0_NTD4_NTM0_NEPBS8_NLCA1_NLCB1_ONLL1_PGR2_PLR1_PKA1_SIA3_SS1_SU16_SUM1_SUS512_SPO0_SRVW0_SSO0_SVW2_SK0_SKXCCM0_TLDS1_ULSGRO0_USL1_UIOFGRO0_USFGROn1_VSn1_VWA2_VWB1_WSGRA0_WSGRB0_WS64_WG32_4_2_WGM1_WGMXCC4_WGMXCCGn1
    SolutionIndex: 12
    SolutionNameMin: Cijk_Alik_Bljk_HSS_BH_Bias_S_HA_S_SAV_UserArgs_MT64x16x256_MI16x16x1_SN_LDSB1_AFC1_AFEM1_AFEM1_ASEM1_CLR1_CADS0_DTVA0_DTVB0_EPS0_FDSI0_GRPM1_GRVWA8_GRVWB8_GSUn1_GSUAMBSK_GSUC1_GSUWGMRR1_GLS0_ISA942_IU1_K1_LBSPPA2048_LBSPPB512_LBSPPM0_LPA16_LPB16_LPM0_LRVW8_LWPMn1_MIAV0_MIWT4_1_MO40_NTn1_NTA0_NTB0_NTC0_NTD4_NTM0_NEPBS8_NLCA1_NLCB1_ONLL1_PGR2_PLR1_PKA1_SIA3_SS1_SU16_SUM1_SUS512_SPO0_SRVW0_SSO0_SVW4_SK0_SKXCCM0_TLDS1_ULSGRO0_USL1_UIOFGRO0_USFGROn1_VSn1_VWA4_VWB1_WSGRA0_WSGRB0_WS64_WG16_4_4_WGM1_WGMXCC4_WGMXCCGn1
    SolutionIndex: 13
    SolutionNameMin: Cijk_Alik_Bljk_HSS_BH_Bias_S_HA_S_SAV_UserArgs_MT16x16x256_MI16x16x1_SN_LDSB1_AFC1_AFEM1_AFEM1_ASEM1_CLR1_CADS0_DTVA0_DTVB0_EPS0_FDSI0_GRPM1_GRVWA8_GRVWB8_GSUn1_GSUAMBSK_GSUC1_GSUWGMRR1_GLS0_ISA942_IU1_K1_LBSPPA512_LBSPPB512_LBSPPM0_LPA16_LPB16_LPM0_LRVW8_LWPMn1_MIAV0_MIWT1_1_MO40_NTn1_NTA0_NTB0_NTC0_NTD4_NTM0_NEPBS8_NLCA1_NLCB1_ONLL1_PGR2_PLR1_PKA1_SIA3_SS1_SU16_SUM1_SUS512_SPO0_SRVW0_SSO0_SVW1_SK0_SKXCCM0_TLDS1_ULSGRO0_USL1_UIOFGRO0_USFGROn1_VSn1_VWA1_VWB1_WSGRA0_WSGRB0_WS64_WG16_4_1_WGM1_WGMXCC4_WGMXCCGn1
    SolutionIndex: 14
    SolutionNameMin: Cijk_Alik_Bljk_HSS_BH_Bias_S_HA_S_SAV_UserArgs_MT32x16x128_MI16x16x1_SN_LDSB1_AFC1_AFEM1_AFEM1_ASEM1_CLR1_CADS0_DTVA0_DTVB0_EPS0_FDSI0_GRPM1_GRVWA8_GRVWB8_GSUn1_GSUAMBSK_GSUC1_GSUWGMRR1_GLS0_ISA942_IU1_K1_LBSPPA256_LBSPPB256_LBSPPM0_LPA16_LPB16_LPM0_LRVW8_LWPMn1_MIAV0_MIWT1_1_MO40_NTn1_NTA0_NTB0_NTC0_NTD4_NTM0_NEPBS8_NLCA1_NLCB1_ONLL1_PGR2_PLR1_PKA1_SIA3_SS1_SU16_SUM1_SUS256_SPO0_SRVW0_SSO0_SVW1_SK0_SKXCCM0_TLDS1_ULSGRO0_USL1_UIOFGRO0_USFGROn1_VSn1_VWA1_VWB1_WSGRA0_WSGRB0_WS64_WG32_4_1_WGM1_WGMXCC4_WGMXCCGn1
    SolutionIndex: 15
    SolutionNameMin: Cijk_Alik_Bljk_HSS_BH_Bias_S_HA_S_SAV_UserArgs_MT192x16x128_MI16x16x1_SN_LDSB1_AFC1_AFEM1_AFEM1_ASEM1_CLR1_CADS0_DTVA0_DTVB0_EPS0_FDSI0_GRPM1_GRVWA8_GRVWB8_GSUn1_GSUAMBSK_GSUC1_GSUWGMRR1_GLS0_ISA942_IU1_K1_LBSPPA256_LBSPPB256_LBSPPM0_LPA16_LPB16_LPM0_LRVW8_LWPMn1_MIAV0_MIWT3_1_MO40_NTn1_NTA0_NTB0_NTC0_NTD4_NTM0_NEPBS6_NLCA1_NLCB1_ONLL1_PGR2_PLR1_PKA1_SIA3_SS1_SU16_SUM1_SUS256_SPO0_SRVW0_SSO0_SVW1_SK0_SKXCCM0_TLDS1_ULSGRO0_USL1_UIOFGRO0_USFGROn1_VSn1_VWA1_VWB1_WSGRA0_WSGRB0_WS64_WG64_4_1_WGM1_WGMXCC4_WGMXCCGn1
    SolutionIndex: 16
    SolutionNameMin: Cijk_Alik_Bljk_HSS_BH_Bias_S_HA_S_SAV_UserArgs_MT128x16x128_MI16x16x1_SN_LDSB1_AFC1_AFEM1_AFEM1_ASEM1_CLR1_CADS0_DTVA0_DTVB0_EPS0_FDSI0_GRPM1_GRVWA8_GRVWB8_GSUn1_GSUAMBSK_GSUC1_GSUWGMRR1_GLS0_ISA942_IU1_K1_LBSPPA512_LBSPPB256_LBSPPM0_LPA16_LPB16_LPM0_LRVW8_LWPMn1_MIAV0_MIWT2_1_MO40_NTn1_NTA0_NTB0_NTC0_NTD4_NTM0_NEPBS8_NLCA1_NLCB1_ONLL1_PGR2_PLR1_PKA1_SIA3_SS1_SU16_SUM1_SUS256_SPO0_SRVW0_SSO0_SVW2_SK0_SKXCCM0_TLDS1_ULSGRO0_USL1_UIOFGRO0_USFGROn1_VSn1_VWA2_VWB1_WSGRA0_WSGRB0_WS64_WG64_4_1_WGM1_WGMXCC4_WGMXCCGn1
    SolutionIndex: 17
    SolutionNameMin: Cijk_Alik_Bljk_HSS_BH_Bias_S_HA_S_SAV_UserArgs_MT128x16x128_MI16x16x1_SN_LDSB1_AFC1_AFEM1_AFEM1_ASEM1_CLR1_CADS0_DTVA0_DTVB0_EPS0_FDSI0_GRPM1_GRVWA8_GRVWB8_GSUn1_GSUAMBSK_GSUC1_GSUWGMRR1_GLS0_ISA942_IU1_K1_LBSPPA1024_LBSPPB256_LBSPPM0_LPA16_LPB16_LPM0_LRVW8_LWPMn1_MIAV0_MIWT4_1_MO40_NTn1_NTA0_NTB0_NTC0_NTD4_NTM0_NEPBS8_NLCA1_NLCB1_ONLL1_PGR2_PLR1_PKA1_SIA3_SS1_SU16_SUM1_SUS256_SPO0_SRVW0_SSO0_SVW4_SK0_SKXCCM0_TLDS1_ULSGRO0_USL1_UIOFGRO0_USFGROn1_VSn1_VWA4_VWB1_WSGRA0_WSGRB0_WS64_WG32_4_2_WGM1_WGMXCC4_WGMXCCGn1
    SolutionIndex: 18
    SolutionNameMin: Cijk_Alik_Bljk_HSS_BH_Bias_S_HA_S_SAV_UserArgs_MT64x16x128_MI16x16x1_SN_LDSB1_AFC1_AFEM1_AFEM1_ASEM1_CLR1_CADS0_DTVA0_DTVB0_EPS0_FDSI0_GRPM1_GRVWA8_GRVWB8_GSUn1_GSUAMBSK_GSUC1_GSUWGMRR1_GLS0_ISA942_IU1_K1_LBSPPA256_LBSPPB256_LBSPPM0_LPA16_LPB16_LPM0_LRVW8_LWPMn1_MIAV0_MIWT1_1_MO40_NTn1_NTA0_NTB0_NTC0_NTD4_NTM0_NEPBS8_NLCA1_NLCB1_ONLL1_PGR2_PLR1_PKA1_SIA3_SS1_SU16_SUM1_SUS256_SPO0_SRVW0_SSO0_SVW1_SK0_SKXCCM0_TLDS1_ULSGRO0_USL1_UIOFGRO0_USFGROn1_VSn1_VWA1_VWB1_WSGRA0_WSGRB0_WS64_WG64_4_1_WGM1_WGMXCC4_WGMXCCGn1
    SolutionIndex: 19
    SolutionNameMin: Cijk_Alik_Bljk_HSS_BH_Bias_S_HA_S_SAV_UserArgs_MT64x16x64_MI16x16x1_SN_LDSB1_AFC1_AFEM1_AFEM1_ASEM1_CLR1_CADS0_DTVA0_DTVB0_EPS0_FDSI0_GRPM1_GRVWA8_GRVWB4_GSUn1_GSUAMBSK_GSUC1_GSUWGMRR1_GLS0_ISA942_IU1_K1_LBSPPA128_LBSPPB128_LBSPPM0_LPA16_LPB16_LPM0_LRVW8_LWPMn1_MIAV0_MIWT1_1_MO40_NTn1_NTA0_NTB0_NTC0_NTD4_NTM0_NEPBS8_NLCA1_NLCB1_ONLL1_PGR2_PLR1_PKA1_SIA3_SS1_SU16_SUM1_SUS128_SPO0_SRVW0_SSO0_SVW1_SK0_SKXCCM0_TLDS1_ULSGRO0_USL1_UIOFGRO0_USFGROn1_VSn1_VWA1_VWB1_WSGRA0_WSGRB0_WS64_WG64_4_1_WGM1_WGMXCC4_WGMXCCGn1
    SolutionIndex: 20
    SolutionNameMin: Cijk_Alik_Bljk_HSS_BH_Bias_S_HA_S_SAV_UserArgs_MT32x16x128_MI16x16x1_SN_LDSB0_AFC1_AFEM1_AFEM1_ASEM1_CLR1_CADS0_DTVA0_DTVB0_EPS0_FDSI0_GRPM1_GRVWA8_GRVWB8_GSUn1_GSUAMBSK_GSUC1_GSUWGMRR1_GLS0_ISA942_IU1_K1_LBSPPA256_LBSPPB256_LBSPPM0_LPA16_LPB16_LPM0_LRVW8_LWPMn1_MIAV0_MIWT1_1_MO40_NTn1_NTA0_NTB0_NTC0_NTD4_NTM0_NEPBS8_NLCA1_NLCB1_ONLL1_PGR2_PLR1_PKA1_SIA3_SS1_SU16_SUM1_SUS256_SPO0_SRVW0_SSO0_SVW1_SK0_SKXCCM0_TLDS1_ULSGRO0_USL1_UIOFGRO0_USFGROn1_VSn1_VWA1_VWB1_WSGRA0_WSGRB0_WS64_WG32_4_1_WGM1_WGMXCC4_WGMXCCGn1
    SolutionIndex: 21
    SolutionNameMin: Cijk_Alik_Bljk_HSS_BH_Bias_S_HA_S_SAV_UserArgs_MT16x32x512_MI16x16x1_SN_LDSB1_AFC1_AFEM1_AFEM1_ASEM1_CLR1_CADS0_DTVA0_DTVB0_EPS0_FDSI0_GRPM1_GRVWA8_GRVWB8_GSUn1_GSUAMBSK_GSUC1_GSUWGMRR1_GLS0_ISA942_IU1_K1_LBSPPA1024_LBSPPB2048_LBSPPM0_LPA16_LPB16_LPM0_LRVW8_LWPMn1_MIAV0_MIWT1_2_MO40_NTn1_NTA0_NTB0_NTC0_NTD4_NTM0_NEPBS8_NLCA1_NLCB1_ONLL1_PGR2_PLR1_PKA1_SIA3_SS1_SU16_SUM1_SUS1024_SPO0_SRVW0_SSO0_SVW1_SK0_SKXCCM0_TLDS1_ULSGRO0_USL1_UIOFGRO0_USFGROn1_VSn1_VWA1_VWB2_WSGRA0_WSGRB0_WS64_WG16_4_4_WGM1_WGMXCC4_WGMXCCGn1
    SolutionIndex: 22
    SolutionNameMin: Cijk_Alik_Bljk_HSS_BH_Bias_S_HA_S_SAV_UserArgs_MT16x16x256_MI16x16x1_SN_LDSB1_AFC1_AFEM1_AFEM1_ASEM1_CLR1_CADS0_DTVA0_DTVB0_EPS0_FDSI0_GRPM1_GRVWA8_GRVWB8_GSUn1_GSUAMBSK_GSUC1_GSUWGMRR1_GLS0_ISA942_IU1_K1_LBSPPA512_LBSPPB512_LBSPPM0_LPA16_LPB16_LPM0_LRVW8_LWPMn1_MIAV0_MIWT1_1_MO40_NTn1_NTA0_NTB0_NTC0_NTD4_NTM0_NEPBS8_NLCA1_NLCB1_ONLL1_PGR2_PLR1_PKA1_SIA3_SS1_SU16_SUM1_SUS512_SPO0_SRVW0_SSO0_SVW1_SK0_SKXCCM0_TLDS1_ULSGRO0_USL1_UIOFGRO0_USFGROn1_VSn1_VWA1_VWB1_WSGRA0_WSGRB0_WS64_WG16_4_2_WGM1_WGMXCC4_WGMXCCGn1
    SolutionIndex: 23
    SolutionNameMin: Cijk_Alik_Bljk_HSS_BH_Bias_S_HA_S_SAV_UserArgs_MT32x32x256_MI16x16x1_SN_LDSB1_AFC1_AFEM1_AFEM1_ASEM1_CLR1_CADS0_DTVA0_DTVB0_EPS0_FDSI0_GRPM1_GRVWA8_GRVWB8_GSUn1_GSUAMBSK_GSUC1_GSUWGMRR1_GLS0_ISA942_IU1_K1_LBSPPA512_LBSPPB512_LBSPPM0_LPA16_LPB16_LPM0_LRVW8_LWPMn1_MIAV0_MIWT1_1_MO40_NTn1_NTA0_NTB0_NTC0_NTD4_NTM0_NEPBS8_NLCA1_NLCB1_ONLL1_PGR2_PLR1_PKA1_SIA3_SS1_SU16_SUM1_SUS512_SPO0_SRVW0_SSO0_SVW1_SK0_SKXCCM0_TLDS1_ULSGRO0_USL1_UIOFGRO0_USFGROn1_VSn1_VWA1_VWB1_WSGRA0_WSGRB0_WS64_WG32_8_1_WGM1_WGMXCC4_WGMXCCGn1
    SolutionIndex: 24
    SolutionNameMin: Cijk_Alik_Bljk_HSS_BH_Bias_S_HA_S_SAV_UserArgs_MT16x32x512_MI16x16x1_SN_LDSB1_AFC1_AFEM1_AFEM1_ASEM1_CLR1_CADS0_DTVA0_DTVB0_EPS0_FDSI0_GRPM1_GRVWA8_GRVWB8_GSUn1_GSUAMBSK_GSUC1_GSUWGMRR1_GLS0_ISA942_IU1_K1_LBSPPA1024_LBSPPB1024_LBSPPM0_LPA16_LPB16_LPM0_LRVW8_LWPMn1_MIAV0_MIWT1_1_MO40_NTn1_NTA0_NTB0_NTC0_NTD4_NTM0_NEPBS8_NLCA1_NLCB1_ONLL1_PGR2_PLR1_PKA1_SIA3_SS1_SU16_SUM1_SUS1024_SPO0_SRVW0_SSO0_SVW1_SK0_SKXCCM0_TLDS1_ULSGRO0_USL1_UIOFGRO0_USFGROn1_VSn1_VWA1_VWB1_WSGRA0_WSGRB0_WS64_WG16_8_2_WGM1_WGMXCC4_WGMXCCGn1
    SolutionIndex: 25
    SolutionNameMin: Cijk_Alik_Bljk_HSS_BH_Bias_S_HA_S_SAV_UserArgs_MT32x32x256_MI32x32x1_SN_LDSB1_AFC1_AFEM1_AFEM1_ASEM1_CLR1_CADS0_DTVA0_DTVB0_EPS0_FDSI0_GRPM1_GRVWA8_GRVWB8_GSUn1_GSUAMBSK_GSUC1_GSUWGMRR1_GLS0_ISA942_IU1_K1_LBSPPA512_LBSPPB512_LBSPPM0_LPA8_LPB8_LPM0_LRVW8_LWPMn1_MIAV0_MIWT1_1_MO40_NTn1_NTA0_NTB0_NTC0_NTD4_NTM0_NEPBS8_NLCA1_NLCB1_ONLL1_PGR2_PLR1_PKA1_SIA3_SS1_SU16_SUM1_SUS512_SPO0_SRVW0_SSO0_SVW1_SK0_SKXCCM0_TLDS1_ULSGRO0_USL1_UIOFGRO0_USFGROn1_VSn1_VWA1_VWB1_WSGRA0_WSGRB0_WS64_WG32_2_4_WGM1_WGMXCC4_WGMXCCGn1
    SolutionIndex: 26
    SolutionNameMin: Cijk_Alik_Bljk_HSS_BH_Bias_S_HA_S_SAV_UserArgs_MT16x32x256_MI16x16x1_SN_LDSB1_AFC1_AFEM1_AFEM1_ASEM1_CLR1_CADS0_DTVA0_DTVB0_EPS0_FDSI0_GRPM1_GRVWA8_GRVWB8_GSUn1_GSUAMBSK_GSUC1_GSUWGMRR1_GLS0_ISA942_IU1_K1_LBSPPA512_LBSPPB512_LBSPPM0_LPA16_LPB16_LPM0_LRVW8_LWPMn1_MIAV0_MIWT1_1_MO40_NTn1_NTA0_NTB0_NTC0_NTD4_NTM0_NEPBS8_NLCA1_NLCB1_ONLL1_PGR2_PLR1_PKA1_SIA3_SS1_SU16_SUM1_SUS512_SPO0_SRVW0_SSO0_SVW1_SK0_SKXCCM0_TLDS1_ULSGRO0_USL1_UIOFGRO0_USFGROn1_VSn1_VWA1_VWB1_WSGRA0_WSGRB0_WS64_WG16_8_1_WGM1_WGMXCC4_WGMXCCGn1
    SolutionIndex: 27
    SolutionNameMin: Cijk_Alik_Bljk_HSS_BH_Bias_S_HA_S_SAV_UserArgs_MT64x32x128_MI16x16x1_SN_LDSB1_AFC1_AFEM1_AFEM1_ASEM1_CLR1_CADS0_DTVA0_DTVB0_EPS0_FDSI0_GRPM1_GRVWA8_GRVWB8_GSUn1_GSUAMBSK_GSUC1_GSUWGMRR1_GLS0_ISA942_IU1_K1_LBSPPA256_LBSPPB512_LBSPPM0_LPA16_LPB16_LPM0_LRVW8_LWPMn1_MIAV0_MIWT1_2_MO40_NTn1_NTA0_NTB0_NTC0_NTD4_NTM0_NEPBS8_NLCA1_NLCB1_ONLL1_PGR2_PLR1_PKA1_SIA3_SS1_SU16_SUM1_SUS256_SPO0_SRVW0_SSO0_SVW1_SK0_SKXCCM0_TLDS1_ULSGRO0_USL1_UIOFGRO0_USFGROn1_VSn1_VWA1_VWB2_WSGRA0_WSGRB0_WS64_WG64_4_1_WGM1_WGMXCC4_WGMXCCGn1
    SolutionIndex: 28
    SolutionNameMin: Cijk_Alik_Bljk_HSS_BH_Bias_S_HA_S_SAV_UserArgs_MT64x32x128_MI16x16x1_SN_LDSB0_AFC1_AFEM1_AFEM1_ASEM1_CLR1_CADS0_DTVA0_DTVB0_EPS0_FDSI0_GRPM1_GRVWA8_GRVWB8_GSUn1_GSUAMBSK_GSUC1_GSUWGMRR1_GLS0_ISA942_IU1_K1_LBSPPA512_LBSPPB256_LBSPPM0_LPA16_LPB16_LPM0_LRVW8_LWPMn1_MIAV0_MIWT2_1_MO40_NTn1_NTA0_NTB0_NTC0_NTD4_NTM0_NEPBS8_NLCA1_NLCB1_ONLL1_PGR2_PLR1_PKA1_SIA3_SS1_SU16_SUM1_SUS256_SPO0_SRVW0_SSO0_SVW2_SK0_SKXCCM0_TLDS1_ULSGRO0_USL1_UIOFGRO0_USFGROn1_VSn1_VWA2_VWB1_WSGRA0_WSGRB0_WS64_WG32_8_1_WGM1_WGMXCC4_WGMXCCGn1
    SolutionIndex: 29
    SolutionNameMin: Cijk_Alik_Bljk_HSS_BH_Bias_S_HA_S_SAV_UserArgs_MT64x32x256_MI16x16x1_SN_LDSB1_AFC1_AFEM1_AFEM1_ASEM1_CLR1_CADS0_DTVA0_DTVB0_EPS0_FDSI0_GRPM1_GRVWA8_GRVWB8_GSUn1_GSUAMBSK_GSUC1_GSUWGMRR1_GLS0_ISA942_IU1_K1_LBSPPA512_LBSPPB1024_LBSPPM0_LPA16_LPB16_LPM0_LRVW8_LWPMn1_MIAV0_MIWT1_2_MO40_NTn1_NTA0_NTB0_NTC0_NTD4_NTM0_NEPBS8_NLCA1_NLCB1_ONLL1_PGR2_PLR1_PKA1_SIA3_SS1_SU16_SUM1_SUS512_SPO0_SRVW0_SSO0_SVW1_SK0_SKXCCM0_TLDS1_ULSGRO0_USL1_UIOFGRO0_USFGROn1_VSn1_VWA1_VWB2_WSGRA0_WSGRB0_WS64_WG64_4_1_WGM1_WGMXCC4_WGMXCCGn1
    SolutionIndex: 30
    SolutionNameMin: Cijk_Alik_Bljk_HSS_BH_Bias_S_HA_S_SAV_UserArgs_MT64x32x256_MI16x16x1_SN_LDSB1_AFC1_AFEM1_AFEM1_ASEM1_CLR1_CADS0_DTVA0_DTVB0_EPS0_FDSI0_GRPM1_GRVWA8_GRVWB8_GSUn1_GSUAMBSK_GSUC1_GSUWGMRR1_GLS0_ISA942_IU1_K1_LBSPPA1024_LBSPPB1024_LBSPPM0_LPA16_LPB16_LPM0_LRVW8_LWPMn1_MIAV0_MIWT2_2_MO40_NTn1_NTA0_NTB0_NTC0_NTD4_NTM0_NEPBS8_NLCA1_NLCB1_ONLL1_PGR2_PLR1_PKA1_SIA3_SS1_SU16_SUM1_SUS512_SPO0_SRVW0_SSO0_SVW2_SK0_SKXCCM0_TLDS1_ULSGRO0_USL1_UIOFGRO0_USFGROn1_VSn1_VWA2_VWB2_WSGRA0_WSGRB0_WS64_WG32_4_2_WGM1_WGMXCC4_WGMXCCGn1
    SolutionIndex: 31
    SolutionNameMin: Cijk_Alik_Bljk_HSS_BH_Bias_S_HA_S_SAV_UserArgs_MT32x32x256_MI16x16x1_SN_LDSB1_AFC1_AFEM1_AFEM1_ASEM1_CLR1_CADS0_DTVA0_DTVB0_EPS0_FDSI0_GRPM1_GRVWA8_GRVWB8_GSUn1_GSUAMBSK_GSUC1_GSUWGMRR1_GLS0_ISA942_IU1_K1_LBSPPA512_LBSPPB1024_LBSPPM0_LPA16_LPB16_LPM0_LRVW8_LWPMn1_MIAV0_MIWT1_2_MO40_NTn1_NTA0_NTB0_NTC0_NTD4_NTM0_NEPBS8_NLCA1_NLCB1_ONLL1_PGR2_PLR1_PKA1_SIA3_SS1_SU16_SUM1_SUS512_SPO0_SRVW0_SSO0_SVW1_SK0_SKXCCM0_TLDS1_ULSGRO0_USL1_UIOFGRO0_USFGROn1_VSn1_VWA1_VWB2_WSGRA0_WSGRB0_WS64_WG32_4_2_WGM1_WGMXCC4_WGMXCCGn1
    SolutionIndex: 32
    SolutionNameMin: Cijk_Alik_Bljk_HSS_BH_Bias_S_HA_S_SAV_UserArgs_MT64x32x256_MI32x32x1_SN_LDSB1_AFC1_AFEM1_AFEM1_ASEM1_CLR1_CADS0_DTVA0_DTVB0_EPS0_FDSI0_GRPM1_GRVWA8_GRVWB8_GSUn1_GSUAMBSK_GSUC1_GSUWGMRR1_GLS0_ISA942_IU1_K1_LBSPPA512_LBSPPB512_LBSPPM0_LPA8_LPB8_LPM0_LRVW8_LWPMn1_MIAV0_MIWT1_1_MO40_NTn1_NTA0_NTB0_NTC0_NTD4_NTM0_NEPBS8_NLCA1_NLCB1_ONLL1_PGR2_PLR1_PKA1_SIA3_SS1_SU16_SUM1_SUS512_SPO0_SRVW0_SSO0_SVW1_SK0_SKXCCM0_TLDS1_ULSGRO0_USL1_UIOFGRO0_USFGROn1_VSn1_VWA1_VWB1_WSGRA0_WSGRB0_WS64_WG64_2_2_WGM1_WGMXCC4_WGMXCCGn1
    SolutionIndex: 33
    SolutionNameMin: Cijk_Alik_Bljk_HSS_BH_Bias_S_HA_S_SAV_UserArgs_MT64x32x256_MI16x16x1_SN_LDSB1_AFC1_AFEM1_AFEM1_ASEM1_CLR1_CADS0_DTVA0_DTVB0_EPS0_FDSI0_GRPM1_GRVWA8_GRVWB8_GSUn1_GSUAMBSK_GSUC1_GSUWGMRR1_GLS0_ISA942_IU1_K1_LBSPPA1024_LBSPPB512_LBSPPM0_LPA16_LPB16_LPM0_LRVW8_LWPMn1_MIAV0_MIWT2_1_MO40_NTn1_NTA0_NTB0_NTC0_NTD4_NTM0_NEPBS8_NLCA1_NLCB1_ONLL1_PGR2_PLR1_PKA1_SIA3_SS1_SU16_SUM1_SUS512_SPO0_SRVW0_SSO0_SVW2_SK0_SKXCCM0_TLDS1_ULSGRO0_USL1_UIOFGRO0_USFGROn1_VSn1_VWA2_VWB1_WSGRA0_WSGRB0_WS64_WG32_8_1_WGM1_WGMXCC4_WGMXCCGn1
    SolutionIndex: 34
    SolutionNameMin: Cijk_Alik_Bljk_HSS_BH_Bias_S_HA_S_SAV_UserArgs_MT160x32x128_MI16x16x1_SN_LDSB1_AFC1_AFEM1_AFEM1_ASEM1_CLR1_CADS0_DTVA0_DTVB0_EPS0_FDSI0_GRPM1_GRVWA8_GRVWB8_GSUn1_GSUAMBSK_GSUC1_GSUWGMRR1_GLS0_ISA942_IU1_K1_LBSPPA256_LBSPPB256_LBSPPM0_LPA16_LPB16_LPM0_LRVW8_LWPMn1_MIAV0_MIWT5_1_MO40_NTn1_NTA0_NTB0_NTC0_NTD4_NTM0_NEPBS5_NLCA1_NLCB1_ONLL1_PGR2_PLR1_PKA1_SIA3_SS1_SU16_SUM1_SUS256_SPO0_SRVW0_SSO0_SVW1_SK0_SKXCCM0_TLDS1_ULSGRO0_USL1_UIOFGRO0_USFGROn1_VSn1_VWA1_VWB1_WSGRA0_WSGRB0_WS64_WG32_8_1_WGM1_WGMXCC4_WGMXCCGn1
    SolutionIndex: 35
    SolutionNameMin: Cijk_Alik_Bljk_HSS_BH_Bias_S_HA_S_SAV_UserArgs_MT64x32x256_MI16x16x1_SN_LDSB1_AFC1_AFEM1_AFEM1_ASEM1_CLR1_CADS0_DTVA0_DTVB0_EPS0_FDSI0_GRPM1_GRVWA8_GRVWB8_GSUn1_GSUAMBSK_GSUC1_GSUWGMRR1_GLS0_ISA942_IU1_K1_LBSPPA2048_LBSPPB512_LBSPPM0_LPA16_LPB16_LPM0_LRVW8_LWPMn1_MIAV0_MIWT4_1_MO40_NTn1_NTA0_NTB0_NTC0_NTD4_NTM0_NEPBS8_NLCA1_NLCB1_ONLL1_PGR2_PLR1_PKA1_SIA3_SS1_SU16_SUM1_SUS512_SPO0_SRVW0_SSO0_SVW4_SK0_SKXCCM0_TLDS1_ULSGRO0_USL1_UIOFGRO0_USFGROn1_VSn1_VWA4_VWB1_WSGRA0_WSGRB0_WS64_WG16_8_2_WGM1_WGMXCC4_WGMXCCGn1
    SolutionIndex: 36
    SolutionNameMin: Cijk_Alik_Bljk_HSS_BH_Bias_S_HA_S_SAV_UserArgs_MT96x32x128_MI16x16x1_SN_LDSB1_AFC1_AFEM1_AFEM1_ASEM1_CLR1_CADS0_DTVA0_DTVB0_EPS0_FDSI0_GRPM1_GRVWA8_GRVWB8_GSUn1_GSUAMBSK_GSUC1_GSUWGMRR1_GLS0_ISA942_IU1_K1_LBSPPA256_LBSPPB256_LBSPPM0_LPA16_LPB16_LPM0_LRVW8_LWPMn1_MIAV0_MIWT3_1_MO40_NTn1_NTA0_NTB0_NTC0_NTD4_NTM0_NEPBS6_NLCA1_NLCB1_ONLL1_PGR2_PLR1_PKA1_SIA3_SS1_SU16_SUM1_SUS256_SPO0_SRVW0_SSO0_SVW1_SK0_SKXCCM0_TLDS1_ULSGRO0_USL1_UIOFGRO0_USFGROn1_VSn1_VWA1_VWB1_WSGRA0_WSGRB0_WS64_WG32_8_1_WGM1_WGMXCC4_WGMXCCGn1
    SolutionIndex: 37
    SolutionNameMin: Cijk_Alik_Bljk_HSS_BH_Bias_S_HA_S_SAV_UserArgs_MT32x32x128_MI16x16x1_SN_LDSB1_AFC1_AFEM1_AFEM1_ASEM1_CLR1_CADS0_DTVA0_DTVB0_EPS0_FDSI0_GRPM1_GRVWA8_GRVWB8_GSUn1_GSUAMBSK_GSUC1_GSUWGMRR1_GLS0_ISA942_IU1_K1_LBSPPA256_LBSPPB256_LBSPPM0_LPA16_LPB16_LPM0_LRVW8_LWPMn1_MIAV0_MIWT1_1_MO40_NTn1_NTA0_NTB0_NTC0_NTD4_NTM0_NEPBS8_NLCA1_NLCB1_ONLL1_PGR2_PLR1_PKA1_SIA3_SS1_SU16_SUM1_SUS256_SPO0_SRVW0_SSO0_SVW1_SK0_SKXCCM0_TLDS1_ULSGRO0_USL1_UIOFGRO0_USFGROn1_VSn1_VWA1_VWB1_WSGRA0_WSGRB0_WS64_WG32_8_1_WGM1_WGMXCC4_WGMXCCGn1
    SolutionIndex: 38
    SolutionNameMin: Cijk_Alik_Bljk_HSS_BH_Bias_S_HA_S_SAV_UserArgs_MT128x32x128_MI32x32x1_SN_LDSB1_AFC1_AFEM1_AFEM1_ASEM1_CLR1_CADS0_DTVA0_DTVB0_EPS0_FDSI0_GRPM1_GRVWA8_GRVWB8_GSUn1_GSUAMBSK_GSUC1_GSUWGMRR1_GLS0_ISA942_IU1_K1_LBSPPA512_LBSPPB256_LBSPPM0_LPA8_LPB8_LPM0_LRVW8_LWPMn1_MIAV0_MIWT2_1_MO40_NTn1_NTA0_NTB0_NTC0_NTD4_NTM0_NEPBS8_NLCA1_NLCB1_ONLL1_PGR2_PLR1_PKA1_SIA3_SS1_SU16_SUM1_SUS256_SPO0_SRVW0_SSO0_SVW2_SK0_SKXCCM0_TLDS1_ULSGRO0_USL1_UIOFGRO0_USFGROn1_VSn1_VWA2_VWB1_WSGRA0_WSGRB0_WS64_WG64_2_2_WGM1_WGMXCC4_WGMXCCGn1
    SolutionIndex: 39
    SolutionNameMin: Cijk_Alik_Bljk_HSS_BH_Bias_S_HA_S_SAV_UserArgs_MT128x32x128_MI16x16x1_SN_LDSB1_AFC1_AFEM1_AFEM1_ASEM1_CLR1_CADS0_DTVA0_DTVB0_EPS0_FDSI0_GRPM1_GRVWA8_GRVWB8_GSUn1_GSUAMBSK_GSUC1_GSUWGMRR1_GLS0_ISA942_IU1_K1_LBSPPA1024_LBSPPB256_LBSPPM0_LPA16_LPB16_LPM0_LRVW8_LWPMn1_MIAV0_MIWT4_1_MO40_NTn1_NTA0_NTB0_NTC0_NTD4_NTM0_NEPBS8_NLCA1_NLCB1_ONLL1_PGR2_PLR1_PKA1_SIA3_SS1_SU16_SUM1_SUS256_SPO0_SRVW0_SSO0_SVW4_SK0_SKXCCM0_TLDS1_ULSGRO0_USL1_UIOFGRO0_USFGROn1_VSn1_VWA4_VWB1_WSGRA0_WSGRB0_WS64_WG32_8_1_WGM1_WGMXCC4_WGMXCCGn1
    SolutionIndex: 40
    SolutionNameMin: Cijk_Alik_Bljk_HSS_BH_Bias_S_HA_S_SAV_UserArgs_MT128x32x128_MI16x16x1_SN_LDSB1_AFC1_AFEM1_AFEM1_ASEM1_CLR1_CADS0_DTVA0_DTVB0_EPS0_FDSI0_GRPM1_GRVWA8_GRVWB8_GSUn1_GSUAMBSK_GSUC1_GSUWGMRR1_GLS0_ISA942_IU1_K1_LBSPPA512_LBSPPB512_LBSPPM0_LPA16_LPB16_LPM0_LRVW8_LWPMn1_MIAV0_MIWT2_2_MO40_NTn1_NTA0_NTB0_NTC0_NTD4_NTM0_NEPBS8_NLCA1_NLCB1_ONLL1_PGR2_PLR1_PKA1_SIA3_SS1_SU16_SUM1_SUS256_SPO0_SRVW0_SSO0_SVW2_SK0_SKXCCM0_TLDS1_ULSGRO0_USL1_UIOFGRO0_USFGROn1_VSn1_VWA2_VWB2_WSGRA0_WSGRB0_WS64_WG64_4_1_WGM1_WGMXCC4_WGMXCCGn1
    SolutionIndex: 41
    SolutionNameMin: Cijk_Alik_Bljk_HSS_BH_Bias_S_HA_S_SAV_UserArgs_MT192x32x128_MI16x16x1_SN_LDSB1_AFC1_AFEM1_AFEM1_ASEM1_CLR1_CADS0_DTVA0_DTVB0_EPS0_FDSI0_GRPM1_GRVWA8_GRVWB8_GSUn1_GSUAMBSK_GSUC1_GSUWGMRR1_GLS0_ISA942_IU1_K1_LBSPPA256_LBSPPB512_LBSPPM0_LPA16_LPB16_LPM0_LRVW8_LWPMn1_MIAV0_MIWT3_2_MO40_NTn1_NTA0_NTB0_NTC0_NTD4_NTM0_NEPBS6_NLCA1_NLCB1_ONLL1_PGR2_PLR1_PKA1_SIA3_SS1_SU16_SUM1_SUS256_SPO0_SRVW0_SSO0_SVW1_SK0_SKXCCM0_TLDS1_ULSGRO0_USL1_UIOFGRO0_USFGROn1_VSn1_VWA1_VWB2_WSGRA0_WSGRB0_WS64_WG64_4_1_WGM1_WGMXCC4_WGMXCCGn1
    SolutionIndex: 42
    SolutionNameMin: Cijk_Alik_Bljk_HSS_BH_Bias_S_HA_S_SAV_UserArgs_MT192x32x128_MI16x16x1_SN_LDSB1_AFC1_AFEM1_AFEM1_ASEM1_CLR1_CADS0_DTVA0_DTVB0_EPS0_FDSI0_GRPM1_GRVWA8_GRVWB8_GSUn1_GSUAMBSK_GSUC1_GSUWGMRR1_GLS0_ISA942_IU1_K1_LBSPPA512_LBSPPB256_LBSPPM0_LPA16_LPB16_LPM0_LRVW8_LWPMn1_MIAV0_MIWT6_1_MO40_NTn1_NTA0_NTB0_NTC0_NTD4_NTM0_NEPBS6_NLCA1_NLCB1_ONLL1_PGR2_PLR1_PKA1_SIA3_SS1_SU16_SUM1_SUS256_SPO0_SRVW0_SSO0_SVW2_SK0_SKXCCM0_TLDS1_ULSGRO0_USL1_UIOFGRO0_USFGROn1_VSn1_VWA2_VWB1_WSGRA0_WSGRB0_WS64_WG32_8_1_WGM1_WGMXCC4_WGMXCCGn1
    SolutionIndex: 43
    SolutionNameMin: Cijk_Alik_Bljk_HSS_BH_Bias_S_HA_S_SAV_UserArgs_MT128x32x128_MI32x32x1_SN_LDSB1_AFC1_AFEM1_AFEM1_ASEM1_CLR1_CADS0_DTVA0_DTVB0_EPS0_FDSI0_GRPM1_GRVWA8_GRVWB8_GSUn1_GSUAMBSK_GSUC1_GSUWGMRR1_GLS0_ISA942_IU1_K1_LBSPPA256_LBSPPB256_LBSPPM0_LPA8_LPB8_LPM0_LRVW8_LWPMn1_MIAV0_MIWT1_1_MO40_NTn1_NTA0_NTB0_NTC0_NTD4_NTM0_NEPBS8_NLCA1_NLCB1_ONLL1_PGR2_PLR1_PKA1_SIA3_SS1_SU16_SUM1_SUS256_SPO0_SRVW0_SSO0_SVW1_SK0_SKXCCM0_TLDS1_ULSGRO0_USL1_UIOFGRO0_USFGROn1_VSn1_VWA1_VWB1_WSGRA0_WSGRB0_WS64_WG128_2_1_WGM1_WGMXCC4_WGMXCCGn1
    SolutionIndex: 44
    SolutionNameMin: Cijk_Alik_Bljk_HSS_BH_Bias_S_HA_S_SAV_UserArgs_MT64x32x128_MI16x16x1_SN_LDSB1_AFC1_AFEM1_AFEM1_ASEM1_CLR1_CADS0_DTVA0_DTVB0_EPS0_FDSI0_GRPM1_GRVWA8_GRVWB8_GSUn1_GSUAMBSK_GSUC1_GSUWGMRR1_GLS0_ISA942_IU1_K1_LBSPPA512_LBSPPB256_LBSPPM0_LPA16_LPB16_LPM0_LRVW8_LWPMn1_MIAV0_MIWT2_1_MO40_NTn1_NTA0_NTB0_NTC0_NTD4_NTM0_NEPBS8_NLCA1_NLCB1_ONLL1_PGR2_PLR1_PKA1_SIA3_SS1_SU16_SUM1_SUS256_SPO0_SRVW0_SSO0_SVW2_SK0_SKXCCM0_TLDS1_ULSGRO0_USL1_UIOFGRO0_USFGROn1_VSn1_VWA2_VWB1_WSGRA0_WSGRB0_WS64_WG32_8_1_WGM1_WGMXCC4_WGMXCCGn1
    SolutionIndex: 45
    SolutionNameMin: Cijk_Alik_Bljk_HSS_BH_Bias_S_HA_S_SAV_UserArgs_MT64x32x64_MI16x16x1_SN_LDSB1_AFC1_AFEM1_AFEM1_ASEM1_CLR1_CADS0_DTVA0_DTVB0_EPS0_FDSI0_GRPM1_GRVWA8_GRVWB8_GSUn1_GSUAMBSK_GSUC1_GSUWGMRR1_GLS0_ISA942_IU1_K1_LBSPPA256_LBSPPB128_LBSPPM0_LPA16_LPB16_LPM0_LRVW8_LWPMn1_MIAV0_MIWT2_1_MO40_NTn1_NTA0_NTB0_NTC0_NTD4_NTM0_NEPBS8_NLCA1_NLCB1_ONLL1_PGR2_PLR1_PKA1_SIA3_SS1_SU16_SUM1_SUS128_SPO0_SRVW0_SSO0_SVW2_SK0_SKXCCM0_TLDS1_ULSGRO0_USL1_UIOFGRO0_USFGROn1_VSn1_VWA2_VWB1_WSGRA0_WSGRB0_WS64_WG32_8_1_WGM1_WGMXCC4_WGMXCCGn1
    SolutionIndex: 46
    SolutionNameMin: Cijk_Alik_Bljk_HSS_BH_Bias_S_HA_S_SAV_UserArgs_MT192x32x64_MI16x16x1_SN_LDSB1_AFC1_AFEM1_AFEM1_ASEM1_CLR1_CADS0_DTVA0_DTVB0_EPS0_FDSI0_GRPM1_GRVWA8_GRVWB8_GSUn1_GSUAMBSK_GSUC1_GSUWGMRR1_GLS0_ISA942_IU1_K1_LBSPPA256_LBSPPB128_LBSPPM0_LPA16_LPB16_LPM0_LRVW8_LWPMn1_MIAV0_MIWT6_1_MO40_NTn1_NTA0_NTB0_NTC0_NTD4_NTM0_NEPBS6_NLCA1_NLCB1_ONLL1_PGR2_PLR1_PKA1_SIA3_SS1_SU16_SUM1_SUS128_SPO0_SRVW0_SSO0_SVW2_SK0_SKXCCM0_TLDS1_ULSGRO0_USL1_UIOFGRO0_USFGROn1_VSn1_VWA2_VWB1_WSGRA0_WSGRB0_WS64_WG32_8_1_WGM1_WGMXCC4_WGMXCCGn1
    SolutionIndex: 47
    SolutionNameMin: Cijk_Alik_Bljk_HSS_BH_Bias_S_HA_S_SAV_UserArgs_MT128x32x64_MI16x16x1_SN_LDSB1_AFC1_AFEM1_AFEM1_ASEM1_CLR1_CADS0_DTVA0_DTVB0_EPS0_FDSI0_GRPM1_GRVWA8_GRVWB8_GSUn1_GSUAMBSK_GSUC1_GSUWGMRR1_GLS0_ISA942_IU1_K1_LBSPPA256_LBSPPB256_LBSPPM0_LPA16_LPB16_LPM0_LRVW8_LWPMn1_MIAV0_MIWT2_2_MO40_NTn1_NTA0_NTB0_NTC0_NTD4_NTM0_NEPBS8_NLCA1_NLCB1_ONLL1_PGR2_PLR1_PKA1_SIA3_SS1_SU16_SUM1_SUS128_SPO0_SRVW0_SSO0_SVW2_SK0_SKXCCM0_TLDS1_ULSGRO0_USL1_UIOFGRO0_USFGROn1_VSn1_VWA2_VWB2_WSGRA0_WSGRB0_WS64_WG64_4_1_WGM1_WGMXCC4_WGMXCCGn1
    SolutionIndex: 48
    SolutionNameMin: Cijk_Alik_Bljk_HSS_BH_Bias_S_HA_S_SAV_UserArgs_MT288x32x64_MI16x16x1_SN_LDSB1_AFC1_AFEM1_AFEM1_ASEM1_CLR1_CADS0_DTVA0_DTVB0_EPS0_FDSI0_GRPM1_GRVWA8_GRVWB8_GSUn1_GSUAMBSK_GSUC1_GSUWGMRR1_GLS0_ISA942_IU1_K1_LBSPPA128_LBSPPB128_LBSPPM0_LPA16_LPB16_LPM0_LRVW8_LWPMn1_MIAV0_MIWT9_1_MO40_NTn1_NTA0_NTB0_NTC0_NTD4_NTM0_NEPBS8_NLCA1_NLCB1_ONLL1_PGR2_PLR1_PKA1_SIA3_SS1_SU16_SUM1_SUS128_SPO0_SRVW0_SSO0_SVW1_SK0_SKXCCM0_TLDS1_ULSGRO0_USL1_UIOFGRO0_USFGROn1_VSn1_VWA1_VWB1_WSGRA0_WSGRB0_WS64_WG32_8_1_WGM1_WGMXCC4_WGMXCCGn1
    SolutionIndex: 49
    SolutionNameMin: Cijk_Alik_Bljk_HSS_BH_Bias_S_HA_S_SAV_UserArgs_MT128x32x64_MI16x16x1_SN_LDSB1_AFC1_AFEM1_AFEM1_ASEM1_CLR1_CADS0_DTVA0_DTVB0_EPS0_FDSI0_GRPM1_GRVWA8_GRVWB8_GSUn1_GSUAMBSK_GSUC1_GSUWGMRR1_GLS0_ISA942_IU1_K1_LBSPPA512_LBSPPB128_LBSPPM0_LPA16_LPB16_LPM0_LRVW8_LWPMn1_MIAV0_MIWT4_1_MO40_NTn1_NTA0_NTB0_NTC0_NTD4_NTM0_NEPBS8_NLCA1_NLCB1_ONLL1_PGR2_PLR1_PKA1_SIA3_SS1_SU16_SUM1_SUS128_SPO0_SRVW0_SSO0_SVW4_SK0_SKXCCM0_TLDS1_ULSGRO0_USL1_UIOFGRO0_USFGROn1_VSn1_VWA4_VWB1_WSGRA0_WSGRB0_WS64_WG32_8_1_WGM1_WGMXCC4_WGMXCCGn1
    SolutionIndex: 50
    SolutionNameMin: Cijk_Alik_Bljk_HSS_BH_Bias_S_HA_S_SAV_UserArgs_MT32x48x256_MI16x16x1_SN_LDSB1_AFC1_AFEM1_AFEM1_ASEM1_CLR1_CADS0_DTVA0_DTVB0_EPS0_FDSI0_GRPM1_GRVWA8_GRVWB8_GSUn1_GSUAMBSK_GSUC1_GSUWGMRR1_GLS0_ISA942_IU1_K1_LBSPPA512_LBSPPB512_LBSPPM0_LPA16_LPB16_LPM0_LRVW8_LWPMn1_MIAV0_MIWT1_3_MO40_NTn1_NTA0_NTB0_NTC0_NTD4_NTM0_NEPBS8_NLCA1_NLCB1_ONLL1_PGR2_PLR1_PKA1_SIA3_SS1_SU16_SUM1_SUS512_SPO0_SRVW0_SSO0_SVW1_SK0_SKXCCM0_TLDS1_ULSGRO0_USL1_UIOFGRO0_USFGROn1_VSn1_VWA1_VWB1_WSGRA0_WSGRB0_WS64_WG32_4_2_WGM1_WGMXCC4_WGMXCCGn1
    SolutionIndex: 51
    SolutionNameMin: Cijk_Alik_Bljk_HSS_BH_Bias_S_HA_S_SAV_UserArgs_MT64x48x256_MI16x16x1_SN_LDSB1_AFC1_AFEM1_AFEM1_ASEM1_CLR1_CADS0_DTVA0_DTVB0_EPS0_FDSI0_GRPM1_GRVWA8_GRVWB8_GSUn1_GSUAMBSK_GSUC1_GSUWGMRR1_GLS0_ISA942_IU1_K1_LBSPPA1024_LBSPPB512_LBSPPM0_LPA16_LPB16_LPM0_LRVW8_LWPMn1_MIAV0_MIWT2_3_MO40_NTn1_NTA0_NTB0_NTC0_NTD4_NTM0_NEPBS8_NLCA1_NLCB1_ONLL1_PGR2_PLR1_PKA1_SIA3_SS1_SU16_SUM1_SUS512_SPO0_SRVW0_SSO0_SVW2_SK0_SKXCCM0_TLDS1_ULSGRO0_USL1_UIOFGRO0_USFGROn1_VSn1_VWA2_VWB1_WSGRA0_WSGRB0_WS64_WG32_4_2_WGM1_WGMXCC4_WGMXCCGn1
    SolutionIndex: 52
    SolutionNameMin: Cijk_Alik_Bljk_HSS_BH_Bias_S_HA_S_SAV_UserArgs_MT64x48x128_MI16x16x1_SN_LDSB1_AFC1_AFEM1_AFEM1_ASEM1_CLR1_CADS0_DTVA0_DTVB0_EPS0_FDSI0_GRPM1_GRVWA8_GRVWB8_GSUn1_GSUAMBSK_GSUC1_GSUWGMRR1_GLS0_ISA942_IU1_K1_LBSPPA256_LBSPPB256_LBSPPM0_LPA16_LPB16_LPM0_LRVW8_LWPMn1_MIAV0_MIWT1_3_MO40_NTn1_NTA0_NTB0_NTC0_NTD4_NTM0_NEPBS8_NLCA1_NLCB1_ONLL1_PGR2_PLR1_PKA1_SIA3_SS1_SU16_SUM1_SUS256_SPO0_SRVW0_SSO0_SVW1_SK0_SKXCCM0_TLDS1_ULSGRO0_USL1_UIOFGRO0_USFGROn1_VSn1_VWA1_VWB1_WSGRA0_WSGRB0_WS64_WG64_4_1_WGM1_WGMXCC4_WGMXCCGn1
    SolutionIndex: 53
    SolutionNameMin: Cijk_Alik_Bljk_HSS_BH_Bias_S_HA_S_SAV_UserArgs_MT64x48x256_MI16x16x1_SN_LDSB1_AFC1_AFEM1_AFEM1_ASEM1_CLR1_CADS0_DTVA0_DTVB0_EPS0_FDSI0_GRPM1_GRVWA8_GRVWB8_GSUn1_GSUAMBSK_GSUC1_GSUWGMRR1_GLS0_ISA942_IU1_K1_LBSPPA512_LBSPPB512_LBSPPM0_LPA16_LPB16_LPM0_LRVW8_LWPMn1_MIAV0_MIWT1_3_MO40_NTn1_NTA0_NTB0_NTC0_NTD4_NTM0_NEPBS8_NLCA1_NLCB1_ONLL1_PGR2_PLR1_PKA1_SIA3_SS1_SU16_SUM1_SUS512_SPO0_SRVW0_SSO0_SVW1_SK0_SKXCCM0_TLDS1_ULSGRO0_USL1_UIOFGRO0_USFGROn1_VSn1_VWA1_VWB1_WSGRA0_WSGRB0_WS64_WG64_4_1_WGM1_WGMXCC4_WGMXCCGn1
    SolutionIndex: 54
    SolutionNameMin: Cijk_Alik_Bljk_HSS_BH_Bias_S_HA_S_SAV_UserArgs_MT128x48x128_MI16x16x1_SN_LDSB1_AFC1_AFEM1_AFEM1_ASEM1_CLR1_CADS0_DTVA0_DTVB0_EPS0_FDSI0_GRPM1_GRVWA8_GRVWB8_GSUn1_GSUAMBSK_GSUC1_GSUWGMRR1_GLS0_ISA942_IU1_K1_LBSPPA512_LBSPPB256_LBSPPM0_LPA16_LPB16_LPM0_LRVW8_LWPMn1_MIAV0_MIWT2_3_MO40_NTn1_NTA0_NTB0_NTC0_NTD4_NTM0_NEPBS8_NLCA1_NLCB1_ONLL1_PGR2_PLR1_PKA1_SIA3_SS1_SU16_SUM1_SUS256_SPO0_SRVW0_SSO0_SVW2_SK0_SKXCCM0_TLDS1_ULSGRO0_USL1_UIOFGRO0_USFGROn1_VSn1_VWA2_VWB1_WSGRA0_WSGRB0_WS64_WG64_4_1_WGM1_WGMXCC4_WGMXCCGn1
    SolutionIndex: 55
    SolutionNameMin: Cijk_Alik_Bljk_HSS_BH_Bias_S_HA_S_SAV_UserArgs_MT128x48x128_MI16x16x1_SN_LDSB1_AFC1_AFEM1_AFEM1_ASEM1_CLR1_CADS0_DTVA0_DTVB0_EPS0_FDSI0_GRPM1_GRVWA8_GRVWB8_GSUn1_GSUAMBSK_GSUC1_GSUWGMRR1_GLS0_ISA942_IU1_K1_LBSPPA1024_LBSPPB256_LBSPPM0_LPA16_LPB16_LPM0_LRVW8_LWPMn1_MIAV0_MIWT4_3_MO40_NTn1_NTA0_NTB0_NTC0_NTD4_NTM0_NEPBS8_NLCA1_NLCB1_ONLL1_PGR2_PLR1_PKA1_SIA3_SS1_SU16_SUM1_SUS256_SPO0_SRVW0_SSO0_SVW4_SK0_SKXCCM0_TLDS1_ULSGRO0_USL1_UIOFGRO0_USFGROn1_VSn1_VWA4_VWB1_WSGRA0_WSGRB0_WS64_WG32_4_2_WGM1_WGMXCC4_WGMXCCGn1
    SolutionIndex: 56
    SolutionNameMin: Cijk_Alik_Bljk_HSS_BH_Bias_S_HA_S_SAV_UserArgs_MT192x48x128_MI16x16x1_SN_LDSB1_AFC1_AFEM1_AFEM1_ASEM1_CLR1_CADS0_DTVA0_DTVB0_EPS0_FDSI0_GRPM1_GRVWA8_GRVWB8_GSUn1_GSUAMBSK_GSUC1_GSUWGMRR1_GLS0_ISA942_IU1_K1_LBSPPA256_LBSPPB256_LBSPPM0_LPA4_LPB8_LPM0_LRVW8_LWPMn1_MIAV0_MIWT3_3_MO40_NTn1_NTA0_NTB0_NTC0_NTD4_NTM0_NEPBS6_NLCA1_NLCB1_ONLL1_PGR2_PLR1_PKA1_SIA3_SS1_SU16_SUM1_SUS256_SPO0_SRVW0_SSO0_SVW1_SK0_SKXCCM0_TLDS1_ULSGRO0_USL1_UIOFGRO0_USFGROn1_VSn1_VWA1_VWB1_WSGRA0_WSGRB0_WS64_WG64_4_1_WGM1_WGMXCC4_WGMXCCGn1
    SolutionIndex: 57
    SolutionNameMin: Cijk_Alik_Bljk_HSS_BH_Bias_S_HA_S_SAV_UserArgs_MT192x48x128_MI16x16x1_SN_LDSB1_AFC1_AFEM1_AFEM1_ASEM1_CLR1_CADS0_DTVA0_DTVB0_EPS0_FDSI0_GRPM1_GRVWA8_GRVWB8_GSUn1_GSUAMBSK_GSUC1_GSUWGMRR1_GLS0_ISA942_IU1_K1_LBSPPA256_LBSPPB256_LBSPPM0_LPA8_LPB8_LPM0_LRVW8_LWPMn1_MIAV0_MIWT3_3_MO40_NTn1_NTA0_NTB0_NTC0_NTD4_NTM0_NEPBS6_NLCA1_NLCB1_ONLL1_PGR2_PLR1_PKA1_SIA3_SS1_SU16_SUM1_SUS256_SPO0_SRVW0_SSO0_SVW1_SK0_SKXCCM0_TLDS1_ULSGRO0_USL1_UIOFGRO0_USFGROn1_VSn1_VWA1_VWB1_WSGRA0_WSGRB0_WS64_WG64_4_1_WGM1_WGMXCC4_WGMXCCGn1
    SolutionIndex: 58
    SolutionNameMin: Cijk_Alik_Bljk_HSS_BH_Bias_S_HA_S_SAV_UserArgs_MT128x48x64_MI16x16x1_SN_LDSB1_AFC1_AFEM1_AFEM1_ASEM1_CLR1_CADS0_DTVA0_DTVB0_EPS0_FDSI0_GRPM1_GRVWA8_GRVWB4_GSUn1_GSUAMBSK_GSUC1_GSUWGMRR1_GLS0_ISA942_IU1_K1_LBSPPA256_LBSPPB128_LBSPPM0_LPA16_LPB16_LPM0_LRVW8_LWPMn1_MIAV0_MIWT2_3_MO40_NTn1_NTA0_NTB0_NTC0_NTD4_NTM0_NEPBS8_NLCA1_NLCB1_ONLL1_PGR2_PLR1_PKA1_SIA3_SS1_SU16_SUM1_SUS128_SPO0_SRVW0_SSO0_SVW2_SK0_SKXCCM0_TLDS1_ULSGRO0_USL1_UIOFGRO0_USFGROn1_VSn1_VWA2_VWB1_WSGRA0_WSGRB0_WS64_WG64_4_1_WGM1_WGMXCC4_WGMXCCGn1
    SolutionIndex: 59
    SolutionNameMin: Cijk_Alik_Bljk_HSS_BH_Bias_S_HA_S_SAV_UserArgs_MT256x48x64_MI16x16x1_SN_LDSB1_AFC1_AFEM1_AFEM1_ASEM1_CLR1_CADS0_DTVA0_DTVB0_EPS0_FDSI0_GRPM1_GRVWA8_GRVWB4_GSUn1_GSUAMBSK_GSUC1_GSUWGMRR1_GLS0_ISA942_IU1_K1_LBSPPA512_LBSPPB128_LBSPPM0_LPA16_LPB16_LPM0_LRVW8_LWPMn1_MIAV0_MIWT4_3_MO40_NTn1_NTA0_NTB0_NTC0_NTD4_NTM0_NEPBS8_NLCA1_NLCB1_ONLL1_PGR2_PLR1_PKA1_SIA3_SS1_SU16_SUM1_SUS128_SPO0_SRVW0_SSO0_SVW4_SK0_SKXCCM0_TLDS1_ULSGRO0_USL1_UIOFGRO0_USFGROn1_VSn1_VWA4_VWB1_WSGRA0_WSGRB0_WS64_WG64_4_1_WGM1_WGMXCC4_WGMXCCGn1
    SolutionIndex: 60
    SolutionNameMin: Cijk_Alik_Bljk_HSS_BH_Bias_S_HA_S_SAV_UserArgs_MT384x48x64_MI16x16x1_SN_LDSB1_AFC1_AFEM1_AFEM1_ASEM1_CLR1_CADS0_DTVA0_DTVB0_EPS0_FDSI0_GRPM1_GRVWA8_GRVWB4_GSUn1_GSUAMBSK_GSUC1_GSUWGMRR1_GLS0_ISA942_IU1_K1_LBSPPA256_LBSPPB128_LBSPPM0_LPA16_LPB16_LPM0_LRVW8_LWPMn1_MIAV0_MIWT6_3_MO40_NTn1_NTA0_NTB0_NTC0_NTD4_NTM0_NEPBS6_NLCA1_NLCB1_ONLL1_PGR2_PLR1_PKA1_SIA3_SS1_SU16_SUM1_SUS128_SPO0_SRVW0_SSO0_SVW2_SK0_SKXCCM0_TLDS1_ULSGRO0_USL1_UIOFGRO0_USFGROn1_VSn1_VWA2_VWB1_WSGRA0_WSGRB0_WS64_WG64_4_1_WGM1_WGMXCC4_WGMXCCGn1
    SolutionIndex: 61
    SolutionNameMin: Cijk_Alik_Bljk_HSS_BH_Bias_S_HA_S_SAV_UserArgs_MT192x48x64_MI16x16x1_SN_LDSB1_AFC1_AFEM1_AFEM1_ASEM1_CLR1_CADS0_DTVA0_DTVB0_EPS0_FDSI0_GRPM1_GRVWA8_GRVWB4_GSUn1_GSUAMBSK_GSUC1_GSUWGMRR1_GLS0_ISA942_IU1_K1_LBSPPA128_LBSPPB128_LBSPPM0_LPA16_LPB16_LPM0_LRVW8_LWPMn1_MIAV0_MIWT3_3_MO40_NTn1_NTA0_NTB0_NTC0_NTD4_NTM0_NEPBS6_NLCA1_NLCB1_ONLL1_PGR2_PLR1_PKA1_SIA3_SS1_SU16_SUM1_SUS128_SPO0_SRVW0_SSO0_SVW1_SK0_SKXCCM0_TLDS1_ULSGRO0_USL1_UIOFGRO0_USFGROn1_VSn1_VWA1_VWB1_WSGRA0_WSGRB0_WS64_WG64_4_1_WGM1_WGMXCC4_WGMXCCGn1
    SolutionIndex: 62
    SolutionNameMin: Cijk_Alik_Bljk_HSS_BH_Bias_S_HA_S_SAV_UserArgs_MT32x32x128_MI16x16x1_SN_LDSB0_AFC1_AFEM1_AFEM1_ASEM1_CLR1_CADS0_DTVA0_DTVB0_EPS0_FDSI0_GRPM1_GRVWA8_GRVWB8_GSUn1_GSUAMBSK_GSUC1_GSUWGMRR1_GLS0_ISA942_IU1_K1_LBSPPA256_LBSPPB256_LBSPPM0_LPA16_LPB16_LPM0_LRVW8_LWPMn1_MIAV0_MIWT1_1_MO40_NTn1_NTA0_NTB0_NTC0_NTD4_NTM0_NEPBS8_NLCA1_NLCB1_ONLL1_PGR2_PLR1_PKA1_SIA3_SS1_SU16_SUM1_SUS256_SPO0_SRVW0_SSO0_SVW1_SK0_SKXCCM0_TLDS1_ULSGRO0_USL1_UIOFGRO0_USFGROn1_VSn1_VWA1_VWB1_WSGRA0_WSGRB0_WS64_WG32_8_1_WGM1_WGMXCC4_WGMXCCGn1
    SolutionIndex: 63
    SolutionNameMin: Cijk_Alik_Bljk_HSS_BH_Bias_S_HA_S_SAV_UserArgs_MT16x64x256_MI16x16x1_SN_LDSB1_AFC1_AFEM1_AFEM1_ASEM1_CLR1_CADS0_DTVA0_DTVB0_EPS0_FDSI0_GRPM1_GRVWA8_GRVWB8_GSUn1_GSUAMBSK_GSUC1_GSUWGMRR1_GLS0_ISA942_IU1_K1_LBSPPA512_LBSPPB512_LBSPPM0_LPA16_LPB16_LPM0_LRVW8_LWPMn1_MIAV0_MIWT1_1_MO40_NTn1_NTA0_NTB0_NTC0_NTD4_NTM0_NEPBS8_NLCA1_NLCB1_ONLL1_PGR2_PLR1_PKA1_SIA3_SS1_SU16_SUM1_SUS512_SPO0_SRVW0_SSO0_SVW1_SK0_SKXCCM0_TLDS1_ULSGRO0_USL1_UIOFGRO0_USFGROn1_VSn1_VWA1_VWB1_WSGRA0_WSGRB0_WS64_WG16_16_1_WGM1_WGMXCC4_WGMXCCGn1
    SolutionIndex: 64
    SolutionNameMin: Cijk_Alik_Bljk_HSS_BH_Bias_S_HA_S_SAV_UserArgs_MT32x64x256_MI16x16x1_SN_LDSB1_AFC1_AFEM1_AFEM1_ASEM1_CLR1_CADS0_DTVA0_DTVB0_EPS0_FDSI0_GRPM1_GRVWA8_GRVWB8_GSUn1_GSUAMBSK_GSUC1_GSUWGMRR1_GLS0_ISA942_IU1_K1_LBSPPA512_LBSPPB1024_LBSPPM0_LPA16_LPB16_LPM0_LRVW8_LWPMn1_MIAV0_MIWT1_2_MO40_NTn1_NTA0_NTB0_NTC0_NTD4_NTM0_NEPBS8_NLCA1_NLCB1_ONLL1_PGR2_PLR1_PKA1_SIA3_SS1_SU16_SUM1_SUS512_SPO0_SRVW0_SSO0_SVW1_SK0_SKXCCM0_TLDS1_ULSGRO0_USL1_UIOFGRO0_USFGROn1_VSn1_VWA1_VWB2_WSGRA0_WSGRB0_WS64_WG32_8_1_WGM1_WGMXCC4_WGMXCCGn1
    SolutionIndex: 65
    SolutionNameMin: Cijk_Alik_Bljk_HSS_BH_Bias_S_HA_S_SAV_UserArgs_MT32x64x256_MI32x32x1_SN_LDSB1_AFC1_AFEM1_AFEM1_ASEM1_CLR1_CADS0_DTVA0_DTVB0_EPS0_FDSI0_GRPM1_GRVWA8_GRVWB8_GSUn1_GSUAMBSK_GSUC1_GSUWGMRR1_GLS0_ISA942_IU1_K1_LBSPPA512_LBSPPB512_LBSPPM0_LPA8_LPB8_LPM0_LRVW8_LWPMn1_MIAV0_MIWT1_1_MO40_NTn1_NTA0_NTB0_NTC0_NTD4_NTM0_NEPBS8_NLCA1_NLCB1_ONLL1_PGR2_PLR1_PKA1_SIA3_SS1_SU16_SUM1_SUS512_SPO0_SRVW0_SSO0_SVW1_SK0_SKXCCM0_TLDS1_ULSGRO0_USL1_UIOFGRO0_USFGROn1_VSn1_VWA1_VWB1_WSGRA0_WSGRB0_WS64_WG32_4_2_WGM1_WGMXCC4_WGMXCCGn1
    SolutionIndex: 66
    SolutionNameMin: Cijk_Alik_Bljk_HSS_BH_Bias_S_HA_S_SAV_UserArgs_MT64x64x128_MI16x16x1_SN_LDSB1_AFC1_AFEM1_AFEM1_ASEM1_CLR1_CADS0_DTVA0_DTVB0_EPS0_FDSI0_GRPM1_GRVWA8_GRVWB8_GSUn1_GSUAMBSK_GSUC1_GSUWGMRR1_GLS0_ISA942_IU1_K1_LBSPPA512_LBSPPB512_LBSPPM0_LPA16_LPB16_LPM0_LRVW8_LWPMn1_MIAV0_MIWT2_2_MO40_NTn1_NTA0_NTB0_NTC0_NTD4_NTM0_NEPBS8_NLCA1_NLCB1_ONLL1_PGR2_PLR1_PKA1_SIA3_SS1_SU16_SUM1_SUS256_SPO0_SRVW0_SSO0_SVW2_SK0_SKXCCM0_TLDS1_ULSGRO0_USL1_UIOFGRO0_USFGROn1_VSn1_VWA2_VWB2_WSGRA0_WSGRB0_WS64_WG32_8_1_WGM1_WGMXCC4_WGMXCCGn1
    SolutionIndex: 67
    SolutionNameMin: Cijk_Alik_Bljk_HSS_BH_Bias_S_HA_S_SAV_UserArgs_MT64x64x64_MI32x32x1_SN_LDSB0_AFC1_AFEM1_AFEM1_ASEM1_CLR1_CADS0_DTVA0_DTVB0_EPS0_FDSI0_GRPM1_GRVWA8_GRVWB8_GSUn1_GSUAMBSK_GSUC1_GSUWGMRR1_GLS0_ISA942_IU1_K1_LBSPPA128_LBSPPB128_LBSPPM0_LPA8_LPB8_LPM0_LRVW8_LWPMn1_MIAV0_MIWT1_1_MO40_NTn1_NTA0_NTB0_NTC0_NTD4_NTM0_NEPBS8_NLCA1_NLCB1_ONLL1_PGR2_PLR1_PKA1_SIA3_SS1_SU16_SUM1_SUS128_SPO0_SRVW0_SSO0_SVW1_SK0_SKXCCM0_TLDS1_ULSGRO0_USL1_UIOFGRO0_USFGROn1_VSn1_VWA1_VWB1_WSGRA0_WSGRB0_WS64_WG64_4_1_WGM1_WGMXCC4_WGMXCCGn1
    SolutionIndex: 68
    SolutionNameMin: Cijk_Alik_Bljk_HSS_BH_Bias_S_HA_S_SAV_UserArgs_MT64x64x128_MI32x32x1_SN_LDSB1_AFC1_AFEM1_AFEM1_ASEM1_CLR1_CADS0_DTVA0_DTVB0_EPS0_FDSI0_GRPM1_GRVWA8_GRVWB8_GSUn1_GSUAMBSK_GSUC1_GSUWGMRR1_GLS0_ISA942_IU1_K1_LBSPPA256_LBSPPB256_LBSPPM0_LPA8_LPB8_LPM0_LRVW8_LWPMn1_MIAV0_MIWT1_1_MO40_NTn1_NTA0_NTB0_NTC0_NTD4_NTM0_NEPBS8_NLCA1_NLCB1_ONLL1_PGR2_PLR1_PKA1_SIA3_SS1_SU16_SUM1_SUS256_SPO0_SRVW0_SSO0_SVW1_SK0_SKXCCM0_TLDS1_ULSGRO0_USL1_UIOFGRO0_USFGROn1_VSn1_VWA1_VWB1_WSGRA0_WSGRB0_WS64_WG64_4_1_WGM1_WGMXCC4_WGMXCCGn1
    SolutionIndex: 69
    SolutionNameMin: Cijk_Alik_Bljk_HSS_BH_Bias_S_HA_S_SAV_UserArgs_MT64x32x128_MI16x16x1_SN_LDSB0_AFC1_AFEM1_AFEM1_ASEM1_CLR1_CADS0_DTVA0_DTVB0_EPS0_FDSI0_GRPM1_GRVWA8_GRVWB8_GSUn1_GSUAMBSK_GSUC1_GSUWGMRR1_GLS0_ISA942_IU1_K1_LBSPPA256_LBSPPB512_LBSPPM0_LPA16_LPB16_LPM0_LRVW8_LWPMn1_MIAV0_MIWT1_2_MO40_NTn1_NTA0_NTB0_NTC0_NTD4_NTM0_NEPBS8_NLCA1_NLCB1_ONLL1_PGR2_PLR1_PKA1_SIA3_SS1_SU16_SUM1_SUS256_SPO0_SRVW0_SSO0_SVW1_SK0_SKXCCM0_TLDS1_ULSGRO0_USL1_UIOFGRO0_USFGROn1_VSn1_VWA1_VWB2_WSGRA0_WSGRB0_WS64_WG64_4_1_WGM1_WGMXCC4_WGMXCCGn1
    SolutionIndex: 70
    SolutionNameMin: Cijk_Alik_Bljk_HSS_BH_Bias_S_HA_S_SAV_UserArgs_MT96x64x128_MI16x16x1_SN_LDSB1_AFC1_AFEM1_AFEM1_ASEM1_CLR1_CADS0_DTVA0_DTVB0_EPS0_FDSI0_GRPM1_GRVWA8_GRVWB8_GSUn1_GSUAMBSK_GSUC1_GSUWGMRR1_GLS0_ISA942_IU1_K1_LBSPPA256_LBSPPB512_LBSPPM0_LPA16_LPB16_LPM0_LRVW8_LWPMn1_MIAV0_MIWT3_2_MO40_NTn1_NTA0_NTB0_NTC0_NTD4_NTM0_NEPBS6_NLCA1_NLCB1_ONLL1_PGR2_PLR1_PKA1_SIA3_SS1_SU16_SUM1_SUS256_SPO0_SRVW0_SSO0_SVW1_SK0_SKXCCM0_TLDS1_ULSGRO0_USL1_UIOFGRO0_USFGROn1_VSn1_VWA1_VWB2_WSGRA0_WSGRB0_WS64_WG32_8_1_WGM1_WGMXCC4_WGMXCCGn1
    SolutionIndex: 71
    SolutionNameMin: Cijk_Alik_Bljk_HSS_BH_Bias_S_HA_S_SAV_UserArgs_MT128x64x128_MI16x16x1_SN_LDSB1_AFC1_AFEM1_AFEM1_ASEM1_CLR1_CADS0_DTVA0_DTVB0_EPS0_FDSI0_GRPM1_GRVWA8_GRVWB8_GSUn1_GSUAMBSK_GSUC1_GSUWGMRR1_GLS0_ISA942_IU1_K1_LBSPPA1024_LBSPPB512_LBSPPM0_LPA16_LPB16_LPM0_LRVW8_LWPMn1_MIAV0_MIWT4_2_MO40_NTn1_NTA0_NTB0_NTC0_NTD4_NTM0_NEPBS8_NLCA1_NLCB1_ONLL1_PGR2_PLR1_PKA1_SIA3_SS1_SU16_SUM1_SUS256_SPO0_SRVW0_SSO0_SVW4_SK0_SKXCCM0_TLDS1_ULSGRO0_USL1_UIOFGRO0_USFGROn1_VSn1_VWA4_VWB2_WSGRA0_WSGRB0_WS64_WG32_8_1_WGM1_WGMXCC4_WGMXCCGn1
    SolutionIndex: 72
    SolutionNameMin: Cijk_Alik_Bljk_HSS_BH_Bias_S_HA_S_SAV_UserArgs_MT160x64x128_MI16x16x1_SN_LDSB1_AFC1_AFEM1_AFEM1_ASEM1_CLR1_CADS0_DTVA0_DTVB0_EPS0_FDSI0_GRPM1_GRVWA8_GRVWB8_GSUn1_GSUAMBSK_GSUC1_GSUWGMRR1_GLS0_ISA942_IU1_K1_LBSPPA256_LBSPPB512_LBSPPM0_LPA16_LPB16_LPM0_LRVW8_LWPMn1_MIAV0_MIWT5_2_MO40_NTn1_NTA0_NTB0_NTC0_NTD4_NTM0_NEPBS5_NLCA1_NLCB1_ONLL1_PGR2_PLR1_PKA1_SIA3_SS1_SU16_SUM1_SUS256_SPO0_SRVW0_SSO0_SVW1_SK0_SKXCCM0_TLDS1_ULSGRO0_USL1_UIOFGRO0_USFGROn1_VSn1_VWA1_VWB2_WSGRA0_WSGRB0_WS64_WG32_8_1_WGM1_WGMXCC4_WGMXCCGn1
    SolutionIndex: 73
    SolutionNameMin: Cijk_Alik_Bljk_HSS_BH_Bias_S_HA_S_SAV_UserArgs_MT48x64x256_MI16x16x1_SN_LDSB1_AFC1_AFEM1_AFEM1_ASEM1_CLR1_CADS0_DTVA0_DTVB0_EPS0_FDSI0_GRPM1_GRVWA8_GRVWB8_GSUn1_GSUAMBSK_GSUC1_GSUWGMRR1_GLS0_ISA942_IU1_K1_LBSPPA512_LBSPPB512_LBSPPM0_LPA16_LPB16_LPM0_LRVW8_LWPMn1_MIAV0_MIWT3_1_MO40_NTn1_NTA0_NTB0_NTC0_NTD4_NTM0_NEPBS6_NLCA1_NLCB1_ONLL1_PGR2_PLR1_PKA1_SIA3_SS1_SU16_SUM1_SUS512_SPO0_SRVW0_SSO0_SVW1_SK0_SKXCCM0_TLDS1_ULSGRO0_USL1_UIOFGRO0_USFGROn1_VSn1_VWA1_VWB1_WSGRA0_WSGRB0_WS64_WG16_16_1_WGM1_WGMXCC4_WGMXCCGn1
    SolutionIndex: 74
    SolutionNameMin: Cijk_Alik_Bljk_HSS_BH_Bias_S_HA_S_SAV_UserArgs_MT128x64x128_MI32x32x1_SN_LDSB1_AFC1_AFEM1_AFEM1_ASEM1_CLR1_CADS0_DTVA0_DTVB0_EPS0_FDSI0_GRPM1_GRVWA8_GRVWB8_GSUn1_GSUAMBSK_GSUC1_GSUWGMRR1_GLS0_ISA942_IU1_K1_LBSPPA256_LBSPPB512_LBSPPM0_LPA8_LPB8_LPM0_LRVW8_LWPMn1_MIAV0_MIWT1_2_MO40_NTn1_NTA0_NTB0_NTC0_NTD4_NTM0_NEPBS8_NLCA1_NLCB1_ONLL1_PGR2_PLR1_PKA1_SIA3_SS1_SU16_SUM1_SUS256_SPO0_SRVW0_SSO0_SVW1_SK0_SKXCCM0_TLDS1_ULSGRO0_USL1_UIOFGRO0_USFGROn1_VSn1_VWA1_VWB2_WSGRA0_WSGRB0_WS64_WG128_2_1_WGM1_WGMXCC4_WGMXCCGn1
    SolutionIndex: 75
    SolutionNameMin: Cijk_Alik_Bljk_HSS_BH_Bias_S_HA_S_SAV_UserArgs_MT128x64x128_MI32x32x1_SN_LDSB1_AFC1_AFEM1_AFEM1_ASEM1_CLR1_CADS0_DTVA0_DTVB0_EPS0_FDSI0_GRPM1_GRVWA8_GRVWB8_GSUn1_GSUAMBSK_GSUC1_GSUWGMRR1_GLS0_ISA942_IU1_K1_LBSPPA512_LBSPPB256_LBSPPM0_LPA8_LPB8_LPM0_LRVW8_LWPMn1_MIAV0_MIWT2_1_MO40_NTn1_NTA0_NTB0_NTC0_NTD4_NTM0_NEPBS8_NLCA1_NLCB1_ONLL1_PGR2_PLR1_PKA1_SIA3_SS1_SU16_SUM1_SUS256_SPO0_SRVW0_SSO0_SVW2_SK0_SKXCCM0_TLDS1_ULSGRO0_USL1_UIOFGRO0_USFGROn1_VSn1_VWA2_VWB1_WSGRA0_WSGRB0_WS64_WG64_4_1_WGM1_WGMXCC4_WGMXCCGn1
    SolutionIndex: 76
    SolutionNameMin: Cijk_Alik_Bljk_HSS_BH_Bias_S_HA_S_SAV_UserArgs_MT112x64x128_MI16x16x1_SN_LDSB1_AFC1_AFEM1_AFEM1_ASEM1_CLR1_CADS0_DTVA0_DTVB0_EPS0_FDSI0_GRPM1_GRVWA8_GRVWB8_GSUn1_GSUAMBSK_GSUC1_GSUWGMRR1_GLS0_ISA942_IU1_K1_LBSPPA256_LBSPPB256_LBSPPM0_LPA16_LPB16_LPM0_LRVW8_LWPMn1_MIAV0_MIWT7_1_MO40_NTn1_NTA0_NTB0_NTC0_NTD4_NTM0_NEPBS7_NLCA1_NLCB1_ONLL1_PGR2_PLR1_PKA1_SIA3_SS1_SU16_SUM1_SUS256_SPO0_SRVW0_SSO0_SVW1_SK0_SKXCCM0_TLDS1_ULSGRO0_USL1_UIOFGRO0_USFGROn1_VSn1_VWA1_VWB1_WSGRA0_WSGRB0_WS64_WG16_16_1_WGM1_WGMXCC4_WGMXCCGn1
    SolutionIndex: 77
    SolutionNameMin: Cijk_Alik_Bljk_HSS_BH_Bias_S_HA_S_SAV_UserArgs_MT80x64x128_MI16x16x1_SN_LDSB1_AFC1_AFEM1_AFEM1_ASEM1_CLR1_CADS0_DTVA0_DTVB0_EPS0_FDSI0_GRPM1_GRVWA8_GRVWB8_GSUn1_GSUAMBSK_GSUC1_GSUWGMRR1_GLS0_ISA942_IU1_K1_LBSPPA256_LBSPPB256_LBSPPM0_LPA16_LPB16_LPM0_LRVW8_LWPMn1_MIAV0_MIWT5_1_MO40_NTn1_NTA0_NTB0_NTC0_NTD4_NTM0_NEPBS5_NLCA1_NLCB1_ONLL1_PGR2_PLR1_PKA1_SIA3_SS1_SU16_SUM1_SUS256_SPO0_SRVW0_SSO0_SVW1_SK0_SKXCCM0_TLDS1_ULSGRO0_USL1_UIOFGRO0_USFGROn1_VSn1_VWA1_VWB1_WSGRA0_WSGRB0_WS64_WG16_16_1_WGM1_WGMXCC4_WGMXCCGn1
    SolutionIndex: 78
    SolutionNameMin: Cijk_Alik_Bljk_HSS_BH_Bias_S_HA_S_SAV_UserArgs_MT48x64x128_MI16x16x1_SN_LDSB1_AFC1_AFEM1_AFEM1_ASEM1_CLR1_CADS0_DTVA0_DTVB0_EPS0_FDSI0_GRPM1_GRVWA8_GRVWB8_GSUn1_GSUAMBSK_GSUC1_GSUWGMRR1_GLS0_ISA942_IU1_K1_LBSPPA256_LBSPPB256_LBSPPM0_LPA16_LPB16_LPM0_LRVW8_LWPMn1_MIAV0_MIWT3_1_MO40_NTn1_NTA0_NTB0_NTC0_NTD4_NTM0_NEPBS6_NLCA1_NLCB1_ONLL1_PGR2_PLR1_PKA1_SIA3_SS1_SU16_SUM1_SUS256_SPO0_SRVW0_SSO0_SVW1_SK0_SKXCCM0_TLDS1_ULSGRO0_USL1_UIOFGRO0_USFGROn1_VSn1_VWA1_VWB1_WSGRA0_WSGRB0_WS64_WG16_16_1_WGM1_WGMXCC4_WGMXCCGn1
    SolutionIndex: 79
    SolutionNameMin: Cijk_Alik_Bljk_HSS_BH_Bias_S_HA_S_SAV_UserArgs_MT128x64x128_MI16x16x1_SN_LDSB1_AFC1_AFEM1_AFEM1_ASEM1_CLR1_CADS0_DTVA0_DTVB0_EPS0_FDSI0_GRPM1_GRVWA8_GRVWB8_GSUn1_GSUAMBSK_GSUC1_GSUWGMRR1_GLS0_ISA942_IU1_K1_LBSPPA512_LBSPPB1024_LBSPPM0_LPA16_LPB16_LPM0_LRVW8_LWPMn1_MIAV0_MIWT2_4_MO40_NTn1_NTA0_NTB0_NTC0_NTD4_NTM0_NEPBS8_NLCA1_NLCB1_ONLL1_PGR2_PLR1_PKA1_SIA3_SS1_SU16_SUM1_SUS256_SPO0_SRVW0_SSO0_SVW2_SK0_SKXCCM0_TLDS1_ULSGRO0_USL1_UIOFGRO0_USFGROn1_VSn1_VWA2_VWB4_WSGRA0_WSGRB0_WS64_WG64_4_1_WGM1_WGMXCC4_WGMXCCGn1
    SolutionIndex: 80
    SolutionNameMin: Cijk_Alik_Bljk_HSS_BH_Bias_S_HA_S_SAV_UserArgs_MT128x64x64_MI16x16x1_SN_LDSB1_AFC1_AFEM1_AFEM1_ASEM1_CLR1_CADS0_DTVA0_DTVB0_EPS0_FDSI0_GRPM1_GRVWA8_GRVWB8_GSUn1_GSUAMBSK_GSUC1_GSUWGMRR1_GLS0_ISA942_IU1_K1_LBSPPA512_LBSPPB256_LBSPPM0_LPA16_LPB16_LPM0_LRVW8_LWPMn1_MIAV0_MIWT4_2_MO40_NTn1_NTA0_NTB0_NTC0_NTD4_NTM0_NEPBS8_NLCA1_NLCB1_ONLL1_PGR2_PLR1_PKA1_SIA3_SS1_SU16_SUM1_SUS128_SPO0_SRVW0_SSO0_SVW4_SK0_SKXCCM0_TLDS1_ULSGRO0_USL1_UIOFGRO0_USFGROn1_VSn1_VWA4_VWB2_WSGRA0_WSGRB0_WS64_WG32_8_1_WGM1_WGMXCC4_WGMXCCGn1
    SolutionIndex: 81
    SolutionNameMin: Cijk_Alik_Bljk_HSS_BH_Bias_S_HA_S_SAV_UserArgs_MT224x64x64_MI16x16x1_SN_LDSB1_AFC1_AFEM1_AFEM1_ASEM1_CLR1_CADS0_DTVA0_DTVB0_EPS0_FDSI0_GRPM1_GRVWA8_GRVWB8_GSUn1_GSUAMBSK_GSUC1_GSUWGMRR1_GLS0_ISA942_IU1_K1_LBSPPA256_LBSPPB128_LBSPPM0_LPA16_LPB16_LPM0_LRVW8_LWPMn1_MIAV0_MIWT14_1_MO40_NTn1_NTA0_NTB0_NTC0_NTD4_NTM0_NEPBS8_NLCA1_NLCB1_ONLL1_PGR2_PLR1_PKA1_SIA3_SS1_SU16_SUM1_SUS128_SPO0_SRVW0_SSO0_SVW2_SK0_SKXCCM0_TLDS1_ULSGRO0_USL1_UIOFGRO0_USFGROn1_VSn1_VWA2_VWB1_WSGRA0_WSGRB0_WS64_WG16_16_1_WGM1_WGMXCC4_WGMXCCGn1
    SolutionIndex: 82
    SolutionNameMin: Cijk_Alik_Bljk_HSS_BH_Bias_S_HA_S_SAV_UserArgs_MT224x64x64_MI16x16x1_SN_LDSB1_AFC1_AFEM1_AFEM1_ASEM1_CLR1_CADS0_DTVA0_DTVB0_EPS0_FDSI0_GRPM1_GRVWA8_GRVWB8_GSUn1_GSUAMBSK_GSUC1_GSUWGMRR1_GLS0_ISA942_IU1_K1_LBSPPA128_LBSPPB256_LBSPPM0_LPA16_LPB16_LPM0_LRVW8_LWPMn1_MIAV0_MIWT7_2_MO40_NTn1_NTA0_NTB0_NTC0_NTD4_NTM0_NEPBS7_NLCA1_NLCB1_ONLL1_PGR2_PLR1_PKA1_SIA3_SS1_SU16_SUM1_SUS128_SPO0_SRVW0_SSO0_SVW1_SK0_SKXCCM0_TLDS1_ULSGRO0_USL1_UIOFGRO0_USFGROn1_VSn1_VWA1_VWB2_WSGRA0_WSGRB0_WS64_WG32_8_1_WGM1_WGMXCC4_WGMXCCGn1
    SolutionIndex: 83
    SolutionNameMin: Cijk_Alik_Bljk_HSS_BH_Bias_S_HA_S_SAV_UserArgs_MT192x64x64_MI32x32x1_SN_LDSB1_AFC1_AFEM1_AFEM1_ASEM1_CLR1_CADS0_DTVA0_DTVB0_EPS0_FDSI0_GRPM1_GRVWA8_GRVWB8_GSUn1_GSUAMBSK_GSUC1_GSUWGMRR1_GLS0_ISA942_IU1_K1_LBSPPA128_LBSPPB128_LBSPPM0_LPA8_LPB8_LPM0_LRVW8_LWPMn1_MIAV0_MIWT3_1_MO40_NTn1_NTA0_NTB0_NTC0_NTD4_NTM0_NEPBS6_NLCA1_NLCB1_ONLL1_PGR2_PLR1_PKA1_SIA3_SS1_SU16_SUM1_SUS128_SPO0_SRVW0_SSO0_SVW1_SK0_SKXCCM0_TLDS1_ULSGRO0_USL1_UIOFGRO0_USFGROn1_VSn1_VWA1_VWB1_WSGRA0_WSGRB0_WS64_WG64_4_1_WGM1_WGMXCC4_WGMXCCGn1
    SolutionIndex: 84
    SolutionNameMin: Cijk_Alik_Bljk_HSS_BH_Bias_S_HA_S_SAV_UserArgs_MT192x64x64_MI16x16x1_SN_LDSB1_AFC1_AFEM1_AFEM1_ASEM1_CLR1_CADS0_DTVA0_DTVB0_EPS0_FDSI0_GRPM1_GRVWA8_GRVWB8_GSUn1_GSUAMBSK_GSUC1_GSUWGMRR1_GLS0_ISA942_IU1_K1_LBSPPA256_LBSPPB256_LBSPPM0_LPA16_LPB16_LPM0_LRVW8_LWPMn1_MIAV0_MIWT6_2_MO40_NTn1_NTA0_NTB0_NTC0_NTD4_NTM0_NEPBS6_NLCA1_NLCB1_ONLL1_PGR2_PLR1_PKA1_SIA3_SS1_SU16_SUM1_SUS128_SPO0_SRVW0_SSO0_SVW2_SK0_SKXCCM0_TLDS1_ULSGRO0_USL1_UIOFGRO0_USFGROn1_VSn1_VWA2_VWB2_WSGRA0_WSGRB0_WS64_WG32_8_1_WGM1_WGMXCC4_WGMXCCGn1
    SolutionIndex: 85
    SolutionNameMin: Cijk_Alik_Bljk_HSS_BH_Bias_S_HA_S_SAV_UserArgs_MT256x64x64_MI16x16x1_SN_LDSB1_AFC1_AFEM1_AFEM1_ASEM1_CLR1_CADS0_DTVA0_DTVB0_EPS0_FDSI0_GRPM1_GRVWA8_GRVWB8_GSUn1_GSUAMBSK_GSUC1_GSUWGMRR1_GLS0_ISA942_IU1_K1_LBSPPA512_LBSPPB512_LBSPPM0_LPA16_LPB16_LPM0_LRVW8_LWPMn1_MIAV0_MIWT4_4_MO40_NTn1_NTA0_NTB0_NTC0_NTD4_NTM0_NEPBS8_NLCA1_NLCB1_ONLL1_PGR2_PLR1_PKA1_SIA3_SS1_SU16_SUM1_SUS128_SPO0_SRVW0_SSO0_SVW4_SK0_SKXCCM0_TLDS1_ULSGRO0_USL1_UIOFGRO0_USFGROn1_VSn1_VWA4_VWB4_WSGRA0_WSGRB0_WS64_WG64_4_1_WGM1_WGMXCC4_WGMXCCGn1
    SolutionIndex: 86
    SolutionNameMin: Cijk_Alik_Bljk_HSS_BH_Bias_S_HA_S_SAV_UserArgs_MT384x64x64_MI32x32x1_SN_LDSB1_AFC1_AFEM1_AFEM1_ASEM1_CLR1_CADS0_DTVA0_DTVB0_EPS0_FDSI0_GRPM1_GRVWA8_GRVWB8_GSUn1_GSUAMBSK_GSUC1_GSUWGMRR1_GLS0_ISA942_IU1_K1_LBSPPA256_LBSPPB128_LBSPPM0_LPA8_LPB8_LPM0_LRVW8_LWPMn1_MIAV0_MIWT6_1_MO40_NTn1_NTA0_NTB0_NTC0_NTD4_NTM0_NEPBS6_NLCA1_NLCB1_ONLL1_PGR2_PLR1_PKA1_SIA3_SS1_SU16_SUM1_SUS128_SPO0_SRVW0_SSO0_SVW2_SK0_SKXCCM0_TLDS1_ULSGRO0_USL1_UIOFGRO0_USFGROn1_VSn1_VWA2_VWB1_WSGRA0_WSGRB0_WS64_WG64_4_1_WGM1_WGMXCC4_WGMXCCGn1
    SolutionIndex: 87
    SolutionNameMin: Cijk_Alik_Bljk_HSS_BH_Bias_S_HA_S_SAV_UserArgs_MT288x64x64_MI16x16x1_SN_LDSB1_AFC1_AFEM1_AFEM1_ASEM1_CLR1_CADS0_DTVA0_DTVB0_EPS0_FDSI0_GRPM1_GRVWA8_GRVWB8_GSUn1_GSUAMBSK_GSUC1_GSUWGMRR1_GLS0_ISA942_IU1_K1_LBSPPA128_LBSPPB256_LBSPPM0_LPA16_LPB16_LPM0_LRVW8_LWPMn1_MIAV0_MIWT9_2_MO40_NTn1_NTA0_NTB0_NTC0_NTD4_NTM0_NEPBS8_NLCA1_NLCB1_ONLL1_PGR2_PLR1_PKA1_SIA3_SS1_SU16_SUM1_SUS128_SPO0_SRVW0_SSO0_SVW1_SK0_SKXCCM0_TLDS1_ULSGRO0_USL1_UIOFGRO0_USFGROn1_VSn1_VWA1_VWB2_WSGRA0_WSGRB0_WS64_WG32_8_1_WGM1_WGMXCC4_WGMXCCGn1
    SolutionIndex: 88
    SolutionNameMin: Cijk_Alik_Bljk_HSS_BH_Bias_S_HA_S_SAV_UserArgs_MT384x64x64_MI16x16x1_SN_LDSB1_AFC1_AFEM1_AFEM1_ASEM1_CLR1_CADS0_DTVA0_DTVB0_EPS0_FDSI0_GRPM1_GRVWA8_GRVWB8_GSUn1_GSUAMBSK_GSUC1_GSUWGMRR1_GLS0_ISA942_IU1_K1_LBSPPA512_LBSPPB256_LBSPPM0_LPA16_LPB16_LPM0_LRVW8_LWPMn1_MIAV0_MIWT12_2_MO40_NTn1_NTA0_NTB0_NTC0_NTD4_NTM0_NEPBS8_NLCA1_NLCB1_ONLL1_PGR2_PLR1_PKA1_SIA3_SS1_SU16_SUM1_SUS128_SPO0_SRVW0_SSO0_SVW4_SK0_SKXCCM0_TLDS1_ULSGRO0_USL1_UIOFGRO0_USFGROn1_VSn1_VWA4_VWB2_WSGRA0_WSGRB0_WS64_WG32_8_1_WGM1_WGMXCC4_WGMXCCGn1
    SolutionIndex: 89
    SolutionNameMin: Cijk_Alik_Bljk_HSS_BH_Bias_S_HA_S_SAV_UserArgs_MT192x64x64_MI16x16x1_SN_LDSB1_AFC1_AFEM1_AFEM1_ASEM1_CLR1_CADS0_DTVA0_DTVB0_EPS0_FDSI0_GRPM1_GRVWA8_GRVWB8_GSUn1_GSUAMBSK_GSUC1_GSUWGMRR1_GLS0_ISA942_IU1_K1_LBSPPA128_LBSPPB512_LBSPPM0_LPA16_LPB16_LPM0_LRVW8_LWPMn1_MIAV0_MIWT3_4_MO40_NTn1_NTA0_NTB0_NTC0_NTD4_NTM0_NEPBS6_NLCA1_NLCB1_ONLL1_PGR2_PLR1_PKA1_SIA3_SS1_SU16_SUM1_SUS128_SPO0_SRVW0_SSO0_SVW1_SK0_SKXCCM0_TLDS1_ULSGRO0_USL1_UIOFGRO0_USFGROn1_VSn1_VWA1_VWB4_WSGRA0_WSGRB0_WS64_WG64_4_1_WGM1_WGMXCC4_WGMXCCGn1
    SolutionIndex: 90
    SolutionNameMin: Cijk_Alik_Bljk_HSS_BH_Bias_S_HA_S_SAV_UserArgs_MT128x64x64_MI16x16x1_SN_LDSB1_AFC1_AFEM1_AFEM1_ASEM1_CLR1_CADS0_DTVA0_DTVB0_EPS0_FDSI0_GRPM1_GRVWA8_GRVWB8_GSUn1_GSUAMBSK_GSUC1_GSUWGMRR1_GLS0_ISA942_IU1_K1_LBSPPA512_LBSPPB256_LBSPPM0_LPA16_LPB16_LPM0_LRVW8_LWPMn1_MIAV0_MIWT4_2_MO40_NTn1_NTA0_NTB0_NTC0_NTD4_NTM0_NEPBS8_NLCA1_NLCB1_ONLL1_PGR2_PLR1_PKA1_SIA3_SS1_SU16_SUM1_SUS128_SPO0_SRVW0_SSO4_SVW4_SK0_SKXCCM0_TLDS1_ULSGRO0_USL1_UIOFGRO0_USFGROn1_VSn1_VWA4_VWB2_WSGRA0_WSGRB0_WS64_WG32_8_1_WGM1_WGMXCC4_WGMXCCGn1
    SolutionIndex: 91
    SolutionNameMin: Cijk_Alik_Bljk_HSS_BH_Bias_S_HA_S_SAV_UserArgs_MT256x64x64_MI16x16x1_SN_LDSB1_AFC1_AFEM1_AFEM1_ASEM1_CLR1_CADS0_DTVA0_DTVB0_EPS0_FDSI0_GRPM1_GRVWA8_GRVWB8_GSUn1_GSUAMBSK_GSUC1_GSUWGMRR1_GLS0_ISA942_IU1_K1_LBSPPA512_LBSPPB512_LBSPPM0_LPA16_LPB16_LPM0_LRVW8_LWPMn1_MIAV0_MIWT4_4_MO40_NTn1_NTA0_NTB0_NTC0_NTD4_NTM0_NEPBS8_NLCA1_NLCB1_ONLL1_PGR2_PLR1_PKA1_SIA3_SS1_SU16_SUM1_SUS128_SPO0_SRVW0_SSO4_SVW4_SK0_SKXCCM0_TLDS1_ULSGRO0_USL1_UIOFGRO0_USFGROn1_VSn1_VWA4_VWB4_WSGRA0_WSGRB0_WS64_WG64_4_1_WGM1_WGMXCC4_WGMXCCGn1
    SolutionIndex: 92
    SolutionNameMin: Cijk_Alik_Bljk_HSS_BH_Bias_S_HA_S_SAV_UserArgs_MT384x64x64_MI16x16x1_SN_LDSB1_AFC1_AFEM1_AFEM1_ASEM1_CLR1_CADS0_DTVA0_DTVB0_EPS0_FDSI0_GRPM1_GRVWA8_GRVWB8_GSUn1_GSUAMBSK_GSUC1_GSUWGMRR1_GLS0_ISA942_IU1_K1_LBSPPA512_LBSPPB256_LBSPPM0_LPA16_LPB16_LPM0_LRVW8_LWPMn1_MIAV0_MIWT12_2_MO40_NTn1_NTA0_NTB0_NTC0_NTD4_NTM0_NEPBS8_NLCA1_NLCB1_ONLL1_PGR2_PLR1_PKA1_SIA3_SS1_SU16_SUM1_SUS128_SPO0_SRVW0_SSO4_SVW4_SK0_SKXCCM0_TLDS1_ULSGRO0_USL1_UIOFGRO0_USFGROn1_VSn1_VWA4_VWB2_WSGRA0_WSGRB0_WS64_WG32_8_1_WGM1_WGMXCC4_WGMXCCGn1
    SolutionIndex: 93
    SolutionNameMin: Cijk_Alik_Bljk_HSS_BH_Bias_S_HA_S_SAV_UserArgs_MT64x48x128_MI16x16x1_SN_LDSB0_AFC1_AFEM1_AFEM1_ASEM1_CLR1_CADS0_DTVA0_DTVB0_EPS0_FDSI0_GRPM1_GRVWA8_GRVWB8_GSUn1_GSUAMBSK_GSUC1_GSUWGMRR1_GLS0_ISA942_IU1_K1_LBSPPA256_LBSPPB256_LBSPPM0_LPA16_LPB16_LPM0_LRVW8_LWPMn1_MIAV0_MIWT1_3_MO40_NTn1_NTA0_NTB0_NTC0_NTD4_NTM0_NEPBS8_NLCA1_NLCB1_ONLL1_PGR2_PLR1_PKA1_SIA3_SS1_SU16_SUM1_SUS256_SPO0_SRVW0_SSO0_SVW1_SK0_SKXCCM0_TLDS1_ULSGRO0_USL1_UIOFGRO0_USFGROn1_VSn1_VWA1_VWB1_WSGRA0_WSGRB0_WS64_WG64_4_1_WGM1_WGMXCC4_WGMXCCGn1
    SolutionIndex: 94
    SolutionNameMin: Cijk_Alik_Bljk_HSS_BH_Bias_S_HA_S_SAV_UserArgs_MT64x80x128_MI16x16x1_SN_LDSB1_AFC1_AFEM1_AFEM1_ASEM1_CLR1_CADS0_DTVA0_DTVB0_EPS0_FDSI0_GRPM1_GRVWA8_GRVWB8_GSUn1_GSUAMBSK_GSUC1_GSUWGMRR1_GLS0_ISA942_IU1_K1_LBSPPA256_LBSPPB256_LBSPPM0_LPA16_LPB16_LPM0_LRVW8_LWPMn1_MIAV0_MIWT1_5_MO40_NTn1_NTA0_NTB0_NTC0_NTD4_NTM0_NEPBS8_NLCA1_NLCB1_ONLL1_PGR2_PLR1_PKA1_SIA3_SS1_SU16_SUM1_SUS256_SPO0_SRVW0_SSO0_SVW1_SK0_SKXCCM0_TLDS1_ULSGRO0_USL1_UIOFGRO0_USFGROn1_VSn1_VWA1_VWB1_WSGRA0_WSGRB0_WS64_WG64_4_1_WGM1_WGMXCC4_WGMXCCGn1
    SolutionIndex: 95
    SolutionNameMin: Cijk_Alik_Bljk_HSS_BH_Bias_S_HA_S_SAV_UserArgs_MT16x32x512_MI16x16x1_SN_LDSB1_AFC1_AFEM1_AFEM1_ASEM1_CLR1_CADS0_DTVA0_DTVB0_EPS0_FDSI0_GRPM1_GRVWA8_GRVWB8_GSUn1_GSUAMBSK_GSUC1_GSUWGMRR1_GLS0_ISA942_IU1_K1_LBSPPA1024_LBSPPB1024_LBSPPM0_LPA16_LPB16_LPM0_LRVW8_LWPMn1_MIAV0_MIWT1_1_MO40_NTn1_NTA0_NTB0_NTC0_NTD4_NTM0_NEPBS8_NLCA1_NLCB1_ONLL1_PGR2_PLR1_PKA1_SIA3_SS1_SU16_SUM1_SUS1024_SPO0_SRVW0_SSO0_SVW1_SK0_SKXCCM0_TLDS1_ULSGRO0_USL1_UIOFGRO0_USFGROn1_VSn1_VWA1_VWB1_WSGRA0_WSGRB0_WS64_WG16_8_1_WGM1_WGMXCC4_WGMXCCGn1
    SolutionIndex: 96
    SolutionNameMin: Cijk_Alik_Bljk_HSS_BH_Bias_S_HA_S_SAV_UserArgs_MT64x80x128_MI16x16x1_SN_LDSB1_AFC1_AFEM1_AFEM1_ASEM1_CLR1_CADS0_DTVA0_DTVB0_EPS0_FDSI0_GRPM1_GRVWA8_GRVWB8_GSUn1_GSUAMBSK_GSUC1_GSUWGMRR1_GLS0_ISA942_IU1_K1_LBSPPA512_LBSPPB256_LBSPPM0_LPA16_LPB16_LPM0_LRVW8_LWPMn1_MIAV0_MIWT2_5_MO40_NTn1_NTA0_NTB0_NTC0_NTD4_NTM0_NEPBS8_NLCA1_NLCB1_ONLL1_PGR2_PLR1_PKA1_SIA3_SS1_SU16_SUM1_SUS256_SPO0_SRVW0_SSO0_SVW2_SK0_SKXCCM0_TLDS1_ULSGRO0_USL1_UIOFGRO0_USFGROn1_VSn1_VWA2_VWB1_WSGRA0_WSGRB0_WS64_WG32_4_2_WGM1_WGMXCC4_WGMXCCGn1
    SolutionIndex: 97
    SolutionNameMin: Cijk_Alik_Bljk_HSS_BH_Bias_S_HA_S_SAV_UserArgs_MT128x80x128_MI16x16x1_SN_LDSB1_AFC1_AFEM1_AFEM1_ASEM1_CLR1_CADS0_DTVA0_DTVB0_EPS0_FDSI0_GRPM1_GRVWA8_GRVWB8_GSUn1_GSUAMBSK_GSUC1_GSUWGMRR1_GLS0_ISA942_IU1_K1_LBSPPA512_LBSPPB256_LBSPPM0_LPA16_LPB16_LPM0_LRVW8_LWPMn1_MIAV0_MIWT2_5_MO40_NTn1_NTA0_NTB0_NTC0_NTD4_NTM0_NEPBS8_NLCA1_NLCB1_ONLL1_PGR2_PLR1_PKA1_SIA3_SS1_SU16_SUM1_SUS256_SPO0_SRVW0_SSO0_SVW2_SK0_SKXCCM0_TLDS1_ULSGRO0_USL1_UIOFGRO0_USFGROn1_VSn1_VWA2_VWB1_WSGRA0_WSGRB0_WS64_WG64_4_1_WGM1_WGMXCC4_WGMXCCGn1
    SolutionIndex: 98
    SolutionNameMin: Cijk_Alik_Bljk_HSS_BH_Bias_S_HA_S_SAV_UserArgs_MT64x16x128_MI16x16x1_SN_LDSB0_AFC1_AFEM1_AFEM1_ASEM1_CLR1_CADS0_DTVA0_DTVB0_EPS0_FDSI0_GRPM1_GRVWA8_GRVWB8_GSUn1_GSUAMBSK_GSUC1_GSUWGMRR1_GLS0_ISA942_IU1_K1_LBSPPA256_LBSPPB256_LBSPPM0_LPA16_LPB16_LPM0_LRVW8_LWPMn1_MIAV0_MIWT1_1_MO40_NTn1_NTA0_NTB0_NTC0_NTD4_NTM0_NEPBS8_NLCA1_NLCB1_ONLL1_PGR2_PLR1_PKA1_SIA3_SS1_SU16_SUM1_SUS256_SPO0_SRVW0_SSO0_SVW1_SK0_SKXCCM0_TLDS1_ULSGRO0_USL1_UIOFGRO0_USFGROn1_VSn1_VWA1_VWB1_WSGRA0_WSGRB0_WS64_WG64_4_1_WGM1_WGMXCC4_WGMXCCGn1
    SolutionIndex: 99
    SolutionNameMin: Cijk_Alik_Bljk_HSS_BH_Bias_S_HA_S_SAV_UserArgs_MT256x80x64_MI16x16x1_SN_LDSB1_AFC1_AFEM1_AFEM1_ASEM1_CLR1_CADS0_DTVA0_DTVB0_EPS0_FDSI0_GRPM1_GRVWA8_GRVWB4_GSUn1_GSUAMBSK_GSUC1_GSUWGMRR1_GLS0_ISA942_IU1_K1_LBSPPA512_LBSPPB128_LBSPPM0_LPA16_LPB16_LPM0_LRVW8_LWPMn1_MIAV0_MIWT4_5_MO40_NTn1_NTA0_NTB0_NTC0_NTD4_NTM0_NEPBS8_NLCA1_NLCB1_ONLL1_PGR2_PLR1_PKA1_SIA3_SS1_SU16_SUM1_SUS128_SPO0_SRVW0_SSO0_SVW4_SK0_SKXCCM0_TLDS1_ULSGRO0_USL1_UIOFGRO0_USFGROn1_VSn1_VWA4_VWB1_WSGRA0_WSGRB0_WS64_WG64_4_1_WGM1_WGMXCC4_WGMXCCGn1
    SolutionIndex: 100
    SolutionNameMin: Cijk_Alik_Bljk_HSS_BH_Bias_S_HA_S_SAV_UserArgs_MT192x80x64_MI16x16x1_SN_LDSB1_AFC1_AFEM1_AFEM1_ASEM1_CLR1_CADS0_DTVA0_DTVB0_EPS0_FDSI0_GRPM1_GRVWA8_GRVWB4_GSUn1_GSUAMBSK_GSUC1_GSUWGMRR1_GLS0_ISA942_IU1_K1_LBSPPA128_LBSPPB128_LBSPPM0_LPA16_LPB16_LPM0_LRVW8_LWPMn1_MIAV0_MIWT3_5_MO40_NTn1_NTA0_NTB0_NTC0_NTD4_NTM0_NEPBS6_NLCA1_NLCB1_ONLL1_PGR2_PLR1_PKA1_SIA3_SS1_SU16_SUM1_SUS128_SPO0_SRVW0_SSO0_SVW1_SK0_SKXCCM0_TLDS1_ULSGRO0_USL1_UIOFGRO0_USFGROn1_VSn1_VWA1_VWB1_WSGRA0_WSGRB0_WS64_WG64_4_1_WGM1_WGMXCC4_WGMXCCGn1
    SolutionIndex: 101
    SolutionNameMin: Cijk_Alik_Bljk_HSS_BH_Bias_S_HA_S_SAV_UserArgs_MT320x80x64_MI16x16x1_SN_LDSB1_AFC1_AFEM1_AFEM1_ASEM1_CLR1_CADS0_DTVA0_DTVB0_EPS0_FDSI0_GRPM1_GRVWA8_GRVWB4_GSUn1_GSUAMBSK_GSUC1_GSUWGMRR1_GLS0_ISA942_IU1_K1_LBSPPA128_LBSPPB128_LBSPPM0_LPA16_LPB16_LPM0_LRVW8_LWPMn1_MIAV0_MIWT5_5_MO40_NTn1_NTA0_NTB0_NTC0_NTD4_NTM0_NEPBS5_NLCA1_NLCB1_ONLL1_PGR2_PLR1_PKA1_SIA3_SS1_SU16_SUM1_SUS128_SPO0_SRVW0_SSO0_SVW1_SK0_SKXCCM0_TLDS1_ULSGRO0_USL1_UIOFGRO0_USFGROn1_VSn1_VWA1_VWB1_WSGRA0_WSGRB0_WS64_WG64_4_1_WGM1_WGMXCC4_WGMXCCGn1
    SolutionIndex: 102
    SolutionNameMin: Cijk_Alik_Bljk_HSS_BH_Bias_S_HA_S_SAV_UserArgs_MT384x80x64_MI16x16x1_SN_LDSB1_AFC1_AFEM1_AFEM1_ASEM1_CLR1_CADS0_DTVA0_DTVB0_EPS0_FDSI0_GRPM1_GRVWA8_GRVWB4_GSUn1_GSUAMBSK_GSUC1_GSUWGMRR1_GLS0_ISA942_IU1_K1_LBSPPA256_LBSPPB128_LBSPPM0_LPA4_LPB4_LPM0_LRVW8_LWPMn1_MIAV0_MIWT6_5_MO40_NTn1_NTA0_NTB0_NTC0_NTD4_NTM0_NEPBS6_NLCA1_NLCB1_ONLL1_PGR2_PLR1_PKA1_SIA3_SS1_SU16_SUM1_SUS128_SPO0_SRVW0_SSO0_SVW2_SK0_SKXCCM0_TLDS1_ULSGRO0_USL1_UIOFGRO0_USFGROn1_VSn1_VWA2_VWB1_WSGRA0_WSGRB0_WS64_WG64_4_1_WGM1_WGMXCC4_WGMXCCGn1
    SolutionIndex: 103
    SolutionNameMin: Cijk_Alik_Bljk_HSS_BH_Bias_S_HA_S_SAV_UserArgs_MT128x80x64_MI16x16x1_SN_LDSB1_AFC1_AFEM1_AFEM1_ASEM1_CLR1_CADS0_DTVA0_DTVB0_EPS0_FDSI0_GRPM1_GRVWA8_GRVWB4_GSUn1_GSUAMBSK_GSUC1_GSUWGMRR1_GLS0_ISA942_IU1_K1_LBSPPA256_LBSPPB128_LBSPPM0_LPA16_LPB16_LPM0_LRVW8_LWPMn1_MIAV0_MIWT2_5_MO40_NTn1_NTA0_NTB0_NTC0_NTD4_NTM0_NEPBS8_NLCA1_NLCB1_ONLL1_PGR2_PLR1_PKA1_SIA3_SS1_SU16_SUM1_SUS128_SPO0_SRVW0_SSO0_SVW2_SK0_SKXCCM0_TLDS1_ULSGRO0_USL1_UIOFGRO0_USFGROn1_VSn1_VWA2_VWB1_WSGRA0_WSGRB0_WS64_WG64_4_1_WGM1_WGMXCC4_WGMXCCGn1
    SolutionIndex: 104
    SolutionNameMin: Cijk_Alik_Bljk_HSS_BH_Bias_S_HA_S_SAV_UserArgs_MT256x80x64_MI16x16x1_SN_LDSB1_AFC1_AFEM1_AFEM1_ASEM1_CLR1_CADS0_DTVA0_DTVB0_EPS0_FDSI0_GRPM1_GRVWA8_GRVWB4_GSUn1_GSUAMBSK_GSUC1_GSUWGMRR1_GLS0_ISA942_IU1_K1_LBSPPA512_LBSPPB128_LBSPPM0_LPA16_LPB16_LPM0_LRVW8_LWPMn1_MIAV0_MIWT4_5_MO40_NTn1_NTA0_NTB0_NTC0_NTD4_NTM0_NEPBS8_NLCA1_NLCB1_ONLL1_PGR2_PLR1_PKA1_SIA3_SS1_SU16_SUM1_SUS128_SPO0_SRVW0_SSO4_SVW4_SK0_SKXCCM0_TLDS1_ULSGRO0_USL1_UIOFGRO0_USFGROn1_VSn1_VWA4_VWB1_WSGRA0_WSGRB0_WS64_WG64_4_1_WGM1_WGMXCC4_WGMXCCGn1
    SolutionIndex: 105
    SolutionNameMin: Cijk_Alik_Bljk_HSS_BH_Bias_S_HA_S_SAV_UserArgs_MT384x80x64_MI16x16x1_SN_LDSB1_AFC1_AFEM1_AFEM1_ASEM1_CLR1_CADS0_DTVA0_DTVB0_EPS0_FDSI0_GRPM1_GRVWA8_GRVWB4_GSUn1_GSUAMBSK_GSUC1_GSUWGMRR1_GLS0_ISA942_IU1_K1_LBSPPA256_LBSPPB128_LBSPPM0_LPA4_LPB4_LPM0_LRVW8_LWPMn1_MIAV0_MIWT6_5_MO40_NTn1_NTA0_NTB0_NTC0_NTD4_NTM0_NEPBS6_NLCA1_NLCB1_ONLL1_PGR2_PLR1_PKA1_SIA3_SS1_SU16_SUM1_SUS128_SPO0_SRVW0_SSO4_SVW2_SK0_SKXCCM0_TLDS1_ULSGRO0_USL1_UIOFGRO0_USFGROn1_VSn1_VWA2_VWB1_WSGRA0_WSGRB0_WS64_WG64_4_1_WGM1_WGMXCC4_WGMXCCGn1
    SolutionIndex: 106
    SolutionNameMin: Cijk_Alik_Bljk_HSS_BH_Bias_S_HA_S_SAV_UserArgs_MT16x32x256_MI16x16x1_SN_LDSB0_AFC1_AFEM1_AFEM1_ASEM1_CLR1_CADS0_DTVA0_DTVB0_EPS0_FDSI0_GRPM1_GRVWA8_GRVWB8_GSUn1_GSUAMBSK_GSUC1_GSUWGMRR1_GLS0_ISA942_IU1_K1_LBSPPA512_LBSPPB512_LBSPPM0_LPA16_LPB16_LPM0_LRVW8_LWPMn1_MIAV0_MIWT1_1_MO40_NTn1_NTA0_NTB0_NTC0_NTD4_NTM0_NEPBS8_NLCA1_NLCB1_ONLL1_PGR2_PLR1_PKA1_SIA3_SS1_SU16_SUM1_SUS512_SPO0_SRVW0_SSO0_SVW1_SK0_SKXCCM0_TLDS1_ULSGRO0_USL1_UIOFGRO0_USFGROn1_VSn1_VWA1_VWB1_WSGRA0_WSGRB0_WS64_WG16_8_1_WGM1_WGMXCC4_WGMXCCGn1
    SolutionIndex: 107
    SolutionNameMin: Cijk_Alik_Bljk_HSS_BH_Bias_S_HA_S_SAV_UserArgs_MT32x96x128_MI16x16x1_SN_LDSB1_AFC1_AFEM1_AFEM1_ASEM1_CLR1_CADS0_DTVA0_DTVB0_EPS0_FDSI0_GRPM1_GRVWA8_GRVWB8_GSUn1_GSUAMBSK_GSUC1_GSUWGMRR1_GLS0_ISA942_IU1_K1_LBSPPA256_LBSPPB256_LBSPPM0_LPA16_LPB16_LPM0_LRVW8_LWPMn1_MIAV0_MIWT1_3_MO40_NTn1_NTA0_NTB0_NTC0_NTD4_NTM0_NEPBS8_NLCA1_NLCB1_ONLL1_PGR2_PLR1_PKA1_SIA3_SS1_SU16_SUM1_SUS256_SPO0_SRVW0_SSO0_SVW1_SK0_SKXCCM0_TLDS1_ULSGRO0_USL1_UIOFGRO0_USFGROn1_VSn1_VWA1_VWB1_WSGRA0_WSGRB0_WS64_WG32_8_1_WGM1_WGMXCC4_WGMXCCGn1
    SolutionIndex: 108
    SolutionNameMin: Cijk_Alik_Bljk_HSS_BH_Bias_S_HA_S_SAV_UserArgs_MT96x96x128_MI16x16x1_SN_LDSB1_AFC1_AFEM1_AFEM1_ASEM1_CLR1_CADS0_DTVA0_DTVB0_EPS0_FDSI0_GRPM1_GRVWA8_GRVWB8_GSUn1_GSUAMBSK_GSUC1_GSUWGMRR1_GLS0_ISA942_IU1_K1_LBSPPA256_LBSPPB256_LBSPPM0_LPA16_LPB16_LPM0_LRVW8_LWPMn1_MIAV0_MIWT3_3_MO40_NTn1_NTA0_NTB0_NTC0_NTD4_NTM0_NEPBS6_NLCA1_NLCB1_ONLL1_PGR2_PLR1_PKA1_SIA3_SS1_SU16_SUM1_SUS256_SPO0_SRVW0_SSO0_SVW1_SK0_SKXCCM0_TLDS1_ULSGRO0_USL1_UIOFGRO0_USFGROn1_VSn1_VWA1_VWB1_WSGRA0_WSGRB0_WS64_WG32_8_1_WGM1_WGMXCC4_WGMXCCGn1
    SolutionIndex: 109
    SolutionNameMin: Cijk_Alik_Bljk_HSS_BH_Bias_S_HA_S_SAV_UserArgs_MT64x96x128_MI16x16x1_SN_LDSB1_AFC1_AFEM1_AFEM1_ASEM1_CLR1_CADS0_DTVA0_DTVB0_EPS0_FDSI0_GRPM1_GRVWA8_GRVWB8_GSUn1_GSUAMBSK_GSUC1_GSUWGMRR1_GLS0_ISA942_IU1_K1_LBSPPA1024_LBSPPB256_LBSPPM0_LPA16_LPB16_LPM0_LRVW8_LWPMn1_MIAV0_MIWT4_3_MO40_NTn1_NTA0_NTB0_NTC0_NTD4_NTM0_NEPBS8_NLCA1_NLCB1_ONLL1_PGR2_PLR1_PKA1_SIA3_SS1_SU16_SUM1_SUS256_SPO0_SRVW0_SSO0_SVW4_SK0_SKXCCM0_TLDS1_ULSGRO0_USL1_UIOFGRO0_USFGROn1_VSn1_VWA4_VWB1_WSGRA0_WSGRB0_WS64_WG16_8_2_WGM1_WGMXCC4_WGMXCCGn1
    SolutionIndex: 110
    SolutionNameMin: Cijk_Alik_Bljk_HSS_BH_Bias_S_HA_S_SAV_UserArgs_MT64x96x128_MI16x16x1_SN_LDSB1_AFC1_AFEM1_AFEM1_ASEM1_CLR1_CADS0_DTVA0_DTVB0_EPS0_FDSI0_GRPM1_GRVWA8_GRVWB8_GSUn1_GSUAMBSK_GSUC1_GSUWGMRR1_GLS0_ISA942_IU1_K1_LBSPPA512_LBSPPB256_LBSPPM0_LPA16_LPB16_LPM0_LRVW8_LWPMn1_MIAV0_MIWT2_3_MO40_NTn1_NTA0_NTB0_NTC0_NTD4_NTM0_NEPBS8_NLCA1_NLCB1_ONLL1_PGR2_PLR1_PKA1_SIA3_SS1_SU16_SUM1_SUS256_SPO0_SRVW0_SSO0_SVW2_SK0_SKXCCM0_TLDS1_ULSGRO0_USL1_UIOFGRO0_USFGROn1_VSn1_VWA2_VWB1_WSGRA0_WSGRB0_WS64_WG32_8_1_WGM1_WGMXCC4_WGMXCCGn1
    SolutionIndex: 111
    SolutionNameMin: Cijk_Alik_Bljk_HSS_BH_Bias_S_HA_S_SAV_UserArgs_MT128x96x128_MI16x16x1_SN_LDSB1_AFC1_AFEM1_AFEM1_ASEM1_CLR1_CADS0_DTVA0_DTVB0_EPS0_FDSI0_GRPM1_GRVWA8_GRVWB8_GSUn1_GSUAMBSK_GSUC1_GSUWGMRR1_GLS0_ISA942_IU1_K1_LBSPPA1024_LBSPPB256_LBSPPM0_LPA16_LPB16_LPM0_LRVW8_LWPMn1_MIAV0_MIWT4_3_MO40_NTn1_NTA0_NTB0_NTC0_NTD4_NTM0_NEPBS8_NLCA1_NLCB1_ONLL1_PGR2_PLR1_PKA1_SIA3_SS1_SU16_SUM1_SUS256_SPO0_SRVW0_SSO0_SVW4_SK0_SKXCCM0_TLDS1_ULSGRO0_USL1_UIOFGRO0_USFGROn1_VSn1_VWA4_VWB1_WSGRA0_WSGRB0_WS64_WG32_8_1_WGM1_WGMXCC4_WGMXCCGn1
    SolutionIndex: 112
    SolutionNameMin: Cijk_Alik_Bljk_HSS_BH_Bias_S_HA_S_SAV_UserArgs_MT128x96x128_MI16x16x1_SN_LDSB1_AFC1_AFEM1_AFEM1_ASEM1_CLR1_CADS0_DTVA0_DTVB0_EPS0_FDSI0_GRPM1_GRVWA8_GRVWB8_GSUn1_GSUAMBSK_GSUC1_GSUWGMRR1_GLS0_ISA942_IU1_K1_LBSPPA512_LBSPPB512_LBSPPM0_LPA16_LPB16_LPM0_LRVW8_LWPMn1_MIAV0_MIWT2_6_MO40_NTn1_NTA0_NTB0_NTC0_NTD4_NTM0_NEPBS8_NLCA1_NLCB1_ONLL1_PGR2_PLR1_PKA1_SIA3_SS1_SU16_SUM1_SUS256_SPO0_SRVW0_SSO0_SVW2_SK0_SKXCCM0_TLDS1_ULSGRO0_USL1_UIOFGRO0_USFGROn1_VSn1_VWA2_VWB2_WSGRA0_WSGRB0_WS64_WG64_4_1_WGM1_WGMXCC4_WGMXCCGn1
    SolutionIndex: 113
    SolutionNameMin: Cijk_Alik_Bljk_HSS_BH_Bias_S_HA_S_SAV_UserArgs_MT288x96x64_MI16x16x1_SN_LDSB1_AFC1_AFEM1_AFEM1_ASEM1_CLR1_CADS0_DTVA0_DTVB0_EPS0_FDSI0_GRPM1_GRVWA8_GRVWB8_GSUn1_GSUAMBSK_GSUC1_GSUWGMRR1_GLS0_ISA942_IU1_K1_LBSPPA128_LBSPPB128_LBSPPM0_LPA16_LPB16_LPM0_LRVW8_LWPMn1_MIAV0_MIWT9_3_MO40_NTn1_NTA0_NTB0_NTC0_NTD4_NTM0_NEPBS8_NLCA1_NLCB1_ONLL1_PGR2_PLR1_PKA1_SIA3_SS1_SU16_SUM1_SUS128_SPO0_SRVW0_SSO0_SVW1_SK0_SKXCCM0_TLDS1_ULSGRO0_USL1_UIOFGRO0_USFGROn1_VSn1_VWA1_VWB1_WSGRA0_WSGRB0_WS64_WG32_8_1_WGM1_WGMXCC4_WGMXCCGn1
    SolutionIndex: 114
    SolutionNameMin: Cijk_Alik_Bljk_HSS_BH_Bias_S_HA_S_SAV_UserArgs_MT160x96x64_MI16x16x1_SN_LDSB1_AFC1_AFEM1_AFEM1_ASEM1_CLR1_CADS0_DTVA0_DTVB0_EPS0_FDSI0_GRPM1_GRVWA8_GRVWB8_GSUn1_GSUAMBSK_GSUC1_GSUWGMRR1_GLS0_ISA942_IU1_K1_LBSPPA128_LBSPPB128_LBSPPM0_LPA16_LPB16_LPM0_LRVW8_LWPMn1_MIAV0_MIWT5_3_MO40_NTn1_NTA0_NTB0_NTC0_NTD4_NTM0_NEPBS5_NLCA1_NLCB1_ONLL1_PGR2_PLR1_PKA1_SIA3_SS1_SU16_SUM1_SUS128_SPO0_SRVW0_SSO0_SVW1_SK0_SKXCCM0_TLDS1_ULSGRO0_USL1_UIOFGRO0_USFGROn1_VSn1_VWA1_VWB1_WSGRA0_WSGRB0_WS64_WG32_8_1_WGM1_WGMXCC4_WGMXCCGn1
    SolutionIndex: 115
    SolutionNameMin: Cijk_Alik_Bljk_HSS_BH_Bias_S_HA_S_SAV_UserArgs_MT320x96x64_MI16x16x1_SN_LDSB1_AFC1_AFEM1_AFEM1_ASEM1_CLR1_CADS0_DTVA0_DTVB0_EPS0_FDSI0_GRPM1_GRVWA8_GRVWB8_GSUn1_GSUAMBSK_GSUC1_GSUWGMRR1_GLS0_ISA942_IU1_K1_LBSPPA128_LBSPPB256_LBSPPM0_LPA16_LPB16_LPM0_LRVW8_LWPMn1_MIAV0_MIWT5_6_MO40_NTn1_NTA0_NTB0_NTC0_NTD4_NTM0_NEPBS5_NLCA1_NLCB1_ONLL1_PGR2_PLR1_PKA1_SIA3_SS1_SU16_SUM1_SUS128_SPO0_SRVW0_SSO0_SVW1_SK0_SKXCCM0_TLDS1_ULSGRO0_USL1_UIOFGRO0_USFGROn1_VSn1_VWA1_VWB2_WSGRA0_WSGRB0_WS64_WG64_4_1_WGM1_WGMXCC4_WGMXCCGn1
    SolutionIndex: 116
    SolutionNameMin: Cijk_Alik_Bljk_HSS_BH_Bias_S_HA_S_SAV_UserArgs_MT96x96x64_MI16x16x1_SN_LDSB1_AFC1_AFEM1_AFEM1_ASEM1_CLR1_CADS0_DTVA0_DTVB0_EPS0_FDSI0_GRPM1_GRVWA8_GRVWB8_GSUn1_GSUAMBSK_GSUC1_GSUWGMRR1_GLS0_ISA942_IU1_K1_LBSPPA128_LBSPPB128_LBSPPM0_LPA16_LPB16_LPM0_LRVW8_LWPMn1_MIAV0_MIWT3_3_MO40_NTn1_NTA0_NTB0_NTC0_NTD4_NTM0_NEPBS6_NLCA1_NLCB1_ONLL1_PGR2_PLR1_PKA1_SIA3_SS1_SU16_SUM1_SUS128_SPO0_SRVW0_SSO0_SVW1_SK0_SKXCCM0_TLDS1_ULSGRO0_USL1_UIOFGRO0_USFGROn1_VSn1_VWA1_VWB1_WSGRA0_WSGRB0_WS64_WG32_8_1_WGM1_WGMXCC4_WGMXCCGn1
    SolutionIndex: 117
    SolutionNameMin: Cijk_Alik_Bljk_HSS_BH_Bias_S_HA_S_SAV_UserArgs_MT128x96x64_MI16x16x1_SN_LDSB1_AFC1_AFEM1_AFEM1_ASEM1_CLR1_CADS0_DTVA0_DTVB0_EPS0_FDSI0_GRPM1_GRVWA8_GRVWB8_GSUn1_GSUAMBSK_GSUC1_GSUWGMRR1_GLS0_ISA942_IU1_K1_LBSPPA512_LBSPPB128_LBSPPM0_LPA16_LPB16_LPM0_LRVW8_LWPMn1_MIAV0_MIWT4_3_MO40_NTn1_NTA0_NTB0_NTC0_NTD4_NTM0_NEPBS8_NLCA1_NLCB1_ONLL1_PGR2_PLR1_PKA1_SIA3_SS1_SU16_SUM1_SUS128_SPO0_SRVW0_SSO0_SVW4_SK0_SKXCCM0_TLDS1_ULSGRO0_USL1_UIOFGRO0_USFGROn1_VSn1_VWA4_VWB1_WSGRA0_WSGRB0_WS64_WG32_8_1_WGM1_WGMXCC4_WGMXCCGn1
    SolutionIndex: 118
    SolutionNameMin: Cijk_Alik_Bljk_HSS_BH_Bias_S_HA_S_SAV_UserArgs_MT224x96x64_MI16x16x1_SN_LDSB1_AFC1_AFEM1_AFEM1_ASEM1_CLR1_CADS0_DTVA0_DTVB0_EPS0_FDSI0_GRPM1_GRVWA8_GRVWB8_GSUn1_GSUAMBSK_GSUC1_GSUWGMRR1_GLS0_ISA942_IU1_K1_LBSPPA128_LBSPPB128_LBSPPM0_LPA16_LPB16_LPM0_LRVW8_LWPMn1_MIAV0_MIWT7_3_MO40_NTn1_NTA0_NTB0_NTC0_NTD4_NTM0_NEPBS7_NLCA1_NLCB1_ONLL1_PGR2_PLR1_PKA1_SIA3_SS1_SU16_SUM1_SUS128_SPO0_SRVW0_SSO0_SVW1_SK0_SKXCCM0_TLDS1_ULSGRO0_USL1_UIOFGRO0_USFGROn1_VSn1_VWA1_VWB1_WSGRA0_WSGRB0_WS64_WG32_8_1_WGM1_WGMXCC4_WGMXCCGn1
    SolutionIndex: 119
    SolutionNameMin: Cijk_Alik_Bljk_HSS_BH_Bias_S_HA_S_SAV_UserArgs_MT192x96x64_MI16x16x1_SN_LDSB1_AFC1_AFEM1_AFEM1_ASEM1_CLR1_CADS0_DTVA0_DTVB0_EPS0_FDSI0_GRPM1_GRVWA8_GRVWB8_GSUn1_GSUAMBSK_GSUC1_GSUWGMRR1_GLS0_ISA942_IU1_K1_LBSPPA256_LBSPPB128_LBSPPM0_LPA16_LPB16_LPM0_LRVW8_LWPMn1_MIAV0_MIWT6_3_MO40_NTn1_NTA0_NTB0_NTC0_NTD4_NTM0_NEPBS6_NLCA1_NLCB1_ONLL1_PGR2_PLR1_PKA1_SIA3_SS1_SU16_SUM1_SUS128_SPO0_SRVW0_SSO0_SVW2_SK0_SKXCCM0_TLDS1_ULSGRO0_USL1_UIOFGRO0_USFGROn1_VSn1_VWA2_VWB1_WSGRA0_WSGRB0_WS64_WG32_8_1_WGM1_WGMXCC4_WGMXCCGn1
    SolutionIndex: 120
    SolutionNameMin: Cijk_Alik_Bljk_HSS_BH_Bias_S_HA_S_SAV_UserArgs_MT256x96x64_MI16x16x1_SN_LDSB1_AFC1_AFEM1_AFEM1_ASEM1_CLR1_CADS0_DTVA0_DTVB0_EPS0_FDSI0_GRPM1_GRVWA8_GRVWB8_GSUn1_GSUAMBSK_GSUC1_GSUWGMRR1_GLS0_ISA942_IU1_K1_LBSPPA512_LBSPPB256_LBSPPM0_LPA16_LPB16_LPM0_LRVW8_LWPMn1_MIAV0_MIWT4_6_MO40_NTn1_NTA0_NTB0_NTC0_NTD4_NTM0_NEPBS8_NLCA1_NLCB1_ONLL1_PGR2_PLR1_PKA1_SIA3_SS1_SU16_SUM1_SUS128_SPO0_SRVW0_SSO0_SVW4_SK0_SKXCCM0_TLDS1_ULSGRO0_USL1_UIOFGRO0_USFGROn1_VSn1_VWA4_VWB2_WSGRA0_WSGRB0_WS64_WG64_4_1_WGM1_WGMXCC4_WGMXCCGn1
    SolutionIndex: 121
    SolutionNameMin: Cijk_Alik_Bljk_HSS_BH_Bias_S_HA_S_SAV_UserArgs_MT384x96x64_MI16x16x1_SN_LDSB1_AFC1_AFEM1_AFEM1_ASEM1_CLR1_CADS0_DTVA0_DTVB0_EPS0_FDSI0_GRPM1_GRVWA8_GRVWB8_GSUn1_GSUAMBSK_GSUC1_GSUWGMRR1_GLS0_ISA942_IU1_K1_LBSPPA512_LBSPPB128_LBSPPM0_LPA4_LPB8_LPM0_LRVW8_LWPMn1_MIAV0_MIWT12_3_MO40_NTn1_NTA0_NTB0_NTC0_NTD4_NTM0_NEPBS8_NLCA1_NLCB1_ONLL1_PGR2_PLR1_PKA1_SIA3_SS1_SU16_SUM1_SUS128_SPO0_SRVW0_SSO0_SVW4_SK0_SKXCCM0_TLDS1_ULSGRO0_USL1_UIOFGRO0_USFGROn1_VSn1_VWA4_VWB1_WSGRA0_WSGRB0_WS64_WG32_8_1_WGM1_WGMXCC4_WGMXCCGn1
    SolutionIndex: 122
    SolutionNameMin: Cijk_Alik_Bljk_HSS_BH_Bias_S_HA_S_SAV_UserArgs_MT256x96x64_MI16x16x1_SN_LDSB1_AFC1_AFEM1_AFEM1_ASEM1_CLR1_CADS0_DTVA0_DTVB0_EPS0_FDSI0_GRPM1_GRVWA8_GRVWB8_GSUn1_GSUAMBSK_GSUC1_GSUWGMRR1_GLS0_ISA942_IU1_K1_LBSPPA512_LBSPPB256_LBSPPM0_LPA16_LPB16_LPM0_LRVW8_LWPMn1_MIAV0_MIWT4_6_MO40_NTn1_NTA0_NTB0_NTC0_NTD4_NTM0_NEPBS8_NLCA1_NLCB1_ONLL1_PGR2_PLR1_PKA1_SIA3_SS1_SU16_SUM1_SUS128_SPO0_SRVW0_SSO4_SVW4_SK0_SKXCCM0_TLDS1_ULSGRO0_USL1_UIOFGRO0_USFGROn1_VSn1_VWA4_VWB2_WSGRA0_WSGRB0_WS64_WG64_4_1_WGM1_WGMXCC4_WGMXCCGn1
    SolutionIndex: 123
    SolutionNameMin: Cijk_Alik_Bljk_HSS_BH_Bias_S_HA_S_SAV_UserArgs_MT192x96x64_MI16x16x1_SN_LDSB1_AFC1_AFEM1_AFEM1_ASEM1_CLR1_CADS0_DTVA0_DTVB0_EPS0_FDSI0_GRPM1_GRVWA8_GRVWB8_GSUn1_GSUAMBSK_GSUC1_GSUWGMRR1_GLS0_ISA942_IU1_K1_LBSPPA256_LBSPPB128_LBSPPM0_LPA16_LPB16_LPM0_LRVW8_LWPMn1_MIAV0_MIWT6_3_MO40_NTn1_NTA0_NTB0_NTC0_NTD4_NTM0_NEPBS6_NLCA1_NLCB1_ONLL1_PGR2_PLR1_PKA1_SIA3_SS1_SU16_SUM1_SUS128_SPO0_SRVW0_SSO4_SVW2_SK0_SKXCCM0_TLDS1_ULSGRO0_USL1_UIOFGRO0_USFGROn1_VSn1_VWA2_VWB1_WSGRA0_WSGRB0_WS64_WG32_8_1_WGM1_WGMXCC4_WGMXCCGn1
    SolutionIndex: 124
    SolutionNameMin: Cijk_Alik_Bljk_HSS_BH_Bias_S_HA_S_SAV_UserArgs_MT384x96x64_MI16x16x1_SN_LDSB1_AFC1_AFEM1_AFEM1_ASEM1_CLR1_CADS0_DTVA0_DTVB0_EPS0_FDSI0_GRPM1_GRVWA8_GRVWB8_GSUn1_GSUAMBSK_GSUC1_GSUWGMRR1_GLS0_ISA942_IU1_K1_LBSPPA512_LBSPPB128_LBSPPM0_LPA4_LPB8_LPM0_LRVW8_LWPMn1_MIAV0_MIWT12_3_MO40_NTn1_NTA0_NTB0_NTC0_NTD4_NTM0_NEPBS8_NLCA1_NLCB1_ONLL1_PGR2_PLR1_PKA1_SIA3_SS1_SU16_SUM1_SUS128_SPO0_SRVW0_SSO4_SVW4_SK0_SKXCCM0_TLDS1_ULSGRO0_USL1_UIOFGRO0_USFGROn1_VSn1_VWA4_VWB1_WSGRA0_WSGRB0_WS64_WG32_8_1_WGM1_WGMXCC4_WGMXCCGn1
    SolutionIndex: 125
    SolutionNameMin: Cijk_Alik_Bljk_HSS_BH_Bias_S_HA_S_SAV_UserArgs_MT288x96x64_MI16x16x1_SN_LDSB1_AFC1_AFEM1_AFEM1_ASEM1_CLR1_CADS0_DTVA0_DTVB0_EPS0_FDSI0_GRPM1_GRVWA8_GRVWB8_GSUn1_GSUAMBSK_GSUC1_GSUWGMRR1_GLS0_ISA942_IU1_K1_LBSPPA128_LBSPPB128_LBSPPM0_LPA16_LPB16_LPM0_LRVW8_LWPMn1_MIAV0_MIWT9_3_MO40_NTn1_NTA0_NTB0_NTC0_NTD4_NTM0_NEPBS8_NLCA1_NLCB1_ONLL1_PGR2_PLR1_PKA1_SIA3_SS1_SU16_SUM1_SUS128_SPO0_SRVW0_SSO4_SVW1_SK0_SKXCCM0_TLDS1_ULSGRO0_USL1_UIOFGRO0_USFGROn1_VSn1_VWA1_VWB1_WSGRA0_WSGRB0_WS64_WG32_8_1_WGM1_WGMXCC4_WGMXCCGn1
    SolutionIndex: 126
    SolutionNameMin: Cijk_Alik_Bljk_HSS_BH_Bias_S_HA_S_SAV_UserArgs_MT320x96x64_MI16x16x1_SN_LDSB1_AFC1_AFEM1_AFEM1_ASEM1_CLR1_CADS0_DTVA0_DTVB0_EPS0_FDSI0_GRPM1_GRVWA8_GRVWB8_GSUn1_GSUAMBSK_GSUC1_GSUWGMRR1_GLS0_ISA942_IU1_K1_LBSPPA256_LBSPPB128_LBSPPM0_LPA16_LPB16_LPM0_LRVW8_LWPMn1_MIAV0_MIWT10_3_MO40_NTn1_NTA0_NTB0_NTC0_NTD4_NTM0_NEPBS8_NLCA1_NLCB1_ONLL1_PGR2_PLR1_PKA1_SIA3_SS1_SU16_SUM1_SUS128_SPO0_SRVW0_SSO4_SVW2_SK0_SKXCCM0_TLDS1_ULSGRO0_USL1_UIOFGRO0_USFGROn1_VSn1_VWA2_VWB1_WSGRA0_WSGRB0_WS64_WG32_8_1_WGM1_WGMXCC4_WGMXCCGn1
    SolutionIndex: 127
    SolutionNameMin: Cijk_Alik_Bljk_HSS_BH_Bias_S_HA_S_SAV_UserArgs_MT48x64x128_MI16x16x1_SN_LDSB0_AFC1_AFEM1_AFEM1_ASEM1_CLR1_CADS0_DTVA0_DTVB0_EPS0_FDSI0_GRPM1_GRVWA8_GRVWB8_GSUn1_GSUAMBSK_GSUC1_GSUWGMRR1_GLS0_ISA942_IU1_K1_LBSPPA256_LBSPPB256_LBSPPM0_LPA16_LPB16_LPM0_LRVW8_LWPMn1_MIAV0_MIWT3_1_MO40_NTn1_NTA0_NTB0_NTC0_NTD4_NTM0_NEPBS6_NLCA1_NLCB1_ONLL1_PGR2_PLR1_PKA1_SIA3_SS1_SU16_SUM1_SUS256_SPO0_SRVW0_SSO0_SVW1_SK0_SKXCCM0_TLDS1_ULSGRO0_USL1_UIOFGRO0_USFGROn1_VSn1_VWA1_VWB1_WSGRA0_WSGRB0_WS64_WG16_16_1_WGM1_WGMXCC4_WGMXCCGn1
    SolutionIndex: 128
    SolutionNameMin: Cijk_Alik_Bljk_HSS_BH_Bias_S_HA_S_SAV_UserArgs_MT64x112x128_MI16x16x1_SN_LDSB1_AFC1_AFEM1_AFEM1_ASEM1_CLR1_CADS0_DTVA0_DTVB0_EPS0_FDSI0_GRPM1_GRVWA8_GRVWB8_GSUn1_GSUAMBSK_GSUC1_GSUWGMRR1_GLS0_ISA942_IU1_K1_LBSPPA512_LBSPPB256_LBSPPM0_LPA16_LPB16_LPM0_LRVW8_LWPMn1_MIAV0_MIWT2_7_MO40_NTn1_NTA0_NTB0_NTC0_NTD4_NTM0_NEPBS8_NLCA1_NLCB1_ONLL1_PGR2_PLR1_PKA1_SIA3_SS1_SU16_SUM1_SUS256_SPO0_SRVW0_SSO0_SVW2_SK0_SKXCCM0_TLDS1_ULSGRO0_USL1_UIOFGRO0_USFGROn1_VSn1_VWA2_VWB1_WSGRA0_WSGRB0_WS64_WG32_4_2_WGM1_WGMXCC4_WGMXCCGn1
    SolutionIndex: 129
    SolutionNameMin: Cijk_Alik_Bljk_HSS_BH_Bias_S_HA_S_SAV_UserArgs_MT64x64x64_MI16x16x1_SN_LDSB0_AFC1_AFEM1_AFEM1_ASEM1_CLR1_CADS0_DTVA0_DTVB0_EPS0_FDSI0_GRPM1_GRVWA8_GRVWB8_GSUn1_GSUAMBSK_GSUC1_GSUWGMRR1_GLS0_ISA942_IU1_K1_LBSPPA256_LBSPPB256_LBSPPM0_LPA16_LPB16_LPM0_LRVW8_LWPMn1_MIAV0_MIWT2_2_MO40_NTn1_NTA0_NTB0_NTC0_NTD4_NTM0_NEPBS8_NLCA1_NLCB1_ONLL1_PGR2_PLR1_PKA1_SIA3_SS1_SU16_SUM1_SUS128_SPO0_SRVW0_SSO0_SVW2_SK0_SKXCCM0_TLDS1_ULSGRO0_USL1_UIOFGRO0_USFGROn1_VSn1_VWA2_VWB2_WSGRA0_WSGRB0_WS64_WG32_8_1_WGM1_WGMXCC4_WGMXCCGn1
    SolutionIndex: 130
    SolutionNameMin: Cijk_Alik_Bljk_HSS_BH_Bias_S_HA_S_SAV_UserArgs_MT64x112x128_MI16x16x1_SN_LDSB1_AFC1_AFEM1_AFEM1_ASEM1_CLR1_CADS0_DTVA0_DTVB0_EPS0_FDSI0_GRPM1_GRVWA8_GRVWB8_GSUn1_GSUAMBSK_GSUC1_GSUWGMRR1_GLS0_ISA942_IU1_K1_LBSPPA256_LBSPPB256_LBSPPM0_LPA16_LPB16_LPM0_LRVW8_LWPMn1_MIAV0_MIWT1_7_MO40_NTn1_NTA0_NTB0_NTC0_NTD4_NTM0_NEPBS8_NLCA1_NLCB1_ONLL1_PGR2_PLR1_PKA1_SIA3_SS1_SU16_SUM1_SUS256_SPO0_SRVW0_SSO0_SVW1_SK0_SKXCCM0_TLDS1_ULSGRO0_USL1_UIOFGRO0_USFGROn1_VSn1_VWA1_VWB1_WSGRA0_WSGRB0_WS64_WG64_4_1_WGM1_WGMXCC4_WGMXCCGn1
    SolutionIndex: 131
    SolutionNameMin: Cijk_Alik_Bljk_HSS_BH_Bias_S_HA_S_SAV_UserArgs_MT32x64x128_MI16x16x1_SN_LDSB0_AFC1_AFEM1_AFEM1_ASEM1_CLR1_CADS0_DTVA0_DTVB0_EPS0_FDSI0_GRPM1_GRVWA8_GRVWB8_GSUn1_GSUAMBSK_GSUC1_GSUWGMRR1_GLS0_ISA942_IU1_K1_LBSPPA512_LBSPPB512_LBSPPM0_LPA16_LPB16_LPM0_LRVW8_LWPMn1_MIAV0_MIWT2_2_MO40_NTn1_NTA0_NTB0_NTC0_NTD4_NTM0_NEPBS8_NLCA1_NLCB1_ONLL1_PGR2_PLR1_PKA1_SIA3_SS1_SU16_SUM1_SUS256_SPO0_SRVW0_SSO0_SVW2_SK0_SKXCCM0_TLDS1_ULSGRO0_USL1_UIOFGRO0_USFGROn1_VSn1_VWA2_VWB2_WSGRA0_WSGRB0_WS64_WG16_8_2_WGM1_WGMXCC4_WGMXCCGn1
    SolutionIndex: 132
    SolutionNameMin: Cijk_Alik_Bljk_HSS_BH_Bias_S_HA_S_SAV_UserArgs_MT256x112x64_MI16x16x1_SN_LDSB1_AFC1_AFEM1_AFEM1_ASEM1_CLR1_CADS0_DTVA0_DTVB0_EPS0_FDSI0_GRPM1_GRVWA8_GRVWB4_GSUn1_GSUAMBSK_GSUC1_GSUWGMRR1_GLS0_ISA942_IU1_K1_LBSPPA512_LBSPPB128_LBSPPM0_LPA16_LPB16_LPM0_LRVW8_LWPMn1_MIAV0_MIWT4_7_MO40_NTn1_NTA0_NTB0_NTC0_NTD4_NTM0_NEPBS8_NLCA1_NLCB1_ONLL1_PGR2_PLR1_PKA1_SIA3_SS1_SU16_SUM1_SUS128_SPO0_SRVW0_SSO0_SVW4_SK0_SKXCCM0_TLDS1_ULSGRO0_USL1_UIOFGRO0_USFGROn1_VSn1_VWA4_VWB1_WSGRA0_WSGRB0_WS64_WG64_4_1_WGM1_WGMXCC4_WGMXCCGn1
    SolutionIndex: 133
    SolutionNameMin: Cijk_Alik_Bljk_HSS_BH_Bias_S_HA_S_SAV_UserArgs_MT320x112x64_MI16x16x1_SN_LDSB1_AFC1_AFEM1_AFEM1_ASEM1_CLR1_CADS0_DTVA0_DTVB0_EPS0_FDSI0_GRPM1_GRVWA8_GRVWB4_GSUn1_GSUAMBSK_GSUC1_GSUWGMRR1_GLS0_ISA942_IU1_K1_LBSPPA128_LBSPPB128_LBSPPM0_LPA4_LPB4_LPM0_LRVW8_LWPMn1_MIAV0_MIWT5_7_MO40_NTn1_NTA0_NTB0_NTC0_NTD4_NTM0_NEPBS5_NLCA1_NLCB1_ONLL1_PGR2_PLR1_PKA1_SIA3_SS1_SU16_SUM1_SUS128_SPO0_SRVW0_SSO0_SVW1_SK0_SKXCCM0_TLDS1_ULSGRO0_USL1_UIOFGRO0_USFGROn1_VSn1_VWA1_VWB1_WSGRA0_WSGRB0_WS64_WG64_4_1_WGM1_WGMXCC4_WGMXCCGn1
    SolutionIndex: 134
    SolutionNameMin: Cijk_Alik_Bljk_HSS_BH_Bias_S_HA_S_SAV_UserArgs_MT192x112x64_MI16x16x1_SN_LDSB1_AFC1_AFEM1_AFEM1_ASEM1_CLR1_CADS0_DTVA0_DTVB0_EPS0_FDSI0_GRPM1_GRVWA8_GRVWB4_GSUn1_GSUAMBSK_GSUC1_GSUWGMRR1_GLS0_ISA942_IU1_K1_LBSPPA128_LBSPPB128_LBSPPM0_LPA16_LPB16_LPM0_LRVW8_LWPMn1_MIAV0_MIWT3_7_MO40_NTn1_NTA0_NTB0_NTC0_NTD4_NTM0_NEPBS6_NLCA1_NLCB1_ONLL1_PGR2_PLR1_PKA1_SIA3_SS1_SU16_SUM1_SUS128_SPO0_SRVW0_SSO0_SVW1_SK0_SKXCCM0_TLDS1_ULSGRO0_USL1_UIOFGRO0_USFGROn1_VSn1_VWA1_VWB1_WSGRA0_WSGRB0_WS64_WG64_4_1_WGM1_WGMXCC4_WGMXCCGn1
    SolutionIndex: 135
    SolutionNameMin: Cijk_Alik_Bljk_HSS_BH_Bias_S_HA_S_SAV_UserArgs_MT128x112x64_MI16x16x1_SN_LDSB1_AFC1_AFEM1_AFEM1_ASEM1_CLR1_CADS0_DTVA0_DTVB0_EPS0_FDSI0_GRPM1_GRVWA8_GRVWB4_GSUn1_GSUAMBSK_GSUC1_GSUWGMRR1_GLS0_ISA942_IU1_K1_LBSPPA256_LBSPPB128_LBSPPM0_LPA16_LPB16_LPM0_LRVW8_LWPMn1_MIAV0_MIWT2_7_MO40_NTn1_NTA0_NTB0_NTC0_NTD4_NTM0_NEPBS8_NLCA1_NLCB1_ONLL1_PGR2_PLR1_PKA1_SIA3_SS1_SU16_SUM1_SUS128_SPO0_SRVW0_SSO0_SVW2_SK0_SKXCCM0_TLDS1_ULSGRO0_USL1_UIOFGRO0_USFGROn1_VSn1_VWA2_VWB1_WSGRA0_WSGRB0_WS64_WG64_4_1_WGM1_WGMXCC4_WGMXCCGn1
    SolutionIndex: 136
    SolutionNameMin: Cijk_Alik_Bljk_HSS_BH_Bias_S_HA_S_SAV_UserArgs_MT128x112x32_MI16x16x1_SN_LDSB1_AFC1_AFEM1_AFEM1_ASEM1_CLR1_CADS0_DTVA0_DTVB0_EPS0_FDSI0_GRPM1_GRVWA4_GRVWB2_GSUn1_GSUAMBSK_GSUC1_GSUWGMRR1_GLS0_ISA942_IU1_K1_LBSPPA128_LBSPPB128_LBSPPM0_LPA8_LPB4_LPM0_LRVW4_LWPMn1_MIAV0_MIWT2_7_MO40_NTn1_NTA0_NTB0_NTC0_NTD4_NTM0_NEPBS8_NLCA1_NLCB1_ONLL1_PGR2_PLR1_PKA1_SIA3_SS1_SU16_SUM1_SUS64_SPO0_SRVW0_SSO0_SVW2_SK0_SKXCCM0_TLDS1_ULSGRO0_USL1_UIOFGRO0_USFGROn1_VSn1_VWA2_VWB1_WSGRA0_WSGRB0_WS64_WG64_4_1_WGM1_WGMXCC4_WGMXCCGn1
    SolutionIndex: 137
    SolutionNameMin: Cijk_Alik_Bljk_HSS_BH_Bias_S_HA_S_SAV_UserArgs_MT192x112x32_MI16x16x1_SN_LDSB1_AFC1_AFEM1_AFEM1_ASEM1_CLR1_CADS0_DTVA0_DTVB0_EPS0_FDSI0_GRPM1_GRVWA4_GRVWB2_GSUn1_GSUAMBSK_GSUC1_GSUWGMRR1_GLS0_ISA942_IU1_K1_LBSPPA128_LBSPPB128_LBSPPM0_LPA8_LPB4_LPM0_LRVW4_LWPMn1_MIAV0_MIWT3_7_MO40_NTn1_NTA0_NTB0_NTC0_NTD4_NTM0_NEPBS6_NLCA1_NLCB1_ONLL1_PGR2_PLR1_PKA1_SIA3_SS1_SU16_SUM1_SUS64_SPO0_SRVW0_SSO0_SVW1_SK0_SKXCCM0_TLDS1_ULSGRO0_USL1_UIOFGRO0_USFGROn1_VSn1_VWA1_VWB1_WSGRA0_WSGRB0_WS64_WG64_4_1_WGM1_WGMXCC4_WGMXCCGn1
    SolutionIndex: 138
    SolutionNameMin: Cijk_Alik_Bljk_HSS_BH_Bias_S_HA_S_SAV_UserArgs_MT256x112x64_MI16x16x1_SN_LDSB1_AFC1_AFEM1_AFEM1_ASEM1_CLR1_CADS0_DTVA0_DTVB0_EPS0_FDSI0_GRPM1_GRVWA8_GRVWB4_GSUn1_GSUAMBSK_GSUC1_GSUWGMRR1_GLS0_ISA942_IU1_K1_LBSPPA512_LBSPPB128_LBSPPM0_LPA16_LPB16_LPM0_LRVW8_LWPMn1_MIAV0_MIWT4_7_MO40_NTn1_NTA0_NTB0_NTC0_NTD4_NTM0_NEPBS8_NLCA1_NLCB1_ONLL1_PGR2_PLR1_PKA1_SIA3_SS1_SU16_SUM1_SUS128_SPO0_SRVW0_SSO4_SVW4_SK0_SKXCCM0_TLDS1_ULSGRO0_USL1_UIOFGRO0_USFGROn1_VSn1_VWA4_VWB1_WSGRA0_WSGRB0_WS64_WG64_4_1_WGM1_WGMXCC4_WGMXCCGn1
    SolutionIndex: 139
    SolutionNameMin: Cijk_Alik_Bljk_HSS_BH_Bias_S_HA_S_SAV_UserArgs_MT256x112x32_MI16x16x1_SN_LDSB1_AFC1_AFEM1_AFEM1_ASEM1_CLR1_CADS0_DTVA0_DTVB0_EPS0_FDSI0_GRPM1_GRVWA4_GRVWB2_GSUn1_GSUAMBSK_GSUC1_GSUWGMRR1_GLS0_ISA942_IU1_K1_LBSPPA256_LBSPPB128_LBSPPM0_LPA8_LPB4_LPM0_LRVW4_LWPMn1_MIAV0_MIWT4_7_MO40_NTn1_NTA0_NTB0_NTC0_NTD4_NTM0_NEPBS8_NLCA1_NLCB1_ONLL1_PGR2_PLR1_PKA1_SIA3_SS1_SU16_SUM1_SUS64_SPO0_SRVW0_SSO4_SVW4_SK0_SKXCCM0_TLDS1_ULSGRO0_USL1_UIOFGRO0_USFGROn1_VSn1_VWA4_VWB1_WSGRA0_WSGRB0_WS64_WG64_4_1_WGM1_WGMXCC4_WGMXCCGn1
    SolutionIndex: 140
    SolutionNameMin: Cijk_Alik_Bljk_HSS_BH_Bias_S_HA_S_SAV_UserArgs_MT320x112x64_MI16x16x1_SN_LDSB1_AFC1_AFEM1_AFEM1_ASEM1_CLR1_CADS0_DTVA0_DTVB0_EPS0_FDSI0_GRPM1_GRVWA8_GRVWB4_GSUn1_GSUAMBSK_GSUC1_GSUWGMRR1_GLS0_ISA942_IU1_K1_LBSPPA128_LBSPPB128_LBSPPM0_LPA4_LPB4_LPM0_LRVW8_LWPMn1_MIAV0_MIWT5_7_MO40_NTn1_NTA0_NTB0_NTC0_NTD4_NTM0_NEPBS5_NLCA1_NLCB1_ONLL1_PGR2_PLR1_PKA1_SIA3_SS1_SU16_SUM1_SUS128_SPO0_SRVW0_SSO4_SVW1_SK0_SKXCCM0_TLDS1_ULSGRO0_USL1_UIOFGRO0_USFGROn1_VSn1_VWA1_VWB1_WSGRA0_WSGRB0_WS64_WG64_4_1_WGM1_WGMXCC4_WGMXCCGn1
    SolutionIndex: 141
    SolutionNameMin: Cijk_Alik_Bljk_HSS_BH_Bias_S_HA_S_SAV_UserArgs_MT16x32x256_MI16x16x1_SN_LDSB0_AFC1_AFEM1_AFEM1_ASEM1_CLR1_CADS0_DTVA0_DTVB0_EPS0_FDSI0_GRPM1_GRVWA8_GRVWB8_GSUn1_GSUAMBSK_GSUC1_GSUWGMRR1_GLS0_ISA942_IU1_K1_LBSPPA512_LBSPPB512_LBSPPM0_LPA16_LPB16_LPM0_LRVW8_LWPMn1_MIAV0_MIWT1_1_MO40_NTn1_NTA0_NTB0_NTC0_NTD4_NTM0_NEPBS8_NLCA1_NLCB1_ONLL1_PGR2_PLR1_PKA1_SIA3_SS1_SU16_SUM1_SUS512_SPO0_SRVW0_SSO0_SVW1_SK0_SKXCCM0_TLDS1_ULSGRO0_USL1_UIOFGRO0_USFGROn1_VSn1_VWA1_VWB1_WSGRA0_WSGRB0_WS64_WG16_8_2_WGM1_WGMXCC4_WGMXCCGn1
    SolutionIndex: 142
    SolutionNameMin: Cijk_Alik_Bljk_HSS_BH_Bias_S_HA_S_SAV_UserArgs_MT16x64x256_MI16x16x1_SN_LDSB1_AFC1_AFEM1_AFEM1_ASEM1_CLR1_CADS0_DTVA0_DTVB0_EPS0_FDSI0_GRPM1_GRVWA8_GRVWB8_GSUn1_GSUAMBSK_GSUC1_GSUWGMRR1_GLS0_ISA942_IU1_K1_LBSPPA512_LBSPPB2048_LBSPPM0_LPA16_LPB16_LPM0_LRVW8_LWPMn1_MIAV0_MIWT1_4_MO40_NTn1_NTA0_NTB0_NTC0_NTD4_NTM0_NEPBS8_NLCA1_NLCB1_ONLL1_PGR2_PLR1_PKA1_SIA3_SS1_SU16_SUM1_SUS512_SPO0_SRVW0_SSO0_SVW1_SK0_SKXCCM0_TLDS1_ULSGRO0_USL1_UIOFGRO0_USFGROn1_VSn1_VWA1_VWB4_WSGRA0_WSGRB0_WS64_WG16_4_4_WGM1_WGMXCC4_WGMXCCGn1
    SolutionIndex: 143
    SolutionNameMin: Cijk_Alik_Bljk_HSS_BH_Bias_S_HA_S_SAV_UserArgs_MT32x128x64_MI32x32x1_SN_LDSB0_AFC1_AFEM1_AFEM1_ASEM1_CLR1_CADS0_DTVA0_DTVB0_EPS0_FDSI0_GRPM1_GRVWA8_GRVWB8_GSUn1_GSUAMBSK_GSUC1_GSUWGMRR1_GLS0_ISA942_IU1_K1_LBSPPA128_LBSPPB128_LBSPPM0_LPA8_LPB8_LPM0_LRVW8_LWPMn1_MIAV0_MIWT1_1_MO40_NTn1_NTA0_NTB0_NTC0_NTD4_NTM0_NEPBS8_NLCA1_NLCB1_ONLL1_PGR2_PLR1_PKA1_SIA3_SS1_SU16_SUM1_SUS128_SPO0_SRVW0_SSO0_SVW1_SK0_SKXCCM0_TLDS1_ULSGRO0_USL1_UIOFGRO0_USFGROn1_VSn1_VWA1_VWB1_WSGRA0_WSGRB0_WS64_WG32_8_1_WGM1_WGMXCC4_WGMXCCGn1
    SolutionIndex: 144
    SolutionNameMin: Cijk_Alik_Bljk_HSS_BH_Bias_S_HA_S_SAV_UserArgs_MT80x128x128_MI16x16x1_SN_LDSB1_AFC1_AFEM1_AFEM1_ASEM1_CLR1_CADS0_DTVA0_DTVB0_EPS0_FDSI0_GRPM1_GRVWA8_GRVWB8_GSUn1_GSUAMBSK_GSUC1_GSUWGMRR1_GLS0_ISA942_IU1_K1_LBSPPA256_LBSPPB512_LBSPPM0_LPA16_LPB16_LPM0_LRVW8_LWPMn1_MIAV0_MIWT5_2_MO40_NTn1_NTA0_NTB0_NTC0_NTD4_NTM0_NEPBS5_NLCA1_NLCB1_ONLL1_PGR2_PLR1_PKA1_SIA3_SS1_SU16_SUM1_SUS256_SPO0_SRVW0_SSO0_SVW1_SK0_SKXCCM0_TLDS1_ULSGRO0_USL1_UIOFGRO0_USFGROn1_VSn1_VWA1_VWB2_WSGRA0_WSGRB0_WS64_WG16_16_1_WGM1_WGMXCC4_WGMXCCGn1
    SolutionIndex: 145
    SolutionNameMin: Cijk_Alik_Bljk_HSS_BH_Bias_S_HA_S_SAV_UserArgs_MT48x128x128_MI16x16x1_SN_LDSB1_AFC1_AFEM1_AFEM1_ASEM1_CLR1_CADS0_DTVA0_DTVB0_EPS0_FDSI0_GRPM1_GRVWA8_GRVWB8_GSUn1_GSUAMBSK_GSUC1_GSUWGMRR1_GLS0_ISA942_IU1_K1_LBSPPA256_LBSPPB512_LBSPPM0_LPA16_LPB16_LPM0_LRVW8_LWPMn1_MIAV0_MIWT3_2_MO40_NTn1_NTA0_NTB0_NTC0_NTD4_NTM0_NEPBS6_NLCA1_NLCB1_ONLL1_PGR2_PLR1_PKA1_SIA3_SS1_SU16_SUM1_SUS256_SPO0_SRVW0_SSO0_SVW1_SK0_SKXCCM0_TLDS1_ULSGRO0_USL1_UIOFGRO0_USFGROn1_VSn1_VWA1_VWB2_WSGRA0_WSGRB0_WS64_WG16_16_1_WGM1_WGMXCC4_WGMXCCGn1
    SolutionIndex: 146
    SolutionNameMin: Cijk_Alik_Bljk_HSS_BH_Bias_S_HA_S_SAV_UserArgs_MT64x128x128_MI16x16x1_SN_LDSB1_AFC1_AFEM1_AFEM1_ASEM1_CLR1_CADS0_DTVA0_DTVB0_EPS0_FDSI0_GRPM1_GRVWA8_GRVWB8_GSUn1_GSUAMBSK_GSUC1_GSUWGMRR1_GLS0_ISA942_IU1_K1_LBSPPA1024_LBSPPB1024_LBSPPM0_LPA16_LPB16_LPM0_LRVW8_LWPMn1_MIAV0_MIWT4_4_MO40_NTn1_NTA0_NTB0_NTC0_NTD4_NTM0_NEPBS8_NLCA1_NLCB1_ONLL1_PGR2_PLR1_PKA1_SIA3_SS1_SU16_SUM1_SUS256_SPO0_SRVW0_SSO0_SVW4_SK0_SKXCCM0_TLDS1_ULSGRO0_USL1_UIOFGRO0_USFGROn1_VSn1_VWA4_VWB4_WSGRA0_WSGRB0_WS64_WG16_8_2_WGM1_WGMXCC4_WGMXCCGn1
    SolutionIndex: 147
    SolutionNameMin: Cijk_Alik_Bljk_HSS_BH_Bias_S_HA_S_SAV_UserArgs_MT64x128x128_MI16x16x1_SN_LDSB1_AFC1_AFEM1_AFEM1_ASEM1_CLR1_CADS0_DTVA0_DTVB0_EPS0_FDSI0_GRPM1_GRVWA8_GRVWB8_GSUn1_GSUAMBSK_GSUC1_GSUWGMRR1_GLS0_ISA942_IU1_K1_LBSPPA1024_LBSPPB512_LBSPPM0_LPA16_LPB16_LPM0_LRVW8_LWPMn1_MIAV0_MIWT4_2_MO40_NTn1_NTA0_NTB0_NTC0_NTD4_NTM0_NEPBS8_NLCA1_NLCB1_ONLL1_PGR2_PLR1_PKA1_SIA3_SS1_SU16_SUM1_SUS256_SPO0_SRVW0_SSO0_SVW4_SK0_SKXCCM0_TLDS1_ULSGRO0_USL1_UIOFGRO0_USFGROn1_VSn1_VWA4_VWB2_WSGRA0_WSGRB0_WS64_WG16_16_1_WGM1_WGMXCC4_WGMXCCGn1
    SolutionIndex: 148
    SolutionNameMin: Cijk_Alik_Bljk_HSS_BH_Bias_S_HA_S_SAV_UserArgs_MT64x128x128_MI16x16x1_SN_LDSB1_AFC1_AFEM1_AFEM1_ASEM1_CLR1_CADS0_DTVA0_DTVB0_EPS0_FDSI0_GRPM1_GRVWA8_GRVWB8_GSUn1_GSUAMBSK_GSUC1_GSUWGMRR1_GLS0_ISA942_IU1_K1_LBSPPA512_LBSPPB1024_LBSPPM0_LPA16_LPB16_LPM0_LRVW8_LWPMn1_MIAV0_MIWT2_4_MO40_NTn1_NTA0_NTB0_NTC0_NTD4_NTM0_NEPBS8_NLCA1_NLCB1_ONLL1_PGR2_PLR1_PKA1_SIA3_SS1_SU16_SUM1_SUS256_SPO0_SRVW0_SSO0_SVW2_SK0_SKXCCM0_TLDS1_ULSGRO0_USL1_UIOFGRO0_USFGROn1_VSn1_VWA2_VWB4_WSGRA0_WSGRB0_WS64_WG32_8_1_WGM1_WGMXCC4_WGMXCCGn1
    SolutionIndex: 149
    SolutionNameMin: Cijk_Alik_Bljk_HSS_BH_Bias_S_HA_S_SAV_UserArgs_MT96x128x128_MI16x16x1_SN_LDSB1_AFC1_AFEM1_AFEM1_ASEM1_CLR1_CADS0_DTVA0_DTVB0_EPS0_FDSI0_GRPM1_GRVWA8_GRVWB8_GSUn1_GSUAMBSK_GSUC1_GSUWGMRR1_GLS0_ISA942_IU1_K1_LBSPPA256_LBSPPB1024_LBSPPM0_LPA16_LPB16_LPM0_LRVW8_LWPMn1_MIAV0_MIWT3_4_MO40_NTn1_NTA0_NTB0_NTC0_NTD4_NTM0_NEPBS6_NLCA1_NLCB1_ONLL1_PGR2_PLR1_PKA1_SIA3_SS1_SU16_SUM1_SUS256_SPO0_SRVW0_SSO0_SVW1_SK0_SKXCCM0_TLDS1_ULSGRO0_USL1_UIOFGRO0_USFGROn1_VSn1_VWA1_VWB4_WSGRA0_WSGRB0_WS64_WG32_8_1_WGM1_WGMXCC4_WGMXCCGn1
    SolutionIndex: 150
    SolutionNameMin: Cijk_Alik_Bljk_HSS_BH_Bias_S_HA_S_SAV_UserArgs_MT32x64x128_MI16x16x1_SN_LDSB0_AFC1_AFEM1_AFEM1_ASEM1_CLR1_CADS0_DTVA0_DTVB0_EPS0_FDSI0_GRPM1_GRVWA8_GRVWB8_GSUn1_GSUAMBSK_GSUC1_GSUWGMRR1_GLS0_ISA942_IU1_K1_LBSPPA256_LBSPPB512_LBSPPM0_LPA16_LPB16_LPM0_LRVW8_LWPMn1_MIAV0_MIWT1_2_MO40_NTn1_NTA0_NTB0_NTC0_NTD4_NTM0_NEPBS8_NLCA1_NLCB1_ONLL1_PGR2_PLR1_PKA1_SIA3_SS1_SU16_SUM1_SUS256_SPO0_SRVW0_SSO0_SVW1_SK0_SKXCCM0_TLDS1_ULSGRO0_USL1_UIOFGRO0_USFGROn1_VSn1_VWA1_VWB2_WSGRA0_WSGRB0_WS64_WG32_8_1_WGM1_WGMXCC4_WGMXCCGn1
    SolutionIndex: 151
    SolutionNameMin: Cijk_Alik_Bljk_HSS_BH_Bias_S_HA_S_SAV_UserArgs_MT144x128x64_MI16x16x1_SN_LDSB1_AFC1_AFEM1_AFEM1_ASEM1_CLR1_CADS0_DTVA0_DTVB0_EPS0_FDSI0_GRPM1_GRVWA4_GRVWB8_GSUn1_GSUAMBSK_GSUC1_GSUWGMRR1_GLS0_ISA942_IU1_K1_LBSPPA128_LBSPPB256_LBSPPM0_LPA16_LPB16_LPM0_LRVW8_LWPMn1_MIAV0_MIWT9_2_MO40_NTn1_NTA0_NTB0_NTC0_NTD4_NTM0_NEPBS8_NLCA1_NLCB1_ONLL1_PGR2_PLR1_PKA1_SIA3_SS1_SU16_SUM1_SUS128_SPO0_SRVW0_SSO0_SVW1_SK0_SKXCCM0_TLDS1_ULSGRO0_USL1_UIOFGRO0_USFGROn1_VSn1_VWA1_VWB2_WSGRA0_WSGRB0_WS64_WG16_16_1_WGM1_WGMXCC4_WGMXCCGn1
    SolutionIndex: 152
    SolutionNameMin: Cijk_Alik_Bljk_HSS_BH_Bias_S_HA_S_SAV_UserArgs_MT192x128x64_MI16x16x1_SN_LDSB1_AFC1_AFEM1_AFEM1_ASEM1_CLR1_CADS0_DTVA0_DTVB0_EPS0_FDSI0_GRPM1_GRVWA8_GRVWB8_GSUn1_GSUAMBSK_GSUC1_GSUWGMRR1_GLS0_ISA942_IU1_K1_LBSPPA128_LBSPPB1024_LBSPPM0_LPA16_LPB16_LPM0_LRVW8_LWPMn1_MIAV0_MIWT3_8_MO40_NTn1_NTA0_NTB0_NTC0_NTD4_NTM0_NEPBS6_NLCA1_NLCB1_ONLL1_PGR2_PLR1_PKA1_SIA3_SS1_SU16_SUM1_SUS128_SPO0_SRVW0_SSO0_SVW1_SK0_SKXCCM0_TLDS1_ULSGRO0_USL1_UIOFGRO0_USFGROn1_VSn1_VWA1_VWB8_WSGRA0_WSGRB0_WS64_WG64_4_1_WGM1_WGMXCC4_WGMXCCGn1
    SolutionIndex: 153
    SolutionNameMin: Cijk_Alik_Bljk_HSS_BH_Bias_S_HA_S_SAV_UserArgs_MT192x128x64_MI32x32x1_SN_LDSB1_AFC1_AFEM1_AFEM1_ASEM1_CLR1_CADS0_DTVA0_DTVB0_EPS0_FDSI0_GRPM1_GRVWA8_GRVWB8_GSUn1_GSUAMBSK_GSUC1_GSUWGMRR1_GLS0_ISA942_IU1_K1_LBSPPA128_LBSPPB256_LBSPPM0_LPA8_LPB8_LPM0_LRVW8_LWPMn1_MIAV0_MIWT3_2_MO40_NTn1_NTA0_NTB0_NTC0_NTD4_NTM0_NEPBS6_NLCA1_NLCB1_ONLL1_PGR2_PLR1_PKA1_SIA3_SS1_SU16_SUM1_SUS128_SPO0_SRVW0_SSO0_SVW1_SK0_SKXCCM0_TLDS1_ULSGRO0_USL1_UIOFGRO0_USFGROn1_VSn1_VWA1_VWB2_WSGRA0_WSGRB0_WS64_WG64_4_1_WGM1_WGMXCC4_WGMXCCGn1
    SolutionIndex: 154
    SolutionNameMin: Cijk_Alik_Bljk_HSS_BH_Bias_S_HA_S_SAV_UserArgs_MT192x128x64_MI16x16x1_SN_LDSB1_AFC1_AFEM1_AFEM1_ASEM1_CLR1_CADS0_DTVA0_DTVB0_EPS0_FDSI0_GRPM1_GRVWA8_GRVWB8_GSUn1_GSUAMBSK_GSUC1_GSUWGMRR1_GLS0_ISA942_IU1_K1_LBSPPA256_LBSPPB512_LBSPPM0_LPA16_LPB16_LPM0_LRVW8_LWPMn1_MIAV0_MIWT6_4_MO40_NTn1_NTA0_NTB0_NTC0_NTD4_NTM0_NEPBS6_NLCA1_NLCB1_ONLL1_PGR2_PLR1_PKA1_SIA3_SS1_SU16_SUM1_SUS128_SPO0_SRVW0_SSO0_SVW2_SK0_SKXCCM0_TLDS1_ULSGRO0_USL1_UIOFGRO0_USFGROn1_VSn1_VWA2_VWB4_WSGRA0_WSGRB0_WS64_WG32_8_1_WGM1_WGMXCC4_WGMXCCGn1
    SolutionIndex: 155
    SolutionNameMin: Cijk_Alik_Bljk_HSS_BH_Bias_S_HA_S_SAV_UserArgs_MT224x128x64_MI16x16x1_SN_LDSB1_AFC1_AFEM1_AFEM1_ASEM1_CLR1_CADS0_DTVA0_DTVB0_EPS0_FDSI0_GRPM1_GRVWA8_GRVWB8_GSUn1_GSUAMBSK_GSUC1_GSUWGMRR1_GLS0_ISA942_IU1_K1_LBSPPA128_LBSPPB512_LBSPPM0_LPA16_LPB16_LPM0_LRVW8_LWPMn1_MIAV0_MIWT7_4_MO40_NTn1_NTA0_NTB0_NTC0_NTD4_NTM0_NEPBS7_NLCA1_NLCB1_ONLL1_PGR2_PLR1_PKA1_SIA3_SS1_SU16_SUM1_SUS128_SPO0_SRVW0_SSO0_SVW1_SK0_SKXCCM0_TLDS1_ULSGRO0_USL1_UIOFGRO0_USFGROn1_VSn1_VWA1_VWB4_WSGRA0_WSGRB0_WS64_WG32_8_1_WGM1_WGMXCC4_WGMXCCGn1
    SolutionIndex: 156
    SolutionNameMin: Cijk_Alik_Bljk_HSS_BH_Bias_S_HA_S_SAV_UserArgs_MT320x128x64_MI32x32x1_SN_LDSB1_AFC1_AFEM1_AFEM1_ASEM1_CLR1_CADS0_DTVA0_DTVB0_EPS0_FDSI0_GRPM1_GRVWA8_GRVWB8_GSUn1_GSUAMBSK_GSUC1_GSUWGMRR1_GLS0_ISA942_IU1_K1_LBSPPA128_LBSPPB256_LBSPPM0_LPA8_LPB8_LPM0_LRVW8_LWPMn1_MIAV0_MIWT5_2_MO40_NTn1_NTA0_NTB0_NTC0_NTD4_NTM0_NEPBS5_NLCA1_NLCB1_ONLL1_PGR2_PLR1_PKA1_SIA3_SS1_SU16_SUM1_SUS128_SPO0_SRVW0_SSO0_SVW1_SK0_SKXCCM0_TLDS1_ULSGRO0_USL1_UIOFGRO0_USFGROn1_VSn1_VWA1_VWB2_WSGRA0_WSGRB0_WS64_WG64_4_1_WGM1_WGMXCC4_WGMXCCGn1
    SolutionIndex: 157
    SolutionNameMin: Cijk_Alik_Bljk_HSS_BH_Bias_S_HA_S_SAV_UserArgs_MT352x128x64_MI16x16x1_SN_LDSB1_AFC1_AFEM1_AFEM1_ASEM1_CLR1_CADS0_DTVA0_DTVB0_EPS0_FDSI0_GRPM1_GRVWA8_GRVWB8_GSUn1_GSUAMBSK_GSUC1_GSUWGMRR1_GLS0_ISA942_IU1_K1_LBSPPA128_LBSPPB512_LBSPPM0_LPA4_LPB8_LPM0_LRVW8_LWPMn1_MIAV0_MIWT11_4_MO40_NTn1_NTA0_NTB0_NTC0_NTD4_NTM0_NEPBS8_NLCA1_NLCB1_ONLL1_PGR2_PLR1_PKA1_SIA3_SS1_SU16_SUM1_SUS128_SPO0_SRVW0_SSO0_SVW1_SK0_SKXCCM0_TLDS1_ULSGRO0_USL1_UIOFGRO0_USFGROn1_VSn1_VWA1_VWB4_WSGRA0_WSGRB0_WS64_WG32_8_1_WGM1_WGMXCC4_WGMXCCGn1
    SolutionIndex: 158
    SolutionNameMin: Cijk_Alik_Bljk_HSS_BH_Bias_S_HA_S_SAV_UserArgs_MT256x128x64_MI16x16x1_SN_LDSB1_AFC1_AFEM1_AFEM1_ASEM1_CLR1_CADS0_DTVA0_DTVB0_EPS0_FDSI0_GRPM1_GRVWA8_GRVWB8_GSUn1_GSUAMBSK_GSUC1_GSUWGMRR1_GLS0_ISA942_IU1_K1_LBSPPA1024_LBSPPB256_LBSPPM0_LPA16_LPB16_LPM0_LRVW8_LWPMn1_MIAV0_MIWT16_2_MO40_NTn1_NTA0_NTB0_NTC0_NTD4_NTM0_NEPBS8_NLCA1_NLCB1_ONLL1_PGR2_PLR1_PKA1_SIA3_SS1_SU16_SUM1_SUS128_SPO0_SRVW0_SSO0_SVW8_SK0_SKXCCM0_TLDS1_ULSGRO0_USL1_UIOFGRO0_USFGROn1_VSn1_VWA8_VWB2_WSGRA0_WSGRB0_WS64_WG16_16_1_WGM1_WGMXCC4_WGMXCCGn1
    SolutionIndex: 159
    SolutionNameMin: Cijk_Alik_Bljk_HSS_BH_Bias_S_HA_S_SAV_UserArgs_MT288x128x64_MI16x16x1_SN_LDSB1_AFC1_AFEM1_AFEM1_ASEM1_CLR1_CADS0_DTVA0_DTVB0_EPS0_FDSI0_GRPM1_GRVWA8_GRVWB8_GSUn1_GSUAMBSK_GSUC1_GSUWGMRR1_GLS0_ISA942_IU1_K1_LBSPPA128_LBSPPB512_LBSPPM0_LPA16_LPB16_LPM0_LRVW8_LWPMn1_MIAV0_MIWT9_4_MO40_NTn1_NTA0_NTB0_NTC0_NTD4_NTM0_NEPBS8_NLCA1_NLCB1_ONLL1_PGR2_PLR1_PKA1_SIA3_SS1_SU16_SUM1_SUS128_SPO0_SRVW0_SSO0_SVW1_SK0_SKXCCM0_TLDS1_ULSGRO0_USL1_UIOFGRO0_USFGROn1_VSn1_VWA1_VWB4_WSGRA0_WSGRB0_WS64_WG32_8_1_WGM1_WGMXCC4_WGMXCCGn1
    SolutionIndex: 160
    SolutionNameMin: Cijk_Alik_Bljk_HSS_BH_Bias_S_HA_S_SAV_UserArgs_MT320x128x64_MI16x16x1_SN_LDSB1_AFC1_AFEM1_AFEM1_ASEM1_CLR1_CADS0_DTVA0_DTVB0_EPS0_FDSI0_GRPM1_GRVWA8_GRVWB8_GSUn1_GSUAMBSK_GSUC1_GSUWGMRR1_GLS0_ISA942_IU1_K1_LBSPPA256_LBSPPB512_LBSPPM0_LPA16_LPB16_LPM0_LRVW8_LWPMn1_MIAV0_MIWT10_4_MO40_NTn1_NTA0_NTB0_NTC0_NTD4_NTM0_NEPBS8_NLCA1_NLCB1_ONLL1_PGR2_PLR1_PKA1_SIA3_SS1_SU16_SUM1_SUS128_SPO0_SRVW0_SSO0_SVW2_SK0_SKXCCM0_TLDS1_ULSGRO0_USL1_UIOFGRO0_USFGROn1_VSn1_VWA2_VWB4_WSGRA0_WSGRB0_WS64_WG32_8_1_WGM1_WGMXCC4_WGMXCCGn1
    SolutionIndex: 161
    SolutionNameMin: Cijk_Alik_Bljk_HSS_BH_Bias_S_HA_S_SAV_UserArgs_MT256x128x64_MI32x32x1_SN_LDSB1_AFC1_AFEM1_AFEM1_ASEM1_CLR1_CADS0_DTVA0_DTVB0_EPS0_FDSI0_GRPM1_GRVWA8_GRVWB8_GSUn1_GSUAMBSK_GSUC1_GSUWGMRR1_GLS0_ISA942_IU1_K1_LBSPPA256_LBSPPB512_LBSPPM0_LPA8_LPB8_LPM0_LRVW8_LWPMn1_MIAV0_MIWT2_4_MO40_NTn1_NTA0_NTB0_NTC0_NTD4_NTM0_NEPBS8_NLCA1_NLCB1_ONLL1_PGR2_PLR1_PKA1_SIA3_SS1_SU16_SUM1_SUS128_SPO0_SRVW0_SSO0_SVW2_SK0_SKXCCM0_TLDS1_ULSGRO0_USL1_UIOFGRO0_USFGROn1_VSn1_VWA2_VWB4_WSGRA0_WSGRB0_WS64_WG128_2_1_WGM1_WGMXCC4_WGMXCCGn1
    SolutionIndex: 162
    SolutionNameMin: Cijk_Alik_Bljk_HSS_BH_Bias_S_HA_S_SAV_UserArgs_MT112x128x64_MI16x16x1_SN_LDSB1_AFC1_AFEM1_AFEM1_ASEM1_CLR1_CADS0_DTVA0_DTVB0_EPS0_FDSI0_GRPM1_GRVWA4_GRVWB8_GSUn1_GSUAMBSK_GSUC1_GSUWGMRR1_GLS0_ISA942_IU1_K1_LBSPPA128_LBSPPB256_LBSPPM0_LPA16_LPB16_LPM0_LRVW8_LWPMn1_MIAV0_MIWT7_2_MO40_NTn1_NTA0_NTB0_NTC0_NTD4_NTM0_NEPBS7_NLCA1_NLCB1_ONLL1_PGR2_PLR1_PKA1_SIA3_SS1_SU16_SUM1_SUS128_SPO0_SRVW0_SSO0_SVW1_SK0_SKXCCM0_TLDS1_ULSGRO0_USL1_UIOFGRO0_USFGROn1_VSn1_VWA1_VWB2_WSGRA0_WSGRB0_WS64_WG16_16_1_WGM1_WGMXCC4_WGMXCCGn1
    SolutionIndex: 163
    SolutionNameMin: Cijk_Alik_Bljk_HSS_BH_Bias_S_HA_S_SAV_UserArgs_MT128x128x64_MI16x16x1_SN_LDSB1_AFC1_AFEM1_AFEM1_ASEM1_CLR1_CADS0_DTVA0_DTVB0_EPS0_FDSI0_GRPM1_GRVWA8_GRVWB8_GSUn1_GSUAMBSK_GSUC1_GSUWGMRR1_GLS0_ISA942_IU1_K1_LBSPPA512_LBSPPB512_LBSPPM0_LPA16_LPB16_LPM0_LRVW8_LWPMn1_MIAV0_MIWT4_4_MO40_NTn1_NTA0_NTB0_NTC0_NTD4_NTM0_NEPBS8_NLCA1_NLCB1_ONLL1_PGR2_PLR1_PKA1_SIA3_SS1_SU16_SUM1_SUS128_SPO0_SRVW0_SSO0_SVW4_SK0_SKXCCM0_TLDS1_ULSGRO0_USL1_UIOFGRO0_USFGROn1_VSn1_VWA4_VWB4_WSGRA0_WSGRB0_WS64_WG32_8_1_WGM1_WGMXCC4_WGMXCCGn1
    SolutionIndex: 164
    SolutionNameMin: Cijk_Alik_Bljk_HSS_BH_Bias_S_HA_S_SAV_UserArgs_MT256x128x64_MI16x16x1_SN_LDSB1_AFC1_AFEM1_AFEM1_ASEM1_CLR1_CADS0_DTVA0_DTVB0_EPS0_FDSI0_GRPM1_GRVWA8_GRVWB8_GSUn1_GSUAMBSK_GSUC1_GSUWGMRR1_GLS0_ISA942_IU1_K1_LBSPPA512_LBSPPB1024_LBSPPM0_LPA16_LPB16_LPM0_LRVW8_LWPMn1_MIAV0_MIWT4_8_MO40_NTn1_NTA0_NTB0_NTC0_NTD4_NTM0_NEPBS8_NLCA1_NLCB1_ONLL1_PGR2_PLR1_PKA1_SIA3_SS1_SU16_SUM1_SUS128_SPO0_SRVW0_SSO0_SVW4_SK0_SKXCCM0_TLDS1_ULSGRO0_USL1_UIOFGRO0_USFGROn1_VSn1_VWA4_VWB8_WSGRA0_WSGRB0_WS64_WG64_4_1_WGM1_WGMXCC4_WGMXCCGn1
    SolutionIndex: 165
    SolutionNameMin: Cijk_Alik_Bljk_HSS_BH_Bias_S_HA_S_SAV_UserArgs_MT256x128x64_MI16x16x1_SN_LDSB1_AFC1_AFEM1_AFEM1_ASEM1_CLR1_CADS0_DTVA0_DTVB0_EPS0_FDSI0_GRPM1_GRVWA8_GRVWB8_GSUn1_GSUAMBSK_GSUC1_GSUWGMRR1_GLS0_ISA942_IU1_K1_LBSPPA1024_LBSPPB512_LBSPPM0_LPA16_LPB16_LPM0_LRVW8_LWPMn1_MIAV0_MIWT8_4_MO40_NTn1_NTA0_NTB0_NTC0_NTD4_NTM0_NEPBS8_NLCA1_NLCB1_ONLL1_PGR2_PLR1_PKA1_SIA3_SS1_SU16_SUM1_SUS128_SPO0_SRVW0_SSO0_SVW8_SK0_SKXCCM0_TLDS1_ULSGRO0_USL1_UIOFGRO0_USFGROn1_VSn1_VWA8_VWB4_WSGRA0_WSGRB0_WS64_WG32_8_1_WGM1_WGMXCC4_WGMXCCGn1
    SolutionIndex: 166
    SolutionNameMin: Cijk_Alik_Bljk_HSS_BH_Bias_S_HA_S_SAV_UserArgs_MT160x128x64_MI16x16x1_SN_LDSB1_AFC1_AFEM1_AFEM1_ASEM1_CLR1_CADS0_DTVA0_DTVB0_EPS0_FDSI0_GRPM1_GRVWA8_GRVWB8_GSUn1_GSUAMBSK_GSUC1_GSUWGMRR1_GLS0_ISA942_IU1_K1_LBSPPA128_LBSPPB512_LBSPPM0_LPA16_LPB16_LPM0_LRVW8_LWPMn1_MIAV0_MIWT5_4_MO40_NTn1_NTA0_NTB0_NTC0_NTD4_NTM0_NEPBS5_NLCA1_NLCB1_ONLL1_PGR2_PLR1_PKA1_SIA3_SS1_SU16_SUM1_SUS128_SPO0_SRVW0_SSO0_SVW1_SK0_SKXCCM0_TLDS1_ULSGRO0_USL1_UIOFGRO0_USFGROn1_VSn1_VWA1_VWB4_WSGRA0_WSGRB0_WS64_WG32_8_1_WGM1_WGMXCC4_WGMXCCGn1
    SolutionIndex: 167
    SolutionNameMin: Cijk_Alik_Bljk_HSS_BH_Bias_S_HA_S_SAV_UserArgs_MT192x128x64_MI16x16x1_SN_LDSB1_AFC1_AFEM1_AFEM1_ASEM1_CLR1_CADS0_DTVA0_DTVB0_EPS0_FDSI0_GRPM1_GRVWA8_GRVWB8_GSUn1_GSUAMBSK_GSUC1_GSUWGMRR1_GLS0_ISA942_IU1_K1_LBSPPA512_LBSPPB256_LBSPPM0_LPA16_LPB16_LPM0_LRVW8_LWPMn1_MIAV0_MIWT12_2_MO40_NTn1_NTA0_NTB0_NTC0_NTD4_NTM0_NEPBS8_NLCA1_NLCB1_ONLL1_PGR2_PLR1_PKA1_SIA3_SS1_SU16_SUM1_SUS128_SPO0_SRVW0_SSO0_SVW4_SK0_SKXCCM0_TLDS1_ULSGRO0_USL1_UIOFGRO0_USFGROn1_VSn1_VWA4_VWB2_WSGRA0_WSGRB0_WS64_WG16_16_1_WGM1_WGMXCC4_WGMXCCGn1
    SolutionIndex: 168
    SolutionNameMin: Cijk_Alik_Bljk_HSS_BH_Bias_S_HA_S_SAV_UserArgs_MT224x128x64_MI16x16x1_SN_LDSB1_AFC1_AFEM1_AFEM1_ASEM1_CLR1_CADS0_DTVA0_DTVB0_EPS0_FDSI0_GRPM1_GRVWA8_GRVWB8_GSUn1_GSUAMBSK_GSUC1_GSUWGMRR1_GLS0_ISA942_IU1_K1_LBSPPA256_LBSPPB256_LBSPPM0_LPA16_LPB16_LPM0_LRVW8_LWPMn1_MIAV0_MIWT14_2_MO40_NTn1_NTA0_NTB0_NTC0_NTD4_NTM0_NEPBS8_NLCA1_NLCB1_ONLL1_PGR2_PLR1_PKA1_SIA3_SS1_SU16_SUM1_SUS128_SPO0_SRVW0_SSO0_SVW2_SK0_SKXCCM0_TLDS1_ULSGRO0_USL1_UIOFGRO0_USFGROn1_VSn1_VWA2_VWB2_WSGRA0_WSGRB0_WS64_WG16_16_1_WGM1_WGMXCC4_WGMXCCGn1
    SolutionIndex: 169
    SolutionNameMin: Cijk_Alik_Bljk_HSS_BH_Bias_S_HA_S_SAV_UserArgs_MT288x128x64_MI32x32x1_SN_LDSB1_AFC1_AFEM1_AFEM1_ASEM1_CLR1_CADS0_DTVA0_DTVB0_EPS0_FDSI0_GRPM1_GRVWA8_GRVWB8_GSUn1_GSUAMBSK_GSUC1_GSUWGMRR1_GLS0_ISA942_IU1_K1_LBSPPA128_LBSPPB128_LBSPPM0_LPA8_LPB8_LPM0_LRVW8_LWPMn1_MIAV0_MIWT9_1_MO40_NTn1_NTA0_NTB0_NTC0_NTD4_NTM0_NEPBS8_NLCA1_NLCB1_ONLL1_PGR2_PLR1_PKA1_SIA3_SS1_SU16_SUM1_SUS128_SPO0_SRVW0_SSO0_SVW1_SK0_SKXCCM0_TLDS1_ULSGRO0_USL1_UIOFGRO0_USFGROn1_VSn1_VWA1_VWB1_WSGRA0_WSGRB0_WS64_WG32_8_1_WGM1_WGMXCC4_WGMXCCGn1
    SolutionIndex: 170
    SolutionNameMin: Cijk_Alik_Bljk_HSS_BH_Bias_S_HA_S_SAV_UserArgs_MT288x128x64_MI16x16x1_SN_LDSB1_AFC1_AFEM1_AFEM1_ASEM1_CLR1_CADS0_DTVA0_DTVB0_EPS0_FDSI0_GRPM1_GRVWA8_GRVWB8_GSUn1_GSUAMBSK_GSUC1_GSUWGMRR1_GLS0_ISA942_IU1_K1_LBSPPA256_LBSPPB256_LBSPPM0_LPA16_LPB16_LPM0_LRVW8_LWPMn1_MIAV0_MIWT18_2_MO40_NTn1_NTA0_NTB0_NTC0_NTD4_NTM0_NEPBS8_NLCA1_NLCB1_ONLL1_PGR2_PLR1_PKA1_SIA3_SS1_SU16_SUM1_SUS128_SPO0_SRVW0_SSO0_SVW2_SK0_SKXCCM0_TLDS1_ULSGRO0_USL1_UIOFGRO0_USFGROn1_VSn1_VWA2_VWB2_WSGRA0_WSGRB0_WS64_WG16_16_1_WGM1_WGMXCC4_WGMXCCGn1
    SolutionIndex: 171
    SolutionNameMin: Cijk_Alik_Bljk_HSS_BH_Bias_S_HA_S_SAV_UserArgs_MT224x128x64_MI32x32x1_SN_LDSB1_AFC1_AFEM1_AFEM1_ASEM1_CLR1_CADS0_DTVA0_DTVB0_EPS0_FDSI0_GRPM1_GRVWA8_GRVWB8_GSUn1_GSUAMBSK_GSUC1_GSUWGMRR1_GLS0_ISA942_IU1_K1_LBSPPA128_LBSPPB128_LBSPPM0_LPA8_LPB8_LPM0_LRVW8_LWPMn1_MIAV0_MIWT7_1_MO40_NTn1_NTA0_NTB0_NTC0_NTD4_NTM0_NEPBS7_NLCA1_NLCB1_ONLL1_PGR2_PLR1_PKA1_SIA3_SS1_SU16_SUM1_SUS128_SPO0_SRVW0_SSO0_SVW1_SK0_SKXCCM0_TLDS1_ULSGRO0_USL1_UIOFGRO0_USFGROn1_VSn1_VWA1_VWB1_WSGRA0_WSGRB0_WS64_WG32_8_1_WGM1_WGMXCC4_WGMXCCGn1
    SolutionIndex: 172
    SolutionNameMin: Cijk_Alik_Bljk_HSS_BH_Bias_S_HA_S_SAV_UserArgs_MT256x128x64_MI32x32x1_SN_LDSB1_AFC1_AFEM1_AFEM1_ASEM1_CLR1_CADS0_DTVA0_DTVB0_EPS0_FDSI0_GRPM1_GRVWA8_GRVWB8_GSUn1_GSUAMBSK_GSUC1_GSUWGMRR1_GLS0_ISA942_IU1_K1_LBSPPA512_LBSPPB256_LBSPPM0_LPA8_LPB8_LPM0_LRVW8_LWPMn1_MIAV0_MIWT4_2_MO40_NTn1_NTA0_NTB0_NTC0_NTD4_NTM0_NEPBS8_NLCA1_NLCB1_ONLL1_PGR2_PLR1_PKA1_SIA3_SS1_SU16_SUM1_SUS128_SPO0_SRVW0_SSO0_SVW4_SK0_SKXCCM0_TLDS1_ULSGRO0_USL1_UIOFGRO0_USFGROn1_VSn1_VWA4_VWB2_WSGRA0_WSGRB0_WS64_WG64_4_1_WGM1_WGMXCC4_WGMXCCGn1
    SolutionIndex: 173
    SolutionNameMin: Cijk_Alik_Bljk_HSS_BH_Bias_S_HA_S_SAV_UserArgs_MT288x128x64_MI32x32x1_SN_LDSB1_AFC1_AFEM1_AFEM1_ASEM1_CLR1_CADS0_DTVA0_DTVB0_EPS0_FDSI0_GRPM1_GRVWA8_GRVWB8_GSUn1_GSUAMBSK_GSUC1_GSUWGMRR1_GLS0_ISA942_IU1_K1_LBSPPA128_LBSPPB128_LBSPPM0_LPA8_LPB8_LPM0_LRVW8_LWPMn1_MIAV0_MIWT9_1_MO40_NTn1_NTA0_NTB0_NTC0_NTD4_NTM0_NEPBS8_NLCA1_NLCB1_ONLL1_PGR2_PLR1_PKA1_SIA3_SS1_SU16_SUM1_SUS128_SPO0_SRVW0_SSO4_SVW1_SK0_SKXCCM0_TLDS1_ULSGRO0_USL1_UIOFGRO0_USFGROn1_VSn1_VWA1_VWB1_WSGRA0_WSGRB0_WS64_WG32_8_1_WGM1_WGMXCC4_WGMXCCGn1
    SolutionIndex: 174
    SolutionNameMin: Cijk_Alik_Bljk_HSS_BH_Bias_S_HA_S_SAV_UserArgs_MT128x128x64_MI16x16x1_SN_LDSB1_AFC1_AFEM1_AFEM1_ASEM1_CLR1_CADS0_DTVA0_DTVB0_EPS0_FDSI0_GRPM1_GRVWA8_GRVWB8_GSUn1_GSUAMBSK_GSUC1_GSUWGMRR1_GLS0_ISA942_IU1_K1_LBSPPA512_LBSPPB512_LBSPPM0_LPA16_LPB16_LPM0_LRVW8_LWPMn1_MIAV0_MIWT4_4_MO40_NTn1_NTA0_NTB0_NTC0_NTD4_NTM0_NEPBS8_NLCA1_NLCB1_ONLL1_PGR2_PLR1_PKA1_SIA3_SS1_SU16_SUM1_SUS128_SPO0_SRVW0_SSO4_SVW4_SK0_SKXCCM0_TLDS1_ULSGRO0_USL1_UIOFGRO0_USFGROn1_VSn1_VWA4_VWB4_WSGRA0_WSGRB0_WS64_WG32_8_1_WGM1_WGMXCC4_WGMXCCGn1
    SolutionIndex: 175
    SolutionNameMin: Cijk_Alik_Bljk_HSS_BH_Bias_S_HA_S_SAV_UserArgs_MT288x128x64_MI16x16x1_SN_LDSB1_AFC1_AFEM1_AFEM1_ASEM1_CLR1_CADS0_DTVA0_DTVB0_EPS0_FDSI0_GRPM1_GRVWA8_GRVWB8_GSUn1_GSUAMBSK_GSUC1_GSUWGMRR1_GLS0_ISA942_IU1_K1_LBSPPA128_LBSPPB512_LBSPPM0_LPA16_LPB16_LPM0_LRVW8_LWPMn1_MIAV0_MIWT9_4_MO40_NTn1_NTA0_NTB0_NTC0_NTD4_NTM0_NEPBS8_NLCA1_NLCB1_ONLL1_PGR2_PLR1_PKA1_SIA3_SS1_SU16_SUM1_SUS128_SPO0_SRVW0_SSO4_SVW1_SK0_SKXCCM0_TLDS1_ULSGRO0_USL1_UIOFGRO0_USFGROn1_VSn1_VWA1_VWB4_WSGRA0_WSGRB0_WS64_WG32_8_1_WGM1_WGMXCC4_WGMXCCGn1
    SolutionIndex: 176
    SolutionNameMin: Cijk_Alik_Bljk_HSS_BH_Bias_S_HA_S_SAV_UserArgs_MT192x128x64_MI16x16x1_SN_LDSB1_AFC1_AFEM1_AFEM1_ASEM1_CLR1_CADS0_DTVA0_DTVB0_EPS0_FDSI0_GRPM1_GRVWA8_GRVWB8_GSUn1_GSUAMBSK_GSUC1_GSUWGMRR1_GLS0_ISA942_IU1_K1_LBSPPA256_LBSPPB512_LBSPPM0_LPA16_LPB16_LPM0_LRVW8_LWPMn1_MIAV0_MIWT6_4_MO40_NTn1_NTA0_NTB0_NTC0_NTD4_NTM0_NEPBS6_NLCA1_NLCB1_ONLL1_PGR2_PLR1_PKA1_SIA3_SS1_SU16_SUM1_SUS128_SPO0_SRVW0_SSO4_SVW2_SK0_SKXCCM0_TLDS1_ULSGRO0_USL1_UIOFGRO0_USFGROn1_VSn1_VWA2_VWB4_WSGRA0_WSGRB0_WS64_WG32_8_1_WGM1_WGMXCC4_WGMXCCGn1
    SolutionIndex: 177
    SolutionNameMin: Cijk_Alik_Bljk_HSS_BH_Bias_S_HA_S_SAV_UserArgs_MT192x128x64_MI16x16x1_SN_LDSB1_AFC1_AFEM1_AFEM1_ASEM1_CLR1_CADS0_DTVA0_DTVB0_EPS0_FDSI0_GRPM1_GRVWA8_GRVWB8_GSUn1_GSUAMBSK_GSUC1_GSUWGMRR1_GLS0_ISA942_IU1_K1_LBSPPA512_LBSPPB256_LBSPPM0_LPA16_LPB16_LPM0_LRVW8_LWPMn1_MIAV0_MIWT12_2_MO40_NTn1_NTA0_NTB0_NTC0_NTD4_NTM0_NEPBS8_NLCA1_NLCB1_ONLL1_PGR2_PLR1_PKA1_SIA3_SS1_SU16_SUM1_SUS128_SPO0_SRVW0_SSO4_SVW4_SK0_SKXCCM0_TLDS1_ULSGRO0_USL1_UIOFGRO0_USFGROn1_VSn1_VWA4_VWB2_WSGRA0_WSGRB0_WS64_WG16_16_1_WGM1_WGMXCC4_WGMXCCGn1
    SolutionIndex: 178
    SolutionNameMin: Cijk_Alik_Bljk_HSS_BH_Bias_S_HA_S_SAV_UserArgs_MT256x128x64_MI16x16x1_SN_LDSB1_AFC1_AFEM1_AFEM1_ASEM1_CLR1_CADS0_DTVA0_DTVB0_EPS0_FDSI0_GRPM1_GRVWA8_GRVWB8_GSUn1_GSUAMBSK_GSUC1_GSUWGMRR1_GLS0_ISA942_IU1_K1_LBSPPA512_LBSPPB1024_LBSPPM0_LPA16_LPB16_LPM0_LRVW8_LWPMn1_MIAV0_MIWT4_8_MO40_NTn1_NTA0_NTB0_NTC0_NTD4_NTM0_NEPBS8_NLCA1_NLCB1_ONLL1_PGR2_PLR1_PKA1_SIA3_SS1_SU16_SUM1_SUS128_SPO0_SRVW0_SSO4_SVW4_SK0_SKXCCM0_TLDS1_ULSGRO0_USL1_UIOFGRO0_USFGROn1_VSn1_VWA4_VWB8_WSGRA0_WSGRB0_WS64_WG64_4_1_WGM1_WGMXCC4_WGMXCCGn1
    SolutionIndex: 179
    SolutionNameMin: Cijk_Alik_Bljk_HSS_BH_Bias_S_HA_S_SAV_UserArgs_MT256x128x64_MI16x16x1_SN_LDSB1_AFC1_AFEM1_AFEM1_ASEM1_CLR1_CADS0_DTVA0_DTVB0_EPS0_FDSI0_GRPM1_GRVWA8_GRVWB8_GSUn1_GSUAMBSK_GSUC1_GSUWGMRR1_GLS0_ISA942_IU1_K1_LBSPPA1024_LBSPPB512_LBSPPM0_LPA16_LPB16_LPM0_LRVW8_LWPMn1_MIAV0_MIWT8_4_MO40_NTn1_NTA0_NTB0_NTC0_NTD4_NTM0_NEPBS8_NLCA1_NLCB1_ONLL1_PGR2_PLR1_PKA1_SIA3_SS1_SU16_SUM1_SUS128_SPO0_SRVW0_SSO4_SVW8_SK0_SKXCCM0_TLDS1_ULSGRO0_USL1_UIOFGRO0_USFGROn1_VSn1_VWA8_VWB4_WSGRA0_WSGRB0_WS64_WG32_8_1_WGM1_WGMXCC4_WGMXCCGn1
    SolutionIndex: 180
    SolutionNameMin: Cijk_Alik_Bljk_HSS_BH_Bias_S_HA_S_SAV_UserArgs_MT256x128x64_MI32x32x1_SN_LDSB1_AFC1_AFEM1_AFEM1_ASEM1_CLR1_CADS0_DTVA0_DTVB0_EPS0_FDSI0_GRPM1_GRVWA8_GRVWB8_GSUn1_GSUAMBSK_GSUC1_GSUWGMRR1_GLS0_ISA942_IU1_K1_LBSPPA512_LBSPPB256_LBSPPM0_LPA8_LPB8_LPM0_LRVW8_LWPMn1_MIAV0_MIWT4_2_MO40_NTn1_NTA0_NTB0_NTC0_NTD4_NTM0_NEPBS8_NLCA1_NLCB1_ONLL1_PGR2_PLR1_PKA1_SIA3_SS1_SU16_SUM1_SUS128_SPO0_SRVW0_SSO4_SVW4_SK0_SKXCCM0_TLDS1_ULSGRO0_USL1_UIOFGRO0_USFGROn1_VSn1_VWA4_VWB2_WSGRA0_WSGRB0_WS64_WG64_4_1_WGM1_WGMXCC4_WGMXCCGn1
    SolutionIndex: 181
    SolutionNameMin: Cijk_Alik_Bljk_HSS_BH_Bias_S_HA_S_SAV_UserArgs_MT320x128x64_MI16x16x1_SN_LDSB1_AFC1_AFEM1_AFEM1_ASEM1_CLR1_CADS0_DTVA0_DTVB0_EPS0_FDSI0_GRPM1_GRVWA8_GRVWB8_GSUn1_GSUAMBSK_GSUC1_GSUWGMRR1_GLS0_ISA942_IU1_K1_LBSPPA256_LBSPPB512_LBSPPM0_LPA16_LPB16_LPM0_LRVW8_LWPMn1_MIAV0_MIWT10_4_MO40_NTn1_NTA0_NTB0_NTC0_NTD4_NTM0_NEPBS8_NLCA1_NLCB1_ONLL1_PGR2_PLR1_PKA1_SIA3_SS1_SU16_SUM1_SUS128_SPO0_SRVW0_SSO4_SVW2_SK0_SKXCCM0_TLDS1_ULSGRO0_USL1_UIOFGRO0_USFGROn1_VSn1_VWA2_VWB4_WSGRA0_WSGRB0_WS64_WG32_8_1_WGM1_WGMXCC4_WGMXCCGn1
    SolutionIndex: 182
    SolutionNameMin: Cijk_Alik_Bljk_HSS_BH_Bias_S_HA_S_SAV_UserArgs_MT16x32x256_MI16x16x1_SN_LDSB1_AFC1_AFEM1_AFEM1_ASEM1_CLR1_CADS0_DTVA0_DTVB0_EPS0_FDSI0_GRPM1_GRVWA8_GRVWB8_GSUn1_GSUAMBSK_GSUC1_GSUWGMRR1_GLS0_ISA942_IU1_K1_LBSPPA512_LBSPPB512_LBSPPM0_LPA16_LPB16_LPM0_LRVW8_LWPMn1_MIAV0_MIWT1_1_MO40_NTn1_NTA0_NTB0_NTC0_NTD4_NTM0_NEPBS8_NLCA1_NLCB1_ONLL1_PGR2_PLR1_PKA1_SIA3_SS1_SU16_SUM1_SUS512_SPO0_SRVW0_SSO0_SVW1_SK0_SKXCCM0_TLDS1_ULSGRO0_USL1_UIOFGRO0_USFGROn1_VSn1_VWA1_VWB1_WSGRA0_WSGRB0_WS64_WG16_8_2_WGM1_WGMXCC4_WGMXCCGn1
    SolutionIndex: 183
    SolutionNameMin: Cijk_Alik_Bljk_HSS_BH_Bias_S_HA_S_SAV_UserArgs_MT16x80x256_MI16x16x1_SN_LDSB1_AFC1_AFEM1_AFEM1_ASEM1_CLR1_CADS0_DTVA0_DTVB0_EPS0_FDSI0_GRPM1_GRVWA8_GRVWB8_GSUn1_GSUAMBSK_GSUC1_GSUWGMRR1_GLS0_ISA942_IU1_K1_LBSPPA512_LBSPPB512_LBSPPM0_LPA16_LPB16_LPM0_LRVW8_LWPMn1_MIAV0_MIWT1_5_MO40_NTn1_NTA0_NTB0_NTC0_NTD4_NTM0_NEPBS8_NLCA1_NLCB1_ONLL1_PGR2_PLR1_PKA1_SIA3_SS1_SU16_SUM1_SUS512_SPO0_SRVW0_SSO0_SVW1_SK0_SKXCCM0_TLDS1_ULSGRO0_USL1_UIOFGRO0_USFGROn1_VSn1_VWA1_VWB1_WSGRA0_WSGRB0_WS64_WG16_4_4_WGM1_WGMXCC4_WGMXCCGn1
    SolutionIndex: 184
    SolutionNameMin: Cijk_Alik_Bljk_HSS_BH_Bias_S_HA_S_SAV_UserArgs_MT32x160x128_MI16x16x1_SN_LDSB1_AFC1_AFEM1_AFEM1_ASEM1_CLR1_CADS0_DTVA0_DTVB0_EPS0_FDSI0_GRPM1_GRVWA8_GRVWB8_GSUn1_GSUAMBSK_GSUC1_GSUWGMRR1_GLS0_ISA942_IU1_K1_LBSPPA256_LBSPPB256_LBSPPM0_LPA16_LPB16_LPM0_LRVW8_LWPMn1_MIAV0_MIWT1_5_MO40_NTn1_NTA0_NTB0_NTC0_NTD4_NTM0_NEPBS8_NLCA1_NLCB1_ONLL1_PGR2_PLR1_PKA1_SIA3_SS1_SU16_SUM1_SUS256_SPO0_SRVW0_SSO0_SVW1_SK0_SKXCCM0_TLDS1_ULSGRO0_USL1_UIOFGRO0_USFGROn1_VSn1_VWA1_VWB1_WSGRA0_WSGRB0_WS64_WG32_8_1_WGM1_WGMXCC4_WGMXCCGn1
    SolutionIndex: 185
    SolutionNameMin: Cijk_Alik_Bljk_HSS_BH_Bias_S_HA_S_SAV_UserArgs_MT160x160x64_MI16x16x1_SN_LDSB1_AFC1_AFEM1_AFEM1_ASEM1_CLR1_CADS0_DTVA0_DTVB0_EPS0_FDSI0_GRPM1_GRVWA8_GRVWB8_GSUn1_GSUAMBSK_GSUC1_GSUWGMRR1_GLS0_ISA942_IU1_K1_LBSPPA128_LBSPPB128_LBSPPM0_LPA16_LPB16_LPM0_LRVW8_LWPMn1_MIAV0_MIWT5_5_MO40_NTn1_NTA0_NTB0_NTC0_NTD4_NTM0_NEPBS5_NLCA1_NLCB1_ONLL1_PGR2_PLR1_PKA1_SIA3_SS1_SU16_SUM1_SUS128_SPO0_SRVW0_SSO0_SVW1_SK0_SKXCCM0_TLDS1_ULSGRO0_USL1_UIOFGRO0_USFGROn1_VSn1_VWA1_VWB1_WSGRA0_WSGRB0_WS64_WG32_8_1_WGM1_WGMXCC4_WGMXCCGn1
    SolutionIndex: 186
    SolutionNameMin: Cijk_Alik_Bljk_HSS_BH_Bias_S_HA_S_SAV_UserArgs_MT64x160x128_MI16x16x1_SN_LDSB1_AFC1_AFEM1_AFEM1_ASEM1_CLR1_CADS0_DTVA0_DTVB0_EPS0_FDSI0_GRPM1_GRVWA8_GRVWB8_GSUn1_GSUAMBSK_GSUC1_GSUWGMRR1_GLS0_ISA942_IU1_K1_LBSPPA512_LBSPPB256_LBSPPM0_LPA16_LPB16_LPM0_LRVW8_LWPMn1_MIAV0_MIWT2_5_MO40_NTn1_NTA0_NTB0_NTC0_NTD4_NTM0_NEPBS8_NLCA1_NLCB1_ONLL1_PGR2_PLR1_PKA1_SIA3_SS1_SU16_SUM1_SUS256_SPO0_SRVW0_SSO0_SVW2_SK0_SKXCCM0_TLDS1_ULSGRO0_USL1_UIOFGRO0_USFGROn1_VSn1_VWA2_VWB1_WSGRA0_WSGRB0_WS64_WG32_8_1_WGM1_WGMXCC4_WGMXCCGn1
    SolutionIndex: 187
    SolutionNameMin: Cijk_Alik_Bljk_HSS_BH_Bias_S_HA_S_SAV_UserArgs_MT128x32x64_MI16x16x1_SN_LDSB0_AFC1_AFEM1_AFEM1_ASEM1_CLR1_CADS0_DTVA0_DTVB0_EPS0_FDSI0_GRPM1_GRVWA8_GRVWB8_GSUn1_GSUAMBSK_GSUC1_GSUWGMRR1_GLS0_ISA942_IU1_K1_LBSPPA256_LBSPPB256_LBSPPM0_LPA16_LPB16_LPM0_LRVW8_LWPMn1_MIAV0_MIWT2_2_MO40_NTn1_NTA0_NTB0_NTC0_NTD4_NTM0_NEPBS8_NLCA1_NLCB1_ONLL1_PGR2_PLR1_PKA1_SIA3_SS1_SU16_SUM1_SUS128_SPO0_SRVW0_SSO0_SVW2_SK0_SKXCCM0_TLDS1_ULSGRO0_USL1_UIOFGRO0_USFGROn1_VSn1_VWA2_VWB2_WSGRA0_WSGRB0_WS64_WG64_4_1_WGM1_WGMXCC4_WGMXCCGn1
    SolutionIndex: 188
    SolutionNameMin: Cijk_Alik_Bljk_HSS_BH_Bias_S_HA_S_SAV_UserArgs_MT128x160x64_MI16x16x1_SN_LDSB1_AFC1_AFEM1_AFEM1_ASEM1_CLR1_CADS0_DTVA0_DTVB0_EPS0_FDSI0_GRPM1_GRVWA8_GRVWB8_GSUn1_GSUAMBSK_GSUC1_GSUWGMRR1_GLS0_ISA942_IU1_K1_LBSPPA256_LBSPPB256_LBSPPM0_LPA16_LPB16_LPM0_LRVW8_LWPMn1_MIAV0_MIWT2_10_MO40_NTn1_NTA0_NTB0_NTC0_NTD4_NTM0_NEPBS8_NLCA1_NLCB1_ONLL1_PGR2_PLR1_PKA1_SIA3_SS1_SU16_SUM1_SUS128_SPO0_SRVW0_SSO0_SVW2_SK0_SKXCCM0_TLDS1_ULSGRO0_USL1_UIOFGRO0_USFGROn1_VSn1_VWA2_VWB2_WSGRA0_WSGRB0_WS64_WG64_4_1_WGM1_WGMXCC4_WGMXCCGn1
    SolutionIndex: 189
    SolutionNameMin: Cijk_Alik_Bljk_HSS_BH_Bias_S_HA_S_SAV_UserArgs_MT256x160x64_MI32x32x1_SN_LDSB1_AFC1_AFEM1_AFEM1_ASEM1_CLR1_CADS0_DTVA0_DTVB0_EPS0_FDSI0_GRPM1_GRVWA8_GRVWB8_GSUn1_GSUAMBSK_GSUC1_GSUWGMRR1_GLS0_ISA942_IU1_K1_LBSPPA256_LBSPPB128_LBSPPM0_LPA8_LPB8_LPM0_LRVW8_LWPMn1_MIAV0_MIWT2_5_MO40_NTn1_NTA0_NTB0_NTC0_NTD4_NTM0_NEPBS8_NLCA1_NLCB1_ONLL1_PGR2_PLR1_PKA1_SIA3_SS1_SU16_SUM1_SUS128_SPO0_SRVW0_SSO0_SVW2_SK0_SKXCCM0_TLDS1_ULSGRO0_USL1_UIOFGRO0_USFGROn1_VSn1_VWA2_VWB1_WSGRA0_WSGRB0_WS64_WG128_2_1_WGM1_WGMXCC4_WGMXCCGn1
    SolutionIndex: 190
    SolutionNameMin: Cijk_Alik_Bljk_HSS_BH_Bias_S_HA_S_SAV_UserArgs_MT288x160x64_MI16x16x1_SN_LDSB1_AFC1_AFEM1_AFEM1_ASEM1_CLR1_CADS0_DTVA0_DTVB0_EPS0_FDSI0_GRPM1_GRVWA8_GRVWB8_GSUn1_GSUAMBSK_GSUC1_GSUWGMRR1_GLS0_ISA942_IU1_K1_LBSPPA128_LBSPPB128_LBSPPM0_LPA4_LPB8_LPM0_LRVW8_LWPMn1_MIAV0_MIWT9_5_MO40_NTn1_NTA0_NTB0_NTC0_NTD4_NTM0_NEPBS8_NLCA1_NLCB1_ONLL1_PGR2_PLR1_PKA1_SIA3_SS1_SU16_SUM1_SUS128_SPO0_SRVW0_SSO0_SVW1_SK0_SKXCCM0_TLDS1_ULSGRO0_USL1_UIOFGRO0_USFGROn1_VSn1_VWA1_VWB1_WSGRA0_WSGRB0_WS64_WG32_8_1_WGM1_WGMXCC4_WGMXCCGn1
    SolutionIndex: 191
    SolutionNameMin: Cijk_Alik_Bljk_HSS_BH_Bias_S_HA_S_SAV_UserArgs_MT64x64x128_MI16x16x1_SN_LDSB1_AFC1_AFEM1_AFEM1_ASEM1_CLR1_CADS0_DTVA0_DTVB0_EPS0_FDSI0_GRPM1_GRVWA8_GRVWB8_GSUn1_GSUAMBSK_GSUC1_GSUWGMRR1_GLS0_ISA942_IU1_K1_LBSPPA1024_LBSPPB512_LBSPPM0_LPA16_LPB16_LPM0_LRVW8_LWPMn1_MIAV0_MIWT4_2_MO40_NTn1_NTA0_NTB0_NTC0_NTD4_NTM0_NEPBS8_NLCA1_NLCB1_ONLL1_PGR2_PLR1_PKA1_SIA3_SS1_SU16_SUM1_SUS256_SPO0_SRVW0_SSO0_SVW4_SK0_SKXCCM0_TLDS1_ULSGRO0_USL1_UIOFGRO0_USFGROn1_VSn1_VWA4_VWB2_WSGRA0_WSGRB0_WS64_WG16_8_2_WGM1_WGMXCC4_WGMXCCGn1
    SolutionIndex: 192
    SolutionNameMin: Cijk_Alik_Bljk_HSS_BH_Bias_S_HA_S_SAV_UserArgs_MT320x160x64_MI16x16x1_SN_LDSB1_AFC1_AFEM1_AFEM1_ASEM1_CLR1_CADS0_DTVA0_DTVB0_EPS0_FDSI0_GRPM1_GRVWA8_GRVWB8_GSUn1_GSUAMBSK_GSUC1_GSUWGMRR1_GLS0_ISA942_IU1_K1_LBSPPA256_LBSPPB128_LBSPPM0_LPA4_LPB8_LPM0_LRVW8_LWPMn1_MIAV0_MIWT10_5_MO40_NTn1_NTA0_NTB0_NTC0_NTD4_NTM0_NEPBS8_NLCA1_NLCB1_ONLL1_PGR2_PLR1_PKA1_SIA3_SS1_SU16_SUM1_SUS128_SPO0_SRVW0_SSO0_SVW2_SK0_SKXCCM0_TLDS1_ULSGRO0_USL1_UIOFGRO0_USFGROn1_VSn1_VWA2_VWB1_WSGRA0_WSGRB0_WS64_WG32_8_1_WGM1_WGMXCC4_WGMXCCGn1
    SolutionIndex: 193
    SolutionNameMin: Cijk_Alik_Bljk_HSS_BH_Bias_S_HA_S_SAV_UserArgs_MT224x160x64_MI16x16x1_SN_LDSB1_AFC1_AFEM1_AFEM1_ASEM1_CLR1_CADS0_DTVA0_DTVB0_EPS0_FDSI0_GRPM1_GRVWA8_GRVWB8_GSUn1_GSUAMBSK_GSUC1_GSUWGMRR1_GLS0_ISA942_IU1_K1_LBSPPA128_LBSPPB128_LBSPPM0_LPA16_LPB16_LPM0_LRVW8_LWPMn1_MIAV0_MIWT7_5_MO40_NTn1_NTA0_NTB0_NTC0_NTD4_NTM0_NEPBS7_NLCA1_NLCB1_ONLL1_PGR2_PLR1_PKA1_SIA3_SS1_SU16_SUM1_SUS128_SPO0_SRVW0_SSO0_SVW1_SK0_SKXCCM0_TLDS1_ULSGRO0_USL1_UIOFGRO0_USFGROn1_VSn1_VWA1_VWB1_WSGRA0_WSGRB0_WS64_WG32_8_1_WGM1_WGMXCC4_WGMXCCGn1
    SolutionIndex: 194
    SolutionNameMin: Cijk_Alik_Bljk_HSS_BH_Bias_S_HA_S_SAV_UserArgs_MT192x160x64_MI16x16x1_SN_LDSB1_AFC1_AFEM1_AFEM1_ASEM1_CLR1_CADS0_DTVA0_DTVB0_EPS0_FDSI0_GRPM1_GRVWA8_GRVWB8_GSUn1_GSUAMBSK_GSUC1_GSUWGMRR1_GLS0_ISA942_IU1_K1_LBSPPA256_LBSPPB128_LBSPPM0_LPA16_LPB16_LPM0_LRVW8_LWPMn1_MIAV0_MIWT6_5_MO40_NTn1_NTA0_NTB0_NTC0_NTD4_NTM0_NEPBS6_NLCA1_NLCB1_ONLL1_PGR2_PLR1_PKA1_SIA3_SS1_SU16_SUM1_SUS128_SPO0_SRVW0_SSO0_SVW2_SK0_SKXCCM0_TLDS1_ULSGRO0_USL1_UIOFGRO0_USFGROn1_VSn1_VWA2_VWB1_WSGRA0_WSGRB0_WS64_WG32_8_1_WGM1_WGMXCC4_WGMXCCGn1
    SolutionIndex: 195
    SolutionNameMin: Cijk_Alik_Bljk_HSS_BH_Bias_S_HA_S_SAV_UserArgs_MT128x64x128_MI16x16x1_SN_LDSB1_AFC1_AFEM1_AFEM1_ASEM1_CLR1_CADS0_DTVA0_DTVB0_EPS0_FDSI0_GRPM1_GRVWA8_GRVWB8_GSUn1_GSUAMBSK_GSUC1_GSUWGMRR1_GLS0_ISA942_IU1_K1_LBSPPA1024_LBSPPB1024_LBSPPM0_LPA16_LPB16_LPM0_LRVW8_LWPMn1_MIAV0_MIWT4_4_MO40_NTn1_NTA0_NTB0_NTC0_NTD4_NTM0_NEPBS8_NLCA1_NLCB1_ONLL1_PGR2_PLR1_PKA1_SIA3_SS1_SU16_SUM1_SUS256_SPO0_SRVW0_SSO0_SVW4_SK0_SKXCCM0_TLDS1_ULSGRO0_USL1_UIOFGRO0_USFGROn1_VSn1_VWA4_VWB4_WSGRA0_WSGRB0_WS64_WG32_4_2_WGM1_WGMXCC4_WGMXCCGn1
    SolutionIndex: 196
    SolutionNameMin: Cijk_Alik_Bljk_HSS_BH_Bias_S_HA_S_SAV_UserArgs_MT256x160x64_MI16x16x1_SN_LDSB1_AFC1_AFEM1_AFEM1_ASEM1_CLR1_CADS0_DTVA0_DTVB0_EPS0_FDSI0_GRPM1_GRVWA8_GRVWB8_GSUn1_GSUAMBSK_GSUC1_GSUWGMRR1_GLS0_ISA942_IU1_K1_LBSPPA512_LBSPPB256_LBSPPM0_LPA16_LPB16_LPM0_LRVW8_LWPMn1_MIAV0_MIWT4_10_MO40_NTn1_NTA0_NTB0_NTC0_NTD4_NTM0_NEPBS8_NLCA1_NLCB1_ONLL1_PGR2_PLR1_PKA1_SIA3_SS1_SU16_SUM1_SUS128_SPO0_SRVW0_SSO0_SVW4_SK0_SKXCCM0_TLDS1_ULSGRO0_USL1_UIOFGRO0_USFGROn1_VSn1_VWA4_VWB2_WSGRA0_WSGRB0_WS64_WG64_4_1_WGM1_WGMXCC4_WGMXCCGn1
    SolutionIndex: 197
    SolutionNameMin: Cijk_Alik_Bljk_HSS_BH_Bias_S_HA_S_SAV_UserArgs_MT96x160x64_MI16x16x1_SN_LDSB1_AFC1_AFEM1_AFEM1_ASEM1_CLR1_CADS0_DTVA0_DTVB0_EPS0_FDSI0_GRPM1_GRVWA8_GRVWB8_GSUn1_GSUAMBSK_GSUC1_GSUWGMRR1_GLS0_ISA942_IU1_K1_LBSPPA128_LBSPPB128_LBSPPM0_LPA16_LPB16_LPM0_LRVW8_LWPMn1_MIAV0_MIWT3_5_MO40_NTn1_NTA0_NTB0_NTC0_NTD4_NTM0_NEPBS6_NLCA1_NLCB1_ONLL1_PGR2_PLR1_PKA1_SIA3_SS1_SU16_SUM1_SUS128_SPO0_SRVW0_SSO0_SVW1_SK0_SKXCCM0_TLDS1_ULSGRO0_USL1_UIOFGRO0_USFGROn1_VSn1_VWA1_VWB1_WSGRA0_WSGRB0_WS64_WG32_8_1_WGM1_WGMXCC4_WGMXCCGn1
    SolutionIndex: 198
    SolutionNameMin: Cijk_Alik_Bljk_HSS_BH_Bias_S_HA_S_SAV_UserArgs_MT128x160x64_MI16x16x1_SN_LDSB1_AFC1_AFEM1_AFEM1_ASEM1_CLR1_CADS0_DTVA0_DTVB0_EPS0_FDSI0_GRPM1_GRVWA8_GRVWB8_GSUn1_GSUAMBSK_GSUC1_GSUWGMRR1_GLS0_ISA942_IU1_K1_LBSPPA512_LBSPPB128_LBSPPM0_LPA16_LPB16_LPM0_LRVW8_LWPMn1_MIAV0_MIWT4_5_MO40_NTn1_NTA0_NTB0_NTC0_NTD4_NTM0_NEPBS8_NLCA1_NLCB1_ONLL1_PGR2_PLR1_PKA1_SIA3_SS1_SU16_SUM1_SUS128_SPO0_SRVW0_SSO0_SVW4_SK0_SKXCCM0_TLDS1_ULSGRO0_USL1_UIOFGRO0_USFGROn1_VSn1_VWA4_VWB1_WSGRA0_WSGRB0_WS64_WG32_8_1_WGM1_WGMXCC4_WGMXCCGn1
    SolutionIndex: 199
    SolutionNameMin: Cijk_Alik_Bljk_HSS_BH_Bias_S_HA_S_SAV_UserArgs_MT256x160x64_MI16x16x1_SN_LDSB1_AFC1_AFEM1_AFEM1_ASEM1_CLR1_CADS0_DTVA0_DTVB0_EPS0_FDSI0_GRPM1_GRVWA8_GRVWB8_GSUn1_GSUAMBSK_GSUC1_GSUWGMRR1_GLS0_ISA942_IU1_K1_LBSPPA1024_LBSPPB128_LBSPPM0_LPA16_LPB16_LPM0_LRVW8_LWPMn1_MIAV0_MIWT8_5_MO40_NTn1_NTA0_NTB0_NTC0_NTD4_NTM0_NEPBS8_NLCA1_NLCB1_ONLL1_PGR2_PLR1_PKA1_SIA3_SS1_SU16_SUM1_SUS128_SPO0_SRVW0_SSO0_SVW8_SK0_SKXCCM0_TLDS1_ULSGRO0_USL1_UIOFGRO0_USFGROn1_VSn1_VWA8_VWB1_WSGRA0_WSGRB0_WS64_WG32_8_1_WGM1_WGMXCC4_WGMXCCGn1
    SolutionIndex: 200
    SolutionNameMin: Cijk_Alik_Bljk_HSS_BH_Bias_S_HA_S_SAV_UserArgs_MT256x160x64_MI16x16x1_SN_LDSB1_AFC1_AFEM1_AFEM1_ASEM1_CLR1_CADS0_DTVA0_DTVB0_EPS0_FDSI0_GRPM1_GRVWA8_GRVWB8_GSUn1_GSUAMBSK_GSUC1_GSUWGMRR1_GLS0_ISA942_IU1_K1_LBSPPA512_LBSPPB256_LBSPPM0_LPA16_LPB16_LPM0_LRVW8_LWPMn1_MIAV0_MIWT4_10_MO40_NTn1_NTA0_NTB0_NTC0_NTD4_NTM0_NEPBS8_NLCA1_NLCB1_ONLL1_PGR2_PLR1_PKA1_SIA3_SS1_SU16_SUM1_SUS128_SPO0_SRVW0_SSO4_SVW4_SK0_SKXCCM0_TLDS1_ULSGRO0_USL1_UIOFGRO0_USFGROn1_VSn1_VWA4_VWB2_WSGRA0_WSGRB0_WS64_WG64_4_1_WGM1_WGMXCC4_WGMXCCGn1
    SolutionIndex: 201
    SolutionNameMin: Cijk_Alik_Bljk_HSS_BH_Bias_S_HA_S_SAV_UserArgs_MT224x160x64_MI16x16x1_SN_LDSB1_AFC1_AFEM1_AFEM1_ASEM1_CLR1_CADS0_DTVA0_DTVB0_EPS0_FDSI0_GRPM1_GRVWA8_GRVWB8_GSUn1_GSUAMBSK_GSUC1_GSUWGMRR1_GLS0_ISA942_IU1_K1_LBSPPA128_LBSPPB128_LBSPPM0_LPA16_LPB16_LPM0_LRVW8_LWPMn1_MIAV0_MIWT7_5_MO40_NTn1_NTA0_NTB0_NTC0_NTD4_NTM0_NEPBS7_NLCA1_NLCB1_ONLL1_PGR2_PLR1_PKA1_SIA3_SS1_SU16_SUM1_SUS128_SPO0_SRVW0_SSO4_SVW1_SK0_SKXCCM0_TLDS1_ULSGRO0_USL1_UIOFGRO0_USFGROn1_VSn1_VWA1_VWB1_WSGRA0_WSGRB0_WS64_WG32_8_1_WGM1_WGMXCC4_WGMXCCGn1
    SolutionIndex: 202
    SolutionNameMin: Cijk_Alik_Bljk_HSS_BH_Bias_S_HA_S_SAV_UserArgs_MT288x160x64_MI16x16x1_SN_LDSB1_AFC1_AFEM1_AFEM1_ASEM1_CLR1_CADS0_DTVA0_DTVB0_EPS0_FDSI0_GRPM1_GRVWA8_GRVWB8_GSUn1_GSUAMBSK_GSUC1_GSUWGMRR1_GLS0_ISA942_IU1_K1_LBSPPA128_LBSPPB128_LBSPPM0_LPA4_LPB8_LPM0_LRVW8_LWPMn1_MIAV0_MIWT9_5_MO40_NTn1_NTA0_NTB0_NTC0_NTD4_NTM0_NEPBS8_NLCA1_NLCB1_ONLL1_PGR2_PLR1_PKA1_SIA3_SS1_SU16_SUM1_SUS128_SPO0_SRVW0_SSO4_SVW1_SK0_SKXCCM0_TLDS1_ULSGRO0_USL1_UIOFGRO0_USFGROn1_VSn1_VWA1_VWB1_WSGRA0_WSGRB0_WS64_WG32_8_1_WGM1_WGMXCC4_WGMXCCGn1
    SolutionIndex: 203
    SolutionNameMin: Cijk_Alik_Bljk_HSS_BH_Bias_S_HA_S_SAV_UserArgs_MT192x160x64_MI16x16x1_SN_LDSB1_AFC1_AFEM1_AFEM1_ASEM1_CLR1_CADS0_DTVA0_DTVB0_EPS0_FDSI0_GRPM1_GRVWA8_GRVWB8_GSUn1_GSUAMBSK_GSUC1_GSUWGMRR1_GLS0_ISA942_IU1_K1_LBSPPA256_LBSPPB128_LBSPPM0_LPA16_LPB16_LPM0_LRVW8_LWPMn1_MIAV0_MIWT6_5_MO40_NTn1_NTA0_NTB0_NTC0_NTD4_NTM0_NEPBS6_NLCA1_NLCB1_ONLL1_PGR2_PLR1_PKA1_SIA3_SS1_SU16_SUM1_SUS128_SPO0_SRVW0_SSO4_SVW2_SK0_SKXCCM0_TLDS1_ULSGRO0_USL1_UIOFGRO0_USFGROn1_VSn1_VWA2_VWB1_WSGRA0_WSGRB0_WS64_WG32_8_1_WGM1_WGMXCC4_WGMXCCGn1
    SolutionIndex: 204
    SolutionNameMin: Cijk_Alik_Bljk_HSS_BH_Bias_S_HA_S_SAV_UserArgs_MT256x160x64_MI16x16x1_SN_LDSB1_AFC1_AFEM1_AFEM1_ASEM1_CLR1_CADS0_DTVA0_DTVB0_EPS0_FDSI0_GRPM1_GRVWA8_GRVWB8_GSUn1_GSUAMBSK_GSUC1_GSUWGMRR1_GLS0_ISA942_IU1_K1_LBSPPA1024_LBSPPB128_LBSPPM0_LPA16_LPB16_LPM0_LRVW8_LWPMn1_MIAV0_MIWT8_5_MO40_NTn1_NTA0_NTB0_NTC0_NTD4_NTM0_NEPBS8_NLCA1_NLCB1_ONLL1_PGR2_PLR1_PKA1_SIA3_SS1_SU16_SUM1_SUS128_SPO0_SRVW0_SSO4_SVW8_SK0_SKXCCM0_TLDS1_ULSGRO0_USL1_UIOFGRO0_USFGROn1_VSn1_VWA8_VWB1_WSGRA0_WSGRB0_WS64_WG32_8_1_WGM1_WGMXCC4_WGMXCCGn1
    SolutionIndex: 205
    SolutionNameMin: Cijk_Alik_Bljk_HSS_BH_Bias_S_HA_S_SAV_UserArgs_MT320x160x64_MI16x16x1_SN_LDSB1_AFC1_AFEM1_AFEM1_ASEM1_CLR1_CADS0_DTVA0_DTVB0_EPS0_FDSI0_GRPM1_GRVWA8_GRVWB8_GSUn1_GSUAMBSK_GSUC1_GSUWGMRR1_GLS0_ISA942_IU1_K1_LBSPPA256_LBSPPB128_LBSPPM0_LPA4_LPB8_LPM0_LRVW8_LWPMn1_MIAV0_MIWT10_5_MO40_NTn1_NTA0_NTB0_NTC0_NTD4_NTM0_NEPBS8_NLCA1_NLCB1_ONLL1_PGR2_PLR1_PKA1_SIA3_SS1_SU16_SUM1_SUS128_SPO0_SRVW0_SSO4_SVW2_SK0_SKXCCM0_TLDS1_ULSGRO0_USL1_UIOFGRO0_USFGROn1_VSn1_VWA2_VWB1_WSGRA0_WSGRB0_WS64_WG32_8_1_WGM1_WGMXCC4_WGMXCCGn1
    SolutionIndex: 206
    SolutionNameMin: Cijk_Alik_Bljk_HSS_BH_Bias_S_HA_S_SAV_UserArgs_MT128x64x64_MI32x32x1_SN_LDSB0_AFC1_AFEM1_AFEM1_ASEM1_CLR1_CADS0_DTVA0_DTVB0_EPS0_FDSI0_GRPM1_GRVWA8_GRVWB8_GSUn1_GSUAMBSK_GSUC1_GSUWGMRR1_GLS0_ISA942_IU1_K1_LBSPPA256_LBSPPB128_LBSPPM0_LPA8_LPB8_LPM0_LRVW8_LWPMn1_MIAV0_MIWT2_1_MO40_NTn1_NTA0_NTB0_NTC0_NTD4_NTM0_NEPBS8_NLCA1_NLCB1_ONLL1_PGR2_PLR1_PKA1_SIA3_SS1_SU16_SUM1_SUS128_SPO0_SRVW0_SSO0_SVW2_SK0_SKXCCM0_TLDS1_ULSGRO0_USL1_UIOFGRO0_USFGROn1_VSn1_VWA2_VWB1_WSGRA0_WSGRB0_WS64_WG64_4_1_WGM1_WGMXCC4_WGMXCCGn1
    SolutionIndex: 207
    SolutionNameMin: Cijk_Alik_Bljk_HSS_BH_Bias_S_HA_S_SAV_UserArgs_MT96x192x64_MI16x16x1_SN_LDSB1_AFC1_AFEM1_AFEM1_ASEM1_CLR1_CADS0_DTVA0_DTVB0_EPS0_FDSI0_GRPM1_GRVWA8_GRVWB8_GSUn1_GSUAMBSK_GSUC1_GSUWGMRR1_GLS0_ISA942_IU1_K1_LBSPPA256_LBSPPB128_LBSPPM0_LPA16_LPB16_LPM0_LRVW8_LWPMn1_MIAV0_MIWT6_3_MO40_NTn1_NTA0_NTB0_NTC0_NTD4_NTM0_NEPBS6_NLCA1_NLCB1_ONLL1_PGR2_PLR1_PKA1_SIA3_SS1_SU16_SUM1_SUS128_SPO0_SRVW0_SSO0_SVW2_SK0_SKXCCM0_TLDS1_ULSGRO0_USL1_UIOFGRO0_USFGROn1_VSn1_VWA2_VWB1_WSGRA0_WSGRB0_WS64_WG16_16_1_WGM1_WGMXCC4_WGMXCCGn1
    SolutionIndex: 208
    SolutionNameMin: Cijk_Alik_Bljk_HSS_BH_Bias_S_HA_S_SAV_UserArgs_MT112x192x64_MI16x16x1_SN_LDSB1_AFC1_AFEM1_AFEM1_ASEM1_CLR1_CADS0_DTVA0_DTVB0_EPS0_FDSI0_GRPM1_GRVWA4_GRVWB8_GSUn1_GSUAMBSK_GSUC1_GSUWGMRR1_GLS0_ISA942_IU1_K1_LBSPPA128_LBSPPB128_LBSPPM0_LPA16_LPB16_LPM0_LRVW8_LWPMn1_MIAV0_MIWT7_3_MO40_NTn1_NTA0_NTB0_NTC0_NTD4_NTM0_NEPBS7_NLCA1_NLCB1_ONLL1_PGR2_PLR1_PKA1_SIA3_SS1_SU16_SUM1_SUS128_SPO0_SRVW0_SSO0_SVW1_SK0_SKXCCM0_TLDS1_ULSGRO0_USL1_UIOFGRO0_USFGROn1_VSn1_VWA1_VWB1_WSGRA0_WSGRB0_WS64_WG16_16_1_WGM1_WGMXCC4_WGMXCCGn1
    SolutionIndex: 209
    SolutionNameMin: Cijk_Alik_Bljk_HSS_BH_Bias_S_HA_S_SAV_UserArgs_MT128x192x64_MI32x32x1_SN_LDSB1_AFC1_AFEM1_AFEM1_ASEM1_CLR1_CADS0_DTVA0_DTVB0_EPS0_FDSI0_GRPM1_GRVWA8_GRVWB8_GSUn1_GSUAMBSK_GSUC1_GSUWGMRR1_GLS0_ISA942_IU1_K1_LBSPPA256_LBSPPB128_LBSPPM0_LPA8_LPB8_LPM0_LRVW8_LWPMn1_MIAV0_MIWT2_3_MO40_NTn1_NTA0_NTB0_NTC0_NTD4_NTM0_NEPBS8_NLCA1_NLCB1_ONLL1_PGR2_PLR1_PKA1_SIA3_SS1_SU16_SUM1_SUS128_SPO0_SRVW0_SSO0_SVW2_SK0_SKXCCM0_TLDS1_ULSGRO0_USL1_UIOFGRO0_USFGROn1_VSn1_VWA2_VWB1_WSGRA0_WSGRB0_WS64_WG64_4_1_WGM1_WGMXCC4_WGMXCCGn1
    SolutionIndex: 210
    SolutionNameMin: Cijk_Alik_Bljk_HSS_BH_Bias_S_HA_S_SAV_UserArgs_MT256x192x64_MI16x16x1_SN_LDSB1_AFC1_AFEM1_AFEM1_ASEM1_CLR1_CADS0_DTVA0_DTVB0_EPS0_FDSI0_GRPM1_GRVWA8_GRVWB8_GSUn1_GSUAMBSK_GSUC1_GSUWGMRR1_GLS0_ISA942_IU1_K1_LBSPPA512_LBSPPB512_LBSPPM0_LPA16_LPB16_LPM0_LRVW8_LWPMn1_MIAV0_MIWT4_12_MO40_NTn1_NTA0_NTB0_NTC0_NTD4_NTM0_NEPBS8_NLCA1_NLCB1_ONLL1_PGR2_PLR1_PKA1_SIA3_SS1_SU16_SUM1_SUS128_SPO0_SRVW0_SSO0_SVW4_SK0_SKXCCM0_TLDS1_ULSGRO0_USL1_UIOFGRO0_USFGROn1_VSn1_VWA4_VWB4_WSGRA0_WSGRB0_WS64_WG64_4_1_WGM1_WGMXCC4_WGMXCCGn1
    SolutionIndex: 211
    SolutionNameMin: Cijk_Alik_Bljk_HSS_BH_Bias_S_HA_S_SAV_UserArgs_MT288x192x64_MI16x16x1_SN_LDSB1_AFC1_AFEM1_AFEM1_ASEM1_CLR1_CADS0_DTVA0_DTVB0_EPS0_FDSI0_GRPM1_GRVWA8_GRVWB8_GSUn1_GSUAMBSK_GSUC1_GSUWGMRR1_GLS0_ISA942_IU1_K1_LBSPPA128_LBSPPB256_LBSPPM0_LPA4_LPB8_LPM0_LRVW8_LWPMn1_MIAV0_MIWT9_6_MO40_NTn1_NTA0_NTB0_NTC0_NTD4_NTM0_NEPBS8_NLCA1_NLCB1_ONLL1_PGR2_PLR1_PKA1_SIA3_SS1_SU16_SUM1_SUS128_SPO0_SRVW0_SSO0_SVW1_SK0_SKXCCM0_TLDS1_ULSGRO0_USL1_UIOFGRO0_USFGROn1_VSn1_VWA1_VWB2_WSGRA0_WSGRB0_WS64_WG32_8_1_WGM1_WGMXCC4_WGMXCCGn1
    SolutionIndex: 212
    SolutionNameMin: Cijk_Alik_Bljk_HSS_BH_Bias_S_HA_S_SAV_UserArgs_MT144x192x64_MI16x16x1_SN_LDSB1_AFC1_AFEM1_AFEM1_ASEM1_CLR1_CADS0_DTVA0_DTVB0_EPS0_FDSI0_GRPM1_GRVWA4_GRVWB8_GSUn1_GSUAMBSK_GSUC1_GSUWGMRR1_GLS0_ISA942_IU1_K1_LBSPPA128_LBSPPB128_LBSPPM0_LPA16_LPB16_LPM0_LRVW8_LWPMn1_MIAV0_MIWT9_3_MO40_NTn1_NTA0_NTB0_NTC0_NTD4_NTM0_NEPBS8_NLCA1_NLCB1_ONLL1_PGR2_PLR1_PKA1_SIA3_SS1_SU16_SUM1_SUS128_SPO0_SRVW0_SSO0_SVW1_SK0_SKXCCM0_TLDS1_ULSGRO0_USL1_UIOFGRO0_USFGROn1_VSn1_VWA1_VWB1_WSGRA0_WSGRB0_WS64_WG16_16_1_WGM1_WGMXCC4_WGMXCCGn1
    SolutionIndex: 213
    SolutionNameMin: Cijk_Alik_Bljk_HSS_BH_Bias_S_HA_S_SAV_UserArgs_MT160x192x64_MI16x16x1_SN_LDSB1_AFC1_AFEM1_AFEM1_ASEM1_CLR1_CADS0_DTVA0_DTVB0_EPS0_FDSI0_GRPM1_GRVWA8_GRVWB8_GSUn1_GSUAMBSK_GSUC1_GSUWGMRR1_GLS0_ISA942_IU1_K1_LBSPPA128_LBSPPB256_LBSPPM0_LPA16_LPB16_LPM0_LRVW8_LWPMn1_MIAV0_MIWT5_6_MO40_NTn1_NTA0_NTB0_NTC0_NTD4_NTM0_NEPBS5_NLCA1_NLCB1_ONLL1_PGR2_PLR1_PKA1_SIA3_SS1_SU16_SUM1_SUS128_SPO0_SRVW0_SSO0_SVW1_SK0_SKXCCM0_TLDS1_ULSGRO0_USL1_UIOFGRO0_USFGROn1_VSn1_VWA1_VWB2_WSGRA0_WSGRB0_WS64_WG32_8_1_WGM1_WGMXCC4_WGMXCCGn1
    SolutionIndex: 214
    SolutionNameMin: Cijk_Alik_Bljk_HSS_BH_Bias_S_HA_S_SAV_UserArgs_MT192x192x64_MI16x16x1_SN_LDSB1_AFC1_AFEM1_AFEM1_ASEM1_CLR1_CADS0_DTVA0_DTVB0_EPS0_FDSI0_GRPM1_GRVWA8_GRVWB8_GSUn1_GSUAMBSK_GSUC1_GSUWGMRR1_GLS0_ISA942_IU1_K1_LBSPPA256_LBSPPB256_LBSPPM0_LPA16_LPB16_LPM0_LRVW8_LWPMn1_MIAV0_MIWT6_6_MO40_NTn1_NTA0_NTB0_NTC0_NTD4_NTM0_NEPBS6_NLCA1_NLCB1_ONLL1_PGR2_PLR1_PKA1_SIA3_SS1_SU16_SUM1_SUS128_SPO0_SRVW0_SSO0_SVW2_SK0_SKXCCM0_TLDS1_ULSGRO0_USL1_UIOFGRO0_USFGROn1_VSn1_VWA2_VWB2_WSGRA0_WSGRB0_WS64_WG32_8_1_WGM1_WGMXCC4_WGMXCCGn1
    SolutionIndex: 215
    SolutionNameMin: Cijk_Alik_Bljk_HSS_BH_Bias_S_HA_S_SAV_UserArgs_MT176x192x64_MI16x16x1_SN_LDSB1_AFC1_AFEM1_AFEM1_ASEM1_CLR1_CADS0_DTVA0_DTVB0_EPS0_FDSI0_GRPM1_GRVWA4_GRVWB8_GSUn1_GSUAMBSK_GSUC1_GSUWGMRR1_GLS0_ISA942_IU1_K1_LBSPPA128_LBSPPB128_LBSPPM0_LPA16_LPB16_LPM0_LRVW8_LWPMn1_MIAV0_MIWT11_3_MO40_NTn1_NTA0_NTB0_NTC0_NTD4_NTM0_NEPBS8_NLCA1_NLCB1_ONLL1_PGR2_PLR1_PKA1_SIA3_SS1_SU16_SUM1_SUS128_SPO0_SRVW0_SSO0_SVW1_SK0_SKXCCM0_TLDS1_ULSGRO0_USL1_UIOFGRO0_USFGROn1_VSn1_VWA1_VWB1_WSGRA0_WSGRB0_WS64_WG16_16_1_WGM1_WGMXCC4_WGMXCCGn1
    SolutionIndex: 216
    SolutionNameMin: Cijk_Alik_Bljk_HSS_BH_Bias_S_HA_S_SAV_UserArgs_MT224x192x64_MI16x16x1_SN_LDSB1_AFC1_AFEM1_AFEM1_ASEM1_CLR1_CADS0_DTVA0_DTVB0_EPS0_FDSI0_GRPM1_GRVWA8_GRVWB8_GSUn1_GSUAMBSK_GSUC1_GSUWGMRR1_GLS0_ISA942_IU1_K1_LBSPPA128_LBSPPB256_LBSPPM0_LPA16_LPB16_LPM0_LRVW8_LWPMn1_MIAV0_MIWT7_6_MO40_NTn1_NTA0_NTB0_NTC0_NTD4_NTM0_NEPBS7_NLCA1_NLCB1_ONLL1_PGR2_PLR1_PKA1_SIA3_SS1_SU16_SUM1_SUS128_SPO0_SRVW0_SSO0_SVW1_SK0_SKXCCM0_TLDS1_ULSGRO0_USL1_UIOFGRO0_USFGROn1_VSn1_VWA1_VWB2_WSGRA0_WSGRB0_WS64_WG32_8_1_WGM1_WGMXCC4_WGMXCCGn1
    SolutionIndex: 217
    SolutionNameMin: Cijk_Alik_Bljk_HSS_BH_Bias_S_HA_S_SAV_UserArgs_MT256x192x64_MI32x32x1_SN_LDSB1_AFC1_AFEM1_AFEM1_ASEM1_CLR1_CADS0_DTVA0_DTVB0_EPS0_FDSI0_GRPM1_GRVWA8_GRVWB8_GSUn1_GSUAMBSK_GSUC1_GSUWGMRR1_GLS0_ISA942_IU1_K1_LBSPPA512_LBSPPB128_LBSPPM0_LPA8_LPB8_LPM0_LRVW8_LWPMn1_MIAV0_MIWT4_3_MO40_NTn1_NTA0_NTB0_NTC0_NTD4_NTM0_NEPBS8_NLCA1_NLCB1_ONLL1_PGR2_PLR1_PKA1_SIA3_SS1_SU16_SUM1_SUS128_SPO0_SRVW0_SSO0_SVW4_SK0_SKXCCM0_TLDS1_ULSGRO0_USL1_UIOFGRO0_USFGROn1_VSn1_VWA4_VWB1_WSGRA0_WSGRB0_WS64_WG64_4_1_WGM1_WGMXCC4_WGMXCCGn1
    SolutionIndex: 218
    SolutionNameMin: Cijk_Alik_Bljk_HSS_BH_Bias_S_HA_S_SAV_UserArgs_MT256x192x64_MI16x16x1_SN_LDSB1_AFC1_AFEM1_AFEM1_ASEM1_CLR1_CADS0_DTVA0_DTVB0_EPS0_FDSI0_GRPM1_GRVWA8_GRVWB8_GSUn1_GSUAMBSK_GSUC1_GSUWGMRR1_GLS0_ISA942_IU1_K1_LBSPPA1024_LBSPPB256_LBSPPM0_LPA16_LPB16_LPM0_LRVW8_LWPMn1_MIAV0_MIWT8_6_MO40_NTn1_NTA0_NTB0_NTC0_NTD4_NTM0_NEPBS8_NLCA1_NLCB1_ONLL1_PGR2_PLR1_PKA1_SIA3_SS1_SU16_SUM1_SUS128_SPO0_SRVW0_SSO0_SVW8_SK0_SKXCCM0_TLDS1_ULSGRO0_USL1_UIOFGRO0_USFGROn1_VSn1_VWA8_VWB2_WSGRA0_WSGRB0_WS64_WG32_8_1_WGM1_WGMXCC4_WGMXCCGn1
    SolutionIndex: 219
    SolutionNameMin: Cijk_Alik_Bljk_HSS_BH_Bias_S_HA_S_SAV_UserArgs_MT256x96x64_MI32x32x1_SN_LDSB1_AFC1_AFEM1_AFEM1_ASEM1_CLR1_CADS0_DTVA0_DTVB0_EPS0_FDSI0_GRPM1_GRVWA8_GRVWB8_GSUn1_GSUAMBSK_GSUC1_GSUWGMRR1_GLS0_ISA942_IU1_K1_LBSPPA256_LBSPPB128_LBSPPM0_LPA8_LPB8_LPM0_LRVW8_LWPMn1_MIAV0_MIWT2_3_MO40_NTn1_NTA0_NTB0_NTC0_NTD4_NTM0_NEPBS8_NLCA1_NLCB1_ONLL1_PGR2_PLR1_PKA1_SIA3_SS1_SU16_SUM1_SUS128_SPO0_SRVW0_SSO0_SVW2_SK0_SKXCCM0_TLDS1_ULSGRO0_USL1_UIOFGRO0_USFGROn1_VSn1_VWA2_VWB1_WSGRA0_WSGRB0_WS64_WG128_2_1_WGM1_WGMXCC4_WGMXCCGn1
    SolutionIndex: 220
    SolutionNameMin: Cijk_Alik_Bljk_HSS_BH_Bias_S_HA_S_SAV_UserArgs_MT160x192x64_MI16x16x1_SN_LDSB1_AFC1_AFEM1_AFEM1_ASEM1_CLR1_CADS0_DTVA0_DTVB0_EPS0_FDSI0_GRPM1_GRVWA8_GRVWB8_GSUn1_GSUAMBSK_GSUC1_GSUWGMRR1_GLS0_ISA942_IU1_K1_LBSPPA256_LBSPPB128_LBSPPM0_LPA16_LPB16_LPM0_LRVW8_LWPMn1_MIAV0_MIWT10_3_MO40_NTn1_NTA0_NTB0_NTC0_NTD4_NTM0_NEPBS8_NLCA1_NLCB1_ONLL1_PGR2_PLR1_PKA1_SIA3_SS1_SU16_SUM1_SUS128_SPO0_SRVW0_SSO0_SVW2_SK0_SKXCCM0_TLDS1_ULSGRO0_USL1_UIOFGRO0_USFGROn1_VSn1_VWA2_VWB1_WSGRA0_WSGRB0_WS64_WG16_16_1_WGM1_WGMXCC4_WGMXCCGn1
    SolutionIndex: 221
    SolutionNameMin: Cijk_Alik_Bljk_HSS_BH_Bias_S_HA_S_SAV_UserArgs_MT192x192x64_MI16x16x1_SN_LDSB1_AFC1_AFEM1_AFEM1_ASEM1_CLR1_CADS0_DTVA0_DTVB0_EPS0_FDSI0_GRPM1_GRVWA8_GRVWB8_GSUn1_GSUAMBSK_GSUC1_GSUWGMRR1_GLS0_ISA942_IU1_K1_LBSPPA512_LBSPPB128_LBSPPM0_LPA16_LPB16_LPM0_LRVW8_LWPMn1_MIAV0_MIWT12_3_MO40_NTn1_NTA0_NTB0_NTC0_NTD4_NTM0_NEPBS8_NLCA1_NLCB1_ONLL1_PGR2_PLR1_PKA1_SIA3_SS1_SU16_SUM1_SUS128_SPO0_SRVW0_SSO0_SVW4_SK0_SKXCCM0_TLDS1_ULSGRO0_USL1_UIOFGRO0_USFGROn1_VSn1_VWA4_VWB1_WSGRA0_WSGRB0_WS64_WG16_16_1_WGM1_WGMXCC4_WGMXCCGn1
    SolutionIndex: 222
    SolutionNameMin: Cijk_Alik_Bljk_HSS_BH_Bias_S_HA_S_SAV_UserArgs_MT208x192x64_MI16x16x1_SN_LDSB1_AFC1_AFEM1_AFEM1_ASEM1_CLR1_CADS0_DTVA0_DTVB0_EPS0_FDSI0_GRPM1_GRVWA4_GRVWB8_GSUn1_GSUAMBSK_GSUC1_GSUWGMRR1_GLS0_ISA942_IU1_K1_LBSPPA128_LBSPPB128_LBSPPM0_LPA16_LPB16_LPM0_LRVW8_LWPMn1_MIAV0_MIWT13_3_MO40_NTn1_NTA0_NTB0_NTC0_NTD4_NTM0_NEPBS8_NLCA1_NLCB1_ONLL1_PGR2_PLR1_PKA1_SIA3_SS1_SU16_SUM1_SUS128_SPO0_SRVW0_SSO0_SVW1_SK0_SKXCCM0_TLDS1_ULSGRO0_USL1_UIOFGRO0_USFGROn1_VSn1_VWA1_VWB1_WSGRA0_WSGRB0_WS64_WG16_16_1_WGM1_WGMXCC4_WGMXCCGn1
    SolutionIndex: 223
    SolutionNameMin: Cijk_Alik_Bljk_HSS_BH_Bias_S_HA_S_SAV_UserArgs_MT224x192x64_MI16x16x1_SN_LDSB1_AFC1_AFEM1_AFEM1_ASEM1_CLR1_CADS0_DTVA0_DTVB0_EPS0_FDSI0_GRPM1_GRVWA8_GRVWB8_GSUn1_GSUAMBSK_GSUC1_GSUWGMRR1_GLS0_ISA942_IU1_K1_LBSPPA256_LBSPPB128_LBSPPM0_LPA16_LPB16_LPM0_LRVW8_LWPMn1_MIAV0_MIWT14_3_MO40_NTn1_NTA0_NTB0_NTC0_NTD4_NTM0_NEPBS8_NLCA1_NLCB1_ONLL1_PGR2_PLR1_PKA1_SIA3_SS1_SU16_SUM1_SUS128_SPO0_SRVW0_SSO0_SVW2_SK0_SKXCCM0_TLDS1_ULSGRO0_USL1_UIOFGRO0_USFGROn1_VSn1_VWA2_VWB1_WSGRA0_WSGRB0_WS64_WG16_16_1_WGM1_WGMXCC4_WGMXCCGn1
    SolutionIndex: 224
    SolutionNameMin: Cijk_Alik_Bljk_HSS_BH_Bias_S_HA_S_SAV_UserArgs_MT192x192x32_MI16x16x1_SN_LDSB1_AFC1_AFEM1_AFEM1_ASEM1_CLR1_CADS0_DTVA0_DTVB0_EPS0_FDSI0_GRPM1_GRVWA4_GRVWB4_GSUn1_GSUAMBSK_GSUC1_GSUWGMRR1_GLS0_ISA942_IU1_K1_LBSPPA256_LBSPPB128_LBSPPM0_LPA8_LPB8_LPM0_LRVW4_LWPMn1_MIAV0_MIWT12_3_MO40_NTn1_NTA0_NTB0_NTC0_NTD4_NTM0_NEPBS8_NLCA1_NLCB1_ONLL1_PGR2_PLR1_PKA1_SIA3_SS1_SU16_SUM1_SUS64_SPO0_SRVW0_SSO0_SVW4_SK0_SKXCCM0_TLDS1_ULSGRO0_USL1_UIOFGRO0_USFGROn1_VSn1_VWA4_VWB1_WSGRA0_WSGRB0_WS64_WG16_16_1_WGM1_WGMXCC4_WGMXCCGn1
    SolutionIndex: 225
    SolutionNameMin: Cijk_Alik_Bljk_HSS_BH_Bias_S_HA_S_SAV_UserArgs_MT336x192x32_MI16x16x1_SN_LDSB1_AFC1_AFEM1_AFEM1_ASEM1_CLR1_CADS0_DTVA0_DTVB0_EPS0_FDSI0_GRPM1_GRVWA2_GRVWB4_GSUn1_GSUAMBSK_GSUC1_GSUWGMRR1_GLS0_ISA942_IU1_K1_LBSPPA128_LBSPPB128_LBSPPM0_LPA4_LPB8_LPM0_LRVW4_LWPMn1_MIAV0_MIWT21_3_MO40_NTn1_NTA0_NTB0_NTC0_NTD4_NTM0_NEPBS8_NLCA1_NLCB1_ONLL1_PGR2_PLR1_PKA1_SIA3_SS1_SU16_SUM1_SUS64_SPO0_SRVW0_SSO0_SVW1_SK0_SKXCCM0_TLDS1_ULSGRO0_USL1_UIOFGRO0_USFGROn1_VSn1_VWA1_VWB1_WSGRA0_WSGRB0_WS64_WG16_16_1_WGM1_WGMXCC4_WGMXCCGn1
    SolutionIndex: 226
    SolutionNameMin: Cijk_Alik_Bljk_HSS_BH_Bias_S_HA_S_SAV_UserArgs_MT192x192x32_MI16x16x1_SN_LDSB1_AFC1_AFEM1_AFEM1_ASEM1_CLR1_CADS0_DTVA0_DTVB0_EPS0_FDSI0_GRPM1_GRVWA4_GRVWB4_GSUn1_GSUAMBSK_GSUC1_GSUWGMRR1_GLS0_ISA942_IU1_K1_LBSPPA128_LBSPPB128_LBSPPM0_LPA8_LPB8_LPM0_LRVW4_LWPMn1_MIAV0_MIWT6_6_MO40_NTn1_NTA0_NTB0_NTC0_NTD4_NTM0_NEPBS6_NLCA1_NLCB1_ONLL1_PGR2_PLR1_PKA1_SIA3_SS1_SU16_SUM1_SUS64_SPO0_SRVW0_SSO0_SVW2_SK0_SKXCCM0_TLDS1_ULSGRO0_USL1_UIOFGRO0_USFGROn1_VSn1_VWA2_VWB2_WSGRA0_WSGRB0_WS64_WG32_8_1_WGM1_WGMXCC4_WGMXCCGn1
    SolutionIndex: 227
    SolutionNameMin: Cijk_Alik_Bljk_HSS_BH_Bias_S_HA_S_SAV_UserArgs_MT192x192x64_MI32x32x1_SN_LDSB1_AFC1_AFEM1_AFEM1_ASEM1_CLR1_CADS0_DTVA0_DTVB0_EPS0_FDSI0_GRPM1_GRVWA8_GRVWB8_GSUn1_GSUAMBSK_GSUC1_GSUWGMRR1_GLS0_ISA942_IU1_K1_LBSPPA128_LBSPPB128_LBSPPM0_LPA8_LPB8_LPM0_LRVW8_LWPMn1_MIAV0_MIWT3_3_MO40_NTn1_NTA0_NTB0_NTC0_NTD4_NTM0_NEPBS6_NLCA1_NLCB1_ONLL1_PGR2_PLR1_PKA1_SIA3_SS1_SU16_SUM1_SUS128_SPO0_SRVW0_SSO0_SVW1_SK0_SKXCCM0_TLDS1_ULSGRO0_USL1_UIOFGRO0_USFGROn1_VSn1_VWA1_VWB1_WSGRA0_WSGRB0_WS64_WG64_4_1_WGM1_WGMXCC4_WGMXCCGn1
    SolutionIndex: 228
    SolutionNameMin: Cijk_Alik_Bljk_HSS_BH_Bias_S_HA_S_SAV_UserArgs_MT224x192x64_MI16x16x1_SN_LDSB1_AFC1_AFEM1_AFEM1_ASEM1_CLR1_CADS0_DTVA0_DTVB0_EPS0_FDSI0_GRPM1_GRVWA8_GRVWB8_GSUn1_GSUAMBSK_GSUC1_GSUWGMRR1_GLS0_ISA942_IU1_K1_LBSPPA256_LBSPPB128_LBSPPM0_LPA16_LPB16_LPM0_LRVW8_LWPMn1_MIAV0_MIWT14_3_MO40_NTn1_NTA0_NTB0_NTC0_NTD4_NTM0_NEPBS8_NLCA1_NLCB1_ONLL1_PGR2_PLR1_PKA1_SIA3_SS1_SU16_SUM1_SUS128_SPO0_SRVW0_SSO4_SVW2_SK0_SKXCCM0_TLDS1_ULSGRO0_USL1_UIOFGRO0_USFGROn1_VSn1_VWA2_VWB1_WSGRA0_WSGRB0_WS64_WG16_16_1_WGM1_WGMXCC4_WGMXCCGn1
    SolutionIndex: 229
    SolutionNameMin: Cijk_Alik_Bljk_HSS_BH_Bias_S_HA_S_SAV_UserArgs_MT288x192x64_MI16x16x1_SN_LDSB1_AFC1_AFEM1_AFEM1_ASEM1_CLR1_CADS0_DTVA0_DTVB0_EPS0_FDSI0_GRPM1_GRVWA8_GRVWB8_GSUn1_GSUAMBSK_GSUC1_GSUWGMRR1_GLS0_ISA942_IU1_K1_LBSPPA128_LBSPPB256_LBSPPM0_LPA4_LPB8_LPM0_LRVW8_LWPMn1_MIAV0_MIWT9_6_MO40_NTn1_NTA0_NTB0_NTC0_NTD4_NTM0_NEPBS8_NLCA1_NLCB1_ONLL1_PGR2_PLR1_PKA1_SIA3_SS1_SU16_SUM1_SUS128_SPO0_SRVW0_SSO4_SVW1_SK0_SKXCCM0_TLDS1_ULSGRO0_USL1_UIOFGRO0_USFGROn1_VSn1_VWA1_VWB2_WSGRA0_WSGRB0_WS64_WG32_8_1_WGM1_WGMXCC4_WGMXCCGn1
    SolutionIndex: 230
    SolutionNameMin: Cijk_Alik_Bljk_HSS_BH_Bias_S_HA_S_SAV_UserArgs_MT192x192x32_MI16x16x1_SN_LDSB1_AFC1_AFEM1_AFEM1_ASEM1_CLR1_CADS0_DTVA0_DTVB0_EPS0_FDSI0_GRPM1_GRVWA4_GRVWB4_GSUn1_GSUAMBSK_GSUC1_GSUWGMRR1_GLS0_ISA942_IU1_K1_LBSPPA256_LBSPPB128_LBSPPM0_LPA4_LPB4_LPM0_LRVW4_LWPMn1_MIAV0_MIWT12_3_MO40_NTn1_NTA0_NTB0_NTC0_NTD4_NTM0_NEPBS8_NLCA1_NLCB1_ONLL1_PGR2_PLR1_PKA1_SIA3_SS1_SU16_SUM1_SUS64_SPO0_SRVW0_SSO4_SVW4_SK0_SKXCCM0_TLDS1_ULSGRO0_USL1_UIOFGRO0_USFGROn1_VSn1_VWA4_VWB1_WSGRA0_WSGRB0_WS64_WG16_16_1_WGM1_WGMXCC4_WGMXCCGn1
    SolutionIndex: 231
    SolutionNameMin: Cijk_Alik_Bljk_HSS_BH_Bias_S_HA_S_SAV_UserArgs_MT192x192x64_MI16x16x1_SN_LDSB1_AFC1_AFEM1_AFEM1_ASEM1_CLR1_CADS0_DTVA0_DTVB0_EPS0_FDSI0_GRPM1_GRVWA8_GRVWB8_GSUn1_GSUAMBSK_GSUC1_GSUWGMRR1_GLS0_ISA942_IU1_K1_LBSPPA256_LBSPPB256_LBSPPM0_LPA16_LPB16_LPM0_LRVW8_LWPMn1_MIAV0_MIWT6_6_MO40_NTn1_NTA0_NTB0_NTC0_NTD4_NTM0_NEPBS6_NLCA1_NLCB1_ONLL1_PGR2_PLR1_PKA1_SIA3_SS1_SU16_SUM1_SUS128_SPO0_SRVW0_SSO4_SVW2_SK0_SKXCCM0_TLDS1_ULSGRO0_USL1_UIOFGRO0_USFGROn1_VSn1_VWA2_VWB2_WSGRA0_WSGRB0_WS64_WG32_8_1_WGM1_WGMXCC4_WGMXCCGn1
    SolutionIndex: 232
    SolutionNameMin: Cijk_Alik_Bljk_HSS_BH_Bias_S_HA_S_SAV_UserArgs_MT224x192x64_MI16x16x1_SN_LDSB1_AFC1_AFEM1_AFEM1_ASEM1_CLR1_CADS0_DTVA0_DTVB0_EPS0_FDSI0_GRPM1_GRVWA8_GRVWB8_GSUn1_GSUAMBSK_GSUC1_GSUWGMRR1_GLS0_ISA942_IU1_K1_LBSPPA128_LBSPPB256_LBSPPM0_LPA16_LPB16_LPM0_LRVW8_LWPMn1_MIAV0_MIWT7_6_MO40_NTn1_NTA0_NTB0_NTC0_NTD4_NTM0_NEPBS7_NLCA1_NLCB1_ONLL1_PGR2_PLR1_PKA1_SIA3_SS1_SU16_SUM1_SUS128_SPO0_SRVW0_SSO4_SVW1_SK0_SKXCCM0_TLDS1_ULSGRO0_USL1_UIOFGRO0_USFGROn1_VSn1_VWA1_VWB2_WSGRA0_WSGRB0_WS64_WG32_8_1_WGM1_WGMXCC4_WGMXCCGn1
    SolutionIndex: 233
    SolutionNameMin: Cijk_Alik_Bljk_HSS_BH_Bias_S_HA_S_SAV_UserArgs_MT192x192x64_MI16x16x1_SN_LDSB1_AFC1_AFEM1_AFEM1_ASEM1_CLR1_CADS0_DTVA0_DTVB0_EPS0_FDSI0_GRPM1_GRVWA8_GRVWB8_GSUn1_GSUAMBSK_GSUC1_GSUWGMRR1_GLS0_ISA942_IU1_K1_LBSPPA512_LBSPPB128_LBSPPM0_LPA16_LPB16_LPM0_LRVW8_LWPMn1_MIAV0_MIWT12_3_MO40_NTn1_NTA0_NTB0_NTC0_NTD4_NTM0_NEPBS8_NLCA1_NLCB1_ONLL1_PGR2_PLR1_PKA1_SIA3_SS1_SU16_SUM1_SUS128_SPO0_SRVW0_SSO4_SVW4_SK0_SKXCCM0_TLDS1_ULSGRO0_USL1_UIOFGRO0_USFGROn1_VSn1_VWA4_VWB1_WSGRA0_WSGRB0_WS64_WG16_16_1_WGM1_WGMXCC4_WGMXCCGn1
    SolutionIndex: 234
    SolutionNameMin: Cijk_Alik_Bljk_HSS_BH_Bias_S_HA_S_SAV_UserArgs_MT256x192x64_MI32x32x1_SN_LDSB1_AFC1_AFEM1_AFEM1_ASEM1_CLR1_CADS0_DTVA0_DTVB0_EPS0_FDSI0_GRPM1_GRVWA8_GRVWB8_GSUn1_GSUAMBSK_GSUC1_GSUWGMRR1_GLS0_ISA942_IU1_K1_LBSPPA512_LBSPPB128_LBSPPM0_LPA8_LPB8_LPM0_LRVW8_LWPMn1_MIAV0_MIWT4_3_MO40_NTn1_NTA0_NTB0_NTC0_NTD4_NTM0_NEPBS8_NLCA1_NLCB1_ONLL1_PGR2_PLR1_PKA1_SIA3_SS1_SU16_SUM1_SUS128_SPO0_SRVW0_SSO4_SVW4_SK0_SKXCCM0_TLDS1_ULSGRO0_USL1_UIOFGRO0_USFGROn1_VSn1_VWA4_VWB1_WSGRA0_WSGRB0_WS64_WG64_4_1_WGM1_WGMXCC4_WGMXCCGn1
    SolutionIndex: 235
    SolutionNameMin: Cijk_Alik_Bljk_HSS_BH_Bias_S_HA_S_SAV_UserArgs_MT160x224x64_MI16x16x1_SN_LDSB1_AFC1_AFEM1_AFEM1_ASEM1_CLR1_CADS0_DTVA0_DTVB0_EPS0_FDSI0_GRPM1_GRVWA8_GRVWB8_GSUn1_GSUAMBSK_GSUC1_GSUWGMRR1_GLS0_ISA942_IU1_K1_LBSPPA128_LBSPPB128_LBSPPM0_LPA16_LPB16_LPM0_LRVW8_LWPMn1_MIAV0_MIWT5_7_MO40_NTn1_NTA0_NTB0_NTC0_NTD4_NTM0_NEPBS5_NLCA1_NLCB1_ONLL1_PGR2_PLR1_PKA1_SIA3_SS1_SU16_SUM1_SUS128_SPO0_SRVW0_SSO0_SVW1_SK0_SKXCCM0_TLDS1_ULSGRO0_USL1_UIOFGRO0_USFGROn1_VSn1_VWA1_VWB1_WSGRA0_WSGRB0_WS64_WG32_8_1_WGM1_WGMXCC4_WGMXCCGn1
    SolutionIndex: 236
    SolutionNameMin: Cijk_Alik_Bljk_HSS_BH_Bias_S_HA_S_SAV_UserArgs_MT192x224x64_MI16x16x1_SN_LDSB1_AFC1_AFEM1_AFEM1_ASEM1_CLR1_CADS0_DTVA0_DTVB0_EPS0_FDSI0_GRPM1_GRVWA8_GRVWB8_GSUn1_GSUAMBSK_GSUC1_GSUWGMRR1_GLS0_ISA942_IU1_K1_LBSPPA256_LBSPPB128_LBSPPM0_LPA16_LPB16_LPM0_LRVW8_LWPMn1_MIAV0_MIWT6_7_MO40_NTn1_NTA0_NTB0_NTC0_NTD4_NTM0_NEPBS6_NLCA1_NLCB1_ONLL1_PGR2_PLR1_PKA1_SIA3_SS1_SU16_SUM1_SUS128_SPO0_SRVW0_SSO0_SVW2_SK0_SKXCCM0_TLDS1_ULSGRO0_USL1_UIOFGRO0_USFGROn1_VSn1_VWA2_VWB1_WSGRA0_WSGRB0_WS64_WG32_8_1_WGM1_WGMXCC4_WGMXCCGn1
    SolutionIndex: 237
    SolutionNameMin: Cijk_Alik_Bljk_HSS_BH_Bias_S_HA_S_SAV_UserArgs_MT64x32x128_MI32x32x1_SN_LDSB0_AFC1_AFEM1_AFEM1_ASEM1_CLR1_CADS0_DTVA0_DTVB0_EPS0_FDSI0_GRPM1_GRVWA8_GRVWB8_GSUn1_GSUAMBSK_GSUC1_GSUWGMRR1_GLS0_ISA942_IU1_K1_LBSPPA256_LBSPPB256_LBSPPM0_LPA8_LPB8_LPM0_LRVW8_LWPMn1_MIAV0_MIWT1_1_MO40_NTn1_NTA0_NTB0_NTC0_NTD4_NTM0_NEPBS8_NLCA1_NLCB1_ONLL1_PGR2_PLR1_PKA1_SIA3_SS1_SU16_SUM1_SUS256_SPO0_SRVW0_SSO0_SVW1_SK0_SKXCCM0_TLDS1_ULSGRO0_USL1_UIOFGRO0_USFGROn1_VSn1_VWA1_VWB1_WSGRA0_WSGRB0_WS64_WG64_2_2_WGM1_WGMXCC4_WGMXCCGn1
    SolutionIndex: 238
    SolutionNameMin: Cijk_Alik_Bljk_HSS_BH_Bias_S_HA_S_SAV_UserArgs_MT224x224x64_MI16x16x1_SN_LDSB1_AFC1_AFEM1_AFEM1_ASEM1_CLR1_CADS0_DTVA0_DTVB0_EPS0_FDSI0_GRPM1_GRVWA8_GRVWB8_GSUn1_GSUAMBSK_GSUC1_GSUWGMRR1_GLS0_ISA942_IU1_K1_LBSPPA128_LBSPPB128_LBSPPM0_LPA4_LPB4_LPM0_LRVW8_LWPMn1_MIAV0_MIWT7_7_MO40_NTn1_NTA0_NTB0_NTC0_NTD4_NTM0_NEPBS7_NLCA1_NLCB1_ONLL1_PGR2_PLR1_PKA1_SIA3_SS1_SU16_SUM1_SUS128_SPO0_SRVW0_SSO0_SVW1_SK0_SKXCCM0_TLDS1_ULSGRO0_USL1_UIOFGRO0_USFGROn1_VSn1_VWA1_VWB1_WSGRA0_WSGRB0_WS64_WG32_8_1_WGM1_WGMXCC4_WGMXCCGn1
    SolutionIndex: 239
    SolutionNameMin: Cijk_Alik_Bljk_HSS_BH_Bias_S_HA_S_SAV_UserArgs_MT64x32x128_MI32x32x1_SN_LDSB0_AFC1_AFEM1_AFEM1_ASEM1_CLR1_CADS0_DTVA0_DTVB0_EPS0_FDSI0_GRPM1_GRVWA8_GRVWB8_GSUn1_GSUAMBSK_GSUC1_GSUWGMRR1_GLS0_ISA942_IU1_K1_LBSPPA256_LBSPPB256_LBSPPM0_LPA8_LPB8_LPM0_LRVW8_LWPMn1_MIAV0_MIWT1_1_MO40_NTn1_NTA0_NTB0_NTC0_NTD4_NTM0_NEPBS8_NLCA1_NLCB1_ONLL1_PGR2_PLR1_PKA1_SIA3_SS1_SU16_SUM1_SUS256_SPO0_SRVW0_SSO0_SVW1_SK0_SKXCCM0_TLDS1_ULSGRO0_USL1_UIOFGRO0_USFGROn1_VSn1_VWA1_VWB1_WSGRA0_WSGRB0_WS64_WG64_2_1_WGM1_WGMXCC4_WGMXCCGn1
    SolutionIndex: 240
    SolutionNameMin: Cijk_Alik_Bljk_HSS_BH_Bias_S_HA_S_SAV_UserArgs_MT256x224x64_MI16x16x1_SN_LDSB1_AFC1_AFEM1_AFEM1_ASEM1_CLR1_CADS0_DTVA0_DTVB0_EPS0_FDSI0_GRPM1_GRVWA8_GRVWB8_GSUn1_GSUAMBSK_GSUC1_GSUWGMRR1_GLS0_ISA942_IU1_K1_LBSPPA512_LBSPPB256_LBSPPM0_LPA4_LPB8_LPM0_LRVW8_LWPMn1_MIAV0_MIWT4_14_MO40_NTn1_NTA0_NTB0_NTC0_NTD4_NTM0_NEPBS8_NLCA1_NLCB1_ONLL1_PGR2_PLR1_PKA1_SIA3_SS1_SU16_SUM1_SUS128_SPO0_SRVW0_SSO0_SVW4_SK0_SKXCCM0_TLDS1_ULSGRO0_USL1_UIOFGRO0_USFGROn1_VSn1_VWA4_VWB2_WSGRA0_WSGRB0_WS64_WG64_4_1_WGM1_WGMXCC4_WGMXCCGn1
    SolutionIndex: 241
    SolutionNameMin: Cijk_Alik_Bljk_HSS_BH_Bias_S_HA_S_SAV_UserArgs_MT128x224x64_MI16x16x1_SN_LDSB1_AFC1_AFEM1_AFEM1_ASEM1_CLR1_CADS0_DTVA0_DTVB0_EPS0_FDSI0_GRPM1_GRVWA8_GRVWB8_GSUn1_GSUAMBSK_GSUC1_GSUWGMRR1_GLS0_ISA942_IU1_K1_LBSPPA256_LBSPPB256_LBSPPM0_LPA16_LPB16_LPM0_LRVW8_LWPMn1_MIAV0_MIWT2_14_MO40_NTn1_NTA0_NTB0_NTC0_NTD4_NTM0_NEPBS8_NLCA1_NLCB1_ONLL1_PGR2_PLR1_PKA1_SIA3_SS1_SU16_SUM1_SUS128_SPO0_SRVW0_SSO0_SVW2_SK0_SKXCCM0_TLDS1_ULSGRO0_USL1_UIOFGRO0_USFGROn1_VSn1_VWA2_VWB2_WSGRA0_WSGRB0_WS64_WG64_4_1_WGM1_WGMXCC4_WGMXCCGn1
    SolutionIndex: 242
    SolutionNameMin: Cijk_Alik_Bljk_HSS_BH_Bias_S_HA_S_SAV_UserArgs_MT192x224x64_MI16x16x1_SN_LDSB1_AFC1_AFEM1_AFEM1_ASEM1_CLR1_CADS0_DTVA0_DTVB0_EPS0_FDSI0_GRPM1_GRVWA8_GRVWB8_GSUn1_GSUAMBSK_GSUC1_GSUWGMRR1_GLS0_ISA942_IU1_K1_LBSPPA128_LBSPPB256_LBSPPM0_LPA16_LPB16_LPM0_LRVW8_LWPMn1_MIAV0_MIWT3_14_MO40_NTn1_NTA0_NTB0_NTC0_NTD4_NTM0_NEPBS6_NLCA1_NLCB1_ONLL1_PGR2_PLR1_PKA1_SIA3_SS1_SU16_SUM1_SUS128_SPO0_SRVW0_SSO0_SVW1_SK0_SKXCCM0_TLDS1_ULSGRO0_USL1_UIOFGRO0_USFGROn1_VSn1_VWA1_VWB2_WSGRA0_WSGRB0_WS64_WG64_4_1_WGM1_WGMXCC4_WGMXCCGn1
    SolutionIndex: 243
    SolutionNameMin: Cijk_Alik_Bljk_HSS_BH_Bias_S_HA_S_SAV_UserArgs_MT128x224x64_MI16x16x1_SN_LDSB1_AFC1_AFEM1_AFEM1_ASEM1_CLR1_CADS0_DTVA0_DTVB0_EPS0_FDSI0_GRPM1_GRVWA8_GRVWB8_GSUn1_GSUAMBSK_GSUC1_GSUWGMRR1_GLS0_ISA942_IU1_K1_LBSPPA512_LBSPPB128_LBSPPM0_LPA16_LPB16_LPM0_LRVW8_LWPMn1_MIAV0_MIWT4_7_MO40_NTn1_NTA0_NTB0_NTC0_NTD4_NTM0_NEPBS8_NLCA1_NLCB1_ONLL1_PGR2_PLR1_PKA1_SIA3_SS1_SU16_SUM1_SUS128_SPO0_SRVW0_SSO0_SVW4_SK0_SKXCCM0_TLDS1_ULSGRO0_USL1_UIOFGRO0_USFGROn1_VSn1_VWA4_VWB1_WSGRA0_WSGRB0_WS64_WG32_8_1_WGM1_WGMXCC4_WGMXCCGn1
    SolutionIndex: 244
    SolutionNameMin: Cijk_Alik_Bljk_HSS_BH_Bias_S_HA_S_SAV_UserArgs_MT256x224x64_MI16x16x1_SN_LDSB1_AFC1_AFEM1_AFEM1_ASEM1_CLR1_CADS0_DTVA0_DTVB0_EPS0_FDSI0_GRPM1_GRVWA8_GRVWB8_GSUn1_GSUAMBSK_GSUC1_GSUWGMRR1_GLS0_ISA942_IU1_K1_LBSPPA1024_LBSPPB128_LBSPPM0_LPA4_LPB8_LPM0_LRVW8_LWPMn1_MIAV0_MIWT8_7_MO40_NTn1_NTA0_NTB0_NTC0_NTD4_NTM0_NEPBS8_NLCA1_NLCB1_ONLL1_PGR2_PLR1_PKA1_SIA3_SS1_SU16_SUM1_SUS128_SPO0_SRVW0_SSO0_SVW8_SK0_SKXCCM0_TLDS1_ULSGRO0_USL1_UIOFGRO0_USFGROn1_VSn1_VWA8_VWB1_WSGRA0_WSGRB0_WS64_WG32_8_1_WGM1_WGMXCC4_WGMXCCGn1
    SolutionIndex: 245
    SolutionNameMin: Cijk_Alik_Bljk_HSS_BH_Bias_S_HA_S_SAV_UserArgs_MT128x128x64_MI16x16x1_SN_LDSB1_AFC1_AFEM1_AFEM1_ASEM1_CLR1_CADS0_DTVA0_DTVB0_EPS0_FDSI0_GRPM1_GRVWA8_GRVWB8_GSUn1_GSUAMBSK_GSUC1_GSUWGMRR1_GLS0_ISA942_IU1_K1_LBSPPA256_LBSPPB1024_LBSPPM0_LPA16_LPB16_LPM0_LRVW8_LWPMn1_MIAV0_MIWT2_8_MO40_NTn1_NTA0_NTB0_NTC0_NTD4_NTM0_NEPBS8_NLCA1_NLCB1_ONLL1_PGR2_PLR1_PKA1_SIA3_SS1_SU16_SUM1_SUS128_SPO0_SRVW0_SSO0_SVW2_SK0_SKXCCM0_TLDS1_ULSGRO0_USL1_UIOFGRO0_USFGROn1_VSn1_VWA2_VWB8_WSGRA0_WSGRB0_WS64_WG64_4_1_WGM1_WGMXCC4_WGMXCCGn1
    SolutionIndex: 246
    SolutionNameMin: Cijk_Alik_Bljk_HSS_BH_Bias_S_HA_S_SAV_UserArgs_MT176x128x64_MI16x16x1_SN_LDSB1_AFC1_AFEM1_AFEM1_ASEM1_CLR1_CADS0_DTVA0_DTVB0_EPS0_FDSI0_GRPM1_GRVWA4_GRVWB8_GSUn1_GSUAMBSK_GSUC1_GSUWGMRR1_GLS0_ISA942_IU1_K1_LBSPPA128_LBSPPB256_LBSPPM0_LPA16_LPB16_LPM0_LRVW8_LWPMn1_MIAV0_MIWT11_2_MO40_NTn1_NTA0_NTB0_NTC0_NTD4_NTM0_NEPBS8_NLCA1_NLCB1_ONLL1_PGR2_PLR1_PKA1_SIA3_SS1_SU16_SUM1_SUS128_SPO0_SRVW0_SSO0_SVW1_SK0_SKXCCM0_TLDS1_ULSGRO0_USL1_UIOFGRO0_USFGROn1_VSn1_VWA1_VWB2_WSGRA0_WSGRB0_WS64_WG16_16_1_WGM1_WGMXCC4_WGMXCCGn1
    SolutionIndex: 247
    SolutionNameMin: Cijk_Alik_Bljk_HSS_BH_Bias_S_HA_S_SAV_UserArgs_MT128x224x64_MI32x32x1_SN_LDSB1_AFC1_AFEM1_AFEM1_ASEM1_CLR1_CADS0_DTVA0_DTVB0_EPS0_FDSI0_GRPM1_GRVWA8_GRVWB8_GSUn1_GSUAMBSK_GSUC1_GSUWGMRR1_GLS0_ISA942_IU1_K1_LBSPPA128_LBSPPB128_LBSPPM0_LPA8_LPB8_LPM0_LRVW8_LWPMn1_MIAV0_MIWT1_7_MO40_NTn1_NTA0_NTB0_NTC0_NTD4_NTM0_NEPBS8_NLCA1_NLCB1_ONLL1_PGR2_PLR1_PKA1_SIA3_SS1_SU16_SUM1_SUS128_SPO0_SRVW0_SSO0_SVW1_SK0_SKXCCM0_TLDS1_ULSGRO0_USL1_UIOFGRO0_USFGROn1_VSn1_VWA1_VWB1_WSGRA0_WSGRB0_WS64_WG128_2_1_WGM1_WGMXCC4_WGMXCCGn1
    SolutionIndex: 248
    SolutionNameMin: Cijk_Alik_Bljk_HSS_BH_Bias_S_HA_S_SAV_UserArgs_MT288x224x32_MI16x16x1_SN_LDSB1_AFC1_AFEM1_AFEM1_ASEM1_CLR1_CADS0_DTVA0_DTVB0_EPS0_FDSI0_GRPM1_GRVWA4_GRVWB4_GSUn1_GSUAMBSK_GSUC1_GSUWGMRR1_GLS0_ISA942_IU1_K1_LBSPPA128_LBSPPB128_LBSPPM0_LPA4_LPB4_LPM0_LRVW4_LWPMn1_MIAV0_MIWT9_7_MO40_NTn1_NTA0_NTB0_NTC0_NTD4_NTM0_NEPBS8_NLCA1_NLCB1_ONLL1_PGR2_PLR1_PKA1_SIA3_SS1_SU16_SUM1_SUS64_SPO0_SRVW0_SSO0_SVW1_SK0_SKXCCM0_TLDS1_ULSGRO0_USL1_UIOFGRO0_USFGROn1_VSn1_VWA1_VWB1_WSGRA0_WSGRB0_WS64_WG32_8_1_WGM1_WGMXCC4_WGMXCCGn1
    SolutionIndex: 249
    SolutionNameMin: Cijk_Alik_Bljk_HSS_BH_Bias_S_HA_S_SAV_UserArgs_MT192x224x32_MI16x16x1_SN_LDSB1_AFC1_AFEM1_AFEM1_ASEM1_CLR1_CADS0_DTVA0_DTVB0_EPS0_FDSI0_GRPM1_GRVWA4_GRVWB4_GSUn1_GSUAMBSK_GSUC1_GSUWGMRR1_GLS0_ISA942_IU1_K1_LBSPPA128_LBSPPB128_LBSPPM0_LPA4_LPB4_LPM0_LRVW4_LWPMn1_MIAV0_MIWT6_7_MO40_NTn1_NTA0_NTB0_NTC0_NTD4_NTM0_NEPBS6_NLCA1_NLCB1_ONLL1_PGR2_PLR1_PKA1_SIA3_SS1_SU16_SUM1_SUS64_SPO0_SRVW0_SSO4_SVW2_SK0_SKXCCM0_TLDS1_ULSGRO0_USL1_UIOFGRO0_USFGROn1_VSn1_VWA2_VWB1_WSGRA0_WSGRB0_WS64_WG32_8_1_WGM1_WGMXCC4_WGMXCCGn1
    SolutionIndex: 250
    SolutionNameMin: Cijk_Alik_Bljk_HSS_BH_Bias_S_HA_S_SAV_UserArgs_MT192x224x64_MI16x16x1_SN_LDSB1_AFC1_AFEM1_AFEM1_ASEM1_CLR1_CADS0_DTVA0_DTVB0_EPS0_FDSI0_GRPM1_GRVWA8_GRVWB8_GSUn1_GSUAMBSK_GSUC1_GSUWGMRR1_GLS0_ISA942_IU1_K1_LBSPPA256_LBSPPB128_LBSPPM0_LPA16_LPB16_LPM0_LRVW8_LWPMn1_MIAV0_MIWT6_7_MO40_NTn1_NTA0_NTB0_NTC0_NTD4_NTM0_NEPBS6_NLCA1_NLCB1_ONLL1_PGR2_PLR1_PKA1_SIA3_SS1_SU16_SUM1_SUS128_SPO0_SRVW0_SSO4_SVW2_SK0_SKXCCM0_TLDS1_ULSGRO0_USL1_UIOFGRO0_USFGROn1_VSn1_VWA2_VWB1_WSGRA0_WSGRB0_WS64_WG32_8_1_WGM1_WGMXCC4_WGMXCCGn1
    SolutionIndex: 251
    SolutionNameMin: Cijk_Alik_Bljk_HSS_BH_Bias_S_HA_S_SAV_UserArgs_MT256x224x64_MI16x16x1_SN_LDSB1_AFC1_AFEM1_AFEM1_ASEM1_CLR1_CADS0_DTVA0_DTVB0_EPS0_FDSI0_GRPM1_GRVWA8_GRVWB8_GSUn1_GSUAMBSK_GSUC1_GSUWGMRR1_GLS0_ISA942_IU1_K1_LBSPPA1024_LBSPPB128_LBSPPM0_LPA4_LPB8_LPM0_LRVW8_LWPMn1_MIAV0_MIWT8_7_MO40_NTn1_NTA0_NTB0_NTC0_NTD4_NTM0_NEPBS8_NLCA1_NLCB1_ONLL1_PGR2_PLR1_PKA1_SIA3_SS1_SU16_SUM1_SUS128_SPO0_SRVW0_SSO4_SVW8_SK0_SKXCCM0_TLDS1_ULSGRO0_USL1_UIOFGRO0_USFGROn1_VSn1_VWA8_VWB1_WSGRA0_WSGRB0_WS64_WG32_8_1_WGM1_WGMXCC4_WGMXCCGn1
    SolutionIndex: 252
    SolutionNameMin: Cijk_Alik_Bljk_HSS_BH_Bias_S_HA_S_SAV_UserArgs_MT64x64x128_MI16x16x1_SN_LDSB1_AFC1_AFEM1_AFEM1_ASEM1_CLR1_CADS0_DTVA0_DTVB0_EPS0_FDSI0_GRPM1_GRVWA8_GRVWB8_GSUn1_GSUAMBSK_GSUC1_GSUWGMRR1_GLS0_ISA942_IU1_K1_LBSPPA256_LBSPPB1024_LBSPPM0_LPA16_LPB16_LPM0_LRVW8_LWPMn1_MIAV0_MIWT1_4_MO40_NTn1_NTA0_NTB0_NTC0_NTD4_NTM0_NEPBS8_NLCA1_NLCB1_ONLL1_PGR2_PLR1_PKA1_SIA3_SS1_SU16_SUM1_SUS256_SPO0_SRVW0_SSO0_SVW1_SK0_SKXCCM0_TLDS1_ULSGRO0_USL1_UIOFGRO0_USFGROn1_VSn1_VWA1_VWB4_WSGRA0_WSGRB0_WS64_WG64_4_1_WGM1_WGMXCC4_WGMXCCGn1
    SolutionIndex: 253
    SolutionNameMin: Cijk_Alik_Bljk_HSS_BH_Bias_S_HA_S_SAV_UserArgs_MT16x64x128_MI16x16x1_SN_LDSB0_AFC1_AFEM1_AFEM1_ASEM1_CLR1_CADS0_DTVA0_DTVB0_EPS0_FDSI0_GRPM1_GRVWA8_GRVWB8_GSUn1_GSUAMBSK_GSUC1_GSUWGMRR1_GLS0_ISA942_IU1_K1_LBSPPA256_LBSPPB256_LBSPPM0_LPA16_LPB16_LPM0_LRVW8_LWPMn1_MIAV0_MIWT1_1_MO40_NTn1_NTA0_NTB0_NTC0_NTD4_NTM0_NEPBS8_NLCA1_NLCB1_ONLL1_PGR2_PLR1_PKA1_SIA3_SS1_SU16_SUM1_SUS256_SPO0_SRVW0_SSO0_SVW1_SK0_SKXCCM0_TLDS1_ULSGRO0_USL1_UIOFGRO0_USFGROn1_VSn1_VWA1_VWB1_WSGRA0_WSGRB0_WS64_WG16_16_1_WGM1_WGMXCC4_WGMXCCGn1
    SolutionIndex: 254
    SolutionNameMin: Cijk_Alik_Bljk_HSS_BH_Bias_S_HA_S_SAV_UserArgs_MT64x128x64_MI16x16x1_SN_LDSB1_AFC1_AFEM1_AFEM1_ASEM1_CLR1_CADS0_DTVA0_DTVB0_EPS0_FDSI0_GRPM1_GRVWA8_GRVWB8_GSUn1_GSUAMBSK_GSUC1_GSUWGMRR1_GLS0_ISA942_IU1_K1_LBSPPA256_LBSPPB512_LBSPPM0_LPA16_LPB16_LPM0_LRVW8_LWPMn1_MIAV0_MIWT2_4_MO40_NTn1_NTA0_NTB0_NTC0_NTD4_NTM0_NEPBS8_NLCA1_NLCB1_ONLL1_PGR2_PLR1_PKA1_SIA3_SS1_SU16_SUM1_SUS128_SPO0_SRVW0_SSO0_SVW2_SK0_SKXCCM0_TLDS1_ULSGRO0_USL1_UIOFGRO0_USFGROn1_VSn1_VWA2_VWB4_WSGRA0_WSGRB0_WS64_WG32_8_1_WGM1_WGMXCC4_WGMXCCGn1
    SolutionIndex: 255
    SolutionNameMin: Cijk_Alik_Bljk_HSS_BH_Bias_S_HA_S_SAV_UserArgs_MT224x256x64_MI16x16x1_SN_LDSB1_AFC1_AFEM1_AFEM1_ASEM1_CLR1_CADS0_DTVA0_DTVB0_EPS0_FDSI0_GRPM1_GRVWA8_GRVWB8_GSUn1_GSUAMBSK_GSUC1_GSUWGMRR1_GLS0_ISA942_IU1_K1_LBSPPA256_LBSPPB512_LBSPPM0_LPA4_LPB8_LPM0_LRVW8_LWPMn1_MIAV0_MIWT14_4_MO40_NTn1_NTA0_NTB0_NTC0_NTD4_NTM0_NEPBS8_NLCA1_NLCB1_ONLL1_PGR2_PLR1_PKA1_SIA3_SS1_SU16_SUM1_SUS128_SPO0_SRVW0_SSO0_SVW2_SK0_SKXCCM0_TLDS1_ULSGRO0_USL1_UIOFGRO0_USFGROn1_VSn1_VWA2_VWB4_WSGRA0_WSGRB0_WS64_WG16_16_1_WGM1_WGMXCC4_WGMXCCGn1
    SolutionIndex: 256
    SolutionNameMin: Cijk_Alik_Bljk_HSS_BH_Bias_S_HA_S_SAV_UserArgs_MT192x160x64_MI16x16x1_SN_LDSB1_AFC1_AFEM1_AFEM1_ASEM1_CLR1_CADS0_DTVA0_DTVB0_EPS0_FDSI0_GRPM1_GRVWA8_GRVWB8_GSUn1_GSUAMBSK_GSUC1_GSUWGMRR1_GLS0_ISA942_IU1_K1_LBSPPA128_LBSPPB256_LBSPPM0_LPA16_LPB16_LPM0_LRVW8_LWPMn1_MIAV0_MIWT3_10_MO40_NTn1_NTA0_NTB0_NTC0_NTD4_NTM0_NEPBS6_NLCA1_NLCB1_ONLL1_PGR2_PLR1_PKA1_SIA3_SS1_SU16_SUM1_SUS128_SPO0_SRVW0_SSO0_SVW1_SK0_SKXCCM0_TLDS1_ULSGRO0_USL1_UIOFGRO0_USFGROn1_VSn1_VWA1_VWB2_WSGRA0_WSGRB0_WS64_WG64_4_1_WGM1_WGMXCC4_WGMXCCGn1
    SolutionIndex: 257
    SolutionNameMin: Cijk_Alik_Bljk_HSS_BH_Bias_S_HA_S_SAV_UserArgs_MT64x128x64_MI32x32x1_SN_LDSB0_AFC1_AFEM1_AFEM1_ASEM1_CLR1_CADS0_DTVA0_DTVB0_EPS0_FDSI0_GRPM1_GRVWA8_GRVWB8_GSUn1_GSUAMBSK_GSUC1_GSUWGMRR1_GLS0_ISA942_IU1_K1_LBSPPA256_LBSPPB128_LBSPPM0_LPA8_LPB8_LPM0_LRVW8_LWPMn1_MIAV0_MIWT2_1_MO40_NTn1_NTA0_NTB0_NTC0_NTD4_NTM0_NEPBS8_NLCA1_NLCB1_ONLL1_PGR2_PLR1_PKA1_SIA3_SS1_SU16_SUM1_SUS128_SPO0_SRVW0_SSO0_SVW2_SK0_SKXCCM0_TLDS1_ULSGRO0_USL1_UIOFGRO0_USFGROn1_VSn1_VWA2_VWB1_WSGRA0_WSGRB0_WS64_WG32_8_1_WGM1_WGMXCC4_WGMXCCGn1
    SolutionIndex: 258
    SolutionNameMin: Cijk_Alik_Bljk_HSS_BH_Bias_S_HA_S_SAV_UserArgs_MT160x256x64_MI16x16x1_SN_LDSB1_AFC1_AFEM1_AFEM1_ASEM1_CLR1_CADS0_DTVA0_DTVB0_EPS0_FDSI0_GRPM1_GRVWA8_GRVWB8_GSUn1_GSUAMBSK_GSUC1_GSUWGMRR1_GLS0_ISA942_IU1_K1_LBSPPA128_LBSPPB1024_LBSPPM0_LPA16_LPB16_LPM0_LRVW8_LWPMn1_MIAV0_MIWT5_8_MO40_NTn1_NTA0_NTB0_NTC0_NTD4_NTM0_NEPBS5_NLCA1_NLCB1_ONLL1_PGR2_PLR1_PKA1_SIA3_SS1_SU16_SUM1_SUS128_SPO0_SRVW0_SSO0_SVW1_SK0_SKXCCM0_TLDS1_ULSGRO0_USL1_UIOFGRO0_USFGROn1_VSn1_VWA1_VWB8_WSGRA0_WSGRB0_WS64_WG32_8_1_WGM1_WGMXCC4_WGMXCCGn1
    SolutionIndex: 259
    SolutionNameMin: Cijk_Alik_Bljk_HSS_BH_Bias_S_HA_S_SAV_UserArgs_MT128x256x64_MI16x16x1_SN_LDSB1_AFC1_AFEM1_AFEM1_ASEM1_CLR1_CADS0_DTVA0_DTVB0_EPS0_FDSI0_GRPM1_GRVWA8_GRVWB8_GSUn1_GSUAMBSK_GSUC1_GSUWGMRR1_GLS0_ISA942_IU1_K1_LBSPPA256_LBSPPB1024_LBSPPM0_LPA16_LPB16_LPM0_LRVW8_LWPMn1_MIAV0_MIWT2_16_MO40_NTn1_NTA0_NTB0_NTC0_NTD4_NTM0_NEPBS8_NLCA1_NLCB1_ONLL1_PGR2_PLR1_PKA1_SIA3_SS1_SU16_SUM1_SUS128_SPO0_SRVW0_SSO0_SVW2_SK0_SKXCCM0_TLDS1_ULSGRO0_USL1_UIOFGRO0_USFGROn1_VSn1_VWA2_VWB8_WSGRA0_WSGRB0_WS64_WG64_4_1_WGM1_WGMXCC4_WGMXCCGn1
    SolutionIndex: 260
    SolutionNameMin: Cijk_Alik_Bljk_HSS_BH_Bias_S_HA_S_SAV_UserArgs_MT128x64x64_MI32x32x1_SN_LDSB0_AFC1_AFEM1_AFEM1_ASEM1_CLR1_CADS0_DTVA0_DTVB0_EPS0_FDSI0_GRPM1_GRVWA8_GRVWB8_GSUn1_GSUAMBSK_GSUC1_GSUWGMRR1_GLS0_ISA942_IU1_K1_LBSPPA128_LBSPPB256_LBSPPM0_LPA8_LPB8_LPM0_LRVW8_LWPMn1_MIAV0_MIWT1_2_MO40_NTn1_NTA0_NTB0_NTC0_NTD4_NTM0_NEPBS8_NLCA1_NLCB1_ONLL1_PGR2_PLR1_PKA1_SIA3_SS1_SU16_SUM1_SUS128_SPO0_SRVW0_SSO0_SVW1_SK0_SKXCCM0_TLDS1_ULSGRO0_USL1_UIOFGRO0_USFGROn1_VSn1_VWA1_VWB2_WSGRA0_WSGRB0_WS64_WG128_2_1_WGM1_WGMXCC4_WGMXCCGn1
    SolutionIndex: 261
    SolutionNameMin: Cijk_Alik_Bljk_HSS_BH_Bias_S_HA_S_SAV_UserArgs_MT112x320x64_MI16x16x1_SN_LDSB1_AFC1_AFEM1_AFEM1_ASEM1_CLR1_CADS0_DTVA0_DTVB0_EPS0_FDSI0_GRPM1_GRVWA4_GRVWB8_GSUn1_GSUAMBSK_GSUC1_GSUWGMRR1_GLS0_ISA942_IU1_K1_LBSPPA128_LBSPPB128_LBSPPM0_LPA4_LPB8_LPM0_LRVW8_LWPMn1_MIAV0_MIWT7_5_MO40_NTn1_NTA0_NTB0_NTC0_NTD4_NTM0_NEPBS7_NLCA1_NLCB1_ONLL1_PGR2_PLR1_PKA1_SIA3_SS1_SU16_SUM1_SUS128_SPO0_SRVW0_SSO0_SVW1_SK0_SKXCCM0_TLDS1_ULSGRO0_USL1_UIOFGRO0_USFGROn1_VSn1_VWA1_VWB1_WSGRA0_WSGRB0_WS64_WG16_16_1_WGM1_WGMXCC4_WGMXCCGn1
    SolutionIndex: 262
    SolutionNameMin: Cijk_Alik_Bljk_HSS_BH_Bias_S_HA_S_SAV_UserArgs_MT192x256x64_MI16x16x1_SN_LDSB1_AFC1_AFEM1_AFEM1_ASEM1_CLR1_CADS0_DTVA0_DTVB0_EPS0_FDSI0_GRPM1_GRVWA8_GRVWB8_GSUn1_GSUAMBSK_GSUC1_GSUWGMRR1_GLS0_ISA942_IU1_K1_LBSPPA256_LBSPPB1024_LBSPPM0_LPA16_LPB16_LPM0_LRVW8_LWPMn1_MIAV0_MIWT6_8_MO40_NTn1_NTA0_NTB0_NTC0_NTD4_NTM0_NEPBS6_NLCA1_NLCB1_ONLL1_PGR2_PLR1_PKA1_SIA3_SS1_SU16_SUM1_SUS128_SPO0_SRVW0_SSO0_SVW2_SK0_SKXCCM0_TLDS1_ULSGRO0_USL1_UIOFGRO0_USFGROn1_VSn1_VWA2_VWB8_WSGRA0_WSGRB0_WS64_WG32_8_1_WGM1_WGMXCC4_WGMXCCGn1
    SolutionIndex: 263
    SolutionNameMin: Cijk_Alik_Bljk_HSS_BH_Bias_S_HA_S_SAV_UserArgs_MT192x256x64_MI16x16x1_SN_LDSB1_AFC1_AFEM1_AFEM1_ASEM1_CLR1_CADS0_DTVA0_DTVB0_EPS0_FDSI0_GRPM1_GRVWA8_GRVWB8_GSUn1_GSUAMBSK_GSUC1_GSUWGMRR1_GLS0_ISA942_IU1_K1_LBSPPA128_LBSPPB1024_LBSPPM0_LPA16_LPB16_LPM0_LRVW8_LWPMn1_MIAV0_MIWT3_16_MO40_NTn1_NTA0_NTB0_NTC0_NTD4_NTM0_NEPBS6_NLCA1_NLCB1_ONLL1_PGR2_PLR1_PKA1_SIA3_SS1_SU16_SUM1_SUS128_SPO0_SRVW0_SSO0_SVW1_SK0_SKXCCM0_TLDS1_ULSGRO0_USL1_UIOFGRO0_USFGROn1_VSn1_VWA1_VWB8_WSGRA0_WSGRB0_WS64_WG64_4_1_WGM1_WGMXCC4_WGMXCCGn1
    SolutionIndex: 264
    SolutionNameMin: Cijk_Alik_Bljk_HSS_BH_Bias_S_HA_S_SAV_UserArgs_MT224x256x64_MI16x16x1_SN_LDSB1_AFC1_AFEM1_AFEM1_ASEM1_CLR1_CADS0_DTVA0_DTVB0_EPS0_FDSI0_GRPM1_GRVWA8_GRVWB8_GSUn1_GSUAMBSK_GSUC1_GSUWGMRR1_GLS0_ISA942_IU1_K1_LBSPPA128_LBSPPB1024_LBSPPM0_LPA4_LPB8_LPM0_LRVW8_LWPMn1_MIAV0_MIWT7_8_MO40_NTn1_NTA0_NTB0_NTC0_NTD4_NTM0_NEPBS7_NLCA1_NLCB1_ONLL1_PGR2_PLR1_PKA1_SIA3_SS1_SU16_SUM1_SUS128_SPO0_SRVW0_SSO0_SVW1_SK0_SKXCCM0_TLDS1_ULSGRO0_USL1_UIOFGRO0_USFGROn1_VSn1_VWA1_VWB8_WSGRA0_WSGRB0_WS64_WG32_8_1_WGM1_WGMXCC4_WGMXCCGn1
    SolutionIndex: 265
    SolutionNameMin: Cijk_Alik_Bljk_HSS_BH_Bias_S_HA_S_SAV_UserArgs_MT192x256x64_MI32x32x1_SN_LDSB1_AFC1_AFEM1_AFEM1_ASEM1_CLR1_CADS0_DTVA0_DTVB0_EPS0_FDSI0_GRPM1_GRVWA8_GRVWB8_GSUn1_GSUAMBSK_GSUC1_GSUWGMRR1_GLS0_ISA942_IU1_K1_LBSPPA128_LBSPPB512_LBSPPM0_LPA8_LPB8_LPM0_LRVW8_LWPMn1_MIAV0_MIWT3_4_MO40_NTn1_NTA0_NTB0_NTC0_NTD4_NTM0_NEPBS6_NLCA1_NLCB1_ONLL1_PGR2_PLR1_PKA1_SIA3_SS1_SU16_SUM1_SUS128_SPO0_SRVW0_SSO0_SVW1_SK0_SKXCCM0_TLDS1_ULSGRO0_USL1_UIOFGRO0_USFGROn1_VSn1_VWA1_VWB4_WSGRA0_WSGRB0_WS64_WG64_4_1_WGM1_WGMXCC4_WGMXCCGn1
    SolutionIndex: 266
    SolutionNameMin: Cijk_Alik_Bljk_HSS_BH_Bias_S_HA_S_SAV_UserArgs_MT176x256x64_MI16x16x1_SN_LDSB1_AFC1_AFEM1_AFEM1_ASEM1_CLR1_CADS0_DTVA0_DTVB0_EPS0_FDSI0_GRPM1_GRVWA4_GRVWB8_GSUn1_GSUAMBSK_GSUC1_GSUWGMRR1_GLS0_ISA942_IU1_K1_LBSPPA128_LBSPPB512_LBSPPM0_LPA16_LPB16_LPM0_LRVW8_LWPMn1_MIAV0_MIWT11_4_MO40_NTn1_NTA0_NTB0_NTC0_NTD4_NTM0_NEPBS8_NLCA1_NLCB1_ONLL1_PGR2_PLR1_PKA1_SIA3_SS1_SU16_SUM1_SUS128_SPO0_SRVW0_SSO0_SVW1_SK0_SKXCCM0_TLDS1_ULSGRO0_USL1_UIOFGRO0_USFGROn1_VSn1_VWA1_VWB4_WSGRA0_WSGRB0_WS64_WG16_16_1_WGM1_WGMXCC4_WGMXCCGn1
    SolutionIndex: 267
    SolutionNameMin: Cijk_Alik_Bljk_HSS_BH_Bias_S_HA_S_SAV_UserArgs_MT208x256x64_MI16x16x1_SN_LDSB1_AFC1_AFEM1_AFEM1_ASEM1_CLR1_CADS0_DTVA0_DTVB0_EPS0_FDSI0_GRPM1_GRVWA4_GRVWB8_GSUn1_GSUAMBSK_GSUC1_GSUWGMRR1_GLS0_ISA942_IU1_K1_LBSPPA128_LBSPPB512_LBSPPM0_LPA4_LPB8_LPM0_LRVW8_LWPMn1_MIAV0_MIWT13_4_MO40_NTn1_NTA0_NTB0_NTC0_NTD4_NTM0_NEPBS8_NLCA1_NLCB1_ONLL1_PGR2_PLR1_PKA1_SIA3_SS1_SU16_SUM1_SUS128_SPO0_SRVW0_SSO0_SVW1_SK0_SKXCCM0_TLDS1_ULSGRO0_USL1_UIOFGRO0_USFGROn1_VSn1_VWA1_VWB4_WSGRA0_WSGRB0_WS64_WG16_16_1_WGM1_WGMXCC4_WGMXCCGn1
    SolutionIndex: 268
    SolutionNameMin: Cijk_Alik_Bljk_HSS_BH_Bias_S_HA_S_SAV_UserArgs_MT160x320x64_MI16x16x1_SN_LDSB1_AFC1_AFEM1_AFEM1_ASEM1_CLR1_CADS0_DTVA0_DTVB0_EPS0_FDSI0_GRPM1_GRVWA8_GRVWB8_GSUn1_GSUAMBSK_GSUC1_GSUWGMRR1_GLS0_ISA942_IU1_K1_LBSPPA128_LBSPPB256_LBSPPM0_LPA4_LPB4_LPM0_LRVW8_LWPMn1_MIAV0_MIWT5_10_MO40_NTn1_NTA0_NTB0_NTC0_NTD4_NTM0_NEPBS5_NLCA1_NLCB1_ONLL1_PGR2_PLR1_PKA1_SIA3_SS1_SU16_SUM1_SUS128_SPO0_SRVW0_SSO0_SVW1_SK0_SKXCCM0_TLDS1_ULSGRO0_USL1_UIOFGRO0_USFGROn1_VSn1_VWA1_VWB2_WSGRA0_WSGRB0_WS64_WG32_8_1_WGM1_WGMXCC4_WGMXCCGn1
    SolutionIndex: 269
    SolutionNameMin: Cijk_Alik_Bljk_HSS_BH_Bias_S_HA_S_SAV_UserArgs_MT128x128x64_MI32x32x1_SN_LDSB1_AFC1_AFEM1_AFEM1_ASEM1_CLR1_CADS0_DTVA0_DTVB0_EPS0_FDSI0_GRPM1_GRVWA8_GRVWB8_GSUn1_GSUAMBSK_GSUC1_GSUWGMRR1_GLS0_ISA942_IU1_K1_LBSPPA128_LBSPPB512_LBSPPM0_LPA8_LPB8_LPM0_LRVW8_LWPMn1_MIAV0_MIWT1_4_MO40_NTn1_NTA0_NTB0_NTC0_NTD4_NTM0_NEPBS8_NLCA1_NLCB1_ONLL1_PGR2_PLR1_PKA1_SIA3_SS1_SU16_SUM1_SUS128_SPO0_SRVW0_SSO0_SVW1_SK0_SKXCCM0_TLDS1_ULSGRO0_USL1_UIOFGRO0_USFGROn1_VSn1_VWA1_VWB4_WSGRA0_WSGRB0_WS64_WG128_2_1_WGM1_WGMXCC4_WGMXCCGn1
    SolutionIndex: 270
    SolutionNameMin: Cijk_Alik_Bljk_HSS_BH_Bias_S_HA_S_SAV_UserArgs_MT160x128x64_MI16x16x1_SN_LDSB1_AFC1_AFEM1_AFEM1_ASEM1_CLR1_CADS0_DTVA0_DTVB0_EPS0_FDSI0_GRPM1_GRVWA8_GRVWB8_GSUn1_GSUAMBSK_GSUC1_GSUWGMRR1_GLS0_ISA942_IU1_K1_LBSPPA256_LBSPPB256_LBSPPM0_LPA16_LPB16_LPM0_LRVW8_LWPMn1_MIAV0_MIWT10_2_MO40_NTn1_NTA0_NTB0_NTC0_NTD4_NTM0_NEPBS8_NLCA1_NLCB1_ONLL1_PGR2_PLR1_PKA1_SIA3_SS1_SU16_SUM1_SUS128_SPO0_SRVW0_SSO0_SVW2_SK0_SKXCCM0_TLDS1_ULSGRO0_USL1_UIOFGRO0_USFGROn1_VSn1_VWA2_VWB2_WSGRA0_WSGRB0_WS64_WG16_16_1_WGM1_WGMXCC4_WGMXCCGn1
    SolutionIndex: 271
    SolutionNameMin: Cijk_Alik_Bljk_HSS_BH_Bias_S_HA_S_SAV_UserArgs_MT160x256x64_MI32x32x1_SN_LDSB1_AFC1_AFEM1_AFEM1_ASEM1_CLR1_CADS0_DTVA0_DTVB0_EPS0_FDSI0_GRPM1_GRVWA8_GRVWB8_GSUn1_GSUAMBSK_GSUC1_GSUWGMRR1_GLS0_ISA942_IU1_K1_LBSPPA128_LBSPPB256_LBSPPM0_LPA8_LPB8_LPM0_LRVW8_LWPMn1_MIAV0_MIWT5_2_MO40_NTn1_NTA0_NTB0_NTC0_NTD4_NTM0_NEPBS5_NLCA1_NLCB1_ONLL1_PGR2_PLR1_PKA1_SIA3_SS1_SU16_SUM1_SUS128_SPO0_SRVW0_SSO0_SVW1_SK0_SKXCCM0_TLDS1_ULSGRO0_USL1_UIOFGRO0_USFGROn1_VSn1_VWA1_VWB2_WSGRA0_WSGRB0_WS64_WG32_8_1_WGM1_WGMXCC4_WGMXCCGn1
    SolutionIndex: 272
    SolutionNameMin: Cijk_Alik_Bljk_HSS_BH_Bias_S_HA_S_SAV_UserArgs_MT144x256x64_MI16x16x1_SN_LDSB1_AFC1_AFEM1_AFEM1_ASEM1_CLR1_CADS0_DTVA0_DTVB0_EPS0_FDSI0_GRPM1_GRVWA4_GRVWB8_GSUn1_GSUAMBSK_GSUC1_GSUWGMRR1_GLS0_ISA942_IU1_K1_LBSPPA128_LBSPPB512_LBSPPM0_LPA16_LPB16_LPM0_LRVW8_LWPMn1_MIAV0_MIWT9_4_MO40_NTn1_NTA0_NTB0_NTC0_NTD4_NTM0_NEPBS8_NLCA1_NLCB1_ONLL1_PGR2_PLR1_PKA1_SIA3_SS1_SU16_SUM1_SUS128_SPO0_SRVW0_SSO0_SVW1_SK0_SKXCCM0_TLDS1_ULSGRO0_USL1_UIOFGRO0_USFGROn1_VSn1_VWA1_VWB4_WSGRA0_WSGRB0_WS64_WG16_16_1_WGM1_WGMXCC4_WGMXCCGn1
    SolutionIndex: 273
    SolutionNameMin: Cijk_Alik_Bljk_HSS_BH_Bias_S_HA_S_SAV_UserArgs_MT160x256x64_MI16x16x1_SN_LDSB1_AFC1_AFEM1_AFEM1_ASEM1_CLR1_CADS0_DTVA0_DTVB0_EPS0_FDSI0_GRPM1_GRVWA8_GRVWB8_GSUn1_GSUAMBSK_GSUC1_GSUWGMRR1_GLS0_ISA942_IU1_K1_LBSPPA256_LBSPPB512_LBSPPM0_LPA16_LPB16_LPM0_LRVW8_LWPMn1_MIAV0_MIWT10_4_MO40_NTn1_NTA0_NTB0_NTC0_NTD4_NTM0_NEPBS8_NLCA1_NLCB1_ONLL1_PGR2_PLR1_PKA1_SIA3_SS1_SU16_SUM1_SUS128_SPO0_SRVW0_SSO0_SVW2_SK0_SKXCCM0_TLDS1_ULSGRO0_USL1_UIOFGRO0_USFGROn1_VSn1_VWA2_VWB4_WSGRA0_WSGRB0_WS64_WG16_16_1_WGM1_WGMXCC4_WGMXCCGn1
    SolutionIndex: 274
    SolutionNameMin: Cijk_Alik_Bljk_HSS_BH_Bias_S_HA_S_SAV_UserArgs_MT192x256x64_MI32x32x1_SN_LDSB1_AFC1_AFEM1_AFEM1_ASEM1_CLR1_CADS0_DTVA0_DTVB0_EPS0_FDSI0_GRPM1_GRVWA8_GRVWB8_GSUn1_GSUAMBSK_GSUC1_GSUWGMRR1_GLS0_ISA942_IU1_K1_LBSPPA256_LBSPPB256_LBSPPM0_LPA8_LPB8_LPM0_LRVW8_LWPMn1_MIAV0_MIWT6_2_MO40_NTn1_NTA0_NTB0_NTC0_NTD4_NTM0_NEPBS6_NLCA1_NLCB1_ONLL1_PGR2_PLR1_PKA1_SIA3_SS1_SU16_SUM1_SUS128_SPO0_SRVW0_SSO0_SVW2_SK0_SKXCCM0_TLDS1_ULSGRO0_USL1_UIOFGRO0_USFGROn1_VSn1_VWA2_VWB2_WSGRA0_WSGRB0_WS64_WG32_8_1_WGM1_WGMXCC4_WGMXCCGn1
    SolutionIndex: 275
    SolutionNameMin: Cijk_Alik_Bljk_HSS_BH_Bias_S_HA_S_SAV_UserArgs_MT160x320x64_MI16x16x1_SN_LDSB1_AFC1_AFEM1_AFEM1_ASEM1_CLR1_CADS0_DTVA0_DTVB0_EPS0_FDSI0_GRPM1_GRVWA8_GRVWB8_GSUn1_GSUAMBSK_GSUC1_GSUWGMRR1_GLS0_ISA942_IU1_K1_LBSPPA256_LBSPPB128_LBSPPM0_LPA4_LPB4_LPM0_LRVW8_LWPMn1_MIAV0_MIWT10_5_MO40_NTn1_NTA0_NTB0_NTC0_NTD4_NTM0_NEPBS8_NLCA1_NLCB1_ONLL1_PGR2_PLR1_PKA1_SIA3_SS1_SU16_SUM1_SUS128_SPO0_SRVW0_SSO0_SVW2_SK0_SKXCCM0_TLDS1_ULSGRO0_USL1_UIOFGRO0_USFGROn1_VSn1_VWA2_VWB1_WSGRA0_WSGRB0_WS64_WG16_16_1_WGM1_WGMXCC4_WGMXCCGn1
    SolutionIndex: 276
    SolutionNameMin: Cijk_Alik_Bljk_HSS_BH_Bias_S_HA_S_SAV_UserArgs_MT352x160x32_MI16x16x1_SN_LDSB1_AFC1_AFEM1_AFEM1_ASEM1_CLR1_CADS0_DTVA0_DTVB0_EPS0_FDSI0_GRPM1_GRVWA4_GRVWB4_GSUn1_GSUAMBSK_GSUC1_GSUWGMRR1_GLS0_ISA942_IU1_K1_LBSPPA128_LBSPPB128_LBSPPM0_LPA4_LPB4_LPM0_LRVW4_LWPMn1_MIAV0_MIWT11_5_MO40_NTn1_NTA0_NTB0_NTC0_NTD4_NTM0_NEPBS8_NLCA1_NLCB1_ONLL1_PGR2_PLR1_PKA1_SIA3_SS1_SU16_SUM1_SUS64_SPO0_SRVW0_SSO0_SVW1_SK0_SKXCCM0_TLDS1_ULSGRO0_USL1_UIOFGRO0_USFGROn1_VSn1_VWA1_VWB1_WSGRA0_WSGRB0_WS64_WG32_8_1_WGM1_WGMXCC4_WGMXCCGn1
    SolutionIndex: 277
    SolutionNameMin: Cijk_Alik_Bljk_HSS_BH_Bias_S_HA_S_SAV_UserArgs_MT192x320x32_MI32x32x1_SN_LDSB1_AFC1_AFEM1_AFEM1_ASEM1_CLR1_CADS0_DTVA0_DTVB0_EPS0_FDSI0_GRPM1_GRVWA8_GRVWB8_GSUn1_GSUAMBSK_GSUC1_GSUWGMRR1_GLS0_ISA942_IU1_K1_LBSPPA128_LBSPPB128_LBSPPM0_LPA8_LPB8_LPM0_LRVW8_LWPMn1_MIAV0_MIWT3_5_MO40_NTn1_NTA0_NTB0_NTC0_NTD4_NTM0_NEPBS6_NLCA1_NLCB1_ONLL1_PGR2_PLR1_PKA1_SIA3_SS1_SU16_SUM1_SUS64_SPO0_SRVW0_SSO0_SVW1_SK0_SKXCCM0_TLDS1_ULSGRO0_USL1_UIOFGRO0_USFGROn1_VSn1_VWA1_VWB1_WSGRA0_WSGRB0_WS64_WG64_4_1_WGM1_WGMXCC4_WGMXCCGn1
    SolutionIndex: 278
    SolutionNameMin: Cijk_Alik_Bljk_HSS_BH_Bias_S_HA_S_SAV_UserArgs_MT192x320x32_MI16x16x1_SN_LDSB1_AFC1_AFEM1_AFEM1_ASEM1_CLR1_CADS0_DTVA0_DTVB0_EPS0_FDSI0_GRPM1_GRVWA4_GRVWB4_GSUn1_GSUAMBSK_GSUC1_GSUWGMRR1_GLS0_ISA942_IU1_K1_LBSPPA256_LBSPPB128_LBSPPM0_LPA8_LPB8_LPM0_LRVW4_LWPMn1_MIAV0_MIWT12_5_MO40_NTn1_NTA0_NTB0_NTC0_NTD4_NTM0_NEPBS8_NLCA1_NLCB1_ONLL1_PGR2_PLR1_PKA1_SIA3_SS1_SU16_SUM1_SUS64_SPO0_SRVW0_SSO0_SVW4_SK0_SKXCCM0_TLDS1_ULSGRO0_USL1_UIOFGRO0_USFGROn1_VSn1_VWA4_VWB1_WSGRA0_WSGRB0_WS64_WG16_16_1_WGM1_WGMXCC4_WGMXCCGn1
    SolutionIndex: 279
    SolutionNameMin: Cijk_Alik_Bljk_HSS_BH_Bias_S_HA_S_SAV_UserArgs_MT240x256x32_MI16x16x1_SN_LDSB1_AFC1_AFEM1_AFEM1_ASEM1_CLR1_CADS0_DTVA0_DTVB0_EPS0_FDSI0_GRPM1_GRVWA2_GRVWB4_GSUn1_GSUAMBSK_GSUC1_GSUWGMRR1_GLS0_ISA942_IU1_K1_LBSPPA128_LBSPPB256_LBSPPM0_LPA4_LPB8_LPM0_LRVW4_LWPMn1_MIAV0_MIWT15_4_MO40_NTn1_NTA0_NTB0_NTC0_NTD4_NTM0_NEPBS8_NLCA1_NLCB1_ONLL1_PGR2_PLR1_PKA1_SIA3_SS1_SU16_SUM1_SUS64_SPO0_SRVW0_SSO0_SVW1_SK0_SKXCCM0_TLDS1_ULSGRO0_USL1_UIOFGRO0_USFGROn1_VSn1_VWA1_VWB4_WSGRA0_WSGRB0_WS64_WG16_16_1_WGM1_WGMXCC4_WGMXCCGn1
    SolutionIndex: 280
    SolutionNameMin: Cijk_Alik_Bljk_HSS_BH_Bias_S_HA_S_SAV_UserArgs_MT144x320x64_MI16x16x1_SN_LDSB1_AFC1_AFEM1_AFEM1_ASEM1_CLR1_CADS0_DTVA0_DTVB0_EPS0_FDSI0_GRPM1_GRVWA4_GRVWB8_GSUn1_GSUAMBSK_GSUC1_GSUWGMRR1_GLS0_ISA942_IU1_K1_LBSPPA128_LBSPPB128_LBSPPM0_LPA4_LPB4_LPM0_LRVW8_LWPMn1_MIAV0_MIWT9_5_MO40_NTn1_NTA0_NTB0_NTC0_NTD4_NTM0_NEPBS8_NLCA1_NLCB1_ONLL1_PGR2_PLR1_PKA1_SIA3_SS1_SU16_SUM1_SUS128_SPO0_SRVW0_SSO0_SVW1_SK0_SKXCCM0_TLDS1_ULSGRO0_USL1_UIOFGRO0_USFGROn1_VSn1_VWA1_VWB1_WSGRA0_WSGRB0_WS64_WG16_16_1_WGM1_WGMXCC4_WGMXCCGn1
    SolutionIndex: 281
    SolutionNameMin: Cijk_Alik_Bljk_HSS_BH_Bias_S_HA_S_SAV_UserArgs_MT192x320x32_MI16x16x1_SN_LDSB1_AFC1_AFEM1_AFEM1_ASEM1_CLR1_CADS0_DTVA0_DTVB0_EPS0_FDSI0_GRPM1_GRVWA4_GRVWB4_GSUn1_GSUAMBSK_GSUC1_GSUWGMRR1_GLS0_ISA942_IU1_K1_LBSPPA256_LBSPPB128_LBSPPM0_LPA4_LPB8_LPM0_LRVW4_LWPMn1_MIAV0_MIWT12_5_MO40_NTn1_NTA0_NTB0_NTC0_NTD4_NTM0_NEPBS8_NLCA1_NLCB1_ONLL1_PGR2_PLR1_PKA1_SIA3_SS1_SU16_SUM1_SUS64_SPO0_SRVW0_SSO0_SVW4_SK0_SKXCCM0_TLDS1_ULSGRO0_USL1_UIOFGRO0_USFGROn1_VSn1_VWA4_VWB1_WSGRA0_WSGRB0_WS64_WG16_16_1_WGM1_WGMXCC4_WGMXCCGn1
    SolutionIndex: 282
    SolutionNameMin: Cijk_Alik_Bljk_HSS_BH_Bias_S_HA_S_SAV_UserArgs_MT224x256x64_MI32x32x1_SN_LDSB1_AFC1_AFEM1_AFEM1_ASEM1_CLR1_CADS0_DTVA0_DTVB0_EPS0_FDSI0_GRPM1_GRVWA8_GRVWB8_GSUn1_GSUAMBSK_GSUC1_GSUWGMRR1_GLS0_ISA942_IU1_K1_LBSPPA128_LBSPPB256_LBSPPM0_LPA4_LPB8_LPM0_LRVW8_LWPMn1_MIAV0_MIWT7_2_MO40_NTn1_NTA0_NTB0_NTC0_NTD4_NTM0_NEPBS7_NLCA1_NLCB1_ONLL1_PGR2_PLR1_PKA1_SIA3_SS1_SU16_SUM1_SUS128_SPO0_SRVW0_SSO4_SVW1_SK0_SKXCCM0_TLDS1_ULSGRO0_USL1_UIOFGRO0_USFGROn1_VSn1_VWA1_VWB2_WSGRA0_WSGRB0_WS64_WG32_8_1_WGM1_WGMXCC4_WGMXCCGn1
    SolutionIndex: 283
    SolutionNameMin: Cijk_Alik_Bljk_HSS_BH_Bias_S_HA_S_SAV_UserArgs_MT224x256x64_MI16x16x1_SN_LDSB1_AFC1_AFEM1_AFEM1_ASEM1_CLR1_CADS0_DTVA0_DTVB0_EPS0_FDSI0_GRPM1_GRVWA8_GRVWB8_GSUn1_GSUAMBSK_GSUC1_GSUWGMRR1_GLS0_ISA942_IU1_K1_LBSPPA256_LBSPPB512_LBSPPM0_LPA4_LPB8_LPM0_LRVW8_LWPMn1_MIAV0_MIWT14_4_MO40_NTn1_NTA0_NTB0_NTC0_NTD4_NTM0_NEPBS8_NLCA1_NLCB1_ONLL1_PGR2_PLR1_PKA1_SIA3_SS1_SU16_SUM1_SUS128_SPO0_SRVW0_SSO4_SVW2_SK0_SKXCCM0_TLDS1_ULSGRO0_USL1_UIOFGRO0_USFGROn1_VSn1_VWA2_VWB4_WSGRA0_WSGRB0_WS64_WG16_16_1_WGM1_WGMXCC4_WGMXCCGn1
    SolutionIndex: 284
    SolutionNameMin: Cijk_Alik_Bljk_HSS_BH_Bias_S_HA_S_SAV_UserArgs_MT192x256x64_MI32x32x1_SN_LDSB1_AFC1_AFEM1_AFEM1_ASEM1_CLR1_CADS0_DTVA0_DTVB0_EPS0_FDSI0_GRPM1_GRVWA8_GRVWB8_GSUn1_GSUAMBSK_GSUC1_GSUWGMRR1_GLS0_ISA942_IU1_K1_LBSPPA128_LBSPPB512_LBSPPM0_LPA8_LPB8_LPM0_LRVW8_LWPMn1_MIAV0_MIWT3_4_MO40_NTn1_NTA0_NTB0_NTC0_NTD4_NTM0_NEPBS6_NLCA1_NLCB1_ONLL1_PGR2_PLR1_PKA1_SIA3_SS1_SU16_SUM1_SUS128_SPO0_SRVW0_SSO4_SVW1_SK0_SKXCCM0_TLDS1_ULSGRO0_USL1_UIOFGRO0_USFGROn1_VSn1_VWA1_VWB4_WSGRA0_WSGRB0_WS64_WG64_4_1_WGM1_WGMXCC4_WGMXCCGn1
    SolutionIndex: 285
    SolutionNameMin: Cijk_Alik_Bljk_HSS_BH_Bias_S_HA_S_SAV_UserArgs_MT192x256x64_MI16x16x1_SN_LDSB1_AFC1_AFEM1_AFEM1_ASEM1_CLR1_CADS0_DTVA0_DTVB0_EPS0_FDSI0_GRPM1_GRVWA8_GRVWB8_GSUn1_GSUAMBSK_GSUC1_GSUWGMRR1_GLS0_ISA942_IU1_K1_LBSPPA256_LBSPPB1024_LBSPPM0_LPA16_LPB16_LPM0_LRVW8_LWPMn1_MIAV0_MIWT6_8_MO40_NTn1_NTA0_NTB0_NTC0_NTD4_NTM0_NEPBS6_NLCA1_NLCB1_ONLL1_PGR2_PLR1_PKA1_SIA3_SS1_SU16_SUM1_SUS128_SPO0_SRVW0_SSO4_SVW2_SK0_SKXCCM0_TLDS1_ULSGRO0_USL1_UIOFGRO0_USFGROn1_VSn1_VWA2_VWB8_WSGRA0_WSGRB0_WS64_WG32_8_1_WGM1_WGMXCC4_WGMXCCGn1
    SolutionIndex: 286
    SolutionNameMin: Cijk_Alik_Bljk_HSS_BH_Bias_S_HA_S_SAV_UserArgs_MT256x160x32_MI16x16x1_SN_LDSB1_AFC1_AFEM1_AFEM1_ASEM1_CLR1_CADS0_DTVA0_DTVB0_EPS0_FDSI0_GRPM1_GRVWA4_GRVWB4_GSUn1_GSUAMBSK_GSUC1_GSUWGMRR1_GLS0_ISA942_IU1_K1_LBSPPA256_LBSPPB128_LBSPPM0_LPA4_LPB4_LPM0_LRVW4_LWPMn1_MIAV0_MIWT4_10_MO40_NTn1_NTA0_NTB0_NTC0_NTD4_NTM0_NEPBS8_NLCA1_NLCB1_ONLL1_PGR2_PLR1_PKA1_SIA3_SS1_SU16_SUM1_SUS64_SPO0_SRVW0_SSO4_SVW4_SK0_SKXCCM0_TLDS1_ULSGRO0_USL1_UIOFGRO0_USFGROn1_VSn1_VWA4_VWB2_WSGRA0_WSGRB0_WS64_WG64_4_1_WGM1_WGMXCC4_WGMXCCGn1
    SolutionIndex: 287
    SolutionNameMin: Cijk_Alik_Bljk_HSS_BH_Bias_S_HA_S_SAV_UserArgs_MT144x320x64_MI16x16x1_SN_LDSB1_AFC1_AFEM1_AFEM1_ASEM1_CLR1_CADS0_DTVA0_DTVB0_EPS0_FDSI0_GRPM1_GRVWA4_GRVWB8_GSUn1_GSUAMBSK_GSUC1_GSUWGMRR1_GLS0_ISA942_IU1_K1_LBSPPA128_LBSPPB128_LBSPPM0_LPA4_LPB4_LPM0_LRVW8_LWPMn1_MIAV0_MIWT9_5_MO40_NTn1_NTA0_NTB0_NTC0_NTD4_NTM0_NEPBS8_NLCA1_NLCB1_ONLL1_PGR2_PLR1_PKA1_SIA3_SS1_SU16_SUM1_SUS128_SPO0_SRVW0_SSO4_SVW1_SK0_SKXCCM0_TLDS1_ULSGRO0_USL1_UIOFGRO0_USFGROn1_VSn1_VWA1_VWB1_WSGRA0_WSGRB0_WS64_WG16_16_1_WGM1_WGMXCC4_WGMXCCGn1
    SolutionIndex: 288
    SolutionNameMin: Cijk_Alik_Bljk_HSS_BH_Bias_S_HA_S_SAV_UserArgs_MT128x320x64_MI16x16x1_SN_LDSB1_AFC1_AFEM1_AFEM1_ASEM1_CLR1_CADS0_DTVA0_DTVB0_EPS0_FDSI0_GRPM1_GRVWA8_GRVWB8_GSUn1_GSUAMBSK_GSUC1_GSUWGMRR1_GLS0_ISA942_IU1_K1_LBSPPA512_LBSPPB256_LBSPPM0_LPA16_LPB16_LPM0_LRVW8_LWPMn1_MIAV0_MIWT4_10_MO40_NTn1_NTA0_NTB0_NTC0_NTD4_NTM0_NEPBS8_NLCA1_NLCB1_ONLL1_PGR2_PLR1_PKA1_SIA3_SS1_SU16_SUM1_SUS128_SPO0_SRVW0_SSO4_SVW4_SK0_SKXCCM0_TLDS1_ULSGRO0_USL1_UIOFGRO0_USFGROn1_VSn1_VWA4_VWB2_WSGRA0_WSGRB0_WS64_WG32_8_1_WGM1_WGMXCC4_WGMXCCGn1
    SolutionIndex: 289
    SolutionNameMin: Cijk_Alik_Bljk_HSS_BH_Bias_S_HA_S_SAV_UserArgs_MT128x320x32_MI16x16x1_SN_LDSB1_AFC1_AFEM1_AFEM1_ASEM1_CLR1_CADS0_DTVA0_DTVB0_EPS0_FDSI0_GRPM1_GRVWA4_GRVWB4_GSUn1_GSUAMBSK_GSUC1_GSUWGMRR1_GLS0_ISA942_IU1_K1_LBSPPA256_LBSPPB128_LBSPPM0_LPA8_LPB4_LPM0_LRVW4_LWPMn1_MIAV0_MIWT4_10_MO40_NTn1_NTA0_NTB0_NTC0_NTD4_NTM0_NEPBS8_NLCA1_NLCB1_ONLL1_PGR2_PLR1_PKA1_SIA3_SS1_SU16_SUM1_SUS64_SPO0_SRVW0_SSO4_SVW4_SK0_SKXCCM0_TLDS1_ULSGRO0_USL1_UIOFGRO0_USFGROn1_VSn1_VWA4_VWB2_WSGRA0_WSGRB0_WS64_WG32_8_1_WGM1_WGMXCC4_WGMXCCGn1
    SolutionIndex: 290
    SolutionNameMin: Cijk_Alik_Bljk_HSS_BH_Bias_S_HA_S_SAV_UserArgs_MT128x320x64_MI32x32x1_SN_LDSB1_AFC1_AFEM1_AFEM1_ASEM1_CLR1_CADS0_DTVA0_DTVB0_EPS0_FDSI0_GRPM1_GRVWA8_GRVWB8_GSUn1_GSUAMBSK_GSUC1_GSUWGMRR1_GLS0_ISA942_IU1_K1_LBSPPA256_LBSPPB128_LBSPPM0_LPA8_LPB8_LPM0_LRVW8_LWPMn1_MIAV0_MIWT2_5_MO40_NTn1_NTA0_NTB0_NTC0_NTD4_NTM0_NEPBS8_NLCA1_NLCB1_ONLL1_PGR2_PLR1_PKA1_SIA3_SS1_SU16_SUM1_SUS128_SPO0_SRVW0_SSO4_SVW2_SK0_SKXCCM0_TLDS1_ULSGRO0_USL1_UIOFGRO0_USFGROn1_VSn1_VWA2_VWB1_WSGRA0_WSGRB0_WS64_WG64_4_1_WGM1_WGMXCC4_WGMXCCGn1
    SolutionIndex: 291
    SolutionNameMin: Cijk_Alik_Bljk_HSS_BH_Bias_S_HA_S_SAV_UserArgs_MT192x256x64_MI32x32x1_SN_LDSB1_AFC1_AFEM1_AFEM1_ASEM1_CLR1_CADS0_DTVA0_DTVB0_EPS0_FDSI0_GRPM1_GRVWA8_GRVWB8_GSUn1_GSUAMBSK_GSUC1_GSUWGMRR1_GLS0_ISA942_IU1_K1_LBSPPA256_LBSPPB256_LBSPPM0_LPA8_LPB8_LPM0_LRVW8_LWPMn1_MIAV0_MIWT6_2_MO40_NTn1_NTA0_NTB0_NTC0_NTD4_NTM0_NEPBS6_NLCA1_NLCB1_ONLL1_PGR2_PLR1_PKA1_SIA3_SS1_SU16_SUM1_SUS128_SPO0_SRVW0_SSO4_SVW2_SK0_SKXCCM0_TLDS1_ULSGRO0_USL1_UIOFGRO0_USFGROn1_VSn1_VWA2_VWB2_WSGRA0_WSGRB0_WS64_WG32_8_1_WGM1_WGMXCC4_WGMXCCGn1
    SolutionIndex: 292
    SolutionNameMin: Cijk_Alik_Bljk_HSS_BH_Bias_S_HA_S_SAV_UserArgs_MT256x256x32_MI32x32x1_SN_LDSB1_AFC1_AFEM1_AFEM1_ASEM1_CLR1_CADS0_DTVA0_DTVB0_EPS0_FDSI0_GRPM1_GRVWA8_GRVWB8_GSUn1_GSUAMBSK_GSUC1_GSUWGMRR1_GLS0_ISA942_IU1_K1_LBSPPA256_LBSPPB256_LBSPPM0_LPA8_LPB8_LPM0_LRVW8_LWPMn1_MIAV0_MIWT4_4_MO40_NTn1_NTA0_NTB0_NTC0_NTD4_NTM0_NEPBS8_NLCA1_NLCB1_ONLL1_PGR2_PLR1_PKA1_SIA3_SS1_SU16_SUM1_SUS64_SPO0_SRVW0_SSO4_SVW4_SK0_SKXCCM0_TLDS1_ULSGRO0_USL1_UIOFGRO0_USFGROn1_VSn1_VWA4_VWB4_WSGRA0_WSGRB0_WS64_WG64_4_1_WGM1_WGMXCC4_WGMXCCGn1
    SolutionIndex: 293
    SolutionNameMin: Cijk_Alik_Bljk_HSS_BH_Bias_S_HA_S_SAV_UserArgs_MT192x320x32_MI16x16x1_SN_LDSB1_AFC1_AFEM1_AFEM1_ASEM1_CLR1_CADS0_DTVA0_DTVB0_EPS0_FDSI0_GRPM1_GRVWA4_GRVWB4_GSUn1_GSUAMBSK_GSUC1_GSUWGMRR1_GLS0_ISA942_IU1_K1_LBSPPA256_LBSPPB128_LBSPPM0_LPA4_LPB8_LPM0_LRVW4_LWPMn1_MIAV0_MIWT12_5_MO40_NTn1_NTA0_NTB0_NTC0_NTD4_NTM0_NEPBS8_NLCA1_NLCB1_ONLL1_PGR2_PLR1_PKA1_SIA3_SS1_SU16_SUM1_SUS64_SPO0_SRVW0_SSO4_SVW4_SK0_SKXCCM0_TLDS1_ULSGRO0_USL1_UIOFGRO0_USFGROn1_VSn1_VWA4_VWB1_WSGRA0_WSGRB0_WS64_WG16_16_1_WGM1_WGMXCC4_WGMXCCGn1
    SolutionIndex: 294
    SolutionNameMin: Cijk_Alik_Bljk_HSS_BH_Bias_S_HA_S_SAV_UserArgs_MT192x256x64_MI16x16x1_SN_LDSB1_AFC1_AFEM1_AFEM1_ASEM1_CLR1_CADS0_DTVA0_DTVB0_EPS0_FDSI0_GRPM1_GRVWA8_GRVWB8_GSUn1_GSUAMBSK_GSUC1_GSUWGMRR1_GLS0_ISA942_IU1_K1_LBSPPA512_LBSPPB512_LBSPPM0_LPA16_LPB16_LPM0_LRVW8_LWPMn1_MIAV0_MIWT12_4_MO40_NTn1_NTA0_NTB0_NTC0_NTD4_NTM0_NEPBS8_NLCA1_NLCB1_ONLL1_PGR2_PLR1_PKA1_SIA3_SS1_SU16_SUM1_SUS128_SPO0_SRVW0_SSO4_SVW4_SK0_SKXCCM0_TLDS1_ULSGRO0_USL1_UIOFGRO0_USFGROn1_VSn1_VWA4_VWB4_WSGRA0_WSGRB0_WS64_WG16_16_1_WGM1_WGMXCC4_WGMXCCGn1
    SolutionIndex: 295
    SolutionNameMin: Cijk_Alik_Bljk_HSS_BH_Bias_S_HA_S_SAV_UserArgs_MT192x320x32_MI32x32x1_SN_LDSB1_AFC1_AFEM1_AFEM1_ASEM1_CLR1_CADS0_DTVA0_DTVB0_EPS0_FDSI0_GRPM1_GRVWA8_GRVWB8_GSUn1_GSUAMBSK_GSUC1_GSUWGMRR1_GLS0_ISA942_IU1_K1_LBSPPA128_LBSPPB128_LBSPPM0_LPA8_LPB8_LPM0_LRVW8_LWPMn1_MIAV0_MIWT3_5_MO40_NTn1_NTA0_NTB0_NTC0_NTD4_NTM0_NEPBS6_NLCA1_NLCB1_ONLL1_PGR2_PLR1_PKA1_SIA3_SS1_SU16_SUM1_SUS64_SPO0_SRVW0_SSO4_SVW1_SK0_SKXCCM0_TLDS1_ULSGRO0_USL1_UIOFGRO0_USFGROn1_VSn1_VWA1_VWB1_WSGRA0_WSGRB0_WS64_WG64_4_1_WGM1_WGMXCC4_WGMXCCGn1
    SolutionIndex: 296
    SolutionNameMin: Cijk_Alik_Bljk_HSS_BH_Bias_S_HA_S_SAV_UserArgs_MT16x96x256_MI16x16x1_SN_LDSB1_AFC1_AFEM1_AFEM1_ASEM1_CLR1_CADS0_DTVA0_DTVB0_EPS0_FDSI0_GRPM1_GRVWA8_GRVWB8_GSUn1_GSUAMBSK_GSUC1_GSUWGMRR1_GLS0_ISA942_IU1_K1_LBSPPA512_LBSPPB512_LBSPPM0_LPA16_LPB16_LPM0_LRVW8_LWPMn1_MIAV0_MIWT1_3_MO40_NTn1_NTA0_NTB0_NTC0_NTD4_NTM0_NEPBS8_NLCA1_NLCB1_ONLL1_PGR2_PLR1_PKA1_SIA3_SS1_SU16_SUM1_SUS512_SPO0_SRVW0_SSO0_SVW1_SK0_SKXCCM0_TLDS1_ULSGRO0_USL1_UIOFGRO0_USFGROn1_VSn1_VWA1_VWB1_WSGRA0_WSGRB0_WS64_WG16_8_2_WGM1_WGMXCC4_WGMXCCGn1
    SolutionIndex: 297
    SolutionNameMin: Cijk_Alik_Bljk_HSS_BH_Bias_S_HA_S_SAV_UserArgs_MT16x48x256_MI16x16x1_SN_LDSB1_AFC1_AFEM1_AFEM1_ASEM1_CLR1_CADS0_DTVA0_DTVB0_EPS0_FDSI0_GRPM1_GRVWA8_GRVWB8_GSUn1_GSUAMBSK_GSUC1_GSUWGMRR1_GLS0_ISA942_IU1_K1_LBSPPA512_LBSPPB512_LBSPPM0_LPA16_LPB16_LPM0_LRVW8_LWPMn1_MIAV0_MIWT1_3_MO40_NTn1_NTA0_NTB0_NTC0_NTD4_NTM0_NEPBS8_NLCA1_NLCB1_ONLL1_PGR2_PLR1_PKA1_SIA3_SS1_SU16_SUM1_SUS512_SPO0_SRVW0_SSO0_SVW1_SK0_SKXCCM0_TLDS1_ULSGRO0_USL1_UIOFGRO0_USFGROn1_VSn1_VWA1_VWB1_WSGRA0_WSGRB0_WS64_WG16_4_4_WGM1_WGMXCC4_WGMXCCGn1
    SolutionIndex: 298
    SolutionNameMin: Cijk_Alik_Bljk_HSS_BH_Bias_S_HA_S_SAV_UserArgs_MT32x64x128_MI32x32x1_SN_LDSB0_AFC1_AFEM1_AFEM1_ASEM1_CLR1_CADS0_DTVA0_DTVB0_EPS0_FDSI0_GRPM1_GRVWA8_GRVWB8_GSUn1_GSUAMBSK_GSUC1_GSUWGMRR1_GLS0_ISA942_IU1_K1_LBSPPA256_LBSPPB256_LBSPPM0_LPA8_LPB8_LPM0_LRVW8_LWPMn1_MIAV0_MIWT1_1_MO40_NTn1_NTA0_NTB0_NTC0_NTD4_NTM0_NEPBS8_NLCA1_NLCB1_ONLL1_PGR2_PLR1_PKA1_SIA3_SS1_SU16_SUM1_SUS256_SPO0_SRVW0_SSO0_SVW1_SK0_SKXCCM0_TLDS1_ULSGRO0_USL1_UIOFGRO0_USFGROn1_VSn1_VWA1_VWB1_WSGRA0_WSGRB0_WS64_WG32_4_2_WGM1_WGMXCC4_WGMXCCGn1
    SolutionIndex: 299
    SolutionNameMin: Cijk_Alik_Bljk_HSS_BH_Bias_S_HA_S_SAV_UserArgs_MT64x128x128_MI32x32x1_SN_LDSB1_AFC1_AFEM1_AFEM1_ASEM1_CLR1_CADS0_DTVA0_DTVB0_EPS0_FDSI0_GRPM1_GRVWA8_GRVWB8_GSUn1_GSUAMBSK_GSUC1_GSUWGMRR1_GLS0_ISA942_IU1_K1_LBSPPA512_LBSPPB512_LBSPPM0_LPA8_LPB8_LPM0_LRVW8_LWPMn1_MIAV0_MIWT2_2_MO40_NTn1_NTA0_NTB0_NTC0_NTD4_NTM0_NEPBS8_NLCA1_NLCB1_ONLL1_PGR2_PLR1_PKA1_SIA3_SS1_SU16_SUM1_SUS256_SPO0_SRVW0_SSO0_SVW2_SK0_SKXCCM0_TLDS1_ULSGRO0_USL1_UIOFGRO0_USFGROn1_VSn1_VWA2_VWB2_WSGRA0_WSGRB0_WS64_WG32_4_2_WGM1_WGMXCC4_WGMXCCGn1
- - - [16, 16, 1, 2048]
    - [0, 0.0]
  - - [16, 16, 1, 8192]
    - [0, 0.0]
  - - [16, 16, 1, 32768]
    - [1, 0.0]
  - - [32, 16, 1, 2048]
    - [0, 0.0]
  - - [32, 16, 1, 8192]
    - [1, 0.0]
  - - [32, 16, 1, 32768]
    - [1, 0.0]
  - - [48, 16, 1, 2048]
    - [0, 0.0]
  - - [48, 16, 1, 8192]
    - [1, 0.0]
  - - [48, 16, 1, 32768]
    - [1, 0.0]
  - - [64, 16, 1, 2048]
    - [1, 0.0]
  - - [64, 16, 1, 8192]
    - [2, 0.0]
  - - [64, 16, 1, 32768]
    - [3, 0.0]
  - - [80, 16, 1, 2048]
    - [1, 0.0]
  - - [80, 16, 1, 8192]
    - [1, 0.0]
  - - [80, 16, 1, 32768]
    - [4, 0.0]
  - - [96, 16, 1, 2048]
    - [1, 0.0]
  - - [96, 16, 1, 8192]
    - [5, 0.0]
  - - [96, 16, 1, 32768]
    - [4, 0.0]
  - - [112, 16, 1, 2048]
    - [1, 0.0]
  - - [112, 16, 1, 8192]
    - [1, 0.0]
  - - [112, 16, 1, 32768]
    - [5, 0.0]
  - - [128, 16, 1, 2048]
    - [1, 0.0]
  - - [128, 16, 1, 8192]
    - [6, 0.0]
  - - [128, 16, 1, 32768]
    - [5, 0.0]
  - - [160, 16, 1, 2048]
    - [1, 0.0]
  - - [160, 16, 1, 8192]
    - [6, 0.0]
  - - [160, 16, 1, 32768]
    - [3, 0.0]
  - - [192, 16, 1, 2048]
    - [1, 0.0]
  - - [192, 16, 1, 8192]
    - [5, 0.0]
  - - [192, 16, 1, 32768]
    - [6, 0.0]
  - - [224, 16, 1, 2048]
    - [1, 0.0]
  - - [224, 16, 1, 8192]
    - [5, 0.0]
  - - [224, 16, 1, 32768]
    - [3, 0.0]
  - - [256, 16, 1, 2048]
    - [7, 0.0]
  - - [256, 16, 1, 8192]
    - [3, 0.0]
  - - [256, 16, 1, 32768]
    - [3, 0.0]
  - - [320, 16, 1, 2048]
    - [7, 0.0]
  - - [320, 16, 1, 8192]
    - [6, 0.0]
  - - [320, 16, 1, 32768]
    - [8, 0.0]
  - - [384, 16, 1, 2048]
    - [7, 0.0]
  - - [384, 16, 1, 8192]
    - [6, 0.0]
  - - [384, 16, 1, 32768]
    - [6, 0.0]
  - - [448, 16, 1, 2048]
    - [7, 0.0]
  - - [448, 16, 1, 8192]
    - [7, 0.0]
  - - [448, 16, 1, 32768]
    - [3, 0.0]
  - - [512, 16, 1, 2048]
    - [9, 0.0]
  - - [512, 16, 1, 8192]
    - [7, 0.0]
  - - [512, 16, 1, 32768]
    - [7, 0.0]
  - - [576, 16, 1, 2048]
    - [7, 0.0]
  - - [576, 16, 1, 8192]
    - [7, 0.0]
  - - [576, 16, 1, 32768]
    - [7, 0.0]
  - - [640, 16, 1, 2048]
    - [9, 0.0]
  - - [640, 16, 1, 8192]
    - [4, 0.0]
  - - [640, 16, 1, 32768]
    - [4, 0.0]
  - - [768, 16, 1, 2048]
    - [9, 0.0]
  - - [768, 16, 1, 8192]
    - [10, 0.0]
  - - [768, 16, 1, 32768]
    - [4, 0.0]
  - - [896, 16, 1, 2048]
    - [9, 0.0]
  - - [896, 16, 1, 8192]
    - [10, 0.0]
  - - [896, 16, 1, 32768]
    - [9, 0.0]
  - - [1024, 16, 1, 2048]
    - [10, 0.0]
  - - [1024, 16, 1, 8192]
    - [10, 0.0]
  - - [1024, 16, 1, 32768]
    - [6, 0.0]
  - - [1280, 16, 1, 2048]
    - [8, 0.0]
  - - [1280, 16, 1, 8192]
    - [11, 0.0]
  - - [1280, 16, 1, 32768]
    - [12, 0.0]
  - - [1536, 16, 1, 2048]
    - [13, 0.0]
  - - [1536, 16, 1, 8192]
    - [11, 0.0]
  - - [1536, 16, 1, 32768]
    - [12, 0.0]
  - - [1792, 16, 1, 2048]
    - [6, 0.0]
  - - [1792, 16, 1, 8192]
    - [13, 0.0]
  - - [1792, 16, 1, 32768]
    - [12, 0.0]
  - - [2048, 16, 1, 2048]
    - [8, 0.0]
  - - [2048, 16, 1, 8192]
    - [6, 0.0]
  - - [2048, 16, 1, 32768]
    - [8, 0.0]
  - - [2304, 16, 1, 2048]
    - [6, 0.0]
  - - [2304, 16, 1, 8192]
    - [6, 0.0]
  - - [2304, 16, 1, 32768]
    - [8, 0.0]
  - - [2560, 16, 1, 2048]
    - [14, 0.0]
  - - [2560, 16, 1, 8192]
    - [15, 0.0]
  - - [2560, 16, 1, 32768]
    - [15, 0.0]
  - - [2816, 16, 1, 2048]
    - [14, 0.0]
  - - [2816, 16, 1, 8192]
    - [15, 0.0]
  - - [2816, 16, 1, 32768]
    - [15, 0.0]
  - - [3072, 16, 1, 2048]
    - [14, 0.0]
  - - [3072, 16, 1, 8192]
    - [15, 0.0]
  - - [3072, 16, 1, 32768]
    - [15, 0.0]
  - - [3584, 16, 1, 2048]
    - [6, 0.0]
  - - [3584, 16, 1, 8192]
    - [16, 0.0]
  - - [3584, 16, 1, 32768]
    - [16, 0.0]
  - - [4096, 16, 1, 2048]
    - [8, 0.0]
  - - [4096, 16, 1, 8192]
    - [16, 0.0]
  - - [4096, 16, 1, 32768]
    - [16, 0.0]
  - - [4608, 16, 1, 2048]
    - [8, 0.0]
  - - [4608, 16, 1, 8192]
    - [8, 0.0]
  - - [4608, 16, 1, 32768]
    - [17, 0.0]
  - - [5120, 16, 1, 2048]
    - [15, 0.0]
  - - [5120, 16, 1, 8192]
    - [15, 0.0]
  - - [5120, 16, 1, 32768]
    - [15, 0.0]
  - - [5632, 16, 1, 2048]
    - [8, 0.0]
  - - [5632, 16, 1, 8192]
    - [15, 0.0]
  - - [5632, 16, 1, 32768]
    - [15, 0.0]
  - - [6144, 16, 1, 2048]
    - [8, 0.0]
  - - [6144, 16, 1, 8192]
    - [15, 0.0]
  - - [6144, 16, 1, 32768]
    - [15, 0.0]
  - - [7168, 16, 1, 2048]
    - [8, 0.0]
  - - [7168, 16, 1, 8192]
    - [15, 0.0]
  - - [7168, 16, 1, 32768]
    - [15, 0.0]
  - - [8192, 16, 1, 2048]
    - [8, 0.0]
  - - [8192, 16, 1, 8192]
    - [16, 0.0]
  - - [8192, 16, 1, 32768]
    - [16, 0.0]
  - - [10240, 16, 1, 2048]
    - [8, 0.0]
  - - [10240, 16, 1, 8192]
    - [8, 0.0]
  - - [10240, 16, 1, 32768]
    - [15, 0.0]
  - - [12288, 16, 1, 2048]
    - [18, 0.0]
  - - [12288, 16, 1, 8192]
    - [15, 0.0]
  - - [12288, 16, 1, 32768]
    - [15, 0.0]
  - - [14336, 16, 1, 2048]
    - [18, 0.0]
  - - [14336, 16, 1, 8192]
    - [16, 0.0]
  - - [14336, 16, 1, 32768]
    - [15, 0.0]
  - - [16384, 16, 1, 2048]
    - [18, 0.0]
  - - [16384, 16, 1, 8192]
    - [8, 0.0]
  - - [16384, 16, 1, 32768]
    - [16, 0.0]
  - - [20480, 16, 1, 2048]
    - [18, 0.0]
  - - [20480, 16, 1, 8192]
    - [15, 0.0]
  - - [20480, 16, 1, 32768]
    - [15, 0.0]
  - - [24576, 16, 1, 2048]
    - [18, 0.0]
  - - [24576, 16, 1, 8192]
    - [8, 0.0]
  - - [24576, 16, 1, 32768]
    - [15, 0.0]
  - - [28672, 16, 1, 2048]
    - [18, 0.0]
  - - [28672, 16, 1, 8192]
    - [16, 0.0]
  - - [28672, 16, 1, 32768]
    - [16, 0.0]
  - - [32768, 16, 1, 2048]
    - [18, 0.0]
  - - [32768, 16, 1, 8192]
    - [16, 0.0]
  - - [32768, 16, 1, 32768]
    - [16, 0.0]
  - - [40960, 16, 1, 2048]
    - [18, 0.0]
  - - [40960, 16, 1, 8192]
    - [16, 0.0]
  - - [40960, 16, 1, 32768]
    - [16, 0.0]
  - - [49152, 16, 1, 2048]
    - [18, 0.0]
  - - [49152, 16, 1, 8192]
    - [15, 0.0]
  - - [49152, 16, 1, 32768]
    - [15, 0.0]
  - - [57344, 16, 1, 512]
    - [19, 0.0]
  - - [57344, 16, 1, 2048]
    - [18, 0.0]
  - - [57344, 16, 1, 8192]
    - [16, 0.0]
  - - [65536, 16, 1, 512]
    - [19, 0.0]
  - - [65536, 16, 1, 2048]
    - [18, 0.0]
  - - [65536, 16, 1, 8192]
    - [16, 0.0]
  - - [98304, 16, 1, 512]
    - [19, 0.0]
  - - [98304, 16, 1, 2048]
    - [18, 0.0]
  - - [98304, 16, 1, 8192]
    - [16, 0.0]
  - - [131072, 16, 1, 512]
    - [19, 0.0]
  - - [131072, 16, 1, 2048]
    - [18, 0.0]
  - - [131072, 16, 1, 8192]
    - [16, 0.0]
  - - [16, 32, 1, 2048]
    - [20, 0.0]
  - - [16, 32, 1, 8192]
    - [1, 0.0]
  - - [16, 32, 1, 32768]
    - [21, 0.0]
  - - [32, 32, 1, 2048]
    - [22, 0.0]
  - - [32, 32, 1, 8192]
    - [1, 0.0]
  - - [32, 32, 1, 32768]
    - [1, 0.0]
  - - [48, 32, 1, 2048]
    - [2, 0.0]
  - - [48, 32, 1, 8192]
    - [1, 0.0]
  - - [48, 32, 1, 32768]
    - [1, 0.0]
  - - [64, 32, 1, 2048]
    - [1, 0.0]
  - - [64, 32, 1, 8192]
    - [6, 0.0]
  - - [64, 32, 1, 32768]
    - [8, 0.0]
  - - [80, 32, 1, 2048]
    - [1, 0.0]
  - - [80, 32, 1, 8192]
    - [23, 0.0]
  - - [80, 32, 1, 32768]
    - [24, 0.0]
  - - [96, 32, 1, 2048]
    - [1, 0.0]
  - - [96, 32, 1, 8192]
    - [9, 0.0]
  - - [96, 32, 1, 32768]
    - [9, 0.0]
  - - [112, 32, 1, 2048]
    - [1, 0.0]
  - - [112, 32, 1, 8192]
    - [23, 0.0]
  - - [112, 32, 1, 32768]
    - [25, 0.0]
  - - [128, 32, 1, 2048]
    - [7, 0.0]
  - - [128, 32, 1, 8192]
    - [23, 0.0]
  - - [128, 32, 1, 32768]
    - [8, 0.0]
  - - [160, 32, 1, 2048]
    - [7, 0.0]
  - - [160, 32, 1, 8192]
    - [23, 0.0]
  - - [160, 32, 1, 32768]
    - [23, 0.0]
  - - [192, 32, 1, 2048]
    - [7, 0.0]
  - - [192, 32, 1, 8192]
    - [23, 0.0]
  - - [192, 32, 1, 32768]
    - [23, 0.0]
  - - [224, 32, 1, 2048]
    - [7, 0.0]
  - - [224, 32, 1, 8192]
    - [26, 0.0]
  - - [224, 32, 1, 32768]
    - [23, 0.0]
  - - [256, 32, 1, 2048]
    - [9, 0.0]
  - - [256, 32, 1, 8192]
    - [27, 0.0]
  - - [256, 32, 1, 32768]
    - [23, 0.0]
  - - [320, 32, 1, 2048]
    - [9, 0.0]
  - - [320, 32, 1, 8192]
    - [28, 0.0]
  - - [320, 32, 1, 32768]
    - [29, 0.0]
  - - [384, 32, 1, 2048]
    - [9, 0.0]
  - - [384, 32, 1, 8192]
    - [23, 0.0]
  - - [384, 32, 1, 32768]
    - [23, 0.0]
  - - [448, 32, 1, 2048]
    - [9, 0.0]
  - - [448, 32, 1, 8192]
    - [29, 0.0]
  - - [448, 32, 1, 32768]
    - [30, 0.0]
  - - [512, 32, 1, 2048]
    - [10, 0.0]
  - - [512, 32, 1, 8192]
    - [23, 0.0]
  - - [512, 32, 1, 32768]
    - [29, 0.0]
  - - [576, 32, 1, 2048]
    - [10, 0.0]
  - - [576, 32, 1, 8192]
    - [10, 0.0]
  - - [576, 32, 1, 32768]
    - [23, 0.0]
  - - [640, 32, 1, 2048]
    - [31, 0.0]
  - - [640, 32, 1, 8192]
    - [32, 0.0]
  - - [640, 32, 1, 32768]
    - [29, 0.0]
  - - [768, 32, 1, 2048]
    - [31, 0.0]
  - - [768, 32, 1, 8192]
    - [29, 0.0]
  - - [768, 32, 1, 32768]
    - [33, 0.0]
  - - [896, 32, 1, 2048]
    - [23, 0.0]
  - - [896, 32, 1, 8192]
    - [31, 0.0]
  - - [896, 32, 1, 32768]
    - [30, 0.0]
  - - [1024, 32, 1, 2048]
    - [8, 0.0]
  - - [1024, 32, 1, 8192]
    - [23, 0.0]
  - - [1024, 32, 1, 32768]
    - [29, 0.0]
  - - [1280, 32, 1, 2048]
    - [30, 0.0]
  - - [1280, 32, 1, 8192]
    - [32, 0.0]
  - - [1280, 32, 1, 32768]
    - [34, 0.0]
  - - [1536, 32, 1, 2048]
    - [32, 0.0]
  - - [1536, 32, 1, 8192]
    - [30, 0.0]
  - - [1536, 32, 1, 32768]
    - [32, 0.0]
  - - [1792, 32, 1, 2048]
    - [32, 0.0]
  - - [1792, 32, 1, 8192]
    - [32, 0.0]
  - - [1792, 32, 1, 32768]
    - [32, 0.0]
  - - [2048, 32, 1, 2048]
    - [29, 0.0]
  - - [2048, 32, 1, 8192]
    - [35, 0.0]
  - - [2048, 32, 1, 32768]
    - [35, 0.0]
  - - [2304, 32, 1, 2048]
    - [29, 0.0]
  - - [2304, 32, 1, 8192]
    - [29, 0.0]
  - - [2304, 32, 1, 32768]
    - [33, 0.0]
  - - [2560, 32, 1, 2048]
    - [36, 0.0]
  - - [2560, 32, 1, 8192]
    - [36, 0.0]
  - - [2560, 32, 1, 32768]
    - [34, 0.0]
  - - [2816, 32, 1, 2048]
    - [36, 0.0]
  - - [2816, 32, 1, 8192]
    - [36, 0.0]
  - - [2816, 32, 1, 32768]
    - [36, 0.0]
  - - [3072, 32, 1, 2048]
    - [37, 0.0]
  - - [3072, 32, 1, 8192]
    - [36, 0.0]
  - - [3072, 32, 1, 32768]
    - [36, 0.0]
  - - [3584, 32, 1, 2048]
    - [37, 0.0]
  - - [3584, 32, 1, 8192]
    - [36, 0.0]
  - - [3584, 32, 1, 32768]
    - [38, 0.0]
  - - [4096, 32, 1, 2048]
    - [29, 0.0]
  - - [4096, 32, 1, 8192]
    - [39, 0.0]
  - - [4096, 32, 1, 32768]
    - [40, 0.0]
  - - [4608, 32, 1, 2048]
    - [29, 0.0]
  - - [4608, 32, 1, 8192]
    - [39, 0.0]
  - - [4608, 32, 1, 32768]
    - [39, 0.0]
  - - [5120, 32, 1, 2048]
    - [34, 0.0]
  - - [5120, 32, 1, 8192]
    - [34, 0.0]
  - - [5120, 32, 1, 32768]
    - [34, 0.0]
  - - [5632, 32, 1, 2048]
    - [34, 0.0]
  - - [5632, 32, 1, 8192]
    - [34, 0.0]
  - - [5632, 32, 1, 32768]
    - [41, 0.0]
  - - [6144, 32, 1, 2048]
    - [29, 0.0]
  - - [6144, 32, 1, 8192]
    - [41, 0.0]
  - - [6144, 32, 1, 32768]
    - [41, 0.0]
  - - [7168, 32, 1, 2048]
    - [27, 0.0]
  - - [7168, 32, 1, 8192]
    - [42, 0.0]
  - - [7168, 32, 1, 32768]
    - [42, 0.0]
  - - [8192, 32, 1, 2048]
    - [27, 0.0]
  - - [8192, 32, 1, 8192]
    - [39, 0.0]
  - - [8192, 32, 1, 32768]
    - [43, 0.0]
  - - [10240, 32, 1, 2048]
    - [36, 0.0]
  - - [10240, 32, 1, 8192]
    - [36, 0.0]
  - - [10240, 32, 1, 32768]
    - [42, 0.0]
  - - [12288, 32, 1, 2048]
    - [27, 0.0]
  - - [12288, 32, 1, 8192]
    - [41, 0.0]
  - - [12288, 32, 1, 32768]
    - [41, 0.0]
  - - [14336, 32, 1, 2048]
    - [27, 0.0]
  - - [14336, 32, 1, 8192]
    - [36, 0.0]
  - - [14336, 32, 1, 32768]
    - [42, 0.0]
  - - [16384, 32, 1, 2048]
    - [27, 0.0]
  - - [16384, 32, 1, 8192]
    - [29, 0.0]
  - - [16384, 32, 1, 32768]
    - [33, 0.0]
  - - [20480, 32, 1, 2048]
    - [27, 0.0]
  - - [20480, 32, 1, 8192]
    - [42, 0.0]
  - - [20480, 32, 1, 32768]
    - [41, 0.0]
  - - [24576, 32, 1, 2048]
    - [44, 0.0]
  - - [24576, 32, 1, 8192]
    - [36, 0.0]
  - - [24576, 32, 1, 32768]
    - [36, 0.0]
  - - [28672, 32, 1, 512]
    - [45, 0.0]
  - - [28672, 32, 1, 2048]
    - [44, 0.0]
  - - [28672, 32, 1, 8192]
    - [43, 0.0]
  - - [32768, 32, 1, 512]
    - [44, 0.0]
  - - [32768, 32, 1, 2048]
    - [44, 0.0]
  - - [32768, 32, 1, 8192]
    - [36, 0.0]
  - - [40960, 32, 1, 512]
    - [44, 0.0]
  - - [40960, 32, 1, 2048]
    - [44, 0.0]
  - - [40960, 32, 1, 8192]
    - [34, 0.0]
  - - [49152, 32, 1, 512]
    - [44, 0.0]
  - - [49152, 32, 1, 2048]
    - [44, 0.0]
  - - [49152, 32, 1, 8192]
    - [41, 0.0]
  - - [57344, 32, 1, 512]
    - [44, 0.0]
  - - [57344, 32, 1, 2048]
    - [44, 0.0]
  - - [57344, 32, 1, 8192]
    - [40, 0.0]
  - - [65536, 32, 1, 512]
    - [45, 0.0]
  - - [65536, 32, 1, 2048]
    - [45, 0.0]
  - - [65536, 32, 1, 8192]
    - [46, 0.0]
  - - [98304, 32, 1, 512]
    - [45, 0.0]
  - - [98304, 32, 1, 2048]
    - [47, 0.0]
  - - [98304, 32, 1, 8192]
    - [48, 0.0]
  - - [131072, 32, 1, 512]
    - [45, 0.0]
  - - [131072, 32, 1, 2048]
    - [49, 0.0]
  - - [131072, 32, 1, 8192]
    - [47, 0.0]
  - - [16, 48, 1, 2048]
    - [1, 0.0]
  - - [16, 48, 1, 8192]
    - [7, 0.0]
  - - [16, 48, 1, 32768]
    - [7, 0.0]
  - - [32, 48, 1, 2048]
    - [1, 0.0]
  - - [32, 48, 1, 8192]
    - [7, 0.0]
  - - [32, 48, 1, 32768]
    - [9, 0.0]
  - - [48, 48, 1, 2048]
    - [1, 0.0]
  - - [48, 48, 1, 8192]
    - [1, 0.0]
  - - [48, 48, 1, 32768]
    - [4, 0.0]
  - - [64, 48, 1, 2048]
    - [1, 0.0]
  - - [64, 48, 1, 8192]
    - [6, 0.0]
  - - [64, 48, 1, 32768]
    - [10, 0.0]
  - - [80, 48, 1, 2048]
    - [1, 0.0]
  - - [80, 48, 1, 8192]
    - [6, 0.0]
  - - [80, 48, 1, 32768]
    - [6, 0.0]
  - - [96, 48, 1, 2048]
    - [1, 0.0]
  - - [96, 48, 1, 8192]
    - [9, 0.0]
  - - [96, 48, 1, 32768]
    - [6, 0.0]
  - - [112, 48, 1, 2048]
    - [1, 0.0]
  - - [112, 48, 1, 8192]
    - [6, 0.0]
  - - [112, 48, 1, 32768]
    - [50, 0.0]
  - - [128, 48, 1, 2048]
    - [8, 0.0]
  - - [128, 48, 1, 8192]
    - [8, 0.0]
  - - [128, 48, 1, 32768]
    - [8, 0.0]
  - - [160, 48, 1, 2048]
    - [24, 0.0]
  - - [160, 48, 1, 8192]
    - [8, 0.0]
  - - [160, 48, 1, 32768]
    - [51, 0.0]
  - - [192, 48, 1, 2048]
    - [9, 0.0]
  - - [192, 48, 1, 8192]
    - [8, 0.0]
  - - [192, 48, 1, 32768]
    - [51, 0.0]
  - - [224, 48, 1, 2048]
    - [9, 0.0]
  - - [224, 48, 1, 8192]
    - [50, 0.0]
  - - [224, 48, 1, 32768]
    - [51, 0.0]
  - - [256, 48, 1, 2048]
    - [10, 0.0]
  - - [256, 48, 1, 8192]
    - [52, 0.0]
  - - [256, 48, 1, 32768]
    - [53, 0.0]
  - - [320, 48, 1, 2048]
    - [10, 0.0]
  - - [320, 48, 1, 8192]
    - [52, 0.0]
  - - [320, 48, 1, 32768]
    - [53, 0.0]
  - - [384, 48, 1, 2048]
    - [10, 0.0]
  - - [384, 48, 1, 8192]
    - [52, 0.0]
  - - [384, 48, 1, 32768]
    - [53, 0.0]
  - - [448, 48, 1, 2048]
    - [23, 0.0]
  - - [448, 48, 1, 8192]
    - [52, 0.0]
  - - [448, 48, 1, 32768]
    - [51, 0.0]
  - - [512, 48, 1, 2048]
    - [52, 0.0]
  - - [512, 48, 1, 8192]
    - [53, 0.0]
  - - [512, 48, 1, 32768]
    - [53, 0.0]
  - - [576, 48, 1, 2048]
    - [52, 0.0]
  - - [576, 48, 1, 8192]
    - [53, 0.0]
  - - [576, 48, 1, 32768]
    - [53, 0.0]
  - - [640, 48, 1, 2048]
    - [8, 0.0]
  - - [640, 48, 1, 8192]
    - [53, 0.0]
  - - [640, 48, 1, 32768]
    - [53, 0.0]
  - - [768, 48, 1, 2048]
    - [51, 0.0]
  - - [768, 48, 1, 8192]
    - [53, 0.0]
  - - [768, 48, 1, 32768]
    - [53, 0.0]
  - - [896, 48, 1, 2048]
    - [32, 0.0]
  - - [896, 48, 1, 8192]
    - [51, 0.0]
  - - [896, 48, 1, 32768]
    - [51, 0.0]
  - - [1024, 48, 1, 2048]
    - [29, 0.0]
  - - [1024, 48, 1, 8192]
    - [53, 0.0]
  - - [1024, 48, 1, 32768]
    - [53, 0.0]
  - - [1280, 48, 1, 2048]
    - [51, 0.0]
  - - [1280, 48, 1, 8192]
    - [54, 0.0]
  - - [1280, 48, 1, 32768]
    - [54, 0.0]
  - - [1536, 48, 1, 2048]
    - [51, 0.0]
  - - [1536, 48, 1, 8192]
    - [51, 0.0]
  - - [1536, 48, 1, 32768]
    - [51, 0.0]
  - - [1792, 48, 1, 2048]
    - [51, 0.0]
  - - [1792, 48, 1, 8192]
    - [51, 0.0]
  - - [1792, 48, 1, 32768]
    - [51, 0.0]
  - - [2048, 48, 1, 2048]
    - [51, 0.0]
  - - [2048, 48, 1, 8192]
    - [51, 0.0]
  - - [2048, 48, 1, 32768]
    - [51, 0.0]
  - - [2304, 48, 1, 2048]
    - [53, 0.0]
  - - [2304, 48, 1, 8192]
    - [51, 0.0]
  - - [2304, 48, 1, 32768]
    - [51, 0.0]
  - - [2560, 48, 1, 2048]
    - [55, 0.0]
  - - [2560, 48, 1, 8192]
    - [54, 0.0]
  - - [2560, 48, 1, 32768]
    - [56, 0.0]
  - - [2816, 48, 1, 2048]
    - [55, 0.0]
  - - [2816, 48, 1, 8192]
    - [54, 0.0]
  - - [2816, 48, 1, 32768]
    - [56, 0.0]
  - - [3072, 48, 1, 2048]
    - [55, 0.0]
  - - [3072, 48, 1, 8192]
    - [56, 0.0]
  - - [3072, 48, 1, 32768]
    - [56, 0.0]
  - - [3584, 48, 1, 2048]
    - [51, 0.0]
  - - [3584, 48, 1, 8192]
    - [57, 0.0]
  - - [3584, 48, 1, 32768]
    - [55, 0.0]
  - - [4096, 48, 1, 2048]
    - [52, 0.0]
  - - [4096, 48, 1, 8192]
    - [54, 0.0]
  - - [4096, 48, 1, 32768]
    - [55, 0.0]
  - - [4608, 48, 1, 2048]
    - [52, 0.0]
  - - [4608, 48, 1, 8192]
    - [54, 0.0]
  - - [4608, 48, 1, 32768]
    - [54, 0.0]
  - - [5120, 48, 1, 2048]
    - [56, 0.0]
  - - [5120, 48, 1, 8192]
    - [56, 0.0]
  - - [5120, 48, 1, 32768]
    - [56, 0.0]
  - - [5632, 48, 1, 2048]
    - [52, 0.0]
  - - [5632, 48, 1, 8192]
    - [56, 0.0]
  - - [5632, 48, 1, 32768]
    - [56, 0.0]
  - - [6144, 48, 1, 2048]
    - [52, 0.0]
  - - [6144, 48, 1, 8192]
    - [56, 0.0]
  - - [6144, 48, 1, 32768]
    - [56, 0.0]
  - - [7168, 48, 1, 2048]
    - [52, 0.0]
  - - [7168, 48, 1, 8192]
    - [57, 0.0]
  - - [7168, 48, 1, 32768]
    - [56, 0.0]
  - - [8192, 48, 1, 2048]
    - [52, 0.0]
  - - [8192, 48, 1, 8192]
    - [54, 0.0]
  - - [8192, 48, 1, 32768]
    - [54, 0.0]
  - - [10240, 48, 1, 2048]
    - [52, 0.0]
  - - [10240, 48, 1, 8192]
    - [57, 0.0]
  - - [10240, 48, 1, 32768]
    - [56, 0.0]
  - - [12288, 48, 1, 2048]
    - [52, 0.0]
  - - [12288, 48, 1, 8192]
    - [54, 0.0]
  - - [12288, 48, 1, 32768]
    - [56, 0.0]
  - - [14336, 48, 1, 2048]
    - [52, 0.0]
  - - [14336, 48, 1, 8192]
    - [53, 0.0]
  - - [14336, 48, 1, 32768]
    - [56, 0.0]
  - - [16384, 48, 1, 2048]
    - [52, 0.0]
  - - [16384, 48, 1, 8192]
    - [52, 0.0]
  - - [16384, 48, 1, 32768]
    - [57, 0.0]
  - - [20480, 48, 1, 512]
    - [52, 0.0]
  - - [20480, 48, 1, 2048]
    - [52, 0.0]
  - - [20480, 48, 1, 8192]
    - [56, 0.0]
  - - [24576, 48, 1, 512]
    - [52, 0.0]
  - - [24576, 48, 1, 2048]
    - [52, 0.0]
  - - [24576, 48, 1, 8192]
    - [56, 0.0]
  - - [28672, 48, 1, 512]
    - [52, 0.0]
  - - [28672, 48, 1, 2048]
    - [52, 0.0]
  - - [28672, 48, 1, 8192]
    - [54, 0.0]
  - - [32768, 48, 1, 512]
    - [58, 0.0]
  - - [32768, 48, 1, 2048]
    - [58, 0.0]
  - - [32768, 48, 1, 8192]
    - [59, 0.0]
  - - [40960, 48, 1, 512]
    - [58, 0.0]
  - - [40960, 48, 1, 2048]
    - [58, 0.0]
  - - [40960, 48, 1, 8192]
    - [60, 0.0]
  - - [49152, 48, 1, 512]
    - [58, 0.0]
  - - [49152, 48, 1, 2048]
    - [58, 0.0]
  - - [49152, 48, 1, 8192]
    - [61, 0.0]
  - - [57344, 48, 1, 512]
    - [58, 0.0]
  - - [57344, 48, 1, 2048]
    - [58, 0.0]
  - - [57344, 48, 1, 8192]
    - [59, 0.0]
  - - [65536, 48, 1, 512]
    - [58, 0.0]
  - - [65536, 48, 1, 2048]
    - [58, 0.0]
  - - [65536, 48, 1, 8192]
    - [59, 0.0]
  - - [98304, 48, 1, 512]
    - [58, 0.0]
  - - [98304, 48, 1, 2048]
    - [58, 0.0]
  - - [98304, 48, 1, 8192]
    - [60, 0.0]
  - - [131072, 48, 1, 512]
    - [58, 0.0]
  - - [131072, 48, 1, 2048]
    - [58, 0.0]
  - - [131072, 48, 1, 8192]
    - [60, 0.0]
  - - [16, 64, 1, 2048]
    - [1, 0.0]
  - - [16, 64, 1, 8192]
    - [7, 0.0]
  - - [16, 64, 1, 32768]
    - [7, 0.0]
  - - [32, 64, 1, 2048]
    - [1, 0.0]
  - - [32, 64, 1, 8192]
    - [1, 0.0]
  - - [32, 64, 1, 32768]
    - [9, 0.0]
  - - [48, 64, 1, 2048]
    - [1, 0.0]
  - - [48, 64, 1, 8192]
    - [21, 0.0]
  - - [48, 64, 1, 32768]
    - [21, 0.0]
  - - [64, 64, 1, 2048]
    - [62, 0.0]
  - - [64, 64, 1, 8192]
    - [23, 0.0]
  - - [64, 64, 1, 32768]
    - [23, 0.0]
  - - [80, 64, 1, 2048]
    - [62, 0.0]
  - - [80, 64, 1, 8192]
    - [63, 0.0]
  - - [80, 64, 1, 32768]
    - [32, 0.0]
  - - [96, 64, 1, 2048]
    - [7, 0.0]
  - - [96, 64, 1, 8192]
    - [64, 0.0]
  - - [96, 64, 1, 32768]
    - [65, 0.0]
  - - [112, 64, 1, 2048]
    - [7, 0.0]
  - - [112, 64, 1, 8192]
    - [29, 0.0]
  - - [112, 64, 1, 32768]
    - [32, 0.0]
  - - [128, 64, 1, 2048]
    - [8, 0.0]
  - - [128, 64, 1, 8192]
    - [33, 0.0]
  - - [128, 64, 1, 32768]
    - [29, 0.0]
  - - [160, 64, 1, 2048]
    - [24, 0.0]
  - - [160, 64, 1, 8192]
    - [64, 0.0]
  - - [160, 64, 1, 32768]
    - [64, 0.0]
  - - [192, 64, 1, 2048]
    - [24, 0.0]
  - - [192, 64, 1, 8192]
    - [64, 0.0]
  - - [192, 64, 1, 32768]
    - [64, 0.0]
  - - [224, 64, 1, 2048]
    - [9, 0.0]
  - - [224, 64, 1, 8192]
    - [65, 0.0]
  - - [224, 64, 1, 32768]
    - [64, 0.0]
  - - [256, 64, 1, 2048]
    - [3, 0.0]
  - - [256, 64, 1, 8192]
    - [29, 0.0]
  - - [256, 64, 1, 32768]
    - [66, 0.0]
  - - [320, 64, 1, 2048]
    - [67, 0.0]
  - - [320, 64, 1, 8192]
    - [68, 0.0]
  - - [320, 64, 1, 32768]
    - [68, 0.0]
  - - [384, 64, 1, 2048]
    - [69, 0.0]
  - - [384, 64, 1, 8192]
    - [29, 0.0]
  - - [384, 64, 1, 32768]
    - [70, 0.0]
  - - [448, 64, 1, 2048]
    - [31, 0.0]
  - - [448, 64, 1, 8192]
    - [66, 0.0]
  - - [448, 64, 1, 32768]
    - [70, 0.0]
  - - [512, 64, 1, 2048]
    - [23, 0.0]
  - - [512, 64, 1, 8192]
    - [68, 0.0]
  - - [512, 64, 1, 32768]
    - [70, 0.0]
  - - [576, 64, 1, 2048]
    - [23, 0.0]
  - - [576, 64, 1, 8192]
    - [29, 0.0]
  - - [576, 64, 1, 32768]
    - [70, 0.0]
  - - [640, 64, 1, 2048]
    - [32, 0.0]
  - - [640, 64, 1, 8192]
    - [71, 0.0]
  - - [640, 64, 1, 32768]
    - [72, 0.0]
  - - [768, 64, 1, 2048]
    - [32, 0.0]
  - - [768, 64, 1, 8192]
    - [68, 0.0]
  - - [768, 64, 1, 32768]
    - [70, 0.0]
  - - [896, 64, 1, 2048]
    - [32, 0.0]
  - - [896, 64, 1, 8192]
    - [73, 0.0]
  - - [896, 64, 1, 32768]
    - [74, 0.0]
  - - [1024, 64, 1, 2048]
    - [29, 0.0]
  - - [1024, 64, 1, 8192]
    - [71, 0.0]
  - - [1024, 64, 1, 32768]
    - [74, 0.0]
  - - [1280, 64, 1, 2048]
    - [73, 0.0]
  - - [1280, 64, 1, 8192]
    - [71, 0.0]
  - - [1280, 64, 1, 32768]
    - [72, 0.0]
  - - [1536, 64, 1, 2048]
    - [73, 0.0]
  - - [1536, 64, 1, 8192]
    - [71, 0.0]
  - - [1536, 64, 1, 32768]
    - [75, 0.0]
  - - [1792, 64, 1, 2048]
    - [73, 0.0]
  - - [1792, 64, 1, 8192]
    - [70, 0.0]
  - - [1792, 64, 1, 32768]
    - [70, 0.0]
  - - [2048, 64, 1, 2048]
    - [68, 0.0]
  - - [2048, 64, 1, 8192]
    - [76, 0.0]
  - - [2048, 64, 1, 32768]
    - [71, 0.0]
  - - [2304, 64, 1, 2048]
    - [68, 0.0]
  - - [2304, 64, 1, 8192]
    - [68, 0.0]
  - - [2304, 64, 1, 32768]
    - [74, 0.0]
  - - [2560, 64, 1, 2048]
    - [70, 0.0]
  - - [2560, 64, 1, 8192]
    - [72, 0.0]
  - - [2560, 64, 1, 32768]
    - [72, 0.0]
  - - [2816, 64, 1, 2048]
    - [77, 0.0]
  - - [2816, 64, 1, 8192]
    - [72, 0.0]
  - - [2816, 64, 1, 32768]
    - [72, 0.0]
  - - [3072, 64, 1, 2048]
    - [70, 0.0]
  - - [3072, 64, 1, 8192]
    - [70, 0.0]
  - - [3072, 64, 1, 32768]
    - [70, 0.0]
  - - [3584, 64, 1, 2048]
    - [78, 0.0]
  - - [3584, 64, 1, 8192]
    - [70, 0.0]
  - - [3584, 64, 1, 32768]
    - [70, 0.0]
  - - [4096, 64, 1, 2048]
    - [71, 0.0]
  - - [4096, 64, 1, 8192]
    - [71, 0.0]
  - - [4096, 64, 1, 32768]
    - [79, 0.0]
  - - [4608, 64, 1, 2048]
    - [71, 0.0]
  - - [4608, 64, 1, 8192]
    - [74, 0.0]
  - - [4608, 64, 1, 32768]
    - [71, 0.0]
  - - [5120, 64, 1, 2048]
    - [72, 0.0]
  - - [5120, 64, 1, 8192]
    - [72, 0.0]
  - - [5120, 64, 1, 32768]
    - [72, 0.0]
  - - [5632, 64, 1, 2048]
    - [72, 0.0]
  - - [5632, 64, 1, 8192]
    - [72, 0.0]
  - - [5632, 64, 1, 32768]
    - [72, 0.0]
  - - [6144, 64, 1, 2048]
    - [70, 0.0]
  - - [6144, 64, 1, 8192]
    - [70, 0.0]
  - - [6144, 64, 1, 32768]
    - [70, 0.0]
  - - [7168, 64, 1, 2048]
    - [70, 0.0]
  - - [7168, 64, 1, 8192]
    - [70, 0.0]
  - - [7168, 64, 1, 32768]
    - [70, 0.0]
  - - [8192, 64, 1, 2048]
    - [71, 0.0]
  - - [8192, 64, 1, 8192]
    - [71, 0.0]
  - - [8192, 64, 1, 32768]
    - [71, 0.0]
  - - [10240, 64, 1, 2048]
    - [70, 0.0]
  - - [10240, 64, 1, 8192]
    - [70, 0.0]
  - - [10240, 64, 1, 32768]
    - [70, 0.0]
  - - [12288, 64, 1, 2048]
    - [71, 0.0]
  - - [12288, 64, 1, 8192]
    - [71, 0.0]
  - - [12288, 64, 1, 32768]
    - [79, 0.0]
  - - [14336, 64, 1, 512]
    - [80, 0.0]
  - - [14336, 64, 1, 2048]
    - [71, 0.0]
  - - [14336, 64, 1, 8192]
    - [71, 0.0]
  - - [16384, 64, 1, 512]
    - [81, 0.0]
  - - [16384, 64, 1, 2048]
    - [81, 0.0]
  - - [16384, 64, 1, 8192]
    - [82, 0.0]
  - - [20480, 64, 1, 512]
    - [83, 0.0]
  - - [20480, 64, 1, 2048]
    - [84, 0.0]
  - - [20480, 64, 1, 8192]
    - [84, 0.0]
  - - [24576, 64, 1, 512]
    - [85, 0.0]
  - - [24576, 64, 1, 2048]
    - [81, 0.0]
  - - [24576, 64, 1, 8192]
    - [82, 0.0]
  - - [28672, 64, 1, 512]
    - [85, 0.0]
  - - [28672, 64, 1, 2048]
    - [85, 0.0]
  - - [28672, 64, 1, 8192]
    - [86, 0.0]
  - - [32768, 64, 1, 512]
    - [80, 0.0]
  - - [32768, 64, 1, 2048]
    - [80, 0.0]
  - - [32768, 64, 1, 8192]
    - [87, 0.0]
  - - [40960, 64, 1, 512]
    - [80, 0.0]
  - - [40960, 64, 1, 2048]
    - [80, 0.0]
  - - [40960, 64, 1, 8192]
    - [88, 0.0]
  - - [49152, 64, 1, 512]
    - [80, 0.0]
  - - [49152, 64, 1, 2048]
    - [84, 0.0]
  - - [49152, 64, 1, 8192]
    - [89, 0.0]
  - - [57344, 64, 1, 512]
    - [80, 0.0]
  - - [57344, 64, 1, 2048]
    - [88, 0.0]
  - - [57344, 64, 1, 8192]
    - [88, 0.0]
  - - [65536, 64, 1, 512]
    - [90, 0.0]
  - - [65536, 64, 1, 2048]
    - [91, 0.0]
  - - [65536, 64, 1, 8192]
    - [91, 0.0]
  - - [98304, 64, 1, 512]
    - [90, 0.0]
  - - [98304, 64, 1, 2048]
    - [92, 0.0]
  - - [98304, 64, 1, 8192]
    - [92, 0.0]
  - - [131072, 64, 1, 512]
    - [90, 0.0]
  - - [131072, 64, 1, 2048]
    - [92, 0.0]
  - - [131072, 64, 1, 8192]
    - [92, 0.0]
  - - [16, 80, 1, 2048]
    - [1, 0.0]
  - - [16, 80, 1, 8192]
    - [7, 0.0]
  - - [16, 80, 1, 32768]
    - [7, 0.0]
  - - [32, 80, 1, 2048]
    - [1, 0.0]
  - - [32, 80, 1, 8192]
    - [6, 0.0]
  - - [32, 80, 1, 32768]
    - [9, 0.0]
  - - [48, 80, 1, 2048]
    - [1, 0.0]
  - - [48, 80, 1, 8192]
    - [26, 0.0]
  - - [48, 80, 1, 32768]
    - [26, 0.0]
  - - [64, 80, 1, 2048]
    - [7, 0.0]
  - - [64, 80, 1, 8192]
    - [8, 0.0]
  - - [64, 80, 1, 32768]
    - [8, 0.0]
  - - [80, 80, 1, 2048]
    - [7, 0.0]
  - - [80, 80, 1, 8192]
    - [23, 0.0]
  - - [80, 80, 1, 32768]
    - [51, 0.0]
  - - [96, 80, 1, 2048]
    - [7, 0.0]
  - - [96, 80, 1, 8192]
    - [23, 0.0]
  - - [96, 80, 1, 32768]
    - [51, 0.0]
  - - [112, 80, 1, 2048]
    - [7, 0.0]
  - - [112, 80, 1, 8192]
    - [32, 0.0]
  - - [112, 80, 1, 32768]
    - [32, 0.0]
  - - [128, 80, 1, 2048]
    - [10, 0.0]
  - - [128, 80, 1, 8192]
    - [93, 0.0]
  - - [128, 80, 1, 32768]
    - [94, 0.0]
  - - [160, 80, 1, 2048]
    - [95, 0.0]
  - - [160, 80, 1, 8192]
    - [52, 0.0]
  - - [160, 80, 1, 32768]
    - [96, 0.0]
  - - [192, 80, 1, 2048]
    - [95, 0.0]
  - - [192, 80, 1, 8192]
    - [96, 0.0]
  - - [192, 80, 1, 32768]
    - [96, 0.0]
  - - [224, 80, 1, 2048]
    - [10, 0.0]
  - - [224, 80, 1, 8192]
    - [94, 0.0]
  - - [224, 80, 1, 32768]
    - [96, 0.0]
  - - [256, 80, 1, 2048]
    - [62, 0.0]
  - - [256, 80, 1, 8192]
    - [94, 0.0]
  - - [256, 80, 1, 32768]
    - [97, 0.0]
  - - [320, 80, 1, 2048]
    - [62, 0.0]
  - - [320, 80, 1, 8192]
    - [94, 0.0]
  - - [320, 80, 1, 32768]
    - [94, 0.0]
  - - [384, 80, 1, 2048]
    - [62, 0.0]
  - - [384, 80, 1, 8192]
    - [94, 0.0]
  - - [384, 80, 1, 32768]
    - [97, 0.0]
  - - [448, 80, 1, 2048]
    - [98, 0.0]
  - - [448, 80, 1, 8192]
    - [94, 0.0]
  - - [448, 80, 1, 32768]
    - [97, 0.0]
  - - [512, 80, 1, 2048]
    - [94, 0.0]
  - - [512, 80, 1, 8192]
    - [97, 0.0]
  - - [512, 80, 1, 32768]
    - [97, 0.0]
  - - [576, 80, 1, 2048]
    - [94, 0.0]
  - - [576, 80, 1, 8192]
    - [94, 0.0]
  - - [576, 80, 1, 32768]
    - [97, 0.0]
  - - [640, 80, 1, 2048]
    - [29, 0.0]
  - - [640, 80, 1, 8192]
    - [97, 0.0]
  - - [640, 80, 1, 32768]
    - [97, 0.0]
  - - [768, 80, 1, 2048]
    - [29, 0.0]
  - - [768, 80, 1, 8192]
    - [97, 0.0]
  - - [768, 80, 1, 32768]
    - [97, 0.0]
  - - [896, 80, 1, 2048]
    - [51, 0.0]
  - - [896, 80, 1, 8192]
    - [97, 0.0]
  - - [896, 80, 1, 32768]
    - [97, 0.0]
  - - [1024, 80, 1, 2048]
    - [51, 0.0]
  - - [1024, 80, 1, 8192]
    - [97, 0.0]
  - - [1024, 80, 1, 32768]
    - [97, 0.0]
  - - [1280, 80, 1, 2048]
    - [96, 0.0]
  - - [1280, 80, 1, 8192]
    - [97, 0.0]
  - - [1280, 80, 1, 32768]
    - [97, 0.0]
  - - [1536, 80, 1, 2048]
    - [96, 0.0]
  - - [1536, 80, 1, 8192]
    - [97, 0.0]
  - - [1536, 80, 1, 32768]
    - [97, 0.0]
  - - [1792, 80, 1, 2048]
    - [96, 0.0]
  - - [1792, 80, 1, 8192]
    - [97, 0.0]
  - - [1792, 80, 1, 32768]
    - [97, 0.0]
  - - [2048, 80, 1, 2048]
    - [94, 0.0]
  - - [2048, 80, 1, 8192]
    - [97, 0.0]
  - - [2048, 80, 1, 32768]
    - [97, 0.0]
  - - [2304, 80, 1, 2048]
    - [94, 0.0]
  - - [2304, 80, 1, 8192]
    - [97, 0.0]
  - - [2304, 80, 1, 32768]
    - [97, 0.0]
  - - [2560, 80, 1, 2048]
    - [72, 0.0]
  - - [2560, 80, 1, 8192]
    - [97, 0.0]
  - - [2560, 80, 1, 32768]
    - [97, 0.0]
  - - [2816, 80, 1, 2048]
    - [72, 0.0]
  - - [2816, 80, 1, 8192]
    - [97, 0.0]
  - - [2816, 80, 1, 32768]
    - [97, 0.0]
  - - [3072, 80, 1, 2048]
    - [99, 0.0]
  - - [3072, 80, 1, 8192]
    - [97, 0.0]
  - - [3072, 80, 1, 32768]
    - [97, 0.0]
  - - [3584, 80, 1, 2048]
    - [56, 0.0]
  - - [3584, 80, 1, 8192]
    - [100, 0.0]
  - - [3584, 80, 1, 32768]
    - [100, 0.0]
  - - [4096, 80, 1, 2048]
    - [97, 0.0]
  - - [4096, 80, 1, 8192]
    - [97, 0.0]
  - - [4096, 80, 1, 32768]
    - [97, 0.0]
  - - [4608, 80, 1, 2048]
    - [97, 0.0]
  - - [4608, 80, 1, 8192]
    - [97, 0.0]
  - - [4608, 80, 1, 32768]
    - [97, 0.0]
  - - [5120, 80, 1, 2048]
    - [101, 0.0]
  - - [5120, 80, 1, 8192]
    - [101, 0.0]
  - - [5120, 80, 1, 32768]
    - [101, 0.0]
  - - [5632, 80, 1, 2048]
    - [101, 0.0]
  - - [5632, 80, 1, 8192]
    - [101, 0.0]
  - - [5632, 80, 1, 32768]
    - [101, 0.0]
  - - [6144, 80, 1, 2048]
    - [100, 0.0]
  - - [6144, 80, 1, 8192]
    - [97, 0.0]
  - - [6144, 80, 1, 32768]
    - [99, 0.0]
  - - [7168, 80, 1, 2048]
    - [100, 0.0]
  - - [7168, 80, 1, 8192]
    - [97, 0.0]
  - - [7168, 80, 1, 32768]
    - [102, 0.0]
  - - [8192, 80, 1, 2048]
    - [97, 0.0]
  - - [8192, 80, 1, 8192]
    - [97, 0.0]
  - - [8192, 80, 1, 32768]
    - [97, 0.0]
  - - [10240, 80, 1, 2048]
    - [97, 0.0]
  - - [10240, 80, 1, 8192]
    - [97, 0.0]
  - - [10240, 80, 1, 32768]
    - [102, 0.0]
  - - [12288, 80, 1, 512]
    - [103, 0.0]
  - - [12288, 80, 1, 2048]
    - [97, 0.0]
  - - [12288, 80, 1, 8192]
    - [97, 0.0]
  - - [14336, 80, 1, 512]
    - [103, 0.0]
  - - [14336, 80, 1, 2048]
    - [97, 0.0]
  - - [14336, 80, 1, 8192]
    - [97, 0.0]
  - - [16384, 80, 1, 512]
    - [103, 0.0]
  - - [16384, 80, 1, 2048]
    - [103, 0.0]
  - - [16384, 80, 1, 8192]
    - [101, 0.0]
  - - [20480, 80, 1, 512]
    - [103, 0.0]
  - - [20480, 80, 1, 2048]
    - [100, 0.0]
  - - [20480, 80, 1, 8192]
    - [102, 0.0]
  - - [24576, 80, 1, 512]
    - [103, 0.0]
  - - [24576, 80, 1, 2048]
    - [103, 0.0]
  - - [24576, 80, 1, 8192]
    - [102, 0.0]
  - - [28672, 80, 1, 512]
    - [103, 0.0]
  - - [28672, 80, 1, 2048]
    - [103, 0.0]
  - - [28672, 80, 1, 8192]
    - [102, 0.0]
  - - [32768, 80, 1, 512]
    - [103, 0.0]
  - - [32768, 80, 1, 2048]
    - [103, 0.0]
  - - [32768, 80, 1, 8192]
    - [103, 0.0]
  - - [40960, 80, 1, 512]
    - [103, 0.0]
  - - [40960, 80, 1, 2048]
    - [102, 0.0]
  - - [40960, 80, 1, 8192]
    - [102, 0.0]
  - - [49152, 80, 1, 512]
    - [103, 0.0]
  - - [49152, 80, 1, 2048]
    - [103, 0.0]
  - - [49152, 80, 1, 8192]
    - [102, 0.0]
  - - [57344, 80, 1, 512]
    - [103, 0.0]
  - - [57344, 80, 1, 2048]
    - [102, 0.0]
  - - [57344, 80, 1, 8192]
    - [102, 0.0]
  - - [65536, 80, 1, 512]
    - [104, 0.0]
  - - [65536, 80, 1, 2048]
    - [104, 0.0]
  - - [65536, 80, 1, 8192]
    - [104, 0.0]
  - - [98304, 80, 1, 512]
    - [105, 0.0]
  - - [98304, 80, 1, 2048]
    - [105, 0.0]
  - - [98304, 80, 1, 8192]
    - [105, 0.0]
  - - [131072, 80, 1, 512]
    - [105, 0.0]
  - - [131072, 80, 1, 2048]
    - [105, 0.0]
  - - [131072, 80, 1, 8192]
    - [105, 0.0]
  - - [16, 96, 1, 2048]
    - [1, 0.0]
  - - [16, 96, 1, 8192]
    - [7, 0.0]
  - - [16, 96, 1, 32768]
    - [106, 0.0]
  - - [32, 96, 1, 2048]
    - [1, 0.0]
  - - [32, 96, 1, 8192]
    - [23, 0.0]
  - - [32, 96, 1, 32768]
    - [24, 0.0]
  - - [48, 96, 1, 2048]
    - [1, 0.0]
  - - [48, 96, 1, 8192]
    - [21, 0.0]
  - - [48, 96, 1, 32768]
    - [21, 0.0]
  - - [64, 96, 1, 2048]
    - [23, 0.0]
  - - [64, 96, 1, 8192]
    - [23, 0.0]
  - - [64, 96, 1, 32768]
    - [23, 0.0]
  - - [80, 96, 1, 2048]
    - [23, 0.0]
  - - [80, 96, 1, 8192]
    - [23, 0.0]
  - - [80, 96, 1, 32768]
    - [51, 0.0]
  - - [96, 96, 1, 2048]
    - [23, 0.0]
  - - [96, 96, 1, 8192]
    - [23, 0.0]
  - - [96, 96, 1, 32768]
    - [32, 0.0]
  - - [112, 96, 1, 2048]
    - [24, 0.0]
  - - [112, 96, 1, 8192]
    - [32, 0.0]
  - - [112, 96, 1, 32768]
    - [51, 0.0]
  - - [128, 96, 1, 2048]
    - [95, 0.0]
  - - [128, 96, 1, 8192]
    - [93, 0.0]
  - - [128, 96, 1, 32768]
    - [53, 0.0]
  - - [160, 96, 1, 2048]
    - [95, 0.0]
  - - [160, 96, 1, 8192]
    - [107, 0.0]
  - - [160, 96, 1, 32768]
    - [108, 0.0]
  - - [192, 96, 1, 2048]
    - [10, 0.0]
  - - [192, 96, 1, 8192]
    - [51, 0.0]
  - - [192, 96, 1, 32768]
    - [108, 0.0]
  - - [224, 96, 1, 2048]
    - [31, 0.0]
  - - [224, 96, 1, 8192]
    - [51, 0.0]
  - - [224, 96, 1, 32768]
    - [109, 0.0]
  - - [256, 96, 1, 2048]
    - [62, 0.0]
  - - [256, 96, 1, 8192]
    - [110, 0.0]
  - - [256, 96, 1, 32768]
    - [111, 0.0]
  - - [320, 96, 1, 2048]
    - [62, 0.0]
  - - [320, 96, 1, 8192]
    - [110, 0.0]
  - - [320, 96, 1, 32768]
    - [110, 0.0]
  - - [384, 96, 1, 2048]
    - [62, 0.0]
  - - [384, 96, 1, 8192]
    - [110, 0.0]
  - - [384, 96, 1, 32768]
    - [108, 0.0]
  - - [448, 96, 1, 2048]
    - [50, 0.0]
  - - [448, 96, 1, 8192]
    - [108, 0.0]
  - - [448, 96, 1, 32768]
    - [108, 0.0]
  - - [512, 96, 1, 2048]
    - [52, 0.0]
  - - [512, 96, 1, 8192]
    - [111, 0.0]
  - - [512, 96, 1, 32768]
    - [111, 0.0]
  - - [576, 96, 1, 2048]
    - [52, 0.0]
  - - [576, 96, 1, 8192]
    - [110, 0.0]
  - - [576, 96, 1, 32768]
    - [111, 0.0]
  - - [640, 96, 1, 2048]
    - [29, 0.0]
  - - [640, 96, 1, 8192]
    - [108, 0.0]
  - - [640, 96, 1, 32768]
    - [108, 0.0]
  - - [768, 96, 1, 2048]
    - [29, 0.0]
  - - [768, 96, 1, 8192]
    - [108, 0.0]
  - - [768, 96, 1, 32768]
    - [112, 0.0]
  - - [896, 96, 1, 2048]
    - [51, 0.0]
  - - [896, 96, 1, 8192]
    - [111, 0.0]
  - - [896, 96, 1, 32768]
    - [111, 0.0]
  - - [1024, 96, 1, 2048]
    - [51, 0.0]
  - - [1024, 96, 1, 8192]
    - [51, 0.0]
  - - [1024, 96, 1, 32768]
    - [111, 0.0]
  - - [1280, 96, 1, 2048]
    - [43, 0.0]
  - - [1280, 96, 1, 8192]
    - [111, 0.0]
  - - [1280, 96, 1, 32768]
    - [111, 0.0]
  - - [1536, 96, 1, 2048]
    - [43, 0.0]
  - - [1536, 96, 1, 8192]
    - [111, 0.0]
  - - [1536, 96, 1, 32768]
    - [111, 0.0]
  - - [1792, 96, 1, 2048]
    - [108, 0.0]
  - - [1792, 96, 1, 8192]
    - [108, 0.0]
  - - [1792, 96, 1, 32768]
    - [108, 0.0]
  - - [2048, 96, 1, 2048]
    - [110, 0.0]
  - - [2048, 96, 1, 8192]
    - [111, 0.0]
  - - [2048, 96, 1, 32768]
    - [111, 0.0]
  - - [2304, 96, 1, 2048]
    - [54, 0.0]
  - - [2304, 96, 1, 8192]
    - [111, 0.0]
  - - [2304, 96, 1, 32768]
    - [111, 0.0]
  - - [2560, 96, 1, 2048]
    - [108, 0.0]
  - - [2560, 96, 1, 8192]
    - [108, 0.0]
  - - [2560, 96, 1, 32768]
    - [113, 0.0]
  - - [2816, 96, 1, 2048]
    - [108, 0.0]
  - - [2816, 96, 1, 8192]
    - [108, 0.0]
  - - [2816, 96, 1, 32768]
    - [111, 0.0]
  - - [3072, 96, 1, 2048]
    - [108, 0.0]
  - - [3072, 96, 1, 8192]
    - [111, 0.0]
  - - [3072, 96, 1, 32768]
    - [108, 0.0]
  - - [3584, 96, 1, 2048]
    - [108, 0.0]
  - - [3584, 96, 1, 8192]
    - [108, 0.0]
  - - [3584, 96, 1, 32768]
    - [108, 0.0]
  - - [4096, 96, 1, 2048]
    - [111, 0.0]
  - - [4096, 96, 1, 8192]
    - [111, 0.0]
  - - [4096, 96, 1, 32768]
    - [111, 0.0]
  - - [4608, 96, 1, 2048]
    - [111, 0.0]
  - - [4608, 96, 1, 8192]
    - [111, 0.0]
  - - [4608, 96, 1, 32768]
    - [111, 0.0]
  - - [5120, 96, 1, 2048]
    - [114, 0.0]
  - - [5120, 96, 1, 8192]
    - [113, 0.0]
  - - [5120, 96, 1, 32768]
    - [113, 0.0]
  - - [5632, 96, 1, 2048]
    - [114, 0.0]
  - - [5632, 96, 1, 8192]
    - [108, 0.0]
  - - [5632, 96, 1, 32768]
    - [115, 0.0]
  - - [6144, 96, 1, 2048]
    - [108, 0.0]
  - - [6144, 96, 1, 8192]
    - [108, 0.0]
  - - [6144, 96, 1, 32768]
    - [108, 0.0]
  - - [7168, 96, 1, 2048]
    - [108, 0.0]
  - - [7168, 96, 1, 8192]
    - [108, 0.0]
  - - [7168, 96, 1, 32768]
    - [108, 0.0]
  - - [8192, 96, 1, 2048]
    - [111, 0.0]
  - - [8192, 96, 1, 8192]
    - [111, 0.0]
  - - [8192, 96, 1, 32768]
    - [111, 0.0]
  - - [10240, 96, 1, 512]
    - [116, 0.0]
  - - [10240, 96, 1, 2048]
    - [108, 0.0]
  - - [10240, 96, 1, 8192]
    - [108, 0.0]
  - - [12288, 96, 1, 512]
    - [117, 0.0]
  - - [12288, 96, 1, 2048]
    - [111, 0.0]
  - - [12288, 96, 1, 8192]
    - [111, 0.0]
  - - [14336, 96, 1, 512]
    - [117, 0.0]
  - - [14336, 96, 1, 2048]
    - [111, 0.0]
  - - [14336, 96, 1, 8192]
    - [111, 0.0]
  - - [16384, 96, 1, 512]
    - [117, 0.0]
  - - [16384, 96, 1, 2048]
    - [118, 0.0]
  - - [16384, 96, 1, 8192]
    - [118, 0.0]
  - - [20480, 96, 1, 512]
    - [117, 0.0]
  - - [20480, 96, 1, 2048]
    - [119, 0.0]
  - - [20480, 96, 1, 8192]
    - [119, 0.0]
  - - [24576, 96, 1, 512]
    - [117, 0.0]
  - - [24576, 96, 1, 2048]
    - [118, 0.0]
  - - [24576, 96, 1, 8192]
    - [118, 0.0]
  - - [28672, 96, 1, 512]
    - [117, 0.0]
  - - [28672, 96, 1, 2048]
    - [120, 0.0]
  - - [28672, 96, 1, 8192]
    - [120, 0.0]
  - - [32768, 96, 1, 512]
    - [117, 0.0]
  - - [32768, 96, 1, 2048]
    - [117, 0.0]
  - - [32768, 96, 1, 8192]
    - [113, 0.0]
  - - [40960, 96, 1, 512]
    - [117, 0.0]
  - - [40960, 96, 1, 2048]
    - [121, 0.0]
  - - [40960, 96, 1, 8192]
    - [121, 0.0]
  - - [49152, 96, 1, 512]
    - [117, 0.0]
  - - [49152, 96, 1, 2048]
    - [119, 0.0]
  - - [49152, 96, 1, 8192]
    - [119, 0.0]
  - - [57344, 96, 1, 512]
    - [117, 0.0]
  - - [57344, 96, 1, 2048]
    - [120, 0.0]
  - - [57344, 96, 1, 8192]
    - [120, 0.0]
  - - [65536, 96, 1, 512]
    - [122, 0.0]
  - - [65536, 96, 1, 2048]
    - [123, 0.0]
  - - [65536, 96, 1, 8192]
    - [122, 0.0]
  - - [98304, 96, 1, 512]
    - [124, 0.0]
  - - [98304, 96, 1, 2048]
    - [124, 0.0]
  - - [98304, 96, 1, 8192]
    - [125, 0.0]
  - - [131072, 96, 1, 512]
    - [124, 0.0]
  - - [131072, 96, 1, 2048]
    - [124, 0.0]
  - - [131072, 96, 1, 8192]
    - [126, 0.0]
  - - [16, 112, 1, 2048]
    - [1, 0.0]
  - - [16, 112, 1, 8192]
    - [26, 0.0]
  - - [16, 112, 1, 32768]
    - [26, 0.0]
  - - [32, 112, 1, 2048]
    - [0, 0.0]
  - - [32, 112, 1, 8192]
    - [23, 0.0]
  - - [32, 112, 1, 32768]
    - [23, 0.0]
  - - [48, 112, 1, 2048]
    - [1, 0.0]
  - - [48, 112, 1, 8192]
    - [26, 0.0]
  - - [48, 112, 1, 32768]
    - [65, 0.0]
  - - [64, 112, 1, 2048]
    - [23, 0.0]
  - - [64, 112, 1, 8192]
    - [33, 0.0]
  - - [64, 112, 1, 32768]
    - [64, 0.0]
  - - [80, 112, 1, 2048]
    - [24, 0.0]
  - - [80, 112, 1, 8192]
    - [78, 0.0]
  - - [80, 112, 1, 32768]
    - [77, 0.0]
  - - [96, 112, 1, 2048]
    - [24, 0.0]
  - - [96, 112, 1, 8192]
    - [127, 0.0]
  - - [96, 112, 1, 32768]
    - [64, 0.0]
  - - [112, 112, 1, 2048]
    - [24, 0.0]
  - - [112, 112, 1, 8192]
    - [68, 0.0]
  - - [112, 112, 1, 32768]
    - [68, 0.0]
  - - [128, 112, 1, 2048]
    - [95, 0.0]
  - - [128, 112, 1, 8192]
    - [66, 0.0]
  - - [128, 112, 1, 32768]
    - [68, 0.0]
  - - [160, 112, 1, 2048]
    - [10, 0.0]
  - - [160, 112, 1, 8192]
    - [77, 0.0]
  - - [160, 112, 1, 32768]
    - [72, 0.0]
  - - [192, 112, 1, 2048]
    - [127, 0.0]
  - - [192, 112, 1, 8192]
    - [70, 0.0]
  - - [192, 112, 1, 32768]
    - [70, 0.0]
  - - [224, 112, 1, 2048]
    - [31, 0.0]
  - - [224, 112, 1, 8192]
    - [128, 0.0]
  - - [224, 112, 1, 32768]
    - [128, 0.0]
  - - [256, 112, 1, 2048]
    - [62, 0.0]
  - - [256, 112, 1, 8192]
    - [71, 0.0]
  - - [256, 112, 1, 32768]
    - [71, 0.0]
  - - [320, 112, 1, 2048]
    - [129, 0.0]
  - - [320, 112, 1, 8192]
    - [130, 0.0]
  - - [320, 112, 1, 32768]
    - [130, 0.0]
  - - [384, 112, 1, 2048]
    - [129, 0.0]
  - - [384, 112, 1, 8192]
    - [66, 0.0]
  - - [384, 112, 1, 32768]
    - [130, 0.0]
  - - [448, 112, 1, 2048]
    - [131, 0.0]
  - - [448, 112, 1, 8192]
    - [128, 0.0]
  - - [448, 112, 1, 32768]
    - [128, 0.0]
  - - [512, 112, 1, 2048]
    - [66, 0.0]
  - - [512, 112, 1, 8192]
    - [71, 0.0]
  - - [512, 112, 1, 32768]
    - [71, 0.0]
  - - [576, 112, 1, 2048]
    - [29, 0.0]
  - - [576, 112, 1, 8192]
    - [130, 0.0]
  - - [576, 112, 1, 32768]
    - [130, 0.0]
  - - [640, 112, 1, 2048]
    - [52, 0.0]
  - - [640, 112, 1, 8192]
    - [71, 0.0]
  - - [640, 112, 1, 32768]
    - [72, 0.0]
  - - [768, 112, 1, 2048]
    - [52, 0.0]
  - - [768, 112, 1, 8192]
    - [71, 0.0]
  - - [768, 112, 1, 32768]
    - [71, 0.0]
  - - [896, 112, 1, 2048]
    - [73, 0.0]
  - - [896, 112, 1, 8192]
    - [72, 0.0]
  - - [896, 112, 1, 32768]
    - [72, 0.0]
  - - [1024, 112, 1, 2048]
    - [68, 0.0]
  - - [1024, 112, 1, 8192]
    - [71, 0.0]
  - - [1024, 112, 1, 32768]
    - [132, 0.0]
  - - [1280, 112, 1, 2048]
    - [55, 0.0]
  - - [1280, 112, 1, 8192]
    - [132, 0.0]
  - - [1280, 112, 1, 32768]
    - [132, 0.0]
  - - [1536, 112, 1, 2048]
    - [55, 0.0]
  - - [1536, 112, 1, 8192]
    - [132, 0.0]
  - - [1536, 112, 1, 32768]
    - [132, 0.0]
  - - [1792, 112, 1, 2048]
    - [70, 0.0]
  - - [1792, 112, 1, 8192]
    - [70, 0.0]
  - - [1792, 112, 1, 32768]
    - [133, 0.0]
  - - [2048, 112, 1, 2048]
    - [71, 0.0]
  - - [2048, 112, 1, 8192]
    - [71, 0.0]
  - - [2048, 112, 1, 32768]
    - [133, 0.0]
  - - [2304, 112, 1, 2048]
    - [71, 0.0]
  - - [2304, 112, 1, 8192]
    - [71, 0.0]
  - - [2304, 112, 1, 32768]
    - [79, 0.0]
  - - [2560, 112, 1, 2048]
    - [72, 0.0]
  - - [2560, 112, 1, 8192]
    - [133, 0.0]
  - - [2560, 112, 1, 32768]
    - [133, 0.0]
  - - [2816, 112, 1, 2048]
    - [72, 0.0]
  - - [2816, 112, 1, 8192]
    - [133, 0.0]
  - - [2816, 112, 1, 32768]
    - [133, 0.0]
  - - [3072, 112, 1, 2048]
    - [70, 0.0]
  - - [3072, 112, 1, 8192]
    - [132, 0.0]
  - - [3072, 112, 1, 32768]
    - [132, 0.0]
  - - [3584, 112, 1, 2048]
    - [71, 0.0]
  - - [3584, 112, 1, 8192]
    - [134, 0.0]
  - - [3584, 112, 1, 32768]
    - [134, 0.0]
  - - [4096, 112, 1, 2048]
    - [135, 0.0]
  - - [4096, 112, 1, 8192]
    - [132, 0.0]
  - - [4096, 112, 1, 32768]
    - [132, 0.0]
  - - [4608, 112, 1, 2048]
    - [135, 0.0]
  - - [4608, 112, 1, 8192]
    - [132, 0.0]
  - - [4608, 112, 1, 32768]
    - [132, 0.0]
  - - [5120, 112, 1, 2048]
    - [133, 0.0]
  - - [5120, 112, 1, 8192]
    - [133, 0.0]
  - - [5120, 112, 1, 32768]
    - [133, 0.0]
  - - [5632, 112, 1, 2048]
    - [134, 0.0]
  - - [5632, 112, 1, 8192]
    - [133, 0.0]
  - - [5632, 112, 1, 32768]
    - [133, 0.0]
  - - [6144, 112, 1, 2048]
    - [134, 0.0]
  - - [6144, 112, 1, 8192]
    - [132, 0.0]
  - - [6144, 112, 1, 32768]
    - [132, 0.0]
  - - [7168, 112, 1, 2048]
    - [134, 0.0]
  - - [7168, 112, 1, 8192]
    - [134, 0.0]
  - - [7168, 112, 1, 32768]
    - [134, 0.0]
  - - [8192, 112, 1, 512]
    - [132, 0.0]
  - - [8192, 112, 1, 2048]
    - [132, 0.0]
  - - [8192, 112, 1, 8192]
    - [132, 0.0]
  - - [10240, 112, 1, 512]
    - [133, 0.0]
  - - [10240, 112, 1, 2048]
    - [133, 0.0]
  - - [10240, 112, 1, 8192]
    - [133, 0.0]
  - - [12288, 112, 1, 512]
    - [136, 0.0]
  - - [12288, 112, 1, 2048]
    - [134, 0.0]
  - - [12288, 112, 1, 8192]
    - [132, 0.0]
  - - [14336, 112, 1, 512]
    - [136, 0.0]
  - - [14336, 112, 1, 2048]
    - [134, 0.0]
  - - [14336, 112, 1, 8192]
    - [132, 0.0]
  - - [16384, 112, 1, 512]
    - [132, 0.0]
  - - [16384, 112, 1, 2048]
    - [132, 0.0]
  - - [16384, 112, 1, 8192]
    - [132, 0.0]
  - - [20480, 112, 1, 512]
    - [137, 0.0]
  - - [20480, 112, 1, 2048]
    - [134, 0.0]
  - - [20480, 112, 1, 8192]
    - [133, 0.0]
  - - [24576, 112, 1, 512]
    - [132, 0.0]
  - - [24576, 112, 1, 2048]
    - [132, 0.0]
  - - [24576, 112, 1, 8192]
    - [132, 0.0]
  - - [28672, 112, 1, 512]
    - [132, 0.0]
  - - [28672, 112, 1, 2048]
    - [132, 0.0]
  - - [28672, 112, 1, 8192]
    - [132, 0.0]
  - - [32768, 112, 1, 512]
    - [136, 0.0]
  - - [32768, 112, 1, 2048]
    - [132, 0.0]
  - - [32768, 112, 1, 8192]
    - [133, 0.0]
  - - [40960, 112, 1, 512]
    - [136, 0.0]
  - - [40960, 112, 1, 2048]
    - [132, 0.0]
  - - [40960, 112, 1, 8192]
    - [133, 0.0]
  - - [49152, 112, 1, 512]
    - [132, 0.0]
  - - [49152, 112, 1, 2048]
    - [132, 0.0]
  - - [49152, 112, 1, 8192]
    - [134, 0.0]
  - - [57344, 112, 1, 512]
    - [132, 0.0]
  - - [57344, 112, 1, 2048]
    - [132, 0.0]
  - - [57344, 112, 1, 8192]
    - [132, 0.0]
  - - [65536, 112, 1, 512]
    - [138, 0.0]
  - - [65536, 112, 1, 2048]
    - [138, 0.0]
  - - [65536, 112, 1, 8192]
    - [138, 0.0]
  - - [98304, 112, 1, 512]
    - [139, 0.0]
  - - [98304, 112, 1, 2048]
    - [138, 0.0]
  - - [98304, 112, 1, 8192]
    - [140, 0.0]
  - - [131072, 112, 1, 512]
    - [138, 0.0]
  - - [131072, 112, 1, 2048]
    - [138, 0.0]
  - - [131072, 112, 1, 8192]
    - [140, 0.0]
  - - [16, 128, 1, 2048]
    - [7, 0.0]
  - - [16, 128, 1, 8192]
    - [95, 0.0]
  - - [16, 128, 1, 32768]
    - [141, 0.0]
  - - [32, 128, 1, 2048]
    - [1, 0.0]
  - - [32, 128, 1, 8192]
    - [23, 0.0]
  - - [32, 128, 1, 32768]
    - [23, 0.0]
  - - [48, 128, 1, 2048]
    - [1, 0.0]
  - - [48, 128, 1, 8192]
    - [26, 0.0]
  - - [48, 128, 1, 32768]
    - [142, 0.0]
  - - [64, 128, 1, 2048]
    - [24, 0.0]
  - - [64, 128, 1, 8192]
    - [29, 0.0]
  - - [64, 128, 1, 32768]
    - [64, 0.0]
  - - [80, 128, 1, 2048]
    - [24, 0.0]
  - - [80, 128, 1, 8192]
    - [127, 0.0]
  - - [80, 128, 1, 32768]
    - [77, 0.0]
  - - [96, 128, 1, 2048]
    - [9, 0.0]
  - - [96, 128, 1, 8192]
    - [73, 0.0]
  - - [96, 128, 1, 32768]
    - [73, 0.0]
  - - [112, 128, 1, 2048]
    - [24, 0.0]
  - - [112, 128, 1, 8192]
    - [65, 0.0]
  - - [112, 128, 1, 32768]
    - [68, 0.0]
  - - [128, 128, 1, 2048]
    - [106, 0.0]
  - - [128, 128, 1, 8192]
    - [66, 0.0]
  - - [128, 128, 1, 32768]
    - [66, 0.0]
  - - [160, 128, 1, 2048]
    - [143, 0.0]
  - - [160, 128, 1, 8192]
    - [77, 0.0]
  - - [160, 128, 1, 32768]
    - [144, 0.0]
  - - [192, 128, 1, 2048]
    - [143, 0.0]
  - - [192, 128, 1, 8192]
    - [70, 0.0]
  - - [192, 128, 1, 32768]
    - [70, 0.0]
  - - [224, 128, 1, 2048]
    - [62, 0.0]
  - - [224, 128, 1, 8192]
    - [145, 0.0]
  - - [224, 128, 1, 32768]
    - [146, 0.0]
  - - [256, 128, 1, 2048]
    - [62, 0.0]
  - - [256, 128, 1, 8192]
    - [79, 0.0]
  - - [256, 128, 1, 32768]
    - [71, 0.0]
  - - [320, 128, 1, 2048]
    - [67, 0.0]
  - - [320, 128, 1, 8192]
    - [147, 0.0]
  - - [320, 128, 1, 32768]
    - [148, 0.0]
  - - [384, 128, 1, 2048]
    - [68, 0.0]
  - - [384, 128, 1, 8192]
    - [68, 0.0]
  - - [384, 128, 1, 32768]
    - [149, 0.0]
  - - [448, 128, 1, 2048]
    - [150, 0.0]
  - - [448, 128, 1, 8192]
    - [147, 0.0]
  - - [448, 128, 1, 32768]
    - [149, 0.0]
  - - [512, 128, 1, 2048]
    - [68, 0.0]
  - - [512, 128, 1, 8192]
    - [79, 0.0]
  - - [512, 128, 1, 32768]
    - [79, 0.0]
  - - [576, 128, 1, 2048]
    - [29, 0.0]
  - - [576, 128, 1, 8192]
    - [147, 0.0]
  - - [576, 128, 1, 32768]
    - [147, 0.0]
  - - [640, 128, 1, 2048]
    - [78, 0.0]
  - - [640, 128, 1, 8192]
    - [144, 0.0]
  - - [640, 128, 1, 32768]
    - [151, 0.0]
  - - [768, 128, 1, 2048]
    - [73, 0.0]
  - - [768, 128, 1, 8192]
    - [71, 0.0]
  - - [768, 128, 1, 32768]
    - [149, 0.0]
  - - [896, 128, 1, 2048]
    - [73, 0.0]
  - - [896, 128, 1, 8192]
    - [152, 0.0]
  - - [896, 128, 1, 32768]
    - [153, 0.0]
  - - [1024, 128, 1, 2048]
    - [68, 0.0]
  - - [1024, 128, 1, 8192]
    - [149, 0.0]
  - - [1024, 128, 1, 32768]
    - [154, 0.0]
  - - [1280, 128, 1, 2048]
    - [55, 0.0]
  - - [1280, 128, 1, 8192]
    - [154, 0.0]
  - - [1280, 128, 1, 32768]
    - [155, 0.0]
  - - [1536, 128, 1, 2048]
    - [70, 0.0]
  - - [1536, 128, 1, 8192]
    - [149, 0.0]
  - - [1536, 128, 1, 32768]
    - [156, 0.0]
  - - [1792, 128, 1, 2048]
    - [70, 0.0]
  - - [1792, 128, 1, 8192]
    - [149, 0.0]
  - - [1792, 128, 1, 32768]
    - [149, 0.0]
  - - [2048, 128, 1, 2048]
    - [71, 0.0]
  - - [2048, 128, 1, 8192]
    - [154, 0.0]
  - - [2048, 128, 1, 32768]
    - [157, 0.0]
  - - [2304, 128, 1, 2048]
    - [79, 0.0]
  - - [2304, 128, 1, 8192]
    - [71, 0.0]
  - - [2304, 128, 1, 32768]
    - [158, 0.0]
  - - [2560, 128, 1, 2048]
    - [144, 0.0]
  - - [2560, 128, 1, 8192]
    - [155, 0.0]
  - - [2560, 128, 1, 32768]
    - [159, 0.0]
  - - [2816, 128, 1, 2048]
    - [144, 0.0]
  - - [2816, 128, 1, 8192]
    - [156, 0.0]
  - - [2816, 128, 1, 32768]
    - [160, 0.0]
  - - [3072, 128, 1, 2048]
    - [149, 0.0]
  - - [3072, 128, 1, 8192]
    - [157, 0.0]
  - - [3072, 128, 1, 32768]
    - [161, 0.0]
  - - [3584, 128, 1, 2048]
    - [149, 0.0]
  - - [3584, 128, 1, 8192]
    - [149, 0.0]
  - - [3584, 128, 1, 32768]
    - [154, 0.0]
  - - [4096, 128, 1, 2048]
    - [162, 0.0]
  - - [4096, 128, 1, 8192]
    - [155, 0.0]
  - - [4096, 128, 1, 32768]
    - [155, 0.0]
  - - [4608, 128, 1, 2048]
    - [163, 0.0]
  - - [4608, 128, 1, 8192]
    - [164, 0.0]
  - - [4608, 128, 1, 32768]
    - [165, 0.0]
  - - [5120, 128, 1, 2048]
    - [151, 0.0]
  - - [5120, 128, 1, 8192]
    - [151, 0.0]
  - - [5120, 128, 1, 32768]
    - [159, 0.0]
  - - [5632, 128, 1, 2048]
    - [166, 0.0]
  - - [5632, 128, 1, 8192]
    - [166, 0.0]
  - - [5632, 128, 1, 32768]
    - [160, 0.0]
  - - [6144, 128, 1, 2048]
    - [167, 0.0]
  - - [6144, 128, 1, 8192]
    - [157, 0.0]
  - - [6144, 128, 1, 32768]
    - [157, 0.0]
  - - [7168, 128, 1, 512]
    - [167, 0.0]
  - - [7168, 128, 1, 2048]
    - [154, 0.0]
  - - [7168, 128, 1, 8192]
    - [154, 0.0]
  - - [8192, 128, 1, 512]
    - [168, 0.0]
  - - [8192, 128, 1, 2048]
    - [168, 0.0]
  - - [8192, 128, 1, 8192]
    - [155, 0.0]
  - - [10240, 128, 1, 512]
    - [169, 0.0]
  - - [10240, 128, 1, 2048]
    - [170, 0.0]
  - - [10240, 128, 1, 8192]
    - [159, 0.0]
  - - [12288, 128, 1, 512]
    - [157, 0.0]
  - - [12288, 128, 1, 2048]
    - [157, 0.0]
  - - [12288, 128, 1, 8192]
    - [157, 0.0]
  - - [14336, 128, 1, 512]
    - [153, 0.0]
  - - [14336, 128, 1, 2048]
    - [153, 0.0]
  - - [14336, 128, 1, 8192]
    - [154, 0.0]
  - - [16384, 128, 1, 512]
    - [168, 0.0]
  - - [16384, 128, 1, 2048]
    - [168, 0.0]
  - - [16384, 128, 1, 8192]
    - [155, 0.0]
  - - [20480, 128, 1, 512]
    - [169, 0.0]
  - - [20480, 128, 1, 2048]
    - [159, 0.0]
  - - [20480, 128, 1, 8192]
    - [154, 0.0]
  - - [24576, 128, 1, 512]
    - [171, 0.0]
  - - [24576, 128, 1, 2048]
    - [155, 0.0]
  - - [24576, 128, 1, 8192]
    - [155, 0.0]
  - - [28672, 128, 1, 512]
    - [172, 0.0]
  - - [28672, 128, 1, 2048]
    - [164, 0.0]
  - - [28672, 128, 1, 8192]
    - [164, 0.0]
  - - [32768, 128, 1, 512]
    - [173, 0.0]
  - - [32768, 128, 1, 2048]
    - [174, 0.0]
  - - [32768, 128, 1, 8192]
    - [175, 0.0]
  - - [40960, 128, 1, 512]
    - [176, 0.0]
  - - [40960, 128, 1, 2048]
    - [176, 0.0]
  - - [40960, 128, 1, 8192]
    - [176, 0.0]
  - - [49152, 128, 1, 512]
    - [177, 0.0]
  - - [49152, 128, 1, 2048]
    - [176, 0.0]
  - - [49152, 128, 1, 8192]
    - [176, 0.0]
  - - [57344, 128, 1, 512]
    - [178, 0.0]
  - - [57344, 128, 1, 2048]
    - [178, 0.0]
  - - [57344, 128, 1, 8192]
    - [179, 0.0]
  - - [65536, 128, 1, 512]
    - [178, 0.0]
  - - [65536, 128, 1, 2048]
    - [176, 0.0]
  - - [65536, 128, 1, 8192]
    - [176, 0.0]
  - - [98304, 128, 1, 512]
    - [178, 0.0]
  - - [98304, 128, 1, 2048]
    - [178, 0.0]
  - - [98304, 128, 1, 8192]
    - [175, 0.0]
  - - [131072, 128, 1, 512]
    - [180, 0.0]
  - - [131072, 128, 1, 2048]
    - [181, 0.0]
  - - [16, 160, 1, 2048]
    - [1, 0.0]
  - - [16, 160, 1, 8192]
    - [106, 0.0]
  - - [16, 160, 1, 32768]
    - [106, 0.0]
  - - [32, 160, 1, 2048]
    - [1, 0.0]
  - - [32, 160, 1, 8192]
    - [23, 0.0]
  - - [32, 160, 1, 32768]
    - [26, 0.0]
  - - [48, 160, 1, 2048]
    - [1, 0.0]
  - - [48, 160, 1, 8192]
    - [182, 0.0]
  - - [48, 160, 1, 32768]
    - [183, 0.0]
  - - [64, 160, 1, 2048]
    - [69, 0.0]
  - - [64, 160, 1, 8192]
    - [29, 0.0]
  - - [64, 160, 1, 32768]
    - [29, 0.0]
  - - [80, 160, 1, 2048]
    - [95, 0.0]
  - - [80, 160, 1, 8192]
    - [96, 0.0]
  - - [80, 160, 1, 32768]
    - [144, 0.0]
  - - [96, 160, 1, 2048]
    - [95, 0.0]
  - - [96, 160, 1, 8192]
    - [94, 0.0]
  - - [96, 160, 1, 32768]
    - [108, 0.0]
  - - [112, 160, 1, 2048]
    - [95, 0.0]
  - - [112, 160, 1, 8192]
    - [94, 0.0]
  - - [112, 160, 1, 32768]
    - [96, 0.0]
  - - [128, 160, 1, 2048]
    - [69, 0.0]
  - - [128, 160, 1, 8192]
    - [94, 0.0]
  - - [128, 160, 1, 32768]
    - [97, 0.0]
  - - [160, 160, 1, 2048]
    - [62, 0.0]
  - - [160, 160, 1, 8192]
    - [184, 0.0]
  - - [160, 160, 1, 32768]
    - [185, 0.0]
  - - [192, 160, 1, 2048]
    - [62, 0.0]
  - - [192, 160, 1, 8192]
    - [108, 0.0]
  - - [192, 160, 1, 32768]
    - [186, 0.0]
  - - [224, 160, 1, 2048]
    - [62, 0.0]
  - - [224, 160, 1, 8192]
    - [96, 0.0]
  - - [224, 160, 1, 32768]
    - [186, 0.0]
  - - [256, 160, 1, 2048]
    - [187, 0.0]
  - - [256, 160, 1, 8192]
    - [97, 0.0]
  - - [256, 160, 1, 32768]
    - [97, 0.0]
  - - [320, 160, 1, 2048]
    - [69, 0.0]
  - - [320, 160, 1, 8192]
    - [186, 0.0]
  - - [320, 160, 1, 32768]
    - [186, 0.0]
  - - [384, 160, 1, 2048]
    - [69, 0.0]
  - - [384, 160, 1, 8192]
    - [186, 0.0]
  - - [384, 160, 1, 32768]
    - [186, 0.0]
  - - [448, 160, 1, 2048]
    - [69, 0.0]
  - - [448, 160, 1, 8192]
    - [71, 0.0]
  - - [448, 160, 1, 32768]
    - [188, 0.0]
  - - [512, 160, 1, 2048]
    - [52, 0.0]
  - - [512, 160, 1, 8192]
    - [97, 0.0]
  - - [512, 160, 1, 32768]
    - [189, 0.0]
  - - [576, 160, 1, 2048]
    - [52, 0.0]
  - - [576, 160, 1, 8192]
    - [108, 0.0]
  - - [576, 160, 1, 32768]
    - [190, 0.0]
  - - [640, 160, 1, 2048]
    - [191, 0.0]
  - - [640, 160, 1, 8192]
    - [97, 0.0]
  - - [640, 160, 1, 32768]
    - [192, 0.0]
  - - [768, 160, 1, 2048]
    - [191, 0.0]
  - - [768, 160, 1, 8192]
    - [97, 0.0]
  - - [768, 160, 1, 32768]
    - [193, 0.0]
  - - [896, 160, 1, 2048]
    - [96, 0.0]
  - - [896, 160, 1, 8192]
    - [185, 0.0]
  - - [896, 160, 1, 32768]
    - [194, 0.0]
  - - [1024, 160, 1, 2048]
    - [94, 0.0]
  - - [1024, 160, 1, 8192]
    - [185, 0.0]
  - - [1024, 160, 1, 32768]
    - [193, 0.0]
  - - [1280, 160, 1, 2048]
    - [195, 0.0]
  - - [1280, 160, 1, 8192]
    - [193, 0.0]
  - - [1280, 160, 1, 32768]
    - [193, 0.0]
  - - [1536, 160, 1, 2048]
    - [195, 0.0]
  - - [1536, 160, 1, 8192]
    - [193, 0.0]
  - - [1536, 160, 1, 32768]
    - [196, 0.0]
  - - [1792, 160, 1, 2048]
    - [108, 0.0]
  - - [1792, 160, 1, 8192]
    - [185, 0.0]
  - - [1792, 160, 1, 32768]
    - [196, 0.0]
  - - [2048, 160, 1, 2048]
    - [97, 0.0]
  - - [2048, 160, 1, 8192]
    - [194, 0.0]
  - - [2048, 160, 1, 32768]
    - [194, 0.0]
  - - [2304, 160, 1, 2048]
    - [97, 0.0]
  - - [2304, 160, 1, 8192]
    - [97, 0.0]
  - - [2304, 160, 1, 32768]
    - [189, 0.0]
  - - [2560, 160, 1, 2048]
    - [193, 0.0]
  - - [2560, 160, 1, 8192]
    - [193, 0.0]
  - - [2560, 160, 1, 32768]
    - [190, 0.0]
  - - [2816, 160, 1, 2048]
    - [185, 0.0]
  - - [2816, 160, 1, 8192]
    - [192, 0.0]
  - - [2816, 160, 1, 32768]
    - [192, 0.0]
  - - [3072, 160, 1, 2048]
    - [196, 0.0]
  - - [3072, 160, 1, 8192]
    - [189, 0.0]
  - - [3072, 160, 1, 32768]
    - [196, 0.0]
  - - [3584, 160, 1, 2048]
    - [197, 0.0]
  - - [3584, 160, 1, 8192]
    - [194, 0.0]
  - - [3584, 160, 1, 32768]
    - [194, 0.0]
  - - [4096, 160, 1, 2048]
    - [198, 0.0]
  - - [4096, 160, 1, 8192]
    - [193, 0.0]
  - - [4096, 160, 1, 32768]
    - [193, 0.0]
  - - [4608, 160, 1, 2048]
    - [198, 0.0]
  - - [4608, 160, 1, 8192]
    - [189, 0.0]
  - - [4608, 160, 1, 32768]
    - [199, 0.0]
  - - [5120, 160, 1, 2048]
    - [194, 0.0]
  - - [5120, 160, 1, 8192]
    - [190, 0.0]
  - - [5120, 160, 1, 32768]
    - [190, 0.0]
  - - [5632, 160, 1, 2048]
    - [185, 0.0]
  - - [5632, 160, 1, 8192]
    - [185, 0.0]
  - - [5632, 160, 1, 32768]
    - [192, 0.0]
  - - [6144, 160, 1, 512]
    - [194, 0.0]
  - - [6144, 160, 1, 2048]
    - [194, 0.0]
  - - [6144, 160, 1, 8192]
    - [194, 0.0]
  - - [7168, 160, 1, 512]
    - [194, 0.0]
  - - [7168, 160, 1, 2048]
    - [194, 0.0]
  - - [7168, 160, 1, 8192]
    - [194, 0.0]
  - - [8192, 160, 1, 512]
    - [193, 0.0]
  - - [8192, 160, 1, 2048]
    - [193, 0.0]
  - - [8192, 160, 1, 8192]
    - [193, 0.0]
  - - [10240, 160, 1, 512]
    - [192, 0.0]
  - - [10240, 160, 1, 2048]
    - [190, 0.0]
  - - [10240, 160, 1, 8192]
    - [190, 0.0]
  - - [12288, 160, 1, 512]
    - [194, 0.0]
  - - [12288, 160, 1, 2048]
    - [194, 0.0]
  - - [12288, 160, 1, 8192]
    - [194, 0.0]
  - - [14336, 160, 1, 512]
    - [194, 0.0]
  - - [14336, 160, 1, 2048]
    - [194, 0.0]
  - - [14336, 160, 1, 8192]
    - [194, 0.0]
  - - [16384, 160, 1, 512]
    - [196, 0.0]
  - - [16384, 160, 1, 2048]
    - [193, 0.0]
  - - [16384, 160, 1, 8192]
    - [193, 0.0]
  - - [20480, 160, 1, 512]
    - [194, 0.0]
  - - [20480, 160, 1, 2048]
    - [194, 0.0]
  - - [20480, 160, 1, 8192]
    - [194, 0.0]
  - - [24576, 160, 1, 512]
    - [196, 0.0]
  - - [24576, 160, 1, 2048]
    - [193, 0.0]
  - - [24576, 160, 1, 8192]
    - [193, 0.0]
  - - [28672, 160, 1, 512]
    - [196, 0.0]
  - - [28672, 160, 1, 2048]
    - [196, 0.0]
  - - [28672, 160, 1, 8192]
    - [196, 0.0]
  - - [32768, 160, 1, 512]
    - [200, 0.0]
  - - [32768, 160, 1, 2048]
    - [201, 0.0]
  - - [32768, 160, 1, 8192]
    - [202, 0.0]
  - - [40960, 160, 1, 512]
    - [203, 0.0]
  - - [40960, 160, 1, 2048]
    - [203, 0.0]
  - - [40960, 160, 1, 8192]
    - [201, 0.0]
  - - [49152, 160, 1, 512]
    - [203, 0.0]
  - - [49152, 160, 1, 2048]
    - [203, 0.0]
  - - [49152, 160, 1, 8192]
    - [201, 0.0]
  - - [57344, 160, 1, 512]
    - [200, 0.0]
  - - [57344, 160, 1, 2048]
    - [200, 0.0]
  - - [57344, 160, 1, 8192]
    - [204, 0.0]
  - - [65536, 160, 1, 512]
    - [200, 0.0]
  - - [65536, 160, 1, 2048]
    - [200, 0.0]
  - - [65536, 160, 1, 8192]
    - [204, 0.0]
  - - [98304, 160, 1, 512]
    - [200, 0.0]
  - - [98304, 160, 1, 2048]
    - [200, 0.0]
  - - [131072, 160, 1, 512]
    - [200, 0.0]
  - - [131072, 160, 1, 2048]
    - [205, 0.0]
  - - [16, 192, 1, 2048]
    - [1, 0.0]
  - - [16, 192, 1, 8192]
    - [106, 0.0]
  - - [16, 192, 1, 32768]
    - [26, 0.0]
  - - [32, 192, 1, 2048]
    - [1, 0.0]
  - - [32, 192, 1, 8192]
    - [23, 0.0]
  - - [32, 192, 1, 32768]
    - [23, 0.0]
  - - [48, 192, 1, 2048]
    - [1, 0.0]
  - - [48, 192, 1, 8192]
    - [63, 0.0]
  - - [48, 192, 1, 32768]
    - [65, 0.0]
  - - [64, 192, 1, 2048]
    - [95, 0.0]
  - - [64, 192, 1, 8192]
    - [53, 0.0]
  - - [64, 192, 1, 32768]
    - [53, 0.0]
  - - [80, 192, 1, 2048]
    - [95, 0.0]
  - - [80, 192, 1, 8192]
    - [51, 0.0]
  - - [80, 192, 1, 32768]
    - [108, 0.0]
  - - [96, 192, 1, 2048]
    - [95, 0.0]
  - - [96, 192, 1, 8192]
    - [51, 0.0]
  - - [96, 192, 1, 32768]
    - [108, 0.0]
  - - [112, 192, 1, 2048]
    - [93, 0.0]
  - - [112, 192, 1, 8192]
    - [51, 0.0]
  - - [112, 192, 1, 32768]
    - [51, 0.0]
  - - [128, 192, 1, 2048]
    - [62, 0.0]
  - - [128, 192, 1, 8192]
    - [110, 0.0]
  - - [128, 192, 1, 32768]
    - [110, 0.0]
  - - [160, 192, 1, 2048]
    - [63, 0.0]
  - - [160, 192, 1, 8192]
    - [108, 0.0]
  - - [160, 192, 1, 32768]
    - [108, 0.0]
  - - [192, 192, 1, 2048]
    - [62, 0.0]
  - - [192, 192, 1, 8192]
    - [108, 0.0]
  - - [192, 192, 1, 32768]
    - [108, 0.0]
  - - [224, 192, 1, 2048]
    - [50, 0.0]
  - - [224, 192, 1, 8192]
    - [68, 0.0]
  - - [224, 192, 1, 32768]
    - [195, 0.0]
  - - [256, 192, 1, 2048]
    - [206, 0.0]
  - - [256, 192, 1, 8192]
    - [79, 0.0]
  - - [256, 192, 1, 32768]
    - [111, 0.0]
  - - [320, 192, 1, 2048]
    - [69, 0.0]
  - - [320, 192, 1, 8192]
    - [72, 0.0]
  - - [320, 192, 1, 32768]
    - [207, 0.0]
  - - [384, 192, 1, 2048]
    - [69, 0.0]
  - - [384, 192, 1, 8192]
    - [70, 0.0]
  - - [384, 192, 1, 32768]
    - [208, 0.0]
  - - [448, 192, 1, 2048]
    - [93, 0.0]
  - - [448, 192, 1, 8192]
    - [71, 0.0]
  - - [448, 192, 1, 32768]
    - [209, 0.0]
  - - [512, 192, 1, 2048]
    - [53, 0.0]
  - - [512, 192, 1, 8192]
    - [108, 0.0]
  - - [512, 192, 1, 32768]
    - [210, 0.0]
  - - [576, 192, 1, 2048]
    - [53, 0.0]
  - - [576, 192, 1, 8192]
    - [108, 0.0]
  - - [576, 192, 1, 32768]
    - [211, 0.0]
  - - [640, 192, 1, 2048]
    - [68, 0.0]
  - - [640, 192, 1, 8192]
    - [111, 0.0]
  - - [640, 192, 1, 32768]
    - [212, 0.0]
  - - [768, 192, 1, 2048]
    - [68, 0.0]
  - - [768, 192, 1, 8192]
    - [111, 0.0]
  - - [768, 192, 1, 32768]
    - [111, 0.0]
  - - [896, 192, 1, 2048]
    - [109, 0.0]
  - - [896, 192, 1, 8192]
    - [213, 0.0]
  - - [896, 192, 1, 32768]
    - [214, 0.0]
  - - [1024, 192, 1, 2048]
    - [70, 0.0]
  - - [1024, 192, 1, 8192]
    - [215, 0.0]
  - - [1024, 192, 1, 32768]
    - [210, 0.0]
  - - [1280, 192, 1, 2048]
    - [195, 0.0]
  - - [1280, 192, 1, 8192]
    - [216, 0.0]
  - - [1280, 192, 1, 32768]
    - [217, 0.0]
  - - [1536, 192, 1, 2048]
    - [195, 0.0]
  - - [1536, 192, 1, 8192]
    - [195, 0.0]
  - - [1536, 192, 1, 32768]
    - [217, 0.0]
  - - [1792, 192, 1, 2048]
    - [108, 0.0]
  - - [1792, 192, 1, 8192]
    - [108, 0.0]
  - - [1792, 192, 1, 32768]
    - [217, 0.0]
  - - [2048, 192, 1, 2048]
    - [111, 0.0]
  - - [2048, 192, 1, 8192]
    - [215, 0.0]
  - - [2048, 192, 1, 32768]
    - [210, 0.0]
  - - [2304, 192, 1, 2048]
    - [111, 0.0]
  - - [2304, 192, 1, 8192]
    - [111, 0.0]
  - - [2304, 192, 1, 32768]
    - [217, 0.0]
  - - [2560, 192, 1, 2048]
    - [216, 0.0]
  - - [2560, 192, 1, 8192]
    - [216, 0.0]
  - - [2560, 192, 1, 32768]
    - [211, 0.0]
  - - [2816, 192, 1, 2048]
    - [114, 0.0]
  - - [2816, 192, 1, 8192]
    - [217, 0.0]
  - - [2816, 192, 1, 32768]
    - [218, 0.0]
  - - [3072, 192, 1, 2048]
    - [111, 0.0]
  - - [3072, 192, 1, 8192]
    - [217, 0.0]
  - - [3072, 192, 1, 32768]
    - [218, 0.0]
  - - [3584, 192, 1, 2048]
    - [119, 0.0]
  - - [3584, 192, 1, 8192]
    - [214, 0.0]
  - - [3584, 192, 1, 32768]
    - [214, 0.0]
  - - [4096, 192, 1, 2048]
    - [118, 0.0]
  - - [4096, 192, 1, 8192]
    - [216, 0.0]
  - - [4096, 192, 1, 32768]
    - [216, 0.0]
  - - [4608, 192, 1, 2048]
    - [219, 0.0]
  - - [4608, 192, 1, 8192]
    - [217, 0.0]
  - - [4608, 192, 1, 32768]
    - [217, 0.0]
  - - [5120, 192, 1, 512]
    - [212, 0.0]
  - - [5120, 192, 1, 2048]
    - [212, 0.0]
  - - [5120, 192, 1, 8192]
    - [211, 0.0]
  - - [5632, 192, 1, 512]
    - [220, 0.0]
  - - [5632, 192, 1, 2048]
    - [213, 0.0]
  - - [5632, 192, 1, 8192]
    - [213, 0.0]
  - - [6144, 192, 1, 512]
    - [221, 0.0]
  - - [6144, 192, 1, 2048]
    - [222, 0.0]
  - - [6144, 192, 1, 8192]
    - [215, 0.0]
  - - [7168, 192, 1, 512]
    - [214, 0.0]
  - - [7168, 192, 1, 2048]
    - [214, 0.0]
  - - [7168, 192, 1, 8192]
    - [214, 0.0]
  - - [8192, 192, 1, 512]
    - [217, 0.0]
  - - [8192, 192, 1, 2048]
    - [223, 0.0]
  - - [8192, 192, 1, 8192]
    - [216, 0.0]
  - - [10240, 192, 1, 512]
    - [211, 0.0]
  - - [10240, 192, 1, 2048]
    - [211, 0.0]
  - - [10240, 192, 1, 8192]
    - [211, 0.0]
  - - [12288, 192, 1, 512]
    - [224, 0.0]
  - - [12288, 192, 1, 2048]
    - [225, 0.0]
  - - [12288, 192, 1, 8192]
    - [225, 0.0]
  - - [14336, 192, 1, 512]
    - [226, 0.0]
  - - [14336, 192, 1, 2048]
    - [227, 0.0]
  - - [14336, 192, 1, 8192]
    - [214, 0.0]
  - - [16384, 192, 1, 512]
    - [223, 0.0]
  - - [16384, 192, 1, 2048]
    - [223, 0.0]
  - - [16384, 192, 1, 8192]
    - [216, 0.0]
  - - [20480, 192, 1, 512]
    - [227, 0.0]
  - - [20480, 192, 1, 2048]
    - [214, 0.0]
  - - [20480, 192, 1, 8192]
    - [211, 0.0]
  - - [24576, 192, 1, 512]
    - [217, 0.0]
  - - [24576, 192, 1, 2048]
    - [216, 0.0]
  - - [24576, 192, 1, 8192]
    - [216, 0.0]
  - - [28672, 192, 1, 512]
    - [217, 0.0]
  - - [28672, 192, 1, 2048]
    - [217, 0.0]
  - - [28672, 192, 1, 8192]
    - [217, 0.0]
  - - [32768, 192, 1, 512]
    - [228, 0.0]
  - - [32768, 192, 1, 2048]
    - [229, 0.0]
  - - [32768, 192, 1, 8192]
    - [229, 0.0]
  - - [40960, 192, 1, 512]
    - [230, 0.0]
  - - [40960, 192, 1, 2048]
    - [231, 0.0]
  - - [40960, 192, 1, 8192]
    - [232, 0.0]
  - - [49152, 192, 1, 512]
    - [233, 0.0]
  - - [49152, 192, 1, 2048]
    - [231, 0.0]
  - - [49152, 192, 1, 8192]
    - [232, 0.0]
  - - [57344, 192, 1, 512]
    - [234, 0.0]
  - - [57344, 192, 1, 2048]
    - [234, 0.0]
  - - [57344, 192, 1, 8192]
    - [234, 0.0]
  - - [65536, 192, 1, 512]
    - [234, 0.0]
  - - [65536, 192, 1, 2048]
    - [234, 0.0]
  - - [65536, 192, 1, 8192]
    - [234, 0.0]
  - - [98304, 192, 1, 512]
    - [234, 0.0]
  - - [98304, 192, 1, 2048]
    - [234, 0.0]
  - - [131072, 192, 1, 512]
    - [234, 0.0]
  - - [131072, 192, 1, 2048]
    - [234, 0.0]
  - - [16, 224, 1, 2048]
    - [1, 0.0]
  - - [16, 224, 1, 8192]
    - [106, 0.0]
  - - [16, 224, 1, 32768]
    - [26, 0.0]
  - - [32, 224, 1, 2048]
    - [1, 0.0]
  - - [32, 224, 1, 8192]
    - [23, 0.0]
  - - [32, 224, 1, 32768]
    - [23, 0.0]
  - - [48, 224, 1, 2048]
    - [21, 0.0]
  - - [48, 224, 1, 8192]
    - [183, 0.0]
  - - [48, 224, 1, 32768]
    - [78, 0.0]
  - - [64, 224, 1, 2048]
    - [95, 0.0]
  - - [64, 224, 1, 8192]
    - [66, 0.0]
  - - [64, 224, 1, 32768]
    - [66, 0.0]
  - - [80, 224, 1, 2048]
    - [95, 0.0]
  - - [80, 224, 1, 8192]
    - [70, 0.0]
  - - [80, 224, 1, 32768]
    - [144, 0.0]
  - - [96, 224, 1, 2048]
    - [31, 0.0]
  - - [96, 224, 1, 8192]
    - [70, 0.0]
  - - [96, 224, 1, 32768]
    - [70, 0.0]
  - - [112, 224, 1, 2048]
    - [31, 0.0]
  - - [112, 224, 1, 8192]
    - [68, 0.0]
  - - [112, 224, 1, 32768]
    - [128, 0.0]
  - - [128, 224, 1, 2048]
    - [62, 0.0]
  - - [128, 224, 1, 8192]
    - [130, 0.0]
  - - [128, 224, 1, 32768]
    - [97, 0.0]
  - - [160, 224, 1, 2048]
    - [62, 0.0]
  - - [160, 224, 1, 8192]
    - [144, 0.0]
  - - [160, 224, 1, 32768]
    - [235, 0.0]
  - - [192, 224, 1, 2048]
    - [32, 0.0]
  - - [192, 224, 1, 8192]
    - [147, 0.0]
  - - [192, 224, 1, 32768]
    - [236, 0.0]
  - - [224, 224, 1, 2048]
    - [237, 0.0]
  - - [224, 224, 1, 8192]
    - [55, 0.0]
  - - [224, 224, 1, 32768]
    - [238, 0.0]
  - - [256, 224, 1, 2048]
    - [239, 0.0]
  - - [256, 224, 1, 8192]
    - [163, 0.0]
  - - [256, 224, 1, 32768]
    - [240, 0.0]
  - - [320, 224, 1, 2048]
    - [69, 0.0]
  - - [320, 224, 1, 8192]
    - [108, 0.0]
  - - [320, 224, 1, 32768]
    - [235, 0.0]
  - - [384, 224, 1, 2048]
    - [127, 0.0]
  - - [384, 224, 1, 8192]
    - [108, 0.0]
  - - [384, 224, 1, 32768]
    - [236, 0.0]
  - - [448, 224, 1, 2048]
    - [68, 0.0]
  - - [448, 224, 1, 8192]
    - [97, 0.0]
  - - [448, 224, 1, 32768]
    - [241, 0.0]
  - - [512, 224, 1, 2048]
    - [68, 0.0]
  - - [512, 224, 1, 8192]
    - [97, 0.0]
  - - [512, 224, 1, 32768]
    - [236, 0.0]
  - - [576, 224, 1, 2048]
    - [68, 0.0]
  - - [576, 224, 1, 8192]
    - [149, 0.0]
  - - [576, 224, 1, 32768]
    - [242, 0.0]
  - - [640, 224, 1, 2048]
    - [96, 0.0]
  - - [640, 224, 1, 8192]
    - [243, 0.0]
  - - [640, 224, 1, 32768]
    - [238, 0.0]
  - - [768, 224, 1, 2048]
    - [96, 0.0]
  - - [768, 224, 1, 8192]
    - [235, 0.0]
  - - [768, 224, 1, 32768]
    - [235, 0.0]
  - - [896, 224, 1, 2048]
    - [55, 0.0]
  - - [896, 224, 1, 8192]
    - [235, 0.0]
  - - [896, 224, 1, 32768]
    - [236, 0.0]
  - - [1024, 224, 1, 2048]
    - [71, 0.0]
  - - [1024, 224, 1, 8192]
    - [236, 0.0]
  - - [1024, 224, 1, 32768]
    - [236, 0.0]
  - - [1280, 224, 1, 2048]
    - [97, 0.0]
  - - [1280, 224, 1, 8192]
    - [236, 0.0]
  - - [1280, 224, 1, 32768]
    - [244, 0.0]
  - - [1536, 224, 1, 2048]
    - [97, 0.0]
  - - [1536, 224, 1, 8192]
    - [238, 0.0]
  - - [1536, 224, 1, 32768]
    - [244, 0.0]
  - - [1792, 224, 1, 2048]
    - [149, 0.0]
  - - [1792, 224, 1, 8192]
    - [235, 0.0]
  - - [1792, 224, 1, 32768]
    - [244, 0.0]
  - - [2048, 224, 1, 2048]
    - [162, 0.0]
  - - [2048, 224, 1, 8192]
    - [236, 0.0]
  - - [2048, 224, 1, 32768]
    - [236, 0.0]
  - - [2304, 224, 1, 2048]
    - [245, 0.0]
  - - [2304, 224, 1, 8192]
    - [236, 0.0]
  - - [2304, 224, 1, 32768]
    - [244, 0.0]
  - - [2560, 224, 1, 2048]
    - [151, 0.0]
  - - [2560, 224, 1, 8192]
    - [238, 0.0]
  - - [2560, 224, 1, 32768]
    - [238, 0.0]
  - - [2816, 224, 1, 2048]
    - [166, 0.0]
  - - [2816, 224, 1, 8192]
    - [235, 0.0]
  - - [2816, 224, 1, 32768]
    - [244, 0.0]
  - - [3072, 224, 1, 2048]
    - [246, 0.0]
  - - [3072, 224, 1, 8192]
    - [244, 0.0]
  - - [3072, 224, 1, 32768]
    - [244, 0.0]
  - - [3584, 224, 1, 2048]
    - [154, 0.0]
  - - [3584, 224, 1, 8192]
    - [236, 0.0]
  - - [3584, 224, 1, 32768]
    - [236, 0.0]
  - - [4096, 224, 1, 512]
    - [247, 0.0]
  - - [4096, 224, 1, 2048]
    - [155, 0.0]
  - - [4096, 224, 1, 8192]
    - [238, 0.0]
  - - [4608, 224, 1, 512]
    - [247, 0.0]
  - - [4608, 224, 1, 2048]
    - [172, 0.0]
  - - [4608, 224, 1, 8192]
    - [244, 0.0]
  - - [5120, 224, 1, 512]
    - [235, 0.0]
  - - [5120, 224, 1, 2048]
    - [159, 0.0]
  - - [5120, 224, 1, 8192]
    - [235, 0.0]
  - - [5632, 224, 1, 512]
    - [235, 0.0]
  - - [5632, 224, 1, 2048]
    - [235, 0.0]
  - - [5632, 224, 1, 8192]
    - [235, 0.0]
  - - [6144, 224, 1, 512]
    - [236, 0.0]
  - - [6144, 224, 1, 2048]
    - [236, 0.0]
  - - [6144, 224, 1, 8192]
    - [236, 0.0]
  - - [7168, 224, 1, 512]
    - [236, 0.0]
  - - [7168, 224, 1, 2048]
    - [236, 0.0]
  - - [7168, 224, 1, 8192]
    - [236, 0.0]
  - - [8192, 224, 1, 512]
    - [238, 0.0]
  - - [8192, 224, 1, 2048]
    - [238, 0.0]
  - - [8192, 224, 1, 8192]
    - [238, 0.0]
  - - [10240, 224, 1, 512]
    - [248, 0.0]
  - - [10240, 224, 1, 2048]
    - [248, 0.0]
  - - [10240, 224, 1, 8192]
    - [235, 0.0]
  - - [12288, 224, 1, 512]
    - [236, 0.0]
  - - [12288, 224, 1, 2048]
    - [236, 0.0]
  - - [12288, 224, 1, 8192]
    - [236, 0.0]
  - - [14336, 224, 1, 512]
    - [243, 0.0]
  - - [14336, 224, 1, 2048]
    - [236, 0.0]
  - - [14336, 224, 1, 8192]
    - [236, 0.0]
  - - [16384, 224, 1, 512]
    - [240, 0.0]
  - - [16384, 224, 1, 2048]
    - [238, 0.0]
  - - [16384, 224, 1, 8192]
    - [238, 0.0]
  - - [20480, 224, 1, 512]
    - [236, 0.0]
  - - [20480, 224, 1, 2048]
    - [236, 0.0]
  - - [20480, 224, 1, 8192]
    - [236, 0.0]
  - - [24576, 224, 1, 512]
    - [238, 0.0]
  - - [24576, 224, 1, 2048]
    - [238, 0.0]
  - - [24576, 224, 1, 8192]
    - [238, 0.0]
  - - [28672, 224, 1, 512]
    - [240, 0.0]
  - - [28672, 224, 1, 2048]
    - [236, 0.0]
  - - [28672, 224, 1, 8192]
    - [244, 0.0]
  - - [32768, 224, 1, 512]
    - [249, 0.0]
  - - [32768, 224, 1, 2048]
    - [250, 0.0]
  - - [32768, 224, 1, 8192]
    - [250, 0.0]
  - - [40960, 224, 1, 512]
    - [249, 0.0]
  - - [40960, 224, 1, 2048]
    - [250, 0.0]
  - - [40960, 224, 1, 8192]
    - [250, 0.0]
  - - [49152, 224, 1, 512]
    - [250, 0.0]
  - - [49152, 224, 1, 2048]
    - [250, 0.0]
  - - [49152, 224, 1, 8192]
    - [250, 0.0]
  - - [57344, 224, 1, 512]
    - [249, 0.0]
  - - [57344, 224, 1, 2048]
    - [250, 0.0]
  - - [57344, 224, 1, 8192]
    - [251, 0.0]
  - - [65536, 224, 1, 512]
    - [250, 0.0]
  - - [65536, 224, 1, 2048]
    - [250, 0.0]
  - - [65536, 224, 1, 8192]
    - [251, 0.0]
  - - [98304, 224, 1, 512]
    - [249, 0.0]
  - - [98304, 224, 1, 2048]
    - [250, 0.0]
  - - [131072, 224, 1, 512]
    - [249, 0.0]
  - - [131072, 224, 1, 2048]
    - [250, 0.0]
  - - [16, 256, 1, 2048]
    - [7, 0.0]
  - - [16, 256, 1, 8192]
    - [106, 0.0]
  - - [16, 256, 1, 32768]
    - [26, 0.0]
  - - [32, 256, 1, 2048]
    - [7, 0.0]
  - - [32, 256, 1, 8192]
    - [23, 0.0]
  - - [32, 256, 1, 32768]
    - [23, 0.0]
  - - [48, 256, 1, 2048]
    - [21, 0.0]
  - - [48, 256, 1, 8192]
    - [78, 0.0]
  - - [48, 256, 1, 32768]
    - [73, 0.0]
  - - [16, 320, 1, 2048]
    - [7, 0.0]
  - - [16, 320, 1, 8192]
    - [26, 0.0]
  - - [16, 320, 1, 32768]
    - [26, 0.0]
  - - [32, 320, 1, 2048]
    - [21, 0.0]
  - - [32, 320, 1, 8192]
    - [23, 0.0]
  - - [32, 320, 1, 32768]
    - [23, 0.0]
  - - [48, 320, 1, 2048]
    - [21, 0.0]
  - - [48, 320, 1, 8192]
    - [78, 0.0]
  - - [48, 320, 1, 32768]
    - [73, 0.0]
  - - [64, 256, 1, 2048]
    - [150, 0.0]
  - - [64, 256, 1, 8192]
    - [64, 0.0]
  - - [64, 256, 1, 32768]
    - [252, 0.0]
  - - [80, 256, 1, 2048]
    - [150, 0.0]
  - - [80, 256, 1, 8192]
    - [64, 0.0]
  - - [80, 256, 1, 32768]
    - [144, 0.0]
  - - [96, 256, 1, 2048]
    - [62, 0.0]
  - - [96, 256, 1, 8192]
    - [64, 0.0]
  - - [96, 256, 1, 32768]
    - [149, 0.0]
  - - [112, 256, 1, 2048]
    - [62, 0.0]
  - - [112, 256, 1, 8192]
    - [148, 0.0]
  - - [112, 256, 1, 32768]
    - [148, 0.0]
  - - [64, 320, 1, 2048]
    - [67, 0.0]
  - - [64, 320, 1, 8192]
    - [68, 0.0]
  - - [64, 320, 1, 32768]
    - [68, 0.0]
  - - [80, 320, 1, 2048]
    - [62, 0.0]
  - - [80, 320, 1, 8192]
    - [77, 0.0]
  - - [80, 320, 1, 32768]
    - [108, 0.0]
  - - [96, 320, 1, 2048]
    - [62, 0.0]
  - - [96, 320, 1, 8192]
    - [70, 0.0]
  - - [96, 320, 1, 32768]
    - [108, 0.0]
  - - [112, 320, 1, 2048]
    - [253, 0.0]
  - - [112, 320, 1, 8192]
    - [76, 0.0]
  - - [112, 320, 1, 32768]
    - [76, 0.0]
  - - [128, 256, 1, 2048]
    - [254, 0.0]
  - - [128, 256, 1, 8192]
    - [147, 0.0]
  - - [128, 256, 1, 32768]
    - [147, 0.0]
  - - [160, 256, 1, 2048]
    - [93, 0.0]
  - - [160, 256, 1, 8192]
    - [144, 0.0]
  - - [160, 256, 1, 32768]
    - [144, 0.0]
  - - [192, 256, 1, 2048]
    - [93, 0.0]
  - - [192, 256, 1, 8192]
    - [149, 0.0]
  - - [192, 256, 1, 32768]
    - [149, 0.0]
  - - [224, 256, 1, 2048]
    - [150, 0.0]
  - - [224, 256, 1, 8192]
    - [110, 0.0]
  - - [224, 256, 1, 32768]
    - [255, 0.0]
  - - [128, 320, 1, 2048]
    - [206, 0.0]
  - - [128, 320, 1, 8192]
    - [79, 0.0]
  - - [128, 320, 1, 32768]
    - [111, 0.0]
  - - [160, 320, 1, 2048]
    - [150, 0.0]
  - - [160, 320, 1, 8192]
    - [72, 0.0]
  - - [160, 320, 1, 32768]
    - [72, 0.0]
  - - [192, 320, 1, 2048]
    - [150, 0.0]
  - - [192, 320, 1, 8192]
    - [110, 0.0]
  - - [192, 320, 1, 32768]
    - [256, 0.0]
  - - [224, 320, 1, 2048]
    - [150, 0.0]
  - - [224, 320, 1, 8192]
    - [147, 0.0]
  - - [224, 320, 1, 32768]
    - [193, 0.0]
  - - [256, 256, 1, 2048]
    - [69, 0.0]
  - - [256, 256, 1, 8192]
    - [148, 0.0]
  - - [256, 256, 1, 32768]
    - [148, 0.0]
  - - [320, 256, 1, 2048]
    - [257, 0.0]
  - - [320, 256, 1, 8192]
    - [71, 0.0]
  - - [320, 256, 1, 32768]
    - [258, 0.0]
  - - [384, 256, 1, 2048]
    - [93, 0.0]
  - - [384, 256, 1, 8192]
    - [71, 0.0]
  - - [384, 256, 1, 32768]
    - [149, 0.0]
  - - [448, 256, 1, 2048]
    - [68, 0.0]
  - - [448, 256, 1, 8192]
    - [144, 0.0]
  - - [448, 256, 1, 32768]
    - [259, 0.0]
  - - [256, 320, 1, 2048]
    - [260, 0.0]
  - - [256, 320, 1, 8192]
    - [147, 0.0]
  - - [256, 320, 1, 32768]
    - [196, 0.0]
  - - [320, 320, 1, 2048]
    - [93, 0.0]
  - - [320, 320, 1, 8192]
    - [144, 0.0]
  - - [320, 320, 1, 32768]
    - [192, 0.0]
  - - [384, 320, 1, 2048]
    - [68, 0.0]
  - - [384, 320, 1, 8192]
    - [111, 0.0]
  - - [384, 320, 1, 32768]
    - [146, 0.0]
  - - [448, 320, 1, 2048]
    - [68, 0.0]
  - - [448, 320, 1, 8192]
    - [191, 0.0]
  - - [448, 320, 1, 32768]
    - [261, 0.0]
  - - [512, 256, 1, 2048]
    - [68, 0.0]
  - - [512, 256, 1, 8192]
    - [111, 0.0]
  - - [512, 256, 1, 32768]
    - [262, 0.0]
  - - [576, 256, 1, 2048]
    - [68, 0.0]
  - - [576, 256, 1, 8192]
    - [149, 0.0]
  - - [576, 256, 1, 32768]
    - [263, 0.0]
  - - [640, 256, 1, 2048]
    - [70, 0.0]
  - - [640, 256, 1, 8192]
    - [155, 0.0]
  - - [640, 256, 1, 32768]
    - [264, 0.0]
  - - [768, 256, 1, 2048]
    - [110, 0.0]
  - - [768, 256, 1, 8192]
    - [111, 0.0]
  - - [768, 256, 1, 32768]
    - [265, 0.0]
  - - [896, 256, 1, 2048]
    - [145, 0.0]
  - - [896, 256, 1, 8192]
    - [258, 0.0]
  - - [896, 256, 1, 32768]
    - [265, 0.0]
  - - [512, 320, 1, 2048]
    - [70, 0.0]
  - - [512, 320, 1, 8192]
    - [194, 0.0]
  - - [512, 320, 1, 32768]
    - [194, 0.0]
  - - [576, 320, 1, 2048]
    - [110, 0.0]
  - - [576, 320, 1, 8192]
    - [194, 0.0]
  - - [576, 320, 1, 32768]
    - [190, 0.0]
  - - [640, 320, 1, 2048]
    - [70, 0.0]
  - - [640, 320, 1, 8192]
    - [193, 0.0]
  - - [640, 320, 1, 32768]
    - [193, 0.0]
  - - [768, 320, 1, 2048]
    - [146, 0.0]
  - - [768, 320, 1, 8192]
    - [189, 0.0]
  - - [768, 320, 1, 32768]
    - [196, 0.0]
  - - [896, 320, 1, 2048]
    - [71, 0.0]
  - - [896, 320, 1, 8192]
    - [185, 0.0]
  - - [896, 320, 1, 32768]
    - [192, 0.0]
  - - [1024, 256, 1, 2048]
    - [148, 0.0]
  - - [1024, 256, 1, 8192]
    - [266, 0.0]
  - - [1024, 256, 1, 32768]
    - [262, 0.0]
  - - [1280, 256, 1, 2048]
    - [111, 0.0]
  - - [1280, 256, 1, 8192]
    - [265, 0.0]
  - - [1280, 256, 1, 32768]
    - [255, 0.0]
  - - [1536, 256, 1, 2048]
    - [111, 0.0]
  - - [1536, 256, 1, 8192]
    - [266, 0.0]
  - - [1536, 256, 1, 32768]
    - [255, 0.0]
  - - [1792, 256, 1, 2048]
    - [149, 0.0]
  - - [1792, 256, 1, 8192]
    - [149, 0.0]
  - - [1792, 256, 1, 32768]
    - [267, 0.0]
  - - [1024, 320, 1, 2048]
    - [111, 0.0]
  - - [1024, 320, 1, 8192]
    - [194, 0.0]
  - - [1024, 320, 1, 32768]
    - [268, 0.0]
  - - [1280, 320, 1, 2048]
    - [162, 0.0]
  - - [1280, 320, 1, 8192]
    - [193, 0.0]
  - - [1280, 320, 1, 32768]
    - [193, 0.0]
  - - [1536, 320, 1, 2048]
    - [163, 0.0]
  - - [1536, 320, 1, 8192]
    - [196, 0.0]
  - - [1536, 320, 1, 32768]
    - [196, 0.0]
  - - [1792, 320, 1, 2048]
    - [71, 0.0]
  - - [1792, 320, 1, 8192]
    - [268, 0.0]
  - - [1792, 320, 1, 32768]
    - [268, 0.0]
  - - [2048, 256, 1, 2048]
    - [162, 0.0]
  - - [2048, 256, 1, 8192]
    - [266, 0.0]
  - - [2048, 256, 1, 32768]
    - [266, 0.0]
  - - [2304, 256, 1, 2048]
    - [269, 0.0]
  - - [2304, 256, 1, 8192]
    - [265, 0.0]
  - - [2304, 256, 1, 32768]
    - [265, 0.0]
  - - [2560, 256, 1, 2048]
    - [154, 0.0]
  - - [2560, 256, 1, 8192]
    - [255, 0.0]
  - - [2560, 256, 1, 32768]
    - [255, 0.0]
  - - [2816, 256, 1, 2048]
    - [270, 0.0]
  - - [2816, 256, 1, 8192]
    - [258, 0.0]
  - - [2816, 256, 1, 32768]
    - [271, 0.0]
  - - [3072, 256, 1, 2048]
    - [154, 0.0]
  - - [3072, 256, 1, 8192]
    - [266, 0.0]
  - - [3072, 256, 1, 32768]
    - [266, 0.0]
  - - [3584, 256, 1, 512]
    - [153, 0.0]
  - - [3584, 256, 1, 2048]
    - [153, 0.0]
  - - [3584, 256, 1, 8192]
    - [265, 0.0]
  - - [2048, 320, 1, 2048]
    - [208, 0.0]
  - - [2048, 320, 1, 8192]
    - [196, 0.0]
  - - [2048, 320, 1, 32768]
    - [196, 0.0]
  - - [2304, 320, 1, 2048]
    - [154, 0.0]
  - - [2304, 320, 1, 8192]
    - [196, 0.0]
  - - [2304, 320, 1, 32768]
    - [199, 0.0]
  - - [2560, 320, 1, 2048]
    - [212, 0.0]
  - - [2560, 320, 1, 8192]
    - [190, 0.0]
  - - [2560, 320, 1, 32768]
    - [190, 0.0]
  - - [2816, 320, 1, 2048]
    - [185, 0.0]
  - - [2816, 320, 1, 8192]
    - [185, 0.0]
  - - [2816, 320, 1, 32768]
    - [268, 0.0]
  - - [3072, 320, 1, 512]
    - [172, 0.0]
  - - [3072, 320, 1, 2048]
    - [194, 0.0]
  - - [3072, 320, 1, 8192]
    - [194, 0.0]
  - - [3584, 320, 1, 512]
    - [256, 0.0]
  - - [3584, 320, 1, 2048]
    - [194, 0.0]
  - - [3584, 320, 1, 8192]
    - [194, 0.0]
  - - [4096, 256, 1, 512]
    - [171, 0.0]
  - - [4096, 256, 1, 2048]
    - [155, 0.0]
  - - [4096, 256, 1, 8192]
    - [155, 0.0]
  - - [4608, 256, 1, 512]
    - [161, 0.0]
  - - [4608, 256, 1, 2048]
    - [161, 0.0]
  - - [4608, 256, 1, 8192]
    - [161, 0.0]
  - - [5120, 256, 1, 512]
    - [169, 0.0]
  - - [5120, 256, 1, 2048]
    - [159, 0.0]
  - - [5120, 256, 1, 8192]
    - [272, 0.0]
  - - [5632, 256, 1, 512]
    - [271, 0.0]
  - - [5632, 256, 1, 2048]
    - [273, 0.0]
  - - [5632, 256, 1, 8192]
    - [273, 0.0]
  - - [6144, 256, 1, 512]
    - [274, 0.0]
  - - [6144, 256, 1, 2048]
    - [265, 0.0]
  - - [6144, 256, 1, 8192]
    - [266, 0.0]
  - - [7168, 256, 1, 512]
    - [265, 0.0]
  - - [7168, 256, 1, 2048]
    - [265, 0.0]
  - - [7168, 256, 1, 8192]
    - [274, 0.0]
  - - [4096, 320, 1, 512]
    - [193, 0.0]
  - - [4096, 320, 1, 2048]
    - [193, 0.0]
  - - [4096, 320, 1, 8192]
    - [193, 0.0]
  - - [4608, 320, 1, 512]
    - [196, 0.0]
  - - [4608, 320, 1, 2048]
    - [196, 0.0]
  - - [4608, 320, 1, 8192]
    - [196, 0.0]
  - - [5120, 320, 1, 512]
    - [192, 0.0]
  - - [5120, 320, 1, 2048]
    - [190, 0.0]
  - - [5120, 320, 1, 8192]
    - [190, 0.0]
  - - [5632, 320, 1, 512]
    - [275, 0.0]
  - - [5632, 320, 1, 2048]
    - [275, 0.0]
  - - [5632, 320, 1, 8192]
    - [275, 0.0]
  - - [6144, 320, 1, 512]
    - [276, 0.0]
  - - [6144, 320, 1, 2048]
    - [161, 0.0]
  - - [6144, 320, 1, 8192]
    - [225, 0.0]
  - - [7168, 320, 1, 512]
    - [277, 0.0]
  - - [7168, 320, 1, 2048]
    - [277, 0.0]
  - - [7168, 320, 1, 8192]
    - [278, 0.0]
  - - [8192, 256, 1, 512]
    - [279, 0.0]
  - - [8192, 256, 1, 2048]
    - [255, 0.0]
  - - [8192, 256, 1, 8192]
    - [255, 0.0]
  - - [10240, 256, 1, 512]
    - [265, 0.0]
  - - [10240, 256, 1, 2048]
    - [266, 0.0]
  - - [10240, 256, 1, 8192]
    - [266, 0.0]
  - - [12288, 256, 1, 512]
    - [274, 0.0]
  - - [12288, 256, 1, 2048]
    - [266, 0.0]
  - - [12288, 256, 1, 8192]
    - [266, 0.0]
  - - [14336, 256, 1, 512]
    - [265, 0.0]
  - - [14336, 256, 1, 2048]
    - [265, 0.0]
  - - [14336, 256, 1, 8192]
    - [265, 0.0]
  - - [8192, 320, 1, 512]
    - [190, 0.0]
  - - [8192, 320, 1, 2048]
    - [190, 0.0]
  - - [8192, 320, 1, 8192]
    - [280, 0.0]
  - - [10240, 320, 1, 512]
    - [192, 0.0]
  - - [10240, 320, 1, 2048]
    - [190, 0.0]
  - - [10240, 320, 1, 8192]
    - [280, 0.0]
  - - [12288, 320, 1, 512]
    - [281, 0.0]
  - - [12288, 320, 1, 2048]
    - [225, 0.0]
  - - [12288, 320, 1, 8192]
    - [280, 0.0]
  - - [14336, 320, 1, 512]
    - [277, 0.0]
  - - [14336, 320, 1, 2048]
    - [277, 0.0]
  - - [14336, 320, 1, 8192]
    - [280, 0.0]
  - - [16384, 256, 1, 512]
    - [282, 0.0]
  - - [16384, 256, 1, 2048]
    - [283, 0.0]
  - - [16384, 256, 1, 8192]
    - [283, 0.0]
  - - [20480, 256, 1, 512]
    - [284, 0.0]
  - - [20480, 256, 1, 2048]
    - [284, 0.0]
  - - [20480, 256, 1, 8192]
    - [284, 0.0]
  - - [24576, 256, 1, 512]
    - [282, 0.0]
  - - [24576, 256, 1, 2048]
    - [283, 0.0]
  - - [24576, 256, 1, 8192]
    - [283, 0.0]
  - - [28672, 256, 1, 512]
    - [284, 0.0]
  - - [28672, 256, 1, 2048]
    - [285, 0.0]
  - - [28672, 256, 1, 8192]
    - [285, 0.0]
  - - [16384, 320, 1, 512]
    - [286, 0.0]
  - - [16384, 320, 1, 2048]
    - [287, 0.0]
  - - [16384, 320, 1, 8192]
    - [287, 0.0]
  - - [20480, 320, 1, 512]
    - [286, 0.0]
  - - [20480, 320, 1, 2048]
    - [288, 0.0]
  - - [20480, 320, 1, 8192]
    - [287, 0.0]
  - - [24576, 320, 1, 512]
    - [286, 0.0]
  - - [24576, 320, 1, 2048]
    - [288, 0.0]
  - - [24576, 320, 1, 8192]
    - [288, 0.0]
  - - [28672, 320, 1, 512]
    - [289, 0.0]
  - - [28672, 320, 1, 2048]
    - [288, 0.0]
  - - [28672, 320, 1, 8192]
    - [290, 0.0]
  - - [32768, 256, 1, 512]
    - [180, 0.0]
  - - [32768, 256, 1, 2048]
    - [283, 0.0]
  - - [32768, 256, 1, 8192]
    - [283, 0.0]
  - - [40960, 256, 1, 512]
    - [284, 0.0]
  - - [40960, 256, 1, 2048]
    - [283, 0.0]
  - - [40960, 256, 1, 8192]
    - [283, 0.0]
  - - [49152, 256, 1, 512]
    - [291, 0.0]
  - - [49152, 256, 1, 2048]
    - [285, 0.0]
  - - [49152, 256, 1, 8192]
    - [285, 0.0]
  - - [57344, 256, 1, 512]
    - [292, 0.0]
  - - [57344, 256, 1, 2048]
    - [285, 0.0]
  - - [57344, 256, 1, 8192]
    - [285, 0.0]
  - - [32768, 320, 1, 512]
    - [286, 0.0]
  - - [32768, 320, 1, 2048]
    - [200, 0.0]
  - - [32768, 320, 1, 8192]
    - [204, 0.0]
  - - [40960, 320, 1, 512]
    - [286, 0.0]
  - - [40960, 320, 1, 2048]
    - [205, 0.0]
  - - [40960, 320, 1, 8192]
    - [205, 0.0]
  - - [49152, 320, 1, 512]
    - [286, 0.0]
  - - [49152, 320, 1, 2048]
    - [293, 0.0]
  - - [57344, 320, 1, 512]
    - [286, 0.0]
  - - [57344, 320, 1, 2048]
    - [200, 0.0]
  - - [65536, 256, 1, 512]
    - [178, 0.0]
  - - [65536, 256, 1, 2048]
    - [294, 0.0]
  - - [98304, 256, 1, 512]
    - [292, 0.0]
  - - [98304, 256, 1, 2048]
    - [283, 0.0]
  - - [131072, 256, 1, 512]
    - [292, 0.0]
  - - [131072, 256, 1, 2048]
    - [294, 0.0]
  - - [65536, 320, 1, 512]
    - [286, 0.0]
  - - [65536, 320, 1, 2048]
    - [295, 0.0]
  - - [98304, 320, 1, 512]
    - [295, 0.0]
  - - [98304, 320, 1, 2048]
    - [295, 0.0]
  - - [131072, 320, 1, 512]
    - [295, 0.0]
  - - [131072, 320, 1, 2048]
    - [293, 0.0]
  - - [16, 384, 1, 2048]
    - [24, 0.0]
  - - [16, 384, 1, 8192]
    - [63, 0.0]
  - - [16, 384, 1, 32768]
    - [26, 0.0]
  - - [32, 384, 1, 2048]
    - [24, 0.0]
  - - [32, 384, 1, 8192]
    - [26, 0.0]
  - - [32, 384, 1, 32768]
    - [296, 0.0]
  - - [48, 384, 1, 2048]
    - [24, 0.0]
  - - [48, 384, 1, 8192]
    - [24, 0.0]
  - - [48, 384, 1, 32768]
    - [296, 0.0]
  - - [16, 448, 1, 2048]
    - [24, 0.0]
  - - [16, 448, 1, 8192]
    - [95, 0.0]
  - - [16, 448, 1, 32768]
    - [26, 0.0]
  - - [32, 448, 1, 2048]
    - [24, 0.0]
  - - [32, 448, 1, 8192]
    - [64, 0.0]
  - - [32, 448, 1, 32768]
    - [64, 0.0]
  - - [48, 448, 1, 2048]
    - [297, 0.0]
  - - [48, 448, 1, 8192]
    - [127, 0.0]
  - - [48, 448, 1, 32768]
    - [145, 0.0]
  - - [64, 384, 1, 2048]
    - [93, 0.0]
  - - [64, 384, 1, 8192]
    - [53, 0.0]
  - - [64, 384, 1, 32768]
    - [53, 0.0]
  - - [80, 384, 1, 2048]
    - [62, 0.0]
  - - [80, 384, 1, 8192]
    - [108, 0.0]
  - - [80, 384, 1, 32768]
    - [108, 0.0]
  - - [96, 384, 1, 2048]
    - [62, 0.0]
  - - [96, 384, 1, 8192]
    - [108, 0.0]
  - - [96, 384, 1, 32768]
    - [108, 0.0]
  - - [112, 384, 1, 2048]
    - [298, 0.0]
  - - [112, 384, 1, 8192]
    - [299, 0.0]
  - - [112, 384, 1, 32768]
    - [146, 0.0]
  - - [64, 448, 1, 2048]
    - [62, 0.0]
  - - [64, 448, 1, 8192]
    - [68, 0.0]
  - - [64, 448, 1, 32768]
    - [110, 0.0]
  - - [80, 448, 1, 2048]
    - [253, 0.0]
  - - [80, 448, 1, 8192]
    - [108, 0.0]
  - - [80, 448, 1, 32768]
    - [108, 0.0]
  - - [96, 448, 1, 2048]
    - [298, 0.0]
  - - [96, 448, 1, 8192]
    - [108, 0.0]
  - - [96, 448, 1, 32768]
    - [108, 0.0]
  - - [112, 448, 1, 2048]
    - [298, 0.0]
  - - [112, 448, 1, 8192]
    - [96, 0.0]
  - - [112, 448, 1, 32768]
    - [162, 0.0]
  - - [128, 384, 1, 2048]
    - [150, 0.0]
  - - [128, 384, 1, 8192]
    - [111, 0.0]
  - - [128, 384, 1, 32768]
    - [111, 0.0]
  - - [160, 384, 1, 2048]
    - [150, 0.0]
  - - [160, 384, 1, 8192]
    - [68, 0.0]
  - - [160, 384, 1, 32768]
    - [220, 0.0]
  - - [192, 384, 1, 2048]
    - [150, 0.0]
  - - [192, 384, 1, 8192]
    - [68, 0.0]
  - - [192, 384, 1, 32768]
    - [214, 0.0]
  - - [224, 384, 1, 2048]
    - [127, 0.0]
  - - [224, 384, 1, 8192]
    - [147, 0.0]
  - - [224, 384, 1, 32768]
    - [216, 0.0]
  - - [128, 448, 1, 2048]
    - [150, 0.0]
  - - [128, 448, 1, 8192]
    - [111, 0.0]
  - - [128, 448, 1, 32768]
    - [111, 0.0]
  - - [160, 448, 1, 2048]
    - [64, 0.0]
  - - [160, 448, 1, 8192]
    - [72, 0.0]
  - - [160, 448, 1, 32768]
    - [235, 0.0]
  - - [192, 448, 1, 2048]
    - [127, 0.0]
  - - [192, 448, 1, 8192]
    - [147, 0.0]
  - - [192, 448, 1, 32768]
    - [236, 0.0]
  - - [224, 448, 1, 2048]
    - [127, 0.0]
  - - [224, 448, 1, 8192]
    - [144, 0.0]
  - - [224, 448, 1, 32768]
    - [111, 0.0]
  - - [256, 384, 1, 2048]
    - [127, 0.0]
  - - [256, 384, 1, 8192]
    - [108, 0.0]
  - - [256, 384, 1, 32768]
    - [217, 0.0]
  - - [320, 384, 1, 2048]
    - [68, 0.0]
  - - [320, 384, 1, 8192]
    - [144, 0.0]
  - - [320, 384, 1, 32768]
    - [213, 0.0]
  - - [384, 384, 1, 2048]
    - [68, 0.0]
  - - [384, 384, 1, 8192]
    - [111, 0.0]
  - - [384, 384, 1, 32768]
    - [111, 0.0]
  - - [448, 384, 1, 2048]
    - [109, 0.0]
  - - [448, 384, 1, 8192]
    - [155, 0.0]
  - - [448, 384, 1, 32768]
    - [216, 0.0]
  - - [256, 448, 1, 2048]
    - [68, 0.0]
  - - [256, 448, 1, 8192]
    - [97, 0.0]
  - - [256, 448, 1, 32768]
    - [244, 0.0]
  - - [320, 448, 1, 2048]
    - [68, 0.0]
  - - [320, 448, 1, 8192]
    - [241, 0.0]
  - - [320, 448, 1, 32768]
    - [235, 0.0]
  - - [384, 448, 1, 2048]
    - [109, 0.0]
  - - [384, 448, 1, 8192]
    - [243, 0.0]
  - - [384, 448, 1, 32768]
    - [236, 0.0]
  - - [448, 448, 1, 2048]
    - [109, 0.0]
  - - [448, 448, 1, 8192]
    - [235, 0.0]
  - - [448, 448, 1, 32768]
    - [235, 0.0]
  - - [512, 384, 1, 2048]
    - [70, 0.0]
