projects/hipblaslt/library/src/amd_detail/rocblaslt/src/Tensile/Logic/asm_full/gfx950/gfx950/GridBased/gfx950_Cijk_Alik_Bjlk_I8II_BH_UserArgs.yaml
- {MinimumRequiredVersion: 5.0.0}
- gfx950
- gfx950
- [Device 75a0]
    SolutionIndex: 0
    SolutionNameMin: Cijk_Alik_Bjlk_I8II_BH_UserArgs_MT256x256x32_MI32x32x1_SN_LDSB0_AFC0_AFEM1_AFEM1_ASEM1_CLR0_CADS0_DTVA0_DTVB0_EPS0_FDSI0_GRPM1_GRVWA16_GRVWB4_GSU0_GSUAMB_GSUC0_GSUWGMRR0_GLS0_ISA950_IU1_K1_LBSPPA128_LBSPPB0_LBSPPM0_LPA16_LPB0_LPM0_LRVW16_LWPMn1_MIAV0_MIWT4_4_MO40_NTn1_NTA0_NTB0_NTC0_NTD0_NTM0_NEPBS0_NLCA1_NLCB1_ONLL1_PGR2_PLR0_PKA1_SIA3_SS1_SU0_SUM1_SUS32_SPO0_SRVW0_SSO0_SVW4_SK3_SKXCCM8_TLDS1_ULSGRO0_USL1_UIOFGRO0_USFGRO0_VSn1_VWA4_VWB2_WSGRA0_WSGRB0_WS64_WG64_4_1_WGM6_WGMXCC1_WGMXCCGn1
    SolutionIndex: 1
    SolutionNameMin: Cijk_Alik_Bjlk_I8II_BH_UserArgs_MT256x256x32_MI32x32x1_SN_LDSB0_AFC0_AFEM1_AFEM1_ASEM1_CLR0_CADS0_DTVA0_DTVB0_EPS0_FDSI0_GRPM1_GRVWA16_GRVWB4_GSU0_GSUAMB_GSUC0_GSUWGMRR0_GLS0_ISA950_IU1_K1_LBSPPA128_LBSPPB0_LBSPPM0_LPA16_LPB0_LPM0_LRVW16_LWPMn1_MIAV0_MIWT4_4_MO40_NTn1_NTA0_NTB0_NTC0_NTD0_NTM0_NEPBS0_NLCA1_NLCB1_ONLL1_PGR2_PLR0_PKA1_SIA3_SS1_SU0_SUM1_SUS32_SPO0_SRVW0_SSO0_SVW4_SK3_SKXCCM8_TLDS1_ULSGRO0_USL1_UIOFGRO0_USFGRO0_VSn1_VWA4_VWB4_WSGRA0_WSGRB0_WS64_WG64_4_1_WGM6_WGMXCC1_WGMXCCGn1
    SolutionIndex: 2
    SolutionNameMin: Cijk_Alik_Bjlk_I8II_BH_UserArgs_MT256x256x32_MI32x32x1_SN_LDSB0_AFC0_AFEM1_AFEM1_ASEM1_CLR0_CADS0_DTVA0_DTVB0_EPS0_FDSI0_GRPM1_GRVWA4_GRVWB8_GSU0_GSUAMB_GSUC0_GSUWGMRR0_GLS0_ISA950_IU1_K1_LBSPPA128_LBSPPB0_LBSPPM0_LPA16_LPB0_LPM0_LRVW16_LWPMn1_MIAV0_MIWT4_4_MO40_NTn1_NTA0_NTB0_NTC0_NTD0_NTM0_NEPBS0_NLCA1_NLCB1_ONLL1_PGR2_PLR0_PKA1_SIA3_SS1_SU0_SUM1_SUS32_SPO0_SRVW0_SSO0_SVW4_SK3_SKXCCM8_TLDS1_ULSGRO0_USL1_UIOFGRO0_USFGRO0_VSn1_VWA4_VWB2_WSGRA0_WSGRB0_WS64_WG64_4_1_WGM6_WGMXCC1_WGMXCCGn1
    SolutionIndex: 3
    SolutionNameMin: Cijk_Alik_Bjlk_I8II_BH_UserArgs_MT256x256x32_MI32x32x1_SN_LDSB0_AFC0_AFEM1_AFEM1_ASEM1_CLR0_CADS0_DTVA0_DTVB0_EPS0_FDSI0_GRPM1_GRVWA4_GRVWB8_GSU0_GSUAMB_GSUC0_GSUWGMRR0_GLS0_ISA950_IU1_K1_LBSPPA128_LBSPPB0_LBSPPM0_LPA16_LPB0_LPM0_LRVW16_LWPMn1_MIAV0_MIWT4_4_MO40_NTn1_NTA0_NTB0_NTC0_NTD0_NTM0_NEPBS0_NLCA1_NLCB1_ONLL1_PGR2_PLR0_PKA1_SIA3_SS1_SU0_SUM1_SUS32_SPO0_SRVW0_SSO0_SVW4_SK3_SKXCCM8_TLDS1_ULSGRO0_USL1_UIOFGRO0_USFGRO0_VSn1_VWA4_VWB4_WSGRA0_WSGRB0_WS64_WG64_4_1_WGM6_WGMXCC1_WGMXCCGn1
    SolutionIndex: 4
    SolutionNameMin: Cijk_Alik_Bjlk_I8II_BH_UserArgs_MT128x256x64_MI16x16x1_SN_LDSB1_AFC0_AFEM1_AFEM1_ASEM1_CLR0_CADS0_DTVA0_DTVB0_EPS0_FDSI0_GRPM1_GRVWA16_GRVWB8_GSU0_GSUAMB_GSUC0_GSUWGMRR0_GLS0_ISA950_IU1_K1_LBSPPA256_LBSPPB4096_LBSPPM0_LPA32_LPB0_LPM0_LRVW16_LWPMn1_MIAV0_MIWT4_8_MO40_NTn1_NTA0_NTB0_NTC0_NTD0_NTM0_NEPBS0_NLCA1_NLCB1_ONLL1_PGR2_PLR0_PKA1_SIA3_SS1_SU0_SUM1_SUS64_SPO0_SRVW0_SSO0_SVW4_SK3_SKXCCM8_TLDS1_ULSGRO0_USL1_UIOFGRO0_USFGRO0_VSn1_VWA4_VWB8_WSGRA0_WSGRB0_WS64_WG32_8_1_WGM6_WGMXCC1_WGMXCCGn1
    SolutionIndex: 5
    SolutionNameMin: Cijk_Alik_Bjlk_I8II_BH_UserArgs_MT256x128x64_MI16x16x1_SN_LDSB1_AFC0_AFEM1_AFEM1_ASEM1_CLR0_CADS0_DTVA0_DTVB0_EPS0_FDSI0_GRPM1_GRVWA16_GRVWB4_GSU0_GSUAMB_GSUC0_GSUWGMRR0_GLS0_ISA950_IU1_K1_LBSPPA256_LBSPPB2048_LBSPPM0_LPA32_LPB64_LPM0_LRVW16_LWPMn1_MIAV0_MIWT8_4_MO40_NTn1_NTA0_NTB0_NTC0_NTD0_NTM0_NEPBS0_NLCA1_NLCB1_ONLL1_PGR2_PLR0_PKA1_SIA3_SS1_SU0_SUM1_SUS64_SPO0_SRVW0_SSO0_SVW4_SK3_SKXCCM8_TLDS1_ULSGRO0_USL1_UIOFGRO0_USFGRO0_VSn1_VWA4_VWB4_WSGRA0_WSGRB0_WS64_WG32_8_1_WGM6_WGMXCC1_WGMXCCGn1
    SolutionIndex: 6
    SolutionNameMin: Cijk_Alik_Bjlk_I8II_BH_UserArgs_MT256x128x64_MI16x16x1_SN_LDSB1_AFC0_AFEM1_AFEM1_ASEM1_CLR0_CADS0_DTVA0_DTVB0_EPS0_FDSI0_GRPM1_GRVWA16_GRVWB16_GSU0_GSUAMB_GSUC0_GSUWGMRR0_GLS0_ISA950_IU1_K1_LBSPPA256_LBSPPB2048_LBSPPM0_LPA32_LPB64_LPM0_LRVW16_LWPMn1_MIAV0_MIWT8_4_MO40_NTn1_NTA0_NTB0_NTC0_NTD0_NTM0_NEPBS0_NLCA1_NLCB1_ONLL1_PGR2_PLR0_PKA1_SIA3_SS1_SU0_SUM1_SUS64_SPO0_SRVW0_SSO0_SVW4_SK3_SKXCCM8_TLDS1_ULSGRO0_USL1_UIOFGRO0_USFGRO0_VSn1_VWA4_VWB4_WSGRA0_WSGRB0_WS64_WG32_8_1_WGM6_WGMXCC1_WGMXCCGn1
    SolutionIndex: 7
    SolutionNameMin: Cijk_Alik_Bjlk_I8II_BH_UserArgs_MT256x64x64_MI16x16x1_SN_LDSB1_AFC0_AFEM1_AFEM1_ASEM1_CLR0_CADS0_DTVA0_DTVB0_EPS0_FDSI0_GRPM1_GRVWA16_GRVWB4_GSU0_GSUAMB_GSUC0_GSUWGMRR0_GLS0_ISA950_IU1_K1_LBSPPA256_LBSPPB1024_LBSPPM0_LPA32_LPB32_LPM0_LRVW16_LWPMn1_MIAV0_MIWT8_2_MO40_NTn1_NTA0_NTB0_NTC0_NTD0_NTM0_NEPBS0_NLCA1_NLCB1_ONLL1_PGR2_PLR0_PKA1_SIA3_SS1_SU0_SUM1_SUS64_SPO0_SRVW0_SSO0_SVW4_SK3_SKXCCM8_TLDS1_ULSGRO0_USL1_UIOFGRO0_USFGRO0_VSn1_VWA4_VWB2_WSGRA0_WSGRB0_WS64_WG32_8_1_WGM6_WGMXCC1_WGMXCCGn1
    SolutionIndex: 8
    SolutionNameMin: Cijk_Alik_Bjlk_I8II_BH_UserArgs_MT256x64x64_MI16x16x1_SN_LDSB1_AFC0_AFEM1_AFEM1_ASEM1_CLR0_CADS0_DTVA0_DTVB0_EPS0_FDSI0_GRPM1_GRVWA16_GRVWB8_GSU0_GSUAMB_GSUC0_GSUWGMRR0_GLS0_ISA950_IU1_K1_LBSPPA256_LBSPPB1024_LBSPPM0_LPA32_LPB32_LPM0_LRVW16_LWPMn1_MIAV0_MIWT8_2_MO40_NTn1_NTA0_NTB0_NTC0_NTD0_NTM0_NEPBS0_NLCA1_NLCB1_ONLL1_PGR2_PLR0_PKA1_SIA3_SS1_SU0_SUM1_SUS64_SPO0_SRVW0_SSO0_SVW4_SK3_SKXCCM8_TLDS1_ULSGRO0_USL1_UIOFGRO0_USFGRO0_VSn1_VWA4_VWB2_WSGRA0_WSGRB0_WS64_WG32_8_1_WGM6_WGMXCC1_WGMXCCGn1
    SolutionIndex: 9
    SolutionNameMin: Cijk_Alik_Bjlk_I8II_BH_UserArgs_MT128x128x64_MI16x16x1_SN_LDSB1_AFC0_AFEM1_AFEM1_ASEM1_CLR0_CADS0_DTVA0_DTVB0_EPS0_FDSI0_GRPM1_GRVWA16_GRVWB4_GSU0_GSUAMB_GSUC0_GSUWGMRR0_GLS0_ISA950_IU1_K1_LBSPPA256_LBSPPB2048_LBSPPM0_LPA32_LPB64_LPM0_LRVW16_LWPMn1_MIAV0_MIWT4_4_MO40_NTn1_NTA0_NTB0_NTC0_NTD0_NTM0_NEPBS0_NLCA1_NLCB1_ONLL1_PGR2_PLR0_PKA1_SIA3_SS1_SU0_SUM1_SUS64_SPO0_SRVW0_SSO0_SVW4_SK3_SKXCCM8_TLDS1_ULSGRO0_USL1_UIOFGRO0_USFGRO0_VSn1_VWA4_VWB4_WSGRA0_WSGRB0_WS64_WG32_8_1_WGM6_WGMXCC1_WGMXCCGn1
    SolutionIndex: 10
    SolutionNameMin: Cijk_Alik_Bjlk_I8II_BH_UserArgs_MT128x128x64_MI16x16x1_SN_LDSB1_AFC0_AFEM1_AFEM1_ASEM1_CLR0_CADS0_DTVA0_DTVB0_EPS0_FDSI0_GRPM1_GRVWA16_GRVWB16_GSU0_GSUAMB_GSUC0_GSUWGMRR0_GLS0_ISA950_IU1_K1_LBSPPA256_LBSPPB2048_LBSPPM0_LPA32_LPB64_LPM0_LRVW16_LWPMn1_MIAV0_MIWT4_4_MO40_NTn1_NTA0_NTB0_NTC0_NTD0_NTM0_NEPBS0_NLCA1_NLCB1_ONLL1_PGR2_PLR0_PKA1_SIA3_SS1_SU0_SUM1_SUS64_SPO0_SRVW0_SSO0_SVW4_SK3_SKXCCM8_TLDS1_ULSGRO0_USL1_UIOFGRO0_USFGRO0_VSn1_VWA4_VWB4_WSGRA0_WSGRB0_WS64_WG32_8_1_WGM6_WGMXCC1_WGMXCCGn1
    SolutionIndex: 11
    SolutionNameMin: Cijk_Alik_Bjlk_I8II_BH_UserArgs_MT512x128x64_MI32x32x1_SN_LDSB0_AFC0_AFEM1_AFEM1_ASEM1_CLR1_CADS0_DTVA0_DTVB0_EPS0_FDSI0_GRPM1_GRVWA16_GRVWB8_GSU0_GSUAMB_GSUC0_GSUWGMRR0_GLS0_ISA950_IU1_K1_LBSPPA256_LBSPPB0_LBSPPM0_LPA16_LPB0_LPM0_LRVW16_LWPMn1_MIAV0_MIWT8_2_MO40_NTn1_NTA0_NTB0_NTC0_NTD0_NTM0_NEPBS0_NLCA1_NLCB1_ONLL1_PGR2_PLR1_PKA1_SIA3_SS1_SU0_SUM1_SUS64_SPO0_SRVW0_SSO0_SVW4_SK3_SKXCCM8_TLDS1_ULSGRO0_USL1_UIOFGRO0_USFGRO0_VSn1_VWA4_VWB2_WSGRA0_WSGRB0_WS64_WG64_4_1_WGM6_WGMXCC1_WGMXCCGn1
    SolutionIndex: 12
    SolutionNameMin: Cijk_Alik_Bjlk_I8II_BH_UserArgs_MT256x256x64_MI32x32x1_SN_LDSB0_AFC0_AFEM1_AFEM1_ASEM1_CLR1_CADS0_DTVA0_DTVB0_EPS0_FDSI0_GRPM1_GRVWA16_GRVWB4_GSU0_GSUAMB_GSUC0_GSUWGMRR0_GLS0_ISA950_IU1_K1_LBSPPA256_LBSPPB0_LBSPPM0_LPA16_LPB0_LPM0_LRVW16_LWPMn1_MIAV0_MIWT4_4_MO40_NTn1_NTA0_NTB0_NTC0_NTD0_NTM0_NEPBS0_NLCA1_NLCB1_ONLL1_PGR2_PLR1_PKA1_SIA3_SS1_SU0_SUM1_SUS64_SPO0_SRVW0_SSO0_SVW4_SK3_SKXCCM8_TLDS1_ULSGRO0_USL1_UIOFGRO0_USFGRO0_VSn1_VWA4_VWB2_WSGRA0_WSGRB0_WS64_WG64_4_1_WGM6_WGMXCC1_WGMXCCGn1
    SolutionIndex: 13
    SolutionNameMin: Cijk_Alik_Bjlk_I8II_BH_UserArgs_MT256x256x64_MI32x32x1_SN_LDSB0_AFC0_AFEM1_AFEM1_ASEM1_CLR1_CADS0_DTVA0_DTVB0_EPS0_FDSI0_GRPM1_GRVWA16_GRVWB4_GSU0_GSUAMB_GSUC0_GSUWGMRR0_GLS0_ISA950_IU1_K1_LBSPPA256_LBSPPB0_LBSPPM0_LPA16_LPB0_LPM0_LRVW16_LWPMn1_MIAV0_MIWT4_4_MO40_NTn1_NTA0_NTB0_NTC0_NTD0_NTM0_NEPBS0_NLCA1_NLCB1_ONLL1_PGR2_PLR1_PKA1_SIA3_SS1_SU0_SUM1_SUS64_SPO0_SRVW0_SSO0_SVW4_SK3_SKXCCM8_TLDS1_ULSGRO0_USL1_UIOFGRO0_USFGRO0_VSn1_VWA4_VWB4_WSGRA0_WSGRB0_WS64_WG64_4_1_WGM6_WGMXCC1_WGMXCCGn1
    SolutionIndex: 14
    SolutionNameMin: Cijk_Alik_Bjlk_I8II_BH_UserArgs_MT256x256x64_MI32x32x1_SN_LDSB0_AFC0_AFEM1_AFEM1_ASEM1_CLR1_CADS0_DTVA0_DTVB0_EPS0_FDSI0_GRPM1_GRVWA4_GRVWB8_GSU0_GSUAMB_GSUC0_GSUWGMRR0_GLS0_ISA950_IU1_K1_LBSPPA256_LBSPPB0_LBSPPM0_LPA16_LPB0_LPM0_LRVW16_LWPMn1_MIAV0_MIWT4_4_MO40_NTn1_NTA0_NTB0_NTC0_NTD0_NTM0_NEPBS0_NLCA1_NLCB1_ONLL1_PGR2_PLR1_PKA1_SIA3_SS1_SU0_SUM1_SUS64_SPO0_SRVW0_SSO0_SVW4_SK3_SKXCCM8_TLDS1_ULSGRO0_USL1_UIOFGRO0_USFGRO0_VSn1_VWA4_VWB4_WSGRA0_WSGRB0_WS64_WG64_4_1_WGM6_WGMXCC1_WGMXCCGn1
    SolutionIndex: 15
    SolutionNameMin: Cijk_Alik_Bjlk_I8II_BH_UserArgs_MT256x256x64_MI32x32x1_SN_LDSB0_AFC0_AFEM1_AFEM1_ASEM1_CLR1_CADS0_DTVA0_DTVB0_EPS0_FDSI0_GRPM1_GRVWA16_GRVWB8_GSU0_GSUAMB_GSUC0_GSUWGMRR0_GLS0_ISA950_IU1_K1_LBSPPA256_LBSPPB0_LBSPPM0_LPA16_LPB0_LPM0_LRVW16_LWPMn1_MIAV0_MIWT4_4_MO40_NTn1_NTA0_NTB0_NTC0_NTD0_NTM0_NEPBS0_NLCA1_NLCB1_ONLL1_PGR2_PLR1_PKA1_SIA3_SS1_SU0_SUM1_SUS64_SPO0_SRVW0_SSO0_SVW4_SK3_SKXCCM8_TLDS1_ULSGRO0_USL1_UIOFGRO0_USFGRO0_VSn1_VWA4_VWB2_WSGRA0_WSGRB0_WS64_WG64_4_1_WGM6_WGMXCC1_WGMXCCGn1
    SolutionIndex: 16
    SolutionNameMin: Cijk_Alik_Bjlk_I8II_BH_UserArgs_MT256x256x64_MI32x32x1_SN_LDSB0_AFC0_AFEM1_AFEM1_ASEM1_CLR1_CADS0_DTVA0_DTVB0_EPS0_FDSI0_GRPM1_GRVWA16_GRVWB8_GSU0_GSUAMB_GSUC0_GSUWGMRR0_GLS0_ISA950_IU1_K1_LBSPPA256_LBSPPB0_LBSPPM0_LPA16_LPB0_LPM0_LRVW16_LWPMn1_MIAV0_MIWT4_4_MO40_NTn1_NTA0_NTB0_NTC0_NTD0_NTM0_NEPBS0_NLCA1_NLCB1_ONLL1_PGR2_PLR1_PKA1_SIA3_SS1_SU0_SUM1_SUS64_SPO0_SRVW0_SSO0_SVW4_SK3_SKXCCM8_TLDS1_ULSGRO0_USL1_UIOFGRO0_USFGRO0_VSn1_VWA4_VWB4_WSGRA0_WSGRB0_WS64_WG64_4_1_WGM6_WGMXCC1_WGMXCCGn1
    SolutionIndex: 17
    SolutionNameMin: Cijk_Alik_Bjlk_I8II_BH_UserArgs_MT256x128x64_MI32x32x1_SN_LDSB1_AFC0_AFEM1_AFEM1_ASEM1_CLR1_CADS0_DTVA0_DTVB0_EPS0_FDSI0_GRPM1_GRVWA16_GRVWB4_GSU0_GSUAMB_GSUC0_GSUWGMRR0_GLS0_ISA950_IU1_K1_LBSPPA256_LBSPPB0_LBSPPM0_LPA16_LPB0_LPM0_LRVW16_LWPMn1_MIAV0_MIWT4_2_MO40_NTn1_NTA0_NTB0_NTC0_NTD0_NTM0_NEPBS0_NLCA1_NLCB1_ONLL1_PGR2_PLR1_PKA1_SIA3_SS1_SU0_SUM1_SUS64_SPO0_SRVW0_SSO0_SVW4_SK3_SKXCCM8_TLDS1_ULSGRO0_USL1_UIOFGRO0_USFGRO0_VSn1_VWA4_VWB2_WSGRA0_WSGRB0_WS64_WG64_4_1_WGM6_WGMXCC1_WGMXCCGn1
    SolutionIndex: 18
    SolutionNameMin: Cijk_Alik_Bjlk_I8II_BH_UserArgs_MT256x128x64_MI32x32x1_SN_LDSB1_AFC0_AFEM1_AFEM1_ASEM1_CLR1_CADS0_DTVA0_DTVB0_EPS0_FDSI0_GRPM1_GRVWA16_GRVWB8_GSU0_GSUAMB_GSUC0_GSUWGMRR0_GLS0_ISA950_IU1_K1_LBSPPA256_LBSPPB0_LBSPPM0_LPA16_LPB0_LPM0_LRVW16_LWPMn1_MIAV0_MIWT4_2_MO40_NTn1_NTA0_NTB0_NTC0_NTD0_NTM0_NEPBS0_NLCA1_NLCB1_ONLL1_PGR2_PLR1_PKA1_SIA3_SS1_SU0_SUM1_SUS64_SPO0_SRVW0_SSO0_SVW4_SK3_SKXCCM8_TLDS1_ULSGRO0_USL1_UIOFGRO0_USFGRO0_VSn1_VWA4_VWB2_WSGRA0_WSGRB0_WS64_WG64_4_1_WGM6_WGMXCC1_WGMXCCGn1
    SolutionIndex: 19
    SolutionNameMin: Cijk_Alik_Bjlk_I8II_BH_UserArgs_MT256x256x128_MI16x16x1_SN_LDSB1_AFC0_AFEM1_AFEM1_ASEM1_CLR1_CADS0_DTVA0_DTVB0_EPS0_FDSI0_GRPM1_GRVWA16_GRVWB16_GSU0_GSUAMB_GSUC0_GSUWGMRR0_GLS0_ISA950_IU1_K1_LBSPPA512_LBSPPB4096_LBSPPM0_LPA32_LPB64_LPM0_LRVW16_LWPMn1_MIAV0_MIWT8_8_MO40_NTn1_NTA0_NTB0_NTC0_NTD0_NTM0_NEPBS0_NLCA1_NLCB1_ONLL1_PGR2_PLR1_PKA1_SIA3_SS1_SU0_SUM1_SUS128_SPO0_SRVW0_SSO0_SVW4_SK3_SKXCCM8_TLDS1_ULSGRO0_USL1_UIOFGRO0_USFGRO0_VSn1_VWA4_VWB4_WSGRA0_WSGRB0_WS64_WG32_8_1_WGM6_WGMXCC1_WGMXCCGn1
    SolutionIndex: 20
    SolutionNameMin: Cijk_Alik_Bjlk_I8II_BH_UserArgs_MT256x256x128_MI16x16x1_SN_LDSB1_AFC0_AFEM1_AFEM1_ASEM1_CLR1_CADS0_DTVA0_DTVB0_EPS0_FDSI0_GRPM1_GRVWA16_GRVWB16_GSU0_GSUAMB_GSUC0_GSUWGMRR0_GLS0_ISA950_IU1_K1_LBSPPA256_LBSPPB4096_LBSPPM0_LPA32_LPB0_LPM0_LRVW16_LWPMn1_MIAV0_MIWT8_8_MO40_NTn1_NTA0_NTB0_NTC0_NTD0_NTM0_NEPBS0_NLCA1_NLCB1_ONLL1_PGR2_PLR1_PKA1_SIA3_SS1_SU0_SUM1_SUS128_SPO0_SRVW0_SSO0_SVW2_SK3_SKXCCM8_TLDS1_ULSGRO0_USL1_UIOFGRO0_USFGRO0_VSn1_VWA2_VWB8_WSGRA0_WSGRB0_WS64_WG32_8_1_WGM6_WGMXCC1_WGMXCCGn1
    SolutionIndex: 21
    SolutionNameMin: Cijk_Alik_Bjlk_I8II_BH_UserArgs_MT256x256x128_MI16x16x1_SN_LDSB1_AFC0_AFEM1_AFEM1_ASEM1_CLR1_CADS0_DTVA0_DTVB0_EPS0_FDSI0_GRPM1_GRVWA16_GRVWB16_GSU0_GSUAMB_GSUC0_GSUWGMRR0_GLS0_ISA950_IU1_K1_LBSPPA512_LBSPPB4096_LBSPPM0_LPA32_LPB0_LPM0_LRVW16_LWPMn1_MIAV0_MIWT8_8_MO40_NTn1_NTA0_NTB0_NTC0_NTD0_NTM0_NEPBS0_NLCA1_NLCB1_ONLL1_PGR2_PLR1_PKA1_SIA3_SS1_SU0_SUM1_SUS128_SPO0_SRVW0_SSO0_SVW4_SK3_SKXCCM8_TLDS1_ULSGRO0_USL1_UIOFGRO0_USFGRO0_VSn1_VWA4_VWB8_WSGRA0_WSGRB0_WS64_WG32_8_1_WGM6_WGMXCC1_WGMXCCGn1
    SolutionIndex: 22
    SolutionNameMin: Cijk_Alik_Bjlk_I8II_BH_UserArgs_MT256x256x128_MI16x16x1_SN_LDSB1_AFC0_AFEM1_AFEM1_ASEM1_CLR1_CADS0_DTVA0_DTVB0_EPS0_FDSI0_GRPM1_GRVWA16_GRVWB16_GSU0_GSUAMB_GSUC0_GSUWGMRR0_GLS0_ISA950_IU1_K1_LBSPPA1024_LBSPPB4096_LBSPPM0_LPA32_LPB0_LPM0_LRVW16_LWPMn1_MIAV0_MIWT8_8_MO40_NTn1_NTA0_NTB0_NTC0_NTD0_NTM0_NEPBS0_NLCA1_NLCB1_ONLL1_PGR2_PLR1_PKA1_SIA3_SS1_SU0_SUM1_SUS128_SPO0_SRVW0_SSO0_SVW8_SK3_SKXCCM8_TLDS1_ULSGRO0_USL1_UIOFGRO0_USFGRO0_VSn1_VWA8_VWB8_WSGRA0_WSGRB0_WS64_WG32_8_1_WGM6_WGMXCC1_WGMXCCGn1
    SolutionIndex: 23
    SolutionNameMin: Cijk_Alik_Bjlk_I8II_BH_UserArgs_MT256x128x128_MI16x16x1_SN_LDSB1_AFC0_AFEM1_AFEM1_ASEM1_CLR1_CADS0_DTVA0_DTVB0_EPS0_FDSI0_GRPM1_GRVWA4_GRVWB16_GSU0_GSUAMB_GSUC0_GSUWGMRR0_GLS0_ISA950_IU1_K1_LBSPPA512_LBSPPB2048_LBSPPM0_LPA32_LPB64_LPM0_LRVW16_LWPMn1_MIAV0_MIWT8_4_MO40_NTn1_NTA0_NTB0_NTC0_NTD0_NTM0_NEPBS0_NLCA1_NLCB1_ONLL1_PGR2_PLR1_PKA1_SIA3_SS1_SU0_SUM1_SUS128_SPO0_SRVW0_SSO0_SVW4_SK3_SKXCCM8_TLDS1_ULSGRO0_USL1_UIOFGRO0_USFGRO0_VSn1_VWA4_VWB4_WSGRA0_WSGRB0_WS64_WG32_8_1_WGM6_WGMXCC1_WGMXCCGn1
    SolutionIndex: 24
    SolutionNameMin: Cijk_Alik_Bjlk_I8II_BH_UserArgs_MT256x128x128_MI16x16x1_SN_LDSB1_AFC0_AFEM1_AFEM1_ASEM1_CLR1_CADS0_DTVA0_DTVB0_EPS0_FDSI0_GRPM1_GRVWA16_GRVWB16_GSU0_GSUAMB_GSUC0_GSUWGMRR0_GLS0_ISA950_IU1_K1_LBSPPA256_LBSPPB2048_LBSPPM0_LPA32_LPB32_LPM0_LRVW16_LWPMn1_MIAV0_MIWT8_4_MO40_NTn1_NTA0_NTB0_NTC0_NTD0_NTM0_NEPBS0_NLCA1_NLCB1_ONLL1_PGR2_PLR1_PKA1_SIA3_SS1_SU0_SUM1_SUS128_SPO0_SRVW0_SSO0_SVW2_SK3_SKXCCM8_TLDS1_ULSGRO0_USL1_UIOFGRO0_USFGRO0_VSn1_VWA2_VWB2_WSGRA0_WSGRB0_WS64_WG32_8_1_WGM6_WGMXCC1_WGMXCCGn1
    SolutionIndex: 25
    SolutionNameMin: Cijk_Alik_Bjlk_I8II_BH_UserArgs_MT256x128x128_MI16x16x1_SN_LDSB1_AFC0_AFEM1_AFEM1_ASEM1_CLR1_CADS0_DTVA0_DTVB0_EPS0_FDSI0_GRPM1_GRVWA16_GRVWB16_GSU0_GSUAMB_GSUC0_GSUWGMRR0_GLS0_ISA950_IU1_K1_LBSPPA512_LBSPPB2048_LBSPPM0_LPA32_LPB32_LPM0_LRVW16_LWPMn1_MIAV0_MIWT8_4_MO40_NTn1_NTA0_NTB0_NTC0_NTD0_NTM0_NEPBS0_NLCA1_NLCB1_ONLL1_PGR2_PLR1_PKA1_SIA3_SS1_SU0_SUM1_SUS128_SPO0_SRVW0_SSO0_SVW4_SK3_SKXCCM8_TLDS1_ULSGRO0_USL1_UIOFGRO0_USFGRO0_VSn1_VWA4_VWB2_WSGRA0_WSGRB0_WS64_WG32_8_1_WGM6_WGMXCC1_WGMXCCGn1
    SolutionIndex: 26
    SolutionNameMin: Cijk_Alik_Bjlk_I8II_BH_UserArgs_MT256x128x128_MI16x16x1_SN_LDSB1_AFC0_AFEM1_AFEM1_ASEM1_CLR1_CADS0_DTVA0_DTVB0_EPS0_FDSI0_GRPM1_GRVWA16_GRVWB16_GSU0_GSUAMB_GSUC0_GSUWGMRR0_GLS0_ISA950_IU1_K1_LBSPPA256_LBSPPB2048_LBSPPM0_LPA32_LPB64_LPM0_LRVW16_LWPMn1_MIAV0_MIWT8_4_MO40_NTn1_NTA0_NTB0_NTC0_NTD0_NTM0_NEPBS0_NLCA1_NLCB1_ONLL1_PGR2_PLR1_PKA1_SIA3_SS1_SU0_SUM1_SUS128_SPO0_SRVW0_SSO0_SVW2_SK3_SKXCCM8_TLDS1_ULSGRO0_USL1_UIOFGRO0_USFGRO0_VSn1_VWA2_VWB4_WSGRA0_WSGRB0_WS64_WG32_8_1_WGM6_WGMXCC1_WGMXCCGn1
    SolutionIndex: 27
    SolutionNameMin: Cijk_Alik_Bjlk_I8II_BH_UserArgs_MT256x128x128_MI16x16x1_SN_LDSB1_AFC0_AFEM1_AFEM1_ASEM1_CLR1_CADS0_DTVA0_DTVB0_EPS0_FDSI0_GRPM1_GRVWA16_GRVWB16_GSU0_GSUAMB_GSUC0_GSUWGMRR0_GLS0_ISA950_IU1_K1_LBSPPA512_LBSPPB2048_LBSPPM0_LPA32_LPB64_LPM0_LRVW16_LWPMn1_MIAV0_MIWT8_4_MO40_NTn1_NTA0_NTB0_NTC0_NTD0_NTM0_NEPBS0_NLCA1_NLCB1_ONLL1_PGR2_PLR1_PKA1_SIA3_SS1_SU0_SUM1_SUS128_SPO0_SRVW0_SSO0_SVW4_SK3_SKXCCM8_TLDS1_ULSGRO0_USL1_UIOFGRO0_USFGRO0_VSn1_VWA4_VWB4_WSGRA0_WSGRB0_WS64_WG32_8_1_WGM6_WGMXCC1_WGMXCCGn1
    SolutionIndex: 28
    SolutionNameMin: Cijk_Alik_Bjlk_I8II_BH_UserArgs_MT256x64x128_MI16x16x1_SN_LDSB1_AFC0_AFEM1_AFEM1_ASEM1_CLR1_CADS0_DTVA0_DTVB0_EPS0_FDSI0_GRPM1_GRVWA16_GRVWB8_GSU0_GSUAMB_GSUC0_GSUWGMRR0_GLS0_ISA950_IU1_K1_LBSPPA256_LBSPPB1024_LBSPPM0_LPA32_LPB32_LPM0_LRVW16_LWPMn1_MIAV0_MIWT8_2_MO40_NTn1_NTA0_NTB0_NTC0_NTD0_NTM0_NEPBS0_NLCA1_NLCB1_ONLL1_PGR2_PLR1_PKA1_SIA3_SS1_SU0_SUM1_SUS128_SPO0_SRVW0_SSO0_SVW2_SK3_SKXCCM8_TLDS1_ULSGRO0_USL1_UIOFGRO0_USFGRO0_VSn1_VWA2_VWB2_WSGRA0_WSGRB0_WS64_WG32_8_1_WGM6_WGMXCC1_WGMXCCGn1
    SolutionIndex: 29
    SolutionNameMin: Cijk_Alik_Bjlk_I8II_BH_UserArgs_MT256x64x128_MI16x16x1_SN_LDSB1_AFC0_AFEM1_AFEM1_ASEM1_CLR1_CADS0_DTVA0_DTVB0_EPS0_FDSI0_GRPM1_GRVWA16_GRVWB16_GSU0_GSUAMB_GSUC0_GSUWGMRR0_GLS0_ISA950_IU1_K1_LBSPPA256_LBSPPB1024_LBSPPM0_LPA32_LPB32_LPM0_LRVW16_LWPMn1_MIAV0_MIWT8_2_MO40_NTn1_NTA0_NTB0_NTC0_NTD0_NTM0_NEPBS0_NLCA1_NLCB1_ONLL1_PGR2_PLR1_PKA1_SIA3_SS1_SU0_SUM1_SUS128_SPO0_SRVW0_SSO0_SVW2_SK3_SKXCCM8_TLDS1_ULSGRO0_USL1_UIOFGRO0_USFGRO0_VSn1_VWA2_VWB2_WSGRA0_WSGRB0_WS64_WG32_8_1_WGM6_WGMXCC1_WGMXCCGn1
    SolutionIndex: 30
    SolutionNameMin: Cijk_Alik_Bjlk_I8II_BH_UserArgs_MT256x64x128_MI16x16x1_SN_LDSB1_AFC0_AFEM1_AFEM1_ASEM1_CLR1_CADS0_DTVA0_DTVB0_EPS0_FDSI0_GRPM1_GRVWA16_GRVWB16_GSU0_GSUAMB_GSUC0_GSUWGMRR0_GLS0_ISA950_IU1_K1_LBSPPA512_LBSPPB1024_LBSPPM0_LPA32_LPB32_LPM0_LRVW16_LWPMn1_MIAV0_MIWT8_2_MO40_NTn1_NTA0_NTB0_NTC0_NTD0_NTM0_NEPBS0_NLCA1_NLCB1_ONLL1_PGR2_PLR1_PKA1_SIA3_SS1_SU0_SUM1_SUS128_SPO0_SRVW0_SSO0_SVW4_SK3_SKXCCM8_TLDS1_ULSGRO0_USL1_UIOFGRO0_USFGRO0_VSn1_VWA4_VWB2_WSGRA0_WSGRB0_WS64_WG32_8_1_WGM6_WGMXCC1_WGMXCCGn1
    SolutionIndex: 31
    SolutionNameMin: Cijk_Alik_Bjlk_I8II_BH_UserArgs_MT128x128x128_MI16x16x1_SN_LDSB1_AFC0_AFEM1_AFEM1_ASEM1_CLR1_CADS0_DTVA0_DTVB0_EPS0_FDSI0_GRPM1_GRVWA16_GRVWB4_GSU0_GSUAMB_GSUC0_GSUWGMRR0_GLS0_ISA950_IU1_K1_LBSPPA256_LBSPPB2048_LBSPPM0_LPA32_LPB32_LPM0_LRVW16_LWPMn1_MIAV0_MIWT4_4_MO40_NTn1_NTA0_NTB0_NTC0_NTD0_NTM0_NEPBS0_NLCA1_NLCB1_ONLL1_PGR2_PLR1_PKA1_SIA3_SS1_SU0_SUM1_SUS128_SPO0_SRVW0_SSO0_SVW2_SK3_SKXCCM8_TLDS1_ULSGRO0_USL1_UIOFGRO0_USFGRO0_VSn1_VWA2_VWB2_WSGRA0_WSGRB0_WS64_WG32_8_1_WGM6_WGMXCC1_WGMXCCGn1
    SolutionIndex: 32
    SolutionNameMin: Cijk_Alik_Bjlk_I8II_BH_UserArgs_MT128x128x128_MI16x16x1_SN_LDSB1_AFC0_AFEM1_AFEM1_ASEM1_CLR1_CADS0_DTVA0_DTVB0_EPS0_FDSI0_GRPM1_GRVWA16_GRVWB16_GSU0_GSUAMB_GSUC0_GSUWGMRR0_GLS0_ISA950_IU1_K1_LBSPPA256_LBSPPB2048_LBSPPM0_LPA32_LPB32_LPM0_LRVW16_LWPMn1_MIAV0_MIWT4_4_MO40_NTn1_NTA0_NTB0_NTC0_NTD0_NTM0_NEPBS0_NLCA1_NLCB1_ONLL1_PGR2_PLR1_PKA1_SIA3_SS1_SU0_SUM1_SUS128_SPO0_SRVW0_SSO0_SVW2_SK3_SKXCCM8_TLDS1_ULSGRO0_USL1_UIOFGRO0_USFGRO0_VSn1_VWA2_VWB2_WSGRA0_WSGRB0_WS64_WG32_8_1_WGM6_WGMXCC1_WGMXCCGn1
    SolutionIndex: 33
    SolutionNameMin: Cijk_Alik_Bjlk_I8II_BH_UserArgs_MT128x128x128_MI16x16x1_SN_LDSB1_AFC0_AFEM1_AFEM1_ASEM1_CLR1_CADS0_DTVA0_DTVB0_EPS0_FDSI0_GRPM1_GRVWA16_GRVWB16_GSU0_GSUAMB_GSUC0_GSUWGMRR0_GLS0_ISA950_IU1_K1_LBSPPA256_LBSPPB2048_LBSPPM0_LPA32_LPB64_LPM0_LRVW16_LWPMn1_MIAV0_MIWT4_4_MO40_NTn1_NTA0_NTB0_NTC0_NTD0_NTM0_NEPBS0_NLCA1_NLCB1_ONLL1_PGR2_PLR1_PKA1_SIA3_SS1_SU0_SUM1_SUS128_SPO0_SRVW0_SSO0_SVW2_SK3_SKXCCM8_TLDS1_ULSGRO0_USL1_UIOFGRO0_USFGRO0_VSn1_VWA2_VWB4_WSGRA0_WSGRB0_WS64_WG32_8_1_WGM6_WGMXCC1_WGMXCCGn1
    SolutionIndex: 34
    SolutionNameMin: Cijk_Alik_Bjlk_I8II_BH_UserArgs_MT128x128x128_MI16x16x1_SN_LDSB1_AFC0_AFEM1_AFEM1_ASEM1_CLR1_CADS0_DTVA0_DTVB0_EPS0_FDSI0_GRPM1_GRVWA16_GRVWB16_GSU0_GSUAMB_GSUC0_GSUWGMRR0_GLS0_ISA950_IU1_K1_LBSPPA512_LBSPPB2048_LBSPPM0_LPA32_LPB64_LPM0_LRVW16_LWPMn1_MIAV0_MIWT4_4_MO40_NTn1_NTA0_NTB0_NTC0_NTD0_NTM0_NEPBS0_NLCA1_NLCB1_ONLL1_PGR2_PLR1_PKA1_SIA3_SS1_SU0_SUM1_SUS128_SPO0_SRVW0_SSO0_SVW4_SK3_SKXCCM8_TLDS1_ULSGRO0_USL1_UIOFGRO0_USFGRO0_VSn1_VWA4_VWB4_WSGRA0_WSGRB0_WS64_WG32_8_1_WGM6_WGMXCC1_WGMXCCGn1
    SolutionIndex: 35
    SolutionNameMin: Cijk_Alik_Bjlk_I8II_BH_UserArgs_MT64x128x128_MI16x16x1_SN_LDSB1_AFC0_AFEM1_AFEM1_ASEM1_CLR1_CADS0_DTVA0_DTVB0_EPS0_FDSI0_GRPM1_GRVWA16_GRVWB4_GSU0_GSUAMB_GSUC0_GSUWGMRR0_GLS0_ISA950_IU1_K1_LBSPPA256_LBSPPB2048_LBSPPM0_LPA32_LPB64_LPM0_LRVW16_LWPMn1_MIAV0_MIWT2_4_MO40_NTn1_NTA0_NTB0_NTC0_NTD0_NTM0_NEPBS0_NLCA1_NLCB1_ONLL1_PGR2_PLR1_PKA1_SIA3_SS1_SU0_SUM1_SUS128_SPO0_SRVW0_SSO0_SVW2_SK3_SKXCCM8_TLDS1_ULSGRO0_USL1_UIOFGRO0_USFGRO0_VSn1_VWA2_VWB4_WSGRA0_WSGRB0_WS64_WG32_8_1_WGM6_WGMXCC1_WGMXCCGn1
    SolutionIndex: 36
    SolutionNameMin: Cijk_Alik_Bjlk_I8II_BH_UserArgs_MT64x128x128_MI16x16x1_SN_LDSB1_AFC0_AFEM1_AFEM1_ASEM1_CLR1_CADS0_DTVA0_DTVB0_EPS0_FDSI0_GRPM1_GRVWA16_GRVWB16_GSU0_GSUAMB_GSUC0_GSUWGMRR0_GLS0_ISA950_IU1_K1_LBSPPA256_LBSPPB2048_LBSPPM0_LPA32_LPB64_LPM0_LRVW16_LWPMn1_MIAV0_MIWT2_4_MO40_NTn1_NTA0_NTB0_NTC0_NTD0_NTM0_NEPBS0_NLCA1_NLCB1_ONLL1_PGR2_PLR1_PKA1_SIA3_SS1_SU0_SUM1_SUS128_SPO0_SRVW0_SSO0_SVW2_SK3_SKXCCM8_TLDS1_ULSGRO0_USL1_UIOFGRO0_USFGRO0_VSn1_VWA2_VWB4_WSGRA0_WSGRB0_WS64_WG32_8_1_WGM6_WGMXCC1_WGMXCCGn1
    SolutionIndex: 37
    SolutionNameMin: Cijk_Alik_Bjlk_I8II_BH_UserArgs_MT128x64x128_MI16x16x1_SN_LDSB1_AFC0_AFEM1_AFEM1_ASEM1_CLR1_CADS0_DTVA0_DTVB0_EPS0_FDSI0_GRPM1_GRVWA16_GRVWB4_GSU0_GSUAMB_GSUC0_GSUWGMRR0_GLS0_ISA950_IU1_K1_LBSPPA256_LBSPPB1024_LBSPPM0_LPA32_LPB32_LPM0_LRVW16_LWPMn1_MIAV0_MIWT4_2_MO40_NTn1_NTA0_NTB0_NTC0_NTD0_NTM0_NEPBS0_NLCA1_NLCB1_ONLL1_PGR2_PLR1_PKA1_SIA3_SS1_SU0_SUM1_SUS128_SPO0_SRVW0_SSO0_SVW2_SK3_SKXCCM8_TLDS1_ULSGRO0_USL1_UIOFGRO0_USFGRO0_VSn1_VWA2_VWB2_WSGRA0_WSGRB0_WS64_WG32_8_1_WGM6_WGMXCC1_WGMXCCGn1
    SolutionIndex: 38
    SolutionNameMin: Cijk_Alik_Bjlk_I8II_BH_UserArgs_MT128x64x128_MI16x16x1_SN_LDSB1_AFC0_AFEM1_AFEM1_ASEM1_CLR1_CADS0_DTVA0_DTVB0_EPS0_FDSI0_GRPM1_GRVWA16_GRVWB4_GSU0_GSUAMB_GSUC0_GSUWGMRR0_GLS0_ISA950_IU1_K1_LBSPPA512_LBSPPB1024_LBSPPM0_LPA32_LPB32_LPM0_LRVW16_LWPMn1_MIAV0_MIWT4_2_MO40_NTn1_NTA0_NTB0_NTC0_NTD0_NTM0_NEPBS0_NLCA1_NLCB1_ONLL1_PGR2_PLR1_PKA1_SIA3_SS1_SU0_SUM1_SUS128_SPO0_SRVW0_SSO0_SVW4_SK3_SKXCCM8_TLDS1_ULSGRO0_USL1_UIOFGRO0_USFGRO0_VSn1_VWA4_VWB2_WSGRA0_WSGRB0_WS64_WG32_8_1_WGM6_WGMXCC1_WGMXCCGn1
    SolutionIndex: 39
    SolutionNameMin: Cijk_Alik_Bjlk_I8II_BH_UserArgs_MT128x64x128_MI16x16x1_SN_LDSB1_AFC0_AFEM1_AFEM1_ASEM1_CLR1_CADS0_DTVA0_DTVB0_EPS0_FDSI0_GRPM1_GRVWA16_GRVWB8_GSU0_GSUAMB_GSUC0_GSUWGMRR0_GLS0_ISA950_IU1_K1_LBSPPA512_LBSPPB1024_LBSPPM0_LPA32_LPB32_LPM0_LRVW16_LWPMn1_MIAV0_MIWT4_2_MO40_NTn1_NTA0_NTB0_NTC0_NTD0_NTM0_NEPBS0_NLCA1_NLCB1_ONLL1_PGR2_PLR1_PKA1_SIA3_SS1_SU0_SUM1_SUS128_SPO0_SRVW0_SSO0_SVW4_SK3_SKXCCM8_TLDS1_ULSGRO0_USL1_UIOFGRO0_USFGRO0_VSn1_VWA4_VWB2_WSGRA0_WSGRB0_WS64_WG32_8_1_WGM6_WGMXCC1_WGMXCCGn1
    SolutionIndex: 40
    SolutionNameMin: Cijk_Alik_Bjlk_I8II_BH_UserArgs_MT128x64x128_MI16x16x1_SN_LDSB1_AFC0_AFEM1_AFEM1_ASEM1_CLR1_CADS0_DTVA0_DTVB0_EPS0_FDSI0_GRPM1_GRVWA16_GRVWB16_GSU0_GSUAMB_GSUC0_GSUWGMRR0_GLS0_ISA950_IU1_K1_LBSPPA512_LBSPPB1024_LBSPPM0_LPA32_LPB32_LPM0_LRVW16_LWPMn1_MIAV0_MIWT4_2_MO40_NTn1_NTA0_NTB0_NTC0_NTD0_NTM0_NEPBS0_NLCA1_NLCB1_ONLL1_PGR2_PLR1_PKA1_SIA3_SS1_SU0_SUM1_SUS128_SPO0_SRVW0_SSO0_SVW4_SK3_SKXCCM8_TLDS1_ULSGRO0_USL1_UIOFGRO0_USFGRO0_VSn1_VWA4_VWB2_WSGRA0_WSGRB0_WS64_WG32_8_1_WGM6_WGMXCC1_WGMXCCGn1
    SolutionIndex: 41
    SolutionNameMin: Cijk_Alik_Bjlk_I8II_BH_UserArgs_MT64x64x128_MI16x16x1_SN_LDSB1_AFC0_AFEM1_AFEM1_ASEM1_CLR1_CADS0_DTVA0_DTVB0_EPS0_FDSI0_GRPM1_GRVWA4_GRVWB4_GSU0_GSUAMB_GSUC0_GSUWGMRR0_GLS0_ISA950_IU1_K1_LBSPPA256_LBSPPB1024_LBSPPM0_LPA32_LPB32_LPM0_LRVW16_LWPMn1_MIAV0_MIWT2_2_MO40_NTn1_NTA0_NTB0_NTC0_NTD0_NTM0_NEPBS0_NLCA1_NLCB1_ONLL1_PGR2_PLR1_PKA1_SIA3_SS1_SU0_SUM1_SUS128_SPO0_SRVW0_SSO0_SVW2_SK3_SKXCCM8_TLDS1_ULSGRO0_USL1_UIOFGRO0_USFGRO0_VSn1_VWA2_VWB2_WSGRA0_WSGRB0_WS64_WG32_8_1_WGM6_WGMXCC1_WGMXCCGn1
    SolutionIndex: 42
    SolutionNameMin: Cijk_Alik_Bjlk_I8II_BH_UserArgs_MT64x64x128_MI16x16x1_SN_LDSB1_AFC0_AFEM1_AFEM1_ASEM1_CLR1_CADS0_DTVA0_DTVB0_EPS0_FDSI0_GRPM1_GRVWA8_GRVWB4_GSU0_GSUAMB_GSUC0_GSUWGMRR0_GLS0_ISA950_IU1_K1_LBSPPA256_LBSPPB1024_LBSPPM0_LPA32_LPB32_LPM0_LRVW16_LWPMn1_MIAV0_MIWT2_2_MO40_NTn1_NTA0_NTB0_NTC0_NTD0_NTM0_NEPBS0_NLCA1_NLCB1_ONLL1_PGR2_PLR1_PKA1_SIA3_SS1_SU0_SUM1_SUS128_SPO0_SRVW0_SSO0_SVW2_SK3_SKXCCM8_TLDS1_ULSGRO0_USL1_UIOFGRO0_USFGRO0_VSn1_VWA2_VWB2_WSGRA0_WSGRB0_WS64_WG32_8_1_WGM6_WGMXCC1_WGMXCCGn1
    SolutionIndex: 43
    SolutionNameMin: Cijk_Alik_Bjlk_I8II_BH_UserArgs_MT64x64x128_MI16x16x1_SN_LDSB1_AFC0_AFEM1_AFEM1_ASEM1_CLR1_CADS0_DTVA0_DTVB0_EPS0_FDSI0_GRPM1_GRVWA16_GRVWB4_GSU0_GSUAMB_GSUC0_GSUWGMRR0_GLS0_ISA950_IU1_K1_LBSPPA256_LBSPPB1024_LBSPPM0_LPA32_LPB32_LPM0_LRVW16_LWPMn1_MIAV0_MIWT2_2_MO40_NTn1_NTA0_NTB0_NTC0_NTD0_NTM0_NEPBS0_NLCA1_NLCB1_ONLL1_PGR2_PLR1_PKA1_SIA3_SS1_SU0_SUM1_SUS128_SPO0_SRVW0_SSO0_SVW2_SK3_SKXCCM8_TLDS1_ULSGRO0_USL1_UIOFGRO0_USFGRO0_VSn1_VWA2_VWB2_WSGRA0_WSGRB0_WS64_WG32_8_1_WGM6_WGMXCC1_WGMXCCGn1
    SolutionIndex: 44
    SolutionNameMin: Cijk_Alik_Bjlk_I8II_BH_UserArgs_MT64x64x128_MI16x16x1_SN_LDSB1_AFC0_AFEM1_AFEM1_ASEM1_CLR1_CADS0_DTVA0_DTVB0_EPS0_FDSI0_GRPM1_GRVWA8_GRVWB8_GSU0_GSUAMB_GSUC0_GSUWGMRR0_GLS0_ISA950_IU1_K1_LBSPPA256_LBSPPB1024_LBSPPM0_LPA32_LPB32_LPM0_LRVW16_LWPMn1_MIAV0_MIWT2_2_MO40_NTn1_NTA0_NTB0_NTC0_NTD0_NTM0_NEPBS0_NLCA1_NLCB1_ONLL1_PGR2_PLR1_PKA1_SIA3_SS1_SU0_SUM1_SUS128_SPO0_SRVW0_SSO0_SVW2_SK3_SKXCCM8_TLDS1_ULSGRO0_USL1_UIOFGRO0_USFGRO0_VSn1_VWA2_VWB2_WSGRA0_WSGRB0_WS64_WG32_8_1_WGM6_WGMXCC1_WGMXCCGn1
    SolutionIndex: 45
    SolutionNameMin: Cijk_Alik_Bjlk_I8II_BH_UserArgs_MT64x64x128_MI16x16x1_SN_LDSB1_AFC0_AFEM1_AFEM1_ASEM1_CLR1_CADS0_DTVA0_DTVB0_EPS0_FDSI0_GRPM1_GRVWA16_GRVWB8_GSU0_GSUAMB_GSUC0_GSUWGMRR0_GLS0_ISA950_IU1_K1_LBSPPA256_LBSPPB1024_LBSPPM0_LPA32_LPB32_LPM0_LRVW16_LWPMn1_MIAV0_MIWT2_2_MO40_NTn1_NTA0_NTB0_NTC0_NTD0_NTM0_NEPBS0_NLCA1_NLCB1_ONLL1_PGR2_PLR1_PKA1_SIA3_SS1_SU0_SUM1_SUS128_SPO0_SRVW0_SSO0_SVW2_SK3_SKXCCM8_TLDS1_ULSGRO0_USL1_UIOFGRO0_USFGRO0_VSn1_VWA2_VWB2_WSGRA0_WSGRB0_WS64_WG32_8_1_WGM6_WGMXCC1_WGMXCCGn1
    SolutionIndex: 46
    SolutionNameMin: Cijk_Alik_Bjlk_I8II_BH_UserArgs_MT64x64x128_MI16x16x1_SN_LDSB1_AFC0_AFEM1_AFEM1_ASEM1_CLR1_CADS0_DTVA0_DTVB0_EPS0_FDSI0_GRPM1_GRVWA16_GRVWB16_GSU0_GSUAMB_GSUC0_GSUWGMRR0_GLS0_ISA950_IU1_K1_LBSPPA256_LBSPPB1024_LBSPPM0_LPA32_LPB32_LPM0_LRVW16_LWPMn1_MIAV0_MIWT2_2_MO40_NTn1_NTA0_NTB0_NTC0_NTD0_NTM0_NEPBS0_NLCA1_NLCB1_ONLL1_PGR2_PLR1_PKA1_SIA3_SS1_SU0_SUM1_SUS128_SPO0_SRVW0_SSO0_SVW2_SK3_SKXCCM8_TLDS1_ULSGRO0_USL1_UIOFGRO0_USFGRO0_VSn1_VWA2_VWB2_WSGRA0_WSGRB0_WS64_WG32_8_1_WGM6_WGMXCC1_WGMXCCGn1
    SolutionIndex: 47
    SolutionNameMin: Cijk_Alik_Bjlk_I8II_BH_UserArgs_MT128x128x128_MI32x32x1_SN_LDSB1_AFC0_AFEM1_AFEM1_ASEM1_CLR1_CADS0_DTVA0_DTVB0_EPS0_FDSI0_GRPM1_GRVWA16_GRVWB4_GSU0_GSUAMB_GSUC0_GSUWGMRR0_GLS0_ISA950_IU1_K1_LBSPPA256_LBSPPB0_LBSPPM0_LPA16_LPB0_LPM0_LRVW16_LWPMn1_MIAV0_MIWT2_2_MO40_NTn1_NTA0_NTB0_NTC0_NTD0_NTM0_NEPBS0_NLCA1_NLCB1_ONLL1_PGR2_PLR2_PKA1_SIA3_SS1_SU0_SUM1_SUS128_SPO0_SRVW0_SSO0_SVW2_SK3_SKXCCM8_TLDS1_ULSGRO0_USL1_UIOFGRO0_USFGRO0_VSn1_VWA2_VWB2_WSGRA0_WSGRB0_WS64_WG64_4_1_WGM6_WGMXCC1_WGMXCCGn1
    SolutionIndex: 48
    SolutionNameMin: Cijk_Alik_Bjlk_I8II_BH_UserArgs_MT128x128x256_MI16x16x1_SN_LDSB1_AFC0_AFEM1_AFEM1_ASEM1_CLR1_CADS0_DTVA0_DTVB0_EPS0_FDSI0_GRPM1_GRVWA16_GRVWB16_GSU0_GSUAMB_GSUC0_GSUWGMRR0_GLS0_ISA950_IU1_K1_LBSPPA1024_LBSPPB2048_LBSPPM0_LPA32_LPB64_LPM0_LRVW16_LWPMn1_MIAV0_MIWT4_4_MO40_NTn1_NTA0_NTB0_NTC0_NTD0_NTM0_NEPBS0_NLCA1_NLCB1_ONLL1_PGR2_PLR2_PKA1_SIA3_SS1_SU0_SUM1_SUS256_SPO0_SRVW0_SSO0_SVW4_SK3_SKXCCM8_TLDS1_ULSGRO0_USL1_UIOFGRO0_USFGRO0_VSn1_VWA4_VWB4_WSGRA0_WSGRB0_WS64_WG32_8_1_WGM6_WGMXCC1_WGMXCCGn1
    SolutionIndex: 49
    SolutionNameMin: Cijk_Alik_Bjlk_I8II_BH_UserArgs_MT128x64x256_MI16x16x1_SN_LDSB1_AFC0_AFEM1_AFEM1_ASEM1_CLR1_CADS0_DTVA0_DTVB0_EPS0_FDSI0_GRPM1_GRVWA16_GRVWB16_GSU0_GSUAMB_GSUC0_GSUWGMRR0_GLS0_ISA950_IU1_K1_LBSPPA512_LBSPPB1024_LBSPPM0_LPA32_LPB32_LPM0_LRVW16_LWPMn1_MIAV0_MIWT4_2_MO40_NTn1_NTA0_NTB0_NTC0_NTD0_NTM0_NEPBS0_NLCA1_NLCB1_ONLL1_PGR2_PLR1_PKA1_SIA3_SS1_SU0_SUM1_SUS256_SPO0_SRVW0_SSO0_SVW2_SK3_SKXCCM8_TLDS1_ULSGRO0_USL1_UIOFGRO0_USFGRO0_VSn1_VWA2_VWB2_WSGRA0_WSGRB0_WS64_WG32_8_1_WGM6_WGMXCC1_WGMXCCGn1
    SolutionIndex: 50
    SolutionNameMin: Cijk_Alik_Bjlk_I8II_BH_UserArgs_MT128x64x256_MI16x16x1_SN_LDSB1_AFC0_AFEM1_AFEM1_ASEM1_CLR1_CADS0_DTVA0_DTVB0_EPS0_FDSI0_GRPM1_GRVWA16_GRVWB16_GSU0_GSUAMB_GSUC0_GSUWGMRR0_GLS0_ISA950_IU1_K1_LBSPPA1024_LBSPPB1024_LBSPPM0_LPA32_LPB32_LPM0_LRVW16_LWPMn1_MIAV0_MIWT4_2_MO40_NTn1_NTA0_NTB0_NTC0_NTD0_NTM0_NEPBS0_NLCA1_NLCB1_ONLL1_PGR2_PLR1_PKA1_SIA3_SS1_SU0_SUM1_SUS256_SPO0_SRVW0_SSO0_SVW4_SK3_SKXCCM8_TLDS1_ULSGRO0_USL1_UIOFGRO0_USFGRO0_VSn1_VWA4_VWB2_WSGRA0_WSGRB0_WS64_WG32_8_1_WGM6_WGMXCC1_WGMXCCGn1
    SolutionIndex: 51
    SolutionNameMin: Cijk_Alik_Bjlk_I8II_BH_UserArgs_MT128x64x256_MI16x16x1_SN_LDSB1_AFC0_AFEM1_AFEM1_ASEM1_CLR1_CADS0_DTVA0_DTVB0_EPS0_FDSI0_GRPM1_GRVWA16_GRVWB16_GSU0_GSUAMB_GSUC0_GSUWGMRR0_GLS0_ISA950_IU1_K1_LBSPPA512_LBSPPB1024_LBSPPM0_LPA32_LPB32_LPM0_LRVW16_LWPMn1_MIAV0_MIWT4_2_MO40_NTn1_NTA0_NTB0_NTC0_NTD0_NTM0_NEPBS0_NLCA1_NLCB1_ONLL1_PGR2_PLR2_PKA1_SIA3_SS1_SU0_SUM1_SUS256_SPO0_SRVW0_SSO0_SVW2_SK3_SKXCCM8_TLDS1_ULSGRO0_USL1_UIOFGRO0_USFGRO0_VSn1_VWA2_VWB2_WSGRA0_WSGRB0_WS64_WG32_8_1_WGM6_WGMXCC1_WGMXCCGn1
    SolutionIndex: 52
    SolutionNameMin: Cijk_Alik_Bjlk_I8II_BH_UserArgs_MT128x64x256_MI16x16x1_SN_LDSB1_AFC0_AFEM1_AFEM1_ASEM1_CLR1_CADS0_DTVA0_DTVB0_EPS0_FDSI0_GRPM1_GRVWA16_GRVWB16_GSU0_GSUAMB_GSUC0_GSUWGMRR0_GLS0_ISA950_IU1_K1_LBSPPA1024_LBSPPB1024_LBSPPM0_LPA32_LPB32_LPM0_LRVW16_LWPMn1_MIAV0_MIWT4_2_MO40_NTn1_NTA0_NTB0_NTC0_NTD0_NTM0_NEPBS0_NLCA1_NLCB1_ONLL1_PGR2_PLR2_PKA1_SIA3_SS1_SU0_SUM1_SUS256_SPO0_SRVW0_SSO0_SVW4_SK3_SKXCCM8_TLDS1_ULSGRO0_USL1_UIOFGRO0_USFGRO0_VSn1_VWA4_VWB2_WSGRA0_WSGRB0_WS64_WG32_8_1_WGM6_WGMXCC1_WGMXCCGn1
    SolutionIndex: 53
    SolutionNameMin: Cijk_Alik_Bjlk_I8II_BH_UserArgs_MT64x64x256_MI16x16x1_SN_LDSB1_AFC0_AFEM1_AFEM1_ASEM1_CLR1_CADS0_DTVA0_DTVB0_EPS0_FDSI0_GRPM1_GRVWA16_GRVWB4_GSU0_GSUAMB_GSUC0_GSUWGMRR0_GLS0_ISA950_IU1_K1_LBSPPA512_LBSPPB1024_LBSPPM0_LPA32_LPB32_LPM0_LRVW16_LWPMn1_MIAV0_MIWT2_2_MO40_NTn1_NTA0_NTB0_NTC0_NTD0_NTM0_NEPBS0_NLCA1_NLCB1_ONLL1_PGR2_PLR1_PKA1_SIA3_SS1_SU0_SUM1_SUS256_SPO0_SRVW0_SSO0_SVW2_SK3_SKXCCM8_TLDS1_ULSGRO0_USL1_UIOFGRO0_USFGRO0_VSn1_VWA2_VWB2_WSGRA0_WSGRB0_WS64_WG32_8_1_WGM6_WGMXCC1_WGMXCCGn1
    SolutionIndex: 54
    SolutionNameMin: Cijk_Alik_Bjlk_I8II_BH_UserArgs_MT64x64x256_MI16x16x1_SN_LDSB1_AFC0_AFEM1_AFEM1_ASEM1_CLR1_CADS0_DTVA0_DTVB0_EPS0_FDSI0_GRPM1_GRVWA16_GRVWB8_GSU0_GSUAMB_GSUC0_GSUWGMRR0_GLS0_ISA950_IU1_K1_LBSPPA512_LBSPPB1024_LBSPPM0_LPA32_LPB32_LPM0_LRVW16_LWPMn1_MIAV0_MIWT2_2_MO40_NTn1_NTA0_NTB0_NTC0_NTD0_NTM0_NEPBS0_NLCA1_NLCB1_ONLL1_PGR2_PLR1_PKA1_SIA3_SS1_SU0_SUM1_SUS256_SPO0_SRVW0_SSO0_SVW2_SK3_SKXCCM8_TLDS1_ULSGRO0_USL1_UIOFGRO0_USFGRO0_VSn1_VWA2_VWB2_WSGRA0_WSGRB0_WS64_WG32_8_1_WGM6_WGMXCC1_WGMXCCGn1
    SolutionIndex: 55
    SolutionNameMin: Cijk_Alik_Bjlk_I8II_BH_UserArgs_MT64x64x256_MI16x16x1_SN_LDSB1_AFC0_AFEM1_AFEM1_ASEM1_CLR1_CADS0_DTVA0_DTVB0_EPS0_FDSI0_GRPM1_GRVWA16_GRVWB16_GSU0_GSUAMB_GSUC0_GSUWGMRR0_GLS0_ISA950_IU1_K1_LBSPPA512_LBSPPB1024_LBSPPM0_LPA32_LPB32_LPM0_LRVW16_LWPMn1_MIAV0_MIWT2_2_MO40_NTn1_NTA0_NTB0_NTC0_NTD0_NTM0_NEPBS0_NLCA1_NLCB1_ONLL1_PGR2_PLR1_PKA1_SIA3_SS1_SU0_SUM1_SUS256_SPO0_SRVW0_SSO0_SVW2_SK3_SKXCCM8_TLDS1_ULSGRO0_USL1_UIOFGRO0_USFGRO0_VSn1_VWA2_VWB2_WSGRA0_WSGRB0_WS64_WG32_8_1_WGM6_WGMXCC1_WGMXCCGn1
    SolutionIndex: 56
    SolutionNameMin: Cijk_Alik_Bjlk_I8II_BH_UserArgs_MT64x64x256_MI16x16x1_SN_LDSB1_AFC0_AFEM1_AFEM1_ASEM1_CLR1_CADS0_DTVA0_DTVB0_EPS0_FDSI0_GRPM1_GRVWA16_GRVWB4_GSU0_GSUAMB_GSUC0_GSUWGMRR0_GLS0_ISA950_IU1_K1_LBSPPA512_LBSPPB1024_LBSPPM0_LPA32_LPB32_LPM0_LRVW16_LWPMn1_MIAV0_MIWT2_2_MO40_NTn1_NTA0_NTB0_NTC0_NTD0_NTM0_NEPBS0_NLCA1_NLCB1_ONLL1_PGR2_PLR2_PKA1_SIA3_SS1_SU0_SUM1_SUS256_SPO0_SRVW0_SSO0_SVW2_SK3_SKXCCM8_TLDS1_ULSGRO0_USL1_UIOFGRO0_USFGRO0_VSn1_VWA2_VWB2_WSGRA0_WSGRB0_WS64_WG32_8_1_WGM6_WGMXCC1_WGMXCCGn1
    SolutionIndex: 57
    SolutionNameMin: Cijk_Alik_Bjlk_I8II_BH_UserArgs_MT64x64x256_MI16x16x1_SN_LDSB1_AFC0_AFEM1_AFEM1_ASEM1_CLR1_CADS0_DTVA0_DTVB0_EPS0_FDSI0_GRPM1_GRVWA4_GRVWB16_GSU0_GSUAMB_GSUC0_GSUWGMRR0_GLS0_ISA950_IU1_K1_LBSPPA512_LBSPPB1024_LBSPPM0_LPA32_LPB32_LPM0_LRVW16_LWPMn1_MIAV0_MIWT2_2_MO40_NTn1_NTA0_NTB0_NTC0_NTD0_NTM0_NEPBS0_NLCA1_NLCB1_ONLL1_PGR2_PLR2_PKA1_SIA3_SS1_SU0_SUM1_SUS256_SPO0_SRVW0_SSO0_SVW2_SK3_SKXCCM8_TLDS1_ULSGRO0_USL1_UIOFGRO0_USFGRO0_VSn1_VWA2_VWB2_WSGRA0_WSGRB0_WS64_WG32_8_1_WGM6_WGMXCC1_WGMXCCGn1
    SolutionIndex: 58
    SolutionNameMin: Cijk_Alik_Bjlk_I8II_BH_UserArgs_MT64x64x256_MI16x16x1_SN_LDSB1_AFC0_AFEM1_AFEM1_ASEM1_CLR1_CADS0_DTVA0_DTVB0_EPS0_FDSI0_GRPM1_GRVWA16_GRVWB16_GSU0_GSUAMB_GSUC0_GSUWGMRR0_GLS0_ISA950_IU1_K1_LBSPPA512_LBSPPB1024_LBSPPM0_LPA32_LPB32_LPM0_LRVW16_LWPMn1_MIAV0_MIWT2_2_MO40_NTn1_NTA0_NTB0_NTC0_NTD0_NTM0_NEPBS0_NLCA1_NLCB1_ONLL1_PGR2_PLR2_PKA1_SIA3_SS1_SU0_SUM1_SUS256_SPO0_SRVW0_SSO0_SVW2_SK3_SKXCCM8_TLDS1_ULSGRO0_USL1_UIOFGRO0_USFGRO0_VSn1_VWA2_VWB2_WSGRA0_WSGRB0_WS64_WG32_8_1_WGM6_WGMXCC1_WGMXCCGn1
- - - [128, 128, 1, 128, 128, 128, 128, 128]
    - [41, 0.38]
  - - [128, 128, 1, 256, 128, 128, 256, 128]
    - [53, 0.67]
  - - [128, 128, 1, 512, 128, 128, 512, 128]
    - [58, 1.11]
  - - [128, 128, 1, 1024, 128, 128, 1024, 128]
    - [58, 1.76]
  - - [128, 128, 1, 2048, 128, 128, 2048, 128]
    - [58, 2.41]
  - - [128, 128, 1, 4096, 128, 128, 4096, 128]
    - [58, 3.06]
  - - [128, 128, 1, 8192, 128, 128, 8192, 128]
    - [58, 3.49]
  - - [128, 256, 1, 128, 128, 128, 128, 256]
    - [41, 0.76]
  - - [128, 256, 1, 256, 128, 128, 256, 256]
    - [53, 1.32]
  - - [128, 256, 1, 512, 128, 128, 512, 256]
    - [43, 2.18]
  - - [128, 256, 1, 1024, 128, 128, 1024, 256]
    - [58, 3.46]
  - - [128, 256, 1, 2048, 128, 128, 2048, 256]
    - [58, 4.8]
  - - [128, 256, 1, 4096, 128, 128, 4096, 256]
    - [58, 6.04]
  - - [128, 256, 1, 8192, 128, 128, 8192, 256]
    - [58, 6.89]
  - - [128, 512, 1, 128, 128, 128, 128, 512]
    - [43, 1.53]
  - - [128, 512, 1, 256, 128, 128, 256, 512]
    - [43, 2.66]
  - - [128, 512, 1, 512, 128, 128, 512, 512]
    - [46, 4.41]
  - - [128, 512, 1, 1024, 128, 128, 1024, 512]
    - [58, 6.97]
  - - [128, 512, 1, 2048, 128, 128, 2048, 512]
    - [58, 9.62]
  - - [128, 512, 1, 4096, 128, 128, 4096, 512]
    - [58, 11.89]
  - - [128, 512, 1, 8192, 128, 128, 8192, 512]
    - [58, 13.74]
  - - [128, 1024, 1, 128, 128, 128, 128, 1024]
    - [43, 3.02]
  - - [128, 1024, 1, 256, 128, 128, 256, 1024]
    - [54, 5.27]
  - - [128, 1024, 1, 512, 128, 128, 512, 1024]
    - [43, 8.67]
  - - [128, 1024, 1, 1024, 128, 128, 1024, 1024]
    - [58, 13.34]
  - - [128, 1024, 1, 2048, 128, 128, 2048, 1024]
    - [58, 18.52]
  - - [128, 1024, 1, 4096, 128, 128, 4096, 1024]
    - [58, 23.04]
  - - [128, 1024, 1, 8192, 128, 128, 8192, 1024]
    - [58, 26.25]
  - - [128, 2048, 1, 128, 128, 128, 128, 2048]
    - [42, 5.89]
  - - [128, 2048, 1, 256, 128, 128, 256, 2048]
    - [43, 10.14]
  - - [128, 2048, 1, 512, 128, 128, 512, 2048]
    - [46, 16.69]
  - - [128, 2048, 1, 1024, 128, 128, 1024, 2048]
    - [58, 25.84]
  - - [128, 2048, 1, 2048, 128, 128, 2048, 2048]
    - [58, 36.18]
  - - [128, 2048, 1, 4096, 128, 128, 4096, 2048]
    - [58, 45.33]
  - - [128, 2048, 1, 8192, 128, 128, 8192, 2048]
    - [58, 52.33]
  - - [128, 4096, 1, 128, 128, 128, 128, 4096]
    - [43, 11.28]
  - - [128, 4096, 1, 256, 128, 128, 256, 4096]
    - [45, 19.35]
  - - [128, 4096, 1, 512, 128, 128, 512, 4096]
    - [46, 32.67]
  - - [128, 4096, 1, 1024, 128, 128, 1024, 4096]
    - [58, 50.95]
  - - [128, 4096, 1, 2048, 128, 128, 2048, 4096]
    - [58, 71.47]
  - - [128, 4096, 1, 4096, 128, 128, 4096, 4096]
    - [58, 89.99]
  - - [128, 4096, 1, 8192, 128, 128, 8192, 4096]
    - [58, 100.73]
  - - [128, 8192, 1, 128, 128, 128, 128, 8192]
    - [42, 20.01]
  - - [128, 8192, 1, 256, 128, 128, 256, 8192]
    - [43, 35.47]
  - - [128, 8192, 1, 512, 128, 128, 512, 8192]
    - [43, 60.13]
  - - [128, 8192, 1, 1024, 128, 128, 1024, 8192]
    - [57, 95.06]
  - - [128, 8192, 1, 2048, 128, 128, 2048, 8192]
    - [55, 133.88]
  - - [128, 8192, 1, 4096, 128, 128, 4096, 8192]
    - [58, 165.11]
  - - [128, 8192, 1, 8192, 128, 128, 8192, 8192]
    - [58, 190.36]
  - - [256, 128, 1, 128, 256, 256, 128, 128]
    - [45, 0.75]
  - - [256, 128, 1, 256, 256, 256, 256, 128]
    - [53, 1.31]
  - - [256, 128, 1, 512, 256, 256, 512, 128]
    - [55, 2.19]
  - - [256, 128, 1, 1024, 256, 256, 1024, 128]
    - [58, 3.48]
  - - [256, 128, 1, 2048, 256, 256, 2048, 128]
    - [58, 4.85]
  - - [256, 128, 1, 4096, 256, 256, 4096, 128]
    - [58, 6.03]
  - - [256, 128, 1, 8192, 256, 256, 8192, 128]
    - [58, 6.94]
  - - [256, 256, 1, 128, 256, 256, 128, 256]
    - [42, 1.54]
  - - [256, 256, 1, 256, 256, 256, 256, 256]
    - [53, 2.67]
  - - [256, 256, 1, 512, 256, 256, 512, 256]
    - [46, 4.41]
  - - [256, 256, 1, 1024, 256, 256, 1024, 256]
    - [58, 6.92]
  - - [256, 256, 1, 2048, 256, 256, 2048, 256]
    - [58, 9.71]
  - - [256, 256, 1, 4096, 256, 256, 4096, 256]
    - [58, 12.05]
  - - [256, 256, 1, 8192, 256, 256, 8192, 256]
    - [58, 13.98]
  - - [256, 512, 1, 128, 256, 256, 128, 512]
    - [43, 3.0]
  - - [256, 512, 1, 256, 256, 256, 256, 512]
    - [54, 5.31]
  - - [256, 512, 1, 512, 256, 256, 512, 512]
    - [46, 8.79]
  - - [256, 512, 1, 1024, 256, 256, 1024, 512]
    - [58, 13.7]
  - - [256, 512, 1, 2048, 256, 256, 2048, 512]
    - [58, 19.36]
  - - [256, 512, 1, 4096, 256, 256, 4096, 512]
    - [58, 23.86]
  - - [256, 512, 1, 8192, 256, 256, 8192, 512]
    - [58, 27.56]
  - - [256, 1024, 1, 128, 256, 256, 128, 1024]
    - [41, 5.91]
  - - [256, 1024, 1, 256, 256, 256, 256, 1024]
    - [43, 10.38]
  - - [256, 1024, 1, 512, 256, 256, 512, 1024]
    - [43, 17.04]
  - - [256, 1024, 1, 1024, 256, 256, 1024, 1024]
    - [58, 26.65]
  - - [256, 1024, 1, 2048, 256, 256, 2048, 1024]
    - [57, 37.0]
  - - [256, 1024, 1, 4096, 256, 256, 4096, 1024]
    - [58, 46.23]
  - - [256, 1024, 1, 8192, 256, 256, 8192, 1024]
    - [58, 53.46]
  - - [256, 2048, 1, 128, 256, 256, 128, 2048]
    - [43, 11.26]
  - - [256, 2048, 1, 256, 256, 256, 256, 2048]
    - [43, 19.64]
  - - [256, 2048, 1, 512, 256, 256, 512, 2048]
    - [55, 32.7]
  - - [256, 2048, 1, 1024, 256, 256, 1024, 2048]
    - [58, 51.64]
  - - [256, 2048, 1, 2048, 256, 256, 2048, 2048]
    - [58, 72.17]
  - - [256, 2048, 1, 4096, 256, 256, 4096, 2048]
    - [58, 90.46]
  - - [256, 2048, 1, 8192, 256, 256, 8192, 2048]
    - [58, 104.94]
  - - [256, 4096, 1, 128, 256, 256, 128, 4096]
    - [43, 19.84]
  - - [256, 4096, 1, 256, 256, 256, 256, 4096]
    - [54, 35.71]
  - - [256, 4096, 1, 512, 256, 256, 512, 4096]
    - [55, 60.25]
  - - [256, 4096, 1, 1024, 256, 256, 1024, 4096]
    - [58, 96.85]
  - - [256, 4096, 1, 2048, 256, 256, 2048, 4096]
    - [58, 138.78]
  - - [256, 4096, 1, 4096, 256, 256, 4096, 4096]
    - [58, 173.96]
  - - [256, 4096, 1, 8192, 256, 256, 8192, 4096]
    - [58, 197.4]
  - - [256, 8192, 1, 128, 256, 256, 128, 8192]
    - [38, 32.23]
  - - [256, 8192, 1, 256, 256, 256, 256, 8192]
    - [38, 57.87]
  - - [256, 8192, 1, 512, 256, 256, 512, 8192]
    - [38, 100.27]
  - - [256, 8192, 1, 1024, 256, 256, 1024, 8192]
    - [50, 157.65]
  - - [256, 8192, 1, 2048, 256, 256, 2048, 8192]
    - [52, 225.7]
  - - [256, 8192, 1, 4096, 256, 256, 4096, 8192]
    - [50, 286.44]
  - - [256, 8192, 1, 8192, 256, 256, 8192, 8192]
    - [49, 330.33]
  - - [512, 128, 1, 128, 512, 512, 128, 128]
    - [43, 1.52]
  - - [512, 128, 1, 256, 512, 512, 256, 128]
    - [53, 2.67]
  - - [512, 128, 1, 512, 512, 512, 512, 128]
    - [58, 4.4]
  - - [512, 128, 1, 1024, 512, 512, 1024, 128]
    - [58, 7.0]
  - - [512, 128, 1, 2048, 512, 512, 2048, 128]
    - [58, 9.73]
  - - [512, 128, 1, 4096, 512, 512, 4096, 128]
    - [58, 12.2]
  - - [512, 128, 1, 8192, 512, 512, 8192, 128]
    - [58, 13.94]
  - - [512, 256, 1, 128, 512, 512, 128, 256]
    - [43, 3.0]
  - - [512, 256, 1, 256, 512, 512, 256, 256]
    - [53, 5.28]
  - - [512, 256, 1, 512, 512, 512, 512, 256]
    - [58, 8.85]
  - - [512, 256, 1, 1024, 512, 512, 1024, 256]
    - [58, 13.62]
  - - [512, 256, 1, 2048, 512, 512, 2048, 256]
    - [58, 19.34]
  - - [512, 256, 1, 4096, 512, 512, 4096, 256]
    - [58, 24.17]
  - - [512, 256, 1, 8192, 512, 512, 8192, 256]
    - [58, 27.86]
  - - [512, 512, 1, 128, 512, 512, 128, 512]
    - [44, 5.85]
  - - [512, 512, 1, 256, 512, 512, 256, 512]
    - [53, 10.44]
  - - [512, 512, 1, 512, 512, 512, 512, 512]
    - [58, 17.2]
  - - [512, 512, 1, 1024, 512, 512, 1024, 512]
    - [58, 27.17]
  - - [512, 512, 1, 2048, 512, 512, 2048, 512]
    - [58, 38.32]
  - - [512, 512, 1, 4096, 512, 512, 4096, 512]
    - [58, 47.78]
  - - [512, 512, 1, 8192, 512, 512, 8192, 512]
    - [58, 54.9]
  - - [512, 1024, 1, 128, 512, 512, 128, 1024]
    - [43, 11.36]
  - - [512, 1024, 1, 256, 512, 512, 256, 1024]
    - [56, 19.85]
  - - [512, 1024, 1, 512, 512, 512, 512, 1024]
    - [58, 33.32]
  - - [512, 1024, 1, 1024, 512, 512, 1024, 1024]
    - [58, 52.66]
  - - [512, 1024, 1, 2048, 512, 512, 2048, 1024]
    - [57, 73.57]
  - - [512, 1024, 1, 4096, 512, 512, 4096, 1024]
    - [58, 92.28]
  - - [512, 1024, 1, 8192, 512, 512, 8192, 1024]
    - [58, 105.54]
  - - [512, 2048, 1, 128, 512, 512, 128, 2048]
    - [43, 20.26]
  - - [512, 2048, 1, 256, 512, 512, 256, 2048]
    - [56, 35.95]
  - - [512, 2048, 1, 512, 512, 512, 512, 2048]
    - [58, 60.91]
  - - [512, 2048, 1, 1024, 512, 512, 1024, 2048]
    - [58, 98.22]
  - - [512, 2048, 1, 2048, 512, 512, 2048, 2048]
    - [58, 140.83]
  - - [512, 2048, 1, 4096, 512, 512, 4096, 2048]
    - [58, 175.38]
  - - [512, 2048, 1, 8192, 512, 512, 8192, 2048]
    - [58, 202.87]
  - - [512, 4096, 1, 128, 512, 512, 128, 4096]
    - [37, 31.99]
  - - [512, 4096, 1, 256, 512, 512, 256, 4096]
    - [38, 58.5]
  - - [512, 4096, 1, 512, 512, 512, 512, 4096]
    - [40, 101.19]
  - - [512, 4096, 1, 1024, 512, 512, 1024, 4096]
    - [52, 160.63]
  - - [512, 4096, 1, 2048, 512, 512, 2048, 4096]
    - [52, 232.22]
  - - [512, 4096, 1, 4096, 512, 512, 4096, 4096]
    - [52, 296.13]
  - - [512, 4096, 1, 8192, 512, 512, 8192, 4096]
    - [52, 337.8]
  - - [512, 8192, 1, 128, 512, 512, 128, 8192]
    - [9, 41.52]
  - - [512, 8192, 1, 256, 512, 512, 256, 8192]
    - [10, 75.06]
  - - [512, 8192, 1, 512, 512, 512, 512, 8192]
    - [34, 136.51]
  - - [512, 8192, 1, 1024, 512, 512, 1024, 8192]
    - [34, 218.92]
  - - [512, 8192, 1, 2048, 512, 512, 2048, 8192]
    - [34, 321.94]
  - - [512, 8192, 1, 4096, 512, 512, 4096, 8192]
    - [33, 418.77]
  - - [512, 8192, 1, 8192, 512, 512, 8192, 8192]
    - [33, 475.75]
  - - [1024, 128, 1, 128, 1024, 1024, 128, 128]
    - [41, 3.02]
  - - [1024, 128, 1, 256, 1024, 1024, 256, 128]
    - [56, 5.34]
  - - [1024, 128, 1, 512, 1024, 1024, 512, 128]
    - [55, 8.78]
  - - [1024, 128, 1, 1024, 1024, 1024, 1024, 128]
    - [58, 13.8]
  - - [1024, 128, 1, 2048, 1024, 1024, 2048, 128]
    - [58, 19.23]
  - - [1024, 128, 1, 4096, 1024, 1024, 4096, 128]
    - [58, 24.23]
  - - [1024, 128, 1, 8192, 1024, 1024, 8192, 128]
    - [58, 27.77]
  - - [1024, 256, 1, 128, 1024, 1024, 128, 256]
    - [42, 5.89]
  - - [1024, 256, 1, 256, 1024, 1024, 256, 256]
    - [56, 10.42]
  - - [1024, 256, 1, 512, 1024, 1024, 512, 256]
    - [57, 17.24]
  - - [1024, 256, 1, 1024, 1024, 1024, 1024, 256]
    - [58, 27.24]
  - - [1024, 256, 1, 2048, 1024, 1024, 2048, 256]
    - [58, 38.29]
  - - [1024, 256, 1, 4096, 1024, 1024, 4096, 256]
    - [58, 48.02]
  - - [1024, 256, 1, 8192, 1024, 1024, 8192, 256]
    - [58, 55.38]
  - - [1024, 512, 1, 128, 1024, 1024, 128, 512]
    - [41, 11.36]
  - - [1024, 512, 1, 256, 1024, 1024, 256, 512]
    - [53, 19.87]
  - - [1024, 512, 1, 512, 1024, 1024, 512, 512]
    - [58, 33.65]
  - - [1024, 512, 1, 1024, 1024, 1024, 1024, 512]
    - [58, 53.14]
  - - [1024, 512, 1, 2048, 1024, 1024, 2048, 512]
    - [58, 74.89]
  - - [1024, 512, 1, 4096, 1024, 1024, 4096, 512]
    - [58, 93.65]
  - - [1024, 512, 1, 8192, 1024, 1024, 8192, 512]
    - [58, 107.51]
  - - [1024, 1024, 1, 128, 1024, 1024, 128, 1024]
    - [42, 20.32]
  - - [1024, 1024, 1, 256, 1024, 1024, 256, 1024]
    - [53, 36.13]
  - - [1024, 1024, 1, 512, 1024, 1024, 512, 1024]
    - [58, 61.61]
  - - [1024, 1024, 1, 1024, 1024, 1024, 1024, 1024]
    - [55, 97.24]
  - - [1024, 1024, 1, 2048, 1024, 1024, 2048, 1024]
    - [58, 141.45]
  - - [1024, 1024, 1, 4096, 1024, 1024, 4096, 1024]
    - [58, 177.52]
  - - [1024, 1024, 1, 8192, 1024, 1024, 8192, 1024]
    - [58, 205.21]
  - - [1024, 2048, 1, 128, 1024, 1024, 128, 2048]
    - [38, 32.15]
  - - [1024, 2048, 1, 256, 1024, 1024, 256, 2048]
    - [38, 58.49]
  - - [1024, 2048, 1, 512, 1024, 1024, 512, 2048]
    - [40, 101.06]
  - - [1024, 2048, 1, 1024, 1024, 1024, 1024, 2048]
    - [51, 159.65]
  - - [1024, 2048, 1, 2048, 1024, 1024, 2048, 2048]
    - [52, 233.42]
  - - [1024, 2048, 1, 4096, 1024, 1024, 4096, 2048]
    - [52, 302.97]
  - - [1024, 2048, 1, 8192, 1024, 1024, 8192, 2048]
    - [52, 345.4]
  - - [1024, 4096, 1, 128, 1024, 1024, 128, 4096]
    - [7, 41.54]
  - - [1024, 4096, 1, 256, 1024, 1024, 256, 4096]
    - [8, 74.69]
  - - [1024, 4096, 1, 512, 1024, 1024, 512, 4096]
    - [34, 131.98]
  - - [1024, 4096, 1, 1024, 1024, 1024, 1024, 4096]
    - [33, 215.88]
  - - [1024, 4096, 1, 2048, 1024, 1024, 2048, 4096]
    - [33, 319.18]
  - - [1024, 4096, 1, 4096, 1024, 1024, 4096, 4096]
    - [34, 419.91]
  - - [1024, 4096, 1, 8192, 1024, 1024, 8192, 4096]
    - [48, 472.86]
  - - [1024, 8192, 1, 128, 1024, 1024, 128, 8192]
    - [18, 54.75]
  - - [1024, 8192, 1, 256, 1024, 1024, 256, 8192]
    - [18, 99.81]
  - - [1024, 8192, 1, 512, 1024, 1024, 512, 8192]
    - [18, 170.11]
  - - [1024, 8192, 1, 1024, 1024, 1024, 1024, 8192]
    - [27, 277.82]
  - - [1024, 8192, 1, 2048, 1024, 1024, 2048, 8192]
    - [27, 428.3]
  - - [1024, 8192, 1, 4096, 1024, 1024, 4096, 8192]
    - [27, 545.63]
  - - [1024, 8192, 1, 8192, 1024, 1024, 8192, 8192]
    - [24, 612.53]
  - - [2048, 128, 1, 128, 2048, 2048, 128, 128]
    - [43, 5.86]
  - - [2048, 128, 1, 256, 2048, 2048, 256, 128]
    - [53, 10.56]
  - - [2048, 128, 1, 512, 2048, 2048, 512, 128]
    - [58, 17.13]
  - - [2048, 128, 1, 1024, 2048, 2048, 1024, 128]
    - [58, 27.02]
  - - [2048, 128, 1, 2048, 2048, 2048, 2048, 128]
    - [58, 38.11]
  - - [2048, 128, 1, 4096, 2048, 2048, 4096, 128]
    - [58, 47.94]
  - - [2048, 128, 1, 8192, 2048, 2048, 8192, 128]
    - [58, 55.27]
  - - [2048, 256, 1, 128, 2048, 2048, 128, 256]
    - [45, 11.29]
  - - [2048, 256, 1, 256, 2048, 2048, 256, 256]
    - [53, 20.0]
  - - [2048, 256, 1, 512, 2048, 2048, 512, 256]
    - [58, 33.49]
  - - [2048, 256, 1, 1024, 2048, 2048, 1024, 256]
    - [58, 52.98]
  - - [2048, 256, 1, 2048, 2048, 2048, 2048, 256]
    - [58, 74.44]
  - - [2048, 256, 1, 4096, 2048, 2048, 4096, 256]
    - [58, 94.21]
  - - [2048, 256, 1, 8192, 2048, 2048, 8192, 256]
    - [58, 107.79]
  - - [2048, 512, 1, 128, 2048, 2048, 128, 512]
    - [43, 20.33]
  - - [2048, 512, 1, 256, 2048, 2048, 256, 512]
    - [56, 36.0]
  - - [2048, 512, 1, 512, 2048, 2048, 512, 512]
    - [58, 61.26]
  - - [2048, 512, 1, 1024, 2048, 2048, 1024, 512]
    - [58, 97.93]
  - - [2048, 512, 1, 2048, 2048, 2048, 2048, 512]
    - [58, 140.6]
  - - [2048, 512, 1, 4096, 2048, 2048, 4096, 512]
    - [58, 176.36]
  - - [2048, 512, 1, 8192, 2048, 2048, 8192, 512]
    - [58, 201.73]
  - - [2048, 1024, 1, 128, 2048, 2048, 128, 1024]
    - [38, 32.3]
  - - [2048, 1024, 1, 256, 2048, 2048, 256, 1024]
    - [38, 58.73]
  - - [2048, 1024, 1, 512, 2048, 2048, 512, 1024]
    - [39, 100.67]
  - - [2048, 1024, 1, 1024, 2048, 2048, 1024, 1024]
    - [52, 160.21]
  - - [2048, 1024, 1, 2048, 2048, 2048, 2048, 1024]
    - [52, 234.01]
  - - [2048, 1024, 1, 4096, 2048, 2048, 4096, 1024]
    - [51, 304.4]
  - - [2048, 1024, 1, 8192, 2048, 2048, 8192, 1024]
    - [50, 351.12]
  - - [2048, 2048, 1, 128, 2048, 2048, 128, 2048]
    - [28, 41.66]
  - - [2048, 2048, 1, 256, 2048, 2048, 256, 2048]
    - [29, 75.3]
  - - [2048, 2048, 1, 512, 2048, 2048, 512, 2048]
    - [30, 131.09]
  - - [2048, 2048, 1, 1024, 2048, 2048, 1024, 2048]
    - [33, 217.44]
  - - [2048, 2048, 1, 2048, 2048, 2048, 2048, 2048]
    - [34, 321.36]
  - - [2048, 2048, 1, 4096, 2048, 2048, 4096, 2048]
    - [34, 422.16]
  - - [2048, 2048, 1, 8192, 2048, 2048, 8192, 2048]
    - [34, 484.76]
  - - [2048, 4096, 1, 128, 2048, 2048, 128, 4096]
    - [4, 52.46]
  - - [2048, 4096, 1, 256, 2048, 2048, 256, 4096]
    - [6, 96.05]
  - - [2048, 4096, 1, 512, 2048, 2048, 512, 4096]
    - [6, 165.57]
  - - [2048, 4096, 1, 1024, 2048, 2048, 1024, 4096]
    - [27, 273.74]
  - - [2048, 4096, 1, 2048, 2048, 2048, 2048, 4096]
    - [27, 418.84]
  - - [2048, 4096, 1, 4096, 2048, 2048, 4096, 4096]
    - [27, 535.13]
  - - [2048, 4096, 1, 8192, 2048, 2048, 8192, 4096]
    - [25, 611.89]
  - - [2048, 8192, 1, 128, 2048, 2048, 128, 8192]
    - [0, 58.64]
  - - [2048, 8192, 1, 256, 2048, 2048, 256, 8192]
    - [16, 110.34]
  - - [2048, 8192, 1, 512, 2048, 2048, 512, 8192]
    - [16, 197.8]
  - - [2048, 8192, 1, 1024, 2048, 2048, 1024, 8192]
    - [21, 331.32]
  - - [2048, 8192, 1, 2048, 2048, 2048, 2048, 8192]
    - [21, 509.09]
  - - [2048, 8192, 1, 4096, 2048, 2048, 4096, 8192]
    - [20, 663.53]
  - - [2048, 8192, 1, 8192, 2048, 2048, 8192, 8192]
    - [21, 771.33]
  - - [4096, 128, 1, 128, 4096, 4096, 128, 128]
    - [43, 11.29]
  - - [4096, 128, 1, 256, 4096, 4096, 256, 128]
    - [53, 19.9]
  - - [4096, 128, 1, 512, 4096, 4096, 512, 128]
    - [58, 32.77]
  - - [4096, 128, 1, 1024, 4096, 4096, 1024, 128]
    - [58, 51.8]
  - - [4096, 128, 1, 2048, 4096, 4096, 2048, 128]
    - [58, 73.41]
  - - [4096, 128, 1, 4096, 4096, 4096, 4096, 128]
    - [58, 93.08]
  - - [4096, 128, 1, 8192, 4096, 4096, 8192, 128]
    - [58, 107.03]
  - - [4096, 256, 1, 128, 4096, 4096, 128, 256]
    - [43, 20.11]
  - - [4096, 256, 1, 256, 4096, 4096, 256, 256]
    - [53, 36.11]
  - - [4096, 256, 1, 512, 4096, 4096, 512, 256]
    - [58, 60.95]
  - - [4096, 256, 1, 1024, 4096, 4096, 1024, 256]
    - [58, 98.43]
  - - [4096, 256, 1, 2048, 4096, 4096, 2048, 256]
    - [58, 141.46]
  - - [4096, 256, 1, 4096, 4096, 4096, 4096, 256]
    - [58, 178.84]
  - - [4096, 256, 1, 8192, 4096, 4096, 8192, 256]
    - [58, 204.98]
  - - [4096, 512, 1, 128, 4096, 4096, 128, 512]
    - [35, 31.51]
  - - [4096, 512, 1, 256, 4096, 4096, 256, 512]
    - [36, 56.97]
  - - [4096, 512, 1, 512, 4096, 4096, 512, 512]
    - [36, 99.66]
  - - [4096, 512, 1, 1024, 4096, 4096, 1024, 512]
    - [52, 157.67]
  - - [4096, 512, 1, 2048, 4096, 4096, 2048, 512]
    - [51, 227.64]
  - - [4096, 512, 1, 4096, 4096, 4096, 4096, 512]
    - [52, 291.23]
  - - [4096, 512, 1, 8192, 4096, 4096, 8192, 512]
    - [52, 346.85]
  - - [4096, 1024, 1, 128, 4096, 4096, 128, 1024]
    - [31, 41.64]
  - - [4096, 1024, 1, 256, 4096, 4096, 256, 1024]
    - [32, 74.34]
  - - [4096, 1024, 1, 512, 4096, 4096, 512, 1024]
    - [33, 131.08]
  - - [4096, 1024, 1, 1024, 4096, 4096, 1024, 1024]
    - [34, 214.13]
  - - [4096, 1024, 1, 2048, 4096, 4096, 2048, 1024]
    - [33, 320.13]
  - - [4096, 1024, 1, 4096, 4096, 4096, 4096, 1024]
    - [34, 420.54]
  - - [4096, 1024, 1, 8192, 4096, 4096, 8192, 1024]
    - [33, 486.94]
  - - [4096, 2048, 1, 128, 4096, 4096, 128, 2048]
    - [5, 53.06]
  - - [4096, 2048, 1, 256, 4096, 4096, 256, 2048]
    - [5, 97.51]
  - - [4096, 2048, 1, 512, 4096, 4096, 512, 2048]
    - [18, 166.91]
  - - [4096, 2048, 1, 1024, 4096, 4096, 1024, 2048]
    - [25, 272.87]
  - - [4096, 2048, 1, 2048, 4096, 4096, 2048, 2048]
    - [27, 420.34]
  - - [4096, 2048, 1, 4096, 4096, 4096, 4096, 2048]
    - [27, 535.04]
  - - [4096, 2048, 1, 8192, 4096, 4096, 8192, 2048]
    - [26, 612.73]
  - - [4096, 4096, 1, 128, 4096, 4096, 128, 4096]
    - [1, 60.05]
  - - [4096, 4096, 1, 256, 4096, 4096, 256, 4096]
    - [16, 111.93]
  - - [4096, 4096, 1, 512, 4096, 4096, 512, 4096]
    - [16, 201.48]
  - - [4096, 4096, 1, 1024, 4096, 4096, 1024, 4096]
    - [16, 336.38]
  - - [4096, 4096, 1, 2048, 4096, 4096, 2048, 4096]
    - [16, 494.6]
  - - [4096, 4096, 1, 4096, 4096, 4096, 4096, 4096]
    - [21, 653.71]
  - - [4096, 4096, 1, 8192, 4096, 4096, 8192, 4096]
    - [21, 773.29]
  - - [4096, 8192, 1, 128, 4096, 4096, 128, 8192]
    - [17, 65.73]
  - - [4096, 8192, 1, 256, 4096, 4096, 256, 8192]
    - [13, 119.69]
  - - [4096, 8192, 1, 512, 4096, 4096, 512, 8192]
    - [11, 213.33]
  - - [4096, 8192, 1, 1024, 4096, 4096, 1024, 8192]
    - [21, 352.09]
  - - [4096, 8192, 1, 2048, 4096, 4096, 2048, 8192]
    - [21, 515.89]
  - - [4096, 8192, 1, 4096, 4096, 4096, 4096, 8192]
    - [21, 669.03]
  - - [4096, 8192, 1, 8192, 4096, 4096, 8192, 8192]
    - [21, 825.62]
  - - [8192, 128, 1, 128, 8192, 8192, 128, 128]
    - [43, 20.21]
  - - [8192, 128, 1, 256, 8192, 8192, 256, 128]
    - [53, 35.67]
  - - [8192, 128, 1, 512, 8192, 8192, 512, 128]
    - [55, 60.3]
  - - [8192, 128, 1, 1024, 8192, 8192, 1024, 128]
    - [58, 97.58]
  - - [8192, 128, 1, 2048, 8192, 8192, 2048, 128]
    - [58, 139.37]
  - - [8192, 128, 1, 4096, 8192, 8192, 4096, 128]
    - [58, 174.13]
  - - [8192, 128, 1, 8192, 8192, 8192, 8192, 128]
    - [58, 200.69]
  - - [8192, 256, 1, 128, 8192, 8192, 128, 256]
    - [37, 32.32]
  - - [8192, 256, 1, 256, 8192, 8192, 256, 256]
    - [40, 58.06]
  - - [8192, 256, 1, 512, 8192, 8192, 512, 256]
    - [40, 100.73]
  - - [8192, 256, 1, 1024, 8192, 8192, 1024, 256]
    - [52, 157.12]
  - - [8192, 256, 1, 2048, 8192, 8192, 2048, 256]
    - [51, 227.95]
  - - [8192, 256, 1, 4096, 8192, 8192, 4096, 256]
    - [52, 298.02]
  - - [8192, 256, 1, 8192, 8192, 8192, 8192, 256]
    - [51, 346.91]
  - - [8192, 512, 1, 128, 8192, 8192, 128, 512]
    - [47, 40.38]
  - - [8192, 512, 1, 256, 8192, 8192, 256, 512]
    - [32, 72.51]
  - - [8192, 512, 1, 512, 8192, 8192, 512, 512]
    - [32, 133.63]
  - - [8192, 512, 1, 1024, 8192, 8192, 1024, 512]
    - [34, 213.8]
  - - [8192, 512, 1, 2048, 8192, 8192, 2048, 512]
    - [34, 322.34]
  - - [8192, 512, 1, 4096, 8192, 8192, 4096, 512]
    - [34, 418.18]
  - - [8192, 512, 1, 8192, 8192, 8192, 8192, 512]
    - [33, 492.81]
  - - [8192, 1024, 1, 128, 8192, 8192, 128, 1024]
    - [17, 54.25]
  - - [8192, 1024, 1, 256, 8192, 8192, 256, 1024]
    - [18, 98.38]
  - - [8192, 1024, 1, 512, 8192, 8192, 512, 1024]
    - [18, 170.88]
  - - [8192, 1024, 1, 1024, 8192, 8192, 1024, 1024]
    - [17, 273.63]
  - - [8192, 1024, 1, 2048, 8192, 8192, 2048, 1024]
    - [25, 408.2]
  - - [8192, 1024, 1, 4096, 8192, 8192, 4096, 1024]
    - [27, 533.49]
  - - [8192, 1024, 1, 8192, 8192, 8192, 8192, 1024]
    - [23, 597.79]
  - - [8192, 2048, 1, 128, 8192, 8192, 128, 2048]
    - [3, 59.34]
  - - [8192, 2048, 1, 256, 8192, 8192, 256, 2048]
    - [16, 111.34]
  - - [8192, 2048, 1, 512, 8192, 8192, 512, 2048]
    - [16, 201.04]
  - - [8192, 2048, 1, 1024, 8192, 8192, 1024, 2048]
    - [21, 330.97]
  - - [8192, 2048, 1, 2048, 8192, 8192, 2048, 2048]
    - [19, 495.28]
  - - [8192, 2048, 1, 4096, 8192, 8192, 4096, 2048]
    - [22, 654.52]
  - - [8192, 2048, 1, 8192, 8192, 8192, 8192, 2048]
    - [21, 753.95]
  - - [8192, 4096, 1, 128, 8192, 8192, 128, 4096]
    - [2, 64.55]
  - - [8192, 4096, 1, 256, 8192, 8192, 256, 4096]
    - [15, 120.35]
  - - [8192, 4096, 1, 512, 8192, 8192, 512, 4096]
    - [15, 213.7]
  - - [8192, 4096, 1, 1024, 8192, 8192, 1024, 4096]
    - [19, 356.1]
  - - [8192, 4096, 1, 2048, 8192, 8192, 2048, 4096]
    - [21, 510.91]
  - - [8192, 4096, 1, 4096, 8192, 8192, 4096, 4096]
    - [21, 674.13]
  - - [8192, 4096, 1, 8192, 8192, 8192, 8192, 4096]
    - [20, 828.91]
  - - [8192, 8192, 1, 128, 8192, 8192, 128, 8192]
    - [15, 71.46]
  - - [8192, 8192, 1, 256, 8192, 8192, 256, 8192]
    - [12, 133.28]
  - - [8192, 8192, 1, 512, 8192, 8192, 512, 8192]
    - [15, 232.68]
  - - [8192, 8192, 1, 1024, 8192, 8192, 1024, 8192]
    - [14, 372.67]
  - - [8192, 8192, 1, 2048, 8192, 8192, 2048, 8192]
    - [21, 539.04]
  - - [8192, 8192, 1, 4096, 8192, 8192, 4096, 8192]
    - [19, 725.61]
  - - [8192, 8192, 1, 8192, 8192, 8192, 8192, 8192]
    - [21, 897.36]
- null
- null
- DeviceEfficiency
- GridBased
