projects/hipblaslt/library/src/amd_detail/rocblaslt/src/Tensile/Logic/asm_full/gfx950/gfx950/GridBased/gfx950_Cijk_Alik_Bljk_I8II_BH_UserArgs.yaml
- {MinimumRequiredVersion: 5.0.0}
- gfx950
- gfx950
- [Device 75a0]
    SolutionIndex: 0
    SolutionNameMin: Cijk_Alik_Bljk_I8II_BH_UserArgs_MT128x256x64_MI16x16x1_SN_LDSB1_AFC0_AFEM1_AFEM1_ASEM1_CLR0_CADS0_DTVA0_DTVB0_EPS0_FDSI0_GRPM1_GRVWA16_GRVWB16_GSU0_GSUAMB_GSUC0_GSUWGMRR0_GLS0_ISA950_IU1_K1_LBSPPA256_LBSPPB512_LBSPPM0_LPA32_LPB32_LPM0_LRVW16_LWPMn1_MIAV0_MIWT4_8_MO40_NTn1_NTA0_NTB0_NTC0_NTD0_NTM0_NEPBS0_NLCA1_NLCB1_ONLL1_PGR2_PLR0_PKA1_SIA3_SS1_SU0_SUM1_SUS64_SPO0_SRVW0_SSO0_SVW4_SK3_SKXCCM8_TLDS1_ULSGRO0_USL1_UIOFGRO0_USFGRO0_VSn1_VWA4_VWB8_WSGRA0_WSGRB0_WS64_WG32_8_1_WGM6_WGMXCC1_WGMXCCGn1
    SolutionIndex: 1
    SolutionNameMin: Cijk_Alik_Bljk_I8II_BH_UserArgs_MT128x128x64_MI16x16x1_SN_LDSB1_AFC0_AFEM1_AFEM1_ASEM1_CLR0_CADS0_DTVA0_DTVB0_EPS0_FDSI0_GRPM1_GRVWA16_GRVWB4_GSU0_GSUAMB_GSUC0_GSUWGMRR0_GLS0_ISA950_IU1_K1_LBSPPA256_LBSPPB256_LBSPPM0_LPA32_LPB32_LPM0_LRVW16_LWPMn1_MIAV0_MIWT4_4_MO40_NTn1_NTA0_NTB0_NTC0_NTD0_NTM0_NEPBS0_NLCA1_NLCB1_ONLL1_PGR2_PLR0_PKA1_SIA3_SS1_SU0_SUM1_SUS64_SPO0_SRVW0_SSO0_SVW4_SK3_SKXCCM8_TLDS1_ULSGRO0_USL1_UIOFGRO0_USFGRO0_VSn1_VWA4_VWB4_WSGRA0_WSGRB0_WS64_WG32_8_1_WGM6_WGMXCC1_WGMXCCGn1
    SolutionIndex: 2
    SolutionNameMin: Cijk_Alik_Bljk_I8II_BH_UserArgs_MT128x128x64_MI16x16x1_SN_LDSB1_AFC0_AFEM1_AFEM1_ASEM1_CLR0_CADS0_DTVA0_DTVB0_EPS0_FDSI0_GRPM1_GRVWA4_GRVWB16_GSU0_GSUAMB_GSUC0_GSUWGMRR0_GLS0_ISA950_IU1_K1_LBSPPA256_LBSPPB128_LBSPPM0_LPA32_LPB32_LPM0_LRVW16_LWPMn1_MIAV0_MIWT4_4_MO40_NTn1_NTA0_NTB0_NTC0_NTD0_NTM0_NEPBS0_NLCA1_NLCB1_ONLL1_PGR2_PLR0_PKA1_SIA3_SS1_SU0_SUM1_SUS64_SPO0_SRVW0_SSO0_SVW4_SK3_SKXCCM8_TLDS1_ULSGRO0_USL1_UIOFGRO0_USFGRO0_VSn1_VWA4_VWB2_WSGRA0_WSGRB0_WS64_WG32_8_1_WGM6_WGMXCC1_WGMXCCGn1
    SolutionIndex: 3
    SolutionNameMin: Cijk_Alik_Bljk_I8II_BH_UserArgs_MT128x128x64_MI16x16x1_SN_LDSB1_AFC0_AFEM1_AFEM1_ASEM1_CLR0_CADS0_DTVA0_DTVB0_EPS0_FDSI0_GRPM1_GRVWA4_GRVWB16_GSU0_GSUAMB_GSUC0_GSUWGMRR0_GLS0_ISA950_IU1_K1_LBSPPA256_LBSPPB256_LBSPPM0_LPA32_LPB32_LPM0_LRVW16_LWPMn1_MIAV0_MIWT4_4_MO40_NTn1_NTA0_NTB0_NTC0_NTD0_NTM0_NEPBS0_NLCA1_NLCB1_ONLL1_PGR2_PLR0_PKA1_SIA3_SS1_SU0_SUM1_SUS64_SPO0_SRVW0_SSO0_SVW4_SK3_SKXCCM8_TLDS1_ULSGRO0_USL1_UIOFGRO0_USFGRO0_VSn1_VWA4_VWB4_WSGRA0_WSGRB0_WS64_WG32_8_1_WGM6_WGMXCC1_WGMXCCGn1
    SolutionIndex: 4
    SolutionNameMin: Cijk_Alik_Bljk_I8II_BH_UserArgs_MT128x128x64_MI16x16x1_SN_LDSB1_AFC0_AFEM1_AFEM1_ASEM1_CLR0_CADS0_DTVA0_DTVB0_EPS0_FDSI0_GRPM1_GRVWA16_GRVWB16_GSU0_GSUAMB_GSUC0_GSUWGMRR0_GLS0_ISA950_IU1_K1_LBSPPA128_LBSPPB256_LBSPPM0_LPA32_LPB32_LPM0_LRVW16_LWPMn1_MIAV0_MIWT4_4_MO40_NTn1_NTA0_NTB0_NTC0_NTD0_NTM0_NEPBS0_NLCA1_NLCB1_ONLL1_PGR2_PLR0_PKA1_SIA3_SS1_SU0_SUM1_SUS64_SPO0_SRVW0_SSO0_SVW2_SK3_SKXCCM8_TLDS1_ULSGRO0_USL1_UIOFGRO0_USFGRO0_VSn1_VWA2_VWB4_WSGRA0_WSGRB0_WS64_WG32_8_1_WGM6_WGMXCC1_WGMXCCGn1
    SolutionIndex: 5
    SolutionNameMin: Cijk_Alik_Bljk_I8II_BH_UserArgs_MT128x64x64_MI16x16x1_SN_LDSB0_AFC0_AFEM1_AFEM1_ASEM1_CLR0_CADS0_DTVA0_DTVB0_EPS0_FDSI0_GRPM1_GRVWA16_GRVWB16_GSU0_GSUAMB_GSUC0_GSUWGMRR0_GLS0_ISA950_IU1_K1_LBSPPA256_LBSPPB128_LBSPPM0_LPA32_LPB32_LPM0_LRVW16_LWPMn1_MIAV0_MIWT4_2_MO40_NTn1_NTA0_NTB0_NTC0_NTD0_NTM0_NEPBS0_NLCA1_NLCB1_ONLL1_PGR2_PLR0_PKA1_SIA3_SS1_SU0_SUM1_SUS64_SPO0_SRVW0_SSO0_SVW4_SK3_SKXCCM8_TLDS1_ULSGRO0_USL1_UIOFGRO0_USFGRO0_VSn1_VWA4_VWB2_WSGRA0_WSGRB0_WS64_WG32_8_1_WGM6_WGMXCC1_WGMXCCGn1
    SolutionIndex: 6
    SolutionNameMin: Cijk_Alik_Bljk_I8II_BH_UserArgs_MT64x64x64_MI16x16x1_SN_LDSB0_AFC0_AFEM1_AFEM1_ASEM1_CLR0_CADS0_DTVA0_DTVB0_EPS0_FDSI0_GRPM1_GRVWA16_GRVWB4_GSU0_GSUAMB_GSUC0_GSUWGMRR0_GLS0_ISA950_IU1_K1_LBSPPA128_LBSPPB128_LBSPPM0_LPA32_LPB32_LPM0_LRVW16_LWPMn1_MIAV0_MIWT2_2_MO40_NTn1_NTA0_NTB0_NTC0_NTD0_NTM0_NEPBS0_NLCA1_NLCB1_ONLL1_PGR2_PLR0_PKA1_SIA3_SS1_SU0_SUM1_SUS64_SPO0_SRVW0_SSO0_SVW2_SK3_SKXCCM8_TLDS1_ULSGRO0_USL1_UIOFGRO0_USFGRO0_VSn1_VWA2_VWB2_WSGRA0_WSGRB0_WS64_WG32_8_1_WGM6_WGMXCC1_WGMXCCGn1
    SolutionIndex: 7
    SolutionNameMin: Cijk_Alik_Bljk_I8II_BH_UserArgs_MT64x64x64_MI16x16x1_SN_LDSB0_AFC0_AFEM1_AFEM1_ASEM1_CLR0_CADS0_DTVA0_DTVB0_EPS0_FDSI0_GRPM1_GRVWA16_GRVWB8_GSU0_GSUAMB_GSUC0_GSUWGMRR0_GLS0_ISA950_IU1_K1_LBSPPA128_LBSPPB128_LBSPPM0_LPA32_LPB32_LPM0_LRVW16_LWPMn1_MIAV0_MIWT2_2_MO40_NTn1_NTA0_NTB0_NTC0_NTD0_NTM0_NEPBS0_NLCA1_NLCB1_ONLL1_PGR2_PLR0_PKA1_SIA3_SS1_SU0_SUM1_SUS64_SPO0_SRVW0_SSO0_SVW2_SK3_SKXCCM8_TLDS1_ULSGRO0_USL1_UIOFGRO0_USFGRO0_VSn1_VWA2_VWB2_WSGRA0_WSGRB0_WS64_WG32_8_1_WGM6_WGMXCC1_WGMXCCGn1
    SolutionIndex: 8
    SolutionNameMin: Cijk_Alik_Bljk_I8II_BH_UserArgs_MT64x64x64_MI16x16x1_SN_LDSB0_AFC0_AFEM1_AFEM1_ASEM1_CLR0_CADS0_DTVA0_DTVB0_EPS0_FDSI0_GRPM1_GRVWA4_GRVWB16_GSU0_GSUAMB_GSUC0_GSUWGMRR0_GLS0_ISA950_IU1_K1_LBSPPA128_LBSPPB128_LBSPPM0_LPA32_LPB32_LPM0_LRVW16_LWPMn1_MIAV0_MIWT2_2_MO40_NTn1_NTA0_NTB0_NTC0_NTD0_NTM0_NEPBS0_NLCA1_NLCB1_ONLL1_PGR2_PLR0_PKA1_SIA3_SS1_SU0_SUM1_SUS64_SPO0_SRVW0_SSO0_SVW2_SK3_SKXCCM8_TLDS1_ULSGRO0_USL1_UIOFGRO0_USFGRO0_VSn1_VWA2_VWB2_WSGRA0_WSGRB0_WS64_WG32_8_1_WGM6_WGMXCC1_WGMXCCGn1
    SolutionIndex: 9
    SolutionNameMin: Cijk_Alik_Bljk_I8II_BH_UserArgs_MT64x64x64_MI16x16x1_SN_LDSB0_AFC0_AFEM1_AFEM1_ASEM1_CLR0_CADS0_DTVA0_DTVB0_EPS0_FDSI0_GRPM1_GRVWA8_GRVWB16_GSU0_GSUAMB_GSUC0_GSUWGMRR0_GLS0_ISA950_IU1_K1_LBSPPA128_LBSPPB128_LBSPPM0_LPA32_LPB32_LPM0_LRVW16_LWPMn1_MIAV0_MIWT2_2_MO40_NTn1_NTA0_NTB0_NTC0_NTD0_NTM0_NEPBS0_NLCA1_NLCB1_ONLL1_PGR2_PLR0_PKA1_SIA3_SS1_SU0_SUM1_SUS64_SPO0_SRVW0_SSO0_SVW2_SK3_SKXCCM8_TLDS1_ULSGRO0_USL1_UIOFGRO0_USFGRO0_VSn1_VWA2_VWB2_WSGRA0_WSGRB0_WS64_WG32_8_1_WGM6_WGMXCC1_WGMXCCGn1
    SolutionIndex: 10
    SolutionNameMin: Cijk_Alik_Bljk_I8II_BH_UserArgs_MT64x64x64_MI16x16x1_SN_LDSB0_AFC0_AFEM1_AFEM1_ASEM1_CLR0_CADS0_DTVA0_DTVB0_EPS0_FDSI0_GRPM1_GRVWA16_GRVWB16_GSU0_GSUAMB_GSUC0_GSUWGMRR0_GLS0_ISA950_IU1_K1_LBSPPA128_LBSPPB128_LBSPPM0_LPA32_LPB32_LPM0_LRVW16_LWPMn1_MIAV0_MIWT2_2_MO40_NTn1_NTA0_NTB0_NTC0_NTD0_NTM0_NEPBS0_NLCA1_NLCB1_ONLL1_PGR2_PLR0_PKA1_SIA3_SS1_SU0_SUM1_SUS64_SPO0_SRVW0_SSO0_SVW2_SK3_SKXCCM8_TLDS1_ULSGRO0_USL1_UIOFGRO0_USFGRO0_VSn1_VWA2_VWB2_WSGRA0_WSGRB0_WS64_WG32_8_1_WGM6_WGMXCC1_WGMXCCGn1
    SolutionIndex: 11
    SolutionNameMin: Cijk_Alik_Bljk_I8II_BH_UserArgs_MT256x256x64_MI32x32x1_SN_LDSB0_AFC0_AFEM1_AFEM1_ASEM1_CLR1_CADS0_DTVA0_DTVB0_EPS0_FDSI0_GRPM1_GRVWA8_GRVWB16_GSU0_GSUAMB_GSUC0_GSUWGMRR0_GLS0_ISA950_IU1_K1_LBSPPA256_LBSPPB256_LBSPPM0_LPA16_LPB16_LPM0_LRVW16_LWPMn1_MIAV0_MIWT4_4_MO40_NTn1_NTA0_NTB0_NTC0_NTD0_NTM0_NEPBS0_NLCA1_NLCB1_ONLL1_PGR2_PLR1_PKA1_SIA3_SS1_SU0_SUM1_SUS64_SPO0_SRVW0_SSO0_SVW4_SK3_SKXCCM8_TLDS1_ULSGRO0_USL1_UIOFGRO0_USFGRO0_VSn1_VWA4_VWB4_WSGRA0_WSGRB0_WS64_WG64_4_1_WGM6_WGMXCC1_WGMXCCGn1
    SolutionIndex: 12
    SolutionNameMin: Cijk_Alik_Bljk_I8II_BH_UserArgs_MT256x256x64_MI32x32x1_SN_LDSB0_AFC0_AFEM1_AFEM1_ASEM1_CLR0_CADS0_DTVA0_DTVB0_EPS0_FDSI0_GRPM1_GRVWA4_GRVWB16_GSU0_GSUAMB_GSUC0_GSUWGMRR0_GLS0_ISA950_IU1_K1_LBSPPA256_LBSPPB128_LBSPPM0_LPA16_LPB16_LPM0_LRVW16_LWPMn1_MIAV0_MIWT4_4_MO40_NTn1_NTA0_NTB0_NTC0_NTD0_NTM0_NEPBS0_NLCA1_NLCB1_ONLL1_PGR2_PLR0_PKA1_SIA3_SS1_SU0_SUM1_SUS64_SPO0_SRVW0_SSO0_SVW4_SK3_SKXCCM8_TLDS1_ULSGRO0_USL1_UIOFGRO0_USFGRO0_VSn1_VWA4_VWB2_WSGRA0_WSGRB0_WS64_WG64_4_1_WGM6_WGMXCC1_WGMXCCGn1
    SolutionIndex: 13
    SolutionNameMin: Cijk_Alik_Bljk_I8II_BH_UserArgs_MT256x256x64_MI32x32x1_SN_LDSB0_AFC0_AFEM1_AFEM1_ASEM1_CLR0_CADS0_DTVA0_DTVB0_EPS0_FDSI0_GRPM1_GRVWA4_GRVWB16_GSU0_GSUAMB_GSUC0_GSUWGMRR0_GLS0_ISA950_IU1_K1_LBSPPA256_LBSPPB256_LBSPPM0_LPA16_LPB16_LPM0_LRVW16_LWPMn1_MIAV0_MIWT4_4_MO40_NTn1_NTA0_NTB0_NTC0_NTD0_NTM0_NEPBS0_NLCA1_NLCB1_ONLL1_PGR2_PLR0_PKA1_SIA3_SS1_SU0_SUM1_SUS64_SPO0_SRVW0_SSO0_SVW4_SK3_SKXCCM8_TLDS1_ULSGRO0_USL1_UIOFGRO0_USFGRO0_VSn1_VWA4_VWB4_WSGRA0_WSGRB0_WS64_WG64_4_1_WGM6_WGMXCC1_WGMXCCGn1
    SolutionIndex: 14
    SolutionNameMin: Cijk_Alik_Bljk_I8II_BH_UserArgs_MT256x256x64_MI32x32x1_SN_LDSB0_AFC0_AFEM1_AFEM1_ASEM1_CLR0_CADS0_DTVA0_DTVB0_EPS0_FDSI0_GRPM1_GRVWA8_GRVWB16_GSU0_GSUAMB_GSUC0_GSUWGMRR0_GLS0_ISA950_IU1_K1_LBSPPA256_LBSPPB128_LBSPPM0_LPA16_LPB16_LPM0_LRVW16_LWPMn1_MIAV0_MIWT4_4_MO40_NTn1_NTA0_NTB0_NTC0_NTD0_NTM0_NEPBS0_NLCA1_NLCB1_ONLL1_PGR2_PLR0_PKA1_SIA3_SS1_SU0_SUM1_SUS64_SPO0_SRVW0_SSO0_SVW4_SK3_SKXCCM8_TLDS1_ULSGRO0_USL1_UIOFGRO0_USFGRO0_VSn1_VWA4_VWB2_WSGRA0_WSGRB0_WS64_WG64_4_1_WGM6_WGMXCC1_WGMXCCGn1
    SolutionIndex: 15
    SolutionNameMin: Cijk_Alik_Bljk_I8II_BH_UserArgs_MT256x256x64_MI32x32x1_SN_LDSB0_AFC0_AFEM1_AFEM1_ASEM1_CLR0_CADS0_DTVA0_DTVB0_EPS0_FDSI0_GRPM1_GRVWA8_GRVWB16_GSU0_GSUAMB_GSUC0_GSUWGMRR0_GLS0_ISA950_IU1_K1_LBSPPA256_LBSPPB256_LBSPPM0_LPA16_LPB16_LPM0_LRVW16_LWPMn1_MIAV0_MIWT4_4_MO40_NTn1_NTA0_NTB0_NTC0_NTD0_NTM0_NEPBS0_NLCA1_NLCB1_ONLL1_PGR2_PLR0_PKA1_SIA3_SS1_SU0_SUM1_SUS64_SPO0_SRVW0_SSO0_SVW4_SK3_SKXCCM8_TLDS1_ULSGRO0_USL1_UIOFGRO0_USFGRO0_VSn1_VWA4_VWB4_WSGRA0_WSGRB0_WS64_WG64_4_1_WGM6_WGMXCC1_WGMXCCGn1
    SolutionIndex: 16
    SolutionNameMin: Cijk_Alik_Bljk_I8II_BH_UserArgs_MT256x256x64_MI32x32x1_SN_LDSB0_AFC0_AFEM1_AFEM1_ASEM1_CLR0_CADS0_DTVA0_DTVB0_EPS0_FDSI0_GRPM1_GRVWA16_GRVWB16_GSU0_GSUAMB_GSUC0_GSUWGMRR0_GLS0_ISA950_IU1_K1_LBSPPA256_LBSPPB128_LBSPPM0_LPA16_LPB16_LPM0_LRVW16_LWPMn1_MIAV0_MIWT4_4_MO40_NTn1_NTA0_NTB0_NTC0_NTD0_NTM0_NEPBS0_NLCA1_NLCB1_ONLL1_PGR2_PLR0_PKA1_SIA3_SS1_SU0_SUM1_SUS64_SPO0_SRVW0_SSO0_SVW4_SK3_SKXCCM8_TLDS1_ULSGRO0_USL1_UIOFGRO0_USFGRO0_VSn1_VWA4_VWB2_WSGRA0_WSGRB0_WS64_WG64_4_1_WGM6_WGMXCC1_WGMXCCGn1
    SolutionIndex: 17
    SolutionNameMin: Cijk_Alik_Bljk_I8II_BH_UserArgs_MT256x256x64_MI32x32x1_SN_LDSB0_AFC0_AFEM1_AFEM1_ASEM1_CLR0_CADS0_DTVA0_DTVB0_EPS0_FDSI0_GRPM1_GRVWA16_GRVWB16_GSU0_GSUAMB_GSUC0_GSUWGMRR0_GLS0_ISA950_IU1_K1_LBSPPA256_LBSPPB256_LBSPPM0_LPA16_LPB16_LPM0_LRVW16_LWPMn1_MIAV0_MIWT4_4_MO40_NTn1_NTA0_NTB0_NTC0_NTD0_NTM0_NEPBS0_NLCA1_NLCB1_ONLL1_PGR2_PLR0_PKA1_SIA3_SS1_SU0_SUM1_SUS64_SPO0_SRVW0_SSO0_SVW4_SK3_SKXCCM8_TLDS1_ULSGRO0_USL1_UIOFGRO0_USFGRO0_VSn1_VWA4_VWB4_WSGRA0_WSGRB0_WS64_WG64_4_1_WGM6_WGMXCC1_WGMXCCGn1
    SolutionIndex: 18
    SolutionNameMin: Cijk_Alik_Bljk_I8II_BH_UserArgs_MT256x128x64_MI32x32x1_SN_LDSB1_AFC0_AFEM1_AFEM1_ASEM1_CLR1_CADS0_DTVA0_DTVB0_EPS0_FDSI0_GRPM1_GRVWA16_GRVWB16_GSU0_GSUAMB_GSUC0_GSUWGMRR0_GLS0_ISA950_IU1_K1_LBSPPA256_LBSPPB128_LBSPPM0_LPA16_LPB16_LPM0_LRVW16_LWPMn1_MIAV0_MIWT4_2_MO40_NTn1_NTA0_NTB0_NTC0_NTD0_NTM0_NEPBS0_NLCA1_NLCB1_ONLL1_PGR2_PLR1_PKA1_SIA3_SS1_SU0_SUM1_SUS64_SPO0_SRVW0_SSO0_SVW4_SK3_SKXCCM8_TLDS1_ULSGRO0_USL1_UIOFGRO0_USFGRO0_VSn1_VWA4_VWB2_WSGRA0_WSGRB0_WS64_WG64_4_1_WGM6_WGMXCC1_WGMXCCGn1
    SolutionIndex: 19
    SolutionNameMin: Cijk_Alik_Bljk_I8II_BH_UserArgs_MT128x128x64_MI32x32x1_SN_LDSB1_AFC0_AFEM1_AFEM1_ASEM1_CLR1_CADS0_DTVA0_DTVB0_EPS0_FDSI0_GRPM1_GRVWA16_GRVWB16_GSU0_GSUAMB_GSUC0_GSUWGMRR0_GLS0_ISA950_IU1_K1_LBSPPA128_LBSPPB128_LBSPPM0_LPA16_LPB16_LPM0_LRVW16_LWPMn1_MIAV0_MIWT2_2_MO40_NTn1_NTA0_NTB0_NTC0_NTD0_NTM0_NEPBS0_NLCA1_NLCB1_ONLL1_PGR2_PLR1_PKA1_SIA3_SS1_SU0_SUM1_SUS64_SPO0_SRVW0_SSO0_SVW2_SK3_SKXCCM8_TLDS1_ULSGRO0_USL1_UIOFGRO0_USFGRO0_VSn1_VWA2_VWB2_WSGRA0_WSGRB0_WS64_WG64_4_1_WGM6_WGMXCC1_WGMXCCGn1
    SolutionIndex: 20
    SolutionNameMin: Cijk_Alik_Bljk_I8II_BH_UserArgs_MT256x256x128_MI16x16x1_SN_LDSB1_AFC0_AFEM1_AFEM1_ASEM1_CLR1_CADS0_DTVA0_DTVB0_EPS0_FDSI0_GRPM1_GRVWA4_GRVWB16_GSU0_GSUAMB_GSUC0_GSUWGMRR0_GLS0_ISA950_IU1_K1_LBSPPA512_LBSPPB1024_LBSPPM0_LPA32_LPB32_LPM0_LRVW16_LWPMn1_MIAV0_MIWT8_8_MO40_NTn1_NTA0_NTB0_NTC0_NTD0_NTM0_NEPBS0_NLCA1_NLCB1_ONLL1_PGR2_PLR1_PKA1_SIA3_SS1_SU0_SUM1_SUS128_SPO0_SRVW0_SSO0_SVW4_SK3_SKXCCM8_TLDS1_ULSGRO0_USL1_UIOFGRO0_USFGRO0_VSn1_VWA4_VWB8_WSGRA0_WSGRB0_WS64_WG32_8_1_WGM6_WGMXCC1_WGMXCCGn1
    SolutionIndex: 21
    SolutionNameMin: Cijk_Alik_Bljk_I8II_BH_UserArgs_MT256x256x128_MI16x16x1_SN_LDSB1_AFC0_AFEM1_AFEM1_ASEM1_CLR1_CADS0_DTVA0_DTVB0_EPS0_FDSI0_GRPM1_GRVWA16_GRVWB16_GSU0_GSUAMB_GSUC0_GSUWGMRR0_GLS0_ISA950_IU1_K1_LBSPPA512_LBSPPB256_LBSPPM0_LPA32_LPB32_LPM0_LRVW16_LWPMn1_MIAV0_MIWT8_8_MO40_NTn1_NTA0_NTB0_NTC0_NTD0_NTM0_NEPBS0_NLCA1_NLCB1_ONLL1_PGR2_PLR1_PKA1_SIA3_SS1_SU0_SUM1_SUS128_SPO0_SRVW0_SSO0_SVW4_SK3_SKXCCM8_TLDS1_ULSGRO0_USL1_UIOFGRO0_USFGRO0_VSn1_VWA4_VWB2_WSGRA0_WSGRB0_WS64_WG32_8_1_WGM6_WGMXCC1_WGMXCCGn1
    SolutionIndex: 22
    SolutionNameMin: Cijk_Alik_Bljk_I8II_BH_UserArgs_MT256x256x128_MI16x16x1_SN_LDSB1_AFC0_AFEM1_AFEM1_ASEM1_CLR1_CADS0_DTVA0_DTVB0_EPS0_FDSI0_GRPM1_GRVWA16_GRVWB16_GSU0_GSUAMB_GSUC0_GSUWGMRR0_GLS0_ISA950_IU1_K1_LBSPPA512_LBSPPB512_LBSPPM0_LPA32_LPB32_LPM0_LRVW16_LWPMn1_MIAV0_MIWT8_8_MO40_NTn1_NTA0_NTB0_NTC0_NTD0_NTM0_NEPBS0_NLCA1_NLCB1_ONLL1_PGR2_PLR1_PKA1_SIA3_SS1_SU0_SUM1_SUS128_SPO0_SRVW0_SSO0_SVW4_SK3_SKXCCM8_TLDS1_ULSGRO0_USL1_UIOFGRO0_USFGRO0_VSn1_VWA4_VWB4_WSGRA0_WSGRB0_WS64_WG32_8_1_WGM6_WGMXCC1_WGMXCCGn1
    SolutionIndex: 23
    SolutionNameMin: Cijk_Alik_Bljk_I8II_BH_UserArgs_MT256x256x128_MI16x16x1_SN_LDSB1_AFC0_AFEM1_AFEM1_ASEM1_CLR1_CADS0_DTVA0_DTVB0_EPS0_FDSI0_GRPM1_GRVWA16_GRVWB16_GSU0_GSUAMB_GSUC0_GSUWGMRR0_GLS0_ISA950_IU1_K1_LBSPPA256_LBSPPB1024_LBSPPM0_LPA32_LPB32_LPM0_LRVW16_LWPMn1_MIAV0_MIWT8_8_MO40_NTn1_NTA0_NTB0_NTC0_NTD0_NTM0_NEPBS0_NLCA1_NLCB1_ONLL1_PGR2_PLR1_PKA1_SIA3_SS1_SU0_SUM1_SUS128_SPO0_SRVW0_SSO0_SVW2_SK3_SKXCCM8_TLDS1_ULSGRO0_USL1_UIOFGRO0_USFGRO0_VSn1_VWA2_VWB8_WSGRA0_WSGRB0_WS64_WG32_8_1_WGM6_WGMXCC1_WGMXCCGn1
    SolutionIndex: 24
    SolutionNameMin: Cijk_Alik_Bljk_I8II_BH_UserArgs_MT256x256x128_MI16x16x1_SN_LDSB1_AFC0_AFEM1_AFEM1_ASEM1_CLR1_CADS0_DTVA0_DTVB0_EPS0_FDSI0_GRPM1_GRVWA16_GRVWB16_GSU0_GSUAMB_GSUC0_GSUWGMRR0_GLS0_ISA950_IU1_K1_LBSPPA512_LBSPPB1024_LBSPPM0_LPA32_LPB32_LPM0_LRVW16_LWPMn1_MIAV0_MIWT8_8_MO40_NTn1_NTA0_NTB0_NTC0_NTD0_NTM0_NEPBS0_NLCA1_NLCB1_ONLL1_PGR2_PLR1_PKA1_SIA3_SS1_SU0_SUM1_SUS128_SPO0_SRVW0_SSO0_SVW4_SK3_SKXCCM8_TLDS1_ULSGRO0_USL1_UIOFGRO0_USFGRO0_VSn1_VWA4_VWB8_WSGRA0_WSGRB0_WS64_WG32_8_1_WGM6_WGMXCC1_WGMXCCGn1
    SolutionIndex: 25
    SolutionNameMin: Cijk_Alik_Bljk_I8II_BH_UserArgs_MT128x256x128_MI16x16x1_SN_LDSB1_AFC0_AFEM1_AFEM1_ASEM1_CLR1_CADS0_DTVA0_DTVB0_EPS0_FDSI0_GRPM1_GRVWA16_GRVWB16_GSU0_GSUAMB_GSUC0_GSUWGMRR0_GLS0_ISA950_IU1_K1_LBSPPA512_LBSPPB512_LBSPPM0_LPA32_LPB32_LPM0_LRVW16_LWPMn1_MIAV0_MIWT4_8_MO40_NTn1_NTA0_NTB0_NTC0_NTD0_NTM0_NEPBS0_NLCA1_NLCB1_ONLL1_PGR2_PLR1_PKA1_SIA3_SS1_SU0_SUM1_SUS128_SPO0_SRVW0_SSO0_SVW4_SK3_SKXCCM8_TLDS1_ULSGRO0_USL1_UIOFGRO0_USFGRO0_VSn1_VWA4_VWB4_WSGRA0_WSGRB0_WS64_WG32_8_1_WGM6_WGMXCC1_WGMXCCGn1
    SolutionIndex: 26
    SolutionNameMin: Cijk_Alik_Bljk_I8II_BH_UserArgs_MT128x256x128_MI16x16x1_SN_LDSB1_AFC0_AFEM1_AFEM1_ASEM1_CLR1_CADS0_DTVA0_DTVB0_EPS0_FDSI0_GRPM1_GRVWA16_GRVWB16_GSU0_GSUAMB_GSUC0_GSUWGMRR0_GLS0_ISA950_IU1_K1_LBSPPA512_LBSPPB1024_LBSPPM0_LPA32_LPB32_LPM0_LRVW16_LWPMn1_MIAV0_MIWT4_8_MO40_NTn1_NTA0_NTB0_NTC0_NTD0_NTM0_NEPBS0_NLCA1_NLCB1_ONLL1_PGR2_PLR1_PKA1_SIA3_SS1_SU0_SUM1_SUS128_SPO0_SRVW0_SSO0_SVW4_SK3_SKXCCM8_TLDS1_ULSGRO0_USL1_UIOFGRO0_USFGRO0_VSn1_VWA4_VWB8_WSGRA0_WSGRB0_WS64_WG32_8_1_WGM6_WGMXCC1_WGMXCCGn1
    SolutionIndex: 27
    SolutionNameMin: Cijk_Alik_Bljk_I8II_BH_UserArgs_MT256x128x128_MI16x16x1_SN_LDSB1_AFC0_AFEM1_AFEM1_ASEM1_CLR1_CADS0_DTVA0_DTVB0_EPS0_FDSI0_GRPM1_GRVWA16_GRVWB16_GSU0_GSUAMB_GSUC0_GSUWGMRR0_GLS0_ISA950_IU1_K1_LBSPPA256_LBSPPB256_LBSPPM0_LPA32_LPB32_LPM0_LRVW16_LWPMn1_MIAV0_MIWT8_4_MO40_NTn1_NTA0_NTB0_NTC0_NTD0_NTM0_NEPBS0_NLCA1_NLCB1_ONLL1_PGR2_PLR1_PKA1_SIA3_SS1_SU0_SUM1_SUS128_SPO0_SRVW0_SSO0_SVW2_SK3_SKXCCM8_TLDS1_ULSGRO0_USL1_UIOFGRO0_USFGRO0_VSn1_VWA2_VWB2_WSGRA0_WSGRB0_WS64_WG32_8_1_WGM6_WGMXCC1_WGMXCCGn1
    SolutionIndex: 28
    SolutionNameMin: Cijk_Alik_Bljk_I8II_BH_UserArgs_MT256x128x128_MI16x16x1_SN_LDSB1_AFC0_AFEM1_AFEM1_ASEM1_CLR1_CADS0_DTVA0_DTVB0_EPS0_FDSI0_GRPM1_GRVWA16_GRVWB16_GSU0_GSUAMB_GSUC0_GSUWGMRR0_GLS0_ISA950_IU1_K1_LBSPPA512_LBSPPB256_LBSPPM0_LPA32_LPB32_LPM0_LRVW16_LWPMn1_MIAV0_MIWT8_4_MO40_NTn1_NTA0_NTB0_NTC0_NTD0_NTM0_NEPBS0_NLCA1_NLCB1_ONLL1_PGR2_PLR1_PKA1_SIA3_SS1_SU0_SUM1_SUS128_SPO0_SRVW0_SSO0_SVW4_SK3_SKXCCM8_TLDS1_ULSGRO0_USL1_UIOFGRO0_USFGRO0_VSn1_VWA4_VWB2_WSGRA0_WSGRB0_WS64_WG32_8_1_WGM6_WGMXCC1_WGMXCCGn1
    SolutionIndex: 29
    SolutionNameMin: Cijk_Alik_Bljk_I8II_BH_UserArgs_MT256x128x128_MI16x16x1_SN_LDSB1_AFC0_AFEM1_AFEM1_ASEM1_CLR1_CADS0_DTVA0_DTVB0_EPS0_FDSI0_GRPM1_GRVWA16_GRVWB16_GSU0_GSUAMB_GSUC0_GSUWGMRR0_GLS0_ISA950_IU1_K1_LBSPPA256_LBSPPB512_LBSPPM0_LPA32_LPB32_LPM0_LRVW16_LWPMn1_MIAV0_MIWT8_4_MO40_NTn1_NTA0_NTB0_NTC0_NTD0_NTM0_NEPBS0_NLCA1_NLCB1_ONLL1_PGR2_PLR1_PKA1_SIA3_SS1_SU0_SUM1_SUS128_SPO0_SRVW0_SSO0_SVW2_SK3_SKXCCM8_TLDS1_ULSGRO0_USL1_UIOFGRO0_USFGRO0_VSn1_VWA2_VWB4_WSGRA0_WSGRB0_WS64_WG32_8_1_WGM6_WGMXCC1_WGMXCCGn1
    SolutionIndex: 30
    SolutionNameMin: Cijk_Alik_Bljk_I8II_BH_UserArgs_MT256x128x128_MI16x16x1_SN_LDSB1_AFC0_AFEM1_AFEM1_ASEM1_CLR1_CADS0_DTVA0_DTVB0_EPS0_FDSI0_GRPM1_GRVWA16_GRVWB16_GSU0_GSUAMB_GSUC0_GSUWGMRR0_GLS0_ISA950_IU1_K1_LBSPPA512_LBSPPB512_LBSPPM0_LPA32_LPB32_LPM0_LRVW16_LWPMn1_MIAV0_MIWT8_4_MO40_NTn1_NTA0_NTB0_NTC0_NTD0_NTM0_NEPBS0_NLCA1_NLCB1_ONLL1_PGR2_PLR1_PKA1_SIA3_SS1_SU0_SUM1_SUS128_SPO0_SRVW0_SSO0_SVW4_SK3_SKXCCM8_TLDS1_ULSGRO0_USL1_UIOFGRO0_USFGRO0_VSn1_VWA4_VWB4_WSGRA0_WSGRB0_WS64_WG32_8_1_WGM6_WGMXCC1_WGMXCCGn1
    SolutionIndex: 31
    SolutionNameMin: Cijk_Alik_Bljk_I8II_BH_UserArgs_MT128x128x128_MI16x16x1_SN_LDSB1_AFC0_AFEM1_AFEM1_ASEM1_CLR1_CADS0_DTVA0_DTVB0_EPS0_FDSI0_GRPM1_GRVWA16_GRVWB16_GSU0_GSUAMB_GSUC0_GSUWGMRR0_GLS0_ISA950_IU1_K1_LBSPPA256_LBSPPB256_LBSPPM0_LPA32_LPB32_LPM0_LRVW16_LWPMn1_MIAV0_MIWT4_4_MO40_NTn1_NTA0_NTB0_NTC0_NTD0_NTM0_NEPBS0_NLCA1_NLCB1_ONLL1_PGR2_PLR1_PKA1_SIA3_SS1_SU0_SUM1_SUS128_SPO0_SRVW0_SSO0_SVW2_SK3_SKXCCM8_TLDS1_ULSGRO0_USL1_UIOFGRO0_USFGRO0_VSn1_VWA2_VWB2_WSGRA0_WSGRB0_WS64_WG32_8_1_WGM6_WGMXCC1_WGMXCCGn1
    SolutionIndex: 32
    SolutionNameMin: Cijk_Alik_Bljk_I8II_BH_UserArgs_MT128x128x128_MI16x16x1_SN_LDSB1_AFC0_AFEM1_AFEM1_ASEM1_CLR1_CADS0_DTVA0_DTVB0_EPS0_FDSI0_GRPM1_GRVWA16_GRVWB16_GSU0_GSUAMB_GSUC0_GSUWGMRR0_GLS0_ISA950_IU1_K1_LBSPPA512_LBSPPB256_LBSPPM0_LPA32_LPB32_LPM0_LRVW16_LWPMn1_MIAV0_MIWT4_4_MO40_NTn1_NTA0_NTB0_NTC0_NTD0_NTM0_NEPBS0_NLCA1_NLCB1_ONLL1_PGR2_PLR1_PKA1_SIA3_SS1_SU0_SUM1_SUS128_SPO0_SRVW0_SSO0_SVW4_SK3_SKXCCM8_TLDS1_ULSGRO0_USL1_UIOFGRO0_USFGRO0_VSn1_VWA4_VWB2_WSGRA0_WSGRB0_WS64_WG32_8_1_WGM6_WGMXCC1_WGMXCCGn1
    SolutionIndex: 33
    SolutionNameMin: Cijk_Alik_Bljk_I8II_BH_UserArgs_MT128x128x128_MI16x16x1_SN_LDSB1_AFC0_AFEM1_AFEM1_ASEM1_CLR1_CADS0_DTVA0_DTVB0_EPS0_FDSI0_GRPM1_GRVWA16_GRVWB16_GSU0_GSUAMB_GSUC0_GSUWGMRR0_GLS0_ISA950_IU1_K1_LBSPPA512_LBSPPB512_LBSPPM0_LPA32_LPB32_LPM0_LRVW16_LWPMn1_MIAV0_MIWT4_4_MO40_NTn1_NTA0_NTB0_NTC0_NTD0_NTM0_NEPBS0_NLCA1_NLCB1_ONLL1_PGR2_PLR1_PKA1_SIA3_SS1_SU0_SUM1_SUS128_SPO0_SRVW0_SSO0_SVW4_SK3_SKXCCM8_TLDS1_ULSGRO0_USL1_UIOFGRO0_USFGRO0_VSn1_VWA4_VWB4_WSGRA0_WSGRB0_WS64_WG32_8_1_WGM6_WGMXCC1_WGMXCCGn1
    SolutionIndex: 34
    SolutionNameMin: Cijk_Alik_Bljk_I8II_BH_UserArgs_MT64x128x128_MI16x16x1_SN_LDSB1_AFC0_AFEM1_AFEM1_ASEM1_CLR1_CADS0_DTVA0_DTVB0_EPS0_FDSI0_GRPM1_GRVWA16_GRVWB16_GSU0_GSUAMB_GSUC0_GSUWGMRR0_GLS0_ISA950_IU1_K1_LBSPPA256_LBSPPB256_LBSPPM0_LPA32_LPB32_LPM0_LRVW16_LWPMn1_MIAV0_MIWT2_4_MO40_NTn1_NTA0_NTB0_NTC0_NTD0_NTM0_NEPBS0_NLCA1_NLCB1_ONLL1_PGR2_PLR1_PKA1_SIA3_SS1_SU0_SUM1_SUS128_SPO0_SRVW0_SSO0_SVW2_SK3_SKXCCM8_TLDS1_ULSGRO0_USL1_UIOFGRO0_USFGRO0_VSn1_VWA2_VWB2_WSGRA0_WSGRB0_WS64_WG32_8_1_WGM6_WGMXCC1_WGMXCCGn1
    SolutionIndex: 35
    SolutionNameMin: Cijk_Alik_Bljk_I8II_BH_UserArgs_MT64x128x128_MI16x16x1_SN_LDSB1_AFC0_AFEM1_AFEM1_ASEM1_CLR1_CADS0_DTVA0_DTVB0_EPS0_FDSI0_GRPM1_GRVWA16_GRVWB16_GSU0_GSUAMB_GSUC0_GSUWGMRR0_GLS0_ISA950_IU1_K1_LBSPPA256_LBSPPB512_LBSPPM0_LPA32_LPB32_LPM0_LRVW16_LWPMn1_MIAV0_MIWT2_4_MO40_NTn1_NTA0_NTB0_NTC0_NTD0_NTM0_NEPBS0_NLCA1_NLCB1_ONLL1_PGR2_PLR1_PKA1_SIA3_SS1_SU0_SUM1_SUS128_SPO0_SRVW0_SSO0_SVW2_SK3_SKXCCM8_TLDS1_ULSGRO0_USL1_UIOFGRO0_USFGRO0_VSn1_VWA2_VWB4_WSGRA0_WSGRB0_WS64_WG32_8_1_WGM6_WGMXCC1_WGMXCCGn1
    SolutionIndex: 36
    SolutionNameMin: Cijk_Alik_Bljk_I8II_BH_UserArgs_MT128x64x128_MI16x16x1_SN_LDSB1_AFC0_AFEM1_AFEM1_ASEM1_CLR1_CADS0_DTVA0_DTVB0_EPS0_FDSI0_GRPM1_GRVWA16_GRVWB16_GSU0_GSUAMB_GSUC0_GSUWGMRR0_GLS0_ISA950_IU1_K1_LBSPPA256_LBSPPB256_LBSPPM0_LPA32_LPB32_LPM0_LRVW16_LWPMn1_MIAV0_MIWT4_2_MO40_NTn1_NTA0_NTB0_NTC0_NTD0_NTM0_NEPBS0_NLCA1_NLCB1_ONLL1_PGR2_PLR1_PKA1_SIA3_SS1_SU0_SUM1_SUS128_SPO0_SRVW0_SSO0_SVW2_SK3_SKXCCM8_TLDS1_ULSGRO0_USL1_UIOFGRO0_USFGRO0_VSn1_VWA2_VWB2_WSGRA0_WSGRB0_WS64_WG32_8_1_WGM6_WGMXCC1_WGMXCCGn1
    SolutionIndex: 37
    SolutionNameMin: Cijk_Alik_Bljk_I8II_BH_UserArgs_MT128x64x128_MI16x16x1_SN_LDSB1_AFC0_AFEM1_AFEM1_ASEM1_CLR1_CADS0_DTVA0_DTVB0_EPS0_FDSI0_GRPM1_GRVWA16_GRVWB16_GSU0_GSUAMB_GSUC0_GSUWGMRR0_GLS0_ISA950_IU1_K1_LBSPPA512_LBSPPB256_LBSPPM0_LPA32_LPB32_LPM0_LRVW16_LWPMn1_MIAV0_MIWT4_2_MO40_NTn1_NTA0_NTB0_NTC0_NTD0_NTM0_NEPBS0_NLCA1_NLCB1_ONLL1_PGR2_PLR1_PKA1_SIA3_SS1_SU0_SUM1_SUS128_SPO0_SRVW0_SSO0_SVW4_SK3_SKXCCM8_TLDS1_ULSGRO0_USL1_UIOFGRO0_USFGRO0_VSn1_VWA4_VWB2_WSGRA0_WSGRB0_WS64_WG32_8_1_WGM6_WGMXCC1_WGMXCCGn1
    SolutionIndex: 38
    SolutionNameMin: Cijk_Alik_Bljk_I8II_BH_UserArgs_MT64x64x128_MI16x16x1_SN_LDSB1_AFC0_AFEM1_AFEM1_ASEM1_CLR1_CADS0_DTVA0_DTVB0_EPS0_FDSI0_GRPM1_GRVWA16_GRVWB4_GSU0_GSUAMB_GSUC0_GSUWGMRR0_GLS0_ISA950_IU1_K1_LBSPPA256_LBSPPB256_LBSPPM0_LPA32_LPB32_LPM0_LRVW16_LWPMn1_MIAV0_MIWT2_2_MO40_NTn1_NTA0_NTB0_NTC0_NTD0_NTM0_NEPBS0_NLCA1_NLCB1_ONLL1_PGR2_PLR1_PKA1_SIA3_SS1_SU0_SUM1_SUS128_SPO0_SRVW0_SSO0_SVW2_SK3_SKXCCM8_TLDS1_ULSGRO0_USL1_UIOFGRO0_USFGRO0_VSn1_VWA2_VWB2_WSGRA0_WSGRB0_WS64_WG32_8_1_WGM6_WGMXCC1_WGMXCCGn1
    SolutionIndex: 39
    SolutionNameMin: Cijk_Alik_Bljk_I8II_BH_UserArgs_MT64x64x128_MI16x16x1_SN_LDSB1_AFC0_AFEM1_AFEM1_ASEM1_CLR1_CADS0_DTVA0_DTVB0_EPS0_FDSI0_GRPM1_GRVWA16_GRVWB8_GSU0_GSUAMB_GSUC0_GSUWGMRR0_GLS0_ISA950_IU1_K1_LBSPPA256_LBSPPB256_LBSPPM0_LPA32_LPB32_LPM0_LRVW16_LWPMn1_MIAV0_MIWT2_2_MO40_NTn1_NTA0_NTB0_NTC0_NTD0_NTM0_NEPBS0_NLCA1_NLCB1_ONLL1_PGR2_PLR1_PKA1_SIA3_SS1_SU0_SUM1_SUS128_SPO0_SRVW0_SSO0_SVW2_SK3_SKXCCM8_TLDS1_ULSGRO0_USL1_UIOFGRO0_USFGRO0_VSn1_VWA2_VWB2_WSGRA0_WSGRB0_WS64_WG32_8_1_WGM6_WGMXCC1_WGMXCCGn1
    SolutionIndex: 40
    SolutionNameMin: Cijk_Alik_Bljk_I8II_BH_UserArgs_MT64x64x128_MI16x16x1_SN_LDSB1_AFC0_AFEM1_AFEM1_ASEM1_CLR1_CADS0_DTVA0_DTVB0_EPS0_FDSI0_GRPM1_GRVWA8_GRVWB16_GSU0_GSUAMB_GSUC0_GSUWGMRR0_GLS0_ISA950_IU1_K1_LBSPPA256_LBSPPB256_LBSPPM0_LPA32_LPB32_LPM0_LRVW16_LWPMn1_MIAV0_MIWT2_2_MO40_NTn1_NTA0_NTB0_NTC0_NTD0_NTM0_NEPBS0_NLCA1_NLCB1_ONLL1_PGR2_PLR1_PKA1_SIA3_SS1_SU0_SUM1_SUS128_SPO0_SRVW0_SSO0_SVW2_SK3_SKXCCM8_TLDS1_ULSGRO0_USL1_UIOFGRO0_USFGRO0_VSn1_VWA2_VWB2_WSGRA0_WSGRB0_WS64_WG32_8_1_WGM6_WGMXCC1_WGMXCCGn1
    SolutionIndex: 41
    SolutionNameMin: Cijk_Alik_Bljk_I8II_BH_UserArgs_MT64x64x128_MI16x16x1_SN_LDSB1_AFC0_AFEM1_AFEM1_ASEM1_CLR1_CADS0_DTVA0_DTVB0_EPS0_FDSI0_GRPM1_GRVWA16_GRVWB16_GSU0_GSUAMB_GSUC0_GSUWGMRR0_GLS0_ISA950_IU1_K1_LBSPPA256_LBSPPB256_LBSPPM0_LPA32_LPB32_LPM0_LRVW16_LWPMn1_MIAV0_MIWT2_2_MO40_NTn1_NTA0_NTB0_NTC0_NTD0_NTM0_NEPBS0_NLCA1_NLCB1_ONLL1_PGR2_PLR1_PKA1_SIA3_SS1_SU0_SUM1_SUS128_SPO0_SRVW0_SSO0_SVW2_SK3_SKXCCM8_TLDS1_ULSGRO0_USL1_UIOFGRO0_USFGRO0_VSn1_VWA2_VWB2_WSGRA0_WSGRB0_WS64_WG32_8_1_WGM6_WGMXCC1_WGMXCCGn1
    SolutionIndex: 42
    SolutionNameMin: Cijk_Alik_Bljk_I8II_BH_UserArgs_MT256x256x128_MI32x32x1_SN_LDSB1_AFC0_AFEM1_AFEM1_ASEM1_CLR1_CADS0_DTVA0_DTVB0_EPS0_FDSI0_GRPM1_GRVWA16_GRVWB16_GSU0_GSUAMB_GSUC0_GSUWGMRR0_GLS0_ISA950_IU1_K1_LBSPPA512_LBSPPB256_LBSPPM0_LPA16_LPB16_LPM0_LRVW16_LWPMn1_MIAV0_MIWT4_4_MO40_NTn1_NTA0_NTB0_NTC0_NTD0_NTM0_NEPBS0_NLCA1_NLCB1_ONLL1_PGR2_PLR1_PKA1_SIA3_SS1_SU0_SUM1_SUS128_SPO0_SRVW0_SSO0_SVW4_SK3_SKXCCM8_TLDS1_ULSGRO0_USL1_UIOFGRO0_USFGRO0_VSn1_VWA4_VWB2_WSGRA0_WSGRB0_WS64_WG64_4_1_WGM6_WGMXCC1_WGMXCCGn1
    SolutionIndex: 43
    SolutionNameMin: Cijk_Alik_Bljk_I8II_BH_UserArgs_MT128x256x128_MI32x32x1_SN_LDSB1_AFC0_AFEM1_AFEM1_ASEM1_CLR1_CADS0_DTVA0_DTVB0_EPS0_FDSI0_GRPM1_GRVWA16_GRVWB16_GSU0_GSUAMB_GSUC0_GSUWGMRR0_GLS0_ISA950_IU1_K1_LBSPPA256_LBSPPB512_LBSPPM0_LPA16_LPB16_LPM0_LRVW16_LWPMn1_MIAV0_MIWT2_4_MO40_NTn1_NTA0_NTB0_NTC0_NTD0_NTM0_NEPBS0_NLCA1_NLCB1_ONLL1_PGR2_PLR1_PKA1_SIA3_SS1_SU0_SUM1_SUS128_SPO0_SRVW0_SSO0_SVW2_SK3_SKXCCM8_TLDS1_ULSGRO0_USL1_UIOFGRO0_USFGRO0_VSn1_VWA2_VWB4_WSGRA0_WSGRB0_WS64_WG64_4_1_WGM6_WGMXCC1_WGMXCCGn1
    SolutionIndex: 44
    SolutionNameMin: Cijk_Alik_Bljk_I8II_BH_UserArgs_MT256x128x128_MI32x32x1_SN_LDSB1_AFC0_AFEM1_AFEM1_ASEM1_CLR1_CADS0_DTVA0_DTVB0_EPS0_FDSI0_GRPM1_GRVWA16_GRVWB16_GSU0_GSUAMB_GSUC0_GSUWGMRR0_GLS0_ISA950_IU1_K1_LBSPPA512_LBSPPB256_LBSPPM0_LPA16_LPB16_LPM0_LRVW16_LWPMn1_MIAV0_MIWT4_2_MO40_NTn1_NTA0_NTB0_NTC0_NTD0_NTM0_NEPBS0_NLCA1_NLCB1_ONLL1_PGR2_PLR1_PKA1_SIA3_SS1_SU0_SUM1_SUS128_SPO0_SRVW0_SSO0_SVW4_SK3_SKXCCM8_TLDS1_ULSGRO0_USL1_UIOFGRO0_USFGRO0_VSn1_VWA4_VWB2_WSGRA0_WSGRB0_WS64_WG64_4_1_WGM6_WGMXCC1_WGMXCCGn1
    SolutionIndex: 45
    SolutionNameMin: Cijk_Alik_Bljk_I8II_BH_UserArgs_MT256x128x128_MI32x32x1_SN_LDSB1_AFC0_AFEM1_AFEM1_ASEM1_CLR1_CADS0_DTVA0_DTVB0_EPS0_FDSI0_GRPM1_GRVWA16_GRVWB16_GSU0_GSUAMB_GSUC0_GSUWGMRR0_GLS0_ISA950_IU1_K1_LBSPPA512_LBSPPB256_LBSPPM0_LPA16_LPB16_LPM0_LRVW16_LWPMn1_MIAV0_MIWT4_2_MO40_NTn1_NTA0_NTB0_NTC0_NTD0_NTM0_NEPBS0_NLCA1_NLCB1_ONLL1_PGR2_PLR2_PKA1_SIA3_SS1_SU0_SUM1_SUS128_SPO0_SRVW0_SSO0_SVW4_SK3_SKXCCM8_TLDS1_ULSGRO0_USL1_UIOFGRO0_USFGRO0_VSn1_VWA4_VWB2_WSGRA0_WSGRB0_WS64_WG64_4_1_WGM6_WGMXCC1_WGMXCCGn1
    SolutionIndex: 46
    SolutionNameMin: Cijk_Alik_Bljk_I8II_BH_UserArgs_MT128x128x128_MI32x32x1_SN_LDSB1_AFC0_AFEM1_AFEM1_ASEM1_CLR1_CADS0_DTVA0_DTVB0_EPS0_FDSI0_GRPM1_GRVWA16_GRVWB16_GSU0_GSUAMB_GSUC0_GSUWGMRR0_GLS0_ISA950_IU1_K1_LBSPPA256_LBSPPB256_LBSPPM0_LPA16_LPB16_LPM0_LRVW16_LWPMn1_MIAV0_MIWT2_2_MO40_NTn1_NTA0_NTB0_NTC0_NTD0_NTM0_NEPBS0_NLCA1_NLCB1_ONLL1_PGR2_PLR1_PKA1_SIA3_SS1_SU0_SUM1_SUS128_SPO0_SRVW0_SSO0_SVW2_SK3_SKXCCM8_TLDS1_ULSGRO0_USL1_UIOFGRO0_USFGRO0_VSn1_VWA2_VWB2_WSGRA0_WSGRB0_WS64_WG64_4_1_WGM6_WGMXCC1_WGMXCCGn1
    SolutionIndex: 47
    SolutionNameMin: Cijk_Alik_Bljk_I8II_BH_UserArgs_MT128x128x256_MI16x16x1_SN_LDSB1_AFC0_AFEM1_AFEM1_ASEM1_CLR1_CADS0_DTVA0_DTVB0_EPS0_FDSI0_GRPM1_GRVWA16_GRVWB16_GSU0_GSUAMB_GSUC0_GSUWGMRR0_GLS0_ISA950_IU1_K1_LBSPPA512_LBSPPB512_LBSPPM0_LPA32_LPB32_LPM0_LRVW16_LWPMn1_MIAV0_MIWT4_4_MO40_NTn1_NTA0_NTB0_NTC0_NTD0_NTM0_NEPBS0_NLCA1_NLCB1_ONLL1_PGR2_PLR1_PKA1_SIA3_SS1_SU0_SUM1_SUS256_SPO0_SRVW0_SSO0_SVW2_SK3_SKXCCM8_TLDS1_ULSGRO0_USL1_UIOFGRO0_USFGRO0_VSn1_VWA2_VWB2_WSGRA0_WSGRB0_WS64_WG32_8_1_WGM6_WGMXCC1_WGMXCCGn1
    SolutionIndex: 48
    SolutionNameMin: Cijk_Alik_Bljk_I8II_BH_UserArgs_MT128x128x256_MI16x16x1_SN_LDSB1_AFC0_AFEM1_AFEM1_ASEM1_CLR1_CADS0_DTVA0_DTVB0_EPS0_FDSI0_GRPM1_GRVWA16_GRVWB16_GSU0_GSUAMB_GSUC0_GSUWGMRR0_GLS0_ISA950_IU1_K1_LBSPPA1024_LBSPPB512_LBSPPM0_LPA32_LPB32_LPM0_LRVW16_LWPMn1_MIAV0_MIWT4_4_MO40_NTn1_NTA0_NTB0_NTC0_NTD0_NTM0_NEPBS0_NLCA1_NLCB1_ONLL1_PGR2_PLR1_PKA1_SIA3_SS1_SU0_SUM1_SUS256_SPO0_SRVW0_SSO0_SVW4_SK3_SKXCCM8_TLDS1_ULSGRO0_USL1_UIOFGRO0_USFGRO0_VSn1_VWA4_VWB2_WSGRA0_WSGRB0_WS64_WG32_8_1_WGM6_WGMXCC1_WGMXCCGn1
    SolutionIndex: 49
    SolutionNameMin: Cijk_Alik_Bljk_I8II_BH_UserArgs_MT128x128x256_MI16x16x1_SN_LDSB1_AFC0_AFEM1_AFEM1_ASEM1_CLR1_CADS0_DTVA0_DTVB0_EPS0_FDSI0_GRPM1_GRVWA16_GRVWB16_GSU0_GSUAMB_GSUC0_GSUWGMRR0_GLS0_ISA950_IU1_K1_LBSPPA512_LBSPPB1024_LBSPPM0_LPA32_LPB32_LPM0_LRVW16_LWPMn1_MIAV0_MIWT4_4_MO40_NTn1_NTA0_NTB0_NTC0_NTD0_NTM0_NEPBS0_NLCA1_NLCB1_ONLL1_PGR2_PLR1_PKA1_SIA3_SS1_SU0_SUM1_SUS256_SPO0_SRVW0_SSO0_SVW2_SK3_SKXCCM8_TLDS1_ULSGRO0_USL1_UIOFGRO0_USFGRO0_VSn1_VWA2_VWB4_WSGRA0_WSGRB0_WS64_WG32_8_1_WGM6_WGMXCC1_WGMXCCGn1
    SolutionIndex: 50
    SolutionNameMin: Cijk_Alik_Bljk_I8II_BH_UserArgs_MT128x128x256_MI16x16x1_SN_LDSB1_AFC0_AFEM1_AFEM1_ASEM1_CLR1_CADS0_DTVA0_DTVB0_EPS0_FDSI0_GRPM1_GRVWA16_GRVWB16_GSU0_GSUAMB_GSUC0_GSUWGMRR0_GLS0_ISA950_IU1_K1_LBSPPA1024_LBSPPB1024_LBSPPM0_LPA32_LPB32_LPM0_LRVW16_LWPMn1_MIAV0_MIWT4_4_MO40_NTn1_NTA0_NTB0_NTC0_NTD0_NTM0_NEPBS0_NLCA1_NLCB1_ONLL1_PGR2_PLR1_PKA1_SIA3_SS1_SU0_SUM1_SUS256_SPO0_SRVW0_SSO0_SVW4_SK3_SKXCCM8_TLDS1_ULSGRO0_USL1_UIOFGRO0_USFGRO0_VSn1_VWA4_VWB4_WSGRA0_WSGRB0_WS64_WG32_8_1_WGM6_WGMXCC1_WGMXCCGn1
    SolutionIndex: 51
    SolutionNameMin: Cijk_Alik_Bljk_I8II_BH_UserArgs_MT128x128x256_MI16x16x1_SN_LDSB1_AFC0_AFEM1_AFEM1_ASEM1_CLR1_CADS0_DTVA0_DTVB0_EPS0_FDSI0_GRPM1_GRVWA16_GRVWB16_GSU0_GSUAMB_GSUC0_GSUWGMRR0_GLS0_ISA950_IU1_K1_LBSPPA1024_LBSPPB512_LBSPPM0_LPA32_LPB32_LPM0_LRVW16_LWPMn1_MIAV0_MIWT4_4_MO40_NTn1_NTA0_NTB0_NTC0_NTD0_NTM0_NEPBS0_NLCA1_NLCB1_ONLL1_PGR2_PLR2_PKA1_SIA3_SS1_SU0_SUM1_SUS256_SPO0_SRVW0_SSO0_SVW4_SK3_SKXCCM8_TLDS1_ULSGRO0_USL1_UIOFGRO0_USFGRO0_VSn1_VWA4_VWB2_WSGRA0_WSGRB0_WS64_WG32_8_1_WGM6_WGMXCC1_WGMXCCGn1
    SolutionIndex: 52
    SolutionNameMin: Cijk_Alik_Bljk_I8II_BH_UserArgs_MT64x128x256_MI16x16x1_SN_LDSB1_AFC0_AFEM1_AFEM1_ASEM1_CLR1_CADS0_DTVA0_DTVB0_EPS0_FDSI0_GRPM1_GRVWA16_GRVWB16_GSU0_GSUAMB_GSUC0_GSUWGMRR0_GLS0_ISA950_IU1_K1_LBSPPA512_LBSPPB512_LBSPPM0_LPA32_LPB32_LPM0_LRVW16_LWPMn1_MIAV0_MIWT2_4_MO40_NTn1_NTA0_NTB0_NTC0_NTD0_NTM0_NEPBS0_NLCA1_NLCB1_ONLL1_PGR2_PLR1_PKA1_SIA3_SS1_SU0_SUM1_SUS256_SPO0_SRVW0_SSO0_SVW2_SK3_SKXCCM8_TLDS1_ULSGRO0_USL1_UIOFGRO0_USFGRO0_VSn1_VWA2_VWB2_WSGRA0_WSGRB0_WS64_WG32_8_1_WGM6_WGMXCC1_WGMXCCGn1
    SolutionIndex: 53
    SolutionNameMin: Cijk_Alik_Bljk_I8II_BH_UserArgs_MT64x128x256_MI16x16x1_SN_LDSB1_AFC0_AFEM1_AFEM1_ASEM1_CLR1_CADS0_DTVA0_DTVB0_EPS0_FDSI0_GRPM1_GRVWA16_GRVWB16_GSU0_GSUAMB_GSUC0_GSUWGMRR0_GLS0_ISA950_IU1_K1_LBSPPA512_LBSPPB1024_LBSPPM0_LPA32_LPB32_LPM0_LRVW16_LWPMn1_MIAV0_MIWT2_4_MO40_NTn1_NTA0_NTB0_NTC0_NTD0_NTM0_NEPBS0_NLCA1_NLCB1_ONLL1_PGR2_PLR1_PKA1_SIA3_SS1_SU0_SUM1_SUS256_SPO0_SRVW0_SSO0_SVW2_SK3_SKXCCM8_TLDS1_ULSGRO0_USL1_UIOFGRO0_USFGRO0_VSn1_VWA2_VWB4_WSGRA0_WSGRB0_WS64_WG32_8_1_WGM6_WGMXCC1_WGMXCCGn1
    SolutionIndex: 54
    SolutionNameMin: Cijk_Alik_Bljk_I8II_BH_UserArgs_MT64x128x256_MI16x16x1_SN_LDSB1_AFC0_AFEM1_AFEM1_ASEM1_CLR1_CADS0_DTVA0_DTVB0_EPS0_FDSI0_GRPM1_GRVWA16_GRVWB16_GSU0_GSUAMB_GSUC0_GSUWGMRR0_GLS0_ISA950_IU1_K1_LBSPPA512_LBSPPB512_LBSPPM0_LPA32_LPB32_LPM0_LRVW16_LWPMn1_MIAV0_MIWT2_4_MO40_NTn1_NTA0_NTB0_NTC0_NTD0_NTM0_NEPBS0_NLCA1_NLCB1_ONLL1_PGR2_PLR2_PKA1_SIA3_SS1_SU0_SUM1_SUS256_SPO0_SRVW0_SSO0_SVW2_SK3_SKXCCM8_TLDS1_ULSGRO0_USL1_UIOFGRO0_USFGRO0_VSn1_VWA2_VWB2_WSGRA0_WSGRB0_WS64_WG32_8_1_WGM6_WGMXCC1_WGMXCCGn1
    SolutionIndex: 55
    SolutionNameMin: Cijk_Alik_Bljk_I8II_BH_UserArgs_MT64x128x256_MI16x16x1_SN_LDSB1_AFC0_AFEM1_AFEM1_ASEM1_CLR1_CADS0_DTVA0_DTVB0_EPS0_FDSI0_GRPM1_GRVWA16_GRVWB16_GSU0_GSUAMB_GSUC0_GSUWGMRR0_GLS0_ISA950_IU1_K1_LBSPPA512_LBSPPB1024_LBSPPM0_LPA32_LPB32_LPM0_LRVW16_LWPMn1_MIAV0_MIWT2_4_MO40_NTn1_NTA0_NTB0_NTC0_NTD0_NTM0_NEPBS0_NLCA1_NLCB1_ONLL1_PGR2_PLR2_PKA1_SIA3_SS1_SU0_SUM1_SUS256_SPO0_SRVW0_SSO0_SVW2_SK3_SKXCCM8_TLDS1_ULSGRO0_USL1_UIOFGRO0_USFGRO0_VSn1_VWA2_VWB4_WSGRA0_WSGRB0_WS64_WG32_8_1_WGM6_WGMXCC1_WGMXCCGn1
    SolutionIndex: 56
    SolutionNameMin: Cijk_Alik_Bljk_I8II_BH_UserArgs_MT128x64x256_MI16x16x1_SN_LDSB1_AFC0_AFEM1_AFEM1_ASEM1_CLR1_CADS0_DTVA0_DTVB0_EPS0_FDSI0_GRPM1_GRVWA16_GRVWB16_GSU0_GSUAMB_GSUC0_GSUWGMRR0_GLS0_ISA950_IU1_K1_LBSPPA512_LBSPPB512_LBSPPM0_LPA32_LPB32_LPM0_LRVW16_LWPMn1_MIAV0_MIWT4_2_MO40_NTn1_NTA0_NTB0_NTC0_NTD0_NTM0_NEPBS0_NLCA1_NLCB1_ONLL1_PGR2_PLR1_PKA1_SIA3_SS1_SU0_SUM1_SUS256_SPO0_SRVW0_SSO0_SVW2_SK3_SKXCCM8_TLDS1_ULSGRO0_USL1_UIOFGRO0_USFGRO0_VSn1_VWA2_VWB2_WSGRA0_WSGRB0_WS64_WG32_8_1_WGM6_WGMXCC1_WGMXCCGn1
    SolutionIndex: 57
    SolutionNameMin: Cijk_Alik_Bljk_I8II_BH_UserArgs_MT128x64x256_MI16x16x1_SN_LDSB1_AFC0_AFEM1_AFEM1_ASEM1_CLR1_CADS0_DTVA0_DTVB0_EPS0_FDSI0_GRPM1_GRVWA16_GRVWB16_GSU0_GSUAMB_GSUC0_GSUWGMRR0_GLS0_ISA950_IU1_K1_LBSPPA1024_LBSPPB512_LBSPPM0_LPA32_LPB32_LPM0_LRVW16_LWPMn1_MIAV0_MIWT4_2_MO40_NTn1_NTA0_NTB0_NTC0_NTD0_NTM0_NEPBS0_NLCA1_NLCB1_ONLL1_PGR2_PLR1_PKA1_SIA3_SS1_SU0_SUM1_SUS256_SPO0_SRVW0_SSO0_SVW4_SK3_SKXCCM8_TLDS1_ULSGRO0_USL1_UIOFGRO0_USFGRO0_VSn1_VWA4_VWB2_WSGRA0_WSGRB0_WS64_WG32_8_1_WGM6_WGMXCC1_WGMXCCGn1
    SolutionIndex: 58
    SolutionNameMin: Cijk_Alik_Bljk_I8II_BH_UserArgs_MT128x64x256_MI16x16x1_SN_LDSB1_AFC0_AFEM1_AFEM1_ASEM1_CLR1_CADS0_DTVA0_DTVB0_EPS0_FDSI0_GRPM1_GRVWA16_GRVWB16_GSU0_GSUAMB_GSUC0_GSUWGMRR0_GLS0_ISA950_IU1_K1_LBSPPA512_LBSPPB512_LBSPPM0_LPA32_LPB32_LPM0_LRVW16_LWPMn1_MIAV0_MIWT4_2_MO40_NTn1_NTA0_NTB0_NTC0_NTD0_NTM0_NEPBS0_NLCA1_NLCB1_ONLL1_PGR2_PLR2_PKA1_SIA3_SS1_SU0_SUM1_SUS256_SPO0_SRVW0_SSO0_SVW2_SK3_SKXCCM8_TLDS1_ULSGRO0_USL1_UIOFGRO0_USFGRO0_VSn1_VWA2_VWB2_WSGRA0_WSGRB0_WS64_WG32_8_1_WGM6_WGMXCC1_WGMXCCGn1
    SolutionIndex: 59
    SolutionNameMin: Cijk_Alik_Bljk_I8II_BH_UserArgs_MT128x64x256_MI16x16x1_SN_LDSB1_AFC0_AFEM1_AFEM1_ASEM1_CLR1_CADS0_DTVA0_DTVB0_EPS0_FDSI0_GRPM1_GRVWA16_GRVWB16_GSU0_GSUAMB_GSUC0_GSUWGMRR0_GLS0_ISA950_IU1_K1_LBSPPA1024_LBSPPB512_LBSPPM0_LPA32_LPB32_LPM0_LRVW16_LWPMn1_MIAV0_MIWT4_2_MO40_NTn1_NTA0_NTB0_NTC0_NTD0_NTM0_NEPBS0_NLCA1_NLCB1_ONLL1_PGR2_PLR2_PKA1_SIA3_SS1_SU0_SUM1_SUS256_SPO0_SRVW0_SSO0_SVW4_SK3_SKXCCM8_TLDS1_ULSGRO0_USL1_UIOFGRO0_USFGRO0_VSn1_VWA4_VWB2_WSGRA0_WSGRB0_WS64_WG32_8_1_WGM6_WGMXCC1_WGMXCCGn1
    SolutionIndex: 60
    SolutionNameMin: Cijk_Alik_Bljk_I8II_BH_UserArgs_MT64x64x256_MI16x16x1_SN_LDSB1_AFC0_AFEM1_AFEM1_ASEM1_CLR1_CADS0_DTVA0_DTVB0_EPS0_FDSI0_GRPM1_GRVWA16_GRVWB4_GSU0_GSUAMB_GSUC0_GSUWGMRR0_GLS0_ISA950_IU1_K1_LBSPPA512_LBSPPB512_LBSPPM0_LPA32_LPB32_LPM0_LRVW16_LWPMn1_MIAV0_MIWT2_2_MO40_NTn1_NTA0_NTB0_NTC0_NTD0_NTM0_NEPBS0_NLCA1_NLCB1_ONLL1_PGR2_PLR1_PKA1_SIA3_SS1_SU0_SUM1_SUS256_SPO0_SRVW0_SSO0_SVW2_SK3_SKXCCM8_TLDS1_ULSGRO0_USL1_UIOFGRO0_USFGRO0_VSn1_VWA2_VWB2_WSGRA0_WSGRB0_WS64_WG32_8_1_WGM6_WGMXCC1_WGMXCCGn1
    SolutionIndex: 61
    SolutionNameMin: Cijk_Alik_Bljk_I8II_BH_UserArgs_MT64x64x256_MI16x16x1_SN_LDSB1_AFC0_AFEM1_AFEM1_ASEM1_CLR1_CADS0_DTVA0_DTVB0_EPS0_FDSI0_GRPM1_GRVWA4_GRVWB16_GSU0_GSUAMB_GSUC0_GSUWGMRR0_GLS0_ISA950_IU1_K1_LBSPPA512_LBSPPB512_LBSPPM0_LPA32_LPB32_LPM0_LRVW16_LWPMn1_MIAV0_MIWT2_2_MO40_NTn1_NTA0_NTB0_NTC0_NTD0_NTM0_NEPBS0_NLCA1_NLCB1_ONLL1_PGR2_PLR1_PKA1_SIA3_SS1_SU0_SUM1_SUS256_SPO0_SRVW0_SSO0_SVW2_SK3_SKXCCM8_TLDS1_ULSGRO0_USL1_UIOFGRO0_USFGRO0_VSn1_VWA2_VWB2_WSGRA0_WSGRB0_WS64_WG32_8_1_WGM6_WGMXCC1_WGMXCCGn1
    SolutionIndex: 62
    SolutionNameMin: Cijk_Alik_Bljk_I8II_BH_UserArgs_MT64x64x256_MI16x16x1_SN_LDSB1_AFC0_AFEM1_AFEM1_ASEM1_CLR1_CADS0_DTVA0_DTVB0_EPS0_FDSI0_GRPM1_GRVWA8_GRVWB16_GSU0_GSUAMB_GSUC0_GSUWGMRR0_GLS0_ISA950_IU1_K1_LBSPPA512_LBSPPB512_LBSPPM0_LPA32_LPB32_LPM0_LRVW16_LWPMn1_MIAV0_MIWT2_2_MO40_NTn1_NTA0_NTB0_NTC0_NTD0_NTM0_NEPBS0_NLCA1_NLCB1_ONLL1_PGR2_PLR1_PKA1_SIA3_SS1_SU0_SUM1_SUS256_SPO0_SRVW0_SSO0_SVW2_SK3_SKXCCM8_TLDS1_ULSGRO0_USL1_UIOFGRO0_USFGRO0_VSn1_VWA2_VWB2_WSGRA0_WSGRB0_WS64_WG32_8_1_WGM6_WGMXCC1_WGMXCCGn1
    SolutionIndex: 63
    SolutionNameMin: Cijk_Alik_Bljk_I8II_BH_UserArgs_MT64x64x256_MI16x16x1_SN_LDSB1_AFC0_AFEM1_AFEM1_ASEM1_CLR1_CADS0_DTVA0_DTVB0_EPS0_FDSI0_GRPM1_GRVWA16_GRVWB16_GSU0_GSUAMB_GSUC0_GSUWGMRR0_GLS0_ISA950_IU1_K1_LBSPPA512_LBSPPB512_LBSPPM0_LPA32_LPB32_LPM0_LRVW16_LWPMn1_MIAV0_MIWT2_2_MO40_NTn1_NTA0_NTB0_NTC0_NTD0_NTM0_NEPBS0_NLCA1_NLCB1_ONLL1_PGR2_PLR1_PKA1_SIA3_SS1_SU0_SUM1_SUS256_SPO0_SRVW0_SSO0_SVW2_SK3_SKXCCM8_TLDS1_ULSGRO0_USL1_UIOFGRO0_USFGRO0_VSn1_VWA2_VWB2_WSGRA0_WSGRB0_WS64_WG32_8_1_WGM6_WGMXCC1_WGMXCCGn1
    SolutionIndex: 64
    SolutionNameMin: Cijk_Alik_Bljk_I8II_BH_UserArgs_MT64x64x256_MI16x16x1_SN_LDSB1_AFC0_AFEM1_AFEM1_ASEM1_CLR1_CADS0_DTVA0_DTVB0_EPS0_FDSI0_GRPM1_GRVWA4_GRVWB16_GSU0_GSUAMB_GSUC0_GSUWGMRR0_GLS0_ISA950_IU1_K1_LBSPPA512_LBSPPB512_LBSPPM0_LPA32_LPB32_LPM0_LRVW16_LWPMn1_MIAV0_MIWT2_2_MO40_NTn1_NTA0_NTB0_NTC0_NTD0_NTM0_NEPBS0_NLCA1_NLCB1_ONLL1_PGR2_PLR2_PKA1_SIA3_SS1_SU0_SUM1_SUS256_SPO0_SRVW0_SSO0_SVW2_SK3_SKXCCM8_TLDS1_ULSGRO0_USL1_UIOFGRO0_USFGRO0_VSn1_VWA2_VWB2_WSGRA0_WSGRB0_WS64_WG32_8_1_WGM6_WGMXCC1_WGMXCCGn1
    SolutionIndex: 65
    SolutionNameMin: Cijk_Alik_Bljk_I8II_BH_UserArgs_MT64x64x256_MI16x16x1_SN_LDSB1_AFC0_AFEM1_AFEM1_ASEM1_CLR1_CADS0_DTVA0_DTVB0_EPS0_FDSI0_GRPM1_GRVWA16_GRVWB16_GSU0_GSUAMB_GSUC0_GSUWGMRR0_GLS0_ISA950_IU1_K1_LBSPPA512_LBSPPB512_LBSPPM0_LPA32_LPB32_LPM0_LRVW16_LWPMn1_MIAV0_MIWT2_2_MO40_NTn1_NTA0_NTB0_NTC0_NTD0_NTM0_NEPBS0_NLCA1_NLCB1_ONLL1_PGR2_PLR2_PKA1_SIA3_SS1_SU0_SUM1_SUS256_SPO0_SRVW0_SSO0_SVW2_SK3_SKXCCM8_TLDS1_ULSGRO0_USL1_UIOFGRO0_USFGRO0_VSn1_VWA2_VWB2_WSGRA0_WSGRB0_WS64_WG32_8_1_WGM6_WGMXCC1_WGMXCCGn1
    SolutionIndex: 66
    SolutionNameMin: Cijk_Alik_Bljk_I8II_BH_UserArgs_MT64x64x512_MI16x16x1_SN_LDSB1_AFC0_AFEM1_AFEM1_ASEM1_CLR1_CADS0_DTVA0_DTVB0_EPS0_FDSI0_GRPM1_GRVWA16_GRVWB16_GSU0_GSUAMB_GSUC0_GSUWGMRR0_GLS0_ISA950_IU1_K1_LBSPPA1024_LBSPPB1024_LBSPPM0_LPA32_LPB32_LPM0_LRVW16_LWPMn1_MIAV0_MIWT2_2_MO40_NTn1_NTA0_NTB0_NTC0_NTD0_NTM0_NEPBS0_NLCA1_NLCB1_ONLL1_PGR2_PLR2_PKA1_SIA3_SS1_SU0_SUM1_SUS512_SPO0_SRVW0_SSO0_SVW2_SK3_SKXCCM8_TLDS1_ULSGRO0_USL1_UIOFGRO0_USFGRO0_VSn1_VWA2_VWB2_WSGRA0_WSGRB0_WS64_WG32_8_1_WGM6_WGMXCC1_WGMXCCGn1
- - - [128, 128, 1, 128, 128, 128, 128, 128]
    - [6, 0.42]
  - - [128, 128, 1, 256, 128, 128, 256, 256]
    - [63, 0.77]
  - - [128, 128, 1, 512, 128, 128, 512, 512]
    - [65, 1.37]
  - - [128, 128, 1, 1024, 128, 128, 1024, 1024]
    - [65, 2.31]
  - - [128, 128, 1, 2048, 128, 128, 2048, 2048]
    - [66, 3.56]
  - - [128, 128, 1, 4096, 128, 128, 4096, 4096]
    - [66, 4.89]
  - - [128, 128, 1, 8192, 128, 128, 8192, 8192]
    - [66, 6.16]
  - - [128, 256, 1, 128, 128, 128, 128, 128]
    - [41, 0.83]
  - - [128, 256, 1, 256, 128, 128, 256, 256]
    - [63, 1.52]
  - - [128, 256, 1, 512, 128, 128, 512, 512]
    - [65, 2.69]
  - - [128, 256, 1, 1024, 128, 128, 1024, 1024]
    - [63, 4.55]
  - - [128, 256, 1, 2048, 128, 128, 2048, 2048]
    - [66, 6.92]
  - - [128, 256, 1, 4096, 128, 128, 4096, 4096]
    - [66, 9.72]
  - - [128, 256, 1, 8192, 128, 128, 8192, 8192]
    - [66, 12.18]
  - - [128, 512, 1, 128, 128, 128, 128, 128]
    - [10, 1.68]
  - - [128, 512, 1, 256, 128, 128, 256, 256]
    - [63, 3.06]
  - - [128, 512, 1, 512, 128, 128, 512, 512]
    - [66, 5.38]
  - - [128, 512, 1, 1024, 128, 128, 1024, 1024]
    - [63, 9.08]
  - - [128, 512, 1, 2048, 128, 128, 2048, 2048]
    - [66, 13.78]
  - - [128, 512, 1, 4096, 128, 128, 4096, 4096]
    - [66, 19.54]
  - - [128, 512, 1, 8192, 128, 128, 8192, 8192]
    - [66, 24.39]
  - - [128, 1024, 1, 128, 128, 128, 128, 128]
    - [40, 3.22]
  - - [128, 1024, 1, 256, 128, 128, 256, 256]
    - [63, 6.1]
  - - [128, 1024, 1, 512, 128, 128, 512, 512]
    - [63, 10.64]
  - - [128, 1024, 1, 1024, 128, 128, 1024, 1024]
    - [65, 17.73]
  - - [128, 1024, 1, 2048, 128, 128, 2048, 2048]
    - [66, 27.36]
  - - [128, 1024, 1, 4096, 128, 128, 4096, 4096]
    - [66, 38.72]
  - - [128, 1024, 1, 8192, 128, 128, 8192, 8192]
    - [66, 48.63]
  - - [128, 2048, 1, 128, 128, 128, 128, 128]
    - [10, 6.49]
  - - [128, 2048, 1, 256, 128, 128, 256, 256]
    - [65, 11.83]
  - - [128, 2048, 1, 512, 128, 128, 512, 512]
    - [66, 20.34]
  - - [128, 2048, 1, 1024, 128, 128, 1024, 1024]
    - [63, 34.3]
  - - [128, 2048, 1, 2048, 128, 128, 2048, 2048]
    - [66, 53.74]
  - - [128, 2048, 1, 4096, 128, 128, 4096, 4096]
    - [66, 75.78]
  - - [128, 2048, 1, 8192, 128, 128, 8192, 8192]
    - [66, 96.86]
  - - [128, 4096, 1, 128, 128, 128, 128, 128]
    - [10, 12.37]
  - - [128, 4096, 1, 256, 128, 128, 256, 256]
    - [63, 22.47]
  - - [128, 4096, 1, 512, 128, 128, 512, 512]
    - [63, 39.1]
  - - [128, 4096, 1, 1024, 128, 128, 1024, 1024]
    - [63, 66.08]
  - - [128, 4096, 1, 2048, 128, 128, 2048, 2048]
    - [66, 104.43]
  - - [128, 4096, 1, 4096, 128, 128, 4096, 4096]
    - [66, 148.03]
  - - [128, 4096, 1, 8192, 128, 128, 8192, 8192]
    - [66, 176.13]
  - - [128, 8192, 1, 128, 128, 128, 128, 128]
    - [10, 21.94]
  - - [128, 8192, 1, 256, 128, 128, 256, 256]
    - [65, 40.25]
  - - [128, 8192, 1, 512, 128, 128, 512, 512]
    - [63, 70.77]
  - - [128, 8192, 1, 1024, 128, 128, 1024, 1024]
    - [63, 121.62]
  - - [128, 8192, 1, 2048, 128, 128, 2048, 2048]
    - [66, 189.9]
  - - [128, 8192, 1, 4096, 128, 128, 4096, 4096]
    - [66, 254.5]
  - - [128, 8192, 1, 8192, 128, 128, 8192, 8192]
    - [66, 313.21]
  - - [256, 128, 1, 128, 256, 256, 128, 128]
    - [8, 0.83]
  - - [256, 128, 1, 256, 256, 256, 256, 256]
    - [65, 1.55]
  - - [256, 128, 1, 512, 256, 256, 512, 512]
    - [65, 2.69]
  - - [256, 128, 1, 1024, 256, 256, 1024, 1024]
    - [63, 4.58]
  - - [256, 128, 1, 2048, 256, 256, 2048, 2048]
    - [65, 6.87]
  - - [256, 128, 1, 4096, 256, 256, 4096, 4096]
    - [66, 9.72]
  - - [256, 128, 1, 8192, 256, 256, 8192, 8192]
    - [66, 12.18]
  - - [256, 256, 1, 128, 256, 256, 128, 128]
    - [10, 1.67]
  - - [256, 256, 1, 256, 256, 256, 256, 256]
    - [63, 3.04]
  - - [256, 256, 1, 512, 256, 256, 512, 512]
    - [65, 5.4]
  - - [256, 256, 1, 1024, 256, 256, 1024, 1024]
    - [65, 9.13]
  - - [256, 256, 1, 2048, 256, 256, 2048, 2048]
    - [66, 14.05]
  - - [256, 256, 1, 4096, 256, 256, 4096, 4096]
    - [66, 19.44]
  - - [256, 256, 1, 8192, 256, 256, 8192, 8192]
    - [66, 24.54]
  - - [256, 512, 1, 128, 256, 256, 128, 128]
    - [41, 3.28]
  - - [256, 512, 1, 256, 256, 256, 256, 256]
    - [63, 6.16]
  - - [256, 512, 1, 512, 256, 256, 512, 512]
    - [65, 10.75]
  - - [256, 512, 1, 1024, 256, 256, 1024, 1024]
    - [63, 18.0]
  - - [256, 512, 1, 2048, 256, 256, 2048, 2048]
    - [66, 28.02]
  - - [256, 512, 1, 4096, 256, 256, 4096, 4096]
    - [66, 39.16]
  - - [256, 512, 1, 8192, 256, 256, 8192, 8192]
    - [66, 49.22]
  - - [256, 1024, 1, 128, 256, 256, 128, 128]
    - [10, 6.61]
  - - [256, 1024, 1, 256, 256, 256, 256, 256]
    - [65, 11.93]
  - - [256, 1024, 1, 512, 256, 256, 512, 512]
    - [63, 20.74]
  - - [256, 1024, 1, 1024, 256, 256, 1024, 1024]
    - [63, 35.21]
  - - [256, 1024, 1, 2048, 256, 256, 2048, 2048]
    - [66, 54.84]
  - - [256, 1024, 1, 4096, 256, 256, 4096, 4096]
    - [66, 77.48]
  - - [256, 1024, 1, 8192, 256, 256, 8192, 8192]
    - [66, 97.27]
  - - [256, 2048, 1, 128, 256, 256, 128, 128]
    - [10, 12.43]
  - - [256, 2048, 1, 256, 256, 256, 256, 256]
    - [65, 22.77]
  - - [256, 2048, 1, 512, 256, 256, 512, 512]
    - [63, 39.58]
  - - [256, 2048, 1, 1024, 256, 256, 1024, 1024]
    - [63, 67.51]
  - - [256, 2048, 1, 2048, 256, 256, 2048, 2048]
    - [66, 105.56]
  - - [256, 2048, 1, 4096, 256, 256, 4096, 4096]
    - [66, 150.96]
  - - [256, 2048, 1, 8192, 256, 256, 8192, 8192]
    - [66, 190.62]
  - - [256, 4096, 1, 128, 256, 256, 128, 128]
    - [10, 22.18]
  - - [256, 4096, 1, 256, 256, 256, 256, 256]
    - [63, 40.7]
  - - [256, 4096, 1, 512, 256, 256, 512, 512]
    - [65, 71.52]
  - - [256, 4096, 1, 1024, 256, 256, 1024, 1024]
    - [63, 123.6]
  - - [256, 4096, 1, 2048, 256, 256, 2048, 2048]
    - [66, 198.22]
  - - [256, 4096, 1, 4096, 256, 256, 4096, 4096]
    - [66, 280.23]
  - - [256, 4096, 1, 8192, 256, 256, 8192, 8192]
    - [66, 337.45]
  - - [256, 8192, 1, 128, 256, 256, 128, 128]
    - [37, 34.38]
  - - [256, 8192, 1, 256, 256, 256, 256, 256]
    - [56, 62.63]
  - - [256, 8192, 1, 512, 256, 256, 512, 512]
    - [37, 111.84]
  - - [256, 8192, 1, 1024, 256, 256, 1024, 1024]
    - [59, 185.65]
  - - [256, 8192, 1, 2048, 256, 256, 2048, 2048]
    - [59, 280.36]
  - - [256, 8192, 1, 4096, 256, 256, 4096, 4096]
    - [55, 367.33]
  - - [256, 8192, 1, 8192, 256, 256, 8192, 8192]
    - [55, 453.44]
  - - [512, 128, 1, 128, 512, 512, 128, 128]
    - [10, 1.66]
  - - [512, 128, 1, 256, 512, 512, 256, 256]
    - [63, 3.08]
  - - [512, 128, 1, 512, 512, 512, 512, 512]
    - [63, 5.35]
  - - [512, 128, 1, 1024, 512, 512, 1024, 1024]
    - [63, 9.14]
  - - [512, 128, 1, 2048, 512, 512, 2048, 2048]
    - [66, 13.72]
  - - [512, 128, 1, 4096, 512, 512, 4096, 4096]
    - [66, 19.31]
  - - [512, 128, 1, 8192, 512, 512, 8192, 8192]
    - [66, 24.23]
  - - [512, 256, 1, 128, 512, 512, 128, 128]
    - [41, 3.28]
  - - [512, 256, 1, 256, 512, 512, 256, 256]
    - [65, 6.03]
  - - [512, 256, 1, 512, 512, 512, 512, 512]
    - [66, 10.64]
  - - [512, 256, 1, 1024, 512, 512, 1024, 1024]
    - [65, 17.95]
  - - [512, 256, 1, 2048, 512, 512, 2048, 2048]
    - [66, 27.71]
  - - [512, 256, 1, 4096, 512, 512, 4096, 4096]
    - [66, 38.85]
  - - [512, 256, 1, 8192, 512, 512, 8192, 8192]
    - [66, 48.83]
  - - [512, 512, 1, 128, 512, 512, 128, 128]
    - [38, 6.51]
  - - [512, 512, 1, 256, 512, 512, 256, 256]
    - [65, 11.97]
  - - [512, 512, 1, 512, 512, 512, 512, 512]
    - [66, 20.9]
  - - [512, 512, 1, 1024, 512, 512, 1024, 1024]
    - [63, 35.61]
  - - [512, 512, 1, 2048, 512, 512, 2048, 2048]
    - [66, 55.28]
  - - [512, 512, 1, 4096, 512, 512, 4096, 4096]
    - [66, 76.85]
  - - [512, 512, 1, 8192, 512, 512, 8192, 8192]
    - [66, 97.35]
  - - [512, 1024, 1, 128, 512, 512, 128, 128]
    - [10, 12.44]
  - - [512, 1024, 1, 256, 512, 512, 256, 256]
    - [64, 22.66]
  - - [512, 1024, 1, 512, 512, 512, 512, 512]
    - [66, 40.45]
  - - [512, 1024, 1, 1024, 512, 512, 1024, 1024]
    - [65, 68.53]
  - - [512, 1024, 1, 2048, 512, 512, 2048, 2048]
    - [66, 107.92]
  - - [512, 1024, 1, 4096, 512, 512, 4096, 4096]
    - [66, 151.19]
  - - [512, 1024, 1, 8192, 512, 512, 8192, 8192]
    - [66, 192.78]
  - - [512, 2048, 1, 128, 512, 512, 128, 128]
    - [10, 22.19]
  - - [512, 2048, 1, 256, 512, 512, 256, 256]
    - [65, 40.77]
  - - [512, 2048, 1, 512, 512, 512, 512, 512]
    - [63, 72.03]
  - - [512, 2048, 1, 1024, 512, 512, 1024, 1024]
    - [65, 123.85]
  - - [512, 2048, 1, 2048, 512, 512, 2048, 2048]
    - [66, 198.12]
  - - [512, 2048, 1, 4096, 512, 512, 4096, 4096]
    - [66, 285.81]
  - - [512, 2048, 1, 8192, 512, 512, 8192, 8192]
    - [66, 345.14]
  - - [512, 4096, 1, 128, 512, 512, 128, 128]
    - [37, 34.54]
  - - [512, 4096, 1, 256, 512, 512, 256, 256]
    - [53, 63.27]
  - - [512, 4096, 1, 512, 512, 512, 512, 512]
    - [57, 111.7]
  - - [512, 4096, 1, 1024, 512, 512, 1024, 1024]
    - [53, 191.5]
  - - [512, 4096, 1, 2048, 512, 512, 2048, 2048]
    - [59, 290.99]
  - - [512, 4096, 1, 4096, 512, 512, 4096, 4096]
    - [59, 385.19]
  - - [512, 4096, 1, 8192, 512, 512, 8192, 8192]
    - [55, 470.6]
  - - [512, 8192, 1, 128, 512, 512, 128, 128]
    - [3, 44.24]
  - - [512, 8192, 1, 256, 512, 512, 256, 256]
    - [3, 80.53]
  - - [512, 8192, 1, 512, 512, 512, 512, 512]
    - [33, 149.94]
  - - [512, 8192, 1, 1024, 512, 512, 1024, 1024]
    - [33, 247.02]
  - - [512, 8192, 1, 2048, 512, 512, 2048, 2048]
    - [33, 376.16]
  - - [512, 8192, 1, 4096, 512, 512, 4096, 4096]
    - [49, 512.95]
  - - [512, 8192, 1, 8192, 512, 512, 8192, 8192]
    - [49, 612.3]
  - - [1024, 128, 1, 128, 1024, 1024, 128, 128]
    - [10, 3.32]
  - - [1024, 128, 1, 256, 1024, 1024, 256, 256]
    - [65, 6.11]
  - - [1024, 128, 1, 512, 1024, 1024, 512, 512]
    - [65, 10.7]
  - - [1024, 128, 1, 1024, 1024, 1024, 1024, 1024]
    - [65, 18.05]
  - - [1024, 128, 1, 2048, 1024, 1024, 2048, 2048]
    - [66, 27.1]
  - - [1024, 128, 1, 4096, 1024, 1024, 4096, 4096]
    - [66, 38.06]
  - - [1024, 128, 1, 8192, 1024, 1024, 8192, 8192]
    - [66, 48.1]
  - - [1024, 256, 1, 128, 1024, 1024, 128, 128]
    - [41, 6.51]
  - - [1024, 256, 1, 256, 1024, 1024, 256, 256]
    - [63, 12.08]
  - - [1024, 256, 1, 512, 1024, 1024, 512, 512]
    - [63, 21.02]
  - - [1024, 256, 1, 1024, 1024, 1024, 1024, 1024]
    - [65, 34.83]
  - - [1024, 256, 1, 2048, 1024, 1024, 2048, 2048]
    - [66, 54.76]
  - - [1024, 256, 1, 4096, 1024, 1024, 4096, 4096]
    - [66, 76.36]
  - - [1024, 256, 1, 8192, 1024, 1024, 8192, 8192]
    - [66, 96.46]
  - - [1024, 512, 1, 128, 1024, 1024, 128, 128]
    - [10, 12.64]
  - - [1024, 512, 1, 256, 1024, 1024, 256, 256]
    - [62, 22.41]
  - - [1024, 512, 1, 512, 1024, 1024, 512, 512]
    - [66, 40.23]
  - - [1024, 512, 1, 1024, 1024, 1024, 1024, 1024]
    - [63, 67.84]
  - - [1024, 512, 1, 2048, 1024, 1024, 2048, 2048]
    - [66, 107.41]
  - - [1024, 512, 1, 4096, 1024, 1024, 4096, 4096]
    - [66, 150.86]
  - - [1024, 512, 1, 8192, 1024, 1024, 8192, 8192]
    - [66, 191.38]
  - - [1024, 1024, 1, 128, 1024, 1024, 128, 128]
    - [7, 22.06]
  - - [1024, 1024, 1, 256, 1024, 1024, 256, 256]
    - [65, 41.0]
  - - [1024, 1024, 1, 512, 1024, 1024, 512, 512]
    - [66, 73.19]
  - - [1024, 1024, 1, 1024, 1024, 1024, 1024, 1024]
    - [65, 126.68]
  - - [1024, 1024, 1, 2048, 1024, 1024, 2048, 2048]
    - [63, 199.38]
  - - [1024, 1024, 1, 4096, 1024, 1024, 4096, 4096]
    - [66, 287.85]
  - - [1024, 1024, 1, 8192, 1024, 1024, 8192, 8192]
    - [66, 362.61]
  - - [1024, 2048, 1, 128, 1024, 1024, 128, 128]
    - [5, 34.47]
  - - [1024, 2048, 1, 256, 1024, 1024, 256, 256]
    - [57, 63.5]
  - - [1024, 2048, 1, 512, 1024, 1024, 512, 512]
    - [36, 112.55]
  - - [1024, 2048, 1, 1024, 1024, 1024, 1024, 1024]
    - [59, 191.21]
  - - [1024, 2048, 1, 2048, 1024, 1024, 2048, 2048]
    - [58, 294.83]
  - - [1024, 2048, 1, 4096, 1024, 1024, 4096, 4096]
    - [59, 399.96]
  - - [1024, 2048, 1, 8192, 1024, 1024, 8192, 8192]
    - [55, 477.34]
  - - [1024, 4096, 1, 128, 1024, 1024, 128, 128]
    - [1, 43.91]
  - - [1024, 4096, 1, 256, 1024, 1024, 256, 256]
    - [4, 80.11]
  - - [1024, 4096, 1, 512, 1024, 1024, 512, 512]
    - [33, 145.77]
  - - [1024, 4096, 1, 1024, 1024, 1024, 1024, 1024]
    - [33, 245.29]
  - - [1024, 4096, 1, 2048, 1024, 1024, 2048, 2048]
    - [33, 374.55]
  - - [1024, 4096, 1, 4096, 1024, 1024, 4096, 4096]
    - [50, 509.81]
  - - [1024, 4096, 1, 8192, 1024, 1024, 8192, 8192]
    - [50, 632.89]
  - - [1024, 8192, 1, 128, 1024, 1024, 128, 128]
    - [18, 56.82]
  - - [1024, 8192, 1, 256, 1024, 1024, 256, 256]
    - [18, 104.0]
  - - [1024, 8192, 1, 512, 1024, 1024, 512, 512]
    - [45, 181.68]
  - - [1024, 8192, 1, 1024, 1024, 1024, 1024, 1024]
    - [45, 310.73]
  - - [1024, 8192, 1, 2048, 1024, 1024, 2048, 2048]
    - [29, 499.38]
  - - [1024, 8192, 1, 4096, 1024, 1024, 4096, 4096]
    - [28, 660.7]
  - - [1024, 8192, 1, 8192, 1024, 1024, 8192, 8192]
    - [30, 802.28]
  - - [2048, 128, 1, 128, 2048, 2048, 128, 128]
    - [41, 6.45]
  - - [2048, 128, 1, 256, 2048, 2048, 256, 256]
    - [65, 12.0]
  - - [2048, 128, 1, 512, 2048, 2048, 512, 512]
    - [63, 20.69]
  - - [2048, 128, 1, 1024, 2048, 2048, 1024, 1024]
    - [63, 34.42]
  - - [2048, 128, 1, 2048, 2048, 2048, 2048, 2048]
    - [66, 52.7]
  - - [2048, 128, 1, 4096, 2048, 2048, 4096, 4096]
    - [66, 74.59]
  - - [2048, 128, 1, 8192, 2048, 2048, 8192, 8192]
    - [66, 96.03]
  - - [2048, 256, 1, 128, 2048, 2048, 128, 128]
    - [39, 12.29]
  - - [2048, 256, 1, 256, 2048, 2048, 256, 256]
    - [60, 22.62]
  - - [2048, 256, 1, 512, 2048, 2048, 512, 512]
    - [63, 39.5]
  - - [2048, 256, 1, 1024, 2048, 2048, 1024, 1024]
    - [65, 68.19]
  - - [2048, 256, 1, 2048, 2048, 2048, 2048, 2048]
    - [66, 105.89]
  - - [2048, 256, 1, 4096, 2048, 2048, 4096, 4096]
    - [66, 149.31]
  - - [2048, 256, 1, 8192, 2048, 2048, 8192, 8192]
    - [66, 188.47]
  - - [2048, 512, 1, 128, 2048, 2048, 128, 128]
    - [10, 22.06]
  - - [2048, 512, 1, 256, 2048, 2048, 256, 256]
    - [65, 40.97]
  - - [2048, 512, 1, 512, 2048, 2048, 512, 512]
    - [66, 72.09]
  - - [2048, 512, 1, 1024, 2048, 2048, 1024, 1024]
    - [63, 125.14]
  - - [2048, 512, 1, 2048, 2048, 2048, 2048, 2048]
    - [63, 197.66]
  - - [2048, 512, 1, 4096, 2048, 2048, 4096, 4096]
    - [66, 281.17]
  - - [2048, 512, 1, 8192, 2048, 2048, 8192, 8192]
    - [66, 341.81]
  - - [2048, 1024, 1, 128, 2048, 2048, 128, 128]
    - [35, 34.4]
  - - [2048, 1024, 1, 256, 2048, 2048, 256, 256]
    - [57, 63.15]
  - - [2048, 1024, 1, 512, 2048, 2048, 512, 512]
    - [36, 112.7]
  - - [2048, 1024, 1, 1024, 2048, 2048, 1024, 1024]
    - [59, 191.34]
  - - [2048, 1024, 1, 2048, 2048, 2048, 2048, 2048]
    - [54, 294.03]
  - - [2048, 1024, 1, 4096, 2048, 2048, 4096, 4096]
    - [58, 396.96]
  - - [2048, 1024, 1, 8192, 2048, 2048, 8192, 8192]
    - [59, 477.71]
  - - [2048, 2048, 1, 128, 2048, 2048, 128, 128]
    - [33, 43.65]
  - - [2048, 2048, 1, 256, 2048, 2048, 256, 256]
    - [3, 80.5]
  - - [2048, 2048, 1, 512, 2048, 2048, 512, 512]
    - [33, 142.24]
  - - [2048, 2048, 1, 1024, 2048, 2048, 1024, 1024]
    - [33, 248.99]
  - - [2048, 2048, 1, 2048, 2048, 2048, 2048, 2048]
    - [33, 375.08]
  - - [2048, 2048, 1, 4096, 2048, 2048, 4096, 4096]
    - [48, 514.6]
  - - [2048, 2048, 1, 8192, 2048, 2048, 8192, 8192]
    - [51, 634.68]
  - - [2048, 4096, 1, 128, 2048, 2048, 128, 128]
    - [0, 54.92]
  - - [2048, 4096, 1, 256, 2048, 2048, 256, 256]
    - [0, 101.04]
  - - [2048, 4096, 1, 512, 2048, 2048, 512, 512]
    - [25, 181.12]
  - - [2048, 4096, 1, 1024, 2048, 2048, 1024, 1024]
    - [25, 306.95]
  - - [2048, 4096, 1, 2048, 2048, 2048, 2048, 2048]
    - [25, 489.81]
  - - [2048, 4096, 1, 4096, 2048, 2048, 4096, 4096]
    - [29, 659.3]
  - - [2048, 4096, 1, 8192, 2048, 2048, 8192, 8192]
    - [30, 798.11]
  - - [2048, 8192, 1, 128, 2048, 2048, 128, 128]
    - [0, 61.66]
  - - [2048, 8192, 1, 256, 2048, 2048, 256, 256]
    - [12, 114.66]
  - - [2048, 8192, 1, 512, 2048, 2048, 512, 512]
    - [21, 208.61]
  - - [2048, 8192, 1, 1024, 2048, 2048, 1024, 1024]
    - [21, 364.13]
  - - [2048, 8192, 1, 2048, 2048, 2048, 2048, 2048]
    - [21, 578.19]
  - - [2048, 8192, 1, 4096, 2048, 2048, 4096, 4096]
    - [21, 805.87]
  - - [2048, 8192, 1, 8192, 2048, 2048, 8192, 8192]
    - [23, 960.66]
  - - [4096, 128, 1, 128, 4096, 4096, 128, 128]
    - [10, 12.52]
  - - [4096, 128, 1, 256, 4096, 4096, 256, 256]
    - [65, 22.34]
  - - [4096, 128, 1, 512, 4096, 4096, 512, 512]
    - [63, 39.54]
  - - [4096, 128, 1, 1024, 4096, 4096, 1024, 1024]
    - [61, 65.63]
  - - [4096, 128, 1, 2048, 4096, 4096, 2048, 2048]
    - [63, 103.29]
  - - [4096, 128, 1, 4096, 4096, 4096, 4096, 4096]
    - [66, 146.49]
  - - [4096, 128, 1, 8192, 4096, 4096, 8192, 8192]
    - [66, 172.64]
  - - [4096, 256, 1, 128, 4096, 4096, 128, 128]
    - [9, 22.09]
  - - [4096, 256, 1, 256, 4096, 4096, 256, 256]
    - [63, 40.88]
  - - [4096, 256, 1, 512, 4096, 4096, 512, 512]
    - [65, 72.03]
  - - [4096, 256, 1, 1024, 4096, 4096, 1024, 1024]
    - [65, 125.29]
  - - [4096, 256, 1, 2048, 4096, 4096, 2048, 2048]
    - [63, 198.08]
  - - [4096, 256, 1, 4096, 4096, 4096, 4096, 4096]
    - [66, 268.91]
  - - [4096, 256, 1, 8192, 4096, 4096, 8192, 8192]
    - [66, 334.35]
  - - [4096, 512, 1, 128, 4096, 4096, 128, 128]
    - [35, 34.04]
  - - [4096, 512, 1, 256, 4096, 4096, 256, 256]
    - [52, 63.35]
  - - [4096, 512, 1, 512, 4096, 4096, 512, 512]
    - [34, 111.49]
  - - [4096, 512, 1, 1024, 4096, 4096, 1024, 1024]
    - [52, 190.32]
  - - [4096, 512, 1, 2048, 4096, 4096, 2048, 2048]
    - [54, 287.25]
  - - [4096, 512, 1, 4096, 4096, 4096, 4096, 4096]
    - [54, 385.39]
  - - [4096, 512, 1, 8192, 4096, 4096, 8192, 8192]
    - [55, 472.56]
  - - [4096, 1024, 1, 128, 4096, 4096, 128, 128]
    - [46, 44.11]
  - - [4096, 1024, 1, 256, 4096, 4096, 256, 256]
    - [47, 79.9]
  - - [4096, 1024, 1, 512, 4096, 4096, 512, 512]
    - [46, 146.19]
  - - [4096, 1024, 1, 1024, 4096, 4096, 1024, 1024]
    - [32, 247.94]
  - - [4096, 1024, 1, 2048, 4096, 4096, 2048, 2048]
    - [32, 376.66]
  - - [4096, 1024, 1, 4096, 4096, 4096, 4096, 4096]
    - [31, 507.08]
  - - [4096, 1024, 1, 8192, 4096, 4096, 8192, 8192]
    - [46, 623.21]
  - - [4096, 2048, 1, 128, 4096, 4096, 128, 128]
    - [43, 55.33]
  - - [4096, 2048, 1, 256, 4096, 4096, 256, 256]
    - [43, 101.32]
  - - [4096, 2048, 1, 512, 4096, 4096, 512, 512]
    - [43, 180.91]
  - - [4096, 2048, 1, 1024, 4096, 4096, 1024, 1024]
    - [43, 304.44]
  - - [4096, 2048, 1, 2048, 4096, 4096, 2048, 2048]
    - [28, 491.73]
  - - [4096, 2048, 1, 4096, 4096, 4096, 4096, 4096]
    - [30, 656.97]
  - - [4096, 2048, 1, 8192, 4096, 4096, 8192, 8192]
    - [28, 802.81]
  - - [4096, 4096, 1, 128, 4096, 4096, 128, 128]
    - [15, 61.89]
  - - [4096, 4096, 1, 256, 4096, 4096, 256, 256]
    - [11, 115.64]
  - - [4096, 4096, 1, 512, 4096, 4096, 512, 512]
    - [15, 208.51]
  - - [4096, 4096, 1, 1024, 4096, 4096, 1024, 1024]
    - [13, 356.64]
  - - [4096, 4096, 1, 2048, 4096, 4096, 2048, 2048]
    - [22, 560.7]
  - - [4096, 4096, 1, 4096, 4096, 4096, 4096, 4096]
    - [22, 789.04]
  - - [4096, 4096, 1, 8192, 4096, 4096, 8192, 8192]
    - [24, 978.84]
  - - [4096, 8192, 1, 128, 4096, 4096, 128, 128]
    - [18, 68.79]
  - - [4096, 8192, 1, 256, 4096, 4096, 256, 256]
    - [18, 126.71]
  - - [4096, 8192, 1, 512, 4096, 4096, 512, 512]
    - [42, 226.05]
  - - [4096, 8192, 1, 1024, 4096, 4096, 1024, 1024]
    - [24, 389.7]
  - - [4096, 8192, 1, 2048, 4096, 4096, 2048, 2048]
    - [24, 606.59]
  - - [4096, 8192, 1, 4096, 4096, 4096, 4096, 4096]
    - [20, 814.92]
  - - [4096, 8192, 1, 8192, 4096, 4096, 8192, 8192]
    - [24, 1006.49]
  - - [8192, 128, 1, 128, 8192, 8192, 128, 128]
    - [9, 22.1]
  - - [8192, 128, 1, 256, 8192, 8192, 256, 256]
    - [65, 40.62]
  - - [8192, 128, 1, 512, 8192, 8192, 512, 512]
    - [65, 70.68]
  - - [8192, 128, 1, 1024, 8192, 8192, 1024, 1024]
    - [65, 122.98]
  - - [8192, 128, 1, 2048, 8192, 8192, 2048, 2048]
    - [63, 183.63]
  - - [8192, 128, 1, 4096, 8192, 8192, 4096, 4096]
    - [66, 245.89]
  - - [8192, 128, 1, 8192, 8192, 8192, 8192, 8192]
    - [66, 313.62]
  - - [8192, 256, 1, 128, 8192, 8192, 128, 128]
    - [36, 34.3]
  - - [8192, 256, 1, 256, 8192, 8192, 256, 256]
    - [59, 62.59]
  - - [8192, 256, 1, 512, 8192, 8192, 512, 512]
    - [37, 111.49]
  - - [8192, 256, 1, 1024, 8192, 8192, 1024, 1024]
    - [57, 183.94]
  - - [8192, 256, 1, 2048, 8192, 8192, 2048, 2048]
    - [59, 279.1]
  - - [8192, 256, 1, 4096, 8192, 8192, 4096, 4096]
    - [59, 372.95]
  - - [8192, 256, 1, 8192, 8192, 8192, 8192, 8192]
    - [58, 457.28]
  - - [8192, 512, 1, 128, 8192, 8192, 128, 128]
    - [19, 43.24]
  - - [8192, 512, 1, 256, 8192, 8192, 256, 256]
    - [2, 78.27]
  - - [8192, 512, 1, 512, 8192, 8192, 512, 512]
    - [46, 149.27]
  - - [8192, 512, 1, 1024, 8192, 8192, 1024, 1024]
    - [32, 245.43]
  - - [8192, 512, 1, 2048, 8192, 8192, 2048, 2048]
    - [32, 378.78]
  - - [8192, 512, 1, 4096, 8192, 8192, 4096, 4096]
    - [46, 501.64]
  - - [8192, 512, 1, 8192, 8192, 8192, 8192, 8192]
    - [48, 606.7]
  - - [8192, 1024, 1, 128, 8192, 8192, 128, 128]
    - [18, 56.27]
  - - [8192, 1024, 1, 256, 8192, 8192, 256, 256]
    - [18, 101.99]
  - - [8192, 1024, 1, 512, 8192, 8192, 512, 512]
    - [44, 180.05]
  - - [8192, 1024, 1, 1024, 8192, 8192, 1024, 1024]
    - [44, 310.71]
  - - [8192, 1024, 1, 2048, 8192, 8192, 2048, 2048]
    - [26, 500.43]
  - - [8192, 1024, 1, 4096, 8192, 8192, 4096, 4096]
    - [27, 661.37]
  - - [8192, 1024, 1, 8192, 8192, 8192, 8192, 8192]
    - [27, 799.34]
  - - [8192, 2048, 1, 128, 8192, 8192, 128, 128]
    - [18, 61.36]
  - - [8192, 2048, 1, 256, 8192, 8192, 256, 256]
    - [17, 114.92]
  - - [8192, 2048, 1, 512, 8192, 8192, 512, 512]
    - [14, 209.24]
  - - [8192, 2048, 1, 1024, 8192, 8192, 1024, 1024]
    - [42, 358.8]
  - - [8192, 2048, 1, 2048, 8192, 8192, 2048, 2048]
    - [22, 573.21]
  - - [8192, 2048, 1, 4096, 8192, 8192, 4096, 4096]
    - [24, 796.32]
  - - [8192, 2048, 1, 8192, 8192, 8192, 8192, 8192]
    - [23, 954.7]
  - - [8192, 4096, 1, 128, 8192, 8192, 128, 128]
    - [33, 67.58]
  - - [8192, 4096, 1, 256, 8192, 8192, 256, 256]
    - [18, 126.61]
  - - [8192, 4096, 1, 512, 8192, 8192, 512, 512]
    - [16, 230.35]
  - - [8192, 4096, 1, 1024, 8192, 8192, 1024, 1024]
    - [22, 396.78]
  - - [8192, 4096, 1, 2048, 8192, 8192, 2048, 2048]
    - [22, 615.61]
  - - [8192, 4096, 1, 4096, 8192, 8192, 4096, 4096]
    - [22, 807.41]
  - - [8192, 4096, 1, 8192, 8192, 8192, 8192, 8192]
    - [22, 1007.11]
  - - [8192, 8192, 1, 128, 8192, 8192, 128, 128]
    - [33, 73.2]
  - - [8192, 8192, 1, 256, 8192, 8192, 256, 256]
    - [16, 139.87]
  - - [8192, 8192, 1, 512, 8192, 8192, 512, 512]
    - [16, 252.81]
  - - [8192, 8192, 1, 1024, 8192, 8192, 1024, 1024]
    - [22, 419.75]
  - - [8192, 8192, 1, 2048, 8192, 8192, 2048, 2048]
    - [22, 637.05]
  - - [8192, 8192, 1, 4096, 8192, 8192, 4096, 4096]
    - [22, 889.34]
  - - [8192, 8192, 1, 8192, 8192, 8192, 8192, 8192]
    - [21, 1131.72]
- null
- null
- DeviceEfficiency
- GridBased
