projects/hipblaslt/library/src/amd_detail/rocblaslt/src/Tensile/Logic/asm_full/gfx950/gfx950/GridBased/gfx950_Cijk_Alik_Bjlk_I8_BH_UserArgs.yaml
- {MinimumRequiredVersion: 5.0.0}
- gfx950
- gfx950
- [Device 75a0]
    SolutionIndex: 0
    SolutionNameMin: Cijk_Alik_Bjlk_I8_BH_UserArgs_MT256x256x64_MI16x16x1_SN_LDSB0_AFC0_AFEM1_AFEM1_ASEM1_CLR0_CADS0_DTVA0_DTVB0_EPS0_FDSI0_GRPM1_GRVWA16_GRVWB16_GSU0_GSUAMB_GSUC0_GSUWGMRR0_GLS0_ISA950_IU1_K1_LBSPPA512_LBSPPB4096_LBSPPM0_LPA32_LPB64_LPM0_LRVW16_LWPMn1_MIAV0_MIWT8_8_MO40_NTn1_NTA0_NTB0_NTC0_NTD0_NTM0_NEPBS0_NLCA1_NLCB1_ONLL1_PGR2_PLR0_PKA1_SIA3_SS1_SU0_SUM1_SUS64_SPO0_SRVW0_SSO0_SVW8_SK3_SKXCCM8_TLDS1_ULSGRO0_USL1_UIOFGRO0_USFGRO0_VSn1_VWA8_VWB4_WSGRA0_WSGRB0_WS64_WG32_8_1_WGM6_WGMXCC1_WGMXCCGn1
    SolutionIndex: 1
    SolutionNameMin: Cijk_Alik_Bjlk_I8_BH_UserArgs_MT256x256x64_MI16x16x1_SN_LDSB0_AFC0_AFEM1_AFEM1_ASEM1_CLR0_CADS0_DTVA0_DTVB0_EPS0_FDSI0_GRPM1_GRVWA16_GRVWB16_GSU0_GSUAMB_GSUC0_GSUWGMRR0_GLS0_ISA950_IU1_K1_LBSPPA512_LBSPPB4096_LBSPPM0_LPA32_LPB0_LPM0_LRVW16_LWPMn1_MIAV0_MIWT8_8_MO40_NTn1_NTA0_NTB0_NTC0_NTD0_NTM0_NEPBS0_NLCA1_NLCB1_ONLL1_PGR2_PLR0_PKA1_SIA3_SS1_SU0_SUM1_SUS64_SPO0_SRVW0_SSO0_SVW8_SK3_SKXCCM8_TLDS1_ULSGRO0_USL1_UIOFGRO0_USFGRO0_VSn1_VWA8_VWB8_WSGRA0_WSGRB0_WS64_WG32_8_1_WGM6_WGMXCC1_WGMXCCGn1
    SolutionIndex: 2
    SolutionNameMin: Cijk_Alik_Bjlk_I8_BH_UserArgs_MT256x128x64_MI16x16x1_SN_LDSB1_AFC0_AFEM1_AFEM1_ASEM1_CLR0_CADS0_DTVA0_DTVB0_EPS0_FDSI0_GRPM1_GRVWA16_GRVWB16_GSU0_GSUAMB_GSUC0_GSUWGMRR0_GLS0_ISA950_IU1_K1_LBSPPA512_LBSPPB2048_LBSPPM0_LPA32_LPB64_LPM0_LRVW16_LWPMn1_MIAV0_MIWT8_4_MO40_NTn1_NTA0_NTB0_NTC0_NTD0_NTM0_NEPBS0_NLCA1_NLCB1_ONLL1_PGR2_PLR0_PKA1_SIA3_SS1_SU0_SUM1_SUS64_SPO0_SRVW0_SSO0_SVW8_SK3_SKXCCM8_TLDS1_ULSGRO0_USL1_UIOFGRO0_USFGRO0_VSn1_VWA8_VWB4_WSGRA0_WSGRB0_WS64_WG32_8_1_WGM6_WGMXCC1_WGMXCCGn1
    SolutionIndex: 3
    SolutionNameMin: Cijk_Alik_Bjlk_I8_BH_UserArgs_MT128x128x64_MI16x16x1_SN_LDSB1_AFC0_AFEM1_AFEM1_ASEM1_CLR0_CADS0_DTVA0_DTVB0_EPS0_FDSI0_GRPM1_GRVWA16_GRVWB4_GSU0_GSUAMB_GSUC0_GSUWGMRR0_GLS0_ISA950_IU1_K1_LBSPPA256_LBSPPB2048_LBSPPM0_LPA32_LPB64_LPM0_LRVW16_LWPMn1_MIAV0_MIWT4_4_MO40_NTn1_NTA0_NTB0_NTC0_NTD0_NTM0_NEPBS0_NLCA1_NLCB1_ONLL1_PGR2_PLR0_PKA1_SIA3_SS1_SU0_SUM1_SUS64_SPO0_SRVW0_SSO0_SVW4_SK3_SKXCCM8_TLDS1_ULSGRO0_USL1_UIOFGRO0_USFGRO0_VSn1_VWA4_VWB4_WSGRA0_WSGRB0_WS64_WG32_8_1_WGM6_WGMXCC1_WGMXCCGn1
    SolutionIndex: 4
    SolutionNameMin: Cijk_Alik_Bjlk_I8_BH_UserArgs_MT512x128x64_MI32x32x1_SN_LDSB0_AFC0_AFEM1_AFEM1_ASEM1_CLR1_CADS0_DTVA0_DTVB0_EPS0_FDSI0_GRPM1_GRVWA16_GRVWB8_GSU0_GSUAMB_GSUC0_GSUWGMRR0_GLS0_ISA950_IU1_K1_LBSPPA256_LBSPPB0_LBSPPM0_LPA16_LPB0_LPM0_LRVW16_LWPMn1_MIAV0_MIWT8_2_MO40_NTn1_NTA0_NTB0_NTC0_NTD0_NTM0_NEPBS0_NLCA1_NLCB1_ONLL1_PGR2_PLR1_PKA1_SIA3_SS1_SU0_SUM1_SUS64_SPO0_SRVW0_SSO0_SVW4_SK3_SKXCCM8_TLDS1_ULSGRO0_USL1_UIOFGRO0_USFGRO0_VSn1_VWA4_VWB2_WSGRA0_WSGRB0_WS64_WG64_4_1_WGM6_WGMXCC1_WGMXCCGn1
    SolutionIndex: 5
    SolutionNameMin: Cijk_Alik_Bjlk_I8_BH_UserArgs_MT256x256x64_MI32x32x1_SN_LDSB0_AFC0_AFEM1_AFEM1_ASEM1_CLR1_CADS0_DTVA0_DTVB0_EPS0_FDSI0_GRPM1_GRVWA16_GRVWB8_GSU0_GSUAMB_GSUC0_GSUWGMRR0_GLS0_ISA950_IU1_K1_LBSPPA256_LBSPPB0_LBSPPM0_LPA16_LPB0_LPM0_LRVW16_LWPMn1_MIAV0_MIWT4_4_MO40_NTn1_NTA0_NTB0_NTC0_NTD0_NTM0_NEPBS0_NLCA1_NLCB1_ONLL1_PGR2_PLR1_PKA1_SIA3_SS1_SU0_SUM1_SUS64_SPO0_SRVW0_SSO0_SVW4_SK3_SKXCCM8_TLDS1_ULSGRO0_USL1_UIOFGRO0_USFGRO0_VSn1_VWA4_VWB4_WSGRA0_WSGRB0_WS64_WG64_4_1_WGM6_WGMXCC1_WGMXCCGn1
    SolutionIndex: 6
    SolutionNameMin: Cijk_Alik_Bjlk_I8_BH_UserArgs_MT256x256x128_MI16x16x1_SN_LDSB1_AFC0_AFEM1_AFEM1_ASEM1_CLR1_CADS0_DTVA0_DTVB0_EPS0_FDSI0_GRPM1_GRVWA16_GRVWB16_GSU0_GSUAMB_GSUC0_GSUWGMRR0_GLS0_ISA950_IU1_K1_LBSPPA1024_LBSPPB4096_LBSPPM0_LPA32_LPB64_LPM0_LRVW16_LWPMn1_MIAV0_MIWT8_8_MO40_NTn1_NTA0_NTB0_NTC0_NTD0_NTM0_NEPBS0_NLCA1_NLCB1_ONLL1_PGR2_PLR1_PKA1_SIA3_SS1_SU0_SUM1_SUS128_SPO0_SRVW0_SSO0_SVW8_SK3_SKXCCM8_TLDS1_ULSGRO0_USL1_UIOFGRO0_USFGRO0_VSn1_VWA8_VWB4_WSGRA0_WSGRB0_WS64_WG32_8_1_WGM6_WGMXCC1_WGMXCCGn1
    SolutionIndex: 7
    SolutionNameMin: Cijk_Alik_Bjlk_I8_BH_UserArgs_MT256x256x128_MI16x16x1_SN_LDSB1_AFC0_AFEM1_AFEM1_ASEM1_CLR1_CADS0_DTVA0_DTVB0_EPS0_FDSI0_GRPM1_GRVWA16_GRVWB16_GSU0_GSUAMB_GSUC0_GSUWGMRR0_GLS0_ISA950_IU1_K1_LBSPPA256_LBSPPB4096_LBSPPM0_LPA32_LPB0_LPM0_LRVW16_LWPMn1_MIAV0_MIWT8_8_MO40_NTn1_NTA0_NTB0_NTC0_NTD0_NTM0_NEPBS0_NLCA1_NLCB1_ONLL1_PGR2_PLR1_PKA1_SIA3_SS1_SU0_SUM1_SUS128_SPO0_SRVW0_SSO0_SVW2_SK3_SKXCCM8_TLDS1_ULSGRO0_USL1_UIOFGRO0_USFGRO0_VSn1_VWA2_VWB8_WSGRA0_WSGRB0_WS64_WG32_8_1_WGM6_WGMXCC1_WGMXCCGn1
    SolutionIndex: 8
    SolutionNameMin: Cijk_Alik_Bjlk_I8_BH_UserArgs_MT256x256x128_MI16x16x1_SN_LDSB1_AFC0_AFEM1_AFEM1_ASEM1_CLR1_CADS0_DTVA0_DTVB0_EPS0_FDSI0_GRPM1_GRVWA16_GRVWB16_GSU0_GSUAMB_GSUC0_GSUWGMRR0_GLS0_ISA950_IU1_K1_LBSPPA512_LBSPPB4096_LBSPPM0_LPA32_LPB0_LPM0_LRVW16_LWPMn1_MIAV0_MIWT8_8_MO40_NTn1_NTA0_NTB0_NTC0_NTD0_NTM0_NEPBS0_NLCA1_NLCB1_ONLL1_PGR2_PLR1_PKA1_SIA3_SS1_SU0_SUM1_SUS128_SPO0_SRVW0_SSO0_SVW4_SK3_SKXCCM8_TLDS1_ULSGRO0_USL1_UIOFGRO0_USFGRO0_VSn1_VWA4_VWB8_WSGRA0_WSGRB0_WS64_WG32_8_1_WGM6_WGMXCC1_WGMXCCGn1
    SolutionIndex: 9
    SolutionNameMin: Cijk_Alik_Bjlk_I8_BH_UserArgs_MT256x256x128_MI16x16x1_SN_LDSB1_AFC0_AFEM1_AFEM1_ASEM1_CLR1_CADS0_DTVA0_DTVB0_EPS0_FDSI0_GRPM1_GRVWA16_GRVWB16_GSU0_GSUAMB_GSUC0_GSUWGMRR0_GLS0_ISA950_IU1_K1_LBSPPA1024_LBSPPB4096_LBSPPM0_LPA32_LPB0_LPM0_LRVW16_LWPMn1_MIAV0_MIWT8_8_MO40_NTn1_NTA0_NTB0_NTC0_NTD0_NTM0_NEPBS0_NLCA1_NLCB1_ONLL1_PGR2_PLR1_PKA1_SIA3_SS1_SU0_SUM1_SUS128_SPO0_SRVW0_SSO0_SVW8_SK3_SKXCCM8_TLDS1_ULSGRO0_USL1_UIOFGRO0_USFGRO0_VSn1_VWA8_VWB8_WSGRA0_WSGRB0_WS64_WG32_8_1_WGM6_WGMXCC1_WGMXCCGn1
    SolutionIndex: 10
    SolutionNameMin: Cijk_Alik_Bjlk_I8_BH_UserArgs_MT256x128x128_MI16x16x1_SN_LDSB1_AFC0_AFEM1_AFEM1_ASEM1_CLR1_CADS0_DTVA0_DTVB0_EPS0_FDSI0_GRPM1_GRVWA16_GRVWB4_GSU0_GSUAMB_GSUC0_GSUWGMRR0_GLS0_ISA950_IU1_K1_LBSPPA1024_LBSPPB2048_LBSPPM0_LPA32_LPB64_LPM0_LRVW16_LWPMn1_MIAV0_MIWT8_4_MO40_NTn1_NTA0_NTB0_NTC0_NTD0_NTM0_NEPBS0_NLCA1_NLCB1_ONLL1_PGR2_PLR1_PKA1_SIA3_SS1_SU0_SUM1_SUS128_SPO0_SRVW0_SSO0_SVW8_SK3_SKXCCM8_TLDS1_ULSGRO0_USL1_UIOFGRO0_USFGRO0_VSn1_VWA8_VWB4_WSGRA0_WSGRB0_WS64_WG32_8_1_WGM6_WGMXCC1_WGMXCCGn1
    SolutionIndex: 11
    SolutionNameMin: Cijk_Alik_Bjlk_I8_BH_UserArgs_MT256x128x128_MI16x16x1_SN_LDSB1_AFC0_AFEM1_AFEM1_ASEM1_CLR1_CADS0_DTVA0_DTVB0_EPS0_FDSI0_GRPM1_GRVWA16_GRVWB8_GSU0_GSUAMB_GSUC0_GSUWGMRR0_GLS0_ISA950_IU1_K1_LBSPPA1024_LBSPPB2048_LBSPPM0_LPA32_LPB64_LPM0_LRVW16_LWPMn1_MIAV0_MIWT8_4_MO40_NTn1_NTA0_NTB0_NTC0_NTD0_NTM0_NEPBS0_NLCA1_NLCB1_ONLL1_PGR2_PLR1_PKA1_SIA3_SS1_SU0_SUM1_SUS128_SPO0_SRVW0_SSO0_SVW8_SK3_SKXCCM8_TLDS1_ULSGRO0_USL1_UIOFGRO0_USFGRO0_VSn1_VWA8_VWB4_WSGRA0_WSGRB0_WS64_WG32_8_1_WGM6_WGMXCC1_WGMXCCGn1
    SolutionIndex: 12
    SolutionNameMin: Cijk_Alik_Bjlk_I8_BH_UserArgs_MT256x128x128_MI16x16x1_SN_LDSB1_AFC0_AFEM1_AFEM1_ASEM1_CLR1_CADS0_DTVA0_DTVB0_EPS0_FDSI0_GRPM1_GRVWA16_GRVWB16_GSU0_GSUAMB_GSUC0_GSUWGMRR0_GLS0_ISA950_IU1_K1_LBSPPA1024_LBSPPB2048_LBSPPM0_LPA32_LPB32_LPM0_LRVW16_LWPMn1_MIAV0_MIWT8_4_MO40_NTn1_NTA0_NTB0_NTC0_NTD0_NTM0_NEPBS0_NLCA1_NLCB1_ONLL1_PGR2_PLR1_PKA1_SIA3_SS1_SU0_SUM1_SUS128_SPO0_SRVW0_SSO0_SVW8_SK3_SKXCCM8_TLDS1_ULSGRO0_USL1_UIOFGRO0_USFGRO0_VSn1_VWA8_VWB2_WSGRA0_WSGRB0_WS64_WG32_8_1_WGM6_WGMXCC1_WGMXCCGn1
    SolutionIndex: 13
    SolutionNameMin: Cijk_Alik_Bjlk_I8_BH_UserArgs_MT256x128x128_MI16x16x1_SN_LDSB1_AFC0_AFEM1_AFEM1_ASEM1_CLR1_CADS0_DTVA0_DTVB0_EPS0_FDSI0_GRPM1_GRVWA16_GRVWB16_GSU0_GSUAMB_GSUC0_GSUWGMRR0_GLS0_ISA950_IU1_K1_LBSPPA256_LBSPPB2048_LBSPPM0_LPA32_LPB64_LPM0_LRVW16_LWPMn1_MIAV0_MIWT8_4_MO40_NTn1_NTA0_NTB0_NTC0_NTD0_NTM0_NEPBS0_NLCA1_NLCB1_ONLL1_PGR2_PLR1_PKA1_SIA3_SS1_SU0_SUM1_SUS128_SPO0_SRVW0_SSO0_SVW2_SK3_SKXCCM8_TLDS1_ULSGRO0_USL1_UIOFGRO0_USFGRO0_VSn1_VWA2_VWB4_WSGRA0_WSGRB0_WS64_WG32_8_1_WGM6_WGMXCC1_WGMXCCGn1
    SolutionIndex: 14
    SolutionNameMin: Cijk_Alik_Bjlk_I8_BH_UserArgs_MT256x128x128_MI16x16x1_SN_LDSB1_AFC0_AFEM1_AFEM1_ASEM1_CLR1_CADS0_DTVA0_DTVB0_EPS0_FDSI0_GRPM1_GRVWA16_GRVWB16_GSU0_GSUAMB_GSUC0_GSUWGMRR0_GLS0_ISA950_IU1_K1_LBSPPA512_LBSPPB2048_LBSPPM0_LPA32_LPB64_LPM0_LRVW16_LWPMn1_MIAV0_MIWT8_4_MO40_NTn1_NTA0_NTB0_NTC0_NTD0_NTM0_NEPBS0_NLCA1_NLCB1_ONLL1_PGR2_PLR1_PKA1_SIA3_SS1_SU0_SUM1_SUS128_SPO0_SRVW0_SSO0_SVW4_SK3_SKXCCM8_TLDS1_ULSGRO0_USL1_UIOFGRO0_USFGRO0_VSn1_VWA4_VWB4_WSGRA0_WSGRB0_WS64_WG32_8_1_WGM6_WGMXCC1_WGMXCCGn1
    SolutionIndex: 15
    SolutionNameMin: Cijk_Alik_Bjlk_I8_BH_UserArgs_MT256x128x128_MI16x16x1_SN_LDSB1_AFC0_AFEM1_AFEM1_ASEM1_CLR1_CADS0_DTVA0_DTVB0_EPS0_FDSI0_GRPM1_GRVWA16_GRVWB16_GSU0_GSUAMB_GSUC0_GSUWGMRR0_GLS0_ISA950_IU1_K1_LBSPPA1024_LBSPPB2048_LBSPPM0_LPA32_LPB64_LPM0_LRVW16_LWPMn1_MIAV0_MIWT8_4_MO40_NTn1_NTA0_NTB0_NTC0_NTD0_NTM0_NEPBS0_NLCA1_NLCB1_ONLL1_PGR2_PLR1_PKA1_SIA3_SS1_SU0_SUM1_SUS128_SPO0_SRVW0_SSO0_SVW8_SK3_SKXCCM8_TLDS1_ULSGRO0_USL1_UIOFGRO0_USFGRO0_VSn1_VWA8_VWB4_WSGRA0_WSGRB0_WS64_WG32_8_1_WGM6_WGMXCC1_WGMXCCGn1
    SolutionIndex: 16
    SolutionNameMin: Cijk_Alik_Bjlk_I8_BH_UserArgs_MT256x64x128_MI16x16x1_SN_LDSB1_AFC0_AFEM1_AFEM1_ASEM1_CLR1_CADS0_DTVA0_DTVB0_EPS0_FDSI0_GRPM1_GRVWA16_GRVWB4_GSU0_GSUAMB_GSUC0_GSUWGMRR0_GLS0_ISA950_IU1_K1_LBSPPA512_LBSPPB1024_LBSPPM0_LPA32_LPB32_LPM0_LRVW16_LWPMn1_MIAV0_MIWT8_2_MO40_NTn1_NTA0_NTB0_NTC0_NTD0_NTM0_NEPBS0_NLCA1_NLCB1_ONLL1_PGR2_PLR1_PKA1_SIA3_SS1_SU0_SUM1_SUS128_SPO0_SRVW0_SSO0_SVW4_SK3_SKXCCM8_TLDS1_ULSGRO0_USL1_UIOFGRO0_USFGRO0_VSn1_VWA4_VWB2_WSGRA0_WSGRB0_WS64_WG32_8_1_WGM6_WGMXCC1_WGMXCCGn1
    SolutionIndex: 17
    SolutionNameMin: Cijk_Alik_Bjlk_I8_BH_UserArgs_MT256x64x128_MI16x16x1_SN_LDSB1_AFC0_AFEM1_AFEM1_ASEM1_CLR1_CADS0_DTVA0_DTVB0_EPS0_FDSI0_GRPM1_GRVWA16_GRVWB4_GSU0_GSUAMB_GSUC0_GSUWGMRR0_GLS0_ISA950_IU1_K1_LBSPPA1024_LBSPPB1024_LBSPPM0_LPA32_LPB32_LPM0_LRVW16_LWPMn1_MIAV0_MIWT8_2_MO40_NTn1_NTA0_NTB0_NTC0_NTD0_NTM0_NEPBS0_NLCA1_NLCB1_ONLL1_PGR2_PLR1_PKA1_SIA3_SS1_SU0_SUM1_SUS128_SPO0_SRVW0_SSO0_SVW8_SK3_SKXCCM8_TLDS1_ULSGRO0_USL1_UIOFGRO0_USFGRO0_VSn1_VWA8_VWB2_WSGRA0_WSGRB0_WS64_WG32_8_1_WGM6_WGMXCC1_WGMXCCGn1
    SolutionIndex: 18
    SolutionNameMin: Cijk_Alik_Bjlk_I8_BH_UserArgs_MT256x64x128_MI16x16x1_SN_LDSB1_AFC0_AFEM1_AFEM1_ASEM1_CLR1_CADS0_DTVA0_DTVB0_EPS0_FDSI0_GRPM1_GRVWA16_GRVWB8_GSU0_GSUAMB_GSUC0_GSUWGMRR0_GLS0_ISA950_IU1_K1_LBSPPA1024_LBSPPB1024_LBSPPM0_LPA32_LPB32_LPM0_LRVW16_LWPMn1_MIAV0_MIWT8_2_MO40_NTn1_NTA0_NTB0_NTC0_NTD0_NTM0_NEPBS0_NLCA1_NLCB1_ONLL1_PGR2_PLR1_PKA1_SIA3_SS1_SU0_SUM1_SUS128_SPO0_SRVW0_SSO0_SVW8_SK3_SKXCCM8_TLDS1_ULSGRO0_USL1_UIOFGRO0_USFGRO0_VSn1_VWA8_VWB2_WSGRA0_WSGRB0_WS64_WG32_8_1_WGM6_WGMXCC1_WGMXCCGn1
    SolutionIndex: 19
    SolutionNameMin: Cijk_Alik_Bjlk_I8_BH_UserArgs_MT256x64x128_MI16x16x1_SN_LDSB1_AFC0_AFEM1_AFEM1_ASEM1_CLR1_CADS0_DTVA0_DTVB0_EPS0_FDSI0_GRPM1_GRVWA16_GRVWB16_GSU0_GSUAMB_GSUC0_GSUWGMRR0_GLS0_ISA950_IU1_K1_LBSPPA1024_LBSPPB1024_LBSPPM0_LPA32_LPB32_LPM0_LRVW16_LWPMn1_MIAV0_MIWT8_2_MO40_NTn1_NTA0_NTB0_NTC0_NTD0_NTM0_NEPBS0_NLCA1_NLCB1_ONLL1_PGR2_PLR1_PKA1_SIA3_SS1_SU0_SUM1_SUS128_SPO0_SRVW0_SSO0_SVW8_SK3_SKXCCM8_TLDS1_ULSGRO0_USL1_UIOFGRO0_USFGRO0_VSn1_VWA8_VWB2_WSGRA0_WSGRB0_WS64_WG32_8_1_WGM6_WGMXCC1_WGMXCCGn1
    SolutionIndex: 20
    SolutionNameMin: Cijk_Alik_Bjlk_I8_BH_UserArgs_MT128x128x128_MI16x16x1_SN_LDSB1_AFC0_AFEM1_AFEM1_ASEM1_CLR1_CADS0_DTVA0_DTVB0_EPS0_FDSI0_GRPM1_GRVWA16_GRVWB16_GSU0_GSUAMB_GSUC0_GSUWGMRR0_GLS0_ISA950_IU1_K1_LBSPPA256_LBSPPB2048_LBSPPM0_LPA32_LPB64_LPM0_LRVW16_LWPMn1_MIAV0_MIWT4_4_MO40_NTn1_NTA0_NTB0_NTC0_NTD0_NTM0_NEPBS0_NLCA1_NLCB1_ONLL1_PGR2_PLR1_PKA1_SIA3_SS1_SU0_SUM1_SUS128_SPO0_SRVW0_SSO0_SVW2_SK3_SKXCCM8_TLDS1_ULSGRO0_USL1_UIOFGRO0_USFGRO0_VSn1_VWA2_VWB4_WSGRA0_WSGRB0_WS64_WG32_8_1_WGM6_WGMXCC1_WGMXCCGn1
    SolutionIndex: 21
    SolutionNameMin: Cijk_Alik_Bjlk_I8_BH_UserArgs_MT128x128x128_MI16x16x1_SN_LDSB1_AFC0_AFEM1_AFEM1_ASEM1_CLR1_CADS0_DTVA0_DTVB0_EPS0_FDSI0_GRPM1_GRVWA16_GRVWB16_GSU0_GSUAMB_GSUC0_GSUWGMRR0_GLS0_ISA950_IU1_K1_LBSPPA512_LBSPPB2048_LBSPPM0_LPA32_LPB64_LPM0_LRVW16_LWPMn1_MIAV0_MIWT4_4_MO40_NTn1_NTA0_NTB0_NTC0_NTD0_NTM0_NEPBS0_NLCA1_NLCB1_ONLL1_PGR2_PLR1_PKA1_SIA3_SS1_SU0_SUM1_SUS128_SPO0_SRVW0_SSO0_SVW4_SK3_SKXCCM8_TLDS1_ULSGRO0_USL1_UIOFGRO0_USFGRO0_VSn1_VWA4_VWB4_WSGRA0_WSGRB0_WS64_WG32_8_1_WGM6_WGMXCC1_WGMXCCGn1
    SolutionIndex: 22
    SolutionNameMin: Cijk_Alik_Bjlk_I8_BH_UserArgs_MT128x64x128_MI16x16x1_SN_LDSB1_AFC0_AFEM1_AFEM1_ASEM1_CLR1_CADS0_DTVA0_DTVB0_EPS0_FDSI0_GRPM1_GRVWA16_GRVWB4_GSU0_GSUAMB_GSUC0_GSUWGMRR0_GLS0_ISA950_IU1_K1_LBSPPA256_LBSPPB1024_LBSPPM0_LPA32_LPB32_LPM0_LRVW16_LWPMn1_MIAV0_MIWT4_2_MO40_NTn1_NTA0_NTB0_NTC0_NTD0_NTM0_NEPBS0_NLCA1_NLCB1_ONLL1_PGR2_PLR1_PKA1_SIA3_SS1_SU0_SUM1_SUS128_SPO0_SRVW0_SSO0_SVW2_SK3_SKXCCM8_TLDS1_ULSGRO0_USL1_UIOFGRO0_USFGRO0_VSn1_VWA2_VWB2_WSGRA0_WSGRB0_WS64_WG32_8_1_WGM6_WGMXCC1_WGMXCCGn1
    SolutionIndex: 23
    SolutionNameMin: Cijk_Alik_Bjlk_I8_BH_UserArgs_MT128x64x128_MI16x16x1_SN_LDSB1_AFC0_AFEM1_AFEM1_ASEM1_CLR1_CADS0_DTVA0_DTVB0_EPS0_FDSI0_GRPM1_GRVWA16_GRVWB4_GSU0_GSUAMB_GSUC0_GSUWGMRR0_GLS0_ISA950_IU1_K1_LBSPPA512_LBSPPB1024_LBSPPM0_LPA32_LPB32_LPM0_LRVW16_LWPMn1_MIAV0_MIWT4_2_MO40_NTn1_NTA0_NTB0_NTC0_NTD0_NTM0_NEPBS0_NLCA1_NLCB1_ONLL1_PGR2_PLR1_PKA1_SIA3_SS1_SU0_SUM1_SUS128_SPO0_SRVW0_SSO0_SVW4_SK3_SKXCCM8_TLDS1_ULSGRO0_USL1_UIOFGRO0_USFGRO0_VSn1_VWA4_VWB2_WSGRA0_WSGRB0_WS64_WG32_8_1_WGM6_WGMXCC1_WGMXCCGn1
    SolutionIndex: 24
    SolutionNameMin: Cijk_Alik_Bjlk_I8_BH_UserArgs_MT128x64x128_MI16x16x1_SN_LDSB1_AFC0_AFEM1_AFEM1_ASEM1_CLR1_CADS0_DTVA0_DTVB0_EPS0_FDSI0_GRPM1_GRVWA16_GRVWB16_GSU0_GSUAMB_GSUC0_GSUWGMRR0_GLS0_ISA950_IU1_K1_LBSPPA256_LBSPPB1024_LBSPPM0_LPA32_LPB32_LPM0_LRVW16_LWPMn1_MIAV0_MIWT4_2_MO40_NTn1_NTA0_NTB0_NTC0_NTD0_NTM0_NEPBS0_NLCA1_NLCB1_ONLL1_PGR2_PLR1_PKA1_SIA3_SS1_SU0_SUM1_SUS128_SPO0_SRVW0_SSO0_SVW2_SK3_SKXCCM8_TLDS1_ULSGRO0_USL1_UIOFGRO0_USFGRO0_VSn1_VWA2_VWB2_WSGRA0_WSGRB0_WS64_WG32_8_1_WGM6_WGMXCC1_WGMXCCGn1
    SolutionIndex: 25
    SolutionNameMin: Cijk_Alik_Bjlk_I8_BH_UserArgs_MT64x64x128_MI16x16x1_SN_LDSB1_AFC0_AFEM1_AFEM1_ASEM1_CLR1_CADS0_DTVA0_DTVB0_EPS0_FDSI0_GRPM1_GRVWA4_GRVWB4_GSU0_GSUAMB_GSUC0_GSUWGMRR0_GLS0_ISA950_IU1_K1_LBSPPA256_LBSPPB1024_LBSPPM0_LPA32_LPB32_LPM0_LRVW16_LWPMn1_MIAV0_MIWT2_2_MO40_NTn1_NTA0_NTB0_NTC0_NTD0_NTM0_NEPBS0_NLCA1_NLCB1_ONLL1_PGR2_PLR1_PKA1_SIA3_SS1_SU0_SUM1_SUS128_SPO0_SRVW0_SSO0_SVW2_SK3_SKXCCM8_TLDS1_ULSGRO0_USL1_UIOFGRO0_USFGRO0_VSn1_VWA2_VWB2_WSGRA0_WSGRB0_WS64_WG32_8_1_WGM6_WGMXCC1_WGMXCCGn1
    SolutionIndex: 26
    SolutionNameMin: Cijk_Alik_Bjlk_I8_BH_UserArgs_MT64x64x128_MI16x16x1_SN_LDSB1_AFC0_AFEM1_AFEM1_ASEM1_CLR1_CADS0_DTVA0_DTVB0_EPS0_FDSI0_GRPM1_GRVWA16_GRVWB4_GSU0_GSUAMB_GSUC0_GSUWGMRR0_GLS0_ISA950_IU1_K1_LBSPPA256_LBSPPB1024_LBSPPM0_LPA32_LPB32_LPM0_LRVW16_LWPMn1_MIAV0_MIWT2_2_MO40_NTn1_NTA0_NTB0_NTC0_NTD0_NTM0_NEPBS0_NLCA1_NLCB1_ONLL1_PGR2_PLR1_PKA1_SIA3_SS1_SU0_SUM1_SUS128_SPO0_SRVW0_SSO0_SVW2_SK3_SKXCCM8_TLDS1_ULSGRO0_USL1_UIOFGRO0_USFGRO0_VSn1_VWA2_VWB2_WSGRA0_WSGRB0_WS64_WG32_8_1_WGM6_WGMXCC1_WGMXCCGn1
    SolutionIndex: 27
    SolutionNameMin: Cijk_Alik_Bjlk_I8_BH_UserArgs_MT64x64x128_MI16x16x1_SN_LDSB1_AFC0_AFEM1_AFEM1_ASEM1_CLR1_CADS0_DTVA0_DTVB0_EPS0_FDSI0_GRPM1_GRVWA16_GRVWB8_GSU0_GSUAMB_GSUC0_GSUWGMRR0_GLS0_ISA950_IU1_K1_LBSPPA256_LBSPPB1024_LBSPPM0_LPA32_LPB32_LPM0_LRVW16_LWPMn1_MIAV0_MIWT2_2_MO40_NTn1_NTA0_NTB0_NTC0_NTD0_NTM0_NEPBS0_NLCA1_NLCB1_ONLL1_PGR2_PLR1_PKA1_SIA3_SS1_SU0_SUM1_SUS128_SPO0_SRVW0_SSO0_SVW2_SK3_SKXCCM8_TLDS1_ULSGRO0_USL1_UIOFGRO0_USFGRO0_VSn1_VWA2_VWB2_WSGRA0_WSGRB0_WS64_WG32_8_1_WGM6_WGMXCC1_WGMXCCGn1
    SolutionIndex: 28
    SolutionNameMin: Cijk_Alik_Bjlk_I8_BH_UserArgs_MT64x64x128_MI16x16x1_SN_LDSB1_AFC0_AFEM1_AFEM1_ASEM1_CLR1_CADS0_DTVA0_DTVB0_EPS0_FDSI0_GRPM1_GRVWA16_GRVWB16_GSU0_GSUAMB_GSUC0_GSUWGMRR0_GLS0_ISA950_IU1_K1_LBSPPA256_LBSPPB1024_LBSPPM0_LPA32_LPB32_LPM0_LRVW16_LWPMn1_MIAV0_MIWT2_2_MO40_NTn1_NTA0_NTB0_NTC0_NTD0_NTM0_NEPBS0_NLCA1_NLCB1_ONLL1_PGR2_PLR1_PKA1_SIA3_SS1_SU0_SUM1_SUS128_SPO0_SRVW0_SSO0_SVW2_SK3_SKXCCM8_TLDS1_ULSGRO0_USL1_UIOFGRO0_USFGRO0_VSn1_VWA2_VWB2_WSGRA0_WSGRB0_WS64_WG32_8_1_WGM6_WGMXCC1_WGMXCCGn1
    SolutionIndex: 29
    SolutionNameMin: Cijk_Alik_Bjlk_I8_BH_UserArgs_MT256x256x128_MI32x32x1_SN_LDSB1_AFC0_AFEM1_AFEM1_ASEM1_CLR1_CADS0_DTVA0_DTVB0_EPS0_FDSI0_GRPM1_GRVWA16_GRVWB4_GSU0_GSUAMB_GSUC0_GSUWGMRR0_GLS0_ISA950_IU1_K1_LBSPPA512_LBSPPB0_LBSPPM0_LPA16_LPB0_LPM0_LRVW16_LWPMn1_MIAV0_MIWT4_4_MO40_NTn1_NTA0_NTB0_NTC0_NTD0_NTM0_NEPBS0_NLCA1_NLCB1_ONLL1_PGR2_PLR1_PKA1_SIA3_SS1_SU0_SUM1_SUS128_SPO0_SRVW0_SSO0_SVW4_SK3_SKXCCM8_TLDS1_ULSGRO0_USL1_UIOFGRO0_USFGRO0_VSn1_VWA4_VWB4_WSGRA0_WSGRB0_WS64_WG64_4_1_WGM6_WGMXCC1_WGMXCCGn1
    SolutionIndex: 30
    SolutionNameMin: Cijk_Alik_Bjlk_I8_BH_UserArgs_MT128x64x256_MI16x16x1_SN_LDSB1_AFC0_AFEM1_AFEM1_ASEM1_CLR1_CADS0_DTVA0_DTVB0_EPS0_FDSI0_GRPM1_GRVWA16_GRVWB16_GSU0_GSUAMB_GSUC0_GSUWGMRR0_GLS0_ISA950_IU1_K1_LBSPPA1024_LBSPPB1024_LBSPPM0_LPA32_LPB32_LPM0_LRVW16_LWPMn1_MIAV0_MIWT4_2_MO40_NTn1_NTA0_NTB0_NTC0_NTD0_NTM0_NEPBS0_NLCA1_NLCB1_ONLL1_PGR2_PLR1_PKA1_SIA3_SS1_SU0_SUM1_SUS256_SPO0_SRVW0_SSO0_SVW4_SK3_SKXCCM8_TLDS1_ULSGRO0_USL1_UIOFGRO0_USFGRO0_VSn1_VWA4_VWB2_WSGRA0_WSGRB0_WS64_WG32_8_1_WGM6_WGMXCC1_WGMXCCGn1
    SolutionIndex: 31
    SolutionNameMin: Cijk_Alik_Bjlk_I8_BH_UserArgs_MT128x64x256_MI16x16x1_SN_LDSB1_AFC0_AFEM1_AFEM1_ASEM1_CLR1_CADS0_DTVA0_DTVB0_EPS0_FDSI0_GRPM1_GRVWA16_GRVWB16_GSU0_GSUAMB_GSUC0_GSUWGMRR0_GLS0_ISA950_IU1_K1_LBSPPA512_LBSPPB1024_LBSPPM0_LPA32_LPB32_LPM0_LRVW16_LWPMn1_MIAV0_MIWT4_2_MO40_NTn1_NTA0_NTB0_NTC0_NTD0_NTM0_NEPBS0_NLCA1_NLCB1_ONLL1_PGR2_PLR2_PKA1_SIA3_SS1_SU0_SUM1_SUS256_SPO0_SRVW0_SSO0_SVW2_SK3_SKXCCM8_TLDS1_ULSGRO0_USL1_UIOFGRO0_USFGRO0_VSn1_VWA2_VWB2_WSGRA0_WSGRB0_WS64_WG32_8_1_WGM6_WGMXCC1_WGMXCCGn1
    SolutionIndex: 32
    SolutionNameMin: Cijk_Alik_Bjlk_I8_BH_UserArgs_MT128x64x256_MI16x16x1_SN_LDSB1_AFC0_AFEM1_AFEM1_ASEM1_CLR1_CADS0_DTVA0_DTVB0_EPS0_FDSI0_GRPM1_GRVWA16_GRVWB16_GSU0_GSUAMB_GSUC0_GSUWGMRR0_GLS0_ISA950_IU1_K1_LBSPPA1024_LBSPPB1024_LBSPPM0_LPA32_LPB32_LPM0_LRVW16_LWPMn1_MIAV0_MIWT4_2_MO40_NTn1_NTA0_NTB0_NTC0_NTD0_NTM0_NEPBS0_NLCA1_NLCB1_ONLL1_PGR2_PLR2_PKA1_SIA3_SS1_SU0_SUM1_SUS256_SPO0_SRVW0_SSO0_SVW4_SK3_SKXCCM8_TLDS1_ULSGRO0_USL1_UIOFGRO0_USFGRO0_VSn1_VWA4_VWB2_WSGRA0_WSGRB0_WS64_WG32_8_1_WGM6_WGMXCC1_WGMXCCGn1
    SolutionIndex: 33
    SolutionNameMin: Cijk_Alik_Bjlk_I8_BH_UserArgs_MT64x64x256_MI16x16x1_SN_LDSB1_AFC0_AFEM1_AFEM1_ASEM1_CLR1_CADS0_DTVA0_DTVB0_EPS0_FDSI0_GRPM1_GRVWA16_GRVWB4_GSU0_GSUAMB_GSUC0_GSUWGMRR0_GLS0_ISA950_IU1_K1_LBSPPA512_LBSPPB1024_LBSPPM0_LPA32_LPB32_LPM0_LRVW16_LWPMn1_MIAV0_MIWT2_2_MO40_NTn1_NTA0_NTB0_NTC0_NTD0_NTM0_NEPBS0_NLCA1_NLCB1_ONLL1_PGR2_PLR1_PKA1_SIA3_SS1_SU0_SUM1_SUS256_SPO0_SRVW0_SSO0_SVW2_SK3_SKXCCM8_TLDS1_ULSGRO0_USL1_UIOFGRO0_USFGRO0_VSn1_VWA2_VWB2_WSGRA0_WSGRB0_WS64_WG32_8_1_WGM6_WGMXCC1_WGMXCCGn1
    SolutionIndex: 34
    SolutionNameMin: Cijk_Alik_Bjlk_I8_BH_UserArgs_MT64x64x256_MI16x16x1_SN_LDSB1_AFC0_AFEM1_AFEM1_ASEM1_CLR1_CADS0_DTVA0_DTVB0_EPS0_FDSI0_GRPM1_GRVWA16_GRVWB8_GSU0_GSUAMB_GSUC0_GSUWGMRR0_GLS0_ISA950_IU1_K1_LBSPPA512_LBSPPB1024_LBSPPM0_LPA32_LPB32_LPM0_LRVW16_LWPMn1_MIAV0_MIWT2_2_MO40_NTn1_NTA0_NTB0_NTC0_NTD0_NTM0_NEPBS0_NLCA1_NLCB1_ONLL1_PGR2_PLR1_PKA1_SIA3_SS1_SU0_SUM1_SUS256_SPO0_SRVW0_SSO0_SVW2_SK3_SKXCCM8_TLDS1_ULSGRO0_USL1_UIOFGRO0_USFGRO0_VSn1_VWA2_VWB2_WSGRA0_WSGRB0_WS64_WG32_8_1_WGM6_WGMXCC1_WGMXCCGn1
    SolutionIndex: 35
    SolutionNameMin: Cijk_Alik_Bjlk_I8_BH_UserArgs_MT64x64x256_MI16x16x1_SN_LDSB1_AFC0_AFEM1_AFEM1_ASEM1_CLR1_CADS0_DTVA0_DTVB0_EPS0_FDSI0_GRPM1_GRVWA16_GRVWB16_GSU0_GSUAMB_GSUC0_GSUWGMRR0_GLS0_ISA950_IU1_K1_LBSPPA512_LBSPPB1024_LBSPPM0_LPA32_LPB32_LPM0_LRVW16_LWPMn1_MIAV0_MIWT2_2_MO40_NTn1_NTA0_NTB0_NTC0_NTD0_NTM0_NEPBS0_NLCA1_NLCB1_ONLL1_PGR2_PLR1_PKA1_SIA3_SS1_SU0_SUM1_SUS256_SPO0_SRVW0_SSO0_SVW2_SK3_SKXCCM8_TLDS1_ULSGRO0_USL1_UIOFGRO0_USFGRO0_VSn1_VWA2_VWB2_WSGRA0_WSGRB0_WS64_WG32_8_1_WGM6_WGMXCC1_WGMXCCGn1
    SolutionIndex: 36
    SolutionNameMin: Cijk_Alik_Bjlk_I8_BH_UserArgs_MT64x64x256_MI16x16x1_SN_LDSB1_AFC0_AFEM1_AFEM1_ASEM1_CLR1_CADS0_DTVA0_DTVB0_EPS0_FDSI0_GRPM1_GRVWA16_GRVWB4_GSU0_GSUAMB_GSUC0_GSUWGMRR0_GLS0_ISA950_IU1_K1_LBSPPA512_LBSPPB1024_LBSPPM0_LPA32_LPB32_LPM0_LRVW16_LWPMn1_MIAV0_MIWT2_2_MO40_NTn1_NTA0_NTB0_NTC0_NTD0_NTM0_NEPBS0_NLCA1_NLCB1_ONLL1_PGR2_PLR2_PKA1_SIA3_SS1_SU0_SUM1_SUS256_SPO0_SRVW0_SSO0_SVW2_SK3_SKXCCM8_TLDS1_ULSGRO0_USL1_UIOFGRO0_USFGRO0_VSn1_VWA2_VWB2_WSGRA0_WSGRB0_WS64_WG32_8_1_WGM6_WGMXCC1_WGMXCCGn1
    SolutionIndex: 37
    SolutionNameMin: Cijk_Alik_Bjlk_I8_BH_UserArgs_MT64x64x256_MI16x16x1_SN_LDSB1_AFC0_AFEM1_AFEM1_ASEM1_CLR1_CADS0_DTVA0_DTVB0_EPS0_FDSI0_GRPM1_GRVWA16_GRVWB8_GSU0_GSUAMB_GSUC0_GSUWGMRR0_GLS0_ISA950_IU1_K1_LBSPPA512_LBSPPB1024_LBSPPM0_LPA32_LPB32_LPM0_LRVW16_LWPMn1_MIAV0_MIWT2_2_MO40_NTn1_NTA0_NTB0_NTC0_NTD0_NTM0_NEPBS0_NLCA1_NLCB1_ONLL1_PGR2_PLR2_PKA1_SIA3_SS1_SU0_SUM1_SUS256_SPO0_SRVW0_SSO0_SVW2_SK3_SKXCCM8_TLDS1_ULSGRO0_USL1_UIOFGRO0_USFGRO0_VSn1_VWA2_VWB2_WSGRA0_WSGRB0_WS64_WG32_8_1_WGM6_WGMXCC1_WGMXCCGn1
    SolutionIndex: 38
    SolutionNameMin: Cijk_Alik_Bjlk_I8_BH_UserArgs_MT64x64x256_MI16x16x1_SN_LDSB1_AFC0_AFEM1_AFEM1_ASEM1_CLR1_CADS0_DTVA0_DTVB0_EPS0_FDSI0_GRPM1_GRVWA4_GRVWB16_GSU0_GSUAMB_GSUC0_GSUWGMRR0_GLS0_ISA950_IU1_K1_LBSPPA512_LBSPPB1024_LBSPPM0_LPA32_LPB32_LPM0_LRVW16_LWPMn1_MIAV0_MIWT2_2_MO40_NTn1_NTA0_NTB0_NTC0_NTD0_NTM0_NEPBS0_NLCA1_NLCB1_ONLL1_PGR2_PLR2_PKA1_SIA3_SS1_SU0_SUM1_SUS256_SPO0_SRVW0_SSO0_SVW2_SK3_SKXCCM8_TLDS1_ULSGRO0_USL1_UIOFGRO0_USFGRO0_VSn1_VWA2_VWB2_WSGRA0_WSGRB0_WS64_WG32_8_1_WGM6_WGMXCC1_WGMXCCGn1
    SolutionIndex: 39
    SolutionNameMin: Cijk_Alik_Bjlk_I8_BH_UserArgs_MT64x64x256_MI16x16x1_SN_LDSB1_AFC0_AFEM1_AFEM1_ASEM1_CLR1_CADS0_DTVA0_DTVB0_EPS0_FDSI0_GRPM1_GRVWA16_GRVWB16_GSU0_GSUAMB_GSUC0_GSUWGMRR0_GLS0_ISA950_IU1_K1_LBSPPA512_LBSPPB1024_LBSPPM0_LPA32_LPB32_LPM0_LRVW16_LWPMn1_MIAV0_MIWT2_2_MO40_NTn1_NTA0_NTB0_NTC0_NTD0_NTM0_NEPBS0_NLCA1_NLCB1_ONLL1_PGR2_PLR2_PKA1_SIA3_SS1_SU0_SUM1_SUS256_SPO0_SRVW0_SSO0_SVW2_SK3_SKXCCM8_TLDS1_ULSGRO0_USL1_UIOFGRO0_USFGRO0_VSn1_VWA2_VWB2_WSGRA0_WSGRB0_WS64_WG32_8_1_WGM6_WGMXCC1_WGMXCCGn1
- - - [128, 128, 1, 128, 128, 128, 128, 128]
    - [26, 0.39]
  - - [128, 128, 1, 256, 128, 128, 256, 128]
    - [33, 0.69]
  - - [128, 128, 1, 512, 128, 128, 512, 128]
    - [35, 1.13]
  - - [128, 128, 1, 1024, 128, 128, 1024, 128]
    - [39, 1.77]
  - - [128, 128, 1, 2048, 128, 128, 2048, 128]
    - [39, 2.45]
  - - [128, 128, 1, 4096, 128, 128, 4096, 128]
    - [39, 3.03]
  - - [128, 128, 1, 8192, 128, 128, 8192, 128]
    - [39, 3.48]
  - - [128, 256, 1, 128, 128, 128, 128, 256]
    - [25, 0.76]
  - - [128, 256, 1, 256, 128, 128, 256, 256]
    - [33, 1.32]
  - - [128, 256, 1, 512, 128, 128, 512, 256]
    - [35, 2.22]
  - - [128, 256, 1, 1024, 128, 128, 1024, 256]
    - [39, 3.47]
  - - [128, 256, 1, 2048, 128, 128, 2048, 256]
    - [39, 4.83]
  - - [128, 256, 1, 4096, 128, 128, 4096, 256]
    - [39, 6.07]
  - - [128, 256, 1, 8192, 128, 128, 8192, 256]
    - [39, 6.94]
  - - [128, 512, 1, 128, 128, 128, 128, 512]
    - [26, 1.49]
  - - [128, 512, 1, 256, 128, 128, 256, 512]
    - [26, 2.65]
  - - [128, 512, 1, 512, 128, 128, 512, 512]
    - [26, 4.42]
  - - [128, 512, 1, 1024, 128, 128, 1024, 512]
    - [35, 6.92]
  - - [128, 512, 1, 2048, 128, 128, 2048, 512]
    - [39, 9.69]
  - - [128, 512, 1, 4096, 128, 128, 4096, 512]
    - [39, 12.0]
  - - [128, 512, 1, 8192, 128, 128, 8192, 512]
    - [39, 13.77]
  - - [128, 1024, 1, 128, 128, 128, 128, 1024]
    - [28, 2.97]
  - - [128, 1024, 1, 256, 128, 128, 256, 1024]
    - [37, 5.27]
  - - [128, 1024, 1, 512, 128, 128, 512, 1024]
    - [28, 8.75]
  - - [128, 1024, 1, 1024, 128, 128, 1024, 1024]
    - [39, 13.58]
  - - [128, 1024, 1, 2048, 128, 128, 2048, 1024]
    - [39, 18.56]
  - - [128, 1024, 1, 4096, 128, 128, 4096, 1024]
    - [39, 23.07]
  - - [128, 1024, 1, 8192, 128, 128, 8192, 1024]
    - [39, 26.18]
  - - [128, 2048, 1, 128, 128, 128, 128, 2048]
    - [28, 5.87]
  - - [128, 2048, 1, 256, 128, 128, 256, 2048]
    - [26, 10.34]
  - - [128, 2048, 1, 512, 128, 128, 512, 2048]
    - [28, 17.07]
  - - [128, 2048, 1, 1024, 128, 128, 1024, 2048]
    - [39, 26.23]
  - - [128, 2048, 1, 2048, 128, 128, 2048, 2048]
    - [39, 36.52]
  - - [128, 2048, 1, 4096, 128, 128, 4096, 2048]
    - [39, 45.41]
  - - [128, 2048, 1, 8192, 128, 128, 8192, 2048]
    - [39, 52.17]
  - - [128, 4096, 1, 128, 128, 128, 128, 4096]
    - [26, 11.59]
  - - [128, 4096, 1, 256, 128, 128, 256, 4096]
    - [26, 20.17]
  - - [128, 4096, 1, 512, 128, 128, 512, 4096]
    - [26, 33.2]
  - - [128, 4096, 1, 1024, 128, 128, 1024, 4096]
    - [35, 51.43]
  - - [128, 4096, 1, 2048, 128, 128, 2048, 4096]
    - [39, 71.64]
  - - [128, 4096, 1, 4096, 128, 128, 4096, 4096]
    - [39, 90.17]
  - - [128, 4096, 1, 8192, 128, 128, 8192, 4096]
    - [39, 100.62]
  - - [128, 8192, 1, 128, 128, 128, 128, 8192]
    - [26, 22.33]
  - - [128, 8192, 1, 256, 128, 128, 256, 8192]
    - [37, 38.37]
  - - [128, 8192, 1, 512, 128, 128, 512, 8192]
    - [28, 64.15]
  - - [128, 8192, 1, 1024, 128, 128, 1024, 8192]
    - [39, 99.01]
  - - [128, 8192, 1, 2048, 128, 128, 2048, 8192]
    - [39, 139.77]
  - - [128, 8192, 1, 4096, 128, 128, 4096, 8192]
    - [39, 168.05]
  - - [128, 8192, 1, 8192, 128, 128, 8192, 8192]
    - [39, 192.59]
  - - [256, 128, 1, 128, 256, 256, 128, 128]
    - [26, 0.75]
  - - [256, 128, 1, 256, 256, 256, 256, 128]
    - [33, 1.33]
  - - [256, 128, 1, 512, 256, 256, 512, 128]
    - [35, 2.22]
  - - [256, 128, 1, 1024, 256, 256, 1024, 128]
    - [39, 3.47]
  - - [256, 128, 1, 2048, 256, 256, 2048, 128]
    - [39, 4.88]
  - - [256, 128, 1, 4096, 256, 256, 4096, 128]
    - [39, 6.02]
  - - [256, 128, 1, 8192, 256, 256, 8192, 128]
    - [39, 6.92]
  - - [256, 256, 1, 128, 256, 256, 128, 256]
    - [26, 1.52]
  - - [256, 256, 1, 256, 256, 256, 256, 256]
    - [36, 2.66]
  - - [256, 256, 1, 512, 256, 256, 512, 256]
    - [26, 4.41]
  - - [256, 256, 1, 1024, 256, 256, 1024, 256]
    - [35, 6.95]
  - - [256, 256, 1, 2048, 256, 256, 2048, 256]
    - [39, 9.74]
  - - [256, 256, 1, 4096, 256, 256, 4096, 256]
    - [39, 12.2]
  - - [256, 256, 1, 8192, 256, 256, 8192, 256]
    - [39, 13.96]
  - - [256, 512, 1, 128, 256, 256, 128, 512]
    - [27, 3.03]
  - - [256, 512, 1, 256, 256, 256, 256, 512]
    - [26, 5.32]
  - - [256, 512, 1, 512, 256, 256, 512, 512]
    - [39, 8.9]
  - - [256, 512, 1, 1024, 256, 256, 1024, 512]
    - [39, 13.76]
  - - [256, 512, 1, 2048, 256, 256, 2048, 512]
    - [39, 19.26]
  - - [256, 512, 1, 4096, 256, 256, 4096, 512]
    - [39, 24.03]
  - - [256, 512, 1, 8192, 256, 256, 8192, 512]
    - [39, 27.65]
  - - [256, 1024, 1, 128, 256, 256, 128, 1024]
    - [26, 5.95]
  - - [256, 1024, 1, 256, 256, 256, 256, 1024]
    - [36, 10.49]
  - - [256, 1024, 1, 512, 256, 256, 512, 1024]
    - [39, 17.35]
  - - [256, 1024, 1, 1024, 256, 256, 1024, 1024]
    - [39, 26.89]
  - - [256, 1024, 1, 2048, 256, 256, 2048, 1024]
    - [39, 37.72]
  - - [256, 1024, 1, 4096, 256, 256, 4096, 1024]
    - [39, 46.47]
  - - [256, 1024, 1, 8192, 256, 256, 8192, 1024]
    - [39, 53.3]
  - - [256, 2048, 1, 128, 256, 256, 128, 2048]
    - [25, 11.62]
  - - [256, 2048, 1, 256, 256, 256, 256, 2048]
    - [26, 20.54]
  - - [256, 2048, 1, 512, 256, 256, 512, 2048]
    - [28, 33.49]
  - - [256, 2048, 1, 1024, 256, 256, 1024, 2048]
    - [39, 52.53]
  - - [256, 2048, 1, 2048, 256, 256, 2048, 2048]
    - [39, 73.44]
  - - [256, 2048, 1, 4096, 256, 256, 4096, 2048]
    - [39, 90.71]
  - - [256, 2048, 1, 8192, 256, 256, 8192, 2048]
    - [39, 105.51]
  - - [256, 4096, 1, 128, 256, 256, 128, 4096]
    - [26, 22.75]
  - - [256, 4096, 1, 256, 256, 256, 256, 4096]
    - [26, 39.17]
  - - [256, 4096, 1, 512, 256, 256, 512, 4096]
    - [26, 65.05]
  - - [256, 4096, 1, 1024, 256, 256, 1024, 4096]
    - [38, 100.52]
  - - [256, 4096, 1, 2048, 256, 256, 2048, 4096]
    - [39, 142.29]
  - - [256, 4096, 1, 4096, 256, 256, 4096, 4096]
    - [39, 177.7]
  - - [256, 4096, 1, 8192, 256, 256, 8192, 4096]
    - [39, 200.68]
  - - [256, 8192, 1, 128, 256, 256, 128, 8192]
    - [22, 40.43]
  - - [256, 8192, 1, 256, 256, 256, 256, 8192]
    - [22, 69.86]
  - - [256, 8192, 1, 512, 256, 256, 512, 8192]
    - [24, 117.95]
  - - [256, 8192, 1, 1024, 256, 256, 1024, 8192]
    - [32, 180.26]
  - - [256, 8192, 1, 2048, 256, 256, 2048, 8192]
    - [32, 252.66]
  - - [256, 8192, 1, 4096, 256, 256, 4096, 8192]
    - [30, 302.36]
  - - [256, 8192, 1, 8192, 256, 256, 8192, 8192]
    - [32, 346.23]
  - - [512, 128, 1, 128, 512, 512, 128, 128]
    - [25, 1.51]
  - - [512, 128, 1, 256, 512, 512, 256, 128]
    - [33, 2.68]
  - - [512, 128, 1, 512, 512, 512, 512, 128]
    - [39, 4.45]
  - - [512, 128, 1, 1024, 512, 512, 1024, 128]
    - [35, 7.0]
  - - [512, 128, 1, 2048, 512, 512, 2048, 128]
    - [39, 9.8]
  - - [512, 128, 1, 4096, 512, 512, 4096, 128]
    - [39, 12.18]
  - - [512, 128, 1, 8192, 512, 512, 8192, 128]
    - [39, 13.87]
  - - [512, 256, 1, 128, 512, 512, 128, 256]
    - [26, 2.95]
  - - [512, 256, 1, 256, 512, 512, 256, 256]
    - [34, 5.22]
  - - [512, 256, 1, 512, 512, 512, 512, 256]
    - [39, 8.74]
  - - [512, 256, 1, 1024, 512, 512, 1024, 256]
    - [35, 13.55]
  - - [512, 256, 1, 2048, 512, 512, 2048, 256]
    - [39, 19.08]
  - - [512, 256, 1, 4096, 512, 512, 4096, 256]
    - [39, 24.08]
  - - [512, 256, 1, 8192, 512, 512, 8192, 256]
    - [39, 27.59]
  - - [512, 512, 1, 128, 512, 512, 128, 512]
    - [26, 5.85]
  - - [512, 512, 1, 256, 512, 512, 256, 512]
    - [37, 10.42]
  - - [512, 512, 1, 512, 512, 512, 512, 512]
    - [28, 17.08]
  - - [512, 512, 1, 1024, 512, 512, 1024, 512]
    - [39, 27.0]
  - - [512, 512, 1, 2048, 512, 512, 2048, 512]
    - [39, 37.56]
  - - [512, 512, 1, 4096, 512, 512, 4096, 512]
    - [39, 47.56]
  - - [512, 512, 1, 8192, 512, 512, 8192, 512]
    - [39, 54.62]
  - - [512, 1024, 1, 128, 512, 512, 128, 1024]
    - [26, 11.63]
  - - [512, 1024, 1, 256, 512, 512, 256, 1024]
    - [34, 20.38]
  - - [512, 1024, 1, 512, 512, 512, 512, 1024]
    - [39, 33.69]
  - - [512, 1024, 1, 1024, 512, 512, 1024, 1024]
    - [38, 52.42]
  - - [512, 1024, 1, 2048, 512, 512, 2048, 1024]
    - [39, 74.25]
  - - [512, 1024, 1, 4096, 512, 512, 4096, 1024]
    - [39, 92.78]
  - - [512, 1024, 1, 8192, 512, 512, 8192, 1024]
    - [39, 105.69]
  - - [512, 2048, 1, 128, 512, 512, 128, 2048]
    - [26, 22.64]
  - - [512, 2048, 1, 256, 512, 512, 256, 2048]
    - [37, 39.08]
  - - [512, 2048, 1, 512, 512, 512, 512, 2048]
    - [26, 64.34]
  - - [512, 2048, 1, 1024, 512, 512, 1024, 2048]
    - [39, 101.78]
  - - [512, 2048, 1, 2048, 512, 512, 2048, 2048]
    - [39, 142.42]
  - - [512, 2048, 1, 4096, 512, 512, 4096, 2048]
    - [39, 178.18]
  - - [512, 2048, 1, 8192, 512, 512, 8192, 2048]
    - [39, 204.83]
  - - [512, 4096, 1, 128, 512, 512, 128, 4096]
    - [22, 40.0]
  - - [512, 4096, 1, 256, 512, 512, 256, 4096]
    - [22, 70.15]
  - - [512, 4096, 1, 512, 512, 512, 512, 4096]
    - [24, 116.92]
  - - [512, 4096, 1, 1024, 512, 512, 1024, 4096]
    - [31, 181.24]
  - - [512, 4096, 1, 2048, 512, 512, 2048, 4096]
    - [32, 253.09]
  - - [512, 4096, 1, 4096, 512, 512, 4096, 4096]
    - [31, 316.86]
  - - [512, 4096, 1, 8192, 512, 512, 8192, 4096]
    - [32, 351.12]
  - - [512, 8192, 1, 128, 512, 512, 128, 8192]
    - [18, 64.19]
  - - [512, 8192, 1, 256, 512, 512, 256, 8192]
    - [19, 112.69]
  - - [512, 8192, 1, 512, 512, 512, 512, 8192]
    - [19, 189.45]
  - - [512, 8192, 1, 1024, 512, 512, 1024, 8192]
    - [21, 288.3]
  - - [512, 8192, 1, 2048, 512, 512, 2048, 8192]
    - [21, 390.19]
  - - [512, 8192, 1, 4096, 512, 512, 4096, 8192]
    - [20, 469.2]
  - - [512, 8192, 1, 8192, 512, 512, 8192, 8192]
    - [20, 501.6]
  - - [1024, 128, 1, 128, 1024, 1024, 128, 128]
    - [26, 2.98]
  - - [1024, 128, 1, 256, 1024, 1024, 256, 128]
    - [36, 5.28]
  - - [1024, 128, 1, 512, 1024, 1024, 512, 128]
    - [39, 8.78]
  - - [1024, 128, 1, 1024, 1024, 1024, 1024, 128]
    - [39, 13.8]
  - - [1024, 128, 1, 2048, 1024, 1024, 2048, 128]
    - [39, 19.61]
  - - [1024, 128, 1, 4096, 1024, 1024, 4096, 128]
    - [39, 24.37]
  - - [1024, 128, 1, 8192, 1024, 1024, 8192, 128]
    - [39, 27.79]
  - - [1024, 256, 1, 128, 1024, 1024, 128, 256]
    - [26, 5.98]
  - - [1024, 256, 1, 256, 1024, 1024, 256, 256]
    - [34, 10.58]
  - - [1024, 256, 1, 512, 1024, 1024, 512, 256]
    - [39, 17.57]
  - - [1024, 256, 1, 1024, 1024, 1024, 1024, 256]
    - [39, 27.54]
  - - [1024, 256, 1, 2048, 1024, 1024, 2048, 256]
    - [39, 38.39]
  - - [1024, 256, 1, 4096, 1024, 1024, 4096, 256]
    - [39, 48.02]
  - - [1024, 256, 1, 8192, 1024, 1024, 8192, 256]
    - [39, 55.5]
  - - [1024, 512, 1, 128, 1024, 1024, 128, 512]
    - [28, 11.72]
  - - [1024, 512, 1, 256, 1024, 1024, 256, 512]
    - [33, 21.02]
  - - [1024, 512, 1, 512, 1024, 1024, 512, 512]
    - [35, 34.29]
  - - [1024, 512, 1, 1024, 1024, 1024, 1024, 512]
    - [39, 53.72]
  - - [1024, 512, 1, 2048, 1024, 1024, 2048, 512]
    - [39, 75.6]
  - - [1024, 512, 1, 4096, 1024, 1024, 4096, 512]
    - [39, 94.24]
  - - [1024, 512, 1, 8192, 1024, 1024, 8192, 512]
    - [39, 108.3]
  - - [1024, 1024, 1, 128, 1024, 1024, 128, 1024]
    - [26, 23.28]
  - - [1024, 1024, 1, 256, 1024, 1024, 256, 1024]
    - [33, 40.51]
  - - [1024, 1024, 1, 512, 1024, 1024, 512, 1024]
    - [28, 66.06]
  - - [1024, 1024, 1, 1024, 1024, 1024, 1024, 1024]
    - [38, 103.61]
  - - [1024, 1024, 1, 2048, 1024, 1024, 2048, 1024]
    - [39, 144.99]
  - - [1024, 1024, 1, 4096, 1024, 1024, 4096, 1024]
    - [39, 180.09]
  - - [1024, 1024, 1, 8192, 1024, 1024, 8192, 1024]
    - [39, 207.82]
  - - [1024, 2048, 1, 128, 1024, 1024, 128, 2048]
    - [22, 40.86]
  - - [1024, 2048, 1, 256, 1024, 1024, 256, 2048]
    - [23, 70.78]
  - - [1024, 2048, 1, 512, 1024, 1024, 512, 2048]
    - [22, 119.84]
  - - [1024, 2048, 1, 1024, 1024, 1024, 1024, 2048]
    - [31, 182.58]
  - - [1024, 2048, 1, 2048, 1024, 1024, 2048, 2048]
    - [31, 255.97]
  - - [1024, 2048, 1, 4096, 1024, 1024, 4096, 2048]
    - [32, 319.14]
  - - [1024, 2048, 1, 8192, 1024, 1024, 8192, 2048]
    - [31, 363.47]
  - - [1024, 4096, 1, 128, 1024, 1024, 128, 4096]
    - [16, 65.44]
  - - [1024, 4096, 1, 256, 1024, 1024, 256, 4096]
    - [19, 114.31]
  - - [1024, 4096, 1, 512, 1024, 1024, 512, 4096]
    - [21, 193.0]
  - - [1024, 4096, 1, 1024, 1024, 1024, 1024, 4096]
    - [21, 290.38]
  - - [1024, 4096, 1, 2048, 1024, 1024, 2048, 4096]
    - [21, 394.65]
  - - [1024, 4096, 1, 4096, 1024, 1024, 4096, 4096]
    - [21, 472.36]
  - - [1024, 4096, 1, 8192, 1024, 1024, 8192, 4096]
    - [21, 516.31]
  - - [1024, 8192, 1, 128, 1024, 1024, 128, 8192]
    - [10, 96.51]
  - - [1024, 8192, 1, 256, 1024, 1024, 256, 8192]
    - [11, 168.46]
  - - [1024, 8192, 1, 512, 1024, 1024, 512, 8192]
    - [15, 283.83]
  - - [1024, 8192, 1, 1024, 1024, 1024, 1024, 8192]
    - [15, 417.08]
  - - [1024, 8192, 1, 2048, 1024, 1024, 2048, 8192]
    - [14, 551.61]
  - - [1024, 8192, 1, 4096, 1024, 1024, 4096, 8192]
    - [15, 655.16]
  - - [1024, 8192, 1, 8192, 1024, 1024, 8192, 8192]
    - [15, 674.24]
  - - [2048, 128, 1, 128, 2048, 2048, 128, 128]
    - [25, 5.95]
  - - [2048, 128, 1, 256, 2048, 2048, 256, 128]
    - [36, 10.52]
  - - [2048, 128, 1, 512, 2048, 2048, 512, 128]
    - [39, 17.6]
  - - [2048, 128, 1, 1024, 2048, 2048, 1024, 128]
    - [39, 27.48]
  - - [2048, 128, 1, 2048, 2048, 2048, 2048, 128]
    - [39, 38.71]
  - - [2048, 128, 1, 4096, 2048, 2048, 4096, 128]
    - [39, 48.18]
  - - [2048, 128, 1, 8192, 2048, 2048, 8192, 128]
    - [39, 55.41]
  - - [2048, 256, 1, 128, 2048, 2048, 128, 256]
    - [26, 11.77]
  - - [2048, 256, 1, 256, 2048, 2048, 256, 256]
    - [36, 20.89]
  - - [2048, 256, 1, 512, 2048, 2048, 512, 256]
    - [39, 34.41]
  - - [2048, 256, 1, 1024, 2048, 2048, 1024, 256]
    - [39, 53.7]
  - - [2048, 256, 1, 2048, 2048, 2048, 2048, 256]
    - [39, 75.88]
  - - [2048, 256, 1, 4096, 2048, 2048, 4096, 256]
    - [39, 94.38]
  - - [2048, 256, 1, 8192, 2048, 2048, 8192, 256]
    - [39, 108.62]
  - - [2048, 512, 1, 128, 2048, 2048, 128, 512]
    - [25, 22.82]
  - - [2048, 512, 1, 256, 2048, 2048, 256, 512]
    - [36, 40.18]
  - - [2048, 512, 1, 512, 2048, 2048, 512, 512]
    - [35, 66.74]
  - - [2048, 512, 1, 1024, 2048, 2048, 1024, 512]
    - [39, 105.17]
  - - [2048, 512, 1, 2048, 2048, 2048, 2048, 512]
    - [39, 144.98]
  - - [2048, 512, 1, 4096, 2048, 2048, 4096, 512]
    - [39, 182.55]
  - - [2048, 512, 1, 8192, 2048, 2048, 8192, 512]
    - [39, 206.65]
  - - [2048, 1024, 1, 128, 2048, 2048, 128, 1024]
    - [22, 41.1]
  - - [2048, 1024, 1, 256, 2048, 2048, 256, 1024]
    - [22, 72.07]
  - - [2048, 1024, 1, 512, 2048, 2048, 512, 1024]
    - [24, 121.29]
  - - [2048, 1024, 1, 1024, 2048, 2048, 1024, 1024]
    - [31, 184.0]
  - - [2048, 1024, 1, 2048, 2048, 2048, 2048, 1024]
    - [31, 257.61]
  - - [2048, 1024, 1, 4096, 2048, 2048, 4096, 1024]
    - [31, 321.93]
  - - [2048, 1024, 1, 8192, 2048, 2048, 8192, 1024]
    - [31, 364.02]
  - - [2048, 2048, 1, 128, 2048, 2048, 128, 2048]
    - [3, 65.95]
  - - [2048, 2048, 1, 256, 2048, 2048, 256, 2048]
    - [21, 114.91]
  - - [2048, 2048, 1, 512, 2048, 2048, 512, 2048]
    - [21, 193.06]
  - - [2048, 2048, 1, 1024, 2048, 2048, 1024, 2048]
    - [21, 292.75]
  - - [2048, 2048, 1, 2048, 2048, 2048, 2048, 2048]
    - [21, 393.62]
  - - [2048, 2048, 1, 4096, 2048, 2048, 4096, 2048]
    - [20, 475.15]
  - - [2048, 2048, 1, 8192, 2048, 2048, 8192, 2048]
    - [20, 518.47]
  - - [2048, 4096, 1, 128, 2048, 2048, 128, 4096]
    - [10, 98.77]
  - - [2048, 4096, 1, 256, 2048, 2048, 256, 4096]
    - [2, 168.43]
  - - [2048, 4096, 1, 512, 2048, 2048, 512, 4096]
    - [15, 284.19]
  - - [2048, 4096, 1, 1024, 2048, 2048, 1024, 4096]
    - [15, 420.87]
  - - [2048, 4096, 1, 2048, 2048, 2048, 2048, 4096]
    - [15, 553.1]
  - - [2048, 4096, 1, 4096, 2048, 2048, 4096, 4096]
    - [14, 647.99]
  - - [2048, 4096, 1, 8192, 2048, 2048, 8192, 4096]
    - [13, 682.35]
  - - [2048, 8192, 1, 128, 2048, 2048, 128, 8192]
    - [1, 120.59]
  - - [2048, 8192, 1, 256, 2048, 2048, 256, 8192]
    - [1, 212.24]
  - - [2048, 8192, 1, 512, 2048, 2048, 512, 8192]
    - [5, 349.82]
  - - [2048, 8192, 1, 1024, 2048, 2048, 1024, 8192]
    - [9, 528.2]
  - - [2048, 8192, 1, 2048, 2048, 2048, 2048, 8192]
    - [9, 720.24]
  - - [2048, 8192, 1, 4096, 2048, 2048, 4096, 8192]
    - [8, 837.85]
  - - [2048, 8192, 1, 8192, 2048, 2048, 8192, 8192]
    - [8, 847.9]
  - - [4096, 128, 1, 128, 4096, 4096, 128, 128]
    - [26, 11.91]
  - - [4096, 128, 1, 256, 4096, 4096, 256, 128]
    - [33, 20.84]
  - - [4096, 128, 1, 512, 4096, 4096, 512, 128]
    - [39, 34.12]
  - - [4096, 128, 1, 1024, 4096, 4096, 1024, 128]
    - [39, 53.57]
  - - [4096, 128, 1, 2048, 4096, 4096, 2048, 128]
    - [39, 75.87]
  - - [4096, 128, 1, 4096, 4096, 4096, 4096, 128]
    - [39, 95.28]
  - - [4096, 128, 1, 8192, 4096, 4096, 8192, 128]
    - [39, 108.53]
  - - [4096, 256, 1, 128, 4096, 4096, 128, 256]
    - [26, 22.98]
  - - [4096, 256, 1, 256, 4096, 4096, 256, 256]
    - [33, 40.0]
  - - [4096, 256, 1, 512, 4096, 4096, 512, 256]
    - [39, 66.54]
  - - [4096, 256, 1, 1024, 4096, 4096, 1024, 256]
    - [39, 103.85]
  - - [4096, 256, 1, 2048, 4096, 4096, 2048, 256]
    - [39, 145.71]
  - - [4096, 256, 1, 4096, 4096, 4096, 4096, 256]
    - [39, 181.74]
  - - [4096, 256, 1, 8192, 4096, 4096, 8192, 256]
    - [39, 206.66]
  - - [4096, 512, 1, 128, 4096, 4096, 128, 512]
    - [23, 40.48]
  - - [4096, 512, 1, 256, 4096, 4096, 256, 512]
    - [22, 71.63]
  - - [4096, 512, 1, 512, 4096, 4096, 512, 512]
    - [24, 119.43]
  - - [4096, 512, 1, 1024, 4096, 4096, 1024, 512]
    - [31, 183.71]
  - - [4096, 512, 1, 2048, 4096, 4096, 2048, 512]
    - [32, 257.39]
  - - [4096, 512, 1, 4096, 4096, 4096, 4096, 512]
    - [31, 317.92]
  - - [4096, 512, 1, 8192, 4096, 4096, 8192, 512]
    - [32, 363.91]
  - - [4096, 1024, 1, 128, 4096, 4096, 128, 1024]
    - [17, 66.16]
  - - [4096, 1024, 1, 256, 4096, 4096, 256, 1024]
    - [21, 115.32]
  - - [4096, 1024, 1, 512, 4096, 4096, 512, 1024]
    - [21, 193.48]
  - - [4096, 1024, 1, 1024, 4096, 4096, 1024, 1024]
    - [21, 293.0]
  - - [4096, 1024, 1, 2048, 4096, 4096, 2048, 1024]
    - [21, 392.5]
  - - [4096, 1024, 1, 4096, 4096, 4096, 4096, 1024]
    - [21, 475.33]
  - - [4096, 1024, 1, 8192, 4096, 4096, 8192, 1024]
    - [21, 518.7]
  - - [4096, 2048, 1, 128, 4096, 4096, 128, 2048]
    - [11, 99.21]
  - - [4096, 2048, 1, 256, 4096, 4096, 256, 2048]
    - [11, 168.93]
  - - [4096, 2048, 1, 512, 4096, 4096, 512, 2048]
    - [15, 284.09]
  - - [4096, 2048, 1, 1024, 4096, 4096, 1024, 2048]
    - [15, 421.44]
  - - [4096, 2048, 1, 2048, 4096, 4096, 2048, 2048]
    - [15, 554.11]
  - - [4096, 2048, 1, 4096, 4096, 4096, 4096, 2048]
    - [15, 661.49]
  - - [4096, 2048, 1, 8192, 4096, 4096, 8192, 2048]
    - [13, 674.27]
  - - [4096, 4096, 1, 128, 4096, 4096, 128, 4096]
    - [0, 120.25]
  - - [4096, 4096, 1, 256, 4096, 4096, 256, 4096]
    - [1, 213.12]
  - - [4096, 4096, 1, 512, 4096, 4096, 512, 4096]
    - [6, 350.35]
  - - [4096, 4096, 1, 1024, 4096, 4096, 1024, 4096]
    - [8, 525.85]
  - - [4096, 4096, 1, 2048, 4096, 4096, 2048, 4096]
    - [8, 712.74]
  - - [4096, 4096, 1, 4096, 4096, 4096, 4096, 4096]
    - [7, 841.96]
  - - [4096, 4096, 1, 8192, 4096, 4096, 8192, 4096]
    - [9, 846.6]
  - - [4096, 8192, 1, 128, 4096, 4096, 128, 8192]
    - [1, 138.28]
  - - [4096, 8192, 1, 256, 4096, 4096, 256, 8192]
    - [1, 242.55]
  - - [4096, 8192, 1, 512, 4096, 4096, 512, 8192]
    - [6, 396.04]
  - - [4096, 8192, 1, 1024, 4096, 4096, 1024, 8192]
    - [7, 570.75]
  - - [4096, 8192, 1, 2048, 4096, 4096, 2048, 8192]
    - [9, 714.8]
  - - [4096, 8192, 1, 4096, 4096, 4096, 4096, 8192]
    - [6, 801.87]
  - - [4096, 8192, 1, 8192, 4096, 4096, 8192, 8192]
    - [8, 906.39]
  - - [8192, 128, 1, 128, 8192, 8192, 128, 128]
    - [26, 23.05]
  - - [8192, 128, 1, 256, 8192, 8192, 256, 128]
    - [26, 39.37]
  - - [8192, 128, 1, 512, 8192, 8192, 512, 128]
    - [39, 64.59]
  - - [8192, 128, 1, 1024, 8192, 8192, 1024, 128]
    - [39, 102.38]
  - - [8192, 128, 1, 2048, 8192, 8192, 2048, 128]
    - [39, 145.11]
  - - [8192, 128, 1, 4096, 8192, 8192, 4096, 128]
    - [39, 179.06]
  - - [8192, 128, 1, 8192, 8192, 8192, 8192, 128]
    - [39, 207.05]
  - - [8192, 256, 1, 128, 8192, 8192, 128, 256]
    - [23, 40.55]
  - - [8192, 256, 1, 256, 8192, 8192, 256, 256]
    - [22, 71.34]
  - - [8192, 256, 1, 512, 8192, 8192, 512, 256]
    - [24, 119.43]
  - - [8192, 256, 1, 1024, 8192, 8192, 1024, 256]
    - [31, 182.0]
  - - [8192, 256, 1, 2048, 8192, 8192, 2048, 256]
    - [31, 257.84]
  - - [8192, 256, 1, 4096, 8192, 8192, 4096, 256]
    - [32, 314.5]
  - - [8192, 256, 1, 8192, 8192, 8192, 8192, 256]
    - [31, 363.92]
  - - [8192, 512, 1, 128, 8192, 8192, 128, 512]
    - [17, 65.73]
  - - [8192, 512, 1, 256, 8192, 8192, 256, 512]
    - [21, 115.31]
  - - [8192, 512, 1, 512, 8192, 8192, 512, 512]
    - [21, 193.61]
  - - [8192, 512, 1, 1024, 8192, 8192, 1024, 512]
    - [21, 293.47]
  - - [8192, 512, 1, 2048, 8192, 8192, 2048, 512]
    - [21, 394.03]
  - - [8192, 512, 1, 4096, 8192, 8192, 4096, 512]
    - [21, 473.22]
  - - [8192, 512, 1, 8192, 8192, 8192, 8192, 512]
    - [21, 517.43]
  - - [8192, 1024, 1, 128, 8192, 8192, 128, 1024]
    - [11, 98.4]
  - - [8192, 1024, 1, 256, 8192, 8192, 256, 1024]
    - [2, 168.58]
  - - [8192, 1024, 1, 512, 8192, 8192, 512, 1024]
    - [15, 281.6]
  - - [8192, 1024, 1, 1024, 8192, 8192, 1024, 1024]
    - [15, 416.2]
  - - [8192, 1024, 1, 2048, 8192, 8192, 2048, 1024]
    - [15, 547.15]
  - - [8192, 1024, 1, 4096, 8192, 8192, 4096, 1024]
    - [15, 642.96]
  - - [8192, 1024, 1, 8192, 8192, 8192, 8192, 1024]
    - [12, 651.91]
  - - [8192, 2048, 1, 128, 8192, 8192, 128, 2048]
    - [0, 121.04]
  - - [8192, 2048, 1, 256, 8192, 8192, 256, 2048]
    - [0, 213.71]
  - - [8192, 2048, 1, 512, 8192, 8192, 512, 2048]
    - [9, 349.45]
  - - [8192, 2048, 1, 1024, 8192, 8192, 1024, 2048]
    - [8, 526.45]
  - - [8192, 2048, 1, 2048, 8192, 8192, 2048, 2048]
    - [8, 715.46]
  - - [8192, 2048, 1, 4096, 8192, 8192, 4096, 2048]
    - [7, 831.07]
  - - [8192, 2048, 1, 8192, 8192, 8192, 8192, 2048]
    - [7, 835.08]
  - - [8192, 4096, 1, 128, 8192, 8192, 128, 4096]
    - [1, 138.49]
  - - [8192, 4096, 1, 256, 8192, 8192, 256, 4096]
    - [1, 243.19]
  - - [8192, 4096, 1, 512, 8192, 8192, 512, 4096]
    - [5, 397.42]
  - - [8192, 4096, 1, 1024, 8192, 8192, 1024, 4096]
    - [8, 575.72]
  - - [8192, 4096, 1, 2048, 8192, 8192, 2048, 4096]
    - [8, 711.1]
  - - [8192, 4096, 1, 4096, 8192, 8192, 4096, 4096]
    - [8, 789.68]
  - - [8192, 4096, 1, 8192, 8192, 8192, 8192, 4096]
    - [8, 907.98]
  - - [8192, 8192, 1, 128, 8192, 8192, 128, 8192]
    - [4, 153.11]
  - - [8192, 8192, 1, 256, 8192, 8192, 256, 8192]
    - [5, 268.98]
  - - [8192, 8192, 1, 512, 8192, 8192, 512, 8192]
    - [5, 419.86]
  - - [8192, 8192, 1, 1024, 8192, 8192, 1024, 8192]
    - [29, 577.28]
  - - [8192, 8192, 1, 2048, 8192, 8192, 2048, 8192]
    - [9, 704.92]
  - - [8192, 8192, 1, 4096, 8192, 8192, 4096, 8192]
    - [7, 836.99]
  - - [8192, 8192, 1, 8192, 8192, 8192, 8192, 8192]
    - [9, 972.13]
- null
- null
- DeviceEfficiency
- GridBased
