projects/hipblaslt/library/src/amd_detail/rocblaslt/src/Tensile/Logic/asm_full/gfx950/gfx950/GridBased/gfx950_Cijk_Ailk_Bljk_I8II_BH_UserArgs.yaml
- {MinimumRequiredVersion: 5.0.0}
- gfx950
- gfx950
- [Device 75a0]
    SolutionIndex: 0
    SolutionNameMin: Cijk_Ailk_Bljk_I8II_BH_UserArgs_MT256x256x32_MI32x32x1_SN_LDSB0_AFC0_AFEM1_AFEM1_ASEM1_CLR0_CADS0_DTVA0_DTVB0_EPS0_FDSI0_GRPM1_GRVWA4_GRVWB8_GSU0_GSUAMB_GSUC0_GSUWGMRR0_GLS0_ISA950_IU1_K1_LBSPPA0_LBSPPB128_LBSPPM0_LPA0_LPB16_LPM0_LRVW16_LWPMn1_MIAV0_MIWT4_4_MO40_NTn1_NTA0_NTB0_NTC0_NTD0_NTM0_NEPBS0_NLCA1_NLCB1_ONLL1_PGR2_PLR0_PKA1_SIA3_SS1_SU0_SUM1_SUS32_SPO0_SRVW0_SSO0_SVW4_SK3_SKXCCM8_TLDS1_ULSGRO0_USL1_UIOFGRO0_USFGRO0_VSn1_VWA4_VWB4_WSGRA0_WSGRB0_WS64_WG64_4_1_WGM6_WGMXCC1_WGMXCCGn1
    SolutionIndex: 1
    SolutionNameMin: Cijk_Ailk_Bljk_I8II_BH_UserArgs_MT256x256x32_MI32x32x1_SN_LDSB0_AFC0_AFEM1_AFEM1_ASEM1_CLR0_CADS0_DTVA0_DTVB0_EPS0_FDSI0_GRPM1_GRVWA4_GRVWB16_GSU0_GSUAMB_GSUC0_GSUWGMRR0_GLS0_ISA950_IU1_K1_LBSPPA0_LBSPPB128_LBSPPM0_LPA0_LPB16_LPM0_LRVW16_LWPMn1_MIAV0_MIWT4_4_MO40_NTn1_NTA0_NTB0_NTC0_NTD0_NTM0_NEPBS0_NLCA1_NLCB1_ONLL1_PGR2_PLR0_PKA1_SIA3_SS1_SU0_SUM1_SUS32_SPO0_SRVW0_SSO0_SVW4_SK3_SKXCCM8_TLDS1_ULSGRO0_USL1_UIOFGRO0_USFGRO0_VSn1_VWA4_VWB2_WSGRA0_WSGRB0_WS64_WG64_4_1_WGM6_WGMXCC1_WGMXCCGn1
    SolutionIndex: 2
    SolutionNameMin: Cijk_Ailk_Bljk_I8II_BH_UserArgs_MT128x256x64_MI16x16x1_SN_LDSB1_AFC0_AFEM1_AFEM1_ASEM1_CLR0_CADS0_DTVA0_DTVB0_EPS0_FDSI0_GRPM1_GRVWA4_GRVWB16_GSU0_GSUAMB_GSUC0_GSUWGMRR0_GLS0_ISA950_IU1_K1_LBSPPA2048_LBSPPB512_LBSPPM0_LPA64_LPB32_LPM0_LRVW16_LWPMn1_MIAV0_MIWT4_8_MO40_NTn1_NTA0_NTB0_NTC0_NTD0_NTM0_NEPBS0_NLCA1_NLCB1_ONLL1_PGR2_PLR0_PKA1_SIA3_SS1_SU0_SUM1_SUS64_SPO0_SRVW0_SSO0_SVW4_SK3_SKXCCM8_TLDS1_ULSGRO0_USL1_UIOFGRO0_USFGRO0_VSn1_VWA4_VWB8_WSGRA0_WSGRB0_WS64_WG32_8_1_WGM6_WGMXCC1_WGMXCCGn1
    SolutionIndex: 3
    SolutionNameMin: Cijk_Ailk_Bljk_I8II_BH_UserArgs_MT128x128x64_MI16x16x1_SN_LDSB1_AFC0_AFEM1_AFEM1_ASEM1_CLR0_CADS0_DTVA0_DTVB0_EPS0_FDSI0_GRPM1_GRVWA4_GRVWB16_GSU0_GSUAMB_GSUC0_GSUWGMRR0_GLS0_ISA950_IU1_K1_LBSPPA2048_LBSPPB256_LBSPPM0_LPA64_LPB32_LPM0_LRVW16_LWPMn1_MIAV0_MIWT4_4_MO40_NTn1_NTA0_NTB0_NTC0_NTD0_NTM0_NEPBS0_NLCA1_NLCB1_ONLL1_PGR2_PLR0_PKA1_SIA3_SS1_SU0_SUM1_SUS64_SPO0_SRVW0_SSO0_SVW4_SK3_SKXCCM8_TLDS1_ULSGRO0_USL1_UIOFGRO0_USFGRO0_VSn1_VWA4_VWB4_WSGRA0_WSGRB0_WS64_WG32_8_1_WGM6_WGMXCC1_WGMXCCGn1
    SolutionIndex: 4
    SolutionNameMin: Cijk_Ailk_Bljk_I8II_BH_UserArgs_MT128x128x64_MI16x16x1_SN_LDSB1_AFC0_AFEM1_AFEM1_ASEM1_CLR0_CADS0_DTVA0_DTVB0_EPS0_FDSI0_GRPM1_GRVWA16_GRVWB16_GSU0_GSUAMB_GSUC0_GSUWGMRR0_GLS0_ISA950_IU1_K1_LBSPPA2048_LBSPPB128_LBSPPM0_LPA64_LPB32_LPM0_LRVW16_LWPMn1_MIAV0_MIWT4_4_MO40_NTn1_NTA0_NTB0_NTC0_NTD0_NTM0_NEPBS0_NLCA1_NLCB1_ONLL1_PGR2_PLR0_PKA1_SIA3_SS1_SU0_SUM1_SUS64_SPO0_SRVW0_SSO0_SVW4_SK3_SKXCCM8_TLDS1_ULSGRO0_USL1_UIOFGRO0_USFGRO0_VSn1_VWA4_VWB2_WSGRA0_WSGRB0_WS64_WG32_8_1_WGM6_WGMXCC1_WGMXCCGn1
    SolutionIndex: 5
    SolutionNameMin: Cijk_Ailk_Bljk_I8II_BH_UserArgs_MT256x256x64_MI32x32x1_SN_LDSB0_AFC0_AFEM1_AFEM1_ASEM1_CLR1_CADS0_DTVA0_DTVB0_EPS0_FDSI0_GRPM1_GRVWA16_GRVWB4_GSU0_GSUAMB_GSUC0_GSUWGMRR0_GLS0_ISA950_IU1_K1_LBSPPA0_LBSPPB128_LBSPPM0_LPA0_LPB16_LPM0_LRVW16_LWPMn1_MIAV0_MIWT4_4_MO40_NTn1_NTA0_NTB0_NTC0_NTD0_NTM0_NEPBS0_NLCA1_NLCB1_ONLL1_PGR2_PLR1_PKA1_SIA3_SS1_SU0_SUM1_SUS64_SPO0_SRVW0_SSO0_SVW4_SK3_SKXCCM8_TLDS1_ULSGRO0_USL1_UIOFGRO0_USFGRO0_VSn1_VWA4_VWB2_WSGRA0_WSGRB0_WS64_WG64_4_1_WGM6_WGMXCC1_WGMXCCGn1
    SolutionIndex: 6
    SolutionNameMin: Cijk_Ailk_Bljk_I8II_BH_UserArgs_MT256x256x64_MI32x32x1_SN_LDSB0_AFC0_AFEM1_AFEM1_ASEM1_CLR1_CADS0_DTVA0_DTVB0_EPS0_FDSI0_GRPM1_GRVWA16_GRVWB4_GSU0_GSUAMB_GSUC0_GSUWGMRR0_GLS0_ISA950_IU1_K1_LBSPPA0_LBSPPB256_LBSPPM0_LPA0_LPB16_LPM0_LRVW16_LWPMn1_MIAV0_MIWT4_4_MO40_NTn1_NTA0_NTB0_NTC0_NTD0_NTM0_NEPBS0_NLCA1_NLCB1_ONLL1_PGR2_PLR1_PKA1_SIA3_SS1_SU0_SUM1_SUS64_SPO0_SRVW0_SSO0_SVW4_SK3_SKXCCM8_TLDS1_ULSGRO0_USL1_UIOFGRO0_USFGRO0_VSn1_VWA4_VWB4_WSGRA0_WSGRB0_WS64_WG64_4_1_WGM6_WGMXCC1_WGMXCCGn1
    SolutionIndex: 7
    SolutionNameMin: Cijk_Ailk_Bljk_I8II_BH_UserArgs_MT256x256x64_MI32x32x1_SN_LDSB0_AFC0_AFEM1_AFEM1_ASEM1_CLR1_CADS0_DTVA0_DTVB0_EPS0_FDSI0_GRPM1_GRVWA16_GRVWB8_GSU0_GSUAMB_GSUC0_GSUWGMRR0_GLS0_ISA950_IU1_K1_LBSPPA0_LBSPPB256_LBSPPM0_LPA0_LPB16_LPM0_LRVW16_LWPMn1_MIAV0_MIWT4_4_MO40_NTn1_NTA0_NTB0_NTC0_NTD0_NTM0_NEPBS0_NLCA1_NLCB1_ONLL1_PGR2_PLR1_PKA1_SIA3_SS1_SU0_SUM1_SUS64_SPO0_SRVW0_SSO0_SVW4_SK3_SKXCCM8_TLDS1_ULSGRO0_USL1_UIOFGRO0_USFGRO0_VSn1_VWA4_VWB4_WSGRA0_WSGRB0_WS64_WG64_4_1_WGM6_WGMXCC1_WGMXCCGn1
    SolutionIndex: 8
    SolutionNameMin: Cijk_Ailk_Bljk_I8II_BH_UserArgs_MT256x256x64_MI32x32x1_SN_LDSB0_AFC0_AFEM1_AFEM1_ASEM1_CLR1_CADS0_DTVA0_DTVB0_EPS0_FDSI0_GRPM1_GRVWA4_GRVWB16_GSU0_GSUAMB_GSUC0_GSUWGMRR0_GLS0_ISA950_IU1_K1_LBSPPA0_LBSPPB128_LBSPPM0_LPA0_LPB16_LPM0_LRVW16_LWPMn1_MIAV0_MIWT4_4_MO40_NTn1_NTA0_NTB0_NTC0_NTD0_NTM0_NEPBS0_NLCA1_NLCB1_ONLL1_PGR2_PLR1_PKA1_SIA3_SS1_SU0_SUM1_SUS64_SPO0_SRVW0_SSO0_SVW4_SK3_SKXCCM8_TLDS1_ULSGRO0_USL1_UIOFGRO0_USFGRO0_VSn1_VWA4_VWB2_WSGRA0_WSGRB0_WS64_WG64_4_1_WGM6_WGMXCC1_WGMXCCGn1
    SolutionIndex: 9
    SolutionNameMin: Cijk_Ailk_Bljk_I8II_BH_UserArgs_MT256x256x64_MI32x32x1_SN_LDSB0_AFC0_AFEM1_AFEM1_ASEM1_CLR1_CADS0_DTVA0_DTVB0_EPS0_FDSI0_GRPM1_GRVWA4_GRVWB16_GSU0_GSUAMB_GSUC0_GSUWGMRR0_GLS0_ISA950_IU1_K1_LBSPPA0_LBSPPB256_LBSPPM0_LPA0_LPB16_LPM0_LRVW16_LWPMn1_MIAV0_MIWT4_4_MO40_NTn1_NTA0_NTB0_NTC0_NTD0_NTM0_NEPBS0_NLCA1_NLCB1_ONLL1_PGR2_PLR1_PKA1_SIA3_SS1_SU0_SUM1_SUS64_SPO0_SRVW0_SSO0_SVW4_SK3_SKXCCM8_TLDS1_ULSGRO0_USL1_UIOFGRO0_USFGRO0_VSn1_VWA4_VWB4_WSGRA0_WSGRB0_WS64_WG64_4_1_WGM6_WGMXCC1_WGMXCCGn1
    SolutionIndex: 10
    SolutionNameMin: Cijk_Ailk_Bljk_I8II_BH_UserArgs_MT256x256x64_MI32x32x1_SN_LDSB0_AFC0_AFEM1_AFEM1_ASEM1_CLR1_CADS0_DTVA0_DTVB0_EPS0_FDSI0_GRPM1_GRVWA8_GRVWB16_GSU0_GSUAMB_GSUC0_GSUWGMRR0_GLS0_ISA950_IU1_K1_LBSPPA0_LBSPPB128_LBSPPM0_LPA0_LPB16_LPM0_LRVW16_LWPMn1_MIAV0_MIWT4_4_MO40_NTn1_NTA0_NTB0_NTC0_NTD0_NTM0_NEPBS0_NLCA1_NLCB1_ONLL1_PGR2_PLR1_PKA1_SIA3_SS1_SU0_SUM1_SUS64_SPO0_SRVW0_SSO0_SVW4_SK3_SKXCCM8_TLDS1_ULSGRO0_USL1_UIOFGRO0_USFGRO0_VSn1_VWA4_VWB2_WSGRA0_WSGRB0_WS64_WG64_4_1_WGM6_WGMXCC1_WGMXCCGn1
    SolutionIndex: 11
    SolutionNameMin: Cijk_Ailk_Bljk_I8II_BH_UserArgs_MT256x256x64_MI32x32x1_SN_LDSB0_AFC0_AFEM1_AFEM1_ASEM1_CLR1_CADS0_DTVA0_DTVB0_EPS0_FDSI0_GRPM1_GRVWA8_GRVWB16_GSU0_GSUAMB_GSUC0_GSUWGMRR0_GLS0_ISA950_IU1_K1_LBSPPA0_LBSPPB256_LBSPPM0_LPA0_LPB16_LPM0_LRVW16_LWPMn1_MIAV0_MIWT4_4_MO40_NTn1_NTA0_NTB0_NTC0_NTD0_NTM0_NEPBS0_NLCA1_NLCB1_ONLL1_PGR2_PLR1_PKA1_SIA3_SS1_SU0_SUM1_SUS64_SPO0_SRVW0_SSO0_SVW4_SK3_SKXCCM8_TLDS1_ULSGRO0_USL1_UIOFGRO0_USFGRO0_VSn1_VWA4_VWB4_WSGRA0_WSGRB0_WS64_WG64_4_1_WGM6_WGMXCC1_WGMXCCGn1
    SolutionIndex: 12
    SolutionNameMin: Cijk_Ailk_Bljk_I8II_BH_UserArgs_MT256x256x64_MI32x32x1_SN_LDSB0_AFC0_AFEM1_AFEM1_ASEM1_CLR1_CADS0_DTVA0_DTVB0_EPS0_FDSI0_GRPM1_GRVWA16_GRVWB16_GSU0_GSUAMB_GSUC0_GSUWGMRR0_GLS0_ISA950_IU1_K1_LBSPPA0_LBSPPB128_LBSPPM0_LPA0_LPB16_LPM0_LRVW16_LWPMn1_MIAV0_MIWT4_4_MO40_NTn1_NTA0_NTB0_NTC0_NTD0_NTM0_NEPBS0_NLCA1_NLCB1_ONLL1_PGR2_PLR1_PKA1_SIA3_SS1_SU0_SUM1_SUS64_SPO0_SRVW0_SSO0_SVW4_SK3_SKXCCM8_TLDS1_ULSGRO0_USL1_UIOFGRO0_USFGRO0_VSn1_VWA4_VWB2_WSGRA0_WSGRB0_WS64_WG64_4_1_WGM6_WGMXCC1_WGMXCCGn1
    SolutionIndex: 13
    SolutionNameMin: Cijk_Ailk_Bljk_I8II_BH_UserArgs_MT128x256x64_MI32x32x1_SN_LDSB1_AFC0_AFEM1_AFEM1_ASEM1_CLR1_CADS0_DTVA0_DTVB0_EPS0_FDSI0_GRPM1_GRVWA16_GRVWB16_GSU0_GSUAMB_GSUC0_GSUWGMRR0_GLS0_ISA950_IU1_K1_LBSPPA0_LBSPPB256_LBSPPM0_LPA0_LPB16_LPM0_LRVW16_LWPMn1_MIAV0_MIWT2_4_MO40_NTn1_NTA0_NTB0_NTC0_NTD0_NTM0_NEPBS0_NLCA1_NLCB1_ONLL1_PGR2_PLR1_PKA1_SIA3_SS1_SU0_SUM1_SUS64_SPO0_SRVW0_SSO0_SVW2_SK3_SKXCCM8_TLDS1_ULSGRO0_USL1_UIOFGRO0_USFGRO0_VSn1_VWA2_VWB4_WSGRA0_WSGRB0_WS64_WG64_4_1_WGM6_WGMXCC1_WGMXCCGn1
    SolutionIndex: 14
    SolutionNameMin: Cijk_Ailk_Bljk_I8II_BH_UserArgs_MT256x128x64_MI32x32x1_SN_LDSB1_AFC0_AFEM1_AFEM1_ASEM1_CLR1_CADS0_DTVA0_DTVB0_EPS0_FDSI0_GRPM1_GRVWA8_GRVWB8_GSU0_GSUAMB_GSUC0_GSUWGMRR0_GLS0_ISA950_IU1_K1_LBSPPA0_LBSPPB128_LBSPPM0_LPA0_LPB16_LPM0_LRVW16_LWPMn1_MIAV0_MIWT4_2_MO40_NTn1_NTA0_NTB0_NTC0_NTD0_NTM0_NEPBS0_NLCA1_NLCB1_ONLL1_PGR2_PLR1_PKA1_SIA3_SS1_SU0_SUM1_SUS64_SPO0_SRVW0_SSO0_SVW4_SK3_SKXCCM8_TLDS1_ULSGRO0_USL1_UIOFGRO0_USFGRO0_VSn1_VWA4_VWB2_WSGRA0_WSGRB0_WS64_WG64_4_1_WGM6_WGMXCC1_WGMXCCGn1
    SolutionIndex: 15
    SolutionNameMin: Cijk_Ailk_Bljk_I8II_BH_UserArgs_MT256x128x64_MI32x32x1_SN_LDSB1_AFC0_AFEM1_AFEM1_ASEM1_CLR1_CADS0_DTVA0_DTVB0_EPS0_FDSI0_GRPM1_GRVWA4_GRVWB16_GSU0_GSUAMB_GSUC0_GSUWGMRR0_GLS0_ISA950_IU1_K1_LBSPPA0_LBSPPB128_LBSPPM0_LPA0_LPB16_LPM0_LRVW16_LWPMn1_MIAV0_MIWT4_2_MO40_NTn1_NTA0_NTB0_NTC0_NTD0_NTM0_NEPBS0_NLCA1_NLCB1_ONLL1_PGR2_PLR1_PKA1_SIA3_SS1_SU0_SUM1_SUS64_SPO0_SRVW0_SSO0_SVW4_SK3_SKXCCM8_TLDS1_ULSGRO0_USL1_UIOFGRO0_USFGRO0_VSn1_VWA4_VWB2_WSGRA0_WSGRB0_WS64_WG64_4_1_WGM6_WGMXCC1_WGMXCCGn1
    SolutionIndex: 16
    SolutionNameMin: Cijk_Ailk_Bljk_I8II_BH_UserArgs_MT256x128x64_MI32x32x1_SN_LDSB1_AFC0_AFEM1_AFEM1_ASEM1_CLR1_CADS0_DTVA0_DTVB0_EPS0_FDSI0_GRPM1_GRVWA8_GRVWB16_GSU0_GSUAMB_GSUC0_GSUWGMRR0_GLS0_ISA950_IU1_K1_LBSPPA0_LBSPPB128_LBSPPM0_LPA0_LPB16_LPM0_LRVW16_LWPMn1_MIAV0_MIWT4_2_MO40_NTn1_NTA0_NTB0_NTC0_NTD0_NTM0_NEPBS0_NLCA1_NLCB1_ONLL1_PGR2_PLR1_PKA1_SIA3_SS1_SU0_SUM1_SUS64_SPO0_SRVW0_SSO0_SVW4_SK3_SKXCCM8_TLDS1_ULSGRO0_USL1_UIOFGRO0_USFGRO0_VSn1_VWA4_VWB2_WSGRA0_WSGRB0_WS64_WG64_4_1_WGM6_WGMXCC1_WGMXCCGn1
    SolutionIndex: 17
    SolutionNameMin: Cijk_Ailk_Bljk_I8II_BH_UserArgs_MT256x128x64_MI32x32x1_SN_LDSB1_AFC0_AFEM1_AFEM1_ASEM1_CLR1_CADS0_DTVA0_DTVB0_EPS0_FDSI0_GRPM1_GRVWA16_GRVWB16_GSU0_GSUAMB_GSUC0_GSUWGMRR0_GLS0_ISA950_IU1_K1_LBSPPA0_LBSPPB128_LBSPPM0_LPA0_LPB16_LPM0_LRVW16_LWPMn1_MIAV0_MIWT4_2_MO40_NTn1_NTA0_NTB0_NTC0_NTD0_NTM0_NEPBS0_NLCA1_NLCB1_ONLL1_PGR2_PLR1_PKA1_SIA3_SS1_SU0_SUM1_SUS64_SPO0_SRVW0_SSO0_SVW4_SK3_SKXCCM8_TLDS1_ULSGRO0_USL1_UIOFGRO0_USFGRO0_VSn1_VWA4_VWB2_WSGRA0_WSGRB0_WS64_WG64_4_1_WGM6_WGMXCC1_WGMXCCGn1
    SolutionIndex: 18
    SolutionNameMin: Cijk_Ailk_Bljk_I8II_BH_UserArgs_MT256x256x128_MI16x16x1_SN_LDSB1_AFC0_AFEM1_AFEM1_ASEM1_CLR1_CADS0_DTVA0_DTVB0_EPS0_FDSI0_GRPM1_GRVWA16_GRVWB16_GSU0_GSUAMB_GSUC0_GSUWGMRR0_GLS0_ISA950_IU1_K1_LBSPPA4096_LBSPPB256_LBSPPM0_LPA64_LPB32_LPM0_LRVW16_LWPMn1_MIAV0_MIWT8_8_MO40_NTn1_NTA0_NTB0_NTC0_NTD0_NTM0_NEPBS0_NLCA1_NLCB1_ONLL1_PGR2_PLR1_PKA1_SIA3_SS1_SU0_SUM1_SUS128_SPO0_SRVW0_SSO0_SVW4_SK3_SKXCCM8_TLDS1_ULSGRO0_USL1_UIOFGRO0_USFGRO0_VSn1_VWA4_VWB2_WSGRA0_WSGRB0_WS64_WG32_8_1_WGM6_WGMXCC1_WGMXCCGn1
    SolutionIndex: 19
    SolutionNameMin: Cijk_Ailk_Bljk_I8II_BH_UserArgs_MT256x256x128_MI16x16x1_SN_LDSB1_AFC0_AFEM1_AFEM1_ASEM1_CLR1_CADS0_DTVA0_DTVB0_EPS0_FDSI0_GRPM1_GRVWA16_GRVWB16_GSU0_GSUAMB_GSUC0_GSUWGMRR0_GLS0_ISA950_IU1_K1_LBSPPA4096_LBSPPB256_LBSPPM0_LPA0_LPB32_LPM0_LRVW16_LWPMn1_MIAV0_MIWT8_8_MO40_NTn1_NTA0_NTB0_NTC0_NTD0_NTM0_NEPBS0_NLCA1_NLCB1_ONLL1_PGR2_PLR1_PKA1_SIA3_SS1_SU0_SUM1_SUS128_SPO0_SRVW0_SSO0_SVW8_SK3_SKXCCM8_TLDS1_ULSGRO0_USL1_UIOFGRO0_USFGRO0_VSn1_VWA8_VWB2_WSGRA0_WSGRB0_WS64_WG32_8_1_WGM6_WGMXCC1_WGMXCCGn1
    SolutionIndex: 20
    SolutionNameMin: Cijk_Ailk_Bljk_I8II_BH_UserArgs_MT256x256x128_MI16x16x1_SN_LDSB1_AFC0_AFEM1_AFEM1_ASEM1_CLR1_CADS0_DTVA0_DTVB0_EPS0_FDSI0_GRPM1_GRVWA16_GRVWB16_GSU0_GSUAMB_GSUC0_GSUWGMRR0_GLS0_ISA950_IU1_K1_LBSPPA4096_LBSPPB512_LBSPPM0_LPA0_LPB32_LPM0_LRVW16_LWPMn1_MIAV0_MIWT8_8_MO40_NTn1_NTA0_NTB0_NTC0_NTD0_NTM0_NEPBS0_NLCA1_NLCB1_ONLL1_PGR2_PLR1_PKA1_SIA3_SS1_SU0_SUM1_SUS128_SPO0_SRVW0_SSO0_SVW8_SK3_SKXCCM8_TLDS1_ULSGRO0_USL1_UIOFGRO0_USFGRO0_VSn1_VWA8_VWB4_WSGRA0_WSGRB0_WS64_WG32_8_1_WGM6_WGMXCC1_WGMXCCGn1
    SolutionIndex: 21
    SolutionNameMin: Cijk_Ailk_Bljk_I8II_BH_UserArgs_MT256x256x128_MI16x16x1_SN_LDSB1_AFC0_AFEM1_AFEM1_ASEM1_CLR1_CADS0_DTVA0_DTVB0_EPS0_FDSI0_GRPM1_GRVWA16_GRVWB16_GSU0_GSUAMB_GSUC0_GSUWGMRR0_GLS0_ISA950_IU1_K1_LBSPPA4096_LBSPPB1024_LBSPPM0_LPA64_LPB32_LPM0_LRVW16_LWPMn1_MIAV0_MIWT8_8_MO40_NTn1_NTA0_NTB0_NTC0_NTD0_NTM0_NEPBS0_NLCA1_NLCB1_ONLL1_PGR2_PLR1_PKA1_SIA3_SS1_SU0_SUM1_SUS128_SPO0_SRVW0_SSO0_SVW4_SK3_SKXCCM8_TLDS1_ULSGRO0_USL1_UIOFGRO0_USFGRO0_VSn1_VWA4_VWB8_WSGRA0_WSGRB0_WS64_WG32_8_1_WGM6_WGMXCC1_WGMXCCGn1
    SolutionIndex: 22
    SolutionNameMin: Cijk_Ailk_Bljk_I8II_BH_UserArgs_MT256x256x128_MI16x16x1_SN_LDSB1_AFC0_AFEM1_AFEM1_ASEM1_CLR1_CADS0_DTVA0_DTVB0_EPS0_FDSI0_GRPM1_GRVWA16_GRVWB16_GSU0_GSUAMB_GSUC0_GSUWGMRR0_GLS0_ISA950_IU1_K1_LBSPPA4096_LBSPPB1024_LBSPPM0_LPA0_LPB32_LPM0_LRVW16_LWPMn1_MIAV0_MIWT8_8_MO40_NTn1_NTA0_NTB0_NTC0_NTD0_NTM0_NEPBS0_NLCA1_NLCB1_ONLL1_PGR2_PLR1_PKA1_SIA3_SS1_SU0_SUM1_SUS128_SPO0_SRVW0_SSO0_SVW8_SK3_SKXCCM8_TLDS1_ULSGRO0_USL1_UIOFGRO0_USFGRO0_VSn1_VWA8_VWB8_WSGRA0_WSGRB0_WS64_WG32_8_1_WGM6_WGMXCC1_WGMXCCGn1
    SolutionIndex: 23
    SolutionNameMin: Cijk_Ailk_Bljk_I8II_BH_UserArgs_MT128x256x128_MI16x16x1_SN_LDSB1_AFC0_AFEM1_AFEM1_ASEM1_CLR1_CADS0_DTVA0_DTVB0_EPS0_FDSI0_GRPM1_GRVWA4_GRVWB16_GSU0_GSUAMB_GSUC0_GSUWGMRR0_GLS0_ISA950_IU1_K1_LBSPPA2048_LBSPPB512_LBSPPM0_LPA64_LPB32_LPM0_LRVW16_LWPMn1_MIAV0_MIWT4_8_MO40_NTn1_NTA0_NTB0_NTC0_NTD0_NTM0_NEPBS0_NLCA1_NLCB1_ONLL1_PGR2_PLR1_PKA1_SIA3_SS1_SU0_SUM1_SUS128_SPO0_SRVW0_SSO0_SVW4_SK3_SKXCCM8_TLDS1_ULSGRO0_USL1_UIOFGRO0_USFGRO0_VSn1_VWA4_VWB4_WSGRA0_WSGRB0_WS64_WG32_8_1_WGM6_WGMXCC1_WGMXCCGn1
    SolutionIndex: 24
    SolutionNameMin: Cijk_Ailk_Bljk_I8II_BH_UserArgs_MT128x256x128_MI16x16x1_SN_LDSB1_AFC0_AFEM1_AFEM1_ASEM1_CLR1_CADS0_DTVA0_DTVB0_EPS0_FDSI0_GRPM1_GRVWA4_GRVWB16_GSU0_GSUAMB_GSUC0_GSUWGMRR0_GLS0_ISA950_IU1_K1_LBSPPA2048_LBSPPB1024_LBSPPM0_LPA64_LPB32_LPM0_LRVW16_LWPMn1_MIAV0_MIWT4_8_MO40_NTn1_NTA0_NTB0_NTC0_NTD0_NTM0_NEPBS0_NLCA1_NLCB1_ONLL1_PGR2_PLR1_PKA1_SIA3_SS1_SU0_SUM1_SUS128_SPO0_SRVW0_SSO0_SVW4_SK3_SKXCCM8_TLDS1_ULSGRO0_USL1_UIOFGRO0_USFGRO0_VSn1_VWA4_VWB8_WSGRA0_WSGRB0_WS64_WG32_8_1_WGM6_WGMXCC1_WGMXCCGn1
    SolutionIndex: 25
    SolutionNameMin: Cijk_Ailk_Bljk_I8II_BH_UserArgs_MT128x256x128_MI16x16x1_SN_LDSB1_AFC0_AFEM1_AFEM1_ASEM1_CLR1_CADS0_DTVA0_DTVB0_EPS0_FDSI0_GRPM1_GRVWA16_GRVWB16_GSU0_GSUAMB_GSUC0_GSUWGMRR0_GLS0_ISA950_IU1_K1_LBSPPA2048_LBSPPB256_LBSPPM0_LPA64_LPB32_LPM0_LRVW16_LWPMn1_MIAV0_MIWT4_8_MO40_NTn1_NTA0_NTB0_NTC0_NTD0_NTM0_NEPBS0_NLCA1_NLCB1_ONLL1_PGR2_PLR1_PKA1_SIA3_SS1_SU0_SUM1_SUS128_SPO0_SRVW0_SSO0_SVW4_SK3_SKXCCM8_TLDS1_ULSGRO0_USL1_UIOFGRO0_USFGRO0_VSn1_VWA4_VWB2_WSGRA0_WSGRB0_WS64_WG32_8_1_WGM6_WGMXCC1_WGMXCCGn1
    SolutionIndex: 26
    SolutionNameMin: Cijk_Ailk_Bljk_I8II_BH_UserArgs_MT128x256x128_MI16x16x1_SN_LDSB1_AFC0_AFEM1_AFEM1_ASEM1_CLR1_CADS0_DTVA0_DTVB0_EPS0_FDSI0_GRPM1_GRVWA16_GRVWB16_GSU0_GSUAMB_GSUC0_GSUWGMRR0_GLS0_ISA950_IU1_K1_LBSPPA2048_LBSPPB512_LBSPPM0_LPA64_LPB32_LPM0_LRVW16_LWPMn1_MIAV0_MIWT4_8_MO40_NTn1_NTA0_NTB0_NTC0_NTD0_NTM0_NEPBS0_NLCA1_NLCB1_ONLL1_PGR2_PLR1_PKA1_SIA3_SS1_SU0_SUM1_SUS128_SPO0_SRVW0_SSO0_SVW4_SK3_SKXCCM8_TLDS1_ULSGRO0_USL1_UIOFGRO0_USFGRO0_VSn1_VWA4_VWB4_WSGRA0_WSGRB0_WS64_WG32_8_1_WGM6_WGMXCC1_WGMXCCGn1
    SolutionIndex: 27
    SolutionNameMin: Cijk_Ailk_Bljk_I8II_BH_UserArgs_MT128x256x128_MI16x16x1_SN_LDSB1_AFC0_AFEM1_AFEM1_ASEM1_CLR1_CADS0_DTVA0_DTVB0_EPS0_FDSI0_GRPM1_GRVWA16_GRVWB16_GSU0_GSUAMB_GSUC0_GSUWGMRR0_GLS0_ISA950_IU1_K1_LBSPPA2048_LBSPPB1024_LBSPPM0_LPA64_LPB32_LPM0_LRVW16_LWPMn1_MIAV0_MIWT4_8_MO40_NTn1_NTA0_NTB0_NTC0_NTD0_NTM0_NEPBS0_NLCA1_NLCB1_ONLL1_PGR2_PLR1_PKA1_SIA3_SS1_SU0_SUM1_SUS128_SPO0_SRVW0_SSO0_SVW4_SK3_SKXCCM8_TLDS1_ULSGRO0_USL1_UIOFGRO0_USFGRO0_VSn1_VWA4_VWB8_WSGRA0_WSGRB0_WS64_WG32_8_1_WGM6_WGMXCC1_WGMXCCGn1
    SolutionIndex: 28
    SolutionNameMin: Cijk_Ailk_Bljk_I8II_BH_UserArgs_MT64x256x128_MI16x16x1_SN_LDSB1_AFC0_AFEM1_AFEM1_ASEM1_CLR1_CADS0_DTVA0_DTVB0_EPS0_FDSI0_GRPM1_GRVWA4_GRVWB16_GSU0_GSUAMB_GSUC0_GSUWGMRR0_GLS0_ISA950_IU1_K1_LBSPPA1024_LBSPPB512_LBSPPM0_LPA32_LPB32_LPM0_LRVW16_LWPMn1_MIAV0_MIWT2_8_MO40_NTn1_NTA0_NTB0_NTC0_NTD0_NTM0_NEPBS0_NLCA1_NLCB1_ONLL1_PGR2_PLR1_PKA1_SIA3_SS1_SU0_SUM1_SUS128_SPO0_SRVW0_SSO0_SVW2_SK3_SKXCCM8_TLDS1_ULSGRO0_USL1_UIOFGRO0_USFGRO0_VSn1_VWA2_VWB4_WSGRA0_WSGRB0_WS64_WG32_8_1_WGM6_WGMXCC1_WGMXCCGn1
    SolutionIndex: 29
    SolutionNameMin: Cijk_Ailk_Bljk_I8II_BH_UserArgs_MT128x128x128_MI16x16x1_SN_LDSB1_AFC0_AFEM1_AFEM1_ASEM1_CLR1_CADS0_DTVA0_DTVB0_EPS0_FDSI0_GRPM1_GRVWA4_GRVWB16_GSU0_GSUAMB_GSUC0_GSUWGMRR0_GLS0_ISA950_IU1_K1_LBSPPA2048_LBSPPB256_LBSPPM0_LPA64_LPB32_LPM0_LRVW16_LWPMn1_MIAV0_MIWT4_4_MO40_NTn1_NTA0_NTB0_NTC0_NTD0_NTM0_NEPBS0_NLCA1_NLCB1_ONLL1_PGR2_PLR1_PKA1_SIA3_SS1_SU0_SUM1_SUS128_SPO0_SRVW0_SSO0_SVW4_SK3_SKXCCM8_TLDS1_ULSGRO0_USL1_UIOFGRO0_USFGRO0_VSn1_VWA4_VWB2_WSGRA0_WSGRB0_WS64_WG32_8_1_WGM6_WGMXCC1_WGMXCCGn1
    SolutionIndex: 30
    SolutionNameMin: Cijk_Ailk_Bljk_I8II_BH_UserArgs_MT128x128x128_MI16x16x1_SN_LDSB1_AFC0_AFEM1_AFEM1_ASEM1_CLR1_CADS0_DTVA0_DTVB0_EPS0_FDSI0_GRPM1_GRVWA4_GRVWB16_GSU0_GSUAMB_GSUC0_GSUWGMRR0_GLS0_ISA950_IU1_K1_LBSPPA2048_LBSPPB512_LBSPPM0_LPA64_LPB32_LPM0_LRVW16_LWPMn1_MIAV0_MIWT4_4_MO40_NTn1_NTA0_NTB0_NTC0_NTD0_NTM0_NEPBS0_NLCA1_NLCB1_ONLL1_PGR2_PLR1_PKA1_SIA3_SS1_SU0_SUM1_SUS128_SPO0_SRVW0_SSO0_SVW4_SK3_SKXCCM8_TLDS1_ULSGRO0_USL1_UIOFGRO0_USFGRO0_VSn1_VWA4_VWB4_WSGRA0_WSGRB0_WS64_WG32_8_1_WGM6_WGMXCC1_WGMXCCGn1
    SolutionIndex: 31
    SolutionNameMin: Cijk_Ailk_Bljk_I8II_BH_UserArgs_MT128x128x128_MI16x16x1_SN_LDSB1_AFC0_AFEM1_AFEM1_ASEM1_CLR1_CADS0_DTVA0_DTVB0_EPS0_FDSI0_GRPM1_GRVWA8_GRVWB16_GSU0_GSUAMB_GSUC0_GSUWGMRR0_GLS0_ISA950_IU1_K1_LBSPPA2048_LBSPPB512_LBSPPM0_LPA64_LPB32_LPM0_LRVW16_LWPMn1_MIAV0_MIWT4_4_MO40_NTn1_NTA0_NTB0_NTC0_NTD0_NTM0_NEPBS0_NLCA1_NLCB1_ONLL1_PGR2_PLR1_PKA1_SIA3_SS1_SU0_SUM1_SUS128_SPO0_SRVW0_SSO0_SVW4_SK3_SKXCCM8_TLDS1_ULSGRO0_USL1_UIOFGRO0_USFGRO0_VSn1_VWA4_VWB4_WSGRA0_WSGRB0_WS64_WG32_8_1_WGM6_WGMXCC1_WGMXCCGn1
    SolutionIndex: 32
    SolutionNameMin: Cijk_Ailk_Bljk_I8II_BH_UserArgs_MT128x128x128_MI16x16x1_SN_LDSB1_AFC0_AFEM1_AFEM1_ASEM1_CLR1_CADS0_DTVA0_DTVB0_EPS0_FDSI0_GRPM1_GRVWA16_GRVWB16_GSU0_GSUAMB_GSUC0_GSUWGMRR0_GLS0_ISA950_IU1_K1_LBSPPA2048_LBSPPB256_LBSPPM0_LPA64_LPB32_LPM0_LRVW16_LWPMn1_MIAV0_MIWT4_4_MO40_NTn1_NTA0_NTB0_NTC0_NTD0_NTM0_NEPBS0_NLCA1_NLCB1_ONLL1_PGR2_PLR1_PKA1_SIA3_SS1_SU0_SUM1_SUS128_SPO0_SRVW0_SSO0_SVW4_SK3_SKXCCM8_TLDS1_ULSGRO0_USL1_UIOFGRO0_USFGRO0_VSn1_VWA4_VWB2_WSGRA0_WSGRB0_WS64_WG32_8_1_WGM6_WGMXCC1_WGMXCCGn1
    SolutionIndex: 33
    SolutionNameMin: Cijk_Ailk_Bljk_I8II_BH_UserArgs_MT128x128x128_MI16x16x1_SN_LDSB1_AFC0_AFEM1_AFEM1_ASEM1_CLR1_CADS0_DTVA0_DTVB0_EPS0_FDSI0_GRPM1_GRVWA16_GRVWB16_GSU0_GSUAMB_GSUC0_GSUWGMRR0_GLS0_ISA950_IU1_K1_LBSPPA2048_LBSPPB512_LBSPPM0_LPA64_LPB32_LPM0_LRVW16_LWPMn1_MIAV0_MIWT4_4_MO40_NTn1_NTA0_NTB0_NTC0_NTD0_NTM0_NEPBS0_NLCA1_NLCB1_ONLL1_PGR2_PLR1_PKA1_SIA3_SS1_SU0_SUM1_SUS128_SPO0_SRVW0_SSO0_SVW4_SK3_SKXCCM8_TLDS1_ULSGRO0_USL1_UIOFGRO0_USFGRO0_VSn1_VWA4_VWB4_WSGRA0_WSGRB0_WS64_WG32_8_1_WGM6_WGMXCC1_WGMXCCGn1
    SolutionIndex: 34
    SolutionNameMin: Cijk_Ailk_Bljk_I8II_BH_UserArgs_MT64x128x128_MI16x16x1_SN_LDSB1_AFC0_AFEM1_AFEM1_ASEM1_CLR1_CADS0_DTVA0_DTVB0_EPS0_FDSI0_GRPM1_GRVWA4_GRVWB16_GSU0_GSUAMB_GSUC0_GSUWGMRR0_GLS0_ISA950_IU1_K1_LBSPPA1024_LBSPPB256_LBSPPM0_LPA32_LPB32_LPM0_LRVW16_LWPMn1_MIAV0_MIWT2_4_MO40_NTn1_NTA0_NTB0_NTC0_NTD0_NTM0_NEPBS0_NLCA1_NLCB1_ONLL1_PGR2_PLR1_PKA1_SIA3_SS1_SU0_SUM1_SUS128_SPO0_SRVW0_SSO0_SVW2_SK3_SKXCCM8_TLDS1_ULSGRO0_USL1_UIOFGRO0_USFGRO0_VSn1_VWA2_VWB2_WSGRA0_WSGRB0_WS64_WG32_8_1_WGM6_WGMXCC1_WGMXCCGn1
    SolutionIndex: 35
    SolutionNameMin: Cijk_Ailk_Bljk_I8II_BH_UserArgs_MT64x128x128_MI16x16x1_SN_LDSB1_AFC0_AFEM1_AFEM1_ASEM1_CLR1_CADS0_DTVA0_DTVB0_EPS0_FDSI0_GRPM1_GRVWA4_GRVWB16_GSU0_GSUAMB_GSUC0_GSUWGMRR0_GLS0_ISA950_IU1_K1_LBSPPA1024_LBSPPB512_LBSPPM0_LPA32_LPB32_LPM0_LRVW16_LWPMn1_MIAV0_MIWT2_4_MO40_NTn1_NTA0_NTB0_NTC0_NTD0_NTM0_NEPBS0_NLCA1_NLCB1_ONLL1_PGR2_PLR1_PKA1_SIA3_SS1_SU0_SUM1_SUS128_SPO0_SRVW0_SSO0_SVW2_SK3_SKXCCM8_TLDS1_ULSGRO0_USL1_UIOFGRO0_USFGRO0_VSn1_VWA2_VWB4_WSGRA0_WSGRB0_WS64_WG32_8_1_WGM6_WGMXCC1_WGMXCCGn1
    SolutionIndex: 36
    SolutionNameMin: Cijk_Ailk_Bljk_I8II_BH_UserArgs_MT64x128x128_MI16x16x1_SN_LDSB1_AFC0_AFEM1_AFEM1_ASEM1_CLR1_CADS0_DTVA0_DTVB0_EPS0_FDSI0_GRPM1_GRVWA8_GRVWB16_GSU0_GSUAMB_GSUC0_GSUWGMRR0_GLS0_ISA950_IU1_K1_LBSPPA1024_LBSPPB512_LBSPPM0_LPA32_LPB32_LPM0_LRVW16_LWPMn1_MIAV0_MIWT2_4_MO40_NTn1_NTA0_NTB0_NTC0_NTD0_NTM0_NEPBS0_NLCA1_NLCB1_ONLL1_PGR2_PLR1_PKA1_SIA3_SS1_SU0_SUM1_SUS128_SPO0_SRVW0_SSO0_SVW2_SK3_SKXCCM8_TLDS1_ULSGRO0_USL1_UIOFGRO0_USFGRO0_VSn1_VWA2_VWB4_WSGRA0_WSGRB0_WS64_WG32_8_1_WGM6_WGMXCC1_WGMXCCGn1
    SolutionIndex: 37
    SolutionNameMin: Cijk_Ailk_Bljk_I8II_BH_UserArgs_MT64x128x128_MI16x16x1_SN_LDSB1_AFC0_AFEM1_AFEM1_ASEM1_CLR1_CADS0_DTVA0_DTVB0_EPS0_FDSI0_GRPM1_GRVWA16_GRVWB16_GSU0_GSUAMB_GSUC0_GSUWGMRR0_GLS0_ISA950_IU1_K1_LBSPPA1024_LBSPPB256_LBSPPM0_LPA32_LPB32_LPM0_LRVW16_LWPMn1_MIAV0_MIWT2_4_MO40_NTn1_NTA0_NTB0_NTC0_NTD0_NTM0_NEPBS0_NLCA1_NLCB1_ONLL1_PGR2_PLR1_PKA1_SIA3_SS1_SU0_SUM1_SUS128_SPO0_SRVW0_SSO0_SVW2_SK3_SKXCCM8_TLDS1_ULSGRO0_USL1_UIOFGRO0_USFGRO0_VSn1_VWA2_VWB2_WSGRA0_WSGRB0_WS64_WG32_8_1_WGM6_WGMXCC1_WGMXCCGn1
    SolutionIndex: 38
    SolutionNameMin: Cijk_Ailk_Bljk_I8II_BH_UserArgs_MT64x128x128_MI16x16x1_SN_LDSB1_AFC0_AFEM1_AFEM1_ASEM1_CLR1_CADS0_DTVA0_DTVB0_EPS0_FDSI0_GRPM1_GRVWA16_GRVWB16_GSU0_GSUAMB_GSUC0_GSUWGMRR0_GLS0_ISA950_IU1_K1_LBSPPA1024_LBSPPB512_LBSPPM0_LPA32_LPB32_LPM0_LRVW16_LWPMn1_MIAV0_MIWT2_4_MO40_NTn1_NTA0_NTB0_NTC0_NTD0_NTM0_NEPBS0_NLCA1_NLCB1_ONLL1_PGR2_PLR1_PKA1_SIA3_SS1_SU0_SUM1_SUS128_SPO0_SRVW0_SSO0_SVW2_SK3_SKXCCM8_TLDS1_ULSGRO0_USL1_UIOFGRO0_USFGRO0_VSn1_VWA2_VWB4_WSGRA0_WSGRB0_WS64_WG32_8_1_WGM6_WGMXCC1_WGMXCCGn1
    SolutionIndex: 39
    SolutionNameMin: Cijk_Ailk_Bljk_I8II_BH_UserArgs_MT128x64x128_MI16x16x1_SN_LDSB1_AFC0_AFEM1_AFEM1_ASEM1_CLR1_CADS0_DTVA0_DTVB0_EPS0_FDSI0_GRPM1_GRVWA4_GRVWB4_GSU0_GSUAMB_GSUC0_GSUWGMRR0_GLS0_ISA950_IU1_K1_LBSPPA2048_LBSPPB256_LBSPPM0_LPA64_LPB32_LPM0_LRVW16_LWPMn1_MIAV0_MIWT4_2_MO40_NTn1_NTA0_NTB0_NTC0_NTD0_NTM0_NEPBS0_NLCA1_NLCB1_ONLL1_PGR2_PLR1_PKA1_SIA3_SS1_SU0_SUM1_SUS128_SPO0_SRVW0_SSO0_SVW4_SK3_SKXCCM8_TLDS1_ULSGRO0_USL1_UIOFGRO0_USFGRO0_VSn1_VWA4_VWB2_WSGRA0_WSGRB0_WS64_WG32_8_1_WGM6_WGMXCC1_WGMXCCGn1
    SolutionIndex: 40
    SolutionNameMin: Cijk_Ailk_Bljk_I8II_BH_UserArgs_MT128x64x128_MI16x16x1_SN_LDSB1_AFC0_AFEM1_AFEM1_ASEM1_CLR1_CADS0_DTVA0_DTVB0_EPS0_FDSI0_GRPM1_GRVWA4_GRVWB16_GSU0_GSUAMB_GSUC0_GSUWGMRR0_GLS0_ISA950_IU1_K1_LBSPPA2048_LBSPPB256_LBSPPM0_LPA64_LPB32_LPM0_LRVW16_LWPMn1_MIAV0_MIWT4_2_MO40_NTn1_NTA0_NTB0_NTC0_NTD0_NTM0_NEPBS0_NLCA1_NLCB1_ONLL1_PGR2_PLR1_PKA1_SIA3_SS1_SU0_SUM1_SUS128_SPO0_SRVW0_SSO0_SVW4_SK3_SKXCCM8_TLDS1_ULSGRO0_USL1_UIOFGRO0_USFGRO0_VSn1_VWA4_VWB2_WSGRA0_WSGRB0_WS64_WG32_8_1_WGM6_WGMXCC1_WGMXCCGn1
    SolutionIndex: 41
    SolutionNameMin: Cijk_Ailk_Bljk_I8II_BH_UserArgs_MT64x64x128_MI16x16x1_SN_LDSB1_AFC0_AFEM1_AFEM1_ASEM1_CLR1_CADS0_DTVA0_DTVB0_EPS0_FDSI0_GRPM1_GRVWA4_GRVWB4_GSU0_GSUAMB_GSUC0_GSUWGMRR0_GLS0_ISA950_IU1_K1_LBSPPA1024_LBSPPB256_LBSPPM0_LPA32_LPB32_LPM0_LRVW16_LWPMn1_MIAV0_MIWT2_2_MO40_NTn1_NTA0_NTB0_NTC0_NTD0_NTM0_NEPBS0_NLCA1_NLCB1_ONLL1_PGR2_PLR1_PKA1_SIA3_SS1_SU0_SUM1_SUS128_SPO0_SRVW0_SSO0_SVW2_SK3_SKXCCM8_TLDS1_ULSGRO0_USL1_UIOFGRO0_USFGRO0_VSn1_VWA2_VWB2_WSGRA0_WSGRB0_WS64_WG32_8_1_WGM6_WGMXCC1_WGMXCCGn1
    SolutionIndex: 42
    SolutionNameMin: Cijk_Ailk_Bljk_I8II_BH_UserArgs_MT64x64x128_MI16x16x1_SN_LDSB1_AFC0_AFEM1_AFEM1_ASEM1_CLR1_CADS0_DTVA0_DTVB0_EPS0_FDSI0_GRPM1_GRVWA8_GRVWB4_GSU0_GSUAMB_GSUC0_GSUWGMRR0_GLS0_ISA950_IU1_K1_LBSPPA1024_LBSPPB256_LBSPPM0_LPA32_LPB32_LPM0_LRVW16_LWPMn1_MIAV0_MIWT2_2_MO40_NTn1_NTA0_NTB0_NTC0_NTD0_NTM0_NEPBS0_NLCA1_NLCB1_ONLL1_PGR2_PLR1_PKA1_SIA3_SS1_SU0_SUM1_SUS128_SPO0_SRVW0_SSO0_SVW2_SK3_SKXCCM8_TLDS1_ULSGRO0_USL1_UIOFGRO0_USFGRO0_VSn1_VWA2_VWB2_WSGRA0_WSGRB0_WS64_WG32_8_1_WGM6_WGMXCC1_WGMXCCGn1
    SolutionIndex: 43
    SolutionNameMin: Cijk_Ailk_Bljk_I8II_BH_UserArgs_MT64x64x128_MI16x16x1_SN_LDSB1_AFC0_AFEM1_AFEM1_ASEM1_CLR1_CADS0_DTVA0_DTVB0_EPS0_FDSI0_GRPM1_GRVWA4_GRVWB8_GSU0_GSUAMB_GSUC0_GSUWGMRR0_GLS0_ISA950_IU1_K1_LBSPPA1024_LBSPPB256_LBSPPM0_LPA32_LPB32_LPM0_LRVW16_LWPMn1_MIAV0_MIWT2_2_MO40_NTn1_NTA0_NTB0_NTC0_NTD0_NTM0_NEPBS0_NLCA1_NLCB1_ONLL1_PGR2_PLR1_PKA1_SIA3_SS1_SU0_SUM1_SUS128_SPO0_SRVW0_SSO0_SVW2_SK3_SKXCCM8_TLDS1_ULSGRO0_USL1_UIOFGRO0_USFGRO0_VSn1_VWA2_VWB2_WSGRA0_WSGRB0_WS64_WG32_8_1_WGM6_WGMXCC1_WGMXCCGn1
    SolutionIndex: 44
    SolutionNameMin: Cijk_Ailk_Bljk_I8II_BH_UserArgs_MT64x64x128_MI16x16x1_SN_LDSB1_AFC0_AFEM1_AFEM1_ASEM1_CLR1_CADS0_DTVA0_DTVB0_EPS0_FDSI0_GRPM1_GRVWA4_GRVWB16_GSU0_GSUAMB_GSUC0_GSUWGMRR0_GLS0_ISA950_IU1_K1_LBSPPA1024_LBSPPB256_LBSPPM0_LPA32_LPB32_LPM0_LRVW16_LWPMn1_MIAV0_MIWT2_2_MO40_NTn1_NTA0_NTB0_NTC0_NTD0_NTM0_NEPBS0_NLCA1_NLCB1_ONLL1_PGR2_PLR1_PKA1_SIA3_SS1_SU0_SUM1_SUS128_SPO0_SRVW0_SSO0_SVW2_SK3_SKXCCM8_TLDS1_ULSGRO0_USL1_UIOFGRO0_USFGRO0_VSn1_VWA2_VWB2_WSGRA0_WSGRB0_WS64_WG32_8_1_WGM6_WGMXCC1_WGMXCCGn1
    SolutionIndex: 45
    SolutionNameMin: Cijk_Ailk_Bljk_I8II_BH_UserArgs_MT64x64x128_MI16x16x1_SN_LDSB1_AFC0_AFEM1_AFEM1_ASEM1_CLR1_CADS0_DTVA0_DTVB0_EPS0_FDSI0_GRPM1_GRVWA8_GRVWB16_GSU0_GSUAMB_GSUC0_GSUWGMRR0_GLS0_ISA950_IU1_K1_LBSPPA1024_LBSPPB256_LBSPPM0_LPA32_LPB32_LPM0_LRVW16_LWPMn1_MIAV0_MIWT2_2_MO40_NTn1_NTA0_NTB0_NTC0_NTD0_NTM0_NEPBS0_NLCA1_NLCB1_ONLL1_PGR2_PLR1_PKA1_SIA3_SS1_SU0_SUM1_SUS128_SPO0_SRVW0_SSO0_SVW2_SK3_SKXCCM8_TLDS1_ULSGRO0_USL1_UIOFGRO0_USFGRO0_VSn1_VWA2_VWB2_WSGRA0_WSGRB0_WS64_WG32_8_1_WGM6_WGMXCC1_WGMXCCGn1
    SolutionIndex: 46
    SolutionNameMin: Cijk_Ailk_Bljk_I8II_BH_UserArgs_MT64x64x128_MI16x16x1_SN_LDSB1_AFC0_AFEM1_AFEM1_ASEM1_CLR1_CADS0_DTVA0_DTVB0_EPS0_FDSI0_GRPM1_GRVWA16_GRVWB16_GSU0_GSUAMB_GSUC0_GSUWGMRR0_GLS0_ISA950_IU1_K1_LBSPPA1024_LBSPPB256_LBSPPM0_LPA32_LPB32_LPM0_LRVW16_LWPMn1_MIAV0_MIWT2_2_MO40_NTn1_NTA0_NTB0_NTC0_NTD0_NTM0_NEPBS0_NLCA1_NLCB1_ONLL1_PGR2_PLR1_PKA1_SIA3_SS1_SU0_SUM1_SUS128_SPO0_SRVW0_SSO0_SVW2_SK3_SKXCCM8_TLDS1_ULSGRO0_USL1_UIOFGRO0_USFGRO0_VSn1_VWA2_VWB2_WSGRA0_WSGRB0_WS64_WG32_8_1_WGM6_WGMXCC1_WGMXCCGn1
    SolutionIndex: 47
    SolutionNameMin: Cijk_Ailk_Bljk_I8II_BH_UserArgs_MT256x256x128_MI32x32x1_SN_LDSB1_AFC0_AFEM1_AFEM1_ASEM1_CLR1_CADS0_DTVA0_DTVB0_EPS0_FDSI0_GRPM1_GRVWA16_GRVWB16_GSU0_GSUAMB_GSUC0_GSUWGMRR0_GLS0_ISA950_IU1_K1_LBSPPA0_LBSPPB256_LBSPPM0_LPA0_LPB16_LPM0_LRVW16_LWPMn1_MIAV0_MIWT4_4_MO40_NTn1_NTA0_NTB0_NTC0_NTD0_NTM0_NEPBS0_NLCA1_NLCB1_ONLL1_PGR2_PLR1_PKA1_SIA3_SS1_SU0_SUM1_SUS128_SPO0_SRVW0_SSO0_SVW4_SK3_SKXCCM8_TLDS1_ULSGRO0_USL1_UIOFGRO0_USFGRO0_VSn1_VWA4_VWB2_WSGRA0_WSGRB0_WS64_WG64_4_1_WGM6_WGMXCC1_WGMXCCGn1
    SolutionIndex: 48
    SolutionNameMin: Cijk_Ailk_Bljk_I8II_BH_UserArgs_MT128x256x128_MI32x32x1_SN_LDSB1_AFC0_AFEM1_AFEM1_ASEM1_CLR1_CADS0_DTVA0_DTVB0_EPS0_FDSI0_GRPM1_GRVWA4_GRVWB16_GSU0_GSUAMB_GSUC0_GSUWGMRR0_GLS0_ISA950_IU1_K1_LBSPPA0_LBSPPB512_LBSPPM0_LPA0_LPB16_LPM0_LRVW16_LWPMn1_MIAV0_MIWT2_4_MO40_NTn1_NTA0_NTB0_NTC0_NTD0_NTM0_NEPBS0_NLCA1_NLCB1_ONLL1_PGR2_PLR1_PKA1_SIA3_SS1_SU0_SUM1_SUS128_SPO0_SRVW0_SSO0_SVW2_SK3_SKXCCM8_TLDS1_ULSGRO0_USL1_UIOFGRO0_USFGRO0_VSn1_VWA2_VWB4_WSGRA0_WSGRB0_WS64_WG64_4_1_WGM6_WGMXCC1_WGMXCCGn1
    SolutionIndex: 49
    SolutionNameMin: Cijk_Ailk_Bljk_I8II_BH_UserArgs_MT64x64x256_MI16x16x1_SN_LDSB1_AFC0_AFEM1_AFEM1_ASEM1_CLR1_CADS0_DTVA0_DTVB0_EPS0_FDSI0_GRPM1_GRVWA4_GRVWB16_GSU0_GSUAMB_GSUC0_GSUWGMRR0_GLS0_ISA950_IU1_K1_LBSPPA1024_LBSPPB512_LBSPPM0_LPA32_LPB32_LPM0_LRVW16_LWPMn1_MIAV0_MIWT2_2_MO40_NTn1_NTA0_NTB0_NTC0_NTD0_NTM0_NEPBS0_NLCA1_NLCB1_ONLL1_PGR2_PLR1_PKA1_SIA3_SS1_SU0_SUM1_SUS256_SPO0_SRVW0_SSO0_SVW2_SK3_SKXCCM8_TLDS1_ULSGRO0_USL1_UIOFGRO0_USFGRO0_VSn1_VWA2_VWB2_WSGRA0_WSGRB0_WS64_WG32_8_1_WGM6_WGMXCC1_WGMXCCGn1
    SolutionIndex: 50
    SolutionNameMin: Cijk_Ailk_Bljk_I8II_BH_UserArgs_MT64x64x256_MI16x16x1_SN_LDSB1_AFC0_AFEM1_AFEM1_ASEM1_CLR1_CADS0_DTVA0_DTVB0_EPS0_FDSI0_GRPM1_GRVWA8_GRVWB16_GSU0_GSUAMB_GSUC0_GSUWGMRR0_GLS0_ISA950_IU1_K1_LBSPPA1024_LBSPPB512_LBSPPM0_LPA32_LPB32_LPM0_LRVW16_LWPMn1_MIAV0_MIWT2_2_MO40_NTn1_NTA0_NTB0_NTC0_NTD0_NTM0_NEPBS0_NLCA1_NLCB1_ONLL1_PGR2_PLR1_PKA1_SIA3_SS1_SU0_SUM1_SUS256_SPO0_SRVW0_SSO0_SVW2_SK3_SKXCCM8_TLDS1_ULSGRO0_USL1_UIOFGRO0_USFGRO0_VSn1_VWA2_VWB2_WSGRA0_WSGRB0_WS64_WG32_8_1_WGM6_WGMXCC1_WGMXCCGn1
    SolutionIndex: 51
    SolutionNameMin: Cijk_Ailk_Bljk_I8II_BH_UserArgs_MT64x64x256_MI16x16x1_SN_LDSB1_AFC0_AFEM1_AFEM1_ASEM1_CLR1_CADS0_DTVA0_DTVB0_EPS0_FDSI0_GRPM1_GRVWA4_GRVWB16_GSU0_GSUAMB_GSUC0_GSUWGMRR0_GLS0_ISA950_IU1_K1_LBSPPA1024_LBSPPB512_LBSPPM0_LPA32_LPB32_LPM0_LRVW16_LWPMn1_MIAV0_MIWT2_2_MO40_NTn1_NTA0_NTB0_NTC0_NTD0_NTM0_NEPBS0_NLCA1_NLCB1_ONLL1_PGR2_PLR2_PKA1_SIA3_SS1_SU0_SUM1_SUS256_SPO0_SRVW0_SSO0_SVW2_SK3_SKXCCM8_TLDS1_ULSGRO0_USL1_UIOFGRO0_USFGRO0_VSn1_VWA2_VWB2_WSGRA0_WSGRB0_WS64_WG32_8_1_WGM6_WGMXCC1_WGMXCCGn1
    SolutionIndex: 52
    SolutionNameMin: Cijk_Ailk_Bljk_I8II_BH_UserArgs_MT64x64x256_MI16x16x1_SN_LDSB1_AFC0_AFEM1_AFEM1_ASEM1_CLR1_CADS0_DTVA0_DTVB0_EPS0_FDSI0_GRPM1_GRVWA8_GRVWB16_GSU0_GSUAMB_GSUC0_GSUWGMRR0_GLS0_ISA950_IU1_K1_LBSPPA1024_LBSPPB512_LBSPPM0_LPA32_LPB32_LPM0_LRVW16_LWPMn1_MIAV0_MIWT2_2_MO40_NTn1_NTA0_NTB0_NTC0_NTD0_NTM0_NEPBS0_NLCA1_NLCB1_ONLL1_PGR2_PLR2_PKA1_SIA3_SS1_SU0_SUM1_SUS256_SPO0_SRVW0_SSO0_SVW2_SK3_SKXCCM8_TLDS1_ULSGRO0_USL1_UIOFGRO0_USFGRO0_VSn1_VWA2_VWB2_WSGRA0_WSGRB0_WS64_WG32_8_1_WGM6_WGMXCC1_WGMXCCGn1
    SolutionIndex: 53
    SolutionNameMin: Cijk_Ailk_Bljk_I8II_BH_UserArgs_MT64x64x256_MI16x16x1_SN_LDSB1_AFC0_AFEM1_AFEM1_ASEM1_CLR1_CADS0_DTVA0_DTVB0_EPS0_FDSI0_GRPM1_GRVWA16_GRVWB16_GSU0_GSUAMB_GSUC0_GSUWGMRR0_GLS0_ISA950_IU1_K1_LBSPPA1024_LBSPPB512_LBSPPM0_LPA32_LPB32_LPM0_LRVW16_LWPMn1_MIAV0_MIWT2_2_MO40_NTn1_NTA0_NTB0_NTC0_NTD0_NTM0_NEPBS0_NLCA1_NLCB1_ONLL1_PGR2_PLR2_PKA1_SIA3_SS1_SU0_SUM1_SUS256_SPO0_SRVW0_SSO0_SVW2_SK3_SKXCCM8_TLDS1_ULSGRO0_USL1_UIOFGRO0_USFGRO0_VSn1_VWA2_VWB2_WSGRA0_WSGRB0_WS64_WG32_8_1_WGM6_WGMXCC1_WGMXCCGn1
- - - [128, 128, 1, 128, 128, 128, 128, 128]
    - [44, 0.39]
  - - [128, 128, 1, 256, 128, 128, 128, 256]
    - [46, 0.67]
  - - [128, 128, 1, 512, 128, 128, 128, 512]
    - [44, 1.11]
  - - [128, 128, 1, 1024, 128, 128, 128, 1024]
    - [53, 1.72]
  - - [128, 128, 1, 2048, 128, 128, 128, 2048]
    - [53, 2.39]
  - - [128, 128, 1, 4096, 128, 128, 128, 4096]
    - [53, 2.99]
  - - [128, 128, 1, 8192, 128, 128, 128, 8192]
    - [53, 3.43]
  - - [128, 256, 1, 128, 128, 128, 128, 128]
    - [44, 0.76]
  - - [128, 256, 1, 256, 128, 128, 128, 256]
    - [44, 1.31]
  - - [128, 256, 1, 512, 128, 128, 128, 512]
    - [44, 2.17]
  - - [128, 256, 1, 1024, 128, 128, 128, 1024]
    - [53, 3.4]
  - - [128, 256, 1, 2048, 128, 128, 128, 2048]
    - [53, 4.76]
  - - [128, 256, 1, 4096, 128, 128, 128, 4096]
    - [53, 5.95]
  - - [128, 256, 1, 8192, 128, 128, 128, 8192]
    - [53, 6.81]
  - - [128, 512, 1, 128, 128, 128, 128, 128]
    - [45, 1.51]
  - - [128, 512, 1, 256, 128, 128, 128, 256]
    - [44, 2.68]
  - - [128, 512, 1, 512, 128, 128, 128, 512]
    - [44, 4.38]
  - - [128, 512, 1, 1024, 128, 128, 128, 1024]
    - [53, 6.83]
  - - [128, 512, 1, 2048, 128, 128, 128, 2048]
    - [53, 9.47]
  - - [128, 512, 1, 4096, 128, 128, 128, 4096]
    - [53, 11.9]
  - - [128, 512, 1, 8192, 128, 128, 128, 8192]
    - [53, 13.62]
  - - [128, 1024, 1, 128, 128, 128, 128, 128]
    - [41, 3.02]
  - - [128, 1024, 1, 256, 128, 128, 128, 256]
    - [44, 5.3]
  - - [128, 1024, 1, 512, 128, 128, 128, 512]
    - [44, 8.7]
  - - [128, 1024, 1, 1024, 128, 128, 128, 1024]
    - [53, 13.45]
  - - [128, 1024, 1, 2048, 128, 128, 128, 2048]
    - [53, 18.89]
  - - [128, 1024, 1, 4096, 128, 128, 128, 4096]
    - [53, 23.58]
  - - [128, 1024, 1, 8192, 128, 128, 128, 8192]
    - [53, 27.19]
  - - [128, 2048, 1, 128, 128, 128, 128, 128]
    - [44, 5.94]
  - - [128, 2048, 1, 256, 128, 128, 128, 256]
    - [46, 10.17]
  - - [128, 2048, 1, 512, 128, 128, 128, 512]
    - [44, 17.13]
  - - [128, 2048, 1, 1024, 128, 128, 128, 1024]
    - [53, 26.25]
  - - [128, 2048, 1, 2048, 128, 128, 128, 2048]
    - [53, 37.21]
  - - [128, 2048, 1, 4096, 128, 128, 128, 4096]
    - [53, 46.93]
  - - [128, 2048, 1, 8192, 128, 128, 128, 8192]
    - [53, 54.21]
  - - [128, 4096, 1, 128, 128, 128, 128, 128]
    - [44, 11.17]
  - - [128, 4096, 1, 256, 128, 128, 128, 256]
    - [44, 19.74]
  - - [128, 4096, 1, 512, 128, 128, 128, 512]
    - [44, 33.0]
  - - [128, 4096, 1, 1024, 128, 128, 128, 1024]
    - [53, 51.22]
  - - [128, 4096, 1, 2048, 128, 128, 128, 2048]
    - [51, 72.11]
  - - [128, 4096, 1, 4096, 128, 128, 128, 4096]
    - [53, 92.01]
  - - [128, 4096, 1, 8192, 128, 128, 128, 8192]
    - [53, 105.9]
  - - [128, 8192, 1, 128, 128, 128, 128, 128]
    - [44, 20.3]
  - - [128, 8192, 1, 256, 128, 128, 128, 256]
    - [44, 35.82]
  - - [128, 8192, 1, 512, 128, 128, 128, 512]
    - [46, 60.12]
  - - [128, 8192, 1, 1024, 128, 128, 128, 1024]
    - [49, 95.22]
  - - [128, 8192, 1, 2048, 128, 128, 128, 2048]
    - [53, 136.1]
  - - [128, 8192, 1, 4096, 128, 128, 128, 4096]
    - [53, 170.25]
  - - [128, 8192, 1, 8192, 128, 128, 128, 8192]
    - [53, 199.87]
  - - [256, 128, 1, 128, 256, 256, 256, 128]
    - [41, 0.75]
  - - [256, 128, 1, 256, 256, 256, 256, 256]
    - [44, 1.31]
  - - [256, 128, 1, 512, 256, 256, 256, 512]
    - [44, 2.19]
  - - [256, 128, 1, 1024, 256, 256, 256, 1024]
    - [53, 3.41]
  - - [256, 128, 1, 2048, 256, 256, 256, 2048]
    - [53, 4.63]
  - - [256, 128, 1, 4096, 256, 256, 256, 4096]
    - [53, 5.7]
  - - [256, 128, 1, 8192, 256, 256, 256, 8192]
    - [53, 6.44]
  - - [256, 256, 1, 128, 256, 256, 256, 128]
    - [41, 1.53]
  - - [256, 256, 1, 256, 256, 256, 256, 256]
    - [44, 2.66]
  - - [256, 256, 1, 512, 256, 256, 256, 512]
    - [44, 4.42]
  - - [256, 256, 1, 1024, 256, 256, 256, 1024]
    - [53, 6.83]
  - - [256, 256, 1, 2048, 256, 256, 256, 2048]
    - [53, 9.39]
  - - [256, 256, 1, 4096, 256, 256, 256, 4096]
    - [53, 11.47]
  - - [256, 256, 1, 8192, 256, 256, 256, 8192]
    - [53, 13.11]
  - - [256, 512, 1, 128, 256, 256, 256, 128]
    - [44, 3.05]
  - - [256, 512, 1, 256, 256, 256, 256, 256]
    - [44, 5.33]
  - - [256, 512, 1, 512, 256, 256, 256, 512]
    - [53, 8.85]
  - - [256, 512, 1, 1024, 256, 256, 256, 1024]
    - [53, 13.58]
  - - [256, 512, 1, 2048, 256, 256, 256, 2048]
    - [53, 18.79]
  - - [256, 512, 1, 4096, 256, 256, 256, 4096]
    - [53, 23.18]
  - - [256, 512, 1, 8192, 256, 256, 256, 8192]
    - [53, 26.38]
  - - [256, 1024, 1, 128, 256, 256, 256, 128]
    - [44, 5.95]
  - - [256, 1024, 1, 256, 256, 256, 256, 256]
    - [51, 10.32]
  - - [256, 1024, 1, 512, 256, 256, 256, 512]
    - [53, 17.16]
  - - [256, 1024, 1, 1024, 256, 256, 256, 1024]
    - [53, 26.81]
  - - [256, 1024, 1, 2048, 256, 256, 256, 2048]
    - [53, 37.15]
  - - [256, 1024, 1, 4096, 256, 256, 256, 4096]
    - [53, 45.66]
  - - [256, 1024, 1, 8192, 256, 256, 256, 8192]
    - [53, 52.21]
  - - [256, 2048, 1, 128, 256, 256, 256, 128]
    - [41, 11.15]
  - - [256, 2048, 1, 256, 256, 256, 256, 256]
    - [44, 19.74]
  - - [256, 2048, 1, 512, 256, 256, 256, 512]
    - [44, 32.82]
  - - [256, 2048, 1, 1024, 256, 256, 256, 1024]
    - [53, 51.59]
  - - [256, 2048, 1, 2048, 256, 256, 256, 2048]
    - [53, 72.22]
  - - [256, 2048, 1, 4096, 256, 256, 256, 4096]
    - [53, 90.46]
  - - [256, 2048, 1, 8192, 256, 256, 256, 8192]
    - [53, 103.34]
  - - [256, 4096, 1, 128, 256, 256, 256, 128]
    - [44, 20.03]
  - - [256, 4096, 1, 256, 256, 256, 256, 256]
    - [45, 35.49]
  - - [256, 4096, 1, 512, 256, 256, 256, 512]
    - [53, 60.08]
  - - [256, 4096, 1, 1024, 256, 256, 256, 1024]
    - [51, 95.53]
  - - [256, 4096, 1, 2048, 256, 256, 256, 2048]
    - [53, 137.47]
  - - [256, 4096, 1, 4096, 256, 256, 256, 4096]
    - [53, 170.92]
  - - [256, 4096, 1, 8192, 256, 256, 256, 8192]
    - [53, 195.36]
  - - [256, 8192, 1, 128, 256, 256, 256, 128]
    - [40, 32.01]
  - - [256, 8192, 1, 256, 256, 256, 256, 256]
    - [34, 57.27]
  - - [256, 8192, 1, 512, 256, 256, 256, 512]
    - [34, 99.54]
  - - [256, 8192, 1, 1024, 256, 256, 256, 1024]
    - [37, 155.06]
  - - [256, 8192, 1, 2048, 256, 256, 256, 2048]
    - [34, 217.08]
  - - [256, 8192, 1, 4096, 256, 256, 256, 4096]
    - [37, 271.73]
  - - [256, 8192, 1, 8192, 256, 256, 256, 8192]
    - [38, 314.95]
  - - [512, 128, 1, 128, 512, 512, 512, 128]
    - [42, 1.46]
  - - [512, 128, 1, 256, 512, 512, 512, 256]
    - [44, 2.62]
  - - [512, 128, 1, 512, 512, 512, 512, 512]
    - [46, 4.3]
  - - [512, 128, 1, 1024, 512, 512, 512, 1024]
    - [53, 6.46]
  - - [512, 128, 1, 2048, 512, 512, 512, 2048]
    - [53, 8.69]
  - - [512, 128, 1, 4096, 512, 512, 512, 4096]
    - [53, 10.41]
  - - [512, 128, 1, 8192, 512, 512, 512, 8192]
    - [53, 11.7]
  - - [512, 256, 1, 128, 512, 512, 512, 128]
    - [41, 2.93]
  - - [512, 256, 1, 256, 512, 512, 512, 256]
    - [50, 5.21]
  - - [512, 256, 1, 512, 512, 512, 512, 512]
    - [53, 8.66]
  - - [512, 256, 1, 1024, 512, 512, 512, 1024]
    - [53, 12.96]
  - - [512, 256, 1, 2048, 512, 512, 512, 2048]
    - [53, 17.56]
  - - [512, 256, 1, 4096, 512, 512, 512, 4096]
    - [53, 21.11]
  - - [512, 256, 1, 8192, 512, 512, 512, 8192]
    - [53, 23.8]
  - - [512, 512, 1, 128, 512, 512, 512, 128]
    - [43, 5.82]
  - - [512, 512, 1, 256, 512, 512, 512, 256]
    - [52, 10.41]
  - - [512, 512, 1, 512, 512, 512, 512, 512]
    - [46, 17.0]
  - - [512, 512, 1, 1024, 512, 512, 512, 1024]
    - [53, 26.17]
  - - [512, 512, 1, 2048, 512, 512, 512, 2048]
    - [53, 35.17]
  - - [512, 512, 1, 4096, 512, 512, 512, 4096]
    - [53, 42.3]
  - - [512, 512, 1, 8192, 512, 512, 512, 8192]
    - [53, 47.54]
  - - [512, 1024, 1, 128, 512, 512, 512, 128]
    - [44, 11.29]
  - - [512, 1024, 1, 256, 512, 512, 512, 256]
    - [46, 19.79]
  - - [512, 1024, 1, 512, 512, 512, 512, 512]
    - [44, 32.98]
  - - [512, 1024, 1, 1024, 512, 512, 512, 1024]
    - [53, 51.16]
  - - [512, 1024, 1, 2048, 512, 512, 512, 2048]
    - [53, 68.88]
  - - [512, 1024, 1, 4096, 512, 512, 512, 4096]
    - [53, 83.87]
  - - [512, 1024, 1, 8192, 512, 512, 512, 8192]
    - [53, 95.04]
  - - [512, 2048, 1, 128, 512, 512, 512, 128]
    - [41, 20.11]
  - - [512, 2048, 1, 256, 512, 512, 512, 256]
    - [44, 35.87]
  - - [512, 2048, 1, 512, 512, 512, 512, 512]
    - [44, 60.39]
  - - [512, 2048, 1, 1024, 512, 512, 512, 1024]
    - [53, 96.47]
  - - [512, 2048, 1, 2048, 512, 512, 512, 2048]
    - [53, 131.46]
  - - [512, 2048, 1, 4096, 512, 512, 512, 4096]
    - [53, 162.17]
  - - [512, 2048, 1, 8192, 512, 512, 512, 8192]
    - [53, 178.39]
  - - [512, 4096, 1, 128, 512, 512, 512, 128]
    - [40, 32.12]
  - - [512, 4096, 1, 256, 512, 512, 512, 256]
    - [40, 57.79]
  - - [512, 4096, 1, 512, 512, 512, 512, 512]
    - [35, 100.79]
  - - [512, 4096, 1, 1024, 512, 512, 512, 1024]
    - [37, 159.53]
  - - [512, 4096, 1, 2048, 512, 512, 512, 2048]
    - [37, 222.28]
  - - [512, 4096, 1, 4096, 512, 512, 512, 4096]
    - [38, 277.12]
  - - [512, 4096, 1, 8192, 512, 512, 512, 8192]
    - [37, 319.41]
  - - [512, 8192, 1, 128, 512, 512, 512, 128]
    - [3, 41.26]
  - - [512, 8192, 1, 256, 512, 512, 512, 256]
    - [30, 76.09]
  - - [512, 8192, 1, 512, 512, 512, 512, 512]
    - [30, 138.33]
  - - [512, 8192, 1, 1024, 512, 512, 512, 1024]
    - [33, 220.9]
  - - [512, 8192, 1, 2048, 512, 512, 512, 2048]
    - [33, 324.54]
  - - [512, 8192, 1, 4096, 512, 512, 512, 4096]
    - [32, 422.18]
  - - [512, 8192, 1, 8192, 512, 512, 512, 8192]
    - [32, 483.02]
  - - [1024, 128, 1, 128, 1024, 1024, 1024, 128]
    - [44, 3.01]
  - - [1024, 128, 1, 256, 1024, 1024, 1024, 256]
    - [50, 5.27]
  - - [1024, 128, 1, 512, 1024, 1024, 1024, 512]
    - [44, 8.77]
  - - [1024, 128, 1, 1024, 1024, 1024, 1024, 1024]
    - [44, 12.91]
  - - [1024, 128, 1, 2048, 1024, 1024, 1024, 2048]
    - [53, 16.87]
  - - [1024, 128, 1, 4096, 1024, 1024, 1024, 4096]
    - [53, 20.25]
  - - [1024, 128, 1, 8192, 1024, 1024, 1024, 8192]
    - [51, 22.5]
  - - [1024, 256, 1, 128, 1024, 1024, 1024, 128]
    - [41, 5.95]
  - - [1024, 256, 1, 256, 1024, 1024, 1024, 256]
    - [44, 10.42]
  - - [1024, 256, 1, 512, 1024, 1024, 1024, 512]
    - [44, 17.12]
  - - [1024, 256, 1, 1024, 1024, 1024, 1024, 1024]
    - [44, 25.54]
  - - [1024, 256, 1, 2048, 1024, 1024, 1024, 2048]
    - [53, 34.04]
  - - [1024, 256, 1, 4096, 1024, 1024, 1024, 4096]
    - [53, 40.52]
  - - [1024, 256, 1, 8192, 1024, 1024, 1024, 8192]
    - [53, 45.28]
  - - [1024, 512, 1, 128, 1024, 1024, 1024, 128]
    - [44, 11.36]
  - - [1024, 512, 1, 256, 1024, 1024, 1024, 256]
    - [52, 19.88]
  - - [1024, 512, 1, 512, 1024, 1024, 1024, 512]
    - [44, 33.08]
  - - [1024, 512, 1, 1024, 1024, 1024, 1024, 1024]
    - [44, 50.03]
  - - [1024, 512, 1, 2048, 1024, 1024, 1024, 2048]
    - [53, 67.08]
  - - [1024, 512, 1, 4096, 1024, 1024, 1024, 4096]
    - [53, 80.32]
  - - [1024, 512, 1, 8192, 1024, 1024, 1024, 8192]
    - [53, 90.6]
  - - [1024, 1024, 1, 128, 1024, 1024, 1024, 128]
    - [44, 20.43]
  - - [1024, 1024, 1, 256, 1024, 1024, 1024, 256]
    - [52, 36.12]
  - - [1024, 1024, 1, 512, 1024, 1024, 1024, 512]
    - [44, 60.95]
  - - [1024, 1024, 1, 1024, 1024, 1024, 1024, 1024]
    - [53, 94.04]
  - - [1024, 1024, 1, 2048, 1024, 1024, 1024, 2048]
    - [53, 129.52]
  - - [1024, 1024, 1, 4096, 1024, 1024, 1024, 4096]
    - [46, 154.94]
  - - [1024, 1024, 1, 8192, 1024, 1024, 1024, 8192]
    - [46, 175.14]
  - - [1024, 2048, 1, 128, 1024, 1024, 1024, 128]
    - [40, 32.04]
  - - [1024, 2048, 1, 256, 1024, 1024, 1024, 256]
    - [35, 58.42]
  - - [1024, 2048, 1, 512, 1024, 1024, 1024, 512]
    - [35, 100.39]
  - - [1024, 2048, 1, 1024, 1024, 1024, 1024, 1024]
    - [36, 158.52]
  - - [1024, 2048, 1, 2048, 1024, 1024, 1024, 2048]
    - [38, 224.7]
  - - [1024, 2048, 1, 4096, 1024, 1024, 1024, 4096]
    - [37, 282.43]
  - - [1024, 2048, 1, 8192, 1024, 1024, 1024, 8192]
    - [38, 321.84]
  - - [1024, 4096, 1, 128, 1024, 1024, 1024, 128]
    - [31, 41.46]
  - - [1024, 4096, 1, 256, 1024, 1024, 1024, 256]
    - [30, 75.24]
  - - [1024, 4096, 1, 512, 1024, 1024, 1024, 512]
    - [30, 132.55]
  - - [1024, 4096, 1, 1024, 1024, 1024, 1024, 1024]
    - [33, 216.51]
  - - [1024, 4096, 1, 2048, 1024, 1024, 1024, 2048]
    - [33, 324.15]
  - - [1024, 4096, 1, 4096, 1024, 1024, 1024, 4096]
    - [33, 423.75]
  - - [1024, 4096, 1, 8192, 1024, 1024, 1024, 8192]
    - [33, 497.96]
  - - [1024, 8192, 1, 128, 1024, 1024, 1024, 128]
    - [15, 54.65]
  - - [1024, 8192, 1, 256, 1024, 1024, 1024, 256]
    - [15, 99.42]
  - - [1024, 8192, 1, 512, 1024, 1024, 1024, 512]
    - [17, 172.49]
  - - [1024, 8192, 1, 1024, 1024, 1024, 1024, 1024]
    - [27, 278.96]
  - - [1024, 8192, 1, 2048, 1024, 1024, 1024, 2048]
    - [27, 419.72]
  - - [1024, 8192, 1, 4096, 1024, 1024, 1024, 4096]
    - [24, 519.81]
  - - [1024, 8192, 1, 8192, 1024, 1024, 1024, 8192]
    - [24, 595.14]
  - - [2048, 128, 1, 128, 2048, 2048, 2048, 128]
    - [44, 5.91]
  - - [2048, 128, 1, 256, 2048, 2048, 2048, 256]
    - [49, 10.25]
  - - [2048, 128, 1, 512, 2048, 2048, 2048, 512]
    - [46, 16.9]
  - - [2048, 128, 1, 1024, 2048, 2048, 2048, 1024]
    - [44, 25.16]
  - - [2048, 128, 1, 2048, 2048, 2048, 2048, 2048]
    - [44, 33.69]
  - - [2048, 128, 1, 4096, 2048, 2048, 2048, 4096]
    - [46, 40.31]
  - - [2048, 128, 1, 8192, 2048, 2048, 2048, 8192]
    - [46, 45.43]
  - - [2048, 256, 1, 128, 2048, 2048, 2048, 128]
    - [43, 11.29]
  - - [2048, 256, 1, 256, 2048, 2048, 2048, 256]
    - [52, 19.66]
  - - [2048, 256, 1, 512, 2048, 2048, 2048, 512]
    - [46, 32.82]
  - - [2048, 256, 1, 1024, 2048, 2048, 2048, 1024]
    - [44, 49.37]
  - - [2048, 256, 1, 2048, 2048, 2048, 2048, 2048]
    - [46, 66.61]
  - - [2048, 256, 1, 4096, 2048, 2048, 2048, 4096]
    - [46, 80.4]
  - - [2048, 256, 1, 8192, 2048, 2048, 2048, 8192]
    - [46, 89.61]
  - - [2048, 512, 1, 128, 2048, 2048, 2048, 128]
    - [44, 20.36]
  - - [2048, 512, 1, 256, 2048, 2048, 2048, 256]
    - [44, 36.16]
  - - [2048, 512, 1, 512, 2048, 2048, 2048, 512]
    - [44, 60.76]
  - - [2048, 512, 1, 1024, 2048, 2048, 2048, 1024]
    - [53, 93.6]
  - - [2048, 512, 1, 2048, 2048, 2048, 2048, 2048]
    - [53, 127.65]
  - - [2048, 512, 1, 4096, 2048, 2048, 2048, 4096]
    - [46, 154.64]
  - - [2048, 512, 1, 8192, 2048, 2048, 2048, 8192]
    - [46, 172.53]
  - - [2048, 1024, 1, 128, 2048, 2048, 2048, 128]
    - [40, 32.0]
  - - [2048, 1024, 1, 256, 2048, 2048, 2048, 256]
    - [35, 58.72]
  - - [2048, 1024, 1, 512, 2048, 2048, 2048, 512]
    - [35, 101.6]
  - - [2048, 1024, 1, 1024, 2048, 2048, 2048, 1024]
    - [37, 160.68]
  - - [2048, 1024, 1, 2048, 2048, 2048, 2048, 2048]
    - [37, 225.62]
  - - [2048, 1024, 1, 4096, 2048, 2048, 2048, 4096]
    - [34, 282.67]
  - - [2048, 1024, 1, 8192, 2048, 2048, 2048, 8192]
    - [37, 320.96]
  - - [2048, 2048, 1, 128, 2048, 2048, 2048, 128]
    - [28, 41.66]
  - - [2048, 2048, 1, 256, 2048, 2048, 2048, 256]
    - [30, 75.03]
  - - [2048, 2048, 1, 512, 2048, 2048, 2048, 512]
    - [30, 130.98]
  - - [2048, 2048, 1, 1024, 2048, 2048, 2048, 1024]
    - [33, 219.84]
  - - [2048, 2048, 1, 2048, 2048, 2048, 2048, 2048]
    - [33, 322.32]
  - - [2048, 2048, 1, 4096, 2048, 2048, 2048, 4096]
    - [33, 422.35]
  - - [2048, 2048, 1, 8192, 2048, 2048, 2048, 8192]
    - [32, 484.55]
  - - [2048, 4096, 1, 128, 2048, 2048, 2048, 128]
    - [2, 53.44]
  - - [2048, 4096, 1, 256, 2048, 2048, 2048, 256]
    - [2, 97.56]
  - - [2048, 4096, 1, 512, 2048, 2048, 2048, 512]
    - [25, 170.11]
  - - [2048, 4096, 1, 1024, 2048, 2048, 2048, 1024]
    - [27, 282.96]
  - - [2048, 4096, 1, 2048, 2048, 2048, 2048, 2048]
    - [27, 434.07]
  - - [2048, 4096, 1, 4096, 2048, 2048, 2048, 4096]
    - [25, 536.27]
  - - [2048, 4096, 1, 8192, 2048, 2048, 2048, 8192]
    - [26, 599.0]
  - - [2048, 8192, 1, 128, 2048, 2048, 2048, 128]
    - [5, 59.4]
  - - [2048, 8192, 1, 256, 2048, 2048, 2048, 256]
    - [8, 112.62]
  - - [2048, 8192, 1, 512, 2048, 2048, 2048, 512]
    - [8, 202.03]
  - - [2048, 8192, 1, 1024, 2048, 2048, 2048, 1024]
    - [9, 335.74]
  - - [2048, 8192, 1, 2048, 2048, 2048, 2048, 2048]
    - [18, 512.06]
  - - [2048, 8192, 1, 4096, 2048, 2048, 2048, 4096]
    - [20, 687.28]
  - - [2048, 8192, 1, 8192, 2048, 2048, 2048, 8192]
    - [22, 797.42]
  - - [4096, 128, 1, 128, 4096, 4096, 4096, 128]
    - [41, 11.15]
  - - [4096, 128, 1, 256, 4096, 4096, 4096, 256]
    - [44, 19.53]
  - - [4096, 128, 1, 512, 4096, 4096, 4096, 512]
    - [44, 32.91]
  - - [4096, 128, 1, 1024, 4096, 4096, 4096, 1024]
    - [44, 48.84]
  - - [4096, 128, 1, 2048, 4096, 4096, 4096, 2048]
    - [44, 66.05]
  - - [4096, 128, 1, 4096, 4096, 4096, 4096, 4096]
    - [46, 79.98]
  - - [4096, 128, 1, 8192, 4096, 4096, 4096, 8192]
    - [44, 88.28]
  - - [4096, 256, 1, 128, 4096, 4096, 4096, 128]
    - [41, 20.23]
  - - [4096, 256, 1, 256, 4096, 4096, 4096, 256]
    - [51, 35.68]
  - - [4096, 256, 1, 512, 4096, 4096, 4096, 512]
    - [51, 60.77]
  - - [4096, 256, 1, 1024, 4096, 4096, 4096, 1024]
    - [46, 92.37]
  - - [4096, 256, 1, 2048, 4096, 4096, 4096, 2048]
    - [53, 127.08]
  - - [4096, 256, 1, 4096, 4096, 4096, 4096, 4096]
    - [46, 152.32]
  - - [4096, 256, 1, 8192, 4096, 4096, 4096, 8192]
    - [46, 169.82]
  - - [4096, 512, 1, 128, 4096, 4096, 4096, 128]
    - [34, 32.07]
  - - [4096, 512, 1, 256, 4096, 4096, 4096, 256]
    - [34, 58.39]
  - - [4096, 512, 1, 512, 4096, 4096, 4096, 512]
    - [37, 101.34]
  - - [4096, 512, 1, 1024, 4096, 4096, 4096, 1024]
    - [35, 160.05]
  - - [4096, 512, 1, 2048, 4096, 4096, 4096, 2048]
    - [38, 221.5]
  - - [4096, 512, 1, 4096, 4096, 4096, 4096, 4096]
    - [37, 275.89]
  - - [4096, 512, 1, 8192, 4096, 4096, 4096, 8192]
    - [38, 317.95]
  - - [4096, 1024, 1, 128, 4096, 4096, 4096, 128]
    - [29, 41.72]
  - - [4096, 1024, 1, 256, 4096, 4096, 4096, 256]
    - [32, 75.71]
  - - [4096, 1024, 1, 512, 4096, 4096, 4096, 512]
    - [32, 132.53]
  - - [4096, 1024, 1, 1024, 4096, 4096, 4096, 1024]
    - [32, 218.89]
  - - [4096, 1024, 1, 2048, 4096, 4096, 4096, 2048]
    - [32, 321.92]
  - - [4096, 1024, 1, 4096, 4096, 4096, 4096, 4096]
    - [32, 420.56]
  - - [4096, 1024, 1, 8192, 4096, 4096, 4096, 8192]
    - [33, 479.26]
  - - [4096, 2048, 1, 128, 4096, 4096, 4096, 128]
    - [48, 52.85]
  - - [4096, 2048, 1, 256, 4096, 4096, 4096, 256]
    - [13, 97.28]
  - - [4096, 2048, 1, 512, 4096, 4096, 4096, 512]
    - [13, 167.86]
  - - [4096, 2048, 1, 1024, 4096, 4096, 4096, 1024]
    - [23, 278.13]
  - - [4096, 2048, 1, 2048, 4096, 4096, 4096, 2048]
    - [26, 417.41]
  - - [4096, 2048, 1, 4096, 4096, 4096, 4096, 4096]
    - [26, 530.54]
  - - [4096, 2048, 1, 8192, 4096, 4096, 4096, 8192]
    - [27, 598.34]
  - - [4096, 4096, 1, 128, 4096, 4096, 4096, 128]
    - [0, 60.23]
  - - [4096, 4096, 1, 256, 4096, 4096, 4096, 256]
    - [6, 113.67]
  - - [4096, 4096, 1, 512, 4096, 4096, 4096, 512]
    - [9, 203.39]
  - - [4096, 4096, 1, 1024, 4096, 4096, 4096, 1024]
    - [11, 339.03]
  - - [4096, 4096, 1, 2048, 4096, 4096, 4096, 2048]
    - [9, 507.36]
  - - [4096, 4096, 1, 4096, 4096, 4096, 4096, 4096]
    - [19, 677.84]
  - - [4096, 4096, 1, 8192, 4096, 4096, 4096, 8192]
    - [22, 806.54]
  - - [4096, 8192, 1, 128, 4096, 4096, 4096, 128]
    - [14, 65.58]
  - - [4096, 8192, 1, 256, 4096, 4096, 4096, 256]
    - [10, 121.71]
  - - [4096, 8192, 1, 512, 4096, 4096, 4096, 512]
    - [8, 218.82]
  - - [4096, 8192, 1, 1024, 4096, 4096, 4096, 1024]
    - [12, 354.91]
  - - [4096, 8192, 1, 2048, 4096, 4096, 4096, 2048]
    - [21, 514.41]
  - - [4096, 8192, 1, 4096, 4096, 4096, 4096, 4096]
    - [19, 696.17]
  - - [4096, 8192, 1, 8192, 4096, 4096, 4096, 8192]
    - [19, 851.91]
  - - [8192, 128, 1, 128, 8192, 8192, 8192, 128]
    - [45, 20.11]
  - - [8192, 128, 1, 256, 8192, 8192, 8192, 256]
    - [44, 35.57]
  - - [8192, 128, 1, 512, 8192, 8192, 8192, 512]
    - [46, 60.39]
  - - [8192, 128, 1, 1024, 8192, 8192, 8192, 1024]
    - [46, 92.42]
  - - [8192, 128, 1, 2048, 8192, 8192, 8192, 2048]
    - [44, 124.88]
  - - [8192, 128, 1, 4096, 8192, 8192, 8192, 4096]
    - [44, 151.7]
  - - [8192, 128, 1, 8192, 8192, 8192, 8192, 8192]
    - [46, 172.0]
  - - [8192, 256, 1, 128, 8192, 8192, 8192, 128]
    - [39, 31.95]
  - - [8192, 256, 1, 256, 8192, 8192, 8192, 256]
    - [34, 57.85]
  - - [8192, 256, 1, 512, 8192, 8192, 8192, 512]
    - [34, 100.85]
  - - [8192, 256, 1, 1024, 8192, 8192, 8192, 1024]
    - [34, 156.95]
  - - [8192, 256, 1, 2048, 8192, 8192, 8192, 2048]
    - [38, 216.21]
  - - [8192, 256, 1, 4096, 8192, 8192, 8192, 4096]
    - [37, 275.47]
  - - [8192, 256, 1, 8192, 8192, 8192, 8192, 8192]
    - [37, 319.24]
  - - [8192, 512, 1, 128, 8192, 8192, 8192, 128]
    - [4, 40.83]
  - - [8192, 512, 1, 256, 8192, 8192, 8192, 256]
    - [4, 73.61]
  - - [8192, 512, 1, 512, 8192, 8192, 8192, 512]
    - [32, 136.46]
  - - [8192, 512, 1, 1024, 8192, 8192, 8192, 1024]
    - [29, 218.28]
  - - [8192, 512, 1, 2048, 8192, 8192, 8192, 2048]
    - [32, 325.35]
  - - [8192, 512, 1, 4096, 8192, 8192, 8192, 4096]
    - [32, 418.86]
  - - [8192, 512, 1, 8192, 8192, 8192, 8192, 8192]
    - [32, 481.74]
  - - [8192, 1024, 1, 128, 8192, 8192, 8192, 128]
    - [16, 53.38]
  - - [8192, 1024, 1, 256, 8192, 8192, 8192, 256]
    - [17, 97.88]
  - - [8192, 1024, 1, 512, 8192, 8192, 8192, 512]
    - [27, 170.39]
  - - [8192, 1024, 1, 1024, 8192, 8192, 8192, 1024]
    - [27, 280.66]
  - - [8192, 1024, 1, 2048, 8192, 8192, 8192, 2048]
    - [25, 422.42]
  - - [8192, 1024, 1, 4096, 8192, 8192, 8192, 4096]
    - [25, 519.57]
  - - [8192, 1024, 1, 8192, 8192, 8192, 8192, 8192]
    - [25, 600.67]
  - - [8192, 2048, 1, 128, 8192, 8192, 8192, 128]
    - [6, 59.57]
  - - [8192, 2048, 1, 256, 8192, 8192, 8192, 256]
    - [7, 112.83]
  - - [8192, 2048, 1, 512, 8192, 8192, 8192, 512]
    - [8, 203.0]
  - - [8192, 2048, 1, 1024, 8192, 8192, 8192, 1024]
    - [8, 342.14]
  - - [8192, 2048, 1, 2048, 8192, 8192, 8192, 2048]
    - [8, 506.28]
  - - [8192, 2048, 1, 4096, 8192, 8192, 8192, 4096]
    - [20, 683.36]
  - - [8192, 2048, 1, 8192, 8192, 8192, 8192, 8192]
    - [19, 812.0]
  - - [8192, 4096, 1, 128, 8192, 8192, 8192, 128]
    - [8, 65.08]
  - - [8192, 4096, 1, 256, 8192, 8192, 8192, 256]
    - [8, 122.58]
  - - [8192, 4096, 1, 512, 8192, 8192, 8192, 512]
    - [5, 220.11]
  - - [8192, 4096, 1, 1024, 8192, 8192, 8192, 1024]
    - [12, 362.97]
  - - [8192, 4096, 1, 2048, 8192, 8192, 8192, 2048]
    - [22, 516.67]
  - - [8192, 4096, 1, 4096, 8192, 8192, 8192, 4096]
    - [22, 686.47]
  - - [8192, 4096, 1, 8192, 8192, 8192, 8192, 8192]
    - [22, 859.1]
  - - [8192, 8192, 1, 128, 8192, 8192, 8192, 128]
    - [1, 71.47]
  - - [8192, 8192, 1, 256, 8192, 8192, 8192, 256]
    - [8, 134.82]
  - - [8192, 8192, 1, 512, 8192, 8192, 8192, 512]
    - [8, 237.54]
  - - [8192, 8192, 1, 1024, 8192, 8192, 8192, 1024]
    - [47, 384.38]
  - - [8192, 8192, 1, 2048, 8192, 8192, 8192, 2048]
    - [18, 551.51]
  - - [8192, 8192, 1, 4096, 8192, 8192, 8192, 4096]
    - [19, 749.85]
  - - [8192, 8192, 1, 8192, 8192, 8192, 8192, 8192]
    - [22, 938.24]
- null
- null
- DeviceEfficiency
- GridBased
