projects/hipblaslt/library/src/amd_detail/rocblaslt/src/Tensile/Logic/asm_full/gfx950/gfx950/GridBased/gfx950_Cijk_Ailk_Bljk_I8_BH_UserArgs.yaml
- {MinimumRequiredVersion: 5.0.0}
- gfx950
- gfx950
- [Device 75a0]
    SolutionIndex: 0
    SolutionNameMin: Cijk_Ailk_Bljk_I8_BH_UserArgs_MT256x256x64_MI16x16x1_SN_LDSB0_AFC0_AFEM1_AFEM1_ASEM1_CLR0_CADS0_DTVA0_DTVB0_EPS0_FDSI0_GRPM1_GRVWA4_GRVWB16_GSU0_GSUAMB_GSUC0_GSUWGMRR0_GLS0_ISA950_IU1_K1_LBSPPA4096_LBSPPB256_LBSPPM0_LPA0_LPB32_LPM0_LRVW16_LWPMn1_MIAV0_MIWT8_8_MO40_NTn1_NTA0_NTB0_NTC0_NTD0_NTM0_NEPBS0_NLCA1_NLCB1_ONLL1_PGR2_PLR0_PKA1_SIA3_SS1_SU0_SUM1_SUS64_SPO0_SRVW0_SSO0_SVW8_SK3_SKXCCM8_TLDS1_ULSGRO0_USL1_UIOFGRO0_USFGRO0_VSn1_VWA8_VWB4_WSGRA0_WSGRB0_WS64_WG32_8_1_WGM6_WGMXCC1_WGMXCCGn1
    SolutionIndex: 1
    SolutionNameMin: Cijk_Ailk_Bljk_I8_BH_UserArgs_MT256x256x64_MI16x16x1_SN_LDSB0_AFC0_AFEM1_AFEM1_ASEM1_CLR0_CADS0_DTVA0_DTVB0_EPS0_FDSI0_GRPM1_GRVWA4_GRVWB16_GSU0_GSUAMB_GSUC0_GSUWGMRR0_GLS0_ISA950_IU1_K1_LBSPPA4096_LBSPPB512_LBSPPM0_LPA0_LPB32_LPM0_LRVW16_LWPMn1_MIAV0_MIWT8_8_MO40_NTn1_NTA0_NTB0_NTC0_NTD0_NTM0_NEPBS0_NLCA1_NLCB1_ONLL1_PGR2_PLR0_PKA1_SIA3_SS1_SU0_SUM1_SUS64_SPO0_SRVW0_SSO0_SVW8_SK3_SKXCCM8_TLDS1_ULSGRO0_USL1_UIOFGRO0_USFGRO0_VSn1_VWA8_VWB8_WSGRA0_WSGRB0_WS64_WG32_8_1_WGM6_WGMXCC1_WGMXCCGn1
    SolutionIndex: 2
    SolutionNameMin: Cijk_Ailk_Bljk_I8_BH_UserArgs_MT128x256x64_MI16x16x1_SN_LDSB1_AFC0_AFEM1_AFEM1_ASEM1_CLR0_CADS0_DTVA0_DTVB0_EPS0_FDSI0_GRPM1_GRVWA8_GRVWB16_GSU0_GSUAMB_GSUC0_GSUWGMRR0_GLS0_ISA950_IU1_K1_LBSPPA2048_LBSPPB512_LBSPPM0_LPA64_LPB32_LPM0_LRVW16_LWPMn1_MIAV0_MIWT4_8_MO40_NTn1_NTA0_NTB0_NTC0_NTD0_NTM0_NEPBS0_NLCA1_NLCB1_ONLL1_PGR2_PLR0_PKA1_SIA3_SS1_SU0_SUM1_SUS64_SPO0_SRVW0_SSO0_SVW4_SK3_SKXCCM8_TLDS1_ULSGRO0_USL1_UIOFGRO0_USFGRO0_VSn1_VWA4_VWB8_WSGRA0_WSGRB0_WS64_WG32_8_1_WGM6_WGMXCC1_WGMXCCGn1
    SolutionIndex: 3
    SolutionNameMin: Cijk_Ailk_Bljk_I8_BH_UserArgs_MT128x256x64_MI16x16x1_SN_LDSB1_AFC0_AFEM1_AFEM1_ASEM1_CLR0_CADS0_DTVA0_DTVB0_EPS0_FDSI0_GRPM1_GRVWA16_GRVWB16_GSU0_GSUAMB_GSUC0_GSUWGMRR0_GLS0_ISA950_IU1_K1_LBSPPA2048_LBSPPB128_LBSPPM0_LPA64_LPB32_LPM0_LRVW16_LWPMn1_MIAV0_MIWT4_8_MO40_NTn1_NTA0_NTB0_NTC0_NTD0_NTM0_NEPBS0_NLCA1_NLCB1_ONLL1_PGR2_PLR0_PKA1_SIA3_SS1_SU0_SUM1_SUS64_SPO0_SRVW0_SSO0_SVW4_SK3_SKXCCM8_TLDS1_ULSGRO0_USL1_UIOFGRO0_USFGRO0_VSn1_VWA4_VWB2_WSGRA0_WSGRB0_WS64_WG32_8_1_WGM6_WGMXCC1_WGMXCCGn1
    SolutionIndex: 4
    SolutionNameMin: Cijk_Ailk_Bljk_I8_BH_UserArgs_MT128x256x64_MI16x16x1_SN_LDSB1_AFC0_AFEM1_AFEM1_ASEM1_CLR0_CADS0_DTVA0_DTVB0_EPS0_FDSI0_GRPM1_GRVWA16_GRVWB16_GSU0_GSUAMB_GSUC0_GSUWGMRR0_GLS0_ISA950_IU1_K1_LBSPPA2048_LBSPPB512_LBSPPM0_LPA64_LPB32_LPM0_LRVW16_LWPMn1_MIAV0_MIWT4_8_MO40_NTn1_NTA0_NTB0_NTC0_NTD0_NTM0_NEPBS0_NLCA1_NLCB1_ONLL1_PGR2_PLR0_PKA1_SIA3_SS1_SU0_SUM1_SUS64_SPO0_SRVW0_SSO0_SVW4_SK3_SKXCCM8_TLDS1_ULSGRO0_USL1_UIOFGRO0_USFGRO0_VSn1_VWA4_VWB8_WSGRA0_WSGRB0_WS64_WG32_8_1_WGM6_WGMXCC1_WGMXCCGn1
    SolutionIndex: 5
    SolutionNameMin: Cijk_Ailk_Bljk_I8_BH_UserArgs_MT256x128x64_MI16x16x1_SN_LDSB1_AFC0_AFEM1_AFEM1_ASEM1_CLR0_CADS0_DTVA0_DTVB0_EPS0_FDSI0_GRPM1_GRVWA4_GRVWB16_GSU0_GSUAMB_GSUC0_GSUWGMRR0_GLS0_ISA950_IU1_K1_LBSPPA4096_LBSPPB128_LBSPPM0_LPA0_LPB32_LPM0_LRVW16_LWPMn1_MIAV0_MIWT8_4_MO40_NTn1_NTA0_NTB0_NTC0_NTD0_NTM0_NEPBS0_NLCA1_NLCB1_ONLL1_PGR2_PLR0_PKA1_SIA3_SS1_SU0_SUM1_SUS64_SPO0_SRVW0_SSO0_SVW8_SK3_SKXCCM8_TLDS1_ULSGRO0_USL1_UIOFGRO0_USFGRO0_VSn1_VWA8_VWB2_WSGRA0_WSGRB0_WS64_WG32_8_1_WGM6_WGMXCC1_WGMXCCGn1
    SolutionIndex: 6
    SolutionNameMin: Cijk_Ailk_Bljk_I8_BH_UserArgs_MT256x128x64_MI16x16x1_SN_LDSB1_AFC0_AFEM1_AFEM1_ASEM1_CLR0_CADS0_DTVA0_DTVB0_EPS0_FDSI0_GRPM1_GRVWA4_GRVWB16_GSU0_GSUAMB_GSUC0_GSUWGMRR0_GLS0_ISA950_IU1_K1_LBSPPA4096_LBSPPB256_LBSPPM0_LPA0_LPB32_LPM0_LRVW16_LWPMn1_MIAV0_MIWT8_4_MO40_NTn1_NTA0_NTB0_NTC0_NTD0_NTM0_NEPBS0_NLCA1_NLCB1_ONLL1_PGR2_PLR0_PKA1_SIA3_SS1_SU0_SUM1_SUS64_SPO0_SRVW0_SSO0_SVW8_SK3_SKXCCM8_TLDS1_ULSGRO0_USL1_UIOFGRO0_USFGRO0_VSn1_VWA8_VWB4_WSGRA0_WSGRB0_WS64_WG32_8_1_WGM6_WGMXCC1_WGMXCCGn1
    SolutionIndex: 7
    SolutionNameMin: Cijk_Ailk_Bljk_I8_BH_UserArgs_MT128x128x64_MI16x16x1_SN_LDSB1_AFC0_AFEM1_AFEM1_ASEM1_CLR0_CADS0_DTVA0_DTVB0_EPS0_FDSI0_GRPM1_GRVWA4_GRVWB16_GSU0_GSUAMB_GSUC0_GSUWGMRR0_GLS0_ISA950_IU1_K1_LBSPPA2048_LBSPPB256_LBSPPM0_LPA64_LPB32_LPM0_LRVW16_LWPMn1_MIAV0_MIWT4_4_MO40_NTn1_NTA0_NTB0_NTC0_NTD0_NTM0_NEPBS0_NLCA1_NLCB1_ONLL1_PGR2_PLR0_PKA1_SIA3_SS1_SU0_SUM1_SUS64_SPO0_SRVW0_SSO0_SVW4_SK3_SKXCCM8_TLDS1_ULSGRO0_USL1_UIOFGRO0_USFGRO0_VSn1_VWA4_VWB4_WSGRA0_WSGRB0_WS64_WG32_8_1_WGM6_WGMXCC1_WGMXCCGn1
    SolutionIndex: 8
    SolutionNameMin: Cijk_Ailk_Bljk_I8_BH_UserArgs_MT256x256x64_MI32x32x1_SN_LDSB0_AFC0_AFEM1_AFEM1_ASEM1_CLR1_CADS0_DTVA0_DTVB0_EPS0_FDSI0_GRPM1_GRVWA4_GRVWB16_GSU0_GSUAMB_GSUC0_GSUWGMRR0_GLS0_ISA950_IU1_K1_LBSPPA0_LBSPPB128_LBSPPM0_LPA0_LPB16_LPM0_LRVW16_LWPMn1_MIAV0_MIWT4_4_MO40_NTn1_NTA0_NTB0_NTC0_NTD0_NTM0_NEPBS0_NLCA1_NLCB1_ONLL1_PGR2_PLR1_PKA1_SIA3_SS1_SU0_SUM1_SUS64_SPO0_SRVW0_SSO0_SVW4_SK3_SKXCCM8_TLDS1_ULSGRO0_USL1_UIOFGRO0_USFGRO0_VSn1_VWA4_VWB2_WSGRA0_WSGRB0_WS64_WG64_4_1_WGM6_WGMXCC1_WGMXCCGn1
    SolutionIndex: 9
    SolutionNameMin: Cijk_Ailk_Bljk_I8_BH_UserArgs_MT256x256x64_MI32x32x1_SN_LDSB0_AFC0_AFEM1_AFEM1_ASEM1_CLR1_CADS0_DTVA0_DTVB0_EPS0_FDSI0_GRPM1_GRVWA16_GRVWB16_GSU0_GSUAMB_GSUC0_GSUWGMRR0_GLS0_ISA950_IU1_K1_LBSPPA0_LBSPPB128_LBSPPM0_LPA0_LPB16_LPM0_LRVW16_LWPMn1_MIAV0_MIWT4_4_MO40_NTn1_NTA0_NTB0_NTC0_NTD0_NTM0_NEPBS0_NLCA1_NLCB1_ONLL1_PGR2_PLR1_PKA1_SIA3_SS1_SU0_SUM1_SUS64_SPO0_SRVW0_SSO0_SVW4_SK3_SKXCCM8_TLDS1_ULSGRO0_USL1_UIOFGRO0_USFGRO0_VSn1_VWA4_VWB2_WSGRA0_WSGRB0_WS64_WG64_4_1_WGM6_WGMXCC1_WGMXCCGn1
    SolutionIndex: 10
    SolutionNameMin: Cijk_Ailk_Bljk_I8_BH_UserArgs_MT256x256x64_MI32x32x1_SN_LDSB0_AFC0_AFEM1_AFEM1_ASEM1_CLR1_CADS0_DTVA0_DTVB0_EPS0_FDSI0_GRPM1_GRVWA16_GRVWB16_GSU0_GSUAMB_GSUC0_GSUWGMRR0_GLS0_ISA950_IU1_K1_LBSPPA0_LBSPPB256_LBSPPM0_LPA0_LPB16_LPM0_LRVW16_LWPMn1_MIAV0_MIWT4_4_MO40_NTn1_NTA0_NTB0_NTC0_NTD0_NTM0_NEPBS0_NLCA1_NLCB1_ONLL1_PGR2_PLR1_PKA1_SIA3_SS1_SU0_SUM1_SUS64_SPO0_SRVW0_SSO0_SVW4_SK3_SKXCCM8_TLDS1_ULSGRO0_USL1_UIOFGRO0_USFGRO0_VSn1_VWA4_VWB4_WSGRA0_WSGRB0_WS64_WG64_4_1_WGM6_WGMXCC1_WGMXCCGn1
    SolutionIndex: 11
    SolutionNameMin: Cijk_Ailk_Bljk_I8_BH_UserArgs_MT256x256x128_MI16x16x1_SN_LDSB1_AFC0_AFEM1_AFEM1_ASEM1_CLR1_CADS0_DTVA0_DTVB0_EPS0_FDSI0_GRPM1_GRVWA16_GRVWB16_GSU0_GSUAMB_GSUC0_GSUWGMRR0_GLS0_ISA950_IU1_K1_LBSPPA4096_LBSPPB256_LBSPPM0_LPA0_LPB32_LPM0_LRVW16_LWPMn1_MIAV0_MIWT8_8_MO40_NTn1_NTA0_NTB0_NTC0_NTD0_NTM0_NEPBS0_NLCA1_NLCB1_ONLL1_PGR2_PLR1_PKA1_SIA3_SS1_SU0_SUM1_SUS128_SPO0_SRVW0_SSO0_SVW8_SK3_SKXCCM8_TLDS1_ULSGRO0_USL1_UIOFGRO0_USFGRO0_VSn1_VWA8_VWB2_WSGRA0_WSGRB0_WS64_WG32_8_1_WGM6_WGMXCC1_WGMXCCGn1
    SolutionIndex: 12
    SolutionNameMin: Cijk_Ailk_Bljk_I8_BH_UserArgs_MT256x256x128_MI16x16x1_SN_LDSB1_AFC0_AFEM1_AFEM1_ASEM1_CLR1_CADS0_DTVA0_DTVB0_EPS0_FDSI0_GRPM1_GRVWA16_GRVWB16_GSU0_GSUAMB_GSUC0_GSUWGMRR0_GLS0_ISA950_IU1_K1_LBSPPA4096_LBSPPB512_LBSPPM0_LPA0_LPB32_LPM0_LRVW16_LWPMn1_MIAV0_MIWT8_8_MO40_NTn1_NTA0_NTB0_NTC0_NTD0_NTM0_NEPBS0_NLCA1_NLCB1_ONLL1_PGR2_PLR1_PKA1_SIA3_SS1_SU0_SUM1_SUS128_SPO0_SRVW0_SSO0_SVW8_SK3_SKXCCM8_TLDS1_ULSGRO0_USL1_UIOFGRO0_USFGRO0_VSn1_VWA8_VWB4_WSGRA0_WSGRB0_WS64_WG32_8_1_WGM6_WGMXCC1_WGMXCCGn1
    SolutionIndex: 13
    SolutionNameMin: Cijk_Ailk_Bljk_I8_BH_UserArgs_MT256x256x128_MI16x16x1_SN_LDSB1_AFC0_AFEM1_AFEM1_ASEM1_CLR1_CADS0_DTVA0_DTVB0_EPS0_FDSI0_GRPM1_GRVWA16_GRVWB16_GSU0_GSUAMB_GSUC0_GSUWGMRR0_GLS0_ISA950_IU1_K1_LBSPPA4096_LBSPPB1024_LBSPPM0_LPA0_LPB32_LPM0_LRVW16_LWPMn1_MIAV0_MIWT8_8_MO40_NTn1_NTA0_NTB0_NTC0_NTD0_NTM0_NEPBS0_NLCA1_NLCB1_ONLL1_PGR2_PLR1_PKA1_SIA3_SS1_SU0_SUM1_SUS128_SPO0_SRVW0_SSO0_SVW8_SK3_SKXCCM8_TLDS1_ULSGRO0_USL1_UIOFGRO0_USFGRO0_VSn1_VWA8_VWB8_WSGRA0_WSGRB0_WS64_WG32_8_1_WGM6_WGMXCC1_WGMXCCGn1
    SolutionIndex: 14
    SolutionNameMin: Cijk_Ailk_Bljk_I8_BH_UserArgs_MT128x256x128_MI16x16x1_SN_LDSB1_AFC0_AFEM1_AFEM1_ASEM1_CLR1_CADS0_DTVA0_DTVB0_EPS0_FDSI0_GRPM1_GRVWA4_GRVWB16_GSU0_GSUAMB_GSUC0_GSUWGMRR0_GLS0_ISA950_IU1_K1_LBSPPA2048_LBSPPB256_LBSPPM0_LPA64_LPB32_LPM0_LRVW16_LWPMn1_MIAV0_MIWT4_8_MO40_NTn1_NTA0_NTB0_NTC0_NTD0_NTM0_NEPBS0_NLCA1_NLCB1_ONLL1_PGR2_PLR1_PKA1_SIA3_SS1_SU0_SUM1_SUS128_SPO0_SRVW0_SSO0_SVW4_SK3_SKXCCM8_TLDS1_ULSGRO0_USL1_UIOFGRO0_USFGRO0_VSn1_VWA4_VWB2_WSGRA0_WSGRB0_WS64_WG32_8_1_WGM6_WGMXCC1_WGMXCCGn1
    SolutionIndex: 15
    SolutionNameMin: Cijk_Ailk_Bljk_I8_BH_UserArgs_MT128x256x128_MI16x16x1_SN_LDSB1_AFC0_AFEM1_AFEM1_ASEM1_CLR1_CADS0_DTVA0_DTVB0_EPS0_FDSI0_GRPM1_GRVWA16_GRVWB16_GSU0_GSUAMB_GSUC0_GSUWGMRR0_GLS0_ISA950_IU1_K1_LBSPPA2048_LBSPPB256_LBSPPM0_LPA64_LPB32_LPM0_LRVW16_LWPMn1_MIAV0_MIWT4_8_MO40_NTn1_NTA0_NTB0_NTC0_NTD0_NTM0_NEPBS0_NLCA1_NLCB1_ONLL1_PGR2_PLR1_PKA1_SIA3_SS1_SU0_SUM1_SUS128_SPO0_SRVW0_SSO0_SVW4_SK3_SKXCCM8_TLDS1_ULSGRO0_USL1_UIOFGRO0_USFGRO0_VSn1_VWA4_VWB2_WSGRA0_WSGRB0_WS64_WG32_8_1_WGM6_WGMXCC1_WGMXCCGn1
    SolutionIndex: 16
    SolutionNameMin: Cijk_Ailk_Bljk_I8_BH_UserArgs_MT128x256x128_MI16x16x1_SN_LDSB1_AFC0_AFEM1_AFEM1_ASEM1_CLR1_CADS0_DTVA0_DTVB0_EPS0_FDSI0_GRPM1_GRVWA16_GRVWB16_GSU0_GSUAMB_GSUC0_GSUWGMRR0_GLS0_ISA950_IU1_K1_LBSPPA2048_LBSPPB512_LBSPPM0_LPA64_LPB32_LPM0_LRVW16_LWPMn1_MIAV0_MIWT4_8_MO40_NTn1_NTA0_NTB0_NTC0_NTD0_NTM0_NEPBS0_NLCA1_NLCB1_ONLL1_PGR2_PLR1_PKA1_SIA3_SS1_SU0_SUM1_SUS128_SPO0_SRVW0_SSO0_SVW4_SK3_SKXCCM8_TLDS1_ULSGRO0_USL1_UIOFGRO0_USFGRO0_VSn1_VWA4_VWB4_WSGRA0_WSGRB0_WS64_WG32_8_1_WGM6_WGMXCC1_WGMXCCGn1
    SolutionIndex: 17
    SolutionNameMin: Cijk_Ailk_Bljk_I8_BH_UserArgs_MT128x256x128_MI16x16x1_SN_LDSB1_AFC0_AFEM1_AFEM1_ASEM1_CLR1_CADS0_DTVA0_DTVB0_EPS0_FDSI0_GRPM1_GRVWA16_GRVWB16_GSU0_GSUAMB_GSUC0_GSUWGMRR0_GLS0_ISA950_IU1_K1_LBSPPA2048_LBSPPB1024_LBSPPM0_LPA64_LPB32_LPM0_LRVW16_LWPMn1_MIAV0_MIWT4_8_MO40_NTn1_NTA0_NTB0_NTC0_NTD0_NTM0_NEPBS0_NLCA1_NLCB1_ONLL1_PGR2_PLR1_PKA1_SIA3_SS1_SU0_SUM1_SUS128_SPO0_SRVW0_SSO0_SVW4_SK3_SKXCCM8_TLDS1_ULSGRO0_USL1_UIOFGRO0_USFGRO0_VSn1_VWA4_VWB8_WSGRA0_WSGRB0_WS64_WG32_8_1_WGM6_WGMXCC1_WGMXCCGn1
    SolutionIndex: 18
    SolutionNameMin: Cijk_Ailk_Bljk_I8_BH_UserArgs_MT256x128x128_MI16x16x1_SN_LDSB1_AFC0_AFEM1_AFEM1_ASEM1_CLR1_CADS0_DTVA0_DTVB0_EPS0_FDSI0_GRPM1_GRVWA16_GRVWB16_GSU0_GSUAMB_GSUC0_GSUWGMRR0_GLS0_ISA950_IU1_K1_LBSPPA4096_LBSPPB256_LBSPPM0_LPA0_LPB32_LPM0_LRVW16_LWPMn1_MIAV0_MIWT8_4_MO40_NTn1_NTA0_NTB0_NTC0_NTD0_NTM0_NEPBS0_NLCA1_NLCB1_ONLL1_PGR2_PLR1_PKA1_SIA3_SS1_SU0_SUM1_SUS128_SPO0_SRVW0_SSO0_SVW8_SK3_SKXCCM8_TLDS1_ULSGRO0_USL1_UIOFGRO0_USFGRO0_VSn1_VWA8_VWB2_WSGRA0_WSGRB0_WS64_WG32_8_1_WGM6_WGMXCC1_WGMXCCGn1
    SolutionIndex: 19
    SolutionNameMin: Cijk_Ailk_Bljk_I8_BH_UserArgs_MT256x128x128_MI16x16x1_SN_LDSB1_AFC0_AFEM1_AFEM1_ASEM1_CLR1_CADS0_DTVA0_DTVB0_EPS0_FDSI0_GRPM1_GRVWA16_GRVWB16_GSU0_GSUAMB_GSUC0_GSUWGMRR0_GLS0_ISA950_IU1_K1_LBSPPA4096_LBSPPB512_LBSPPM0_LPA0_LPB32_LPM0_LRVW16_LWPMn1_MIAV0_MIWT8_4_MO40_NTn1_NTA0_NTB0_NTC0_NTD0_NTM0_NEPBS0_NLCA1_NLCB1_ONLL1_PGR2_PLR1_PKA1_SIA3_SS1_SU0_SUM1_SUS128_SPO0_SRVW0_SSO0_SVW8_SK3_SKXCCM8_TLDS1_ULSGRO0_USL1_UIOFGRO0_USFGRO0_VSn1_VWA8_VWB4_WSGRA0_WSGRB0_WS64_WG32_8_1_WGM6_WGMXCC1_WGMXCCGn1
    SolutionIndex: 20
    SolutionNameMin: Cijk_Ailk_Bljk_I8_BH_UserArgs_MT128x128x128_MI16x16x1_SN_LDSB1_AFC0_AFEM1_AFEM1_ASEM1_CLR1_CADS0_DTVA0_DTVB0_EPS0_FDSI0_GRPM1_GRVWA4_GRVWB16_GSU0_GSUAMB_GSUC0_GSUWGMRR0_GLS0_ISA950_IU1_K1_LBSPPA2048_LBSPPB256_LBSPPM0_LPA32_LPB32_LPM0_LRVW16_LWPMn1_MIAV0_MIWT4_4_MO40_NTn1_NTA0_NTB0_NTC0_NTD0_NTM0_NEPBS0_NLCA1_NLCB1_ONLL1_PGR2_PLR1_PKA1_SIA3_SS1_SU0_SUM1_SUS128_SPO0_SRVW0_SSO0_SVW2_SK3_SKXCCM8_TLDS1_ULSGRO0_USL1_UIOFGRO0_USFGRO0_VSn1_VWA2_VWB2_WSGRA0_WSGRB0_WS64_WG32_8_1_WGM6_WGMXCC1_WGMXCCGn1
    SolutionIndex: 21
    SolutionNameMin: Cijk_Ailk_Bljk_I8_BH_UserArgs_MT128x128x128_MI16x16x1_SN_LDSB1_AFC0_AFEM1_AFEM1_ASEM1_CLR1_CADS0_DTVA0_DTVB0_EPS0_FDSI0_GRPM1_GRVWA4_GRVWB16_GSU0_GSUAMB_GSUC0_GSUWGMRR0_GLS0_ISA950_IU1_K1_LBSPPA2048_LBSPPB256_LBSPPM0_LPA64_LPB32_LPM0_LRVW16_LWPMn1_MIAV0_MIWT4_4_MO40_NTn1_NTA0_NTB0_NTC0_NTD0_NTM0_NEPBS0_NLCA1_NLCB1_ONLL1_PGR2_PLR1_PKA1_SIA3_SS1_SU0_SUM1_SUS128_SPO0_SRVW0_SSO0_SVW4_SK3_SKXCCM8_TLDS1_ULSGRO0_USL1_UIOFGRO0_USFGRO0_VSn1_VWA4_VWB2_WSGRA0_WSGRB0_WS64_WG32_8_1_WGM6_WGMXCC1_WGMXCCGn1
    SolutionIndex: 22
    SolutionNameMin: Cijk_Ailk_Bljk_I8_BH_UserArgs_MT128x128x128_MI16x16x1_SN_LDSB1_AFC0_AFEM1_AFEM1_ASEM1_CLR1_CADS0_DTVA0_DTVB0_EPS0_FDSI0_GRPM1_GRVWA4_GRVWB16_GSU0_GSUAMB_GSUC0_GSUWGMRR0_GLS0_ISA950_IU1_K1_LBSPPA2048_LBSPPB512_LBSPPM0_LPA32_LPB32_LPM0_LRVW16_LWPMn1_MIAV0_MIWT4_4_MO40_NTn1_NTA0_NTB0_NTC0_NTD0_NTM0_NEPBS0_NLCA1_NLCB1_ONLL1_PGR2_PLR1_PKA1_SIA3_SS1_SU0_SUM1_SUS128_SPO0_SRVW0_SSO0_SVW2_SK3_SKXCCM8_TLDS1_ULSGRO0_USL1_UIOFGRO0_USFGRO0_VSn1_VWA2_VWB4_WSGRA0_WSGRB0_WS64_WG32_8_1_WGM6_WGMXCC1_WGMXCCGn1
    SolutionIndex: 23
    SolutionNameMin: Cijk_Ailk_Bljk_I8_BH_UserArgs_MT128x128x128_MI16x16x1_SN_LDSB1_AFC0_AFEM1_AFEM1_ASEM1_CLR1_CADS0_DTVA0_DTVB0_EPS0_FDSI0_GRPM1_GRVWA4_GRVWB16_GSU0_GSUAMB_GSUC0_GSUWGMRR0_GLS0_ISA950_IU1_K1_LBSPPA2048_LBSPPB512_LBSPPM0_LPA64_LPB32_LPM0_LRVW16_LWPMn1_MIAV0_MIWT4_4_MO40_NTn1_NTA0_NTB0_NTC0_NTD0_NTM0_NEPBS0_NLCA1_NLCB1_ONLL1_PGR2_PLR1_PKA1_SIA3_SS1_SU0_SUM1_SUS128_SPO0_SRVW0_SSO0_SVW4_SK3_SKXCCM8_TLDS1_ULSGRO0_USL1_UIOFGRO0_USFGRO0_VSn1_VWA4_VWB4_WSGRA0_WSGRB0_WS64_WG32_8_1_WGM6_WGMXCC1_WGMXCCGn1
    SolutionIndex: 24
    SolutionNameMin: Cijk_Ailk_Bljk_I8_BH_UserArgs_MT128x128x128_MI16x16x1_SN_LDSB1_AFC0_AFEM1_AFEM1_ASEM1_CLR1_CADS0_DTVA0_DTVB0_EPS0_FDSI0_GRPM1_GRVWA16_GRVWB16_GSU0_GSUAMB_GSUC0_GSUWGMRR0_GLS0_ISA950_IU1_K1_LBSPPA2048_LBSPPB256_LBSPPM0_LPA64_LPB32_LPM0_LRVW16_LWPMn1_MIAV0_MIWT4_4_MO40_NTn1_NTA0_NTB0_NTC0_NTD0_NTM0_NEPBS0_NLCA1_NLCB1_ONLL1_PGR2_PLR1_PKA1_SIA3_SS1_SU0_SUM1_SUS128_SPO0_SRVW0_SSO0_SVW4_SK3_SKXCCM8_TLDS1_ULSGRO0_USL1_UIOFGRO0_USFGRO0_VSn1_VWA4_VWB2_WSGRA0_WSGRB0_WS64_WG32_8_1_WGM6_WGMXCC1_WGMXCCGn1
    SolutionIndex: 25
    SolutionNameMin: Cijk_Ailk_Bljk_I8_BH_UserArgs_MT128x128x128_MI16x16x1_SN_LDSB1_AFC0_AFEM1_AFEM1_ASEM1_CLR1_CADS0_DTVA0_DTVB0_EPS0_FDSI0_GRPM1_GRVWA16_GRVWB16_GSU0_GSUAMB_GSUC0_GSUWGMRR0_GLS0_ISA950_IU1_K1_LBSPPA2048_LBSPPB512_LBSPPM0_LPA64_LPB32_LPM0_LRVW16_LWPMn1_MIAV0_MIWT4_4_MO40_NTn1_NTA0_NTB0_NTC0_NTD0_NTM0_NEPBS0_NLCA1_NLCB1_ONLL1_PGR2_PLR1_PKA1_SIA3_SS1_SU0_SUM1_SUS128_SPO0_SRVW0_SSO0_SVW4_SK3_SKXCCM8_TLDS1_ULSGRO0_USL1_UIOFGRO0_USFGRO0_VSn1_VWA4_VWB4_WSGRA0_WSGRB0_WS64_WG32_8_1_WGM6_WGMXCC1_WGMXCCGn1
    SolutionIndex: 26
    SolutionNameMin: Cijk_Ailk_Bljk_I8_BH_UserArgs_MT64x128x128_MI16x16x1_SN_LDSB1_AFC0_AFEM1_AFEM1_ASEM1_CLR1_CADS0_DTVA0_DTVB0_EPS0_FDSI0_GRPM1_GRVWA4_GRVWB16_GSU0_GSUAMB_GSUC0_GSUWGMRR0_GLS0_ISA950_IU1_K1_LBSPPA1024_LBSPPB256_LBSPPM0_LPA32_LPB32_LPM0_LRVW16_LWPMn1_MIAV0_MIWT2_4_MO40_NTn1_NTA0_NTB0_NTC0_NTD0_NTM0_NEPBS0_NLCA1_NLCB1_ONLL1_PGR2_PLR1_PKA1_SIA3_SS1_SU0_SUM1_SUS128_SPO0_SRVW0_SSO0_SVW2_SK3_SKXCCM8_TLDS1_ULSGRO0_USL1_UIOFGRO0_USFGRO0_VSn1_VWA2_VWB2_WSGRA0_WSGRB0_WS64_WG32_8_1_WGM6_WGMXCC1_WGMXCCGn1
    SolutionIndex: 27
    SolutionNameMin: Cijk_Ailk_Bljk_I8_BH_UserArgs_MT64x128x128_MI16x16x1_SN_LDSB1_AFC0_AFEM1_AFEM1_ASEM1_CLR1_CADS0_DTVA0_DTVB0_EPS0_FDSI0_GRPM1_GRVWA4_GRVWB16_GSU0_GSUAMB_GSUC0_GSUWGMRR0_GLS0_ISA950_IU1_K1_LBSPPA1024_LBSPPB512_LBSPPM0_LPA32_LPB32_LPM0_LRVW16_LWPMn1_MIAV0_MIWT2_4_MO40_NTn1_NTA0_NTB0_NTC0_NTD0_NTM0_NEPBS0_NLCA1_NLCB1_ONLL1_PGR2_PLR1_PKA1_SIA3_SS1_SU0_SUM1_SUS128_SPO0_SRVW0_SSO0_SVW2_SK3_SKXCCM8_TLDS1_ULSGRO0_USL1_UIOFGRO0_USFGRO0_VSn1_VWA2_VWB4_WSGRA0_WSGRB0_WS64_WG32_8_1_WGM6_WGMXCC1_WGMXCCGn1
    SolutionIndex: 28
    SolutionNameMin: Cijk_Ailk_Bljk_I8_BH_UserArgs_MT64x128x128_MI16x16x1_SN_LDSB1_AFC0_AFEM1_AFEM1_ASEM1_CLR1_CADS0_DTVA0_DTVB0_EPS0_FDSI0_GRPM1_GRVWA16_GRVWB16_GSU0_GSUAMB_GSUC0_GSUWGMRR0_GLS0_ISA950_IU1_K1_LBSPPA1024_LBSPPB256_LBSPPM0_LPA32_LPB32_LPM0_LRVW16_LWPMn1_MIAV0_MIWT2_4_MO40_NTn1_NTA0_NTB0_NTC0_NTD0_NTM0_NEPBS0_NLCA1_NLCB1_ONLL1_PGR2_PLR1_PKA1_SIA3_SS1_SU0_SUM1_SUS128_SPO0_SRVW0_SSO0_SVW2_SK3_SKXCCM8_TLDS1_ULSGRO0_USL1_UIOFGRO0_USFGRO0_VSn1_VWA2_VWB2_WSGRA0_WSGRB0_WS64_WG32_8_1_WGM6_WGMXCC1_WGMXCCGn1
    SolutionIndex: 29
    SolutionNameMin: Cijk_Ailk_Bljk_I8_BH_UserArgs_MT64x128x128_MI16x16x1_SN_LDSB1_AFC0_AFEM1_AFEM1_ASEM1_CLR1_CADS0_DTVA0_DTVB0_EPS0_FDSI0_GRPM1_GRVWA16_GRVWB16_GSU0_GSUAMB_GSUC0_GSUWGMRR0_GLS0_ISA950_IU1_K1_LBSPPA1024_LBSPPB512_LBSPPM0_LPA32_LPB32_LPM0_LRVW16_LWPMn1_MIAV0_MIWT2_4_MO40_NTn1_NTA0_NTB0_NTC0_NTD0_NTM0_NEPBS0_NLCA1_NLCB1_ONLL1_PGR2_PLR1_PKA1_SIA3_SS1_SU0_SUM1_SUS128_SPO0_SRVW0_SSO0_SVW2_SK3_SKXCCM8_TLDS1_ULSGRO0_USL1_UIOFGRO0_USFGRO0_VSn1_VWA2_VWB4_WSGRA0_WSGRB0_WS64_WG32_8_1_WGM6_WGMXCC1_WGMXCCGn1
    SolutionIndex: 30
    SolutionNameMin: Cijk_Ailk_Bljk_I8_BH_UserArgs_MT128x64x128_MI16x16x1_SN_LDSB1_AFC0_AFEM1_AFEM1_ASEM1_CLR1_CADS0_DTVA0_DTVB0_EPS0_FDSI0_GRPM1_GRVWA4_GRVWB4_GSU0_GSUAMB_GSUC0_GSUWGMRR0_GLS0_ISA950_IU1_K1_LBSPPA2048_LBSPPB256_LBSPPM0_LPA64_LPB32_LPM0_LRVW16_LWPMn1_MIAV0_MIWT4_2_MO40_NTn1_NTA0_NTB0_NTC0_NTD0_NTM0_NEPBS0_NLCA1_NLCB1_ONLL1_PGR2_PLR1_PKA1_SIA3_SS1_SU0_SUM1_SUS128_SPO0_SRVW0_SSO0_SVW4_SK3_SKXCCM8_TLDS1_ULSGRO0_USL1_UIOFGRO0_USFGRO0_VSn1_VWA4_VWB2_WSGRA0_WSGRB0_WS64_WG32_8_1_WGM6_WGMXCC1_WGMXCCGn1
    SolutionIndex: 31
    SolutionNameMin: Cijk_Ailk_Bljk_I8_BH_UserArgs_MT128x64x128_MI16x16x1_SN_LDSB1_AFC0_AFEM1_AFEM1_ASEM1_CLR1_CADS0_DTVA0_DTVB0_EPS0_FDSI0_GRPM1_GRVWA4_GRVWB16_GSU0_GSUAMB_GSUC0_GSUWGMRR0_GLS0_ISA950_IU1_K1_LBSPPA2048_LBSPPB256_LBSPPM0_LPA64_LPB32_LPM0_LRVW16_LWPMn1_MIAV0_MIWT4_2_MO40_NTn1_NTA0_NTB0_NTC0_NTD0_NTM0_NEPBS0_NLCA1_NLCB1_ONLL1_PGR2_PLR1_PKA1_SIA3_SS1_SU0_SUM1_SUS128_SPO0_SRVW0_SSO0_SVW4_SK3_SKXCCM8_TLDS1_ULSGRO0_USL1_UIOFGRO0_USFGRO0_VSn1_VWA4_VWB2_WSGRA0_WSGRB0_WS64_WG32_8_1_WGM6_WGMXCC1_WGMXCCGn1
    SolutionIndex: 32
    SolutionNameMin: Cijk_Ailk_Bljk_I8_BH_UserArgs_MT64x64x128_MI16x16x1_SN_LDSB1_AFC0_AFEM1_AFEM1_ASEM1_CLR1_CADS0_DTVA0_DTVB0_EPS0_FDSI0_GRPM1_GRVWA4_GRVWB8_GSU0_GSUAMB_GSUC0_GSUWGMRR0_GLS0_ISA950_IU1_K1_LBSPPA1024_LBSPPB256_LBSPPM0_LPA32_LPB32_LPM0_LRVW16_LWPMn1_MIAV0_MIWT2_2_MO40_NTn1_NTA0_NTB0_NTC0_NTD0_NTM0_NEPBS0_NLCA1_NLCB1_ONLL1_PGR2_PLR1_PKA1_SIA3_SS1_SU0_SUM1_SUS128_SPO0_SRVW0_SSO0_SVW2_SK3_SKXCCM8_TLDS1_ULSGRO0_USL1_UIOFGRO0_USFGRO0_VSn1_VWA2_VWB2_WSGRA0_WSGRB0_WS64_WG32_8_1_WGM6_WGMXCC1_WGMXCCGn1
    SolutionIndex: 33
    SolutionNameMin: Cijk_Ailk_Bljk_I8_BH_UserArgs_MT64x64x128_MI16x16x1_SN_LDSB1_AFC0_AFEM1_AFEM1_ASEM1_CLR1_CADS0_DTVA0_DTVB0_EPS0_FDSI0_GRPM1_GRVWA4_GRVWB16_GSU0_GSUAMB_GSUC0_GSUWGMRR0_GLS0_ISA950_IU1_K1_LBSPPA1024_LBSPPB256_LBSPPM0_LPA32_LPB32_LPM0_LRVW16_LWPMn1_MIAV0_MIWT2_2_MO40_NTn1_NTA0_NTB0_NTC0_NTD0_NTM0_NEPBS0_NLCA1_NLCB1_ONLL1_PGR2_PLR1_PKA1_SIA3_SS1_SU0_SUM1_SUS128_SPO0_SRVW0_SSO0_SVW2_SK3_SKXCCM8_TLDS1_ULSGRO0_USL1_UIOFGRO0_USFGRO0_VSn1_VWA2_VWB2_WSGRA0_WSGRB0_WS64_WG32_8_1_WGM6_WGMXCC1_WGMXCCGn1
    SolutionIndex: 34
    SolutionNameMin: Cijk_Ailk_Bljk_I8_BH_UserArgs_MT64x64x128_MI16x16x1_SN_LDSB1_AFC0_AFEM1_AFEM1_ASEM1_CLR1_CADS0_DTVA0_DTVB0_EPS0_FDSI0_GRPM1_GRVWA8_GRVWB16_GSU0_GSUAMB_GSUC0_GSUWGMRR0_GLS0_ISA950_IU1_K1_LBSPPA1024_LBSPPB256_LBSPPM0_LPA32_LPB32_LPM0_LRVW16_LWPMn1_MIAV0_MIWT2_2_MO40_NTn1_NTA0_NTB0_NTC0_NTD0_NTM0_NEPBS0_NLCA1_NLCB1_ONLL1_PGR2_PLR1_PKA1_SIA3_SS1_SU0_SUM1_SUS128_SPO0_SRVW0_SSO0_SVW2_SK3_SKXCCM8_TLDS1_ULSGRO0_USL1_UIOFGRO0_USFGRO0_VSn1_VWA2_VWB2_WSGRA0_WSGRB0_WS64_WG32_8_1_WGM6_WGMXCC1_WGMXCCGn1
    SolutionIndex: 35
    SolutionNameMin: Cijk_Ailk_Bljk_I8_BH_UserArgs_MT64x64x128_MI16x16x1_SN_LDSB1_AFC0_AFEM1_AFEM1_ASEM1_CLR1_CADS0_DTVA0_DTVB0_EPS0_FDSI0_GRPM1_GRVWA16_GRVWB16_GSU0_GSUAMB_GSUC0_GSUWGMRR0_GLS0_ISA950_IU1_K1_LBSPPA1024_LBSPPB256_LBSPPM0_LPA32_LPB32_LPM0_LRVW16_LWPMn1_MIAV0_MIWT2_2_MO40_NTn1_NTA0_NTB0_NTC0_NTD0_NTM0_NEPBS0_NLCA1_NLCB1_ONLL1_PGR2_PLR1_PKA1_SIA3_SS1_SU0_SUM1_SUS128_SPO0_SRVW0_SSO0_SVW2_SK3_SKXCCM8_TLDS1_ULSGRO0_USL1_UIOFGRO0_USFGRO0_VSn1_VWA2_VWB2_WSGRA0_WSGRB0_WS64_WG32_8_1_WGM6_WGMXCC1_WGMXCCGn1
    SolutionIndex: 36
    SolutionNameMin: Cijk_Ailk_Bljk_I8_BH_UserArgs_MT64x64x256_MI16x16x1_SN_LDSB1_AFC0_AFEM1_AFEM1_ASEM1_CLR1_CADS0_DTVA0_DTVB0_EPS0_FDSI0_GRPM1_GRVWA16_GRVWB16_GSU0_GSUAMB_GSUC0_GSUWGMRR0_GLS0_ISA950_IU1_K1_LBSPPA1024_LBSPPB512_LBSPPM0_LPA32_LPB32_LPM0_LRVW16_LWPMn1_MIAV0_MIWT2_2_MO40_NTn1_NTA0_NTB0_NTC0_NTD0_NTM0_NEPBS0_NLCA1_NLCB1_ONLL1_PGR2_PLR1_PKA1_SIA3_SS1_SU0_SUM1_SUS256_SPO0_SRVW0_SSO0_SVW2_SK3_SKXCCM8_TLDS1_ULSGRO0_USL1_UIOFGRO0_USFGRO0_VSn1_VWA2_VWB2_WSGRA0_WSGRB0_WS64_WG32_8_1_WGM6_WGMXCC1_WGMXCCGn1
    SolutionIndex: 37
    SolutionNameMin: Cijk_Ailk_Bljk_I8_BH_UserArgs_MT64x64x256_MI16x16x1_SN_LDSB1_AFC0_AFEM1_AFEM1_ASEM1_CLR1_CADS0_DTVA0_DTVB0_EPS0_FDSI0_GRPM1_GRVWA4_GRVWB16_GSU0_GSUAMB_GSUC0_GSUWGMRR0_GLS0_ISA950_IU1_K1_LBSPPA1024_LBSPPB512_LBSPPM0_LPA32_LPB32_LPM0_LRVW16_LWPMn1_MIAV0_MIWT2_2_MO40_NTn1_NTA0_NTB0_NTC0_NTD0_NTM0_NEPBS0_NLCA1_NLCB1_ONLL1_PGR2_PLR2_PKA1_SIA3_SS1_SU0_SUM1_SUS256_SPO0_SRVW0_SSO0_SVW2_SK3_SKXCCM8_TLDS1_ULSGRO0_USL1_UIOFGRO0_USFGRO0_VSn1_VWA2_VWB2_WSGRA0_WSGRB0_WS64_WG32_8_1_WGM6_WGMXCC1_WGMXCCGn1
    SolutionIndex: 38
    SolutionNameMin: Cijk_Ailk_Bljk_I8_BH_UserArgs_MT64x64x256_MI16x16x1_SN_LDSB1_AFC0_AFEM1_AFEM1_ASEM1_CLR1_CADS0_DTVA0_DTVB0_EPS0_FDSI0_GRPM1_GRVWA8_GRVWB16_GSU0_GSUAMB_GSUC0_GSUWGMRR0_GLS0_ISA950_IU1_K1_LBSPPA1024_LBSPPB512_LBSPPM0_LPA32_LPB32_LPM0_LRVW16_LWPMn1_MIAV0_MIWT2_2_MO40_NTn1_NTA0_NTB0_NTC0_NTD0_NTM0_NEPBS0_NLCA1_NLCB1_ONLL1_PGR2_PLR2_PKA1_SIA3_SS1_SU0_SUM1_SUS256_SPO0_SRVW0_SSO0_SVW2_SK3_SKXCCM8_TLDS1_ULSGRO0_USL1_UIOFGRO0_USFGRO0_VSn1_VWA2_VWB2_WSGRA0_WSGRB0_WS64_WG32_8_1_WGM6_WGMXCC1_WGMXCCGn1
    SolutionIndex: 39
    SolutionNameMin: Cijk_Ailk_Bljk_I8_BH_UserArgs_MT64x64x256_MI16x16x1_SN_LDSB1_AFC0_AFEM1_AFEM1_ASEM1_CLR1_CADS0_DTVA0_DTVB0_EPS0_FDSI0_GRPM1_GRVWA16_GRVWB16_GSU0_GSUAMB_GSUC0_GSUWGMRR0_GLS0_ISA950_IU1_K1_LBSPPA1024_LBSPPB512_LBSPPM0_LPA32_LPB32_LPM0_LRVW16_LWPMn1_MIAV0_MIWT2_2_MO40_NTn1_NTA0_NTB0_NTC0_NTD0_NTM0_NEPBS0_NLCA1_NLCB1_ONLL1_PGR2_PLR2_PKA1_SIA3_SS1_SU0_SUM1_SUS256_SPO0_SRVW0_SSO0_SVW2_SK3_SKXCCM8_TLDS1_ULSGRO0_USL1_UIOFGRO0_USFGRO0_VSn1_VWA2_VWB2_WSGRA0_WSGRB0_WS64_WG32_8_1_WGM6_WGMXCC1_WGMXCCGn1
- - - [128, 128, 1, 128, 128, 128, 128, 128]
    - [33, 0.39]
  - - [128, 128, 1, 256, 128, 128, 128, 256]
    - [36, 0.68]
  - - [128, 128, 1, 512, 128, 128, 128, 512]
    - [33, 1.13]
  - - [128, 128, 1, 1024, 128, 128, 128, 1024]
    - [36, 1.74]
  - - [128, 128, 1, 2048, 128, 128, 128, 2048]
    - [39, 2.4]
  - - [128, 128, 1, 4096, 128, 128, 128, 4096]
    - [39, 2.99]
  - - [128, 128, 1, 8192, 128, 128, 128, 8192]
    - [39, 3.43]
  - - [128, 256, 1, 128, 128, 128, 128, 128]
    - [32, 0.75]
  - - [128, 256, 1, 256, 128, 128, 128, 256]
    - [33, 1.34]
  - - [128, 256, 1, 512, 128, 128, 128, 512]
    - [33, 2.2]
  - - [128, 256, 1, 1024, 128, 128, 128, 1024]
    - [36, 3.4]
  - - [128, 256, 1, 2048, 128, 128, 128, 2048]
    - [39, 4.78]
  - - [128, 256, 1, 4096, 128, 128, 128, 4096]
    - [39, 5.95]
  - - [128, 256, 1, 8192, 128, 128, 128, 8192]
    - [39, 6.8]
  - - [128, 512, 1, 128, 128, 128, 128, 128]
    - [32, 1.52]
  - - [128, 512, 1, 256, 128, 128, 128, 256]
    - [33, 2.69]
  - - [128, 512, 1, 512, 128, 128, 128, 512]
    - [34, 4.39]
  - - [128, 512, 1, 1024, 128, 128, 128, 1024]
    - [39, 6.87]
  - - [128, 512, 1, 2048, 128, 128, 128, 2048]
    - [39, 9.47]
  - - [128, 512, 1, 4096, 128, 128, 128, 4096]
    - [39, 11.94]
  - - [128, 512, 1, 8192, 128, 128, 128, 8192]
    - [39, 13.63]
  - - [128, 1024, 1, 128, 128, 128, 128, 128]
    - [33, 3.02]
  - - [128, 1024, 1, 256, 128, 128, 128, 256]
    - [33, 5.31]
  - - [128, 1024, 1, 512, 128, 128, 128, 512]
    - [33, 8.85]
  - - [128, 1024, 1, 1024, 128, 128, 128, 1024]
    - [39, 13.43]
  - - [128, 1024, 1, 2048, 128, 128, 128, 2048]
    - [39, 19.06]
  - - [128, 1024, 1, 4096, 128, 128, 128, 4096]
    - [39, 23.63]
  - - [128, 1024, 1, 8192, 128, 128, 128, 8192]
    - [39, 27.22]
  - - [128, 2048, 1, 128, 128, 128, 128, 128]
    - [33, 6.02]
  - - [128, 2048, 1, 256, 128, 128, 128, 256]
    - [33, 10.46]
  - - [128, 2048, 1, 512, 128, 128, 128, 512]
    - [33, 17.41]
  - - [128, 2048, 1, 1024, 128, 128, 128, 1024]
    - [39, 26.46]
  - - [128, 2048, 1, 2048, 128, 128, 128, 2048]
    - [39, 37.17]
  - - [128, 2048, 1, 4096, 128, 128, 128, 4096]
    - [39, 46.84]
  - - [128, 2048, 1, 8192, 128, 128, 128, 8192]
    - [39, 54.27]
  - - [128, 4096, 1, 128, 128, 128, 128, 128]
    - [33, 11.61]
  - - [128, 4096, 1, 256, 128, 128, 128, 256]
    - [33, 20.35]
  - - [128, 4096, 1, 512, 128, 128, 128, 512]
    - [33, 33.53]
  - - [128, 4096, 1, 1024, 128, 128, 128, 1024]
    - [39, 52.08]
  - - [128, 4096, 1, 2048, 128, 128, 128, 2048]
    - [39, 73.0]
  - - [128, 4096, 1, 4096, 128, 128, 128, 4096]
    - [39, 92.87]
  - - [128, 4096, 1, 8192, 128, 128, 128, 8192]
    - [39, 106.61]
  - - [128, 8192, 1, 128, 128, 128, 128, 128]
    - [33, 22.31]
  - - [128, 8192, 1, 256, 128, 128, 128, 256]
    - [33, 38.73]
  - - [128, 8192, 1, 512, 128, 128, 128, 512]
    - [33, 65.07]
  - - [128, 8192, 1, 1024, 128, 128, 128, 1024]
    - [39, 100.32]
  - - [128, 8192, 1, 2048, 128, 128, 128, 2048]
    - [39, 141.36]
  - - [128, 8192, 1, 4096, 128, 128, 128, 4096]
    - [39, 175.15]
  - - [128, 8192, 1, 8192, 128, 128, 128, 8192]
    - [39, 201.96]
  - - [256, 128, 1, 128, 256, 256, 256, 128]
    - [34, 0.75]
  - - [256, 128, 1, 256, 256, 256, 256, 256]
    - [33, 1.33]
  - - [256, 128, 1, 512, 256, 256, 256, 512]
    - [33, 2.2]
  - - [256, 128, 1, 1024, 256, 256, 256, 1024]
    - [39, 3.4]
  - - [256, 128, 1, 2048, 256, 256, 256, 2048]
    - [39, 4.66]
  - - [256, 128, 1, 4096, 256, 256, 256, 4096]
    - [39, 5.71]
  - - [256, 128, 1, 8192, 256, 256, 256, 8192]
    - [39, 6.45]
  - - [256, 256, 1, 128, 256, 256, 256, 128]
    - [33, 1.52]
  - - [256, 256, 1, 256, 256, 256, 256, 256]
    - [37, 2.66]
  - - [256, 256, 1, 512, 256, 256, 256, 512]
    - [39, 4.42]
  - - [256, 256, 1, 1024, 256, 256, 256, 1024]
    - [39, 6.88]
  - - [256, 256, 1, 2048, 256, 256, 256, 2048]
    - [39, 9.38]
  - - [256, 256, 1, 4096, 256, 256, 256, 4096]
    - [39, 11.53]
  - - [256, 256, 1, 8192, 256, 256, 256, 8192]
    - [39, 13.09]
  - - [256, 512, 1, 128, 256, 256, 256, 128]
    - [32, 2.98]
  - - [256, 512, 1, 256, 256, 256, 256, 256]
    - [33, 5.28]
  - - [256, 512, 1, 512, 256, 256, 256, 512]
    - [33, 8.86]
  - - [256, 512, 1, 1024, 256, 256, 256, 1024]
    - [39, 13.51]
  - - [256, 512, 1, 2048, 256, 256, 256, 2048]
    - [39, 18.76]
  - - [256, 512, 1, 4096, 256, 256, 256, 4096]
    - [39, 23.14]
  - - [256, 512, 1, 8192, 256, 256, 256, 8192]
    - [39, 26.32]
  - - [256, 1024, 1, 128, 256, 256, 256, 128]
    - [33, 6.1]
  - - [256, 1024, 1, 256, 256, 256, 256, 256]
    - [33, 10.48]
  - - [256, 1024, 1, 512, 256, 256, 256, 512]
    - [33, 17.46]
  - - [256, 1024, 1, 1024, 256, 256, 256, 1024]
    - [39, 26.94]
  - - [256, 1024, 1, 2048, 256, 256, 256, 2048]
    - [39, 37.08]
  - - [256, 1024, 1, 4096, 256, 256, 256, 4096]
    - [39, 45.55]
  - - [256, 1024, 1, 8192, 256, 256, 256, 8192]
    - [39, 52.28]
  - - [256, 2048, 1, 128, 256, 256, 256, 128]
    - [33, 11.84]
  - - [256, 2048, 1, 256, 256, 256, 256, 256]
    - [33, 20.21]
  - - [256, 2048, 1, 512, 256, 256, 256, 512]
    - [33, 33.87]
  - - [256, 2048, 1, 1024, 256, 256, 256, 1024]
    - [39, 52.67]
  - - [256, 2048, 1, 2048, 256, 256, 256, 2048]
    - [39, 73.05]
  - - [256, 2048, 1, 4096, 256, 256, 256, 4096]
    - [39, 89.8]
  - - [256, 2048, 1, 8192, 256, 256, 256, 8192]
    - [39, 103.09]
  - - [256, 4096, 1, 128, 256, 256, 256, 128]
    - [33, 22.67]
  - - [256, 4096, 1, 256, 256, 256, 256, 256]
    - [33, 39.48]
  - - [256, 4096, 1, 512, 256, 256, 256, 512]
    - [33, 65.11]
  - - [256, 4096, 1, 1024, 256, 256, 256, 1024]
    - [39, 102.15]
  - - [256, 4096, 1, 2048, 256, 256, 256, 2048]
    - [39, 141.18]
  - - [256, 4096, 1, 4096, 256, 256, 256, 4096]
    - [39, 174.25]
  - - [256, 4096, 1, 8192, 256, 256, 256, 8192]
    - [39, 197.3]
  - - [256, 8192, 1, 128, 256, 256, 256, 128]
    - [31, 39.87]
  - - [256, 8192, 1, 256, 256, 256, 256, 256]
    - [27, 70.39]
  - - [256, 8192, 1, 512, 256, 256, 256, 512]
    - [27, 117.82]
  - - [256, 8192, 1, 1024, 256, 256, 256, 1024]
    - [27, 180.08]
  - - [256, 8192, 1, 2048, 256, 256, 256, 2048]
    - [28, 244.1]
  - - [256, 8192, 1, 4096, 256, 256, 256, 4096]
    - [29, 287.47]
  - - [256, 8192, 1, 8192, 256, 256, 256, 8192]
    - [28, 325.86]
  - - [512, 128, 1, 128, 512, 512, 512, 128]
    - [32, 1.51]
  - - [512, 128, 1, 256, 512, 512, 512, 256]
    - [33, 2.68]
  - - [512, 128, 1, 512, 512, 512, 512, 512]
    - [33, 4.42]
  - - [512, 128, 1, 1024, 512, 512, 512, 1024]
    - [39, 6.69]
  - - [512, 128, 1, 2048, 512, 512, 512, 2048]
    - [39, 8.74]
  - - [512, 128, 1, 4096, 512, 512, 512, 4096]
    - [39, 10.58]
  - - [512, 128, 1, 8192, 512, 512, 512, 8192]
    - [39, 11.73]
  - - [512, 256, 1, 128, 512, 512, 512, 128]
    - [33, 3.06]
  - - [512, 256, 1, 256, 512, 512, 512, 256]
    - [33, 5.39]
  - - [512, 256, 1, 512, 512, 512, 512, 512]
    - [33, 8.91]
  - - [512, 256, 1, 1024, 512, 512, 512, 1024]
    - [39, 13.28]
  - - [512, 256, 1, 2048, 512, 512, 512, 2048]
    - [39, 17.76]
  - - [512, 256, 1, 4096, 512, 512, 512, 4096]
    - [39, 21.1]
  - - [512, 256, 1, 8192, 512, 512, 512, 8192]
    - [39, 23.7]
  - - [512, 512, 1, 128, 512, 512, 512, 128]
    - [33, 5.94]
  - - [512, 512, 1, 256, 512, 512, 512, 256]
    - [38, 10.36]
  - - [512, 512, 1, 512, 512, 512, 512, 512]
    - [33, 17.17]
  - - [512, 512, 1, 1024, 512, 512, 512, 1024]
    - [39, 25.95]
  - - [512, 512, 1, 2048, 512, 512, 512, 2048]
    - [39, 34.86]
  - - [512, 512, 1, 4096, 512, 512, 512, 4096]
    - [39, 42.42]
  - - [512, 512, 1, 8192, 512, 512, 512, 8192]
    - [39, 47.38]
  - - [512, 1024, 1, 128, 512, 512, 512, 128]
    - [33, 11.59]
  - - [512, 1024, 1, 256, 512, 512, 512, 256]
    - [33, 20.54]
  - - [512, 1024, 1, 512, 512, 512, 512, 512]
    - [33, 33.74]
  - - [512, 1024, 1, 1024, 512, 512, 512, 1024]
    - [39, 51.3]
  - - [512, 1024, 1, 2048, 512, 512, 512, 2048]
    - [39, 68.52]
  - - [512, 1024, 1, 4096, 512, 512, 512, 4096]
    - [39, 83.06]
  - - [512, 1024, 1, 8192, 512, 512, 512, 8192]
    - [39, 94.63]
  - - [512, 2048, 1, 128, 512, 512, 512, 128]
    - [33, 22.3]
  - - [512, 2048, 1, 256, 512, 512, 512, 256]
    - [33, 38.96]
  - - [512, 2048, 1, 512, 512, 512, 512, 512]
    - [34, 64.61]
  - - [512, 2048, 1, 1024, 512, 512, 512, 1024]
    - [36, 98.41]
  - - [512, 2048, 1, 2048, 512, 512, 512, 2048]
    - [39, 134.34]
  - - [512, 2048, 1, 4096, 512, 512, 512, 4096]
    - [39, 163.1]
  - - [512, 2048, 1, 8192, 512, 512, 512, 8192]
    - [39, 183.82]
  - - [512, 4096, 1, 128, 512, 512, 512, 128]
    - [26, 39.07]
  - - [512, 4096, 1, 256, 512, 512, 512, 256]
    - [27, 69.1]
  - - [512, 4096, 1, 512, 512, 512, 512, 512]
    - [26, 117.78]
  - - [512, 4096, 1, 1024, 512, 512, 512, 1024]
    - [26, 178.27]
  - - [512, 4096, 1, 2048, 512, 512, 512, 2048]
    - [28, 244.13]
  - - [512, 4096, 1, 4096, 512, 512, 512, 4096]
    - [29, 298.31]
  - - [512, 4096, 1, 8192, 512, 512, 512, 8192]
    - [29, 327.98]
  - - [512, 8192, 1, 128, 512, 512, 512, 128]
    - [7, 64.67]
  - - [512, 8192, 1, 256, 512, 512, 512, 256]
    - [25, 113.37]
  - - [512, 8192, 1, 512, 512, 512, 512, 512]
    - [25, 191.61]
  - - [512, 8192, 1, 1024, 512, 512, 512, 1024]
    - [24, 291.41]
  - - [512, 8192, 1, 2048, 512, 512, 512, 2048]
    - [24, 389.54]
  - - [512, 8192, 1, 4096, 512, 512, 512, 4096]
    - [24, 469.05]
  - - [512, 8192, 1, 8192, 512, 512, 512, 8192]
    - [25, 521.57]
  - - [1024, 128, 1, 128, 1024, 1024, 1024, 128]
    - [33, 3.01]
  - - [1024, 128, 1, 256, 1024, 1024, 1024, 256]
    - [38, 5.27]
  - - [1024, 128, 1, 512, 1024, 1024, 1024, 512]
    - [33, 8.79]
  - - [1024, 128, 1, 1024, 1024, 1024, 1024, 1024]
    - [39, 13.12]
  - - [1024, 128, 1, 2048, 1024, 1024, 1024, 2048]
    - [39, 16.92]
  - - [1024, 128, 1, 4096, 1024, 1024, 1024, 4096]
    - [37, 20.33]
  - - [1024, 128, 1, 8192, 1024, 1024, 1024, 8192]
    - [37, 22.57]
  - - [1024, 256, 1, 128, 1024, 1024, 1024, 128]
    - [33, 6.01]
  - - [1024, 256, 1, 256, 1024, 1024, 1024, 256]
    - [38, 10.45]
  - - [1024, 256, 1, 512, 1024, 1024, 1024, 512]
    - [33, 17.35]
  - - [1024, 256, 1, 1024, 1024, 1024, 1024, 1024]
    - [39, 25.62]
  - - [1024, 256, 1, 2048, 1024, 1024, 1024, 2048]
    - [37, 33.86]
  - - [1024, 256, 1, 4096, 1024, 1024, 1024, 4096]
    - [37, 40.66]
  - - [1024, 256, 1, 8192, 1024, 1024, 1024, 8192]
    - [39, 45.32]
  - - [1024, 512, 1, 128, 1024, 1024, 1024, 128]
    - [33, 11.94]
  - - [1024, 512, 1, 256, 1024, 1024, 1024, 256]
    - [38, 20.8]
  - - [1024, 512, 1, 512, 1024, 1024, 1024, 512]
    - [33, 33.89]
  - - [1024, 512, 1, 1024, 1024, 1024, 1024, 1024]
    - [33, 50.69]
  - - [1024, 512, 1, 2048, 1024, 1024, 1024, 2048]
    - [33, 67.42]
  - - [1024, 512, 1, 4096, 1024, 1024, 1024, 4096]
    - [39, 81.18]
  - - [1024, 512, 1, 8192, 1024, 1024, 1024, 8192]
    - [39, 90.56]
  - - [1024, 1024, 1, 128, 1024, 1024, 1024, 128]
    - [33, 23.22]
  - - [1024, 1024, 1, 256, 1024, 1024, 1024, 256]
    - [37, 39.75]
  - - [1024, 1024, 1, 512, 1024, 1024, 1024, 512]
    - [35, 66.03]
  - - [1024, 1024, 1, 1024, 1024, 1024, 1024, 1024]
    - [35, 98.51]
  - - [1024, 1024, 1, 2048, 1024, 1024, 1024, 2048]
    - [39, 131.61]
  - - [1024, 1024, 1, 4096, 1024, 1024, 1024, 4096]
    - [35, 157.55]
  - - [1024, 1024, 1, 8192, 1024, 1024, 1024, 8192]
    - [39, 176.6]
  - - [1024, 2048, 1, 128, 1024, 1024, 1024, 128]
    - [27, 40.08]
  - - [1024, 2048, 1, 256, 1024, 1024, 1024, 256]
    - [27, 71.29]
  - - [1024, 2048, 1, 512, 1024, 1024, 1024, 512]
    - [29, 119.59]
  - - [1024, 2048, 1, 1024, 1024, 1024, 1024, 1024]
    - [29, 182.65]
  - - [1024, 2048, 1, 2048, 1024, 1024, 1024, 2048]
    - [26, 246.91]
  - - [1024, 2048, 1, 4096, 1024, 1024, 1024, 4096]
    - [28, 299.9]
  - - [1024, 2048, 1, 8192, 1024, 1024, 1024, 8192]
    - [29, 336.23]
  - - [1024, 4096, 1, 128, 1024, 1024, 1024, 128]
    - [22, 65.17]
  - - [1024, 4096, 1, 256, 1024, 1024, 1024, 256]
    - [21, 116.13]
  - - [1024, 4096, 1, 512, 1024, 1024, 1024, 512]
    - [25, 194.75]
  - - [1024, 4096, 1, 1024, 1024, 1024, 1024, 1024]
    - [25, 293.73]
  - - [1024, 4096, 1, 2048, 1024, 1024, 1024, 2048]
    - [25, 392.64]
  - - [1024, 4096, 1, 4096, 1024, 1024, 1024, 4096]
    - [25, 473.79]
  - - [1024, 4096, 1, 8192, 1024, 1024, 1024, 8192]
    - [25, 519.84]
  - - [1024, 8192, 1, 128, 1024, 1024, 1024, 128]
    - [6, 95.89]
  - - [1024, 8192, 1, 256, 1024, 1024, 1024, 256]
    - [3, 166.35]
  - - [1024, 8192, 1, 512, 1024, 1024, 1024, 512]
    - [18, 270.11]
  - - [1024, 8192, 1, 1024, 1024, 1024, 1024, 1024]
    - [18, 395.14]
  - - [1024, 8192, 1, 2048, 1024, 1024, 1024, 2048]
    - [19, 513.69]
  - - [1024, 8192, 1, 4096, 1024, 1024, 1024, 4096]
    - [18, 594.72]
  - - [1024, 8192, 1, 8192, 1024, 1024, 1024, 8192]
    - [16, 637.98]
  - - [2048, 128, 1, 128, 2048, 2048, 2048, 128]
    - [33, 5.95]
  - - [2048, 128, 1, 256, 2048, 2048, 2048, 256]
    - [33, 10.12]
  - - [2048, 128, 1, 512, 2048, 2048, 2048, 512]
    - [33, 16.87]
  - - [2048, 128, 1, 1024, 2048, 2048, 2048, 1024]
    - [33, 25.27]
  - - [2048, 128, 1, 2048, 2048, 2048, 2048, 2048]
    - [33, 33.55]
  - - [2048, 128, 1, 4096, 2048, 2048, 2048, 4096]
    - [35, 40.27]
  - - [2048, 128, 1, 8192, 2048, 2048, 2048, 8192]
    - [35, 45.27]
  - - [2048, 256, 1, 128, 2048, 2048, 2048, 128]
    - [34, 11.65]
  - - [2048, 256, 1, 256, 2048, 2048, 2048, 256]
    - [33, 20.49]
  - - [2048, 256, 1, 512, 2048, 2048, 2048, 512]
    - [33, 34.19]
  - - [2048, 256, 1, 1024, 2048, 2048, 2048, 1024]
    - [33, 50.52]
  - - [2048, 256, 1, 2048, 2048, 2048, 2048, 2048]
    - [35, 67.13]
  - - [2048, 256, 1, 4096, 2048, 2048, 2048, 4096]
    - [35, 80.63]
  - - [2048, 256, 1, 8192, 2048, 2048, 2048, 8192]
    - [35, 90.2]
  - - [2048, 512, 1, 128, 2048, 2048, 2048, 128]
    - [33, 22.95]
  - - [2048, 512, 1, 256, 2048, 2048, 2048, 256]
    - [33, 39.97]
  - - [2048, 512, 1, 512, 2048, 2048, 2048, 512]
    - [33, 66.7]
  - - [2048, 512, 1, 1024, 2048, 2048, 2048, 1024]
    - [33, 98.95]
  - - [2048, 512, 1, 2048, 2048, 2048, 2048, 2048]
    - [35, 130.52]
  - - [2048, 512, 1, 4096, 2048, 2048, 2048, 4096]
    - [39, 156.87]
  - - [2048, 512, 1, 8192, 2048, 2048, 2048, 8192]
    - [29, 176.07]
  - - [2048, 1024, 1, 128, 2048, 2048, 2048, 128]
    - [31, 40.18]
  - - [2048, 1024, 1, 256, 2048, 2048, 2048, 256]
    - [26, 71.16]
  - - [2048, 1024, 1, 512, 2048, 2048, 2048, 512]
    - [26, 120.1]
  - - [2048, 1024, 1, 1024, 2048, 2048, 2048, 1024]
    - [27, 182.77]
  - - [2048, 1024, 1, 2048, 2048, 2048, 2048, 2048]
    - [27, 246.18]
  - - [2048, 1024, 1, 4096, 2048, 2048, 2048, 4096]
    - [28, 300.11]
  - - [2048, 1024, 1, 8192, 2048, 2048, 2048, 8192]
    - [28, 335.64]
  - - [2048, 2048, 1, 128, 2048, 2048, 2048, 128]
    - [20, 65.57]
  - - [2048, 2048, 1, 256, 2048, 2048, 2048, 256]
    - [21, 116.7]
  - - [2048, 2048, 1, 512, 2048, 2048, 2048, 512]
    - [21, 196.3]
  - - [2048, 2048, 1, 1024, 2048, 2048, 2048, 1024]
    - [24, 294.29]
  - - [2048, 2048, 1, 2048, 2048, 2048, 2048, 2048]
    - [24, 394.15]
  - - [2048, 2048, 1, 4096, 2048, 2048, 2048, 4096]
    - [24, 477.24]
  - - [2048, 2048, 1, 8192, 2048, 2048, 2048, 8192]
    - [25, 522.93]
  - - [2048, 4096, 1, 128, 2048, 2048, 2048, 128]
    - [18, 96.39]
  - - [2048, 4096, 1, 256, 2048, 2048, 2048, 256]
    - [4, 168.2]
  - - [2048, 4096, 1, 512, 2048, 2048, 2048, 512]
    - [4, 268.2]
  - - [2048, 4096, 1, 1024, 2048, 2048, 2048, 1024]
    - [17, 401.23]
  - - [2048, 4096, 1, 2048, 2048, 2048, 2048, 2048]
    - [17, 518.2]
  - - [2048, 4096, 1, 4096, 2048, 2048, 2048, 4096]
    - [18, 597.79]
  - - [2048, 4096, 1, 8192, 2048, 2048, 2048, 8192]
    - [15, 646.14]
  - - [2048, 8192, 1, 128, 2048, 2048, 2048, 128]
    - [1, 121.94]
  - - [2048, 8192, 1, 256, 2048, 2048, 2048, 256]
    - [1, 216.68]
  - - [2048, 8192, 1, 512, 2048, 2048, 2048, 512]
    - [10, 360.74]
  - - [2048, 8192, 1, 1024, 2048, 2048, 2048, 1024]
    - [10, 543.64]
  - - [2048, 8192, 1, 2048, 2048, 2048, 2048, 2048]
    - [13, 738.43]
  - - [2048, 8192, 1, 4096, 2048, 2048, 2048, 4096]
    - [12, 851.1]
  - - [2048, 8192, 1, 8192, 2048, 2048, 2048, 8192]
    - [13, 873.33]
  - - [4096, 128, 1, 128, 4096, 4096, 4096, 128]
    - [32, 11.63]
  - - [4096, 128, 1, 256, 4096, 4096, 4096, 256]
    - [33, 20.5]
  - - [4096, 128, 1, 512, 4096, 4096, 4096, 512]
    - [33, 33.74]
  - - [4096, 128, 1, 1024, 4096, 4096, 4096, 1024]
    - [35, 49.98]
  - - [4096, 128, 1, 2048, 4096, 4096, 4096, 2048]
    - [33, 66.73]
  - - [4096, 128, 1, 4096, 4096, 4096, 4096, 4096]
    - [33, 79.68]
  - - [4096, 128, 1, 8192, 4096, 4096, 4096, 8192]
    - [33, 88.66]
  - - [4096, 256, 1, 128, 4096, 4096, 4096, 128]
    - [33, 22.8]
  - - [4096, 256, 1, 256, 4096, 4096, 4096, 256]
    - [33, 39.99]
  - - [4096, 256, 1, 512, 4096, 4096, 4096, 512]
    - [33, 65.1]
  - - [4096, 256, 1, 1024, 4096, 4096, 4096, 1024]
    - [33, 97.3]
  - - [4096, 256, 1, 2048, 4096, 4096, 4096, 2048]
    - [33, 130.12]
  - - [4096, 256, 1, 4096, 4096, 4096, 4096, 4096]
    - [29, 155.91]
  - - [4096, 256, 1, 8192, 4096, 4096, 4096, 8192]
    - [35, 171.73]
  - - [4096, 512, 1, 128, 4096, 4096, 4096, 128]
    - [30, 39.83]
  - - [4096, 512, 1, 256, 4096, 4096, 4096, 256]
    - [27, 70.65]
  - - [4096, 512, 1, 512, 4096, 4096, 4096, 512]
    - [27, 119.62]
  - - [4096, 512, 1, 1024, 4096, 4096, 4096, 1024]
    - [26, 181.57]
  - - [4096, 512, 1, 2048, 4096, 4096, 4096, 2048]
    - [29, 246.41]
  - - [4096, 512, 1, 4096, 4096, 4096, 4096, 4096]
    - [28, 298.33]
  - - [4096, 512, 1, 8192, 4096, 4096, 4096, 8192]
    - [28, 328.02]
  - - [4096, 1024, 1, 128, 4096, 4096, 4096, 128]
    - [23, 66.38]
  - - [4096, 1024, 1, 256, 4096, 4096, 4096, 256]
    - [25, 116.57]
  - - [4096, 1024, 1, 512, 4096, 4096, 4096, 512]
    - [25, 195.64]
  - - [4096, 1024, 1, 1024, 4096, 4096, 4096, 1024]
    - [24, 291.25]
  - - [4096, 1024, 1, 2048, 4096, 4096, 4096, 2048]
    - [25, 395.49]
  - - [4096, 1024, 1, 4096, 4096, 4096, 4096, 4096]
    - [25, 471.53]
  - - [4096, 1024, 1, 8192, 4096, 4096, 4096, 8192]
    - [25, 522.26]
  - - [4096, 2048, 1, 128, 4096, 4096, 4096, 128]
    - [19, 97.18]
  - - [4096, 2048, 1, 256, 4096, 4096, 4096, 256]
    - [2, 168.46]
  - - [4096, 2048, 1, 512, 4096, 4096, 4096, 512]
    - [19, 269.95]
  - - [4096, 2048, 1, 1024, 4096, 4096, 4096, 1024]
    - [14, 400.52]
  - - [4096, 2048, 1, 2048, 4096, 4096, 4096, 2048]
    - [19, 518.66]
  - - [4096, 2048, 1, 4096, 4096, 4096, 4096, 4096]
    - [19, 600.64]
  - - [4096, 2048, 1, 8192, 4096, 4096, 4096, 8192]
    - [15, 640.25]
  - - [4096, 4096, 1, 128, 4096, 4096, 4096, 128]
    - [1, 121.96]
  - - [4096, 4096, 1, 256, 4096, 4096, 4096, 256]
    - [8, 217.34]
  - - [4096, 4096, 1, 512, 4096, 4096, 4096, 512]
    - [9, 363.92]
  - - [4096, 4096, 1, 1024, 4096, 4096, 4096, 1024]
    - [9, 545.27]
  - - [4096, 4096, 1, 2048, 4096, 4096, 4096, 2048]
    - [12, 738.63]
  - - [4096, 4096, 1, 4096, 4096, 4096, 4096, 4096]
    - [11, 871.05]
  - - [4096, 4096, 1, 8192, 4096, 4096, 4096, 8192]
    - [11, 909.84]
  - - [4096, 8192, 1, 128, 4096, 4096, 4096, 128]
    - [1, 140.44]
  - - [4096, 8192, 1, 256, 4096, 4096, 4096, 256]
    - [9, 248.14]
  - - [4096, 8192, 1, 512, 4096, 4096, 4096, 512]
    - [9, 407.21]
  - - [4096, 8192, 1, 1024, 4096, 4096, 4096, 1024]
    - [12, 589.9]
  - - [4096, 8192, 1, 2048, 4096, 4096, 4096, 2048]
    - [11, 749.84]
  - - [4096, 8192, 1, 4096, 4096, 4096, 4096, 4096]
    - [13, 834.27]
  - - [4096, 8192, 1, 8192, 4096, 4096, 4096, 8192]
    - [12, 951.91]
  - - [8192, 128, 1, 128, 8192, 8192, 8192, 128]
    - [33, 22.58]
  - - [8192, 128, 1, 256, 8192, 8192, 8192, 256]
    - [33, 38.75]
  - - [8192, 128, 1, 512, 8192, 8192, 8192, 512]
    - [33, 64.67]
  - - [8192, 128, 1, 1024, 8192, 8192, 8192, 1024]
    - [33, 96.58]
  - - [8192, 128, 1, 2048, 8192, 8192, 8192, 2048]
    - [33, 127.94]
  - - [8192, 128, 1, 4096, 8192, 8192, 8192, 4096]
    - [33, 154.17]
  - - [8192, 128, 1, 8192, 8192, 8192, 8192, 8192]
    - [35, 172.69]
  - - [8192, 256, 1, 128, 8192, 8192, 8192, 128]
    - [31, 39.78]
  - - [8192, 256, 1, 256, 8192, 8192, 8192, 256]
    - [26, 70.32]
  - - [8192, 256, 1, 512, 8192, 8192, 8192, 512]
    - [26, 118.82]
  - - [8192, 256, 1, 1024, 8192, 8192, 8192, 1024]
    - [27, 180.41]
  - - [8192, 256, 1, 2048, 8192, 8192, 8192, 2048]
    - [29, 245.81]
  - - [8192, 256, 1, 4096, 8192, 8192, 8192, 4096]
    - [28, 291.91]
  - - [8192, 256, 1, 8192, 8192, 8192, 8192, 8192]
    - [28, 330.64]
  - - [8192, 512, 1, 128, 8192, 8192, 8192, 128]
    - [23, 66.19]
  - - [8192, 512, 1, 256, 8192, 8192, 8192, 256]
    - [23, 116.48]
  - - [8192, 512, 1, 512, 8192, 8192, 8192, 512]
    - [24, 194.53]
  - - [8192, 512, 1, 1024, 8192, 8192, 8192, 1024]
    - [25, 295.35]
  - - [8192, 512, 1, 2048, 8192, 8192, 8192, 2048]
    - [24, 394.89]
  - - [8192, 512, 1, 4096, 8192, 8192, 8192, 4096]
    - [24, 473.26]
  - - [8192, 512, 1, 8192, 8192, 8192, 8192, 8192]
    - [24, 522.9]
  - - [8192, 1024, 1, 128, 8192, 8192, 8192, 128]
    - [5, 97.08]
  - - [8192, 1024, 1, 256, 8192, 8192, 8192, 256]
    - [3, 168.28]
  - - [8192, 1024, 1, 512, 8192, 8192, 8192, 512]
    - [18, 269.78]
  - - [8192, 1024, 1, 1024, 8192, 8192, 8192, 1024]
    - [15, 393.25]
  - - [8192, 1024, 1, 2048, 8192, 8192, 8192, 2048]
    - [18, 505.31]
  - - [8192, 1024, 1, 4096, 8192, 8192, 8192, 4096]
    - [19, 592.86]
  - - [8192, 1024, 1, 8192, 8192, 8192, 8192, 8192]
    - [15, 635.72]
  - - [8192, 2048, 1, 128, 8192, 8192, 8192, 128]
    - [0, 123.21]
  - - [8192, 2048, 1, 256, 8192, 8192, 8192, 256]
    - [0, 219.46]
  - - [8192, 2048, 1, 512, 8192, 8192, 8192, 512]
    - [10, 356.95]
  - - [8192, 2048, 1, 1024, 8192, 8192, 8192, 1024]
    - [10, 537.85]
  - - [8192, 2048, 1, 2048, 8192, 8192, 8192, 2048]
    - [11, 735.71]
  - - [8192, 2048, 1, 4096, 8192, 8192, 8192, 4096]
    - [11, 874.04]
  - - [8192, 2048, 1, 8192, 8192, 8192, 8192, 8192]
    - [11, 901.0]
  - - [8192, 4096, 1, 128, 8192, 8192, 8192, 128]
    - [1, 140.81]
  - - [8192, 4096, 1, 256, 8192, 8192, 8192, 256]
    - [10, 248.11]
  - - [8192, 4096, 1, 512, 8192, 8192, 8192, 512]
    - [10, 405.33]
  - - [8192, 4096, 1, 1024, 8192, 8192, 8192, 1024]
    - [13, 589.9]
  - - [8192, 4096, 1, 2048, 8192, 8192, 8192, 2048]
    - [12, 742.22]
  - - [8192, 4096, 1, 4096, 8192, 8192, 8192, 4096]
    - [11, 841.52]
  - - [8192, 4096, 1, 8192, 8192, 8192, 8192, 8192]
    - [11, 956.68]
  - - [8192, 8192, 1, 128, 8192, 8192, 8192, 128]
    - [1, 155.96]
  - - [8192, 8192, 1, 256, 8192, 8192, 8192, 256]
    - [0, 269.31]
  - - [8192, 8192, 1, 512, 8192, 8192, 8192, 512]
    - [13, 422.2]
  - - [8192, 8192, 1, 1024, 8192, 8192, 8192, 1024]
    - [12, 597.67]
  - - [8192, 8192, 1, 2048, 8192, 8192, 8192, 2048]
    - [11, 757.71]
  - - [8192, 8192, 1, 4096, 8192, 8192, 8192, 4096]
    - [13, 887.22]
  - - [8192, 8192, 1, 8192, 8192, 8192, 8192, 8192]
    - [13, 1030.31]
- null
- null
- DeviceEfficiency
- GridBased
