projects/hipblaslt/library/src/amd_detail/rocblaslt/src/Tensile/Logic/asm_full/gfx950/gfx950/GridBased/gfx950_Cijk_Ailk_Bjlk_I8_BH_UserArgs.yaml
- {MinimumRequiredVersion: 5.0.0}
- gfx950
- gfx950
- [Device 75a0]
    SolutionIndex: 0
    SolutionNameMin: Cijk_Ailk_Bjlk_I8_BH_UserArgs_MT256x256x64_MI16x16x1_SN_LDSB0_AFC0_AFEM1_AFEM1_ASEM1_CLR0_CADS0_DTVA0_DTVB0_EPS0_FDSI0_GRPM1_GRVWA4_GRVWB16_GSU0_GSUAMB_GSUC0_GSUWGMRR0_GLS0_ISA950_IU1_K1_LBSPPA4096_LBSPPB4096_LBSPPM0_LPA0_LPB64_LPM0_LRVW16_LWPMn1_MIAV0_MIWT8_8_MO40_NTn1_NTA0_NTB0_NTC0_NTD0_NTM0_NEPBS0_NLCA1_NLCB1_ONLL1_PGR2_PLR0_PKA1_SIA3_SS1_SU0_SUM1_SUS64_SPO0_SRVW0_SSO0_SVW8_SK3_SKXCCM8_TLDS0_ULSGRO0_USL1_UIOFGRO0_USFGRO0_VSn1_VWA8_VWB4_WSGRA0_WSGRB0_WS64_WG32_8_1_WGM6_WGMXCC1_WGMXCCGn1
    SolutionIndex: 1
    SolutionNameMin: Cijk_Ailk_Bjlk_I8_BH_UserArgs_MT256x256x64_MI16x16x1_SN_LDSB0_AFC0_AFEM1_AFEM1_ASEM1_CLR0_CADS0_DTVA0_DTVB0_EPS0_FDSI0_GRPM1_GRVWA16_GRVWB16_GSU0_GSUAMB_GSUC0_GSUWGMRR0_GLS0_ISA950_IU1_K1_LBSPPA4096_LBSPPB4096_LBSPPM0_LPA0_LPB0_LPM0_LRVW16_LWPMn1_MIAV0_MIWT8_8_MO40_NTn1_NTA0_NTB0_NTC0_NTD0_NTM0_NEPBS0_NLCA1_NLCB1_ONLL1_PGR2_PLR0_PKA1_SIA3_SS1_SU0_SUM1_SUS64_SPO0_SRVW0_SSO0_SVW8_SK3_SKXCCM8_TLDS0_ULSGRO0_USL1_UIOFGRO0_USFGRO0_VSn1_VWA8_VWB8_WSGRA0_WSGRB0_WS64_WG32_8_1_WGM6_WGMXCC1_WGMXCCGn1
    SolutionIndex: 2
    SolutionNameMin: Cijk_Ailk_Bjlk_I8_BH_UserArgs_MT256x128x64_MI16x16x1_SN_LDSB1_AFC0_AFEM1_AFEM1_ASEM1_CLR0_CADS0_DTVA0_DTVB0_EPS0_FDSI0_GRPM1_GRVWA16_GRVWB4_GSU0_GSUAMB_GSUC0_GSUWGMRR0_GLS0_ISA950_IU1_K1_LBSPPA4096_LBSPPB2048_LBSPPM0_LPA0_LPB64_LPM0_LRVW16_LWPMn1_MIAV0_MIWT8_4_MO40_NTn1_NTA0_NTB0_NTC0_NTD0_NTM0_NEPBS0_NLCA1_NLCB1_ONLL1_PGR2_PLR0_PKA1_SIA3_SS1_SU0_SUM1_SUS64_SPO0_SRVW0_SSO0_SVW8_SK3_SKXCCM8_TLDS0_ULSGRO0_USL1_UIOFGRO0_USFGRO0_VSn1_VWA8_VWB4_WSGRA0_WSGRB0_WS64_WG32_8_1_WGM6_WGMXCC1_WGMXCCGn1
    SolutionIndex: 3
    SolutionNameMin: Cijk_Ailk_Bjlk_I8_BH_UserArgs_MT256x128x64_MI16x16x1_SN_LDSB1_AFC0_AFEM1_AFEM1_ASEM1_CLR0_CADS0_DTVA0_DTVB0_EPS0_FDSI0_GRPM1_GRVWA16_GRVWB8_GSU0_GSUAMB_GSUC0_GSUWGMRR0_GLS0_ISA950_IU1_K1_LBSPPA4096_LBSPPB2048_LBSPPM0_LPA0_LPB64_LPM0_LRVW16_LWPMn1_MIAV0_MIWT8_4_MO40_NTn1_NTA0_NTB0_NTC0_NTD0_NTM0_NEPBS0_NLCA1_NLCB1_ONLL1_PGR2_PLR0_PKA1_SIA3_SS1_SU0_SUM1_SUS64_SPO0_SRVW0_SSO0_SVW8_SK3_SKXCCM8_TLDS0_ULSGRO0_USL1_UIOFGRO0_USFGRO0_VSn1_VWA8_VWB4_WSGRA0_WSGRB0_WS64_WG32_8_1_WGM6_WGMXCC1_WGMXCCGn1
    SolutionIndex: 4
    SolutionNameMin: Cijk_Ailk_Bjlk_I8_BH_UserArgs_MT256x128x64_MI16x16x1_SN_LDSB1_AFC0_AFEM1_AFEM1_ASEM1_CLR0_CADS0_DTVA0_DTVB0_EPS0_FDSI0_GRPM1_GRVWA4_GRVWB16_GSU0_GSUAMB_GSUC0_GSUWGMRR0_GLS0_ISA950_IU1_K1_LBSPPA4096_LBSPPB2048_LBSPPM0_LPA0_LPB64_LPM0_LRVW16_LWPMn1_MIAV0_MIWT8_4_MO40_NTn1_NTA0_NTB0_NTC0_NTD0_NTM0_NEPBS0_NLCA1_NLCB1_ONLL1_PGR2_PLR0_PKA1_SIA3_SS1_SU0_SUM1_SUS64_SPO0_SRVW0_SSO0_SVW8_SK3_SKXCCM8_TLDS0_ULSGRO0_USL1_UIOFGRO0_USFGRO0_VSn1_VWA8_VWB4_WSGRA0_WSGRB0_WS64_WG32_8_1_WGM6_WGMXCC1_WGMXCCGn1
    SolutionIndex: 5
    SolutionNameMin: Cijk_Ailk_Bjlk_I8_BH_UserArgs_MT256x128x64_MI16x16x1_SN_LDSB1_AFC0_AFEM1_AFEM1_ASEM1_CLR0_CADS0_DTVA0_DTVB0_EPS0_FDSI0_GRPM1_GRVWA16_GRVWB16_GSU0_GSUAMB_GSUC0_GSUWGMRR0_GLS0_ISA950_IU1_K1_LBSPPA4096_LBSPPB2048_LBSPPM0_LPA0_LPB64_LPM0_LRVW16_LWPMn1_MIAV0_MIWT8_4_MO40_NTn1_NTA0_NTB0_NTC0_NTD0_NTM0_NEPBS0_NLCA1_NLCB1_ONLL1_PGR2_PLR0_PKA1_SIA3_SS1_SU0_SUM1_SUS64_SPO0_SRVW0_SSO0_SVW8_SK3_SKXCCM8_TLDS0_ULSGRO0_USL1_UIOFGRO0_USFGRO0_VSn1_VWA8_VWB4_WSGRA0_WSGRB0_WS64_WG32_8_1_WGM6_WGMXCC1_WGMXCCGn1
    SolutionIndex: 6
    SolutionNameMin: Cijk_Ailk_Bjlk_I8_BH_UserArgs_MT128x128x64_MI16x16x1_SN_LDSB1_AFC0_AFEM1_AFEM1_ASEM1_CLR0_CADS0_DTVA0_DTVB0_EPS0_FDSI0_GRPM1_GRVWA4_GRVWB4_GSU0_GSUAMB_GSUC0_GSUWGMRR0_GLS0_ISA950_IU1_K1_LBSPPA2048_LBSPPB2048_LBSPPM0_LPA64_LPB64_LPM0_LRVW16_LWPMn1_MIAV0_MIWT4_4_MO40_NTn1_NTA0_NTB0_NTC0_NTD0_NTM0_NEPBS0_NLCA1_NLCB1_ONLL1_PGR2_PLR0_PKA1_SIA3_SS1_SU0_SUM1_SUS64_SPO0_SRVW0_SSO0_SVW4_SK3_SKXCCM8_TLDS0_ULSGRO0_USL1_UIOFGRO0_USFGRO0_VSn1_VWA4_VWB4_WSGRA0_WSGRB0_WS64_WG32_8_1_WGM6_WGMXCC1_WGMXCCGn1
    SolutionIndex: 7
    SolutionNameMin: Cijk_Ailk_Bjlk_I8_BH_UserArgs_MT128x128x64_MI16x16x1_SN_LDSB1_AFC0_AFEM1_AFEM1_ASEM1_CLR0_CADS0_DTVA0_DTVB0_EPS0_FDSI0_GRPM1_GRVWA4_GRVWB16_GSU0_GSUAMB_GSUC0_GSUWGMRR0_GLS0_ISA950_IU1_K1_LBSPPA2048_LBSPPB2048_LBSPPM0_LPA64_LPB64_LPM0_LRVW16_LWPMn1_MIAV0_MIWT4_4_MO40_NTn1_NTA0_NTB0_NTC0_NTD0_NTM0_NEPBS0_NLCA1_NLCB1_ONLL1_PGR2_PLR0_PKA1_SIA3_SS1_SU0_SUM1_SUS64_SPO0_SRVW0_SSO0_SVW4_SK3_SKXCCM8_TLDS0_ULSGRO0_USL1_UIOFGRO0_USFGRO0_VSn1_VWA4_VWB4_WSGRA0_WSGRB0_WS64_WG32_8_1_WGM6_WGMXCC1_WGMXCCGn1
    SolutionIndex: 8
    SolutionNameMin: Cijk_Ailk_Bjlk_I8_BH_UserArgs_MT64x128x64_MI16x16x1_SN_LDSB0_AFC0_AFEM1_AFEM1_ASEM1_CLR0_CADS0_DTVA0_DTVB0_EPS0_FDSI0_GRPM1_GRVWA4_GRVWB4_GSU0_GSUAMB_GSUC0_GSUWGMRR0_GLS0_ISA950_IU1_K1_LBSPPA1024_LBSPPB2048_LBSPPM0_LPA32_LPB64_LPM0_LRVW16_LWPMn1_MIAV0_MIWT2_4_MO40_NTn1_NTA0_NTB0_NTC0_NTD0_NTM0_NEPBS0_NLCA1_NLCB1_ONLL1_PGR2_PLR0_PKA1_SIA3_SS1_SU0_SUM1_SUS64_SPO0_SRVW0_SSO0_SVW2_SK3_SKXCCM8_TLDS0_ULSGRO0_USL1_UIOFGRO0_USFGRO0_VSn1_VWA2_VWB4_WSGRA0_WSGRB0_WS64_WG32_8_1_WGM6_WGMXCC1_WGMXCCGn1
    SolutionIndex: 9
    SolutionNameMin: Cijk_Ailk_Bjlk_I8_BH_UserArgs_MT128x64x64_MI16x16x1_SN_LDSB0_AFC0_AFEM1_AFEM1_ASEM1_CLR0_CADS0_DTVA0_DTVB0_EPS0_FDSI0_GRPM1_GRVWA4_GRVWB4_GSU0_GSUAMB_GSUC0_GSUWGMRR0_GLS0_ISA950_IU1_K1_LBSPPA2048_LBSPPB1024_LBSPPM0_LPA64_LPB32_LPM0_LRVW16_LWPMn1_MIAV0_MIWT4_2_MO40_NTn1_NTA0_NTB0_NTC0_NTD0_NTM0_NEPBS0_NLCA1_NLCB1_ONLL1_PGR2_PLR0_PKA1_SIA3_SS1_SU0_SUM1_SUS64_SPO0_SRVW0_SSO0_SVW4_SK3_SKXCCM8_TLDS0_ULSGRO0_USL1_UIOFGRO0_USFGRO0_VSn1_VWA4_VWB2_WSGRA0_WSGRB0_WS64_WG32_8_1_WGM6_WGMXCC1_WGMXCCGn1
    SolutionIndex: 10
    SolutionNameMin: Cijk_Ailk_Bjlk_I8_BH_UserArgs_MT64x64x64_MI16x16x1_SN_LDSB0_AFC0_AFEM1_AFEM1_ASEM1_CLR0_CADS0_DTVA0_DTVB0_EPS0_FDSI0_GRPM1_GRVWA4_GRVWB4_GSU0_GSUAMB_GSUC0_GSUWGMRR0_GLS0_ISA950_IU1_K1_LBSPPA1024_LBSPPB1024_LBSPPM0_LPA32_LPB32_LPM0_LRVW16_LWPMn1_MIAV0_MIWT2_2_MO40_NTn1_NTA0_NTB0_NTC0_NTD0_NTM0_NEPBS0_NLCA1_NLCB1_ONLL1_PGR2_PLR0_PKA1_SIA3_SS1_SU0_SUM1_SUS64_SPO0_SRVW0_SSO0_SVW2_SK3_SKXCCM8_TLDS0_ULSGRO0_USL1_UIOFGRO0_USFGRO0_VSn1_VWA2_VWB2_WSGRA0_WSGRB0_WS64_WG32_8_1_WGM6_WGMXCC1_WGMXCCGn1
    SolutionIndex: 11
    SolutionNameMin: Cijk_Ailk_Bjlk_I8_BH_UserArgs_MT256x256x64_MI32x32x1_SN_LDSB0_AFC0_AFEM1_AFEM1_ASEM1_CLR1_CADS0_DTVA0_DTVB0_EPS0_FDSI0_GRPM1_GRVWA4_GRVWB4_GSU0_GSUAMB_GSUC0_GSUWGMRR0_GLS0_ISA950_IU1_K1_LBSPPA0_LBSPPB0_LBSPPM0_LPA0_LPB0_LPM0_LRVW16_LWPMn1_MIAV0_MIWT4_4_MO40_NTn1_NTA0_NTB0_NTC0_NTD0_NTM0_NEPBS0_NLCA1_NLCB1_ONLL1_PGR2_PLR1_PKA1_SIA3_SS1_SU0_SUM1_SUS64_SPO0_SRVW0_SSO0_SVW4_SK3_SKXCCM8_TLDS0_ULSGRO0_USL1_UIOFGRO0_USFGRO0_VSn1_VWA4_VWB4_WSGRA0_WSGRB0_WS64_WG64_4_1_WGM6_WGMXCC1_WGMXCCGn1
    SolutionIndex: 12
    SolutionNameMin: Cijk_Ailk_Bjlk_I8_BH_UserArgs_MT256x256x64_MI32x32x1_SN_LDSB0_AFC0_AFEM1_AFEM1_ASEM1_CLR1_CADS0_DTVA0_DTVB0_EPS0_FDSI0_GRPM1_GRVWA16_GRVWB4_GSU0_GSUAMB_GSUC0_GSUWGMRR0_GLS0_ISA950_IU1_K1_LBSPPA0_LBSPPB0_LBSPPM0_LPA0_LPB0_LPM0_LRVW16_LWPMn1_MIAV0_MIWT4_4_MO40_NTn1_NTA0_NTB0_NTC0_NTD0_NTM0_NEPBS0_NLCA1_NLCB1_ONLL1_PGR2_PLR1_PKA1_SIA3_SS1_SU0_SUM1_SUS64_SPO0_SRVW0_SSO0_SVW4_SK3_SKXCCM8_TLDS0_ULSGRO0_USL1_UIOFGRO0_USFGRO0_VSn1_VWA4_VWB4_WSGRA0_WSGRB0_WS64_WG64_4_1_WGM6_WGMXCC1_WGMXCCGn1
    SolutionIndex: 13
    SolutionNameMin: Cijk_Ailk_Bjlk_I8_BH_UserArgs_MT256x256x64_MI32x32x1_SN_LDSB0_AFC0_AFEM1_AFEM1_ASEM1_CLR1_CADS0_DTVA0_DTVB0_EPS0_FDSI0_GRPM1_GRVWA16_GRVWB8_GSU0_GSUAMB_GSUC0_GSUWGMRR0_GLS0_ISA950_IU1_K1_LBSPPA0_LBSPPB0_LBSPPM0_LPA0_LPB0_LPM0_LRVW16_LWPMn1_MIAV0_MIWT4_4_MO40_NTn1_NTA0_NTB0_NTC0_NTD0_NTM0_NEPBS0_NLCA1_NLCB1_ONLL1_PGR2_PLR1_PKA1_SIA3_SS1_SU0_SUM1_SUS64_SPO0_SRVW0_SSO0_SVW4_SK3_SKXCCM8_TLDS0_ULSGRO0_USL1_UIOFGRO0_USFGRO0_VSn1_VWA4_VWB4_WSGRA0_WSGRB0_WS64_WG64_4_1_WGM6_WGMXCC1_WGMXCCGn1
    SolutionIndex: 14
    SolutionNameMin: Cijk_Ailk_Bjlk_I8_BH_UserArgs_MT256x128x128_MI16x16x1_SN_LDSB1_AFC0_AFEM1_AFEM1_ASEM1_CLR1_CADS0_DTVA0_DTVB0_EPS0_FDSI0_GRPM1_GRVWA16_GRVWB16_GSU0_GSUAMB_GSUC0_GSUWGMRR0_GLS0_ISA950_IU1_K1_LBSPPA4096_LBSPPB2048_LBSPPM0_LPA0_LPB64_LPM0_LRVW16_LWPMn1_MIAV0_MIWT8_4_MO40_NTn1_NTA0_NTB0_NTC0_NTD0_NTM0_NEPBS0_NLCA1_NLCB1_ONLL1_PGR2_PLR1_PKA1_SIA3_SS1_SU0_SUM1_SUS128_SPO0_SRVW0_SSO0_SVW8_SK3_SKXCCM8_TLDS0_ULSGRO0_USL1_UIOFGRO0_USFGRO0_VSn1_VWA8_VWB4_WSGRA0_WSGRB0_WS64_WG32_8_1_WGM6_WGMXCC1_WGMXCCGn1
    SolutionIndex: 15
    SolutionNameMin: Cijk_Ailk_Bjlk_I8_BH_UserArgs_MT128x128x128_MI16x16x1_SN_LDSB1_AFC0_AFEM1_AFEM1_ASEM1_CLR1_CADS0_DTVA0_DTVB0_EPS0_FDSI0_GRPM1_GRVWA4_GRVWB16_GSU0_GSUAMB_GSUC0_GSUWGMRR0_GLS0_ISA950_IU1_K1_LBSPPA2048_LBSPPB2048_LBSPPM0_LPA64_LPB64_LPM0_LRVW16_LWPMn1_MIAV0_MIWT4_4_MO40_NTn1_NTA0_NTB0_NTC0_NTD0_NTM0_NEPBS0_NLCA1_NLCB1_ONLL1_PGR2_PLR1_PKA1_SIA3_SS1_SU0_SUM1_SUS128_SPO0_SRVW0_SSO0_SVW4_SK3_SKXCCM8_TLDS0_ULSGRO0_USL1_UIOFGRO0_USFGRO0_VSn1_VWA4_VWB4_WSGRA0_WSGRB0_WS64_WG32_8_1_WGM6_WGMXCC1_WGMXCCGn1
    SolutionIndex: 16
    SolutionNameMin: Cijk_Ailk_Bjlk_I8_BH_UserArgs_MT128x128x128_MI16x16x1_SN_LDSB1_AFC0_AFEM1_AFEM1_ASEM1_CLR1_CADS0_DTVA0_DTVB0_EPS0_FDSI0_GRPM1_GRVWA16_GRVWB16_GSU0_GSUAMB_GSUC0_GSUWGMRR0_GLS0_ISA950_IU1_K1_LBSPPA2048_LBSPPB2048_LBSPPM0_LPA64_LPB64_LPM0_LRVW16_LWPMn1_MIAV0_MIWT4_4_MO40_NTn1_NTA0_NTB0_NTC0_NTD0_NTM0_NEPBS0_NLCA1_NLCB1_ONLL1_PGR2_PLR1_PKA1_SIA3_SS1_SU0_SUM1_SUS128_SPO0_SRVW0_SSO0_SVW4_SK3_SKXCCM8_TLDS0_ULSGRO0_USL1_UIOFGRO0_USFGRO0_VSn1_VWA4_VWB4_WSGRA0_WSGRB0_WS64_WG32_8_1_WGM6_WGMXCC1_WGMXCCGn1
    SolutionIndex: 17
    SolutionNameMin: Cijk_Ailk_Bjlk_I8_BH_UserArgs_MT64x128x128_MI16x16x1_SN_LDSB1_AFC0_AFEM1_AFEM1_ASEM1_CLR1_CADS0_DTVA0_DTVB0_EPS0_FDSI0_GRPM1_GRVWA8_GRVWB4_GSU0_GSUAMB_GSUC0_GSUWGMRR0_GLS0_ISA950_IU1_K1_LBSPPA1024_LBSPPB2048_LBSPPM0_LPA32_LPB64_LPM0_LRVW16_LWPMn1_MIAV0_MIWT2_4_MO40_NTn1_NTA0_NTB0_NTC0_NTD0_NTM0_NEPBS0_NLCA1_NLCB1_ONLL1_PGR2_PLR1_PKA1_SIA3_SS1_SU0_SUM1_SUS128_SPO0_SRVW0_SSO0_SVW2_SK3_SKXCCM8_TLDS0_ULSGRO0_USL1_UIOFGRO0_USFGRO0_VSn1_VWA2_VWB4_WSGRA0_WSGRB0_WS64_WG32_8_1_WGM6_WGMXCC1_WGMXCCGn1
    SolutionIndex: 18
    SolutionNameMin: Cijk_Ailk_Bjlk_I8_BH_UserArgs_MT64x128x128_MI16x16x1_SN_LDSB1_AFC0_AFEM1_AFEM1_ASEM1_CLR1_CADS0_DTVA0_DTVB0_EPS0_FDSI0_GRPM1_GRVWA4_GRVWB16_GSU0_GSUAMB_GSUC0_GSUWGMRR0_GLS0_ISA950_IU1_K1_LBSPPA1024_LBSPPB2048_LBSPPM0_LPA32_LPB64_LPM0_LRVW16_LWPMn1_MIAV0_MIWT2_4_MO40_NTn1_NTA0_NTB0_NTC0_NTD0_NTM0_NEPBS0_NLCA1_NLCB1_ONLL1_PGR2_PLR1_PKA1_SIA3_SS1_SU0_SUM1_SUS128_SPO0_SRVW0_SSO0_SVW2_SK3_SKXCCM8_TLDS0_ULSGRO0_USL1_UIOFGRO0_USFGRO0_VSn1_VWA2_VWB4_WSGRA0_WSGRB0_WS64_WG32_8_1_WGM6_WGMXCC1_WGMXCCGn1
    SolutionIndex: 19
    SolutionNameMin: Cijk_Ailk_Bjlk_I8_BH_UserArgs_MT64x128x128_MI16x16x1_SN_LDSB1_AFC0_AFEM1_AFEM1_ASEM1_CLR1_CADS0_DTVA0_DTVB0_EPS0_FDSI0_GRPM1_GRVWA8_GRVWB16_GSU0_GSUAMB_GSUC0_GSUWGMRR0_GLS0_ISA950_IU1_K1_LBSPPA1024_LBSPPB2048_LBSPPM0_LPA32_LPB64_LPM0_LRVW16_LWPMn1_MIAV0_MIWT2_4_MO40_NTn1_NTA0_NTB0_NTC0_NTD0_NTM0_NEPBS0_NLCA1_NLCB1_ONLL1_PGR2_PLR1_PKA1_SIA3_SS1_SU0_SUM1_SUS128_SPO0_SRVW0_SSO0_SVW2_SK3_SKXCCM8_TLDS0_ULSGRO0_USL1_UIOFGRO0_USFGRO0_VSn1_VWA2_VWB4_WSGRA0_WSGRB0_WS64_WG32_8_1_WGM6_WGMXCC1_WGMXCCGn1
    SolutionIndex: 20
    SolutionNameMin: Cijk_Ailk_Bjlk_I8_BH_UserArgs_MT64x128x128_MI16x16x1_SN_LDSB1_AFC0_AFEM1_AFEM1_ASEM1_CLR1_CADS0_DTVA0_DTVB0_EPS0_FDSI0_GRPM1_GRVWA16_GRVWB16_GSU0_GSUAMB_GSUC0_GSUWGMRR0_GLS0_ISA950_IU1_K1_LBSPPA1024_LBSPPB2048_LBSPPM0_LPA32_LPB64_LPM0_LRVW16_LWPMn1_MIAV0_MIWT2_4_MO40_NTn1_NTA0_NTB0_NTC0_NTD0_NTM0_NEPBS0_NLCA1_NLCB1_ONLL1_PGR2_PLR1_PKA1_SIA3_SS1_SU0_SUM1_SUS128_SPO0_SRVW0_SSO0_SVW2_SK3_SKXCCM8_TLDS0_ULSGRO0_USL1_UIOFGRO0_USFGRO0_VSn1_VWA2_VWB4_WSGRA0_WSGRB0_WS64_WG32_8_1_WGM6_WGMXCC1_WGMXCCGn1
    SolutionIndex: 21
    SolutionNameMin: Cijk_Ailk_Bjlk_I8_BH_UserArgs_MT128x64x128_MI16x16x1_SN_LDSB1_AFC0_AFEM1_AFEM1_ASEM1_CLR1_CADS0_DTVA0_DTVB0_EPS0_FDSI0_GRPM1_GRVWA4_GRVWB4_GSU0_GSUAMB_GSUC0_GSUWGMRR0_GLS0_ISA950_IU1_K1_LBSPPA2048_LBSPPB1024_LBSPPM0_LPA64_LPB32_LPM0_LRVW16_LWPMn1_MIAV0_MIWT4_2_MO40_NTn1_NTA0_NTB0_NTC0_NTD0_NTM0_NEPBS0_NLCA1_NLCB1_ONLL1_PGR2_PLR1_PKA1_SIA3_SS1_SU0_SUM1_SUS128_SPO0_SRVW0_SSO0_SVW4_SK3_SKXCCM8_TLDS0_ULSGRO0_USL1_UIOFGRO0_USFGRO0_VSn1_VWA4_VWB2_WSGRA0_WSGRB0_WS64_WG32_8_1_WGM6_WGMXCC1_WGMXCCGn1
    SolutionIndex: 22
    SolutionNameMin: Cijk_Ailk_Bjlk_I8_BH_UserArgs_MT128x64x128_MI16x16x1_SN_LDSB1_AFC0_AFEM1_AFEM1_ASEM1_CLR1_CADS0_DTVA0_DTVB0_EPS0_FDSI0_GRPM1_GRVWA16_GRVWB4_GSU0_GSUAMB_GSUC0_GSUWGMRR0_GLS0_ISA950_IU1_K1_LBSPPA2048_LBSPPB1024_LBSPPM0_LPA64_LPB32_LPM0_LRVW16_LWPMn1_MIAV0_MIWT4_2_MO40_NTn1_NTA0_NTB0_NTC0_NTD0_NTM0_NEPBS0_NLCA1_NLCB1_ONLL1_PGR2_PLR1_PKA1_SIA3_SS1_SU0_SUM1_SUS128_SPO0_SRVW0_SSO0_SVW4_SK3_SKXCCM8_TLDS0_ULSGRO0_USL1_UIOFGRO0_USFGRO0_VSn1_VWA4_VWB2_WSGRA0_WSGRB0_WS64_WG32_8_1_WGM6_WGMXCC1_WGMXCCGn1
    SolutionIndex: 23
    SolutionNameMin: Cijk_Ailk_Bjlk_I8_BH_UserArgs_MT128x64x128_MI16x16x1_SN_LDSB1_AFC0_AFEM1_AFEM1_ASEM1_CLR1_CADS0_DTVA0_DTVB0_EPS0_FDSI0_GRPM1_GRVWA16_GRVWB8_GSU0_GSUAMB_GSUC0_GSUWGMRR0_GLS0_ISA950_IU1_K1_LBSPPA2048_LBSPPB1024_LBSPPM0_LPA64_LPB32_LPM0_LRVW16_LWPMn1_MIAV0_MIWT4_2_MO40_NTn1_NTA0_NTB0_NTC0_NTD0_NTM0_NEPBS0_NLCA1_NLCB1_ONLL1_PGR2_PLR1_PKA1_SIA3_SS1_SU0_SUM1_SUS128_SPO0_SRVW0_SSO0_SVW4_SK3_SKXCCM8_TLDS0_ULSGRO0_USL1_UIOFGRO0_USFGRO0_VSn1_VWA4_VWB2_WSGRA0_WSGRB0_WS64_WG32_8_1_WGM6_WGMXCC1_WGMXCCGn1
    SolutionIndex: 24
    SolutionNameMin: Cijk_Ailk_Bjlk_I8_BH_UserArgs_MT128x64x128_MI16x16x1_SN_LDSB1_AFC0_AFEM1_AFEM1_ASEM1_CLR1_CADS0_DTVA0_DTVB0_EPS0_FDSI0_GRPM1_GRVWA4_GRVWB16_GSU0_GSUAMB_GSUC0_GSUWGMRR0_GLS0_ISA950_IU1_K1_LBSPPA2048_LBSPPB1024_LBSPPM0_LPA64_LPB32_LPM0_LRVW16_LWPMn1_MIAV0_MIWT4_2_MO40_NTn1_NTA0_NTB0_NTC0_NTD0_NTM0_NEPBS0_NLCA1_NLCB1_ONLL1_PGR2_PLR1_PKA1_SIA3_SS1_SU0_SUM1_SUS128_SPO0_SRVW0_SSO0_SVW4_SK3_SKXCCM8_TLDS0_ULSGRO0_USL1_UIOFGRO0_USFGRO0_VSn1_VWA4_VWB2_WSGRA0_WSGRB0_WS64_WG32_8_1_WGM6_WGMXCC1_WGMXCCGn1
    SolutionIndex: 25
    SolutionNameMin: Cijk_Ailk_Bjlk_I8_BH_UserArgs_MT128x64x128_MI16x16x1_SN_LDSB1_AFC0_AFEM1_AFEM1_ASEM1_CLR1_CADS0_DTVA0_DTVB0_EPS0_FDSI0_GRPM1_GRVWA16_GRVWB16_GSU0_GSUAMB_GSUC0_GSUWGMRR0_GLS0_ISA950_IU1_K1_LBSPPA2048_LBSPPB1024_LBSPPM0_LPA64_LPB32_LPM0_LRVW16_LWPMn1_MIAV0_MIWT4_2_MO40_NTn1_NTA0_NTB0_NTC0_NTD0_NTM0_NEPBS0_NLCA1_NLCB1_ONLL1_PGR2_PLR1_PKA1_SIA3_SS1_SU0_SUM1_SUS128_SPO0_SRVW0_SSO0_SVW4_SK3_SKXCCM8_TLDS0_ULSGRO0_USL1_UIOFGRO0_USFGRO0_VSn1_VWA4_VWB2_WSGRA0_WSGRB0_WS64_WG32_8_1_WGM6_WGMXCC1_WGMXCCGn1
    SolutionIndex: 26
    SolutionNameMin: Cijk_Ailk_Bjlk_I8_BH_UserArgs_MT64x64x128_MI16x16x1_SN_LDSB1_AFC0_AFEM1_AFEM1_ASEM1_CLR1_CADS0_DTVA0_DTVB0_EPS0_FDSI0_GRPM1_GRVWA4_GRVWB4_GSU0_GSUAMB_GSUC0_GSUWGMRR0_GLS0_ISA950_IU1_K1_LBSPPA1024_LBSPPB1024_LBSPPM0_LPA32_LPB32_LPM0_LRVW16_LWPMn1_MIAV0_MIWT2_2_MO40_NTn1_NTA0_NTB0_NTC0_NTD0_NTM0_NEPBS0_NLCA1_NLCB1_ONLL1_PGR2_PLR1_PKA1_SIA3_SS1_SU0_SUM1_SUS128_SPO0_SRVW0_SSO0_SVW2_SK3_SKXCCM8_TLDS0_ULSGRO0_USL1_UIOFGRO0_USFGRO0_VSn1_VWA2_VWB2_WSGRA0_WSGRB0_WS64_WG32_8_1_WGM6_WGMXCC1_WGMXCCGn1
    SolutionIndex: 27
    SolutionNameMin: Cijk_Ailk_Bjlk_I8_BH_UserArgs_MT64x64x128_MI16x16x1_SN_LDSB1_AFC0_AFEM1_AFEM1_ASEM1_CLR1_CADS0_DTVA0_DTVB0_EPS0_FDSI0_GRPM1_GRVWA8_GRVWB4_GSU0_GSUAMB_GSUC0_GSUWGMRR0_GLS0_ISA950_IU1_K1_LBSPPA1024_LBSPPB1024_LBSPPM0_LPA32_LPB32_LPM0_LRVW16_LWPMn1_MIAV0_MIWT2_2_MO40_NTn1_NTA0_NTB0_NTC0_NTD0_NTM0_NEPBS0_NLCA1_NLCB1_ONLL1_PGR2_PLR1_PKA1_SIA3_SS1_SU0_SUM1_SUS128_SPO0_SRVW0_SSO0_SVW2_SK3_SKXCCM8_TLDS0_ULSGRO0_USL1_UIOFGRO0_USFGRO0_VSn1_VWA2_VWB2_WSGRA0_WSGRB0_WS64_WG32_8_1_WGM6_WGMXCC1_WGMXCCGn1
    SolutionIndex: 28
    SolutionNameMin: Cijk_Ailk_Bjlk_I8_BH_UserArgs_MT64x64x128_MI16x16x1_SN_LDSB1_AFC0_AFEM1_AFEM1_ASEM1_CLR1_CADS0_DTVA0_DTVB0_EPS0_FDSI0_GRPM1_GRVWA16_GRVWB4_GSU0_GSUAMB_GSUC0_GSUWGMRR0_GLS0_ISA950_IU1_K1_LBSPPA1024_LBSPPB1024_LBSPPM0_LPA32_LPB32_LPM0_LRVW16_LWPMn1_MIAV0_MIWT2_2_MO40_NTn1_NTA0_NTB0_NTC0_NTD0_NTM0_NEPBS0_NLCA1_NLCB1_ONLL1_PGR2_PLR1_PKA1_SIA3_SS1_SU0_SUM1_SUS128_SPO0_SRVW0_SSO0_SVW2_SK3_SKXCCM8_TLDS0_ULSGRO0_USL1_UIOFGRO0_USFGRO0_VSn1_VWA2_VWB2_WSGRA0_WSGRB0_WS64_WG32_8_1_WGM6_WGMXCC1_WGMXCCGn1
    SolutionIndex: 29
    SolutionNameMin: Cijk_Ailk_Bjlk_I8_BH_UserArgs_MT64x64x128_MI16x16x1_SN_LDSB1_AFC0_AFEM1_AFEM1_ASEM1_CLR1_CADS0_DTVA0_DTVB0_EPS0_FDSI0_GRPM1_GRVWA4_GRVWB8_GSU0_GSUAMB_GSUC0_GSUWGMRR0_GLS0_ISA950_IU1_K1_LBSPPA1024_LBSPPB1024_LBSPPM0_LPA32_LPB32_LPM0_LRVW16_LWPMn1_MIAV0_MIWT2_2_MO40_NTn1_NTA0_NTB0_NTC0_NTD0_NTM0_NEPBS0_NLCA1_NLCB1_ONLL1_PGR2_PLR1_PKA1_SIA3_SS1_SU0_SUM1_SUS128_SPO0_SRVW0_SSO0_SVW2_SK3_SKXCCM8_TLDS0_ULSGRO0_USL1_UIOFGRO0_USFGRO0_VSn1_VWA2_VWB2_WSGRA0_WSGRB0_WS64_WG32_8_1_WGM6_WGMXCC1_WGMXCCGn1
    SolutionIndex: 30
    SolutionNameMin: Cijk_Ailk_Bjlk_I8_BH_UserArgs_MT64x64x128_MI16x16x1_SN_LDSB1_AFC0_AFEM1_AFEM1_ASEM1_CLR1_CADS0_DTVA0_DTVB0_EPS0_FDSI0_GRPM1_GRVWA8_GRVWB8_GSU0_GSUAMB_GSUC0_GSUWGMRR0_GLS0_ISA950_IU1_K1_LBSPPA1024_LBSPPB1024_LBSPPM0_LPA32_LPB32_LPM0_LRVW16_LWPMn1_MIAV0_MIWT2_2_MO40_NTn1_NTA0_NTB0_NTC0_NTD0_NTM0_NEPBS0_NLCA1_NLCB1_ONLL1_PGR2_PLR1_PKA1_SIA3_SS1_SU0_SUM1_SUS128_SPO0_SRVW0_SSO0_SVW2_SK3_SKXCCM8_TLDS0_ULSGRO0_USL1_UIOFGRO0_USFGRO0_VSn1_VWA2_VWB2_WSGRA0_WSGRB0_WS64_WG32_8_1_WGM6_WGMXCC1_WGMXCCGn1
    SolutionIndex: 31
    SolutionNameMin: Cijk_Ailk_Bjlk_I8_BH_UserArgs_MT64x64x128_MI16x16x1_SN_LDSB1_AFC0_AFEM1_AFEM1_ASEM1_CLR1_CADS0_DTVA0_DTVB0_EPS0_FDSI0_GRPM1_GRVWA4_GRVWB16_GSU0_GSUAMB_GSUC0_GSUWGMRR0_GLS0_ISA950_IU1_K1_LBSPPA1024_LBSPPB1024_LBSPPM0_LPA32_LPB32_LPM0_LRVW16_LWPMn1_MIAV0_MIWT2_2_MO40_NTn1_NTA0_NTB0_NTC0_NTD0_NTM0_NEPBS0_NLCA1_NLCB1_ONLL1_PGR2_PLR1_PKA1_SIA3_SS1_SU0_SUM1_SUS128_SPO0_SRVW0_SSO0_SVW2_SK3_SKXCCM8_TLDS0_ULSGRO0_USL1_UIOFGRO0_USFGRO0_VSn1_VWA2_VWB2_WSGRA0_WSGRB0_WS64_WG32_8_1_WGM6_WGMXCC1_WGMXCCGn1
    SolutionIndex: 32
    SolutionNameMin: Cijk_Ailk_Bjlk_I8_BH_UserArgs_MT64x64x128_MI16x16x1_SN_LDSB1_AFC0_AFEM1_AFEM1_ASEM1_CLR1_CADS0_DTVA0_DTVB0_EPS0_FDSI0_GRPM1_GRVWA8_GRVWB16_GSU0_GSUAMB_GSUC0_GSUWGMRR0_GLS0_ISA950_IU1_K1_LBSPPA1024_LBSPPB1024_LBSPPM0_LPA32_LPB32_LPM0_LRVW16_LWPMn1_MIAV0_MIWT2_2_MO40_NTn1_NTA0_NTB0_NTC0_NTD0_NTM0_NEPBS0_NLCA1_NLCB1_ONLL1_PGR2_PLR1_PKA1_SIA3_SS1_SU0_SUM1_SUS128_SPO0_SRVW0_SSO0_SVW2_SK3_SKXCCM8_TLDS0_ULSGRO0_USL1_UIOFGRO0_USFGRO0_VSn1_VWA2_VWB2_WSGRA0_WSGRB0_WS64_WG32_8_1_WGM6_WGMXCC1_WGMXCCGn1
    SolutionIndex: 33
    SolutionNameMin: Cijk_Ailk_Bjlk_I8_BH_UserArgs_MT64x64x128_MI16x16x1_SN_LDSB1_AFC0_AFEM1_AFEM1_ASEM1_CLR1_CADS0_DTVA0_DTVB0_EPS0_FDSI0_GRPM1_GRVWA16_GRVWB16_GSU0_GSUAMB_GSUC0_GSUWGMRR0_GLS0_ISA950_IU1_K1_LBSPPA1024_LBSPPB1024_LBSPPM0_LPA32_LPB32_LPM0_LRVW16_LWPMn1_MIAV0_MIWT2_2_MO40_NTn1_NTA0_NTB0_NTC0_NTD0_NTM0_NEPBS0_NLCA1_NLCB1_ONLL1_PGR2_PLR1_PKA1_SIA3_SS1_SU0_SUM1_SUS128_SPO0_SRVW0_SSO0_SVW2_SK3_SKXCCM8_TLDS0_ULSGRO0_USL1_UIOFGRO0_USFGRO0_VSn1_VWA2_VWB2_WSGRA0_WSGRB0_WS64_WG32_8_1_WGM6_WGMXCC1_WGMXCCGn1
    SolutionIndex: 34
    SolutionNameMin: Cijk_Ailk_Bjlk_I8_BH_UserArgs_MT256x256x128_MI32x32x1_SN_LDSB0_AFC0_AFEM1_AFEM1_ASEM1_CLR1_CADS0_DTVA0_DTVB0_EPS0_FDSI0_GRPM1_GRVWA16_GRVWB8_GSU0_GSUAMB_GSUC0_GSUWGMRR0_GLS0_ISA950_IU1_K1_LBSPPA0_LBSPPB0_LBSPPM0_LPA0_LPB0_LPM0_LRVW16_LWPMn1_MIAV0_MIWT4_4_MO40_NTn1_NTA0_NTB0_NTC0_NTD0_NTM0_NEPBS0_NLCA1_NLCB1_ONLL1_PGR2_PLR2_PKA1_SIA3_SS1_SU0_SUM1_SUS128_SPO0_SRVW0_SSO0_SVW4_SK3_SKXCCM8_TLDS0_ULSGRO0_USL1_UIOFGRO0_USFGRO0_VSn1_VWA4_VWB4_WSGRA0_WSGRB0_WS64_WG64_4_1_WGM6_WGMXCC1_WGMXCCGn1
    SolutionIndex: 35
    SolutionNameMin: Cijk_Ailk_Bjlk_I8_BH_UserArgs_MT64x64x256_MI16x16x1_SN_LDSB1_AFC0_AFEM1_AFEM1_ASEM1_CLR1_CADS0_DTVA0_DTVB0_EPS0_FDSI0_GRPM1_GRVWA16_GRVWB16_GSU0_GSUAMB_GSUC0_GSUWGMRR0_GLS0_ISA950_IU1_K1_LBSPPA1024_LBSPPB1024_LBSPPM0_LPA32_LPB32_LPM0_LRVW16_LWPMn1_MIAV0_MIWT2_2_MO40_NTn1_NTA0_NTB0_NTC0_NTD0_NTM0_NEPBS0_NLCA1_NLCB1_ONLL1_PGR2_PLR1_PKA1_SIA3_SS1_SU0_SUM1_SUS256_SPO0_SRVW0_SSO0_SVW2_SK3_SKXCCM8_TLDS0_ULSGRO0_USL1_UIOFGRO0_USFGRO0_VSn1_VWA2_VWB2_WSGRA0_WSGRB0_WS64_WG32_8_1_WGM6_WGMXCC1_WGMXCCGn1
    SolutionIndex: 36
    SolutionNameMin: Cijk_Ailk_Bjlk_I8_BH_UserArgs_MT64x64x256_MI16x16x1_SN_LDSB1_AFC0_AFEM1_AFEM1_ASEM1_CLR1_CADS0_DTVA0_DTVB0_EPS0_FDSI0_GRPM1_GRVWA16_GRVWB16_GSU0_GSUAMB_GSUC0_GSUWGMRR0_GLS0_ISA950_IU1_K1_LBSPPA1024_LBSPPB1024_LBSPPM0_LPA32_LPB32_LPM0_LRVW16_LWPMn1_MIAV0_MIWT2_2_MO40_NTn1_NTA0_NTB0_NTC0_NTD0_NTM0_NEPBS0_NLCA1_NLCB1_ONLL1_PGR2_PLR2_PKA1_SIA3_SS1_SU0_SUM1_SUS256_SPO0_SRVW0_SSO0_SVW2_SK3_SKXCCM8_TLDS0_ULSGRO0_USL1_UIOFGRO0_USFGRO0_VSn1_VWA2_VWB2_WSGRA0_WSGRB0_WS64_WG32_8_1_WGM6_WGMXCC1_WGMXCCGn1
- - - [128, 128, 1, 128, 128, 128, 128, 128]
    - [26, 0.36]
  - - [128, 128, 1, 256, 128, 128, 128, 128]
    - [29, 0.61]
  - - [128, 128, 1, 512, 128, 128, 128, 128]
    - [26, 0.97]
  - - [128, 128, 1, 1024, 128, 128, 128, 128]
    - [35, 1.42]
  - - [128, 128, 1, 2048, 128, 128, 128, 128]
    - [36, 1.86]
  - - [128, 128, 1, 4096, 128, 128, 128, 128]
    - [36, 2.23]
  - - [128, 128, 1, 8192, 128, 128, 128, 128]
    - [36, 2.48]
  - - [128, 256, 1, 128, 128, 128, 128, 256]
    - [26, 0.69]
  - - [128, 256, 1, 256, 128, 128, 128, 256]
    - [29, 1.19]
  - - [128, 256, 1, 512, 128, 128, 128, 256]
    - [31, 1.91]
  - - [128, 256, 1, 1024, 128, 128, 128, 256]
    - [35, 2.79]
  - - [128, 256, 1, 2048, 128, 128, 128, 256]
    - [35, 3.7]
  - - [128, 256, 1, 4096, 128, 128, 128, 256]
    - [36, 4.42]
  - - [128, 256, 1, 8192, 128, 128, 128, 256]
    - [36, 4.92]
  - - [128, 512, 1, 128, 128, 128, 128, 512]
    - [26, 1.38]
  - - [128, 512, 1, 256, 128, 128, 128, 512]
    - [31, 2.38]
  - - [128, 512, 1, 512, 128, 128, 128, 512]
    - [31, 3.86]
  - - [128, 512, 1, 1024, 128, 128, 128, 512]
    - [35, 5.6]
  - - [128, 512, 1, 2048, 128, 128, 128, 512]
    - [35, 7.38]
  - - [128, 512, 1, 4096, 128, 128, 128, 512]
    - [36, 8.92]
  - - [128, 512, 1, 8192, 128, 128, 128, 512]
    - [36, 9.93]
  - - [128, 1024, 1, 128, 128, 128, 128, 1024]
    - [27, 2.77]
  - - [128, 1024, 1, 256, 128, 128, 128, 1024]
    - [26, 4.8]
  - - [128, 1024, 1, 512, 128, 128, 128, 1024]
    - [31, 7.68]
  - - [128, 1024, 1, 1024, 128, 128, 128, 1024]
    - [31, 10.99]
  - - [128, 1024, 1, 2048, 128, 128, 128, 1024]
    - [36, 14.67]
  - - [128, 1024, 1, 4096, 128, 128, 128, 1024]
    - [36, 17.68]
  - - [128, 1024, 1, 8192, 128, 128, 128, 1024]
    - [36, 19.93]
  - - [128, 2048, 1, 128, 128, 128, 128, 2048]
    - [26, 5.44]
  - - [128, 2048, 1, 256, 128, 128, 128, 2048]
    - [26, 9.31]
  - - [128, 2048, 1, 512, 128, 128, 128, 2048]
    - [31, 14.93]
  - - [128, 2048, 1, 1024, 128, 128, 128, 2048]
    - [31, 21.56]
  - - [128, 2048, 1, 2048, 128, 128, 128, 2048]
    - [36, 28.81]
  - - [128, 2048, 1, 4096, 128, 128, 128, 2048]
    - [35, 35.33]
  - - [128, 2048, 1, 8192, 128, 128, 128, 2048]
    - [35, 39.85]
  - - [128, 4096, 1, 128, 128, 128, 128, 4096]
    - [30, 10.63]
  - - [128, 4096, 1, 256, 128, 128, 128, 4096]
    - [26, 18.11]
  - - [128, 4096, 1, 512, 128, 128, 128, 4096]
    - [31, 29.03]
  - - [128, 4096, 1, 1024, 128, 128, 128, 4096]
    - [35, 42.34]
  - - [128, 4096, 1, 2048, 128, 128, 128, 4096]
    - [35, 57.0]
  - - [128, 4096, 1, 4096, 128, 128, 128, 4096]
    - [35, 69.45]
  - - [128, 4096, 1, 8192, 128, 128, 128, 4096]
    - [35, 77.52]
  - - [128, 8192, 1, 128, 128, 128, 128, 8192]
    - [10, 20.54]
  - - [128, 8192, 1, 256, 128, 128, 128, 8192]
    - [10, 34.81]
  - - [128, 8192, 1, 512, 128, 128, 128, 8192]
    - [31, 56.39]
  - - [128, 8192, 1, 1024, 128, 128, 128, 8192]
    - [32, 81.95]
  - - [128, 8192, 1, 2048, 128, 128, 128, 8192]
    - [35, 109.65]
  - - [128, 8192, 1, 4096, 128, 128, 128, 8192]
    - [35, 132.89]
  - - [128, 8192, 1, 8192, 128, 128, 128, 8192]
    - [35, 147.52]
  - - [256, 128, 1, 128, 256, 256, 256, 128]
    - [26, 0.69]
  - - [256, 128, 1, 256, 256, 256, 256, 128]
    - [29, 1.18]
  - - [256, 128, 1, 512, 256, 256, 256, 128]
    - [31, 1.92]
  - - [256, 128, 1, 1024, 256, 256, 256, 128]
    - [31, 2.78]
  - - [256, 128, 1, 2048, 256, 256, 256, 128]
    - [35, 3.54]
  - - [256, 128, 1, 4096, 256, 256, 256, 128]
    - [35, 4.2]
  - - [256, 128, 1, 8192, 256, 256, 256, 128]
    - [35, 4.61]
  - - [256, 256, 1, 128, 256, 256, 256, 256]
    - [26, 1.38]
  - - [256, 256, 1, 256, 256, 256, 256, 256]
    - [29, 2.39]
  - - [256, 256, 1, 512, 256, 256, 256, 256]
    - [29, 3.85]
  - - [256, 256, 1, 1024, 256, 256, 256, 256]
    - [36, 5.57]
  - - [256, 256, 1, 2048, 256, 256, 256, 256]
    - [36, 7.18]
  - - [256, 256, 1, 4096, 256, 256, 256, 256]
    - [35, 8.54]
  - - [256, 256, 1, 8192, 256, 256, 256, 256]
    - [35, 9.43]
  - - [256, 512, 1, 128, 256, 256, 256, 512]
    - [29, 2.79]
  - - [256, 512, 1, 256, 256, 256, 256, 512]
    - [31, 4.81]
  - - [256, 512, 1, 512, 256, 256, 256, 512]
    - [31, 7.77]
  - - [256, 512, 1, 1024, 256, 256, 256, 512]
    - [31, 11.09]
  - - [256, 512, 1, 2048, 256, 256, 256, 512]
    - [35, 14.43]
  - - [256, 512, 1, 4096, 256, 256, 256, 512]
    - [35, 17.13]
  - - [256, 512, 1, 8192, 256, 256, 256, 512]
    - [35, 19.02]
  - - [256, 1024, 1, 128, 256, 256, 256, 1024]
    - [10, 5.47]
  - - [256, 1024, 1, 256, 256, 256, 256, 1024]
    - [31, 9.5]
  - - [256, 1024, 1, 512, 256, 256, 256, 1024]
    - [31, 15.14]
  - - [256, 1024, 1, 1024, 256, 256, 256, 1024]
    - [36, 21.73]
  - - [256, 1024, 1, 2048, 256, 256, 256, 1024]
    - [35, 28.57]
  - - [256, 1024, 1, 4096, 256, 256, 256, 1024]
    - [35, 33.96]
  - - [256, 1024, 1, 8192, 256, 256, 256, 1024]
    - [35, 37.95]
  - - [256, 2048, 1, 128, 256, 256, 256, 2048]
    - [30, 10.68]
  - - [256, 2048, 1, 256, 256, 256, 256, 2048]
    - [31, 18.38]
  - - [256, 2048, 1, 512, 256, 256, 256, 2048]
    - [31, 29.43]
  - - [256, 2048, 1, 1024, 256, 256, 256, 2048]
    - [33, 42.6]
  - - [256, 2048, 1, 2048, 256, 256, 256, 2048]
    - [35, 56.42]
  - - [256, 2048, 1, 4096, 256, 256, 256, 2048]
    - [35, 67.45]
  - - [256, 2048, 1, 8192, 256, 256, 256, 2048]
    - [35, 75.47]
  - - [256, 4096, 1, 128, 256, 256, 256, 4096]
    - [27, 20.61]
  - - [256, 4096, 1, 256, 256, 256, 256, 4096]
    - [31, 35.28]
  - - [256, 4096, 1, 512, 256, 256, 256, 4096]
    - [33, 56.74]
  - - [256, 4096, 1, 1024, 256, 256, 256, 4096]
    - [31, 82.34]
  - - [256, 4096, 1, 2048, 256, 256, 256, 4096]
    - [35, 108.53]
  - - [256, 4096, 1, 4096, 256, 256, 256, 4096]
    - [35, 131.19]
  - - [256, 4096, 1, 8192, 256, 256, 256, 4096]
    - [35, 144.85]
  - - [256, 8192, 1, 128, 256, 256, 256, 8192]
    - [9, 36.98]
  - - [256, 8192, 1, 256, 256, 256, 256, 8192]
    - [18, 62.75]
  - - [256, 8192, 1, 512, 256, 256, 256, 8192]
    - [24, 102.0]
  - - [256, 8192, 1, 1024, 256, 256, 256, 8192]
    - [25, 150.59]
  - - [256, 8192, 1, 2048, 256, 256, 256, 8192]
    - [25, 194.77]
  - - [256, 8192, 1, 4096, 256, 256, 256, 8192]
    - [25, 228.85]
  - - [256, 8192, 1, 8192, 256, 256, 256, 8192]
    - [25, 251.08]
  - - [512, 128, 1, 128, 512, 512, 512, 128]
    - [26, 1.4]
  - - [512, 128, 1, 256, 512, 512, 512, 128]
    - [29, 2.4]
  - - [512, 128, 1, 512, 512, 512, 512, 128]
    - [31, 3.87]
  - - [512, 128, 1, 1024, 512, 512, 512, 128]
    - [29, 5.53]
  - - [512, 128, 1, 2048, 512, 512, 512, 128]
    - [33, 7.07]
  - - [512, 128, 1, 4096, 512, 512, 512, 128]
    - [31, 8.29]
  - - [512, 128, 1, 8192, 512, 512, 512, 128]
    - [31, 9.03]
  - - [512, 256, 1, 128, 512, 512, 512, 256]
    - [29, 2.75]
  - - [512, 256, 1, 256, 512, 512, 512, 256]
    - [26, 4.79]
  - - [512, 256, 1, 512, 512, 512, 512, 256]
    - [29, 7.74]
  - - [512, 256, 1, 1024, 512, 512, 512, 256]
    - [31, 11.03]
  - - [512, 256, 1, 2048, 512, 512, 512, 256]
    - [33, 14.12]
  - - [512, 256, 1, 4096, 512, 512, 512, 256]
    - [31, 16.47]
  - - [512, 256, 1, 8192, 512, 512, 512, 256]
    - [31, 18.12]
  - - [512, 512, 1, 128, 512, 512, 512, 512]
    - [29, 5.55]
  - - [512, 512, 1, 256, 512, 512, 512, 512]
    - [26, 9.57]
  - - [512, 512, 1, 512, 512, 512, 512, 512]
    - [29, 15.27]
  - - [512, 512, 1, 1024, 512, 512, 512, 512]
    - [31, 21.81]
  - - [512, 512, 1, 2048, 512, 512, 512, 512]
    - [33, 28.16]
  - - [512, 512, 1, 4096, 512, 512, 512, 512]
    - [31, 32.78]
  - - [512, 512, 1, 8192, 512, 512, 512, 512]
    - [32, 36.13]
  - - [512, 1024, 1, 128, 512, 512, 512, 1024]
    - [10, 10.84]
  - - [512, 1024, 1, 256, 512, 512, 512, 1024]
    - [29, 18.63]
  - - [512, 1024, 1, 512, 512, 512, 512, 1024]
    - [28, 29.72]
  - - [512, 1024, 1, 1024, 512, 512, 512, 1024]
    - [31, 43.11]
  - - [512, 1024, 1, 2048, 512, 512, 512, 1024]
    - [33, 55.07]
  - - [512, 1024, 1, 4096, 512, 512, 512, 1024]
    - [33, 65.08]
  - - [512, 1024, 1, 8192, 512, 512, 512, 1024]
    - [33, 72.04]
  - - [512, 2048, 1, 128, 512, 512, 512, 2048]
    - [26, 21.01]
  - - [512, 2048, 1, 256, 512, 512, 512, 2048]
    - [31, 35.78]
  - - [512, 2048, 1, 512, 512, 512, 512, 2048]
    - [29, 57.54]
  - - [512, 2048, 1, 1024, 512, 512, 512, 2048]
    - [32, 82.98]
  - - [512, 2048, 1, 2048, 512, 512, 512, 2048]
    - [33, 106.95]
  - - [512, 2048, 1, 4096, 512, 512, 512, 2048]
    - [33, 125.57]
  - - [512, 2048, 1, 8192, 512, 512, 512, 2048]
    - [33, 138.81]
  - - [512, 4096, 1, 128, 512, 512, 512, 4096]
    - [17, 36.64]
  - - [512, 4096, 1, 256, 512, 512, 512, 4096]
    - [22, 63.27]
  - - [512, 4096, 1, 512, 512, 512, 512, 4096]
    - [19, 102.5]
  - - [512, 4096, 1, 1024, 512, 512, 512, 4096]
    - [20, 149.31]
  - - [512, 4096, 1, 2048, 512, 512, 512, 4096]
    - [25, 195.76]
  - - [512, 4096, 1, 4096, 512, 512, 512, 4096]
    - [25, 229.62]
  - - [512, 4096, 1, 8192, 512, 512, 512, 4096]
    - [25, 249.82]
  - - [512, 8192, 1, 128, 512, 512, 512, 8192]
    - [6, 61.51]
  - - [512, 8192, 1, 256, 512, 512, 512, 8192]
    - [7, 105.72]
  - - [512, 8192, 1, 512, 512, 512, 512, 8192]
    - [16, 170.45]
  - - [512, 8192, 1, 1024, 512, 512, 512, 8192]
    - [16, 245.93]
  - - [512, 8192, 1, 2048, 512, 512, 512, 8192]
    - [16, 317.76]
  - - [512, 8192, 1, 4096, 512, 512, 512, 8192]
    - [16, 367.28]
  - - [512, 8192, 1, 8192, 512, 512, 512, 8192]
    - [16, 391.91]
  - - [1024, 128, 1, 128, 1024, 1024, 1024, 128]
    - [27, 2.78]
  - - [1024, 128, 1, 256, 1024, 1024, 1024, 128]
    - [26, 4.75]
  - - [1024, 128, 1, 512, 1024, 1024, 1024, 128]
    - [31, 7.65]
  - - [1024, 128, 1, 1024, 1024, 1024, 1024, 128]
    - [29, 11.04]
  - - [1024, 128, 1, 2048, 1024, 1024, 1024, 128]
    - [33, 14.05]
  - - [1024, 128, 1, 4096, 1024, 1024, 1024, 128]
    - [31, 16.49]
  - - [1024, 128, 1, 8192, 1024, 1024, 1024, 128]
    - [33, 18.04]
  - - [1024, 256, 1, 128, 1024, 1024, 1024, 256]
    - [26, 5.52]
  - - [1024, 256, 1, 256, 1024, 1024, 1024, 256]
    - [26, 9.46]
  - - [1024, 256, 1, 512, 1024, 1024, 1024, 256]
    - [26, 15.15]
  - - [1024, 256, 1, 1024, 1024, 1024, 1024, 256]
    - [31, 21.81]
  - - [1024, 256, 1, 2048, 1024, 1024, 1024, 256]
    - [31, 27.97]
  - - [1024, 256, 1, 4096, 1024, 1024, 1024, 256]
    - [33, 32.75]
  - - [1024, 256, 1, 8192, 1024, 1024, 1024, 256]
    - [33, 36.11]
  - - [1024, 512, 1, 128, 1024, 1024, 1024, 512]
    - [31, 10.89]
  - - [1024, 512, 1, 256, 1024, 1024, 1024, 512]
    - [31, 18.88]
  - - [1024, 512, 1, 512, 1024, 1024, 1024, 512]
    - [31, 29.96]
  - - [1024, 512, 1, 1024, 1024, 1024, 1024, 512]
    - [32, 43.04]
  - - [1024, 512, 1, 2048, 1024, 1024, 1024, 512]
    - [33, 55.66]
  - - [1024, 512, 1, 4096, 1024, 1024, 1024, 512]
    - [33, 65.25]
  - - [1024, 512, 1, 8192, 1024, 1024, 1024, 512]
    - [33, 71.9]
  - - [1024, 1024, 1, 128, 1024, 1024, 1024, 1024]
    - [26, 21.23]
  - - [1024, 1024, 1, 256, 1024, 1024, 1024, 1024]
    - [26, 36.44]
  - - [1024, 1024, 1, 512, 1024, 1024, 1024, 1024]
    - [29, 58.2]
  - - [1024, 1024, 1, 1024, 1024, 1024, 1024, 1024]
    - [33, 83.91]
  - - [1024, 1024, 1, 2048, 1024, 1024, 1024, 1024]
    - [33, 107.13]
  - - [1024, 1024, 1, 4096, 1024, 1024, 1024, 1024]
    - [33, 126.22]
  - - [1024, 1024, 1, 8192, 1024, 1024, 1024, 1024]
    - [33, 139.77]
  - - [1024, 2048, 1, 128, 1024, 1024, 1024, 2048]
    - [8, 36.82]
  - - [1024, 2048, 1, 256, 1024, 1024, 1024, 2048]
    - [21, 63.39]
  - - [1024, 2048, 1, 512, 1024, 1024, 1024, 2048]
    - [18, 103.31]
  - - [1024, 2048, 1, 1024, 1024, 1024, 1024, 2048]
    - [20, 150.18]
  - - [1024, 2048, 1, 2048, 1024, 1024, 1024, 2048]
    - [25, 196.52]
  - - [1024, 2048, 1, 4096, 1024, 1024, 1024, 2048]
    - [25, 229.02]
  - - [1024, 2048, 1, 8192, 1024, 1024, 1024, 2048]
    - [25, 250.97]
  - - [1024, 4096, 1, 128, 1024, 1024, 1024, 4096]
    - [6, 61.43]
  - - [1024, 4096, 1, 256, 1024, 1024, 1024, 4096]
    - [15, 106.07]
  - - [1024, 4096, 1, 512, 1024, 1024, 1024, 4096]
    - [16, 170.53]
  - - [1024, 4096, 1, 1024, 1024, 1024, 1024, 4096]
    - [16, 245.58]
  - - [1024, 4096, 1, 2048, 1024, 1024, 1024, 4096]
    - [16, 316.33]
  - - [1024, 4096, 1, 4096, 1024, 1024, 1024, 4096]
    - [16, 367.39]
  - - [1024, 4096, 1, 8192, 1024, 1024, 1024, 4096]
    - [16, 386.0]
  - - [1024, 8192, 1, 128, 1024, 1024, 1024, 8192]
    - [2, 91.77]
  - - [1024, 8192, 1, 256, 1024, 1024, 1024, 8192]
    - [5, 153.49]
  - - [1024, 8192, 1, 512, 1024, 1024, 1024, 8192]
    - [14, 238.71]
  - - [1024, 8192, 1, 1024, 1024, 1024, 1024, 8192]
    - [14, 335.91]
  - - [1024, 8192, 1, 2048, 1024, 1024, 1024, 8192]
    - [14, 413.76]
  - - [1024, 8192, 1, 4096, 1024, 1024, 1024, 8192]
    - [14, 467.87]
  - - [1024, 8192, 1, 8192, 1024, 1024, 1024, 8192]
    - [14, 485.2]
  - - [2048, 128, 1, 128, 2048, 2048, 2048, 128]
    - [27, 5.44]
  - - [2048, 128, 1, 256, 2048, 2048, 2048, 128]
    - [26, 9.5]
  - - [2048, 128, 1, 512, 2048, 2048, 2048, 128]
    - [28, 15.12]
  - - [2048, 128, 1, 1024, 2048, 2048, 2048, 128]
    - [26, 21.59]
  - - [2048, 128, 1, 2048, 2048, 2048, 2048, 128]
    - [33, 27.89]
  - - [2048, 128, 1, 4096, 2048, 2048, 2048, 128]
    - [33, 32.78]
  - - [2048, 128, 1, 8192, 2048, 2048, 2048, 128]
    - [33, 35.99]
  - - [2048, 256, 1, 128, 2048, 2048, 2048, 256]
    - [26, 10.88]
  - - [2048, 256, 1, 256, 2048, 2048, 2048, 256]
    - [29, 18.6]
  - - [2048, 256, 1, 512, 2048, 2048, 2048, 256]
    - [26, 30.04]
  - - [2048, 256, 1, 1024, 2048, 2048, 2048, 256]
    - [33, 42.98]
  - - [2048, 256, 1, 2048, 2048, 2048, 2048, 256]
    - [33, 55.28]
  - - [2048, 256, 1, 4096, 2048, 2048, 2048, 256]
    - [33, 65.11]
  - - [2048, 256, 1, 8192, 2048, 2048, 2048, 256]
    - [33, 71.87]
  - - [2048, 512, 1, 128, 2048, 2048, 2048, 512]
    - [26, 21.45]
  - - [2048, 512, 1, 256, 2048, 2048, 2048, 512]
    - [26, 35.99]
  - - [2048, 512, 1, 512, 2048, 2048, 2048, 512]
    - [31, 58.11]
  - - [2048, 512, 1, 1024, 2048, 2048, 2048, 512]
    - [31, 83.75]
  - - [2048, 512, 1, 2048, 2048, 2048, 2048, 512]
    - [32, 107.43]
  - - [2048, 512, 1, 4096, 2048, 2048, 2048, 512]
    - [33, 125.47]
  - - [2048, 512, 1, 8192, 2048, 2048, 2048, 512]
    - [33, 138.8]
  - - [2048, 1024, 1, 128, 2048, 2048, 2048, 1024]
    - [21, 37.07]
  - - [2048, 1024, 1, 256, 2048, 2048, 2048, 1024]
    - [22, 62.9]
  - - [2048, 1024, 1, 512, 2048, 2048, 2048, 1024]
    - [23, 101.86]
  - - [2048, 1024, 1, 1024, 2048, 2048, 2048, 1024]
    - [25, 150.69]
  - - [2048, 1024, 1, 2048, 2048, 2048, 2048, 1024]
    - [25, 195.41]
  - - [2048, 1024, 1, 4096, 2048, 2048, 2048, 1024]
    - [25, 229.0]
  - - [2048, 1024, 1, 8192, 2048, 2048, 2048, 1024]
    - [23, 249.84]
  - - [2048, 2048, 1, 128, 2048, 2048, 2048, 2048]
    - [7, 61.44]
  - - [2048, 2048, 1, 256, 2048, 2048, 2048, 2048]
    - [6, 105.32]
  - - [2048, 2048, 1, 512, 2048, 2048, 2048, 2048]
    - [16, 169.98]
  - - [2048, 2048, 1, 1024, 2048, 2048, 2048, 2048]
    - [16, 244.57]
  - - [2048, 2048, 1, 2048, 2048, 2048, 2048, 2048]
    - [16, 314.7]
  - - [2048, 2048, 1, 4096, 2048, 2048, 2048, 2048]
    - [16, 366.04]
  - - [2048, 2048, 1, 8192, 2048, 2048, 2048, 2048]
    - [16, 397.45]
  - - [2048, 4096, 1, 128, 2048, 2048, 2048, 4096]
    - [4, 91.27]
  - - [2048, 4096, 1, 256, 2048, 2048, 2048, 4096]
    - [3, 153.06]
  - - [2048, 4096, 1, 512, 2048, 2048, 2048, 4096]
    - [14, 237.82]
  - - [2048, 4096, 1, 1024, 2048, 2048, 2048, 4096]
    - [14, 334.39]
  - - [2048, 4096, 1, 2048, 2048, 2048, 2048, 4096]
    - [14, 418.38]
  - - [2048, 4096, 1, 4096, 2048, 2048, 2048, 4096]
    - [14, 466.68]
  - - [2048, 4096, 1, 8192, 2048, 2048, 2048, 4096]
    - [14, 485.4]
  - - [2048, 8192, 1, 128, 2048, 2048, 2048, 8192]
    - [1, 114.44]
  - - [2048, 8192, 1, 256, 2048, 2048, 2048, 8192]
    - [13, 200.32]
  - - [2048, 8192, 1, 512, 2048, 2048, 2048, 8192]
    - [13, 326.01]
  - - [2048, 8192, 1, 1024, 2048, 2048, 2048, 8192]
    - [13, 469.15]
  - - [2048, 8192, 1, 2048, 2048, 2048, 2048, 8192]
    - [13, 585.7]
  - - [2048, 8192, 1, 4096, 2048, 2048, 2048, 8192]
    - [13, 626.5]
  - - [2048, 8192, 1, 8192, 2048, 2048, 2048, 8192]
    - [13, 663.73]
  - - [4096, 128, 1, 128, 4096, 4096, 4096, 128]
    - [26, 10.86]
  - - [4096, 128, 1, 256, 4096, 4096, 4096, 128]
    - [26, 18.7]
  - - [4096, 128, 1, 512, 4096, 4096, 4096, 128]
    - [32, 29.45]
  - - [4096, 128, 1, 1024, 4096, 4096, 4096, 128]
    - [32, 42.63]
  - - [4096, 128, 1, 2048, 4096, 4096, 4096, 128]
    - [33, 55.19]
  - - [4096, 128, 1, 4096, 4096, 4096, 4096, 128]
    - [33, 64.98]
  - - [4096, 128, 1, 8192, 4096, 4096, 4096, 128]
    - [33, 71.72]
  - - [4096, 256, 1, 128, 4096, 4096, 4096, 256]
    - [26, 21.18]
  - - [4096, 256, 1, 256, 4096, 4096, 4096, 256]
    - [26, 36.18]
  - - [4096, 256, 1, 512, 4096, 4096, 4096, 256]
    - [26, 57.46]
  - - [4096, 256, 1, 1024, 4096, 4096, 4096, 256]
    - [31, 83.01]
  - - [4096, 256, 1, 2048, 4096, 4096, 4096, 256]
    - [33, 107.07]
  - - [4096, 256, 1, 4096, 4096, 4096, 4096, 256]
    - [31, 124.89]
  - - [4096, 256, 1, 8192, 4096, 4096, 4096, 256]
    - [33, 138.28]
  - - [4096, 512, 1, 128, 4096, 4096, 4096, 512]
    - [21, 37.03]
  - - [4096, 512, 1, 256, 4096, 4096, 4096, 512]
    - [21, 63.55]
  - - [4096, 512, 1, 512, 4096, 4096, 4096, 512]
    - [20, 102.63]
  - - [4096, 512, 1, 1024, 4096, 4096, 4096, 512]
    - [25, 150.88]
  - - [4096, 512, 1, 2048, 4096, 4096, 4096, 512]
    - [25, 193.6]
  - - [4096, 512, 1, 4096, 4096, 4096, 4096, 512]
    - [25, 229.95]
  - - [4096, 512, 1, 8192, 4096, 4096, 4096, 512]
    - [25, 250.85]
  - - [4096, 1024, 1, 128, 4096, 4096, 4096, 1024]
    - [6, 61.83]
  - - [4096, 1024, 1, 256, 4096, 4096, 4096, 1024]
    - [16, 105.97]
  - - [4096, 1024, 1, 512, 4096, 4096, 4096, 1024]
    - [16, 171.49]
  - - [4096, 1024, 1, 1024, 4096, 4096, 4096, 1024]
    - [16, 247.55]
  - - [4096, 1024, 1, 2048, 4096, 4096, 4096, 1024]
    - [16, 316.38]
  - - [4096, 1024, 1, 4096, 4096, 4096, 4096, 1024]
    - [16, 361.42]
  - - [4096, 1024, 1, 8192, 4096, 4096, 4096, 1024]
    - [16, 397.29]
  - - [4096, 2048, 1, 128, 4096, 4096, 4096, 2048]
    - [4, 91.95]
  - - [4096, 2048, 1, 256, 4096, 4096, 4096, 2048]
    - [4, 155.43]
  - - [4096, 2048, 1, 512, 4096, 4096, 4096, 2048]
    - [14, 237.95]
  - - [4096, 2048, 1, 1024, 4096, 4096, 4096, 2048]
    - [14, 336.09]
  - - [4096, 2048, 1, 2048, 4096, 4096, 4096, 2048]
    - [14, 418.1]
  - - [4096, 2048, 1, 4096, 4096, 4096, 4096, 2048]
    - [14, 460.7]
  - - [4096, 2048, 1, 8192, 4096, 4096, 4096, 2048]
    - [14, 503.04]
  - - [4096, 4096, 1, 128, 4096, 4096, 4096, 4096]
    - [0, 115.17]
  - - [4096, 4096, 1, 256, 4096, 4096, 4096, 4096]
    - [0, 199.4]
  - - [4096, 4096, 1, 512, 4096, 4096, 4096, 4096]
    - [13, 316.75]
  - - [4096, 4096, 1, 1024, 4096, 4096, 4096, 4096]
    - [13, 463.53]
  - - [4096, 4096, 1, 2048, 4096, 4096, 4096, 4096]
    - [13, 584.11]
  - - [4096, 4096, 1, 4096, 4096, 4096, 4096, 4096]
    - [13, 633.61]
  - - [4096, 4096, 1, 8192, 4096, 4096, 4096, 4096]
    - [13, 667.66]
  - - [4096, 8192, 1, 128, 4096, 4096, 4096, 8192]
    - [1, 132.1]
  - - [4096, 8192, 1, 256, 4096, 4096, 4096, 8192]
    - [11, 225.41]
  - - [4096, 8192, 1, 512, 4096, 4096, 4096, 8192]
    - [11, 352.86]
  - - [4096, 8192, 1, 1024, 4096, 4096, 4096, 8192]
    - [13, 492.9]
  - - [4096, 8192, 1, 2048, 4096, 4096, 4096, 8192]
    - [1, 567.36]
  - - [4096, 8192, 1, 4096, 4096, 4096, 4096, 8192]
    - [13, 630.19]
  - - [4096, 8192, 1, 8192, 4096, 4096, 4096, 8192]
    - [13, 718.25]
  - - [8192, 128, 1, 128, 8192, 8192, 8192, 128]
    - [29, 20.8]
  - - [8192, 128, 1, 256, 8192, 8192, 8192, 128]
    - [26, 35.24]
  - - [8192, 128, 1, 512, 8192, 8192, 8192, 128]
    - [26, 56.99]
  - - [8192, 128, 1, 1024, 8192, 8192, 8192, 128]
    - [29, 82.33]
  - - [8192, 128, 1, 2048, 8192, 8192, 8192, 128]
    - [33, 106.41]
  - - [8192, 128, 1, 4096, 8192, 8192, 8192, 128]
    - [33, 124.46]
  - - [8192, 128, 1, 8192, 8192, 8192, 8192, 128]
    - [33, 136.58]
  - - [8192, 256, 1, 128, 8192, 8192, 8192, 256]
    - [21, 37.01]
  - - [8192, 256, 1, 256, 8192, 8192, 8192, 256]
    - [22, 63.47]
  - - [8192, 256, 1, 512, 8192, 8192, 8192, 256]
    - [25, 102.44]
  - - [8192, 256, 1, 1024, 8192, 8192, 8192, 256]
    - [25, 150.06]
  - - [8192, 256, 1, 2048, 8192, 8192, 8192, 256]
    - [25, 194.72]
  - - [8192, 256, 1, 4096, 8192, 8192, 8192, 256]
    - [25, 229.32]
  - - [8192, 256, 1, 8192, 8192, 8192, 8192, 256]
    - [25, 248.29]
  - - [8192, 512, 1, 128, 8192, 8192, 8192, 512]
    - [6, 61.78]
  - - [8192, 512, 1, 256, 8192, 8192, 8192, 512]
    - [16, 105.8]
  - - [8192, 512, 1, 512, 8192, 8192, 8192, 512]
    - [16, 171.55]
  - - [8192, 512, 1, 1024, 8192, 8192, 8192, 512]
    - [16, 246.9]
  - - [8192, 512, 1, 2048, 8192, 8192, 8192, 512]
    - [16, 317.65]
  - - [8192, 512, 1, 4096, 8192, 8192, 8192, 512]
    - [16, 368.73]
  - - [8192, 512, 1, 8192, 8192, 8192, 8192, 512]
    - [16, 390.42]
  - - [8192, 1024, 1, 128, 8192, 8192, 8192, 1024]
    - [2, 92.17]
  - - [8192, 1024, 1, 256, 8192, 8192, 8192, 1024]
    - [5, 153.38]
  - - [8192, 1024, 1, 512, 8192, 8192, 8192, 1024]
    - [14, 238.56]
  - - [8192, 1024, 1, 1024, 8192, 8192, 8192, 1024]
    - [14, 330.9]
  - - [8192, 1024, 1, 2048, 8192, 8192, 8192, 1024]
    - [14, 408.39]
  - - [8192, 1024, 1, 4096, 8192, 8192, 8192, 1024]
    - [14, 459.59]
  - - [8192, 1024, 1, 8192, 8192, 8192, 8192, 1024]
    - [14, 479.01]
  - - [8192, 2048, 1, 128, 8192, 8192, 8192, 2048]
    - [0, 115.95]
  - - [8192, 2048, 1, 256, 8192, 8192, 8192, 2048]
    - [0, 200.48]
  - - [8192, 2048, 1, 512, 8192, 8192, 8192, 2048]
    - [13, 320.81]
  - - [8192, 2048, 1, 1024, 8192, 8192, 8192, 2048]
    - [13, 468.1]
  - - [8192, 2048, 1, 2048, 8192, 8192, 8192, 2048]
    - [13, 590.44]
  - - [8192, 2048, 1, 4096, 8192, 8192, 8192, 2048]
    - [12, 625.7]
  - - [8192, 2048, 1, 8192, 8192, 8192, 8192, 2048]
    - [34, 649.25]
  - - [8192, 4096, 1, 128, 8192, 8192, 8192, 4096]
    - [1, 132.49]
  - - [8192, 4096, 1, 256, 8192, 8192, 8192, 4096]
    - [13, 227.43]
  - - [8192, 4096, 1, 512, 8192, 8192, 8192, 4096]
    - [13, 357.3]
  - - [8192, 4096, 1, 1024, 8192, 8192, 8192, 4096]
    - [13, 495.72]
  - - [8192, 4096, 1, 2048, 8192, 8192, 8192, 4096]
    - [13, 593.24]
  - - [8192, 4096, 1, 4096, 8192, 8192, 8192, 4096]
    - [12, 628.25]
  - - [8192, 4096, 1, 8192, 8192, 8192, 8192, 4096]
    - [13, 717.53]
  - - [8192, 8192, 1, 128, 8192, 8192, 8192, 8192]
    - [1, 146.42]
  - - [8192, 8192, 1, 256, 8192, 8192, 8192, 8192]
    - [13, 244.88]
  - - [8192, 8192, 1, 512, 8192, 8192, 8192, 8192]
    - [13, 371.21]
  - - [8192, 8192, 1, 1024, 8192, 8192, 8192, 8192]
    - [13, 498.65]
  - - [8192, 8192, 1, 2048, 8192, 8192, 8192, 8192]
    - [13, 581.52]
  - - [8192, 8192, 1, 4096, 8192, 8192, 8192, 8192]
    - [13, 687.19]
  - - [8192, 8192, 1, 8192, 8192, 8192, 8192, 8192]
    - [13, 764.24]
- null
- null
- DeviceEfficiency
- GridBased
