projects/hipblaslt/library/src/amd_detail/rocblaslt/src/Tensile/Logic/asm_full/gfx950/gfx950/GridBased/gfx950_Cijk_Ailk_Bjlk_I8II_BH_UserArgs.yaml
- {MinimumRequiredVersion: 5.0.0}
- gfx950
- gfx950
- [Device 75a0]
    SolutionIndex: 0
    SolutionNameMin: Cijk_Ailk_Bjlk_I8II_BH_UserArgs_MT512x128x32_MI32x32x1_SN_LDSB0_AFC0_AFEM1_AFEM1_ASEM1_CLR0_CADS0_DTVA0_DTVB0_EPS0_FDSI0_GRPM1_GRVWA16_GRVWB4_GSU0_GSUAMB_GSUC0_GSUWGMRR0_GLS0_ISA950_IU1_K1_LBSPPA0_LBSPPB0_LBSPPM0_LPA0_LPB0_LPM0_LRVW16_LWPMn1_MIAV0_MIWT8_2_MO40_NTn1_NTA0_NTB0_NTC0_NTD0_NTM0_NEPBS0_NLCA1_NLCB1_ONLL1_PGR2_PLR0_PKA1_SIA3_SS1_SU0_SUM1_SUS32_SPO0_SRVW0_SSO0_SVW4_SK3_SKXCCM8_TLDS0_ULSGRO0_USL1_UIOFGRO0_USFGRO0_VSn1_VWA4_VWB2_WSGRA0_WSGRB0_WS64_WG64_4_1_WGM6_WGMXCC1_WGMXCCGn1
    SolutionIndex: 1
    SolutionNameMin: Cijk_Ailk_Bjlk_I8II_BH_UserArgs_MT256x128x32_MI32x32x1_SN_LDSB0_AFC0_AFEM1_AFEM1_ASEM1_CLR0_CADS0_DTVA0_DTVB0_EPS0_FDSI0_GRPM1_GRVWA4_GRVWB4_GSU0_GSUAMB_GSUC0_GSUWGMRR0_GLS0_ISA950_IU1_K1_LBSPPA0_LBSPPB0_LBSPPM0_LPA0_LPB0_LPM0_LRVW16_LWPMn1_MIAV0_MIWT4_2_MO40_NTn1_NTA0_NTB0_NTC0_NTD0_NTM0_NEPBS0_NLCA1_NLCB1_ONLL1_PGR2_PLR0_PKA1_SIA3_SS1_SU0_SUM1_SUS32_SPO0_SRVW0_SSO0_SVW4_SK3_SKXCCM8_TLDS0_ULSGRO0_USL1_UIOFGRO0_USFGRO0_VSn1_VWA4_VWB2_WSGRA0_WSGRB0_WS64_WG64_4_1_WGM6_WGMXCC1_WGMXCCGn1
    SolutionIndex: 2
    SolutionNameMin: Cijk_Ailk_Bjlk_I8II_BH_UserArgs_MT256x128x32_MI32x32x1_SN_LDSB0_AFC0_AFEM1_AFEM1_ASEM1_CLR0_CADS0_DTVA0_DTVB0_EPS0_FDSI0_GRPM1_GRVWA8_GRVWB4_GSU0_GSUAMB_GSUC0_GSUWGMRR0_GLS0_ISA950_IU1_K1_LBSPPA0_LBSPPB0_LBSPPM0_LPA0_LPB0_LPM0_LRVW16_LWPMn1_MIAV0_MIWT4_2_MO40_NTn1_NTA0_NTB0_NTC0_NTD0_NTM0_NEPBS0_NLCA1_NLCB1_ONLL1_PGR2_PLR0_PKA1_SIA3_SS1_SU0_SUM1_SUS32_SPO0_SRVW0_SSO0_SVW4_SK3_SKXCCM8_TLDS0_ULSGRO0_USL1_UIOFGRO0_USFGRO0_VSn1_VWA4_VWB2_WSGRA0_WSGRB0_WS64_WG64_4_1_WGM6_WGMXCC1_WGMXCCGn1
    SolutionIndex: 3
    SolutionNameMin: Cijk_Ailk_Bjlk_I8II_BH_UserArgs_MT128x128x64_MI16x16x1_SN_LDSB1_AFC0_AFEM1_AFEM1_ASEM1_CLR0_CADS0_DTVA0_DTVB0_EPS0_FDSI0_GRPM1_GRVWA4_GRVWB4_GSU0_GSUAMB_GSUC0_GSUWGMRR0_GLS0_ISA950_IU1_K1_LBSPPA2048_LBSPPB2048_LBSPPM0_LPA32_LPB64_LPM0_LRVW16_LWPMn1_MIAV0_MIWT4_4_MO40_NTn1_NTA0_NTB0_NTC0_NTD0_NTM0_NEPBS0_NLCA1_NLCB1_ONLL1_PGR2_PLR0_PKA1_SIA3_SS1_SU0_SUM1_SUS64_SPO0_SRVW0_SSO0_SVW2_SK3_SKXCCM8_TLDS0_ULSGRO0_USL1_UIOFGRO0_USFGRO0_VSn1_VWA2_VWB4_WSGRA0_WSGRB0_WS64_WG32_8_1_WGM6_WGMXCC1_WGMXCCGn1
    SolutionIndex: 4
    SolutionNameMin: Cijk_Ailk_Bjlk_I8II_BH_UserArgs_MT128x128x64_MI16x16x1_SN_LDSB1_AFC0_AFEM1_AFEM1_ASEM1_CLR0_CADS0_DTVA0_DTVB0_EPS0_FDSI0_GRPM1_GRVWA4_GRVWB16_GSU0_GSUAMB_GSUC0_GSUWGMRR0_GLS0_ISA950_IU1_K1_LBSPPA2048_LBSPPB2048_LBSPPM0_LPA64_LPB64_LPM0_LRVW16_LWPMn1_MIAV0_MIWT4_4_MO40_NTn1_NTA0_NTB0_NTC0_NTD0_NTM0_NEPBS0_NLCA1_NLCB1_ONLL1_PGR2_PLR0_PKA1_SIA3_SS1_SU0_SUM1_SUS64_SPO0_SRVW0_SSO0_SVW4_SK3_SKXCCM8_TLDS0_ULSGRO0_USL1_UIOFGRO0_USFGRO0_VSn1_VWA4_VWB4_WSGRA0_WSGRB0_WS64_WG32_8_1_WGM6_WGMXCC1_WGMXCCGn1
    SolutionIndex: 5
    SolutionNameMin: Cijk_Ailk_Bjlk_I8II_BH_UserArgs_MT128x64x64_MI16x16x1_SN_LDSB0_AFC0_AFEM1_AFEM1_ASEM1_CLR0_CADS0_DTVA0_DTVB0_EPS0_FDSI0_GRPM1_GRVWA4_GRVWB4_GSU0_GSUAMB_GSUC0_GSUWGMRR0_GLS0_ISA950_IU1_K1_LBSPPA2048_LBSPPB1024_LBSPPM0_LPA64_LPB32_LPM0_LRVW16_LWPMn1_MIAV0_MIWT4_2_MO40_NTn1_NTA0_NTB0_NTC0_NTD0_NTM0_NEPBS0_NLCA1_NLCB1_ONLL1_PGR2_PLR0_PKA1_SIA3_SS1_SU0_SUM1_SUS64_SPO0_SRVW0_SSO0_SVW4_SK3_SKXCCM8_TLDS0_ULSGRO0_USL1_UIOFGRO0_USFGRO0_VSn1_VWA4_VWB2_WSGRA0_WSGRB0_WS64_WG32_8_1_WGM6_WGMXCC1_WGMXCCGn1
    SolutionIndex: 6
    SolutionNameMin: Cijk_Ailk_Bjlk_I8II_BH_UserArgs_MT256x256x64_MI32x32x1_SN_LDSB0_AFC0_AFEM1_AFEM1_ASEM1_CLR1_CADS0_DTVA0_DTVB0_EPS0_FDSI0_GRPM1_GRVWA16_GRVWB4_GSU0_GSUAMB_GSUC0_GSUWGMRR0_GLS0_ISA950_IU1_K1_LBSPPA0_LBSPPB0_LBSPPM0_LPA0_LPB0_LPM0_LRVW16_LWPMn1_MIAV0_MIWT4_4_MO40_NTn1_NTA0_NTB0_NTC0_NTD0_NTM0_NEPBS0_NLCA1_NLCB1_ONLL1_PGR2_PLR1_PKA1_SIA3_SS1_SU0_SUM1_SUS64_SPO0_SRVW0_SSO0_SVW4_SK3_SKXCCM8_TLDS0_ULSGRO0_USL1_UIOFGRO0_USFGRO0_VSn1_VWA4_VWB2_WSGRA0_WSGRB0_WS64_WG64_4_1_WGM6_WGMXCC1_WGMXCCGn1
    SolutionIndex: 7
    SolutionNameMin: Cijk_Ailk_Bjlk_I8II_BH_UserArgs_MT256x256x64_MI32x32x1_SN_LDSB0_AFC0_AFEM1_AFEM1_ASEM1_CLR1_CADS0_DTVA0_DTVB0_EPS0_FDSI0_GRPM1_GRVWA16_GRVWB4_GSU0_GSUAMB_GSUC0_GSUWGMRR0_GLS0_ISA950_IU1_K1_LBSPPA0_LBSPPB0_LBSPPM0_LPA0_LPB0_LPM0_LRVW16_LWPMn1_MIAV0_MIWT4_4_MO40_NTn1_NTA0_NTB0_NTC0_NTD0_NTM0_NEPBS0_NLCA1_NLCB1_ONLL1_PGR2_PLR1_PKA1_SIA3_SS1_SU0_SUM1_SUS64_SPO0_SRVW0_SSO0_SVW4_SK3_SKXCCM8_TLDS0_ULSGRO0_USL1_UIOFGRO0_USFGRO0_VSn1_VWA4_VWB4_WSGRA0_WSGRB0_WS64_WG64_4_1_WGM6_WGMXCC1_WGMXCCGn1
    SolutionIndex: 8
    SolutionNameMin: Cijk_Ailk_Bjlk_I8II_BH_UserArgs_MT256x256x64_MI32x32x1_SN_LDSB0_AFC0_AFEM1_AFEM1_ASEM1_CLR1_CADS0_DTVA0_DTVB0_EPS0_FDSI0_GRPM1_GRVWA4_GRVWB8_GSU0_GSUAMB_GSUC0_GSUWGMRR0_GLS0_ISA950_IU1_K1_LBSPPA0_LBSPPB0_LBSPPM0_LPA0_LPB0_LPM0_LRVW16_LWPMn1_MIAV0_MIWT4_4_MO40_NTn1_NTA0_NTB0_NTC0_NTD0_NTM0_NEPBS0_NLCA1_NLCB1_ONLL1_PGR2_PLR1_PKA1_SIA3_SS1_SU0_SUM1_SUS64_SPO0_SRVW0_SSO0_SVW4_SK3_SKXCCM8_TLDS0_ULSGRO0_USL1_UIOFGRO0_USFGRO0_VSn1_VWA4_VWB4_WSGRA0_WSGRB0_WS64_WG64_4_1_WGM6_WGMXCC1_WGMXCCGn1
    SolutionIndex: 9
    SolutionNameMin: Cijk_Ailk_Bjlk_I8II_BH_UserArgs_MT256x256x64_MI32x32x1_SN_LDSB0_AFC0_AFEM1_AFEM1_ASEM1_CLR1_CADS0_DTVA0_DTVB0_EPS0_FDSI0_GRPM1_GRVWA8_GRVWB8_GSU0_GSUAMB_GSUC0_GSUWGMRR0_GLS0_ISA950_IU1_K1_LBSPPA0_LBSPPB0_LBSPPM0_LPA0_LPB0_LPM0_LRVW16_LWPMn1_MIAV0_MIWT4_4_MO40_NTn1_NTA0_NTB0_NTC0_NTD0_NTM0_NEPBS0_NLCA1_NLCB1_ONLL1_PGR2_PLR1_PKA1_SIA3_SS1_SU0_SUM1_SUS64_SPO0_SRVW0_SSO0_SVW4_SK3_SKXCCM8_TLDS0_ULSGRO0_USL1_UIOFGRO0_USFGRO0_VSn1_VWA4_VWB2_WSGRA0_WSGRB0_WS64_WG64_4_1_WGM6_WGMXCC1_WGMXCCGn1
    SolutionIndex: 10
    SolutionNameMin: Cijk_Ailk_Bjlk_I8II_BH_UserArgs_MT256x256x64_MI32x32x1_SN_LDSB0_AFC0_AFEM1_AFEM1_ASEM1_CLR1_CADS0_DTVA0_DTVB0_EPS0_FDSI0_GRPM1_GRVWA16_GRVWB8_GSU0_GSUAMB_GSUC0_GSUWGMRR0_GLS0_ISA950_IU1_K1_LBSPPA0_LBSPPB0_LBSPPM0_LPA0_LPB0_LPM0_LRVW16_LWPMn1_MIAV0_MIWT4_4_MO40_NTn1_NTA0_NTB0_NTC0_NTD0_NTM0_NEPBS0_NLCA1_NLCB1_ONLL1_PGR2_PLR1_PKA1_SIA3_SS1_SU0_SUM1_SUS64_SPO0_SRVW0_SSO0_SVW4_SK3_SKXCCM8_TLDS0_ULSGRO0_USL1_UIOFGRO0_USFGRO0_VSn1_VWA4_VWB2_WSGRA0_WSGRB0_WS64_WG64_4_1_WGM6_WGMXCC1_WGMXCCGn1
    SolutionIndex: 11
    SolutionNameMin: Cijk_Ailk_Bjlk_I8II_BH_UserArgs_MT256x256x64_MI32x32x1_SN_LDSB0_AFC0_AFEM1_AFEM1_ASEM1_CLR1_CADS0_DTVA0_DTVB0_EPS0_FDSI0_GRPM1_GRVWA16_GRVWB8_GSU0_GSUAMB_GSUC0_GSUWGMRR0_GLS0_ISA950_IU1_K1_LBSPPA0_LBSPPB0_LBSPPM0_LPA0_LPB0_LPM0_LRVW16_LWPMn1_MIAV0_MIWT4_4_MO40_NTn1_NTA0_NTB0_NTC0_NTD0_NTM0_NEPBS0_NLCA1_NLCB1_ONLL1_PGR2_PLR1_PKA1_SIA3_SS1_SU0_SUM1_SUS64_SPO0_SRVW0_SSO0_SVW4_SK3_SKXCCM8_TLDS0_ULSGRO0_USL1_UIOFGRO0_USFGRO0_VSn1_VWA4_VWB4_WSGRA0_WSGRB0_WS64_WG64_4_1_WGM6_WGMXCC1_WGMXCCGn1
    SolutionIndex: 12
    SolutionNameMin: Cijk_Ailk_Bjlk_I8II_BH_UserArgs_MT128x256x64_MI32x32x1_SN_LDSB1_AFC0_AFEM1_AFEM1_ASEM1_CLR1_CADS0_DTVA0_DTVB0_EPS0_FDSI0_GRPM1_GRVWA4_GRVWB4_GSU0_GSUAMB_GSUC0_GSUWGMRR0_GLS0_ISA950_IU1_K1_LBSPPA0_LBSPPB0_LBSPPM0_LPA0_LPB0_LPM0_LRVW16_LWPMn1_MIAV0_MIWT2_4_MO40_NTn1_NTA0_NTB0_NTC0_NTD0_NTM0_NEPBS0_NLCA1_NLCB1_ONLL1_PGR2_PLR1_PKA1_SIA3_SS1_SU0_SUM1_SUS64_SPO0_SRVW0_SSO0_SVW2_SK3_SKXCCM8_TLDS0_ULSGRO0_USL1_UIOFGRO0_USFGRO0_VSn1_VWA2_VWB4_WSGRA0_WSGRB0_WS64_WG64_4_1_WGM6_WGMXCC1_WGMXCCGn1
    SolutionIndex: 13
    SolutionNameMin: Cijk_Ailk_Bjlk_I8II_BH_UserArgs_MT128x256x64_MI32x32x1_SN_LDSB1_AFC0_AFEM1_AFEM1_ASEM1_CLR1_CADS0_DTVA0_DTVB0_EPS0_FDSI0_GRPM1_GRVWA16_GRVWB4_GSU0_GSUAMB_GSUC0_GSUWGMRR0_GLS0_ISA950_IU1_K1_LBSPPA0_LBSPPB0_LBSPPM0_LPA0_LPB0_LPM0_LRVW16_LWPMn1_MIAV0_MIWT2_4_MO40_NTn1_NTA0_NTB0_NTC0_NTD0_NTM0_NEPBS0_NLCA1_NLCB1_ONLL1_PGR2_PLR1_PKA1_SIA3_SS1_SU0_SUM1_SUS64_SPO0_SRVW0_SSO0_SVW2_SK3_SKXCCM8_TLDS0_ULSGRO0_USL1_UIOFGRO0_USFGRO0_VSn1_VWA2_VWB4_WSGRA0_WSGRB0_WS64_WG64_4_1_WGM6_WGMXCC1_WGMXCCGn1
    SolutionIndex: 14
    SolutionNameMin: Cijk_Ailk_Bjlk_I8II_BH_UserArgs_MT256x128x64_MI32x32x1_SN_LDSB1_AFC0_AFEM1_AFEM1_ASEM1_CLR1_CADS0_DTVA0_DTVB0_EPS0_FDSI0_GRPM1_GRVWA16_GRVWB8_GSU0_GSUAMB_GSUC0_GSUWGMRR0_GLS0_ISA950_IU1_K1_LBSPPA0_LBSPPB0_LBSPPM0_LPA0_LPB0_LPM0_LRVW16_LWPMn1_MIAV0_MIWT4_2_MO40_NTn1_NTA0_NTB0_NTC0_NTD0_NTM0_NEPBS0_NLCA1_NLCB1_ONLL1_PGR2_PLR1_PKA1_SIA3_SS1_SU0_SUM1_SUS64_SPO0_SRVW0_SSO0_SVW4_SK3_SKXCCM8_TLDS0_ULSGRO0_USL1_UIOFGRO0_USFGRO0_VSn1_VWA4_VWB2_WSGRA0_WSGRB0_WS64_WG64_4_1_WGM6_WGMXCC1_WGMXCCGn1
    SolutionIndex: 15
    SolutionNameMin: Cijk_Ailk_Bjlk_I8II_BH_UserArgs_MT128x256x128_MI16x16x1_SN_LDSB1_AFC0_AFEM1_AFEM1_ASEM1_CLR1_CADS0_DTVA0_DTVB0_EPS0_FDSI0_GRPM1_GRVWA4_GRVWB16_GSU0_GSUAMB_GSUC0_GSUWGMRR0_GLS0_ISA950_IU1_K1_LBSPPA2048_LBSPPB4096_LBSPPM0_LPA64_LPB0_LPM0_LRVW16_LWPMn1_MIAV0_MIWT4_8_MO40_NTn1_NTA0_NTB0_NTC0_NTD0_NTM0_NEPBS0_NLCA1_NLCB1_ONLL1_PGR2_PLR1_PKA1_SIA3_SS1_SU0_SUM1_SUS128_SPO0_SRVW0_SSO0_SVW4_SK3_SKXCCM8_TLDS0_ULSGRO0_USL1_UIOFGRO0_USFGRO0_VSn1_VWA4_VWB8_WSGRA0_WSGRB0_WS64_WG32_8_1_WGM6_WGMXCC1_WGMXCCGn1
    SolutionIndex: 16
    SolutionNameMin: Cijk_Ailk_Bjlk_I8II_BH_UserArgs_MT128x256x128_MI16x16x1_SN_LDSB1_AFC0_AFEM1_AFEM1_ASEM1_CLR1_CADS0_DTVA0_DTVB0_EPS0_FDSI0_GRPM1_GRVWA16_GRVWB16_GSU0_GSUAMB_GSUC0_GSUWGMRR0_GLS0_ISA950_IU1_K1_LBSPPA2048_LBSPPB4096_LBSPPM0_LPA64_LPB64_LPM0_LRVW16_LWPMn1_MIAV0_MIWT4_8_MO40_NTn1_NTA0_NTB0_NTC0_NTD0_NTM0_NEPBS0_NLCA1_NLCB1_ONLL1_PGR2_PLR1_PKA1_SIA3_SS1_SU0_SUM1_SUS128_SPO0_SRVW0_SSO0_SVW4_SK3_SKXCCM8_TLDS0_ULSGRO0_USL1_UIOFGRO0_USFGRO0_VSn1_VWA4_VWB4_WSGRA0_WSGRB0_WS64_WG32_8_1_WGM6_WGMXCC1_WGMXCCGn1
    SolutionIndex: 17
    SolutionNameMin: Cijk_Ailk_Bjlk_I8II_BH_UserArgs_MT128x256x128_MI16x16x1_SN_LDSB1_AFC0_AFEM1_AFEM1_ASEM1_CLR1_CADS0_DTVA0_DTVB0_EPS0_FDSI0_GRPM1_GRVWA16_GRVWB16_GSU0_GSUAMB_GSUC0_GSUWGMRR0_GLS0_ISA950_IU1_K1_LBSPPA2048_LBSPPB4096_LBSPPM0_LPA64_LPB0_LPM0_LRVW16_LWPMn1_MIAV0_MIWT4_8_MO40_NTn1_NTA0_NTB0_NTC0_NTD0_NTM0_NEPBS0_NLCA1_NLCB1_ONLL1_PGR2_PLR1_PKA1_SIA3_SS1_SU0_SUM1_SUS128_SPO0_SRVW0_SSO0_SVW4_SK3_SKXCCM8_TLDS0_ULSGRO0_USL1_UIOFGRO0_USFGRO0_VSn1_VWA4_VWB8_WSGRA0_WSGRB0_WS64_WG32_8_1_WGM6_WGMXCC1_WGMXCCGn1
    SolutionIndex: 18
    SolutionNameMin: Cijk_Ailk_Bjlk_I8II_BH_UserArgs_MT256x128x128_MI16x16x1_SN_LDSB1_AFC0_AFEM1_AFEM1_ASEM1_CLR1_CADS0_DTVA0_DTVB0_EPS0_FDSI0_GRPM1_GRVWA16_GRVWB16_GSU0_GSUAMB_GSUC0_GSUWGMRR0_GLS0_ISA950_IU1_K1_LBSPPA4096_LBSPPB2048_LBSPPM0_LPA64_LPB64_LPM0_LRVW16_LWPMn1_MIAV0_MIWT8_4_MO40_NTn1_NTA0_NTB0_NTC0_NTD0_NTM0_NEPBS0_NLCA1_NLCB1_ONLL1_PGR2_PLR1_PKA1_SIA3_SS1_SU0_SUM1_SUS128_SPO0_SRVW0_SSO0_SVW4_SK3_SKXCCM8_TLDS0_ULSGRO0_USL1_UIOFGRO0_USFGRO0_VSn1_VWA4_VWB4_WSGRA0_WSGRB0_WS64_WG32_8_1_WGM6_WGMXCC1_WGMXCCGn1
    SolutionIndex: 19
    SolutionNameMin: Cijk_Ailk_Bjlk_I8II_BH_UserArgs_MT256x128x128_MI16x16x1_SN_LDSB1_AFC0_AFEM1_AFEM1_ASEM1_CLR1_CADS0_DTVA0_DTVB0_EPS0_FDSI0_GRPM1_GRVWA16_GRVWB16_GSU0_GSUAMB_GSUC0_GSUWGMRR0_GLS0_ISA950_IU1_K1_LBSPPA4096_LBSPPB2048_LBSPPM0_LPA0_LPB64_LPM0_LRVW16_LWPMn1_MIAV0_MIWT8_4_MO40_NTn1_NTA0_NTB0_NTC0_NTD0_NTM0_NEPBS0_NLCA1_NLCB1_ONLL1_PGR2_PLR1_PKA1_SIA3_SS1_SU0_SUM1_SUS128_SPO0_SRVW0_SSO0_SVW8_SK3_SKXCCM8_TLDS0_ULSGRO0_USL1_UIOFGRO0_USFGRO0_VSn1_VWA8_VWB4_WSGRA0_WSGRB0_WS64_WG32_8_1_WGM6_WGMXCC1_WGMXCCGn1
    SolutionIndex: 20
    SolutionNameMin: Cijk_Ailk_Bjlk_I8II_BH_UserArgs_MT128x128x128_MI16x16x1_SN_LDSB1_AFC0_AFEM1_AFEM1_ASEM1_CLR1_CADS0_DTVA0_DTVB0_EPS0_FDSI0_GRPM1_GRVWA4_GRVWB4_GSU0_GSUAMB_GSUC0_GSUWGMRR0_GLS0_ISA950_IU1_K1_LBSPPA2048_LBSPPB2048_LBSPPM0_LPA64_LPB32_LPM0_LRVW16_LWPMn1_MIAV0_MIWT4_4_MO40_NTn1_NTA0_NTB0_NTC0_NTD0_NTM0_NEPBS0_NLCA1_NLCB1_ONLL1_PGR2_PLR1_PKA1_SIA3_SS1_SU0_SUM1_SUS128_SPO0_SRVW0_SSO0_SVW4_SK3_SKXCCM8_TLDS0_ULSGRO0_USL1_UIOFGRO0_USFGRO0_VSn1_VWA4_VWB2_WSGRA0_WSGRB0_WS64_WG32_8_1_WGM6_WGMXCC1_WGMXCCGn1
    SolutionIndex: 21
    SolutionNameMin: Cijk_Ailk_Bjlk_I8II_BH_UserArgs_MT128x128x128_MI16x16x1_SN_LDSB1_AFC0_AFEM1_AFEM1_ASEM1_CLR1_CADS0_DTVA0_DTVB0_EPS0_FDSI0_GRPM1_GRVWA4_GRVWB4_GSU0_GSUAMB_GSUC0_GSUWGMRR0_GLS0_ISA950_IU1_K1_LBSPPA2048_LBSPPB2048_LBSPPM0_LPA64_LPB64_LPM0_LRVW16_LWPMn1_MIAV0_MIWT4_4_MO40_NTn1_NTA0_NTB0_NTC0_NTD0_NTM0_NEPBS0_NLCA1_NLCB1_ONLL1_PGR2_PLR1_PKA1_SIA3_SS1_SU0_SUM1_SUS128_SPO0_SRVW0_SSO0_SVW4_SK3_SKXCCM8_TLDS0_ULSGRO0_USL1_UIOFGRO0_USFGRO0_VSn1_VWA4_VWB4_WSGRA0_WSGRB0_WS64_WG32_8_1_WGM6_WGMXCC1_WGMXCCGn1
    SolutionIndex: 22
    SolutionNameMin: Cijk_Ailk_Bjlk_I8II_BH_UserArgs_MT128x128x128_MI16x16x1_SN_LDSB1_AFC0_AFEM1_AFEM1_ASEM1_CLR1_CADS0_DTVA0_DTVB0_EPS0_FDSI0_GRPM1_GRVWA4_GRVWB8_GSU0_GSUAMB_GSUC0_GSUWGMRR0_GLS0_ISA950_IU1_K1_LBSPPA2048_LBSPPB2048_LBSPPM0_LPA64_LPB32_LPM0_LRVW16_LWPMn1_MIAV0_MIWT4_4_MO40_NTn1_NTA0_NTB0_NTC0_NTD0_NTM0_NEPBS0_NLCA1_NLCB1_ONLL1_PGR2_PLR1_PKA1_SIA3_SS1_SU0_SUM1_SUS128_SPO0_SRVW0_SSO0_SVW4_SK3_SKXCCM8_TLDS0_ULSGRO0_USL1_UIOFGRO0_USFGRO0_VSn1_VWA4_VWB2_WSGRA0_WSGRB0_WS64_WG32_8_1_WGM6_WGMXCC1_WGMXCCGn1
    SolutionIndex: 23
    SolutionNameMin: Cijk_Ailk_Bjlk_I8II_BH_UserArgs_MT128x128x128_MI16x16x1_SN_LDSB1_AFC0_AFEM1_AFEM1_ASEM1_CLR1_CADS0_DTVA0_DTVB0_EPS0_FDSI0_GRPM1_GRVWA4_GRVWB8_GSU0_GSUAMB_GSUC0_GSUWGMRR0_GLS0_ISA950_IU1_K1_LBSPPA2048_LBSPPB2048_LBSPPM0_LPA64_LPB64_LPM0_LRVW16_LWPMn1_MIAV0_MIWT4_4_MO40_NTn1_NTA0_NTB0_NTC0_NTD0_NTM0_NEPBS0_NLCA1_NLCB1_ONLL1_PGR2_PLR1_PKA1_SIA3_SS1_SU0_SUM1_SUS128_SPO0_SRVW0_SSO0_SVW4_SK3_SKXCCM8_TLDS0_ULSGRO0_USL1_UIOFGRO0_USFGRO0_VSn1_VWA4_VWB4_WSGRA0_WSGRB0_WS64_WG32_8_1_WGM6_WGMXCC1_WGMXCCGn1
    SolutionIndex: 24
    SolutionNameMin: Cijk_Ailk_Bjlk_I8II_BH_UserArgs_MT128x128x128_MI16x16x1_SN_LDSB1_AFC0_AFEM1_AFEM1_ASEM1_CLR1_CADS0_DTVA0_DTVB0_EPS0_FDSI0_GRPM1_GRVWA4_GRVWB16_GSU0_GSUAMB_GSUC0_GSUWGMRR0_GLS0_ISA950_IU1_K1_LBSPPA2048_LBSPPB2048_LBSPPM0_LPA64_LPB64_LPM0_LRVW16_LWPMn1_MIAV0_MIWT4_4_MO40_NTn1_NTA0_NTB0_NTC0_NTD0_NTM0_NEPBS0_NLCA1_NLCB1_ONLL1_PGR2_PLR1_PKA1_SIA3_SS1_SU0_SUM1_SUS128_SPO0_SRVW0_SSO0_SVW4_SK3_SKXCCM8_TLDS0_ULSGRO0_USL1_UIOFGRO0_USFGRO0_VSn1_VWA4_VWB4_WSGRA0_WSGRB0_WS64_WG32_8_1_WGM6_WGMXCC1_WGMXCCGn1
    SolutionIndex: 25
    SolutionNameMin: Cijk_Ailk_Bjlk_I8II_BH_UserArgs_MT128x128x128_MI16x16x1_SN_LDSB1_AFC0_AFEM1_AFEM1_ASEM1_CLR1_CADS0_DTVA0_DTVB0_EPS0_FDSI0_GRPM1_GRVWA8_GRVWB16_GSU0_GSUAMB_GSUC0_GSUWGMRR0_GLS0_ISA950_IU1_K1_LBSPPA2048_LBSPPB2048_LBSPPM0_LPA64_LPB64_LPM0_LRVW16_LWPMn1_MIAV0_MIWT4_4_MO40_NTn1_NTA0_NTB0_NTC0_NTD0_NTM0_NEPBS0_NLCA1_NLCB1_ONLL1_PGR2_PLR1_PKA1_SIA3_SS1_SU0_SUM1_SUS128_SPO0_SRVW0_SSO0_SVW4_SK3_SKXCCM8_TLDS0_ULSGRO0_USL1_UIOFGRO0_USFGRO0_VSn1_VWA4_VWB4_WSGRA0_WSGRB0_WS64_WG32_8_1_WGM6_WGMXCC1_WGMXCCGn1
    SolutionIndex: 26
    SolutionNameMin: Cijk_Ailk_Bjlk_I8II_BH_UserArgs_MT128x128x128_MI16x16x1_SN_LDSB1_AFC0_AFEM1_AFEM1_ASEM1_CLR1_CADS0_DTVA0_DTVB0_EPS0_FDSI0_GRPM1_GRVWA16_GRVWB16_GSU0_GSUAMB_GSUC0_GSUWGMRR0_GLS0_ISA950_IU1_K1_LBSPPA2048_LBSPPB2048_LBSPPM0_LPA64_LPB32_LPM0_LRVW16_LWPMn1_MIAV0_MIWT4_4_MO40_NTn1_NTA0_NTB0_NTC0_NTD0_NTM0_NEPBS0_NLCA1_NLCB1_ONLL1_PGR2_PLR1_PKA1_SIA3_SS1_SU0_SUM1_SUS128_SPO0_SRVW0_SSO0_SVW4_SK3_SKXCCM8_TLDS0_ULSGRO0_USL1_UIOFGRO0_USFGRO0_VSn1_VWA4_VWB2_WSGRA0_WSGRB0_WS64_WG32_8_1_WGM6_WGMXCC1_WGMXCCGn1
    SolutionIndex: 27
    SolutionNameMin: Cijk_Ailk_Bjlk_I8II_BH_UserArgs_MT128x128x128_MI16x16x1_SN_LDSB1_AFC0_AFEM1_AFEM1_ASEM1_CLR1_CADS0_DTVA0_DTVB0_EPS0_FDSI0_GRPM1_GRVWA16_GRVWB16_GSU0_GSUAMB_GSUC0_GSUWGMRR0_GLS0_ISA950_IU1_K1_LBSPPA2048_LBSPPB2048_LBSPPM0_LPA64_LPB64_LPM0_LRVW16_LWPMn1_MIAV0_MIWT4_4_MO40_NTn1_NTA0_NTB0_NTC0_NTD0_NTM0_NEPBS0_NLCA1_NLCB1_ONLL1_PGR2_PLR1_PKA1_SIA3_SS1_SU0_SUM1_SUS128_SPO0_SRVW0_SSO0_SVW4_SK3_SKXCCM8_TLDS0_ULSGRO0_USL1_UIOFGRO0_USFGRO0_VSn1_VWA4_VWB4_WSGRA0_WSGRB0_WS64_WG32_8_1_WGM6_WGMXCC1_WGMXCCGn1
    SolutionIndex: 28
    SolutionNameMin: Cijk_Ailk_Bjlk_I8II_BH_UserArgs_MT64x128x128_MI16x16x1_SN_LDSB1_AFC0_AFEM1_AFEM1_ASEM1_CLR1_CADS0_DTVA0_DTVB0_EPS0_FDSI0_GRPM1_GRVWA8_GRVWB4_GSU0_GSUAMB_GSUC0_GSUWGMRR0_GLS0_ISA950_IU1_K1_LBSPPA1024_LBSPPB2048_LBSPPM0_LPA32_LPB64_LPM0_LRVW16_LWPMn1_MIAV0_MIWT2_4_MO40_NTn1_NTA0_NTB0_NTC0_NTD0_NTM0_NEPBS0_NLCA1_NLCB1_ONLL1_PGR2_PLR1_PKA1_SIA3_SS1_SU0_SUM1_SUS128_SPO0_SRVW0_SSO0_SVW2_SK3_SKXCCM8_TLDS0_ULSGRO0_USL1_UIOFGRO0_USFGRO0_VSn1_VWA2_VWB4_WSGRA0_WSGRB0_WS64_WG32_8_1_WGM6_WGMXCC1_WGMXCCGn1
    SolutionIndex: 29
    SolutionNameMin: Cijk_Ailk_Bjlk_I8II_BH_UserArgs_MT64x128x128_MI16x16x1_SN_LDSB1_AFC0_AFEM1_AFEM1_ASEM1_CLR1_CADS0_DTVA0_DTVB0_EPS0_FDSI0_GRPM1_GRVWA4_GRVWB16_GSU0_GSUAMB_GSUC0_GSUWGMRR0_GLS0_ISA950_IU1_K1_LBSPPA1024_LBSPPB2048_LBSPPM0_LPA32_LPB64_LPM0_LRVW16_LWPMn1_MIAV0_MIWT2_4_MO40_NTn1_NTA0_NTB0_NTC0_NTD0_NTM0_NEPBS0_NLCA1_NLCB1_ONLL1_PGR2_PLR1_PKA1_SIA3_SS1_SU0_SUM1_SUS128_SPO0_SRVW0_SSO0_SVW2_SK3_SKXCCM8_TLDS0_ULSGRO0_USL1_UIOFGRO0_USFGRO0_VSn1_VWA2_VWB4_WSGRA0_WSGRB0_WS64_WG32_8_1_WGM6_WGMXCC1_WGMXCCGn1
    SolutionIndex: 30
    SolutionNameMin: Cijk_Ailk_Bjlk_I8II_BH_UserArgs_MT64x128x128_MI16x16x1_SN_LDSB1_AFC0_AFEM1_AFEM1_ASEM1_CLR1_CADS0_DTVA0_DTVB0_EPS0_FDSI0_GRPM1_GRVWA8_GRVWB16_GSU0_GSUAMB_GSUC0_GSUWGMRR0_GLS0_ISA950_IU1_K1_LBSPPA1024_LBSPPB2048_LBSPPM0_LPA32_LPB64_LPM0_LRVW16_LWPMn1_MIAV0_MIWT2_4_MO40_NTn1_NTA0_NTB0_NTC0_NTD0_NTM0_NEPBS0_NLCA1_NLCB1_ONLL1_PGR2_PLR1_PKA1_SIA3_SS1_SU0_SUM1_SUS128_SPO0_SRVW0_SSO0_SVW2_SK3_SKXCCM8_TLDS0_ULSGRO0_USL1_UIOFGRO0_USFGRO0_VSn1_VWA2_VWB4_WSGRA0_WSGRB0_WS64_WG32_8_1_WGM6_WGMXCC1_WGMXCCGn1
    SolutionIndex: 31
    SolutionNameMin: Cijk_Ailk_Bjlk_I8II_BH_UserArgs_MT128x64x128_MI16x16x1_SN_LDSB1_AFC0_AFEM1_AFEM1_ASEM1_CLR1_CADS0_DTVA0_DTVB0_EPS0_FDSI0_GRPM1_GRVWA4_GRVWB4_GSU0_GSUAMB_GSUC0_GSUWGMRR0_GLS0_ISA950_IU1_K1_LBSPPA2048_LBSPPB1024_LBSPPM0_LPA64_LPB32_LPM0_LRVW16_LWPMn1_MIAV0_MIWT4_2_MO40_NTn1_NTA0_NTB0_NTC0_NTD0_NTM0_NEPBS0_NLCA1_NLCB1_ONLL1_PGR2_PLR1_PKA1_SIA3_SS1_SU0_SUM1_SUS128_SPO0_SRVW0_SSO0_SVW4_SK3_SKXCCM8_TLDS0_ULSGRO0_USL1_UIOFGRO0_USFGRO0_VSn1_VWA4_VWB2_WSGRA0_WSGRB0_WS64_WG32_8_1_WGM6_WGMXCC1_WGMXCCGn1
    SolutionIndex: 32
    SolutionNameMin: Cijk_Ailk_Bjlk_I8II_BH_UserArgs_MT128x64x128_MI16x16x1_SN_LDSB1_AFC0_AFEM1_AFEM1_ASEM1_CLR1_CADS0_DTVA0_DTVB0_EPS0_FDSI0_GRPM1_GRVWA16_GRVWB4_GSU0_GSUAMB_GSUC0_GSUWGMRR0_GLS0_ISA950_IU1_K1_LBSPPA2048_LBSPPB1024_LBSPPM0_LPA64_LPB32_LPM0_LRVW16_LWPMn1_MIAV0_MIWT4_2_MO40_NTn1_NTA0_NTB0_NTC0_NTD0_NTM0_NEPBS0_NLCA1_NLCB1_ONLL1_PGR2_PLR1_PKA1_SIA3_SS1_SU0_SUM1_SUS128_SPO0_SRVW0_SSO0_SVW4_SK3_SKXCCM8_TLDS0_ULSGRO0_USL1_UIOFGRO0_USFGRO0_VSn1_VWA4_VWB2_WSGRA0_WSGRB0_WS64_WG32_8_1_WGM6_WGMXCC1_WGMXCCGn1
    SolutionIndex: 33
    SolutionNameMin: Cijk_Ailk_Bjlk_I8II_BH_UserArgs_MT128x64x128_MI16x16x1_SN_LDSB1_AFC0_AFEM1_AFEM1_ASEM1_CLR1_CADS0_DTVA0_DTVB0_EPS0_FDSI0_GRPM1_GRVWA16_GRVWB8_GSU0_GSUAMB_GSUC0_GSUWGMRR0_GLS0_ISA950_IU1_K1_LBSPPA2048_LBSPPB1024_LBSPPM0_LPA64_LPB32_LPM0_LRVW16_LWPMn1_MIAV0_MIWT4_2_MO40_NTn1_NTA0_NTB0_NTC0_NTD0_NTM0_NEPBS0_NLCA1_NLCB1_ONLL1_PGR2_PLR1_PKA1_SIA3_SS1_SU0_SUM1_SUS128_SPO0_SRVW0_SSO0_SVW4_SK3_SKXCCM8_TLDS0_ULSGRO0_USL1_UIOFGRO0_USFGRO0_VSn1_VWA4_VWB2_WSGRA0_WSGRB0_WS64_WG32_8_1_WGM6_WGMXCC1_WGMXCCGn1
    SolutionIndex: 34
    SolutionNameMin: Cijk_Ailk_Bjlk_I8II_BH_UserArgs_MT128x64x128_MI16x16x1_SN_LDSB1_AFC0_AFEM1_AFEM1_ASEM1_CLR1_CADS0_DTVA0_DTVB0_EPS0_FDSI0_GRPM1_GRVWA4_GRVWB16_GSU0_GSUAMB_GSUC0_GSUWGMRR0_GLS0_ISA950_IU1_K1_LBSPPA2048_LBSPPB1024_LBSPPM0_LPA64_LPB32_LPM0_LRVW16_LWPMn1_MIAV0_MIWT4_2_MO40_NTn1_NTA0_NTB0_NTC0_NTD0_NTM0_NEPBS0_NLCA1_NLCB1_ONLL1_PGR2_PLR1_PKA1_SIA3_SS1_SU0_SUM1_SUS128_SPO0_SRVW0_SSO0_SVW4_SK3_SKXCCM8_TLDS0_ULSGRO0_USL1_UIOFGRO0_USFGRO0_VSn1_VWA4_VWB2_WSGRA0_WSGRB0_WS64_WG32_8_1_WGM6_WGMXCC1_WGMXCCGn1
    SolutionIndex: 35
    SolutionNameMin: Cijk_Ailk_Bjlk_I8II_BH_UserArgs_MT128x64x128_MI16x16x1_SN_LDSB1_AFC0_AFEM1_AFEM1_ASEM1_CLR1_CADS0_DTVA0_DTVB0_EPS0_FDSI0_GRPM1_GRVWA16_GRVWB16_GSU0_GSUAMB_GSUC0_GSUWGMRR0_GLS0_ISA950_IU1_K1_LBSPPA2048_LBSPPB1024_LBSPPM0_LPA64_LPB32_LPM0_LRVW16_LWPMn1_MIAV0_MIWT4_2_MO40_NTn1_NTA0_NTB0_NTC0_NTD0_NTM0_NEPBS0_NLCA1_NLCB1_ONLL1_PGR2_PLR1_PKA1_SIA3_SS1_SU0_SUM1_SUS128_SPO0_SRVW0_SSO0_SVW4_SK3_SKXCCM8_TLDS0_ULSGRO0_USL1_UIOFGRO0_USFGRO0_VSn1_VWA4_VWB2_WSGRA0_WSGRB0_WS64_WG32_8_1_WGM6_WGMXCC1_WGMXCCGn1
    SolutionIndex: 36
    SolutionNameMin: Cijk_Ailk_Bjlk_I8II_BH_UserArgs_MT64x64x128_MI16x16x1_SN_LDSB1_AFC0_AFEM1_AFEM1_ASEM1_CLR1_CADS0_DTVA0_DTVB0_EPS0_FDSI0_GRPM1_GRVWA4_GRVWB4_GSU0_GSUAMB_GSUC0_GSUWGMRR0_GLS0_ISA950_IU1_K1_LBSPPA1024_LBSPPB1024_LBSPPM0_LPA32_LPB32_LPM0_LRVW16_LWPMn1_MIAV0_MIWT2_2_MO40_NTn1_NTA0_NTB0_NTC0_NTD0_NTM0_NEPBS0_NLCA1_NLCB1_ONLL1_PGR2_PLR1_PKA1_SIA3_SS1_SU0_SUM1_SUS128_SPO0_SRVW0_SSO0_SVW2_SK3_SKXCCM8_TLDS0_ULSGRO0_USL1_UIOFGRO0_USFGRO0_VSn1_VWA2_VWB2_WSGRA0_WSGRB0_WS64_WG32_8_1_WGM6_WGMXCC1_WGMXCCGn1
    SolutionIndex: 37
    SolutionNameMin: Cijk_Ailk_Bjlk_I8II_BH_UserArgs_MT64x64x128_MI16x16x1_SN_LDSB1_AFC0_AFEM1_AFEM1_ASEM1_CLR1_CADS0_DTVA0_DTVB0_EPS0_FDSI0_GRPM1_GRVWA8_GRVWB4_GSU0_GSUAMB_GSUC0_GSUWGMRR0_GLS0_ISA950_IU1_K1_LBSPPA1024_LBSPPB1024_LBSPPM0_LPA32_LPB32_LPM0_LRVW16_LWPMn1_MIAV0_MIWT2_2_MO40_NTn1_NTA0_NTB0_NTC0_NTD0_NTM0_NEPBS0_NLCA1_NLCB1_ONLL1_PGR2_PLR1_PKA1_SIA3_SS1_SU0_SUM1_SUS128_SPO0_SRVW0_SSO0_SVW2_SK3_SKXCCM8_TLDS0_ULSGRO0_USL1_UIOFGRO0_USFGRO0_VSn1_VWA2_VWB2_WSGRA0_WSGRB0_WS64_WG32_8_1_WGM6_WGMXCC1_WGMXCCGn1
    SolutionIndex: 38
    SolutionNameMin: Cijk_Ailk_Bjlk_I8II_BH_UserArgs_MT64x64x128_MI16x16x1_SN_LDSB1_AFC0_AFEM1_AFEM1_ASEM1_CLR1_CADS0_DTVA0_DTVB0_EPS0_FDSI0_GRPM1_GRVWA4_GRVWB8_GSU0_GSUAMB_GSUC0_GSUWGMRR0_GLS0_ISA950_IU1_K1_LBSPPA1024_LBSPPB1024_LBSPPM0_LPA32_LPB32_LPM0_LRVW16_LWPMn1_MIAV0_MIWT2_2_MO40_NTn1_NTA0_NTB0_NTC0_NTD0_NTM0_NEPBS0_NLCA1_NLCB1_ONLL1_PGR2_PLR1_PKA1_SIA3_SS1_SU0_SUM1_SUS128_SPO0_SRVW0_SSO0_SVW2_SK3_SKXCCM8_TLDS0_ULSGRO0_USL1_UIOFGRO0_USFGRO0_VSn1_VWA2_VWB2_WSGRA0_WSGRB0_WS64_WG32_8_1_WGM6_WGMXCC1_WGMXCCGn1
    SolutionIndex: 39
    SolutionNameMin: Cijk_Ailk_Bjlk_I8II_BH_UserArgs_MT64x64x128_MI16x16x1_SN_LDSB1_AFC0_AFEM1_AFEM1_ASEM1_CLR1_CADS0_DTVA0_DTVB0_EPS0_FDSI0_GRPM1_GRVWA8_GRVWB8_GSU0_GSUAMB_GSUC0_GSUWGMRR0_GLS0_ISA950_IU1_K1_LBSPPA1024_LBSPPB1024_LBSPPM0_LPA32_LPB32_LPM0_LRVW16_LWPMn1_MIAV0_MIWT2_2_MO40_NTn1_NTA0_NTB0_NTC0_NTD0_NTM0_NEPBS0_NLCA1_NLCB1_ONLL1_PGR2_PLR1_PKA1_SIA3_SS1_SU0_SUM1_SUS128_SPO0_SRVW0_SSO0_SVW2_SK3_SKXCCM8_TLDS0_ULSGRO0_USL1_UIOFGRO0_USFGRO0_VSn1_VWA2_VWB2_WSGRA0_WSGRB0_WS64_WG32_8_1_WGM6_WGMXCC1_WGMXCCGn1
    SolutionIndex: 40
    SolutionNameMin: Cijk_Ailk_Bjlk_I8II_BH_UserArgs_MT64x64x128_MI16x16x1_SN_LDSB1_AFC0_AFEM1_AFEM1_ASEM1_CLR1_CADS0_DTVA0_DTVB0_EPS0_FDSI0_GRPM1_GRVWA16_GRVWB8_GSU0_GSUAMB_GSUC0_GSUWGMRR0_GLS0_ISA950_IU1_K1_LBSPPA1024_LBSPPB1024_LBSPPM0_LPA32_LPB32_LPM0_LRVW16_LWPMn1_MIAV0_MIWT2_2_MO40_NTn1_NTA0_NTB0_NTC0_NTD0_NTM0_NEPBS0_NLCA1_NLCB1_ONLL1_PGR2_PLR1_PKA1_SIA3_SS1_SU0_SUM1_SUS128_SPO0_SRVW0_SSO0_SVW2_SK3_SKXCCM8_TLDS0_ULSGRO0_USL1_UIOFGRO0_USFGRO0_VSn1_VWA2_VWB2_WSGRA0_WSGRB0_WS64_WG32_8_1_WGM6_WGMXCC1_WGMXCCGn1
    SolutionIndex: 41
    SolutionNameMin: Cijk_Ailk_Bjlk_I8II_BH_UserArgs_MT64x64x128_MI16x16x1_SN_LDSB1_AFC0_AFEM1_AFEM1_ASEM1_CLR1_CADS0_DTVA0_DTVB0_EPS0_FDSI0_GRPM1_GRVWA4_GRVWB16_GSU0_GSUAMB_GSUC0_GSUWGMRR0_GLS0_ISA950_IU1_K1_LBSPPA1024_LBSPPB1024_LBSPPM0_LPA32_LPB32_LPM0_LRVW16_LWPMn1_MIAV0_MIWT2_2_MO40_NTn1_NTA0_NTB0_NTC0_NTD0_NTM0_NEPBS0_NLCA1_NLCB1_ONLL1_PGR2_PLR1_PKA1_SIA3_SS1_SU0_SUM1_SUS128_SPO0_SRVW0_SSO0_SVW2_SK3_SKXCCM8_TLDS0_ULSGRO0_USL1_UIOFGRO0_USFGRO0_VSn1_VWA2_VWB2_WSGRA0_WSGRB0_WS64_WG32_8_1_WGM6_WGMXCC1_WGMXCCGn1
    SolutionIndex: 42
    SolutionNameMin: Cijk_Ailk_Bjlk_I8II_BH_UserArgs_MT64x64x128_MI16x16x1_SN_LDSB1_AFC0_AFEM1_AFEM1_ASEM1_CLR1_CADS0_DTVA0_DTVB0_EPS0_FDSI0_GRPM1_GRVWA8_GRVWB16_GSU0_GSUAMB_GSUC0_GSUWGMRR0_GLS0_ISA950_IU1_K1_LBSPPA1024_LBSPPB1024_LBSPPM0_LPA32_LPB32_LPM0_LRVW16_LWPMn1_MIAV0_MIWT2_2_MO40_NTn1_NTA0_NTB0_NTC0_NTD0_NTM0_NEPBS0_NLCA1_NLCB1_ONLL1_PGR2_PLR1_PKA1_SIA3_SS1_SU0_SUM1_SUS128_SPO0_SRVW0_SSO0_SVW2_SK3_SKXCCM8_TLDS0_ULSGRO0_USL1_UIOFGRO0_USFGRO0_VSn1_VWA2_VWB2_WSGRA0_WSGRB0_WS64_WG32_8_1_WGM6_WGMXCC1_WGMXCCGn1
    SolutionIndex: 43
    SolutionNameMin: Cijk_Ailk_Bjlk_I8II_BH_UserArgs_MT64x64x128_MI16x16x1_SN_LDSB1_AFC0_AFEM1_AFEM1_ASEM1_CLR1_CADS0_DTVA0_DTVB0_EPS0_FDSI0_GRPM1_GRVWA16_GRVWB16_GSU0_GSUAMB_GSUC0_GSUWGMRR0_GLS0_ISA950_IU1_K1_LBSPPA1024_LBSPPB1024_LBSPPM0_LPA32_LPB32_LPM0_LRVW16_LWPMn1_MIAV0_MIWT2_2_MO40_NTn1_NTA0_NTB0_NTC0_NTD0_NTM0_NEPBS0_NLCA1_NLCB1_ONLL1_PGR2_PLR1_PKA1_SIA3_SS1_SU0_SUM1_SUS128_SPO0_SRVW0_SSO0_SVW2_SK3_SKXCCM8_TLDS0_ULSGRO0_USL1_UIOFGRO0_USFGRO0_VSn1_VWA2_VWB2_WSGRA0_WSGRB0_WS64_WG32_8_1_WGM6_WGMXCC1_WGMXCCGn1
    SolutionIndex: 44
    SolutionNameMin: Cijk_Ailk_Bjlk_I8II_BH_UserArgs_MT128x128x256_MI16x16x1_SN_LDSB1_AFC0_AFEM1_AFEM1_ASEM1_CLR1_CADS0_DTVA0_DTVB0_EPS0_FDSI0_GRPM1_GRVWA16_GRVWB16_GSU0_GSUAMB_GSUC0_GSUWGMRR0_GLS0_ISA950_IU1_K1_LBSPPA2048_LBSPPB2048_LBSPPM0_LPA64_LPB64_LPM0_LRVW16_LWPMn1_MIAV0_MIWT4_4_MO40_NTn1_NTA0_NTB0_NTC0_NTD0_NTM0_NEPBS0_NLCA1_NLCB1_ONLL1_PGR2_PLR2_PKA1_SIA3_SS1_SU0_SUM1_SUS256_SPO0_SRVW0_SSO0_SVW4_SK3_SKXCCM8_TLDS0_ULSGRO0_USL1_UIOFGRO0_USFGRO0_VSn1_VWA4_VWB4_WSGRA0_WSGRB0_WS64_WG32_8_1_WGM6_WGMXCC1_WGMXCCGn1
    SolutionIndex: 45
    SolutionNameMin: Cijk_Ailk_Bjlk_I8II_BH_UserArgs_MT128x64x256_MI16x16x1_SN_LDSB1_AFC0_AFEM1_AFEM1_ASEM1_CLR1_CADS0_DTVA0_DTVB0_EPS0_FDSI0_GRPM1_GRVWA4_GRVWB16_GSU0_GSUAMB_GSUC0_GSUWGMRR0_GLS0_ISA950_IU1_K1_LBSPPA2048_LBSPPB1024_LBSPPM0_LPA64_LPB32_LPM0_LRVW16_LWPMn1_MIAV0_MIWT4_2_MO40_NTn1_NTA0_NTB0_NTC0_NTD0_NTM0_NEPBS0_NLCA1_NLCB1_ONLL1_PGR2_PLR1_PKA1_SIA3_SS1_SU0_SUM1_SUS256_SPO0_SRVW0_SSO0_SVW4_SK3_SKXCCM8_TLDS0_ULSGRO0_USL1_UIOFGRO0_USFGRO0_VSn1_VWA4_VWB2_WSGRA0_WSGRB0_WS64_WG32_8_1_WGM6_WGMXCC1_WGMXCCGn1
    SolutionIndex: 46
    SolutionNameMin: Cijk_Ailk_Bjlk_I8II_BH_UserArgs_MT128x64x256_MI16x16x1_SN_LDSB1_AFC0_AFEM1_AFEM1_ASEM1_CLR1_CADS0_DTVA0_DTVB0_EPS0_FDSI0_GRPM1_GRVWA16_GRVWB16_GSU0_GSUAMB_GSUC0_GSUWGMRR0_GLS0_ISA950_IU1_K1_LBSPPA2048_LBSPPB1024_LBSPPM0_LPA64_LPB32_LPM0_LRVW16_LWPMn1_MIAV0_MIWT4_2_MO40_NTn1_NTA0_NTB0_NTC0_NTD0_NTM0_NEPBS0_NLCA1_NLCB1_ONLL1_PGR2_PLR1_PKA1_SIA3_SS1_SU0_SUM1_SUS256_SPO0_SRVW0_SSO0_SVW4_SK3_SKXCCM8_TLDS0_ULSGRO0_USL1_UIOFGRO0_USFGRO0_VSn1_VWA4_VWB2_WSGRA0_WSGRB0_WS64_WG32_8_1_WGM6_WGMXCC1_WGMXCCGn1
    SolutionIndex: 47
    SolutionNameMin: Cijk_Ailk_Bjlk_I8II_BH_UserArgs_MT128x64x256_MI16x16x1_SN_LDSB1_AFC0_AFEM1_AFEM1_ASEM1_CLR1_CADS0_DTVA0_DTVB0_EPS0_FDSI0_GRPM1_GRVWA16_GRVWB16_GSU0_GSUAMB_GSUC0_GSUWGMRR0_GLS0_ISA950_IU1_K1_LBSPPA2048_LBSPPB1024_LBSPPM0_LPA64_LPB32_LPM0_LRVW16_LWPMn1_MIAV0_MIWT4_2_MO40_NTn1_NTA0_NTB0_NTC0_NTD0_NTM0_NEPBS0_NLCA1_NLCB1_ONLL1_PGR2_PLR2_PKA1_SIA3_SS1_SU0_SUM1_SUS256_SPO0_SRVW0_SSO0_SVW4_SK3_SKXCCM8_TLDS0_ULSGRO0_USL1_UIOFGRO0_USFGRO0_VSn1_VWA4_VWB2_WSGRA0_WSGRB0_WS64_WG32_8_1_WGM6_WGMXCC1_WGMXCCGn1
    SolutionIndex: 48
    SolutionNameMin: Cijk_Ailk_Bjlk_I8II_BH_UserArgs_MT64x64x256_MI16x16x1_SN_LDSB1_AFC0_AFEM1_AFEM1_ASEM1_CLR1_CADS0_DTVA0_DTVB0_EPS0_FDSI0_GRPM1_GRVWA16_GRVWB16_GSU0_GSUAMB_GSUC0_GSUWGMRR0_GLS0_ISA950_IU1_K1_LBSPPA1024_LBSPPB1024_LBSPPM0_LPA32_LPB32_LPM0_LRVW16_LWPMn1_MIAV0_MIWT2_2_MO40_NTn1_NTA0_NTB0_NTC0_NTD0_NTM0_NEPBS0_NLCA1_NLCB1_ONLL1_PGR2_PLR1_PKA1_SIA3_SS1_SU0_SUM1_SUS256_SPO0_SRVW0_SSO0_SVW2_SK3_SKXCCM8_TLDS0_ULSGRO0_USL1_UIOFGRO0_USFGRO0_VSn1_VWA2_VWB2_WSGRA0_WSGRB0_WS64_WG32_8_1_WGM6_WGMXCC1_WGMXCCGn1
    SolutionIndex: 49
    SolutionNameMin: Cijk_Ailk_Bjlk_I8II_BH_UserArgs_MT64x64x256_MI16x16x1_SN_LDSB1_AFC0_AFEM1_AFEM1_ASEM1_CLR1_CADS0_DTVA0_DTVB0_EPS0_FDSI0_GRPM1_GRVWA16_GRVWB16_GSU0_GSUAMB_GSUC0_GSUWGMRR0_GLS0_ISA950_IU1_K1_LBSPPA1024_LBSPPB1024_LBSPPM0_LPA32_LPB32_LPM0_LRVW16_LWPMn1_MIAV0_MIWT2_2_MO40_NTn1_NTA0_NTB0_NTC0_NTD0_NTM0_NEPBS0_NLCA1_NLCB1_ONLL1_PGR2_PLR2_PKA1_SIA3_SS1_SU0_SUM1_SUS256_SPO0_SRVW0_SSO0_SVW2_SK3_SKXCCM8_TLDS0_ULSGRO0_USL1_UIOFGRO0_USFGRO0_VSn1_VWA2_VWB2_WSGRA0_WSGRB0_WS64_WG32_8_1_WGM6_WGMXCC1_WGMXCCGn1
- - - [128, 128, 1, 128, 128, 128, 128, 128]
    - [37, 0.35]
  - - [128, 128, 1, 256, 128, 128, 128, 128]
    - [37, 0.6]
  - - [128, 128, 1, 512, 128, 128, 128, 128]
    - [38, 0.96]
  - - [128, 128, 1, 1024, 128, 128, 128, 128]
    - [49, 1.4]
  - - [128, 128, 1, 2048, 128, 128, 128, 128]
    - [48, 1.86]
  - - [128, 128, 1, 4096, 128, 128, 128, 128]
    - [49, 2.22]
  - - [128, 128, 1, 8192, 128, 128, 128, 128]
    - [49, 2.5]
  - - [128, 256, 1, 128, 128, 128, 128, 256]
    - [36, 0.69]
  - - [128, 256, 1, 256, 128, 128, 128, 256]
    - [37, 1.17]
  - - [128, 256, 1, 512, 128, 128, 128, 256]
    - [43, 1.89]
  - - [128, 256, 1, 1024, 128, 128, 128, 256]
    - [48, 2.76]
  - - [128, 256, 1, 2048, 128, 128, 128, 256]
    - [49, 3.66]
  - - [128, 256, 1, 4096, 128, 128, 128, 256]
    - [49, 4.42]
  - - [128, 256, 1, 8192, 128, 128, 128, 256]
    - [49, 4.94]
  - - [128, 512, 1, 128, 128, 128, 128, 512]
    - [37, 1.4]
  - - [128, 512, 1, 256, 128, 128, 128, 512]
    - [41, 2.38]
  - - [128, 512, 1, 512, 128, 128, 128, 512]
    - [41, 3.85]
  - - [128, 512, 1, 1024, 128, 128, 128, 512]
    - [49, 5.58]
  - - [128, 512, 1, 2048, 128, 128, 128, 512]
    - [49, 7.33]
  - - [128, 512, 1, 4096, 128, 128, 128, 512]
    - [49, 8.87]
  - - [128, 512, 1, 8192, 128, 128, 128, 512]
    - [49, 9.95]
  - - [128, 1024, 1, 128, 128, 128, 128, 1024]
    - [36, 2.79]
  - - [128, 1024, 1, 256, 128, 128, 128, 1024]
    - [41, 4.73]
  - - [128, 1024, 1, 512, 128, 128, 128, 1024]
    - [41, 7.65]
  - - [128, 1024, 1, 1024, 128, 128, 128, 1024]
    - [41, 10.92]
  - - [128, 1024, 1, 2048, 128, 128, 128, 1024]
    - [49, 14.61]
  - - [128, 1024, 1, 4096, 128, 128, 128, 1024]
    - [49, 17.82]
  - - [128, 1024, 1, 8192, 128, 128, 128, 1024]
    - [49, 19.91]
  - - [128, 2048, 1, 128, 128, 128, 128, 2048]
    - [37, 5.42]
  - - [128, 2048, 1, 256, 128, 128, 128, 2048]
    - [36, 9.15]
  - - [128, 2048, 1, 512, 128, 128, 128, 2048]
    - [43, 14.77]
  - - [128, 2048, 1, 1024, 128, 128, 128, 2048]
    - [41, 21.54]
  - - [128, 2048, 1, 2048, 128, 128, 128, 2048]
    - [48, 28.85]
  - - [128, 2048, 1, 4096, 128, 128, 128, 2048]
    - [48, 35.25]
  - - [128, 2048, 1, 8192, 128, 128, 128, 2048]
    - [48, 39.68]
  - - [128, 4096, 1, 128, 128, 128, 128, 4096]
    - [36, 10.31]
  - - [128, 4096, 1, 256, 128, 128, 128, 4096]
    - [36, 17.71]
  - - [128, 4096, 1, 512, 128, 128, 128, 4096]
    - [36, 28.65]
  - - [128, 4096, 1, 1024, 128, 128, 128, 4096]
    - [48, 41.75]
  - - [128, 4096, 1, 2048, 128, 128, 128, 4096]
    - [48, 56.41]
  - - [128, 4096, 1, 4096, 128, 128, 128, 4096]
    - [48, 69.25]
  - - [128, 4096, 1, 8192, 128, 128, 128, 4096]
    - [48, 77.16]
  - - [128, 8192, 1, 128, 128, 128, 128, 8192]
    - [37, 18.6]
  - - [128, 8192, 1, 256, 128, 128, 128, 8192]
    - [37, 32.3]
  - - [128, 8192, 1, 512, 128, 128, 128, 8192]
    - [36, 53.07]
  - - [128, 8192, 1, 1024, 128, 128, 128, 8192]
    - [41, 79.12]
  - - [128, 8192, 1, 2048, 128, 128, 128, 8192]
    - [48, 106.69]
  - - [128, 8192, 1, 4096, 128, 128, 128, 8192]
    - [48, 127.96]
  - - [128, 8192, 1, 8192, 128, 128, 128, 8192]
    - [48, 146.79]
  - - [256, 128, 1, 128, 256, 256, 256, 128]
    - [36, 0.69]
  - - [256, 128, 1, 256, 256, 256, 256, 128]
    - [37, 1.17]
  - - [256, 128, 1, 512, 256, 256, 256, 128]
    - [36, 1.91]
  - - [256, 128, 1, 1024, 256, 256, 256, 128]
    - [43, 2.76]
  - - [256, 128, 1, 2048, 256, 256, 256, 128]
    - [48, 3.52]
  - - [256, 128, 1, 4096, 256, 256, 256, 128]
    - [48, 4.18]
  - - [256, 128, 1, 8192, 256, 256, 256, 128]
    - [48, 4.62]
  - - [256, 256, 1, 128, 256, 256, 256, 256]
    - [36, 1.41]
  - - [256, 256, 1, 256, 256, 256, 256, 256]
    - [36, 2.4]
  - - [256, 256, 1, 512, 256, 256, 256, 256]
    - [38, 3.86]
  - - [256, 256, 1, 1024, 256, 256, 256, 256]
    - [49, 5.54]
  - - [256, 256, 1, 2048, 256, 256, 256, 256]
    - [48, 7.16]
  - - [256, 256, 1, 4096, 256, 256, 256, 256]
    - [48, 8.54]
  - - [256, 256, 1, 8192, 256, 256, 256, 256]
    - [48, 9.47]
  - - [256, 512, 1, 128, 256, 256, 256, 512]
    - [39, 2.78]
  - - [256, 512, 1, 256, 256, 256, 256, 512]
    - [41, 4.8]
  - - [256, 512, 1, 512, 256, 256, 256, 512]
    - [41, 7.67]
  - - [256, 512, 1, 1024, 256, 256, 256, 512]
    - [41, 11.05]
  - - [256, 512, 1, 2048, 256, 256, 256, 512]
    - [48, 14.37]
  - - [256, 512, 1, 4096, 256, 256, 256, 512]
    - [48, 17.1]
  - - [256, 512, 1, 8192, 256, 256, 256, 512]
    - [48, 19.01]
  - - [256, 1024, 1, 128, 256, 256, 256, 1024]
    - [38, 5.45]
  - - [256, 1024, 1, 256, 256, 256, 256, 1024]
    - [38, 9.35]
  - - [256, 1024, 1, 512, 256, 256, 256, 1024]
    - [36, 15.02]
  - - [256, 1024, 1, 1024, 256, 256, 256, 1024]
    - [43, 21.73]
  - - [256, 1024, 1, 2048, 256, 256, 256, 1024]
    - [48, 28.44]
  - - [256, 1024, 1, 4096, 256, 256, 256, 1024]
    - [48, 34.2]
  - - [256, 1024, 1, 8192, 256, 256, 256, 1024]
    - [48, 37.97]
  - - [256, 2048, 1, 128, 256, 256, 256, 2048]
    - [36, 10.31]
  - - [256, 2048, 1, 256, 256, 256, 256, 2048]
    - [38, 17.75]
  - - [256, 2048, 1, 512, 256, 256, 256, 2048]
    - [41, 28.89]
  - - [256, 2048, 1, 1024, 256, 256, 256, 2048]
    - [43, 42.28]
  - - [256, 2048, 1, 2048, 256, 256, 256, 2048]
    - [48, 55.89]
  - - [256, 2048, 1, 4096, 256, 256, 256, 2048]
    - [48, 66.92]
  - - [256, 2048, 1, 8192, 256, 256, 256, 2048]
    - [48, 75.54]
  - - [256, 4096, 1, 128, 256, 256, 256, 4096]
    - [37, 18.57]
  - - [256, 4096, 1, 256, 256, 256, 256, 4096]
    - [36, 32.28]
  - - [256, 4096, 1, 512, 256, 256, 256, 4096]
    - [41, 53.11]
  - - [256, 4096, 1, 1024, 256, 256, 256, 4096]
    - [41, 79.35]
  - - [256, 4096, 1, 2048, 256, 256, 256, 4096]
    - [48, 106.45]
  - - [256, 4096, 1, 4096, 256, 256, 256, 4096]
    - [48, 129.2]
  - - [256, 4096, 1, 8192, 256, 256, 256, 4096]
    - [48, 143.63]
  - - [256, 8192, 1, 128, 256, 256, 256, 8192]
    - [5, 29.93]
  - - [256, 8192, 1, 256, 256, 256, 256, 8192]
    - [5, 53.09]
  - - [256, 8192, 1, 512, 256, 256, 256, 8192]
    - [31, 88.69]
  - - [256, 8192, 1, 1024, 256, 256, 256, 8192]
    - [35, 134.09]
  - - [256, 8192, 1, 2048, 256, 256, 256, 8192]
    - [35, 179.45]
  - - [256, 8192, 1, 4096, 256, 256, 256, 8192]
    - [46, 218.45]
  - - [256, 8192, 1, 8192, 256, 256, 256, 8192]
    - [45, 243.7]
  - - [512, 128, 1, 128, 512, 512, 512, 128]
    - [36, 1.4]
  - - [512, 128, 1, 256, 512, 512, 512, 128]
    - [37, 2.39]
  - - [512, 128, 1, 512, 512, 512, 512, 128]
    - [36, 3.86]
  - - [512, 128, 1, 1024, 512, 512, 512, 128]
    - [38, 5.56]
  - - [512, 128, 1, 2048, 512, 512, 512, 128]
    - [40, 7.05]
  - - [512, 128, 1, 4096, 512, 512, 512, 128]
    - [42, 8.27]
  - - [512, 128, 1, 8192, 512, 512, 512, 128]
    - [42, 9.03]
  - - [512, 256, 1, 128, 512, 512, 512, 256]
    - [37, 2.79]
  - - [512, 256, 1, 256, 512, 512, 512, 256]
    - [38, 4.76]
  - - [512, 256, 1, 512, 512, 512, 512, 256]
    - [36, 7.67]
  - - [512, 256, 1, 1024, 512, 512, 512, 256]
    - [43, 10.99]
  - - [512, 256, 1, 2048, 512, 512, 512, 256]
    - [41, 14.17]
  - - [512, 256, 1, 4096, 512, 512, 512, 256]
    - [41, 16.55]
  - - [512, 256, 1, 8192, 512, 512, 512, 256]
    - [41, 18.09]
  - - [512, 512, 1, 128, 512, 512, 512, 512]
    - [37, 5.48]
  - - [512, 512, 1, 256, 512, 512, 512, 512]
    - [38, 9.39]
  - - [512, 512, 1, 512, 512, 512, 512, 512]
    - [36, 15.06]
  - - [512, 512, 1, 1024, 512, 512, 512, 512]
    - [41, 21.76]
  - - [512, 512, 1, 2048, 512, 512, 512, 512]
    - [43, 28.09]
  - - [512, 512, 1, 4096, 512, 512, 512, 512]
    - [42, 32.97]
  - - [512, 512, 1, 8192, 512, 512, 512, 512]
    - [43, 36.17]
  - - [512, 1024, 1, 128, 512, 512, 512, 1024]
    - [39, 10.36]
  - - [512, 1024, 1, 256, 512, 512, 512, 1024]
    - [36, 18.1]
  - - [512, 1024, 1, 512, 512, 512, 512, 1024]
    - [38, 29.18]
  - - [512, 1024, 1, 1024, 512, 512, 512, 1024]
    - [43, 42.68]
  - - [512, 1024, 1, 2048, 512, 512, 512, 1024]
    - [41, 55.03]
  - - [512, 1024, 1, 4096, 512, 512, 512, 1024]
    - [43, 65.25]
  - - [512, 1024, 1, 8192, 512, 512, 512, 1024]
    - [43, 71.79]
  - - [512, 2048, 1, 128, 512, 512, 512, 2048]
    - [38, 18.59]
  - - [512, 2048, 1, 256, 512, 512, 512, 2048]
    - [38, 32.59]
  - - [512, 2048, 1, 512, 512, 512, 512, 2048]
    - [38, 53.43]
  - - [512, 2048, 1, 1024, 512, 512, 512, 2048]
    - [41, 79.22]
  - - [512, 2048, 1, 2048, 512, 512, 512, 2048]
    - [41, 104.04]
  - - [512, 2048, 1, 4096, 512, 512, 512, 2048]
    - [49, 123.99]
  - - [512, 2048, 1, 8192, 512, 512, 512, 2048]
    - [43, 136.85]
  - - [512, 4096, 1, 128, 512, 512, 512, 4096]
    - [5, 30.07]
  - - [512, 4096, 1, 256, 512, 512, 512, 4096]
    - [32, 53.19]
  - - [512, 4096, 1, 512, 512, 512, 512, 4096]
    - [33, 89.2]
  - - [512, 4096, 1, 1024, 512, 512, 512, 4096]
    - [33, 135.31]
  - - [512, 4096, 1, 2048, 512, 512, 512, 4096]
    - [47, 180.3]
  - - [512, 4096, 1, 4096, 512, 512, 512, 4096]
    - [35, 216.65]
  - - [512, 4096, 1, 8192, 512, 512, 512, 4096]
    - [33, 242.7]
  - - [512, 8192, 1, 128, 512, 512, 512, 8192]
    - [4, 39.71]
  - - [512, 8192, 1, 256, 512, 512, 512, 8192]
    - [4, 70.78]
  - - [512, 8192, 1, 512, 512, 512, 512, 8192]
    - [27, 124.54]
  - - [512, 8192, 1, 1024, 512, 512, 512, 8192]
    - [27, 193.51]
  - - [512, 8192, 1, 2048, 512, 512, 512, 8192]
    - [27, 270.99]
  - - [512, 8192, 1, 4096, 512, 512, 512, 8192]
    - [44, 331.48]
  - - [512, 8192, 1, 8192, 512, 512, 512, 8192]
    - [27, 370.97]
  - - [1024, 128, 1, 128, 1024, 1024, 1024, 128]
    - [37, 2.79]
  - - [1024, 128, 1, 256, 1024, 1024, 1024, 128]
    - [36, 4.81]
  - - [1024, 128, 1, 512, 1024, 1024, 1024, 128]
    - [38, 7.67]
  - - [1024, 128, 1, 1024, 1024, 1024, 1024, 128]
    - [38, 11.03]
  - - [1024, 128, 1, 2048, 1024, 1024, 1024, 128]
    - [41, 14.01]
  - - [1024, 128, 1, 4096, 1024, 1024, 1024, 128]
    - [43, 16.45]
  - - [1024, 128, 1, 8192, 1024, 1024, 1024, 128]
    - [41, 18.03]
  - - [1024, 256, 1, 128, 1024, 1024, 1024, 256]
    - [37, 5.46]
  - - [1024, 256, 1, 256, 1024, 1024, 1024, 256]
    - [36, 9.38]
  - - [1024, 256, 1, 512, 1024, 1024, 1024, 256]
    - [41, 15.04]
  - - [1024, 256, 1, 1024, 1024, 1024, 1024, 256]
    - [43, 21.81]
  - - [1024, 256, 1, 2048, 1024, 1024, 1024, 256]
    - [43, 27.96]
  - - [1024, 256, 1, 4096, 1024, 1024, 1024, 256]
    - [41, 32.79]
  - - [1024, 256, 1, 8192, 1024, 1024, 1024, 256]
    - [43, 35.98]
  - - [1024, 512, 1, 128, 1024, 1024, 1024, 512]
    - [36, 10.47]
  - - [1024, 512, 1, 256, 1024, 1024, 1024, 512]
    - [36, 18.09]
  - - [1024, 512, 1, 512, 1024, 1024, 1024, 512]
    - [41, 29.36]
  - - [1024, 512, 1, 1024, 1024, 1024, 1024, 512]
    - [43, 42.49]
  - - [1024, 512, 1, 2048, 1024, 1024, 1024, 512]
    - [43, 55.36]
  - - [1024, 512, 1, 4096, 1024, 1024, 1024, 512]
    - [43, 65.34]
  - - [1024, 512, 1, 8192, 1024, 1024, 1024, 512]
    - [43, 72.11]
  - - [1024, 1024, 1, 128, 1024, 1024, 1024, 1024]
    - [37, 18.88]
  - - [1024, 1024, 1, 256, 1024, 1024, 1024, 1024]
    - [36, 32.88]
  - - [1024, 1024, 1, 512, 1024, 1024, 1024, 1024]
    - [38, 53.97]
  - - [1024, 1024, 1, 1024, 1024, 1024, 1024, 1024]
    - [43, 79.77]
  - - [1024, 1024, 1, 2048, 1024, 1024, 1024, 1024]
    - [43, 104.71]
  - - [1024, 1024, 1, 4096, 1024, 1024, 1024, 1024]
    - [43, 123.92]
  - - [1024, 1024, 1, 8192, 1024, 1024, 1024, 1024]
    - [43, 138.22]
  - - [1024, 2048, 1, 128, 1024, 1024, 1024, 2048]
    - [5, 30.23]
  - - [1024, 2048, 1, 256, 1024, 1024, 1024, 2048]
    - [31, 53.38]
  - - [1024, 2048, 1, 512, 1024, 1024, 1024, 2048]
    - [35, 89.02]
  - - [1024, 2048, 1, 1024, 1024, 1024, 1024, 2048]
    - [33, 135.19]
  - - [1024, 2048, 1, 2048, 1024, 1024, 1024, 2048]
    - [35, 182.61]
  - - [1024, 2048, 1, 4096, 1024, 1024, 1024, 2048]
    - [35, 220.71]
  - - [1024, 2048, 1, 8192, 1024, 1024, 1024, 2048]
    - [35, 244.63]
  - - [1024, 4096, 1, 128, 1024, 1024, 1024, 4096]
    - [3, 39.64]
  - - [1024, 4096, 1, 256, 1024, 1024, 1024, 4096]
    - [25, 70.26]
  - - [1024, 4096, 1, 512, 1024, 1024, 1024, 4096]
    - [27, 120.24]
  - - [1024, 4096, 1, 1024, 1024, 1024, 1024, 4096]
    - [27, 190.95]
  - - [1024, 4096, 1, 2048, 1024, 1024, 1024, 4096]
    - [27, 270.45]
  - - [1024, 4096, 1, 4096, 1024, 1024, 1024, 4096]
    - [27, 331.6]
  - - [1024, 4096, 1, 8192, 1024, 1024, 1024, 4096]
    - [27, 378.6]
  - - [1024, 8192, 1, 128, 1024, 1024, 1024, 8192]
    - [1, 52.45]
  - - [1024, 8192, 1, 256, 1024, 1024, 1024, 8192]
    - [14, 94.64]
  - - [1024, 8192, 1, 512, 1024, 1024, 1024, 8192]
    - [14, 158.73]
  - - [1024, 8192, 1, 1024, 1024, 1024, 1024, 8192]
    - [14, 243.52]
  - - [1024, 8192, 1, 2048, 1024, 1024, 1024, 8192]
    - [19, 349.86]
  - - [1024, 8192, 1, 4096, 1024, 1024, 1024, 8192]
    - [17, 419.8]
  - - [1024, 8192, 1, 8192, 1024, 1024, 1024, 8192]
    - [17, 453.82]
  - - [2048, 128, 1, 128, 2048, 2048, 2048, 128]
    - [38, 5.46]
  - - [2048, 128, 1, 256, 2048, 2048, 2048, 128]
    - [38, 9.36]
  - - [2048, 128, 1, 512, 2048, 2048, 2048, 128]
    - [38, 14.96]
  - - [2048, 128, 1, 1024, 2048, 2048, 2048, 128]
    - [36, 21.6]
  - - [2048, 128, 1, 2048, 2048, 2048, 2048, 128]
    - [43, 28.1]
  - - [2048, 128, 1, 4096, 2048, 2048, 2048, 128]
    - [41, 32.75]
  - - [2048, 128, 1, 8192, 2048, 2048, 2048, 128]
    - [41, 36.01]
  - - [2048, 256, 1, 128, 2048, 2048, 2048, 256]
    - [36, 10.5]
  - - [2048, 256, 1, 256, 2048, 2048, 2048, 256]
    - [36, 18.06]
  - - [2048, 256, 1, 512, 2048, 2048, 2048, 256]
    - [36, 29.07]
  - - [2048, 256, 1, 1024, 2048, 2048, 2048, 256]
    - [41, 42.27]
  - - [2048, 256, 1, 2048, 2048, 2048, 2048, 256]
    - [43, 55.26]
  - - [2048, 256, 1, 4096, 2048, 2048, 2048, 256]
    - [43, 65.09]
  - - [2048, 256, 1, 8192, 2048, 2048, 2048, 256]
    - [43, 71.67]
  - - [2048, 512, 1, 128, 2048, 2048, 2048, 512]
    - [36, 18.9]
  - - [2048, 512, 1, 256, 2048, 2048, 2048, 512]
    - [38, 32.47]
  - - [2048, 512, 1, 512, 2048, 2048, 2048, 512]
    - [41, 53.7]
  - - [2048, 512, 1, 1024, 2048, 2048, 2048, 512]
    - [42, 79.15]
  - - [2048, 512, 1, 2048, 2048, 2048, 2048, 512]
    - [43, 104.0]
  - - [2048, 512, 1, 4096, 2048, 2048, 2048, 512]
    - [43, 125.28]
  - - [2048, 512, 1, 8192, 2048, 2048, 2048, 512]
    - [43, 136.22]
  - - [2048, 1024, 1, 128, 2048, 2048, 2048, 1024]
    - [31, 30.03]
  - - [2048, 1024, 1, 256, 2048, 2048, 2048, 1024]
    - [5, 53.23]
  - - [2048, 1024, 1, 512, 2048, 2048, 2048, 1024]
    - [35, 89.02]
  - - [2048, 1024, 1, 1024, 2048, 2048, 2048, 1024]
    - [35, 135.71]
  - - [2048, 1024, 1, 2048, 2048, 2048, 2048, 1024]
    - [35, 182.91]
  - - [2048, 1024, 1, 4096, 2048, 2048, 2048, 1024]
    - [35, 222.58]
  - - [2048, 1024, 1, 8192, 2048, 2048, 2048, 1024]
    - [33, 244.57]
  - - [2048, 2048, 1, 128, 2048, 2048, 2048, 2048]
    - [23, 39.67]
  - - [2048, 2048, 1, 256, 2048, 2048, 2048, 2048]
    - [24, 71.04]
  - - [2048, 2048, 1, 512, 2048, 2048, 2048, 2048]
    - [24, 119.49]
  - - [2048, 2048, 1, 1024, 2048, 2048, 2048, 2048]
    - [27, 191.81]
  - - [2048, 2048, 1, 2048, 2048, 2048, 2048, 2048]
    - [27, 268.92]
  - - [2048, 2048, 1, 4096, 2048, 2048, 2048, 2048]
    - [27, 333.23]
  - - [2048, 2048, 1, 8192, 2048, 2048, 2048, 2048]
    - [27, 371.82]
  - - [2048, 4096, 1, 128, 2048, 2048, 2048, 4096]
    - [15, 50.56]
  - - [2048, 4096, 1, 256, 2048, 2048, 2048, 4096]
    - [15, 90.91]
  - - [2048, 4096, 1, 512, 2048, 2048, 2048, 4096]
    - [16, 155.66]
  - - [2048, 4096, 1, 1024, 2048, 2048, 2048, 4096]
    - [17, 244.56]
  - - [2048, 4096, 1, 2048, 2048, 2048, 2048, 4096]
    - [17, 358.13]
  - - [2048, 4096, 1, 4096, 2048, 2048, 2048, 4096]
    - [19, 423.72]
  - - [2048, 4096, 1, 8192, 2048, 2048, 2048, 4096]
    - [19, 471.38]
  - - [2048, 8192, 1, 128, 2048, 2048, 2048, 8192]
    - [6, 57.69]
  - - [2048, 8192, 1, 256, 2048, 2048, 2048, 8192]
    - [7, 107.25]
  - - [2048, 8192, 1, 512, 2048, 2048, 2048, 8192]
    - [7, 189.25]
  - - [2048, 8192, 1, 1024, 2048, 2048, 2048, 8192]
    - [11, 312.29]
  - - [2048, 8192, 1, 2048, 2048, 2048, 2048, 8192]
    - [11, 448.72]
  - - [2048, 8192, 1, 4096, 2048, 2048, 2048, 8192]
    - [11, 544.39]
  - - [2048, 8192, 1, 8192, 2048, 2048, 2048, 8192]
    - [7, 620.67]
  - - [4096, 128, 1, 128, 4096, 4096, 4096, 128]
    - [36, 10.46]
  - - [4096, 128, 1, 256, 4096, 4096, 4096, 128]
    - [36, 17.93]
  - - [4096, 128, 1, 512, 4096, 4096, 4096, 128]
    - [36, 28.93]
  - - [4096, 128, 1, 1024, 4096, 4096, 4096, 128]
    - [43, 41.84]
  - - [4096, 128, 1, 2048, 4096, 4096, 4096, 128]
    - [43, 54.6]
  - - [4096, 128, 1, 4096, 4096, 4096, 4096, 128]
    - [43, 64.84]
  - - [4096, 128, 1, 8192, 4096, 4096, 4096, 128]
    - [43, 70.97]
  - - [4096, 256, 1, 128, 4096, 4096, 4096, 256]
    - [38, 18.72]
  - - [4096, 256, 1, 256, 4096, 4096, 4096, 256]
    - [36, 32.72]
  - - [4096, 256, 1, 512, 4096, 4096, 4096, 256]
    - [41, 53.69]
  - - [4096, 256, 1, 1024, 4096, 4096, 4096, 256]
    - [43, 79.47]
  - - [4096, 256, 1, 2048, 4096, 4096, 4096, 256]
    - [43, 104.51]
  - - [4096, 256, 1, 4096, 4096, 4096, 4096, 256]
    - [42, 123.0]
  - - [4096, 256, 1, 8192, 4096, 4096, 4096, 256]
    - [43, 136.52]
  - - [4096, 512, 1, 128, 4096, 4096, 4096, 512]
    - [28, 29.72]
  - - [4096, 512, 1, 256, 4096, 4096, 4096, 512]
    - [29, 52.53]
  - - [4096, 512, 1, 512, 4096, 4096, 4096, 512]
    - [29, 88.96]
  - - [4096, 512, 1, 1024, 4096, 4096, 4096, 512]
    - [30, 133.1]
  - - [4096, 512, 1, 2048, 4096, 4096, 4096, 512]
    - [33, 179.01]
  - - [4096, 512, 1, 4096, 4096, 4096, 4096, 512]
    - [35, 216.61]
  - - [4096, 512, 1, 8192, 4096, 4096, 4096, 512]
    - [35, 243.77]
  - - [4096, 1024, 1, 128, 4096, 4096, 4096, 1024]
    - [22, 39.78]
  - - [4096, 1024, 1, 256, 4096, 4096, 4096, 1024]
    - [24, 70.36]
  - - [4096, 1024, 1, 512, 4096, 4096, 4096, 1024]
    - [27, 119.67]
  - - [4096, 1024, 1, 1024, 4096, 4096, 4096, 1024]
    - [27, 189.63]
  - - [4096, 1024, 1, 2048, 4096, 4096, 4096, 1024]
    - [27, 269.1]
  - - [4096, 1024, 1, 4096, 4096, 4096, 4096, 1024]
    - [27, 330.84]
  - - [4096, 1024, 1, 8192, 4096, 4096, 4096, 1024]
    - [27, 372.02]
  - - [4096, 2048, 1, 128, 4096, 4096, 4096, 2048]
    - [12, 50.85]
  - - [4096, 2048, 1, 256, 4096, 4096, 4096, 2048]
    - [13, 91.37]
  - - [4096, 2048, 1, 512, 4096, 4096, 4096, 2048]
    - [14, 153.15]
  - - [4096, 2048, 1, 1024, 4096, 4096, 4096, 2048]
    - [18, 241.17]
  - - [4096, 2048, 1, 2048, 4096, 4096, 4096, 2048]
    - [18, 346.34]
  - - [4096, 2048, 1, 4096, 4096, 4096, 4096, 2048]
    - [19, 412.51]
  - - [4096, 2048, 1, 8192, 4096, 4096, 4096, 2048]
    - [19, 473.72]
  - - [4096, 4096, 1, 128, 4096, 4096, 4096, 4096]
    - [7, 59.44]
  - - [4096, 4096, 1, 256, 4096, 4096, 4096, 4096]
    - [11, 109.3]
  - - [4096, 4096, 1, 512, 4096, 4096, 4096, 4096]
    - [11, 191.96]
  - - [4096, 4096, 1, 1024, 4096, 4096, 4096, 4096]
    - [11, 314.72]
  - - [4096, 4096, 1, 2048, 4096, 4096, 4096, 4096]
    - [11, 451.05]
  - - [4096, 4096, 1, 4096, 4096, 4096, 4096, 4096]
    - [11, 573.59]
  - - [4096, 4096, 1, 8192, 4096, 4096, 4096, 4096]
    - [11, 623.1]
  - - [4096, 8192, 1, 128, 4096, 4096, 4096, 8192]
    - [11, 63.29]
  - - [4096, 8192, 1, 256, 4096, 4096, 4096, 8192]
    - [7, 116.84]
  - - [4096, 8192, 1, 512, 4096, 4096, 4096, 8192]
    - [11, 203.33]
  - - [4096, 8192, 1, 1024, 4096, 4096, 4096, 8192]
    - [11, 319.74]
  - - [4096, 8192, 1, 2048, 4096, 4096, 4096, 8192]
    - [11, 446.68]
  - - [4096, 8192, 1, 4096, 4096, 4096, 4096, 8192]
    - [11, 561.04]
  - - [4096, 8192, 1, 8192, 4096, 4096, 4096, 8192]
    - [11, 680.9]
  - - [8192, 128, 1, 128, 8192, 8192, 8192, 128]
    - [37, 18.69]
  - - [8192, 128, 1, 256, 8192, 8192, 8192, 128]
    - [36, 32.4]
  - - [8192, 128, 1, 512, 8192, 8192, 8192, 128]
    - [36, 53.6]
  - - [8192, 128, 1, 1024, 8192, 8192, 8192, 128]
    - [42, 78.92]
  - - [8192, 128, 1, 2048, 8192, 8192, 8192, 128]
    - [42, 103.82]
  - - [8192, 128, 1, 4096, 8192, 8192, 8192, 128]
    - [42, 123.62]
  - - [8192, 128, 1, 8192, 8192, 8192, 8192, 128]
    - [43, 135.77]
  - - [8192, 256, 1, 128, 8192, 8192, 8192, 256]
    - [5, 30.15]
  - - [8192, 256, 1, 256, 8192, 8192, 8192, 256]
    - [31, 52.93]
  - - [8192, 256, 1, 512, 8192, 8192, 8192, 256]
    - [35, 89.36]
  - - [8192, 256, 1, 1024, 8192, 8192, 8192, 256]
    - [34, 133.46]
  - - [8192, 256, 1, 2048, 8192, 8192, 8192, 256]
    - [33, 179.11]
  - - [8192, 256, 1, 4096, 8192, 8192, 8192, 256]
    - [35, 217.0]
  - - [8192, 256, 1, 8192, 8192, 8192, 8192, 256]
    - [35, 240.78]
  - - [8192, 512, 1, 128, 8192, 8192, 8192, 512]
    - [20, 38.53]
  - - [8192, 512, 1, 256, 8192, 8192, 8192, 512]
    - [26, 68.06]
  - - [8192, 512, 1, 512, 8192, 8192, 8192, 512]
    - [21, 122.57]
  - - [8192, 512, 1, 1024, 8192, 8192, 8192, 512]
    - [27, 188.46]
  - - [8192, 512, 1, 2048, 8192, 8192, 8192, 512]
    - [27, 272.35]
  - - [8192, 512, 1, 4096, 8192, 8192, 8192, 512]
    - [27, 332.55]
  - - [8192, 512, 1, 8192, 8192, 8192, 8192, 512]
    - [27, 375.98]
  - - [8192, 1024, 1, 128, 8192, 8192, 8192, 1024]
    - [2, 51.87]
  - - [8192, 1024, 1, 256, 8192, 8192, 8192, 1024]
    - [14, 93.16]
  - - [8192, 1024, 1, 512, 8192, 8192, 8192, 1024]
    - [14, 156.91]
  - - [8192, 1024, 1, 1024, 8192, 8192, 8192, 1024]
    - [17, 245.03]
  - - [8192, 1024, 1, 2048, 8192, 8192, 8192, 1024]
    - [17, 350.19]
  - - [8192, 1024, 1, 4096, 8192, 8192, 8192, 1024]
    - [17, 411.03]
  - - [8192, 1024, 1, 8192, 8192, 8192, 8192, 1024]
    - [15, 454.4]
  - - [8192, 2048, 1, 128, 8192, 8192, 8192, 2048]
    - [0, 58.36]
  - - [8192, 2048, 1, 256, 8192, 8192, 8192, 2048]
    - [7, 108.87]
  - - [8192, 2048, 1, 512, 8192, 8192, 8192, 2048]
    - [11, 191.98]
  - - [8192, 2048, 1, 1024, 8192, 8192, 8192, 2048]
    - [11, 308.68]
  - - [8192, 2048, 1, 2048, 8192, 8192, 8192, 2048]
    - [11, 439.29]
  - - [8192, 2048, 1, 4096, 8192, 8192, 8192, 2048]
    - [7, 537.44]
  - - [8192, 2048, 1, 8192, 8192, 8192, 8192, 2048]
    - [11, 618.58]
  - - [8192, 4096, 1, 128, 8192, 8192, 8192, 4096]
    - [6, 63.88]
  - - [8192, 4096, 1, 256, 8192, 8192, 8192, 4096]
    - [6, 117.14]
  - - [8192, 4096, 1, 512, 8192, 8192, 8192, 4096]
    - [6, 203.78]
  - - [8192, 4096, 1, 1024, 8192, 8192, 8192, 4096]
    - [8, 321.23]
  - - [8192, 4096, 1, 2048, 8192, 8192, 8192, 4096]
    - [11, 444.65]
  - - [8192, 4096, 1, 4096, 8192, 8192, 8192, 4096]
    - [11, 555.04]
  - - [8192, 4096, 1, 8192, 8192, 8192, 8192, 4096]
    - [11, 668.93]
  - - [8192, 8192, 1, 128, 8192, 8192, 8192, 8192]
    - [10, 69.86]
  - - [8192, 8192, 1, 256, 8192, 8192, 8192, 8192]
    - [9, 128.61]
  - - [8192, 8192, 1, 512, 8192, 8192, 8192, 8192]
    - [10, 220.27]
  - - [8192, 8192, 1, 1024, 8192, 8192, 8192, 8192]
    - [7, 342.03]
  - - [8192, 8192, 1, 2048, 8192, 8192, 8192, 8192]
    - [8, 469.4]
  - - [8192, 8192, 1, 4096, 8192, 8192, 8192, 8192]
    - [11, 609.18]
  - - [8192, 8192, 1, 8192, 8192, 8192, 8192, 8192]
    - [11, 716.6]
- null
- null
- DeviceEfficiency
- GridBased
