projects/hipblaslt/library/src/amd_detail/rocblaslt/src/Tensile/Logic/asm_full/gfx950/gfx950/GridBased/gfx950_Cijk_Alik_Bljk_I8_BH_UserArgs.yaml
- {MinimumRequiredVersion: 5.0.0}
- gfx950
- gfx950
- [Device 75a0]
    SolutionIndex: 0
    SolutionNameMin: Cijk_Alik_Bljk_I8_BH_UserArgs_MT256x256x64_MI16x16x1_SN_LDSB0_AFC0_AFEM1_AFEM1_ASEM1_CLR0_CADS0_DTVA0_DTVB0_EPS0_FDSI0_GRPM1_GRVWA8_GRVWB16_GSU0_GSUAMB_GSUC0_GSUWGMRR0_GLS0_ISA950_IU1_K1_LBSPPA512_LBSPPB256_LBSPPM0_LPA32_LPB32_LPM0_LRVW16_LWPMn1_MIAV0_MIWT8_8_MO40_NTn1_NTA0_NTB0_NTC0_NTD0_NTM0_NEPBS0_NLCA1_NLCB1_ONLL1_PGR2_PLR0_PKA1_SIA3_SS1_SU0_SUM1_SUS64_SPO0_SRVW0_SSO0_SVW8_SK3_SKXCCM8_TLDS1_ULSGRO0_USL1_UIOFGRO0_USFGRO0_VSn1_VWA8_VWB4_WSGRA0_WSGRB0_WS64_WG32_8_1_WGM6_WGMXCC1_WGMXCCGn1
    SolutionIndex: 1
    SolutionNameMin: Cijk_Alik_Bljk_I8_BH_UserArgs_MT256x256x64_MI16x16x1_SN_LDSB0_AFC0_AFEM1_AFEM1_ASEM1_CLR0_CADS0_DTVA0_DTVB0_EPS0_FDSI0_GRPM1_GRVWA8_GRVWB16_GSU0_GSUAMB_GSUC0_GSUWGMRR0_GLS0_ISA950_IU1_K1_LBSPPA512_LBSPPB512_LBSPPM0_LPA32_LPB32_LPM0_LRVW16_LWPMn1_MIAV0_MIWT8_8_MO40_NTn1_NTA0_NTB0_NTC0_NTD0_NTM0_NEPBS0_NLCA1_NLCB1_ONLL1_PGR2_PLR0_PKA1_SIA3_SS1_SU0_SUM1_SUS64_SPO0_SRVW0_SSO0_SVW8_SK3_SKXCCM8_TLDS1_ULSGRO0_USL1_UIOFGRO0_USFGRO0_VSn1_VWA8_VWB8_WSGRA0_WSGRB0_WS64_WG32_8_1_WGM6_WGMXCC1_WGMXCCGn1
    SolutionIndex: 2
    SolutionNameMin: Cijk_Alik_Bljk_I8_BH_UserArgs_MT256x256x64_MI16x16x1_SN_LDSB0_AFC0_AFEM1_AFEM1_ASEM1_CLR0_CADS0_DTVA0_DTVB0_EPS0_FDSI0_GRPM1_GRVWA16_GRVWB16_GSU0_GSUAMB_GSUC0_GSUWGMRR0_GLS0_ISA950_IU1_K1_LBSPPA256_LBSPPB128_LBSPPM0_LPA32_LPB32_LPM0_LRVW16_LWPMn1_MIAV0_MIWT8_8_MO40_NTn1_NTA0_NTB0_NTC0_NTD0_NTM0_NEPBS0_NLCA1_NLCB1_ONLL1_PGR2_PLR0_PKA1_SIA3_SS1_SU0_SUM1_SUS64_SPO0_SRVW0_SSO0_SVW4_SK3_SKXCCM8_TLDS1_ULSGRO0_USL1_UIOFGRO0_USFGRO0_VSn1_VWA4_VWB2_WSGRA0_WSGRB0_WS64_WG32_8_1_WGM6_WGMXCC1_WGMXCCGn1
    SolutionIndex: 3
    SolutionNameMin: Cijk_Alik_Bljk_I8_BH_UserArgs_MT256x256x64_MI16x16x1_SN_LDSB0_AFC0_AFEM1_AFEM1_ASEM1_CLR0_CADS0_DTVA0_DTVB0_EPS0_FDSI0_GRPM1_GRVWA16_GRVWB16_GSU0_GSUAMB_GSUC0_GSUWGMRR0_GLS0_ISA950_IU1_K1_LBSPPA256_LBSPPB256_LBSPPM0_LPA32_LPB32_LPM0_LRVW16_LWPMn1_MIAV0_MIWT8_8_MO40_NTn1_NTA0_NTB0_NTC0_NTD0_NTM0_NEPBS0_NLCA1_NLCB1_ONLL1_PGR2_PLR0_PKA1_SIA3_SS1_SU0_SUM1_SUS64_SPO0_SRVW0_SSO0_SVW4_SK3_SKXCCM8_TLDS1_ULSGRO0_USL1_UIOFGRO0_USFGRO0_VSn1_VWA4_VWB4_WSGRA0_WSGRB0_WS64_WG32_8_1_WGM6_WGMXCC1_WGMXCCGn1
    SolutionIndex: 4
    SolutionNameMin: Cijk_Alik_Bljk_I8_BH_UserArgs_MT256x256x64_MI16x16x1_SN_LDSB0_AFC0_AFEM1_AFEM1_ASEM1_CLR0_CADS0_DTVA0_DTVB0_EPS0_FDSI0_GRPM1_GRVWA16_GRVWB16_GSU0_GSUAMB_GSUC0_GSUWGMRR0_GLS0_ISA950_IU1_K1_LBSPPA512_LBSPPB256_LBSPPM0_LPA32_LPB32_LPM0_LRVW16_LWPMn1_MIAV0_MIWT8_8_MO40_NTn1_NTA0_NTB0_NTC0_NTD0_NTM0_NEPBS0_NLCA1_NLCB1_ONLL1_PGR2_PLR0_PKA1_SIA3_SS1_SU0_SUM1_SUS64_SPO0_SRVW0_SSO0_SVW8_SK3_SKXCCM8_TLDS1_ULSGRO0_USL1_UIOFGRO0_USFGRO0_VSn1_VWA8_VWB4_WSGRA0_WSGRB0_WS64_WG32_8_1_WGM6_WGMXCC1_WGMXCCGn1
    SolutionIndex: 5
    SolutionNameMin: Cijk_Alik_Bljk_I8_BH_UserArgs_MT256x256x64_MI16x16x1_SN_LDSB0_AFC0_AFEM1_AFEM1_ASEM1_CLR0_CADS0_DTVA0_DTVB0_EPS0_FDSI0_GRPM1_GRVWA16_GRVWB16_GSU0_GSUAMB_GSUC0_GSUWGMRR0_GLS0_ISA950_IU1_K1_LBSPPA256_LBSPPB512_LBSPPM0_LPA32_LPB32_LPM0_LRVW16_LWPMn1_MIAV0_MIWT8_8_MO40_NTn1_NTA0_NTB0_NTC0_NTD0_NTM0_NEPBS0_NLCA1_NLCB1_ONLL1_PGR2_PLR0_PKA1_SIA3_SS1_SU0_SUM1_SUS64_SPO0_SRVW0_SSO0_SVW4_SK3_SKXCCM8_TLDS1_ULSGRO0_USL1_UIOFGRO0_USFGRO0_VSn1_VWA4_VWB8_WSGRA0_WSGRB0_WS64_WG32_8_1_WGM6_WGMXCC1_WGMXCCGn1
    SolutionIndex: 6
    SolutionNameMin: Cijk_Alik_Bljk_I8_BH_UserArgs_MT256x256x64_MI16x16x1_SN_LDSB0_AFC0_AFEM1_AFEM1_ASEM1_CLR0_CADS0_DTVA0_DTVB0_EPS0_FDSI0_GRPM1_GRVWA16_GRVWB16_GSU0_GSUAMB_GSUC0_GSUWGMRR0_GLS0_ISA950_IU1_K1_LBSPPA512_LBSPPB512_LBSPPM0_LPA32_LPB32_LPM0_LRVW16_LWPMn1_MIAV0_MIWT8_8_MO40_NTn1_NTA0_NTB0_NTC0_NTD0_NTM0_NEPBS0_NLCA1_NLCB1_ONLL1_PGR2_PLR0_PKA1_SIA3_SS1_SU0_SUM1_SUS64_SPO0_SRVW0_SSO0_SVW8_SK3_SKXCCM8_TLDS1_ULSGRO0_USL1_UIOFGRO0_USFGRO0_VSn1_VWA8_VWB8_WSGRA0_WSGRB0_WS64_WG32_8_1_WGM6_WGMXCC1_WGMXCCGn1
    SolutionIndex: 7
    SolutionNameMin: Cijk_Alik_Bljk_I8_BH_UserArgs_MT256x64x64_MI16x16x1_SN_LDSB1_AFC0_AFEM1_AFEM1_ASEM1_CLR0_CADS0_DTVA0_DTVB0_EPS0_FDSI0_GRPM1_GRVWA16_GRVWB16_GSU0_GSUAMB_GSUC0_GSUWGMRR0_GLS0_ISA950_IU1_K1_LBSPPA512_LBSPPB128_LBSPPM0_LPA32_LPB32_LPM0_LRVW16_LWPMn1_MIAV0_MIWT8_2_MO40_NTn1_NTA0_NTB0_NTC0_NTD0_NTM0_NEPBS0_NLCA1_NLCB1_ONLL1_PGR2_PLR0_PKA1_SIA3_SS1_SU0_SUM1_SUS64_SPO0_SRVW0_SSO0_SVW8_SK3_SKXCCM8_TLDS1_ULSGRO0_USL1_UIOFGRO0_USFGRO0_VSn1_VWA8_VWB2_WSGRA0_WSGRB0_WS64_WG32_8_1_WGM6_WGMXCC1_WGMXCCGn1
    SolutionIndex: 8
    SolutionNameMin: Cijk_Alik_Bljk_I8_BH_UserArgs_MT64x128x64_MI16x16x1_SN_LDSB0_AFC0_AFEM1_AFEM1_ASEM1_CLR0_CADS0_DTVA0_DTVB0_EPS0_FDSI0_GRPM1_GRVWA8_GRVWB16_GSU0_GSUAMB_GSUC0_GSUWGMRR0_GLS0_ISA950_IU1_K1_LBSPPA128_LBSPPB256_LBSPPM0_LPA32_LPB32_LPM0_LRVW16_LWPMn1_MIAV0_MIWT2_4_MO40_NTn1_NTA0_NTB0_NTC0_NTD0_NTM0_NEPBS0_NLCA1_NLCB1_ONLL1_PGR2_PLR0_PKA1_SIA3_SS1_SU0_SUM1_SUS64_SPO0_SRVW0_SSO0_SVW2_SK3_SKXCCM8_TLDS1_ULSGRO0_USL1_UIOFGRO0_USFGRO0_VSn1_VWA2_VWB4_WSGRA0_WSGRB0_WS64_WG32_8_1_WGM6_WGMXCC1_WGMXCCGn1
    SolutionIndex: 9
    SolutionNameMin: Cijk_Alik_Bljk_I8_BH_UserArgs_MT128x64x64_MI16x16x1_SN_LDSB0_AFC0_AFEM1_AFEM1_ASEM1_CLR0_CADS0_DTVA0_DTVB0_EPS0_FDSI0_GRPM1_GRVWA16_GRVWB16_GSU0_GSUAMB_GSUC0_GSUWGMRR0_GLS0_ISA950_IU1_K1_LBSPPA256_LBSPPB128_LBSPPM0_LPA32_LPB32_LPM0_LRVW16_LWPMn1_MIAV0_MIWT4_2_MO40_NTn1_NTA0_NTB0_NTC0_NTD0_NTM0_NEPBS0_NLCA1_NLCB1_ONLL1_PGR2_PLR0_PKA1_SIA3_SS1_SU0_SUM1_SUS64_SPO0_SRVW0_SSO0_SVW4_SK3_SKXCCM8_TLDS1_ULSGRO0_USL1_UIOFGRO0_USFGRO0_VSn1_VWA4_VWB2_WSGRA0_WSGRB0_WS64_WG32_8_1_WGM6_WGMXCC1_WGMXCCGn1
    SolutionIndex: 10
    SolutionNameMin: Cijk_Alik_Bljk_I8_BH_UserArgs_MT64x64x64_MI16x16x1_SN_LDSB0_AFC0_AFEM1_AFEM1_ASEM1_CLR0_CADS0_DTVA0_DTVB0_EPS0_FDSI0_GRPM1_GRVWA16_GRVWB4_GSU0_GSUAMB_GSUC0_GSUWGMRR0_GLS0_ISA950_IU1_K1_LBSPPA128_LBSPPB128_LBSPPM0_LPA32_LPB32_LPM0_LRVW16_LWPMn1_MIAV0_MIWT2_2_MO40_NTn1_NTA0_NTB0_NTC0_NTD0_NTM0_NEPBS0_NLCA1_NLCB1_ONLL1_PGR2_PLR0_PKA1_SIA3_SS1_SU0_SUM1_SUS64_SPO0_SRVW0_SSO0_SVW2_SK3_SKXCCM8_TLDS1_ULSGRO0_USL1_UIOFGRO0_USFGRO0_VSn1_VWA2_VWB2_WSGRA0_WSGRB0_WS64_WG32_8_1_WGM6_WGMXCC1_WGMXCCGn1
    SolutionIndex: 11
    SolutionNameMin: Cijk_Alik_Bljk_I8_BH_UserArgs_MT64x64x64_MI16x16x1_SN_LDSB0_AFC0_AFEM1_AFEM1_ASEM1_CLR0_CADS0_DTVA0_DTVB0_EPS0_FDSI0_GRPM1_GRVWA8_GRVWB8_GSU0_GSUAMB_GSUC0_GSUWGMRR0_GLS0_ISA950_IU1_K1_LBSPPA128_LBSPPB128_LBSPPM0_LPA32_LPB32_LPM0_LRVW16_LWPMn1_MIAV0_MIWT2_2_MO40_NTn1_NTA0_NTB0_NTC0_NTD0_NTM0_NEPBS0_NLCA1_NLCB1_ONLL1_PGR2_PLR0_PKA1_SIA3_SS1_SU0_SUM1_SUS64_SPO0_SRVW0_SSO0_SVW2_SK3_SKXCCM8_TLDS1_ULSGRO0_USL1_UIOFGRO0_USFGRO0_VSn1_VWA2_VWB2_WSGRA0_WSGRB0_WS64_WG32_8_1_WGM6_WGMXCC1_WGMXCCGn1
    SolutionIndex: 12
    SolutionNameMin: Cijk_Alik_Bljk_I8_BH_UserArgs_MT64x64x64_MI16x16x1_SN_LDSB0_AFC0_AFEM1_AFEM1_ASEM1_CLR0_CADS0_DTVA0_DTVB0_EPS0_FDSI0_GRPM1_GRVWA16_GRVWB8_GSU0_GSUAMB_GSUC0_GSUWGMRR0_GLS0_ISA950_IU1_K1_LBSPPA128_LBSPPB128_LBSPPM0_LPA32_LPB32_LPM0_LRVW16_LWPMn1_MIAV0_MIWT2_2_MO40_NTn1_NTA0_NTB0_NTC0_NTD0_NTM0_NEPBS0_NLCA1_NLCB1_ONLL1_PGR2_PLR0_PKA1_SIA3_SS1_SU0_SUM1_SUS64_SPO0_SRVW0_SSO0_SVW2_SK3_SKXCCM8_TLDS1_ULSGRO0_USL1_UIOFGRO0_USFGRO0_VSn1_VWA2_VWB2_WSGRA0_WSGRB0_WS64_WG32_8_1_WGM6_WGMXCC1_WGMXCCGn1
    SolutionIndex: 13
    SolutionNameMin: Cijk_Alik_Bljk_I8_BH_UserArgs_MT64x64x64_MI16x16x1_SN_LDSB0_AFC0_AFEM1_AFEM1_ASEM1_CLR0_CADS0_DTVA0_DTVB0_EPS0_FDSI0_GRPM1_GRVWA4_GRVWB16_GSU0_GSUAMB_GSUC0_GSUWGMRR0_GLS0_ISA950_IU1_K1_LBSPPA128_LBSPPB128_LBSPPM0_LPA32_LPB32_LPM0_LRVW16_LWPMn1_MIAV0_MIWT2_2_MO40_NTn1_NTA0_NTB0_NTC0_NTD0_NTM0_NEPBS0_NLCA1_NLCB1_ONLL1_PGR2_PLR0_PKA1_SIA3_SS1_SU0_SUM1_SUS64_SPO0_SRVW0_SSO0_SVW2_SK3_SKXCCM8_TLDS1_ULSGRO0_USL1_UIOFGRO0_USFGRO0_VSn1_VWA2_VWB2_WSGRA0_WSGRB0_WS64_WG32_8_1_WGM6_WGMXCC1_WGMXCCGn1
    SolutionIndex: 14
    SolutionNameMin: Cijk_Alik_Bljk_I8_BH_UserArgs_MT64x64x64_MI16x16x1_SN_LDSB0_AFC0_AFEM1_AFEM1_ASEM1_CLR0_CADS0_DTVA0_DTVB0_EPS0_FDSI0_GRPM1_GRVWA8_GRVWB16_GSU0_GSUAMB_GSUC0_GSUWGMRR0_GLS0_ISA950_IU1_K1_LBSPPA128_LBSPPB128_LBSPPM0_LPA32_LPB32_LPM0_LRVW16_LWPMn1_MIAV0_MIWT2_2_MO40_NTn1_NTA0_NTB0_NTC0_NTD0_NTM0_NEPBS0_NLCA1_NLCB1_ONLL1_PGR2_PLR0_PKA1_SIA3_SS1_SU0_SUM1_SUS64_SPO0_SRVW0_SSO0_SVW2_SK3_SKXCCM8_TLDS1_ULSGRO0_USL1_UIOFGRO0_USFGRO0_VSn1_VWA2_VWB2_WSGRA0_WSGRB0_WS64_WG32_8_1_WGM6_WGMXCC1_WGMXCCGn1
    SolutionIndex: 15
    SolutionNameMin: Cijk_Alik_Bljk_I8_BH_UserArgs_MT64x64x64_MI16x16x1_SN_LDSB0_AFC0_AFEM1_AFEM1_ASEM1_CLR0_CADS0_DTVA0_DTVB0_EPS0_FDSI0_GRPM1_GRVWA16_GRVWB16_GSU0_GSUAMB_GSUC0_GSUWGMRR0_GLS0_ISA950_IU1_K1_LBSPPA128_LBSPPB128_LBSPPM0_LPA32_LPB32_LPM0_LRVW16_LWPMn1_MIAV0_MIWT2_2_MO40_NTn1_NTA0_NTB0_NTC0_NTD0_NTM0_NEPBS0_NLCA1_NLCB1_ONLL1_PGR2_PLR0_PKA1_SIA3_SS1_SU0_SUM1_SUS64_SPO0_SRVW0_SSO0_SVW2_SK3_SKXCCM8_TLDS1_ULSGRO0_USL1_UIOFGRO0_USFGRO0_VSn1_VWA2_VWB2_WSGRA0_WSGRB0_WS64_WG32_8_1_WGM6_WGMXCC1_WGMXCCGn1
    SolutionIndex: 16
    SolutionNameMin: Cijk_Alik_Bljk_I8_BH_UserArgs_MT256x256x64_MI32x32x1_SN_LDSB0_AFC0_AFEM1_AFEM1_ASEM1_CLR1_CADS0_DTVA0_DTVB0_EPS0_FDSI0_GRPM1_GRVWA16_GRVWB16_GSU0_GSUAMB_GSUC0_GSUWGMRR0_GLS0_ISA950_IU1_K1_LBSPPA256_LBSPPB128_LBSPPM0_LPA16_LPB16_LPM0_LRVW16_LWPMn1_MIAV0_MIWT4_4_MO40_NTn1_NTA0_NTB0_NTC0_NTD0_NTM0_NEPBS0_NLCA1_NLCB1_ONLL1_PGR2_PLR1_PKA1_SIA3_SS1_SU0_SUM1_SUS64_SPO0_SRVW0_SSO0_SVW4_SK3_SKXCCM8_TLDS1_ULSGRO0_USL1_UIOFGRO0_USFGRO0_VSn1_VWA4_VWB2_WSGRA0_WSGRB0_WS64_WG64_4_1_WGM6_WGMXCC1_WGMXCCGn1
    SolutionIndex: 17
    SolutionNameMin: Cijk_Alik_Bljk_I8_BH_UserArgs_MT256x256x128_MI16x16x1_SN_LDSB1_AFC0_AFEM1_AFEM1_ASEM1_CLR1_CADS0_DTVA0_DTVB0_EPS0_FDSI0_GRPM1_GRVWA16_GRVWB16_GSU0_GSUAMB_GSUC0_GSUWGMRR0_GLS0_ISA950_IU1_K1_LBSPPA1024_LBSPPB256_LBSPPM0_LPA32_LPB32_LPM0_LRVW16_LWPMn1_MIAV0_MIWT8_8_MO40_NTn1_NTA0_NTB0_NTC0_NTD0_NTM0_NEPBS0_NLCA1_NLCB1_ONLL1_PGR2_PLR1_PKA1_SIA3_SS1_SU0_SUM1_SUS128_SPO0_SRVW0_SSO0_SVW8_SK3_SKXCCM8_TLDS1_ULSGRO0_USL1_UIOFGRO0_USFGRO0_VSn1_VWA8_VWB2_WSGRA0_WSGRB0_WS64_WG32_8_1_WGM6_WGMXCC1_WGMXCCGn1
    SolutionIndex: 18
    SolutionNameMin: Cijk_Alik_Bljk_I8_BH_UserArgs_MT256x256x128_MI16x16x1_SN_LDSB1_AFC0_AFEM1_AFEM1_ASEM1_CLR1_CADS0_DTVA0_DTVB0_EPS0_FDSI0_GRPM1_GRVWA16_GRVWB16_GSU0_GSUAMB_GSUC0_GSUWGMRR0_GLS0_ISA950_IU1_K1_LBSPPA256_LBSPPB512_LBSPPM0_LPA32_LPB32_LPM0_LRVW16_LWPMn1_MIAV0_MIWT8_8_MO40_NTn1_NTA0_NTB0_NTC0_NTD0_NTM0_NEPBS0_NLCA1_NLCB1_ONLL1_PGR2_PLR1_PKA1_SIA3_SS1_SU0_SUM1_SUS128_SPO0_SRVW0_SSO0_SVW2_SK3_SKXCCM8_TLDS1_ULSGRO0_USL1_UIOFGRO0_USFGRO0_VSn1_VWA2_VWB4_WSGRA0_WSGRB0_WS64_WG32_8_1_WGM6_WGMXCC1_WGMXCCGn1
    SolutionIndex: 19
    SolutionNameMin: Cijk_Alik_Bljk_I8_BH_UserArgs_MT256x256x128_MI16x16x1_SN_LDSB1_AFC0_AFEM1_AFEM1_ASEM1_CLR1_CADS0_DTVA0_DTVB0_EPS0_FDSI0_GRPM1_GRVWA16_GRVWB16_GSU0_GSUAMB_GSUC0_GSUWGMRR0_GLS0_ISA950_IU1_K1_LBSPPA512_LBSPPB512_LBSPPM0_LPA32_LPB32_LPM0_LRVW16_LWPMn1_MIAV0_MIWT8_8_MO40_NTn1_NTA0_NTB0_NTC0_NTD0_NTM0_NEPBS0_NLCA1_NLCB1_ONLL1_PGR2_PLR1_PKA1_SIA3_SS1_SU0_SUM1_SUS128_SPO0_SRVW0_SSO0_SVW4_SK3_SKXCCM8_TLDS1_ULSGRO0_USL1_UIOFGRO0_USFGRO0_VSn1_VWA4_VWB4_WSGRA0_WSGRB0_WS64_WG32_8_1_WGM6_WGMXCC1_WGMXCCGn1
    SolutionIndex: 20
    SolutionNameMin: Cijk_Alik_Bljk_I8_BH_UserArgs_MT256x256x128_MI16x16x1_SN_LDSB1_AFC0_AFEM1_AFEM1_ASEM1_CLR1_CADS0_DTVA0_DTVB0_EPS0_FDSI0_GRPM1_GRVWA16_GRVWB16_GSU0_GSUAMB_GSUC0_GSUWGMRR0_GLS0_ISA950_IU1_K1_LBSPPA1024_LBSPPB512_LBSPPM0_LPA32_LPB32_LPM0_LRVW16_LWPMn1_MIAV0_MIWT8_8_MO40_NTn1_NTA0_NTB0_NTC0_NTD0_NTM0_NEPBS0_NLCA1_NLCB1_ONLL1_PGR2_PLR1_PKA1_SIA3_SS1_SU0_SUM1_SUS128_SPO0_SRVW0_SSO0_SVW8_SK3_SKXCCM8_TLDS1_ULSGRO0_USL1_UIOFGRO0_USFGRO0_VSn1_VWA8_VWB4_WSGRA0_WSGRB0_WS64_WG32_8_1_WGM6_WGMXCC1_WGMXCCGn1
    SolutionIndex: 21
    SolutionNameMin: Cijk_Alik_Bljk_I8_BH_UserArgs_MT256x256x128_MI16x16x1_SN_LDSB1_AFC0_AFEM1_AFEM1_ASEM1_CLR1_CADS0_DTVA0_DTVB0_EPS0_FDSI0_GRPM1_GRVWA16_GRVWB16_GSU0_GSUAMB_GSUC0_GSUWGMRR0_GLS0_ISA950_IU1_K1_LBSPPA512_LBSPPB1024_LBSPPM0_LPA32_LPB32_LPM0_LRVW16_LWPMn1_MIAV0_MIWT8_8_MO40_NTn1_NTA0_NTB0_NTC0_NTD0_NTM0_NEPBS0_NLCA1_NLCB1_ONLL1_PGR2_PLR1_PKA1_SIA3_SS1_SU0_SUM1_SUS128_SPO0_SRVW0_SSO0_SVW4_SK3_SKXCCM8_TLDS1_ULSGRO0_USL1_UIOFGRO0_USFGRO0_VSn1_VWA4_VWB8_WSGRA0_WSGRB0_WS64_WG32_8_1_WGM6_WGMXCC1_WGMXCCGn1
    SolutionIndex: 22
    SolutionNameMin: Cijk_Alik_Bljk_I8_BH_UserArgs_MT256x256x128_MI16x16x1_SN_LDSB1_AFC0_AFEM1_AFEM1_ASEM1_CLR1_CADS0_DTVA0_DTVB0_EPS0_FDSI0_GRPM1_GRVWA16_GRVWB16_GSU0_GSUAMB_GSUC0_GSUWGMRR0_GLS0_ISA950_IU1_K1_LBSPPA1024_LBSPPB1024_LBSPPM0_LPA32_LPB32_LPM0_LRVW16_LWPMn1_MIAV0_MIWT8_8_MO40_NTn1_NTA0_NTB0_NTC0_NTD0_NTM0_NEPBS0_NLCA1_NLCB1_ONLL1_PGR2_PLR1_PKA1_SIA3_SS1_SU0_SUM1_SUS128_SPO0_SRVW0_SSO0_SVW8_SK3_SKXCCM8_TLDS1_ULSGRO0_USL1_UIOFGRO0_USFGRO0_VSn1_VWA8_VWB8_WSGRA0_WSGRB0_WS64_WG32_8_1_WGM6_WGMXCC1_WGMXCCGn1
    SolutionIndex: 23
    SolutionNameMin: Cijk_Alik_Bljk_I8_BH_UserArgs_MT256x128x128_MI16x16x1_SN_LDSB1_AFC0_AFEM1_AFEM1_ASEM1_CLR1_CADS0_DTVA0_DTVB0_EPS0_FDSI0_GRPM1_GRVWA16_GRVWB16_GSU0_GSUAMB_GSUC0_GSUWGMRR0_GLS0_ISA950_IU1_K1_LBSPPA512_LBSPPB256_LBSPPM0_LPA32_LPB32_LPM0_LRVW16_LWPMn1_MIAV0_MIWT8_4_MO40_NTn1_NTA0_NTB0_NTC0_NTD0_NTM0_NEPBS0_NLCA1_NLCB1_ONLL1_PGR2_PLR1_PKA1_SIA3_SS1_SU0_SUM1_SUS128_SPO0_SRVW0_SSO0_SVW4_SK3_SKXCCM8_TLDS1_ULSGRO0_USL1_UIOFGRO0_USFGRO0_VSn1_VWA4_VWB2_WSGRA0_WSGRB0_WS64_WG32_8_1_WGM6_WGMXCC1_WGMXCCGn1
    SolutionIndex: 24
    SolutionNameMin: Cijk_Alik_Bljk_I8_BH_UserArgs_MT256x128x128_MI16x16x1_SN_LDSB1_AFC0_AFEM1_AFEM1_ASEM1_CLR1_CADS0_DTVA0_DTVB0_EPS0_FDSI0_GRPM1_GRVWA16_GRVWB16_GSU0_GSUAMB_GSUC0_GSUWGMRR0_GLS0_ISA950_IU1_K1_LBSPPA1024_LBSPPB256_LBSPPM0_LPA32_LPB32_LPM0_LRVW16_LWPMn1_MIAV0_MIWT8_4_MO40_NTn1_NTA0_NTB0_NTC0_NTD0_NTM0_NEPBS0_NLCA1_NLCB1_ONLL1_PGR2_PLR1_PKA1_SIA3_SS1_SU0_SUM1_SUS128_SPO0_SRVW0_SSO0_SVW8_SK3_SKXCCM8_TLDS1_ULSGRO0_USL1_UIOFGRO0_USFGRO0_VSn1_VWA8_VWB2_WSGRA0_WSGRB0_WS64_WG32_8_1_WGM6_WGMXCC1_WGMXCCGn1
    SolutionIndex: 25
    SolutionNameMin: Cijk_Alik_Bljk_I8_BH_UserArgs_MT256x128x128_MI16x16x1_SN_LDSB1_AFC0_AFEM1_AFEM1_ASEM1_CLR1_CADS0_DTVA0_DTVB0_EPS0_FDSI0_GRPM1_GRVWA16_GRVWB16_GSU0_GSUAMB_GSUC0_GSUWGMRR0_GLS0_ISA950_IU1_K1_LBSPPA256_LBSPPB512_LBSPPM0_LPA32_LPB32_LPM0_LRVW16_LWPMn1_MIAV0_MIWT8_4_MO40_NTn1_NTA0_NTB0_NTC0_NTD0_NTM0_NEPBS0_NLCA1_NLCB1_ONLL1_PGR2_PLR1_PKA1_SIA3_SS1_SU0_SUM1_SUS128_SPO0_SRVW0_SSO0_SVW2_SK3_SKXCCM8_TLDS1_ULSGRO0_USL1_UIOFGRO0_USFGRO0_VSn1_VWA2_VWB4_WSGRA0_WSGRB0_WS64_WG32_8_1_WGM6_WGMXCC1_WGMXCCGn1
    SolutionIndex: 26
    SolutionNameMin: Cijk_Alik_Bljk_I8_BH_UserArgs_MT256x128x128_MI16x16x1_SN_LDSB1_AFC0_AFEM1_AFEM1_ASEM1_CLR1_CADS0_DTVA0_DTVB0_EPS0_FDSI0_GRPM1_GRVWA16_GRVWB16_GSU0_GSUAMB_GSUC0_GSUWGMRR0_GLS0_ISA950_IU1_K1_LBSPPA512_LBSPPB512_LBSPPM0_LPA32_LPB32_LPM0_LRVW16_LWPMn1_MIAV0_MIWT8_4_MO40_NTn1_NTA0_NTB0_NTC0_NTD0_NTM0_NEPBS0_NLCA1_NLCB1_ONLL1_PGR2_PLR1_PKA1_SIA3_SS1_SU0_SUM1_SUS128_SPO0_SRVW0_SSO0_SVW4_SK3_SKXCCM8_TLDS1_ULSGRO0_USL1_UIOFGRO0_USFGRO0_VSn1_VWA4_VWB4_WSGRA0_WSGRB0_WS64_WG32_8_1_WGM6_WGMXCC1_WGMXCCGn1
    SolutionIndex: 27
    SolutionNameMin: Cijk_Alik_Bljk_I8_BH_UserArgs_MT256x128x128_MI16x16x1_SN_LDSB1_AFC0_AFEM1_AFEM1_ASEM1_CLR1_CADS0_DTVA0_DTVB0_EPS0_FDSI0_GRPM1_GRVWA16_GRVWB16_GSU0_GSUAMB_GSUC0_GSUWGMRR0_GLS0_ISA950_IU1_K1_LBSPPA1024_LBSPPB512_LBSPPM0_LPA32_LPB32_LPM0_LRVW16_LWPMn1_MIAV0_MIWT8_4_MO40_NTn1_NTA0_NTB0_NTC0_NTD0_NTM0_NEPBS0_NLCA1_NLCB1_ONLL1_PGR2_PLR1_PKA1_SIA3_SS1_SU0_SUM1_SUS128_SPO0_SRVW0_SSO0_SVW8_SK3_SKXCCM8_TLDS1_ULSGRO0_USL1_UIOFGRO0_USFGRO0_VSn1_VWA8_VWB4_WSGRA0_WSGRB0_WS64_WG32_8_1_WGM6_WGMXCC1_WGMXCCGn1
    SolutionIndex: 28
    SolutionNameMin: Cijk_Alik_Bljk_I8_BH_UserArgs_MT256x64x128_MI16x16x1_SN_LDSB1_AFC0_AFEM1_AFEM1_ASEM1_CLR1_CADS0_DTVA0_DTVB0_EPS0_FDSI0_GRPM1_GRVWA16_GRVWB16_GSU0_GSUAMB_GSUC0_GSUWGMRR0_GLS0_ISA950_IU1_K1_LBSPPA1024_LBSPPB256_LBSPPM0_LPA32_LPB32_LPM0_LRVW16_LWPMn1_MIAV0_MIWT8_2_MO40_NTn1_NTA0_NTB0_NTC0_NTD0_NTM0_NEPBS0_NLCA1_NLCB1_ONLL1_PGR2_PLR1_PKA1_SIA3_SS1_SU0_SUM1_SUS128_SPO0_SRVW0_SSO0_SVW8_SK3_SKXCCM8_TLDS1_ULSGRO0_USL1_UIOFGRO0_USFGRO0_VSn1_VWA8_VWB2_WSGRA0_WSGRB0_WS64_WG32_8_1_WGM6_WGMXCC1_WGMXCCGn1
    SolutionIndex: 29
    SolutionNameMin: Cijk_Alik_Bljk_I8_BH_UserArgs_MT128x128x128_MI16x16x1_SN_LDSB1_AFC0_AFEM1_AFEM1_ASEM1_CLR1_CADS0_DTVA0_DTVB0_EPS0_FDSI0_GRPM1_GRVWA16_GRVWB16_GSU0_GSUAMB_GSUC0_GSUWGMRR0_GLS0_ISA950_IU1_K1_LBSPPA256_LBSPPB256_LBSPPM0_LPA32_LPB32_LPM0_LRVW16_LWPMn1_MIAV0_MIWT4_4_MO40_NTn1_NTA0_NTB0_NTC0_NTD0_NTM0_NEPBS0_NLCA1_NLCB1_ONLL1_PGR2_PLR1_PKA1_SIA3_SS1_SU0_SUM1_SUS128_SPO0_SRVW0_SSO0_SVW2_SK3_SKXCCM8_TLDS1_ULSGRO0_USL1_UIOFGRO0_USFGRO0_VSn1_VWA2_VWB2_WSGRA0_WSGRB0_WS64_WG32_8_1_WGM6_WGMXCC1_WGMXCCGn1
    SolutionIndex: 30
    SolutionNameMin: Cijk_Alik_Bljk_I8_BH_UserArgs_MT128x128x128_MI16x16x1_SN_LDSB1_AFC0_AFEM1_AFEM1_ASEM1_CLR1_CADS0_DTVA0_DTVB0_EPS0_FDSI0_GRPM1_GRVWA16_GRVWB16_GSU0_GSUAMB_GSUC0_GSUWGMRR0_GLS0_ISA950_IU1_K1_LBSPPA512_LBSPPB256_LBSPPM0_LPA32_LPB32_LPM0_LRVW16_LWPMn1_MIAV0_MIWT4_4_MO40_NTn1_NTA0_NTB0_NTC0_NTD0_NTM0_NEPBS0_NLCA1_NLCB1_ONLL1_PGR2_PLR1_PKA1_SIA3_SS1_SU0_SUM1_SUS128_SPO0_SRVW0_SSO0_SVW4_SK3_SKXCCM8_TLDS1_ULSGRO0_USL1_UIOFGRO0_USFGRO0_VSn1_VWA4_VWB2_WSGRA0_WSGRB0_WS64_WG32_8_1_WGM6_WGMXCC1_WGMXCCGn1
    SolutionIndex: 31
    SolutionNameMin: Cijk_Alik_Bljk_I8_BH_UserArgs_MT128x128x128_MI16x16x1_SN_LDSB1_AFC0_AFEM1_AFEM1_ASEM1_CLR1_CADS0_DTVA0_DTVB0_EPS0_FDSI0_GRPM1_GRVWA16_GRVWB16_GSU0_GSUAMB_GSUC0_GSUWGMRR0_GLS0_ISA950_IU1_K1_LBSPPA256_LBSPPB512_LBSPPM0_LPA32_LPB32_LPM0_LRVW16_LWPMn1_MIAV0_MIWT4_4_MO40_NTn1_NTA0_NTB0_NTC0_NTD0_NTM0_NEPBS0_NLCA1_NLCB1_ONLL1_PGR2_PLR1_PKA1_SIA3_SS1_SU0_SUM1_SUS128_SPO0_SRVW0_SSO0_SVW2_SK3_SKXCCM8_TLDS1_ULSGRO0_USL1_UIOFGRO0_USFGRO0_VSn1_VWA2_VWB4_WSGRA0_WSGRB0_WS64_WG32_8_1_WGM6_WGMXCC1_WGMXCCGn1
    SolutionIndex: 32
    SolutionNameMin: Cijk_Alik_Bljk_I8_BH_UserArgs_MT128x128x128_MI16x16x1_SN_LDSB1_AFC0_AFEM1_AFEM1_ASEM1_CLR1_CADS0_DTVA0_DTVB0_EPS0_FDSI0_GRPM1_GRVWA16_GRVWB16_GSU0_GSUAMB_GSUC0_GSUWGMRR0_GLS0_ISA950_IU1_K1_LBSPPA512_LBSPPB512_LBSPPM0_LPA32_LPB32_LPM0_LRVW16_LWPMn1_MIAV0_MIWT4_4_MO40_NTn1_NTA0_NTB0_NTC0_NTD0_NTM0_NEPBS0_NLCA1_NLCB1_ONLL1_PGR2_PLR1_PKA1_SIA3_SS1_SU0_SUM1_SUS128_SPO0_SRVW0_SSO0_SVW4_SK3_SKXCCM8_TLDS1_ULSGRO0_USL1_UIOFGRO0_USFGRO0_VSn1_VWA4_VWB4_WSGRA0_WSGRB0_WS64_WG32_8_1_WGM6_WGMXCC1_WGMXCCGn1
    SolutionIndex: 33
    SolutionNameMin: Cijk_Alik_Bljk_I8_BH_UserArgs_MT128x64x128_MI16x16x1_SN_LDSB1_AFC0_AFEM1_AFEM1_ASEM1_CLR1_CADS0_DTVA0_DTVB0_EPS0_FDSI0_GRPM1_GRVWA16_GRVWB16_GSU0_GSUAMB_GSUC0_GSUWGMRR0_GLS0_ISA950_IU1_K1_LBSPPA256_LBSPPB256_LBSPPM0_LPA32_LPB32_LPM0_LRVW16_LWPMn1_MIAV0_MIWT4_2_MO40_NTn1_NTA0_NTB0_NTC0_NTD0_NTM0_NEPBS0_NLCA1_NLCB1_ONLL1_PGR2_PLR1_PKA1_SIA3_SS1_SU0_SUM1_SUS128_SPO0_SRVW0_SSO0_SVW2_SK3_SKXCCM8_TLDS1_ULSGRO0_USL1_UIOFGRO0_USFGRO0_VSn1_VWA2_VWB2_WSGRA0_WSGRB0_WS64_WG32_8_1_WGM6_WGMXCC1_WGMXCCGn1
    SolutionIndex: 34
    SolutionNameMin: Cijk_Alik_Bljk_I8_BH_UserArgs_MT128x64x128_MI16x16x1_SN_LDSB1_AFC0_AFEM1_AFEM1_ASEM1_CLR1_CADS0_DTVA0_DTVB0_EPS0_FDSI0_GRPM1_GRVWA16_GRVWB16_GSU0_GSUAMB_GSUC0_GSUWGMRR0_GLS0_ISA950_IU1_K1_LBSPPA512_LBSPPB256_LBSPPM0_LPA32_LPB32_LPM0_LRVW16_LWPMn1_MIAV0_MIWT4_2_MO40_NTn1_NTA0_NTB0_NTC0_NTD0_NTM0_NEPBS0_NLCA1_NLCB1_ONLL1_PGR2_PLR1_PKA1_SIA3_SS1_SU0_SUM1_SUS128_SPO0_SRVW0_SSO0_SVW4_SK3_SKXCCM8_TLDS1_ULSGRO0_USL1_UIOFGRO0_USFGRO0_VSn1_VWA4_VWB2_WSGRA0_WSGRB0_WS64_WG32_8_1_WGM6_WGMXCC1_WGMXCCGn1
    SolutionIndex: 35
    SolutionNameMin: Cijk_Alik_Bljk_I8_BH_UserArgs_MT64x64x128_MI16x16x1_SN_LDSB1_AFC0_AFEM1_AFEM1_ASEM1_CLR1_CADS0_DTVA0_DTVB0_EPS0_FDSI0_GRPM1_GRVWA16_GRVWB4_GSU0_GSUAMB_GSUC0_GSUWGMRR0_GLS0_ISA950_IU1_K1_LBSPPA256_LBSPPB256_LBSPPM0_LPA32_LPB32_LPM0_LRVW16_LWPMn1_MIAV0_MIWT2_2_MO40_NTn1_NTA0_NTB0_NTC0_NTD0_NTM0_NEPBS0_NLCA1_NLCB1_ONLL1_PGR2_PLR1_PKA1_SIA3_SS1_SU0_SUM1_SUS128_SPO0_SRVW0_SSO0_SVW2_SK3_SKXCCM8_TLDS1_ULSGRO0_USL1_UIOFGRO0_USFGRO0_VSn1_VWA2_VWB2_WSGRA0_WSGRB0_WS64_WG32_8_1_WGM6_WGMXCC1_WGMXCCGn1
    SolutionIndex: 36
    SolutionNameMin: Cijk_Alik_Bljk_I8_BH_UserArgs_MT64x64x128_MI16x16x1_SN_LDSB1_AFC0_AFEM1_AFEM1_ASEM1_CLR1_CADS0_DTVA0_DTVB0_EPS0_FDSI0_GRPM1_GRVWA8_GRVWB16_GSU0_GSUAMB_GSUC0_GSUWGMRR0_GLS0_ISA950_IU1_K1_LBSPPA256_LBSPPB256_LBSPPM0_LPA32_LPB32_LPM0_LRVW16_LWPMn1_MIAV0_MIWT2_2_MO40_NTn1_NTA0_NTB0_NTC0_NTD0_NTM0_NEPBS0_NLCA1_NLCB1_ONLL1_PGR2_PLR1_PKA1_SIA3_SS1_SU0_SUM1_SUS128_SPO0_SRVW0_SSO0_SVW2_SK3_SKXCCM8_TLDS1_ULSGRO0_USL1_UIOFGRO0_USFGRO0_VSn1_VWA2_VWB2_WSGRA0_WSGRB0_WS64_WG32_8_1_WGM6_WGMXCC1_WGMXCCGn1
    SolutionIndex: 37
    SolutionNameMin: Cijk_Alik_Bljk_I8_BH_UserArgs_MT64x64x128_MI16x16x1_SN_LDSB1_AFC0_AFEM1_AFEM1_ASEM1_CLR1_CADS0_DTVA0_DTVB0_EPS0_FDSI0_GRPM1_GRVWA16_GRVWB16_GSU0_GSUAMB_GSUC0_GSUWGMRR0_GLS0_ISA950_IU1_K1_LBSPPA256_LBSPPB256_LBSPPM0_LPA32_LPB32_LPM0_LRVW16_LWPMn1_MIAV0_MIWT2_2_MO40_NTn1_NTA0_NTB0_NTC0_NTD0_NTM0_NEPBS0_NLCA1_NLCB1_ONLL1_PGR2_PLR1_PKA1_SIA3_SS1_SU0_SUM1_SUS128_SPO0_SRVW0_SSO0_SVW2_SK3_SKXCCM8_TLDS1_ULSGRO0_USL1_UIOFGRO0_USFGRO0_VSn1_VWA2_VWB2_WSGRA0_WSGRB0_WS64_WG32_8_1_WGM6_WGMXCC1_WGMXCCGn1
    SolutionIndex: 38
    SolutionNameMin: Cijk_Alik_Bljk_I8_BH_UserArgs_MT128x128x256_MI16x16x1_SN_LDSB1_AFC0_AFEM1_AFEM1_ASEM1_CLR1_CADS0_DTVA0_DTVB0_EPS0_FDSI0_GRPM1_GRVWA16_GRVWB16_GSU0_GSUAMB_GSUC0_GSUWGMRR0_GLS0_ISA950_IU1_K1_LBSPPA1024_LBSPPB512_LBSPPM0_LPA32_LPB32_LPM0_LRVW16_LWPMn1_MIAV0_MIWT4_4_MO40_NTn1_NTA0_NTB0_NTC0_NTD0_NTM0_NEPBS0_NLCA1_NLCB1_ONLL1_PGR2_PLR1_PKA1_SIA3_SS1_SU0_SUM1_SUS256_SPO0_SRVW0_SSO0_SVW4_SK3_SKXCCM8_TLDS1_ULSGRO0_USL1_UIOFGRO0_USFGRO0_VSn1_VWA4_VWB2_WSGRA0_WSGRB0_WS64_WG32_8_1_WGM6_WGMXCC1_WGMXCCGn1
    SolutionIndex: 39
    SolutionNameMin: Cijk_Alik_Bljk_I8_BH_UserArgs_MT128x128x256_MI16x16x1_SN_LDSB1_AFC0_AFEM1_AFEM1_ASEM1_CLR1_CADS0_DTVA0_DTVB0_EPS0_FDSI0_GRPM1_GRVWA16_GRVWB16_GSU0_GSUAMB_GSUC0_GSUWGMRR0_GLS0_ISA950_IU1_K1_LBSPPA1024_LBSPPB1024_LBSPPM0_LPA32_LPB32_LPM0_LRVW16_LWPMn1_MIAV0_MIWT4_4_MO40_NTn1_NTA0_NTB0_NTC0_NTD0_NTM0_NEPBS0_NLCA1_NLCB1_ONLL1_PGR2_PLR1_PKA1_SIA3_SS1_SU0_SUM1_SUS256_SPO0_SRVW0_SSO0_SVW4_SK3_SKXCCM8_TLDS1_ULSGRO0_USL1_UIOFGRO0_USFGRO0_VSn1_VWA4_VWB4_WSGRA0_WSGRB0_WS64_WG32_8_1_WGM6_WGMXCC1_WGMXCCGn1
    SolutionIndex: 40
    SolutionNameMin: Cijk_Alik_Bljk_I8_BH_UserArgs_MT128x128x256_MI16x16x1_SN_LDSB1_AFC0_AFEM1_AFEM1_ASEM1_CLR1_CADS0_DTVA0_DTVB0_EPS0_FDSI0_GRPM1_GRVWA16_GRVWB16_GSU0_GSUAMB_GSUC0_GSUWGMRR0_GLS0_ISA950_IU1_K1_LBSPPA512_LBSPPB512_LBSPPM0_LPA32_LPB32_LPM0_LRVW16_LWPMn1_MIAV0_MIWT4_4_MO40_NTn1_NTA0_NTB0_NTC0_NTD0_NTM0_NEPBS0_NLCA1_NLCB1_ONLL1_PGR2_PLR2_PKA1_SIA3_SS1_SU0_SUM1_SUS256_SPO0_SRVW0_SSO0_SVW2_SK3_SKXCCM8_TLDS1_ULSGRO0_USL1_UIOFGRO0_USFGRO0_VSn1_VWA2_VWB2_WSGRA0_WSGRB0_WS64_WG32_8_1_WGM6_WGMXCC1_WGMXCCGn1
    SolutionIndex: 41
    SolutionNameMin: Cijk_Alik_Bljk_I8_BH_UserArgs_MT64x128x256_MI16x16x1_SN_LDSB1_AFC0_AFEM1_AFEM1_ASEM1_CLR1_CADS0_DTVA0_DTVB0_EPS0_FDSI0_GRPM1_GRVWA16_GRVWB16_GSU0_GSUAMB_GSUC0_GSUWGMRR0_GLS0_ISA950_IU1_K1_LBSPPA512_LBSPPB512_LBSPPM0_LPA32_LPB32_LPM0_LRVW16_LWPMn1_MIAV0_MIWT2_4_MO40_NTn1_NTA0_NTB0_NTC0_NTD0_NTM0_NEPBS0_NLCA1_NLCB1_ONLL1_PGR2_PLR2_PKA1_SIA3_SS1_SU0_SUM1_SUS256_SPO0_SRVW0_SSO0_SVW2_SK3_SKXCCM8_TLDS1_ULSGRO0_USL1_UIOFGRO0_USFGRO0_VSn1_VWA2_VWB2_WSGRA0_WSGRB0_WS64_WG32_8_1_WGM6_WGMXCC1_WGMXCCGn1
    SolutionIndex: 42
    SolutionNameMin: Cijk_Alik_Bljk_I8_BH_UserArgs_MT64x128x256_MI16x16x1_SN_LDSB1_AFC0_AFEM1_AFEM1_ASEM1_CLR1_CADS0_DTVA0_DTVB0_EPS0_FDSI0_GRPM1_GRVWA16_GRVWB16_GSU0_GSUAMB_GSUC0_GSUWGMRR0_GLS0_ISA950_IU1_K1_LBSPPA512_LBSPPB1024_LBSPPM0_LPA32_LPB32_LPM0_LRVW16_LWPMn1_MIAV0_MIWT2_4_MO40_NTn1_NTA0_NTB0_NTC0_NTD0_NTM0_NEPBS0_NLCA1_NLCB1_ONLL1_PGR2_PLR2_PKA1_SIA3_SS1_SU0_SUM1_SUS256_SPO0_SRVW0_SSO0_SVW2_SK3_SKXCCM8_TLDS1_ULSGRO0_USL1_UIOFGRO0_USFGRO0_VSn1_VWA2_VWB4_WSGRA0_WSGRB0_WS64_WG32_8_1_WGM6_WGMXCC1_WGMXCCGn1
    SolutionIndex: 43
    SolutionNameMin: Cijk_Alik_Bljk_I8_BH_UserArgs_MT128x64x256_MI16x16x1_SN_LDSB1_AFC0_AFEM1_AFEM1_ASEM1_CLR1_CADS0_DTVA0_DTVB0_EPS0_FDSI0_GRPM1_GRVWA16_GRVWB16_GSU0_GSUAMB_GSUC0_GSUWGMRR0_GLS0_ISA950_IU1_K1_LBSPPA512_LBSPPB512_LBSPPM0_LPA32_LPB32_LPM0_LRVW16_LWPMn1_MIAV0_MIWT4_2_MO40_NTn1_NTA0_NTB0_NTC0_NTD0_NTM0_NEPBS0_NLCA1_NLCB1_ONLL1_PGR2_PLR1_PKA1_SIA3_SS1_SU0_SUM1_SUS256_SPO0_SRVW0_SSO0_SVW2_SK3_SKXCCM8_TLDS1_ULSGRO0_USL1_UIOFGRO0_USFGRO0_VSn1_VWA2_VWB2_WSGRA0_WSGRB0_WS64_WG32_8_1_WGM6_WGMXCC1_WGMXCCGn1
    SolutionIndex: 44
    SolutionNameMin: Cijk_Alik_Bljk_I8_BH_UserArgs_MT128x64x256_MI16x16x1_SN_LDSB1_AFC0_AFEM1_AFEM1_ASEM1_CLR1_CADS0_DTVA0_DTVB0_EPS0_FDSI0_GRPM1_GRVWA16_GRVWB16_GSU0_GSUAMB_GSUC0_GSUWGMRR0_GLS0_ISA950_IU1_K1_LBSPPA512_LBSPPB512_LBSPPM0_LPA32_LPB32_LPM0_LRVW16_LWPMn1_MIAV0_MIWT4_2_MO40_NTn1_NTA0_NTB0_NTC0_NTD0_NTM0_NEPBS0_NLCA1_NLCB1_ONLL1_PGR2_PLR2_PKA1_SIA3_SS1_SU0_SUM1_SUS256_SPO0_SRVW0_SSO0_SVW2_SK3_SKXCCM8_TLDS1_ULSGRO0_USL1_UIOFGRO0_USFGRO0_VSn1_VWA2_VWB2_WSGRA0_WSGRB0_WS64_WG32_8_1_WGM6_WGMXCC1_WGMXCCGn1
    SolutionIndex: 45
    SolutionNameMin: Cijk_Alik_Bljk_I8_BH_UserArgs_MT128x64x256_MI16x16x1_SN_LDSB1_AFC0_AFEM1_AFEM1_ASEM1_CLR1_CADS0_DTVA0_DTVB0_EPS0_FDSI0_GRPM1_GRVWA16_GRVWB16_GSU0_GSUAMB_GSUC0_GSUWGMRR0_GLS0_ISA950_IU1_K1_LBSPPA1024_LBSPPB512_LBSPPM0_LPA32_LPB32_LPM0_LRVW16_LWPMn1_MIAV0_MIWT4_2_MO40_NTn1_NTA0_NTB0_NTC0_NTD0_NTM0_NEPBS0_NLCA1_NLCB1_ONLL1_PGR2_PLR2_PKA1_SIA3_SS1_SU0_SUM1_SUS256_SPO0_SRVW0_SSO0_SVW4_SK3_SKXCCM8_TLDS1_ULSGRO0_USL1_UIOFGRO0_USFGRO0_VSn1_VWA4_VWB2_WSGRA0_WSGRB0_WS64_WG32_8_1_WGM6_WGMXCC1_WGMXCCGn1
    SolutionIndex: 46
    SolutionNameMin: Cijk_Alik_Bljk_I8_BH_UserArgs_MT64x64x256_MI16x16x1_SN_LDSB1_AFC0_AFEM1_AFEM1_ASEM1_CLR1_CADS0_DTVA0_DTVB0_EPS0_FDSI0_GRPM1_GRVWA16_GRVWB16_GSU0_GSUAMB_GSUC0_GSUWGMRR0_GLS0_ISA950_IU1_K1_LBSPPA512_LBSPPB512_LBSPPM0_LPA32_LPB32_LPM0_LRVW16_LWPMn1_MIAV0_MIWT2_2_MO40_NTn1_NTA0_NTB0_NTC0_NTD0_NTM0_NEPBS0_NLCA1_NLCB1_ONLL1_PGR2_PLR1_PKA1_SIA3_SS1_SU0_SUM1_SUS256_SPO0_SRVW0_SSO0_SVW2_SK3_SKXCCM8_TLDS1_ULSGRO0_USL1_UIOFGRO0_USFGRO0_VSn1_VWA2_VWB2_WSGRA0_WSGRB0_WS64_WG32_8_1_WGM6_WGMXCC1_WGMXCCGn1
    SolutionIndex: 47
    SolutionNameMin: Cijk_Alik_Bljk_I8_BH_UserArgs_MT64x64x256_MI16x16x1_SN_LDSB1_AFC0_AFEM1_AFEM1_ASEM1_CLR1_CADS0_DTVA0_DTVB0_EPS0_FDSI0_GRPM1_GRVWA16_GRVWB4_GSU0_GSUAMB_GSUC0_GSUWGMRR0_GLS0_ISA950_IU1_K1_LBSPPA512_LBSPPB512_LBSPPM0_LPA32_LPB32_LPM0_LRVW16_LWPMn1_MIAV0_MIWT2_2_MO40_NTn1_NTA0_NTB0_NTC0_NTD0_NTM0_NEPBS0_NLCA1_NLCB1_ONLL1_PGR2_PLR2_PKA1_SIA3_SS1_SU0_SUM1_SUS256_SPO0_SRVW0_SSO0_SVW2_SK3_SKXCCM8_TLDS1_ULSGRO0_USL1_UIOFGRO0_USFGRO0_VSn1_VWA2_VWB2_WSGRA0_WSGRB0_WS64_WG32_8_1_WGM6_WGMXCC1_WGMXCCGn1
    SolutionIndex: 48
    SolutionNameMin: Cijk_Alik_Bljk_I8_BH_UserArgs_MT64x64x256_MI16x16x1_SN_LDSB1_AFC0_AFEM1_AFEM1_ASEM1_CLR1_CADS0_DTVA0_DTVB0_EPS0_FDSI0_GRPM1_GRVWA16_GRVWB16_GSU0_GSUAMB_GSUC0_GSUWGMRR0_GLS0_ISA950_IU1_K1_LBSPPA512_LBSPPB512_LBSPPM0_LPA32_LPB32_LPM0_LRVW16_LWPMn1_MIAV0_MIWT2_2_MO40_NTn1_NTA0_NTB0_NTC0_NTD0_NTM0_NEPBS0_NLCA1_NLCB1_ONLL1_PGR2_PLR2_PKA1_SIA3_SS1_SU0_SUM1_SUS256_SPO0_SRVW0_SSO0_SVW2_SK3_SKXCCM8_TLDS1_ULSGRO0_USL1_UIOFGRO0_USFGRO0_VSn1_VWA2_VWB2_WSGRA0_WSGRB0_WS64_WG32_8_1_WGM6_WGMXCC1_WGMXCCGn1
    SolutionIndex: 49
    SolutionNameMin: Cijk_Alik_Bljk_I8_BH_UserArgs_MT64x64x512_MI16x16x1_SN_LDSB1_AFC0_AFEM1_AFEM1_ASEM1_CLR1_CADS0_DTVA0_DTVB0_EPS0_FDSI0_GRPM1_GRVWA16_GRVWB16_GSU0_GSUAMB_GSUC0_GSUWGMRR0_GLS0_ISA950_IU1_K1_LBSPPA1024_LBSPPB1024_LBSPPM0_LPA32_LPB32_LPM0_LRVW16_LWPMn1_MIAV0_MIWT2_2_MO40_NTn1_NTA0_NTB0_NTC0_NTD0_NTM0_NEPBS0_NLCA1_NLCB1_ONLL1_PGR2_PLR2_PKA1_SIA3_SS1_SU0_SUM1_SUS512_SPO0_SRVW0_SSO0_SVW2_SK3_SKXCCM8_TLDS1_ULSGRO0_USL1_UIOFGRO0_USFGRO0_VSn1_VWA2_VWB2_WSGRA0_WSGRB0_WS64_WG32_8_1_WGM6_WGMXCC1_WGMXCCGn1
- - - [128, 128, 1, 128, 128, 128, 128, 128]
    - [15, 0.44]
  - - [128, 128, 1, 256, 128, 128, 256, 256]
    - [46, 0.78]
  - - [128, 128, 1, 512, 128, 128, 512, 512]
    - [49, 1.38]
  - - [128, 128, 1, 1024, 128, 128, 1024, 1024]
    - [46, 2.34]
  - - [128, 128, 1, 2048, 128, 128, 2048, 2048]
    - [46, 3.58]
  - - [128, 128, 1, 4096, 128, 128, 4096, 4096]
    - [49, 4.89]
  - - [128, 128, 1, 8192, 128, 128, 8192, 8192]
    - [49, 6.12]
  - - [128, 256, 1, 128, 128, 128, 128, 128]
    - [36, 0.83]
  - - [128, 256, 1, 256, 128, 128, 256, 256]
    - [47, 1.51]
  - - [128, 256, 1, 512, 128, 128, 512, 512]
    - [48, 2.72]
  - - [128, 256, 1, 1024, 128, 128, 1024, 1024]
    - [48, 4.62]
  - - [128, 256, 1, 2048, 128, 128, 2048, 2048]
    - [49, 7.08]
  - - [128, 256, 1, 4096, 128, 128, 4096, 4096]
    - [49, 9.76]
  - - [128, 256, 1, 8192, 128, 128, 8192, 8192]
    - [49, 12.34]
  - - [128, 512, 1, 128, 128, 128, 128, 128]
    - [35, 1.63]
  - - [128, 512, 1, 256, 128, 128, 256, 256]
    - [48, 3.03]
  - - [128, 512, 1, 512, 128, 128, 512, 512]
    - [49, 5.39]
  - - [128, 512, 1, 1024, 128, 128, 1024, 1024]
    - [46, 9.21]
  - - [128, 512, 1, 2048, 128, 128, 2048, 2048]
    - [49, 13.95]
  - - [128, 512, 1, 4096, 128, 128, 4096, 4096]
    - [49, 19.59]
  - - [128, 512, 1, 8192, 128, 128, 8192, 8192]
    - [49, 24.5]
  - - [128, 1024, 1, 128, 128, 128, 128, 128]
    - [14, 3.16]
  - - [128, 1024, 1, 256, 128, 128, 256, 256]
    - [48, 6.07]
  - - [128, 1024, 1, 512, 128, 128, 512, 512]
    - [46, 10.77]
  - - [128, 1024, 1, 1024, 128, 128, 1024, 1024]
    - [48, 17.95]
  - - [128, 1024, 1, 2048, 128, 128, 2048, 2048]
    - [49, 27.73]
  - - [128, 1024, 1, 4096, 128, 128, 4096, 4096]
    - [49, 38.8]
  - - [128, 1024, 1, 8192, 128, 128, 8192, 8192]
    - [49, 48.71]
  - - [128, 2048, 1, 128, 128, 128, 128, 128]
    - [37, 6.5]
  - - [128, 2048, 1, 256, 128, 128, 256, 256]
    - [48, 11.99]
  - - [128, 2048, 1, 512, 128, 128, 512, 512]
    - [49, 20.84]
  - - [128, 2048, 1, 1024, 128, 128, 1024, 1024]
    - [48, 34.86]
  - - [128, 2048, 1, 2048, 128, 128, 2048, 2048]
    - [49, 54.47]
  - - [128, 2048, 1, 4096, 128, 128, 4096, 4096]
    - [49, 76.33]
  - - [128, 2048, 1, 8192, 128, 128, 8192, 8192]
    - [49, 97.43]
  - - [128, 4096, 1, 128, 128, 128, 128, 128]
    - [37, 12.78]
  - - [128, 4096, 1, 256, 128, 128, 256, 256]
    - [46, 23.48]
  - - [128, 4096, 1, 512, 128, 128, 512, 512]
    - [46, 40.35]
  - - [128, 4096, 1, 1024, 128, 128, 1024, 1024]
    - [46, 68.2]
  - - [128, 4096, 1, 2048, 128, 128, 2048, 2048]
    - [49, 105.76]
  - - [128, 4096, 1, 4096, 128, 128, 4096, 4096]
    - [49, 150.91]
  - - [128, 4096, 1, 8192, 128, 128, 8192, 8192]
    - [49, 179.56]
  - - [128, 8192, 1, 128, 128, 128, 128, 128]
    - [37, 24.98]
  - - [128, 8192, 1, 256, 128, 128, 256, 256]
    - [46, 45.06]
  - - [128, 8192, 1, 512, 128, 128, 512, 512]
    - [46, 77.03]
  - - [128, 8192, 1, 1024, 128, 128, 1024, 1024]
    - [46, 129.55]
  - - [128, 8192, 1, 2048, 128, 128, 2048, 2048]
    - [49, 203.52]
  - - [128, 8192, 1, 4096, 128, 128, 4096, 4096]
    - [49, 264.91]
  - - [128, 8192, 1, 8192, 128, 128, 8192, 8192]
    - [49, 318.36]
  - - [256, 128, 1, 128, 256, 256, 128, 128]
    - [15, 0.84]
  - - [256, 128, 1, 256, 256, 256, 256, 256]
    - [46, 1.54]
  - - [256, 128, 1, 512, 256, 256, 512, 512]
    - [46, 2.69]
  - - [256, 128, 1, 1024, 256, 256, 1024, 1024]
    - [48, 4.6]
  - - [256, 128, 1, 2048, 256, 256, 2048, 2048]
    - [46, 7.07]
  - - [256, 128, 1, 4096, 256, 256, 4096, 4096]
    - [49, 9.77]
  - - [256, 128, 1, 8192, 256, 256, 8192, 8192]
    - [49, 12.18]
  - - [256, 256, 1, 128, 256, 256, 128, 128]
    - [11, 1.63]
  - - [256, 256, 1, 256, 256, 256, 256, 256]
    - [48, 3.1]
  - - [256, 256, 1, 512, 256, 256, 512, 512]
    - [46, 5.46]
  - - [256, 256, 1, 1024, 256, 256, 1024, 1024]
    - [46, 9.17]
  - - [256, 256, 1, 2048, 256, 256, 2048, 2048]
    - [49, 13.86]
  - - [256, 256, 1, 4096, 256, 256, 4096, 4096]
    - [49, 19.84]
  - - [256, 256, 1, 8192, 256, 256, 8192, 8192]
    - [49, 24.8]
  - - [256, 512, 1, 128, 256, 256, 128, 128]
    - [10, 3.31]
  - - [256, 512, 1, 256, 256, 256, 256, 256]
    - [48, 6.14]
  - - [256, 512, 1, 512, 256, 256, 512, 512]
    - [46, 10.86]
  - - [256, 512, 1, 1024, 256, 256, 1024, 1024]
    - [46, 18.05]
  - - [256, 512, 1, 2048, 256, 256, 2048, 2048]
    - [49, 27.86]
  - - [256, 512, 1, 4096, 256, 256, 4096, 4096]
    - [49, 39.64]
  - - [256, 512, 1, 8192, 256, 256, 8192, 8192]
    - [49, 49.65]
  - - [256, 1024, 1, 128, 256, 256, 128, 128]
    - [12, 6.61]
  - - [256, 1024, 1, 256, 256, 256, 256, 256]
    - [46, 12.19]
  - - [256, 1024, 1, 512, 256, 256, 512, 512]
    - [48, 21.26]
  - - [256, 1024, 1, 1024, 256, 256, 1024, 1024]
    - [48, 35.24]
  - - [256, 1024, 1, 2048, 256, 256, 2048, 2048]
    - [49, 55.6]
  - - [256, 1024, 1, 4096, 256, 256, 4096, 4096]
    - [49, 78.41]
  - - [256, 1024, 1, 8192, 256, 256, 8192, 8192]
    - [49, 97.96]
  - - [256, 2048, 1, 128, 256, 256, 128, 128]
    - [15, 12.8]
  - - [256, 2048, 1, 256, 256, 256, 256, 256]
    - [46, 23.65]
  - - [256, 2048, 1, 512, 256, 256, 512, 512]
    - [49, 40.94]
  - - [256, 2048, 1, 1024, 256, 256, 1024, 1024]
    - [48, 69.57]
  - - [256, 2048, 1, 2048, 256, 256, 2048, 2048]
    - [49, 108.33]
  - - [256, 2048, 1, 4096, 256, 256, 4096, 4096]
    - [49, 152.54]
  - - [256, 2048, 1, 8192, 256, 256, 8192, 8192]
    - [49, 191.77]
  - - [256, 4096, 1, 128, 256, 256, 128, 128]
    - [12, 24.91]
  - - [256, 4096, 1, 256, 256, 256, 256, 256]
    - [46, 45.77]
  - - [256, 4096, 1, 512, 256, 256, 512, 512]
    - [48, 78.46]
  - - [256, 4096, 1, 1024, 256, 256, 1024, 1024]
    - [48, 132.81]
  - - [256, 4096, 1, 2048, 256, 256, 2048, 2048]
    - [49, 209.0]
  - - [256, 4096, 1, 4096, 256, 256, 4096, 4096]
    - [49, 293.84]
  - - [256, 4096, 1, 8192, 256, 256, 8192, 8192]
    - [49, 346.94]
  - - [256, 8192, 1, 128, 256, 256, 128, 128]
    - [9, 44.73]
  - - [256, 8192, 1, 256, 256, 256, 256, 256]
    - [43, 78.12]
  - - [256, 8192, 1, 512, 256, 256, 512, 512]
    - [34, 133.96]
  - - [256, 8192, 1, 1024, 256, 256, 1024, 1024]
    - [45, 219.47]
  - - [256, 8192, 1, 2048, 256, 256, 2048, 2048]
    - [44, 332.77]
  - - [256, 8192, 1, 4096, 256, 256, 4096, 4096]
    - [41, 403.86]
  - - [256, 8192, 1, 8192, 256, 256, 8192, 8192]
    - [41, 478.2]
  - - [512, 128, 1, 128, 512, 512, 128, 128]
    - [15, 1.73]
  - - [512, 128, 1, 256, 512, 512, 256, 256]
    - [46, 3.01]
  - - [512, 128, 1, 512, 512, 512, 512, 512]
    - [46, 5.5]
  - - [512, 128, 1, 1024, 512, 512, 1024, 1024]
    - [46, 9.28]
  - - [512, 128, 1, 2048, 512, 512, 2048, 2048]
    - [49, 13.94]
  - - [512, 128, 1, 4096, 512, 512, 4096, 4096]
    - [49, 19.5]
  - - [512, 128, 1, 8192, 512, 512, 8192, 8192]
    - [49, 24.48]
  - - [512, 256, 1, 128, 512, 512, 128, 128]
    - [15, 3.31]
  - - [512, 256, 1, 256, 512, 512, 256, 256]
    - [46, 6.2]
  - - [512, 256, 1, 512, 512, 512, 512, 512]
    - [49, 10.92]
  - - [512, 256, 1, 1024, 512, 512, 1024, 1024]
    - [48, 18.01]
  - - [512, 256, 1, 2048, 512, 512, 2048, 2048]
    - [49, 27.98]
  - - [512, 256, 1, 4096, 512, 512, 4096, 4096]
    - [49, 39.02]
  - - [512, 256, 1, 8192, 512, 512, 8192, 8192]
    - [49, 49.15]
  - - [512, 512, 1, 128, 512, 512, 128, 128]
    - [15, 6.76]
  - - [512, 512, 1, 256, 512, 512, 256, 256]
    - [46, 12.16]
  - - [512, 512, 1, 512, 512, 512, 512, 512]
    - [49, 21.27]
  - - [512, 512, 1, 1024, 512, 512, 1024, 1024]
    - [46, 35.7]
  - - [512, 512, 1, 2048, 512, 512, 2048, 2048]
    - [49, 55.77]
  - - [512, 512, 1, 4096, 512, 512, 4096, 4096]
    - [49, 78.29]
  - - [512, 512, 1, 8192, 512, 512, 8192, 8192]
    - [49, 98.09]
  - - [512, 1024, 1, 128, 512, 512, 128, 128]
    - [10, 12.92]
  - - [512, 1024, 1, 256, 512, 512, 256, 256]
    - [48, 23.77]
  - - [512, 1024, 1, 512, 512, 512, 512, 512]
    - [46, 41.95]
  - - [512, 1024, 1, 1024, 512, 512, 1024, 1024]
    - [46, 70.77]
  - - [512, 1024, 1, 2048, 512, 512, 2048, 2048]
    - [49, 109.98]
  - - [512, 1024, 1, 4096, 512, 512, 4096, 4096]
    - [49, 154.69]
  - - [512, 1024, 1, 8192, 512, 512, 8192, 8192]
    - [49, 193.87]
  - - [512, 2048, 1, 128, 512, 512, 128, 128]
    - [13, 25.28]
  - - [512, 2048, 1, 256, 512, 512, 256, 256]
    - [48, 46.21]
  - - [512, 2048, 1, 512, 512, 512, 512, 512]
    - [46, 80.41]
  - - [512, 2048, 1, 1024, 512, 512, 1024, 1024]
    - [46, 136.12]
  - - [512, 2048, 1, 2048, 512, 512, 2048, 2048]
    - [49, 212.8]
  - - [512, 2048, 1, 4096, 512, 512, 4096, 4096]
    - [49, 292.67]
  - - [512, 2048, 1, 8192, 512, 512, 8192, 8192]
    - [49, 368.51]
  - - [512, 4096, 1, 128, 512, 512, 128, 128]
    - [9, 44.27]
  - - [512, 4096, 1, 256, 512, 512, 256, 256]
    - [43, 78.66]
  - - [512, 4096, 1, 512, 512, 512, 512, 512]
    - [33, 134.79]
  - - [512, 4096, 1, 1024, 512, 512, 1024, 1024]
    - [44, 224.03]
  - - [512, 4096, 1, 2048, 512, 512, 2048, 2048]
    - [44, 332.51]
  - - [512, 4096, 1, 4096, 512, 512, 4096, 4096]
    - [42, 430.08]
  - - [512, 4096, 1, 8192, 512, 512, 8192, 8192]
    - [45, 495.79]
  - - [512, 8192, 1, 128, 512, 512, 128, 128]
    - [30, 71.86]
  - - [512, 8192, 1, 256, 512, 512, 256, 256]
    - [30, 125.95]
  - - [512, 8192, 1, 512, 512, 512, 512, 512]
    - [30, 221.88]
  - - [512, 8192, 1, 1024, 512, 512, 1024, 1024]
    - [30, 352.34]
  - - [512, 8192, 1, 2048, 512, 512, 2048, 2048]
    - [32, 486.64]
  - - [512, 8192, 1, 4096, 512, 512, 4096, 4096]
    - [39, 582.33]
  - - [512, 8192, 1, 8192, 512, 512, 8192, 8192]
    - [39, 680.03]
  - - [1024, 128, 1, 128, 1024, 1024, 128, 128]
    - [37, 3.31]
  - - [1024, 128, 1, 256, 1024, 1024, 256, 256]
    - [48, 6.14]
  - - [1024, 128, 1, 512, 1024, 1024, 512, 512]
    - [46, 10.82]
  - - [1024, 128, 1, 1024, 1024, 1024, 1024, 1024]
    - [46, 18.14]
  - - [1024, 128, 1, 2048, 1024, 1024, 2048, 2048]
    - [46, 27.59]
  - - [1024, 128, 1, 4096, 1024, 1024, 4096, 4096]
    - [49, 38.71]
  - - [1024, 128, 1, 8192, 1024, 1024, 8192, 8192]
    - [49, 48.54]
  - - [1024, 256, 1, 128, 1024, 1024, 128, 128]
    - [15, 6.56]
  - - [1024, 256, 1, 256, 1024, 1024, 256, 256]
    - [46, 12.11]
  - - [1024, 256, 1, 512, 1024, 1024, 512, 512]
    - [49, 21.31]
  - - [1024, 256, 1, 1024, 1024, 1024, 1024, 1024]
    - [46, 35.91]
  - - [1024, 256, 1, 2048, 1024, 1024, 2048, 2048]
    - [49, 55.02]
  - - [1024, 256, 1, 4096, 1024, 1024, 4096, 4096]
    - [49, 77.55]
  - - [1024, 256, 1, 8192, 1024, 1024, 8192, 8192]
    - [49, 97.68]
  - - [1024, 512, 1, 128, 1024, 1024, 128, 128]
    - [12, 13.15]
  - - [1024, 512, 1, 256, 1024, 1024, 256, 256]
    - [46, 23.98]
  - - [1024, 512, 1, 512, 1024, 1024, 512, 512]
    - [49, 42.19]
  - - [1024, 512, 1, 1024, 1024, 1024, 1024, 1024]
    - [48, 70.46]
  - - [1024, 512, 1, 2048, 1024, 1024, 2048, 2048]
    - [49, 109.82]
  - - [1024, 512, 1, 4096, 1024, 1024, 4096, 4096]
    - [49, 153.38]
  - - [1024, 512, 1, 8192, 1024, 1024, 8192, 8192]
    - [49, 193.2]
  - - [1024, 1024, 1, 128, 1024, 1024, 128, 128]
    - [15, 25.67]
  - - [1024, 1024, 1, 256, 1024, 1024, 256, 256]
    - [46, 46.66]
  - - [1024, 1024, 1, 512, 1024, 1024, 512, 512]
    - [49, 81.55]
  - - [1024, 1024, 1, 1024, 1024, 1024, 1024, 1024]
    - [48, 138.21]
  - - [1024, 1024, 1, 2048, 1024, 1024, 2048, 2048]
    - [46, 211.47]
  - - [1024, 1024, 1, 4096, 1024, 1024, 4096, 4096]
    - [49, 294.95]
  - - [1024, 1024, 1, 8192, 1024, 1024, 8192, 8192]
    - [49, 370.95]
  - - [1024, 2048, 1, 128, 1024, 1024, 128, 128]
    - [8, 43.94]
  - - [1024, 2048, 1, 256, 1024, 1024, 256, 256]
    - [44, 79.32]
  - - [1024, 2048, 1, 512, 1024, 1024, 512, 512]
    - [33, 135.86]
  - - [1024, 2048, 1, 1024, 1024, 1024, 1024, 1024]
    - [43, 223.78]
  - - [1024, 2048, 1, 2048, 1024, 1024, 2048, 2048]
    - [44, 334.06]
  - - [1024, 2048, 1, 4096, 1024, 1024, 4096, 4096]
    - [44, 436.86]
  - - [1024, 2048, 1, 8192, 1024, 1024, 8192, 8192]
    - [44, 511.15]
  - - [1024, 4096, 1, 128, 1024, 1024, 128, 128]
    - [7, 71.22]
  - - [1024, 4096, 1, 256, 1024, 1024, 256, 256]
    - [30, 127.39]
  - - [1024, 4096, 1, 512, 1024, 1024, 512, 512]
    - [30, 220.86]
  - - [1024, 4096, 1, 1024, 1024, 1024, 1024, 1024]
    - [30, 352.79]
  - - [1024, 4096, 1, 2048, 1024, 1024, 2048, 2048]
    - [32, 493.64]
  - - [1024, 4096, 1, 4096, 1024, 1024, 4096, 4096]
    - [38, 593.07]
  - - [1024, 4096, 1, 8192, 1024, 1024, 8192, 8192]
    - [40, 673.74]
  - - [1024, 8192, 1, 128, 1024, 1024, 128, 128]
    - [24, 104.24]
  - - [1024, 8192, 1, 256, 1024, 1024, 256, 256]
    - [24, 187.37]
  - - [1024, 8192, 1, 512, 1024, 1024, 512, 512]
    - [24, 325.37]
  - - [1024, 8192, 1, 1024, 1024, 1024, 1024, 1024]
    - [24, 502.45]
  - - [1024, 8192, 1, 2048, 1024, 1024, 2048, 2048]
    - [24, 684.51]
  - - [1024, 8192, 1, 4096, 1024, 1024, 4096, 4096]
    - [24, 834.04]
  - - [1024, 8192, 1, 8192, 1024, 1024, 8192, 8192]
    - [27, 941.18]
  - - [2048, 128, 1, 128, 2048, 2048, 128, 128]
    - [12, 6.46]
  - - [2048, 128, 1, 256, 2048, 2048, 256, 256]
    - [48, 12.12]
  - - [2048, 128, 1, 512, 2048, 2048, 512, 512]
    - [46, 21.28]
  - - [2048, 128, 1, 1024, 2048, 2048, 1024, 1024]
    - [46, 35.43]
  - - [2048, 128, 1, 2048, 2048, 2048, 2048, 2048]
    - [48, 53.79]
  - - [2048, 128, 1, 4096, 2048, 2048, 4096, 4096]
    - [49, 75.86]
  - - [2048, 128, 1, 8192, 2048, 2048, 8192, 8192]
    - [49, 96.53]
  - - [2048, 256, 1, 128, 2048, 2048, 128, 128]
    - [13, 12.95]
  - - [2048, 256, 1, 256, 2048, 2048, 256, 256]
    - [48, 23.65]
  - - [2048, 256, 1, 512, 2048, 2048, 512, 512]
    - [46, 42.03]
  - - [2048, 256, 1, 1024, 2048, 2048, 1024, 1024]
    - [46, 70.22]
  - - [2048, 256, 1, 2048, 2048, 2048, 2048, 2048]
    - [49, 108.5]
  - - [2048, 256, 1, 4096, 2048, 2048, 4096, 4096]
    - [49, 150.75]
  - - [2048, 256, 1, 8192, 2048, 2048, 8192, 8192]
    - [49, 192.1]
  - - [2048, 512, 1, 128, 2048, 2048, 128, 128]
    - [15, 25.3]
  - - [2048, 512, 1, 256, 2048, 2048, 256, 256]
    - [46, 45.98]
  - - [2048, 512, 1, 512, 2048, 2048, 512, 512]
    - [49, 80.96]
  - - [2048, 512, 1, 1024, 2048, 2048, 1024, 1024]
    - [46, 136.89]
  - - [2048, 512, 1, 2048, 2048, 2048, 2048, 2048]
    - [49, 209.79]
  - - [2048, 512, 1, 4096, 2048, 2048, 4096, 4096]
    - [49, 290.29]
  - - [2048, 512, 1, 8192, 2048, 2048, 8192, 8192]
    - [49, 367.19]
  - - [2048, 1024, 1, 128, 2048, 2048, 128, 128]
    - [33, 44.67]
  - - [2048, 1024, 1, 256, 2048, 2048, 256, 256]
    - [44, 79.78]
  - - [2048, 1024, 1, 512, 2048, 2048, 512, 512]
    - [33, 137.21]
  - - [2048, 1024, 1, 1024, 2048, 2048, 1024, 1024]
    - [44, 226.23]
  - - [2048, 1024, 1, 2048, 2048, 2048, 2048, 2048]
    - [44, 335.87]
  - - [2048, 1024, 1, 4096, 2048, 2048, 4096, 4096]
    - [44, 437.13]
  - - [2048, 1024, 1, 8192, 2048, 2048, 8192, 8192]
    - [44, 513.22]
  - - [2048, 2048, 1, 128, 2048, 2048, 128, 128]
    - [7, 72.03]
  - - [2048, 2048, 1, 256, 2048, 2048, 256, 256]
    - [29, 127.62]
  - - [2048, 2048, 1, 512, 2048, 2048, 512, 512]
    - [29, 222.66]
  - - [2048, 2048, 1, 1024, 2048, 2048, 1024, 1024]
    - [30, 354.47]
  - - [2048, 2048, 1, 2048, 2048, 2048, 2048, 2048]
    - [29, 497.94]
  - - [2048, 2048, 1, 4096, 2048, 2048, 4096, 4096]
    - [30, 619.75]
  - - [2048, 2048, 1, 8192, 2048, 2048, 8192, 8192]
    - [31, 680.59]
  - - [2048, 4096, 1, 128, 2048, 2048, 128, 128]
    - [27, 105.38]
  - - [2048, 4096, 1, 256, 2048, 2048, 256, 256]
    - [24, 187.93]
  - - [2048, 4096, 1, 512, 2048, 2048, 512, 512]
    - [27, 326.36]
  - - [2048, 4096, 1, 1024, 2048, 2048, 1024, 1024]
    - [24, 509.34]
  - - [2048, 4096, 1, 2048, 2048, 2048, 2048, 2048]
    - [24, 700.31]
  - - [2048, 4096, 1, 4096, 2048, 2048, 4096, 4096]
    - [24, 838.17]
  - - [2048, 4096, 1, 8192, 2048, 2048, 8192, 8192]
    - [23, 942.6]
  - - [2048, 8192, 1, 128, 2048, 2048, 128, 128]
    - [1, 125.56]
  - - [2048, 8192, 1, 256, 2048, 2048, 256, 256]
    - [6, 228.37]
  - - [2048, 8192, 1, 512, 2048, 2048, 512, 512]
    - [22, 386.6]
  - - [2048, 8192, 1, 1024, 2048, 2048, 1024, 1024]
    - [22, 610.65]
  - - [2048, 8192, 1, 2048, 2048, 2048, 2048, 2048]
    - [21, 854.47]
  - - [2048, 8192, 1, 4096, 2048, 2048, 4096, 4096]
    - [17, 1064.15]
  - - [2048, 8192, 1, 8192, 2048, 2048, 8192, 8192]
    - [21, 1078.02]
  - - [4096, 128, 1, 128, 4096, 4096, 128, 128]
    - [14, 13.16]
  - - [4096, 128, 1, 256, 4096, 4096, 256, 256]
    - [48, 23.66]
  - - [4096, 128, 1, 512, 4096, 4096, 512, 512]
    - [46, 41.12]
  - - [4096, 128, 1, 1024, 4096, 4096, 1024, 1024]
    - [48, 68.74]
  - - [4096, 128, 1, 2048, 4096, 4096, 2048, 2048]
    - [48, 105.59]
  - - [4096, 128, 1, 4096, 4096, 4096, 4096, 4096]
    - [49, 146.53]
  - - [4096, 128, 1, 8192, 4096, 4096, 8192, 8192]
    - [49, 175.63]
  - - [4096, 256, 1, 128, 4096, 4096, 128, 128]
    - [14, 25.38]
  - - [4096, 256, 1, 256, 4096, 4096, 256, 256]
    - [48, 45.98]
  - - [4096, 256, 1, 512, 4096, 4096, 512, 512]
    - [46, 79.57]
  - - [4096, 256, 1, 1024, 4096, 4096, 1024, 1024]
    - [48, 135.0]
  - - [4096, 256, 1, 2048, 4096, 4096, 2048, 2048]
    - [48, 208.26]
  - - [4096, 256, 1, 4096, 4096, 4096, 4096, 4096]
    - [49, 287.22]
  - - [4096, 256, 1, 8192, 4096, 4096, 8192, 8192]
    - [49, 340.27]
  - - [4096, 512, 1, 128, 4096, 4096, 128, 128]
    - [9, 44.4]
  - - [4096, 512, 1, 256, 4096, 4096, 256, 256]
    - [45, 79.06]
  - - [4096, 512, 1, 512, 4096, 4096, 512, 512]
    - [33, 134.44]
  - - [4096, 512, 1, 1024, 4096, 4096, 1024, 1024]
    - [44, 223.43]
  - - [4096, 512, 1, 2048, 4096, 4096, 2048, 2048]
    - [42, 334.12]
  - - [4096, 512, 1, 4096, 4096, 4096, 4096, 4096]
    - [42, 432.46]
  - - [4096, 512, 1, 8192, 4096, 4096, 8192, 8192]
    - [42, 497.62]
  - - [4096, 1024, 1, 128, 4096, 4096, 128, 128]
    - [28, 71.78]
  - - [4096, 1024, 1, 256, 4096, 4096, 256, 256]
    - [32, 127.95]
  - - [4096, 1024, 1, 512, 4096, 4096, 512, 512]
    - [32, 222.49]
  - - [4096, 1024, 1, 1024, 4096, 4096, 1024, 1024]
    - [32, 355.95]
  - - [4096, 1024, 1, 2048, 4096, 4096, 2048, 2048]
    - [32, 500.38]
  - - [4096, 1024, 1, 4096, 4096, 4096, 4096, 4096]
    - [31, 600.95]
  - - [4096, 1024, 1, 8192, 4096, 4096, 8192, 8192]
    - [31, 676.61]
  - - [4096, 2048, 1, 128, 4096, 4096, 128, 128]
    - [27, 105.63]
  - - [4096, 2048, 1, 256, 4096, 4096, 256, 256]
    - [27, 188.13]
  - - [4096, 2048, 1, 512, 4096, 4096, 512, 512]
    - [27, 329.25]
  - - [4096, 2048, 1, 1024, 4096, 4096, 1024, 1024]
    - [27, 508.99]
  - - [4096, 2048, 1, 2048, 4096, 4096, 2048, 2048]
    - [27, 700.9]
  - - [4096, 2048, 1, 4096, 4096, 4096, 4096, 4096]
    - [24, 836.96]
  - - [4096, 2048, 1, 8192, 4096, 4096, 8192, 8192]
    - [24, 940.46]
  - - [4096, 4096, 1, 128, 4096, 4096, 128, 128]
    - [16, 126.08]
  - - [4096, 4096, 1, 256, 4096, 4096, 256, 256]
    - [16, 229.11]
  - - [4096, 4096, 1, 512, 4096, 4096, 512, 512]
    - [20, 388.96]
  - - [4096, 4096, 1, 1024, 4096, 4096, 1024, 1024]
    - [20, 608.4]
  - - [4096, 4096, 1, 2048, 4096, 4096, 2048, 2048]
    - [20, 857.63]
  - - [4096, 4096, 1, 4096, 4096, 4096, 4096, 4096]
    - [19, 1050.94]
  - - [4096, 4096, 1, 8192, 4096, 4096, 8192, 8192]
    - [19, 1122.56]
  - - [4096, 8192, 1, 128, 4096, 4096, 128, 128]
    - [3, 146.26]
  - - [4096, 8192, 1, 256, 4096, 4096, 256, 256]
    - [3, 265.6]
  - - [4096, 8192, 1, 512, 4096, 4096, 512, 512]
    - [22, 447.81]
  - - [4096, 8192, 1, 1024, 4096, 4096, 1024, 1024]
    - [20, 689.98]
  - - [4096, 8192, 1, 2048, 4096, 4096, 2048, 2048]
    - [20, 935.68]
  - - [4096, 8192, 1, 4096, 4096, 4096, 4096, 4096]
    - [22, 1029.53]
  - - [4096, 8192, 1, 8192, 4096, 4096, 8192, 8192]
    - [19, 1152.66]
  - - [8192, 128, 1, 128, 8192, 8192, 128, 128]
    - [10, 24.87]
  - - [8192, 128, 1, 256, 8192, 8192, 256, 256]
    - [46, 44.99]
  - - [8192, 128, 1, 512, 8192, 8192, 512, 512]
    - [46, 77.44]
  - - [8192, 128, 1, 1024, 8192, 8192, 1024, 1024]
    - [48, 130.12]
  - - [8192, 128, 1, 2048, 8192, 8192, 2048, 2048]
    - [48, 202.87]
  - - [8192, 128, 1, 4096, 8192, 8192, 4096, 4096]
    - [49, 261.45]
  - - [8192, 128, 1, 8192, 8192, 8192, 8192, 8192]
    - [49, 323.7]
  - - [8192, 256, 1, 128, 8192, 8192, 128, 128]
    - [9, 44.6]
  - - [8192, 256, 1, 256, 8192, 8192, 256, 256]
    - [33, 78.3]
  - - [8192, 256, 1, 512, 8192, 8192, 512, 512]
    - [33, 132.22]
  - - [8192, 256, 1, 1024, 8192, 8192, 1024, 1024]
    - [44, 221.12]
  - - [8192, 256, 1, 2048, 8192, 8192, 2048, 2048]
    - [44, 331.67]
  - - [8192, 256, 1, 4096, 8192, 8192, 4096, 4096]
    - [42, 408.74]
  - - [8192, 256, 1, 8192, 8192, 8192, 8192, 8192]
    - [45, 484.5]
  - - [8192, 512, 1, 128, 8192, 8192, 128, 128]
    - [32, 71.95]
  - - [8192, 512, 1, 256, 8192, 8192, 256, 256]
    - [30, 128.2]
  - - [8192, 512, 1, 512, 8192, 8192, 512, 512]
    - [32, 224.28]
  - - [8192, 512, 1, 1024, 8192, 8192, 1024, 1024]
    - [30, 354.71]
  - - [8192, 512, 1, 2048, 8192, 8192, 2048, 2048]
    - [29, 486.9]
  - - [8192, 512, 1, 4096, 8192, 8192, 4096, 4096]
    - [29, 582.69]
  - - [8192, 512, 1, 8192, 8192, 8192, 8192, 8192]
    - [32, 661.34]
  - - [8192, 1024, 1, 128, 8192, 8192, 128, 128]
    - [27, 105.62]
  - - [8192, 1024, 1, 256, 8192, 8192, 256, 256]
    - [27, 184.72]
  - - [8192, 1024, 1, 512, 8192, 8192, 512, 512]
    - [24, 323.37]
  - - [8192, 1024, 1, 1024, 8192, 8192, 1024, 1024]
    - [27, 506.23]
  - - [8192, 1024, 1, 2048, 8192, 8192, 2048, 2048]
    - [27, 685.25]
  - - [8192, 1024, 1, 4096, 8192, 8192, 4096, 4096]
    - [26, 827.71]
  - - [8192, 1024, 1, 8192, 8192, 8192, 8192, 8192]
    - [25, 914.9]
  - - [8192, 2048, 1, 128, 8192, 8192, 128, 128]
    - [4, 127.41]
  - - [8192, 2048, 1, 256, 8192, 8192, 256, 256]
    - [0, 231.42]
  - - [8192, 2048, 1, 512, 8192, 8192, 512, 512]
    - [4, 389.35]
  - - [8192, 2048, 1, 1024, 8192, 8192, 1024, 1024]
    - [20, 605.18]
  - - [8192, 2048, 1, 2048, 8192, 8192, 2048, 2048]
    - [20, 851.83]
  - - [8192, 2048, 1, 4096, 8192, 8192, 4096, 4096]
    - [22, 1044.73]
  - - [8192, 2048, 1, 8192, 8192, 8192, 8192, 8192]
    - [18, 1096.65]
  - - [8192, 4096, 1, 128, 8192, 8192, 128, 128]
    - [5, 147.23]
  - - [8192, 4096, 1, 256, 8192, 8192, 256, 256]
    - [3, 265.14]
  - - [8192, 4096, 1, 512, 8192, 8192, 512, 512]
    - [17, 448.66]
  - - [8192, 4096, 1, 1024, 8192, 8192, 1024, 1024]
    - [17, 685.32]
  - - [8192, 4096, 1, 2048, 8192, 8192, 2048, 2048]
    - [22, 914.31]
  - - [8192, 4096, 1, 4096, 8192, 8192, 4096, 4096]
    - [17, 1032.61]
  - - [8192, 4096, 1, 8192, 8192, 8192, 8192, 8192]
    - [17, 1147.89]
  - - [8192, 8192, 1, 128, 8192, 8192, 128, 128]
    - [2, 165.52]
  - - [8192, 8192, 1, 256, 8192, 8192, 256, 256]
    - [4, 293.53]
  - - [8192, 8192, 1, 512, 8192, 8192, 512, 512]
    - [22, 486.09]
  - - [8192, 8192, 1, 1024, 8192, 8192, 1024, 1024]
    - [17, 708.94]
  - - [8192, 8192, 1, 2048, 8192, 8192, 2048, 2048]
    - [22, 913.67]
  - - [8192, 8192, 1, 4096, 8192, 8192, 4096, 4096]
    - [20, 1060.93]
  - - [8192, 8192, 1, 8192, 8192, 8192, 8192, 8192]
    - [17, 1244.19]
- null
- null
- DeviceEfficiency
- GridBased
