library/src/amd_detail/rocblaslt/src/Tensile/Logic/asm_full/gfx950/GridBased/gfx950_Cijk_Alik_Bjlk_I8_BH_UserArgs.yaml
- {MinimumRequiredVersion: 4.33.0}
- gfx950
- gfx950
- [Device 75a0]
    SolutionIndex: 0
    SolutionNameMin: Cijk_Alik_Bjlk_I8_BH_UserArgs_MT256x256x32_MI32x32x1_SN_LDSB0_AFC0_AFEM1_AFEM1_ASEM1_CLR0_CADS0_DTVA0_DTVB0_EPS0_FDSI0_GRPM1_GRVWA8_GRVWB8_GSU0_GSUAMB_GSUC0_GSUWGMRR0_GLS0_ISA950_IU1_K1_LBSPPA128_LBSPPB0_LBSPPM0_LPA16_LPB0_LPM0_LRVW16_LWPMn1_MIAV0_MIWT4_4_MO40_NTn1_NTA0_NTB0_NTC0_NTD0_NTM0_NEPBS0_NLCA1_NLCB1_ONLL1_PGR2_PLR0_PKA1_SIA3_SS1_SU0_SUM0_SUS32_SPO0_SRVW0_SSO0_SVW4_SK3_SKXCCM8_TLDS1_ULSGRO0_USL1_UIOFGRO0_USFGRO0_VSn1_VWA4_VWB4_WSGRA0_WSGRB0_WS64_WG64_4_1_WGM6_WGMXCC1_WGMXCCGn1
    SolutionIndex: 1
    SolutionNameMin: Cijk_Alik_Bjlk_I8_BH_UserArgs_MT256x256x32_MI32x32x1_SN_LDSB0_AFC0_AFEM1_AFEM1_ASEM1_CLR0_CADS0_DTVA0_DTVB0_EPS0_FDSI0_GRPM1_GRVWA16_GRVWB8_GSU0_GSUAMB_GSUC0_GSUWGMRR0_GLS0_ISA950_IU1_K1_LBSPPA128_LBSPPB0_LBSPPM0_LPA16_LPB0_LPM0_LRVW16_LWPMn1_MIAV0_MIWT4_4_MO40_NTn1_NTA0_NTB0_NTC0_NTD0_NTM0_NEPBS0_NLCA1_NLCB1_ONLL1_PGR2_PLR0_PKA1_SIA3_SS1_SU0_SUM0_SUS32_SPO0_SRVW0_SSO0_SVW4_SK3_SKXCCM8_TLDS1_ULSGRO0_USL1_UIOFGRO0_USFGRO0_VSn1_VWA4_VWB4_WSGRA0_WSGRB0_WS64_WG64_4_1_WGM6_WGMXCC1_WGMXCCGn1
    SolutionIndex: 2
    SolutionNameMin: Cijk_Alik_Bjlk_I8_BH_UserArgs_MT256x128x64_MI16x16x1_SN_LDSB1_AFC0_AFEM1_AFEM1_ASEM1_CLR1_CADS0_DTVA0_DTVB0_EPS0_FDSI0_GRPM1_GRVWA16_GRVWB16_GSU0_GSUAMB_GSUC0_GSUWGMRR0_GLS0_ISA950_IU1_K1_LBSPPA512_LBSPPB1024_LBSPPM0_LPA16_LPB64_LPM0_LRVW8_LWPMn1_MIAV0_MIWT8_4_MO40_NTn1_NTA0_NTB0_NTC0_NTD0_NTM0_NEPBS0_NLCA1_NLCB1_ONLL1_PGR2_PLR1_PKA1_SIA3_SS1_SU0_SUM0_SUS64_SPO0_SRVW0_SSO0_SVW8_SK3_SKXCCM8_TLDS1_ULSGRO0_USL1_UIOFGRO0_USFGRO0_VSn1_VWA8_VWB4_WSGRA0_WSGRB0_WS64_WG32_8_1_WGM6_WGMXCC1_WGMXCCGn1
    SolutionIndex: 3
    SolutionNameMin: Cijk_Alik_Bjlk_I8_BH_UserArgs_MT128x128x64_MI16x16x1_SN_LDSB1_AFC0_AFEM1_AFEM1_ASEM1_CLR1_CADS0_DTVA0_DTVB0_EPS0_FDSI0_GRPM1_GRVWA16_GRVWB4_GSU0_GSUAMB_GSUC0_GSUWGMRR0_GLS0_ISA950_IU1_K1_LBSPPA256_LBSPPB1024_LBSPPM0_LPA16_LPB64_LPM0_LRVW8_LWPMn1_MIAV0_MIWT4_4_MO40_NTn1_NTA0_NTB0_NTC0_NTD0_NTM0_NEPBS0_NLCA1_NLCB1_ONLL1_PGR2_PLR1_PKA1_SIA3_SS1_SU0_SUM0_SUS64_SPO0_SRVW0_SSO0_SVW4_SK3_SKXCCM8_TLDS1_ULSGRO0_USL1_UIOFGRO0_USFGRO0_VSn1_VWA4_VWB4_WSGRA0_WSGRB0_WS64_WG32_8_1_WGM6_WGMXCC1_WGMXCCGn1
    SolutionIndex: 4
    SolutionNameMin: Cijk_Alik_Bjlk_I8_BH_UserArgs_MT128x128x64_MI16x16x1_SN_LDSB1_AFC0_AFEM1_AFEM1_ASEM1_CLR1_CADS0_DTVA0_DTVB0_EPS0_FDSI0_GRPM1_GRVWA16_GRVWB16_GSU0_GSUAMB_GSUC0_GSUWGMRR0_GLS0_ISA950_IU1_K1_LBSPPA256_LBSPPB1024_LBSPPM0_LPA16_LPB64_LPM0_LRVW8_LWPMn1_MIAV0_MIWT4_4_MO40_NTn1_NTA0_NTB0_NTC0_NTD0_NTM0_NEPBS0_NLCA1_NLCB1_ONLL1_PGR2_PLR1_PKA1_SIA3_SS1_SU0_SUM0_SUS64_SPO0_SRVW0_SSO0_SVW4_SK3_SKXCCM8_TLDS1_ULSGRO0_USL1_UIOFGRO0_USFGRO0_VSn1_VWA4_VWB4_WSGRA0_WSGRB0_WS64_WG32_8_1_WGM6_WGMXCC1_WGMXCCGn1
    SolutionIndex: 5
    SolutionNameMin: Cijk_Alik_Bjlk_I8_BH_UserArgs_MT64x64x64_MI16x16x1_SN_LDSB0_AFC0_AFEM1_AFEM1_ASEM1_CLR1_CADS0_DTVA0_DTVB0_EPS0_FDSI0_GRPM1_GRVWA4_GRVWB8_GSU0_GSUAMB_GSUC0_GSUWGMRR0_GLS0_ISA950_IU1_K1_LBSPPA128_LBSPPB512_LBSPPM0_LPA8_LPB32_LPM0_LRVW8_LWPMn1_MIAV0_MIWT2_2_MO40_NTn1_NTA0_NTB0_NTC0_NTD0_NTM0_NEPBS0_NLCA1_NLCB1_ONLL1_PGR2_PLR1_PKA1_SIA3_SS1_SU0_SUM0_SUS64_SPO0_SRVW0_SSO0_SVW2_SK3_SKXCCM8_TLDS1_ULSGRO0_USL1_UIOFGRO0_USFGRO0_VSn1_VWA2_VWB2_WSGRA0_WSGRB0_WS64_WG32_8_1_WGM6_WGMXCC1_WGMXCCGn1
    SolutionIndex: 6
    SolutionNameMin: Cijk_Alik_Bjlk_I8_BH_UserArgs_MT64x64x64_MI16x16x1_SN_LDSB0_AFC0_AFEM1_AFEM1_ASEM1_CLR1_CADS0_DTVA0_DTVB0_EPS0_FDSI0_GRPM1_GRVWA16_GRVWB8_GSU0_GSUAMB_GSUC0_GSUWGMRR0_GLS0_ISA950_IU1_K1_LBSPPA128_LBSPPB512_LBSPPM0_LPA16_LPB32_LPM0_LRVW8_LWPMn1_MIAV0_MIWT2_2_MO40_NTn1_NTA0_NTB0_NTC0_NTD0_NTM0_NEPBS0_NLCA1_NLCB1_ONLL1_PGR2_PLR1_PKA1_SIA3_SS1_SU0_SUM0_SUS64_SPO0_SRVW0_SSO0_SVW2_SK3_SKXCCM8_TLDS1_ULSGRO0_USL1_UIOFGRO0_USFGRO0_VSn1_VWA2_VWB2_WSGRA0_WSGRB0_WS64_WG32_8_1_WGM6_WGMXCC1_WGMXCCGn1
    SolutionIndex: 7
    SolutionNameMin: Cijk_Alik_Bjlk_I8_BH_UserArgs_MT64x64x64_MI16x16x1_SN_LDSB0_AFC0_AFEM1_AFEM1_ASEM1_CLR1_CADS0_DTVA0_DTVB0_EPS0_FDSI0_GRPM1_GRVWA4_GRVWB4_GSU0_GSUAMB_GSUC0_GSUWGMRR0_GLS0_ISA950_IU1_K1_LBSPPA128_LBSPPB1024_LBSPPM0_LPA32_LPB32_LPM0_LRVW16_LWPMn1_MIAV0_MIWT2_2_MO40_NTn1_NTA0_NTB0_NTC0_NTD0_NTM0_NEPBS0_NLCA1_NLCB1_ONLL1_PGR2_PLR1_PKA1_SIA3_SS1_SU0_SUM0_SUS64_SPO0_SRVW0_SSO0_SVW2_SK3_SKXCCM8_TLDS1_ULSGRO0_USL1_UIOFGRO0_USFGRO0_VSn1_VWA2_VWB2_WSGRA0_WSGRB0_WS64_WG32_8_1_WGM6_WGMXCC1_WGMXCCGn1
    SolutionIndex: 8
    SolutionNameMin: Cijk_Alik_Bjlk_I8_BH_UserArgs_MT64x64x64_MI16x16x1_SN_LDSB0_AFC0_AFEM1_AFEM1_ASEM1_CLR1_CADS0_DTVA0_DTVB0_EPS0_FDSI0_GRPM1_GRVWA16_GRVWB4_GSU0_GSUAMB_GSUC0_GSUWGMRR0_GLS0_ISA950_IU1_K1_LBSPPA128_LBSPPB1024_LBSPPM0_LPA32_LPB32_LPM0_LRVW16_LWPMn1_MIAV0_MIWT2_2_MO40_NTn1_NTA0_NTB0_NTC0_NTD0_NTM0_NEPBS0_NLCA1_NLCB1_ONLL1_PGR2_PLR1_PKA1_SIA3_SS1_SU0_SUM0_SUS64_SPO0_SRVW0_SSO0_SVW2_SK3_SKXCCM8_TLDS1_ULSGRO0_USL1_UIOFGRO0_USFGRO0_VSn1_VWA2_VWB2_WSGRA0_WSGRB0_WS64_WG32_8_1_WGM6_WGMXCC1_WGMXCCGn1
    SolutionIndex: 9
    SolutionNameMin: Cijk_Alik_Bjlk_I8_BH_UserArgs_MT512x128x64_MI32x32x1_SN_LDSB0_AFC0_AFEM1_AFEM1_ASEM1_CLR1_CADS0_DTVA0_DTVB0_EPS0_FDSI0_GRPM1_GRVWA16_GRVWB8_GSU0_GSUAMB_GSUC0_GSUWGMRR0_GLS0_ISA950_IU1_K1_LBSPPA256_LBSPPB0_LBSPPM0_LPA16_LPB0_LPM0_LRVW16_LWPMn1_MIAV0_MIWT8_2_MO40_NTn1_NTA0_NTB0_NTC0_NTD0_NTM0_NEPBS0_NLCA1_NLCB1_ONLL1_PGR2_PLR1_PKA1_SIA3_SS1_SU0_SUM0_SUS64_SPO0_SRVW0_SSO0_SVW4_SK3_SKXCCM8_TLDS1_ULSGRO0_USL1_UIOFGRO0_USFGRO0_VSn1_VWA4_VWB2_WSGRA0_WSGRB0_WS64_WG64_4_1_WGM6_WGMXCC1_WGMXCCGn1
    SolutionIndex: 10
    SolutionNameMin: Cijk_Alik_Bjlk_I8_BH_UserArgs_MT512x128x64_MI32x32x1_SN_LDSB0_AFC0_AFEM1_AFEM1_ASEM1_CLR0_CADS0_DTVA0_DTVB0_EPS0_FDSI0_GRPM1_GRVWA16_GRVWB8_GSU0_GSUAMB_GSUC0_GSUWGMRR0_GLS0_ISA950_IU1_K1_LBSPPA512_LBSPPB0_LBSPPM0_LPA16_LPB0_LPM0_LRVW16_LWPMn1_MIAV0_MIWT8_2_MO40_NTn1_NTA0_NTB0_NTC0_NTD0_NTM0_NEPBS0_NLCA1_NLCB1_ONLL1_PGR2_PLR0_PKA1_SIA3_SS1_SU0_SUM0_SUS64_SPO0_SRVW0_SSO0_SVW8_SK3_SKXCCM8_TLDS1_ULSGRO0_USL1_UIOFGRO0_USFGRO0_VSn1_VWA8_VWB2_WSGRA0_WSGRB0_WS64_WG64_4_1_WGM6_WGMXCC1_WGMXCCGn1
    SolutionIndex: 11
    SolutionNameMin: Cijk_Alik_Bjlk_I8_BH_UserArgs_MT256x256x64_MI32x32x1_SN_LDSB0_AFC0_AFEM1_AFEM1_ASEM1_CLR1_CADS0_DTVA0_DTVB0_EPS0_FDSI0_GRPM1_GRVWA4_GRVWB4_GSU0_GSUAMB_GSUC0_GSUWGMRR0_GLS0_ISA950_IU1_K1_LBSPPA256_LBSPPB0_LBSPPM0_LPA16_LPB0_LPM0_LRVW16_LWPMn1_MIAV0_MIWT4_4_MO40_NTn1_NTA0_NTB0_NTC0_NTD0_NTM0_NEPBS0_NLCA1_NLCB1_ONLL1_PGR2_PLR1_PKA1_SIA3_SS1_SU0_SUM0_SUS64_SPO0_SRVW0_SSO0_SVW4_SK3_SKXCCM8_TLDS1_ULSGRO0_USL1_UIOFGRO0_USFGRO0_VSn1_VWA4_VWB4_WSGRA0_WSGRB0_WS64_WG64_4_1_WGM6_WGMXCC1_WGMXCCGn1
    SolutionIndex: 12
    SolutionNameMin: Cijk_Alik_Bjlk_I8_BH_UserArgs_MT256x256x64_MI32x32x1_SN_LDSB0_AFC0_AFEM1_AFEM1_ASEM1_CLR1_CADS0_DTVA0_DTVB0_EPS0_FDSI0_GRPM1_GRVWA16_GRVWB8_GSU0_GSUAMB_GSUC0_GSUWGMRR0_GLS0_ISA950_IU1_K1_LBSPPA128_LBSPPB0_LBSPPM0_LPA16_LPB0_LPM0_LRVW16_LWPMn1_MIAV0_MIWT4_4_MO40_NTn1_NTA0_NTB0_NTC0_NTD0_NTM0_NEPBS0_NLCA1_NLCB1_ONLL1_PGR2_PLR1_PKA1_SIA3_SS1_SU0_SUM0_SUS64_SPO0_SRVW0_SSO0_SVW2_SK3_SKXCCM8_TLDS1_ULSGRO0_USL1_UIOFGRO0_USFGRO0_VSn1_VWA2_VWB4_WSGRA0_WSGRB0_WS64_WG64_4_1_WGM6_WGMXCC1_WGMXCCGn1
    SolutionIndex: 13
    SolutionNameMin: Cijk_Alik_Bjlk_I8_BH_UserArgs_MT256x256x64_MI32x32x1_SN_LDSB0_AFC0_AFEM1_AFEM1_ASEM1_CLR1_CADS0_DTVA0_DTVB0_EPS0_FDSI0_GRPM1_GRVWA16_GRVWB8_GSU0_GSUAMB_GSUC0_GSUWGMRR0_GLS0_ISA950_IU1_K1_LBSPPA256_LBSPPB0_LBSPPM0_LPA16_LPB0_LPM0_LRVW16_LWPMn1_MIAV0_MIWT4_4_MO40_NTn1_NTA0_NTB0_NTC0_NTD0_NTM0_NEPBS0_NLCA1_NLCB1_ONLL1_PGR2_PLR1_PKA1_SIA3_SS1_SU0_SUM0_SUS64_SPO0_SRVW0_SSO0_SVW4_SK3_SKXCCM8_TLDS1_ULSGRO0_USL1_UIOFGRO0_USFGRO0_VSn1_VWA4_VWB4_WSGRA0_WSGRB0_WS64_WG64_4_1_WGM6_WGMXCC1_WGMXCCGn1
    SolutionIndex: 14
    SolutionNameMin: Cijk_Alik_Bjlk_I8_BH_UserArgs_MT256x128x64_MI32x32x1_SN_LDSB1_AFC0_AFEM1_AFEM1_ASEM1_CLR1_CADS0_DTVA0_DTVB0_EPS0_FDSI0_GRPM1_GRVWA16_GRVWB4_GSU0_GSUAMB_GSUC0_GSUWGMRR0_GLS0_ISA950_IU1_K1_LBSPPA256_LBSPPB0_LBSPPM0_LPA16_LPB0_LPM0_LRVW16_LWPMn1_MIAV0_MIWT4_2_MO40_NTn1_NTA0_NTB0_NTC0_NTD0_NTM0_NEPBS0_NLCA1_NLCB1_ONLL1_PGR2_PLR1_PKA1_SIA3_SS1_SU0_SUM0_SUS64_SPO0_SRVW0_SSO0_SVW4_SK3_SKXCCM8_TLDS1_ULSGRO0_USL1_UIOFGRO0_USFGRO0_VSn1_VWA4_VWB2_WSGRA0_WSGRB0_WS64_WG64_4_1_WGM6_WGMXCC1_WGMXCCGn1
    SolutionIndex: 15
    SolutionNameMin: Cijk_Alik_Bjlk_I8_BH_UserArgs_MT256x128x64_MI32x32x1_SN_LDSB1_AFC0_AFEM1_AFEM1_ASEM1_CLR1_CADS0_DTVA0_DTVB0_EPS0_FDSI0_GRPM1_GRVWA16_GRVWB8_GSU0_GSUAMB_GSUC0_GSUWGMRR0_GLS0_ISA950_IU1_K1_LBSPPA256_LBSPPB0_LBSPPM0_LPA16_LPB0_LPM0_LRVW16_LWPMn1_MIAV0_MIWT4_2_MO40_NTn1_NTA0_NTB0_NTC0_NTD0_NTM0_NEPBS0_NLCA1_NLCB1_ONLL1_PGR2_PLR1_PKA1_SIA3_SS1_SU0_SUM0_SUS64_SPO0_SRVW0_SSO0_SVW4_SK3_SKXCCM8_TLDS1_ULSGRO0_USL1_UIOFGRO0_USFGRO0_VSn1_VWA4_VWB2_WSGRA0_WSGRB0_WS64_WG64_4_1_WGM6_WGMXCC1_WGMXCCGn1
    SolutionIndex: 16
    SolutionNameMin: Cijk_Alik_Bjlk_I8_BH_UserArgs_MT256x64x128_MI16x16x1_SN_LDSB1_AFC0_AFEM1_AFEM1_ASEM1_CLR1_CADS0_DTVA0_DTVB0_EPS0_FDSI0_GRPM1_GRVWA16_GRVWB4_GSU0_GSUAMB_GSUC0_GSUWGMRR0_GLS0_ISA950_IU1_K1_LBSPPA1024_LBSPPB512_LBSPPM0_LPA16_LPB32_LPM0_LRVW8_LWPMn1_MIAV0_MIWT8_2_MO40_NTn1_NTA0_NTB0_NTC0_NTD0_NTM0_NEPBS0_NLCA1_NLCB1_ONLL1_PGR2_PLR1_PKA1_SIA3_SS1_SU0_SUM0_SUS128_SPO0_SRVW0_SSO0_SVW8_SK3_SKXCCM8_TLDS1_ULSGRO0_USL1_UIOFGRO0_USFGRO0_VSn1_VWA8_VWB2_WSGRA0_WSGRB0_WS64_WG32_8_1_WGM6_WGMXCC1_WGMXCCGn1
    SolutionIndex: 17
    SolutionNameMin: Cijk_Alik_Bjlk_I8_BH_UserArgs_MT256x64x128_MI16x16x1_SN_LDSB1_AFC0_AFEM1_AFEM1_ASEM1_CLR1_CADS0_DTVA0_DTVB0_EPS0_FDSI0_GRPM1_GRVWA16_GRVWB4_GSU0_GSUAMB_GSUC0_GSUWGMRR0_GLS0_ISA950_IU1_K1_LBSPPA1024_LBSPPB1024_LBSPPM0_LPA32_LPB32_LPM0_LRVW16_LWPMn1_MIAV0_MIWT8_2_MO40_NTn1_NTA0_NTB0_NTC0_NTD0_NTM0_NEPBS0_NLCA1_NLCB1_ONLL1_PGR2_PLR1_PKA1_SIA3_SS1_SU0_SUM0_SUS128_SPO0_SRVW0_SSO0_SVW8_SK3_SKXCCM8_TLDS1_ULSGRO0_USL1_UIOFGRO0_USFGRO0_VSn1_VWA8_VWB2_WSGRA0_WSGRB0_WS64_WG32_8_1_WGM6_WGMXCC1_WGMXCCGn1
    SolutionIndex: 18
    SolutionNameMin: Cijk_Alik_Bjlk_I8_BH_UserArgs_MT128x128x128_MI16x16x1_SN_LDSB1_AFC0_AFEM1_AFEM1_ASEM1_CLR1_CADS0_DTVA0_DTVB0_EPS0_FDSI0_GRPM1_GRVWA16_GRVWB16_GSU0_GSUAMB_GSUC0_GSUWGMRR0_GLS0_ISA950_IU1_K1_LBSPPA512_LBSPPB1024_LBSPPM0_LPA16_LPB64_LPM0_LRVW8_LWPMn1_MIAV0_MIWT4_4_MO40_NTn1_NTA0_NTB0_NTC0_NTD0_NTM0_NEPBS0_NLCA1_NLCB1_ONLL1_PGR2_PLR1_PKA1_SIA3_SS1_SU0_SUM0_SUS128_SPO0_SRVW0_SSO0_SVW4_SK3_SKXCCM8_TLDS1_ULSGRO0_USL1_UIOFGRO0_USFGRO0_VSn1_VWA4_VWB4_WSGRA0_WSGRB0_WS64_WG32_8_1_WGM6_WGMXCC1_WGMXCCGn1
    SolutionIndex: 19
    SolutionNameMin: Cijk_Alik_Bjlk_I8_BH_UserArgs_MT128x128x128_MI16x16x1_SN_LDSB1_AFC0_AFEM1_AFEM1_ASEM1_CLR1_CADS0_DTVA0_DTVB0_EPS0_FDSI0_GRPM1_GRVWA16_GRVWB16_GSU0_GSUAMB_GSUC0_GSUWGMRR0_GLS0_ISA950_IU1_K1_LBSPPA256_LBSPPB2048_LBSPPM0_LPA32_LPB64_LPM0_LRVW16_LWPMn1_MIAV0_MIWT4_4_MO40_NTn1_NTA0_NTB0_NTC0_NTD0_NTM0_NEPBS0_NLCA1_NLCB1_ONLL1_PGR2_PLR1_PKA1_SIA3_SS1_SU0_SUM0_SUS128_SPO0_SRVW0_SSO0_SVW2_SK3_SKXCCM8_TLDS1_ULSGRO0_USL1_UIOFGRO0_USFGRO0_VSn1_VWA2_VWB4_WSGRA0_WSGRB0_WS64_WG32_8_1_WGM6_WGMXCC1_WGMXCCGn1
    SolutionIndex: 20
    SolutionNameMin: Cijk_Alik_Bjlk_I8_BH_UserArgs_MT128x128x128_MI16x16x1_SN_LDSB1_AFC0_AFEM1_AFEM1_ASEM1_CLR1_CADS0_DTVA0_DTVB0_EPS0_FDSI0_GRPM1_GRVWA16_GRVWB16_GSU0_GSUAMB_GSUC0_GSUWGMRR0_GLS0_ISA950_IU1_K1_LBSPPA512_LBSPPB2048_LBSPPM0_LPA32_LPB64_LPM0_LRVW16_LWPMn1_MIAV0_MIWT4_4_MO40_NTn1_NTA0_NTB0_NTC0_NTD0_NTM0_NEPBS0_NLCA1_NLCB1_ONLL1_PGR2_PLR1_PKA1_SIA3_SS1_SU0_SUM0_SUS128_SPO0_SRVW0_SSO0_SVW4_SK3_SKXCCM8_TLDS1_ULSGRO0_USL1_UIOFGRO0_USFGRO0_VSn1_VWA4_VWB4_WSGRA0_WSGRB0_WS64_WG32_8_1_WGM6_WGMXCC1_WGMXCCGn1
    SolutionIndex: 21
    SolutionNameMin: Cijk_Alik_Bjlk_I8_BH_UserArgs_MT128x64x128_MI16x16x1_SN_LDSB1_AFC0_AFEM1_AFEM1_ASEM1_CLR1_CADS0_DTVA0_DTVB0_EPS0_FDSI0_GRPM1_GRVWA16_GRVWB4_GSU0_GSUAMB_GSUC0_GSUWGMRR0_GLS0_ISA950_IU1_K1_LBSPPA256_LBSPPB512_LBSPPM0_LPA16_LPB32_LPM0_LRVW8_LWPMn1_MIAV0_MIWT4_2_MO40_NTn1_NTA0_NTB0_NTC0_NTD0_NTM0_NEPBS0_NLCA1_NLCB1_ONLL1_PGR2_PLR1_PKA1_SIA3_SS1_SU0_SUM0_SUS128_SPO0_SRVW0_SSO0_SVW2_SK3_SKXCCM8_TLDS1_ULSGRO0_USL1_UIOFGRO0_USFGRO0_VSn1_VWA2_VWB2_WSGRA0_WSGRB0_WS64_WG32_8_1_WGM6_WGMXCC1_WGMXCCGn1
    SolutionIndex: 22
    SolutionNameMin: Cijk_Alik_Bjlk_I8_BH_UserArgs_MT128x64x128_MI16x16x1_SN_LDSB1_AFC0_AFEM1_AFEM1_ASEM1_CLR1_CADS0_DTVA0_DTVB0_EPS0_FDSI0_GRPM1_GRVWA16_GRVWB4_GSU0_GSUAMB_GSUC0_GSUWGMRR0_GLS0_ISA950_IU1_K1_LBSPPA512_LBSPPB512_LBSPPM0_LPA16_LPB32_LPM0_LRVW8_LWPMn1_MIAV0_MIWT4_2_MO40_NTn1_NTA0_NTB0_NTC0_NTD0_NTM0_NEPBS0_NLCA1_NLCB1_ONLL1_PGR2_PLR1_PKA1_SIA3_SS1_SU0_SUM0_SUS128_SPO0_SRVW0_SSO0_SVW4_SK3_SKXCCM8_TLDS1_ULSGRO0_USL1_UIOFGRO0_USFGRO0_VSn1_VWA4_VWB2_WSGRA0_WSGRB0_WS64_WG32_8_1_WGM6_WGMXCC1_WGMXCCGn1
    SolutionIndex: 23
    SolutionNameMin: Cijk_Alik_Bjlk_I8_BH_UserArgs_MT128x64x128_MI16x16x1_SN_LDSB1_AFC0_AFEM1_AFEM1_ASEM1_CLR1_CADS0_DTVA0_DTVB0_EPS0_FDSI0_GRPM1_GRVWA16_GRVWB16_GSU0_GSUAMB_GSUC0_GSUWGMRR0_GLS0_ISA950_IU1_K1_LBSPPA256_LBSPPB512_LBSPPM0_LPA16_LPB32_LPM0_LRVW8_LWPMn1_MIAV0_MIWT4_2_MO40_NTn1_NTA0_NTB0_NTC0_NTD0_NTM0_NEPBS0_NLCA1_NLCB1_ONLL1_PGR2_PLR1_PKA1_SIA3_SS1_SU0_SUM0_SUS128_SPO0_SRVW0_SSO0_SVW2_SK3_SKXCCM8_TLDS1_ULSGRO0_USL1_UIOFGRO0_USFGRO0_VSn1_VWA2_VWB2_WSGRA0_WSGRB0_WS64_WG32_8_1_WGM6_WGMXCC1_WGMXCCGn1
    SolutionIndex: 24
    SolutionNameMin: Cijk_Alik_Bjlk_I8_BH_UserArgs_MT128x64x128_MI16x16x1_SN_LDSB1_AFC0_AFEM1_AFEM1_ASEM1_CLR1_CADS0_DTVA0_DTVB0_EPS0_FDSI0_GRPM1_GRVWA16_GRVWB16_GSU0_GSUAMB_GSUC0_GSUWGMRR0_GLS0_ISA950_IU1_K1_LBSPPA256_LBSPPB1024_LBSPPM0_LPA32_LPB32_LPM0_LRVW16_LWPMn1_MIAV0_MIWT4_2_MO40_NTn1_NTA0_NTB0_NTC0_NTD0_NTM0_NEPBS0_NLCA1_NLCB1_ONLL1_PGR2_PLR1_PKA1_SIA3_SS1_SU0_SUM0_SUS128_SPO0_SRVW0_SSO0_SVW2_SK3_SKXCCM8_TLDS1_ULSGRO0_USL1_UIOFGRO0_USFGRO0_VSn1_VWA2_VWB2_WSGRA0_WSGRB0_WS64_WG32_8_1_WGM6_WGMXCC1_WGMXCCGn1
    SolutionIndex: 25
    SolutionNameMin: Cijk_Alik_Bjlk_I8_BH_UserArgs_MT128x64x128_MI16x16x1_SN_LDSB1_AFC0_AFEM1_AFEM1_ASEM1_CLR1_CADS0_DTVA0_DTVB0_EPS0_FDSI0_GRPM1_GRVWA16_GRVWB4_GSU0_GSUAMB_GSUC0_GSUWGMRR0_GLS0_ISA950_IU1_K1_LBSPPA256_LBSPPB512_LBSPPM0_LPA16_LPB32_LPM0_LRVW8_LWPMn1_MIAV0_MIWT4_2_MO40_NTn1_NTA0_NTB0_NTC0_NTD0_NTM0_NEPBS0_NLCA1_NLCB1_ONLL1_PGR2_PLR2_PKA1_SIA3_SS1_SU0_SUM0_SUS128_SPO0_SRVW0_SSO0_SVW2_SK3_SKXCCM8_TLDS1_ULSGRO0_USL1_UIOFGRO0_USFGRO0_VSn1_VWA2_VWB2_WSGRA0_WSGRB0_WS64_WG32_8_1_WGM6_WGMXCC1_WGMXCCGn1
    SolutionIndex: 26
    SolutionNameMin: Cijk_Alik_Bjlk_I8_BH_UserArgs_MT128x64x128_MI16x16x1_SN_LDSB1_AFC0_AFEM1_AFEM1_ASEM1_CLR1_CADS0_DTVA0_DTVB0_EPS0_FDSI0_GRPM1_GRVWA16_GRVWB4_GSU0_GSUAMB_GSUC0_GSUWGMRR0_GLS0_ISA950_IU1_K1_LBSPPA512_LBSPPB512_LBSPPM0_LPA16_LPB32_LPM0_LRVW8_LWPMn1_MIAV0_MIWT4_2_MO40_NTn1_NTA0_NTB0_NTC0_NTD0_NTM0_NEPBS0_NLCA1_NLCB1_ONLL1_PGR2_PLR2_PKA1_SIA3_SS1_SU0_SUM0_SUS128_SPO0_SRVW0_SSO0_SVW4_SK3_SKXCCM8_TLDS1_ULSGRO0_USL1_UIOFGRO0_USFGRO0_VSn1_VWA4_VWB2_WSGRA0_WSGRB0_WS64_WG32_8_1_WGM6_WGMXCC1_WGMXCCGn1
    SolutionIndex: 27
    SolutionNameMin: Cijk_Alik_Bjlk_I8_BH_UserArgs_MT128x64x128_MI16x16x1_SN_LDSB1_AFC0_AFEM1_AFEM1_ASEM1_CLR1_CADS0_DTVA0_DTVB0_EPS0_FDSI0_GRPM1_GRVWA16_GRVWB8_GSU0_GSUAMB_GSUC0_GSUWGMRR0_GLS0_ISA950_IU1_K1_LBSPPA256_LBSPPB512_LBSPPM0_LPA16_LPB32_LPM0_LRVW8_LWPMn1_MIAV0_MIWT4_2_MO40_NTn1_NTA0_NTB0_NTC0_NTD0_NTM0_NEPBS0_NLCA1_NLCB1_ONLL1_PGR2_PLR2_PKA1_SIA3_SS1_SU0_SUM0_SUS128_SPO0_SRVW0_SSO0_SVW2_SK3_SKXCCM8_TLDS1_ULSGRO0_USL1_UIOFGRO0_USFGRO0_VSn1_VWA2_VWB2_WSGRA0_WSGRB0_WS64_WG32_8_1_WGM6_WGMXCC1_WGMXCCGn1
    SolutionIndex: 28
    SolutionNameMin: Cijk_Alik_Bjlk_I8_BH_UserArgs_MT128x64x128_MI16x16x1_SN_LDSB1_AFC0_AFEM1_AFEM1_ASEM1_CLR1_CADS0_DTVA0_DTVB0_EPS0_FDSI0_GRPM1_GRVWA16_GRVWB16_GSU0_GSUAMB_GSUC0_GSUWGMRR0_GLS0_ISA950_IU1_K1_LBSPPA256_LBSPPB512_LBSPPM0_LPA16_LPB32_LPM0_LRVW8_LWPMn1_MIAV0_MIWT4_2_MO40_NTn1_NTA0_NTB0_NTC0_NTD0_NTM0_NEPBS0_NLCA1_NLCB1_ONLL1_PGR2_PLR2_PKA1_SIA3_SS1_SU0_SUM0_SUS128_SPO0_SRVW0_SSO0_SVW2_SK3_SKXCCM8_TLDS1_ULSGRO0_USL1_UIOFGRO0_USFGRO0_VSn1_VWA2_VWB2_WSGRA0_WSGRB0_WS64_WG32_8_1_WGM6_WGMXCC1_WGMXCCGn1
    SolutionIndex: 29
    SolutionNameMin: Cijk_Alik_Bjlk_I8_BH_UserArgs_MT128x64x128_MI16x16x1_SN_LDSB1_AFC0_AFEM1_AFEM1_ASEM1_CLR1_CADS0_DTVA0_DTVB0_EPS0_FDSI0_GRPM1_GRVWA16_GRVWB16_GSU0_GSUAMB_GSUC0_GSUWGMRR0_GLS0_ISA950_IU1_K1_LBSPPA512_LBSPPB512_LBSPPM0_LPA16_LPB32_LPM0_LRVW8_LWPMn1_MIAV0_MIWT4_2_MO40_NTn1_NTA0_NTB0_NTC0_NTD0_NTM0_NEPBS0_NLCA1_NLCB1_ONLL1_PGR2_PLR2_PKA1_SIA3_SS1_SU0_SUM0_SUS128_SPO0_SRVW0_SSO0_SVW4_SK3_SKXCCM8_TLDS1_ULSGRO0_USL1_UIOFGRO0_USFGRO0_VSn1_VWA4_VWB2_WSGRA0_WSGRB0_WS64_WG32_8_1_WGM6_WGMXCC1_WGMXCCGn1
    SolutionIndex: 30
    SolutionNameMin: Cijk_Alik_Bjlk_I8_BH_UserArgs_MT64x64x128_MI16x16x1_SN_LDSB1_AFC0_AFEM1_AFEM1_ASEM1_CLR1_CADS0_DTVA0_DTVB0_EPS0_FDSI0_GRPM1_GRVWA4_GRVWB4_GSU0_GSUAMB_GSUC0_GSUWGMRR0_GLS0_ISA950_IU1_K1_LBSPPA256_LBSPPB512_LBSPPM0_LPA8_LPB32_LPM0_LRVW8_LWPMn1_MIAV0_MIWT2_2_MO40_NTn1_NTA0_NTB0_NTC0_NTD0_NTM0_NEPBS0_NLCA1_NLCB1_ONLL1_PGR2_PLR1_PKA1_SIA3_SS1_SU0_SUM0_SUS128_SPO0_SRVW0_SSO0_SVW2_SK3_SKXCCM8_TLDS1_ULSGRO0_USL1_UIOFGRO0_USFGRO0_VSn1_VWA2_VWB2_WSGRA0_WSGRB0_WS64_WG32_8_1_WGM6_WGMXCC1_WGMXCCGn1
    SolutionIndex: 31
    SolutionNameMin: Cijk_Alik_Bjlk_I8_BH_UserArgs_MT64x64x128_MI16x16x1_SN_LDSB1_AFC0_AFEM1_AFEM1_ASEM1_CLR1_CADS0_DTVA0_DTVB0_EPS0_FDSI0_GRPM1_GRVWA16_GRVWB4_GSU0_GSUAMB_GSUC0_GSUWGMRR0_GLS0_ISA950_IU1_K1_LBSPPA256_LBSPPB512_LBSPPM0_LPA16_LPB32_LPM0_LRVW8_LWPMn1_MIAV0_MIWT2_2_MO40_NTn1_NTA0_NTB0_NTC0_NTD0_NTM0_NEPBS0_NLCA1_NLCB1_ONLL1_PGR2_PLR1_PKA1_SIA3_SS1_SU0_SUM0_SUS128_SPO0_SRVW0_SSO0_SVW2_SK3_SKXCCM8_TLDS1_ULSGRO0_USL1_UIOFGRO0_USFGRO0_VSn1_VWA2_VWB2_WSGRA0_WSGRB0_WS64_WG32_8_1_WGM6_WGMXCC1_WGMXCCGn1
    SolutionIndex: 32
    SolutionNameMin: Cijk_Alik_Bjlk_I8_BH_UserArgs_MT64x64x128_MI16x16x1_SN_LDSB1_AFC0_AFEM1_AFEM1_ASEM1_CLR1_CADS0_DTVA0_DTVB0_EPS0_FDSI0_GRPM1_GRVWA16_GRVWB16_GSU0_GSUAMB_GSUC0_GSUWGMRR0_GLS0_ISA950_IU1_K1_LBSPPA256_LBSPPB512_LBSPPM0_LPA16_LPB32_LPM0_LRVW8_LWPMn1_MIAV0_MIWT2_2_MO40_NTn1_NTA0_NTB0_NTC0_NTD0_NTM0_NEPBS0_NLCA1_NLCB1_ONLL1_PGR2_PLR1_PKA1_SIA3_SS1_SU0_SUM0_SUS128_SPO0_SRVW0_SSO0_SVW2_SK3_SKXCCM8_TLDS1_ULSGRO0_USL1_UIOFGRO0_USFGRO0_VSn1_VWA2_VWB2_WSGRA0_WSGRB0_WS64_WG32_8_1_WGM6_WGMXCC1_WGMXCCGn1
    SolutionIndex: 33
    SolutionNameMin: Cijk_Alik_Bjlk_I8_BH_UserArgs_MT64x64x128_MI16x16x1_SN_LDSB1_AFC0_AFEM1_AFEM1_ASEM1_CLR1_CADS0_DTVA0_DTVB0_EPS0_FDSI0_GRPM1_GRVWA8_GRVWB4_GSU0_GSUAMB_GSUC0_GSUWGMRR0_GLS0_ISA950_IU1_K1_LBSPPA256_LBSPPB1024_LBSPPM0_LPA32_LPB32_LPM0_LRVW16_LWPMn1_MIAV0_MIWT2_2_MO40_NTn1_NTA0_NTB0_NTC0_NTD0_NTM0_NEPBS0_NLCA1_NLCB1_ONLL1_PGR2_PLR1_PKA1_SIA3_SS1_SU0_SUM0_SUS128_SPO0_SRVW0_SSO0_SVW2_SK3_SKXCCM8_TLDS1_ULSGRO0_USL1_UIOFGRO0_USFGRO0_VSn1_VWA2_VWB2_WSGRA0_WSGRB0_WS64_WG32_8_1_WGM6_WGMXCC1_WGMXCCGn1
    SolutionIndex: 34
    SolutionNameMin: Cijk_Alik_Bjlk_I8_BH_UserArgs_MT64x64x128_MI16x16x1_SN_LDSB1_AFC0_AFEM1_AFEM1_ASEM1_CLR1_CADS0_DTVA0_DTVB0_EPS0_FDSI0_GRPM1_GRVWA16_GRVWB4_GSU0_GSUAMB_GSUC0_GSUWGMRR0_GLS0_ISA950_IU1_K1_LBSPPA256_LBSPPB1024_LBSPPM0_LPA32_LPB32_LPM0_LRVW16_LWPMn1_MIAV0_MIWT2_2_MO40_NTn1_NTA0_NTB0_NTC0_NTD0_NTM0_NEPBS0_NLCA1_NLCB1_ONLL1_PGR2_PLR1_PKA1_SIA3_SS1_SU0_SUM0_SUS128_SPO0_SRVW0_SSO0_SVW2_SK3_SKXCCM8_TLDS1_ULSGRO0_USL1_UIOFGRO0_USFGRO0_VSn1_VWA2_VWB2_WSGRA0_WSGRB0_WS64_WG32_8_1_WGM6_WGMXCC1_WGMXCCGn1
    SolutionIndex: 35
    SolutionNameMin: Cijk_Alik_Bjlk_I8_BH_UserArgs_MT64x64x128_MI16x16x1_SN_LDSB1_AFC0_AFEM1_AFEM1_ASEM1_CLR1_CADS0_DTVA0_DTVB0_EPS0_FDSI0_GRPM1_GRVWA8_GRVWB8_GSU0_GSUAMB_GSUC0_GSUWGMRR0_GLS0_ISA950_IU1_K1_LBSPPA256_LBSPPB1024_LBSPPM0_LPA32_LPB32_LPM0_LRVW16_LWPMn1_MIAV0_MIWT2_2_MO40_NTn1_NTA0_NTB0_NTC0_NTD0_NTM0_NEPBS0_NLCA1_NLCB1_ONLL1_PGR2_PLR1_PKA1_SIA3_SS1_SU0_SUM0_SUS128_SPO0_SRVW0_SSO0_SVW2_SK3_SKXCCM8_TLDS1_ULSGRO0_USL1_UIOFGRO0_USFGRO0_VSn1_VWA2_VWB2_WSGRA0_WSGRB0_WS64_WG32_8_1_WGM6_WGMXCC1_WGMXCCGn1
    SolutionIndex: 36
    SolutionNameMin: Cijk_Alik_Bjlk_I8_BH_UserArgs_MT64x64x128_MI16x16x1_SN_LDSB1_AFC0_AFEM1_AFEM1_ASEM1_CLR1_CADS0_DTVA0_DTVB0_EPS0_FDSI0_GRPM1_GRVWA16_GRVWB8_GSU0_GSUAMB_GSUC0_GSUWGMRR0_GLS0_ISA950_IU1_K1_LBSPPA256_LBSPPB1024_LBSPPM0_LPA32_LPB32_LPM0_LRVW16_LWPMn1_MIAV0_MIWT2_2_MO40_NTn1_NTA0_NTB0_NTC0_NTD0_NTM0_NEPBS0_NLCA1_NLCB1_ONLL1_PGR2_PLR1_PKA1_SIA3_SS1_SU0_SUM0_SUS128_SPO0_SRVW0_SSO0_SVW2_SK3_SKXCCM8_TLDS1_ULSGRO0_USL1_UIOFGRO0_USFGRO0_VSn1_VWA2_VWB2_WSGRA0_WSGRB0_WS64_WG32_8_1_WGM6_WGMXCC1_WGMXCCGn1
    SolutionIndex: 37
    SolutionNameMin: Cijk_Alik_Bjlk_I8_BH_UserArgs_MT64x64x128_MI16x16x1_SN_LDSB1_AFC0_AFEM1_AFEM1_ASEM1_CLR1_CADS0_DTVA0_DTVB0_EPS0_FDSI0_GRPM1_GRVWA4_GRVWB16_GSU0_GSUAMB_GSUC0_GSUWGMRR0_GLS0_ISA950_IU1_K1_LBSPPA256_LBSPPB1024_LBSPPM0_LPA32_LPB32_LPM0_LRVW16_LWPMn1_MIAV0_MIWT2_2_MO40_NTn1_NTA0_NTB0_NTC0_NTD0_NTM0_NEPBS0_NLCA1_NLCB1_ONLL1_PGR2_PLR1_PKA1_SIA3_SS1_SU0_SUM0_SUS128_SPO0_SRVW0_SSO0_SVW2_SK3_SKXCCM8_TLDS1_ULSGRO0_USL1_UIOFGRO0_USFGRO0_VSn1_VWA2_VWB2_WSGRA0_WSGRB0_WS64_WG32_8_1_WGM6_WGMXCC1_WGMXCCGn1
    SolutionIndex: 38
    SolutionNameMin: Cijk_Alik_Bjlk_I8_BH_UserArgs_MT64x64x128_MI16x16x1_SN_LDSB1_AFC0_AFEM1_AFEM1_ASEM1_CLR1_CADS0_DTVA0_DTVB0_EPS0_FDSI0_GRPM1_GRVWA16_GRVWB16_GSU0_GSUAMB_GSUC0_GSUWGMRR0_GLS0_ISA950_IU1_K1_LBSPPA256_LBSPPB1024_LBSPPM0_LPA32_LPB32_LPM0_LRVW16_LWPMn1_MIAV0_MIWT2_2_MO40_NTn1_NTA0_NTB0_NTC0_NTD0_NTM0_NEPBS0_NLCA1_NLCB1_ONLL1_PGR2_PLR1_PKA1_SIA3_SS1_SU0_SUM0_SUS128_SPO0_SRVW0_SSO0_SVW2_SK3_SKXCCM8_TLDS1_ULSGRO0_USL1_UIOFGRO0_USFGRO0_VSn1_VWA2_VWB2_WSGRA0_WSGRB0_WS64_WG32_8_1_WGM6_WGMXCC1_WGMXCCGn1
    SolutionIndex: 39
    SolutionNameMin: Cijk_Alik_Bjlk_I8_BH_UserArgs_MT64x64x128_MI16x16x1_SN_LDSB1_AFC0_AFEM1_AFEM1_ASEM1_CLR1_CADS0_DTVA0_DTVB0_EPS0_FDSI0_GRPM1_GRVWA16_GRVWB4_GSU0_GSUAMB_GSUC0_GSUWGMRR0_GLS0_ISA950_IU1_K1_LBSPPA256_LBSPPB512_LBSPPM0_LPA16_LPB32_LPM0_LRVW8_LWPMn1_MIAV0_MIWT2_2_MO40_NTn1_NTA0_NTB0_NTC0_NTD0_NTM0_NEPBS0_NLCA1_NLCB1_ONLL1_PGR2_PLR2_PKA1_SIA3_SS1_SU0_SUM0_SUS128_SPO0_SRVW0_SSO0_SVW2_SK3_SKXCCM8_TLDS1_ULSGRO0_USL1_UIOFGRO0_USFGRO0_VSn1_VWA2_VWB2_WSGRA0_WSGRB0_WS64_WG32_8_1_WGM6_WGMXCC1_WGMXCCGn1
    SolutionIndex: 40
    SolutionNameMin: Cijk_Alik_Bjlk_I8_BH_UserArgs_MT64x64x128_MI16x16x1_SN_LDSB1_AFC0_AFEM1_AFEM1_ASEM1_CLR1_CADS0_DTVA0_DTVB0_EPS0_FDSI0_GRPM1_GRVWA4_GRVWB8_GSU0_GSUAMB_GSUC0_GSUWGMRR0_GLS0_ISA950_IU1_K1_LBSPPA256_LBSPPB512_LBSPPM0_LPA8_LPB32_LPM0_LRVW8_LWPMn1_MIAV0_MIWT2_2_MO40_NTn1_NTA0_NTB0_NTC0_NTD0_NTM0_NEPBS0_NLCA1_NLCB1_ONLL1_PGR2_PLR2_PKA1_SIA3_SS1_SU0_SUM0_SUS128_SPO0_SRVW0_SSO0_SVW2_SK3_SKXCCM8_TLDS1_ULSGRO0_USL1_UIOFGRO0_USFGRO0_VSn1_VWA2_VWB2_WSGRA0_WSGRB0_WS64_WG32_8_1_WGM6_WGMXCC1_WGMXCCGn1
    SolutionIndex: 41
    SolutionNameMin: Cijk_Alik_Bjlk_I8_BH_UserArgs_MT64x64x128_MI16x16x1_SN_LDSB1_AFC0_AFEM1_AFEM1_ASEM1_CLR1_CADS0_DTVA0_DTVB0_EPS0_FDSI0_GRPM1_GRVWA16_GRVWB8_GSU0_GSUAMB_GSUC0_GSUWGMRR0_GLS0_ISA950_IU1_K1_LBSPPA256_LBSPPB512_LBSPPM0_LPA16_LPB32_LPM0_LRVW8_LWPMn1_MIAV0_MIWT2_2_MO40_NTn1_NTA0_NTB0_NTC0_NTD0_NTM0_NEPBS0_NLCA1_NLCB1_ONLL1_PGR2_PLR2_PKA1_SIA3_SS1_SU0_SUM0_SUS128_SPO0_SRVW0_SSO0_SVW2_SK3_SKXCCM8_TLDS1_ULSGRO0_USL1_UIOFGRO0_USFGRO0_VSn1_VWA2_VWB2_WSGRA0_WSGRB0_WS64_WG32_8_1_WGM6_WGMXCC1_WGMXCCGn1
    SolutionIndex: 42
    SolutionNameMin: Cijk_Alik_Bjlk_I8_BH_UserArgs_MT64x64x128_MI16x16x1_SN_LDSB1_AFC0_AFEM1_AFEM1_ASEM1_CLR1_CADS0_DTVA0_DTVB0_EPS0_FDSI0_GRPM1_GRVWA4_GRVWB4_GSU0_GSUAMB_GSUC0_GSUWGMRR0_GLS0_ISA950_IU1_K1_LBSPPA256_LBSPPB1024_LBSPPM0_LPA32_LPB32_LPM0_LRVW16_LWPMn1_MIAV0_MIWT2_2_MO40_NTn1_NTA0_NTB0_NTC0_NTD0_NTM0_NEPBS0_NLCA1_NLCB1_ONLL1_PGR2_PLR2_PKA1_SIA3_SS1_SU0_SUM0_SUS128_SPO0_SRVW0_SSO0_SVW2_SK3_SKXCCM8_TLDS1_ULSGRO0_USL1_UIOFGRO0_USFGRO0_VSn1_VWA2_VWB2_WSGRA0_WSGRB0_WS64_WG32_8_1_WGM6_WGMXCC1_WGMXCCGn1
    SolutionIndex: 43
    SolutionNameMin: Cijk_Alik_Bjlk_I8_BH_UserArgs_MT64x64x128_MI16x16x1_SN_LDSB1_AFC0_AFEM1_AFEM1_ASEM1_CLR1_CADS0_DTVA0_DTVB0_EPS0_FDSI0_GRPM1_GRVWA16_GRVWB8_GSU0_GSUAMB_GSUC0_GSUWGMRR0_GLS0_ISA950_IU1_K1_LBSPPA256_LBSPPB1024_LBSPPM0_LPA32_LPB32_LPM0_LRVW16_LWPMn1_MIAV0_MIWT2_2_MO40_NTn1_NTA0_NTB0_NTC0_NTD0_NTM0_NEPBS0_NLCA1_NLCB1_ONLL1_PGR2_PLR2_PKA1_SIA3_SS1_SU0_SUM0_SUS128_SPO0_SRVW0_SSO0_SVW2_SK3_SKXCCM8_TLDS1_ULSGRO0_USL1_UIOFGRO0_USFGRO0_VSn1_VWA2_VWB2_WSGRA0_WSGRB0_WS64_WG32_8_1_WGM6_WGMXCC1_WGMXCCGn1
    SolutionIndex: 44
    SolutionNameMin: Cijk_Alik_Bjlk_I8_BH_UserArgs_MT256x256x128_MI32x32x1_SN_LDSB1_AFC0_AFEM1_AFEM1_ASEM1_CLR1_CADS0_DTVA0_DTVB0_EPS0_FDSI0_GRPM1_GRVWA16_GRVWB4_GSU0_GSUAMB_GSUC0_GSUWGMRR0_GLS0_ISA950_IU1_K1_LBSPPA512_LBSPPB0_LBSPPM0_LPA16_LPB0_LPM0_LRVW16_LWPMn1_MIAV0_MIWT4_4_MO40_NTn1_NTA0_NTB0_NTC0_NTD0_NTM0_NEPBS0_NLCA1_NLCB1_ONLL1_PGR2_PLR1_PKA1_SIA3_SS1_SU0_SUM0_SUS128_SPO0_SRVW0_SSO0_SVW4_SK3_SKXCCM8_TLDS1_ULSGRO0_USL1_UIOFGRO0_USFGRO0_VSn1_VWA4_VWB4_WSGRA0_WSGRB0_WS64_WG64_4_1_WGM6_WGMXCC1_WGMXCCGn1
    SolutionIndex: 45
    SolutionNameMin: Cijk_Alik_Bjlk_I8_BH_UserArgs_MT256x256x128_MI32x32x1_SN_LDSB1_AFC0_AFEM1_AFEM1_ASEM1_CLR1_CADS0_DTVA0_DTVB0_EPS0_FDSI0_GRPM1_GRVWA16_GRVWB8_GSU0_GSUAMB_GSUC0_GSUWGMRR0_GLS0_ISA950_IU1_K1_LBSPPA256_LBSPPB0_LBSPPM0_LPA16_LPB0_LPM0_LRVW16_LWPMn1_MIAV0_MIWT4_4_MO40_NTn1_NTA0_NTB0_NTC0_NTD0_NTM0_NEPBS0_NLCA1_NLCB1_ONLL1_PGR2_PLR1_PKA1_SIA3_SS1_SU0_SUM0_SUS128_SPO0_SRVW0_SSO0_SVW2_SK3_SKXCCM8_TLDS1_ULSGRO0_USL1_UIOFGRO0_USFGRO0_VSn1_VWA2_VWB4_WSGRA0_WSGRB0_WS64_WG64_4_1_WGM6_WGMXCC1_WGMXCCGn1
    SolutionIndex: 46
    SolutionNameMin: Cijk_Alik_Bjlk_I8_BH_UserArgs_MT256x256x128_MI32x32x1_SN_LDSB1_AFC0_AFEM1_AFEM1_ASEM1_CLR1_CADS0_DTVA0_DTVB0_EPS0_FDSI0_GRPM1_GRVWA16_GRVWB8_GSU0_GSUAMB_GSUC0_GSUWGMRR0_GLS0_ISA950_IU1_K1_LBSPPA512_LBSPPB0_LBSPPM0_LPA16_LPB0_LPM0_LRVW16_LWPMn1_MIAV0_MIWT4_4_MO40_NTn1_NTA0_NTB0_NTC0_NTD0_NTM0_NEPBS0_NLCA1_NLCB1_ONLL1_PGR2_PLR1_PKA1_SIA3_SS1_SU0_SUM0_SUS128_SPO0_SRVW0_SSO0_SVW4_SK3_SKXCCM8_TLDS1_ULSGRO0_USL1_UIOFGRO0_USFGRO0_VSn1_VWA4_VWB4_WSGRA0_WSGRB0_WS64_WG64_4_1_WGM6_WGMXCC1_WGMXCCGn1
    SolutionIndex: 47
    SolutionNameMin: Cijk_Alik_Bjlk_I8_BH_UserArgs_MT256x128x128_MI32x32x1_SN_LDSB1_AFC0_AFEM1_AFEM1_ASEM1_CLR1_CADS0_DTVA0_DTVB0_EPS0_FDSI0_GRPM1_GRVWA16_GRVWB4_GSU0_GSUAMB_GSUC0_GSUWGMRR0_GLS0_ISA950_IU1_K1_LBSPPA512_LBSPPB0_LBSPPM0_LPA16_LPB0_LPM0_LRVW16_LWPMn1_MIAV0_MIWT4_2_MO40_NTn1_NTA0_NTB0_NTC0_NTD0_NTM0_NEPBS0_NLCA1_NLCB1_ONLL1_PGR2_PLR1_PKA1_SIA3_SS1_SU0_SUM0_SUS128_SPO0_SRVW0_SSO0_SVW4_SK3_SKXCCM8_TLDS1_ULSGRO0_USL1_UIOFGRO0_USFGRO0_VSn1_VWA4_VWB2_WSGRA0_WSGRB0_WS64_WG64_4_1_WGM6_WGMXCC1_WGMXCCGn1
    SolutionIndex: 48
    SolutionNameMin: Cijk_Alik_Bjlk_I8_BH_UserArgs_MT256x128x128_MI32x32x1_SN_LDSB1_AFC0_AFEM1_AFEM1_ASEM1_CLR1_CADS0_DTVA0_DTVB0_EPS0_FDSI0_GRPM1_GRVWA16_GRVWB8_GSU0_GSUAMB_GSUC0_GSUWGMRR0_GLS0_ISA950_IU1_K1_LBSPPA512_LBSPPB0_LBSPPM0_LPA16_LPB0_LPM0_LRVW16_LWPMn1_MIAV0_MIWT4_2_MO40_NTn1_NTA0_NTB0_NTC0_NTD0_NTM0_NEPBS0_NLCA1_NLCB1_ONLL1_PGR2_PLR1_PKA1_SIA3_SS1_SU0_SUM0_SUS128_SPO0_SRVW0_SSO0_SVW4_SK3_SKXCCM8_TLDS1_ULSGRO0_USL1_UIOFGRO0_USFGRO0_VSn1_VWA4_VWB2_WSGRA0_WSGRB0_WS64_WG64_4_1_WGM6_WGMXCC1_WGMXCCGn1
    SolutionIndex: 49
    SolutionNameMin: Cijk_Alik_Bjlk_I8_BH_UserArgs_MT256x128x128_MI32x32x1_SN_LDSB1_AFC0_AFEM1_AFEM1_ASEM1_CLR1_CADS0_DTVA0_DTVB0_EPS0_FDSI0_GRPM1_GRVWA4_GRVWB4_GSU0_GSUAMB_GSUC0_GSUWGMRR0_GLS0_ISA950_IU1_K1_LBSPPA512_LBSPPB0_LBSPPM0_LPA16_LPB0_LPM0_LRVW16_LWPMn1_MIAV0_MIWT4_2_MO40_NTn1_NTA0_NTB0_NTC0_NTD0_NTM0_NEPBS0_NLCA1_NLCB1_ONLL1_PGR2_PLR2_PKA1_SIA3_SS1_SU0_SUM0_SUS128_SPO0_SRVW0_SSO0_SVW4_SK3_SKXCCM8_TLDS1_ULSGRO0_USL1_UIOFGRO0_USFGRO0_VSn1_VWA4_VWB2_WSGRA0_WSGRB0_WS64_WG64_4_1_WGM6_WGMXCC1_WGMXCCGn1
    SolutionIndex: 50
    SolutionNameMin: Cijk_Alik_Bjlk_I8_BH_UserArgs_MT256x128x128_MI32x32x1_SN_LDSB1_AFC0_AFEM1_AFEM1_ASEM1_CLR1_CADS0_DTVA0_DTVB0_EPS0_FDSI0_GRPM1_GRVWA16_GRVWB4_GSU0_GSUAMB_GSUC0_GSUWGMRR0_GLS0_ISA950_IU1_K1_LBSPPA512_LBSPPB0_LBSPPM0_LPA16_LPB0_LPM0_LRVW16_LWPMn1_MIAV0_MIWT4_2_MO40_NTn1_NTA0_NTB0_NTC0_NTD0_NTM0_NEPBS0_NLCA1_NLCB1_ONLL1_PGR2_PLR2_PKA1_SIA3_SS1_SU0_SUM0_SUS128_SPO0_SRVW0_SSO0_SVW4_SK3_SKXCCM8_TLDS1_ULSGRO0_USL1_UIOFGRO0_USFGRO0_VSn1_VWA4_VWB2_WSGRA0_WSGRB0_WS64_WG64_4_1_WGM6_WGMXCC1_WGMXCCGn1
    SolutionIndex: 51
    SolutionNameMin: Cijk_Alik_Bjlk_I8_BH_UserArgs_MT256x128x128_MI32x32x1_SN_LDSB1_AFC0_AFEM1_AFEM1_ASEM1_CLR1_CADS0_DTVA0_DTVB0_EPS0_FDSI0_GRPM1_GRVWA4_GRVWB8_GSU0_GSUAMB_GSUC0_GSUWGMRR0_GLS0_ISA950_IU1_K1_LBSPPA512_LBSPPB0_LBSPPM0_LPA16_LPB0_LPM0_LRVW16_LWPMn1_MIAV0_MIWT4_2_MO40_NTn1_NTA0_NTB0_NTC0_NTD0_NTM0_NEPBS0_NLCA1_NLCB1_ONLL1_PGR2_PLR2_PKA1_SIA3_SS1_SU0_SUM0_SUS128_SPO0_SRVW0_SSO0_SVW4_SK3_SKXCCM8_TLDS1_ULSGRO0_USL1_UIOFGRO0_USFGRO0_VSn1_VWA4_VWB2_WSGRA0_WSGRB0_WS64_WG64_4_1_WGM6_WGMXCC1_WGMXCCGn1
    SolutionIndex: 52
    SolutionNameMin: Cijk_Alik_Bjlk_I8_BH_UserArgs_MT256x128x128_MI32x32x1_SN_LDSB1_AFC0_AFEM1_AFEM1_ASEM1_CLR1_CADS0_DTVA0_DTVB0_EPS0_FDSI0_GRPM1_GRVWA16_GRVWB8_GSU0_GSUAMB_GSUC0_GSUWGMRR0_GLS0_ISA950_IU1_K1_LBSPPA512_LBSPPB0_LBSPPM0_LPA16_LPB0_LPM0_LRVW16_LWPMn1_MIAV0_MIWT4_2_MO40_NTn1_NTA0_NTB0_NTC0_NTD0_NTM0_NEPBS0_NLCA1_NLCB1_ONLL1_PGR2_PLR2_PKA1_SIA3_SS1_SU0_SUM0_SUS128_SPO0_SRVW0_SSO0_SVW4_SK3_SKXCCM8_TLDS1_ULSGRO0_USL1_UIOFGRO0_USFGRO0_VSn1_VWA4_VWB2_WSGRA0_WSGRB0_WS64_WG64_4_1_WGM6_WGMXCC1_WGMXCCGn1
    SolutionIndex: 53
    SolutionNameMin: Cijk_Alik_Bjlk_I8_BH_UserArgs_MT128x128x256_MI16x16x1_SN_LDSB1_AFC0_AFEM1_AFEM1_ASEM1_CLR1_CADS0_DTVA0_DTVB0_EPS0_FDSI0_GRPM1_GRVWA16_GRVWB16_GSU0_GSUAMB_GSUC0_GSUWGMRR0_GLS0_ISA950_IU1_K1_LBSPPA512_LBSPPB2048_LBSPPM0_LPA32_LPB64_LPM0_LRVW16_LWPMn1_MIAV0_MIWT4_4_MO40_NTn1_NTA0_NTB0_NTC0_NTD0_NTM0_NEPBS0_NLCA1_NLCB1_ONLL1_PGR2_PLR1_PKA1_SIA3_SS1_SU0_SUM0_SUS256_SPO0_SRVW0_SSO0_SVW2_SK3_SKXCCM8_TLDS1_ULSGRO0_USL1_UIOFGRO0_USFGRO0_VSn1_VWA2_VWB4_WSGRA0_WSGRB0_WS64_WG32_8_1_WGM6_WGMXCC1_WGMXCCGn1
    SolutionIndex: 54
    SolutionNameMin: Cijk_Alik_Bjlk_I8_BH_UserArgs_MT128x128x256_MI16x16x1_SN_LDSB1_AFC0_AFEM1_AFEM1_ASEM1_CLR1_CADS0_DTVA0_DTVB0_EPS0_FDSI0_GRPM1_GRVWA16_GRVWB16_GSU0_GSUAMB_GSUC0_GSUWGMRR0_GLS0_ISA950_IU1_K1_LBSPPA1024_LBSPPB2048_LBSPPM0_LPA32_LPB64_LPM0_LRVW16_LWPMn1_MIAV0_MIWT4_4_MO40_NTn1_NTA0_NTB0_NTC0_NTD0_NTM0_NEPBS0_NLCA1_NLCB1_ONLL1_PGR2_PLR1_PKA1_SIA3_SS1_SU0_SUM0_SUS256_SPO0_SRVW0_SSO0_SVW4_SK3_SKXCCM8_TLDS1_ULSGRO0_USL1_UIOFGRO0_USFGRO0_VSn1_VWA4_VWB4_WSGRA0_WSGRB0_WS64_WG32_8_1_WGM6_WGMXCC1_WGMXCCGn1
    SolutionIndex: 55
    SolutionNameMin: Cijk_Alik_Bjlk_I8_BH_UserArgs_MT128x64x256_MI16x16x1_SN_LDSB1_AFC0_AFEM1_AFEM1_ASEM1_CLR1_CADS0_DTVA0_DTVB0_EPS0_FDSI0_GRPM1_GRVWA16_GRVWB16_GSU0_GSUAMB_GSUC0_GSUWGMRR0_GLS0_ISA950_IU1_K1_LBSPPA512_LBSPPB512_LBSPPM0_LPA16_LPB32_LPM0_LRVW8_LWPMn1_MIAV0_MIWT4_2_MO40_NTn1_NTA0_NTB0_NTC0_NTD0_NTM0_NEPBS0_NLCA1_NLCB1_ONLL1_PGR2_PLR2_PKA1_SIA3_SS1_SU0_SUM0_SUS256_SPO0_SRVW0_SSO0_SVW2_SK3_SKXCCM8_TLDS1_ULSGRO0_USL1_UIOFGRO0_USFGRO0_VSn1_VWA2_VWB2_WSGRA0_WSGRB0_WS64_WG32_8_1_WGM6_WGMXCC1_WGMXCCGn1
    SolutionIndex: 56
    SolutionNameMin: Cijk_Alik_Bjlk_I8_BH_UserArgs_MT128x64x256_MI16x16x1_SN_LDSB1_AFC0_AFEM1_AFEM1_ASEM1_CLR1_CADS0_DTVA0_DTVB0_EPS0_FDSI0_GRPM1_GRVWA16_GRVWB16_GSU0_GSUAMB_GSUC0_GSUWGMRR0_GLS0_ISA950_IU1_K1_LBSPPA512_LBSPPB1024_LBSPPM0_LPA32_LPB32_LPM0_LRVW16_LWPMn1_MIAV0_MIWT4_2_MO40_NTn1_NTA0_NTB0_NTC0_NTD0_NTM0_NEPBS0_NLCA1_NLCB1_ONLL1_PGR2_PLR2_PKA1_SIA3_SS1_SU0_SUM0_SUS256_SPO0_SRVW0_SSO0_SVW2_SK3_SKXCCM8_TLDS1_ULSGRO0_USL1_UIOFGRO0_USFGRO0_VSn1_VWA2_VWB2_WSGRA0_WSGRB0_WS64_WG32_8_1_WGM6_WGMXCC1_WGMXCCGn1
    SolutionIndex: 57
    SolutionNameMin: Cijk_Alik_Bjlk_I8_BH_UserArgs_MT128x64x256_MI16x16x1_SN_LDSB1_AFC0_AFEM1_AFEM1_ASEM1_CLR1_CADS0_DTVA0_DTVB0_EPS0_FDSI0_GRPM1_GRVWA16_GRVWB16_GSU0_GSUAMB_GSUC0_GSUWGMRR0_GLS0_ISA950_IU1_K1_LBSPPA1024_LBSPPB1024_LBSPPM0_LPA32_LPB32_LPM0_LRVW16_LWPMn1_MIAV0_MIWT4_2_MO40_NTn1_NTA0_NTB0_NTC0_NTD0_NTM0_NEPBS0_NLCA1_NLCB1_ONLL1_PGR2_PLR2_PKA1_SIA3_SS1_SU0_SUM0_SUS256_SPO0_SRVW0_SSO0_SVW4_SK3_SKXCCM8_TLDS1_ULSGRO0_USL1_UIOFGRO0_USFGRO0_VSn1_VWA4_VWB2_WSGRA0_WSGRB0_WS64_WG32_8_1_WGM6_WGMXCC1_WGMXCCGn1
    SolutionIndex: 58
    SolutionNameMin: Cijk_Alik_Bjlk_I8_BH_UserArgs_MT64x64x256_MI16x16x1_SN_LDSB1_AFC0_AFEM1_AFEM1_ASEM1_CLR1_CADS0_DTVA0_DTVB0_EPS0_FDSI0_GRPM1_GRVWA16_GRVWB8_GSU0_GSUAMB_GSUC0_GSUWGMRR0_GLS0_ISA950_IU1_K1_LBSPPA512_LBSPPB512_LBSPPM0_LPA16_LPB32_LPM0_LRVW8_LWPMn1_MIAV0_MIWT2_2_MO40_NTn1_NTA0_NTB0_NTC0_NTD0_NTM0_NEPBS0_NLCA1_NLCB1_ONLL1_PGR2_PLR1_PKA1_SIA3_SS1_SU0_SUM0_SUS256_SPO0_SRVW0_SSO0_SVW2_SK3_SKXCCM8_TLDS1_ULSGRO0_USL1_UIOFGRO0_USFGRO0_VSn1_VWA2_VWB2_WSGRA0_WSGRB0_WS64_WG32_8_1_WGM6_WGMXCC1_WGMXCCGn1
    SolutionIndex: 59
    SolutionNameMin: Cijk_Alik_Bjlk_I8_BH_UserArgs_MT64x64x256_MI16x16x1_SN_LDSB1_AFC0_AFEM1_AFEM1_ASEM1_CLR1_CADS0_DTVA0_DTVB0_EPS0_FDSI0_GRPM1_GRVWA16_GRVWB16_GSU0_GSUAMB_GSUC0_GSUWGMRR0_GLS0_ISA950_IU1_K1_LBSPPA512_LBSPPB512_LBSPPM0_LPA16_LPB32_LPM0_LRVW8_LWPMn1_MIAV0_MIWT2_2_MO40_NTn1_NTA0_NTB0_NTC0_NTD0_NTM0_NEPBS0_NLCA1_NLCB1_ONLL1_PGR2_PLR1_PKA1_SIA3_SS1_SU0_SUM0_SUS256_SPO0_SRVW0_SSO0_SVW2_SK3_SKXCCM8_TLDS1_ULSGRO0_USL1_UIOFGRO0_USFGRO0_VSn1_VWA2_VWB2_WSGRA0_WSGRB0_WS64_WG32_8_1_WGM6_WGMXCC1_WGMXCCGn1
    SolutionIndex: 60
    SolutionNameMin: Cijk_Alik_Bjlk_I8_BH_UserArgs_MT64x64x256_MI16x16x1_SN_LDSB1_AFC0_AFEM1_AFEM1_ASEM1_CLR1_CADS0_DTVA0_DTVB0_EPS0_FDSI0_GRPM1_GRVWA16_GRVWB4_GSU0_GSUAMB_GSUC0_GSUWGMRR0_GLS0_ISA950_IU1_K1_LBSPPA512_LBSPPB1024_LBSPPM0_LPA32_LPB32_LPM0_LRVW16_LWPMn1_MIAV0_MIWT2_2_MO40_NTn1_NTA0_NTB0_NTC0_NTD0_NTM0_NEPBS0_NLCA1_NLCB1_ONLL1_PGR2_PLR1_PKA1_SIA3_SS1_SU0_SUM0_SUS256_SPO0_SRVW0_SSO0_SVW2_SK3_SKXCCM8_TLDS1_ULSGRO0_USL1_UIOFGRO0_USFGRO0_VSn1_VWA2_VWB2_WSGRA0_WSGRB0_WS64_WG32_8_1_WGM6_WGMXCC1_WGMXCCGn1
    SolutionIndex: 61
    SolutionNameMin: Cijk_Alik_Bjlk_I8_BH_UserArgs_MT64x64x256_MI16x16x1_SN_LDSB1_AFC0_AFEM1_AFEM1_ASEM1_CLR1_CADS0_DTVA0_DTVB0_EPS0_FDSI0_GRPM1_GRVWA16_GRVWB16_GSU0_GSUAMB_GSUC0_GSUWGMRR0_GLS0_ISA950_IU1_K1_LBSPPA512_LBSPPB1024_LBSPPM0_LPA32_LPB32_LPM0_LRVW16_LWPMn1_MIAV0_MIWT2_2_MO40_NTn1_NTA0_NTB0_NTC0_NTD0_NTM0_NEPBS0_NLCA1_NLCB1_ONLL1_PGR2_PLR1_PKA1_SIA3_SS1_SU0_SUM0_SUS256_SPO0_SRVW0_SSO0_SVW2_SK3_SKXCCM8_TLDS1_ULSGRO0_USL1_UIOFGRO0_USFGRO0_VSn1_VWA2_VWB2_WSGRA0_WSGRB0_WS64_WG32_8_1_WGM6_WGMXCC1_WGMXCCGn1
    SolutionIndex: 62
    SolutionNameMin: Cijk_Alik_Bjlk_I8_BH_UserArgs_MT64x64x256_MI16x16x1_SN_LDSB1_AFC0_AFEM1_AFEM1_ASEM1_CLR1_CADS0_DTVA0_DTVB0_EPS0_FDSI0_GRPM1_GRVWA8_GRVWB4_GSU0_GSUAMB_GSUC0_GSUWGMRR0_GLS0_ISA950_IU1_K1_LBSPPA512_LBSPPB512_LBSPPM0_LPA8_LPB32_LPM0_LRVW8_LWPMn1_MIAV0_MIWT2_2_MO40_NTn1_NTA0_NTB0_NTC0_NTD0_NTM0_NEPBS0_NLCA1_NLCB1_ONLL1_PGR2_PLR2_PKA1_SIA3_SS1_SU0_SUM0_SUS256_SPO0_SRVW0_SSO0_SVW2_SK3_SKXCCM8_TLDS1_ULSGRO0_USL1_UIOFGRO0_USFGRO0_VSn1_VWA2_VWB2_WSGRA0_WSGRB0_WS64_WG32_8_1_WGM6_WGMXCC1_WGMXCCGn1
    SolutionIndex: 63
    SolutionNameMin: Cijk_Alik_Bjlk_I8_BH_UserArgs_MT64x64x256_MI16x16x1_SN_LDSB1_AFC0_AFEM1_AFEM1_ASEM1_CLR1_CADS0_DTVA0_DTVB0_EPS0_FDSI0_GRPM1_GRVWA16_GRVWB8_GSU0_GSUAMB_GSUC0_GSUWGMRR0_GLS0_ISA950_IU1_K1_LBSPPA512_LBSPPB512_LBSPPM0_LPA16_LPB32_LPM0_LRVW8_LWPMn1_MIAV0_MIWT2_2_MO40_NTn1_NTA0_NTB0_NTC0_NTD0_NTM0_NEPBS0_NLCA1_NLCB1_ONLL1_PGR2_PLR2_PKA1_SIA3_SS1_SU0_SUM0_SUS256_SPO0_SRVW0_SSO0_SVW2_SK3_SKXCCM8_TLDS1_ULSGRO0_USL1_UIOFGRO0_USFGRO0_VSn1_VWA2_VWB2_WSGRA0_WSGRB0_WS64_WG32_8_1_WGM6_WGMXCC1_WGMXCCGn1
    SolutionIndex: 64
    SolutionNameMin: Cijk_Alik_Bjlk_I8_BH_UserArgs_MT64x64x256_MI16x16x1_SN_LDSB1_AFC0_AFEM1_AFEM1_ASEM1_CLR1_CADS0_DTVA0_DTVB0_EPS0_FDSI0_GRPM1_GRVWA16_GRVWB16_GSU0_GSUAMB_GSUC0_GSUWGMRR0_GLS0_ISA950_IU1_K1_LBSPPA512_LBSPPB512_LBSPPM0_LPA16_LPB32_LPM0_LRVW8_LWPMn1_MIAV0_MIWT2_2_MO40_NTn1_NTA0_NTB0_NTC0_NTD0_NTM0_NEPBS0_NLCA1_NLCB1_ONLL1_PGR2_PLR2_PKA1_SIA3_SS1_SU0_SUM0_SUS256_SPO0_SRVW0_SSO0_SVW2_SK3_SKXCCM8_TLDS1_ULSGRO0_USL1_UIOFGRO0_USFGRO0_VSn1_VWA2_VWB2_WSGRA0_WSGRB0_WS64_WG32_8_1_WGM6_WGMXCC1_WGMXCCGn1
    SolutionIndex: 65
    SolutionNameMin: Cijk_Alik_Bjlk_I8_BH_UserArgs_MT64x64x256_MI16x16x1_SN_LDSB1_AFC0_AFEM1_AFEM1_ASEM1_CLR1_CADS0_DTVA0_DTVB0_EPS0_FDSI0_GRPM1_GRVWA16_GRVWB4_GSU0_GSUAMB_GSUC0_GSUWGMRR0_GLS0_ISA950_IU1_K1_LBSPPA512_LBSPPB1024_LBSPPM0_LPA32_LPB32_LPM0_LRVW16_LWPMn1_MIAV0_MIWT2_2_MO40_NTn1_NTA0_NTB0_NTC0_NTD0_NTM0_NEPBS0_NLCA1_NLCB1_ONLL1_PGR2_PLR2_PKA1_SIA3_SS1_SU0_SUM0_SUS256_SPO0_SRVW0_SSO0_SVW2_SK3_SKXCCM8_TLDS1_ULSGRO0_USL1_UIOFGRO0_USFGRO0_VSn1_VWA2_VWB2_WSGRA0_WSGRB0_WS64_WG32_8_1_WGM6_WGMXCC1_WGMXCCGn1
    SolutionIndex: 66
    SolutionNameMin: Cijk_Alik_Bjlk_I8_BH_UserArgs_MT64x64x256_MI16x16x1_SN_LDSB1_AFC0_AFEM1_AFEM1_ASEM1_CLR1_CADS0_DTVA0_DTVB0_EPS0_FDSI0_GRPM1_GRVWA4_GRVWB8_GSU0_GSUAMB_GSUC0_GSUWGMRR0_GLS0_ISA950_IU1_K1_LBSPPA512_LBSPPB1024_LBSPPM0_LPA32_LPB32_LPM0_LRVW16_LWPMn1_MIAV0_MIWT2_2_MO40_NTn1_NTA0_NTB0_NTC0_NTD0_NTM0_NEPBS0_NLCA1_NLCB1_ONLL1_PGR2_PLR2_PKA1_SIA3_SS1_SU0_SUM0_SUS256_SPO0_SRVW0_SSO0_SVW2_SK3_SKXCCM8_TLDS1_ULSGRO0_USL1_UIOFGRO0_USFGRO0_VSn1_VWA2_VWB2_WSGRA0_WSGRB0_WS64_WG32_8_1_WGM6_WGMXCC1_WGMXCCGn1
    SolutionIndex: 67
    SolutionNameMin: Cijk_Alik_Bjlk_I8_BH_UserArgs_MT64x64x256_MI16x16x1_SN_LDSB1_AFC0_AFEM1_AFEM1_ASEM1_CLR1_CADS0_DTVA0_DTVB0_EPS0_FDSI0_GRPM1_GRVWA16_GRVWB8_GSU0_GSUAMB_GSUC0_GSUWGMRR0_GLS0_ISA950_IU1_K1_LBSPPA512_LBSPPB1024_LBSPPM0_LPA32_LPB32_LPM0_LRVW16_LWPMn1_MIAV0_MIWT2_2_MO40_NTn1_NTA0_NTB0_NTC0_NTD0_NTM0_NEPBS0_NLCA1_NLCB1_ONLL1_PGR2_PLR2_PKA1_SIA3_SS1_SU0_SUM0_SUS256_SPO0_SRVW0_SSO0_SVW2_SK3_SKXCCM8_TLDS1_ULSGRO0_USL1_UIOFGRO0_USFGRO0_VSn1_VWA2_VWB2_WSGRA0_WSGRB0_WS64_WG32_8_1_WGM6_WGMXCC1_WGMXCCGn1
    SolutionIndex: 68
    SolutionNameMin: Cijk_Alik_Bjlk_I8_BH_UserArgs_MT64x64x256_MI16x16x1_SN_LDSB1_AFC0_AFEM1_AFEM1_ASEM1_CLR1_CADS0_DTVA0_DTVB0_EPS0_FDSI0_GRPM1_GRVWA4_GRVWB16_GSU0_GSUAMB_GSUC0_GSUWGMRR0_GLS0_ISA950_IU1_K1_LBSPPA512_LBSPPB1024_LBSPPM0_LPA32_LPB32_LPM0_LRVW16_LWPMn1_MIAV0_MIWT2_2_MO40_NTn1_NTA0_NTB0_NTC0_NTD0_NTM0_NEPBS0_NLCA1_NLCB1_ONLL1_PGR2_PLR2_PKA1_SIA3_SS1_SU0_SUM0_SUS256_SPO0_SRVW0_SSO0_SVW2_SK3_SKXCCM8_TLDS1_ULSGRO0_USL1_UIOFGRO0_USFGRO0_VSn1_VWA2_VWB2_WSGRA0_WSGRB0_WS64_WG32_8_1_WGM6_WGMXCC1_WGMXCCGn1
    SolutionIndex: 69
    SolutionNameMin: Cijk_Alik_Bjlk_I8_BH_UserArgs_MT64x64x256_MI16x16x1_SN_LDSB1_AFC0_AFEM1_AFEM1_ASEM1_CLR1_CADS0_DTVA0_DTVB0_EPS0_FDSI0_GRPM1_GRVWA16_GRVWB16_GSU0_GSUAMB_GSUC0_GSUWGMRR0_GLS0_ISA950_IU1_K1_LBSPPA512_LBSPPB1024_LBSPPM0_LPA32_LPB32_LPM0_LRVW16_LWPMn1_MIAV0_MIWT2_2_MO40_NTn1_NTA0_NTB0_NTC0_NTD0_NTM0_NEPBS0_NLCA1_NLCB1_ONLL1_PGR2_PLR2_PKA1_SIA3_SS1_SU0_SUM0_SUS256_SPO0_SRVW0_SSO0_SVW2_SK3_SKXCCM8_TLDS1_ULSGRO0_USL1_UIOFGRO0_USFGRO0_VSn1_VWA2_VWB2_WSGRA0_WSGRB0_WS64_WG32_8_1_WGM6_WGMXCC1_WGMXCCGn1
- - - [128, 128, 1, 128, 128, 128, 128, 128]
    - [34, 0.38]
  - - [128, 128, 1, 256, 128, 128, 256, 128]
    - [67, 0.67]
  - - [128, 128, 1, 512, 128, 128, 512, 128]
    - [31, 1.15]
  - - [128, 128, 1, 1024, 128, 128, 1024, 128]
    - [61, 1.81]
  - - [128, 128, 1, 2048, 128, 128, 2048, 128]
    - [69, 2.56]
  - - [128, 128, 1, 4096, 128, 128, 4096, 128]
    - [69, 3.22]
  - - [128, 128, 1, 8192, 128, 128, 8192, 128]
    - [68, 3.72]
  - - [128, 256, 1, 128, 128, 128, 128, 256]
    - [7, 0.72]
  - - [128, 256, 1, 256, 128, 128, 256, 256]
    - [41, 1.31]
  - - [128, 256, 1, 512, 128, 128, 512, 256]
    - [34, 2.26]
  - - [128, 256, 1, 1024, 128, 128, 1024, 256]
    - [69, 3.6]
  - - [128, 256, 1, 2048, 128, 128, 2048, 256]
    - [64, 5.02]
  - - [128, 256, 1, 4096, 128, 128, 4096, 256]
    - [68, 6.33]
  - - [128, 256, 1, 8192, 128, 128, 8192, 256]
    - [68, 7.41]
  - - [128, 512, 1, 128, 128, 128, 128, 512]
    - [42, 1.37]
  - - [128, 512, 1, 256, 128, 128, 256, 512]
    - [58, 2.58]
  - - [128, 512, 1, 512, 128, 128, 512, 512]
    - [39, 4.43]
  - - [128, 512, 1, 1024, 128, 128, 1024, 512]
    - [69, 7.12]
  - - [128, 512, 1, 2048, 128, 128, 2048, 512]
    - [69, 9.97]
  - - [128, 512, 1, 4096, 128, 128, 4096, 512]
    - [69, 12.64]
  - - [128, 512, 1, 8192, 128, 128, 8192, 512]
    - [68, 14.67]
  - - [128, 1024, 1, 128, 128, 128, 128, 1024]
    - [36, 2.7]
  - - [128, 1024, 1, 256, 128, 128, 256, 1024]
    - [66, 4.99]
  - - [128, 1024, 1, 512, 128, 128, 512, 1024]
    - [36, 8.78]
  - - [128, 1024, 1, 1024, 128, 128, 1024, 1024]
    - [64, 13.66]
  - - [128, 1024, 1, 2048, 128, 128, 2048, 1024]
    - [69, 19.28]
  - - [128, 1024, 1, 4096, 128, 128, 4096, 1024]
    - [69, 24.15]
  - - [128, 1024, 1, 8192, 128, 128, 8192, 1024]
    - [68, 27.56]
  - - [128, 2048, 1, 128, 128, 128, 128, 2048]
    - [39, 5.49]
  - - [128, 2048, 1, 256, 128, 128, 256, 2048]
    - [63, 9.95]
  - - [128, 2048, 1, 512, 128, 128, 512, 2048]
    - [32, 17.23]
  - - [128, 2048, 1, 1024, 128, 128, 1024, 2048]
    - [69, 26.68]
  - - [128, 2048, 1, 2048, 128, 128, 2048, 2048]
    - [69, 37.22]
  - - [128, 2048, 1, 4096, 128, 128, 4096, 2048]
    - [69, 47.0]
  - - [128, 2048, 1, 8192, 128, 128, 8192, 2048]
    - [68, 54.68]
  - - [128, 4096, 1, 128, 128, 128, 128, 4096]
    - [39, 11.48]
  - - [128, 4096, 1, 256, 128, 128, 256, 4096]
    - [34, 20.21]
  - - [128, 4096, 1, 512, 128, 128, 512, 4096]
    - [39, 33.56]
  - - [128, 4096, 1, 1024, 128, 128, 1024, 4096]
    - [69, 52.46]
  - - [128, 4096, 1, 2048, 128, 128, 2048, 4096]
    - [69, 73.83]
  - - [128, 4096, 1, 4096, 128, 128, 4096, 4096]
    - [69, 93.84]
  - - [128, 4096, 1, 8192, 128, 128, 8192, 4096]
    - [68, 105.05]
  - - [128, 8192, 1, 128, 128, 128, 128, 8192]
    - [43, 21.38]
  - - [128, 8192, 1, 256, 128, 128, 256, 8192]
    - [34, 37.98]
  - - [128, 8192, 1, 512, 128, 128, 512, 8192]
    - [39, 64.67]
  - - [128, 8192, 1, 1024, 128, 128, 1024, 8192]
    - [68, 99.91]
  - - [128, 8192, 1, 2048, 128, 128, 2048, 8192]
    - [69, 142.85]
  - - [128, 8192, 1, 4096, 128, 128, 4096, 8192]
    - [59, 173.78]
  - - [128, 8192, 1, 8192, 128, 128, 8192, 8192]
    - [68, 199.05]
  - - [256, 128, 1, 128, 256, 256, 128, 128]
    - [34, 0.74]
  - - [256, 128, 1, 256, 256, 256, 256, 128]
    - [33, 1.3]
  - - [256, 128, 1, 512, 256, 256, 512, 128]
    - [34, 2.24]
  - - [256, 128, 1, 1024, 256, 256, 1024, 128]
    - [69, 3.56]
  - - [256, 128, 1, 2048, 256, 256, 2048, 128]
    - [68, 5.0]
  - - [256, 128, 1, 4096, 256, 256, 4096, 128]
    - [69, 6.4]
  - - [256, 128, 1, 8192, 256, 256, 8192, 128]
    - [68, 7.39]
  - - [256, 256, 1, 128, 256, 256, 128, 256]
    - [7, 1.43]
  - - [256, 256, 1, 256, 256, 256, 256, 256]
    - [65, 2.64]
  - - [256, 256, 1, 512, 256, 256, 512, 256]
    - [34, 4.49]
  - - [256, 256, 1, 1024, 256, 256, 1024, 256]
    - [69, 7.12]
  - - [256, 256, 1, 2048, 256, 256, 2048, 256]
    - [69, 10.13]
  - - [256, 256, 1, 4096, 256, 256, 4096, 256]
    - [69, 12.95]
  - - [256, 256, 1, 8192, 256, 256, 8192, 256]
    - [69, 14.99]
  - - [256, 512, 1, 128, 256, 256, 128, 512]
    - [6, 2.79]
  - - [256, 512, 1, 256, 256, 256, 256, 512]
    - [63, 5.16]
  - - [256, 512, 1, 512, 256, 256, 512, 512]
    - [69, 8.88]
  - - [256, 512, 1, 1024, 256, 256, 1024, 512]
    - [59, 13.9]
  - - [256, 512, 1, 2048, 256, 256, 2048, 512]
    - [68, 20.04]
  - - [256, 512, 1, 4096, 256, 256, 4096, 512]
    - [69, 25.61]
  - - [256, 512, 1, 8192, 256, 256, 8192, 512]
    - [68, 29.83]
  - - [256, 1024, 1, 128, 256, 256, 128, 1024]
    - [34, 5.77]
  - - [256, 1024, 1, 256, 256, 256, 256, 1024]
    - [34, 10.29]
  - - [256, 1024, 1, 512, 256, 256, 512, 1024]
    - [69, 17.59]
  - - [256, 1024, 1, 1024, 256, 256, 1024, 1024]
    - [69, 27.39]
  - - [256, 1024, 1, 2048, 256, 256, 2048, 1024]
    - [59, 38.56]
  - - [256, 1024, 1, 4096, 256, 256, 4096, 1024]
    - [68, 49.1]
  - - [256, 1024, 1, 8192, 256, 256, 8192, 1024]
    - [68, 57.08]
  - - [256, 2048, 1, 128, 256, 256, 128, 2048]
    - [34, 11.62]
  - - [256, 2048, 1, 256, 256, 256, 256, 2048]
    - [37, 19.85]
  - - [256, 2048, 1, 512, 256, 256, 512, 2048]
    - [31, 33.8]
  - - [256, 2048, 1, 1024, 256, 256, 1024, 2048]
    - [68, 53.38]
  - - [256, 2048, 1, 2048, 256, 256, 2048, 2048]
    - [69, 75.34]
  - - [256, 2048, 1, 4096, 256, 256, 4096, 2048]
    - [69, 95.17]
  - - [256, 2048, 1, 8192, 256, 256, 8192, 2048]
    - [68, 111.99]
  - - [256, 4096, 1, 128, 256, 256, 128, 4096]
    - [8, 21.73]
  - - [256, 4096, 1, 256, 256, 256, 256, 4096]
    - [34, 38.94]
  - - [256, 4096, 1, 512, 256, 256, 512, 4096]
    - [34, 65.8]
  - - [256, 4096, 1, 1024, 256, 256, 1024, 4096]
    - [68, 103.0]
  - - [256, 4096, 1, 2048, 256, 256, 2048, 4096]
    - [68, 146.36]
  - - [256, 4096, 1, 4096, 256, 256, 4096, 4096]
    - [69, 187.36]
  - - [256, 4096, 1, 8192, 256, 256, 8192, 4096]
    - [68, 211.9]
  - - [256, 8192, 1, 128, 256, 256, 128, 8192]
    - [26, 39.43]
  - - [256, 8192, 1, 256, 256, 256, 256, 8192]
    - [21, 68.93]
  - - [256, 8192, 1, 512, 256, 256, 512, 8192]
    - [27, 115.99]
  - - [256, 8192, 1, 1024, 256, 256, 1024, 8192]
    - [24, 176.12]
  - - [256, 8192, 1, 2048, 256, 256, 2048, 8192]
    - [57, 245.47]
  - - [256, 8192, 1, 4096, 256, 256, 4096, 8192]
    - [55, 297.68]
  - - [256, 8192, 1, 8192, 256, 256, 8192, 8192]
    - [57, 340.01]
  - - [512, 128, 1, 128, 512, 512, 128, 128]
    - [34, 1.43]
  - - [512, 128, 1, 256, 512, 512, 256, 128]
    - [60, 2.62]
  - - [512, 128, 1, 512, 512, 512, 512, 128]
    - [34, 4.49]
  - - [512, 128, 1, 1024, 512, 512, 1024, 128]
    - [69, 7.23]
  - - [512, 128, 1, 2048, 512, 512, 2048, 128]
    - [69, 10.21]
  - - [512, 128, 1, 4096, 512, 512, 4096, 128]
    - [69, 12.94]
  - - [512, 128, 1, 8192, 512, 512, 8192, 128]
    - [68, 15.01]
  - - [512, 256, 1, 128, 512, 512, 128, 256]
    - [39, 2.93]
  - - [512, 256, 1, 256, 512, 512, 256, 256]
    - [31, 5.22]
  - - [512, 256, 1, 512, 512, 512, 512, 256]
    - [31, 8.93]
  - - [512, 256, 1, 1024, 512, 512, 1024, 256]
    - [69, 14.15]
  - - [512, 256, 1, 2048, 512, 512, 2048, 256]
    - [69, 20.23]
  - - [512, 256, 1, 4096, 512, 512, 4096, 256]
    - [69, 25.79]
  - - [512, 256, 1, 8192, 512, 512, 8192, 256]
    - [69, 30.16]
  - - [512, 512, 1, 128, 512, 512, 128, 512]
    - [41, 5.63]
  - - [512, 512, 1, 256, 512, 512, 256, 512]
    - [63, 10.43]
  - - [512, 512, 1, 512, 512, 512, 512, 512]
    - [69, 17.52]
  - - [512, 512, 1, 1024, 512, 512, 1024, 512]
    - [68, 27.84]
  - - [512, 512, 1, 2048, 512, 512, 2048, 512]
    - [69, 40.6]
  - - [512, 512, 1, 4096, 512, 512, 4096, 512]
    - [69, 51.11]
  - - [512, 512, 1, 8192, 512, 512, 8192, 512]
    - [69, 59.67]
  - - [512, 1024, 1, 128, 512, 512, 128, 1024]
    - [7, 10.93]
  - - [512, 1024, 1, 256, 512, 512, 256, 1024]
    - [67, 20.14]
  - - [512, 1024, 1, 512, 512, 512, 512, 1024]
    - [34, 34.43]
  - - [512, 1024, 1, 1024, 512, 512, 1024, 1024]
    - [69, 54.74]
  - - [512, 1024, 1, 2048, 512, 512, 2048, 1024]
    - [68, 77.73]
  - - [512, 1024, 1, 4096, 512, 512, 4096, 1024]
    - [68, 99.21]
  - - [512, 1024, 1, 8192, 512, 512, 8192, 1024]
    - [68, 114.77]
  - - [512, 2048, 1, 128, 512, 512, 128, 2048]
    - [40, 21.93]
  - - [512, 2048, 1, 256, 512, 512, 256, 2048]
    - [32, 39.09]
  - - [512, 2048, 1, 512, 512, 512, 512, 2048]
    - [34, 66.84]
  - - [512, 2048, 1, 1024, 512, 512, 1024, 2048]
    - [69, 104.22]
  - - [512, 2048, 1, 2048, 512, 512, 2048, 2048]
    - [69, 149.11]
  - - [512, 2048, 1, 4096, 512, 512, 4096, 2048]
    - [68, 188.6]
  - - [512, 2048, 1, 8192, 512, 512, 8192, 2048]
    - [68, 219.24]
  - - [512, 4096, 1, 128, 512, 512, 128, 4096]
    - [27, 38.7]
  - - [512, 4096, 1, 256, 512, 512, 256, 4096]
    - [25, 69.71]
  - - [512, 4096, 1, 512, 512, 512, 512, 4096]
    - [23, 116.0]
  - - [512, 4096, 1, 1024, 512, 512, 1024, 4096]
    - [28, 176.85]
  - - [512, 4096, 1, 2048, 512, 512, 2048, 4096]
    - [56, 245.57]
  - - [512, 4096, 1, 4096, 512, 512, 4096, 4096]
    - [57, 306.35]
  - - [512, 4096, 1, 8192, 512, 512, 8192, 4096]
    - [56, 349.77]
  - - [512, 8192, 1, 128, 512, 512, 128, 8192]
    - [3, 63.77]
  - - [512, 8192, 1, 256, 512, 512, 256, 8192]
    - [20, 110.75]
  - - [512, 8192, 1, 512, 512, 512, 512, 8192]
    - [19, 185.5]
  - - [512, 8192, 1, 1024, 512, 512, 1024, 8192]
    - [20, 276.63]
  - - [512, 8192, 1, 2048, 512, 512, 2048, 8192]
    - [20, 363.36]
  - - [512, 8192, 1, 4096, 512, 512, 4096, 8192]
    - [20, 435.56]
  - - [512, 8192, 1, 8192, 512, 512, 8192, 8192]
    - [54, 469.4]
  - - [1024, 128, 1, 128, 1024, 1024, 128, 128]
    - [38, 2.87]
  - - [1024, 128, 1, 256, 1024, 1024, 256, 128]
    - [69, 5.19]
  - - [1024, 128, 1, 512, 1024, 1024, 512, 128]
    - [69, 8.98]
  - - [1024, 128, 1, 1024, 1024, 1024, 1024, 128]
    - [69, 14.44]
  - - [1024, 128, 1, 2048, 1024, 1024, 2048, 128]
    - [69, 20.43]
  - - [1024, 128, 1, 4096, 1024, 1024, 4096, 128]
    - [69, 26.03]
  - - [1024, 128, 1, 8192, 1024, 1024, 8192, 128]
    - [69, 30.37]
  - - [1024, 256, 1, 128, 1024, 1024, 128, 256]
    - [39, 5.65]
  - - [1024, 256, 1, 256, 1024, 1024, 256, 256]
    - [62, 10.1]
  - - [1024, 256, 1, 512, 1024, 1024, 512, 256]
    - [69, 17.69]
  - - [1024, 256, 1, 1024, 1024, 1024, 1024, 256]
    - [68, 27.83]
  - - [1024, 256, 1, 2048, 1024, 1024, 2048, 256]
    - [69, 40.39]
  - - [1024, 256, 1, 4096, 1024, 1024, 4096, 256]
    - [69, 50.99]
  - - [1024, 256, 1, 8192, 1024, 1024, 8192, 256]
    - [69, 59.68]
  - - [1024, 512, 1, 128, 1024, 1024, 128, 512]
    - [5, 11.0]
  - - [1024, 512, 1, 256, 1024, 1024, 256, 512]
    - [60, 20.7]
  - - [1024, 512, 1, 512, 1024, 1024, 512, 512]
    - [31, 34.35]
  - - [1024, 512, 1, 1024, 1024, 1024, 1024, 512]
    - [69, 55.53]
  - - [1024, 512, 1, 2048, 1024, 1024, 2048, 512]
    - [69, 78.74]
  - - [1024, 512, 1, 4096, 1024, 1024, 4096, 512]
    - [69, 101.09]
  - - [1024, 512, 1, 8192, 1024, 1024, 8192, 512]
    - [69, 118.85]
  - - [1024, 1024, 1, 128, 1024, 1024, 128, 1024]
    - [34, 22.41]
  - - [1024, 1024, 1, 256, 1024, 1024, 256, 1024]
    - [58, 39.32]
  - - [1024, 1024, 1, 512, 1024, 1024, 512, 1024]
    - [31, 67.13]
  - - [1024, 1024, 1, 1024, 1024, 1024, 1024, 1024]
    - [68, 106.59]
  - - [1024, 1024, 1, 2048, 1024, 1024, 2048, 1024]
    - [69, 151.86]
  - - [1024, 1024, 1, 4096, 1024, 1024, 4096, 1024]
    - [69, 192.04]
  - - [1024, 1024, 1, 8192, 1024, 1024, 8192, 1024]
    - [69, 223.32]
  - - [1024, 2048, 1, 128, 1024, 1024, 128, 2048]
    - [27, 39.37]
  - - [1024, 2048, 1, 256, 1024, 1024, 256, 2048]
    - [25, 69.52]
  - - [1024, 2048, 1, 512, 1024, 1024, 512, 2048]
    - [23, 117.61]
  - - [1024, 2048, 1, 1024, 1024, 1024, 1024, 2048]
    - [28, 177.85]
  - - [1024, 2048, 1, 2048, 1024, 1024, 2048, 2048]
    - [56, 248.15]
  - - [1024, 2048, 1, 4096, 1024, 1024, 4096, 2048]
    - [56, 308.14]
  - - [1024, 2048, 1, 8192, 1024, 1024, 8192, 2048]
    - [57, 354.25]
  - - [1024, 4096, 1, 128, 1024, 1024, 128, 4096]
    - [16, 63.84]
  - - [1024, 4096, 1, 256, 1024, 1024, 256, 4096]
    - [18, 112.06]
  - - [1024, 4096, 1, 512, 1024, 1024, 512, 4096]
    - [20, 184.8]
  - - [1024, 4096, 1, 1024, 1024, 1024, 1024, 4096]
    - [20, 276.51]
  - - [1024, 4096, 1, 2048, 1024, 1024, 2048, 4096]
    - [20, 363.92]
  - - [1024, 4096, 1, 4096, 1024, 1024, 4096, 4096]
    - [19, 436.71]
  - - [1024, 4096, 1, 8192, 1024, 1024, 8192, 4096]
    - [53, 472.82]
  - - [1024, 8192, 1, 128, 1024, 1024, 128, 8192]
    - [14, 93.66]
  - - [1024, 8192, 1, 256, 1024, 1024, 256, 8192]
    - [15, 166.98]
  - - [1024, 8192, 1, 512, 1024, 1024, 512, 8192]
    - [52, 271.49]
  - - [1024, 8192, 1, 1024, 1024, 1024, 1024, 8192]
    - [50, 388.56]
  - - [1024, 8192, 1, 2048, 1024, 1024, 2048, 8192]
    - [52, 494.66]
  - - [1024, 8192, 1, 4096, 1024, 1024, 4096, 8192]
    - [50, 578.4]
  - - [1024, 8192, 1, 8192, 1024, 1024, 8192, 8192]
    - [52, 620.38]
  - - [2048, 128, 1, 128, 2048, 2048, 128, 128]
    - [35, 5.6]
  - - [2048, 128, 1, 256, 2048, 2048, 256, 128]
    - [34, 10.34]
  - - [2048, 128, 1, 512, 2048, 2048, 512, 128]
    - [34, 17.65]
  - - [2048, 128, 1, 1024, 2048, 2048, 1024, 128]
    - [69, 28.05]
  - - [2048, 128, 1, 2048, 2048, 2048, 2048, 128]
    - [69, 40.35]
  - - [2048, 128, 1, 4096, 2048, 2048, 4096, 128]
    - [69, 51.48]
  - - [2048, 128, 1, 8192, 2048, 2048, 8192, 128]
    - [69, 60.12]
  - - [2048, 256, 1, 128, 2048, 2048, 128, 256]
    - [33, 11.04]
  - - [2048, 256, 1, 256, 2048, 2048, 256, 256]
    - [65, 20.47]
  - - [2048, 256, 1, 512, 2048, 2048, 512, 256]
    - [69, 34.87]
  - - [2048, 256, 1, 1024, 2048, 2048, 1024, 256]
    - [69, 55.6]
  - - [2048, 256, 1, 2048, 2048, 2048, 2048, 256]
    - [69, 79.83]
  - - [2048, 256, 1, 4096, 2048, 2048, 4096, 256]
    - [69, 101.09]
  - - [2048, 256, 1, 8192, 2048, 2048, 8192, 256]
    - [69, 117.66]
  - - [2048, 512, 1, 128, 2048, 2048, 128, 512]
    - [38, 21.92]
  - - [2048, 512, 1, 256, 2048, 2048, 256, 512]
    - [34, 40.01]
  - - [2048, 512, 1, 512, 2048, 2048, 512, 512]
    - [59, 67.23]
  - - [2048, 512, 1, 1024, 2048, 2048, 1024, 512]
    - [69, 106.08]
  - - [2048, 512, 1, 2048, 2048, 2048, 2048, 512]
    - [69, 151.63]
  - - [2048, 512, 1, 4096, 2048, 2048, 4096, 512]
    - [69, 193.68]
  - - [2048, 512, 1, 8192, 2048, 2048, 8192, 512]
    - [69, 224.37]
  - - [2048, 1024, 1, 128, 2048, 2048, 128, 1024]
    - [27, 39.7]
  - - [2048, 1024, 1, 256, 2048, 2048, 256, 1024]
    - [21, 70.84]
  - - [2048, 1024, 1, 512, 2048, 2048, 512, 1024]
    - [24, 118.94]
  - - [2048, 1024, 1, 1024, 2048, 2048, 1024, 1024]
    - [23, 178.59]
  - - [2048, 1024, 1, 2048, 2048, 2048, 2048, 1024]
    - [56, 247.19]
  - - [2048, 1024, 1, 4096, 2048, 2048, 4096, 1024]
    - [56, 308.46]
  - - [2048, 1024, 1, 8192, 2048, 2048, 8192, 1024]
    - [56, 354.06]
  - - [2048, 2048, 1, 128, 2048, 2048, 128, 2048]
    - [16, 64.1]
  - - [2048, 2048, 1, 256, 2048, 2048, 256, 2048]
    - [20, 112.47]
  - - [2048, 2048, 1, 512, 2048, 2048, 512, 2048]
    - [19, 188.65]
  - - [2048, 2048, 1, 1024, 2048, 2048, 1024, 2048]
    - [19, 275.18]
  - - [2048, 2048, 1, 2048, 2048, 2048, 2048, 2048]
    - [19, 365.23]
  - - [2048, 2048, 1, 4096, 2048, 2048, 4096, 2048]
    - [19, 439.21]
  - - [2048, 2048, 1, 8192, 2048, 2048, 8192, 2048]
    - [20, 475.07]
  - - [2048, 4096, 1, 128, 2048, 2048, 128, 4096]
    - [48, 94.96]
  - - [2048, 4096, 1, 256, 2048, 2048, 256, 4096]
    - [15, 165.07]
  - - [2048, 4096, 1, 512, 2048, 2048, 512, 4096]
    - [48, 268.54]
  - - [2048, 4096, 1, 1024, 2048, 2048, 1024, 4096]
    - [50, 386.36]
  - - [2048, 4096, 1, 2048, 2048, 2048, 2048, 4096]
    - [52, 505.62]
  - - [2048, 4096, 1, 4096, 2048, 2048, 4096, 4096]
    - [52, 572.6]
  - - [2048, 4096, 1, 8192, 2048, 2048, 8192, 4096]
    - [50, 620.98]
  - - [2048, 8192, 1, 128, 2048, 2048, 128, 8192]
    - [10, 118.38]
  - - [2048, 8192, 1, 256, 2048, 2048, 256, 8192]
    - [13, 210.63]
  - - [2048, 8192, 1, 512, 2048, 2048, 512, 8192]
    - [13, 351.67]
  - - [2048, 8192, 1, 1024, 2048, 2048, 1024, 8192]
    - [13, 522.3]
  - - [2048, 8192, 1, 2048, 2048, 2048, 2048, 8192]
    - [46, 701.77]
  - - [2048, 8192, 1, 4096, 2048, 2048, 4096, 8192]
    - [44, 802.01]
  - - [2048, 8192, 1, 8192, 2048, 2048, 8192, 8192]
    - [46, 832.96]
  - - [4096, 128, 1, 128, 4096, 4096, 128, 128]
    - [39, 11.72]
  - - [4096, 128, 1, 256, 4096, 4096, 256, 128]
    - [34, 20.33]
  - - [4096, 128, 1, 512, 4096, 4096, 512, 128]
    - [69, 34.48]
  - - [4096, 128, 1, 1024, 4096, 4096, 1024, 128]
    - [69, 55.18]
  - - [4096, 128, 1, 2048, 4096, 4096, 2048, 128]
    - [69, 79.67]
  - - [4096, 128, 1, 4096, 4096, 4096, 4096, 128]
    - [69, 101.7]
  - - [4096, 128, 1, 8192, 4096, 4096, 8192, 128]
    - [69, 117.42]
  - - [4096, 256, 1, 128, 4096, 4096, 128, 256]
    - [31, 21.22]
  - - [4096, 256, 1, 256, 4096, 4096, 256, 256]
    - [65, 39.73]
  - - [4096, 256, 1, 512, 4096, 4096, 512, 256]
    - [64, 66.7]
  - - [4096, 256, 1, 1024, 4096, 4096, 1024, 256]
    - [69, 106.05]
  - - [4096, 256, 1, 2048, 4096, 4096, 2048, 256]
    - [64, 152.26]
  - - [4096, 256, 1, 4096, 4096, 4096, 4096, 256]
    - [64, 192.09]
  - - [4096, 256, 1, 8192, 4096, 4096, 8192, 256]
    - [69, 225.16]
  - - [4096, 512, 1, 128, 4096, 4096, 128, 512]
    - [21, 40.12]
  - - [4096, 512, 1, 256, 4096, 4096, 256, 512]
    - [21, 70.73]
  - - [4096, 512, 1, 512, 4096, 4096, 512, 512]
    - [25, 117.6]
  - - [4096, 512, 1, 1024, 4096, 4096, 1024, 512]
    - [28, 178.63]
  - - [4096, 512, 1, 2048, 4096, 4096, 2048, 512]
    - [56, 246.83]
  - - [4096, 512, 1, 4096, 4096, 4096, 4096, 512]
    - [57, 306.7]
  - - [4096, 512, 1, 8192, 4096, 4096, 8192, 512]
    - [56, 347.31]
  - - [4096, 1024, 1, 128, 4096, 4096, 128, 1024]
    - [4, 64.33]
  - - [4096, 1024, 1, 256, 4096, 4096, 256, 1024]
    - [18, 112.49]
  - - [4096, 1024, 1, 512, 4096, 4096, 512, 1024]
    - [20, 186.97]
  - - [4096, 1024, 1, 1024, 4096, 4096, 1024, 1024]
    - [20, 279.31]
  - - [4096, 1024, 1, 2048, 4096, 4096, 2048, 1024]
    - [19, 366.64]
  - - [4096, 1024, 1, 4096, 4096, 4096, 4096, 1024]
    - [20, 436.12]
  - - [4096, 1024, 1, 8192, 4096, 4096, 8192, 1024]
    - [19, 471.47]
  - - [4096, 2048, 1, 128, 4096, 4096, 128, 2048]
    - [48, 95.61]
  - - [4096, 2048, 1, 256, 4096, 4096, 256, 2048]
    - [14, 165.4]
  - - [4096, 2048, 1, 512, 4096, 4096, 512, 2048]
    - [15, 269.93]
  - - [4096, 2048, 1, 1024, 4096, 4096, 1024, 2048]
    - [47, 387.05]
  - - [4096, 2048, 1, 2048, 4096, 4096, 2048, 2048]
    - [52, 501.13]
  - - [4096, 2048, 1, 4096, 4096, 4096, 4096, 2048]
    - [50, 575.12]
  - - [4096, 2048, 1, 8192, 4096, 4096, 8192, 2048]
    - [51, 614.47]
  - - [4096, 4096, 1, 128, 4096, 4096, 128, 4096]
    - [9, 119.45]
  - - [4096, 4096, 1, 256, 4096, 4096, 256, 4096]
    - [10, 210.41]
  - - [4096, 4096, 1, 512, 4096, 4096, 512, 4096]
    - [13, 345.38]
  - - [4096, 4096, 1, 1024, 4096, 4096, 1024, 4096]
    - [13, 514.59]
  - - [4096, 4096, 1, 2048, 4096, 4096, 2048, 4096]
    - [13, 687.46]
  - - [4096, 4096, 1, 4096, 4096, 4096, 4096, 4096]
    - [46, 797.77]
  - - [4096, 4096, 1, 8192, 4096, 4096, 8192, 4096]
    - [46, 834.29]
  - - [4096, 8192, 1, 128, 4096, 4096, 128, 8192]
    - [9, 138.52]
  - - [4096, 8192, 1, 256, 4096, 4096, 256, 8192]
    - [9, 243.61]
  - - [4096, 8192, 1, 512, 4096, 4096, 512, 8192]
    - [13, 394.96]
  - - [4096, 8192, 1, 1024, 4096, 4096, 1024, 8192]
    - [13, 570.73]
  - - [4096, 8192, 1, 2048, 4096, 4096, 2048, 8192]
    - [46, 688.63]
  - - [4096, 8192, 1, 4096, 4096, 4096, 4096, 8192]
    - [46, 778.59]
  - - [4096, 8192, 1, 8192, 4096, 4096, 8192, 8192]
    - [45, 868.24]
  - - [8192, 128, 1, 128, 8192, 8192, 128, 128]
    - [30, 22.1]
  - - [8192, 128, 1, 256, 8192, 8192, 256, 128]
    - [34, 39.27]
  - - [8192, 128, 1, 512, 8192, 8192, 512, 128]
    - [34, 65.75]
  - - [8192, 128, 1, 1024, 8192, 8192, 1024, 128]
    - [68, 103.82]
  - - [8192, 128, 1, 2048, 8192, 8192, 2048, 128]
    - [69, 153.04]
  - - [8192, 128, 1, 4096, 8192, 8192, 4096, 128]
    - [69, 189.71]
  - - [8192, 128, 1, 8192, 8192, 8192, 8192, 128]
    - [69, 219.81]
  - - [8192, 256, 1, 128, 8192, 8192, 128, 256]
    - [22, 39.48]
  - - [8192, 256, 1, 256, 8192, 8192, 256, 256]
    - [21, 70.06]
  - - [8192, 256, 1, 512, 8192, 8192, 512, 256]
    - [21, 117.3]
  - - [8192, 256, 1, 1024, 8192, 8192, 1024, 256]
    - [29, 179.6]
  - - [8192, 256, 1, 2048, 8192, 8192, 2048, 256]
    - [56, 246.42]
  - - [8192, 256, 1, 4096, 8192, 8192, 4096, 256]
    - [56, 296.29]
  - - [8192, 256, 1, 8192, 8192, 8192, 8192, 256]
    - [56, 339.47]
  - - [8192, 512, 1, 128, 8192, 8192, 128, 512]
    - [17, 63.75]
  - - [8192, 512, 1, 256, 8192, 8192, 256, 512]
    - [20, 112.55]
  - - [8192, 512, 1, 512, 8192, 8192, 512, 512]
    - [20, 187.55]
  - - [8192, 512, 1, 1024, 8192, 8192, 1024, 512]
    - [19, 278.99]
  - - [8192, 512, 1, 2048, 8192, 8192, 2048, 512]
    - [20, 366.93]
  - - [8192, 512, 1, 4096, 8192, 8192, 4096, 512]
    - [20, 433.0]
  - - [8192, 512, 1, 8192, 8192, 8192, 8192, 512]
    - [20, 463.65]
  - - [8192, 1024, 1, 128, 8192, 8192, 128, 1024]
    - [15, 94.48]
  - - [8192, 1024, 1, 256, 8192, 8192, 256, 1024]
    - [2, 164.69]
  - - [8192, 1024, 1, 512, 8192, 8192, 512, 1024]
    - [15, 268.12]
  - - [8192, 1024, 1, 1024, 8192, 8192, 1024, 1024]
    - [47, 381.9]
  - - [8192, 1024, 1, 2048, 8192, 8192, 2048, 1024]
    - [52, 484.3]
  - - [8192, 1024, 1, 4096, 8192, 8192, 4096, 1024]
    - [50, 561.5]
  - - [8192, 1024, 1, 8192, 8192, 8192, 8192, 1024]
    - [49, 594.16]
  - - [8192, 2048, 1, 128, 8192, 8192, 128, 2048]
    - [0, 117.68]
  - - [8192, 2048, 1, 256, 8192, 8192, 256, 2048]
    - [13, 210.11]
  - - [8192, 2048, 1, 512, 8192, 8192, 512, 2048]
    - [13, 345.78]
  - - [8192, 2048, 1, 1024, 8192, 8192, 1024, 2048]
    - [13, 520.6]
  - - [8192, 2048, 1, 2048, 8192, 8192, 2048, 2048]
    - [13, 688.56]
  - - [8192, 2048, 1, 4096, 8192, 8192, 4096, 2048]
    - [12, 783.09]
  - - [8192, 2048, 1, 8192, 8192, 8192, 8192, 2048]
    - [46, 801.25]
  - - [8192, 4096, 1, 128, 8192, 8192, 128, 4096]
    - [1, 138.61]
  - - [8192, 4096, 1, 256, 8192, 8192, 256, 4096]
    - [13, 244.79]
  - - [8192, 4096, 1, 512, 8192, 8192, 512, 4096]
    - [13, 402.62]
  - - [8192, 4096, 1, 1024, 8192, 8192, 1024, 4096]
    - [46, 570.69]
  - - [8192, 4096, 1, 2048, 8192, 8192, 2048, 4096]
    - [45, 698.5]
  - - [8192, 4096, 1, 4096, 8192, 8192, 4096, 4096]
    - [46, 768.65]
  - - [8192, 4096, 1, 8192, 8192, 8192, 8192, 4096]
    - [46, 880.47]
  - - [8192, 8192, 1, 128, 8192, 8192, 128, 8192]
    - [10, 152.77]
  - - [8192, 8192, 1, 256, 8192, 8192, 256, 8192]
    - [11, 268.69]
  - - [8192, 8192, 1, 512, 8192, 8192, 512, 8192]
    - [13, 421.12]
  - - [8192, 8192, 1, 1024, 8192, 8192, 1024, 8192]
    - [13, 571.36]
  - - [8192, 8192, 1, 2048, 8192, 8192, 2048, 8192]
    - [46, 711.4]
  - - [8192, 8192, 1, 4096, 8192, 8192, 4096, 8192]
    - [46, 824.21]
  - - [8192, 8192, 1, 8192, 8192, 8192, 8192, 8192]
    - [45, 951.8]
- null
- null
- DeviceEfficiency
- GridBased
