library/src/amd_detail/rocblaslt/src/Tensile/Logic/asm_full/gfx950/GridBased/gfx950_Cijk_Ailk_Bljk_I8_BH_UserArgs.yaml
- {MinimumRequiredVersion: 4.33.0}
- gfx950
- gfx950
- [Device 75a0]
    SolutionIndex: 0
    SolutionNameMin: Cijk_Ailk_Bljk_I8_BH_UserArgs_MT256x256x32_MI32x32x1_SN_LDSB0_AFC0_AFEM1_AFEM1_ASEM1_CLR0_CADS0_DTVA0_DTVB0_EPS0_FDSI0_GRPM1_GRVWA4_GRVWB16_GSU0_GSUAMB_GSUC0_GSUWGMRR0_GLS0_ISA950_IU1_K1_LBSPPA0_LBSPPB128_LBSPPM0_LPA0_LPB16_LPM0_LRVW16_LWPMn1_MIAV0_MIWT4_4_MO40_NTn1_NTA0_NTB0_NTC0_NTD0_NTM0_NEPBS0_NLCA1_NLCB1_ONLL1_PGR2_PLR0_PKA1_SIA3_SS1_SU0_SUM0_SUS32_SPO0_SRVW0_SSO0_SVW4_SK3_SKXCCM8_TLDS1_ULSGRO0_USL1_UIOFGRO0_USFGRO0_VSn1_VWA4_VWB2_WSGRA0_WSGRB0_WS64_WG64_4_1_WGM6_WGMXCC1_WGMXCCGn1
    SolutionIndex: 1
    SolutionNameMin: Cijk_Ailk_Bljk_I8_BH_UserArgs_MT256x256x32_MI32x32x1_SN_LDSB0_AFC0_AFEM1_AFEM1_ASEM1_CLR0_CADS0_DTVA0_DTVB0_EPS0_FDSI0_GRPM1_GRVWA8_GRVWB16_GSU0_GSUAMB_GSUC0_GSUWGMRR0_GLS0_ISA950_IU1_K1_LBSPPA0_LBSPPB128_LBSPPM0_LPA0_LPB16_LPM0_LRVW16_LWPMn1_MIAV0_MIWT4_4_MO40_NTn1_NTA0_NTB0_NTC0_NTD0_NTM0_NEPBS0_NLCA1_NLCB1_ONLL1_PGR2_PLR0_PKA1_SIA3_SS1_SU0_SUM0_SUS32_SPO0_SRVW0_SSO0_SVW4_SK3_SKXCCM8_TLDS1_ULSGRO0_USL1_UIOFGRO0_USFGRO0_VSn1_VWA4_VWB2_WSGRA0_WSGRB0_WS64_WG64_4_1_WGM6_WGMXCC1_WGMXCCGn1
    SolutionIndex: 2
    SolutionNameMin: Cijk_Ailk_Bljk_I8_BH_UserArgs_MT256x128x64_MI16x16x1_SN_LDSB1_AFC0_AFEM1_AFEM1_ASEM1_CLR1_CADS0_DTVA0_DTVB0_EPS0_FDSI0_GRPM1_GRVWA4_GRVWB16_GSU0_GSUAMB_GSUC0_GSUWGMRR0_GLS0_ISA950_IU1_K1_LBSPPA2048_LBSPPB128_LBSPPM0_LPA0_LPB16_LPM0_LRVW8_LWPMn1_MIAV0_MIWT8_4_MO40_NTn1_NTA0_NTB0_NTC0_NTD0_NTM0_NEPBS0_NLCA1_NLCB1_ONLL1_PGR2_PLR1_PKA1_SIA3_SS1_SU0_SUM0_SUS64_SPO0_SRVW0_SSO0_SVW8_SK3_SKXCCM8_TLDS1_ULSGRO0_USL1_UIOFGRO0_USFGRO0_VSn1_VWA8_VWB2_WSGRA0_WSGRB0_WS64_WG32_8_1_WGM6_WGMXCC1_WGMXCCGn1
    SolutionIndex: 3
    SolutionNameMin: Cijk_Ailk_Bljk_I8_BH_UserArgs_MT256x128x64_MI16x16x1_SN_LDSB1_AFC0_AFEM1_AFEM1_ASEM1_CLR1_CADS0_DTVA0_DTVB0_EPS0_FDSI0_GRPM1_GRVWA4_GRVWB16_GSU0_GSUAMB_GSUC0_GSUWGMRR0_GLS0_ISA950_IU1_K1_LBSPPA2048_LBSPPB256_LBSPPM0_LPA0_LPB16_LPM0_LRVW8_LWPMn1_MIAV0_MIWT8_4_MO40_NTn1_NTA0_NTB0_NTC0_NTD0_NTM0_NEPBS0_NLCA1_NLCB1_ONLL1_PGR2_PLR1_PKA1_SIA3_SS1_SU0_SUM0_SUS64_SPO0_SRVW0_SSO0_SVW8_SK3_SKXCCM8_TLDS1_ULSGRO0_USL1_UIOFGRO0_USFGRO0_VSn1_VWA8_VWB4_WSGRA0_WSGRB0_WS64_WG32_8_1_WGM6_WGMXCC1_WGMXCCGn1
    SolutionIndex: 4
    SolutionNameMin: Cijk_Ailk_Bljk_I8_BH_UserArgs_MT128x128x64_MI16x16x1_SN_LDSB1_AFC0_AFEM1_AFEM1_ASEM1_CLR1_CADS0_DTVA0_DTVB0_EPS0_FDSI0_GRPM1_GRVWA4_GRVWB16_GSU0_GSUAMB_GSUC0_GSUWGMRR0_GLS0_ISA950_IU1_K1_LBSPPA1024_LBSPPB128_LBSPPM0_LPA64_LPB16_LPM0_LRVW8_LWPMn1_MIAV0_MIWT4_4_MO40_NTn1_NTA0_NTB0_NTC0_NTD0_NTM0_NEPBS0_NLCA1_NLCB1_ONLL1_PGR2_PLR1_PKA1_SIA3_SS1_SU0_SUM0_SUS64_SPO0_SRVW0_SSO0_SVW4_SK3_SKXCCM8_TLDS1_ULSGRO0_USL1_UIOFGRO0_USFGRO0_VSn1_VWA4_VWB2_WSGRA0_WSGRB0_WS64_WG32_8_1_WGM6_WGMXCC1_WGMXCCGn1
    SolutionIndex: 5
    SolutionNameMin: Cijk_Ailk_Bljk_I8_BH_UserArgs_MT128x128x64_MI16x16x1_SN_LDSB1_AFC0_AFEM1_AFEM1_ASEM1_CLR1_CADS0_DTVA0_DTVB0_EPS0_FDSI0_GRPM1_GRVWA4_GRVWB16_GSU0_GSUAMB_GSUC0_GSUWGMRR0_GLS0_ISA950_IU1_K1_LBSPPA1024_LBSPPB256_LBSPPM0_LPA64_LPB16_LPM0_LRVW8_LWPMn1_MIAV0_MIWT4_4_MO40_NTn1_NTA0_NTB0_NTC0_NTD0_NTM0_NEPBS0_NLCA1_NLCB1_ONLL1_PGR2_PLR1_PKA1_SIA3_SS1_SU0_SUM0_SUS64_SPO0_SRVW0_SSO0_SVW4_SK3_SKXCCM8_TLDS1_ULSGRO0_USL1_UIOFGRO0_USFGRO0_VSn1_VWA4_VWB4_WSGRA0_WSGRB0_WS64_WG32_8_1_WGM6_WGMXCC1_WGMXCCGn1
    SolutionIndex: 6
    SolutionNameMin: Cijk_Ailk_Bljk_I8_BH_UserArgs_MT128x128x64_MI16x16x1_SN_LDSB1_AFC0_AFEM1_AFEM1_ASEM1_CLR1_CADS0_DTVA0_DTVB0_EPS0_FDSI0_GRPM1_GRVWA4_GRVWB16_GSU0_GSUAMB_GSUC0_GSUWGMRR0_GLS0_ISA950_IU1_K1_LBSPPA2048_LBSPPB256_LBSPPM0_LPA64_LPB32_LPM0_LRVW16_LWPMn1_MIAV0_MIWT4_4_MO40_NTn1_NTA0_NTB0_NTC0_NTD0_NTM0_NEPBS0_NLCA1_NLCB1_ONLL1_PGR2_PLR1_PKA1_SIA3_SS1_SU0_SUM0_SUS64_SPO0_SRVW0_SSO0_SVW4_SK3_SKXCCM8_TLDS1_ULSGRO0_USL1_UIOFGRO0_USFGRO0_VSn1_VWA4_VWB4_WSGRA0_WSGRB0_WS64_WG32_8_1_WGM6_WGMXCC1_WGMXCCGn1
    SolutionIndex: 7
    SolutionNameMin: Cijk_Ailk_Bljk_I8_BH_UserArgs_MT64x64x64_MI16x16x1_SN_LDSB0_AFC0_AFEM1_AFEM1_ASEM1_CLR1_CADS0_DTVA0_DTVB0_EPS0_FDSI0_GRPM1_GRVWA4_GRVWB4_GSU0_GSUAMB_GSUC0_GSUWGMRR0_GLS0_ISA950_IU1_K1_LBSPPA512_LBSPPB128_LBSPPM0_LPA32_LPB8_LPM0_LRVW8_LWPMn1_MIAV0_MIWT2_2_MO40_NTn1_NTA0_NTB0_NTC0_NTD0_NTM0_NEPBS0_NLCA1_NLCB1_ONLL1_PGR2_PLR1_PKA1_SIA3_SS1_SU0_SUM0_SUS64_SPO0_SRVW0_SSO0_SVW2_SK3_SKXCCM8_TLDS1_ULSGRO0_USL1_UIOFGRO0_USFGRO0_VSn1_VWA2_VWB2_WSGRA0_WSGRB0_WS64_WG32_8_1_WGM6_WGMXCC1_WGMXCCGn1
    SolutionIndex: 8
    SolutionNameMin: Cijk_Ailk_Bljk_I8_BH_UserArgs_MT64x64x64_MI16x16x1_SN_LDSB0_AFC0_AFEM1_AFEM1_ASEM1_CLR1_CADS0_DTVA0_DTVB0_EPS0_FDSI0_GRPM1_GRVWA4_GRVWB8_GSU0_GSUAMB_GSUC0_GSUWGMRR0_GLS0_ISA950_IU1_K1_LBSPPA512_LBSPPB128_LBSPPM0_LPA32_LPB8_LPM0_LRVW8_LWPMn1_MIAV0_MIWT2_2_MO40_NTn1_NTA0_NTB0_NTC0_NTD0_NTM0_NEPBS0_NLCA1_NLCB1_ONLL1_PGR2_PLR1_PKA1_SIA3_SS1_SU0_SUM0_SUS64_SPO0_SRVW0_SSO0_SVW2_SK3_SKXCCM8_TLDS1_ULSGRO0_USL1_UIOFGRO0_USFGRO0_VSn1_VWA2_VWB2_WSGRA0_WSGRB0_WS64_WG32_8_1_WGM6_WGMXCC1_WGMXCCGn1
    SolutionIndex: 9
    SolutionNameMin: Cijk_Ailk_Bljk_I8_BH_UserArgs_MT64x64x64_MI16x16x1_SN_LDSB0_AFC0_AFEM1_AFEM1_ASEM1_CLR1_CADS0_DTVA0_DTVB0_EPS0_FDSI0_GRPM1_GRVWA4_GRVWB16_GSU0_GSUAMB_GSUC0_GSUWGMRR0_GLS0_ISA950_IU1_K1_LBSPPA512_LBSPPB128_LBSPPM0_LPA32_LPB16_LPM0_LRVW8_LWPMn1_MIAV0_MIWT2_2_MO40_NTn1_NTA0_NTB0_NTC0_NTD0_NTM0_NEPBS0_NLCA1_NLCB1_ONLL1_PGR2_PLR1_PKA1_SIA3_SS1_SU0_SUM0_SUS64_SPO0_SRVW0_SSO0_SVW2_SK3_SKXCCM8_TLDS1_ULSGRO0_USL1_UIOFGRO0_USFGRO0_VSn1_VWA2_VWB2_WSGRA0_WSGRB0_WS64_WG32_8_1_WGM6_WGMXCC1_WGMXCCGn1
    SolutionIndex: 10
    SolutionNameMin: Cijk_Ailk_Bljk_I8_BH_UserArgs_MT64x64x64_MI16x16x1_SN_LDSB0_AFC0_AFEM1_AFEM1_ASEM1_CLR1_CADS0_DTVA0_DTVB0_EPS0_FDSI0_GRPM1_GRVWA4_GRVWB8_GSU0_GSUAMB_GSUC0_GSUWGMRR0_GLS0_ISA950_IU1_K1_LBSPPA1024_LBSPPB128_LBSPPM0_LPA32_LPB32_LPM0_LRVW16_LWPMn1_MIAV0_MIWT2_2_MO40_NTn1_NTA0_NTB0_NTC0_NTD0_NTM0_NEPBS0_NLCA1_NLCB1_ONLL1_PGR2_PLR1_PKA1_SIA3_SS1_SU0_SUM0_SUS64_SPO0_SRVW0_SSO0_SVW2_SK3_SKXCCM8_TLDS1_ULSGRO0_USL1_UIOFGRO0_USFGRO0_VSn1_VWA2_VWB2_WSGRA0_WSGRB0_WS64_WG32_8_1_WGM6_WGMXCC1_WGMXCCGn1
    SolutionIndex: 11
    SolutionNameMin: Cijk_Ailk_Bljk_I8_BH_UserArgs_MT64x64x64_MI16x16x1_SN_LDSB0_AFC0_AFEM1_AFEM1_ASEM1_CLR0_CADS0_DTVA0_DTVB0_EPS0_FDSI0_GRPM1_GRVWA4_GRVWB16_GSU0_GSUAMB_GSUC0_GSUWGMRR0_GLS0_ISA950_IU1_K1_LBSPPA512_LBSPPB128_LBSPPM0_LPA32_LPB16_LPM0_LRVW8_LWPMn1_MIAV0_MIWT2_2_MO40_NTn1_NTA0_NTB0_NTC0_NTD0_NTM0_NEPBS0_NLCA1_NLCB1_ONLL1_PGR2_PLR0_PKA1_SIA3_SS1_SU0_SUM0_SUS64_SPO0_SRVW0_SSO0_SVW2_SK3_SKXCCM8_TLDS1_ULSGRO0_USL1_UIOFGRO0_USFGRO0_VSn1_VWA2_VWB2_WSGRA0_WSGRB0_WS64_WG32_8_1_WGM6_WGMXCC1_WGMXCCGn1
    SolutionIndex: 12
    SolutionNameMin: Cijk_Ailk_Bljk_I8_BH_UserArgs_MT512x128x64_MI32x32x1_SN_LDSB0_AFC0_AFEM1_AFEM1_ASEM1_CLR1_CADS0_DTVA0_DTVB0_EPS0_FDSI0_GRPM1_GRVWA16_GRVWB16_GSU0_GSUAMB_GSUC0_GSUWGMRR0_GLS0_ISA950_IU1_K1_LBSPPA0_LBSPPB128_LBSPPM0_LPA0_LPB16_LPM0_LRVW16_LWPMn1_MIAV0_MIWT8_2_MO40_NTn1_NTA0_NTB0_NTC0_NTD0_NTM0_NEPBS0_NLCA1_NLCB1_ONLL1_PGR2_PLR1_PKA1_SIA3_SS1_SU0_SUM0_SUS64_SPO0_SRVW0_SSO0_SVW8_SK3_SKXCCM8_TLDS1_ULSGRO0_USL1_UIOFGRO0_USFGRO0_VSn1_VWA8_VWB2_WSGRA0_WSGRB0_WS64_WG64_4_1_WGM6_WGMXCC1_WGMXCCGn1
    SolutionIndex: 13
    SolutionNameMin: Cijk_Ailk_Bljk_I8_BH_UserArgs_MT256x256x64_MI32x32x1_SN_LDSB0_AFC0_AFEM1_AFEM1_ASEM1_CLR1_CADS0_DTVA0_DTVB0_EPS0_FDSI0_GRPM1_GRVWA4_GRVWB16_GSU0_GSUAMB_GSUC0_GSUWGMRR0_GLS0_ISA950_IU1_K1_LBSPPA0_LBSPPB128_LBSPPM0_LPA0_LPB16_LPM0_LRVW16_LWPMn1_MIAV0_MIWT4_4_MO40_NTn1_NTA0_NTB0_NTC0_NTD0_NTM0_NEPBS0_NLCA1_NLCB1_ONLL1_PGR2_PLR1_PKA1_SIA3_SS1_SU0_SUM0_SUS64_SPO0_SRVW0_SSO0_SVW4_SK3_SKXCCM8_TLDS1_ULSGRO0_USL1_UIOFGRO0_USFGRO0_VSn1_VWA4_VWB2_WSGRA0_WSGRB0_WS64_WG64_4_1_WGM6_WGMXCC1_WGMXCCGn1
    SolutionIndex: 14
    SolutionNameMin: Cijk_Ailk_Bljk_I8_BH_UserArgs_MT256x256x64_MI32x32x1_SN_LDSB0_AFC0_AFEM1_AFEM1_ASEM1_CLR1_CADS0_DTVA0_DTVB0_EPS0_FDSI0_GRPM1_GRVWA4_GRVWB16_GSU0_GSUAMB_GSUC0_GSUWGMRR0_GLS0_ISA950_IU1_K1_LBSPPA0_LBSPPB256_LBSPPM0_LPA0_LPB16_LPM0_LRVW16_LWPMn1_MIAV0_MIWT4_4_MO40_NTn1_NTA0_NTB0_NTC0_NTD0_NTM0_NEPBS0_NLCA1_NLCB1_ONLL1_PGR2_PLR1_PKA1_SIA3_SS1_SU0_SUM0_SUS64_SPO0_SRVW0_SSO0_SVW4_SK3_SKXCCM8_TLDS1_ULSGRO0_USL1_UIOFGRO0_USFGRO0_VSn1_VWA4_VWB4_WSGRA0_WSGRB0_WS64_WG64_4_1_WGM6_WGMXCC1_WGMXCCGn1
    SolutionIndex: 15
    SolutionNameMin: Cijk_Ailk_Bljk_I8_BH_UserArgs_MT256x256x64_MI32x32x1_SN_LDSB0_AFC0_AFEM1_AFEM1_ASEM1_CLR1_CADS0_DTVA0_DTVB0_EPS0_FDSI0_GRPM1_GRVWA8_GRVWB16_GSU0_GSUAMB_GSUC0_GSUWGMRR0_GLS0_ISA950_IU1_K1_LBSPPA0_LBSPPB128_LBSPPM0_LPA0_LPB16_LPM0_LRVW16_LWPMn1_MIAV0_MIWT4_4_MO40_NTn1_NTA0_NTB0_NTC0_NTD0_NTM0_NEPBS0_NLCA1_NLCB1_ONLL1_PGR2_PLR1_PKA1_SIA3_SS1_SU0_SUM0_SUS64_SPO0_SRVW0_SSO0_SVW4_SK3_SKXCCM8_TLDS1_ULSGRO0_USL1_UIOFGRO0_USFGRO0_VSn1_VWA4_VWB2_WSGRA0_WSGRB0_WS64_WG64_4_1_WGM6_WGMXCC1_WGMXCCGn1
    SolutionIndex: 16
    SolutionNameMin: Cijk_Ailk_Bljk_I8_BH_UserArgs_MT256x256x64_MI32x32x1_SN_LDSB0_AFC0_AFEM1_AFEM1_ASEM1_CLR1_CADS0_DTVA0_DTVB0_EPS0_FDSI0_GRPM1_GRVWA8_GRVWB16_GSU0_GSUAMB_GSUC0_GSUWGMRR0_GLS0_ISA950_IU1_K1_LBSPPA0_LBSPPB256_LBSPPM0_LPA0_LPB16_LPM0_LRVW16_LWPMn1_MIAV0_MIWT4_4_MO40_NTn1_NTA0_NTB0_NTC0_NTD0_NTM0_NEPBS0_NLCA1_NLCB1_ONLL1_PGR2_PLR1_PKA1_SIA3_SS1_SU0_SUM0_SUS64_SPO0_SRVW0_SSO0_SVW4_SK3_SKXCCM8_TLDS1_ULSGRO0_USL1_UIOFGRO0_USFGRO0_VSn1_VWA4_VWB4_WSGRA0_WSGRB0_WS64_WG64_4_1_WGM6_WGMXCC1_WGMXCCGn1
    SolutionIndex: 17
    SolutionNameMin: Cijk_Ailk_Bljk_I8_BH_UserArgs_MT256x256x64_MI32x32x1_SN_LDSB0_AFC0_AFEM1_AFEM1_ASEM1_CLR1_CADS0_DTVA0_DTVB0_EPS0_FDSI0_GRPM1_GRVWA16_GRVWB16_GSU0_GSUAMB_GSUC0_GSUWGMRR0_GLS0_ISA950_IU1_K1_LBSPPA0_LBSPPB128_LBSPPM0_LPA0_LPB16_LPM0_LRVW16_LWPMn1_MIAV0_MIWT4_4_MO40_NTn1_NTA0_NTB0_NTC0_NTD0_NTM0_NEPBS0_NLCA1_NLCB1_ONLL1_PGR2_PLR1_PKA1_SIA3_SS1_SU0_SUM0_SUS64_SPO0_SRVW0_SSO0_SVW4_SK3_SKXCCM8_TLDS1_ULSGRO0_USL1_UIOFGRO0_USFGRO0_VSn1_VWA4_VWB2_WSGRA0_WSGRB0_WS64_WG64_4_1_WGM6_WGMXCC1_WGMXCCGn1
    SolutionIndex: 18
    SolutionNameMin: Cijk_Ailk_Bljk_I8_BH_UserArgs_MT256x256x64_MI32x32x1_SN_LDSB0_AFC0_AFEM1_AFEM1_ASEM1_CLR1_CADS0_DTVA0_DTVB0_EPS0_FDSI0_GRPM1_GRVWA16_GRVWB16_GSU0_GSUAMB_GSUC0_GSUWGMRR0_GLS0_ISA950_IU1_K1_LBSPPA0_LBSPPB256_LBSPPM0_LPA0_LPB16_LPM0_LRVW16_LWPMn1_MIAV0_MIWT4_4_MO40_NTn1_NTA0_NTB0_NTC0_NTD0_NTM0_NEPBS0_NLCA1_NLCB1_ONLL1_PGR2_PLR1_PKA1_SIA3_SS1_SU0_SUM0_SUS64_SPO0_SRVW0_SSO0_SVW4_SK3_SKXCCM8_TLDS1_ULSGRO0_USL1_UIOFGRO0_USFGRO0_VSn1_VWA4_VWB4_WSGRA0_WSGRB0_WS64_WG64_4_1_WGM6_WGMXCC1_WGMXCCGn1
    SolutionIndex: 19
    SolutionNameMin: Cijk_Ailk_Bljk_I8_BH_UserArgs_MT128x256x64_MI32x32x1_SN_LDSB1_AFC0_AFEM1_AFEM1_ASEM1_CLR1_CADS0_DTVA0_DTVB0_EPS0_FDSI0_GRPM1_GRVWA16_GRVWB16_GSU0_GSUAMB_GSUC0_GSUWGMRR0_GLS0_ISA950_IU1_K1_LBSPPA0_LBSPPB128_LBSPPM0_LPA0_LPB16_LPM0_LRVW16_LWPMn1_MIAV0_MIWT2_4_MO40_NTn1_NTA0_NTB0_NTC0_NTD0_NTM0_NEPBS0_NLCA1_NLCB1_ONLL1_PGR2_PLR1_PKA1_SIA3_SS1_SU0_SUM0_SUS64_SPO0_SRVW0_SSO0_SVW2_SK3_SKXCCM8_TLDS1_ULSGRO0_USL1_UIOFGRO0_USFGRO0_VSn1_VWA2_VWB2_WSGRA0_WSGRB0_WS64_WG64_4_1_WGM6_WGMXCC1_WGMXCCGn1
    SolutionIndex: 20
    SolutionNameMin: Cijk_Ailk_Bljk_I8_BH_UserArgs_MT128x256x64_MI32x32x1_SN_LDSB1_AFC0_AFEM1_AFEM1_ASEM1_CLR1_CADS0_DTVA0_DTVB0_EPS0_FDSI0_GRPM1_GRVWA16_GRVWB16_GSU0_GSUAMB_GSUC0_GSUWGMRR0_GLS0_ISA950_IU1_K1_LBSPPA0_LBSPPB256_LBSPPM0_LPA0_LPB16_LPM0_LRVW16_LWPMn1_MIAV0_MIWT2_4_MO40_NTn1_NTA0_NTB0_NTC0_NTD0_NTM0_NEPBS0_NLCA1_NLCB1_ONLL1_PGR2_PLR1_PKA1_SIA3_SS1_SU0_SUM0_SUS64_SPO0_SRVW0_SSO0_SVW2_SK3_SKXCCM8_TLDS1_ULSGRO0_USL1_UIOFGRO0_USFGRO0_VSn1_VWA2_VWB4_WSGRA0_WSGRB0_WS64_WG64_4_1_WGM6_WGMXCC1_WGMXCCGn1
    SolutionIndex: 21
    SolutionNameMin: Cijk_Ailk_Bljk_I8_BH_UserArgs_MT256x128x64_MI32x32x1_SN_LDSB1_AFC0_AFEM1_AFEM1_ASEM1_CLR1_CADS0_DTVA0_DTVB0_EPS0_FDSI0_GRPM1_GRVWA4_GRVWB16_GSU0_GSUAMB_GSUC0_GSUWGMRR0_GLS0_ISA950_IU1_K1_LBSPPA0_LBSPPB128_LBSPPM0_LPA0_LPB16_LPM0_LRVW16_LWPMn1_MIAV0_MIWT4_2_MO40_NTn1_NTA0_NTB0_NTC0_NTD0_NTM0_NEPBS0_NLCA1_NLCB1_ONLL1_PGR2_PLR1_PKA1_SIA3_SS1_SU0_SUM0_SUS64_SPO0_SRVW0_SSO0_SVW4_SK3_SKXCCM8_TLDS1_ULSGRO0_USL1_UIOFGRO0_USFGRO0_VSn1_VWA4_VWB2_WSGRA0_WSGRB0_WS64_WG64_4_1_WGM6_WGMXCC1_WGMXCCGn1
    SolutionIndex: 22
    SolutionNameMin: Cijk_Ailk_Bljk_I8_BH_UserArgs_MT256x128x64_MI32x32x1_SN_LDSB1_AFC0_AFEM1_AFEM1_ASEM1_CLR1_CADS0_DTVA0_DTVB0_EPS0_FDSI0_GRPM1_GRVWA16_GRVWB16_GSU0_GSUAMB_GSUC0_GSUWGMRR0_GLS0_ISA950_IU1_K1_LBSPPA0_LBSPPB128_LBSPPM0_LPA0_LPB16_LPM0_LRVW16_LWPMn1_MIAV0_MIWT4_2_MO40_NTn1_NTA0_NTB0_NTC0_NTD0_NTM0_NEPBS0_NLCA1_NLCB1_ONLL1_PGR2_PLR1_PKA1_SIA3_SS1_SU0_SUM0_SUS64_SPO0_SRVW0_SSO0_SVW4_SK3_SKXCCM8_TLDS1_ULSGRO0_USL1_UIOFGRO0_USFGRO0_VSn1_VWA4_VWB2_WSGRA0_WSGRB0_WS64_WG64_4_1_WGM6_WGMXCC1_WGMXCCGn1
    SolutionIndex: 23
    SolutionNameMin: Cijk_Ailk_Bljk_I8_BH_UserArgs_MT128x128x128_MI16x16x1_SN_LDSB1_AFC0_AFEM1_AFEM1_ASEM1_CLR1_CADS0_DTVA0_DTVB0_EPS0_FDSI0_GRPM1_GRVWA4_GRVWB16_GSU0_GSUAMB_GSUC0_GSUWGMRR0_GLS0_ISA950_IU1_K1_LBSPPA1024_LBSPPB512_LBSPPM0_LPA64_LPB16_LPM0_LRVW8_LWPMn1_MIAV0_MIWT4_4_MO40_NTn1_NTA0_NTB0_NTC0_NTD0_NTM0_NEPBS0_NLCA1_NLCB1_ONLL1_PGR2_PLR1_PKA1_SIA3_SS1_SU0_SUM0_SUS128_SPO0_SRVW0_SSO0_SVW4_SK3_SKXCCM8_TLDS1_ULSGRO0_USL1_UIOFGRO0_USFGRO0_VSn1_VWA4_VWB4_WSGRA0_WSGRB0_WS64_WG32_8_1_WGM6_WGMXCC1_WGMXCCGn1
    SolutionIndex: 24
    SolutionNameMin: Cijk_Ailk_Bljk_I8_BH_UserArgs_MT128x128x128_MI16x16x1_SN_LDSB1_AFC0_AFEM1_AFEM1_ASEM1_CLR1_CADS0_DTVA0_DTVB0_EPS0_FDSI0_GRPM1_GRVWA4_GRVWB16_GSU0_GSUAMB_GSUC0_GSUWGMRR0_GLS0_ISA950_IU1_K1_LBSPPA2048_LBSPPB256_LBSPPM0_LPA64_LPB32_LPM0_LRVW16_LWPMn1_MIAV0_MIWT4_4_MO40_NTn1_NTA0_NTB0_NTC0_NTD0_NTM0_NEPBS0_NLCA1_NLCB1_ONLL1_PGR2_PLR1_PKA1_SIA3_SS1_SU0_SUM0_SUS128_SPO0_SRVW0_SSO0_SVW4_SK3_SKXCCM8_TLDS1_ULSGRO0_USL1_UIOFGRO0_USFGRO0_VSn1_VWA4_VWB2_WSGRA0_WSGRB0_WS64_WG32_8_1_WGM6_WGMXCC1_WGMXCCGn1
    SolutionIndex: 25
    SolutionNameMin: Cijk_Ailk_Bljk_I8_BH_UserArgs_MT128x128x128_MI16x16x1_SN_LDSB1_AFC0_AFEM1_AFEM1_ASEM1_CLR1_CADS0_DTVA0_DTVB0_EPS0_FDSI0_GRPM1_GRVWA16_GRVWB16_GSU0_GSUAMB_GSUC0_GSUWGMRR0_GLS0_ISA950_IU1_K1_LBSPPA2048_LBSPPB256_LBSPPM0_LPA64_LPB32_LPM0_LRVW16_LWPMn1_MIAV0_MIWT4_4_MO40_NTn1_NTA0_NTB0_NTC0_NTD0_NTM0_NEPBS0_NLCA1_NLCB1_ONLL1_PGR2_PLR1_PKA1_SIA3_SS1_SU0_SUM0_SUS128_SPO0_SRVW0_SSO0_SVW4_SK3_SKXCCM8_TLDS1_ULSGRO0_USL1_UIOFGRO0_USFGRO0_VSn1_VWA4_VWB2_WSGRA0_WSGRB0_WS64_WG32_8_1_WGM6_WGMXCC1_WGMXCCGn1
    SolutionIndex: 26
    SolutionNameMin: Cijk_Ailk_Bljk_I8_BH_UserArgs_MT128x128x128_MI16x16x1_SN_LDSB1_AFC0_AFEM1_AFEM1_ASEM1_CLR1_CADS0_DTVA0_DTVB0_EPS0_FDSI0_GRPM1_GRVWA16_GRVWB16_GSU0_GSUAMB_GSUC0_GSUWGMRR0_GLS0_ISA950_IU1_K1_LBSPPA2048_LBSPPB512_LBSPPM0_LPA64_LPB32_LPM0_LRVW16_LWPMn1_MIAV0_MIWT4_4_MO40_NTn1_NTA0_NTB0_NTC0_NTD0_NTM0_NEPBS0_NLCA1_NLCB1_ONLL1_PGR2_PLR1_PKA1_SIA3_SS1_SU0_SUM0_SUS128_SPO0_SRVW0_SSO0_SVW4_SK3_SKXCCM8_TLDS1_ULSGRO0_USL1_UIOFGRO0_USFGRO0_VSn1_VWA4_VWB4_WSGRA0_WSGRB0_WS64_WG32_8_1_WGM6_WGMXCC1_WGMXCCGn1
    SolutionIndex: 27
    SolutionNameMin: Cijk_Ailk_Bljk_I8_BH_UserArgs_MT64x128x128_MI16x16x1_SN_LDSB1_AFC0_AFEM1_AFEM1_ASEM1_CLR1_CADS0_DTVA0_DTVB0_EPS0_FDSI0_GRPM1_GRVWA4_GRVWB16_GSU0_GSUAMB_GSUC0_GSUWGMRR0_GLS0_ISA950_IU1_K1_LBSPPA512_LBSPPB256_LBSPPM0_LPA32_LPB16_LPM0_LRVW8_LWPMn1_MIAV0_MIWT2_4_MO40_NTn1_NTA0_NTB0_NTC0_NTD0_NTM0_NEPBS0_NLCA1_NLCB1_ONLL1_PGR2_PLR1_PKA1_SIA3_SS1_SU0_SUM0_SUS128_SPO0_SRVW0_SSO0_SVW2_SK3_SKXCCM8_TLDS1_ULSGRO0_USL1_UIOFGRO0_USFGRO0_VSn1_VWA2_VWB2_WSGRA0_WSGRB0_WS64_WG32_8_1_WGM6_WGMXCC1_WGMXCCGn1
    SolutionIndex: 28
    SolutionNameMin: Cijk_Ailk_Bljk_I8_BH_UserArgs_MT64x128x128_MI16x16x1_SN_LDSB1_AFC0_AFEM1_AFEM1_ASEM1_CLR1_CADS0_DTVA0_DTVB0_EPS0_FDSI0_GRPM1_GRVWA4_GRVWB16_GSU0_GSUAMB_GSUC0_GSUWGMRR0_GLS0_ISA950_IU1_K1_LBSPPA512_LBSPPB512_LBSPPM0_LPA32_LPB16_LPM0_LRVW8_LWPMn1_MIAV0_MIWT2_4_MO40_NTn1_NTA0_NTB0_NTC0_NTD0_NTM0_NEPBS0_NLCA1_NLCB1_ONLL1_PGR2_PLR1_PKA1_SIA3_SS1_SU0_SUM0_SUS128_SPO0_SRVW0_SSO0_SVW2_SK3_SKXCCM8_TLDS1_ULSGRO0_USL1_UIOFGRO0_USFGRO0_VSn1_VWA2_VWB4_WSGRA0_WSGRB0_WS64_WG32_8_1_WGM6_WGMXCC1_WGMXCCGn1
    SolutionIndex: 29
    SolutionNameMin: Cijk_Ailk_Bljk_I8_BH_UserArgs_MT64x128x128_MI16x16x1_SN_LDSB1_AFC0_AFEM1_AFEM1_ASEM1_CLR1_CADS0_DTVA0_DTVB0_EPS0_FDSI0_GRPM1_GRVWA8_GRVWB16_GSU0_GSUAMB_GSUC0_GSUWGMRR0_GLS0_ISA950_IU1_K1_LBSPPA512_LBSPPB512_LBSPPM0_LPA32_LPB16_LPM0_LRVW8_LWPMn1_MIAV0_MIWT2_4_MO40_NTn1_NTA0_NTB0_NTC0_NTD0_NTM0_NEPBS0_NLCA1_NLCB1_ONLL1_PGR2_PLR1_PKA1_SIA3_SS1_SU0_SUM0_SUS128_SPO0_SRVW0_SSO0_SVW2_SK3_SKXCCM8_TLDS1_ULSGRO0_USL1_UIOFGRO0_USFGRO0_VSn1_VWA2_VWB4_WSGRA0_WSGRB0_WS64_WG32_8_1_WGM6_WGMXCC1_WGMXCCGn1
    SolutionIndex: 30
    SolutionNameMin: Cijk_Ailk_Bljk_I8_BH_UserArgs_MT64x128x128_MI16x16x1_SN_LDSB1_AFC0_AFEM1_AFEM1_ASEM1_CLR1_CADS0_DTVA0_DTVB0_EPS0_FDSI0_GRPM1_GRVWA16_GRVWB16_GSU0_GSUAMB_GSUC0_GSUWGMRR0_GLS0_ISA950_IU1_K1_LBSPPA512_LBSPPB512_LBSPPM0_LPA32_LPB16_LPM0_LRVW8_LWPMn1_MIAV0_MIWT2_4_MO40_NTn1_NTA0_NTB0_NTC0_NTD0_NTM0_NEPBS0_NLCA1_NLCB1_ONLL1_PGR2_PLR1_PKA1_SIA3_SS1_SU0_SUM0_SUS128_SPO0_SRVW0_SSO0_SVW2_SK3_SKXCCM8_TLDS1_ULSGRO0_USL1_UIOFGRO0_USFGRO0_VSn1_VWA2_VWB4_WSGRA0_WSGRB0_WS64_WG32_8_1_WGM6_WGMXCC1_WGMXCCGn1
    SolutionIndex: 31
    SolutionNameMin: Cijk_Ailk_Bljk_I8_BH_UserArgs_MT64x128x128_MI16x16x1_SN_LDSB1_AFC0_AFEM1_AFEM1_ASEM1_CLR1_CADS0_DTVA0_DTVB0_EPS0_FDSI0_GRPM1_GRVWA4_GRVWB16_GSU0_GSUAMB_GSUC0_GSUWGMRR0_GLS0_ISA950_IU1_K1_LBSPPA1024_LBSPPB256_LBSPPM0_LPA32_LPB32_LPM0_LRVW16_LWPMn1_MIAV0_MIWT2_4_MO40_NTn1_NTA0_NTB0_NTC0_NTD0_NTM0_NEPBS0_NLCA1_NLCB1_ONLL1_PGR2_PLR1_PKA1_SIA3_SS1_SU0_SUM0_SUS128_SPO0_SRVW0_SSO0_SVW2_SK3_SKXCCM8_TLDS1_ULSGRO0_USL1_UIOFGRO0_USFGRO0_VSn1_VWA2_VWB2_WSGRA0_WSGRB0_WS64_WG32_8_1_WGM6_WGMXCC1_WGMXCCGn1
    SolutionIndex: 32
    SolutionNameMin: Cijk_Ailk_Bljk_I8_BH_UserArgs_MT64x128x128_MI16x16x1_SN_LDSB1_AFC0_AFEM1_AFEM1_ASEM1_CLR1_CADS0_DTVA0_DTVB0_EPS0_FDSI0_GRPM1_GRVWA4_GRVWB16_GSU0_GSUAMB_GSUC0_GSUWGMRR0_GLS0_ISA950_IU1_K1_LBSPPA1024_LBSPPB512_LBSPPM0_LPA32_LPB32_LPM0_LRVW16_LWPMn1_MIAV0_MIWT2_4_MO40_NTn1_NTA0_NTB0_NTC0_NTD0_NTM0_NEPBS0_NLCA1_NLCB1_ONLL1_PGR2_PLR1_PKA1_SIA3_SS1_SU0_SUM0_SUS128_SPO0_SRVW0_SSO0_SVW2_SK3_SKXCCM8_TLDS1_ULSGRO0_USL1_UIOFGRO0_USFGRO0_VSn1_VWA2_VWB4_WSGRA0_WSGRB0_WS64_WG32_8_1_WGM6_WGMXCC1_WGMXCCGn1
    SolutionIndex: 33
    SolutionNameMin: Cijk_Ailk_Bljk_I8_BH_UserArgs_MT64x128x128_MI16x16x1_SN_LDSB1_AFC0_AFEM1_AFEM1_ASEM1_CLR1_CADS0_DTVA0_DTVB0_EPS0_FDSI0_GRPM1_GRVWA4_GRVWB16_GSU0_GSUAMB_GSUC0_GSUWGMRR0_GLS0_ISA950_IU1_K1_LBSPPA512_LBSPPB256_LBSPPM0_LPA32_LPB16_LPM0_LRVW8_LWPMn1_MIAV0_MIWT2_4_MO40_NTn1_NTA0_NTB0_NTC0_NTD0_NTM0_NEPBS0_NLCA1_NLCB1_ONLL1_PGR2_PLR2_PKA1_SIA3_SS1_SU0_SUM0_SUS128_SPO0_SRVW0_SSO0_SVW2_SK3_SKXCCM8_TLDS1_ULSGRO0_USL1_UIOFGRO0_USFGRO0_VSn1_VWA2_VWB2_WSGRA0_WSGRB0_WS64_WG32_8_1_WGM6_WGMXCC1_WGMXCCGn1
    SolutionIndex: 34
    SolutionNameMin: Cijk_Ailk_Bljk_I8_BH_UserArgs_MT64x128x128_MI16x16x1_SN_LDSB1_AFC0_AFEM1_AFEM1_ASEM1_CLR1_CADS0_DTVA0_DTVB0_EPS0_FDSI0_GRPM1_GRVWA4_GRVWB16_GSU0_GSUAMB_GSUC0_GSUWGMRR0_GLS0_ISA950_IU1_K1_LBSPPA512_LBSPPB512_LBSPPM0_LPA32_LPB16_LPM0_LRVW8_LWPMn1_MIAV0_MIWT2_4_MO40_NTn1_NTA0_NTB0_NTC0_NTD0_NTM0_NEPBS0_NLCA1_NLCB1_ONLL1_PGR2_PLR2_PKA1_SIA3_SS1_SU0_SUM0_SUS128_SPO0_SRVW0_SSO0_SVW2_SK3_SKXCCM8_TLDS1_ULSGRO0_USL1_UIOFGRO0_USFGRO0_VSn1_VWA2_VWB4_WSGRA0_WSGRB0_WS64_WG32_8_1_WGM6_WGMXCC1_WGMXCCGn1
    SolutionIndex: 35
    SolutionNameMin: Cijk_Ailk_Bljk_I8_BH_UserArgs_MT64x128x128_MI16x16x1_SN_LDSB1_AFC0_AFEM1_AFEM1_ASEM1_CLR1_CADS0_DTVA0_DTVB0_EPS0_FDSI0_GRPM1_GRVWA16_GRVWB16_GSU0_GSUAMB_GSUC0_GSUWGMRR0_GLS0_ISA950_IU1_K1_LBSPPA512_LBSPPB256_LBSPPM0_LPA32_LPB16_LPM0_LRVW8_LWPMn1_MIAV0_MIWT2_4_MO40_NTn1_NTA0_NTB0_NTC0_NTD0_NTM0_NEPBS0_NLCA1_NLCB1_ONLL1_PGR2_PLR2_PKA1_SIA3_SS1_SU0_SUM0_SUS128_SPO0_SRVW0_SSO0_SVW2_SK3_SKXCCM8_TLDS1_ULSGRO0_USL1_UIOFGRO0_USFGRO0_VSn1_VWA2_VWB2_WSGRA0_WSGRB0_WS64_WG32_8_1_WGM6_WGMXCC1_WGMXCCGn1
    SolutionIndex: 36
    SolutionNameMin: Cijk_Ailk_Bljk_I8_BH_UserArgs_MT64x128x128_MI16x16x1_SN_LDSB1_AFC0_AFEM1_AFEM1_ASEM1_CLR1_CADS0_DTVA0_DTVB0_EPS0_FDSI0_GRPM1_GRVWA16_GRVWB16_GSU0_GSUAMB_GSUC0_GSUWGMRR0_GLS0_ISA950_IU1_K1_LBSPPA512_LBSPPB512_LBSPPM0_LPA32_LPB16_LPM0_LRVW8_LWPMn1_MIAV0_MIWT2_4_MO40_NTn1_NTA0_NTB0_NTC0_NTD0_NTM0_NEPBS0_NLCA1_NLCB1_ONLL1_PGR2_PLR2_PKA1_SIA3_SS1_SU0_SUM0_SUS128_SPO0_SRVW0_SSO0_SVW2_SK3_SKXCCM8_TLDS1_ULSGRO0_USL1_UIOFGRO0_USFGRO0_VSn1_VWA2_VWB4_WSGRA0_WSGRB0_WS64_WG32_8_1_WGM6_WGMXCC1_WGMXCCGn1
    SolutionIndex: 37
    SolutionNameMin: Cijk_Ailk_Bljk_I8_BH_UserArgs_MT128x64x128_MI16x16x1_SN_LDSB1_AFC0_AFEM1_AFEM1_ASEM1_CLR1_CADS0_DTVA0_DTVB0_EPS0_FDSI0_GRPM1_GRVWA4_GRVWB16_GSU0_GSUAMB_GSUC0_GSUWGMRR0_GLS0_ISA950_IU1_K1_LBSPPA1024_LBSPPB256_LBSPPM0_LPA64_LPB16_LPM0_LRVW8_LWPMn1_MIAV0_MIWT4_2_MO40_NTn1_NTA0_NTB0_NTC0_NTD0_NTM0_NEPBS0_NLCA1_NLCB1_ONLL1_PGR2_PLR1_PKA1_SIA3_SS1_SU0_SUM0_SUS128_SPO0_SRVW0_SSO0_SVW4_SK3_SKXCCM8_TLDS1_ULSGRO0_USL1_UIOFGRO0_USFGRO0_VSn1_VWA4_VWB2_WSGRA0_WSGRB0_WS64_WG32_8_1_WGM6_WGMXCC1_WGMXCCGn1
    SolutionIndex: 38
    SolutionNameMin: Cijk_Ailk_Bljk_I8_BH_UserArgs_MT128x64x128_MI16x16x1_SN_LDSB1_AFC0_AFEM1_AFEM1_ASEM1_CLR1_CADS0_DTVA0_DTVB0_EPS0_FDSI0_GRPM1_GRVWA4_GRVWB16_GSU0_GSUAMB_GSUC0_GSUWGMRR0_GLS0_ISA950_IU1_K1_LBSPPA2048_LBSPPB256_LBSPPM0_LPA64_LPB32_LPM0_LRVW16_LWPMn1_MIAV0_MIWT4_2_MO40_NTn1_NTA0_NTB0_NTC0_NTD0_NTM0_NEPBS0_NLCA1_NLCB1_ONLL1_PGR2_PLR1_PKA1_SIA3_SS1_SU0_SUM0_SUS128_SPO0_SRVW0_SSO0_SVW4_SK3_SKXCCM8_TLDS1_ULSGRO0_USL1_UIOFGRO0_USFGRO0_VSn1_VWA4_VWB2_WSGRA0_WSGRB0_WS64_WG32_8_1_WGM6_WGMXCC1_WGMXCCGn1
    SolutionIndex: 39
    SolutionNameMin: Cijk_Ailk_Bljk_I8_BH_UserArgs_MT128x64x128_MI16x16x1_SN_LDSB1_AFC0_AFEM1_AFEM1_ASEM1_CLR1_CADS0_DTVA0_DTVB0_EPS0_FDSI0_GRPM1_GRVWA16_GRVWB16_GSU0_GSUAMB_GSUC0_GSUWGMRR0_GLS0_ISA950_IU1_K1_LBSPPA2048_LBSPPB256_LBSPPM0_LPA64_LPB32_LPM0_LRVW16_LWPMn1_MIAV0_MIWT4_2_MO40_NTn1_NTA0_NTB0_NTC0_NTD0_NTM0_NEPBS0_NLCA1_NLCB1_ONLL1_PGR2_PLR1_PKA1_SIA3_SS1_SU0_SUM0_SUS128_SPO0_SRVW0_SSO0_SVW4_SK3_SKXCCM8_TLDS1_ULSGRO0_USL1_UIOFGRO0_USFGRO0_VSn1_VWA4_VWB2_WSGRA0_WSGRB0_WS64_WG32_8_1_WGM6_WGMXCC1_WGMXCCGn1
    SolutionIndex: 40
    SolutionNameMin: Cijk_Ailk_Bljk_I8_BH_UserArgs_MT64x64x128_MI16x16x1_SN_LDSB1_AFC0_AFEM1_AFEM1_ASEM1_CLR1_CADS0_DTVA0_DTVB0_EPS0_FDSI0_GRPM1_GRVWA4_GRVWB4_GSU0_GSUAMB_GSUC0_GSUWGMRR0_GLS0_ISA950_IU1_K1_LBSPPA512_LBSPPB256_LBSPPM0_LPA32_LPB8_LPM0_LRVW8_LWPMn1_MIAV0_MIWT2_2_MO40_NTn1_NTA0_NTB0_NTC0_NTD0_NTM0_NEPBS0_NLCA1_NLCB1_ONLL1_PGR2_PLR1_PKA1_SIA3_SS1_SU0_SUM0_SUS128_SPO0_SRVW0_SSO0_SVW2_SK3_SKXCCM8_TLDS1_ULSGRO0_USL1_UIOFGRO0_USFGRO0_VSn1_VWA2_VWB2_WSGRA0_WSGRB0_WS64_WG32_8_1_WGM6_WGMXCC1_WGMXCCGn1
    SolutionIndex: 41
    SolutionNameMin: Cijk_Ailk_Bljk_I8_BH_UserArgs_MT64x64x128_MI16x16x1_SN_LDSB1_AFC0_AFEM1_AFEM1_ASEM1_CLR1_CADS0_DTVA0_DTVB0_EPS0_FDSI0_GRPM1_GRVWA8_GRVWB4_GSU0_GSUAMB_GSUC0_GSUWGMRR0_GLS0_ISA950_IU1_K1_LBSPPA512_LBSPPB256_LBSPPM0_LPA32_LPB8_LPM0_LRVW8_LWPMn1_MIAV0_MIWT2_2_MO40_NTn1_NTA0_NTB0_NTC0_NTD0_NTM0_NEPBS0_NLCA1_NLCB1_ONLL1_PGR2_PLR1_PKA1_SIA3_SS1_SU0_SUM0_SUS128_SPO0_SRVW0_SSO0_SVW2_SK3_SKXCCM8_TLDS1_ULSGRO0_USL1_UIOFGRO0_USFGRO0_VSn1_VWA2_VWB2_WSGRA0_WSGRB0_WS64_WG32_8_1_WGM6_WGMXCC1_WGMXCCGn1
    SolutionIndex: 42
    SolutionNameMin: Cijk_Ailk_Bljk_I8_BH_UserArgs_MT64x64x128_MI16x16x1_SN_LDSB1_AFC0_AFEM1_AFEM1_ASEM1_CLR1_CADS0_DTVA0_DTVB0_EPS0_FDSI0_GRPM1_GRVWA4_GRVWB8_GSU0_GSUAMB_GSUC0_GSUWGMRR0_GLS0_ISA950_IU1_K1_LBSPPA512_LBSPPB256_LBSPPM0_LPA32_LPB8_LPM0_LRVW8_LWPMn1_MIAV0_MIWT2_2_MO40_NTn1_NTA0_NTB0_NTC0_NTD0_NTM0_NEPBS0_NLCA1_NLCB1_ONLL1_PGR2_PLR1_PKA1_SIA3_SS1_SU0_SUM0_SUS128_SPO0_SRVW0_SSO0_SVW2_SK3_SKXCCM8_TLDS1_ULSGRO0_USL1_UIOFGRO0_USFGRO0_VSn1_VWA2_VWB2_WSGRA0_WSGRB0_WS64_WG32_8_1_WGM6_WGMXCC1_WGMXCCGn1
    SolutionIndex: 43
    SolutionNameMin: Cijk_Ailk_Bljk_I8_BH_UserArgs_MT64x64x128_MI16x16x1_SN_LDSB1_AFC0_AFEM1_AFEM1_ASEM1_CLR1_CADS0_DTVA0_DTVB0_EPS0_FDSI0_GRPM1_GRVWA4_GRVWB16_GSU0_GSUAMB_GSUC0_GSUWGMRR0_GLS0_ISA950_IU1_K1_LBSPPA512_LBSPPB256_LBSPPM0_LPA32_LPB16_LPM0_LRVW8_LWPMn1_MIAV0_MIWT2_2_MO40_NTn1_NTA0_NTB0_NTC0_NTD0_NTM0_NEPBS0_NLCA1_NLCB1_ONLL1_PGR2_PLR1_PKA1_SIA3_SS1_SU0_SUM0_SUS128_SPO0_SRVW0_SSO0_SVW2_SK3_SKXCCM8_TLDS1_ULSGRO0_USL1_UIOFGRO0_USFGRO0_VSn1_VWA2_VWB2_WSGRA0_WSGRB0_WS64_WG32_8_1_WGM6_WGMXCC1_WGMXCCGn1
    SolutionIndex: 44
    SolutionNameMin: Cijk_Ailk_Bljk_I8_BH_UserArgs_MT64x64x128_MI16x16x1_SN_LDSB1_AFC0_AFEM1_AFEM1_ASEM1_CLR1_CADS0_DTVA0_DTVB0_EPS0_FDSI0_GRPM1_GRVWA8_GRVWB16_GSU0_GSUAMB_GSUC0_GSUWGMRR0_GLS0_ISA950_IU1_K1_LBSPPA512_LBSPPB256_LBSPPM0_LPA32_LPB16_LPM0_LRVW8_LWPMn1_MIAV0_MIWT2_2_MO40_NTn1_NTA0_NTB0_NTC0_NTD0_NTM0_NEPBS0_NLCA1_NLCB1_ONLL1_PGR2_PLR1_PKA1_SIA3_SS1_SU0_SUM0_SUS128_SPO0_SRVW0_SSO0_SVW2_SK3_SKXCCM8_TLDS1_ULSGRO0_USL1_UIOFGRO0_USFGRO0_VSn1_VWA2_VWB2_WSGRA0_WSGRB0_WS64_WG32_8_1_WGM6_WGMXCC1_WGMXCCGn1
    SolutionIndex: 45
    SolutionNameMin: Cijk_Ailk_Bljk_I8_BH_UserArgs_MT64x64x128_MI16x16x1_SN_LDSB1_AFC0_AFEM1_AFEM1_ASEM1_CLR1_CADS0_DTVA0_DTVB0_EPS0_FDSI0_GRPM1_GRVWA16_GRVWB16_GSU0_GSUAMB_GSUC0_GSUWGMRR0_GLS0_ISA950_IU1_K1_LBSPPA512_LBSPPB256_LBSPPM0_LPA32_LPB16_LPM0_LRVW8_LWPMn1_MIAV0_MIWT2_2_MO40_NTn1_NTA0_NTB0_NTC0_NTD0_NTM0_NEPBS0_NLCA1_NLCB1_ONLL1_PGR2_PLR1_PKA1_SIA3_SS1_SU0_SUM0_SUS128_SPO0_SRVW0_SSO0_SVW2_SK3_SKXCCM8_TLDS1_ULSGRO0_USL1_UIOFGRO0_USFGRO0_VSn1_VWA2_VWB2_WSGRA0_WSGRB0_WS64_WG32_8_1_WGM6_WGMXCC1_WGMXCCGn1
    SolutionIndex: 46
    SolutionNameMin: Cijk_Ailk_Bljk_I8_BH_UserArgs_MT64x64x128_MI16x16x1_SN_LDSB1_AFC0_AFEM1_AFEM1_ASEM1_CLR1_CADS0_DTVA0_DTVB0_EPS0_FDSI0_GRPM1_GRVWA4_GRVWB4_GSU0_GSUAMB_GSUC0_GSUWGMRR0_GLS0_ISA950_IU1_K1_LBSPPA1024_LBSPPB256_LBSPPM0_LPA32_LPB32_LPM0_LRVW16_LWPMn1_MIAV0_MIWT2_2_MO40_NTn1_NTA0_NTB0_NTC0_NTD0_NTM0_NEPBS0_NLCA1_NLCB1_ONLL1_PGR2_PLR1_PKA1_SIA3_SS1_SU0_SUM0_SUS128_SPO0_SRVW0_SSO0_SVW2_SK3_SKXCCM8_TLDS1_ULSGRO0_USL1_UIOFGRO0_USFGRO0_VSn1_VWA2_VWB2_WSGRA0_WSGRB0_WS64_WG32_8_1_WGM6_WGMXCC1_WGMXCCGn1
    SolutionIndex: 47
    SolutionNameMin: Cijk_Ailk_Bljk_I8_BH_UserArgs_MT64x64x128_MI16x16x1_SN_LDSB1_AFC0_AFEM1_AFEM1_ASEM1_CLR1_CADS0_DTVA0_DTVB0_EPS0_FDSI0_GRPM1_GRVWA8_GRVWB4_GSU0_GSUAMB_GSUC0_GSUWGMRR0_GLS0_ISA950_IU1_K1_LBSPPA1024_LBSPPB256_LBSPPM0_LPA32_LPB32_LPM0_LRVW16_LWPMn1_MIAV0_MIWT2_2_MO40_NTn1_NTA0_NTB0_NTC0_NTD0_NTM0_NEPBS0_NLCA1_NLCB1_ONLL1_PGR2_PLR1_PKA1_SIA3_SS1_SU0_SUM0_SUS128_SPO0_SRVW0_SSO0_SVW2_SK3_SKXCCM8_TLDS1_ULSGRO0_USL1_UIOFGRO0_USFGRO0_VSn1_VWA2_VWB2_WSGRA0_WSGRB0_WS64_WG32_8_1_WGM6_WGMXCC1_WGMXCCGn1
    SolutionIndex: 48
    SolutionNameMin: Cijk_Ailk_Bljk_I8_BH_UserArgs_MT64x64x128_MI16x16x1_SN_LDSB1_AFC0_AFEM1_AFEM1_ASEM1_CLR1_CADS0_DTVA0_DTVB0_EPS0_FDSI0_GRPM1_GRVWA4_GRVWB8_GSU0_GSUAMB_GSUC0_GSUWGMRR0_GLS0_ISA950_IU1_K1_LBSPPA1024_LBSPPB256_LBSPPM0_LPA32_LPB32_LPM0_LRVW16_LWPMn1_MIAV0_MIWT2_2_MO40_NTn1_NTA0_NTB0_NTC0_NTD0_NTM0_NEPBS0_NLCA1_NLCB1_ONLL1_PGR2_PLR1_PKA1_SIA3_SS1_SU0_SUM0_SUS128_SPO0_SRVW0_SSO0_SVW2_SK3_SKXCCM8_TLDS1_ULSGRO0_USL1_UIOFGRO0_USFGRO0_VSn1_VWA2_VWB2_WSGRA0_WSGRB0_WS64_WG32_8_1_WGM6_WGMXCC1_WGMXCCGn1
    SolutionIndex: 49
    SolutionNameMin: Cijk_Ailk_Bljk_I8_BH_UserArgs_MT64x64x128_MI16x16x1_SN_LDSB1_AFC0_AFEM1_AFEM1_ASEM1_CLR1_CADS0_DTVA0_DTVB0_EPS0_FDSI0_GRPM1_GRVWA8_GRVWB8_GSU0_GSUAMB_GSUC0_GSUWGMRR0_GLS0_ISA950_IU1_K1_LBSPPA1024_LBSPPB256_LBSPPM0_LPA32_LPB32_LPM0_LRVW16_LWPMn1_MIAV0_MIWT2_2_MO40_NTn1_NTA0_NTB0_NTC0_NTD0_NTM0_NEPBS0_NLCA1_NLCB1_ONLL1_PGR2_PLR1_PKA1_SIA3_SS1_SU0_SUM0_SUS128_SPO0_SRVW0_SSO0_SVW2_SK3_SKXCCM8_TLDS1_ULSGRO0_USL1_UIOFGRO0_USFGRO0_VSn1_VWA2_VWB2_WSGRA0_WSGRB0_WS64_WG32_8_1_WGM6_WGMXCC1_WGMXCCGn1
    SolutionIndex: 50
    SolutionNameMin: Cijk_Ailk_Bljk_I8_BH_UserArgs_MT64x64x128_MI16x16x1_SN_LDSB1_AFC0_AFEM1_AFEM1_ASEM1_CLR1_CADS0_DTVA0_DTVB0_EPS0_FDSI0_GRPM1_GRVWA4_GRVWB16_GSU0_GSUAMB_GSUC0_GSUWGMRR0_GLS0_ISA950_IU1_K1_LBSPPA1024_LBSPPB256_LBSPPM0_LPA32_LPB32_LPM0_LRVW16_LWPMn1_MIAV0_MIWT2_2_MO40_NTn1_NTA0_NTB0_NTC0_NTD0_NTM0_NEPBS0_NLCA1_NLCB1_ONLL1_PGR2_PLR1_PKA1_SIA3_SS1_SU0_SUM0_SUS128_SPO0_SRVW0_SSO0_SVW2_SK3_SKXCCM8_TLDS1_ULSGRO0_USL1_UIOFGRO0_USFGRO0_VSn1_VWA2_VWB2_WSGRA0_WSGRB0_WS64_WG32_8_1_WGM6_WGMXCC1_WGMXCCGn1
    SolutionIndex: 51
    SolutionNameMin: Cijk_Ailk_Bljk_I8_BH_UserArgs_MT64x64x128_MI16x16x1_SN_LDSB1_AFC0_AFEM1_AFEM1_ASEM1_CLR1_CADS0_DTVA0_DTVB0_EPS0_FDSI0_GRPM1_GRVWA8_GRVWB16_GSU0_GSUAMB_GSUC0_GSUWGMRR0_GLS0_ISA950_IU1_K1_LBSPPA1024_LBSPPB256_LBSPPM0_LPA32_LPB32_LPM0_LRVW16_LWPMn1_MIAV0_MIWT2_2_MO40_NTn1_NTA0_NTB0_NTC0_NTD0_NTM0_NEPBS0_NLCA1_NLCB1_ONLL1_PGR2_PLR1_PKA1_SIA3_SS1_SU0_SUM0_SUS128_SPO0_SRVW0_SSO0_SVW2_SK3_SKXCCM8_TLDS1_ULSGRO0_USL1_UIOFGRO0_USFGRO0_VSn1_VWA2_VWB2_WSGRA0_WSGRB0_WS64_WG32_8_1_WGM6_WGMXCC1_WGMXCCGn1
    SolutionIndex: 52
    SolutionNameMin: Cijk_Ailk_Bljk_I8_BH_UserArgs_MT64x64x128_MI16x16x1_SN_LDSB1_AFC0_AFEM1_AFEM1_ASEM1_CLR1_CADS0_DTVA0_DTVB0_EPS0_FDSI0_GRPM1_GRVWA16_GRVWB16_GSU0_GSUAMB_GSUC0_GSUWGMRR0_GLS0_ISA950_IU1_K1_LBSPPA1024_LBSPPB256_LBSPPM0_LPA32_LPB32_LPM0_LRVW16_LWPMn1_MIAV0_MIWT2_2_MO40_NTn1_NTA0_NTB0_NTC0_NTD0_NTM0_NEPBS0_NLCA1_NLCB1_ONLL1_PGR2_PLR1_PKA1_SIA3_SS1_SU0_SUM0_SUS128_SPO0_SRVW0_SSO0_SVW2_SK3_SKXCCM8_TLDS1_ULSGRO0_USL1_UIOFGRO0_USFGRO0_VSn1_VWA2_VWB2_WSGRA0_WSGRB0_WS64_WG32_8_1_WGM6_WGMXCC1_WGMXCCGn1
    SolutionIndex: 53
    SolutionNameMin: Cijk_Ailk_Bljk_I8_BH_UserArgs_MT64x64x128_MI16x16x1_SN_LDSB1_AFC0_AFEM1_AFEM1_ASEM1_CLR1_CADS0_DTVA0_DTVB0_EPS0_FDSI0_GRPM1_GRVWA4_GRVWB4_GSU0_GSUAMB_GSUC0_GSUWGMRR0_GLS0_ISA950_IU1_K1_LBSPPA512_LBSPPB256_LBSPPM0_LPA32_LPB8_LPM0_LRVW8_LWPMn1_MIAV0_MIWT2_2_MO40_NTn1_NTA0_NTB0_NTC0_NTD0_NTM0_NEPBS0_NLCA1_NLCB1_ONLL1_PGR2_PLR2_PKA1_SIA3_SS1_SU0_SUM0_SUS128_SPO0_SRVW0_SSO0_SVW2_SK3_SKXCCM8_TLDS1_ULSGRO0_USL1_UIOFGRO0_USFGRO0_VSn1_VWA2_VWB2_WSGRA0_WSGRB0_WS64_WG32_8_1_WGM6_WGMXCC1_WGMXCCGn1
    SolutionIndex: 54
    SolutionNameMin: Cijk_Ailk_Bljk_I8_BH_UserArgs_MT64x64x128_MI16x16x1_SN_LDSB1_AFC0_AFEM1_AFEM1_ASEM1_CLR1_CADS0_DTVA0_DTVB0_EPS0_FDSI0_GRPM1_GRVWA4_GRVWB16_GSU0_GSUAMB_GSUC0_GSUWGMRR0_GLS0_ISA950_IU1_K1_LBSPPA512_LBSPPB256_LBSPPM0_LPA32_LPB16_LPM0_LRVW8_LWPMn1_MIAV0_MIWT2_2_MO40_NTn1_NTA0_NTB0_NTC0_NTD0_NTM0_NEPBS0_NLCA1_NLCB1_ONLL1_PGR2_PLR2_PKA1_SIA3_SS1_SU0_SUM0_SUS128_SPO0_SRVW0_SSO0_SVW2_SK3_SKXCCM8_TLDS1_ULSGRO0_USL1_UIOFGRO0_USFGRO0_VSn1_VWA2_VWB2_WSGRA0_WSGRB0_WS64_WG32_8_1_WGM6_WGMXCC1_WGMXCCGn1
    SolutionIndex: 55
    SolutionNameMin: Cijk_Ailk_Bljk_I8_BH_UserArgs_MT64x64x128_MI16x16x1_SN_LDSB1_AFC0_AFEM1_AFEM1_ASEM1_CLR1_CADS0_DTVA0_DTVB0_EPS0_FDSI0_GRPM1_GRVWA8_GRVWB16_GSU0_GSUAMB_GSUC0_GSUWGMRR0_GLS0_ISA950_IU1_K1_LBSPPA512_LBSPPB256_LBSPPM0_LPA32_LPB16_LPM0_LRVW8_LWPMn1_MIAV0_MIWT2_2_MO40_NTn1_NTA0_NTB0_NTC0_NTD0_NTM0_NEPBS0_NLCA1_NLCB1_ONLL1_PGR2_PLR2_PKA1_SIA3_SS1_SU0_SUM0_SUS128_SPO0_SRVW0_SSO0_SVW2_SK3_SKXCCM8_TLDS1_ULSGRO0_USL1_UIOFGRO0_USFGRO0_VSn1_VWA2_VWB2_WSGRA0_WSGRB0_WS64_WG32_8_1_WGM6_WGMXCC1_WGMXCCGn1
    SolutionIndex: 56
    SolutionNameMin: Cijk_Ailk_Bljk_I8_BH_UserArgs_MT64x64x128_MI16x16x1_SN_LDSB1_AFC0_AFEM1_AFEM1_ASEM1_CLR1_CADS0_DTVA0_DTVB0_EPS0_FDSI0_GRPM1_GRVWA16_GRVWB16_GSU0_GSUAMB_GSUC0_GSUWGMRR0_GLS0_ISA950_IU1_K1_LBSPPA512_LBSPPB256_LBSPPM0_LPA32_LPB16_LPM0_LRVW8_LWPMn1_MIAV0_MIWT2_2_MO40_NTn1_NTA0_NTB0_NTC0_NTD0_NTM0_NEPBS0_NLCA1_NLCB1_ONLL1_PGR2_PLR2_PKA1_SIA3_SS1_SU0_SUM0_SUS128_SPO0_SRVW0_SSO0_SVW2_SK3_SKXCCM8_TLDS1_ULSGRO0_USL1_UIOFGRO0_USFGRO0_VSn1_VWA2_VWB2_WSGRA0_WSGRB0_WS64_WG32_8_1_WGM6_WGMXCC1_WGMXCCGn1
    SolutionIndex: 57
    SolutionNameMin: Cijk_Ailk_Bljk_I8_BH_UserArgs_MT64x64x128_MI16x16x1_SN_LDSB1_AFC0_AFEM1_AFEM1_ASEM1_CLR1_CADS0_DTVA0_DTVB0_EPS0_FDSI0_GRPM1_GRVWA4_GRVWB16_GSU0_GSUAMB_GSUC0_GSUWGMRR0_GLS0_ISA950_IU1_K1_LBSPPA1024_LBSPPB256_LBSPPM0_LPA32_LPB32_LPM0_LRVW16_LWPMn1_MIAV0_MIWT2_2_MO40_NTn1_NTA0_NTB0_NTC0_NTD0_NTM0_NEPBS0_NLCA1_NLCB1_ONLL1_PGR2_PLR2_PKA1_SIA3_SS1_SU0_SUM0_SUS128_SPO0_SRVW0_SSO0_SVW2_SK3_SKXCCM8_TLDS1_ULSGRO0_USL1_UIOFGRO0_USFGRO0_VSn1_VWA2_VWB2_WSGRA0_WSGRB0_WS64_WG32_8_1_WGM6_WGMXCC1_WGMXCCGn1
    SolutionIndex: 58
    SolutionNameMin: Cijk_Ailk_Bljk_I8_BH_UserArgs_MT64x64x128_MI16x16x1_SN_LDSB1_AFC0_AFEM1_AFEM1_ASEM1_CLR1_CADS0_DTVA0_DTVB0_EPS0_FDSI0_GRPM1_GRVWA8_GRVWB16_GSU0_GSUAMB_GSUC0_GSUWGMRR0_GLS0_ISA950_IU1_K1_LBSPPA1024_LBSPPB256_LBSPPM0_LPA32_LPB32_LPM0_LRVW16_LWPMn1_MIAV0_MIWT2_2_MO40_NTn1_NTA0_NTB0_NTC0_NTD0_NTM0_NEPBS0_NLCA1_NLCB1_ONLL1_PGR2_PLR2_PKA1_SIA3_SS1_SU0_SUM0_SUS128_SPO0_SRVW0_SSO0_SVW2_SK3_SKXCCM8_TLDS1_ULSGRO0_USL1_UIOFGRO0_USFGRO0_VSn1_VWA2_VWB2_WSGRA0_WSGRB0_WS64_WG32_8_1_WGM6_WGMXCC1_WGMXCCGn1
    SolutionIndex: 59
    SolutionNameMin: Cijk_Ailk_Bljk_I8_BH_UserArgs_MT256x256x128_MI32x32x1_SN_LDSB1_AFC0_AFEM1_AFEM1_ASEM1_CLR1_CADS0_DTVA0_DTVB0_EPS0_FDSI0_GRPM1_GRVWA16_GRVWB16_GSU0_GSUAMB_GSUC0_GSUWGMRR0_GLS0_ISA950_IU1_K1_LBSPPA0_LBSPPB256_LBSPPM0_LPA0_LPB16_LPM0_LRVW16_LWPMn1_MIAV0_MIWT4_4_MO40_NTn1_NTA0_NTB0_NTC0_NTD0_NTM0_NEPBS0_NLCA1_NLCB1_ONLL1_PGR2_PLR1_PKA1_SIA3_SS1_SU0_SUM0_SUS128_SPO0_SRVW0_SSO0_SVW4_SK3_SKXCCM8_TLDS1_ULSGRO0_USL1_UIOFGRO0_USFGRO0_VSn1_VWA4_VWB2_WSGRA0_WSGRB0_WS64_WG64_4_1_WGM6_WGMXCC1_WGMXCCGn1
    SolutionIndex: 60
    SolutionNameMin: Cijk_Ailk_Bljk_I8_BH_UserArgs_MT256x256x128_MI32x32x1_SN_LDSB1_AFC0_AFEM1_AFEM1_ASEM1_CLR1_CADS0_DTVA0_DTVB0_EPS0_FDSI0_GRPM1_GRVWA16_GRVWB16_GSU0_GSUAMB_GSUC0_GSUWGMRR0_GLS0_ISA950_IU1_K1_LBSPPA0_LBSPPB512_LBSPPM0_LPA0_LPB16_LPM0_LRVW16_LWPMn1_MIAV0_MIWT4_4_MO40_NTn1_NTA0_NTB0_NTC0_NTD0_NTM0_NEPBS0_NLCA1_NLCB1_ONLL1_PGR2_PLR1_PKA1_SIA3_SS1_SU0_SUM0_SUS128_SPO0_SRVW0_SSO0_SVW4_SK3_SKXCCM8_TLDS1_ULSGRO0_USL1_UIOFGRO0_USFGRO0_VSn1_VWA4_VWB4_WSGRA0_WSGRB0_WS64_WG64_4_1_WGM6_WGMXCC1_WGMXCCGn1
    SolutionIndex: 61
    SolutionNameMin: Cijk_Ailk_Bljk_I8_BH_UserArgs_MT128x256x128_MI32x32x1_SN_LDSB1_AFC0_AFEM1_AFEM1_ASEM1_CLR1_CADS0_DTVA0_DTVB0_EPS0_FDSI0_GRPM1_GRVWA4_GRVWB16_GSU0_GSUAMB_GSUC0_GSUWGMRR0_GLS0_ISA950_IU1_K1_LBSPPA0_LBSPPB256_LBSPPM0_LPA0_LPB16_LPM0_LRVW16_LWPMn1_MIAV0_MIWT2_4_MO40_NTn1_NTA0_NTB0_NTC0_NTD0_NTM0_NEPBS0_NLCA1_NLCB1_ONLL1_PGR2_PLR1_PKA1_SIA3_SS1_SU0_SUM0_SUS128_SPO0_SRVW0_SSO0_SVW2_SK3_SKXCCM8_TLDS1_ULSGRO0_USL1_UIOFGRO0_USFGRO0_VSn1_VWA2_VWB2_WSGRA0_WSGRB0_WS64_WG64_4_1_WGM6_WGMXCC1_WGMXCCGn1
    SolutionIndex: 62
    SolutionNameMin: Cijk_Ailk_Bljk_I8_BH_UserArgs_MT128x256x128_MI32x32x1_SN_LDSB1_AFC0_AFEM1_AFEM1_ASEM1_CLR1_CADS0_DTVA0_DTVB0_EPS0_FDSI0_GRPM1_GRVWA16_GRVWB16_GSU0_GSUAMB_GSUC0_GSUWGMRR0_GLS0_ISA950_IU1_K1_LBSPPA0_LBSPPB256_LBSPPM0_LPA0_LPB16_LPM0_LRVW16_LWPMn1_MIAV0_MIWT2_4_MO40_NTn1_NTA0_NTB0_NTC0_NTD0_NTM0_NEPBS0_NLCA1_NLCB1_ONLL1_PGR2_PLR1_PKA1_SIA3_SS1_SU0_SUM0_SUS128_SPO0_SRVW0_SSO0_SVW2_SK3_SKXCCM8_TLDS1_ULSGRO0_USL1_UIOFGRO0_USFGRO0_VSn1_VWA2_VWB2_WSGRA0_WSGRB0_WS64_WG64_4_1_WGM6_WGMXCC1_WGMXCCGn1
    SolutionIndex: 63
    SolutionNameMin: Cijk_Ailk_Bljk_I8_BH_UserArgs_MT128x256x128_MI32x32x1_SN_LDSB1_AFC0_AFEM1_AFEM1_ASEM1_CLR1_CADS0_DTVA0_DTVB0_EPS0_FDSI0_GRPM1_GRVWA16_GRVWB16_GSU0_GSUAMB_GSUC0_GSUWGMRR0_GLS0_ISA950_IU1_K1_LBSPPA0_LBSPPB512_LBSPPM0_LPA0_LPB16_LPM0_LRVW16_LWPMn1_MIAV0_MIWT2_4_MO40_NTn1_NTA0_NTB0_NTC0_NTD0_NTM0_NEPBS0_NLCA1_NLCB1_ONLL1_PGR2_PLR1_PKA1_SIA3_SS1_SU0_SUM0_SUS128_SPO0_SRVW0_SSO0_SVW2_SK3_SKXCCM8_TLDS1_ULSGRO0_USL1_UIOFGRO0_USFGRO0_VSn1_VWA2_VWB4_WSGRA0_WSGRB0_WS64_WG64_4_1_WGM6_WGMXCC1_WGMXCCGn1
    SolutionIndex: 64
    SolutionNameMin: Cijk_Ailk_Bljk_I8_BH_UserArgs_MT128x256x128_MI32x32x1_SN_LDSB1_AFC0_AFEM1_AFEM1_ASEM1_CLR1_CADS0_DTVA0_DTVB0_EPS0_FDSI0_GRPM1_GRVWA4_GRVWB16_GSU0_GSUAMB_GSUC0_GSUWGMRR0_GLS0_ISA950_IU1_K1_LBSPPA0_LBSPPB256_LBSPPM0_LPA0_LPB16_LPM0_LRVW16_LWPMn1_MIAV0_MIWT2_4_MO40_NTn1_NTA0_NTB0_NTC0_NTD0_NTM0_NEPBS0_NLCA1_NLCB1_ONLL1_PGR2_PLR2_PKA1_SIA3_SS1_SU0_SUM0_SUS128_SPO0_SRVW0_SSO0_SVW2_SK3_SKXCCM8_TLDS1_ULSGRO0_USL1_UIOFGRO0_USFGRO0_VSn1_VWA2_VWB2_WSGRA0_WSGRB0_WS64_WG64_4_1_WGM6_WGMXCC1_WGMXCCGn1
    SolutionIndex: 65
    SolutionNameMin: Cijk_Ailk_Bljk_I8_BH_UserArgs_MT128x256x128_MI32x32x1_SN_LDSB1_AFC0_AFEM1_AFEM1_ASEM1_CLR1_CADS0_DTVA0_DTVB0_EPS0_FDSI0_GRPM1_GRVWA4_GRVWB16_GSU0_GSUAMB_GSUC0_GSUWGMRR0_GLS0_ISA950_IU1_K1_LBSPPA0_LBSPPB512_LBSPPM0_LPA0_LPB16_LPM0_LRVW16_LWPMn1_MIAV0_MIWT2_4_MO40_NTn1_NTA0_NTB0_NTC0_NTD0_NTM0_NEPBS0_NLCA1_NLCB1_ONLL1_PGR2_PLR2_PKA1_SIA3_SS1_SU0_SUM0_SUS128_SPO0_SRVW0_SSO0_SVW2_SK3_SKXCCM8_TLDS1_ULSGRO0_USL1_UIOFGRO0_USFGRO0_VSn1_VWA2_VWB4_WSGRA0_WSGRB0_WS64_WG64_4_1_WGM6_WGMXCC1_WGMXCCGn1
    SolutionIndex: 66
    SolutionNameMin: Cijk_Ailk_Bljk_I8_BH_UserArgs_MT128x256x128_MI32x32x1_SN_LDSB1_AFC0_AFEM1_AFEM1_ASEM1_CLR1_CADS0_DTVA0_DTVB0_EPS0_FDSI0_GRPM1_GRVWA8_GRVWB16_GSU0_GSUAMB_GSUC0_GSUWGMRR0_GLS0_ISA950_IU1_K1_LBSPPA0_LBSPPB512_LBSPPM0_LPA0_LPB16_LPM0_LRVW16_LWPMn1_MIAV0_MIWT2_4_MO40_NTn1_NTA0_NTB0_NTC0_NTD0_NTM0_NEPBS0_NLCA1_NLCB1_ONLL1_PGR2_PLR2_PKA1_SIA3_SS1_SU0_SUM0_SUS128_SPO0_SRVW0_SSO0_SVW2_SK3_SKXCCM8_TLDS1_ULSGRO0_USL1_UIOFGRO0_USFGRO0_VSn1_VWA2_VWB4_WSGRA0_WSGRB0_WS64_WG64_4_1_WGM6_WGMXCC1_WGMXCCGn1
    SolutionIndex: 67
    SolutionNameMin: Cijk_Ailk_Bljk_I8_BH_UserArgs_MT128x256x128_MI32x32x1_SN_LDSB1_AFC0_AFEM1_AFEM1_ASEM1_CLR1_CADS0_DTVA0_DTVB0_EPS0_FDSI0_GRPM1_GRVWA16_GRVWB16_GSU0_GSUAMB_GSUC0_GSUWGMRR0_GLS0_ISA950_IU1_K1_LBSPPA0_LBSPPB256_LBSPPM0_LPA0_LPB16_LPM0_LRVW16_LWPMn1_MIAV0_MIWT2_4_MO40_NTn1_NTA0_NTB0_NTC0_NTD0_NTM0_NEPBS0_NLCA1_NLCB1_ONLL1_PGR2_PLR2_PKA1_SIA3_SS1_SU0_SUM0_SUS128_SPO0_SRVW0_SSO0_SVW2_SK3_SKXCCM8_TLDS1_ULSGRO0_USL1_UIOFGRO0_USFGRO0_VSn1_VWA2_VWB2_WSGRA0_WSGRB0_WS64_WG64_4_1_WGM6_WGMXCC1_WGMXCCGn1
    SolutionIndex: 68
    SolutionNameMin: Cijk_Ailk_Bljk_I8_BH_UserArgs_MT128x256x128_MI32x32x1_SN_LDSB1_AFC0_AFEM1_AFEM1_ASEM1_CLR1_CADS0_DTVA0_DTVB0_EPS0_FDSI0_GRPM1_GRVWA16_GRVWB16_GSU0_GSUAMB_GSUC0_GSUWGMRR0_GLS0_ISA950_IU1_K1_LBSPPA0_LBSPPB512_LBSPPM0_LPA0_LPB16_LPM0_LRVW16_LWPMn1_MIAV0_MIWT2_4_MO40_NTn1_NTA0_NTB0_NTC0_NTD0_NTM0_NEPBS0_NLCA1_NLCB1_ONLL1_PGR2_PLR2_PKA1_SIA3_SS1_SU0_SUM0_SUS128_SPO0_SRVW0_SSO0_SVW2_SK3_SKXCCM8_TLDS1_ULSGRO0_USL1_UIOFGRO0_USFGRO0_VSn1_VWA2_VWB4_WSGRA0_WSGRB0_WS64_WG64_4_1_WGM6_WGMXCC1_WGMXCCGn1
    SolutionIndex: 69
    SolutionNameMin: Cijk_Ailk_Bljk_I8_BH_UserArgs_MT256x128x128_MI32x32x1_SN_LDSB1_AFC0_AFEM1_AFEM1_ASEM1_CLR1_CADS0_DTVA0_DTVB0_EPS0_FDSI0_GRPM1_GRVWA16_GRVWB16_GSU0_GSUAMB_GSUC0_GSUWGMRR0_GLS0_ISA950_IU1_K1_LBSPPA0_LBSPPB256_LBSPPM0_LPA0_LPB16_LPM0_LRVW16_LWPMn1_MIAV0_MIWT4_2_MO40_NTn1_NTA0_NTB0_NTC0_NTD0_NTM0_NEPBS0_NLCA1_NLCB1_ONLL1_PGR2_PLR1_PKA1_SIA3_SS1_SU0_SUM0_SUS128_SPO0_SRVW0_SSO0_SVW4_SK3_SKXCCM8_TLDS1_ULSGRO0_USL1_UIOFGRO0_USFGRO0_VSn1_VWA4_VWB2_WSGRA0_WSGRB0_WS64_WG64_4_1_WGM6_WGMXCC1_WGMXCCGn1
    SolutionIndex: 70
    SolutionNameMin: Cijk_Ailk_Bljk_I8_BH_UserArgs_MT64x64x256_MI16x16x1_SN_LDSB1_AFC0_AFEM1_AFEM1_ASEM1_CLR1_CADS0_DTVA0_DTVB0_EPS0_FDSI0_GRPM1_GRVWA8_GRVWB16_GSU0_GSUAMB_GSUC0_GSUWGMRR0_GLS0_ISA950_IU1_K1_LBSPPA512_LBSPPB512_LBSPPM0_LPA32_LPB16_LPM0_LRVW8_LWPMn1_MIAV0_MIWT2_2_MO40_NTn1_NTA0_NTB0_NTC0_NTD0_NTM0_NEPBS0_NLCA1_NLCB1_ONLL1_PGR2_PLR2_PKA1_SIA3_SS1_SU0_SUM0_SUS256_SPO0_SRVW0_SSO0_SVW2_SK3_SKXCCM8_TLDS1_ULSGRO0_USL1_UIOFGRO0_USFGRO0_VSn1_VWA2_VWB2_WSGRA0_WSGRB0_WS64_WG32_8_1_WGM6_WGMXCC1_WGMXCCGn1
    SolutionIndex: 71
    SolutionNameMin: Cijk_Ailk_Bljk_I8_BH_UserArgs_MT64x64x256_MI16x16x1_SN_LDSB1_AFC0_AFEM1_AFEM1_ASEM1_CLR1_CADS0_DTVA0_DTVB0_EPS0_FDSI0_GRPM1_GRVWA16_GRVWB16_GSU0_GSUAMB_GSUC0_GSUWGMRR0_GLS0_ISA950_IU1_K1_LBSPPA512_LBSPPB512_LBSPPM0_LPA32_LPB16_LPM0_LRVW8_LWPMn1_MIAV0_MIWT2_2_MO40_NTn1_NTA0_NTB0_NTC0_NTD0_NTM0_NEPBS0_NLCA1_NLCB1_ONLL1_PGR2_PLR2_PKA1_SIA3_SS1_SU0_SUM0_SUS256_SPO0_SRVW0_SSO0_SVW2_SK3_SKXCCM8_TLDS1_ULSGRO0_USL1_UIOFGRO0_USFGRO0_VSn1_VWA2_VWB2_WSGRA0_WSGRB0_WS64_WG32_8_1_WGM6_WGMXCC1_WGMXCCGn1
    SolutionIndex: 72
    SolutionNameMin: Cijk_Ailk_Bljk_I8_BH_UserArgs_MT64x64x256_MI16x16x1_SN_LDSB1_AFC0_AFEM1_AFEM1_ASEM1_CLR1_CADS0_DTVA0_DTVB0_EPS0_FDSI0_GRPM1_GRVWA4_GRVWB16_GSU0_GSUAMB_GSUC0_GSUWGMRR0_GLS0_ISA950_IU1_K1_LBSPPA1024_LBSPPB512_LBSPPM0_LPA32_LPB32_LPM0_LRVW16_LWPMn1_MIAV0_MIWT2_2_MO40_NTn1_NTA0_NTB0_NTC0_NTD0_NTM0_NEPBS0_NLCA1_NLCB1_ONLL1_PGR2_PLR2_PKA1_SIA3_SS1_SU0_SUM0_SUS256_SPO0_SRVW0_SSO0_SVW2_SK3_SKXCCM8_TLDS1_ULSGRO0_USL1_UIOFGRO0_USFGRO0_VSn1_VWA2_VWB2_WSGRA0_WSGRB0_WS64_WG32_8_1_WGM6_WGMXCC1_WGMXCCGn1
    SolutionIndex: 73
    SolutionNameMin: Cijk_Ailk_Bljk_I8_BH_UserArgs_MT64x64x256_MI16x16x1_SN_LDSB1_AFC0_AFEM1_AFEM1_ASEM1_CLR1_CADS0_DTVA0_DTVB0_EPS0_FDSI0_GRPM1_GRVWA8_GRVWB16_GSU0_GSUAMB_GSUC0_GSUWGMRR0_GLS0_ISA950_IU1_K1_LBSPPA1024_LBSPPB512_LBSPPM0_LPA32_LPB32_LPM0_LRVW16_LWPMn1_MIAV0_MIWT2_2_MO40_NTn1_NTA0_NTB0_NTC0_NTD0_NTM0_NEPBS0_NLCA1_NLCB1_ONLL1_PGR2_PLR2_PKA1_SIA3_SS1_SU0_SUM0_SUS256_SPO0_SRVW0_SSO0_SVW2_SK3_SKXCCM8_TLDS1_ULSGRO0_USL1_UIOFGRO0_USFGRO0_VSn1_VWA2_VWB2_WSGRA0_WSGRB0_WS64_WG32_8_1_WGM6_WGMXCC1_WGMXCCGn1
    SolutionIndex: 74
    SolutionNameMin: Cijk_Ailk_Bljk_I8_BH_UserArgs_MT64x64x256_MI16x16x1_SN_LDSB1_AFC0_AFEM1_AFEM1_ASEM1_CLR1_CADS0_DTVA0_DTVB0_EPS0_FDSI0_GRPM1_GRVWA16_GRVWB16_GSU0_GSUAMB_GSUC0_GSUWGMRR0_GLS0_ISA950_IU1_K1_LBSPPA1024_LBSPPB512_LBSPPM0_LPA32_LPB32_LPM0_LRVW16_LWPMn1_MIAV0_MIWT2_2_MO40_NTn1_NTA0_NTB0_NTC0_NTD0_NTM0_NEPBS0_NLCA1_NLCB1_ONLL1_PGR2_PLR2_PKA1_SIA3_SS1_SU0_SUM0_SUS256_SPO0_SRVW0_SSO0_SVW2_SK3_SKXCCM8_TLDS1_ULSGRO0_USL1_UIOFGRO0_USFGRO0_VSn1_VWA2_VWB2_WSGRA0_WSGRB0_WS64_WG32_8_1_WGM6_WGMXCC1_WGMXCCGn1
- - - [128, 128, 1, 128, 128, 128, 128, 128]
    - [58, 0.35]
  - - [128, 128, 1, 256, 128, 128, 128, 256]
    - [54, 0.68]
  - - [128, 128, 1, 512, 128, 128, 128, 512]
    - [43, 1.15]
  - - [128, 128, 1, 1024, 128, 128, 128, 1024]
    - [74, 1.8]
  - - [128, 128, 1, 2048, 128, 128, 128, 2048]
    - [74, 2.55]
  - - [128, 128, 1, 4096, 128, 128, 128, 4096]
    - [74, 3.21]
  - - [128, 128, 1, 8192, 128, 128, 128, 8192]
    - [74, 3.7]
  - - [128, 256, 1, 128, 128, 128, 128, 128]
    - [43, 0.75]
  - - [128, 256, 1, 256, 128, 128, 128, 256]
    - [43, 1.34]
  - - [128, 256, 1, 512, 128, 128, 128, 512]
    - [50, 2.27]
  - - [128, 256, 1, 1024, 128, 128, 128, 1024]
    - [74, 3.56]
  - - [128, 256, 1, 2048, 128, 128, 128, 2048]
    - [74, 5.02]
  - - [128, 256, 1, 4096, 128, 128, 128, 4096]
    - [74, 6.36]
  - - [128, 256, 1, 8192, 128, 128, 128, 8192]
    - [74, 7.36]
  - - [128, 512, 1, 128, 128, 128, 128, 128]
    - [9, 1.5]
  - - [128, 512, 1, 256, 128, 128, 128, 256]
    - [43, 2.63]
  - - [128, 512, 1, 512, 128, 128, 128, 512]
    - [54, 4.45]
  - - [128, 512, 1, 1024, 128, 128, 128, 1024]
    - [74, 7.09]
  - - [128, 512, 1, 2048, 128, 128, 128, 2048]
    - [74, 10.11]
  - - [128, 512, 1, 4096, 128, 128, 128, 4096]
    - [74, 12.68]
  - - [128, 512, 1, 8192, 128, 128, 128, 8192]
    - [74, 14.71]
  - - [128, 1024, 1, 128, 128, 128, 128, 128]
    - [43, 3.02]
  - - [128, 1024, 1, 256, 128, 128, 128, 256]
    - [54, 5.32]
  - - [128, 1024, 1, 512, 128, 128, 128, 512]
    - [44, 8.79]
  - - [128, 1024, 1, 1024, 128, 128, 128, 1024]
    - [74, 14.11]
  - - [128, 1024, 1, 2048, 128, 128, 128, 2048]
    - [74, 19.89]
  - - [128, 1024, 1, 4096, 128, 128, 128, 4096]
    - [74, 25.1]
  - - [128, 1024, 1, 8192, 128, 128, 128, 8192]
    - [74, 29.48]
  - - [128, 2048, 1, 128, 128, 128, 128, 128]
    - [53, 5.59]
  - - [128, 2048, 1, 256, 128, 128, 128, 256]
    - [54, 10.21]
  - - [128, 2048, 1, 512, 128, 128, 128, 512]
    - [56, 17.14]
  - - [128, 2048, 1, 1024, 128, 128, 128, 1024]
    - [74, 27.4]
  - - [128, 2048, 1, 2048, 128, 128, 128, 2048]
    - [74, 39.25]
  - - [128, 2048, 1, 4096, 128, 128, 128, 4096]
    - [74, 50.29]
  - - [128, 2048, 1, 8192, 128, 128, 128, 8192]
    - [74, 58.63]
  - - [128, 4096, 1, 128, 128, 128, 128, 128]
    - [54, 11.57]
  - - [128, 4096, 1, 256, 128, 128, 128, 256]
    - [50, 20.19]
  - - [128, 4096, 1, 512, 128, 128, 128, 512]
    - [50, 34.06]
  - - [128, 4096, 1, 1024, 128, 128, 128, 1024]
    - [72, 54.04]
  - - [128, 4096, 1, 2048, 128, 128, 128, 2048]
    - [74, 77.6]
  - - [128, 4096, 1, 4096, 128, 128, 128, 4096]
    - [74, 99.28]
  - - [128, 4096, 1, 8192, 128, 128, 128, 8192]
    - [74, 114.18]
  - - [128, 8192, 1, 128, 128, 128, 128, 128]
    - [50, 22.28]
  - - [128, 8192, 1, 256, 128, 128, 128, 256]
    - [43, 38.96]
  - - [128, 8192, 1, 512, 128, 128, 128, 512]
    - [43, 64.97]
  - - [128, 8192, 1, 1024, 128, 128, 128, 1024]
    - [74, 103.67]
  - - [128, 8192, 1, 2048, 128, 128, 128, 2048]
    - [74, 148.63]
  - - [128, 8192, 1, 4096, 128, 128, 128, 4096]
    - [74, 187.19]
  - - [128, 8192, 1, 8192, 128, 128, 128, 8192]
    - [74, 213.12]
  - - [256, 128, 1, 128, 256, 256, 256, 128]
    - [11, 0.72]
  - - [256, 128, 1, 256, 256, 256, 256, 256]
    - [43, 1.35]
  - - [256, 128, 1, 512, 256, 256, 256, 512]
    - [71, 2.22]
  - - [256, 128, 1, 1024, 256, 256, 256, 1024]
    - [74, 3.54]
  - - [256, 128, 1, 2048, 256, 256, 256, 2048]
    - [74, 4.88]
  - - [256, 128, 1, 4096, 256, 256, 256, 4096]
    - [74, 5.99]
  - - [256, 128, 1, 8192, 256, 256, 256, 8192]
    - [74, 6.78]
  - - [256, 256, 1, 128, 256, 256, 256, 128]
    - [43, 1.51]
  - - [256, 256, 1, 256, 256, 256, 256, 256]
    - [54, 2.66]
  - - [256, 256, 1, 512, 256, 256, 256, 512]
    - [74, 4.54]
  - - [256, 256, 1, 1024, 256, 256, 256, 1024]
    - [74, 7.2]
  - - [256, 256, 1, 2048, 256, 256, 256, 2048]
    - [74, 9.69]
  - - [256, 256, 1, 4096, 256, 256, 256, 4096]
    - [74, 12.11]
  - - [256, 256, 1, 8192, 256, 256, 256, 8192]
    - [74, 13.68]
  - - [256, 512, 1, 128, 256, 256, 256, 128]
    - [51, 2.96]
  - - [256, 512, 1, 256, 256, 256, 256, 256]
    - [40, 5.12]
  - - [256, 512, 1, 512, 256, 256, 256, 512]
    - [54, 8.91]
  - - [256, 512, 1, 1024, 256, 256, 256, 1024]
    - [71, 13.96]
  - - [256, 512, 1, 2048, 256, 256, 256, 2048]
    - [74, 19.54]
  - - [256, 512, 1, 4096, 256, 256, 256, 4096]
    - [74, 24.28]
  - - [256, 512, 1, 8192, 256, 256, 256, 8192]
    - [74, 27.82]
  - - [256, 1024, 1, 128, 256, 256, 256, 128]
    - [54, 5.98]
  - - [256, 1024, 1, 256, 256, 256, 256, 256]
    - [45, 10.29]
  - - [256, 1024, 1, 512, 256, 256, 256, 512]
    - [50, 17.67]
  - - [256, 1024, 1, 1024, 256, 256, 256, 1024]
    - [74, 27.69]
  - - [256, 1024, 1, 2048, 256, 256, 256, 2048]
    - [74, 38.92]
  - - [256, 1024, 1, 4096, 256, 256, 256, 4096]
    - [74, 48.23]
  - - [256, 1024, 1, 8192, 256, 256, 256, 8192]
    - [74, 55.69]
  - - [256, 2048, 1, 128, 256, 256, 256, 128]
    - [49, 11.04]
  - - [256, 2048, 1, 256, 256, 256, 256, 256]
    - [43, 20.16]
  - - [256, 2048, 1, 512, 256, 256, 256, 512]
    - [50, 33.77]
  - - [256, 2048, 1, 1024, 256, 256, 256, 1024]
    - [74, 54.52]
  - - [256, 2048, 1, 2048, 256, 256, 256, 2048]
    - [74, 76.45]
  - - [256, 2048, 1, 4096, 256, 256, 256, 4096]
    - [74, 95.87]
  - - [256, 2048, 1, 8192, 256, 256, 256, 8192]
    - [74, 110.49]
  - - [256, 4096, 1, 128, 256, 256, 256, 128]
    - [50, 22.42]
  - - [256, 4096, 1, 256, 256, 256, 256, 256]
    - [44, 39.07]
  - - [256, 4096, 1, 512, 256, 256, 256, 512]
    - [54, 66.05]
  - - [256, 4096, 1, 1024, 256, 256, 256, 1024]
    - [71, 104.46]
  - - [256, 4096, 1, 2048, 256, 256, 256, 2048]
    - [74, 147.41]
  - - [256, 4096, 1, 4096, 256, 256, 256, 4096]
    - [74, 186.25]
  - - [256, 4096, 1, 8192, 256, 256, 256, 8192]
    - [74, 211.18]
  - - [256, 8192, 1, 128, 256, 256, 256, 128]
    - [38, 39.24]
  - - [256, 8192, 1, 256, 256, 256, 256, 256]
    - [27, 69.13]
  - - [256, 8192, 1, 512, 256, 256, 256, 512]
    - [28, 115.43]
  - - [256, 8192, 1, 1024, 256, 256, 256, 1024]
    - [33, 175.44]
  - - [256, 8192, 1, 2048, 256, 256, 256, 2048]
    - [36, 237.83]
  - - [256, 8192, 1, 4096, 256, 256, 256, 4096]
    - [36, 282.3]
  - - [256, 8192, 1, 8192, 256, 256, 256, 8192]
    - [34, 319.47]
  - - [512, 128, 1, 128, 512, 512, 512, 128]
    - [46, 1.48]
  - - [512, 128, 1, 256, 512, 512, 512, 256]
    - [50, 2.64]
  - - [512, 128, 1, 512, 512, 512, 512, 512]
    - [43, 4.49]
  - - [512, 128, 1, 1024, 512, 512, 512, 1024]
    - [43, 6.84]
  - - [512, 128, 1, 2048, 512, 512, 512, 2048]
    - [74, 9.18]
  - - [512, 128, 1, 4096, 512, 512, 512, 4096]
    - [74, 11.31]
  - - [512, 128, 1, 8192, 512, 512, 512, 8192]
    - [74, 12.75]
  - - [512, 256, 1, 128, 512, 512, 512, 128]
    - [10, 2.83]
  - - [512, 256, 1, 256, 512, 512, 512, 256]
    - [54, 5.25]
  - - [512, 256, 1, 512, 512, 512, 512, 512]
    - [54, 8.93]
  - - [512, 256, 1, 1024, 512, 512, 512, 1024]
    - [74, 13.77]
  - - [512, 256, 1, 2048, 512, 512, 512, 2048]
    - [74, 18.62]
  - - [512, 256, 1, 4096, 512, 512, 512, 4096]
    - [74, 22.73]
  - - [512, 256, 1, 8192, 512, 512, 512, 8192]
    - [74, 25.73]
  - - [512, 512, 1, 128, 512, 512, 512, 128]
    - [7, 5.55]
  - - [512, 512, 1, 256, 512, 512, 512, 256]
    - [73, 10.69]
  - - [512, 512, 1, 512, 512, 512, 512, 512]
    - [43, 17.67]
  - - [512, 512, 1, 1024, 512, 512, 512, 1024]
    - [74, 27.15]
  - - [512, 512, 1, 2048, 512, 512, 512, 2048]
    - [74, 37.21]
  - - [512, 512, 1, 4096, 512, 512, 512, 4096]
    - [74, 45.18]
  - - [512, 512, 1, 8192, 512, 512, 512, 8192]
    - [74, 51.4]
  - - [512, 1024, 1, 128, 512, 512, 512, 128]
    - [54, 11.71]
  - - [512, 1024, 1, 256, 512, 512, 512, 256]
    - [70, 20.61]
  - - [512, 1024, 1, 512, 512, 512, 512, 512]
    - [74, 34.62]
  - - [512, 1024, 1, 1024, 512, 512, 512, 1024]
    - [74, 53.09]
  - - [512, 1024, 1, 2048, 512, 512, 512, 2048]
    - [74, 73.33]
  - - [512, 1024, 1, 4096, 512, 512, 512, 4096]
    - [74, 90.26]
  - - [512, 1024, 1, 8192, 512, 512, 512, 8192]
    - [74, 102.3]
  - - [512, 2048, 1, 128, 512, 512, 512, 128]
    - [43, 21.55]
  - - [512, 2048, 1, 256, 512, 512, 512, 256]
    - [73, 39.19]
  - - [512, 2048, 1, 512, 512, 512, 512, 512]
    - [43, 66.87]
  - - [512, 2048, 1, 1024, 512, 512, 512, 1024]
    - [74, 103.81]
  - - [512, 2048, 1, 2048, 512, 512, 512, 2048]
    - [74, 142.4]
  - - [512, 2048, 1, 4096, 512, 512, 512, 4096]
    - [74, 175.06]
  - - [512, 2048, 1, 8192, 512, 512, 512, 8192]
    - [74, 199.85]
  - - [512, 4096, 1, 128, 512, 512, 512, 128]
    - [29, 38.47]
  - - [512, 4096, 1, 256, 512, 512, 512, 256]
    - [32, 68.93]
  - - [512, 4096, 1, 512, 512, 512, 512, 512]
    - [31, 116.91]
  - - [512, 4096, 1, 1024, 512, 512, 512, 1024]
    - [30, 176.74]
  - - [512, 4096, 1, 2048, 512, 512, 512, 2048]
    - [35, 240.46]
  - - [512, 4096, 1, 4096, 512, 512, 512, 4096]
    - [35, 292.59]
  - - [512, 4096, 1, 8192, 512, 512, 512, 8192]
    - [34, 319.85]
  - - [512, 8192, 1, 128, 512, 512, 512, 128]
    - [5, 63.93]
  - - [512, 8192, 1, 256, 512, 512, 512, 256]
    - [23, 112.39]
  - - [512, 8192, 1, 512, 512, 512, 512, 512]
    - [26, 187.42]
  - - [512, 8192, 1, 1024, 512, 512, 512, 1024]
    - [26, 280.67]
  - - [512, 8192, 1, 2048, 512, 512, 512, 2048]
    - [26, 373.74]
  - - [512, 8192, 1, 4096, 512, 512, 512, 4096]
    - [26, 440.96]
  - - [512, 8192, 1, 8192, 512, 512, 512, 8192]
    - [26, 475.53]
  - - [1024, 128, 1, 128, 1024, 1024, 1024, 128]
    - [47, 2.83]
  - - [1024, 128, 1, 256, 1024, 1024, 1024, 256]
    - [48, 5.13]
  - - [1024, 128, 1, 512, 1024, 1024, 1024, 512]
    - [50, 8.86]
  - - [1024, 128, 1, 1024, 1024, 1024, 1024, 1024]
    - [50, 13.43]
  - - [1024, 128, 1, 2048, 1024, 1024, 1024, 2048]
    - [50, 17.76]
  - - [1024, 128, 1, 4096, 1024, 1024, 1024, 4096]
    - [74, 21.44]
  - - [1024, 128, 1, 8192, 1024, 1024, 1024, 8192]
    - [74, 24.24]
  - - [1024, 256, 1, 128, 1024, 1024, 1024, 128]
    - [57, 5.67]
  - - [1024, 256, 1, 256, 1024, 1024, 1024, 256]
    - [52, 10.11]
  - - [1024, 256, 1, 512, 1024, 1024, 1024, 512]
    - [54, 17.29]
  - - [1024, 256, 1, 1024, 1024, 1024, 1024, 1024]
    - [74, 26.2]
  - - [1024, 256, 1, 2048, 1024, 1024, 1024, 2048]
    - [43, 35.61]
  - - [1024, 256, 1, 4096, 1024, 1024, 1024, 4096]
    - [52, 43.1]
  - - [1024, 256, 1, 8192, 1024, 1024, 1024, 8192]
    - [74, 48.62]
  - - [1024, 512, 1, 128, 1024, 1024, 1024, 128]
    - [8, 11.24]
  - - [1024, 512, 1, 256, 1024, 1024, 1024, 256]
    - [54, 20.45]
  - - [1024, 512, 1, 512, 1024, 1024, 1024, 512]
    - [74, 34.43]
  - - [1024, 512, 1, 1024, 1024, 1024, 1024, 1024]
    - [50, 52.45]
  - - [1024, 512, 1, 2048, 1024, 1024, 1024, 2048]
    - [50, 71.47]
  - - [1024, 512, 1, 4096, 1024, 1024, 1024, 4096]
    - [52, 86.45]
  - - [1024, 512, 1, 8192, 1024, 1024, 1024, 8192]
    - [50, 97.91]
  - - [1024, 1024, 1, 128, 1024, 1024, 1024, 128]
    - [41, 21.21]
  - - [1024, 1024, 1, 256, 1024, 1024, 1024, 256]
    - [43, 40.11]
  - - [1024, 1024, 1, 512, 1024, 1024, 1024, 512]
    - [50, 67.54]
  - - [1024, 1024, 1, 1024, 1024, 1024, 1024, 1024]
    - [43, 102.5]
  - - [1024, 1024, 1, 2048, 1024, 1024, 1024, 2048]
    - [52, 139.53]
  - - [1024, 1024, 1, 4096, 1024, 1024, 1024, 4096]
    - [50, 168.99]
  - - [1024, 1024, 1, 8192, 1024, 1024, 1024, 8192]
    - [50, 191.21]
  - - [1024, 2048, 1, 128, 1024, 1024, 1024, 128]
    - [38, 39.35]
  - - [1024, 2048, 1, 256, 1024, 1024, 1024, 256]
    - [28, 70.05]
  - - [1024, 2048, 1, 512, 1024, 1024, 1024, 512]
    - [28, 117.6]
  - - [1024, 2048, 1, 1024, 1024, 1024, 1024, 1024]
    - [34, 176.83]
  - - [1024, 2048, 1, 2048, 1024, 1024, 1024, 2048]
    - [35, 241.09]
  - - [1024, 2048, 1, 4096, 1024, 1024, 1024, 4096]
    - [36, 293.3]
  - - [1024, 2048, 1, 8192, 1024, 1024, 1024, 8192]
    - [35, 327.58]
  - - [1024, 4096, 1, 128, 1024, 1024, 1024, 128]
    - [24, 64.14]
  - - [1024, 4096, 1, 256, 1024, 1024, 1024, 256]
    - [25, 112.2]
  - - [1024, 4096, 1, 512, 1024, 1024, 1024, 512]
    - [25, 186.81]
  - - [1024, 4096, 1, 1024, 1024, 1024, 1024, 1024]
    - [26, 280.78]
  - - [1024, 4096, 1, 2048, 1024, 1024, 1024, 2048]
    - [26, 374.59]
  - - [1024, 4096, 1, 4096, 1024, 1024, 1024, 4096]
    - [26, 442.18]
  - - [1024, 4096, 1, 8192, 1024, 1024, 1024, 8192]
    - [26, 459.95]
  - - [1024, 8192, 1, 128, 1024, 1024, 1024, 128]
    - [21, 93.79]
  - - [1024, 8192, 1, 256, 1024, 1024, 1024, 256]
    - [22, 165.19]
  - - [1024, 8192, 1, 512, 1024, 1024, 1024, 512]
    - [22, 265.23]
  - - [1024, 8192, 1, 1024, 1024, 1024, 1024, 1024]
    - [67, 385.7]
  - - [1024, 8192, 1, 2048, 1024, 1024, 1024, 2048]
    - [65, 491.14]
  - - [1024, 8192, 1, 4096, 1024, 1024, 1024, 4096]
    - [67, 573.8]
  - - [1024, 8192, 1, 8192, 1024, 1024, 1024, 8192]
    - [66, 606.23]
  - - [2048, 128, 1, 128, 2048, 2048, 2048, 128]
    - [9, 5.69]
  - - [2048, 128, 1, 256, 2048, 2048, 2048, 256]
    - [55, 10.24]
  - - [2048, 128, 1, 512, 2048, 2048, 2048, 512]
    - [43, 17.45]
  - - [2048, 128, 1, 1024, 2048, 2048, 2048, 1024]
    - [50, 26.25]
  - - [2048, 128, 1, 2048, 2048, 2048, 2048, 2048]
    - [52, 35.34]
  - - [2048, 128, 1, 4096, 2048, 2048, 2048, 4096]
    - [52, 43.17]
  - - [2048, 128, 1, 8192, 2048, 2048, 2048, 8192]
    - [52, 49.0]
  - - [2048, 256, 1, 128, 2048, 2048, 2048, 128]
    - [42, 10.87]
  - - [2048, 256, 1, 256, 2048, 2048, 2048, 256]
    - [73, 20.14]
  - - [2048, 256, 1, 512, 2048, 2048, 2048, 512]
    - [43, 34.48]
  - - [2048, 256, 1, 1024, 2048, 2048, 2048, 1024]
    - [52, 51.93]
  - - [2048, 256, 1, 2048, 2048, 2048, 2048, 2048]
    - [52, 70.36]
  - - [2048, 256, 1, 4096, 2048, 2048, 2048, 4096]
    - [52, 85.88]
  - - [2048, 256, 1, 8192, 2048, 2048, 2048, 8192]
    - [52, 98.06]
  - - [2048, 512, 1, 128, 2048, 2048, 2048, 128]
    - [43, 22.71]
  - - [2048, 512, 1, 256, 2048, 2048, 2048, 256]
    - [50, 39.42]
  - - [2048, 512, 1, 512, 2048, 2048, 2048, 512]
    - [50, 67.36]
  - - [2048, 512, 1, 1024, 2048, 2048, 2048, 1024]
    - [50, 102.5]
  - - [2048, 512, 1, 2048, 2048, 2048, 2048, 2048]
    - [52, 139.36]
  - - [2048, 512, 1, 4096, 2048, 2048, 2048, 4096]
    - [52, 168.93]
  - - [2048, 512, 1, 8192, 2048, 2048, 2048, 8192]
    - [52, 190.44]
  - - [2048, 1024, 1, 128, 2048, 2048, 2048, 128]
    - [38, 39.34]
  - - [2048, 1024, 1, 256, 2048, 2048, 2048, 256]
    - [27, 70.06]
  - - [2048, 1024, 1, 512, 2048, 2048, 2048, 512]
    - [30, 117.02]
  - - [2048, 1024, 1, 1024, 2048, 2048, 2048, 1024]
    - [33, 177.77]
  - - [2048, 1024, 1, 2048, 2048, 2048, 2048, 2048]
    - [36, 240.35]
  - - [2048, 1024, 1, 4096, 2048, 2048, 2048, 4096]
    - [36, 291.71]
  - - [2048, 1024, 1, 8192, 2048, 2048, 2048, 8192]
    - [36, 325.95]
  - - [2048, 2048, 1, 128, 2048, 2048, 2048, 128]
    - [5, 64.03]
  - - [2048, 2048, 1, 256, 2048, 2048, 2048, 256]
    - [4, 112.66]
  - - [2048, 2048, 1, 512, 2048, 2048, 2048, 512]
    - [26, 189.16]
  - - [2048, 2048, 1, 1024, 2048, 2048, 2048, 1024]
    - [26, 282.5]
  - - [2048, 2048, 1, 2048, 2048, 2048, 2048, 2048]
    - [26, 374.82]
  - - [2048, 2048, 1, 4096, 2048, 2048, 2048, 4096]
    - [25, 444.29]
  - - [2048, 2048, 1, 8192, 2048, 2048, 2048, 8192]
    - [26, 484.66]
  - - [2048, 4096, 1, 128, 2048, 2048, 2048, 128]
    - [2, 94.18]
  - - [2048, 4096, 1, 256, 2048, 2048, 2048, 256]
    - [22, 164.35]
  - - [2048, 4096, 1, 512, 2048, 2048, 2048, 512]
    - [22, 263.98]
  - - [2048, 4096, 1, 1024, 2048, 2048, 2048, 1024]
    - [63, 388.26]
  - - [2048, 4096, 1, 2048, 2048, 2048, 2048, 2048]
    - [65, 507.7]
  - - [2048, 4096, 1, 4096, 2048, 2048, 2048, 4096]
    - [65, 572.29]
  - - [2048, 4096, 1, 8192, 2048, 2048, 2048, 8192]
    - [61, 608.28]
  - - [2048, 8192, 1, 128, 2048, 2048, 2048, 128]
    - [12, 118.93]
  - - [2048, 8192, 1, 256, 2048, 2048, 2048, 256]
    - [13, 213.73]
  - - [2048, 8192, 1, 512, 2048, 2048, 2048, 512]
    - [18, 359.43]
  - - [2048, 8192, 1, 1024, 2048, 2048, 2048, 1024]
    - [17, 538.06]
  - - [2048, 8192, 1, 2048, 2048, 2048, 2048, 2048]
    - [18, 724.08]
  - - [2048, 8192, 1, 4096, 2048, 2048, 2048, 4096]
    - [16, 790.68]
  - - [2048, 8192, 1, 8192, 2048, 2048, 2048, 8192]
    - [59, 798.4]
  - - [4096, 128, 1, 128, 4096, 4096, 4096, 128]
    - [43, 11.56]
  - - [4096, 128, 1, 256, 4096, 4096, 4096, 256]
    - [54, 20.04]
  - - [4096, 128, 1, 512, 4096, 4096, 4096, 512]
    - [43, 33.67]
  - - [4096, 128, 1, 1024, 4096, 4096, 4096, 1024]
    - [51, 51.18]
  - - [4096, 128, 1, 2048, 4096, 4096, 4096, 2048]
    - [52, 69.41]
  - - [4096, 128, 1, 4096, 4096, 4096, 4096, 4096]
    - [50, 85.72]
  - - [4096, 128, 1, 8192, 4096, 4096, 4096, 8192]
    - [50, 94.55]
  - - [4096, 256, 1, 128, 4096, 4096, 4096, 128]
    - [58, 21.43]
  - - [4096, 256, 1, 256, 4096, 4096, 4096, 256]
    - [50, 39.47]
  - - [4096, 256, 1, 512, 4096, 4096, 4096, 512]
    - [50, 65.83]
  - - [4096, 256, 1, 1024, 4096, 4096, 4096, 1024]
    - [52, 100.22]
  - - [4096, 256, 1, 2048, 4096, 4096, 4096, 2048]
    - [52, 137.28]
  - - [4096, 256, 1, 4096, 4096, 4096, 4096, 4096]
    - [52, 167.85]
  - - [4096, 256, 1, 8192, 4096, 4096, 4096, 8192]
    - [50, 183.89]
  - - [4096, 512, 1, 128, 4096, 4096, 4096, 128]
    - [37, 39.32]
  - - [4096, 512, 1, 256, 4096, 4096, 4096, 256]
    - [27, 69.45]
  - - [4096, 512, 1, 512, 4096, 4096, 4096, 512]
    - [27, 117.09]
  - - [4096, 512, 1, 1024, 4096, 4096, 4096, 1024]
    - [30, 174.9]
  - - [4096, 512, 1, 2048, 4096, 4096, 4096, 2048]
    - [36, 239.8]
  - - [4096, 512, 1, 4096, 4096, 4096, 4096, 4096]
    - [36, 292.82]
  - - [4096, 512, 1, 8192, 4096, 4096, 4096, 8192]
    - [36, 321.64]
  - - [4096, 1024, 1, 128, 4096, 4096, 4096, 128]
    - [5, 64.55]
  - - [4096, 1024, 1, 256, 4096, 4096, 4096, 256]
    - [23, 112.89]
  - - [4096, 1024, 1, 512, 4096, 4096, 4096, 512]
    - [26, 189.03]
  - - [4096, 1024, 1, 1024, 4096, 4096, 4096, 1024]
    - [26, 280.4]
  - - [4096, 1024, 1, 2048, 4096, 4096, 4096, 2048]
    - [26, 374.14]
  - - [4096, 1024, 1, 4096, 4096, 4096, 4096, 4096]
    - [26, 445.0]
  - - [4096, 1024, 1, 8192, 4096, 4096, 4096, 8192]
    - [26, 485.38]
  - - [4096, 2048, 1, 128, 4096, 4096, 4096, 128]
    - [69, 94.07]
  - - [4096, 2048, 1, 256, 4096, 4096, 4096, 256]
    - [22, 164.45]
  - - [4096, 2048, 1, 512, 4096, 4096, 4096, 512]
    - [22, 264.41]
  - - [4096, 2048, 1, 1024, 4096, 4096, 4096, 1024]
    - [62, 384.93]
  - - [4096, 2048, 1, 2048, 4096, 4096, 4096, 2048]
    - [65, 497.16]
  - - [4096, 2048, 1, 4096, 4096, 4096, 4096, 4096]
    - [67, 568.5]
  - - [4096, 2048, 1, 8192, 4096, 4096, 4096, 8192]
    - [63, 595.2]
  - - [4096, 4096, 1, 128, 4096, 4096, 4096, 128]
    - [0, 121.4]
  - - [4096, 4096, 1, 256, 4096, 4096, 4096, 256]
    - [17, 216.19]
  - - [4096, 4096, 1, 512, 4096, 4096, 4096, 512]
    - [17, 361.78]
  - - [4096, 4096, 1, 1024, 4096, 4096, 4096, 1024]
    - [17, 544.62]
  - - [4096, 4096, 1, 2048, 4096, 4096, 4096, 2048]
    - [15, 709.47]
  - - [4096, 4096, 1, 4096, 4096, 4096, 4096, 4096]
    - [18, 789.14]
  - - [4096, 4096, 1, 8192, 4096, 4096, 4096, 8192]
    - [59, 800.03]
  - - [4096, 8192, 1, 128, 4096, 4096, 4096, 128]
    - [0, 139.82]
  - - [4096, 8192, 1, 256, 4096, 4096, 4096, 256]
    - [17, 247.39]
  - - [4096, 8192, 1, 512, 4096, 4096, 4096, 512]
    - [17, 411.12]
  - - [4096, 8192, 1, 1024, 4096, 4096, 4096, 1024]
    - [18, 591.8]
  - - [4096, 8192, 1, 2048, 4096, 4096, 4096, 2048]
    - [17, 708.97]
  - - [4096, 8192, 1, 4096, 4096, 4096, 4096, 4096]
    - [59, 757.75]
  - - [4096, 8192, 1, 8192, 4096, 4096, 4096, 8192]
    - [60, 848.22]
  - - [8192, 128, 1, 128, 8192, 8192, 8192, 128]
    - [50, 22.05]
  - - [8192, 128, 1, 256, 8192, 8192, 8192, 256]
    - [48, 37.96]
  - - [8192, 128, 1, 512, 8192, 8192, 8192, 512]
    - [43, 64.61]
  - - [8192, 128, 1, 1024, 8192, 8192, 8192, 1024]
    - [51, 98.85]
  - - [8192, 128, 1, 2048, 8192, 8192, 8192, 2048]
    - [52, 136.42]
  - - [8192, 128, 1, 4096, 8192, 8192, 8192, 4096]
    - [52, 161.52]
  - - [8192, 128, 1, 8192, 8192, 8192, 8192, 8192]
    - [52, 183.03]
  - - [8192, 256, 1, 128, 8192, 8192, 8192, 128]
    - [39, 39.46]
  - - [8192, 256, 1, 256, 8192, 8192, 8192, 256]
    - [27, 68.11]
  - - [8192, 256, 1, 512, 8192, 8192, 8192, 512]
    - [28, 117.03]
  - - [8192, 256, 1, 1024, 8192, 8192, 8192, 1024]
    - [36, 176.36]
  - - [8192, 256, 1, 2048, 8192, 8192, 8192, 2048]
    - [35, 240.23]
  - - [8192, 256, 1, 4096, 8192, 8192, 8192, 4096]
    - [34, 285.17]
  - - [8192, 256, 1, 8192, 8192, 8192, 8192, 8192]
    - [36, 322.85]
  - - [8192, 512, 1, 128, 8192, 8192, 8192, 128]
    - [6, 64.61]
  - - [8192, 512, 1, 256, 8192, 8192, 8192, 256]
    - [23, 112.75]
  - - [8192, 512, 1, 512, 8192, 8192, 8192, 512]
    - [26, 188.99]
  - - [8192, 512, 1, 1024, 8192, 8192, 8192, 1024]
    - [25, 282.08]
  - - [8192, 512, 1, 2048, 8192, 8192, 8192, 2048]
    - [26, 372.5]
  - - [8192, 512, 1, 4096, 8192, 8192, 8192, 4096]
    - [26, 441.35]
  - - [8192, 512, 1, 8192, 8192, 8192, 8192, 8192]
    - [25, 481.11]
  - - [8192, 1024, 1, 128, 8192, 8192, 8192, 128]
    - [3, 93.22]
  - - [8192, 1024, 1, 256, 8192, 8192, 8192, 256]
    - [22, 164.16]
  - - [8192, 1024, 1, 512, 8192, 8192, 8192, 512]
    - [22, 266.11]
  - - [8192, 1024, 1, 1024, 8192, 8192, 8192, 1024]
    - [19, 378.36]
  - - [8192, 1024, 1, 2048, 8192, 8192, 8192, 2048]
    - [20, 484.94]
  - - [8192, 1024, 1, 4096, 8192, 8192, 8192, 4096]
    - [68, 568.94]
  - - [8192, 1024, 1, 8192, 8192, 8192, 8192, 8192]
    - [64, 604.47]
  - - [8192, 2048, 1, 128, 8192, 8192, 8192, 128]
    - [13, 118.26]
  - - [8192, 2048, 1, 256, 8192, 8192, 8192, 256]
    - [17, 213.68]
  - - [8192, 2048, 1, 512, 8192, 8192, 8192, 512]
    - [18, 360.12]
  - - [8192, 2048, 1, 1024, 8192, 8192, 8192, 1024]
    - [17, 534.41]
  - - [8192, 2048, 1, 2048, 8192, 8192, 8192, 2048]
    - [18, 711.53]
  - - [8192, 2048, 1, 4096, 8192, 8192, 8192, 4096]
    - [18, 797.42]
  - - [8192, 2048, 1, 8192, 8192, 8192, 8192, 8192]
    - [18, 792.56]
  - - [8192, 4096, 1, 128, 8192, 8192, 8192, 128]
    - [1, 139.02]
  - - [8192, 4096, 1, 256, 8192, 8192, 8192, 256]
    - [18, 248.2]
  - - [8192, 4096, 1, 512, 8192, 8192, 8192, 512]
    - [14, 405.38]
  - - [8192, 4096, 1, 1024, 8192, 8192, 8192, 1024]
    - [18, 586.93]
  - - [8192, 4096, 1, 2048, 8192, 8192, 8192, 2048]
    - [18, 714.18]
  - - [8192, 4096, 1, 4096, 8192, 8192, 8192, 4096]
    - [18, 764.09]
  - - [8192, 4096, 1, 8192, 8192, 8192, 8192, 8192]
    - [17, 846.24]
  - - [8192, 8192, 1, 128, 8192, 8192, 8192, 128]
    - [14, 154.44]
  - - [8192, 8192, 1, 256, 8192, 8192, 8192, 256]
    - [18, 271.79]
  - - [8192, 8192, 1, 512, 8192, 8192, 8192, 512]
    - [16, 424.92]
  - - [8192, 8192, 1, 1024, 8192, 8192, 8192, 1024]
    - [17, 565.52]
  - - [8192, 8192, 1, 2048, 8192, 8192, 8192, 2048]
    - [17, 688.21]
  - - [8192, 8192, 1, 4096, 8192, 8192, 8192, 4096]
    - [18, 817.42]
  - - [8192, 8192, 1, 8192, 8192, 8192, 8192, 8192]
    - [59, 925.87]
- null
- null
- DeviceEfficiency
- GridBased
