library/src/amd_detail/rocblaslt/src/Tensile/Logic/asm_full/gfx950/GridBased/gfx950_Cijk_Ailk_Bjlk_I8_BH_UserArgs.yaml
- {MinimumRequiredVersion: 4.33.0}
- gfx950
- gfx950
- [Device 75a0]
    SolutionIndex: 0
    SolutionNameMin: Cijk_Ailk_Bjlk_I8_BH_UserArgs_MT512x128x32_MI32x32x1_SN_LDSB0_AFC0_AFEM1_AFEM1_ASEM1_CLR0_CADS0_DTVA0_DTVB0_EPS0_FDSI0_GRPM1_GRVWA16_GRVWB8_GSU0_GSUAMB_GSUC0_GSUWGMRR0_GLS0_ISA950_IU1_K1_LBSPPA0_LBSPPB0_LBSPPM0_LPA0_LPB0_LPM0_LRVW16_LWPMn1_MIAV0_MIWT8_2_MO40_NTn1_NTA0_NTB0_NTC0_NTD0_NTM0_NEPBS0_NLCA1_NLCB1_ONLL1_PGR2_PLR0_PKA1_SIA3_SS1_SU0_SUM0_SUS32_SPO0_SRVW0_SSO0_SVW4_SK3_SKXCCM8_TLDS0_ULSGRO0_USL1_UIOFGRO0_USFGRO0_VSn1_VWA4_VWB2_WSGRA0_WSGRB0_WS64_WG64_4_1_WGM6_WGMXCC1_WGMXCCGn1
    SolutionIndex: 1
    SolutionNameMin: Cijk_Ailk_Bjlk_I8_BH_UserArgs_MT256x256x32_MI32x32x1_SN_LDSB0_AFC0_AFEM1_AFEM1_ASEM1_CLR0_CADS0_DTVA0_DTVB0_EPS0_FDSI0_GRPM1_GRVWA4_GRVWB8_GSU0_GSUAMB_GSUC0_GSUWGMRR0_GLS0_ISA950_IU1_K1_LBSPPA0_LBSPPB0_LBSPPM0_LPA0_LPB0_LPM0_LRVW16_LWPMn1_MIAV0_MIWT4_4_MO40_NTn1_NTA0_NTB0_NTC0_NTD0_NTM0_NEPBS0_NLCA1_NLCB1_ONLL1_PGR2_PLR0_PKA1_SIA3_SS1_SU0_SUM0_SUS32_SPO0_SRVW0_SSO0_SVW4_SK3_SKXCCM8_TLDS0_ULSGRO0_USL1_UIOFGRO0_USFGRO0_VSn1_VWA4_VWB4_WSGRA0_WSGRB0_WS64_WG64_4_1_WGM6_WGMXCC1_WGMXCCGn1
    SolutionIndex: 2
    SolutionNameMin: Cijk_Ailk_Bjlk_I8_BH_UserArgs_MT256x128x64_MI16x16x1_SN_LDSB1_AFC0_AFEM1_AFEM1_ASEM1_CLR1_CADS0_DTVA0_DTVB0_EPS0_FDSI0_GRPM1_GRVWA16_GRVWB4_GSU0_GSUAMB_GSUC0_GSUWGMRR0_GLS0_ISA950_IU1_K1_LBSPPA2048_LBSPPB1024_LBSPPM0_LPA0_LPB32_LPM0_LRVW8_LWPMn1_MIAV0_MIWT8_4_MO40_NTn1_NTA0_NTB0_NTC0_NTD0_NTM0_NEPBS0_NLCA1_NLCB1_ONLL1_PGR2_PLR1_PKA1_SIA3_SS1_SU0_SUM0_SUS64_SPO0_SRVW0_SSO0_SVW8_SK3_SKXCCM8_TLDS0_ULSGRO0_USL1_UIOFGRO0_USFGRO0_VSn1_VWA8_VWB2_WSGRA0_WSGRB0_WS64_WG32_8_1_WGM6_WGMXCC1_WGMXCCGn1
    SolutionIndex: 3
    SolutionNameMin: Cijk_Ailk_Bjlk_I8_BH_UserArgs_MT256x128x64_MI16x16x1_SN_LDSB1_AFC0_AFEM1_AFEM1_ASEM1_CLR1_CADS0_DTVA0_DTVB0_EPS0_FDSI0_GRPM1_GRVWA4_GRVWB8_GSU0_GSUAMB_GSUC0_GSUWGMRR0_GLS0_ISA950_IU1_K1_LBSPPA2048_LBSPPB1024_LBSPPM0_LPA0_LPB64_LPM0_LRVW8_LWPMn1_MIAV0_MIWT8_4_MO40_NTn1_NTA0_NTB0_NTC0_NTD0_NTM0_NEPBS0_NLCA1_NLCB1_ONLL1_PGR2_PLR1_PKA1_SIA3_SS1_SU0_SUM0_SUS64_SPO0_SRVW0_SSO0_SVW8_SK3_SKXCCM8_TLDS0_ULSGRO0_USL1_UIOFGRO0_USFGRO0_VSn1_VWA8_VWB4_WSGRA0_WSGRB0_WS64_WG32_8_1_WGM6_WGMXCC1_WGMXCCGn1
    SolutionIndex: 4
    SolutionNameMin: Cijk_Ailk_Bjlk_I8_BH_UserArgs_MT256x64x64_MI16x16x1_SN_LDSB1_AFC0_AFEM1_AFEM1_ASEM1_CLR1_CADS0_DTVA0_DTVB0_EPS0_FDSI0_GRPM1_GRVWA4_GRVWB4_GSU0_GSUAMB_GSUC0_GSUWGMRR0_GLS0_ISA950_IU1_K1_LBSPPA2048_LBSPPB512_LBSPPM0_LPA0_LPB32_LPM0_LRVW8_LWPMn1_MIAV0_MIWT8_2_MO40_NTn1_NTA0_NTB0_NTC0_NTD0_NTM0_NEPBS0_NLCA1_NLCB1_ONLL1_PGR2_PLR1_PKA1_SIA3_SS1_SU0_SUM0_SUS64_SPO0_SRVW0_SSO0_SVW8_SK3_SKXCCM8_TLDS0_ULSGRO0_USL1_UIOFGRO0_USFGRO0_VSn1_VWA8_VWB2_WSGRA0_WSGRB0_WS64_WG32_8_1_WGM6_WGMXCC1_WGMXCCGn1
    SolutionIndex: 5
    SolutionNameMin: Cijk_Ailk_Bjlk_I8_BH_UserArgs_MT256x64x64_MI16x16x1_SN_LDSB1_AFC0_AFEM1_AFEM1_ASEM1_CLR1_CADS0_DTVA0_DTVB0_EPS0_FDSI0_GRPM1_GRVWA4_GRVWB8_GSU0_GSUAMB_GSUC0_GSUWGMRR0_GLS0_ISA950_IU1_K1_LBSPPA2048_LBSPPB512_LBSPPM0_LPA0_LPB32_LPM0_LRVW8_LWPMn1_MIAV0_MIWT8_2_MO40_NTn1_NTA0_NTB0_NTC0_NTD0_NTM0_NEPBS0_NLCA1_NLCB1_ONLL1_PGR2_PLR1_PKA1_SIA3_SS1_SU0_SUM0_SUS64_SPO0_SRVW0_SSO0_SVW8_SK3_SKXCCM8_TLDS0_ULSGRO0_USL1_UIOFGRO0_USFGRO0_VSn1_VWA8_VWB2_WSGRA0_WSGRB0_WS64_WG32_8_1_WGM6_WGMXCC1_WGMXCCGn1
    SolutionIndex: 6
    SolutionNameMin: Cijk_Ailk_Bjlk_I8_BH_UserArgs_MT128x128x64_MI16x16x1_SN_LDSB1_AFC0_AFEM1_AFEM1_ASEM1_CLR1_CADS0_DTVA0_DTVB0_EPS0_FDSI0_GRPM1_GRVWA4_GRVWB4_GSU0_GSUAMB_GSUC0_GSUWGMRR0_GLS0_ISA950_IU1_K1_LBSPPA1024_LBSPPB1024_LBSPPM0_LPA64_LPB64_LPM0_LRVW8_LWPMn1_MIAV0_MIWT4_4_MO40_NTn1_NTA0_NTB0_NTC0_NTD0_NTM0_NEPBS0_NLCA1_NLCB1_ONLL1_PGR2_PLR1_PKA1_SIA3_SS1_SU0_SUM0_SUS64_SPO0_SRVW0_SSO0_SVW4_SK3_SKXCCM8_TLDS0_ULSGRO0_USL1_UIOFGRO0_USFGRO0_VSn1_VWA4_VWB4_WSGRA0_WSGRB0_WS64_WG32_8_1_WGM6_WGMXCC1_WGMXCCGn1
    SolutionIndex: 7
    SolutionNameMin: Cijk_Ailk_Bjlk_I8_BH_UserArgs_MT128x128x64_MI16x16x1_SN_LDSB1_AFC0_AFEM1_AFEM1_ASEM1_CLR1_CADS0_DTVA0_DTVB0_EPS0_FDSI0_GRPM1_GRVWA8_GRVWB4_GSU0_GSUAMB_GSUC0_GSUWGMRR0_GLS0_ISA950_IU1_K1_LBSPPA1024_LBSPPB1024_LBSPPM0_LPA64_LPB64_LPM0_LRVW8_LWPMn1_MIAV0_MIWT4_4_MO40_NTn1_NTA0_NTB0_NTC0_NTD0_NTM0_NEPBS0_NLCA1_NLCB1_ONLL1_PGR2_PLR1_PKA1_SIA3_SS1_SU0_SUM0_SUS64_SPO0_SRVW0_SSO0_SVW4_SK3_SKXCCM8_TLDS0_ULSGRO0_USL1_UIOFGRO0_USFGRO0_VSn1_VWA4_VWB4_WSGRA0_WSGRB0_WS64_WG32_8_1_WGM6_WGMXCC1_WGMXCCGn1
    SolutionIndex: 8
    SolutionNameMin: Cijk_Ailk_Bjlk_I8_BH_UserArgs_MT128x128x64_MI16x16x1_SN_LDSB1_AFC0_AFEM1_AFEM1_ASEM1_CLR1_CADS0_DTVA0_DTVB0_EPS0_FDSI0_GRPM1_GRVWA4_GRVWB8_GSU0_GSUAMB_GSUC0_GSUWGMRR0_GLS0_ISA950_IU1_K1_LBSPPA1024_LBSPPB1024_LBSPPM0_LPA64_LPB64_LPM0_LRVW8_LWPMn1_MIAV0_MIWT4_4_MO40_NTn1_NTA0_NTB0_NTC0_NTD0_NTM0_NEPBS0_NLCA1_NLCB1_ONLL1_PGR2_PLR1_PKA1_SIA3_SS1_SU0_SUM0_SUS64_SPO0_SRVW0_SSO0_SVW4_SK3_SKXCCM8_TLDS0_ULSGRO0_USL1_UIOFGRO0_USFGRO0_VSn1_VWA4_VWB4_WSGRA0_WSGRB0_WS64_WG32_8_1_WGM6_WGMXCC1_WGMXCCGn1
    SolutionIndex: 9
    SolutionNameMin: Cijk_Ailk_Bjlk_I8_BH_UserArgs_MT128x128x64_MI16x16x1_SN_LDSB1_AFC0_AFEM1_AFEM1_ASEM1_CLR1_CADS0_DTVA0_DTVB0_EPS0_FDSI0_GRPM1_GRVWA4_GRVWB16_GSU0_GSUAMB_GSUC0_GSUWGMRR0_GLS0_ISA950_IU1_K1_LBSPPA1024_LBSPPB1024_LBSPPM0_LPA64_LPB32_LPM0_LRVW8_LWPMn1_MIAV0_MIWT4_4_MO40_NTn1_NTA0_NTB0_NTC0_NTD0_NTM0_NEPBS0_NLCA1_NLCB1_ONLL1_PGR2_PLR1_PKA1_SIA3_SS1_SU0_SUM0_SUS64_SPO0_SRVW0_SSO0_SVW4_SK3_SKXCCM8_TLDS0_ULSGRO0_USL1_UIOFGRO0_USFGRO0_VSn1_VWA4_VWB2_WSGRA0_WSGRB0_WS64_WG32_8_1_WGM6_WGMXCC1_WGMXCCGn1
    SolutionIndex: 10
    SolutionNameMin: Cijk_Ailk_Bjlk_I8_BH_UserArgs_MT128x128x64_MI16x16x1_SN_LDSB1_AFC0_AFEM1_AFEM1_ASEM1_CLR1_CADS0_DTVA0_DTVB0_EPS0_FDSI0_GRPM1_GRVWA8_GRVWB16_GSU0_GSUAMB_GSUC0_GSUWGMRR0_GLS0_ISA950_IU1_K1_LBSPPA1024_LBSPPB1024_LBSPPM0_LPA64_LPB64_LPM0_LRVW8_LWPMn1_MIAV0_MIWT4_4_MO40_NTn1_NTA0_NTB0_NTC0_NTD0_NTM0_NEPBS0_NLCA1_NLCB1_ONLL1_PGR2_PLR1_PKA1_SIA3_SS1_SU0_SUM0_SUS64_SPO0_SRVW0_SSO0_SVW4_SK3_SKXCCM8_TLDS0_ULSGRO0_USL1_UIOFGRO0_USFGRO0_VSn1_VWA4_VWB4_WSGRA0_WSGRB0_WS64_WG32_8_1_WGM6_WGMXCC1_WGMXCCGn1
    SolutionIndex: 11
    SolutionNameMin: Cijk_Ailk_Bjlk_I8_BH_UserArgs_MT128x64x64_MI16x16x1_SN_LDSB0_AFC0_AFEM1_AFEM1_ASEM1_CLR1_CADS0_DTVA0_DTVB0_EPS0_FDSI0_GRPM1_GRVWA4_GRVWB4_GSU0_GSUAMB_GSUC0_GSUWGMRR0_GLS0_ISA950_IU1_K1_LBSPPA1024_LBSPPB512_LBSPPM0_LPA64_LPB32_LPM0_LRVW8_LWPMn1_MIAV0_MIWT4_2_MO40_NTn1_NTA0_NTB0_NTC0_NTD0_NTM0_NEPBS0_NLCA1_NLCB1_ONLL1_PGR2_PLR1_PKA1_SIA3_SS1_SU0_SUM0_SUS64_SPO0_SRVW0_SSO0_SVW4_SK3_SKXCCM8_TLDS0_ULSGRO0_USL1_UIOFGRO0_USFGRO0_VSn1_VWA4_VWB2_WSGRA0_WSGRB0_WS64_WG32_8_1_WGM6_WGMXCC1_WGMXCCGn1
    SolutionIndex: 12
    SolutionNameMin: Cijk_Ailk_Bjlk_I8_BH_UserArgs_MT64x64x64_MI16x16x1_SN_LDSB0_AFC0_AFEM1_AFEM1_ASEM1_CLR1_CADS0_DTVA0_DTVB0_EPS0_FDSI0_GRPM1_GRVWA4_GRVWB4_GSU0_GSUAMB_GSUC0_GSUWGMRR0_GLS0_ISA950_IU1_K1_LBSPPA512_LBSPPB512_LBSPPM0_LPA32_LPB32_LPM0_LRVW8_LWPMn1_MIAV0_MIWT2_2_MO40_NTn1_NTA0_NTB0_NTC0_NTD0_NTM0_NEPBS0_NLCA1_NLCB1_ONLL1_PGR2_PLR1_PKA1_SIA3_SS1_SU0_SUM0_SUS64_SPO0_SRVW0_SSO0_SVW2_SK3_SKXCCM8_TLDS0_ULSGRO0_USL1_UIOFGRO0_USFGRO0_VSn1_VWA2_VWB2_WSGRA0_WSGRB0_WS64_WG32_8_1_WGM6_WGMXCC1_WGMXCCGn1
    SolutionIndex: 13
    SolutionNameMin: Cijk_Ailk_Bjlk_I8_BH_UserArgs_MT64x64x64_MI16x16x1_SN_LDSB0_AFC0_AFEM1_AFEM1_ASEM1_CLR1_CADS0_DTVA0_DTVB0_EPS0_FDSI0_GRPM1_GRVWA16_GRVWB4_GSU0_GSUAMB_GSUC0_GSUWGMRR0_GLS0_ISA950_IU1_K1_LBSPPA512_LBSPPB512_LBSPPM0_LPA32_LPB32_LPM0_LRVW8_LWPMn1_MIAV0_MIWT2_2_MO40_NTn1_NTA0_NTB0_NTC0_NTD0_NTM0_NEPBS0_NLCA1_NLCB1_ONLL1_PGR2_PLR1_PKA1_SIA3_SS1_SU0_SUM0_SUS64_SPO0_SRVW0_SSO0_SVW2_SK3_SKXCCM8_TLDS0_ULSGRO0_USL1_UIOFGRO0_USFGRO0_VSn1_VWA2_VWB2_WSGRA0_WSGRB0_WS64_WG32_8_1_WGM6_WGMXCC1_WGMXCCGn1
    SolutionIndex: 14
    SolutionNameMin: Cijk_Ailk_Bjlk_I8_BH_UserArgs_MT64x64x64_MI16x16x1_SN_LDSB0_AFC0_AFEM1_AFEM1_ASEM1_CLR1_CADS0_DTVA0_DTVB0_EPS0_FDSI0_GRPM1_GRVWA4_GRVWB8_GSU0_GSUAMB_GSUC0_GSUWGMRR0_GLS0_ISA950_IU1_K1_LBSPPA512_LBSPPB512_LBSPPM0_LPA32_LPB32_LPM0_LRVW8_LWPMn1_MIAV0_MIWT2_2_MO40_NTn1_NTA0_NTB0_NTC0_NTD0_NTM0_NEPBS0_NLCA1_NLCB1_ONLL1_PGR2_PLR1_PKA1_SIA3_SS1_SU0_SUM0_SUS64_SPO0_SRVW0_SSO0_SVW2_SK3_SKXCCM8_TLDS0_ULSGRO0_USL1_UIOFGRO0_USFGRO0_VSn1_VWA2_VWB2_WSGRA0_WSGRB0_WS64_WG32_8_1_WGM6_WGMXCC1_WGMXCCGn1
    SolutionIndex: 15
    SolutionNameMin: Cijk_Ailk_Bjlk_I8_BH_UserArgs_MT64x64x64_MI16x16x1_SN_LDSB0_AFC0_AFEM1_AFEM1_ASEM1_CLR0_CADS0_DTVA0_DTVB0_EPS0_FDSI0_GRPM1_GRVWA4_GRVWB4_GSU0_GSUAMB_GSUC0_GSUWGMRR0_GLS0_ISA950_IU1_K1_LBSPPA512_LBSPPB512_LBSPPM0_LPA32_LPB32_LPM0_LRVW8_LWPMn1_MIAV0_MIWT2_2_MO40_NTn1_NTA0_NTB0_NTC0_NTD0_NTM0_NEPBS0_NLCA1_NLCB1_ONLL1_PGR2_PLR0_PKA1_SIA3_SS1_SU0_SUM0_SUS64_SPO0_SRVW0_SSO0_SVW2_SK3_SKXCCM8_TLDS0_ULSGRO0_USL1_UIOFGRO0_USFGRO0_VSn1_VWA2_VWB2_WSGRA0_WSGRB0_WS64_WG32_8_1_WGM6_WGMXCC1_WGMXCCGn1
    SolutionIndex: 16
    SolutionNameMin: Cijk_Ailk_Bjlk_I8_BH_UserArgs_MT512x128x64_MI32x32x1_SN_LDSB0_AFC0_AFEM1_AFEM1_ASEM1_CLR1_CADS0_DTVA0_DTVB0_EPS0_FDSI0_GRPM1_GRVWA16_GRVWB4_GSU0_GSUAMB_GSUC0_GSUWGMRR0_GLS0_ISA950_IU1_K1_LBSPPA0_LBSPPB0_LBSPPM0_LPA0_LPB0_LPM0_LRVW16_LWPMn1_MIAV0_MIWT8_2_MO40_NTn1_NTA0_NTB0_NTC0_NTD0_NTM0_NEPBS0_NLCA1_NLCB1_ONLL1_PGR2_PLR1_PKA1_SIA3_SS1_SU0_SUM0_SUS64_SPO0_SRVW0_SSO0_SVW8_SK3_SKXCCM8_TLDS0_ULSGRO0_USL1_UIOFGRO0_USFGRO0_VSn1_VWA8_VWB2_WSGRA0_WSGRB0_WS64_WG64_4_1_WGM6_WGMXCC1_WGMXCCGn1
    SolutionIndex: 17
    SolutionNameMin: Cijk_Ailk_Bjlk_I8_BH_UserArgs_MT256x256x64_MI32x32x1_SN_LDSB0_AFC0_AFEM1_AFEM1_ASEM1_CLR1_CADS0_DTVA0_DTVB0_EPS0_FDSI0_GRPM1_GRVWA4_GRVWB4_GSU0_GSUAMB_GSUC0_GSUWGMRR0_GLS0_ISA950_IU1_K1_LBSPPA0_LBSPPB0_LBSPPM0_LPA0_LPB0_LPM0_LRVW16_LWPMn1_MIAV0_MIWT4_4_MO40_NTn1_NTA0_NTB0_NTC0_NTD0_NTM0_NEPBS0_NLCA1_NLCB1_ONLL1_PGR2_PLR1_PKA1_SIA3_SS1_SU0_SUM0_SUS64_SPO0_SRVW0_SSO0_SVW4_SK3_SKXCCM8_TLDS0_ULSGRO0_USL1_UIOFGRO0_USFGRO0_VSn1_VWA4_VWB4_WSGRA0_WSGRB0_WS64_WG64_4_1_WGM6_WGMXCC1_WGMXCCGn1
    SolutionIndex: 18
    SolutionNameMin: Cijk_Ailk_Bjlk_I8_BH_UserArgs_MT256x256x64_MI32x32x1_SN_LDSB0_AFC0_AFEM1_AFEM1_ASEM1_CLR1_CADS0_DTVA0_DTVB0_EPS0_FDSI0_GRPM1_GRVWA16_GRVWB4_GSU0_GSUAMB_GSUC0_GSUWGMRR0_GLS0_ISA950_IU1_K1_LBSPPA0_LBSPPB0_LBSPPM0_LPA0_LPB0_LPM0_LRVW16_LWPMn1_MIAV0_MIWT4_4_MO40_NTn1_NTA0_NTB0_NTC0_NTD0_NTM0_NEPBS0_NLCA1_NLCB1_ONLL1_PGR2_PLR1_PKA1_SIA3_SS1_SU0_SUM0_SUS64_SPO0_SRVW0_SSO0_SVW4_SK3_SKXCCM8_TLDS0_ULSGRO0_USL1_UIOFGRO0_USFGRO0_VSn1_VWA4_VWB4_WSGRA0_WSGRB0_WS64_WG64_4_1_WGM6_WGMXCC1_WGMXCCGn1
    SolutionIndex: 19
    SolutionNameMin: Cijk_Ailk_Bjlk_I8_BH_UserArgs_MT256x256x64_MI32x32x1_SN_LDSB0_AFC0_AFEM1_AFEM1_ASEM1_CLR1_CADS0_DTVA0_DTVB0_EPS0_FDSI0_GRPM1_GRVWA4_GRVWB8_GSU0_GSUAMB_GSUC0_GSUWGMRR0_GLS0_ISA950_IU1_K1_LBSPPA0_LBSPPB0_LBSPPM0_LPA0_LPB0_LPM0_LRVW16_LWPMn1_MIAV0_MIWT4_4_MO40_NTn1_NTA0_NTB0_NTC0_NTD0_NTM0_NEPBS0_NLCA1_NLCB1_ONLL1_PGR2_PLR1_PKA1_SIA3_SS1_SU0_SUM0_SUS64_SPO0_SRVW0_SSO0_SVW4_SK3_SKXCCM8_TLDS0_ULSGRO0_USL1_UIOFGRO0_USFGRO0_VSn1_VWA4_VWB4_WSGRA0_WSGRB0_WS64_WG64_4_1_WGM6_WGMXCC1_WGMXCCGn1
    SolutionIndex: 20
    SolutionNameMin: Cijk_Ailk_Bjlk_I8_BH_UserArgs_MT256x256x64_MI32x32x1_SN_LDSB0_AFC0_AFEM1_AFEM1_ASEM1_CLR1_CADS0_DTVA0_DTVB0_EPS0_FDSI0_GRPM1_GRVWA16_GRVWB8_GSU0_GSUAMB_GSUC0_GSUWGMRR0_GLS0_ISA950_IU1_K1_LBSPPA0_LBSPPB0_LBSPPM0_LPA0_LPB0_LPM0_LRVW16_LWPMn1_MIAV0_MIWT4_4_MO40_NTn1_NTA0_NTB0_NTC0_NTD0_NTM0_NEPBS0_NLCA1_NLCB1_ONLL1_PGR2_PLR1_PKA1_SIA3_SS1_SU0_SUM0_SUS64_SPO0_SRVW0_SSO0_SVW4_SK3_SKXCCM8_TLDS0_ULSGRO0_USL1_UIOFGRO0_USFGRO0_VSn1_VWA4_VWB2_WSGRA0_WSGRB0_WS64_WG64_4_1_WGM6_WGMXCC1_WGMXCCGn1
    SolutionIndex: 21
    SolutionNameMin: Cijk_Ailk_Bjlk_I8_BH_UserArgs_MT256x256x64_MI32x32x1_SN_LDSB0_AFC0_AFEM1_AFEM1_ASEM1_CLR1_CADS0_DTVA0_DTVB0_EPS0_FDSI0_GRPM1_GRVWA16_GRVWB8_GSU0_GSUAMB_GSUC0_GSUWGMRR0_GLS0_ISA950_IU1_K1_LBSPPA0_LBSPPB0_LBSPPM0_LPA0_LPB0_LPM0_LRVW16_LWPMn1_MIAV0_MIWT4_4_MO40_NTn1_NTA0_NTB0_NTC0_NTD0_NTM0_NEPBS0_NLCA1_NLCB1_ONLL1_PGR2_PLR1_PKA1_SIA3_SS1_SU0_SUM0_SUS64_SPO0_SRVW0_SSO0_SVW4_SK3_SKXCCM8_TLDS0_ULSGRO0_USL1_UIOFGRO0_USFGRO0_VSn1_VWA4_VWB4_WSGRA0_WSGRB0_WS64_WG64_4_1_WGM6_WGMXCC1_WGMXCCGn1
    SolutionIndex: 22
    SolutionNameMin: Cijk_Ailk_Bjlk_I8_BH_UserArgs_MT256x128x64_MI32x32x1_SN_LDSB1_AFC0_AFEM1_AFEM1_ASEM1_CLR1_CADS0_DTVA0_DTVB0_EPS0_FDSI0_GRPM1_GRVWA4_GRVWB4_GSU0_GSUAMB_GSUC0_GSUWGMRR0_GLS0_ISA950_IU1_K1_LBSPPA0_LBSPPB0_LBSPPM0_LPA0_LPB0_LPM0_LRVW16_LWPMn1_MIAV0_MIWT4_2_MO40_NTn1_NTA0_NTB0_NTC0_NTD0_NTM0_NEPBS0_NLCA1_NLCB1_ONLL1_PGR2_PLR1_PKA1_SIA3_SS1_SU0_SUM0_SUS64_SPO0_SRVW0_SSO0_SVW4_SK3_SKXCCM8_TLDS0_ULSGRO0_USL1_UIOFGRO0_USFGRO0_VSn1_VWA4_VWB2_WSGRA0_WSGRB0_WS64_WG64_4_1_WGM6_WGMXCC1_WGMXCCGn1
    SolutionIndex: 23
    SolutionNameMin: Cijk_Ailk_Bjlk_I8_BH_UserArgs_MT256x128x64_MI32x32x1_SN_LDSB1_AFC0_AFEM1_AFEM1_ASEM1_CLR1_CADS0_DTVA0_DTVB0_EPS0_FDSI0_GRPM1_GRVWA16_GRVWB4_GSU0_GSUAMB_GSUC0_GSUWGMRR0_GLS0_ISA950_IU1_K1_LBSPPA0_LBSPPB0_LBSPPM0_LPA0_LPB0_LPM0_LRVW16_LWPMn1_MIAV0_MIWT4_2_MO40_NTn1_NTA0_NTB0_NTC0_NTD0_NTM0_NEPBS0_NLCA1_NLCB1_ONLL1_PGR2_PLR1_PKA1_SIA3_SS1_SU0_SUM0_SUS64_SPO0_SRVW0_SSO0_SVW4_SK3_SKXCCM8_TLDS0_ULSGRO0_USL1_UIOFGRO0_USFGRO0_VSn1_VWA4_VWB2_WSGRA0_WSGRB0_WS64_WG64_4_1_WGM6_WGMXCC1_WGMXCCGn1
    SolutionIndex: 24
    SolutionNameMin: Cijk_Ailk_Bjlk_I8_BH_UserArgs_MT256x128x64_MI32x32x1_SN_LDSB1_AFC0_AFEM1_AFEM1_ASEM1_CLR1_CADS0_DTVA0_DTVB0_EPS0_FDSI0_GRPM1_GRVWA4_GRVWB8_GSU0_GSUAMB_GSUC0_GSUWGMRR0_GLS0_ISA950_IU1_K1_LBSPPA0_LBSPPB0_LBSPPM0_LPA0_LPB0_LPM0_LRVW16_LWPMn1_MIAV0_MIWT4_2_MO40_NTn1_NTA0_NTB0_NTC0_NTD0_NTM0_NEPBS0_NLCA1_NLCB1_ONLL1_PGR2_PLR1_PKA1_SIA3_SS1_SU0_SUM0_SUS64_SPO0_SRVW0_SSO0_SVW4_SK3_SKXCCM8_TLDS0_ULSGRO0_USL1_UIOFGRO0_USFGRO0_VSn1_VWA4_VWB2_WSGRA0_WSGRB0_WS64_WG64_4_1_WGM6_WGMXCC1_WGMXCCGn1
    SolutionIndex: 25
    SolutionNameMin: Cijk_Ailk_Bjlk_I8_BH_UserArgs_MT256x128x64_MI32x32x1_SN_LDSB1_AFC0_AFEM1_AFEM1_ASEM1_CLR1_CADS0_DTVA0_DTVB0_EPS0_FDSI0_GRPM1_GRVWA16_GRVWB8_GSU0_GSUAMB_GSUC0_GSUWGMRR0_GLS0_ISA950_IU1_K1_LBSPPA0_LBSPPB0_LBSPPM0_LPA0_LPB0_LPM0_LRVW16_LWPMn1_MIAV0_MIWT4_2_MO40_NTn1_NTA0_NTB0_NTC0_NTD0_NTM0_NEPBS0_NLCA1_NLCB1_ONLL1_PGR2_PLR1_PKA1_SIA3_SS1_SU0_SUM0_SUS64_SPO0_SRVW0_SSO0_SVW4_SK3_SKXCCM8_TLDS0_ULSGRO0_USL1_UIOFGRO0_USFGRO0_VSn1_VWA4_VWB2_WSGRA0_WSGRB0_WS64_WG64_4_1_WGM6_WGMXCC1_WGMXCCGn1
    SolutionIndex: 26
    SolutionNameMin: Cijk_Ailk_Bjlk_I8_BH_UserArgs_MT128x256x128_MI16x16x1_SN_LDSB1_AFC0_AFEM1_AFEM1_ASEM1_CLR1_CADS0_DTVA0_DTVB0_EPS0_FDSI0_GRPM1_GRVWA4_GRVWB16_GSU0_GSUAMB_GSUC0_GSUWGMRR0_GLS0_ISA950_IU1_K1_LBSPPA1024_LBSPPB2048_LBSPPM0_LPA64_LPB0_LPM0_LRVW8_LWPMn1_MIAV0_MIWT4_8_MO40_NTn1_NTA0_NTB0_NTC0_NTD0_NTM0_NEPBS0_NLCA1_NLCB1_ONLL1_PGR2_PLR1_PKA1_SIA3_SS1_SU0_SUM0_SUS128_SPO0_SRVW0_SSO0_SVW4_SK3_SKXCCM8_TLDS0_ULSGRO0_USL1_UIOFGRO0_USFGRO0_VSn1_VWA4_VWB8_WSGRA0_WSGRB0_WS64_WG32_8_1_WGM6_WGMXCC1_WGMXCCGn1
    SolutionIndex: 27
    SolutionNameMin: Cijk_Ailk_Bjlk_I8_BH_UserArgs_MT256x128x128_MI16x16x1_SN_LDSB1_AFC0_AFEM1_AFEM1_ASEM1_CLR1_CADS0_DTVA0_DTVB0_EPS0_FDSI0_GRPM1_GRVWA8_GRVWB16_GSU0_GSUAMB_GSUC0_GSUWGMRR0_GLS0_ISA950_IU1_K1_LBSPPA2048_LBSPPB1024_LBSPPM0_LPA0_LPB64_LPM0_LRVW8_LWPMn1_MIAV0_MIWT8_4_MO40_NTn1_NTA0_NTB0_NTC0_NTD0_NTM0_NEPBS0_NLCA1_NLCB1_ONLL1_PGR2_PLR1_PKA1_SIA3_SS1_SU0_SUM0_SUS128_SPO0_SRVW0_SSO0_SVW8_SK3_SKXCCM8_TLDS0_ULSGRO0_USL1_UIOFGRO0_USFGRO0_VSn1_VWA8_VWB4_WSGRA0_WSGRB0_WS64_WG32_8_1_WGM6_WGMXCC1_WGMXCCGn1
    SolutionIndex: 28
    SolutionNameMin: Cijk_Ailk_Bjlk_I8_BH_UserArgs_MT128x128x128_MI16x16x1_SN_LDSB1_AFC0_AFEM1_AFEM1_ASEM1_CLR1_CADS0_DTVA0_DTVB0_EPS0_FDSI0_GRPM1_GRVWA16_GRVWB16_GSU0_GSUAMB_GSUC0_GSUWGMRR0_GLS0_ISA950_IU1_K1_LBSPPA1024_LBSPPB1024_LBSPPM0_LPA64_LPB64_LPM0_LRVW8_LWPMn1_MIAV0_MIWT4_4_MO40_NTn1_NTA0_NTB0_NTC0_NTD0_NTM0_NEPBS0_NLCA1_NLCB1_ONLL1_PGR2_PLR1_PKA1_SIA3_SS1_SU0_SUM0_SUS128_SPO0_SRVW0_SSO0_SVW4_SK3_SKXCCM8_TLDS0_ULSGRO0_USL1_UIOFGRO0_USFGRO0_VSn1_VWA4_VWB4_WSGRA0_WSGRB0_WS64_WG32_8_1_WGM6_WGMXCC1_WGMXCCGn1
    SolutionIndex: 29
    SolutionNameMin: Cijk_Ailk_Bjlk_I8_BH_UserArgs_MT128x128x128_MI16x16x1_SN_LDSB1_AFC0_AFEM1_AFEM1_ASEM1_CLR1_CADS0_DTVA0_DTVB0_EPS0_FDSI0_GRPM1_GRVWA4_GRVWB16_GSU0_GSUAMB_GSUC0_GSUWGMRR0_GLS0_ISA950_IU1_K1_LBSPPA1024_LBSPPB1024_LBSPPM0_LPA64_LPB64_LPM0_LRVW8_LWPMn1_MIAV0_MIWT4_4_MO40_NTn1_NTA0_NTB0_NTC0_NTD0_NTM0_NEPBS0_NLCA1_NLCB1_ONLL1_PGR2_PLR2_PKA1_SIA3_SS1_SU0_SUM0_SUS128_SPO0_SRVW0_SSO0_SVW4_SK3_SKXCCM8_TLDS0_ULSGRO0_USL1_UIOFGRO0_USFGRO0_VSn1_VWA4_VWB4_WSGRA0_WSGRB0_WS64_WG32_8_1_WGM6_WGMXCC1_WGMXCCGn1
    SolutionIndex: 30
    SolutionNameMin: Cijk_Ailk_Bjlk_I8_BH_UserArgs_MT128x128x128_MI16x16x1_SN_LDSB1_AFC0_AFEM1_AFEM1_ASEM1_CLR1_CADS0_DTVA0_DTVB0_EPS0_FDSI0_GRPM1_GRVWA16_GRVWB16_GSU0_GSUAMB_GSUC0_GSUWGMRR0_GLS0_ISA950_IU1_K1_LBSPPA1024_LBSPPB1024_LBSPPM0_LPA64_LPB32_LPM0_LRVW8_LWPMn1_MIAV0_MIWT4_4_MO40_NTn1_NTA0_NTB0_NTC0_NTD0_NTM0_NEPBS0_NLCA1_NLCB1_ONLL1_PGR2_PLR2_PKA1_SIA3_SS1_SU0_SUM0_SUS128_SPO0_SRVW0_SSO0_SVW4_SK3_SKXCCM8_TLDS0_ULSGRO0_USL1_UIOFGRO0_USFGRO0_VSn1_VWA4_VWB2_WSGRA0_WSGRB0_WS64_WG32_8_1_WGM6_WGMXCC1_WGMXCCGn1
    SolutionIndex: 31
    SolutionNameMin: Cijk_Ailk_Bjlk_I8_BH_UserArgs_MT128x128x128_MI16x16x1_SN_LDSB1_AFC0_AFEM1_AFEM1_ASEM1_CLR1_CADS0_DTVA0_DTVB0_EPS0_FDSI0_GRPM1_GRVWA16_GRVWB16_GSU0_GSUAMB_GSUC0_GSUWGMRR0_GLS0_ISA950_IU1_K1_LBSPPA1024_LBSPPB1024_LBSPPM0_LPA64_LPB64_LPM0_LRVW8_LWPMn1_MIAV0_MIWT4_4_MO40_NTn1_NTA0_NTB0_NTC0_NTD0_NTM0_NEPBS0_NLCA1_NLCB1_ONLL1_PGR2_PLR2_PKA1_SIA3_SS1_SU0_SUM0_SUS128_SPO0_SRVW0_SSO0_SVW4_SK3_SKXCCM8_TLDS0_ULSGRO0_USL1_UIOFGRO0_USFGRO0_VSn1_VWA4_VWB4_WSGRA0_WSGRB0_WS64_WG32_8_1_WGM6_WGMXCC1_WGMXCCGn1
    SolutionIndex: 32
    SolutionNameMin: Cijk_Ailk_Bjlk_I8_BH_UserArgs_MT64x128x128_MI16x16x1_SN_LDSB1_AFC0_AFEM1_AFEM1_ASEM1_CLR1_CADS0_DTVA0_DTVB0_EPS0_FDSI0_GRPM1_GRVWA4_GRVWB16_GSU0_GSUAMB_GSUC0_GSUWGMRR0_GLS0_ISA950_IU1_K1_LBSPPA512_LBSPPB1024_LBSPPM0_LPA32_LPB64_LPM0_LRVW8_LWPMn1_MIAV0_MIWT2_4_MO40_NTn1_NTA0_NTB0_NTC0_NTD0_NTM0_NEPBS0_NLCA1_NLCB1_ONLL1_PGR2_PLR1_PKA1_SIA3_SS1_SU0_SUM0_SUS128_SPO0_SRVW0_SSO0_SVW2_SK3_SKXCCM8_TLDS0_ULSGRO0_USL1_UIOFGRO0_USFGRO0_VSn1_VWA2_VWB4_WSGRA0_WSGRB0_WS64_WG32_8_1_WGM6_WGMXCC1_WGMXCCGn1
    SolutionIndex: 33
    SolutionNameMin: Cijk_Ailk_Bjlk_I8_BH_UserArgs_MT64x128x128_MI16x16x1_SN_LDSB1_AFC0_AFEM1_AFEM1_ASEM1_CLR1_CADS0_DTVA0_DTVB0_EPS0_FDSI0_GRPM1_GRVWA4_GRVWB16_GSU0_GSUAMB_GSUC0_GSUWGMRR0_GLS0_ISA950_IU1_K1_LBSPPA512_LBSPPB1024_LBSPPM0_LPA32_LPB64_LPM0_LRVW8_LWPMn1_MIAV0_MIWT2_4_MO40_NTn1_NTA0_NTB0_NTC0_NTD0_NTM0_NEPBS0_NLCA1_NLCB1_ONLL1_PGR2_PLR2_PKA1_SIA3_SS1_SU0_SUM0_SUS128_SPO0_SRVW0_SSO0_SVW2_SK3_SKXCCM8_TLDS0_ULSGRO0_USL1_UIOFGRO0_USFGRO0_VSn1_VWA2_VWB4_WSGRA0_WSGRB0_WS64_WG32_8_1_WGM6_WGMXCC1_WGMXCCGn1
    SolutionIndex: 34
    SolutionNameMin: Cijk_Ailk_Bjlk_I8_BH_UserArgs_MT64x128x128_MI16x16x1_SN_LDSB1_AFC0_AFEM1_AFEM1_ASEM1_CLR1_CADS0_DTVA0_DTVB0_EPS0_FDSI0_GRPM1_GRVWA8_GRVWB16_GSU0_GSUAMB_GSUC0_GSUWGMRR0_GLS0_ISA950_IU1_K1_LBSPPA512_LBSPPB1024_LBSPPM0_LPA32_LPB64_LPM0_LRVW8_LWPMn1_MIAV0_MIWT2_4_MO40_NTn1_NTA0_NTB0_NTC0_NTD0_NTM0_NEPBS0_NLCA1_NLCB1_ONLL1_PGR2_PLR2_PKA1_SIA3_SS1_SU0_SUM0_SUS128_SPO0_SRVW0_SSO0_SVW2_SK3_SKXCCM8_TLDS0_ULSGRO0_USL1_UIOFGRO0_USFGRO0_VSn1_VWA2_VWB4_WSGRA0_WSGRB0_WS64_WG32_8_1_WGM6_WGMXCC1_WGMXCCGn1
    SolutionIndex: 35
    SolutionNameMin: Cijk_Ailk_Bjlk_I8_BH_UserArgs_MT64x128x128_MI16x16x1_SN_LDSB1_AFC0_AFEM1_AFEM1_ASEM1_CLR1_CADS0_DTVA0_DTVB0_EPS0_FDSI0_GRPM1_GRVWA16_GRVWB16_GSU0_GSUAMB_GSUC0_GSUWGMRR0_GLS0_ISA950_IU1_K1_LBSPPA512_LBSPPB1024_LBSPPM0_LPA32_LPB64_LPM0_LRVW8_LWPMn1_MIAV0_MIWT2_4_MO40_NTn1_NTA0_NTB0_NTC0_NTD0_NTM0_NEPBS0_NLCA1_NLCB1_ONLL1_PGR2_PLR2_PKA1_SIA3_SS1_SU0_SUM0_SUS128_SPO0_SRVW0_SSO0_SVW2_SK3_SKXCCM8_TLDS0_ULSGRO0_USL1_UIOFGRO0_USFGRO0_VSn1_VWA2_VWB4_WSGRA0_WSGRB0_WS64_WG32_8_1_WGM6_WGMXCC1_WGMXCCGn1
    SolutionIndex: 36
    SolutionNameMin: Cijk_Ailk_Bjlk_I8_BH_UserArgs_MT128x64x128_MI16x16x1_SN_LDSB1_AFC0_AFEM1_AFEM1_ASEM1_CLR1_CADS0_DTVA0_DTVB0_EPS0_FDSI0_GRPM1_GRVWA4_GRVWB4_GSU0_GSUAMB_GSUC0_GSUWGMRR0_GLS0_ISA950_IU1_K1_LBSPPA1024_LBSPPB512_LBSPPM0_LPA64_LPB32_LPM0_LRVW8_LWPMn1_MIAV0_MIWT4_2_MO40_NTn1_NTA0_NTB0_NTC0_NTD0_NTM0_NEPBS0_NLCA1_NLCB1_ONLL1_PGR2_PLR2_PKA1_SIA3_SS1_SU0_SUM0_SUS128_SPO0_SRVW0_SSO0_SVW4_SK3_SKXCCM8_TLDS0_ULSGRO0_USL1_UIOFGRO0_USFGRO0_VSn1_VWA4_VWB2_WSGRA0_WSGRB0_WS64_WG32_8_1_WGM6_WGMXCC1_WGMXCCGn1
    SolutionIndex: 37
    SolutionNameMin: Cijk_Ailk_Bjlk_I8_BH_UserArgs_MT128x64x128_MI16x16x1_SN_LDSB1_AFC0_AFEM1_AFEM1_ASEM1_CLR1_CADS0_DTVA0_DTVB0_EPS0_FDSI0_GRPM1_GRVWA8_GRVWB4_GSU0_GSUAMB_GSUC0_GSUWGMRR0_GLS0_ISA950_IU1_K1_LBSPPA1024_LBSPPB512_LBSPPM0_LPA64_LPB32_LPM0_LRVW8_LWPMn1_MIAV0_MIWT4_2_MO40_NTn1_NTA0_NTB0_NTC0_NTD0_NTM0_NEPBS0_NLCA1_NLCB1_ONLL1_PGR2_PLR2_PKA1_SIA3_SS1_SU0_SUM0_SUS128_SPO0_SRVW0_SSO0_SVW4_SK3_SKXCCM8_TLDS0_ULSGRO0_USL1_UIOFGRO0_USFGRO0_VSn1_VWA4_VWB2_WSGRA0_WSGRB0_WS64_WG32_8_1_WGM6_WGMXCC1_WGMXCCGn1
    SolutionIndex: 38
    SolutionNameMin: Cijk_Ailk_Bjlk_I8_BH_UserArgs_MT128x64x128_MI16x16x1_SN_LDSB1_AFC0_AFEM1_AFEM1_ASEM1_CLR1_CADS0_DTVA0_DTVB0_EPS0_FDSI0_GRPM1_GRVWA4_GRVWB8_GSU0_GSUAMB_GSUC0_GSUWGMRR0_GLS0_ISA950_IU1_K1_LBSPPA1024_LBSPPB512_LBSPPM0_LPA64_LPB32_LPM0_LRVW8_LWPMn1_MIAV0_MIWT4_2_MO40_NTn1_NTA0_NTB0_NTC0_NTD0_NTM0_NEPBS0_NLCA1_NLCB1_ONLL1_PGR2_PLR2_PKA1_SIA3_SS1_SU0_SUM0_SUS128_SPO0_SRVW0_SSO0_SVW4_SK3_SKXCCM8_TLDS0_ULSGRO0_USL1_UIOFGRO0_USFGRO0_VSn1_VWA4_VWB2_WSGRA0_WSGRB0_WS64_WG32_8_1_WGM6_WGMXCC1_WGMXCCGn1
    SolutionIndex: 39
    SolutionNameMin: Cijk_Ailk_Bjlk_I8_BH_UserArgs_MT128x64x128_MI16x16x1_SN_LDSB1_AFC0_AFEM1_AFEM1_ASEM1_CLR1_CADS0_DTVA0_DTVB0_EPS0_FDSI0_GRPM1_GRVWA16_GRVWB8_GSU0_GSUAMB_GSUC0_GSUWGMRR0_GLS0_ISA950_IU1_K1_LBSPPA1024_LBSPPB512_LBSPPM0_LPA64_LPB32_LPM0_LRVW8_LWPMn1_MIAV0_MIWT4_2_MO40_NTn1_NTA0_NTB0_NTC0_NTD0_NTM0_NEPBS0_NLCA1_NLCB1_ONLL1_PGR2_PLR2_PKA1_SIA3_SS1_SU0_SUM0_SUS128_SPO0_SRVW0_SSO0_SVW4_SK3_SKXCCM8_TLDS0_ULSGRO0_USL1_UIOFGRO0_USFGRO0_VSn1_VWA4_VWB2_WSGRA0_WSGRB0_WS64_WG32_8_1_WGM6_WGMXCC1_WGMXCCGn1
    SolutionIndex: 40
    SolutionNameMin: Cijk_Ailk_Bjlk_I8_BH_UserArgs_MT128x64x128_MI16x16x1_SN_LDSB1_AFC0_AFEM1_AFEM1_ASEM1_CLR1_CADS0_DTVA0_DTVB0_EPS0_FDSI0_GRPM1_GRVWA16_GRVWB16_GSU0_GSUAMB_GSUC0_GSUWGMRR0_GLS0_ISA950_IU1_K1_LBSPPA1024_LBSPPB512_LBSPPM0_LPA64_LPB32_LPM0_LRVW8_LWPMn1_MIAV0_MIWT4_2_MO40_NTn1_NTA0_NTB0_NTC0_NTD0_NTM0_NEPBS0_NLCA1_NLCB1_ONLL1_PGR2_PLR2_PKA1_SIA3_SS1_SU0_SUM0_SUS128_SPO0_SRVW0_SSO0_SVW4_SK3_SKXCCM8_TLDS0_ULSGRO0_USL1_UIOFGRO0_USFGRO0_VSn1_VWA4_VWB2_WSGRA0_WSGRB0_WS64_WG32_8_1_WGM6_WGMXCC1_WGMXCCGn1
    SolutionIndex: 41
    SolutionNameMin: Cijk_Ailk_Bjlk_I8_BH_UserArgs_MT64x64x128_MI16x16x1_SN_LDSB1_AFC0_AFEM1_AFEM1_ASEM1_CLR1_CADS0_DTVA0_DTVB0_EPS0_FDSI0_GRPM1_GRVWA4_GRVWB4_GSU0_GSUAMB_GSUC0_GSUWGMRR0_GLS0_ISA950_IU1_K1_LBSPPA512_LBSPPB512_LBSPPM0_LPA32_LPB32_LPM0_LRVW8_LWPMn1_MIAV0_MIWT2_2_MO40_NTn1_NTA0_NTB0_NTC0_NTD0_NTM0_NEPBS0_NLCA1_NLCB1_ONLL1_PGR2_PLR1_PKA1_SIA3_SS1_SU0_SUM0_SUS128_SPO0_SRVW0_SSO0_SVW2_SK3_SKXCCM8_TLDS0_ULSGRO0_USL1_UIOFGRO0_USFGRO0_VSn1_VWA2_VWB2_WSGRA0_WSGRB0_WS64_WG32_8_1_WGM6_WGMXCC1_WGMXCCGn1
    SolutionIndex: 42
    SolutionNameMin: Cijk_Ailk_Bjlk_I8_BH_UserArgs_MT64x64x128_MI16x16x1_SN_LDSB1_AFC0_AFEM1_AFEM1_ASEM1_CLR1_CADS0_DTVA0_DTVB0_EPS0_FDSI0_GRPM1_GRVWA8_GRVWB4_GSU0_GSUAMB_GSUC0_GSUWGMRR0_GLS0_ISA950_IU1_K1_LBSPPA512_LBSPPB512_LBSPPM0_LPA32_LPB32_LPM0_LRVW8_LWPMn1_MIAV0_MIWT2_2_MO40_NTn1_NTA0_NTB0_NTC0_NTD0_NTM0_NEPBS0_NLCA1_NLCB1_ONLL1_PGR2_PLR1_PKA1_SIA3_SS1_SU0_SUM0_SUS128_SPO0_SRVW0_SSO0_SVW2_SK3_SKXCCM8_TLDS0_ULSGRO0_USL1_UIOFGRO0_USFGRO0_VSn1_VWA2_VWB2_WSGRA0_WSGRB0_WS64_WG32_8_1_WGM6_WGMXCC1_WGMXCCGn1
    SolutionIndex: 43
    SolutionNameMin: Cijk_Ailk_Bjlk_I8_BH_UserArgs_MT64x64x128_MI16x16x1_SN_LDSB1_AFC0_AFEM1_AFEM1_ASEM1_CLR1_CADS0_DTVA0_DTVB0_EPS0_FDSI0_GRPM1_GRVWA16_GRVWB4_GSU0_GSUAMB_GSUC0_GSUWGMRR0_GLS0_ISA950_IU1_K1_LBSPPA512_LBSPPB512_LBSPPM0_LPA32_LPB32_LPM0_LRVW8_LWPMn1_MIAV0_MIWT2_2_MO40_NTn1_NTA0_NTB0_NTC0_NTD0_NTM0_NEPBS0_NLCA1_NLCB1_ONLL1_PGR2_PLR1_PKA1_SIA3_SS1_SU0_SUM0_SUS128_SPO0_SRVW0_SSO0_SVW2_SK3_SKXCCM8_TLDS0_ULSGRO0_USL1_UIOFGRO0_USFGRO0_VSn1_VWA2_VWB2_WSGRA0_WSGRB0_WS64_WG32_8_1_WGM6_WGMXCC1_WGMXCCGn1
    SolutionIndex: 44
    SolutionNameMin: Cijk_Ailk_Bjlk_I8_BH_UserArgs_MT64x64x128_MI16x16x1_SN_LDSB1_AFC0_AFEM1_AFEM1_ASEM1_CLR1_CADS0_DTVA0_DTVB0_EPS0_FDSI0_GRPM1_GRVWA4_GRVWB8_GSU0_GSUAMB_GSUC0_GSUWGMRR0_GLS0_ISA950_IU1_K1_LBSPPA512_LBSPPB512_LBSPPM0_LPA32_LPB32_LPM0_LRVW8_LWPMn1_MIAV0_MIWT2_2_MO40_NTn1_NTA0_NTB0_NTC0_NTD0_NTM0_NEPBS0_NLCA1_NLCB1_ONLL1_PGR2_PLR1_PKA1_SIA3_SS1_SU0_SUM0_SUS128_SPO0_SRVW0_SSO0_SVW2_SK3_SKXCCM8_TLDS0_ULSGRO0_USL1_UIOFGRO0_USFGRO0_VSn1_VWA2_VWB2_WSGRA0_WSGRB0_WS64_WG32_8_1_WGM6_WGMXCC1_WGMXCCGn1
    SolutionIndex: 45
    SolutionNameMin: Cijk_Ailk_Bjlk_I8_BH_UserArgs_MT64x64x128_MI16x16x1_SN_LDSB1_AFC0_AFEM1_AFEM1_ASEM1_CLR1_CADS0_DTVA0_DTVB0_EPS0_FDSI0_GRPM1_GRVWA8_GRVWB8_GSU0_GSUAMB_GSUC0_GSUWGMRR0_GLS0_ISA950_IU1_K1_LBSPPA512_LBSPPB512_LBSPPM0_LPA32_LPB32_LPM0_LRVW8_LWPMn1_MIAV0_MIWT2_2_MO40_NTn1_NTA0_NTB0_NTC0_NTD0_NTM0_NEPBS0_NLCA1_NLCB1_ONLL1_PGR2_PLR1_PKA1_SIA3_SS1_SU0_SUM0_SUS128_SPO0_SRVW0_SSO0_SVW2_SK3_SKXCCM8_TLDS0_ULSGRO0_USL1_UIOFGRO0_USFGRO0_VSn1_VWA2_VWB2_WSGRA0_WSGRB0_WS64_WG32_8_1_WGM6_WGMXCC1_WGMXCCGn1
    SolutionIndex: 46
    SolutionNameMin: Cijk_Ailk_Bjlk_I8_BH_UserArgs_MT64x64x128_MI16x16x1_SN_LDSB1_AFC0_AFEM1_AFEM1_ASEM1_CLR1_CADS0_DTVA0_DTVB0_EPS0_FDSI0_GRPM1_GRVWA4_GRVWB16_GSU0_GSUAMB_GSUC0_GSUWGMRR0_GLS0_ISA950_IU1_K1_LBSPPA512_LBSPPB512_LBSPPM0_LPA32_LPB32_LPM0_LRVW8_LWPMn1_MIAV0_MIWT2_2_MO40_NTn1_NTA0_NTB0_NTC0_NTD0_NTM0_NEPBS0_NLCA1_NLCB1_ONLL1_PGR2_PLR1_PKA1_SIA3_SS1_SU0_SUM0_SUS128_SPO0_SRVW0_SSO0_SVW2_SK3_SKXCCM8_TLDS0_ULSGRO0_USL1_UIOFGRO0_USFGRO0_VSn1_VWA2_VWB2_WSGRA0_WSGRB0_WS64_WG32_8_1_WGM6_WGMXCC1_WGMXCCGn1
    SolutionIndex: 47
    SolutionNameMin: Cijk_Ailk_Bjlk_I8_BH_UserArgs_MT64x64x128_MI16x16x1_SN_LDSB1_AFC0_AFEM1_AFEM1_ASEM1_CLR1_CADS0_DTVA0_DTVB0_EPS0_FDSI0_GRPM1_GRVWA4_GRVWB4_GSU0_GSUAMB_GSUC0_GSUWGMRR0_GLS0_ISA950_IU1_K1_LBSPPA512_LBSPPB512_LBSPPM0_LPA32_LPB32_LPM0_LRVW8_LWPMn1_MIAV0_MIWT2_2_MO40_NTn1_NTA0_NTB0_NTC0_NTD0_NTM0_NEPBS0_NLCA1_NLCB1_ONLL1_PGR2_PLR2_PKA1_SIA3_SS1_SU0_SUM0_SUS128_SPO0_SRVW0_SSO0_SVW2_SK3_SKXCCM8_TLDS0_ULSGRO0_USL1_UIOFGRO0_USFGRO0_VSn1_VWA2_VWB2_WSGRA0_WSGRB0_WS64_WG32_8_1_WGM6_WGMXCC1_WGMXCCGn1
    SolutionIndex: 48
    SolutionNameMin: Cijk_Ailk_Bjlk_I8_BH_UserArgs_MT64x64x128_MI16x16x1_SN_LDSB1_AFC0_AFEM1_AFEM1_ASEM1_CLR1_CADS0_DTVA0_DTVB0_EPS0_FDSI0_GRPM1_GRVWA8_GRVWB4_GSU0_GSUAMB_GSUC0_GSUWGMRR0_GLS0_ISA950_IU1_K1_LBSPPA512_LBSPPB512_LBSPPM0_LPA32_LPB32_LPM0_LRVW8_LWPMn1_MIAV0_MIWT2_2_MO40_NTn1_NTA0_NTB0_NTC0_NTD0_NTM0_NEPBS0_NLCA1_NLCB1_ONLL1_PGR2_PLR2_PKA1_SIA3_SS1_SU0_SUM0_SUS128_SPO0_SRVW0_SSO0_SVW2_SK3_SKXCCM8_TLDS0_ULSGRO0_USL1_UIOFGRO0_USFGRO0_VSn1_VWA2_VWB2_WSGRA0_WSGRB0_WS64_WG32_8_1_WGM6_WGMXCC1_WGMXCCGn1
    SolutionIndex: 49
    SolutionNameMin: Cijk_Ailk_Bjlk_I8_BH_UserArgs_MT64x64x128_MI16x16x1_SN_LDSB1_AFC0_AFEM1_AFEM1_ASEM1_CLR1_CADS0_DTVA0_DTVB0_EPS0_FDSI0_GRPM1_GRVWA4_GRVWB8_GSU0_GSUAMB_GSUC0_GSUWGMRR0_GLS0_ISA950_IU1_K1_LBSPPA512_LBSPPB512_LBSPPM0_LPA32_LPB32_LPM0_LRVW8_LWPMn1_MIAV0_MIWT2_2_MO40_NTn1_NTA0_NTB0_NTC0_NTD0_NTM0_NEPBS0_NLCA1_NLCB1_ONLL1_PGR2_PLR2_PKA1_SIA3_SS1_SU0_SUM0_SUS128_SPO0_SRVW0_SSO0_SVW2_SK3_SKXCCM8_TLDS0_ULSGRO0_USL1_UIOFGRO0_USFGRO0_VSn1_VWA2_VWB2_WSGRA0_WSGRB0_WS64_WG32_8_1_WGM6_WGMXCC1_WGMXCCGn1
    SolutionIndex: 50
    SolutionNameMin: Cijk_Ailk_Bjlk_I8_BH_UserArgs_MT64x64x128_MI16x16x1_SN_LDSB1_AFC0_AFEM1_AFEM1_ASEM1_CLR1_CADS0_DTVA0_DTVB0_EPS0_FDSI0_GRPM1_GRVWA8_GRVWB8_GSU0_GSUAMB_GSUC0_GSUWGMRR0_GLS0_ISA950_IU1_K1_LBSPPA512_LBSPPB512_LBSPPM0_LPA32_LPB32_LPM0_LRVW8_LWPMn1_MIAV0_MIWT2_2_MO40_NTn1_NTA0_NTB0_NTC0_NTD0_NTM0_NEPBS0_NLCA1_NLCB1_ONLL1_PGR2_PLR2_PKA1_SIA3_SS1_SU0_SUM0_SUS128_SPO0_SRVW0_SSO0_SVW2_SK3_SKXCCM8_TLDS0_ULSGRO0_USL1_UIOFGRO0_USFGRO0_VSn1_VWA2_VWB2_WSGRA0_WSGRB0_WS64_WG32_8_1_WGM6_WGMXCC1_WGMXCCGn1
    SolutionIndex: 51
    SolutionNameMin: Cijk_Ailk_Bjlk_I8_BH_UserArgs_MT64x64x128_MI16x16x1_SN_LDSB1_AFC0_AFEM1_AFEM1_ASEM1_CLR1_CADS0_DTVA0_DTVB0_EPS0_FDSI0_GRPM1_GRVWA16_GRVWB8_GSU0_GSUAMB_GSUC0_GSUWGMRR0_GLS0_ISA950_IU1_K1_LBSPPA512_LBSPPB512_LBSPPM0_LPA32_LPB32_LPM0_LRVW8_LWPMn1_MIAV0_MIWT2_2_MO40_NTn1_NTA0_NTB0_NTC0_NTD0_NTM0_NEPBS0_NLCA1_NLCB1_ONLL1_PGR2_PLR2_PKA1_SIA3_SS1_SU0_SUM0_SUS128_SPO0_SRVW0_SSO0_SVW2_SK3_SKXCCM8_TLDS0_ULSGRO0_USL1_UIOFGRO0_USFGRO0_VSn1_VWA2_VWB2_WSGRA0_WSGRB0_WS64_WG32_8_1_WGM6_WGMXCC1_WGMXCCGn1
    SolutionIndex: 52
    SolutionNameMin: Cijk_Ailk_Bjlk_I8_BH_UserArgs_MT64x64x128_MI16x16x1_SN_LDSB1_AFC0_AFEM1_AFEM1_ASEM1_CLR1_CADS0_DTVA0_DTVB0_EPS0_FDSI0_GRPM1_GRVWA4_GRVWB16_GSU0_GSUAMB_GSUC0_GSUWGMRR0_GLS0_ISA950_IU1_K1_LBSPPA512_LBSPPB512_LBSPPM0_LPA32_LPB32_LPM0_LRVW8_LWPMn1_MIAV0_MIWT2_2_MO40_NTn1_NTA0_NTB0_NTC0_NTD0_NTM0_NEPBS0_NLCA1_NLCB1_ONLL1_PGR2_PLR2_PKA1_SIA3_SS1_SU0_SUM0_SUS128_SPO0_SRVW0_SSO0_SVW2_SK3_SKXCCM8_TLDS0_ULSGRO0_USL1_UIOFGRO0_USFGRO0_VSn1_VWA2_VWB2_WSGRA0_WSGRB0_WS64_WG32_8_1_WGM6_WGMXCC1_WGMXCCGn1
    SolutionIndex: 53
    SolutionNameMin: Cijk_Ailk_Bjlk_I8_BH_UserArgs_MT64x64x128_MI16x16x1_SN_LDSB1_AFC0_AFEM1_AFEM1_ASEM1_CLR1_CADS0_DTVA0_DTVB0_EPS0_FDSI0_GRPM1_GRVWA8_GRVWB16_GSU0_GSUAMB_GSUC0_GSUWGMRR0_GLS0_ISA950_IU1_K1_LBSPPA512_LBSPPB512_LBSPPM0_LPA32_LPB32_LPM0_LRVW8_LWPMn1_MIAV0_MIWT2_2_MO40_NTn1_NTA0_NTB0_NTC0_NTD0_NTM0_NEPBS0_NLCA1_NLCB1_ONLL1_PGR2_PLR2_PKA1_SIA3_SS1_SU0_SUM0_SUS128_SPO0_SRVW0_SSO0_SVW2_SK3_SKXCCM8_TLDS0_ULSGRO0_USL1_UIOFGRO0_USFGRO0_VSn1_VWA2_VWB2_WSGRA0_WSGRB0_WS64_WG32_8_1_WGM6_WGMXCC1_WGMXCCGn1
    SolutionIndex: 54
    SolutionNameMin: Cijk_Ailk_Bjlk_I8_BH_UserArgs_MT64x64x128_MI16x16x1_SN_LDSB1_AFC0_AFEM1_AFEM1_ASEM1_CLR1_CADS0_DTVA0_DTVB0_EPS0_FDSI0_GRPM1_GRVWA16_GRVWB16_GSU0_GSUAMB_GSUC0_GSUWGMRR0_GLS0_ISA950_IU1_K1_LBSPPA512_LBSPPB512_LBSPPM0_LPA32_LPB32_LPM0_LRVW8_LWPMn1_MIAV0_MIWT2_2_MO40_NTn1_NTA0_NTB0_NTC0_NTD0_NTM0_NEPBS0_NLCA1_NLCB1_ONLL1_PGR2_PLR2_PKA1_SIA3_SS1_SU0_SUM0_SUS128_SPO0_SRVW0_SSO0_SVW2_SK3_SKXCCM8_TLDS0_ULSGRO0_USL1_UIOFGRO0_USFGRO0_VSn1_VWA2_VWB2_WSGRA0_WSGRB0_WS64_WG32_8_1_WGM6_WGMXCC1_WGMXCCGn1
    SolutionIndex: 55
    SolutionNameMin: Cijk_Ailk_Bjlk_I8_BH_UserArgs_MT64x64x256_MI16x16x1_SN_LDSB1_AFC0_AFEM1_AFEM1_ASEM1_CLR1_CADS0_DTVA0_DTVB0_EPS0_FDSI0_GRPM1_GRVWA16_GRVWB16_GSU0_GSUAMB_GSUC0_GSUWGMRR0_GLS0_ISA950_IU1_K1_LBSPPA512_LBSPPB512_LBSPPM0_LPA32_LPB32_LPM0_LRVW8_LWPMn1_MIAV0_MIWT2_2_MO40_NTn1_NTA0_NTB0_NTC0_NTD0_NTM0_NEPBS0_NLCA1_NLCB1_ONLL1_PGR2_PLR1_PKA1_SIA3_SS1_SU0_SUM0_SUS256_SPO0_SRVW0_SSO0_SVW2_SK3_SKXCCM8_TLDS0_ULSGRO0_USL1_UIOFGRO0_USFGRO0_VSn1_VWA2_VWB2_WSGRA0_WSGRB0_WS64_WG32_8_1_WGM6_WGMXCC1_WGMXCCGn1
    SolutionIndex: 56
    SolutionNameMin: Cijk_Ailk_Bjlk_I8_BH_UserArgs_MT64x64x256_MI16x16x1_SN_LDSB1_AFC0_AFEM1_AFEM1_ASEM1_CLR1_CADS0_DTVA0_DTVB0_EPS0_FDSI0_GRPM1_GRVWA4_GRVWB4_GSU0_GSUAMB_GSUC0_GSUWGMRR0_GLS0_ISA950_IU1_K1_LBSPPA512_LBSPPB512_LBSPPM0_LPA32_LPB32_LPM0_LRVW8_LWPMn1_MIAV0_MIWT2_2_MO40_NTn1_NTA0_NTB0_NTC0_NTD0_NTM0_NEPBS0_NLCA1_NLCB1_ONLL1_PGR2_PLR2_PKA1_SIA3_SS1_SU0_SUM0_SUS256_SPO0_SRVW0_SSO0_SVW2_SK3_SKXCCM8_TLDS0_ULSGRO0_USL1_UIOFGRO0_USFGRO0_VSn1_VWA2_VWB2_WSGRA0_WSGRB0_WS64_WG32_8_1_WGM6_WGMXCC1_WGMXCCGn1
    SolutionIndex: 57
    SolutionNameMin: Cijk_Ailk_Bjlk_I8_BH_UserArgs_MT64x64x256_MI16x16x1_SN_LDSB1_AFC0_AFEM1_AFEM1_ASEM1_CLR1_CADS0_DTVA0_DTVB0_EPS0_FDSI0_GRPM1_GRVWA16_GRVWB4_GSU0_GSUAMB_GSUC0_GSUWGMRR0_GLS0_ISA950_IU1_K1_LBSPPA512_LBSPPB512_LBSPPM0_LPA32_LPB32_LPM0_LRVW8_LWPMn1_MIAV0_MIWT2_2_MO40_NTn1_NTA0_NTB0_NTC0_NTD0_NTM0_NEPBS0_NLCA1_NLCB1_ONLL1_PGR2_PLR2_PKA1_SIA3_SS1_SU0_SUM0_SUS256_SPO0_SRVW0_SSO0_SVW2_SK3_SKXCCM8_TLDS0_ULSGRO0_USL1_UIOFGRO0_USFGRO0_VSn1_VWA2_VWB2_WSGRA0_WSGRB0_WS64_WG32_8_1_WGM6_WGMXCC1_WGMXCCGn1
    SolutionIndex: 58
    SolutionNameMin: Cijk_Ailk_Bjlk_I8_BH_UserArgs_MT64x64x256_MI16x16x1_SN_LDSB1_AFC0_AFEM1_AFEM1_ASEM1_CLR1_CADS0_DTVA0_DTVB0_EPS0_FDSI0_GRPM1_GRVWA8_GRVWB8_GSU0_GSUAMB_GSUC0_GSUWGMRR0_GLS0_ISA950_IU1_K1_LBSPPA512_LBSPPB512_LBSPPM0_LPA32_LPB32_LPM0_LRVW8_LWPMn1_MIAV0_MIWT2_2_MO40_NTn1_NTA0_NTB0_NTC0_NTD0_NTM0_NEPBS0_NLCA1_NLCB1_ONLL1_PGR2_PLR2_PKA1_SIA3_SS1_SU0_SUM0_SUS256_SPO0_SRVW0_SSO0_SVW2_SK3_SKXCCM8_TLDS0_ULSGRO0_USL1_UIOFGRO0_USFGRO0_VSn1_VWA2_VWB2_WSGRA0_WSGRB0_WS64_WG32_8_1_WGM6_WGMXCC1_WGMXCCGn1
    SolutionIndex: 59
    SolutionNameMin: Cijk_Ailk_Bjlk_I8_BH_UserArgs_MT64x64x256_MI16x16x1_SN_LDSB1_AFC0_AFEM1_AFEM1_ASEM1_CLR1_CADS0_DTVA0_DTVB0_EPS0_FDSI0_GRPM1_GRVWA4_GRVWB16_GSU0_GSUAMB_GSUC0_GSUWGMRR0_GLS0_ISA950_IU1_K1_LBSPPA512_LBSPPB512_LBSPPM0_LPA32_LPB32_LPM0_LRVW8_LWPMn1_MIAV0_MIWT2_2_MO40_NTn1_NTA0_NTB0_NTC0_NTD0_NTM0_NEPBS0_NLCA1_NLCB1_ONLL1_PGR2_PLR2_PKA1_SIA3_SS1_SU0_SUM0_SUS256_SPO0_SRVW0_SSO0_SVW2_SK3_SKXCCM8_TLDS0_ULSGRO0_USL1_UIOFGRO0_USFGRO0_VSn1_VWA2_VWB2_WSGRA0_WSGRB0_WS64_WG32_8_1_WGM6_WGMXCC1_WGMXCCGn1
    SolutionIndex: 60
    SolutionNameMin: Cijk_Ailk_Bjlk_I8_BH_UserArgs_MT64x64x256_MI16x16x1_SN_LDSB1_AFC0_AFEM1_AFEM1_ASEM1_CLR1_CADS0_DTVA0_DTVB0_EPS0_FDSI0_GRPM1_GRVWA16_GRVWB16_GSU0_GSUAMB_GSUC0_GSUWGMRR0_GLS0_ISA950_IU1_K1_LBSPPA512_LBSPPB512_LBSPPM0_LPA32_LPB32_LPM0_LRVW8_LWPMn1_MIAV0_MIWT2_2_MO40_NTn1_NTA0_NTB0_NTC0_NTD0_NTM0_NEPBS0_NLCA1_NLCB1_ONLL1_PGR2_PLR2_PKA1_SIA3_SS1_SU0_SUM0_SUS256_SPO0_SRVW0_SSO0_SVW2_SK3_SKXCCM8_TLDS0_ULSGRO0_USL1_UIOFGRO0_USFGRO0_VSn1_VWA2_VWB2_WSGRA0_WSGRB0_WS64_WG32_8_1_WGM6_WGMXCC1_WGMXCCGn1
- - - [128, 128, 1, 128, 128, 128, 128, 128]
    - [49, 0.34]
  - - [128, 128, 1, 256, 128, 128, 128, 128]
    - [12, 0.6]
  - - [128, 128, 1, 512, 128, 128, 128, 128]
    - [52, 0.97]
  - - [128, 128, 1, 1024, 128, 128, 128, 128]
    - [55, 1.45]
  - - [128, 128, 1, 2048, 128, 128, 128, 128]
    - [60, 1.92]
  - - [128, 128, 1, 4096, 128, 128, 128, 128]
    - [60, 2.33]
  - - [128, 128, 1, 8192, 128, 128, 128, 128]
    - [55, 2.6]
  - - [128, 256, 1, 128, 128, 128, 128, 256]
    - [46, 0.66]
  - - [128, 256, 1, 256, 128, 128, 128, 256]
    - [44, 1.17]
  - - [128, 256, 1, 512, 128, 128, 128, 256]
    - [52, 1.89]
  - - [128, 256, 1, 1024, 128, 128, 128, 256]
    - [55, 2.86]
  - - [128, 256, 1, 2048, 128, 128, 128, 256]
    - [55, 3.8]
  - - [128, 256, 1, 4096, 128, 128, 128, 256]
    - [60, 4.59]
  - - [128, 256, 1, 8192, 128, 128, 128, 256]
    - [55, 5.17]
  - - [128, 512, 1, 128, 128, 128, 128, 512]
    - [52, 1.3]
  - - [128, 512, 1, 256, 128, 128, 128, 512]
    - [56, 2.31]
  - - [128, 512, 1, 512, 128, 128, 128, 512]
    - [53, 3.79]
  - - [128, 512, 1, 1024, 128, 128, 128, 512]
    - [60, 5.71]
  - - [128, 512, 1, 2048, 128, 128, 128, 512]
    - [55, 7.58]
  - - [128, 512, 1, 4096, 128, 128, 128, 512]
    - [55, 9.28]
  - - [128, 512, 1, 8192, 128, 128, 128, 512]
    - [55, 10.45]
  - - [128, 1024, 1, 128, 128, 128, 128, 1024]
    - [46, 2.69]
  - - [128, 1024, 1, 256, 128, 128, 128, 1024]
    - [52, 4.76]
  - - [128, 1024, 1, 512, 128, 128, 128, 1024]
    - [52, 7.63]
  - - [128, 1024, 1, 1024, 128, 128, 128, 1024]
    - [60, 11.18]
  - - [128, 1024, 1, 2048, 128, 128, 128, 1024]
    - [60, 15.13]
  - - [128, 1024, 1, 4096, 128, 128, 128, 1024]
    - [55, 18.55]
  - - [128, 1024, 1, 8192, 128, 128, 128, 1024]
    - [55, 20.91]
  - - [128, 2048, 1, 128, 128, 128, 128, 2048]
    - [13, 5.08]
  - - [128, 2048, 1, 256, 128, 128, 128, 2048]
    - [44, 9.06]
  - - [128, 2048, 1, 512, 128, 128, 128, 2048]
    - [49, 14.71]
  - - [128, 2048, 1, 1024, 128, 128, 128, 2048]
    - [55, 21.92]
  - - [128, 2048, 1, 2048, 128, 128, 128, 2048]
    - [55, 29.76]
  - - [128, 2048, 1, 4096, 128, 128, 128, 2048]
    - [55, 36.59]
  - - [128, 2048, 1, 8192, 128, 128, 128, 2048]
    - [60, 41.36]
  - - [128, 4096, 1, 128, 128, 128, 128, 4096]
    - [52, 10.0]
  - - [128, 4096, 1, 256, 128, 128, 128, 4096]
    - [46, 17.84]
  - - [128, 4096, 1, 512, 128, 128, 128, 4096]
    - [49, 29.0]
  - - [128, 4096, 1, 1024, 128, 128, 128, 4096]
    - [55, 43.03]
  - - [128, 4096, 1, 2048, 128, 128, 128, 4096]
    - [55, 58.41]
  - - [128, 4096, 1, 4096, 128, 128, 128, 4096]
    - [60, 71.93]
  - - [128, 4096, 1, 8192, 128, 128, 128, 4096]
    - [60, 80.53]
  - - [128, 8192, 1, 128, 128, 128, 128, 8192]
    - [14, 19.88]
  - - [128, 8192, 1, 256, 128, 128, 128, 8192]
    - [46, 34.4]
  - - [128, 8192, 1, 512, 128, 128, 128, 8192]
    - [49, 56.08]
  - - [128, 8192, 1, 1024, 128, 128, 128, 8192]
    - [55, 83.0]
  - - [128, 8192, 1, 2048, 128, 128, 128, 8192]
    - [55, 112.24]
  - - [128, 8192, 1, 4096, 128, 128, 128, 8192]
    - [60, 136.93]
  - - [128, 8192, 1, 8192, 128, 128, 128, 8192]
    - [55, 155.03]
  - - [256, 128, 1, 128, 256, 256, 256, 128]
    - [44, 0.67]
  - - [256, 128, 1, 256, 256, 256, 256, 128]
    - [49, 1.17]
  - - [256, 128, 1, 512, 256, 256, 256, 128]
    - [49, 1.89]
  - - [256, 128, 1, 1024, 256, 256, 256, 128]
    - [60, 2.79]
  - - [256, 128, 1, 2048, 256, 256, 256, 128]
    - [55, 3.66]
  - - [256, 128, 1, 4096, 256, 256, 256, 128]
    - [60, 4.41]
  - - [256, 128, 1, 8192, 256, 256, 256, 128]
    - [60, 4.93]
  - - [256, 256, 1, 128, 256, 256, 256, 256]
    - [47, 1.36]
  - - [256, 256, 1, 256, 256, 256, 256, 256]
    - [52, 2.36]
  - - [256, 256, 1, 512, 256, 256, 256, 256]
    - [52, 3.81]
  - - [256, 256, 1, 1024, 256, 256, 256, 256]
    - [55, 5.68]
  - - [256, 256, 1, 2048, 256, 256, 256, 256]
    - [60, 7.44]
  - - [256, 256, 1, 4096, 256, 256, 256, 256]
    - [55, 9.0]
  - - [256, 256, 1, 8192, 256, 256, 256, 256]
    - [55, 10.03]
  - - [256, 512, 1, 128, 256, 256, 256, 512]
    - [45, 2.65]
  - - [256, 512, 1, 256, 256, 256, 256, 512]
    - [52, 4.78]
  - - [256, 512, 1, 512, 256, 256, 256, 512]
    - [52, 7.58]
  - - [256, 512, 1, 1024, 256, 256, 256, 512]
    - [55, 11.23]
  - - [256, 512, 1, 2048, 256, 256, 256, 512]
    - [55, 14.98]
  - - [256, 512, 1, 4096, 256, 256, 256, 512]
    - [55, 18.06]
  - - [256, 512, 1, 8192, 256, 256, 256, 512]
    - [60, 20.13]
  - - [256, 1024, 1, 128, 256, 256, 256, 1024]
    - [41, 5.37]
  - - [256, 1024, 1, 256, 256, 256, 256, 1024]
    - [52, 9.32]
  - - [256, 1024, 1, 512, 256, 256, 256, 1024]
    - [52, 15.07]
  - - [256, 1024, 1, 1024, 256, 256, 256, 1024]
    - [60, 22.02]
  - - [256, 1024, 1, 2048, 256, 256, 256, 1024]
    - [60, 29.73]
  - - [256, 1024, 1, 4096, 256, 256, 256, 1024]
    - [55, 35.97]
  - - [256, 1024, 1, 8192, 256, 256, 256, 1024]
    - [60, 40.29]
  - - [256, 2048, 1, 128, 256, 256, 256, 2048]
    - [52, 10.31]
  - - [256, 2048, 1, 256, 256, 256, 256, 2048]
    - [54, 17.85]
  - - [256, 2048, 1, 512, 256, 256, 256, 2048]
    - [52, 29.11]
  - - [256, 2048, 1, 1024, 256, 256, 256, 2048]
    - [60, 43.38]
  - - [256, 2048, 1, 2048, 256, 256, 256, 2048]
    - [60, 58.25]
  - - [256, 2048, 1, 4096, 256, 256, 256, 2048]
    - [60, 70.88]
  - - [256, 2048, 1, 8192, 256, 256, 256, 2048]
    - [60, 79.52]
  - - [256, 4096, 1, 128, 256, 256, 256, 4096]
    - [42, 20.02]
  - - [256, 4096, 1, 256, 256, 256, 256, 4096]
    - [52, 34.82]
  - - [256, 4096, 1, 512, 256, 256, 256, 4096]
    - [52, 56.76]
  - - [256, 4096, 1, 1024, 256, 256, 256, 4096]
    - [60, 84.31]
  - - [256, 4096, 1, 2048, 256, 256, 256, 4096]
    - [55, 112.57]
  - - [256, 4096, 1, 4096, 256, 256, 256, 4096]
    - [60, 137.54]
  - - [256, 4096, 1, 8192, 256, 256, 256, 4096]
    - [60, 152.85]
  - - [256, 8192, 1, 128, 256, 256, 256, 8192]
    - [37, 36.3]
  - - [256, 8192, 1, 256, 256, 256, 256, 8192]
    - [39, 63.02]
  - - [256, 8192, 1, 512, 256, 256, 256, 8192]
    - [33, 102.61]
  - - [256, 8192, 1, 1024, 256, 256, 256, 8192]
    - [40, 150.85]
  - - [256, 8192, 1, 2048, 256, 256, 256, 8192]
    - [34, 194.38]
  - - [256, 8192, 1, 4096, 256, 256, 256, 8192]
    - [35, 228.4]
  - - [256, 8192, 1, 8192, 256, 256, 256, 8192]
    - [35, 250.88]
  - - [512, 128, 1, 128, 512, 512, 512, 128]
    - [47, 1.34]
  - - [512, 128, 1, 256, 512, 512, 512, 128]
    - [47, 2.36]
  - - [512, 128, 1, 512, 512, 512, 512, 128]
    - [52, 3.81]
  - - [512, 128, 1, 1024, 512, 512, 512, 128]
    - [60, 5.55]
  - - [512, 128, 1, 2048, 512, 512, 512, 128]
    - [60, 7.12]
  - - [512, 128, 1, 4096, 512, 512, 512, 128]
    - [51, 8.38]
  - - [512, 128, 1, 8192, 512, 512, 512, 128]
    - [60, 9.21]
  - - [512, 256, 1, 128, 512, 512, 512, 256]
    - [15, 2.65]
  - - [512, 256, 1, 256, 512, 512, 512, 256]
    - [58, 4.71]
  - - [512, 256, 1, 512, 512, 512, 512, 256]
    - [52, 7.68]
  - - [512, 256, 1, 1024, 512, 512, 512, 256]
    - [55, 10.96]
  - - [512, 256, 1, 2048, 512, 512, 512, 256]
    - [60, 14.24]
  - - [512, 256, 1, 4096, 512, 512, 512, 256]
    - [60, 16.85]
  - - [512, 256, 1, 8192, 512, 512, 512, 256]
    - [60, 18.58]
  - - [512, 512, 1, 128, 512, 512, 512, 512]
    - [47, 5.42]
  - - [512, 512, 1, 256, 512, 512, 512, 512]
    - [49, 9.49]
  - - [512, 512, 1, 512, 512, 512, 512, 512]
    - [49, 15.06]
  - - [512, 512, 1, 1024, 512, 512, 512, 512]
    - [60, 21.97]
  - - [512, 512, 1, 2048, 512, 512, 512, 512]
    - [60, 28.51]
  - - [512, 512, 1, 4096, 512, 512, 512, 512]
    - [60, 33.69]
  - - [512, 512, 1, 8192, 512, 512, 512, 512]
    - [60, 37.45]
  - - [512, 1024, 1, 128, 512, 512, 512, 1024]
    - [44, 10.46]
  - - [512, 1024, 1, 256, 512, 512, 512, 1024]
    - [46, 18.46]
  - - [512, 1024, 1, 512, 512, 512, 512, 1024]
    - [52, 29.75]
  - - [512, 1024, 1, 1024, 512, 512, 512, 1024]
    - [60, 42.96]
  - - [512, 1024, 1, 2048, 512, 512, 512, 1024]
    - [60, 56.3]
  - - [512, 1024, 1, 4096, 512, 512, 512, 1024]
    - [60, 67.29]
  - - [512, 1024, 1, 8192, 512, 512, 512, 1024]
    - [60, 74.41]
  - - [512, 2048, 1, 128, 512, 512, 512, 2048]
    - [48, 20.74]
  - - [512, 2048, 1, 256, 512, 512, 512, 2048]
    - [52, 35.33]
  - - [512, 2048, 1, 512, 512, 512, 512, 2048]
    - [49, 57.09]
  - - [512, 2048, 1, 1024, 512, 512, 512, 2048]
    - [52, 83.01]
  - - [512, 2048, 1, 2048, 512, 512, 512, 2048]
    - [60, 108.95]
  - - [512, 2048, 1, 4096, 512, 512, 512, 2048]
    - [60, 130.45]
  - - [512, 2048, 1, 8192, 512, 512, 512, 2048]
    - [60, 145.08]
  - - [512, 4096, 1, 128, 512, 512, 512, 4096]
    - [36, 36.61]
  - - [512, 4096, 1, 256, 512, 512, 512, 4096]
    - [32, 63.46]
  - - [512, 4096, 1, 512, 512, 512, 512, 4096]
    - [33, 103.44]
  - - [512, 4096, 1, 1024, 512, 512, 512, 4096]
    - [34, 150.38]
  - - [512, 4096, 1, 2048, 512, 512, 512, 4096]
    - [34, 195.99]
  - - [512, 4096, 1, 4096, 512, 512, 512, 4096]
    - [35, 231.17]
  - - [512, 4096, 1, 8192, 512, 512, 512, 4096]
    - [35, 252.5]
  - - [512, 8192, 1, 128, 512, 512, 512, 8192]
    - [4, 60.2]
  - - [512, 8192, 1, 256, 512, 512, 512, 8192]
    - [9, 103.01]
  - - [512, 8192, 1, 512, 512, 512, 512, 8192]
    - [29, 161.51]
  - - [512, 8192, 1, 1024, 512, 512, 512, 8192]
    - [31, 230.62]
  - - [512, 8192, 1, 2048, 512, 512, 512, 8192]
    - [31, 293.11]
  - - [512, 8192, 1, 4096, 512, 512, 512, 8192]
    - [28, 336.0]
  - - [512, 8192, 1, 8192, 512, 512, 512, 8192]
    - [28, 351.9]
  - - [1024, 128, 1, 128, 1024, 1024, 1024, 128]
    - [15, 2.67]
  - - [1024, 128, 1, 256, 1024, 1024, 1024, 128]
    - [52, 4.71]
  - - [1024, 128, 1, 512, 1024, 1024, 1024, 128]
    - [52, 7.59]
  - - [1024, 128, 1, 1024, 1024, 1024, 1024, 128]
    - [53, 10.99]
  - - [1024, 128, 1, 2048, 1024, 1024, 1024, 128]
    - [51, 14.08]
  - - [1024, 128, 1, 4096, 1024, 1024, 1024, 128]
    - [51, 16.51]
  - - [1024, 128, 1, 8192, 1024, 1024, 1024, 128]
    - [51, 18.14]
  - - [1024, 256, 1, 128, 1024, 1024, 1024, 256]
    - [49, 5.4]
  - - [1024, 256, 1, 256, 1024, 1024, 1024, 256]
    - [52, 9.38]
  - - [1024, 256, 1, 512, 1024, 1024, 1024, 256]
    - [52, 15.03]
  - - [1024, 256, 1, 1024, 1024, 1024, 1024, 256]
    - [52, 21.68]
  - - [1024, 256, 1, 2048, 1024, 1024, 1024, 256]
    - [51, 27.9]
  - - [1024, 256, 1, 4096, 1024, 1024, 1024, 256]
    - [51, 32.91]
  - - [1024, 256, 1, 8192, 1024, 1024, 1024, 256]
    - [51, 36.11]
  - - [1024, 512, 1, 128, 1024, 1024, 1024, 512]
    - [43, 10.47]
  - - [1024, 512, 1, 256, 1024, 1024, 1024, 512]
    - [52, 18.57]
  - - [1024, 512, 1, 512, 1024, 1024, 1024, 512]
    - [49, 29.53]
  - - [1024, 512, 1, 1024, 1024, 1024, 1024, 512]
    - [52, 42.78]
  - - [1024, 512, 1, 2048, 1024, 1024, 1024, 512]
    - [52, 55.13]
  - - [1024, 512, 1, 4096, 1024, 1024, 1024, 512]
    - [60, 65.26]
  - - [1024, 512, 1, 8192, 1024, 1024, 1024, 512]
    - [51, 72.23]
  - - [1024, 1024, 1, 128, 1024, 1024, 1024, 1024]
    - [44, 20.34]
  - - [1024, 1024, 1, 256, 1024, 1024, 1024, 1024]
    - [49, 35.72]
  - - [1024, 1024, 1, 512, 1024, 1024, 1024, 1024]
    - [52, 57.34]
  - - [1024, 1024, 1, 1024, 1024, 1024, 1024, 1024]
    - [49, 83.31]
  - - [1024, 1024, 1, 2048, 1024, 1024, 1024, 1024]
    - [60, 106.95]
  - - [1024, 1024, 1, 4096, 1024, 1024, 1024, 1024]
    - [60, 126.63]
  - - [1024, 1024, 1, 8192, 1024, 1024, 1024, 1024]
    - [60, 139.96]
  - - [1024, 2048, 1, 128, 1024, 1024, 1024, 2048]
    - [38, 36.95]
  - - [1024, 2048, 1, 256, 1024, 1024, 1024, 2048]
    - [32, 63.87]
  - - [1024, 2048, 1, 512, 1024, 1024, 1024, 2048]
    - [40, 103.89]
  - - [1024, 2048, 1, 1024, 1024, 1024, 1024, 2048]
    - [34, 151.15]
  - - [1024, 2048, 1, 2048, 1024, 1024, 1024, 2048]
    - [35, 196.65]
  - - [1024, 2048, 1, 4096, 1024, 1024, 1024, 2048]
    - [35, 231.18]
  - - [1024, 2048, 1, 8192, 1024, 1024, 1024, 2048]
    - [34, 252.93]
  - - [1024, 4096, 1, 128, 1024, 1024, 1024, 4096]
    - [5, 60.0]
  - - [1024, 4096, 1, 256, 1024, 1024, 1024, 4096]
    - [10, 102.31]
  - - [1024, 4096, 1, 512, 1024, 1024, 1024, 4096]
    - [29, 162.02]
  - - [1024, 4096, 1, 1024, 1024, 1024, 1024, 4096]
    - [31, 229.32]
  - - [1024, 4096, 1, 2048, 1024, 1024, 1024, 4096]
    - [31, 291.82]
  - - [1024, 4096, 1, 4096, 1024, 1024, 1024, 4096]
    - [31, 336.79]
  - - [1024, 4096, 1, 8192, 1024, 1024, 1024, 4096]
    - [28, 352.69]
  - - [1024, 8192, 1, 128, 1024, 1024, 1024, 8192]
    - [2, 90.77]
  - - [1024, 8192, 1, 256, 1024, 1024, 1024, 8192]
    - [23, 153.9]
  - - [1024, 8192, 1, 512, 1024, 1024, 1024, 8192]
    - [24, 237.5]
  - - [1024, 8192, 1, 1024, 1024, 1024, 1024, 8192]
    - [24, 328.78]
  - - [1024, 8192, 1, 2048, 1024, 1024, 1024, 8192]
    - [24, 408.13]
  - - [1024, 8192, 1, 4096, 1024, 1024, 1024, 8192]
    - [24, 455.94]
  - - [1024, 8192, 1, 8192, 1024, 1024, 1024, 8192]
    - [27, 470.23]
  - - [2048, 128, 1, 128, 2048, 2048, 2048, 128]
    - [47, 5.31]
  - - [2048, 128, 1, 256, 2048, 2048, 2048, 128]
    - [47, 9.31]
  - - [2048, 128, 1, 512, 2048, 2048, 2048, 128]
    - [49, 15.04]
  - - [2048, 128, 1, 1024, 2048, 2048, 2048, 128]
    - [51, 21.58]
  - - [2048, 128, 1, 2048, 2048, 2048, 2048, 128]
    - [51, 28.0]
  - - [2048, 128, 1, 4096, 2048, 2048, 2048, 128]
    - [51, 33.08]
  - - [2048, 128, 1, 8192, 2048, 2048, 2048, 128]
    - [51, 36.54]
  - - [2048, 256, 1, 128, 2048, 2048, 2048, 256]
    - [50, 10.4]
  - - [2048, 256, 1, 256, 2048, 2048, 2048, 256]
    - [57, 18.09]
  - - [2048, 256, 1, 512, 2048, 2048, 2048, 256]
    - [52, 29.79]
  - - [2048, 256, 1, 1024, 2048, 2048, 2048, 256]
    - [51, 42.71]
  - - [2048, 256, 1, 2048, 2048, 2048, 2048, 256]
    - [51, 55.49]
  - - [2048, 256, 1, 4096, 2048, 2048, 2048, 256]
    - [51, 65.36]
  - - [2048, 256, 1, 8192, 2048, 2048, 2048, 256]
    - [51, 72.15]
  - - [2048, 512, 1, 128, 2048, 2048, 2048, 512]
    - [41, 20.71]
  - - [2048, 512, 1, 256, 2048, 2048, 2048, 512]
    - [47, 35.61]
  - - [2048, 512, 1, 512, 2048, 2048, 2048, 512]
    - [49, 57.73]
  - - [2048, 512, 1, 1024, 2048, 2048, 2048, 512]
    - [52, 83.29]
  - - [2048, 512, 1, 2048, 2048, 2048, 2048, 512]
    - [51, 106.81]
  - - [2048, 512, 1, 4096, 2048, 2048, 2048, 512]
    - [51, 125.86]
  - - [2048, 512, 1, 8192, 2048, 2048, 2048, 512]
    - [59, 139.01]
  - - [2048, 1024, 1, 128, 2048, 2048, 2048, 1024]
    - [11, 37.04]
  - - [2048, 1024, 1, 256, 2048, 2048, 2048, 1024]
    - [32, 64.0]
  - - [2048, 1024, 1, 512, 2048, 2048, 2048, 1024]
    - [33, 103.94]
  - - [2048, 1024, 1, 1024, 2048, 2048, 2048, 1024]
    - [33, 151.49]
  - - [2048, 1024, 1, 2048, 2048, 2048, 2048, 1024]
    - [35, 195.7]
  - - [2048, 1024, 1, 4096, 2048, 2048, 2048, 1024]
    - [35, 231.1]
  - - [2048, 1024, 1, 8192, 2048, 2048, 2048, 1024]
    - [35, 253.97]
  - - [2048, 2048, 1, 128, 2048, 2048, 2048, 2048]
    - [9, 60.59]
  - - [2048, 2048, 1, 256, 2048, 2048, 2048, 2048]
    - [8, 103.2]
  - - [2048, 2048, 1, 512, 2048, 2048, 2048, 2048]
    - [29, 162.88]
  - - [2048, 2048, 1, 1024, 2048, 2048, 2048, 2048]
    - [31, 229.57]
  - - [2048, 2048, 1, 2048, 2048, 2048, 2048, 2048]
    - [31, 293.94]
  - - [2048, 2048, 1, 4096, 2048, 2048, 2048, 2048]
    - [31, 341.27]
  - - [2048, 2048, 1, 8192, 2048, 2048, 2048, 2048]
    - [31, 358.58]
  - - [2048, 4096, 1, 128, 2048, 2048, 2048, 4096]
    - [2, 90.47]
  - - [2048, 4096, 1, 256, 2048, 2048, 2048, 4096]
    - [23, 153.19]
  - - [2048, 4096, 1, 512, 2048, 2048, 2048, 4096]
    - [24, 237.87]
  - - [2048, 4096, 1, 1024, 2048, 2048, 2048, 4096]
    - [24, 328.01]
  - - [2048, 4096, 1, 2048, 2048, 2048, 2048, 4096]
    - [24, 409.46]
  - - [2048, 4096, 1, 4096, 2048, 2048, 2048, 4096]
    - [22, 454.45]
  - - [2048, 4096, 1, 8192, 2048, 2048, 2048, 4096]
    - [26, 464.94]
  - - [2048, 8192, 1, 128, 2048, 2048, 2048, 8192]
    - [1, 114.9]
  - - [2048, 8192, 1, 256, 2048, 2048, 2048, 8192]
    - [21, 202.58]
  - - [2048, 8192, 1, 512, 2048, 2048, 2048, 8192]
    - [21, 326.93]
  - - [2048, 8192, 1, 1024, 2048, 2048, 2048, 8192]
    - [21, 477.98]
  - - [2048, 8192, 1, 2048, 2048, 2048, 2048, 8192]
    - [19, 596.86]
  - - [2048, 8192, 1, 4096, 2048, 2048, 2048, 8192]
    - [21, 659.24]
  - - [2048, 8192, 1, 8192, 2048, 2048, 2048, 8192]
    - [21, 656.72]
  - - [4096, 128, 1, 128, 4096, 4096, 4096, 128]
    - [42, 10.36]
  - - [4096, 128, 1, 256, 4096, 4096, 4096, 128]
    - [49, 18.23]
  - - [4096, 128, 1, 512, 4096, 4096, 4096, 128]
    - [49, 29.29]
  - - [4096, 128, 1, 1024, 4096, 4096, 4096, 128]
    - [49, 42.41]
  - - [4096, 128, 1, 2048, 4096, 4096, 4096, 128]
    - [51, 55.04]
  - - [4096, 128, 1, 4096, 4096, 4096, 4096, 128]
    - [51, 64.99]
  - - [4096, 128, 1, 8192, 4096, 4096, 4096, 128]
    - [51, 71.41]
  - - [4096, 256, 1, 128, 4096, 4096, 4096, 256]
    - [49, 20.46]
  - - [4096, 256, 1, 256, 4096, 4096, 4096, 256]
    - [47, 35.7]
  - - [4096, 256, 1, 512, 4096, 4096, 4096, 256]
    - [49, 56.97]
  - - [4096, 256, 1, 1024, 4096, 4096, 4096, 256]
    - [52, 82.63]
  - - [4096, 256, 1, 2048, 4096, 4096, 4096, 256]
    - [51, 106.77]
  - - [4096, 256, 1, 4096, 4096, 4096, 4096, 256]
    - [51, 126.25]
  - - [4096, 256, 1, 8192, 4096, 4096, 4096, 256]
    - [51, 137.99]
  - - [4096, 512, 1, 128, 4096, 4096, 4096, 512]
    - [11, 36.64]
  - - [4096, 512, 1, 256, 4096, 4096, 4096, 512]
    - [32, 63.12]
  - - [4096, 512, 1, 512, 4096, 4096, 4096, 512]
    - [33, 103.29]
  - - [4096, 512, 1, 1024, 4096, 4096, 4096, 512]
    - [35, 150.3]
  - - [4096, 512, 1, 2048, 4096, 4096, 4096, 512]
    - [35, 195.99]
  - - [4096, 512, 1, 4096, 4096, 4096, 4096, 512]
    - [35, 229.92]
  - - [4096, 512, 1, 8192, 4096, 4096, 4096, 512]
    - [35, 249.1]
  - - [4096, 1024, 1, 128, 4096, 4096, 4096, 1024]
    - [7, 60.21]
  - - [4096, 1024, 1, 256, 4096, 4096, 4096, 1024]
    - [6, 103.49]
  - - [4096, 1024, 1, 512, 4096, 4096, 4096, 1024]
    - [28, 162.24]
  - - [4096, 1024, 1, 1024, 4096, 4096, 4096, 1024]
    - [31, 230.52]
  - - [4096, 1024, 1, 2048, 4096, 4096, 4096, 1024]
    - [31, 293.98]
  - - [4096, 1024, 1, 4096, 4096, 4096, 4096, 1024]
    - [31, 342.33]
  - - [4096, 1024, 1, 8192, 4096, 4096, 4096, 1024]
    - [30, 355.31]
  - - [4096, 2048, 1, 128, 4096, 4096, 4096, 2048]
    - [3, 89.84]
  - - [4096, 2048, 1, 256, 4096, 4096, 4096, 2048]
    - [23, 153.42]
  - - [4096, 2048, 1, 512, 4096, 4096, 4096, 2048]
    - [24, 238.66]
  - - [4096, 2048, 1, 1024, 4096, 4096, 4096, 2048]
    - [25, 329.87]
  - - [4096, 2048, 1, 2048, 4096, 4096, 4096, 2048]
    - [24, 409.7]
  - - [4096, 2048, 1, 4096, 4096, 4096, 4096, 2048]
    - [24, 459.2]
  - - [4096, 2048, 1, 8192, 4096, 4096, 4096, 2048]
    - [25, 477.43]
  - - [4096, 4096, 1, 128, 4096, 4096, 4096, 4096]
    - [0, 115.15]
  - - [4096, 4096, 1, 256, 4096, 4096, 4096, 4096]
    - [20, 197.02]
  - - [4096, 4096, 1, 512, 4096, 4096, 4096, 4096]
    - [21, 322.27]
  - - [4096, 4096, 1, 1024, 4096, 4096, 4096, 4096]
    - [21, 468.69]
  - - [4096, 4096, 1, 2048, 4096, 4096, 4096, 4096]
    - [21, 610.65]
  - - [4096, 4096, 1, 4096, 4096, 4096, 4096, 4096]
    - [21, 656.7]
  - - [4096, 4096, 1, 8192, 4096, 4096, 4096, 4096]
    - [21, 673.08]
  - - [4096, 8192, 1, 128, 4096, 4096, 4096, 8192]
    - [16, 131.54]
  - - [4096, 8192, 1, 256, 4096, 4096, 4096, 8192]
    - [21, 227.69]
  - - [4096, 8192, 1, 512, 4096, 4096, 4096, 8192]
    - [21, 361.08]
  - - [4096, 8192, 1, 1024, 4096, 4096, 4096, 8192]
    - [21, 509.44]
  - - [4096, 8192, 1, 2048, 4096, 4096, 4096, 8192]
    - [21, 571.7]
  - - [4096, 8192, 1, 4096, 4096, 4096, 4096, 8192]
    - [21, 641.34]
  - - [4096, 8192, 1, 8192, 4096, 4096, 4096, 8192]
    - [21, 728.65]
  - - [8192, 128, 1, 128, 8192, 8192, 8192, 128]
    - [48, 20.28]
  - - [8192, 128, 1, 256, 8192, 8192, 8192, 128]
    - [47, 34.48]
  - - [8192, 128, 1, 512, 8192, 8192, 8192, 128]
    - [47, 56.34]
  - - [8192, 128, 1, 1024, 8192, 8192, 8192, 128]
    - [53, 81.76]
  - - [8192, 128, 1, 2048, 8192, 8192, 8192, 128]
    - [51, 105.38]
  - - [8192, 128, 1, 4096, 8192, 8192, 8192, 128]
    - [51, 124.96]
  - - [8192, 128, 1, 8192, 8192, 8192, 8192, 128]
    - [51, 137.06]
  - - [8192, 256, 1, 128, 8192, 8192, 8192, 256]
    - [36, 36.91]
  - - [8192, 256, 1, 256, 8192, 8192, 8192, 256]
    - [33, 62.97]
  - - [8192, 256, 1, 512, 8192, 8192, 8192, 256]
    - [34, 102.59]
  - - [8192, 256, 1, 1024, 8192, 8192, 8192, 256]
    - [35, 150.57]
  - - [8192, 256, 1, 2048, 8192, 8192, 8192, 256]
    - [34, 195.18]
  - - [8192, 256, 1, 4096, 8192, 8192, 8192, 256]
    - [34, 228.75]
  - - [8192, 256, 1, 8192, 8192, 8192, 8192, 256]
    - [34, 250.88]
  - - [8192, 512, 1, 128, 8192, 8192, 8192, 512]
    - [6, 60.51]
  - - [8192, 512, 1, 256, 8192, 8192, 8192, 512]
    - [8, 103.72]
  - - [8192, 512, 1, 512, 8192, 8192, 8192, 512]
    - [29, 162.79]
  - - [8192, 512, 1, 1024, 8192, 8192, 8192, 512]
    - [31, 230.48]
  - - [8192, 512, 1, 2048, 8192, 8192, 8192, 512]
    - [31, 293.69]
  - - [8192, 512, 1, 4096, 8192, 8192, 8192, 512]
    - [31, 337.11]
  - - [8192, 512, 1, 8192, 8192, 8192, 8192, 512]
    - [31, 364.32]
  - - [8192, 1024, 1, 128, 8192, 8192, 8192, 1024]
    - [2, 90.59]
  - - [8192, 1024, 1, 256, 8192, 8192, 8192, 1024]
    - [23, 153.09]
  - - [8192, 1024, 1, 512, 8192, 8192, 8192, 1024]
    - [23, 235.71]
  - - [8192, 1024, 1, 1024, 8192, 8192, 8192, 1024]
    - [24, 327.86]
  - - [8192, 1024, 1, 2048, 8192, 8192, 8192, 1024]
    - [25, 408.63]
  - - [8192, 1024, 1, 4096, 8192, 8192, 8192, 1024]
    - [24, 454.45]
  - - [8192, 1024, 1, 8192, 8192, 8192, 8192, 1024]
    - [25, 465.7]
  - - [8192, 2048, 1, 128, 8192, 8192, 8192, 2048]
    - [1, 113.93]
  - - [8192, 2048, 1, 256, 8192, 8192, 8192, 2048]
    - [21, 198.94]
  - - [8192, 2048, 1, 512, 8192, 8192, 8192, 2048]
    - [21, 325.9]
  - - [8192, 2048, 1, 1024, 8192, 8192, 8192, 2048]
    - [21, 473.51]
  - - [8192, 2048, 1, 2048, 8192, 8192, 8192, 2048]
    - [21, 603.44]
  - - [8192, 2048, 1, 4096, 8192, 8192, 8192, 2048]
    - [19, 652.38]
  - - [8192, 2048, 1, 8192, 8192, 8192, 8192, 2048]
    - [21, 669.06]
  - - [8192, 4096, 1, 128, 8192, 8192, 8192, 4096]
    - [1, 133.42]
  - - [8192, 4096, 1, 256, 8192, 8192, 8192, 4096]
    - [21, 229.45]
  - - [8192, 4096, 1, 512, 8192, 8192, 8192, 4096]
    - [21, 363.33]
  - - [8192, 4096, 1, 1024, 8192, 8192, 8192, 4096]
    - [21, 508.38]
  - - [8192, 4096, 1, 2048, 8192, 8192, 8192, 4096]
    - [19, 576.8]
  - - [8192, 4096, 1, 4096, 8192, 8192, 8192, 4096]
    - [21, 654.46]
  - - [8192, 4096, 1, 8192, 8192, 8192, 8192, 4096]
    - [21, 723.33]
  - - [8192, 8192, 1, 128, 8192, 8192, 8192, 8192]
    - [17, 147.45]
  - - [8192, 8192, 1, 256, 8192, 8192, 8192, 8192]
    - [19, 247.06]
  - - [8192, 8192, 1, 512, 8192, 8192, 8192, 8192]
    - [21, 384.96]
  - - [8192, 8192, 1, 1024, 8192, 8192, 8192, 8192]
    - [17, 484.5]
  - - [8192, 8192, 1, 2048, 8192, 8192, 8192, 8192]
    - [18, 577.82]
  - - [8192, 8192, 1, 4096, 8192, 8192, 8192, 8192]
    - [21, 694.31]
  - - [8192, 8192, 1, 8192, 8192, 8192, 8192, 8192]
    - [21, 773.56]
- null
- null
- DeviceEfficiency
- GridBased
