projects/hipblaslt/library/src/amd_detail/rocblaslt/src/Tensile/Logic/asm_full/aquavanjaram/gfx942/GridBased/aquavanjaram_Cijk_Alik_Bjlk_BBS_BH_Bias_HAS_SAV_UserArgs.yaml
- {MinimumRequiredVersion: 4.33.0}
- aquavanjaram
- gfx942
- [Device 0049, Device 0050]
    SolutionIndex: 0
    SolutionNameMin: Cijk_Alik_Bjlk_BBS_BH_Bias_HAS_SAV_UserArgs_MT16x16x32_MI16x16x1_SN_LDSB0_GRVWA4_GSU1_LBSPPA128_LBSPPB128_LPA4_LRVW4_MIWT1_1_SU0_SUM0_SUS0_SVW1_VWA1_WG16_4_1_WGM8
    SolutionIndex: 1
    SolutionNameMin: Cijk_Alik_Bjlk_BBS_BH_Bias_HAS_SAV_UserArgs_MT32x16x64_MI16x16x1_SN_LDSB0_GRVWA8_GSU1_LBSPPA128_LBSPPB256_LPA16_LRVW8_MIWT1_1_SU0_SUM0_SUS0_SVW1_VWA1_WG32_4_1_WGM8
    SolutionIndex: 2
    SolutionNameMin: Cijk_Alik_Bjlk_BBS_BH_Bias_HAS_SAV_UserArgs_MT128x16x64_MI16x16x1_SN_LDSB1_GRVWA8_GSU1_LBSPPA256_LBSPPB256_LPA16_LRVW8_MIWT2_1_SU0_SUM0_SUS0_SVW2_VWA2_WG64_4_1_WGM8
    SolutionIndex: 3
    SolutionNameMin: Cijk_Alik_Bjlk_BBS_BH_Bias_HAS_SAV_UserArgs_MT256x16x64_MI16x16x1_SN_LDSB1_GRVWA8_GSU1_LBSPPA512_LBSPPB256_LPA16_LRVW8_MIWT4_1_SU0_SUM0_SUS0_SVW4_VWA4_WG64_4_1_WGM8
    SolutionIndex: 4
    SolutionNameMin: Cijk_Alik_Bjlk_BBS_BH_Bias_HAS_SAV_UserArgs_MT448x16x64_MI16x16x1_SN_LDSB1_GRVWA4_GSU1_LBSPPA128_LBSPPB128_LPA4_LRVW4_MIWT7_1_SU0_SUM0_SUS0_SVW1_VWA1_WG64_4_1_WGM8
    SolutionIndex: 5
    SolutionNameMin: Cijk_Alik_Bjlk_BBS_BH_Bias_HAS_SAV_UserArgs_MT32x16x128_MI16x16x1_SN_LDSB0_GRVWA8_GSU1_LBSPPA256_LBSPPB256_LPA16_LRVW8_MIWT1_1_SU0_SUM0_SUS0_SVW1_VWA1_WG32_4_1_WGM8
    SolutionIndex: 6
    SolutionNameMin: Cijk_Alik_Bjlk_BBS_BH_Bias_HAS_SAV_UserArgs_MT64x16x128_MI16x16x1_SN_LDSB1_GRVWA8_GSU1_LBSPPA256_LBSPPB256_LPA16_LRVW8_MIWT1_1_SU0_SUM0_SUS0_SVW1_VWA1_WG64_4_1_WGM8
    SolutionIndex: 7
    SolutionNameMin: Cijk_Alik_Bjlk_BBS_BH_Bias_HAS_SAV_UserArgs_MT32x64x32_MI16x16x1_SN_LDSB0_CLR1_GRVWA1_GSU1_GSUC0_GSUWGMRR0_K1_LBSPPA128_LBSPPB512_LPA4_LPB32_LRVW4_LWPM0p27_MIWT1_2_NTD0_NLCB1_PLR1_SU0_SUM0_SUS0_SVW1_ULSGRO1_VWA1_VWB2_WG32_8_1_WGM1_WGMXCC1_WGMXCCG304
    SolutionIndex: 8
    SolutionNameMin: Cijk_Alik_Bjlk_BBS_BH_Bias_HAS_SAV_UserArgs_MT32x64x64_MI16x16x1_SN_LDSB0_CLR1_GRVWA1_GSU1_GSUC0_GSUWGMRR0_K1_LBSPPA128_LBSPPB1024_LPA16_LPB32_LRVW8_LWPMn1_MIWT1_2_NTD4_NLCB1_PLR1_SU0_SUM0_SUS0_SVW1_ULSGRO1_VWA1_VWB2_WG32_8_1_WGM1_WGMXCC1_WGMXCCG304
    SolutionIndex: 9
    SolutionNameMin: Cijk_Alik_Bjlk_BBS_BH_Bias_HAS_SAV_UserArgs_MT32x64x32_MI16x16x1_SN_LDSB0_CLR1_GRVWA4_GSU1_GSUC0_GSUWGMRR0_K1_LBSPPA128_LBSPPB512_LPA4_LPB32_LRVW4_LWPMn1_MIWT1_2_NTD4_NLCB1_PLR1_SU16_SUM0_SUS64_SVW1_ULSGRO0_VWA1_VWB2_WG32_8_1_WGM1_WGMXCC8_WGMXCCG304
    SolutionIndex: 10
    SolutionNameMin: Cijk_Alik_Bjlk_BBS_BH_Bias_HAS_SAV_UserArgs_MT32x64x64_MI16x16x1_SN_LDSB0_CLR1_GRVWA8_GSU1_GSUC0_GSUWGMRR0_K1_LBSPPA128_LBSPPB1024_LPA16_LPB32_LRVW8_LWPM0p50_MIWT1_2_NTD0_NLCB1_PLR1_SU0_SUM0_SUS0_SVW1_ULSGRO0_VWA1_VWB2_WG32_8_1_WGM1_WGMXCC8_WGMXCCG304
    SolutionIndex: 11
    SolutionNameMin: Cijk_Alik_Bjlk_BBS_BH_Bias_HAS_SAV_UserArgs_MT32x64x32_MI16x16x1_SN_LDSB0_CLR1_GRVWA1_GSU1_GSUC0_GSUWGMRR0_K1_LBSPPA128_LBSPPB512_LPA4_LPB32_LRVW4_LWPM0p27_MIWT1_2_NTD4_NLCB1_PLR1_SU0_SUM0_SUS0_SVW1_ULSGRO1_VWA1_VWB2_WG32_8_1_WGM1_WGMXCC8_WGMXCCG304
    SolutionIndex: 12
    SolutionNameMin: Cijk_Alik_Bjlk_BBS_BH_Bias_HAS_SAV_UserArgs_MT32x64x32_MI16x16x1_SN_LDSB0_CLR1_GRVWA1_GSU1_GSUC0_GSUWGMRR0_K1_LBSPPA128_LBSPPB512_LPA4_LPB32_LRVW4_LWPM0p27_MIWT1_2_NTD4_NLCB1_PLR1_SU16_SUM1_SUS64_SVW1_ULSGRO1_VWA1_VWB2_WG32_8_1_WGM1_WGMXCC8_WGMXCCG304
    SolutionIndex: 13
    SolutionNameMin: Cijk_Alik_Bjlk_BBS_BH_Bias_HAS_SAV_UserArgs_MT32x64x32_MI16x16x1_SN_LDSB0_CLR1_GRVWA4_GSU1_GSUC0_GSUWGMRR0_K1_LBSPPA128_LBSPPB512_LPA4_LPB32_LRVW4_LWPMn1_MIWT1_2_NTD0_NLCB1_PLR1_SU16_SUM1_SUS64_SVW1_ULSGRO0_VWA1_VWB2_WG32_8_1_WGM1_WGMXCC8_WGMXCCG304
    SolutionIndex: 14
    SolutionNameMin: Cijk_Alik_Bjlk_BBS_BH_Bias_HAS_SAV_UserArgs_MT32x64x32_MI16x16x1_SN_LDSB0_CLR1_GRVWA1_GSU1_GSUC0_GSUWGMRR0_K1_LBSPPA128_LBSPPB512_LPA4_LPB32_LRVW4_LWPM0p25_MIWT1_2_NTD0_NLCB1_PLR1_SU0_SUM0_SUS0_SVW1_ULSGRO1_VWA1_VWB2_WG32_8_1_WGM1_WGMXCC1_WGMXCCG304
    SolutionIndex: 15
    SolutionNameMin: Cijk_Alik_Bjlk_BBS_BH_Bias_HAS_SAV_UserArgs_MT32x64x32_MI16x16x1_SN_LDSB0_CLR1_GRVWA1_GSU1_GSUC0_GSUWGMRR0_K1_LBSPPA128_LBSPPB512_LPA4_LPB32_LRVW4_LWPM0p27_MIWT1_2_NTD4_NLCB1_PLR1_SU0_SUM0_SUS0_SVW1_ULSGRO1_VWA1_VWB2_WG32_8_1_WGM1_WGMXCC1_WGMXCCG304
    SolutionIndex: 16
    SolutionNameMin: Cijk_Alik_Bjlk_BBS_BH_Bias_HAS_SAV_UserArgs_MT32x64x64_MI16x16x1_SN_LDSB0_CLR1_GRVWA8_GSU1_GSUC0_GSUWGMRR0_K1_LBSPPA128_LBSPPB1024_LPA16_LPB32_LRVW8_LWPM0p27_MIWT1_2_NTD0_NLCB1_PLR1_SU0_SUM0_SUS0_SVW1_ULSGRO0_VWA1_VWB2_WG32_8_1_WGM1_WGMXCC8_WGMXCCG304
    SolutionIndex: 17
    SolutionNameMin: Cijk_Alik_Bjlk_BBS_BH_Bias_HAS_SAV_UserArgs_MT32x64x32_MI16x16x1_SN_LDSB0_CLR1_GRVWA1_GSU1_GSUC0_GSUWGMRR0_K1_LBSPPA128_LBSPPB512_LPA4_LPB32_LRVW4_LWPM0p26_MIWT1_2_NTD4_NLCB1_PLR1_SU0_SUM0_SUS0_SVW1_ULSGRO1_VWA1_VWB2_WG32_8_1_WGM1_WGMXCC8_WGMXCCG304
    SolutionIndex: 18
    SolutionNameMin: Cijk_Alik_Bjlk_BBS_BH_Bias_HAS_SAV_UserArgs_MT32x64x32_MI16x16x1_SN_LDSB0_CLR1_GRVWA1_GSU1_GSUC0_GSUWGMRR0_K1_LBSPPA128_LBSPPB512_LPA4_LPB32_LRVW4_LWPM0p25_MIWT1_2_NTD4_NLCB1_PLR1_SU0_SUM0_SUS0_SVW1_ULSGRO1_VWA1_VWB2_WG32_8_1_WGM1_WGMXCC8_WGMXCCG304
    SolutionIndex: 19
    SolutionNameMin: Cijk_Alik_Bjlk_BBS_BH_Bias_HAS_SAV_UserArgs_MT64x64x32_MI16x16x1_SN_LDSB0_CLR1_GRVWA1_GSU1_GSUC0_GSUWGMRR0_K1_LBSPPA128_LBSPPB512_LPA4_LPB32_LRVW4_LWPM0p27_MIWT2_2_NTD0_NLCB1_PLR1_SU0_SUM0_SUS0_SVW2_ULSGRO1_VWA2_VWB2_WG32_8_1_WGM1_WGMXCC8_WGMXCCG304
    SolutionIndex: 20
    SolutionNameMin: Cijk_Alik_Bjlk_BBS_BH_Bias_HAS_SAV_UserArgs_MT32x64x32_MI16x16x1_SN_LDSB0_CLR1_GRVWA1_GSU1_GSUC0_GSUWGMRR0_K1_LBSPPA128_LBSPPB512_LPA4_LPB32_LRVW4_LWPM0p27_MIWT1_2_NTD0_NLCB1_PLR1_SU0_SUM0_SUS0_SVW1_ULSGRO1_VWA1_VWB2_WG32_8_1_WGM1_WGMXCC8_WGMXCCG304
    SolutionIndex: 21
    SolutionNameMin: Cijk_Alik_Bjlk_BBS_BH_Bias_HAS_SAV_UserArgs_MT64x64x64_MI16x16x1_SN_LDSB1_CLR1_GRVWA8_GSU1_GSUC0_GSUWGMRR0_K1_LBSPPA256_LBSPPB1024_LPA16_LPB32_LRVW8_LWPM0p26_MIWT2_2_NTD4_NLCB1_PLR1_SU0_SUM0_SUS0_SVW2_ULSGRO0_VWA2_VWB2_WG32_8_1_WGM1_WGMXCC8_WGMXCCG304
    SolutionIndex: 22
    SolutionNameMin: Cijk_Alik_Bjlk_BBS_BH_Bias_HAS_SAV_UserArgs_MT64x64x32_MI16x16x1_SN_LDSB0_CLR1_GRVWA1_GSU1_GSUC0_GSUWGMRR0_K1_LBSPPA128_LBSPPB512_LPA4_LPB32_LRVW4_LWPM0p26_MIWT2_2_NTD4_NLCB1_PLR1_SU0_SUM0_SUS0_SVW2_ULSGRO1_VWA2_VWB2_WG32_8_1_WGM1_WGMXCC8_WGMXCCG304
    SolutionIndex: 23
    SolutionNameMin: Cijk_Alik_Bjlk_BBS_BH_Bias_HAS_SAV_UserArgs_MT96x64x32_MI16x16x1_SN_LDSB0_CLR1_GRVWA1_GSU1_GSUC0_GSUWGMRR0_K1_LBSPPA128_LBSPPB512_LPA4_LPB32_LRVW4_LWPM0p25_MIWT3_2_NTD0_NLCB1_PLR1_SU0_SUM0_SUS0_SVW1_ULSGRO1_VWA1_VWB2_WG32_8_1_WGM1_WGMXCC8_WGMXCCG304
    SolutionIndex: 24
    SolutionNameMin: Cijk_Alik_Bjlk_BBS_BH_Bias_HAS_SAV_UserArgs_MT64x128x32_MI16x16x1_SN_LDSB0_CLR1_GRVWA1_GSU1_GSUC0_GSUWGMRR0_K1_LBSPPA128_LBSPPB1024_LPA4_LPB0_LRVW4_LWPM0p27_MIWT2_4_NTD0_NLCB1_PLR1_SU0_SUM0_SUS0_SVW2_ULSGRO1_VWA2_VWB4_WG32_8_1_WGM1_WGMXCC8_WGMXCCG304
    SolutionIndex: 25
    SolutionNameMin: Cijk_Alik_Bjlk_BBS_BH_Bias_HAS_SAV_UserArgs_MT32x128x32_MI16x16x1_SN_LDSB0_CLR1_GRVWA1_GSU1_GSUC0_GSUWGMRR0_K1_LBSPPA128_LBSPPB1024_LPA4_LPB0_LRVW4_LWPMn1_MIWT1_4_NTD4_NLCB1_PLR1_SU0_SUM0_SUS0_SVW1_ULSGRO1_VWA1_VWB4_WG32_8_1_WGM1_WGMXCC8_WGMXCCG304
    SolutionIndex: 26
    SolutionNameMin: Cijk_Alik_Bjlk_BBS_BH_Bias_HAS_SAV_UserArgs_MT64x128x32_MI16x16x1_SN_LDSB0_CLR1_GRVWA4_GSU1_GSUC0_GSUWGMRR0_K1_LBSPPA128_LBSPPB1024_LPA4_LPB0_LRVW4_LWPM0p27_MIWT2_4_NTD4_NLCB1_PLR1_SU16_SUM1_SUS64_SVW2_ULSGRO0_VWA2_VWB4_WG32_8_1_WGM1_WGMXCC8_WGMXCCG304
    SolutionIndex: 27
    SolutionNameMin: Cijk_Alik_Bjlk_BBS_BH_Bias_HAS_SAV_UserArgs_MT64x128x32_MI16x16x1_SN_LDSB0_CLR1_GRVWA1_GSU1_GSUC0_GSUWGMRR0_K1_LBSPPA128_LBSPPB1024_LPA4_LPB0_LRVW4_LWPM0p26_MIWT2_4_NTD0_NLCB1_PLR1_SU0_SUM0_SUS0_SVW2_ULSGRO1_VWA2_VWB4_WG32_8_1_WGM1_WGMXCC8_WGMXCCG304
    SolutionIndex: 28
    SolutionNameMin: Cijk_Alik_Bjlk_BBS_BH_Bias_HAS_SAV_UserArgs_MT96x128x32_MI16x16x1_SN_LDSB0_CLR1_GRVWA4_GSU1_GSUC0_GSUWGMRR0_K1_LBSPPA128_LBSPPB1024_LPA4_LPB0_LRVW4_LWPM0p25_MIWT3_4_NTD4_NLCB1_PLR1_SU16_SUM0_SUS256_SVW1_ULSGRO0_VWA1_VWB4_WG32_8_1_WGM1_WGMXCC8_WGMXCCG304
    SolutionIndex: 29
    SolutionNameMin: Cijk_Alik_Bjlk_BBS_BH_Bias_HAS_SAV_UserArgs_MT64x256x32_MI16x16x1_SN_LDSB1_CLR1_GRVWA1_GSU1_GSUC0_GSUWGMRR0_K1_LBSPPA128_LBSPPB2048_LPA4_LPB0_LRVW4_LWPMn1_MIWT2_8_NTD0_NLCB1_PLR1_SU0_SUM0_SUS0_SVW2_ULSGRO1_VWA2_VWB8_WG32_8_1_WGM1_WGMXCC8_WGMXCCG304
    SolutionIndex: 30
    SolutionNameMin: Cijk_Alik_Bjlk_BBS_BH_Bias_HAS_SAV_UserArgs_MT32x128x32_MI16x16x1_SN_LDSB0_CLR1_GRVWA1_GSU1_GSUC0_GSUWGMRR0_K1_LBSPPA128_LBSPPB1024_LPA4_LPB0_LRVW4_LWPM0p27_MIWT1_4_NTD4_NLCB1_PLR1_SU0_SUM0_SUS0_SVW1_ULSGRO1_VWA1_VWB4_WG32_8_1_WGM1_WGMXCC1_WGMXCCG304
    SolutionIndex: 31
    SolutionNameMin: Cijk_Alik_Bjlk_BBS_BH_Bias_HAS_SAV_UserArgs_MT32x256x32_MI16x16x1_SN_LDSB1_CLR1_GRVWA1_GSU1_GSUC0_GSUWGMRR0_K1_LBSPPA128_LBSPPB2048_LPA4_LPB0_LRVW4_LWPM0p50_MIWT1_8_NTD4_NLCB1_PLR1_SU0_SUM0_SUS0_SVW1_ULSGRO1_VWA1_VWB8_WG32_8_1_WGM1_WGMXCC8_WGMXCCG304
    SolutionIndex: 32
    SolutionNameMin: Cijk_Alik_Bjlk_BBS_BH_Bias_HAS_SAV_UserArgs_MT32x256x32_MI16x16x1_SN_LDSB1_CLR1_GRVWA1_GSU1_GSUC0_GSUWGMRR0_K1_LBSPPA128_LBSPPB2048_LPA4_LPB0_LRVW4_LWPM0p25_MIWT1_8_NTD0_NLCB1_PLR1_SU16_SUM0_SUS64_SVW1_ULSGRO1_VWA1_VWB8_WG32_8_1_WGM1_WGMXCC8_WGMXCCG304
    SolutionIndex: 33
    SolutionNameMin: Cijk_Alik_Bjlk_BBS_BH_Bias_HAS_SAV_UserArgs_MT64x256x32_MI16x16x1_SN_LDSB1_CLR1_GRVWA1_GSU1_GSUC0_GSUWGMRR0_K1_LBSPPA128_LBSPPB2048_LPA4_LPB0_LRVW4_LWPM0p50_MIWT2_8_NTD0_NLCB1_PLR1_SU16_SUM0_SUS64_SVW2_ULSGRO1_VWA2_VWB8_WG32_8_1_WGM1_WGMXCC1_WGMXCCG304
    SolutionIndex: 34
    SolutionNameMin: Cijk_Alik_Bjlk_BBS_BH_Bias_HAS_SAV_UserArgs_MT64x256x32_MI16x16x1_SN_LDSB1_CLR1_GRVWA1_GSU1_GSUC0_GSUWGMRR0_K1_LBSPPA128_LBSPPB2048_LPA4_LPB0_LRVW4_LWPM0p25_MIWT2_8_NTD4_NLCB1_PLR1_SU16_SUM0_SUS64_SVW2_ULSGRO1_VWA2_VWB8_WG32_8_1_WGM1_WGMXCC1_WGMXCCG304
    SolutionIndex: 35
    SolutionNameMin: Cijk_Alik_Bjlk_BBS_BH_Bias_HAS_SAV_UserArgs_MT96x256x32_MI16x16x1_SN_LDSB1_CLR1_GRVWA1_GSU1_GSUC0_GSUWGMRR0_K1_LBSPPA128_LBSPPB2048_LPA4_LPB0_LRVW4_LWPM0p26_MIWT3_8_NTD4_NLCB1_PLR1_SU16_SUM1_SUS64_SVW1_ULSGRO1_VWA1_VWB8_WG32_8_1_WGM1_WGMXCC8_WGMXCCG304
    SolutionIndex: 36
    SolutionNameMin: Cijk_Alik_Bjlk_BBS_BH_Bias_HAS_SAV_UserArgs_MT64x256x32_MI16x16x1_SN_LDSB1_CLR1_GRVWA1_GSU1_GSUC0_GSUWGMRR0_K1_LBSPPA128_LBSPPB2048_LPA4_LPB0_LRVW4_LWPM0p26_MIWT2_8_NTD0_NLCB1_PLR1_SU16_SUM0_SUS64_SVW2_ULSGRO1_VWA2_VWB8_WG32_8_1_WGM1_WGMXCC8_WGMXCCG304
    SolutionIndex: 37
    SolutionNameMin: Cijk_Alik_Bjlk_BBS_BH_Bias_HAS_SAV_UserArgs_MT32x128x64_MI16x16x1_SN_LDSB1_CLR1_GRVWA1_GSU1_GSUC0_GSUWGMRR0_K1_LBSPPA128_LBSPPB2048_LPA16_LPB0_LRVW8_LWPMn1_MIWT1_4_NTD4_NLCB1_PLR1_SU0_SUM0_SUS0_SVW1_ULSGRO1_VWA1_VWB4_WG32_8_1_WGM1_WGMXCC1_WGMXCCG304
    SolutionIndex: 38
    SolutionNameMin: Cijk_Alik_Bjlk_BBS_BH_Bias_HAS_SAV_UserArgs_MT32x256x32_MI16x16x1_SN_LDSB1_CLR1_GRVWA1_GSU1_GSUC0_GSUWGMRR0_K1_LBSPPA128_LBSPPB2048_LPA4_LPB0_LRVW4_LWPMn1_MIWT1_8_NTD4_NLCB1_PLR1_SU0_SUM0_SUS0_SVW1_ULSGRO1_VWA1_VWB8_WG32_8_1_WGM8_WGMXCC8_WGMXCCG304
    SolutionIndex: 39
    SolutionNameMin: Cijk_Alik_Bjlk_BBS_BH_Bias_HAS_SAV_UserArgs_MT32x256x32_MI16x16x1_SN_LDSB1_CLR1_GRVWA1_GSU1_GSUC0_GSUWGMRR0_K1_LBSPPA128_LBSPPB2048_LPA4_LPB0_LRVW4_LWPM0p25_MIWT1_8_NTD0_NLCB1_PLR1_SU16_SUM1_SUS64_SVW1_ULSGRO1_VWA1_VWB8_WG32_8_1_WGM6_WGMXCC8_WGMXCCG304
    SolutionIndex: 40
    SolutionNameMin: Cijk_Alik_Bjlk_BBS_BH_Bias_HAS_SAV_UserArgs_MT64x256x32_MI16x16x1_SN_LDSB1_CLR1_GRVWA1_GSU1_GSUC0_GSUWGMRR0_K1_LBSPPA128_LBSPPB2048_LPA4_LPB0_LRVW4_LWPM0p50_MIWT2_8_NTD0_NLCB1_PLR1_SU0_SUM0_SUS0_SVW2_ULSGRO1_VWA2_VWB8_WG32_8_1_WGM1_WGMXCC1_WGMXCCG304
    SolutionIndex: 41
    SolutionNameMin: Cijk_Alik_Bjlk_BBS_BH_Bias_HAS_SAV_UserArgs_MT64x128x32_MI16x16x1_SN_LDSB0_CLR1_GRVWA1_GSU1_GSUC0_GSUWGMRR0_K1_LBSPPA128_LBSPPB1024_LPA4_LPB0_LRVW4_LWPMn1_MIWT2_4_NTD0_NLCB1_PLR1_SU0_SUM0_SUS0_SVW2_ULSGRO1_VWA2_VWB4_WG32_8_1_WGM1_WGMXCC1_WGMXCCG304
    SolutionIndex: 42
    SolutionNameMin: Cijk_Alik_Bjlk_BBS_BH_Bias_HAS_SAV_UserArgs_MT96x256x32_MI16x16x1_SN_LDSB1_CLR1_GRVWA1_GSU1_GSUC0_GSUWGMRR0_K1_LBSPPA128_LBSPPB2048_LPA4_LPB0_LRVW4_LWPMn1_MIWT3_8_NTD4_NLCB1_PLR1_SU0_SUM0_SUS0_SVW1_ULSGRO1_VWA1_VWB8_WG32_8_1_WGM6_WGMXCC1_WGMXCCG304
    SolutionIndex: 43
    SolutionNameMin: Cijk_Alik_Bjlk_BBS_BH_Bias_HAS_SAV_UserArgs_MT128x128x32_MI16x16x1_SN_LDSB1_CLR1_GRVWA1_GSU1_GSUC0_GSUWGMRR0_K1_LBSPPA256_LBSPPB1024_LPA4_LPB0_LRVW4_LWPMn1_MIWT4_4_NTD0_NLCB1_PLR1_SU16_SUM0_SUS256_SVW4_ULSGRO1_VWA4_VWB4_WG32_8_1_WGM8_WGMXCC8_WGMXCCG304
    SolutionIndex: 44
    SolutionNameMin: Cijk_Alik_Bjlk_BBS_BH_Bias_HAS_SAV_UserArgs_MT32x128x64_MI16x16x1_SN_LDSB1_CLR1_GRVWA1_GSU1_GSUC0_GSUWGMRR0_K1_LBSPPA128_LBSPPB2048_LPA16_LPB0_LRVW8_LWPM0p26_MIWT1_4_NTD4_NLCB1_PLR1_SU0_SUM0_SUS0_SVW1_ULSGRO1_VWA1_VWB4_WG32_8_1_WGM1_WGMXCC1_WGMXCCG304
    SolutionIndex: 45
    SolutionNameMin: Cijk_Alik_Bjlk_BBS_BH_Bias_HAS_SAV_UserArgs_MT32x256x32_MI16x16x1_SN_LDSB1_CLR1_GRVWA1_GSU1_GSUC0_GSUWGMRR0_K1_LBSPPA128_LBSPPB2048_LPA4_LPB0_LRVW4_LWPM0p26_MIWT1_8_NTD4_NLCB1_PLR1_SU0_SUM0_SUS0_SVW1_ULSGRO1_VWA1_VWB8_WG32_8_1_WGM1_WGMXCC8_WGMXCCG304
    SolutionIndex: 46
    SolutionNameMin: Cijk_Alik_Bjlk_BBS_BH_Bias_HAS_SAV_UserArgs_MT32x256x32_MI16x16x1_SN_LDSB1_CLR1_GRVWA1_GSU1_GSUC0_GSUWGMRR0_K1_LBSPPA128_LBSPPB2048_LPA4_LPB0_LRVW4_LWPMn1_MIWT1_8_NTD0_NLCB1_PLR1_SU16_SUM1_SUS256_SVW1_ULSGRO1_VWA1_VWB8_WG32_8_1_WGM6_WGMXCC8_WGMXCCG304
    SolutionIndex: 47
    SolutionNameMin: Cijk_Alik_Bjlk_BBS_BH_Bias_HAS_SAV_UserArgs_MT32x256x32_MI16x16x1_SN_LDSB1_CLR1_GRVWA1_GSU1_GSUC0_GSUWGMRR0_K1_LBSPPA128_LBSPPB2048_LPA4_LPB0_LRVW4_LWPM0p27_MIWT1_8_NTD0_NLCB1_PLR1_SU16_SUM1_SUS256_SVW1_ULSGRO1_VWA1_VWB8_WG32_8_1_WGM8_WGMXCC8_WGMXCCG304
    SolutionIndex: 48
    SolutionNameMin: Cijk_Alik_Bjlk_BBS_BH_Bias_HAS_SAV_UserArgs_MT32x256x32_MI16x16x1_SN_LDSB1_CLR1_GRVWA1_GSU1_GSUC0_GSUWGMRR0_K1_LBSPPA128_LBSPPB2048_LPA4_LPB0_LRVW4_LWPM0p27_MIWT1_8_NTD0_NLCB1_PLR1_SU16_SUM0_SUS256_SVW1_ULSGRO1_VWA1_VWB8_WG32_8_1_WGM1_WGMXCC8_WGMXCCG304
    SolutionIndex: 49
    SolutionNameMin: Cijk_Alik_Bjlk_BBS_BH_Bias_HAS_SAV_UserArgs_MT96x128x32_MI16x16x1_SN_LDSB0_CLR1_GRVWA1_GSU1_GSUC0_GSUWGMRR0_K1_LBSPPA128_LBSPPB1024_LPA4_LPB0_LRVW4_LWPM0p50_MIWT3_4_NTD4_NLCB1_PLR1_SU0_SUM0_SUS0_SVW1_ULSGRO1_VWA1_VWB4_WG32_8_1_WGM1_WGMXCC8_WGMXCCG304
    SolutionIndex: 50
    SolutionNameMin: Cijk_Alik_Bjlk_BBS_BH_Bias_HAS_SAV_UserArgs_MT32x256x32_MI16x16x1_SN_LDSB1_CLR1_GRVWA1_GSU1_GSUC0_GSUWGMRR0_K1_LBSPPA128_LBSPPB2048_LPA4_LPB0_LRVW4_LWPM0p26_MIWT1_8_NTD0_NLCB1_PLR1_SU0_SUM0_SUS0_SVW1_ULSGRO1_VWA1_VWB8_WG32_8_1_WGM1_WGMXCC1_WGMXCCG304
    SolutionIndex: 51
    SolutionNameMin: Cijk_Alik_Bjlk_BBS_BH_Bias_HAS_SAV_UserArgs_MT32x256x32_MI16x16x1_SN_LDSB1_CLR1_GRVWA1_GSU1_GSUC0_GSUWGMRR0_K1_LBSPPA128_LBSPPB2048_LPA4_LPB0_LRVW4_LWPM0p50_MIWT1_8_NTD0_NLCB1_PLR1_SU0_SUM0_SUS0_SVW1_ULSGRO1_VWA1_VWB8_WG32_8_1_WGM1_WGMXCC1_WGMXCCG304
    SolutionIndex: 52
    SolutionNameMin: Cijk_Alik_Bjlk_BBS_BH_Bias_HAS_SAV_UserArgs_MT32x256x32_MI16x16x1_SN_LDSB1_CLR1_GRVWA1_GSU1_GSUC0_GSUWGMRR0_K1_LBSPPA128_LBSPPB2048_LPA4_LPB0_LRVW4_LWPM0p25_MIWT1_8_NTD0_NLCB1_PLR1_SU0_SUM0_SUS0_SVW1_ULSGRO1_VWA1_VWB8_WG32_8_1_WGM1_WGMXCC8_WGMXCCG304
    SolutionIndex: 53
    SolutionNameMin: Cijk_Alik_Bjlk_BBS_BH_Bias_HAS_SAV_UserArgs_MT64x128x32_MI16x16x1_SN_LDSB0_CLR1_GRVWA4_GSU1_GSUC0_GSUWGMRR0_K1_LBSPPA128_LBSPPB1024_LPA4_LPB0_LRVW4_LWPM0p50_MIWT2_4_NTD4_NLCB1_PLR1_SU0_SUM0_SUS0_SVW2_ULSGRO0_VWA2_VWB4_WG32_8_1_WGM1_WGMXCC8_WGMXCCG304
    SolutionIndex: 54
    SolutionNameMin: Cijk_Alik_Bjlk_BBS_BH_Bias_HAS_SAV_UserArgs_MT96x256x32_MI16x16x1_SN_LDSB1_CLR1_GRVWA1_GSU1_GSUC0_GSUWGMRR0_K1_LBSPPA128_LBSPPB2048_LPA4_LPB0_LRVW4_LWPMn1_MIWT3_8_NTD0_NLCB1_PLR1_SU16_SUM1_SUS256_SVW1_ULSGRO1_VWA1_VWB8_WG32_8_1_WGM8_WGMXCC1_WGMXCCG304
    SolutionIndex: 55
    SolutionNameMin: Cijk_Alik_Bjlk_BBS_BH_Bias_HAS_SAV_UserArgs_MT128x128x32_MI16x16x1_SN_LDSB1_CLR1_GRVWA1_GSU1_GSUC0_GSUWGMRR0_K1_LBSPPA256_LBSPPB1024_LPA4_LPB0_LRVW4_LWPM0p26_MIWT4_4_NTD0_NLCB1_PLR1_SU16_SUM0_SUS64_SVW4_ULSGRO1_VWA4_VWB4_WG32_8_1_WGM1_WGMXCC8_WGMXCCG304
    SolutionIndex: 56
    SolutionNameMin: Cijk_Alik_Bjlk_BBS_BH_Bias_HAS_SAV_UserArgs_MT32x128x32_MI16x16x1_SN_LDSB0_CLR1_GRVWA1_GSU1_GSUC0_GSUWGMRR0_K1_LBSPPA128_LBSPPB1024_LPA4_LPB0_LRVW4_LWPM0p25_MIWT1_4_NTD4_NLCB1_PLR1_SU0_SUM0_SUS0_SVW1_ULSGRO1_VWA1_VWB4_WG32_8_1_WGM1_WGMXCC1_WGMXCCG304
    SolutionIndex: 57
    SolutionNameMin: Cijk_Alik_Bjlk_BBS_BH_Bias_HAS_SAV_UserArgs_MT32x256x32_MI16x16x1_SN_LDSB1_CLR1_GRVWA1_GSU1_GSUC0_GSUWGMRR0_K1_LBSPPA128_LBSPPB2048_LPA4_LPB0_LRVW4_LWPM0p27_MIWT1_8_NTD4_NLCB1_PLR1_SU16_SUM1_SUS256_SVW1_ULSGRO1_VWA1_VWB8_WG32_8_1_WGM1_WGMXCC1_WGMXCCG304
    SolutionIndex: 58
    SolutionNameMin: Cijk_Alik_Bjlk_BBS_BH_Bias_HAS_SAV_UserArgs_MT32x256x32_MI16x16x1_SN_LDSB1_CLR1_GRVWA1_GSU1_GSUC0_GSUWGMRR0_K1_LBSPPA128_LBSPPB2048_LPA4_LPB0_LRVW4_LWPMn1_MIWT1_8_NTD4_NLCB1_PLR1_SU0_SUM0_SUS0_SVW1_ULSGRO1_VWA1_VWB8_WG32_8_1_WGM4_WGMXCC8_WGMXCCG304
    SolutionIndex: 59
    SolutionNameMin: Cijk_Alik_Bjlk_BBS_BH_Bias_HAS_SAV_UserArgs_MT64x256x32_MI16x16x1_SN_LDSB1_CLR1_GRVWA1_GSU1_GSUC0_GSUWGMRR0_K1_LBSPPA128_LBSPPB2048_LPA4_LPB0_LRVW4_LWPM0p25_MIWT2_8_NTD0_NLCB1_PLR1_SU16_SUM1_SUS256_SVW2_ULSGRO1_VWA2_VWB8_WG32_8_1_WGM1_WGMXCC1_WGMXCCG304
    SolutionIndex: 60
    SolutionNameMin: Cijk_Alik_Bjlk_BBS_BH_Bias_HAS_SAV_UserArgs_MT96x256x32_MI16x16x1_SN_LDSB1_CLR1_GRVWA1_GSU1_GSUC0_GSUWGMRR0_K1_LBSPPA128_LBSPPB2048_LPA4_LPB0_LRVW4_LWPMn1_MIWT3_8_NTD0_NLCB1_PLR1_SU16_SUM0_SUS64_SVW1_ULSGRO1_VWA1_VWB8_WG32_8_1_WGM8_WGMXCC1_WGMXCCG304
    SolutionIndex: 61
    SolutionNameMin: Cijk_Alik_Bjlk_BBS_BH_Bias_HAS_SAV_UserArgs_MT128x128x32_MI16x16x1_SN_LDSB1_CLR1_GRVWA1_GSU1_GSUC0_GSUWGMRR0_K1_LBSPPA256_LBSPPB1024_LPA4_LPB0_LRVW4_LWPM0p50_MIWT4_4_NTD0_NLCB1_PLR1_SU16_SUM1_SUS256_SVW4_ULSGRO1_VWA4_VWB4_WG32_8_1_WGM1_WGMXCC8_WGMXCCG304
    SolutionIndex: 62
    SolutionNameMin: Cijk_Alik_Bjlk_BBS_BH_Bias_HAS_SAV_UserArgs_MT128x128x32_MI16x16x1_SN_LDSB1_CLR1_GRVWA4_GSU1_GSUC0_GSUWGMRR0_K1_LBSPPA128_LBSPPB1024_LPA4_LPB0_LRVW4_MIWT4_4_NTD0_NLCB1_PLR1_SS1_SU16_SUM0_SUS256_SVW1_ULSGRO0_VWA1_VWB4_WG32_8_1_WGM8_WGMXCC8_WGMXCCG304
    SolutionIndex: 63
    SolutionNameMin: Cijk_Alik_Bjlk_BBS_BH_Bias_HAS_SAV_UserArgs_MT128x128x32_MI16x16x1_SN_LDSB1_CLR1_GRVWA1_GSU1_GSUC0_GSUWGMRR0_K1_LBSPPA256_LBSPPB1024_LPA4_LPB0_LRVW4_LWPM0p50_MIWT4_4_NTD0_NLCB1_PLR1_SU16_SUM1_SUS256_SVW4_ULSGRO1_VWA4_VWB4_WG32_8_1_WGM1_WGMXCC8_WGMXCCG304
    SolutionIndex: 64
    SolutionNameMin: Cijk_Alik_Bjlk_BBS_BH_UserArgs_MT64x128x64_MI16x16x1_SN_LDSB1_GRVWA8_GRVWB8_GSU1_GSUAMB_GSUC0_GSUWGMRR0_K1_LBSPPA512_LBSPPB2048_LPA16_LPB32_LRVW8_MIWT4_2_SU16_SUM1_SUS128_SVW4_VWA4_VWB2_WG16_16_1_WGM1_WGMXCC8_WGMXCCG304
    SolutionIndex: 65
    SolutionNameMin: Cijk_Alik_Bjlk_BBS_BH_Bias_HAS_SAV_UserArgs_MT32x256x32_MI16x16x1_SN_LDSB1_CLR1_GRVWA1_GSU1_GSUC0_GSUWGMRR0_K1_LBSPPA128_LBSPPB2048_LPA4_LPB0_LRVW4_LWPM0p26_MIWT1_8_NTD0_NLCB1_PLR1_SU0_SUM0_SUS0_SVW1_ULSGRO1_VWA1_VWB8_WG32_8_1_WGM1_WGMXCC1_WGMXCCG304
    SolutionIndex: 66
    SolutionNameMin: Cijk_Alik_Bjlk_BBS_BH_Bias_HAS_SAV_UserArgs_MT128x128x32_MI16x16x1_SN_LDSB1_CLR1_GRVWA1_GSU1_GSUC0_GSUWGMRR0_K1_LBSPPA256_LBSPPB1024_LPA4_LPB0_LRVW4_LWPM0p26_MIWT4_4_NTD0_NLCB1_PLR1_SU16_SUM0_SUS64_SVW4_ULSGRO1_VWA4_VWB4_WG32_8_1_WGM1_WGMXCC8_WGMXCCG304
    SolutionIndex: 67
    SolutionNameMin: Cijk_Alik_Bjlk_BBS_BH_Bias_HAS_SAV_UserArgs_MT32x256x32_MI16x16x1_SN_LDSB1_CLR1_GRVWA1_GSU1_GSUC0_GSUWGMRR0_K1_LBSPPA128_LBSPPB2048_LPA4_LPB0_LRVW4_LWPM0p50_MIWT1_8_NTD0_NLCB1_PLR1_SU0_SUM0_SUS0_SVW1_ULSGRO1_VWA1_VWB8_WG32_8_1_WGM1_WGMXCC1_WGMXCCG304
    SolutionIndex: 68
    SolutionNameMin: Cijk_Alik_Bjlk_BBS_BH_Bias_HAS_SAV_UserArgs_MT128x128x32_MI16x16x1_SN_LDSB1_CLR1_GRVWA1_GSU1_GSUC0_GSUWGMRR0_K1_LBSPPA256_LBSPPB1024_LPA4_LPB0_LRVW4_LWPMn1_MIWT4_4_NTD0_NLCB1_PLR1_SU16_SUM0_SUS256_SVW4_ULSGRO1_VWA4_VWB4_WG32_8_1_WGM8_WGMXCC8_WGMXCCG304
    SolutionIndex: 69
    SolutionNameMin: Cijk_Alik_Bjlk_BBS_BH_UserArgs_MT256x128x64_MI16x16x1_SN_LDSB1_GRVWA8_GRVWB8_GSU1_GSUAMBSK_GSUC0_GSUWGMRR0_K1_LBSPPA1024_LBSPPB2048_LPA16_LPB0_LRVW8_MIWT8_4_SU0_SUM0_SUS0_SVW8_VWA8_VWB4_WG32_8_1_WGM1_WGMXCC8_WGMXCCG304
    SolutionIndex: 70
    SolutionNameMin: Cijk_Alik_Bjlk_BBS_BH_Bias_HAS_SAV_UserArgs_MT32x256x32_MI16x16x1_SN_LDSB1_CLR1_GRVWA1_GSU1_GSUC0_GSUWGMRR0_K1_LBSPPA128_LBSPPB2048_LPA4_LPB0_LRVW4_LWPM0p27_MIWT1_8_NTD0_NLCB1_PLR1_SU16_SUM0_SUS256_SVW1_ULSGRO1_VWA1_VWB8_WG32_8_1_WGM1_WGMXCC8_WGMXCCG304
    SolutionIndex: 71
    SolutionNameMin: Cijk_Alik_Bjlk_BBS_BH_Bias_HAS_SAV_UserArgs_MT32x256x32_MI16x16x1_SN_LDSB1_CLR1_GRVWA1_GSU1_GSUC0_GSUWGMRR0_K1_LBSPPA128_LBSPPB2048_LPA4_LPB0_LRVW4_LWPMn1_MIWT1_8_NTD0_NLCB1_PLR1_SU16_SUM1_SUS256_SVW1_ULSGRO1_VWA1_VWB8_WG32_8_1_WGM6_WGMXCC8_WGMXCCG304
    SolutionIndex: 72
    SolutionNameMin: Cijk_Alik_Bjlk_BBS_BH_Bias_HAS_SAV_UserArgs_MT32x256x32_MI16x16x1_SN_LDSB1_CLR1_GRVWA1_GSU1_GSUC0_GSUWGMRR0_K1_LBSPPA128_LBSPPB2048_LPA4_LPB0_LRVW4_LWPM0p25_MIWT1_8_NTD0_NLCB1_PLR1_SU0_SUM0_SUS0_SVW1_ULSGRO1_VWA1_VWB8_WG32_8_1_WGM1_WGMXCC8_WGMXCCG304
    SolutionIndex: 73
    SolutionNameMin: Cijk_Alik_Bjlk_BBS_BH_Bias_HAS_SAV_UserArgs_MT32x64x32_MI16x16x1_SN_LDSB0_CLR1_GRVWA1_GSU1_GSUC0_GSUWGMRR0_K1_LBSPPA128_LBSPPB512_LPA4_LPB32_LRVW4_LWPM0p27_MIWT1_2_NTD0_NLCB1_PLR1_SU0_SUM0_SUS0_SVW1_ULSGRO1_VWA1_VWB2_WG32_8_1_WGM1_WGMXCC1_WGMXCCG304
    SolutionIndex: 74
    SolutionNameMin: Cijk_Alik_Bjlk_BBS_BH_Bias_HAS_SAV_UserArgs_MT96x256x32_MI16x16x1_SN_LDSB1_CLR1_GRVWA1_GSU1_GSUC0_GSUWGMRR0_K1_LBSPPA128_LBSPPB2048_LPA4_LPB0_LRVW4_LWPMn1_MIWT3_8_NTD0_NLCB1_PLR1_SU16_SUM0_SUS64_SVW1_ULSGRO1_VWA1_VWB8_WG32_8_1_WGM8_WGMXCC1_WGMXCCG304
    SolutionIndex: 75
    SolutionNameMin: Cijk_Alik_Bjlk_BBS_BH_Bias_HAS_SAV_UserArgs_MT128x128x32_MI16x16x1_SN_LDSB1_CLR1_GRVWA4_GSU1_GSUC0_GSUWGMRR0_K1_LBSPPA128_LBSPPB1024_LPA4_LPB0_LRVW4_MIWT4_4_NTD0_NLCB1_PLR1_SS1_SU16_SUM0_SUS256_SVW1_ULSGRO0_VWA1_VWB4_WG32_8_1_WGM8_WGMXCC8_WGMXCCG304
    SolutionIndex: 76
    SolutionNameMin: Cijk_Alik_Bjlk_BBS_BH_Bias_HAS_SAV_UserArgs_MT96x256x32_MI16x16x1_SN_LDSB1_CLR1_GRVWA1_GSU1_GSUC0_GSUWGMRR0_K1_LBSPPA128_LBSPPB2048_LPA4_LPB0_LRVW4_LWPMn1_MIWT3_8_NTD4_NLCB1_PLR1_SU0_SUM0_SUS0_SVW1_ULSGRO1_VWA1_VWB8_WG32_8_1_WGM6_WGMXCC1_WGMXCCG304
- - - [1024, 1, 1, 256]
    - [0, 0.0]
  - - [4096, 1, 1, 256]
    - [6, 0.0]
  - - [16384, 1, 1, 256]
    - [6, 0.0]
  - - [65536, 1, 1, 256]
    - [3, 0.0]
  - - [262144, 1, 1, 256]
    - [2, 0.0]
  - - [1024, 1, 1, 1024]
    - [5, 0.0]
  - - [4096, 1, 1, 1024]
    - [5, 0.0]
  - - [16384, 1, 1, 1024]
    - [6, 0.0]
  - - [65536, 1, 1, 1024]
    - [2, 0.0]
  - - [262144, 1, 1, 1024]
    - [2, 0.0]
  - - [1024, 1, 1, 4096]
    - [5, 0.0]
  - - [4096, 1, 1, 4096]
    - [5, 0.0]
  - - [16384, 1, 1, 4096]
    - [1, 0.0]
  - - [65536, 1, 1, 4096]
    - [3, 0.0]
  - - [262144, 1, 1, 4096]
    - [4, 0.0]
  - - [24, 128, 38, 6]
    - [7, 0.0]
  - - [32, 256, 38, 52]
    - [8, 0.0]
  - - [32, 256, 38, 110]
    - [9, 0.0]
  - - [56, 256, 38, 128]
    - [10, 0.0]
  - - [56, 256, 38, 52]
    - [11, 0.0]
  - - [96, 256, 38, 90]
    - [12, 0.0]
  - - [112, 256, 38, 90]
    - [13, 0.0]
  - - [24, 128, 76, 6]
    - [14, 0.0]
  - - [32, 256, 76, 52]
    - [15, 0.0]
  - - [32, 256, 76, 110]
    - [9, 0.0]
  - - [56, 256, 76, 128]
    - [16, 0.0]
  - - [56, 256, 76, 52]
    - [17, 0.0]
  - - [96, 256, 76, 90]
    - [18, 0.0]
  - - [112, 256, 76, 90]
    - [19, 0.0]
  - - [24, 128, 152, 6]
    - [20, 0.0]
  - - [32, 256, 152, 52]
    - [11, 0.0]
  - - [32, 256, 152, 110]
    - [11, 0.0]
  - - [56, 256, 152, 128]
    - [21, 0.0]
  - - [56, 256, 152, 52]
    - [22, 0.0]
  - - [96, 256, 152, 90]
    - [23, 0.0]
  - - [112, 256, 152, 90]
    - [24, 0.0]
  - - [24, 128, 304, 6]
    - [15, 0.0]
  - - [32, 256, 304, 52]
    - [25, 0.0]
  - - [32, 256, 304, 110]
    - [25, 0.0]
  - - [56, 256, 304, 128]
    - [26, 0.0]
  - - [56, 256, 304, 52]
    - [27, 0.0]
  - - [96, 256, 304, 90]
    - [28, 0.0]
  - - [112, 256, 304, 90]
    - [29, 0.0]
  - - [24, 128, 608, 6]
    - [30, 0.0]
  - - [32, 256, 608, 52]
    - [31, 0.0]
  - - [32, 256, 608, 110]
    - [32, 0.0]
  - - [56, 256, 608, 128]
    - [33, 0.0]
  - - [56, 256, 608, 52]
    - [34, 0.0]
  - - [96, 256, 608, 90]
    - [35, 0.0]
  - - [112, 256, 608, 90]
    - [36, 0.0]
  - - [24, 128, 912, 6]
    - [37, 0.0]
  - - [32, 256, 912, 52]
    - [38, 0.0]
  - - [32, 256, 912, 110]
    - [39, 0.0]
  - - [56, 256, 912, 128]
    - [40, 0.0]
  - - [56, 256, 912, 52]
    - [41, 0.0]
  - - [96, 256, 912, 90]
    - [42, 0.0]
  - - [112, 256, 912, 90]
    - [43, 0.0]
  - - [24, 128, 1287, 6]
    - [44, 0.0]
  - - [32, 256, 1287, 52]
    - [45, 0.0]
  - - [32, 256, 1287, 110]
    - [46, 0.0]
  - - [56, 256, 1287, 128]
    - [47, 0.0]
  - - [56, 256, 1287, 52]
    - [48, 0.0]
  - - [96, 256, 1287, 90]
    - [49, 0.0]
  - - [112, 256, 1287, 90]
    - [62, 0.0]
  - - [24, 128, 1520, 6]
    - [37, 0.0]
  - - [32, 256, 1520, 52]
    - [50, 0.0]
  - - [32, 256, 1520, 110]
    - [51, 0.0]
  - - [56, 256, 1520, 128]
    - [52, 0.0]
  - - [56, 256, 1520, 52]
    - [53, 0.0]
  - - [96, 256, 1520, 90]
    - [54, 0.0]
  - - [112, 256, 1520, 90]
    - [55, 0.0]
  - - [24, 128, 2048, 6]
    - [56, 0.0]
  - - [32, 256, 2048, 52]
    - [57, 0.0]
  - - [32, 256, 2048, 110]
    - [58, 0.0]
  - - [56, 256, 2048, 128]
    - [52, 0.0]
  - - [56, 256, 2048, 52]
    - [59, 0.0]
  - - [96, 256, 2048, 90]
    - [60, 0.0]
  - - [112, 256, 2048, 90]
    - [61, 0.0]
  - - [512, 1, 1, 256]
    - [0, 0.0]
  - - [512, 1, 1, 1024]
    - [5, 0.0]
  - - [512, 1, 1, 4096]
    - [5, 0.0]
  - - [512, 16384, 1, 256]
    - [0, 0.0]
  - - [512, 16384, 1, 512]
    - [63, 0.0]
  - - [512, 16384, 1, 1024]
    - [5, 0.0]
  - - [512, 16384, 1, 4096]
    - [5, 0.0]
  - - [3, 1, 1, 256]
    - [0, 0.0]
  - - [3, 1, 1, 1024]
    - [5, 0.0]
  - - [3, 1, 1, 4096]
    - [5, 0.0]
  - - [3, 16384, 1, 256]
    - [0, 0.0]
  - - [3, 16384, 1, 512]
    - [63, 0.0]
  - - [3, 16384, 1, 1024]
    - [5, 0.0]
  - - [3, 16384, 1, 4096]
    - [5, 0.0]
  - - [3, 80640, 1, 128]
    - [65, 0.0]
  - - [3, 80640, 1, 256]
    - [0, 0.0]
  - - [3, 80640, 1, 512]
    - [63, 0.0]
  - - [3, 80640, 1, 1024]
    - [5, 0.0]
  - - [3, 80640, 1, 4096]
    - [5, 0.0]
  - - [3, 134400, 1, 128]
    - [73, 0.0]
  - - [3, 134400, 1, 256]
    - [0, 0.0]
  - - [3, 134400, 1, 512]
    - [63, 0.0]
  - - [3, 134400, 1, 1024]
    - [5, 0.0]
  - - [3, 134400, 1, 4096]
    - [5, 0.0]
  - - [3, 276480, 1, 128]
    - [65, 0.0]
  - - [3, 276480, 1, 256]
    - [0, 0.0]
  - - [3, 276480, 1, 512]
    - [63, 0.0]
  - - [3, 276480, 1, 1024]
    - [5, 0.0]
  - - [3, 276480, 1, 4096]
    - [5, 0.0]
  - - [3, 288000, 1, 128]
    - [67, 0.0]
  - - [3, 288000, 1, 256]
    - [0, 0.0]
  - - [3, 288000, 1, 512]
    - [63, 0.0]
  - - [3, 288000, 1, 1024]
    - [5, 0.0]
  - - [3, 288000, 1, 4096]
    - [5, 0.0]
  - - [3, 354816, 1, 128]
    - [67, 0.0]
  - - [3, 354816, 1, 256]
    - [0, 0.0]
  - - [3, 354816, 1, 512]
    - [63, 0.0]
  - - [3, 354816, 1, 1024]
    - [5, 0.0]
  - - [3, 354816, 1, 4096]
    - [5, 0.0]
  - - [3, 403200, 1, 128]
    - [71, 0.0]
  - - [3, 403200, 1, 256]
    - [0, 0.0]
  - - [3, 403200, 1, 512]
    - [63, 0.0]
  - - [3, 403200, 1, 1024]
    - [5, 0.0]
  - - [3, 403200, 1, 4096]
    - [5, 0.0]
  - - [3, 460800, 1, 128]
    - [67, 0.0]
  - - [3, 460800, 1, 256]
    - [0, 0.0]
  - - [3, 460800, 1, 512]
    - [63, 0.0]
  - - [3, 460800, 1, 1024]
    - [5, 0.0]
  - - [3, 460800, 1, 4096]
    - [5, 0.0]
  - - [3, 480000, 1, 128]
    - [67, 0.0]
  - - [3, 480000, 1, 256]
    - [0, 0.0]
  - - [3, 480000, 1, 512]
    - [63, 0.0]
  - - [3, 480000, 1, 1024]
    - [5, 0.0]
  - - [3, 480000, 1, 4096]
    - [5, 0.0]
  - - [3, 672000, 1, 128]
    - [67, 0.0]
  - - [3, 672000, 1, 256]
    - [0, 0.0]
  - - [3, 672000, 1, 512]
    - [63, 0.0]
  - - [3, 672000, 1, 1024]
    - [5, 0.0]
  - - [3, 672000, 1, 4096]
    - [5, 0.0]
  - - [3, 1216512, 1, 128]
    - [67, 0.0]
  - - [3, 1216512, 1, 256]
    - [0, 0.0]
  - - [3, 1216512, 1, 512]
    - [63, 0.0]
  - - [3, 1216512, 1, 1024]
    - [5, 0.0]
  - - [3, 1216512, 1, 4096]
    - [5, 0.0]
  - - [3, 1240000, 1, 128]
    - [65, 0.0]
  - - [3, 1240000, 1, 256]
    - [0, 0.0]
  - - [3, 1240000, 1, 512]
    - [63, 0.0]
  - - [3, 1240000, 1, 1024]
    - [5, 0.0]
  - - [3, 1240000, 1, 4096]
    - [5, 0.0]
  - - [3, 1267200, 1, 128]
    - [65, 0.0]
  - - [3, 1267200, 1, 256]
    - [0, 0.0]
  - - [3, 1267200, 1, 512]
    - [63, 0.0]
  - - [3, 1267200, 1, 1024]
    - [5, 0.0]
  - - [3, 1267200, 1, 4096]
    - [5, 0.0]
  - - [3, 1382400, 1, 128]
    - [65, 0.0]
  - - [3, 1382400, 1, 256]
    - [0, 0.0]
  - - [3, 1382400, 1, 512]
    - [63, 0.0]
  - - [3, 1382400, 1, 1024]
    - [5, 0.0]
  - - [3, 1382400, 1, 4096]
    - [5, 0.0]
  - - [3, 1440000, 1, 128]
    - [65, 0.0]
  - - [3, 1440000, 1, 256]
    - [0, 0.0]
  - - [3, 1440000, 1, 512]
    - [63, 0.0]
  - - [3, 1440000, 1, 1024]
    - [5, 0.0]
  - - [3, 1440000, 1, 4096]
    - [5, 0.0]
  - - [3, 2112000, 1, 128]
    - [65, 0.0]
  - - [3, 2112000, 1, 256]
    - [0, 0.0]
  - - [3, 2112000, 1, 512]
    - [63, 0.0]
  - - [3, 2112000, 1, 1024]
    - [5, 0.0]
  - - [3, 2112000, 1, 4096]
    - [5, 0.0]
  - - [3, 2200000, 1, 128]
    - [67, 0.0]
  - - [3, 2200000, 1, 256]
    - [0, 0.0]
  - - [3, 2200000, 1, 512]
    - [63, 0.0]
  - - [3, 2200000, 1, 1024]
    - [5, 0.0]
  - - [3, 2200000, 1, 4096]
    - [5, 0.0]
  - - [3, 2304000, 1, 128]
    - [72, 0.0]
  - - [3, 2304000, 1, 256]
    - [0, 0.0]
  - - [3, 2304000, 1, 512]
    - [63, 0.0]
  - - [3, 2304000, 1, 1024]
    - [5, 0.0]
  - - [3, 2304000, 1, 4096]
    - [5, 0.0]
  - - [3, 2400000, 1, 128]
    - [70, 0.0]
  - - [3, 2400000, 1, 256]
    - [0, 0.0]
  - - [3, 2400000, 1, 512]
    - [63, 0.0]
  - - [3, 2400000, 1, 1024]
    - [5, 0.0]
  - - [3, 2400000, 1, 4096]
    - [5, 0.0]
  - - [512, 20160, 1, 256]
    - [64, 0.0]
  - - [512, 20160, 1, 512]
    - [63, 0.0]
  - - [512, 20160, 1, 1024]
    - [5, 0.0]
  - - [512, 20160, 1, 4096]
    - [5, 0.0]
  - - [512, 33600, 1, 256]
    - [64, 0.0]
  - - [512, 33600, 1, 512]
    - [63, 0.0]
  - - [512, 33600, 1, 1024]
    - [5, 0.0]
  - - [512, 33600, 1, 4096]
    - [5, 0.0]
  - - [512, 69120, 1, 256]
    - [64, 0.0]
  - - [512, 69120, 1, 512]
    - [63, 0.0]
  - - [512, 69120, 1, 1024]
    - [5, 0.0]
  - - [512, 69120, 1, 4096]
    - [5, 0.0]
  - - [512, 72000, 1, 256]
    - [64, 0.0]
  - - [512, 72000, 1, 512]
    - [63, 0.0]
  - - [512, 72000, 1, 1024]
    - [5, 0.0]
  - - [512, 72000, 1, 4096]
    - [5, 0.0]
  - - [512, 88704, 1, 256]
    - [64, 0.0]
  - - [512, 88704, 1, 512]
    - [63, 0.0]
  - - [512, 88704, 1, 1024]
    - [5, 0.0]
  - - [512, 88704, 1, 4096]
    - [5, 0.0]
  - - [512, 100800, 1, 256]
    - [64, 0.0]
  - - [512, 100800, 1, 512]
    - [63, 0.0]
  - - [512, 100800, 1, 1024]
    - [5, 0.0]
  - - [512, 100800, 1, 4096]
    - [5, 0.0]
  - - [512, 115200, 1, 256]
    - [64, 0.0]
  - - [512, 115200, 1, 512]
    - [63, 0.0]
  - - [512, 115200, 1, 1024]
    - [5, 0.0]
  - - [512, 115200, 1, 4096]
    - [5, 0.0]
  - - [512, 120000, 1, 256]
    - [64, 0.0]
  - - [512, 120000, 1, 512]
    - [63, 0.0]
  - - [512, 120000, 1, 1024]
    - [5, 0.0]
  - - [512, 120000, 1, 4096]
    - [5, 0.0]
  - - [512, 147840, 1, 256]
    - [64, 0.0]
  - - [512, 147840, 1, 512]
    - [63, 0.0]
  - - [512, 147840, 1, 1024]
    - [5, 0.0]
  - - [512, 147840, 1, 4096]
    - [5, 0.0]
  - - [512, 168000, 1, 256]
    - [64, 0.0]
  - - [512, 168000, 1, 512]
    - [63, 0.0]
  - - [512, 168000, 1, 1024]
    - [5, 0.0]
  - - [512, 168000, 1, 4096]
    - [5, 0.0]
  - - [512, 304128, 1, 256]
    - [66, 0.0]
  - - [512, 304128, 1, 512]
    - [63, 0.0]
  - - [512, 304128, 1, 1024]
    - [5, 0.0]
  - - [512, 304128, 1, 4096]
    - [5, 0.0]
  - - [512, 310000, 1, 256]
    - [66, 0.0]
  - - [512, 310000, 1, 512]
    - [63, 0.0]
  - - [512, 310000, 1, 1024]
    - [5, 0.0]
  - - [512, 310000, 1, 4096]
    - [5, 0.0]
  - - [512, 316800, 1, 256]
    - [66, 0.0]
  - - [512, 316800, 1, 512]
    - [63, 0.0]
  - - [512, 316800, 1, 1024]
    - [5, 0.0]
  - - [512, 316800, 1, 4096]
    - [5, 0.0]
  - - [512, 345600, 1, 256]
    - [66, 0.0]
  - - [512, 345600, 1, 512]
    - [63, 0.0]
  - - [512, 345600, 1, 1024]
    - [5, 0.0]
  - - [512, 345600, 1, 4096]
    - [5, 0.0]
  - - [512, 360000, 1, 256]
    - [66, 0.0]
  - - [512, 360000, 1, 512]
    - [63, 0.0]
  - - [512, 360000, 1, 1024]
    - [5, 0.0]
  - - [512, 360000, 1, 4096]
    - [5, 0.0]
  - - [512, 528000, 1, 256]
    - [66, 0.0]
  - - [512, 528000, 1, 512]
    - [63, 0.0]
  - - [512, 528000, 1, 1024]
    - [5, 0.0]
  - - [512, 528000, 1, 4096]
    - [5, 0.0]
  - - [512, 550000, 1, 256]
    - [68, 0.0]
  - - [512, 550000, 1, 512]
    - [63, 0.0]
  - - [512, 550000, 1, 1024]
    - [5, 0.0]
  - - [512, 550000, 1, 4096]
    - [5, 0.0]
  - - [512, 576000, 1, 256]
    - [66, 0.0]
  - - [512, 576000, 1, 512]
    - [63, 0.0]
  - - [512, 576000, 1, 1024]
    - [5, 0.0]
  - - [512, 576000, 1, 4096]
    - [5, 0.0]
  - - [512, 600000, 1, 256]
    - [66, 0.0]
  - - [512, 600000, 1, 512]
    - [63, 0.0]
  - - [512, 600000, 1, 1024]
    - [5, 0.0]
  - - [512, 600000, 1, 4096]
    - [5, 0.0]
  - - [2048, 1, 1, 256]
    - [6, 0.0]
  - - [2048, 1, 1, 1024]
    - [5, 0.0]
  - - [2048, 1, 1, 4096]
    - [5, 0.0]
  - - [2048, 2520, 1, 256]
    - [6, 0.0]
  - - [2048, 2520, 1, 512]
    - [69, 0.0]
  - - [2048, 2520, 1, 1024]
    - [5, 0.0]
  - - [2048, 2520, 1, 4096]
    - [5, 0.0]
  - - [2048, 4200, 1, 256]
    - [6, 0.0]
  - - [2048, 4200, 1, 512]
    - [69, 0.0]
  - - [2048, 4200, 1, 1024]
    - [5, 0.0]
  - - [2048, 4200, 1, 4096]
    - [5, 0.0]
  - - [2048, 8640, 1, 256]
    - [6, 0.0]
  - - [2048, 8640, 1, 512]
    - [64, 0.0]
  - - [2048, 8640, 1, 1024]
    - [5, 0.0]
  - - [2048, 8640, 1, 4096]
    - [5, 0.0]
  - - [2048, 9000, 1, 256]
    - [6, 0.0]
  - - [2048, 9000, 1, 512]
    - [64, 0.0]
  - - [2048, 9000, 1, 1024]
    - [5, 0.0]
  - - [2048, 9000, 1, 4096]
    - [5, 0.0]
  - - [2048, 11088, 1, 256]
    - [6, 0.0]
  - - [2048, 11088, 1, 512]
    - [64, 0.0]
  - - [2048, 11088, 1, 1024]
    - [5, 0.0]
  - - [2048, 11088, 1, 4096]
    - [5, 0.0]
  - - [2048, 11200, 1, 256]
    - [6, 0.0]
  - - [2048, 11200, 1, 512]
    - [64, 0.0]
  - - [2048, 11200, 1, 1024]
    - [5, 0.0]
  - - [2048, 11200, 1, 4096]
    - [5, 0.0]
  - - [2048, 12600, 1, 256]
    - [6, 0.0]
  - - [2048, 12600, 1, 512]
    - [64, 0.0]
  - - [2048, 12600, 1, 1024]
    - [5, 0.0]
  - - [2048, 12600, 1, 4096]
    - [5, 0.0]
  - - [2048, 14400, 1, 256]
    - [6, 0.0]
  - - [2048, 14400, 1, 512]
    - [64, 0.0]
  - - [2048, 14400, 1, 1024]
    - [5, 0.0]
  - - [2048, 14400, 1, 4096]
    - [5, 0.0]
  - - [2048, 15000, 1, 256]
    - [6, 0.0]
  - - [2048, 15000, 1, 512]
    - [64, 0.0]
  - - [2048, 15000, 1, 1024]
    - [5, 0.0]
  - - [2048, 15000, 1, 4096]
    - [5, 0.0]
  - - [2048, 18480, 1, 256]
    - [6, 0.0]
  - - [2048, 18480, 1, 512]
    - [64, 0.0]
  - - [2048, 18480, 1, 1024]
    - [5, 0.0]
  - - [2048, 18480, 1, 4096]
    - [5, 0.0]
  - - [2048, 21000, 1, 256]
    - [6, 0.0]
  - - [2048, 21000, 1, 512]
    - [64, 0.0]
  - - [2048, 21000, 1, 1024]
    - [5, 0.0]
  - - [2048, 21000, 1, 4096]
    - [5, 0.0]
  - - [2048, 38016, 1, 256]
    - [6, 0.0]
  - - [2048, 38016, 1, 512]
    - [64, 0.0]
  - - [2048, 38016, 1, 1024]
    - [5, 0.0]
  - - [2048, 38016, 1, 4096]
    - [5, 0.0]
  - - [2048, 39600, 1, 256]
    - [6, 0.0]
  - - [2048, 39600, 1, 512]
    - [64, 0.0]
  - - [2048, 39600, 1, 1024]
    - [5, 0.0]
  - - [2048, 39600, 1, 4096]
    - [5, 0.0]
  - - [2048, 40000, 1, 256]
    - [6, 0.0]
  - - [2048, 40000, 1, 512]
    - [64, 0.0]
  - - [2048, 40000, 1, 1024]
    - [5, 0.0]
  - - [2048, 40000, 1, 4096]
    - [5, 0.0]
  - - [2048, 43200, 1, 256]
    - [6, 0.0]
  - - [2048, 43200, 1, 512]
    - [64, 0.0]
  - - [2048, 43200, 1, 1024]
    - [5, 0.0]
  - - [2048, 43200, 1, 4096]
    - [5, 0.0]
  - - [2048, 45000, 1, 256]
    - [6, 0.0]
  - - [2048, 45000, 1, 512]
    - [64, 0.0]
  - - [2048, 45000, 1, 1024]
    - [5, 0.0]
  - - [2048, 45000, 1, 4096]
    - [5, 0.0]
  - - [2048, 66000, 1, 256]
    - [6, 0.0]
  - - [2048, 66000, 1, 512]
    - [64, 0.0]
  - - [2048, 66000, 1, 1024]
    - [5, 0.0]
  - - [2048, 66000, 1, 4096]
    - [5, 0.0]
  - - [2048, 67200, 1, 256]
    - [6, 0.0]
  - - [2048, 67200, 1, 512]
    - [64, 0.0]
  - - [2048, 67200, 1, 1024]
    - [5, 0.0]
  - - [2048, 67200, 1, 4096]
    - [5, 0.0]
  - - [2048, 70000, 1, 256]
    - [6, 0.0]
  - - [2048, 70000, 1, 512]
    - [64, 0.0]
  - - [2048, 70000, 1, 1024]
    - [5, 0.0]
  - - [2048, 70000, 1, 4096]
    - [5, 0.0]
  - - [2048, 72000, 1, 256]
    - [6, 0.0]
  - - [2048, 72000, 1, 512]
    - [64, 0.0]
  - - [2048, 72000, 1, 1024]
    - [5, 0.0]
  - - [2048, 72000, 1, 4096]
    - [5, 0.0]
  - - [2048, 75000, 1, 256]
    - [6, 0.0]
  - - [2048, 75000, 1, 512]
    - [64, 0.0]
  - - [2048, 75000, 1, 1024]
    - [5, 0.0]
  - - [2048, 75000, 1, 4096]
    - [5, 0.0]
  - - [6144, 1, 1, 256]
    - [6, 0.0]
  - - [6144, 1, 1, 1024]
    - [6, 0.0]
  - - [6144, 1, 1, 4096]
    - [1, 0.0]
  - - [6144, 210, 1, 256]
    - [6, 0.0]
  - - [6144, 210, 1, 768]
    - [64, 0.0]
  - - [6144, 210, 1, 1024]
    - [6, 0.0]
  - - [6144, 210, 1, 4096]
    - [1, 0.0]
  - - [6144, 720, 1, 256]
    - [6, 0.0]
  - - [6144, 720, 1, 768]
    - [64, 0.0]
  - - [6144, 720, 1, 1024]
    - [6, 0.0]
  - - [6144, 720, 1, 4096]
    - [1, 0.0]
  - - [6144, 750, 1, 256]
    - [6, 0.0]
  - - [6144, 750, 1, 768]
    - [64, 0.0]
  - - [6144, 750, 1, 1024]
    - [6, 0.0]
  - - [6144, 750, 1, 4096]
    - [1, 0.0]
  - - [6144, 924, 1, 256]
    - [6, 0.0]
  - - [6144, 924, 1, 768]
    - [69, 0.0]
  - - [6144, 924, 1, 1024]
    - [6, 0.0]
  - - [6144, 924, 1, 4096]
    - [1, 0.0]
  - - [6144, 1050, 1, 256]
    - [6, 0.0]
  - - [6144, 1050, 1, 768]
    - [69, 0.0]
  - - [6144, 1050, 1, 1024]
    - [6, 0.0]
  - - [6144, 1050, 1, 4096]
    - [1, 0.0]
  - - [6144, 1250, 1, 256]
    - [6, 0.0]
  - - [6144, 1250, 1, 768]
    - [69, 0.0]
  - - [6144, 1250, 1, 1024]
    - [6, 0.0]
  - - [6144, 1250, 1, 4096]
    - [1, 0.0]
  - - [6144, 1750, 1, 256]
    - [6, 0.0]
  - - [6144, 1750, 1, 768]
    - [64, 0.0]
  - - [6144, 1750, 1, 1024]
    - [6, 0.0]
  - - [6144, 1750, 1, 4096]
    - [1, 0.0]
  - - [6144, 3168, 1, 256]
    - [6, 0.0]
  - - [6144, 3168, 1, 768]
    - [64, 0.0]
  - - [6144, 3168, 1, 1024]
    - [6, 0.0]
  - - [6144, 3168, 1, 4096]
    - [1, 0.0]
  - - [6144, 3300, 1, 256]
    - [6, 0.0]
  - - [6144, 3300, 1, 768]
    - [64, 0.0]
  - - [6144, 3300, 1, 1024]
    - [6, 0.0]
  - - [6144, 3300, 1, 4096]
    - [1, 0.0]
  - - [6144, 3600, 1, 256]
    - [6, 0.0]
  - - [6144, 3600, 1, 768]
    - [64, 0.0]
  - - [6144, 3600, 1, 1024]
    - [6, 0.0]
  - - [6144, 3600, 1, 4096]
    - [1, 0.0]
  - - [6144, 3750, 1, 256]
    - [6, 0.0]
  - - [6144, 3750, 1, 768]
    - [64, 0.0]
  - - [6144, 3750, 1, 1024]
    - [6, 0.0]
  - - [6144, 3750, 1, 4096]
    - [1, 0.0]
  - - [6144, 5500, 1, 256]
    - [6, 0.0]
  - - [6144, 5500, 1, 768]
    - [64, 0.0]
  - - [6144, 5500, 1, 1024]
    - [6, 0.0]
  - - [6144, 5500, 1, 4096]
    - [1, 0.0]
  - - [6144, 6000, 1, 256]
    - [6, 0.0]
  - - [6144, 6000, 1, 768]
    - [64, 0.0]
  - - [6144, 6000, 1, 1024]
    - [6, 0.0]
  - - [6144, 6000, 1, 4096]
    - [1, 0.0]
  - - [6144, 6250, 1, 256]
    - [6, 0.0]
  - - [6144, 6250, 1, 768]
    - [64, 0.0]
  - - [6144, 6250, 1, 1024]
    - [6, 0.0]
  - - [6144, 6250, 1, 4096]
    - [1, 0.0]
  - - [384, 1, 1, 256]
    - [0, 0.0]
  - - [384, 1, 1, 1024]
    - [5, 0.0]
  - - [384, 1, 1, 4096]
    - [5, 0.0]
  - - [384, 16384, 1, 256]
    - [0, 0.0]
  - - [384, 16384, 1, 512]
    - [63, 0.0]
  - - [384, 16384, 1, 1024]
    - [5, 0.0]
  - - [384, 16384, 1, 4096]
    - [5, 0.0]
  - - [384, 20160, 1, 256]
    - [64, 0.0]
  - - [384, 20160, 1, 512]
    - [63, 0.0]
  - - [384, 20160, 1, 1024]
    - [5, 0.0]
  - - [384, 20160, 1, 4096]
    - [5, 0.0]
  - - [384, 33600, 1, 256]
    - [64, 0.0]
  - - [384, 33600, 1, 512]
    - [63, 0.0]
  - - [384, 33600, 1, 1024]
    - [5, 0.0]
  - - [384, 33600, 1, 4096]
    - [5, 0.0]
  - - [384, 34680, 1, 256]
    - [64, 0.0]
  - - [384, 34680, 1, 512]
    - [63, 0.0]
  - - [384, 34680, 1, 1024]
    - [5, 0.0]
  - - [384, 34680, 1, 3072]
    - [64, 0.0]
  - - [384, 34680, 1, 4096]
    - [5, 0.0]
  - - [384, 69120, 1, 256]
    - [64, 0.0]
  - - [384, 69120, 1, 512]
    - [63, 0.0]
  - - [384, 69120, 1, 1024]
    - [5, 0.0]
  - - [384, 69120, 1, 4096]
    - [5, 0.0]
  - - [384, 72000, 1, 256]
    - [64, 0.0]
  - - [384, 72000, 1, 512]
    - [63, 0.0]
  - - [384, 72000, 1, 1024]
    - [5, 0.0]
  - - [384, 72000, 1, 4096]
    - [5, 0.0]
  - - [384, 88704, 1, 256]
    - [64, 0.0]
  - - [384, 88704, 1, 512]
    - [63, 0.0]
  - - [384, 88704, 1, 1024]
    - [5, 0.0]
  - - [384, 88704, 1, 4096]
    - [5, 0.0]
  - - [384, 100800, 1, 256]
    - [64, 0.0]
  - - [384, 100800, 1, 512]
    - [63, 0.0]
  - - [384, 100800, 1, 1024]
    - [5, 0.0]
  - - [384, 100800, 1, 4096]
    - [5, 0.0]
  - - [384, 115200, 1, 256]
    - [64, 0.0]
  - - [384, 115200, 1, 512]
    - [63, 0.0]
  - - [384, 115200, 1, 1024]
    - [5, 0.0]
  - - [384, 115200, 1, 4096]
    - [5, 0.0]
  - - [384, 120000, 1, 256]
    - [64, 0.0]
  - - [384, 120000, 1, 512]
    - [63, 0.0]
  - - [384, 120000, 1, 1024]
    - [5, 0.0]
  - - [384, 120000, 1, 4096]
    - [5, 0.0]
  - - [384, 147840, 1, 256]
    - [64, 0.0]
  - - [384, 147840, 1, 512]
    - [63, 0.0]
  - - [384, 147840, 1, 1024]
    - [5, 0.0]
  - - [384, 147840, 1, 4096]
    - [5, 0.0]
  - - [384, 168000, 1, 256]
    - [64, 0.0]
  - - [384, 168000, 1, 512]
    - [63, 0.0]
  - - [384, 168000, 1, 1024]
    - [5, 0.0]
  - - [384, 168000, 1, 4096]
    - [5, 0.0]
  - - [384, 304128, 1, 256]
    - [66, 0.0]
  - - [384, 304128, 1, 512]
    - [63, 0.0]
  - - [384, 304128, 1, 1024]
    - [5, 0.0]
  - - [384, 304128, 1, 4096]
    - [5, 0.0]
  - - [384, 310000, 1, 256]
    - [66, 0.0]
  - - [384, 310000, 1, 512]
    - [63, 0.0]
  - - [384, 310000, 1, 1024]
    - [5, 0.0]
  - - [384, 310000, 1, 4096]
    - [5, 0.0]
  - - [384, 316800, 1, 256]
    - [66, 0.0]
  - - [384, 316800, 1, 512]
    - [63, 0.0]
  - - [384, 316800, 1, 1024]
    - [5, 0.0]
  - - [384, 316800, 1, 4096]
    - [5, 0.0]
  - - [384, 345600, 1, 256]
    - [66, 0.0]
  - - [384, 345600, 1, 512]
    - [63, 0.0]
  - - [384, 345600, 1, 1024]
    - [5, 0.0]
  - - [384, 345600, 1, 4096]
    - [5, 0.0]
  - - [384, 360000, 1, 256]
    - [66, 0.0]
  - - [384, 360000, 1, 512]
    - [63, 0.0]
  - - [384, 360000, 1, 1024]
    - [5, 0.0]
  - - [384, 360000, 1, 4096]
    - [5, 0.0]
  - - [384, 528000, 1, 256]
    - [66, 0.0]
  - - [384, 528000, 1, 512]
    - [63, 0.0]
  - - [384, 528000, 1, 1024]
    - [5, 0.0]
  - - [384, 528000, 1, 4096]
    - [5, 0.0]
  - - [384, 550000, 1, 256]
    - [68, 0.0]
  - - [384, 550000, 1, 512]
    - [63, 0.0]
  - - [384, 550000, 1, 1024]
    - [5, 0.0]
  - - [384, 550000, 1, 4096]
    - [5, 0.0]
  - - [384, 576000, 1, 256]
    - [66, 0.0]
  - - [384, 576000, 1, 512]
    - [63, 0.0]
  - - [384, 576000, 1, 1024]
    - [5, 0.0]
  - - [384, 576000, 1, 4096]
    - [5, 0.0]
  - - [384, 600000, 1, 256]
    - [66, 0.0]
  - - [384, 600000, 1, 512]
    - [63, 0.0]
  - - [384, 600000, 1, 1024]
    - [5, 0.0]
  - - [384, 600000, 1, 4096]
    - [5, 0.0]
  - - [3072, 1, 1, 256]
    - [6, 0.0]
  - - [3072, 1, 1, 1024]
    - [5, 0.0]
  - - [3072, 1, 1, 4096]
    - [5, 0.0]
  - - [3072, 384, 1, 256]
    - [6, 0.0]
  - - [3072, 384, 1, 1024]
    - [5, 0.0]
  - - [3072, 384, 1, 4096]
    - [5, 0.0]
  - - [3072, 384, 1, 34680]
    - [64, 0.0]
  - - [34680, 1, 1, 256]
    - [3, 0.0]
  - - [34680, 1, 1, 1024]
    - [2, 0.0]
  - - [34680, 1, 1, 4096]
    - [3, 0.0]
  - - [34680, 3072, 1, 256]
    - [3, 0.0]
  - - [34680, 3072, 1, 384]
    - [75, 0.0]
  - - [34680, 3072, 1, 1024]
    - [2, 0.0]
  - - [34680, 3072, 1, 4096]
    - [3, 0.0]
  - - [67320, 1, 1, 256]
    - [2, 0.0]
  - - [67320, 1, 1, 1024]
    - [2, 0.0]
  - - [67320, 1, 1, 4096]
    - [4, 0.0]
  - - [67320, 3072, 1, 256]
    - [2, 0.0]
  - - [67320, 3072, 1, 384]
    - [75, 0.0]
  - - [67320, 3072, 1, 1024]
    - [2, 0.0]
  - - [67320, 3072, 1, 3072]
    - [74, 0.0]
  - - [67320, 3072, 1, 4096]
    - [4, 0.0]
  - - [67320, 3072, 1, 12288]
    - [74, 0.0]
  - - [67320, 3072, 1, 15360]
    - [4, 0.0]
  - - [67576, 1, 1, 256]
    - [2, 0.0]
  - - [67576, 1, 1, 1024]
    - [2, 0.0]
  - - [67576, 1, 1, 4096]
    - [4, 0.0]
  - - [67576, 3072, 1, 256]
    - [2, 0.0]
  - - [67576, 3072, 1, 1024]
    - [2, 0.0]
  - - [67576, 3072, 1, 4096]
    - [4, 0.0]
  - - [67576, 3072, 1, 15360]
    - [74, 0.0]
  - - [118800, 1, 1, 256]
    - [2, 0.0]
  - - [118800, 1, 1, 1024]
    - [2, 0.0]
  - - [118800, 1, 1, 4096]
    - [4, 0.0]
  - - [118800, 3072, 1, 256]
    - [2, 0.0]
  - - [118800, 3072, 1, 384]
    - [64, 0.0]
  - - [118800, 3072, 1, 1024]
    - [2, 0.0]
  - - [118800, 3072, 1, 3072]
    - [74, 0.0]
  - - [118800, 3072, 1, 4096]
    - [4, 0.0]
  - - [118800, 3072, 1, 12288]
    - [76, 0.0]
  - - [118800, 3072, 1, 15360]
    - [4, 0.0]
  - - [119056, 1, 1, 256]
    - [2, 0.0]
  - - [119056, 1, 1, 1024]
    - [2, 0.0]
  - - [119056, 1, 1, 4096]
    - [4, 0.0]
  - - [119056, 3072, 1, 256]
    - [2, 0.0]
  - - [119056, 3072, 1, 1024]
    - [2, 0.0]
  - - [119056, 3072, 1, 4096]
    - [4, 0.0]
  - - [119056, 3072, 1, 15360]
    - [74, 0.0]
  - - [269280, 1, 1, 256]
    - [2, 0.0]
  - - [269280, 1, 1, 1024]
    - [2, 0.0]
  - - [269280, 1, 1, 4096]
    - [4, 0.0]
  - - [269280, 3072, 1, 256]
    - [2, 0.0]
  - - [269280, 3072, 1, 384]
    - [75, 0.0]
  - - [269280, 3072, 1, 1024]
    - [2, 0.0]
  - - [269280, 3072, 1, 4096]
    - [4, 0.0]
  - - [475200, 1, 1, 256]
    - [2, 0.0]
  - - [475200, 1, 1, 1024]
    - [2, 0.0]
  - - [475200, 1, 1, 4096]
    - [4, 0.0]
  - - [475200, 3072, 1, 256]
    - [2, 0.0]
  - - [475200, 3072, 1, 384]
    - [75, 0.0]
  - - [475200, 3072, 1, 1024]
    - [2, 0.0]
  - - [475200, 3072, 1, 4096]
    - [4, 0.0]
  - - [538560, 1, 1, 256]
    - [2, 0.0]
  - - [538560, 1, 1, 1024]
    - [2, 0.0]
  - - [538560, 1, 1, 4096]
    - [4, 0.0]
  - - [538560, 3072, 1, 256]
    - [2, 0.0]
  - - [538560, 3072, 1, 384]
    - [75, 0.0]
  - - [538560, 3072, 1, 1024]
    - [2, 0.0]
  - - [538560, 3072, 1, 4096]
    - [4, 0.0]
- null
- null
- DeviceEfficiency
- GridBased
