projects/hipblaslt/library/src/amd_detail/rocblaslt/src/Tensile/Logic/asm_full/aquavanjaram/gfx942/GridBased/aquavanjaram_Cijk_Alik_Bljk_F8NHS_STA_BH_BiasSH_HAS_SAB_SAV_UserArgs.yaml
- {MinimumRequiredVersion: 4.33.0}
- aquavanjaram
- gfx942
- [Device 0049, Device 0050]
    SolutionIndex: 0
    SolutionNameMin: Cijk_Alik_Bljk_F8NHS_STA_BH_BiasSH_HAS_SAB_SAV_UserArgs_MT64x16x128_MI16x16x1_SN_GSU1_GSUC0_GSUWGMRR0_K1_LBSPPB128_MIWT1_1_NLCA2_PLR1_SU0_SUM0_SUS0_VWB1_WG64_4_1_WGM8_WGMXCC8_WGMXCCGn1
    SolutionIndex: 1
    SolutionNameMin: Cijk_Alik_Bljk_F8NHS_STA_BH_BiasSH_HAS_SAB_SAV_UserArgs_MT64x16x128_MI16x16x1_SN_GSU1_GSUC0_GSUWGMRR0_K1_LBSPPB128_MIWT1_1_NLCA2_PLR2_SU0_SUM0_SUS0_VWB1_WG64_4_1_WGM8_WGMXCC8_WGMXCCGn1
    SolutionIndex: 2
    SolutionNameMin: Cijk_Alik_Bljk_F8NHS_STA_BH_BiasSH_HAS_SAB_SAV_UserArgs_MT128x16x128_MI16x16x1_SN_GSU1_GSUC0_GSUWGMRR0_K1_LBSPPB128_MIWT2_1_NLCA2_PLR2_SU0_SUM0_SUS0_VWB1_WG64_4_1_WGM8_WGMXCC8_WGMXCCGn1
    SolutionIndex: 3
    SolutionNameMin: Cijk_Alik_Bljk_F8NHS_STA_BH_BiasSH_HAS_SAB_SAV_UserArgs_MT128x128x128_MI16x16x1_SN_GSU1_GSUC0_GSUWGMRR0_K1_LBSPPB1024_MIWT2_8_NLCA2_PLR1_SU0_SUM0_SUS0_VWB8_WG64_4_1_WGM8_WGMXCC8_WGMXCCGn1
    SolutionIndex: 4
    SolutionNameMin: Cijk_Alik_Bljk_F8NHS_STA_BH_BiasSH_HAS_SAB_SAV_UserArgs_MT128x128x128_MI16x16x1_SN_GSU1_GSUC0_GSUWGMRR0_K1_LBSPPB1024_MIWT2_8_NLCA2_PLR2_SU0_SUM0_SUS0_VWB8_WG64_4_1_WGM8_WGMXCC8_WGMXCCGn1
    SolutionIndex: 5
    SolutionNameMin: Cijk_Alik_Bljk_F8NHS_STA_BH_BiasSH_HAS_SAB_SAV_UserArgs_MT512x128x128_MI16x16x1_SN_GSU1_GSUC0_GSUWGMRR0_K1_LBSPPB1024_MIWT8_8_NLCA2_PLR1_SU0_SUM0_SUS0_VWB8_WG64_4_1_WGM8_WGMXCC8_WGMXCCGn1
    SolutionIndex: 6
    SolutionNameMin: Cijk_Alik_Bljk_F8NHS_STA_BH_BiasSH_HAS_SAB_SAV_UserArgs_MT160x128x128_MI16x16x1_SN_GSU1_GSUC0_GSUWGMRR0_K1_LBSPPB1024_MIWT5_8_NLCA2_PLR1_SU0_SUM0_SUS0_VWB8_WG32_4_1_WGM8_WGMXCC8_WGMXCCGn1
    SolutionIndex: 7
    SolutionNameMin: Cijk_Alik_Bljk_F8NHS_STA_BH_BiasSH_HAS_SAB_SAV_UserArgs_MT48x16x256_MI16x16x1_SN_LDSB0_GRVWB16_GSU1_GSUAMB_GSUC0_GSUWGMRR0_K1_LBSPPB256_MIWT3_1_NLCA4_SU16_SUM0_SUS256_VWB1_WG16_4_1_WGM8_WGMXCC8_WGMXCCG304
    SolutionIndex: 8
    SolutionNameMin: Cijk_Alik_Bljk_F8NHS_STA_BH_BiasSH_HAS_SAB_SAV_UserArgs_MT64x32x256_MI16x16x1_SN_LDSB0_GRVWB16_GSU1_GSUAMB_GSUC0_GSUWGMRR0_K1_LBSPPB512_MIWT1_2_NLCA4_SU16_SUM0_SUS256_VWB2_WG64_4_1_WGM8_WGMXCC8_WGMXCCG304
    SolutionIndex: 9
    SolutionNameMin: Cijk_Alik_Bljk_F8NHS_STA_BH_BiasSH_HAS_SAB_SAV_UserArgs_MT128x48x256_MI16x16x1_SN_LDSB0_GRVWB16_GSU1_GSUAMB_GSUC0_GSUWGMRR0_K1_LBSPPB256_MIWT2_3_NLCA4_SU16_SUM0_SUS256_VWB1_WG64_4_1_WGM8_WGMXCC8_WGMXCCG304
    SolutionIndex: 10
    SolutionNameMin: Cijk_Alik_Bljk_F8NHS_STA_BH_BiasSH_HAS_SAB_SAV_UserArgs_MT128x64x256_MI16x16x1_SN_LDSB1_GRVWB16_GSU1_GSUAMB_GSUC0_GSUWGMRR0_K1_LBSPPB1024_MIWT2_4_NLCA4_SU16_SUM0_SUS256_VWB4_WG64_4_1_WGM8_WGMXCC8_WGMXCCG304
    SolutionIndex: 11
    SolutionNameMin: Cijk_Alik_Bljk_F8NHS_STA_BH_BiasSH_HAS_SAB_SAV_UserArgs_MT128x80x256_MI16x16x1_SN_LDSB1_GRVWB16_GSU1_GSUAMB_GSUC0_GSUWGMRR0_K1_LBSPPB256_MIWT2_5_NLCA4_SU16_SUM0_SUS256_VWB1_WG64_4_1_WGM8_WGMXCC8_WGMXCCG304
    SolutionIndex: 12
    SolutionNameMin: Cijk_Alik_Bljk_F8NHS_STA_BH_BiasSH_HAS_SAB_SAV_UserArgs_MT128x96x256_MI16x16x1_SN_LDSB1_GRVWB16_GSU1_GSUAMB_GSUC0_GSUWGMRR0_K1_LBSPPB512_MIWT2_6_NLCA4_SU16_SUM0_SUS256_VWB2_WG64_4_1_WGM8_WGMXCC8_WGMXCCG304
    SolutionIndex: 13
    SolutionNameMin: Cijk_Alik_Bljk_F8NHS_STA_BH_BiasSH_HAS_SAB_SAV_UserArgs_MT128x112x256_MI16x16x1_SN_LDSB1_GRVWB16_GSU1_GSUAMB_GSUC0_GSUWGMRR0_K1_LBSPPB256_MIWT2_7_NLCA4_SU16_SUM0_SUS256_VWB1_WG64_4_1_WGM8_WGMXCC8_WGMXCCG304
    SolutionIndex: 14
    SolutionNameMin: Cijk_Alik_Bljk_F8NHS_STA_BH_BiasSH_HAS_SAB_SAV_UserArgs_MT192x64x256_MI16x16x1_SN_LDSB1_GRVWB16_GSU1_GSUAMB_GSUC0_GSUWGMRR0_K1_LBSPPB1024_MIWT3_4_NLCA4_SU16_SUM0_SUS256_VWB4_WG64_4_1_WGM8_WGMXCC8_WGMXCCG304
    SolutionIndex: 15
    SolutionNameMin: Cijk_Alik_Bljk_F8NHS_STA_BH_BiasSH_HAS_SAB_SAV_UserArgs_MT192x80x256_MI16x16x1_SN_LDSB1_GRVWB16_GSU1_GSUAMB_GSUC0_GSUWGMRR0_K1_LBSPPB256_MIWT3_5_NLCA4_SU16_SUM0_SUS256_VWB1_WG64_4_1_WGM8_WGMXCC8_WGMXCCG304
    SolutionIndex: 16
    SolutionNameMin: Cijk_Alik_Bljk_F8NHS_STA_BH_BiasSH_HAS_SAB_SAV_UserArgs_MT192x96x128_MI16x16x1_SN_LDSB0_GRVWB16_GSU1_GSUAMB_GSUC0_GSUWGMRR0_K1_LBSPPB256_MIWT3_6_NLCA2_SU16_SUM0_SUS256_VWB2_WG64_4_1_WGM8_WGMXCC8_WGMXCCG304
    SolutionIndex: 17
    SolutionNameMin: Cijk_Alik_Bljk_F8NHS_STA_BH_BiasSH_HAS_SAB_SAV_UserArgs_MT192x112x128_MI16x16x1_SN_LDSB1_GRVWB8_GSU1_GSUAMB_GSUC0_GSUWGMRR0_K1_LBSPPB128_MIWT3_7_NLCA2_SU16_SUM0_SUS256_VWB1_WG64_4_1_WGM8_WGMXCC8_WGMXCCG304
    SolutionIndex: 18
    SolutionNameMin: Cijk_Alik_Bljk_F8NHS_STA_BH_BiasSH_HAS_SAB_SAV_UserArgs_MT320x80x128_MI16x16x1_SN_LDSB0_GRVWB8_GSU1_GSUAMB_GSUC0_GSUWGMRR0_K1_LBSPPB128_MIWT5_5_NLCA2_SU16_SUM0_SUS256_VWB1_WG64_4_1_WGM8_WGMXCC8_WGMXCCG304
    SolutionIndex: 19
    SolutionNameMin: Cijk_Alik_Bljk_F8NHS_STA_BH_BiasSH_HAS_SAB_SAV_UserArgs_MT192x128x128_MI16x16x1_SN_LDSB1_GRVWB16_GSU1_GSUAMB_GSUC0_GSUWGMRR0_K1_LBSPPB1024_MIWT3_8_NLCA2_SU16_SUM0_SUS256_VWB8_WG64_4_1_WGM8_WGMXCC8_WGMXCCG304
    SolutionIndex: 20
    SolutionNameMin: Cijk_Alik_Bljk_F8NHS_STA_BH_BiasSH_HAS_SAB_SAV_UserArgs_MT192x144x128_MI16x16x1_SN_LDSB1_GRVWB8_GSU1_GSUAMB_GSUC0_GSUWGMRR0_K1_LBSPPB128_MIWT3_9_NLCA2_SU16_SUM0_SUS256_VWB1_WG64_4_1_WGM8_WGMXCC8_WGMXCCG304
    SolutionIndex: 21
    SolutionNameMin: Cijk_Alik_Bljk_F8NHS_STA_BH_BiasSH_HAS_SAB_SAV_UserArgs_MT192x80x128_MI16x16x1_SN_LDSB0_GRVWB8_GSU1_GSUAMB_GSUC0_GSUWGMRR0_K1_LBSPPB128_MIWT3_5_NLCA2_SU16_SUM0_SUS256_VWB1_WG64_4_1_WGM8_WGMXCC8_WGMXCCG304
    SolutionIndex: 22
    SolutionNameMin: Cijk_Alik_Bljk_F8NHS_STA_BH_BiasSH_HAS_SAB_SAV_UserArgs_MT320x112x128_MI16x16x1_SN_LDSB0_GRVWB8_GSU1_GSUAMB_GSUC0_GSUWGMRR0_K1_LBSPPB128_MIWT5_7_NLCA2_SU16_SUM0_SUS256_VWB1_WG64_4_1_WGM8_WGMXCC8_WGMXCCG304
    SolutionIndex: 23
    SolutionNameMin: Cijk_Alik_Bljk_F8NHS_STA_BH_BiasSH_HAS_SAB_SAV_UserArgs_MT192x176x128_MI16x16x1_SN_LDSB0_GRVWB8_GSU1_GSUAMB_GSUC0_GSUWGMRR0_K1_LBSPPB128_MIWT3_11_NLCA2_SU16_SUM0_SUS256_VWB1_WG64_4_1_WGM8_WGMXCC8_WGMXCCG304
    SolutionIndex: 24
    SolutionNameMin: Cijk_Alik_Bljk_F8NHS_STA_BH_BiasSH_HAS_SAB_SAV_UserArgs_MT256x80x128_MI16x16x1_SN_LDSB0_GRVWB8_GSU1_GSUAMB_GSUC0_GSUWGMRR0_K1_LBSPPB128_MIWT4_5_NLCA2_SU16_SUM0_SUS256_VWB1_WG64_4_1_WGM8_WGMXCC8_WGMXCCG304
    SolutionIndex: 25
    SolutionNameMin: Cijk_Alik_Bljk_F8NHS_STA_BH_BiasSH_HAS_SAB_SAV_UserArgs_MT192x208x128_MI16x16x1_SN_LDSB1_GRVWB8_GSU1_GSUAMB_GSUC0_GSUWGMRR0_K1_LBSPPB128_MIWT3_13_NLCA2_SU16_SUM0_SUS256_VWB1_WG64_4_1_WGM8_WGMXCC8_WGMXCCG304
    SolutionIndex: 26
    SolutionNameMin: Cijk_Alik_Bljk_F8NHS_STA_BH_BiasSH_HAS_SAB_SAV_UserArgs_MT256x96x128_MI16x16x1_SN_LDSB0_GRVWB16_GSU1_GSUAMB_GSUC0_GSUWGMRR0_K1_LBSPPB256_MIWT4_6_NLCA2_SU16_SUM0_SUS256_VWB2_WG64_4_1_WGM8_WGMXCC8_WGMXCCG304
    SolutionIndex: 27
    SolutionNameMin: Cijk_Alik_Bljk_F8NHS_STA_BH_BiasSH_HAS_SAB_SAV_UserArgs_MT320x192x128_MI16x16x1_SN_LDSB0_GRVWB16_GSU1_GSUAMB_GSUC0_GSUWGMRR0_K1_LBSPPB512_MIWT5_12_NLCA2_SU16_SUM0_SUS256_VWB4_WG64_4_1_WGM8_WGMXCC8_WGMXCCG304
    SolutionIndex: 28
    SolutionNameMin: Cijk_Alik_Bljk_F8NHS_STA_BH_BiasSH_HAS_SAB_SAV_UserArgs_MT128x160x128_MI16x16x1_SN_LDSB1_GRVWB16_GSU1_GSUAMB_GSUC0_GSUWGMRR0_K1_LBSPPB256_MIWT2_10_NLCA2_SU16_SUM0_SUS256_VWB2_WG64_4_1_WGM8_WGMXCC8_WGMXCCG304
    SolutionIndex: 29
    SolutionNameMin: Cijk_Alik_Bljk_F8NHS_STA_BH_BiasSH_HAS_SAB_SAV_UserArgs_MT256x160x128_MI16x16x1_SN_LDSB0_GRVWB16_GSU1_GSUAMB_GSUC0_GSUWGMRR0_K1_LBSPPB256_MIWT4_10_NLCA2_SU16_SUM0_SUS256_VWB2_WG64_4_1_WGM8_WGMXCC8_WGMXCCG304
    SolutionIndex: 30
    SolutionNameMin: Cijk_Alik_Bljk_F8NHS_STA_BH_BiasSH_HAS_SAB_SAV_UserArgs_MT192x224x128_MI16x16x1_SN_LDSB0_GRVWB16_GSU1_GSUAMB_GSUC0_GSUWGMRR0_K1_LBSPPB256_MIWT3_14_NLCA2_SU16_SUM0_SUS256_VWB2_WG64_4_1_WGM8_WGMXCC8_WGMXCCG304
    SolutionIndex: 31
    SolutionNameMin: Cijk_Alik_Bljk_F8NHS_STA_BH_BiasSH_HAS_SAB_SAV_UserArgs_MT192x160x128_MI16x16x1_SN_LDSB1_GRVWB16_GSU1_GSUAMB_GSUC0_GSUWGMRR0_K1_LBSPPB256_MIWT3_10_NLCA2_SU16_SUM0_SUS256_VWB2_WG64_4_1_WGM8_WGMXCC8_WGMXCCG304
    SolutionIndex: 32
    SolutionNameMin: Cijk_Alik_Bljk_F8NHS_STA_BH_BiasSH_HAS_SAB_SAV_UserArgs_MT256x192x128_MI16x16x1_SN_LDSB0_GRVWB16_GSU1_GSUAMB_GSUC0_GSUWGMRR0_K1_LBSPPB512_MIWT4_12_NLCA2_SU16_SUM0_SUS256_VWB4_WG64_4_1_WGM8_WGMXCC8_WGMXCCG304
    SolutionIndex: 33
    SolutionNameMin: Cijk_Alik_Bljk_F8NHS_STA_BH_BiasSH_HAS_SAB_SAV_UserArgs_MT192x256x128_MI16x16x1_SN_LDSB1_GRVWB16_GSU1_GSUAMB_GSUC0_GSUWGMRR0_K1_LBSPPB2048_MIWT3_16_NLCA2_SU16_SUM0_SUS256_VWB16_WG64_4_1_WGM8_WGMXCC8_WGMXCCG304
    SolutionIndex: 34
    SolutionNameMin: Cijk_Alik_Bljk_F8NHS_STA_BH_BiasSH_HAS_SAB_SAV_UserArgs_MT256x224x128_MI16x16x1_SN_LDSB0_GRVWB16_GSU1_GSUAMB_GSUC0_GSUWGMRR0_K1_LBSPPB256_MIWT4_14_NLCA2_SU16_SUM0_SUS256_VWB2_WG64_4_1_WGM8_WGMXCC8_WGMXCCG304
    SolutionIndex: 35
    SolutionNameMin: Cijk_Alik_Bljk_F8NHS_STA_BH_BiasSH_HAS_SAB_SAV_UserArgs_MT192x192x128_MI16x16x1_SN_LDSB0_GRVWB16_GSU1_GSUAMB_GSUC0_GSUWGMRR0_K1_LBSPPB512_MIWT3_12_NLCA2_SU16_SUM0_SUS256_VWB4_WG64_4_1_WGM8_WGMXCC8_WGMXCCG304
    SolutionIndex: 36
    SolutionNameMin: Cijk_Alik_Bljk_F8NHS_STA_BH_BiasSH_HAS_SAB_SAV_UserArgs_MT256x176x128_MI16x16x1_SN_LDSB0_GRVWB8_GSU1_GSUAMB_GSUC0_GSUWGMRR0_K1_LBSPPB128_MIWT4_11_NLCA2_SU16_SUM0_SUS256_VWB1_WG64_4_1_WGM8_WGMXCC8_WGMXCCG304
    SolutionIndex: 37
    SolutionNameMin: Cijk_Alik_Bljk_F8NHS_STA_BH_BiasSH_HAS_SAB_SAV_UserArgs_MT256x208x128_MI16x16x1_SN_LDSB1_GRVWB8_GSU1_GSUAMB_GSUC0_GSUWGMRR0_K1_LBSPPB128_MIWT4_13_NLCA2_SU16_SUM0_SUS256_VWB1_WG64_4_1_WGM8_WGMXCC8_WGMXCCG304
    SolutionIndex: 38
    SolutionNameMin: Cijk_Alik_Bljk_F8NHS_STA_BH_BiasSH_HAS_SAB_SAV_UserArgs_MT256x224x128_MI16x16x1_SN_LDSB0_GRVWB16_GSU1_GSUAMB_GSUC0_GSUWGMRR0_K1_LBSPPB256_MIWT4_14_NLCA2_SU16_SUM0_SUS256_VWB2_WG64_4_1_WGM8_WGMXCC8_WGMXCCG304
    SolutionIndex: 39
    SolutionNameMin: Cijk_Alik_Bljk_F8NHS_STA_BH_BiasSH_HAS_SAB_SAV_UserArgs_MT320x192x128_MI16x16x1_SN_LDSB0_GRVWB16_GSU1_GSUAMB_GSUC0_GSUWGMRR0_K1_LBSPPB512_MIWT5_12_NLCA2_SU16_SUM0_SUS256_VWB4_WG64_4_1_WGM8_WGMXCC8_WGMXCCG304
    SolutionIndex: 40
    SolutionNameMin: Cijk_Alik_Bljk_F8NHS_STA_BH_BiasSH_HAS_SAB_SAV_UserArgs_MT320x160x128_MI16x16x1_SN_LDSB0_GRVWB16_GSU1_GSUAMB_GSUC0_GSUWGMRR0_K1_LBSPPB256_MIWT5_10_NLCA2_SU16_SUM0_SUS256_VWB2_WG64_4_1_WGM8_WGMXCC8_WGMXCCG304
    SolutionIndex: 41
    SolutionNameMin: Cijk_Alik_Bljk_F8NHS_STA_BH_BiasSH_HAS_SAB_SAV_UserArgs_MT192x224x128_MI16x16x1_SN_LDSB0_GRVWB16_GSU1_GSUAMB_GSUC0_GSUWGMRR0_K1_LBSPPB256_MIWT3_14_NLCA2_SU16_SUM0_SUS256_VWB2_WG64_4_1_WGM8_WGMXCC8_WGMXCCG304
    SolutionIndex: 42
    SolutionNameMin: Cijk_Alik_Bljk_F8NHS_STA_BH_BiasSH_HAS_SAB_SAV_UserArgs_MT384x160x128_MI16x16x1_SN_LDSB0_GRVWB16_GSU1_GSUAMB_GSUC0_GSUWGMRR0_K1_LBSPPB256_MIWT6_10_NLCA2_SU16_SUM0_SUS256_VWB2_WG64_4_1_WGM8_WGMXCC8_WGMXCCG304
    SolutionIndex: 43
    SolutionNameMin: Cijk_Alik_Bljk_F8NHS_STA_BH_BiasSH_HAS_SAB_SAV_UserArgs_MT256x128x128_MI16x16x1_SN_LDSB1_GRVWB16_GSU1_GSUAMB_GSUC0_GSUWGMRR0_K1_LBSPPB1024_MIWT4_8_NLCA2_SU16_SUM0_SUS256_VWB8_WG64_4_1_WGM8_WGMXCC8_WGMXCCG304
    SolutionIndex: 44
    SolutionNameMin: Cijk_Alik_Bljk_F8NHS_STA_BH_BiasSH_HAS_SAB_SAV_UserArgs_MT128x160x128_MI16x16x1_SN_LDSB1_GRVWB16_GSU1_GSUAMB_GSUC0_GSUWGMRR0_K1_LBSPPB256_MIWT2_10_NLCA2_SU16_SUM0_SUS256_VWB2_WG64_4_1_WGM8_WGMXCC8_WGMXCCG304
    SolutionIndex: 45
    SolutionNameMin: Cijk_Alik_Bljk_F8NHS_STA_BH_BiasSH_HAS_SAB_SAV_UserArgs_MT256x192x128_MI16x16x1_SN_LDSB0_GRVWB16_GSU1_GSUAMB_GSUC0_GSUWGMRR0_K1_LBSPPB512_MIWT4_12_NLCA2_SU16_SUM0_SUS256_VWB4_WG64_4_1_WGM8_WGMXCC8_WGMXCCG304
    SolutionIndex: 46
    SolutionNameMin: Cijk_Alik_Bljk_F8NHS_STA_BH_BiasSH_HAS_SAB_SAV_UserArgs_MT16x16x256_MI16x16x1_SN_LDSB0_GRVWB16_GSU1_GSUAMBSK_GSUC0_GSUWGMRR0_K1_LBSPPB256_MIWT1_1_NLCA4_SU16_SUM0_SUS256_VWB1_WG16_4_1_WGM8_WGMXCC8_WGMXCCG304
    SolutionIndex: 47
    SolutionNameMin: Cijk_Alik_Bljk_F8NHS_STA_BH_BiasSH_HAS_SAB_SAV_UserArgs_MT64x16x256_MI16x16x1_SN_LDSB0_GRVWB16_GSU1_GSUAMB_GSUC0_GSUWGMRR0_K1_LBSPPB256_MIWT1_1_NLCA4_SU16_SUM0_SUS256_VWB1_WG64_4_1_WGM8_WGMXCC8_WGMXCCG304
    SolutionIndex: 48
    SolutionNameMin: Cijk_Alik_Bljk_F8NHS_STA_BH_BiasSH_HAS_SAB_SAV_UserArgs_MT64x48x256_MI16x16x1_SN_LDSB0_GRVWB16_GSU1_GSUAMB_GSUC0_GSUWGMRR0_K1_LBSPPB256_MIWT1_3_NLCA4_SU16_SUM0_SUS256_VWB1_WG64_4_1_WGM8_WGMXCC8_WGMXCCG304
    SolutionIndex: 49
    SolutionNameMin: Cijk_Alik_Bljk_F8NHS_STA_BH_BiasSH_HAS_SAB_SAV_UserArgs_MT128x32x256_MI16x16x1_SN_LDSB0_GRVWB16_GSU1_GSUAMB_GSUC0_GSUWGMRR0_K1_LBSPPB512_MIWT2_2_NLCA4_SU16_SUM0_SUS256_VWB2_WG64_4_1_WGM8_WGMXCC8_WGMXCCG304
    SolutionIndex: 50
    SolutionNameMin: Cijk_Alik_Bljk_F8NHS_STA_BH_BiasSH_HAS_SAB_SAV_UserArgs_MT128x32x256_MI16x16x1_SN_LDSB0_GRVWB16_GSU1_GSUAMBSK_GSUC0_GSUWGMRR0_K1_LBSPPB512_MIWT2_2_NLCA4_SU16_SUM0_SUS256_VWB2_WG64_4_1_WGM8_WGMXCC8_WGMXCCG304
    SolutionIndex: 51
    SolutionNameMin: Cijk_Alik_Bljk_F8NHS_STA_BH_BiasSH_HAS_SAB_SAV_UserArgs_MT128x48x256_MI16x16x1_SN_LDSB0_GRVWB16_GSU1_GSUAMBSK_GSUC0_GSUWGMRR0_K1_LBSPPB256_MIWT2_3_NLCA4_SU16_SUM0_SUS256_VWB1_WG64_4_1_WGM8_WGMXCC8_WGMXCCG304
    SolutionIndex: 52
    SolutionNameMin: Cijk_Alik_Bljk_F8NHS_STA_BH_BiasSH_HAS_SAB_SAV_UserArgs_MT128x80x256_MI16x16x1_SN_LDSB1_GRVWB16_GSU1_GSUAMBSK_GSUC0_GSUWGMRR0_K1_LBSPPB256_MIWT2_5_NLCA4_SU16_SUM0_SUS256_VWB1_WG64_4_1_WGM8_WGMXCC8_WGMXCCG304
    SolutionIndex: 53
    SolutionNameMin: Cijk_Alik_Bljk_F8NHS_STA_BH_BiasSH_HAS_SAB_SAV_UserArgs_MT256x64x256_MI16x16x1_SN_LDSB1_GRVWB16_GSU1_GSUAMB_GSUC0_GSUWGMRR0_K1_LBSPPB1024_MIWT4_4_NLCA4_SU16_SUM0_SUS256_VWB4_WG64_4_1_WGM8_WGMXCC8_WGMXCCG304
    SolutionIndex: 54
    SolutionNameMin: Cijk_Alik_Bljk_F8NHS_STA_BH_BiasSH_HAS_SAB_SAV_UserArgs_MT256x64x256_MI16x16x1_SN_LDSB1_GRVWB16_GSU1_GSUAMBSK_GSUC0_GSUWGMRR0_K1_LBSPPB1024_MIWT4_4_NLCA4_SU16_SUM0_SUS256_VWB4_WG64_4_1_WGM8_WGMXCC8_WGMXCCG304
    SolutionIndex: 55
    SolutionNameMin: Cijk_Alik_Bljk_F8NHS_STA_BH_BiasSH_HAS_SAB_SAV_UserArgs_MT320x64x128_MI16x16x1_SN_LDSB0_GRVWB16_GSU1_GSUAMB_GSUC0_GSUWGMRR0_K1_LBSPPB512_MIWT5_4_NLCA2_SU16_SUM0_SUS256_VWB4_WG64_4_1_WGM8_WGMXCC8_WGMXCCG304
    SolutionIndex: 56
    SolutionNameMin: Cijk_Alik_Bljk_F8NHS_STA_BH_BiasSH_HAS_SAB_SAV_UserArgs_MT256x112x128_MI16x16x1_SN_LDSB1_GRVWB8_GSU1_GSUAMB_GSUC0_GSUWGMRR0_K1_LBSPPB128_MIWT4_7_NLCA2_SU16_SUM0_SUS256_VWB1_WG64_4_1_WGM8_WGMXCC8_WGMXCCG304
    SolutionIndex: 57
    SolutionNameMin: Cijk_Alik_Bljk_F8NHS_STA_BH_BiasSH_HAS_SAB_SAV_UserArgs_MT256x128x128_MI16x16x1_SN_LDSB1_GRVWB16_GSU1_GSUAMBSK_GSUC0_GSUWGMRR0_K1_LBSPPB1024_MIWT4_8_NLCA2_SU16_SUM0_SUS256_VWB8_WG64_4_1_WGM8_WGMXCC8_WGMXCCG304
    SolutionIndex: 58
    SolutionNameMin: Cijk_Alik_Bljk_F8NHS_STA_BH_BiasSH_HAS_SAB_SAV_UserArgs_MT256x144x128_MI16x16x1_SN_LDSB0_GRVWB8_GSU1_GSUAMBSK_GSUC0_GSUWGMRR0_K1_LBSPPB128_MIWT4_9_NLCA2_SU16_SUM0_SUS256_VWB1_WG64_4_1_WGM8_WGMXCC8_WGMXCCG304
    SolutionIndex: 59
    SolutionNameMin: Cijk_Alik_Bljk_F8NHS_STA_BH_BiasSH_HAS_SAB_SAV_UserArgs_MT256x144x128_MI16x16x1_SN_LDSB0_GRVWB8_GSU1_GSUAMB_GSUC0_GSUWGMRR0_K1_LBSPPB128_MIWT4_9_NLCA2_SU16_SUM0_SUS256_VWB1_WG64_4_1_WGM8_WGMXCC8_WGMXCCG304
    SolutionIndex: 60
    SolutionNameMin: Cijk_Alik_Bljk_F8NHS_STA_BH_BiasSH_HAS_SAB_SAV_UserArgs_MT256x176x128_MI16x16x1_SN_LDSB0_GRVWB8_GSU1_GSUAMB_GSUC0_GSUWGMRR0_K1_LBSPPB128_MIWT4_11_NLCA2_SU16_SUM0_SUS256_VWB1_WG64_4_1_WGM8_WGMXCC8_WGMXCCG304
    SolutionIndex: 61
    SolutionNameMin: Cijk_Alik_Bljk_F8NHS_STA_BH_BiasSH_HAS_SAB_SAV_UserArgs_MT320x160x128_MI16x16x1_SN_LDSB0_GRVWB16_GSU1_GSUAMB_GSUC0_GSUWGMRR0_K1_LBSPPB256_MIWT5_10_NLCA2_SU16_SUM0_SUS256_VWB2_WG64_4_1_WGM8_WGMXCC8_WGMXCCG304
    SolutionIndex: 62
    SolutionNameMin: Cijk_Alik_Bljk_F8NHS_STA_BH_BiasSH_HAS_SAB_SAV_UserArgs_MT256x208x128_MI16x16x1_SN_LDSB1_GRVWB8_GSU1_GSUAMB_GSUC0_GSUWGMRR0_K1_LBSPPB128_MIWT4_13_NLCA2_SU16_SUM0_SUS256_VWB1_WG64_4_1_WGM8_WGMXCC8_WGMXCCG304
    SolutionIndex: 63
    SolutionNameMin: Cijk_Alik_Bljk_F8NHS_STA_BH_BiasSH_HAS_SAB_SAV_UserArgs_MT512x128x128_MI16x16x1_SN_LDSB0_GRVWB16_GSU1_GSUC0_GSUWGMRR0_K1_LBSPPB1024_MIWT8_8_NLCA2_SU16_SUM0_SUS128_VWB8_WG64_4_1_WGM8_WGMXCC8_WGMXCCG304
    SolutionIndex: 64
    SolutionNameMin: Cijk_Alik_Bljk_F8NHS_STA_BH_BiasSH_HAS_SAB_SAV_UserArgs_MT512x128x128_MI16x16x1_SN_LDSB0_GRVWB16_GSU1_GSUC0_GSUWGMRR0_K1_LBSPPB1024_MIWT8_8_NLCA2_SU8_SUM0_SUS128_VWB8_WG64_4_1_WGM8_WGMXCC8_WGMXCCG304
    SolutionIndex: 65
    SolutionNameMin: Cijk_Alik_Bljk_F8NHS_STA_BH_BiasSH_HAS_SAB_SAV_UserArgs_MT448x128x128_MI16x16x1_SN_LDSB0_GRVWB16_GSU1_GSUC0_GSUWGMRR0_K1_LBSPPB1024_MIWT7_8_NLCA2_SU16_SUM0_SUS128_VWB8_WG64_4_1_WGM8_WGMXCC8_WGMXCCG304
    SolutionIndex: 66
    SolutionNameMin: Cijk_Alik_Bljk_F8NHS_STA_BH_BiasSH_HAS_SAB_SAV_UserArgs_MT320x128x128_MI16x16x1_SN_LDSB0_GRVWB16_GSU1_GSUC0_GSUWGMRR0_K1_LBSPPB1024_MIWT5_8_NLCA2_SU8_SUM0_SUS128_VWB8_WG64_4_1_WGM6_WGMXCC8_WGMXCCG304
    SolutionIndex: 67
    SolutionNameMin: Cijk_Alik_Bljk_F8NHS_STA_BH_BiasSH_HAS_SAB_SAV_UserArgs_MT512x128x128_MI16x16x1_SN_LDSB0_GRVWB16_GSU1_GSUC0_GSUWGMRR0_K1_LBSPPB1024_MIWT8_8_NLCA2_SU16_SUM0_SUS128_VWB8_WG64_4_1_WGM6_WGMXCC8_WGMXCCG304
    SolutionIndex: 68
    SolutionNameMin: Cijk_Alik_Bljk_F8NHS_STA_BH_BiasSH_HAS_SAB_SAV_UserArgs_MT448x128x128_MI16x16x1_SN_LDSB0_GRVWB16_GSU1_GSUC0_GSUWGMRR0_K1_LBSPPB1024_MIWT7_8_NLCA2_SU8_SUM0_SUS128_VWB8_WG64_4_1_WGM8_WGMXCC8_WGMXCCG304
    SolutionIndex: 69
    SolutionNameMin: Cijk_Alik_Bljk_F8NHS_STA_BH_BiasSH_HAS_SAB_SAV_UserArgs_MT192x80x256_MI16x16x1_SN_LDSB1_GRVWB16_GSU1_GSUC0_GSUWGMRR0_K1_LBSPPB256_MIWT3_5_NLCA4_SU16_SUM0_SUS256_VWB1_WG64_4_1_WGM8_WGMXCC8_WGMXCCG304
    SolutionIndex: 70
    SolutionNameMin: Cijk_Alik_Bljk_F8NHS_STA_BH_BiasSH_HAS_SAB_SAV_UserArgs_MT192x96x128_MI16x16x1_SN_LDSB0_GRVWB16_GSU1_GSUC0_GSUWGMRR0_K1_LBSPPB256_MIWT3_6_NLCA2_SU8_SUM0_SUS128_VWB2_WG64_4_1_WGM6_WGMXCC8_WGMXCCG304
    SolutionIndex: 71
    SolutionNameMin: Cijk_Alik_Bljk_F8NHS_STA_BH_BiasSH_HAS_SAB_SAV_UserArgs_MT192x96x128_MI16x16x1_SN_LDSB0_GRVWB16_GSU1_GSUC0_GSUWGMRR0_K1_LBSPPB256_MIWT3_6_NLCA2_SU16_SUM0_SUS128_VWB2_WG64_4_1_WGM8_WGMXCC8_WGMXCCG304
    SolutionIndex: 72
    SolutionNameMin: Cijk_Alik_Bljk_F8NHS_STA_BH_BiasSH_HAS_SAB_SAV_UserArgs_MT192x128x128_MI16x16x1_SN_LDSB1_GRVWB16_GSU1_GSUC0_GSUWGMRR0_K1_LBSPPB1024_MIWT3_8_NLCA2_SU16_SUM0_SUS128_VWB8_WG64_4_1_WGM6_WGMXCC8_WGMXCCG304
    SolutionIndex: 73
    SolutionNameMin: Cijk_Alik_Bljk_F8NHS_STA_BH_BiasSH_HAS_SAB_SAV_UserArgs_MT192x128x128_MI16x16x1_SN_LDSB1_GRVWB16_GSU1_GSUC0_GSUWGMRR0_K1_LBSPPB1024_MIWT3_8_NLCA2_SU8_SUM0_SUS128_VWB8_WG64_4_1_WGM6_WGMXCC8_WGMXCCG304
    SolutionIndex: 74
    SolutionNameMin: Cijk_Alik_Bljk_F8NHS_STA_BH_BiasSH_HAS_SAB_SAV_UserArgs_MT256x96x128_MI16x16x1_SN_LDSB0_GRVWB16_GSU1_GSUC0_GSUWGMRR0_K1_LBSPPB256_MIWT4_6_NLCA2_SU8_SUM0_SUS128_VWB2_WG64_4_1_WGM8_WGMXCC8_WGMXCCG304
    SolutionIndex: 75
    SolutionNameMin: Cijk_Alik_Bljk_F8NHS_STA_BH_BiasSH_HAS_SAB_SAV_UserArgs_MT192x128x128_MI16x16x1_SN_LDSB1_GRVWB16_GSU1_GSUC0_GSUWGMRR0_K1_LBSPPB1024_MIWT3_8_NLCA2_SU16_SUM0_SUS128_VWB8_WG64_4_1_WGM8_WGMXCC8_WGMXCCG304
    SolutionIndex: 76
    SolutionNameMin: Cijk_Alik_Bljk_F8NHS_STA_BH_BiasSH_HAS_SAB_SAV_UserArgs_MT192x128x128_MI16x16x1_SN_LDSB1_GRVWB16_GSU1_GSUC0_GSUWGMRR0_K1_LBSPPB1024_MIWT3_8_NLCA2_SU8_SUM0_SUS128_VWB8_WG64_4_1_WGM8_WGMXCC8_WGMXCCG304
    SolutionIndex: 77
    SolutionNameMin: Cijk_Alik_Bljk_F8NHS_STA_BH_BiasSH_HAS_SAB_SAV_UserArgs_MT192x160x128_MI16x16x1_SN_LDSB1_GRVWB16_GSU1_GSUC0_GSUWGMRR0_K1_LBSPPB256_MIWT3_10_NLCA2_SU16_SUM0_SUS128_VWB2_WG64_4_1_WGM6_WGMXCC8_WGMXCCG304
    SolutionIndex: 78
    SolutionNameMin: Cijk_Alik_Bljk_F8NHS_STA_BH_BiasSH_HAS_SAB_SAV_UserArgs_MT256x112x128_MI16x16x1_SN_LDSB1_GRVWB8_GSU1_GSUC0_GSUWGMRR0_K1_LBSPPB128_MIWT4_7_NLCA2_SU8_SUM0_SUS128_VWB1_WG64_4_1_WGM8_WGMXCC8_WGMXCCG304
    SolutionIndex: 79
    SolutionNameMin: Cijk_Alik_Bljk_F8NHS_STA_BH_BiasSH_HAS_SAB_SAV_UserArgs_MT256x112x128_MI16x16x1_SN_LDSB1_GRVWB8_GSU1_GSUC0_GSUWGMRR0_K1_LBSPPB128_MIWT4_7_NLCA2_SU8_SUM0_SUS128_VWB1_WG64_4_1_WGM6_WGMXCC8_WGMXCCG304
    SolutionIndex: 80
    SolutionNameMin: Cijk_Alik_Bljk_F8NHS_STA_BH_BiasSH_HAS_SAB_SAV_UserArgs_MT256x128x128_MI16x16x1_SN_LDSB1_GRVWB16_GSU1_GSUC0_GSUWGMRR0_K1_LBSPPB1024_MIWT4_8_NLCA2_SU16_SUM0_SUS128_VWB8_WG64_4_1_WGM6_WGMXCC8_WGMXCCG304
    SolutionIndex: 81
    SolutionNameMin: Cijk_Alik_Bljk_F8NHS_STA_BH_BiasSH_HAS_SAB_SAV_UserArgs_MT256x128x128_MI16x16x1_SN_LDSB1_GRVWB16_GSU1_GSUC0_GSUWGMRR0_K1_LBSPPB1024_MIWT4_8_NLCA2_SU16_SUM0_SUS128_VWB8_WG64_4_1_WGM8_WGMXCC8_WGMXCCG304
    SolutionIndex: 82
    SolutionNameMin: Cijk_Alik_Bljk_F8NHS_STA_BH_BiasSH_HAS_SAB_SAV_UserArgs_MT320x112x128_MI16x16x1_SN_LDSB0_GRVWB8_GSU1_GSUC0_GSUWGMRR0_K1_LBSPPB128_MIWT5_7_NLCA2_SU16_SUM0_SUS128_VWB1_WG64_4_1_WGM6_WGMXCC8_WGMXCCG304
    SolutionIndex: 83
    SolutionNameMin: Cijk_Alik_Bljk_F8NHS_STA_BH_BiasSH_HAS_SAB_SAV_UserArgs_MT320x128x128_MI16x16x1_SN_LDSB0_GRVWB16_GSU1_GSUC0_GSUWGMRR0_K1_LBSPPB1024_MIWT5_8_NLCA2_SU8_SUM0_SUS128_VWB8_WG64_4_1_WGM8_WGMXCC8_WGMXCCG304
    SolutionIndex: 84
    SolutionNameMin: Cijk_Alik_Bljk_F8NHS_STA_BH_BiasSH_HAS_SAB_SAV_UserArgs_MT256x176x128_MI16x16x1_SN_LDSB0_GRVWB8_GSU1_GSUC0_GSUWGMRR0_K1_LBSPPB128_MIWT4_11_NLCA2_SU16_SUM0_SUS128_VWB1_WG64_4_1_WGM8_WGMXCC8_WGMXCCG304
    SolutionIndex: 85
    SolutionNameMin: Cijk_Alik_Bljk_F8NHS_STA_BH_BiasSH_HAS_SAB_SAV_UserArgs_MT384x128x128_MI16x16x1_SN_LDSB0_GRVWB16_GSU1_GSUC0_GSUWGMRR0_K1_LBSPPB1024_MIWT6_8_NLCA2_SU16_SUM0_SUS128_VWB8_WG64_4_1_WGM6_WGMXCC8_WGMXCCG304
    SolutionIndex: 86
    SolutionNameMin: Cijk_Alik_Bljk_F8NHS_STA_BH_BiasSH_HAS_SAB_SAV_UserArgs_MT384x128x128_MI16x16x1_SN_LDSB0_GRVWB16_GSU1_GSUC0_GSUWGMRR0_K1_LBSPPB1024_MIWT6_8_NLCA2_SU16_SUM0_SUS128_VWB8_WG64_4_1_WGM8_WGMXCC8_WGMXCCG304
    SolutionIndex: 87
    SolutionNameMin: Cijk_Alik_Bljk_F8NHS_STA_BH_BiasSH_HAS_SAB_SAV_UserArgs_MT256x192x128_MI16x16x1_SN_LDSB0_GRVWB16_GSU1_GSUC0_GSUWGMRR0_K1_LBSPPB512_MIWT4_12_NLCA2_SU16_SUM0_SUS128_VWB4_WG64_4_1_WGM8_WGMXCC8_WGMXCCG304
    SolutionIndex: 88
    SolutionNameMin: Cijk_Alik_Bljk_F8NHS_STA_BH_BiasSH_HAS_SAB_SAV_UserArgs_MT192x256x128_MI16x16x1_SN_LDSB1_GRVWB16_GSU1_GSUC0_GSUWGMRR0_K1_LBSPPB2048_MIWT3_16_NLCA2_SU8_SUM0_SUS128_VWB16_WG64_4_1_WGM6_WGMXCC8_WGMXCCG304
    SolutionIndex: 89
    SolutionNameMin: Cijk_Alik_Bljk_F8NHS_STA_BH_BiasSH_HAS_SAB_SAV_UserArgs_MT256x208x128_MI16x16x1_SN_LDSB1_GRVWB8_GSU1_GSUC0_GSUWGMRR0_K1_LBSPPB128_MIWT4_13_NLCA2_SU16_SUM0_SUS128_VWB1_WG64_4_1_WGM6_WGMXCC8_WGMXCCG304
    SolutionIndex: 90
    SolutionNameMin: Cijk_Alik_Bljk_F8NHS_STA_BH_BiasSH_HAS_SAB_SAV_UserArgs_MT320x128x128_MI16x16x1_SN_LDSB0_GRVWB16_GSU1_GSUC0_GSUWGMRR0_K1_LBSPPB1024_MIWT5_8_NLCA2_SU16_SUM0_SUS128_VWB8_WG64_4_1_WGM8_WGMXCC8_WGMXCCG304
    SolutionIndex: 91
    SolutionNameMin: Cijk_Alik_Bljk_F8NHS_STA_BH_BiasSH_HAS_SAB_SAV_UserArgs_MT384x128x128_MI16x16x1_SN_LDSB0_GRVWB16_GSU1_GSUC0_GSUWGMRR0_K1_LBSPPB1024_MIWT6_8_NLCA2_SU8_SUM0_SUS128_VWB8_WG64_4_1_WGM6_WGMXCC8_WGMXCCG304
    SolutionIndex: 92
    SolutionNameMin: Cijk_Alik_Bljk_F8NHS_STA_BH_BiasSH_HAS_SAB_SAV_UserArgs_MT384x128x128_MI16x16x1_SN_LDSB0_GRVWB16_GSU1_GSUC0_GSUWGMRR0_K1_LBSPPB1024_MIWT6_8_NLCA2_SU8_SUM0_SUS128_VWB8_WG64_4_1_WGM8_WGMXCC8_WGMXCCG304
    SolutionIndex: 93
    SolutionNameMin: Cijk_Alik_Bljk_F8NHS_STA_BH_BiasSH_HAS_SAB_SAV_UserArgs_MT256x192x128_MI16x16x1_SN_LDSB0_GRVWB16_GSU1_GSUC0_GSUWGMRR0_K1_LBSPPB512_MIWT4_12_NLCA2_SU8_SUM0_SUS128_VWB4_WG64_4_1_WGM8_WGMXCC8_WGMXCCG304
    SolutionIndex: 94
    SolutionNameMin: Cijk_Alik_Bljk_F8NHS_STA_BH_BiasSH_HAS_SAB_SAV_UserArgs_MT64x16x512_MI16x16x1_SN_LDSB0_GRVWB16_GSU1_GSUC0_GSUWGMRR0_K1_LBSPPB512_MIWT1_1_NLCA8_SU16_SUM0_SUS512_VWB1_WG64_4_1_WGM6_WGMXCC8_WGMXCCG304
    SolutionIndex: 95
    SolutionNameMin: Cijk_Alik_Bljk_F8NHS_STA_BH_BiasSH_HAS_SAB_SAV_UserArgs_MT64x32x512_MI16x16x1_SN_LDSB1_GRVWB16_GSU1_GSUC0_GSUWGMRR0_K1_LBSPPB1024_MIWT1_2_NLCA8_SU16_SUM0_SUS512_VWB2_WG64_4_1_WGM8_WGMXCC8_WGMXCCG304
    SolutionIndex: 96
    SolutionNameMin: Cijk_Alik_Bljk_F8NHS_STA_BH_BiasSH_HAS_SAB_SAV_UserArgs_MT64x48x256_MI16x16x1_SN_LDSB0_GRVWB16_GSU1_GSUC0_GSUWGMRR0_K1_LBSPPB256_MIWT1_3_NLCA4_SU16_SUM0_SUS256_VWB1_WG64_4_1_WGM8_WGMXCC8_WGMXCCG304
    SolutionIndex: 97
    SolutionNameMin: Cijk_Alik_Bljk_F8NHS_STA_BH_BiasSH_HAS_SAB_SAV_UserArgs_MT64x32x512_MI16x16x1_SN_LDSB1_GRVWB16_GSU1_GSUC0_GSUWGMRR0_K1_LBSPPB1024_MIWT1_2_NLCA8_SU8_SUM0_SUS512_VWB2_WG64_4_1_WGM6_WGMXCC8_WGMXCCG304
    SolutionIndex: 98
    SolutionNameMin: Cijk_Alik_Bljk_F8NHS_STA_BH_BiasSH_HAS_SAB_SAV_UserArgs_MT64x80x256_MI16x16x1_SN_LDSB1_GRVWB16_GSU1_GSUC0_GSUWGMRR0_K1_LBSPPB256_MIWT1_5_NLCA4_SU16_SUM0_SUS256_VWB1_WG64_4_1_WGM6_WGMXCC8_WGMXCCG304
    SolutionIndex: 99
    SolutionNameMin: Cijk_Alik_Bljk_F8NHS_STA_BH_BiasSH_HAS_SAB_SAV_UserArgs_MT128x48x256_MI16x16x1_SN_LDSB0_GRVWB16_GSU1_GSUC0_GSUWGMRR0_K1_LBSPPB256_MIWT2_3_NLCA4_SU8_SUM0_SUS256_VWB1_WG64_4_1_WGM8_WGMXCC8_WGMXCCG304
    SolutionIndex: 100
    SolutionNameMin: Cijk_Alik_Bljk_F8NHS_STA_BH_BiasSH_HAS_SAB_SAV_UserArgs_MT128x32x256_MI16x16x1_SN_LDSB0_GRVWB16_GSU1_GSUC0_GSUWGMRR0_K1_LBSPPB512_MIWT2_2_NLCA4_SU16_SUM0_SUS256_VWB2_WG64_4_1_WGM6_WGMXCC8_WGMXCCG304
    SolutionIndex: 101
    SolutionNameMin: Cijk_Alik_Bljk_F8NHS_STA_BH_BiasSH_HAS_SAB_SAV_UserArgs_MT128x32x256_MI16x16x1_SN_LDSB0_GRVWB16_GSU1_GSUC0_GSUWGMRR0_K1_LBSPPB512_MIWT2_2_NLCA4_SU16_SUM0_SUS256_VWB2_WG64_4_1_WGM8_WGMXCC8_WGMXCCG304
    SolutionIndex: 102
    SolutionNameMin: Cijk_Alik_Bljk_F8NHS_STA_BH_BiasSH_HAS_SAB_SAV_UserArgs_MT128x80x256_MI16x16x1_SN_LDSB1_GRVWB16_GSU1_GSUC0_GSUWGMRR0_K1_LBSPPB256_MIWT2_5_NLCA4_SU8_SUM0_SUS256_VWB1_WG64_4_1_WGM8_WGMXCC8_WGMXCCG304
    SolutionIndex: 103
    SolutionNameMin: Cijk_Alik_Bljk_F8NHS_STA_BH_BiasSH_HAS_SAB_SAV_UserArgs_MT128x48x256_MI16x16x1_SN_LDSB0_GRVWB16_GSU1_GSUC0_GSUWGMRR0_K1_LBSPPB256_MIWT2_3_NLCA4_SU16_SUM0_SUS256_VWB1_WG64_4_1_WGM8_WGMXCC8_WGMXCCG304
    SolutionIndex: 104
    SolutionNameMin: Cijk_Alik_Bljk_F8NHS_STA_BH_BiasSH_HAS_SAB_SAV_UserArgs_MT128x64x256_MI16x16x1_SN_LDSB1_GRVWB16_GSU1_GSUC0_GSUWGMRR0_K1_LBSPPB1024_MIWT2_4_NLCA4_SU8_SUM0_SUS256_VWB4_WG64_4_1_WGM6_WGMXCC8_WGMXCCG304
    SolutionIndex: 105
    SolutionNameMin: Cijk_Alik_Bljk_F8NHS_STA_BH_BiasSH_HAS_SAB_SAV_UserArgs_MT128x80x256_MI16x16x1_SN_LDSB1_GRVWB16_GSU1_GSUC0_GSUWGMRR0_K1_LBSPPB256_MIWT2_5_NLCA4_SU8_SUM0_SUS256_VWB1_WG64_4_1_WGM6_WGMXCC8_WGMXCCG304
    SolutionIndex: 106
    SolutionNameMin: Cijk_Alik_Bljk_F8NHS_STA_BH_BiasSH_HAS_SAB_SAV_UserArgs_MT128x80x256_MI16x16x1_SN_LDSB1_GRVWB16_GSU1_GSUC0_GSUWGMRR0_K1_LBSPPB256_MIWT2_5_NLCA4_SU16_SUM0_SUS256_VWB1_WG64_4_1_WGM6_WGMXCC8_WGMXCCG304
    SolutionIndex: 107
    SolutionNameMin: Cijk_Alik_Bljk_F8NHS_STA_BH_BiasSH_HAS_SAB_SAV_UserArgs_MT128x96x256_MI16x16x1_SN_LDSB1_GRVWB16_GSU1_GSUC0_GSUWGMRR0_K1_LBSPPB512_MIWT2_6_NLCA4_SU8_SUM0_SUS256_VWB2_WG64_4_1_WGM8_WGMXCC8_WGMXCCG304
    SolutionIndex: 108
    SolutionNameMin: Cijk_Alik_Bljk_F8NHS_STA_BH_BiasSH_HAS_SAB_SAV_UserArgs_MT128x112x256_MI16x16x1_SN_LDSB1_GRVWB16_GSU1_GSUC0_GSUWGMRR0_K1_LBSPPB256_MIWT2_7_NLCA4_SU8_SUM0_SUS256_VWB1_WG64_4_1_WGM6_WGMXCC8_WGMXCCG304
    SolutionIndex: 109
    SolutionNameMin: Cijk_Alik_Bljk_F8NHS_STA_BH_BiasSH_HAS_SAB_SAV_UserArgs_MT192x80x256_MI16x16x1_SN_LDSB1_GRVWB16_GSU1_GSUC0_GSUWGMRR0_K1_LBSPPB256_MIWT3_5_NLCA4_SU8_SUM0_SUS256_VWB1_WG64_4_1_WGM6_WGMXCC8_WGMXCCG304
    SolutionIndex: 110
    SolutionNameMin: Cijk_Alik_Bljk_F8NHS_STA_BH_BiasSH_HAS_SAB_SAV_UserArgs_MT128x112x256_MI16x16x1_SN_LDSB1_GRVWB16_GSU1_GSUC0_GSUWGMRR0_K1_LBSPPB256_MIWT2_7_NLCA4_SU16_SUM0_SUS256_VWB1_WG64_4_1_WGM6_WGMXCC8_WGMXCCG304
    SolutionIndex: 111
    SolutionNameMin: Cijk_Alik_Bljk_F8NHS_STA_BH_BiasSH_HAS_SAB_SAV_UserArgs_MT128x112x256_MI16x16x1_SN_LDSB1_GRVWB16_GSU1_GSUC0_GSUWGMRR0_K1_LBSPPB256_MIWT2_7_NLCA4_SU16_SUM0_SUS256_VWB1_WG64_4_1_WGM8_WGMXCC8_WGMXCCG304
    SolutionIndex: 112
    SolutionNameMin: Cijk_Alik_Bljk_F8NHS_STA_BH_BiasSH_HAS_SAB_SAV_UserArgs_MT192x80x128_MI16x16x1_SN_LDSB0_GRVWB8_GSU1_GSUC0_GSUWGMRR0_K1_LBSPPB128_MIWT3_5_NLCA2_SU16_SUM0_SUS128_VWB1_WG64_4_1_WGM8_WGMXCC8_WGMXCCG304
    SolutionIndex: 113
    SolutionNameMin: Cijk_Alik_Bljk_F8NHS_STA_BH_BiasSH_HAS_SAB_SAV_UserArgs_MT256x64x128_MI16x16x1_SN_LDSB0_GRVWB16_GSU1_GSUC0_GSUWGMRR0_K1_LBSPPB512_MIWT4_4_NLCA2_SU8_SUM0_SUS128_VWB4_WG64_4_1_WGM8_WGMXCC8_WGMXCCG304
    SolutionIndex: 114
    SolutionNameMin: Cijk_Alik_Bljk_F8NHS_STA_BH_BiasSH_HAS_SAB_SAV_UserArgs_MT384x160x128_MI16x16x1_SN_LDSB0_GRVWB16_GSU1_GSUC0_GSUWGMRR0_K1_LBSPPB256_MIWT6_10_NLCA2_SU8_SUM0_SUS128_VWB2_WG64_4_1_WGM8_WGMXCC8_WGMXCCG304
    SolutionIndex: 115
    SolutionNameMin: Cijk_Alik_Bljk_F8NHS_STA_BH_BiasSH_HAS_SAB_SAV_UserArgs_MT448x144x128_MI16x16x1_SN_LDSB0_GRVWB8_GSU1_GSUC0_GSUWGMRR0_K1_LBSPPB128_MIWT7_9_NLCA2_SU16_SUM0_SUS128_VWB1_WG64_4_1_WGM8_WGMXCC8_WGMXCCG304
    SolutionIndex: 116
    SolutionNameMin: Cijk_Alik_Bljk_F8NHS_STA_BH_BiasSH_HAS_SAB_SAV_UserArgs_MT256x224x128_MI16x16x1_SN_LDSB0_GRVWB16_GSU1_GSUC0_GSUWGMRR0_K1_LBSPPB256_MIWT4_14_NLCA2_SU16_SUM0_SUS128_VWB2_WG64_4_1_WGM8_WGMXCC8_WGMXCCG304
    SolutionIndex: 117
    SolutionNameMin: Cijk_Alik_Bljk_F8NHS_STA_BH_BiasSH_HAS_SAB_SAV_UserArgs_MT256x192x128_MI16x16x1_SN_LDSB0_GRVWB16_GSU1_GSUC0_GSUWGMRR0_K1_LBSPPB512_MIWT4_12_NLCA2_SU8_SUM0_SUS128_VWB4_WG64_4_1_WGM6_WGMXCC8_WGMXCCG304
    SolutionIndex: 118
    SolutionNameMin: Cijk_Alik_Bljk_F8NHS_STA_BH_BiasSH_HAS_SAB_SAV_UserArgs_MT320x192x128_MI16x16x1_SN_LDSB0_GRVWB16_GSU1_GSUC0_GSUWGMRR0_K1_LBSPPB512_MIWT5_12_NLCA2_SU16_SUM0_SUS128_VWB4_WG64_4_1_WGM8_WGMXCC8_WGMXCCG304
    SolutionIndex: 119
    SolutionNameMin: Cijk_Alik_Bljk_F8NHS_STA_BH_BiasSH_HAS_SAB_SAV_UserArgs_MT256x208x128_MI16x16x1_SN_LDSB1_GRVWB8_GSU1_GSUC0_GSUWGMRR0_K1_LBSPPB128_MIWT4_13_NLCA2_SU16_SUM0_SUS128_VWB1_WG64_4_1_WGM8_WGMXCC8_WGMXCCG304
    SolutionIndex: 120
    SolutionNameMin: Cijk_Alik_Bljk_F8NHS_STA_BH_BiasSH_HAS_SAB_SAV_UserArgs_MT256x192x128_MI16x16x1_SN_LDSB0_GRVWB16_GSU1_GSUC0_GSUWGMRR0_K1_LBSPPB512_MIWT4_12_NLCA2_SU16_SUM0_SUS128_VWB4_WG64_4_1_WGM6_WGMXCC8_WGMXCCG304
    SolutionIndex: 121
    SolutionNameMin: Cijk_Alik_Bljk_F8NHS_STA_BH_BiasSH_HAS_SAB_SAV_UserArgs_MT512x112x128_MI16x16x1_SN_LDSB0_GRVWB8_GSU1_GSUC0_GSUWGMRR0_K1_LBSPPB128_MIWT8_7_NLCA2_SU8_SUM0_SUS128_VWB1_WG64_4_1_WGM8_WGMXCC8_WGMXCCG304
    SolutionIndex: 122
    SolutionNameMin: Cijk_Alik_Bljk_F8NHS_STA_BH_BiasSH_HAS_SAB_SAV_UserArgs_MT320x192x128_MI16x16x1_SN_LDSB0_GRVWB16_GSU1_GSUC0_GSUWGMRR0_K1_LBSPPB512_MIWT5_12_NLCA2_SU8_SUM0_SUS128_VWB4_WG64_4_1_WGM8_WGMXCC8_WGMXCCG304
    SolutionIndex: 123
    SolutionNameMin: Cijk_Alik_Bljk_F8NHS_STA_BH_BiasSH_HAS_SAB_SAV_UserArgs_MT256x208x128_MI16x16x1_SN_LDSB1_GRVWB8_GSU1_GSUC0_GSUWGMRR0_K1_LBSPPB128_MIWT4_13_NLCA2_SU8_SUM0_SUS128_VWB1_WG64_4_1_WGM6_WGMXCC8_WGMXCCG304
    SolutionIndex: 124
    SolutionNameMin: Cijk_Alik_Bljk_F8NHS_STA_BH_BiasSH_HAS_SAB_SAV_UserArgs_MT320x176x128_MI16x16x1_SN_LDSB0_GRVWB8_GSU1_GSUC0_GSUWGMRR0_K1_LBSPPB128_MIWT5_11_NLCA2_SU8_SUM0_SUS128_VWB1_WG64_4_1_WGM6_WGMXCC8_WGMXCCG304
    SolutionIndex: 125
    SolutionNameMin: Cijk_Alik_Bljk_F8NHS_STA_BH_BiasSH_HAS_SAB_SAV_UserArgs_MT448x144x128_MI16x16x1_SN_LDSB0_GRVWB8_GSU1_GSUC0_GSUWGMRR0_K1_LBSPPB128_MIWT7_9_NLCA2_SU8_SUM0_SUS128_VWB1_WG64_4_1_WGM8_WGMXCC8_WGMXCCG304
    SolutionIndex: 126
    SolutionNameMin: Cijk_Alik_Bljk_F8NHS_STA_BH_BiasSH_HAS_SAB_SAV_UserArgs_MT256x224x128_MI16x16x1_SN_LDSB0_GRVWB16_GSU1_GSUC0_GSUWGMRR0_K1_LBSPPB256_MIWT4_14_NLCA2_SU8_SUM0_SUS128_VWB2_WG64_4_1_WGM6_WGMXCC8_WGMXCCG304
    SolutionIndex: 127
    SolutionNameMin: Cijk_Alik_Bljk_F8NHS_STA_BH_BiasSH_HAS_SAB_SAV_UserArgs_MT512x112x128_MI16x16x1_SN_LDSB0_GRVWB8_GSU1_GSUC0_GSUWGMRR0_K1_LBSPPB128_MIWT8_7_NLCA2_SU16_SUM0_SUS128_VWB1_WG64_4_1_WGM8_WGMXCC8_WGMXCCG304
    SolutionIndex: 128
    SolutionNameMin: Cijk_Alik_Bljk_F8NHS_STA_BH_BiasSH_HAS_SAB_SAV_UserArgs_MT256x224x128_MI16x16x1_SN_LDSB0_GRVWB16_GSU1_GSUC0_GSUWGMRR0_K1_LBSPPB256_MIWT4_14_NLCA2_SU8_SUM0_SUS128_VWB2_WG64_4_1_WGM8_WGMXCC8_WGMXCCG304
    SolutionIndex: 129
    SolutionNameMin: Cijk_Alik_Bljk_F8NHS_STA_BH_BiasSH_HAS_SAB_SAV_UserArgs_MT192x80x256_MI16x16x1_SN_LDSB1_GRVWB16_GSU1_GSUC0_GSUWGMRR0_K1_LBSPPB256_MIWT3_5_NLCA4_SU8_SUM0_SUS256_VWB1_WG64_4_1_WGM8_WGMXCC8_WGMXCCG304
    SolutionIndex: 130
    SolutionNameMin: Cijk_Alik_Bljk_F8NHS_STA_BH_BiasSH_HAS_SAB_SAV_UserArgs_MT192x96x128_MI16x16x1_SN_LDSB0_GRVWB16_GSU1_GSUC0_GSUWGMRR0_K1_LBSPPB256_MIWT3_6_NLCA2_SU8_SUM0_SUS128_VWB2_WG64_4_1_WGM8_WGMXCC8_WGMXCCG304
    SolutionIndex: 131
    SolutionNameMin: Cijk_Alik_Bljk_F8NHS_STA_BH_BiasSH_HAS_SAB_SAV_UserArgs_MT256x80x128_MI16x16x1_SN_LDSB0_GRVWB8_GSU1_GSUC0_GSUWGMRR0_K1_LBSPPB128_MIWT4_5_NLCA2_SU16_SUM0_SUS128_VWB1_WG64_4_1_WGM8_WGMXCC8_WGMXCCG304
    SolutionIndex: 132
    SolutionNameMin: Cijk_Alik_Bljk_F8NHS_STA_BH_BiasSH_HAS_SAB_SAV_UserArgs_MT256x80x128_MI16x16x1_SN_LDSB0_GRVWB8_GSU1_GSUC0_GSUWGMRR0_K1_LBSPPB128_MIWT4_5_NLCA2_SU8_SUM0_SUS128_VWB1_WG64_4_1_WGM8_WGMXCC8_WGMXCCG304
    SolutionIndex: 133
    SolutionNameMin: Cijk_Alik_Bljk_F8NHS_STA_BH_BiasSH_HAS_SAB_SAV_UserArgs_MT256x80x128_MI16x16x1_SN_LDSB0_GRVWB8_GSU1_GSUC0_GSUWGMRR0_K1_LBSPPB128_MIWT4_5_NLCA2_SU16_SUM0_SUS128_VWB1_WG64_4_1_WGM6_WGMXCC8_WGMXCCG304
    SolutionIndex: 134
    SolutionNameMin: Cijk_Alik_Bljk_F8NHS_STA_BH_BiasSH_HAS_SAB_SAV_UserArgs_MT256x96x128_MI16x16x1_SN_LDSB0_GRVWB16_GSU1_GSUC0_GSUWGMRR0_K1_LBSPPB256_MIWT4_6_NLCA2_SU16_SUM0_SUS128_VWB2_WG64_4_1_WGM8_WGMXCC8_WGMXCCG304
    SolutionIndex: 135
    SolutionNameMin: Cijk_Alik_Bljk_F8NHS_STA_BH_BiasSH_HAS_SAB_SAV_UserArgs_MT192x160x128_MI16x16x1_SN_LDSB1_GRVWB16_GSU1_GSUC0_GSUWGMRR0_K1_LBSPPB256_MIWT3_10_NLCA2_SU8_SUM0_SUS128_VWB2_WG64_4_1_WGM6_WGMXCC8_WGMXCCG304
    SolutionIndex: 136
    SolutionNameMin: Cijk_Alik_Bljk_F8NHS_STA_BH_BiasSH_HAS_SAB_SAV_UserArgs_MT256x96x128_MI16x16x1_SN_LDSB0_GRVWB16_GSU1_GSUC0_GSUWGMRR0_K1_LBSPPB256_MIWT4_6_NLCA2_SU16_SUM0_SUS128_VWB2_WG64_4_1_WGM6_WGMXCC8_WGMXCCG304
    SolutionIndex: 137
    SolutionNameMin: Cijk_Alik_Bljk_F8NHS_STA_BH_BiasSH_HAS_SAB_SAV_UserArgs_MT256x112x128_MI16x16x1_SN_LDSB1_GRVWB8_GSU1_GSUC0_GSUWGMRR0_K1_LBSPPB128_MIWT4_7_NLCA2_SU16_SUM0_SUS128_VWB1_WG64_4_1_WGM8_WGMXCC8_WGMXCCG304
    SolutionIndex: 138
    SolutionNameMin: Cijk_Alik_Bljk_F8NHS_STA_BH_BiasSH_HAS_SAB_SAV_UserArgs_MT192x160x128_MI16x16x1_SN_LDSB1_GRVWB16_GSU1_GSUC0_GSUWGMRR0_K1_LBSPPB256_MIWT3_10_NLCA2_SU16_SUM0_SUS128_VWB2_WG64_4_1_WGM8_WGMXCC8_WGMXCCG304
    SolutionIndex: 139
    SolutionNameMin: Cijk_Alik_Bljk_F8NHS_STA_BH_BiasSH_HAS_SAB_SAV_UserArgs_MT256x112x128_MI16x16x1_SN_LDSB1_GRVWB8_GSU1_GSUC0_GSUWGMRR0_K1_LBSPPB128_MIWT4_7_NLCA2_SU16_SUM0_SUS128_VWB1_WG64_4_1_WGM6_WGMXCC8_WGMXCCG304
    SolutionIndex: 140
    SolutionNameMin: Cijk_Alik_Bljk_F8NHS_STA_BH_BiasSH_HAS_SAB_SAV_UserArgs_MT256x128x128_MI16x16x1_SN_LDSB1_GRVWB16_GSU1_GSUC0_GSUWGMRR0_K1_LBSPPB1024_MIWT4_8_NLCA2_SU8_SUM0_SUS128_VWB8_WG64_4_1_WGM6_WGMXCC8_WGMXCCG304
    SolutionIndex: 141
    SolutionNameMin: Cijk_Alik_Bljk_F8NHS_STA_BH_BiasSH_HAS_SAB_SAV_UserArgs_MT192x176x128_MI16x16x1_SN_LDSB0_GRVWB8_GSU1_GSUC0_GSUWGMRR0_K1_LBSPPB128_MIWT3_11_NLCA2_SU8_SUM0_SUS128_VWB1_WG64_4_1_WGM8_WGMXCC8_WGMXCCG304
    SolutionIndex: 142
    SolutionNameMin: Cijk_Alik_Bljk_F8NHS_STA_BH_BiasSH_HAS_SAB_SAV_UserArgs_MT256x160x128_MI16x16x1_SN_LDSB0_GRVWB16_GSU1_GSUC0_GSUWGMRR0_K1_LBSPPB256_MIWT4_10_NLCA2_SU16_SUM0_SUS128_VWB2_WG64_4_1_WGM8_WGMXCC8_WGMXCCG304
    SolutionIndex: 143
    SolutionNameMin: Cijk_Alik_Bljk_F8NHS_STA_BH_BiasSH_HAS_SAB_SAV_UserArgs_MT192x192x128_MI16x16x1_SN_LDSB0_GRVWB16_GSU1_GSUC0_GSUWGMRR0_K1_LBSPPB512_MIWT3_12_NLCA2_SU8_SUM0_SUS128_VWB4_WG64_4_1_WGM8_WGMXCC8_WGMXCCG304
    SolutionIndex: 144
    SolutionNameMin: Cijk_Alik_Bljk_F8NHS_STA_BH_BiasSH_HAS_SAB_SAV_UserArgs_MT256x176x128_MI16x16x1_SN_LDSB0_GRVWB8_GSU1_GSUC0_GSUWGMRR0_K1_LBSPPB128_MIWT4_11_NLCA2_SU8_SUM0_SUS128_VWB1_WG64_4_1_WGM8_WGMXCC8_WGMXCCG304
    SolutionIndex: 145
    SolutionNameMin: Cijk_Alik_Bljk_F8NHS_STA_BH_BiasSH_HAS_SAB_SAV_UserArgs_MT448x96x128_MI16x16x1_SN_LDSB0_GRVWB16_GSU1_GSUC0_GSUWGMRR0_K1_LBSPPB256_MIWT7_6_NLCA2_SU16_SUM0_SUS128_VWB2_WG64_4_1_WGM8_WGMXCC8_WGMXCCG304
    SolutionIndex: 146
    SolutionNameMin: Cijk_Alik_Bljk_F8NHS_STA_BH_BiasSH_HAS_SAB_SAV_UserArgs_MT512x96x128_MI16x16x1_SN_LDSB0_GRVWB16_GSU1_GSUC0_GSUWGMRR0_K1_LBSPPB256_MIWT8_6_NLCA2_SU8_SUM0_SUS128_VWB2_WG64_4_1_WGM8_WGMXCC8_WGMXCCG304
    SolutionIndex: 147
    SolutionNameMin: Cijk_Alik_Bljk_F8NHS_STA_BH_BiasSH_HAS_SAB_SAV_UserArgs_MT448x112x128_MI16x16x1_SN_LDSB0_GRVWB8_GSU1_GSUC0_GSUWGMRR0_K1_LBSPPB128_MIWT7_7_NLCA2_SU16_SUM0_SUS128_VWB1_WG64_4_1_WGM8_WGMXCC8_WGMXCCG304
    SolutionIndex: 148
    SolutionNameMin: Cijk_Alik_Bljk_F8NHS_STA_BH_BiasSH_HAS_SAB_SAV_UserArgs_MT320x176x128_MI16x16x1_SN_LDSB0_GRVWB8_GSU1_GSUC0_GSUWGMRR0_K1_LBSPPB128_MIWT5_11_NLCA2_SU16_SUM0_SUS128_VWB1_WG64_4_1_WGM6_WGMXCC8_WGMXCCG304
    SolutionIndex: 149
    SolutionNameMin: Cijk_Alik_Bljk_F8NHS_STA_BH_BiasSH_HAS_SAB_SAV_UserArgs_MT256x224x128_MI16x16x1_SN_LDSB0_GRVWB16_GSU1_GSUC0_GSUWGMRR0_K1_LBSPPB256_MIWT4_14_NLCA2_SU16_SUM0_SUS128_VWB2_WG64_4_1_WGM6_WGMXCC8_WGMXCCG304
    SolutionIndex: 150
    SolutionNameMin: Cijk_Alik_Bljk_F8NHS_STA_BH_BiasSH_HAS_SAB_SAV_UserArgs_MT448x128x128_MI16x16x1_SN_LDSB0_GRVWB16_GSU1_GSUC0_GSUWGMRR0_K1_LBSPPB1024_MIWT7_8_NLCA2_SU8_SUM0_SUS128_VWB8_WG64_4_1_WGM6_WGMXCC8_WGMXCCG304
    SolutionIndex: 151
    SolutionNameMin: Cijk_Alik_Bljk_F8NHS_STA_BH_BiasSH_HAS_SAB_SAV_UserArgs_MT256x144x128_MI16x16x1_SN_LDSB0_GRVWB8_GSU1_GSUC0_GSUWGMRR0_K1_LBSPPB128_MIWT4_9_NLCA2_SU8_SUM0_SUS128_VWB1_WG64_4_1_WGM8_WGMXCC8_WGMXCCG304
    SolutionIndex: 152
    SolutionNameMin: Cijk_Alik_Bljk_F8NHS_STA_BH_BiasSH_HAS_SAB_SAV_UserArgs_MT256x144x128_MI16x16x1_SN_LDSB0_GRVWB8_GSU1_GSUC0_GSUWGMRR0_K1_LBSPPB128_MIWT4_9_NLCA2_SU8_SUM0_SUS128_VWB1_WG64_4_1_WGM6_WGMXCC8_WGMXCCG304
    SolutionIndex: 153
    SolutionNameMin: Cijk_Alik_Bljk_F8NHS_STA_BH_BiasSH_HAS_SAB_SAV_UserArgs_MT448x96x128_MI16x16x1_SN_LDSB0_GRVWB16_GSU1_GSUC0_GSUWGMRR0_K1_LBSPPB256_MIWT7_6_NLCA2_SU8_SUM0_SUS128_VWB2_WG64_4_1_WGM8_WGMXCC8_WGMXCCG304
    SolutionIndex: 154
    SolutionNameMin: Cijk_Alik_Bljk_F8NHS_STA_BH_BiasSH_HAS_SAB_SAV_UserArgs_MT320x176x128_MI16x16x1_SN_LDSB0_GRVWB8_GSU1_GSUC0_GSUWGMRR0_K1_LBSPPB128_MIWT5_11_NLCA2_SU8_SUM0_SUS128_VWB1_WG64_4_1_WGM8_WGMXCC8_WGMXCCG304
    SolutionIndex: 155
    SolutionNameMin: Cijk_Alik_Bljk_F8NHS_STA_BH_BiasSH_HAS_SAB_SAV_UserArgs_MT384x144x128_MI16x16x1_SN_LDSB0_GRVWB8_GSU1_GSUC0_GSUWGMRR0_K1_LBSPPB128_MIWT6_9_NLCA2_SU16_SUM0_SUS128_VWB1_WG64_4_1_WGM8_WGMXCC8_WGMXCCG304
    SolutionIndex: 156
    SolutionNameMin: Cijk_Alik_Bljk_F8NHS_STA_BH_BiasSH_HAS_SAB_SAV_UserArgs_MT320x176x128_MI16x16x1_SN_LDSB0_GRVWB8_GSU1_GSUC0_GSUWGMRR0_K1_LBSPPB128_MIWT5_11_NLCA2_SU16_SUM0_SUS128_VWB1_WG64_4_1_WGM8_WGMXCC8_WGMXCCG304
    SolutionIndex: 157
    SolutionNameMin: Cijk_Alik_Bljk_F8NHS_STA_BH_BiasSH_HAS_SAB_SAV_UserArgs_MT64x16x512_MI16x16x1_SN_LDSB0_GRVWB16_GSU1_GSUC0_GSUWGMRR0_K1_LBSPPB512_MIWT1_1_NTA4_NLCA8_SU8_SUM0_SUS512_VWB1_WG64_4_1_WGM8_WGMXCC8_WGMXCCG304
    SolutionIndex: 158
    SolutionNameMin: Cijk_Alik_Bljk_F8NHS_STA_BH_BiasSH_HAS_SAB_SAV_UserArgs_MT64x16x512_MI16x16x1_SN_LDSB0_GRVWB16_GSU1_GSUC0_GSUWGMRR0_K1_LBSPPB512_MIWT1_1_NTA0_NLCA8_SU8_SUM0_SUS512_VWB1_WG64_4_1_WGM6_WGMXCC8_WGMXCCG304
    SolutionIndex: 159
    SolutionNameMin: Cijk_Alik_Bljk_F8NHS_STA_BH_BiasSH_HAS_SAB_SAV_UserArgs_MT32x48x512_MI16x16x1_SN_LDSB1_GRVWB16_GSU1_GSUC0_GSUWGMRR0_K1_LBSPPB512_MIWT1_3_NTA4_NLCA8_SU16_SUM0_SUS512_VWB1_WG32_4_1_WGM6_WGMXCC8_WGMXCCG304
    SolutionIndex: 160
    SolutionNameMin: Cijk_Alik_Bljk_F8NHS_STA_BH_BiasSH_HAS_SAB_SAV_UserArgs_MT128x48x256_MI16x16x1_SN_LDSB0_GRVWB16_GSU1_GSUC0_GSUWGMRR0_K1_LBSPPB256_MIWT2_3_NTA0_NLCA4_SU16_SUM0_SUS256_VWB1_WG64_4_1_WGM8_WGMXCC8_WGMXCCG304
    SolutionIndex: 161
    SolutionNameMin: Cijk_Alik_Bljk_F8NHS_STA_BH_BiasSH_HAS_SAB_SAV_UserArgs_MT128x80x256_MI16x16x1_SN_LDSB1_GRVWB16_GSU1_GSUC0_GSUWGMRR0_K1_LBSPPB256_MIWT2_5_NTA0_NLCA4_SU16_SUM0_SUS256_VWB1_WG64_4_1_WGM8_WGMXCC8_WGMXCCG304
    SolutionIndex: 162
    SolutionNameMin: Cijk_Alik_Bljk_F8NHS_STA_BH_BiasSH_HAS_SAB_SAV_UserArgs_MT128x64x256_MI16x16x1_SN_LDSB1_GRVWB16_GSU1_GSUC0_GSUWGMRR0_K1_LBSPPB1024_MIWT2_4_NTA0_NLCA4_SU16_SUM0_SUS256_VWB4_WG64_4_1_WGM8_WGMXCC8_WGMXCCG304
    SolutionIndex: 163
    SolutionNameMin: Cijk_Alik_Bljk_F8NHS_STA_BH_BiasSH_HAS_SAB_SAV_UserArgs_MT128x64x256_MI16x16x1_SN_LDSB1_GRVWB16_GSU1_GSUC0_GSUWGMRR0_K1_LBSPPB1024_MIWT2_4_NTA0_NLCA4_SU8_SUM0_SUS256_VWB4_WG64_4_1_WGM6_WGMXCC8_WGMXCCG304
    SolutionIndex: 164
    SolutionNameMin: Cijk_Alik_Bljk_F8NHS_STA_BH_BiasSH_HAS_SAB_SAV_UserArgs_MT128x80x256_MI16x16x1_SN_LDSB1_GRVWB16_GSU1_GSUC0_GSUWGMRR0_K1_LBSPPB256_MIWT2_5_NTA0_NLCA4_SU8_SUM0_SUS256_VWB1_WG64_4_1_WGM8_WGMXCC8_WGMXCCG304
    SolutionIndex: 165
    SolutionNameMin: Cijk_Alik_Bljk_F8NHS_STA_BH_BiasSH_HAS_SAB_SAV_UserArgs_MT128x64x256_MI16x16x1_SN_LDSB1_GRVWB16_GSU1_GSUC0_GSUWGMRR0_K1_LBSPPB1024_MIWT2_4_NTA0_NLCA4_SU8_SUM0_SUS256_VWB4_WG64_4_1_WGM8_WGMXCC8_WGMXCCG304
    SolutionIndex: 166
    SolutionNameMin: Cijk_Alik_Bljk_F8NHS_STA_BH_BiasSH_HAS_SAB_SAV_UserArgs_MT192x48x256_MI16x16x1_SN_LDSB0_GRVWB16_GSU1_GSUC0_GSUWGMRR0_K1_LBSPPB256_MIWT3_3_NTA0_NLCA4_SU8_SUM0_SUS256_VWB1_WG64_4_1_WGM8_WGMXCC8_WGMXCCG304
    SolutionIndex: 167
    SolutionNameMin: Cijk_Alik_Bljk_F8NHS_STA_BH_BiasSH_HAS_SAB_SAV_UserArgs_MT192x48x256_MI16x16x1_SN_LDSB0_GRVWB16_GSU1_GSUC0_GSUWGMRR0_K1_LBSPPB256_MIWT3_3_NTA0_NLCA4_SU8_SUM0_SUS256_VWB1_WG64_4_1_WGM6_WGMXCC8_WGMXCCG304
    SolutionIndex: 168
    SolutionNameMin: Cijk_Alik_Bljk_F8NHS_STA_BH_BiasSH_HAS_SAB_SAV_UserArgs_MT128x80x256_MI16x16x1_SN_LDSB1_GRVWB16_GSU1_GSUC0_GSUWGMRR0_K1_LBSPPB256_MIWT2_5_NTA0_NLCA4_SU8_SUM0_SUS256_VWB1_WG64_4_1_WGM6_WGMXCC8_WGMXCCG304
    SolutionIndex: 169
    SolutionNameMin: Cijk_Alik_Bljk_F8NHS_STA_BH_BiasSH_HAS_SAB_SAV_UserArgs_MT128x96x256_MI16x16x1_SN_LDSB1_GRVWB16_GSU1_GSUC0_GSUWGMRR0_K1_LBSPPB512_MIWT2_6_NTA0_NLCA4_SU8_SUM0_SUS256_VWB2_WG64_4_1_WGM8_WGMXCC8_WGMXCCG304
    SolutionIndex: 170
    SolutionNameMin: Cijk_Alik_Bljk_F8NHS_STA_BH_BiasSH_HAS_SAB_SAV_UserArgs_MT192x80x256_MI16x16x1_SN_LDSB1_GRVWB16_GSU1_GSUC0_GSUWGMRR0_K1_LBSPPB256_MIWT3_5_NTA0_NLCA4_SU16_SUM0_SUS256_VWB1_WG64_4_1_WGM8_WGMXCC8_WGMXCCG304
    SolutionIndex: 171
    SolutionNameMin: Cijk_Alik_Bljk_F8NHS_STA_BH_BiasSH_HAS_SAB_SAV_UserArgs_MT192x64x256_MI16x16x1_SN_LDSB1_GRVWB16_GSU1_GSUC0_GSUWGMRR0_K1_LBSPPB1024_MIWT3_4_NTA0_NLCA4_SU8_SUM0_SUS256_VWB4_WG64_4_1_WGM8_WGMXCC8_WGMXCCG304
    SolutionIndex: 172
    SolutionNameMin: Cijk_Alik_Bljk_F8NHS_STA_BH_BiasSH_HAS_SAB_SAV_UserArgs_MT128x112x256_MI16x16x1_SN_LDSB1_GRVWB16_GSU1_GSUC0_GSUWGMRR0_K1_LBSPPB256_MIWT2_7_NTA0_NLCA4_SU16_SUM0_SUS256_VWB1_WG64_4_1_WGM8_WGMXCC8_WGMXCCG304
    SolutionIndex: 173
    SolutionNameMin: Cijk_Alik_Bljk_F8NHS_STA_BH_BiasSH_HAS_SAB_SAV_UserArgs_MT192x64x256_MI16x16x1_SN_LDSB1_GRVWB16_GSU1_GSUC0_GSUWGMRR0_K1_LBSPPB1024_MIWT3_4_NTA0_NLCA4_SU16_SUM0_SUS256_VWB4_WG64_4_1_WGM8_WGMXCC8_WGMXCCG304
    SolutionIndex: 174
    SolutionNameMin: Cijk_Alik_Bljk_F8NHS_STA_BH_BiasSH_HAS_SAB_SAV_UserArgs_MT192x80x256_MI16x16x1_SN_LDSB1_GRVWB16_GSU1_GSUC0_GSUWGMRR0_K1_LBSPPB256_MIWT3_5_NTA0_NLCA4_SU8_SUM0_SUS256_VWB1_WG64_4_1_WGM8_WGMXCC8_WGMXCCG304
    SolutionIndex: 175
    SolutionNameMin: Cijk_Alik_Bljk_F8NHS_STA_BH_BiasSH_HAS_SAB_SAV_UserArgs_MT192x80x256_MI16x16x1_SN_LDSB1_GRVWB16_GSU1_GSUC0_GSUWGMRR0_K1_LBSPPB256_MIWT3_5_NTA0_NLCA4_SU8_SUM0_SUS256_VWB1_WG64_4_1_WGM6_WGMXCC8_WGMXCCG304
    SolutionIndex: 176
    SolutionNameMin: Cijk_Alik_Bljk_F8NHS_STA_BH_BiasSH_HAS_SAB_SAV_UserArgs_MT256x64x256_MI16x16x1_SN_LDSB1_GRVWB16_GSU1_GSUC0_GSUWGMRR0_K1_LBSPPB1024_MIWT4_4_NTA0_NLCA4_SU16_SUM0_SUS256_VWB4_WG64_4_1_WGM8_WGMXCC8_WGMXCCG304
    SolutionIndex: 177
    SolutionNameMin: Cijk_Alik_Bljk_F8NHS_STA_BH_BiasSH_HAS_SAB_SAV_UserArgs_MT256x64x256_MI16x16x1_SN_LDSB1_GRVWB16_GSU1_GSUC0_GSUWGMRR0_K1_LBSPPB1024_MIWT4_4_NTA0_NLCA4_SU8_SUM0_SUS256_VWB4_WG64_4_1_WGM8_WGMXCC8_WGMXCCG304
    SolutionIndex: 178
    SolutionNameMin: Cijk_Alik_Bljk_F8NHS_STA_BH_BiasSH_HAS_SAB_SAV_UserArgs_MT256x96x128_MI16x16x1_SN_LDSB0_GRVWB16_GSU1_GSUC0_GSUWGMRR0_K1_LBSPPB256_MIWT4_6_NLCA2_SU8_SUM0_SUS128_VWB2_WG64_4_1_WGM6_WGMXCC8_WGMXCCG304
    SolutionIndex: 179
    SolutionNameMin: Cijk_Alik_Bljk_F8NHS_STA_BH_BiasSH_HAS_SAB_SAV_UserArgs_MT320x80x128_MI16x16x1_SN_LDSB0_GRVWB8_GSU1_GSUC0_GSUWGMRR0_K1_LBSPPB128_MIWT5_5_NLCA2_SU16_SUM0_SUS128_VWB1_WG64_4_1_WGM6_WGMXCC8_WGMXCCG304
    SolutionIndex: 180
    SolutionNameMin: Cijk_Alik_Bljk_F8NHS_STA_BH_BiasSH_HAS_SAB_SAV_UserArgs_MT256x128x128_MI16x16x1_SN_LDSB1_GRVWB16_GSU1_GSUC0_GSUWGMRR0_K1_LBSPPB1024_MIWT4_8_NLCA2_SU8_SUM0_SUS128_VWB8_WG64_4_1_WGM8_WGMXCC8_WGMXCCG304
    SolutionIndex: 181
    SolutionNameMin: Cijk_Alik_Bljk_F8NHS_STA_BH_BiasSH_HAS_SAB_SAV_UserArgs_MT192x160x128_MI16x16x1_SN_LDSB1_GRVWB16_GSU1_GSUC0_GSUWGMRR0_K1_LBSPPB256_MIWT3_10_NLCA2_SU8_SUM0_SUS128_VWB2_WG64_4_1_WGM8_WGMXCC8_WGMXCCG304
    SolutionIndex: 182
    SolutionNameMin: Cijk_Alik_Bljk_F8NHS_STA_BH_BiasSH_HAS_SAB_SAV_UserArgs_MT320x96x128_MI16x16x1_SN_LDSB0_GRVWB16_GSU1_GSUC0_GSUWGMRR0_K1_LBSPPB256_MIWT5_6_NLCA2_SU16_SUM0_SUS128_VWB2_WG64_4_1_WGM6_WGMXCC8_WGMXCCG304
    SolutionIndex: 183
    SolutionNameMin: Cijk_Alik_Bljk_F8NHS_STA_BH_BiasSH_HAS_SAB_SAV_UserArgs_MT320x112x128_MI16x16x1_SN_LDSB0_GRVWB8_GSU1_GSUC0_GSUWGMRR0_K1_LBSPPB128_MIWT5_7_NLCA2_SU8_SUM0_SUS128_VWB1_WG64_4_1_WGM8_WGMXCC8_WGMXCCG304
    SolutionIndex: 184
    SolutionNameMin: Cijk_Alik_Bljk_F8NHS_STA_BH_BiasSH_HAS_SAB_SAV_UserArgs_MT384x112x128_MI16x16x1_SN_LDSB0_GRVWB8_GSU1_GSUC0_GSUWGMRR0_K1_LBSPPB128_MIWT6_7_NLCA2_SU16_SUM0_SUS128_VWB1_WG64_4_1_WGM8_WGMXCC8_WGMXCCG304
    SolutionIndex: 185
    SolutionNameMin: Cijk_Alik_Bljk_F8NHS_STA_BH_BiasSH_HAS_SAB_SAV_UserArgs_MT448x128x128_MI16x16x1_SN_LDSB0_GRVWB16_GSU1_GSUC0_GSUWGMRR0_K1_LBSPPB1024_MIWT7_8_NLCA2_SU16_SUM0_SUS128_VWB8_WG64_4_1_WGM6_WGMXCC8_WGMXCCG304
    SolutionIndex: 186
    SolutionNameMin: Cijk_Alik_Bljk_F8NHS_STA_BH_BiasSH_HAS_SAB_SAV_UserArgs_MT320x192x128_MI16x16x1_SN_LDSB0_GRVWB16_GSU1_GSUC0_GSUWGMRR0_K1_LBSPPB512_MIWT5_12_NLCA2_SU16_SUM0_SUS128_VWB4_WG64_4_1_WGM6_WGMXCC8_WGMXCCG304
    SolutionIndex: 187
    SolutionNameMin: Cijk_Alik_Bljk_F8NHS_STA_BH_BiasSH_HAS_SAB_SAV_UserArgs_MT320x112x128_MI16x16x1_SN_LDSB0_GRVWB8_GSU1_GSUC0_GSUWGMRR0_K1_LBSPPB128_MIWT5_7_NLCA2_SU8_SUM0_SUS128_VWB1_WG64_4_1_WGM6_WGMXCC8_WGMXCCG304
    SolutionIndex: 188
    SolutionNameMin: Cijk_Alik_Bljk_F8NHS_STA_BH_BiasSH_HAS_SAB_SAV_UserArgs_MT64x16x512_MI16x16x1_SN_LDSB0_GRVWB16_GSU1_GSUC0_GSUWGMRR0_K1_LBSPPB512_MIWT1_1_NTA4_NLCA8_SU8_SUM0_SUS512_VWB1_WG64_4_1_WGM6_WGMXCC8_WGMXCCG304
    SolutionIndex: 189
    SolutionNameMin: Cijk_Alik_Bljk_F8NHS_STA_BH_BiasSH_HAS_SAB_SAV_UserArgs_MT64x32x256_MI16x16x1_SN_LDSB0_GRVWB16_GSU1_GSUC0_GSUWGMRR0_K1_LBSPPB512_MIWT1_2_NTA4_NLCA4_SU16_SUM0_SUS256_VWB2_WG64_4_1_WGM8_WGMXCC8_WGMXCCG304
    SolutionIndex: 190
    SolutionNameMin: Cijk_Alik_Bljk_F8NHS_STA_BH_BiasSH_HAS_SAB_SAV_UserArgs_MT64x48x256_MI16x16x1_SN_LDSB0_GRVWB16_GSU1_GSUC0_GSUWGMRR0_K1_LBSPPB256_MIWT1_3_NTA4_NLCA4_SU8_SUM0_SUS256_VWB1_WG64_4_1_WGM8_WGMXCC8_WGMXCCG304
    SolutionIndex: 191
    SolutionNameMin: Cijk_Alik_Bljk_F8NHS_STA_BH_BiasSH_HAS_SAB_SAV_UserArgs_MT64x64x256_MI16x16x1_SN_LDSB1_GRVWB16_GSU1_GSUC0_GSUWGMRR0_K1_LBSPPB1024_MIWT1_4_NTA4_NLCA4_SU16_SUM0_SUS256_VWB4_WG64_4_1_WGM6_WGMXCC8_WGMXCCG304
    SolutionIndex: 192
    SolutionNameMin: Cijk_Alik_Bljk_F8NHS_STA_BH_BiasSH_HAS_SAB_SAV_UserArgs_MT128x80x256_MI16x16x1_SN_LDSB1_GRVWB16_GSU1_GSUC0_GSUWGMRR0_K1_LBSPPB256_MIWT2_5_NTA4_NLCA4_SU8_SUM0_SUS256_VWB1_WG64_4_1_WGM8_WGMXCC8_WGMXCCG304
    SolutionIndex: 193
    SolutionNameMin: Cijk_Alik_Bljk_F8NHS_STA_BH_BiasSH_HAS_SAB_SAV_UserArgs_MT128x32x256_MI16x16x1_SN_LDSB0_GRVWB16_GSU1_GSUC0_GSUWGMRR0_K1_LBSPPB512_MIWT2_2_NTA0_NLCA4_SU16_SUM0_SUS256_VWB2_WG64_4_1_WGM8_WGMXCC8_WGMXCCG304
    SolutionIndex: 194
    SolutionNameMin: Cijk_Alik_Bljk_F8NHS_STA_BH_BiasSH_HAS_SAB_SAV_UserArgs_MT64x112x256_MI16x16x1_SN_LDSB1_GRVWB16_GSU1_GSUC0_GSUWGMRR0_K1_LBSPPB256_MIWT1_7_NTA4_NLCA4_SU8_SUM0_SUS256_VWB1_WG64_4_1_WGM6_WGMXCC8_WGMXCCG304
    SolutionIndex: 195
    SolutionNameMin: Cijk_Alik_Bljk_F8NHS_STA_BH_BiasSH_HAS_SAB_SAV_UserArgs_MT128x112x256_MI16x16x1_SN_LDSB1_GRVWB16_GSU1_GSUC0_GSUWGMRR0_K1_LBSPPB256_MIWT2_7_NTA0_NLCA4_SU16_SUM0_SUS256_VWB1_WG64_4_1_WGM6_WGMXCC8_WGMXCCG304
    SolutionIndex: 196
    SolutionNameMin: Cijk_Alik_Bljk_F8NHS_STA_BH_BiasSH_HAS_SAB_SAV_UserArgs_MT128x128x128_MI16x16x1_SN_LDSB1_GRVWB16_GSU1_GSUC0_GSUWGMRR0_K1_LBSPPB1024_MIWT2_8_NTA4_NLCA2_SU16_SUM0_SUS128_VWB8_WG64_4_1_WGM6_WGMXCC8_WGMXCCG304
    SolutionIndex: 197
    SolutionNameMin: Cijk_Alik_Bljk_F8NHS_STA_BH_BiasSH_HAS_SAB_SAV_UserArgs_MT128x96x256_MI16x16x1_SN_LDSB1_GRVWB16_GSU1_GSUC0_GSUWGMRR0_K1_LBSPPB512_MIWT2_6_NTA0_NLCA4_SU16_SUM0_SUS256_VWB2_WG64_4_1_WGM8_WGMXCC8_WGMXCCG304
    SolutionIndex: 198
    SolutionNameMin: Cijk_Alik_Bljk_F8NHS_STA_BH_BiasSH_HAS_SAB_SAV_UserArgs_MT128x96x256_MI16x16x1_SN_LDSB1_GRVWB16_GSU1_GSUC0_GSUWGMRR0_K1_LBSPPB512_MIWT2_6_NTA0_NLCA4_SU8_SUM0_SUS256_VWB2_WG64_4_1_WGM6_WGMXCC8_WGMXCCG304
    SolutionIndex: 199
    SolutionNameMin: Cijk_Alik_Bljk_F8NHS_STA_BH_BiasSH_HAS_SAB_SAV_UserArgs_MT256x64x256_MI16x16x1_SN_LDSB1_GRVWB16_GSU1_GSUC0_GSUWGMRR0_K1_LBSPPB1024_MIWT4_4_NTA0_NLCA4_SU8_SUM0_SUS256_VWB4_WG64_4_1_WGM6_WGMXCC8_WGMXCCG304
    SolutionIndex: 200
    SolutionNameMin: Cijk_Alik_Bljk_F8NHS_STA_BH_BiasSH_HAS_SAB_SAV_UserArgs_MT128x112x256_MI16x16x1_SN_LDSB1_GRVWB16_GSU1_GSUC0_GSUWGMRR0_K1_LBSPPB256_MIWT2_7_NTA0_NLCA4_SU8_SUM0_SUS256_VWB1_WG64_4_1_WGM6_WGMXCC8_WGMXCCG304
    SolutionIndex: 201
    SolutionNameMin: Cijk_Alik_Bljk_F8NHS_STA_BH_BiasSH_HAS_SAB_SAV_UserArgs_MT192x96x128_MI16x16x1_SN_LDSB0_GRVWB16_GSU1_GSUC0_GSUWGMRR0_K1_LBSPPB256_MIWT3_6_NTA0_NLCA2_SU16_SUM0_SUS128_VWB2_WG64_4_1_WGM6_WGMXCC8_WGMXCCG304
    SolutionIndex: 202
    SolutionNameMin: Cijk_Alik_Bljk_F8NHS_STA_BH_BiasSH_HAS_SAB_SAV_UserArgs_MT128x128x128_MI16x16x1_SN_LDSB1_GRVWB16_GSU1_GSUC0_GSUWGMRR0_K1_LBSPPB1024_MIWT2_8_NTA0_NLCA2_SU8_SUM0_SUS128_VWB8_WG64_4_1_WGM6_WGMXCC8_WGMXCCG304
    SolutionIndex: 203
    SolutionNameMin: Cijk_Alik_Bljk_F8NHS_STA_BH_BiasSH_HAS_SAB_SAV_UserArgs_MT192x96x128_MI16x16x1_SN_LDSB0_GRVWB16_GSU1_GSUC0_GSUWGMRR0_K1_LBSPPB256_MIWT3_6_NTA0_NLCA2_SU8_SUM0_SUS128_VWB2_WG64_4_1_WGM8_WGMXCC8_WGMXCCG304
    SolutionIndex: 204
    SolutionNameMin: Cijk_Alik_Bljk_F8NHS_STA_BH_BiasSH_HAS_SAB_SAV_UserArgs_MT192x80x128_MI16x16x1_SN_LDSB0_GRVWB8_GSU1_GSUC0_GSUWGMRR0_K1_LBSPPB128_MIWT3_5_NTA0_NLCA2_SU8_SUM0_SUS128_VWB1_WG64_4_1_WGM8_WGMXCC8_WGMXCCG304
    SolutionIndex: 205
    SolutionNameMin: Cijk_Alik_Bljk_F8NHS_STA_BH_BiasSH_HAS_SAB_SAV_UserArgs_MT256x64x128_MI16x16x1_SN_LDSB0_GRVWB16_GSU1_GSUC0_GSUWGMRR0_K1_LBSPPB512_MIWT4_4_NTA0_NLCA2_SU16_SUM0_SUS128_VWB4_WG64_4_1_WGM8_WGMXCC8_WGMXCCG304
    SolutionIndex: 206
    SolutionNameMin: Cijk_Alik_Bljk_F8NHS_STA_BH_BiasSH_HAS_SAB_SAV_UserArgs_MT192x96x128_MI16x16x1_SN_LDSB0_GRVWB16_GSU1_GSUC0_GSUWGMRR0_K1_LBSPPB256_MIWT3_6_NTA0_NLCA2_SU16_SUM0_SUS128_VWB2_WG64_4_1_WGM8_WGMXCC8_WGMXCCG304
    SolutionIndex: 207
    SolutionNameMin: Cijk_Alik_Bljk_F8NHS_STA_BH_BiasSH_HAS_SAB_SAV_UserArgs_MT192x128x128_MI16x16x1_SN_LDSB1_GRVWB16_GSU1_GSUC0_GSUWGMRR0_K1_LBSPPB1024_MIWT3_8_NTA0_NLCA2_SU16_SUM0_SUS128_VWB8_WG64_4_1_WGM6_WGMXCC8_WGMXCCG304
    SolutionIndex: 208
    SolutionNameMin: Cijk_Alik_Bljk_F8NHS_STA_BH_BiasSH_HAS_SAB_SAV_UserArgs_MT192x128x128_MI16x16x1_SN_LDSB1_GRVWB16_GSU1_GSUC0_GSUWGMRR0_K1_LBSPPB1024_MIWT3_8_NTA0_NLCA2_SU8_SUM0_SUS128_VWB8_WG64_4_1_WGM6_WGMXCC8_WGMXCCG304
    SolutionIndex: 209
    SolutionNameMin: Cijk_Alik_Bljk_F8NHS_STA_BH_BiasSH_HAS_SAB_SAV_UserArgs_MT384x144x128_MI16x16x1_SN_LDSB0_GRVWB8_GSU1_GSUC0_GSUWGMRR0_K1_LBSPPB128_MIWT6_9_NLCA2_SU16_SUM0_SUS128_VWB1_WGM6_WGMXCC8_WGMXCCG304
    SolutionIndex: 210
    SolutionNameMin: Cijk_Alik_Bljk_F8NHS_STA_BH_BiasSH_HAS_SAB_SAV_UserArgs_MT384x160x128_MI16x16x1_SN_LDSB0_GRVWB16_GSU1_GSUC0_GSUWGMRR0_K1_LBSPPB256_MIWT6_10_NLCA2_SU16_SUM0_SUS128_VWB2_WGM8_WGMXCC8_WGMXCCG304
    SolutionIndex: 211
    SolutionNameMin: Cijk_Alik_Bljk_F8NHS_STA_BH_BiasSH_HAS_SAB_SAV_UserArgs_MT384x160x128_MI16x16x1_SN_LDSB0_GRVWB16_GSU1_GSUC0_GSUWGMRR0_K1_LBSPPB256_MIWT6_10_NLCA2_SU8_SUM0_SUS128_VWB2_WGM8_WGMXCC8_WGMXCCG304
    SolutionIndex: 212
    SolutionNameMin: Cijk_Alik_Bljk_F8NHS_STA_BH_BiasSH_HAS_SAB_SAV_UserArgs_MT384x112x128_MI16x16x1_SN_LDSB0_GRVWB8_GSU1_GSUC0_GSUWGMRR0_K1_LBSPPB128_MIWT6_7_NLCA2_SU16_SUM0_SUS128_VWB1_WGM6_WGMXCC8_WGMXCCG304
    SolutionIndex: 213
    SolutionNameMin: Cijk_Alik_Bljk_F8NHS_STA_BH_BiasSH_HAS_SAB_SAV_UserArgs_MT256x176x128_MI16x16x1_SN_LDSB0_GRVWB8_GSU1_GSUC0_GSUWGMRR0_K1_LBSPPB128_MIWT4_11_NLCA2_SU8_SUM0_SUS128_VWB1_WGM6_WGMXCC8_WGMXCCG304
    SolutionIndex: 214
    SolutionNameMin: Cijk_Alik_Bljk_F8NHS_STA_BH_BiasSH_HAS_SAB_SAV_UserArgs_MT384x128x128_MI16x16x1_SN_LDSB0_GRVWB16_GSU1_GSUC0_GSUWGMRR0_K1_LBSPPB1024_MIWT6_8_NLCA2_SU8_SUM0_SUS128_VWB8_WGM6_WGMXCC8_WGMXCCG304
    SolutionIndex: 215
    SolutionNameMin: Cijk_Alik_Bljk_F8NHS_STA_BH_BiasSH_HAS_SAB_SAV_UserArgs_MT192x256x128_MI16x16x1_SN_LDSB1_GRVWB16_GSU1_GSUC0_GSUWGMRR0_K1_LBSPPB2048_MIWT3_16_NLCA2_SU8_SUM0_SUS128_VWB16_WGM6_WGMXCC8_WGMXCCG304
    SolutionIndex: 216
    SolutionNameMin: Cijk_Alik_Bljk_F8NHS_STA_BH_BiasSH_HAS_SAB_SAV_UserArgs_MT320x160x128_MI16x16x1_SN_LDSB0_GRVWB16_GSU1_GSUC0_GSUWGMRR0_K1_LBSPPB256_MIWT5_10_NLCA2_SU8_SUM0_SUS128_VWB2_WGM6_WGMXCC8_WGMXCCG304
    SolutionIndex: 217
    SolutionNameMin: Cijk_Alik_Bljk_F8NHS_STA_BH_BiasSH_HAS_SAB_SAV_UserArgs_MT256x208x128_MI16x16x1_SN_LDSB1_GRVWB8_GSU1_GSUC0_GSUWGMRR0_K1_LBSPPB128_MIWT4_13_NLCA2_SU16_SUM0_SUS128_VWB1_WGM6_WGMXCC8_WGMXCCG304
    SolutionIndex: 218
    SolutionNameMin: Cijk_Alik_Bljk_F8NHS_STA_BH_BiasSH_HAS_SAB_SAV_UserArgs_MT384x144x128_MI16x16x1_SN_LDSB0_GRVWB8_GSU1_GSUC0_GSUWGMRR0_K1_LBSPPB128_MIWT6_9_NLCA2_SU8_SUM0_SUS128_VWB1_WGM6_WGMXCC8_WGMXCCG304
    SolutionIndex: 219
    SolutionNameMin: Cijk_Alik_Bljk_F8NHS_STA_BH_BiasSH_HAS_SAB_SAV_UserArgs_MT448x128x128_MI16x16x1_SN_LDSB0_GRVWB16_GSU1_GSUC0_GSUWGMRR0_K1_LBSPPB1024_MIWT7_8_NLCA2_SU8_SUM0_SUS128_VWB8_WGM8_WGMXCC8_WGMXCCG304
    SolutionIndex: 220
    SolutionNameMin: Cijk_Alik_Bljk_F8NHS_STA_BH_BiasSH_HAS_SAB_SAV_UserArgs_MT384x160x128_MI16x16x1_SN_LDSB0_GRVWB16_GSU1_GSUC0_GSUWGMRR0_K1_LBSPPB256_MIWT6_10_NLCA2_SU8_SUM0_SUS128_VWB2_WGM6_WGMXCC8_WGMXCCG304
    SolutionIndex: 221
    SolutionNameMin: Cijk_Alik_Bljk_F8NHS_STA_BH_BiasSH_HAS_SAB_SAV_UserArgs_MT320x192x128_MI16x16x1_SN_LDSB0_GRVWB16_GSU1_GSUC0_GSUWGMRR0_K1_LBSPPB512_MIWT5_12_NLCA2_SU8_SUM0_SUS128_VWB4_WGM6_WGMXCC8_WGMXCCG304
    SolutionIndex: 222
    SolutionNameMin: Cijk_Alik_Bljk_F8NHS_STA_BH_BiasSH_HAS_SAB_SAV_UserArgs_MT448x144x128_MI16x16x1_SN_LDSB0_GRVWB8_GSU1_GSUC0_GSUWGMRR0_K1_LBSPPB128_MIWT7_9_NLCA2_SU16_SUM0_SUS128_VWB1_WGM8_WGMXCC8_WGMXCCG304
    SolutionIndex: 223
    SolutionNameMin: Cijk_Alik_Bljk_F8NHS_STA_BH_BiasSH_HAS_SAB_SAV_UserArgs_MT512x128x128_MI16x16x1_SN_LDSB0_GRVWB16_GSU1_GSUC0_GSUWGMRR0_K1_LBSPPB1024_MIWT8_8_NLCA2_SU8_SUM0_SUS128_VWB8_WGM8_WGMXCC8_WGMXCCG304
    SolutionIndex: 224
    SolutionNameMin: Cijk_Alik_Bljk_F8NHS_STA_BH_BiasSH_HAS_SAB_SAV_UserArgs_MT256x224x128_MI16x16x1_SN_LDSB0_GRVWB16_GSU1_GSUC0_GSUWGMRR0_K1_LBSPPB256_MIWT4_14_NLCA2_SU16_SUM0_SUS128_VWB2_WGM8_WGMXCC8_WGMXCCG304
    SolutionIndex: 225
    SolutionNameMin: Cijk_Alik_Bljk_F8NHS_STA_BH_BiasSH_HAS_SAB_SAV_UserArgs_MT384x144x128_MI16x16x1_SN_LDSB0_GRVWB8_GSU1_GSUC0_GSUWGMRR0_K1_LBSPPB128_MIWT6_9_NLCA2_SU16_SUM0_SUS128_VWB1_WGM8_WGMXCC8_WGMXCCG304
    SolutionIndex: 226
    SolutionNameMin: Cijk_Alik_Bljk_F8NHS_STA_BH_BiasSH_HAS_SAB_SAV_UserArgs_MT192x224x128_MI16x16x1_SN_LDSB0_GRVWB16_GSU1_GSUC0_GSUWGMRR0_K1_LBSPPB256_MIWT3_14_NLCA2_SU16_SUM0_SUS128_VWB2_WGM8_WGMXCC8_WGMXCCG304
    SolutionIndex: 227
    SolutionNameMin: Cijk_Alik_Bljk_F8NHS_STA_BH_BiasSH_HAS_SAB_SAV_UserArgs_MT320x176x128_MI16x16x1_SN_LDSB0_GRVWB8_GSU1_GSUC0_GSUWGMRR0_K1_LBSPPB128_MIWT5_11_NLCA2_SU16_SUM0_SUS128_VWB1_WGM8_WGMXCC8_WGMXCCG304
    SolutionIndex: 228
    SolutionNameMin: Cijk_Alik_Bljk_F8NHS_STA_BH_BiasSH_HAS_SAB_SAV_UserArgs_MT448x128x128_MI16x16x1_SN_LDSB0_GRVWB16_GSU1_GSUC0_GSUWGMRR0_K1_LBSPPB1024_MIWT7_8_NLCA2_SU16_SUM0_SUS128_VWB8_WGM8_WGMXCC8_WGMXCCG304
    SolutionIndex: 229
    SolutionNameMin: Cijk_Alik_Bljk_F8NHS_STA_BH_BiasSH_HAS_SAB_SAV_UserArgs_MT320x128x128_MI16x16x1_SN_LDSB0_GRVWB16_GSU1_GSUC0_GSUWGMRR0_K1_LBSPPB1024_MIWT5_8_NLCA2_SU8_SUM0_SUS128_VWB8_WGM8_WGMXCC8_WGMXCCG304
    SolutionIndex: 230
    SolutionNameMin: Cijk_Alik_Bljk_F8NHS_STA_BH_BiasSH_HAS_SAB_SAV_UserArgs_MT512x128x128_MI16x16x1_SN_LDSB0_GRVWB16_GSU1_GSUC0_GSUWGMRR0_K1_LBSPPB1024_MIWT8_8_SU16_SUM0_SUS128_VWB8_WGM8_WGMXCC8_WGMXCCG304
    SolutionIndex: 231
    SolutionNameMin: Cijk_Alik_Bljk_F8NHS_STA_BH_BiasSH_HAS_SAB_SAV_UserArgs_MT384x128x128_MI16x16x1_SN_LDSB0_GRVWB16_GSU1_GSUC0_GSUWGMRR0_K1_LBSPPB1024_MIWT6_8_SU8_SUM0_SUS128_VWB8_WGM8_WGMXCC8_WGMXCCG304
    SolutionIndex: 232
    SolutionNameMin: Cijk_Alik_Bljk_F8NHS_STA_BH_BiasSH_HAS_SAB_SAV_UserArgs_MT512x128x128_MI16x16x1_SN_LDSB0_GRVWB16_GSU1_GSUC0_GSUWGMRR0_K1_LBSPPB1024_MIWT8_8_SU8_SUM0_SUS128_VWB8_WGM8_WGMXCC8_WGMXCCG304
    SolutionIndex: 233
    SolutionNameMin: Cijk_Alik_Bljk_F8NHS_STA_BH_BiasSH_HAS_SAB_SAV_UserArgs_MT448x128x128_MI16x16x1_SN_LDSB0_GRVWB16_GSU1_GSUC0_GSUWGMRR0_K1_LBSPPB1024_MIWT7_8_SU8_SUM0_SUS128_VWB8_WGM8_WGMXCC8_WGMXCCG304
    SolutionIndex: 234
    SolutionNameMin: Cijk_Alik_Bljk_F8NHS_STA_BH_BiasSH_HAS_SAB_SAV_UserArgs_MT384x128x128_MI16x16x1_SN_LDSB0_GRVWB16_GSU1_GSUC0_GSUWGMRR0_K1_LBSPPB1024_MIWT6_8_SU16_SUM0_SUS128_VWB8_WGM8_WGMXCC8_WGMXCCG304
    SolutionIndex: 235
    SolutionNameMin: Cijk_Alik_Bljk_F8NHS_STA_BH_BiasSH_HAS_SAB_SAV_UserArgs_MT512x128x128_MI16x16x1_SN_LDSB0_GRVWB16_GSU1_GSUC0_GSUWGMRR0_K1_LBSPPB1024_MIWT8_8_SU16_SUM0_SUS128_VWB8_WGM6_WGMXCC8_WGMXCCG304
    SolutionIndex: 236
    SolutionNameMin: Cijk_Alik_Bljk_F8NHS_STA_BH_BiasSH_HAS_SAB_SAV_UserArgs_MT256x16x256_MI16x16x1_SN_LDSB0_GRVWB16_GSU1_GSUC0_GSUWGMRR0_K1_LBSPPB256_MIWT4_1_NTA4_NLCA4_SU16_SUM0_SUS256_VWB1_WG64_4_1_WGM6_WGMXCC8_WGMXCCG304
    SolutionIndex: 237
    SolutionNameMin: Cijk_Alik_Bljk_F8NHS_STA_BH_BiasSH_HAS_SAB_SAV_UserArgs_MT320x32x256_MI16x16x1_SN_LDSB0_GRVWB16_GSU1_GSUC0_GSUWGMRR0_K1_LBSPPB512_MIWT5_2_NTA4_NLCA4_SU16_SUM0_SUS256_VWB2_WG64_4_1_WGM6_WGMXCC8_WGMXCCG304
    SolutionIndex: 238
    SolutionNameMin: Cijk_Alik_Bljk_F8NHS_STA_BH_BiasSH_HAS_SAB_SAV_UserArgs_MT192x48x256_MI16x16x1_SN_LDSB0_GRVWB16_GSU1_GSUC0_GSUWGMRR0_K1_LBSPPB256_MIWT3_3_NTA4_NLCA4_SU16_SUM0_SUS256_VWB1_WG64_4_1_WGM8_WGMXCC8_WGMXCCG304
    SolutionIndex: 239
    SolutionNameMin: Cijk_Alik_Bljk_F8NHS_STA_BH_BiasSH_HAS_SAB_SAV_UserArgs_MT192x64x256_MI16x16x1_SN_LDSB1_GRVWB16_GSU1_GSUC0_GSUWGMRR0_K1_LBSPPB1024_MIWT3_4_NTA4_NLCA4_SU8_SUM0_SUS256_VWB4_WG64_4_1_WGM6_WGMXCC8_WGMXCCG304
    SolutionIndex: 240
    SolutionNameMin: Cijk_Alik_Bljk_F8NHS_STA_BH_BiasSH_HAS_SAB_SAV_UserArgs_MT192x80x256_MI16x16x1_SN_LDSB1_GRVWB16_GSU1_GSUC0_GSUWGMRR0_K1_LBSPPB256_MIWT3_5_NTA4_NLCA4_SU8_SUM0_SUS256_VWB1_WG64_4_1_WGM6_WGMXCC8_WGMXCCG304
    SolutionIndex: 241
    SolutionNameMin: Cijk_Alik_Bljk_F8NHS_STA_BH_BiasSH_HAS_SAB_SAV_UserArgs_MT256x96x128_MI16x16x1_SN_LDSB0_GRVWB16_GSU1_GSUC0_GSUWGMRR0_K1_LBSPPB256_MIWT4_6_NTA4_NLCA2_SU16_SUM0_SUS128_VWB2_WG64_4_1_WGM8_WGMXCC8_WGMXCCG304
    SolutionIndex: 242
    SolutionNameMin: Cijk_Alik_Bljk_F8NHS_STA_BH_BiasSH_HAS_SAB_SAV_UserArgs_MT192x112x128_MI16x16x1_SN_LDSB1_GRVWB8_GSU1_GSUC0_GSUWGMRR0_K1_LBSPPB128_MIWT3_7_NTA4_NLCA2_SU8_SUM0_SUS128_VWB1_WG64_4_1_WGM6_WGMXCC8_WGMXCCG304
    SolutionIndex: 243
    SolutionNameMin: Cijk_Alik_Bljk_F8NHS_STA_BH_BiasSH_HAS_SAB_SAV_UserArgs_MT192x128x128_MI16x16x1_SN_LDSB1_GRVWB16_GSU1_GSUC0_GSUWGMRR0_K1_LBSPPB1024_MIWT3_8_NTA4_NLCA2_SU8_SUM0_SUS128_VWB8_WG64_4_1_WGM6_WGMXCC8_WGMXCCG304
    SolutionIndex: 244
    SolutionNameMin: Cijk_Alik_Bljk_F8NHS_STA_BH_BiasSH_HAS_SAB_SAV_UserArgs_MT192x144x128_MI16x16x1_SN_LDSB1_GRVWB8_GSU1_GSUC0_GSUWGMRR0_K1_LBSPPB128_MIWT3_9_NTA4_NLCA2_SU8_SUM0_SUS128_VWB1_WG64_4_1_WGM8_WGMXCC8_WGMXCCG304
    SolutionIndex: 245
    SolutionNameMin: Cijk_Alik_Bljk_F8NHS_STA_BH_BiasSH_HAS_SAB_SAV_UserArgs_MT192x160x128_MI16x16x1_SN_LDSB1_GRVWB16_GSU1_GSUC0_GSUWGMRR0_K1_LBSPPB256_MIWT3_10_NTA4_NLCA2_SU16_SUM0_SUS128_VWB2_WG64_4_1_WGM8_WGMXCC8_WGMXCCG304
    SolutionIndex: 246
    SolutionNameMin: Cijk_Alik_Bljk_F8NHS_STA_BH_BiasSH_HAS_SAB_SAV_UserArgs_MT192x176x128_MI16x16x1_SN_LDSB0_GRVWB8_GSU1_GSUC0_GSUWGMRR0_K1_LBSPPB128_MIWT3_11_NTA4_NLCA2_SU16_SUM0_SUS128_VWB1_WG64_4_1_WGM8_WGMXCC8_WGMXCCG304
    SolutionIndex: 247
    SolutionNameMin: Cijk_Alik_Bljk_F8NHS_STA_BH_BiasSH_HAS_SAB_SAV_UserArgs_MT192x192x128_MI16x16x1_SN_LDSB0_GRVWB16_GSU1_GSUC0_GSUWGMRR0_K1_LBSPPB512_MIWT3_12_NTA4_NLCA2_SU16_SUM0_SUS128_VWB4_WG64_4_1_WGM8_WGMXCC8_WGMXCCG304
    SolutionIndex: 248
    SolutionNameMin: Cijk_Alik_Bljk_F8NHS_STA_BH_BiasSH_HAS_SAB_SAV_UserArgs_MT192x208x128_MI16x16x1_SN_LDSB1_GRVWB8_GSU1_GSUC0_GSUWGMRR0_K1_LBSPPB128_MIWT3_13_NTA4_NLCA2_SU8_SUM0_SUS128_VWB1_WG64_4_1_WGM6_WGMXCC8_WGMXCCG304
    SolutionIndex: 249
    SolutionNameMin: Cijk_Alik_Bljk_F8NHS_STA_BH_BiasSH_HAS_SAB_SAV_UserArgs_MT192x224x128_MI16x16x1_SN_LDSB0_GRVWB16_GSU1_GSUC0_GSUWGMRR0_K1_LBSPPB256_MIWT3_14_NTA4_NLCA2_SU8_SUM0_SUS128_VWB2_WG64_4_1_WGM8_WGMXCC8_WGMXCCG304
    SolutionIndex: 250
    SolutionNameMin: Cijk_Alik_Bljk_F8NHS_STA_BH_BiasSH_HAS_SAB_SAV_UserArgs_MT384x128x128_MI16x16x1_SN_LDSB0_GRVWB16_GSU1_GSUC0_GSUWGMRR0_K1_LBSPPB1024_MIWT6_8_NTA0_NLCA2_SU16_SUM0_SUS128_VWB8_WG64_4_1_WGM6_WGMXCC8_WGMXCCG304
    SolutionIndex: 251
    SolutionNameMin: Cijk_Alik_Bljk_F8NHS_STA_BH_BiasSH_HAS_SAB_SAV_UserArgs_MT192x256x128_MI16x16x1_SN_LDSB1_GRVWB16_GSU1_GSUC0_GSUWGMRR0_K1_LBSPPB2048_MIWT3_16_NTA4_NLCA2_SU16_SUM0_SUS128_VWB16_WG64_4_1_WGM8_WGMXCC8_WGMXCCG304
    SolutionIndex: 252
    SolutionNameMin: Cijk_Alik_Bljk_F8NHS_STA_BH_BiasSH_HAS_SAB_SAV_UserArgs_MT384x144x128_MI16x16x1_SN_LDSB0_GRVWB8_GSU1_GSUC0_GSUWGMRR0_K1_LBSPPB128_MIWT6_9_NTA0_NLCA2_SU16_SUM0_SUS128_VWB1_WG64_4_1_WGM8_WGMXCC8_WGMXCCG304
    SolutionIndex: 253
    SolutionNameMin: Cijk_Alik_Bljk_F8NHS_STA_BH_BiasSH_HAS_SAB_SAV_UserArgs_MT384x144x128_MI16x16x1_SN_LDSB0_GRVWB8_GSU1_GSUC0_GSUWGMRR0_K1_LBSPPB128_MIWT6_9_NTA0_NLCA2_SU8_SUM0_SUS128_VWB1_WG64_4_1_WGM8_WGMXCC8_WGMXCCG304
    SolutionIndex: 254
    SolutionNameMin: Cijk_Alik_Bljk_F8NHS_STA_BH_BiasSH_HAS_SAB_SAV_UserArgs_MT384x160x128_MI16x16x1_SN_LDSB0_GRVWB16_GSU1_GSUC0_GSUWGMRR0_K1_LBSPPB256_MIWT6_10_NTA0_NLCA2_SU16_SUM0_SUS128_VWB2_WG64_4_1_WGM6_WGMXCC8_WGMXCCG304
    SolutionIndex: 255
    SolutionNameMin: Cijk_Alik_Bljk_F8NHS_STA_BH_BiasSH_HAS_SAB_SAV_UserArgs_MT384x160x128_MI16x16x1_SN_LDSB0_GRVWB16_GSU1_GSUC0_GSUWGMRR0_K1_LBSPPB256_MIWT6_10_NTA0_NLCA2_SU8_SUM0_SUS128_VWB2_WG64_4_1_WGM6_WGMXCC8_WGMXCCG304
    SolutionIndex: 256
    SolutionNameMin: Cijk_Alik_Bljk_F8NHS_STA_BH_BiasSH_HAS_SAB_SAV_UserArgs_MT320x112x128_MI16x16x1_SN_LDSB0_GRVWB8_GSU1_GSUC0_GSUWGMRR0_K1_LBSPPB128_MIWT5_7_NTA0_NLCA2_SU16_SUM0_SUS128_VWB1_WG64_4_1_WGM8_WGMXCC8_WGMXCCG304
    SolutionIndex: 257
    SolutionNameMin: Cijk_Alik_Bljk_F8NHS_STA_BH_BiasSH_HAS_SAB_SAV_UserArgs_MT192x176x128_MI16x16x1_SN_LDSB0_GRVWB8_GSU1_GSUC0_GSUWGMRR0_K1_LBSPPB128_MIWT3_11_NTA0_NLCA2_SU16_SUM0_SUS128_VWB1_WG64_4_1_WGM6_WGMXCC8_WGMXCCG304
    SolutionIndex: 258
    SolutionNameMin: Cijk_Alik_Bljk_F8NHS_STA_BH_BiasSH_HAS_SAB_SAV_UserArgs_MT320x128x128_MI16x16x1_SN_LDSB0_GRVWB16_GSU1_GSUC0_GSUWGMRR0_K1_LBSPPB1024_MIWT5_8_NTA0_NLCA2_SU16_SUM0_SUS128_VWB8_WG64_4_1_WGM6_WGMXCC8_WGMXCCG304
    SolutionIndex: 259
    SolutionNameMin: Cijk_Alik_Bljk_F8NHS_STA_BH_BiasSH_HAS_SAB_SAV_UserArgs_MT512x80x128_MI16x16x1_SN_LDSB0_GRVWB8_GSU1_GSUC0_GSUWGMRR0_K1_LBSPPB128_MIWT8_5_NTA0_NLCA2_SU16_SUM0_SUS128_VWB1_WG64_4_1_WGM6_WGMXCC8_WGMXCCG304
    SolutionIndex: 260
    SolutionNameMin: Cijk_Alik_Bljk_F8NHS_STA_BH_BiasSH_HAS_SAB_SAV_UserArgs_MT192x208x128_MI16x16x1_SN_LDSB1_GRVWB8_GSU1_GSUC0_GSUWGMRR0_K1_LBSPPB128_MIWT3_13_NTA0_NLCA2_SU16_SUM0_SUS128_VWB1_WG64_4_1_WGM6_WGMXCC8_WGMXCCG304
    SolutionIndex: 261
    SolutionNameMin: Cijk_Alik_Bljk_F8NHS_STA_BH_BiasSH_HAS_SAB_SAV_UserArgs_MT320x144x128_MI16x16x1_SN_LDSB0_GRVWB8_GSU1_GSUC0_GSUWGMRR0_K1_LBSPPB128_MIWT5_9_NTA0_NLCA2_SU16_SUM0_SUS128_VWB1_WG64_4_1_WGM6_WGMXCC8_WGMXCCG304
    SolutionIndex: 262
    SolutionNameMin: Cijk_Alik_Bljk_F8NHS_STA_BH_BiasSH_HAS_SAB_SAV_UserArgs_MT192x224x128_MI16x16x1_SN_LDSB0_GRVWB16_GSU1_GSUC0_GSUWGMRR0_K1_LBSPPB256_MIWT3_14_NTA0_NLCA2_SU16_SUM0_SUS128_VWB2_WG64_4_1_WGM6_WGMXCC8_WGMXCCG304
    SolutionIndex: 263
    SolutionNameMin: Cijk_Alik_Bljk_F8NHS_STA_BH_BiasSH_HAS_SAB_SAV_UserArgs_MT320x160x128_MI16x16x1_SN_LDSB0_GRVWB16_GSU1_GSUC0_GSUWGMRR0_K1_LBSPPB256_MIWT5_10_NTA0_NLCA2_SU8_SUM0_SUS128_VWB2_WG64_4_1_WGM8_WGMXCC8_WGMXCCG304
    SolutionIndex: 264
    SolutionNameMin: Cijk_Alik_Bljk_F8NHS_STA_BH_BiasSH_HAS_SAB_SAV_UserArgs_MT384x128x128_MI16x16x1_SN_LDSB0_GRVWB16_GSU1_GSUC0_GSUWGMRR0_K1_LBSPPB1024_MIWT6_8_NTA0_NLCA2_SU8_SUM0_SUS128_VWB8_WG64_4_1_WGM8_WGMXCC8_WGMXCCG304
    SolutionIndex: 265
    SolutionNameMin: Cijk_Alik_Bljk_F8NHS_STA_BH_BiasSH_HAS_SAB_SAV_UserArgs_MT512x128x128_MI16x16x1_SN_LDSB0_GRVWB16_GSU1_GSUC0_GSUWGMRR0_K1_LBSPPB1024_MIWT8_8_NLCA2_SU16_SUM0_SUS128_VWB8_WGM8_WGMXCC8_WGMXCCG304
    SolutionIndex: 266
    SolutionNameMin: Cijk_Alik_Bljk_F8NHS_STA_BH_BiasSH_HAS_SAB_SAV_UserArgs_MT192x256x128_MI16x16x1_SN_LDSB1_GRVWB16_GSU1_GSUC0_GSUWGMRR0_K1_LBSPPB2048_MIWT3_16_NLCA2_SU16_SUM0_SUS128_VWB16_WGM6_WGMXCC8_WGMXCCG304
    SolutionIndex: 267
    SolutionNameMin: Cijk_Alik_Bljk_F8NHS_STA_BH_BiasSH_HAS_SAB_SAV_UserArgs_MT384x128x128_MI16x16x1_SN_LDSB0_GRVWB16_GSU1_GSUC0_GSUWGMRR0_K1_LBSPPB1024_MIWT6_8_NLCA2_SU16_SUM0_SUS128_VWB8_WGM8_WGMXCC8_WGMXCCG304
    SolutionIndex: 268
    SolutionNameMin: Cijk_Alik_Bljk_F8NHS_STA_BH_BiasSH_HAS_SAB_SAV_UserArgs_MT384x128x128_MI16x16x1_SN_LDSB0_GRVWB16_GSU1_GSUC0_GSUWGMRR0_K1_LBSPPB1024_MIWT6_8_NLCA2_SU8_SUM0_SUS128_VWB8_WGM8_WGMXCC8_WGMXCCG304
    SolutionIndex: 269
    SolutionNameMin: Cijk_Alik_Bljk_F8NHS_STA_BH_BiasSH_HAS_SAB_SAV_UserArgs_MT192x256x128_MI16x16x1_SN_LDSB1_GRVWB16_GSU1_GSUC0_GSUWGMRR0_K1_LBSPPB2048_MIWT3_16_NLCA2_SU16_SUM0_SUS128_VWB16_WGM8_WGMXCC8_WGMXCCG304
    SolutionIndex: 270
    SolutionNameMin: Cijk_Alik_Bljk_F8NHS_STA_BH_BiasSH_HAS_SAB_SAV_UserArgs_MT128x64x256_MI16x16x1_SN_LDSB1_GRVWB16_GSU4_GSUC0_GSUWGMRR0_K1_LBSPPB1024_MIWT2_4_NLCA4_SU16_SUM0_SUS256_VWB4_WG64_4_1_WGM8_WGMXCC8_WGMXCCG304
    SolutionIndex: 271
    SolutionNameMin: Cijk_Alik_Bljk_F8NHS_STA_BH_BiasSH_HAS_SAB_SAV_UserArgs_MT128x80x256_MI16x16x1_SN_LDSB1_GRVWB16_GSU4_GSUC0_GSUWGMRR0_K1_LBSPPB256_MIWT2_5_NLCA4_SU16_SUM0_SUS256_VWB1_WG64_4_1_WGM8_WGMXCC8_WGMXCCG304
    SolutionIndex: 272
    SolutionNameMin: Cijk_Alik_Bljk_F8NHS_STA_BH_BiasSH_HAS_SAB_SAV_UserArgs_MT128x96x256_MI16x16x1_SN_LDSB1_GRVWB16_GSU4_GSUC0_GSUWGMRR0_K1_LBSPPB512_MIWT2_6_NLCA4_SU16_SUM0_SUS256_VWB2_WG64_4_1_WGM8_WGMXCC8_WGMXCCG304
    SolutionIndex: 273
    SolutionNameMin: Cijk_Alik_Bljk_F8NHS_STA_BH_BiasSH_HAS_SAB_SAV_UserArgs_MT128x112x256_MI16x16x1_SN_LDSB1_GRVWB16_GSU4_GSUC0_GSUWGMRR0_K1_LBSPPB256_MIWT2_7_NLCA4_SU16_SUM0_SUS256_VWB1_WG64_4_1_WGM8_WGMXCC8_WGMXCCG304
    SolutionIndex: 274
    SolutionNameMin: Cijk_Alik_Bljk_F8NHS_STA_BH_BiasSH_HAS_SAB_SAV_UserArgs_MT128x128x256_MI16x16x1_SN_LDSB1_GRVWB16_GSU3_GSUC0_GSUWGMRR0_K1_LBSPPB2048_MIWT2_8_NLCA4_SU16_SUM0_SUS256_VWB8_WG64_4_1_WGM8_WGMXCC8_WGMXCCG304
    SolutionIndex: 275
    SolutionNameMin: Cijk_Alik_Bljk_F8NHS_STA_BH_BiasSH_HAS_SAB_SAV_UserArgs_MT256x48x256_MI16x16x1_SN_LDSB0_GRVWB16_GSU2_GSUC0_GSUWGMRR0_K1_LBSPPB256_MIWT4_3_NLCA4_SU16_SUM0_SUS256_VWB1_WG64_4_1_WGM8_WGMXCC8_WGMXCCG304
    SolutionIndex: 276
    SolutionNameMin: Cijk_Alik_Bljk_F8NHS_STA_BH_BiasSH_HAS_SAB_SAV_UserArgs_MT320x80x128_MI16x16x1_SN_LDSB0_GRVWB8_GSU4_GSUC0_GSUWGMRR0_K1_LBSPPB128_MIWT5_5_NLCA2_SU16_SUM0_SUS128_VWB1_WG64_4_1_WGM8_WGMXCC8_WGMXCCG304
    SolutionIndex: 277
    SolutionNameMin: Cijk_Alik_Bljk_F8NHS_STA_BH_BiasSH_HAS_SAB_SAV_UserArgs_MT256x96x128_MI16x16x1_SN_LDSB0_GRVWB16_GSU4_GSUC0_GSUWGMRR0_K1_LBSPPB256_MIWT4_6_NLCA2_SU16_SUM0_SUS128_VWB2_WG64_4_1_WGM8_WGMXCC8_WGMXCCG304
    SolutionIndex: 278
    SolutionNameMin: Cijk_Alik_Bljk_F8NHS_STA_BH_BiasSH_HAS_SAB_SAV_UserArgs_MT192x96x128_MI16x16x1_SN_LDSB0_GRVWB16_GSU3_GSUC0_GSUWGMRR0_K1_LBSPPB256_MIWT3_6_NLCA2_SU16_SUM0_SUS128_VWB2_WG64_4_1_WGM8_WGMXCC8_WGMXCCG304
    SolutionIndex: 279
    SolutionNameMin: Cijk_Alik_Bljk_F8NHS_STA_BH_BiasSH_HAS_SAB_SAV_UserArgs_MT128x112x256_MI16x16x1_SN_LDSB1_GRVWB16_GSU2_GSUC0_GSUWGMRR0_K1_LBSPPB256_MIWT2_7_NLCA4_SU16_SUM0_SUS256_VWB1_WG64_4_1_WGM8_WGMXCC8_WGMXCCG304
    SolutionIndex: 280
    SolutionNameMin: Cijk_Alik_Bljk_F8NHS_STA_BH_BiasSH_HAS_SAB_SAV_UserArgs_MT256x112x128_MI16x16x1_SN_LDSB1_GRVWB8_GSU4_GSUC0_GSUWGMRR0_K1_LBSPPB128_MIWT4_7_NLCA2_SU16_SUM0_SUS128_VWB1_WG64_4_1_WGM8_WGMXCC8_WGMXCCG304
    SolutionIndex: 281
    SolutionNameMin: Cijk_Alik_Bljk_F8NHS_STA_BH_BiasSH_HAS_SAB_SAV_UserArgs_MT256x80x256_MI16x16x1_SN_LDSB1_GRVWB16_GSU3_GSUC0_GSUWGMRR0_K1_LBSPPB256_MIWT4_5_NLCA4_SU16_SUM0_SUS256_VWB1_WG64_4_1_WGM8_WGMXCC8_WGMXCCG304
    SolutionIndex: 282
    SolutionNameMin: Cijk_Alik_Bljk_F8NHS_STA_BH_BiasSH_HAS_SAB_SAV_UserArgs_MT128x64x256_MI16x16x1_SN_LDSB1_GRVWB16_GSU1_GSUC0_GSUWGMRR0_K1_LBSPPB1024_MIWT2_4_NLCA4_SU16_SUM0_SUS256_VWB4_WG64_4_1_WGM8_WGMXCC8_WGMXCCG304
    SolutionIndex: 283
    SolutionNameMin: Cijk_Alik_Bljk_F8NHS_STA_BH_BiasSH_HAS_SAB_SAV_UserArgs_MT192x128x128_MI16x16x1_SN_LDSB1_GRVWB16_GSU1_GSUC0_GSUWGMRR0_K1_LBSPPB1024_MIWT3_8_NLCA2_SU16_SUM0_SUS128_VWB8_WG64_4_1_WGM8_WGMXCC8_WGMXCCGn1
    SolutionIndex: 284
    SolutionNameMin: Cijk_Alik_Bljk_F8NHS_STA_BH_BiasSH_HAS_SAB_SAV_UserArgs_MT192x192x128_MI16x16x1_SN_LDSB0_GRVWB16_GSU1_GSUC0_GSUWGMRR0_K1_LBSPPB512_MIWT3_12_NLCA2_SU16_SUM0_SUS128_VWB4_WG64_4_1_WGM8_WGMXCC8_WGMXCCGn1
    SolutionIndex: 285
    SolutionNameMin: Cijk_Alik_Bljk_F8NHS_STA_BH_BiasSH_HAS_SAB_SAV_UserArgs_MT256x160x128_MI16x16x1_SN_LDSB0_GRVWB16_GSU1_GSUC0_GSUWGMRR0_K1_LBSPPB256_MIWT4_10_NLCA2_SU16_SUM0_SUS128_VWB2_WG64_4_1_WGM8_WGMXCC8_WGMXCCGn1
    SolutionIndex: 286
    SolutionNameMin: Cijk_Alik_Bljk_F8NHS_STA_BH_BiasSH_HAS_SAB_SAV_UserArgs_MT384x128x128_MI16x16x1_SN_LDSB0_GRVWB16_GSU1_GSUC0_GSUWGMRR0_K1_LBSPPB1024_MIWT6_8_NLCA2_SU16_SUM0_SUS128_VWB8_WG64_4_1_WGM8_WGMXCC8_WGMXCCGn1
    SolutionIndex: 287
    SolutionNameMin: Cijk_Alik_Bljk_F8NHS_STA_BH_BiasSH_HAS_SAB_SAV_UserArgs_MT256x208x128_MI16x16x1_SN_LDSB1_GRVWB8_GSU1_GSUC0_GSUWGMRR0_K1_LBSPPB128_MIWT4_13_NLCA2_SU16_SUM0_SUS128_VWB1_WG64_4_1_WGM8_WGMXCC8_WGMXCCGn1
    SolutionIndex: 288
    SolutionNameMin: Cijk_Alik_Bljk_F8NHS_STA_BH_BiasSH_HAS_SAB_SAV_UserArgs_MT384x144x128_MI16x16x1_SN_LDSB0_GRVWB8_GSU1_GSUC0_GSUWGMRR0_K1_LBSPPB128_MIWT6_9_NLCA2_SU16_SUM0_SUS128_VWB1_WG64_4_1_WGM8_WGMXCC8_WGMXCCGn1
    SolutionIndex: 289
    SolutionNameMin: Cijk_Alik_Bljk_F8NHS_STA_BH_BiasSH_HAS_SAB_SAV_UserArgs_MT256x224x128_MI16x16x1_SN_LDSB0_GRVWB16_GSU1_GSUC0_GSUWGMRR0_K1_LBSPPB256_MIWT4_14_NLCA2_SU16_SUM0_SUS128_VWB2_WG64_4_1_WGM8_WGMXCC8_WGMXCCGn1
    SolutionIndex: 290
    SolutionNameMin: Cijk_Alik_Bljk_F8NHS_STA_BH_BiasSH_HAS_SAB_SAV_UserArgs_MT512x128x128_MI16x16x1_SN_LDSB0_GRVWB16_GSU1_GSUC0_GSUWGMRR0_K1_LBSPPB1024_MIWT8_8_NLCA2_SU16_SUM0_SUS128_VWB8_WG64_4_1_WGM8_WGMXCC8_WGMXCCGn1
    SolutionIndex: 291
    SolutionNameMin: Cijk_Alik_Bljk_F8NHS_STA_BH_BiasSH_HAS_SAB_SAV_UserArgs_MT256x128x128_MI16x16x1_SN_LDSB1_GRVWB16_GSU1_GSUC0_GSUWGMRR0_K1_LBSPPB1024_MIWT4_8_NLCA2_SU16_SUM0_SUS128_VWB8_WG64_4_1_WGM8_WGMXCC8_WGMXCCGn1
    SolutionIndex: 292
    SolutionNameMin: Cijk_Alik_Bljk_F8NHS_STA_BH_BiasSH_HAS_SAB_SAV_UserArgs_MT192x256x128_MI16x16x1_SN_LDSB1_GRVWB16_GSU1_GSUC0_GSUWGMRR0_K1_LBSPPB2048_MIWT3_16_NLCA2_SU16_SUM0_SUS128_VWB16_WG64_4_1_WGM8_WGMXCC8_WGMXCCGn1
    SolutionIndex: 293
    SolutionNameMin: Cijk_Alik_Bljk_F8NHS_STA_BH_BiasSH_HAS_SAB_SAV_UserArgs_MT192x96x128_MI16x16x1_SN_LDSB0_GRVWB16_GSU1_GSUC0_GSUWGMRR0_K1_LBSPPB256_MIWT3_6_NLCA2_SU16_SUM0_SUS128_VWB2_WG64_4_1_WGM8_WGMXCC8_WGMXCCGn1
    SolutionIndex: 294
    SolutionNameMin: Cijk_Alik_Bljk_F8NHS_STA_BH_BiasSH_HAS_SAB_SAV_UserArgs_MT256x80x128_MI16x16x1_SN_LDSB0_GRVWB8_GSU1_GSUC0_GSUWGMRR0_K1_LBSPPB128_MIWT4_5_NLCA2_SU16_SUM0_SUS128_VWB1_WG64_4_1_WGM8_WGMXCC8_WGMXCCGn1
    SolutionIndex: 295
    SolutionNameMin: Cijk_Alik_Bljk_F8NHS_STA_BH_BiasSH_HAS_SAB_SAV_UserArgs_MT256x112x128_MI16x16x1_SN_LDSB1_GRVWB8_GSU1_GSUC0_GSUWGMRR0_K1_LBSPPB128_MIWT4_7_NLCA2_SU16_SUM0_SUS128_VWB1_WG64_4_1_WGM8_WGMXCC8_WGMXCCGn1
    SolutionIndex: 296
    SolutionNameMin: Cijk_Alik_Bljk_F8NHS_STA_BH_BiasSH_HAS_SAB_SAV_UserArgs_MT384x96x128_MI16x16x1_SN_LDSB0_GRVWB16_GSU1_GSUC0_GSUWGMRR0_K1_LBSPPB256_MIWT6_6_NLCA2_SU16_SUM0_SUS128_VWB2_WG64_4_1_WGM8_WGMXCC8_WGMXCCGn1
    SolutionIndex: 297
    SolutionNameMin: Cijk_Alik_Bljk_F8NHS_STA_BH_BiasSH_HAS_SAB_SAV_UserArgs_MT320x128x128_MI16x16x1_SN_LDSB0_GRVWB16_GSU1_GSUC0_GSUWGMRR0_K1_LBSPPB1024_MIWT5_8_NLCA2_SU16_SUM0_SUS128_VWB8_WG64_4_1_WGM8_WGMXCC8_WGMXCCGn1
    SolutionIndex: 298
    SolutionNameMin: Cijk_Alik_Bljk_F8NHS_STA_BH_BiasSH_HAS_SAB_SAV_UserArgs_MT384x160x128_MI16x16x1_SN_LDSB0_GRVWB16_GSU1_GSUC0_GSUWGMRR0_K1_LBSPPB256_MIWT6_10_NLCA2_SU16_SUM0_SUS128_VWB2_WG64_4_1_WGM8_WGMXCC8_WGMXCCGn1
    SolutionIndex: 299
    SolutionNameMin: Cijk_Alik_Bljk_F8NHS_STA_BH_BiasSH_HAS_SAB_SAV_UserArgs_MT192x128x128_MI16x16x1_SN_LDSB1_GRVWB16_GSU5_GSUAMB_GSUC0_GSUWGMRR0_K1_LBSPPB1024_MIWT3_8_NLCA2_SU16_SUM0_SUS128_VWB8_WG64_4_1_WGM1_WGMXCC8_WGMXCCGn1
    SolutionIndex: 300
    SolutionNameMin: Cijk_Alik_Bljk_F8NHS_STA_BH_BiasSH_HAS_SAB_SAV_UserArgs_MT32x16x512_MI16x16x1_SN_LDSB0_GRVWB16_GSU4_GSUAMBSK_GSUC0_GSUWGMRR0_K1_LBSPPB512_MIWT1_1_NLCA8_SU16_SUM0_SUS512_VWB1_WG32_4_1_WGM1_WGMXCC8_WGMXCCGn1
    SolutionIndex: 301
    SolutionNameMin: Cijk_Alik_Bljk_F8NHS_STA_BH_BiasSH_HAS_SAB_SAV_UserArgs_MT64x16x512_MI16x16x1_SN_LDSB0_GRVWB16_GSU5_GSUAMBSK_GSUC0_GSUWGMRR0_K1_LBSPPB512_MIWT1_1_NLCA8_SU16_SUM0_SUS512_VWB1_WG64_4_1_WGM1_WGMXCC8_WGMXCCGn1
    SolutionIndex: 302
    SolutionNameMin: Cijk_Alik_Bljk_F8NHS_STA_BH_BiasSH_HAS_SAB_SAV_UserArgs_MT16x16x512_MI16x16x1_SN_LDSB0_GRVWB16_GSU3_GSUAMBSK_GSUC0_GSUWGMRR0_K1_LBSPPB512_MIWT1_1_NLCA8_SU16_SUM0_SUS512_VWB1_WG16_4_1_WGM1_WGMXCC8_WGMXCCGn1
    SolutionIndex: 303
    SolutionNameMin: Cijk_Alik_Bljk_F8NHS_STA_BH_BiasSH_HAS_SAB_SAV_UserArgs_MT16x16x512_MI16x16x1_SN_LDSB0_GRVWB16_GSU4_GSUAMBSK_GSUC0_GSUWGMRR0_K1_LBSPPB512_MIWT1_1_NLCA8_SU16_SUM0_SUS512_VWB1_WG16_4_1_WGM1_WGMXCC8_WGMXCCGn1
    SolutionIndex: 304
    SolutionNameMin: Cijk_Alik_Bljk_F8NHS_STA_BH_BiasSH_HAS_SAB_SAV_UserArgs_MT64x16x512_MI16x16x1_SN_LDSB0_GRVWB16_GSU3_GSUAMBSK_GSUC0_GSUWGMRR0_K1_LBSPPB512_MIWT1_1_NLCA8_SU16_SUM0_SUS512_VWB1_WG64_4_1_WGM1_WGMXCC8_WGMXCCGn1
    SolutionIndex: 305
    SolutionNameMin: Cijk_Alik_Bljk_F8NHS_STA_BH_BiasSH_HAS_SAB_SAV_UserArgs_MT64x16x512_MI16x16x1_SN_LDSB0_GRVWB16_GSU4_GSUAMBSK_GSUC0_GSUWGMRR0_K1_LBSPPB512_MIWT1_1_NLCA8_SU16_SUM0_SUS512_VWB1_WG64_4_1_WGM1_WGMXCC8_WGMXCCGn1
    SolutionIndex: 306
    SolutionNameMin: Cijk_Alik_Bljk_F8NHS_STA_BH_BiasSH_HAS_SAB_SAV_UserArgs_MT32x16x256_MI16x16x1_SN_LDSB0_GRVWB16_GSU5_GSUAMBSK_GSUC0_GSUWGMRR0_K1_LBSPPB256_MIWT1_1_NLCA4_SU16_SUM0_SUS256_VWB1_WG32_4_1_WGM1_WGMXCC8_WGMXCCGn1
    SolutionIndex: 307
    SolutionNameMin: Cijk_Alik_Bljk_F8NHS_STA_BH_BiasSH_HAS_SAB_SAV_UserArgs_MT64x16x512_MI16x16x1_SN_LDSB0_GRVWB16_GSU7_GSUAMBSK_GSUC0_GSUWGMRR0_K1_LBSPPB512_MIWT1_1_NLCA8_SU16_SUM0_SUS512_VWB1_WG64_4_1_WGM1_WGMXCC8_WGMXCCGn1
    SolutionIndex: 308
    SolutionNameMin: Cijk_Alik_Bljk_F8NHS_STA_BH_BiasSH_HAS_SAB_SAV_UserArgs_MT64x16x256_MI16x16x1_SN_LDSB0_GRVWB16_GSU6_GSUAMBSK_GSUC0_GSUWGMRR0_K1_LBSPPB256_MIWT1_1_NLCA4_SU16_SUM0_SUS256_VWB1_WG64_4_1_WGM1_WGMXCC8_WGMXCCGn1
    SolutionIndex: 309
    SolutionNameMin: Cijk_Alik_Bljk_F8NHS_STA_BH_BiasSH_HAS_SAB_SAV_UserArgs_MT64x16x256_MI16x16x1_SN_LDSB0_GRVWB16_GSU5_GSUAMBSK_GSUC0_GSUWGMRR0_K1_LBSPPB256_MIWT1_1_NLCA4_SU16_SUM0_SUS256_VWB1_WG64_4_1_WGM1_WGMXCC8_WGMXCCGn1
    SolutionIndex: 310
    SolutionNameMin: Cijk_Alik_Bljk_F8NHS_STA_BH_BiasSH_HAS_SAB_SAV_UserArgs_MT64x32x512_MI16x16x1_SN_LDSB1_GRVWB16_GSU3_GSUAMBSK_GSUC0_GSUWGMRR0_K1_LBSPPB1024_MIWT1_2_NLCA8_SU16_SUM0_SUS512_VWB2_WG64_4_1_WGM1_WGMXCC8_WGMXCCGn1
    SolutionIndex: 311
    SolutionNameMin: Cijk_Alik_Bljk_F8NHS_STA_BH_BiasSH_HAS_SAB_SAV_UserArgs_MT256x176x128_MI16x16x1_SN_LDSB0_GRVWB8_GSU1_GSUC0_GSUWGMRR0_K1_LBSPPB128_MIWT4_11_NLCA2_SU16_SUM0_SUS128_VWB1_WG64_4_1_WGM8_WGMXCC8_WGMXCCGn1
    SolutionIndex: 312
    SolutionNameMin: Cijk_Alik_Bljk_F8NHS_STA_BH_BiasSH_HAS_SAB_SAV_UserArgs_MT448x128x128_MI16x16x1_SN_LDSB0_GRVWB16_GSU1_GSUC0_GSUWGMRR0_K1_LBSPPB1024_MIWT7_8_NLCA2_SU16_SUM0_SUS128_VWB8_WG64_4_1_WGM8_WGMXCC8_WGMXCCGn1
    SolutionIndex: 313
    SolutionNameMin: Cijk_Alik_Bljk_F8NHS_STA_BH_BiasSH_HAS_SAB_SAV_UserArgs_MT192x176x128_MI16x16x1_SN_LDSB0_GRVWB8_GSU1_GSUC0_GSUWGMRR0_K1_LBSPPB128_MIWT3_11_NLCA2_SU16_SUM0_SUS128_VWB1_WG64_4_1_WGM8_WGMXCC8_WGMXCCGn1
    SolutionIndex: 314
    SolutionNameMin: Cijk_Alik_Bljk_F8NHS_STA_BH_BiasSH_HAS_SAB_SAV_UserArgs_MT320x192x128_MI16x16x1_SN_LDSB0_GRVWB16_GSU1_GSUC0_GSUWGMRR0_K1_LBSPPB512_MIWT5_12_NLCA2_SU16_SUM0_SUS128_VWB4_WG64_4_1_WGM8_WGMXCC8_WGMXCCGn1
    SolutionIndex: 315
    SolutionNameMin: Cijk_Alik_Bljk_F8NHS_STA_BH_BiasSH_HAS_SAB_SAV_UserArgs_MT384x80x128_MI16x16x1_SN_LDSB0_GRVWB8_GSU1_GSUC0_GSUWGMRR0_K1_LBSPPB128_MIWT6_5_NLCA2_SU16_SUM0_SUS128_VWB1_WG64_4_1_WGM8_WGMXCC8_WGMXCCGn1
    SolutionIndex: 316
    SolutionNameMin: Cijk_Alik_Bljk_F8NHS_STA_BH_BiasSH_HAS_SAB_SAV_UserArgs_MT256x144x128_MI16x16x1_SN_LDSB0_GRVWB8_GSU1_GSUC0_GSUWGMRR0_K1_LBSPPB128_MIWT4_9_NLCA2_SU16_SUM0_SUS128_VWB1_WG64_4_1_WGM8_WGMXCC8_WGMXCCGn1
    SolutionIndex: 317
    SolutionNameMin: Cijk_Alik_Bljk_F8NHS_STA_BH_BiasSH_HAS_SAB_SAV_UserArgs_MT64x16x512_MI16x16x1_SN_LDSB0_GRVWB16_GSU2_GSUAMBSK_GSUC0_GSUWGMRR0_K1_LBSPPB512_MIWT1_1_NLCA8_SU16_SUM0_SUS512_VWB1_WG64_4_1_WGM1_WGMXCC8_WGMXCCGn1
    SolutionIndex: 318
    SolutionNameMin: Cijk_Alik_Bljk_F8NHS_STA_BH_BiasSH_HAS_SAB_SAV_UserArgs_MT128x32x256_MI16x16x1_SN_LDSB0_GRVWB16_GSU4_GSUAMB_GSUC0_GSUWGMRR0_K1_LBSPPB512_MIWT2_2_NLCA4_SU16_SUM0_SUS256_VWB2_WG64_4_1_WGM1_WGMXCC8_WGMXCCGn1
    SolutionIndex: 319
    SolutionNameMin: Cijk_Alik_Bljk_F8NHS_STA_BH_BiasSH_HAS_SAB_SAV_UserArgs_MT128x48x256_MI16x16x1_SN_LDSB0_GRVWB16_GSU5_GSUAMB_GSUC0_GSUWGMRR0_K1_LBSPPB256_MIWT2_3_NLCA4_SU16_SUM0_SUS256_VWB1_WG64_4_1_WGM1_WGMXCC8_WGMXCCGn1
    SolutionIndex: 320
    SolutionNameMin: Cijk_Alik_Bljk_F8NHS_STA_BH_BiasSH_HAS_SAB_SAV_UserArgs_MT128x64x256_MI16x16x1_SN_LDSB1_GRVWB16_GSU6_GSUAMB_GSUC0_GSUWGMRR0_K1_LBSPPB1024_MIWT2_4_NLCA4_SU16_SUM0_SUS256_VWB4_WG64_4_1_WGM1_WGMXCC8_WGMXCCGn1
    SolutionIndex: 321
    SolutionNameMin: Cijk_Alik_Bljk_F8NHS_STA_BH_BiasSH_HAS_SAB_SAV_UserArgs_MT128x80x256_MI16x16x1_SN_LDSB1_GRVWB16_GSU6_GSUAMB_GSUC0_GSUWGMRR0_K1_LBSPPB256_MIWT2_5_NLCA4_SU16_SUM0_SUS256_VWB1_WG64_4_1_WGM1_WGMXCC8_WGMXCCGn1
    SolutionIndex: 322
    SolutionNameMin: Cijk_Alik_Bljk_F8NHS_STA_BH_BiasSH_HAS_SAB_SAV_UserArgs_MT128x96x256_MI16x16x1_SN_LDSB1_GRVWB16_GSU5_GSUAMB_GSUC0_GSUWGMRR0_K1_LBSPPB512_MIWT2_6_NLCA4_SU16_SUM0_SUS256_VWB2_WG64_4_1_WGM1_WGMXCC8_WGMXCCGn1
    SolutionIndex: 323
    SolutionNameMin: Cijk_Alik_Bljk_F8NHS_STA_BH_BiasSH_HAS_SAB_SAV_UserArgs_MT128x112x256_MI16x16x1_SN_LDSB1_GRVWB16_GSU5_GSUAMB_GSUC0_GSUWGMRR0_K1_LBSPPB256_MIWT2_7_NLCA4_SU16_SUM0_SUS256_VWB1_WG64_4_1_WGM1_WGMXCC8_WGMXCCGn1
    SolutionIndex: 324
    SolutionNameMin: Cijk_Alik_Bljk_F8NHS_STA_BH_BiasSH_HAS_SAB_SAV_UserArgs_MT128x128x128_MI16x16x1_SN_LDSB1_GRVWB16_GSU5_GSUAMB_GSUC0_GSUWGMRR0_K1_LBSPPB1024_MIWT2_8_NLCA2_SU16_SUM0_SUS128_VWB8_WG64_4_1_WGM1_WGMXCC8_WGMXCCGn1
    SolutionIndex: 325
    SolutionNameMin: Cijk_Alik_Bljk_F8NHS_STA_BH_BiasSH_HAS_SAB_SAV_UserArgs_MT128x144x128_MI16x16x1_SN_LDSB1_GRVWB8_GSU6_GSUAMB_GSUC0_GSUWGMRR0_K1_LBSPPB128_MIWT2_9_NLCA2_SU16_SUM0_SUS128_VWB1_WG64_4_1_WGM1_WGMXCC8_WGMXCCGn1
    SolutionIndex: 326
    SolutionNameMin: Cijk_Alik_Bljk_F8NHS_STA_BH_BiasSH_HAS_SAB_SAV_UserArgs_MT128x160x128_MI16x16x1_SN_LDSB1_GRVWB16_GSU6_GSUAMB_GSUC0_GSUWGMRR0_K1_LBSPPB256_MIWT2_10_NLCA2_SU16_SUM0_SUS128_VWB2_WG64_4_1_WGM1_WGMXCC8_WGMXCCGn1
    SolutionIndex: 327
    SolutionNameMin: Cijk_Alik_Bljk_F8NHS_STA_BH_BiasSH_HAS_SAB_SAV_UserArgs_MT128x176x128_MI16x16x1_SN_LDSB1_GRVWB8_GSU6_GSUAMB_GSUC0_GSUWGMRR0_K1_LBSPPB128_MIWT2_11_NLCA2_SU16_SUM0_SUS128_VWB1_WG64_4_1_WGM1_WGMXCC8_WGMXCCGn1
    SolutionIndex: 328
    SolutionNameMin: Cijk_Alik_Bljk_F8NHS_STA_BH_BiasSH_HAS_SAB_SAV_UserArgs_MT128x192x128_MI16x16x1_SN_LDSB1_GRVWB16_GSU5_GSUAMB_GSUC0_GSUWGMRR0_K1_LBSPPB512_MIWT2_12_NLCA2_SU16_SUM0_SUS128_VWB4_WG64_4_1_WGM1_WGMXCC8_WGMXCCGn1
    SolutionIndex: 329
    SolutionNameMin: Cijk_Alik_Bljk_F8NHS_STA_BH_BiasSH_HAS_SAB_SAV_UserArgs_MT128x224x128_MI16x16x1_SN_LDSB1_GRVWB16_GSU6_GSUAMB_GSUC0_GSUWGMRR0_K1_LBSPPB256_MIWT2_14_NLCA2_SU16_SUM0_SUS128_VWB2_WG64_4_1_WGM1_WGMXCC8_WGMXCCGn1
    SolutionIndex: 330
    SolutionNameMin: Cijk_Alik_Bljk_F8NHS_STA_BH_BiasSH_HAS_SAB_SAV_UserArgs_MT128x128x128_MI16x16x1_SN_LDSB1_GRVWB16_GSU4_GSUAMB_GSUC0_GSUWGMRR0_K1_LBSPPB1024_MIWT2_8_NLCA2_SU16_SUM0_SUS128_VWB8_WG64_4_1_WGM1_WGMXCC8_WGMXCCGn1
    SolutionIndex: 331
    SolutionNameMin: Cijk_Alik_Bljk_F8NHS_STA_BH_BiasSH_HAS_SAB_SAV_UserArgs_MT192x96x128_MI16x16x1_SN_LDSB0_GRVWB16_GSU3_GSUAMB_GSUC0_GSUWGMRR0_K1_LBSPPB256_MIWT3_6_NLCA2_SU16_SUM0_SUS128_VWB2_WG64_4_1_WGM1_WGMXCC8_WGMXCCGn1
    SolutionIndex: 332
    SolutionNameMin: Cijk_Alik_Bljk_F8NHS_STA_BH_BiasSH_HAS_SAB_SAV_UserArgs_MT192x144x128_MI16x16x1_SN_LDSB1_GRVWB8_GSU5_GSUAMB_GSUC0_GSUWGMRR0_K1_LBSPPB128_MIWT3_9_NLCA2_SU16_SUM0_SUS128_VWB1_WG64_4_1_WGM1_WGMXCC8_WGMXCCGn1
    SolutionIndex: 333
    SolutionNameMin: Cijk_Alik_Bljk_F8NHS_STA_BH_BiasSH_HAS_SAB_SAV_UserArgs_MT128x160x128_MI16x16x1_SN_LDSB1_GRVWB16_GSU4_GSUAMB_GSUC0_GSUWGMRR0_K1_LBSPPB256_MIWT2_10_NLCA2_SU16_SUM0_SUS128_VWB2_WG64_4_1_WGM1_WGMXCC8_WGMXCCGn1
    SolutionIndex: 334
    SolutionNameMin: Cijk_Alik_Bljk_F8NHS_STA_BH_BiasSH_HAS_SAB_SAV_UserArgs_MT128x112x256_MI16x16x1_SN_LDSB1_GRVWB16_GSU2_GSUAMB_GSUC0_GSUWGMRR0_K1_LBSPPB256_MIWT2_7_NLCA4_SU16_SUM0_SUS256_VWB1_WG64_4_1_WGM1_WGMXCC8_WGMXCCGn1
    SolutionIndex: 335
    SolutionNameMin: Cijk_Alik_Bljk_F8NHS_STA_BH_BiasSH_HAS_SAB_SAV_UserArgs_MT128x176x128_MI16x16x1_SN_LDSB1_GRVWB8_GSU4_GSUAMB_GSUC0_GSUWGMRR0_K1_LBSPPB128_MIWT2_11_NLCA2_SU16_SUM0_SUS128_VWB1_WG64_4_1_WGM1_WGMXCC8_WGMXCCGn1
    SolutionIndex: 336
    SolutionNameMin: Cijk_Alik_Bljk_F8NHS_STA_BH_BiasSH_HAS_SAB_SAV_UserArgs_MT192x128x128_MI16x16x1_SN_LDSB1_GRVWB16_GSU3_GSUAMB_GSUC0_GSUWGMRR0_K1_LBSPPB1024_MIWT3_8_NLCA2_SU16_SUM0_SUS128_VWB8_WG64_4_1_WGM1_WGMXCC8_WGMXCCGn1
    SolutionIndex: 337
    SolutionNameMin: Cijk_Alik_Bljk_F8NHS_STA_BH_BiasSH_HAS_SAB_SAV_UserArgs_MT192x128x128_MI16x16x1_SN_LDSB1_GRVWB16_GSU4_GSUAMB_GSUC0_GSUWGMRR0_K1_LBSPPB1024_MIWT3_8_NLCA2_SU16_SUM0_SUS128_VWB8_WG64_4_1_WGM1_WGMXCC8_WGMXCCGn1
    SolutionIndex: 338
    SolutionNameMin: Cijk_Alik_Bljk_F8NHS_STA_BH_BiasSH_HAS_SAB_SAV_UserArgs_MT128x224x128_MI16x16x1_SN_LDSB1_GRVWB16_GSU4_GSUAMB_GSUC0_GSUWGMRR0_K1_LBSPPB256_MIWT2_14_NLCA2_SU16_SUM0_SUS128_VWB2_WG64_4_1_WGM1_WGMXCC8_WGMXCCGn1
    SolutionIndex: 339
    SolutionNameMin: Cijk_Alik_Bljk_F8NHS_STA_BH_BiasSH_HAS_SAB_SAV_UserArgs_MT256x160x128_MI16x16x1_SN_LDSB0_GRVWB16_GSU4_GSUAMB_GSUC0_GSUWGMRR0_K1_LBSPPB256_MIWT4_10_NLCA2_SU16_SUM0_SUS128_VWB2_WG64_4_1_WGM1_WGMXCC8_WGMXCCGn1
    SolutionIndex: 340
    SolutionNameMin: Cijk_Alik_Bljk_F8NHS_STA_BH_BiasSH_HAS_SAB_SAV_UserArgs_MT256x128x128_MI16x16x1_SN_LDSB1_GRVWB16_GSU3_GSUAMB_GSUC0_GSUWGMRR0_K1_LBSPPB1024_MIWT4_8_NLCA2_SU16_SUM0_SUS128_VWB8_WG64_4_1_WGM1_WGMXCC8_WGMXCCGn1
    SolutionIndex: 341
    SolutionNameMin: Cijk_Alik_Bljk_F8NHS_STA_BH_BiasSH_HAS_SAB_SAV_UserArgs_MT256x96x128_MI16x16x1_SN_LDSB0_GRVWB16_GSU1_GSUC0_GSUWGMRR0_K1_LBSPPB256_MIWT4_6_NLCA2_SU16_SUM0_SUS128_VWB2_WG64_4_1_WGM8_WGMXCC8_WGMXCCGn1
    SolutionIndex: 342
    SolutionNameMin: Cijk_Alik_Bljk_F8NHS_STA_BH_BiasSH_HAS_SAB_SAV_UserArgs_MT64x16x512_MI16x16x1_SN_LDSB0_GRVWB16_GSU1_GSUC0_GSUWGMRR0_K1_LBSPPB512_MIWT1_1_NLCA8_SU16_SUM0_SUS512_VWB1_WG64_4_1_WGM8_WGMXCC8_WGMXCCGn1
    SolutionIndex: 343
    SolutionNameMin: Cijk_Alik_Bljk_F8NHS_STA_BH_BiasSH_HAS_SAB_SAV_UserArgs_MT32x16x256_MI16x16x1_SN_LDSB0_GRVWB16_GSU1_GSUC0_GSUWGMRR0_K1_LBSPPB256_MIWT1_1_NLCA4_SU16_SUM0_SUS256_VWB1_WG32_4_1_WGM8_WGMXCC8_WGMXCCGn1
    SolutionIndex: 344
    SolutionNameMin: Cijk_Alik_Bljk_F8NHS_STA_BH_BiasSH_HAS_SAB_SAV_UserArgs_MT128x16x512_MI16x16x1_SN_LDSB0_GRVWB16_GSU1_GSUC0_GSUWGMRR0_K1_LBSPPB512_MIWT2_1_NLCA8_SU16_SUM0_SUS512_VWB1_WG64_4_1_WGM8_WGMXCC8_WGMXCCGn1
    SolutionIndex: 345
    SolutionNameMin: Cijk_Alik_Bljk_F8NHS_STA_BH_BiasSH_HAS_SAB_SAV_UserArgs_MT64x16x256_MI16x16x1_SN_LDSB0_GRVWB16_GSU1_GSUC0_GSUWGMRR0_K1_LBSPPB256_MIWT1_1_NLCA4_SU16_SUM0_SUS256_VWB1_WG64_4_1_WGM8_WGMXCC8_WGMXCCGn1
    SolutionIndex: 346
    SolutionNameMin: Cijk_Alik_Bljk_F8NHS_STA_BH_BiasSH_HAS_SAB_SAV_UserArgs_MT64x32x256_MI16x16x1_SN_LDSB0_GRVWB16_GSU1_GSUC0_GSUWGMRR0_K1_LBSPPB512_MIWT1_2_NLCA4_SU16_SUM0_SUS256_VWB2_WG64_4_1_WGM8_WGMXCC8_WGMXCCGn1
    SolutionIndex: 347
    SolutionNameMin: Cijk_Alik_Bljk_F8NHS_STA_BH_BiasSH_HAS_SAB_SAV_UserArgs_MT192x112x128_MI16x16x1_SN_LDSB1_GRVWB8_GSU1_GSUC0_GSUWGMRR0_K1_LBSPPB128_MIWT3_7_NLCA2_SU16_SUM0_SUS128_VWB1_WG64_4_1_WGM8_WGMXCC8_WGMXCCGn1
    SolutionIndex: 348
    SolutionNameMin: Cijk_Alik_Bljk_F8NHS_STA_BH_BiasSH_HAS_SAB_SAV_UserArgs_MT128x128x128_MI16x16x1_SN_LDSB1_GRVWB16_GSU1_GSUC0_GSUWGMRR0_K1_LBSPPB1024_MIWT2_8_NLCA2_SU16_SUM0_SUS128_VWB8_WG64_4_1_WGM8_WGMXCC8_WGMXCCGn1
    SolutionIndex: 349
    SolutionNameMin: Cijk_Alik_Bljk_F8NHS_STA_BH_BiasSH_HAS_SAB_SAV_UserArgs_MT256x192x128_MI16x16x1_SN_LDSB0_GRVWB16_GSU1_GSUC0_GSUWGMRR0_K1_LBSPPB512_MIWT4_12_NLCA2_SU16_SUM0_SUS128_VWB4_WG64_4_1_WGM8_WGMXCC8_WGMXCCGn1
    SolutionIndex: 350
    SolutionNameMin: Cijk_Alik_Bljk_F8NHS_STA_BH_BiasSH_HAS_SAB_SAV_UserArgs_MT256x128x128_MI16x16x1_SN_LDSB1_GRVWB16_GSU1_GSUAMB_GSUC0_GSUWGMRR0_K1_LBSPPB1024_MIWT4_8_NLCA2_SU16_SUM0_SUS128_VWB8_WG64_4_1_WGM1_WGMXCC8_WGMXCCGn1
    SolutionIndex: 351
    SolutionNameMin: Cijk_Alik_Bljk_F8NHS_STA_BH_BiasSH_HAS_SAB_SAV_UserArgs_MT64x16x256_MI16x16x1_SN_LDSB0_GRVWB16_GSU1_GSUAMB_GSUC0_GSUWGMRR0_K1_LBSPPB256_MIWT1_1_NLCA4_SU16_SUM0_SUS256_VWB1_WG64_4_1_WGM1_WGMXCC8_WGMXCCGn1
    SolutionIndex: 352
    SolutionNameMin: Cijk_Alik_Bljk_F8NHS_STA_BH_BiasSH_HAS_SAB_SAV_UserArgs_MT64x16x256_MI16x16x1_SN_LDSB0_GRVWB16_GSU1_GSUAMBSK_GSUC0_GSUWGMRR0_K1_LBSPPB256_MIWT1_1_NLCA4_SU16_SUM0_SUS256_VWB1_WG64_4_1_WGM1_WGMXCC8_WGMXCCGn1
    SolutionIndex: 353
    SolutionNameMin: Cijk_Alik_Bljk_F8NHS_STA_BH_BiasSH_HAS_SAB_SAV_UserArgs_MT64x16x512_MI16x16x1_SN_LDSB0_GRVWB16_GSU1_GSUAMB_GSUC0_GSUWGMRR0_K1_LBSPPB512_MIWT1_1_NLCA8_SU16_SUM0_SUS512_VWB1_WG64_4_1_WGM1_WGMXCC8_WGMXCCGn1
    SolutionIndex: 354
    SolutionNameMin: Cijk_Alik_Bljk_F8NHS_STA_BH_BiasSH_HAS_SAB_SAV_UserArgs_MT32x16x256_MI16x16x1_SN_LDSB0_GRVWB16_GSU1_GSUAMB_GSUC0_GSUWGMRR0_K1_LBSPPB256_MIWT1_1_NLCA4_SU16_SUM0_SUS256_VWB1_WG32_4_1_WGM1_WGMXCC8_WGMXCCGn1
    SolutionIndex: 355
    SolutionNameMin: Cijk_Alik_Bljk_F8NHS_STA_BH_BiasSH_HAS_SAB_SAV_UserArgs_MT64x32x512_MI16x16x1_SN_LDSB1_GRVWB16_GSU1_GSUAMB_GSUC0_GSUWGMRR0_K1_LBSPPB1024_MIWT1_2_NLCA8_SU16_SUM0_SUS512_VWB2_WG64_4_1_WGM1_WGMXCC8_WGMXCCGn1
    SolutionIndex: 356
    SolutionNameMin: Cijk_Alik_Bljk_F8NHS_STA_BH_BiasSH_HAS_SAB_SAV_UserArgs_MT320x160x128_MI16x16x1_SN_LDSB0_GRVWB16_GSU1_GSUC0_GSUWGMRR0_K1_LBSPPB256_MIWT5_10_NLCA2_SU16_SUM0_SUS128_VWB2_WG64_4_1_WGM8_WGMXCC8_WGMXCCGn1
    SolutionIndex: 357
    SolutionNameMin: Cijk_Alik_Bljk_F8NHS_STA_BH_BiasSH_HAS_SAB_SAV_UserArgs_MT128x160x128_MI16x16x1_SN_LDSB1_GRVWB16_GSU1_GSUC0_GSUWGMRR0_K1_LBSPPB256_MIWT2_10_NLCA2_SU16_SUM0_SUS128_VWB2_WG64_4_1_WGM8_WGMXCC8_WGMXCCGn1
    SolutionIndex: 358
    SolutionNameMin: Cijk_Alik_Bljk_F8NHS_STA_BH_BiasSH_HAS_SAB_SAV_UserArgs_MT448x96x128_MI16x16x1_SN_LDSB0_GRVWB16_GSU1_GSUC0_GSUWGMRR0_K1_LBSPPB256_MIWT7_6_NLCA2_SU16_SUM0_SUS128_VWB2_WG64_4_1_WGM8_WGMXCC8_WGMXCCGn1
    SolutionIndex: 359
    SolutionNameMin: Cijk_Alik_Bljk_F8NHS_STA_BH_BiasSH_HAS_SAB_SAV_UserArgs_MT512x96x128_MI16x16x1_SN_LDSB0_GRVWB16_GSU1_GSUC0_GSUWGMRR0_K1_LBSPPB256_MIWT8_6_NLCA2_SU16_SUM0_SUS128_VWB2_WG64_4_1_WGM8_WGMXCC8_WGMXCCGn1
    SolutionIndex: 360
    SolutionNameMin: Cijk_Alik_Bljk_F8NHS_STA_BH_BiasSH_HAS_SAB_SAV_UserArgs_MT128x16x256_MI16x16x1_SN_LDSB0_GRVWB16_GSU1_GSUAMB_GSUC0_GSUWGMRR0_K1_LBSPPB256_MIWT2_1_NLCA4_SU16_SUM0_SUS256_VWB1_WG64_4_1_WGM1_WGMXCC8_WGMXCCGn1
    SolutionIndex: 361
    SolutionNameMin: Cijk_Alik_Bljk_F8NHS_STA_BH_BiasSH_HAS_SAB_SAV_UserArgs_MT128x32x256_MI16x16x1_SN_LDSB0_GRVWB16_GSU1_GSUAMB_GSUC0_GSUWGMRR0_K1_LBSPPB512_MIWT2_2_NLCA4_SU16_SUM0_SUS256_VWB2_WG64_4_1_WGM1_WGMXCC8_WGMXCCGn1
    SolutionIndex: 362
    SolutionNameMin: Cijk_Alik_Bljk_F8NHS_STA_BH_BiasSH_HAS_SAB_SAV_UserArgs_MT64x48x256_MI16x16x1_SN_LDSB0_GRVWB16_GSU1_GSUAMB_GSUC0_GSUWGMRR0_K1_LBSPPB256_MIWT1_3_NLCA4_SU16_SUM0_SUS256_VWB1_WG64_4_1_WGM1_WGMXCC8_WGMXCCGn1
    SolutionIndex: 363
    SolutionNameMin: Cijk_Alik_Bljk_F8NHS_STA_BH_BiasSH_HAS_SAB_SAV_UserArgs_MT128x64x256_MI16x16x1_SN_LDSB1_GRVWB16_GSU1_GSUAMB_GSUC0_GSUWGMRR0_K1_LBSPPB1024_MIWT2_4_NLCA4_SU16_SUM0_SUS256_VWB4_WG64_4_1_WGM1_WGMXCC8_WGMXCCGn1
    SolutionIndex: 364
    SolutionNameMin: Cijk_Alik_Bljk_F8NHS_STA_BH_BiasSH_HAS_SAB_SAV_UserArgs_MT128x80x256_MI16x16x1_SN_LDSB1_GRVWB16_GSU1_GSUAMB_GSUC0_GSUWGMRR0_K1_LBSPPB256_MIWT2_5_NLCA4_SU16_SUM0_SUS256_VWB1_WG64_4_1_WGM1_WGMXCC8_WGMXCCGn1
    SolutionIndex: 365
    SolutionNameMin: Cijk_Alik_Bljk_F8NHS_STA_BH_BiasSH_HAS_SAB_SAV_UserArgs_MT128x96x256_MI16x16x1_SN_LDSB1_GRVWB16_GSU1_GSUAMB_GSUC0_GSUWGMRR0_K1_LBSPPB512_MIWT2_6_NLCA4_SU16_SUM0_SUS256_VWB2_WG64_4_1_WGM1_WGMXCC8_WGMXCCGn1
    SolutionIndex: 366
    SolutionNameMin: Cijk_Alik_Bljk_F8NHS_STA_BH_BiasSH_HAS_SAB_SAV_UserArgs_MT128x112x256_MI16x16x1_SN_LDSB1_GRVWB16_GSU1_GSUAMB_GSUC0_GSUWGMRR0_K1_LBSPPB256_MIWT2_7_NLCA4_SU16_SUM0_SUS256_VWB1_WG64_4_1_WGM1_WGMXCC8_WGMXCCGn1
    SolutionIndex: 367
    SolutionNameMin: Cijk_Alik_Bljk_F8NHS_STA_BH_BiasSH_HAS_SAB_SAV_UserArgs_MT64x128x128_MI16x16x1_SN_LDSB1_GRVWB16_GSU1_GSUAMB_GSUC0_GSUWGMRR0_K1_LBSPPB1024_MIWT1_8_NLCA2_SU16_SUM0_SUS128_VWB8_WG64_4_1_WGM1_WGMXCC8_WGMXCCGn1
    SolutionIndex: 368
    SolutionNameMin: Cijk_Alik_Bljk_F8NHS_STA_BH_BiasSH_HAS_SAB_SAV_UserArgs_MT64x144x256_MI16x16x1_SN_LDSB1_GRVWB16_GSU1_GSUAMB_GSUC0_GSUWGMRR0_K1_LBSPPB256_MIWT1_9_NLCA4_SU16_SUM0_SUS256_VWB1_WG64_4_1_WGM1_WGMXCC8_WGMXCCGn1
    SolutionIndex: 369
    SolutionNameMin: Cijk_Alik_Bljk_F8NHS_STA_BH_BiasSH_HAS_SAB_SAV_UserArgs_MT128x96x128_MI16x16x1_SN_LDSB0_GRVWB16_GSU1_GSUAMB_GSUC0_GSUWGMRR0_K1_LBSPPB256_MIWT2_6_NLCA2_SU16_SUM0_SUS128_VWB2_WG64_4_1_WGM1_WGMXCC8_WGMXCCGn1
    SolutionIndex: 370
    SolutionNameMin: Cijk_Alik_Bljk_F8NHS_STA_BH_BiasSH_HAS_SAB_SAV_UserArgs_MT128x128x128_MI16x16x1_SN_LDSB1_GRVWB16_GSU1_GSUAMB_GSUC0_GSUWGMRR0_K1_LBSPPB1024_MIWT2_8_NLCA2_SU16_SUM0_SUS128_VWB8_WG64_4_1_WGM1_WGMXCC8_WGMXCCGn1
    SolutionIndex: 371
    SolutionNameMin: Cijk_Alik_Bljk_F8NHS_STA_BH_BiasSH_HAS_SAB_SAV_UserArgs_MT128x144x128_MI16x16x1_SN_LDSB1_GRVWB8_GSU1_GSUAMB_GSUC0_GSUWGMRR0_K1_LBSPPB128_MIWT2_9_NLCA2_SU16_SUM0_SUS128_VWB1_WG64_4_1_WGM1_WGMXCC8_WGMXCCGn1
    SolutionIndex: 372
    SolutionNameMin: Cijk_Alik_Bljk_F8NHS_STA_BH_BiasSH_HAS_SAB_SAV_UserArgs_MT192x96x256_MI16x16x1_SN_LDSB1_GRVWB16_GSU1_GSUAMB_GSUC0_GSUWGMRR0_K1_LBSPPB512_MIWT3_6_NLCA4_SU16_SUM0_SUS256_VWB2_WG64_4_1_WGM1_WGMXCC8_WGMXCCGn1
    SolutionIndex: 373
    SolutionNameMin: Cijk_Alik_Bljk_F8NHS_STA_BH_BiasSH_HAS_SAB_SAV_UserArgs_MT128x160x128_MI16x16x1_SN_LDSB1_GRVWB16_GSU1_GSUAMB_GSUC0_GSUWGMRR0_K1_LBSPPB256_MIWT2_10_NLCA2_SU16_SUM0_SUS128_VWB2_WG64_4_1_WGM1_WGMXCC8_WGMXCCGn1
    SolutionIndex: 374
    SolutionNameMin: Cijk_Alik_Bljk_F8NHS_STA_BH_BiasSH_HAS_SAB_SAV_UserArgs_MT192x112x128_MI16x16x1_SN_LDSB1_GRVWB8_GSU1_GSUAMB_GSUC0_GSUWGMRR0_K1_LBSPPB128_MIWT3_7_NLCA2_SU16_SUM0_SUS128_VWB1_WG64_4_1_WGM1_WGMXCC8_WGMXCCGn1
    SolutionIndex: 375
    SolutionNameMin: Cijk_Alik_Bljk_F8NHS_STA_BH_BiasSH_HAS_SAB_SAV_UserArgs_MT128x192x128_MI16x16x1_SN_LDSB1_GRVWB16_GSU1_GSUAMB_GSUC0_GSUWGMRR0_K1_LBSPPB512_MIWT2_12_NLCA2_SU16_SUM0_SUS128_VWB4_WG64_4_1_WGM1_WGMXCC8_WGMXCCGn1
    SolutionIndex: 376
    SolutionNameMin: Cijk_Alik_Bljk_F8NHS_STA_BH_BiasSH_HAS_SAB_SAV_UserArgs_MT192x128x128_MI16x16x1_SN_LDSB1_GRVWB16_GSU1_GSUAMB_GSUC0_GSUWGMRR0_K1_LBSPPB1024_MIWT3_8_NLCA2_SU16_SUM0_SUS128_VWB8_WG64_4_1_WGM1_WGMXCC8_WGMXCCGn1
    SolutionIndex: 377
    SolutionNameMin: Cijk_Alik_Bljk_F8NHS_STA_BH_BiasSH_HAS_SAB_SAV_UserArgs_MT192x160x128_MI16x16x1_SN_LDSB1_GRVWB16_GSU1_GSUAMB_GSUC0_GSUWGMRR0_K1_LBSPPB256_MIWT3_10_NLCA2_SU16_SUM0_SUS128_VWB2_WG64_4_1_WGM1_WGMXCC8_WGMXCCGn1
    SolutionIndex: 378
    SolutionNameMin: Cijk_Alik_Bljk_F8NHS_STA_BH_BiasSH_HAS_SAB_SAV_UserArgs_MT192x144x128_MI16x16x1_SN_LDSB1_GRVWB8_GSU1_GSUAMB_GSUC0_GSUWGMRR0_K1_LBSPPB128_MIWT3_9_NLCA2_SU16_SUM0_SUS128_VWB1_WG64_4_1_WGM1_WGMXCC8_WGMXCCGn1
    SolutionIndex: 379
    SolutionNameMin: Cijk_Alik_Bljk_F8NHS_STA_BH_BiasSH_HAS_SAB_SAV_UserArgs_MT256x240x128_MI16x16x1_SN_LDSB1_GRVWB8_GSU1_GSUC0_GSUWGMRR0_K1_LBSPPB128_MIWT4_15_NLCA2_SU16_SUM0_SUS128_VWB1_WG64_4_1_WGM8_WGMXCC8_WGMXCCGn1
    SolutionIndex: 380
    SolutionNameMin: Cijk_Alik_Bljk_F8NHS_STA_BH_BiasSH_HAS_SAB_SAV_UserArgs_MT512x112x128_MI16x16x1_SN_LDSB0_GRVWB8_GSU1_GSUC0_GSUWGMRR0_K1_LBSPPB128_MIWT8_7_NLCA2_SU16_SUM0_SUS128_VWB1_WG64_4_1_WGM8_WGMXCC8_WGMXCCGn1
    SolutionIndex: 381
    SolutionNameMin: Cijk_Alik_Bljk_F8NHS_STA_BH_BiasSH_HAS_SAB_SAV_UserArgs_MT448x144x128_MI16x16x1_SN_LDSB0_GRVWB8_GSU1_GSUC0_GSUWGMRR0_K1_LBSPPB128_MIWT7_9_NLCA2_SU16_SUM0_SUS128_VWB1_WG64_4_1_WGM8_WGMXCC8_WGMXCCGn1
    SolutionIndex: 382
    SolutionNameMin: Cijk_Alik_Bljk_F8NHS_STA_BH_BiasSH_HAS_SAB_SAV_UserArgs_MT320x176x128_MI16x16x1_SN_LDSB0_GRVWB8_GSU1_GSUC0_GSUWGMRR0_K1_LBSPPB128_MIWT5_11_NLCA2_SU16_SUM0_SUS128_VWB1_WG64_4_1_WGM8_WGMXCC8_WGMXCCGn1
    SolutionIndex: 383
    SolutionNameMin: Cijk_Alik_Bljk_F8NHS_STA_BH_BiasSH_HAS_SAB_SAV_UserArgs_MT320x96x128_MI16x16x1_SN_LDSB0_GRVWB16_GSU1_GSUC0_GSUWGMRR0_K1_LBSPPB256_MIWT5_6_NLCA2_SU16_SUM0_SUS128_VWB2_WG64_4_1_WGM8_WGMXCC8_WGMXCCGn1
    SolutionIndex: 384
    SolutionNameMin: Cijk_Alik_Bljk_F8NHS_STA_BH_BiasSH_HAS_SAB_SAV_UserArgs_MT128x16x256_MI16x16x1_SN_LDSB0_GRVWB16_GSU1_GSUC0_GSUWGMRR0_K1_LBSPPB256_MIWT2_1_NLCA4_SU16_SUM0_SUS256_VWB1_WG64_4_1_WGM8_WGMXCC8_WGMXCCGn1
    SolutionIndex: 385
    SolutionNameMin: Cijk_Alik_Bljk_F8NHS_STA_BH_BiasSH_HAS_SAB_SAV_UserArgs_MT384x112x128_MI16x16x1_SN_LDSB0_GRVWB8_GSU1_GSUC0_GSUWGMRR0_K1_LBSPPB128_MIWT6_7_NLCA2_SU16_SUM0_SUS128_VWB1_WG64_4_1_WGM8_WGMXCC8_WGMXCCGn1
    SolutionIndex: 386
    SolutionNameMin: Cijk_Alik_Bljk_F8NHS_STA_BH_BiasSH_HAS_SAB_SAV_UserArgs_MT448x112x128_MI16x16x1_SN_LDSB0_GRVWB8_GSU1_GSUC0_GSUWGMRR0_K1_LBSPPB128_MIWT7_7_NLCA2_SU16_SUM0_SUS128_VWB1_WG64_4_1_WGM8_WGMXCC8_WGMXCCGn1
    SolutionIndex: 387
    SolutionNameMin: Cijk_Alik_Bljk_F8NHS_STA_BH_BiasSH_HAS_SAB_SAV_UserArgs_MT192x272x128_MI16x16x1_SN_LDSB1_GRVWB8_GSU1_GSUC0_GSUWGMRR0_K1_LBSPPB128_MIWT3_17_NLCA2_SU16_SUM0_SUS128_VWB1_WG64_4_1_WGM8_WGMXCC8_WGMXCCGn1
    SolutionIndex: 388
    SolutionNameMin: Cijk_Alik_Bljk_F8NHS_STA_BH_BiasSH_HAS_SAB_SAV_UserArgs_MT128x48x256_MI16x16x1_SN_LDSB0_GRVWB16_GSU1_GSUC0_GSUWGMRR0_K1_LBSPPB256_MIWT2_3_NLCA4_SU16_SUM0_SUS256_VWB1_WG64_4_1_WGM8_WGMXCC8_WGMXCCGn1
    SolutionIndex: 389
    SolutionNameMin: Cijk_Alik_Bljk_F8NHS_STA_BH_BiasSH_HAS_SAB_SAV_UserArgs_MT128x64x256_MI16x16x1_SN_LDSB1_GRVWB16_GSU1_GSUC0_GSUWGMRR0_K1_LBSPPB1024_MIWT2_4_NLCA4_SU16_SUM0_SUS256_VWB4_WG64_4_1_WGM8_WGMXCC8_WGMXCCGn1
    SolutionIndex: 390
    SolutionNameMin: Cijk_Alik_Bljk_F8NHS_STA_BH_BiasSH_HAS_SAB_SAV_UserArgs_MT128x80x256_MI16x16x1_SN_LDSB1_GRVWB16_GSU1_GSUC0_GSUWGMRR0_K1_LBSPPB256_MIWT2_5_NLCA4_SU16_SUM0_SUS256_VWB1_WG64_4_1_WGM8_WGMXCC8_WGMXCCGn1
    SolutionIndex: 391
    SolutionNameMin: Cijk_Alik_Bljk_F8NHS_STA_BH_BiasSH_HAS_SAB_SAV_UserArgs_MT192x48x256_MI16x16x1_SN_LDSB0_GRVWB16_GSU1_GSUC0_GSUWGMRR0_K1_LBSPPB256_MIWT3_3_NLCA4_SU16_SUM0_SUS256_VWB1_WG64_4_1_WGM8_WGMXCC8_WGMXCCGn1
    SolutionIndex: 392
    SolutionNameMin: Cijk_Alik_Bljk_F8NHS_STA_BH_BiasSH_HAS_SAB_SAV_UserArgs_MT192x64x256_MI16x16x1_SN_LDSB1_GRVWB16_GSU1_GSUC0_GSUWGMRR0_K1_LBSPPB1024_MIWT3_4_NLCA4_SU16_SUM0_SUS256_VWB4_WG64_4_1_WGM8_WGMXCC8_WGMXCCGn1
    SolutionIndex: 393
    SolutionNameMin: Cijk_Alik_Bljk_F8NHS_STA_BH_BiasSH_HAS_SAB_SAV_UserArgs_MT256x48x256_MI16x16x1_SN_LDSB0_GRVWB16_GSU1_GSUC0_GSUWGMRR0_K1_LBSPPB256_MIWT4_3_NLCA4_SU16_SUM0_SUS256_VWB1_WG64_4_1_WGM8_WGMXCC8_WGMXCCGn1
    SolutionIndex: 394
    SolutionNameMin: Cijk_Alik_Bljk_F8NHS_STA_BH_BiasSH_HAS_SAB_SAV_UserArgs_MT128x112x256_MI16x16x1_SN_LDSB1_GRVWB16_GSU1_GSUC0_GSUWGMRR0_K1_LBSPPB256_MIWT2_7_NLCA4_SU16_SUM0_SUS256_VWB1_WG64_4_1_WGM8_WGMXCC8_WGMXCCGn1
    SolutionIndex: 395
    SolutionNameMin: Cijk_Alik_Bljk_F8NHS_STA_BH_BiasSH_HAS_SAB_SAV_UserArgs_MT192x80x256_MI16x16x1_SN_LDSB1_GRVWB16_GSU1_GSUC0_GSUWGMRR0_K1_LBSPPB256_MIWT3_5_NLCA4_SU16_SUM0_SUS256_VWB1_WG64_4_1_WGM8_WGMXCC8_WGMXCCGn1
    SolutionIndex: 396
    SolutionNameMin: Cijk_Alik_Bljk_F8NHS_STA_BH_BiasSH_HAS_SAB_SAV_UserArgs_MT256x64x256_MI16x16x1_SN_LDSB1_GRVWB16_GSU1_GSUC0_GSUWGMRR0_K1_LBSPPB1024_MIWT4_4_NLCA4_SU16_SUM0_SUS256_VWB4_WG64_4_1_WGM8_WGMXCC8_WGMXCCGn1
    SolutionIndex: 397
    SolutionNameMin: Cijk_Alik_Bljk_F8NHS_STA_BH_BiasSH_HAS_SAB_SAV_UserArgs_MT192x96x256_MI16x16x1_SN_LDSB1_GRVWB16_GSU1_GSUC0_GSUWGMRR0_K1_LBSPPB512_MIWT3_6_NLCA4_SU16_SUM0_SUS256_VWB2_WG64_4_1_WGM8_WGMXCC8_WGMXCCGn1
    SolutionIndex: 398
    SolutionNameMin: Cijk_Alik_Bljk_F8NHS_STA_BH_BiasSH_HAS_SAB_SAV_UserArgs_MT320x80x128_MI16x16x1_SN_LDSB0_GRVWB8_GSU1_GSUC0_GSUWGMRR0_K1_LBSPPB128_MIWT5_5_NLCA2_SU16_SUM0_SUS128_VWB1_WG64_4_1_WGM8_WGMXCC8_WGMXCCGn1
    SolutionIndex: 399
    SolutionNameMin: Cijk_Alik_Bljk_F8NHS_STA_BH_BiasSH_HAS_SAB_SAV_UserArgs_MT384x64x128_MI16x16x1_SN_LDSB0_GRVWB16_GSU1_GSUC0_GSUWGMRR0_K1_LBSPPB512_MIWT6_4_NLCA2_SU16_SUM0_SUS128_VWB4_WG64_4_1_WGM8_WGMXCC8_WGMXCCGn1
    SolutionIndex: 400
    SolutionNameMin: Cijk_Alik_Bljk_F8NHS_STA_BH_BiasSH_HAS_SAB_SAV_UserArgs_MT192x160x128_MI16x16x1_SN_LDSB1_GRVWB16_GSU1_GSUC0_GSUWGMRR0_K1_LBSPPB256_MIWT3_10_NLCA2_SU16_SUM0_SUS128_VWB2_WG64_4_1_WGM8_WGMXCC8_WGMXCCGn1
    SolutionIndex: 401
    SolutionNameMin: Cijk_Alik_Bljk_F8NHS_STA_BH_BiasSH_HAS_SAB_SAV_UserArgs_MT192x16x256_MI16x16x1_SN_LDSB0_GRVWB16_GSU1_GSUC0_GSUWGMRR0_K1_LBSPPB256_MIWT3_1_NLCA4_SU16_SUM0_SUS256_VWB1_WG64_4_1_WGM8_WGMXCC8_WGMXCCGn1
    SolutionIndex: 402
    SolutionNameMin: Cijk_Alik_Bljk_F8NHS_STA_BH_BiasSH_HAS_SAB_SAV_UserArgs_MT128x32x512_MI16x16x1_SN_LDSB1_GRVWB16_GSU1_GSUC0_GSUWGMRR0_K1_LBSPPB1024_MIWT2_2_NLCA8_SU16_SUM0_SUS512_VWB2_WG64_4_1_WGM8_WGMXCC8_WGMXCCGn1
    SolutionIndex: 403
    SolutionNameMin: Cijk_Alik_Bljk_F8NHS_STA_BH_BiasSH_HAS_SAB_SAV_UserArgs_MT192x144x128_MI16x16x1_SN_LDSB1_GRVWB8_GSU1_GSUC0_GSUWGMRR0_K1_LBSPPB128_MIWT3_9_NLCA2_SU16_SUM0_SUS128_VWB1_WG64_4_1_WGM8_WGMXCC8_WGMXCCGn1
    SolutionIndex: 404
    SolutionNameMin: Cijk_Alik_Bljk_F8NHS_STA_BH_BiasSH_HAS_SAB_SAV_UserArgs_MT320x112x128_MI16x16x1_SN_LDSB0_GRVWB8_GSU1_GSUC0_GSUWGMRR0_K1_LBSPPB128_MIWT5_7_NLCA2_SU16_SUM0_SUS128_VWB1_WG64_4_1_WGM8_WGMXCC8_WGMXCCGn1
    SolutionIndex: 405
    SolutionNameMin: Cijk_Alik_Bljk_F8NHS_STA_BH_BiasSH_HAS_SAB_SAV_UserArgs_MT512x80x128_MI16x16x1_SN_LDSB0_GRVWB8_GSU1_GSUC0_GSUWGMRR0_K1_LBSPPB128_MIWT8_5_NLCA2_SU16_SUM0_SUS128_VWB1_WG64_4_1_WGM8_WGMXCC8_WGMXCCGn1
    SolutionIndex: 406
    SolutionNameMin: Cijk_Alik_Bljk_F8NHS_STA_BH_BiasSH_HAS_SAB_SAV_UserArgs_MT192x208x128_MI16x16x1_SN_LDSB1_GRVWB8_GSU1_GSUC0_GSUWGMRR0_K1_LBSPPB128_MIWT3_13_NLCA2_SU16_SUM0_SUS128_VWB1_WG64_4_1_WGM8_WGMXCC8_WGMXCCGn1
    SolutionIndex: 407
    SolutionNameMin: Cijk_Alik_Bljk_F8NHS_STA_BH_BiasSH_HAS_SAB_SAV_UserArgs_MT192x224x128_MI16x16x1_SN_LDSB0_GRVWB16_GSU1_GSUC0_GSUWGMRR0_K1_LBSPPB256_MIWT3_14_NLCA2_SU16_SUM0_SUS128_VWB2_WG64_4_1_WGM8_WGMXCC8_WGMXCCGn1
- - - [127, 127, 1, 127]
    - [1, 0.0]
  - - [127, 128, 1, 127]
    - [0, 0.0]
  - - [1, 127, 1, 127]
    - [1, 0.0]
  - - [128, 128, 1, 128]
    - [2, 0.0]
  - - [1248, 2048, 1, 5280]
    - [4, 0.0]
  - - [1920, 2048, 1, 5280]
    - [3, 0.0]
  - - [5280, 2048, 1, 1024]
    - [6, 0.0]
  - - [8320, 2048, 1, 5280]
    - [5, 0.0]
  - - [28672, 16, 1, 4096]
    - [7, 0.0]
  - - [28672, 32, 1, 4096]
    - [8, 0.0]
  - - [28672, 48, 1, 4096]
    - [9, 0.0]
  - - [28672, 64, 1, 4096]
    - [10, 0.0]
  - - [28672, 80, 1, 4096]
    - [11, 0.0]
  - - [28672, 96, 1, 4096]
    - [12, 0.0]
  - - [28672, 112, 1, 4096]
    - [13, 0.0]
  - - [28672, 128, 1, 4096]
    - [14, 0.0]
  - - [28672, 144, 1, 4096]
    - [15, 0.0]
  - - [28672, 160, 1, 4096]
    - [15, 0.0]
  - - [28672, 176, 1, 4096]
    - [16, 0.0]
  - - [28672, 192, 1, 4096]
    - [16, 0.0]
  - - [28672, 208, 1, 4096]
    - [17, 0.0]
  - - [28672, 224, 1, 4096]
    - [17, 0.0]
  - - [28672, 240, 1, 4096]
    - [18, 0.0]
  - - [28672, 256, 1, 4096]
    - [19, 0.0]
  - - [28672, 272, 1, 4096]
    - [20, 0.0]
  - - [28672, 288, 1, 4096]
    - [20, 0.0]
  - - [28672, 304, 1, 4096]
    - [11, 0.0]
  - - [28672, 320, 1, 4096]
    - [21, 0.0]
  - - [28672, 336, 1, 4096]
    - [22, 0.0]
  - - [28672, 352, 1, 4096]
    - [23, 0.0]
  - - [28672, 368, 1, 4096]
    - [16, 0.0]
  - - [28672, 384, 1, 4096]
    - [16, 0.0]
  - - [28672, 400, 1, 4096]
    - [24, 0.0]
  - - [28672, 416, 1, 4096]
    - [25, 0.0]
  - - [28672, 432, 1, 4096]
    - [17, 0.0]
  - - [28672, 448, 1, 4096]
    - [17, 0.0]
  - - [28672, 464, 1, 4096]
    - [26, 0.0]
  - - [28672, 480, 1, 4096]
    - [26, 0.0]
  - - [28672, 496, 1, 4096]
    - [19, 0.0]
  - - [28672, 512, 1, 4096]
    - [19, 0.0]
  - - [28672, 544, 1, 4096]
    - [16, 0.0]
  - - [28672, 576, 1, 4096]
    - [27, 0.0]
  - - [28672, 608, 1, 4096]
    - [28, 0.0]
  - - [28672, 640, 1, 4096]
    - [28, 0.0]
  - - [28672, 672, 1, 4096]
    - [17, 0.0]
  - - [28672, 704, 1, 4096]
    - [23, 0.0]
  - - [28672, 736, 1, 4096]
    - [19, 0.0]
  - - [28672, 768, 1, 4096]
    - [19, 0.0]
  - - [28672, 800, 1, 4096]
    - [29, 0.0]
  - - [28672, 832, 1, 4096]
    - [25, 0.0]
  - - [28672, 864, 1, 4096]
    - [30, 0.0]
  - - [28672, 896, 1, 4096]
    - [30, 0.0]
  - - [28672, 928, 1, 4096]
    - [31, 0.0]
  - - [28672, 960, 1, 4096]
    - [32, 0.0]
  - - [28672, 992, 1, 4096]
    - [33, 0.0]
  - - [28672, 1024, 1, 4096]
    - [33, 0.0]
  - - [28672, 1088, 1, 4096]
    - [34, 0.0]
  - - [28672, 1152, 1, 4096]
    - [35, 0.0]
  - - [28672, 1216, 1, 4096]
    - [26, 0.0]
  - - [28672, 1280, 1, 4096]
    - [29, 0.0]
  - - [28672, 1344, 1, 4096]
    - [30, 0.0]
  - - [28672, 1408, 1, 4096]
    - [36, 0.0]
  - - [28672, 1472, 1, 4096]
    - [19, 0.0]
  - - [28672, 1536, 1, 4096]
    - [32, 0.0]
  - - [28672, 1600, 1, 4096]
    - [29, 0.0]
  - - [28672, 1664, 1, 4096]
    - [37, 0.0]
  - - [28672, 1728, 1, 4096]
    - [38, 0.0]
  - - [28672, 1792, 1, 4096]
    - [38, 0.0]
  - - [28672, 1856, 1, 4096]
    - [27, 0.0]
  - - [28672, 1920, 1, 4096]
    - [39, 0.0]
  - - [28672, 1984, 1, 4096]
    - [40, 0.0]
  - - [28672, 2048, 1, 4096]
    - [33, 0.0]
  - - [28672, 2176, 1, 4096]
    - [41, 0.0]
  - - [28672, 2304, 1, 4096]
    - [35, 0.0]
  - - [28672, 2432, 1, 4096]
    - [27, 0.0]
  - - [28672, 2560, 1, 4096]
    - [29, 0.0]
  - - [28672, 2688, 1, 4096]
    - [30, 0.0]
  - - [28672, 2816, 1, 4096]
    - [36, 0.0]
  - - [28672, 2944, 1, 4096]
    - [32, 0.0]
  - - [28672, 3072, 1, 4096]
    - [32, 0.0]
  - - [28672, 3200, 1, 4096]
    - [42, 0.0]
  - - [28672, 3328, 1, 4096]
    - [37, 0.0]
  - - [28672, 3456, 1, 4096]
    - [43, 0.0]
  - - [28672, 3584, 1, 4096]
    - [38, 0.0]
  - - [28672, 3712, 1, 4096]
    - [37, 0.0]
  - - [28672, 3840, 1, 4096]
    - [44, 0.0]
  - - [28672, 3968, 1, 4096]
    - [32, 0.0]
  - - [28672, 4096, 1, 4096]
    - [38, 0.0]
  - - [28672, 4352, 1, 4096]
    - [37, 0.0]
  - - [28672, 4608, 1, 4096]
    - [38, 0.0]
  - - [28672, 4864, 1, 4096]
    - [43, 0.0]
  - - [28672, 5120, 1, 4096]
    - [33, 0.0]
  - - [28672, 5376, 1, 4096]
    - [38, 0.0]
  - - [28672, 5632, 1, 4096]
    - [33, 0.0]
  - - [28672, 5888, 1, 4096]
    - [19, 0.0]
  - - [28672, 6144, 1, 4096]
    - [32, 0.0]
  - - [28672, 6400, 1, 4096]
    - [38, 0.0]
  - - [28672, 6656, 1, 4096]
    - [37, 0.0]
  - - [28672, 6912, 1, 4096]
    - [35, 0.0]
  - - [28672, 7168, 1, 4096]
    - [33, 0.0]
  - - [28672, 7424, 1, 4096]
    - [36, 0.0]
  - - [28672, 7680, 1, 4096]
    - [45, 0.0]
  - - [28672, 7936, 1, 4096]
    - [33, 0.0]
  - - [28672, 8192, 1, 4096]
    - [32, 0.0]
  - - [28672, 8704, 1, 4096]
    - [32, 0.0]
  - - [28672, 9216, 1, 4096]
    - [32, 0.0]
  - - [28672, 9728, 1, 4096]
    - [32, 0.0]
  - - [28672, 10240, 1, 4096]
    - [32, 0.0]
  - - [28672, 10752, 1, 4096]
    - [32, 0.0]
  - - [28672, 11264, 1, 4096]
    - [33, 0.0]
  - - [28672, 11776, 1, 4096]
    - [33, 0.0]
  - - [28672, 12288, 1, 4096]
    - [32, 0.0]
  - - [28672, 12800, 1, 4096]
    - [33, 0.0]
  - - [28672, 13312, 1, 4096]
    - [32, 0.0]
  - - [28672, 13824, 1, 4096]
    - [38, 0.0]
  - - [28672, 14336, 1, 4096]
    - [33, 0.0]
  - - [28672, 14848, 1, 4096]
    - [38, 0.0]
  - - [28672, 15360, 1, 4096]
    - [34, 0.0]
  - - [28672, 15872, 1, 4096]
    - [38, 0.0]
  - - [28672, 16384, 1, 4096]
    - [30, 0.0]
  - - [28672, 17408, 1, 4096]
    - [35, 0.0]
  - - [28672, 18432, 1, 4096]
    - [33, 0.0]
  - - [28672, 19456, 1, 4096]
    - [38, 0.0]
  - - [28672, 20480, 1, 4096]
    - [35, 0.0]
  - - [28672, 21504, 1, 4096]
    - [33, 0.0]
  - - [28672, 22528, 1, 4096]
    - [33, 0.0]
  - - [28672, 23552, 1, 4096]
    - [35, 0.0]
  - - [28672, 24576, 1, 4096]
    - [30, 0.0]
  - - [28672, 25600, 1, 4096]
    - [33, 0.0]
  - - [28672, 26624, 1, 4096]
    - [30, 0.0]
  - - [28672, 27648, 1, 4096]
    - [33, 0.0]
  - - [28672, 28672, 1, 4096]
    - [33, 0.0]
  - - [28672, 29696, 1, 4096]
    - [32, 0.0]
  - - [28672, 30720, 1, 4096]
    - [30, 0.0]
  - - [28672, 31744, 1, 4096]
    - [30, 0.0]
  - - [28672, 32768, 1, 4096]
    - [33, 0.0]
  - - [28672, 34816, 1, 4096]
    - [33, 0.0]
  - - [28672, 36864, 1, 4096]
    - [33, 0.0]
  - - [28672, 38912, 1, 4096]
    - [30, 0.0]
  - - [28672, 40960, 1, 4096]
    - [32, 0.0]
  - - [28672, 43008, 1, 4096]
    - [38, 0.0]
  - - [28672, 45056, 1, 4096]
    - [33, 0.0]
  - - [28672, 47104, 1, 4096]
    - [38, 0.0]
  - - [28672, 49152, 1, 4096]
    - [33, 0.0]
  - - [28672, 51200, 1, 4096]
    - [38, 0.0]
  - - [28672, 53248, 1, 4096]
    - [30, 0.0]
  - - [28672, 55296, 1, 4096]
    - [30, 0.0]
  - - [28672, 57344, 1, 4096]
    - [30, 0.0]
  - - [28672, 59392, 1, 4096]
    - [33, 0.0]
  - - [28672, 61440, 1, 4096]
    - [33, 0.0]
  - - [28672, 63488, 1, 4096]
    - [33, 0.0]
  - - [28672, 65536, 1, 4096]
    - [38, 0.0]
  - - [4096, 16, 1, 14336]
    - [46, 0.0]
  - - [4096, 32, 1, 14336]
    - [46, 0.0]
  - - [4096, 48, 1, 14336]
    - [47, 0.0]
  - - [4096, 64, 1, 14336]
    - [47, 0.0]
  - - [4096, 80, 1, 14336]
    - [8, 0.0]
  - - [4096, 96, 1, 14336]
    - [8, 0.0]
  - - [4096, 112, 1, 14336]
    - [8, 0.0]
  - - [4096, 128, 1, 14336]
    - [8, 0.0]
  - - [4096, 144, 1, 14336]
    - [48, 0.0]
  - - [4096, 160, 1, 14336]
    - [49, 0.0]
  - - [4096, 176, 1, 14336]
    - [48, 0.0]
  - - [4096, 192, 1, 14336]
    - [48, 0.0]
  - - [4096, 208, 1, 14336]
    - [50, 0.0]
  - - [4096, 224, 1, 14336]
    - [49, 0.0]
  - - [4096, 240, 1, 14336]
    - [51, 0.0]
  - - [4096, 256, 1, 14336]
    - [49, 0.0]
  - - [4096, 272, 1, 14336]
    - [9, 0.0]
  - - [4096, 288, 1, 14336]
    - [9, 0.0]
  - - [4096, 304, 1, 14336]
    - [9, 0.0]
  - - [4096, 320, 1, 14336]
    - [9, 0.0]
  - - [4096, 336, 1, 14336]
    - [9, 0.0]
  - - [4096, 352, 1, 14336]
    - [9, 0.0]
  - - [4096, 368, 1, 14336]
    - [51, 0.0]
  - - [4096, 384, 1, 14336]
    - [9, 0.0]
  - - [4096, 400, 1, 14336]
    - [11, 0.0]
  - - [4096, 416, 1, 14336]
    - [10, 0.0]
  - - [4096, 432, 1, 14336]
    - [10, 0.0]
  - - [4096, 448, 1, 14336]
    - [10, 0.0]
  - - [4096, 464, 1, 14336]
    - [10, 0.0]
  - - [4096, 480, 1, 14336]
    - [10, 0.0]
  - - [4096, 496, 1, 14336]
    - [10, 0.0]
  - - [4096, 512, 1, 14336]
    - [10, 0.0]
  - - [4096, 544, 1, 14336]
    - [11, 0.0]
  - - [4096, 576, 1, 14336]
    - [11, 0.0]
  - - [4096, 608, 1, 14336]
    - [11, 0.0]
  - - [4096, 640, 1, 14336]
    - [11, 0.0]
  - - [4096, 672, 1, 14336]
    - [11, 0.0]
  - - [4096, 704, 1, 14336]
    - [52, 0.0]
  - - [4096, 736, 1, 14336]
    - [12, 0.0]
  - - [4096, 768, 1, 14336]
    - [12, 0.0]
  - - [4096, 800, 1, 14336]
    - [12, 0.0]
  - - [4096, 832, 1, 14336]
    - [13, 0.0]
  - - [4096, 864, 1, 14336]
    - [13, 0.0]
  - - [4096, 896, 1, 14336]
    - [13, 0.0]
  - - [4096, 928, 1, 14336]
    - [13, 0.0]
  - - [4096, 960, 1, 14336]
    - [13, 0.0]
  - - [4096, 992, 1, 14336]
    - [13, 0.0]
  - - [4096, 1024, 1, 14336]
    - [15, 0.0]
  - - [4096, 1088, 1, 14336]
    - [53, 0.0]
  - - [4096, 1152, 1, 14336]
    - [16, 0.0]
  - - [4096, 1216, 1, 14336]
    - [54, 0.0]
  - - [4096, 1280, 1, 14336]
    - [24, 0.0]
  - - [4096, 1344, 1, 14336]
    - [55, 0.0]
  - - [4096, 1408, 1, 14336]
    - [55, 0.0]
  - - [4096, 1472, 1, 14336]
    - [24, 0.0]
  - - [4096, 1536, 1, 14336]
    - [26, 0.0]
  - - [4096, 1600, 1, 14336]
    - [26, 0.0]
  - - [4096, 1664, 1, 14336]
    - [26, 0.0]
  - - [4096, 1728, 1, 14336]
    - [26, 0.0]
  - - [4096, 1792, 1, 14336]
    - [26, 0.0]
  - - [4096, 1856, 1, 14336]
    - [56, 0.0]
  - - [4096, 1920, 1, 14336]
    - [56, 0.0]
  - - [4096, 1984, 1, 14336]
    - [56, 0.0]
  - - [4096, 2048, 1, 14336]
    - [56, 0.0]
  - - [4096, 2176, 1, 14336]
    - [57, 0.0]
  - - [4096, 2304, 1, 14336]
    - [43, 0.0]
  - - [4096, 2432, 1, 14336]
    - [57, 0.0]
  - - [4096, 2560, 1, 14336]
    - [58, 0.0]
  - - [4096, 2688, 1, 14336]
    - [59, 0.0]
  - - [4096, 2816, 1, 14336]
    - [29, 0.0]
  - - [4096, 2944, 1, 14336]
    - [29, 0.0]
  - - [4096, 3072, 1, 14336]
    - [36, 0.0]
  - - [4096, 3200, 1, 14336]
    - [36, 0.0]
  - - [4096, 3328, 1, 14336]
    - [36, 0.0]
  - - [4096, 3456, 1, 14336]
    - [32, 0.0]
  - - [4096, 3584, 1, 14336]
    - [32, 0.0]
  - - [4096, 3712, 1, 14336]
    - [37, 0.0]
  - - [4096, 3840, 1, 14336]
    - [37, 0.0]
  - - [4096, 3968, 1, 14336]
    - [38, 0.0]
  - - [4096, 4096, 1, 14336]
    - [38, 0.0]
  - - [4096, 4352, 1, 14336]
    - [39, 0.0]
  - - [4096, 4608, 1, 14336]
    - [43, 0.0]
  - - [4096, 4864, 1, 14336]
    - [43, 0.0]
  - - [4096, 5120, 1, 14336]
    - [59, 0.0]
  - - [4096, 5376, 1, 14336]
    - [59, 0.0]
  - - [4096, 5632, 1, 14336]
    - [29, 0.0]
  - - [4096, 5888, 1, 14336]
    - [29, 0.0]
  - - [4096, 6144, 1, 14336]
    - [36, 0.0]
  - - [4096, 6400, 1, 14336]
    - [36, 0.0]
  - - [4096, 6656, 1, 14336]
    - [36, 0.0]
  - - [4096, 6912, 1, 14336]
    - [32, 0.0]
  - - [4096, 7168, 1, 14336]
    - [32, 0.0]
  - - [4096, 7424, 1, 14336]
    - [37, 0.0]
  - - [4096, 7680, 1, 14336]
    - [37, 0.0]
  - - [4096, 7936, 1, 14336]
    - [38, 0.0]
  - - [4096, 8192, 1, 14336]
    - [38, 0.0]
  - - [4096, 8704, 1, 14336]
    - [39, 0.0]
  - - [4096, 9216, 1, 14336]
    - [36, 0.0]
  - - [4096, 9728, 1, 14336]
    - [36, 0.0]
  - - [4096, 10240, 1, 14336]
    - [32, 0.0]
  - - [4096, 10752, 1, 14336]
    - [32, 0.0]
  - - [4096, 11264, 1, 14336]
    - [37, 0.0]
  - - [4096, 11776, 1, 14336]
    - [37, 0.0]
  - - [4096, 12288, 1, 14336]
    - [38, 0.0]
  - - [4096, 12800, 1, 14336]
    - [27, 0.0]
  - - [4096, 13312, 1, 14336]
    - [60, 0.0]
  - - [4096, 13824, 1, 14336]
    - [32, 0.0]
  - - [4096, 14336, 1, 14336]
    - [32, 0.0]
  - - [4096, 14848, 1, 14336]
    - [29, 0.0]
  - - [4096, 15360, 1, 14336]
    - [37, 0.0]
  - - [4096, 15872, 1, 14336]
    - [38, 0.0]
  - - [4096, 16384, 1, 14336]
    - [38, 0.0]
  - - [4096, 17408, 1, 14336]
    - [27, 0.0]
  - - [4096, 18432, 1, 14336]
    - [40, 0.0]
  - - [4096, 19456, 1, 14336]
    - [37, 0.0]
  - - [4096, 20480, 1, 14336]
    - [38, 0.0]
  - - [4096, 21504, 1, 14336]
    - [32, 0.0]
  - - [4096, 22528, 1, 14336]
    - [60, 0.0]
  - - [4096, 23552, 1, 14336]
    - [37, 0.0]
  - - [4096, 24576, 1, 14336]
    - [38, 0.0]
  - - [4096, 25600, 1, 14336]
    - [61, 0.0]
  - - [4096, 26624, 1, 14336]
    - [60, 0.0]
  - - [4096, 27648, 1, 14336]
    - [37, 0.0]
  - - [4096, 28672, 1, 14336]
    - [38, 0.0]
  - - [4096, 29696, 1, 14336]
    - [38, 0.0]
  - - [4096, 30720, 1, 14336]
    - [62, 0.0]
  - - [4096, 31744, 1, 14336]
    - [45, 0.0]
  - - [4096, 32768, 1, 14336]
    - [32, 0.0]
  - - [4096, 34816, 1, 14336]
    - [37, 0.0]
  - - [4096, 36864, 1, 14336]
    - [38, 0.0]
  - - [4096, 38912, 1, 14336]
    - [32, 0.0]
  - - [4096, 40960, 1, 14336]
    - [34, 0.0]
  - - [4096, 43008, 1, 14336]
    - [32, 0.0]
  - - [4096, 45056, 1, 14336]
    - [34, 0.0]
  - - [4096, 47104, 1, 14336]
    - [32, 0.0]
  - - [4096, 49152, 1, 14336]
    - [34, 0.0]
  - - [4096, 51200, 1, 14336]
    - [37, 0.0]
  - - [4096, 53248, 1, 14336]
    - [45, 0.0]
  - - [4096, 55296, 1, 14336]
    - [38, 0.0]
  - - [4096, 57344, 1, 14336]
    - [32, 0.0]
  - - [4096, 59392, 1, 14336]
    - [38, 0.0]
  - - [4096, 61440, 1, 14336]
    - [32, 0.0]
  - - [4096, 63488, 1, 14336]
    - [38, 0.0]
  - - [4096, 65536, 1, 14336]
    - [32, 0.0]
  - - [6144, 64854, 1, 4096]
    - [34, 0.0]
  - - [8192, 8704, 1, 8192]
    - [63, 0.0]
  - - [8192, 9216, 1, 8192]
    - [64, 0.0]
  - - [8192, 9728, 1, 8192]
    - [64, 0.0]
  - - [8192, 10240, 1, 8192]
    - [65, 0.0]
  - - [8192, 10752, 1, 8192]
    - [63, 0.0]
  - - [8192, 11264, 1, 8192]
    - [63, 0.0]
  - - [8192, 11776, 1, 8192]
    - [64, 0.0]
  - - [8192, 12288, 1, 8192]
    - [65, 0.0]
  - - [8192, 12800, 1, 8192]
    - [63, 0.0]
  - - [8192, 13312, 1, 8192]
    - [64, 0.0]
  - - [8192, 13824, 1, 8192]
    - [64, 0.0]
  - - [8192, 14336, 1, 8192]
    - [63, 0.0]
  - - [8192, 14848, 1, 8192]
    - [66, 0.0]
  - - [8192, 15360, 1, 8192]
    - [63, 0.0]
  - - [8192, 15872, 1, 8192]
    - [64, 0.0]
  - - [8192, 16384, 1, 8192]
    - [63, 0.0]
  - - [8192, 16896, 1, 8192]
    - [67, 0.0]
  - - [8192, 17408, 1, 8192]
    - [64, 0.0]
  - - [8192, 17920, 1, 8192]
    - [64, 0.0]
  - - [8192, 18432, 1, 8192]
    - [64, 0.0]
  - - [8192, 18944, 1, 8192]
    - [64, 0.0]
  - - [8192, 19456, 1, 8192]
    - [64, 0.0]
  - - [8192, 19968, 1, 8192]
    - [63, 0.0]
  - - [8192, 20480, 1, 8192]
    - [64, 0.0]
  - - [8192, 20992, 1, 8192]
    - [64, 0.0]
  - - [8192, 21504, 1, 8192]
    - [64, 0.0]
  - - [8192, 22016, 1, 8192]
    - [65, 0.0]
  - - [8192, 22528, 1, 8192]
    - [68, 0.0]
  - - [8192, 23040, 1, 8192]
    - [63, 0.0]
  - - [8192, 23552, 1, 8192]
    - [64, 0.0]
  - - [8192, 24064, 1, 8192]
    - [64, 0.0]
  - - [8192, 24576, 1, 8192]
    - [63, 0.0]
  - - [8192, 25088, 1, 8192]
    - [63, 0.0]
  - - [8192, 25600, 1, 8192]
    - [64, 0.0]
  - - [8192, 26112, 1, 8192]
    - [63, 0.0]
  - - [8192, 26624, 1, 8192]
    - [63, 0.0]
  - - [8192, 27136, 1, 8192]
    - [63, 0.0]
  - - [8192, 27648, 1, 8192]
    - [64, 0.0]
  - - [8192, 28160, 1, 8192]
    - [64, 0.0]
  - - [8192, 28672, 1, 8192]
    - [63, 0.0]
  - - [8192, 29184, 1, 8192]
    - [64, 0.0]
  - - [8192, 29696, 1, 8192]
    - [63, 0.0]
  - - [8192, 30208, 1, 8192]
    - [63, 0.0]
  - - [8192, 30720, 1, 8192]
    - [63, 0.0]
  - - [8192, 544, 1, 8192]
    - [69, 0.0]
  - - [8192, 576, 1, 8192]
    - [70, 0.0]
  - - [8192, 608, 1, 8192]
    - [71, 0.0]
  - - [8192, 640, 1, 8192]
    - [71, 0.0]
  - - [8192, 672, 1, 8192]
    - [71, 0.0]
  - - [8192, 704, 1, 8192]
    - [72, 0.0]
  - - [8192, 736, 1, 8192]
    - [73, 0.0]
  - - [8192, 768, 1, 8192]
    - [74, 0.0]
  - - [8192, 800, 1, 8192]
    - [75, 0.0]
  - - [8192, 832, 1, 8192]
    - [73, 0.0]
  - - [8192, 864, 1, 8192]
    - [75, 0.0]
  - - [8192, 896, 1, 8192]
    - [76, 0.0]
  - - [8192, 928, 1, 8192]
    - [77, 0.0]
  - - [8192, 960, 1, 8192]
    - [78, 0.0]
  - - [8192, 992, 1, 8192]
    - [79, 0.0]
  - - [8192, 1024, 1, 8192]
    - [80, 0.0]
  - - [8192, 1088, 1, 8192]
    - [81, 0.0]
  - - [8192, 1152, 1, 8192]
    - [80, 0.0]
  - - [8192, 1216, 1, 8192]
    - [82, 0.0]
  - - [8192, 1280, 1, 8192]
    - [83, 0.0]
  - - [8192, 1344, 1, 8192]
    - [66, 0.0]
  - - [8192, 1408, 1, 8192]
    - [66, 0.0]
  - - [8192, 1472, 1, 8192]
    - [84, 0.0]
  - - [8192, 1536, 1, 8192]
    - [85, 0.0]
  - - [8192, 1600, 1, 8192]
    - [85, 0.0]
  - - [8192, 1664, 1, 8192]
    - [86, 0.0]
  - - [8192, 1728, 1, 8192]
    - [87, 0.0]
  - - [8192, 1792, 1, 8192]
    - [88, 0.0]
  - - [8192, 1856, 1, 8192]
    - [89, 0.0]
  - - [8192, 1920, 1, 8192]
    - [65, 0.0]
  - - [8192, 1984, 1, 8192]
    - [65, 0.0]
  - - [8192, 2048, 1, 8192]
    - [65, 0.0]
  - - [8192, 2176, 1, 8192]
    - [64, 0.0]
  - - [8192, 2304, 1, 8192]
    - [63, 0.0]
  - - [8192, 2432, 1, 8192]
    - [63, 0.0]
  - - [8192, 2560, 1, 8192]
    - [90, 0.0]
  - - [8192, 2688, 1, 8192]
    - [83, 0.0]
  - - [8192, 2816, 1, 8192]
    - [90, 0.0]
  - - [8192, 2944, 1, 8192]
    - [90, 0.0]
  - - [8192, 3072, 1, 8192]
    - [91, 0.0]
  - - [8192, 3200, 1, 8192]
    - [86, 0.0]
  - - [8192, 3328, 1, 8192]
    - [92, 0.0]
  - - [8192, 3456, 1, 8192]
    - [92, 0.0]
  - - [8192, 3584, 1, 8192]
    - [80, 0.0]
  - - [8192, 3712, 1, 8192]
    - [68, 0.0]
  - - [8192, 3840, 1, 8192]
    - [68, 0.0]
  - - [8192, 3968, 1, 8192]
    - [68, 0.0]
  - - [8192, 4096, 1, 8192]
    - [65, 0.0]
  - - [8192, 4352, 1, 8192]
    - [64, 0.0]
  - - [8192, 4608, 1, 8192]
    - [63, 0.0]
  - - [8192, 4864, 1, 8192]
    - [63, 0.0]
  - - [8192, 5120, 1, 8192]
    - [92, 0.0]
  - - [8192, 5376, 1, 8192]
    - [93, 0.0]
  - - [8192, 5632, 1, 8192]
    - [65, 0.0]
  - - [8192, 5888, 1, 8192]
    - [68, 0.0]
  - - [8192, 6144, 1, 8192]
    - [65, 0.0]
  - - [8192, 6400, 1, 8192]
    - [64, 0.0]
  - - [8192, 6656, 1, 8192]
    - [64, 0.0]
  - - [8192, 6912, 1, 8192]
    - [64, 0.0]
  - - [8192, 7168, 1, 8192]
    - [64, 0.0]
  - - [8192, 7424, 1, 8192]
    - [90, 0.0]
  - - [8192, 7680, 1, 8192]
    - [68, 0.0]
  - - [8192, 7936, 1, 8192]
    - [68, 0.0]
  - - [8192, 8192, 1, 8192]
    - [68, 0.0]
  - - [8192, 16, 1, 8192]
    - [94, 0.0]
  - - [8192, 32, 1, 8192]
    - [95, 0.0]
  - - [8192, 48, 1, 8192]
    - [96, 0.0]
  - - [8192, 64, 1, 8192]
    - [97, 0.0]
  - - [8192, 80, 1, 8192]
    - [98, 0.0]
  - - [8192, 96, 1, 8192]
    - [99, 0.0]
  - - [8192, 112, 1, 8192]
    - [100, 0.0]
  - - [8192, 128, 1, 8192]
    - [101, 0.0]
  - - [8192, 144, 1, 8192]
    - [99, 0.0]
  - - [8192, 160, 1, 8192]
    - [102, 0.0]
  - - [8192, 176, 1, 8192]
    - [103, 0.0]
  - - [8192, 192, 1, 8192]
    - [104, 0.0]
  - - [8192, 208, 1, 8192]
    - [105, 0.0]
  - - [8192, 224, 1, 8192]
    - [105, 0.0]
  - - [8192, 240, 1, 8192]
    - [102, 0.0]
  - - [8192, 256, 1, 8192]
    - [104, 0.0]
  - - [8192, 272, 1, 8192]
    - [106, 0.0]
  - - [8192, 288, 1, 8192]
    - [107, 0.0]
  - - [8192, 304, 1, 8192]
    - [106, 0.0]
  - - [8192, 320, 1, 8192]
    - [102, 0.0]
  - - [8192, 336, 1, 8192]
    - [108, 0.0]
  - - [8192, 352, 1, 8192]
    - [107, 0.0]
  - - [8192, 368, 1, 8192]
    - [107, 0.0]
  - - [8192, 384, 1, 8192]
    - [107, 0.0]
  - - [8192, 400, 1, 8192]
    - [109, 0.0]
  - - [8192, 416, 1, 8192]
    - [110, 0.0]
  - - [8192, 432, 1, 8192]
    - [111, 0.0]
  - - [8192, 448, 1, 8192]
    - [111, 0.0]
  - - [8192, 464, 1, 8192]
    - [109, 0.0]
  - - [8192, 480, 1, 8192]
    - [112, 0.0]
  - - [8192, 496, 1, 8192]
    - [71, 0.0]
  - - [8192, 512, 1, 8192]
    - [113, 0.0]
  - - [8192, 8704, 1, 28672]
    - [114, 0.0]
  - - [8192, 9216, 1, 28672]
    - [115, 0.0]
  - - [8192, 9728, 1, 28672]
    - [64, 0.0]
  - - [8192, 10240, 1, 28672]
    - [68, 0.0]
  - - [8192, 10752, 1, 28672]
    - [93, 0.0]
  - - [8192, 11264, 1, 28672]
    - [116, 0.0]
  - - [8192, 11776, 1, 28672]
    - [63, 0.0]
  - - [8192, 12288, 1, 28672]
    - [117, 0.0]
  - - [8192, 12800, 1, 28672]
    - [118, 0.0]
  - - [8192, 13312, 1, 28672]
    - [119, 0.0]
  - - [8192, 13824, 1, 28672]
    - [120, 0.0]
  - - [8192, 14336, 1, 28672]
    - [64, 0.0]
  - - [8192, 14848, 1, 28672]
    - [121, 0.0]
  - - [8192, 15360, 1, 28672]
    - [122, 0.0]
  - - [8192, 15872, 1, 28672]
    - [115, 0.0]
  - - [8192, 16384, 1, 28672]
    - [64, 0.0]
  - - [8192, 16896, 1, 28672]
    - [64, 0.0]
  - - [8192, 17408, 1, 28672]
    - [123, 0.0]
  - - [8192, 17920, 1, 28672]
    - [124, 0.0]
  - - [8192, 18432, 1, 28672]
    - [115, 0.0]
  - - [8192, 18944, 1, 28672]
    - [64, 0.0]
  - - [8192, 19456, 1, 28672]
    - [63, 0.0]
  - - [8192, 19968, 1, 28672]
    - [117, 0.0]
  - - [8192, 20480, 1, 28672]
    - [125, 0.0]
  - - [8192, 20992, 1, 28672]
    - [63, 0.0]
  - - [8192, 21504, 1, 28672]
    - [63, 0.0]
  - - [8192, 22016, 1, 28672]
    - [118, 0.0]
  - - [8192, 22528, 1, 28672]
    - [65, 0.0]
  - - [8192, 23040, 1, 28672]
    - [115, 0.0]
  - - [8192, 23552, 1, 28672]
    - [64, 0.0]
  - - [8192, 24064, 1, 28672]
    - [64, 0.0]
  - - [8192, 24576, 1, 28672]
    - [122, 0.0]
  - - [8192, 25088, 1, 28672]
    - [126, 0.0]
  - - [8192, 25600, 1, 28672]
    - [63, 0.0]
  - - [8192, 26112, 1, 28672]
    - [63, 0.0]
  - - [8192, 26624, 1, 28672]
    - [64, 0.0]
  - - [8192, 27136, 1, 28672]
    - [127, 0.0]
  - - [8192, 27648, 1, 28672]
    - [125, 0.0]
  - - [8192, 28160, 1, 28672]
    - [64, 0.0]
  - - [8192, 28672, 1, 28672]
    - [63, 0.0]
  - - [8192, 29184, 1, 28672]
    - [63, 0.0]
  - - [8192, 29696, 1, 28672]
    - [128, 0.0]
  - - [8192, 30208, 1, 28672]
    - [64, 0.0]
  - - [8192, 30720, 1, 28672]
    - [63, 0.0]
  - - [8192, 544, 1, 28672]
    - [129, 0.0]
  - - [8192, 576, 1, 28672]
    - [130, 0.0]
  - - [8192, 608, 1, 28672]
    - [131, 0.0]
  - - [8192, 640, 1, 28672]
    - [132, 0.0]
  - - [8192, 672, 1, 28672]
    - [71, 0.0]
  - - [8192, 704, 1, 28672]
    - [133, 0.0]
  - - [8192, 736, 1, 28672]
    - [76, 0.0]
  - - [8192, 768, 1, 28672]
    - [134, 0.0]
  - - [8192, 800, 1, 28672]
    - [135, 0.0]
  - - [8192, 832, 1, 28672]
    - [74, 0.0]
  - - [8192, 864, 1, 28672]
    - [136, 0.0]
  - - [8192, 896, 1, 28672]
    - [76, 0.0]
  - - [8192, 928, 1, 28672]
    - [137, 0.0]
  - - [8192, 960, 1, 28672]
    - [138, 0.0]
  - - [8192, 992, 1, 28672]
    - [139, 0.0]
  - - [8192, 1024, 1, 28672]
    - [140, 0.0]
  - - [8192, 1088, 1, 28672]
    - [138, 0.0]
  - - [8192, 1152, 1, 28672]
    - [80, 0.0]
  - - [8192, 1216, 1, 28672]
    - [141, 0.0]
  - - [8192, 1280, 1, 28672]
    - [142, 0.0]
  - - [8192, 1344, 1, 28672]
    - [143, 0.0]
  - - [8192, 1408, 1, 28672]
    - [144, 0.0]
  - - [8192, 1472, 1, 28672]
    - [87, 0.0]
  - - [8192, 1536, 1, 28672]
    - [145, 0.0]
  - - [8192, 1600, 1, 28672]
    - [146, 0.0]
  - - [8192, 1664, 1, 28672]
    - [86, 0.0]
  - - [8192, 1728, 1, 28672]
    - [87, 0.0]
  - - [8192, 1792, 1, 28672]
    - [147, 0.0]
  - - [8192, 1856, 1, 28672]
    - [89, 0.0]
  - - [8192, 1920, 1, 28672]
    - [148, 0.0]
  - - [8192, 1984, 1, 28672]
    - [149, 0.0]
  - - [8192, 2048, 1, 28672]
    - [150, 0.0]
  - - [8192, 2176, 1, 28672]
    - [67, 0.0]
  - - [8192, 2304, 1, 28672]
    - [63, 0.0]
  - - [8192, 2432, 1, 28672]
    - [64, 0.0]
  - - [8192, 2560, 1, 28672]
    - [151, 0.0]
  - - [8192, 2688, 1, 28672]
    - [152, 0.0]
  - - [8192, 2816, 1, 28672]
    - [142, 0.0]
  - - [8192, 2944, 1, 28672]
    - [83, 0.0]
  - - [8192, 3072, 1, 28672]
    - [153, 0.0]
  - - [8192, 3200, 1, 28672]
    - [84, 0.0]
  - - [8192, 3328, 1, 28672]
    - [144, 0.0]
  - - [8192, 3456, 1, 28672]
    - [117, 0.0]
  - - [8192, 3584, 1, 28672]
    - [93, 0.0]
  - - [8192, 3712, 1, 28672]
    - [119, 0.0]
  - - [8192, 3840, 1, 28672]
    - [123, 0.0]
  - - [8192, 3968, 1, 28672]
    - [154, 0.0]
  - - [8192, 4096, 1, 28672]
    - [68, 0.0]
  - - [8192, 4352, 1, 28672]
    - [122, 0.0]
  - - [8192, 4608, 1, 28672]
    - [125, 0.0]
  - - [8192, 4864, 1, 28672]
    - [64, 0.0]
  - - [8192, 5120, 1, 28672]
    - [87, 0.0]
  - - [8192, 5376, 1, 28672]
    - [87, 0.0]
  - - [8192, 5632, 1, 28672]
    - [154, 0.0]
  - - [8192, 5888, 1, 28672]
    - [155, 0.0]
  - - [8192, 6144, 1, 28672]
    - [156, 0.0]
  - - [8192, 6400, 1, 28672]
    - [114, 0.0]
  - - [8192, 6656, 1, 28672]
    - [118, 0.0]
  - - [8192, 6912, 1, 28672]
    - [115, 0.0]
  - - [8192, 7168, 1, 28672]
    - [63, 0.0]
  - - [8192, 7424, 1, 28672]
    - [142, 0.0]
  - - [8192, 7680, 1, 28672]
    - [123, 0.0]
  - - [8192, 7936, 1, 28672]
    - [68, 0.0]
  - - [8192, 8192, 1, 28672]
    - [68, 0.0]
  - - [8192, 16, 1, 28672]
    - [157, 0.0]
  - - [8192, 32, 1, 28672]
    - [158, 0.0]
  - - [8192, 48, 1, 28672]
    - [159, 0.0]
  - - [8192, 64, 1, 28672]
    - [270, 0.0]
  - - [8192, 80, 1, 28672]
    - [271, 0.0]
  - - [8192, 96, 1, 28672]
    - [272, 0.0]
  - - [8192, 112, 1, 28672]
    - [273, 0.0]
  - - [8192, 128, 1, 28672]
    - [274, 0.0]
  - - [8192, 144, 1, 28672]
    - [275, 0.0]
  - - [8192, 160, 1, 28672]
    - [276, 0.0]
  - - [8192, 176, 1, 28672]
    - [277, 0.0]
  - - [8192, 192, 1, 28672]
    - [278, 0.0]
  - - [8192, 208, 1, 28672]
    - [279, 0.0]
  - - [8192, 224, 1, 28672]
    - [280, 0.0]
  - - [8192, 240, 1, 28672]
    - [281, 0.0]
  - - [8192, 256, 1, 28672]
    - [282, 0.0]
  - - [8192, 272, 1, 28672]
    - [166, 0.0]
  - - [8192, 288, 1, 28672]
    - [167, 0.0]
  - - [8192, 304, 1, 28672]
    - [168, 0.0]
  - - [8192, 320, 1, 28672]
    - [164, 0.0]
  - - [8192, 336, 1, 28672]
    - [166, 0.0]
  - - [8192, 352, 1, 28672]
    - [169, 0.0]
  - - [8192, 368, 1, 28672]
    - [169, 0.0]
  - - [8192, 384, 1, 28672]
    - [169, 0.0]
  - - [8192, 400, 1, 28672]
    - [170, 0.0]
  - - [8192, 416, 1, 28672]
    - [171, 0.0]
  - - [8192, 432, 1, 28672]
    - [172, 0.0]
  - - [8192, 448, 1, 28672]
    - [173, 0.0]
  - - [8192, 464, 1, 28672]
    - [174, 0.0]
  - - [8192, 480, 1, 28672]
    - [175, 0.0]
  - - [8192, 496, 1, 28672]
    - [176, 0.0]
  - - [8192, 512, 1, 28672]
    - [177, 0.0]
  - - [10240, 8704, 1, 8192]
    - [63, 0.0]
  - - [10240, 9216, 1, 8192]
    - [63, 0.0]
  - - [10240, 9728, 1, 8192]
    - [63, 0.0]
  - - [10240, 10240, 1, 8192]
    - [90, 0.0]
  - - [10240, 10752, 1, 8192]
    - [64, 0.0]
  - - [10240, 11264, 1, 8192]
    - [64, 0.0]
  - - [10240, 11776, 1, 8192]
    - [68, 0.0]
  - - [10240, 12288, 1, 8192]
    - [64, 0.0]
  - - [10240, 12800, 1, 8192]
    - [64, 0.0]
  - - [10240, 13312, 1, 8192]
    - [63, 0.0]
  - - [10240, 13824, 1, 8192]
    - [64, 0.0]
  - - [10240, 14336, 1, 8192]
    - [86, 0.0]
  - - [10240, 14848, 1, 8192]
    - [64, 0.0]
  - - [10240, 15360, 1, 8192]
    - [64, 0.0]
  - - [10240, 15872, 1, 8192]
    - [63, 0.0]
  - - [10240, 16384, 1, 8192]
    - [63, 0.0]
  - - [10240, 16896, 1, 8192]
    - [64, 0.0]
  - - [10240, 17408, 1, 8192]
    - [63, 0.0]
  - - [10240, 17920, 1, 8192]
    - [63, 0.0]
  - - [10240, 18432, 1, 8192]
    - [64, 0.0]
  - - [10240, 18944, 1, 8192]
    - [63, 0.0]
  - - [10240, 19456, 1, 8192]
    - [64, 0.0]
  - - [10240, 19968, 1, 8192]
    - [65, 0.0]
  - - [10240, 20480, 1, 8192]
    - [64, 0.0]
  - - [10240, 20992, 1, 8192]
    - [64, 0.0]
  - - [10240, 21504, 1, 8192]
    - [68, 0.0]
  - - [10240, 22016, 1, 8192]
    - [64, 0.0]
  - - [10240, 22528, 1, 8192]
    - [63, 0.0]
  - - [10240, 23040, 1, 8192]
    - [63, 0.0]
  - - [10240, 23552, 1, 8192]
    - [68, 0.0]
  - - [10240, 24064, 1, 8192]
    - [63, 0.0]
  - - [10240, 24576, 1, 8192]
    - [64, 0.0]
  - - [10240, 25088, 1, 8192]
    - [64, 0.0]
  - - [10240, 25600, 1, 8192]
    - [64, 0.0]
  - - [10240, 26112, 1, 8192]
    - [64, 0.0]
  - - [10240, 26624, 1, 8192]
    - [64, 0.0]
  - - [10240, 27136, 1, 8192]
    - [64, 0.0]
  - - [10240, 27648, 1, 8192]
    - [64, 0.0]
  - - [10240, 28160, 1, 8192]
    - [64, 0.0]
  - - [10240, 28672, 1, 8192]
    - [64, 0.0]
  - - [10240, 29184, 1, 8192]
    - [63, 0.0]
  - - [10240, 29696, 1, 8192]
    - [64, 0.0]
  - - [10240, 30208, 1, 8192]
    - [63, 0.0]
  - - [10240, 30720, 1, 8192]
    - [63, 0.0]
  - - [10240, 544, 1, 8192]
    - [131, 0.0]
  - - [10240, 576, 1, 8192]
    - [178, 0.0]
  - - [10240, 608, 1, 8192]
    - [76, 0.0]
  - - [10240, 640, 1, 8192]
    - [75, 0.0]
  - - [10240, 672, 1, 8192]
    - [134, 0.0]
  - - [10240, 704, 1, 8192]
    - [179, 0.0]
  - - [10240, 736, 1, 8192]
    - [180, 0.0]
  - - [10240, 768, 1, 8192]
    - [81, 0.0]
  - - [10240, 800, 1, 8192]
    - [181, 0.0]
  - - [10240, 832, 1, 8192]
    - [81, 0.0]
  - - [10240, 864, 1, 8192]
    - [182, 0.0]
  - - [10240, 896, 1, 8192]
    - [81, 0.0]
  - - [10240, 928, 1, 8192]
    - [183, 0.0]
  - - [10240, 960, 1, 8192]
    - [183, 0.0]
  - - [10240, 992, 1, 8192]
    - [83, 0.0]
  - - [10240, 1024, 1, 8192]
    - [90, 0.0]
  - - [10240, 1088, 1, 8192]
    - [83, 0.0]
  - - [10240, 1152, 1, 8192]
    - [83, 0.0]
  - - [10240, 1216, 1, 8192]
    - [184, 0.0]
  - - [10240, 1280, 1, 8192]
    - [85, 0.0]
  - - [10240, 1344, 1, 8192]
    - [93, 0.0]
  - - [10240, 1408, 1, 8192]
    - [92, 0.0]
  - - [10240, 1472, 1, 8192]
    - [150, 0.0]
  - - [10240, 1536, 1, 8192]
    - [185, 0.0]
  - - [10240, 1600, 1, 8192]
    - [65, 0.0]
  - - [10240, 1664, 1, 8192]
    - [68, 0.0]
  - - [10240, 1728, 1, 8192]
    - [186, 0.0]
  - - [10240, 1792, 1, 8192]
    - [63, 0.0]
  - - [10240, 1856, 1, 8192]
    - [63, 0.0]
  - - [10240, 1920, 1, 8192]
    - [63, 0.0]
  - - [10240, 1984, 1, 8192]
    - [187, 0.0]
  - - [10240, 2048, 1, 8192]
    - [83, 0.0]
  - - [10240, 2176, 1, 8192]
    - [66, 0.0]
  - - [10240, 2304, 1, 8192]
    - [90, 0.0]
  - - [10240, 2432, 1, 8192]
    - [90, 0.0]
  - - [10240, 2560, 1, 8192]
    - [86, 0.0]
  - - [10240, 2688, 1, 8192]
    - [86, 0.0]
  - - [10240, 2816, 1, 8192]
    - [92, 0.0]
  - - [10240, 2944, 1, 8192]
    - [68, 0.0]
  - - [10240, 3072, 1, 8192]
    - [185, 0.0]
  - - [10240, 3200, 1, 8192]
    - [65, 0.0]
  - - [10240, 3328, 1, 8192]
    - [150, 0.0]
  - - [10240, 3456, 1, 8192]
    - [63, 0.0]
  - - [10240, 3584, 1, 8192]
    - [64, 0.0]
  - - [10240, 3712, 1, 8192]
    - [64, 0.0]
  - - [10240, 3840, 1, 8192]
    - [63, 0.0]
  - - [10240, 3968, 1, 8192]
    - [92, 0.0]
  - - [10240, 4096, 1, 8192]
    - [86, 0.0]
  - - [10240, 4352, 1, 8192]
    - [83, 0.0]
  - - [10240, 4608, 1, 8192]
    - [83, 0.0]
  - - [10240, 4864, 1, 8192]
    - [90, 0.0]
  - - [10240, 5120, 1, 8192]
    - [64, 0.0]
  - - [10240, 5376, 1, 8192]
    - [63, 0.0]
  - - [10240, 5632, 1, 8192]
    - [63, 0.0]
  - - [10240, 5888, 1, 8192]
    - [90, 0.0]
  - - [10240, 6144, 1, 8192]
    - [68, 0.0]
  - - [10240, 6400, 1, 8192]
    - [68, 0.0]
  - - [10240, 6656, 1, 8192]
    - [65, 0.0]
  - - [10240, 6912, 1, 8192]
    - [92, 0.0]
  - - [10240, 7168, 1, 8192]
    - [64, 0.0]
  - - [10240, 7424, 1, 8192]
    - [63, 0.0]
  - - [10240, 7680, 1, 8192]
    - [63, 0.0]
  - - [10240, 7936, 1, 8192]
    - [65, 0.0]
  - - [10240, 8192, 1, 8192]
    - [65, 0.0]
  - - [10240, 16, 1, 8192]
    - [188, 0.0]
  - - [10240, 32, 1, 8192]
    - [189, 0.0]
  - - [10240, 48, 1, 8192]
    - [190, 0.0]
  - - [10240, 64, 1, 8192]
    - [191, 0.0]
  - - [10240, 80, 1, 8192]
    - [192, 0.0]
  - - [10240, 96, 1, 8192]
    - [193, 0.0]
  - - [10240, 112, 1, 8192]
    - [194, 0.0]
  - - [10240, 128, 1, 8192]
    - [163, 0.0]
  - - [10240, 144, 1, 8192]
    - [160, 0.0]
  - - [10240, 160, 1, 8192]
    - [164, 0.0]
  - - [10240, 176, 1, 8192]
    - [162, 0.0]
  - - [10240, 192, 1, 8192]
    - [165, 0.0]
  - - [10240, 208, 1, 8192]
    - [164, 0.0]
  - - [10240, 224, 1, 8192]
    - [195, 0.0]
  - - [10240, 240, 1, 8192]
    - [161, 0.0]
  - - [10240, 256, 1, 8192]
    - [196, 0.0]
  - - [10240, 272, 1, 8192]
    - [197, 0.0]
  - - [10240, 288, 1, 8192]
    - [198, 0.0]
  - - [10240, 304, 1, 8192]
    - [172, 0.0]
  - - [10240, 320, 1, 8192]
    - [199, 0.0]
  - - [10240, 336, 1, 8192]
    - [200, 0.0]
  - - [10240, 352, 1, 8192]
    - [201, 0.0]
  - - [10240, 368, 1, 8192]
    - [202, 0.0]
  - - [10240, 384, 1, 8192]
    - [203, 0.0]
  - - [10240, 400, 1, 8192]
    - [204, 0.0]
  - - [10240, 416, 1, 8192]
    - [203, 0.0]
  - - [10240, 432, 1, 8192]
    - [205, 0.0]
  - - [10240, 448, 1, 8192]
    - [205, 0.0]
  - - [10240, 464, 1, 8192]
    - [206, 0.0]
  - - [10240, 480, 1, 8192]
    - [206, 0.0]
  - - [10240, 496, 1, 8192]
    - [207, 0.0]
  - - [10240, 512, 1, 8192]
    - [208, 0.0]
  - - [57344, 544, 1, 8192]
    - [209, 0.0]
  - - [57344, 576, 1, 8192]
    - [209, 0.0]
  - - [57344, 608, 1, 8192]
    - [210, 0.0]
  - - [57344, 640, 1, 8192]
    - [211, 0.0]
  - - [57344, 672, 1, 8192]
    - [212, 0.0]
  - - [57344, 704, 1, 8192]
    - [213, 0.0]
  - - [57344, 736, 1, 8192]
    - [214, 0.0]
  - - [57344, 768, 1, 8192]
    - [215, 0.0]
  - - [57344, 800, 1, 8192]
    - [216, 0.0]
  - - [57344, 832, 1, 8192]
    - [217, 0.0]
  - - [57344, 864, 1, 8192]
    - [218, 0.0]
  - - [57344, 896, 1, 8192]
    - [219, 0.0]
  - - [57344, 928, 1, 8192]
    - [220, 0.0]
  - - [57344, 960, 1, 8192]
    - [221, 0.0]
  - - [57344, 992, 1, 8192]
    - [222, 0.0]
  - - [57344, 1024, 1, 8192]
    - [223, 0.0]
  - - [57344, 1088, 1, 8192]
    - [224, 0.0]
  - - [57344, 1152, 1, 8192]
    - [225, 0.0]
  - - [57344, 1216, 1, 8192]
    - [215, 0.0]
  - - [57344, 1280, 1, 8192]
    - [215, 0.0]
  - - [57344, 1344, 1, 8192]
    - [226, 0.0]
  - - [57344, 1408, 1, 8192]
    - [227, 0.0]
  - - [57344, 1472, 1, 8192]
    - [215, 0.0]
  - - [57344, 1536, 1, 8192]
    - [215, 0.0]
  - - [57344, 1600, 1, 8192]
    - [211, 0.0]
  - - [57344, 1664, 1, 8192]
    - [223, 0.0]
  - - [57344, 1728, 1, 8192]
    - [219, 0.0]
  - - [57344, 1792, 1, 8192]
    - [228, 0.0]
  - - [57344, 1856, 1, 8192]
    - [229, 0.0]
  - - [57344, 1920, 1, 8192]
    - [229, 0.0]
  - - [57344, 1984, 1, 8192]
    - [223, 0.0]
  - - [57344, 2048, 1, 8192]
    - [230, 0.0]
  - - [57344, 2176, 1, 8192]
    - [231, 0.0]
  - - [57344, 2304, 1, 8192]
    - [232, 0.0]
  - - [57344, 2432, 1, 8192]
    - [233, 0.0]
  - - [57344, 2560, 1, 8192]
    - [234, 0.0]
  - - [57344, 2688, 1, 8192]
    - [235, 0.0]
  - - [57344, 2816, 1, 8192]
    - [234, 0.0]
  - - [57344, 2944, 1, 8192]
    - [233, 0.0]
  - - [57344, 3072, 1, 8192]
    - [230, 0.0]
  - - [57344, 3200, 1, 8192]
    - [233, 0.0]
  - - [57344, 3328, 1, 8192]
    - [233, 0.0]
  - - [57344, 3456, 1, 8192]
    - [230, 0.0]
  - - [57344, 3584, 1, 8192]
    - [233, 0.0]
  - - [57344, 3712, 1, 8192]
    - [230, 0.0]
  - - [57344, 3840, 1, 8192]
    - [232, 0.0]
  - - [57344, 3968, 1, 8192]
    - [232, 0.0]
  - - [57344, 4096, 1, 8192]
    - [232, 0.0]
  - - [57344, 16, 1, 8192]
    - [236, 0.0]
  - - [57344, 32, 1, 8192]
    - [237, 0.0]
  - - [57344, 48, 1, 8192]
    - [238, 0.0]
  - - [57344, 64, 1, 8192]
    - [239, 0.0]
  - - [57344, 80, 1, 8192]
    - [240, 0.0]
  - - [57344, 96, 1, 8192]
    - [241, 0.0]
  - - [57344, 112, 1, 8192]
    - [242, 0.0]
  - - [57344, 128, 1, 8192]
    - [243, 0.0]
  - - [57344, 144, 1, 8192]
    - [244, 0.0]
  - - [57344, 160, 1, 8192]
    - [245, 0.0]
  - - [57344, 176, 1, 8192]
    - [246, 0.0]
  - - [57344, 192, 1, 8192]
    - [247, 0.0]
  - - [57344, 208, 1, 8192]
    - [248, 0.0]
  - - [57344, 224, 1, 8192]
    - [249, 0.0]
  - - [57344, 240, 1, 8192]
    - [250, 0.0]
  - - [57344, 256, 1, 8192]
    - [251, 0.0]
  - - [57344, 272, 1, 8192]
    - [252, 0.0]
  - - [57344, 288, 1, 8192]
    - [253, 0.0]
  - - [57344, 304, 1, 8192]
    - [254, 0.0]
  - - [57344, 320, 1, 8192]
    - [255, 0.0]
  - - [57344, 336, 1, 8192]
    - [256, 0.0]
  - - [57344, 352, 1, 8192]
    - [257, 0.0]
  - - [57344, 368, 1, 8192]
    - [258, 0.0]
  - - [57344, 384, 1, 8192]
    - [258, 0.0]
  - - [57344, 400, 1, 8192]
    - [259, 0.0]
  - - [57344, 416, 1, 8192]
    - [260, 0.0]
  - - [57344, 432, 1, 8192]
    - [261, 0.0]
  - - [57344, 448, 1, 8192]
    - [262, 0.0]
  - - [57344, 464, 1, 8192]
    - [250, 0.0]
  - - [57344, 480, 1, 8192]
    - [263, 0.0]
  - - [57344, 496, 1, 8192]
    - [264, 0.0]
  - - [57344, 512, 1, 8192]
    - [264, 0.0]
  - - [57344, 4352, 1, 8192]
    - [265, 0.0]
  - - [57344, 4608, 1, 8192]
    - [266, 0.0]
  - - [57344, 4864, 1, 8192]
    - [223, 0.0]
  - - [57344, 5120, 1, 8192]
    - [223, 0.0]
  - - [57344, 5376, 1, 8192]
    - [267, 0.0]
  - - [57344, 5632, 1, 8192]
    - [268, 0.0]
  - - [57344, 5888, 1, 8192]
    - [265, 0.0]
  - - [57344, 6144, 1, 8192]
    - [265, 0.0]
  - - [57344, 6400, 1, 8192]
    - [223, 0.0]
  - - [57344, 6656, 1, 8192]
    - [228, 0.0]
  - - [57344, 6912, 1, 8192]
    - [223, 0.0]
  - - [57344, 7168, 1, 8192]
    - [265, 0.0]
  - - [57344, 7424, 1, 8192]
    - [228, 0.0]
  - - [57344, 7680, 1, 8192]
    - [269, 0.0]
  - - [57344, 7936, 1, 8192]
    - [223, 0.0]
  - - [57344, 8192, 1, 8192]
    - [219, 0.0]
  - - [57344, 8704, 1, 8192]
    - [219, 0.0]
  - - [57344, 9216, 1, 8192]
    - [223, 0.0]
  - - [57344, 9728, 1, 8192]
    - [265, 0.0]
  - - [57344, 10240, 1, 8192]
    - [228, 0.0]
  - - [57344, 10752, 1, 8192]
    - [223, 0.0]
  - - [57344, 11264, 1, 8192]
    - [223, 0.0]
  - - [57344, 11776, 1, 8192]
    - [265, 0.0]
  - - [57344, 12288, 1, 8192]
    - [223, 0.0]
  - - [57344, 12800, 1, 8192]
    - [223, 0.0]
  - - [57344, 13312, 1, 8192]
    - [219, 0.0]
  - - [57344, 13824, 1, 8192]
    - [228, 0.0]
  - - [57344, 14336, 1, 8192]
    - [223, 0.0]
  - - [57344, 14848, 1, 8192]
    - [228, 0.0]
  - - [57344, 15360, 1, 8192]
    - [223, 0.0]
  - - [57344, 15872, 1, 8192]
    - [265, 0.0]
  - - [57344, 16384, 1, 8192]
    - [219, 0.0]
  - - [57344, 16896, 1, 8192]
    - [223, 0.0]
  - - [57344, 17408, 1, 8192]
    - [265, 0.0]
  - - [57344, 17920, 1, 8192]
    - [219, 0.0]
  - - [57344, 18432, 1, 8192]
    - [228, 0.0]
  - - [57344, 18944, 1, 8192]
    - [223, 0.0]
  - - [57344, 19456, 1, 8192]
    - [228, 0.0]
  - - [57344, 19968, 1, 8192]
    - [228, 0.0]
  - - [57344, 20480, 1, 8192]
    - [265, 0.0]
  - - [57344, 20992, 1, 8192]
    - [265, 0.0]
  - - [57344, 21504, 1, 8192]
    - [265, 0.0]
  - - [57344, 22016, 1, 8192]
    - [223, 0.0]
  - - [57344, 22528, 1, 8192]
    - [265, 0.0]
  - - [57344, 23040, 1, 8192]
    - [228, 0.0]
  - - [57344, 23552, 1, 8192]
    - [228, 0.0]
  - - [57344, 24064, 1, 8192]
    - [228, 0.0]
  - - [57344, 24576, 1, 8192]
    - [228, 0.0]
  - - [57344, 25088, 1, 8192]
    - [219, 0.0]
  - - [57344, 25600, 1, 8192]
    - [223, 0.0]
  - - [57344, 26112, 1, 8192]
    - [223, 0.0]
  - - [57344, 26624, 1, 8192]
    - [265, 0.0]
  - - [57344, 27136, 1, 8192]
    - [228, 0.0]
  - - [57344, 27648, 1, 8192]
    - [228, 0.0]
  - - [57344, 28160, 1, 8192]
    - [219, 0.0]
  - - [57344, 28672, 1, 8192]
    - [219, 0.0]
  - - [57344, 29184, 1, 8192]
    - [265, 0.0]
  - - [57344, 29696, 1, 8192]
    - [219, 0.0]
  - - [57344, 30208, 1, 8192]
    - [219, 0.0]
  - - [57344, 30720, 1, 8192]
    - [219, 0.0]
  - - [2304, 8704, 1, 16384]
    - [283, 0.0]
  - - [2304, 9216, 1, 16384]
    - [284, 0.0]
  - - [2304, 9728, 1, 16384]
    - [283, 0.0]
  - - [2304, 10240, 1, 16384]
    - [285, 0.0]
  - - [2304, 10752, 1, 16384]
    - [286, 0.0]
  - - [2304, 11264, 1, 16384]
    - [286, 0.0]
  - - [2304, 11776, 1, 16384]
    - [286, 0.0]
  - - [2304, 12288, 1, 16384]
    - [286, 0.0]
  - - [2304, 12800, 1, 16384]
    - [286, 0.0]
  - - [2304, 13312, 1, 16384]
    - [287, 0.0]
  - - [2304, 13824, 1, 16384]
    - [288, 0.0]
  - - [2304, 14336, 1, 16384]
    - [289, 0.0]
  - - [2304, 14848, 1, 16384]
    - [290, 0.0]
  - - [2304, 15360, 1, 16384]
    - [290, 0.0]
  - - [2304, 15872, 1, 16384]
    - [283, 0.0]
  - - [2304, 16384, 1, 16384]
    - [291, 0.0]
  - - [2304, 16896, 1, 16384]
    - [286, 0.0]
  - - [2304, 17408, 1, 16384]
    - [286, 0.0]
  - - [2304, 17920, 1, 16384]
    - [286, 0.0]
  - - [2304, 18432, 1, 16384]
    - [286, 0.0]
  - - [2304, 18944, 1, 16384]
    - [286, 0.0]
  - - [2304, 19456, 1, 16384]
    - [286, 0.0]
  - - [2304, 19968, 1, 16384]
    - [291, 0.0]
  - - [2304, 20480, 1, 16384]
    - [291, 0.0]
  - - [2304, 20992, 1, 16384]
    - [291, 0.0]
  - - [2304, 21504, 1, 16384]
    - [291, 0.0]
  - - [2304, 22016, 1, 16384]
    - [283, 0.0]
  - - [2304, 22528, 1, 16384]
    - [286, 0.0]
  - - [2304, 23040, 1, 16384]
    - [286, 0.0]
  - - [2304, 23552, 1, 16384]
    - [286, 0.0]
  - - [2304, 24064, 1, 16384]
    - [286, 0.0]
  - - [2304, 24576, 1, 16384]
    - [292, 0.0]
  - - [2304, 25088, 1, 16384]
    - [286, 0.0]
  - - [2304, 25600, 1, 16384]
    - [286, 0.0]
  - - [2304, 26112, 1, 16384]
    - [286, 0.0]
  - - [2304, 26624, 1, 16384]
    - [283, 0.0]
  - - [2304, 27136, 1, 16384]
    - [286, 0.0]
  - - [2304, 27648, 1, 16384]
    - [286, 0.0]
  - - [2304, 28160, 1, 16384]
    - [291, 0.0]
  - - [2304, 131072, 1, 16384]
    - [286, 0.0]
  - - [2304, 2176, 1, 16384]
    - [293, 0.0]
  - - [2304, 2304, 1, 16384]
    - [293, 0.0]
  - - [2304, 2432, 1, 16384]
    - [294, 0.0]
  - - [2304, 2560, 1, 16384]
    - [283, 0.0]
  - - [2304, 2688, 1, 16384]
    - [283, 0.0]
  - - [2304, 2816, 1, 16384]
    - [283, 0.0]
  - - [2304, 2944, 1, 16384]
    - [283, 0.0]
  - - [2304, 3072, 1, 16384]
    - [283, 0.0]
  - - [2304, 3200, 1, 16384]
    - [283, 0.0]
  - - [2304, 3328, 1, 16384]
    - [295, 0.0]
  - - [2304, 3456, 1, 16384]
    - [291, 0.0]
  - - [2304, 3584, 1, 16384]
    - [291, 0.0]
  - - [2304, 3712, 1, 16384]
    - [291, 0.0]
  - - [2304, 3840, 1, 16384]
    - [291, 0.0]
  - - [2304, 3968, 1, 16384]
    - [291, 0.0]
  - - [2304, 4096, 1, 16384]
    - [291, 0.0]
  - - [2304, 4352, 1, 16384]
    - [296, 0.0]
  - - [2304, 4608, 1, 16384]
    - [297, 0.0]
  - - [2304, 4864, 1, 16384]
    - [297, 0.0]
  - - [2304, 5120, 1, 16384]
    - [285, 0.0]
  - - [2304, 5376, 1, 16384]
    - [286, 0.0]
  - - [2304, 5632, 1, 16384]
    - [286, 0.0]
  - - [2304, 5888, 1, 16384]
    - [286, 0.0]
  - - [2304, 6144, 1, 16384]
    - [286, 0.0]
  - - [2304, 6400, 1, 16384]
    - [286, 0.0]
  - - [2304, 6656, 1, 16384]
    - [287, 0.0]
  - - [2304, 6912, 1, 16384]
    - [289, 0.0]
  - - [2304, 7168, 1, 16384]
    - [289, 0.0]
  - - [2304, 7424, 1, 16384]
    - [298, 0.0]
  - - [2304, 7680, 1, 16384]
    - [298, 0.0]
  - - [2304, 7936, 1, 16384]
    - [298, 0.0]
  - - [2304, 8192, 1, 16384]
    - [283, 0.0]
  - - [2304, 476, 1, 16384]
    - [299, 0.0]
  - - [2304, 1, 1, 16384]
    - [300, 0.0]
  - - [2304, 2, 1, 16384]
    - [301, 0.0]
  - - [2304, 3, 1, 16384]
    - [302, 0.0]
  - - [2304, 4, 1, 16384]
    - [303, 0.0]
  - - [2304, 5, 1, 16384]
    - [304, 0.0]
  - - [2304, 6, 1, 16384]
    - [305, 0.0]
  - - [2304, 7, 1, 16384]
    - [306, 0.0]
  - - [2304, 8, 1, 16384]
    - [305, 0.0]
  - - [2304, 9, 1, 16384]
    - [307, 0.0]
  - - [2304, 10, 1, 16384]
    - [305, 0.0]
  - - [2304, 11, 1, 16384]
    - [308, 0.0]
  - - [2304, 12, 1, 16384]
    - [307, 0.0]
  - - [2304, 13, 1, 16384]
    - [308, 0.0]
  - - [2304, 14, 1, 16384]
    - [309, 0.0]
  - - [2304, 15, 1, 16384]
    - [308, 0.0]
  - - [2304, 16, 1, 16384]
    - [301, 0.0]
  - - [2304, 17, 1, 16384]
    - [310, 0.0]
  - - [4608, 8704, 1, 16384]
    - [311, 0.0]
  - - [4608, 9216, 1, 16384]
    - [286, 0.0]
  - - [4608, 9728, 1, 16384]
    - [286, 0.0]
  - - [4608, 10240, 1, 16384]
    - [312, 0.0]
  - - [4608, 10752, 1, 16384]
    - [291, 0.0]
  - - [4608, 11264, 1, 16384]
    - [290, 0.0]
  - - [4608, 11776, 1, 16384]
    - [290, 0.0]
  - - [4608, 12288, 1, 16384]
    - [290, 0.0]
  - - [4608, 12800, 1, 16384]
    - [286, 0.0]
  - - [4608, 13312, 1, 16384]
    - [313, 0.0]
  - - [4608, 13824, 1, 16384]
    - [312, 0.0]
  - - [4608, 14336, 1, 16384]
    - [297, 0.0]
  - - [4608, 14848, 1, 16384]
    - [291, 0.0]
  - - [4608, 15360, 1, 16384]
    - [314, 0.0]
  - - [4608, 15872, 1, 16384]
    - [286, 0.0]
  - - [4608, 16384, 1, 16384]
    - [290, 0.0]
  - - [4608, 16896, 1, 16384]
    - [283, 0.0]
  - - [4608, 17408, 1, 16384]
    - [297, 0.0]
  - - [4608, 17920, 1, 16384]
    - [291, 0.0]
  - - [4608, 18432, 1, 16384]
    - [286, 0.0]
  - - [4608, 18944, 1, 16384]
    - [283, 0.0]
  - - [4608, 19456, 1, 16384]
    - [283, 0.0]
  - - [4608, 19968, 1, 16384]
    - [298, 0.0]
  - - [4608, 20480, 1, 16384]
    - [283, 0.0]
  - - [4608, 20992, 1, 16384]
    - [290, 0.0]
  - - [4608, 21504, 1, 16384]
    - [290, 0.0]
  - - [4608, 22016, 1, 16384]
    - [283, 0.0]
  - - [4608, 22528, 1, 16384]
    - [291, 0.0]
  - - [4608, 23040, 1, 16384]
    - [286, 0.0]
  - - [4608, 23552, 1, 16384]
    - [290, 0.0]
  - - [4608, 24064, 1, 16384]
    - [290, 0.0]
  - - [4608, 24576, 1, 16384]
    - [290, 0.0]
  - - [4608, 25088, 1, 16384]
    - [283, 0.0]
  - - [4608, 25600, 1, 16384]
    - [290, 0.0]
  - - [4608, 26112, 1, 16384]
    - [283, 0.0]
  - - [4608, 26624, 1, 16384]
    - [283, 0.0]
  - - [4608, 27136, 1, 16384]
    - [283, 0.0]
  - - [4608, 27648, 1, 16384]
    - [290, 0.0]
  - - [4608, 28160, 1, 16384]
    - [286, 0.0]
  - - [4608, 28672, 1, 16384]
    - [286, 0.0]
  - - [4608, 29184, 1, 16384]
    - [290, 0.0]
  - - [4608, 29696, 1, 16384]
    - [290, 0.0]
  - - [4608, 30208, 1, 16384]
    - [290, 0.0]
  - - [4608, 30720, 1, 16384]
    - [286, 0.0]
  - - [4608, 31232, 1, 16384]
    - [290, 0.0]
  - - [4608, 31744, 1, 16384]
    - [283, 0.0]
  - - [4608, 32256, 1, 16384]
    - [286, 0.0]
  - - [4608, 32768, 1, 16384]
    - [290, 0.0]
  - - [4608, 33280, 1, 16384]
    - [286, 0.0]
  - - [4608, 33792, 1, 16384]
    - [283, 0.0]
  - - [4608, 34304, 1, 16384]
    - [290, 0.0]
  - - [4608, 34816, 1, 16384]
    - [286, 0.0]
  - - [4608, 35328, 1, 16384]
    - [286, 0.0]
  - - [4608, 35840, 1, 16384]
    - [290, 0.0]
  - - [4608, 36352, 1, 16384]
    - [290, 0.0]
  - - [4608, 36864, 1, 16384]
    - [286, 0.0]
  - - [4608, 37376, 1, 16384]
    - [286, 0.0]
  - - [4608, 37888, 1, 16384]
    - [290, 0.0]
  - - [4608, 38400, 1, 16384]
    - [290, 0.0]
  - - [4608, 38912, 1, 16384]
    - [286, 0.0]
  - - [4608, 39424, 1, 16384]
    - [286, 0.0]
  - - [4608, 39936, 1, 16384]
    - [290, 0.0]
  - - [4608, 40448, 1, 16384]
    - [286, 0.0]
  - - [4608, 40960, 1, 16384]
    - [290, 0.0]
  - - [4608, 41472, 1, 16384]
    - [290, 0.0]
  - - [4608, 41984, 1, 16384]
    - [286, 0.0]
  - - [4608, 42496, 1, 16384]
    - [290, 0.0]
  - - [4608, 43008, 1, 16384]
    - [290, 0.0]
  - - [4608, 43520, 1, 16384]
    - [283, 0.0]
  - - [4608, 44032, 1, 16384]
    - [283, 0.0]
  - - [4608, 44544, 1, 16384]
    - [286, 0.0]
  - - [4608, 45056, 1, 16384]
    - [286, 0.0]
  - - [4608, 45568, 1, 16384]
    - [290, 0.0]
  - - [4608, 46080, 1, 16384]
    - [286, 0.0]
  - - [4608, 46592, 1, 16384]
    - [290, 0.0]
  - - [4608, 47104, 1, 16384]
    - [290, 0.0]
  - - [4608, 47616, 1, 16384]
    - [286, 0.0]
  - - [4608, 48128, 1, 16384]
    - [283, 0.0]
  - - [4608, 48640, 1, 16384]
    - [286, 0.0]
  - - [4608, 49152, 1, 16384]
    - [290, 0.0]
  - - [4608, 49664, 1, 16384]
    - [290, 0.0]
  - - [4608, 50176, 1, 16384]
    - [290, 0.0]
  - - [4608, 50688, 1, 16384]
    - [290, 0.0]
  - - [4608, 51200, 1, 16384]
    - [290, 0.0]
  - - [4608, 51712, 1, 16384]
    - [290, 0.0]
  - - [4608, 52224, 1, 16384]
    - [286, 0.0]
  - - [4608, 52736, 1, 16384]
    - [283, 0.0]
  - - [4608, 53248, 1, 16384]
    - [283, 0.0]
  - - [4608, 53760, 1, 16384]
    - [286, 0.0]
  - - [4608, 54272, 1, 16384]
    - [286, 0.0]
  - - [4608, 54784, 1, 16384]
    - [286, 0.0]
  - - [4608, 55296, 1, 16384]
    - [290, 0.0]
  - - [4608, 55808, 1, 16384]
    - [290, 0.0]
  - - [4608, 56320, 1, 16384]
    - [286, 0.0]
  - - [4608, 56832, 1, 16384]
    - [286, 0.0]
  - - [4608, 57344, 1, 16384]
    - [286, 0.0]
  - - [4608, 57856, 1, 16384]
    - [290, 0.0]
  - - [4608, 58368, 1, 16384]
    - [286, 0.0]
  - - [4608, 58880, 1, 16384]
    - [290, 0.0]
  - - [4608, 59392, 1, 16384]
    - [290, 0.0]
  - - [4608, 59904, 1, 16384]
    - [290, 0.0]
  - - [4608, 60416, 1, 16384]
    - [290, 0.0]
  - - [4608, 60928, 1, 16384]
    - [283, 0.0]
  - - [4608, 61440, 1, 16384]
    - [286, 0.0]
  - - [4608, 61952, 1, 16384]
    - [290, 0.0]
  - - [4608, 62464, 1, 16384]
    - [283, 0.0]
  - - [4608, 62976, 1, 16384]
    - [290, 0.0]
  - - [4608, 63488, 1, 16384]
    - [290, 0.0]
  - - [4608, 64000, 1, 16384]
    - [290, 0.0]
  - - [4608, 64512, 1, 16384]
    - [283, 0.0]
  - - [4608, 65024, 1, 16384]
    - [283, 0.0]
  - - [4608, 65536, 1, 16384]
    - [290, 0.0]
  - - [4608, 66048, 1, 16384]
    - [290, 0.0]
  - - [4608, 66560, 1, 16384]
    - [290, 0.0]
  - - [4608, 67072, 1, 16384]
    - [290, 0.0]
  - - [4608, 67584, 1, 16384]
    - [290, 0.0]
  - - [4608, 68096, 1, 16384]
    - [286, 0.0]
  - - [4608, 68608, 1, 16384]
    - [290, 0.0]
  - - [4608, 69120, 1, 16384]
    - [290, 0.0]
  - - [4608, 69632, 1, 16384]
    - [283, 0.0]
  - - [4608, 70144, 1, 16384]
    - [286, 0.0]
  - - [4608, 70656, 1, 16384]
    - [283, 0.0]
  - - [4608, 71168, 1, 16384]
    - [290, 0.0]
  - - [4608, 71680, 1, 16384]
    - [290, 0.0]
  - - [4608, 72192, 1, 16384]
    - [283, 0.0]
  - - [4608, 72704, 1, 16384]
    - [290, 0.0]
  - - [4608, 73216, 1, 16384]
    - [290, 0.0]
  - - [4608, 73728, 1, 16384]
    - [286, 0.0]
  - - [4608, 74240, 1, 16384]
    - [286, 0.0]
  - - [4608, 74752, 1, 16384]
    - [290, 0.0]
  - - [4608, 75264, 1, 16384]
    - [290, 0.0]
  - - [4608, 75776, 1, 16384]
    - [290, 0.0]
  - - [4608, 76288, 1, 16384]
    - [286, 0.0]
  - - [4608, 76800, 1, 16384]
    - [286, 0.0]
  - - [4608, 77312, 1, 16384]
    - [290, 0.0]
  - - [4608, 77824, 1, 16384]
    - [290, 0.0]
  - - [4608, 78336, 1, 16384]
    - [290, 0.0]
  - - [4608, 78848, 1, 16384]
    - [290, 0.0]
  - - [4608, 79360, 1, 16384]
    - [290, 0.0]
  - - [4608, 79872, 1, 16384]
    - [290, 0.0]
  - - [4608, 80384, 1, 16384]
    - [290, 0.0]
  - - [4608, 80896, 1, 16384]
    - [290, 0.0]
  - - [4608, 81408, 1, 16384]
    - [290, 0.0]
  - - [4608, 81920, 1, 16384]
    - [290, 0.0]
  - - [4608, 82432, 1, 16384]
    - [290, 0.0]
  - - [4608, 82944, 1, 16384]
    - [286, 0.0]
  - - [4608, 83456, 1, 16384]
    - [286, 0.0]
  - - [4608, 83968, 1, 16384]
    - [290, 0.0]
  - - [4608, 84480, 1, 16384]
    - [290, 0.0]
  - - [4608, 84992, 1, 16384]
    - [290, 0.0]
  - - [4608, 85504, 1, 16384]
    - [290, 0.0]
  - - [4608, 86016, 1, 16384]
    - [290, 0.0]
  - - [4608, 86528, 1, 16384]
    - [286, 0.0]
  - - [4608, 87040, 1, 16384]
    - [286, 0.0]
  - - [4608, 87552, 1, 16384]
    - [286, 0.0]
  - - [4608, 88064, 1, 16384]
    - [290, 0.0]
  - - [4608, 88576, 1, 16384]
    - [290, 0.0]
  - - [4608, 89088, 1, 16384]
    - [286, 0.0]
  - - [4608, 89600, 1, 16384]
    - [290, 0.0]
  - - [4608, 90112, 1, 16384]
    - [290, 0.0]
  - - [4608, 90624, 1, 16384]
    - [290, 0.0]
  - - [4608, 91136, 1, 16384]
    - [290, 0.0]
  - - [4608, 91648, 1, 16384]
    - [286, 0.0]
  - - [4608, 92160, 1, 16384]
    - [286, 0.0]
  - - [4608, 92672, 1, 16384]
    - [290, 0.0]
  - - [4608, 93184, 1, 16384]
    - [290, 0.0]
  - - [4608, 93696, 1, 16384]
    - [290, 0.0]
  - - [4608, 94208, 1, 16384]
    - [290, 0.0]
  - - [4608, 94720, 1, 16384]
    - [290, 0.0]
  - - [4608, 95232, 1, 16384]
    - [290, 0.0]
  - - [4608, 95744, 1, 16384]
    - [286, 0.0]
  - - [4608, 96256, 1, 16384]
    - [290, 0.0]
  - - [4608, 96768, 1, 16384]
    - [290, 0.0]
  - - [4608, 97280, 1, 16384]
    - [290, 0.0]
  - - [4608, 97792, 1, 16384]
    - [290, 0.0]
  - - [4608, 98304, 1, 16384]
    - [290, 0.0]
  - - [4608, 98816, 1, 16384]
    - [290, 0.0]
  - - [4608, 99328, 1, 16384]
    - [290, 0.0]
  - - [4608, 99840, 1, 16384]
    - [286, 0.0]
  - - [4608, 100352, 1, 16384]
    - [290, 0.0]
  - - [4608, 100864, 1, 16384]
    - [290, 0.0]
  - - [4608, 101376, 1, 16384]
    - [290, 0.0]
  - - [4608, 101888, 1, 16384]
    - [290, 0.0]
  - - [4608, 102400, 1, 16384]
    - [290, 0.0]
  - - [4608, 102912, 1, 16384]
    - [290, 0.0]
  - - [4608, 103424, 1, 16384]
    - [290, 0.0]
  - - [4608, 103936, 1, 16384]
    - [290, 0.0]
  - - [4608, 104448, 1, 16384]
    - [290, 0.0]
  - - [4608, 104960, 1, 16384]
    - [286, 0.0]
  - - [4608, 105472, 1, 16384]
    - [290, 0.0]
  - - [4608, 105984, 1, 16384]
    - [290, 0.0]
  - - [4608, 106496, 1, 16384]
    - [290, 0.0]
  - - [4608, 107008, 1, 16384]
    - [290, 0.0]
  - - [4608, 107520, 1, 16384]
    - [290, 0.0]
  - - [4608, 108032, 1, 16384]
    - [290, 0.0]
  - - [4608, 108544, 1, 16384]
    - [290, 0.0]
  - - [4608, 109056, 1, 16384]
    - [286, 0.0]
  - - [4608, 109568, 1, 16384]
    - [290, 0.0]
  - - [4608, 110080, 1, 16384]
    - [290, 0.0]
  - - [4608, 110592, 1, 16384]
    - [290, 0.0]
  - - [4608, 111104, 1, 16384]
    - [290, 0.0]
  - - [4608, 111616, 1, 16384]
    - [290, 0.0]
  - - [4608, 112128, 1, 16384]
    - [290, 0.0]
  - - [4608, 112640, 1, 16384]
    - [286, 0.0]
  - - [4608, 113152, 1, 16384]
    - [286, 0.0]
  - - [4608, 113664, 1, 16384]
    - [286, 0.0]
  - - [4608, 114176, 1, 16384]
    - [290, 0.0]
  - - [4608, 114688, 1, 16384]
    - [290, 0.0]
  - - [4608, 115200, 1, 16384]
    - [290, 0.0]
  - - [4608, 115712, 1, 16384]
    - [290, 0.0]
  - - [4608, 116224, 1, 16384]
    - [290, 0.0]
  - - [4608, 116736, 1, 16384]
    - [286, 0.0]
  - - [4608, 117248, 1, 16384]
    - [290, 0.0]
  - - [4608, 117760, 1, 16384]
    - [290, 0.0]
  - - [4608, 118272, 1, 16384]
    - [290, 0.0]
  - - [4608, 118784, 1, 16384]
    - [286, 0.0]
  - - [4608, 119296, 1, 16384]
    - [290, 0.0]
  - - [4608, 119808, 1, 16384]
    - [290, 0.0]
  - - [4608, 120320, 1, 16384]
    - [290, 0.0]
  - - [4608, 120832, 1, 16384]
    - [290, 0.0]
  - - [4608, 121344, 1, 16384]
    - [286, 0.0]
  - - [4608, 121856, 1, 16384]
    - [286, 0.0]
  - - [4608, 122368, 1, 16384]
    - [286, 0.0]
  - - [4608, 122880, 1, 16384]
    - [286, 0.0]
  - - [4608, 123392, 1, 16384]
    - [290, 0.0]
  - - [4608, 123904, 1, 16384]
    - [290, 0.0]
  - - [4608, 124416, 1, 16384]
    - [290, 0.0]
  - - [4608, 124928, 1, 16384]
    - [290, 0.0]
  - - [4608, 125440, 1, 16384]
    - [286, 0.0]
  - - [4608, 125952, 1, 16384]
    - [286, 0.0]
  - - [4608, 126464, 1, 16384]
    - [286, 0.0]
  - - [4608, 126976, 1, 16384]
    - [290, 0.0]
  - - [4608, 127488, 1, 16384]
    - [290, 0.0]
  - - [4608, 128000, 1, 16384]
    - [290, 0.0]
  - - [4608, 128512, 1, 16384]
    - [290, 0.0]
  - - [4608, 129024, 1, 16384]
    - [290, 0.0]
  - - [4608, 129536, 1, 16384]
    - [290, 0.0]
  - - [4608, 130048, 1, 16384]
    - [290, 0.0]
  - - [4608, 130560, 1, 16384]
    - [290, 0.0]
  - - [4608, 131072, 1, 16384]
    - [286, 0.0]
  - - [4608, 1088, 1, 16384]
    - [293, 0.0]
  - - [4608, 1152, 1, 16384]
    - [293, 0.0]
  - - [4608, 1216, 1, 16384]
    - [294, 0.0]
  - - [4608, 1280, 1, 16384]
    - [283, 0.0]
  - - [4608, 1344, 1, 16384]
    - [283, 0.0]
  - - [4608, 1408, 1, 16384]
    - [283, 0.0]
  - - [4608, 1472, 1, 16384]
    - [283, 0.0]
  - - [4608, 1536, 1, 16384]
    - [283, 0.0]
  - - [4608, 1600, 1, 16384]
    - [295, 0.0]
  - - [4608, 1664, 1, 16384]
    - [291, 0.0]
  - - [4608, 1728, 1, 16384]
    - [291, 0.0]
  - - [4608, 1792, 1, 16384]
    - [291, 0.0]
  - - [4608, 1856, 1, 16384]
    - [315, 0.0]
  - - [4608, 1920, 1, 16384]
    - [291, 0.0]
  - - [4608, 1984, 1, 16384]
    - [291, 0.0]
  - - [4608, 2048, 1, 16384]
    - [291, 0.0]
  - - [4608, 2176, 1, 16384]
    - [316, 0.0]
  - - [4608, 2304, 1, 16384]
    - [316, 0.0]
  - - [4608, 2432, 1, 16384]
    - [297, 0.0]
  - - [4608, 2560, 1, 16384]
    - [285, 0.0]
  - - [4608, 2688, 1, 16384]
    - [286, 0.0]
  - - [4608, 2816, 1, 16384]
    - [286, 0.0]
  - - [4608, 2944, 1, 16384]
    - [286, 0.0]
  - - [4608, 3072, 1, 16384]
    - [286, 0.0]
  - - [4608, 3200, 1, 16384]
    - [286, 0.0]
  - - [4608, 3328, 1, 16384]
    - [312, 0.0]
  - - [4608, 3456, 1, 16384]
    - [312, 0.0]
  - - [4608, 3584, 1, 16384]
    - [289, 0.0]
  - - [4608, 3712, 1, 16384]
    - [290, 0.0]
  - - [4608, 3840, 1, 16384]
    - [290, 0.0]
  - - [4608, 3968, 1, 16384]
    - [290, 0.0]
  - - [4608, 4096, 1, 16384]
    - [290, 0.0]
  - - [4608, 4352, 1, 16384]
    - [284, 0.0]
  - - [4608, 4608, 1, 16384]
    - [297, 0.0]
  - - [4608, 4864, 1, 16384]
    - [283, 0.0]
  - - [4608, 5120, 1, 16384]
    - [297, 0.0]
  - - [4608, 5376, 1, 16384]
    - [286, 0.0]
  - - [4608, 5632, 1, 16384]
    - [286, 0.0]
  - - [4608, 5888, 1, 16384]
    - [286, 0.0]
  - - [4608, 6144, 1, 16384]
    - [286, 0.0]
  - - [4608, 6400, 1, 16384]
    - [286, 0.0]
  - - [4608, 6656, 1, 16384]
    - [312, 0.0]
  - - [4608, 6912, 1, 16384]
    - [312, 0.0]
  - - [4608, 7168, 1, 16384]
    - [290, 0.0]
  - - [4608, 7424, 1, 16384]
    - [290, 0.0]
  - - [4608, 7680, 1, 16384]
    - [290, 0.0]
  - - [4608, 7936, 1, 16384]
    - [290, 0.0]
  - - [4608, 8192, 1, 16384]
    - [290, 0.0]
  - - [4608, 16, 1, 16384]
    - [317, 0.0]
  - - [4608, 32, 1, 16384]
    - [318, 0.0]
  - - [4608, 48, 1, 16384]
    - [319, 0.0]
  - - [4608, 64, 1, 16384]
    - [320, 0.0]
  - - [4608, 80, 1, 16384]
    - [321, 0.0]
  - - [4608, 96, 1, 16384]
    - [322, 0.0]
  - - [4608, 112, 1, 16384]
    - [323, 0.0]
  - - [4608, 128, 1, 16384]
    - [324, 0.0]
  - - [4608, 144, 1, 16384]
    - [325, 0.0]
  - - [4608, 160, 1, 16384]
    - [326, 0.0]
  - - [4608, 176, 1, 16384]
    - [327, 0.0]
  - - [4608, 192, 1, 16384]
    - [328, 0.0]
  - - [4608, 208, 1, 16384]
    - [329, 0.0]
  - - [4608, 224, 1, 16384]
    - [329, 0.0]
  - - [4608, 240, 1, 16384]
    - [330, 0.0]
  - - [4608, 256, 1, 16384]
    - [299, 0.0]
  - - [4608, 272, 1, 16384]
    - [331, 0.0]
  - - [4608, 288, 1, 16384]
    - [332, 0.0]
  - - [4608, 304, 1, 16384]
    - [333, 0.0]
  - - [4608, 320, 1, 16384]
    - [333, 0.0]
  - - [4608, 336, 1, 16384]
    - [334, 0.0]
  - - [4608, 352, 1, 16384]
    - [335, 0.0]
  - - [4608, 368, 1, 16384]
    - [336, 0.0]
  - - [4608, 384, 1, 16384]
    - [337, 0.0]
  - - [4608, 400, 1, 16384]
    - [338, 0.0]
  - - [4608, 416, 1, 16384]
    - [338, 0.0]
  - - [4608, 432, 1, 16384]
    - [338, 0.0]
  - - [4608, 448, 1, 16384]
    - [338, 0.0]
  - - [4608, 464, 1, 16384]
    - [336, 0.0]
  - - [4608, 480, 1, 16384]
    - [339, 0.0]
  - - [4608, 496, 1, 16384]
    - [336, 0.0]
  - - [4608, 512, 1, 16384]
    - [340, 0.0]
  - - [13312, 8704, 1, 16384]
    - [290, 0.0]
  - - [13312, 9216, 1, 16384]
    - [314, 0.0]
  - - [13312, 9728, 1, 16384]
    - [290, 0.0]
  - - [13312, 10240, 1, 16384]
    - [290, 0.0]
  - - [13312, 10752, 1, 16384]
    - [290, 0.0]
  - - [13312, 11264, 1, 16384]
    - [290, 0.0]
  - - [13312, 11776, 1, 16384]
    - [290, 0.0]
  - - [13312, 12288, 1, 16384]
    - [286, 0.0]
  - - [13312, 12800, 1, 16384]
    - [290, 0.0]
  - - [13312, 13312, 1, 16384]
    - [290, 0.0]
  - - [13312, 13824, 1, 16384]
    - [290, 0.0]
  - - [13312, 14336, 1, 16384]
    - [290, 0.0]
  - - [13312, 14848, 1, 16384]
    - [290, 0.0]
  - - [13312, 15360, 1, 16384]
    - [312, 0.0]
  - - [13312, 15872, 1, 16384]
    - [290, 0.0]
  - - [13312, 16384, 1, 16384]
    - [290, 0.0]
  - - [13312, 16896, 1, 16384]
    - [290, 0.0]
  - - [13312, 17408, 1, 16384]
    - [290, 0.0]
  - - [13312, 17920, 1, 16384]
    - [290, 0.0]
  - - [13312, 18432, 1, 16384]
    - [290, 0.0]
  - - [13312, 18944, 1, 16384]
    - [290, 0.0]
  - - [13312, 19456, 1, 16384]
    - [290, 0.0]
  - - [13312, 19968, 1, 16384]
    - [290, 0.0]
  - - [13312, 20480, 1, 16384]
    - [290, 0.0]
  - - [13312, 20992, 1, 16384]
    - [286, 0.0]
  - - [13312, 21504, 1, 16384]
    - [290, 0.0]
  - - [13312, 22016, 1, 16384]
    - [312, 0.0]
  - - [13312, 22528, 1, 16384]
    - [290, 0.0]
  - - [13312, 23040, 1, 16384]
    - [290, 0.0]
  - - [13312, 23552, 1, 16384]
    - [290, 0.0]
  - - [13312, 24064, 1, 16384]
    - [312, 0.0]
  - - [13312, 24576, 1, 16384]
    - [312, 0.0]
  - - [13312, 25088, 1, 16384]
    - [286, 0.0]
  - - [13312, 25600, 1, 16384]
    - [290, 0.0]
  - - [13312, 26112, 1, 16384]
    - [312, 0.0]
  - - [13312, 26624, 1, 16384]
    - [290, 0.0]
  - - [13312, 27136, 1, 16384]
    - [312, 0.0]
  - - [13312, 27648, 1, 16384]
    - [290, 0.0]
  - - [13312, 28160, 1, 16384]
    - [290, 0.0]
  - - [13312, 131072, 1, 16384]
    - [290, 0.0]
  - - [13312, 2176, 1, 16384]
    - [286, 0.0]
  - - [13312, 2304, 1, 16384]
    - [312, 0.0]
  - - [13312, 2432, 1, 16384]
    - [312, 0.0]
  - - [13312, 2560, 1, 16384]
    - [312, 0.0]
  - - [13312, 2688, 1, 16384]
    - [297, 0.0]
  - - [13312, 2816, 1, 16384]
    - [290, 0.0]
  - - [13312, 2944, 1, 16384]
    - [290, 0.0]
  - - [13312, 3072, 1, 16384]
    - [286, 0.0]
  - - [13312, 3200, 1, 16384]
    - [286, 0.0]
  - - [13312, 3328, 1, 16384]
    - [286, 0.0]
  - - [13312, 3456, 1, 16384]
    - [297, 0.0]
  - - [13312, 3584, 1, 16384]
    - [297, 0.0]
  - - [13312, 3712, 1, 16384]
    - [283, 0.0]
  - - [13312, 3840, 1, 16384]
    - [312, 0.0]
  - - [13312, 3968, 1, 16384]
    - [290, 0.0]
  - - [13312, 4096, 1, 16384]
    - [290, 0.0]
  - - [13312, 4352, 1, 16384]
    - [290, 0.0]
  - - [13312, 4608, 1, 16384]
    - [297, 0.0]
  - - [13312, 4864, 1, 16384]
    - [312, 0.0]
  - - [13312, 5120, 1, 16384]
    - [312, 0.0]
  - - [13312, 5376, 1, 16384]
    - [290, 0.0]
  - - [13312, 5632, 1, 16384]
    - [290, 0.0]
  - - [13312, 5888, 1, 16384]
    - [290, 0.0]
  - - [13312, 6144, 1, 16384]
    - [312, 0.0]
  - - [13312, 6400, 1, 16384]
    - [297, 0.0]
  - - [13312, 6656, 1, 16384]
    - [286, 0.0]
  - - [13312, 6912, 1, 16384]
    - [290, 0.0]
  - - [13312, 7168, 1, 16384]
    - [290, 0.0]
  - - [13312, 7424, 1, 16384]
    - [290, 0.0]
  - - [13312, 7680, 1, 16384]
    - [286, 0.0]
  - - [13312, 7936, 1, 16384]
    - [297, 0.0]
  - - [13312, 8192, 1, 16384]
    - [297, 0.0]
  - - [13312, 476, 1, 16384]
    - [341, 0.0]
  - - [13312, 1, 1, 16384]
    - [342, 0.0]
  - - [13312, 2, 1, 16384]
    - [343, 0.0]
  - - [13312, 3, 1, 16384]
    - [344, 0.0]
  - - [13312, 4, 1, 16384]
    - [342, 0.0]
  - - [13312, 5, 1, 16384]
    - [343, 0.0]
  - - [13312, 6, 1, 16384]
    - [342, 0.0]
  - - [13312, 7, 1, 16384]
    - [342, 0.0]
  - - [13312, 8, 1, 16384]
    - [344, 0.0]
  - - [13312, 9, 1, 16384]
    - [342, 0.0]
  - - [13312, 10, 1, 16384]
    - [342, 0.0]
  - - [13312, 11, 1, 16384]
    - [342, 0.0]
  - - [13312, 12, 1, 16384]
    - [342, 0.0]
  - - [13312, 13, 1, 16384]
    - [342, 0.0]
  - - [13312, 14, 1, 16384]
    - [342, 0.0]
  - - [13312, 15, 1, 16384]
    - [345, 0.0]
  - - [13312, 16, 1, 16384]
    - [343, 0.0]
  - - [13312, 17, 1, 16384]
    - [346, 0.0]
  - - [16384, 8704, 1, 2048]
    - [341, 0.0]
  - - [16384, 9216, 1, 2048]
    - [283, 0.0]
  - - [16384, 9728, 1, 2048]
    - [283, 0.0]
  - - [16384, 10240, 1, 2048]
    - [341, 0.0]
  - - [16384, 10752, 1, 2048]
    - [283, 0.0]
  - - [16384, 11264, 1, 2048]
    - [347, 0.0]
  - - [16384, 11776, 1, 2048]
    - [347, 0.0]
  - - [16384, 12288, 1, 2048]
    - [341, 0.0]
  - - [16384, 12800, 1, 2048]
    - [283, 0.0]
  - - [16384, 13312, 1, 2048]
    - [283, 0.0]
  - - [16384, 13824, 1, 2048]
    - [283, 0.0]
  - - [16384, 14336, 1, 2048]
    - [283, 0.0]
  - - [16384, 14848, 1, 2048]
    - [283, 0.0]
  - - [16384, 15360, 1, 2048]
    - [283, 0.0]
  - - [16384, 15872, 1, 2048]
    - [341, 0.0]
  - - [16384, 16384, 1, 2048]
    - [341, 0.0]
  - - [16384, 16896, 1, 2048]
    - [341, 0.0]
  - - [16384, 17408, 1, 2048]
    - [341, 0.0]
  - - [16384, 17920, 1, 2048]
    - [283, 0.0]
  - - [16384, 18432, 1, 2048]
    - [283, 0.0]
  - - [16384, 18944, 1, 2048]
    - [341, 0.0]
  - - [16384, 19456, 1, 2048]
    - [283, 0.0]
  - - [16384, 19968, 1, 2048]
    - [341, 0.0]
  - - [16384, 20480, 1, 2048]
    - [341, 0.0]
  - - [16384, 20992, 1, 2048]
    - [283, 0.0]
  - - [16384, 21504, 1, 2048]
    - [283, 0.0]
  - - [16384, 22016, 1, 2048]
    - [341, 0.0]
  - - [16384, 22528, 1, 2048]
    - [283, 0.0]
  - - [16384, 23040, 1, 2048]
    - [341, 0.0]
  - - [16384, 23552, 1, 2048]
    - [341, 0.0]
  - - [16384, 24064, 1, 2048]
    - [341, 0.0]
  - - [16384, 24576, 1, 2048]
    - [283, 0.0]
  - - [16384, 25088, 1, 2048]
    - [341, 0.0]
  - - [16384, 25600, 1, 2048]
    - [341, 0.0]
  - - [16384, 26112, 1, 2048]
    - [341, 0.0]
  - - [16384, 26624, 1, 2048]
    - [341, 0.0]
  - - [16384, 27136, 1, 2048]
    - [283, 0.0]
  - - [16384, 27648, 1, 2048]
    - [341, 0.0]
  - - [16384, 28160, 1, 2048]
    - [341, 0.0]
  - - [16384, 131072, 1, 2048]
    - [283, 0.0]
  - - [16384, 2176, 1, 2048]
    - [283, 0.0]
  - - [16384, 2304, 1, 2048]
    - [293, 0.0]
  - - [16384, 2432, 1, 2048]
    - [348, 0.0]
  - - [16384, 2560, 1, 2048]
    - [283, 0.0]
  - - [16384, 2688, 1, 2048]
    - [349, 0.0]
  - - [16384, 2816, 1, 2048]
    - [283, 0.0]
  - - [16384, 2944, 1, 2048]
    - [341, 0.0]
  - - [16384, 3072, 1, 2048]
    - [347, 0.0]
  - - [16384, 3200, 1, 2048]
    - [283, 0.0]
  - - [16384, 3328, 1, 2048]
    - [283, 0.0]
  - - [16384, 3456, 1, 2048]
    - [283, 0.0]
  - - [16384, 3584, 1, 2048]
    - [294, 0.0]
  - - [16384, 3712, 1, 2048]
    - [283, 0.0]
  - - [16384, 3840, 1, 2048]
    - [341, 0.0]
  - - [16384, 3968, 1, 2048]
    - [283, 0.0]
  - - [16384, 4096, 1, 2048]
    - [283, 0.0]
  - - [16384, 4352, 1, 2048]
    - [347, 0.0]
  - - [16384, 4608, 1, 2048]
    - [283, 0.0]
  - - [16384, 4864, 1, 2048]
    - [290, 0.0]
  - - [16384, 5120, 1, 2048]
    - [349, 0.0]
  - - [16384, 5376, 1, 2048]
    - [349, 0.0]
  - - [16384, 5632, 1, 2048]
    - [283, 0.0]
  - - [16384, 5888, 1, 2048]
    - [341, 0.0]
  - - [16384, 6144, 1, 2048]
    - [341, 0.0]
  - - [16384, 6400, 1, 2048]
    - [294, 0.0]
  - - [16384, 6656, 1, 2048]
    - [283, 0.0]
  - - [16384, 6912, 1, 2048]
    - [341, 0.0]
  - - [16384, 7168, 1, 2048]
    - [341, 0.0]
  - - [16384, 7424, 1, 2048]
    - [341, 0.0]
  - - [16384, 7680, 1, 2048]
    - [283, 0.0]
  - - [16384, 7936, 1, 2048]
    - [341, 0.0]
  - - [16384, 8192, 1, 2048]
    - [341, 0.0]
  - - [16384, 476, 1, 2048]
    - [350, 0.0]
  - - [16384, 1, 1, 2048]
    - [351, 0.0]
  - - [16384, 2, 1, 2048]
    - [351, 0.0]
  - - [16384, 3, 1, 2048]
    - [352, 0.0]
  - - [16384, 4, 1, 2048]
    - [351, 0.0]
  - - [16384, 5, 1, 2048]
    - [352, 0.0]
  - - [16384, 6, 1, 2048]
    - [351, 0.0]
  - - [16384, 7, 1, 2048]
    - [352, 0.0]
  - - [16384, 8, 1, 2048]
    - [351, 0.0]
  - - [16384, 9, 1, 2048]
    - [351, 0.0]
  - - [16384, 10, 1, 2048]
    - [351, 0.0]
  - - [16384, 11, 1, 2048]
    - [351, 0.0]
  - - [16384, 12, 1, 2048]
    - [351, 0.0]
  - - [16384, 13, 1, 2048]
    - [353, 0.0]
  - - [16384, 14, 1, 2048]
    - [354, 0.0]
  - - [16384, 15, 1, 2048]
    - [351, 0.0]
  - - [16384, 16, 1, 2048]
    - [351, 0.0]
  - - [16384, 17, 1, 2048]
    - [355, 0.0]
  - - [16384, 8704, 1, 4096]
    - [314, 0.0]
  - - [16384, 9216, 1, 4096]
    - [356, 0.0]
  - - [16384, 9728, 1, 4096]
    - [290, 0.0]
  - - [16384, 10240, 1, 4096]
    - [289, 0.0]
  - - [16384, 10752, 1, 4096]
    - [290, 0.0]
  - - [16384, 11264, 1, 4096]
    - [283, 0.0]
  - - [16384, 11776, 1, 4096]
    - [283, 0.0]
  - - [16384, 12288, 1, 4096]
    - [290, 0.0]
  - - [16384, 12800, 1, 4096]
    - [283, 0.0]
  - - [16384, 13312, 1, 4096]
    - [286, 0.0]
  - - [16384, 13824, 1, 4096]
    - [283, 0.0]
  - - [16384, 14336, 1, 4096]
    - [283, 0.0]
  - - [16384, 14848, 1, 4096]
    - [341, 0.0]
  - - [16384, 15360, 1, 4096]
    - [283, 0.0]
  - - [16384, 15872, 1, 4096]
    - [357, 0.0]
  - - [16384, 16384, 1, 4096]
    - [314, 0.0]
  - - [16384, 16896, 1, 4096]
    - [290, 0.0]
  - - [16384, 17408, 1, 4096]
    - [357, 0.0]
  - - [16384, 17920, 1, 4096]
    - [357, 0.0]
  - - [16384, 18432, 1, 4096]
    - [293, 0.0]
  - - [16384, 18944, 1, 4096]
    - [283, 0.0]
  - - [16384, 19456, 1, 4096]
    - [283, 0.0]
  - - [16384, 19968, 1, 4096]
    - [348, 0.0]
  - - [16384, 20480, 1, 4096]
    - [283, 0.0]
  - - [16384, 20992, 1, 4096]
    - [312, 0.0]
  - - [16384, 21504, 1, 4096]
    - [293, 0.0]
  - - [16384, 22016, 1, 4096]
    - [283, 0.0]
  - - [16384, 22528, 1, 4096]
    - [341, 0.0]
  - - [16384, 23040, 1, 4096]
    - [341, 0.0]
  - - [16384, 23552, 1, 4096]
    - [341, 0.0]
  - - [16384, 24064, 1, 4096]
    - [283, 0.0]
  - - [16384, 24576, 1, 4096]
    - [341, 0.0]
  - - [16384, 25088, 1, 4096]
    - [283, 0.0]
  - - [16384, 25600, 1, 4096]
    - [314, 0.0]
  - - [16384, 26112, 1, 4096]
    - [290, 0.0]
  - - [16384, 26624, 1, 4096]
    - [341, 0.0]
  - - [16384, 27136, 1, 4096]
    - [341, 0.0]
  - - [16384, 27648, 1, 4096]
    - [293, 0.0]
  - - [16384, 28160, 1, 4096]
    - [341, 0.0]
  - - [16384, 28672, 1, 4096]
    - [341, 0.0]
  - - [16384, 29184, 1, 4096]
    - [290, 0.0]
  - - [16384, 29696, 1, 4096]
    - [341, 0.0]
  - - [16384, 30208, 1, 4096]
    - [298, 0.0]
  - - [16384, 30720, 1, 4096]
    - [289, 0.0]
  - - [16384, 31232, 1, 4096]
    - [290, 0.0]
  - - [16384, 31744, 1, 4096]
    - [283, 0.0]
  - - [16384, 32256, 1, 4096]
    - [356, 0.0]
  - - [16384, 32768, 1, 4096]
    - [341, 0.0]
  - - [16384, 33280, 1, 4096]
    - [298, 0.0]
  - - [16384, 33792, 1, 4096]
    - [290, 0.0]
  - - [16384, 34304, 1, 4096]
    - [283, 0.0]
  - - [16384, 34816, 1, 4096]
    - [283, 0.0]
  - - [16384, 35328, 1, 4096]
    - [283, 0.0]
  - - [16384, 35840, 1, 4096]
    - [341, 0.0]
  - - [16384, 36352, 1, 4096]
    - [283, 0.0]
  - - [16384, 36864, 1, 4096]
    - [283, 0.0]
  - - [16384, 37376, 1, 4096]
    - [298, 0.0]
  - - [16384, 37888, 1, 4096]
    - [285, 0.0]
  - - [16384, 38400, 1, 4096]
    - [290, 0.0]
  - - [16384, 38912, 1, 4096]
    - [290, 0.0]
  - - [16384, 39424, 1, 4096]
    - [341, 0.0]
  - - [16384, 39936, 1, 4096]
    - [290, 0.0]
  - - [16384, 40448, 1, 4096]
    - [298, 0.0]
  - - [16384, 40960, 1, 4096]
    - [289, 0.0]
  - - [16384, 41472, 1, 4096]
    - [341, 0.0]
  - - [16384, 41984, 1, 4096]
    - [341, 0.0]
  - - [16384, 42496, 1, 4096]
    - [283, 0.0]
  - - [16384, 43008, 1, 4096]
    - [283, 0.0]
  - - [16384, 43520, 1, 4096]
    - [341, 0.0]
  - - [16384, 44032, 1, 4096]
    - [341, 0.0]
  - - [16384, 44544, 1, 4096]
    - [341, 0.0]
  - - [16384, 45056, 1, 4096]
    - [283, 0.0]
  - - [16384, 45568, 1, 4096]
    - [283, 0.0]
  - - [16384, 46080, 1, 4096]
    - [341, 0.0]
  - - [16384, 46592, 1, 4096]
    - [341, 0.0]
  - - [16384, 47104, 1, 4096]
    - [283, 0.0]
  - - [16384, 47616, 1, 4096]
    - [283, 0.0]
  - - [16384, 48128, 1, 4096]
    - [341, 0.0]
  - - [16384, 48640, 1, 4096]
    - [341, 0.0]
  - - [16384, 49152, 1, 4096]
    - [283, 0.0]
  - - [16384, 49664, 1, 4096]
    - [341, 0.0]
  - - [16384, 50176, 1, 4096]
    - [341, 0.0]
  - - [16384, 50688, 1, 4096]
    - [289, 0.0]
  - - [16384, 51200, 1, 4096]
    - [341, 0.0]
  - - [16384, 51712, 1, 4096]
    - [283, 0.0]
  - - [16384, 52224, 1, 4096]
    - [341, 0.0]
  - - [16384, 52736, 1, 4096]
    - [283, 0.0]
  - - [16384, 53248, 1, 4096]
    - [341, 0.0]
  - - [16384, 53760, 1, 4096]
    - [341, 0.0]
  - - [16384, 54272, 1, 4096]
    - [283, 0.0]
  - - [16384, 54784, 1, 4096]
    - [341, 0.0]
  - - [16384, 55296, 1, 4096]
    - [341, 0.0]
  - - [16384, 55808, 1, 4096]
    - [341, 0.0]
  - - [16384, 56320, 1, 4096]
    - [341, 0.0]
  - - [16384, 56832, 1, 4096]
    - [285, 0.0]
  - - [16384, 57344, 1, 4096]
    - [341, 0.0]
  - - [16384, 57856, 1, 4096]
    - [341, 0.0]
  - - [16384, 58368, 1, 4096]
    - [341, 0.0]
  - - [16384, 58880, 1, 4096]
    - [283, 0.0]
  - - [16384, 59392, 1, 4096]
    - [341, 0.0]
  - - [16384, 59904, 1, 4096]
    - [341, 0.0]
  - - [16384, 60416, 1, 4096]
    - [341, 0.0]
  - - [16384, 60928, 1, 4096]
    - [341, 0.0]
  - - [16384, 61440, 1, 4096]
    - [341, 0.0]
  - - [16384, 61952, 1, 4096]
    - [341, 0.0]
  - - [16384, 62464, 1, 4096]
    - [341, 0.0]
  - - [16384, 62976, 1, 4096]
    - [341, 0.0]
  - - [16384, 63488, 1, 4096]
    - [283, 0.0]
  - - [16384, 64000, 1, 4096]
    - [341, 0.0]
  - - [16384, 64512, 1, 4096]
    - [341, 0.0]
  - - [16384, 65024, 1, 4096]
    - [341, 0.0]
  - - [16384, 65536, 1, 4096]
    - [341, 0.0]
  - - [16384, 66048, 1, 4096]
    - [341, 0.0]
  - - [16384, 66560, 1, 4096]
    - [341, 0.0]
  - - [16384, 67072, 1, 4096]
    - [341, 0.0]
  - - [16384, 67584, 1, 4096]
    - [341, 0.0]
  - - [16384, 68096, 1, 4096]
    - [341, 0.0]
  - - [16384, 68608, 1, 4096]
    - [283, 0.0]
  - - [16384, 69120, 1, 4096]
    - [283, 0.0]
  - - [16384, 69632, 1, 4096]
    - [341, 0.0]
  - - [16384, 70144, 1, 4096]
    - [341, 0.0]
  - - [16384, 70656, 1, 4096]
    - [341, 0.0]
  - - [16384, 71168, 1, 4096]
    - [341, 0.0]
  - - [16384, 71680, 1, 4096]
    - [341, 0.0]
  - - [16384, 72192, 1, 4096]
    - [341, 0.0]
  - - [16384, 72704, 1, 4096]
    - [341, 0.0]
  - - [16384, 73216, 1, 4096]
    - [341, 0.0]
  - - [16384, 73728, 1, 4096]
    - [341, 0.0]
  - - [16384, 74240, 1, 4096]
    - [341, 0.0]
  - - [16384, 74752, 1, 4096]
    - [341, 0.0]
  - - [16384, 75264, 1, 4096]
    - [341, 0.0]
  - - [16384, 75776, 1, 4096]
    - [341, 0.0]
  - - [16384, 76288, 1, 4096]
    - [283, 0.0]
  - - [16384, 76800, 1, 4096]
    - [283, 0.0]
  - - [16384, 77312, 1, 4096]
    - [290, 0.0]
  - - [16384, 77824, 1, 4096]
    - [341, 0.0]
  - - [16384, 78336, 1, 4096]
    - [341, 0.0]
  - - [16384, 78848, 1, 4096]
    - [283, 0.0]
  - - [16384, 79360, 1, 4096]
    - [298, 0.0]
  - - [16384, 79872, 1, 4096]
    - [290, 0.0]
  - - [16384, 80384, 1, 4096]
    - [290, 0.0]
  - - [16384, 80896, 1, 4096]
    - [290, 0.0]
  - - [16384, 81408, 1, 4096]
    - [283, 0.0]
  - - [16384, 81920, 1, 4096]
    - [341, 0.0]
  - - [16384, 82432, 1, 4096]
    - [289, 0.0]
  - - [16384, 82944, 1, 4096]
    - [341, 0.0]
  - - [16384, 83456, 1, 4096]
    - [290, 0.0]
  - - [16384, 83968, 1, 4096]
    - [298, 0.0]
  - - [16384, 84480, 1, 4096]
    - [341, 0.0]
  - - [16384, 84992, 1, 4096]
    - [290, 0.0]
  - - [16384, 85504, 1, 4096]
    - [298, 0.0]
  - - [16384, 86016, 1, 4096]
    - [290, 0.0]
  - - [16384, 86528, 1, 4096]
    - [341, 0.0]
  - - [16384, 87040, 1, 4096]
    - [298, 0.0]
  - - [16384, 87552, 1, 4096]
    - [290, 0.0]
  - - [16384, 88064, 1, 4096]
    - [341, 0.0]
  - - [16384, 88576, 1, 4096]
    - [289, 0.0]
  - - [16384, 89088, 1, 4096]
    - [290, 0.0]
  - - [16384, 89600, 1, 4096]
    - [312, 0.0]
  - - [16384, 90112, 1, 4096]
    - [290, 0.0]
  - - [16384, 90624, 1, 4096]
    - [290, 0.0]
  - - [16384, 91136, 1, 4096]
    - [298, 0.0]
  - - [16384, 91648, 1, 4096]
    - [289, 0.0]
  - - [16384, 92160, 1, 4096]
    - [290, 0.0]
  - - [16384, 92672, 1, 4096]
    - [289, 0.0]
  - - [16384, 93184, 1, 4096]
    - [341, 0.0]
  - - [16384, 93696, 1, 4096]
    - [341, 0.0]
  - - [16384, 94208, 1, 4096]
    - [298, 0.0]
  - - [16384, 94720, 1, 4096]
    - [290, 0.0]
  - - [16384, 95232, 1, 4096]
    - [290, 0.0]
  - - [16384, 95744, 1, 4096]
    - [290, 0.0]
  - - [16384, 96256, 1, 4096]
    - [290, 0.0]
  - - [16384, 96768, 1, 4096]
    - [289, 0.0]
  - - [16384, 97280, 1, 4096]
    - [298, 0.0]
  - - [16384, 97792, 1, 4096]
    - [290, 0.0]
  - - [16384, 98304, 1, 4096]
    - [290, 0.0]
  - - [16384, 98816, 1, 4096]
    - [290, 0.0]
  - - [16384, 99328, 1, 4096]
    - [290, 0.0]
  - - [16384, 99840, 1, 4096]
    - [312, 0.0]
  - - [16384, 100352, 1, 4096]
    - [289, 0.0]
  - - [16384, 100864, 1, 4096]
    - [290, 0.0]
  - - [16384, 101376, 1, 4096]
    - [290, 0.0]
  - - [16384, 101888, 1, 4096]
    - [290, 0.0]
  - - [16384, 102400, 1, 4096]
    - [298, 0.0]
  - - [16384, 102912, 1, 4096]
    - [290, 0.0]
  - - [16384, 103424, 1, 4096]
    - [290, 0.0]
  - - [16384, 103936, 1, 4096]
    - [289, 0.0]
  - - [16384, 104448, 1, 4096]
    - [290, 0.0]
  - - [16384, 104960, 1, 4096]
    - [290, 0.0]
  - - [16384, 105472, 1, 4096]
    - [290, 0.0]
  - - [16384, 105984, 1, 4096]
    - [290, 0.0]
  - - [16384, 106496, 1, 4096]
    - [290, 0.0]
  - - [16384, 107008, 1, 4096]
    - [290, 0.0]
  - - [16384, 107520, 1, 4096]
    - [290, 0.0]
  - - [16384, 108032, 1, 4096]
    - [290, 0.0]
  - - [16384, 108544, 1, 4096]
    - [341, 0.0]
  - - [16384, 109056, 1, 4096]
    - [298, 0.0]
  - - [16384, 109568, 1, 4096]
    - [290, 0.0]
  - - [16384, 110080, 1, 4096]
    - [298, 0.0]
  - - [16384, 110592, 1, 4096]
    - [290, 0.0]
  - - [16384, 111104, 1, 4096]
    - [290, 0.0]
  - - [16384, 111616, 1, 4096]
    - [290, 0.0]
  - - [16384, 112128, 1, 4096]
    - [289, 0.0]
  - - [16384, 112640, 1, 4096]
    - [290, 0.0]
  - - [16384, 113152, 1, 4096]
    - [290, 0.0]
  - - [16384, 113664, 1, 4096]
    - [289, 0.0]
  - - [16384, 114176, 1, 4096]
    - [298, 0.0]
  - - [16384, 114688, 1, 4096]
    - [290, 0.0]
  - - [16384, 115200, 1, 4096]
    - [290, 0.0]
  - - [16384, 115712, 1, 4096]
    - [298, 0.0]
  - - [16384, 116224, 1, 4096]
    - [290, 0.0]
  - - [16384, 116736, 1, 4096]
    - [290, 0.0]
  - - [16384, 117248, 1, 4096]
    - [290, 0.0]
  - - [16384, 117760, 1, 4096]
    - [290, 0.0]
  - - [16384, 118272, 1, 4096]
    - [298, 0.0]
  - - [16384, 118784, 1, 4096]
    - [290, 0.0]
  - - [16384, 119296, 1, 4096]
    - [290, 0.0]
  - - [16384, 119808, 1, 4096]
    - [290, 0.0]
  - - [16384, 120320, 1, 4096]
    - [298, 0.0]
  - - [16384, 120832, 1, 4096]
    - [289, 0.0]
  - - [16384, 121344, 1, 4096]
    - [290, 0.0]
  - - [16384, 121856, 1, 4096]
    - [298, 0.0]
  - - [16384, 122368, 1, 4096]
    - [290, 0.0]
  - - [16384, 122880, 1, 4096]
    - [290, 0.0]
  - - [16384, 123392, 1, 4096]
    - [289, 0.0]
  - - [16384, 123904, 1, 4096]
    - [290, 0.0]
  - - [16384, 124416, 1, 4096]
    - [290, 0.0]
  - - [16384, 124928, 1, 4096]
    - [290, 0.0]
  - - [16384, 125440, 1, 4096]
    - [290, 0.0]
  - - [16384, 125952, 1, 4096]
    - [298, 0.0]
  - - [16384, 126464, 1, 4096]
    - [290, 0.0]
  - - [16384, 126976, 1, 4096]
    - [290, 0.0]
  - - [16384, 127488, 1, 4096]
    - [290, 0.0]
  - - [16384, 128000, 1, 4096]
    - [290, 0.0]
  - - [16384, 128512, 1, 4096]
    - [290, 0.0]
  - - [16384, 129024, 1, 4096]
    - [290, 0.0]
  - - [16384, 129536, 1, 4096]
    - [298, 0.0]
  - - [16384, 130048, 1, 4096]
    - [289, 0.0]
  - - [16384, 130560, 1, 4096]
    - [290, 0.0]
  - - [16384, 131072, 1, 4096]
    - [290, 0.0]
  - - [16384, 1088, 1, 4096]
    - [290, 0.0]
  - - [16384, 1152, 1, 4096]
    - [290, 0.0]
  - - [16384, 1216, 1, 4096]
    - [341, 0.0]
  - - [16384, 1280, 1, 4096]
    - [283, 0.0]
  - - [16384, 1344, 1, 4096]
    - [341, 0.0]
  - - [16384, 1408, 1, 4096]
    - [294, 0.0]
  - - [16384, 1472, 1, 4096]
    - [293, 0.0]
  - - [16384, 1536, 1, 4096]
    - [358, 0.0]
  - - [16384, 1600, 1, 4096]
    - [341, 0.0]
  - - [16384, 1664, 1, 4096]
    - [286, 0.0]
  - - [16384, 1728, 1, 4096]
    - [341, 0.0]
  - - [16384, 1792, 1, 4096]
    - [286, 0.0]
  - - [16384, 1856, 1, 4096]
    - [287, 0.0]
  - - [16384, 1920, 1, 4096]
    - [312, 0.0]
  - - [16384, 1984, 1, 4096]
    - [288, 0.0]
  - - [16384, 2048, 1, 4096]
    - [298, 0.0]
  - - [16384, 2176, 1, 4096]
    - [298, 0.0]
  - - [16384, 2304, 1, 4096]
    - [290, 0.0]
  - - [16384, 2432, 1, 4096]
    - [290, 0.0]
  - - [16384, 2560, 1, 4096]
    - [341, 0.0]
  - - [16384, 2688, 1, 4096]
    - [359, 0.0]
  - - [16384, 2816, 1, 4096]
    - [289, 0.0]
  - - [16384, 2944, 1, 4096]
    - [289, 0.0]
  - - [16384, 3072, 1, 4096]
    - [358, 0.0]
  - - [16384, 3200, 1, 4096]
    - [286, 0.0]
  - - [16384, 3328, 1, 4096]
    - [298, 0.0]
  - - [16384, 3456, 1, 4096]
    - [290, 0.0]
  - - [16384, 3584, 1, 4096]
    - [290, 0.0]
  - - [16384, 3712, 1, 4096]
    - [297, 0.0]
  - - [16384, 3840, 1, 4096]
    - [341, 0.0]
  - - [16384, 3968, 1, 4096]
    - [289, 0.0]
  - - [16384, 4096, 1, 4096]
    - [312, 0.0]
  - - [16384, 4352, 1, 4096]
    - [286, 0.0]
  - - [16384, 4608, 1, 4096]
    - [290, 0.0]
  - - [16384, 4864, 1, 4096]
    - [290, 0.0]
  - - [16384, 5120, 1, 4096]
    - [312, 0.0]
  - - [16384, 5376, 1, 4096]
    - [286, 0.0]
  - - [16384, 5632, 1, 4096]
    - [341, 0.0]
  - - [16384, 5888, 1, 4096]
    - [290, 0.0]
  - - [16384, 6144, 1, 4096]
    - [312, 0.0]
  - - [16384, 6400, 1, 4096]
    - [298, 0.0]
  - - [16384, 6656, 1, 4096]
    - [298, 0.0]
  - - [16384, 6912, 1, 4096]
    - [290, 0.0]
  - - [16384, 7168, 1, 4096]
    - [290, 0.0]
  - - [16384, 7424, 1, 4096]
    - [283, 0.0]
  - - [16384, 7680, 1, 4096]
    - [298, 0.0]
  - - [16384, 7936, 1, 4096]
    - [290, 0.0]
  - - [16384, 8192, 1, 4096]
    - [290, 0.0]
  - - [16384, 16, 1, 4096]
    - [360, 0.0]
  - - [16384, 32, 1, 4096]
    - [361, 0.0]
  - - [16384, 48, 1, 4096]
    - [362, 0.0]
  - - [16384, 64, 1, 4096]
    - [363, 0.0]
  - - [16384, 80, 1, 4096]
    - [364, 0.0]
  - - [16384, 96, 1, 4096]
    - [365, 0.0]
  - - [16384, 112, 1, 4096]
    - [366, 0.0]
  - - [16384, 128, 1, 4096]
    - [367, 0.0]
  - - [16384, 144, 1, 4096]
    - [368, 0.0]
  - - [16384, 160, 1, 4096]
    - [364, 0.0]
  - - [16384, 176, 1, 4096]
    - [365, 0.0]
  - - [16384, 192, 1, 4096]
    - [369, 0.0]
  - - [16384, 208, 1, 4096]
    - [366, 0.0]
  - - [16384, 224, 1, 4096]
    - [366, 0.0]
  - - [16384, 240, 1, 4096]
    - [370, 0.0]
  - - [16384, 256, 1, 4096]
    - [370, 0.0]
  - - [16384, 272, 1, 4096]
    - [371, 0.0]
  - - [16384, 288, 1, 4096]
    - [372, 0.0]
  - - [16384, 304, 1, 4096]
    - [373, 0.0]
  - - [16384, 320, 1, 4096]
    - [373, 0.0]
  - - [16384, 336, 1, 4096]
    - [374, 0.0]
  - - [16384, 352, 1, 4096]
    - [375, 0.0]
  - - [16384, 368, 1, 4096]
    - [376, 0.0]
  - - [16384, 384, 1, 4096]
    - [375, 0.0]
  - - [16384, 400, 1, 4096]
    - [377, 0.0]
  - - [16384, 416, 1, 4096]
    - [378, 0.0]
  - - [16384, 432, 1, 4096]
    - [378, 0.0]
  - - [16384, 448, 1, 4096]
    - [377, 0.0]
  - - [16384, 464, 1, 4096]
    - [377, 0.0]
  - - [16384, 480, 1, 4096]
    - [377, 0.0]
  - - [16384, 496, 1, 4096]
    - [350, 0.0]
  - - [16384, 512, 1, 4096]
    - [350, 0.0]
  - - [16384, 8704, 1, 6656]
    - [312, 0.0]
  - - [16384, 9216, 1, 6656]
    - [290, 0.0]
  - - [16384, 9728, 1, 6656]
    - [290, 0.0]
  - - [16384, 10240, 1, 6656]
    - [290, 0.0]
  - - [16384, 10752, 1, 6656]
    - [290, 0.0]
  - - [16384, 11264, 1, 6656]
    - [312, 0.0]
  - - [16384, 11776, 1, 6656]
    - [285, 0.0]
  - - [16384, 12288, 1, 6656]
    - [283, 0.0]
  - - [16384, 12800, 1, 6656]
    - [283, 0.0]
  - - [16384, 13312, 1, 6656]
    - [379, 0.0]
  - - [16384, 13824, 1, 6656]
    - [314, 0.0]
  - - [16384, 14336, 1, 6656]
    - [290, 0.0]
  - - [16384, 14848, 1, 6656]
    - [283, 0.0]
  - - [16384, 15360, 1, 6656]
    - [290, 0.0]
  - - [16384, 15872, 1, 6656]
    - [380, 0.0]
  - - [16384, 16384, 1, 6656]
    - [381, 0.0]
  - - [16384, 16896, 1, 6656]
    - [290, 0.0]
  - - [16384, 17408, 1, 6656]
    - [312, 0.0]
  - - [16384, 17920, 1, 6656]
    - [289, 0.0]
  - - [16384, 18432, 1, 6656]
    - [290, 0.0]
  - - [16384, 18944, 1, 6656]
    - [289, 0.0]
  - - [16384, 19456, 1, 6656]
    - [341, 0.0]
  - - [16384, 19968, 1, 6656]
    - [290, 0.0]
  - - [16384, 20480, 1, 6656]
    - [290, 0.0]
  - - [16384, 20992, 1, 6656]
    - [290, 0.0]
  - - [16384, 21504, 1, 6656]
    - [290, 0.0]
  - - [16384, 22016, 1, 6656]
    - [290, 0.0]
  - - [16384, 22528, 1, 6656]
    - [290, 0.0]
  - - [16384, 23040, 1, 6656]
    - [290, 0.0]
  - - [16384, 23552, 1, 6656]
    - [356, 0.0]
  - - [16384, 24064, 1, 6656]
    - [290, 0.0]
  - - [16384, 24576, 1, 6656]
    - [290, 0.0]
  - - [16384, 25088, 1, 6656]
    - [290, 0.0]
  - - [16384, 25600, 1, 6656]
    - [298, 0.0]
  - - [16384, 26112, 1, 6656]
    - [290, 0.0]
  - - [16384, 26624, 1, 6656]
    - [290, 0.0]
  - - [16384, 27136, 1, 6656]
    - [290, 0.0]
  - - [16384, 27648, 1, 6656]
    - [290, 0.0]
  - - [16384, 28160, 1, 6656]
    - [283, 0.0]
  - - [16384, 131072, 1, 6656]
    - [290, 0.0]
  - - [16384, 2176, 1, 6656]
    - [298, 0.0]
  - - [16384, 2304, 1, 6656]
    - [290, 0.0]
  - - [16384, 2432, 1, 6656]
    - [290, 0.0]
  - - [16384, 2560, 1, 6656]
    - [286, 0.0]
  - - [16384, 2688, 1, 6656]
    - [286, 0.0]
  - - [16384, 2816, 1, 6656]
    - [297, 0.0]
  - - [16384, 2944, 1, 6656]
    - [288, 0.0]
  - - [16384, 3072, 1, 6656]
    - [380, 0.0]
  - - [16384, 3200, 1, 6656]
    - [298, 0.0]
  - - [16384, 3328, 1, 6656]
    - [298, 0.0]
  - - [16384, 3456, 1, 6656]
    - [381, 0.0]
  - - [16384, 3584, 1, 6656]
    - [290, 0.0]
  - - [16384, 3712, 1, 6656]
    - [297, 0.0]
  - - [16384, 3840, 1, 6656]
    - [382, 0.0]
  - - [16384, 3968, 1, 6656]
    - [382, 0.0]
  - - [16384, 4096, 1, 6656]
    - [312, 0.0]
  - - [16384, 4352, 1, 6656]
    - [314, 0.0]
  - - [16384, 4608, 1, 6656]
    - [290, 0.0]
  - - [16384, 4864, 1, 6656]
    - [290, 0.0]
  - - [16384, 5120, 1, 6656]
    - [285, 0.0]
  - - [16384, 5376, 1, 6656]
    - [349, 0.0]
  - - [16384, 5632, 1, 6656]
    - [381, 0.0]
  - - [16384, 5888, 1, 6656]
    - [290, 0.0]
  - - [16384, 6144, 1, 6656]
    - [312, 0.0]
  - - [16384, 6400, 1, 6656]
    - [356, 0.0]
  - - [16384, 6656, 1, 6656]
    - [314, 0.0]
  - - [16384, 6912, 1, 6656]
    - [381, 0.0]
  - - [16384, 7168, 1, 6656]
    - [290, 0.0]
  - - [16384, 7424, 1, 6656]
    - [298, 0.0]
  - - [16384, 7680, 1, 6656]
    - [298, 0.0]
  - - [16384, 7936, 1, 6656]
    - [290, 0.0]
  - - [16384, 8192, 1, 6656]
    - [312, 0.0]
  - - [16384, 476, 1, 6656]
    - [383, 0.0]
  - - [16384, 1, 1, 6656]
    - [342, 0.0]
  - - [16384, 2, 1, 6656]
    - [344, 0.0]
  - - [16384, 3, 1, 6656]
    - [384, 0.0]
  - - [16384, 4, 1, 6656]
    - [344, 0.0]
  - - [16384, 5, 1, 6656]
    - [344, 0.0]
  - - [16384, 6, 1, 6656]
    - [344, 0.0]
  - - [16384, 7, 1, 6656]
    - [344, 0.0]
  - - [16384, 8, 1, 6656]
    - [342, 0.0]
  - - [16384, 9, 1, 6656]
    - [344, 0.0]
  - - [16384, 10, 1, 6656]
    - [344, 0.0]
  - - [16384, 11, 1, 6656]
    - [344, 0.0]
  - - [16384, 12, 1, 6656]
    - [344, 0.0]
  - - [16384, 13, 1, 6656]
    - [342, 0.0]
  - - [16384, 14, 1, 6656]
    - [344, 0.0]
  - - [16384, 15, 1, 6656]
    - [344, 0.0]
  - - [16384, 16, 1, 6656]
    - [344, 0.0]
  - - [16384, 17, 1, 6656]
    - [346, 0.0]
  - - [16384, 8704, 1, 13312]
    - [288, 0.0]
  - - [16384, 9216, 1, 13312]
    - [380, 0.0]
  - - [16384, 9728, 1, 13312]
    - [286, 0.0]
  - - [16384, 10240, 1, 13312]
    - [349, 0.0]
  - - [16384, 10752, 1, 13312]
    - [349, 0.0]
  - - [16384, 11264, 1, 13312]
    - [286, 0.0]
  - - [16384, 11776, 1, 13312]
    - [314, 0.0]
  - - [16384, 12288, 1, 13312]
    - [314, 0.0]
  - - [16384, 12800, 1, 13312]
    - [381, 0.0]
  - - [16384, 13312, 1, 13312]
    - [314, 0.0]
  - - [16384, 13824, 1, 13312]
    - [296, 0.0]
  - - [16384, 14336, 1, 13312]
    - [290, 0.0]
  - - [16384, 14848, 1, 13312]
    - [311, 0.0]
  - - [16384, 15360, 1, 13312]
    - [359, 0.0]
  - - [16384, 15872, 1, 13312]
    - [381, 0.0]
  - - [16384, 16384, 1, 13312]
    - [314, 0.0]
  - - [16384, 16896, 1, 13312]
    - [298, 0.0]
  - - [16384, 17408, 1, 13312]
    - [381, 0.0]
  - - [16384, 17920, 1, 13312]
    - [298, 0.0]
  - - [16384, 18432, 1, 13312]
    - [341, 0.0]
  - - [16384, 18944, 1, 13312]
    - [314, 0.0]
  - - [16384, 19456, 1, 13312]
    - [290, 0.0]
  - - [16384, 19968, 1, 13312]
    - [359, 0.0]
  - - [16384, 20480, 1, 13312]
    - [290, 0.0]
  - - [16384, 20992, 1, 13312]
    - [381, 0.0]
  - - [16384, 21504, 1, 13312]
    - [290, 0.0]
  - - [16384, 22016, 1, 13312]
    - [314, 0.0]
  - - [16384, 22528, 1, 13312]
    - [290, 0.0]
  - - [16384, 23040, 1, 13312]
    - [290, 0.0]
  - - [16384, 23552, 1, 13312]
    - [381, 0.0]
  - - [16384, 24064, 1, 13312]
    - [290, 0.0]
  - - [16384, 24576, 1, 13312]
    - [314, 0.0]
  - - [16384, 25088, 1, 13312]
    - [288, 0.0]
  - - [16384, 25600, 1, 13312]
    - [298, 0.0]
  - - [16384, 26112, 1, 13312]
    - [290, 0.0]
  - - [16384, 26624, 1, 13312]
    - [314, 0.0]
  - - [16384, 27136, 1, 13312]
    - [290, 0.0]
  - - [16384, 27648, 1, 13312]
    - [298, 0.0]
  - - [16384, 28160, 1, 13312]
    - [312, 0.0]
  - - [16384, 28672, 1, 13312]
    - [380, 0.0]
  - - [16384, 29184, 1, 13312]
    - [290, 0.0]
  - - [16384, 29696, 1, 13312]
    - [290, 0.0]
  - - [16384, 30208, 1, 13312]
    - [290, 0.0]
  - - [16384, 30720, 1, 13312]
    - [314, 0.0]
  - - [16384, 31232, 1, 13312]
    - [314, 0.0]
  - - [16384, 31744, 1, 13312]
    - [289, 0.0]
  - - [16384, 32256, 1, 13312]
    - [298, 0.0]
  - - [16384, 32768, 1, 13312]
    - [298, 0.0]
  - - [16384, 33280, 1, 13312]
    - [298, 0.0]
  - - [16384, 33792, 1, 13312]
    - [290, 0.0]
  - - [16384, 34304, 1, 13312]
    - [314, 0.0]
  - - [16384, 34816, 1, 13312]
    - [289, 0.0]
  - - [16384, 35328, 1, 13312]
    - [380, 0.0]
  - - [16384, 35840, 1, 13312]
    - [314, 0.0]
  - - [16384, 36352, 1, 13312]
    - [290, 0.0]
  - - [16384, 36864, 1, 13312]
    - [314, 0.0]
  - - [16384, 37376, 1, 13312]
    - [314, 0.0]
  - - [16384, 37888, 1, 13312]
    - [290, 0.0]
  - - [16384, 38400, 1, 13312]
    - [298, 0.0]
  - - [16384, 38912, 1, 13312]
    - [314, 0.0]
  - - [16384, 39424, 1, 13312]
    - [298, 0.0]
  - - [16384, 39936, 1, 13312]
    - [298, 0.0]
  - - [16384, 40448, 1, 13312]
    - [290, 0.0]
  - - [16384, 40960, 1, 13312]
    - [290, 0.0]
  - - [16384, 41472, 1, 13312]
    - [314, 0.0]
  - - [16384, 41984, 1, 13312]
    - [314, 0.0]
  - - [16384, 42496, 1, 13312]
    - [290, 0.0]
  - - [16384, 43008, 1, 13312]
    - [298, 0.0]
  - - [16384, 43520, 1, 13312]
    - [290, 0.0]
  - - [16384, 44032, 1, 13312]
    - [290, 0.0]
  - - [16384, 44544, 1, 13312]
    - [290, 0.0]
  - - [16384, 45056, 1, 13312]
    - [298, 0.0]
  - - [16384, 45568, 1, 13312]
    - [314, 0.0]
  - - [16384, 46080, 1, 13312]
    - [290, 0.0]
  - - [16384, 46592, 1, 13312]
    - [380, 0.0]
  - - [16384, 47104, 1, 13312]
    - [298, 0.0]
  - - [16384, 47616, 1, 13312]
    - [349, 0.0]
  - - [16384, 48128, 1, 13312]
    - [314, 0.0]
  - - [16384, 48640, 1, 13312]
    - [290, 0.0]
  - - [16384, 49152, 1, 13312]
    - [314, 0.0]
  - - [16384, 49664, 1, 13312]
    - [298, 0.0]
  - - [16384, 50176, 1, 13312]
    - [314, 0.0]
  - - [16384, 50688, 1, 13312]
    - [290, 0.0]
  - - [16384, 51200, 1, 13312]
    - [381, 0.0]
  - - [16384, 51712, 1, 13312]
    - [290, 0.0]
  - - [16384, 52224, 1, 13312]
    - [290, 0.0]
  - - [16384, 52736, 1, 13312]
    - [298, 0.0]
  - - [16384, 53248, 1, 13312]
    - [290, 0.0]
  - - [16384, 53760, 1, 13312]
    - [298, 0.0]
  - - [16384, 54272, 1, 13312]
    - [290, 0.0]
  - - [16384, 54784, 1, 13312]
    - [314, 0.0]
  - - [16384, 55296, 1, 13312]
    - [290, 0.0]
  - - [16384, 55808, 1, 13312]
    - [290, 0.0]
  - - [16384, 56320, 1, 13312]
    - [290, 0.0]
  - - [16384, 56832, 1, 13312]
    - [290, 0.0]
  - - [16384, 57344, 1, 13312]
    - [290, 0.0]
  - - [16384, 57856, 1, 13312]
    - [290, 0.0]
  - - [16384, 58368, 1, 13312]
    - [289, 0.0]
  - - [16384, 58880, 1, 13312]
    - [349, 0.0]
  - - [16384, 59392, 1, 13312]
    - [290, 0.0]
  - - [16384, 59904, 1, 13312]
    - [381, 0.0]
  - - [16384, 60416, 1, 13312]
    - [314, 0.0]
  - - [16384, 60928, 1, 13312]
    - [314, 0.0]
  - - [16384, 61440, 1, 13312]
    - [314, 0.0]
  - - [16384, 61952, 1, 13312]
    - [290, 0.0]
  - - [16384, 62464, 1, 13312]
    - [314, 0.0]
  - - [16384, 62976, 1, 13312]
    - [290, 0.0]
  - - [16384, 63488, 1, 13312]
    - [314, 0.0]
  - - [16384, 64000, 1, 13312]
    - [290, 0.0]
  - - [16384, 64512, 1, 13312]
    - [314, 0.0]
  - - [16384, 65024, 1, 13312]
    - [314, 0.0]
  - - [16384, 65536, 1, 13312]
    - [314, 0.0]
  - - [16384, 66048, 1, 13312]
    - [298, 0.0]
  - - [16384, 66560, 1, 13312]
    - [290, 0.0]
  - - [16384, 67072, 1, 13312]
    - [314, 0.0]
  - - [16384, 67584, 1, 13312]
    - [298, 0.0]
  - - [16384, 68096, 1, 13312]
    - [379, 0.0]
  - - [16384, 68608, 1, 13312]
    - [314, 0.0]
  - - [16384, 69120, 1, 13312]
    - [349, 0.0]
  - - [16384, 69632, 1, 13312]
    - [290, 0.0]
  - - [16384, 70144, 1, 13312]
    - [290, 0.0]
  - - [16384, 70656, 1, 13312]
    - [314, 0.0]
  - - [16384, 71168, 1, 13312]
    - [298, 0.0]
  - - [16384, 71680, 1, 13312]
    - [289, 0.0]
  - - [16384, 72192, 1, 13312]
    - [314, 0.0]
  - - [16384, 72704, 1, 13312]
    - [314, 0.0]
  - - [16384, 73216, 1, 13312]
    - [289, 0.0]
  - - [16384, 73728, 1, 13312]
    - [290, 0.0]
  - - [16384, 74240, 1, 13312]
    - [314, 0.0]
  - - [16384, 74752, 1, 13312]
    - [314, 0.0]
  - - [16384, 75264, 1, 13312]
    - [290, 0.0]
  - - [16384, 75776, 1, 13312]
    - [314, 0.0]
  - - [16384, 76288, 1, 13312]
    - [289, 0.0]
  - - [16384, 76800, 1, 13312]
    - [314, 0.0]
  - - [16384, 77312, 1, 13312]
    - [314, 0.0]
  - - [16384, 77824, 1, 13312]
    - [290, 0.0]
  - - [16384, 78336, 1, 13312]
    - [314, 0.0]
  - - [16384, 78848, 1, 13312]
    - [314, 0.0]
  - - [16384, 79360, 1, 13312]
    - [289, 0.0]
  - - [16384, 79872, 1, 13312]
    - [290, 0.0]
  - - [16384, 80384, 1, 13312]
    - [289, 0.0]
  - - [16384, 80896, 1, 13312]
    - [290, 0.0]
  - - [16384, 81408, 1, 13312]
    - [314, 0.0]
  - - [16384, 81920, 1, 13312]
    - [379, 0.0]
  - - [16384, 82432, 1, 13312]
    - [290, 0.0]
  - - [16384, 82944, 1, 13312]
    - [314, 0.0]
  - - [16384, 83456, 1, 13312]
    - [349, 0.0]
  - - [16384, 83968, 1, 13312]
    - [314, 0.0]
  - - [16384, 84480, 1, 13312]
    - [290, 0.0]
  - - [16384, 84992, 1, 13312]
    - [290, 0.0]
  - - [16384, 85504, 1, 13312]
    - [290, 0.0]
  - - [16384, 86016, 1, 13312]
    - [289, 0.0]
  - - [16384, 86528, 1, 13312]
    - [349, 0.0]
  - - [16384, 87040, 1, 13312]
    - [289, 0.0]
  - - [16384, 87552, 1, 13312]
    - [349, 0.0]
  - - [16384, 88064, 1, 13312]
    - [380, 0.0]
  - - [16384, 88576, 1, 13312]
    - [379, 0.0]
  - - [16384, 89088, 1, 13312]
    - [349, 0.0]
  - - [16384, 89600, 1, 13312]
    - [314, 0.0]
  - - [16384, 90112, 1, 13312]
    - [349, 0.0]
  - - [16384, 90624, 1, 13312]
    - [314, 0.0]
  - - [16384, 91136, 1, 13312]
    - [379, 0.0]
  - - [16384, 91648, 1, 13312]
    - [314, 0.0]
  - - [16384, 92160, 1, 13312]
    - [290, 0.0]
  - - [16384, 92672, 1, 13312]
    - [314, 0.0]
  - - [16384, 93184, 1, 13312]
    - [290, 0.0]
  - - [16384, 93696, 1, 13312]
    - [349, 0.0]
  - - [16384, 94208, 1, 13312]
    - [314, 0.0]
  - - [16384, 94720, 1, 13312]
    - [314, 0.0]
  - - [16384, 95232, 1, 13312]
    - [314, 0.0]
  - - [16384, 95744, 1, 13312]
    - [290, 0.0]
  - - [16384, 96256, 1, 13312]
    - [349, 0.0]
  - - [16384, 96768, 1, 13312]
    - [289, 0.0]
  - - [16384, 97280, 1, 13312]
    - [314, 0.0]
  - - [16384, 97792, 1, 13312]
    - [289, 0.0]
  - - [16384, 98304, 1, 13312]
    - [314, 0.0]
  - - [16384, 98816, 1, 13312]
    - [381, 0.0]
  - - [16384, 99328, 1, 13312]
    - [381, 0.0]
  - - [16384, 99840, 1, 13312]
    - [314, 0.0]
  - - [16384, 100352, 1, 13312]
    - [314, 0.0]
  - - [16384, 100864, 1, 13312]
    - [314, 0.0]
  - - [16384, 101376, 1, 13312]
    - [290, 0.0]
  - - [16384, 101888, 1, 13312]
    - [349, 0.0]
  - - [16384, 102400, 1, 13312]
    - [379, 0.0]
  - - [16384, 102912, 1, 13312]
    - [289, 0.0]
  - - [16384, 103424, 1, 13312]
    - [349, 0.0]
  - - [16384, 103936, 1, 13312]
    - [289, 0.0]
  - - [16384, 104448, 1, 13312]
    - [290, 0.0]
  - - [16384, 104960, 1, 13312]
    - [290, 0.0]
  - - [16384, 105472, 1, 13312]
    - [290, 0.0]
  - - [16384, 105984, 1, 13312]
    - [349, 0.0]
  - - [16384, 106496, 1, 13312]
    - [349, 0.0]
  - - [16384, 107008, 1, 13312]
    - [290, 0.0]
  - - [16384, 107520, 1, 13312]
    - [314, 0.0]
  - - [16384, 108032, 1, 13312]
    - [314, 0.0]
  - - [16384, 108544, 1, 13312]
    - [314, 0.0]
  - - [16384, 109056, 1, 13312]
    - [349, 0.0]
  - - [16384, 109568, 1, 13312]
    - [289, 0.0]
  - - [16384, 110080, 1, 13312]
    - [290, 0.0]
  - - [16384, 110592, 1, 13312]
    - [290, 0.0]
  - - [16384, 111104, 1, 13312]
    - [349, 0.0]
  - - [16384, 111616, 1, 13312]
    - [290, 0.0]
  - - [16384, 112128, 1, 13312]
    - [349, 0.0]
  - - [16384, 112640, 1, 13312]
    - [290, 0.0]
  - - [16384, 113152, 1, 13312]
    - [314, 0.0]
  - - [16384, 113664, 1, 13312]
    - [290, 0.0]
  - - [16384, 114176, 1, 13312]
    - [290, 0.0]
  - - [16384, 114688, 1, 13312]
    - [349, 0.0]
  - - [16384, 115200, 1, 13312]
    - [290, 0.0]
  - - [16384, 115712, 1, 13312]
    - [349, 0.0]
  - - [16384, 116224, 1, 13312]
    - [290, 0.0]
  - - [16384, 116736, 1, 13312]
    - [314, 0.0]
  - - [16384, 117248, 1, 13312]
    - [290, 0.0]
  - - [16384, 117760, 1, 13312]
    - [289, 0.0]
  - - [16384, 118272, 1, 13312]
    - [349, 0.0]
  - - [16384, 118784, 1, 13312]
    - [289, 0.0]
  - - [16384, 119296, 1, 13312]
    - [349, 0.0]
  - - [16384, 119808, 1, 13312]
    - [349, 0.0]
  - - [16384, 120320, 1, 13312]
    - [290, 0.0]
  - - [16384, 120832, 1, 13312]
    - [289, 0.0]
  - - [16384, 121344, 1, 13312]
    - [290, 0.0]
  - - [16384, 121856, 1, 13312]
    - [349, 0.0]
  - - [16384, 122368, 1, 13312]
    - [290, 0.0]
  - - [16384, 122880, 1, 13312]
    - [379, 0.0]
  - - [16384, 123392, 1, 13312]
    - [289, 0.0]
  - - [16384, 123904, 1, 13312]
    - [349, 0.0]
  - - [16384, 124416, 1, 13312]
    - [314, 0.0]
  - - [16384, 124928, 1, 13312]
    - [290, 0.0]
  - - [16384, 125440, 1, 13312]
    - [349, 0.0]
  - - [16384, 125952, 1, 13312]
    - [290, 0.0]
  - - [16384, 126464, 1, 13312]
    - [290, 0.0]
  - - [16384, 126976, 1, 13312]
    - [349, 0.0]
  - - [16384, 127488, 1, 13312]
    - [289, 0.0]
  - - [16384, 128000, 1, 13312]
    - [349, 0.0]
  - - [16384, 128512, 1, 13312]
    - [381, 0.0]
  - - [16384, 129024, 1, 13312]
    - [314, 0.0]
  - - [16384, 129536, 1, 13312]
    - [314, 0.0]
  - - [16384, 130048, 1, 13312]
    - [290, 0.0]
  - - [16384, 130560, 1, 13312]
    - [289, 0.0]
  - - [16384, 131072, 1, 13312]
    - [349, 0.0]
  - - [16384, 1088, 1, 13312]
    - [381, 0.0]
  - - [16384, 1152, 1, 13312]
    - [381, 0.0]
  - - [16384, 1216, 1, 13312]
    - [296, 0.0]
  - - [16384, 1280, 1, 13312]
    - [297, 0.0]
  - - [16384, 1344, 1, 13312]
    - [284, 0.0]
  - - [16384, 1408, 1, 13312]
    - [285, 0.0]
  - - [16384, 1472, 1, 13312]
    - [358, 0.0]
  - - [16384, 1536, 1, 13312]
    - [385, 0.0]
  - - [16384, 1600, 1, 13312]
    - [356, 0.0]
  - - [16384, 1664, 1, 13312]
    - [349, 0.0]
  - - [16384, 1728, 1, 13312]
    - [349, 0.0]
  - - [16384, 1792, 1, 13312]
    - [386, 0.0]
  - - [16384, 1856, 1, 13312]
    - [387, 0.0]
  - - [16384, 1920, 1, 13312]
    - [288, 0.0]
  - - [16384, 1984, 1, 13312]
    - [288, 0.0]
  - - [16384, 2048, 1, 13312]
    - [380, 0.0]
  - - [16384, 2176, 1, 13312]
    - [298, 0.0]
  - - [16384, 2304, 1, 13312]
    - [290, 0.0]
  - - [16384, 2432, 1, 13312]
    - [290, 0.0]
  - - [16384, 2560, 1, 13312]
    - [292, 0.0]
  - - [16384, 2688, 1, 13312]
    - [349, 0.0]
  - - [16384, 2816, 1, 13312]
    - [382, 0.0]
  - - [16384, 2944, 1, 13312]
    - [288, 0.0]
  - - [16384, 3072, 1, 13312]
    - [380, 0.0]
  - - [16384, 3200, 1, 13312]
    - [311, 0.0]
  - - [16384, 3328, 1, 13312]
    - [298, 0.0]
  - - [16384, 3456, 1, 13312]
    - [381, 0.0]
  - - [16384, 3584, 1, 13312]
    - [290, 0.0]
  - - [16384, 3712, 1, 13312]
    - [287, 0.0]
  - - [16384, 3840, 1, 13312]
    - [382, 0.0]
  - - [16384, 3968, 1, 13312]
    - [382, 0.0]
  - - [16384, 4096, 1, 13312]
    - [380, 0.0]
  - - [16384, 4352, 1, 13312]
    - [381, 0.0]
  - - [16384, 4608, 1, 13312]
    - [290, 0.0]
  - - [16384, 4864, 1, 13312]
    - [290, 0.0]
  - - [16384, 5120, 1, 13312]
    - [349, 0.0]
  - - [16384, 5376, 1, 13312]
    - [356, 0.0]
  - - [16384, 5632, 1, 13312]
    - [311, 0.0]
  - - [16384, 5888, 1, 13312]
    - [288, 0.0]
  - - [16384, 6144, 1, 13312]
    - [382, 0.0]
  - - [16384, 6400, 1, 13312]
    - [285, 0.0]
  - - [16384, 6656, 1, 13312]
    - [311, 0.0]
  - - [16384, 6912, 1, 13312]
    - [381, 0.0]
  - - [16384, 7168, 1, 13312]
    - [312, 0.0]
  - - [16384, 7424, 1, 13312]
    - [285, 0.0]
  - - [16384, 7680, 1, 13312]
    - [298, 0.0]
  - - [16384, 7936, 1, 13312]
    - [381, 0.0]
  - - [16384, 8192, 1, 13312]
    - [290, 0.0]
  - - [16384, 16, 1, 13312]
    - [342, 0.0]
  - - [16384, 32, 1, 13312]
    - [346, 0.0]
  - - [16384, 48, 1, 13312]
    - [388, 0.0]
  - - [16384, 64, 1, 13312]
    - [389, 0.0]
  - - [16384, 80, 1, 13312]
    - [390, 0.0]
  - - [16384, 96, 1, 13312]
    - [391, 0.0]
  - - [16384, 112, 1, 13312]
    - [392, 0.0]
  - - [16384, 128, 1, 13312]
    - [392, 0.0]
  - - [16384, 144, 1, 13312]
    - [390, 0.0]
  - - [16384, 160, 1, 13312]
    - [390, 0.0]
  - - [16384, 176, 1, 13312]
    - [393, 0.0]
  - - [16384, 192, 1, 13312]
    - [393, 0.0]
  - - [16384, 208, 1, 13312]
    - [394, 0.0]
  - - [16384, 224, 1, 13312]
    - [394, 0.0]
  - - [16384, 240, 1, 13312]
    - [395, 0.0]
  - - [16384, 256, 1, 13312]
    - [396, 0.0]
  - - [16384, 272, 1, 13312]
    - [397, 0.0]
  - - [16384, 288, 1, 13312]
    - [293, 0.0]
  - - [16384, 304, 1, 13312]
    - [294, 0.0]
  - - [16384, 320, 1, 13312]
    - [294, 0.0]
  - - [16384, 336, 1, 13312]
    - [341, 0.0]
  - - [16384, 352, 1, 13312]
    - [341, 0.0]
  - - [16384, 368, 1, 13312]
    - [341, 0.0]
  - - [16384, 384, 1, 13312]
    - [341, 0.0]
  - - [16384, 400, 1, 13312]
    - [398, 0.0]
  - - [16384, 416, 1, 13312]
    - [399, 0.0]
  - - [16384, 432, 1, 13312]
    - [295, 0.0]
  - - [16384, 448, 1, 13312]
    - [295, 0.0]
  - - [16384, 464, 1, 13312]
    - [315, 0.0]
  - - [16384, 480, 1, 13312]
    - [400, 0.0]
  - - [16384, 496, 1, 13312]
    - [291, 0.0]
  - - [16384, 512, 1, 13312]
    - [291, 0.0]
  - - [26624, 8704, 1, 16384]
    - [290, 0.0]
  - - [26624, 9216, 1, 16384]
    - [290, 0.0]
  - - [26624, 9728, 1, 16384]
    - [290, 0.0]
  - - [26624, 10240, 1, 16384]
    - [290, 0.0]
  - - [26624, 10752, 1, 16384]
    - [290, 0.0]
  - - [26624, 11264, 1, 16384]
    - [290, 0.0]
  - - [26624, 11776, 1, 16384]
    - [290, 0.0]
  - - [26624, 12288, 1, 16384]
    - [312, 0.0]
  - - [26624, 12800, 1, 16384]
    - [290, 0.0]
  - - [26624, 13312, 1, 16384]
    - [290, 0.0]
  - - [26624, 13824, 1, 16384]
    - [290, 0.0]
  - - [26624, 14336, 1, 16384]
    - [290, 0.0]
  - - [26624, 14848, 1, 16384]
    - [290, 0.0]
  - - [26624, 15360, 1, 16384]
    - [290, 0.0]
  - - [26624, 15872, 1, 16384]
    - [312, 0.0]
  - - [26624, 16384, 1, 16384]
    - [290, 0.0]
  - - [26624, 16896, 1, 16384]
    - [290, 0.0]
  - - [26624, 17408, 1, 16384]
    - [290, 0.0]
  - - [26624, 17920, 1, 16384]
    - [312, 0.0]
  - - [26624, 18432, 1, 16384]
    - [312, 0.0]
  - - [26624, 18944, 1, 16384]
    - [290, 0.0]
  - - [26624, 19456, 1, 16384]
    - [290, 0.0]
  - - [26624, 19968, 1, 16384]
    - [312, 0.0]
  - - [26624, 20480, 1, 16384]
    - [290, 0.0]
  - - [26624, 20992, 1, 16384]
    - [290, 0.0]
  - - [26624, 21504, 1, 16384]
    - [290, 0.0]
  - - [26624, 22016, 1, 16384]
    - [290, 0.0]
  - - [26624, 22528, 1, 16384]
    - [290, 0.0]
  - - [26624, 23040, 1, 16384]
    - [290, 0.0]
  - - [26624, 23552, 1, 16384]
    - [290, 0.0]
  - - [26624, 24064, 1, 16384]
    - [290, 0.0]
  - - [26624, 24576, 1, 16384]
    - [290, 0.0]
  - - [26624, 25088, 1, 16384]
    - [312, 0.0]
  - - [26624, 25600, 1, 16384]
    - [290, 0.0]
  - - [26624, 26112, 1, 16384]
    - [290, 0.0]
  - - [26624, 26624, 1, 16384]
    - [290, 0.0]
  - - [26624, 27136, 1, 16384]
    - [290, 0.0]
  - - [26624, 27648, 1, 16384]
    - [312, 0.0]
  - - [26624, 28160, 1, 16384]
    - [290, 0.0]
  - - [26624, 28672, 1, 16384]
    - [290, 0.0]
  - - [26624, 29184, 1, 16384]
    - [290, 0.0]
  - - [26624, 29696, 1, 16384]
    - [290, 0.0]
  - - [26624, 30208, 1, 16384]
    - [290, 0.0]
  - - [26624, 30720, 1, 16384]
    - [290, 0.0]
  - - [26624, 31232, 1, 16384]
    - [290, 0.0]
  - - [26624, 31744, 1, 16384]
    - [290, 0.0]
  - - [26624, 32256, 1, 16384]
    - [290, 0.0]
  - - [26624, 32768, 1, 16384]
    - [312, 0.0]
  - - [26624, 33280, 1, 16384]
    - [290, 0.0]
  - - [26624, 33792, 1, 16384]
    - [290, 0.0]
  - - [26624, 34304, 1, 16384]
    - [290, 0.0]
  - - [26624, 34816, 1, 16384]
    - [290, 0.0]
  - - [26624, 35328, 1, 16384]
    - [290, 0.0]
  - - [26624, 35840, 1, 16384]
    - [290, 0.0]
  - - [26624, 36352, 1, 16384]
    - [290, 0.0]
  - - [26624, 36864, 1, 16384]
    - [290, 0.0]
  - - [26624, 37376, 1, 16384]
    - [290, 0.0]
  - - [26624, 37888, 1, 16384]
    - [290, 0.0]
  - - [26624, 38400, 1, 16384]
    - [290, 0.0]
  - - [26624, 38912, 1, 16384]
    - [290, 0.0]
  - - [26624, 39424, 1, 16384]
    - [290, 0.0]
  - - [26624, 39936, 1, 16384]
    - [290, 0.0]
  - - [26624, 40448, 1, 16384]
    - [290, 0.0]
  - - [26624, 40960, 1, 16384]
    - [290, 0.0]
  - - [26624, 41472, 1, 16384]
    - [290, 0.0]
  - - [26624, 41984, 1, 16384]
    - [290, 0.0]
  - - [26624, 42496, 1, 16384]
    - [290, 0.0]
  - - [26624, 43008, 1, 16384]
    - [290, 0.0]
  - - [26624, 43520, 1, 16384]
    - [312, 0.0]
  - - [26624, 44032, 1, 16384]
    - [290, 0.0]
  - - [26624, 44544, 1, 16384]
    - [290, 0.0]
  - - [26624, 45056, 1, 16384]
    - [290, 0.0]
  - - [26624, 45568, 1, 16384]
    - [290, 0.0]
  - - [26624, 46080, 1, 16384]
    - [290, 0.0]
  - - [26624, 46592, 1, 16384]
    - [290, 0.0]
  - - [26624, 47104, 1, 16384]
    - [290, 0.0]
  - - [26624, 47616, 1, 16384]
    - [290, 0.0]
  - - [26624, 48128, 1, 16384]
    - [290, 0.0]
  - - [26624, 48640, 1, 16384]
    - [290, 0.0]
  - - [26624, 49152, 1, 16384]
    - [290, 0.0]
  - - [26624, 49664, 1, 16384]
    - [290, 0.0]
  - - [26624, 50176, 1, 16384]
    - [290, 0.0]
  - - [26624, 50688, 1, 16384]
    - [290, 0.0]
  - - [26624, 51200, 1, 16384]
    - [290, 0.0]
  - - [26624, 51712, 1, 16384]
    - [290, 0.0]
  - - [26624, 52224, 1, 16384]
    - [290, 0.0]
  - - [26624, 52736, 1, 16384]
    - [290, 0.0]
  - - [26624, 53248, 1, 16384]
    - [290, 0.0]
  - - [26624, 53760, 1, 16384]
    - [290, 0.0]
  - - [26624, 54272, 1, 16384]
    - [290, 0.0]
  - - [26624, 54784, 1, 16384]
    - [290, 0.0]
  - - [26624, 55296, 1, 16384]
    - [290, 0.0]
  - - [26624, 55808, 1, 16384]
    - [290, 0.0]
  - - [26624, 56320, 1, 16384]
    - [290, 0.0]
  - - [26624, 56832, 1, 16384]
    - [290, 0.0]
  - - [26624, 57344, 1, 16384]
    - [290, 0.0]
  - - [26624, 57856, 1, 16384]
    - [286, 0.0]
  - - [26624, 58368, 1, 16384]
    - [312, 0.0]
  - - [26624, 58880, 1, 16384]
    - [290, 0.0]
  - - [26624, 59392, 1, 16384]
    - [290, 0.0]
  - - [26624, 59904, 1, 16384]
    - [290, 0.0]
  - - [26624, 60416, 1, 16384]
    - [290, 0.0]
  - - [26624, 60928, 1, 16384]
    - [290, 0.0]
  - - [26624, 61440, 1, 16384]
    - [312, 0.0]
  - - [26624, 61952, 1, 16384]
    - [290, 0.0]
  - - [26624, 62464, 1, 16384]
    - [290, 0.0]
  - - [26624, 62976, 1, 16384]
    - [290, 0.0]
  - - [26624, 63488, 1, 16384]
    - [290, 0.0]
  - - [26624, 64000, 1, 16384]
    - [290, 0.0]
  - - [26624, 64512, 1, 16384]
    - [290, 0.0]
  - - [26624, 65024, 1, 16384]
    - [290, 0.0]
  - - [26624, 65536, 1, 16384]
    - [290, 0.0]
  - - [26624, 66048, 1, 16384]
    - [290, 0.0]
  - - [26624, 66560, 1, 16384]
    - [312, 0.0]
  - - [26624, 67072, 1, 16384]
    - [312, 0.0]
  - - [26624, 67584, 1, 16384]
    - [290, 0.0]
  - - [26624, 68096, 1, 16384]
    - [290, 0.0]
  - - [26624, 68608, 1, 16384]
    - [312, 0.0]
  - - [26624, 69120, 1, 16384]
    - [290, 0.0]
  - - [26624, 69632, 1, 16384]
    - [312, 0.0]
  - - [26624, 70144, 1, 16384]
    - [290, 0.0]
  - - [26624, 70656, 1, 16384]
    - [290, 0.0]
  - - [26624, 71168, 1, 16384]
    - [290, 0.0]
  - - [26624, 71680, 1, 16384]
    - [290, 0.0]
  - - [26624, 72192, 1, 16384]
    - [290, 0.0]
  - - [26624, 72704, 1, 16384]
    - [290, 0.0]
  - - [26624, 73216, 1, 16384]
    - [312, 0.0]
  - - [26624, 73728, 1, 16384]
    - [290, 0.0]
  - - [26624, 74240, 1, 16384]
    - [312, 0.0]
  - - [26624, 74752, 1, 16384]
    - [290, 0.0]
  - - [26624, 75264, 1, 16384]
    - [290, 0.0]
  - - [26624, 75776, 1, 16384]
    - [312, 0.0]
  - - [26624, 76288, 1, 16384]
    - [290, 0.0]
  - - [26624, 76800, 1, 16384]
    - [290, 0.0]
  - - [26624, 77312, 1, 16384]
    - [290, 0.0]
  - - [26624, 77824, 1, 16384]
    - [290, 0.0]
  - - [26624, 78336, 1, 16384]
    - [290, 0.0]
  - - [26624, 78848, 1, 16384]
    - [290, 0.0]
  - - [26624, 79360, 1, 16384]
    - [290, 0.0]
  - - [26624, 79872, 1, 16384]
    - [290, 0.0]
  - - [26624, 80384, 1, 16384]
    - [290, 0.0]
  - - [26624, 80896, 1, 16384]
    - [286, 0.0]
  - - [26624, 81408, 1, 16384]
    - [290, 0.0]
  - - [26624, 81920, 1, 16384]
    - [290, 0.0]
  - - [26624, 82432, 1, 16384]
    - [290, 0.0]
  - - [26624, 82944, 1, 16384]
    - [290, 0.0]
  - - [26624, 83456, 1, 16384]
    - [290, 0.0]
  - - [26624, 83968, 1, 16384]
    - [290, 0.0]
  - - [26624, 84480, 1, 16384]
    - [290, 0.0]
  - - [26624, 84992, 1, 16384]
    - [312, 0.0]
  - - [26624, 85504, 1, 16384]
    - [290, 0.0]
  - - [26624, 86016, 1, 16384]
    - [290, 0.0]
  - - [26624, 86528, 1, 16384]
    - [290, 0.0]
  - - [26624, 87040, 1, 16384]
    - [290, 0.0]
  - - [26624, 87552, 1, 16384]
    - [290, 0.0]
  - - [26624, 88064, 1, 16384]
    - [290, 0.0]
  - - [26624, 88576, 1, 16384]
    - [312, 0.0]
  - - [26624, 89088, 1, 16384]
    - [290, 0.0]
  - - [26624, 89600, 1, 16384]
    - [290, 0.0]
  - - [26624, 90112, 1, 16384]
    - [290, 0.0]
  - - [26624, 90624, 1, 16384]
    - [290, 0.0]
  - - [26624, 91136, 1, 16384]
    - [290, 0.0]
  - - [26624, 91648, 1, 16384]
    - [290, 0.0]
  - - [26624, 92160, 1, 16384]
    - [286, 0.0]
  - - [26624, 92672, 1, 16384]
    - [290, 0.0]
  - - [26624, 93184, 1, 16384]
    - [290, 0.0]
  - - [26624, 93696, 1, 16384]
    - [290, 0.0]
  - - [26624, 94208, 1, 16384]
    - [290, 0.0]
  - - [26624, 94720, 1, 16384]
    - [290, 0.0]
  - - [26624, 95232, 1, 16384]
    - [290, 0.0]
  - - [26624, 95744, 1, 16384]
    - [290, 0.0]
  - - [26624, 96256, 1, 16384]
    - [290, 0.0]
  - - [26624, 96768, 1, 16384]
    - [290, 0.0]
  - - [26624, 97280, 1, 16384]
    - [290, 0.0]
  - - [26624, 97792, 1, 16384]
    - [290, 0.0]
  - - [26624, 98304, 1, 16384]
    - [312, 0.0]
  - - [26624, 98816, 1, 16384]
    - [312, 0.0]
  - - [26624, 99328, 1, 16384]
    - [290, 0.0]
  - - [26624, 99840, 1, 16384]
    - [290, 0.0]
  - - [26624, 100352, 1, 16384]
    - [290, 0.0]
  - - [26624, 100864, 1, 16384]
    - [290, 0.0]
  - - [26624, 101376, 1, 16384]
    - [290, 0.0]
  - - [26624, 101888, 1, 16384]
    - [290, 0.0]
  - - [26624, 102400, 1, 16384]
    - [290, 0.0]
  - - [26624, 102912, 1, 16384]
    - [312, 0.0]
  - - [26624, 103424, 1, 16384]
    - [290, 0.0]
  - - [26624, 103936, 1, 16384]
    - [290, 0.0]
  - - [26624, 104448, 1, 16384]
    - [290, 0.0]
  - - [26624, 104960, 1, 16384]
    - [290, 0.0]
  - - [26624, 105472, 1, 16384]
    - [290, 0.0]
  - - [26624, 105984, 1, 16384]
    - [290, 0.0]
  - - [26624, 106496, 1, 16384]
    - [290, 0.0]
  - - [26624, 107008, 1, 16384]
    - [290, 0.0]
  - - [26624, 107520, 1, 16384]
    - [290, 0.0]
  - - [26624, 108032, 1, 16384]
    - [312, 0.0]
  - - [26624, 108544, 1, 16384]
    - [290, 0.0]
  - - [26624, 109056, 1, 16384]
    - [290, 0.0]
  - - [26624, 109568, 1, 16384]
    - [312, 0.0]
  - - [26624, 110080, 1, 16384]
    - [290, 0.0]
  - - [26624, 110592, 1, 16384]
    - [312, 0.0]
  - - [26624, 111104, 1, 16384]
    - [290, 0.0]
  - - [26624, 111616, 1, 16384]
    - [290, 0.0]
  - - [26624, 112128, 1, 16384]
    - [312, 0.0]
  - - [26624, 112640, 1, 16384]
    - [290, 0.0]
  - - [26624, 113152, 1, 16384]
    - [312, 0.0]
  - - [26624, 113664, 1, 16384]
    - [290, 0.0]
  - - [26624, 114176, 1, 16384]
    - [290, 0.0]
  - - [26624, 114688, 1, 16384]
    - [290, 0.0]
  - - [26624, 115200, 1, 16384]
    - [290, 0.0]
  - - [26624, 115712, 1, 16384]
    - [290, 0.0]
  - - [26624, 116224, 1, 16384]
    - [290, 0.0]
  - - [26624, 116736, 1, 16384]
    - [290, 0.0]
  - - [26624, 117248, 1, 16384]
    - [290, 0.0]
  - - [26624, 117760, 1, 16384]
    - [290, 0.0]
  - - [26624, 118272, 1, 16384]
    - [290, 0.0]
  - - [26624, 118784, 1, 16384]
    - [312, 0.0]
  - - [26624, 119296, 1, 16384]
    - [312, 0.0]
  - - [26624, 119808, 1, 16384]
    - [290, 0.0]
  - - [26624, 120320, 1, 16384]
    - [290, 0.0]
  - - [26624, 120832, 1, 16384]
    - [312, 0.0]
  - - [26624, 121344, 1, 16384]
    - [290, 0.0]
  - - [26624, 121856, 1, 16384]
    - [312, 0.0]
  - - [26624, 122368, 1, 16384]
    - [290, 0.0]
  - - [26624, 122880, 1, 16384]
    - [290, 0.0]
  - - [26624, 123392, 1, 16384]
    - [290, 0.0]
  - - [26624, 123904, 1, 16384]
    - [290, 0.0]
  - - [26624, 124416, 1, 16384]
    - [312, 0.0]
  - - [26624, 124928, 1, 16384]
    - [312, 0.0]
  - - [26624, 125440, 1, 16384]
    - [290, 0.0]
  - - [26624, 125952, 1, 16384]
    - [290, 0.0]
  - - [26624, 126464, 1, 16384]
    - [290, 0.0]
  - - [26624, 126976, 1, 16384]
    - [290, 0.0]
  - - [26624, 127488, 1, 16384]
    - [290, 0.0]
  - - [26624, 128000, 1, 16384]
    - [290, 0.0]
  - - [26624, 128512, 1, 16384]
    - [290, 0.0]
  - - [26624, 129024, 1, 16384]
    - [312, 0.0]
  - - [26624, 129536, 1, 16384]
    - [290, 0.0]
  - - [26624, 130048, 1, 16384]
    - [290, 0.0]
  - - [26624, 130560, 1, 16384]
    - [290, 0.0]
  - - [26624, 131072, 1, 16384]
    - [312, 0.0]
  - - [26624, 1088, 1, 16384]
    - [387, 0.0]
  - - [26624, 1152, 1, 16384]
    - [316, 0.0]
  - - [26624, 1216, 1, 16384]
    - [312, 0.0]
  - - [26624, 1280, 1, 16384]
    - [312, 0.0]
  - - [26624, 1344, 1, 16384]
    - [314, 0.0]
  - - [26624, 1408, 1, 16384]
    - [290, 0.0]
  - - [26624, 1472, 1, 16384]
    - [286, 0.0]
  - - [26624, 1536, 1, 16384]
    - [286, 0.0]
  - - [26624, 1600, 1, 16384]
    - [283, 0.0]
  - - [26624, 1664, 1, 16384]
    - [286, 0.0]
  - - [26624, 1728, 1, 16384]
    - [312, 0.0]
  - - [26624, 1792, 1, 16384]
    - [312, 0.0]
  - - [26624, 1856, 1, 16384]
    - [312, 0.0]
  - - [26624, 1920, 1, 16384]
    - [312, 0.0]
  - - [26624, 1984, 1, 16384]
    - [290, 0.0]
  - - [26624, 2048, 1, 16384]
    - [290, 0.0]
  - - [26624, 2176, 1, 16384]
    - [290, 0.0]
  - - [26624, 2304, 1, 16384]
    - [297, 0.0]
  - - [26624, 2432, 1, 16384]
    - [312, 0.0]
  - - [26624, 2560, 1, 16384]
    - [312, 0.0]
  - - [26624, 2688, 1, 16384]
    - [314, 0.0]
  - - [26624, 2816, 1, 16384]
    - [290, 0.0]
  - - [26624, 2944, 1, 16384]
    - [290, 0.0]
  - - [26624, 3072, 1, 16384]
    - [312, 0.0]
  - - [26624, 3200, 1, 16384]
    - [297, 0.0]
  - - [26624, 3328, 1, 16384]
    - [286, 0.0]
  - - [26624, 3456, 1, 16384]
    - [290, 0.0]
  - - [26624, 3584, 1, 16384]
    - [290, 0.0]
  - - [26624, 3712, 1, 16384]
    - [290, 0.0]
  - - [26624, 3840, 1, 16384]
    - [312, 0.0]
  - - [26624, 3968, 1, 16384]
    - [291, 0.0]
  - - [26624, 4096, 1, 16384]
    - [290, 0.0]
  - - [26624, 4352, 1, 16384]
    - [290, 0.0]
  - - [26624, 4608, 1, 16384]
    - [297, 0.0]
  - - [26624, 4864, 1, 16384]
    - [286, 0.0]
  - - [26624, 5120, 1, 16384]
    - [290, 0.0]
  - - [26624, 5376, 1, 16384]
    - [286, 0.0]
  - - [26624, 5632, 1, 16384]
    - [290, 0.0]
  - - [26624, 5888, 1, 16384]
    - [290, 0.0]
  - - [26624, 6144, 1, 16384]
    - [290, 0.0]
  - - [26624, 6400, 1, 16384]
    - [290, 0.0]
  - - [26624, 6656, 1, 16384]
    - [297, 0.0]
  - - [26624, 6912, 1, 16384]
    - [314, 0.0]
  - - [26624, 7168, 1, 16384]
    - [290, 0.0]
  - - [26624, 7424, 1, 16384]
    - [290, 0.0]
  - - [26624, 7680, 1, 16384]
    - [312, 0.0]
  - - [26624, 7936, 1, 16384]
    - [290, 0.0]
  - - [26624, 8192, 1, 16384]
    - [290, 0.0]
  - - [26624, 16, 1, 16384]
    - [401, 0.0]
  - - [26624, 32, 1, 16384]
    - [402, 0.0]
  - - [26624, 48, 1, 16384]
    - [388, 0.0]
  - - [26624, 64, 1, 16384]
    - [389, 0.0]
  - - [26624, 80, 1, 16384]
    - [390, 0.0]
  - - [26624, 96, 1, 16384]
    - [391, 0.0]
  - - [26624, 112, 1, 16384]
    - [394, 0.0]
  - - [26624, 128, 1, 16384]
    - [348, 0.0]
  - - [26624, 144, 1, 16384]
    - [294, 0.0]
  - - [26624, 160, 1, 16384]
    - [395, 0.0]
  - - [26624, 176, 1, 16384]
    - [397, 0.0]
  - - [26624, 192, 1, 16384]
    - [293, 0.0]
  - - [26624, 208, 1, 16384]
    - [398, 0.0]
  - - [26624, 224, 1, 16384]
    - [291, 0.0]
  - - [26624, 240, 1, 16384]
    - [291, 0.0]
  - - [26624, 256, 1, 16384]
    - [291, 0.0]
  - - [26624, 272, 1, 16384]
    - [400, 0.0]
  - - [26624, 288, 1, 16384]
    - [403, 0.0]
  - - [26624, 304, 1, 16384]
    - [404, 0.0]
  - - [26624, 320, 1, 16384]
    - [400, 0.0]
  - - [26624, 336, 1, 16384]
    - [297, 0.0]
  - - [26624, 352, 1, 16384]
    - [313, 0.0]
  - - [26624, 368, 1, 16384]
    - [297, 0.0]
  - - [26624, 384, 1, 16384]
    - [297, 0.0]
  - - [26624, 400, 1, 16384]
    - [405, 0.0]
  - - [26624, 416, 1, 16384]
    - [406, 0.0]
  - - [26624, 432, 1, 16384]
    - [407, 0.0]
  - - [26624, 448, 1, 16384]
    - [386, 0.0]
  - - [26624, 464, 1, 16384]
    - [286, 0.0]
  - - [26624, 480, 1, 16384]
    - [286, 0.0]
  - - [26624, 496, 1, 16384]
    - [286, 0.0]
  - - [26624, 512, 1, 16384]
    - [286, 0.0]
- null
- null
- DeviceEfficiency
- GridBased
