projects/hipblaslt/library/src/amd_detail/rocblaslt/src/Tensile/Logic/asm_full/aquavanjaram/gfx942/GridBased/aquavanjaram_Cijk_Ailk_Bljk_ZB_UserArgs.yaml
- {MinimumRequiredVersion: 5.0.0}
- aquavanjaram
- gfx942
- [Device 0049, Device 0050]
    SolutionIndex: 0
    SolutionNameMin: Cijk_Ailk_Bljk_ZB_UserArgs_MT64x64x8_MI16x16x4x1_SN_1LDSB1_GLS0_LBSPP0_LPB1_ONLL1_PGR2_PLR1_SU32_SUS128_TT1_64_TLDS0_UMLDSB0_WG64_4_1_WGM36
    SolutionIndex: 1
    SolutionNameMin: Cijk_Ailk_Bljk_ZB_UserArgs_MT64x64x8_MI16x16x4x1_SN_1LDSB1_GLS1_LBSPP0_LPB1_ONLL0_PGR2_PLR3_SU0_SUS0_TT1_64_TLDS0_UMLDSB0_WG64_4_1_WGM24
    SolutionIndex: 2
    SolutionNameMin: Cijk_Ailk_Bljk_ZB_UserArgs_MT64x64x8_MI16x16x4x1_SN_1LDSB1_GLS1_LBSPP128_LPB2_ONLL0_PGR1_PLR1_SU32_SUS256_TT1_64_TLDS1_UMLDSB1_WG64_4_1_WGM24
    SolutionIndex: 3
    SolutionNameMin: Cijk_Ailk_Bljk_ZB_UserArgs_MT64x64x8_MI16x16x4x1_SN_1LDSB1_GLS1_LBSPP128_LPB2_ONLL1_PGR1_PLR3_SU32_SUS256_TT1_64_TLDS1_UMLDSB1_WG64_4_1_WGM24
    SolutionIndex: 4
    SolutionNameMin: Cijk_Ailk_Bljk_ZB_UserArgs_MT64x64x8_MI16x16x4x1_SN_1LDSB1_GLS1_LBSPP128_LPB2_ONLL0_PGR1_PLR1_SU32_SUS256_TT1_64_TLDS1_UMLDSB1_WG64_4_1_WGM30
    SolutionIndex: 5
    SolutionNameMin: Cijk_Ailk_Bljk_ZB_UserArgs_MT64x64x8_MI16x16x4x1_SN_1LDSB1_GLS1_LBSPP0_LPB1_ONLL1_PGR2_PLR3_SU32_SUS128_TT1_64_TLDS0_UMLDSB0_WG64_4_1_WGM36
    SolutionIndex: 6
    SolutionNameMin: Cijk_Ailk_Bljk_ZB_UserArgs_MT64x64x8_MI16x16x4x1_SN_1LDSB1_GLS1_LBSPP0_LPB1_ONLL2_PGR2_PLR3_SU32_SUS256_TT1_64_TLDS0_UMLDSB0_WG64_4_1_WGM36
    SolutionIndex: 7
    SolutionNameMin: Cijk_Ailk_Bljk_ZB_UserArgs_MT16x16x8_MI16x16x4x1_SN_DTVA0_LPB1_PLR3_SU32_SUS128_TT1_16_WG16_4_1
    SolutionIndex: 8
    SolutionNameMin: Cijk_Ailk_Bljk_ZB_UserArgs_MT16x16x16_MI16x16x4x1_SN_DTVA0_LPB1_PLR5_SU0_SUS0_TT1_16_WG16_4_1
    SolutionIndex: 9
    SolutionNameMin: Cijk_Ailk_Bljk_ZB_UserArgs_MT32x16x16_MI16x16x4x1_SN_DTVA0_LPB1_PLR5_SU0_SUS0_TT1_16_WG32_4_1
    SolutionIndex: 10
    SolutionNameMin: Cijk_Ailk_Bljk_ZB_UserArgs_MT64x16x16_MI16x16x4x1_SN_DTVA1_LPB2_PLR5_SU0_SUS0_TT1_16_WG64_4_1
    SolutionIndex: 11
    SolutionNameMin: Cijk_Ailk_Bljk_ZB_UserArgs_MT64x16x16_MI16x16x4x1_SN_DTVA0_LPB1_PLR5_SU0_SUS0_TT1_16_WG64_4_1
    SolutionIndex: 12
    SolutionNameMin: Cijk_Ailk_Bljk_ZB_UserArgs_MT64x16x16_MI16x16x4x1_SN_DTVA1_LPB1_PLR5_SU0_SUS0_TT1_16_WG64_4_1
    SolutionIndex: 13
    SolutionNameMin: Cijk_Ailk_Bljk_ZB_UserArgs_MT32x16x16_MI16x16x4x1_SN_DTVA1_LPB2_PLR5_SU0_SUS0_TT1_16_WG32_4_1
    SolutionIndex: 14
    SolutionNameMin: Cijk_Ailk_Bljk_ZB_UserArgs_MT64x32x16_MI16x16x4x1_SN_DTVA1_LPB1_PLR5_SU0_SUS0_TT1_32_WG64_4_1
    SolutionIndex: 15
    SolutionNameMin: Cijk_Ailk_Bljk_ZB_UserArgs_MT64x32x16_MI16x16x4x1_SN_DTVA1_LPB2_PLR5_SU0_SUS0_TT1_32_WG64_4_1
    SolutionIndex: 16
    SolutionNameMin: Cijk_Ailk_Bljk_ZB_UserArgs_MT64x32x8_MI16x16x4x1_SN_DTVA1_LPB1_PLR3_SU32_SUS128_TT1_32_WG64_4_1
    SolutionIndex: 17
    SolutionNameMin: Cijk_Ailk_Bljk_ZB_UserArgs_MT64x48x16_MI16x16x4x1_SN_DTVA1_LPB2_PLR5_SU0_SUS0_TT1_48_WG64_4_1
    SolutionIndex: 18
    SolutionNameMin: Cijk_Ailk_Bljk_ZB_UserArgs_MT64x16x16_MI16x16x4x1_SN_1LDSB1_LPB2_PLR5_SU32_SUS256_TT1_16_TLDS1_UMLDSB1_WGM12
    SolutionIndex: 19
    SolutionNameMin: Cijk_Ailk_Bljk_ZB_UserArgs_MT64x16x16_MI16x16x4x1_SN_1LDSB0_LPB2_PLR5_SU0_SUS0_TT1_16_TLDS1_UMLDSB1_WGM18
    SolutionIndex: 20
    SolutionNameMin: Cijk_Ailk_Bljk_ZB_UserArgs_MT64x16x16_MI16x16x4x1_SN_1LDSB0_LPB1_PLR5_SU0_SUS0_TT1_16_TLDS0_UMLDSB0_WGM12
    SolutionIndex: 21
    SolutionNameMin: Cijk_Ailk_Bljk_ZB_UserArgs_MT64x16x16_MI16x16x4x1_SN_1LDSB1_LPB1_PLR5_SU32_SUS256_TT1_16_TLDS0_UMLDSB0_WGM12
    SolutionIndex: 22
    SolutionNameMin: Cijk_Ailk_Bljk_ZB_UserArgs_MT64x32x8_MI16x16x4x1_SN_1LDSB0_LPB2_PLR3_SU0_SUS0_TT1_32_TLDS1_UMLDSB1_WGM12
    SolutionIndex: 23
    SolutionNameMin: Cijk_Ailk_Bljk_ZB_UserArgs_MT64x16x16_MI16x16x4x1_SN_1LDSB1_LPB1_PLR5_SU0_SUS0_TT1_16_TLDS0_UMLDSB0_WGM12
    SolutionIndex: 24
    SolutionNameMin: Cijk_Ailk_Bljk_ZB_UserArgs_MT64x64x8_MI16x16x4x1_SN_1LDSB1_LPB2_PLR3_SU32_SUS256_TT1_64_TLDS1_UMLDSB1_WGM1
    SolutionIndex: 25
    SolutionNameMin: Cijk_Ailk_Bljk_ZB_UserArgs_MT64x32x16_MI16x16x4x1_SN_1LDSB1_LPB2_NLCA1_PLR1_SU0_SUS0_TT1_32_TLDS1_UMLDSB1_WGM1
    SolutionIndex: 26
    SolutionNameMin: Cijk_Ailk_Bljk_ZB_UserArgs_MT64x32x16_MI16x16x4x1_SN_1LDSB1_LPB1_PLR5_SU0_SUS0_TT1_32_TLDS0_UMLDSB0_WGM12
    SolutionIndex: 27
    SolutionNameMin: Cijk_Ailk_Bljk_ZB_UserArgs_MT64x32x16_MI16x16x4x1_SN_1LDSB1_LPB2_PLR5_SU0_SUS0_TT1_32_TLDS1_UMLDSB1_WGM18
    SolutionIndex: 28
    SolutionNameMin: Cijk_Ailk_Bljk_ZB_UserArgs_MT64x48x16_MI16x16x4x1_SN_1LDSB1_LPB1_PLR5_SU0_SUS0_TT1_48_TLDS0_UMLDSB0_WGM1
    SolutionIndex: 29
    SolutionNameMin: Cijk_Ailk_Bljk_ZB_UserArgs_MT64x48x16_MI16x16x4x1_SN_1LDSB1_LPB1_PLR5_SU32_SUS256_TT1_48_TLDS0_UMLDSB0_WGM1
    SolutionIndex: 30
    SolutionNameMin: Cijk_Ailk_Bljk_ZB_UserArgs_MT64x32x8_MI16x16x4x1_SN_1LDSB0_LPB1_PLR3_SU0_SUS0_TT1_32_TLDS0_UMLDSB0_WGM12
    SolutionIndex: 31
    SolutionNameMin: Cijk_Ailk_Bljk_ZB_UserArgs_MT64x32x8_MI16x16x4x1_SN_1LDSB1_LPB2_PLR3_SU32_SUS128_TT1_32_TLDS1_UMLDSB1_WGM1
    SolutionIndex: 32
    SolutionNameMin: Cijk_Ailk_Bljk_ZB_UserArgs_MT64x32x8_MI16x16x4x1_SN_1LDSB1_LPB2_PLR3_SU0_SUS0_TT1_32_TLDS1_UMLDSB1_WGM1
    SolutionIndex: 33
    SolutionNameMin: Cijk_Ailk_Bljk_ZB_UserArgs_MT64x64x16_MI16x16x4x1_SN_1LDSB1_LPB2_NLCA1_PLR1_SU0_SUS0_TT1_64_TLDS1_UMLDSB1_WGM36
    SolutionIndex: 34
    SolutionNameMin: Cijk_Ailk_Bljk_ZB_UserArgs_MT64x64x8_MI16x16x4x1_SN_1LDSB1_LPB2_PLR3_SU32_SUS256_TT1_64_TLDS1_UMLDSB1_WGM12
    SolutionIndex: 35
    SolutionNameMin: Cijk_Ailk_Bljk_ZB_UserArgs_MT64x32x8_MI16x16x4x1_SN_1LDSB1_LPB1_PLR3_SU32_SUS256_TT1_32_TLDS0_UMLDSB0_WGM12
    SolutionIndex: 36
    SolutionNameMin: Cijk_Ailk_Bljk_ZB_UserArgs_MT64x32x8_MI16x16x4x1_SN_1LDSB1_LPB2_PLR3_SU32_SUS256_TT1_32_TLDS1_UMLDSB1_WGM12
    SolutionIndex: 37
    SolutionNameMin: Cijk_Ailk_Bljk_ZB_UserArgs_MT64x64x8_MI16x16x4x1_SN_1LDSB1_LPB2_PLR3_SU32_SUS128_TT1_64_TLDS1_UMLDSB1_WGM12
    SolutionIndex: 38
    SolutionNameMin: Cijk_Ailk_Bljk_ZB_UserArgs_MT64x32x8_MI16x16x4x1_SN_1LDSB0_LPB1_PLR3_SU0_SUS0_TT1_32_TLDS0_UMLDSB0_WGM1
    SolutionIndex: 39
    SolutionNameMin: Cijk_Ailk_Bljk_ZB_UserArgs_MT64x32x8_MI16x16x4x1_SN_1LDSB0_LPB1_PLR3_SU0_SUS0_TT1_32_TLDS0_UMLDSB0_WGM18
    SolutionIndex: 40
    SolutionNameMin: Cijk_Ailk_Bljk_ZB_UserArgs_MT64x32x8_MI16x16x4x1_SN_LPB1_NLCA1_SU32_SUS256_TT1_32_TLDS0_UMLDSB0_WGM18
    SolutionIndex: 41
    SolutionNameMin: Cijk_Ailk_Bljk_ZB_UserArgs_MT64x32x8_MI16x16x4x1_SN_LPB1_NLCA1_SU32_SUS128_TT1_32_TLDS0_UMLDSB0_WGM36
    SolutionIndex: 42
    SolutionNameMin: Cijk_Ailk_Bljk_ZB_UserArgs_MT64x32x8_MI16x16x4x1_SN_LPB2_NLCA1_SU32_SUS256_TT1_32_TLDS1_UMLDSB1_WGM36
    SolutionIndex: 43
    SolutionNameMin: Cijk_Ailk_Bljk_ZB_UserArgs_MT64x32x8_MI16x16x4x1_SN_LPB1_NLCA1_SU0_SUS0_TT1_32_TLDS0_UMLDSB0_WGM1
    SolutionIndex: 44
    SolutionNameMin: Cijk_Ailk_Bljk_ZB_UserArgs_MT64x32x8_MI16x16x4x1_SN_LPB1_NLCA1_SU32_SUS256_TT1_32_TLDS0_UMLDSB0_WGM36
    SolutionIndex: 45
    SolutionNameMin: Cijk_Ailk_Bljk_ZB_UserArgs_MT64x32x8_MI16x16x4x1_SN_LPB1_NLCA1_SU32_SUS128_TT1_32_TLDS0_UMLDSB0_WGM1
    SolutionIndex: 46
    SolutionNameMin: Cijk_Ailk_Bljk_ZB_UserArgs_MT64x48x16_MI16x16x4x1_SN_1LDSB1_LPB2_NLCA1_PLR1_SU32_SUS256_TT1_48_TLDS1_UMLDSB1_WGM1
    SolutionIndex: 47
    SolutionNameMin: Cijk_Ailk_Bljk_ZB_UserArgs_MT64x64x8_MI16x16x4x1_SN_LPB2_NLCA1_SU32_SUS128_TT1_64_TLDS1_UMLDSB1_WGM36
    SolutionIndex: 48
    SolutionNameMin: Cijk_Ailk_Bljk_ZB_UserArgs_MT64x64x16_MI16x16x4x1_SN_1LDSB1_LPB1_NLCA1_PLR1_SU32_SUS256_TT1_64_TLDS0_UMLDSB0_WGM36
    SolutionIndex: 49
    SolutionNameMin: Cijk_Ailk_Bljk_ZB_UserArgs_MT64x32x8_MI16x16x4x1_SN_LPB2_NLCA1_SU0_SUS0_TT1_32_TLDS1_UMLDSB1_WGM36
    SolutionIndex: 50
    SolutionNameMin: Cijk_Ailk_Bljk_ZB_UserArgs_MT128x64x8_MI16x16x4x1_SN_1LDSB1_DTVA1_LPB2_NLCA2_PLR1_SU32_SUS128_TT2_64_WG64_4_1_WGM1
    SolutionIndex: 51
    SolutionNameMin: Cijk_Ailk_Bljk_ZB_UserArgs_MT64x48x16_MI16x16x4x1_SN_1LDSB1_LPB1_NLCA1_PLR1_SU32_SUS256_TT1_48_TLDS0_UMLDSB0_WGM1
    SolutionIndex: 52
    SolutionNameMin: Cijk_Ailk_Bljk_ZB_UserArgs_MT64x48x16_MI16x16x4x1_SN_1LDSB1_LPB2_NLCA1_PLR1_SU32_SUS256_TT1_48_TLDS1_UMLDSB1_WGM36
    SolutionIndex: 53
    SolutionNameMin: Cijk_Ailk_Bljk_ZB_UserArgs_MT64x64x8_MI16x16x4x1_SN_LPB2_NLCA1_SU0_SUS0_TT1_64_TLDS1_UMLDSB1_WGM36
    SolutionIndex: 54
    SolutionNameMin: Cijk_Ailk_Bljk_ZB_UserArgs_MT64x64x8_MI16x16x4x1_SN_LPB1_MIAV0_NLCA1_SU0_SUS0_TT1_64_TLDS0_UMLDSB0_WGM36
    SolutionIndex: 55
    SolutionNameMin: Cijk_Ailk_Bljk_ZB_UserArgs_MT64x64x8_MI16x16x4x1_SN_LPB2_MIAV0_NLCA1_SU0_SUS0_TT1_64_TLDS1_UMLDSB1_WGM36
    SolutionIndex: 56
    SolutionNameMin: Cijk_Ailk_Bljk_ZB_UserArgs_MT64x64x16_MI16x16x4x1_SN_1LDSB1_LPB2_NLCA1_PLR1_SU32_SUS256_TT1_64_TLDS1_UMLDSB1_WGM36
    SolutionIndex: 57
    SolutionNameMin: Cijk_Ailk_Bljk_ZB_UserArgs_MT64x64x8_MI16x16x4x1_SN_LPB1_MIAV1_NLCA1_SU0_SUS0_TT1_64_TLDS0_UMLDSB0_WGM36
    SolutionIndex: 58
    SolutionNameMin: Cijk_Ailk_Bljk_ZB_UserArgs_MT128x64x8_MI16x16x4x1_SN_LPB2_MIAV1_NLCA2_SU0_SUS0_TT2_64_TLDS1_UMLDSB1_WGM1
    SolutionIndex: 59
    SolutionNameMin: Cijk_Ailk_Bljk_ZB_UserArgs_MT128x64x8_MI16x16x4x1_SN_1LDSB1_LPB2_MIAV1_PLR1_TLDS1_UMLDSB1
    SolutionIndex: 60
    SolutionNameMin: Cijk_Ailk_Bljk_ZB_UserArgs_MT128x64x8_MI16x16x4x1_SN_LPB1_MIAV1_NLCA2_SU32_SUS256_TT2_64_TLDS0_UMLDSB0_WGM36
    SolutionIndex: 61
    SolutionNameMin: Cijk_Ailk_Bljk_ZB_UserArgs_MT128x64x8_MI16x16x4x1_SN_LPB2_MIAV1_NLCA2_SU32_SUS256_TT2_64_TLDS1_UMLDSB1_WGM36
    SolutionIndex: 62
    SolutionNameMin: Cijk_Ailk_Bljk_ZB_UserArgs_MT128x64x8_MI16x16x4x1_SN_1LDSB0_LPB2_MIAV1_PLR1_TLDS1_UMLDSB1
    SolutionIndex: 63
    SolutionNameMin: Cijk_Ailk_Bljk_ZB_UserArgs_MT128x64x8_MI16x16x4x1_SN_1LDSB1_LPB1_MIAV1_PLR1_TLDS0_UMLDSB0
    SolutionIndex: 64
    SolutionNameMin: Cijk_Ailk_Bljk_ZB_UserArgs_MT16x16x64_MI16x16x4x1_SN_1LDSB0_DTVA0_GSU1_GSUASB_LBSPPB0_LPB0_NLCB1_PLR1_WG16_4_2
    SolutionIndex: 65
    SolutionNameMin: Cijk_Ailk_Bljk_ZB_UserArgs_MT16x16x64_MI16x16x4x1_SN_1LDSB1_DTVA1_GSU10_GSUAMB_LBSPPB1024_LPB2_NLCB1_PLR1_WG16_4_4
    SolutionIndex: 66
    SolutionNameMin: Cijk_Ailk_Bljk_ZB_UserArgs_MT16x16x128_MI16x16x4x1_SN_1LDSB1_DTVA1_GSU16_GSUAMB_LBSPPB2048_LPB2_NLCB1_PLR9_WG16_4_4
    SolutionIndex: 67
    SolutionNameMin: Cijk_Ailk_Bljk_ZB_UserArgs_MT16x16x64_MI16x16x4x1_SN_1LDSB1_DTVA0_GSU1_GSUASB_LBSPPB1024_LPB2_NLCA1_NLCB1_PLR1_TT1_16_WG16_4_4
    SolutionIndex: 68
    SolutionNameMin: Cijk_Ailk_Bljk_ZB_UserArgs_MT32x16x32_MI16x16x4x1_SN_1LDSB0_DTVA0_GSU16_GSUAMB_LBSPPB512_LPB2_NLCA1_NLCB1_PLR3_TT2_16_WG16_4_4
    SolutionIndex: 69
    SolutionNameMin: Cijk_Ailk_Bljk_ZB_UserArgs_MT16x16x64_MI16x16x4x1_SN_1LDSB1_DTVA1_GSU13_GSUAMB_LBSPPB1024_LPB2_NLCA1_NLCB1_PLR5_TT1_16_WG16_4_4
    SolutionIndex: 70
    SolutionNameMin: Cijk_Ailk_Bljk_ZB_UserArgs_MT32x16x64_MI16x16x4x1_SN_1LDSB1_DTVA0_GSU1_GSUASB_LBSPPB1024_LPB2_NLCA1_NLCB1_PLR9_TT1_16_WG32_4_2
    SolutionIndex: 71
    SolutionNameMin: Cijk_Ailk_Bljk_ZB_UserArgs_MT16x16x64_MI16x16x4x1_SN_1LDSB1_DTVA1_GSU4_GSUAMB_LBSPPB1024_LPB2_NLCA1_NLCB1_PLR1_TT1_16_WG16_4_4
    SolutionIndex: 72
    SolutionNameMin: Cijk_Ailk_Bljk_ZB_UserArgs_MT16x16x64_MI16x16x4x1_SN_1LDSB0_DTVA1_GSU16_GSUAMB_LBSPPB1024_LPB2_NLCA1_NLCB1_PLR5_TT1_16_WG16_4_4
    SolutionIndex: 73
    SolutionNameMin: Cijk_Ailk_Bljk_ZB_UserArgs_MT16x16x128_MI16x16x4x1_SN_1LDSB1_DTVA1_GSU1_GSUASB_LBSPPB2048_LPB2_NLCA1_NLCB1_PLR9_TT1_16_WG16_4_4
    SolutionIndex: 74
    SolutionNameMin: Cijk_Ailk_Bljk_ZB_UserArgs_MT16x16x32_MI16x16x4x1_SN_1LDSB1_DTVA1_GSU9_GSUAMB_LBSPPB512_LPB2_NLCA1_NLCB1_PLR3_TT1_16_WG16_4_4
    SolutionIndex: 75
    SolutionNameMin: Cijk_Ailk_Bljk_ZB_UserArgs_MT32x16x64_MI16x16x4x1_SN_1LDSB1_DTVA1_GSU16_GSUAMB_LBSPPB1024_LPB2_NLCA2_NLCB1_PLR1_TT2_16_WG16_4_4
    SolutionIndex: 76
    SolutionNameMin: Cijk_Ailk_Bljk_ZB_UserArgs_MT16x16x32_MI16x16x4x1_SN_1LDSB0_DTVA1_GSU3_LBSPPB512_LPB2_NLCA1_NLCB1_PLR3_TT1_16_WG16_4_4
    SolutionIndex: 77
    SolutionNameMin: Cijk_Ailk_Bljk_ZB_UserArgs_MT64x16x16_MI16x16x4x1_SN_1LDSB0_DTVA0_GSU15_LBSPPB256_LPB2_NLCA1_NLCB1_PLR1_TT4_16_WG16_4_4
    SolutionIndex: 78
    SolutionNameMin: Cijk_Ailk_Bljk_ZB_UserArgs_MT16x16x32_MI16x16x4x1_SN_1LDSB0_DTVA1_GSU9_LBSPPB512_LPB2_NLCA1_NLCB1_PLR5_TT1_16_WG16_4_2
    SolutionIndex: 79
    SolutionNameMin: Cijk_Ailk_Bljk_ZB_UserArgs_MT16x16x128_MI16x16x4x1_SN_DTVA0_GSU2_LBSPPB0_LPB0_NLCA1_NLCB1_PLR9_TT1_16_WG16_4_4
    SolutionIndex: 80
    SolutionNameMin: Cijk_Ailk_Bljk_ZB_UserArgs_MT16x16x32_MI16x16x4x1_SN_DTVA1_GSU5_LBSPPB512_LPB2_NLCA1_NLCB1_PLR1_TT1_16_WG16_4_2
    SolutionIndex: 81
    SolutionNameMin: Cijk_Ailk_Bljk_ZB_UserArgs_MT32x16x64_MI16x16x4x1_SN_DTVA0_GSU5_LBSPPB1024_LPB2_NLCA1_NLCB1_PLR1_TT2_16_WG16_4_4
    SolutionIndex: 82
    SolutionNameMin: Cijk_Ailk_Bljk_ZB_UserArgs_MT16x16x32_MI16x16x4x1_SN_DTVA1_GSU1_GSUASB_LBSPPB512_LPB2_NLCA1_NLCB1_PLR1_TT1_16_WG16_4_2
    SolutionIndex: 83
    SolutionNameMin: Cijk_Ailk_Bljk_ZB_UserArgs_MT16x16x64_MI16x16x4x1_SN_DTVA1_GSU1_GSUASB_LBSPPB1024_LPB2_NLCA1_NLCB1_PLR5_TT1_16_WG16_4_4
    SolutionIndex: 84
    SolutionNameMin: Cijk_Ailk_Bljk_ZB_UserArgs_MT32x16x16_MI16x16x4x1_SN_DTVA1_GSU9_GSUAMB_LBSPPB256_LPB2_NLCA1_NLCB1_PLR5_TT1_16_WG32_4_1
    SolutionIndex: 85
    SolutionNameMin: Cijk_Ailk_Bljk_ZB_UserArgs_MT16x16x64_MI16x16x4x1_SN_DTVA1_GSU1_GSUASB_LBSPPB1024_LPB2_NLCA1_NLCB1_PLR1_TT1_16_WG16_4_4
    SolutionIndex: 86
    SolutionNameMin: Cijk_Ailk_Bljk_ZB_UserArgs_MT32x16x32_MI16x16x4x1_SN_DTVA1_GSU4_GSUAMB_LBSPPB512_LPB2_NLCA1_NLCB1_PLR1_TT1_16_WG32_4_2
    SolutionIndex: 87
    SolutionNameMin: Cijk_Ailk_Bljk_ZB_UserArgs_MT32x16x32_MI16x16x4x1_SN_DTVA1_GSU3_GSUAMB_LBSPPB512_LPB2_NLCA2_NLCB1_PLR3_TT2_16_WG16_4_4
    SolutionIndex: 88
    SolutionNameMin: Cijk_Ailk_Bljk_ZB_UserArgs_MT32x16x32_MI16x16x4x1_SN_DTVA1_GSU1_GSUASB_LBSPPB512_LPB2_NLCA1_NLCB1_PLR5_TT1_16_WG32_4_2
    SolutionIndex: 89
    SolutionNameMin: Cijk_Ailk_Bljk_ZB_UserArgs_MT32x16x64_MI16x16x4x1_SN_DTVA1_GSU1_GSUASB_LBSPPB1024_LPB2_NLCA2_NLCB1_PLR1_TT2_16_WG16_4_4
    SolutionIndex: 90
    SolutionNameMin: Cijk_Ailk_Bljk_ZB_UserArgs_MT64x16x32_MI16x16x4x1_SN_DTVA1_GSU5_GSUAMB_LBSPPB512_LPB2_NLCA2_NLCB1_PLR1_TT2_16_WG32_4_2
    SolutionIndex: 91
    SolutionNameMin: Cijk_Ailk_Bljk_ZB_UserArgs_MT16x16x64_MI16x16x4x1_SN_DTVA0_GSU1_GSUASB_LBSPPB1024_LPB2_NLCA1_NLCB1_PLR9_TT1_16_WG16_4_2
    SolutionIndex: 92
    SolutionNameMin: Cijk_Ailk_Bljk_ZB_UserArgs_MT128x16x16_MI16x16x4x1_SN_DTVA0_GSU6_GSUAMB_LBSPPB256_LPB2_NLCA1_NLCB1_PLR3_TT4_16_WG32_4_2
    SolutionIndex: 93
    SolutionNameMin: Cijk_Ailk_Bljk_ZB_UserArgs_MT32x16x64_MI16x16x4x1_SN_DTVA0_GSU1_GSUASB_LBSPPB1024_LPB2_NLCA1_NLCB1_PLR9_TT1_16_WG32_4_2
    SolutionIndex: 94
    SolutionNameMin: Cijk_Ailk_Bljk_ZB_UserArgs_MT64x16x32_MI16x16x4x1_SN_DTVA1_GSU1_GSUASB_LBSPPB512_LPB2_NLCA4_NLCB1_PLR1_TT4_16_WG16_4_4
    SolutionIndex: 95
    SolutionNameMin: Cijk_Ailk_Bljk_ZB_UserArgs_MT64x16x64_MI16x16x4x1_SN_DTVA1_GSU3_GSUAMB_LBSPPB1024_LPB2_NLCA4_NLCB1_PLR5_TT4_16_WG16_4_4
    SolutionIndex: 96
    SolutionNameMin: Cijk_Ailk_Bljk_ZB_UserArgs_MT32x16x32_MI16x16x4x1_SN_DTVA0_GSU1_GSUASB_LBSPPB512_LPB2_MIAV1_NTA0_NLCA1_NLCB1_PLR5_TT1_16_WG32_4_2
    SolutionIndex: 97
    SolutionNameMin: Cijk_Ailk_Bljk_ZB_UserArgs_MT32x16x32_MI16x16x4x1_SN_DTVA1_GSU1_GSUASB_LBSPPB512_LPB2_MIAV1_NTA4_NLCA1_NLCB1_PLR1_TT1_16_WG32_4_1
    SolutionIndex: 98
    SolutionNameMin: Cijk_Ailk_Bljk_ZB_UserArgs_MT128x16x16_MI16x16x4x1_SN_DTVA1_GSU13_GSUAMB_LBSPPB256_LPB2_MIAV1_NTA4_NLCA2_NLCB1_PLR1_TT2_16_WG64_4_1
    SolutionIndex: 99
    SolutionNameMin: Cijk_Ailk_Bljk_ZB_UserArgs_MT16x16x16_MI16x16x4x1_SN_DTVA1_GSU1_GSUASB_LBSPPB256_LPB2_MIAV1_NTA0_NLCA1_NLCB1_PLR1_TT1_16_WG16_4_1
    SolutionIndex: 100
    SolutionNameMin: Cijk_Ailk_Bljk_ZB_UserArgs_MT64x16x16_MI16x16x4x1_SN_DTVA1_GSU1_GSUASB_LBSPPB256_LPB2_MIAV1_NTA4_NLCA2_NLCB1_PLR1_TT2_16_WG32_4_2
    SolutionIndex: 101
    SolutionNameMin: Cijk_Ailk_Bljk_ZB_UserArgs_MT256x16x16_MI16x16x4x1_SN_DTVA1_GSU7_GSUAMB_LBSPPB256_LPB2_MIAV1_NTA4_NLCA4_NLCB1_PLR5_TT4_16_WG64_4_1
    SolutionIndex: 102
    SolutionNameMin: Cijk_Ailk_Bljk_ZB_UserArgs_MT64x16x16_MI16x16x4x1_SN_DTVA0_GSU1_GSUASB_LBSPPB256_LPB2_MIAV1_NTA0_NLCA1_NLCB1_PLR1_TT2_16_WG32_4_2
    SolutionIndex: 103
    SolutionNameMin: Cijk_Ailk_Bljk_ZB_UserArgs_MT64x16x32_MI16x16x4x1_SN_DTVA1_GSU1_GSUASB_LBSPPB512_LPB2_MIAV1_NTA4_NLCA4_NLCB1_PLR1_TT4_16_WG16_4_4
    SolutionIndex: 104
    SolutionNameMin: Cijk_Ailk_Bljk_ZB_UserArgs_MT64x16x32_MI16x16x4x1_SN_DTVA1_GSU10_GSUAMB_LBSPPB512_LPB2_MIAV1_NTA4_NLCA1_NLCB1_PLR1_TT1_16_WG64_4_1
    SolutionIndex: 105
    SolutionNameMin: Cijk_Ailk_Bljk_ZB_UserArgs_MT128x16x16_MI16x16x4x1_SN_DTVA1_GSU1_GSUASB_LBSPPB256_LPB2_MIAV1_NTA0_NLCA4_NLCB1_PLR3_TT4_16_WG32_4_2
    SolutionIndex: 106
    SolutionNameMin: Cijk_Ailk_Bljk_ZB_UserArgs_MT128x16x16_MI16x16x4x1_SN_DTVA1_GSU1_GSUASB_LBSPPB256_LPB2_MIAV1_NTA4_NLCA4_NLCB1_PLR3_TT4_16_WG32_4_2
    SolutionIndex: 107
    SolutionNameMin: Cijk_Ailk_Bljk_ZB_UserArgs_MT64x16x32_MI16x16x4x1_SN_DTVA1_GSU8_GSUAMB_LBSPPB512_LPB2_MIAV1_NTA4_NLCA1_NLCB1_PLR9_TT1_16_WG64_4_1
    SolutionIndex: 108
    SolutionNameMin: Cijk_Ailk_Bljk_ZB_UserArgs_MT16x16x64_MI16x16x4x1_SN_1LDSB1_DTVA1_GSU1_GSUASB_LBSPPB1024_LPB2_NLCB1_PLR5_TT1_16_WG16_4_4
    SolutionIndex: 109
    SolutionNameMin: Cijk_Ailk_Bljk_ZB_UserArgs_MT16x16x64_MI16x16x4x1_SN_1LDSB0_DTVA0_GSU13_GSUAMB_LBSPPB0_LPB0_NLCB1_PLR5_TT1_16_WG16_4_4
    SolutionIndex: 110
    SolutionNameMin: Cijk_Ailk_Bljk_ZB_UserArgs_MT16x16x128_MI16x16x4x1_SN_1LDSB0_DTVA1_GSU16_GSUAMB_LBSPPB0_LPB0_NLCB1_PLR1_TT1_16_WG16_4_4
    SolutionIndex: 111
    SolutionNameMin: Cijk_Ailk_Bljk_ZB_UserArgs_MT16x16x64_MI16x16x4x1_SN_1LDSB1_DTVA1_GSU1_GSUASB_LBSPPB1024_LPB2_NLCA1_NLCB1_PLR1_TT1_16_WG16_4_4
    SolutionIndex: 112
    SolutionNameMin: Cijk_Ailk_Bljk_ZB_UserArgs_MT16x16x128_MI16x16x4x1_SN_1LDSB0_DTVA1_GSU11_GSUAMB_LBSPPB0_LPB0_NLCA1_NLCB1_PLR1_TT1_16_WG16_4_4
    SolutionIndex: 113
    SolutionNameMin: Cijk_Ailk_Bljk_ZB_UserArgs_MT16x16x64_MI16x16x4x1_SN_1LDSB0_DTVA1_GSU16_GSUAMB_LBSPPB1024_LPB2_NLCA1_NLCB1_PLR5_TT1_16_WG16_4_4
    SolutionIndex: 114
    SolutionNameMin: Cijk_Ailk_Bljk_ZB_UserArgs_MT16x16x64_MI16x16x4x1_SN_1LDSB0_DTVA1_GSU1_GSUASB_LBSPPB1024_LPB2_NLCA1_NLCB1_PLR5_TT1_16_WG16_4_4
    SolutionIndex: 115
    SolutionNameMin: Cijk_Ailk_Bljk_ZB_UserArgs_MT16x16x128_MI16x16x4x1_SN_1LDSB0_DTVA1_GSU12_GSUAMB_LBSPPB0_LPB0_NLCA1_NLCB1_PLR1_TT1_16_WG16_4_4
    SolutionIndex: 116
    SolutionNameMin: Cijk_Ailk_Bljk_ZB_UserArgs_MT32x16x64_MI16x16x4x1_SN_1LDSB0_DTVA1_GSU16_GSUAMB_LBSPPB1024_LPB2_NLCA2_NLCB1_PLR5_TT2_16_WG16_4_4
    SolutionIndex: 117
    SolutionNameMin: Cijk_Ailk_Bljk_ZB_UserArgs_MT16x16x64_MI16x16x4x1_SN_1LDSB1_DTVA1_GSU4_LBSPPB1024_LPB2_NLCA1_NLCB1_PLR1_TT1_16_WG16_4_4
    SolutionIndex: 118
    SolutionNameMin: Cijk_Ailk_Bljk_ZB_UserArgs_MT16x16x64_MI16x16x4x1_SN_1LDSB0_DTVA1_GSU9_LBSPPB1024_LPB2_NLCA1_NLCB1_PLR9_TT1_16_WG16_4_2
    SolutionIndex: 119
    SolutionNameMin: Cijk_Ailk_Bljk_ZB_UserArgs_MT32x16x32_MI16x16x4x1_SN_1LDSB1_DTVA1_GSU12_LBSPPB512_LPB2_NLCA2_NLCB1_PLR1_TT2_16_WG16_4_4
    SolutionIndex: 120
    SolutionNameMin: Cijk_Ailk_Bljk_ZB_UserArgs_MT16x16x64_MI16x16x4x1_SN_1LDSB1_DTVA1_GSU3_LBSPPB1024_LPB2_NLCA1_NLCB1_PLR1_TT1_16_WG16_4_4
    SolutionIndex: 121
    SolutionNameMin: Cijk_Ailk_Bljk_ZB_UserArgs_MT16x32x64_MI16x16x4x1_SN_1LDSB1_DTVA1_GSU5_LBSPPB1024_LPB2_NLCA1_NLCB1_PLR5_TT1_32_WG16_4_4
    SolutionIndex: 122
    SolutionNameMin: Cijk_Ailk_Bljk_ZB_UserArgs_MT64x16x32_MI16x16x4x1_SN_1LDSB0_DTVA1_GSU12_LBSPPB512_LPB2_NLCA2_NLCB1_PLR5_TT2_16_WG32_4_2
    SolutionIndex: 123
    SolutionNameMin: Cijk_Ailk_Bljk_ZB_UserArgs_MT16x16x64_MI16x16x4x1_SN_DTVA1_GSU1_GSUASB_LBSPPB1024_LPB2_NLCA1_NLCB1_PLR5_TT1_16_WG16_4_4
    SolutionIndex: 124
    SolutionNameMin: Cijk_Ailk_Bljk_ZB_UserArgs_MT16x16x64_MI16x16x4x1_SN_DTVA1_GSU1_GSUASB_LBSPPB1024_LPB2_NLCA1_NLCB1_PLR1_TT1_16_WG16_4_4
    SolutionIndex: 125
    SolutionNameMin: Cijk_Ailk_Bljk_ZB_UserArgs_MT32x32x32_MI16x16x4x1_SN_DTVA1_GSU6_GSUAMB_LBSPPB512_LPB2_NLCA2_NLCB1_PLR3_TT2_32_WG16_4_4
    SolutionIndex: 126
    SolutionNameMin: Cijk_Ailk_Bljk_ZB_UserArgs_MT64x32x16_MI16x16x4x1_SN_DTVA1_GSU9_GSUAMB_LBSPPB256_LPB2_NLCA1_NLCB1_PLR1_TT1_32_WG64_4_1
    SolutionIndex: 127
    SolutionNameMin: Cijk_Ailk_Bljk_ZB_UserArgs_MT32x32x32_MI16x16x4x1_SN_DTVA1_GSU4_GSUAMB_LBSPPB512_LPB2_NLCA2_NLCB1_PLR3_TT2_32_WG16_4_4
    SolutionIndex: 128
    SolutionNameMin: Cijk_Ailk_Bljk_ZB_UserArgs_MT32x16x32_MI16x16x4x1_SN_DTVA1_GSU1_GSUASB_LBSPPB512_LPB2_NLCA2_NLCB1_PLR3_TT2_16_WG16_4_4
    SolutionIndex: 129
    SolutionNameMin: Cijk_Ailk_Bljk_ZB_UserArgs_MT64x32x16_MI16x16x4x1_SN_DTVA1_GSU6_GSUAMB_LBSPPB256_LPB2_NLCA2_NLCB1_PLR1_TT2_32_WG32_4_2
    SolutionIndex: 130
    SolutionNameMin: Cijk_Ailk_Bljk_ZB_UserArgs_MT32x32x32_MI16x16x4x1_SN_DTVA1_GSU1_GSUASB_LBSPPB512_LPB2_MIAV1_NLCA2_NLCB1_PLR1_TT2_32_WG16_4_4
    SolutionIndex: 131
    SolutionNameMin: Cijk_Ailk_Bljk_ZB_UserArgs_MT32x32x32_MI16x16x4x1_SN_DTVA1_GSU1_GSUASB_LBSPPB512_LPB2_MIAV1_NLCA1_NLCB1_PLR5_TT1_32_WG32_4_2
    SolutionIndex: 132
    SolutionNameMin: Cijk_Ailk_Bljk_ZB_UserArgs_MT64x32x16_MI16x16x4x1_SN_DTVA1_GSU5_GSUAMB_LBSPPB256_LPB2_MIAV1_NLCA1_NLCB1_PLR1_TT1_32_WG64_4_1
    SolutionIndex: 133
    SolutionNameMin: Cijk_Ailk_Bljk_ZB_UserArgs_MT32x16x64_MI16x16x4x1_SN_DTVA0_GSU1_GSUASB_LBSPPB1024_LPB2_MIAV1_NLCA1_NLCB1_PLR9_TT1_16_WG32_4_2
    SolutionIndex: 134
    SolutionNameMin: Cijk_Ailk_Bljk_ZB_UserArgs_MT32x32x32_MI16x16x4x1_SN_DTVA1_GSU1_GSUASB_LBSPPB512_LPB2_MIAV1_NLCA2_NLCB1_PLR3_TT2_32_WG16_4_4
    SolutionIndex: 135
    SolutionNameMin: Cijk_Ailk_Bljk_ZB_UserArgs_MT64x32x16_MI16x16x4x1_SN_DTVA1_GSU4_GSUAMB_LBSPPB256_LPB2_MIAV1_NLCA2_NLCB1_PLR1_TT2_32_WG32_4_2
    SolutionIndex: 136
    SolutionNameMin: Cijk_Ailk_Bljk_ZB_UserArgs_MT32x32x16_MI16x16x4x1_SN_DTVA0_GSU1_GSUASB_LBSPPB256_LPB2_MIAV1_NLCA1_NLCB1_PLR1_TT2_32_WG16_4_4
    SolutionIndex: 137
    SolutionNameMin: Cijk_Ailk_Bljk_ZB_UserArgs_MT32x32x64_MI16x16x4x1_SN_DTVA1_GSU1_GSUASB_LBSPPB1024_LPB2_MIAV1_NLCA2_NLCB1_PLR1_TT2_32_WG16_4_4
    SolutionIndex: 138
    SolutionNameMin: Cijk_Ailk_Bljk_ZB_UserArgs_MT256x32x16_MI16x16x4x1_SN_DTVA1_GSU14_GSUAMB_LBSPPB256_LPB2_MIAV0_NLCA4_NLCB1_PLR5_TT4_32_WG64_4_1
    SolutionIndex: 139
    SolutionNameMin: Cijk_Ailk_Bljk_ZB_UserArgs_MT32x32x32_MI16x16x4x1_SN_DTVA1_GSU1_GSUASB_LBSPPB512_LPB2_MIAV1_NTA4_NLCA1_PLR1_TT1_32_WG32_4_2
    SolutionIndex: 140
    SolutionNameMin: Cijk_Ailk_Bljk_ZB_UserArgs_MT256x32x16_MI16x16x4x1_SN_DTVA1_GSU9_GSUAMB_LBSPPB256_LPB2_MIAV0_NTA4_NLCA4_PLR1_TT4_32_WG64_4_1
    SolutionIndex: 141
    SolutionNameMin: Cijk_Ailk_Bljk_ZB_UserArgs_MT64x32x16_MI16x16x4x1_SN_DTVA1_GSU1_GSUASB_LBSPPB256_LPB2_MIAV1_NTA0_NLCA2_PLR3_TT2_32_WG32_4_2
    SolutionIndex: 142
    SolutionNameMin: Cijk_Ailk_Bljk_ZB_UserArgs_MT64x32x16_MI16x16x4x1_SN_DTVA1_GSU1_GSUASB_LBSPPB256_LPB2_MIAV1_NTA4_NLCA2_PLR1_TT2_32_WG32_4_2
    SolutionIndex: 143
    SolutionNameMin: Cijk_Ailk_Bljk_ZB_UserArgs_MT256x32x16_MI16x16x4x1_SN_DTVA1_GSU7_GSUAMB_LBSPPB256_LPB2_MIAV0_NTA4_NLCA4_PLR5_TT4_32_WG64_4_1
    SolutionIndex: 144
    SolutionNameMin: Cijk_Ailk_Bljk_ZB_UserArgs_MT128x16x16_MI16x16x4x1_SN_DTVA1_GSU1_GSUASB_LBSPPB256_LPB2_MIAV1_NTA0_NLCA2_PLR5_TT2_16_WG64_4_1
    SolutionIndex: 145
    SolutionNameMin: Cijk_Ailk_Bljk_ZB_UserArgs_MT64x32x16_MI16x16x4x1_SN_DTVA1_GSU1_GSUASB_LBSPPB256_LPB2_MIAV1_NTA4_NLCA2_PLR3_TT2_32_WG32_4_2
    SolutionIndex: 146
    SolutionNameMin: Cijk_Ailk_Bljk_ZB_UserArgs_MT192x32x16_MI16x16x4x1_SN_DTVA1_GSU7_GSUAMB_LBSPPB256_LPB2_MIAV0_NTA4_NLCA3_PLR5_TT3_32_WG64_4_1
    SolutionIndex: 147
    SolutionNameMin: Cijk_Ailk_Bljk_ZB_UserArgs_MT32x32x16_MI16x16x4x1_SN_DTVA0_GSU1_GSUASB_LBSPPB256_LPB2_MIAV1_NTA0_NLCA1_PLR1_TT1_16_WG32_8_1
    SolutionIndex: 148
    SolutionNameMin: Cijk_Ailk_Bljk_ZB_UserArgs_MT320x32x16_MI16x16x4x1_SN_DTVA1_GSU4_GSUAMB_LBSPPB256_LPB2_MIAV0_NTA4_NLCA5_PLR5_TT5_32_WG64_4_1
    SolutionIndex: 149
    SolutionNameMin: Cijk_Ailk_Bljk_ZB_UserArgs_MT384x32x16_MI16x16x4x1_SN_DTVA1_GSU5_GSUAMB_LBSPPB256_LPB2_MIAV0_NTA4_NLCA6_PLR1_TT6_32_WG64_4_1
    SolutionIndex: 150
    SolutionNameMin: Cijk_Ailk_Bljk_ZB_UserArgs_MT16x16x128_MI16x16x4x1_SN_1LDSB1_DTVA1_GSU1_GSUASB_LBSPPB2048_LPB2_NLCB1_PLR9_TT1_16_WG16_4_4
    SolutionIndex: 151
    SolutionNameMin: Cijk_Ailk_Bljk_ZB_UserArgs_MT16x16x64_MI16x16x4x1_SN_1LDSB1_DTVA1_GSU11_GSUAMB_LBSPPB1024_LPB2_NLCB1_PLR5_TT1_16_WG16_4_4
    SolutionIndex: 152
    SolutionNameMin: Cijk_Ailk_Bljk_ZB_UserArgs_MT16x16x128_MI16x16x4x1_SN_1LDSB1_DTVA1_GSU14_GSUAMB_LBSPPB2048_LPB2_NLCB1_PLR9_TT1_16_WG16_4_4
    SolutionIndex: 153
    SolutionNameMin: Cijk_Ailk_Bljk_ZB_UserArgs_MT16x16x64_MI16x16x4x1_SN_1LDSB1_DTVA1_GSU1_GSUASB_LBSPPB1024_LPB2_NLCA1_NLCB1_PLR5_TT1_16_WG16_4_4
    SolutionIndex: 154
    SolutionNameMin: Cijk_Ailk_Bljk_ZB_UserArgs_MT16x16x32_MI16x16x4x1_SN_1LDSB1_DTVA0_GSU13_GSUAMB_LBSPPB512_LPB2_NLCA1_NLCB1_PLR1_TT1_16_WG16_4_4
    SolutionIndex: 155
    SolutionNameMin: Cijk_Ailk_Bljk_ZB_UserArgs_MT32x16x64_MI16x16x4x1_SN_1LDSB1_DTVA0_GSU15_GSUAMB_LBSPPB1024_LPB2_NLCA1_NLCB1_PLR5_TT2_16_WG16_4_4
    SolutionIndex: 156
    SolutionNameMin: Cijk_Ailk_Bljk_ZB_UserArgs_MT16x16x32_MI16x16x4x1_SN_1LDSB0_DTVA0_GSU4_LBSPPB512_LPB2_NLCA1_NLCB1_PLR3_TT1_16_WG16_4_4
    SolutionIndex: 157
    SolutionNameMin: Cijk_Ailk_Bljk_ZB_UserArgs_MT32x16x64_MI16x16x4x1_SN_1LDSB0_DTVA1_GSU10_LBSPPB1024_LPB2_NLCA1_NLCB1_PLR1_TT1_16_WG32_4_2
    SolutionIndex: 158
    SolutionNameMin: Cijk_Ailk_Bljk_ZB_UserArgs_MT32x16x32_MI16x16x4x1_SN_1LDSB0_DTVA0_GSU3_LBSPPB512_LPB2_NLCA1_NLCB1_PLR1_TT2_16_WG16_4_4
    SolutionIndex: 159
    SolutionNameMin: Cijk_Ailk_Bljk_ZB_UserArgs_MT32x16x64_MI16x16x4x1_SN_1LDSB0_DTVA1_GSU6_LBSPPB1024_LPB2_NLCA1_NLCB1_PLR9_TT1_16_WG32_4_2
    SolutionIndex: 160
    SolutionNameMin: Cijk_Ailk_Bljk_ZB_UserArgs_MT64x16x32_MI16x16x4x1_SN_1LDSB1_DTVA1_GSU12_LBSPPB512_LPB2_NLCA2_NLCB1_PLR1_TT2_16_WG32_4_2
    SolutionIndex: 161
    SolutionNameMin: Cijk_Ailk_Bljk_ZB_UserArgs_MT16x16x64_MI16x16x4x1_SN_1LDSB1_DTVA1_GSU1_GSUASB_LBSPPB1024_LPB2_NLCA1_NLCB1_PLR1_TT1_16_WG16_4_4
    SolutionIndex: 162
    SolutionNameMin: Cijk_Ailk_Bljk_ZB_UserArgs_MT64x16x16_MI16x16x4x1_SN_1LDSB0_DTVA1_GSU9_GSUAMB_LBSPPB256_LPB2_NLCA2_NLCB1_PLR1_TT2_16_WG32_4_2
    SolutionIndex: 163
    SolutionNameMin: Cijk_Ailk_Bljk_ZB_UserArgs_MT64x16x16_MI16x16x4x1_SN_1LDSB1_DTVA1_GSU12_GSUAMB_LBSPPB256_LPB2_NLCA1_NLCB1_PLR1_TT1_16_WG64_4_1
    SolutionIndex: 164
    SolutionNameMin: Cijk_Ailk_Bljk_ZB_UserArgs_MT32x16x64_MI16x16x4x1_SN_DTVA1_GSU1_GSUASB_LBSPPB1024_LPB2_NLCA2_NLCB1_PLR5_TT2_16_WG16_4_4
    SolutionIndex: 165
    SolutionNameMin: Cijk_Ailk_Bljk_ZB_UserArgs_MT64x32x16_MI16x16x4x1_SN_DTVA0_GSU9_GSUAMB_LBSPPB256_LPB2_NLCA1_NLCB1_PLR1_TT2_32_WG32_4_2
    SolutionIndex: 166
    SolutionNameMin: Cijk_Ailk_Bljk_ZB_UserArgs_MT128x16x32_MI16x16x4x1_SN_DTVA1_GSU12_GSUAMB_LBSPPB512_LPB2_NLCA4_NLCB1_PLR5_TT4_16_WG32_4_2
    SolutionIndex: 167
    SolutionNameMin: Cijk_Ailk_Bljk_ZB_UserArgs_MT64x32x32_MI16x16x4x1_SN_DTVA0_GSU8_GSUAMB_LBSPPB512_LPB2_MIAV1_NLCA1_NLCB1_PLR9_TT1_32_WG64_4_1
    SolutionIndex: 168
    SolutionNameMin: Cijk_Ailk_Bljk_ZB_UserArgs_MT32x32x32_MI16x16x4x1_SN_DTVA1_GSU1_GSUASB_LBSPPB512_LPB2_MIAV1_NLCA2_NLCB1_PLR3_TT2_32_WG16_4_4
    SolutionIndex: 169
    SolutionNameMin: Cijk_Ailk_Bljk_ZB_UserArgs_MT32x64x16_MI16x16x4x1_SN_DTVA0_GSU6_GSUAMB_LBSPPB256_LPB2_MIAV1_NLCA1_NLCB1_PLR1_TT1_64_WG32_4_2
    SolutionIndex: 170
    SolutionNameMin: Cijk_Ailk_Bljk_ZB_UserArgs_MT64x64x16_MI16x16x4x1_SN_DTVA1_GSU13_GSUAMB_LBSPPB256_LPB2_MIAV1_NLCA1_NLCB1_PLR5_TT1_64_WG64_4_1
    SolutionIndex: 171
    SolutionNameMin: Cijk_Ailk_Bljk_ZB_UserArgs_MT16x32x64_MI16x16x4x1_SN_DTVA0_GSU1_GSUASB_LBSPPB1024_LPB2_MIAV1_NLCA1_NLCB1_PLR9_TT1_16_WG16_8_2
    SolutionIndex: 172
    SolutionNameMin: Cijk_Ailk_Bljk_ZB_UserArgs_MT32x32x32_MI16x16x4x1_SN_DTVA1_GSU1_GSUASB_LBSPPB512_LPB2_MIAV1_NLCA2_NLCB1_PLR1_TT2_32_WG16_4_4
    SolutionIndex: 173
    SolutionNameMin: Cijk_Ailk_Bljk_ZB_UserArgs_MT64x64x16_MI16x16x4x1_SN_DTVA1_GSU9_GSUAMB_LBSPPB256_LPB2_MIAV1_NLCA1_NLCB1_PLR5_TT1_64_WG64_4_1
    SolutionIndex: 174
    SolutionNameMin: Cijk_Ailk_Bljk_ZB_UserArgs_MT32x32x32_MI16x16x4x1_SN_DTVA0_GSU1_GSUASB_LBSPPB512_LPB2_MIAV1_NLCA1_PLR9_TT1_16_WG32_8_1
    SolutionIndex: 175
    SolutionNameMin: Cijk_Ailk_Bljk_ZB_UserArgs_MT32x32x32_MI16x16x4x1_SN_DTVA1_GSU1_GSUASB_LBSPPB512_LPB2_MIAV1_NLCA1_PLR5_TT1_32_WG32_4_2
    SolutionIndex: 176
    SolutionNameMin: Cijk_Ailk_Bljk_ZB_UserArgs_MT128x64x16_MI16x16x4x1_SN_DTVA1_GSU14_GSUAMB_LBSPPB256_LPB2_MIAV0_NLCA2_PLR5_TT2_64_WG64_4_1
    SolutionIndex: 177
    SolutionNameMin: Cijk_Ailk_Bljk_ZB_UserArgs_MT64x16x16_MI16x16x4x1_SN_DTVA1_GSU1_GSUASB_LBSPPB256_LPB2_MIAV1_NLCA2_PLR3_TT2_16_WG32_4_2
    SolutionIndex: 178
    SolutionNameMin: Cijk_Ailk_Bljk_ZB_UserArgs_MT128x64x16_MI16x16x4x1_SN_DTVA1_GSU9_GSUAMB_LBSPPB256_LPB2_MIAV0_NLCA2_PLR5_TT2_64_WG64_4_1
    SolutionIndex: 179
    SolutionNameMin: Cijk_Ailk_Bljk_ZB_UserArgs_MT32x64x32_MI16x16x4x1_SN_DTVA1_GSU1_GSUASB_LBSPPB512_LPB2_MIAV1_NLCA1_PLR1_TT1_64_WG32_4_2
    SolutionIndex: 180
    SolutionNameMin: Cijk_Ailk_Bljk_ZB_UserArgs_MT96x64x16_MI16x16x4x1_SN_DTVA0_GSU5_GSUAMB_LBSPPB256_LPB2_MIAV0_NLCA3_PLR5_TT6_16_WG16_16_1
    SolutionIndex: 181
    SolutionNameMin: Cijk_Ailk_Bljk_ZB_UserArgs_MT128x64x32_MI16x16x4x1_SN_DTVA1_GSU14_GSUAMB_LBSPPB512_LPB2_MIAV0_NLCA2_PLR1_TT2_64_WG64_4_1
    SolutionIndex: 182
    SolutionNameMin: Cijk_Ailk_Bljk_ZB_UserArgs_MT64x32x32_MI16x16x4x1_SN_DTVA0_GSU1_GSUASB_LBSPPB512_LPB2_MIAV1_NTA0_NLCA1_PLR9_TT1_32_WG64_4_1
    SolutionIndex: 183
    SolutionNameMin: Cijk_Ailk_Bljk_ZB_UserArgs_MT32x64x32_MI16x16x4x1_SN_DTVA0_GSU1_GSUASB_LBSPPB512_LPB2_MIAV1_NTA4_NLCA1_PLR9_TT1_32_WG32_8_1
    SolutionIndex: 184
    SolutionNameMin: Cijk_Ailk_Bljk_ZB_UserArgs_MT256x64x8_MI16x16x4x1_SN_DTVA1_GSU9_GSUAMB_LBSPPB128_LPB2_MIAV0_NTA4_NLCA4_PLR1_TT4_64_WG64_4_1
    SolutionIndex: 185
    SolutionNameMin: Cijk_Ailk_Bljk_ZB_UserArgs_MT64x64x32_MI16x16x4x1_SN_DTVA0_GSU1_GSUASB_LBSPPB0_LPB0_MIAV1_NTA0_NLCA1_PLR1_TT4_16_WG16_16_1
    SolutionIndex: 186
    SolutionNameMin: Cijk_Ailk_Bljk_ZB_UserArgs_MT256x32x8_MI16x16x4x1_SN_DTVA1_GSU3_GSUAMB_LBSPPB128_LPB2_MIAV0_NTA0_NLCA4_PLR3_TT4_32_WG64_4_1
    SolutionIndex: 187
    SolutionNameMin: Cijk_Ailk_Bljk_ZB_UserArgs_MT256x64x16_MI16x16x4x1_SN_DTVA1_GSU7_GSUAMB_LBSPPB256_LPB2_MIAV0_NTA4_NLCA4_PLR1_TT4_64_WG64_4_1
    SolutionIndex: 188
    SolutionNameMin: Cijk_Ailk_Bljk_ZB_UserArgs_MT80x64x16_MI16x16x4x1_SN_DTVA0_GSU1_GSUASB_LBSPPB256_LPB2_MIAV1_NTA0_NLCA5_PLR1_TT5_16_WG16_16_1
    SolutionIndex: 189
    SolutionNameMin: Cijk_Ailk_Bljk_ZB_UserArgs_MT64x64x8_MI16x16x4x1_SN_DTVA1_GSU1_GSUASB_LBSPPB128_LPB2_MIAV1_NTA0_NLCA1_PLR3_TT1_64_WG64_4_1
    SolutionIndex: 190
    SolutionNameMin: Cijk_Ailk_Bljk_ZB_UserArgs_MT192x64x16_MI16x16x4x1_SN_DTVA1_GSU7_GSUAMB_LBSPPB256_LPB2_MIAV0_NTA4_NLCA3_PLR5_TT3_64_WG64_4_1
    SolutionIndex: 191
    SolutionNameMin: Cijk_Ailk_Bljk_ZB_UserArgs_MT32x64x8_MI16x16x4x1_SN_DTVA0_GSU1_GSUASB_LBSPPB128_LPB2_MIAV1_NTA0_NLCA1_PLR1_TT2_16_WG16_16_1
    SolutionIndex: 192
    SolutionNameMin: Cijk_Ailk_Bljk_ZB_UserArgs_MT80x64x16_MI16x16x4x1_SN_DTVA0_GSU1_GSUASB_LBSPPB256_LPB2_MIAV1_NTA0_NLCA5_PLR5_TT5_16_WG16_16_1
    SolutionIndex: 193
    SolutionNameMin: Cijk_Ailk_Bljk_ZB_UserArgs_MT160x64x16_MI16x16x4x1_SN_DTVA0_GSU2_GSUAMB_LBSPPB256_LPB2_MIAV0_NTA4_NLCA5_PLR5_TT5_32_WG32_8_1
    SolutionIndex: 194
    SolutionNameMin: Cijk_Ailk_Bljk_ZB_UserArgs_MT16x16x64_MI16x16x4x1_SN_1LDSB0_DTVA1_GSU1_GSUASB_LBSPPB1024_LPB2_NLCB1_PLR1_TT1_16_WG16_4_4
    SolutionIndex: 195
    SolutionNameMin: Cijk_Ailk_Bljk_ZB_UserArgs_MT16x16x64_MI16x16x4x1_SN_1LDSB0_DTVA1_GSU10_GSUAMB_LBSPPB1024_LPB2_NLCB1_PLR1_TT1_16_WG16_4_4
    SolutionIndex: 196
    SolutionNameMin: Cijk_Ailk_Bljk_ZB_UserArgs_MT16x16x64_MI16x16x4x1_SN_1LDSB1_DTVA1_GSU12_GSUAMB_LBSPPB1024_LPB2_NLCB1_PLR5_TT1_16_WG16_4_4
    SolutionIndex: 197
    SolutionNameMin: Cijk_Ailk_Bljk_ZB_UserArgs_MT16x16x128_MI16x16x4x1_SN_1LDSB1_DTVA0_GSU3_LBSPPB0_LPB0_NLCA1_NLCB1_PLR9_TT1_16_WG16_4_4
    SolutionIndex: 198
    SolutionNameMin: Cijk_Ailk_Bljk_ZB_UserArgs_MT16x16x64_MI16x16x4x1_SN_1LDSB1_DTVA1_GSU6_LBSPPB1024_LPB2_NLCA1_NLCB1_PLR5_TT1_16_WG16_4_4
    SolutionIndex: 199
    SolutionNameMin: Cijk_Ailk_Bljk_ZB_UserArgs_MT32x16x64_MI16x16x4x1_SN_1LDSB0_DTVA1_GSU12_LBSPPB1024_LPB2_NLCA2_NLCB1_PLR5_TT2_16_WG16_4_4
    SolutionIndex: 200
    SolutionNameMin: Cijk_Ailk_Bljk_ZB_UserArgs_MT16x16x32_MI16x16x4x1_SN_1LDSB1_DTVA1_GSU3_LBSPPB512_LPB2_NLCA1_NLCB1_PLR5_TT1_16_WG16_4_2
    SolutionIndex: 201
    SolutionNameMin: Cijk_Ailk_Bljk_ZB_UserArgs_MT32x16x32_MI16x16x4x1_SN_1LDSB0_DTVA1_GSU6_LBSPPB512_LPB2_NLCA2_NLCB1_PLR1_TT2_16_WG16_4_4
    SolutionIndex: 202
    SolutionNameMin: Cijk_Ailk_Bljk_ZB_UserArgs_MT64x16x32_MI16x16x4x1_SN_1LDSB0_DTVA1_GSU12_LBSPPB512_LPB2_NLCA4_NLCB1_PLR1_TT4_16_WG16_4_4
    SolutionIndex: 203
    SolutionNameMin: Cijk_Ailk_Bljk_ZB_UserArgs_MT16x16x64_MI16x16x4x1_SN_1LDSB1_DTVA1_GSU1_GSUASB_LBSPPB1024_LPB2_NLCA1_NLCB1_PLR1_TT1_16_WG16_4_4
    SolutionIndex: 204
    SolutionNameMin: Cijk_Ailk_Bljk_ZB_UserArgs_MT64x16x32_MI16x16x4x1_SN_1LDSB1_DTVA1_GSU6_GSUAMB_LBSPPB512_LPB2_NLCA2_NLCB1_PLR5_TT2_16_WG32_4_2
    SolutionIndex: 205
    SolutionNameMin: Cijk_Ailk_Bljk_ZB_UserArgs_MT64x32x32_MI16x16x4x1_SN_1LDSB1_DTVA1_GSU15_GSUAMB_LBSPPB512_LPB2_NLCA2_NLCB1_PLR5_TT2_32_WG32_4_2
    SolutionIndex: 206
    SolutionNameMin: Cijk_Ailk_Bljk_ZB_UserArgs_MT32x16x64_MI16x16x4x1_SN_1LDSB0_DTVA1_GSU1_GSUASB_LBSPPB1024_LPB2_NLCA2_NLCB1_PLR5_TT2_16_WG16_4_4
    SolutionIndex: 207
    SolutionNameMin: Cijk_Ailk_Bljk_ZB_UserArgs_MT128x16x16_MI16x16x4x1_SN_1LDSB0_DTVA1_GSU12_GSUAMB_LBSPPB256_LPB2_NLCA4_NLCB1_PLR1_TT4_16_WG32_4_2
    SolutionIndex: 208
    SolutionNameMin: Cijk_Ailk_Bljk_ZB_UserArgs_MT128x16x16_MI16x16x4x1_SN_1LDSB1_DTVA1_GSU12_GSUAMB_LBSPPB256_LPB2_NLCA4_NLCB1_PLR3_TT4_16_WG32_4_2
    SolutionIndex: 209
    SolutionNameMin: Cijk_Ailk_Bljk_ZB_UserArgs_MT32x32x32_MI16x16x4x1_SN_DTVA1_GSU1_GSUASB_LBSPPB512_LPB2_MIAV1_NLCA2_NLCB1_PLR3_TT2_32_WG16_4_4
    SolutionIndex: 210
    SolutionNameMin: Cijk_Ailk_Bljk_ZB_UserArgs_MT32x128x16_MI16x16x4x1_SN_DTVA0_GSU13_GSUAMB_LBSPPB256_LPB2_MIAV1_NLCA1_NLCB1_PLR1_TT1_64_WG32_8_1
    SolutionIndex: 211
    SolutionNameMin: Cijk_Ailk_Bljk_ZB_UserArgs_MT64x32x16_MI16x16x4x1_SN_DTVA0_GSU6_GSUAMB_LBSPPB256_LPB2_MIAV1_NLCA1_NLCB1_PLR3_TT2_32_WG32_4_2
    SolutionIndex: 212
    SolutionNameMin: Cijk_Ailk_Bljk_ZB_UserArgs_MT32x16x64_MI16x16x4x1_SN_DTVA0_GSU1_GSUASB_LBSPPB1024_LPB2_MIAV1_NLCA1_NLCB1_PLR9_TT1_16_WG32_4_2
    SolutionIndex: 213
    SolutionNameMin: Cijk_Ailk_Bljk_ZB_UserArgs_MT64x16x32_MI16x16x4x1_SN_DTVA1_GSU1_GSUASB_LBSPPB512_LPB2_MIAV1_NLCA4_NLCB1_PLR1_TT4_16_WG16_4_4
    SolutionIndex: 214
    SolutionNameMin: Cijk_Ailk_Bljk_ZB_UserArgs_MT64x64x16_MI16x16x4x1_SN_DTVA0_GSU9_GSUAMB_LBSPPB256_LPB2_MIAV1_NLCA1_NLCB1_PLR5_TT1_64_WG64_4_1
    SolutionIndex: 215
    SolutionNameMin: Cijk_Ailk_Bljk_ZB_UserArgs_MT16x16x32_MI16x16x4x1_SN_DTVA0_GSU1_GSUASB_LBSPPB512_LPB2_MIAV1_NLCA1_NLCB1_PLR9_TT1_16_WG16_4_1
    SolutionIndex: 216
    SolutionNameMin: Cijk_Ailk_Bljk_ZB_UserArgs_MT32x32x64_MI16x16x4x1_SN_DTVA1_GSU1_GSUASB_LBSPPB1024_LPB2_MIAV1_NLCA1_NLCB1_PLR9_TT1_32_WG32_4_2
    SolutionIndex: 217
    SolutionNameMin: Cijk_Ailk_Bljk_ZB_UserArgs_MT64x128x16_MI16x16x4x1_SN_DTVA1_GSU14_GSUAMB_LBSPPB256_LPB2_MIAV0_NLCA1_NLCB1_PLR5_TT1_128_WG64_4_1
    SolutionIndex: 218
    SolutionNameMin: Cijk_Ailk_Bljk_ZB_UserArgs_MT16x64x16_MI16x16x4x1_SN_DTVA0_GSU1_GSUASB_LBSPPB256_LPB2_MIAV1_NLCA1_NLCB1_PLR1_TT1_64_WG16_4_4
    SolutionIndex: 219
    SolutionNameMin: Cijk_Ailk_Bljk_ZB_UserArgs_MT32x32x32_MI16x16x4x1_SN_DTVA0_GSU1_GSUASB_LBSPPB512_LPB2_MIAV1_NLCA1_NLCB1_PLR1_TT2_32_WG16_4_4
    SolutionIndex: 220
    SolutionNameMin: Cijk_Ailk_Bljk_ZB_UserArgs_MT128x64x16_MI16x16x4x1_SN_DTVA1_GSU9_GSUAMB_LBSPPB256_LPB2_MIAV0_NLCA2_NLCB1_PLR5_TT2_64_WG64_4_1
    SolutionIndex: 221
    SolutionNameMin: Cijk_Ailk_Bljk_ZB_UserArgs_MT32x48x16_MI16x16x4x1_SN_DTVA0_GSU1_GSUASB_LBSPPB256_LPB2_MIAV1_NLCA1_PLR1_TT1_48_WG32_4_2
    SolutionIndex: 222
    SolutionNameMin: Cijk_Ailk_Bljk_ZB_UserArgs_MT64x64x8_MI16x16x4x1_SN_DTVA0_GSU3_GSUAMB_LBSPPB128_LPB2_MIAV1_NLCA1_PLR3_TT1_64_WG64_4_1
    SolutionIndex: 223
    SolutionNameMin: Cijk_Ailk_Bljk_ZB_UserArgs_MT64x128x8_MI16x16x4x1_SN_DTVA1_GSU7_GSUAMB_LBSPPB128_LPB2_MIAV0_NLCA1_PLR1_TT1_128_WG64_4_1
    SolutionIndex: 224
    SolutionNameMin: Cijk_Ailk_Bljk_ZB_UserArgs_MT64x32x16_MI16x16x4x1_SN_DTVA0_GSU1_GSUASB_LBSPPB256_LPB2_MIAV1_NLCA1_PLR3_TT2_32_WG32_4_2
    SolutionIndex: 225
    SolutionNameMin: Cijk_Ailk_Bljk_ZB_UserArgs_MT64x32x32_MI16x16x4x1_SN_DTVA1_GSU1_GSUASB_LBSPPB512_LPB2_MIAV1_NLCA2_PLR5_TT2_32_WG32_4_2
    SolutionIndex: 226
    SolutionNameMin: Cijk_Ailk_Bljk_ZB_UserArgs_MT128x128x8_MI16x16x4x1_SN_DTVA1_GSU9_GSUAMB_LBSPPB128_LPB2_MIAV0_NLCA2_PLR3_TT2_128_WG64_4_1
    SolutionIndex: 227
    SolutionNameMin: Cijk_Ailk_Bljk_ZB_UserArgs_MT32x48x16_MI16x16x4x1_SN_DTVA1_GSU1_GSUASB_LBSPPB256_LPB2_MIAV1_NLCA1_PLR3_TT1_48_WG32_4_2
    SolutionIndex: 228
    SolutionNameMin: Cijk_Ailk_Bljk_ZB_UserArgs_MT96x128x8_MI16x16x4x1_SN_DTVA0_GSU5_GSUAMB_LBSPPB128_LPB2_MIAV0_NLCA3_PLR1_TT3_64_WG32_8_1
    SolutionIndex: 229
    SolutionNameMin: Cijk_Ailk_Bljk_ZB_UserArgs_MT128x128x16_MI16x16x4x1_SN_DTVA1_GSU7_GSUAMB_LBSPPB256_LPB2_MIAV0_NLCA2_PLR1_TT2_128_WG64_4_1
    SolutionIndex: 230
    SolutionNameMin: Cijk_Ailk_Bljk_ZB_UserArgs_MT128x32x8_MI16x16x4x1_SN_DTVA0_GSU1_GSUASB_LBSPPB128_LPB2_MIAV1_NTA0_NLCA1_PLR1_TT2_32_WG64_4_1
    SolutionIndex: 231
    SolutionNameMin: Cijk_Ailk_Bljk_ZB_UserArgs_MT64x64x16_MI16x16x4x1_SN_DTVA1_GSU1_GSUASB_LBSPPB256_LPB2_MIAV1_NTA4_NLCA1_PLR1_TT1_64_WG64_4_1
    SolutionIndex: 232
    SolutionNameMin: Cijk_Ailk_Bljk_ZB_UserArgs_MT112x128x16_MI16x16x4x1_SN_DTVA0_GSU4_GSUAMB_LBSPPB256_LPB2_MIAV0_NTA4_NLCA7_PLR1_TT7_32_WG16_16_1
    SolutionIndex: 233
    SolutionNameMin: Cijk_Ailk_Bljk_ZB_UserArgs_MT80x64x16_MI16x16x4x1_SN_DTVA0_GSU1_GSUASB_LBSPPB256_LPB2_MIAV1_NTA0_NLCA5_PLR5_TT5_16_WG16_16_1
    SolutionIndex: 234
    SolutionNameMin: Cijk_Ailk_Bljk_ZB_UserArgs_MT80x64x16_MI16x16x4x1_SN_DTVA0_GSU1_GSUASB_LBSPPB256_LPB2_MIAV1_NTA0_NLCA5_PLR1_TT5_16_WG16_16_1
    SolutionIndex: 235
    SolutionNameMin: Cijk_Ailk_Bljk_ZB_UserArgs_MT144x64x16_MI16x16x4x1_SN_DTVA0_GSU2_GSUAMB_LBSPPB256_LPB2_MIAV0_NTA0_NLCA9_PLR1_TT9_16_WG16_16_1
    SolutionIndex: 236
    SolutionNameMin: Cijk_Ailk_Bljk_ZB_UserArgs_MT128x64x16_MI16x16x4x1_SN_DTVA0_GSU1_GSUASB_LBSPPB256_LPB2_MIAV0_NTA0_NLCA1_PLR5_TT2_64_WG64_4_1
    SolutionIndex: 237
    SolutionNameMin: Cijk_Ailk_Bljk_ZB_UserArgs_MT128x64x16_MI16x16x4x1_SN_DTVA0_GSU1_GSUASB_LBSPPB256_LPB2_MIAV0_NTA0_NLCA1_PLR1_TT4_32_WG32_8_1
    SolutionIndex: 238
    SolutionNameMin: Cijk_Ailk_Bljk_ZB_UserArgs_MT112x128x16_MI16x16x4x1_SN_DTVA0_GSU2_GSUAMB_LBSPPB256_LPB2_MIAV0_NTA0_NLCA7_PLR1_TT7_32_WG16_16_1
    SolutionIndex: 239
    SolutionNameMin: Cijk_Ailk_Bljk_ZB_UserArgs_MT80x128x16_MI16x16x4x1_SN_DTVA0_GSU1_GSUASB_LBSPPB256_LPB2_MIAV0_NTA0_NLCA5_PLR5_TT5_32_WG16_16_1
    SolutionIndex: 240
    SolutionNameMin: Cijk_Ailk_Bljk_ZB_UserArgs_MT144x64x16_MI16x16x4x1_SN_DTVA0_GSU1_GSUASB_LBSPPB256_LPB2_MIAV0_NTA4_NLCA9_PLR1_TT9_16_WG16_16_1
    SolutionIndex: 241
    SolutionNameMin: Cijk_Ailk_Bljk_ZB_UserArgs_MT80x128x16_MI16x16x4x1_SN_DTVA0_GSU1_GSUASB_LBSPPB256_LPB2_MIAV0_NTA4_NLCA5_PLR1_TT5_32_WG16_16_1
    SolutionIndex: 242
    SolutionNameMin: Cijk_Ailk_Bljk_ZB_UserArgs_MT16x16x64_MI16x16x4x1_SN_1LDSB0_DTVA1_GSU4_LBSPPB1024_LPB2_NLCB1_PLR5_TT1_16_WG16_4_4
    SolutionIndex: 243
    SolutionNameMin: Cijk_Ailk_Bljk_ZB_UserArgs_MT16x16x32_MI16x16x4x1_SN_1LDSB1_DTVA0_GSU13_LBSPPB512_LPB2_NLCB1_PLR9_TT1_16_WG16_4_1
    SolutionIndex: 244
    SolutionNameMin: Cijk_Ailk_Bljk_ZB_UserArgs_MT16x16x64_MI16x16x4x1_SN_1LDSB0_DTVA1_GSU6_LBSPPB1024_LPB2_NLCB1_PLR5_TT1_16_WG16_4_4
    SolutionIndex: 245
    SolutionNameMin: Cijk_Ailk_Bljk_ZB_UserArgs_MT16x16x64_MI16x16x4x1_SN_1LDSB1_DTVA1_GSU3_LBSPPB1024_LPB2_NLCA1_NLCB1_PLR5_TT1_16_WG16_4_4
    SolutionIndex: 246
    SolutionNameMin: Cijk_Ailk_Bljk_ZB_UserArgs_MT32x16x32_MI16x16x4x1_SN_1LDSB1_DTVA1_GSU6_LBSPPB512_LPB2_NLCA1_NLCB1_PLR1_TT1_16_WG32_4_2
    SolutionIndex: 247
    SolutionNameMin: Cijk_Ailk_Bljk_ZB_UserArgs_MT32x32x32_MI16x16x4x1_SN_1LDSB0_DTVA1_GSU12_LBSPPB512_LPB2_NLCA2_NLCB1_PLR3_TT2_32_WG16_4_4
    SolutionIndex: 248
    SolutionNameMin: Cijk_Ailk_Bljk_ZB_UserArgs_MT16x16x64_MI16x16x4x1_SN_1LDSB0_DTVA1_GSU1_GSUASB_LBSPPB1024_LPB2_NLCA1_NLCB1_PLR5_TT1_16_WG16_4_4
    SolutionIndex: 249
    SolutionNameMin: Cijk_Ailk_Bljk_ZB_UserArgs_MT64x16x32_MI16x16x4x1_SN_1LDSB1_DTVA1_GSU6_GSUAMB_LBSPPB512_LPB2_NLCA4_NLCB1_PLR1_TT4_16_WG16_4_4
    SolutionIndex: 250
    SolutionNameMin: Cijk_Ailk_Bljk_ZB_UserArgs_MT64x16x16_MI16x16x4x1_SN_1LDSB0_DTVA1_GSU14_GSUAMB_LBSPPB256_LPB2_NLCA1_NLCB1_PLR5_TT1_16_WG64_4_1
    SolutionIndex: 251
    SolutionNameMin: Cijk_Ailk_Bljk_ZB_UserArgs_MT32x16x64_MI16x16x4x1_SN_1LDSB0_DTVA1_GSU1_GSUASB_LBSPPB1024_LPB2_NLCA2_NLCB1_PLR5_TT2_16_WG16_4_4
    SolutionIndex: 252
    SolutionNameMin: Cijk_Ailk_Bljk_ZB_UserArgs_MT128x16x16_MI16x16x4x1_SN_1LDSB0_DTVA1_GSU8_GSUAMB_LBSPPB256_LPB2_NLCA4_NLCB1_PLR1_TT4_16_WG32_4_2
    SolutionIndex: 253
    SolutionNameMin: Cijk_Ailk_Bljk_ZB_UserArgs_MT128x16x16_MI16x16x4x1_SN_1LDSB0_DTVA1_GSU9_GSUAMB_LBSPPB256_LPB2_NLCA4_NLCB1_PLR3_TT4_16_WG32_4_2
    SolutionIndex: 254
    SolutionNameMin: Cijk_Ailk_Bljk_ZB_UserArgs_MT32x32x32_MI16x16x4x1_SN_1LDSB0_DTVA1_GSU1_GSUASB_LBSPPB512_LPB2_MIAV1_NLCA2_NLCB1_PLR3_TT2_32_WG16_4_4
    SolutionIndex: 255
    SolutionNameMin: Cijk_Ailk_Bljk_ZB_UserArgs_MT128x16x16_MI16x16x4x1_SN_1LDSB0_DTVA1_GSU7_GSUAMB_LBSPPB256_LPB2_MIAV1_NLCA2_NLCB1_PLR1_TT2_16_WG64_4_1
    SolutionIndex: 256
    SolutionNameMin: Cijk_Ailk_Bljk_ZB_UserArgs_MT128x16x16_MI16x16x4x1_SN_1LDSB1_DTVA1_GSU7_GSUAMB_LBSPPB256_LPB2_MIAV1_NLCA4_NLCB1_PLR3_TT4_16_WG32_4_2
    SolutionIndex: 257
    SolutionNameMin: Cijk_Ailk_Bljk_ZB_UserArgs_MT32x32x16_MI16x16x4x1_SN_DTVA0_GSU1_GSUASB_LBSPPB256_LPB2_MIAV1_NLCA1_PLR1_TT1_32_WG32_4_2
    SolutionIndex: 258
    SolutionNameMin: Cijk_Ailk_Bljk_ZB_UserArgs_MT32x32x32_MI16x16x4x1_SN_DTVA1_GSU1_GSUASB_LBSPPB512_LPB2_MIAV1_NLCA1_PLR5_TT1_32_WG32_4_2
    SolutionIndex: 259
    SolutionNameMin: Cijk_Ailk_Bljk_ZB_UserArgs_MT128x64x16_MI16x16x4x1_SN_DTVA1_GSU14_GSUAMB_LBSPPB256_LPB2_MIAV0_NLCA2_PLR1_TT2_64_WG64_4_1
    SolutionIndex: 260
    SolutionNameMin: Cijk_Ailk_Bljk_ZB_UserArgs_MT32x32x16_MI16x16x4x1_SN_DTVA0_GSU1_GSUASB_LBSPPB256_LPB2_MIAV1_NLCA1_PLR1_TT1_16_WG32_8_1
    SolutionIndex: 261
    SolutionNameMin: Cijk_Ailk_Bljk_ZB_UserArgs_MT32x32x32_MI16x16x4x1_SN_DTVA0_GSU1_GSUASB_LBSPPB512_LPB2_MIAV1_NLCA1_PLR5_TT1_32_WG32_4_2
    SolutionIndex: 262
    SolutionNameMin: Cijk_Ailk_Bljk_ZB_UserArgs_MT128x64x16_MI16x16x4x1_SN_DTVA1_GSU9_GSUAMB_LBSPPB256_LPB2_MIAV0_NLCA2_PLR5_TT2_64_WG64_4_1
    SolutionIndex: 263
    SolutionNameMin: Cijk_Ailk_Bljk_ZB_UserArgs_MT64x32x16_MI16x16x4x1_SN_DTVA0_GSU1_GSUASB_LBSPPB256_LPB2_MIAV1_NLCA1_PLR1_TT2_32_WG32_4_2
    SolutionIndex: 264
    SolutionNameMin: Cijk_Ailk_Bljk_ZB_UserArgs_MT32x48x32_MI16x16x4x1_SN_DTVA0_GSU1_GSUASB_LBSPPB512_LPB2_MIAV1_NLCA1_PLR5_TT1_48_WG32_4_2
    SolutionIndex: 265
    SolutionNameMin: Cijk_Ailk_Bljk_ZB_UserArgs_MT64x128x16_MI16x16x4x1_SN_DTVA1_GSU7_GSUAMB_LBSPPB256_LPB2_MIAV0_NLCA1_PLR1_TT1_128_WG64_4_1
    SolutionIndex: 266
    SolutionNameMin: Cijk_Ailk_Bljk_ZB_UserArgs_MT32x64x32_MI16x16x4x1_SN_DTVA1_GSU1_GSUASB_LBSPPB512_LPB2_MIAV1_NLCA1_PLR5_TT1_64_WG32_4_2
    SolutionIndex: 267
    SolutionNameMin: Cijk_Ailk_Bljk_ZB_UserArgs_MT128x128x16_MI16x16x4x1_SN_DTVA1_GSU9_GSUAMB_LBSPPB256_LPB2_MIAV0_NLCA2_PLR5_TT2_128_WG64_4_1
    SolutionIndex: 268
    SolutionNameMin: Cijk_Ailk_Bljk_ZB_UserArgs_MT64x144x16_MI16x16x4x1_SN_DTVA0_GSU3_GSUAMB_LBSPPB256_LPB2_MIAV0_NLCA1_PLR1_TT1_144_WG64_4_1
    SolutionIndex: 269
    SolutionNameMin: Cijk_Ailk_Bljk_ZB_UserArgs_MT64x128x16_MI16x16x4x1_SN_DTVA1_GSU3_GSUAMB_LBSPPB256_LPB2_MIAV0_NLCA1_PLR5_TT1_128_WG64_4_1
    SolutionIndex: 270
    SolutionNameMin: Cijk_Ailk_Bljk_ZB_UserArgs_MT128x128x16_MI16x16x4x1_SN_DTVA1_GSU7_GSUAMB_LBSPPB256_LPB2_MIAV0_NLCA2_PLR5_TT2_128_WG64_4_1
    SolutionIndex: 271
    SolutionNameMin: Cijk_Ailk_Bljk_ZB_UserArgs_MT64x64x32_MI16x16x4x1_SN_DTVA1_GSU1_GSUASB_LBSPPB512_LPB2_MIAV1_NLCA1_PLR1_TT1_64_WG64_4_1
    SolutionIndex: 272
    SolutionNameMin: Cijk_Ailk_Bljk_ZB_UserArgs_MT128x32x16_MI16x16x4x1_SN_DTVA1_GSU1_GSUASB_LBSPPB256_LPB2_MIAV1_NLCA2_PLR5_TT2_32_WG64_4_1
    SolutionIndex: 273
    SolutionNameMin: Cijk_Ailk_Bljk_ZB_UserArgs_MT112x128x16_MI16x16x4x1_SN_DTVA0_GSU4_GSUAMB_LBSPPB256_LPB2_MIAV0_NLCA7_PLR1_TT7_32_WG16_16_1
    SolutionIndex: 274
    SolutionNameMin: Cijk_Ailk_Bljk_ZB_UserArgs_MT32x96x8_MI16x16x4x1_SN_DTVA0_GSU1_GSUASB_LBSPPB128_LPB2_MIAV1_NLCA1_PLR1_TT1_48_WG32_8_1
    SolutionIndex: 275
    SolutionNameMin: Cijk_Ailk_Bljk_ZB_UserArgs_MT32x96x16_MI16x16x4x1_SN_DTVA0_GSU1_GSUASB_LBSPPB256_LPB2_MIAV1_NLCA1_PLR5_TT1_48_WG32_8_1
    SolutionIndex: 276
    SolutionNameMin: Cijk_Ailk_Bljk_ZB_UserArgs_MT224x64x8_MI16x16x4x1_SN_DTVA0_GSU3_GSUAMB_LBSPPB128_LPB2_MIAV0_NLCA7_PLR1_TT7_32_WG32_8_1
    SolutionIndex: 277
    SolutionNameMin: Cijk_Ailk_Bljk_ZB_UserArgs_MT128x32x16_MI16x16x4x1_SN_DTVA1_GSU1_GSUASB_LBSPPB256_LPB2_MIAV1_NTA0_NTC3_NTD3_NLCA2_PLR5_TT2_32_WG64_4_1
    SolutionIndex: 278
    SolutionNameMin: Cijk_Ailk_Bljk_ZB_UserArgs_MT128x32x8_MI16x16x4x1_SN_DTVA1_GSU1_GSUASB_LBSPPB128_LPB2_MIAV1_NTA0_NTC3_NTD3_NLCA2_PLR1_TT2_32_WG64_4_1
    SolutionIndex: 279
    SolutionNameMin: Cijk_Ailk_Bljk_ZB_UserArgs_MT128x64x16_MI16x16x4x1_SN_DTVA0_GSU1_GSUASB_LBSPPB256_LPB2_MIAV0_NTA4_NTC0_NTD0_NLCA1_PLR1_TT2_64_WG64_4_1
    SolutionIndex: 280
    SolutionNameMin: Cijk_Ailk_Bljk_ZB_UserArgs_MT128x96x16_MI16x16x4x1_SN_DTVA0_GSU1_GSUASB_LBSPPB256_LPB2_MIAV0_NTA0_NTC0_NTD0_NLCA1_PLR5_TT4_48_WG32_8_1
    SolutionIndex: 281
    SolutionNameMin: Cijk_Ailk_Bljk_ZB_UserArgs_MT144x64x16_MI16x16x4x1_SN_DTVA0_GSU1_GSUASB_LBSPPB256_LPB2_MIAV0_NTA0_NTC3_NTD3_NLCA9_PLR1_TT9_16_WG16_16_1
    SolutionIndex: 282
    SolutionNameMin: Cijk_Ailk_Bljk_ZB_UserArgs_MT128x64x8_MI16x16x4x1_SN_DTVA1_GSU1_GSUASB_LBSPPB128_LPB2_MIAV0_NTA0_NTC0_NTD0_NLCA2_PLR3_TT2_64_WG64_4_1
    SolutionIndex: 283
    SolutionNameMin: Cijk_Ailk_Bljk_ZB_UserArgs_MT256x64x8_MI16x16x4x1_SN_DTVA1_GSU1_GSUASB_LBSPPB128_LPB2_MIAV0_NTA0_NTC3_NTD3_NLCA4_PLR3_TT4_64_WG64_4_1
    SolutionIndex: 284
    SolutionNameMin: Cijk_Ailk_Bljk_ZB_UserArgs_MT112x128x16_MI16x16x4x1_SN_DTVA0_GSU1_GSUASB_LBSPPB256_LPB2_MIAV0_NTA0_NTC3_NTD3_NLCA7_PLR5_TT7_32_WG16_16_1
    SolutionIndex: 285
    SolutionNameMin: Cijk_Ailk_Bljk_ZB_UserArgs_MT48x128x16_MI16x16x4x1_SN_DTVA0_GSU1_GSUASB_LBSPPB256_LPB2_MIAV0_NTA0_NTC0_NTD0_NLCA3_PLR5_TT3_32_WG16_16_1
    SolutionIndex: 286
    SolutionNameMin: Cijk_Ailk_Bljk_ZB_UserArgs_MT48x128x16_MI16x16x4x1_SN_DTVA0_GSU1_GSUASB_LBSPPB256_LPB2_MIAV0_NTA0_NTC3_NTD3_NLCA3_PLR5_TT3_32_WG16_16_1
    SolutionIndex: 287
    SolutionNameMin: Cijk_Ailk_Bljk_ZB_UserArgs_MT48x128x16_MI16x16x4x1_SN_DTVA0_GSU1_GSUASB_LBSPPB256_LPB2_MIAV0_NTA4_NTC0_NTD0_NLCA3_PLR5_TT3_32_WG16_16_1
    SolutionIndex: 288
    SolutionNameMin: Cijk_Ailk_Bljk_ZB_UserArgs_MT16x48x32_MI16x16x4x1_SN_DTVA0_GSU4_LBSPPB512_LPB2_NLCB1_PLR1_TT1_48_WG16_4_4
    SolutionIndex: 289
    SolutionNameMin: Cijk_Ailk_Bljk_ZB_UserArgs_MT16x16x16_MI16x16x4x1_SN_DTVA0_GSU3_LBSPPB256_LPB2_NLCB1_PLR3_TT1_16_WG16_4_2
    SolutionIndex: 290
    SolutionNameMin: Cijk_Ailk_Bljk_ZB_UserArgs_MT16x16x64_MI16x16x4x1_SN_DTVA1_GSU4_LBSPPB1024_LPB2_NLCB1_PLR9_TT1_16_WG16_4_2
    SolutionIndex: 291
    SolutionNameMin: Cijk_Ailk_Bljk_ZB_UserArgs_MT16x16x64_MI16x16x4x1_SN_DTVA1_GSU1_GSUASB_LBSPPB1024_LPB2_NLCA1_NLCB1_PLR1_TT1_16_WG16_4_4
    SolutionIndex: 292
    SolutionNameMin: Cijk_Ailk_Bljk_ZB_UserArgs_MT32x16x32_MI16x16x4x1_SN_DTVA1_GSU4_GSUAMB_LBSPPB512_LPB2_NLCA1_NLCB1_PLR5_TT1_16_WG32_4_2
    SolutionIndex: 293
    SolutionNameMin: Cijk_Ailk_Bljk_ZB_UserArgs_MT32x32x32_MI16x16x4x1_SN_DTVA1_GSU6_GSUAMB_LBSPPB512_LPB2_NLCA2_NLCB1_PLR3_TT2_32_WG16_4_4
    SolutionIndex: 294
    SolutionNameMin: Cijk_Ailk_Bljk_ZB_UserArgs_MT32x16x64_MI16x16x4x1_SN_DTVA1_GSU1_GSUASB_LBSPPB1024_LPB2_NLCA2_NLCB1_PLR5_TT2_16_WG16_4_4
    SolutionIndex: 295
    SolutionNameMin: Cijk_Ailk_Bljk_ZB_UserArgs_MT32x32x16_MI16x16x4x1_SN_DTVA0_GSU7_GSUAMB_LBSPPB256_LPB2_NLCA1_NLCB1_PLR1_TT1_16_WG32_8_1
    SolutionIndex: 296
    SolutionNameMin: Cijk_Ailk_Bljk_ZB_UserArgs_MT64x32x16_MI16x16x4x1_SN_DTVA1_GSU8_GSUAMB_LBSPPB256_LPB2_NLCA2_NLCB1_PLR1_TT2_32_WG32_4_2
    SolutionIndex: 297
    SolutionNameMin: Cijk_Ailk_Bljk_ZB_UserArgs_MT64x16x32_MI16x16x4x1_SN_DTVA1_GSU1_GSUASB_LBSPPB512_LPB2_MIAV1_NLCA4_NLCB1_PLR1_TT4_16_WG16_4_4
    SolutionIndex: 298
    SolutionNameMin: Cijk_Ailk_Bljk_ZB_UserArgs_MT128x16x16_MI16x16x4x1_SN_DTVA0_GSU6_GSUAMB_LBSPPB256_LPB2_MIAV1_NLCA1_NLCB1_PLR1_TT4_16_WG32_4_2
    SolutionIndex: 299
    SolutionNameMin: Cijk_Ailk_Bljk_ZB_UserArgs_MT128x32x16_MI16x16x4x1_SN_DTVA1_GSU14_GSUAMB_LBSPPB256_LPB2_MIAV1_NLCA2_NLCB1_PLR5_TT2_32_WG64_4_1
    SolutionIndex: 300
    SolutionNameMin: Cijk_Ailk_Bljk_ZB_UserArgs_MT32x32x16_MI16x16x4x1_SN_DTVA0_GSU1_GSUASB_LBSPPB256_LPB2_MIAV1_NLCA1_PLR1_TT1_32_WG32_4_2
    SolutionIndex: 301
    SolutionNameMin: Cijk_Ailk_Bljk_ZB_UserArgs_MT32x32x32_MI16x16x4x1_SN_DTVA1_GSU1_GSUASB_LBSPPB512_LPB2_MIAV1_NLCA1_PLR1_TT1_32_WG32_4_2
    SolutionIndex: 302
    SolutionNameMin: Cijk_Ailk_Bljk_ZB_UserArgs_MT128x32x16_MI16x16x4x1_SN_DTVA1_GSU7_GSUAMB_LBSPPB256_LPB2_MIAV1_NLCA2_PLR5_TT2_32_WG64_4_1
    SolutionIndex: 303
    SolutionNameMin: Cijk_Ailk_Bljk_ZB_UserArgs_MT16x96x16_MI16x16x4x1_SN_DTVA0_GSU1_GSUASB_LBSPPB256_LPB2_MIAV1_NLCA1_PLR1_TT1_48_WG16_8_2
    SolutionIndex: 304
    SolutionNameMin: Cijk_Ailk_Bljk_ZB_UserArgs_MT32x48x32_MI16x16x4x1_SN_DTVA0_GSU1_GSUASB_LBSPPB512_LPB2_MIAV1_NLCA1_PLR5_TT1_48_WG32_4_2
    SolutionIndex: 305
    SolutionNameMin: Cijk_Ailk_Bljk_ZB_UserArgs_MT256x64x16_MI16x16x4x1_SN_DTVA1_GSU14_GSUAMB_LBSPPB256_LPB2_MIAV0_NLCA4_PLR1_TT4_64_WG64_4_1
    SolutionIndex: 306
    SolutionNameMin: Cijk_Ailk_Bljk_ZB_UserArgs_MT64x32x8_MI16x16x4x1_SN_DTVA0_GSU1_GSUASB_LBSPPB128_LPB2_MIAV1_NLCA1_PLR3_TT2_16_WG32_8_1
    SolutionIndex: 307
    SolutionNameMin: Cijk_Ailk_Bljk_ZB_UserArgs_MT64x32x16_MI16x16x4x1_SN_DTVA1_GSU1_GSUASB_LBSPPB256_LPB2_MIAV1_NLCA1_PLR5_TT1_32_WG64_4_1
    SolutionIndex: 308
    SolutionNameMin: Cijk_Ailk_Bljk_ZB_UserArgs_MT256x64x16_MI16x16x4x1_SN_DTVA1_GSU9_GSUAMB_LBSPPB256_LPB2_MIAV0_NLCA4_PLR5_TT4_64_WG64_4_1
    SolutionIndex: 309
    SolutionNameMin: Cijk_Ailk_Bljk_ZB_UserArgs_MT64x48x16_MI16x16x4x1_SN_DTVA1_GSU1_GSUASB_LBSPPB256_LPB2_MIAV1_NLCA1_PLR5_TT1_48_WG64_4_1
    SolutionIndex: 310
    SolutionNameMin: Cijk_Ailk_Bljk_ZB_UserArgs_MT64x80x16_MI16x16x4x1_SN_DTVA1_GSU2_GSUAMB_LBSPPB256_LPB2_MIAV1_NLCA1_PLR1_TT1_80_WG64_4_1
    SolutionIndex: 311
    SolutionNameMin: Cijk_Ailk_Bljk_ZB_UserArgs_MT256x64x16_MI16x16x4x1_SN_DTVA1_GSU7_GSUAMB_LBSPPB256_LPB2_MIAV0_NLCA4_PLR1_TT4_64_WG64_4_1
    SolutionIndex: 312
    SolutionNameMin: Cijk_Ailk_Bljk_ZB_UserArgs_MT64x32x16_MI16x16x4x1_SN_DTVA1_GSU1_GSUASB_LBSPPB256_LPB2_MIAV1_NLCA2_PLR1_TT2_32_WG32_4_2
    SolutionIndex: 313
    SolutionNameMin: Cijk_Ailk_Bljk_ZB_UserArgs_MT64x32x16_MI16x16x4x1_SN_DTVA1_GSU1_GSUASB_LBSPPB256_LPB2_MIAV1_NLCA2_PLR3_TT2_32_WG32_4_2
    SolutionIndex: 314
    SolutionNameMin: Cijk_Ailk_Bljk_ZB_UserArgs_MT64x176x16_MI16x16x4x1_SN_DTVA1_GSU3_GSUAMB_LBSPPB256_LPB2_MIAV0_NLCA1_PLR1_TT1_176_WG64_4_1
    SolutionIndex: 315
    SolutionNameMin: Cijk_Ailk_Bljk_ZB_UserArgs_MT64x80x32_MI16x16x4x1_SN_DTVA1_GSU1_GSUASB_LBSPPB512_LPB2_MIAV1_NTC3_NTD3_NLCA1_PLR1_TT1_80_WG64_4_1_WGMn12
    SolutionIndex: 316
    SolutionNameMin: Cijk_Ailk_Bljk_ZB_UserArgs_MT64x80x16_MI16x16x4x1_SN_DTVA1_GSU1_GSUASB_LBSPPB256_LPB2_MIAV1_NTC3_NTD3_NLCA1_PLR1_TT1_80_WG64_4_1_WGMn12
    SolutionIndex: 317
    SolutionNameMin: Cijk_Ailk_Bljk_ZB_UserArgs_MT64x80x16_MI16x16x4x1_SN_DTVA1_GSU1_GSUASB_LBSPPB256_LPB2_MIAV1_NTC0_NTD0_NLCA1_PLR5_TT1_80_WG64_4_1_WGM1
    SolutionIndex: 318
    SolutionNameMin: Cijk_Ailk_Bljk_ZB_UserArgs_MT64x128x8_MI16x16x4x1_SN_DTVA0_GSU1_GSUASB_LBSPPB128_LPB2_MIAV0_NTC0_NTD0_NLCA1_PLR1_TT1_128_WG64_4_1_WGM1
    SolutionIndex: 319
    SolutionNameMin: Cijk_Ailk_Bljk_ZB_UserArgs_MT64x128x8_MI16x16x4x1_SN_DTVA0_GSU1_GSUASB_LBSPPB128_LPB2_MIAV0_NTC0_NTD0_NLCA1_PLR1_TT1_128_WG64_4_1_WGMn12
    SolutionIndex: 320
    SolutionNameMin: Cijk_Ailk_Bljk_ZB_UserArgs_MT128x64x16_MI16x16x4x1_SN_DTVA1_GSU1_GSUASB_LBSPPB256_LPB2_MIAV0_NTC3_NTD3_NLCA2_PLR5_TT2_64_WG64_4_1_WGM1
    SolutionIndex: 321
    SolutionNameMin: Cijk_Ailk_Bljk_ZB_UserArgs_MT128x48x16_MI16x16x4x1_SN_DTVA1_GSU1_GSUASB_LBSPPB256_LPB2_MIAV0_NTC3_NTD3_NLCA2_PLR1_TT2_48_WG64_4_1_WGM1
    SolutionIndex: 322
    SolutionNameMin: Cijk_Ailk_Bljk_ZB_UserArgs_MT128x80x16_MI16x16x4x1_SN_DTVA0_GSU1_GSUASB_LBSPPB256_LPB2_MIAV0_NTC3_NTD3_NLCA1_PLR5_TT2_80_WG64_4_1_WGM1
    SolutionIndex: 323
    SolutionNameMin: Cijk_Ailk_Bljk_ZB_UserArgs_MT128x80x16_MI16x16x4x1_SN_DTVA1_GSU1_GSUASB_LBSPPB256_LPB2_MIAV0_NTC3_NTD3_NLCA2_PLR1_TT2_80_WG64_4_1_WGMn12
    SolutionIndex: 324
    SolutionNameMin: Cijk_Ailk_Bljk_ZB_UserArgs_MT256x64x16_MI16x16x4x1_SN_DTVA1_LBSPPB256_LPB2_MIAV0_NTC3_NTD3_NLCA4_PLR5_TT4_64_WG64_4_1
    SolutionIndex: 325
    SolutionNameMin: Cijk_Ailk_Bljk_ZB_UserArgs_MT128x128x8_MI16x16x4x1_SN_DTVA0_LBSPPB128_LPB2_MIAV0_NTC3_NTD3_NLCA1_PLR3_TT2_128_WG64_4_1
    SolutionIndex: 326
    SolutionNameMin: Cijk_Ailk_Bljk_ZB_UserArgs_MT128x128x8_MI16x16x4x1_SN_DTVA1_LBSPPB128_LPB2_MIAV0_NTC0_NTD0_NLCA2_PLR3_TT2_128_WG64_4_1
    SolutionIndex: 327
    SolutionNameMin: Cijk_Ailk_Bljk_ZB_UserArgs_MT96x64x8_MI16x16x4x1_SN_DTVA0_LBSPPB128_LPB2_MIAV0_NTC0_NTD0_NLCA3_PLR1_TT6_16_WG16_16_1
    SolutionIndex: 328
    SolutionNameMin: Cijk_Ailk_Bljk_ZB_UserArgs_MT144x64x16_MI16x16x4x1_SN_DTVA0_LBSPPB256_LPB2_MIAV0_NTC3_NTD3_NLCA9_PLR5_TT9_16_WG16_16_1
    SolutionIndex: 329
    SolutionNameMin: Cijk_Ailk_Bljk_ZB_UserArgs_MT144x64x16_MI16x16x4x1_SN_DTVA0_LBSPPB256_LPB2_MIAV0_NTC0_NTD0_NLCA9_PLR1_TT9_16_WG16_16_1
    SolutionIndex: 330
    SolutionNameMin: Cijk_Ailk_Bljk_ZB_UserArgs_MT256x64x8_MI16x16x4x1_SN_DTVA0_LBSPPB128_LPB2_MIAV0_NTC3_NTD3_NLCA1_PLR3_TT8_32_WG32_8_1
    SolutionIndex: 331
    SolutionNameMin: Cijk_Ailk_Bljk_ZB_UserArgs_MT112x128x16_MI16x16x4x1_SN_DTVA0_LBSPPB256_LPB2_MIAV0_NTC0_NTD0_NLCA7_PLR5_TT7_32_WG16_16_1
    SolutionIndex: 332
    SolutionNameMin: Cijk_Ailk_Bljk_ZB_UserArgs_MT112x128x16_MI16x16x4x1_SN_DTVA0_LBSPPB256_LPB2_MIAV0_NTC3_NTD3_NLCA7_PLR1_TT7_32_WG16_16_1
    SolutionIndex: 333
    SolutionNameMin: Cijk_Ailk_Bljk_ZB_UserArgs_MT64x64x8_MI16x16x4x1_SN_DTVA0_LBSPPB128_LPB2_MIAV1_NTC0_NTD0_NLCA1_PLR3_TT4_16_WG16_16_1
    SolutionIndex: 334
    SolutionNameMin: Cijk_Ailk_Bljk_ZB_UserArgs_MT96x128x8_MI16x16x4x1_SN_DTVA0_LBSPPB128_LPB2_MIAV0_NTC3_NTD3_NLCA3_PLR3_TT6_32_WG16_16_1
    SolutionIndex: 335
    SolutionNameMin: Cijk_Ailk_Bljk_ZB_UserArgs_MT96x128x16_MI16x16x4x1_SN_DTVA0_LBSPPB256_LPB2_MIAV0_NTC0_NTD0_NLCA3_PLR1_TT3_64_WG32_8_1
    SolutionIndex: 336
    SolutionNameMin: Cijk_Ailk_Bljk_ZB_UserArgs_MT16x16x128_MI16x16x4x1_SN_DTVA1_GSU1_GSUASB_LBSPPB2048_LPB2_NLCB1_PLR9_TT1_16_WG16_4_4
    SolutionIndex: 337
    SolutionNameMin: Cijk_Ailk_Bljk_ZB_UserArgs_MT16x32x64_MI16x16x4x1_SN_DTVA1_GSU4_GSUAMB_LBSPPB1024_LPB2_NLCB1_PLR5_TT1_32_WG16_4_4
    SolutionIndex: 338
    SolutionNameMin: Cijk_Ailk_Bljk_ZB_UserArgs_MT16x16x64_MI16x16x4x1_SN_DTVA1_GSU1_GSUASB_LBSPPB1024_LPB2_NLCB1_PLR1_TT1_16_WG16_4_4
    SolutionIndex: 339
    SolutionNameMin: Cijk_Ailk_Bljk_ZB_UserArgs_MT16x64x32_MI16x16x4x1_SN_DTVA0_GSU7_GSUAMB_LBSPPB512_LPB2_NLCB1_PLR5_TT1_32_WG16_8_2
    SolutionIndex: 340
    SolutionNameMin: Cijk_Ailk_Bljk_ZB_UserArgs_MT16x64x32_MI16x16x4x1_SN_DTVA1_GSU5_GSUAMB_LBSPPB512_LPB2_NLCB1_PLR3_TT1_64_WG16_4_4
    SolutionIndex: 341
    SolutionNameMin: Cijk_Ailk_Bljk_ZB_UserArgs_MT16x16x128_MI16x16x4x1_SN_DTVA1_GSU1_GSUASB_LBSPPB2048_LPB2_NLCA1_NLCB1_PLR9_TT1_16_WG16_4_4
    SolutionIndex: 342
    SolutionNameMin: Cijk_Ailk_Bljk_ZB_UserArgs_MT32x32x32_MI16x16x4x1_SN_DTVA1_GSU4_GSUAMB_LBSPPB512_LPB2_NLCA2_NLCB1_PLR1_TT2_32_WG16_4_4
    SolutionIndex: 343
    SolutionNameMin: Cijk_Ailk_Bljk_ZB_UserArgs_MT32x32x32_MI16x16x4x1_SN_DTVA1_GSU6_GSUAMB_LBSPPB512_LPB2_NLCA1_NLCB1_PLR1_TT1_32_WG32_4_2
    SolutionIndex: 344
    SolutionNameMin: Cijk_Ailk_Bljk_ZB_UserArgs_MT32x16x64_MI16x16x4x1_SN_DTVA1_GSU1_GSUASB_LBSPPB1024_LPB2_NLCA2_NLCB1_PLR5_TT2_16_WG16_4_4
    SolutionIndex: 345
    SolutionNameMin: Cijk_Ailk_Bljk_ZB_UserArgs_MT32x16x32_MI16x16x4x1_SN_DTVA1_GSU2_GSUAMB_LBSPPB512_LPB2_NLCA2_NLCB1_PLR1_TT2_16_WG16_4_4
    SolutionIndex: 346
    SolutionNameMin: Cijk_Ailk_Bljk_ZB_UserArgs_MT32x32x32_MI16x16x4x1_SN_DTVA0_GSU6_GSUAMB_LBSPPB512_LPB2_NLCA1_NLCB1_PLR9_TT1_16_WG32_8_1
    SolutionIndex: 347
    SolutionNameMin: Cijk_Ailk_Bljk_ZB_UserArgs_MT32x16x32_MI16x16x4x1_SN_DTVA1_GSU1_GSUASB_LBSPPB512_LPB2_NLCA2_NLCB1_PLR3_TT2_16_WG16_4_4
    SolutionIndex: 348
    SolutionNameMin: Cijk_Ailk_Bljk_ZB_UserArgs_MT32x32x32_MI16x16x4x1_SN_DTVA1_GSU3_GSUAMB_LBSPPB512_LPB2_NLCA1_NLCB1_PLR1_TT1_32_WG32_4_2
    SolutionIndex: 349
    SolutionNameMin: Cijk_Ailk_Bljk_ZB_UserArgs_MT64x16x16_MI16x16x4x1_SN_DTVA0_GSU8_GSUAMB_LBSPPB256_LPB2_MIAV1_NLCA1_NLCB1_PLR1_TT1_16_WG64_4_1
    SolutionIndex: 350
    SolutionNameMin: Cijk_Ailk_Bljk_ZB_UserArgs_MT64x32x16_MI16x16x4x1_SN_DTVA1_GSU9_GSUAMB_LBSPPB256_LPB2_MIAV1_NLCA2_NLCB1_PLR3_TT2_32_WG32_4_2
    SolutionIndex: 351
    SolutionNameMin: Cijk_Ailk_Bljk_ZB_UserArgs_MT64x16x32_MI16x16x4x1_SN_DTVA1_GSU1_GSUASB_LBSPPB512_LPB2_MIAV1_NLCA4_NLCB1_PLR1_TT4_16_WG16_4_4
    SolutionIndex: 352
    SolutionNameMin: Cijk_Ailk_Bljk_ZB_UserArgs_MT64x64x32_MI16x16x4x1_SN_DTVA1_GSU14_GSUAMB_LBSPPB512_LPB2_MIAV1_NLCA1_NLCB1_PLR1_TT1_64_WG64_4_1
    SolutionIndex: 353
    SolutionNameMin: Cijk_Ailk_Bljk_ZB_UserArgs_MT64x48x32_MI16x16x4x1_SN_DTVA0_GSU9_GSUAMB_LBSPPB512_LPB2_MIAV1_NLCA1_NLCB1_PLR9_TT1_48_WG64_4_1
    SolutionIndex: 354
    SolutionNameMin: Cijk_Ailk_Bljk_ZB_UserArgs_MT32x16x64_MI16x16x4x1_SN_DTVA0_GSU1_GSUASB_LBSPPB1024_LPB2_MIAV1_NLCA1_NLCB1_PLR9_TT1_16_WG32_4_2
    SolutionIndex: 355
    SolutionNameMin: Cijk_Ailk_Bljk_ZB_UserArgs_MT64x32x32_MI16x16x4x1_SN_DTVA1_GSU3_GSUAMB_LBSPPB512_LPB2_MIAV1_NLCA2_NLCB1_PLR5_TT2_32_WG32_4_2
    SolutionIndex: 356
    SolutionNameMin: Cijk_Ailk_Bljk_ZB_UserArgs_MT64x96x16_MI16x16x4x1_SN_DTVA0_GSU14_GSUAMB_LBSPPB256_LPB2_MIAV0_NLCA1_NLCB1_PLR5_TT1_96_WG64_4_1
    SolutionIndex: 357
    SolutionNameMin: Cijk_Ailk_Bljk_ZB_UserArgs_MT32x16x64_MI16x16x4x1_SN_DTVA0_GSU1_GSUASB_LBSPPB1024_LPB2_MIAV1_NLCA1_NLCB1_PLR9_TT1_16_WG32_4_2
    SolutionIndex: 358
    SolutionNameMin: Cijk_Ailk_Bljk_ZB_UserArgs_MT128x32x16_MI16x16x4x1_SN_DTVA1_GSU8_GSUAMB_LBSPPB256_LPB2_MIAV1_NLCA2_NLCB1_PLR1_TT2_32_WG64_4_1
    SolutionIndex: 359
    SolutionNameMin: Cijk_Ailk_Bljk_ZB_UserArgs_MT32x32x16_MI16x16x4x1_SN_DTVA0_GSU1_GSUASB_LBSPPB256_LPB2_MIAV1_NLCA1_NLCB1_PLR1_TT1_32_WG32_4_2
    SolutionIndex: 360
    SolutionNameMin: Cijk_Ailk_Bljk_ZB_UserArgs_MT64x16x16_MI16x16x4x1_SN_DTVA1_GSU1_GSUASB_LBSPPB256_LPB2_MIAV1_NLCA2_NLCB1_PLR1_TT2_16_WG32_4_2
    SolutionIndex: 361
    SolutionNameMin: Cijk_Ailk_Bljk_ZB_UserArgs_MT128x64x16_MI16x16x4x1_SN_DTVA1_GSU14_GSUAMB_LBSPPB256_LPB2_MIAV0_NLCA2_NLCB1_PLR1_TT2_64_WG64_4_1
    SolutionIndex: 362
    SolutionNameMin: Cijk_Ailk_Bljk_ZB_UserArgs_MT64x16x32_MI16x16x4x1_SN_DTVA0_GSU1_GSUASB_LBSPPB512_LPB2_MIAV1_NLCA1_NLCB1_PLR3_TT4_16_WG16_4_4
    SolutionIndex: 363
    SolutionNameMin: Cijk_Ailk_Bljk_ZB_UserArgs_MT128x96x16_MI16x16x4x1_SN_DTVA0_GSU14_GSUAMB_LBSPPB256_LPB2_MIAV0_NLCA1_NLCB1_PLR5_TT4_48_WG32_8_1
    SolutionIndex: 364
    SolutionNameMin: Cijk_Ailk_Bljk_ZB_UserArgs_MT32x32x32_MI16x16x4x1_SN_DTVA0_GSU1_GSUASB_LBSPPB512_LPB2_MIAV1_NLCA1_PLR9_TT1_16_WG32_8_1
    SolutionIndex: 365
    SolutionNameMin: Cijk_Ailk_Bljk_ZB_UserArgs_MT64x16x16_MI16x16x4x1_SN_DTVA1_GSU1_GSUASB_LBSPPB256_LPB2_MIAV1_NLCA2_PLR3_TT2_16_WG32_4_2
    SolutionIndex: 366
    SolutionNameMin: Cijk_Ailk_Bljk_ZB_UserArgs_MT256x48x16_MI16x16x4x1_SN_DTVA1_GSU14_GSUAMB_LBSPPB256_LPB2_MIAV0_NLCA4_PLR1_TT4_48_WG64_4_1
    SolutionIndex: 367
    SolutionNameMin: Cijk_Ailk_Bljk_ZB_UserArgs_MT128x16x16_MI16x16x4x1_SN_DTVA1_GSU1_GSUASB_LBSPPB256_LPB2_MIAV1_NLCA4_PLR1_TT4_16_WG32_4_2
    SolutionIndex: 368
    SolutionNameMin: Cijk_Ailk_Bljk_ZB_UserArgs_MT128x32x16_MI16x16x4x1_SN_DTVA1_GSU3_GSUAMB_LBSPPB256_LPB2_MIAV1_NLCA2_PLR5_TT2_32_WG64_4_1
    SolutionIndex: 369
    SolutionNameMin: Cijk_Ailk_Bljk_ZB_UserArgs_MT128x64x16_MI16x16x4x1_SN_DTVA1_GSU7_GSUAMB_LBSPPB256_LPB2_MIAV0_NLCA2_PLR1_TT2_64_WG64_4_1
    SolutionIndex: 370
    SolutionNameMin: Cijk_Ailk_Bljk_ZB_UserArgs_MT64x32x16_MI16x16x4x1_SN_DTVA0_GSU1_GSUASB_LBSPPB256_LPB2_MIAV1_NLCA1_PLR1_TT2_32_WG32_4_2
    SolutionIndex: 371
    SolutionNameMin: Cijk_Ailk_Bljk_ZB_UserArgs_MT64x32x32_MI16x16x4x1_SN_DTVA0_GSU1_GSUASB_LBSPPB512_LPB2_MIAV1_NLCA1_PLR5_TT2_32_WG32_4_2
    SolutionIndex: 372
    SolutionNameMin: Cijk_Ailk_Bljk_ZB_UserArgs_MT256x64x16_MI16x16x4x1_SN_DTVA1_GSU9_GSUAMB_LBSPPB256_LPB2_MIAV0_NLCA4_PLR5_TT4_64_WG64_4_1
    SolutionIndex: 373
    SolutionNameMin: Cijk_Ailk_Bljk_ZB_UserArgs_MT32x64x8_MI16x16x4x1_SN_DTVA0_GSU1_GSUASB_LBSPPB128_LPB2_MIAV1_NLCA1_PLR1_TT1_32_WG32_8_1
    SolutionIndex: 374
    SolutionNameMin: Cijk_Ailk_Bljk_ZB_UserArgs_MT64x32x32_MI16x16x4x1_SN_DTVA0_GSU1_GSUASB_LBSPPB512_LPB2_MIAV1_NLCA1_PLR5_TT2_32_WG32_4_2
    SolutionIndex: 375
    SolutionNameMin: Cijk_Ailk_Bljk_ZB_UserArgs_MT256x64x8_MI16x16x4x1_SN_DTVA1_GSU9_GSUAMB_LBSPPB128_LPB2_MIAV0_NLCA4_PLR1_TT4_64_WG64_4_1
    SolutionIndex: 376
    SolutionNameMin: Cijk_Ailk_Bljk_ZB_UserArgs_MT64x48x32_MI16x16x4x1_SN_DTVA0_GSU1_GSUASB_LBSPPB512_LPB2_MIAV1_NLCA1_PLR1_TT1_48_WG64_4_1
    SolutionIndex: 377
    SolutionNameMin: Cijk_Ailk_Bljk_ZB_UserArgs_MT256x64x16_MI16x16x4x1_SN_DTVA1_GSU7_GSUAMB_LBSPPB256_LPB2_MIAV0_NLCA4_PLR5_TT4_64_WG64_4_1
    SolutionIndex: 378
    SolutionNameMin: Cijk_Ailk_Bljk_ZB_UserArgs_MT64x32x8_MI16x16x4x1_SN_DTVA0_GSU1_GSUASB_LBSPPB128_LPB2_MIAV1_NLCA1_PLR1_TT1_32_WG64_4_1
    SolutionIndex: 379
    SolutionNameMin: Cijk_Ailk_Bljk_ZB_UserArgs_MT128x112x16_MI16x16x4x1_SN_DTVA1_GSU4_GSUAMB_LBSPPB256_LPB2_MIAV0_NLCA2_PLR5_TT2_112_WG64_4_1
    SolutionIndex: 380
    SolutionNameMin: Cijk_Ailk_Bljk_ZB_UserArgs_MT64x192x8_MI16x16x4x1_SN_DTVA1_GSU4_GSUAMB_LBSPPB128_LPB2_MIAV0_NLCA1_PLR1_TT1_192_WG64_4_1
    SolutionIndex: 381
    SolutionNameMin: Cijk_Ailk_Bljk_ZB_UserArgs_MT256x64x8_MI16x16x4x1_SN_DTVA1_GSU6_GSUAMB_LBSPPB128_LPB2_MIAV0_NLCA4_PLR1_TT4_64_WG64_4_1
    SolutionIndex: 382
    SolutionNameMin: Cijk_Ailk_Bljk_ZB_UserArgs_MT64x64x16_MI16x16x4x1_SN_DTVA1_GSU1_GSUASB_LBSPPB256_LPB2_MIAV1_NLCA1_PLR5_TT1_64_WG64_4_1
    SolutionIndex: 383
    SolutionNameMin: Cijk_Ailk_Bljk_ZB_UserArgs_MT64x64x16_MI16x16x4x1_SN_DTVA0_GSU1_GSUASB_LBSPPB256_LPB2_MIAV1_NLCA1_PLR5_TT1_64_WG64_4_1
    SolutionIndex: 384
    SolutionNameMin: Cijk_Ailk_Bljk_ZB_UserArgs_MT128x112x16_MI16x16x4x1_SN_DTVA1_GSU4_GSUAMB_LBSPPB256_LPB2_MIAV0_NLCA2_PLR1_TT2_112_WG64_4_1
    SolutionIndex: 385
    SolutionNameMin: Cijk_Ailk_Bljk_ZB_UserArgs_MT64x96x16_MI16x16x4x1_SN_DTVA1_GSU1_GSUASB_LBSPPB256_LPB2_MIAV0_NLCA1_PLR1_TT1_96_WG64_4_1
    SolutionIndex: 386
    SolutionNameMin: Cijk_Ailk_Bljk_ZB_UserArgs_MT64x96x16_MI16x16x4x1_SN_DTVA1_GSU1_GSUASB_LBSPPB256_LPB2_MIAV0_NLCA1_PLR5_TT1_96_WG64_4_1
    SolutionIndex: 387
    SolutionNameMin: Cijk_Ailk_Bljk_ZB_UserArgs_MT64x64x8_MI16x16x4x1_SN_DTVA1_GSU1_GSUASB_LBSPPB128_LPB2_MIAV1_NLCA1_PLR1_TT1_64_WG64_4_1
    SolutionIndex: 388
    SolutionNameMin: Cijk_Ailk_Bljk_ZB_UserArgs_MT64x64x8_MI16x16x4x1_SN_DTVA0_GSU1_GSUASB_LBSPPB128_LPB2_MIAV1_NLCA1_PLR3_TT2_32_WG32_8_1
    SolutionIndex: 389
    SolutionNameMin: Cijk_Ailk_Bljk_ZB_UserArgs_MT192x80x16_MI16x16x4x1_SN_DTVA1_GSU4_GSUAMB_LBSPPB256_LPB2_MIAV0_NLCA3_PLR5_TT3_80_WG64_4_1
    SolutionIndex: 390
    SolutionNameMin: Cijk_Ailk_Bljk_ZB_UserArgs_MT32x160x8_MI16x16x4x1_SN_DTVA0_GSU1_GSUASB_LBSPPB128_LPB2_MIAV1_NLCA1_PLR3_TT1_80_WG32_8_1
    SolutionIndex: 391
    SolutionNameMin: Cijk_Ailk_Bljk_ZB_UserArgs_MT128x32x16_MI16x16x4x1_SN_DTVA1_GSU1_GSUASB_LBSPPB256_LPB2_MIAV1_NLCA2_PLR5_TT2_32_WG64_4_1
    SolutionIndex: 392
    SolutionNameMin: Cijk_Ailk_Bljk_ZB_UserArgs_MT128x80x16_MI16x16x4x1_SN_DTVA1_GSU1_GSUASB_LBSPPB256_LPB2_MIAV0_NLCA2_PLR5_TT2_80_WG64_4_1
    SolutionIndex: 393
    SolutionNameMin: Cijk_Ailk_Bljk_ZB_UserArgs_MT128x64x8_MI16x16x4x1_SN_DTVA1_GSU1_GSUASB_LBSPPB128_LPB2_MIAV0_NLCA2_PLR3_TT2_64_WG64_4_1
    SolutionIndex: 394
    SolutionNameMin: Cijk_Ailk_Bljk_ZB_UserArgs_MT64x32x8_MI16x16x4x1_SN_DTVA1_GSU1_GSUASB_LBSPPB128_LPB2_MIAV1_NLCA1_PLR1_TT1_32_WG64_4_1
    SolutionIndex: 395
    SolutionNameMin: Cijk_Ailk_Bljk_ZB_UserArgs_MT64x128x16_MI16x16x4x1_SN_DTVA1_GSU1_GSUASB_LBSPPB256_LPB2_MIAV0_NLCA1_PLR1_TT1_128_WG64_4_1
    SolutionIndex: 396
    SolutionNameMin: Cijk_Ailk_Bljk_ZB_UserArgs_MT128x128x8_MI16x16x4x1_SN_DTVA0_GSU3_GSUAMB_LBSPPB128_LPB2_MIAV0_NLCA1_PLR1_TT2_128_WG64_4_1
    SolutionIndex: 397
    SolutionNameMin: Cijk_Ailk_Bljk_ZB_UserArgs_MT64x112x16_MI16x16x4x1_SN_DTVA0_GSU1_GSUASB_LBSPPB256_LPB2_MIAV0_NLCA1_PLR5_TT1_112_WG64_4_1
    SolutionIndex: 398
    SolutionNameMin: Cijk_Ailk_Bljk_ZB_UserArgs_MT64x112x16_MI16x16x4x1_SN_DTVA1_GSU1_GSUASB_LBSPPB256_LPB2_MIAV0_NLCA1_PLR5_TT1_112_WG64_4_1
    SolutionIndex: 399
    SolutionNameMin: Cijk_Ailk_Bljk_ZB_UserArgs_MT128x48x16_MI16x16x4x1_SN_DTVA1_GSU1_GSUASB_LBSPPB256_LPB2_MIAV0_NLCA2_PLR5_TT2_48_WG64_4_1
    SolutionIndex: 400
    SolutionNameMin: Cijk_Ailk_Bljk_ZB_UserArgs_MT96x64x8_MI16x16x4x1_SN_DTVA0_GSU1_GSUASB_LBSPPB128_LPB2_MIAV0_NLCA3_PLR3_TT6_16_WG16_16_1
    SolutionIndex: 401
    SolutionNameMin: Cijk_Ailk_Bljk_ZB_UserArgs_MT64x176x16_MI16x16x4x1_SN_DTVA1_GSU1_GSUASB_LBSPPB256_LPB2_MIAV0_NLCA1_PLR1_TT1_176_WG64_4_1
    SolutionIndex: 402
    SolutionNameMin: Cijk_Ailk_Bljk_ZB_UserArgs_MT64x112x32_MI16x16x4x1_SN_DTVA1_GSU1_GSUASB_LBSPPB512_LPB2_MIAV0_NTC3_NTD3_NLCA1_PLR1_TT1_112_WG64_4_1_WGMn12
    SolutionIndex: 403
    SolutionNameMin: Cijk_Ailk_Bljk_ZB_UserArgs_MT64x112x16_MI16x16x4x1_SN_DTVA0_GSU1_GSUASB_LBSPPB256_LPB2_MIAV0_NTC0_NTD0_NLCA1_PLR5_TT1_112_WG64_4_1_WGMn12
    SolutionIndex: 404
    SolutionNameMin: Cijk_Ailk_Bljk_ZB_UserArgs_MT64x112x16_MI16x16x4x1_SN_DTVA1_GSU1_GSUASB_LBSPPB256_LPB2_MIAV0_NTC3_NTD3_NLCA1_PLR5_TT1_112_WG64_4_1_WGM1
    SolutionIndex: 405
    SolutionNameMin: Cijk_Ailk_Bljk_ZB_UserArgs_MT128x48x16_MI16x16x4x1_SN_DTVA1_GSU1_GSUASB_LBSPPB256_LPB2_MIAV0_NTC0_NTD0_NLCA2_PLR1_TT2_48_WG64_4_1_WGMn12
    SolutionIndex: 406
    SolutionNameMin: Cijk_Ailk_Bljk_ZB_UserArgs_MT96x128x16_MI16x16x4x1_SN_DTVA0_GSU1_GSUASB_LBSPPB256_LPB2_MIAV0_NTC3_NTD3_NLCA3_PLR5_TT3_64_WG32_8_1_WGM1
    SolutionIndex: 407
    SolutionNameMin: Cijk_Ailk_Bljk_ZB_UserArgs_MT128x96x16_MI16x16x4x1_SN_DTVA1_GSU1_GSUASB_LBSPPB256_LPB2_MIAV0_NTC0_NTD0_NLCA2_PLR1_TT2_96_WG64_4_1_WGMn12
    SolutionIndex: 408
    SolutionNameMin: Cijk_Ailk_Bljk_ZB_UserArgs_MT256x32x8_MI16x16x4x1_SN_DTVA1_GSU1_GSUASB_LBSPPB128_LPB2_MIAV0_NTC3_NTD3_NLCA4_PLR3_TT4_32_WG64_4_1_WGMn12
    SolutionIndex: 409
    SolutionNameMin: Cijk_Ailk_Bljk_ZB_UserArgs_MT128x112x16_MI16x16x4x1_SN_DTVA1_GSU1_GSUASB_LBSPPB256_LPB2_MIAV0_NTC3_NTD3_NLCA2_PLR5_TT2_112_WG64_4_1_WGM1
    SolutionIndex: 410
    SolutionNameMin: Cijk_Ailk_Bljk_ZB_UserArgs_MT128x112x16_MI16x16x4x1_SN_DTVA1_GSU1_GSUASB_LBSPPB256_LPB2_MIAV0_NTC3_NTD3_NLCA2_PLR5_TT2_112_WG64_4_1_WGMn12
    SolutionIndex: 411
    SolutionNameMin: Cijk_Ailk_Bljk_ZB_UserArgs_MT128x128x16_MI16x16x4x1_SN_DTVA0_GSU1_GSUASB_LBSPPB0_LPB0_MIAV0_NTC3_NTD3_NLCA1_PLR1_TT4_64_WG32_8_1_WGMn12
    SolutionIndex: 412
    SolutionNameMin: Cijk_Ailk_Bljk_ZB_UserArgs_MT128x80x16_MI16x16x4x1_SN_DTVA1_GSU1_GSUASB_LBSPPB256_LPB2_MIAV0_NTC3_NTD3_NLCA2_PLR1_TT2_80_WG64_4_1_WGM1
    SolutionIndex: 413
    SolutionNameMin: Cijk_Ailk_Bljk_ZB_UserArgs_MT128x128x8_MI16x16x4x1_SN_DTVA0_GSU1_GSUASB_LBSPPB128_LPB2_MIAV0_NTC3_NTD3_NLCA1_PLR1_TT4_64_WG32_8_1_WGM1
    SolutionIndex: 414
    SolutionNameMin: Cijk_Ailk_Bljk_ZB_UserArgs_MT192x80x16_MI16x16x4x1_SN_DTVA1_GSU1_GSUASB_LBSPPB256_LPB2_MIAV0_NTC3_NTD3_NLCA3_PLR1_TT3_80_WG64_4_1_WGMn12
    SolutionIndex: 415
    SolutionNameMin: Cijk_Ailk_Bljk_ZB_UserArgs_MT192x80x16_MI16x16x4x1_SN_DTVA1_GSU1_GSUASB_LBSPPB256_LPB2_MIAV0_NTC0_NTD0_NLCA3_PLR1_TT3_80_WG64_4_1_WGM1
    SolutionIndex: 416
    SolutionNameMin: Cijk_Ailk_Bljk_ZB_UserArgs_MT32x160x8_MI16x16x4x1_SN_DTVA0_GSU1_GSUASB_LBSPPB128_LPB2_MIAV1_NTC3_NTD3_NLCA1_PLR3_TT1_80_WG32_8_1_WGM1
    SolutionIndex: 417
    SolutionNameMin: Cijk_Ailk_Bljk_ZB_UserArgs_MT128x80x16_MI16x16x4x1_SN_DTVA1_GSU1_GSUASB_LBSPPB256_LPB2_MIAV0_NTC3_NTD3_NLCA2_PLR5_TT2_80_WG64_4_1_WGM1
    SolutionIndex: 418
    SolutionNameMin: Cijk_Ailk_Bljk_ZB_UserArgs_MT64x112x16_MI16x16x4x1_SN_DTVA1_GSU1_GSUASB_LBSPPB256_LPB2_MIAV0_NTC0_NTD0_NLCA1_PLR1_TT1_112_WG64_4_1_WGM1
    SolutionIndex: 419
    SolutionNameMin: Cijk_Ailk_Bljk_ZB_UserArgs_MT128x112x16_MI16x16x4x1_SN_DTVA1_GSU1_GSUASB_LBSPPB256_LPB2_MIAV0_NTC3_NTD3_NLCA2_PLR1_TT2_112_WG64_4_1_WGM1
    SolutionIndex: 420
    SolutionNameMin: Cijk_Ailk_Bljk_ZB_UserArgs_MT64x112x16_MI16x16x4x1_SN_DTVA1_GSU1_GSUASB_LBSPPB256_LPB2_MIAV0_NTC3_NTD3_NLCA1_PLR1_TT1_112_WG64_4_1_WGM1
    SolutionIndex: 421
    SolutionNameMin: Cijk_Ailk_Bljk_ZB_UserArgs_MT128x112x16_MI16x16x4x1_SN_DTVA1_GSU1_GSUASB_LBSPPB256_LPB2_MIAV0_NTC3_NTD3_NLCA2_PLR1_TT2_112_WG64_4_1_WGMn12
    SolutionIndex: 422
    SolutionNameMin: Cijk_Ailk_Bljk_ZB_UserArgs_MT128x96x16_MI16x16x4x1_SN_DTVA0_LBSPPB256_LPB2_NLCA1_PLR1_TT2_96_WG64_4_1
    SolutionIndex: 423
    SolutionNameMin: Cijk_Ailk_Bljk_ZB_UserArgs_MT128x96x8_MI16x16x4x1_SN_DTVA1_LBSPPB128_LPB2_NLCA2_PLR1_TT2_96_WG64_4_1
    SolutionIndex: 424
    SolutionNameMin: Cijk_Ailk_Bljk_ZB_UserArgs_MT128x96x8_MI16x16x4x1_SN_DTVA1_LBSPPB128_LPB2_NLCA2_PLR3_TT2_96_WG64_4_1
    SolutionIndex: 425
    SolutionNameMin: Cijk_Ailk_Bljk_ZB_UserArgs_MT112x128x16_MI16x16x4x1_SN_DTVA0_LBSPPB256_LPB2_NLCA7_PLR5_TT7_32_WG16_16_1
    SolutionIndex: 426
    SolutionNameMin: Cijk_Ailk_Bljk_ZB_UserArgs_MT128x112x16_MI16x16x4x1_SN_DTVA1_LBSPPB256_LPB2_NLCA2_PLR5_TT2_112_WG64_4_1
    SolutionIndex: 427
    SolutionNameMin: Cijk_Ailk_Bljk_ZB_UserArgs_MT96x128x16_MI16x16x4x1_SN_DTVA0_LBSPPB256_LPB2_NLCA3_PLR5_TT3_64_WG32_8_1
    SolutionIndex: 428
    SolutionNameMin: Cijk_Ailk_Bljk_ZB_UserArgs_MT128x112x16_MI16x16x4x1_SN_DTVA1_LBSPPB256_LPB2_NLCA2_PLR1_TT2_112_WG64_4_1
    SolutionIndex: 429
    SolutionNameMin: Cijk_Ailk_Bljk_ZB_UserArgs_MT96x96x8_MI16x16x4x1_SN_DTVA0_LBSPPB128_LPB2_NLCA3_PLR3_TT3_48_WG32_8_1
    SolutionIndex: 430
    SolutionNameMin: Cijk_Ailk_Bljk_ZB_UserArgs_MT128x128x16_MI16x16x4x1_SN_DTVA1_LBSPPB256_LPB2_NLCA2_PLR1_TT2_128_WG64_4_1
    SolutionIndex: 431
    SolutionNameMin: Cijk_Ailk_Bljk_ZB_UserArgs_MT160x96x8_MI16x16x4x1_SN_DTVA0_LBSPPB128_LPB2_NLCA5_PLR3_TT5_48_WG32_8_1
    SolutionIndex: 432
    SolutionNameMin: Cijk_Ailk_Bljk_ZB_UserArgs_MT112x128x16_MI16x16x4x1_SN_DTVA0_LBSPPB256_LPB2_NLCA7_PLR1_TT7_32_WG16_16_1
    SolutionIndex: 433
    SolutionNameMin: Cijk_Ailk_Bljk_ZB_UserArgs_MT128x96x8_MI16x16x4x1_SN_DTVA0_LBSPPB128_LPB2_NLCA1_PLR1_TT4_48_WG32_8_1
    SolutionIndex: 434
    SolutionNameMin: Cijk_Ailk_Bljk_ZB_UserArgs_MT96x128x8_MI16x16x4x1_SN_DTVA0_LBSPPB128_LPB2_NLCA3_PLR1_TT3_64_WG32_8_1
    SolutionIndex: 435
    SolutionNameMin: Cijk_Ailk_Bljk_ZB_UserArgs_MT128x112x16_MI16x16x4x1_SN_DTVA0_LBSPPB256_LPB2_NLCA1_PLR5_TT2_112_WG64_4_1
    SolutionIndex: 436
    SolutionNameMin: Cijk_Ailk_Bljk_ZB_UserArgs_MT128x96x8_MI16x16x4x1_SN_DTVA0_LBSPPB128_LPB2_NLCA1_PLR3_TT2_96_WG64_4_1
    SolutionIndex: 437
    SolutionNameMin: Cijk_Ailk_Bljk_ZB_UserArgs_MT128x128x8_MI16x16x4x1_SN_DTVA1_LBSPPB128_LPB2_NLCA2_PLR3_TT2_128_WG64_4_1
    SolutionIndex: 438
    SolutionNameMin: Cijk_Ailk_Bljk_ZB_UserArgs_MT16x16x32_MI16x16x4x1_SN_DTVA1_GSU1_GSUASB_LBSPPB512_LPB2_NLCB1_PLR5_TT1_16_WG16_4_2
    SolutionIndex: 439
    SolutionNameMin: Cijk_Ailk_Bljk_ZB_UserArgs_MT16x32x64_MI16x16x4x1_SN_DTVA1_GSU1_GSUASB_LBSPPB1024_LPB2_NLCB1_PLR1_TT1_32_WG16_4_4
    SolutionIndex: 440
    SolutionNameMin: Cijk_Ailk_Bljk_ZB_UserArgs_MT16x128x16_MI16x16x4x1_SN_DTVA0_GSU9_GSUAMB_LBSPPB256_LPB2_NLCB1_PLR1_TT1_32_WG16_16_1
    SolutionIndex: 441
    SolutionNameMin: Cijk_Ailk_Bljk_ZB_UserArgs_MT16x16x64_MI16x16x4x1_SN_DTVA0_GSU1_GSUASB_LBSPPB1024_LPB2_NLCB1_PLR9_TT1_16_WG16_4_2
    SolutionIndex: 442
    SolutionNameMin: Cijk_Ailk_Bljk_ZB_UserArgs_MT16x48x32_MI16x16x4x1_SN_DTVA1_GSU1_GSUASB_LBSPPB512_LPB2_NLCB1_PLR1_TT1_48_WG16_4_4
    SolutionIndex: 443
    SolutionNameMin: Cijk_Ailk_Bljk_ZB_UserArgs_MT16x128x16_MI16x16x4x1_SN_DTVA0_GSU6_GSUAMB_LBSPPB256_LPB2_NLCB1_PLR3_TT1_64_WG16_8_2
    SolutionIndex: 444
    SolutionNameMin: Cijk_Ailk_Bljk_ZB_UserArgs_MT16x32x64_MI16x16x4x1_SN_DTVA0_GSU1_GSUASB_LBSPPB1024_LPB2_NLCB1_PLR9_TT1_16_WG16_8_2
    SolutionIndex: 445
    SolutionNameMin: Cijk_Ailk_Bljk_ZB_UserArgs_MT16x32x64_MI16x16x4x1_SN_DTVA1_GSU1_GSUASB_LBSPPB1024_LPB2_NLCB1_PLR5_TT1_32_WG16_4_4
    SolutionIndex: 446
    SolutionNameMin: Cijk_Ailk_Bljk_ZB_UserArgs_MT32x32x32_MI16x16x4x1_SN_DTVA1_GSU1_GSUASB_LBSPPB512_LPB2_MIAV1_NLCA2_NLCB1_PLR1_TT2_32_WG16_4_4
    SolutionIndex: 447
    SolutionNameMin: Cijk_Ailk_Bljk_ZB_UserArgs_MT32x32x32_MI16x16x4x1_SN_DTVA1_GSU1_GSUASB_LBSPPB512_LPB2_MIAV1_NLCA1_NLCB1_PLR5_TT1_32_WG32_4_2
    SolutionIndex: 448
    SolutionNameMin: Cijk_Ailk_Bljk_ZB_UserArgs_MT32x96x16_MI16x16x4x1_SN_DTVA0_GSU9_GSUAMB_LBSPPB256_LPB2_MIAV1_NLCA1_NLCB1_PLR1_TT1_48_WG32_8_1
    SolutionIndex: 449
    SolutionNameMin: Cijk_Ailk_Bljk_ZB_UserArgs_MT32x16x64_MI16x16x4x1_SN_DTVA0_GSU1_GSUASB_LBSPPB1024_LPB2_MIAV1_NLCA1_NLCB1_PLR9_TT1_16_WG32_4_2
    SolutionIndex: 450
    SolutionNameMin: Cijk_Ailk_Bljk_ZB_UserArgs_MT32x16x64_MI16x16x4x1_SN_DTVA1_GSU1_GSUASB_LBSPPB1024_LPB2_MIAV1_NLCA1_NLCB1_PLR1_TT1_16_WG32_4_2
    SolutionIndex: 451
    SolutionNameMin: Cijk_Ailk_Bljk_ZB_UserArgs_MT32x96x16_MI16x16x4x1_SN_DTVA0_GSU6_GSUAMB_LBSPPB256_LPB2_MIAV1_NLCA1_NLCB1_PLR5_TT1_48_WG32_8_1
    SolutionIndex: 452
    SolutionNameMin: Cijk_Ailk_Bljk_ZB_UserArgs_MT16x48x16_MI16x16x4x1_SN_DTVA0_GSU1_GSUASB_LBSPPB256_LPB2_MIAV1_NLCA1_NLCB1_PLR1_TT1_48_WG16_4_4
    SolutionIndex: 453
    SolutionNameMin: Cijk_Ailk_Bljk_ZB_UserArgs_MT32x32x32_MI16x16x4x1_SN_DTVA1_GSU1_GSUASB_LBSPPB512_LPB2_MIAV1_NLCA2_NLCB1_PLR3_TT2_32_WG16_4_4
    SolutionIndex: 454
    SolutionNameMin: Cijk_Ailk_Bljk_ZB_UserArgs_MT32x64x16_MI16x16x4x1_SN_DTVA0_GSU3_GSUAMB_LBSPPB256_LPB2_MIAV1_NLCA1_NLCB1_PLR1_TT2_32_WG16_8_2
    SolutionIndex: 455
    SolutionNameMin: Cijk_Ailk_Bljk_ZB_UserArgs_MT64x16x32_MI16x16x4x1_SN_DTVA0_GSU1_GSUASB_LBSPPB512_LPB2_MIAV1_NLCA1_PLR9_TT1_16_WG64_4_1
    SolutionIndex: 456
    SolutionNameMin: Cijk_Ailk_Bljk_ZB_UserArgs_MT64x16x32_MI16x16x4x1_SN_DTVA1_GSU1_GSUASB_LBSPPB512_LPB2_MIAV1_NLCA2_PLR1_TT2_16_WG32_4_2
    SolutionIndex: 457
    SolutionNameMin: Cijk_Ailk_Bljk_ZB_UserArgs_MT64x128x16_MI16x16x4x1_SN_DTVA0_GSU14_GSUAMB_LBSPPB256_LPB2_MIAV0_NLCA1_PLR5_TT1_128_WG64_4_1
    SolutionIndex: 458
    SolutionNameMin: Cijk_Ailk_Bljk_ZB_UserArgs_MT64x16x16_MI16x16x4x1_SN_DTVA0_GSU1_GSUASB_LBSPPB256_LPB2_MIAV1_NLCA1_PLR3_TT2_16_WG32_4_2
    SolutionIndex: 459
    SolutionNameMin: Cijk_Ailk_Bljk_ZB_UserArgs_MT64x112x16_MI16x16x4x1_SN_DTVA0_GSU8_GSUAMB_LBSPPB256_LPB2_MIAV0_NLCA1_PLR1_TT1_112_WG64_4_1
    SolutionIndex: 460
    SolutionNameMin: Cijk_Ailk_Bljk_ZB_UserArgs_MT32x64x16_MI16x16x4x1_SN_DTVA0_GSU1_GSUASB_LBSPPB256_LPB2_MIAV1_NLCA1_PLR1_TT1_64_WG32_4_2
    SolutionIndex: 461
    SolutionNameMin: Cijk_Ailk_Bljk_ZB_UserArgs_MT64x80x16_MI16x16x4x1_SN_DTVA0_GSU4_GSUAMB_LBSPPB256_LPB2_MIAV1_NLCA1_PLR1_TT1_80_WG64_4_1
    SolutionIndex: 462
    SolutionNameMin: Cijk_Ailk_Bljk_ZB_UserArgs_MT64x112x16_MI16x16x4x1_SN_DTVA1_GSU12_GSUAMB_LBSPPB256_LPB2_MIAV0_NLCA1_PLR5_TT1_112_WG64_4_1
    SolutionIndex: 463
    SolutionNameMin: Cijk_Ailk_Bljk_ZB_UserArgs_MT32x48x16_MI16x16x4x1_SN_DTVA1_GSU1_GSUASB_LBSPPB256_LPB2_MIAV1_NLCA1_PLR1_TT1_48_WG32_4_2
    SolutionIndex: 464
    SolutionNameMin: Cijk_Ailk_Bljk_ZB_UserArgs_MT128x32x16_MI16x16x4x1_SN_DTVA1_GSU3_GSUAMB_LBSPPB256_LPB2_MIAV1_NLCA2_PLR5_TT2_32_WG64_4_1
    SolutionIndex: 465
    SolutionNameMin: Cijk_Ailk_Bljk_ZB_UserArgs_MT128x112x16_MI16x16x4x1_SN_DTVA1_GSU12_GSUAMB_LBSPPB256_LPB2_MIAV0_NLCA2_PLR1_TT2_112_WG64_4_1
    SolutionIndex: 466
    SolutionNameMin: Cijk_Ailk_Bljk_ZB_UserArgs_MT64x32x16_MI16x16x4x1_SN_DTVA1_GSU1_GSUASB_LBSPPB256_LPB2_MIAV1_NLCA1_PLR1_TT1_32_WG64_4_1
    SolutionIndex: 467
    SolutionNameMin: Cijk_Ailk_Bljk_ZB_UserArgs_MT128x16x16_MI16x16x4x1_SN_DTVA1_GSU1_GSUASB_LBSPPB256_LPB2_MIAV1_NLCA4_PLR3_TT4_16_WG32_4_2
    SolutionIndex: 468
    SolutionNameMin: Cijk_Ailk_Bljk_ZB_UserArgs_MT128x128x16_MI16x16x4x1_SN_DTVA1_GSU9_GSUAMB_LBSPPB256_LPB2_MIAV0_NLCA2_PLR1_TT2_128_WG64_4_1
    SolutionIndex: 469
    SolutionNameMin: Cijk_Ailk_Bljk_ZB_UserArgs_MT32x48x32_MI16x16x4x1_SN_DTVA1_GSU1_GSUASB_LBSPPB512_LPB2_MIAV1_NLCA1_PLR5_TT1_48_WG32_4_2
    SolutionIndex: 470
    SolutionNameMin: Cijk_Ailk_Bljk_ZB_UserArgs_MT64x80x16_MI16x16x4x1_SN_DTVA1_GSU4_GSUAMB_LBSPPB256_LPB2_MIAV1_NLCA1_PLR5_TT1_80_WG64_4_1
    SolutionIndex: 471
    SolutionNameMin: Cijk_Ailk_Bljk_ZB_UserArgs_MT128x112x16_MI16x16x4x1_SN_DTVA1_GSU6_GSUAMB_LBSPPB256_LPB2_MIAV0_NLCA2_PLR1_TT2_112_WG64_4_1
    SolutionIndex: 472
    SolutionNameMin: Cijk_Ailk_Bljk_ZB_UserArgs_MT128x64x8_MI16x16x4x1_SN_DTVA0_GSU3_GSUAMB_LBSPPB128_LPB2_MIAV0_NLCA1_PLR1_TT2_64_WG64_4_1
    SolutionIndex: 473
    SolutionNameMin: Cijk_Ailk_Bljk_ZB_UserArgs_MT64x80x16_MI16x16x4x1_SN_DTVA1_GSU2_GSUAMB_LBSPPB256_LPB2_MIAV1_NLCA1_PLR5_TT1_80_WG64_4_1
    SolutionIndex: 474
    SolutionNameMin: Cijk_Ailk_Bljk_ZB_UserArgs_MT256x64x16_MI16x16x4x1_SN_DTVA1_GSU7_GSUAMB_LBSPPB256_LPB2_MIAV0_NLCA4_PLR5_TT4_64_WG64_4_1
    SolutionIndex: 475
    SolutionNameMin: Cijk_Ailk_Bljk_ZB_UserArgs_MT128x64x8_MI16x16x4x1_SN_DTVA0_GSU2_GSUAMB_LBSPPB128_LPB2_MIAV0_NLCA1_PLR1_TT2_64_WG64_4_1
    SolutionIndex: 476
    SolutionNameMin: Cijk_Ailk_Bljk_ZB_UserArgs_MT64x112x16_MI16x16x4x1_SN_DTVA1_GSU2_GSUAMB_LBSPPB256_LPB2_MIAV0_NLCA1_PLR1_TT1_112_WG64_4_1
    SolutionIndex: 477
    SolutionNameMin: Cijk_Ailk_Bljk_ZB_UserArgs_MT128x112x16_MI16x16x4x1_SN_DTVA1_GSU4_GSUAMB_LBSPPB256_LPB2_MIAV0_NLCA2_PLR1_TT2_112_WG64_4_1
    SolutionIndex: 478
    SolutionNameMin: Cijk_Ailk_Bljk_ZB_UserArgs_MT64x80x16_MI16x16x4x1_SN_DTVA0_GSU1_GSUASB_LBSPPB256_LPB2_MIAV1_NLCA1_PLR1_TT1_80_WG64_4_1
    SolutionIndex: 479
    SolutionNameMin: Cijk_Ailk_Bljk_ZB_UserArgs_MT64x48x16_MI16x16x4x1_SN_DTVA1_GSU1_GSUASB_LBSPPB256_LPB2_MIAV1_NLCA1_PLR1_TT1_48_WG64_4_1
    SolutionIndex: 480
    SolutionNameMin: Cijk_Ailk_Bljk_ZB_UserArgs_MT128x112x16_MI16x16x4x1_SN_DTVA0_GSU3_GSUAMB_LBSPPB256_LPB2_MIAV0_NLCA1_PLR5_TT2_112_WG64_4_1
    SolutionIndex: 481
    SolutionNameMin: Cijk_Ailk_Bljk_ZB_UserArgs_MT64x80x32_MI16x16x4x1_SN_DTVA1_GSU1_GSUASB_LBSPPB512_LPB2_MIAV1_NTC3_NTD3_NLCA1_PLR1_TT1_80_WG64_4_1_WGM12
    SolutionIndex: 482
    SolutionNameMin: Cijk_Ailk_Bljk_ZB_UserArgs_MT64x80x16_MI16x16x4x1_SN_DTVA0_GSU1_GSUASB_LBSPPB256_LPB2_MIAV1_NTC3_NTD3_NLCA1_PLR5_TT1_80_WG64_4_1_WGM12
    SolutionIndex: 483
    SolutionNameMin: Cijk_Ailk_Bljk_ZB_UserArgs_MT64x80x16_MI16x16x4x1_SN_DTVA1_GSU1_GSUASB_LBSPPB256_LPB2_MIAV1_NTC3_NTD3_NLCA1_PLR5_TT1_80_WG64_4_1_WGM12
    SolutionIndex: 484
    SolutionNameMin: Cijk_Ailk_Bljk_ZB_UserArgs_MT64x64x8_MI16x16x4x1_SN_DTVA0_GSU1_GSUASB_LBSPPB128_LPB2_MIAV1_NTC3_NTD3_NLCA1_PLR1_TT4_16_WG16_16_1_WGM1
    SolutionIndex: 485
    SolutionNameMin: Cijk_Ailk_Bljk_ZB_UserArgs_MT64x112x16_MI16x16x4x1_SN_DTVA1_GSU1_GSUASB_LBSPPB256_LPB2_MIAV0_NTC0_NTD0_NLCA1_PLR5_TT1_112_WG64_4_1_WGM12
    SolutionIndex: 486
    SolutionNameMin: Cijk_Ailk_Bljk_ZB_UserArgs_MT64x112x16_MI16x16x4x1_SN_DTVA1_GSU1_GSUASB_LBSPPB256_LPB2_MIAV0_NTC3_NTD3_NLCA1_PLR1_TT1_112_WG64_4_1_WGM12
    SolutionIndex: 487
    SolutionNameMin: Cijk_Ailk_Bljk_ZB_UserArgs_MT64x32x16_MI16x16x4x1_SN_DTVA1_GSU1_GSUASB_LBSPPB256_LPB2_MIAV1_NTC3_NTD3_NLCA1_PLR5_TT1_32_WG64_4_1_WGM1
    SolutionIndex: 488
    SolutionNameMin: Cijk_Ailk_Bljk_ZB_UserArgs_MT64x160x16_MI16x16x4x1_SN_DTVA0_GSU1_GSUASB_LBSPPB256_LPB2_MIAV0_NTC0_NTD0_NLCA1_PLR1_TT2_80_WG32_8_1_WGM12
    SolutionIndex: 489
    SolutionNameMin: Cijk_Ailk_Bljk_ZB_UserArgs_MT128x80x16_MI16x16x4x1_SN_DTVA1_GSU1_GSUASB_LBSPPB256_LPB2_MIAV0_NTC0_NTD0_NLCA2_PLR1_TT2_80_WG64_4_1_WGM12
    SolutionIndex: 490
    SolutionNameMin: Cijk_Ailk_Bljk_ZB_UserArgs_MT128x64x8_MI16x16x4x1_SN_DTVA1_GSU1_GSUASB_LBSPPB128_LPB2_MIAV0_NTC3_NTD3_NLCA2_PLR3_TT2_64_WG64_4_1_WGM12
    SolutionIndex: 491
    SolutionNameMin: Cijk_Ailk_Bljk_ZB_UserArgs_MT64x128x16_MI16x16x4x1_SN_DTVA1_GSU1_GSUASB_LBSPPB256_LPB2_MIAV0_NTC3_NTD3_NLCA1_PLR5_TT1_128_WG64_4_1_WGM12
    SolutionIndex: 492
    SolutionNameMin: Cijk_Ailk_Bljk_ZB_UserArgs_MT64x112x16_MI16x16x4x1_SN_DTVA1_GSU1_GSUASB_LBSPPB256_LPB2_MIAV0_NTC0_NTD0_NLCA1_PLR1_TT1_112_WG64_4_1_WGM12
    SolutionIndex: 493
    SolutionNameMin: Cijk_Ailk_Bljk_ZB_UserArgs_MT128x80x16_MI16x16x4x1_SN_DTVA0_GSU1_GSUASB_LBSPPB256_LPB2_MIAV0_NTC0_NTD0_NLCA1_PLR5_TT2_80_WG64_4_1_WGM12
    SolutionIndex: 494
    SolutionNameMin: Cijk_Ailk_Bljk_ZB_UserArgs_MT64x160x16_MI16x16x4x1_SN_DTVA0_GSU1_GSUASB_LBSPPB256_LPB2_MIAV0_NTC3_NTD3_NLCA1_PLR5_TT2_80_WG32_8_1_WGM12
    SolutionIndex: 495
    SolutionNameMin: Cijk_Ailk_Bljk_ZB_UserArgs_MT128x80x16_MI16x16x4x1_SN_DTVA1_GSU1_GSUASB_LBSPPB256_LPB2_MIAV0_NTC3_NTD3_NLCA2_PLR5_TT2_80_WG64_4_1_WGM12
    SolutionIndex: 496
    SolutionNameMin: Cijk_Ailk_Bljk_ZB_UserArgs_MT128x128x8_MI16x16x4x1_SN_DTVA0_GSU1_GSUASB_LBSPPB128_LPB2_MIAV0_NTC3_NTD3_NLCA1_PLR1_TT4_64_WG32_8_1_WGM12
    SolutionIndex: 497
    SolutionNameMin: Cijk_Ailk_Bljk_ZB_UserArgs_MT128x112x16_MI16x16x4x1_SN_DTVA1_GSU1_GSUASB_LBSPPB256_LPB2_MIAV0_NTC3_NTD3_NLCA2_PLR1_TT2_112_WG64_4_1_WGM12
    SolutionIndex: 498
    SolutionNameMin: Cijk_Ailk_Bljk_ZB_UserArgs_MT128x112x16_MI16x16x4x1_SN_DTVA1_GSU1_GSUASB_LBSPPB256_LPB2_MIAV0_NTC0_NTD0_NLCA2_PLR1_TT2_112_WG64_4_1_WGM1
    SolutionIndex: 499
    SolutionNameMin: Cijk_Ailk_Bljk_ZB_UserArgs_MT192x64x8_MI16x16x4x1_SN_DTVA1_GSU1_GSUASB_LBSPPB128_LPB2_MIAV0_NTC0_NTD0_NLCA3_PLR1_TT3_64_WG64_4_1_WGM1
    SolutionIndex: 500
    SolutionNameMin: Cijk_Ailk_Bljk_ZB_UserArgs_MT64x176x16_MI16x16x4x1_SN_DTVA1_GSU1_GSUASB_LBSPPB256_LPB2_MIAV0_NTC0_NTD0_NLCA1_PLR1_TT1_176_WG64_4_1_WGM12
    SolutionIndex: 501
    SolutionNameMin: Cijk_Ailk_Bljk_ZB_UserArgs_MT64x80x16_MI16x16x4x1_SN_DTVA0_GSU1_GSUASB_LBSPPB256_LPB2_MIAV1_NTC0_NTD0_NLCA1_PLR5_TT1_80_WG64_4_1_WGM12
    SolutionIndex: 502
    SolutionNameMin: Cijk_Ailk_Bljk_ZB_UserArgs_MT128x112x16_MI16x16x4x1_SN_DTVA1_GSU1_GSUASB_LBSPPB256_LPB2_MIAV0_NTC3_NTD3_NLCA2_PLR5_TT2_112_WG64_4_1_WGM12
    SolutionIndex: 503
    SolutionNameMin: Cijk_Ailk_Bljk_ZB_UserArgs_MT256x32x8_MI16x16x4x1_SN_DTVA1_GSU1_GSUASB_LBSPPB128_LPB2_MIAV0_NTC0_NTD0_NLCA4_PLR1_TT4_32_WG64_4_1_WGM1
    SolutionIndex: 504
    SolutionNameMin: Cijk_Ailk_Bljk_ZB_UserArgs_MT64x224x8_MI16x16x4x1_SN_DTVA1_GSU1_GSUASB_LBSPPB128_LPB2_MIAV0_NTC3_NTD3_NLCA1_PLR3_TT1_224_WG64_4_1_WGM12
    SolutionIndex: 505
    SolutionNameMin: Cijk_Ailk_Bljk_ZB_UserArgs_MT128x80x16_MI16x16x4x1_SN_DTVA0_GSU1_GSUASB_LBSPPB256_LPB2_MIAV0_NTC3_NTD3_NLCA1_PLR5_TT2_80_WG64_4_1_WGM12
    SolutionIndex: 506
    SolutionNameMin: Cijk_Ailk_Bljk_ZB_UserArgs_MT64x160x8_MI16x16x4x1_SN_DTVA0_GSU1_GSUASB_LBSPPB128_LPB2_MIAV0_NTC3_NTD3_NLCA1_PLR3_TT1_160_WG64_4_1_WGM12
    SolutionIndex: 507
    SolutionNameMin: Cijk_Ailk_Bljk_ZB_UserArgs_MT128x80x16_MI16x16x4x1_SN_DTVA1_GSU1_GSUASB_LBSPPB256_LPB2_MIAV0_NTC3_NTD3_NLCA2_PLR1_TT2_80_WG64_4_1_WGM12
    SolutionIndex: 508
    SolutionNameMin: Cijk_Ailk_Bljk_ZB_UserArgs_MT128x48x16_MI16x16x4x1_SN_DTVA1_GSU1_GSUASB_LBSPPB256_LPB2_MIAV0_NTC3_NTD3_NLCA2_PLR5_TT2_48_WG64_4_1_WGM12
    SolutionIndex: 509
    SolutionNameMin: Cijk_Ailk_Bljk_ZB_UserArgs_MT128x96x16_MI16x16x4x1_SN_DTVA1_LBSPPB256_LPB2_NLCA2_PLR5_TT2_96_WG64_4_1_WGM12
    SolutionIndex: 510
    SolutionNameMin: Cijk_Ailk_Bljk_ZB_UserArgs_MT128x96x8_MI16x16x4x1_SN_DTVA0_LBSPPB128_LPB2_NLCA1_PLR3_TT2_96_WG64_4_1_WGM12
    SolutionIndex: 511
    SolutionNameMin: Cijk_Ailk_Bljk_ZB_UserArgs_MT128x96x8_MI16x16x4x1_SN_DTVA1_LBSPPB128_LPB2_NLCA2_PLR3_TT2_96_WG64_4_1_WGM12
    SolutionIndex: 512
    SolutionNameMin: Cijk_Ailk_Bljk_ZB_UserArgs_MT128x112x16_MI16x16x4x1_SN_DTVA0_LBSPPB256_LPB2_NLCA1_PLR1_TT2_112_WG64_4_1_WGM1
    SolutionIndex: 513
    SolutionNameMin: Cijk_Ailk_Bljk_ZB_UserArgs_MT128x112x16_MI16x16x4x1_SN_DTVA1_LBSPPB256_LPB2_NLCA2_PLR5_TT2_112_WG64_4_1_WGM1
    SolutionIndex: 514
    SolutionNameMin: Cijk_Ailk_Bljk_ZB_UserArgs_MT128x112x16_MI16x16x4x1_SN_DTVA1_LBSPPB256_LPB2_NLCA2_PLR1_TT2_112_WG64_4_1_WGM12
    SolutionIndex: 515
    SolutionNameMin: Cijk_Ailk_Bljk_ZB_UserArgs_MT128x112x16_MI16x16x4x1_SN_DTVA1_LBSPPB256_LPB2_NLCA2_PLR1_TT2_112_WG64_4_1_WGM1
    SolutionIndex: 516
    SolutionNameMin: Cijk_Ailk_Bljk_ZB_UserArgs_MT128x112x16_MI16x16x4x1_SN_DTVA1_LBSPPB256_LPB2_NLCA2_PLR5_TT2_112_WG64_4_1_WGM12
    SolutionIndex: 517
    SolutionNameMin: Cijk_Ailk_Bljk_ZB_UserArgs_MT112x128x16_MI16x16x4x1_SN_DTVA0_LBSPPB256_LPB2_NLCA7_PLR1_TT7_32_WG16_16_1_WGM12
    SolutionIndex: 518
    SolutionNameMin: Cijk_Ailk_Bljk_ZB_UserArgs_MT128x112x16_MI16x16x4x1_SN_DTVA0_LBSPPB256_LPB2_NLCA1_PLR1_TT2_112_WG64_4_1_WGM12
    SolutionIndex: 519
    SolutionNameMin: Cijk_Ailk_Bljk_ZB_UserArgs_MT160x96x8_MI16x16x4x1_SN_DTVA0_LBSPPB128_LPB2_NLCA5_PLR3_TT5_48_WG32_8_1_WGM1
    SolutionIndex: 520
    SolutionNameMin: Cijk_Ailk_Bljk_ZB_UserArgs_MT128x128x8_MI16x16x4x1_SN_DTVA1_LBSPPB128_LPB2_NLCA2_PLR1_TT2_128_WG64_4_1
    SolutionIndex: 521
    SolutionNameMin: Cijk_Ailk_Bljk_ZB_UserArgs_MT96x128x16_MI16x16x4x1_SN_DTVA0_LBSPPB256_LPB2_NLCA3_PLR5_TT6_32_WG16_16_1
    SolutionIndex: 522
    SolutionNameMin: Cijk_Ailk_Bljk_ZB_UserArgs_MT128x128x16_MI16x16x4x1_SN_DTVA1_LBSPPB256_LPB2_NLCA2_PLR5_TT2_128_WG64_4_1
    SolutionIndex: 523
    SolutionNameMin: Cijk_Ailk_Bljk_ZB_UserArgs_MT16x32x16_MI16x16x4x1_SN_DTVA0_GSU1_GSUASB_LBSPPB256_LPB2_NTB0_NLCB1_PLR3_TT1_16_WG16_8_2
    SolutionIndex: 524
    SolutionNameMin: Cijk_Ailk_Bljk_ZB_UserArgs_MT16x64x32_MI16x16x4x1_SN_DTVA0_GSU1_GSUASB_LBSPPB512_LPB2_NTB4_NLCB1_PLR5_TT1_32_WG16_8_2
    SolutionIndex: 525
    SolutionNameMin: Cijk_Ailk_Bljk_ZB_UserArgs_MT16x96x32_MI16x16x4x1_SN_DTVA0_GSU3_GSUAMB_LBSPPB512_LPB2_NTB0_NLCB1_PLR1_TT1_48_WG16_8_2
    SolutionIndex: 526
    SolutionNameMin: Cijk_Ailk_Bljk_ZB_UserArgs_MT16x16x16_MI16x16x4x1_SN_DTVA1_GSU1_GSUASB_LBSPPB256_LPB2_NTB0_NLCB1_PLR1_TT1_16_WG16_4_1
    SolutionIndex: 527
    SolutionNameMin: Cijk_Ailk_Bljk_ZB_UserArgs_MT16x64x32_MI16x16x4x1_SN_DTVA0_GSU1_GSUASB_LBSPPB512_LPB2_NTB0_NLCB1_PLR3_TT1_64_WG16_4_4
    SolutionIndex: 528
    SolutionNameMin: Cijk_Ailk_Bljk_ZB_UserArgs_MT16x64x16_MI16x16x4x1_SN_DTVA0_GSU3_GSUAMB_LBSPPB256_LPB2_NTB4_NLCB1_PLR1_TT1_16_WG16_16_1
    SolutionIndex: 529
    SolutionNameMin: Cijk_Ailk_Bljk_ZB_UserArgs_MT16x64x16_MI16x16x4x1_SN_DTVA1_GSU1_GSUASB_LBSPPB256_LPB2_NTB4_NLCB1_PLR1_TT1_64_WG16_4_4
    SolutionIndex: 530
    SolutionNameMin: Cijk_Ailk_Bljk_ZB_UserArgs_MT16x64x16_MI16x16x4x1_SN_DTVA0_GSU2_GSUAMB_LBSPPB256_LPB2_NTB4_NLCB1_PLR1_TT1_32_WG16_8_2
    SolutionIndex: 531
    SolutionNameMin: Cijk_Ailk_Bljk_ZB_UserArgs_MT32x32x16_MI16x16x4x1_SN_DTVA1_GSU1_GSUASB_LBSPPB256_LPB2_MIAV1_NTB0_PLR1_TT1_32_WG32_4_2
    SolutionIndex: 532
    SolutionNameMin: Cijk_Ailk_Bljk_ZB_UserArgs_MT32x32x32_MI16x16x4x1_SN_DTVA0_GSU1_GSUASB_LBSPPB512_LPB2_MIAV1_NTB0_PLR1_TT1_32_WG32_4_2
    SolutionIndex: 533
    SolutionNameMin: Cijk_Ailk_Bljk_ZB_UserArgs_MT32x192x16_MI16x16x4x1_SN_DTVA0_GSU7_GSUAMB_LBSPPB256_LPB2_MIAV0_NTB4_PLR5_TT1_96_WG32_8_1
    SolutionIndex: 534
    SolutionNameMin: Cijk_Ailk_Bljk_ZB_UserArgs_MT32x48x32_MI16x16x4x1_SN_DTVA1_GSU1_GSUASB_LBSPPB512_LPB2_MIAV1_NTB0_PLR5_TT1_48_WG32_4_2
    SolutionIndex: 535
    SolutionNameMin: Cijk_Ailk_Bljk_ZB_UserArgs_MT32x48x16_MI16x16x4x1_SN_DTVA1_GSU1_GSUASB_LBSPPB256_LPB2_MIAV1_NTB4_PLR3_TT1_48_WG32_4_2
    SolutionIndex: 536
    SolutionNameMin: Cijk_Ailk_Bljk_ZB_UserArgs_MT32x128x16_MI16x16x4x1_SN_DTVA0_GSU7_GSUAMB_LBSPPB256_LPB2_MIAV1_NTB4_PLR5_TT2_32_WG16_16_1
    SolutionIndex: 537
    SolutionNameMin: Cijk_Ailk_Bljk_ZB_UserArgs_MT32x64x32_MI16x16x4x1_SN_DTVA0_GSU1_GSUASB_LBSPPB512_LPB2_MIAV1_NTB0_PLR5_TT2_32_WG16_8_2
    SolutionIndex: 538
    SolutionNameMin: Cijk_Ailk_Bljk_ZB_UserArgs_MT32x64x16_MI16x16x4x1_SN_DTVA0_GSU1_GSUASB_LBSPPB256_LPB2_MIAV1_NTB4_PLR3_TT2_32_WG16_8_2
    SolutionIndex: 539
    SolutionNameMin: Cijk_Ailk_Bljk_ZB_UserArgs_MT32x192x16_MI16x16x4x1_SN_DTVA0_GSU7_GSUAMB_LBSPPB256_LPB2_MIAV0_NTB4_PLR5_TT2_48_WG16_16_1
    SolutionIndex: 540
    SolutionNameMin: Cijk_Ailk_Bljk_ZB_UserArgs_MT64x32x16_MI16x16x4x1_SN_DTVA1_GSU1_GSUASB_LBSPPB256_LPB2_MIAV1_NTB0_NLCA2_PLR1_TT2_32_WG32_4_2
    SolutionIndex: 541
    SolutionNameMin: Cijk_Ailk_Bljk_ZB_UserArgs_MT64x128x8_MI16x16x4x1_SN_DTVA0_GSU4_GSUAMB_LBSPPB128_LPB2_MIAV0_NTB0_NLCA1_PLR1_TT1_128_WG64_4_1
    SolutionIndex: 542
    SolutionNameMin: Cijk_Ailk_Bljk_ZB_UserArgs_MT64x112x16_MI16x16x4x1_SN_DTVA1_GSU4_GSUAMB_LBSPPB256_LPB2_MIAV0_NTB4_NLCA1_PLR1_TT1_112_WG64_4_1
    SolutionIndex: 543
    SolutionNameMin: Cijk_Ailk_Bljk_ZB_UserArgs_MT64x48x32_MI16x16x4x1_SN_DTVA1_GSU1_GSUASB_LBSPPB512_LPB2_MIAV1_NTB0_NLCA1_PLR1_TT1_48_WG64_4_1
    SolutionIndex: 544
    SolutionNameMin: Cijk_Ailk_Bljk_ZB_UserArgs_MT64x144x16_MI16x16x4x1_SN_DTVA1_GSU4_GSUAMB_LBSPPB256_LPB2_MIAV0_NTB4_NLCA1_PLR5_TT1_144_WG64_4_1
    SolutionIndex: 545
    SolutionNameMin: Cijk_Ailk_Bljk_ZB_UserArgs_MT64x32x32_MI16x16x4x1_SN_DTVA0_GSU1_GSUASB_LBSPPB512_LPB2_MIAV1_NTB0_NLCA1_PLR5_TT2_32_WG32_4_2
    SolutionIndex: 546
    SolutionNameMin: Cijk_Ailk_Bljk_ZB_UserArgs_MT64x112x16_MI16x16x4x1_SN_DTVA1_GSU2_GSUAMB_LBSPPB256_LPB2_MIAV0_NTB4_NLCA1_PLR5_TT1_112_WG64_4_1
    SolutionIndex: 547
    SolutionNameMin: Cijk_Ailk_Bljk_ZB_UserArgs_MT64x64x8_MI16x16x4x1_SN_DTVA1_GSU1_GSUASB_LBSPPB128_LPB2_MIAV1_NTB0_NLCA1_PLR1_TT1_64_WG64_4_1
    SolutionIndex: 548
    SolutionNameMin: Cijk_Ailk_Bljk_ZB_UserArgs_MT64x64x16_MI16x16x4x1_SN_DTVA1_GSU1_GSUASB_LBSPPB256_LPB2_MIAV1_NTB0_NLCA1_PLR1_TT1_64_WG64_4_1
    SolutionIndex: 549
    SolutionNameMin: Cijk_Ailk_Bljk_ZB_UserArgs_MT128x112x16_MI16x16x4x1_SN_DTVA1_GSU4_GSUAMB_LBSPPB256_LPB2_MIAV0_NTB4_NLCA2_PLR1_TT2_112_WG64_4_1
    SolutionIndex: 550
    SolutionNameMin: Cijk_Ailk_Bljk_ZB_UserArgs_MT64x80x32_MI16x16x4x1_SN_DTVA1_GSU1_GSUASB_LBSPPB512_LPB2_MIAV1_NTB0_NLCA1_PLR1_TT1_80_WG64_4_1
    SolutionIndex: 551
    SolutionNameMin: Cijk_Ailk_Bljk_ZB_UserArgs_MT64x80x16_MI16x16x4x1_SN_DTVA1_GSU1_GSUASB_LBSPPB256_LPB2_MIAV1_NTB0_NLCA1_PLR1_TT1_80_WG64_4_1
    SolutionIndex: 552
    SolutionNameMin: Cijk_Ailk_Bljk_ZB_UserArgs_MT64x80x16_MI16x16x4x1_SN_DTVA1_GSU1_GSUASB_LBSPPB256_LPB2_MIAV1_NTB0_NLCA1_PLR5_TT1_80_WG64_4_1
    SolutionIndex: 553
    SolutionNameMin: Cijk_Ailk_Bljk_ZB_UserArgs_MT128x32x8_MI16x16x4x1_SN_DTVA1_GSU1_GSUASB_LBSPPB128_LPB2_MIAV1_NTB0_NLCA2_PLR1_TT2_32_WG64_4_1
    SolutionIndex: 554
    SolutionNameMin: Cijk_Ailk_Bljk_ZB_UserArgs_MT64x64x32_MI16x16x4x1_SN_DTVA1_GSU1_GSUASB_LBSPPB512_LPB2_MIAV1_NTB0_NLCA1_PLR1_TT1_64_WG64_4_1
    SolutionIndex: 555
    SolutionNameMin: Cijk_Ailk_Bljk_ZB_UserArgs_MT128x112x16_MI16x16x4x1_SN_DTVA1_GSU2_GSUAMB_LBSPPB256_LPB2_MIAV0_NTB4_NLCA2_PLR1_TT2_112_WG64_4_1
    SolutionIndex: 556
    SolutionNameMin: Cijk_Ailk_Bljk_ZB_UserArgs_MT128x64x8_MI16x16x4x1_SN_DTVA0_GSU1_GSUASB_LBSPPB128_LPB2_MIAV0_NTB4_NTC0_NTD0_NLCA1_PLR1_TT2_64_WG64_4_1
    SolutionIndex: 557
    SolutionNameMin: Cijk_Ailk_Bljk_ZB_UserArgs_MT64x112x16_MI16x16x4x1_SN_DTVA1_GSU1_GSUASB_LBSPPB256_LPB2_MIAV0_NTB0_NTC3_NTD3_NLCA1_PLR1_TT1_112_WG64_4_1
    SolutionIndex: 558
    SolutionNameMin: Cijk_Ailk_Bljk_ZB_UserArgs_MT128x112x16_MI16x16x4x1_SN_DTVA0_GSU2_GSUAMB_LBSPPB256_LPB2_MIAV0_NTB0_NTC3_NTD3_NLCA1_PLR5_TT2_112_WG64_4_1
    SolutionIndex: 559
    SolutionNameMin: Cijk_Ailk_Bljk_ZB_UserArgs_MT128x96x16_MI16x16x4x1_SN_DTVA0_GSU1_GSUASB_LBSPPB256_LPB2_MIAV0_NTB0_NTC0_NTD0_NLCA1_PLR1_TT4_48_WG32_8_1
    SolutionIndex: 560
    SolutionNameMin: Cijk_Ailk_Bljk_ZB_UserArgs_MT128x80x16_MI16x16x4x1_SN_DTVA1_GSU1_GSUASB_LBSPPB256_LPB2_MIAV0_NTB0_NTC3_NTD3_NLCA2_PLR5_TT2_80_WG64_4_1
    SolutionIndex: 561
    SolutionNameMin: Cijk_Ailk_Bljk_ZB_UserArgs_MT256x32x8_MI16x16x4x1_SN_DTVA1_GSU1_GSUASB_LBSPPB128_LPB2_MIAV0_NTB0_NTC0_NTD0_NLCA4_PLR3_TT4_32_WG64_4_1
    SolutionIndex: 562
    SolutionNameMin: Cijk_Ailk_Bljk_ZB_UserArgs_MT128x112x16_MI16x16x4x1_SN_DTVA1_GSU1_GSUASB_LBSPPB256_LPB2_MIAV0_NTB0_NTC3_NTD3_NLCA2_PLR5_TT2_112_WG64_4_1
    SolutionIndex: 563
    SolutionNameMin: Cijk_Ailk_Bljk_ZB_UserArgs_MT128x112x16_MI16x16x4x1_SN_DTVA0_LBSPPB256_LPB2_MIAV0_NTC0_NTD0_NLCA1_PLR1_TT2_112_WG64_4_1
    SolutionIndex: 564
    SolutionNameMin: Cijk_Ailk_Bljk_ZB_UserArgs_MT64x224x8_MI16x16x4x1_SN_DTVA0_LBSPPB128_LPB2_MIAV0_NTC3_NTD3_NLCA1_PLR3_TT1_224_WG64_4_1
    SolutionIndex: 565
    SolutionNameMin: Cijk_Ailk_Bljk_ZB_UserArgs_MT128x112x16_MI16x16x4x1_SN_DTVA1_LBSPPB256_LPB2_MIAV0_NTC3_NTD3_NLCA2_PLR5_TT2_112_WG64_4_1
    SolutionIndex: 566
    SolutionNameMin: Cijk_Ailk_Bljk_ZB_UserArgs_MT128x80x16_MI16x16x4x1_SN_DTVA1_LBSPPB256_LPB2_MIAV0_NTC0_NTD0_NLCA2_PLR1_TT2_80_WG64_4_1
    SolutionIndex: 567
    SolutionNameMin: Cijk_Ailk_Bljk_ZB_UserArgs_MT64x144x16_MI16x16x4x1_SN_DTVA0_LBSPPB256_LPB2_MIAV0_NTC0_NTD0_NLCA1_PLR5_TT1_144_WG64_4_1
    SolutionIndex: 568
    SolutionNameMin: Cijk_Ailk_Bljk_ZB_UserArgs_MT64x144x16_MI16x16x4x1_SN_DTVA1_LBSPPB256_LPB2_MIAV0_NTC0_NTD0_NLCA1_PLR5_TT1_144_WG64_4_1
    SolutionIndex: 569
    SolutionNameMin: Cijk_Ailk_Bljk_ZB_UserArgs_MT64x64x16_MI16x16x4x1_SN_DTVA1_LBSPPB256_LPB2_MIAV1_NTC0_NTD0_NLCA1_PLR5_TT1_64_WG64_4_1
    SolutionIndex: 570
    SolutionNameMin: Cijk_Ailk_Bljk_ZB_UserArgs_MT128x112x16_MI16x16x4x1_SN_DTVA1_LBSPPB256_LPB2_MIAV0_NTC0_NTD0_NLCA2_PLR5_TT2_112_WG64_4_1
    SolutionIndex: 571
    SolutionNameMin: Cijk_Ailk_Bljk_ZB_UserArgs_MT128x112x16_MI16x16x4x1_SN_DTVA1_LBSPPB256_LPB2_MIAV0_NTC0_NTD0_NLCA2_PLR1_TT2_112_WG64_4_1
    SolutionIndex: 572
    SolutionNameMin: Cijk_Ailk_Bljk_ZB_UserArgs_MT128x96x8_MI16x16x4x1_SN_DTVA1_LBSPPB128_LPB2_NLCA2_PLR1_TT2_96_WG64_4_1
    SolutionIndex: 573
    SolutionNameMin: Cijk_Ailk_Bljk_ZB_UserArgs_MT128x96x16_MI16x16x4x1_SN_DTVA0_LBSPPB256_LPB2_NLCA1_PLR1_TT2_96_WG64_4_1
    SolutionIndex: 574
    SolutionNameMin: Cijk_Ailk_Bljk_ZB_UserArgs_MT128x96x16_MI16x16x4x1_SN_DTVA1_LBSPPB256_LPB2_NLCA2_PLR5_TT2_96_WG64_4_1
    SolutionIndex: 575
    SolutionNameMin: Cijk_Ailk_Bljk_ZB_UserArgs_MT96x160x16_MI16x16x4x1_SN_DTVA0_LBSPPB0_LPB0_NLCA3_PLR1_TT3_80_WG32_8_1
    SolutionIndex: 576
    SolutionNameMin: Cijk_Ailk_Bljk_ZB_UserArgs_MT128x112x16_MI16x16x4x1_SN_DTVA0_LBSPPB256_LPB2_NLCA1_PLR5_TT2_112_WG64_4_1
    SolutionIndex: 577
    SolutionNameMin: Cijk_Ailk_Bljk_ZB_UserArgs_MT128x112x16_MI16x16x4x1_SN_DTVA1_LBSPPB256_LPB2_NLCA2_PLR1_TT2_112_WG64_4_1
    SolutionIndex: 578
    SolutionNameMin: Cijk_Ailk_Bljk_ZB_UserArgs_MT128x112x16_MI16x16x4x1_SN_DTVA1_LBSPPB256_LPB2_NLCA2_PLR5_TT2_112_WG64_4_1
    SolutionIndex: 579
    SolutionNameMin: Cijk_Ailk_Bljk_ZB_UserArgs_MT96x160x8_MI16x16x4x1_SN_DTVA0_LBSPPB128_LPB2_NLCA3_PLR3_TT3_80_WG32_8_1
    SolutionIndex: 580
    SolutionNameMin: Cijk_Ailk_Bljk_ZB_UserArgs_MT128x112x16_MI16x16x4x1_SN_DTVA0_LBSPPB256_LPB2_NLCA1_PLR1_TT2_112_WG64_4_1
    SolutionIndex: 581
    SolutionNameMin: Cijk_Ailk_Bljk_ZB_UserArgs_MT128x96x16_MI16x16x4x1_SN_DTVA1_LBSPPB256_LPB2_NLCA2_PLR1_TT2_96_WG64_4_1
    SolutionIndex: 582
    SolutionNameMin: Cijk_Ailk_Bljk_ZB_UserArgs_MT128x128x16_MI16x16x4x1_SN_DTVA1_LBSPPB256_LPB2_NLCA2_PLR1_TT2_128_WG64_4_1
    SolutionIndex: 583
    SolutionNameMin: Cijk_Ailk_Bljk_ZB_UserArgs_MT128x128x16_MI16x16x4x1_SN_DTVA1_LBSPPB256_LPB2_NLCA2_PLR5_TT2_128_WG64_4_1
    SolutionIndex: 584
    SolutionNameMin: Cijk_Ailk_Bljk_ZB_UserArgs_MT96x96x8_MI16x16x4x1_SN_DTVA0_LBSPPB128_LPB2_NLCA3_PLR3_TT3_48_WG32_8_1
    SolutionIndex: 585
    SolutionNameMin: Cijk_Ailk_Bljk_ZB_UserArgs_MT160x96x8_MI16x16x4x1_SN_DTVA0_LBSPPB128_LPB2_NLCA5_PLR3_TT5_48_WG32_8_1
    SolutionIndex: 586
    SolutionNameMin: Cijk_Ailk_Bljk_ZB_UserArgs_MT128x128x8_MI16x16x4x1_SN_DTVA1_LBSPPB128_LPB2_NLCA2_PLR1_TT2_128_WG64_4_1
    SolutionIndex: 587
    SolutionNameMin: Cijk_Ailk_Bljk_ZB_UserArgs_MT16x96x16_MI16x16x4x1_SN_GSU1_GSUASB_LBSPPB256_NTB0_NTC3_NTD3_PLR3_TT1_48_WG16_8_2
    SolutionIndex: 588
    SolutionNameMin: Cijk_Ailk_Bljk_ZB_UserArgs_MT16x96x16_MI16x16x4x1_SN_GSU1_GSUASB_LBSPPB256_NTB4_NTC3_NTD3_PLR3_TT1_48_WG16_8_2
    SolutionIndex: 589
    SolutionNameMin: Cijk_Ailk_Bljk_ZB_UserArgs_MT32x32x16_MI16x16x4x1_SN_GSU1_GSUASB_LBSPPB256_LPB2_MIAV1_NTB0_NTC3_NTD3_PLR1_TT1_16_WG32_8_1
    SolutionIndex: 590
    SolutionNameMin: Cijk_Ailk_Bljk_ZB_UserArgs_MT32x96x8_MI16x16x4x1_SN_GSU4_GSUAMB_LBSPPB128_LPB2_MIAV1_NTB4_NTC3_NTD3_PLR1_TT1_48_WG32_8_1
    SolutionIndex: 591
    SolutionNameMin: Cijk_Ailk_Bljk_ZB_UserArgs_MT32x160x16_MI16x16x4x1_SN_GSU2_GSUAMB_LBSPPB256_LPB2_MIAV1_NTB0_NTC0_NTD0_PLR5_TT1_80_WG32_8_1
    SolutionIndex: 592
    SolutionNameMin: Cijk_Ailk_Bljk_ZB_UserArgs_MT32x32x8_MI16x16x4x1_SN_DTVA0_GSU1_GSUASB_LBSPPB128_LPB2_MIAV1_NTB0_NTC0_NTD0_NLCA1_PLR3_TT1_16_WG32_8_1
    SolutionIndex: 593
    SolutionNameMin: Cijk_Ailk_Bljk_ZB_UserArgs_MT64x80x16_MI16x16x4x1_SN_DTVA1_GSU1_GSUASB_LBSPPB256_LPB2_MIAV1_NTB0_NTC3_NTD3_NLCA1_PLR1_TT1_80_WG64_4_1
    SolutionIndex: 594
    SolutionNameMin: Cijk_Ailk_Bljk_ZB_UserArgs_MT64x144x16_MI16x16x4x1_SN_DTVA0_GSU2_GSUAMB_LBSPPB256_LPB2_MIAV0_NTB4_NTC3_NTD3_NLCA1_PLR1_TT1_144_WG64_4_1
    SolutionIndex: 595
    SolutionNameMin: Cijk_Ailk_Bljk_ZB_UserArgs_MT64x144x16_MI16x16x4x1_SN_DTVA0_LBSPPB256_LPB2_MIAV0_NTB0_NTC3_NTD3_NLCA1_PLR5_TT1_144_WG64_4_1
    SolutionIndex: 596
    SolutionNameMin: Cijk_Ailk_Bljk_ZB_UserArgs_MT64x144x16_MI16x16x4x1_SN_DTVA0_LBSPPB256_LPB2_MIAV0_NTB0_NTC0_NTD0_NLCA1_PLR5_TT1_144_WG64_4_1
    SolutionIndex: 597
    SolutionNameMin: Cijk_Ailk_Bljk_ZB_UserArgs_MT128x80x16_MI16x16x4x1_SN_DTVA1_LBSPPB256_LPB2_MIAV0_NTB4_NTC0_NTD0_NLCA2_PLR1_TT2_80_WG64_4_1
    SolutionIndex: 598
    SolutionNameMin: Cijk_Ailk_Bljk_ZB_UserArgs_MT128x96x16_MI16x16x4x1_SN_DTVA1_LBSPPB256_LPB2_NTB0_NLCA2_PLR5_TT2_96_WG64_4_1
    SolutionIndex: 599
    SolutionNameMin: Cijk_Ailk_Bljk_ZB_UserArgs_MT128x96x8_MI16x16x4x1_SN_DTVA1_LBSPPB128_LPB2_NTB0_NLCA2_PLR1_TT2_96_WG64_4_1
    SolutionIndex: 600
    SolutionNameMin: Cijk_Ailk_Bljk_ZB_UserArgs_MT128x96x16_MI16x16x4x1_SN_DTVA1_LBSPPB256_LPB2_NTB0_NLCA2_PLR1_TT2_96_WG64_4_1
    SolutionIndex: 601
    SolutionNameMin: Cijk_Ailk_Bljk_ZB_UserArgs_MT96x96x8_MI16x16x4x1_SN_DTVA0_LBSPPB128_LPB2_NLCA3_PLR1_TT3_48_WG32_8_1
- - - [7296, 9216, 1, 4096]
    - [5, 96.869]
  - - [7296, 9216, 1, 4128]
    - [0, 96.751]
  - - [7296, 9216, 1, 4160]
    - [6, 96.857]
  - - [7296, 9216, 1, 8192]
    - [1, 97.111]
  - - [7296, 9216, 1, 8224]
    - [4, 96.913]
  - - [7296, 9216, 1, 16384]
    - [3, 97.056]
  - - [7296, 9216, 1, 16416]
    - [2, 97.081]
  - - [32, 32, 1, 64]
    - [7, 0.045]
  - - [48, 16, 1, 16]
    - [8, 0.008]
  - - [64, 32, 1, 16]
    - [9, 0.022]
  - - [80, 48, 1, 16]
    - [8, 0.043]
  - - [96, 96, 1, 64]
    - [10, 0.433]
  - - [106, 106, 1, 128]
    - [11, 0.8]
  - - [128, 128, 1, 128]
    - [10, 1.223]
  - - [160, 160, 1, 64]
    - [9, 1.233]
  - - [224, 224, 1, 64]
    - [10, 2.302]
  - - [234, 234, 1, 128]
    - [10, 4.029]
  - - [256, 256, 1, 128]
    - [9, 4.822]
  - - [288, 288, 1, 64]
    - [10, 3.949]
  - - [352, 352, 1, 64]
    - [10, 5.738]
  - - [362, 362, 1, 128]
    - [10, 9.504]
  - - [384, 384, 1, 128]
    - [10, 10.753]
  - - [416, 416, 1, 64]
    - [9, 7.48]
  - - [480, 480, 1, 64]
    - [10, 9.275]
  - - [490, 490, 1, 128]
    - [10, 15.638]
  - - [512, 512, 1, 128]
    - [10, 16.978]
  - - [544, 544, 1, 64]
    - [10, 11.586]
  - - [608, 608, 1, 64]
    - [10, 13.061]
  - - [618, 618, 1, 128]
    - [10, 23.7]
  - - [640, 640, 1, 128]
    - [12, 25.82]
  - - [672, 672, 1, 64]
    - [13, 15.024]
  - - [736, 736, 1, 64]
    - [12, 16.662]
  - - [746, 746, 1, 128]
    - [10, 29.496]
  - - [768, 768, 1, 128]
    - [10, 31.935]
  - - [800, 800, 1, 64]
    - [14, 17.912]
  - - [864, 864, 1, 64]
    - [15, 19.765]
  - - [874, 874, 1, 128]
    - [15, 33.385]
  - - [896, 896, 1, 128]
    - [16, 35.209]
  - - [928, 928, 1, 64]
    - [12, 22.536]
  - - [992, 992, 1, 64]
    - [17, 22.497]
  - - [1002, 1002, 1, 128]
    - [18, 38.744]
  - - [1024, 1024, 1, 128]
    - [19, 41.217]
  - - [1056, 1056, 1, 64]
    - [20, 26.199]
  - - [1120, 1120, 1, 64]
    - [21, 27.048]
  - - [1130, 1130, 1, 128]
    - [22, 42.027]
  - - [1152, 1152, 1, 128]
    - [23, 46.335]
  - - [1184, 1184, 1, 64]
    - [24, 31.12]
  - - [1248, 1248, 1, 64]
    - [25, 34.845]
  - - [1258, 1258, 1, 128]
    - [26, 44.546]
  - - [1280, 1280, 1, 128]
    - [26, 47.645]
  - - [1312, 1312, 1, 64]
    - [27, 37.837]
  - - [1376, 1376, 1, 64]
    - [28, 35.056]
  - - [1386, 1386, 1, 128]
    - [29, 49.714]
  - - [1408, 1408, 1, 128]
    - [23, 51.994]
  - - [1440, 1440, 1, 64]
    - [30, 39.414]
  - - [1504, 1504, 1, 64]
    - [31, 40.856]
  - - [1514, 1514, 1, 128]
    - [32, 45.042]
  - - [1536, 1536, 1, 128]
    - [33, 47.282]
  - - [1568, 1568, 1, 64]
    - [34, 35.105]
  - - [1632, 1632, 1, 64]
    - [35, 43.115]
  - - [1642, 1642, 1, 128]
    - [36, 49.699]
  - - [1664, 1664, 1, 128]
    - [37, 48.809]
  - - [1696, 1696, 1, 64]
    - [38, 41.283]
  - - [1760, 1760, 1, 64]
    - [31, 43.14]
  - - [1770, 1770, 1, 128]
    - [39, 50.043]
  - - [1792, 1792, 1, 128]
    - [39, 50.785]
  - - [1824, 1824, 1, 64]
    - [21, 48.935]
  - - [1888, 1888, 1, 64]
    - [32, 44.756]
  - - [1898, 1898, 1, 128]
    - [32, 53.055]
  - - [1920, 1920, 1, 128]
    - [32, 52.514]
  - - [1952, 1952, 1, 64]
    - [18, 48.805]
  - - [2016, 2016, 1, 64]
    - [40, 44.541]
  - - [2026, 2026, 1, 128]
    - [41, 59.338]
  - - [2048, 2048, 1, 128]
    - [42, 52.807]
  - - [2080, 2080, 1, 64]
    - [31, 45.777]
  - - [2144, 2144, 1, 64]
    - [43, 45.955]
  - - [2154, 2154, 1, 128]
    - [44, 53.549]
  - - [2176, 2176, 1, 128]
    - [44, 54.777]
  - - [2208, 2208, 1, 64]
    - [41, 46.913]
  - - [2272, 2272, 1, 64]
    - [45, 50.099]
  - - [2282, 2282, 1, 128]
    - [42, 59.989]
  - - [2304, 2304, 1, 128]
    - [32, 61.387]
  - - [2336, 2336, 1, 64]
    - [5, 46.397]
  - - [2400, 2400, 1, 64]
    - [46, 50.369]
  - - [2410, 2410, 1, 128]
    - [42, 58.635]
  - - [2432, 2432, 1, 128]
    - [42, 62.307]
  - - [2464, 2464, 1, 64]
    - [43, 50.5]
  - - [2528, 2528, 1, 64]
    - [46, 52.291]
  - - [2538, 2538, 1, 128]
    - [42, 57.701]
  - - [2560, 2560, 1, 128]
    - [42, 74.75]
  - - [2592, 2592, 1, 64]
    - [47, 45.802]
  - - [2656, 2656, 1, 64]
    - [47, 47.748]
  - - [2666, 2666, 1, 128]
    - [31, 65.946]
  - - [2688, 2688, 1, 128]
    - [32, 66.444]
  - - [2720, 2720, 1, 64]
    - [48, 46.857]
  - - [2784, 2784, 1, 64]
    - [47, 47.184]
  - - [2794, 2794, 1, 128]
    - [42, 75.908]
  - - [2816, 2816, 1, 128]
    - [42, 79.488]
  - - [2848, 2848, 1, 64]
    - [24, 49.573]
  - - [2912, 2912, 1, 64]
    - [47, 48.471]
  - - [2922, 2922, 1, 128]
    - [44, 76.571]
  - - [2944, 2944, 1, 128]
    - [49, 78.872]
  - - [2976, 2976, 1, 64]
    - [50, 44.009]
  - - [3040, 3040, 1, 64]
    - [51, 57.599]
  - - [3050, 3050, 1, 128]
    - [31, 72.47]
  - - [3072, 3072, 1, 128]
    - [32, 69.768]
  - - [3104, 3104, 1, 64]
    - [47, 50.301]
  - - [3168, 3168, 1, 64]
    - [47, 49.831]
  - - [3178, 3178, 1, 128]
    - [5, 56.084]
  - - [3200, 3200, 1, 128]
    - [42, 80.33]
  - - [3232, 3232, 1, 64]
    - [24, 52.13]
  - - [3306, 3306, 1, 128]
    - [52, 62.308]
  - - [3328, 3328, 1, 128]
    - [49, 80.287]
  - - [3434, 3434, 1, 128]
    - [32, 71.34]
  - - [3456, 3456, 1, 128]
    - [53, 64.907]
  - - [3562, 3562, 1, 128]
    - [52, 68.482]
  - - [3584, 3584, 1, 128]
    - [53, 64.335]
  - - [3690, 3690, 1, 128]
    - [52, 70.57]
  - - [3712, 3712, 1, 128]
    - [47, 64.856]
  - - [3818, 3818, 1, 128]
    - [32, 74.341]
  - - [3840, 3840, 1, 128]
    - [47, 67.723]
  - - [3946, 3946, 1, 128]
    - [5, 62.006]
  - - [3968, 3968, 1, 128]
    - [52, 71.08]
  - - [4074, 4074, 1, 128]
    - [52, 67.477]
  - - [4096, 4096, 1, 128]
    - [47, 67.966]
  - - [4202, 4202, 1, 128]
    - [53, 67.75]
  - - [4224, 4224, 1, 128]
    - [47, 69.29]
  - - [4330, 4330, 1, 128]
    - [5, 65.265]
  - - [4352, 4352, 1, 128]
    - [47, 68.618]
  - - [4458, 4458, 1, 128]
    - [5, 66.17]
  - - [4480, 4480, 1, 128]
    - [47, 68.812]
  - - [4586, 4586, 1, 128]
    - [53, 70.822]
  - - [4608, 4608, 1, 128]
    - [54, 71.24]
  - - [4714, 4714, 1, 128]
    - [53, 71.278]
  - - [4736, 4736, 1, 128]
    - [47, 72.074]
  - - [4842, 4842, 1, 128]
    - [55, 69.147]
  - - [4864, 4864, 1, 128]
    - [56, 73.835]
  - - [4970, 4970, 1, 128]
    - [53, 71.469]
  - - [4992, 4992, 1, 128]
    - [47, 71.612]
  - - [5098, 5098, 1, 128]
    - [57, 71.822]
  - - [5120, 5120, 1, 128]
    - [47, 72.364]
  - - [5226, 5226, 1, 128]
    - [53, 72.445]
  - - [5248, 5248, 1, 128]
    - [47, 72.598]
  - - [5354, 5354, 1, 128]
    - [58, 63.009]
  - - [5376, 5376, 1, 128]
    - [58, 66.991]
  - - [5482, 5482, 1, 128]
    - [53, 73.505]
  - - [5504, 5504, 1, 128]
    - [56, 76.035]
  - - [5610, 5610, 1, 128]
    - [53, 73.821]
  - - [5632, 5632, 1, 128]
    - [59, 62.694]
  - - [5738, 5738, 1, 128]
    - [60, 65.794]
  - - [5760, 5760, 1, 128]
    - [60, 65.648]
  - - [5866, 5866, 1, 128]
    - [57, 75.809]
  - - [5888, 5888, 1, 128]
    - [61, 63.777]
  - - [5994, 5994, 1, 128]
    - [62, 64.705]
  - - [6016, 6016, 1, 128]
    - [62, 68.802]
  - - [6122, 6122, 1, 128]
    - [58, 67.515]
  - - [6144, 6144, 1, 128]
    - [58, 71.255]
  - - [6250, 6250, 1, 128]
    - [62, 66.735]
  - - [6272, 6272, 1, 128]
    - [60, 67.602]
  - - [6378, 6378, 1, 128]
    - [62, 71.102]
  - - [6400, 6400, 1, 128]
    - [59, 67.084]
  - - [6506, 6506, 1, 128]
    - [60, 68.607]
  - - [6528, 6528, 1, 128]
    - [60, 71.232]
  - - [6634, 6634, 1, 128]
    - [60, 67.125]
  - - [6656, 6656, 1, 128]
    - [60, 68.981]
  - - [6762, 6762, 1, 128]
    - [60, 67.511]
  - - [6784, 6784, 1, 128]
    - [60, 69.056]
  - - [6890, 6890, 1, 128]
    - [60, 69.515]
  - - [6912, 6912, 1, 128]
    - [58, 73.316]
  - - [7018, 7018, 1, 128]
    - [60, 69.618]
  - - [7040, 7040, 1, 128]
    - [61, 70.873]
  - - [7168, 7168, 1, 128]
    - [60, 72.217]
  - - [7296, 7296, 1, 128]
    - [61, 70.246]
  - - [7424, 7424, 1, 128]
    - [61, 70.711]
  - - [7552, 7552, 1, 128]
    - [60, 72.546]
  - - [7680, 7680, 1, 128]
    - [5, 75.129]
  - - [7808, 7808, 1, 128]
    - [60, 73.239]
  - - [7936, 7936, 1, 128]
    - [60, 73.213]
  - - [8064, 8064, 1, 128]
    - [60, 74.858]
  - - [8192, 8192, 1, 128]
    - [59, 73.512]
  - - [8320, 8320, 1, 128]
    - [60, 74.117]
  - - [8448, 8448, 1, 128]
    - [61, 74.487]
  - - [8576, 8576, 1, 128]
    - [59, 75.076]
  - - [8704, 8704, 1, 128]
    - [59, 75.688]
  - - [8832, 8832, 1, 128]
    - [59, 75.547]
  - - [8960, 8960, 1, 128]
    - [59, 76.308]
  - - [9088, 9088, 1, 128]
    - [61, 77.121]
  - - [9216, 9216, 1, 128]
    - [59, 75.921]
  - - [9344, 9344, 1, 128]
    - [60, 76.885]
  - - [9472, 9472, 1, 128]
    - [63, 76.522]
  - - [9600, 9600, 1, 128]
    - [59, 75.326]
  - - [9728, 9728, 1, 128]
    - [60, 76.46]
  - - [9856, 9856, 1, 128]
    - [63, 77.248]
  - - [9984, 9984, 1, 128]
    - [60, 77.225]
  - - [10112, 10112, 1, 128]
    - [59, 76.157]
  - - [10240, 10240, 1, 128]
    - [63, 77.469]
  - - [10368, 10368, 1, 128]
    - [60, 77.825]
  - - [10496, 10496, 1, 128]
    - [63, 76.83]
  - - [10624, 10624, 1, 128]
    - [60, 77.698]
  - - [10752, 10752, 1, 128]
    - [60, 78.157]
  - - [10880, 10880, 1, 128]
    - [60, 77.946]
  - - [11008, 11008, 1, 128]
    - [60, 79.754]
  - - [11136, 11136, 1, 128]
    - [62, 78.202]
  - - [11264, 11264, 1, 128]
    - [63, 78.465]
  - - [11392, 11392, 1, 128]
    - [61, 79.727]
  - - [11520, 11520, 1, 128]
    - [62, 78.409]
  - - [11648, 11648, 1, 128]
    - [62, 78.615]
  - - [11776, 11776, 1, 128]
    - [63, 78.38]
  - - [11904, 11904, 1, 128]
    - [60, 78.188]
  - - [12032, 12032, 1, 128]
    - [59, 77.994]
  - - [12160, 12160, 1, 128]
    - [61, 77.847]
  - - [12288, 12288, 1, 128]
    - [61, 78.274]
  - - [12416, 12416, 1, 128]
    - [60, 79.195]
  - - [12544, 12544, 1, 128]
    - [59, 78.501]
  - - [12672, 12672, 1, 128]
    - [63, 78.912]
  - - [12800, 12800, 1, 128]
    - [60, 79.026]
  - - [12928, 12928, 1, 128]
    - [63, 78.67]
  - - [13056, 13056, 1, 128]
    - [63, 78.689]
  - - [16, 16, 1, 1024]
    - [64, 0.0]
  - - [16, 16, 1, 4096]
    - [65, 0.0]
  - - [16, 16, 1, 16384]
    - [66, 0.0]
  - - [32, 16, 1, 1024]
    - [67, 0.0]
  - - [32, 16, 1, 4096]
    - [68, 0.0]
  - - [32, 16, 1, 16384]
    - [69, 0.0]
  - - [64, 16, 1, 1024]
    - [70, 0.0]
  - - [64, 16, 1, 4096]
    - [71, 0.0]
  - - [64, 16, 1, 16384]
    - [72, 0.0]
  - - [128, 16, 1, 1024]
    - [73, 0.0]
  - - [128, 16, 1, 4096]
    - [74, 0.0]
  - - [128, 16, 1, 16384]
    - [75, 0.0]
  - - [256, 16, 1, 1024]
    - [76, 0.0]
  - - [256, 16, 1, 4096]
    - [77, 0.0]
  - - [256, 16, 1, 16384]
    - [78, 0.0]
  - - [512, 16, 1, 1024]
    - [79, 0.0]
  - - [512, 16, 1, 4096]
    - [80, 0.0]
  - - [512, 16, 1, 16384]
    - [81, 0.0]
  - - [768, 16, 1, 1024]
    - [82, 0.0]
  - - [768, 16, 1, 4096]
    - [83, 0.0]
  - - [768, 16, 1, 16384]
    - [84, 0.0]
  - - [1024, 16, 1, 1024]
    - [82, 0.0]
  - - [1024, 16, 1, 4096]
    - [85, 0.0]
  - - [1024, 16, 1, 16384]
    - [86, 0.0]
  - - [1536, 16, 1, 1024]
    - [83, 0.0]
  - - [1536, 16, 1, 4096]
    - [85, 0.0]
  - - [1536, 16, 1, 16384]
    - [87, 0.0]
  - - [2048, 16, 1, 1024]
    - [88, 0.0]
  - - [2048, 16, 1, 4096]
    - [89, 0.0]
  - - [2048, 16, 1, 16384]
    - [90, 0.0]
  - - [3072, 16, 1, 1024]
    - [91, 0.0]
  - - [3072, 16, 1, 4096]
    - [88, 0.0]
  - - [3072, 16, 1, 16384]
    - [92, 0.0]
  - - [4096, 16, 1, 1024]
    - [93, 0.0]
  - - [4096, 16, 1, 4096]
    - [94, 0.0]
  - - [4096, 16, 1, 16384]
    - [95, 0.0]
  - - [6144, 16, 1, 1024]
    - [96, 0.0]
  - - [6144, 16, 1, 4096]
    - [97, 0.0]
  - - [6144, 16, 1, 16384]
    - [98, 0.0]
  - - [8192, 16, 1, 1024]
    - [99, 0.0]
  - - [8192, 16, 1, 4096]
    - [100, 0.0]
  - - [8192, 16, 1, 16384]
    - [101, 0.0]
  - - [12288, 16, 1, 1024]
    - [102, 0.0]
  - - [12288, 16, 1, 4096]
    - [103, 0.0]
  - - [12288, 16, 1, 16384]
    - [104, 0.0]
  - - [16384, 16, 1, 1024]
    - [105, 0.0]
  - - [16384, 16, 1, 4096]
    - [106, 0.0]
  - - [16384, 16, 1, 16384]
    - [107, 0.0]
  - - [16, 32, 1, 1024]
    - [108, 0.0]
  - - [16, 32, 1, 4096]
    - [109, 0.0]
  - - [16, 32, 1, 16384]
    - [110, 0.0]
  - - [32, 32, 1, 1024]
    - [111, 0.0]
  - - [32, 32, 1, 4096]
    - [112, 0.0]
  - - [32, 32, 1, 16384]
    - [113, 0.0]
  - - [64, 32, 1, 1024]
    - [114, 0.0]
  - - [64, 32, 1, 4096]
    - [115, 0.0]
  - - [64, 32, 1, 16384]
    - [116, 0.0]
  - - [128, 32, 1, 1024]
    - [117, 0.0]
  - - [128, 32, 1, 4096]
    - [118, 0.0]
  - - [128, 32, 1, 16384]
    - [119, 0.0]
  - - [256, 32, 1, 1024]
    - [120, 0.0]
  - - [256, 32, 1, 4096]
    - [121, 0.0]
  - - [256, 32, 1, 16384]
    - [122, 0.0]
  - - [512, 32, 1, 1024]
    - [123, 0.0]
  - - [512, 32, 1, 4096]
    - [124, 0.0]
  - - [512, 32, 1, 16384]
    - [125, 0.0]
  - - [768, 32, 1, 1024]
    - [123, 0.0]
  - - [768, 32, 1, 4096]
    - [124, 0.0]
  - - [768, 32, 1, 16384]
    - [126, 0.0]
  - - [1024, 32, 1, 1024]
    - [124, 0.0]
  - - [1024, 32, 1, 4096]
    - [123, 0.0]
  - - [1024, 32, 1, 16384]
    - [127, 0.0]
  - - [1536, 32, 1, 1024]
    - [128, 0.0]
  - - [1536, 32, 1, 4096]
    - [123, 0.0]
  - - [1536, 32, 1, 16384]
    - [129, 0.0]
  - - [2048, 32, 1, 1024]
    - [130, 0.0]
  - - [2048, 32, 1, 4096]
    - [131, 0.0]
  - - [2048, 32, 1, 16384]
    - [132, 0.0]
  - - [3072, 32, 1, 1024]
    - [133, 0.0]
  - - [3072, 32, 1, 4096]
    - [134, 0.0]
  - - [3072, 32, 1, 16384]
    - [135, 0.0]
  - - [4096, 32, 1, 1024]
    - [136, 0.0]
  - - [4096, 32, 1, 4096]
    - [137, 0.0]
  - - [4096, 32, 1, 16384]
    - [138, 0.0]
  - - [6144, 32, 1, 1024]
    - [131, 0.0]
  - - [6144, 32, 1, 4096]
    - [139, 0.0]
  - - [6144, 32, 1, 16384]
    - [140, 0.0]
  - - [8192, 32, 1, 1024]
    - [141, 0.0]
  - - [8192, 32, 1, 4096]
    - [142, 0.0]
  - - [8192, 32, 1, 16384]
    - [143, 0.0]
  - - [12288, 32, 1, 1024]
    - [144, 0.0]
  - - [12288, 32, 1, 4096]
    - [145, 0.0]
  - - [12288, 32, 1, 16384]
    - [146, 0.0]
  - - [16384, 32, 1, 1024]
    - [147, 0.0]
  - - [16384, 32, 1, 4096]
    - [148, 0.0]
  - - [16384, 32, 1, 16384]
    - [149, 0.0]
  - - [16, 64, 1, 1024]
    - [150, 0.0]
  - - [16, 64, 1, 4096]
    - [151, 0.0]
  - - [16, 64, 1, 16384]
    - [152, 0.0]
  - - [32, 64, 1, 1024]
    - [153, 0.0]
  - - [32, 64, 1, 4096]
    - [154, 0.0]
  - - [32, 64, 1, 16384]
    - [155, 0.0]
  - - [64, 64, 1, 1024]
    - [156, 0.0]
  - - [64, 64, 1, 4096]
    - [156, 0.0]
  - - [64, 64, 1, 16384]
    - [157, 0.0]
  - - [128, 64, 1, 1024]
    - [158, 0.0]
  - - [128, 64, 1, 4096]
    - [159, 0.0]
  - - [128, 64, 1, 16384]
    - [160, 0.0]
  - - [256, 64, 1, 1024]
    - [161, 0.0]
  - - [256, 64, 1, 4096]
    - [162, 0.0]
  - - [256, 64, 1, 16384]
    - [163, 0.0]
  - - [512, 64, 1, 1024]
    - [164, 0.0]
  - - [512, 64, 1, 4096]
    - [165, 0.0]
  - - [512, 64, 1, 16384]
    - [166, 0.0]
  - - [768, 64, 1, 1024]
    - [164, 0.0]
  - - [768, 64, 1, 4096]
    - [165, 0.0]
  - - [768, 64, 1, 16384]
    - [167, 0.0]
  - - [1024, 64, 1, 1024]
    - [168, 0.0]
  - - [1024, 64, 1, 4096]
    - [169, 0.0]
  - - [1024, 64, 1, 16384]
    - [170, 0.0]
  - - [1536, 64, 1, 1024]
    - [171, 0.0]
  - - [1536, 64, 1, 4096]
    - [172, 0.0]
  - - [1536, 64, 1, 16384]
    - [173, 0.0]
  - - [2048, 64, 1, 1024]
    - [174, 0.0]
  - - [2048, 64, 1, 4096]
    - [175, 0.0]
  - - [2048, 64, 1, 16384]
    - [176, 0.0]
  - - [3072, 64, 1, 1024]
    - [174, 0.0]
  - - [3072, 64, 1, 4096]
    - [177, 0.0]
  - - [3072, 64, 1, 16384]
    - [178, 0.0]
  - - [4096, 64, 1, 1024]
    - [179, 0.0]
  - - [4096, 64, 1, 4096]
    - [180, 0.0]
  - - [4096, 64, 1, 16384]
    - [181, 0.0]
  - - [6144, 64, 1, 1024]
    - [182, 0.0]
  - - [6144, 64, 1, 4096]
    - [183, 0.0]
  - - [6144, 64, 1, 16384]
    - [184, 0.0]
  - - [8192, 64, 1, 1024]
    - [185, 0.0]
  - - [8192, 64, 1, 4096]
    - [186, 0.0]
  - - [8192, 64, 1, 16384]
    - [187, 0.0]
  - - [12288, 64, 1, 1024]
    - [188, 0.0]
  - - [12288, 64, 1, 4096]
    - [189, 0.0]
  - - [12288, 64, 1, 16384]
    - [190, 0.0]
  - - [16384, 64, 1, 256]
    - [191, 0.0]
  - - [16384, 64, 1, 1024]
    - [192, 0.0]
  - - [16384, 64, 1, 4096]
    - [193, 0.0]
  - - [16, 128, 1, 1024]
    - [194, 0.0]
  - - [16, 128, 1, 4096]
    - [195, 0.0]
  - - [16, 128, 1, 16384]
    - [196, 0.0]
  - - [32, 128, 1, 1024]
    - [197, 0.0]
  - - [32, 128, 1, 4096]
    - [198, 0.0]
  - - [32, 128, 1, 16384]
    - [199, 0.0]
  - - [64, 128, 1, 1024]
    - [200, 0.0]
  - - [64, 128, 1, 4096]
    - [201, 0.0]
  - - [64, 128, 1, 16384]
    - [202, 0.0]
  - - [128, 128, 1, 1024]
    - [203, 0.0]
  - - [128, 128, 1, 4096]
    - [204, 0.0]
  - - [128, 128, 1, 16384]
    - [205, 0.0]
  - - [256, 128, 1, 1024]
    - [206, 0.0]
  - - [256, 128, 1, 4096]
    - [207, 0.0]
  - - [256, 128, 1, 16384]
    - [208, 0.0]
  - - [512, 128, 1, 1024]
    - [209, 0.0]
  - - [512, 128, 1, 4096]
    - [210, 0.0]
  - - [512, 128, 1, 16384]
    - [211, 0.0]
  - - [768, 128, 1, 1024]
    - [212, 0.0]
  - - [768, 128, 1, 4096]
    - [213, 0.0]
  - - [768, 128, 1, 16384]
    - [214, 0.0]
  - - [1024, 128, 1, 1024]
    - [215, 0.0]
  - - [1024, 128, 1, 4096]
    - [216, 0.0]
  - - [1024, 128, 1, 16384]
    - [217, 0.0]
  - - [1536, 128, 1, 1024]
    - [218, 0.0]
  - - [1536, 128, 1, 4096]
    - [219, 0.0]
  - - [1536, 128, 1, 16384]
    - [220, 0.0]
  - - [2048, 128, 1, 1024]
    - [221, 0.0]
  - - [2048, 128, 1, 4096]
    - [222, 0.0]
  - - [2048, 128, 1, 16384]
    - [223, 0.0]
  - - [3072, 128, 1, 1024]
    - [224, 0.0]
  - - [3072, 128, 1, 4096]
    - [225, 0.0]
  - - [3072, 128, 1, 16384]
    - [226, 0.0]
  - - [4096, 128, 1, 1024]
    - [227, 0.0]
  - - [4096, 128, 1, 4096]
    - [228, 0.0]
  - - [4096, 128, 1, 16384]
    - [229, 0.0]
  - - [6144, 128, 1, 1024]
    - [230, 0.0]
  - - [6144, 128, 1, 4096]
    - [231, 0.0]
  - - [6144, 128, 1, 16384]
    - [232, 0.0]
  - - [8192, 128, 1, 256]
    - [233, 0.0]
  - - [8192, 128, 1, 1024]
    - [234, 0.0]
  - - [8192, 128, 1, 4096]
    - [235, 0.0]
  - - [12288, 128, 1, 256]
    - [236, 0.0]
  - - [12288, 128, 1, 1024]
    - [237, 0.0]
  - - [12288, 128, 1, 4096]
    - [238, 0.0]
  - - [16384, 128, 1, 256]
    - [239, 0.0]
  - - [16384, 128, 1, 1024]
    - [240, 0.0]
  - - [16384, 128, 1, 4096]
    - [241, 0.0]
  - - [16, 256, 1, 1024]
    - [242, 0.0]
  - - [16, 256, 1, 4096]
    - [243, 0.0]
  - - [16, 256, 1, 16384]
    - [244, 0.0]
  - - [32, 256, 1, 1024]
    - [245, 0.0]
  - - [32, 256, 1, 4096]
    - [246, 0.0]
  - - [32, 256, 1, 16384]
    - [247, 0.0]
  - - [64, 256, 1, 1024]
    - [248, 0.0]
  - - [64, 256, 1, 4096]
    - [249, 0.0]
  - - [64, 256, 1, 16384]
    - [250, 0.0]
  - - [128, 256, 1, 1024]
    - [251, 0.0]
  - - [128, 256, 1, 4096]
    - [252, 0.0]
  - - [128, 256, 1, 16384]
    - [253, 0.0]
  - - [256, 256, 1, 1024]
    - [254, 0.0]
  - - [256, 256, 1, 4096]
    - [255, 0.0]
  - - [256, 256, 1, 16384]
    - [256, 0.0]
  - - [512, 256, 1, 1024]
    - [257, 0.0]
  - - [512, 256, 1, 4096]
    - [258, 0.0]
  - - [512, 256, 1, 16384]
    - [259, 0.0]
  - - [768, 256, 1, 1024]
    - [260, 0.0]
  - - [768, 256, 1, 4096]
    - [261, 0.0]
  - - [768, 256, 1, 16384]
    - [262, 0.0]
  - - [1024, 256, 1, 1024]
    - [263, 0.0]
  - - [1024, 256, 1, 4096]
    - [264, 0.0]
  - - [1024, 256, 1, 16384]
    - [265, 0.0]
  - - [1536, 256, 1, 1024]
    - [263, 0.0]
  - - [1536, 256, 1, 4096]
    - [266, 0.0]
  - - [1536, 256, 1, 16384]
    - [267, 0.0]
  - - [2048, 256, 1, 1024]
    - [268, 0.0]
  - - [2048, 256, 1, 4096]
    - [269, 0.0]
  - - [2048, 256, 1, 16384]
    - [270, 0.0]
  - - [3072, 256, 1, 1024]
    - [271, 0.0]
  - - [3072, 256, 1, 4096]
    - [272, 0.0]
  - - [3072, 256, 1, 16384]
    - [273, 0.0]
  - - [4096, 256, 1, 256]
    - [274, 0.0]
  - - [4096, 256, 1, 1024]
    - [275, 0.0]
  - - [4096, 256, 1, 4096]
    - [276, 0.0]
  - - [6144, 256, 1, 256]
    - [277, 0.0]
  - - [6144, 256, 1, 1024]
    - [278, 0.0]
  - - [6144, 256, 1, 4096]
    - [279, 0.0]
  - - [8192, 256, 1, 256]
    - [280, 0.0]
  - - [8192, 256, 1, 1024]
    - [281, 0.0]
  - - [8192, 256, 1, 4096]
    - [281, 0.0]
  - - [12288, 256, 1, 256]
    - [282, 0.0]
  - - [12288, 256, 1, 1024]
    - [283, 0.0]
  - - [12288, 256, 1, 4096]
    - [284, 0.0]
  - - [16384, 256, 1, 256]
    - [285, 0.0]
  - - [16384, 256, 1, 1024]
    - [286, 0.0]
  - - [16384, 256, 1, 4096]
    - [287, 0.0]
  - - [16, 512, 1, 1024]
    - [288, 0.0]
  - - [16, 512, 1, 4096]
    - [289, 0.0]
  - - [16, 512, 1, 16384]
    - [290, 0.0]
  - - [32, 512, 1, 1024]
    - [291, 0.0]
  - - [32, 512, 1, 4096]
    - [292, 0.0]
  - - [32, 512, 1, 16384]
    - [293, 0.0]
  - - [64, 512, 1, 1024]
    - [294, 0.0]
  - - [64, 512, 1, 4096]
    - [295, 0.0]
  - - [64, 512, 1, 16384]
    - [296, 0.0]
  - - [128, 512, 1, 1024]
    - [297, 0.0]
  - - [128, 512, 1, 4096]
    - [298, 0.0]
  - - [128, 512, 1, 16384]
    - [299, 0.0]
  - - [256, 512, 1, 1024]
    - [300, 0.0]
  - - [256, 512, 1, 4096]
    - [301, 0.0]
  - - [256, 512, 1, 16384]
    - [302, 0.0]
  - - [512, 512, 1, 1024]
    - [303, 0.0]
  - - [512, 512, 1, 4096]
    - [304, 0.0]
  - - [512, 512, 1, 16384]
    - [305, 0.0]
  - - [768, 512, 1, 1024]
    - [306, 0.0]
  - - [768, 512, 1, 4096]
    - [307, 0.0]
  - - [768, 512, 1, 16384]
    - [308, 0.0]
  - - [1024, 512, 1, 1024]
    - [309, 0.0]
  - - [1024, 512, 1, 4096]
    - [310, 0.0]
  - - [1024, 512, 1, 16384]
    - [311, 0.0]
  - - [1536, 512, 1, 1024]
    - [312, 0.0]
  - - [1536, 512, 1, 4096]
    - [313, 0.0]
  - - [1536, 512, 1, 16384]
    - [314, 0.0]
  - - [2048, 512, 1, 256]
    - [315, 0.0]
  - - [2048, 512, 1, 1024]
    - [316, 0.0]
  - - [2048, 512, 1, 4096]
    - [317, 0.0]
  - - [3072, 512, 1, 256]
    - [318, 0.0]
  - - [3072, 512, 1, 1024]
    - [319, 0.0]
  - - [3072, 512, 1, 4096]
    - [320, 0.0]
  - - [4096, 512, 1, 256]
    - [321, 0.0]
  - - [4096, 512, 1, 1024]
    - [322, 0.0]
  - - [4096, 512, 1, 4096]
    - [323, 0.0]
  - - [6144, 512, 1, 256]
    - [324, 0.0]
  - - [6144, 512, 1, 1024]
    - [325, 0.0]
  - - [6144, 512, 1, 4096]
    - [326, 0.0]
  - - [8192, 512, 1, 256]
    - [327, 0.0]
  - - [8192, 512, 1, 1024]
    - [328, 0.0]
  - - [8192, 512, 1, 4096]
    - [329, 0.0]
  - - [12288, 512, 1, 256]
    - [330, 0.0]
  - - [12288, 512, 1, 1024]
    - [331, 0.0]
  - - [12288, 512, 1, 4096]
    - [332, 0.0]
  - - [16384, 512, 1, 256]
    - [333, 0.0]
  - - [16384, 512, 1, 1024]
    - [334, 0.0]
  - - [16384, 512, 1, 4096]
    - [335, 0.0]
  - - [16, 768, 1, 1024]
    - [336, 0.0]
  - - [16, 768, 1, 4096]
    - [336, 0.0]
  - - [16, 768, 1, 16384]
    - [337, 0.0]
  - - [16, 1024, 1, 1024]
    - [338, 0.0]
  - - [16, 1024, 1, 4096]
    - [338, 0.0]
  - - [16, 1024, 1, 16384]
    - [339, 0.0]
  - - [16, 1536, 1, 1024]
    - [338, 0.0]
  - - [16, 1536, 1, 4096]
    - [336, 0.0]
  - - [16, 1536, 1, 16384]
    - [340, 0.0]
  - - [32, 768, 1, 1024]
    - [341, 0.0]
  - - [32, 768, 1, 4096]
    - [342, 0.0]
  - - [32, 768, 1, 16384]
    - [343, 0.0]
  - - [32, 1024, 1, 1024]
    - [344, 0.0]
  - - [32, 1024, 1, 4096]
    - [345, 0.0]
  - - [32, 1024, 1, 16384]
    - [346, 0.0]
  - - [32, 1536, 1, 1024]
    - [347, 0.0]
  - - [32, 1536, 1, 4096]
    - [344, 0.0]
  - - [32, 1536, 1, 16384]
    - [348, 0.0]
  - - [64, 768, 1, 1024]
    - [294, 0.0]
  - - [64, 768, 1, 4096]
    - [349, 0.0]
  - - [64, 768, 1, 16384]
    - [350, 0.0]
  - - [64, 1024, 1, 1024]
    - [351, 0.0]
  - - [64, 1024, 1, 4096]
    - [352, 0.0]
  - - [64, 1024, 1, 16384]
    - [353, 0.0]
  - - [64, 1536, 1, 1024]
    - [354, 0.0]
  - - [64, 1536, 1, 4096]
    - [355, 0.0]
  - - [64, 1536, 1, 16384]
    - [356, 0.0]
  - - [128, 768, 1, 1024]
    - [357, 0.0]
  - - [128, 768, 1, 4096]
    - [297, 0.0]
  - - [128, 768, 1, 16384]
    - [358, 0.0]
  - - [128, 1024, 1, 1024]
    - [359, 0.0]
  - - [128, 1024, 1, 4096]
    - [360, 0.0]
  - - [128, 1024, 1, 16384]
    - [361, 0.0]
  - - [128, 1536, 1, 1024]
    - [359, 0.0]
  - - [128, 1536, 1, 4096]
    - [362, 0.0]
  - - [128, 1536, 1, 16384]
    - [363, 0.0]
  - - [256, 768, 1, 1024]
    - [364, 0.0]
  - - [256, 768, 1, 4096]
    - [365, 0.0]
  - - [256, 768, 1, 16384]
    - [366, 0.0]
  - - [256, 1024, 1, 1024]
    - [367, 0.0]
  - - [256, 1024, 1, 4096]
    - [368, 0.0]
  - - [256, 1024, 1, 16384]
    - [369, 0.0]
  - - [256, 1536, 1, 1024]
    - [370, 0.0]
  - - [256, 1536, 1, 4096]
    - [371, 0.0]
  - - [256, 1536, 1, 16384]
    - [372, 0.0]
  - - [512, 768, 1, 1024]
    - [373, 0.0]
  - - [512, 768, 1, 4096]
    - [374, 0.0]
  - - [512, 768, 1, 16384]
    - [375, 0.0]
  - - [512, 1024, 1, 1024]
    - [376, 0.0]
  - - [512, 1024, 1, 4096]
    - [377, 0.0]
  - - [512, 1024, 1, 16384]
    - [311, 0.0]
  - - [512, 1536, 1, 1024]
    - [378, 0.0]
  - - [512, 1536, 1, 4096]
    - [379, 0.0]
  - - [512, 1536, 1, 16384]
    - [379, 0.0]
  - - [768, 768, 1, 1024]
    - [309, 0.0]
  - - [768, 768, 1, 4096]
    - [380, 0.0]
  - - [768, 768, 1, 16384]
    - [381, 0.0]
  - - [1024, 768, 1, 1024]
    - [382, 0.0]
  - - [1024, 768, 1, 4096]
    - [383, 0.0]
  - - [1024, 768, 1, 16384]
    - [384, 0.0]
  - - [1536, 768, 1, 256]
    - [307, 0.0]
  - - [1536, 768, 1, 1024]
    - [385, 0.0]
  - - [1536, 768, 1, 4096]
    - [386, 0.0]
  - - [768, 1024, 1, 1024]
    - [387, 0.0]
  - - [768, 1024, 1, 4096]
    - [388, 0.0]
  - - [768, 1024, 1, 16384]
    - [389, 0.0]
  - - [1024, 1024, 1, 256]
    - [390, 0.0]
  - - [1024, 1024, 1, 1024]
    - [317, 0.0]
  - - [1024, 1024, 1, 4096]
    - [317, 0.0]
  - - [1536, 1024, 1, 256]
    - [391, 0.0]
  - - [1536, 1024, 1, 1024]
    - [392, 0.0]
  - - [1536, 1024, 1, 4096]
    - [393, 0.0]
  - - [768, 1536, 1, 256]
    - [394, 0.0]
  - - [768, 1536, 1, 1024]
    - [395, 0.0]
  - - [768, 1536, 1, 4096]
    - [396, 0.0]
  - - [1024, 1536, 1, 256]
    - [397, 0.0]
  - - [1024, 1536, 1, 1024]
    - [392, 0.0]
  - - [1024, 1536, 1, 4096]
    - [398, 0.0]
  - - [1536, 1536, 1, 256]
    - [399, 0.0]
  - - [1536, 1536, 1, 1024]
    - [400, 0.0]
  - - [1536, 1536, 1, 4096]
    - [401, 0.0]
  - - [2048, 768, 1, 256]
    - [402, 0.0]
  - - [2048, 768, 1, 1024]
    - [403, 0.0]
  - - [2048, 768, 1, 4096]
    - [404, 0.0]
  - - [3072, 768, 1, 256]
    - [405, 0.0]
  - - [3072, 768, 1, 1024]
    - [406, 0.0]
  - - [3072, 768, 1, 4096]
    - [407, 0.0]
  - - [4096, 768, 1, 256]
    - [408, 0.0]
  - - [4096, 768, 1, 1024]
    - [409, 0.0]
  - - [4096, 768, 1, 4096]
    - [410, 0.0]
  - - [2048, 1024, 1, 256]
    - [411, 0.0]
  - - [2048, 1024, 1, 1024]
    - [317, 0.0]
  - - [2048, 1024, 1, 4096]
    - [412, 0.0]
  - - [3072, 1024, 1, 256]
    - [413, 0.0]
  - - [3072, 1024, 1, 1024]
    - [414, 0.0]
  - - [3072, 1024, 1, 4096]
    - [415, 0.0]
  - - [4096, 1024, 1, 256]
    - [416, 0.0]
  - - [4096, 1024, 1, 1024]
    - [323, 0.0]
  - - [4096, 1024, 1, 4096]
    - [417, 0.0]
  - - [2048, 1536, 1, 256]
    - [418, 0.0]
  - - [2048, 1536, 1, 1024]
    - [419, 0.0]
  - - [2048, 1536, 1, 4096]
    - [409, 0.0]
  - - [3072, 1536, 1, 256]
    - [405, 0.0]
  - - [3072, 1536, 1, 1024]
    - [401, 0.0]
  - - [3072, 1536, 1, 4096]
    - [418, 0.0]
  - - [4096, 1536, 1, 256]
    - [420, 0.0]
  - - [4096, 1536, 1, 1024]
    - [421, 0.0]
  - - [4096, 1536, 1, 4096]
    - [419, 0.0]
  - - [6144, 768, 1, 256]
    - [422, 0.0]
  - - [6144, 768, 1, 1024]
    - [423, 0.0]
  - - [6144, 768, 1, 4096]
    - [424, 0.0]
  - - [8192, 768, 1, 256]
    - [425, 0.0]
  - - [8192, 768, 1, 1024]
    - [426, 0.0]
  - - [8192, 768, 1, 4096]
    - [426, 0.0]
  - - [12288, 768, 1, 256]
    - [427, 0.0]
  - - [12288, 768, 1, 1024]
    - [426, 0.0]
  - - [12288, 768, 1, 4096]
    - [428, 0.0]
  - - [16384, 768, 1, 256]
    - [428, 0.0]
  - - [16384, 768, 1, 1024]
    - [429, 0.0]
  - - [16384, 768, 1, 4096]
    - [429, 0.0]
  - - [6144, 1024, 1, 256]
    - [430, 0.0]
  - - [6144, 1024, 1, 1024]
    - [431, 0.0]
  - - [6144, 1024, 1, 4096]
    - [432, 0.0]
  - - [8192, 1024, 1, 256]
    - [426, 0.0]
  - - [8192, 1024, 1, 1024]
    - [428, 0.0]
  - - [8192, 1024, 1, 4096]
    - [428, 0.0]
  - - [12288, 1024, 1, 256]
    - [433, 0.0]
  - - [12288, 1024, 1, 1024]
    - [432, 0.0]
  - - [12288, 1024, 1, 4096]
    - [432, 0.0]
  - - [16384, 1024, 1, 1024]
    - [427, 0.0]
  - - [6144, 1536, 1, 256]
    - [428, 0.0]
  - - [6144, 1536, 1, 1024]
    - [428, 0.0]
  - - [6144, 1536, 1, 4096]
    - [426, 0.0]
  - - [8192, 1536, 1, 256]
    - [434, 0.0]
  - - [8192, 1536, 1, 1024]
    - [435, 0.0]
  - - [8192, 1536, 1, 4096]
    - [428, 0.0]
  - - [12288, 1536, 1, 1024]
    - [436, 0.0]
  - - [16384, 1536, 1, 1024]
    - [437, 0.0]
  - - [16, 2048, 1, 1024]
    - [438, 0.0]
  - - [16, 2048, 1, 4096]
    - [439, 0.0]
  - - [16, 2048, 1, 16384]
    - [440, 0.0]
  - - [16, 3072, 1, 1024]
    - [441, 0.0]
  - - [16, 3072, 1, 4096]
    - [442, 0.0]
  - - [16, 3072, 1, 16384]
    - [443, 0.0]
  - - [16, 4096, 1, 1024]
    - [444, 0.0]
  - - [16, 4096, 1, 4096]
    - [439, 0.0]
  - - [16, 4096, 1, 16384]
    - [445, 0.0]
  - - [32, 2048, 1, 1024]
    - [446, 0.0]
  - - [32, 2048, 1, 4096]
    - [447, 0.0]
  - - [32, 2048, 1, 16384]
    - [448, 0.0]
  - - [32, 3072, 1, 1024]
    - [449, 0.0]
  - - [32, 3072, 1, 4096]
    - [450, 0.0]
  - - [32, 3072, 1, 16384]
    - [451, 0.0]
  - - [32, 4096, 1, 1024]
    - [452, 0.0]
  - - [32, 4096, 1, 4096]
    - [453, 0.0]
  - - [32, 4096, 1, 16384]
    - [454, 0.0]
  - - [64, 2048, 1, 1024]
    - [455, 0.0]
  - - [64, 2048, 1, 4096]
    - [456, 0.0]
  - - [64, 2048, 1, 16384]
    - [457, 0.0]
  - - [64, 3072, 1, 1024]
    - [458, 0.0]
  - - [64, 3072, 1, 4096]
    - [456, 0.0]
  - - [64, 3072, 1, 16384]
    - [459, 0.0]
  - - [64, 4096, 1, 1024]
    - [460, 0.0]
  - - [64, 4096, 1, 4096]
    - [461, 0.0]
  - - [64, 4096, 1, 16384]
    - [462, 0.0]
  - - [128, 2048, 1, 1024]
    - [463, 0.0]
  - - [128, 2048, 1, 4096]
    - [464, 0.0]
  - - [128, 2048, 1, 16384]
    - [465, 0.0]
  - - [128, 3072, 1, 1024]
    - [466, 0.0]
  - - [128, 3072, 1, 4096]
    - [467, 0.0]
  - - [128, 3072, 1, 16384]
    - [468, 0.0]
  - - [128, 4096, 1, 1024]
    - [469, 0.0]
  - - [128, 4096, 1, 4096]
    - [470, 0.0]
  - - [128, 4096, 1, 16384]
    - [471, 0.0]
  - - [256, 2048, 1, 1024]
    - [472, 0.0]
  - - [256, 2048, 1, 4096]
    - [473, 0.0]
  - - [256, 2048, 1, 16384]
    - [474, 0.0]
  - - [256, 3072, 1, 1024]
    - [475, 0.0]
  - - [256, 3072, 1, 4096]
    - [476, 0.0]
  - - [256, 3072, 1, 16384]
    - [477, 0.0]
  - - [256, 4096, 1, 256]
    - [478, 0.0]
  - - [256, 4096, 1, 1024]
    - [479, 0.0]
  - - [256, 4096, 1, 4096]
    - [480, 0.0]
  - - [512, 2048, 1, 256]
    - [481, 0.0]
  - - [512, 2048, 1, 1024]
    - [482, 0.0]
  - - [512, 2048, 1, 4096]
    - [483, 0.0]
  - - [512, 3072, 1, 256]
    - [484, 0.0]
  - - [512, 3072, 1, 1024]
    - [485, 0.0]
  - - [512, 3072, 1, 4096]
    - [486, 0.0]
  - - [512, 4096, 1, 256]
    - [487, 0.0]
  - - [512, 4096, 1, 1024]
    - [488, 0.0]
  - - [512, 4096, 1, 4096]
    - [489, 0.0]
  - - [768, 2048, 1, 256]
    - [490, 0.0]
  - - [768, 2048, 1, 1024]
    - [491, 0.0]
  - - [768, 2048, 1, 4096]
    - [492, 0.0]
  - - [1024, 2048, 1, 256]
    - [493, 0.0]
  - - [1024, 2048, 1, 1024]
    - [494, 0.0]
  - - [1024, 2048, 1, 4096]
    - [495, 0.0]
  - - [1536, 2048, 1, 256]
    - [496, 0.0]
  - - [1536, 2048, 1, 1024]
    - [497, 0.0]
  - - [1536, 2048, 1, 4096]
    - [498, 0.0]
  - - [768, 3072, 1, 256]
    - [499, 0.0]
  - - [768, 3072, 1, 1024]
    - [500, 0.0]
  - - [768, 3072, 1, 4096]
    - [500, 0.0]
  - - [1024, 3072, 1, 256]
    - [501, 0.0]
  - - [1024, 3072, 1, 1024]
    - [502, 0.0]
  - - [1024, 3072, 1, 4096]
    - [502, 0.0]
  - - [1536, 3072, 1, 256]
    - [503, 0.0]
  - - [1536, 3072, 1, 1024]
    - [492, 0.0]
  - - [1536, 3072, 1, 4096]
    - [418, 0.0]
  - - [768, 4096, 1, 256]
    - [504, 0.0]
  - - [768, 4096, 1, 1024]
    - [497, 0.0]
  - - [768, 4096, 1, 4096]
    - [502, 0.0]
  - - [1024, 4096, 1, 256]
    - [505, 0.0]
  - - [1024, 4096, 1, 1024]
    - [506, 0.0]
  - - [1024, 4096, 1, 4096]
    - [507, 0.0]
  - - [1536, 4096, 1, 256]
    - [508, 0.0]
  - - [1536, 4096, 1, 1024]
    - [497, 0.0]
  - - [1536, 4096, 1, 4096]
    - [502, 0.0]
  - - [2048, 2048, 1, 256]
    - [509, 0.0]
  - - [2048, 2048, 1, 1024]
    - [510, 0.0]
  - - [2048, 2048, 1, 4096]
    - [511, 0.0]
  - - [3072, 2048, 1, 256]
    - [512, 0.0]
  - - [3072, 2048, 1, 1024]
    - [513, 0.0]
  - - [3072, 2048, 1, 4096]
    - [513, 0.0]
  - - [4096, 2048, 1, 256]
    - [514, 0.0]
  - - [4096, 2048, 1, 1024]
    - [515, 0.0]
  - - [4096, 2048, 1, 4096]
    - [514, 0.0]
  - - [2048, 3072, 1, 256]
    - [512, 0.0]
  - - [2048, 3072, 1, 1024]
    - [515, 0.0]
  - - [2048, 3072, 1, 4096]
    - [516, 0.0]
  - - [3072, 3072, 1, 256]
    - [514, 0.0]
  - - [3072, 3072, 1, 1024]
    - [513, 0.0]
  - - [3072, 3072, 1, 4096]
    - [515, 0.0]
  - - [4096, 3072, 1, 256]
    - [517, 0.0]
  - - [4096, 3072, 1, 1024]
    - [518, 0.0]
  - - [4096, 3072, 1, 4096]
    - [513, 0.0]
  - - [2048, 4096, 1, 256]
    - [512, 0.0]
  - - [2048, 4096, 1, 1024]
    - [514, 0.0]
  - - [2048, 4096, 1, 4096]
    - [515, 0.0]
  - - [3072, 4096, 1, 256]
    - [514, 0.0]
  - - [3072, 4096, 1, 1024]
    - [515, 0.0]
  - - [3072, 4096, 1, 4096]
    - [513, 0.0]
  - - [4096, 4096, 1, 1024]
    - [519, 0.0]
  - - [6144, 2048, 1, 256]
    - [428, 0.0]
  - - [6144, 2048, 1, 1024]
    - [428, 0.0]
  - - [6144, 2048, 1, 4096]
    - [428, 0.0]
  - - [8192, 2048, 1, 1024]
    - [437, 0.0]
  - - [12288, 2048, 1, 1024]
    - [430, 0.0]
  - - [16384, 2048, 1, 1024]
    - [430, 0.0]
  - - [6144, 3072, 1, 1024]
    - [426, 0.0]
  - - [8192, 3072, 1, 1024]
    - [520, 0.0]
  - - [12288, 3072, 1, 1024]
    - [428, 0.0]
  - - [16384, 3072, 1, 1024]
    - [430, 0.0]
  - - [6144, 4096, 1, 1024]
    - [437, 0.0]
  - - [8192, 4096, 1, 1024]
    - [520, 0.0]
  - - [12288, 4096, 1, 1024]
    - [521, 0.0]
  - - [16384, 4096, 1, 1024]
    - [522, 0.0]
  - - [16, 6144, 1, 1024]
    - [523, 0.0]
  - - [16, 6144, 1, 4096]
    - [524, 0.0]
  - - [16, 6144, 1, 16384]
    - [525, 0.0]
  - - [16, 8192, 1, 1024]
    - [526, 0.0]
  - - [16, 8192, 1, 4096]
    - [527, 0.0]
  - - [16, 8192, 1, 16384]
    - [528, 0.0]
  - - [16, 12288, 1, 1024]
    - [526, 0.0]
  - - [16, 12288, 1, 4096]
    - [529, 0.0]
  - - [16, 12288, 1, 16384]
    - [530, 0.0]
  - - [32, 6144, 1, 1024]
    - [531, 0.0]
  - - [32, 6144, 1, 4096]
    - [532, 0.0]
  - - [32, 6144, 1, 16384]
    - [533, 0.0]
  - - [32, 8192, 1, 1024]
    - [534, 0.0]
  - - [32, 8192, 1, 4096]
    - [535, 0.0]
  - - [32, 8192, 1, 16384]
    - [536, 0.0]
  - - [32, 12288, 1, 1024]
    - [537, 0.0]
  - - [32, 12288, 1, 4096]
    - [538, 0.0]
  - - [32, 12288, 1, 16384]
    - [539, 0.0]
  - - [64, 6144, 1, 1024]
    - [540, 0.0]
  - - [64, 6144, 1, 4096]
    - [541, 0.0]
  - - [64, 6144, 1, 16384]
    - [542, 0.0]
  - - [64, 8192, 1, 1024]
    - [543, 0.0]
  - - [64, 8192, 1, 4096]
    - [544, 0.0]
  - - [64, 8192, 1, 16384]
    - [544, 0.0]
  - - [64, 12288, 1, 1024]
    - [545, 0.0]
  - - [64, 12288, 1, 4096]
    - [546, 0.0]
  - - [64, 12288, 1, 16384]
    - [546, 0.0]
  - - [128, 6144, 1, 1024]
    - [547, 0.0]
  - - [128, 6144, 1, 4096]
    - [548, 0.0]
  - - [128, 6144, 1, 16384]
    - [549, 0.0]
  - - [128, 8192, 1, 256]
    - [550, 0.0]
  - - [128, 8192, 1, 1024]
    - [551, 0.0]
  - - [128, 8192, 1, 4096]
    - [552, 0.0]
  - - [128, 12288, 1, 256]
    - [553, 0.0]
  - - [128, 12288, 1, 1024]
    - [554, 0.0]
  - - [128, 12288, 1, 4096]
    - [555, 0.0]
  - - [256, 6144, 1, 256]
    - [556, 0.0]
  - - [256, 6144, 1, 1024]
    - [557, 0.0]
  - - [256, 6144, 1, 4096]
    - [558, 0.0]
  - - [256, 8192, 1, 256]
    - [559, 0.0]
  - - [256, 8192, 1, 1024]
    - [479, 0.0]
  - - [256, 8192, 1, 4096]
    - [560, 0.0]
  - - [256, 12288, 1, 256]
    - [561, 0.0]
  - - [256, 12288, 1, 1024]
    - [562, 0.0]
  - - [256, 12288, 1, 4096]
    - [562, 0.0]
  - - [512, 6144, 1, 256]
    - [563, 0.0]
  - - [512, 6144, 1, 1024]
    - [564, 0.0]
  - - [512, 6144, 1, 4096]
    - [565, 0.0]
  - - [512, 8192, 1, 256]
    - [566, 0.0]
  - - [512, 8192, 1, 1024]
    - [567, 0.0]
  - - [512, 8192, 1, 4096]
    - [568, 0.0]
  - - [512, 12288, 1, 256]
    - [569, 0.0]
  - - [512, 12288, 1, 1024]
    - [570, 0.0]
  - - [512, 12288, 1, 4096]
    - [571, 0.0]
  - - [768, 6144, 1, 256]
    - [572, 0.0]
  - - [768, 6144, 1, 1024]
    - [573, 0.0]
  - - [768, 6144, 1, 4096]
    - [574, 0.0]
  - - [1024, 6144, 1, 256]
    - [575, 0.0]
  - - [1024, 6144, 1, 1024]
    - [576, 0.0]
  - - [1024, 6144, 1, 4096]
    - [577, 0.0]
  - - [1536, 6144, 1, 256]
    - [578, 0.0]
  - - [1536, 6144, 1, 1024]
    - [576, 0.0]
  - - [1536, 6144, 1, 4096]
    - [577, 0.0]
  - - [768, 8192, 1, 256]
    - [579, 0.0]
  - - [768, 8192, 1, 1024]
    - [580, 0.0]
  - - [768, 8192, 1, 4096]
    - [577, 0.0]
  - - [1024, 8192, 1, 256]
    - [577, 0.0]
  - - [1024, 8192, 1, 1024]
    - [578, 0.0]
  - - [1024, 8192, 1, 4096]
    - [577, 0.0]
  - - [1536, 8192, 1, 256]
    - [577, 0.0]
  - - [1536, 8192, 1, 1024]
    - [577, 0.0]
  - - [1536, 8192, 1, 4096]
    - [577, 0.0]
  - - [768, 12288, 1, 256]
    - [580, 0.0]
  - - [768, 12288, 1, 1024]
    - [578, 0.0]
  - - [768, 12288, 1, 4096]
    - [578, 0.0]
  - - [1024, 12288, 1, 256]
    - [576, 0.0]
  - - [1024, 12288, 1, 1024]
    - [578, 0.0]
  - - [1024, 12288, 1, 4096]
    - [578, 0.0]
  - - [1536, 12288, 1, 1024]
    - [578, 0.0]
  - - [2048, 6144, 1, 256]
    - [577, 0.0]
  - - [2048, 6144, 1, 1024]
    - [578, 0.0]
  - - [2048, 6144, 1, 4096]
    - [577, 0.0]
  - - [3072, 6144, 1, 1024]
    - [578, 0.0]
  - - [4096, 6144, 1, 1024]
    - [581, 0.0]
  - - [2048, 8192, 1, 1024]
    - [582, 0.0]
  - - [3072, 8192, 1, 1024]
    - [578, 0.0]
  - - [4096, 8192, 1, 1024]
    - [583, 0.0]
  - - [2048, 12288, 1, 1024]
    - [574, 0.0]
  - - [3072, 12288, 1, 1024]
    - [584, 0.0]
  - - [4096, 12288, 1, 1024]
    - [581, 0.0]
  - - [6144, 6144, 1, 1024]
    - [585, 0.0]
  - - [8192, 6144, 1, 1024]
    - [573, 0.0]
  - - [6144, 8192, 1, 1024]
    - [574, 0.0]
  - - [8192, 8192, 1, 1024]
    - [586, 0.0]
  - - [16, 16384, 1, 1024]
    - [587, 0.0]
  - - [16, 16384, 1, 4096]
    - [588, 0.0]
  - - [16, 16384, 1, 16384]
    - [588, 0.0]
  - - [32, 16384, 1, 1024]
    - [589, 0.0]
  - - [32, 16384, 1, 4096]
    - [590, 0.0]
  - - [32, 16384, 1, 16384]
    - [591, 0.0]
  - - [64, 16384, 1, 256]
    - [592, 0.0]
  - - [64, 16384, 1, 1024]
    - [593, 0.0]
  - - [64, 16384, 1, 4096]
    - [594, 0.0]
  - - [128, 16384, 1, 256]
    - [595, 0.0]
  - - [128, 16384, 1, 1024]
    - [596, 0.0]
  - - [128, 16384, 1, 4096]
    - [597, 0.0]
  - - [256, 16384, 1, 256]
    - [598, 0.0]
  - - [256, 16384, 1, 1024]
    - [599, 0.0]
  - - [256, 16384, 1, 4096]
    - [600, 0.0]
  - - [512, 16384, 1, 256]
    - [573, 0.0]
  - - [512, 16384, 1, 1024]
    - [572, 0.0]
  - - [512, 16384, 1, 4096]
    - [574, 0.0]
  - - [768, 16384, 1, 256]
    - [601, 0.0]
  - - [768, 16384, 1, 1024]
    - [578, 0.0]
  - - [768, 16384, 1, 4096]
    - [578, 0.0]
  - - [1024, 16384, 1, 1024]
    - [574, 0.0]
  - - [1536, 16384, 1, 1024]
    - [581, 0.0]
  - - [2048, 16384, 1, 1024]
    - [583, 0.0]
  - - [3072, 16384, 1, 1024]
    - [581, 0.0]
  - - [4096, 16384, 1, 1024]
    - [582, 0.0]
- null
- null
- DeviceEfficiency
- GridBased
