projects/hipblaslt/library/src/amd_detail/rocblaslt/src/Tensile/Logic/asm_full/aquavanjaram/gfx942/GridBased/aquavanjaram_Cijk_Alik_Bjlk_S_MX_B_Bias_HAS_SAV_UserArgs.yaml
- {MinimumRequiredVersion: 4.33.0}
- aquavanjaram
- gfx942
- [Device 0049, Device 0050]
    SolutionIndex: 0
    SolutionNameMin: Cijk_Alik_Bjlk_S_MX_B_Bias_HAS_SAV_UserArgs_MT16x16x16_MI16x16x1_SN_LDSB0_CLR1_GSU1_GSUC0_GSUWGMRR0_K1_LBSPPA128_LBSPPB128_LPA2_LRVW2_LSU1_MIWT1_1_NLCA1_PLR1_SU0_SUM0_SUS0_WG16_4_1_WGM8_WGMXCC1_WGMXCCGn1
    SolutionIndex: 1
    SolutionNameMin: Cijk_Alik_Bjlk_S_MX_B_Bias_HAS_SAV_UserArgs_MT16x16x16_MI16x16x1_SN_LDSB0_CLR0_GSU1_GSUC0_GSUWGMRR0_K1_LBSPPA128_LBSPPB128_LPA2_LRVW2_LSU2_MIWT1_1_NLCA1_PLR0_SU0_SUM0_SUS0_WG16_4_2_WGM8_WGMXCC1_WGMXCCGn1
    SolutionIndex: 2
    SolutionNameMin: Cijk_Alik_Bjlk_S_MX_B_Bias_HAS_SAV_UserArgs_MT32x16x16_MI16x16x1_SN_LDSB0_CLR1_GSU1_GSUC0_GSUWGMRR0_K1_LBSPPA128_LBSPPB128_LPA2_LRVW2_LSU1_MIWT1_1_NLCA1_PLR1_SU0_SUM0_SUS0_WG32_4_1_WGM8_WGMXCC1_WGMXCCGn1
    SolutionIndex: 3
    SolutionNameMin: Cijk_Alik_Bjlk_S_MX_B_Bias_HAS_SAV_UserArgs_MT32x16x16_MI16x16x1_SN_LDSB0_CLR0_GSU1_GSUC0_GSUWGMRR0_K1_LBSPPA128_LBSPPB128_LPA2_LRVW2_LSU2_MIWT1_1_NLCA1_PLR0_SU0_SUM0_SUS0_WG32_4_2_WGM8_WGMXCC1_WGMXCCGn1
    SolutionIndex: 4
    SolutionNameMin: Cijk_Alik_Bjlk_S_MX_B_Bias_HAS_SAV_UserArgs_MT64x16x16_MI16x16x1_SN_LDSB0_CLR1_GSU1_GSUC0_GSUWGMRR0_K1_LBSPPA128_LBSPPB128_LPA2_LRVW2_LSU1_MIWT1_1_NLCA1_PLR1_SU0_SUM0_SUS0_WG64_4_1_WGM8_WGMXCC1_WGMXCCGn1
    SolutionIndex: 5
    SolutionNameMin: Cijk_Alik_Bjlk_S_MX_B_Bias_HAS_SAV_UserArgs_MT64x16x16_MI16x16x1_SN_LDSB0_CLR1_GSU1_GSUC0_GSUWGMRR0_K1_LBSPPA128_LBSPPB128_LPA2_LRVW2_LSU1_MIWT2_1_NLCA1_PLR1_SU0_SUM0_SUS0_WG32_4_1_WGM8_WGMXCC1_WGMXCCGn1
    SolutionIndex: 6
    SolutionNameMin: Cijk_Alik_Bjlk_S_MX_B_Bias_HAS_SAV_UserArgs_MT128x16x16_MI16x16x1_SN_LDSB0_CLR1_GSU1_GSUC0_GSUWGMRR0_K1_LBSPPA128_LBSPPB128_LPA2_LRVW2_LSU1_MIWT2_1_NLCA1_PLR1_SU0_SUM0_SUS0_WG64_4_1_WGM8_WGMXCC1_WGMXCCGn1
    SolutionIndex: 7
    SolutionNameMin: Cijk_Alik_Bjlk_S_MX_B_Bias_HAS_SAV_UserArgs_MT256x16x16_MI16x16x1_SN_LDSB1_CLR1_GSU1_GSUC0_GSUWGMRR0_K1_LBSPPA128_LBSPPB128_LPA2_LRVW2_LSU1_MIWT4_1_NLCA1_PLR1_SU0_SUM0_SUS0_WG64_4_1_WGM8_WGMXCC1_WGMXCCGn1
    SolutionIndex: 8
    SolutionNameMin: Cijk_Alik_Bjlk_S_MX_B_Bias_HAS_SAV_UserArgs_MT256x16x16_MI16x16x1_SN_LDSB1_CLR0_GSU1_GSUC0_GSUWGMRR0_K1_LBSPPA128_LBSPPB128_LPA2_LRVW2_LSU2_MIWT8_1_NLCA1_PLR0_SU0_SUM0_SUS0_WG32_4_2_WGM8_WGMXCC1_WGMXCCGn1
    SolutionIndex: 9
    SolutionNameMin: Cijk_Alik_Bjlk_S_MX_B_Bias_HAS_SAV_UserArgs_MT32x16x32_MI16x16x1_SN_LDSB0_CLR1_GSU1_GSUC0_GSUWGMRR0_K1_LBSPPA128_LBSPPB256_LPA8_LRVW4_LSU1_MIWT1_1_NLCA1_PLR1_SU0_SUM0_SUS0_WG32_4_1_WGM8_WGMXCC1_WGMXCCGn1
    SolutionIndex: 10
    SolutionNameMin: Cijk_Alik_Bjlk_S_MX_B_Bias_HAS_SAV_UserArgs_MT64x16x32_MI16x16x1_SN_LDSB0_CLR1_GSU1_GSUC0_GSUWGMRR0_K1_LBSPPA128_LBSPPB256_LPA8_LRVW4_LSU1_MIWT1_1_NLCA1_PLR1_SU0_SUM0_SUS0_WG64_4_1_WGM8_WGMXCC1_WGMXCCGn1
    SolutionIndex: 11
    SolutionNameMin: Cijk_Alik_Bjlk_S_MX_B_Bias_HAS_SAV_UserArgs_MT128x16x32_MI16x16x1_SN_LDSB1_CLR1_GSU1_GSUC0_GSUWGMRR0_K1_LBSPPA128_LBSPPB256_LPA8_LRVW4_LSU1_MIWT2_1_NLCA1_PLR1_SU0_SUM0_SUS0_WG64_4_1_WGM8_WGMXCC1_WGMXCCGn1
    SolutionIndex: 12
    SolutionNameMin: Cijk_Alik_Bjlk_S_MX_B_Bias_HAS_SAV_UserArgs_MT128x16x32_MI16x16x1_SN_LDSB1_CLR1_GSU1_GSUC0_GSUWGMRR0_K1_LBSPPA128_LBSPPB256_LPA8_LRVW4_LSU2_MIWT2_1_NLCA1_PLR1_SU0_SUM0_SUS0_WG64_4_2_WGM8_WGMXCC1_WGMXCCGn1
    SolutionIndex: 13
    SolutionNameMin: Cijk_Alik_Bjlk_S_MX_B_Bias_HAS_SAV_UserArgs_MT256x16x32_MI16x16x1_SN_LDSB1_CLR1_GSU1_GSUC0_GSUWGMRR0_K1_LBSPPA128_LBSPPB256_LPA8_LRVW4_LSU2_MIWT4_1_NLCA1_PLR1_SU0_SUM0_SUS0_WG64_4_2_WGM8_WGMXCC1_WGMXCCGn1
    SolutionIndex: 14
    SolutionNameMin: Cijk_Alik_Bjlk_S_MX_B_Bias_HAS_SAV_UserArgs_MT16x16x64_MI16x16x1_SN_LDSB0_CLR1_GSU1_GSUC0_GSUWGMRR0_K1_LBSPPA256_LBSPPB256_LPA8_LRVW4_LSU4_MIWT1_1_NLCA1_PLR1_SU0_SUM0_SUS0_WG16_4_4_WGM8_WGMXCC1_WGMXCCGn1
    SolutionIndex: 15
    SolutionNameMin: Cijk_Alik_Bjlk_S_MX_B_Bias_HAS_SAV_UserArgs_MT32x16x64_MI16x16x1_SN_LDSB0_CLR1_GSU1_GSUC0_GSUWGMRR0_K1_LBSPPA256_LBSPPB256_LPA8_LRVW4_LSU2_MIWT1_1_NLCA1_PLR1_SU0_SUM0_SUS0_WG32_4_2_WGM8_WGMXCC1_WGMXCCGn1
    SolutionIndex: 16
    SolutionNameMin: Cijk_Alik_Bjlk_S_MX_B_Bias_HAS_SAV_UserArgs_MT64x16x64_MI16x16x1_SN_LDSB1_CLR1_GSU1_GSUC0_GSUWGMRR0_K1_LBSPPA256_LBSPPB256_LPA8_LRVW4_LSU1_MIWT1_1_NLCA1_PLR1_SU0_SUM0_SUS0_WG64_4_1_WGM8_WGMXCC1_WGMXCCGn1
    SolutionIndex: 17
    SolutionNameMin: Cijk_Alik_Bjlk_S_MX_B_Bias_HAS_SAV_UserArgs_MT16x16x128_MI16x16x1_SN_LDSB1_CLR1_GSU1_GSUC0_GSUWGMRR0_K1_LBSPPA512_LBSPPB256_LPA8_LRVW4_LSU4_MIWT1_1_NLCA1_PLR1_SU0_SUM0_SUS0_WG16_4_4_WGM8_WGMXCC1_WGMXCCGn1
    SolutionIndex: 18
    SolutionNameMin: Cijk_Alik_Bjlk_S_MX_B_Bias_HAS_SAV_UserArgs_MT32x16x128_MI16x16x1_SN_LDSB1_CLR1_GSU1_GSUC0_GSUWGMRR0_K1_LBSPPA512_LBSPPB256_LPA8_LRVW4_LSU4_MIWT1_1_NLCA1_PLR1_SU0_SUM0_SUS0_WG32_4_4_WGM8_WGMXCC1_WGMXCCGn1
    SolutionIndex: 19
    SolutionNameMin: Cijk_Alik_Bjlk_S_MX_B_Bias_HAS_SAV_UserArgs_MT16x16x256_MI16x16x1_SN_LDSB1_CLR1_GSU1_GSUC0_GSUWGMRR0_K1_LBSPPA1024_LBSPPB256_LPA8_LRVW4_LSU4_MIWT1_1_NLCA1_PLR1_SU0_SUM0_SUS0_WG16_4_4_WGM8_WGMXCC1_WGMXCCGn1
    SolutionIndex: 20
    SolutionNameMin: Cijk_Alik_Bjlk_S_MX_B_Bias_HAS_SAV_UserArgs_MT16x16x16_MI16x16x1_SN_LDSB0_CLR0_GSU1_GSUC0_GSUWGMRR0_K1_LBSPPA128_LBSPPB128_LPA2_LRVW2_LSU2_MIWT1_1_NLCA1_NLCB1_PLR0_SU0_SUM0_SUS0_WG16_4_2_WGM8_WGMXCC1_WGMXCCGn1
    SolutionIndex: 21
    SolutionNameMin: Cijk_Alik_Bjlk_S_MX_B_Bias_HAS_SAV_UserArgs_MT16x32x16_MI16x16x1_SN_LDSB0_CLR1_GSU1_GSUC0_GSUWGMRR0_K1_LBSPPA128_LBSPPB256_LPA2_LRVW2_LSU1_MIWT1_1_NLCA1_NLCB1_PLR1_SU0_SUM0_SUS0_WG16_8_1_WGM8_WGMXCC1_WGMXCCGn1
    SolutionIndex: 22
    SolutionNameMin: Cijk_Alik_Bjlk_S_MX_B_Bias_HAS_SAV_UserArgs_MT16x16x16_MI16x16x1_SN_LDSB0_CLR1_GSU1_GSUC0_GSUWGMRR0_K1_LBSPPA128_LBSPPB128_LPA2_LRVW2_LSU1_MIWT1_1_NLCA1_NLCB1_PLR1_SU0_SUM0_SUS0_WG16_4_1_WGM8_WGMXCC1_WGMXCCGn1
    SolutionIndex: 23
    SolutionNameMin: Cijk_Alik_Bjlk_S_MX_B_Bias_HAS_SAV_UserArgs_MT16x64x16_MI16x16x1_SN_LDSB0_CLR1_GSU1_GSUC0_GSUWGMRR0_K1_LBSPPA128_LBSPPB512_LPA2_LRVW2_LSU1_MIWT1_1_NLCA1_NLCB1_PLR1_SU0_SUM0_SUS0_WG16_16_1_WGM8_WGMXCC1_WGMXCCGn1
    SolutionIndex: 24
    SolutionNameMin: Cijk_Alik_Bjlk_S_MX_B_Bias_HAS_SAV_UserArgs_MT16x64x16_MI16x16x1_SN_LDSB0_CLR1_GSU1_GSUC0_GSUWGMRR0_K1_LBSPPA128_LBSPPB512_LPA2_LRVW2_LSU1_MIWT1_2_NLCA1_NLCB1_PLR1_SU0_SUM0_SUS0_WG16_8_1_WGM8_WGMXCC1_WGMXCCGn1
    SolutionIndex: 25
    SolutionNameMin: Cijk_Alik_Bjlk_S_MX_B_Bias_HAS_SAV_UserArgs_MT16x128x16_MI16x16x1_SN_LDSB0_CLR1_GSU1_GSUC0_GSUWGMRR0_K1_LBSPPA128_LBSPPB1024_LPA2_LRVW2_LSU1_MIWT1_2_NLCA1_NLCB1_PLR1_SU0_SUM0_SUS0_WG16_16_1_WGM8_WGMXCC1_WGMXCCGn1
    SolutionIndex: 26
    SolutionNameMin: Cijk_Alik_Bjlk_S_MX_B_Bias_HAS_SAV_UserArgs_MT16x256x16_MI16x16x1_SN_LDSB1_CLR1_GSU1_GSUC0_GSUWGMRR0_K1_LBSPPA128_LBSPPB2048_LPA2_LRVW2_LSU1_MIWT1_4_NLCA1_NLCB1_PLR1_SU0_SUM0_SUS0_WG16_16_1_WGM8_WGMXCC1_WGMXCCGn1
    SolutionIndex: 27
    SolutionNameMin: Cijk_Alik_Bjlk_S_MX_B_Bias_HAS_SAV_UserArgs_MT16x128x32_MI16x16x1_SN_LDSB1_CLR1_GSU1_GSUC0_GSUWGMRR0_K1_LBSPPA128_LBSPPB2048_LPA8_LRVW4_LSU1_MIWT1_2_NLCA1_NLCB1_PLR1_SU0_SUM0_SUS0_WG16_16_1_WGM8_WGMXCC1_WGMXCCGn1
    SolutionIndex: 28
    SolutionNameMin: Cijk_Alik_Bjlk_S_MX_B_Bias_HAS_SAV_UserArgs_MT16x16x64_MI16x16x1_SN_LDSB0_CLR1_GSU1_GSUC0_GSUWGMRR0_K1_LBSPPA256_LBSPPB256_LPA8_LRVW4_LSU4_MIWT1_1_NLCA1_NLCB1_PLR1_SU0_SUM0_SUS0_WG16_4_4_WGM8_WGMXCC1_WGMXCCGn1
    SolutionIndex: 29
    SolutionNameMin: Cijk_Alik_Bjlk_S_MX_B_Bias_HAS_SAV_UserArgs_MT16x16x128_MI16x16x1_SN_LDSB1_CLR1_GSU1_GSUC0_GSUWGMRR0_K1_LBSPPA512_LBSPPB256_LPA8_LRVW4_LSU4_MIWT1_1_NLCA1_NLCB1_PLR1_SU0_SUM0_SUS0_WG16_4_4_WGM8_WGMXCC1_WGMXCCGn1
    SolutionIndex: 30
    SolutionNameMin: Cijk_Alik_Bjlk_S_MX_B_Bias_HAS_SAV_UserArgs_MT16x32x64_MI16x16x1_SN_LDSB0_CLR1_GSU1_GSUC0_GSUWGMRR0_K1_LBSPPA256_LBSPPB512_LPA8_LRVW4_LSU4_MIWT1_1_NLCA1_NLCB1_PLR1_SU0_SUM0_SUS0_WG16_8_4_WGM8_WGMXCC1_WGMXCCGn1
    SolutionIndex: 31
    SolutionNameMin: Cijk_Alik_Bjlk_S_MX_B_Bias_HAS_SAV_UserArgs_MT16x64x32_MI16x16x1_SN_LDSB0_CLR1_GSU1_GSUC0_GSUWGMRR0_K1_LBSPPA128_LBSPPB1024_LPA8_LRVW4_LSU1_MIWT1_1_NLCA1_NLCB1_PLR1_SU0_SUM0_SUS0_WG16_16_1_WGM8_WGMXCC1_WGMXCCGn1
    SolutionIndex: 32
    SolutionNameMin: Cijk_Alik_Bjlk_S_MX_B_Bias_HAS_SAV_UserArgs_MT16x32x32_MI16x16x1_SN_LDSB0_CLR1_GSU1_GSUC0_GSUWGMRR0_K1_LBSPPA128_LBSPPB512_LPA8_LRVW4_LSU1_MIWT1_1_NLCA1_NLCB1_PLR1_SU0_SUM0_SUS0_WG16_8_1_WGM8_WGMXCC1_WGMXCCGn1
    SolutionIndex: 33
    SolutionNameMin: Cijk_Alik_Bjlk_S_MX_B_Bias_HAS_SAV_UserArgs_MT16x64x64_MI16x16x1_SN_LDSB1_CLR1_GSU1_GSUC0_GSUWGMRR0_K1_LBSPPA256_LBSPPB1024_LPA8_LRVW4_LSU1_MIWT1_1_NLCA1_NLCB1_PLR1_SU0_SUM0_SUS0_WG16_16_1_WGM8_WGMXCC1_WGMXCCGn1
    SolutionIndex: 34
    SolutionNameMin: Cijk_Alik_Bjlk_S_MX_B_Bias_HAS_SAV_UserArgs_MT16x32x64_MI16x16x1_SN_LDSB0_CLR1_GSU1_GSUC0_GSUWGMRR0_K1_LBSPPA256_LBSPPB512_LPA8_LRVW4_LSU2_MIWT1_1_NLCA1_NLCB1_PLR1_SU0_SUM0_SUS0_WG16_8_2_WGM8_WGMXCC1_WGMXCCGn1
    SolutionIndex: 35
    SolutionNameMin: Cijk_Alik_Bjlk_S_MX_B_Bias_HAS_SAV_UserArgs_MT16x128x32_MI16x16x1_SN_LDSB1_CLR1_GSU1_GSUC0_GSUWGMRR0_K1_LBSPPA128_LBSPPB2048_LPA8_LRVW4_LSU2_MIWT1_2_NLCA1_NLCB1_PLR1_SU0_SUM0_SUS0_WG16_16_2_WGM8_WGMXCC1_WGMXCCGn1
    SolutionIndex: 36
    SolutionNameMin: Cijk_Alik_Bjlk_S_MX_B_Bias_HAS_SAV_UserArgs_MT16x32x64_MI16x16x1_SN_LDSB0_CLR1_GSU1_GSUC0_GSUWGMRR0_K1_LBSPPA256_LBSPPB512_LPA8_LRVW4_LSU1_MIWT1_1_NLCA1_NLCB1_PLR1_SU0_SUM0_SUS0_WG16_8_1_WGM8_WGMXCC1_WGMXCCGn1
    SolutionIndex: 37
    SolutionNameMin: Cijk_Alik_Bjlk_S_MX_B_Bias_HAS_SAV_UserArgs_MT16x16x32_MI16x16x1_SN_LDSB0_CLR1_GSU1_GSUC0_GSUWGMRR0_K1_LBSPPA128_LBSPPB256_LPA8_LRVW4_LSU2_MIWT1_1_NLCA1_NLCB1_PLR1_SU0_SUM0_SUS0_WG16_4_2_WGM8_WGMXCC1_WGMXCCGn1
    SolutionIndex: 38
    SolutionNameMin: Cijk_Alik_Bjlk_S_MX_B_Bias_HAS_SAV_UserArgs_MT16x128x32_MI16x16x1_SN_LDSB1_CLR1_GSU1_GSUC0_GSUWGMRR0_K1_LBSPPA128_LBSPPB2048_LPA8_LRVW4_LSU1_MIWT1_4_NLCA1_NLCB1_PLR1_SU0_SUM0_SUS0_WG16_8_1_WGM8_WGMXCC1_WGMXCCGn1
    SolutionIndex: 39
    SolutionNameMin: Cijk_Alik_Bjlk_S_MX_B_Bias_HAS_SAV_UserArgs_MT16x64x16_MI16x16x1_SN_LDSB0_CLR0_GSU1_GSUC0_GSUWGMRR0_K1_LBSPPA128_LBSPPB512_LPA2_LRVW2_LSU2_MIWT1_2_NLCA1_NLCB1_PLR0_SU0_SUM0_SUS0_WG16_8_2_WGM8_WGMXCC1_WGMXCCGn1
    SolutionIndex: 40
    SolutionNameMin: Cijk_Alik_Bjlk_S_MX_B_Bias_HAS_SAV_UserArgs_MT16x32x128_MI16x16x1_SN_LDSB1_CLR1_GSU1_GSUC0_GSUWGMRR0_K1_LBSPPA512_LBSPPB512_LPA8_LRVW4_LSU2_MIWT1_1_NLCA1_NLCB1_PLR1_SU0_SUM0_SUS0_WG16_8_2_WGM8_WGMXCC1_WGMXCCGn1
    SolutionIndex: 41
    SolutionNameMin: Cijk_Alik_Bjlk_S_MX_B_Bias_HAS_SAV_UserArgs_MT16x128x64_MI16x16x1_SN_LDSB1_CLR1_GSU1_GSUC0_GSUWGMRR0_K1_LBSPPA256_LBSPPB2048_LPA8_LRVW4_LSU2_MIWT1_2_NLCA1_NLCB1_PLR1_SU0_SUM0_SUS0_WG16_16_2_WGM8_WGMXCC1_WGMXCCGn1
    SolutionIndex: 42
    SolutionNameMin: Cijk_Alik_Bjlk_S_MX_B_Bias_HAS_SAV_UserArgs_MT16x256x32_MI16x16x1_SN_LDSB1_CLR1_GSU1_GSUC0_GSUWGMRR0_K1_LBSPPA128_LBSPPB4096_LPA8_LRVW4_LSU2_MIWT1_4_NLCA1_NLCB1_PLR1_SU0_SUM0_SUS0_WG16_16_2_WGM8_WGMXCC1_WGMXCCGn1
    SolutionIndex: 43
    SolutionNameMin: Cijk_Alik_Bjlk_S_MX_B_Bias_HAS_SAV_UserArgs_MT16x16x32_MI16x16x1_SN_LDSB0_CLR1_GSU1_GSUC0_GSUWGMRR0_K1_LBSPPA128_LBSPPB256_LPA8_LRVW4_LSU1_MIWT1_1_NLCA1_NLCB1_PLR1_SU0_SUM0_SUS0_WG16_4_1_WGM8_WGMXCC1_WGMXCCGn1
- - - [16, 16, 2, 16]
    - [20, 0.0]
  - - [32, 16, 2, 16]
    - [1, 0.0]
  - - [48, 16, 2, 16]
    - [0, 0.0]
  - - [64, 16, 2, 16]
    - [2, 0.0]
  - - [80, 16, 2, 16]
    - [3, 0.0]
  - - [96, 16, 2, 16]
    - [2, 0.0]
  - - [112, 16, 2, 16]
    - [0, 0.0]
  - - [128, 16, 2, 16]
    - [4, 0.0]
  - - [144, 16, 2, 16]
    - [0, 0.0]
  - - [160, 16, 2, 16]
    - [0, 0.0]
  - - [176, 16, 2, 16]
    - [0, 0.0]
  - - [192, 16, 2, 16]
    - [0, 0.0]
  - - [208, 16, 2, 16]
    - [0, 0.0]
  - - [224, 16, 2, 16]
    - [0, 0.0]
  - - [240, 16, 2, 16]
    - [0, 0.0]
  - - [256, 16, 2, 16]
    - [0, 0.0]
  - - [16, 16, 130, 16]
    - [22, 0.0]
  - - [32, 16, 130, 16]
    - [2, 0.0]
  - - [48, 16, 130, 16]
    - [0, 0.0]
  - - [64, 16, 130, 16]
    - [0, 0.0]
  - - [80, 16, 130, 16]
    - [0, 0.0]
  - - [96, 16, 130, 16]
    - [4, 0.0]
  - - [112, 16, 130, 16]
    - [4, 0.0]
  - - [128, 16, 130, 16]
    - [4, 0.0]
  - - [144, 16, 130, 16]
    - [0, 0.0]
  - - [160, 16, 130, 16]
    - [2, 0.0]
  - - [176, 16, 130, 16]
    - [4, 0.0]
  - - [192, 16, 130, 16]
    - [4, 0.0]
  - - [208, 16, 130, 16]
    - [4, 0.0]
  - - [224, 16, 130, 16]
    - [4, 0.0]
  - - [240, 16, 130, 16]
    - [4, 0.0]
  - - [256, 16, 130, 16]
    - [4, 0.0]
  - - [16, 16, 258, 16]
    - [22, 0.0]
  - - [32, 16, 258, 16]
    - [2, 0.0]
  - - [48, 16, 258, 16]
    - [4, 0.0]
  - - [64, 16, 258, 16]
    - [4, 0.0]
  - - [80, 16, 258, 16]
    - [4, 0.0]
  - - [96, 16, 258, 16]
    - [2, 0.0]
  - - [112, 16, 258, 16]
    - [4, 0.0]
  - - [128, 16, 258, 16]
    - [4, 0.0]
  - - [144, 16, 258, 16]
    - [6, 0.0]
  - - [160, 16, 258, 16]
    - [5, 0.0]
  - - [176, 16, 258, 16]
    - [6, 0.0]
  - - [192, 16, 258, 16]
    - [5, 0.0]
  - - [208, 16, 258, 16]
    - [6, 0.0]
  - - [224, 16, 258, 16]
    - [6, 0.0]
  - - [240, 16, 258, 16]
    - [6, 0.0]
  - - [256, 16, 258, 16]
    - [5, 0.0]
  - - [16, 16, 386, 16]
    - [22, 0.0]
  - - [32, 16, 386, 16]
    - [0, 0.0]
  - - [48, 16, 386, 16]
    - [0, 0.0]
  - - [64, 16, 386, 16]
    - [4, 0.0]
  - - [80, 16, 386, 16]
    - [6, 0.0]
  - - [96, 16, 386, 16]
    - [2, 0.0]
  - - [112, 16, 386, 16]
    - [6, 0.0]
  - - [128, 16, 386, 16]
    - [6, 0.0]
  - - [144, 16, 386, 16]
    - [5, 0.0]
  - - [160, 16, 386, 16]
    - [5, 0.0]
  - - [176, 16, 386, 16]
    - [4, 0.0]
  - - [192, 16, 386, 16]
    - [5, 0.0]
  - - [208, 16, 386, 16]
    - [7, 0.0]
  - - [224, 16, 386, 16]
    - [7, 0.0]
  - - [240, 16, 386, 16]
    - [7, 0.0]
  - - [256, 16, 386, 16]
    - [7, 0.0]
  - - [16, 16, 514, 16]
    - [22, 0.0]
  - - [32, 16, 514, 16]
    - [0, 0.0]
  - - [48, 16, 514, 16]
    - [4, 0.0]
  - - [64, 16, 514, 16]
    - [4, 0.0]
  - - [80, 16, 514, 16]
    - [6, 0.0]
  - - [96, 16, 514, 16]
    - [6, 0.0]
  - - [112, 16, 514, 16]
    - [6, 0.0]
  - - [128, 16, 514, 16]
    - [5, 0.0]
  - - [144, 16, 514, 16]
    - [7, 0.0]
  - - [160, 16, 514, 16]
    - [7, 0.0]
  - - [176, 16, 514, 16]
    - [7, 0.0]
  - - [192, 16, 514, 16]
    - [7, 0.0]
  - - [208, 16, 514, 16]
    - [7, 0.0]
  - - [224, 16, 514, 16]
    - [7, 0.0]
  - - [240, 16, 514, 16]
    - [7, 0.0]
  - - [256, 16, 514, 16]
    - [7, 0.0]
  - - [16, 16, 642, 16]
    - [22, 0.0]
  - - [32, 16, 642, 16]
    - [2, 0.0]
  - - [48, 16, 642, 16]
    - [5, 0.0]
  - - [64, 16, 642, 16]
    - [5, 0.0]
  - - [80, 16, 642, 16]
    - [2, 0.0]
  - - [96, 16, 642, 16]
    - [2, 0.0]
  - - [112, 16, 642, 16]
    - [7, 0.0]
  - - [128, 16, 642, 16]
    - [7, 0.0]
  - - [144, 16, 642, 16]
    - [7, 0.0]
  - - [160, 16, 642, 16]
    - [7, 0.0]
  - - [176, 16, 642, 16]
    - [7, 0.0]
  - - [192, 16, 642, 16]
    - [7, 0.0]
  - - [208, 16, 642, 16]
    - [7, 0.0]
  - - [224, 16, 642, 16]
    - [7, 0.0]
  - - [240, 16, 642, 16]
    - [7, 0.0]
  - - [256, 16, 642, 16]
    - [7, 0.0]
  - - [16, 16, 770, 16]
    - [22, 0.0]
  - - [32, 16, 770, 16]
    - [2, 0.0]
  - - [48, 16, 770, 16]
    - [5, 0.0]
  - - [64, 16, 770, 16]
    - [5, 0.0]
  - - [80, 16, 770, 16]
    - [7, 0.0]
  - - [96, 16, 770, 16]
    - [2, 0.0]
  - - [112, 16, 770, 16]
    - [7, 0.0]
  - - [128, 16, 770, 16]
    - [7, 0.0]
  - - [144, 16, 770, 16]
    - [7, 0.0]
  - - [160, 16, 770, 16]
    - [7, 0.0]
  - - [176, 16, 770, 16]
    - [7, 0.0]
  - - [192, 16, 770, 16]
    - [7, 0.0]
  - - [208, 16, 770, 16]
    - [7, 0.0]
  - - [224, 16, 770, 16]
    - [7, 0.0]
  - - [240, 16, 770, 16]
    - [7, 0.0]
  - - [256, 16, 770, 16]
    - [7, 0.0]
  - - [16, 16, 898, 16]
    - [22, 0.0]
  - - [32, 16, 898, 16]
    - [2, 0.0]
  - - [48, 16, 898, 16]
    - [5, 0.0]
  - - [64, 16, 898, 16]
    - [5, 0.0]
  - - [80, 16, 898, 16]
    - [7, 0.0]
  - - [96, 16, 898, 16]
    - [7, 0.0]
  - - [112, 16, 898, 16]
    - [7, 0.0]
  - - [144, 16, 898, 16]
    - [7, 0.0]
  - - [160, 16, 898, 16]
    - [7, 0.0]
  - - [176, 16, 898, 16]
    - [7, 0.0]
  - - [192, 16, 898, 16]
    - [7, 0.0]
  - - [208, 16, 898, 16]
    - [7, 0.0]
  - - [224, 16, 898, 16]
    - [7, 0.0]
  - - [240, 16, 898, 16]
    - [7, 0.0]
  - - [16, 16, 2, 144]
    - [28, 0.0]
  - - [32, 16, 2, 144]
    - [14, 0.0]
  - - [48, 16, 2, 144]
    - [14, 0.0]
  - - [64, 16, 2, 144]
    - [14, 0.0]
  - - [80, 16, 2, 144]
    - [14, 0.0]
  - - [96, 16, 2, 144]
    - [14, 0.0]
  - - [112, 16, 2, 144]
    - [14, 0.0]
  - - [128, 16, 2, 144]
    - [14, 0.0]
  - - [144, 16, 2, 144]
    - [14, 0.0]
  - - [160, 16, 2, 144]
    - [14, 0.0]
  - - [176, 16, 2, 144]
    - [14, 0.0]
  - - [192, 16, 2, 144]
    - [14, 0.0]
  - - [208, 16, 2, 144]
    - [17, 0.0]
  - - [224, 16, 2, 144]
    - [17, 0.0]
  - - [240, 16, 2, 144]
    - [17, 0.0]
  - - [256, 16, 2, 144]
    - [17, 0.0]
  - - [16, 16, 130, 144]
    - [29, 0.0]
  - - [32, 16, 130, 144]
    - [14, 0.0]
  - - [48, 16, 130, 144]
    - [14, 0.0]
  - - [64, 16, 130, 144]
    - [14, 0.0]
  - - [80, 16, 130, 144]
    - [15, 0.0]
  - - [96, 16, 130, 144]
    - [15, 0.0]
  - - [112, 16, 130, 144]
    - [15, 0.0]
  - - [128, 16, 130, 144]
    - [15, 0.0]
  - - [144, 16, 130, 144]
    - [9, 0.0]
  - - [160, 16, 130, 144]
    - [9, 0.0]
  - - [176, 16, 130, 144]
    - [9, 0.0]
  - - [192, 16, 130, 144]
    - [9, 0.0]
  - - [208, 16, 130, 144]
    - [9, 0.0]
  - - [224, 16, 130, 144]
    - [9, 0.0]
  - - [240, 16, 130, 144]
    - [10, 0.0]
  - - [256, 16, 130, 144]
    - [10, 0.0]
  - - [16, 16, 258, 144]
    - [28, 0.0]
  - - [32, 16, 258, 144]
    - [14, 0.0]
  - - [48, 16, 258, 144]
    - [15, 0.0]
  - - [64, 16, 258, 144]
    - [15, 0.0]
  - - [80, 16, 258, 144]
    - [9, 0.0]
  - - [96, 16, 258, 144]
    - [9, 0.0]
  - - [112, 16, 258, 144]
    - [10, 0.0]
  - - [128, 16, 258, 144]
    - [10, 0.0]
  - - [144, 16, 258, 144]
    - [4, 0.0]
  - - [160, 16, 258, 144]
    - [4, 0.0]
  - - [176, 16, 258, 144]
    - [4, 0.0]
  - - [192, 16, 258, 144]
    - [4, 0.0]
  - - [208, 16, 258, 144]
    - [2, 0.0]
  - - [224, 16, 258, 144]
    - [2, 0.0]
  - - [240, 16, 258, 144]
    - [6, 0.0]
  - - [256, 16, 258, 144]
    - [6, 0.0]
  - - [16, 16, 386, 144]
    - [28, 0.0]
  - - [32, 16, 386, 144]
    - [15, 0.0]
  - - [48, 16, 386, 144]
    - [9, 0.0]
  - - [64, 16, 386, 144]
    - [9, 0.0]
  - - [80, 16, 386, 144]
    - [2, 0.0]
  - - [96, 16, 386, 144]
    - [2, 0.0]
  - - [112, 16, 386, 144]
    - [4, 0.0]
  - - [128, 16, 386, 144]
    - [4, 0.0]
  - - [144, 16, 386, 144]
    - [4, 0.0]
  - - [160, 16, 386, 144]
    - [4, 0.0]
  - - [176, 16, 386, 144]
    - [4, 0.0]
  - - [192, 16, 386, 144]
    - [4, 0.0]
  - - [208, 16, 386, 144]
    - [7, 0.0]
  - - [224, 16, 386, 144]
    - [7, 0.0]
  - - [240, 16, 386, 144]
    - [7, 0.0]
  - - [256, 16, 386, 144]
    - [7, 0.0]
  - - [16, 16, 514, 144]
    - [28, 0.0]
  - - [32, 16, 514, 144]
    - [15, 0.0]
  - - [48, 16, 514, 144]
    - [10, 0.0]
  - - [64, 16, 514, 144]
    - [2, 0.0]
  - - [80, 16, 514, 144]
    - [6, 0.0]
  - - [96, 16, 514, 144]
    - [6, 0.0]
  - - [112, 16, 514, 144]
    - [6, 0.0]
  - - [128, 16, 514, 144]
    - [4, 0.0]
  - - [144, 16, 514, 144]
    - [7, 0.0]
  - - [160, 16, 514, 144]
    - [7, 0.0]
  - - [176, 16, 514, 144]
    - [7, 0.0]
  - - [192, 16, 514, 144]
    - [7, 0.0]
  - - [208, 16, 514, 144]
    - [7, 0.0]
  - - [224, 16, 514, 144]
    - [7, 0.0]
  - - [240, 16, 514, 144]
    - [7, 0.0]
  - - [256, 16, 514, 144]
    - [7, 0.0]
  - - [16, 16, 642, 144]
    - [37, 0.0]
  - - [32, 16, 642, 144]
    - [9, 0.0]
  - - [48, 16, 642, 144]
    - [4, 0.0]
  - - [64, 16, 642, 144]
    - [4, 0.0]
  - - [80, 16, 642, 144]
    - [2, 0.0]
  - - [96, 16, 642, 144]
    - [2, 0.0]
  - - [112, 16, 642, 144]
    - [7, 0.0]
  - - [128, 16, 642, 144]
    - [7, 0.0]
  - - [144, 16, 642, 144]
    - [4, 0.0]
  - - [160, 16, 642, 144]
    - [4, 0.0]
  - - [176, 16, 642, 144]
    - [4, 0.0]
  - - [192, 16, 642, 144]
    - [4, 0.0]
  - - [208, 16, 642, 144]
    - [2, 0.0]
  - - [224, 16, 642, 144]
    - [2, 0.0]
  - - [240, 16, 642, 144]
    - [7, 0.0]
  - - [256, 16, 642, 144]
    - [7, 0.0]
  - - [16, 16, 770, 144]
    - [37, 0.0]
  - - [32, 16, 770, 144]
    - [9, 0.0]
  - - [48, 16, 770, 144]
    - [4, 0.0]
  - - [64, 16, 770, 144]
    - [4, 0.0]
  - - [80, 16, 770, 144]
    - [2, 0.0]
  - - [96, 16, 770, 144]
    - [2, 0.0]
  - - [112, 16, 770, 144]
    - [7, 0.0]
  - - [128, 16, 770, 144]
    - [7, 0.0]
  - - [144, 16, 770, 144]
    - [7, 0.0]
  - - [160, 16, 770, 144]
    - [7, 0.0]
  - - [176, 16, 770, 144]
    - [7, 0.0]
  - - [192, 16, 770, 144]
    - [7, 0.0]
  - - [208, 16, 770, 144]
    - [7, 0.0]
  - - [224, 16, 770, 144]
    - [7, 0.0]
  - - [240, 16, 770, 144]
    - [7, 0.0]
  - - [256, 16, 770, 144]
    - [7, 0.0]
  - - [16, 16, 898, 144]
    - [37, 0.0]
  - - [32, 16, 898, 144]
    - [9, 0.0]
  - - [48, 16, 898, 144]
    - [4, 0.0]
  - - [64, 16, 898, 144]
    - [4, 0.0]
  - - [80, 16, 898, 144]
    - [7, 0.0]
  - - [96, 16, 898, 144]
    - [7, 0.0]
  - - [112, 16, 898, 144]
    - [7, 0.0]
  - - [128, 16, 898, 144]
    - [7, 0.0]
  - - [144, 16, 898, 144]
    - [7, 0.0]
  - - [160, 16, 898, 144]
    - [7, 0.0]
  - - [176, 16, 898, 144]
    - [7, 0.0]
  - - [192, 16, 898, 144]
    - [7, 0.0]
  - - [208, 16, 898, 144]
    - [7, 0.0]
  - - [224, 16, 898, 144]
    - [7, 0.0]
  - - [240, 16, 898, 144]
    - [7, 0.0]
  - - [256, 16, 898, 144]
    - [7, 0.0]
  - - [16, 16, 2, 272]
    - [29, 0.0]
  - - [32, 16, 2, 272]
    - [17, 0.0]
  - - [48, 16, 2, 272]
    - [17, 0.0]
  - - [64, 16, 2, 272]
    - [17, 0.0]
  - - [80, 16, 2, 272]
    - [17, 0.0]
  - - [96, 16, 2, 272]
    - [17, 0.0]
  - - [112, 16, 2, 272]
    - [17, 0.0]
  - - [128, 16, 2, 272]
    - [17, 0.0]
  - - [144, 16, 2, 272]
    - [17, 0.0]
  - - [160, 16, 2, 272]
    - [17, 0.0]
  - - [176, 16, 2, 272]
    - [19, 0.0]
  - - [192, 16, 2, 272]
    - [19, 0.0]
  - - [208, 16, 2, 272]
    - [19, 0.0]
  - - [224, 16, 2, 272]
    - [17, 0.0]
  - - [240, 16, 2, 272]
    - [17, 0.0]
  - - [256, 16, 2, 272]
    - [17, 0.0]
  - - [16, 16, 130, 272]
    - [29, 0.0]
  - - [32, 16, 130, 272]
    - [17, 0.0]
  - - [48, 16, 130, 272]
    - [18, 0.0]
  - - [64, 16, 130, 272]
    - [15, 0.0]
  - - [80, 16, 130, 272]
    - [15, 0.0]
  - - [96, 16, 130, 272]
    - [16, 0.0]
  - - [112, 16, 130, 272]
    - [16, 0.0]
  - - [128, 16, 130, 272]
    - [16, 0.0]
  - - [144, 16, 130, 272]
    - [9, 0.0]
  - - [160, 16, 130, 272]
    - [9, 0.0]
  - - [176, 16, 130, 272]
    - [10, 0.0]
  - - [192, 16, 130, 272]
    - [10, 0.0]
  - - [208, 16, 130, 272]
    - [12, 0.0]
  - - [224, 16, 130, 272]
    - [12, 0.0]
  - - [240, 16, 130, 272]
    - [12, 0.0]
  - - [256, 16, 130, 272]
    - [10, 0.0]
  - - [16, 16, 258, 272]
    - [29, 0.0]
  - - [32, 16, 258, 272]
    - [18, 0.0]
  - - [48, 16, 258, 272]
    - [16, 0.0]
  - - [64, 16, 258, 272]
    - [15, 0.0]
  - - [80, 16, 258, 272]
    - [9, 0.0]
  - - [96, 16, 258, 272]
    - [9, 0.0]
  - - [112, 16, 258, 272]
    - [10, 0.0]
  - - [128, 16, 258, 272]
    - [10, 0.0]
  - - [144, 16, 258, 272]
    - [4, 0.0]
  - - [160, 16, 258, 272]
    - [4, 0.0]
  - - [176, 16, 258, 272]
    - [4, 0.0]
  - - [192, 16, 258, 272]
    - [4, 0.0]
  - - [208, 16, 258, 272]
    - [13, 0.0]
  - - [224, 16, 258, 272]
    - [11, 0.0]
  - - [240, 16, 258, 272]
    - [11, 0.0]
  - - [256, 16, 258, 272]
    - [6, 0.0]
  - - [16, 16, 386, 272]
    - [29, 0.0]
  - - [32, 16, 386, 272]
    - [15, 0.0]
  - - [48, 16, 386, 272]
    - [10, 0.0]
  - - [64, 16, 386, 272]
    - [9, 0.0]
  - - [80, 16, 386, 272]
    - [9, 0.0]
  - - [96, 16, 386, 272]
    - [2, 0.0]
  - - [112, 16, 386, 272]
    - [4, 0.0]
  - - [128, 16, 386, 272]
    - [4, 0.0]
  - - [144, 16, 386, 272]
    - [4, 0.0]
  - - [160, 16, 386, 272]
    - [4, 0.0]
  - - [176, 16, 386, 272]
    - [4, 0.0]
  - - [192, 16, 386, 272]
    - [4, 0.0]
  - - [208, 16, 386, 272]
    - [11, 0.0]
  - - [224, 16, 386, 272]
    - [7, 0.0]
  - - [240, 16, 386, 272]
    - [12, 0.0]
  - - [256, 16, 386, 272]
    - [7, 0.0]
  - - [16, 16, 514, 272]
    - [28, 0.0]
  - - [32, 16, 514, 272]
    - [15, 0.0]
  - - [48, 16, 514, 272]
    - [10, 0.0]
  - - [64, 16, 514, 272]
    - [10, 0.0]
  - - [80, 16, 514, 272]
    - [6, 0.0]
  - - [96, 16, 514, 272]
    - [6, 0.0]
  - - [112, 16, 514, 272]
    - [6, 0.0]
  - - [128, 16, 514, 272]
    - [4, 0.0]
  - - [144, 16, 514, 272]
    - [7, 0.0]
  - - [160, 16, 514, 272]
    - [7, 0.0]
  - - [176, 16, 514, 272]
    - [7, 0.0]
  - - [192, 16, 514, 272]
    - [7, 0.0]
  - - [208, 16, 514, 272]
    - [7, 0.0]
  - - [224, 16, 514, 272]
    - [7, 0.0]
  - - [240, 16, 514, 272]
    - [7, 0.0]
  - - [256, 16, 514, 272]
    - [7, 0.0]
  - - [16, 16, 642, 272]
    - [43, 0.0]
  - - [32, 16, 642, 272]
    - [9, 0.0]
  - - [48, 16, 642, 272]
    - [4, 0.0]
  - - [64, 16, 642, 272]
    - [4, 0.0]
  - - [80, 16, 642, 272]
    - [2, 0.0]
  - - [96, 16, 642, 272]
    - [2, 0.0]
  - - [112, 16, 642, 272]
    - [7, 0.0]
  - - [128, 16, 642, 272]
    - [7, 0.0]
  - - [144, 16, 642, 272]
    - [4, 0.0]
  - - [160, 16, 642, 272]
    - [4, 0.0]
  - - [176, 16, 642, 272]
    - [4, 0.0]
  - - [192, 16, 642, 272]
    - [4, 0.0]
  - - [208, 16, 642, 272]
    - [11, 0.0]
  - - [224, 16, 642, 272]
    - [2, 0.0]
  - - [240, 16, 642, 272]
    - [11, 0.0]
  - - [256, 16, 642, 272]
    - [11, 0.0]
  - - [16, 16, 770, 272]
    - [37, 0.0]
  - - [32, 16, 770, 272]
    - [9, 0.0]
  - - [48, 16, 770, 272]
    - [4, 0.0]
  - - [64, 16, 770, 272]
    - [4, 0.0]
  - - [80, 16, 770, 272]
    - [2, 0.0]
  - - [96, 16, 770, 272]
    - [2, 0.0]
  - - [112, 16, 770, 272]
    - [12, 0.0]
  - - [128, 16, 770, 272]
    - [11, 0.0]
  - - [144, 16, 770, 272]
    - [7, 0.0]
  - - [160, 16, 770, 272]
    - [7, 0.0]
  - - [176, 16, 770, 272]
    - [7, 0.0]
  - - [192, 16, 770, 272]
    - [7, 0.0]
  - - [208, 16, 770, 272]
    - [7, 0.0]
  - - [224, 16, 770, 272]
    - [8, 0.0]
  - - [240, 16, 770, 272]
    - [8, 0.0]
  - - [256, 16, 770, 272]
    - [7, 0.0]
  - - [16, 16, 898, 272]
    - [37, 0.0]
  - - [32, 16, 898, 272]
    - [9, 0.0]
  - - [48, 16, 898, 272]
    - [4, 0.0]
  - - [64, 16, 898, 272]
    - [4, 0.0]
  - - [80, 16, 898, 272]
    - [7, 0.0]
  - - [96, 16, 898, 272]
    - [7, 0.0]
  - - [112, 16, 898, 272]
    - [7, 0.0]
  - - [128, 16, 898, 272]
    - [7, 0.0]
  - - [144, 16, 898, 272]
    - [7, 0.0]
  - - [160, 16, 898, 272]
    - [7, 0.0]
  - - [176, 16, 898, 272]
    - [7, 0.0]
  - - [192, 16, 898, 272]
    - [7, 0.0]
  - - [208, 16, 898, 272]
    - [7, 0.0]
  - - [224, 16, 898, 272]
    - [8, 0.0]
  - - [240, 16, 898, 272]
    - [8, 0.0]
  - - [256, 16, 898, 272]
    - [8, 0.0]
  - - [16, 32, 2, 16]
    - [21, 0.0]
  - - [16, 48, 2, 16]
    - [22, 0.0]
  - - [16, 64, 2, 16]
    - [21, 0.0]
  - - [16, 80, 2, 16]
    - [22, 0.0]
  - - [16, 96, 2, 16]
    - [22, 0.0]
  - - [16, 112, 2, 16]
    - [22, 0.0]
  - - [16, 128, 2, 16]
    - [22, 0.0]
  - - [16, 144, 2, 16]
    - [22, 0.0]
  - - [16, 160, 2, 16]
    - [22, 0.0]
  - - [16, 176, 2, 16]
    - [22, 0.0]
  - - [16, 192, 2, 16]
    - [22, 0.0]
  - - [16, 208, 2, 16]
    - [22, 0.0]
  - - [16, 224, 2, 16]
    - [22, 0.0]
  - - [16, 240, 2, 16]
    - [22, 0.0]
  - - [16, 256, 2, 16]
    - [22, 0.0]
  - - [16, 32, 130, 16]
    - [21, 0.0]
  - - [16, 48, 130, 16]
    - [22, 0.0]
  - - [16, 64, 130, 16]
    - [23, 0.0]
  - - [16, 80, 130, 16]
    - [22, 0.0]
  - - [16, 96, 130, 16]
    - [22, 0.0]
  - - [16, 112, 130, 16]
    - [23, 0.0]
  - - [16, 128, 130, 16]
    - [23, 0.0]
  - - [16, 144, 130, 16]
    - [22, 0.0]
  - - [16, 160, 130, 16]
    - [21, 0.0]
  - - [16, 176, 130, 16]
    - [23, 0.0]
  - - [16, 192, 130, 16]
    - [23, 0.0]
  - - [16, 208, 130, 16]
    - [23, 0.0]
  - - [16, 224, 130, 16]
    - [23, 0.0]
  - - [16, 240, 130, 16]
    - [23, 0.0]
  - - [16, 256, 130, 16]
    - [23, 0.0]
  - - [16, 32, 258, 16]
    - [21, 0.0]
  - - [16, 48, 258, 16]
    - [22, 0.0]
  - - [16, 64, 258, 16]
    - [23, 0.0]
  - - [16, 80, 258, 16]
    - [23, 0.0]
  - - [16, 96, 258, 16]
    - [23, 0.0]
  - - [16, 112, 258, 16]
    - [23, 0.0]
  - - [16, 128, 258, 16]
    - [23, 0.0]
  - - [16, 144, 258, 16]
    - [24, 0.0]
  - - [16, 160, 258, 16]
    - [21, 0.0]
  - - [16, 176, 258, 16]
    - [25, 0.0]
  - - [16, 192, 258, 16]
    - [24, 0.0]
  - - [16, 208, 258, 16]
    - [25, 0.0]
  - - [16, 224, 258, 16]
    - [25, 0.0]
  - - [16, 240, 258, 16]
    - [25, 0.0]
  - - [16, 256, 258, 16]
    - [25, 0.0]
  - - [16, 32, 386, 16]
    - [22, 0.0]
  - - [16, 48, 386, 16]
    - [21, 0.0]
  - - [16, 64, 386, 16]
    - [23, 0.0]
  - - [16, 80, 386, 16]
    - [24, 0.0]
  - - [16, 96, 386, 16]
    - [24, 0.0]
  - - [16, 112, 386, 16]
    - [24, 0.0]
  - - [16, 128, 386, 16]
    - [25, 0.0]
  - - [16, 144, 386, 16]
    - [24, 0.0]
  - - [16, 160, 386, 16]
    - [21, 0.0]
  - - [16, 176, 386, 16]
    - [23, 0.0]
  - - [16, 192, 386, 16]
    - [23, 0.0]
  - - [16, 208, 386, 16]
    - [26, 0.0]
  - - [16, 224, 386, 16]
    - [26, 0.0]
  - - [16, 240, 386, 16]
    - [26, 0.0]
  - - [16, 256, 386, 16]
    - [26, 0.0]
  - - [16, 32, 514, 16]
    - [21, 0.0]
  - - [16, 48, 514, 16]
    - [23, 0.0]
  - - [16, 64, 514, 16]
    - [23, 0.0]
  - - [16, 80, 514, 16]
    - [25, 0.0]
  - - [16, 96, 514, 16]
    - [25, 0.0]
  - - [16, 112, 514, 16]
    - [24, 0.0]
  - - [16, 128, 514, 16]
    - [25, 0.0]
  - - [16, 144, 514, 16]
    - [26, 0.0]
  - - [16, 160, 514, 16]
    - [26, 0.0]
  - - [16, 176, 514, 16]
    - [26, 0.0]
  - - [16, 192, 514, 16]
    - [26, 0.0]
  - - [16, 208, 514, 16]
    - [26, 0.0]
  - - [16, 224, 514, 16]
    - [26, 0.0]
  - - [16, 240, 514, 16]
    - [26, 0.0]
  - - [16, 256, 514, 16]
    - [26, 0.0]
  - - [16, 32, 642, 16]
    - [21, 0.0]
  - - [16, 48, 642, 16]
    - [24, 0.0]
  - - [16, 64, 642, 16]
    - [24, 0.0]
  - - [16, 80, 642, 16]
    - [21, 0.0]
  - - [16, 96, 642, 16]
    - [21, 0.0]
  - - [16, 112, 642, 16]
    - [27, 0.0]
  - - [16, 128, 642, 16]
    - [27, 0.0]
  - - [16, 144, 642, 16]
    - [26, 0.0]
  - - [16, 160, 642, 16]
    - [26, 0.0]
  - - [16, 176, 642, 16]
    - [26, 0.0]
  - - [16, 192, 642, 16]
    - [26, 0.0]
  - - [16, 208, 642, 16]
    - [26, 0.0]
  - - [16, 224, 642, 16]
    - [26, 0.0]
  - - [16, 240, 642, 16]
    - [26, 0.0]
  - - [16, 256, 642, 16]
    - [26, 0.0]
  - - [16, 32, 770, 16]
    - [21, 0.0]
  - - [16, 48, 770, 16]
    - [24, 0.0]
  - - [16, 64, 770, 16]
    - [24, 0.0]
  - - [16, 80, 770, 16]
    - [21, 0.0]
  - - [16, 96, 770, 16]
    - [21, 0.0]
  - - [16, 112, 770, 16]
    - [27, 0.0]
  - - [16, 128, 770, 16]
    - [27, 0.0]
  - - [16, 144, 770, 16]
    - [26, 0.0]
  - - [16, 160, 770, 16]
    - [26, 0.0]
  - - [16, 176, 770, 16]
    - [26, 0.0]
  - - [16, 192, 770, 16]
    - [26, 0.0]
  - - [16, 208, 770, 16]
    - [26, 0.0]
  - - [16, 224, 770, 16]
    - [26, 0.0]
  - - [16, 240, 770, 16]
    - [26, 0.0]
  - - [16, 256, 770, 16]
    - [26, 0.0]
  - - [16, 32, 898, 16]
    - [21, 0.0]
  - - [16, 48, 898, 16]
    - [24, 0.0]
  - - [16, 64, 898, 16]
    - [24, 0.0]
  - - [16, 80, 898, 16]
    - [27, 0.0]
  - - [16, 96, 898, 16]
    - [27, 0.0]
  - - [16, 112, 898, 16]
    - [27, 0.0]
  - - [16, 128, 898, 16]
    - [27, 0.0]
  - - [16, 144, 898, 16]
    - [26, 0.0]
  - - [16, 160, 898, 16]
    - [26, 0.0]
  - - [16, 176, 898, 16]
    - [26, 0.0]
  - - [16, 192, 898, 16]
    - [26, 0.0]
  - - [16, 208, 898, 16]
    - [26, 0.0]
  - - [16, 224, 898, 16]
    - [26, 0.0]
  - - [16, 240, 898, 16]
    - [26, 0.0]
  - - [16, 256, 898, 16]
    - [26, 0.0]
  - - [16, 32, 2, 144]
    - [28, 0.0]
  - - [16, 48, 2, 144]
    - [28, 0.0]
  - - [16, 64, 2, 144]
    - [28, 0.0]
  - - [16, 80, 2, 144]
    - [28, 0.0]
  - - [16, 96, 2, 144]
    - [28, 0.0]
  - - [16, 112, 2, 144]
    - [28, 0.0]
  - - [16, 128, 2, 144]
    - [28, 0.0]
  - - [16, 144, 2, 144]
    - [28, 0.0]
  - - [16, 160, 2, 144]
    - [28, 0.0]
  - - [16, 176, 2, 144]
    - [28, 0.0]
  - - [16, 192, 2, 144]
    - [28, 0.0]
  - - [16, 208, 2, 144]
    - [29, 0.0]
  - - [16, 224, 2, 144]
    - [29, 0.0]
  - - [16, 240, 2, 144]
    - [29, 0.0]
  - - [16, 256, 2, 144]
    - [28, 0.0]
  - - [16, 32, 130, 144]
    - [28, 0.0]
  - - [16, 48, 130, 144]
    - [30, 0.0]
  - - [16, 64, 130, 144]
    - [30, 0.0]
  - - [16, 80, 130, 144]
    - [31, 0.0]
  - - [16, 96, 130, 144]
    - [32, 0.0]
  - - [16, 112, 130, 144]
    - [31, 0.0]
  - - [16, 128, 130, 144]
    - [33, 0.0]
  - - [16, 144, 130, 144]
    - [23, 0.0]
  - - [16, 160, 130, 144]
    - [23, 0.0]
  - - [16, 176, 130, 144]
    - [23, 0.0]
  - - [16, 192, 130, 144]
    - [31, 0.0]
  - - [16, 208, 130, 144]
    - [23, 0.0]
  - - [16, 224, 130, 144]
    - [23, 0.0]
  - - [16, 240, 130, 144]
    - [23, 0.0]
  - - [16, 256, 130, 144]
    - [27, 0.0]
  - - [16, 32, 258, 144]
    - [34, 0.0]
  - - [16, 48, 258, 144]
    - [33, 0.0]
  - - [16, 64, 258, 144]
    - [33, 0.0]
  - - [16, 80, 258, 144]
    - [35, 0.0]
  - - [16, 96, 258, 144]
    - [35, 0.0]
  - - [16, 112, 258, 144]
    - [35, 0.0]
  - - [16, 128, 258, 144]
    - [27, 0.0]
  - - [16, 144, 258, 144]
    - [26, 0.0]
  - - [16, 160, 258, 144]
    - [26, 0.0]
  - - [16, 176, 258, 144]
    - [26, 0.0]
  - - [16, 192, 258, 144]
    - [26, 0.0]
  - - [16, 208, 258, 144]
    - [26, 0.0]
  - - [16, 224, 258, 144]
    - [26, 0.0]
  - - [16, 240, 258, 144]
    - [26, 0.0]
  - - [16, 256, 258, 144]
    - [26, 0.0]
  - - [16, 32, 386, 144]
    - [34, 0.0]
  - - [16, 48, 386, 144]
    - [33, 0.0]
  - - [16, 64, 386, 144]
    - [31, 0.0]
  - - [16, 80, 386, 144]
    - [27, 0.0]
  - - [16, 96, 386, 144]
    - [25, 0.0]
  - - [16, 112, 386, 144]
    - [25, 0.0]
  - - [16, 128, 386, 144]
    - [25, 0.0]
  - - [16, 144, 386, 144]
    - [26, 0.0]
  - - [16, 160, 386, 144]
    - [26, 0.0]
  - - [16, 176, 386, 144]
    - [26, 0.0]
  - - [16, 192, 386, 144]
    - [26, 0.0]
  - - [16, 208, 386, 144]
    - [26, 0.0]
  - - [16, 224, 386, 144]
    - [26, 0.0]
  - - [16, 240, 386, 144]
    - [26, 0.0]
  - - [16, 256, 386, 144]
    - [26, 0.0]
  - - [16, 32, 514, 144]
    - [36, 0.0]
  - - [16, 48, 514, 144]
    - [31, 0.0]
  - - [16, 64, 514, 144]
    - [31, 0.0]
  - - [16, 80, 514, 144]
    - [25, 0.0]
  - - [16, 96, 514, 144]
    - [25, 0.0]
  - - [16, 112, 514, 144]
    - [25, 0.0]
  - - [16, 128, 514, 144]
    - [25, 0.0]
  - - [16, 144, 514, 144]
    - [26, 0.0]
  - - [16, 160, 514, 144]
    - [26, 0.0]
  - - [16, 176, 514, 144]
    - [26, 0.0]
  - - [16, 192, 514, 144]
    - [26, 0.0]
  - - [16, 208, 514, 144]
    - [26, 0.0]
  - - [16, 224, 514, 144]
    - [26, 0.0]
  - - [16, 240, 514, 144]
    - [26, 0.0]
  - - [16, 256, 514, 144]
    - [26, 0.0]
  - - [16, 32, 642, 144]
    - [32, 0.0]
  - - [16, 48, 642, 144]
    - [23, 0.0]
  - - [16, 64, 642, 144]
    - [23, 0.0]
  - - [16, 80, 642, 144]
    - [38, 0.0]
  - - [16, 96, 642, 144]
    - [38, 0.0]
  - - [16, 112, 642, 144]
    - [27, 0.0]
  - - [16, 128, 642, 144]
    - [38, 0.0]
  - - [16, 144, 642, 144]
    - [26, 0.0]
  - - [16, 160, 642, 144]
    - [26, 0.0]
  - - [16, 176, 642, 144]
    - [26, 0.0]
  - - [16, 192, 642, 144]
    - [26, 0.0]
  - - [16, 208, 642, 144]
    - [26, 0.0]
  - - [16, 224, 642, 144]
    - [26, 0.0]
  - - [16, 240, 642, 144]
    - [26, 0.0]
  - - [16, 256, 642, 144]
    - [26, 0.0]
  - - [16, 32, 770, 144]
    - [32, 0.0]
  - - [16, 48, 770, 144]
    - [23, 0.0]
  - - [16, 64, 770, 144]
    - [23, 0.0]
  - - [16, 80, 770, 144]
    - [27, 0.0]
  - - [16, 96, 770, 144]
    - [27, 0.0]
  - - [16, 112, 770, 144]
    - [27, 0.0]
  - - [16, 128, 770, 144]
    - [27, 0.0]
  - - [16, 144, 770, 144]
    - [26, 0.0]
  - - [16, 160, 770, 144]
    - [26, 0.0]
  - - [16, 176, 770, 144]
    - [26, 0.0]
  - - [16, 192, 770, 144]
    - [26, 0.0]
  - - [16, 208, 770, 144]
    - [26, 0.0]
  - - [16, 224, 770, 144]
    - [26, 0.0]
  - - [16, 240, 770, 144]
    - [26, 0.0]
  - - [16, 256, 770, 144]
    - [26, 0.0]
  - - [16, 32, 898, 144]
    - [32, 0.0]
  - - [16, 48, 898, 144]
    - [39, 0.0]
  - - [16, 64, 898, 144]
    - [23, 0.0]
  - - [16, 80, 898, 144]
    - [27, 0.0]
  - - [16, 96, 898, 144]
    - [27, 0.0]
  - - [16, 112, 898, 144]
    - [27, 0.0]
  - - [16, 128, 898, 144]
    - [27, 0.0]
  - - [16, 144, 898, 144]
    - [26, 0.0]
  - - [16, 160, 898, 144]
    - [26, 0.0]
  - - [16, 176, 898, 144]
    - [26, 0.0]
  - - [16, 192, 898, 144]
    - [26, 0.0]
  - - [16, 208, 898, 144]
    - [26, 0.0]
  - - [16, 224, 898, 144]
    - [26, 0.0]
  - - [16, 240, 898, 144]
    - [26, 0.0]
  - - [16, 256, 898, 144]
    - [26, 0.0]
  - - [16, 32, 2, 272]
    - [29, 0.0]
  - - [16, 48, 2, 272]
    - [29, 0.0]
  - - [16, 64, 2, 272]
    - [29, 0.0]
  - - [16, 80, 2, 272]
    - [29, 0.0]
  - - [16, 96, 2, 272]
    - [29, 0.0]
  - - [16, 112, 2, 272]
    - [29, 0.0]
  - - [16, 128, 2, 272]
    - [29, 0.0]
  - - [16, 144, 2, 272]
    - [29, 0.0]
  - - [16, 160, 2, 272]
    - [29, 0.0]
  - - [16, 176, 2, 272]
    - [29, 0.0]
  - - [16, 192, 2, 272]
    - [29, 0.0]
  - - [16, 208, 2, 272]
    - [29, 0.0]
  - - [16, 224, 2, 272]
    - [29, 0.0]
  - - [16, 240, 2, 272]
    - [29, 0.0]
  - - [16, 256, 2, 272]
    - [29, 0.0]
  - - [16, 32, 130, 272]
    - [40, 0.0]
  - - [16, 48, 130, 272]
    - [33, 0.0]
  - - [16, 64, 130, 272]
    - [33, 0.0]
  - - [16, 80, 130, 272]
    - [41, 0.0]
  - - [16, 96, 130, 272]
    - [41, 0.0]
  - - [16, 112, 130, 272]
    - [33, 0.0]
  - - [16, 128, 130, 272]
    - [33, 0.0]
  - - [16, 144, 130, 272]
    - [23, 0.0]
  - - [16, 160, 130, 272]
    - [23, 0.0]
  - - [16, 176, 130, 272]
    - [31, 0.0]
  - - [16, 192, 130, 272]
    - [31, 0.0]
  - - [16, 208, 130, 272]
    - [35, 0.0]
  - - [16, 224, 130, 272]
    - [35, 0.0]
  - - [16, 240, 130, 272]
    - [27, 0.0]
  - - [16, 256, 130, 272]
    - [27, 0.0]
  - - [16, 32, 258, 272]
    - [34, 0.0]
  - - [16, 48, 258, 272]
    - [33, 0.0]
  - - [16, 64, 258, 272]
    - [33, 0.0]
  - - [16, 80, 258, 272]
    - [41, 0.0]
  - - [16, 96, 258, 272]
    - [35, 0.0]
  - - [16, 112, 258, 272]
    - [35, 0.0]
  - - [16, 128, 258, 272]
    - [27, 0.0]
  - - [16, 144, 258, 272]
    - [42, 0.0]
  - - [16, 160, 258, 272]
    - [26, 0.0]
  - - [16, 176, 258, 272]
    - [26, 0.0]
  - - [16, 192, 258, 272]
    - [26, 0.0]
  - - [16, 208, 258, 272]
    - [26, 0.0]
  - - [16, 224, 258, 272]
    - [26, 0.0]
  - - [16, 240, 258, 272]
    - [26, 0.0]
  - - [16, 256, 258, 272]
    - [26, 0.0]
  - - [16, 32, 386, 272]
    - [34, 0.0]
  - - [16, 48, 386, 272]
    - [31, 0.0]
  - - [16, 64, 386, 272]
    - [31, 0.0]
  - - [16, 80, 386, 272]
    - [27, 0.0]
  - - [16, 96, 386, 272]
    - [27, 0.0]
  - - [16, 112, 386, 272]
    - [25, 0.0]
  - - [16, 128, 386, 272]
    - [25, 0.0]
  - - [16, 144, 386, 272]
    - [26, 0.0]
  - - [16, 160, 386, 272]
    - [26, 0.0]
  - - [16, 176, 386, 272]
    - [26, 0.0]
  - - [16, 192, 386, 272]
    - [26, 0.0]
  - - [16, 208, 386, 272]
    - [26, 0.0]
  - - [16, 224, 386, 272]
    - [26, 0.0]
  - - [16, 240, 386, 272]
    - [26, 0.0]
  - - [16, 256, 386, 272]
    - [26, 0.0]
  - - [16, 32, 514, 272]
    - [36, 0.0]
  - - [16, 48, 514, 272]
    - [31, 0.0]
  - - [16, 64, 514, 272]
    - [31, 0.0]
  - - [16, 80, 514, 272]
    - [25, 0.0]
  - - [16, 96, 514, 272]
    - [25, 0.0]
  - - [16, 112, 514, 272]
    - [25, 0.0]
  - - [16, 128, 514, 272]
    - [25, 0.0]
  - - [16, 144, 514, 272]
    - [26, 0.0]
  - - [16, 160, 514, 272]
    - [26, 0.0]
  - - [16, 176, 514, 272]
    - [26, 0.0]
  - - [16, 192, 514, 272]
    - [26, 0.0]
  - - [16, 208, 514, 272]
    - [26, 0.0]
  - - [16, 224, 514, 272]
    - [26, 0.0]
  - - [16, 240, 514, 272]
    - [26, 0.0]
  - - [16, 256, 514, 272]
    - [26, 0.0]
  - - [16, 32, 642, 272]
    - [32, 0.0]
  - - [16, 48, 642, 272]
    - [23, 0.0]
  - - [16, 64, 642, 272]
    - [23, 0.0]
  - - [16, 80, 642, 272]
    - [38, 0.0]
  - - [16, 96, 642, 272]
    - [38, 0.0]
  - - [16, 112, 642, 272]
    - [38, 0.0]
  - - [16, 128, 642, 272]
    - [38, 0.0]
  - - [16, 144, 642, 272]
    - [26, 0.0]
  - - [16, 160, 642, 272]
    - [26, 0.0]
  - - [16, 176, 642, 272]
    - [26, 0.0]
  - - [16, 192, 642, 272]
    - [26, 0.0]
  - - [16, 208, 642, 272]
    - [26, 0.0]
  - - [16, 224, 642, 272]
    - [26, 0.0]
  - - [16, 240, 642, 272]
    - [35, 0.0]
  - - [16, 256, 642, 272]
    - [27, 0.0]
  - - [16, 32, 770, 272]
    - [32, 0.0]
  - - [16, 48, 770, 272]
    - [23, 0.0]
  - - [16, 64, 770, 272]
    - [23, 0.0]
  - - [16, 80, 770, 272]
    - [38, 0.0]
  - - [16, 96, 770, 272]
    - [27, 0.0]
  - - [16, 112, 770, 272]
    - [27, 0.0]
  - - [16, 128, 770, 272]
    - [27, 0.0]
  - - [16, 144, 770, 272]
    - [26, 0.0]
  - - [16, 160, 770, 272]
    - [26, 0.0]
  - - [16, 176, 770, 272]
    - [26, 0.0]
  - - [16, 192, 770, 272]
    - [26, 0.0]
  - - [16, 208, 770, 272]
    - [26, 0.0]
  - - [16, 224, 770, 272]
    - [26, 0.0]
  - - [16, 240, 770, 272]
    - [26, 0.0]
  - - [16, 256, 770, 272]
    - [26, 0.0]
  - - [16, 32, 898, 272]
    - [32, 0.0]
  - - [16, 48, 898, 272]
    - [23, 0.0]
  - - [16, 64, 898, 272]
    - [23, 0.0]
  - - [16, 80, 898, 272]
    - [27, 0.0]
  - - [16, 96, 898, 272]
    - [27, 0.0]
  - - [16, 112, 898, 272]
    - [27, 0.0]
  - - [16, 128, 898, 272]
    - [27, 0.0]
  - - [16, 144, 898, 272]
    - [26, 0.0]
  - - [16, 160, 898, 272]
    - [26, 0.0]
  - - [16, 176, 898, 272]
    - [26, 0.0]
  - - [16, 192, 898, 272]
    - [26, 0.0]
  - - [16, 208, 898, 272]
    - [26, 0.0]
  - - [16, 224, 898, 272]
    - [26, 0.0]
  - - [16, 240, 898, 272]
    - [26, 0.0]
  - - [16, 256, 898, 272]
    - [26, 0.0]
- null
- null
- DeviceEfficiency
- GridBased
