projects/hipblaslt/library/src/amd_detail/rocblaslt/src/Tensile/Logic/asm_full/aquavanjaram/gfx942/GridBased/aquavanjaram_Cijk_Alik_Bljk_F8NBS_STA_BH_Bias_HAS_SAB_SAV_UserArgs.yaml
- {MinimumRequiredVersion: 4.33.0}
- aquavanjaram
- gfx942
- [Device 0049, Device 0050]
    SolutionIndex: 0
    SolutionNameMin: Cijk_Alik_Bljk_F8NBS_STA_BH_BiasSB_HAS_SAB_SAV_UserArgs_MT64x32x512_MI16x16x1_SN_LDSB1_GRVWB16_GSU1_GSUAMB_GSUC1_GSUWGMRR1_K1_LBSPPB1024_MIWT2_2_NTA0_NLCA8_SU0_SUM0_SUS0_VWB2_WG32_4_1_WGM1_WGMXCC8_WGMXCCGn1
    SolutionIndex: 1
    SolutionNameMin: Cijk_Alik_Bljk_F8NBS_STA_BH_BiasSB_HAS_SAB_SAV_UserArgs_MT64x32x512_MI16x16x1_SN_LDSB1_GRVWB16_GSU1_GSUC0_GSUWGMRR0_K1_LBSPPB1024_MIWT1_2_NLCA8_SU8_SUM0_SUS512_VWB2_WG64_4_1_WGM6_WGMXCC8_WGMXCCGn1
    SolutionIndex: 2
    SolutionNameMin: Cijk_Alik_Bljk_F8NBS_STA_BH_BiasSB_HAS_SAB_SAV_UserArgs_MT64x32x512_MI16x16x1_SN_LDSB1_GRVWB16_GSU1_GSUC0_GSUWGMRR0_K1_LBSPPB1024_MIWT1_2_NLCA8_SU8_SUM0_SUS512_VWB2_WG64_4_1_WGM8_WGMXCC8_WGMXCCGn1
    SolutionIndex: 3
    SolutionNameMin: Cijk_Alik_Bljk_F8NBS_STA_BH_BiasSB_HAS_SAB_SAV_UserArgs_MT128x32x512_MI16x16x1_SN_LDSB1_GRVWB16_GSU1_GSUC0_GSUWGMRR0_K1_LBSPPB1024_MIWT2_2_NLCA8_SU8_SUM0_SUS512_VWB2_WG64_4_1_WGM6_WGMXCC8_WGMXCCGn1
    SolutionIndex: 4
    SolutionNameMin: Cijk_Alik_Bljk_F8NBS_STA_BH_BiasSB_HAS_SAB_SAV_UserArgs_MT128x32x512_MI16x16x1_SN_LDSB1_GRVWB16_GSU1_GSUC0_GSUWGMRR0_K1_LBSPPB1024_MIWT2_2_NLCA8_SU8_SUM0_SUS512_VWB2_WG64_4_1_WGM8_WGMXCC8_WGMXCCGn1
    SolutionIndex: 5
    SolutionNameMin: Cijk_Alik_Bljk_F8NBS_STA_BH_BiasSB_HAS_SAB_SAV_UserArgs_MT128x32x512_MI16x16x1_SN_LDSB1_GRVWB16_GSU1_GSUC0_GSUWGMRR0_K1_LBSPPB1024_MIWT2_2_NLCA8_SU0_SUM0_SUS0_VWB2_WG64_4_1_WGM6_WGMXCC8_WGMXCCGn1
    SolutionIndex: 6
    SolutionNameMin: Cijk_Alik_Bljk_F8NBS_STA_BH_BiasSB_HAS_SAB_SAV_UserArgs_MT128x32x512_MI16x16x1_SN_LDSB1_GRVWB16_GSU1_GSUC0_GSUWGMRR0_K1_LBSPPB1024_MIWT2_2_NLCA8_SU0_SUM0_SUS0_VWB2_WG64_4_1_WGM8_WGMXCC8_WGMXCCGn1
    SolutionIndex: 7
    SolutionNameMin: Cijk_Alik_Bljk_F8NBS_STA_BH_BiasSB_HAS_SAB_SAV_UserArgs_MT64x48x512_MI16x16x1_SN_LDSB1_GRVWB16_GSU1_GSUC0_GSUWGMRR0_K1_LBSPPB512_MIWT1_3_NLCA8_SU8_SUM0_SUS512_VWB1_WG64_4_1_WGM6_WGMXCC8_WGMXCCGn1
    SolutionIndex: 8
    SolutionNameMin: Cijk_Alik_Bljk_F8NBS_STA_BH_BiasSB_HAS_SAB_SAV_UserArgs_MT128x64x256_MI16x16x1_SN_LDSB1_GRVWB16_GSU1_GSUC0_GSUWGMRR0_K1_LBSPPB1024_MIWT2_4_NLCA4_SU0_SUM0_SUS0_VWB4_WG64_4_1_WGM8_WGMXCC8_WGMXCCGn1
    SolutionIndex: 9
    SolutionNameMin: Cijk_Alik_Bljk_F8NBS_STA_BH_BiasSB_HAS_SAB_SAV_UserArgs_MT128x48x256_MI16x16x1_SN_LDSB0_GRVWB16_GSU1_GSUC0_GSUWGMRR0_K1_LBSPPB256_MIWT2_3_NLCA4_SU0_SUM0_SUS0_VWB1_WG64_4_1_WGM6_WGMXCC8_WGMXCCGn1
    SolutionIndex: 10
    SolutionNameMin: Cijk_Alik_Bljk_F8NBS_STA_BH_BiasSB_HAS_SAB_SAV_UserArgs_MT128x48x256_MI16x16x1_SN_LDSB0_GRVWB16_GSU1_GSUC0_GSUWGMRR0_K1_LBSPPB256_MIWT2_3_NLCA4_SU0_SUM0_SUS0_VWB1_WG64_4_1_WGM8_WGMXCC8_WGMXCCGn1
    SolutionIndex: 11
    SolutionNameMin: Cijk_Alik_Bljk_F8NBS_STA_BH_BiasSB_HAS_SAB_SAV_UserArgs_MT128x48x256_MI16x16x1_SN_LDSB0_GRVWB16_GSU1_GSUC0_GSUWGMRR0_K1_LBSPPB256_MIWT2_3_NLCA4_SU8_SUM0_SUS256_VWB1_WG64_4_1_WGM6_WGMXCC8_WGMXCCGn1
    SolutionIndex: 12
    SolutionNameMin: Cijk_Alik_Bljk_F8NBS_STA_BH_BiasSB_HAS_SAB_SAV_UserArgs_MT128x64x256_MI16x16x1_SN_LDSB1_GRVWB16_GSU1_GSUC0_GSUWGMRR0_K1_LBSPPB1024_MIWT2_4_NLCA4_SU0_SUM0_SUS0_VWB4_WG64_4_1_WGM6_WGMXCC8_WGMXCCGn1
    SolutionIndex: 13
    SolutionNameMin: Cijk_Alik_Bljk_F8NBS_STA_BH_BiasSB_HAS_SAB_SAV_UserArgs_MT128x64x256_MI16x16x1_SN_LDSB1_GRVWB16_GSU1_GSUC0_GSUWGMRR0_K1_LBSPPB1024_MIWT2_4_NLCA4_SU8_SUM0_SUS256_VWB4_WG64_4_1_WGM8_WGMXCC8_WGMXCCGn1
    SolutionIndex: 14
    SolutionNameMin: Cijk_Alik_Bljk_F8NBS_STA_BH_BiasSB_HAS_SAB_SAV_UserArgs_MT128x80x256_MI16x16x1_SN_LDSB1_GRVWB16_GSU1_GSUC0_GSUWGMRR0_K1_LBSPPB256_MIWT2_5_NLCA4_SU8_SUM0_SUS256_VWB1_WG64_4_1_WGM8_WGMXCC8_WGMXCCGn1
    SolutionIndex: 15
    SolutionNameMin: Cijk_Alik_Bljk_F8NBS_STA_BH_BiasSB_HAS_SAB_SAV_UserArgs_MT128x96x256_MI16x16x1_SN_LDSB1_GRVWB16_GSU1_GSUC0_GSUWGMRR0_K1_LBSPPB512_MIWT2_6_NLCA4_SU0_SUM0_SUS0_VWB2_WG64_4_1_WGM8_WGMXCC8_WGMXCCGn1
    SolutionIndex: 16
    SolutionNameMin: Cijk_Alik_Bljk_F8NBS_STA_BH_BiasSB_HAS_SAB_SAV_UserArgs_MT128x96x256_MI16x16x1_SN_LDSB1_GRVWB16_GSU1_GSUC0_GSUWGMRR0_K1_LBSPPB512_MIWT2_6_NLCA4_SU0_SUM0_SUS0_VWB2_WG64_4_1_WGM6_WGMXCC8_WGMXCCGn1
    SolutionIndex: 17
    SolutionNameMin: Cijk_Alik_Bljk_F8NBS_STA_BH_BiasSB_HAS_SAB_SAV_UserArgs_MT256x64x256_MI16x16x1_SN_LDSB1_GRVWB16_GSU1_GSUC0_GSUWGMRR0_K1_LBSPPB1024_MIWT4_4_NLCA4_SU0_SUM0_SUS0_VWB4_WG64_4_1_WGM8_WGMXCC8_WGMXCCGn1
    SolutionIndex: 18
    SolutionNameMin: Cijk_Alik_Bljk_F8NBS_STA_BH_BiasSB_HAS_SAB_SAV_UserArgs_MT256x64x256_MI16x16x1_SN_LDSB1_GRVWB16_GSU1_GSUC0_GSUWGMRR0_K1_LBSPPB1024_MIWT4_4_NLCA4_SU0_SUM0_SUS0_VWB4_WG64_4_1_WGM6_WGMXCC8_WGMXCCGn1
    SolutionIndex: 19
    SolutionNameMin: Cijk_Alik_Bljk_F8NBS_STA_BH_BiasSB_HAS_SAB_SAV_UserArgs_MT256x64x128_MI16x16x1_SN_LDSB0_GRVWB16_GSU1_GSUC0_GSUWGMRR0_K1_LBSPPB512_MIWT4_4_NLCA2_SU0_SUM0_SUS0_VWB4_WG64_4_1_WGM8_WGMXCC8_WGMXCCGn1
    SolutionIndex: 20
    SolutionNameMin: Cijk_Alik_Bljk_F8NBS_STA_BH_BiasSB_HAS_SAB_SAV_UserArgs_MT192x96x128_MI16x16x1_SN_LDSB0_GRVWB16_GSU1_GSUC0_GSUWGMRR0_K1_LBSPPB256_MIWT3_6_NLCA2_SU0_SUM0_SUS0_VWB2_WG64_4_1_WGM8_WGMXCC8_WGMXCCGn1
    SolutionIndex: 21
    SolutionNameMin: Cijk_Alik_Bljk_F8NBS_STA_BH_BiasSB_HAS_SAB_SAV_UserArgs_MT256x96x128_MI16x16x1_SN_LDSB0_GRVWB16_GSU1_GSUC0_GSUWGMRR0_K1_LBSPPB256_MIWT4_6_NLCA2_SU0_SUM0_SUS0_VWB2_WG64_4_1_WGM6_WGMXCC8_WGMXCCGn1
    SolutionIndex: 22
    SolutionNameMin: Cijk_Alik_Bljk_F8NBS_STA_BH_BiasSB_HAS_SAB_SAV_UserArgs_MT128x160x128_MI16x16x1_SN_LDSB1_GRVWB16_GSU1_GSUC0_GSUWGMRR0_K1_LBSPPB256_MIWT2_10_NLCA2_SU8_SUM0_SUS128_VWB2_WG64_4_1_WGM1_WGMXCC8_WGMXCCGn1
    SolutionIndex: 23
    SolutionNameMin: Cijk_Alik_Bljk_F8NBS_STA_BH_BiasSB_HAS_SAB_SAV_UserArgs_MT128x160x128_MI16x16x1_SN_LDSB1_GRVWB16_GSU1_GSUC0_GSUWGMRR0_K1_LBSPPB256_MIWT2_10_NLCA2_SU0_SUM0_SUS0_VWB2_WG64_4_1_WGM6_WGMXCC8_WGMXCCGn1
    SolutionIndex: 24
    SolutionNameMin: Cijk_Alik_Bljk_F8NBS_STA_BH_BiasSB_HAS_SAB_SAV_UserArgs_MT256x96x128_MI16x16x1_SN_LDSB0_GRVWB16_GSU1_GSUC0_GSUWGMRR0_K1_LBSPPB256_MIWT4_6_NLCA2_SU0_SUM0_SUS0_VWB2_WG64_4_1_WGM8_WGMXCC8_WGMXCCGn1
    SolutionIndex: 25
    SolutionNameMin: Cijk_Alik_Bljk_F8NBS_STA_BH_BiasSB_HAS_SAB_SAV_UserArgs_MT256x96x128_MI16x16x1_SN_LDSB0_GRVWB16_GSU1_GSUC0_GSUWGMRR0_K1_LBSPPB256_MIWT4_6_NLCA2_SU0_SUM0_SUS0_VWB2_WG64_4_1_WGM1_WGMXCC8_WGMXCCGn1
    SolutionIndex: 26
    SolutionNameMin: Cijk_Alik_Bljk_F8NBS_STA_BH_BiasSB_HAS_SAB_SAV_UserArgs_MT256x128x128_MI16x16x1_SN_LDSB1_GRVWB16_GSU1_GSUC0_GSUWGMRR0_K1_LBSPPB1024_MIWT4_8_NLCA2_SU0_SUM0_SUS0_VWB8_WG64_4_1_WGM6_WGMXCC8_WGMXCCGn1
    SolutionIndex: 27
    SolutionNameMin: Cijk_Alik_Bljk_F8NBS_STA_BH_BiasSB_HAS_SAB_SAV_UserArgs_MT192x160x128_MI16x16x1_SN_LDSB1_GRVWB16_GSU1_GSUC0_GSUWGMRR0_K1_LBSPPB256_MIWT3_10_NLCA2_SU0_SUM0_SUS0_VWB2_WG64_4_1_WGM6_WGMXCC8_WGMXCCGn1
    SolutionIndex: 28
    SolutionNameMin: Cijk_Alik_Bljk_F8NBS_STA_BH_BiasSB_HAS_SAB_SAV_UserArgs_MT512x64x128_MI16x16x1_SN_LDSB0_GRVWB16_GSU1_GSUC0_GSUWGMRR0_K1_LBSPPB512_MIWT8_4_NLCA2_SU0_SUM0_SUS0_VWB4_WG64_4_1_WGM1_WGMXCC8_WGMXCCGn1
    SolutionIndex: 29
    SolutionNameMin: Cijk_Alik_Bljk_F8NBS_STA_BH_BiasSB_HAS_SAB_SAV_UserArgs_MT256x128x128_MI16x16x1_SN_LDSB1_GRVWB16_GSU1_GSUC0_GSUWGMRR0_K1_LBSPPB1024_MIWT4_8_NLCA2_SU0_SUM0_SUS0_VWB8_WG64_4_1_WGM8_WGMXCC8_WGMXCCGn1
    SolutionIndex: 30
    SolutionNameMin: Cijk_Alik_Bljk_F8NBS_STA_BH_BiasSB_HAS_SAB_SAV_UserArgs_MT128x64x256_MI16x16x1_SN_LDSB1_GRVWB16_GSU1_GSUC0_GSUWGMRR0_K1_LBSPPB1024_MIWT2_4_NLCA4_SU8_SUM0_SUS256_VWB4_WG64_4_1_WGM6_WGMXCC8_WGMXCCGn1
    SolutionIndex: 31
    SolutionNameMin: Cijk_Alik_Bljk_F8NBS_STA_BH_BiasSB_HAS_SAB_SAV_UserArgs_MT128x48x256_MI16x16x1_SN_LDSB0_GRVWB16_GSU1_GSUC0_GSUWGMRR0_K1_LBSPPB256_MIWT2_3_NLCA4_SU8_SUM0_SUS256_VWB1_WG64_4_1_WGM8_WGMXCC8_WGMXCCGn1
    SolutionIndex: 32
    SolutionNameMin: Cijk_Alik_Bljk_F8NBS_STA_BH_BiasSB_HAS_SAB_SAV_UserArgs_MT128x80x256_MI16x16x1_SN_LDSB1_GRVWB16_GSU1_GSUC0_GSUWGMRR0_K1_LBSPPB256_MIWT2_5_NLCA4_SU0_SUM0_SUS0_VWB1_WG64_4_1_WGM8_WGMXCC8_WGMXCCGn1
    SolutionIndex: 33
    SolutionNameMin: Cijk_Alik_Bljk_F8NBS_STA_BH_BiasSB_HAS_SAB_SAV_UserArgs_MT128x80x256_MI16x16x1_SN_LDSB1_GRVWB16_GSU1_GSUC0_GSUWGMRR0_K1_LBSPPB256_MIWT2_5_NLCA4_SU0_SUM0_SUS0_VWB1_WG64_4_1_WGM6_WGMXCC8_WGMXCCGn1
    SolutionIndex: 34
    SolutionNameMin: Cijk_Alik_Bljk_F8NBS_STA_BH_BiasSB_HAS_SAB_SAV_UserArgs_MT128x96x256_MI16x16x1_SN_LDSB1_GRVWB16_GSU1_GSUC0_GSUWGMRR0_K1_LBSPPB512_MIWT2_6_NLCA4_SU8_SUM0_SUS256_VWB2_WG64_4_1_WGM8_WGMXCC8_WGMXCCGn1
    SolutionIndex: 35
    SolutionNameMin: Cijk_Alik_Bljk_F8NBS_STA_BH_BiasSB_HAS_SAB_SAV_UserArgs_MT128x112x256_MI16x16x1_SN_LDSB1_GRVWB16_GSU1_GSUC0_GSUWGMRR0_K1_LBSPPB256_MIWT2_7_NLCA4_SU8_SUM0_SUS256_VWB1_WG64_4_1_WGM6_WGMXCC8_WGMXCCGn1
    SolutionIndex: 36
    SolutionNameMin: Cijk_Alik_Bljk_F8NBS_STA_BH_BiasSB_HAS_SAB_SAV_UserArgs_MT128x112x256_MI16x16x1_SN_LDSB1_GRVWB16_GSU1_GSUC0_GSUWGMRR0_K1_LBSPPB256_MIWT2_7_NLCA4_SU0_SUM0_SUS0_VWB1_WG64_4_1_WGM6_WGMXCC8_WGMXCCGn1
    SolutionIndex: 37
    SolutionNameMin: Cijk_Alik_Bljk_F8NBS_STA_BH_BiasSB_HAS_SAB_SAV_UserArgs_MT256x80x256_MI16x16x1_SN_LDSB1_GRVWB16_GSU1_GSUC0_GSUWGMRR0_K1_LBSPPB256_MIWT4_5_NLCA4_SU0_SUM0_SUS0_VWB1_WG64_4_1_WGM6_WGMXCC8_WGMXCCGn1
    SolutionIndex: 38
    SolutionNameMin: Cijk_Alik_Bljk_F8NBS_STA_BH_BiasSB_HAS_SAB_SAV_UserArgs_MT320x64x128_MI16x16x1_SN_LDSB0_GRVWB16_GSU1_GSUC0_GSUWGMRR0_K1_LBSPPB512_MIWT5_4_NLCA2_SU8_SUM0_SUS128_VWB4_WG64_4_1_WGM8_WGMXCC8_WGMXCCGn1
    SolutionIndex: 39
    SolutionNameMin: Cijk_Alik_Bljk_F8NBS_STA_BH_BiasSB_HAS_SAB_SAV_UserArgs_MT320x96x128_MI16x16x1_SN_LDSB0_GRVWB16_GSU1_GSUC0_GSUWGMRR0_K1_LBSPPB256_MIWT5_6_NLCA2_SU0_SUM0_SUS0_VWB2_WG64_4_1_WGM8_WGMXCC8_WGMXCCGn1
    SolutionIndex: 40
    SolutionNameMin: Cijk_Alik_Bljk_F8NBS_STA_BH_BiasSB_HAS_SAB_SAV_UserArgs_MT192x160x128_MI16x16x1_SN_LDSB1_GRVWB16_GSU1_GSUC0_GSUWGMRR0_K1_LBSPPB256_MIWT3_10_NLCA2_SU8_SUM0_SUS128_VWB2_WG64_4_1_WGM6_WGMXCC8_WGMXCCGn1
    SolutionIndex: 41
    SolutionNameMin: Cijk_Alik_Bljk_F8NBS_STA_BH_BiasSB_HAS_SAB_SAV_UserArgs_MT256x160x128_MI16x16x1_SN_LDSB0_GRVWB16_GSU1_GSUC0_GSUWGMRR0_K1_LBSPPB256_MIWT4_10_NLCA2_SU0_SUM0_SUS0_VWB2_WG64_4_1_WGM8_WGMXCC8_WGMXCCGn1
    SolutionIndex: 42
    SolutionNameMin: Cijk_Alik_Bljk_F8NBS_STA_BH_BiasSB_HAS_SAB_SAV_UserArgs_MT256x160x128_MI16x16x1_SN_LDSB0_GRVWB16_GSU1_GSUC0_GSUWGMRR0_K1_LBSPPB256_MIWT4_10_NLCA2_SU0_SUM0_SUS0_VWB2_WG64_4_1_WGM6_WGMXCC8_WGMXCCGn1
    SolutionIndex: 43
    SolutionNameMin: Cijk_Alik_Bljk_F8NBS_STA_BH_BiasSB_HAS_SAB_SAV_UserArgs_MT256x192x128_MI16x16x1_SN_LDSB0_GRVWB16_GSU1_GSUC0_GSUWGMRR0_K1_LBSPPB512_MIWT4_12_NLCA2_SU0_SUM0_SUS0_VWB4_WG64_4_1_WGM1_WGMXCC8_WGMXCCGn1
    SolutionIndex: 44
    SolutionNameMin: Cijk_Alik_Bljk_F8NBS_STA_BH_BiasSB_HAS_SAB_SAV_UserArgs_MT256x192x128_MI16x16x1_SN_LDSB0_GRVWB16_GSU1_GSUC0_GSUWGMRR0_K1_LBSPPB512_MIWT4_12_NLCA2_SU0_SUM0_SUS0_VWB4_WG64_4_1_WGM6_WGMXCC8_WGMXCCGn1
    SolutionIndex: 45
    SolutionNameMin: Cijk_Alik_Bljk_F8NBS_STA_BH_BiasSB_HAS_SAB_SAV_UserArgs_MT256x192x128_MI16x16x1_SN_LDSB0_GRVWB16_GSU1_GSUC0_GSUWGMRR0_K1_LBSPPB512_MIWT4_12_NLCA2_SU0_SUM0_SUS0_VWB4_WG64_4_1_WGM8_WGMXCC8_WGMXCCGn1
    SolutionIndex: 46
    SolutionNameMin: Cijk_Alik_Bljk_F8NBS_STA_BH_BiasSB_HAS_SAB_SAV_UserArgs_MT256x224x128_MI16x16x1_SN_LDSB0_GRVWB16_GSU1_GSUC0_GSUWGMRR0_K1_LBSPPB256_MIWT4_14_NLCA2_SU0_SUM0_SUS0_VWB2_WG64_4_1_WGM1_WGMXCC8_WGMXCCGn1
    SolutionIndex: 47
    SolutionNameMin: Cijk_Alik_Bljk_F8NBS_STA_BH_BiasSB_HAS_SAB_SAV_UserArgs_MT384x160x128_MI16x16x1_SN_LDSB0_GRVWB16_GSU1_GSUC0_GSUWGMRR0_K1_LBSPPB256_MIWT6_10_NLCA2_SU0_SUM0_SUS0_VWB2_WG64_4_1_WGM6_WGMXCC8_WGMXCCGn1
    SolutionIndex: 48
    SolutionNameMin: Cijk_Alik_Bljk_F8NBS_STA_BH_BiasSB_HAS_SAB_SAV_UserArgs_MT256x224x128_MI16x16x1_SN_LDSB0_GRVWB16_GSU1_GSUC0_GSUWGMRR0_K1_LBSPPB256_MIWT4_14_NLCA2_SU0_SUM0_SUS0_VWB2_WG64_4_1_WGM6_WGMXCC8_WGMXCCGn1
    SolutionIndex: 49
    SolutionNameMin: Cijk_Alik_Bljk_F8NBS_STA_BH_BiasSB_HAS_SAB_SAV_UserArgs_MT192x80x256_MI16x16x1_SN_LDSB1_GRVWB16_GSU1_GSUC0_GSUWGMRR0_K1_LBSPPB256_MIWT3_5_NLCA4_SU0_SUM0_SUS0_VWB1_WG64_4_1_WGM6_WGMXCC8_WGMXCCGn1
    SolutionIndex: 50
    SolutionNameMin: Cijk_Alik_Bljk_F8NBS_STA_BH_BiasSB_HAS_SAB_SAV_UserArgs_MT320x64x128_MI16x16x1_SN_LDSB0_GRVWB16_GSU1_GSUC0_GSUWGMRR0_K1_LBSPPB512_MIWT5_4_NLCA2_SU0_SUM0_SUS0_VWB4_WG64_4_1_WGM6_WGMXCC8_WGMXCCGn1
    SolutionIndex: 51
    SolutionNameMin: Cijk_Alik_Bljk_F8NBS_STA_BH_BiasSB_HAS_SAB_SAV_UserArgs_MT320x80x128_MI16x16x1_SN_LDSB0_GRVWB8_GSU1_GSUC0_GSUWGMRR0_K1_LBSPPB128_MIWT5_5_NLCA2_SU0_SUM0_SUS0_VWB1_WG64_4_1_WGM6_WGMXCC8_WGMXCCGn1
    SolutionIndex: 52
    SolutionNameMin: Cijk_Alik_Bljk_F8NBS_STA_BH_BiasSB_HAS_SAB_SAV_UserArgs_MT384x64x128_MI16x16x1_SN_LDSB0_GRVWB16_GSU1_GSUC0_GSUWGMRR0_K1_LBSPPB512_MIWT6_4_NLCA2_SU0_SUM0_SUS0_VWB4_WG64_4_1_WGM8_WGMXCC8_WGMXCCGn1
    SolutionIndex: 53
    SolutionNameMin: Cijk_Alik_Bljk_F8NBS_STA_BH_BiasSB_HAS_SAB_SAV_UserArgs_MT320x96x128_MI16x16x1_SN_LDSB0_GRVWB16_GSU1_GSUC0_GSUWGMRR0_K1_LBSPPB256_MIWT5_6_NLCA2_SU0_SUM0_SUS0_VWB2_WG64_4_1_WGM6_WGMXCC8_WGMXCCGn1
    SolutionIndex: 54
    SolutionNameMin: Cijk_Alik_Bljk_F8NBS_STA_BH_BiasSB_HAS_SAB_SAV_UserArgs_MT320x96x128_MI16x16x1_SN_LDSB0_GRVWB16_GSU1_GSUC0_GSUWGMRR0_K1_LBSPPB256_MIWT5_6_NLCA2_SU8_SUM0_SUS128_VWB2_WG64_4_1_WGM8_WGMXCC8_WGMXCCGn1
    SolutionIndex: 55
    SolutionNameMin: Cijk_Alik_Bljk_F8NBS_STA_BH_BiasSB_HAS_SAB_SAV_UserArgs_MT448x64x128_MI16x16x1_SN_LDSB0_GRVWB16_GSU1_GSUC0_GSUWGMRR0_K1_LBSPPB512_MIWT7_4_NLCA2_SU0_SUM0_SUS0_VWB4_WG64_4_1_WGM8_WGMXCC8_WGMXCCGn1
    SolutionIndex: 56
    SolutionNameMin: Cijk_Alik_Bljk_F8NBS_STA_BH_BiasSB_HAS_SAB_SAV_UserArgs_MT192x192x128_MI16x16x1_SN_LDSB0_GRVWB16_GSU1_GSUC0_GSUWGMRR0_K1_LBSPPB512_MIWT3_12_NLCA2_SU0_SUM0_SUS0_VWB4_WG64_4_1_WGM6_WGMXCC8_WGMXCCGn1
    SolutionIndex: 57
    SolutionNameMin: Cijk_Alik_Bljk_F8NBS_STA_BH_BiasSB_HAS_SAB_SAV_UserArgs_MT512x64x128_MI16x16x1_SN_LDSB0_GRVWB16_GSU1_GSUC0_GSUWGMRR0_K1_LBSPPB512_MIWT8_4_NLCA2_SU0_SUM0_SUS0_VWB4_WG64_4_1_WGM6_WGMXCC8_WGMXCCGn1
    SolutionIndex: 58
    SolutionNameMin: Cijk_Alik_Bljk_F8NBS_STA_BH_BiasSB_HAS_SAB_SAV_UserArgs_MT256x160x128_MI16x16x1_SN_LDSB0_GRVWB16_GSU1_GSUC0_GSUWGMRR0_K1_LBSPPB256_MIWT4_10_NLCA2_SU8_SUM0_SUS128_VWB2_WG64_4_1_WGM6_WGMXCC8_WGMXCCGn1
    SolutionIndex: 59
    SolutionNameMin: Cijk_Alik_Bljk_F8NBS_STA_BH_BiasSB_HAS_SAB_SAV_UserArgs_MT192x96x128_MI16x16x1_SN_LDSB0_GRVWB16_GSU1_GSUC0_GSUWGMRR0_K1_LBSPPB256_MIWT3_6_NLCA2_SU0_SUM0_SUS0_VWB2_WG64_4_1_WGM6_WGMXCC8_WGMXCCGn1
    SolutionIndex: 60
    SolutionNameMin: Cijk_Alik_Bljk_F8NBS_STA_BH_BiasSB_HAS_SAB_SAV_UserArgs_MT256x176x128_MI16x16x1_SN_LDSB0_GRVWB8_GSU1_GSUC0_GSUWGMRR0_K1_LBSPPB128_MIWT4_11_NLCA2_SU8_SUM0_SUS128_VWB1_WG64_4_1_WGM8_WGMXCC8_WGMXCCGn1
    SolutionIndex: 61
    SolutionNameMin: Cijk_Alik_Bljk_F8NBS_STA_BH_BiasSB_HAS_SAB_SAV_UserArgs_MT256x192x128_MI16x16x1_SN_LDSB0_GRVWB16_GSU1_GSUC0_GSUWGMRR0_K1_LBSPPB512_MIWT4_12_NLCA2_SU8_SUM0_SUS128_VWB4_WG64_4_1_WGM8_WGMXCC8_WGMXCCGn1
    SolutionIndex: 62
    SolutionNameMin: Cijk_Alik_Bljk_F8NBS_STA_BH_BiasSB_HAS_SAB_SAV_UserArgs_MT320x160x128_MI16x16x1_SN_LDSB0_GRVWB16_GSU1_GSUC0_GSUWGMRR0_K1_LBSPPB256_MIWT5_10_NLCA2_SU0_SUM0_SUS0_VWB2_WG64_4_1_WGM8_WGMXCC8_WGMXCCGn1
    SolutionIndex: 63
    SolutionNameMin: Cijk_Alik_Bljk_F8NBS_STA_BH_BiasSB_HAS_SAB_SAV_UserArgs_MT384x160x128_MI16x16x1_SN_LDSB0_GRVWB16_GSU1_GSUC0_GSUWGMRR0_K1_LBSPPB256_MIWT6_10_NLCA2_SU0_SUM0_SUS0_VWB2_WG64_4_1_WGM8_WGMXCC8_WGMXCCGn1
    SolutionIndex: 64
    SolutionNameMin: Cijk_Alik_Bljk_F8NBS_STA_BH_BiasSB_HAS_SAB_SAV_UserArgs_MT384x144x128_MI16x16x1_SN_LDSB0_GRVWB8_GSU1_GSUC0_GSUWGMRR0_K1_LBSPPB128_MIWT6_9_NLCA2_SU8_SUM0_SUS128_VWB1_WG64_4_1_WGM8_WGMXCC8_WGMXCCGn1
    SolutionIndex: 65
    SolutionNameMin: Cijk_Alik_Bljk_F8NBS_STA_BH_BiasSB_HAS_SAB_SAV_UserArgs_MT448x128x128_MI16x16x1_SN_LDSB0_GRVWB16_GSU1_GSUC0_GSUWGMRR0_K1_LBSPPB1024_MIWT7_8_NLCA2_SU0_SUM0_SUS0_VWB8_WG64_4_1_WGM8_WGMXCC8_WGMXCCGn1
    SolutionIndex: 66
    SolutionNameMin: Cijk_Alik_Bljk_F8NBS_STA_BH_BiasSB_HAS_SAB_SAV_UserArgs_MT512x128x128_MI16x16x1_SN_LDSB0_GRVWB16_GSU1_GSUC0_GSUWGMRR0_K1_LBSPPB1024_MIWT8_8_NLCA2_SU0_SUM0_SUS0_VWB8_WG64_4_1_WGM6_WGMXCC8_WGMXCCGn1
    SolutionIndex: 67
    SolutionNameMin: Cijk_Alik_Bljk_F8NBS_STA_BH_BiasSB_HAS_SAB_SAV_UserArgs_MT192x224x128_MI16x16x1_SN_LDSB0_GRVWB16_GSU1_GSUC0_GSUWGMRR0_K1_LBSPPB256_MIWT3_14_NLCA2_SU8_SUM0_SUS128_VWB2_WG64_4_1_WGM8_WGMXCC8_WGMXCCGn1
    SolutionIndex: 68
    SolutionNameMin: Cijk_Alik_Bljk_F8NBS_STA_BH_BiasSB_HAS_SAB_SAV_UserArgs_MT384x160x128_MI16x16x1_SN_LDSB0_GRVWB16_GSU1_GSUC0_GSUWGMRR0_K1_LBSPPB256_MIWT6_10_NLCA2_SU8_SUM0_SUS128_VWB2_WG64_4_1_WGM8_WGMXCC8_WGMXCCGn1
    SolutionIndex: 69
    SolutionNameMin: Cijk_Alik_Bljk_F8NBS_STA_BH_BiasSB_HAS_SAB_SAV_UserArgs_MT512x128x128_MI16x16x1_SN_LDSB0_GRVWB16_GSU1_GSUC0_GSUWGMRR0_K1_LBSPPB1024_MIWT8_8_NLCA2_SU8_SUM0_SUS128_VWB8_WG64_4_1_WGM8_WGMXCC8_WGMXCCGn1
    SolutionIndex: 70
    SolutionNameMin: Cijk_Alik_Bljk_F8NBS_STA_BH_BiasSB_HAS_SAB_SAV_UserArgs_MT192x64x256_MI16x16x1_SN_LDSB1_GRVWB16_GSU1_GSUC0_GSUWGMRR0_K1_LBSPPB1024_MIWT3_4_NLCA4_SU0_SUM0_SUS0_VWB4_WG64_4_1_WGM8_WGMXCC8_WGMXCCGn1
    SolutionIndex: 71
    SolutionNameMin: Cijk_Alik_Bljk_F8NBS_STA_BH_BiasSB_HAS_SAB_SAV_UserArgs_MT128x112x256_MI16x16x1_SN_LDSB1_GRVWB16_GSU1_GSUC0_GSUWGMRR0_K1_LBSPPB256_MIWT2_7_NLCA4_SU0_SUM0_SUS0_VWB1_WG64_4_1_WGM8_WGMXCC8_WGMXCCGn1
    SolutionIndex: 72
    SolutionNameMin: Cijk_Alik_Bljk_F8NBS_STA_BH_BiasSB_HAS_SAB_SAV_UserArgs_MT128x128x256_MI16x16x1_SN_LDSB1_GRVWB16_GSU1_GSUC0_GSUWGMRR0_K1_LBSPPB2048_MIWT2_8_NLCA4_SU0_SUM0_SUS0_VWB8_WG64_4_1_WGM6_WGMXCC8_WGMXCCGn1
    SolutionIndex: 73
    SolutionNameMin: Cijk_Alik_Bljk_F8NBS_STA_BH_BiasSB_HAS_SAB_SAV_UserArgs_MT320x48x256_MI16x16x1_SN_LDSB0_GRVWB16_GSU1_GSUC0_GSUWGMRR0_K1_LBSPPB256_MIWT5_3_NLCA4_SU0_SUM0_SUS0_VWB1_WG64_4_1_WGM8_WGMXCC8_WGMXCCGn1
    SolutionIndex: 74
    SolutionNameMin: Cijk_Alik_Bljk_F8NBS_STA_BH_BiasSB_HAS_SAB_SAV_UserArgs_MT128x128x256_MI16x16x1_SN_LDSB1_GRVWB16_GSU1_GSUC0_GSUWGMRR0_K1_LBSPPB2048_MIWT2_8_NLCA4_SU0_SUM0_SUS0_VWB8_WG64_4_1_WGM8_WGMXCC8_WGMXCCGn1
    SolutionIndex: 75
    SolutionNameMin: Cijk_Alik_Bljk_F8NBS_STA_BH_BiasSB_HAS_SAB_SAV_UserArgs_MT320x64x128_MI16x16x1_SN_LDSB0_GRVWB16_GSU1_GSUC0_GSUWGMRR0_K1_LBSPPB512_MIWT5_4_NLCA2_SU0_SUM0_SUS0_VWB4_WG64_4_1_WGM8_WGMXCC8_WGMXCCGn1
    SolutionIndex: 76
    SolutionNameMin: Cijk_Alik_Bljk_F8NBS_STA_BH_BiasSB_HAS_SAB_SAV_UserArgs_MT320x80x128_MI16x16x1_SN_LDSB0_GRVWB8_GSU1_GSUC0_GSUWGMRR0_K1_LBSPPB128_MIWT5_5_NLCA2_SU0_SUM0_SUS0_VWB1_WG64_4_1_WGM8_WGMXCC8_WGMXCCGn1
    SolutionIndex: 77
    SolutionNameMin: Cijk_Alik_Bljk_F8NBS_STA_BH_BiasSB_HAS_SAB_SAV_UserArgs_MT192x128x128_MI16x16x1_SN_LDSB1_GRVWB16_GSU1_GSUC0_GSUWGMRR0_K1_LBSPPB1024_MIWT3_8_NLCA2_SU0_SUM0_SUS0_VWB8_WG64_4_1_WGM8_WGMXCC8_WGMXCCGn1
    SolutionIndex: 78
    SolutionNameMin: Cijk_Alik_Bljk_F8NBS_STA_BH_BiasSB_HAS_SAB_SAV_UserArgs_MT320x80x128_MI16x16x1_SN_LDSB0_GRVWB8_GSU1_GSUC0_GSUWGMRR0_K1_LBSPPB128_MIWT5_5_NLCA2_SU8_SUM0_SUS128_VWB1_WG64_4_1_WGM8_WGMXCC8_WGMXCCGn1
    SolutionIndex: 79
    SolutionNameMin: Cijk_Alik_Bljk_F8NBS_STA_BH_BiasSB_HAS_SAB_SAV_UserArgs_MT256x128x128_MI16x16x1_SN_LDSB1_GRVWB16_GSU1_GSUC0_GSUWGMRR0_K1_LBSPPB1024_MIWT4_8_NLCA2_SU8_SUM0_SUS128_VWB8_WG64_4_1_WGM6_WGMXCC8_WGMXCCGn1
    SolutionIndex: 80
    SolutionNameMin: Cijk_Alik_Bljk_F8NBS_STA_BH_BiasSB_HAS_SAB_SAV_UserArgs_MT256x112x128_MI16x16x1_SN_LDSB1_GRVWB8_GSU1_GSUC0_GSUWGMRR0_K1_LBSPPB128_MIWT4_7_NLCA2_SU0_SUM0_SUS0_VWB1_WG64_4_1_WGM6_WGMXCC8_WGMXCCGn1
    SolutionIndex: 81
    SolutionNameMin: Cijk_Alik_Bljk_F8NBS_STA_BH_BiasSB_HAS_SAB_SAV_UserArgs_MT320x112x128_MI16x16x1_SN_LDSB0_GRVWB8_GSU1_GSUC0_GSUWGMRR0_K1_LBSPPB128_MIWT5_7_NLCA2_SU0_SUM0_SUS0_VWB1_WG64_4_1_WGM8_WGMXCC8_WGMXCCGn1
    SolutionIndex: 82
    SolutionNameMin: Cijk_Alik_Bljk_F8NBS_STA_BH_BiasSB_HAS_SAB_SAV_UserArgs_MT320x112x128_MI16x16x1_SN_LDSB0_GRVWB8_GSU1_GSUC0_GSUWGMRR0_K1_LBSPPB128_MIWT5_7_NLCA2_SU0_SUM0_SUS0_VWB1_WG64_4_1_WGM6_WGMXCC8_WGMXCCGn1
    SolutionIndex: 83
    SolutionNameMin: Cijk_Alik_Bljk_F8NBS_STA_BH_BiasSB_HAS_SAB_SAV_UserArgs_MT320x128x128_MI16x16x1_SN_LDSB0_GRVWB16_GSU1_GSUC0_GSUWGMRR0_K1_LBSPPB1024_MIWT5_8_NLCA2_SU0_SUM0_SUS0_VWB8_WG64_4_1_WGM6_WGMXCC8_WGMXCCGn1
    SolutionIndex: 84
    SolutionNameMin: Cijk_Alik_Bljk_F8NBS_STA_BH_BiasSB_HAS_SAB_SAV_UserArgs_MT192x256x128_MI16x16x1_SN_LDSB1_GRVWB16_GSU1_GSUC0_GSUWGMRR0_K1_LBSPPB2048_MIWT3_16_NLCA2_SU0_SUM0_SUS0_VWB16_WG64_4_1_WGM6_WGMXCC8_WGMXCCGn1
    SolutionIndex: 85
    SolutionNameMin: Cijk_Alik_Bljk_F8NBS_STA_BH_BiasSB_HAS_SAB_SAV_UserArgs_MT320x144x128_MI16x16x1_SN_LDSB0_GRVWB8_GSU1_GSUC0_GSUWGMRR0_K1_LBSPPB128_MIWT5_9_NLCA2_SU0_SUM0_SUS0_VWB1_WG64_4_1_WGM6_WGMXCC8_WGMXCCGn1
    SolutionIndex: 86
    SolutionNameMin: Cijk_Alik_Bljk_F8NBS_STA_BH_BiasSB_HAS_SAB_SAV_UserArgs_MT320x176x128_MI16x16x1_SN_LDSB0_GRVWB8_GSU1_GSUC0_GSUWGMRR0_K1_LBSPPB128_MIWT5_11_NLCA2_SU8_SUM0_SUS128_VWB1_WG64_4_1_WGM8_WGMXCC8_WGMXCCGn1
    SolutionIndex: 87
    SolutionNameMin: Cijk_Alik_Bljk_F8NBS_STA_BH_BiasSB_HAS_SAB_SAV_UserArgs_MT256x256x128_MI16x16x1_SN_LDSB1_GRVWB16_GSU1_GSUC0_GSUWGMRR0_K1_LBSPPB2048_MIWT4_16_NLCA2_SU0_SUM0_SUS0_VWB16_WG64_4_1_WGM6_WGMXCC8_WGMXCCGn1
    SolutionIndex: 88
    SolutionNameMin: Cijk_Alik_Bljk_F8NBS_STA_BH_BiasSB_HAS_SAB_SAV_UserArgs_MT320x176x128_MI16x16x1_SN_LDSB0_GRVWB8_GSU1_GSUC0_GSUWGMRR0_K1_LBSPPB128_MIWT5_11_NLCA2_SU8_SUM0_SUS128_VWB1_WG64_4_1_WGM6_WGMXCC8_WGMXCCGn1
    SolutionIndex: 89
    SolutionNameMin: Cijk_Alik_Bljk_F8NBS_STA_BH_BiasSB_HAS_SAB_SAV_UserArgs_MT256x256x128_MI16x16x1_SN_LDSB1_GRVWB16_GSU1_GSUC0_GSUWGMRR0_K1_LBSPPB2048_MIWT4_16_NLCA2_SU8_SUM0_SUS128_VWB16_WG64_4_1_WGM8_WGMXCC8_WGMXCCGn1
    SolutionIndex: 90
    SolutionNameMin: Cijk_Alik_Bljk_F8NBS_STA_BH_BiasSB_HAS_SAB_SAV_UserArgs_MT256x256x128_MI16x16x1_SN_LDSB1_GRVWB16_GSU1_GSUC0_GSUWGMRR0_K1_LBSPPB2048_MIWT4_16_NLCA2_SU8_SUM0_SUS128_VWB16_WG64_4_1_WGM6_WGMXCC8_WGMXCCGn1
    SolutionIndex: 91
    SolutionNameMin: Cijk_Alik_Bljk_F8NBS_STA_BH_BiasSB_HAS_SAB_SAV_UserArgs_MT256x256x128_MI16x16x1_SN_LDSB1_GRVWB16_GSU1_GSUC0_GSUWGMRR0_K1_LBSPPB2048_MIWT4_16_NLCA2_SU0_SUM0_SUS0_VWB16_WG64_4_1_WGM8_WGMXCC8_WGMXCCGn1
    SolutionIndex: 92
    SolutionNameMin: Cijk_Alik_Bljk_F8NBS_STA_BH_BiasSB_HAS_SAB_SAV_UserArgs_MT128x80x256_MI16x16x1_SN_LDSB1_GRVWB16_GSU1_GSUC0_GSUWGMRR0_K1_LBSPPB256_MIWT2_5_NLCA4_SU8_SUM0_SUS256_VWB1_WG64_4_1_WGM6_WGMXCC8_WGMXCCGn1
    SolutionIndex: 93
    SolutionNameMin: Cijk_Alik_Bljk_F8NBS_STA_BH_BiasSB_HAS_SAB_SAV_UserArgs_MT192x48x256_MI16x16x1_SN_LDSB0_GRVWB16_GSU1_GSUC0_GSUWGMRR0_K1_LBSPPB256_MIWT3_3_NLCA4_SU0_SUM0_SUS0_VWB1_WG64_4_1_WGM6_WGMXCC8_WGMXCCGn1
    SolutionIndex: 94
    SolutionNameMin: Cijk_Alik_Bljk_F8NBS_STA_BH_BiasSB_HAS_SAB_SAV_UserArgs_MT128x128x256_MI16x16x1_SN_LDSB1_GRVWB16_GSU1_GSUC0_GSUWGMRR0_K1_LBSPPB2048_MIWT2_8_NLCA4_SU8_SUM0_SUS256_VWB8_WG64_4_1_WGM8_WGMXCC8_WGMXCCGn1
    SolutionIndex: 95
    SolutionNameMin: Cijk_Alik_Bljk_F8NBS_STA_BH_BiasSB_HAS_SAB_SAV_UserArgs_MT128x112x256_MI16x16x1_SN_LDSB1_GRVWB16_GSU1_GSUC0_GSUWGMRR0_K1_LBSPPB256_MIWT2_7_NLCA4_SU8_SUM0_SUS256_VWB1_WG64_4_1_WGM8_WGMXCC8_WGMXCCGn1
    SolutionIndex: 96
    SolutionNameMin: Cijk_Alik_Bljk_F8NBS_STA_BH_BiasSB_HAS_SAB_SAV_UserArgs_MT128x64x128_MI16x16x1_SN_LDSB0_GRVWB16_GSU1_GSUC0_GSUWGMRR0_K1_LBSPPB512_MIWT2_4_NLCA2_SU8_SUM0_SUS128_VWB4_WG64_4_1_WGM8_WGMXCC8_WGMXCCGn1
    SolutionIndex: 97
    SolutionNameMin: Cijk_Alik_Bljk_F8NBS_STA_BH_BiasSB_HAS_SAB_SAV_UserArgs_MT320x48x256_MI16x16x1_SN_LDSB0_GRVWB16_GSU1_GSUC0_GSUWGMRR0_K1_LBSPPB256_MIWT5_3_NLCA4_SU0_SUM0_SUS0_VWB1_WG64_4_1_WGM6_WGMXCC8_WGMXCCGn1
    SolutionIndex: 98
    SolutionNameMin: Cijk_Alik_Bljk_F8NBS_STA_BH_BiasSB_HAS_SAB_SAV_UserArgs_MT128x128x128_MI16x16x1_SN_LDSB1_GRVWB16_GSU1_GSUC0_GSUWGMRR0_K1_LBSPPB1024_MIWT2_8_NLCA2_SU8_SUM0_SUS128_VWB8_WG64_4_1_WGM8_WGMXCC8_WGMXCCGn1
    SolutionIndex: 99
    SolutionNameMin: Cijk_Alik_Bljk_F8NBS_STA_BH_BiasSB_HAS_SAB_SAV_UserArgs_MT128x96x128_MI16x16x1_SN_LDSB0_GRVWB16_GSU1_GSUC0_GSUWGMRR0_K1_LBSPPB256_MIWT2_6_NLCA2_SU8_SUM0_SUS128_VWB2_WG64_4_1_WGM8_WGMXCC8_WGMXCCGn1
    SolutionIndex: 100
    SolutionNameMin: Cijk_Alik_Bljk_F8NBS_STA_BH_BiasSB_HAS_SAB_SAV_UserArgs_MT320x128x128_MI16x16x1_SN_LDSB0_GRVWB16_GSU1_GSUC0_GSUWGMRR0_K1_LBSPPB1024_MIWT5_8_NLCA2_SU0_SUM0_SUS0_VWB8_WG64_4_1_WGM8_WGMXCC8_WGMXCCGn1
    SolutionIndex: 101
    SolutionNameMin: Cijk_Alik_Bljk_F8NBS_STA_BH_BiasSB_HAS_SAB_SAV_UserArgs_MT320x192x128_MI16x16x1_SN_LDSB0_GRVWB16_GSU1_GSUC0_GSUWGMRR0_K1_LBSPPB512_MIWT5_12_NLCA2_SU0_SUM0_SUS0_VWB4_WG64_4_1_WGM6_WGMXCC8_WGMXCCGn1
    SolutionIndex: 102
    SolutionNameMin: Cijk_Alik_Bljk_F8NBS_STA_BH_BiasSB_HAS_SAB_SAV_UserArgs_MT320x208x128_MI16x16x1_SN_LDSB1_GRVWB8_GSU1_GSUC0_GSUWGMRR0_K1_LBSPPB128_MIWT5_13_NLCA2_SU0_SUM0_SUS0_VWB1_WG64_4_1_WGM6_WGMXCC8_WGMXCCGn1
    SolutionIndex: 103
    SolutionNameMin: Cijk_Alik_Bljk_F8NBS_STA_BH_BiasSB_HAS_SAB_SAV_UserArgs_MT320x192x128_MI16x16x1_SN_LDSB0_GRVWB16_GSU1_GSUC0_GSUWGMRR0_K1_LBSPPB512_MIWT5_12_NLCA2_SU0_SUM0_SUS0_VWB4_WG64_4_1_WGM8_WGMXCC8_WGMXCCGn1
    SolutionIndex: 104
    SolutionNameMin: Cijk_Alik_Bljk_F8NBS_STA_BH_BiasSB_HAS_SAB_SAV_UserArgs_MT512x128x128_MI16x16x1_SN_LDSB0_GRVWB16_GSU1_GSUC0_GSUWGMRR0_K1_LBSPPB1024_MIWT8_8_NLCA2_SU0_SUM0_SUS0_VWB8_WG64_4_1_WGM1_WGMXCC8_WGMXCCGn1
    SolutionIndex: 105
    SolutionNameMin: Cijk_Alik_Bljk_F8NBS_STA_BH_BiasSB_HAS_SAB_SAV_UserArgs_MT256x256x128_MI16x16x1_SN_LDSB1_GRVWB16_GSU1_GSUC0_GSUWGMRR0_K1_LBSPPB2048_MIWT4_16_NLCA2_SU0_SUM0_SUS0_VWB16_WG64_4_1_WGM1_WGMXCC8_WGMXCCGn1
    SolutionIndex: 106
    SolutionNameMin: Cijk_Alik_Bljk_F8NBS_STA_BH_BiasSB_HAS_SAB_SAV_UserArgs_MT192x128x128_MI16x16x1_SN_LDSB1_GRVWB16_GSU1_GSUC0_GSUWGMRR0_K1_LBSPPB1024_MIWT3_8_NLCA2_SU0_SUM0_SUS0_VWB8_WG64_4_1_WGM6_WGMXCC8_WGMXCCGn1
    SolutionIndex: 107
    SolutionNameMin: Cijk_Alik_Bljk_F8NBS_STA_BH_BiasSB_HAS_SAB_SAV_UserArgs_MT64x32x512_MI16x16x1_SN_LDSB1_GRVWB16_GSU1_GSUAMB_GSUC1_GSUWGMRR1_K1_LBSPPB1024_MIWT1_2_NTA0_NLCA8_SU0_SUM0_SUS0_VWB2_WG64_4_1_WGM1_WGMXCC8_WGMXCCGn1
    SolutionIndex: 108
    SolutionNameMin: Cijk_Alik_Bljk_F8NBS_STA_BH_BiasSB_HAS_SAB_SAV_UserArgs_MT128x32x512_MI16x16x1_SN_LDSB1_GRVWB16_GSU1_GSUAMB_GSUC1_GSUWGMRR1_K1_LBSPPB1024_MIWT2_2_NTA0_NLCA8_SU0_SUM0_SUS0_VWB2_WG64_4_1_WGM1_WGMXCC8_WGMXCCGn1
    SolutionIndex: 109
    SolutionNameMin: Cijk_Alik_Bljk_F8NBS_STA_BH_BiasSB_HAS_SAB_SAV_UserArgs_MT128x32x256_MI16x16x1_SN_LDSB0_GRVWB16_GSU1_GSUAMB_GSUC1_GSUWGMRR1_K1_LBSPPB512_MIWT2_2_NTA0_NLCA4_SU0_SUM0_SUS0_VWB2_WG64_4_1_WGM1_WGMXCC8_WGMXCCGn1
    SolutionIndex: 110
    SolutionNameMin: Cijk_Alik_Bljk_F8NBS_STA_BH_BiasSB_HAS_SAB_SAV_UserArgs_MT64x32x512_MI16x16x1_SN_LDSB1_GRVWB16_GSU1_GSUC0_GSUWGMRR0_K1_LBSPPB1024_MIWT2_2_NLCA8_SU0_SUM0_SUS0_VWB2_WG32_4_1_WGM8_WGMXCC8_WGMXCCGn1
    SolutionIndex: 111
    SolutionNameMin: Cijk_Alik_Bljk_F8NBS_STA_BH_BiasSB_HAS_SAB_SAV_UserArgs_MT128x32x512_MI16x16x1_SN_LDSB1_GRVWB16_GSU1_GSUC0_GSUWGMRR0_K1_LBSPPB1024_MIWT2_2_NLCA8_SU0_SUM0_SUS0_VWB2_WG64_4_1_WGM1_WGMXCC8_WGMXCCGn1
    SolutionIndex: 112
    SolutionNameMin: Cijk_Alik_Bljk_F8NBS_STA_BH_BiasSB_HAS_SAB_SAV_UserArgs_MT128x48x256_MI16x16x1_SN_LDSB0_GRVWB16_GSU1_GSUC0_GSUWGMRR0_K1_LBSPPB256_MIWT2_3_NLCA4_SU8_SUM0_SUS256_VWB1_WG64_4_1_WGM1_WGMXCC8_WGMXCCGn1
    SolutionIndex: 113
    SolutionNameMin: Cijk_Alik_Bljk_F8NBS_STA_BH_BiasSB_HAS_SAB_SAV_UserArgs_MT128x64x256_MI16x16x1_SN_LDSB1_GRVWB16_GSU1_GSUC0_GSUWGMRR0_K1_LBSPPB1024_MIWT2_4_NLCA4_SU8_SUM0_SUS256_VWB4_WG64_4_1_WGM1_WGMXCC8_WGMXCCGn1
    SolutionIndex: 114
    SolutionNameMin: Cijk_Alik_Bljk_F8NBS_STA_BH_BiasSB_HAS_SAB_SAV_UserArgs_MT128x48x256_MI16x16x1_SN_LDSB0_GRVWB16_GSU1_GSUC0_GSUWGMRR0_K1_LBSPPB256_MIWT2_3_NLCA4_SU0_SUM0_SUS0_VWB1_WG64_4_1_WGM1_WGMXCC8_WGMXCCGn1
    SolutionIndex: 115
    SolutionNameMin: Cijk_Alik_Bljk_F8NBS_STA_BH_BiasSB_HAS_SAB_SAV_UserArgs_MT128x64x256_MI16x16x1_SN_LDSB1_GRVWB16_GSU1_GSUC0_GSUWGMRR0_K1_LBSPPB1024_MIWT2_4_NLCA4_SU0_SUM0_SUS0_VWB4_WG64_4_1_WGM1_WGMXCC8_WGMXCCGn1
    SolutionIndex: 116
    SolutionNameMin: Cijk_Alik_Bljk_F8NBS_STA_BH_BiasSB_HAS_SAB_SAV_UserArgs_MT128x80x256_MI16x16x1_SN_LDSB1_GRVWB16_GSU1_GSUC0_GSUWGMRR0_K1_LBSPPB256_MIWT2_5_NLCA4_SU0_SUM0_SUS0_VWB1_WG64_4_1_WGM1_WGMXCC8_WGMXCCGn1
    SolutionIndex: 117
    SolutionNameMin: Cijk_Alik_Bljk_F8NBS_STA_BH_BiasSB_HAS_SAB_SAV_UserArgs_MT128x96x256_MI16x16x1_SN_LDSB1_GRVWB16_GSU1_GSUC0_GSUWGMRR0_K1_LBSPPB512_MIWT2_6_NLCA4_SU8_SUM0_SUS256_VWB2_WG64_4_1_WGM1_WGMXCC8_WGMXCCGn1
    SolutionIndex: 118
    SolutionNameMin: Cijk_Alik_Bljk_F8NBS_STA_BH_BiasSB_HAS_SAB_SAV_UserArgs_MT128x96x256_MI16x16x1_SN_LDSB1_GRVWB16_GSU1_GSUC0_GSUWGMRR0_K1_LBSPPB512_MIWT2_6_NLCA4_SU0_SUM0_SUS0_VWB2_WG64_4_1_WGM1_WGMXCC8_WGMXCCGn1
    SolutionIndex: 119
    SolutionNameMin: Cijk_Alik_Bljk_F8NBS_STA_BH_BiasSB_HAS_SAB_SAV_UserArgs_MT128x96x256_MI16x16x1_SN_LDSB1_GRVWB16_GSU1_GSUC0_GSUWGMRR0_K1_LBSPPB512_MIWT2_6_NLCA4_SU8_SUM0_SUS256_VWB2_WG64_4_1_WGM6_WGMXCC8_WGMXCCGn1
    SolutionIndex: 120
    SolutionNameMin: Cijk_Alik_Bljk_F8NBS_STA_BH_BiasSB_HAS_SAB_SAV_UserArgs_MT128x112x256_MI16x16x1_SN_LDSB1_GRVWB16_GSU1_GSUC0_GSUWGMRR0_K1_LBSPPB256_MIWT2_7_NLCA4_SU8_SUM0_SUS256_VWB1_WG64_4_1_WGM1_WGMXCC8_WGMXCCGn1
    SolutionIndex: 121
    SolutionNameMin: Cijk_Alik_Bljk_F8NBS_STA_BH_BiasSB_HAS_SAB_SAV_UserArgs_MT256x64x256_MI16x16x1_SN_LDSB1_GRVWB16_GSU1_GSUC0_GSUWGMRR0_K1_LBSPPB1024_MIWT4_4_NLCA4_SU0_SUM0_SUS0_VWB4_WG64_4_1_WGM1_WGMXCC8_WGMXCCGn1
    SolutionIndex: 122
    SolutionNameMin: Cijk_Alik_Bljk_F8NBS_STA_BH_BiasSB_HAS_SAB_SAV_UserArgs_MT128x32x256_MI16x16x1_SN_LDSB0_GRVWB16_GSU1_GSUC0_GSUWGMRR0_K1_LBSPPB512_MIWT2_2_NLCA4_SU0_SUM0_SUS0_VWB2_WG64_4_1_WGM8_WGMXCC8_WGMXCCGn1
    SolutionIndex: 123
    SolutionNameMin: Cijk_Alik_Bljk_F8NBS_STA_BH_Bias_HAS_SAB_SAVUserArgs_MT32x16x1024_MI16x16x1_SN_LDSB1_GRVWB16_GSU1_GSUC0_GSUWGMRR0_K1_LBSPPB1024_MIWT1_1_NTA4_NLCA16_SU0_SUM0_SUS1024_VWB1_WG32_4_1_WGM1_WGMXCC8_WGMXCCGn1
    SolutionIndex: 124
    SolutionNameMin: Cijk_Alik_Bljk_F8NBS_STA_BH_Bias_HAS_SAB_SAVUserArgs_MT32x16x1024_MI16x16x1_SN_LDSB1_GRVWB16_GSU1_GSUC0_GSUWGMRR0_K1_LBSPPB1024_MIWT1_1_NTA0_NLCA16_SU8_SUM0_SUS1024_VWB1_WG32_4_1_WGM1_WGMXCC8_WGMXCCGn1
    SolutionIndex: 125
    SolutionNameMin: Cijk_Alik_Bljk_F8NBS_STA_BH_Bias_HAS_SAB_SAVUserArgs_MT32x16x1024_MI16x16x1_SN_LDSB1_GRVWB16_GSU1_GSUC0_GSUWGMRR0_K1_LBSPPB1024_MIWT1_1_NTA0_NLCA16_SU8_SUM0_SUS1024_VWB1_WG32_4_1_WGM8_WGMXCC8_WGMXCCGn1
    SolutionIndex: 126
    SolutionNameMin: Cijk_Alik_Bljk_F8NBS_STA_BH_Bias_HAS_SAB_SAVUserArgs_MT32x16x1024_MI16x16x1_SN_LDSB1_GRVWB16_GSU1_GSUC0_GSUWGMRR0_K1_LBSPPB1024_MIWT1_1_NTA0_NLCA16_SU0_SUM0_SUS1024_VWB1_WG32_4_1_WGM8_WGMXCC8_WGMXCCGn1
    SolutionIndex: 127
    SolutionNameMin: Cijk_Alik_Bljk_F8NBS_STA_BH_Bias_HAS_SAB_SAVUserArgs_MT64x16x1024_MI16x16x1_SN_LDSB1_GRVWB16_GSU1_GSUC0_GSUWGMRR0_K1_LBSPPB1024_MIWT1_1_NTA0_NLCA16_SU8_SUM0_SUS1024_VWB1_WG64_4_1_WGM8_WGMXCC8_WGMXCCGn1
    SolutionIndex: 128
    SolutionNameMin: Cijk_Alik_Bljk_F8NBS_STA_BH_Bias_HAS_SAB_SAVUserArgs_MT64x16x512_MI16x16x1_SN_LDSB0_GRVWB16_GSU1_GSUC0_GSUWGMRR0_K1_LBSPPB512_MIWT1_1_NTA0_NLCA8_SU8_SUM0_SUS512_VWB1_WG64_4_1_WGM8_WGMXCC8_WGMXCCGn1
    SolutionIndex: 129
    SolutionNameMin: Cijk_Alik_Bljk_F8NBS_STA_BH_Bias_HAS_SAB_SAVUserArgs_MT64x16x512_MI16x16x1_SN_LDSB0_GRVWB16_GSU1_GSUC0_GSUWGMRR0_K1_LBSPPB512_MIWT1_1_NTA0_NLCA8_SU0_SUM0_SUS512_VWB1_WG64_4_1_WGM8_WGMXCC8_WGMXCCGn1
    SolutionIndex: 130
    SolutionNameMin: Cijk_Alik_Bljk_F8NBS_STA_BH_Bias_HAS_SAB_SAVUserArgs_MT64x32x512_MI16x16x1_SN_LDSB1_GRVWB16_GSU1_GSUC0_GSUWGMRR0_K1_LBSPPB1024_MIWT1_2_NTA0_NLCA8_SU8_SUM0_SUS512_VWB2_WG64_4_1_WGM8_WGMXCC8_WGMXCCGn1
    SolutionIndex: 131
    SolutionNameMin: Cijk_Alik_Bljk_F8NBS_STA_BH_Bias_HAS_SAB_SAVUserArgs_MT32x16x1024_MI16x16x1_SN_LDSB1_GRVWB16_GSU1_GSUC0_GSUWGMRR0_K1_LBSPPB1024_MIWT1_1_NTA4_NLCA16_SU0_SUM0_SUS1024_VWB1_WG32_4_1_WGM8_WGMXCC8_WGMXCCGn1
    SolutionIndex: 132
    SolutionNameMin: Cijk_Alik_Bljk_F8NBS_STA_BH_Bias_HAS_SAB_SAVUserArgs_MT64x16x512_MI16x16x1_SN_LDSB0_GRVWB16_GSU1_GSUC0_GSUWGMRR0_K1_LBSPPB512_MIWT1_1_NTA4_NLCA8_SU0_SUM0_SUS512_VWB1_WG64_4_1_WGM8_WGMXCC8_WGMXCCGn1
    SolutionIndex: 133
    SolutionNameMin: Cijk_Alik_Bljk_F8NBS_STA_BH_Bias_HAS_SAB_SAVUserArgs_MT64x32x512_MI16x16x1_SN_LDSB1_GRVWB16_GSU1_GSUC0_GSUWGMRR0_K1_LBSPPB1024_MIWT1_2_NTA4_NLCA8_SU0_SUM0_SUS512_VWB2_WG64_4_1_WGM8_WGMXCC8_WGMXCCGn1
    SolutionIndex: 134
    SolutionNameMin: Cijk_Alik_Bljk_F8NBS_STA_BH_Bias_HAS_SAB_SAVUserArgs_MT64x48x512_MI16x16x1_SN_LDSB1_GRVWB16_GSU1_GSUC0_GSUWGMRR0_K1_LBSPPB512_MIWT1_3_NTA0_NLCA8_SU8_SUM0_SUS512_VWB1_WG64_4_1_WGM8_WGMXCC8_WGMXCCGn1
    SolutionIndex: 135
    SolutionNameMin: Cijk_Alik_Bljk_F8NBS_STA_BH_Bias_HAS_SAB_SAVUserArgs_MT128x32x512_MI16x16x1_SN_LDSB1_GRVWB16_GSU1_GSUC0_GSUWGMRR0_K1_LBSPPB1024_MIWT2_2_NTA0_NLCA8_SU8_SUM0_SUS512_VWB2_WG64_4_1_WGM8_WGMXCC8_WGMXCCGn1
    SolutionIndex: 136
    SolutionNameMin: Cijk_Alik_Bljk_F8NBS_STA_BH_Bias_HAS_SAB_SAVUserArgs_MT64x48x512_MI16x16x1_SN_LDSB1_GRVWB16_GSU1_GSUC0_GSUWGMRR0_K1_LBSPPB512_MIWT1_3_NTA4_NLCA8_SU0_SUM0_SUS512_VWB1_WG64_4_1_WGM8_WGMXCC8_WGMXCCGn1
    SolutionIndex: 137
    SolutionNameMin: Cijk_Alik_Bljk_F8NBS_STA_BH_Bias_HAS_SAB_SAVUserArgs_MT128x32x512_MI16x16x1_SN_LDSB1_GRVWB16_GSU1_GSUC0_GSUWGMRR0_K1_LBSPPB1024_MIWT2_2_NTA0_NLCA8_SU0_SUM0_SUS512_VWB2_WG64_4_1_WGM8_WGMXCC8_WGMXCCGn1
    SolutionIndex: 138
    SolutionNameMin: Cijk_Alik_Bljk_F8NBS_STA_BH_Bias_HAS_SAB_SAVUserArgs_MT32x16x1024_MI16x16x1_SN_LDSB1_GRVWB16_GSU1_GSUC0_GSUWGMRR0_K1_LBSPPB1024_MIWT1_1_NTA4_NLCA16_SU8_SUM0_SUS1024_VWB1_WG32_4_1_WGM1_WGMXCC8_WGMXCCGn1
    SolutionIndex: 139
    SolutionNameMin: Cijk_Alik_Bljk_F8NBS_STA_BH_Bias_HAS_SAB_SAVUserArgs_MT64x32x512_MI16x16x1_SN_LDSB1_GRVWB16_GSU1_GSUC0_GSUWGMRR0_K1_LBSPPB1024_MIWT1_2_NTA0_NLCA8_SU0_SUM0_SUS512_VWB2_WG64_4_1_WGM8_WGMXCC8_WGMXCCGn1
    SolutionIndex: 140
    SolutionNameMin: Cijk_Alik_Bljk_F8NBS_STA_BH_Bias_HAS_SAB_SAVUserArgs_MT128x32x512_MI16x16x1_SN_LDSB1_GRVWB16_GSU1_GSUC0_GSUWGMRR0_K1_LBSPPB1024_MIWT2_2_NTA4_NLCA8_SU0_SUM0_SUS512_VWB2_WG64_4_1_WGM8_WGMXCC8_WGMXCCGn1
    SolutionIndex: 141
    SolutionNameMin: Cijk_Alik_Bljk_F8NBS_STA_BH_Bias_HAS_SAB_SAVUserArgs_MT128x48x256_MI16x16x1_SN_LDSB0_GRVWB16_GSU1_GSUC0_GSUWGMRR0_K1_LBSPPB256_MIWT2_3_NTA4_NLCA4_SU0_SUM0_SUS256_VWB1_WG64_4_1_WGM8_WGMXCC8_WGMXCCGn1
    SolutionIndex: 142
    SolutionNameMin: Cijk_Alik_Bljk_F8NBS_STA_BH_Bias_HAS_SAB_SAVUserArgs_MT128x48x256_MI16x16x1_SN_LDSB0_GRVWB16_GSU1_GSUC0_GSUWGMRR0_K1_LBSPPB256_MIWT2_3_NTA0_NLCA4_SU0_SUM0_SUS256_VWB1_WG64_4_1_WGM8_WGMXCC8_WGMXCCGn1
    SolutionIndex: 143
    SolutionNameMin: Cijk_Alik_Bljk_F8NBS_STA_BH_Bias_HAS_SAB_SAVUserArgs_MT128x64x256_MI16x16x1_SN_LDSB1_GRVWB16_GSU1_GSUC0_GSUWGMRR0_K1_LBSPPB1024_MIWT2_4_NTA4_NLCA4_SU0_SUM0_SUS256_VWB4_WG64_4_1_WGM8_WGMXCC8_WGMXCCGn1
    SolutionIndex: 144
    SolutionNameMin: Cijk_Alik_Bljk_F8NBS_STA_BH_Bias_HAS_SAB_SAVUserArgs_MT64x16x512_MI16x16x1_SN_LDSB0_GRVWB16_GSU1_GSUC0_GSUWGMRR0_K1_LBSPPB512_MIWT1_1_NTA4_NLCA8_SU8_SUM0_SUS512_VWB1_WG64_4_1_WGM1_WGMXCC8_WGMXCCGn1
    SolutionIndex: 145
    SolutionNameMin: Cijk_Alik_Bljk_F8NBS_STA_BH_Bias_HAS_SAB_SAVUserArgs_MT64x32x256_MI16x16x1_SN_LDSB0_GRVWB16_GSU1_GSUC0_GSUWGMRR0_K1_LBSPPB512_MIWT1_2_NTA4_NLCA4_SU8_SUM0_SUS256_VWB2_WG64_4_1_WGM1_WGMXCC8_WGMXCCGn1
    SolutionIndex: 146
    SolutionNameMin: Cijk_Alik_Bljk_F8NBS_STA_BH_Bias_HAS_SAB_SAVUserArgs_MT64x48x256_MI16x16x1_SN_LDSB0_GRVWB16_GSU1_GSUC0_GSUWGMRR0_K1_LBSPPB256_MIWT1_3_NTA4_NLCA4_SU0_SUM0_SUS256_VWB1_WG64_4_1_WGM1_WGMXCC8_WGMXCCGn1
    SolutionIndex: 147
    SolutionNameMin: Cijk_Alik_Bljk_F8NBS_STA_BH_Bias_HAS_SAB_SAVUserArgs_MT128x80x256_MI16x16x1_SN_LDSB1_GRVWB16_GSU1_GSUC0_GSUWGMRR0_K1_LBSPPB256_MIWT2_5_NTA4_NLCA4_SU0_SUM0_SUS256_VWB1_WG64_4_1_WGM8_WGMXCC8_WGMXCCGn1
    SolutionIndex: 148
    SolutionNameMin: Cijk_Alik_Bljk_F8NBS_STA_BH_Bias_HAS_SAB_SAVUserArgs_MT192x48x256_MI16x16x1_SN_LDSB0_GRVWB16_GSU1_GSUC0_GSUWGMRR0_K1_LBSPPB256_MIWT3_3_NTA4_NLCA4_SU0_SUM0_SUS256_VWB1_WG64_4_1_WGM8_WGMXCC8_WGMXCCGn1
    SolutionIndex: 149
    SolutionNameMin: Cijk_Alik_Bljk_F8NBS_STA_BH_Bias_HAS_SAB_SAVUserArgs_MT128x96x256_MI16x16x1_SN_LDSB1_GRVWB16_GSU1_GSUC0_GSUWGMRR0_K1_LBSPPB512_MIWT2_6_NTA4_NLCA4_SU0_SUM0_SUS256_VWB2_WG64_4_1_WGM8_WGMXCC8_WGMXCCGn1
    SolutionIndex: 150
    SolutionNameMin: Cijk_Alik_Bljk_F8NBS_STA_BH_Bias_HAS_SAB_SAVUserArgs_MT128x112x256_MI16x16x1_SN_LDSB1_GRVWB16_GSU1_GSUC0_GSUWGMRR0_K1_LBSPPB256_MIWT2_7_NTA4_NLCA4_SU0_SUM0_SUS256_VWB1_WG64_4_1_WGM8_WGMXCC8_WGMXCCGn1
    SolutionIndex: 151
    SolutionNameMin: Cijk_Alik_Bljk_F8NBS_STA_BH_Bias_HAS_SAB_SAVUserArgs_MT192x80x256_MI16x16x1_SN_LDSB1_GRVWB16_GSU1_GSUC0_GSUWGMRR0_K1_LBSPPB256_MIWT3_5_NTA0_NLCA4_SU0_SUM0_SUS256_VWB1_WG64_4_1_WGM8_WGMXCC8_WGMXCCGn1
    SolutionIndex: 152
    SolutionNameMin: Cijk_Alik_Bljk_F8NBS_STA_BH_Bias_HAS_SAB_SAVUserArgs_MT256x64x256_MI16x16x1_SN_LDSB1_GRVWB16_GSU1_GSUC0_GSUWGMRR0_K1_LBSPPB1024_MIWT4_4_NTA4_NLCA4_SU0_SUM0_SUS256_VWB4_WG64_4_1_WGM8_WGMXCC8_WGMXCCGn1
    SolutionIndex: 153
    SolutionNameMin: Cijk_Alik_Bljk_F8NBS_STA_BH_Bias_HAS_SAB_SAVUserArgs_MT192x96x256_MI16x16x1_SN_LDSB1_GRVWB16_GSU1_GSUC0_GSUWGMRR0_K1_LBSPPB512_MIWT3_6_NTA4_NLCA4_SU0_SUM0_SUS256_VWB2_WG64_4_1_WGM8_WGMXCC8_WGMXCCGn1
    SolutionIndex: 154
    SolutionNameMin: Cijk_Alik_Bljk_F8NBS_STA_BH_Bias_HAS_SAB_SAVUserArgs_MT192x96x128_MI16x16x1_SN_LDSB0_GRVWB16_GSU1_GSUC0_GSUWGMRR0_K1_LBSPPB256_MIWT3_6_NTA4_NLCA2_SU0_SUM0_SUS128_VWB2_WG64_4_1_WGM8_WGMXCC8_WGMXCCGn1
    SolutionIndex: 155
    SolutionNameMin: Cijk_Alik_Bljk_F8NBS_STA_BH_Bias_HAS_SAB_SAVUserArgs_MT128x160x128_MI16x16x1_SN_LDSB1_GRVWB16_GSU1_GSUC0_GSUWGMRR0_K1_LBSPPB256_MIWT2_10_NTA4_NLCA2_SU0_SUM0_SUS128_VWB2_WG64_4_1_WGM8_WGMXCC8_WGMXCCGn1
    SolutionIndex: 156
    SolutionNameMin: Cijk_Alik_Bljk_F8NBS_STA_BH_Bias_HAS_SAB_SAVUserArgs_MT192x112x128_MI16x16x1_SN_LDSB1_GRVWB8_GSU1_GSUC0_GSUWGMRR0_K1_LBSPPB128_MIWT3_7_NTA4_NLCA2_SU0_SUM0_SUS128_VWB1_WG64_4_1_WGM8_WGMXCC8_WGMXCCGn1
    SolutionIndex: 157
    SolutionNameMin: Cijk_Alik_Bljk_F8NBS_STA_BH_Bias_HAS_SAB_SAVUserArgs_MT256x96x128_MI16x16x1_SN_LDSB0_GRVWB16_GSU1_GSUC0_GSUWGMRR0_K1_LBSPPB256_MIWT4_6_NTA4_NLCA2_SU0_SUM0_SUS128_VWB2_WG64_4_1_WGM8_WGMXCC8_WGMXCCGn1
    SolutionIndex: 158
    SolutionNameMin: Cijk_Alik_Bljk_F8NBS_STA_BH_Bias_HAS_SAB_SAVUserArgs_MT16x16x128_MI16x16x1_SN_LDSB0_GRVWB16_GSU1_GSUC0_GSUWGMRR0_K1_LBSPPB128_MIWT1_1_NTA4_NLCA2_SU0_SUM0_SUS128_VWB1_WG16_4_1_WGM8_WGMXCC8_WGMXCCGn1
    SolutionIndex: 159
    SolutionNameMin: Cijk_Alik_Bljk_F8NBS_STA_BH_Bias_HAS_SAB_SAVUserArgs_MT64x32x128_MI16x16x1_SN_LDSB0_GRVWB16_GSU1_GSUC0_GSUWGMRR0_K1_LBSPPB256_MIWT1_2_NTA4_NLCA2_SU0_SUM0_SUS128_VWB2_WG64_4_1_WGM8_WGMXCC8_WGMXCCGn1
    SolutionIndex: 160
    SolutionNameMin: Cijk_Alik_Bljk_F8NBS_STA_BH_Bias_HAS_SAB_SAVUserArgs_MT16x16x512_MI16x16x1_SN_LDSB0_GRVWB16_GSU1_GSUC0_GSUWGMRR0_K1_LBSPPB512_MIWT1_1_NTA4_NLCA8_SU8_SUM0_SUS512_VWB1_WG16_4_1_WGM1_WGMXCC8_WGMXCCGn1
    SolutionIndex: 161
    SolutionNameMin: Cijk_Alik_Bljk_F8NBS_STA_BH_Bias_HAS_SAB_SAVUserArgs_MT128x16x512_MI16x16x1_SN_LDSB0_GRVWB16_GSU1_GSUC0_GSUWGMRR0_K1_LBSPPB512_MIWT2_1_NTA4_NLCA8_SU0_SUM0_SUS512_VWB1_WG64_4_1_WGM8_WGMXCC8_WGMXCCGn1
    SolutionIndex: 162
    SolutionNameMin: Cijk_Alik_Bljk_F8NBS_STA_BH_Bias_HAS_SAB_SAVUserArgs_MT64x32x256_MI16x16x1_SN_LDSB0_GRVWB16_GSU1_GSUC0_GSUWGMRR0_K1_LBSPPB512_MIWT1_2_NTA0_NLCA4_SU0_SUM0_SUS256_VWB2_WG64_4_1_WGM8_WGMXCC8_WGMXCCGn1
    SolutionIndex: 163
    SolutionNameMin: Cijk_Alik_Bljk_F8NBS_STA_BH_Bias_HAS_SAB_SAVUserArgs_MT128x32x256_MI16x16x1_SN_LDSB0_GRVWB16_GSU1_GSUC0_GSUWGMRR0_K1_LBSPPB512_MIWT2_2_NTA4_NLCA4_SU0_SUM0_SUS256_VWB2_WG64_4_1_WGM8_WGMXCC8_WGMXCCGn1
    SolutionIndex: 164
    SolutionNameMin: Cijk_Alik_Bljk_F8NBS_STA_BH_Bias_HAS_SAB_SAVUserArgs_MT64x48x256_MI16x16x1_SN_LDSB0_GRVWB16_GSU1_GSUC0_GSUWGMRR0_K1_LBSPPB256_MIWT1_3_NTA4_NLCA4_SU0_SUM0_SUS256_VWB1_WG64_4_1_WGM8_WGMXCC8_WGMXCCGn1
    SolutionIndex: 165
    SolutionNameMin: Cijk_Alik_Bljk_F8NBS_STA_BH_Bias_HAS_SAB_SAVUserArgs_MT128x32x256_MI16x16x1_SN_LDSB0_GRVWB16_GSU1_GSUC0_GSUWGMRR0_K1_LBSPPB512_MIWT2_2_NTA0_NLCA4_SU0_SUM0_SUS256_VWB2_WG64_4_1_WGM8_WGMXCC8_WGMXCCGn1
    SolutionIndex: 166
    SolutionNameMin: Cijk_Alik_Bljk_F8NBS_STA_BH_Bias_HAS_SAB_SAVUserArgs_MT32x16x512_MI16x16x1_SN_LDSB0_GRVWB16_GSU1_GSUC0_GSUWGMRR0_K1_LBSPPB512_MIWT1_1_NTA4_NLCA8_SU0_SUM0_SUS512_VWB1_WG32_4_1_WGM1_WGMXCC8_WGMXCCGn1
    SolutionIndex: 167
    SolutionNameMin: Cijk_Alik_Bljk_F8NBS_STA_BH_Bias_HAS_SAB_SAVUserArgs_MT128x16x512_MI16x16x1_SN_LDSB0_GRVWB16_GSU1_GSUC0_GSUWGMRR0_K1_LBSPPB512_MIWT2_1_NTA0_NLCA8_SU0_SUM0_SUS512_VWB1_WG64_4_1_WGM8_WGMXCC8_WGMXCCGn1
    SolutionIndex: 168
    SolutionNameMin: Cijk_Alik_Bljk_F8NBS_STA_BH_Bias_HAS_SAB_SAVUserArgs_MT128x64x256_MI16x16x1_SN_LDSB1_GRVWB16_GSU1_GSUC0_GSUWGMRR0_K1_LBSPPB1024_MIWT2_4_NTA0_NLCA4_SU0_SUM0_SUS256_VWB4_WG64_4_1_WGM8_WGMXCC8_WGMXCCGn1
    SolutionIndex: 169
    SolutionNameMin: Cijk_Alik_Bljk_F8NBS_STA_BH_Bias_HAS_SAB_SAVUserArgs_MT128x112x256_MI16x16x1_SN_LDSB1_GRVWB16_GSU1_GSUC0_GSUWGMRR0_K1_LBSPPB256_MIWT2_7_NLCA4_SU0_SUM0_SUS256_VWB1_WG64_4_1_WGM1_WGMXCC8_WGMXCCGn1
    SolutionIndex: 170
    SolutionNameMin: Cijk_Alik_Bljk_F8NBS_STA_BH_Bias_HAS_SAB_SAVUserArgs_MT128x128x256_MI16x16x1_SN_LDSB1_GRVWB16_GSU1_GSUC0_GSUWGMRR0_K1_LBSPPB2048_MIWT2_8_NLCA4_SU0_SUM0_SUS256_VWB8_WG64_4_1_WGM1_WGMXCC8_WGMXCCGn1
    SolutionIndex: 171
    SolutionNameMin: Cijk_Alik_Bljk_F8NBS_STA_BH_Bias_HAS_SAB_SAVUserArgs_MT128x128x256_MI16x16x1_SN_LDSB1_GRVWB16_GSU1_GSUC0_GSUWGMRR0_K1_LBSPPB2048_MIWT2_8_NLCA4_SU8_SUM0_SUS256_VWB8_WG64_4_1_WGM1_WGMXCC8_WGMXCCGn1
    SolutionIndex: 172
    SolutionNameMin: Cijk_Alik_Bljk_F8NBS_STA_BH_Bias_HAS_SAB_SAVUserArgs_MT192x96x256_MI16x16x1_SN_LDSB1_GRVWB16_GSU1_GSUC0_GSUWGMRR0_K1_LBSPPB512_MIWT3_6_NLCA4_SU8_SUM0_SUS256_VWB2_WG64_4_1_WGM1_WGMXCC8_WGMXCCGn1
    SolutionIndex: 173
    SolutionNameMin: Cijk_Alik_Bljk_F8NBS_STA_BH_Bias_HAS_SAB_SAVUserArgs_MT320x64x128_MI16x16x1_SN_LDSB0_GRVWB16_GSU1_GSUC0_GSUWGMRR0_K1_LBSPPB512_MIWT5_4_NLCA2_SU0_SUM0_SUS128_VWB4_WG64_4_1_WGM1_WGMXCC8_WGMXCCGn1
    SolutionIndex: 174
    SolutionNameMin: Cijk_Alik_Bljk_F8NBS_STA_BH_Bias_HAS_SAB_SAVUserArgs_MT320x64x128_MI16x16x1_SN_LDSB0_GRVWB16_GSU1_GSUC0_GSUWGMRR0_K1_LBSPPB512_MIWT5_4_NLCA2_SU0_SUM0_SUS128_VWB4_WG64_4_1_WGM6_WGMXCC8_WGMXCCGn1
    SolutionIndex: 175
    SolutionNameMin: Cijk_Alik_Bljk_F8NBS_STA_BH_Bias_HAS_SAB_SAVUserArgs_MT128x160x128_MI16x16x1_SN_LDSB1_GRVWB16_GSU1_GSUC0_GSUWGMRR0_K1_LBSPPB256_MIWT2_10_NLCA2_SU0_SUM0_SUS128_VWB2_WG64_4_1_WGM1_WGMXCC8_WGMXCCGn1
    SolutionIndex: 176
    SolutionNameMin: Cijk_Alik_Bljk_F8NBS_STA_BH_Bias_HAS_SAB_SAVUserArgs_MT128x96x256_MI16x16x1_SN_LDSB1_GRVWB16_GSU1_GSUC0_GSUWGMRR0_K1_LBSPPB512_MIWT2_6_NLCA4_SU0_SUM0_SUS256_VWB2_WG64_4_1_WGM1_WGMXCC8_WGMXCCGn1
    SolutionIndex: 177
    SolutionNameMin: Cijk_Alik_Bljk_F8NBS_STA_BH_Bias_HAS_SAB_SAVUserArgs_MT128x96x256_MI16x16x1_SN_LDSB1_GRVWB16_GSU1_GSUC0_GSUWGMRR0_K1_LBSPPB512_MIWT2_6_NLCA4_SU8_SUM0_SUS256_VWB2_WG64_4_1_WGM1_WGMXCC8_WGMXCCGn1
    SolutionIndex: 178
    SolutionNameMin: Cijk_Alik_Bljk_F8NBS_STA_BH_Bias_HAS_SAB_SAVUserArgs_MT448x64x128_MI16x16x1_SN_LDSB0_GRVWB16_GSU1_GSUC0_GSUWGMRR0_K1_LBSPPB512_MIWT7_4_NLCA2_SU8_SUM0_SUS128_VWB4_WG64_4_1_WGM1_WGMXCC8_WGMXCCGn1
    SolutionIndex: 179
    SolutionNameMin: Cijk_Alik_Bljk_F8NBS_STA_BH_Bias_HAS_SAB_SAVUserArgs_MT448x64x128_MI16x16x1_SN_LDSB0_GRVWB16_GSU1_GSUC0_GSUWGMRR0_K1_LBSPPB512_MIWT7_4_NLCA2_SU0_SUM0_SUS128_VWB4_WG64_4_1_WGM6_WGMXCC8_WGMXCCGn1
    SolutionIndex: 180
    SolutionNameMin: Cijk_Alik_Bljk_F8NBS_STA_BH_Bias_HAS_SAB_SAVUserArgs_MT448x64x128_MI16x16x1_SN_LDSB0_GRVWB16_GSU1_GSUC0_GSUWGMRR0_K1_LBSPPB512_MIWT7_4_NLCA2_SU8_SUM0_SUS128_VWB4_WG64_4_1_WGM8_WGMXCC8_WGMXCCGn1
    SolutionIndex: 181
    SolutionNameMin: Cijk_Alik_Bljk_F8NBS_STA_BH_Bias_HAS_SAB_SAVUserArgs_MT448x64x128_MI16x16x1_SN_LDSB0_GRVWB16_GSU1_GSUC0_GSUWGMRR0_K1_LBSPPB512_MIWT7_4_NLCA2_SU8_SUM0_SUS128_VWB4_WG64_4_1_WGM6_WGMXCC8_WGMXCCGn1
    SolutionIndex: 182
    SolutionNameMin: Cijk_Alik_Bljk_F8NBS_STA_BH_Bias_HAS_SAB_SAVUserArgs_MT192x192x128_MI16x16x1_SN_LDSB0_GRVWB16_GSU1_GSUC0_GSUWGMRR0_K1_LBSPPB512_MIWT3_12_NLCA2_SU8_SUM0_SUS128_VWB4_WG64_4_1_WGM1_WGMXCC8_WGMXCCGn1
    SolutionIndex: 183
    SolutionNameMin: Cijk_Alik_Bljk_F8NBS_STA_BH_Bias_HAS_SAB_SAVUserArgs_MT192x192x128_MI16x16x1_SN_LDSB0_GRVWB16_GSU1_GSUC0_GSUWGMRR0_K1_LBSPPB512_MIWT3_12_NLCA2_SU0_SUM0_SUS128_VWB4_WG64_4_1_WGM1_WGMXCC8_WGMXCCGn1
    SolutionIndex: 184
    SolutionNameMin: Cijk_Alik_Bljk_F8NBS_STA_BH_Bias_HAS_SAB_SAVUserArgs_MT192x96x128_MI16x16x1_SN_LDSB0_GRVWB16_GSU1_GSUC0_GSUWGMRR0_K1_LBSPPB256_MIWT3_6_NLCA2_SU0_SUM0_SUS128_VWB2_WG64_4_1_WGM1_WGMXCC8_WGMXCCGn1
    SolutionIndex: 185
    SolutionNameMin: Cijk_Alik_Bljk_F8NBS_STA_BH_Bias_HAS_SAB_SAVUserArgs_MT320x64x128_MI16x16x1_SN_LDSB0_GRVWB16_GSU1_GSUC0_GSUWGMRR0_K1_LBSPPB512_MIWT5_4_NLCA2_SU8_SUM0_SUS128_VWB4_WG64_4_1_WGM1_WGMXCC8_WGMXCCGn1
    SolutionIndex: 186
    SolutionNameMin: Cijk_Alik_Bljk_F8NBS_STA_BH_Bias_HAS_SAB_SAVUserArgs_MT320x128x128_MI16x16x1_SN_LDSB0_GRVWB16_GSU1_GSUC0_GSUWGMRR0_K1_LBSPPB1024_MIWT5_8_NLCA2_SU8_SUM0_SUS128_VWB8_WG64_4_1_WGM1_WGMXCC8_WGMXCCGn1
    SolutionIndex: 187
    SolutionNameMin: Cijk_Alik_Bljk_F8NBS_STA_BH_Bias_HAS_SAB_SAVUserArgs_MT192x224x128_MI16x16x1_SN_LDSB0_GRVWB16_GSU1_GSUC0_GSUWGMRR0_K1_LBSPPB256_MIWT3_14_NLCA2_SU0_SUM0_SUS128_VWB2_WG64_4_1_WGM1_WGMXCC8_WGMXCCGn1
    SolutionIndex: 188
    SolutionNameMin: Cijk_Alik_Bljk_F8NBS_STA_BH_Bias_HAS_SAB_SAVUserArgs_MT192x224x128_MI16x16x1_SN_LDSB0_GRVWB16_GSU1_GSUC0_GSUWGMRR0_K1_LBSPPB256_MIWT3_14_NLCA2_SU8_SUM0_SUS128_VWB2_WG64_4_1_WGM8_WGMXCC8_WGMXCCGn1
    SolutionIndex: 189
    SolutionNameMin: Cijk_Alik_Bljk_F8NBS_STA_BH_Bias_HAS_SAB_SAVUserArgs_MT320x160x128_MI16x16x1_SN_LDSB0_GRVWB16_GSU1_GSUC0_GSUWGMRR0_K1_LBSPPB256_MIWT5_10_NLCA2_SU8_SUM0_SUS128_VWB2_WG64_4_1_WGM1_WGMXCC8_WGMXCCGn1
    SolutionIndex: 190
    SolutionNameMin: Cijk_Alik_Bljk_F8NBS_STA_BH_Bias_HAS_SAB_SAVUserArgs_MT320x160x128_MI16x16x1_SN_LDSB0_GRVWB16_GSU1_GSUC0_GSUWGMRR0_K1_LBSPPB256_MIWT5_10_NLCA2_SU0_SUM0_SUS128_VWB2_WG64_4_1_WGM1_WGMXCC8_WGMXCCGn1
    SolutionIndex: 191
    SolutionNameMin: Cijk_Alik_Bljk_F8NBS_STA_BH_Bias_HAS_SAB_SAVUserArgs_MT320x160x128_MI16x16x1_SN_LDSB0_GRVWB16_GSU1_GSUC0_GSUWGMRR0_K1_LBSPPB256_MIWT5_10_NLCA2_SU0_SUM0_SUS128_VWB2_WG64_4_1_WGM6_WGMXCC8_WGMXCCGn1
    SolutionIndex: 192
    SolutionNameMin: Cijk_Alik_Bljk_F8NBS_STA_BH_Bias_HAS_SAB_SAVUserArgs_MT320x160x128_MI16x16x1_SN_LDSB0_GRVWB16_GSU1_GSUC0_GSUWGMRR0_K1_LBSPPB256_MIWT5_10_NLCA2_SU0_SUM0_SUS128_VWB2_WG64_4_1_WGM8_WGMXCC8_WGMXCCGn1
    SolutionIndex: 193
    SolutionNameMin: Cijk_Alik_Bljk_F8NBS_STA_BH_Bias_HAS_SAB_SAVUserArgs_MT448x128x128_MI16x16x1_SN_LDSB0_GRVWB16_GSU1_GSUC0_GSUWGMRR0_K1_LBSPPB1024_MIWT7_8_NLCA2_SU8_SUM0_SUS128_VWB8_WG64_4_1_WGM8_WGMXCC8_WGMXCCGn1
    SolutionIndex: 194
    SolutionNameMin: Cijk_Alik_Bljk_F8NBS_STA_BH_Bias_HAS_SAB_SAVUserArgs_MT448x128x128_MI16x16x1_SN_LDSB0_GRVWB16_GSU1_GSUC0_GSUWGMRR0_K1_LBSPPB1024_MIWT7_8_NLCA2_SU0_SUM0_SUS128_VWB8_WG64_4_1_WGM1_WGMXCC8_WGMXCCGn1
    SolutionIndex: 195
    SolutionNameMin: Cijk_Alik_Bljk_F8NBS_STA_BH_Bias_HAS_SAB_SAVUserArgs_MT448x128x128_MI16x16x1_SN_LDSB0_GRVWB16_GSU1_GSUC0_GSUWGMRR0_K1_LBSPPB1024_MIWT7_8_NLCA2_SU0_SUM0_SUS128_VWB8_WG64_4_1_WGM8_WGMXCC8_WGMXCCGn1
    SolutionIndex: 196
    SolutionNameMin: Cijk_Alik_Bljk_F8NBS_STA_BH_Bias_HAS_SAB_SAVUserArgs_MT448x128x128_MI16x16x1_SN_LDSB0_GRVWB16_GSU1_GSUC0_GSUWGMRR0_K1_LBSPPB1024_MIWT7_8_NLCA2_SU0_SUM0_SUS128_VWB8_WG64_4_1_WGM6_WGMXCC8_WGMXCCGn1
    SolutionIndex: 197
    SolutionNameMin: Cijk_Alik_Bljk_F8NBS_STA_BH_Bias_HAS_SAB_SAVUserArgs_MT448x144x128_MI16x16x1_SN_LDSB0_GRVWB8_GSU1_GSUC0_GSUWGMRR0_K1_LBSPPB128_MIWT7_9_NLCA2_SU8_SUM0_SUS128_VWB1_WG64_4_1_WGM1_WGMXCC8_WGMXCCGn1
    SolutionIndex: 198
    SolutionNameMin: Cijk_Alik_Bljk_F8NBS_STA_BH_Bias_HAS_SAB_SAVUserArgs_MT448x144x128_MI16x16x1_SN_LDSB0_GRVWB8_GSU1_GSUC0_GSUWGMRR0_K1_LBSPPB128_MIWT7_9_NLCA2_SU0_SUM0_SUS128_VWB1_WG64_4_1_WGM1_WGMXCC8_WGMXCCGn1
    SolutionIndex: 199
    SolutionNameMin: Cijk_Alik_Bljk_F8NBS_STA_BH_Bias_HAS_SAB_SAVUserArgs_MT448x144x128_MI16x16x1_SN_LDSB0_GRVWB8_GSU1_GSUC0_GSUWGMRR0_K1_LBSPPB128_MIWT7_9_NLCA2_SU0_SUM0_SUS128_VWB1_WG64_4_1_WGM6_WGMXCC8_WGMXCCGn1
    SolutionIndex: 200
    SolutionNameMin: Cijk_Alik_Bljk_F8NBS_STA_BH_Bias_HAS_SAB_SAVUserArgs_MT448x144x128_MI16x16x1_SN_LDSB0_GRVWB8_GSU1_GSUC0_GSUWGMRR0_K1_LBSPPB128_MIWT7_9_NLCA2_SU8_SUM0_SUS128_VWB1_WG64_4_1_WGM8_WGMXCC8_WGMXCCGn1
    SolutionIndex: 201
    SolutionNameMin: Cijk_Alik_Bljk_F8NBS_STA_BH_Bias_HAS_SAB_SAVUserArgs_MT192x96x128_MI16x16x1_SN_LDSB0_GRVWB16_GSU1_GSUC0_GSUWGMRR0_K1_LBSPPB256_MIWT3_6_NLCA2_SU0_SUM0_SUS128_VWB2_WG64_4_1_WGM6_WGMXCC8_WGMXCCGn1
    SolutionIndex: 202
    SolutionNameMin: Cijk_Alik_Bljk_F8NBS_STA_BH_Bias_HAS_SAB_SAVUserArgs_MT192x128x128_MI16x16x1_SN_LDSB1_GRVWB16_GSU1_GSUC0_GSUWGMRR0_K1_LBSPPB1024_MIWT3_8_NLCA2_SU8_SUM0_SUS128_VWB8_WG64_4_1_WGM1_WGMXCC8_WGMXCCGn1
    SolutionIndex: 203
    SolutionNameMin: Cijk_Alik_Bljk_F8NBS_STA_BH_Bias_HAS_SAB_SAVUserArgs_MT192x128x128_MI16x16x1_SN_LDSB1_GRVWB16_GSU1_GSUC0_GSUWGMRR0_K1_LBSPPB1024_MIWT3_8_NLCA2_SU0_SUM0_SUS128_VWB8_WG64_4_1_WGM1_WGMXCC8_WGMXCCGn1
    SolutionIndex: 204
    SolutionNameMin: Cijk_Alik_Bljk_F8NBS_STA_BH_Bias_HAS_SAB_SAVUserArgs_MT192x96x128_MI16x16x1_SN_LDSB0_GRVWB16_GSU1_GSUC0_GSUWGMRR0_K1_LBSPPB256_MIWT3_6_NLCA2_SU8_SUM0_SUS128_VWB2_WG64_4_1_WGM1_WGMXCC8_WGMXCCGn1
    SolutionIndex: 205
    SolutionNameMin: Cijk_Alik_Bljk_F8NBS_STA_BH_Bias_HAS_SAB_SAVUserArgs_MT256x160x128_MI16x16x1_SN_LDSB0_GRVWB16_GSU1_GSUC0_GSUWGMRR0_K1_LBSPPB256_MIWT4_10_NLCA2_SU0_SUM0_SUS128_VWB2_WG64_4_1_WGM6_WGMXCC8_WGMXCCGn1
    SolutionIndex: 206
    SolutionNameMin: Cijk_Alik_Bljk_F8NBS_STA_BH_Bias_HAS_SAB_SAVUserArgs_MT128x160x128_MI16x16x1_SN_LDSB1_GRVWB16_GSU1_GSUC0_GSUWGMRR0_K1_LBSPPB256_MIWT2_10_NLCA2_SU8_SUM0_SUS128_VWB2_WG64_4_1_WGM1_WGMXCC8_WGMXCCGn1
    SolutionIndex: 207
    SolutionNameMin: Cijk_Alik_Bljk_F8NBS_STA_BH_Bias_HAS_SAB_SAVUserArgs_MT320x128x128_MI16x16x1_SN_LDSB0_GRVWB16_GSU1_GSUC0_GSUWGMRR0_K1_LBSPPB1024_MIWT5_8_NLCA2_SU0_SUM0_SUS128_VWB8_WG64_4_1_WGM8_WGMXCC8_WGMXCCGn1
    SolutionIndex: 208
    SolutionNameMin: Cijk_Alik_Bljk_F8NBS_STA_BH_Bias_HAS_SAB_SAVUserArgs_MT192x224x128_MI16x16x1_SN_LDSB0_GRVWB16_GSU1_GSUC0_GSUWGMRR0_K1_LBSPPB256_MIWT3_14_NLCA2_SU8_SUM0_SUS128_VWB2_WG64_4_1_WGM1_WGMXCC8_WGMXCCGn1
    SolutionIndex: 209
    SolutionNameMin: Cijk_Alik_Bljk_F8NBS_STA_BH_Bias_HAS_SAB_SAVUserArgs_MT320x160x128_MI16x16x1_SN_LDSB0_GRVWB16_GSU1_GSUC0_GSUWGMRR0_K1_LBSPPB256_MIWT5_10_NLCA2_SU8_SUM0_SUS128_VWB2_WG64_4_1_WGM6_WGMXCC8_WGMXCCGn1
    SolutionIndex: 210
    SolutionNameMin: Cijk_Alik_Bljk_F8NBS_STA_BH_Bias_HAS_SAB_SAVUserArgs_MT448x128x128_MI16x16x1_SN_LDSB0_GRVWB16_GSU1_GSUC0_GSUWGMRR0_K1_LBSPPB1024_MIWT7_8_NLCA2_SU8_SUM0_SUS128_VWB8_WG64_4_1_WGM1_WGMXCC8_WGMXCCGn1
    SolutionIndex: 211
    SolutionNameMin: Cijk_Alik_Bljk_F8NBS_STA_BH_Bias_HAS_SAB_SAVUserArgs_MT448x144x128_MI16x16x1_SN_LDSB0_GRVWB8_GSU1_GSUC0_GSUWGMRR0_K1_LBSPPB128_MIWT7_9_NLCA2_SU0_SUM0_SUS128_VWB1_WG64_4_1_WGM8_WGMXCC8_WGMXCCGn1
    SolutionIndex: 212
    SolutionNameMin: Cijk_Alik_Bljk_F8NBS_STA_BH_Bias_HAS_SAB_SAVUserArgs_MT448x128x128_MI16x16x1_SN_LDSB0_GRVWB16_GSU1_GSUC0_GSUWGMRR0_K1_LBSPPB1024_MIWT7_8_NLCA2_SU8_SUM0_SUS128_VWB8_WG64_4_1_WGM6_WGMXCC8_WGMXCCGn1
    SolutionIndex: 213
    SolutionNameMin: Cijk_Alik_Bljk_F8NBS_STA_BH_Bias_HAS_SAB_SAVUserArgs_MT448x144x128_MI16x16x1_SN_LDSB0_GRVWB8_GSU1_GSUC0_GSUWGMRR0_K1_LBSPPB128_MIWT7_9_NLCA2_SU8_SUM0_SUS128_VWB1_WG64_4_1_WGM6_WGMXCC8_WGMXCCGn1
    SolutionIndex: 214
    SolutionNameMin: Cijk_Alik_Bljk_F8NBS_STA_BH_Bias_HAS_SAB_SAVUserArgs_MT256x96x128_MI16x16x1_SN_LDSB0_GRVWB16_GSU1_GSUC0_GSUWGMRR0_K1_LBSPPB256_MIWT4_6_NLCA2_SU0_SUM0_SUS128_VWB2_WG64_4_1_WGM1_WGMXCC8_WGMXCCGn1
    SolutionIndex: 215
    SolutionNameMin: Cijk_Alik_Bljk_F8NBS_STA_BH_Bias_HAS_SAB_SAVUserArgs_MT128x96x256_MI16x16x1_SN_LDSB1_GRVWB16_GSU1_GSUC0_GSUWGMRR0_K1_LBSPPB512_MIWT2_6_NLCA4_SU0_SUM0_SUS256_VWB2_WG64_4_1_WGM6_WGMXCC8_WGMXCCGn1
    SolutionIndex: 216
    SolutionNameMin: Cijk_Alik_Bljk_F8NBS_STA_BH_Bias_HAS_SAB_SAVUserArgs_MT128x160x128_MI16x16x1_SN_LDSB1_GRVWB16_GSU1_GSUC0_GSUWGMRR0_K1_LBSPPB256_MIWT2_10_NLCA2_SU0_SUM0_SUS128_VWB2_WG64_4_1_WGM8_WGMXCC8_WGMXCCGn1
    SolutionIndex: 217
    SolutionNameMin: Cijk_Alik_Bljk_F8NBS_STA_BH_Bias_HAS_SAB_SAVUserArgs_MT128x160x128_MI16x16x1_SN_LDSB1_GRVWB16_GSU1_GSUC0_GSUWGMRR0_K1_LBSPPB256_MIWT2_10_NLCA2_SU0_SUM0_SUS128_VWB2_WG64_4_1_WGM6_WGMXCC8_WGMXCCGn1
    SolutionIndex: 218
    SolutionNameMin: Cijk_Alik_Bljk_F8NBS_STA_BH_Bias_HAS_SAB_SAVUserArgs_MT320x192x128_MI16x16x1_SN_LDSB0_GRVWB16_GSU1_GSUC0_GSUWGMRR0_K1_LBSPPB512_MIWT5_12_NLCA2_SU8_SUM0_SUS128_VWB4_WG64_4_1_WGM8_WGMXCC8_WGMXCCGn1
    SolutionIndex: 219
    SolutionNameMin: Cijk_Alik_Bljk_F8NBS_STA_BH_Bias_HAS_SAB_SAVUserArgs_MT512x128x128_MI16x16x1_SN_LDSB0_GRVWB16_GSU1_GSUC0_GSUWGMRR0_K1_LBSPPB1024_MIWT8_8_NLCA2_SU0_SUM0_SUS128_VWB8_WG64_4_1_WGM1_WGMXCC8_WGMXCCGn1
    SolutionIndex: 220
    SolutionNameMin: Cijk_Alik_Bljk_F8NBS_STA_BH_Bias_HAS_SAB_SAVUserArgs_MT256x96x128_MI16x16x1_SN_LDSB0_GRVWB16_GSU1_GSUC0_GSUWGMRR0_K1_LBSPPB256_MIWT4_6_NLCA2_SU0_SUM0_SUS128_VWB2_WG64_4_1_WGM6_WGMXCC8_WGMXCCGn1
    SolutionIndex: 221
    SolutionNameMin: Cijk_Alik_Bljk_F8NBS_STA_BH_Bias_HAS_SAB_SAVUserArgs_MT256x96x128_MI16x16x1_SN_LDSB0_GRVWB16_GSU1_GSUC0_GSUWGMRR0_K1_LBSPPB256_MIWT4_6_NLCA2_SU0_SUM0_SUS128_VWB2_WG64_4_1_WGM8_WGMXCC8_WGMXCCGn1
    SolutionIndex: 222
    SolutionNameMin: Cijk_Alik_Bljk_F8NBS_STA_BH_Bias_HAS_SAB_SAVUserArgs_MT256x160x128_MI16x16x1_SN_LDSB0_GRVWB16_GSU1_GSUC0_GSUWGMRR0_K1_LBSPPB256_MIWT4_10_NLCA2_SU0_SUM0_SUS128_VWB2_WG64_4_1_WGM8_WGMXCC8_WGMXCCGn1
    SolutionIndex: 223
    SolutionNameMin: Cijk_Alik_Bljk_F8NBS_STA_BH_Bias_HAS_SAB_SAVUserArgs_MT256x224x128_MI16x16x1_SN_LDSB0_GRVWB16_GSU1_GSUC0_GSUWGMRR0_K1_LBSPPB256_MIWT4_14_NLCA2_SU8_SUM0_SUS128_VWB2_WG64_4_1_WGM1_WGMXCC8_WGMXCCGn1
    SolutionIndex: 224
    SolutionNameMin: Cijk_Alik_Bljk_F8NBS_STA_BH_Bias_HAS_SAB_SAVUserArgs_MT256x224x128_MI16x16x1_SN_LDSB0_GRVWB16_GSU1_GSUC0_GSUWGMRR0_K1_LBSPPB256_MIWT4_14_NLCA2_SU0_SUM0_SUS128_VWB2_WG64_4_1_WGM8_WGMXCC8_WGMXCCGn1
    SolutionIndex: 225
    SolutionNameMin: Cijk_Alik_Bljk_F8NBS_STA_BH_Bias_HAS_SAB_SAVUserArgs_MT256x224x128_MI16x16x1_SN_LDSB0_GRVWB16_GSU1_GSUC0_GSUWGMRR0_K1_LBSPPB256_MIWT4_14_NLCA2_SU0_SUM0_SUS128_VWB2_WG64_4_1_WGM6_WGMXCC8_WGMXCCGn1
    SolutionIndex: 226
    SolutionNameMin: Cijk_Alik_Bljk_F8NBS_STA_BH_Bias_HAS_SAB_SAVUserArgs_MT384x160x128_MI16x16x1_SN_LDSB0_GRVWB16_GSU1_GSUC0_GSUWGMRR0_K1_LBSPPB256_MIWT6_10_NLCA2_SU8_SUM0_SUS128_VWB2_WG64_4_1_WGM6_WGMXCC8_WGMXCCGn1
    SolutionIndex: 227
    SolutionNameMin: Cijk_Alik_Bljk_F8NBS_STA_BH_Bias_HAS_SAB_SAVUserArgs_MT512x128x128_MI16x16x1_SN_LDSB0_GRVWB16_GSU1_GSUC0_GSUWGMRR0_K1_LBSPPB1024_MIWT8_8_NLCA2_SU0_SUM0_SUS128_VWB8_WG64_4_1_WGM8_WGMXCC8_WGMXCCGn1
    SolutionIndex: 228
    SolutionNameMin: Cijk_Alik_Bljk_F8NBS_STA_BH_Bias_HAS_SAB_SAVUserArgs_MT384x160x128_MI16x16x1_SN_LDSB0_GRVWB16_GSU1_GSUC0_GSUWGMRR0_K1_LBSPPB256_MIWT6_10_NLCA2_SU0_SUM0_SUS128_VWB2_WG64_4_1_WGM8_WGMXCC8_WGMXCCGn1
    SolutionIndex: 229
    SolutionNameMin: Cijk_Alik_Bljk_F8NBS_STA_BH_Bias_HAS_SAB_SAVUserArgs_MT384x160x128_MI16x16x1_SN_LDSB0_GRVWB16_GSU1_GSUC0_GSUWGMRR0_K1_LBSPPB256_MIWT6_10_NLCA2_SU8_SUM0_SUS128_VWB2_WG64_4_1_WGM8_WGMXCC8_WGMXCCGn1
    SolutionIndex: 230
    SolutionNameMin: Cijk_Alik_Bljk_F8NBS_STA_BH_Bias_HAS_SAB_SAVUserArgs_MT320x192x128_MI16x16x1_SN_LDSB0_GRVWB16_GSU1_GSUC0_GSUWGMRR0_K1_LBSPPB512_MIWT5_12_NLCA2_SU8_SUM0_SUS128_VWB4_WG64_4_1_WGM6_WGMXCC8_WGMXCCGn1
    SolutionIndex: 231
    SolutionNameMin: Cijk_Alik_Bljk_F8NBS_STA_BH_Bias_HAS_SAB_SAVUserArgs_MT256x224x128_MI16x16x1_SN_LDSB0_GRVWB16_GSU1_GSUC0_GSUWGMRR0_K1_LBSPPB256_MIWT4_14_NLCA2_SU8_SUM0_SUS128_VWB2_WG64_4_1_WGM6_WGMXCC8_WGMXCCGn1
    SolutionIndex: 232
    SolutionNameMin: Cijk_Alik_Bljk_F8NBS_STA_BH_Bias_HAS_SAB_SAVUserArgs_MT256x96x128_MI16x16x1_SN_LDSB0_GRVWB16_GSU1_GSUC0_GSUWGMRR0_K1_LBSPPB256_MIWT4_6_NLCA2_SU8_SUM0_SUS128_VWB2_WG64_4_1_WGM8_WGMXCC8_WGMXCCGn1
    SolutionIndex: 233
    SolutionNameMin: Cijk_Alik_Bljk_F8NBS_STA_BH_Bias_HAS_SAB_SAVUserArgs_MT320x160x128_MI16x16x1_SN_LDSB0_GRVWB16_GSU1_GSUC0_GSUWGMRR0_K1_LBSPPB256_MIWT5_10_NLCA2_SU8_SUM0_SUS128_VWB2_WG64_4_1_WGM8_WGMXCC8_WGMXCCGn1
    SolutionIndex: 234
    SolutionNameMin: Cijk_Alik_Bljk_F8NBS_STA_BH_Bias_HAS_SAB_SAVUserArgs_MT256x192x128_MI16x16x1_SN_LDSB0_GRVWB16_GSU1_GSUC0_GSUWGMRR0_K1_LBSPPB512_MIWT4_12_NLCA2_SU8_SUM0_SUS128_VWB4_WG64_4_1_WGM8_WGMXCC8_WGMXCCGn1
    SolutionIndex: 235
    SolutionNameMin: Cijk_Alik_Bljk_F8NBS_STA_BH_Bias_HAS_SAB_SAVUserArgs_MT256x192x128_MI16x16x1_SN_LDSB0_GRVWB16_GSU1_GSUC0_GSUWGMRR0_K1_LBSPPB512_MIWT4_12_NLCA2_SU0_SUM0_SUS128_VWB4_WG64_4_1_WGM8_WGMXCC8_WGMXCCGn1
    SolutionIndex: 236
    SolutionNameMin: Cijk_Alik_Bljk_F8NBS_STA_BH_Bias_HAS_SAB_SAVUserArgs_MT256x192x128_MI16x16x1_SN_LDSB0_GRVWB16_GSU1_GSUC0_GSUWGMRR0_K1_LBSPPB512_MIWT4_12_NLCA2_SU0_SUM0_SUS128_VWB4_WG64_4_1_WGM6_WGMXCC8_WGMXCCGn1
    SolutionIndex: 237
    SolutionNameMin: Cijk_Alik_Bljk_F8NBS_STA_BH_Bias_HAS_SAB_SAVUserArgs_MT256x224x128_MI16x16x1_SN_LDSB0_GRVWB16_GSU1_GSUC0_GSUWGMRR0_K1_LBSPPB256_MIWT4_14_NLCA2_SU8_SUM0_SUS128_VWB2_WG64_4_1_WGM8_WGMXCC8_WGMXCCGn1
    SolutionIndex: 238
    SolutionNameMin: Cijk_Alik_Bljk_F8NBS_STA_BH_Bias_HAS_SAB_SAVUserArgs_MT256x64x256_MI16x16x1_SN_LDSB1_GRVWB16_GSU1_GSUC0_GSUWGMRR0_K1_LBSPPB1024_MIWT4_4_NLCA4_SU0_SUM0_SUS256_VWB4_WG64_4_1_WGM1_WGMXCC8_WGMXCCGn1
    SolutionIndex: 239
    SolutionNameMin: Cijk_Alik_Bljk_F8NBS_STA_BH_Bias_HAS_SAB_SAVUserArgs_MT256x80x256_MI16x16x1_SN_LDSB1_GRVWB16_GSU1_GSUC0_GSUWGMRR0_K1_LBSPPB256_MIWT4_5_NLCA4_SU0_SUM0_SUS256_VWB1_WG64_4_1_WGM6_WGMXCC8_WGMXCCGn1
    SolutionIndex: 240
    SolutionNameMin: Cijk_Alik_Bljk_F8NBS_STA_BH_Bias_HAS_SAB_SAVUserArgs_MT256x96x128_MI16x16x1_SN_LDSB0_GRVWB16_GSU1_GSUC0_GSUWGMRR0_K1_LBSPPB256_MIWT4_6_NLCA2_SU8_SUM0_SUS128_VWB2_WG64_4_1_WGM1_WGMXCC8_WGMXCCGn1
    SolutionIndex: 241
    SolutionNameMin: Cijk_Alik_Bljk_F8NBS_STA_BH_Bias_HAS_SAB_SAVUserArgs_MT256x112x128_MI16x16x1_SN_LDSB1_GRVWB8_GSU1_GSUC0_GSUWGMRR0_K1_LBSPPB128_MIWT4_7_NLCA2_SU8_SUM0_SUS128_VWB1_WG64_4_1_WGM1_WGMXCC8_WGMXCCGn1
    SolutionIndex: 242
    SolutionNameMin: Cijk_Alik_Bljk_F8NBS_STA_BH_Bias_HAS_SAB_SAVUserArgs_MT256x112x128_MI16x16x1_SN_LDSB1_GRVWB8_GSU1_GSUC0_GSUWGMRR0_K1_LBSPPB128_MIWT4_7_NLCA2_SU0_SUM0_SUS128_VWB1_WG64_4_1_WGM1_WGMXCC8_WGMXCCGn1
    SolutionIndex: 243
    SolutionNameMin: Cijk_Alik_Bljk_F8NBS_STA_BH_Bias_HAS_SAB_SAVUserArgs_MT256x128x128_MI16x16x1_SN_LDSB1_GRVWB16_GSU1_GSUC0_GSUWGMRR0_K1_LBSPPB1024_MIWT4_8_NLCA2_SU0_SUM0_SUS128_VWB8_WG64_4_1_WGM8_WGMXCC8_WGMXCCGn1
    SolutionIndex: 244
    SolutionNameMin: Cijk_Alik_Bljk_F8NBS_STA_BH_Bias_HAS_SAB_SAVUserArgs_MT256x128x128_MI16x16x1_SN_LDSB1_GRVWB16_GSU1_GSUC0_GSUWGMRR0_K1_LBSPPB1024_MIWT4_8_NLCA2_SU0_SUM0_SUS128_VWB8_WG64_4_1_WGM1_WGMXCC8_WGMXCCGn1
    SolutionIndex: 245
    SolutionNameMin: Cijk_Alik_Bljk_F8NBS_STA_BH_Bias_HAS_SAB_SAVUserArgs_MT512x64x128_MI16x16x1_SN_LDSB0_GRVWB16_GSU1_GSUC0_GSUWGMRR0_K1_LBSPPB512_MIWT8_4_NLCA2_SU8_SUM0_SUS128_VWB4_WG64_4_1_WGM8_WGMXCC8_WGMXCCGn1
    SolutionIndex: 246
    SolutionNameMin: Cijk_Alik_Bljk_F8NBS_STA_BH_Bias_HAS_SAB_SAVUserArgs_MT256x160x128_MI16x16x1_SN_LDSB0_GRVWB16_GSU1_GSUC0_GSUWGMRR0_K1_LBSPPB256_MIWT4_10_NLCA2_SU0_SUM0_SUS128_VWB2_WG64_4_1_WGM1_WGMXCC8_WGMXCCGn1
    SolutionIndex: 247
    SolutionNameMin: Cijk_Alik_Bljk_F8NBS_STA_BH_Bias_HAS_SAB_SAVUserArgs_MT256x192x128_MI16x16x1_SN_LDSB0_GRVWB16_GSU1_GSUC0_GSUWGMRR0_K1_LBSPPB512_MIWT4_12_NLCA2_SU0_SUM0_SUS128_VWB4_WG64_4_1_WGM1_WGMXCC8_WGMXCCGn1
    SolutionIndex: 248
    SolutionNameMin: Cijk_Alik_Bljk_F8NBS_STA_BH_Bias_HAS_SAB_SAVUserArgs_MT256x176x128_MI16x16x1_SN_LDSB0_GRVWB8_GSU1_GSUC0_GSUWGMRR0_K1_LBSPPB128_MIWT4_11_NLCA2_SU0_SUM0_SUS128_VWB1_WG64_4_1_WGM1_WGMXCC8_WGMXCCGn1
    SolutionIndex: 249
    SolutionNameMin: Cijk_Alik_Bljk_F8NBS_STA_BH_Bias_HAS_SAB_SAVUserArgs_MT256x192x128_MI16x16x1_SN_LDSB0_GRVWB16_GSU1_GSUC0_GSUWGMRR0_K1_LBSPPB512_MIWT4_12_NLCA2_SU8_SUM0_SUS128_VWB4_WG64_4_1_WGM6_WGMXCC8_WGMXCCGn1
    SolutionIndex: 250
    SolutionNameMin: Cijk_Alik_Bljk_F8NBS_STA_BH_Bias_HAS_SAB_SAVUserArgs_MT256x192x128_MI16x16x1_SN_LDSB0_GRVWB16_GSU1_GSUC0_GSUWGMRR0_K1_LBSPPB512_MIWT4_12_NLCA2_SU8_SUM0_SUS128_VWB4_WG64_4_1_WGM1_WGMXCC8_WGMXCCGn1
    SolutionIndex: 251
    SolutionNameMin: Cijk_Alik_Bljk_F8NBS_STA_BH_Bias_HAS_SAB_SAVUserArgs_MT256x224x128_MI16x16x1_SN_LDSB0_GRVWB16_GSU1_GSUC0_GSUWGMRR0_K1_LBSPPB256_MIWT4_14_NLCA2_SU0_SUM0_SUS128_VWB2_WG64_4_1_WGM1_WGMXCC8_WGMXCCGn1
    SolutionIndex: 252
    SolutionNameMin: Cijk_Alik_Bljk_F8NBS_STA_BH_Bias_HAS_SAB_SAVUserArgs_MT512x128x128_MI16x16x1_SN_LDSB0_GRVWB16_GSU1_GSUC0_GSUWGMRR0_K1_LBSPPB1024_MIWT8_8_NLCA2_SU8_SUM0_SUS128_VWB8_WG64_4_1_WGM8_WGMXCC8_WGMXCCGn1
    SolutionIndex: 253
    SolutionNameMin: Cijk_Alik_Bljk_F8NBS_STA_BH_Bias_HAS_SAB_SAVUserArgs_MT512x128x128_MI16x16x1_SN_LDSB0_GRVWB16_GSU1_GSUC0_GSUWGMRR0_K1_LBSPPB1024_MIWT8_8_NLCA2_SU0_SUM0_SUS128_VWB8_WG64_4_1_WGM6_WGMXCC8_WGMXCCGn1
    SolutionIndex: 254
    SolutionNameMin: Cijk_Alik_Bljk_F8NBS_STA_BH_Bias_HAS_SAB_SAVUserArgs_MT256x160x128_MI16x16x1_SN_LDSB0_GRVWB16_GSU1_GSUC0_GSUWGMRR0_K1_LBSPPB256_MIWT4_10_NLCA2_SU8_SUM0_SUS128_VWB2_WG64_4_1_WGM1_WGMXCC8_WGMXCCGn1
    SolutionIndex: 255
    SolutionNameMin: Cijk_Alik_Bljk_F8NBS_STA_BH_Bias_HAS_SAB_SAVUserArgs_MT512x128x128_MI16x16x1_SN_LDSB0_GRVWB16_GSU1_GSUC0_GSUWGMRR0_K1_LBSPPB1024_MIWT8_8_NLCA2_SU8_SUM0_SUS128_VWB8_WG64_4_1_WGM1_WGMXCC8_WGMXCCGn1
    SolutionIndex: 256
    SolutionNameMin: Cijk_Alik_Bljk_F8NBS_STA_BH_Bias_HAS_SAB_SAVUserArgs_MT256x96x128_MI16x16x1_SN_LDSB0_GRVWB16_GSU1_GSUC0_GSUWGMRR0_K1_LBSPPB256_MIWT4_6_NLCA2_SU8_SUM0_SUS128_VWB2_WG64_4_1_WGM6_WGMXCC8_WGMXCCGn1
    SolutionIndex: 257
    SolutionNameMin: Cijk_Alik_Bljk_F8NBS_STA_BH_Bias_HAS_SAB_SAVUserArgs_MT256x128x128_MI16x16x1_SN_LDSB1_GRVWB16_GSU1_GSUC0_GSUWGMRR0_K1_LBSPPB1024_MIWT4_8_NLCA2_SU8_SUM0_SUS128_VWB8_WG64_4_1_WGM1_WGMXCC8_WGMXCCGn1
    SolutionIndex: 258
    SolutionNameMin: Cijk_Alik_Bljk_F8NBS_STA_BH_Bias_HAS_SAB_SAVUserArgs_MT256x128x128_MI16x16x1_SN_LDSB1_GRVWB16_GSU1_GSUC0_GSUWGMRR0_K1_LBSPPB1024_MIWT4_8_NLCA2_SU8_SUM0_SUS128_VWB8_WG64_4_1_WGM8_WGMXCC8_WGMXCCGn1
    SolutionIndex: 259
    SolutionNameMin: Cijk_Alik_Bljk_F8NBS_STA_BH_Bias_HAS_SAB_SAVUserArgs_MT256x160x128_MI16x16x1_SN_LDSB0_GRVWB16_GSU1_GSUC0_GSUWGMRR0_K1_LBSPPB256_MIWT4_10_NLCA2_SU8_SUM0_SUS128_VWB2_WG64_4_1_WGM6_WGMXCC8_WGMXCCGn1
    SolutionIndex: 260
    SolutionNameMin: Cijk_Alik_Bljk_F8NBS_STA_BH_Bias_HAS_SAB_SAVUserArgs_MT384x160x128_MI16x16x1_SN_LDSB0_GRVWB16_GSU1_GSUC0_GSUWGMRR0_K1_LBSPPB256_MIWT6_10_NLCA2_SU0_SUM0_SUS128_VWB2_WG64_4_1_WGM6_WGMXCC8_WGMXCCGn1
    SolutionIndex: 261
    SolutionNameMin: Cijk_Alik_Bljk_F8NBS_STA_BH_Bias_HAS_SAB_SAVUserArgs_MT320x64x128_MI16x16x1_SN_LDSB0_GRVWB16_GSU1_GSUC0_GSUWGMRR0_K1_LBSPPB512_MIWT5_4_NLCA2_SU0_SUM0_SUS128_VWB4_WG64_4_1_WGM8_WGMXCC8_WGMXCCGn1
    SolutionIndex: 262
    SolutionNameMin: Cijk_Alik_Bljk_F8NBS_STA_BH_Bias_HAS_SAB_SAVUserArgs_MT256x80x128_MI16x16x1_SN_LDSB0_GRVWB8_GSU1_GSUC0_GSUWGMRR0_K1_LBSPPB128_MIWT4_5_NLCA2_SU0_SUM0_SUS128_VWB1_WG64_4_1_WGM8_WGMXCC8_WGMXCCGn1
    SolutionIndex: 263
    SolutionNameMin: Cijk_Alik_Bljk_F8NBS_STA_BH_Bias_HAS_SAB_SAVUserArgs_MT192x128x128_MI16x16x1_SN_LDSB1_GRVWB16_GSU1_GSUC0_GSUWGMRR0_K1_LBSPPB1024_MIWT3_8_NLCA2_SU8_SUM0_SUS128_VWB8_WG64_4_1_WGM6_WGMXCC8_WGMXCCGn1
    SolutionIndex: 264
    SolutionNameMin: Cijk_Alik_Bljk_F8NBS_STA_BH_Bias_HAS_SAB_SAVUserArgs_MT192x128x128_MI16x16x1_SN_LDSB1_GRVWB16_GSU1_GSUC0_GSUWGMRR0_K1_LBSPPB1024_MIWT3_8_NLCA2_SU0_SUM0_SUS128_VWB8_WG64_4_1_WGM6_WGMXCC8_WGMXCCGn1
    SolutionIndex: 265
    SolutionNameMin: Cijk_Alik_Bljk_F8NBS_STA_BH_Bias_HAS_SAB_SAVUserArgs_MT320x80x128_MI16x16x1_SN_LDSB0_GRVWB8_GSU1_GSUC0_GSUWGMRR0_K1_LBSPPB128_MIWT5_5_NLCA2_SU0_SUM0_SUS128_VWB1_WG64_4_1_WGM6_WGMXCC8_WGMXCCGn1
    SolutionIndex: 266
    SolutionNameMin: Cijk_Alik_Bljk_F8NBS_STA_BH_Bias_HAS_SAB_SAVUserArgs_MT192x112x128_MI16x16x1_SN_LDSB1_GRVWB8_GSU1_GSUC0_GSUWGMRR0_K1_LBSPPB128_MIWT3_7_NLCA2_SU0_SUM0_SUS128_VWB1_WG64_4_1_WGM6_WGMXCC8_WGMXCCGn1
    SolutionIndex: 267
    SolutionNameMin: Cijk_Alik_Bljk_F8NBS_STA_BH_Bias_HAS_SAB_SAVUserArgs_MT192x128x128_MI16x16x1_SN_LDSB1_GRVWB16_GSU1_GSUC0_GSUWGMRR0_K1_LBSPPB1024_MIWT3_8_NLCA2_SU0_SUM0_SUS128_VWB8_WG64_4_1_WGM8_WGMXCC8_WGMXCCGn1
    SolutionIndex: 268
    SolutionNameMin: Cijk_Alik_Bljk_F8NBS_STA_BH_Bias_HAS_SAB_SAVUserArgs_MT256x256x128_MI16x16x1_SN_LDSB1_GRVWB16_GSU1_GSUC0_GSUWGMRR0_K1_LBSPPB2048_MIWT4_16_NLCA2_SU0_SUM0_SUS128_VWB16_WG64_4_1_WGM6_WGMXCC8_WGMXCCGn1
    SolutionIndex: 269
    SolutionNameMin: Cijk_Alik_Bljk_F8NBS_STA_BH_Bias_HAS_SAB_SAVUserArgs_MT320x80x128_MI16x16x1_SN_LDSB0_GRVWB8_GSU1_GSUC0_GSUWGMRR0_K1_LBSPPB128_MIWT5_5_NLCA2_SU0_SUM0_SUS128_VWB1_WG64_4_1_WGM8_WGMXCC8_WGMXCCGn1
    SolutionIndex: 270
    SolutionNameMin: Cijk_Alik_Bljk_F8NBS_STA_BH_Bias_HAS_SAB_SAVUserArgs_MT320x208x128_MI16x16x1_SN_LDSB1_GRVWB8_GSU1_GSUC0_GSUWGMRR0_K1_LBSPPB128_MIWT5_13_NLCA2_SU0_SUM0_SUS128_VWB1_WG64_4_1_WGM8_WGMXCC8_WGMXCCGn1
    SolutionIndex: 271
    SolutionNameMin: Cijk_Alik_Bljk_F8NBS_STA_BH_Bias_HAS_SAB_SAVUserArgs_MT192x128x128_MI16x16x1_SN_LDSB1_GRVWB16_GSU1_GSUC0_GSUWGMRR0_K1_LBSPPB1024_MIWT3_8_NLCA2_SU8_SUM0_SUS128_VWB8_WG64_4_1_WGM8_WGMXCC8_WGMXCCGn1
    SolutionIndex: 272
    SolutionNameMin: Cijk_Alik_Bljk_F8NBS_STA_BH_Bias_HAS_SAB_SAVUserArgs_MT320x128x128_MI16x16x1_SN_LDSB0_GRVWB16_GSU1_GSUC0_GSUWGMRR0_K1_LBSPPB1024_MIWT5_8_NLCA2_SU0_SUM0_SUS128_VWB8_WG64_4_1_WGM6_WGMXCC8_WGMXCCGn1
    SolutionIndex: 273
    SolutionNameMin: Cijk_Alik_Bljk_F8NBS_STA_BH_Bias_HAS_SAB_SAVUserArgs_MT192x256x128_MI16x16x1_SN_LDSB1_GRVWB16_GSU1_GSUC0_GSUWGMRR0_K1_LBSPPB2048_MIWT3_16_NLCA2_SU0_SUM0_SUS128_VWB16_WG64_4_1_WGM8_WGMXCC8_WGMXCCGn1
    SolutionIndex: 274
    SolutionNameMin: Cijk_Alik_Bljk_F8NBS_STA_BH_Bias_HAS_SAB_SAVUserArgs_MT192x256x128_MI16x16x1_SN_LDSB1_GRVWB16_GSU1_GSUC0_GSUWGMRR0_K1_LBSPPB2048_MIWT3_16_NLCA2_SU0_SUM0_SUS128_VWB16_WG64_4_1_WGM6_WGMXCC8_WGMXCCGn1
    SolutionIndex: 275
    SolutionNameMin: Cijk_Alik_Bljk_F8NBS_STA_BH_Bias_HAS_SAB_SAVUserArgs_MT192x256x128_MI16x16x1_SN_LDSB1_GRVWB16_GSU1_GSUC0_GSUWGMRR0_K1_LBSPPB2048_MIWT3_16_NLCA2_SU8_SUM0_SUS128_VWB16_WG64_4_1_WGM8_WGMXCC8_WGMXCCGn1
    SolutionIndex: 276
    SolutionNameMin: Cijk_Alik_Bljk_F8NBS_STA_BH_Bias_HAS_SAB_SAVUserArgs_MT320x176x128_MI16x16x1_SN_LDSB0_GRVWB8_GSU1_GSUC0_GSUWGMRR0_K1_LBSPPB128_MIWT5_11_NLCA2_SU0_SUM0_SUS128_VWB1_WG64_4_1_WGM8_WGMXCC8_WGMXCCGn1
    SolutionIndex: 277
    SolutionNameMin: Cijk_Alik_Bljk_F8NBS_STA_BH_Bias_HAS_SAB_SAVUserArgs_MT256x144x128_MI16x16x1_SN_LDSB0_GRVWB8_GSU1_GSUC0_GSUWGMRR0_K1_LBSPPB128_MIWT4_9_NLCA2_SU8_SUM0_SUS128_VWB1_WG64_4_1_WGM6_WGMXCC8_WGMXCCGn1
    SolutionIndex: 278
    SolutionNameMin: Cijk_Alik_Bljk_F8NBS_STA_BH_Bias_HAS_SAB_SAVUserArgs_MT320x176x128_MI16x16x1_SN_LDSB0_GRVWB8_GSU1_GSUC0_GSUWGMRR0_K1_LBSPPB128_MIWT5_11_NLCA2_SU0_SUM0_SUS128_VWB1_WG64_4_1_WGM6_WGMXCC8_WGMXCCGn1
    SolutionIndex: 279
    SolutionNameMin: Cijk_Alik_Bljk_F8NBS_STA_BH_Bias_HAS_SAB_SAVUserArgs_MT256x256x128_MI16x16x1_SN_LDSB1_GRVWB16_GSU1_GSUC0_GSUWGMRR0_K1_LBSPPB2048_MIWT4_16_NLCA2_SU8_SUM0_SUS128_VWB16_WG64_4_1_WGM6_WGMXCC8_WGMXCCGn1
    SolutionIndex: 280
    SolutionNameMin: Cijk_Alik_Bljk_F8NBS_STA_BH_Bias_HAS_SAB_SAVUserArgs_MT256x256x128_MI16x16x1_SN_LDSB1_GRVWB16_GSU1_GSUC0_GSUWGMRR0_K1_LBSPPB2048_MIWT4_16_NLCA2_SU8_SUM0_SUS128_VWB16_WG64_4_1_WGM8_WGMXCC8_WGMXCCGn1
    SolutionIndex: 281
    SolutionNameMin: Cijk_Alik_Bljk_F8NBS_STA_BH_Bias_HAS_SAB_SAVUserArgs_MT256x208x128_MI16x16x1_SN_LDSB1_GRVWB8_GSU1_GSUC0_GSUWGMRR0_K1_LBSPPB128_MIWT4_13_NLCA2_SU0_SUM0_SUS128_VWB1_WG64_4_1_WGM1_WGMXCC8_WGMXCCGn1
    SolutionIndex: 282
    SolutionNameMin: Cijk_Alik_Bljk_F8NBS_STA_BH_Bias_HAS_SAB_SAVUserArgs_MT320x112x128_MI16x16x1_SN_LDSB0_GRVWB8_GSU1_GSUC0_GSUWGMRR0_K1_LBSPPB128_MIWT5_7_NLCA2_SU0_SUM0_SUS128_VWB1_WG64_4_1_WGM8_WGMXCC8_WGMXCCGn1
    SolutionIndex: 283
    SolutionNameMin: Cijk_Alik_Bljk_F8NBS_STA_BH_Bias_HAS_SAB_SAVUserArgs_MT320x176x128_MI16x16x1_SN_LDSB0_GRVWB8_GSU1_GSUC0_GSUWGMRR0_K1_LBSPPB128_MIWT5_11_NLCA2_SU8_SUM0_SUS128_VWB1_WG64_4_1_WGM6_WGMXCC8_WGMXCCGn1
    SolutionIndex: 284
    SolutionNameMin: Cijk_Alik_Bljk_F8NBS_STA_BH_Bias_HAS_SAB_SAVUserArgs_MT256x256x128_MI16x16x1_SN_LDSB1_GRVWB16_GSU1_GSUC0_GSUWGMRR0_K1_LBSPPB2048_MIWT4_16_NLCA2_SU0_SUM0_SUS128_VWB16_WG64_4_1_WGM8_WGMXCC8_WGMXCCGn1
    SolutionIndex: 285
    SolutionNameMin: Cijk_Alik_Bljk_F8NBS_STA_BH_Bias_HAS_SAB_SAVUserArgs_MT320x144x128_MI16x16x1_SN_LDSB0_GRVWB8_GSU1_GSUC0_GSUWGMRR0_K1_LBSPPB128_MIWT5_9_NLCA2_SU0_SUM0_SUS128_VWB1_WG64_4_1_WGM8_WGMXCC8_WGMXCCGn1
    SolutionIndex: 286
    SolutionNameMin: Cijk_Alik_Bljk_F8NBS_STA_BH_Bias_HAS_SAB_SAVUserArgs_MT320x144x128_MI16x16x1_SN_LDSB0_GRVWB8_GSU1_GSUC0_GSUWGMRR0_K1_LBSPPB128_MIWT5_9_NLCA2_SU8_SUM0_SUS128_VWB1_WG64_4_1_WGM8_WGMXCC8_WGMXCCGn1
    SolutionIndex: 287
    SolutionNameMin: Cijk_Alik_Bljk_F8NBS_STA_BH_Bias_HAS_SAB_SAVUserArgs_MT320x176x128_MI16x16x1_SN_LDSB0_GRVWB8_GSU1_GSUC0_GSUWGMRR0_K1_LBSPPB128_MIWT5_11_NLCA2_SU8_SUM0_SUS128_VWB1_WG64_4_1_WGM8_WGMXCC8_WGMXCCGn1
    SolutionIndex: 288
    SolutionNameMin: Cijk_Alik_Bljk_F8NBS_STA_BH_Bias_HAS_SAB_SAVUserArgs_MT320x208x128_MI16x16x1_SN_LDSB1_GRVWB8_GSU1_GSUC0_GSUWGMRR0_K1_LBSPPB128_MIWT5_13_NLCA2_SU8_SUM0_SUS128_VWB1_WG64_4_1_WGM8_WGMXCC8_WGMXCCGn1
    SolutionIndex: 289
    SolutionNameMin: Cijk_Alik_Bljk_F8NBS_STA_BH_Bias_HAS_SAB_SAVUserArgs_MT320x208x128_MI16x16x1_SN_LDSB1_GRVWB8_GSU1_GSUC0_GSUWGMRR0_K1_LBSPPB128_MIWT5_13_NLCA2_SU8_SUM0_SUS128_VWB1_WG64_4_1_WGM6_WGMXCC8_WGMXCCGn1
    SolutionIndex: 290
    SolutionNameMin: Cijk_Alik_Bljk_F8NBS_STA_BH_Bias_HAS_SABV_SAV_UserArgs_MT32x16x128_MI16x16x1_SN_LDSB0_GRVWB16_GSU1_GSUC0_GSUWGMRR0_K1_LBSPPB128_MIWT1_1_NLCA2_SU0_SUM0_SUS128_SVW1_VWA1_VWB1_WG32_4_1_WGM1_WGMXCC8_WGMXCCGn1
    SolutionIndex: 291
    SolutionNameMin: Cijk_Alik_Bljk_F8NBS_STA_BH_Bias_HAS_SABV_SAV_UserArgs_MT64x16x128_MI16x16x1_SN_LDSB0_GRVWB8_GSU1_GSUC0_GSUWGMRR0_K1_LBSPPB128_MIWT1_1_NLCA2_SU8_SUM0_SUS128_SVW1_VWA1_VWB1_WG64_4_1_WGM1_WGMXCC8_WGMXCCGn1
    SolutionIndex: 292
    SolutionNameMin: Cijk_Alik_Bljk_F8NBS_STA_BH_Bias_HAS_SABV_SAV_UserArgs_MT128x16x128_MI16x16x1_SN_LDSB0_GRVWB8_GSU1_GSUC0_GSUWGMRR0_K1_LBSPPB128_MIWT2_1_NLCA2_SU8_SUM0_SUS128_SVW2_VWA2_VWB1_WG64_4_1_WGM6_WGMXCC8_WGMXCCGn1
    SolutionIndex: 293
    SolutionNameMin: Cijk_Alik_Bljk_F8NBS_STA_BH_Bias_HAS_SABV_SAV_UserArgs_MT32x16x128_MI16x16x1_SN_LDSB0_GRVWB16_GSU1_GSUC0_GSUWGMRR0_K1_LBSPPB128_MIWT1_1_NLCA2_SU8_SUM0_SUS128_SVW1_VWA1_VWB1_WG32_4_1_WGM6_WGMXCC8_WGMXCCGn1
    SolutionIndex: 294
    SolutionNameMin: Cijk_Alik_Bljk_F8NBS_STA_BH_Bias_HAS_SABV_SAV_UserArgs_MT64x32x128_MI16x16x1_SN_LDSB0_GRVWB16_GSU1_GSUC0_GSUWGMRR0_K1_LBSPPB128_MIWT2_1_NLCA2_SU0_SUM0_SUS128_SVW2_VWA2_VWB1_WG32_8_1_WGM1_WGMXCC8_WGMXCCGn1
    SolutionIndex: 295
    SolutionNameMin: Cijk_Alik_Bljk_F8NBS_STA_BH_Bias_HAS_SABV_SAV_UserArgs_MT64x32x128_MI16x16x1_SN_LDSB0_GRVWB16_GSU1_GSUC0_GSUWGMRR0_K1_LBSPPB128_MIWT2_1_NLCA2_SU8_SUM0_SUS128_SVW2_VWA2_VWB1_WG32_8_1_WGM6_WGMXCC8_WGMXCCGn1
    SolutionIndex: 296
    SolutionNameMin: Cijk_Alik_Bljk_F8NBS_STA_BH_Bias_HAS_SABV_SAV_UserArgs_MT64x64x128_MI16x16x1_SN_LDSB0_GRVWB16_GSU1_GSUC0_GSUWGMRR0_K1_LBSPPB256_MIWT2_2_NLCA2_SU0_SUM0_SUS128_SVW2_VWA2_VWB2_WG32_8_1_WGM1_WGMXCC8_WGMXCCGn1
    SolutionIndex: 297
    SolutionNameMin: Cijk_Alik_Bljk_F8NBS_STA_BH_Bias_HAS_SABV_SAV_UserArgs_MT64x32x128_MI16x16x1_SN_LDSB0_GRVWB16_GSU1_GSUC0_GSUWGMRR0_K1_LBSPPB128_MIWT2_1_NLCA2_SU0_SUM0_SUS128_SVW2_VWA2_VWB1_WG32_8_1_WGM8_WGMXCC8_WGMXCCGn1
    SolutionIndex: 298
    SolutionNameMin: Cijk_Alik_Bljk_F8NBS_STA_BH_Bias_HAS_SABV_SAV_UserArgs_MT64x64x128_MI16x16x1_SN_LDSB0_GRVWB16_GSU1_GSUC0_GSUWGMRR0_K1_LBSPPB256_MIWT2_2_NLCA2_SU8_SUM0_SUS128_SVW2_VWA2_VWB2_WG32_8_1_WGM1_WGMXCC8_WGMXCCGn1
    SolutionIndex: 299
    SolutionNameMin: Cijk_Alik_Bljk_F8NBS_STA_BH_Bias_HAS_SABV_SAV_UserArgs_MT64x64x128_MI16x16x1_SN_LDSB0_GRVWB16_GSU1_GSUC0_GSUWGMRR0_K1_LBSPPB256_MIWT2_2_NLCA2_SU8_SUM0_SUS128_SVW2_VWA2_VWB2_WG32_8_1_WGM8_WGMXCC8_WGMXCCGn1
    SolutionIndex: 300
    SolutionNameMin: Cijk_Alik_Bljk_F8NBS_STA_BH_Bias_HAS_SABV_SAV_UserArgs_MT128x32x128_MI16x16x1_SN_LDSB0_GRVWB16_GSU1_GSUC0_GSUWGMRR0_K1_LBSPPB256_MIWT2_2_NLCA2_SU0_SUM0_SUS128_SVW2_VWA2_VWB2_WG64_4_1_WGM8_WGMXCC8_WGMXCCGn1
    SolutionIndex: 301
    SolutionNameMin: Cijk_Alik_Bljk_F8NBS_STA_BH_Bias_HAS_SABV_SAV_UserArgs_MT64x64x128_MI16x16x1_SN_LDSB0_GRVWB16_GSU1_GSUC0_GSUWGMRR0_K1_LBSPPB256_MIWT2_2_NLCA2_SU0_SUM0_SUS128_SVW2_VWA2_VWB2_WG32_8_1_WGM6_WGMXCC8_WGMXCCGn1
    SolutionIndex: 302
    SolutionNameMin: Cijk_Alik_Bljk_F8NBS_STA_BH_Bias_HAS_SABV_SAV_UserArgs_MT64x96x128_MI16x16x1_SN_LDSB0_GRVWB16_GSU1_GSUC0_GSUWGMRR0_K1_LBSPPB128_MIWT2_3_NLCA2_SU0_SUM0_SUS128_SVW2_VWA2_VWB1_WG32_8_1_WGM1_WGMXCC8_WGMXCCGn1
    SolutionIndex: 303
    SolutionNameMin: Cijk_Alik_Bljk_F8NBS_STA_BH_Bias_HAS_SABV_SAV_UserArgs_MT64x96x128_MI16x16x1_SN_LDSB0_GRVWB16_GSU1_GSUC0_GSUWGMRR0_K1_LBSPPB128_MIWT2_3_NLCA2_SU0_SUM0_SUS128_SVW2_VWA2_VWB1_WG32_8_1_WGM8_WGMXCC8_WGMXCCGn1
    SolutionIndex: 304
    SolutionNameMin: Cijk_Alik_Bljk_F8NBS_STA_BH_Bias_HAS_SABV_SAV_UserArgs_MT128x64x128_MI16x16x1_SN_LDSB0_GRVWB16_GSU1_GSUC0_GSUWGMRR0_K1_LBSPPB512_MIWT2_4_NLCA2_SU8_SUM0_SUS128_SVW2_VWA2_VWB4_WG64_4_1_WGM6_WGMXCC8_WGMXCCGn1
    SolutionIndex: 305
    SolutionNameMin: Cijk_Alik_Bljk_F8NBS_STA_BH_Bias_HAS_SABV_SAV_UserArgs_MT128x48x128_MI16x16x1_SN_LDSB0_GRVWB8_GSU1_GSUC0_GSUWGMRR0_K1_LBSPPB128_MIWT2_3_NLCA2_SU8_SUM0_SUS128_SVW2_VWA2_VWB1_WG64_4_1_WGM8_WGMXCC8_WGMXCCGn1
    SolutionIndex: 306
    SolutionNameMin: Cijk_Alik_Bljk_F8NBS_STA_BH_Bias_HAS_SABV_SAV_UserArgs_MT128x64x128_MI16x16x1_SN_LDSB0_GRVWB16_GSU1_GSUC0_GSUWGMRR0_K1_LBSPPB256_MIWT4_2_NLCA2_SU8_SUM0_SUS128_SVW4_VWA4_VWB2_WG32_8_1_WGM8_WGMXCC8_WGMXCCGn1
    SolutionIndex: 307
    SolutionNameMin: Cijk_Alik_Bljk_F8NBS_STA_BH_Bias_HAS_SABV_SAV_UserArgs_MT128x64x128_MI16x16x1_SN_LDSB0_GRVWB16_GSU1_GSUC0_GSUWGMRR0_K1_LBSPPB512_MIWT2_4_NLCA2_SU8_SUM0_SUS128_SVW2_VWA2_VWB4_WG64_4_1_WGM8_WGMXCC8_WGMXCCGn1
    SolutionIndex: 308
    SolutionNameMin: Cijk_Alik_Bljk_F8NBS_STA_BH_Bias_HAS_SABV_SAV_UserArgs_MT64x80x128_MI16x16x1_SN_LDSB0_GRVWB8_GSU1_GSUC0_GSUWGMRR0_K1_LBSPPB128_MIWT1_5_NLCA2_SU8_SUM0_SUS128_SVW1_VWA1_VWB1_WG64_4_1_WGM1_WGMXCC8_WGMXCCGn1
    SolutionIndex: 309
    SolutionNameMin: Cijk_Alik_Bljk_F8NBS_STA_BH_Bias_HAS_SABV_SAV_UserArgs_MT256x32x128_MI16x16x1_SN_LDSB0_GRVWB16_GSU1_GSUC0_GSUWGMRR0_K1_LBSPPB256_MIWT4_2_NLCA2_SU8_SUM0_SUS128_SVW4_VWA4_VWB2_WG64_4_1_WGM8_WGMXCC8_WGMXCCGn1
    SolutionIndex: 310
    SolutionNameMin: Cijk_Alik_Bljk_F8NBS_STA_BH_Bias_HAS_SABV_SAV_UserArgs_MT128x32x128_MI16x16x1_SN_LDSB0_GRVWB16_GSU1_GSUC0_GSUWGMRR0_K1_LBSPPB256_MIWT2_2_NLCA2_SU0_SUM0_SUS128_SVW2_VWA2_VWB2_WG64_4_1_WGM6_WGMXCC8_WGMXCCGn1
    SolutionIndex: 311
    SolutionNameMin: Cijk_Alik_Bljk_F8NBS_STA_BH_Bias_HAS_SABV_SAV_UserArgs_MT256x48x128_MI16x16x1_SN_LDSB0_GRVWB8_GSU1_GSUC0_GSUWGMRR0_K1_LBSPPB128_MIWT4_3_NLCA2_SU8_SUM0_SUS128_SVW4_VWA4_VWB1_WG64_4_1_WGM8_WGMXCC8_WGMXCCGn1
    SolutionIndex: 312
    SolutionNameMin: Cijk_Alik_Bljk_F8NBS_STA_BH_Bias_HAS_SABV_SAV_UserArgs_MT128x96x128_MI16x16x1_SN_LDSB0_GRVWB16_GSU1_GSUC0_GSUWGMRR0_K1_LBSPPB128_MIWT4_3_NLCA2_SU8_SUM0_SUS128_SVW4_VWA4_VWB1_WG32_8_1_WGM6_WGMXCC8_WGMXCCGn1
    SolutionIndex: 313
    SolutionNameMin: Cijk_Alik_Bljk_F8NBS_STA_BH_Bias_HAS_SABV_SAV_UserArgs_MT256x48x128_MI16x16x1_SN_LDSB0_GRVWB8_GSU1_GSUC0_GSUWGMRR0_K1_LBSPPB128_MIWT4_3_NLCA2_SU8_SUM0_SUS128_SVW4_VWA4_VWB1_WG64_4_1_WGM6_WGMXCC8_WGMXCCGn1
    SolutionIndex: 314
    SolutionNameMin: Cijk_Alik_Bljk_F8NBS_STA_BH_Bias_HAS_SABV_SAV_UserArgs_MT128x96x128_MI16x16x1_SN_LDSB0_GRVWB16_GSU1_GSUC0_GSUWGMRR0_K1_LBSPPB256_MIWT2_6_NLCA2_SU8_SUM0_SUS128_SVW2_VWA2_VWB2_WG64_4_1_WGM8_WGMXCC8_WGMXCCGn1
    SolutionIndex: 315
    SolutionNameMin: Cijk_Alik_Bljk_F8NBS_STA_BH_Bias_HAS_SABV_SAV_UserArgs_MT64x96x128_MI16x16x1_SN_LDSB0_GRVWB16_GSU1_GSUC0_GSUWGMRR0_K1_LBSPPB128_MIWT2_3_NLCA2_SU8_SUM0_SUS128_SVW2_VWA2_VWB1_WG32_8_1_WGM6_WGMXCC8_WGMXCCGn1
    SolutionIndex: 316
    SolutionNameMin: Cijk_Alik_Bljk_F8NBS_STA_BH_Bias_HAS_SABV_SAV_UserArgs_MT256x64x128_MI16x16x1_SN_LDSB0_GRVWB16_GSU1_GSUC0_GSUWGMRR0_K1_LBSPPB512_MIWT4_4_NLCA2_SU8_SUM0_SUS128_SVW4_VWA4_VWB4_WG64_4_1_WGM6_WGMXCC8_WGMXCCGn1
    SolutionIndex: 317
    SolutionNameMin: Cijk_Alik_Bljk_F8NBS_STA_BH_Bias_HAS_SABV_SAV_UserArgs_MT128x64x128_MI16x16x1_SN_LDSB0_GRVWB16_GSU1_GSUC0_GSUWGMRR0_K1_LBSPPB512_MIWT2_4_NLCA2_SU0_SUM0_SUS128_SVW2_VWA2_VWB4_WG64_4_1_WGM6_WGMXCC8_WGMXCCGn1
    SolutionIndex: 318
    SolutionNameMin: Cijk_Alik_Bljk_F8NBS_STA_BH_Bias_HAS_SABV_SAV_UserArgs_MT256x64x128_MI16x16x1_SN_LDSB0_GRVWB16_GSU1_GSUC0_GSUWGMRR0_K1_LBSPPB512_MIWT4_4_NLCA2_SU8_SUM0_SUS128_SVW4_VWA4_VWB4_WG64_4_1_WGM8_WGMXCC8_WGMXCCGn1
    SolutionIndex: 319
    SolutionNameMin: Cijk_Alik_Bljk_F8NBS_STA_BH_Bias_HAS_SABV_SAV_UserArgs_MT128x128x128_MI16x16x1_SN_LDSB1_GRVWB16_GSU1_GSUC0_GSUWGMRR0_K1_LBSPPB512_MIWT4_4_NLCA2_SU8_SUM0_SUS128_SVW4_VWA4_VWB4_WG32_8_1_WGM6_WGMXCC8_WGMXCCGn1
    SolutionIndex: 320
    SolutionNameMin: Cijk_Alik_Bljk_F8NBS_STA_BH_Bias_HAS_SABV_SAV_UserArgs_MT256x80x128_MI16x16x1_SN_LDSB0_GRVWB8_GSU1_GSUC0_GSUWGMRR0_K1_LBSPPB128_MIWT4_5_NLCA2_SU8_SUM0_SUS128_SVW4_VWA4_VWB1_WG64_4_1_WGM6_WGMXCC8_WGMXCCGn1
    SolutionIndex: 321
    SolutionNameMin: Cijk_Alik_Bljk_F8NBS_STA_BH_Bias_HAS_SABV_SAV_UserArgs_MT128x160x128_MI16x16x1_SN_LDSB1_GRVWB16_GSU1_GSUC0_GSUWGMRR0_K1_LBSPPB128_MIWT4_5_NLCA2_SU8_SUM0_SUS128_SVW4_VWA4_VWB1_WG32_8_1_WGM6_WGMXCC8_WGMXCCGn1
    SolutionIndex: 322
    SolutionNameMin: Cijk_Alik_Bljk_F8NBS_STA_BH_Bias_HAS_SABV_SAV_UserArgs_MT128x192x128_MI16x16x1_SN_LDSB1_GRVWB16_GSU1_GSUC0_GSUWGMRR0_K1_LBSPPB256_MIWT4_6_NLCA2_SU0_SUM0_SUS128_SVW4_VWA4_VWB2_WG32_8_1_WGM1_WGMXCC8_WGMXCCGn1
    SolutionIndex: 323
    SolutionNameMin: Cijk_Alik_Bljk_F8NBS_STA_BH_Bias_HAS_SABV_SAV_UserArgs_MT128x96x128_MI16x16x1_SN_LDSB0_GRVWB16_GSU1_GSUC0_GSUWGMRR0_K1_LBSPPB256_MIWT2_6_NLCA2_SU0_SUM0_SUS128_SVW2_VWA2_VWB2_WG64_4_1_WGM6_WGMXCC8_WGMXCCGn1
    SolutionIndex: 324
    SolutionNameMin: Cijk_Alik_Bljk_F8NBS_STA_BH_Bias_HAS_SABV_SAV_UserArgs_MT256x96x128_MI16x16x1_SN_LDSB0_GRVWB16_GSU1_GSUC0_GSUWGMRR0_K1_LBSPPB256_MIWT4_6_NLCA2_SU8_SUM0_SUS128_SVW4_VWA4_VWB2_WG64_4_1_WGM6_WGMXCC8_WGMXCCGn1
    SolutionIndex: 325
    SolutionNameMin: Cijk_Alik_Bljk_F8NBS_STA_BH_Bias_HAS_SABV_SAV_UserArgs_MT128x96x128_MI16x16x1_SN_LDSB0_GRVWB16_GSU1_GSUC0_GSUWGMRR0_K1_LBSPPB256_MIWT2_6_NLCA2_SU0_SUM0_SUS128_SVW2_VWA2_VWB2_WG64_4_1_WGM8_WGMXCC8_WGMXCCGn1
    SolutionIndex: 326
    SolutionNameMin: Cijk_Alik_Bljk_F8NBS_STA_BH_Bias_HAS_SABV_SAV_UserArgs_MT256x112x128_MI16x16x1_SN_LDSB1_GRVWB8_GSU1_GSUC0_GSUWGMRR0_K1_LBSPPB128_MIWT4_7_NLCA2_SU8_SUM0_SUS128_SVW4_VWA4_VWB1_WG64_4_1_WGM6_WGMXCC8_WGMXCCGn1
    SolutionIndex: 327
    SolutionNameMin: Cijk_Alik_Bljk_F8NBS_STA_BH_Bias_HAS_SABV_SAV_UserArgs_MT256x128x128_MI16x16x1_SN_LDSB1_GRVWB16_GSU1_GSUC0_GSUWGMRR0_K1_LBSPPB1024_MIWT4_8_NLCA2_SU8_SUM0_SUS128_SVW4_VWA4_VWB8_WG64_4_1_WGM6_WGMXCC8_WGMXCCGn1
    SolutionIndex: 328
    SolutionNameMin: Cijk_Alik_Bljk_F8NBS_STA_BH_Bias_HAS_SABV_SAV_UserArgs_MT128x128x128_MI16x16x1_SN_LDSB1_GRVWB16_GSU1_GSUC0_GSUWGMRR0_K1_LBSPPB1024_MIWT2_8_NLCA2_SU8_SUM0_SUS128_SVW2_VWA2_VWB8_WG64_4_1_WGM8_WGMXCC8_WGMXCCGn1
    SolutionIndex: 329
    SolutionNameMin: Cijk_Alik_Bljk_F8NBS_STA_BH_Bias_HAS_SABV_SAV_UserArgs_MT256x128x128_MI16x16x1_SN_LDSB1_GRVWB16_GSU1_GSUC0_GSUWGMRR0_K1_LBSPPB1024_MIWT4_8_NLCA2_SU8_SUM0_SUS128_SVW4_VWA4_VWB8_WG64_4_1_WGM8_WGMXCC8_WGMXCCGn1
    SolutionIndex: 330
    SolutionNameMin: Cijk_Alik_Bljk_F8NBS_STA_BH_Bias_HAS_SABV_SAV_UserArgs_MT128x128x128_MI16x16x1_SN_LDSB1_GRVWB16_GSU1_GSUC0_GSUWGMRR0_K1_LBSPPB1024_MIWT2_8_NLCA2_SU0_SUM0_SUS128_SVW2_VWA2_VWB8_WG64_4_1_WGM8_WGMXCC8_WGMXCCGn1
    SolutionIndex: 331
    SolutionNameMin: Cijk_Alik_Bljk_F8NBS_STA_BH_Bias_HAS_SABV_SAV_UserArgs_MT256x144x128_MI16x16x1_SN_LDSB0_GRVWB8_GSU1_GSUC0_GSUWGMRR0_K1_LBSPPB128_MIWT4_9_NLCA2_SU8_SUM0_SUS128_SVW4_VWA4_VWB1_WG64_4_1_WGM6_WGMXCC8_WGMXCCGn1
    SolutionIndex: 332
    SolutionNameMin: Cijk_Alik_Bljk_F8NBS_STA_BH_Bias_HAS_SABV_SAV_UserArgs_MT256x160x128_MI16x16x1_SN_LDSB0_GRVWB16_GSU1_GSUC0_GSUWGMRR0_K1_LBSPPB256_MIWT4_10_NLCA2_SU8_SUM0_SUS128_SVW4_VWA4_VWB2_WG64_4_1_WGM6_WGMXCC8_WGMXCCGn1
    SolutionIndex: 333
    SolutionNameMin: Cijk_Alik_Bljk_F8NBS_STA_BH_Bias_HAS_SABV_SAV_UserArgs_MT256x96x128_MI16x16x1_SN_LDSB0_GRVWB16_GSU1_GSUC0_GSUWGMRR0_K1_LBSPPB256_MIWT4_6_NLCA2_SU8_SUM0_SUS128_SVW4_VWA4_VWB2_WG64_4_1_WGM1_WGMXCC8_WGMXCCGn1
    SolutionIndex: 334
    SolutionNameMin: Cijk_Alik_Bljk_F8NBS_STA_BH_Bias_HAS_SABV_SAV_UserArgs_MT256x96x128_MI16x16x1_SN_LDSB0_GRVWB16_GSU1_GSUC0_GSUWGMRR0_K1_LBSPPB256_MIWT4_6_NLCA2_SU0_SUM0_SUS128_SVW4_VWA4_VWB2_WG64_4_1_WGM8_WGMXCC8_WGMXCCGn1
    SolutionIndex: 335
    SolutionNameMin: Cijk_Alik_Bljk_F8NBS_STA_BH_Bias_HAS_SABV_SAV_UserArgs_MT128x192x128_MI16x16x1_SN_LDSB1_GRVWB16_GSU1_GSUC0_GSUWGMRR0_K1_LBSPPB256_MIWT4_6_NLCA2_SU8_SUM0_SUS128_SVW4_VWA4_VWB2_WG32_8_1_WGM8_WGMXCC8_WGMXCCGn1
    SolutionIndex: 336
    SolutionNameMin: Cijk_Alik_Bljk_F8NBS_STA_BH_Bias_HAS_SABV_SAV_UserArgs_MT256x96x128_MI16x16x1_SN_LDSB0_GRVWB16_GSU1_GSUC0_GSUWGMRR0_K1_LBSPPB256_MIWT4_6_NLCA2_SU8_SUM0_SUS128_SVW4_VWA4_VWB2_WG64_4_1_WGM8_WGMXCC8_WGMXCCGn1
    SolutionIndex: 337
    SolutionNameMin: Cijk_Alik_Bljk_F8NBS_STA_BH_Bias_HAS_SABV_SAV_UserArgs_MT256x256x128_MI16x16x1_SN_LDSB1_GRVWB16_GSU1_GSUC0_GSUWGMRR0_K1_LBSPPB2048_MIWT4_16_NLCA2_SU8_SUM0_SUS128_SVW4_VWA4_VWB16_WG64_4_1_WGM6_WGMXCC8_WGMXCCGn1
    SolutionIndex: 338
    SolutionNameMin: Cijk_Alik_Bljk_F8NBS_STA_BH_Bias_HAS_SABV_SAV_UserArgs_MT256x256x128_MI16x16x1_SN_LDSB1_GRVWB16_GSU1_GSUC0_GSUWGMRR0_K1_LBSPPB2048_MIWT4_16_NLCA2_SU0_SUM0_SUS128_SVW4_VWA4_VWB16_WG64_4_1_WGM8_WGMXCC8_WGMXCCGn1
    SolutionIndex: 339
    SolutionNameMin: Cijk_Alik_Bljk_F8NBS_STA_BH_Bias_HAS_SABV_SAV_UserArgs_MT256x224x128_MI16x16x1_SN_LDSB0_GRVWB16_GSU1_GSUC0_GSUWGMRR0_K1_LBSPPB256_MIWT4_14_NLCA2_SU8_SUM0_SUS128_SVW4_VWA4_VWB2_WG64_4_1_WGM1_WGMXCC8_WGMXCCGn1
    SolutionIndex: 340
    SolutionNameMin: Cijk_Alik_Bljk_F8NBS_STA_BH_Bias_HAS_SABV_SAV_UserArgs_MT256x224x128_MI16x16x1_SN_LDSB0_GRVWB16_GSU1_GSUC0_GSUWGMRR0_K1_LBSPPB256_MIWT4_14_NLCA2_SU8_SUM0_SUS128_SVW4_VWA4_VWB2_WG64_4_1_WGM6_WGMXCC8_WGMXCCGn1
    SolutionIndex: 341
    SolutionNameMin: Cijk_Alik_Bljk_F8NBS_STA_BH_Bias_HAS_SABV_SAV_UserArgs_MT256x256x128_MI16x16x1_SN_LDSB1_GRVWB16_GSU1_GSUC0_GSUWGMRR0_K1_LBSPPB2048_MIWT4_16_NLCA2_SU8_SUM0_SUS128_SVW4_VWA4_VWB16_WG64_4_1_WGM8_WGMXCC8_WGMXCCGn1
    SolutionIndex: 342
    SolutionNameMin: Cijk_Alik_Bljk_F8NBS_STA_BH_Bias_HAS_SABV_SAV_UserArgs_MT256x256x128_MI16x16x1_SN_LDSB1_GRVWB16_GSU1_GSUC0_GSUWGMRR0_K1_LBSPPB2048_MIWT4_16_NLCA2_SU0_SUM0_SUS128_SVW4_VWA4_VWB16_WG64_4_1_WGM1_WGMXCC8_WGMXCCGn1
    SolutionIndex: 343
    SolutionNameMin: Cijk_Alik_Bljk_F8NBS_STA_BH_Bias_HAS_SABV_SAV_UserArgs_MT128x160x128_MI16x16x1_SN_LDSB1_GRVWB16_GSU1_GSUC0_GSUWGMRR0_K1_LBSPPB128_MIWT4_5_NLCA2_SU0_SUM0_SUS128_SVW4_VWA4_VWB1_WG32_8_1_WGM8_WGMXCC8_WGMXCCGn1
    SolutionIndex: 344
    SolutionNameMin: Cijk_Alik_Bljk_F8NBS_STA_BH_Bias_HAS_SABV_SAV_UserArgs_MT256x224x128_MI16x16x1_SN_LDSB0_GRVWB16_GSU1_GSUC0_GSUWGMRR0_K1_LBSPPB256_MIWT4_14_NLCA2_SU0_SUM0_SUS128_SVW4_VWA4_VWB2_WG64_4_1_WGM8_WGMXCC8_WGMXCCGn1
    SolutionIndex: 345
    SolutionNameMin: Cijk_Alik_Bljk_F8NBS_STA_BH_Bias_HAS_SABV_SAV_UserArgs_MT256x256x128_MI16x16x1_SN_LDSB1_GRVWB16_GSU1_GSUC0_GSUWGMRR0_K1_LBSPPB2048_MIWT4_16_NLCA2_SU0_SUM0_SUS128_SVW4_VWA4_VWB16_WG64_4_1_WGM6_WGMXCC8_WGMXCCGn1
    SolutionIndex: 346
    SolutionNameMin: Cijk_Alik_Bljk_F8NBS_STA_BH_Bias_HAS_SABV_SAV_UserArgs_MT256x96x128_MI16x16x1_SN_LDSB0_GRVWB16_GSU1_GSUC0_GSUWGMRR0_K1_LBSPPB256_MIWT4_6_NLCA2_SU0_SUM0_SUS128_SVW4_VWA4_VWB2_WG64_4_1_WGM6_WGMXCC8_WGMXCCGn1
    SolutionIndex: 347
    SolutionNameMin: Cijk_Alik_Bljk_F8NBS_STA_BH_Bias_HAS_SABV_SAV_UserArgs_MT128x192x128_MI16x16x1_SN_LDSB1_GRVWB16_GSU1_GSUC0_GSUWGMRR0_K1_LBSPPB256_MIWT4_6_NLCA2_SU0_SUM0_SUS128_SVW4_VWA4_VWB2_WG32_8_1_WGM8_WGMXCC8_WGMXCCGn1
    SolutionIndex: 348
    SolutionNameMin: Cijk_Alik_Bljk_F8NBS_STA_BH_Bias_HAS_SABV_SAV_UserArgs_MT256x224x128_MI16x16x1_SN_LDSB0_GRVWB16_GSU1_GSUC0_GSUWGMRR0_K1_LBSPPB256_MIWT4_14_NLCA2_SU0_SUM0_SUS128_SVW4_VWA4_VWB2_WG64_4_1_WGM6_WGMXCC8_WGMXCCGn1
    SolutionIndex: 349
    SolutionNameMin: Cijk_Alik_Bljk_F8NBS_STA_BH_Bias_HAS_SABV_SAV_UserArgs_MT64x16x256_MI16x16x1_SN_LDSB0_GRVWB16_GSU1_GSUC0_GSUWGMRR0_K1_LBSPPB256_MIWT1_1_NLCA4_SU8_SUM0_SUS256_SVW1_VWA1_VWB1_WG64_4_1_WGM8_WGMXCC8_WGMXCCGn1
    SolutionIndex: 350
    SolutionNameMin: Cijk_Alik_Bljk_F8NBS_STA_BH_Bias_HAS_SABV_SAV_UserArgs_MT64x16x256_MI16x16x1_SN_LDSB0_GRVWB16_GSU1_GSUC0_GSUWGMRR0_K1_LBSPPB256_MIWT1_1_NLCA4_SU0_SUM0_SUS256_SVW1_VWA1_VWB1_WG64_4_1_WGM8_WGMXCC8_WGMXCCGn1
    SolutionIndex: 351
    SolutionNameMin: Cijk_Alik_Bljk_F8NBS_STA_BH_Bias_HAS_SABV_SAV_UserArgs_MT64x64x256_MI16x16x1_SN_LDSB1_GRVWB16_GSU1_GSUC0_GSUWGMRR0_K1_LBSPPB512_MIWT2_2_NLCA4_SU8_SUM0_SUS256_SVW2_VWA2_VWB2_WG32_8_1_WGM6_WGMXCC8_WGMXCCGn1
    SolutionIndex: 352
    SolutionNameMin: Cijk_Alik_Bljk_F8NBS_STA_BH_Bias_HAS_SABV_SAV_UserArgs_MT128x48x256_MI16x16x1_SN_LDSB0_GRVWB16_GSU1_GSUC0_GSUWGMRR0_K1_LBSPPB256_MIWT2_3_NLCA4_SU0_SUM0_SUS256_SVW2_VWA2_VWB1_WG64_4_1_WGM6_WGMXCC8_WGMXCCGn1
    SolutionIndex: 353
    SolutionNameMin: Cijk_Alik_Bljk_F8NBS_STA_BH_Bias_HAS_SABV_SAV_UserArgs_MT128x32x512_MI16x16x1_SN_LDSB1_GRVWB16_GSU1_GSUC0_GSUWGMRR0_K1_LBSPPB1024_MIWT2_2_NLCA8_SU0_SUM0_SUS512_SVW2_VWA2_VWB2_WG64_4_1_WGM8_WGMXCC8_WGMXCCGn1
    SolutionIndex: 354
    SolutionNameMin: Cijk_Alik_Bljk_F8NBS_STA_BH_Bias_HAS_SABV_SAV_UserArgs_MT64x80x256_MI16x16x1_SN_LDSB1_GRVWB16_GSU1_GSUC0_GSUWGMRR0_K1_LBSPPB256_MIWT1_5_NLCA4_SU8_SUM0_SUS256_SVW1_VWA1_VWB1_WG64_4_1_WGM8_WGMXCC8_WGMXCCGn1
    SolutionIndex: 355
    SolutionNameMin: Cijk_Alik_Bljk_F8NBS_STA_BH_Bias_HAS_SABV_SAV_UserArgs_MT64x96x256_MI16x16x1_SN_LDSB1_GRVWB16_GSU1_GSUC0_GSUWGMRR0_K1_LBSPPB256_MIWT2_3_NLCA4_SU0_SUM0_SUS256_SVW2_VWA2_VWB1_WG32_8_1_WGM6_WGMXCC8_WGMXCCGn1
    SolutionIndex: 356
    SolutionNameMin: Cijk_Alik_Bljk_F8NBS_STA_BH_Bias_HAS_SABV_SAV_UserArgs_MT64x96x256_MI16x16x1_SN_LDSB1_GRVWB16_GSU1_GSUC0_GSUWGMRR0_K1_LBSPPB256_MIWT2_3_NLCA4_SU8_SUM0_SUS256_SVW2_VWA2_VWB1_WG32_8_1_WGM6_WGMXCC8_WGMXCCGn1
    SolutionIndex: 357
    SolutionNameMin: Cijk_Alik_Bljk_F8NBS_STA_BH_Bias_HAS_SABV_SAV_UserArgs_MT128x48x256_MI16x16x1_SN_LDSB0_GRVWB16_GSU1_GSUC0_GSUWGMRR0_K1_LBSPPB256_MIWT2_3_NLCA4_SU0_SUM0_SUS256_SVW2_VWA2_VWB1_WG64_4_1_WGM8_WGMXCC8_WGMXCCGn1
    SolutionIndex: 358
    SolutionNameMin: Cijk_Alik_Bljk_F8NBS_STA_BH_Bias_HAS_SABV_SAV_UserArgs_MT128x64x256_MI16x16x1_SN_LDSB1_GRVWB16_GSU1_GSUC0_GSUWGMRR0_K1_LBSPPB1024_MIWT2_4_NLCA4_SU0_SUM0_SUS256_SVW2_VWA2_VWB4_WG64_4_1_WGM8_WGMXCC8_WGMXCCGn1
    SolutionIndex: 359
    SolutionNameMin: Cijk_Alik_Bljk_F8NBS_STA_BH_Bias_HAS_SABV_SAV_UserArgs_MT128x64x256_MI16x16x1_SN_LDSB1_GRVWB16_GSU1_GSUC0_GSUWGMRR0_K1_LBSPPB1024_MIWT2_4_NLCA4_SU0_SUM0_SUS256_SVW2_VWA2_VWB4_WG64_4_1_WGM6_WGMXCC8_WGMXCCGn1
    SolutionIndex: 360
    SolutionNameMin: Cijk_Alik_Bljk_F8NBS_STA_BH_Bias_HAS_SABV_SAV_UserArgs_MT128x64x256_MI16x16x1_SN_LDSB1_GRVWB16_GSU1_GSUC0_GSUWGMRR0_K1_LBSPPB1024_MIWT2_4_NLCA4_SU8_SUM0_SUS256_SVW2_VWA2_VWB4_WG64_4_1_WGM8_WGMXCC8_WGMXCCGn1
    SolutionIndex: 361
    SolutionNameMin: Cijk_Alik_Bljk_F8NBS_STA_BH_Bias_HAS_SABV_SAV_UserArgs_MT128x80x256_MI16x16x1_SN_LDSB1_GRVWB16_GSU1_GSUC0_GSUWGMRR0_K1_LBSPPB256_MIWT2_5_NLCA4_SU0_SUM0_SUS256_SVW2_VWA2_VWB1_WG64_4_1_WGM8_WGMXCC8_WGMXCCGn1
    SolutionIndex: 362
    SolutionNameMin: Cijk_Alik_Bljk_F8NBS_STA_BH_Bias_HAS_SABV_SAV_UserArgs_MT128x96x256_MI16x16x1_SN_LDSB1_GRVWB16_GSU1_GSUC0_GSUWGMRR0_K1_LBSPPB512_MIWT2_6_NLCA4_SU8_SUM0_SUS256_SVW2_VWA2_VWB2_WG64_4_1_WGM6_WGMXCC8_WGMXCCGn1
    SolutionIndex: 363
    SolutionNameMin: Cijk_Alik_Bljk_F8NBS_STA_BH_Bias_HAS_SABV_SAV_UserArgs_MT128x96x256_MI16x16x1_SN_LDSB1_GRVWB16_GSU1_GSUC0_GSUWGMRR0_K1_LBSPPB256_MIWT4_3_NLCA4_SU0_SUM0_SUS256_SVW4_VWA4_VWB1_WG32_8_1_WGM8_WGMXCC8_WGMXCCGn1
    SolutionIndex: 364
    SolutionNameMin: Cijk_Alik_Bljk_F8NBS_STA_BH_Bias_HAS_SABV_SAV_UserArgs_MT128x112x256_MI16x16x1_SN_LDSB1_GRVWB16_GSU1_GSUC0_GSUWGMRR0_K1_LBSPPB256_MIWT2_7_NLCA4_SU8_SUM0_SUS256_SVW2_VWA2_VWB1_WG64_4_1_WGM8_WGMXCC8_WGMXCCGn1
    SolutionIndex: 365
    SolutionNameMin: Cijk_Alik_Bljk_F8NBS_STA_BH_Bias_HAS_SABV_SAV_UserArgs_MT128x80x256_MI16x16x1_SN_LDSB1_GRVWB16_GSU1_GSUC0_GSUWGMRR0_K1_LBSPPB256_MIWT2_5_NLCA4_SU0_SUM0_SUS256_SVW2_VWA2_VWB1_WG64_4_1_WGM6_WGMXCC8_WGMXCCGn1
    SolutionIndex: 366
    SolutionNameMin: Cijk_Alik_Bljk_F8NBS_STA_BH_Bias_HAS_SABV_SAV_UserArgs_MT256x80x256_MI16x16x1_SN_LDSB1_GRVWB16_GSU1_GSUC0_GSUWGMRR0_K1_LBSPPB256_MIWT4_5_NLCA4_SU8_SUM0_SUS256_SVW4_VWA4_VWB1_WG64_4_1_WGM8_WGMXCC8_WGMXCCGn1
    SolutionIndex: 367
    SolutionNameMin: Cijk_Alik_Bljk_F8NBS_STA_BH_Bias_HAS_SABV_SAV_UserArgs_MT128x96x256_MI16x16x1_SN_LDSB1_GRVWB16_GSU1_GSUC0_GSUWGMRR0_K1_LBSPPB512_MIWT2_6_NLCA4_SU0_SUM0_SUS256_SVW2_VWA2_VWB2_WG64_4_1_WGM8_WGMXCC8_WGMXCCGn1
    SolutionIndex: 368
    SolutionNameMin: Cijk_Alik_Bljk_F8NBS_STA_BH_Bias_HAS_SABV_SAV_UserArgs_MT256x112x128_MI16x16x1_SN_LDSB1_GRVWB8_GSU1_GSUC0_GSUWGMRR0_K1_LBSPPB128_MIWT4_7_NLCA2_SU8_SUM0_SUS128_SVW4_VWA4_VWB1_WG64_4_1_WGM8_WGMXCC8_WGMXCCGn1
    SolutionIndex: 369
    SolutionNameMin: Cijk_Alik_Bljk_F8NBS_STA_BH_Bias_HAS_SABV_SAV_UserArgs_MT256x144x128_MI16x16x1_SN_LDSB0_GRVWB8_GSU1_GSUC0_GSUWGMRR0_K1_LBSPPB128_MIWT4_9_NLCA2_SU8_SUM0_SUS128_SVW4_VWA4_VWB1_WG64_4_1_WGM8_WGMXCC8_WGMXCCGn1
    SolutionIndex: 370
    SolutionNameMin: Cijk_Alik_Bljk_F8NBS_STA_BH_Bias_HAS_SABV_SAV_UserArgs_MT256x176x128_MI16x16x1_SN_LDSB0_GRVWB8_GSU1_GSUC0_GSUWGMRR0_K1_LBSPPB128_MIWT4_11_NLCA2_SU8_SUM0_SUS128_SVW4_VWA4_VWB1_WG64_4_1_WGM6_WGMXCC8_WGMXCCGn1
    SolutionIndex: 371
    SolutionNameMin: Cijk_Alik_Bljk_F8NBS_STA_BH_Bias_HAS_SABV_SAV_UserArgs_MT256x192x128_MI16x16x1_SN_LDSB0_GRVWB16_GSU1_GSUC0_GSUWGMRR0_K1_LBSPPB512_MIWT4_12_NLCA2_SU8_SUM0_SUS128_SVW4_VWA4_VWB4_WG64_4_1_WGM8_WGMXCC8_WGMXCCGn1
    SolutionIndex: 372
    SolutionNameMin: Cijk_Alik_Bljk_F8NBS_STA_BH_Bias_HAS_SABV_SAV_UserArgs_MT256x208x128_MI16x16x1_SN_LDSB1_GRVWB8_GSU1_GSUC0_GSUWGMRR0_K1_LBSPPB128_MIWT4_13_NLCA2_SU8_SUM0_SUS128_SVW4_VWA4_VWB1_WG64_4_1_WGM6_WGMXCC8_WGMXCCGn1
    SolutionIndex: 373
    SolutionNameMin: Cijk_Alik_Bljk_F8NBS_STA_BH_Bias_HAS_SABV_SAV_UserArgs_MT256x208x128_MI16x16x1_SN_LDSB1_GRVWB8_GSU1_GSUC0_GSUWGMRR0_K1_LBSPPB128_MIWT4_13_NLCA2_SU0_SUM0_SUS128_SVW4_VWA4_VWB1_WG64_4_1_WGM6_WGMXCC8_WGMXCCGn1
    SolutionIndex: 374
    SolutionNameMin: Cijk_Alik_Bljk_F8NBS_STA_BH_Bias_HAS_SABV_SAV_UserArgs_MT256x224x128_MI16x16x1_SN_LDSB0_GRVWB16_GSU1_GSUC0_GSUWGMRR0_K1_LBSPPB256_MIWT4_14_NLCA2_SU8_SUM0_SUS128_SVW4_VWA4_VWB2_WG64_4_1_WGM8_WGMXCC8_WGMXCCGn1
    SolutionIndex: 375
    SolutionNameMin: Cijk_Alik_Bljk_F8NBS_STA_BH_Bias_HAS_SABV_SAV_UserArgs_MT256x240x128_MI16x16x1_SN_LDSB1_GRVWB8_GSU1_GSUC0_GSUWGMRR0_K1_LBSPPB128_MIWT4_15_NLCA2_SU8_SUM0_SUS128_SVW4_VWA4_VWB1_WG64_4_1_WGM8_WGMXCC8_WGMXCCGn1
    SolutionIndex: 376
    SolutionNameMin: Cijk_Alik_Bljk_F8NBS_STA_BH_Bias_HAS_SABV_SAV_UserArgs_MT256x240x128_MI16x16x1_SN_LDSB1_GRVWB8_GSU1_GSUC0_GSUWGMRR0_K1_LBSPPB128_MIWT4_15_NLCA2_SU8_SUM0_SUS128_SVW4_VWA4_VWB1_WG64_4_1_WGM6_WGMXCC8_WGMXCCGn1
    SolutionIndex: 377
    SolutionNameMin: Cijk_Alik_Bljk_F8NBS_STA_BH_Bias_HAS_SABV_SAV_UserArgs_MT256x160x128_MI16x16x1_SN_LDSB0_GRVWB16_GSU1_GSUC0_GSUWGMRR0_K1_LBSPPB256_MIWT4_10_NLCA2_SU0_SUM0_SUS128_SVW4_VWA4_VWB2_WG64_4_1_WGM6_WGMXCC8_WGMXCCGn1
    SolutionIndex: 378
    SolutionNameMin: Cijk_Alik_Bljk_F8NBS_STA_BH_Bias_HAS_SABV_SAV_UserArgs_MT256x80x128_MI16x16x1_SN_LDSB0_GRVWB8_GSU1_GSUC0_GSUWGMRR0_K1_LBSPPB128_MIWT4_5_NLCA2_SU0_SUM0_SUS128_SVW4_VWA4_VWB1_WG64_4_1_WGM8_WGMXCC8_WGMXCCGn1
    SolutionIndex: 379
    SolutionNameMin: Cijk_Alik_Bljk_F8NBS_STA_BH_Bias_HAS_SABV_SAV_UserArgs_MT256x176x128_MI16x16x1_SN_LDSB0_GRVWB8_GSU1_GSUC0_GSUWGMRR0_K1_LBSPPB128_MIWT4_11_NLCA2_SU8_SUM0_SUS128_SVW4_VWA4_VWB1_WG64_4_1_WGM8_WGMXCC8_WGMXCCGn1
    SolutionIndex: 380
    SolutionNameMin: Cijk_Alik_Bljk_F8NBS_STA_BH_Bias_HAS_SABV_SAV_UserArgs_MT256x240x128_MI16x16x1_SN_LDSB1_GRVWB8_GSU1_GSUC0_GSUWGMRR0_K1_LBSPPB128_MIWT4_15_NLCA2_SU0_SUM0_SUS128_SVW4_VWA4_VWB1_WG64_4_1_WGM8_WGMXCC8_WGMXCCGn1
    SolutionIndex: 381
    SolutionNameMin: Cijk_Alik_Bljk_F8NBS_STA_BH_Bias_HAS_SABV_SAV_UserArgs_MT256x240x128_MI16x16x1_SN_LDSB1_GRVWB8_GSU1_GSUC0_GSUWGMRR0_K1_LBSPPB128_MIWT4_15_NLCA2_SU0_SUM0_SUS128_SVW4_VWA4_VWB1_WG64_4_1_WGM6_WGMXCC8_WGMXCCGn1
    SolutionIndex: 382
    SolutionNameMin: Cijk_Alik_Bljk_F8NBS_STA_BH_Bias_HAS_SABV_SAV_UserArgs_MT256x96x128_MI16x16x1_SN_LDSB0_GRVWB16_GSU1_GSUC0_GSUWGMRR0_K1_LBSPPB256_MIWT4_6_NLCA2_SU0_SUM0_SUS128_SVW1_VWA1_VWB2_WG64_4_1_WGM8_WGMXCC8_WGMXCCGn1
    SolutionIndex: 383
    SolutionNameMin: Cijk_Alik_Bljk_F8NBS_STA_BH_Bias_HAS_SABV_SAV_UserArgs_MT256x176x128_MI16x16x1_SN_LDSB0_GRVWB8_GSU1_GSUC0_GSUWGMRR0_K1_LBSPPB128_MIWT4_11_NLCA2_SU0_SUM0_SUS128_SVW4_VWA4_VWB1_WG64_4_1_WGM6_WGMXCC8_WGMXCCGn1
- - - [2048, 16, 1, 5120]
    - [123, 20.34]
  - - [2048, 32, 1, 5120]
    - [131, 39.46]
  - - [2048, 48, 1, 5120]
    - [131, 58.44]
  - - [2048, 64, 1, 5120]
    - [131, 73.77]
  - - [2048, 80, 1, 5120]
    - [132, 80.56]
  - - [2048, 96, 1, 5120]
    - [132, 90.85]
  - - [2048, 112, 1, 5120]
    - [132, 100.15]
  - - [2048, 128, 1, 5120]
    - [132, 110.29]
  - - [2048, 144, 1, 5120]
    - [130, 110.8]
  - - [2048, 160, 1, 5120]
    - [133, 124.1]
  - - [4096, 16, 1, 5120]
    - [138, 35.82]
  - - [4096, 32, 1, 5120]
    - [131, 60.69]
  - - [4096, 48, 1, 5120]
    - [132, 80.46]
  - - [4096, 64, 1, 5120]
    - [132, 99.09]
  - - [4096, 80, 1, 5120]
    - [133, 107.0]
  - - [4096, 96, 1, 5120]
    - [133, 130.13]
  - - [4096, 112, 1, 5120]
    - [139, 134.3]
  - - [4096, 128, 1, 5120]
    - [133, 155.03]
  - - [4096, 144, 1, 5120]
    - [136, 157.64]
  - - [4096, 160, 1, 5120]
    - [140, 173.25]
  - - [16384, 16, 1, 5120]
    - [144, 59.04]
  - - [16384, 32, 1, 5120]
    - [145, 106.53]
  - - [16384, 48, 1, 5120]
    - [146, 136.97]
  - - [16384, 64, 1, 5120]
    - [140, 173.52]
  - - [16384, 80, 1, 5120]
    - [147, 180.26]
  - - [16384, 96, 1, 5120]
    - [141, 212.65]
  - - [16384, 112, 1, 5120]
    - [143, 219.59]
  - - [16384, 128, 1, 5120]
    - [143, 260.54]
  - - [16384, 144, 1, 5120]
    - [148, 267.9]
  - - [16384, 160, 1, 5120]
    - [147, 283.39]
  - - [5120, 16, 1, 8192]
    - [138, 44.88]
  - - [5120, 32, 1, 8192]
    - [132, 73.68]
  - - [5120, 48, 1, 8192]
    - [132, 101.07]
  - - [5120, 64, 1, 8192]
    - [133, 115.99]
  - - [5120, 80, 1, 8192]
    - [133, 128.7]
  - - [5120, 96, 1, 8192]
    - [133, 156.82]
  - - [5120, 112, 1, 8192]
    - [167, 160.6]
  - - [5120, 128, 1, 8192]
    - [140, 180.47]
  - - [5120, 144, 1, 8192]
    - [136, 190.89]
  - - [5120, 160, 1, 8192]
    - [140, 209.13]
  - - [5120, 176, 1, 8192]
    - [140, 214.21]
  - - [5120, 192, 1, 8192]
    - [140, 230.22]
  - - [5120, 208, 1, 8192]
    - [140, 225.21]
  - - [5120, 224, 1, 8192]
    - [140, 242.29]
  - - [5120, 240, 1, 8192]
    - [141, 246.56]
  - - [5120, 256, 1, 8192]
    - [143, 256.88]
  - - [2048, 176, 1, 5120]
    - [130, 128.41]
  - - [2048, 192, 1, 5120]
    - [130, 141.31]
  - - [2048, 208, 1, 5120]
    - [133, 143.24]
  - - [2048, 224, 1, 5120]
    - [133, 154.15]
  - - [2048, 240, 1, 5120]
    - [133, 154.76]
  - - [2048, 256, 1, 5120]
    - [133, 168.73]
  - - [2048, 272, 1, 5120]
    - [130, 159.0]
  - - [2048, 288, 1, 5120]
    - [130, 173.09]
  - - [2048, 304, 1, 5120]
    - [134, 166.86]
  - - [2048, 320, 1, 5120]
    - [135, 175.86]
  - - [2048, 336, 1, 5120]
    - [136, 183.75]
  - - [2048, 352, 1, 5120]
    - [137, 188.25]
  - - [2048, 368, 1, 5120]
    - [136, 189.05]
  - - [2048, 384, 1, 5120]
    - [137, 197.69]
  - - [2048, 400, 1, 5120]
    - [4, 198.07]
  - - [2048, 416, 1, 5120]
    - [6, 209.52]
  - - [2048, 432, 1, 5120]
    - [7, 203.87]
  - - [2048, 448, 1, 5120]
    - [4, 217.49]
  - - [2048, 464, 1, 5120]
    - [4, 209.79]
  - - [2048, 480, 1, 5120]
    - [6, 225.71]
  - - [2048, 496, 1, 5120]
    - [6, 218.82]
  - - [2048, 512, 1, 5120]
    - [6, 232.72]
  - - [2048, 544, 1, 5120]
    - [5, 237.12]
  - - [2048, 576, 1, 5120]
    - [5, 245.74]
  - - [2048, 608, 1, 5120]
    - [6, 253.16]
  - - [2048, 640, 1, 5120]
    - [8, 246.87]
  - - [2048, 672, 1, 5120]
    - [9, 254.99]
  - - [2048, 704, 1, 5120]
    - [8, 264.0]
  - - [2048, 736, 1, 5120]
    - [10, 263.17]
  - - [2048, 768, 1, 5120]
    - [8, 279.52]
  - - [2048, 800, 1, 5120]
    - [11, 277.44]
  - - [2048, 832, 1, 5120]
    - [12, 291.28]
  - - [2048, 864, 1, 5120]
    - [9, 297.56]
  - - [2048, 896, 1, 5120]
    - [8, 302.73]
  - - [2048, 928, 1, 5120]
    - [12, 294.09]
  - - [2048, 960, 1, 5120]
    - [8, 316.12]
  - - [2048, 992, 1, 5120]
    - [13, 307.02]
  - - [2048, 1024, 1, 5120]
    - [8, 332.38]
  - - [2048, 1088, 1, 5120]
    - [8, 334.17]
  - - [2048, 1152, 1, 5120]
    - [12, 353.34]
  - - [2048, 1216, 1, 5120]
    - [8, 346.93]
  - - [2048, 1280, 1, 5120]
    - [14, 346.19]
  - - [2048, 1344, 1, 5120]
    - [15, 351.22]
  - - [2048, 1408, 1, 5120]
    - [16, 345.01]
  - - [2048, 1472, 1, 5120]
    - [16, 351.09]
  - - [2048, 1536, 1, 5120]
    - [16, 374.64]
  - - [2048, 1600, 1, 5120]
    - [16, 370.73]
  - - [2048, 1664, 1, 5120]
    - [16, 381.91]
  - - [2048, 1728, 1, 5120]
    - [16, 396.6]
  - - [2048, 1792, 1, 5120]
    - [15, 390.68]
  - - [2048, 1856, 1, 5120]
    - [17, 366.49]
  - - [2048, 1920, 1, 5120]
    - [18, 379.61]
  - - [2048, 1984, 1, 5120]
    - [17, 386.61]
  - - [2048, 2048, 1, 5120]
    - [17, 393.42]
  - - [2048, 2176, 1, 5120]
    - [17, 399.26]
  - - [2048, 2304, 1, 5120]
    - [19, 409.31]
  - - [2048, 2432, 1, 5120]
    - [17, 419.62]
  - - [2048, 2560, 1, 5120]
    - [20, 414.01]
  - - [2048, 2688, 1, 5120]
    - [21, 412.64]
  - - [2048, 2816, 1, 5120]
    - [22, 420.71]
  - - [2048, 2944, 1, 5120]
    - [23, 418.34]
  - - [2048, 3072, 1, 5120]
    - [24, 435.88]
  - - [2048, 3200, 1, 5120]
    - [25, 428.07]
  - - [2048, 3328, 1, 5120]
    - [24, 439.84]
  - - [2048, 3456, 1, 5120]
    - [25, 462.18]
  - - [2048, 3584, 1, 5120]
    - [24, 457.34]
  - - [2048, 3712, 1, 5120]
    - [26, 424.89]
  - - [2048, 3840, 1, 5120]
    - [27, 432.86]
  - - [2048, 3968, 1, 5120]
    - [28, 434.66]
  - - [2048, 4096, 1, 5120]
    - [29, 448.23]
  - - [4096, 176, 1, 5120]
    - [140, 175.86]
  - - [4096, 192, 1, 5120]
    - [140, 196.3]
  - - [4096, 208, 1, 5120]
    - [140, 194.44]
  - - [4096, 224, 1, 5120]
    - [140, 214.27]
  - - [4096, 240, 1, 5120]
    - [140, 213.04]
  - - [4096, 256, 1, 5120]
    - [140, 237.07]
  - - [4096, 272, 1, 5120]
    - [141, 217.32]
  - - [4096, 288, 1, 5120]
    - [141, 234.53]
  - - [4096, 304, 1, 5120]
    - [142, 228.31]
  - - [4096, 320, 1, 5120]
    - [143, 247.85]
  - - [4096, 336, 1, 5120]
    - [141, 253.3]
  - - [4096, 352, 1, 5120]
    - [141, 248.09]
  - - [4096, 368, 1, 5120]
    - [141, 257.67]
  - - [4096, 384, 1, 5120]
    - [143, 276.8]
  - - [4096, 400, 1, 5120]
    - [8, 261.19]
  - - [4096, 416, 1, 5120]
    - [13, 269.85]
  - - [4096, 432, 1, 5120]
    - [9, 281.31]
  - - [4096, 448, 1, 5120]
    - [8, 298.57]
  - - [4096, 464, 1, 5120]
    - [8, 282.7]
  - - [4096, 480, 1, 5120]
    - [8, 291.23]
  - - [4096, 496, 1, 5120]
    - [8, 296.49]
  - - [4096, 512, 1, 5120]
    - [8, 318.16]
  - - [4096, 544, 1, 5120]
    - [12, 302.15]
  - - [4096, 576, 1, 5120]
    - [12, 324.1]
  - - [4096, 608, 1, 5120]
    - [32, 315.72]
  - - [4096, 640, 1, 5120]
    - [32, 338.16]
  - - [4096, 672, 1, 5120]
    - [15, 344.15]
  - - [4096, 704, 1, 5120]
    - [33, 339.63]
  - - [4096, 736, 1, 5120]
    - [34, 343.12]
  - - [4096, 768, 1, 5120]
    - [15, 366.92]
  - - [4096, 800, 1, 5120]
    - [16, 359.35]
  - - [4096, 832, 1, 5120]
    - [16, 364.0]
  - - [4096, 864, 1, 5120]
    - [16, 391.35]
  - - [4096, 896, 1, 5120]
    - [35, 368.56]
  - - [4096, 928, 1, 5120]
    - [36, 354.66]
  - - [4096, 960, 1, 5120]
    - [17, 378.28]
  - - [4096, 992, 1, 5120]
    - [36, 373.81]
  - - [4096, 1024, 1, 5120]
    - [17, 388.38]
  - - [4096, 1088, 1, 5120]
    - [18, 390.86]
  - - [4096, 1152, 1, 5120]
    - [18, 414.81]
  - - [4096, 1216, 1, 5120]
    - [19, 415.54]
  - - [4096, 1280, 1, 5120]
    - [37, 401.76]
  - - [4096, 1344, 1, 5120]
    - [24, 412.84]
  - - [4096, 1408, 1, 5120]
    - [23, 420.93]
  - - [4096, 1472, 1, 5120]
    - [38, 411.51]
  - - [4096, 1536, 1, 5120]
    - [21, 439.77]
  - - [4096, 1600, 1, 5120]
    - [24, 430.53]
  - - [4096, 1664, 1, 5120]
    - [24, 433.16]
  - - [4096, 1728, 1, 5120]
    - [21, 446.49]
  - - [4096, 1792, 1, 5120]
    - [21, 451.39]
  - - [4096, 1856, 1, 5120]
    - [39, 423.05]
  - - [4096, 1920, 1, 5120]
    - [40, 435.63]
  - - [4096, 1984, 1, 5120]
    - [39, 432.31]
  - - [4096, 2048, 1, 5120]
    - [29, 442.57]
  - - [4096, 2176, 1, 5120]
    - [39, 453.18]
  - - [4096, 2304, 1, 5120]
    - [28, 461.64]
  - - [4096, 2432, 1, 5120]
    - [29, 475.45]
  - - [4096, 2560, 1, 5120]
    - [41, 485.52]
  - - [4096, 2688, 1, 5120]
    - [42, 474.21]
  - - [4096, 2816, 1, 5120]
    - [42, 481.58]
  - - [4096, 2944, 1, 5120]
    - [42, 488.34]
  - - [4096, 3072, 1, 5120]
    - [43, 479.66]
  - - [4096, 3200, 1, 5120]
    - [44, 474.17]
  - - [4096, 3328, 1, 5120]
    - [24, 485.99]
  - - [4096, 3456, 1, 5120]
    - [45, 499.08]
  - - [4096, 3584, 1, 5120]
    - [44, 502.15]
  - - [4096, 3712, 1, 5120]
    - [46, 486.31]
  - - [4096, 3840, 1, 5120]
    - [47, 483.41]
  - - [4096, 3968, 1, 5120]
    - [46, 502.42]
  - - [4096, 4096, 1, 5120]
    - [48, 499.78]
  - - [16384, 176, 1, 5120]
    - [149, 280.89]
  - - [16384, 192, 1, 5120]
    - [149, 317.95]
  - - [16384, 208, 1, 5120]
    - [150, 295.77]
  - - [16384, 224, 1, 5120]
    - [150, 323.58]
  - - [16384, 240, 1, 5120]
    - [151, 323.19]
  - - [16384, 256, 1, 5120]
    - [152, 350.49]
  - - [16384, 272, 1, 5120]
    - [153, 339.3]
  - - [16384, 288, 1, 5120]
    - [154, 370.77]
  - - [16384, 304, 1, 5120]
    - [155, 351.89]
  - - [16384, 320, 1, 5120]
    - [155, 387.92]
  - - [16384, 336, 1, 5120]
    - [156, 355.45]
  - - [16384, 352, 1, 5120]
    - [157, 371.34]
  - - [16384, 368, 1, 5120]
    - [157, 371.97]
  - - [16384, 384, 1, 5120]
    - [157, 407.22]
  - - [16384, 400, 1, 5120]
    - [51, 369.49]
  - - [16384, 416, 1, 5120]
    - [52, 372.66]
  - - [16384, 432, 1, 5120]
    - [52, 388.45]
  - - [16384, 448, 1, 5120]
    - [52, 404.14]
  - - [16384, 464, 1, 5120]
    - [53, 394.87]
  - - [16384, 480, 1, 5120]
    - [54, 413.82]
  - - [16384, 496, 1, 5120]
    - [29, 392.58]
  - - [16384, 512, 1, 5120]
    - [55, 419.22]
  - - [16384, 544, 1, 5120]
    - [56, 397.54]
  - - [16384, 576, 1, 5120]
    - [57, 434.45]
  - - [16384, 608, 1, 5120]
    - [41, 424.8]
  - - [16384, 640, 1, 5120]
    - [58, 458.59]
  - - [16384, 672, 1, 5120]
    - [59, 446.82]
  - - [16384, 704, 1, 5120]
    - [60, 437.23]
  - - [16384, 736, 1, 5120]
    - [61, 436.3]
  - - [16384, 768, 1, 5120]
    - [44, 469.01]
  - - [16384, 800, 1, 5120]
    - [62, 452.22]
  - - [16384, 832, 1, 5120]
    - [24, 451.77]
  - - [16384, 864, 1, 5120]
    - [24, 466.73]
  - - [16384, 896, 1, 5120]
    - [48, 482.62]
  - - [16384, 928, 1, 5120]
    - [63, 454.83]
  - - [16384, 960, 1, 5120]
    - [63, 468.74]
  - - [16384, 992, 1, 5120]
    - [64, 456.74]
  - - [16384, 1024, 1, 5120]
    - [65, 478.17]
  - - [16384, 1088, 1, 5120]
    - [63, 481.31]
  - - [16384, 1152, 1, 5120]
    - [66, 485.25]
  - - [16384, 1216, 1, 5120]
    - [21, 476.08]
  - - [16384, 1280, 1, 5120]
    - [24, 485.01]
  - - [16384, 1344, 1, 5120]
    - [24, 502.76]
  - - [16384, 1408, 1, 5120]
    - [42, 484.49]
  - - [16384, 1472, 1, 5120]
    - [67, 473.37]
  - - [16384, 1536, 1, 5120]
    - [24, 490.91]
  - - [16384, 1600, 1, 5120]
    - [24, 487.9]
  - - [16384, 1664, 1, 5120]
    - [21, 495.28]
  - - [16384, 1728, 1, 5120]
    - [21, 507.05]
  - - [16384, 1792, 1, 5120]
    - [24, 507.39]
  - - [16384, 1856, 1, 5120]
    - [24, 486.62]
  - - [16384, 1920, 1, 5120]
    - [24, 493.48]
  - - [16384, 1984, 1, 5120]
    - [48, 501.49]
  - - [16384, 2048, 1, 5120]
    - [63, 496.8]
  - - [16384, 2176, 1, 5120]
    - [68, 514.15]
  - - [16384, 2304, 1, 5120]
    - [66, 507.11]
  - - [16384, 2432, 1, 5120]
    - [69, 514.73]
  - - [16384, 2560, 1, 5120]
    - [24, 515.0]
  - - [16384, 2688, 1, 5120]
    - [21, 532.51]
  - - [16384, 2816, 1, 5120]
    - [42, 512.68]
  - - [16384, 2944, 1, 5120]
    - [24, 518.9]
  - - [16384, 3072, 1, 5120]
    - [21, 528.67]
  - - [16384, 3200, 1, 5120]
    - [63, 527.1]
  - - [16384, 3328, 1, 5120]
    - [63, 533.36]
  - - [16384, 3456, 1, 5120]
    - [21, 530.71]
  - - [16384, 3584, 1, 5120]
    - [44, 531.65]
  - - [16384, 3712, 1, 5120]
    - [24, 526.9]
  - - [16384, 3840, 1, 5120]
    - [21, 534.13]
  - - [16384, 3968, 1, 5120]
    - [24, 534.71]
  - - [16384, 4096, 1, 5120]
    - [48, 536.38]
  - - [5120, 272, 1, 8192]
    - [141, 260.42]
  - - [5120, 288, 1, 8192]
    - [141, 279.4]
  - - [5120, 304, 1, 8192]
    - [142, 277.44]
  - - [5120, 320, 1, 8192]
    - [143, 293.96]
  - - [5120, 336, 1, 8192]
    - [142, 303.34]
  - - [5120, 352, 1, 8192]
    - [143, 297.0]
  - - [5120, 368, 1, 8192]
    - [168, 303.31]
  - - [5120, 384, 1, 8192]
    - [168, 325.3]
  - - [5120, 400, 1, 8192]
    - [32, 315.52]
  - - [5120, 416, 1, 8192]
    - [8, 325.89]
  - - [5120, 432, 1, 8192]
    - [8, 321.76]
  - - [5120, 448, 1, 8192]
    - [8, 346.25]
  - - [5120, 464, 1, 8192]
    - [32, 324.41]
  - - [5120, 480, 1, 8192]
    - [33, 345.79]
  - - [5120, 496, 1, 8192]
    - [14, 330.56]
  - - [5120, 512, 1, 8192]
    - [32, 352.97]
  - - [5120, 544, 1, 8192]
    - [14, 363.45]
  - - [5120, 576, 1, 8192]
    - [15, 363.65]
  - - [5120, 608, 1, 8192]
    - [16, 353.2]
  - - [5120, 640, 1, 8192]
    - [70, 370.85]
  - - [5120, 672, 1, 8192]
    - [15, 398.77]
  - - [5120, 704, 1, 8192]
    - [70, 380.79]
  - - [5120, 736, 1, 8192]
    - [71, 374.48]
  - - [5120, 768, 1, 8192]
    - [72, 389.37]
  - - [5120, 800, 1, 8192]
    - [49, 383.45]
  - - [5120, 832, 1, 8192]
    - [17, 391.86]
  - - [5120, 864, 1, 8192]
    - [73, 394.88]
  - - [5120, 896, 1, 8192]
    - [74, 406.51]
  - - [5120, 928, 1, 8192]
    - [19, 388.98]
  - - [5120, 960, 1, 8192]
    - [18, 410.52]
  - - [5120, 992, 1, 8192]
    - [20, 397.5]
  - - [5120, 1024, 1, 8192]
    - [38, 412.64]
  - - [5120, 1088, 1, 8192]
    - [38, 421.7]
  - - [5120, 1152, 1, 8192]
    - [50, 421.61]
  - - [5120, 1216, 1, 8192]
    - [75, 451.99]
  - - [5120, 1280, 1, 8192]
    - [76, 431.44]
  - - [5120, 1344, 1, 8192]
    - [24, 438.84]
  - - [5120, 1408, 1, 8192]
    - [77, 444.17]
  - - [5120, 1472, 1, 8192]
    - [78, 439.24]
  - - [5120, 1536, 1, 8192]
    - [79, 451.38]
  - - [5120, 1600, 1, 8192]
    - [80, 444.02]
  - - [5120, 1664, 1, 8192]
    - [29, 453.55]
  - - [5120, 1728, 1, 8192]
    - [53, 461.59]
  - - [5120, 1792, 1, 8192]
    - [29, 468.34]
  - - [5120, 1856, 1, 8192]
    - [29, 456.86]
  - - [5120, 1920, 1, 8192]
    - [79, 479.3]
  - - [5120, 1984, 1, 8192]
    - [81, 470.39]
  - - [5120, 2048, 1, 8192]
    - [82, 469.31]
  - - [5120, 2176, 1, 8192]
    - [83, 477.82]
  - - [5120, 2304, 1, 8192]
    - [83, 487.71]
  - - [5120, 2432, 1, 8192]
    - [83, 499.64]
  - - [5120, 2560, 1, 8192]
    - [84, 493.1]
  - - [5120, 2688, 1, 8192]
    - [85, 493.24]
  - - [5120, 2816, 1, 8192]
    - [84, 506.48]
  - - [5120, 2944, 1, 8192]
    - [86, 489.97]
  - - [5120, 3072, 1, 8192]
    - [87, 506.22]
  - - [5120, 3200, 1, 8192]
    - [88, 499.83]
  - - [5120, 3328, 1, 8192]
    - [89, 526.78]
  - - [5120, 3456, 1, 8192]
    - [87, 513.18]
  - - [5120, 3584, 1, 8192]
    - [90, 527.61]
  - - [5120, 3712, 1, 8192]
    - [91, 516.02]
  - - [5120, 3840, 1, 8192]
    - [89, 541.28]
  - - [5120, 3968, 1, 8192]
    - [81, 483.75]
  - - [5120, 4096, 1, 8192]
    - [82, 486.12]
  - - [5120, 16, 1, 2048]
    - [166, 25.54]
  - - [5120, 32, 1, 2048]
    - [132, 47.05]
  - - [5120, 48, 1, 2048]
    - [132, 64.53]
  - - [5120, 64, 1, 2048]
    - [161, 79.09]
  - - [5120, 80, 1, 2048]
    - [161, 89.77]
  - - [5120, 96, 1, 2048]
    - [133, 104.55]
  - - [5120, 112, 1, 2048]
    - [161, 111.74]
  - - [5120, 128, 1, 2048]
    - [140, 120.31]
  - - [5120, 144, 1, 2048]
    - [136, 131.97]
  - - [5120, 160, 1, 2048]
    - [140, 139.52]
  - - [5120, 176, 1, 2048]
    - [140, 140.64]
  - - [5120, 192, 1, 2048]
    - [140, 159.15]
  - - [5120, 208, 1, 2048]
    - [140, 156.58]
  - - [5120, 224, 1, 2048]
    - [140, 171.37]
  - - [5120, 240, 1, 2048]
    - [141, 176.35]
  - - [5120, 256, 1, 2048]
    - [143, 177.7]
  - - [5120, 272, 1, 2048]
    - [141, 181.07]
  - - [5120, 288, 1, 2048]
    - [141, 197.62]
  - - [5120, 304, 1, 2048]
    - [141, 193.73]
  - - [5120, 320, 1, 2048]
    - [141, 203.99]
  - - [5120, 336, 1, 2048]
    - [141, 218.34]
  - - [5120, 352, 1, 2048]
    - [143, 195.09]
  - - [5120, 368, 1, 2048]
    - [143, 203.25]
  - - [5120, 384, 1, 2048]
    - [143, 225.25]
  - - [5120, 400, 1, 2048]
    - [92, 221.8]
  - - [5120, 416, 1, 2048]
    - [8, 220.94]
  - - [5120, 432, 1, 2048]
    - [8, 224.14]
  - - [5120, 448, 1, 2048]
    - [8, 247.1]
  - - [5120, 464, 1, 2048]
    - [92, 222.82]
  - - [5120, 480, 1, 2048]
    - [14, 246.01]
  - - [5120, 496, 1, 2048]
    - [14, 225.94]
  - - [5120, 512, 1, 2048]
    - [93, 236.62]
  - - [5120, 544, 1, 2048]
    - [32, 244.57]
  - - [5120, 576, 1, 2048]
    - [16, 257.49]
  - - [5120, 608, 1, 2048]
    - [10, 248.12]
  - - [5120, 640, 1, 2048]
    - [94, 253.51]
  - - [5120, 672, 1, 2048]
    - [34, 277.69]
  - - [5120, 704, 1, 2048]
    - [10, 272.38]
  - - [5120, 736, 1, 2048]
    - [95, 262.95]
  - - [5120, 768, 1, 2048]
    - [94, 282.37]
  - - [5120, 800, 1, 2048]
    - [96, 272.19]
  - - [5120, 832, 1, 2048]
    - [8, 293.49]
  - - [5120, 864, 1, 2048]
    - [97, 296.77]
  - - [5120, 896, 1, 2048]
    - [98, 307.31]
  - - [5120, 928, 1, 2048]
    - [96, 298.92]
  - - [5120, 960, 1, 2048]
    - [19, 317.07]
  - - [5120, 992, 1, 2048]
    - [14, 286.57]
  - - [5120, 1024, 1, 2048]
    - [50, 308.29]
  - - [5120, 1088, 1, 2048]
    - [75, 315.09]
  - - [5120, 1152, 1, 2048]
    - [50, 321.3]
  - - [5120, 1216, 1, 2048]
    - [75, 334.76]
  - - [5120, 1280, 1, 2048]
    - [76, 325.1]
  - - [5120, 1344, 1, 2048]
    - [21, 340.71]
  - - [5120, 1408, 1, 2048]
    - [99, 334.54]
  - - [5120, 1472, 1, 2048]
    - [19, 330.69]
  - - [5120, 1536, 1, 2048]
    - [39, 342.81]
  - - [5120, 1600, 1, 2048]
    - [32, 336.69]
  - - [5120, 1664, 1, 2048]
    - [29, 353.36]
  - - [5120, 1728, 1, 2048]
    - [39, 368.34]
  - - [5120, 1792, 1, 2048]
    - [29, 374.07]
  - - [5120, 1856, 1, 2048]
    - [19, 371.4]
  - - [5120, 1920, 1, 2048]
    - [26, 380.72]
  - - [5120, 1984, 1, 2048]
    - [75, 372.67]
  - - [5120, 2048, 1, 2048]
    - [75, 372.71]
  - - [5120, 2176, 1, 2048]
    - [75, 385.17]
  - - [5120, 2304, 1, 2048]
    - [83, 390.3]
  - - [5120, 2432, 1, 2048]
    - [100, 402.69]
  - - [5120, 2560, 1, 2048]
    - [51, 388.53]
  - - [5120, 2688, 1, 2048]
    - [21, 405.13]
  - - [5120, 2816, 1, 2048]
    - [77, 388.53]
  - - [5120, 2944, 1, 2048]
    - [76, 382.63]
  - - [5120, 3072, 1, 2048]
    - [101, 392.8]
  - - [5120, 3200, 1, 2048]
    - [75, 389.5]
  - - [5120, 3328, 1, 2048]
    - [102, 396.03]
  - - [5120, 3456, 1, 2048]
    - [103, 418.38]
  - - [5120, 3584, 1, 2048]
    - [91, 405.21]
  - - [5120, 3712, 1, 2048]
    - [104, 410.61]
  - - [5120, 3840, 1, 2048]
    - [105, 417.98]
  - - [5120, 3968, 1, 2048]
    - [21, 400.38]
  - - [5120, 4096, 1, 2048]
    - [106, 410.64]
  - - [896, 16, 1, 5120]
    - [123, 8.94]
  - - [896, 32, 1, 5120]
    - [124, 18.06]
  - - [896, 48, 1, 5120]
    - [124, 26.83]
  - - [896, 64, 1, 5120]
    - [125, 35.35]
  - - [896, 80, 1, 5120]
    - [125, 44.03]
  - - [896, 96, 1, 5120]
    - [125, 52.87]
  - - [896, 112, 1, 5120]
    - [125, 61.56]
  - - [896, 128, 1, 5120]
    - [125, 69.01]
  - - [896, 144, 1, 5120]
    - [126, 73.29]
  - - [896, 160, 1, 5120]
    - [126, 78.46]
  - - [1024, 16, 1, 5120]
    - [123, 10.22]
  - - [1024, 32, 1, 5120]
    - [124, 20.49]
  - - [1024, 48, 1, 5120]
    - [125, 30.36]
  - - [1024, 64, 1, 5120]
    - [131, 40.36]
  - - [1024, 80, 1, 5120]
    - [131, 50.41]
  - - [1024, 96, 1, 5120]
    - [125, 60.07]
  - - [1024, 112, 1, 5120]
    - [131, 69.83]
  - - [1024, 128, 1, 5120]
    - [131, 78.6]
  - - [1024, 144, 1, 5120]
    - [126, 76.17]
  - - [1024, 160, 1, 5120]
    - [127, 83.01]
  - - [1024, 176, 1, 5120]
    - [127, 89.5]
  - - [1024, 192, 1, 5120]
    - [128, 95.71]
  - - [1024, 208, 1, 5120]
    - [128, 99.45]
  - - [1024, 224, 1, 5120]
    - [128, 103.77]
  - - [1024, 240, 1, 5120]
    - [128, 108.83]
  - - [1024, 256, 1, 5120]
    - [128, 113.89]
  - - [1024, 272, 1, 5120]
    - [129, 113.67]
  - - [1024, 288, 1, 5120]
    - [130, 117.9]
  - - [1024, 304, 1, 5120]
    - [130, 123.89]
  - - [1024, 320, 1, 5120]
    - [130, 131.32]
  - - [1024, 336, 1, 5120]
    - [130, 131.58]
  - - [1024, 352, 1, 5120]
    - [130, 137.23]
  - - [1024, 368, 1, 5120]
    - [130, 141.77]
  - - [1024, 384, 1, 5120]
    - [130, 145.61]
  - - [1024, 400, 1, 5120]
    - [0, 122.44]
  - - [1024, 416, 1, 5120]
    - [0, 129.76]
  - - [1024, 432, 1, 5120]
    - [107, 129.42]
  - - [1024, 448, 1, 5120]
    - [0, 136.67]
  - - [1024, 464, 1, 5120]
    - [0, 133.17]
  - - [1024, 480, 1, 5120]
    - [0, 142.45]
  - - [1024, 496, 1, 5120]
    - [107, 141.07]
  - - [1024, 512, 1, 5120]
    - [0, 150.47]
  - - [1024, 544, 1, 5120]
    - [107, 152.98]
  - - [1024, 576, 1, 5120]
    - [0, 160.99]
  - - [1024, 608, 1, 5120]
    - [107, 163.62]
  - - [1024, 640, 1, 5120]
    - [108, 169.1]
  - - [1024, 672, 1, 5120]
    - [108, 170.72]
  - - [1024, 704, 1, 5120]
    - [109, 177.61]
  - - [1024, 736, 1, 5120]
    - [108, 179.47]
  - - [1024, 768, 1, 5120]
    - [108, 187.84]
  - - [1024, 800, 1, 5120]
    - [108, 190.92]
  - - [1024, 832, 1, 5120]
    - [108, 195.15]
  - - [1024, 864, 1, 5120]
    - [108, 198.56]
  - - [1024, 896, 1, 5120]
    - [109, 206.59]
  - - [1024, 928, 1, 5120]
    - [108, 210.71]
  - - [1024, 960, 1, 5120]
    - [108, 216.9]
  - - [1024, 992, 1, 5120]
    - [108, 219.57]
  - - [1024, 1024, 1, 5120]
    - [108, 223.32]
  - - [5120, 16, 1, 1024]
    - [160, 15.19]
  - - [5120, 32, 1, 1024]
    - [349, 25.74]
  - - [5120, 48, 1, 1024]
    - [350, 38.82]
  - - [5120, 64, 1, 1024]
    - [161, 50.49]
  - - [5120, 80, 1, 1024]
    - [161, 62.02]
  - - [5120, 96, 1, 1024]
    - [133, 74.12]
  - - [5120, 112, 1, 1024]
    - [161, 81.86]
  - - [5120, 128, 1, 1024]
    - [162, 86.25]
  - - [5120, 144, 1, 1024]
    - [136, 99.17]
  - - [5120, 160, 1, 1024]
    - [163, 104.11]
  - - [896, 176, 1, 5120]
    - [127, 80.47]
  - - [896, 192, 1, 5120]
    - [128, 85.28]
  - - [896, 208, 1, 5120]
    - [128, 91.89]
  - - [896, 224, 1, 5120]
    - [127, 97.62]
  - - [896, 240, 1, 5120]
    - [128, 101.45]
  - - [896, 256, 1, 5120]
    - [128, 105.61]
  - - [896, 272, 1, 5120]
    - [128, 107.52]
  - - [896, 288, 1, 5120]
    - [128, 110.51]
  - - [896, 304, 1, 5120]
    - [128, 113.19]
  - - [896, 320, 1, 5120]
    - [129, 117.15]
  - - [896, 336, 1, 5120]
    - [129, 121.6]
  - - [896, 352, 1, 5120]
    - [130, 127.29]
  - - [896, 368, 1, 5120]
    - [130, 130.33]
  - - [896, 384, 1, 5120]
    - [130, 135.72]
  - - [896, 400, 1, 5120]
    - [2, 131.11]
  - - [896, 416, 1, 5120]
    - [2, 137.17]
  - - [896, 432, 1, 5120]
    - [1, 136.43]
  - - [896, 448, 1, 5120]
    - [1, 140.99]
  - - [896, 464, 1, 5120]
    - [2, 143.43]
  - - [896, 480, 1, 5120]
    - [1, 148.01]
  - - [896, 496, 1, 5120]
    - [2, 151.32]
  - - [896, 512, 1, 5120]
    - [2, 156.02]
  - - [896, 544, 1, 5120]
    - [2, 158.89]
  - - [896, 576, 1, 5120]
    - [1, 163.19]
  - - [896, 608, 1, 5120]
    - [1, 168.64]
  - - [896, 640, 1, 5120]
    - [2, 173.48]
  - - [896, 672, 1, 5120]
    - [110, 178.58]
  - - [896, 704, 1, 5120]
    - [4, 176.34]
  - - [896, 736, 1, 5120]
    - [4, 178.8]
  - - [896, 768, 1, 5120]
    - [4, 183.0]
  - - [896, 800, 1, 5120]
    - [5, 188.41]
  - - [896, 832, 1, 5120]
    - [5, 189.9]
  - - [896, 864, 1, 5120]
    - [3, 193.83]
  - - [896, 896, 1, 5120]
    - [6, 199.42]
  - - [896, 928, 1, 5120]
    - [6, 204.45]
  - - [896, 960, 1, 5120]
    - [6, 209.14]
  - - [896, 992, 1, 5120]
    - [6, 214.21]
  - - [896, 1024, 1, 5120]
    - [6, 217.09]
  - - [896, 1088, 1, 5120]
    - [6, 222.81]
  - - [896, 1152, 1, 5120]
    - [111, 229.96]
  - - [896, 1216, 1, 5120]
    - [6, 236.0]
  - - [896, 1280, 1, 5120]
    - [111, 244.7]
  - - [896, 1344, 1, 5120]
    - [111, 250.63]
  - - [896, 1408, 1, 5120]
    - [30, 238.9]
  - - [896, 1472, 1, 5120]
    - [13, 248.18]
  - - [896, 1536, 1, 5120]
    - [112, 256.19]
  - - [896, 1600, 1, 5120]
    - [113, 257.52]
  - - [896, 1664, 1, 5120]
    - [113, 263.03]
  - - [896, 1728, 1, 5120]
    - [114, 273.34]
  - - [896, 1792, 1, 5120]
    - [12, 277.23]
  - - [896, 1856, 1, 5120]
    - [115, 282.67]
  - - [896, 1920, 1, 5120]
    - [114, 292.56]
  - - [896, 1984, 1, 5120]
    - [115, 295.95]
  - - [896, 2048, 1, 5120]
    - [13, 301.61]
  - - [896, 2176, 1, 5120]
    - [115, 311.23]
  - - [896, 2304, 1, 5120]
    - [115, 320.42]
  - - [896, 2432, 1, 5120]
    - [115, 337.07]
  - - [896, 2560, 1, 5120]
    - [115, 338.25]
  - - [896, 2688, 1, 5120]
    - [115, 337.47]
  - - [896, 2816, 1, 5120]
    - [116, 319.51]
  - - [896, 2944, 1, 5120]
    - [116, 327.89]
  - - [896, 3072, 1, 5120]
    - [117, 345.19]
  - - [896, 3200, 1, 5120]
    - [116, 351.26]
  - - [896, 3328, 1, 5120]
    - [33, 351.65]
  - - [896, 3456, 1, 5120]
    - [118, 360.41]
  - - [896, 3584, 1, 5120]
    - [119, 359.0]
  - - [896, 3712, 1, 5120]
    - [118, 366.85]
  - - [896, 3840, 1, 5120]
    - [118, 381.73]
  - - [896, 3968, 1, 5120]
    - [118, 374.5]
  - - [896, 4096, 1, 5120]
    - [118, 381.95]
  - - [896, 4352, 1, 5120]
    - [169, 359.11]
  - - [896, 4608, 1, 5120]
    - [170, 356.01]
  - - [896, 4864, 1, 5120]
    - [171, 363.98]
  - - [896, 5120, 1, 5120]
    - [171, 381.11]
  - - [896, 5376, 1, 5120]
    - [170, 391.2]
  - - [896, 5632, 1, 5120]
    - [172, 380.85]
  - - [896, 5888, 1, 5120]
    - [173, 373.25]
  - - [896, 6144, 1, 5120]
    - [174, 375.64]
  - - [896, 6400, 1, 5120]
    - [175, 380.9]
  - - [896, 6656, 1, 5120]
    - [175, 382.28]
  - - [896, 6912, 1, 5120]
    - [176, 388.46]
  - - [896, 7168, 1, 5120]
    - [177, 384.2]
  - - [896, 7424, 1, 5120]
    - [177, 393.53]
  - - [896, 7680, 1, 5120]
    - [177, 393.81]
  - - [896, 7936, 1, 5120]
    - [177, 400.11]
  - - [896, 8192, 1, 5120]
    - [178, 403.05]
  - - [896, 8448, 1, 5120]
    - [179, 406.85]
  - - [896, 8704, 1, 5120]
    - [179, 410.14]
  - - [896, 8960, 1, 5120]
    - [180, 412.17]
  - - [896, 9216, 1, 5120]
    - [181, 419.98]
  - - [896, 9728, 1, 5120]
    - [179, 427.69]
  - - [896, 9984, 1, 5120]
    - [182, 390.58]
  - - [5120, 16, 1, 640]
    - [158, 8.38]
  - - [5120, 32, 1, 640]
    - [290, 14.26]
  - - [5120, 48, 1, 640]
    - [291, 21.49]
  - - [5120, 64, 1, 640]
    - [292, 27.69]
  - - [5120, 80, 1, 640]
    - [293, 33.94]
  - - [5120, 96, 1, 640]
    - [294, 33.84]
  - - [5120, 112, 1, 640]
    - [292, 38.24]
  - - [5120, 128, 1, 640]
    - [295, 42.47]
  - - [5120, 144, 1, 640]
    - [296, 45.94]
  - - [5120, 160, 1, 640]
    - [297, 61.02]
  - - [5120, 176, 1, 640]
    - [298, 63.93]
  - - [5120, 192, 1, 640]
    - [299, 70.37]
  - - [5120, 208, 1, 640]
    - [159, 84.69]
  - - [5120, 224, 1, 640]
    - [300, 79.55]
  - - [5120, 240, 1, 640]
    - [301, 77.62]
  - - [5120, 256, 1, 640]
    - [299, 73.57]
  - - [5120, 272, 1, 640]
    - [302, 73.29]
  - - [5120, 288, 1, 640]
    - [303, 78.73]
  - - [5120, 304, 1, 640]
    - [299, 88.9]
  - - [5120, 320, 1, 640]
    - [304, 97.39]
  - - [5120, 336, 1, 640]
    - [305, 99.3]
  - - [5120, 352, 1, 640]
    - [306, 101.08]
  - - [5120, 368, 1, 640]
    - [306, 104.61]
  - - [5120, 384, 1, 640]
    - [307, 96.04]
  - - [5120, 400, 1, 640]
    - [308, 97.83]
  - - [5120, 416, 1, 640]
    - [306, 111.01]
  - - [5120, 432, 1, 640]
    - [306, 103.34]
  - - [5120, 448, 1, 640]
    - [309, 118.33]
  - - [5120, 464, 1, 640]
    - [310, 121.48]
  - - [5120, 480, 1, 640]
    - [300, 127.12]
  - - [5120, 496, 1, 640]
    - [311, 120.79]
  - - [5120, 512, 1, 640]
    - [311, 111.04]
  - - [5120, 544, 1, 640]
    - [312, 114.2]
  - - [5120, 576, 1, 640]
    - [313, 121.54]
  - - [5120, 608, 1, 640]
    - [314, 141.89]
  - - [5120, 640, 1, 640]
    - [315, 142.47]
  - - [5120, 672, 1, 640]
    - [315, 149.92]
  - - [5120, 704, 1, 640]
    - [311, 152.27]
  - - [5120, 736, 1, 640]
    - [316, 152.67]
  - - [5120, 768, 1, 640]
    - [317, 160.29]
  - - [5120, 800, 1, 640]
    - [318, 159.96]
  - - [5120, 832, 1, 640]
    - [307, 168.26]
  - - [5120, 864, 1, 640]
    - [319, 169.1]
  - - [5120, 896, 1, 640]
    - [307, 176.5]
  - - [5120, 928, 1, 640]
    - [318, 176.34]
  - - [5120, 960, 1, 640]
    - [307, 183.08]
  - - [5120, 992, 1, 640]
    - [320, 173.0]
  - - [5120, 1024, 1, 640]
    - [320, 175.92]
  - - [5120, 1088, 1, 640]
    - [321, 183.1]
  - - [5120, 1152, 1, 640]
    - [322, 180.74]
  - - [5120, 1216, 1, 640]
    - [323, 189.91]
  - - [5120, 1280, 1, 640]
    - [324, 196.71]
  - - [5120, 1344, 1, 640]
    - [325, 206.37]
  - - [5120, 1408, 1, 640]
    - [324, 209.72]
  - - [5120, 1472, 1, 640]
    - [326, 199.7]
  - - [5120, 1536, 1, 640]
    - [327, 211.1]
  - - [5120, 1600, 1, 640]
    - [326, 210.3]
  - - [5120, 1664, 1, 640]
    - [328, 220.1]
  - - [5120, 1728, 1, 640]
    - [329, 215.25]
  - - [5120, 1792, 1, 640]
    - [328, 227.66]
  - - [5120, 1856, 1, 640]
    - [327, 226.78]
  - - [5120, 1920, 1, 640]
    - [330, 239.54]
  - - [5120, 1984, 1, 640]
    - [331, 222.38]
  - - [5120, 2048, 1, 640]
    - [332, 226.95]
  - - [5120, 2176, 1, 640]
    - [332, 234.12]
  - - [5120, 2304, 1, 640]
    - [332, 240.07]
  - - [5120, 2432, 1, 640]
    - [333, 239.66]
  - - [5120, 2560, 1, 640]
    - [334, 247.56]
  - - [5120, 2688, 1, 640]
    - [335, 251.36]
  - - [5120, 2816, 1, 640]
    - [336, 261.24]
  - - [5120, 2944, 1, 640]
    - [337, 239.31]
  - - [5120, 3072, 1, 640]
    - [338, 256.17]
  - - [5120, 3200, 1, 640]
    - [339, 257.78]
  - - [5120, 3328, 1, 640]
    - [340, 262.48]
  - - [5120, 3456, 1, 640]
    - [337, 258.2]
  - - [5120, 3584, 1, 640]
    - [341, 280.39]
  - - [5120, 3712, 1, 640]
    - [342, 273.0]
  - - [5120, 3840, 1, 640]
    - [341, 291.08]
  - - [5120, 3968, 1, 640]
    - [334, 259.47]
  - - [5120, 4096, 1, 640]
    - [336, 265.94]
  - - [5120, 4352, 1, 640]
    - [343, 254.88]
  - - [5120, 4608, 1, 640]
    - [343, 261.7]
  - - [5120, 4864, 1, 640]
    - [336, 261.34]
  - - [5120, 5120, 1, 640]
    - [334, 270.83]
  - - [5120, 5376, 1, 640]
    - [336, 277.3]
  - - [5120, 5632, 1, 640]
    - [334, 286.25]
  - - [5120, 5888, 1, 640]
    - [344, 266.01]
  - - [5120, 6144, 1, 640]
    - [336, 268.98]
  - - [5120, 6400, 1, 640]
    - [344, 276.94]
  - - [5120, 6656, 1, 640]
    - [341, 284.16]
  - - [5120, 6912, 1, 640]
    - [338, 292.36]
  - - [5120, 7168, 1, 640]
    - [345, 298.66]
  - - [5120, 7424, 1, 640]
    - [345, 303.08]
  - - [5120, 7680, 1, 640]
    - [345, 309.37]
  - - [5120, 7936, 1, 640]
    - [334, 283.77]
  - - [5120, 8192, 1, 640]
    - [346, 286.0]
  - - [5120, 8448, 1, 640]
    - [334, 295.81]
  - - [5120, 8704, 1, 640]
    - [334, 297.04]
  - - [5120, 8960, 1, 640]
    - [336, 282.6]
  - - [5120, 9216, 1, 640]
    - [334, 288.83]
  - - [5120, 9728, 1, 640]
    - [334, 290.63]
  - - [5120, 9984, 1, 640]
    - [347, 294.24]
  - - [1024, 1088, 1, 5120]
    - [6, 238.8]
  - - [1024, 1152, 1, 5120]
    - [5, 248.5]
  - - [1024, 1216, 1, 5120]
    - [6, 251.98]
  - - [1024, 1280, 1, 5120]
    - [31, 248.55]
  - - [1024, 1344, 1, 5120]
    - [10, 257.76]
  - - [1024, 1408, 1, 5120]
    - [30, 262.28]
  - - [1024, 1472, 1, 5120]
    - [13, 269.34]
  - - [1024, 1536, 1, 5120]
    - [10, 279.9]
  - - [1024, 1600, 1, 5120]
    - [115, 279.89]
  - - [1024, 1664, 1, 5120]
    - [12, 289.62]
  - - [1024, 1728, 1, 5120]
    - [8, 295.21]
  - - [1024, 1792, 1, 5120]
    - [115, 302.11]
  - - [1024, 1856, 1, 5120]
    - [115, 308.93]
  - - [1024, 1920, 1, 5120]
    - [12, 314.73]
  - - [1024, 1984, 1, 5120]
    - [115, 319.56]
  - - [1024, 2048, 1, 5120]
    - [8, 325.42]
  - - [1024, 2176, 1, 5120]
    - [115, 333.98]
  - - [1024, 2304, 1, 5120]
    - [115, 344.8]
  - - [1024, 2432, 1, 5120]
    - [115, 347.35]
  - - [1024, 2560, 1, 5120]
    - [116, 340.47]
  - - [1024, 2688, 1, 5120]
    - [118, 346.28]
  - - [1024, 2816, 1, 5120]
    - [32, 348.51]
  - - [1024, 2944, 1, 5120]
    - [118, 355.65]
  - - [1024, 3072, 1, 5120]
    - [15, 370.62]
  - - [1024, 3200, 1, 5120]
    - [118, 372.4]
  - - [1024, 3328, 1, 5120]
    - [118, 375.88]
  - - [1024, 3456, 1, 5120]
    - [118, 385.65]
  - - [1024, 3584, 1, 5120]
    - [118, 391.82]
  - - [1024, 3712, 1, 5120]
    - [120, 365.85]
  - - [1024, 3840, 1, 5120]
    - [17, 373.39]
  - - [1024, 3968, 1, 5120]
    - [121, 379.66]
  - - [1024, 4096, 1, 5120]
    - [121, 388.25]
  - - [1024, 4352, 1, 5120]
    - [171, 390.6]
  - - [1024, 4608, 1, 5120]
    - [238, 402.93]
  - - [1024, 4864, 1, 5120]
    - [170, 407.46]
  - - [1024, 5120, 1, 5120]
    - [239, 387.67]
  - - [1024, 5376, 1, 5120]
    - [214, 393.45]
  - - [1024, 5632, 1, 5120]
    - [214, 397.23]
  - - [5120, 176, 1, 1024]
    - [163, 105.39]
  - - [5120, 192, 1, 1024]
    - [351, 105.98]
  - - [5120, 208, 1, 1024]
    - [352, 100.72]
  - - [5120, 224, 1, 1024]
    - [353, 109.63]
  - - [5120, 240, 1, 1024]
    - [354, 114.43]
  - - [5120, 256, 1, 1024]
    - [355, 119.69]
  - - [5120, 272, 1, 1024]
    - [352, 119.68]
  - - [5120, 288, 1, 1024]
    - [356, 133.16]
  - - [5120, 304, 1, 1024]
    - [164, 140.34]
  - - [5120, 320, 1, 1024]
    - [164, 147.17]
  - - [5120, 336, 1, 1024]
    - [357, 143.15]
  - - [5120, 352, 1, 1024]
    - [165, 151.79]
  - - [5120, 368, 1, 1024]
    - [358, 139.06]
  - - [5120, 384, 1, 1024]
    - [359, 149.67]
  - - [5120, 400, 1, 1024]
    - [360, 149.88]
  - - [5120, 416, 1, 1024]
    - [122, 176.61]
  - - [5120, 432, 1, 1024]
    - [122, 168.7]
  - - [5120, 448, 1, 1024]
    - [8, 187.34]
  - - [5120, 464, 1, 1024]
    - [122, 172.55]
  - - [5120, 480, 1, 1024]
    - [122, 190.53]
  - - [5120, 496, 1, 1024]
    - [357, 162.15]
  - - [5120, 512, 1, 1024]
    - [10, 180.45]
  - - [5120, 544, 1, 1024]
    - [361, 186.3]
  - - [5120, 576, 1, 1024]
    - [10, 205.93]
  - - [5120, 608, 1, 1024]
    - [357, 171.61]
  - - [5120, 640, 1, 1024]
    - [362, 186.87]
  - - [5120, 672, 1, 1024]
    - [363, 199.79]
  - - [5120, 704, 1, 1024]
    - [364, 200.39]
  - - [5120, 736, 1, 1024]
    - [364, 204.29]
  - - [5120, 768, 1, 1024]
    - [359, 203.06]
  - - [5120, 800, 1, 1024]
    - [359, 201.51]
  - - [5120, 832, 1, 1024]
    - [358, 212.02]
  - - [5120, 864, 1, 1024]
    - [358, 210.61]
  - - [5120, 896, 1, 1024]
    - [360, 220.11]
  - - [5120, 928, 1, 1024]
    - [358, 217.85]
  - - [5120, 960, 1, 1024]
    - [358, 228.77]
  - - [5120, 992, 1, 1024]
    - [365, 221.89]
  - - [5120, 1024, 1, 1024]
    - [366, 226.9]
  - - [5120, 1088, 1, 1024]
    - [366, 234.52]
  - - [5120, 1152, 1, 1024]
    - [366, 249.62]
  - - [5120, 1216, 1, 1024]
    - [367, 242.63]
  - - [5120, 1280, 1, 1024]
    - [324, 247.72]
  - - [5120, 1344, 1, 1024]
    - [367, 265.01]
  - - [5120, 1408, 1, 1024]
    - [367, 266.01]
  - - [5120, 1472, 1, 1024]
    - [326, 255.48]
  - - [5120, 1536, 1, 1024]
    - [327, 266.69]
  - - [5120, 1600, 1, 1024]
    - [368, 269.1]
  - - [5120, 1664, 1, 1024]
    - [327, 273.65]
  - - [5120, 1728, 1, 1024]
    - [329, 276.29]
  - - [5120, 1792, 1, 1024]
    - [329, 285.89]
  - - [5120, 1856, 1, 1024]
    - [329, 287.69]
  - - [5120, 1920, 1, 1024]
    - [329, 296.86]
  - - [5120, 1984, 1, 1024]
    - [369, 284.4]
  - - [5120, 2048, 1, 1024]
    - [331, 288.34]
  - - [5120, 2176, 1, 1024]
    - [332, 291.09]
  - - [5120, 2304, 1, 1024]
    - [332, 301.35]
  - - [5120, 2432, 1, 1024]
    - [370, 301.21]
  - - [5120, 2560, 1, 1024]
    - [370, 312.85]
  - - [5120, 2688, 1, 1024]
    - [371, 311.56]
  - - [5120, 2816, 1, 1024]
    - [334, 318.85]
  - - [5120, 2944, 1, 1024]
    - [372, 315.54]
  - - [5120, 3072, 1, 1024]
    - [373, 319.58]
  - - [5120, 3200, 1, 1024]
    - [374, 324.99]
  - - [5120, 3328, 1, 1024]
    - [374, 328.53]
  - - [5120, 3456, 1, 1024]
    - [375, 325.58]
  - - [5120, 3584, 1, 1024]
    - [376, 331.51]
  - - [5120, 3712, 1, 1024]
    - [341, 327.72]
  - - [5120, 3840, 1, 1024]
    - [341, 345.58]
  - - [5120, 3968, 1, 1024]
    - [336, 314.11]
  - - [5120, 4096, 1, 1024]
    - [334, 322.03]
  - - [5120, 4352, 1, 1024]
    - [377, 309.87]
  - - [5120, 4608, 1, 1024]
    - [378, 319.5]
  - - [5120, 4864, 1, 1024]
    - [334, 317.15]
  - - [5120, 5120, 1, 1024]
    - [379, 325.61]
  - - [5120, 5376, 1, 1024]
    - [334, 332.89]
  - - [5120, 5632, 1, 1024]
    - [334, 342.43]
  - - [896, 10240, 1, 5120]
    - [182, 394.93]
  - - [896, 10752, 1, 5120]
    - [183, 407.14]
  - - [896, 11264, 1, 5120]
    - [183, 415.29]
  - - [896, 11520, 1, 5120]
    - [184, 423.72]
  - - [896, 11776, 1, 5120]
    - [177, 425.33]
  - - [896, 12288, 1, 5120]
    - [176, 429.37]
  - - [896, 12544, 1, 5120]
    - [185, 422.54]
  - - [896, 12800, 1, 5120]
    - [186, 429.0]
  - - [896, 13056, 1, 5120]
    - [187, 431.44]
  - - [896, 13312, 1, 5120]
    - [188, 425.46]
  - - [896, 13824, 1, 5120]
    - [189, 427.49]
  - - [896, 14080, 1, 5120]
    - [190, 434.72]
  - - [896, 14336, 1, 5120]
    - [190, 435.57]
  - - [896, 14592, 1, 5120]
    - [191, 440.37]
  - - [896, 14848, 1, 5120]
    - [190, 446.29]
  - - [896, 15360, 1, 5120]
    - [189, 451.84]
  - - [896, 15872, 1, 5120]
    - [192, 450.69]
  - - [896, 16128, 1, 5120]
    - [189, 458.07]
  - - [896, 16384, 1, 5120]
    - [193, 454.86]
  - - [896, 16640, 1, 5120]
    - [194, 460.33]
  - - [896, 16896, 1, 5120]
    - [194, 460.59]
  - - [896, 17408, 1, 5120]
    - [193, 467.79]
  - - [896, 17664, 1, 5120]
    - [195, 462.86]
  - - [896, 17920, 1, 5120]
    - [196, 475.31]
  - - [896, 18432, 1, 5120]
    - [194, 476.28]
  - - [896, 19200, 1, 5120]
    - [194, 485.78]
  - - [896, 19456, 1, 5120]
    - [194, 486.77]
  - - [896, 19712, 1, 5120]
    - [197, 451.62]
  - - [896, 19968, 1, 5120]
    - [198, 451.71]
  - - [896, 20480, 1, 5120]
    - [199, 458.17]
  - - [896, 20736, 1, 5120]
    - [198, 469.0]
  - - [896, 21504, 1, 5120]
    - [198, 473.11]
  - - [896, 21760, 1, 5120]
    - [200, 471.86]
  - - [896, 22272, 1, 5120]
    - [201, 434.44]
  - - [896, 22528, 1, 5120]
    - [202, 438.37]
  - - [896, 23040, 1, 5120]
    - [203, 441.14]
  - - [896, 23296, 1, 5120]
    - [204, 449.18]
  - - [896, 23552, 1, 5120]
    - [177, 433.12]
  - - [896, 23808, 1, 5120]
    - [176, 438.67]
  - - [896, 24320, 1, 5120]
    - [205, 436.87]
  - - [896, 24576, 1, 5120]
    - [176, 439.23]
  - - [896, 25088, 1, 5120]
    - [175, 435.94]
  - - [896, 25344, 1, 5120]
    - [206, 441.62]
  - - [896, 25600, 1, 5120]
    - [207, 437.71]
  - - [896, 26112, 1, 5120]
    - [206, 444.57]
  - - [896, 26624, 1, 5120]
    - [208, 444.85]
  - - [896, 26880, 1, 5120]
    - [175, 455.3]
  - - [896, 27648, 1, 5120]
    - [175, 458.86]
  - - [896, 28160, 1, 5120]
    - [184, 444.78]
  - - [896, 28672, 1, 5120]
    - [176, 447.16]
  - - [896, 29184, 1, 5120]
    - [180, 462.09]
  - - [896, 29440, 1, 5120]
    - [189, 446.78]
  - - [896, 29696, 1, 5120]
    - [190, 453.51]
  - - [896, 29952, 1, 5120]
    - [190, 457.26]
  - - [896, 30464, 1, 5120]
    - [189, 456.17]
  - - [896, 30720, 1, 5120]
    - [190, 462.86]
  - - [896, 30976, 1, 5120]
    - [209, 461.71]
  - - [896, 31744, 1, 5120]
    - [190, 457.33]
  - - [896, 32000, 1, 5120]
    - [189, 471.02]
  - - [896, 32256, 1, 5120]
    - [209, 462.45]
  - - [896, 32768, 1, 5120]
    - [194, 458.76]
  - - [896, 33280, 1, 5120]
    - [195, 458.91]
  - - [896, 33792, 1, 5120]
    - [210, 458.87]
  - - [896, 34048, 1, 5120]
    - [210, 459.12]
  - - [896, 34560, 1, 5120]
    - [196, 464.23]
  - - [896, 34816, 1, 5120]
    - [195, 468.6]
  - - [896, 35328, 1, 5120]
    - [194, 465.54]
  - - [896, 35840, 1, 5120]
    - [195, 471.55]
  - - [896, 36608, 1, 5120]
    - [195, 474.15]
  - - [896, 36864, 1, 5120]
    - [194, 475.41]
  - - [896, 37120, 1, 5120]
    - [195, 476.21]
  - - [896, 37632, 1, 5120]
    - [196, 481.34]
  - - [896, 38400, 1, 5120]
    - [210, 490.13]
  - - [896, 38912, 1, 5120]
    - [196, 487.2]
  - - [896, 39168, 1, 5120]
    - [198, 459.87]
  - - [896, 39424, 1, 5120]
    - [198, 464.72]
  - - [896, 39680, 1, 5120]
    - [198, 461.34]
  - - [896, 39936, 1, 5120]
    - [200, 466.87]
  - - [896, 40960, 1, 5120]
    - [197, 474.69]
  - - [896, 41216, 1, 5120]
    - [198, 470.58]
  - - [896, 41472, 1, 5120]
    - [211, 468.62]
  - - [896, 42240, 1, 5120]
    - [198, 476.98]
  - - [896, 43008, 1, 5120]
    - [197, 482.52]
  - - [896, 43264, 1, 5120]
    - [200, 480.46]
  - - [896, 43520, 1, 5120]
    - [198, 478.16]
  - - [896, 43776, 1, 5120]
    - [211, 481.72]
  - - [896, 44544, 1, 5120]
    - [190, 460.06]
  - - [896, 44800, 1, 5120]
    - [191, 456.14]
  - - [896, 45056, 1, 5120]
    - [189, 463.44]
  - - [896, 46080, 1, 5120]
    - [190, 465.38]
  - - [896, 46592, 1, 5120]
    - [189, 466.32]
  - - [896, 47104, 1, 5120]
    - [190, 466.81]
  - - [896, 47616, 1, 5120]
    - [189, 470.01]
  - - [896, 47872, 1, 5120]
    - [190, 468.77]
  - - [896, 48384, 1, 5120]
    - [190, 468.85]
  - - [896, 48640, 1, 5120]
    - [190, 470.53]
  - - [896, 49152, 1, 5120]
    - [194, 459.06]
  - - [896, 49920, 1, 5120]
    - [176, 469.69]
  - - [896, 50176, 1, 5120]
    - [194, 460.42]
  - - [896, 50688, 1, 5120]
    - [210, 459.58]
  - - [896, 51200, 1, 5120]
    - [194, 465.52]
  - - [896, 51968, 1, 5120]
    - [194, 468.68]
  - - [896, 52224, 1, 5120]
    - [212, 467.66]
  - - [896, 52992, 1, 5120]
    - [194, 473.93]
  - - [896, 53248, 1, 5120]
    - [194, 477.37]
  - - [896, 53504, 1, 5120]
    - [210, 470.38]
  - - [896, 53760, 1, 5120]
    - [210, 472.38]
  - - [896, 55296, 1, 5120]
    - [212, 482.4]
  - - [896, 55552, 1, 5120]
    - [194, 484.13]
  - - [896, 56320, 1, 5120]
    - [194, 483.35]
  - - [896, 56576, 1, 5120]
    - [194, 483.92]
  - - [896, 57344, 1, 5120]
    - [196, 484.67]
  - - [896, 57600, 1, 5120]
    - [196, 483.14]
  - - [896, 58368, 1, 5120]
    - [212, 485.19]
  - - [896, 58880, 1, 5120]
    - [176, 470.12]
  - - [896, 59136, 1, 5120]
    - [211, 463.38]
  - - [896, 59392, 1, 5120]
    - [198, 462.94]
  - - [896, 59904, 1, 5120]
    - [197, 467.64]
  - - [896, 60928, 1, 5120]
    - [177, 467.74]
  - - [896, 61440, 1, 5120]
    - [198, 471.06]
  - - [896, 61952, 1, 5120]
    - [211, 470.92]
  - - [896, 62208, 1, 5120]
    - [197, 472.85]
  - - [896, 63232, 1, 5120]
    - [197, 478.08]
  - - [896, 63488, 1, 5120]
    - [213, 480.03]
  - - [896, 64000, 1, 5120]
    - [198, 481.7]
  - - [896, 64512, 1, 5120]
    - [213, 482.21]
  - - [896, 64768, 1, 5120]
    - [198, 490.45]
  - - [896, 65280, 1, 5120]
    - [199, 484.45]
  - - [896, 65536, 1, 5120]
    - [211, 486.11]
  - - [896, 66560, 1, 5120]
    - [177, 470.33]
  - - [896, 66816, 1, 5120]
    - [194, 468.57]
  - - [896, 67584, 1, 5120]
    - [206, 465.91]
  - - [896, 68096, 1, 5120]
    - [177, 471.32]
  - - [896, 69120, 1, 5120]
    - [206, 472.09]
  - - [896, 69632, 1, 5120]
    - [194, 468.5]
  - - [896, 69888, 1, 5120]
    - [177, 469.52]
  - - [896, 70400, 1, 5120]
    - [196, 472.83]
  - - [896, 70656, 1, 5120]
    - [177, 474.64]
  - - [896, 71424, 1, 5120]
    - [194, 476.92]
  - - [896, 71680, 1, 5120]
    - [212, 475.03]
  - - [896, 72960, 1, 5120]
    - [196, 480.71]
  - - [896, 73216, 1, 5120]
    - [196, 476.37]
  - - [896, 73728, 1, 5120]
    - [194, 478.46]
  - - [896, 74240, 1, 5120]
    - [210, 481.55]
  - - [896, 75264, 1, 5120]
    - [195, 481.9]
  - - [896, 76032, 1, 5120]
    - [210, 487.71]
  - - [896, 76544, 1, 5120]
    - [196, 489.76]
  - - [896, 76800, 1, 5120]
    - [210, 485.6]
  - - [896, 77824, 1, 5120]
    - [210, 498.85]
  - - [896, 78848, 1, 5120]
    - [190, 479.43]
  - - [896, 79360, 1, 5120]
    - [192, 480.06]
  - - [896, 79872, 1, 5120]
    - [214, 481.98]
  - - [896, 80640, 1, 5120]
    - [190, 483.18]
  - - [896, 81664, 1, 5120]
    - [184, 489.67]
  - - [896, 81920, 1, 5120]
    - [175, 482.19]
  - - [896, 82432, 1, 5120]
    - [206, 487.24]
  - - [896, 82944, 1, 5120]
    - [197, 490.98]
  - - [896, 83200, 1, 5120]
    - [175, 485.84]
  - - [896, 84480, 1, 5120]
    - [198, 480.9]
  - - [896, 86016, 1, 5120]
    - [197, 496.5]
  - - [896, 86528, 1, 5120]
    - [211, 502.19]
  - - [896, 87296, 1, 5120]
    - [199, 497.85]
  - - [896, 88320, 1, 5120]
    - [175, 484.82]
  - - [896, 89088, 1, 5120]
    - [175, 485.67]
  - - [896, 89600, 1, 5120]
    - [175, 484.0]
  - - [896, 89856, 1, 5120]
    - [215, 486.88]
  - - [896, 90112, 1, 5120]
    - [175, 487.61]
  - - [896, 92160, 1, 5120]
    - [201, 494.0]
  - - [896, 93184, 1, 5120]
    - [196, 486.56]
  - - [896, 94208, 1, 5120]
    - [193, 496.75]
  - - [896, 95232, 1, 5120]
    - [210, 501.61]
  - - [896, 96000, 1, 5120]
    - [196, 505.34]
  - - [896, 96512, 1, 5120]
    - [210, 513.65]
  - - [896, 96768, 1, 5120]
    - [196, 513.71]
  - - [896, 98304, 1, 5120]
    - [202, 482.8]
  - - [896, 99840, 1, 5120]
    - [204, 483.66]
  - - [896, 100352, 1, 5120]
    - [215, 484.0]
  - - [896, 102400, 1, 5120]
    - [199, 491.62]
  - - [896, 103168, 1, 5120]
    - [216, 493.08]
  - - [896, 103680, 1, 5120]
    - [176, 494.25]
  - - [896, 103936, 1, 5120]
    - [217, 494.39]
  - - [896, 106496, 1, 5120]
    - [199, 508.09]
  - - [896, 107520, 1, 5120]
    - [198, 503.9]
  - - [896, 110592, 1, 5120]
    - [194, 492.66]
  - - [896, 111104, 1, 5120]
    - [194, 496.59]
  - - [896, 111360, 1, 5120]
    - [210, 494.97]
  - - [896, 114688, 1, 5120]
    - [212, 508.67]
  - - [896, 115200, 1, 5120]
    - [196, 505.86]
  - - [896, 118784, 1, 5120]
    - [203, 487.19]
  - - [896, 119040, 1, 5120]
    - [214, 484.24]
  - - [896, 122880, 1, 5120]
    - [198, 498.95]
  - - [896, 126976, 1, 5120]
    - [198, 504.1]
  - - [896, 131072, 1, 5120]
    - [194, 515.73]
  - - [4096, 4352, 1, 5120]
    - [218, 486.06]
  - - [4096, 4608, 1, 5120]
    - [219, 490.11]
  - - [4096, 4864, 1, 5120]
    - [219, 506.82]
  - - [4096, 5120, 1, 5120]
    - [220, 488.65]
  - - [4096, 5376, 1, 5120]
    - [221, 505.5]
  - - [4096, 5632, 1, 5120]
    - [222, 485.28]
  - - [4096, 5888, 1, 5120]
    - [205, 495.0]
  - - [4096, 6144, 1, 5120]
    - [220, 478.91]
  - - [4096, 6400, 1, 5120]
    - [221, 484.04]
  - - [4096, 6656, 1, 5120]
    - [220, 497.54]
  - - [4096, 6912, 1, 5120]
    - [220, 502.78]
  - - [4096, 7168, 1, 5120]
    - [220, 505.56]
  - - [4096, 7424, 1, 5120]
    - [223, 487.8]
  - - [4096, 7680, 1, 5120]
    - [224, 491.55]
  - - [4096, 7936, 1, 5120]
    - [224, 507.95]
  - - [4096, 8192, 1, 5120]
    - [224, 510.81]
  - - [4096, 8448, 1, 5120]
    - [225, 521.87]
  - - [4096, 8704, 1, 5120]
    - [226, 510.73]
  - - [4096, 8960, 1, 5120]
    - [221, 518.44]
  - - [4096, 9216, 1, 5120]
    - [227, 500.09]
  - - [4096, 9728, 1, 5120]
    - [227, 507.61]
  - - [4096, 9984, 1, 5120]
    - [221, 509.59]
  - - [4096, 10240, 1, 5120]
    - [192, 508.21]
  - - [4096, 10752, 1, 5120]
    - [220, 520.98]
  - - [4096, 11264, 1, 5120]
    - [221, 501.41]
  - - [4096, 11520, 1, 5120]
    - [205, 512.79]
  - - [4096, 11776, 1, 5120]
    - [222, 516.0]
  - - [4096, 12288, 1, 5120]
    - [225, 519.0]
  - - [4096, 12544, 1, 5120]
    - [224, 527.13]
  - - [4096, 12800, 1, 5120]
    - [228, 521.89]
  - - [4096, 13056, 1, 5120]
    - [229, 523.62]
  - - [4096, 13312, 1, 5120]
    - [230, 515.64]
  - - [4096, 13824, 1, 5120]
    - [221, 524.19]
  - - [4096, 14080, 1, 5120]
    - [220, 520.33]
  - - [4096, 14336, 1, 5120]
    - [221, 531.79]
  - - [4096, 14592, 1, 5120]
    - [221, 535.57]
  - - [4096, 14848, 1, 5120]
    - [191, 520.37]
  - - [4096, 15360, 1, 5120]
    - [220, 526.14]
  - - [4096, 15872, 1, 5120]
    - [221, 527.32]
  - - [4096, 16128, 1, 5120]
    - [220, 529.64]
  - - [4096, 16384, 1, 5120]
    - [231, 528.04]
  - - [4096, 16640, 1, 5120]
    - [225, 533.72]
  - - [4096, 16896, 1, 5120]
    - [231, 530.09]
  - - [4096, 17408, 1, 5120]
    - [221, 529.41]
  - - [4096, 17664, 1, 5120]
    - [221, 532.97]
  - - [4096, 17920, 1, 5120]
    - [221, 542.66]
  - - [4096, 18432, 1, 5120]
    - [220, 528.51]
  - - [4096, 19200, 1, 5120]
    - [220, 536.36]
  - - [4096, 19456, 1, 5120]
    - [221, 540.61]
  - - [4096, 19712, 1, 5120]
    - [221, 538.83]
  - - [4096, 19968, 1, 5120]
    - [221, 545.53]
  - - [4096, 20480, 1, 5120]
    - [225, 533.78]
  - - [4096, 20736, 1, 5120]
    - [221, 535.33]
  - - [4096, 21504, 1, 5120]
    - [221, 539.6]
  - - [4096, 21760, 1, 5120]
    - [220, 539.3]
  - - [4096, 22272, 1, 5120]
    - [221, 535.88]
  - - [4096, 22528, 1, 5120]
    - [221, 532.94]
  - - [4096, 23040, 1, 5120]
    - [221, 542.61]
  - - [4096, 23296, 1, 5120]
    - [220, 544.43]
  - - [4096, 23552, 1, 5120]
    - [232, 539.2]
  - - [4096, 23808, 1, 5120]
    - [225, 527.95]
  - - [4096, 24320, 1, 5120]
    - [220, 534.39]
  - - [4096, 24576, 1, 5120]
    - [220, 538.99]
  - - [4096, 25088, 1, 5120]
    - [220, 541.17]
  - - [4096, 25344, 1, 5120]
    - [221, 544.08]
  - - [4096, 25600, 1, 5120]
    - [221, 536.62]
  - - [4096, 26112, 1, 5120]
    - [220, 534.99]
  - - [4096, 26624, 1, 5120]
    - [220, 542.77]
  - - [4096, 26880, 1, 5120]
    - [221, 543.1]
  - - [4096, 27648, 1, 5120]
    - [221, 533.71]
  - - [4096, 28160, 1, 5120]
    - [221, 538.67]
  - - [4096, 28672, 1, 5120]
    - [220, 540.9]
  - - [4096, 29184, 1, 5120]
    - [220, 549.91]
  - - [4096, 29440, 1, 5120]
    - [221, 543.5]
  - - [4096, 29696, 1, 5120]
    - [224, 542.74]
  - - [4096, 29952, 1, 5120]
    - [221, 545.1]
  - - [4096, 30464, 1, 5120]
    - [221, 543.27]
  - - [4096, 30720, 1, 5120]
    - [221, 549.36]
  - - [4096, 30976, 1, 5120]
    - [220, 547.84]
  - - [4096, 31744, 1, 5120]
    - [221, 541.49]
  - - [4096, 32000, 1, 5120]
    - [220, 543.39]
  - - [4096, 32256, 1, 5120]
    - [220, 550.42]
  - - [4096, 32768, 1, 5120]
    - [221, 545.75]
  - - [4096, 33280, 1, 5120]
    - [221, 545.8]
  - - [4096, 33792, 1, 5120]
    - [220, 549.38]
  - - [4096, 34048, 1, 5120]
    - [221, 551.26]
  - - [4096, 34560, 1, 5120]
    - [221, 552.23]
  - - [4096, 34816, 1, 5120]
    - [221, 547.61]
  - - [4096, 35328, 1, 5120]
    - [220, 545.58]
  - - [4096, 35840, 1, 5120]
    - [220, 552.7]
  - - [4096, 36608, 1, 5120]
    - [221, 540.42]
  - - [4096, 36864, 1, 5120]
    - [220, 546.56]
  - - [4096, 37120, 1, 5120]
    - [221, 550.87]
  - - [4096, 37632, 1, 5120]
    - [221, 551.06]
  - - [4096, 38400, 1, 5120]
    - [221, 553.5]
  - - [4096, 38912, 1, 5120]
    - [220, 560.7]
  - - [4096, 39168, 1, 5120]
    - [221, 562.29]
  - - [4096, 39424, 1, 5120]
    - [220, 563.13]
  - - [4096, 39680, 1, 5120]
    - [220, 564.2]
  - - [4096, 39936, 1, 5120]
    - [221, 564.48]
  - - [4096, 40960, 1, 5120]
    - [232, 560.8]
  - - [4096, 41216, 1, 5120]
    - [221, 563.83]
  - - [4096, 41472, 1, 5120]
    - [220, 566.5]
  - - [4096, 42240, 1, 5120]
    - [221, 564.07]
  - - [4096, 43008, 1, 5120]
    - [221, 563.4]
  - - [4096, 43264, 1, 5120]
    - [221, 564.34]
  - - [4096, 43520, 1, 5120]
    - [220, 565.23]
  - - [4096, 43776, 1, 5120]
    - [221, 564.76]
  - - [4096, 44544, 1, 5120]
    - [221, 562.95]
  - - [4096, 44800, 1, 5120]
    - [221, 565.32]
  - - [4096, 45056, 1, 5120]
    - [221, 563.77]
  - - [4096, 46080, 1, 5120]
    - [221, 561.34]
  - - [4096, 46592, 1, 5120]
    - [221, 563.64]
  - - [4096, 47104, 1, 5120]
    - [221, 562.77]
  - - [4096, 47616, 1, 5120]
    - [220, 557.01]
  - - [4096, 47872, 1, 5120]
    - [221, 561.97]
  - - [4096, 48384, 1, 5120]
    - [221, 561.13]
  - - [4096, 48640, 1, 5120]
    - [221, 559.85]
  - - [4096, 49152, 1, 5120]
    - [221, 566.1]
  - - [4096, 49920, 1, 5120]
    - [220, 562.49]
  - - [4096, 50176, 1, 5120]
    - [224, 565.21]
  - - [4096, 50688, 1, 5120]
    - [224, 563.13]
  - - [4096, 51200, 1, 5120]
    - [220, 556.12]
  - - [4096, 51968, 1, 5120]
    - [221, 554.69]
  - - [4096, 52224, 1, 5120]
    - [233, 556.02]
  - - [4096, 52992, 1, 5120]
    - [224, 553.19]
  - - [4096, 53248, 1, 5120]
    - [225, 552.51]
  - - [4096, 53504, 1, 5120]
    - [221, 555.53]
  - - [4096, 53760, 1, 5120]
    - [224, 557.54]
  - - [4096, 55296, 1, 5120]
    - [224, 564.47]
  - - [4096, 55552, 1, 5120]
    - [221, 560.48]
  - - [4096, 56320, 1, 5120]
    - [221, 560.25]
  - - [4096, 56576, 1, 5120]
    - [225, 555.56]
  - - [4096, 57344, 1, 5120]
    - [234, 554.38]
  - - [4096, 57600, 1, 5120]
    - [221, 562.11]
  - - [4096, 58368, 1, 5120]
    - [221, 561.88]
  - - [4096, 58880, 1, 5120]
    - [224, 564.85]
  - - [4096, 59136, 1, 5120]
    - [225, 564.73]
  - - [4096, 59392, 1, 5120]
    - [225, 572.4]
  - - [4096, 59904, 1, 5120]
    - [221, 560.56]
  - - [4096, 60928, 1, 5120]
    - [221, 560.08]
  - - [4096, 61440, 1, 5120]
    - [221, 560.19]
  - - [4096, 61952, 1, 5120]
    - [235, 561.93]
  - - [4096, 62208, 1, 5120]
    - [224, 561.75]
  - - [4096, 63232, 1, 5120]
    - [225, 568.66]
  - - [4096, 63488, 1, 5120]
    - [225, 569.5]
  - - [4096, 64000, 1, 5120]
    - [221, 558.69]
  - - [4096, 64512, 1, 5120]
    - [221, 559.36]
  - - [4096, 64768, 1, 5120]
    - [221, 561.24]
  - - [4096, 65280, 1, 5120]
    - [236, 562.19]
  - - [4096, 65536, 1, 5120]
    - [221, 561.39]
  - - [4096, 66560, 1, 5120]
    - [224, 564.93]
  - - [4096, 66816, 1, 5120]
    - [224, 563.88]
  - - [4096, 67584, 1, 5120]
    - [224, 569.16]
  - - [4096, 68096, 1, 5120]
    - [225, 573.1]
  - - [4096, 69120, 1, 5120]
    - [235, 561.43]
  - - [4096, 69632, 1, 5120]
    - [221, 559.08]
  - - [4096, 69888, 1, 5120]
    - [224, 558.95]
  - - [4096, 70400, 1, 5120]
    - [225, 560.88]
  - - [4096, 70656, 1, 5120]
    - [225, 563.22]
  - - [4096, 71424, 1, 5120]
    - [224, 571.27]
  - - [4096, 71680, 1, 5120]
    - [224, 573.65]
  - - [4096, 72960, 1, 5120]
    - [221, 559.6]
  - - [4096, 73216, 1, 5120]
    - [221, 557.49]
  - - [4096, 73728, 1, 5120]
    - [221, 561.19]
  - - [4096, 74240, 1, 5120]
    - [221, 562.08]
  - - [4096, 75264, 1, 5120]
    - [224, 571.01]
  - - [4096, 76032, 1, 5120]
    - [224, 572.46]
  - - [4096, 76544, 1, 5120]
    - [225, 571.72]
  - - [4096, 76800, 1, 5120]
    - [221, 561.56]
  - - [4096, 77824, 1, 5120]
    - [221, 560.29]
  - - [4096, 78848, 1, 5120]
    - [224, 563.1]
  - - [4096, 79360, 1, 5120]
    - [224, 564.61]
  - - [4096, 79872, 1, 5120]
    - [224, 569.94]
  - - [4096, 80640, 1, 5120]
    - [224, 577.07]
  - - [4096, 81664, 1, 5120]
    - [221, 562.62]
  - - [4096, 81920, 1, 5120]
    - [220, 560.9]
  - - [4096, 82432, 1, 5120]
    - [225, 562.26]
  - - [4096, 82944, 1, 5120]
    - [224, 562.77]
  - - [4096, 83200, 1, 5120]
    - [225, 563.65]
  - - [4096, 84480, 1, 5120]
    - [225, 572.78]
  - - [4096, 86016, 1, 5120]
    - [224, 559.59]
  - - [4096, 86528, 1, 5120]
    - [221, 560.08]
  - - [4096, 87296, 1, 5120]
    - [225, 566.19]
  - - [4096, 88320, 1, 5120]
    - [225, 572.29]
  - - [4096, 89088, 1, 5120]
    - [224, 575.19]
  - - [4096, 89600, 1, 5120]
    - [205, 558.81]
  - - [4096, 89856, 1, 5120]
    - [224, 560.9]
  - - [4096, 90112, 1, 5120]
    - [225, 561.44]
  - - [4096, 92160, 1, 5120]
    - [224, 566.93]
  - - [4096, 93184, 1, 5120]
    - [224, 576.22]
  - - [4096, 94208, 1, 5120]
    - [225, 562.06]
  - - [4096, 95232, 1, 5120]
    - [224, 564.02]
  - - [4096, 96000, 1, 5120]
    - [225, 572.54]
  - - [4096, 96512, 1, 5120]
    - [224, 574.4]
  - - [4096, 96768, 1, 5120]
    - [224, 577.65]
  - - [4096, 98304, 1, 5120]
    - [221, 571.01]
  - - [4096, 99840, 1, 5120]
    - [224, 574.68]
  - - [4096, 100352, 1, 5120]
    - [225, 577.88]
  - - [4096, 102400, 1, 5120]
    - [221, 571.25]
  - - [4096, 103168, 1, 5120]
    - [225, 569.91]
  - - [4096, 103680, 1, 5120]
    - [224, 572.87]
  - - [4096, 103936, 1, 5120]
    - [224, 574.47]
  - - [4096, 106496, 1, 5120]
    - [221, 572.4]
  - - [4096, 107520, 1, 5120]
    - [221, 572.82]
  - - [4096, 110592, 1, 5120]
    - [225, 582.46]
  - - [4096, 111104, 1, 5120]
    - [221, 569.49]
  - - [4096, 111360, 1, 5120]
    - [225, 566.36]
  - - [4096, 114688, 1, 5120]
    - [224, 581.67]
  - - [4096, 115200, 1, 5120]
    - [221, 567.9]
  - - [4096, 118784, 1, 5120]
    - [224, 579.4]
  - - [4096, 119040, 1, 5120]
    - [237, 579.4]
  - - [4096, 122880, 1, 5120]
    - [225, 575.46]
  - - [4096, 126976, 1, 5120]
    - [224, 574.51]
  - - [4096, 131072, 1, 5120]
    - [224, 573.93]
  - - [1024, 5888, 1, 5120]
    - [214, 408.73]
  - - [1024, 6144, 1, 5120]
    - [221, 415.77]
  - - [1024, 6400, 1, 5120]
    - [214, 420.21]
  - - [1024, 6656, 1, 5120]
    - [214, 430.55]
  - - [1024, 6912, 1, 5120]
    - [214, 437.7]
  - - [1024, 7168, 1, 5120]
    - [240, 436.44]
  - - [1024, 7424, 1, 5120]
    - [241, 409.52]
  - - [1024, 7680, 1, 5120]
    - [241, 411.01]
  - - [1024, 7936, 1, 5120]
    - [242, 419.75]
  - - [1024, 8192, 1, 5120]
    - [242, 423.84]
  - - [1024, 8448, 1, 5120]
    - [242, 431.17]
  - - [1024, 8704, 1, 5120]
    - [243, 433.98]
  - - [1024, 8960, 1, 5120]
    - [244, 441.77]
  - - [1024, 9216, 1, 5120]
    - [245, 446.29]
  - - [1024, 9728, 1, 5120]
    - [244, 450.57]
  - - [1024, 9984, 1, 5120]
    - [205, 442.17]
  - - [1024, 10240, 1, 5120]
    - [246, 455.27]
  - - [1024, 10752, 1, 5120]
    - [246, 455.72]
  - - [1024, 11264, 1, 5120]
    - [246, 463.49]
  - - [1024, 11520, 1, 5120]
    - [246, 471.9]
  - - [1024, 11776, 1, 5120]
    - [246, 475.63]
  - - [1024, 12288, 1, 5120]
    - [235, 451.8]
  - - [1024, 12544, 1, 5120]
    - [214, 450.03]
  - - [1024, 12800, 1, 5120]
    - [240, 458.66]
  - - [1024, 13056, 1, 5120]
    - [247, 460.66]
  - - [1024, 13312, 1, 5120]
    - [248, 456.76]
  - - [1024, 13824, 1, 5120]
    - [249, 474.29]
  - - [1024, 14080, 1, 5120]
    - [250, 469.89]
  - - [1024, 14336, 1, 5120]
    - [214, 477.41]
  - - [1024, 14592, 1, 5120]
    - [247, 484.39]
  - - [1024, 14848, 1, 5120]
    - [251, 457.03]
  - - [1024, 15360, 1, 5120]
    - [251, 469.45]
  - - [1024, 15872, 1, 5120]
    - [251, 476.54]
  - - [1024, 16128, 1, 5120]
    - [224, 486.21]
  - - [1024, 16384, 1, 5120]
    - [223, 479.64]
  - - [1024, 16640, 1, 5120]
    - [251, 485.15]
  - - [1024, 16896, 1, 5120]
    - [224, 486.82]
  - - [1024, 17408, 1, 5120]
    - [219, 459.65]
  - - [1024, 17664, 1, 5120]
    - [252, 467.12]
  - - [1024, 17920, 1, 5120]
    - [219, 464.75]
  - - [1024, 18432, 1, 5120]
    - [219, 472.79]
  - - [1024, 19200, 1, 5120]
    - [253, 487.02]
  - - [1024, 19456, 1, 5120]
    - [219, 490.67]
  - - [1024, 19712, 1, 5120]
    - [214, 471.65]
  - - [1024, 19968, 1, 5120]
    - [214, 474.49]
  - - [1024, 20480, 1, 5120]
    - [240, 474.51]
  - - [1024, 20736, 1, 5120]
    - [214, 472.0]
  - - [1024, 21504, 1, 5120]
    - [214, 482.15]
  - - [1024, 21760, 1, 5120]
    - [214, 487.3]
  - - [1024, 22272, 1, 5120]
    - [254, 464.27]
  - - [1024, 22528, 1, 5120]
    - [246, 470.02]
  - - [1024, 23040, 1, 5120]
    - [246, 470.59]
  - - [1024, 23296, 1, 5120]
    - [246, 477.75]
  - - [1024, 23552, 1, 5120]
    - [246, 471.89]
  - - [1024, 23808, 1, 5120]
    - [246, 484.74]
  - - [1024, 24320, 1, 5120]
    - [246, 486.92]
  - - [1024, 24576, 1, 5120]
    - [220, 459.58]
  - - [1024, 25088, 1, 5120]
    - [221, 461.01]
  - - [1024, 25344, 1, 5120]
    - [214, 461.28]
  - - [1024, 25600, 1, 5120]
    - [220, 471.18]
  - - [1024, 26112, 1, 5120]
    - [214, 476.59]
  - - [1024, 26624, 1, 5120]
    - [214, 489.69]
  - - [1024, 26880, 1, 5120]
    - [240, 482.0]
  - - [1024, 27648, 1, 5120]
    - [247, 478.95]
  - - [1024, 28160, 1, 5120]
    - [232, 488.54]
  - - [1024, 28672, 1, 5120]
    - [214, 490.63]
  - - [1024, 29184, 1, 5120]
    - [214, 494.1]
  - - [1024, 29440, 1, 5120]
    - [251, 466.7]
  - - [1024, 29696, 1, 5120]
    - [251, 472.41]
  - - [1024, 29952, 1, 5120]
    - [223, 470.28]
  - - [1024, 30464, 1, 5120]
    - [251, 473.74]
  - - [1024, 30720, 1, 5120]
    - [251, 483.84]
  - - [1024, 30976, 1, 5120]
    - [251, 482.81]
  - - [1024, 31744, 1, 5120]
    - [223, 487.44]
  - - [1024, 32000, 1, 5120]
    - [251, 492.18]
  - - [1024, 32256, 1, 5120]
    - [251, 487.79]
  - - [1024, 32768, 1, 5120]
    - [251, 482.85]
  - - [1024, 33280, 1, 5120]
    - [251, 498.98]
  - - [1024, 33792, 1, 5120]
    - [224, 498.64]
  - - [1024, 34048, 1, 5120]
    - [223, 506.41]
  - - [1024, 34560, 1, 5120]
    - [214, 488.88]
  - - [1024, 34816, 1, 5120]
    - [214, 491.44]
  - - [1024, 35328, 1, 5120]
    - [214, 488.55]
  - - [1024, 35840, 1, 5120]
    - [240, 486.53]
  - - [1024, 36608, 1, 5120]
    - [227, 478.41]
  - - [1024, 36864, 1, 5120]
    - [255, 478.74]
  - - [1024, 37120, 1, 5120]
    - [219, 482.45]
  - - [1024, 37632, 1, 5120]
    - [227, 481.85]
  - - [1024, 38400, 1, 5120]
    - [255, 487.24]
  - - [1024, 38912, 1, 5120]
    - [255, 489.43]
  - - [1024, 39168, 1, 5120]
    - [232, 481.87]
  - - [1024, 39424, 1, 5120]
    - [214, 484.59]
  - - [1024, 39680, 1, 5120]
    - [240, 482.79]
  - - [1024, 39936, 1, 5120]
    - [214, 484.91]
  - - [1024, 40960, 1, 5120]
    - [214, 495.9]
  - - [1024, 41216, 1, 5120]
    - [214, 498.52]
  - - [1024, 41472, 1, 5120]
    - [240, 492.12]
  - - [1024, 42240, 1, 5120]
    - [240, 490.83]
  - - [1024, 43008, 1, 5120]
    - [240, 500.74]
  - - [1024, 43264, 1, 5120]
    - [214, 506.28]
  - - [1024, 43520, 1, 5120]
    - [214, 501.27]
  - - [1024, 43776, 1, 5120]
    - [214, 503.0]
  - - [1024, 44544, 1, 5120]
    - [214, 484.91]
  - - [1024, 44800, 1, 5120]
    - [246, 479.08]
  - - [1024, 45056, 1, 5120]
    - [220, 480.41]
  - - [1024, 46080, 1, 5120]
    - [214, 489.85]
  - - [1024, 46592, 1, 5120]
    - [246, 488.71]
  - - [1024, 47104, 1, 5120]
    - [240, 490.07]
  - - [1024, 47616, 1, 5120]
    - [221, 492.41]
  - - [1024, 47872, 1, 5120]
    - [251, 495.51]
  - - [1024, 48384, 1, 5120]
    - [214, 496.63]
  - - [1024, 48640, 1, 5120]
    - [214, 495.06]
  - - [1024, 49152, 1, 5120]
    - [220, 499.58]
  - - [1024, 49920, 1, 5120]
    - [214, 504.75]
  - - [1024, 50176, 1, 5120]
    - [214, 505.03]
  - - [1024, 50688, 1, 5120]
    - [240, 503.52]
  - - [1024, 51200, 1, 5120]
    - [214, 488.19]
  - - [1024, 51968, 1, 5120]
    - [240, 486.28]
  - - [1024, 52224, 1, 5120]
    - [214, 488.1]
  - - [1024, 52992, 1, 5120]
    - [214, 495.65]
  - - [1024, 53248, 1, 5120]
    - [221, 487.95]
  - - [1024, 53504, 1, 5120]
    - [240, 492.28]
  - - [1024, 53760, 1, 5120]
    - [220, 493.96]
  - - [1024, 55296, 1, 5120]
    - [214, 501.3]
  - - [1024, 55552, 1, 5120]
    - [221, 498.6]
  - - [1024, 56320, 1, 5120]
    - [214, 507.28]
  - - [1024, 56576, 1, 5120]
    - [214, 510.99]
  - - [1024, 57344, 1, 5120]
    - [214, 511.06]
  - - [1024, 57600, 1, 5120]
    - [240, 509.7]
  - - [1024, 58368, 1, 5120]
    - [214, 511.21]
  - - [1024, 58880, 1, 5120]
    - [214, 493.8]
  - - [1024, 59136, 1, 5120]
    - [254, 505.72]
  - - [1024, 59392, 1, 5120]
    - [222, 496.15]
  - - [1024, 59904, 1, 5120]
    - [246, 502.16]
  - - [1024, 60928, 1, 5120]
    - [214, 502.11]
  - - [1024, 61440, 1, 5120]
    - [232, 499.16]
  - - [1024, 61952, 1, 5120]
    - [214, 506.15]
  - - [1024, 62208, 1, 5120]
    - [221, 504.49]
  - - [1024, 63232, 1, 5120]
    - [214, 512.26]
  - - [1024, 63488, 1, 5120]
    - [214, 510.41]
  - - [1024, 64000, 1, 5120]
    - [240, 511.92]
  - - [1024, 64512, 1, 5120]
    - [214, 514.49]
  - - [1024, 64768, 1, 5120]
    - [214, 514.1]
  - - [1024, 65280, 1, 5120]
    - [214, 515.02]
  - - [1024, 65536, 1, 5120]
    - [214, 514.4]
  - - [1024, 66560, 1, 5120]
    - [223, 498.56]
  - - [1024, 66816, 1, 5120]
    - [251, 504.51]
  - - [1024, 67584, 1, 5120]
    - [231, 516.9]
  - - [1024, 68096, 1, 5120]
    - [224, 513.0]
  - - [1024, 69120, 1, 5120]
    - [214, 508.71]
  - - [1024, 69632, 1, 5120]
    - [220, 504.79]
  - - [1024, 69888, 1, 5120]
    - [221, 506.74]
  - - [1024, 70400, 1, 5120]
    - [214, 509.9]
  - - [1024, 70656, 1, 5120]
    - [214, 509.45]
  - - [1024, 71424, 1, 5120]
    - [214, 518.44]
  - - [1024, 71680, 1, 5120]
    - [214, 510.76]
  - - [1024, 72960, 1, 5120]
    - [205, 514.95]
  - - [1024, 73216, 1, 5120]
    - [214, 506.78]
  - - [1024, 73728, 1, 5120]
    - [220, 500.52]
  - - [1024, 74240, 1, 5120]
    - [214, 509.66]
  - - [1024, 75264, 1, 5120]
    - [220, 515.46]
  - - [1024, 76032, 1, 5120]
    - [221, 534.93]
  - - [1024, 76544, 1, 5120]
    - [214, 520.58]
  - - [1024, 76800, 1, 5120]
    - [214, 518.61]
  - - [1024, 77824, 1, 5120]
    - [240, 521.86]
  - - [1024, 78848, 1, 5120]
    - [214, 524.8]
  - - [1024, 79360, 1, 5120]
    - [214, 528.77]
  - - [1024, 79872, 1, 5120]
    - [240, 527.98]
  - - [1024, 80640, 1, 5120]
    - [214, 521.08]
  - - [1024, 81664, 1, 5120]
    - [214, 520.93]
  - - [1024, 81920, 1, 5120]
    - [231, 517.94]
  - - [1024, 82432, 1, 5120]
    - [254, 515.71]
  - - [1024, 82944, 1, 5120]
    - [240, 531.91]
  - - [1024, 83200, 1, 5120]
    - [220, 521.8]
  - - [1024, 84480, 1, 5120]
    - [251, 521.73]
  - - [1024, 86016, 1, 5120]
    - [232, 530.96]
  - - [1024, 86528, 1, 5120]
    - [214, 527.88]
  - - [1024, 87296, 1, 5120]
    - [214, 530.14]
  - - [1024, 88320, 1, 5120]
    - [214, 517.06]
  - - [1024, 89088, 1, 5120]
    - [214, 526.79]
  - - [1024, 89600, 1, 5120]
    - [240, 523.79]
  - - [1024, 89856, 1, 5120]
    - [214, 525.13]
  - - [1024, 90112, 1, 5120]
    - [240, 521.97]
  - - [1024, 92160, 1, 5120]
    - [220, 523.7]
  - - [1024, 93184, 1, 5120]
    - [214, 524.56]
  - - [1024, 94208, 1, 5120]
    - [232, 538.02]
  - - [1024, 95232, 1, 5120]
    - [214, 523.41]
  - - [1024, 96000, 1, 5120]
    - [240, 519.87]
  - - [1024, 96512, 1, 5120]
    - [214, 522.02]
  - - [1024, 96768, 1, 5120]
    - [246, 527.0]
  - - [1024, 98304, 1, 5120]
    - [256, 536.3]
  - - [1024, 99840, 1, 5120]
    - [214, 528.76]
  - - [1024, 100352, 1, 5120]
    - [214, 532.07]
  - - [1024, 102400, 1, 5120]
    - [214, 525.09]
  - - [1024, 103168, 1, 5120]
    - [240, 522.65]
  - - [1024, 103680, 1, 5120]
    - [214, 532.89]
  - - [1024, 103936, 1, 5120]
    - [240, 523.2]
  - - [1024, 106496, 1, 5120]
    - [240, 536.75]
  - - [1024, 107520, 1, 5120]
    - [220, 529.84]
  - - [1024, 110592, 1, 5120]
    - [240, 528.98]
  - - [1024, 111104, 1, 5120]
    - [214, 522.72]
  - - [1024, 111360, 1, 5120]
    - [214, 529.23]
  - - [1024, 114688, 1, 5120]
    - [214, 535.38]
  - - [1024, 115200, 1, 5120]
    - [214, 536.22]
  - - [1024, 118784, 1, 5120]
    - [251, 533.25]
  - - [1024, 119040, 1, 5120]
    - [224, 537.98]
  - - [1024, 122880, 1, 5120]
    - [214, 540.86]
  - - [1024, 126976, 1, 5120]
    - [220, 535.67]
  - - [1024, 131072, 1, 5120]
    - [214, 550.66]
  - - [2048, 4352, 1, 5120]
    - [244, 434.37]
  - - [2048, 4608, 1, 5120]
    - [257, 452.73]
  - - [2048, 4864, 1, 5120]
    - [258, 454.12]
  - - [2048, 5120, 1, 5120]
    - [254, 456.87]
  - - [2048, 5376, 1, 5120]
    - [222, 460.47]
  - - [2048, 5632, 1, 5120]
    - [246, 466.47]
  - - [2048, 5888, 1, 5120]
    - [246, 474.23]
  - - [2048, 6144, 1, 5120]
    - [250, 455.1]
  - - [2048, 6400, 1, 5120]
    - [247, 462.4]
  - - [2048, 6656, 1, 5120]
    - [247, 466.22]
  - - [2048, 6912, 1, 5120]
    - [247, 474.99]
  - - [2048, 7168, 1, 5120]
    - [247, 484.55]
  - - [2048, 7424, 1, 5120]
    - [251, 471.79]
  - - [2048, 7680, 1, 5120]
    - [223, 479.76]
  - - [2048, 7936, 1, 5120]
    - [251, 484.81]
  - - [2048, 8192, 1, 5120]
    - [225, 499.9]
  - - [2048, 8448, 1, 5120]
    - [223, 503.44]
  - - [2048, 8704, 1, 5120]
    - [227, 473.41]
  - - [2048, 8960, 1, 5120]
    - [219, 481.37]
  - - [2048, 9216, 1, 5120]
    - [219, 491.6]
  - - [2048, 9728, 1, 5120]
    - [227, 499.82]
  - - [2048, 9984, 1, 5120]
    - [221, 475.46]
  - - [2048, 10240, 1, 5120]
    - [214, 490.97]
  - - [2048, 10752, 1, 5120]
    - [221, 489.93]
  - - [2048, 11264, 1, 5120]
    - [254, 477.22]
  - - [2048, 11520, 1, 5120]
    - [259, 484.93]
  - - [2048, 11776, 1, 5120]
    - [246, 491.45]
  - - [2048, 12288, 1, 5120]
    - [187, 471.44]
  - - [2048, 12544, 1, 5120]
    - [247, 470.88]
  - - [2048, 12800, 1, 5120]
    - [220, 473.8]
  - - [2048, 13056, 1, 5120]
    - [221, 472.98]
  - - [2048, 13312, 1, 5120]
    - [220, 484.43]
  - - [2048, 13824, 1, 5120]
    - [220, 488.09]
  - - [2048, 14080, 1, 5120]
    - [214, 489.99]
  - - [2048, 14336, 1, 5120]
    - [234, 493.83]
  - - [2048, 14592, 1, 5120]
    - [250, 498.84]
  - - [2048, 14848, 1, 5120]
    - [223, 477.2]
  - - [2048, 15360, 1, 5120]
    - [251, 496.74]
  - - [2048, 15872, 1, 5120]
    - [251, 506.08]
  - - [2048, 16128, 1, 5120]
    - [251, 501.34]
  - - [2048, 16384, 1, 5120]
    - [225, 502.9]
  - - [2048, 16640, 1, 5120]
    - [251, 504.37]
  - - [2048, 16896, 1, 5120]
    - [224, 504.79]
  - - [2048, 17408, 1, 5120]
    - [246, 496.61]
  - - [2048, 17664, 1, 5120]
    - [221, 497.51]
  - - [2048, 17920, 1, 5120]
    - [220, 492.8]
  - - [2048, 18432, 1, 5120]
    - [219, 485.8]
  - - [2048, 19200, 1, 5120]
    - [227, 497.31]
  - - [2048, 19456, 1, 5120]
    - [255, 503.03]
  - - [2048, 19712, 1, 5120]
    - [221, 496.37]
  - - [2048, 19968, 1, 5120]
    - [220, 500.63]
  - - [2048, 20480, 1, 5120]
    - [220, 497.89]
  - - [2048, 20736, 1, 5120]
    - [221, 500.05]
  - - [2048, 21504, 1, 5120]
    - [221, 506.51]
  - - [2048, 21760, 1, 5120]
    - [247, 505.33]
  - - [2048, 22272, 1, 5120]
    - [251, 484.51]
  - - [2048, 22528, 1, 5120]
    - [221, 483.79]
  - - [2048, 23040, 1, 5120]
    - [221, 497.12]
  - - [2048, 23296, 1, 5120]
    - [214, 497.27]
  - - [2048, 23552, 1, 5120]
    - [251, 496.8]
  - - [2048, 23808, 1, 5120]
    - [221, 502.99]
  - - [2048, 24320, 1, 5120]
    - [214, 502.3]
  - - [2048, 24576, 1, 5120]
    - [221, 508.71]
  - - [2048, 25088, 1, 5120]
    - [251, 515.19]
  - - [2048, 25344, 1, 5120]
    - [214, 511.6]
  - - [2048, 25600, 1, 5120]
    - [256, 490.41]
  - - [2048, 26112, 1, 5120]
    - [232, 497.6]
  - - [2048, 26624, 1, 5120]
    - [214, 503.84]
  - - [2048, 26880, 1, 5120]
    - [220, 498.07]
  - - [2048, 27648, 1, 5120]
    - [232, 504.2]
  - - [2048, 28160, 1, 5120]
    - [220, 510.87]
  - - [2048, 28672, 1, 5120]
    - [214, 517.31]
  - - [2048, 29184, 1, 5120]
    - [220, 515.68]
  - - [2048, 29440, 1, 5120]
    - [214, 502.74]
  - - [2048, 29696, 1, 5120]
    - [214, 504.67]
  - - [2048, 29952, 1, 5120]
    - [220, 505.54]
  - - [2048, 30464, 1, 5120]
    - [214, 507.1]
  - - [2048, 30720, 1, 5120]
    - [221, 507.89]
  - - [2048, 30976, 1, 5120]
    - [214, 505.52]
  - - [2048, 31744, 1, 5120]
    - [214, 515.9]
  - - [2048, 32000, 1, 5120]
    - [214, 520.0]
  - - [2048, 32256, 1, 5120]
    - [221, 519.6]
  - - [2048, 32768, 1, 5120]
    - [221, 527.92]
  - - [2048, 33280, 1, 5120]
    - [224, 512.06]
  - - [2048, 33792, 1, 5120]
    - [251, 523.34]
  - - [2048, 34048, 1, 5120]
    - [231, 524.87]
  - - [2048, 34560, 1, 5120]
    - [221, 519.68]
  - - [2048, 34816, 1, 5120]
    - [214, 519.09]
  - - [2048, 35328, 1, 5120]
    - [221, 521.7]
  - - [2048, 35840, 1, 5120]
    - [214, 529.75]
  - - [2048, 36608, 1, 5120]
    - [220, 514.58]
  - - [2048, 36864, 1, 5120]
    - [214, 517.56]
  - - [2048, 37120, 1, 5120]
    - [219, 523.18]
  - - [2048, 37632, 1, 5120]
    - [253, 518.36]
  - - [2048, 38400, 1, 5120]
    - [221, 521.66]
  - - [2048, 38912, 1, 5120]
    - [253, 527.02]
  - - [2048, 39168, 1, 5120]
    - [214, 521.62]
  - - [2048, 39424, 1, 5120]
    - [221, 523.8]
  - - [2048, 39680, 1, 5120]
    - [221, 525.39]
  - - [2048, 39936, 1, 5120]
    - [214, 528.84]
  - - [2048, 40960, 1, 5120]
    - [251, 519.8]
  - - [2048, 41216, 1, 5120]
    - [251, 525.8]
  - - [2048, 41472, 1, 5120]
    - [251, 527.34]
  - - [2048, 42240, 1, 5120]
    - [251, 524.52]
  - - [2048, 43008, 1, 5120]
    - [220, 527.9]
  - - [2048, 43264, 1, 5120]
    - [220, 529.23]
  - - [2048, 43520, 1, 5120]
    - [221, 530.58]
  - - [2048, 43776, 1, 5120]
    - [236, 529.49]
  - - [2048, 44544, 1, 5120]
    - [220, 520.83]
  - - [2048, 44800, 1, 5120]
    - [221, 521.52]
  - - [2048, 45056, 1, 5120]
    - [221, 521.22]
  - - [2048, 46080, 1, 5120]
    - [214, 528.7]
  - - [2048, 46592, 1, 5120]
    - [221, 528.04]
  - - [2048, 47104, 1, 5120]
    - [214, 527.55]
  - - [2048, 47616, 1, 5120]
    - [222, 523.92]
  - - [2048, 47872, 1, 5120]
    - [220, 533.59]
  - - [2048, 48384, 1, 5120]
    - [246, 533.12]
  - - [2048, 48640, 1, 5120]
    - [259, 529.57]
  - - [2048, 49152, 1, 5120]
    - [225, 536.53]
  - - [2048, 49920, 1, 5120]
    - [221, 527.88]
  - - [2048, 50176, 1, 5120]
    - [237, 539.89]
  - - [2048, 50688, 1, 5120]
    - [256, 539.59]
  - - [2048, 51200, 1, 5120]
    - [214, 522.79]
  - - [2048, 51968, 1, 5120]
    - [221, 524.87]
  - - [2048, 52224, 1, 5120]
    - [214, 523.97]
  - - [2048, 52992, 1, 5120]
    - [221, 537.11]
  - - [2048, 53248, 1, 5120]
    - [214, 540.66]
  - - [2048, 53504, 1, 5120]
    - [221, 532.17]
  - - [2048, 53760, 1, 5120]
    - [221, 545.09]
  - - [2048, 55296, 1, 5120]
    - [240, 527.91]
  - - [2048, 55552, 1, 5120]
    - [220, 528.94]
  - - [2048, 56320, 1, 5120]
    - [214, 533.23]
  - - [2048, 56576, 1, 5120]
    - [221, 535.0]
  - - [2048, 57344, 1, 5120]
    - [220, 544.74]
  - - [2048, 57600, 1, 5120]
    - [214, 543.43]
  - - [2048, 58368, 1, 5120]
    - [221, 547.59]
  - - [2048, 58880, 1, 5120]
    - [221, 542.96]
  - - [2048, 59136, 1, 5120]
    - [225, 541.48]
  - - [2048, 59392, 1, 5120]
    - [221, 541.13]
  - - [2048, 59904, 1, 5120]
    - [221, 547.44]
  - - [2048, 60928, 1, 5120]
    - [221, 547.79]
  - - [2048, 61440, 1, 5120]
    - [221, 548.76]
  - - [2048, 61952, 1, 5120]
    - [221, 551.95]
  - - [2048, 62208, 1, 5120]
    - [221, 541.98]
  - - [2048, 63232, 1, 5120]
    - [221, 541.21]
  - - [2048, 63488, 1, 5120]
    - [214, 551.04]
  - - [2048, 64000, 1, 5120]
    - [232, 547.85]
  - - [2048, 64512, 1, 5120]
    - [220, 546.21]
  - - [2048, 64768, 1, 5120]
    - [221, 552.2]
  - - [2048, 65280, 1, 5120]
    - [240, 550.95]
  - - [2048, 65536, 1, 5120]
    - [221, 548.21]
  - - [2048, 66560, 1, 5120]
    - [237, 550.9]
  - - [2048, 66816, 1, 5120]
    - [220, 548.22]
  - - [2048, 67584, 1, 5120]
    - [221, 562.41]
  - - [2048, 68096, 1, 5120]
    - [223, 549.99]
  - - [2048, 69120, 1, 5120]
    - [214, 561.03]
  - - [2048, 69632, 1, 5120]
    - [221, 552.21]
  - - [2048, 69888, 1, 5120]
    - [220, 554.95]
  - - [2048, 70400, 1, 5120]
    - [232, 549.95]
  - - [2048, 70656, 1, 5120]
    - [221, 549.35]
  - - [2048, 71424, 1, 5120]
    - [214, 554.13]
  - - [2048, 71680, 1, 5120]
    - [214, 557.64]
  - - [2048, 72960, 1, 5120]
    - [221, 557.45]
  - - [2048, 73216, 1, 5120]
    - [214, 553.36]
  - - [2048, 73728, 1, 5120]
    - [214, 554.83]
  - - [2048, 74240, 1, 5120]
    - [221, 554.66]
  - - [2048, 75264, 1, 5120]
    - [231, 557.7]
  - - [2048, 76032, 1, 5120]
    - [224, 563.99]
  - - [2048, 76544, 1, 5120]
    - [220, 560.15]
  - - [2048, 76800, 1, 5120]
    - [214, 557.32]
  - - [2048, 77824, 1, 5120]
    - [221, 560.42]
  - - [2048, 78848, 1, 5120]
    - [221, 559.12]
  - - [2048, 79360, 1, 5120]
    - [221, 558.22]
  - - [2048, 79872, 1, 5120]
    - [221, 562.07]
  - - [2048, 80640, 1, 5120]
    - [220, 558.4]
  - - [2048, 81664, 1, 5120]
    - [221, 552.81]
  - - [2048, 81920, 1, 5120]
    - [221, 551.29]
  - - [2048, 82432, 1, 5120]
    - [221, 558.86]
  - - [2048, 82944, 1, 5120]
    - [221, 561.02]
  - - [2048, 83200, 1, 5120]
    - [221, 562.12]
  - - [2048, 84480, 1, 5120]
    - [221, 556.59]
  - - [2048, 86016, 1, 5120]
    - [221, 558.6]
  - - [2048, 86528, 1, 5120]
    - [214, 560.6]
  - - [2048, 87296, 1, 5120]
    - [221, 561.5]
  - - [2048, 88320, 1, 5120]
    - [214, 559.33]
  - - [2048, 89088, 1, 5120]
    - [214, 554.22]
  - - [2048, 89600, 1, 5120]
    - [221, 560.83]
  - - [2048, 89856, 1, 5120]
    - [221, 557.59]
  - - [2048, 90112, 1, 5120]
    - [221, 557.3]
  - - [2048, 92160, 1, 5120]
    - [251, 556.83]
  - - [2048, 93184, 1, 5120]
    - [251, 570.95]
  - - [2048, 94208, 1, 5120]
    - [221, 556.67]
  - - [2048, 95232, 1, 5120]
    - [214, 556.74]
  - - [2048, 96000, 1, 5120]
    - [221, 562.2]
  - - [2048, 96512, 1, 5120]
    - [221, 559.75]
  - - [2048, 96768, 1, 5120]
    - [221, 558.1]
  - - [2048, 98304, 1, 5120]
    - [214, 561.56]
  - - [2048, 99840, 1, 5120]
    - [225, 562.61]
  - - [2048, 100352, 1, 5120]
    - [251, 560.24]
  - - [2048, 102400, 1, 5120]
    - [221, 558.13]
  - - [2048, 103168, 1, 5120]
    - [221, 559.98]
  - - [2048, 103680, 1, 5120]
    - [220, 555.58]
  - - [2048, 103936, 1, 5120]
    - [221, 554.64]
  - - [2048, 106496, 1, 5120]
    - [251, 556.51]
  - - [2048, 107520, 1, 5120]
    - [221, 560.83]
  - - [2048, 110592, 1, 5120]
    - [224, 571.32]
  - - [2048, 111104, 1, 5120]
    - [221, 558.94]
  - - [2048, 111360, 1, 5120]
    - [214, 559.26]
  - - [2048, 114688, 1, 5120]
    - [246, 558.26]
  - - [2048, 115200, 1, 5120]
    - [221, 557.63]
  - - [2048, 118784, 1, 5120]
    - [251, 569.3]
  - - [2048, 119040, 1, 5120]
    - [251, 574.31]
  - - [2048, 122880, 1, 5120]
    - [221, 563.19]
  - - [2048, 126976, 1, 5120]
    - [251, 571.3]
  - - [2048, 131072, 1, 5120]
    - [247, 561.9]
  - - [16384, 4352, 1, 5120]
    - [220, 545.43]
  - - [16384, 4608, 1, 5120]
    - [220, 541.98]
  - - [16384, 4864, 1, 5120]
    - [220, 547.18]
  - - [16384, 5120, 1, 5120]
    - [231, 545.03]
  - - [16384, 5376, 1, 5120]
    - [221, 557.98]
  - - [16384, 5632, 1, 5120]
    - [221, 542.7]
  - - [16384, 5888, 1, 5120]
    - [220, 545.74]
  - - [16384, 6144, 1, 5120]
    - [220, 555.78]
  - - [16384, 6400, 1, 5120]
    - [192, 556.49]
  - - [16384, 6656, 1, 5120]
    - [260, 560.74]
  - - [16384, 6912, 1, 5120]
    - [221, 563.15]
  - - [16384, 7168, 1, 5120]
    - [220, 562.95]
  - - [16384, 7424, 1, 5120]
    - [220, 562.13]
  - - [16384, 7680, 1, 5120]
    - [221, 563.88]
  - - [16384, 7936, 1, 5120]
    - [220, 564.81]
  - - [16384, 8192, 1, 5120]
    - [221, 559.38]
  - - [16384, 8448, 1, 5120]
    - [221, 570.21]
  - - [16384, 8704, 1, 5120]
    - [220, 566.98]
  - - [16384, 8960, 1, 5120]
    - [228, 573.64]
  - - [16384, 9216, 1, 5120]
    - [221, 571.61]
  - - [16384, 9728, 1, 5120]
    - [221, 576.02]
  - - [16384, 9984, 1, 5120]
    - [220, 580.25]
  - - [16384, 10240, 1, 5120]
    - [221, 571.32]
  - - [16384, 10752, 1, 5120]
    - [221, 578.78]
  - - [16384, 11264, 1, 5120]
    - [221, 578.9]
  - - [16384, 11520, 1, 5120]
    - [221, 583.3]
  - - [16384, 11776, 1, 5120]
    - [221, 582.86]
  - - [16384, 12288, 1, 5120]
    - [221, 597.69]
  - - [16384, 12544, 1, 5120]
    - [220, 591.95]
  - - [16384, 12800, 1, 5120]
    - [220, 589.47]
  - - [16384, 13056, 1, 5120]
    - [220, 598.24]
  - - [16384, 13312, 1, 5120]
    - [221, 589.76]
  - - [16384, 13824, 1, 5120]
    - [221, 595.5]
  - - [16384, 14080, 1, 5120]
    - [221, 595.27]
  - - [16384, 14336, 1, 5120]
    - [221, 593.36]
  - - [16384, 14592, 1, 5120]
    - [221, 597.17]
  - - [16384, 14848, 1, 5120]
    - [221, 594.23]
  - - [16384, 15360, 1, 5120]
    - [221, 594.17]
  - - [16384, 15872, 1, 5120]
    - [221, 593.69]
  - - [16384, 16128, 1, 5120]
    - [221, 589.82]
  - - [16384, 16384, 1, 5120]
    - [220, 596.14]
  - - [16384, 16640, 1, 5120]
    - [228, 595.47]
  - - [16384, 16896, 1, 5120]
    - [228, 598.79]
  - - [16384, 17408, 1, 5120]
    - [221, 592.46]
  - - [16384, 17664, 1, 5120]
    - [220, 590.28]
  - - [16384, 17920, 1, 5120]
    - [224, 598.04]
  - - [16384, 18432, 1, 5120]
    - [221, 592.25]
  - - [16384, 19200, 1, 5120]
    - [260, 599.62]
  - - [16384, 19456, 1, 5120]
    - [221, 591.42]
  - - [16384, 19712, 1, 5120]
    - [225, 589.27]
  - - [16384, 19968, 1, 5120]
    - [220, 592.16]
  - - [16384, 20480, 1, 5120]
    - [220, 592.5]
  - - [16384, 20736, 1, 5120]
    - [221, 591.05]
  - - [16384, 21504, 1, 5120]
    - [220, 590.75]
  - - [16384, 21760, 1, 5120]
    - [221, 591.36]
  - - [16384, 22272, 1, 5120]
    - [221, 595.08]
  - - [16384, 22528, 1, 5120]
    - [228, 594.55]
  - - [16384, 23040, 1, 5120]
    - [224, 592.42]
  - - [16384, 23296, 1, 5120]
    - [224, 599.67]
  - - [16384, 23552, 1, 5120]
    - [221, 591.31]
  - - [16384, 23808, 1, 5120]
    - [221, 591.08]
  - - [16384, 24320, 1, 5120]
    - [224, 592.09]
  - - [16384, 24576, 1, 5120]
    - [260, 593.22]
  - - [16384, 25088, 1, 5120]
    - [224, 591.99]
  - - [16384, 25200, 1, 5120]
    - [225, 592.9]
  - - [16384, 25344, 1, 5120]
    - [221, 594.03]
  - - [16384, 25600, 1, 5120]
    - [228, 594.35]
  - - [16384, 26112, 1, 5120]
    - [221, 590.07]
  - - [16384, 26624, 1, 5120]
    - [228, 591.34]
  - - [16384, 26880, 1, 5120]
    - [228, 596.75]
  - - [16384, 27648, 1, 5120]
    - [221, 592.38]
  - - [16384, 28160, 1, 5120]
    - [228, 596.8]
  - - [16384, 28672, 1, 5120]
    - [224, 596.31]
  - - [16384, 29184, 1, 5120]
    - [228, 593.89]
  - - [16384, 29440, 1, 5120]
    - [221, 590.61]
  - - [16384, 29696, 1, 5120]
    - [225, 596.0]
  - - [16384, 29952, 1, 5120]
    - [221, 591.0]
  - - [16384, 30464, 1, 5120]
    - [221, 592.78]
  - - [16384, 30720, 1, 5120]
    - [220, 589.83]
  - - [16384, 30976, 1, 5120]
    - [221, 590.86]
  - - [16384, 31744, 1, 5120]
    - [221, 591.6]
  - - [16384, 32000, 1, 5120]
    - [260, 590.7]
  - - [16384, 32256, 1, 5120]
    - [221, 595.3]
  - - [16384, 32768, 1, 5120]
    - [260, 593.83]
  - - [5120, 4352, 1, 2048]
    - [261, 385.59]
  - - [5120, 4608, 1, 2048]
    - [262, 392.54]
  - - [5120, 4864, 1, 2048]
    - [174, 398.32]
  - - [5120, 5120, 1, 2048]
    - [263, 390.29]
  - - [5120, 5376, 1, 2048]
    - [221, 404.14]
  - - [5120, 5632, 1, 2048]
    - [264, 408.36]
  - - [5120, 5888, 1, 2048]
    - [265, 406.56]
  - - [5120, 6144, 1, 2048]
    - [266, 398.13]
  - - [5120, 6400, 1, 2048]
    - [221, 400.52]
  - - [5120, 6656, 1, 2048]
    - [264, 411.31]
  - - [5120, 6912, 1, 2048]
    - [232, 419.44]
  - - [5120, 7168, 1, 2048]
    - [267, 416.02]
  - - [5120, 7424, 1, 2048]
    - [265, 408.17]
  - - [5120, 7680, 1, 2048]
    - [268, 409.96]
  - - [5120, 7936, 1, 2048]
    - [221, 410.37]
  - - [5120, 8192, 1, 2048]
    - [267, 420.89]
  - - [5120, 8448, 1, 2048]
    - [232, 423.56]
  - - [5120, 8704, 1, 2048]
    - [232, 421.55]
  - - [5120, 8960, 1, 2048]
    - [269, 414.81]
  - - [5120, 9216, 1, 2048]
    - [221, 417.49]
  - - [5120, 9728, 1, 2048]
    - [264, 418.42]
  - - [5120, 9984, 1, 2048]
    - [220, 431.04]
  - - [5120, 10240, 1, 2048]
    - [265, 416.23]
  - - [5120, 10752, 1, 2048]
    - [220, 419.27]
  - - [5120, 11264, 1, 2048]
    - [264, 428.58]
  - - [5120, 11520, 1, 2048]
    - [232, 432.54]
  - - [5120, 11776, 1, 2048]
    - [270, 418.1]
  - - [5120, 12288, 1, 2048]
    - [232, 428.25]
  - - [5120, 12544, 1, 2048]
    - [221, 429.57]
  - - [5120, 12800, 1, 2048]
    - [267, 427.44]
  - - [5120, 13056, 1, 2048]
    - [232, 430.65]
  - - [5120, 13312, 1, 2048]
    - [221, 423.04]
  - - [5120, 13824, 1, 2048]
    - [221, 434.24]
  - - [5120, 14080, 1, 2048]
    - [264, 434.64]
  - - [5120, 14336, 1, 2048]
    - [267, 438.52]
  - - [5120, 14592, 1, 2048]
    - [221, 441.9]
  - - [5120, 14848, 1, 2048]
    - [269, 426.42]
  - - [5120, 15360, 1, 2048]
    - [220, 443.78]
  - - [5120, 15872, 1, 2048]
    - [232, 435.67]
  - - [5120, 16128, 1, 2048]
    - [221, 433.71]
  - - [5120, 16384, 1, 2048]
    - [271, 429.75]
  - - [5120, 16640, 1, 2048]
    - [265, 429.21]
  - - [5120, 16896, 1, 2048]
    - [232, 436.03]
  - - [5120, 17408, 1, 2048]
    - [232, 445.83]
  - - [5120, 17664, 1, 2048]
    - [220, 432.76]
  - - [5120, 17920, 1, 2048]
    - [232, 435.97]
  - - [5120, 18432, 1, 2048]
    - [232, 443.65]
  - - [5120, 19200, 1, 2048]
    - [220, 436.03]
  - - [5120, 19456, 1, 2048]
    - [221, 432.8]
  - - [5120, 19712, 1, 2048]
    - [221, 439.28]
  - - [5120, 19968, 1, 2048]
    - [221, 441.71]
  - - [5120, 20480, 1, 2048]
    - [221, 437.06]
  - - [5120, 20736, 1, 2048]
    - [221, 436.18]
  - - [5120, 21504, 1, 2048]
    - [221, 447.97]
  - - [5120, 21760, 1, 2048]
    - [220, 446.94]
  - - [5120, 22272, 1, 2048]
    - [221, 441.37]
  - - [5120, 22528, 1, 2048]
    - [220, 445.25]
  - - [5120, 23040, 1, 2048]
    - [221, 446.85]
  - - [5120, 23296, 1, 2048]
    - [220, 443.68]
  - - [5120, 23552, 1, 2048]
    - [221, 442.32]
  - - [5120, 23808, 1, 2048]
    - [267, 446.19]
  - - [5120, 24320, 1, 2048]
    - [232, 446.02]
  - - [5120, 24576, 1, 2048]
    - [221, 448.5]
  - - [5120, 25088, 1, 2048]
    - [232, 442.65]
  - - [5120, 25344, 1, 2048]
    - [232, 445.86]
  - - [5120, 25600, 1, 2048]
    - [220, 447.3]
  - - [5120, 26112, 1, 2048]
    - [221, 445.9]
  - - [5120, 26624, 1, 2048]
    - [221, 446.62]
  - - [5120, 26880, 1, 2048]
    - [220, 448.86]
  - - [5120, 27648, 1, 2048]
    - [220, 463.14]
  - - [5120, 28160, 1, 2048]
    - [267, 448.49]
  - - [5120, 28672, 1, 2048]
    - [221, 454.62]
  - - [5120, 29184, 1, 2048]
    - [232, 446.97]
  - - [5120, 29440, 1, 2048]
    - [267, 448.62]
  - - [5120, 29696, 1, 2048]
    - [267, 449.46]
  - - [5120, 29952, 1, 2048]
    - [220, 451.57]
  - - [5120, 30464, 1, 2048]
    - [221, 463.87]
  - - [5120, 30720, 1, 2048]
    - [221, 447.09]
  - - [5120, 30976, 1, 2048]
    - [221, 452.69]
  - - [5120, 31744, 1, 2048]
    - [221, 453.1]
  - - [5120, 32000, 1, 2048]
    - [221, 453.07]
  - - [5120, 32256, 1, 2048]
    - [267, 452.45]
  - - [5120, 32768, 1, 2048]
    - [221, 464.06]
  - - [5120, 33280, 1, 2048]
    - [232, 454.78]
  - - [5120, 33792, 1, 2048]
    - [232, 451.69]
  - - [5120, 34048, 1, 2048]
    - [267, 454.45]
  - - [5120, 34560, 1, 2048]
    - [221, 457.77]
  - - [5120, 34816, 1, 2048]
    - [232, 466.13]
  - - [5120, 35328, 1, 2048]
    - [221, 454.58]
  - - [5120, 35840, 1, 2048]
    - [232, 464.42]
  - - [5120, 36608, 1, 2048]
    - [271, 457.88]
  - - [5120, 36864, 1, 2048]
    - [220, 457.28]
  - - [5120, 37120, 1, 2048]
    - [263, 464.76]
  - - [5120, 37632, 1, 2048]
    - [221, 459.4]
  - - [5120, 38400, 1, 2048]
    - [264, 463.7]
  - - [5120, 38912, 1, 2048]
    - [263, 462.38]
  - - [5120, 39168, 1, 2048]
    - [220, 469.44]
  - - [5120, 39424, 1, 2048]
    - [256, 456.48]
  - - [5120, 39680, 1, 2048]
    - [221, 455.35]
  - - [5120, 39936, 1, 2048]
    - [256, 457.15]
  - - [5120, 40960, 1, 2048]
    - [221, 466.66]
  - - [5120, 41216, 1, 2048]
    - [264, 455.61]
  - - [5120, 41472, 1, 2048]
    - [221, 467.06]
  - - [5120, 42240, 1, 2048]
    - [256, 461.64]
  - - [5120, 43008, 1, 2048]
    - [267, 467.35]
  - - [5120, 43264, 1, 2048]
    - [174, 470.46]
  - - [5120, 43520, 1, 2048]
    - [232, 467.59]
  - - [5120, 43776, 1, 2048]
    - [220, 468.81]
  - - [5120, 44544, 1, 2048]
    - [264, 474.73]
  - - [5120, 44800, 1, 2048]
    - [256, 476.3]
  - - [5120, 45056, 1, 2048]
    - [232, 470.18]
  - - [5120, 46080, 1, 2048]
    - [261, 475.41]
  - - [5120, 46592, 1, 2048]
    - [220, 470.73]
  - - [5120, 47104, 1, 2048]
    - [221, 471.28]
  - - [5120, 47616, 1, 2048]
    - [232, 476.83]
  - - [5120, 47872, 1, 2048]
    - [220, 476.91]
  - - [5120, 48384, 1, 2048]
    - [232, 472.23]
  - - [5120, 48640, 1, 2048]
    - [261, 472.41]
  - - [5120, 49152, 1, 2048]
    - [221, 477.76]
  - - [5120, 49920, 1, 2048]
    - [267, 471.51]
  - - [5120, 50176, 1, 2048]
    - [263, 479.16]
  - - [5120, 50688, 1, 2048]
    - [220, 476.93]
  - - [5120, 51200, 1, 2048]
    - [221, 471.16]
  - - [5120, 51968, 1, 2048]
    - [220, 478.4]
  - - [5120, 52224, 1, 2048]
    - [271, 477.93]
  - - [5120, 52992, 1, 2048]
    - [263, 476.54]
  - - [5120, 53248, 1, 2048]
    - [261, 475.46]
  - - [5120, 53504, 1, 2048]
    - [232, 477.33]
  - - [5120, 53760, 1, 2048]
    - [221, 481.22]
  - - [5120, 55296, 1, 2048]
    - [232, 483.42]
  - - [5120, 55552, 1, 2048]
    - [221, 479.68]
  - - [5120, 56320, 1, 2048]
    - [221, 479.38]
  - - [5120, 56576, 1, 2048]
    - [221, 476.49]
  - - [5120, 57344, 1, 2048]
    - [220, 476.56]
  - - [5120, 57600, 1, 2048]
    - [221, 482.08]
  - - [5120, 58368, 1, 2048]
    - [232, 475.8]
  - - [5120, 58880, 1, 2048]
    - [221, 474.91]
  - - [5120, 59136, 1, 2048]
    - [221, 480.67]
  - - [5120, 59392, 1, 2048]
    - [232, 476.6]
  - - [5120, 59904, 1, 2048]
    - [232, 481.34]
  - - [5120, 60928, 1, 2048]
    - [221, 482.06]
  - - [5120, 61440, 1, 2048]
    - [232, 479.29]
  - - [5120, 61952, 1, 2048]
    - [264, 476.79]
  - - [5120, 62208, 1, 2048]
    - [221, 482.06]
  - - [5120, 63232, 1, 2048]
    - [220, 478.93]
  - - [5120, 63488, 1, 2048]
    - [221, 486.51]
  - - [5120, 64000, 1, 2048]
    - [267, 478.11]
  - - [5120, 64512, 1, 2048]
    - [220, 482.89]
  - - [5120, 64768, 1, 2048]
    - [232, 481.18]
  - - [5120, 65280, 1, 2048]
    - [220, 480.7]
  - - [5120, 65536, 1, 2048]
    - [220, 479.75]
  - - [5120, 66560, 1, 2048]
    - [232, 478.44]
  - - [5120, 66816, 1, 2048]
    - [221, 481.78]
  - - [5120, 67584, 1, 2048]
    - [221, 481.28]
  - - [5120, 68096, 1, 2048]
    - [264, 484.56]
  - - [5120, 69120, 1, 2048]
    - [220, 482.81]
  - - [5120, 69632, 1, 2048]
    - [263, 478.74]
  - - [5120, 69888, 1, 2048]
    - [221, 482.14]
  - - [5120, 70400, 1, 2048]
    - [267, 477.9]
  - - [5120, 70656, 1, 2048]
    - [264, 480.39]
  - - [5120, 71424, 1, 2048]
    - [232, 481.59]
  - - [5120, 71680, 1, 2048]
    - [220, 482.64]
  - - [5120, 72960, 1, 2048]
    - [221, 481.7]
  - - [5120, 73216, 1, 2048]
    - [267, 479.03]
  - - [5120, 73728, 1, 2048]
    - [232, 482.12]
  - - [5120, 74240, 1, 2048]
    - [221, 479.27]
  - - [5120, 75264, 1, 2048]
    - [221, 477.7]
  - - [5120, 76032, 1, 2048]
    - [232, 481.35]
  - - [5120, 76544, 1, 2048]
    - [220, 479.51]
  - - [5120, 76800, 1, 2048]
    - [220, 481.67]
  - - [5120, 77824, 1, 2048]
    - [264, 482.28]
  - - [5120, 78848, 1, 2048]
    - [263, 479.55]
  - - [5120, 79360, 1, 2048]
    - [232, 481.88]
  - - [5120, 79872, 1, 2048]
    - [221, 484.38]
  - - [5120, 80640, 1, 2048]
    - [267, 481.51]
  - - [5120, 81664, 1, 2048]
    - [220, 482.46]
  - - [5120, 81920, 1, 2048]
    - [264, 477.62]
  - - [5120, 82432, 1, 2048]
    - [267, 481.03]
  - - [5120, 82944, 1, 2048]
    - [267, 482.3]
  - - [5120, 83200, 1, 2048]
    - [220, 479.6]
  - - [5120, 84480, 1, 2048]
    - [232, 480.26]
  - - [5120, 86016, 1, 2048]
    - [232, 481.72]
  - - [5120, 86528, 1, 2048]
    - [220, 479.48]
  - - [5120, 87296, 1, 2048]
    - [221, 483.54]
  - - [5120, 88320, 1, 2048]
    - [267, 481.3]
  - - [5120, 89088, 1, 2048]
    - [264, 479.74]
  - - [5120, 89600, 1, 2048]
    - [232, 481.25]
  - - [5120, 89856, 1, 2048]
    - [221, 479.2]
  - - [5120, 90112, 1, 2048]
    - [221, 482.74]
  - - [5120, 92160, 1, 2048]
    - [221, 483.87]
  - - [5120, 93184, 1, 2048]
    - [267, 481.49]
  - - [5120, 94208, 1, 2048]
    - [221, 479.39]
  - - [5120, 95232, 1, 2048]
    - [221, 477.74]
  - - [5120, 96000, 1, 2048]
    - [221, 478.76]
  - - [5120, 96512, 1, 2048]
    - [221, 479.89]
  - - [5120, 96768, 1, 2048]
    - [264, 479.44]
  - - [5120, 98304, 1, 2048]
    - [221, 480.4]
  - - [5120, 99840, 1, 2048]
    - [221, 479.5]
  - - [5120, 100352, 1, 2048]
    - [220, 477.59]
  - - [5120, 102400, 1, 2048]
    - [232, 479.1]
  - - [5120, 103168, 1, 2048]
    - [220, 479.39]
  - - [5120, 103680, 1, 2048]
    - [267, 480.35]
  - - [5120, 103936, 1, 2048]
    - [232, 476.72]
  - - [5120, 106496, 1, 2048]
    - [221, 479.9]
  - - [5120, 107520, 1, 2048]
    - [267, 480.19]
  - - [5120, 110592, 1, 2048]
    - [221, 479.12]
  - - [5120, 111104, 1, 2048]
    - [232, 480.57]
  - - [5120, 111360, 1, 2048]
    - [232, 480.11]
  - - [5120, 114688, 1, 2048]
    - [221, 479.21]
  - - [5120, 115200, 1, 2048]
    - [264, 479.39]
  - - [5120, 118784, 1, 2048]
    - [221, 477.75]
  - - [5120, 119040, 1, 2048]
    - [221, 483.23]
  - - [5120, 122880, 1, 2048]
    - [232, 480.19]
  - - [5120, 126976, 1, 2048]
    - [267, 481.45]
  - - [5120, 131072, 1, 2048]
    - [221, 480.2]
  - - [5120, 10240, 1, 640]
    - [345, 296.81]
  - - [5120, 10752, 1, 640]
    - [345, 303.52]
  - - [5120, 11264, 1, 640]
    - [345, 311.45]
  - - [5120, 11520, 1, 640]
    - [345, 317.14]
  - - [5120, 11776, 1, 640]
    - [334, 287.69]
  - - [5120, 12288, 1, 640]
    - [334, 298.29]
  - - [5120, 12544, 1, 640]
    - [334, 297.52]
  - - [5120, 12800, 1, 640]
    - [334, 301.54]
  - - [5120, 13056, 1, 640]
    - [346, 299.11]
  - - [5120, 13312, 1, 640]
    - [348, 294.57]
  - - [5120, 13824, 1, 640]
    - [334, 302.95]
  - - [5120, 14080, 1, 640]
    - [345, 303.15]
  - - [5120, 14336, 1, 640]
    - [345, 308.47]
  - - [5120, 14592, 1, 640]
    - [345, 309.47]
  - - [5120, 14848, 1, 640]
    - [338, 313.42]
  - - [5120, 15360, 1, 640]
    - [345, 318.72]
  - - [5120, 15872, 1, 640]
    - [336, 304.47]
  - - [5120, 16128, 1, 640]
    - [348, 300.96]
  - - [5120, 16384, 1, 640]
    - [334, 301.78]
  - - [5120, 16640, 1, 640]
    - [334, 307.04]
  - - [5120, 16896, 1, 640]
    - [346, 303.44]
  - - [5120, 17408, 1, 640]
    - [336, 307.53]
  - - [5120, 17664, 1, 640]
    - [338, 305.12]
  - - [5120, 17920, 1, 640]
    - [345, 308.66]
  - - [5120, 18432, 1, 640]
    - [337, 315.0]
  - - [5120, 19200, 1, 640]
    - [338, 322.18]
  - - [5120, 19456, 1, 640]
    - [345, 320.89]
  - - [5120, 19712, 1, 640]
    - [334, 308.56]
  - - [5120, 19968, 1, 640]
    - [336, 310.73]
  - - [5120, 20480, 1, 640]
    - [334, 304.8]
  - - [5120, 20736, 1, 640]
    - [334, 304.01]
  - - [5120, 21504, 1, 640]
    - [345, 312.58]
  - - [5120, 21760, 1, 640]
    - [345, 313.3]
  - - [5120, 22272, 1, 640]
    - [345, 318.56]
  - - [5120, 22528, 1, 640]
    - [338, 319.32]
  - - [5120, 23040, 1, 640]
    - [345, 322.49]
  - - [5120, 23296, 1, 640]
    - [338, 324.31]
  - - [5120, 23552, 1, 640]
    - [334, 307.58]
  - - [5120, 23808, 1, 640]
    - [334, 311.08]
  - - [5120, 24320, 1, 640]
    - [345, 309.46]
  - - [5120, 24576, 1, 640]
    - [334, 311.37]
  - - [5120, 25088, 1, 640]
    - [337, 311.88]
  - - [5120, 25344, 1, 640]
    - [345, 314.79]
  - - [5120, 25600, 1, 640]
    - [345, 316.55]
  - - [5120, 26112, 1, 640]
    - [345, 320.6]
  - - [5120, 26624, 1, 640]
    - [337, 321.81]
  - - [5120, 26880, 1, 640]
    - [345, 325.23]
  - - [5120, 27648, 1, 640]
    - [334, 310.82]
  - - [5120, 28160, 1, 640]
    - [337, 310.69]
  - - [5120, 28672, 1, 640]
    - [337, 313.34]
  - - [5120, 29184, 1, 640]
    - [345, 316.18]
  - - [5120, 29440, 1, 640]
    - [345, 318.46]
  - - [5120, 29696, 1, 640]
    - [345, 318.19]
  - - [5120, 29952, 1, 640]
    - [337, 321.51]
  - - [5120, 30464, 1, 640]
    - [345, 320.14]
  - - [5120, 30720, 1, 640]
    - [345, 324.83]
  - - [5120, 30976, 1, 640]
    - [338, 329.11]
  - - [5120, 31744, 1, 640]
    - [334, 316.86]
  - - [5120, 32000, 1, 640]
    - [334, 316.33]
  - - [5120, 32256, 1, 640]
    - [337, 314.0]
  - - [5120, 32768, 1, 640]
    - [337, 315.98]
  - - [5120, 33280, 1, 640]
    - [337, 321.23]
  - - [5120, 33792, 1, 640]
    - [345, 323.59]
  - - [5120, 34048, 1, 640]
    - [338, 324.26]
  - - [5120, 34560, 1, 640]
    - [341, 326.65]
  - - [5120, 34816, 1, 640]
    - [345, 327.58]
  - - [5120, 35328, 1, 640]
    - [337, 312.11]
  - - [5120, 35840, 1, 640]
    - [341, 314.64]
  - - [5120, 36608, 1, 640]
    - [341, 318.26]
  - - [5120, 36864, 1, 640]
    - [345, 317.63]
  - - [5120, 37120, 1, 640]
    - [338, 322.42]
  - - [5120, 37632, 1, 640]
    - [341, 323.15]
  - - [5120, 38400, 1, 640]
    - [337, 327.83]
  - - [5120, 38912, 1, 640]
    - [337, 328.21]
  - - [5120, 39168, 1, 640]
    - [334, 316.23]
  - - [5120, 39424, 1, 640]
    - [334, 316.66]
  - - [5120, 39680, 1, 640]
    - [338, 316.96]
  - - [5120, 39936, 1, 640]
    - [337, 320.32]
  - - [5120, 40960, 1, 640]
    - [337, 324.25]
  - - [5120, 41216, 1, 640]
    - [345, 324.53]
  - - [5120, 41472, 1, 640]
    - [338, 327.17]
  - - [5120, 42240, 1, 640]
    - [338, 330.21]
  - - [5120, 43008, 1, 640]
    - [334, 317.31]
  - - [5120, 43264, 1, 640]
    - [337, 319.77]
  - - [5120, 43520, 1, 640]
    - [345, 320.73]
  - - [5120, 43776, 1, 640]
    - [338, 319.14]
  - - [5120, 44544, 1, 640]
    - [337, 324.08]
  - - [5120, 44800, 1, 640]
    - [341, 325.51]
  - - [5120, 45056, 1, 640]
    - [338, 324.94]
  - - [5120, 46080, 1, 640]
    - [345, 330.18]
  - - [5120, 46592, 1, 640]
    - [341, 330.53]
  - - [5120, 47104, 1, 640]
    - [337, 321.31]
  - - [5120, 47616, 1, 640]
    - [338, 322.93]
  - - [5120, 47872, 1, 640]
    - [345, 324.32]
  - - [5120, 48384, 1, 640]
    - [338, 324.12]
  - - [5120, 48640, 1, 640]
    - [337, 324.09]
  - - [5120, 49152, 1, 640]
    - [337, 328.76]
  - - [5120, 49920, 1, 640]
    - [345, 330.23]
  - - [5120, 50176, 1, 640]
    - [345, 334.24]
  - - [5120, 50688, 1, 640]
    - [337, 325.0]
  - - [5120, 51200, 1, 640]
    - [341, 324.37]
  - - [5120, 51968, 1, 640]
    - [345, 325.91]
  - - [5120, 52224, 1, 640]
    - [337, 325.58]
  - - [5120, 52992, 1, 640]
    - [345, 330.6]
  - - [5120, 53248, 1, 640]
    - [345, 328.06]
  - - [5120, 53504, 1, 640]
    - [345, 331.18]
  - - [5120, 53760, 1, 640]
    - [338, 332.32]
  - - [5120, 55296, 1, 640]
    - [337, 325.77]
  - - [5120, 55552, 1, 640]
    - [337, 327.86]
  - - [5120, 56320, 1, 640]
    - [337, 329.99]
  - - [5120, 56576, 1, 640]
    - [338, 330.73]
  - - [5120, 57344, 1, 640]
    - [345, 331.41]
  - - [5120, 57600, 1, 640]
    - [345, 331.54]
  - - [5120, 58368, 1, 640]
    - [338, 334.11]
  - - [5120, 58880, 1, 640]
    - [341, 324.97]
  - - [5120, 59136, 1, 640]
    - [337, 330.97]
  - - [5120, 59392, 1, 640]
    - [334, 324.93]
  - - [5120, 59904, 1, 640]
    - [341, 332.1]
  - - [5120, 60928, 1, 640]
    - [337, 329.67]
  - - [5120, 61440, 1, 640]
    - [338, 334.25]
  - - [5120, 61952, 1, 640]
    - [337, 335.53]
  - - [5120, 62208, 1, 640]
    - [338, 334.88]
  - - [5120, 63232, 1, 640]
    - [345, 326.28]
  - - [5120, 63488, 1, 640]
    - [345, 328.78]
  - - [5120, 64000, 1, 640]
    - [345, 334.54]
  - - [5120, 64512, 1, 640]
    - [337, 334.47]
  - - [5120, 64768, 1, 640]
    - [338, 332.81]
  - - [5120, 65280, 1, 640]
    - [345, 334.04]
  - - [5120, 65536, 1, 640]
    - [337, 336.82]
  - - [5120, 66560, 1, 640]
    - [341, 327.51]
  - - [5120, 66816, 1, 640]
    - [337, 327.82]
  - - [5120, 67584, 1, 640]
    - [337, 332.58]
  - - [5120, 68096, 1, 640]
    - [345, 334.13]
  - - [5120, 69120, 1, 640]
    - [345, 335.42]
  - - [5120, 69632, 1, 640]
    - [341, 337.91]
  - - [5120, 69888, 1, 640]
    - [337, 338.81]
  - - [5120, 70400, 1, 640]
    - [341, 330.6]
  - - [5120, 70656, 1, 640]
    - [337, 332.71]
  - - [5120, 71424, 1, 640]
    - [337, 335.28]
  - - [5120, 71680, 1, 640]
    - [345, 333.08]
  - - [5120, 72960, 1, 640]
    - [341, 338.41]
  - - [5120, 73216, 1, 640]
    - [337, 336.88]
  - - [5120, 73728, 1, 640]
    - [345, 339.62]
  - - [5120, 74240, 1, 640]
    - [337, 330.73]
  - - [5120, 75264, 1, 640]
    - [338, 334.75]
  - - [5120, 76032, 1, 640]
    - [341, 332.56]
  - - [5120, 76544, 1, 640]
    - [345, 339.84]
  - - [5120, 76800, 1, 640]
    - [337, 334.69]
  - - [5120, 77824, 1, 640]
    - [337, 341.68]
  - - [5120, 78848, 1, 640]
    - [337, 335.46]
  - - [5120, 79360, 1, 640]
    - [345, 337.18]
  - - [5120, 79872, 1, 640]
    - [341, 337.21]
  - - [5120, 80640, 1, 640]
    - [338, 334.71]
  - - [5120, 81664, 1, 640]
    - [338, 341.93]
  - - [5120, 81920, 1, 640]
    - [337, 335.72]
  - - [5120, 82432, 1, 640]
    - [345, 335.23]
  - - [5120, 82944, 1, 640]
    - [337, 337.54]
  - - [5120, 83200, 1, 640]
    - [337, 336.11]
  - - [5120, 84480, 1, 640]
    - [345, 338.44]
  - - [5120, 86016, 1, 640]
    - [345, 335.35]
  - - [5120, 86528, 1, 640]
    - [345, 338.95]
  - - [5120, 87296, 1, 640]
    - [345, 336.91]
  - - [5120, 88320, 1, 640]
    - [337, 337.74]
  - - [5120, 89088, 1, 640]
    - [338, 341.57]
  - - [5120, 89600, 1, 640]
    - [337, 333.96]
  - - [5120, 89856, 1, 640]
    - [341, 337.2]
  - - [5120, 90112, 1, 640]
    - [338, 336.98]
  - - [5120, 92160, 1, 640]
    - [345, 340.1]
  - - [5120, 93184, 1, 640]
    - [345, 348.48]
  - - [5120, 94208, 1, 640]
    - [337, 340.45]
  - - [5120, 95232, 1, 640]
    - [338, 342.19]
  - - [5120, 96000, 1, 640]
    - [337, 338.81]
  - - [5120, 96512, 1, 640]
    - [345, 341.72]
  - - [5120, 96768, 1, 640]
    - [341, 339.23]
  - - [5120, 98304, 1, 640]
    - [337, 338.59]
  - - [5120, 99840, 1, 640]
    - [345, 341.01]
  - - [5120, 100352, 1, 640]
    - [337, 342.8]
  - - [5120, 102400, 1, 640]
    - [345, 341.71]
  - - [5120, 103168, 1, 640]
    - [337, 344.11]
  - - [5120, 103680, 1, 640]
    - [337, 340.56]
  - - [5120, 103936, 1, 640]
    - [345, 339.44]
  - - [5120, 106496, 1, 640]
    - [345, 340.27]
  - - [5120, 107520, 1, 640]
    - [338, 346.94]
  - - [5120, 110592, 1, 640]
    - [337, 340.37]
  - - [5120, 111104, 1, 640]
    - [345, 342.53]
  - - [5120, 111360, 1, 640]
    - [345, 343.62]
  - - [5120, 114688, 1, 640]
    - [337, 339.31]
  - - [5120, 115200, 1, 640]
    - [337, 341.69]
  - - [5120, 118784, 1, 640]
    - [345, 342.19]
  - - [5120, 119040, 1, 640]
    - [337, 343.76]
  - - [5120, 122880, 1, 640]
    - [337, 342.2]
  - - [5120, 126976, 1, 640]
    - [341, 341.2]
  - - [5120, 131072, 1, 640]
    - [341, 343.99]
  - - [5120, 5888, 1, 1024]
    - [372, 331.03]
  - - [5120, 6144, 1, 1024]
    - [372, 341.38]
  - - [5120, 6400, 1, 1024]
    - [344, 343.63]
  - - [5120, 6656, 1, 1024]
    - [348, 349.67]
  - - [5120, 6912, 1, 1024]
    - [380, 341.72]
  - - [5120, 7168, 1, 1024]
    - [376, 349.7]
  - - [5120, 7424, 1, 1024]
    - [337, 351.29]
  - - [5120, 7680, 1, 1024]
    - [337, 355.03]
  - - [5120, 7936, 1, 1024]
    - [334, 336.49]
  - - [5120, 8192, 1, 1024]
    - [336, 342.17]
  - - [5120, 8448, 1, 1024]
    - [334, 349.21]
  - - [5120, 8704, 1, 1024]
    - [334, 352.26]
  - - [5120, 8960, 1, 1024]
    - [372, 340.72]
  - - [5120, 9216, 1, 1024]
    - [373, 349.31]
  - - [5120, 9728, 1, 1024]
    - [348, 352.31]
  - - [5120, 9984, 1, 1024]
    - [348, 358.83]
  - - [5120, 10240, 1, 1024]
    - [380, 347.97]
  - - [5120, 10752, 1, 1024]
    - [381, 362.63]
  - - [5120, 11264, 1, 1024]
    - [338, 360.85]
  - - [5120, 11520, 1, 1024]
    - [338, 366.61]
  - - [5120, 11776, 1, 1024]
    - [334, 348.04]
  - - [5120, 12288, 1, 1024]
    - [336, 356.22]
  - - [5120, 12544, 1, 1024]
    - [346, 354.07]
  - - [5120, 12800, 1, 1024]
    - [334, 355.84]
  - - [5120, 13056, 1, 1024]
    - [334, 361.12]
  - - [5120, 13312, 1, 1024]
    - [344, 357.63]
  - - [5120, 13824, 1, 1024]
    - [334, 354.8]
  - - [5120, 14080, 1, 1024]
    - [380, 358.06]
  - - [5120, 14336, 1, 1024]
    - [381, 363.58]
  - - [5120, 14592, 1, 1024]
    - [334, 363.4]
  - - [5120, 14848, 1, 1024]
    - [345, 359.91]
  - - [5120, 15360, 1, 1024]
    - [345, 365.74]
  - - [5120, 15872, 1, 1024]
    - [334, 363.95]
  - - [5120, 16128, 1, 1024]
    - [348, 360.25]
  - - [5120, 16384, 1, 1024]
    - [348, 357.17]
  - - [5120, 16640, 1, 1024]
    - [348, 365.69]
  - - [5120, 16896, 1, 1024]
    - [348, 370.32]
  - - [5120, 17408, 1, 1024]
    - [334, 366.96]
  - - [5120, 17664, 1, 1024]
    - [380, 363.0]
  - - [5120, 17920, 1, 1024]
    - [381, 365.51]
  - - [5120, 18432, 1, 1024]
    - [345, 363.48]
  - - [5120, 19200, 1, 1024]
    - [338, 371.36]
  - - [5120, 19456, 1, 1024]
    - [338, 373.58]
  - - [5120, 19712, 1, 1024]
    - [348, 367.25]
  - - [5120, 19968, 1, 1024]
    - [334, 369.87]
  - - [5120, 20480, 1, 1024]
    - [346, 359.84]
  - - [5120, 20736, 1, 1024]
    - [381, 360.74]
  - - [5120, 21504, 1, 1024]
    - [380, 367.68]
  - - [5120, 21760, 1, 1024]
    - [380, 370.1]
  - - [5120, 22272, 1, 1024]
    - [345, 364.56]
  - - [5120, 22528, 1, 1024]
    - [338, 366.72]
  - - [5120, 23040, 1, 1024]
    - [338, 371.78]
  - - [5120, 23296, 1, 1024]
    - [345, 374.77]
  - - [5120, 23552, 1, 1024]
    - [348, 370.59]
  - - [5120, 23808, 1, 1024]
    - [334, 365.36]
  - - [5120, 24320, 1, 1024]
    - [381, 364.64]
  - - [5120, 24576, 1, 1024]
    - [381, 366.23]
  - - [5120, 25088, 1, 1024]
    - [373, 369.38]
  - - [5120, 25344, 1, 1024]
    - [381, 371.45]
  - - [5120, 25600, 1, 1024]
    - [334, 371.9]
  - - [5120, 26112, 1, 1024]
    - [334, 369.73]
  - - [5120, 26624, 1, 1024]
    - [341, 374.85]
  - - [5120, 26880, 1, 1024]
    - [348, 376.57]
  - - [5120, 27648, 1, 1024]
    - [334, 371.57]
  - - [5120, 28160, 1, 1024]
    - [334, 373.38]
  - - [5120, 28672, 1, 1024]
    - [380, 372.01]
  - - [5120, 29184, 1, 1024]
    - [334, 373.17]
  - - [5120, 29440, 1, 1024]
    - [334, 369.03]
  - - [5120, 29696, 1, 1024]
    - [348, 371.71]
  - - [5120, 29952, 1, 1024]
    - [344, 373.16]
  - - [5120, 30464, 1, 1024]
    - [344, 373.38]
  - - [5120, 30720, 1, 1024]
    - [337, 371.92]
  - - [5120, 30976, 1, 1024]
    - [345, 372.25]
  - - [5120, 31744, 1, 1024]
    - [334, 372.77]
  - - [5120, 32000, 1, 1024]
    - [334, 372.09]
  - - [5120, 32256, 1, 1024]
    - [381, 370.01]
  - - [5120, 32768, 1, 1024]
    - [334, 371.61]
  - - [5120, 33280, 1, 1024]
    - [334, 370.3]
  - - [5120, 33792, 1, 1024]
    - [344, 372.27]
  - - [5120, 34048, 1, 1024]
    - [344, 379.67]
  - - [5120, 34560, 1, 1024]
    - [345, 375.41]
  - - [5120, 34816, 1, 1024]
    - [341, 373.77]
  - - [5120, 35328, 1, 1024]
    - [381, 371.91]
  - - [5120, 35840, 1, 1024]
    - [381, 374.93]
  - - [5120, 36608, 1, 1024]
    - [348, 373.15]
  - - [5120, 36864, 1, 1024]
    - [348, 375.37]
  - - [5120, 37120, 1, 1024]
    - [348, 374.03]
  - - [5120, 37632, 1, 1024]
    - [334, 375.14]
  - - [5120, 38400, 1, 1024]
    - [345, 375.63]
  - - [5120, 38912, 1, 1024]
    - [345, 376.92]
  - - [5120, 39168, 1, 1024]
    - [381, 375.57]
  - - [5120, 39424, 1, 1024]
    - [348, 373.62]
  - - [5120, 39680, 1, 1024]
    - [380, 377.44]
  - - [5120, 39936, 1, 1024]
    - [381, 378.06]
  - - [5120, 40960, 1, 1024]
    - [345, 374.81]
  - - [5120, 41216, 1, 1024]
    - [338, 371.97]
  - - [5120, 41472, 1, 1024]
    - [336, 374.47]
  - - [5120, 42240, 1, 1024]
    - [345, 374.71]
  - - [5120, 43008, 1, 1024]
    - [381, 375.94]
  - - [5120, 43264, 1, 1024]
    - [381, 376.09]
  - - [5120, 43520, 1, 1024]
    - [334, 379.86]
  - - [5120, 43776, 1, 1024]
    - [348, 379.17]
  - - [5120, 44544, 1, 1024]
    - [334, 375.68]
  - - [5120, 44800, 1, 1024]
    - [382, 374.09]
  - - [5120, 45056, 1, 1024]
    - [338, 376.66]
  - - [5120, 46080, 1, 1024]
    - [334, 376.91]
  - - [5120, 46592, 1, 1024]
    - [338, 382.19]
  - - [5120, 47104, 1, 1024]
    - [348, 377.29]
  - - [5120, 47616, 1, 1024]
    - [334, 376.22]
  - - [5120, 47872, 1, 1024]
    - [334, 378.59]
  - - [5120, 48384, 1, 1024]
    - [338, 376.24]
  - - [5120, 48640, 1, 1024]
    - [334, 381.44]
  - - [5120, 49152, 1, 1024]
    - [334, 378.99]
  - - [5120, 49920, 1, 1024]
    - [334, 382.92]
  - - [5120, 50176, 1, 1024]
    - [345, 382.99]
  - - [5120, 50688, 1, 1024]
    - [344, 382.72]
  - - [5120, 51200, 1, 1024]
    - [334, 379.65]
  - - [5120, 51968, 1, 1024]
    - [334, 380.68]
  - - [5120, 52224, 1, 1024]
    - [334, 380.11]
  - - [5120, 52992, 1, 1024]
    - [334, 381.98]
  - - [5120, 53248, 1, 1024]
    - [334, 380.68]
  - - [5120, 53504, 1, 1024]
    - [334, 381.08]
  - - [5120, 53760, 1, 1024]
    - [334, 379.24]
  - - [5120, 55296, 1, 1024]
    - [334, 382.28]
  - - [5120, 55552, 1, 1024]
    - [348, 378.03]
  - - [5120, 56320, 1, 1024]
    - [348, 381.7]
  - - [5120, 56576, 1, 1024]
    - [334, 379.19]
  - - [5120, 57344, 1, 1024]
    - [344, 384.23]
  - - [5120, 57600, 1, 1024]
    - [344, 382.38]
  - - [5120, 58368, 1, 1024]
    - [338, 385.42]
  - - [5120, 58880, 1, 1024]
    - [334, 380.38]
  - - [5120, 59136, 1, 1024]
    - [346, 381.3]
  - - [5120, 59392, 1, 1024]
    - [334, 381.09]
  - - [5120, 59904, 1, 1024]
    - [334, 382.24]
  - - [5120, 60928, 1, 1024]
    - [334, 383.89]
  - - [5120, 61440, 1, 1024]
    - [380, 383.25]
  - - [5120, 61952, 1, 1024]
    - [345, 386.89]
  - - [5120, 62208, 1, 1024]
    - [345, 387.67]
  - - [5120, 63232, 1, 1024]
    - [348, 383.95]
  - - [5120, 63488, 1, 1024]
    - [348, 382.57]
  - - [5120, 64000, 1, 1024]
    - [348, 385.07]
  - - [5120, 64512, 1, 1024]
    - [344, 386.1]
  - - [5120, 64768, 1, 1024]
    - [345, 384.54]
  - - [5120, 65280, 1, 1024]
    - [381, 386.0]
  - - [5120, 65536, 1, 1024]
    - [338, 382.98]
  - - [5120, 66560, 1, 1024]
    - [334, 384.05]
  - - [5120, 66816, 1, 1024]
    - [344, 384.14]
  - - [5120, 67584, 1, 1024]
    - [348, 387.7]
  - - [5120, 68096, 1, 1024]
    - [348, 388.36]
  - - [5120, 69120, 1, 1024]
    - [380, 389.66]
  - - [5120, 69632, 1, 1024]
    - [338, 389.28]
  - - [5120, 69888, 1, 1024]
    - [348, 384.86]
  - - [5120, 70400, 1, 1024]
    - [348, 385.68]
  - - [5120, 70656, 1, 1024]
    - [344, 387.19]
  - - [5120, 71424, 1, 1024]
    - [348, 386.76]
  - - [5120, 71680, 1, 1024]
    - [345, 385.28]
  - - [5120, 72960, 1, 1024]
    - [345, 391.66]
  - - [5120, 73216, 1, 1024]
    - [345, 387.85]
  - - [5120, 73728, 1, 1024]
    - [345, 388.26]
  - - [5120, 74240, 1, 1024]
    - [348, 390.28]
  - - [5120, 75264, 1, 1024]
    - [345, 386.51]
  - - [5120, 76032, 1, 1024]
    - [380, 389.17]
  - - [5120, 76544, 1, 1024]
    - [381, 385.85]
  - - [5120, 76800, 1, 1024]
    - [345, 385.87]
  - - [5120, 77824, 1, 1024]
    - [345, 389.73]
  - - [5120, 78848, 1, 1024]
    - [381, 386.15]
  - - [5120, 79360, 1, 1024]
    - [380, 389.33]
  - - [5120, 79872, 1, 1024]
    - [348, 387.45]
  - - [5120, 80640, 1, 1024]
    - [345, 392.71]
  - - [5120, 81664, 1, 1024]
    - [345, 390.76]
  - - [5120, 81920, 1, 1024]
    - [334, 387.04]
  - - [5120, 82432, 1, 1024]
    - [338, 386.46]
  - - [5120, 82944, 1, 1024]
    - [345, 387.71]
  - - [5120, 83200, 1, 1024]
    - [381, 387.67]
  - - [5120, 84480, 1, 1024]
    - [348, 392.88]
  - - [5120, 86016, 1, 1024]
    - [380, 389.41]
  - - [5120, 86528, 1, 1024]
    - [381, 388.39]
  - - [5120, 87296, 1, 1024]
    - [345, 389.63]
  - - [5120, 88320, 1, 1024]
    - [338, 393.99]
  - - [5120, 89088, 1, 1024]
    - [337, 390.13]
  - - [5120, 89600, 1, 1024]
    - [348, 389.04]
  - - [5120, 89856, 1, 1024]
    - [380, 390.25]
  - - [5120, 90112, 1, 1024]
    - [348, 390.71]
  - - [5120, 92160, 1, 1024]
    - [338, 390.01]
  - - [5120, 93184, 1, 1024]
    - [334, 391.25]
  - - [5120, 94208, 1, 1024]
    - [348, 390.29]
  - - [5120, 95232, 1, 1024]
    - [345, 396.44]
  - - [5120, 96000, 1, 1024]
    - [345, 393.53]
  - - [5120, 96512, 1, 1024]
    - [338, 396.25]
  - - [5120, 96768, 1, 1024]
    - [345, 395.11]
  - - [5120, 98304, 1, 1024]
    - [380, 391.64]
  - - [5120, 99840, 1, 1024]
    - [338, 394.67]
  - - [5120, 100352, 1, 1024]
    - [345, 399.31]
  - - [5120, 102400, 1, 1024]
    - [338, 390.4]
  - - [5120, 103168, 1, 1024]
    - [338, 392.11]
  - - [5120, 103680, 1, 1024]
    - [383, 397.41]
  - - [5120, 103936, 1, 1024]
    - [345, 396.96]
  - - [5120, 106496, 1, 1024]
    - [338, 392.17]
  - - [5120, 107520, 1, 1024]
    - [338, 397.31]
  - - [5120, 110592, 1, 1024]
    - [345, 390.85]
  - - [5120, 111104, 1, 1024]
    - [348, 394.41]
  - - [5120, 111360, 1, 1024]
    - [345, 393.7]
  - - [5120, 114688, 1, 1024]
    - [348, 395.79]
  - - [5120, 115200, 1, 1024]
    - [345, 395.55]
  - - [5120, 118784, 1, 1024]
    - [348, 396.62]
  - - [5120, 119040, 1, 1024]
    - [345, 396.5]
  - - [5120, 122880, 1, 1024]
    - [345, 395.84]
  - - [5120, 126976, 1, 1024]
    - [345, 396.37]
  - - [5120, 131072, 1, 1024]
    - [381, 400.17]
  - - [5120, 4352, 1, 8192]
    - [272, 487.13]
  - - [5120, 4608, 1, 8192]
    - [207, 495.68]
  - - [5120, 4864, 1, 8192]
    - [272, 508.95]
  - - [5120, 5120, 1, 8192]
    - [273, 492.87]
  - - [5120, 5376, 1, 8192]
    - [274, 508.0]
  - - [5120, 5632, 1, 8192]
    - [275, 515.91]
  - - [5120, 5888, 1, 8192]
    - [209, 502.14]
  - - [5120, 6144, 1, 8192]
    - [276, 500.39]
  - - [5120, 6400, 1, 8192]
    - [277, 507.61]
  - - [5120, 6656, 1, 8192]
    - [278, 518.76]
  - - [5120, 6912, 1, 8192]
    - [279, 533.09]
  - - [5120, 7168, 1, 8192]
    - [279, 539.68]
  - - [5120, 7424, 1, 8192]
    - [279, 542.71]
  - - [5120, 7680, 1, 8192]
    - [279, 552.16]
  - - [5120, 7936, 1, 8192]
    - [275, 512.75]
  - - [5120, 8192, 1, 8192]
    - [275, 518.64]
  - - [5120, 8448, 1, 8192]
    - [274, 520.29]
  - - [5120, 8704, 1, 8192]
    - [190, 507.24]
  - - [5120, 8960, 1, 8192]
    - [191, 521.64]
  - - [5120, 9216, 1, 8192]
    - [278, 510.62]
  - - [5120, 9728, 1, 8192]
    - [272, 528.59]
  - - [5120, 9984, 1, 8192]
    - [268, 527.08]
  - - [5120, 10240, 1, 8192]
    - [268, 531.3]
  - - [5120, 10752, 1, 8192]
    - [268, 545.25]
  - - [5120, 11264, 1, 8192]
    - [280, 554.93]
  - - [5120, 11520, 1, 8192]
    - [280, 557.48]
  - - [5120, 11776, 1, 8192]
    - [270, 531.56]
  - - [5120, 12288, 1, 8192]
    - [281, 517.37]
  - - [5120, 12544, 1, 8192]
    - [282, 523.51]
  - - [5120, 12800, 1, 8192]
    - [283, 528.33]
  - - [5120, 13056, 1, 8192]
    - [268, 530.55]
  - - [5120, 13312, 1, 8192]
    - [276, 543.16]
  - - [5120, 13824, 1, 8192]
    - [268, 540.9]
  - - [5120, 14080, 1, 8192]
    - [279, 544.62]
  - - [5120, 14336, 1, 8192]
    - [268, 552.73]
  - - [5120, 14592, 1, 8192]
    - [280, 551.63]
  - - [5120, 14848, 1, 8192]
    - [284, 560.67]
  - - [5120, 15360, 1, 8192]
    - [280, 562.82]
  - - [5120, 15872, 1, 8192]
    - [285, 544.02]
  - - [5120, 16128, 1, 8192]
    - [286, 539.43]
  - - [5120, 16384, 1, 8192]
    - [287, 545.14]
  - - [5120, 16640, 1, 8192]
    - [268, 543.79]
  - - [5120, 16896, 1, 8192]
    - [272, 540.27]
  - - [5120, 17408, 1, 8192]
    - [268, 554.41]
  - - [5120, 17664, 1, 8192]
    - [284, 553.27]
  - - [5120, 17920, 1, 8192]
    - [280, 556.67]
  - - [5120, 18432, 1, 8192]
    - [268, 566.65]
  - - [5120, 19200, 1, 8192]
    - [268, 577.84]
  - - [5120, 19456, 1, 8192]
    - [279, 580.15]
  - - [5120, 19712, 1, 8192]
    - [288, 557.49]
  - - [5120, 19968, 1, 8192]
    - [276, 555.01]
  - - [5120, 20480, 1, 8192]
    - [279, 550.1]
  - - [5120, 20736, 1, 8192]
    - [284, 554.19]
  - - [5120, 21504, 1, 8192]
    - [284, 564.35]
  - - [5120, 21760, 1, 8192]
    - [268, 569.14]
  - - [5120, 22272, 1, 8192]
    - [280, 575.17]
  - - [5120, 22528, 1, 8192]
    - [268, 573.42]
  - - [5120, 23040, 1, 8192]
    - [268, 582.56]
  - - [5120, 23296, 1, 8192]
    - [268, 589.55]
  - - [5120, 23552, 1, 8192]
    - [288, 559.2]
  - - [5120, 23808, 1, 8192]
    - [279, 550.84]
  - - [5120, 24320, 1, 8192]
    - [279, 558.46]
  - - [5120, 24576, 1, 8192]
    - [284, 561.69]
  - - [5120, 25088, 1, 8192]
    - [268, 567.02]
  - - [5120, 25344, 1, 8192]
    - [279, 571.63]
  - - [5120, 25600, 1, 8192]
    - [279, 571.43]
  - - [5120, 26112, 1, 8192]
    - [268, 579.14]
  - - [5120, 26624, 1, 8192]
    - [284, 581.98]
  - - [5120, 26880, 1, 8192]
    - [268, 596.62]
  - - [5120, 27648, 1, 8192]
    - [289, 569.92]
  - - [5120, 28160, 1, 8192]
    - [284, 572.57]
  - - [5120, 28672, 1, 8192]
    - [268, 578.46]
  - - [5120, 29184, 1, 8192]
    - [284, 580.63]
  - - [5120, 29440, 1, 8192]
    - [279, 584.69]
  - - [5120, 29696, 1, 8192]
    - [284, 589.06]
  - - [5120, 29952, 1, 8192]
    - [268, 590.58]
  - - [5120, 30464, 1, 8192]
    - [284, 595.11]
  - - [5120, 30720, 1, 8192]
    - [268, 599.38]
  - - [5120, 30976, 1, 8192]
    - [268, 603.34]
  - - [5120, 31744, 1, 8192]
    - [268, 574.98]
  - - [5120, 32000, 1, 8192]
    - [284, 580.35]
  - - [5120, 32256, 1, 8192]
    - [284, 578.45]
  - - [5120, 32768, 1, 8192]
    - [268, 587.73]
  - - [5120, 33280, 1, 8192]
    - [268, 591.37]
  - - [5120, 33792, 1, 8192]
    - [284, 595.45]
  - - [5120, 34048, 1, 8192]
    - [284, 598.32]
  - - [5120, 34560, 1, 8192]
    - [268, 602.63]
  - - [5120, 34816, 1, 8192]
    - [268, 605.28]
  - - [5120, 35328, 1, 8192]
    - [268, 575.16]
  - - [5120, 35840, 1, 8192]
    - [284, 581.67]
  - - [5120, 36608, 1, 8192]
    - [284, 585.08]
  - - [5120, 36864, 1, 8192]
    - [268, 587.93]
  - - [5120, 37120, 1, 8192]
    - [284, 590.6]
  - - [5120, 37632, 1, 8192]
    - [284, 596.3]
  - - [5120, 38400, 1, 8192]
    - [268, 603.3]
  - - [5120, 38912, 1, 8192]
    - [268, 602.18]
  - - [5120, 39168, 1, 8192]
    - [268, 579.06]
  - - [5120, 39424, 1, 8192]
    - [268, 582.19]
  - - [5120, 39680, 1, 8192]
    - [284, 582.36]
  - - [5120, 39936, 1, 8192]
    - [268, 585.55]
  - - [5120, 40960, 1, 8192]
    - [268, 592.03]
  - - [5120, 41216, 1, 8192]
    - [284, 591.55]
  - - [5120, 41472, 1, 8192]
    - [268, 594.35]
  - - [5120, 42240, 1, 8192]
    - [284, 601.05]
  - - [5120, 43008, 1, 8192]
    - [268, 580.22]
  - - [5120, 43264, 1, 8192]
    - [268, 581.53]
  - - [5120, 43520, 1, 8192]
    - [284, 586.04]
  - - [5120, 43776, 1, 8192]
    - [268, 585.74]
  - - [5120, 44544, 1, 8192]
    - [268, 590.05]
  - - [5120, 44800, 1, 8192]
    - [284, 591.68]
  - - [5120, 45056, 1, 8192]
    - [268, 594.69]
  - - [5120, 46080, 1, 8192]
    - [284, 600.57]
  - - [5120, 46592, 1, 8192]
    - [268, 604.34]
  - - [5120, 47104, 1, 8192]
    - [284, 582.43]
  - - [5120, 47616, 1, 8192]
    - [284, 586.19]
  - - [5120, 47872, 1, 8192]
    - [268, 587.3]
  - - [5120, 48384, 1, 8192]
    - [268, 590.43]
  - - [5120, 48640, 1, 8192]
    - [268, 591.18]
  - - [5120, 49152, 1, 8192]
    - [268, 594.65]
  - - [5120, 49920, 1, 8192]
    - [284, 598.91]
  - - [5120, 50176, 1, 8192]
    - [268, 602.45]
  - - [5120, 50688, 1, 8192]
    - [284, 580.92]
  - - [5120, 51200, 1, 8192]
    - [268, 585.12]
  - - [5120, 51968, 1, 8192]
    - [280, 586.71]
  - - [5120, 52224, 1, 8192]
    - [268, 590.8]
  - - [5120, 52992, 1, 8192]
    - [268, 595.34]
  - - [5120, 53248, 1, 8192]
    - [268, 596.67]
  - - [5120, 53504, 1, 8192]
    - [268, 596.19]
  - - [5120, 53760, 1, 8192]
    - [268, 599.02]
  - - [5120, 55296, 1, 8192]
    - [284, 584.99]
  - - [5120, 55552, 1, 8192]
    - [284, 586.17]
  - - [5120, 56320, 1, 8192]
    - [268, 589.58]
  - - [5120, 56576, 1, 8192]
    - [284, 591.17]
  - - [5120, 57344, 1, 8192]
    - [268, 596.6]
  - - [5120, 57600, 1, 8192]
    - [268, 598.21]
  - - [5120, 58368, 1, 8192]
    - [268, 606.1]
  - - [5120, 58880, 1, 8192]
    - [268, 582.57]
  - - [5120, 59136, 1, 8192]
    - [268, 587.78]
  - - [5120, 59392, 1, 8192]
    - [284, 583.36]
  - - [5120, 59904, 1, 8192]
    - [268, 590.12]
  - - [5120, 60928, 1, 8192]
    - [280, 594.6]
  - - [5120, 61440, 1, 8192]
    - [268, 599.67]
  - - [5120, 61952, 1, 8192]
    - [268, 601.48]
  - - [5120, 62208, 1, 8192]
    - [284, 602.36]
  - - [5120, 63232, 1, 8192]
    - [268, 586.49]
  - - [5120, 63488, 1, 8192]
    - [268, 588.18]
  - - [5120, 64000, 1, 8192]
    - [284, 592.29]
  - - [5120, 64512, 1, 8192]
    - [284, 591.93]
  - - [5120, 64768, 1, 8192]
    - [268, 596.05]
  - - [5120, 65280, 1, 8192]
    - [268, 597.44]
  - - [5120, 65536, 1, 8192]
    - [268, 600.0]
  - - [5120, 66560, 1, 8192]
    - [268, 579.58]
  - - [5120, 66816, 1, 8192]
    - [280, 582.78]
  - - [5120, 67584, 1, 8192]
    - [284, 588.3]
  - - [5120, 68096, 1, 8192]
    - [268, 590.33]
  - - [5120, 69120, 1, 8192]
    - [284, 596.43]
  - - [5120, 69632, 1, 8192]
    - [284, 601.43]
  - - [5120, 69888, 1, 8192]
    - [284, 603.23]
  - - [5120, 70400, 1, 8192]
    - [280, 580.07]
  - - [5120, 70656, 1, 8192]
    - [268, 582.67]
  - - [5120, 71424, 1, 8192]
    - [268, 590.6]
  - - [5120, 71680, 1, 8192]
    - [284, 590.82]
  - - [5120, 72960, 1, 8192]
    - [268, 595.92]
  - - [5120, 73216, 1, 8192]
    - [268, 598.8]
  - - [5120, 73728, 1, 8192]
    - [284, 599.61]
  - - [5120, 74240, 1, 8192]
    - [284, 579.49]
  - - [5120, 75264, 1, 8192]
    - [279, 587.51]
  - - [5120, 76032, 1, 8192]
    - [284, 592.6]
  - - [5120, 76544, 1, 8192]
    - [268, 593.99]
  - - [5120, 76800, 1, 8192]
    - [268, 597.1]
  - - [5120, 77824, 1, 8192]
    - [268, 602.7]
  - - [5120, 78848, 1, 8192]
    - [268, 585.35]
  - - [5120, 79360, 1, 8192]
    - [284, 592.1]
  - - [5120, 79872, 1, 8192]
    - [268, 592.1]
  - - [5120, 80640, 1, 8192]
    - [284, 598.95]
  - - [5120, 81664, 1, 8192]
    - [284, 602.02]
  - - [5120, 81920, 1, 8192]
    - [268, 577.8]
  - - [5120, 82432, 1, 8192]
    - [280, 583.13]
  - - [5120, 82944, 1, 8192]
    - [284, 584.29]
  - - [5120, 83200, 1, 8192]
    - [268, 590.09]
  - - [5120, 84480, 1, 8192]
    - [268, 596.3]
  - - [5120, 86016, 1, 8192]
    - [268, 581.38]
  - - [5120, 86528, 1, 8192]
    - [279, 583.36]
  - - [5120, 87296, 1, 8192]
    - [284, 589.48]
  - - [5120, 88320, 1, 8192]
    - [268, 596.13]
  - - [5120, 89088, 1, 8192]
    - [268, 601.39]
  - - [5120, 89600, 1, 8192]
    - [268, 579.8]
  - - [5120, 89856, 1, 8192]
    - [279, 582.73]
  - - [5120, 90112, 1, 8192]
    - [268, 583.08]
  - - [5120, 92160, 1, 8192]
    - [268, 595.83]
  - - [5120, 93184, 1, 8192]
    - [284, 601.04]
  - - [5120, 94208, 1, 8192]
    - [268, 589.25]
  - - [5120, 95232, 1, 8192]
    - [268, 589.26]
  - - [5120, 96000, 1, 8192]
    - [268, 595.32]
  - - [5120, 96512, 1, 8192]
    - [268, 597.42]
  - - [5120, 96768, 1, 8192]
    - [268, 599.55]
  - - [5120, 98304, 1, 8192]
    - [268, 586.79]
  - - [5120, 99840, 1, 8192]
    - [268, 596.5]
  - - [5120, 100352, 1, 8192]
    - [268, 598.71]
  - - [5120, 102400, 1, 8192]
    - [284, 589.88]
  - - [5120, 103168, 1, 8192]
    - [284, 592.52]
  - - [5120, 103680, 1, 8192]
    - [268, 594.75]
  - - [5120, 103936, 1, 8192]
    - [268, 598.11]
  - - [5120, 106496, 1, 8192]
    - [284, 588.45]
  - - [5120, 107520, 1, 8192]
    - [268, 596.85]
  - - [5120, 110592, 1, 8192]
    - [268, 593.1]
  - - [5120, 111104, 1, 8192]
    - [268, 595.82]
  - - [5120, 111360, 1, 8192]
    - [268, 596.96]
  - - [5120, 114688, 1, 8192]
    - [284, 595.37]
  - - [5120, 115200, 1, 8192]
    - [268, 597.8]
  - - [5120, 118784, 1, 8192]
    - [284, 593.02]
  - - [5120, 119040, 1, 8192]
    - [268, 595.68]
  - - [5120, 122880, 1, 8192]
    - [268, 594.54]
  - - [5120, 126976, 1, 8192]
    - [268, 595.56]
  - - [5120, 131072, 1, 8192]
    - [268, 596.63]
- null
- null
- DeviceEfficiency
- GridBased
