projects/hipblaslt/library/src/amd_detail/rocblaslt/src/Tensile/Logic/asm_full/aquavanjaram/gfx942/GridBased/aquavanjaram_Cijk_Alik_Bljk_F8NBS_STA_BH_Bias_HAS_SAB_SAV_UserArgs.yaml
- {MinimumRequiredVersion: 4.33.0}
- aquavanjaram
- gfx942
- [Device 0049, Device 0050]
    SolutionIndex: 0
    SolutionNameMin: Cijk_Alik_Bljk_F8NBS_STA_BH_BiasSB_HAS_SAB_SAV_UserArgs_MT64x32x512_MI16x16x1_SN_LDSB1_GRVWB16_GSU1_GSUAMB_GSUC1_GSUWGMRR1_K1_LBSPPB1024_MIWT2_2_NTA0_NLCA8_SU0_SUM0_SUS0_VWB2_WG32_4_1_WGM1_WGMXCC8_WGMXCCGn1
    SolutionIndex: 1
    SolutionNameMin: Cijk_Alik_Bljk_F8NBS_STA_BH_BiasSB_HAS_SAB_SAV_UserArgs_MT64x32x512_MI16x16x1_SN_LDSB1_GRVWB16_GSU1_GSUC0_GSUWGMRR0_K1_LBSPPB1024_MIWT1_2_NLCA8_SU8_SUM0_SUS512_VWB2_WG64_4_1_WGM6_WGMXCC8_WGMXCCGn1
    SolutionIndex: 2
    SolutionNameMin: Cijk_Alik_Bljk_F8NBS_STA_BH_BiasSB_HAS_SAB_SAV_UserArgs_MT64x32x512_MI16x16x1_SN_LDSB1_GRVWB16_GSU1_GSUC0_GSUWGMRR0_K1_LBSPPB1024_MIWT1_2_NLCA8_SU8_SUM0_SUS512_VWB2_WG64_4_1_WGM8_WGMXCC8_WGMXCCGn1
    SolutionIndex: 3
    SolutionNameMin: Cijk_Alik_Bljk_F8NBS_STA_BH_BiasSB_HAS_SAB_SAV_UserArgs_MT128x32x512_MI16x16x1_SN_LDSB1_GRVWB16_GSU1_GSUC0_GSUWGMRR0_K1_LBSPPB1024_MIWT2_2_NLCA8_SU8_SUM0_SUS512_VWB2_WG64_4_1_WGM6_WGMXCC8_WGMXCCGn1
    SolutionIndex: 4
    SolutionNameMin: Cijk_Alik_Bljk_F8NBS_STA_BH_BiasSB_HAS_SAB_SAV_UserArgs_MT128x32x512_MI16x16x1_SN_LDSB1_GRVWB16_GSU1_GSUC0_GSUWGMRR0_K1_LBSPPB1024_MIWT2_2_NLCA8_SU8_SUM0_SUS512_VWB2_WG64_4_1_WGM8_WGMXCC8_WGMXCCGn1
    SolutionIndex: 5
    SolutionNameMin: Cijk_Alik_Bljk_F8NBS_STA_BH_BiasSB_HAS_SAB_SAV_UserArgs_MT128x32x512_MI16x16x1_SN_LDSB1_GRVWB16_GSU1_GSUC0_GSUWGMRR0_K1_LBSPPB1024_MIWT2_2_NLCA8_SU0_SUM0_SUS0_VWB2_WG64_4_1_WGM6_WGMXCC8_WGMXCCGn1
    SolutionIndex: 6
    SolutionNameMin: Cijk_Alik_Bljk_F8NBS_STA_BH_BiasSB_HAS_SAB_SAV_UserArgs_MT128x32x512_MI16x16x1_SN_LDSB1_GRVWB16_GSU1_GSUC0_GSUWGMRR0_K1_LBSPPB1024_MIWT2_2_NLCA8_SU0_SUM0_SUS0_VWB2_WG64_4_1_WGM8_WGMXCC8_WGMXCCGn1
    SolutionIndex: 7
    SolutionNameMin: Cijk_Alik_Bljk_F8NBS_STA_BH_BiasSB_HAS_SAB_SAV_UserArgs_MT64x48x512_MI16x16x1_SN_LDSB1_GRVWB16_GSU1_GSUC0_GSUWGMRR0_K1_LBSPPB512_MIWT1_3_NLCA8_SU8_SUM0_SUS512_VWB1_WG64_4_1_WGM6_WGMXCC8_WGMXCCGn1
    SolutionIndex: 8
    SolutionNameMin: Cijk_Alik_Bljk_F8NBS_STA_BH_BiasSB_HAS_SAB_SAV_UserArgs_MT128x64x256_MI16x16x1_SN_LDSB1_GRVWB16_GSU1_GSUC0_GSUWGMRR0_K1_LBSPPB1024_MIWT2_4_NLCA4_SU0_SUM0_SUS0_VWB4_WG64_4_1_WGM8_WGMXCC8_WGMXCCGn1
    SolutionIndex: 9
    SolutionNameMin: Cijk_Alik_Bljk_F8NBS_STA_BH_BiasSB_HAS_SAB_SAV_UserArgs_MT128x48x256_MI16x16x1_SN_LDSB0_GRVWB16_GSU1_GSUC0_GSUWGMRR0_K1_LBSPPB256_MIWT2_3_NLCA4_SU0_SUM0_SUS0_VWB1_WG64_4_1_WGM6_WGMXCC8_WGMXCCGn1
    SolutionIndex: 10
    SolutionNameMin: Cijk_Alik_Bljk_F8NBS_STA_BH_BiasSB_HAS_SAB_SAV_UserArgs_MT128x48x256_MI16x16x1_SN_LDSB0_GRVWB16_GSU1_GSUC0_GSUWGMRR0_K1_LBSPPB256_MIWT2_3_NLCA4_SU0_SUM0_SUS0_VWB1_WG64_4_1_WGM8_WGMXCC8_WGMXCCGn1
    SolutionIndex: 11
    SolutionNameMin: Cijk_Alik_Bljk_F8NBS_STA_BH_BiasSB_HAS_SAB_SAV_UserArgs_MT128x48x256_MI16x16x1_SN_LDSB0_GRVWB16_GSU1_GSUC0_GSUWGMRR0_K1_LBSPPB256_MIWT2_3_NLCA4_SU8_SUM0_SUS256_VWB1_WG64_4_1_WGM6_WGMXCC8_WGMXCCGn1
    SolutionIndex: 12
    SolutionNameMin: Cijk_Alik_Bljk_F8NBS_STA_BH_BiasSB_HAS_SAB_SAV_UserArgs_MT128x64x256_MI16x16x1_SN_LDSB1_GRVWB16_GSU1_GSUC0_GSUWGMRR0_K1_LBSPPB1024_MIWT2_4_NLCA4_SU0_SUM0_SUS0_VWB4_WG64_4_1_WGM6_WGMXCC8_WGMXCCGn1
    SolutionIndex: 13
    SolutionNameMin: Cijk_Alik_Bljk_F8NBS_STA_BH_BiasSB_HAS_SAB_SAV_UserArgs_MT128x64x256_MI16x16x1_SN_LDSB1_GRVWB16_GSU1_GSUC0_GSUWGMRR0_K1_LBSPPB1024_MIWT2_4_NLCA4_SU8_SUM0_SUS256_VWB4_WG64_4_1_WGM8_WGMXCC8_WGMXCCGn1
    SolutionIndex: 14
    SolutionNameMin: Cijk_Alik_Bljk_F8NBS_STA_BH_BiasSB_HAS_SAB_SAV_UserArgs_MT128x80x256_MI16x16x1_SN_LDSB1_GRVWB16_GSU1_GSUC0_GSUWGMRR0_K1_LBSPPB256_MIWT2_5_NLCA4_SU8_SUM0_SUS256_VWB1_WG64_4_1_WGM8_WGMXCC8_WGMXCCGn1
    SolutionIndex: 15
    SolutionNameMin: Cijk_Alik_Bljk_F8NBS_STA_BH_BiasSB_HAS_SAB_SAV_UserArgs_MT128x96x256_MI16x16x1_SN_LDSB1_GRVWB16_GSU1_GSUC0_GSUWGMRR0_K1_LBSPPB512_MIWT2_6_NLCA4_SU0_SUM0_SUS0_VWB2_WG64_4_1_WGM8_WGMXCC8_WGMXCCGn1
    SolutionIndex: 16
    SolutionNameMin: Cijk_Alik_Bljk_F8NBS_STA_BH_BiasSB_HAS_SAB_SAV_UserArgs_MT128x96x256_MI16x16x1_SN_LDSB1_GRVWB16_GSU1_GSUC0_GSUWGMRR0_K1_LBSPPB512_MIWT2_6_NLCA4_SU0_SUM0_SUS0_VWB2_WG64_4_1_WGM6_WGMXCC8_WGMXCCGn1
    SolutionIndex: 17
    SolutionNameMin: Cijk_Alik_Bljk_F8NBS_STA_BH_BiasSB_HAS_SAB_SAV_UserArgs_MT256x64x256_MI16x16x1_SN_LDSB1_GRVWB16_GSU1_GSUC0_GSUWGMRR0_K1_LBSPPB1024_MIWT4_4_NLCA4_SU0_SUM0_SUS0_VWB4_WG64_4_1_WGM8_WGMXCC8_WGMXCCGn1
    SolutionIndex: 18
    SolutionNameMin: Cijk_Alik_Bljk_F8NBS_STA_BH_BiasSB_HAS_SAB_SAV_UserArgs_MT256x64x256_MI16x16x1_SN_LDSB1_GRVWB16_GSU1_GSUC0_GSUWGMRR0_K1_LBSPPB1024_MIWT4_4_NLCA4_SU0_SUM0_SUS0_VWB4_WG64_4_1_WGM6_WGMXCC8_WGMXCCGn1
    SolutionIndex: 19
    SolutionNameMin: Cijk_Alik_Bljk_F8NBS_STA_BH_BiasSB_HAS_SAB_SAV_UserArgs_MT256x64x128_MI16x16x1_SN_LDSB0_GRVWB16_GSU1_GSUC0_GSUWGMRR0_K1_LBSPPB512_MIWT4_4_NLCA2_SU0_SUM0_SUS0_VWB4_WG64_4_1_WGM8_WGMXCC8_WGMXCCGn1
    SolutionIndex: 20
    SolutionNameMin: Cijk_Alik_Bljk_F8NBS_STA_BH_BiasSB_HAS_SAB_SAV_UserArgs_MT192x96x128_MI16x16x1_SN_LDSB0_GRVWB16_GSU1_GSUC0_GSUWGMRR0_K1_LBSPPB256_MIWT3_6_NLCA2_SU0_SUM0_SUS0_VWB2_WG64_4_1_WGM8_WGMXCC8_WGMXCCGn1
    SolutionIndex: 21
    SolutionNameMin: Cijk_Alik_Bljk_F8NBS_STA_BH_BiasSB_HAS_SAB_SAV_UserArgs_MT256x96x128_MI16x16x1_SN_LDSB0_GRVWB16_GSU1_GSUC0_GSUWGMRR0_K1_LBSPPB256_MIWT4_6_NLCA2_SU0_SUM0_SUS0_VWB2_WG64_4_1_WGM6_WGMXCC8_WGMXCCGn1
    SolutionIndex: 22
    SolutionNameMin: Cijk_Alik_Bljk_F8NBS_STA_BH_BiasSB_HAS_SAB_SAV_UserArgs_MT128x160x128_MI16x16x1_SN_LDSB1_GRVWB16_GSU1_GSUC0_GSUWGMRR0_K1_LBSPPB256_MIWT2_10_NLCA2_SU8_SUM0_SUS128_VWB2_WG64_4_1_WGM1_WGMXCC8_WGMXCCGn1
    SolutionIndex: 23
    SolutionNameMin: Cijk_Alik_Bljk_F8NBS_STA_BH_BiasSB_HAS_SAB_SAV_UserArgs_MT128x160x128_MI16x16x1_SN_LDSB1_GRVWB16_GSU1_GSUC0_GSUWGMRR0_K1_LBSPPB256_MIWT2_10_NLCA2_SU0_SUM0_SUS0_VWB2_WG64_4_1_WGM6_WGMXCC8_WGMXCCGn1
    SolutionIndex: 24
    SolutionNameMin: Cijk_Alik_Bljk_F8NBS_STA_BH_BiasSB_HAS_SAB_SAV_UserArgs_MT256x96x128_MI16x16x1_SN_LDSB0_GRVWB16_GSU1_GSUC0_GSUWGMRR0_K1_LBSPPB256_MIWT4_6_NLCA2_SU0_SUM0_SUS0_VWB2_WG64_4_1_WGM8_WGMXCC8_WGMXCCGn1
    SolutionIndex: 25
    SolutionNameMin: Cijk_Alik_Bljk_F8NBS_STA_BH_BiasSB_HAS_SAB_SAV_UserArgs_MT256x96x128_MI16x16x1_SN_LDSB0_GRVWB16_GSU1_GSUC0_GSUWGMRR0_K1_LBSPPB256_MIWT4_6_NLCA2_SU0_SUM0_SUS0_VWB2_WG64_4_1_WGM1_WGMXCC8_WGMXCCGn1
    SolutionIndex: 26
    SolutionNameMin: Cijk_Alik_Bljk_F8NBS_STA_BH_BiasSB_HAS_SAB_SAV_UserArgs_MT256x128x128_MI16x16x1_SN_LDSB1_GRVWB16_GSU1_GSUC0_GSUWGMRR0_K1_LBSPPB1024_MIWT4_8_NLCA2_SU0_SUM0_SUS0_VWB8_WG64_4_1_WGM6_WGMXCC8_WGMXCCGn1
    SolutionIndex: 27
    SolutionNameMin: Cijk_Alik_Bljk_F8NBS_STA_BH_BiasSB_HAS_SAB_SAV_UserArgs_MT192x160x128_MI16x16x1_SN_LDSB1_GRVWB16_GSU1_GSUC0_GSUWGMRR0_K1_LBSPPB256_MIWT3_10_NLCA2_SU0_SUM0_SUS0_VWB2_WG64_4_1_WGM6_WGMXCC8_WGMXCCGn1
    SolutionIndex: 28
    SolutionNameMin: Cijk_Alik_Bljk_F8NBS_STA_BH_BiasSB_HAS_SAB_SAV_UserArgs_MT512x64x128_MI16x16x1_SN_LDSB0_GRVWB16_GSU1_GSUC0_GSUWGMRR0_K1_LBSPPB512_MIWT8_4_NLCA2_SU0_SUM0_SUS0_VWB4_WG64_4_1_WGM1_WGMXCC8_WGMXCCGn1
    SolutionIndex: 29
    SolutionNameMin: Cijk_Alik_Bljk_F8NBS_STA_BH_BiasSB_HAS_SAB_SAV_UserArgs_MT256x128x128_MI16x16x1_SN_LDSB1_GRVWB16_GSU1_GSUC0_GSUWGMRR0_K1_LBSPPB1024_MIWT4_8_NLCA2_SU0_SUM0_SUS0_VWB8_WG64_4_1_WGM8_WGMXCC8_WGMXCCGn1
    SolutionIndex: 30
    SolutionNameMin: Cijk_Alik_Bljk_F8NBS_STA_BH_BiasSB_HAS_SAB_SAV_UserArgs_MT128x64x256_MI16x16x1_SN_LDSB1_GRVWB16_GSU1_GSUC0_GSUWGMRR0_K1_LBSPPB1024_MIWT2_4_NLCA4_SU8_SUM0_SUS256_VWB4_WG64_4_1_WGM6_WGMXCC8_WGMXCCGn1
    SolutionIndex: 31
    SolutionNameMin: Cijk_Alik_Bljk_F8NBS_STA_BH_BiasSB_HAS_SAB_SAV_UserArgs_MT128x48x256_MI16x16x1_SN_LDSB0_GRVWB16_GSU1_GSUC0_GSUWGMRR0_K1_LBSPPB256_MIWT2_3_NLCA4_SU8_SUM0_SUS256_VWB1_WG64_4_1_WGM8_WGMXCC8_WGMXCCGn1
    SolutionIndex: 32
    SolutionNameMin: Cijk_Alik_Bljk_F8NBS_STA_BH_BiasSB_HAS_SAB_SAV_UserArgs_MT128x80x256_MI16x16x1_SN_LDSB1_GRVWB16_GSU1_GSUC0_GSUWGMRR0_K1_LBSPPB256_MIWT2_5_NLCA4_SU0_SUM0_SUS0_VWB1_WG64_4_1_WGM8_WGMXCC8_WGMXCCGn1
    SolutionIndex: 33
    SolutionNameMin: Cijk_Alik_Bljk_F8NBS_STA_BH_BiasSB_HAS_SAB_SAV_UserArgs_MT128x80x256_MI16x16x1_SN_LDSB1_GRVWB16_GSU1_GSUC0_GSUWGMRR0_K1_LBSPPB256_MIWT2_5_NLCA4_SU0_SUM0_SUS0_VWB1_WG64_4_1_WGM6_WGMXCC8_WGMXCCGn1
    SolutionIndex: 34
    SolutionNameMin: Cijk_Alik_Bljk_F8NBS_STA_BH_BiasSB_HAS_SAB_SAV_UserArgs_MT128x96x256_MI16x16x1_SN_LDSB1_GRVWB16_GSU1_GSUC0_GSUWGMRR0_K1_LBSPPB512_MIWT2_6_NLCA4_SU8_SUM0_SUS256_VWB2_WG64_4_1_WGM8_WGMXCC8_WGMXCCGn1
    SolutionIndex: 35
    SolutionNameMin: Cijk_Alik_Bljk_F8NBS_STA_BH_BiasSB_HAS_SAB_SAV_UserArgs_MT128x112x256_MI16x16x1_SN_LDSB1_GRVWB16_GSU1_GSUC0_GSUWGMRR0_K1_LBSPPB256_MIWT2_7_NLCA4_SU8_SUM0_SUS256_VWB1_WG64_4_1_WGM6_WGMXCC8_WGMXCCGn1
    SolutionIndex: 36
    SolutionNameMin: Cijk_Alik_Bljk_F8NBS_STA_BH_BiasSB_HAS_SAB_SAV_UserArgs_MT128x112x256_MI16x16x1_SN_LDSB1_GRVWB16_GSU1_GSUC0_GSUWGMRR0_K1_LBSPPB256_MIWT2_7_NLCA4_SU0_SUM0_SUS0_VWB1_WG64_4_1_WGM6_WGMXCC8_WGMXCCGn1
    SolutionIndex: 37
    SolutionNameMin: Cijk_Alik_Bljk_F8NBS_STA_BH_BiasSB_HAS_SAB_SAV_UserArgs_MT256x80x256_MI16x16x1_SN_LDSB1_GRVWB16_GSU1_GSUC0_GSUWGMRR0_K1_LBSPPB256_MIWT4_5_NLCA4_SU0_SUM0_SUS0_VWB1_WG64_4_1_WGM6_WGMXCC8_WGMXCCGn1
    SolutionIndex: 38
    SolutionNameMin: Cijk_Alik_Bljk_F8NBS_STA_BH_BiasSB_HAS_SAB_SAV_UserArgs_MT320x64x128_MI16x16x1_SN_LDSB0_GRVWB16_GSU1_GSUC0_GSUWGMRR0_K1_LBSPPB512_MIWT5_4_NLCA2_SU8_SUM0_SUS128_VWB4_WG64_4_1_WGM8_WGMXCC8_WGMXCCGn1
    SolutionIndex: 39
    SolutionNameMin: Cijk_Alik_Bljk_F8NBS_STA_BH_BiasSB_HAS_SAB_SAV_UserArgs_MT320x96x128_MI16x16x1_SN_LDSB0_GRVWB16_GSU1_GSUC0_GSUWGMRR0_K1_LBSPPB256_MIWT5_6_NLCA2_SU0_SUM0_SUS0_VWB2_WG64_4_1_WGM8_WGMXCC8_WGMXCCGn1
    SolutionIndex: 40
    SolutionNameMin: Cijk_Alik_Bljk_F8NBS_STA_BH_BiasSB_HAS_SAB_SAV_UserArgs_MT192x160x128_MI16x16x1_SN_LDSB1_GRVWB16_GSU1_GSUC0_GSUWGMRR0_K1_LBSPPB256_MIWT3_10_NLCA2_SU8_SUM0_SUS128_VWB2_WG64_4_1_WGM6_WGMXCC8_WGMXCCGn1
    SolutionIndex: 41
    SolutionNameMin: Cijk_Alik_Bljk_F8NBS_STA_BH_BiasSB_HAS_SAB_SAV_UserArgs_MT256x160x128_MI16x16x1_SN_LDSB0_GRVWB16_GSU1_GSUC0_GSUWGMRR0_K1_LBSPPB256_MIWT4_10_NLCA2_SU0_SUM0_SUS0_VWB2_WG64_4_1_WGM8_WGMXCC8_WGMXCCGn1
    SolutionIndex: 42
    SolutionNameMin: Cijk_Alik_Bljk_F8NBS_STA_BH_BiasSB_HAS_SAB_SAV_UserArgs_MT256x160x128_MI16x16x1_SN_LDSB0_GRVWB16_GSU1_GSUC0_GSUWGMRR0_K1_LBSPPB256_MIWT4_10_NLCA2_SU0_SUM0_SUS0_VWB2_WG64_4_1_WGM6_WGMXCC8_WGMXCCGn1
    SolutionIndex: 43
    SolutionNameMin: Cijk_Alik_Bljk_F8NBS_STA_BH_BiasSB_HAS_SAB_SAV_UserArgs_MT256x192x128_MI16x16x1_SN_LDSB0_GRVWB16_GSU1_GSUC0_GSUWGMRR0_K1_LBSPPB512_MIWT4_12_NLCA2_SU0_SUM0_SUS0_VWB4_WG64_4_1_WGM1_WGMXCC8_WGMXCCGn1
    SolutionIndex: 44
    SolutionNameMin: Cijk_Alik_Bljk_F8NBS_STA_BH_BiasSB_HAS_SAB_SAV_UserArgs_MT256x192x128_MI16x16x1_SN_LDSB0_GRVWB16_GSU1_GSUC0_GSUWGMRR0_K1_LBSPPB512_MIWT4_12_NLCA2_SU0_SUM0_SUS0_VWB4_WG64_4_1_WGM6_WGMXCC8_WGMXCCGn1
    SolutionIndex: 45
    SolutionNameMin: Cijk_Alik_Bljk_F8NBS_STA_BH_BiasSB_HAS_SAB_SAV_UserArgs_MT256x192x128_MI16x16x1_SN_LDSB0_GRVWB16_GSU1_GSUC0_GSUWGMRR0_K1_LBSPPB512_MIWT4_12_NLCA2_SU0_SUM0_SUS0_VWB4_WG64_4_1_WGM8_WGMXCC8_WGMXCCGn1
    SolutionIndex: 46
    SolutionNameMin: Cijk_Alik_Bljk_F8NBS_STA_BH_BiasSB_HAS_SAB_SAV_UserArgs_MT256x224x128_MI16x16x1_SN_LDSB0_GRVWB16_GSU1_GSUC0_GSUWGMRR0_K1_LBSPPB256_MIWT4_14_NLCA2_SU0_SUM0_SUS0_VWB2_WG64_4_1_WGM1_WGMXCC8_WGMXCCGn1
    SolutionIndex: 47
    SolutionNameMin: Cijk_Alik_Bljk_F8NBS_STA_BH_BiasSB_HAS_SAB_SAV_UserArgs_MT384x160x128_MI16x16x1_SN_LDSB0_GRVWB16_GSU1_GSUC0_GSUWGMRR0_K1_LBSPPB256_MIWT6_10_NLCA2_SU0_SUM0_SUS0_VWB2_WG64_4_1_WGM6_WGMXCC8_WGMXCCGn1
    SolutionIndex: 48
    SolutionNameMin: Cijk_Alik_Bljk_F8NBS_STA_BH_BiasSB_HAS_SAB_SAV_UserArgs_MT256x224x128_MI16x16x1_SN_LDSB0_GRVWB16_GSU1_GSUC0_GSUWGMRR0_K1_LBSPPB256_MIWT4_14_NLCA2_SU0_SUM0_SUS0_VWB2_WG64_4_1_WGM6_WGMXCC8_WGMXCCGn1
    SolutionIndex: 49
    SolutionNameMin: Cijk_Alik_Bljk_F8NBS_STA_BH_BiasSB_HAS_SAB_SAV_UserArgs_MT192x80x256_MI16x16x1_SN_LDSB1_GRVWB16_GSU1_GSUC0_GSUWGMRR0_K1_LBSPPB256_MIWT3_5_NLCA4_SU0_SUM0_SUS0_VWB1_WG64_4_1_WGM6_WGMXCC8_WGMXCCGn1
    SolutionIndex: 50
    SolutionNameMin: Cijk_Alik_Bljk_F8NBS_STA_BH_BiasSB_HAS_SAB_SAV_UserArgs_MT320x64x128_MI16x16x1_SN_LDSB0_GRVWB16_GSU1_GSUC0_GSUWGMRR0_K1_LBSPPB512_MIWT5_4_NLCA2_SU0_SUM0_SUS0_VWB4_WG64_4_1_WGM6_WGMXCC8_WGMXCCGn1
    SolutionIndex: 51
    SolutionNameMin: Cijk_Alik_Bljk_F8NBS_STA_BH_BiasSB_HAS_SAB_SAV_UserArgs_MT320x80x128_MI16x16x1_SN_LDSB0_GRVWB8_GSU1_GSUC0_GSUWGMRR0_K1_LBSPPB128_MIWT5_5_NLCA2_SU0_SUM0_SUS0_VWB1_WG64_4_1_WGM6_WGMXCC8_WGMXCCGn1
    SolutionIndex: 52
    SolutionNameMin: Cijk_Alik_Bljk_F8NBS_STA_BH_BiasSB_HAS_SAB_SAV_UserArgs_MT384x64x128_MI16x16x1_SN_LDSB0_GRVWB16_GSU1_GSUC0_GSUWGMRR0_K1_LBSPPB512_MIWT6_4_NLCA2_SU0_SUM0_SUS0_VWB4_WG64_4_1_WGM8_WGMXCC8_WGMXCCGn1
    SolutionIndex: 53
    SolutionNameMin: Cijk_Alik_Bljk_F8NBS_STA_BH_BiasSB_HAS_SAB_SAV_UserArgs_MT320x96x128_MI16x16x1_SN_LDSB0_GRVWB16_GSU1_GSUC0_GSUWGMRR0_K1_LBSPPB256_MIWT5_6_NLCA2_SU0_SUM0_SUS0_VWB2_WG64_4_1_WGM6_WGMXCC8_WGMXCCGn1
    SolutionIndex: 54
    SolutionNameMin: Cijk_Alik_Bljk_F8NBS_STA_BH_BiasSB_HAS_SAB_SAV_UserArgs_MT320x96x128_MI16x16x1_SN_LDSB0_GRVWB16_GSU1_GSUC0_GSUWGMRR0_K1_LBSPPB256_MIWT5_6_NLCA2_SU8_SUM0_SUS128_VWB2_WG64_4_1_WGM8_WGMXCC8_WGMXCCGn1
    SolutionIndex: 55
    SolutionNameMin: Cijk_Alik_Bljk_F8NBS_STA_BH_BiasSB_HAS_SAB_SAV_UserArgs_MT448x64x128_MI16x16x1_SN_LDSB0_GRVWB16_GSU1_GSUC0_GSUWGMRR0_K1_LBSPPB512_MIWT7_4_NLCA2_SU0_SUM0_SUS0_VWB4_WG64_4_1_WGM8_WGMXCC8_WGMXCCGn1
    SolutionIndex: 56
    SolutionNameMin: Cijk_Alik_Bljk_F8NBS_STA_BH_BiasSB_HAS_SAB_SAV_UserArgs_MT192x192x128_MI16x16x1_SN_LDSB0_GRVWB16_GSU1_GSUC0_GSUWGMRR0_K1_LBSPPB512_MIWT3_12_NLCA2_SU0_SUM0_SUS0_VWB4_WG64_4_1_WGM6_WGMXCC8_WGMXCCGn1
    SolutionIndex: 57
    SolutionNameMin: Cijk_Alik_Bljk_F8NBS_STA_BH_BiasSB_HAS_SAB_SAV_UserArgs_MT512x64x128_MI16x16x1_SN_LDSB0_GRVWB16_GSU1_GSUC0_GSUWGMRR0_K1_LBSPPB512_MIWT8_4_NLCA2_SU0_SUM0_SUS0_VWB4_WG64_4_1_WGM6_WGMXCC8_WGMXCCGn1
    SolutionIndex: 58
    SolutionNameMin: Cijk_Alik_Bljk_F8NBS_STA_BH_BiasSB_HAS_SAB_SAV_UserArgs_MT256x160x128_MI16x16x1_SN_LDSB0_GRVWB16_GSU1_GSUC0_GSUWGMRR0_K1_LBSPPB256_MIWT4_10_NLCA2_SU8_SUM0_SUS128_VWB2_WG64_4_1_WGM6_WGMXCC8_WGMXCCGn1
    SolutionIndex: 59
    SolutionNameMin: Cijk_Alik_Bljk_F8NBS_STA_BH_BiasSB_HAS_SAB_SAV_UserArgs_MT192x96x128_MI16x16x1_SN_LDSB0_GRVWB16_GSU1_GSUC0_GSUWGMRR0_K1_LBSPPB256_MIWT3_6_NLCA2_SU0_SUM0_SUS0_VWB2_WG64_4_1_WGM6_WGMXCC8_WGMXCCGn1
    SolutionIndex: 60
    SolutionNameMin: Cijk_Alik_Bljk_F8NBS_STA_BH_BiasSB_HAS_SAB_SAV_UserArgs_MT256x176x128_MI16x16x1_SN_LDSB0_GRVWB8_GSU1_GSUC0_GSUWGMRR0_K1_LBSPPB128_MIWT4_11_NLCA2_SU8_SUM0_SUS128_VWB1_WG64_4_1_WGM8_WGMXCC8_WGMXCCGn1
    SolutionIndex: 61
    SolutionNameMin: Cijk_Alik_Bljk_F8NBS_STA_BH_BiasSB_HAS_SAB_SAV_UserArgs_MT256x192x128_MI16x16x1_SN_LDSB0_GRVWB16_GSU1_GSUC0_GSUWGMRR0_K1_LBSPPB512_MIWT4_12_NLCA2_SU8_SUM0_SUS128_VWB4_WG64_4_1_WGM8_WGMXCC8_WGMXCCGn1
    SolutionIndex: 62
    SolutionNameMin: Cijk_Alik_Bljk_F8NBS_STA_BH_BiasSB_HAS_SAB_SAV_UserArgs_MT320x160x128_MI16x16x1_SN_LDSB0_GRVWB16_GSU1_GSUC0_GSUWGMRR0_K1_LBSPPB256_MIWT5_10_NLCA2_SU0_SUM0_SUS0_VWB2_WG64_4_1_WGM8_WGMXCC8_WGMXCCGn1
    SolutionIndex: 63
    SolutionNameMin: Cijk_Alik_Bljk_F8NBS_STA_BH_BiasSB_HAS_SAB_SAV_UserArgs_MT384x160x128_MI16x16x1_SN_LDSB0_GRVWB16_GSU1_GSUC0_GSUWGMRR0_K1_LBSPPB256_MIWT6_10_NLCA2_SU0_SUM0_SUS0_VWB2_WG64_4_1_WGM8_WGMXCC8_WGMXCCGn1
    SolutionIndex: 64
    SolutionNameMin: Cijk_Alik_Bljk_F8NBS_STA_BH_BiasSB_HAS_SAB_SAV_UserArgs_MT384x144x128_MI16x16x1_SN_LDSB0_GRVWB8_GSU1_GSUC0_GSUWGMRR0_K1_LBSPPB128_MIWT6_9_NLCA2_SU8_SUM0_SUS128_VWB1_WG64_4_1_WGM8_WGMXCC8_WGMXCCGn1
    SolutionIndex: 65
    SolutionNameMin: Cijk_Alik_Bljk_F8NBS_STA_BH_BiasSB_HAS_SAB_SAV_UserArgs_MT448x128x128_MI16x16x1_SN_LDSB0_GRVWB16_GSU1_GSUC0_GSUWGMRR0_K1_LBSPPB1024_MIWT7_8_NLCA2_SU0_SUM0_SUS0_VWB8_WG64_4_1_WGM8_WGMXCC8_WGMXCCGn1
    SolutionIndex: 66
    SolutionNameMin: Cijk_Alik_Bljk_F8NBS_STA_BH_BiasSB_HAS_SAB_SAV_UserArgs_MT512x128x128_MI16x16x1_SN_LDSB0_GRVWB16_GSU1_GSUC0_GSUWGMRR0_K1_LBSPPB1024_MIWT8_8_NLCA2_SU0_SUM0_SUS0_VWB8_WG64_4_1_WGM6_WGMXCC8_WGMXCCGn1
    SolutionIndex: 67
    SolutionNameMin: Cijk_Alik_Bljk_F8NBS_STA_BH_BiasSB_HAS_SAB_SAV_UserArgs_MT192x224x128_MI16x16x1_SN_LDSB0_GRVWB16_GSU1_GSUC0_GSUWGMRR0_K1_LBSPPB256_MIWT3_14_NLCA2_SU8_SUM0_SUS128_VWB2_WG64_4_1_WGM8_WGMXCC8_WGMXCCGn1
    SolutionIndex: 68
    SolutionNameMin: Cijk_Alik_Bljk_F8NBS_STA_BH_BiasSB_HAS_SAB_SAV_UserArgs_MT384x160x128_MI16x16x1_SN_LDSB0_GRVWB16_GSU1_GSUC0_GSUWGMRR0_K1_LBSPPB256_MIWT6_10_NLCA2_SU8_SUM0_SUS128_VWB2_WG64_4_1_WGM8_WGMXCC8_WGMXCCGn1
    SolutionIndex: 69
    SolutionNameMin: Cijk_Alik_Bljk_F8NBS_STA_BH_BiasSB_HAS_SAB_SAV_UserArgs_MT512x128x128_MI16x16x1_SN_LDSB0_GRVWB16_GSU1_GSUC0_GSUWGMRR0_K1_LBSPPB1024_MIWT8_8_NLCA2_SU8_SUM0_SUS128_VWB8_WG64_4_1_WGM8_WGMXCC8_WGMXCCGn1
    SolutionIndex: 70
    SolutionNameMin: Cijk_Alik_Bljk_F8NBS_STA_BH_BiasSB_HAS_SAB_SAV_UserArgs_MT192x64x256_MI16x16x1_SN_LDSB1_GRVWB16_GSU1_GSUC0_GSUWGMRR0_K1_LBSPPB1024_MIWT3_4_NLCA4_SU0_SUM0_SUS0_VWB4_WG64_4_1_WGM8_WGMXCC8_WGMXCCGn1
    SolutionIndex: 71
    SolutionNameMin: Cijk_Alik_Bljk_F8NBS_STA_BH_BiasSB_HAS_SAB_SAV_UserArgs_MT128x112x256_MI16x16x1_SN_LDSB1_GRVWB16_GSU1_GSUC0_GSUWGMRR0_K1_LBSPPB256_MIWT2_7_NLCA4_SU0_SUM0_SUS0_VWB1_WG64_4_1_WGM8_WGMXCC8_WGMXCCGn1
    SolutionIndex: 72
    SolutionNameMin: Cijk_Alik_Bljk_F8NBS_STA_BH_BiasSB_HAS_SAB_SAV_UserArgs_MT128x128x256_MI16x16x1_SN_LDSB1_GRVWB16_GSU1_GSUC0_GSUWGMRR0_K1_LBSPPB2048_MIWT2_8_NLCA4_SU0_SUM0_SUS0_VWB8_WG64_4_1_WGM6_WGMXCC8_WGMXCCGn1
    SolutionIndex: 73
    SolutionNameMin: Cijk_Alik_Bljk_F8NBS_STA_BH_BiasSB_HAS_SAB_SAV_UserArgs_MT320x48x256_MI16x16x1_SN_LDSB0_GRVWB16_GSU1_GSUC0_GSUWGMRR0_K1_LBSPPB256_MIWT5_3_NLCA4_SU0_SUM0_SUS0_VWB1_WG64_4_1_WGM8_WGMXCC8_WGMXCCGn1
    SolutionIndex: 74
    SolutionNameMin: Cijk_Alik_Bljk_F8NBS_STA_BH_BiasSB_HAS_SAB_SAV_UserArgs_MT128x128x256_MI16x16x1_SN_LDSB1_GRVWB16_GSU1_GSUC0_GSUWGMRR0_K1_LBSPPB2048_MIWT2_8_NLCA4_SU0_SUM0_SUS0_VWB8_WG64_4_1_WGM8_WGMXCC8_WGMXCCGn1
    SolutionIndex: 75
    SolutionNameMin: Cijk_Alik_Bljk_F8NBS_STA_BH_BiasSB_HAS_SAB_SAV_UserArgs_MT320x64x128_MI16x16x1_SN_LDSB0_GRVWB16_GSU1_GSUC0_GSUWGMRR0_K1_LBSPPB512_MIWT5_4_NLCA2_SU0_SUM0_SUS0_VWB4_WG64_4_1_WGM8_WGMXCC8_WGMXCCGn1
    SolutionIndex: 76
    SolutionNameMin: Cijk_Alik_Bljk_F8NBS_STA_BH_BiasSB_HAS_SAB_SAV_UserArgs_MT320x80x128_MI16x16x1_SN_LDSB0_GRVWB8_GSU1_GSUC0_GSUWGMRR0_K1_LBSPPB128_MIWT5_5_NLCA2_SU0_SUM0_SUS0_VWB1_WG64_4_1_WGM8_WGMXCC8_WGMXCCGn1
    SolutionIndex: 77
    SolutionNameMin: Cijk_Alik_Bljk_F8NBS_STA_BH_BiasSB_HAS_SAB_SAV_UserArgs_MT192x128x128_MI16x16x1_SN_LDSB1_GRVWB16_GSU1_GSUC0_GSUWGMRR0_K1_LBSPPB1024_MIWT3_8_NLCA2_SU0_SUM0_SUS0_VWB8_WG64_4_1_WGM8_WGMXCC8_WGMXCCGn1
    SolutionIndex: 78
    SolutionNameMin: Cijk_Alik_Bljk_F8NBS_STA_BH_BiasSB_HAS_SAB_SAV_UserArgs_MT320x80x128_MI16x16x1_SN_LDSB0_GRVWB8_GSU1_GSUC0_GSUWGMRR0_K1_LBSPPB128_MIWT5_5_NLCA2_SU8_SUM0_SUS128_VWB1_WG64_4_1_WGM8_WGMXCC8_WGMXCCGn1
    SolutionIndex: 79
    SolutionNameMin: Cijk_Alik_Bljk_F8NBS_STA_BH_BiasSB_HAS_SAB_SAV_UserArgs_MT256x128x128_MI16x16x1_SN_LDSB1_GRVWB16_GSU1_GSUC0_GSUWGMRR0_K1_LBSPPB1024_MIWT4_8_NLCA2_SU8_SUM0_SUS128_VWB8_WG64_4_1_WGM6_WGMXCC8_WGMXCCGn1
    SolutionIndex: 80
    SolutionNameMin: Cijk_Alik_Bljk_F8NBS_STA_BH_BiasSB_HAS_SAB_SAV_UserArgs_MT256x112x128_MI16x16x1_SN_LDSB1_GRVWB8_GSU1_GSUC0_GSUWGMRR0_K1_LBSPPB128_MIWT4_7_NLCA2_SU0_SUM0_SUS0_VWB1_WG64_4_1_WGM6_WGMXCC8_WGMXCCGn1
    SolutionIndex: 81
    SolutionNameMin: Cijk_Alik_Bljk_F8NBS_STA_BH_BiasSB_HAS_SAB_SAV_UserArgs_MT320x112x128_MI16x16x1_SN_LDSB0_GRVWB8_GSU1_GSUC0_GSUWGMRR0_K1_LBSPPB128_MIWT5_7_NLCA2_SU0_SUM0_SUS0_VWB1_WG64_4_1_WGM8_WGMXCC8_WGMXCCGn1
    SolutionIndex: 82
    SolutionNameMin: Cijk_Alik_Bljk_F8NBS_STA_BH_BiasSB_HAS_SAB_SAV_UserArgs_MT320x112x128_MI16x16x1_SN_LDSB0_GRVWB8_GSU1_GSUC0_GSUWGMRR0_K1_LBSPPB128_MIWT5_7_NLCA2_SU0_SUM0_SUS0_VWB1_WG64_4_1_WGM6_WGMXCC8_WGMXCCGn1
    SolutionIndex: 83
    SolutionNameMin: Cijk_Alik_Bljk_F8NBS_STA_BH_BiasSB_HAS_SAB_SAV_UserArgs_MT320x128x128_MI16x16x1_SN_LDSB0_GRVWB16_GSU1_GSUC0_GSUWGMRR0_K1_LBSPPB1024_MIWT5_8_NLCA2_SU0_SUM0_SUS0_VWB8_WG64_4_1_WGM6_WGMXCC8_WGMXCCGn1
    SolutionIndex: 84
    SolutionNameMin: Cijk_Alik_Bljk_F8NBS_STA_BH_BiasSB_HAS_SAB_SAV_UserArgs_MT192x256x128_MI16x16x1_SN_LDSB1_GRVWB16_GSU1_GSUC0_GSUWGMRR0_K1_LBSPPB2048_MIWT3_16_NLCA2_SU0_SUM0_SUS0_VWB16_WG64_4_1_WGM6_WGMXCC8_WGMXCCGn1
    SolutionIndex: 85
    SolutionNameMin: Cijk_Alik_Bljk_F8NBS_STA_BH_BiasSB_HAS_SAB_SAV_UserArgs_MT320x144x128_MI16x16x1_SN_LDSB0_GRVWB8_GSU1_GSUC0_GSUWGMRR0_K1_LBSPPB128_MIWT5_9_NLCA2_SU0_SUM0_SUS0_VWB1_WG64_4_1_WGM6_WGMXCC8_WGMXCCGn1
    SolutionIndex: 86
    SolutionNameMin: Cijk_Alik_Bljk_F8NBS_STA_BH_BiasSB_HAS_SAB_SAV_UserArgs_MT320x176x128_MI16x16x1_SN_LDSB0_GRVWB8_GSU1_GSUC0_GSUWGMRR0_K1_LBSPPB128_MIWT5_11_NLCA2_SU8_SUM0_SUS128_VWB1_WG64_4_1_WGM8_WGMXCC8_WGMXCCGn1
    SolutionIndex: 87
    SolutionNameMin: Cijk_Alik_Bljk_F8NBS_STA_BH_BiasSB_HAS_SAB_SAV_UserArgs_MT256x256x128_MI16x16x1_SN_LDSB1_GRVWB16_GSU1_GSUC0_GSUWGMRR0_K1_LBSPPB2048_MIWT4_16_NLCA2_SU0_SUM0_SUS0_VWB16_WG64_4_1_WGM6_WGMXCC8_WGMXCCGn1
    SolutionIndex: 88
    SolutionNameMin: Cijk_Alik_Bljk_F8NBS_STA_BH_BiasSB_HAS_SAB_SAV_UserArgs_MT320x176x128_MI16x16x1_SN_LDSB0_GRVWB8_GSU1_GSUC0_GSUWGMRR0_K1_LBSPPB128_MIWT5_11_NLCA2_SU8_SUM0_SUS128_VWB1_WG64_4_1_WGM6_WGMXCC8_WGMXCCGn1
    SolutionIndex: 89
    SolutionNameMin: Cijk_Alik_Bljk_F8NBS_STA_BH_BiasSB_HAS_SAB_SAV_UserArgs_MT256x256x128_MI16x16x1_SN_LDSB1_GRVWB16_GSU1_GSUC0_GSUWGMRR0_K1_LBSPPB2048_MIWT4_16_NLCA2_SU8_SUM0_SUS128_VWB16_WG64_4_1_WGM8_WGMXCC8_WGMXCCGn1
    SolutionIndex: 90
    SolutionNameMin: Cijk_Alik_Bljk_F8NBS_STA_BH_BiasSB_HAS_SAB_SAV_UserArgs_MT256x256x128_MI16x16x1_SN_LDSB1_GRVWB16_GSU1_GSUC0_GSUWGMRR0_K1_LBSPPB2048_MIWT4_16_NLCA2_SU8_SUM0_SUS128_VWB16_WG64_4_1_WGM6_WGMXCC8_WGMXCCGn1
    SolutionIndex: 91
    SolutionNameMin: Cijk_Alik_Bljk_F8NBS_STA_BH_BiasSB_HAS_SAB_SAV_UserArgs_MT256x256x128_MI16x16x1_SN_LDSB1_GRVWB16_GSU1_GSUC0_GSUWGMRR0_K1_LBSPPB2048_MIWT4_16_NLCA2_SU0_SUM0_SUS0_VWB16_WG64_4_1_WGM8_WGMXCC8_WGMXCCGn1
    SolutionIndex: 92
    SolutionNameMin: Cijk_Alik_Bljk_F8NBS_STA_BH_BiasSB_HAS_SAB_SAV_UserArgs_MT128x80x256_MI16x16x1_SN_LDSB1_GRVWB16_GSU1_GSUC0_GSUWGMRR0_K1_LBSPPB256_MIWT2_5_NLCA4_SU8_SUM0_SUS256_VWB1_WG64_4_1_WGM6_WGMXCC8_WGMXCCGn1
    SolutionIndex: 93
    SolutionNameMin: Cijk_Alik_Bljk_F8NBS_STA_BH_BiasSB_HAS_SAB_SAV_UserArgs_MT192x48x256_MI16x16x1_SN_LDSB0_GRVWB16_GSU1_GSUC0_GSUWGMRR0_K1_LBSPPB256_MIWT3_3_NLCA4_SU0_SUM0_SUS0_VWB1_WG64_4_1_WGM6_WGMXCC8_WGMXCCGn1
    SolutionIndex: 94
    SolutionNameMin: Cijk_Alik_Bljk_F8NBS_STA_BH_BiasSB_HAS_SAB_SAV_UserArgs_MT128x128x256_MI16x16x1_SN_LDSB1_GRVWB16_GSU1_GSUC0_GSUWGMRR0_K1_LBSPPB2048_MIWT2_8_NLCA4_SU8_SUM0_SUS256_VWB8_WG64_4_1_WGM8_WGMXCC8_WGMXCCGn1
    SolutionIndex: 95
    SolutionNameMin: Cijk_Alik_Bljk_F8NBS_STA_BH_BiasSB_HAS_SAB_SAV_UserArgs_MT128x112x256_MI16x16x1_SN_LDSB1_GRVWB16_GSU1_GSUC0_GSUWGMRR0_K1_LBSPPB256_MIWT2_7_NLCA4_SU8_SUM0_SUS256_VWB1_WG64_4_1_WGM8_WGMXCC8_WGMXCCGn1
    SolutionIndex: 96
    SolutionNameMin: Cijk_Alik_Bljk_F8NBS_STA_BH_BiasSB_HAS_SAB_SAV_UserArgs_MT128x64x128_MI16x16x1_SN_LDSB0_GRVWB16_GSU1_GSUC0_GSUWGMRR0_K1_LBSPPB512_MIWT2_4_NLCA2_SU8_SUM0_SUS128_VWB4_WG64_4_1_WGM8_WGMXCC8_WGMXCCGn1
    SolutionIndex: 97
    SolutionNameMin: Cijk_Alik_Bljk_F8NBS_STA_BH_BiasSB_HAS_SAB_SAV_UserArgs_MT320x48x256_MI16x16x1_SN_LDSB0_GRVWB16_GSU1_GSUC0_GSUWGMRR0_K1_LBSPPB256_MIWT5_3_NLCA4_SU0_SUM0_SUS0_VWB1_WG64_4_1_WGM6_WGMXCC8_WGMXCCGn1
    SolutionIndex: 98
    SolutionNameMin: Cijk_Alik_Bljk_F8NBS_STA_BH_BiasSB_HAS_SAB_SAV_UserArgs_MT128x128x128_MI16x16x1_SN_LDSB1_GRVWB16_GSU1_GSUC0_GSUWGMRR0_K1_LBSPPB1024_MIWT2_8_NLCA2_SU8_SUM0_SUS128_VWB8_WG64_4_1_WGM8_WGMXCC8_WGMXCCGn1
    SolutionIndex: 99
    SolutionNameMin: Cijk_Alik_Bljk_F8NBS_STA_BH_BiasSB_HAS_SAB_SAV_UserArgs_MT128x96x128_MI16x16x1_SN_LDSB0_GRVWB16_GSU1_GSUC0_GSUWGMRR0_K1_LBSPPB256_MIWT2_6_NLCA2_SU8_SUM0_SUS128_VWB2_WG64_4_1_WGM8_WGMXCC8_WGMXCCGn1
    SolutionIndex: 100
    SolutionNameMin: Cijk_Alik_Bljk_F8NBS_STA_BH_BiasSB_HAS_SAB_SAV_UserArgs_MT320x128x128_MI16x16x1_SN_LDSB0_GRVWB16_GSU1_GSUC0_GSUWGMRR0_K1_LBSPPB1024_MIWT5_8_NLCA2_SU0_SUM0_SUS0_VWB8_WG64_4_1_WGM8_WGMXCC8_WGMXCCGn1
    SolutionIndex: 101
    SolutionNameMin: Cijk_Alik_Bljk_F8NBS_STA_BH_BiasSB_HAS_SAB_SAV_UserArgs_MT320x192x128_MI16x16x1_SN_LDSB0_GRVWB16_GSU1_GSUC0_GSUWGMRR0_K1_LBSPPB512_MIWT5_12_NLCA2_SU0_SUM0_SUS0_VWB4_WG64_4_1_WGM6_WGMXCC8_WGMXCCGn1
    SolutionIndex: 102
    SolutionNameMin: Cijk_Alik_Bljk_F8NBS_STA_BH_BiasSB_HAS_SAB_SAV_UserArgs_MT320x208x128_MI16x16x1_SN_LDSB1_GRVWB8_GSU1_GSUC0_GSUWGMRR0_K1_LBSPPB128_MIWT5_13_NLCA2_SU0_SUM0_SUS0_VWB1_WG64_4_1_WGM6_WGMXCC8_WGMXCCGn1
    SolutionIndex: 103
    SolutionNameMin: Cijk_Alik_Bljk_F8NBS_STA_BH_BiasSB_HAS_SAB_SAV_UserArgs_MT320x192x128_MI16x16x1_SN_LDSB0_GRVWB16_GSU1_GSUC0_GSUWGMRR0_K1_LBSPPB512_MIWT5_12_NLCA2_SU0_SUM0_SUS0_VWB4_WG64_4_1_WGM8_WGMXCC8_WGMXCCGn1
    SolutionIndex: 104
    SolutionNameMin: Cijk_Alik_Bljk_F8NBS_STA_BH_BiasSB_HAS_SAB_SAV_UserArgs_MT512x128x128_MI16x16x1_SN_LDSB0_GRVWB16_GSU1_GSUC0_GSUWGMRR0_K1_LBSPPB1024_MIWT8_8_NLCA2_SU0_SUM0_SUS0_VWB8_WG64_4_1_WGM1_WGMXCC8_WGMXCCGn1
    SolutionIndex: 105
    SolutionNameMin: Cijk_Alik_Bljk_F8NBS_STA_BH_BiasSB_HAS_SAB_SAV_UserArgs_MT256x256x128_MI16x16x1_SN_LDSB1_GRVWB16_GSU1_GSUC0_GSUWGMRR0_K1_LBSPPB2048_MIWT4_16_NLCA2_SU0_SUM0_SUS0_VWB16_WG64_4_1_WGM1_WGMXCC8_WGMXCCGn1
    SolutionIndex: 106
    SolutionNameMin: Cijk_Alik_Bljk_F8NBS_STA_BH_BiasSB_HAS_SAB_SAV_UserArgs_MT192x128x128_MI16x16x1_SN_LDSB1_GRVWB16_GSU1_GSUC0_GSUWGMRR0_K1_LBSPPB1024_MIWT3_8_NLCA2_SU0_SUM0_SUS0_VWB8_WG64_4_1_WGM6_WGMXCC8_WGMXCCGn1
    SolutionIndex: 107
    SolutionNameMin: Cijk_Alik_Bljk_F8NBS_STA_BH_BiasSB_HAS_SAB_SAV_UserArgs_MT64x32x512_MI16x16x1_SN_LDSB1_GRVWB16_GSU1_GSUAMB_GSUC1_GSUWGMRR1_K1_LBSPPB1024_MIWT1_2_NTA0_NLCA8_SU0_SUM0_SUS0_VWB2_WG64_4_1_WGM1_WGMXCC8_WGMXCCGn1
    SolutionIndex: 108
    SolutionNameMin: Cijk_Alik_Bljk_F8NBS_STA_BH_BiasSB_HAS_SAB_SAV_UserArgs_MT128x32x512_MI16x16x1_SN_LDSB1_GRVWB16_GSU1_GSUAMB_GSUC1_GSUWGMRR1_K1_LBSPPB1024_MIWT2_2_NTA0_NLCA8_SU0_SUM0_SUS0_VWB2_WG64_4_1_WGM1_WGMXCC8_WGMXCCGn1
    SolutionIndex: 109
    SolutionNameMin: Cijk_Alik_Bljk_F8NBS_STA_BH_BiasSB_HAS_SAB_SAV_UserArgs_MT128x32x256_MI16x16x1_SN_LDSB0_GRVWB16_GSU1_GSUAMB_GSUC1_GSUWGMRR1_K1_LBSPPB512_MIWT2_2_NTA0_NLCA4_SU0_SUM0_SUS0_VWB2_WG64_4_1_WGM1_WGMXCC8_WGMXCCGn1
    SolutionIndex: 110
    SolutionNameMin: Cijk_Alik_Bljk_F8NBS_STA_BH_BiasSB_HAS_SAB_SAV_UserArgs_MT64x32x512_MI16x16x1_SN_LDSB1_GRVWB16_GSU1_GSUC0_GSUWGMRR0_K1_LBSPPB1024_MIWT2_2_NLCA8_SU0_SUM0_SUS0_VWB2_WG32_4_1_WGM8_WGMXCC8_WGMXCCGn1
    SolutionIndex: 111
    SolutionNameMin: Cijk_Alik_Bljk_F8NBS_STA_BH_BiasSB_HAS_SAB_SAV_UserArgs_MT128x32x512_MI16x16x1_SN_LDSB1_GRVWB16_GSU1_GSUC0_GSUWGMRR0_K1_LBSPPB1024_MIWT2_2_NLCA8_SU0_SUM0_SUS0_VWB2_WG64_4_1_WGM1_WGMXCC8_WGMXCCGn1
    SolutionIndex: 112
    SolutionNameMin: Cijk_Alik_Bljk_F8NBS_STA_BH_BiasSB_HAS_SAB_SAV_UserArgs_MT128x48x256_MI16x16x1_SN_LDSB0_GRVWB16_GSU1_GSUC0_GSUWGMRR0_K1_LBSPPB256_MIWT2_3_NLCA4_SU8_SUM0_SUS256_VWB1_WG64_4_1_WGM1_WGMXCC8_WGMXCCGn1
    SolutionIndex: 113
    SolutionNameMin: Cijk_Alik_Bljk_F8NBS_STA_BH_BiasSB_HAS_SAB_SAV_UserArgs_MT128x64x256_MI16x16x1_SN_LDSB1_GRVWB16_GSU1_GSUC0_GSUWGMRR0_K1_LBSPPB1024_MIWT2_4_NLCA4_SU8_SUM0_SUS256_VWB4_WG64_4_1_WGM1_WGMXCC8_WGMXCCGn1
    SolutionIndex: 114
    SolutionNameMin: Cijk_Alik_Bljk_F8NBS_STA_BH_BiasSB_HAS_SAB_SAV_UserArgs_MT128x48x256_MI16x16x1_SN_LDSB0_GRVWB16_GSU1_GSUC0_GSUWGMRR0_K1_LBSPPB256_MIWT2_3_NLCA4_SU0_SUM0_SUS0_VWB1_WG64_4_1_WGM1_WGMXCC8_WGMXCCGn1
    SolutionIndex: 115
    SolutionNameMin: Cijk_Alik_Bljk_F8NBS_STA_BH_BiasSB_HAS_SAB_SAV_UserArgs_MT128x64x256_MI16x16x1_SN_LDSB1_GRVWB16_GSU1_GSUC0_GSUWGMRR0_K1_LBSPPB1024_MIWT2_4_NLCA4_SU0_SUM0_SUS0_VWB4_WG64_4_1_WGM1_WGMXCC8_WGMXCCGn1
    SolutionIndex: 116
    SolutionNameMin: Cijk_Alik_Bljk_F8NBS_STA_BH_BiasSB_HAS_SAB_SAV_UserArgs_MT128x80x256_MI16x16x1_SN_LDSB1_GRVWB16_GSU1_GSUC0_GSUWGMRR0_K1_LBSPPB256_MIWT2_5_NLCA4_SU0_SUM0_SUS0_VWB1_WG64_4_1_WGM1_WGMXCC8_WGMXCCGn1
    SolutionIndex: 117
    SolutionNameMin: Cijk_Alik_Bljk_F8NBS_STA_BH_BiasSB_HAS_SAB_SAV_UserArgs_MT128x96x256_MI16x16x1_SN_LDSB1_GRVWB16_GSU1_GSUC0_GSUWGMRR0_K1_LBSPPB512_MIWT2_6_NLCA4_SU8_SUM0_SUS256_VWB2_WG64_4_1_WGM1_WGMXCC8_WGMXCCGn1
    SolutionIndex: 118
    SolutionNameMin: Cijk_Alik_Bljk_F8NBS_STA_BH_BiasSB_HAS_SAB_SAV_UserArgs_MT128x96x256_MI16x16x1_SN_LDSB1_GRVWB16_GSU1_GSUC0_GSUWGMRR0_K1_LBSPPB512_MIWT2_6_NLCA4_SU0_SUM0_SUS0_VWB2_WG64_4_1_WGM1_WGMXCC8_WGMXCCGn1
    SolutionIndex: 119
    SolutionNameMin: Cijk_Alik_Bljk_F8NBS_STA_BH_BiasSB_HAS_SAB_SAV_UserArgs_MT128x96x256_MI16x16x1_SN_LDSB1_GRVWB16_GSU1_GSUC0_GSUWGMRR0_K1_LBSPPB512_MIWT2_6_NLCA4_SU8_SUM0_SUS256_VWB2_WG64_4_1_WGM6_WGMXCC8_WGMXCCGn1
    SolutionIndex: 120
    SolutionNameMin: Cijk_Alik_Bljk_F8NBS_STA_BH_BiasSB_HAS_SAB_SAV_UserArgs_MT128x112x256_MI16x16x1_SN_LDSB1_GRVWB16_GSU1_GSUC0_GSUWGMRR0_K1_LBSPPB256_MIWT2_7_NLCA4_SU8_SUM0_SUS256_VWB1_WG64_4_1_WGM1_WGMXCC8_WGMXCCGn1
    SolutionIndex: 121
    SolutionNameMin: Cijk_Alik_Bljk_F8NBS_STA_BH_BiasSB_HAS_SAB_SAV_UserArgs_MT256x64x256_MI16x16x1_SN_LDSB1_GRVWB16_GSU1_GSUC0_GSUWGMRR0_K1_LBSPPB1024_MIWT4_4_NLCA4_SU0_SUM0_SUS0_VWB4_WG64_4_1_WGM1_WGMXCC8_WGMXCCGn1
    SolutionIndex: 122
    SolutionNameMin: Cijk_Alik_Bljk_F8NBS_STA_BH_BiasSB_HAS_SAB_SAV_UserArgs_MT128x32x256_MI16x16x1_SN_LDSB0_GRVWB16_GSU1_GSUC0_GSUWGMRR0_K1_LBSPPB512_MIWT2_2_NLCA4_SU0_SUM0_SUS0_VWB2_WG64_4_1_WGM8_WGMXCC8_WGMXCCGn1
    SolutionIndex: 123
    SolutionNameMin: Cijk_Alik_Bljk_F8NBS_STA_BH_Bias_HAS_SAB_SAVUserArgs_MT32x16x1024_MI16x16x1_SN_LDSB1_GRVWB16_GSU1_GSUC0_GSUWGMRR0_K1_LBSPPB1024_MIWT1_1_NTA4_NLCA16_SU0_SUM0_SUS1024_VWB1_WG32_4_1_WGM1_WGMXCC8_WGMXCCGn1
    SolutionIndex: 124
    SolutionNameMin: Cijk_Alik_Bljk_F8NBS_STA_BH_Bias_HAS_SAB_SAVUserArgs_MT32x16x1024_MI16x16x1_SN_LDSB1_GRVWB16_GSU1_GSUC0_GSUWGMRR0_K1_LBSPPB1024_MIWT1_1_NTA0_NLCA16_SU8_SUM0_SUS1024_VWB1_WG32_4_1_WGM1_WGMXCC8_WGMXCCGn1
    SolutionIndex: 125
    SolutionNameMin: Cijk_Alik_Bljk_F8NBS_STA_BH_Bias_HAS_SAB_SAVUserArgs_MT32x16x1024_MI16x16x1_SN_LDSB1_GRVWB16_GSU1_GSUC0_GSUWGMRR0_K1_LBSPPB1024_MIWT1_1_NTA0_NLCA16_SU8_SUM0_SUS1024_VWB1_WG32_4_1_WGM8_WGMXCC8_WGMXCCGn1
    SolutionIndex: 126
    SolutionNameMin: Cijk_Alik_Bljk_F8NBS_STA_BH_Bias_HAS_SAB_SAVUserArgs_MT32x16x1024_MI16x16x1_SN_LDSB1_GRVWB16_GSU1_GSUC0_GSUWGMRR0_K1_LBSPPB1024_MIWT1_1_NTA0_NLCA16_SU0_SUM0_SUS1024_VWB1_WG32_4_1_WGM8_WGMXCC8_WGMXCCGn1
    SolutionIndex: 127
    SolutionNameMin: Cijk_Alik_Bljk_F8NBS_STA_BH_Bias_HAS_SAB_SAVUserArgs_MT64x16x1024_MI16x16x1_SN_LDSB1_GRVWB16_GSU1_GSUC0_GSUWGMRR0_K1_LBSPPB1024_MIWT1_1_NTA0_NLCA16_SU8_SUM0_SUS1024_VWB1_WG64_4_1_WGM8_WGMXCC8_WGMXCCGn1
    SolutionIndex: 128
    SolutionNameMin: Cijk_Alik_Bljk_F8NBS_STA_BH_Bias_HAS_SAB_SAVUserArgs_MT64x16x512_MI16x16x1_SN_LDSB0_GRVWB16_GSU1_GSUC0_GSUWGMRR0_K1_LBSPPB512_MIWT1_1_NTA0_NLCA8_SU8_SUM0_SUS512_VWB1_WG64_4_1_WGM8_WGMXCC8_WGMXCCGn1
    SolutionIndex: 129
    SolutionNameMin: Cijk_Alik_Bljk_F8NBS_STA_BH_Bias_HAS_SAB_SAVUserArgs_MT64x16x512_MI16x16x1_SN_LDSB0_GRVWB16_GSU1_GSUC0_GSUWGMRR0_K1_LBSPPB512_MIWT1_1_NTA0_NLCA8_SU0_SUM0_SUS512_VWB1_WG64_4_1_WGM8_WGMXCC8_WGMXCCGn1
    SolutionIndex: 130
    SolutionNameMin: Cijk_Alik_Bljk_F8NBS_STA_BH_Bias_HAS_SAB_SAVUserArgs_MT64x32x512_MI16x16x1_SN_LDSB1_GRVWB16_GSU1_GSUC0_GSUWGMRR0_K1_LBSPPB1024_MIWT1_2_NTA0_NLCA8_SU8_SUM0_SUS512_VWB2_WG64_4_1_WGM8_WGMXCC8_WGMXCCGn1
    SolutionIndex: 131
    SolutionNameMin: Cijk_Alik_Bljk_F8NBS_STA_BH_Bias_HAS_SAB_SAVUserArgs_MT32x16x1024_MI16x16x1_SN_LDSB1_GRVWB16_GSU1_GSUC0_GSUWGMRR0_K1_LBSPPB1024_MIWT1_1_NTA4_NLCA16_SU0_SUM0_SUS1024_VWB1_WG32_4_1_WGM8_WGMXCC8_WGMXCCGn1
    SolutionIndex: 132
    SolutionNameMin: Cijk_Alik_Bljk_F8NBS_STA_BH_Bias_HAS_SAB_SAVUserArgs_MT64x16x512_MI16x16x1_SN_LDSB0_GRVWB16_GSU1_GSUC0_GSUWGMRR0_K1_LBSPPB512_MIWT1_1_NTA4_NLCA8_SU0_SUM0_SUS512_VWB1_WG64_4_1_WGM8_WGMXCC8_WGMXCCGn1
    SolutionIndex: 133
    SolutionNameMin: Cijk_Alik_Bljk_F8NBS_STA_BH_Bias_HAS_SAB_SAVUserArgs_MT64x32x512_MI16x16x1_SN_LDSB1_GRVWB16_GSU1_GSUC0_GSUWGMRR0_K1_LBSPPB1024_MIWT1_2_NTA4_NLCA8_SU0_SUM0_SUS512_VWB2_WG64_4_1_WGM8_WGMXCC8_WGMXCCGn1
    SolutionIndex: 134
    SolutionNameMin: Cijk_Alik_Bljk_F8NBS_STA_BH_Bias_HAS_SAB_SAVUserArgs_MT64x48x512_MI16x16x1_SN_LDSB1_GRVWB16_GSU1_GSUC0_GSUWGMRR0_K1_LBSPPB512_MIWT1_3_NTA0_NLCA8_SU8_SUM0_SUS512_VWB1_WG64_4_1_WGM8_WGMXCC8_WGMXCCGn1
    SolutionIndex: 135
    SolutionNameMin: Cijk_Alik_Bljk_F8NBS_STA_BH_Bias_HAS_SAB_SAVUserArgs_MT128x32x512_MI16x16x1_SN_LDSB1_GRVWB16_GSU1_GSUC0_GSUWGMRR0_K1_LBSPPB1024_MIWT2_2_NTA0_NLCA8_SU8_SUM0_SUS512_VWB2_WG64_4_1_WGM8_WGMXCC8_WGMXCCGn1
    SolutionIndex: 136
    SolutionNameMin: Cijk_Alik_Bljk_F8NBS_STA_BH_Bias_HAS_SAB_SAVUserArgs_MT64x48x512_MI16x16x1_SN_LDSB1_GRVWB16_GSU1_GSUC0_GSUWGMRR0_K1_LBSPPB512_MIWT1_3_NTA4_NLCA8_SU0_SUM0_SUS512_VWB1_WG64_4_1_WGM8_WGMXCC8_WGMXCCGn1
    SolutionIndex: 137
    SolutionNameMin: Cijk_Alik_Bljk_F8NBS_STA_BH_Bias_HAS_SAB_SAVUserArgs_MT128x32x512_MI16x16x1_SN_LDSB1_GRVWB16_GSU1_GSUC0_GSUWGMRR0_K1_LBSPPB1024_MIWT2_2_NTA0_NLCA8_SU0_SUM0_SUS512_VWB2_WG64_4_1_WGM8_WGMXCC8_WGMXCCGn1
    SolutionIndex: 138
    SolutionNameMin: Cijk_Alik_Bljk_F8NBS_STA_BH_Bias_HAS_SAB_SAVUserArgs_MT32x16x1024_MI16x16x1_SN_LDSB1_GRVWB16_GSU1_GSUC0_GSUWGMRR0_K1_LBSPPB1024_MIWT1_1_NTA4_NLCA16_SU8_SUM0_SUS1024_VWB1_WG32_4_1_WGM1_WGMXCC8_WGMXCCGn1
    SolutionIndex: 139
    SolutionNameMin: Cijk_Alik_Bljk_F8NBS_STA_BH_Bias_HAS_SAB_SAVUserArgs_MT64x32x512_MI16x16x1_SN_LDSB1_GRVWB16_GSU1_GSUC0_GSUWGMRR0_K1_LBSPPB1024_MIWT1_2_NTA0_NLCA8_SU0_SUM0_SUS512_VWB2_WG64_4_1_WGM8_WGMXCC8_WGMXCCGn1
    SolutionIndex: 140
    SolutionNameMin: Cijk_Alik_Bljk_F8NBS_STA_BH_Bias_HAS_SAB_SAVUserArgs_MT128x32x512_MI16x16x1_SN_LDSB1_GRVWB16_GSU1_GSUC0_GSUWGMRR0_K1_LBSPPB1024_MIWT2_2_NTA4_NLCA8_SU0_SUM0_SUS512_VWB2_WG64_4_1_WGM8_WGMXCC8_WGMXCCGn1
    SolutionIndex: 141
    SolutionNameMin: Cijk_Alik_Bljk_F8NBS_STA_BH_Bias_HAS_SAB_SAVUserArgs_MT128x48x256_MI16x16x1_SN_LDSB0_GRVWB16_GSU1_GSUC0_GSUWGMRR0_K1_LBSPPB256_MIWT2_3_NTA4_NLCA4_SU0_SUM0_SUS256_VWB1_WG64_4_1_WGM8_WGMXCC8_WGMXCCGn1
    SolutionIndex: 142
    SolutionNameMin: Cijk_Alik_Bljk_F8NBS_STA_BH_Bias_HAS_SAB_SAVUserArgs_MT128x48x256_MI16x16x1_SN_LDSB0_GRVWB16_GSU1_GSUC0_GSUWGMRR0_K1_LBSPPB256_MIWT2_3_NTA0_NLCA4_SU0_SUM0_SUS256_VWB1_WG64_4_1_WGM8_WGMXCC8_WGMXCCGn1
    SolutionIndex: 143
    SolutionNameMin: Cijk_Alik_Bljk_F8NBS_STA_BH_Bias_HAS_SAB_SAVUserArgs_MT128x64x256_MI16x16x1_SN_LDSB1_GRVWB16_GSU1_GSUC0_GSUWGMRR0_K1_LBSPPB1024_MIWT2_4_NTA4_NLCA4_SU0_SUM0_SUS256_VWB4_WG64_4_1_WGM8_WGMXCC8_WGMXCCGn1
    SolutionIndex: 144
    SolutionNameMin: Cijk_Alik_Bljk_F8NBS_STA_BH_Bias_HAS_SAB_SAVUserArgs_MT64x16x512_MI16x16x1_SN_LDSB0_GRVWB16_GSU1_GSUC0_GSUWGMRR0_K1_LBSPPB512_MIWT1_1_NTA4_NLCA8_SU8_SUM0_SUS512_VWB1_WG64_4_1_WGM1_WGMXCC8_WGMXCCGn1
    SolutionIndex: 145
    SolutionNameMin: Cijk_Alik_Bljk_F8NBS_STA_BH_Bias_HAS_SAB_SAVUserArgs_MT64x32x256_MI16x16x1_SN_LDSB0_GRVWB16_GSU1_GSUC0_GSUWGMRR0_K1_LBSPPB512_MIWT1_2_NTA4_NLCA4_SU8_SUM0_SUS256_VWB2_WG64_4_1_WGM1_WGMXCC8_WGMXCCGn1
    SolutionIndex: 146
    SolutionNameMin: Cijk_Alik_Bljk_F8NBS_STA_BH_Bias_HAS_SAB_SAVUserArgs_MT64x48x256_MI16x16x1_SN_LDSB0_GRVWB16_GSU1_GSUC0_GSUWGMRR0_K1_LBSPPB256_MIWT1_3_NTA4_NLCA4_SU0_SUM0_SUS256_VWB1_WG64_4_1_WGM1_WGMXCC8_WGMXCCGn1
    SolutionIndex: 147
    SolutionNameMin: Cijk_Alik_Bljk_F8NBS_STA_BH_Bias_HAS_SAB_SAVUserArgs_MT128x80x256_MI16x16x1_SN_LDSB1_GRVWB16_GSU1_GSUC0_GSUWGMRR0_K1_LBSPPB256_MIWT2_5_NTA4_NLCA4_SU0_SUM0_SUS256_VWB1_WG64_4_1_WGM8_WGMXCC8_WGMXCCGn1
    SolutionIndex: 148
    SolutionNameMin: Cijk_Alik_Bljk_F8NBS_STA_BH_Bias_HAS_SAB_SAVUserArgs_MT192x48x256_MI16x16x1_SN_LDSB0_GRVWB16_GSU1_GSUC0_GSUWGMRR0_K1_LBSPPB256_MIWT3_3_NTA4_NLCA4_SU0_SUM0_SUS256_VWB1_WG64_4_1_WGM8_WGMXCC8_WGMXCCGn1
    SolutionIndex: 149
    SolutionNameMin: Cijk_Alik_Bljk_F8NBS_STA_BH_Bias_HAS_SAB_SAVUserArgs_MT128x96x256_MI16x16x1_SN_LDSB1_GRVWB16_GSU1_GSUC0_GSUWGMRR0_K1_LBSPPB512_MIWT2_6_NTA4_NLCA4_SU0_SUM0_SUS256_VWB2_WG64_4_1_WGM8_WGMXCC8_WGMXCCGn1
    SolutionIndex: 150
    SolutionNameMin: Cijk_Alik_Bljk_F8NBS_STA_BH_Bias_HAS_SAB_SAVUserArgs_MT128x112x256_MI16x16x1_SN_LDSB1_GRVWB16_GSU1_GSUC0_GSUWGMRR0_K1_LBSPPB256_MIWT2_7_NTA4_NLCA4_SU0_SUM0_SUS256_VWB1_WG64_4_1_WGM8_WGMXCC8_WGMXCCGn1
    SolutionIndex: 151
    SolutionNameMin: Cijk_Alik_Bljk_F8NBS_STA_BH_Bias_HAS_SAB_SAVUserArgs_MT192x80x256_MI16x16x1_SN_LDSB1_GRVWB16_GSU1_GSUC0_GSUWGMRR0_K1_LBSPPB256_MIWT3_5_NTA0_NLCA4_SU0_SUM0_SUS256_VWB1_WG64_4_1_WGM8_WGMXCC8_WGMXCCGn1
    SolutionIndex: 152
    SolutionNameMin: Cijk_Alik_Bljk_F8NBS_STA_BH_Bias_HAS_SAB_SAVUserArgs_MT256x64x256_MI16x16x1_SN_LDSB1_GRVWB16_GSU1_GSUC0_GSUWGMRR0_K1_LBSPPB1024_MIWT4_4_NTA4_NLCA4_SU0_SUM0_SUS256_VWB4_WG64_4_1_WGM8_WGMXCC8_WGMXCCGn1
    SolutionIndex: 153
    SolutionNameMin: Cijk_Alik_Bljk_F8NBS_STA_BH_Bias_HAS_SAB_SAVUserArgs_MT192x96x256_MI16x16x1_SN_LDSB1_GRVWB16_GSU1_GSUC0_GSUWGMRR0_K1_LBSPPB512_MIWT3_6_NTA4_NLCA4_SU0_SUM0_SUS256_VWB2_WG64_4_1_WGM8_WGMXCC8_WGMXCCGn1
    SolutionIndex: 154
    SolutionNameMin: Cijk_Alik_Bljk_F8NBS_STA_BH_Bias_HAS_SAB_SAVUserArgs_MT192x96x128_MI16x16x1_SN_LDSB0_GRVWB16_GSU1_GSUC0_GSUWGMRR0_K1_LBSPPB256_MIWT3_6_NTA4_NLCA2_SU0_SUM0_SUS128_VWB2_WG64_4_1_WGM8_WGMXCC8_WGMXCCGn1
    SolutionIndex: 155
    SolutionNameMin: Cijk_Alik_Bljk_F8NBS_STA_BH_Bias_HAS_SAB_SAVUserArgs_MT128x160x128_MI16x16x1_SN_LDSB1_GRVWB16_GSU1_GSUC0_GSUWGMRR0_K1_LBSPPB256_MIWT2_10_NTA4_NLCA2_SU0_SUM0_SUS128_VWB2_WG64_4_1_WGM8_WGMXCC8_WGMXCCGn1
    SolutionIndex: 156
    SolutionNameMin: Cijk_Alik_Bljk_F8NBS_STA_BH_Bias_HAS_SAB_SAVUserArgs_MT192x112x128_MI16x16x1_SN_LDSB1_GRVWB8_GSU1_GSUC0_GSUWGMRR0_K1_LBSPPB128_MIWT3_7_NTA4_NLCA2_SU0_SUM0_SUS128_VWB1_WG64_4_1_WGM8_WGMXCC8_WGMXCCGn1
    SolutionIndex: 157
    SolutionNameMin: Cijk_Alik_Bljk_F8NBS_STA_BH_Bias_HAS_SAB_SAVUserArgs_MT256x96x128_MI16x16x1_SN_LDSB0_GRVWB16_GSU1_GSUC0_GSUWGMRR0_K1_LBSPPB256_MIWT4_6_NTA4_NLCA2_SU0_SUM0_SUS128_VWB2_WG64_4_1_WGM8_WGMXCC8_WGMXCCGn1
    SolutionIndex: 158
    SolutionNameMin: Cijk_Alik_Bljk_F8NBS_STA_BH_Bias_HAS_SAB_SAVUserArgs_MT16x16x128_MI16x16x1_SN_LDSB0_GRVWB16_GSU1_GSUC0_GSUWGMRR0_K1_LBSPPB128_MIWT1_1_NTA4_NLCA2_SU0_SUM0_SUS128_VWB1_WG16_4_1_WGM8_WGMXCC8_WGMXCCGn1
    SolutionIndex: 159
    SolutionNameMin: Cijk_Alik_Bljk_F8NBS_STA_BH_Bias_HAS_SAB_SAVUserArgs_MT64x32x128_MI16x16x1_SN_LDSB0_GRVWB16_GSU1_GSUC0_GSUWGMRR0_K1_LBSPPB256_MIWT1_2_NTA4_NLCA2_SU0_SUM0_SUS128_VWB2_WG64_4_1_WGM8_WGMXCC8_WGMXCCGn1
    SolutionIndex: 160
    SolutionNameMin: Cijk_Alik_Bljk_F8NBS_STA_BH_Bias_HAS_SAB_SAVUserArgs_MT16x16x512_MI16x16x1_SN_LDSB0_GRVWB16_GSU1_GSUC0_GSUWGMRR0_K1_LBSPPB512_MIWT1_1_NTA4_NLCA8_SU8_SUM0_SUS512_VWB1_WG16_4_1_WGM1_WGMXCC8_WGMXCCGn1
    SolutionIndex: 161
    SolutionNameMin: Cijk_Alik_Bljk_F8NBS_STA_BH_Bias_HAS_SAB_SAVUserArgs_MT128x16x512_MI16x16x1_SN_LDSB0_GRVWB16_GSU1_GSUC0_GSUWGMRR0_K1_LBSPPB512_MIWT2_1_NTA4_NLCA8_SU0_SUM0_SUS512_VWB1_WG64_4_1_WGM8_WGMXCC8_WGMXCCGn1
    SolutionIndex: 162
    SolutionNameMin: Cijk_Alik_Bljk_F8NBS_STA_BH_Bias_HAS_SAB_SAVUserArgs_MT64x32x256_MI16x16x1_SN_LDSB0_GRVWB16_GSU1_GSUC0_GSUWGMRR0_K1_LBSPPB512_MIWT1_2_NTA0_NLCA4_SU0_SUM0_SUS256_VWB2_WG64_4_1_WGM8_WGMXCC8_WGMXCCGn1
    SolutionIndex: 163
    SolutionNameMin: Cijk_Alik_Bljk_F8NBS_STA_BH_Bias_HAS_SAB_SAVUserArgs_MT128x32x256_MI16x16x1_SN_LDSB0_GRVWB16_GSU1_GSUC0_GSUWGMRR0_K1_LBSPPB512_MIWT2_2_NTA4_NLCA4_SU0_SUM0_SUS256_VWB2_WG64_4_1_WGM8_WGMXCC8_WGMXCCGn1
    SolutionIndex: 164
    SolutionNameMin: Cijk_Alik_Bljk_F8NBS_STA_BH_Bias_HAS_SAB_SAVUserArgs_MT64x48x256_MI16x16x1_SN_LDSB0_GRVWB16_GSU1_GSUC0_GSUWGMRR0_K1_LBSPPB256_MIWT1_3_NTA4_NLCA4_SU0_SUM0_SUS256_VWB1_WG64_4_1_WGM8_WGMXCC8_WGMXCCGn1
    SolutionIndex: 165
    SolutionNameMin: Cijk_Alik_Bljk_F8NBS_STA_BH_Bias_HAS_SAB_SAVUserArgs_MT128x32x256_MI16x16x1_SN_LDSB0_GRVWB16_GSU1_GSUC0_GSUWGMRR0_K1_LBSPPB512_MIWT2_2_NTA0_NLCA4_SU0_SUM0_SUS256_VWB2_WG64_4_1_WGM8_WGMXCC8_WGMXCCGn1
    SolutionIndex: 166
    SolutionNameMin: Cijk_Alik_Bljk_F8NBS_STA_BH_Bias_HAS_SAB_SAVUserArgs_MT32x16x512_MI16x16x1_SN_LDSB0_GRVWB16_GSU1_GSUC0_GSUWGMRR0_K1_LBSPPB512_MIWT1_1_NTA4_NLCA8_SU0_SUM0_SUS512_VWB1_WG32_4_1_WGM1_WGMXCC8_WGMXCCGn1
    SolutionIndex: 167
    SolutionNameMin: Cijk_Alik_Bljk_F8NBS_STA_BH_Bias_HAS_SAB_SAVUserArgs_MT128x16x512_MI16x16x1_SN_LDSB0_GRVWB16_GSU1_GSUC0_GSUWGMRR0_K1_LBSPPB512_MIWT2_1_NTA0_NLCA8_SU0_SUM0_SUS512_VWB1_WG64_4_1_WGM8_WGMXCC8_WGMXCCGn1
    SolutionIndex: 168
    SolutionNameMin: Cijk_Alik_Bljk_F8NBS_STA_BH_Bias_HAS_SAB_SAVUserArgs_MT128x64x256_MI16x16x1_SN_LDSB1_GRVWB16_GSU1_GSUC0_GSUWGMRR0_K1_LBSPPB1024_MIWT2_4_NTA0_NLCA4_SU0_SUM0_SUS256_VWB4_WG64_4_1_WGM8_WGMXCC8_WGMXCCGn1
    SolutionIndex: 169
    SolutionNameMin: Cijk_Alik_Bljk_F8NBS_STA_BH_Bias_HAS_SAB_SAVUserArgs_MT128x112x256_MI16x16x1_SN_LDSB1_GRVWB16_GSU1_GSUC0_GSUWGMRR0_K1_LBSPPB256_MIWT2_7_NLCA4_SU0_SUM0_SUS256_VWB1_WG64_4_1_WGM1_WGMXCC8_WGMXCCGn1
    SolutionIndex: 170
    SolutionNameMin: Cijk_Alik_Bljk_F8NBS_STA_BH_Bias_HAS_SAB_SAVUserArgs_MT128x128x256_MI16x16x1_SN_LDSB1_GRVWB16_GSU1_GSUC0_GSUWGMRR0_K1_LBSPPB2048_MIWT2_8_NLCA4_SU0_SUM0_SUS256_VWB8_WG64_4_1_WGM1_WGMXCC8_WGMXCCGn1
    SolutionIndex: 171
    SolutionNameMin: Cijk_Alik_Bljk_F8NBS_STA_BH_Bias_HAS_SAB_SAVUserArgs_MT128x128x256_MI16x16x1_SN_LDSB1_GRVWB16_GSU1_GSUC0_GSUWGMRR0_K1_LBSPPB2048_MIWT2_8_NLCA4_SU8_SUM0_SUS256_VWB8_WG64_4_1_WGM1_WGMXCC8_WGMXCCGn1
    SolutionIndex: 172
    SolutionNameMin: Cijk_Alik_Bljk_F8NBS_STA_BH_Bias_HAS_SAB_SAVUserArgs_MT192x96x256_MI16x16x1_SN_LDSB1_GRVWB16_GSU1_GSUC0_GSUWGMRR0_K1_LBSPPB512_MIWT3_6_NLCA4_SU8_SUM0_SUS256_VWB2_WG64_4_1_WGM1_WGMXCC8_WGMXCCGn1
    SolutionIndex: 173
    SolutionNameMin: Cijk_Alik_Bljk_F8NBS_STA_BH_Bias_HAS_SAB_SAVUserArgs_MT320x64x128_MI16x16x1_SN_LDSB0_GRVWB16_GSU1_GSUC0_GSUWGMRR0_K1_LBSPPB512_MIWT5_4_NLCA2_SU0_SUM0_SUS128_VWB4_WG64_4_1_WGM1_WGMXCC8_WGMXCCGn1
    SolutionIndex: 174
    SolutionNameMin: Cijk_Alik_Bljk_F8NBS_STA_BH_Bias_HAS_SAB_SAVUserArgs_MT320x64x128_MI16x16x1_SN_LDSB0_GRVWB16_GSU1_GSUC0_GSUWGMRR0_K1_LBSPPB512_MIWT5_4_NLCA2_SU0_SUM0_SUS128_VWB4_WG64_4_1_WGM6_WGMXCC8_WGMXCCGn1
    SolutionIndex: 175
    SolutionNameMin: Cijk_Alik_Bljk_F8NBS_STA_BH_Bias_HAS_SAB_SAVUserArgs_MT128x160x128_MI16x16x1_SN_LDSB1_GRVWB16_GSU1_GSUC0_GSUWGMRR0_K1_LBSPPB256_MIWT2_10_NLCA2_SU0_SUM0_SUS128_VWB2_WG64_4_1_WGM1_WGMXCC8_WGMXCCGn1
    SolutionIndex: 176
    SolutionNameMin: Cijk_Alik_Bljk_F8NBS_STA_BH_Bias_HAS_SAB_SAVUserArgs_MT128x96x256_MI16x16x1_SN_LDSB1_GRVWB16_GSU1_GSUC0_GSUWGMRR0_K1_LBSPPB512_MIWT2_6_NLCA4_SU0_SUM0_SUS256_VWB2_WG64_4_1_WGM1_WGMXCC8_WGMXCCGn1
    SolutionIndex: 177
    SolutionNameMin: Cijk_Alik_Bljk_F8NBS_STA_BH_Bias_HAS_SAB_SAVUserArgs_MT128x96x256_MI16x16x1_SN_LDSB1_GRVWB16_GSU1_GSUC0_GSUWGMRR0_K1_LBSPPB512_MIWT2_6_NLCA4_SU8_SUM0_SUS256_VWB2_WG64_4_1_WGM1_WGMXCC8_WGMXCCGn1
    SolutionIndex: 178
    SolutionNameMin: Cijk_Alik_Bljk_F8NBS_STA_BH_Bias_HAS_SAB_SAVUserArgs_MT448x64x128_MI16x16x1_SN_LDSB0_GRVWB16_GSU1_GSUC0_GSUWGMRR0_K1_LBSPPB512_MIWT7_4_NLCA2_SU8_SUM0_SUS128_VWB4_WG64_4_1_WGM1_WGMXCC8_WGMXCCGn1
    SolutionIndex: 179
    SolutionNameMin: Cijk_Alik_Bljk_F8NBS_STA_BH_Bias_HAS_SAB_SAVUserArgs_MT448x64x128_MI16x16x1_SN_LDSB0_GRVWB16_GSU1_GSUC0_GSUWGMRR0_K1_LBSPPB512_MIWT7_4_NLCA2_SU0_SUM0_SUS128_VWB4_WG64_4_1_WGM6_WGMXCC8_WGMXCCGn1
    SolutionIndex: 180
    SolutionNameMin: Cijk_Alik_Bljk_F8NBS_STA_BH_Bias_HAS_SAB_SAVUserArgs_MT448x64x128_MI16x16x1_SN_LDSB0_GRVWB16_GSU1_GSUC0_GSUWGMRR0_K1_LBSPPB512_MIWT7_4_NLCA2_SU8_SUM0_SUS128_VWB4_WG64_4_1_WGM8_WGMXCC8_WGMXCCGn1
    SolutionIndex: 181
    SolutionNameMin: Cijk_Alik_Bljk_F8NBS_STA_BH_Bias_HAS_SAB_SAVUserArgs_MT448x64x128_MI16x16x1_SN_LDSB0_GRVWB16_GSU1_GSUC0_GSUWGMRR0_K1_LBSPPB512_MIWT7_4_NLCA2_SU8_SUM0_SUS128_VWB4_WG64_4_1_WGM6_WGMXCC8_WGMXCCGn1
    SolutionIndex: 182
    SolutionNameMin: Cijk_Alik_Bljk_F8NBS_STA_BH_Bias_HAS_SAB_SAVUserArgs_MT192x192x128_MI16x16x1_SN_LDSB0_GRVWB16_GSU1_GSUC0_GSUWGMRR0_K1_LBSPPB512_MIWT3_12_NLCA2_SU8_SUM0_SUS128_VWB4_WG64_4_1_WGM1_WGMXCC8_WGMXCCGn1
    SolutionIndex: 183
    SolutionNameMin: Cijk_Alik_Bljk_F8NBS_STA_BH_Bias_HAS_SAB_SAVUserArgs_MT192x192x128_MI16x16x1_SN_LDSB0_GRVWB16_GSU1_GSUC0_GSUWGMRR0_K1_LBSPPB512_MIWT3_12_NLCA2_SU0_SUM0_SUS128_VWB4_WG64_4_1_WGM1_WGMXCC8_WGMXCCGn1
    SolutionIndex: 184
    SolutionNameMin: Cijk_Alik_Bljk_F8NBS_STA_BH_Bias_HAS_SAB_SAVUserArgs_MT192x96x128_MI16x16x1_SN_LDSB0_GRVWB16_GSU1_GSUC0_GSUWGMRR0_K1_LBSPPB256_MIWT3_6_NLCA2_SU0_SUM0_SUS128_VWB2_WG64_4_1_WGM1_WGMXCC8_WGMXCCGn1
    SolutionIndex: 185
    SolutionNameMin: Cijk_Alik_Bljk_F8NBS_STA_BH_Bias_HAS_SAB_SAVUserArgs_MT320x64x128_MI16x16x1_SN_LDSB0_GRVWB16_GSU1_GSUC0_GSUWGMRR0_K1_LBSPPB512_MIWT5_4_NLCA2_SU8_SUM0_SUS128_VWB4_WG64_4_1_WGM1_WGMXCC8_WGMXCCGn1
    SolutionIndex: 186
    SolutionNameMin: Cijk_Alik_Bljk_F8NBS_STA_BH_Bias_HAS_SAB_SAVUserArgs_MT320x128x128_MI16x16x1_SN_LDSB0_GRVWB16_GSU1_GSUC0_GSUWGMRR0_K1_LBSPPB1024_MIWT5_8_NLCA2_SU8_SUM0_SUS128_VWB8_WG64_4_1_WGM1_WGMXCC8_WGMXCCGn1
    SolutionIndex: 187
    SolutionNameMin: Cijk_Alik_Bljk_F8NBS_STA_BH_Bias_HAS_SAB_SAVUserArgs_MT192x224x128_MI16x16x1_SN_LDSB0_GRVWB16_GSU1_GSUC0_GSUWGMRR0_K1_LBSPPB256_MIWT3_14_NLCA2_SU0_SUM0_SUS128_VWB2_WG64_4_1_WGM1_WGMXCC8_WGMXCCGn1
    SolutionIndex: 188
    SolutionNameMin: Cijk_Alik_Bljk_F8NBS_STA_BH_Bias_HAS_SAB_SAVUserArgs_MT192x224x128_MI16x16x1_SN_LDSB0_GRVWB16_GSU1_GSUC0_GSUWGMRR0_K1_LBSPPB256_MIWT3_14_NLCA2_SU8_SUM0_SUS128_VWB2_WG64_4_1_WGM8_WGMXCC8_WGMXCCGn1
    SolutionIndex: 189
    SolutionNameMin: Cijk_Alik_Bljk_F8NBS_STA_BH_Bias_HAS_SAB_SAVUserArgs_MT320x160x128_MI16x16x1_SN_LDSB0_GRVWB16_GSU1_GSUC0_GSUWGMRR0_K1_LBSPPB256_MIWT5_10_NLCA2_SU8_SUM0_SUS128_VWB2_WG64_4_1_WGM1_WGMXCC8_WGMXCCGn1
    SolutionIndex: 190
    SolutionNameMin: Cijk_Alik_Bljk_F8NBS_STA_BH_Bias_HAS_SAB_SAVUserArgs_MT320x160x128_MI16x16x1_SN_LDSB0_GRVWB16_GSU1_GSUC0_GSUWGMRR0_K1_LBSPPB256_MIWT5_10_NLCA2_SU0_SUM0_SUS128_VWB2_WG64_4_1_WGM1_WGMXCC8_WGMXCCGn1
    SolutionIndex: 191
    SolutionNameMin: Cijk_Alik_Bljk_F8NBS_STA_BH_Bias_HAS_SAB_SAVUserArgs_MT320x160x128_MI16x16x1_SN_LDSB0_GRVWB16_GSU1_GSUC0_GSUWGMRR0_K1_LBSPPB256_MIWT5_10_NLCA2_SU0_SUM0_SUS128_VWB2_WG64_4_1_WGM6_WGMXCC8_WGMXCCGn1
    SolutionIndex: 192
    SolutionNameMin: Cijk_Alik_Bljk_F8NBS_STA_BH_Bias_HAS_SAB_SAVUserArgs_MT320x160x128_MI16x16x1_SN_LDSB0_GRVWB16_GSU1_GSUC0_GSUWGMRR0_K1_LBSPPB256_MIWT5_10_NLCA2_SU0_SUM0_SUS128_VWB2_WG64_4_1_WGM8_WGMXCC8_WGMXCCGn1
    SolutionIndex: 193
    SolutionNameMin: Cijk_Alik_Bljk_F8NBS_STA_BH_Bias_HAS_SAB_SAVUserArgs_MT448x128x128_MI16x16x1_SN_LDSB0_GRVWB16_GSU1_GSUC0_GSUWGMRR0_K1_LBSPPB1024_MIWT7_8_NLCA2_SU8_SUM0_SUS128_VWB8_WG64_4_1_WGM8_WGMXCC8_WGMXCCGn1
    SolutionIndex: 194
    SolutionNameMin: Cijk_Alik_Bljk_F8NBS_STA_BH_Bias_HAS_SAB_SAVUserArgs_MT448x128x128_MI16x16x1_SN_LDSB0_GRVWB16_GSU1_GSUC0_GSUWGMRR0_K1_LBSPPB1024_MIWT7_8_NLCA2_SU0_SUM0_SUS128_VWB8_WG64_4_1_WGM1_WGMXCC8_WGMXCCGn1
    SolutionIndex: 195
    SolutionNameMin: Cijk_Alik_Bljk_F8NBS_STA_BH_Bias_HAS_SAB_SAVUserArgs_MT448x128x128_MI16x16x1_SN_LDSB0_GRVWB16_GSU1_GSUC0_GSUWGMRR0_K1_LBSPPB1024_MIWT7_8_NLCA2_SU0_SUM0_SUS128_VWB8_WG64_4_1_WGM8_WGMXCC8_WGMXCCGn1
    SolutionIndex: 196
    SolutionNameMin: Cijk_Alik_Bljk_F8NBS_STA_BH_Bias_HAS_SAB_SAVUserArgs_MT448x128x128_MI16x16x1_SN_LDSB0_GRVWB16_GSU1_GSUC0_GSUWGMRR0_K1_LBSPPB1024_MIWT7_8_NLCA2_SU0_SUM0_SUS128_VWB8_WG64_4_1_WGM6_WGMXCC8_WGMXCCGn1
    SolutionIndex: 197
    SolutionNameMin: Cijk_Alik_Bljk_F8NBS_STA_BH_Bias_HAS_SAB_SAVUserArgs_MT448x144x128_MI16x16x1_SN_LDSB0_GRVWB8_GSU1_GSUC0_GSUWGMRR0_K1_LBSPPB128_MIWT7_9_NLCA2_SU8_SUM0_SUS128_VWB1_WG64_4_1_WGM1_WGMXCC8_WGMXCCGn1
    SolutionIndex: 198
    SolutionNameMin: Cijk_Alik_Bljk_F8NBS_STA_BH_Bias_HAS_SAB_SAVUserArgs_MT448x144x128_MI16x16x1_SN_LDSB0_GRVWB8_GSU1_GSUC0_GSUWGMRR0_K1_LBSPPB128_MIWT7_9_NLCA2_SU0_SUM0_SUS128_VWB1_WG64_4_1_WGM1_WGMXCC8_WGMXCCGn1
    SolutionIndex: 199
    SolutionNameMin: Cijk_Alik_Bljk_F8NBS_STA_BH_Bias_HAS_SAB_SAVUserArgs_MT448x144x128_MI16x16x1_SN_LDSB0_GRVWB8_GSU1_GSUC0_GSUWGMRR0_K1_LBSPPB128_MIWT7_9_NLCA2_SU0_SUM0_SUS128_VWB1_WG64_4_1_WGM6_WGMXCC8_WGMXCCGn1
    SolutionIndex: 200
    SolutionNameMin: Cijk_Alik_Bljk_F8NBS_STA_BH_Bias_HAS_SAB_SAVUserArgs_MT448x144x128_MI16x16x1_SN_LDSB0_GRVWB8_GSU1_GSUC0_GSUWGMRR0_K1_LBSPPB128_MIWT7_9_NLCA2_SU8_SUM0_SUS128_VWB1_WG64_4_1_WGM8_WGMXCC8_WGMXCCGn1
    SolutionIndex: 201
    SolutionNameMin: Cijk_Alik_Bljk_F8NBS_STA_BH_Bias_HAS_SAB_SAVUserArgs_MT192x96x128_MI16x16x1_SN_LDSB0_GRVWB16_GSU1_GSUC0_GSUWGMRR0_K1_LBSPPB256_MIWT3_6_NLCA2_SU0_SUM0_SUS128_VWB2_WG64_4_1_WGM6_WGMXCC8_WGMXCCGn1
    SolutionIndex: 202
    SolutionNameMin: Cijk_Alik_Bljk_F8NBS_STA_BH_Bias_HAS_SAB_SAVUserArgs_MT192x128x128_MI16x16x1_SN_LDSB1_GRVWB16_GSU1_GSUC0_GSUWGMRR0_K1_LBSPPB1024_MIWT3_8_NLCA2_SU8_SUM0_SUS128_VWB8_WG64_4_1_WGM1_WGMXCC8_WGMXCCGn1
    SolutionIndex: 203
    SolutionNameMin: Cijk_Alik_Bljk_F8NBS_STA_BH_Bias_HAS_SAB_SAVUserArgs_MT192x128x128_MI16x16x1_SN_LDSB1_GRVWB16_GSU1_GSUC0_GSUWGMRR0_K1_LBSPPB1024_MIWT3_8_NLCA2_SU0_SUM0_SUS128_VWB8_WG64_4_1_WGM1_WGMXCC8_WGMXCCGn1
    SolutionIndex: 204
    SolutionNameMin: Cijk_Alik_Bljk_F8NBS_STA_BH_Bias_HAS_SAB_SAVUserArgs_MT192x96x128_MI16x16x1_SN_LDSB0_GRVWB16_GSU1_GSUC0_GSUWGMRR0_K1_LBSPPB256_MIWT3_6_NLCA2_SU8_SUM0_SUS128_VWB2_WG64_4_1_WGM1_WGMXCC8_WGMXCCGn1
    SolutionIndex: 205
    SolutionNameMin: Cijk_Alik_Bljk_F8NBS_STA_BH_Bias_HAS_SAB_SAVUserArgs_MT256x160x128_MI16x16x1_SN_LDSB0_GRVWB16_GSU1_GSUC0_GSUWGMRR0_K1_LBSPPB256_MIWT4_10_NLCA2_SU0_SUM0_SUS128_VWB2_WG64_4_1_WGM6_WGMXCC8_WGMXCCGn1
    SolutionIndex: 206
    SolutionNameMin: Cijk_Alik_Bljk_F8NBS_STA_BH_Bias_HAS_SAB_SAVUserArgs_MT128x160x128_MI16x16x1_SN_LDSB1_GRVWB16_GSU1_GSUC0_GSUWGMRR0_K1_LBSPPB256_MIWT2_10_NLCA2_SU8_SUM0_SUS128_VWB2_WG64_4_1_WGM1_WGMXCC8_WGMXCCGn1
    SolutionIndex: 207
    SolutionNameMin: Cijk_Alik_Bljk_F8NBS_STA_BH_Bias_HAS_SAB_SAVUserArgs_MT320x128x128_MI16x16x1_SN_LDSB0_GRVWB16_GSU1_GSUC0_GSUWGMRR0_K1_LBSPPB1024_MIWT5_8_NLCA2_SU0_SUM0_SUS128_VWB8_WG64_4_1_WGM8_WGMXCC8_WGMXCCGn1
    SolutionIndex: 208
    SolutionNameMin: Cijk_Alik_Bljk_F8NBS_STA_BH_Bias_HAS_SAB_SAVUserArgs_MT192x224x128_MI16x16x1_SN_LDSB0_GRVWB16_GSU1_GSUC0_GSUWGMRR0_K1_LBSPPB256_MIWT3_14_NLCA2_SU8_SUM0_SUS128_VWB2_WG64_4_1_WGM1_WGMXCC8_WGMXCCGn1
    SolutionIndex: 209
    SolutionNameMin: Cijk_Alik_Bljk_F8NBS_STA_BH_Bias_HAS_SAB_SAVUserArgs_MT320x160x128_MI16x16x1_SN_LDSB0_GRVWB16_GSU1_GSUC0_GSUWGMRR0_K1_LBSPPB256_MIWT5_10_NLCA2_SU8_SUM0_SUS128_VWB2_WG64_4_1_WGM6_WGMXCC8_WGMXCCGn1
    SolutionIndex: 210
    SolutionNameMin: Cijk_Alik_Bljk_F8NBS_STA_BH_Bias_HAS_SAB_SAVUserArgs_MT448x128x128_MI16x16x1_SN_LDSB0_GRVWB16_GSU1_GSUC0_GSUWGMRR0_K1_LBSPPB1024_MIWT7_8_NLCA2_SU8_SUM0_SUS128_VWB8_WG64_4_1_WGM1_WGMXCC8_WGMXCCGn1
    SolutionIndex: 211
    SolutionNameMin: Cijk_Alik_Bljk_F8NBS_STA_BH_Bias_HAS_SAB_SAVUserArgs_MT448x144x128_MI16x16x1_SN_LDSB0_GRVWB8_GSU1_GSUC0_GSUWGMRR0_K1_LBSPPB128_MIWT7_9_NLCA2_SU0_SUM0_SUS128_VWB1_WG64_4_1_WGM8_WGMXCC8_WGMXCCGn1
    SolutionIndex: 212
    SolutionNameMin: Cijk_Alik_Bljk_F8NBS_STA_BH_Bias_HAS_SAB_SAVUserArgs_MT448x128x128_MI16x16x1_SN_LDSB0_GRVWB16_GSU1_GSUC0_GSUWGMRR0_K1_LBSPPB1024_MIWT7_8_NLCA2_SU8_SUM0_SUS128_VWB8_WG64_4_1_WGM6_WGMXCC8_WGMXCCGn1
    SolutionIndex: 213
    SolutionNameMin: Cijk_Alik_Bljk_F8NBS_STA_BH_Bias_HAS_SAB_SAVUserArgs_MT448x144x128_MI16x16x1_SN_LDSB0_GRVWB8_GSU1_GSUC0_GSUWGMRR0_K1_LBSPPB128_MIWT7_9_NLCA2_SU8_SUM0_SUS128_VWB1_WG64_4_1_WGM6_WGMXCC8_WGMXCCGn1
    SolutionIndex: 214
    SolutionNameMin: Cijk_Alik_Bljk_F8NBS_STA_BH_Bias_HAS_SAB_SAVUserArgs_MT256x96x128_MI16x16x1_SN_LDSB0_GRVWB16_GSU1_GSUC0_GSUWGMRR0_K1_LBSPPB256_MIWT4_6_NLCA2_SU0_SUM0_SUS128_VWB2_WG64_4_1_WGM1_WGMXCC8_WGMXCCGn1
    SolutionIndex: 215
    SolutionNameMin: Cijk_Alik_Bljk_F8NBS_STA_BH_Bias_HAS_SAB_SAVUserArgs_MT128x96x256_MI16x16x1_SN_LDSB1_GRVWB16_GSU1_GSUC0_GSUWGMRR0_K1_LBSPPB512_MIWT2_6_NLCA4_SU0_SUM0_SUS256_VWB2_WG64_4_1_WGM6_WGMXCC8_WGMXCCGn1
    SolutionIndex: 216
    SolutionNameMin: Cijk_Alik_Bljk_F8NBS_STA_BH_Bias_HAS_SAB_SAVUserArgs_MT128x160x128_MI16x16x1_SN_LDSB1_GRVWB16_GSU1_GSUC0_GSUWGMRR0_K1_LBSPPB256_MIWT2_10_NLCA2_SU0_SUM0_SUS128_VWB2_WG64_4_1_WGM8_WGMXCC8_WGMXCCGn1
    SolutionIndex: 217
    SolutionNameMin: Cijk_Alik_Bljk_F8NBS_STA_BH_Bias_HAS_SAB_SAVUserArgs_MT128x160x128_MI16x16x1_SN_LDSB1_GRVWB16_GSU1_GSUC0_GSUWGMRR0_K1_LBSPPB256_MIWT2_10_NLCA2_SU0_SUM0_SUS128_VWB2_WG64_4_1_WGM6_WGMXCC8_WGMXCCGn1
    SolutionIndex: 218
    SolutionNameMin: Cijk_Alik_Bljk_F8NBS_STA_BH_Bias_HAS_SAB_SAVUserArgs_MT320x192x128_MI16x16x1_SN_LDSB0_GRVWB16_GSU1_GSUC0_GSUWGMRR0_K1_LBSPPB512_MIWT5_12_NLCA2_SU8_SUM0_SUS128_VWB4_WG64_4_1_WGM8_WGMXCC8_WGMXCCGn1
    SolutionIndex: 219
    SolutionNameMin: Cijk_Alik_Bljk_F8NBS_STA_BH_Bias_HAS_SAB_SAVUserArgs_MT512x128x128_MI16x16x1_SN_LDSB0_GRVWB16_GSU1_GSUC0_GSUWGMRR0_K1_LBSPPB1024_MIWT8_8_NLCA2_SU0_SUM0_SUS128_VWB8_WG64_4_1_WGM1_WGMXCC8_WGMXCCGn1
    SolutionIndex: 220
    SolutionNameMin: Cijk_Alik_Bljk_F8NBS_STA_BH_Bias_HAS_SAB_SAVUserArgs_MT256x96x128_MI16x16x1_SN_LDSB0_GRVWB16_GSU1_GSUC0_GSUWGMRR0_K1_LBSPPB256_MIWT4_6_NLCA2_SU0_SUM0_SUS128_VWB2_WG64_4_1_WGM6_WGMXCC8_WGMXCCGn1
    SolutionIndex: 221
    SolutionNameMin: Cijk_Alik_Bljk_F8NBS_STA_BH_Bias_HAS_SAB_SAVUserArgs_MT256x96x128_MI16x16x1_SN_LDSB0_GRVWB16_GSU1_GSUC0_GSUWGMRR0_K1_LBSPPB256_MIWT4_6_NLCA2_SU0_SUM0_SUS128_VWB2_WG64_4_1_WGM8_WGMXCC8_WGMXCCGn1
    SolutionIndex: 222
    SolutionNameMin: Cijk_Alik_Bljk_F8NBS_STA_BH_Bias_HAS_SAB_SAVUserArgs_MT256x160x128_MI16x16x1_SN_LDSB0_GRVWB16_GSU1_GSUC0_GSUWGMRR0_K1_LBSPPB256_MIWT4_10_NLCA2_SU0_SUM0_SUS128_VWB2_WG64_4_1_WGM8_WGMXCC8_WGMXCCGn1
    SolutionIndex: 223
    SolutionNameMin: Cijk_Alik_Bljk_F8NBS_STA_BH_Bias_HAS_SAB_SAVUserArgs_MT256x224x128_MI16x16x1_SN_LDSB0_GRVWB16_GSU1_GSUC0_GSUWGMRR0_K1_LBSPPB256_MIWT4_14_NLCA2_SU8_SUM0_SUS128_VWB2_WG64_4_1_WGM1_WGMXCC8_WGMXCCGn1
    SolutionIndex: 224
    SolutionNameMin: Cijk_Alik_Bljk_F8NBS_STA_BH_Bias_HAS_SAB_SAVUserArgs_MT256x224x128_MI16x16x1_SN_LDSB0_GRVWB16_GSU1_GSUC0_GSUWGMRR0_K1_LBSPPB256_MIWT4_14_NLCA2_SU0_SUM0_SUS128_VWB2_WG64_4_1_WGM8_WGMXCC8_WGMXCCGn1
    SolutionIndex: 225
    SolutionNameMin: Cijk_Alik_Bljk_F8NBS_STA_BH_Bias_HAS_SAB_SAVUserArgs_MT256x224x128_MI16x16x1_SN_LDSB0_GRVWB16_GSU1_GSUC0_GSUWGMRR0_K1_LBSPPB256_MIWT4_14_NLCA2_SU0_SUM0_SUS128_VWB2_WG64_4_1_WGM6_WGMXCC8_WGMXCCGn1
    SolutionIndex: 226
    SolutionNameMin: Cijk_Alik_Bljk_F8NBS_STA_BH_Bias_HAS_SAB_SAVUserArgs_MT384x160x128_MI16x16x1_SN_LDSB0_GRVWB16_GSU1_GSUC0_GSUWGMRR0_K1_LBSPPB256_MIWT6_10_NLCA2_SU8_SUM0_SUS128_VWB2_WG64_4_1_WGM6_WGMXCC8_WGMXCCGn1
    SolutionIndex: 227
    SolutionNameMin: Cijk_Alik_Bljk_F8NBS_STA_BH_Bias_HAS_SAB_SAVUserArgs_MT512x128x128_MI16x16x1_SN_LDSB0_GRVWB16_GSU1_GSUC0_GSUWGMRR0_K1_LBSPPB1024_MIWT8_8_NLCA2_SU0_SUM0_SUS128_VWB8_WG64_4_1_WGM8_WGMXCC8_WGMXCCGn1
    SolutionIndex: 228
    SolutionNameMin: Cijk_Alik_Bljk_F8NBS_STA_BH_Bias_HAS_SAB_SAVUserArgs_MT384x160x128_MI16x16x1_SN_LDSB0_GRVWB16_GSU1_GSUC0_GSUWGMRR0_K1_LBSPPB256_MIWT6_10_NLCA2_SU0_SUM0_SUS128_VWB2_WG64_4_1_WGM8_WGMXCC8_WGMXCCGn1
    SolutionIndex: 229
    SolutionNameMin: Cijk_Alik_Bljk_F8NBS_STA_BH_Bias_HAS_SAB_SAVUserArgs_MT384x160x128_MI16x16x1_SN_LDSB0_GRVWB16_GSU1_GSUC0_GSUWGMRR0_K1_LBSPPB256_MIWT6_10_NLCA2_SU8_SUM0_SUS128_VWB2_WG64_4_1_WGM8_WGMXCC8_WGMXCCGn1
    SolutionIndex: 230
    SolutionNameMin: Cijk_Alik_Bljk_F8NBS_STA_BH_Bias_HAS_SAB_SAVUserArgs_MT320x192x128_MI16x16x1_SN_LDSB0_GRVWB16_GSU1_GSUC0_GSUWGMRR0_K1_LBSPPB512_MIWT5_12_NLCA2_SU8_SUM0_SUS128_VWB4_WG64_4_1_WGM6_WGMXCC8_WGMXCCGn1
    SolutionIndex: 231
    SolutionNameMin: Cijk_Alik_Bljk_F8NBS_STA_BH_Bias_HAS_SAB_SAVUserArgs_MT256x224x128_MI16x16x1_SN_LDSB0_GRVWB16_GSU1_GSUC0_GSUWGMRR0_K1_LBSPPB256_MIWT4_14_NLCA2_SU8_SUM0_SUS128_VWB2_WG64_4_1_WGM6_WGMXCC8_WGMXCCGn1
    SolutionIndex: 232
    SolutionNameMin: Cijk_Alik_Bljk_F8NBS_STA_BH_Bias_HAS_SAB_SAVUserArgs_MT256x96x128_MI16x16x1_SN_LDSB0_GRVWB16_GSU1_GSUC0_GSUWGMRR0_K1_LBSPPB256_MIWT4_6_NLCA2_SU8_SUM0_SUS128_VWB2_WG64_4_1_WGM8_WGMXCC8_WGMXCCGn1
    SolutionIndex: 233
    SolutionNameMin: Cijk_Alik_Bljk_F8NBS_STA_BH_Bias_HAS_SAB_SAVUserArgs_MT320x160x128_MI16x16x1_SN_LDSB0_GRVWB16_GSU1_GSUC0_GSUWGMRR0_K1_LBSPPB256_MIWT5_10_NLCA2_SU8_SUM0_SUS128_VWB2_WG64_4_1_WGM8_WGMXCC8_WGMXCCGn1
    SolutionIndex: 234
    SolutionNameMin: Cijk_Alik_Bljk_F8NBS_STA_BH_Bias_HAS_SAB_SAVUserArgs_MT256x192x128_MI16x16x1_SN_LDSB0_GRVWB16_GSU1_GSUC0_GSUWGMRR0_K1_LBSPPB512_MIWT4_12_NLCA2_SU8_SUM0_SUS128_VWB4_WG64_4_1_WGM8_WGMXCC8_WGMXCCGn1
    SolutionIndex: 235
    SolutionNameMin: Cijk_Alik_Bljk_F8NBS_STA_BH_Bias_HAS_SAB_SAVUserArgs_MT256x192x128_MI16x16x1_SN_LDSB0_GRVWB16_GSU1_GSUC0_GSUWGMRR0_K1_LBSPPB512_MIWT4_12_NLCA2_SU0_SUM0_SUS128_VWB4_WG64_4_1_WGM8_WGMXCC8_WGMXCCGn1
    SolutionIndex: 236
    SolutionNameMin: Cijk_Alik_Bljk_F8NBS_STA_BH_Bias_HAS_SAB_SAVUserArgs_MT256x192x128_MI16x16x1_SN_LDSB0_GRVWB16_GSU1_GSUC0_GSUWGMRR0_K1_LBSPPB512_MIWT4_12_NLCA2_SU0_SUM0_SUS128_VWB4_WG64_4_1_WGM6_WGMXCC8_WGMXCCGn1
    SolutionIndex: 237
    SolutionNameMin: Cijk_Alik_Bljk_F8NBS_STA_BH_Bias_HAS_SAB_SAVUserArgs_MT256x224x128_MI16x16x1_SN_LDSB0_GRVWB16_GSU1_GSUC0_GSUWGMRR0_K1_LBSPPB256_MIWT4_14_NLCA2_SU8_SUM0_SUS128_VWB2_WG64_4_1_WGM8_WGMXCC8_WGMXCCGn1
    SolutionIndex: 238
    SolutionNameMin: Cijk_Alik_Bljk_F8NBS_STA_BH_Bias_HAS_SAB_SAVUserArgs_MT256x64x256_MI16x16x1_SN_LDSB1_GRVWB16_GSU1_GSUC0_GSUWGMRR0_K1_LBSPPB1024_MIWT4_4_NLCA4_SU0_SUM0_SUS256_VWB4_WG64_4_1_WGM1_WGMXCC8_WGMXCCGn1
    SolutionIndex: 239
    SolutionNameMin: Cijk_Alik_Bljk_F8NBS_STA_BH_Bias_HAS_SAB_SAVUserArgs_MT256x80x256_MI16x16x1_SN_LDSB1_GRVWB16_GSU1_GSUC0_GSUWGMRR0_K1_LBSPPB256_MIWT4_5_NLCA4_SU0_SUM0_SUS256_VWB1_WG64_4_1_WGM6_WGMXCC8_WGMXCCGn1
    SolutionIndex: 240
    SolutionNameMin: Cijk_Alik_Bljk_F8NBS_STA_BH_Bias_HAS_SAB_SAVUserArgs_MT256x96x128_MI16x16x1_SN_LDSB0_GRVWB16_GSU1_GSUC0_GSUWGMRR0_K1_LBSPPB256_MIWT4_6_NLCA2_SU8_SUM0_SUS128_VWB2_WG64_4_1_WGM1_WGMXCC8_WGMXCCGn1
    SolutionIndex: 241
    SolutionNameMin: Cijk_Alik_Bljk_F8NBS_STA_BH_Bias_HAS_SAB_SAVUserArgs_MT256x112x128_MI16x16x1_SN_LDSB1_GRVWB8_GSU1_GSUC0_GSUWGMRR0_K1_LBSPPB128_MIWT4_7_NLCA2_SU8_SUM0_SUS128_VWB1_WG64_4_1_WGM1_WGMXCC8_WGMXCCGn1
    SolutionIndex: 242
    SolutionNameMin: Cijk_Alik_Bljk_F8NBS_STA_BH_Bias_HAS_SAB_SAVUserArgs_MT256x112x128_MI16x16x1_SN_LDSB1_GRVWB8_GSU1_GSUC0_GSUWGMRR0_K1_LBSPPB128_MIWT4_7_NLCA2_SU0_SUM0_SUS128_VWB1_WG64_4_1_WGM1_WGMXCC8_WGMXCCGn1
    SolutionIndex: 243
    SolutionNameMin: Cijk_Alik_Bljk_F8NBS_STA_BH_Bias_HAS_SAB_SAVUserArgs_MT256x128x128_MI16x16x1_SN_LDSB1_GRVWB16_GSU1_GSUC0_GSUWGMRR0_K1_LBSPPB1024_MIWT4_8_NLCA2_SU0_SUM0_SUS128_VWB8_WG64_4_1_WGM8_WGMXCC8_WGMXCCGn1
    SolutionIndex: 244
    SolutionNameMin: Cijk_Alik_Bljk_F8NBS_STA_BH_Bias_HAS_SAB_SAVUserArgs_MT256x128x128_MI16x16x1_SN_LDSB1_GRVWB16_GSU1_GSUC0_GSUWGMRR0_K1_LBSPPB1024_MIWT4_8_NLCA2_SU0_SUM0_SUS128_VWB8_WG64_4_1_WGM1_WGMXCC8_WGMXCCGn1
    SolutionIndex: 245
    SolutionNameMin: Cijk_Alik_Bljk_F8NBS_STA_BH_Bias_HAS_SAB_SAVUserArgs_MT512x64x128_MI16x16x1_SN_LDSB0_GRVWB16_GSU1_GSUC0_GSUWGMRR0_K1_LBSPPB512_MIWT8_4_NLCA2_SU8_SUM0_SUS128_VWB4_WG64_4_1_WGM8_WGMXCC8_WGMXCCGn1
    SolutionIndex: 246
    SolutionNameMin: Cijk_Alik_Bljk_F8NBS_STA_BH_Bias_HAS_SAB_SAVUserArgs_MT256x160x128_MI16x16x1_SN_LDSB0_GRVWB16_GSU1_GSUC0_GSUWGMRR0_K1_LBSPPB256_MIWT4_10_NLCA2_SU0_SUM0_SUS128_VWB2_WG64_4_1_WGM1_WGMXCC8_WGMXCCGn1
    SolutionIndex: 247
    SolutionNameMin: Cijk_Alik_Bljk_F8NBS_STA_BH_Bias_HAS_SAB_SAVUserArgs_MT256x192x128_MI16x16x1_SN_LDSB0_GRVWB16_GSU1_GSUC0_GSUWGMRR0_K1_LBSPPB512_MIWT4_12_NLCA2_SU0_SUM0_SUS128_VWB4_WG64_4_1_WGM1_WGMXCC8_WGMXCCGn1
    SolutionIndex: 248
    SolutionNameMin: Cijk_Alik_Bljk_F8NBS_STA_BH_Bias_HAS_SAB_SAVUserArgs_MT256x176x128_MI16x16x1_SN_LDSB0_GRVWB8_GSU1_GSUC0_GSUWGMRR0_K1_LBSPPB128_MIWT4_11_NLCA2_SU0_SUM0_SUS128_VWB1_WG64_4_1_WGM1_WGMXCC8_WGMXCCGn1
    SolutionIndex: 249
    SolutionNameMin: Cijk_Alik_Bljk_F8NBS_STA_BH_Bias_HAS_SAB_SAVUserArgs_MT256x192x128_MI16x16x1_SN_LDSB0_GRVWB16_GSU1_GSUC0_GSUWGMRR0_K1_LBSPPB512_MIWT4_12_NLCA2_SU8_SUM0_SUS128_VWB4_WG64_4_1_WGM6_WGMXCC8_WGMXCCGn1
    SolutionIndex: 250
    SolutionNameMin: Cijk_Alik_Bljk_F8NBS_STA_BH_Bias_HAS_SAB_SAVUserArgs_MT256x192x128_MI16x16x1_SN_LDSB0_GRVWB16_GSU1_GSUC0_GSUWGMRR0_K1_LBSPPB512_MIWT4_12_NLCA2_SU8_SUM0_SUS128_VWB4_WG64_4_1_WGM1_WGMXCC8_WGMXCCGn1
    SolutionIndex: 251
    SolutionNameMin: Cijk_Alik_Bljk_F8NBS_STA_BH_Bias_HAS_SAB_SAVUserArgs_MT256x224x128_MI16x16x1_SN_LDSB0_GRVWB16_GSU1_GSUC0_GSUWGMRR0_K1_LBSPPB256_MIWT4_14_NLCA2_SU0_SUM0_SUS128_VWB2_WG64_4_1_WGM1_WGMXCC8_WGMXCCGn1
    SolutionIndex: 252
    SolutionNameMin: Cijk_Alik_Bljk_F8NBS_STA_BH_Bias_HAS_SAB_SAVUserArgs_MT512x128x128_MI16x16x1_SN_LDSB0_GRVWB16_GSU1_GSUC0_GSUWGMRR0_K1_LBSPPB1024_MIWT8_8_NLCA2_SU8_SUM0_SUS128_VWB8_WG64_4_1_WGM8_WGMXCC8_WGMXCCGn1
    SolutionIndex: 253
    SolutionNameMin: Cijk_Alik_Bljk_F8NBS_STA_BH_Bias_HAS_SAB_SAVUserArgs_MT512x128x128_MI16x16x1_SN_LDSB0_GRVWB16_GSU1_GSUC0_GSUWGMRR0_K1_LBSPPB1024_MIWT8_8_NLCA2_SU0_SUM0_SUS128_VWB8_WG64_4_1_WGM6_WGMXCC8_WGMXCCGn1
    SolutionIndex: 254
    SolutionNameMin: Cijk_Alik_Bljk_F8NBS_STA_BH_Bias_HAS_SAB_SAVUserArgs_MT256x160x128_MI16x16x1_SN_LDSB0_GRVWB16_GSU1_GSUC0_GSUWGMRR0_K1_LBSPPB256_MIWT4_10_NLCA2_SU8_SUM0_SUS128_VWB2_WG64_4_1_WGM1_WGMXCC8_WGMXCCGn1
    SolutionIndex: 255
    SolutionNameMin: Cijk_Alik_Bljk_F8NBS_STA_BH_Bias_HAS_SAB_SAVUserArgs_MT512x128x128_MI16x16x1_SN_LDSB0_GRVWB16_GSU1_GSUC0_GSUWGMRR0_K1_LBSPPB1024_MIWT8_8_NLCA2_SU8_SUM0_SUS128_VWB8_WG64_4_1_WGM1_WGMXCC8_WGMXCCGn1
    SolutionIndex: 256
    SolutionNameMin: Cijk_Alik_Bljk_F8NBS_STA_BH_Bias_HAS_SAB_SAVUserArgs_MT256x96x128_MI16x16x1_SN_LDSB0_GRVWB16_GSU1_GSUC0_GSUWGMRR0_K1_LBSPPB256_MIWT4_6_NLCA2_SU8_SUM0_SUS128_VWB2_WG64_4_1_WGM6_WGMXCC8_WGMXCCGn1
    SolutionIndex: 257
    SolutionNameMin: Cijk_Alik_Bljk_F8NBS_STA_BH_Bias_HAS_SAB_SAVUserArgs_MT256x128x128_MI16x16x1_SN_LDSB1_GRVWB16_GSU1_GSUC0_GSUWGMRR0_K1_LBSPPB1024_MIWT4_8_NLCA2_SU8_SUM0_SUS128_VWB8_WG64_4_1_WGM1_WGMXCC8_WGMXCCGn1
    SolutionIndex: 258
    SolutionNameMin: Cijk_Alik_Bljk_F8NBS_STA_BH_Bias_HAS_SAB_SAVUserArgs_MT256x128x128_MI16x16x1_SN_LDSB1_GRVWB16_GSU1_GSUC0_GSUWGMRR0_K1_LBSPPB1024_MIWT4_8_NLCA2_SU8_SUM0_SUS128_VWB8_WG64_4_1_WGM8_WGMXCC8_WGMXCCGn1
    SolutionIndex: 259
    SolutionNameMin: Cijk_Alik_Bljk_F8NBS_STA_BH_Bias_HAS_SAB_SAVUserArgs_MT256x160x128_MI16x16x1_SN_LDSB0_GRVWB16_GSU1_GSUC0_GSUWGMRR0_K1_LBSPPB256_MIWT4_10_NLCA2_SU8_SUM0_SUS128_VWB2_WG64_4_1_WGM6_WGMXCC8_WGMXCCGn1
    SolutionIndex: 260
    SolutionNameMin: Cijk_Alik_Bljk_F8NBS_STA_BH_Bias_HAS_SAB_SAVUserArgs_MT384x160x128_MI16x16x1_SN_LDSB0_GRVWB16_GSU1_GSUC0_GSUWGMRR0_K1_LBSPPB256_MIWT6_10_NLCA2_SU0_SUM0_SUS128_VWB2_WG64_4_1_WGM6_WGMXCC8_WGMXCCGn1
    SolutionIndex: 261
    SolutionNameMin: Cijk_Alik_Bljk_F8NBS_STA_BH_Bias_HAS_SAB_SAVUserArgs_MT320x64x128_MI16x16x1_SN_LDSB0_GRVWB16_GSU1_GSUC0_GSUWGMRR0_K1_LBSPPB512_MIWT5_4_NLCA2_SU0_SUM0_SUS128_VWB4_WG64_4_1_WGM8_WGMXCC8_WGMXCCGn1
    SolutionIndex: 262
    SolutionNameMin: Cijk_Alik_Bljk_F8NBS_STA_BH_Bias_HAS_SAB_SAVUserArgs_MT256x80x128_MI16x16x1_SN_LDSB0_GRVWB8_GSU1_GSUC0_GSUWGMRR0_K1_LBSPPB128_MIWT4_5_NLCA2_SU0_SUM0_SUS128_VWB1_WG64_4_1_WGM8_WGMXCC8_WGMXCCGn1
    SolutionIndex: 263
    SolutionNameMin: Cijk_Alik_Bljk_F8NBS_STA_BH_Bias_HAS_SAB_SAVUserArgs_MT192x128x128_MI16x16x1_SN_LDSB1_GRVWB16_GSU1_GSUC0_GSUWGMRR0_K1_LBSPPB1024_MIWT3_8_NLCA2_SU8_SUM0_SUS128_VWB8_WG64_4_1_WGM6_WGMXCC8_WGMXCCGn1
    SolutionIndex: 264
    SolutionNameMin: Cijk_Alik_Bljk_F8NBS_STA_BH_Bias_HAS_SAB_SAVUserArgs_MT192x128x128_MI16x16x1_SN_LDSB1_GRVWB16_GSU1_GSUC0_GSUWGMRR0_K1_LBSPPB1024_MIWT3_8_NLCA2_SU0_SUM0_SUS128_VWB8_WG64_4_1_WGM6_WGMXCC8_WGMXCCGn1
    SolutionIndex: 265
    SolutionNameMin: Cijk_Alik_Bljk_F8NBS_STA_BH_Bias_HAS_SAB_SAVUserArgs_MT320x80x128_MI16x16x1_SN_LDSB0_GRVWB8_GSU1_GSUC0_GSUWGMRR0_K1_LBSPPB128_MIWT5_5_NLCA2_SU0_SUM0_SUS128_VWB1_WG64_4_1_WGM6_WGMXCC8_WGMXCCGn1
    SolutionIndex: 266
    SolutionNameMin: Cijk_Alik_Bljk_F8NBS_STA_BH_Bias_HAS_SAB_SAVUserArgs_MT192x112x128_MI16x16x1_SN_LDSB1_GRVWB8_GSU1_GSUC0_GSUWGMRR0_K1_LBSPPB128_MIWT3_7_NLCA2_SU0_SUM0_SUS128_VWB1_WG64_4_1_WGM6_WGMXCC8_WGMXCCGn1
    SolutionIndex: 267
    SolutionNameMin: Cijk_Alik_Bljk_F8NBS_STA_BH_Bias_HAS_SAB_SAVUserArgs_MT192x128x128_MI16x16x1_SN_LDSB1_GRVWB16_GSU1_GSUC0_GSUWGMRR0_K1_LBSPPB1024_MIWT3_8_NLCA2_SU0_SUM0_SUS128_VWB8_WG64_4_1_WGM8_WGMXCC8_WGMXCCGn1
    SolutionIndex: 268
    SolutionNameMin: Cijk_Alik_Bljk_F8NBS_STA_BH_Bias_HAS_SAB_SAVUserArgs_MT256x256x128_MI16x16x1_SN_LDSB1_GRVWB16_GSU1_GSUC0_GSUWGMRR0_K1_LBSPPB2048_MIWT4_16_NLCA2_SU0_SUM0_SUS128_VWB16_WG64_4_1_WGM6_WGMXCC8_WGMXCCGn1
    SolutionIndex: 269
    SolutionNameMin: Cijk_Alik_Bljk_F8NBS_STA_BH_Bias_HAS_SAB_SAVUserArgs_MT320x80x128_MI16x16x1_SN_LDSB0_GRVWB8_GSU1_GSUC0_GSUWGMRR0_K1_LBSPPB128_MIWT5_5_NLCA2_SU0_SUM0_SUS128_VWB1_WG64_4_1_WGM8_WGMXCC8_WGMXCCGn1
    SolutionIndex: 270
    SolutionNameMin: Cijk_Alik_Bljk_F8NBS_STA_BH_Bias_HAS_SAB_SAVUserArgs_MT320x208x128_MI16x16x1_SN_LDSB1_GRVWB8_GSU1_GSUC0_GSUWGMRR0_K1_LBSPPB128_MIWT5_13_NLCA2_SU0_SUM0_SUS128_VWB1_WG64_4_1_WGM8_WGMXCC8_WGMXCCGn1
    SolutionIndex: 271
    SolutionNameMin: Cijk_Alik_Bljk_F8NBS_STA_BH_Bias_HAS_SAB_SAVUserArgs_MT192x128x128_MI16x16x1_SN_LDSB1_GRVWB16_GSU1_GSUC0_GSUWGMRR0_K1_LBSPPB1024_MIWT3_8_NLCA2_SU8_SUM0_SUS128_VWB8_WG64_4_1_WGM8_WGMXCC8_WGMXCCGn1
    SolutionIndex: 272
    SolutionNameMin: Cijk_Alik_Bljk_F8NBS_STA_BH_Bias_HAS_SAB_SAVUserArgs_MT320x128x128_MI16x16x1_SN_LDSB0_GRVWB16_GSU1_GSUC0_GSUWGMRR0_K1_LBSPPB1024_MIWT5_8_NLCA2_SU0_SUM0_SUS128_VWB8_WG64_4_1_WGM6_WGMXCC8_WGMXCCGn1
    SolutionIndex: 273
    SolutionNameMin: Cijk_Alik_Bljk_F8NBS_STA_BH_Bias_HAS_SAB_SAVUserArgs_MT192x256x128_MI16x16x1_SN_LDSB1_GRVWB16_GSU1_GSUC0_GSUWGMRR0_K1_LBSPPB2048_MIWT3_16_NLCA2_SU0_SUM0_SUS128_VWB16_WG64_4_1_WGM8_WGMXCC8_WGMXCCGn1
    SolutionIndex: 274
    SolutionNameMin: Cijk_Alik_Bljk_F8NBS_STA_BH_Bias_HAS_SAB_SAVUserArgs_MT192x256x128_MI16x16x1_SN_LDSB1_GRVWB16_GSU1_GSUC0_GSUWGMRR0_K1_LBSPPB2048_MIWT3_16_NLCA2_SU0_SUM0_SUS128_VWB16_WG64_4_1_WGM6_WGMXCC8_WGMXCCGn1
    SolutionIndex: 275
    SolutionNameMin: Cijk_Alik_Bljk_F8NBS_STA_BH_Bias_HAS_SAB_SAVUserArgs_MT192x256x128_MI16x16x1_SN_LDSB1_GRVWB16_GSU1_GSUC0_GSUWGMRR0_K1_LBSPPB2048_MIWT3_16_NLCA2_SU8_SUM0_SUS128_VWB16_WG64_4_1_WGM8_WGMXCC8_WGMXCCGn1
    SolutionIndex: 276
    SolutionNameMin: Cijk_Alik_Bljk_F8NBS_STA_BH_Bias_HAS_SAB_SAVUserArgs_MT320x176x128_MI16x16x1_SN_LDSB0_GRVWB8_GSU1_GSUC0_GSUWGMRR0_K1_LBSPPB128_MIWT5_11_NLCA2_SU0_SUM0_SUS128_VWB1_WG64_4_1_WGM8_WGMXCC8_WGMXCCGn1
    SolutionIndex: 277
    SolutionNameMin: Cijk_Alik_Bljk_F8NBS_STA_BH_Bias_HAS_SAB_SAVUserArgs_MT256x144x128_MI16x16x1_SN_LDSB0_GRVWB8_GSU1_GSUC0_GSUWGMRR0_K1_LBSPPB128_MIWT4_9_NLCA2_SU8_SUM0_SUS128_VWB1_WG64_4_1_WGM6_WGMXCC8_WGMXCCGn1
    SolutionIndex: 278
    SolutionNameMin: Cijk_Alik_Bljk_F8NBS_STA_BH_Bias_HAS_SAB_SAVUserArgs_MT320x176x128_MI16x16x1_SN_LDSB0_GRVWB8_GSU1_GSUC0_GSUWGMRR0_K1_LBSPPB128_MIWT5_11_NLCA2_SU0_SUM0_SUS128_VWB1_WG64_4_1_WGM6_WGMXCC8_WGMXCCGn1
    SolutionIndex: 279
    SolutionNameMin: Cijk_Alik_Bljk_F8NBS_STA_BH_Bias_HAS_SAB_SAVUserArgs_MT256x256x128_MI16x16x1_SN_LDSB1_GRVWB16_GSU1_GSUC0_GSUWGMRR0_K1_LBSPPB2048_MIWT4_16_NLCA2_SU8_SUM0_SUS128_VWB16_WG64_4_1_WGM6_WGMXCC8_WGMXCCGn1
    SolutionIndex: 280
    SolutionNameMin: Cijk_Alik_Bljk_F8NBS_STA_BH_Bias_HAS_SAB_SAVUserArgs_MT256x256x128_MI16x16x1_SN_LDSB1_GRVWB16_GSU1_GSUC0_GSUWGMRR0_K1_LBSPPB2048_MIWT4_16_NLCA2_SU8_SUM0_SUS128_VWB16_WG64_4_1_WGM8_WGMXCC8_WGMXCCGn1
    SolutionIndex: 281
    SolutionNameMin: Cijk_Alik_Bljk_F8NBS_STA_BH_Bias_HAS_SAB_SAVUserArgs_MT256x208x128_MI16x16x1_SN_LDSB1_GRVWB8_GSU1_GSUC0_GSUWGMRR0_K1_LBSPPB128_MIWT4_13_NLCA2_SU0_SUM0_SUS128_VWB1_WG64_4_1_WGM1_WGMXCC8_WGMXCCGn1
    SolutionIndex: 282
    SolutionNameMin: Cijk_Alik_Bljk_F8NBS_STA_BH_Bias_HAS_SAB_SAVUserArgs_MT320x112x128_MI16x16x1_SN_LDSB0_GRVWB8_GSU1_GSUC0_GSUWGMRR0_K1_LBSPPB128_MIWT5_7_NLCA2_SU0_SUM0_SUS128_VWB1_WG64_4_1_WGM8_WGMXCC8_WGMXCCGn1
    SolutionIndex: 283
    SolutionNameMin: Cijk_Alik_Bljk_F8NBS_STA_BH_Bias_HAS_SAB_SAVUserArgs_MT320x176x128_MI16x16x1_SN_LDSB0_GRVWB8_GSU1_GSUC0_GSUWGMRR0_K1_LBSPPB128_MIWT5_11_NLCA2_SU8_SUM0_SUS128_VWB1_WG64_4_1_WGM6_WGMXCC8_WGMXCCGn1
    SolutionIndex: 284
    SolutionNameMin: Cijk_Alik_Bljk_F8NBS_STA_BH_Bias_HAS_SAB_SAVUserArgs_MT256x256x128_MI16x16x1_SN_LDSB1_GRVWB16_GSU1_GSUC0_GSUWGMRR0_K1_LBSPPB2048_MIWT4_16_NLCA2_SU0_SUM0_SUS128_VWB16_WG64_4_1_WGM8_WGMXCC8_WGMXCCGn1
    SolutionIndex: 285
    SolutionNameMin: Cijk_Alik_Bljk_F8NBS_STA_BH_Bias_HAS_SAB_SAVUserArgs_MT320x144x128_MI16x16x1_SN_LDSB0_GRVWB8_GSU1_GSUC0_GSUWGMRR0_K1_LBSPPB128_MIWT5_9_NLCA2_SU0_SUM0_SUS128_VWB1_WG64_4_1_WGM8_WGMXCC8_WGMXCCGn1
    SolutionIndex: 286
    SolutionNameMin: Cijk_Alik_Bljk_F8NBS_STA_BH_Bias_HAS_SAB_SAVUserArgs_MT320x144x128_MI16x16x1_SN_LDSB0_GRVWB8_GSU1_GSUC0_GSUWGMRR0_K1_LBSPPB128_MIWT5_9_NLCA2_SU8_SUM0_SUS128_VWB1_WG64_4_1_WGM8_WGMXCC8_WGMXCCGn1
    SolutionIndex: 287
    SolutionNameMin: Cijk_Alik_Bljk_F8NBS_STA_BH_Bias_HAS_SAB_SAVUserArgs_MT320x176x128_MI16x16x1_SN_LDSB0_GRVWB8_GSU1_GSUC0_GSUWGMRR0_K1_LBSPPB128_MIWT5_11_NLCA2_SU8_SUM0_SUS128_VWB1_WG64_4_1_WGM8_WGMXCC8_WGMXCCGn1
    SolutionIndex: 288
    SolutionNameMin: Cijk_Alik_Bljk_F8NBS_STA_BH_Bias_HAS_SAB_SAVUserArgs_MT320x208x128_MI16x16x1_SN_LDSB1_GRVWB8_GSU1_GSUC0_GSUWGMRR0_K1_LBSPPB128_MIWT5_13_NLCA2_SU8_SUM0_SUS128_VWB1_WG64_4_1_WGM8_WGMXCC8_WGMXCCGn1
    SolutionIndex: 289
    SolutionNameMin: Cijk_Alik_Bljk_F8NBS_STA_BH_Bias_HAS_SAB_SAVUserArgs_MT320x208x128_MI16x16x1_SN_LDSB1_GRVWB8_GSU1_GSUC0_GSUWGMRR0_K1_LBSPPB128_MIWT5_13_NLCA2_SU8_SUM0_SUS128_VWB1_WG64_4_1_WGM6_WGMXCC8_WGMXCCGn1
    SolutionIndex: 290
    SolutionNameMin: Cijk_Alik_Bljk_F8NBS_STA_BH_Bias_HAS_SABV_SAV_UserArgs_MT32x16x128_MI16x16x1_SN_LDSB0_GRVWB16_GSU1_GSUC0_GSUWGMRR0_K1_LBSPPB128_MIWT1_1_NLCA2_SU0_SUM0_SUS128_SVW1_VWA1_VWB1_WG32_4_1_WGM1_WGMXCC8_WGMXCCGn1
    SolutionIndex: 291
    SolutionNameMin: Cijk_Alik_Bljk_F8NBS_STA_BH_Bias_HAS_SABV_SAV_UserArgs_MT64x16x128_MI16x16x1_SN_LDSB0_GRVWB8_GSU1_GSUC0_GSUWGMRR0_K1_LBSPPB128_MIWT1_1_NLCA2_SU8_SUM0_SUS128_SVW1_VWA1_VWB1_WG64_4_1_WGM1_WGMXCC8_WGMXCCGn1
    SolutionIndex: 292
    SolutionNameMin: Cijk_Alik_Bljk_F8NBS_STA_BH_Bias_HAS_SABV_SAV_UserArgs_MT128x16x128_MI16x16x1_SN_LDSB0_GRVWB8_GSU1_GSUC0_GSUWGMRR0_K1_LBSPPB128_MIWT2_1_NLCA2_SU8_SUM0_SUS128_SVW2_VWA2_VWB1_WG64_4_1_WGM6_WGMXCC8_WGMXCCGn1
    SolutionIndex: 293
    SolutionNameMin: Cijk_Alik_Bljk_F8NBS_STA_BH_Bias_HAS_SABV_SAV_UserArgs_MT32x16x128_MI16x16x1_SN_LDSB0_GRVWB16_GSU1_GSUC0_GSUWGMRR0_K1_LBSPPB128_MIWT1_1_NLCA2_SU8_SUM0_SUS128_SVW1_VWA1_VWB1_WG32_4_1_WGM6_WGMXCC8_WGMXCCGn1
    SolutionIndex: 294
    SolutionNameMin: Cijk_Alik_Bljk_F8NBS_STA_BH_Bias_HAS_SABV_SAV_UserArgs_MT64x32x128_MI16x16x1_SN_LDSB0_GRVWB16_GSU1_GSUC0_GSUWGMRR0_K1_LBSPPB128_MIWT2_1_NLCA2_SU0_SUM0_SUS128_SVW2_VWA2_VWB1_WG32_8_1_WGM1_WGMXCC8_WGMXCCGn1
    SolutionIndex: 295
    SolutionNameMin: Cijk_Alik_Bljk_F8NBS_STA_BH_Bias_HAS_SABV_SAV_UserArgs_MT64x32x128_MI16x16x1_SN_LDSB0_GRVWB16_GSU1_GSUC0_GSUWGMRR0_K1_LBSPPB128_MIWT2_1_NLCA2_SU8_SUM0_SUS128_SVW2_VWA2_VWB1_WG32_8_1_WGM6_WGMXCC8_WGMXCCGn1
    SolutionIndex: 296
    SolutionNameMin: Cijk_Alik_Bljk_F8NBS_STA_BH_Bias_HAS_SABV_SAV_UserArgs_MT64x64x128_MI16x16x1_SN_LDSB0_GRVWB16_GSU1_GSUC0_GSUWGMRR0_K1_LBSPPB256_MIWT2_2_NLCA2_SU0_SUM0_SUS128_SVW2_VWA2_VWB2_WG32_8_1_WGM1_WGMXCC8_WGMXCCGn1
    SolutionIndex: 297
    SolutionNameMin: Cijk_Alik_Bljk_F8NBS_STA_BH_Bias_HAS_SABV_SAV_UserArgs_MT64x32x128_MI16x16x1_SN_LDSB0_GRVWB16_GSU1_GSUC0_GSUWGMRR0_K1_LBSPPB128_MIWT2_1_NLCA2_SU0_SUM0_SUS128_SVW2_VWA2_VWB1_WG32_8_1_WGM8_WGMXCC8_WGMXCCGn1
    SolutionIndex: 298
    SolutionNameMin: Cijk_Alik_Bljk_F8NBS_STA_BH_Bias_HAS_SABV_SAV_UserArgs_MT64x64x128_MI16x16x1_SN_LDSB0_GRVWB16_GSU1_GSUC0_GSUWGMRR0_K1_LBSPPB256_MIWT2_2_NLCA2_SU8_SUM0_SUS128_SVW2_VWA2_VWB2_WG32_8_1_WGM1_WGMXCC8_WGMXCCGn1
    SolutionIndex: 299
    SolutionNameMin: Cijk_Alik_Bljk_F8NBS_STA_BH_Bias_HAS_SABV_SAV_UserArgs_MT64x64x128_MI16x16x1_SN_LDSB0_GRVWB16_GSU1_GSUC0_GSUWGMRR0_K1_LBSPPB256_MIWT2_2_NLCA2_SU8_SUM0_SUS128_SVW2_VWA2_VWB2_WG32_8_1_WGM8_WGMXCC8_WGMXCCGn1
    SolutionIndex: 300
    SolutionNameMin: Cijk_Alik_Bljk_F8NBS_STA_BH_Bias_HAS_SABV_SAV_UserArgs_MT128x32x128_MI16x16x1_SN_LDSB0_GRVWB16_GSU1_GSUC0_GSUWGMRR0_K1_LBSPPB256_MIWT2_2_NLCA2_SU0_SUM0_SUS128_SVW2_VWA2_VWB2_WG64_4_1_WGM8_WGMXCC8_WGMXCCGn1
    SolutionIndex: 301
    SolutionNameMin: Cijk_Alik_Bljk_F8NBS_STA_BH_Bias_HAS_SABV_SAV_UserArgs_MT64x64x128_MI16x16x1_SN_LDSB0_GRVWB16_GSU1_GSUC0_GSUWGMRR0_K1_LBSPPB256_MIWT2_2_NLCA2_SU0_SUM0_SUS128_SVW2_VWA2_VWB2_WG32_8_1_WGM6_WGMXCC8_WGMXCCGn1
    SolutionIndex: 302
    SolutionNameMin: Cijk_Alik_Bljk_F8NBS_STA_BH_Bias_HAS_SABV_SAV_UserArgs_MT64x96x128_MI16x16x1_SN_LDSB0_GRVWB16_GSU1_GSUC0_GSUWGMRR0_K1_LBSPPB128_MIWT2_3_NLCA2_SU0_SUM0_SUS128_SVW2_VWA2_VWB1_WG32_8_1_WGM1_WGMXCC8_WGMXCCGn1
    SolutionIndex: 303
    SolutionNameMin: Cijk_Alik_Bljk_F8NBS_STA_BH_Bias_HAS_SABV_SAV_UserArgs_MT64x96x128_MI16x16x1_SN_LDSB0_GRVWB16_GSU1_GSUC0_GSUWGMRR0_K1_LBSPPB128_MIWT2_3_NLCA2_SU0_SUM0_SUS128_SVW2_VWA2_VWB1_WG32_8_1_WGM8_WGMXCC8_WGMXCCGn1
    SolutionIndex: 304
    SolutionNameMin: Cijk_Alik_Bljk_F8NBS_STA_BH_Bias_HAS_SABV_SAV_UserArgs_MT128x64x128_MI16x16x1_SN_LDSB0_GRVWB16_GSU1_GSUC0_GSUWGMRR0_K1_LBSPPB512_MIWT2_4_NLCA2_SU8_SUM0_SUS128_SVW2_VWA2_VWB4_WG64_4_1_WGM6_WGMXCC8_WGMXCCGn1
    SolutionIndex: 305
    SolutionNameMin: Cijk_Alik_Bljk_F8NBS_STA_BH_Bias_HAS_SABV_SAV_UserArgs_MT128x48x128_MI16x16x1_SN_LDSB0_GRVWB8_GSU1_GSUC0_GSUWGMRR0_K1_LBSPPB128_MIWT2_3_NLCA2_SU8_SUM0_SUS128_SVW2_VWA2_VWB1_WG64_4_1_WGM8_WGMXCC8_WGMXCCGn1
    SolutionIndex: 306
    SolutionNameMin: Cijk_Alik_Bljk_F8NBS_STA_BH_Bias_HAS_SABV_SAV_UserArgs_MT128x64x128_MI16x16x1_SN_LDSB0_GRVWB16_GSU1_GSUC0_GSUWGMRR0_K1_LBSPPB256_MIWT4_2_NLCA2_SU8_SUM0_SUS128_SVW4_VWA4_VWB2_WG32_8_1_WGM8_WGMXCC8_WGMXCCGn1
    SolutionIndex: 307
    SolutionNameMin: Cijk_Alik_Bljk_F8NBS_STA_BH_Bias_HAS_SABV_SAV_UserArgs_MT128x64x128_MI16x16x1_SN_LDSB0_GRVWB16_GSU1_GSUC0_GSUWGMRR0_K1_LBSPPB512_MIWT2_4_NLCA2_SU8_SUM0_SUS128_SVW2_VWA2_VWB4_WG64_4_1_WGM8_WGMXCC8_WGMXCCGn1
    SolutionIndex: 308
    SolutionNameMin: Cijk_Alik_Bljk_F8NBS_STA_BH_Bias_HAS_SABV_SAV_UserArgs_MT64x80x128_MI16x16x1_SN_LDSB0_GRVWB8_GSU1_GSUC0_GSUWGMRR0_K1_LBSPPB128_MIWT1_5_NLCA2_SU8_SUM0_SUS128_SVW1_VWA1_VWB1_WG64_4_1_WGM1_WGMXCC8_WGMXCCGn1
    SolutionIndex: 309
    SolutionNameMin: Cijk_Alik_Bljk_F8NBS_STA_BH_Bias_HAS_SABV_SAV_UserArgs_MT256x32x128_MI16x16x1_SN_LDSB0_GRVWB16_GSU1_GSUC0_GSUWGMRR0_K1_LBSPPB256_MIWT4_2_NLCA2_SU8_SUM0_SUS128_SVW4_VWA4_VWB2_WG64_4_1_WGM8_WGMXCC8_WGMXCCGn1
    SolutionIndex: 310
    SolutionNameMin: Cijk_Alik_Bljk_F8NBS_STA_BH_Bias_HAS_SABV_SAV_UserArgs_MT128x32x128_MI16x16x1_SN_LDSB0_GRVWB16_GSU1_GSUC0_GSUWGMRR0_K1_LBSPPB256_MIWT2_2_NLCA2_SU0_SUM0_SUS128_SVW2_VWA2_VWB2_WG64_4_1_WGM6_WGMXCC8_WGMXCCGn1
    SolutionIndex: 311
    SolutionNameMin: Cijk_Alik_Bljk_F8NBS_STA_BH_Bias_HAS_SABV_SAV_UserArgs_MT256x48x128_MI16x16x1_SN_LDSB0_GRVWB8_GSU1_GSUC0_GSUWGMRR0_K1_LBSPPB128_MIWT4_3_NLCA2_SU8_SUM0_SUS128_SVW4_VWA4_VWB1_WG64_4_1_WGM8_WGMXCC8_WGMXCCGn1
    SolutionIndex: 312
    SolutionNameMin: Cijk_Alik_Bljk_F8NBS_STA_BH_Bias_HAS_SABV_SAV_UserArgs_MT128x96x128_MI16x16x1_SN_LDSB0_GRVWB16_GSU1_GSUC0_GSUWGMRR0_K1_LBSPPB128_MIWT4_3_NLCA2_SU8_SUM0_SUS128_SVW4_VWA4_VWB1_WG32_8_1_WGM6_WGMXCC8_WGMXCCGn1
    SolutionIndex: 313
    SolutionNameMin: Cijk_Alik_Bljk_F8NBS_STA_BH_Bias_HAS_SABV_SAV_UserArgs_MT256x48x128_MI16x16x1_SN_LDSB0_GRVWB8_GSU1_GSUC0_GSUWGMRR0_K1_LBSPPB128_MIWT4_3_NLCA2_SU8_SUM0_SUS128_SVW4_VWA4_VWB1_WG64_4_1_WGM6_WGMXCC8_WGMXCCGn1
    SolutionIndex: 314
    SolutionNameMin: Cijk_Alik_Bljk_F8NBS_STA_BH_Bias_HAS_SABV_SAV_UserArgs_MT128x96x128_MI16x16x1_SN_LDSB0_GRVWB16_GSU1_GSUC0_GSUWGMRR0_K1_LBSPPB256_MIWT2_6_NLCA2_SU8_SUM0_SUS128_SVW2_VWA2_VWB2_WG64_4_1_WGM8_WGMXCC8_WGMXCCGn1
    SolutionIndex: 315
    SolutionNameMin: Cijk_Alik_Bljk_F8NBS_STA_BH_Bias_HAS_SABV_SAV_UserArgs_MT64x96x128_MI16x16x1_SN_LDSB0_GRVWB16_GSU1_GSUC0_GSUWGMRR0_K1_LBSPPB128_MIWT2_3_NLCA2_SU8_SUM0_SUS128_SVW2_VWA2_VWB1_WG32_8_1_WGM6_WGMXCC8_WGMXCCGn1
    SolutionIndex: 316
    SolutionNameMin: Cijk_Alik_Bljk_F8NBS_STA_BH_Bias_HAS_SABV_SAV_UserArgs_MT256x64x128_MI16x16x1_SN_LDSB0_GRVWB16_GSU1_GSUC0_GSUWGMRR0_K1_LBSPPB512_MIWT4_4_NLCA2_SU8_SUM0_SUS128_SVW4_VWA4_VWB4_WG64_4_1_WGM6_WGMXCC8_WGMXCCGn1
    SolutionIndex: 317
    SolutionNameMin: Cijk_Alik_Bljk_F8NBS_STA_BH_Bias_HAS_SABV_SAV_UserArgs_MT128x64x128_MI16x16x1_SN_LDSB0_GRVWB16_GSU1_GSUC0_GSUWGMRR0_K1_LBSPPB512_MIWT2_4_NLCA2_SU0_SUM0_SUS128_SVW2_VWA2_VWB4_WG64_4_1_WGM6_WGMXCC8_WGMXCCGn1
    SolutionIndex: 318
    SolutionNameMin: Cijk_Alik_Bljk_F8NBS_STA_BH_Bias_HAS_SABV_SAV_UserArgs_MT256x64x128_MI16x16x1_SN_LDSB0_GRVWB16_GSU1_GSUC0_GSUWGMRR0_K1_LBSPPB512_MIWT4_4_NLCA2_SU8_SUM0_SUS128_SVW4_VWA4_VWB4_WG64_4_1_WGM8_WGMXCC8_WGMXCCGn1
    SolutionIndex: 319
    SolutionNameMin: Cijk_Alik_Bljk_F8NBS_STA_BH_Bias_HAS_SABV_SAV_UserArgs_MT128x128x128_MI16x16x1_SN_LDSB1_GRVWB16_GSU1_GSUC0_GSUWGMRR0_K1_LBSPPB512_MIWT4_4_NLCA2_SU8_SUM0_SUS128_SVW4_VWA4_VWB4_WG32_8_1_WGM6_WGMXCC8_WGMXCCGn1
    SolutionIndex: 320
    SolutionNameMin: Cijk_Alik_Bljk_F8NBS_STA_BH_Bias_HAS_SABV_SAV_UserArgs_MT256x80x128_MI16x16x1_SN_LDSB0_GRVWB8_GSU1_GSUC0_GSUWGMRR0_K1_LBSPPB128_MIWT4_5_NLCA2_SU8_SUM0_SUS128_SVW4_VWA4_VWB1_WG64_4_1_WGM6_WGMXCC8_WGMXCCGn1
    SolutionIndex: 321
    SolutionNameMin: Cijk_Alik_Bljk_F8NBS_STA_BH_Bias_HAS_SABV_SAV_UserArgs_MT128x160x128_MI16x16x1_SN_LDSB1_GRVWB16_GSU1_GSUC0_GSUWGMRR0_K1_LBSPPB128_MIWT4_5_NLCA2_SU8_SUM0_SUS128_SVW4_VWA4_VWB1_WG32_8_1_WGM6_WGMXCC8_WGMXCCGn1
    SolutionIndex: 322
    SolutionNameMin: Cijk_Alik_Bljk_F8NBS_STA_BH_Bias_HAS_SABV_SAV_UserArgs_MT128x192x128_MI16x16x1_SN_LDSB1_GRVWB16_GSU1_GSUC0_GSUWGMRR0_K1_LBSPPB256_MIWT4_6_NLCA2_SU0_SUM0_SUS128_SVW4_VWA4_VWB2_WG32_8_1_WGM1_WGMXCC8_WGMXCCGn1
    SolutionIndex: 323
    SolutionNameMin: Cijk_Alik_Bljk_F8NBS_STA_BH_Bias_HAS_SABV_SAV_UserArgs_MT128x96x128_MI16x16x1_SN_LDSB0_GRVWB16_GSU1_GSUC0_GSUWGMRR0_K1_LBSPPB256_MIWT2_6_NLCA2_SU0_SUM0_SUS128_SVW2_VWA2_VWB2_WG64_4_1_WGM6_WGMXCC8_WGMXCCGn1
    SolutionIndex: 324
    SolutionNameMin: Cijk_Alik_Bljk_F8NBS_STA_BH_Bias_HAS_SABV_SAV_UserArgs_MT256x96x128_MI16x16x1_SN_LDSB0_GRVWB16_GSU1_GSUC0_GSUWGMRR0_K1_LBSPPB256_MIWT4_6_NLCA2_SU8_SUM0_SUS128_SVW4_VWA4_VWB2_WG64_4_1_WGM6_WGMXCC8_WGMXCCGn1
    SolutionIndex: 325
    SolutionNameMin: Cijk_Alik_Bljk_F8NBS_STA_BH_Bias_HAS_SABV_SAV_UserArgs_MT128x96x128_MI16x16x1_SN_LDSB0_GRVWB16_GSU1_GSUC0_GSUWGMRR0_K1_LBSPPB256_MIWT2_6_NLCA2_SU0_SUM0_SUS128_SVW2_VWA2_VWB2_WG64_4_1_WGM8_WGMXCC8_WGMXCCGn1
    SolutionIndex: 326
    SolutionNameMin: Cijk_Alik_Bljk_F8NBS_STA_BH_Bias_HAS_SABV_SAV_UserArgs_MT256x112x128_MI16x16x1_SN_LDSB1_GRVWB8_GSU1_GSUC0_GSUWGMRR0_K1_LBSPPB128_MIWT4_7_NLCA2_SU8_SUM0_SUS128_SVW4_VWA4_VWB1_WG64_4_1_WGM6_WGMXCC8_WGMXCCGn1
    SolutionIndex: 327
    SolutionNameMin: Cijk_Alik_Bljk_F8NBS_STA_BH_Bias_HAS_SABV_SAV_UserArgs_MT256x128x128_MI16x16x1_SN_LDSB1_GRVWB16_GSU1_GSUC0_GSUWGMRR0_K1_LBSPPB1024_MIWT4_8_NLCA2_SU8_SUM0_SUS128_SVW4_VWA4_VWB8_WG64_4_1_WGM6_WGMXCC8_WGMXCCGn1
    SolutionIndex: 328
    SolutionNameMin: Cijk_Alik_Bljk_F8NBS_STA_BH_Bias_HAS_SABV_SAV_UserArgs_MT128x128x128_MI16x16x1_SN_LDSB1_GRVWB16_GSU1_GSUC0_GSUWGMRR0_K1_LBSPPB1024_MIWT2_8_NLCA2_SU8_SUM0_SUS128_SVW2_VWA2_VWB8_WG64_4_1_WGM8_WGMXCC8_WGMXCCGn1
    SolutionIndex: 329
    SolutionNameMin: Cijk_Alik_Bljk_F8NBS_STA_BH_Bias_HAS_SABV_SAV_UserArgs_MT256x128x128_MI16x16x1_SN_LDSB1_GRVWB16_GSU1_GSUC0_GSUWGMRR0_K1_LBSPPB1024_MIWT4_8_NLCA2_SU8_SUM0_SUS128_SVW4_VWA4_VWB8_WG64_4_1_WGM8_WGMXCC8_WGMXCCGn1
    SolutionIndex: 330
    SolutionNameMin: Cijk_Alik_Bljk_F8NBS_STA_BH_Bias_HAS_SABV_SAV_UserArgs_MT128x128x128_MI16x16x1_SN_LDSB1_GRVWB16_GSU1_GSUC0_GSUWGMRR0_K1_LBSPPB1024_MIWT2_8_NLCA2_SU0_SUM0_SUS128_SVW2_VWA2_VWB8_WG64_4_1_WGM8_WGMXCC8_WGMXCCGn1
    SolutionIndex: 331
    SolutionNameMin: Cijk_Alik_Bljk_F8NBS_STA_BH_Bias_HAS_SABV_SAV_UserArgs_MT256x144x128_MI16x16x1_SN_LDSB0_GRVWB8_GSU1_GSUC0_GSUWGMRR0_K1_LBSPPB128_MIWT4_9_NLCA2_SU8_SUM0_SUS128_SVW4_VWA4_VWB1_WG64_4_1_WGM6_WGMXCC8_WGMXCCGn1
    SolutionIndex: 332
    SolutionNameMin: Cijk_Alik_Bljk_F8NBS_STA_BH_Bias_HAS_SABV_SAV_UserArgs_MT256x160x128_MI16x16x1_SN_LDSB0_GRVWB16_GSU1_GSUC0_GSUWGMRR0_K1_LBSPPB256_MIWT4_10_NLCA2_SU8_SUM0_SUS128_SVW4_VWA4_VWB2_WG64_4_1_WGM6_WGMXCC8_WGMXCCGn1
    SolutionIndex: 333
    SolutionNameMin: Cijk_Alik_Bljk_F8NBS_STA_BH_Bias_HAS_SABV_SAV_UserArgs_MT256x96x128_MI16x16x1_SN_LDSB0_GRVWB16_GSU1_GSUC0_GSUWGMRR0_K1_LBSPPB256_MIWT4_6_NLCA2_SU8_SUM0_SUS128_SVW4_VWA4_VWB2_WG64_4_1_WGM1_WGMXCC8_WGMXCCGn1
    SolutionIndex: 334
    SolutionNameMin: Cijk_Alik_Bljk_F8NBS_STA_BH_Bias_HAS_SABV_SAV_UserArgs_MT256x96x128_MI16x16x1_SN_LDSB0_GRVWB16_GSU1_GSUC0_GSUWGMRR0_K1_LBSPPB256_MIWT4_6_NLCA2_SU0_SUM0_SUS128_SVW4_VWA4_VWB2_WG64_4_1_WGM8_WGMXCC8_WGMXCCGn1
    SolutionIndex: 335
    SolutionNameMin: Cijk_Alik_Bljk_F8NBS_STA_BH_Bias_HAS_SABV_SAV_UserArgs_MT128x192x128_MI16x16x1_SN_LDSB1_GRVWB16_GSU1_GSUC0_GSUWGMRR0_K1_LBSPPB256_MIWT4_6_NLCA2_SU8_SUM0_SUS128_SVW4_VWA4_VWB2_WG32_8_1_WGM8_WGMXCC8_WGMXCCGn1
    SolutionIndex: 336
    SolutionNameMin: Cijk_Alik_Bljk_F8NBS_STA_BH_Bias_HAS_SABV_SAV_UserArgs_MT256x96x128_MI16x16x1_SN_LDSB0_GRVWB16_GSU1_GSUC0_GSUWGMRR0_K1_LBSPPB256_MIWT4_6_NLCA2_SU8_SUM0_SUS128_SVW4_VWA4_VWB2_WG64_4_1_WGM8_WGMXCC8_WGMXCCGn1
    SolutionIndex: 337
    SolutionNameMin: Cijk_Alik_Bljk_F8NBS_STA_BH_Bias_HAS_SABV_SAV_UserArgs_MT256x256x128_MI16x16x1_SN_LDSB1_GRVWB16_GSU1_GSUC0_GSUWGMRR0_K1_LBSPPB2048_MIWT4_16_NLCA2_SU8_SUM0_SUS128_SVW4_VWA4_VWB16_WG64_4_1_WGM6_WGMXCC8_WGMXCCGn1
    SolutionIndex: 338
    SolutionNameMin: Cijk_Alik_Bljk_F8NBS_STA_BH_Bias_HAS_SABV_SAV_UserArgs_MT256x256x128_MI16x16x1_SN_LDSB1_GRVWB16_GSU1_GSUC0_GSUWGMRR0_K1_LBSPPB2048_MIWT4_16_NLCA2_SU0_SUM0_SUS128_SVW4_VWA4_VWB16_WG64_4_1_WGM8_WGMXCC8_WGMXCCGn1
    SolutionIndex: 339
    SolutionNameMin: Cijk_Alik_Bljk_F8NBS_STA_BH_Bias_HAS_SABV_SAV_UserArgs_MT256x224x128_MI16x16x1_SN_LDSB0_GRVWB16_GSU1_GSUC0_GSUWGMRR0_K1_LBSPPB256_MIWT4_14_NLCA2_SU8_SUM0_SUS128_SVW4_VWA4_VWB2_WG64_4_1_WGM1_WGMXCC8_WGMXCCGn1
    SolutionIndex: 340
    SolutionNameMin: Cijk_Alik_Bljk_F8NBS_STA_BH_Bias_HAS_SABV_SAV_UserArgs_MT256x224x128_MI16x16x1_SN_LDSB0_GRVWB16_GSU1_GSUC0_GSUWGMRR0_K1_LBSPPB256_MIWT4_14_NLCA2_SU8_SUM0_SUS128_SVW4_VWA4_VWB2_WG64_4_1_WGM6_WGMXCC8_WGMXCCGn1
    SolutionIndex: 341
    SolutionNameMin: Cijk_Alik_Bljk_F8NBS_STA_BH_Bias_HAS_SABV_SAV_UserArgs_MT256x256x128_MI16x16x1_SN_LDSB1_GRVWB16_GSU1_GSUC0_GSUWGMRR0_K1_LBSPPB2048_MIWT4_16_NLCA2_SU8_SUM0_SUS128_SVW4_VWA4_VWB16_WG64_4_1_WGM8_WGMXCC8_WGMXCCGn1
    SolutionIndex: 342
    SolutionNameMin: Cijk_Alik_Bljk_F8NBS_STA_BH_Bias_HAS_SABV_SAV_UserArgs_MT256x256x128_MI16x16x1_SN_LDSB1_GRVWB16_GSU1_GSUC0_GSUWGMRR0_K1_LBSPPB2048_MIWT4_16_NLCA2_SU0_SUM0_SUS128_SVW4_VWA4_VWB16_WG64_4_1_WGM1_WGMXCC8_WGMXCCGn1
    SolutionIndex: 343
    SolutionNameMin: Cijk_Alik_Bljk_F8NBS_STA_BH_Bias_HAS_SABV_SAV_UserArgs_MT128x160x128_MI16x16x1_SN_LDSB1_GRVWB16_GSU1_GSUC0_GSUWGMRR0_K1_LBSPPB128_MIWT4_5_NLCA2_SU0_SUM0_SUS128_SVW4_VWA4_VWB1_WG32_8_1_WGM8_WGMXCC8_WGMXCCGn1
    SolutionIndex: 344
    SolutionNameMin: Cijk_Alik_Bljk_F8NBS_STA_BH_Bias_HAS_SABV_SAV_UserArgs_MT256x224x128_MI16x16x1_SN_LDSB0_GRVWB16_GSU1_GSUC0_GSUWGMRR0_K1_LBSPPB256_MIWT4_14_NLCA2_SU0_SUM0_SUS128_SVW4_VWA4_VWB2_WG64_4_1_WGM8_WGMXCC8_WGMXCCGn1
    SolutionIndex: 345
    SolutionNameMin: Cijk_Alik_Bljk_F8NBS_STA_BH_Bias_HAS_SABV_SAV_UserArgs_MT256x256x128_MI16x16x1_SN_LDSB1_GRVWB16_GSU1_GSUC0_GSUWGMRR0_K1_LBSPPB2048_MIWT4_16_NLCA2_SU0_SUM0_SUS128_SVW4_VWA4_VWB16_WG64_4_1_WGM6_WGMXCC8_WGMXCCGn1
    SolutionIndex: 346
    SolutionNameMin: Cijk_Alik_Bljk_F8NBS_STA_BH_Bias_HAS_SABV_SAV_UserArgs_MT256x96x128_MI16x16x1_SN_LDSB0_GRVWB16_GSU1_GSUC0_GSUWGMRR0_K1_LBSPPB256_MIWT4_6_NLCA2_SU0_SUM0_SUS128_SVW4_VWA4_VWB2_WG64_4_1_WGM6_WGMXCC8_WGMXCCGn1
    SolutionIndex: 347
    SolutionNameMin: Cijk_Alik_Bljk_F8NBS_STA_BH_Bias_HAS_SABV_SAV_UserArgs_MT128x192x128_MI16x16x1_SN_LDSB1_GRVWB16_GSU1_GSUC0_GSUWGMRR0_K1_LBSPPB256_MIWT4_6_NLCA2_SU0_SUM0_SUS128_SVW4_VWA4_VWB2_WG32_8_1_WGM8_WGMXCC8_WGMXCCGn1
    SolutionIndex: 348
    SolutionNameMin: Cijk_Alik_Bljk_F8NBS_STA_BH_Bias_HAS_SABV_SAV_UserArgs_MT256x224x128_MI16x16x1_SN_LDSB0_GRVWB16_GSU1_GSUC0_GSUWGMRR0_K1_LBSPPB256_MIWT4_14_NLCA2_SU0_SUM0_SUS128_SVW4_VWA4_VWB2_WG64_4_1_WGM6_WGMXCC8_WGMXCCGn1
    SolutionIndex: 349
    SolutionNameMin: Cijk_Alik_Bljk_F8NBS_STA_BH_Bias_HAS_SABV_SAV_UserArgs_MT64x16x256_MI16x16x1_SN_LDSB0_GRVWB16_GSU1_GSUC0_GSUWGMRR0_K1_LBSPPB256_MIWT1_1_NLCA4_SU8_SUM0_SUS256_SVW1_VWA1_VWB1_WG64_4_1_WGM8_WGMXCC8_WGMXCCGn1
    SolutionIndex: 350
    SolutionNameMin: Cijk_Alik_Bljk_F8NBS_STA_BH_Bias_HAS_SABV_SAV_UserArgs_MT64x16x256_MI16x16x1_SN_LDSB0_GRVWB16_GSU1_GSUC0_GSUWGMRR0_K1_LBSPPB256_MIWT1_1_NLCA4_SU0_SUM0_SUS256_SVW1_VWA1_VWB1_WG64_4_1_WGM8_WGMXCC8_WGMXCCGn1
    SolutionIndex: 351
    SolutionNameMin: Cijk_Alik_Bljk_F8NBS_STA_BH_Bias_HAS_SABV_SAV_UserArgs_MT64x64x256_MI16x16x1_SN_LDSB1_GRVWB16_GSU1_GSUC0_GSUWGMRR0_K1_LBSPPB512_MIWT2_2_NLCA4_SU8_SUM0_SUS256_SVW2_VWA2_VWB2_WG32_8_1_WGM6_WGMXCC8_WGMXCCGn1
    SolutionIndex: 352
    SolutionNameMin: Cijk_Alik_Bljk_F8NBS_STA_BH_Bias_HAS_SABV_SAV_UserArgs_MT128x48x256_MI16x16x1_SN_LDSB0_GRVWB16_GSU1_GSUC0_GSUWGMRR0_K1_LBSPPB256_MIWT2_3_NLCA4_SU0_SUM0_SUS256_SVW2_VWA2_VWB1_WG64_4_1_WGM6_WGMXCC8_WGMXCCGn1
    SolutionIndex: 353
    SolutionNameMin: Cijk_Alik_Bljk_F8NBS_STA_BH_Bias_HAS_SABV_SAV_UserArgs_MT128x32x512_MI16x16x1_SN_LDSB1_GRVWB16_GSU1_GSUC0_GSUWGMRR0_K1_LBSPPB1024_MIWT2_2_NLCA8_SU0_SUM0_SUS512_SVW2_VWA2_VWB2_WG64_4_1_WGM8_WGMXCC8_WGMXCCGn1
    SolutionIndex: 354
    SolutionNameMin: Cijk_Alik_Bljk_F8NBS_STA_BH_Bias_HAS_SABV_SAV_UserArgs_MT64x80x256_MI16x16x1_SN_LDSB1_GRVWB16_GSU1_GSUC0_GSUWGMRR0_K1_LBSPPB256_MIWT1_5_NLCA4_SU8_SUM0_SUS256_SVW1_VWA1_VWB1_WG64_4_1_WGM8_WGMXCC8_WGMXCCGn1
    SolutionIndex: 355
    SolutionNameMin: Cijk_Alik_Bljk_F8NBS_STA_BH_Bias_HAS_SABV_SAV_UserArgs_MT64x96x256_MI16x16x1_SN_LDSB1_GRVWB16_GSU1_GSUC0_GSUWGMRR0_K1_LBSPPB256_MIWT2_3_NLCA4_SU0_SUM0_SUS256_SVW2_VWA2_VWB1_WG32_8_1_WGM6_WGMXCC8_WGMXCCGn1
    SolutionIndex: 356
    SolutionNameMin: Cijk_Alik_Bljk_F8NBS_STA_BH_Bias_HAS_SABV_SAV_UserArgs_MT64x96x256_MI16x16x1_SN_LDSB1_GRVWB16_GSU1_GSUC0_GSUWGMRR0_K1_LBSPPB256_MIWT2_3_NLCA4_SU8_SUM0_SUS256_SVW2_VWA2_VWB1_WG32_8_1_WGM6_WGMXCC8_WGMXCCGn1
    SolutionIndex: 357
    SolutionNameMin: Cijk_Alik_Bljk_F8NBS_STA_BH_Bias_HAS_SABV_SAV_UserArgs_MT128x48x256_MI16x16x1_SN_LDSB0_GRVWB16_GSU1_GSUC0_GSUWGMRR0_K1_LBSPPB256_MIWT2_3_NLCA4_SU0_SUM0_SUS256_SVW2_VWA2_VWB1_WG64_4_1_WGM8_WGMXCC8_WGMXCCGn1
    SolutionIndex: 358
    SolutionNameMin: Cijk_Alik_Bljk_F8NBS_STA_BH_Bias_HAS_SABV_SAV_UserArgs_MT128x64x256_MI16x16x1_SN_LDSB1_GRVWB16_GSU1_GSUC0_GSUWGMRR0_K1_LBSPPB1024_MIWT2_4_NLCA4_SU0_SUM0_SUS256_SVW2_VWA2_VWB4_WG64_4_1_WGM8_WGMXCC8_WGMXCCGn1
    SolutionIndex: 359
    SolutionNameMin: Cijk_Alik_Bljk_F8NBS_STA_BH_Bias_HAS_SABV_SAV_UserArgs_MT128x64x256_MI16x16x1_SN_LDSB1_GRVWB16_GSU1_GSUC0_GSUWGMRR0_K1_LBSPPB1024_MIWT2_4_NLCA4_SU0_SUM0_SUS256_SVW2_VWA2_VWB4_WG64_4_1_WGM6_WGMXCC8_WGMXCCGn1
    SolutionIndex: 360
    SolutionNameMin: Cijk_Alik_Bljk_F8NBS_STA_BH_Bias_HAS_SABV_SAV_UserArgs_MT128x64x256_MI16x16x1_SN_LDSB1_GRVWB16_GSU1_GSUC0_GSUWGMRR0_K1_LBSPPB1024_MIWT2_4_NLCA4_SU8_SUM0_SUS256_SVW2_VWA2_VWB4_WG64_4_1_WGM8_WGMXCC8_WGMXCCGn1
    SolutionIndex: 361
    SolutionNameMin: Cijk_Alik_Bljk_F8NBS_STA_BH_Bias_HAS_SABV_SAV_UserArgs_MT128x80x256_MI16x16x1_SN_LDSB1_GRVWB16_GSU1_GSUC0_GSUWGMRR0_K1_LBSPPB256_MIWT2_5_NLCA4_SU0_SUM0_SUS256_SVW2_VWA2_VWB1_WG64_4_1_WGM8_WGMXCC8_WGMXCCGn1
    SolutionIndex: 362
    SolutionNameMin: Cijk_Alik_Bljk_F8NBS_STA_BH_Bias_HAS_SABV_SAV_UserArgs_MT128x96x256_MI16x16x1_SN_LDSB1_GRVWB16_GSU1_GSUC0_GSUWGMRR0_K1_LBSPPB512_MIWT2_6_NLCA4_SU8_SUM0_SUS256_SVW2_VWA2_VWB2_WG64_4_1_WGM6_WGMXCC8_WGMXCCGn1
    SolutionIndex: 363
    SolutionNameMin: Cijk_Alik_Bljk_F8NBS_STA_BH_Bias_HAS_SABV_SAV_UserArgs_MT128x96x256_MI16x16x1_SN_LDSB1_GRVWB16_GSU1_GSUC0_GSUWGMRR0_K1_LBSPPB256_MIWT4_3_NLCA4_SU0_SUM0_SUS256_SVW4_VWA4_VWB1_WG32_8_1_WGM8_WGMXCC8_WGMXCCGn1
    SolutionIndex: 364
    SolutionNameMin: Cijk_Alik_Bljk_F8NBS_STA_BH_Bias_HAS_SABV_SAV_UserArgs_MT128x112x256_MI16x16x1_SN_LDSB1_GRVWB16_GSU1_GSUC0_GSUWGMRR0_K1_LBSPPB256_MIWT2_7_NLCA4_SU8_SUM0_SUS256_SVW2_VWA2_VWB1_WG64_4_1_WGM8_WGMXCC8_WGMXCCGn1
    SolutionIndex: 365
    SolutionNameMin: Cijk_Alik_Bljk_F8NBS_STA_BH_Bias_HAS_SABV_SAV_UserArgs_MT128x80x256_MI16x16x1_SN_LDSB1_GRVWB16_GSU1_GSUC0_GSUWGMRR0_K1_LBSPPB256_MIWT2_5_NLCA4_SU0_SUM0_SUS256_SVW2_VWA2_VWB1_WG64_4_1_WGM6_WGMXCC8_WGMXCCGn1
    SolutionIndex: 366
    SolutionNameMin: Cijk_Alik_Bljk_F8NBS_STA_BH_Bias_HAS_SABV_SAV_UserArgs_MT256x80x256_MI16x16x1_SN_LDSB1_GRVWB16_GSU1_GSUC0_GSUWGMRR0_K1_LBSPPB256_MIWT4_5_NLCA4_SU8_SUM0_SUS256_SVW4_VWA4_VWB1_WG64_4_1_WGM8_WGMXCC8_WGMXCCGn1
    SolutionIndex: 367
    SolutionNameMin: Cijk_Alik_Bljk_F8NBS_STA_BH_Bias_HAS_SABV_SAV_UserArgs_MT128x96x256_MI16x16x1_SN_LDSB1_GRVWB16_GSU1_GSUC0_GSUWGMRR0_K1_LBSPPB512_MIWT2_6_NLCA4_SU0_SUM0_SUS256_SVW2_VWA2_VWB2_WG64_4_1_WGM8_WGMXCC8_WGMXCCGn1
    SolutionIndex: 368
    SolutionNameMin: Cijk_Alik_Bljk_F8NBS_STA_BH_Bias_HAS_SABV_SAV_UserArgs_MT256x112x128_MI16x16x1_SN_LDSB1_GRVWB8_GSU1_GSUC0_GSUWGMRR0_K1_LBSPPB128_MIWT4_7_NLCA2_SU8_SUM0_SUS128_SVW4_VWA4_VWB1_WG64_4_1_WGM8_WGMXCC8_WGMXCCGn1
    SolutionIndex: 369
    SolutionNameMin: Cijk_Alik_Bljk_F8NBS_STA_BH_Bias_HAS_SABV_SAV_UserArgs_MT256x144x128_MI16x16x1_SN_LDSB0_GRVWB8_GSU1_GSUC0_GSUWGMRR0_K1_LBSPPB128_MIWT4_9_NLCA2_SU8_SUM0_SUS128_SVW4_VWA4_VWB1_WG64_4_1_WGM8_WGMXCC8_WGMXCCGn1
    SolutionIndex: 370
    SolutionNameMin: Cijk_Alik_Bljk_F8NBS_STA_BH_Bias_HAS_SABV_SAV_UserArgs_MT256x176x128_MI16x16x1_SN_LDSB0_GRVWB8_GSU1_GSUC0_GSUWGMRR0_K1_LBSPPB128_MIWT4_11_NLCA2_SU8_SUM0_SUS128_SVW4_VWA4_VWB1_WG64_4_1_WGM6_WGMXCC8_WGMXCCGn1
    SolutionIndex: 371
    SolutionNameMin: Cijk_Alik_Bljk_F8NBS_STA_BH_Bias_HAS_SABV_SAV_UserArgs_MT256x192x128_MI16x16x1_SN_LDSB0_GRVWB16_GSU1_GSUC0_GSUWGMRR0_K1_LBSPPB512_MIWT4_12_NLCA2_SU8_SUM0_SUS128_SVW4_VWA4_VWB4_WG64_4_1_WGM8_WGMXCC8_WGMXCCGn1
    SolutionIndex: 372
    SolutionNameMin: Cijk_Alik_Bljk_F8NBS_STA_BH_Bias_HAS_SABV_SAV_UserArgs_MT256x208x128_MI16x16x1_SN_LDSB1_GRVWB8_GSU1_GSUC0_GSUWGMRR0_K1_LBSPPB128_MIWT4_13_NLCA2_SU8_SUM0_SUS128_SVW4_VWA4_VWB1_WG64_4_1_WGM6_WGMXCC8_WGMXCCGn1
    SolutionIndex: 373
    SolutionNameMin: Cijk_Alik_Bljk_F8NBS_STA_BH_Bias_HAS_SABV_SAV_UserArgs_MT256x208x128_MI16x16x1_SN_LDSB1_GRVWB8_GSU1_GSUC0_GSUWGMRR0_K1_LBSPPB128_MIWT4_13_NLCA2_SU0_SUM0_SUS128_SVW4_VWA4_VWB1_WG64_4_1_WGM6_WGMXCC8_WGMXCCGn1
    SolutionIndex: 374
    SolutionNameMin: Cijk_Alik_Bljk_F8NBS_STA_BH_Bias_HAS_SABV_SAV_UserArgs_MT256x224x128_MI16x16x1_SN_LDSB0_GRVWB16_GSU1_GSUC0_GSUWGMRR0_K1_LBSPPB256_MIWT4_14_NLCA2_SU8_SUM0_SUS128_SVW4_VWA4_VWB2_WG64_4_1_WGM8_WGMXCC8_WGMXCCGn1
    SolutionIndex: 375
    SolutionNameMin: Cijk_Alik_Bljk_F8NBS_STA_BH_Bias_HAS_SABV_SAV_UserArgs_MT256x240x128_MI16x16x1_SN_LDSB1_GRVWB8_GSU1_GSUC0_GSUWGMRR0_K1_LBSPPB128_MIWT4_15_NLCA2_SU8_SUM0_SUS128_SVW4_VWA4_VWB1_WG64_4_1_WGM8_WGMXCC8_WGMXCCGn1
    SolutionIndex: 376
    SolutionNameMin: Cijk_Alik_Bljk_F8NBS_STA_BH_Bias_HAS_SABV_SAV_UserArgs_MT256x240x128_MI16x16x1_SN_LDSB1_GRVWB8_GSU1_GSUC0_GSUWGMRR0_K1_LBSPPB128_MIWT4_15_NLCA2_SU8_SUM0_SUS128_SVW4_VWA4_VWB1_WG64_4_1_WGM6_WGMXCC8_WGMXCCGn1
    SolutionIndex: 377
    SolutionNameMin: Cijk_Alik_Bljk_F8NBS_STA_BH_Bias_HAS_SABV_SAV_UserArgs_MT256x160x128_MI16x16x1_SN_LDSB0_GRVWB16_GSU1_GSUC0_GSUWGMRR0_K1_LBSPPB256_MIWT4_10_NLCA2_SU0_SUM0_SUS128_SVW4_VWA4_VWB2_WG64_4_1_WGM6_WGMXCC8_WGMXCCGn1
    SolutionIndex: 378
    SolutionNameMin: Cijk_Alik_Bljk_F8NBS_STA_BH_Bias_HAS_SABV_SAV_UserArgs_MT256x80x128_MI16x16x1_SN_LDSB0_GRVWB8_GSU1_GSUC0_GSUWGMRR0_K1_LBSPPB128_MIWT4_5_NLCA2_SU0_SUM0_SUS128_SVW4_VWA4_VWB1_WG64_4_1_WGM8_WGMXCC8_WGMXCCGn1
    SolutionIndex: 379
    SolutionNameMin: Cijk_Alik_Bljk_F8NBS_STA_BH_Bias_HAS_SABV_SAV_UserArgs_MT256x176x128_MI16x16x1_SN_LDSB0_GRVWB8_GSU1_GSUC0_GSUWGMRR0_K1_LBSPPB128_MIWT4_11_NLCA2_SU8_SUM0_SUS128_SVW4_VWA4_VWB1_WG64_4_1_WGM8_WGMXCC8_WGMXCCGn1
    SolutionIndex: 380
    SolutionNameMin: Cijk_Alik_Bljk_F8NBS_STA_BH_Bias_HAS_SABV_SAV_UserArgs_MT256x240x128_MI16x16x1_SN_LDSB1_GRVWB8_GSU1_GSUC0_GSUWGMRR0_K1_LBSPPB128_MIWT4_15_NLCA2_SU0_SUM0_SUS128_SVW4_VWA4_VWB1_WG64_4_1_WGM8_WGMXCC8_WGMXCCGn1
    SolutionIndex: 381
    SolutionNameMin: Cijk_Alik_Bljk_F8NBS_STA_BH_Bias_HAS_SABV_SAV_UserArgs_MT256x240x128_MI16x16x1_SN_LDSB1_GRVWB8_GSU1_GSUC0_GSUWGMRR0_K1_LBSPPB128_MIWT4_15_NLCA2_SU0_SUM0_SUS128_SVW4_VWA4_VWB1_WG64_4_1_WGM6_WGMXCC8_WGMXCCGn1
    SolutionIndex: 382
    SolutionNameMin: Cijk_Alik_Bljk_F8NBS_STA_BH_Bias_HAS_SABV_SAV_UserArgs_MT256x96x128_MI16x16x1_SN_LDSB0_GRVWB16_GSU1_GSUC0_GSUWGMRR0_K1_LBSPPB256_MIWT4_6_NLCA2_SU0_SUM0_SUS128_SVW1_VWA1_VWB2_WG64_4_1_WGM8_WGMXCC8_WGMXCCGn1
    SolutionIndex: 383
    SolutionNameMin: Cijk_Alik_Bljk_F8NBS_STA_BH_Bias_HAS_SABV_SAV_UserArgs_MT256x176x128_MI16x16x1_SN_LDSB0_GRVWB8_GSU1_GSUC0_GSUWGMRR0_K1_LBSPPB128_MIWT4_11_NLCA2_SU0_SUM0_SUS128_SVW4_VWA4_VWB1_WG64_4_1_WGM6_WGMXCC8_WGMXCCGn1
- - - [2048, 16, 1, 5120]
    - [123, 0.0]
  - - [2048, 32, 1, 5120]
    - [131, 0.0]
  - - [2048, 48, 1, 5120]
    - [131, 0.0]
  - - [2048, 64, 1, 5120]
    - [131, 0.0]
  - - [2048, 80, 1, 5120]
    - [132, 0.0]
  - - [2048, 96, 1, 5120]
    - [132, 0.0]
  - - [2048, 112, 1, 5120]
    - [132, 0.0]
  - - [2048, 128, 1, 5120]
    - [132, 0.0]
  - - [2048, 144, 1, 5120]
    - [130, 0.0]
  - - [2048, 160, 1, 5120]
    - [133, 0.0]
  - - [4096, 16, 1, 5120]
    - [138, 0.0]
  - - [4096, 32, 1, 5120]
    - [131, 0.0]
  - - [4096, 48, 1, 5120]
    - [132, 0.0]
  - - [4096, 64, 1, 5120]
    - [132, 0.0]
  - - [4096, 80, 1, 5120]
    - [133, 0.0]
  - - [4096, 96, 1, 5120]
    - [133, 0.0]
  - - [4096, 112, 1, 5120]
    - [139, 0.0]
  - - [4096, 128, 1, 5120]
    - [133, 0.0]
  - - [4096, 144, 1, 5120]
    - [136, 0.0]
  - - [4096, 160, 1, 5120]
    - [140, 0.0]
  - - [16384, 16, 1, 5120]
    - [144, 0.0]
  - - [16384, 32, 1, 5120]
    - [145, 0.0]
  - - [16384, 48, 1, 5120]
    - [146, 0.0]
  - - [16384, 64, 1, 5120]
    - [140, 0.0]
  - - [16384, 80, 1, 5120]
    - [147, 0.0]
  - - [16384, 96, 1, 5120]
    - [141, 0.0]
  - - [16384, 112, 1, 5120]
    - [143, 0.0]
  - - [16384, 128, 1, 5120]
    - [143, 0.0]
  - - [16384, 144, 1, 5120]
    - [148, 0.0]
  - - [16384, 160, 1, 5120]
    - [147, 0.0]
  - - [5120, 16, 1, 8192]
    - [138, 0.0]
  - - [5120, 32, 1, 8192]
    - [132, 0.0]
  - - [5120, 48, 1, 8192]
    - [132, 0.0]
  - - [5120, 64, 1, 8192]
    - [133, 0.0]
  - - [5120, 80, 1, 8192]
    - [133, 0.0]
  - - [5120, 96, 1, 8192]
    - [133, 0.0]
  - - [5120, 112, 1, 8192]
    - [167, 0.0]
  - - [5120, 128, 1, 8192]
    - [140, 0.0]
  - - [5120, 144, 1, 8192]
    - [136, 0.0]
  - - [5120, 160, 1, 8192]
    - [140, 0.0]
  - - [5120, 176, 1, 8192]
    - [140, 0.0]
  - - [5120, 192, 1, 8192]
    - [140, 0.0]
  - - [5120, 208, 1, 8192]
    - [140, 0.0]
  - - [5120, 224, 1, 8192]
    - [140, 0.0]
  - - [5120, 240, 1, 8192]
    - [141, 0.0]
  - - [5120, 256, 1, 8192]
    - [143, 0.0]
  - - [2048, 176, 1, 5120]
    - [130, 0.0]
  - - [2048, 192, 1, 5120]
    - [130, 0.0]
  - - [2048, 208, 1, 5120]
    - [133, 0.0]
  - - [2048, 224, 1, 5120]
    - [133, 0.0]
  - - [2048, 240, 1, 5120]
    - [133, 0.0]
  - - [2048, 256, 1, 5120]
    - [133, 0.0]
  - - [2048, 272, 1, 5120]
    - [130, 0.0]
  - - [2048, 288, 1, 5120]
    - [130, 0.0]
  - - [2048, 304, 1, 5120]
    - [134, 0.0]
  - - [2048, 320, 1, 5120]
    - [135, 0.0]
  - - [2048, 336, 1, 5120]
    - [136, 0.0]
  - - [2048, 352, 1, 5120]
    - [137, 0.0]
  - - [2048, 368, 1, 5120]
    - [136, 0.0]
  - - [2048, 384, 1, 5120]
    - [137, 0.0]
  - - [2048, 400, 1, 5120]
    - [4, 0.0]
  - - [2048, 416, 1, 5120]
    - [6, 0.0]
  - - [2048, 432, 1, 5120]
    - [7, 0.0]
  - - [2048, 448, 1, 5120]
    - [4, 0.0]
  - - [2048, 464, 1, 5120]
    - [4, 0.0]
  - - [2048, 480, 1, 5120]
    - [6, 0.0]
  - - [2048, 496, 1, 5120]
    - [6, 0.0]
  - - [2048, 512, 1, 5120]
    - [6, 0.0]
  - - [2048, 544, 1, 5120]
    - [5, 0.0]
  - - [2048, 576, 1, 5120]
    - [5, 0.0]
  - - [2048, 608, 1, 5120]
    - [6, 0.0]
  - - [2048, 640, 1, 5120]
    - [8, 0.0]
  - - [2048, 672, 1, 5120]
    - [9, 0.0]
  - - [2048, 704, 1, 5120]
    - [8, 0.0]
  - - [2048, 736, 1, 5120]
    - [10, 0.0]
  - - [2048, 768, 1, 5120]
    - [8, 0.0]
  - - [2048, 800, 1, 5120]
    - [11, 0.0]
  - - [2048, 832, 1, 5120]
    - [12, 0.0]
  - - [2048, 864, 1, 5120]
    - [9, 0.0]
  - - [2048, 896, 1, 5120]
    - [8, 0.0]
  - - [2048, 928, 1, 5120]
    - [12, 0.0]
  - - [2048, 960, 1, 5120]
    - [8, 0.0]
  - - [2048, 992, 1, 5120]
    - [13, 0.0]
  - - [2048, 1024, 1, 5120]
    - [8, 0.0]
  - - [2048, 1088, 1, 5120]
    - [8, 0.0]
  - - [2048, 1152, 1, 5120]
    - [12, 0.0]
  - - [2048, 1216, 1, 5120]
    - [8, 0.0]
  - - [2048, 1280, 1, 5120]
    - [14, 0.0]
  - - [2048, 1344, 1, 5120]
    - [15, 0.0]
  - - [2048, 1408, 1, 5120]
    - [16, 0.0]
  - - [2048, 1472, 1, 5120]
    - [16, 0.0]
  - - [2048, 1536, 1, 5120]
    - [16, 0.0]
  - - [2048, 1600, 1, 5120]
    - [16, 0.0]
  - - [2048, 1664, 1, 5120]
    - [16, 0.0]
  - - [2048, 1728, 1, 5120]
    - [16, 0.0]
  - - [2048, 1792, 1, 5120]
    - [15, 0.0]
  - - [2048, 1856, 1, 5120]
    - [17, 0.0]
  - - [2048, 1920, 1, 5120]
    - [18, 0.0]
  - - [2048, 1984, 1, 5120]
    - [17, 0.0]
  - - [2048, 2048, 1, 5120]
    - [17, 0.0]
  - - [2048, 2176, 1, 5120]
    - [17, 0.0]
  - - [2048, 2304, 1, 5120]
    - [19, 0.0]
  - - [2048, 2432, 1, 5120]
    - [17, 0.0]
  - - [2048, 2560, 1, 5120]
    - [20, 0.0]
  - - [2048, 2688, 1, 5120]
    - [21, 0.0]
  - - [2048, 2816, 1, 5120]
    - [22, 0.0]
  - - [2048, 2944, 1, 5120]
    - [23, 0.0]
  - - [2048, 3072, 1, 5120]
    - [24, 0.0]
  - - [2048, 3200, 1, 5120]
    - [25, 0.0]
  - - [2048, 3328, 1, 5120]
    - [24, 0.0]
  - - [2048, 3456, 1, 5120]
    - [25, 0.0]
  - - [2048, 3584, 1, 5120]
    - [24, 0.0]
  - - [2048, 3712, 1, 5120]
    - [26, 0.0]
  - - [2048, 3840, 1, 5120]
    - [27, 0.0]
  - - [2048, 3968, 1, 5120]
    - [28, 0.0]
  - - [2048, 4096, 1, 5120]
    - [29, 0.0]
  - - [4096, 176, 1, 5120]
    - [140, 0.0]
  - - [4096, 192, 1, 5120]
    - [140, 0.0]
  - - [4096, 208, 1, 5120]
    - [140, 0.0]
  - - [4096, 224, 1, 5120]
    - [140, 0.0]
  - - [4096, 240, 1, 5120]
    - [140, 0.0]
  - - [4096, 256, 1, 5120]
    - [140, 0.0]
  - - [4096, 272, 1, 5120]
    - [141, 0.0]
  - - [4096, 288, 1, 5120]
    - [141, 0.0]
  - - [4096, 304, 1, 5120]
    - [142, 0.0]
  - - [4096, 320, 1, 5120]
    - [143, 0.0]
  - - [4096, 336, 1, 5120]
    - [141, 0.0]
  - - [4096, 352, 1, 5120]
    - [141, 0.0]
  - - [4096, 368, 1, 5120]
    - [141, 0.0]
  - - [4096, 384, 1, 5120]
    - [143, 0.0]
  - - [4096, 400, 1, 5120]
    - [8, 0.0]
  - - [4096, 416, 1, 5120]
    - [13, 0.0]
  - - [4096, 432, 1, 5120]
    - [9, 0.0]
  - - [4096, 448, 1, 5120]
    - [8, 0.0]
  - - [4096, 464, 1, 5120]
    - [8, 0.0]
  - - [4096, 480, 1, 5120]
    - [8, 0.0]
  - - [4096, 496, 1, 5120]
    - [8, 0.0]
  - - [4096, 512, 1, 5120]
    - [8, 0.0]
  - - [4096, 544, 1, 5120]
    - [12, 0.0]
  - - [4096, 576, 1, 5120]
    - [12, 0.0]
  - - [4096, 608, 1, 5120]
    - [32, 0.0]
  - - [4096, 640, 1, 5120]
    - [32, 0.0]
  - - [4096, 672, 1, 5120]
    - [15, 0.0]
  - - [4096, 704, 1, 5120]
    - [33, 0.0]
  - - [4096, 736, 1, 5120]
    - [34, 0.0]
  - - [4096, 768, 1, 5120]
    - [15, 0.0]
  - - [4096, 800, 1, 5120]
    - [16, 0.0]
  - - [4096, 832, 1, 5120]
    - [16, 0.0]
  - - [4096, 864, 1, 5120]
    - [16, 0.0]
  - - [4096, 896, 1, 5120]
    - [35, 0.0]
  - - [4096, 928, 1, 5120]
    - [36, 0.0]
  - - [4096, 960, 1, 5120]
    - [17, 0.0]
  - - [4096, 992, 1, 5120]
    - [36, 0.0]
  - - [4096, 1024, 1, 5120]
    - [17, 0.0]
  - - [4096, 1088, 1, 5120]
    - [18, 0.0]
  - - [4096, 1152, 1, 5120]
    - [18, 0.0]
  - - [4096, 1216, 1, 5120]
    - [19, 0.0]
  - - [4096, 1280, 1, 5120]
    - [37, 0.0]
  - - [4096, 1344, 1, 5120]
    - [24, 0.0]
  - - [4096, 1408, 1, 5120]
    - [23, 0.0]
  - - [4096, 1472, 1, 5120]
    - [38, 0.0]
  - - [4096, 1536, 1, 5120]
    - [21, 0.0]
  - - [4096, 1600, 1, 5120]
    - [24, 0.0]
  - - [4096, 1664, 1, 5120]
    - [24, 0.0]
  - - [4096, 1728, 1, 5120]
    - [21, 0.0]
  - - [4096, 1792, 1, 5120]
    - [21, 0.0]
  - - [4096, 1856, 1, 5120]
    - [39, 0.0]
  - - [4096, 1920, 1, 5120]
    - [40, 0.0]
  - - [4096, 1984, 1, 5120]
    - [39, 0.0]
  - - [4096, 2048, 1, 5120]
    - [29, 0.0]
  - - [4096, 2176, 1, 5120]
    - [39, 0.0]
  - - [4096, 2304, 1, 5120]
    - [28, 0.0]
  - - [4096, 2432, 1, 5120]
    - [29, 0.0]
  - - [4096, 2560, 1, 5120]
    - [41, 0.0]
  - - [4096, 2688, 1, 5120]
    - [42, 0.0]
  - - [4096, 2816, 1, 5120]
    - [42, 0.0]
  - - [4096, 2944, 1, 5120]
    - [42, 0.0]
  - - [4096, 3072, 1, 5120]
    - [43, 0.0]
  - - [4096, 3200, 1, 5120]
    - [44, 0.0]
  - - [4096, 3328, 1, 5120]
    - [24, 0.0]
  - - [4096, 3456, 1, 5120]
    - [45, 0.0]
  - - [4096, 3584, 1, 5120]
    - [44, 0.0]
  - - [4096, 3712, 1, 5120]
    - [46, 0.0]
  - - [4096, 3840, 1, 5120]
    - [47, 0.0]
  - - [4096, 3968, 1, 5120]
    - [46, 0.0]
  - - [4096, 4096, 1, 5120]
    - [48, 0.0]
  - - [16384, 176, 1, 5120]
    - [149, 0.0]
  - - [16384, 192, 1, 5120]
    - [149, 0.0]
  - - [16384, 208, 1, 5120]
    - [150, 0.0]
  - - [16384, 224, 1, 5120]
    - [150, 0.0]
  - - [16384, 240, 1, 5120]
    - [151, 0.0]
  - - [16384, 256, 1, 5120]
    - [152, 0.0]
  - - [16384, 272, 1, 5120]
    - [153, 0.0]
  - - [16384, 288, 1, 5120]
    - [154, 0.0]
  - - [16384, 304, 1, 5120]
    - [155, 0.0]
  - - [16384, 320, 1, 5120]
    - [155, 0.0]
  - - [16384, 336, 1, 5120]
    - [156, 0.0]
  - - [16384, 352, 1, 5120]
    - [157, 0.0]
  - - [16384, 368, 1, 5120]
    - [157, 0.0]
  - - [16384, 384, 1, 5120]
    - [157, 0.0]
  - - [16384, 400, 1, 5120]
    - [51, 0.0]
  - - [16384, 416, 1, 5120]
    - [52, 0.0]
  - - [16384, 432, 1, 5120]
    - [52, 0.0]
  - - [16384, 448, 1, 5120]
    - [52, 0.0]
  - - [16384, 464, 1, 5120]
    - [53, 0.0]
  - - [16384, 480, 1, 5120]
    - [54, 0.0]
  - - [16384, 496, 1, 5120]
    - [29, 0.0]
  - - [16384, 512, 1, 5120]
    - [55, 0.0]
  - - [16384, 544, 1, 5120]
    - [56, 0.0]
  - - [16384, 576, 1, 5120]
    - [57, 0.0]
  - - [16384, 608, 1, 5120]
    - [41, 0.0]
  - - [16384, 640, 1, 5120]
    - [58, 0.0]
  - - [16384, 672, 1, 5120]
    - [59, 0.0]
  - - [16384, 704, 1, 5120]
    - [60, 0.0]
  - - [16384, 736, 1, 5120]
    - [61, 0.0]
  - - [16384, 768, 1, 5120]
    - [44, 0.0]
  - - [16384, 800, 1, 5120]
    - [62, 0.0]
  - - [16384, 832, 1, 5120]
    - [24, 0.0]
  - - [16384, 864, 1, 5120]
    - [24, 0.0]
  - - [16384, 896, 1, 5120]
    - [48, 0.0]
  - - [16384, 928, 1, 5120]
    - [63, 0.0]
  - - [16384, 960, 1, 5120]
    - [63, 0.0]
  - - [16384, 992, 1, 5120]
    - [64, 0.0]
  - - [16384, 1024, 1, 5120]
    - [65, 0.0]
  - - [16384, 1088, 1, 5120]
    - [63, 0.0]
  - - [16384, 1152, 1, 5120]
    - [66, 0.0]
  - - [16384, 1216, 1, 5120]
    - [21, 0.0]
  - - [16384, 1280, 1, 5120]
    - [24, 0.0]
  - - [16384, 1344, 1, 5120]
    - [24, 0.0]
  - - [16384, 1408, 1, 5120]
    - [42, 0.0]
  - - [16384, 1472, 1, 5120]
    - [67, 0.0]
  - - [16384, 1536, 1, 5120]
    - [24, 0.0]
  - - [16384, 1600, 1, 5120]
    - [24, 0.0]
  - - [16384, 1664, 1, 5120]
    - [21, 0.0]
  - - [16384, 1728, 1, 5120]
    - [21, 0.0]
  - - [16384, 1792, 1, 5120]
    - [24, 0.0]
  - - [16384, 1856, 1, 5120]
    - [24, 0.0]
  - - [16384, 1920, 1, 5120]
    - [24, 0.0]
  - - [16384, 1984, 1, 5120]
    - [48, 0.0]
  - - [16384, 2048, 1, 5120]
    - [63, 0.0]
  - - [16384, 2176, 1, 5120]
    - [68, 0.0]
  - - [16384, 2304, 1, 5120]
    - [66, 0.0]
  - - [16384, 2432, 1, 5120]
    - [69, 0.0]
  - - [16384, 2560, 1, 5120]
    - [24, 0.0]
  - - [16384, 2688, 1, 5120]
    - [21, 0.0]
  - - [16384, 2816, 1, 5120]
    - [42, 0.0]
  - - [16384, 2944, 1, 5120]
    - [24, 0.0]
  - - [16384, 3072, 1, 5120]
    - [21, 0.0]
  - - [16384, 3200, 1, 5120]
    - [63, 0.0]
  - - [16384, 3328, 1, 5120]
    - [63, 0.0]
  - - [16384, 3456, 1, 5120]
    - [21, 0.0]
  - - [16384, 3584, 1, 5120]
    - [44, 0.0]
  - - [16384, 3712, 1, 5120]
    - [24, 0.0]
  - - [16384, 3840, 1, 5120]
    - [21, 0.0]
  - - [16384, 3968, 1, 5120]
    - [24, 0.0]
  - - [16384, 4096, 1, 5120]
    - [48, 0.0]
  - - [5120, 272, 1, 8192]
    - [141, 0.0]
  - - [5120, 288, 1, 8192]
    - [141, 0.0]
  - - [5120, 304, 1, 8192]
    - [142, 0.0]
  - - [5120, 320, 1, 8192]
    - [143, 0.0]
  - - [5120, 336, 1, 8192]
    - [142, 0.0]
  - - [5120, 352, 1, 8192]
    - [143, 0.0]
  - - [5120, 368, 1, 8192]
    - [168, 0.0]
  - - [5120, 384, 1, 8192]
    - [168, 0.0]
  - - [5120, 400, 1, 8192]
    - [32, 0.0]
  - - [5120, 416, 1, 8192]
    - [8, 0.0]
  - - [5120, 432, 1, 8192]
    - [8, 0.0]
  - - [5120, 448, 1, 8192]
    - [8, 0.0]
  - - [5120, 464, 1, 8192]
    - [32, 0.0]
  - - [5120, 480, 1, 8192]
    - [33, 0.0]
  - - [5120, 496, 1, 8192]
    - [14, 0.0]
  - - [5120, 512, 1, 8192]
    - [32, 0.0]
  - - [5120, 544, 1, 8192]
    - [14, 0.0]
  - - [5120, 576, 1, 8192]
    - [15, 0.0]
  - - [5120, 608, 1, 8192]
    - [16, 0.0]
  - - [5120, 640, 1, 8192]
    - [70, 0.0]
  - - [5120, 672, 1, 8192]
    - [15, 0.0]
  - - [5120, 704, 1, 8192]
    - [70, 0.0]
  - - [5120, 736, 1, 8192]
    - [71, 0.0]
  - - [5120, 768, 1, 8192]
    - [72, 0.0]
  - - [5120, 800, 1, 8192]
    - [49, 0.0]
  - - [5120, 832, 1, 8192]
    - [17, 0.0]
  - - [5120, 864, 1, 8192]
    - [73, 0.0]
  - - [5120, 896, 1, 8192]
    - [74, 0.0]
  - - [5120, 928, 1, 8192]
    - [19, 0.0]
  - - [5120, 960, 1, 8192]
    - [18, 0.0]
  - - [5120, 992, 1, 8192]
    - [20, 0.0]
  - - [5120, 1024, 1, 8192]
    - [38, 0.0]
  - - [5120, 1088, 1, 8192]
    - [38, 0.0]
  - - [5120, 1152, 1, 8192]
    - [50, 0.0]
  - - [5120, 1216, 1, 8192]
    - [75, 0.0]
  - - [5120, 1280, 1, 8192]
    - [76, 0.0]
  - - [5120, 1344, 1, 8192]
    - [24, 0.0]
  - - [5120, 1408, 1, 8192]
    - [77, 0.0]
  - - [5120, 1472, 1, 8192]
    - [78, 0.0]
  - - [5120, 1536, 1, 8192]
    - [79, 0.0]
  - - [5120, 1600, 1, 8192]
    - [80, 0.0]
  - - [5120, 1664, 1, 8192]
    - [29, 0.0]
  - - [5120, 1728, 1, 8192]
    - [53, 0.0]
  - - [5120, 1792, 1, 8192]
    - [29, 0.0]
  - - [5120, 1856, 1, 8192]
    - [29, 0.0]
  - - [5120, 1920, 1, 8192]
    - [79, 0.0]
  - - [5120, 1984, 1, 8192]
    - [81, 0.0]
  - - [5120, 2048, 1, 8192]
    - [82, 0.0]
  - - [5120, 2176, 1, 8192]
    - [83, 0.0]
  - - [5120, 2304, 1, 8192]
    - [83, 0.0]
  - - [5120, 2432, 1, 8192]
    - [83, 0.0]
  - - [5120, 2560, 1, 8192]
    - [84, 0.0]
  - - [5120, 2688, 1, 8192]
    - [85, 0.0]
  - - [5120, 2816, 1, 8192]
    - [84, 0.0]
  - - [5120, 2944, 1, 8192]
    - [86, 0.0]
  - - [5120, 3072, 1, 8192]
    - [87, 0.0]
  - - [5120, 3200, 1, 8192]
    - [88, 0.0]
  - - [5120, 3328, 1, 8192]
    - [89, 0.0]
  - - [5120, 3456, 1, 8192]
    - [87, 0.0]
  - - [5120, 3584, 1, 8192]
    - [90, 0.0]
  - - [5120, 3712, 1, 8192]
    - [91, 0.0]
  - - [5120, 3840, 1, 8192]
    - [89, 0.0]
  - - [5120, 3968, 1, 8192]
    - [81, 0.0]
  - - [5120, 4096, 1, 8192]
    - [82, 0.0]
  - - [5120, 16, 1, 2048]
    - [166, 0.0]
  - - [5120, 32, 1, 2048]
    - [132, 0.0]
  - - [5120, 48, 1, 2048]
    - [132, 0.0]
  - - [5120, 64, 1, 2048]
    - [161, 0.0]
  - - [5120, 80, 1, 2048]
    - [161, 0.0]
  - - [5120, 96, 1, 2048]
    - [133, 0.0]
  - - [5120, 112, 1, 2048]
    - [161, 0.0]
  - - [5120, 128, 1, 2048]
    - [140, 0.0]
  - - [5120, 144, 1, 2048]
    - [136, 0.0]
  - - [5120, 160, 1, 2048]
    - [140, 0.0]
  - - [5120, 176, 1, 2048]
    - [140, 0.0]
  - - [5120, 192, 1, 2048]
    - [140, 0.0]
  - - [5120, 208, 1, 2048]
    - [140, 0.0]
  - - [5120, 224, 1, 2048]
    - [140, 0.0]
  - - [5120, 240, 1, 2048]
    - [141, 0.0]
  - - [5120, 256, 1, 2048]
    - [143, 0.0]
  - - [5120, 272, 1, 2048]
    - [141, 0.0]
  - - [5120, 288, 1, 2048]
    - [141, 0.0]
  - - [5120, 304, 1, 2048]
    - [141, 0.0]
  - - [5120, 320, 1, 2048]
    - [141, 0.0]
  - - [5120, 336, 1, 2048]
    - [141, 0.0]
  - - [5120, 352, 1, 2048]
    - [143, 0.0]
  - - [5120, 368, 1, 2048]
    - [143, 0.0]
  - - [5120, 384, 1, 2048]
    - [143, 0.0]
  - - [5120, 400, 1, 2048]
    - [92, 0.0]
  - - [5120, 416, 1, 2048]
    - [8, 0.0]
  - - [5120, 432, 1, 2048]
    - [8, 0.0]
  - - [5120, 448, 1, 2048]
    - [8, 0.0]
  - - [5120, 464, 1, 2048]
    - [92, 0.0]
  - - [5120, 480, 1, 2048]
    - [14, 0.0]
  - - [5120, 496, 1, 2048]
    - [14, 0.0]
  - - [5120, 512, 1, 2048]
    - [93, 0.0]
  - - [5120, 544, 1, 2048]
    - [32, 0.0]
  - - [5120, 576, 1, 2048]
    - [16, 0.0]
  - - [5120, 608, 1, 2048]
    - [10, 0.0]
  - - [5120, 640, 1, 2048]
    - [94, 0.0]
  - - [5120, 672, 1, 2048]
    - [34, 0.0]
  - - [5120, 704, 1, 2048]
    - [10, 0.0]
  - - [5120, 736, 1, 2048]
    - [95, 0.0]
  - - [5120, 768, 1, 2048]
    - [94, 0.0]
  - - [5120, 800, 1, 2048]
    - [96, 0.0]
  - - [5120, 832, 1, 2048]
    - [8, 0.0]
  - - [5120, 864, 1, 2048]
    - [97, 0.0]
  - - [5120, 896, 1, 2048]
    - [98, 0.0]
  - - [5120, 928, 1, 2048]
    - [96, 0.0]
  - - [5120, 960, 1, 2048]
    - [19, 0.0]
  - - [5120, 992, 1, 2048]
    - [14, 0.0]
  - - [5120, 1024, 1, 2048]
    - [50, 0.0]
  - - [5120, 1088, 1, 2048]
    - [75, 0.0]
  - - [5120, 1152, 1, 2048]
    - [50, 0.0]
  - - [5120, 1216, 1, 2048]
    - [75, 0.0]
  - - [5120, 1280, 1, 2048]
    - [76, 0.0]
  - - [5120, 1344, 1, 2048]
    - [21, 0.0]
  - - [5120, 1408, 1, 2048]
    - [99, 0.0]
  - - [5120, 1472, 1, 2048]
    - [19, 0.0]
  - - [5120, 1536, 1, 2048]
    - [39, 0.0]
  - - [5120, 1600, 1, 2048]
    - [32, 0.0]
  - - [5120, 1664, 1, 2048]
    - [29, 0.0]
  - - [5120, 1728, 1, 2048]
    - [39, 0.0]
  - - [5120, 1792, 1, 2048]
    - [29, 0.0]
  - - [5120, 1856, 1, 2048]
    - [19, 0.0]
  - - [5120, 1920, 1, 2048]
    - [26, 0.0]
  - - [5120, 1984, 1, 2048]
    - [75, 0.0]
  - - [5120, 2048, 1, 2048]
    - [75, 0.0]
  - - [5120, 2176, 1, 2048]
    - [75, 0.0]
  - - [5120, 2304, 1, 2048]
    - [83, 0.0]
  - - [5120, 2432, 1, 2048]
    - [100, 0.0]
  - - [5120, 2560, 1, 2048]
    - [51, 0.0]
  - - [5120, 2688, 1, 2048]
    - [21, 0.0]
  - - [5120, 2816, 1, 2048]
    - [77, 0.0]
  - - [5120, 2944, 1, 2048]
    - [76, 0.0]
  - - [5120, 3072, 1, 2048]
    - [101, 0.0]
  - - [5120, 3200, 1, 2048]
    - [75, 0.0]
  - - [5120, 3328, 1, 2048]
    - [102, 0.0]
  - - [5120, 3456, 1, 2048]
    - [103, 0.0]
  - - [5120, 3584, 1, 2048]
    - [91, 0.0]
  - - [5120, 3712, 1, 2048]
    - [104, 0.0]
  - - [5120, 3840, 1, 2048]
    - [105, 0.0]
  - - [5120, 3968, 1, 2048]
    - [21, 0.0]
  - - [5120, 4096, 1, 2048]
    - [106, 0.0]
  - - [896, 16, 1, 5120]
    - [123, 0.0]
  - - [896, 32, 1, 5120]
    - [124, 0.0]
  - - [896, 48, 1, 5120]
    - [124, 0.0]
  - - [896, 64, 1, 5120]
    - [125, 0.0]
  - - [896, 80, 1, 5120]
    - [125, 0.0]
  - - [896, 96, 1, 5120]
    - [125, 0.0]
  - - [896, 112, 1, 5120]
    - [125, 0.0]
  - - [896, 128, 1, 5120]
    - [125, 0.0]
  - - [896, 144, 1, 5120]
    - [126, 0.0]
  - - [896, 160, 1, 5120]
    - [126, 0.0]
  - - [1024, 16, 1, 5120]
    - [123, 0.0]
  - - [1024, 32, 1, 5120]
    - [124, 0.0]
  - - [1024, 48, 1, 5120]
    - [125, 0.0]
  - - [1024, 64, 1, 5120]
    - [131, 0.0]
  - - [1024, 80, 1, 5120]
    - [131, 0.0]
  - - [1024, 96, 1, 5120]
    - [125, 0.0]
  - - [1024, 112, 1, 5120]
    - [131, 0.0]
  - - [1024, 128, 1, 5120]
    - [131, 0.0]
  - - [1024, 144, 1, 5120]
    - [126, 0.0]
  - - [1024, 160, 1, 5120]
    - [127, 0.0]
  - - [1024, 176, 1, 5120]
    - [127, 0.0]
  - - [1024, 192, 1, 5120]
    - [128, 0.0]
  - - [1024, 208, 1, 5120]
    - [128, 0.0]
  - - [1024, 224, 1, 5120]
    - [128, 0.0]
  - - [1024, 240, 1, 5120]
    - [128, 0.0]
  - - [1024, 256, 1, 5120]
    - [128, 0.0]
  - - [1024, 272, 1, 5120]
    - [129, 0.0]
  - - [1024, 288, 1, 5120]
    - [130, 0.0]
  - - [1024, 304, 1, 5120]
    - [130, 0.0]
  - - [1024, 320, 1, 5120]
    - [130, 0.0]
  - - [1024, 336, 1, 5120]
    - [130, 0.0]
  - - [1024, 352, 1, 5120]
    - [130, 0.0]
  - - [1024, 368, 1, 5120]
    - [130, 0.0]
  - - [1024, 384, 1, 5120]
    - [130, 0.0]
  - - [1024, 400, 1, 5120]
    - [0, 0.0]
  - - [1024, 416, 1, 5120]
    - [0, 0.0]
  - - [1024, 432, 1, 5120]
    - [107, 0.0]
  - - [1024, 448, 1, 5120]
    - [0, 0.0]
  - - [1024, 464, 1, 5120]
    - [0, 0.0]
  - - [1024, 480, 1, 5120]
    - [0, 0.0]
  - - [1024, 496, 1, 5120]
    - [107, 0.0]
  - - [1024, 512, 1, 5120]
    - [0, 0.0]
  - - [1024, 544, 1, 5120]
    - [107, 0.0]
  - - [1024, 576, 1, 5120]
    - [0, 0.0]
  - - [1024, 608, 1, 5120]
    - [107, 0.0]
  - - [1024, 640, 1, 5120]
    - [108, 0.0]
  - - [1024, 672, 1, 5120]
    - [108, 0.0]
  - - [1024, 704, 1, 5120]
    - [109, 0.0]
  - - [1024, 736, 1, 5120]
    - [108, 0.0]
  - - [1024, 768, 1, 5120]
    - [108, 0.0]
  - - [1024, 800, 1, 5120]
    - [108, 0.0]
  - - [1024, 832, 1, 5120]
    - [108, 0.0]
  - - [1024, 864, 1, 5120]
    - [108, 0.0]
  - - [1024, 896, 1, 5120]
    - [109, 0.0]
  - - [1024, 928, 1, 5120]
    - [108, 0.0]
  - - [1024, 960, 1, 5120]
    - [108, 0.0]
  - - [1024, 992, 1, 5120]
    - [108, 0.0]
  - - [1024, 1024, 1, 5120]
    - [108, 0.0]
  - - [5120, 16, 1, 1024]
    - [160, 0.0]
  - - [5120, 32, 1, 1024]
    - [349, 0.0]
  - - [5120, 48, 1, 1024]
    - [350, 0.0]
  - - [5120, 64, 1, 1024]
    - [161, 0.0]
  - - [5120, 80, 1, 1024]
    - [161, 0.0]
  - - [5120, 96, 1, 1024]
    - [133, 0.0]
  - - [5120, 112, 1, 1024]
    - [161, 0.0]
  - - [5120, 128, 1, 1024]
    - [162, 0.0]
  - - [5120, 144, 1, 1024]
    - [136, 0.0]
  - - [5120, 160, 1, 1024]
    - [163, 0.0]
  - - [896, 176, 1, 5120]
    - [127, 0.0]
  - - [896, 192, 1, 5120]
    - [128, 0.0]
  - - [896, 208, 1, 5120]
    - [128, 0.0]
  - - [896, 224, 1, 5120]
    - [127, 0.0]
  - - [896, 240, 1, 5120]
    - [128, 0.0]
  - - [896, 256, 1, 5120]
    - [128, 0.0]
  - - [896, 272, 1, 5120]
    - [128, 0.0]
  - - [896, 288, 1, 5120]
    - [128, 0.0]
  - - [896, 304, 1, 5120]
    - [128, 0.0]
  - - [896, 320, 1, 5120]
    - [129, 0.0]
  - - [896, 336, 1, 5120]
    - [129, 0.0]
  - - [896, 352, 1, 5120]
    - [130, 0.0]
  - - [896, 368, 1, 5120]
    - [130, 0.0]
  - - [896, 384, 1, 5120]
    - [130, 0.0]
  - - [896, 400, 1, 5120]
    - [2, 0.0]
  - - [896, 416, 1, 5120]
    - [2, 0.0]
  - - [896, 432, 1, 5120]
    - [1, 0.0]
  - - [896, 448, 1, 5120]
    - [1, 0.0]
  - - [896, 464, 1, 5120]
    - [2, 0.0]
  - - [896, 480, 1, 5120]
    - [1, 0.0]
  - - [896, 496, 1, 5120]
    - [2, 0.0]
  - - [896, 512, 1, 5120]
    - [2, 0.0]
  - - [896, 544, 1, 5120]
    - [2, 0.0]
  - - [896, 576, 1, 5120]
    - [1, 0.0]
  - - [896, 608, 1, 5120]
    - [1, 0.0]
  - - [896, 640, 1, 5120]
    - [2, 0.0]
  - - [896, 672, 1, 5120]
    - [110, 0.0]
  - - [896, 704, 1, 5120]
    - [4, 0.0]
  - - [896, 736, 1, 5120]
    - [4, 0.0]
  - - [896, 768, 1, 5120]
    - [4, 0.0]
  - - [896, 800, 1, 5120]
    - [5, 0.0]
  - - [896, 832, 1, 5120]
    - [5, 0.0]
  - - [896, 864, 1, 5120]
    - [3, 0.0]
  - - [896, 896, 1, 5120]
    - [6, 0.0]
  - - [896, 928, 1, 5120]
    - [6, 0.0]
  - - [896, 960, 1, 5120]
    - [6, 0.0]
  - - [896, 992, 1, 5120]
    - [6, 0.0]
  - - [896, 1024, 1, 5120]
    - [6, 0.0]
  - - [896, 1088, 1, 5120]
    - [6, 0.0]
  - - [896, 1152, 1, 5120]
    - [111, 0.0]
  - - [896, 1216, 1, 5120]
    - [6, 0.0]
  - - [896, 1280, 1, 5120]
    - [111, 0.0]
  - - [896, 1344, 1, 5120]
    - [111, 0.0]
  - - [896, 1408, 1, 5120]
    - [30, 0.0]
  - - [896, 1472, 1, 5120]
    - [13, 0.0]
  - - [896, 1536, 1, 5120]
    - [112, 0.0]
  - - [896, 1600, 1, 5120]
    - [113, 0.0]
  - - [896, 1664, 1, 5120]
    - [113, 0.0]
  - - [896, 1728, 1, 5120]
    - [114, 0.0]
  - - [896, 1792, 1, 5120]
    - [12, 0.0]
  - - [896, 1856, 1, 5120]
    - [115, 0.0]
  - - [896, 1920, 1, 5120]
    - [114, 0.0]
  - - [896, 1984, 1, 5120]
    - [115, 0.0]
  - - [896, 2048, 1, 5120]
    - [13, 0.0]
  - - [896, 2176, 1, 5120]
    - [115, 0.0]
  - - [896, 2304, 1, 5120]
    - [115, 0.0]
  - - [896, 2432, 1, 5120]
    - [115, 0.0]
  - - [896, 2560, 1, 5120]
    - [115, 0.0]
  - - [896, 2688, 1, 5120]
    - [115, 0.0]
  - - [896, 2816, 1, 5120]
    - [116, 0.0]
  - - [896, 2944, 1, 5120]
    - [116, 0.0]
  - - [896, 3072, 1, 5120]
    - [117, 0.0]
  - - [896, 3200, 1, 5120]
    - [116, 0.0]
  - - [896, 3328, 1, 5120]
    - [33, 0.0]
  - - [896, 3456, 1, 5120]
    - [118, 0.0]
  - - [896, 3584, 1, 5120]
    - [119, 0.0]
  - - [896, 3712, 1, 5120]
    - [118, 0.0]
  - - [896, 3840, 1, 5120]
    - [118, 0.0]
  - - [896, 3968, 1, 5120]
    - [118, 0.0]
  - - [896, 4096, 1, 5120]
    - [118, 0.0]
  - - [896, 4352, 1, 5120]
    - [169, 0.0]
  - - [896, 4608, 1, 5120]
    - [170, 0.0]
  - - [896, 4864, 1, 5120]
    - [171, 0.0]
  - - [896, 5120, 1, 5120]
    - [171, 0.0]
  - - [896, 5376, 1, 5120]
    - [170, 0.0]
  - - [896, 5632, 1, 5120]
    - [172, 0.0]
  - - [896, 5888, 1, 5120]
    - [173, 0.0]
  - - [896, 6144, 1, 5120]
    - [174, 0.0]
  - - [896, 6400, 1, 5120]
    - [175, 0.0]
  - - [896, 6656, 1, 5120]
    - [175, 0.0]
  - - [896, 6912, 1, 5120]
    - [176, 0.0]
  - - [896, 7168, 1, 5120]
    - [177, 0.0]
  - - [896, 7424, 1, 5120]
    - [177, 0.0]
  - - [896, 7680, 1, 5120]
    - [177, 0.0]
  - - [896, 7936, 1, 5120]
    - [177, 0.0]
  - - [896, 8192, 1, 5120]
    - [178, 0.0]
  - - [896, 8448, 1, 5120]
    - [179, 0.0]
  - - [896, 8704, 1, 5120]
    - [179, 0.0]
  - - [896, 8960, 1, 5120]
    - [180, 0.0]
  - - [896, 9216, 1, 5120]
    - [181, 0.0]
  - - [896, 9728, 1, 5120]
    - [179, 0.0]
  - - [896, 9984, 1, 5120]
    - [182, 0.0]
  - - [5120, 16, 1, 640]
    - [158, 0.0]
  - - [5120, 32, 1, 640]
    - [290, 0.0]
  - - [5120, 48, 1, 640]
    - [291, 0.0]
  - - [5120, 64, 1, 640]
    - [292, 0.0]
  - - [5120, 80, 1, 640]
    - [293, 0.0]
  - - [5120, 96, 1, 640]
    - [294, 0.0]
  - - [5120, 112, 1, 640]
    - [292, 0.0]
  - - [5120, 128, 1, 640]
    - [295, 0.0]
  - - [5120, 144, 1, 640]
    - [296, 0.0]
  - - [5120, 160, 1, 640]
    - [297, 0.0]
  - - [5120, 176, 1, 640]
    - [298, 0.0]
  - - [5120, 192, 1, 640]
    - [299, 0.0]
  - - [5120, 208, 1, 640]
    - [159, 0.0]
  - - [5120, 224, 1, 640]
    - [300, 0.0]
  - - [5120, 240, 1, 640]
    - [301, 0.0]
  - - [5120, 256, 1, 640]
    - [299, 0.0]
  - - [5120, 272, 1, 640]
    - [302, 0.0]
  - - [5120, 288, 1, 640]
    - [303, 0.0]
  - - [5120, 304, 1, 640]
    - [299, 0.0]
  - - [5120, 320, 1, 640]
    - [304, 0.0]
  - - [5120, 336, 1, 640]
    - [305, 0.0]
  - - [5120, 352, 1, 640]
    - [306, 0.0]
  - - [5120, 368, 1, 640]
    - [306, 0.0]
  - - [5120, 384, 1, 640]
    - [307, 0.0]
  - - [5120, 400, 1, 640]
    - [308, 0.0]
  - - [5120, 416, 1, 640]
    - [306, 0.0]
  - - [5120, 432, 1, 640]
    - [306, 0.0]
  - - [5120, 448, 1, 640]
    - [309, 0.0]
  - - [5120, 464, 1, 640]
    - [310, 0.0]
  - - [5120, 480, 1, 640]
    - [300, 0.0]
  - - [5120, 496, 1, 640]
    - [311, 0.0]
  - - [5120, 512, 1, 640]
    - [311, 0.0]
  - - [5120, 544, 1, 640]
    - [312, 0.0]
  - - [5120, 576, 1, 640]
    - [313, 0.0]
  - - [5120, 608, 1, 640]
    - [314, 0.0]
  - - [5120, 640, 1, 640]
    - [315, 0.0]
  - - [5120, 672, 1, 640]
    - [315, 0.0]
  - - [5120, 704, 1, 640]
    - [311, 0.0]
  - - [5120, 736, 1, 640]
    - [316, 0.0]
  - - [5120, 768, 1, 640]
    - [317, 0.0]
  - - [5120, 800, 1, 640]
    - [318, 0.0]
  - - [5120, 832, 1, 640]
    - [307, 0.0]
  - - [5120, 864, 1, 640]
    - [319, 0.0]
  - - [5120, 896, 1, 640]
    - [307, 0.0]
  - - [5120, 928, 1, 640]
    - [318, 0.0]
  - - [5120, 960, 1, 640]
    - [307, 0.0]
  - - [5120, 992, 1, 640]
    - [320, 0.0]
  - - [5120, 1024, 1, 640]
    - [320, 0.0]
  - - [5120, 1088, 1, 640]
    - [321, 0.0]
  - - [5120, 1152, 1, 640]
    - [322, 0.0]
  - - [5120, 1216, 1, 640]
    - [323, 0.0]
  - - [5120, 1280, 1, 640]
    - [324, 0.0]
  - - [5120, 1344, 1, 640]
    - [325, 0.0]
  - - [5120, 1408, 1, 640]
    - [324, 0.0]
  - - [5120, 1472, 1, 640]
    - [326, 0.0]
  - - [5120, 1536, 1, 640]
    - [327, 0.0]
  - - [5120, 1600, 1, 640]
    - [326, 0.0]
  - - [5120, 1664, 1, 640]
    - [328, 0.0]
  - - [5120, 1728, 1, 640]
    - [329, 0.0]
  - - [5120, 1792, 1, 640]
    - [328, 0.0]
  - - [5120, 1856, 1, 640]
    - [327, 0.0]
  - - [5120, 1920, 1, 640]
    - [330, 0.0]
  - - [5120, 1984, 1, 640]
    - [331, 0.0]
  - - [5120, 2048, 1, 640]
    - [332, 0.0]
  - - [5120, 2176, 1, 640]
    - [332, 0.0]
  - - [5120, 2304, 1, 640]
    - [332, 0.0]
  - - [5120, 2432, 1, 640]
    - [333, 0.0]
  - - [5120, 2560, 1, 640]
    - [334, 0.0]
  - - [5120, 2688, 1, 640]
    - [335, 0.0]
  - - [5120, 2816, 1, 640]
    - [336, 0.0]
  - - [5120, 2944, 1, 640]
    - [337, 0.0]
  - - [5120, 3072, 1, 640]
    - [338, 0.0]
  - - [5120, 3200, 1, 640]
    - [339, 0.0]
  - - [5120, 3328, 1, 640]
    - [340, 0.0]
  - - [5120, 3456, 1, 640]
    - [337, 0.0]
  - - [5120, 3584, 1, 640]
    - [341, 0.0]
  - - [5120, 3712, 1, 640]
    - [342, 0.0]
  - - [5120, 3840, 1, 640]
    - [341, 0.0]
  - - [5120, 3968, 1, 640]
    - [334, 0.0]
  - - [5120, 4096, 1, 640]
    - [336, 0.0]
  - - [5120, 4352, 1, 640]
    - [343, 0.0]
  - - [5120, 4608, 1, 640]
    - [343, 0.0]
  - - [5120, 4864, 1, 640]
    - [336, 0.0]
  - - [5120, 5120, 1, 640]
    - [334, 0.0]
  - - [5120, 5376, 1, 640]
    - [336, 0.0]
  - - [5120, 5632, 1, 640]
    - [334, 0.0]
  - - [5120, 5888, 1, 640]
    - [344, 0.0]
  - - [5120, 6144, 1, 640]
    - [336, 0.0]
  - - [5120, 6400, 1, 640]
    - [344, 0.0]
  - - [5120, 6656, 1, 640]
    - [341, 0.0]
  - - [5120, 6912, 1, 640]
    - [338, 0.0]
  - - [5120, 7168, 1, 640]
    - [345, 0.0]
  - - [5120, 7424, 1, 640]
    - [345, 0.0]
  - - [5120, 7680, 1, 640]
    - [345, 0.0]
  - - [5120, 7936, 1, 640]
    - [334, 0.0]
  - - [5120, 8192, 1, 640]
    - [346, 0.0]
  - - [5120, 8448, 1, 640]
    - [334, 0.0]
  - - [5120, 8704, 1, 640]
    - [334, 0.0]
  - - [5120, 8960, 1, 640]
    - [336, 0.0]
  - - [5120, 9216, 1, 640]
    - [334, 0.0]
  - - [5120, 9728, 1, 640]
    - [334, 0.0]
  - - [5120, 9984, 1, 640]
    - [347, 0.0]
  - - [1024, 1088, 1, 5120]
    - [6, 0.0]
  - - [1024, 1152, 1, 5120]
    - [5, 0.0]
  - - [1024, 1216, 1, 5120]
    - [6, 0.0]
  - - [1024, 1280, 1, 5120]
    - [31, 0.0]
  - - [1024, 1344, 1, 5120]
    - [10, 0.0]
  - - [1024, 1408, 1, 5120]
    - [30, 0.0]
  - - [1024, 1472, 1, 5120]
    - [13, 0.0]
  - - [1024, 1536, 1, 5120]
    - [10, 0.0]
  - - [1024, 1600, 1, 5120]
    - [115, 0.0]
  - - [1024, 1664, 1, 5120]
    - [12, 0.0]
  - - [1024, 1728, 1, 5120]
    - [8, 0.0]
  - - [1024, 1792, 1, 5120]
    - [115, 0.0]
  - - [1024, 1856, 1, 5120]
    - [115, 0.0]
  - - [1024, 1920, 1, 5120]
    - [12, 0.0]
  - - [1024, 1984, 1, 5120]
    - [115, 0.0]
  - - [1024, 2048, 1, 5120]
    - [8, 0.0]
  - - [1024, 2176, 1, 5120]
    - [115, 0.0]
  - - [1024, 2304, 1, 5120]
    - [115, 0.0]
  - - [1024, 2432, 1, 5120]
    - [115, 0.0]
  - - [1024, 2560, 1, 5120]
    - [116, 0.0]
  - - [1024, 2688, 1, 5120]
    - [118, 0.0]
  - - [1024, 2816, 1, 5120]
    - [32, 0.0]
  - - [1024, 2944, 1, 5120]
    - [118, 0.0]
  - - [1024, 3072, 1, 5120]
    - [15, 0.0]
  - - [1024, 3200, 1, 5120]
    - [118, 0.0]
  - - [1024, 3328, 1, 5120]
    - [118, 0.0]
  - - [1024, 3456, 1, 5120]
    - [118, 0.0]
  - - [1024, 3584, 1, 5120]
    - [118, 0.0]
  - - [1024, 3712, 1, 5120]
    - [120, 0.0]
  - - [1024, 3840, 1, 5120]
    - [17, 0.0]
  - - [1024, 3968, 1, 5120]
    - [121, 0.0]
  - - [1024, 4096, 1, 5120]
    - [121, 0.0]
  - - [1024, 4352, 1, 5120]
    - [171, 0.0]
  - - [1024, 4608, 1, 5120]
    - [238, 0.0]
  - - [1024, 4864, 1, 5120]
    - [170, 0.0]
  - - [1024, 5120, 1, 5120]
    - [239, 0.0]
  - - [1024, 5376, 1, 5120]
    - [214, 0.0]
  - - [1024, 5632, 1, 5120]
    - [214, 0.0]
  - - [5120, 176, 1, 1024]
    - [163, 0.0]
  - - [5120, 192, 1, 1024]
    - [351, 0.0]
  - - [5120, 208, 1, 1024]
    - [352, 0.0]
  - - [5120, 224, 1, 1024]
    - [353, 0.0]
  - - [5120, 240, 1, 1024]
    - [354, 0.0]
  - - [5120, 256, 1, 1024]
    - [355, 0.0]
  - - [5120, 272, 1, 1024]
    - [352, 0.0]
  - - [5120, 288, 1, 1024]
    - [356, 0.0]
  - - [5120, 304, 1, 1024]
    - [164, 0.0]
  - - [5120, 320, 1, 1024]
    - [164, 0.0]
  - - [5120, 336, 1, 1024]
    - [357, 0.0]
  - - [5120, 352, 1, 1024]
    - [165, 0.0]
  - - [5120, 368, 1, 1024]
    - [358, 0.0]
  - - [5120, 384, 1, 1024]
    - [359, 0.0]
  - - [5120, 400, 1, 1024]
    - [360, 0.0]
  - - [5120, 416, 1, 1024]
    - [122, 0.0]
  - - [5120, 432, 1, 1024]
    - [122, 0.0]
  - - [5120, 448, 1, 1024]
    - [8, 0.0]
  - - [5120, 464, 1, 1024]
    - [122, 0.0]
  - - [5120, 480, 1, 1024]
    - [122, 0.0]
  - - [5120, 496, 1, 1024]
    - [357, 0.0]
  - - [5120, 512, 1, 1024]
    - [10, 0.0]
  - - [5120, 544, 1, 1024]
    - [361, 0.0]
  - - [5120, 576, 1, 1024]
    - [10, 0.0]
  - - [5120, 608, 1, 1024]
    - [357, 0.0]
  - - [5120, 640, 1, 1024]
    - [362, 0.0]
  - - [5120, 672, 1, 1024]
    - [363, 0.0]
  - - [5120, 704, 1, 1024]
    - [364, 0.0]
  - - [5120, 736, 1, 1024]
    - [364, 0.0]
  - - [5120, 768, 1, 1024]
    - [359, 0.0]
  - - [5120, 800, 1, 1024]
    - [359, 0.0]
  - - [5120, 832, 1, 1024]
    - [358, 0.0]
  - - [5120, 864, 1, 1024]
    - [358, 0.0]
  - - [5120, 896, 1, 1024]
    - [360, 0.0]
  - - [5120, 928, 1, 1024]
    - [358, 0.0]
  - - [5120, 960, 1, 1024]
    - [358, 0.0]
  - - [5120, 992, 1, 1024]
    - [365, 0.0]
  - - [5120, 1024, 1, 1024]
    - [366, 0.0]
  - - [5120, 1088, 1, 1024]
    - [366, 0.0]
  - - [5120, 1152, 1, 1024]
    - [366, 0.0]
  - - [5120, 1216, 1, 1024]
    - [367, 0.0]
  - - [5120, 1280, 1, 1024]
    - [324, 0.0]
  - - [5120, 1344, 1, 1024]
    - [367, 0.0]
  - - [5120, 1408, 1, 1024]
    - [367, 0.0]
  - - [5120, 1472, 1, 1024]
    - [326, 0.0]
  - - [5120, 1536, 1, 1024]
    - [327, 0.0]
  - - [5120, 1600, 1, 1024]
    - [368, 0.0]
  - - [5120, 1664, 1, 1024]
    - [327, 0.0]
  - - [5120, 1728, 1, 1024]
    - [329, 0.0]
  - - [5120, 1792, 1, 1024]
    - [329, 0.0]
  - - [5120, 1856, 1, 1024]
    - [329, 0.0]
  - - [5120, 1920, 1, 1024]
    - [329, 0.0]
  - - [5120, 1984, 1, 1024]
    - [369, 0.0]
  - - [5120, 2048, 1, 1024]
    - [331, 0.0]
  - - [5120, 2176, 1, 1024]
    - [332, 0.0]
  - - [5120, 2304, 1, 1024]
    - [332, 0.0]
  - - [5120, 2432, 1, 1024]
    - [370, 0.0]
  - - [5120, 2560, 1, 1024]
    - [370, 0.0]
  - - [5120, 2688, 1, 1024]
    - [371, 0.0]
  - - [5120, 2816, 1, 1024]
    - [334, 0.0]
  - - [5120, 2944, 1, 1024]
    - [372, 0.0]
  - - [5120, 3072, 1, 1024]
    - [373, 0.0]
  - - [5120, 3200, 1, 1024]
    - [374, 0.0]
  - - [5120, 3328, 1, 1024]
    - [374, 0.0]
  - - [5120, 3456, 1, 1024]
    - [375, 0.0]
  - - [5120, 3584, 1, 1024]
    - [376, 0.0]
  - - [5120, 3712, 1, 1024]
    - [341, 0.0]
  - - [5120, 3840, 1, 1024]
    - [341, 0.0]
  - - [5120, 3968, 1, 1024]
    - [336, 0.0]
  - - [5120, 4096, 1, 1024]
    - [334, 0.0]
  - - [5120, 4352, 1, 1024]
    - [377, 0.0]
  - - [5120, 4608, 1, 1024]
    - [378, 0.0]
  - - [5120, 4864, 1, 1024]
    - [334, 0.0]
  - - [5120, 5120, 1, 1024]
    - [379, 0.0]
  - - [5120, 5376, 1, 1024]
    - [334, 0.0]
  - - [5120, 5632, 1, 1024]
    - [334, 0.0]
  - - [896, 10240, 1, 5120]
    - [182, 0.0]
  - - [896, 10752, 1, 5120]
    - [183, 0.0]
  - - [896, 11264, 1, 5120]
    - [183, 0.0]
  - - [896, 11520, 1, 5120]
    - [184, 0.0]
  - - [896, 11776, 1, 5120]
    - [177, 0.0]
  - - [896, 12288, 1, 5120]
    - [176, 0.0]
  - - [896, 12544, 1, 5120]
    - [185, 0.0]
  - - [896, 12800, 1, 5120]
    - [186, 0.0]
  - - [896, 13056, 1, 5120]
    - [187, 0.0]
  - - [896, 13312, 1, 5120]
    - [188, 0.0]
  - - [896, 13824, 1, 5120]
    - [189, 0.0]
  - - [896, 14080, 1, 5120]
    - [190, 0.0]
  - - [896, 14336, 1, 5120]
    - [190, 0.0]
  - - [896, 14592, 1, 5120]
    - [191, 0.0]
  - - [896, 14848, 1, 5120]
    - [190, 0.0]
  - - [896, 15360, 1, 5120]
    - [189, 0.0]
  - - [896, 15872, 1, 5120]
    - [192, 0.0]
  - - [896, 16128, 1, 5120]
    - [189, 0.0]
  - - [896, 16384, 1, 5120]
    - [193, 0.0]
  - - [896, 16640, 1, 5120]
    - [194, 0.0]
  - - [896, 16896, 1, 5120]
    - [194, 0.0]
  - - [896, 17408, 1, 5120]
    - [193, 0.0]
  - - [896, 17664, 1, 5120]
    - [195, 0.0]
  - - [896, 17920, 1, 5120]
    - [196, 0.0]
  - - [896, 18432, 1, 5120]
    - [194, 0.0]
  - - [896, 19200, 1, 5120]
    - [194, 0.0]
  - - [896, 19456, 1, 5120]
    - [194, 0.0]
  - - [896, 19712, 1, 5120]
    - [197, 0.0]
  - - [896, 19968, 1, 5120]
    - [198, 0.0]
  - - [896, 20480, 1, 5120]
    - [199, 0.0]
  - - [896, 20736, 1, 5120]
    - [198, 0.0]
  - - [896, 21504, 1, 5120]
    - [198, 0.0]
  - - [896, 21760, 1, 5120]
    - [200, 0.0]
  - - [896, 22272, 1, 5120]
    - [201, 0.0]
  - - [896, 22528, 1, 5120]
    - [202, 0.0]
  - - [896, 23040, 1, 5120]
    - [203, 0.0]
  - - [896, 23296, 1, 5120]
    - [204, 0.0]
  - - [896, 23552, 1, 5120]
    - [177, 0.0]
  - - [896, 23808, 1, 5120]
    - [176, 0.0]
  - - [896, 24320, 1, 5120]
    - [205, 0.0]
  - - [896, 24576, 1, 5120]
    - [176, 0.0]
  - - [896, 25088, 1, 5120]
    - [175, 0.0]
  - - [896, 25344, 1, 5120]
    - [206, 0.0]
  - - [896, 25600, 1, 5120]
    - [207, 0.0]
  - - [896, 26112, 1, 5120]
    - [206, 0.0]
  - - [896, 26624, 1, 5120]
    - [208, 0.0]
  - - [896, 26880, 1, 5120]
    - [175, 0.0]
  - - [896, 27648, 1, 5120]
    - [175, 0.0]
  - - [896, 28160, 1, 5120]
    - [184, 0.0]
  - - [896, 28672, 1, 5120]
    - [176, 0.0]
  - - [896, 29184, 1, 5120]
    - [180, 0.0]
  - - [896, 29440, 1, 5120]
    - [189, 0.0]
  - - [896, 29696, 1, 5120]
    - [190, 0.0]
  - - [896, 29952, 1, 5120]
    - [190, 0.0]
  - - [896, 30464, 1, 5120]
    - [189, 0.0]
  - - [896, 30720, 1, 5120]
    - [190, 0.0]
  - - [896, 30976, 1, 5120]
    - [209, 0.0]
  - - [896, 31744, 1, 5120]
    - [190, 0.0]
  - - [896, 32000, 1, 5120]
    - [189, 0.0]
  - - [896, 32256, 1, 5120]
    - [209, 0.0]
  - - [896, 32768, 1, 5120]
    - [194, 0.0]
  - - [896, 33280, 1, 5120]
    - [195, 0.0]
  - - [896, 33792, 1, 5120]
    - [210, 0.0]
  - - [896, 34048, 1, 5120]
    - [210, 0.0]
  - - [896, 34560, 1, 5120]
    - [196, 0.0]
  - - [896, 34816, 1, 5120]
    - [195, 0.0]
  - - [896, 35328, 1, 5120]
    - [194, 0.0]
  - - [896, 35840, 1, 5120]
    - [195, 0.0]
  - - [896, 36608, 1, 5120]
    - [195, 0.0]
  - - [896, 36864, 1, 5120]
    - [194, 0.0]
  - - [896, 37120, 1, 5120]
    - [195, 0.0]
  - - [896, 37632, 1, 5120]
    - [196, 0.0]
  - - [896, 38400, 1, 5120]
    - [210, 0.0]
  - - [896, 38912, 1, 5120]
    - [196, 0.0]
  - - [896, 39168, 1, 5120]
    - [198, 0.0]
  - - [896, 39424, 1, 5120]
    - [198, 0.0]
  - - [896, 39680, 1, 5120]
    - [198, 0.0]
  - - [896, 39936, 1, 5120]
    - [200, 0.0]
  - - [896, 40960, 1, 5120]
    - [197, 0.0]
  - - [896, 41216, 1, 5120]
    - [198, 0.0]
  - - [896, 41472, 1, 5120]
    - [211, 0.0]
  - - [896, 42240, 1, 5120]
    - [198, 0.0]
  - - [896, 43008, 1, 5120]
    - [197, 0.0]
  - - [896, 43264, 1, 5120]
    - [200, 0.0]
  - - [896, 43520, 1, 5120]
    - [198, 0.0]
  - - [896, 43776, 1, 5120]
    - [211, 0.0]
  - - [896, 44544, 1, 5120]
    - [190, 0.0]
  - - [896, 44800, 1, 5120]
    - [191, 0.0]
  - - [896, 45056, 1, 5120]
    - [189, 0.0]
  - - [896, 46080, 1, 5120]
    - [190, 0.0]
  - - [896, 46592, 1, 5120]
    - [189, 0.0]
  - - [896, 47104, 1, 5120]
    - [190, 0.0]
  - - [896, 47616, 1, 5120]
    - [189, 0.0]
  - - [896, 47872, 1, 5120]
    - [190, 0.0]
  - - [896, 48384, 1, 5120]
    - [190, 0.0]
  - - [896, 48640, 1, 5120]
    - [190, 0.0]
  - - [896, 49152, 1, 5120]
    - [194, 0.0]
  - - [896, 49920, 1, 5120]
    - [176, 0.0]
  - - [896, 50176, 1, 5120]
    - [194, 0.0]
  - - [896, 50688, 1, 5120]
    - [210, 0.0]
  - - [896, 51200, 1, 5120]
    - [194, 0.0]
  - - [896, 51968, 1, 5120]
    - [194, 0.0]
  - - [896, 52224, 1, 5120]
    - [212, 0.0]
  - - [896, 52992, 1, 5120]
    - [194, 0.0]
  - - [896, 53248, 1, 5120]
    - [194, 0.0]
  - - [896, 53504, 1, 5120]
    - [210, 0.0]
  - - [896, 53760, 1, 5120]
    - [210, 0.0]
  - - [896, 55296, 1, 5120]
    - [212, 0.0]
  - - [896, 55552, 1, 5120]
    - [194, 0.0]
  - - [896, 56320, 1, 5120]
    - [194, 0.0]
  - - [896, 56576, 1, 5120]
    - [194, 0.0]
  - - [896, 57344, 1, 5120]
    - [196, 0.0]
  - - [896, 57600, 1, 5120]
    - [196, 0.0]
  - - [896, 58368, 1, 5120]
    - [212, 0.0]
  - - [896, 58880, 1, 5120]
    - [176, 0.0]
  - - [896, 59136, 1, 5120]
    - [211, 0.0]
  - - [896, 59392, 1, 5120]
    - [198, 0.0]
  - - [896, 59904, 1, 5120]
    - [197, 0.0]
  - - [896, 60928, 1, 5120]
    - [177, 0.0]
  - - [896, 61440, 1, 5120]
    - [198, 0.0]
  - - [896, 61952, 1, 5120]
    - [211, 0.0]
  - - [896, 62208, 1, 5120]
    - [197, 0.0]
  - - [896, 63232, 1, 5120]
    - [197, 0.0]
  - - [896, 63488, 1, 5120]
    - [213, 0.0]
  - - [896, 64000, 1, 5120]
    - [198, 0.0]
  - - [896, 64512, 1, 5120]
    - [213, 0.0]
  - - [896, 64768, 1, 5120]
    - [198, 0.0]
  - - [896, 65280, 1, 5120]
    - [199, 0.0]
  - - [896, 65536, 1, 5120]
    - [211, 0.0]
  - - [896, 66560, 1, 5120]
    - [177, 0.0]
  - - [896, 66816, 1, 5120]
    - [194, 0.0]
  - - [896, 67584, 1, 5120]
    - [206, 0.0]
  - - [896, 68096, 1, 5120]
    - [177, 0.0]
  - - [896, 69120, 1, 5120]
    - [206, 0.0]
  - - [896, 69632, 1, 5120]
    - [194, 0.0]
  - - [896, 69888, 1, 5120]
    - [177, 0.0]
  - - [896, 70400, 1, 5120]
    - [196, 0.0]
  - - [896, 70656, 1, 5120]
    - [177, 0.0]
  - - [896, 71424, 1, 5120]
    - [194, 0.0]
  - - [896, 71680, 1, 5120]
    - [212, 0.0]
  - - [896, 72960, 1, 5120]
    - [196, 0.0]
  - - [896, 73216, 1, 5120]
    - [196, 0.0]
  - - [896, 73728, 1, 5120]
    - [194, 0.0]
  - - [896, 74240, 1, 5120]
    - [210, 0.0]
  - - [896, 75264, 1, 5120]
    - [195, 0.0]
  - - [896, 76032, 1, 5120]
    - [210, 0.0]
  - - [896, 76544, 1, 5120]
    - [196, 0.0]
  - - [896, 76800, 1, 5120]
    - [210, 0.0]
  - - [896, 77824, 1, 5120]
    - [210, 0.0]
  - - [896, 78848, 1, 5120]
    - [190, 0.0]
  - - [896, 79360, 1, 5120]
    - [192, 0.0]
  - - [896, 79872, 1, 5120]
    - [214, 0.0]
  - - [896, 80640, 1, 5120]
    - [190, 0.0]
  - - [896, 81664, 1, 5120]
    - [184, 0.0]
  - - [896, 81920, 1, 5120]
    - [175, 0.0]
  - - [896, 82432, 1, 5120]
    - [206, 0.0]
  - - [896, 82944, 1, 5120]
    - [197, 0.0]
  - - [896, 83200, 1, 5120]
    - [175, 0.0]
  - - [896, 84480, 1, 5120]
    - [198, 0.0]
  - - [896, 86016, 1, 5120]
    - [197, 0.0]
  - - [896, 86528, 1, 5120]
    - [211, 0.0]
  - - [896, 87296, 1, 5120]
    - [199, 0.0]
  - - [896, 88320, 1, 5120]
    - [175, 0.0]
  - - [896, 89088, 1, 5120]
    - [175, 0.0]
  - - [896, 89600, 1, 5120]
    - [175, 0.0]
  - - [896, 89856, 1, 5120]
    - [215, 0.0]
  - - [896, 90112, 1, 5120]
    - [175, 0.0]
  - - [896, 92160, 1, 5120]
    - [201, 0.0]
  - - [896, 93184, 1, 5120]
    - [196, 0.0]
  - - [896, 94208, 1, 5120]
    - [193, 0.0]
  - - [896, 95232, 1, 5120]
    - [210, 0.0]
  - - [896, 96000, 1, 5120]
    - [196, 0.0]
  - - [896, 96512, 1, 5120]
    - [210, 0.0]
  - - [896, 96768, 1, 5120]
    - [196, 0.0]
  - - [896, 98304, 1, 5120]
    - [202, 0.0]
  - - [896, 99840, 1, 5120]
    - [204, 0.0]
  - - [896, 100352, 1, 5120]
    - [215, 0.0]
  - - [896, 102400, 1, 5120]
    - [199, 0.0]
  - - [896, 103168, 1, 5120]
    - [216, 0.0]
  - - [896, 103680, 1, 5120]
    - [176, 0.0]
  - - [896, 103936, 1, 5120]
    - [217, 0.0]
  - - [896, 106496, 1, 5120]
    - [199, 0.0]
  - - [896, 107520, 1, 5120]
    - [198, 0.0]
  - - [896, 110592, 1, 5120]
    - [194, 0.0]
  - - [896, 111104, 1, 5120]
    - [194, 0.0]
  - - [896, 111360, 1, 5120]
    - [210, 0.0]
  - - [896, 114688, 1, 5120]
    - [212, 0.0]
  - - [896, 115200, 1, 5120]
    - [196, 0.0]
  - - [896, 118784, 1, 5120]
    - [203, 0.0]
  - - [896, 119040, 1, 5120]
    - [214, 0.0]
  - - [896, 122880, 1, 5120]
    - [198, 0.0]
  - - [896, 126976, 1, 5120]
    - [198, 0.0]
  - - [896, 131072, 1, 5120]
    - [194, 0.0]
  - - [4096, 4352, 1, 5120]
    - [218, 0.0]
  - - [4096, 4608, 1, 5120]
    - [219, 0.0]
  - - [4096, 4864, 1, 5120]
    - [219, 0.0]
  - - [4096, 5120, 1, 5120]
    - [220, 0.0]
  - - [4096, 5376, 1, 5120]
    - [221, 0.0]
  - - [4096, 5632, 1, 5120]
    - [222, 0.0]
  - - [4096, 5888, 1, 5120]
    - [205, 0.0]
  - - [4096, 6144, 1, 5120]
    - [220, 0.0]
  - - [4096, 6400, 1, 5120]
    - [221, 0.0]
  - - [4096, 6656, 1, 5120]
    - [220, 0.0]
  - - [4096, 6912, 1, 5120]
    - [220, 0.0]
  - - [4096, 7168, 1, 5120]
    - [220, 0.0]
  - - [4096, 7424, 1, 5120]
    - [223, 0.0]
  - - [4096, 7680, 1, 5120]
    - [224, 0.0]
  - - [4096, 7936, 1, 5120]
    - [224, 0.0]
  - - [4096, 8192, 1, 5120]
    - [224, 0.0]
  - - [4096, 8448, 1, 5120]
    - [225, 0.0]
  - - [4096, 8704, 1, 5120]
    - [226, 0.0]
  - - [4096, 8960, 1, 5120]
    - [221, 0.0]
  - - [4096, 9216, 1, 5120]
    - [227, 0.0]
  - - [4096, 9728, 1, 5120]
    - [227, 0.0]
  - - [4096, 9984, 1, 5120]
    - [221, 0.0]
  - - [4096, 10240, 1, 5120]
    - [192, 0.0]
  - - [4096, 10752, 1, 5120]
    - [220, 0.0]
  - - [4096, 11264, 1, 5120]
    - [221, 0.0]
  - - [4096, 11520, 1, 5120]
    - [205, 0.0]
  - - [4096, 11776, 1, 5120]
    - [222, 0.0]
  - - [4096, 12288, 1, 5120]
    - [225, 0.0]
  - - [4096, 12544, 1, 5120]
    - [224, 0.0]
  - - [4096, 12800, 1, 5120]
    - [228, 0.0]
  - - [4096, 13056, 1, 5120]
    - [229, 0.0]
  - - [4096, 13312, 1, 5120]
    - [230, 0.0]
  - - [4096, 13824, 1, 5120]
    - [221, 0.0]
  - - [4096, 14080, 1, 5120]
    - [220, 0.0]
  - - [4096, 14336, 1, 5120]
    - [221, 0.0]
  - - [4096, 14592, 1, 5120]
    - [221, 0.0]
  - - [4096, 14848, 1, 5120]
    - [191, 0.0]
  - - [4096, 15360, 1, 5120]
    - [220, 0.0]
  - - [4096, 15872, 1, 5120]
    - [221, 0.0]
  - - [4096, 16128, 1, 5120]
    - [220, 0.0]
  - - [4096, 16384, 1, 5120]
    - [231, 0.0]
  - - [4096, 16640, 1, 5120]
    - [225, 0.0]
  - - [4096, 16896, 1, 5120]
    - [231, 0.0]
  - - [4096, 17408, 1, 5120]
    - [221, 0.0]
  - - [4096, 17664, 1, 5120]
    - [221, 0.0]
  - - [4096, 17920, 1, 5120]
    - [221, 0.0]
  - - [4096, 18432, 1, 5120]
    - [220, 0.0]
  - - [4096, 19200, 1, 5120]
    - [220, 0.0]
  - - [4096, 19456, 1, 5120]
    - [221, 0.0]
  - - [4096, 19712, 1, 5120]
    - [221, 0.0]
  - - [4096, 19968, 1, 5120]
    - [221, 0.0]
  - - [4096, 20480, 1, 5120]
    - [225, 0.0]
  - - [4096, 20736, 1, 5120]
    - [221, 0.0]
  - - [4096, 21504, 1, 5120]
    - [221, 0.0]
  - - [4096, 21760, 1, 5120]
    - [220, 0.0]
  - - [4096, 22272, 1, 5120]
    - [221, 0.0]
  - - [4096, 22528, 1, 5120]
    - [221, 0.0]
  - - [4096, 23040, 1, 5120]
    - [221, 0.0]
  - - [4096, 23296, 1, 5120]
    - [220, 0.0]
  - - [4096, 23552, 1, 5120]
    - [232, 0.0]
  - - [4096, 23808, 1, 5120]
    - [225, 0.0]
  - - [4096, 24320, 1, 5120]
    - [220, 0.0]
  - - [4096, 24576, 1, 5120]
    - [220, 0.0]
  - - [4096, 25088, 1, 5120]
    - [220, 0.0]
  - - [4096, 25344, 1, 5120]
    - [221, 0.0]
  - - [4096, 25600, 1, 5120]
    - [221, 0.0]
  - - [4096, 26112, 1, 5120]
    - [220, 0.0]
  - - [4096, 26624, 1, 5120]
    - [220, 0.0]
  - - [4096, 26880, 1, 5120]
    - [221, 0.0]
  - - [4096, 27648, 1, 5120]
    - [221, 0.0]
  - - [4096, 28160, 1, 5120]
    - [221, 0.0]
  - - [4096, 28672, 1, 5120]
    - [220, 0.0]
  - - [4096, 29184, 1, 5120]
    - [220, 0.0]
  - - [4096, 29440, 1, 5120]
    - [221, 0.0]
  - - [4096, 29696, 1, 5120]
    - [224, 0.0]
  - - [4096, 29952, 1, 5120]
    - [221, 0.0]
  - - [4096, 30464, 1, 5120]
    - [221, 0.0]
  - - [4096, 30720, 1, 5120]
    - [221, 0.0]
  - - [4096, 30976, 1, 5120]
    - [220, 0.0]
  - - [4096, 31744, 1, 5120]
    - [221, 0.0]
  - - [4096, 32000, 1, 5120]
    - [220, 0.0]
  - - [4096, 32256, 1, 5120]
    - [220, 0.0]
  - - [4096, 32768, 1, 5120]
    - [221, 0.0]
  - - [4096, 33280, 1, 5120]
    - [221, 0.0]
  - - [4096, 33792, 1, 5120]
    - [220, 0.0]
  - - [4096, 34048, 1, 5120]
    - [221, 0.0]
  - - [4096, 34560, 1, 5120]
    - [221, 0.0]
  - - [4096, 34816, 1, 5120]
    - [221, 0.0]
  - - [4096, 35328, 1, 5120]
    - [220, 0.0]
  - - [4096, 35840, 1, 5120]
    - [220, 0.0]
  - - [4096, 36608, 1, 5120]
    - [221, 0.0]
  - - [4096, 36864, 1, 5120]
    - [220, 0.0]
  - - [4096, 37120, 1, 5120]
    - [221, 0.0]
  - - [4096, 37632, 1, 5120]
    - [221, 0.0]
  - - [4096, 38400, 1, 5120]
    - [221, 0.0]
  - - [4096, 38912, 1, 5120]
    - [220, 0.0]
  - - [4096, 39168, 1, 5120]
    - [221, 0.0]
  - - [4096, 39424, 1, 5120]
    - [220, 0.0]
  - - [4096, 39680, 1, 5120]
    - [220, 0.0]
  - - [4096, 39936, 1, 5120]
    - [221, 0.0]
  - - [4096, 40960, 1, 5120]
    - [232, 0.0]
  - - [4096, 41216, 1, 5120]
    - [221, 0.0]
  - - [4096, 41472, 1, 5120]
    - [220, 0.0]
  - - [4096, 42240, 1, 5120]
    - [221, 0.0]
  - - [4096, 43008, 1, 5120]
    - [221, 0.0]
  - - [4096, 43264, 1, 5120]
    - [221, 0.0]
  - - [4096, 43520, 1, 5120]
    - [220, 0.0]
  - - [4096, 43776, 1, 5120]
    - [221, 0.0]
  - - [4096, 44544, 1, 5120]
    - [221, 0.0]
  - - [4096, 44800, 1, 5120]
    - [221, 0.0]
  - - [4096, 45056, 1, 5120]
    - [221, 0.0]
  - - [4096, 46080, 1, 5120]
    - [221, 0.0]
  - - [4096, 46592, 1, 5120]
    - [221, 0.0]
  - - [4096, 47104, 1, 5120]
    - [221, 0.0]
  - - [4096, 47616, 1, 5120]
    - [220, 0.0]
  - - [4096, 47872, 1, 5120]
    - [221, 0.0]
  - - [4096, 48384, 1, 5120]
    - [221, 0.0]
  - - [4096, 48640, 1, 5120]
    - [221, 0.0]
  - - [4096, 49152, 1, 5120]
    - [221, 0.0]
  - - [4096, 49920, 1, 5120]
    - [220, 0.0]
  - - [4096, 50176, 1, 5120]
    - [224, 0.0]
  - - [4096, 50688, 1, 5120]
    - [224, 0.0]
  - - [4096, 51200, 1, 5120]
    - [220, 0.0]
  - - [4096, 51968, 1, 5120]
    - [221, 0.0]
  - - [4096, 52224, 1, 5120]
    - [233, 0.0]
  - - [4096, 52992, 1, 5120]
    - [224, 0.0]
  - - [4096, 53248, 1, 5120]
    - [225, 0.0]
  - - [4096, 53504, 1, 5120]
    - [221, 0.0]
  - - [4096, 53760, 1, 5120]
    - [224, 0.0]
  - - [4096, 55296, 1, 5120]
    - [224, 0.0]
  - - [4096, 55552, 1, 5120]
    - [221, 0.0]
  - - [4096, 56320, 1, 5120]
    - [221, 0.0]
  - - [4096, 56576, 1, 5120]
    - [225, 0.0]
  - - [4096, 57344, 1, 5120]
    - [234, 0.0]
  - - [4096, 57600, 1, 5120]
    - [221, 0.0]
  - - [4096, 58368, 1, 5120]
    - [221, 0.0]
  - - [4096, 58880, 1, 5120]
    - [224, 0.0]
  - - [4096, 59136, 1, 5120]
    - [225, 0.0]
  - - [4096, 59392, 1, 5120]
    - [225, 0.0]
  - - [4096, 59904, 1, 5120]
    - [221, 0.0]
  - - [4096, 60928, 1, 5120]
    - [221, 0.0]
  - - [4096, 61440, 1, 5120]
    - [221, 0.0]
  - - [4096, 61952, 1, 5120]
    - [235, 0.0]
  - - [4096, 62208, 1, 5120]
    - [224, 0.0]
  - - [4096, 63232, 1, 5120]
    - [225, 0.0]
  - - [4096, 63488, 1, 5120]
    - [225, 0.0]
  - - [4096, 64000, 1, 5120]
    - [221, 0.0]
  - - [4096, 64512, 1, 5120]
    - [221, 0.0]
  - - [4096, 64768, 1, 5120]
    - [221, 0.0]
  - - [4096, 65280, 1, 5120]
    - [236, 0.0]
  - - [4096, 65536, 1, 5120]
    - [221, 0.0]
  - - [4096, 66560, 1, 5120]
    - [224, 0.0]
  - - [4096, 66816, 1, 5120]
    - [224, 0.0]
  - - [4096, 67584, 1, 5120]
    - [224, 0.0]
  - - [4096, 68096, 1, 5120]
    - [225, 0.0]
  - - [4096, 69120, 1, 5120]
    - [235, 0.0]
  - - [4096, 69632, 1, 5120]
    - [221, 0.0]
  - - [4096, 69888, 1, 5120]
    - [224, 0.0]
  - - [4096, 70400, 1, 5120]
    - [225, 0.0]
  - - [4096, 70656, 1, 5120]
    - [225, 0.0]
  - - [4096, 71424, 1, 5120]
    - [224, 0.0]
  - - [4096, 71680, 1, 5120]
    - [224, 0.0]
  - - [4096, 72960, 1, 5120]
    - [221, 0.0]
  - - [4096, 73216, 1, 5120]
    - [221, 0.0]
  - - [4096, 73728, 1, 5120]
    - [221, 0.0]
  - - [4096, 74240, 1, 5120]
    - [221, 0.0]
  - - [4096, 75264, 1, 5120]
    - [224, 0.0]
  - - [4096, 76032, 1, 5120]
    - [224, 0.0]
  - - [4096, 76544, 1, 5120]
    - [225, 0.0]
  - - [4096, 76800, 1, 5120]
    - [221, 0.0]
  - - [4096, 77824, 1, 5120]
    - [221, 0.0]
  - - [4096, 78848, 1, 5120]
    - [224, 0.0]
  - - [4096, 79360, 1, 5120]
    - [224, 0.0]
  - - [4096, 79872, 1, 5120]
    - [224, 0.0]
  - - [4096, 80640, 1, 5120]
    - [224, 0.0]
  - - [4096, 81664, 1, 5120]
    - [221, 0.0]
  - - [4096, 81920, 1, 5120]
    - [220, 0.0]
  - - [4096, 82432, 1, 5120]
    - [225, 0.0]
  - - [4096, 82944, 1, 5120]
    - [224, 0.0]
  - - [4096, 83200, 1, 5120]
    - [225, 0.0]
  - - [4096, 84480, 1, 5120]
    - [225, 0.0]
  - - [4096, 86016, 1, 5120]
    - [224, 0.0]
  - - [4096, 86528, 1, 5120]
    - [221, 0.0]
  - - [4096, 87296, 1, 5120]
    - [225, 0.0]
  - - [4096, 88320, 1, 5120]
    - [225, 0.0]
  - - [4096, 89088, 1, 5120]
    - [224, 0.0]
  - - [4096, 89600, 1, 5120]
    - [205, 0.0]
  - - [4096, 89856, 1, 5120]
    - [224, 0.0]
  - - [4096, 90112, 1, 5120]
    - [225, 0.0]
  - - [4096, 92160, 1, 5120]
    - [224, 0.0]
  - - [4096, 93184, 1, 5120]
    - [224, 0.0]
  - - [4096, 94208, 1, 5120]
    - [225, 0.0]
  - - [4096, 95232, 1, 5120]
    - [224, 0.0]
  - - [4096, 96000, 1, 5120]
    - [225, 0.0]
  - - [4096, 96512, 1, 5120]
    - [224, 0.0]
  - - [4096, 96768, 1, 5120]
    - [224, 0.0]
  - - [4096, 98304, 1, 5120]
    - [221, 0.0]
  - - [4096, 99840, 1, 5120]
    - [224, 0.0]
  - - [4096, 100352, 1, 5120]
    - [225, 0.0]
  - - [4096, 102400, 1, 5120]
    - [221, 0.0]
  - - [4096, 103168, 1, 5120]
    - [225, 0.0]
  - - [4096, 103680, 1, 5120]
    - [224, 0.0]
  - - [4096, 103936, 1, 5120]
    - [224, 0.0]
  - - [4096, 106496, 1, 5120]
    - [221, 0.0]
  - - [4096, 107520, 1, 5120]
    - [221, 0.0]
  - - [4096, 110592, 1, 5120]
    - [225, 0.0]
  - - [4096, 111104, 1, 5120]
    - [221, 0.0]
  - - [4096, 111360, 1, 5120]
    - [225, 0.0]
  - - [4096, 114688, 1, 5120]
    - [224, 0.0]
  - - [4096, 115200, 1, 5120]
    - [221, 0.0]
  - - [4096, 118784, 1, 5120]
    - [224, 0.0]
  - - [4096, 119040, 1, 5120]
    - [237, 0.0]
  - - [4096, 122880, 1, 5120]
    - [225, 0.0]
  - - [4096, 126976, 1, 5120]
    - [224, 0.0]
  - - [4096, 131072, 1, 5120]
    - [224, 0.0]
  - - [1024, 5888, 1, 5120]
    - [214, 0.0]
  - - [1024, 6144, 1, 5120]
    - [221, 0.0]
  - - [1024, 6400, 1, 5120]
    - [214, 0.0]
  - - [1024, 6656, 1, 5120]
    - [214, 0.0]
  - - [1024, 6912, 1, 5120]
    - [214, 0.0]
  - - [1024, 7168, 1, 5120]
    - [240, 0.0]
  - - [1024, 7424, 1, 5120]
    - [241, 0.0]
  - - [1024, 7680, 1, 5120]
    - [241, 0.0]
  - - [1024, 7936, 1, 5120]
    - [242, 0.0]
  - - [1024, 8192, 1, 5120]
    - [242, 0.0]
  - - [1024, 8448, 1, 5120]
    - [242, 0.0]
  - - [1024, 8704, 1, 5120]
    - [243, 0.0]
  - - [1024, 8960, 1, 5120]
    - [244, 0.0]
  - - [1024, 9216, 1, 5120]
    - [245, 0.0]
  - - [1024, 9728, 1, 5120]
    - [244, 0.0]
  - - [1024, 9984, 1, 5120]
    - [205, 0.0]
  - - [1024, 10240, 1, 5120]
    - [246, 0.0]
  - - [1024, 10752, 1, 5120]
    - [246, 0.0]
  - - [1024, 11264, 1, 5120]
    - [246, 0.0]
  - - [1024, 11520, 1, 5120]
    - [246, 0.0]
  - - [1024, 11776, 1, 5120]
    - [246, 0.0]
  - - [1024, 12288, 1, 5120]
    - [235, 0.0]
  - - [1024, 12544, 1, 5120]
    - [214, 0.0]
  - - [1024, 12800, 1, 5120]
    - [240, 0.0]
  - - [1024, 13056, 1, 5120]
    - [247, 0.0]
  - - [1024, 13312, 1, 5120]
    - [248, 0.0]
  - - [1024, 13824, 1, 5120]
    - [249, 0.0]
  - - [1024, 14080, 1, 5120]
    - [250, 0.0]
  - - [1024, 14336, 1, 5120]
    - [214, 0.0]
  - - [1024, 14592, 1, 5120]
    - [247, 0.0]
  - - [1024, 14848, 1, 5120]
    - [251, 0.0]
  - - [1024, 15360, 1, 5120]
    - [251, 0.0]
  - - [1024, 15872, 1, 5120]
    - [251, 0.0]
  - - [1024, 16128, 1, 5120]
    - [224, 0.0]
  - - [1024, 16384, 1, 5120]
    - [223, 0.0]
  - - [1024, 16640, 1, 5120]
    - [251, 0.0]
  - - [1024, 16896, 1, 5120]
    - [224, 0.0]
  - - [1024, 17408, 1, 5120]
    - [219, 0.0]
  - - [1024, 17664, 1, 5120]
    - [252, 0.0]
  - - [1024, 17920, 1, 5120]
    - [219, 0.0]
  - - [1024, 18432, 1, 5120]
    - [219, 0.0]
  - - [1024, 19200, 1, 5120]
    - [253, 0.0]
  - - [1024, 19456, 1, 5120]
    - [219, 0.0]
  - - [1024, 19712, 1, 5120]
    - [214, 0.0]
  - - [1024, 19968, 1, 5120]
    - [214, 0.0]
  - - [1024, 20480, 1, 5120]
    - [240, 0.0]
  - - [1024, 20736, 1, 5120]
    - [214, 0.0]
  - - [1024, 21504, 1, 5120]
    - [214, 0.0]
  - - [1024, 21760, 1, 5120]
    - [214, 0.0]
  - - [1024, 22272, 1, 5120]
    - [254, 0.0]
  - - [1024, 22528, 1, 5120]
    - [246, 0.0]
  - - [1024, 23040, 1, 5120]
    - [246, 0.0]
  - - [1024, 23296, 1, 5120]
    - [246, 0.0]
  - - [1024, 23552, 1, 5120]
    - [246, 0.0]
  - - [1024, 23808, 1, 5120]
    - [246, 0.0]
  - - [1024, 24320, 1, 5120]
    - [246, 0.0]
  - - [1024, 24576, 1, 5120]
    - [220, 0.0]
  - - [1024, 25088, 1, 5120]
    - [221, 0.0]
  - - [1024, 25344, 1, 5120]
    - [214, 0.0]
  - - [1024, 25600, 1, 5120]
    - [220, 0.0]
  - - [1024, 26112, 1, 5120]
    - [214, 0.0]
  - - [1024, 26624, 1, 5120]
    - [214, 0.0]
  - - [1024, 26880, 1, 5120]
    - [240, 0.0]
  - - [1024, 27648, 1, 5120]
    - [247, 0.0]
  - - [1024, 28160, 1, 5120]
    - [232, 0.0]
  - - [1024, 28672, 1, 5120]
    - [214, 0.0]
  - - [1024, 29184, 1, 5120]
    - [214, 0.0]
  - - [1024, 29440, 1, 5120]
    - [251, 0.0]
  - - [1024, 29696, 1, 5120]
    - [251, 0.0]
  - - [1024, 29952, 1, 5120]
    - [223, 0.0]
  - - [1024, 30464, 1, 5120]
    - [251, 0.0]
  - - [1024, 30720, 1, 5120]
    - [251, 0.0]
  - - [1024, 30976, 1, 5120]
    - [251, 0.0]
  - - [1024, 31744, 1, 5120]
    - [223, 0.0]
  - - [1024, 32000, 1, 5120]
    - [251, 0.0]
  - - [1024, 32256, 1, 5120]
    - [251, 0.0]
  - - [1024, 32768, 1, 5120]
    - [251, 0.0]
  - - [1024, 33280, 1, 5120]
    - [251, 0.0]
  - - [1024, 33792, 1, 5120]
    - [224, 0.0]
  - - [1024, 34048, 1, 5120]
    - [223, 0.0]
  - - [1024, 34560, 1, 5120]
    - [214, 0.0]
  - - [1024, 34816, 1, 5120]
    - [214, 0.0]
  - - [1024, 35328, 1, 5120]
    - [214, 0.0]
  - - [1024, 35840, 1, 5120]
    - [240, 0.0]
  - - [1024, 36608, 1, 5120]
    - [227, 0.0]
  - - [1024, 36864, 1, 5120]
    - [255, 0.0]
  - - [1024, 37120, 1, 5120]
    - [219, 0.0]
  - - [1024, 37632, 1, 5120]
    - [227, 0.0]
  - - [1024, 38400, 1, 5120]
    - [255, 0.0]
  - - [1024, 38912, 1, 5120]
    - [255, 0.0]
  - - [1024, 39168, 1, 5120]
    - [232, 0.0]
  - - [1024, 39424, 1, 5120]
    - [214, 0.0]
  - - [1024, 39680, 1, 5120]
    - [240, 0.0]
  - - [1024, 39936, 1, 5120]
    - [214, 0.0]
  - - [1024, 40960, 1, 5120]
    - [214, 0.0]
  - - [1024, 41216, 1, 5120]
    - [214, 0.0]
  - - [1024, 41472, 1, 5120]
    - [240, 0.0]
  - - [1024, 42240, 1, 5120]
    - [240, 0.0]
  - - [1024, 43008, 1, 5120]
    - [240, 0.0]
  - - [1024, 43264, 1, 5120]
    - [214, 0.0]
  - - [1024, 43520, 1, 5120]
    - [214, 0.0]
  - - [1024, 43776, 1, 5120]
    - [214, 0.0]
  - - [1024, 44544, 1, 5120]
    - [214, 0.0]
  - - [1024, 44800, 1, 5120]
    - [246, 0.0]
  - - [1024, 45056, 1, 5120]
    - [220, 0.0]
  - - [1024, 46080, 1, 5120]
    - [214, 0.0]
  - - [1024, 46592, 1, 5120]
    - [246, 0.0]
  - - [1024, 47104, 1, 5120]
    - [240, 0.0]
  - - [1024, 47616, 1, 5120]
    - [221, 0.0]
  - - [1024, 47872, 1, 5120]
    - [251, 0.0]
  - - [1024, 48384, 1, 5120]
    - [214, 0.0]
  - - [1024, 48640, 1, 5120]
    - [214, 0.0]
  - - [1024, 49152, 1, 5120]
    - [220, 0.0]
  - - [1024, 49920, 1, 5120]
    - [214, 0.0]
  - - [1024, 50176, 1, 5120]
    - [214, 0.0]
  - - [1024, 50688, 1, 5120]
    - [240, 0.0]
  - - [1024, 51200, 1, 5120]
    - [214, 0.0]
  - - [1024, 51968, 1, 5120]
    - [240, 0.0]
  - - [1024, 52224, 1, 5120]
    - [214, 0.0]
  - - [1024, 52992, 1, 5120]
    - [214, 0.0]
  - - [1024, 53248, 1, 5120]
    - [221, 0.0]
  - - [1024, 53504, 1, 5120]
    - [240, 0.0]
  - - [1024, 53760, 1, 5120]
    - [220, 0.0]
  - - [1024, 55296, 1, 5120]
    - [214, 0.0]
  - - [1024, 55552, 1, 5120]
    - [221, 0.0]
  - - [1024, 56320, 1, 5120]
    - [214, 0.0]
  - - [1024, 56576, 1, 5120]
    - [214, 0.0]
  - - [1024, 57344, 1, 5120]
    - [214, 0.0]
  - - [1024, 57600, 1, 5120]
    - [240, 0.0]
  - - [1024, 58368, 1, 5120]
    - [214, 0.0]
  - - [1024, 58880, 1, 5120]
    - [214, 0.0]
  - - [1024, 59136, 1, 5120]
    - [254, 0.0]
  - - [1024, 59392, 1, 5120]
    - [222, 0.0]
  - - [1024, 59904, 1, 5120]
    - [246, 0.0]
  - - [1024, 60928, 1, 5120]
    - [214, 0.0]
  - - [1024, 61440, 1, 5120]
    - [232, 0.0]
  - - [1024, 61952, 1, 5120]
    - [214, 0.0]
  - - [1024, 62208, 1, 5120]
    - [221, 0.0]
  - - [1024, 63232, 1, 5120]
    - [214, 0.0]
  - - [1024, 63488, 1, 5120]
    - [214, 0.0]
  - - [1024, 64000, 1, 5120]
    - [240, 0.0]
  - - [1024, 64512, 1, 5120]
    - [214, 0.0]
  - - [1024, 64768, 1, 5120]
    - [214, 0.0]
  - - [1024, 65280, 1, 5120]
    - [214, 0.0]
  - - [1024, 65536, 1, 5120]
    - [214, 0.0]
  - - [1024, 66560, 1, 5120]
    - [223, 0.0]
  - - [1024, 66816, 1, 5120]
    - [251, 0.0]
  - - [1024, 67584, 1, 5120]
    - [231, 0.0]
  - - [1024, 68096, 1, 5120]
    - [224, 0.0]
  - - [1024, 69120, 1, 5120]
    - [214, 0.0]
  - - [1024, 69632, 1, 5120]
    - [220, 0.0]
  - - [1024, 69888, 1, 5120]
    - [221, 0.0]
  - - [1024, 70400, 1, 5120]
    - [214, 0.0]
  - - [1024, 70656, 1, 5120]
    - [214, 0.0]
  - - [1024, 71424, 1, 5120]
    - [214, 0.0]
  - - [1024, 71680, 1, 5120]
    - [214, 0.0]
  - - [1024, 72960, 1, 5120]
    - [205, 0.0]
  - - [1024, 73216, 1, 5120]
    - [214, 0.0]
  - - [1024, 73728, 1, 5120]
    - [220, 0.0]
  - - [1024, 74240, 1, 5120]
    - [214, 0.0]
  - - [1024, 75264, 1, 5120]
    - [220, 0.0]
  - - [1024, 76032, 1, 5120]
    - [221, 0.0]
  - - [1024, 76544, 1, 5120]
    - [214, 0.0]
  - - [1024, 76800, 1, 5120]
    - [214, 0.0]
  - - [1024, 77824, 1, 5120]
    - [240, 0.0]
  - - [1024, 78848, 1, 5120]
    - [214, 0.0]
  - - [1024, 79360, 1, 5120]
    - [214, 0.0]
  - - [1024, 79872, 1, 5120]
    - [240, 0.0]
  - - [1024, 80640, 1, 5120]
    - [214, 0.0]
  - - [1024, 81664, 1, 5120]
    - [214, 0.0]
  - - [1024, 81920, 1, 5120]
    - [231, 0.0]
  - - [1024, 82432, 1, 5120]
    - [254, 0.0]
  - - [1024, 82944, 1, 5120]
    - [240, 0.0]
  - - [1024, 83200, 1, 5120]
    - [220, 0.0]
  - - [1024, 84480, 1, 5120]
    - [251, 0.0]
  - - [1024, 86016, 1, 5120]
    - [232, 0.0]
  - - [1024, 86528, 1, 5120]
    - [214, 0.0]
  - - [1024, 87296, 1, 5120]
    - [214, 0.0]
  - - [1024, 88320, 1, 5120]
    - [214, 0.0]
  - - [1024, 89088, 1, 5120]
    - [214, 0.0]
  - - [1024, 89600, 1, 5120]
    - [240, 0.0]
  - - [1024, 89856, 1, 5120]
    - [214, 0.0]
  - - [1024, 90112, 1, 5120]
    - [240, 0.0]
  - - [1024, 92160, 1, 5120]
    - [220, 0.0]
  - - [1024, 93184, 1, 5120]
    - [214, 0.0]
  - - [1024, 94208, 1, 5120]
    - [232, 0.0]
  - - [1024, 95232, 1, 5120]
    - [214, 0.0]
  - - [1024, 96000, 1, 5120]
    - [240, 0.0]
  - - [1024, 96512, 1, 5120]
    - [214, 0.0]
  - - [1024, 96768, 1, 5120]
    - [246, 0.0]
  - - [1024, 98304, 1, 5120]
    - [256, 0.0]
  - - [1024, 99840, 1, 5120]
    - [214, 0.0]
  - - [1024, 100352, 1, 5120]
    - [214, 0.0]
  - - [1024, 102400, 1, 5120]
    - [214, 0.0]
  - - [1024, 103168, 1, 5120]
    - [240, 0.0]
  - - [1024, 103680, 1, 5120]
    - [214, 0.0]
  - - [1024, 103936, 1, 5120]
    - [240, 0.0]
  - - [1024, 106496, 1, 5120]
    - [240, 0.0]
  - - [1024, 107520, 1, 5120]
    - [220, 0.0]
  - - [1024, 110592, 1, 5120]
    - [240, 0.0]
  - - [1024, 111104, 1, 5120]
    - [214, 0.0]
  - - [1024, 111360, 1, 5120]
    - [214, 0.0]
  - - [1024, 114688, 1, 5120]
    - [214, 0.0]
  - - [1024, 115200, 1, 5120]
    - [214, 0.0]
  - - [1024, 118784, 1, 5120]
    - [251, 0.0]
  - - [1024, 119040, 1, 5120]
    - [224, 0.0]
  - - [1024, 122880, 1, 5120]
    - [214, 0.0]
  - - [1024, 126976, 1, 5120]
    - [220, 0.0]
  - - [1024, 131072, 1, 5120]
    - [214, 0.0]
  - - [2048, 4352, 1, 5120]
    - [244, 0.0]
  - - [2048, 4608, 1, 5120]
    - [257, 0.0]
  - - [2048, 4864, 1, 5120]
    - [258, 0.0]
  - - [2048, 5120, 1, 5120]
    - [254, 0.0]
  - - [2048, 5376, 1, 5120]
    - [222, 0.0]
  - - [2048, 5632, 1, 5120]
    - [246, 0.0]
  - - [2048, 5888, 1, 5120]
    - [246, 0.0]
  - - [2048, 6144, 1, 5120]
    - [250, 0.0]
  - - [2048, 6400, 1, 5120]
    - [247, 0.0]
  - - [2048, 6656, 1, 5120]
    - [247, 0.0]
  - - [2048, 6912, 1, 5120]
    - [247, 0.0]
  - - [2048, 7168, 1, 5120]
    - [247, 0.0]
  - - [2048, 7424, 1, 5120]
    - [251, 0.0]
  - - [2048, 7680, 1, 5120]
    - [223, 0.0]
  - - [2048, 7936, 1, 5120]
    - [251, 0.0]
  - - [2048, 8192, 1, 5120]
    - [225, 0.0]
  - - [2048, 8448, 1, 5120]
    - [223, 0.0]
  - - [2048, 8704, 1, 5120]
    - [227, 0.0]
  - - [2048, 8960, 1, 5120]
    - [219, 0.0]
  - - [2048, 9216, 1, 5120]
    - [219, 0.0]
  - - [2048, 9728, 1, 5120]
    - [227, 0.0]
  - - [2048, 9984, 1, 5120]
    - [221, 0.0]
  - - [2048, 10240, 1, 5120]
    - [214, 0.0]
  - - [2048, 10752, 1, 5120]
    - [221, 0.0]
  - - [2048, 11264, 1, 5120]
    - [254, 0.0]
  - - [2048, 11520, 1, 5120]
    - [259, 0.0]
  - - [2048, 11776, 1, 5120]
    - [246, 0.0]
  - - [2048, 12288, 1, 5120]
    - [187, 0.0]
  - - [2048, 12544, 1, 5120]
    - [247, 0.0]
  - - [2048, 12800, 1, 5120]
    - [220, 0.0]
  - - [2048, 13056, 1, 5120]
    - [221, 0.0]
  - - [2048, 13312, 1, 5120]
    - [220, 0.0]
  - - [2048, 13824, 1, 5120]
    - [220, 0.0]
  - - [2048, 14080, 1, 5120]
    - [214, 0.0]
  - - [2048, 14336, 1, 5120]
    - [234, 0.0]
  - - [2048, 14592, 1, 5120]
    - [250, 0.0]
  - - [2048, 14848, 1, 5120]
    - [223, 0.0]
  - - [2048, 15360, 1, 5120]
    - [251, 0.0]
  - - [2048, 15872, 1, 5120]
    - [251, 0.0]
  - - [2048, 16128, 1, 5120]
    - [251, 0.0]
  - - [2048, 16384, 1, 5120]
    - [225, 0.0]
  - - [2048, 16640, 1, 5120]
    - [251, 0.0]
  - - [2048, 16896, 1, 5120]
    - [224, 0.0]
  - - [2048, 17408, 1, 5120]
    - [246, 0.0]
  - - [2048, 17664, 1, 5120]
    - [221, 0.0]
  - - [2048, 17920, 1, 5120]
    - [220, 0.0]
  - - [2048, 18432, 1, 5120]
    - [219, 0.0]
  - - [2048, 19200, 1, 5120]
    - [227, 0.0]
  - - [2048, 19456, 1, 5120]
    - [255, 0.0]
  - - [2048, 19712, 1, 5120]
    - [221, 0.0]
  - - [2048, 19968, 1, 5120]
    - [220, 0.0]
  - - [2048, 20480, 1, 5120]
    - [220, 0.0]
  - - [2048, 20736, 1, 5120]
    - [221, 0.0]
  - - [2048, 21504, 1, 5120]
    - [221, 0.0]
  - - [2048, 21760, 1, 5120]
    - [247, 0.0]
  - - [2048, 22272, 1, 5120]
    - [251, 0.0]
  - - [2048, 22528, 1, 5120]
    - [221, 0.0]
  - - [2048, 23040, 1, 5120]
    - [221, 0.0]
  - - [2048, 23296, 1, 5120]
    - [214, 0.0]
  - - [2048, 23552, 1, 5120]
    - [251, 0.0]
  - - [2048, 23808, 1, 5120]
    - [221, 0.0]
  - - [2048, 24320, 1, 5120]
    - [214, 0.0]
  - - [2048, 24576, 1, 5120]
    - [221, 0.0]
  - - [2048, 25088, 1, 5120]
    - [251, 0.0]
  - - [2048, 25344, 1, 5120]
    - [214, 0.0]
  - - [2048, 25600, 1, 5120]
    - [256, 0.0]
  - - [2048, 26112, 1, 5120]
    - [232, 0.0]
  - - [2048, 26624, 1, 5120]
    - [214, 0.0]
  - - [2048, 26880, 1, 5120]
    - [220, 0.0]
  - - [2048, 27648, 1, 5120]
    - [232, 0.0]
  - - [2048, 28160, 1, 5120]
    - [220, 0.0]
  - - [2048, 28672, 1, 5120]
    - [214, 0.0]
  - - [2048, 29184, 1, 5120]
    - [220, 0.0]
  - - [2048, 29440, 1, 5120]
    - [214, 0.0]
  - - [2048, 29696, 1, 5120]
    - [214, 0.0]
  - - [2048, 29952, 1, 5120]
    - [220, 0.0]
  - - [2048, 30464, 1, 5120]
    - [214, 0.0]
  - - [2048, 30720, 1, 5120]
    - [221, 0.0]
  - - [2048, 30976, 1, 5120]
    - [214, 0.0]
  - - [2048, 31744, 1, 5120]
    - [214, 0.0]
  - - [2048, 32000, 1, 5120]
    - [214, 0.0]
  - - [2048, 32256, 1, 5120]
    - [221, 0.0]
  - - [2048, 32768, 1, 5120]
    - [221, 0.0]
  - - [2048, 33280, 1, 5120]
    - [224, 0.0]
  - - [2048, 33792, 1, 5120]
    - [251, 0.0]
  - - [2048, 34048, 1, 5120]
    - [231, 0.0]
  - - [2048, 34560, 1, 5120]
    - [221, 0.0]
  - - [2048, 34816, 1, 5120]
    - [214, 0.0]
  - - [2048, 35328, 1, 5120]
    - [221, 0.0]
  - - [2048, 35840, 1, 5120]
    - [214, 0.0]
  - - [2048, 36608, 1, 5120]
    - [220, 0.0]
  - - [2048, 36864, 1, 5120]
    - [214, 0.0]
  - - [2048, 37120, 1, 5120]
    - [219, 0.0]
  - - [2048, 37632, 1, 5120]
    - [253, 0.0]
  - - [2048, 38400, 1, 5120]
    - [221, 0.0]
  - - [2048, 38912, 1, 5120]
    - [253, 0.0]
  - - [2048, 39168, 1, 5120]
    - [214, 0.0]
  - - [2048, 39424, 1, 5120]
    - [221, 0.0]
  - - [2048, 39680, 1, 5120]
    - [221, 0.0]
  - - [2048, 39936, 1, 5120]
    - [214, 0.0]
  - - [2048, 40960, 1, 5120]
    - [251, 0.0]
  - - [2048, 41216, 1, 5120]
    - [251, 0.0]
  - - [2048, 41472, 1, 5120]
    - [251, 0.0]
  - - [2048, 42240, 1, 5120]
    - [251, 0.0]
  - - [2048, 43008, 1, 5120]
    - [220, 0.0]
  - - [2048, 43264, 1, 5120]
    - [220, 0.0]
  - - [2048, 43520, 1, 5120]
    - [221, 0.0]
  - - [2048, 43776, 1, 5120]
    - [236, 0.0]
  - - [2048, 44544, 1, 5120]
    - [220, 0.0]
  - - [2048, 44800, 1, 5120]
    - [221, 0.0]
  - - [2048, 45056, 1, 5120]
    - [221, 0.0]
  - - [2048, 46080, 1, 5120]
    - [214, 0.0]
  - - [2048, 46592, 1, 5120]
    - [221, 0.0]
  - - [2048, 47104, 1, 5120]
    - [214, 0.0]
  - - [2048, 47616, 1, 5120]
    - [222, 0.0]
  - - [2048, 47872, 1, 5120]
    - [220, 0.0]
  - - [2048, 48384, 1, 5120]
    - [246, 0.0]
  - - [2048, 48640, 1, 5120]
    - [259, 0.0]
  - - [2048, 49152, 1, 5120]
    - [225, 0.0]
  - - [2048, 49920, 1, 5120]
    - [221, 0.0]
  - - [2048, 50176, 1, 5120]
    - [237, 0.0]
  - - [2048, 50688, 1, 5120]
    - [256, 0.0]
  - - [2048, 51200, 1, 5120]
    - [214, 0.0]
  - - [2048, 51968, 1, 5120]
    - [221, 0.0]
  - - [2048, 52224, 1, 5120]
    - [214, 0.0]
  - - [2048, 52992, 1, 5120]
    - [221, 0.0]
  - - [2048, 53248, 1, 5120]
    - [214, 0.0]
  - - [2048, 53504, 1, 5120]
    - [221, 0.0]
  - - [2048, 53760, 1, 5120]
    - [221, 0.0]
  - - [2048, 55296, 1, 5120]
    - [240, 0.0]
  - - [2048, 55552, 1, 5120]
    - [220, 0.0]
  - - [2048, 56320, 1, 5120]
    - [214, 0.0]
  - - [2048, 56576, 1, 5120]
    - [221, 0.0]
  - - [2048, 57344, 1, 5120]
    - [220, 0.0]
  - - [2048, 57600, 1, 5120]
    - [214, 0.0]
  - - [2048, 58368, 1, 5120]
    - [221, 0.0]
  - - [2048, 58880, 1, 5120]
    - [221, 0.0]
  - - [2048, 59136, 1, 5120]
    - [225, 0.0]
  - - [2048, 59392, 1, 5120]
    - [221, 0.0]
  - - [2048, 59904, 1, 5120]
    - [221, 0.0]
  - - [2048, 60928, 1, 5120]
    - [221, 0.0]
  - - [2048, 61440, 1, 5120]
    - [221, 0.0]
  - - [2048, 61952, 1, 5120]
    - [221, 0.0]
  - - [2048, 62208, 1, 5120]
    - [221, 0.0]
  - - [2048, 63232, 1, 5120]
    - [221, 0.0]
  - - [2048, 63488, 1, 5120]
    - [214, 0.0]
  - - [2048, 64000, 1, 5120]
    - [232, 0.0]
  - - [2048, 64512, 1, 5120]
    - [220, 0.0]
  - - [2048, 64768, 1, 5120]
    - [221, 0.0]
  - - [2048, 65280, 1, 5120]
    - [240, 0.0]
  - - [2048, 65536, 1, 5120]
    - [221, 0.0]
  - - [2048, 66560, 1, 5120]
    - [237, 0.0]
  - - [2048, 66816, 1, 5120]
    - [220, 0.0]
  - - [2048, 67584, 1, 5120]
    - [221, 0.0]
  - - [2048, 68096, 1, 5120]
    - [223, 0.0]
  - - [2048, 69120, 1, 5120]
    - [214, 0.0]
  - - [2048, 69632, 1, 5120]
    - [221, 0.0]
  - - [2048, 69888, 1, 5120]
    - [220, 0.0]
  - - [2048, 70400, 1, 5120]
    - [232, 0.0]
  - - [2048, 70656, 1, 5120]
    - [221, 0.0]
  - - [2048, 71424, 1, 5120]
    - [214, 0.0]
  - - [2048, 71680, 1, 5120]
    - [214, 0.0]
  - - [2048, 72960, 1, 5120]
    - [221, 0.0]
  - - [2048, 73216, 1, 5120]
    - [214, 0.0]
  - - [2048, 73728, 1, 5120]
    - [214, 0.0]
  - - [2048, 74240, 1, 5120]
    - [221, 0.0]
  - - [2048, 75264, 1, 5120]
    - [231, 0.0]
  - - [2048, 76032, 1, 5120]
    - [224, 0.0]
  - - [2048, 76544, 1, 5120]
    - [220, 0.0]
  - - [2048, 76800, 1, 5120]
    - [214, 0.0]
  - - [2048, 77824, 1, 5120]
    - [221, 0.0]
  - - [2048, 78848, 1, 5120]
    - [221, 0.0]
  - - [2048, 79360, 1, 5120]
    - [221, 0.0]
  - - [2048, 79872, 1, 5120]
    - [221, 0.0]
  - - [2048, 80640, 1, 5120]
    - [220, 0.0]
  - - [2048, 81664, 1, 5120]
    - [221, 0.0]
  - - [2048, 81920, 1, 5120]
    - [221, 0.0]
  - - [2048, 82432, 1, 5120]
    - [221, 0.0]
  - - [2048, 82944, 1, 5120]
    - [221, 0.0]
  - - [2048, 83200, 1, 5120]
    - [221, 0.0]
  - - [2048, 84480, 1, 5120]
    - [221, 0.0]
  - - [2048, 86016, 1, 5120]
    - [221, 0.0]
  - - [2048, 86528, 1, 5120]
    - [214, 0.0]
  - - [2048, 87296, 1, 5120]
    - [221, 0.0]
  - - [2048, 88320, 1, 5120]
    - [214, 0.0]
  - - [2048, 89088, 1, 5120]
    - [214, 0.0]
  - - [2048, 89600, 1, 5120]
    - [221, 0.0]
  - - [2048, 89856, 1, 5120]
    - [221, 0.0]
  - - [2048, 90112, 1, 5120]
    - [221, 0.0]
  - - [2048, 92160, 1, 5120]
    - [251, 0.0]
  - - [2048, 93184, 1, 5120]
    - [251, 0.0]
  - - [2048, 94208, 1, 5120]
    - [221, 0.0]
  - - [2048, 95232, 1, 5120]
    - [214, 0.0]
  - - [2048, 96000, 1, 5120]
    - [221, 0.0]
  - - [2048, 96512, 1, 5120]
    - [221, 0.0]
  - - [2048, 96768, 1, 5120]
    - [221, 0.0]
  - - [2048, 98304, 1, 5120]
    - [214, 0.0]
  - - [2048, 99840, 1, 5120]
    - [225, 0.0]
  - - [2048, 100352, 1, 5120]
    - [251, 0.0]
  - - [2048, 102400, 1, 5120]
    - [221, 0.0]
  - - [2048, 103168, 1, 5120]
    - [221, 0.0]
  - - [2048, 103680, 1, 5120]
    - [220, 0.0]
  - - [2048, 103936, 1, 5120]
    - [221, 0.0]
  - - [2048, 106496, 1, 5120]
    - [251, 0.0]
  - - [2048, 107520, 1, 5120]
    - [221, 0.0]
  - - [2048, 110592, 1, 5120]
    - [224, 0.0]
  - - [2048, 111104, 1, 5120]
    - [221, 0.0]
  - - [2048, 111360, 1, 5120]
    - [214, 0.0]
  - - [2048, 114688, 1, 5120]
    - [246, 0.0]
  - - [2048, 115200, 1, 5120]
    - [221, 0.0]
  - - [2048, 118784, 1, 5120]
    - [251, 0.0]
  - - [2048, 119040, 1, 5120]
    - [251, 0.0]
  - - [2048, 122880, 1, 5120]
    - [221, 0.0]
  - - [2048, 126976, 1, 5120]
    - [251, 0.0]
  - - [2048, 131072, 1, 5120]
    - [247, 0.0]
  - - [16384, 4352, 1, 5120]
    - [220, 0.0]
  - - [16384, 4608, 1, 5120]
    - [220, 0.0]
  - - [16384, 4864, 1, 5120]
    - [220, 0.0]
  - - [16384, 5120, 1, 5120]
    - [231, 0.0]
  - - [16384, 5376, 1, 5120]
    - [221, 0.0]
  - - [16384, 5632, 1, 5120]
    - [221, 0.0]
  - - [16384, 5888, 1, 5120]
    - [220, 0.0]
  - - [16384, 6144, 1, 5120]
    - [220, 0.0]
  - - [16384, 6400, 1, 5120]
    - [192, 0.0]
  - - [16384, 6656, 1, 5120]
    - [260, 0.0]
  - - [16384, 6912, 1, 5120]
    - [221, 0.0]
  - - [16384, 7168, 1, 5120]
    - [220, 0.0]
  - - [16384, 7424, 1, 5120]
    - [220, 0.0]
  - - [16384, 7680, 1, 5120]
    - [221, 0.0]
  - - [16384, 7936, 1, 5120]
    - [220, 0.0]
  - - [16384, 8192, 1, 5120]
    - [221, 0.0]
  - - [16384, 8448, 1, 5120]
    - [221, 0.0]
  - - [16384, 8704, 1, 5120]
    - [220, 0.0]
  - - [16384, 8960, 1, 5120]
    - [228, 0.0]
  - - [16384, 9216, 1, 5120]
    - [221, 0.0]
  - - [16384, 9728, 1, 5120]
    - [221, 0.0]
  - - [16384, 9984, 1, 5120]
    - [220, 0.0]
  - - [16384, 10240, 1, 5120]
    - [221, 0.0]
  - - [16384, 10752, 1, 5120]
    - [221, 0.0]
  - - [16384, 11264, 1, 5120]
    - [221, 0.0]
  - - [16384, 11520, 1, 5120]
    - [221, 0.0]
  - - [16384, 11776, 1, 5120]
    - [221, 0.0]
  - - [16384, 12288, 1, 5120]
    - [221, 0.0]
  - - [16384, 12544, 1, 5120]
    - [220, 0.0]
  - - [16384, 12800, 1, 5120]
    - [220, 0.0]
  - - [16384, 13056, 1, 5120]
    - [220, 0.0]
  - - [16384, 13312, 1, 5120]
    - [221, 0.0]
  - - [16384, 13824, 1, 5120]
    - [221, 0.0]
  - - [16384, 14080, 1, 5120]
    - [221, 0.0]
  - - [16384, 14336, 1, 5120]
    - [221, 0.0]
  - - [16384, 14592, 1, 5120]
    - [221, 0.0]
  - - [16384, 14848, 1, 5120]
    - [221, 0.0]
  - - [16384, 15360, 1, 5120]
    - [221, 0.0]
  - - [16384, 15872, 1, 5120]
    - [221, 0.0]
  - - [16384, 16128, 1, 5120]
    - [221, 0.0]
  - - [16384, 16384, 1, 5120]
    - [220, 0.0]
  - - [16384, 16640, 1, 5120]
    - [228, 0.0]
  - - [16384, 16896, 1, 5120]
    - [228, 0.0]
  - - [16384, 17408, 1, 5120]
    - [221, 0.0]
  - - [16384, 17664, 1, 5120]
    - [220, 0.0]
  - - [16384, 17920, 1, 5120]
    - [224, 0.0]
  - - [16384, 18432, 1, 5120]
    - [221, 0.0]
  - - [16384, 19200, 1, 5120]
    - [260, 0.0]
  - - [16384, 19456, 1, 5120]
    - [221, 0.0]
  - - [16384, 19712, 1, 5120]
    - [225, 0.0]
  - - [16384, 19968, 1, 5120]
    - [220, 0.0]
  - - [16384, 20480, 1, 5120]
    - [220, 0.0]
  - - [16384, 20736, 1, 5120]
    - [221, 0.0]
  - - [16384, 21504, 1, 5120]
    - [220, 0.0]
  - - [16384, 21760, 1, 5120]
    - [221, 0.0]
  - - [16384, 22272, 1, 5120]
    - [221, 0.0]
  - - [16384, 22528, 1, 5120]
    - [228, 0.0]
  - - [16384, 23040, 1, 5120]
    - [224, 0.0]
  - - [16384, 23296, 1, 5120]
    - [224, 0.0]
  - - [16384, 23552, 1, 5120]
    - [221, 0.0]
  - - [16384, 23808, 1, 5120]
    - [221, 0.0]
  - - [16384, 24320, 1, 5120]
    - [224, 0.0]
  - - [16384, 24576, 1, 5120]
    - [260, 0.0]
  - - [16384, 25088, 1, 5120]
    - [224, 0.0]
  - - [16384, 25200, 1, 5120]
    - [225, 0.0]
  - - [16384, 25344, 1, 5120]
    - [221, 0.0]
  - - [16384, 25600, 1, 5120]
    - [228, 0.0]
  - - [16384, 26112, 1, 5120]
    - [221, 0.0]
  - - [16384, 26624, 1, 5120]
    - [228, 0.0]
  - - [16384, 26880, 1, 5120]
    - [228, 0.0]
  - - [16384, 27648, 1, 5120]
    - [221, 0.0]
  - - [16384, 28160, 1, 5120]
    - [228, 0.0]
  - - [16384, 28672, 1, 5120]
    - [224, 0.0]
  - - [16384, 29184, 1, 5120]
    - [228, 0.0]
  - - [16384, 29440, 1, 5120]
    - [221, 0.0]
  - - [16384, 29696, 1, 5120]
    - [225, 0.0]
  - - [16384, 29952, 1, 5120]
    - [221, 0.0]
  - - [16384, 30464, 1, 5120]
    - [221, 0.0]
  - - [16384, 30720, 1, 5120]
    - [220, 0.0]
  - - [16384, 30976, 1, 5120]
    - [221, 0.0]
  - - [16384, 31744, 1, 5120]
    - [221, 0.0]
  - - [16384, 32000, 1, 5120]
    - [260, 0.0]
  - - [16384, 32256, 1, 5120]
    - [221, 0.0]
  - - [16384, 32768, 1, 5120]
    - [260, 0.0]
  - - [5120, 4352, 1, 2048]
    - [261, 0.0]
  - - [5120, 4608, 1, 2048]
    - [262, 0.0]
  - - [5120, 4864, 1, 2048]
    - [174, 0.0]
  - - [5120, 5120, 1, 2048]
    - [263, 0.0]
  - - [5120, 5376, 1, 2048]
    - [221, 0.0]
  - - [5120, 5632, 1, 2048]
    - [264, 0.0]
  - - [5120, 5888, 1, 2048]
    - [265, 0.0]
  - - [5120, 6144, 1, 2048]
    - [266, 0.0]
  - - [5120, 6400, 1, 2048]
    - [221, 0.0]
  - - [5120, 6656, 1, 2048]
    - [264, 0.0]
  - - [5120, 6912, 1, 2048]
    - [232, 0.0]
  - - [5120, 7168, 1, 2048]
    - [267, 0.0]
  - - [5120, 7424, 1, 2048]
    - [265, 0.0]
  - - [5120, 7680, 1, 2048]
    - [268, 0.0]
  - - [5120, 7936, 1, 2048]
    - [221, 0.0]
  - - [5120, 8192, 1, 2048]
    - [267, 0.0]
  - - [5120, 8448, 1, 2048]
    - [232, 0.0]
  - - [5120, 8704, 1, 2048]
    - [232, 0.0]
  - - [5120, 8960, 1, 2048]
    - [269, 0.0]
  - - [5120, 9216, 1, 2048]
    - [221, 0.0]
  - - [5120, 9728, 1, 2048]
    - [264, 0.0]
  - - [5120, 9984, 1, 2048]
    - [220, 0.0]
  - - [5120, 10240, 1, 2048]
    - [265, 0.0]
  - - [5120, 10752, 1, 2048]
    - [220, 0.0]
  - - [5120, 11264, 1, 2048]
    - [264, 0.0]
  - - [5120, 11520, 1, 2048]
    - [232, 0.0]
  - - [5120, 11776, 1, 2048]
    - [270, 0.0]
  - - [5120, 12288, 1, 2048]
    - [232, 0.0]
  - - [5120, 12544, 1, 2048]
    - [221, 0.0]
  - - [5120, 12800, 1, 2048]
    - [267, 0.0]
  - - [5120, 13056, 1, 2048]
    - [232, 0.0]
  - - [5120, 13312, 1, 2048]
    - [221, 0.0]
  - - [5120, 13824, 1, 2048]
    - [221, 0.0]
  - - [5120, 14080, 1, 2048]
    - [264, 0.0]
  - - [5120, 14336, 1, 2048]
    - [267, 0.0]
  - - [5120, 14592, 1, 2048]
    - [221, 0.0]
  - - [5120, 14848, 1, 2048]
    - [269, 0.0]
  - - [5120, 15360, 1, 2048]
    - [220, 0.0]
  - - [5120, 15872, 1, 2048]
    - [232, 0.0]
  - - [5120, 16128, 1, 2048]
    - [221, 0.0]
  - - [5120, 16384, 1, 2048]
    - [271, 0.0]
  - - [5120, 16640, 1, 2048]
    - [265, 0.0]
  - - [5120, 16896, 1, 2048]
    - [232, 0.0]
  - - [5120, 17408, 1, 2048]
    - [232, 0.0]
  - - [5120, 17664, 1, 2048]
    - [220, 0.0]
  - - [5120, 17920, 1, 2048]
    - [232, 0.0]
  - - [5120, 18432, 1, 2048]
    - [232, 0.0]
  - - [5120, 19200, 1, 2048]
    - [220, 0.0]
  - - [5120, 19456, 1, 2048]
    - [221, 0.0]
  - - [5120, 19712, 1, 2048]
    - [221, 0.0]
  - - [5120, 19968, 1, 2048]
    - [221, 0.0]
  - - [5120, 20480, 1, 2048]
    - [221, 0.0]
  - - [5120, 20736, 1, 2048]
    - [221, 0.0]
  - - [5120, 21504, 1, 2048]
    - [221, 0.0]
  - - [5120, 21760, 1, 2048]
    - [220, 0.0]
  - - [5120, 22272, 1, 2048]
    - [221, 0.0]
  - - [5120, 22528, 1, 2048]
    - [220, 0.0]
  - - [5120, 23040, 1, 2048]
    - [221, 0.0]
  - - [5120, 23296, 1, 2048]
    - [220, 0.0]
  - - [5120, 23552, 1, 2048]
    - [221, 0.0]
  - - [5120, 23808, 1, 2048]
    - [267, 0.0]
  - - [5120, 24320, 1, 2048]
    - [232, 0.0]
  - - [5120, 24576, 1, 2048]
    - [221, 0.0]
  - - [5120, 25088, 1, 2048]
    - [232, 0.0]
  - - [5120, 25344, 1, 2048]
    - [232, 0.0]
  - - [5120, 25600, 1, 2048]
    - [220, 0.0]
  - - [5120, 26112, 1, 2048]
    - [221, 0.0]
  - - [5120, 26624, 1, 2048]
    - [221, 0.0]
  - - [5120, 26880, 1, 2048]
    - [220, 0.0]
  - - [5120, 27648, 1, 2048]
    - [220, 0.0]
  - - [5120, 28160, 1, 2048]
    - [267, 0.0]
  - - [5120, 28672, 1, 2048]
    - [221, 0.0]
  - - [5120, 29184, 1, 2048]
    - [232, 0.0]
  - - [5120, 29440, 1, 2048]
    - [267, 0.0]
  - - [5120, 29696, 1, 2048]
    - [267, 0.0]
  - - [5120, 29952, 1, 2048]
    - [220, 0.0]
  - - [5120, 30464, 1, 2048]
    - [221, 0.0]
  - - [5120, 30720, 1, 2048]
    - [221, 0.0]
  - - [5120, 30976, 1, 2048]
    - [221, 0.0]
  - - [5120, 31744, 1, 2048]
    - [221, 0.0]
  - - [5120, 32000, 1, 2048]
    - [221, 0.0]
  - - [5120, 32256, 1, 2048]
    - [267, 0.0]
  - - [5120, 32768, 1, 2048]
    - [221, 0.0]
  - - [5120, 33280, 1, 2048]
    - [232, 0.0]
  - - [5120, 33792, 1, 2048]
    - [232, 0.0]
  - - [5120, 34048, 1, 2048]
    - [267, 0.0]
  - - [5120, 34560, 1, 2048]
    - [221, 0.0]
  - - [5120, 34816, 1, 2048]
    - [232, 0.0]
  - - [5120, 35328, 1, 2048]
    - [221, 0.0]
  - - [5120, 35840, 1, 2048]
    - [232, 0.0]
  - - [5120, 36608, 1, 2048]
    - [271, 0.0]
  - - [5120, 36864, 1, 2048]
    - [220, 0.0]
  - - [5120, 37120, 1, 2048]
    - [263, 0.0]
  - - [5120, 37632, 1, 2048]
    - [221, 0.0]
  - - [5120, 38400, 1, 2048]
    - [264, 0.0]
  - - [5120, 38912, 1, 2048]
    - [263, 0.0]
  - - [5120, 39168, 1, 2048]
    - [220, 0.0]
  - - [5120, 39424, 1, 2048]
    - [256, 0.0]
  - - [5120, 39680, 1, 2048]
    - [221, 0.0]
  - - [5120, 39936, 1, 2048]
    - [256, 0.0]
  - - [5120, 40960, 1, 2048]
    - [221, 0.0]
  - - [5120, 41216, 1, 2048]
    - [264, 0.0]
  - - [5120, 41472, 1, 2048]
    - [221, 0.0]
  - - [5120, 42240, 1, 2048]
    - [256, 0.0]
  - - [5120, 43008, 1, 2048]
    - [267, 0.0]
  - - [5120, 43264, 1, 2048]
    - [174, 0.0]
  - - [5120, 43520, 1, 2048]
    - [232, 0.0]
  - - [5120, 43776, 1, 2048]
    - [220, 0.0]
  - - [5120, 44544, 1, 2048]
    - [264, 0.0]
  - - [5120, 44800, 1, 2048]
    - [256, 0.0]
  - - [5120, 45056, 1, 2048]
    - [232, 0.0]
  - - [5120, 46080, 1, 2048]
    - [261, 0.0]
  - - [5120, 46592, 1, 2048]
    - [220, 0.0]
  - - [5120, 47104, 1, 2048]
    - [221, 0.0]
  - - [5120, 47616, 1, 2048]
    - [232, 0.0]
  - - [5120, 47872, 1, 2048]
    - [220, 0.0]
  - - [5120, 48384, 1, 2048]
    - [232, 0.0]
  - - [5120, 48640, 1, 2048]
    - [261, 0.0]
  - - [5120, 49152, 1, 2048]
    - [221, 0.0]
  - - [5120, 49920, 1, 2048]
    - [267, 0.0]
  - - [5120, 50176, 1, 2048]
    - [263, 0.0]
  - - [5120, 50688, 1, 2048]
    - [220, 0.0]
  - - [5120, 51200, 1, 2048]
    - [221, 0.0]
  - - [5120, 51968, 1, 2048]
    - [220, 0.0]
  - - [5120, 52224, 1, 2048]
    - [271, 0.0]
  - - [5120, 52992, 1, 2048]
    - [263, 0.0]
  - - [5120, 53248, 1, 2048]
    - [261, 0.0]
  - - [5120, 53504, 1, 2048]
    - [232, 0.0]
  - - [5120, 53760, 1, 2048]
    - [221, 0.0]
  - - [5120, 55296, 1, 2048]
    - [232, 0.0]
  - - [5120, 55552, 1, 2048]
    - [221, 0.0]
  - - [5120, 56320, 1, 2048]
    - [221, 0.0]
  - - [5120, 56576, 1, 2048]
    - [221, 0.0]
  - - [5120, 57344, 1, 2048]
    - [220, 0.0]
  - - [5120, 57600, 1, 2048]
    - [221, 0.0]
  - - [5120, 58368, 1, 2048]
    - [232, 0.0]
  - - [5120, 58880, 1, 2048]
    - [221, 0.0]
  - - [5120, 59136, 1, 2048]
    - [221, 0.0]
  - - [5120, 59392, 1, 2048]
    - [232, 0.0]
  - - [5120, 59904, 1, 2048]
    - [232, 0.0]
  - - [5120, 60928, 1, 2048]
    - [221, 0.0]
  - - [5120, 61440, 1, 2048]
    - [232, 0.0]
  - - [5120, 61952, 1, 2048]
    - [264, 0.0]
  - - [5120, 62208, 1, 2048]
    - [221, 0.0]
  - - [5120, 63232, 1, 2048]
    - [220, 0.0]
  - - [5120, 63488, 1, 2048]
    - [221, 0.0]
  - - [5120, 64000, 1, 2048]
    - [267, 0.0]
  - - [5120, 64512, 1, 2048]
    - [220, 0.0]
  - - [5120, 64768, 1, 2048]
    - [232, 0.0]
  - - [5120, 65280, 1, 2048]
    - [220, 0.0]
  - - [5120, 65536, 1, 2048]
    - [220, 0.0]
  - - [5120, 66560, 1, 2048]
    - [232, 0.0]
  - - [5120, 66816, 1, 2048]
    - [221, 0.0]
  - - [5120, 67584, 1, 2048]
    - [221, 0.0]
  - - [5120, 68096, 1, 2048]
    - [264, 0.0]
  - - [5120, 69120, 1, 2048]
    - [220, 0.0]
  - - [5120, 69632, 1, 2048]
    - [263, 0.0]
  - - [5120, 69888, 1, 2048]
    - [221, 0.0]
  - - [5120, 70400, 1, 2048]
    - [267, 0.0]
  - - [5120, 70656, 1, 2048]
    - [264, 0.0]
  - - [5120, 71424, 1, 2048]
    - [232, 0.0]
  - - [5120, 71680, 1, 2048]
    - [220, 0.0]
  - - [5120, 72960, 1, 2048]
    - [221, 0.0]
  - - [5120, 73216, 1, 2048]
    - [267, 0.0]
  - - [5120, 73728, 1, 2048]
    - [232, 0.0]
  - - [5120, 74240, 1, 2048]
    - [221, 0.0]
  - - [5120, 75264, 1, 2048]
    - [221, 0.0]
  - - [5120, 76032, 1, 2048]
    - [232, 0.0]
  - - [5120, 76544, 1, 2048]
    - [220, 0.0]
  - - [5120, 76800, 1, 2048]
    - [220, 0.0]
  - - [5120, 77824, 1, 2048]
    - [264, 0.0]
  - - [5120, 78848, 1, 2048]
    - [263, 0.0]
  - - [5120, 79360, 1, 2048]
    - [232, 0.0]
  - - [5120, 79872, 1, 2048]
    - [221, 0.0]
  - - [5120, 80640, 1, 2048]
    - [267, 0.0]
  - - [5120, 81664, 1, 2048]
    - [220, 0.0]
  - - [5120, 81920, 1, 2048]
    - [264, 0.0]
  - - [5120, 82432, 1, 2048]
    - [267, 0.0]
  - - [5120, 82944, 1, 2048]
    - [267, 0.0]
  - - [5120, 83200, 1, 2048]
    - [220, 0.0]
  - - [5120, 84480, 1, 2048]
    - [232, 0.0]
  - - [5120, 86016, 1, 2048]
    - [232, 0.0]
  - - [5120, 86528, 1, 2048]
    - [220, 0.0]
  - - [5120, 87296, 1, 2048]
    - [221, 0.0]
  - - [5120, 88320, 1, 2048]
    - [267, 0.0]
  - - [5120, 89088, 1, 2048]
    - [264, 0.0]
  - - [5120, 89600, 1, 2048]
    - [232, 0.0]
  - - [5120, 89856, 1, 2048]
    - [221, 0.0]
  - - [5120, 90112, 1, 2048]
    - [221, 0.0]
  - - [5120, 92160, 1, 2048]
    - [221, 0.0]
  - - [5120, 93184, 1, 2048]
    - [267, 0.0]
  - - [5120, 94208, 1, 2048]
    - [221, 0.0]
  - - [5120, 95232, 1, 2048]
    - [221, 0.0]
  - - [5120, 96000, 1, 2048]
    - [221, 0.0]
  - - [5120, 96512, 1, 2048]
    - [221, 0.0]
  - - [5120, 96768, 1, 2048]
    - [264, 0.0]
  - - [5120, 98304, 1, 2048]
    - [221, 0.0]
  - - [5120, 99840, 1, 2048]
    - [221, 0.0]
  - - [5120, 100352, 1, 2048]
    - [220, 0.0]
  - - [5120, 102400, 1, 2048]
    - [232, 0.0]
  - - [5120, 103168, 1, 2048]
    - [220, 0.0]
  - - [5120, 103680, 1, 2048]
    - [267, 0.0]
  - - [5120, 103936, 1, 2048]
    - [232, 0.0]
  - - [5120, 106496, 1, 2048]
    - [221, 0.0]
  - - [5120, 107520, 1, 2048]
    - [267, 0.0]
  - - [5120, 110592, 1, 2048]
    - [221, 0.0]
  - - [5120, 111104, 1, 2048]
    - [232, 0.0]
  - - [5120, 111360, 1, 2048]
    - [232, 0.0]
  - - [5120, 114688, 1, 2048]
    - [221, 0.0]
  - - [5120, 115200, 1, 2048]
    - [264, 0.0]
  - - [5120, 118784, 1, 2048]
    - [221, 0.0]
  - - [5120, 119040, 1, 2048]
    - [221, 0.0]
  - - [5120, 122880, 1, 2048]
    - [232, 0.0]
  - - [5120, 126976, 1, 2048]
    - [267, 0.0]
  - - [5120, 131072, 1, 2048]
    - [221, 0.0]
  - - [5120, 10240, 1, 640]
    - [345, 0.0]
  - - [5120, 10752, 1, 640]
    - [345, 0.0]
  - - [5120, 11264, 1, 640]
    - [345, 0.0]
  - - [5120, 11520, 1, 640]
    - [345, 0.0]
  - - [5120, 11776, 1, 640]
    - [334, 0.0]
  - - [5120, 12288, 1, 640]
    - [334, 0.0]
  - - [5120, 12544, 1, 640]
    - [334, 0.0]
  - - [5120, 12800, 1, 640]
    - [334, 0.0]
  - - [5120, 13056, 1, 640]
    - [346, 0.0]
  - - [5120, 13312, 1, 640]
    - [348, 0.0]
  - - [5120, 13824, 1, 640]
    - [334, 0.0]
  - - [5120, 14080, 1, 640]
    - [345, 0.0]
  - - [5120, 14336, 1, 640]
    - [345, 0.0]
  - - [5120, 14592, 1, 640]
    - [345, 0.0]
  - - [5120, 14848, 1, 640]
    - [338, 0.0]
  - - [5120, 15360, 1, 640]
    - [345, 0.0]
  - - [5120, 15872, 1, 640]
    - [336, 0.0]
  - - [5120, 16128, 1, 640]
    - [348, 0.0]
  - - [5120, 16384, 1, 640]
    - [334, 0.0]
  - - [5120, 16640, 1, 640]
    - [334, 0.0]
  - - [5120, 16896, 1, 640]
    - [346, 0.0]
  - - [5120, 17408, 1, 640]
    - [336, 0.0]
  - - [5120, 17664, 1, 640]
    - [338, 0.0]
  - - [5120, 17920, 1, 640]
    - [345, 0.0]
  - - [5120, 18432, 1, 640]
    - [337, 0.0]
  - - [5120, 19200, 1, 640]
    - [338, 0.0]
  - - [5120, 19456, 1, 640]
    - [345, 0.0]
  - - [5120, 19712, 1, 640]
    - [334, 0.0]
  - - [5120, 19968, 1, 640]
    - [336, 0.0]
  - - [5120, 20480, 1, 640]
    - [334, 0.0]
  - - [5120, 20736, 1, 640]
    - [334, 0.0]
  - - [5120, 21504, 1, 640]
    - [345, 0.0]
  - - [5120, 21760, 1, 640]
    - [345, 0.0]
  - - [5120, 22272, 1, 640]
    - [345, 0.0]
  - - [5120, 22528, 1, 640]
    - [338, 0.0]
  - - [5120, 23040, 1, 640]
    - [345, 0.0]
  - - [5120, 23296, 1, 640]
    - [338, 0.0]
  - - [5120, 23552, 1, 640]
    - [334, 0.0]
  - - [5120, 23808, 1, 640]
    - [334, 0.0]
  - - [5120, 24320, 1, 640]
    - [345, 0.0]
  - - [5120, 24576, 1, 640]
    - [334, 0.0]
  - - [5120, 25088, 1, 640]
    - [337, 0.0]
  - - [5120, 25344, 1, 640]
    - [345, 0.0]
  - - [5120, 25600, 1, 640]
    - [345, 0.0]
  - - [5120, 26112, 1, 640]
    - [345, 0.0]
  - - [5120, 26624, 1, 640]
    - [337, 0.0]
  - - [5120, 26880, 1, 640]
    - [345, 0.0]
  - - [5120, 27648, 1, 640]
    - [334, 0.0]
  - - [5120, 28160, 1, 640]
    - [337, 0.0]
  - - [5120, 28672, 1, 640]
    - [337, 0.0]
  - - [5120, 29184, 1, 640]
    - [345, 0.0]
  - - [5120, 29440, 1, 640]
    - [345, 0.0]
  - - [5120, 29696, 1, 640]
    - [345, 0.0]
  - - [5120, 29952, 1, 640]
    - [337, 0.0]
  - - [5120, 30464, 1, 640]
    - [345, 0.0]
  - - [5120, 30720, 1, 640]
    - [345, 0.0]
  - - [5120, 30976, 1, 640]
    - [338, 0.0]
  - - [5120, 31744, 1, 640]
    - [334, 0.0]
  - - [5120, 32000, 1, 640]
    - [334, 0.0]
  - - [5120, 32256, 1, 640]
    - [337, 0.0]
  - - [5120, 32768, 1, 640]
    - [337, 0.0]
  - - [5120, 33280, 1, 640]
    - [337, 0.0]
  - - [5120, 33792, 1, 640]
    - [345, 0.0]
  - - [5120, 34048, 1, 640]
    - [338, 0.0]
  - - [5120, 34560, 1, 640]
    - [341, 0.0]
  - - [5120, 34816, 1, 640]
    - [345, 0.0]
  - - [5120, 35328, 1, 640]
    - [337, 0.0]
  - - [5120, 35840, 1, 640]
    - [341, 0.0]
  - - [5120, 36608, 1, 640]
    - [341, 0.0]
  - - [5120, 36864, 1, 640]
    - [345, 0.0]
  - - [5120, 37120, 1, 640]
    - [338, 0.0]
  - - [5120, 37632, 1, 640]
    - [341, 0.0]
  - - [5120, 38400, 1, 640]
    - [337, 0.0]
  - - [5120, 38912, 1, 640]
    - [337, 0.0]
  - - [5120, 39168, 1, 640]
    - [334, 0.0]
  - - [5120, 39424, 1, 640]
    - [334, 0.0]
  - - [5120, 39680, 1, 640]
    - [338, 0.0]
  - - [5120, 39936, 1, 640]
    - [337, 0.0]
  - - [5120, 40960, 1, 640]
    - [337, 0.0]
  - - [5120, 41216, 1, 640]
    - [345, 0.0]
  - - [5120, 41472, 1, 640]
    - [338, 0.0]
  - - [5120, 42240, 1, 640]
    - [338, 0.0]
  - - [5120, 43008, 1, 640]
    - [334, 0.0]
  - - [5120, 43264, 1, 640]
    - [337, 0.0]
  - - [5120, 43520, 1, 640]
    - [345, 0.0]
  - - [5120, 43776, 1, 640]
    - [338, 0.0]
  - - [5120, 44544, 1, 640]
    - [337, 0.0]
  - - [5120, 44800, 1, 640]
    - [341, 0.0]
  - - [5120, 45056, 1, 640]
    - [338, 0.0]
  - - [5120, 46080, 1, 640]
    - [345, 0.0]
  - - [5120, 46592, 1, 640]
    - [341, 0.0]
  - - [5120, 47104, 1, 640]
    - [337, 0.0]
  - - [5120, 47616, 1, 640]
    - [338, 0.0]
  - - [5120, 47872, 1, 640]
    - [345, 0.0]
  - - [5120, 48384, 1, 640]
    - [338, 0.0]
  - - [5120, 48640, 1, 640]
    - [337, 0.0]
  - - [5120, 49152, 1, 640]
    - [337, 0.0]
  - - [5120, 49920, 1, 640]
    - [345, 0.0]
  - - [5120, 50176, 1, 640]
    - [345, 0.0]
  - - [5120, 50688, 1, 640]
    - [337, 0.0]
  - - [5120, 51200, 1, 640]
    - [341, 0.0]
  - - [5120, 51968, 1, 640]
    - [345, 0.0]
  - - [5120, 52224, 1, 640]
    - [337, 0.0]
  - - [5120, 52992, 1, 640]
    - [345, 0.0]
  - - [5120, 53248, 1, 640]
    - [345, 0.0]
  - - [5120, 53504, 1, 640]
    - [345, 0.0]
  - - [5120, 53760, 1, 640]
    - [338, 0.0]
  - - [5120, 55296, 1, 640]
    - [337, 0.0]
  - - [5120, 55552, 1, 640]
    - [337, 0.0]
  - - [5120, 56320, 1, 640]
    - [337, 0.0]
  - - [5120, 56576, 1, 640]
    - [338, 0.0]
  - - [5120, 57344, 1, 640]
    - [345, 0.0]
  - - [5120, 57600, 1, 640]
    - [345, 0.0]
  - - [5120, 58368, 1, 640]
    - [338, 0.0]
  - - [5120, 58880, 1, 640]
    - [341, 0.0]
  - - [5120, 59136, 1, 640]
    - [337, 0.0]
  - - [5120, 59392, 1, 640]
    - [334, 0.0]
  - - [5120, 59904, 1, 640]
    - [341, 0.0]
  - - [5120, 60928, 1, 640]
    - [337, 0.0]
  - - [5120, 61440, 1, 640]
    - [338, 0.0]
  - - [5120, 61952, 1, 640]
    - [337, 0.0]
  - - [5120, 62208, 1, 640]
    - [338, 0.0]
  - - [5120, 63232, 1, 640]
    - [345, 0.0]
  - - [5120, 63488, 1, 640]
    - [345, 0.0]
  - - [5120, 64000, 1, 640]
    - [345, 0.0]
  - - [5120, 64512, 1, 640]
    - [337, 0.0]
  - - [5120, 64768, 1, 640]
    - [338, 0.0]
  - - [5120, 65280, 1, 640]
    - [345, 0.0]
  - - [5120, 65536, 1, 640]
    - [337, 0.0]
  - - [5120, 66560, 1, 640]
    - [341, 0.0]
  - - [5120, 66816, 1, 640]
    - [337, 0.0]
  - - [5120, 67584, 1, 640]
    - [337, 0.0]
  - - [5120, 68096, 1, 640]
    - [345, 0.0]
  - - [5120, 69120, 1, 640]
    - [345, 0.0]
  - - [5120, 69632, 1, 640]
    - [341, 0.0]
  - - [5120, 69888, 1, 640]
    - [337, 0.0]
  - - [5120, 70400, 1, 640]
    - [341, 0.0]
  - - [5120, 70656, 1, 640]
    - [337, 0.0]
  - - [5120, 71424, 1, 640]
    - [337, 0.0]
  - - [5120, 71680, 1, 640]
    - [345, 0.0]
  - - [5120, 72960, 1, 640]
    - [341, 0.0]
  - - [5120, 73216, 1, 640]
    - [337, 0.0]
  - - [5120, 73728, 1, 640]
    - [345, 0.0]
  - - [5120, 74240, 1, 640]
    - [337, 0.0]
  - - [5120, 75264, 1, 640]
    - [338, 0.0]
  - - [5120, 76032, 1, 640]
    - [341, 0.0]
  - - [5120, 76544, 1, 640]
    - [345, 0.0]
  - - [5120, 76800, 1, 640]
    - [337, 0.0]
  - - [5120, 77824, 1, 640]
    - [337, 0.0]
  - - [5120, 78848, 1, 640]
    - [337, 0.0]
  - - [5120, 79360, 1, 640]
    - [345, 0.0]
  - - [5120, 79872, 1, 640]
    - [341, 0.0]
  - - [5120, 80640, 1, 640]
    - [338, 0.0]
  - - [5120, 81664, 1, 640]
    - [338, 0.0]
  - - [5120, 81920, 1, 640]
    - [337, 0.0]
  - - [5120, 82432, 1, 640]
    - [345, 0.0]
  - - [5120, 82944, 1, 640]
    - [337, 0.0]
  - - [5120, 83200, 1, 640]
    - [337, 0.0]
  - - [5120, 84480, 1, 640]
    - [345, 0.0]
  - - [5120, 86016, 1, 640]
    - [345, 0.0]
  - - [5120, 86528, 1, 640]
    - [345, 0.0]
  - - [5120, 87296, 1, 640]
    - [345, 0.0]
  - - [5120, 88320, 1, 640]
    - [337, 0.0]
  - - [5120, 89088, 1, 640]
    - [338, 0.0]
  - - [5120, 89600, 1, 640]
    - [337, 0.0]
  - - [5120, 89856, 1, 640]
    - [341, 0.0]
  - - [5120, 90112, 1, 640]
    - [338, 0.0]
  - - [5120, 92160, 1, 640]
    - [345, 0.0]
  - - [5120, 93184, 1, 640]
    - [345, 0.0]
  - - [5120, 94208, 1, 640]
    - [337, 0.0]
  - - [5120, 95232, 1, 640]
    - [338, 0.0]
  - - [5120, 96000, 1, 640]
    - [337, 0.0]
  - - [5120, 96512, 1, 640]
    - [345, 0.0]
  - - [5120, 96768, 1, 640]
    - [341, 0.0]
  - - [5120, 98304, 1, 640]
    - [337, 0.0]
  - - [5120, 99840, 1, 640]
    - [345, 0.0]
  - - [5120, 100352, 1, 640]
    - [337, 0.0]
  - - [5120, 102400, 1, 640]
    - [345, 0.0]
  - - [5120, 103168, 1, 640]
    - [337, 0.0]
  - - [5120, 103680, 1, 640]
    - [337, 0.0]
  - - [5120, 103936, 1, 640]
    - [345, 0.0]
  - - [5120, 106496, 1, 640]
    - [345, 0.0]
  - - [5120, 107520, 1, 640]
    - [338, 0.0]
  - - [5120, 110592, 1, 640]
    - [337, 0.0]
  - - [5120, 111104, 1, 640]
    - [345, 0.0]
  - - [5120, 111360, 1, 640]
    - [345, 0.0]
  - - [5120, 114688, 1, 640]
    - [337, 0.0]
  - - [5120, 115200, 1, 640]
    - [337, 0.0]
  - - [5120, 118784, 1, 640]
    - [345, 0.0]
  - - [5120, 119040, 1, 640]
    - [337, 0.0]
  - - [5120, 122880, 1, 640]
    - [337, 0.0]
  - - [5120, 126976, 1, 640]
    - [341, 0.0]
  - - [5120, 131072, 1, 640]
    - [341, 0.0]
  - - [5120, 5888, 1, 1024]
    - [372, 0.0]
  - - [5120, 6144, 1, 1024]
    - [372, 0.0]
  - - [5120, 6400, 1, 1024]
    - [344, 0.0]
  - - [5120, 6656, 1, 1024]
    - [348, 0.0]
  - - [5120, 6912, 1, 1024]
    - [380, 0.0]
  - - [5120, 7168, 1, 1024]
    - [376, 0.0]
  - - [5120, 7424, 1, 1024]
    - [337, 0.0]
  - - [5120, 7680, 1, 1024]
    - [337, 0.0]
  - - [5120, 7936, 1, 1024]
    - [334, 0.0]
  - - [5120, 8192, 1, 1024]
    - [336, 0.0]
  - - [5120, 8448, 1, 1024]
    - [334, 0.0]
  - - [5120, 8704, 1, 1024]
    - [334, 0.0]
  - - [5120, 8960, 1, 1024]
    - [372, 0.0]
  - - [5120, 9216, 1, 1024]
    - [373, 0.0]
  - - [5120, 9728, 1, 1024]
    - [348, 0.0]
  - - [5120, 9984, 1, 1024]
    - [348, 0.0]
  - - [5120, 10240, 1, 1024]
    - [380, 0.0]
  - - [5120, 10752, 1, 1024]
    - [381, 0.0]
  - - [5120, 11264, 1, 1024]
    - [338, 0.0]
  - - [5120, 11520, 1, 1024]
    - [338, 0.0]
  - - [5120, 11776, 1, 1024]
    - [334, 0.0]
  - - [5120, 12288, 1, 1024]
    - [336, 0.0]
  - - [5120, 12544, 1, 1024]
    - [346, 0.0]
  - - [5120, 12800, 1, 1024]
    - [334, 0.0]
  - - [5120, 13056, 1, 1024]
    - [334, 0.0]
  - - [5120, 13312, 1, 1024]
    - [344, 0.0]
  - - [5120, 13824, 1, 1024]
    - [334, 0.0]
  - - [5120, 14080, 1, 1024]
    - [380, 0.0]
  - - [5120, 14336, 1, 1024]
    - [381, 0.0]
  - - [5120, 14592, 1, 1024]
    - [334, 0.0]
  - - [5120, 14848, 1, 1024]
    - [345, 0.0]
  - - [5120, 15360, 1, 1024]
    - [345, 0.0]
  - - [5120, 15872, 1, 1024]
    - [334, 0.0]
  - - [5120, 16128, 1, 1024]
    - [348, 0.0]
  - - [5120, 16384, 1, 1024]
    - [348, 0.0]
  - - [5120, 16640, 1, 1024]
    - [348, 0.0]
  - - [5120, 16896, 1, 1024]
    - [348, 0.0]
  - - [5120, 17408, 1, 1024]
    - [334, 0.0]
  - - [5120, 17664, 1, 1024]
    - [380, 0.0]
  - - [5120, 17920, 1, 1024]
    - [381, 0.0]
  - - [5120, 18432, 1, 1024]
    - [345, 0.0]
  - - [5120, 19200, 1, 1024]
    - [338, 0.0]
  - - [5120, 19456, 1, 1024]
    - [338, 0.0]
  - - [5120, 19712, 1, 1024]
    - [348, 0.0]
  - - [5120, 19968, 1, 1024]
    - [334, 0.0]
  - - [5120, 20480, 1, 1024]
    - [346, 0.0]
  - - [5120, 20736, 1, 1024]
    - [381, 0.0]
  - - [5120, 21504, 1, 1024]
    - [380, 0.0]
  - - [5120, 21760, 1, 1024]
    - [380, 0.0]
  - - [5120, 22272, 1, 1024]
    - [345, 0.0]
  - - [5120, 22528, 1, 1024]
    - [338, 0.0]
  - - [5120, 23040, 1, 1024]
    - [338, 0.0]
  - - [5120, 23296, 1, 1024]
    - [345, 0.0]
  - - [5120, 23552, 1, 1024]
    - [348, 0.0]
  - - [5120, 23808, 1, 1024]
    - [334, 0.0]
  - - [5120, 24320, 1, 1024]
    - [381, 0.0]
  - - [5120, 24576, 1, 1024]
    - [381, 0.0]
  - - [5120, 25088, 1, 1024]
    - [373, 0.0]
  - - [5120, 25344, 1, 1024]
    - [381, 0.0]
  - - [5120, 25600, 1, 1024]
    - [334, 0.0]
  - - [5120, 26112, 1, 1024]
    - [334, 0.0]
  - - [5120, 26624, 1, 1024]
    - [341, 0.0]
  - - [5120, 26880, 1, 1024]
    - [348, 0.0]
  - - [5120, 27648, 1, 1024]
    - [334, 0.0]
  - - [5120, 28160, 1, 1024]
    - [334, 0.0]
  - - [5120, 28672, 1, 1024]
    - [380, 0.0]
  - - [5120, 29184, 1, 1024]
    - [334, 0.0]
  - - [5120, 29440, 1, 1024]
    - [334, 0.0]
  - - [5120, 29696, 1, 1024]
    - [348, 0.0]
  - - [5120, 29952, 1, 1024]
    - [344, 0.0]
  - - [5120, 30464, 1, 1024]
    - [344, 0.0]
  - - [5120, 30720, 1, 1024]
    - [337, 0.0]
  - - [5120, 30976, 1, 1024]
    - [345, 0.0]
  - - [5120, 31744, 1, 1024]
    - [334, 0.0]
  - - [5120, 32000, 1, 1024]
    - [334, 0.0]
  - - [5120, 32256, 1, 1024]
    - [381, 0.0]
  - - [5120, 32768, 1, 1024]
    - [334, 0.0]
  - - [5120, 33280, 1, 1024]
    - [334, 0.0]
  - - [5120, 33792, 1, 1024]
    - [344, 0.0]
  - - [5120, 34048, 1, 1024]
    - [344, 0.0]
  - - [5120, 34560, 1, 1024]
    - [345, 0.0]
  - - [5120, 34816, 1, 1024]
    - [341, 0.0]
  - - [5120, 35328, 1, 1024]
    - [381, 0.0]
  - - [5120, 35840, 1, 1024]
    - [381, 0.0]
  - - [5120, 36608, 1, 1024]
    - [348, 0.0]
  - - [5120, 36864, 1, 1024]
    - [348, 0.0]
  - - [5120, 37120, 1, 1024]
    - [348, 0.0]
  - - [5120, 37632, 1, 1024]
    - [334, 0.0]
  - - [5120, 38400, 1, 1024]
    - [345, 0.0]
  - - [5120, 38912, 1, 1024]
    - [345, 0.0]
  - - [5120, 39168, 1, 1024]
    - [381, 0.0]
  - - [5120, 39424, 1, 1024]
    - [348, 0.0]
  - - [5120, 39680, 1, 1024]
    - [380, 0.0]
  - - [5120, 39936, 1, 1024]
    - [381, 0.0]
  - - [5120, 40960, 1, 1024]
    - [345, 0.0]
  - - [5120, 41216, 1, 1024]
    - [338, 0.0]
  - - [5120, 41472, 1, 1024]
    - [336, 0.0]
  - - [5120, 42240, 1, 1024]
    - [345, 0.0]
  - - [5120, 43008, 1, 1024]
    - [381, 0.0]
  - - [5120, 43264, 1, 1024]
    - [381, 0.0]
  - - [5120, 43520, 1, 1024]
    - [334, 0.0]
  - - [5120, 43776, 1, 1024]
    - [348, 0.0]
  - - [5120, 44544, 1, 1024]
    - [334, 0.0]
  - - [5120, 44800, 1, 1024]
    - [382, 0.0]
  - - [5120, 45056, 1, 1024]
    - [338, 0.0]
  - - [5120, 46080, 1, 1024]
    - [334, 0.0]
  - - [5120, 46592, 1, 1024]
    - [338, 0.0]
  - - [5120, 47104, 1, 1024]
    - [348, 0.0]
  - - [5120, 47616, 1, 1024]
    - [334, 0.0]
  - - [5120, 47872, 1, 1024]
    - [334, 0.0]
  - - [5120, 48384, 1, 1024]
    - [338, 0.0]
  - - [5120, 48640, 1, 1024]
    - [334, 0.0]
  - - [5120, 49152, 1, 1024]
    - [334, 0.0]
  - - [5120, 49920, 1, 1024]
    - [334, 0.0]
  - - [5120, 50176, 1, 1024]
    - [345, 0.0]
  - - [5120, 50688, 1, 1024]
    - [344, 0.0]
  - - [5120, 51200, 1, 1024]
    - [334, 0.0]
  - - [5120, 51968, 1, 1024]
    - [334, 0.0]
  - - [5120, 52224, 1, 1024]
    - [334, 0.0]
  - - [5120, 52992, 1, 1024]
    - [334, 0.0]
  - - [5120, 53248, 1, 1024]
    - [334, 0.0]
  - - [5120, 53504, 1, 1024]
    - [334, 0.0]
  - - [5120, 53760, 1, 1024]
    - [334, 0.0]
  - - [5120, 55296, 1, 1024]
    - [334, 0.0]
  - - [5120, 55552, 1, 1024]
    - [348, 0.0]
  - - [5120, 56320, 1, 1024]
    - [348, 0.0]
  - - [5120, 56576, 1, 1024]
    - [334, 0.0]
  - - [5120, 57344, 1, 1024]
    - [344, 0.0]
  - - [5120, 57600, 1, 1024]
    - [344, 0.0]
  - - [5120, 58368, 1, 1024]
    - [338, 0.0]
  - - [5120, 58880, 1, 1024]
    - [334, 0.0]
  - - [5120, 59136, 1, 1024]
    - [346, 0.0]
  - - [5120, 59392, 1, 1024]
    - [334, 0.0]
  - - [5120, 59904, 1, 1024]
    - [334, 0.0]
  - - [5120, 60928, 1, 1024]
    - [334, 0.0]
  - - [5120, 61440, 1, 1024]
    - [380, 0.0]
  - - [5120, 61952, 1, 1024]
    - [345, 0.0]
  - - [5120, 62208, 1, 1024]
    - [345, 0.0]
  - - [5120, 63232, 1, 1024]
    - [348, 0.0]
  - - [5120, 63488, 1, 1024]
    - [348, 0.0]
  - - [5120, 64000, 1, 1024]
    - [348, 0.0]
  - - [5120, 64512, 1, 1024]
    - [344, 0.0]
  - - [5120, 64768, 1, 1024]
    - [345, 0.0]
  - - [5120, 65280, 1, 1024]
    - [381, 0.0]
  - - [5120, 65536, 1, 1024]
    - [338, 0.0]
  - - [5120, 66560, 1, 1024]
    - [334, 0.0]
  - - [5120, 66816, 1, 1024]
    - [344, 0.0]
  - - [5120, 67584, 1, 1024]
    - [348, 0.0]
  - - [5120, 68096, 1, 1024]
    - [348, 0.0]
  - - [5120, 69120, 1, 1024]
    - [380, 0.0]
  - - [5120, 69632, 1, 1024]
    - [338, 0.0]
  - - [5120, 69888, 1, 1024]
    - [348, 0.0]
  - - [5120, 70400, 1, 1024]
    - [348, 0.0]
  - - [5120, 70656, 1, 1024]
    - [344, 0.0]
  - - [5120, 71424, 1, 1024]
    - [348, 0.0]
  - - [5120, 71680, 1, 1024]
    - [345, 0.0]
  - - [5120, 72960, 1, 1024]
    - [345, 0.0]
  - - [5120, 73216, 1, 1024]
    - [345, 0.0]
  - - [5120, 73728, 1, 1024]
    - [345, 0.0]
  - - [5120, 74240, 1, 1024]
    - [348, 0.0]
  - - [5120, 75264, 1, 1024]
    - [345, 0.0]
  - - [5120, 76032, 1, 1024]
    - [380, 0.0]
  - - [5120, 76544, 1, 1024]
    - [381, 0.0]
  - - [5120, 76800, 1, 1024]
    - [345, 0.0]
  - - [5120, 77824, 1, 1024]
    - [345, 0.0]
  - - [5120, 78848, 1, 1024]
    - [381, 0.0]
  - - [5120, 79360, 1, 1024]
    - [380, 0.0]
  - - [5120, 79872, 1, 1024]
    - [348, 0.0]
  - - [5120, 80640, 1, 1024]
    - [345, 0.0]
  - - [5120, 81664, 1, 1024]
    - [345, 0.0]
  - - [5120, 81920, 1, 1024]
    - [334, 0.0]
  - - [5120, 82432, 1, 1024]
    - [338, 0.0]
  - - [5120, 82944, 1, 1024]
    - [345, 0.0]
  - - [5120, 83200, 1, 1024]
    - [381, 0.0]
  - - [5120, 84480, 1, 1024]
    - [348, 0.0]
  - - [5120, 86016, 1, 1024]
    - [380, 0.0]
  - - [5120, 86528, 1, 1024]
    - [381, 0.0]
  - - [5120, 87296, 1, 1024]
    - [345, 0.0]
  - - [5120, 88320, 1, 1024]
    - [338, 0.0]
  - - [5120, 89088, 1, 1024]
    - [337, 0.0]
  - - [5120, 89600, 1, 1024]
    - [348, 0.0]
  - - [5120, 89856, 1, 1024]
    - [380, 0.0]
  - - [5120, 90112, 1, 1024]
    - [348, 0.0]
  - - [5120, 92160, 1, 1024]
    - [338, 0.0]
  - - [5120, 93184, 1, 1024]
    - [334, 0.0]
  - - [5120, 94208, 1, 1024]
    - [348, 0.0]
  - - [5120, 95232, 1, 1024]
    - [345, 0.0]
  - - [5120, 96000, 1, 1024]
    - [345, 0.0]
  - - [5120, 96512, 1, 1024]
    - [338, 0.0]
  - - [5120, 96768, 1, 1024]
    - [345, 0.0]
  - - [5120, 98304, 1, 1024]
    - [380, 0.0]
  - - [5120, 99840, 1, 1024]
    - [338, 0.0]
  - - [5120, 100352, 1, 1024]
    - [345, 0.0]
  - - [5120, 102400, 1, 1024]
    - [338, 0.0]
  - - [5120, 103168, 1, 1024]
    - [338, 0.0]
  - - [5120, 103680, 1, 1024]
    - [383, 0.0]
  - - [5120, 103936, 1, 1024]
    - [345, 0.0]
  - - [5120, 106496, 1, 1024]
    - [338, 0.0]
  - - [5120, 107520, 1, 1024]
    - [338, 0.0]
  - - [5120, 110592, 1, 1024]
    - [345, 0.0]
  - - [5120, 111104, 1, 1024]
    - [348, 0.0]
  - - [5120, 111360, 1, 1024]
    - [345, 0.0]
  - - [5120, 114688, 1, 1024]
    - [348, 0.0]
  - - [5120, 115200, 1, 1024]
    - [345, 0.0]
  - - [5120, 118784, 1, 1024]
    - [348, 0.0]
  - - [5120, 119040, 1, 1024]
    - [345, 0.0]
  - - [5120, 122880, 1, 1024]
    - [345, 0.0]
  - - [5120, 126976, 1, 1024]
    - [345, 0.0]
  - - [5120, 131072, 1, 1024]
    - [381, 0.0]
  - - [5120, 4352, 1, 8192]
    - [272, 0.0]
  - - [5120, 4608, 1, 8192]
    - [207, 0.0]
  - - [5120, 4864, 1, 8192]
    - [272, 0.0]
  - - [5120, 5120, 1, 8192]
    - [273, 0.0]
  - - [5120, 5376, 1, 8192]
    - [274, 0.0]
  - - [5120, 5632, 1, 8192]
    - [275, 0.0]
  - - [5120, 5888, 1, 8192]
    - [209, 0.0]
  - - [5120, 6144, 1, 8192]
    - [276, 0.0]
  - - [5120, 6400, 1, 8192]
    - [277, 0.0]
  - - [5120, 6656, 1, 8192]
    - [278, 0.0]
  - - [5120, 6912, 1, 8192]
    - [279, 0.0]
  - - [5120, 7168, 1, 8192]
    - [279, 0.0]
  - - [5120, 7424, 1, 8192]
    - [279, 0.0]
  - - [5120, 7680, 1, 8192]
    - [279, 0.0]
  - - [5120, 7936, 1, 8192]
    - [275, 0.0]
  - - [5120, 8192, 1, 8192]
    - [275, 0.0]
  - - [5120, 8448, 1, 8192]
    - [274, 0.0]
  - - [5120, 8704, 1, 8192]
    - [190, 0.0]
  - - [5120, 8960, 1, 8192]
    - [191, 0.0]
  - - [5120, 9216, 1, 8192]
    - [278, 0.0]
  - - [5120, 9728, 1, 8192]
    - [272, 0.0]
  - - [5120, 9984, 1, 8192]
    - [268, 0.0]
  - - [5120, 10240, 1, 8192]
    - [268, 0.0]
  - - [5120, 10752, 1, 8192]
    - [268, 0.0]
  - - [5120, 11264, 1, 8192]
    - [280, 0.0]
  - - [5120, 11520, 1, 8192]
    - [280, 0.0]
  - - [5120, 11776, 1, 8192]
    - [270, 0.0]
  - - [5120, 12288, 1, 8192]
    - [281, 0.0]
  - - [5120, 12544, 1, 8192]
    - [282, 0.0]
  - - [5120, 12800, 1, 8192]
    - [283, 0.0]
  - - [5120, 13056, 1, 8192]
    - [268, 0.0]
  - - [5120, 13312, 1, 8192]
    - [276, 0.0]
  - - [5120, 13824, 1, 8192]
    - [268, 0.0]
  - - [5120, 14080, 1, 8192]
    - [279, 0.0]
  - - [5120, 14336, 1, 8192]
    - [268, 0.0]
  - - [5120, 14592, 1, 8192]
    - [280, 0.0]
  - - [5120, 14848, 1, 8192]
    - [284, 0.0]
  - - [5120, 15360, 1, 8192]
    - [280, 0.0]
  - - [5120, 15872, 1, 8192]
    - [285, 0.0]
  - - [5120, 16128, 1, 8192]
    - [286, 0.0]
  - - [5120, 16384, 1, 8192]
    - [287, 0.0]
  - - [5120, 16640, 1, 8192]
    - [268, 0.0]
  - - [5120, 16896, 1, 8192]
    - [272, 0.0]
  - - [5120, 17408, 1, 8192]
    - [268, 0.0]
  - - [5120, 17664, 1, 8192]
    - [284, 0.0]
  - - [5120, 17920, 1, 8192]
    - [280, 0.0]
  - - [5120, 18432, 1, 8192]
    - [268, 0.0]
  - - [5120, 19200, 1, 8192]
    - [268, 0.0]
  - - [5120, 19456, 1, 8192]
    - [279, 0.0]
  - - [5120, 19712, 1, 8192]
    - [288, 0.0]
  - - [5120, 19968, 1, 8192]
    - [276, 0.0]
  - - [5120, 20480, 1, 8192]
    - [279, 0.0]
  - - [5120, 20736, 1, 8192]
    - [284, 0.0]
  - - [5120, 21504, 1, 8192]
    - [284, 0.0]
  - - [5120, 21760, 1, 8192]
    - [268, 0.0]
  - - [5120, 22272, 1, 8192]
    - [280, 0.0]
  - - [5120, 22528, 1, 8192]
    - [268, 0.0]
  - - [5120, 23040, 1, 8192]
    - [268, 0.0]
  - - [5120, 23296, 1, 8192]
    - [268, 0.0]
  - - [5120, 23552, 1, 8192]
    - [288, 0.0]
  - - [5120, 23808, 1, 8192]
    - [279, 0.0]
  - - [5120, 24320, 1, 8192]
    - [279, 0.0]
  - - [5120, 24576, 1, 8192]
    - [284, 0.0]
  - - [5120, 25088, 1, 8192]
    - [268, 0.0]
  - - [5120, 25344, 1, 8192]
    - [279, 0.0]
  - - [5120, 25600, 1, 8192]
    - [279, 0.0]
  - - [5120, 26112, 1, 8192]
    - [268, 0.0]
  - - [5120, 26624, 1, 8192]
    - [284, 0.0]
  - - [5120, 26880, 1, 8192]
    - [268, 0.0]
  - - [5120, 27648, 1, 8192]
    - [289, 0.0]
  - - [5120, 28160, 1, 8192]
    - [284, 0.0]
  - - [5120, 28672, 1, 8192]
    - [268, 0.0]
  - - [5120, 29184, 1, 8192]
    - [284, 0.0]
  - - [5120, 29440, 1, 8192]
    - [279, 0.0]
  - - [5120, 29696, 1, 8192]
    - [284, 0.0]
  - - [5120, 29952, 1, 8192]
    - [268, 0.0]
  - - [5120, 30464, 1, 8192]
    - [284, 0.0]
  - - [5120, 30720, 1, 8192]
    - [268, 0.0]
  - - [5120, 30976, 1, 8192]
    - [268, 0.0]
  - - [5120, 31744, 1, 8192]
    - [268, 0.0]
  - - [5120, 32000, 1, 8192]
    - [284, 0.0]
  - - [5120, 32256, 1, 8192]
    - [284, 0.0]
  - - [5120, 32768, 1, 8192]
    - [268, 0.0]
  - - [5120, 33280, 1, 8192]
    - [268, 0.0]
  - - [5120, 33792, 1, 8192]
    - [284, 0.0]
  - - [5120, 34048, 1, 8192]
    - [284, 0.0]
  - - [5120, 34560, 1, 8192]
    - [268, 0.0]
  - - [5120, 34816, 1, 8192]
    - [268, 0.0]
  - - [5120, 35328, 1, 8192]
    - [268, 0.0]
  - - [5120, 35840, 1, 8192]
    - [284, 0.0]
  - - [5120, 36608, 1, 8192]
    - [284, 0.0]
  - - [5120, 36864, 1, 8192]
    - [268, 0.0]
  - - [5120, 37120, 1, 8192]
    - [284, 0.0]
  - - [5120, 37632, 1, 8192]
    - [284, 0.0]
  - - [5120, 38400, 1, 8192]
    - [268, 0.0]
  - - [5120, 38912, 1, 8192]
    - [268, 0.0]
  - - [5120, 39168, 1, 8192]
    - [268, 0.0]
  - - [5120, 39424, 1, 8192]
    - [268, 0.0]
  - - [5120, 39680, 1, 8192]
    - [284, 0.0]
  - - [5120, 39936, 1, 8192]
    - [268, 0.0]
  - - [5120, 40960, 1, 8192]
    - [268, 0.0]
  - - [5120, 41216, 1, 8192]
    - [284, 0.0]
  - - [5120, 41472, 1, 8192]
    - [268, 0.0]
  - - [5120, 42240, 1, 8192]
    - [284, 0.0]
  - - [5120, 43008, 1, 8192]
    - [268, 0.0]
  - - [5120, 43264, 1, 8192]
    - [268, 0.0]
  - - [5120, 43520, 1, 8192]
    - [284, 0.0]
  - - [5120, 43776, 1, 8192]
    - [268, 0.0]
  - - [5120, 44544, 1, 8192]
    - [268, 0.0]
  - - [5120, 44800, 1, 8192]
    - [284, 0.0]
  - - [5120, 45056, 1, 8192]
    - [268, 0.0]
  - - [5120, 46080, 1, 8192]
    - [284, 0.0]
  - - [5120, 46592, 1, 8192]
    - [268, 0.0]
  - - [5120, 47104, 1, 8192]
    - [284, 0.0]
  - - [5120, 47616, 1, 8192]
    - [284, 0.0]
  - - [5120, 47872, 1, 8192]
    - [268, 0.0]
  - - [5120, 48384, 1, 8192]
    - [268, 0.0]
  - - [5120, 48640, 1, 8192]
    - [268, 0.0]
  - - [5120, 49152, 1, 8192]
    - [268, 0.0]
  - - [5120, 49920, 1, 8192]
    - [284, 0.0]
  - - [5120, 50176, 1, 8192]
    - [268, 0.0]
  - - [5120, 50688, 1, 8192]
    - [284, 0.0]
  - - [5120, 51200, 1, 8192]
    - [268, 0.0]
  - - [5120, 51968, 1, 8192]
    - [280, 0.0]
  - - [5120, 52224, 1, 8192]
    - [268, 0.0]
  - - [5120, 52992, 1, 8192]
    - [268, 0.0]
  - - [5120, 53248, 1, 8192]
    - [268, 0.0]
  - - [5120, 53504, 1, 8192]
    - [268, 0.0]
  - - [5120, 53760, 1, 8192]
    - [268, 0.0]
  - - [5120, 55296, 1, 8192]
    - [284, 0.0]
  - - [5120, 55552, 1, 8192]
    - [284, 0.0]
  - - [5120, 56320, 1, 8192]
    - [268, 0.0]
  - - [5120, 56576, 1, 8192]
    - [284, 0.0]
  - - [5120, 57344, 1, 8192]
    - [268, 0.0]
  - - [5120, 57600, 1, 8192]
    - [268, 0.0]
  - - [5120, 58368, 1, 8192]
    - [268, 0.0]
  - - [5120, 58880, 1, 8192]
    - [268, 0.0]
  - - [5120, 59136, 1, 8192]
    - [268, 0.0]
  - - [5120, 59392, 1, 8192]
    - [284, 0.0]
  - - [5120, 59904, 1, 8192]
    - [268, 0.0]
  - - [5120, 60928, 1, 8192]
    - [280, 0.0]
  - - [5120, 61440, 1, 8192]
    - [268, 0.0]
  - - [5120, 61952, 1, 8192]
    - [268, 0.0]
  - - [5120, 62208, 1, 8192]
    - [284, 0.0]
  - - [5120, 63232, 1, 8192]
    - [268, 0.0]
  - - [5120, 63488, 1, 8192]
    - [268, 0.0]
  - - [5120, 64000, 1, 8192]
    - [284, 0.0]
  - - [5120, 64512, 1, 8192]
    - [284, 0.0]
  - - [5120, 64768, 1, 8192]
    - [268, 0.0]
  - - [5120, 65280, 1, 8192]
    - [268, 0.0]
  - - [5120, 65536, 1, 8192]
    - [268, 0.0]
  - - [5120, 66560, 1, 8192]
    - [268, 0.0]
  - - [5120, 66816, 1, 8192]
    - [280, 0.0]
  - - [5120, 67584, 1, 8192]
    - [284, 0.0]
  - - [5120, 68096, 1, 8192]
    - [268, 0.0]
  - - [5120, 69120, 1, 8192]
    - [284, 0.0]
  - - [5120, 69632, 1, 8192]
    - [284, 0.0]
  - - [5120, 69888, 1, 8192]
    - [284, 0.0]
  - - [5120, 70400, 1, 8192]
    - [280, 0.0]
  - - [5120, 70656, 1, 8192]
    - [268, 0.0]
  - - [5120, 71424, 1, 8192]
    - [268, 0.0]
  - - [5120, 71680, 1, 8192]
    - [284, 0.0]
  - - [5120, 72960, 1, 8192]
    - [268, 0.0]
  - - [5120, 73216, 1, 8192]
    - [268, 0.0]
  - - [5120, 73728, 1, 8192]
    - [284, 0.0]
  - - [5120, 74240, 1, 8192]
    - [284, 0.0]
  - - [5120, 75264, 1, 8192]
    - [279, 0.0]
  - - [5120, 76032, 1, 8192]
    - [284, 0.0]
  - - [5120, 76544, 1, 8192]
    - [268, 0.0]
  - - [5120, 76800, 1, 8192]
    - [268, 0.0]
  - - [5120, 77824, 1, 8192]
    - [268, 0.0]
  - - [5120, 78848, 1, 8192]
    - [268, 0.0]
  - - [5120, 79360, 1, 8192]
    - [284, 0.0]
  - - [5120, 79872, 1, 8192]
    - [268, 0.0]
  - - [5120, 80640, 1, 8192]
    - [284, 0.0]
  - - [5120, 81664, 1, 8192]
    - [284, 0.0]
  - - [5120, 81920, 1, 8192]
    - [268, 0.0]
  - - [5120, 82432, 1, 8192]
    - [280, 0.0]
  - - [5120, 82944, 1, 8192]
    - [284, 0.0]
  - - [5120, 83200, 1, 8192]
    - [268, 0.0]
  - - [5120, 84480, 1, 8192]
    - [268, 0.0]
  - - [5120, 86016, 1, 8192]
    - [268, 0.0]
  - - [5120, 86528, 1, 8192]
    - [279, 0.0]
  - - [5120, 87296, 1, 8192]
    - [284, 0.0]
  - - [5120, 88320, 1, 8192]
    - [268, 0.0]
  - - [5120, 89088, 1, 8192]
    - [268, 0.0]
  - - [5120, 89600, 1, 8192]
    - [268, 0.0]
  - - [5120, 89856, 1, 8192]
    - [279, 0.0]
  - - [5120, 90112, 1, 8192]
    - [268, 0.0]
  - - [5120, 92160, 1, 8192]
    - [268, 0.0]
  - - [5120, 93184, 1, 8192]
    - [284, 0.0]
  - - [5120, 94208, 1, 8192]
    - [268, 0.0]
  - - [5120, 95232, 1, 8192]
    - [268, 0.0]
  - - [5120, 96000, 1, 8192]
    - [268, 0.0]
  - - [5120, 96512, 1, 8192]
    - [268, 0.0]
  - - [5120, 96768, 1, 8192]
    - [268, 0.0]
  - - [5120, 98304, 1, 8192]
    - [268, 0.0]
  - - [5120, 99840, 1, 8192]
    - [268, 0.0]
  - - [5120, 100352, 1, 8192]
    - [268, 0.0]
  - - [5120, 102400, 1, 8192]
    - [284, 0.0]
  - - [5120, 103168, 1, 8192]
    - [284, 0.0]
  - - [5120, 103680, 1, 8192]
    - [268, 0.0]
  - - [5120, 103936, 1, 8192]
    - [268, 0.0]
  - - [5120, 106496, 1, 8192]
    - [284, 0.0]
  - - [5120, 107520, 1, 8192]
    - [268, 0.0]
  - - [5120, 110592, 1, 8192]
    - [268, 0.0]
  - - [5120, 111104, 1, 8192]
    - [268, 0.0]
  - - [5120, 111360, 1, 8192]
    - [268, 0.0]
  - - [5120, 114688, 1, 8192]
    - [284, 0.0]
  - - [5120, 115200, 1, 8192]
    - [268, 0.0]
  - - [5120, 118784, 1, 8192]
    - [284, 0.0]
  - - [5120, 119040, 1, 8192]
    - [268, 0.0]
  - - [5120, 122880, 1, 8192]
    - [268, 0.0]
  - - [5120, 126976, 1, 8192]
    - [268, 0.0]
  - - [5120, 131072, 1, 8192]
    - [268, 0.0]
- null
- null
- DeviceEfficiency
- GridBased
