projects/hipblaslt/library/src/amd_detail/rocblaslt/src/Tensile/Logic/asm_full/aquavanjaram/gfx942/GridBased/aquavanjaram_Cijk_Ailk_Bljk_CB_UserArgs.yaml
- {MinimumRequiredVersion: 5.0.0}
- aquavanjaram
- gfx942
- [Device 0049, Device 0050]
    SolutionIndex: 0
    SolutionNameMin: Cijk_Ailk_Bljk_CB_UserArgs_MT128x128x4_MI32x32x2x1_SN_1LDSB1_LBSPP0_LPB1_MIAV0_ONLL0_PGR2_PLR3_SU0_SUS0_TT1_128_TLDS0_UMLDSB0_WG128_2_1_WGM12
    SolutionIndex: 1
    SolutionNameMin: Cijk_Ailk_Bljk_CB_UserArgs_MT128x128x4_MI32x32x2x1_SN_1LDSB1_LBSPP0_LPB1_MIAV0_ONLL1_PGR2_PLR1_SU0_SUS0_TT1_128_TLDS0_UMLDSB0_WG128_2_1_WGM12
    SolutionIndex: 2
    SolutionNameMin: Cijk_Ailk_Bljk_CB_UserArgs_MT128x128x4_MI32x32x2x1_SN_1LDSB1_LBSPP0_LPB1_MIAV0_ONLL1_PGR2_PLR3_SU0_SUS0_TT1_128_TLDS0_UMLDSB0_WG128_2_1_WGM12
    SolutionIndex: 3
    SolutionNameMin: Cijk_Ailk_Bljk_CB_UserArgs_MT128x128x4_MI32x32x2x1_SN_1LDSB1_LBSPP128_LPB2_MIAV0_ONLL0_PGR2_PLR3_SU32_SUS256_TT1_128_TLDS1_UMLDSB1_WG128_2_1_WGM12
    SolutionIndex: 4
    SolutionNameMin: Cijk_Ailk_Bljk_CB_UserArgs_MT128x128x4_MI32x32x2x1_SN_1LDSB1_LBSPP128_LPB2_MIAV0_ONLL1_PGR2_PLR1_SU32_SUS256_TT1_128_TLDS1_UMLDSB1_WG128_2_1_WGM12
    SolutionIndex: 5
    SolutionNameMin: Cijk_Ailk_Bljk_CB_UserArgs_MT128x128x4_MI32x32x2x1_SN_1LDSB1_LBSPP128_LPB2_MIAV1_ONLL1_PGR2_PLR3_SU0_SUS0_TT1_128_TLDS1_UMLDSB1_WG128_2_1_WGM12
    SolutionIndex: 6
    SolutionNameMin: Cijk_Ailk_Bljk_CB_UserArgs_MT128x128x4_MI32x32x2x1_SN_1LDSB1_LBSPP0_LPB1_MIAV1_ONLL1_PGR2_PLR1_SU0_SUS0_TT1_128_TLDS0_UMLDSB0_WG128_2_1_WGM24
    SolutionIndex: 7
    SolutionNameMin: Cijk_Ailk_Bljk_CB_UserArgs_MT16x16x128_MI16x16x4x1_SN_1LDSB0_DTVA1_GLVWB2_GSU1_GSUASB_LBSPPB1024_LPB4_LRVW2_NLCB1_PLR9_WG16_4_4
    SolutionIndex: 8
    SolutionNameMin: Cijk_Ailk_Bljk_CB_UserArgs_MT16x16x64_MI16x16x4x1_SN_1LDSB0_DTVA1_GLVWB2_GSU13_GSUAMB_LBSPPB512_LPB2_LRVW1_NLCB1_PLR5_WG16_4_4
    SolutionIndex: 9
    SolutionNameMin: Cijk_Ailk_Bljk_CB_UserArgs_MT16x16x128_MI16x16x4x1_SN_1LDSB0_DTVA1_GLVWB2_GSU16_GSUAMB_LBSPPB1024_LPB2_LRVW1_NLCB1_PLR1_WG16_4_4
    SolutionIndex: 10
    SolutionNameMin: Cijk_Ailk_Bljk_CB_UserArgs_MT16x16x128_MI16x16x4x1_SN_1LDSB1_DTVA0_GLVWA2_GLVWB2_GSU1_GSUASB_LBSPPB1024_LPB2_LRVW1_NLCB1_PLR9_WG16_4_4
    SolutionIndex: 11
    SolutionNameMin: Cijk_Ailk_Bljk_CB_UserArgs_MT16x16x128_MI16x16x4x1_SN_1LDSB1_DTVA0_GLVWA2_GLVWB2_GSU9_GSUAMB_LBSPPB1024_LPB2_LRVW1_NLCB1_PLR9_WG16_4_4
    SolutionIndex: 12
    SolutionNameMin: Cijk_Ailk_Bljk_CB_UserArgs_MT16x16x128_MI16x16x4x1_SN_1LDSB1_DTVA0_GLVWA2_GLVWB1_GSU16_GSUAMB_LBSPPB1024_LPB4_LRVW2_NLCB1_PLR9_WG16_4_4
    SolutionIndex: 13
    SolutionNameMin: Cijk_Ailk_Bljk_CB_UserArgs_MT16x16x128_MI16x16x4x1_SN_1LDSB1_AMAS0_DTVA0_GLVWA2_GLVWB2_GSU1_GSUASB_LBSPPB1024_LPB4_LRVW2_NLCB1_PLR9_SVW1_TT1_16_VW1_WG16_4_4
    SolutionIndex: 14
    SolutionNameMin: Cijk_Ailk_Bljk_CB_UserArgs_MT16x16x128_MI16x16x4x1_SN_1LDSB0_AMAS0_DTVA0_GLVWA2_GLVWB1_GSU11_GSUAMB_LBSPPB0_LPB0_LRVW1_NLCB1_PLR1_SVW1_TT1_16_VW1_WG16_4_2
    SolutionIndex: 15
    SolutionNameMin: Cijk_Ailk_Bljk_CB_UserArgs_MT16x16x128_MI16x16x4x1_SN_1LDSB1_AMAS0_DTVA0_GLVWA2_GLVWB2_GSU16_GSUAMB_LBSPPB1024_LPB2_LRVW1_NLCB1_PLR9_SVW1_TT1_16_VW1_WG16_4_4
    SolutionIndex: 16
    SolutionNameMin: Cijk_Ailk_Bljk_CB_UserArgs_MT16x16x64_MI16x16x4x1_SN_1LDSB0_AMAS0_DTVA0_GLVWA2_GLVWB2_GSU1_GSUASB_LBSPPB512_LPB2_LRVW1_NLCA1_NLCB1_PLR5_SVW1_TT1_16_VW1_WG16_4_4
    SolutionIndex: 17
    SolutionNameMin: Cijk_Ailk_Bljk_CB_UserArgs_MT16x16x64_MI16x16x4x1_SN_1LDSB1_AMAS0_DTVA0_GLVWA2_GLVWB2_GSU11_GSUAMB_LBSPPB512_LPB4_LRVW2_NLCA1_NLCB1_PLR5_SVW1_TT1_16_VW1_WG16_4_4
    SolutionIndex: 18
    SolutionNameMin: Cijk_Ailk_Bljk_CB_UserArgs_MT16x16x64_MI16x16x4x1_SN_1LDSB0_AMAS0_DTVA0_GLVWA2_GLVWB1_GSU16_GSUAMB_LBSPPB512_LPB1_LRVW1_NLCA1_NLCB1_PLR1_SVW1_TT1_16_VW1_WG16_4_4
    SolutionIndex: 19
    SolutionNameMin: Cijk_Ailk_Bljk_CB_UserArgs_MT16x16x128_MI16x16x4x1_SN_1LDSB1_AMAS0_DTVA0_GLVWA2_GLVWB2_GSU1_GSUASB_LBSPPB1024_LPB4_LRVW2_NLCA1_NLCB1_PLR9_SVW1_TT1_16_VW1_WG16_4_4
    SolutionIndex: 20
    SolutionNameMin: Cijk_Ailk_Bljk_CB_UserArgs_MT16x16x64_MI16x16x4x1_SN_1LDSB1_AMAS0_DTVA0_GLVWA2_GLVWB2_GSU13_GSUAMB_LBSPPB512_LPB4_LRVW2_NLCA1_NLCB1_PLR5_SVW1_TT1_16_VW1_WG16_4_4
    SolutionIndex: 21
    SolutionNameMin: Cijk_Ailk_Bljk_CB_UserArgs_MT16x16x64_MI16x16x4x1_SN_1LDSB0_AMAS0_DTVA0_GLVWA2_GLVWB1_GSU15_GSUAMB_LBSPPB512_LPB1_LRVW1_NLCA1_NLCB1_PLR1_SVW1_TT1_16_VW1_WG16_4_2
    SolutionIndex: 22
    SolutionNameMin: Cijk_Ailk_Bljk_CB_UserArgs_MT16x16x64_MI16x16x4x1_SN_1LDSB0_AMAS0_DTVA0_GLVWA2_GLVWB1_GSU4_LBSPPB512_LPB1_LRVW1_NLCA1_NLCB1_PLR5_SVW1_TT1_16_VW1_WG16_4_4
    SolutionIndex: 23
    SolutionNameMin: Cijk_Ailk_Bljk_CB_UserArgs_MT32x16x64_MI16x16x4x1_SN_1LDSB0_AMAS0_DTVA0_GLVWA2_GLVWB2_GSU11_LBSPPB512_LPB2_LRVW1_NLCA1_NLCB1_PLR9_SVW1_TT1_16_VW1_WG32_4_2
    SolutionIndex: 24
    SolutionNameMin: Cijk_Ailk_Bljk_CB_UserArgs_MT32x16x64_MI16x16x4x1_SN_1LDSB1_AMAS0_DTVA0_GLVWA2_GLVWB1_GSU12_LBSPPB512_LPB1_LRVW1_NLCA1_NLCB1_PLR9_SVW1_TT1_16_VW1_WG32_4_2
    SolutionIndex: 25
    SolutionNameMin: Cijk_Ailk_Bljk_CB_UserArgs_MT32x16x64_MI16x16x4x1_SN_AMAS3_DTVA0_GLVWA2_GLVWB2_GSU3_LBSPPB512_LPB2_LRVW1_NLCA1_NLCB1_PLR1_SVW2_TT2_16_VW2_WG16_4_4
    SolutionIndex: 26
    SolutionNameMin: Cijk_Ailk_Bljk_CB_UserArgs_MT64x16x32_MI16x16x4x1_SN_AMAS3_DTVA1_GLVWA2_GLVWB1_GSU13_LBSPPB256_LPB4_LRVW2_NLCA1_NLCB1_PLR5_SVW2_TT2_16_VW2_WG32_4_2
    SolutionIndex: 27
    SolutionNameMin: Cijk_Ailk_Bljk_CB_UserArgs_MT32x16x64_MI16x16x4x1_SN_AMAS3_DTVA1_GLVWA2_GLVWB2_GSU6_LBSPPB512_LPB4_LRVW2_NLCA1_NLCB1_PLR5_SVW2_TT2_16_VW2_WG16_4_4
    SolutionIndex: 28
    SolutionNameMin: Cijk_Ailk_Bljk_CB_UserArgs_MT16x16x64_MI16x16x4x1_SN_AMAS0_DTVA0_GLVWA2_GLVWB2_GSU1_GSUASB_LBSPPB512_LPB4_LRVW2_NLCA1_NLCB1_PLR5_SVW1_TT1_16_VW1_WG16_4_4
    SolutionIndex: 29
    SolutionNameMin: Cijk_Ailk_Bljk_CB_UserArgs_MT16x16x128_MI16x16x4x1_SN_AMAS0_DTVA0_GLVWA2_GLVWB2_GSU1_GSUASB_LBSPPB1024_LPB2_LRVW1_NLCA1_NLCB1_PLR9_SVW1_TT1_16_VW1_WG16_4_4
    SolutionIndex: 30
    SolutionNameMin: Cijk_Ailk_Bljk_CB_UserArgs_MT64x16x32_MI16x16x4x1_SN_AMAS3_DTVA1_GLVWA2_GLVWB2_GSU9_GSUAMB_LBSPPB256_LPB2_LRVW1_NLCA1_NLCB1_PLR5_SVW2_TT2_16_VW2_WG32_4_2
    SolutionIndex: 31
    SolutionNameMin: Cijk_Ailk_Bljk_CB_UserArgs_MT16x16x128_MI16x16x4x1_SN_AMAS0_DTVA0_GLVWA2_GLVWB2_GSU1_GSUASB_LBSPPB1024_LPB4_LRVW2_NLCA1_NLCB1_PLR9_SVW1_TT1_16_VW1_WG16_4_4
    SolutionIndex: 32
    SolutionNameMin: Cijk_Ailk_Bljk_CB_UserArgs_MT64x16x32_MI16x16x4x1_SN_AMAS3_DTVA1_GLVWA2_GLVWB1_GSU7_GSUAMB_LBSPPB256_LPB1_LRVW1_NLCA1_NLCB1_PLR1_SVW2_TT2_16_VW2_WG32_4_2
    SolutionIndex: 33
    SolutionNameMin: Cijk_Ailk_Bljk_CB_UserArgs_MT64x16x32_MI16x16x4x1_SN_AMAS3_DTVA1_GLVWA2_GLVWB1_GSU5_GSUAMB_LBSPPB256_LPB4_LRVW2_NLCA1_NLCB1_PLR5_SVW2_TT2_16_VW2_WG32_4_2
    SolutionIndex: 34
    SolutionNameMin: Cijk_Ailk_Bljk_CB_UserArgs_MT32x16x64_MI16x16x4x1_SN_AMAS3_DTVA1_GLVWB1_GSU1_GSUASB_LBSPPB512_LPB1_LRVW1_NLCA1_NLCB1_PLR5_SVW2_TT2_16_VW2_WG16_4_4
    SolutionIndex: 35
    SolutionNameMin: Cijk_Ailk_Bljk_CB_UserArgs_MT64x16x32_MI16x16x4x1_SN_AMAS3_DTVA1_GLVWB2_GSU4_GSUAMB_LBSPPB256_LPB2_LRVW1_NLCA1_NLCB1_PLR5_SVW2_TT2_16_VW2_WG32_4_2
    SolutionIndex: 36
    SolutionNameMin: Cijk_Ailk_Bljk_CB_UserArgs_MT32x16x64_MI16x16x4x1_SN_AMAS3_DTVA1_GLVWB2_GSU1_GSUASB_LBSPPB512_LPB2_LRVW1_NLCA1_NLCB1_PLR1_SVW2_TT2_16_VW2_WG16_4_4
    SolutionIndex: 37
    SolutionNameMin: Cijk_Ailk_Bljk_CB_UserArgs_MT32x16x64_MI16x16x4x1_SN_AMAS3_DTVA1_GLVWB1_GSU1_GSUASB_LBSPPB512_LPB1_LRVW1_NLCA1_NLCB1_PLR1_SVW2_TT2_16_VW2_WG16_4_4
    SolutionIndex: 38
    SolutionNameMin: Cijk_Ailk_Bljk_CB_UserArgs_MT64x16x32_MI16x16x4x1_SN_AMAS3_DTVA1_GLVWB1_GSU4_GSUAMB_LBSPPB256_LPB4_LRVW2_NLCA1_NLCB1_PLR5_SVW2_TT2_16_VW2_WG32_4_2
    SolutionIndex: 39
    SolutionNameMin: Cijk_Ailk_Bljk_CB_UserArgs_MT32x16x64_MI16x16x4x1_SN_AMAS3_DTVA1_GLVWB2_GSU1_GSUASB_LBSPPB512_LPB4_LRVW2_NLCA1_NLCB1_PLR5_SVW2_TT2_16_VW2_WG16_4_4
    SolutionIndex: 40
    SolutionNameMin: Cijk_Ailk_Bljk_CB_UserArgs_MT128x16x16_MI16x16x4x1_SN_AMAS3_DTVA1_GLVWB1_GSU7_GSUAMB_LBSPPB128_LPB1_LRVW1_NLCA1_NLCB1_PLR1_SVW2_TT2_16_VW2_WG64_4_1
    SolutionIndex: 41
    SolutionNameMin: Cijk_Ailk_Bljk_CB_UserArgs_MT32x16x64_MI16x16x4x1_SN_AMAS0_DTVA0_GLVWB2_GSU1_GSUASB_LBSPPB512_LPB4_LRVW2_NTA0_NLCA1_NLCB1_PLR9_SVW1_TT1_16_VW1_WG32_4_2
    SolutionIndex: 42
    SolutionNameMin: Cijk_Ailk_Bljk_CB_UserArgs_MT32x16x64_MI16x16x4x1_SN_AMAS0_DTVA0_GLVWB1_GSU1_GSUASB_LBSPPB512_LPB1_LRVW1_NTA0_NLCA1_NLCB1_PLR1_SVW1_TT1_16_VW1_WG32_4_2
    SolutionIndex: 43
    SolutionNameMin: Cijk_Ailk_Bljk_CB_UserArgs_MT256x16x16_MI16x16x4x1_SN_AMAS3_DTVA1_GLVWB1_GSU9_GSUAMB_LBSPPB128_LPB1_LRVW1_NTA4_NLCA2_NLCB1_PLR5_SVW2_TT4_16_VW2_WG64_4_1
    SolutionIndex: 44
    SolutionNameMin: Cijk_Ailk_Bljk_CB_UserArgs_MT64x16x32_MI16x16x4x1_SN_AMAS0_DTVA0_GLVWB2_GSU1_GSUASB_LBSPPB256_LPB4_LRVW2_NTA0_NLCA1_NLCB1_PLR9_SVW1_TT1_16_VW1_WG64_4_1
    SolutionIndex: 45
    SolutionNameMin: Cijk_Ailk_Bljk_CB_UserArgs_MT64x16x128_MI16x16x4x1_SN_AMAS3_DTVA1_GLVWB2_GSU1_GSUASB_LBSPPB1024_LPB4_LRVW2_NTA0_NLCA2_NLCB1_PLR9_SVW2_TT4_16_VW2_WG16_4_4
    SolutionIndex: 46
    SolutionNameMin: Cijk_Ailk_Bljk_CB_UserArgs_MT256x16x16_MI16x16x4x1_SN_AMAS3_DTVA1_GLVWB1_GSU7_GSUAMB_LBSPPB128_LPB1_LRVW1_NTA4_NLCA2_NLCB1_PLR5_SVW2_TT4_16_VW2_WG64_4_1
    SolutionIndex: 47
    SolutionNameMin: Cijk_Ailk_Bljk_CB_UserArgs_MT64x16x32_MI16x16x4x1_SN_AMAS3_DTVA1_GLVWB2_GSU1_GSUASB_LBSPPB256_LPB2_LRVW1_NTA0_NLCA1_NLCB1_PLR1_SVW2_TT2_16_VW2_WG32_4_2
    SolutionIndex: 48
    SolutionNameMin: Cijk_Ailk_Bljk_CB_UserArgs_MT64x16x16_MI16x16x4x1_SN_AMAS3_DTVA1_GLVWB1_GSU1_GSUASB_LBSPPB128_LPB1_LRVW1_NTA4_NLCA1_NLCB1_PLR1_SVW2_TT2_16_VW2_WG32_4_2
    SolutionIndex: 49
    SolutionNameMin: Cijk_Ailk_Bljk_CB_UserArgs_MT64x16x32_MI16x16x4x1_SN_AMAS0_DTVA0_GLVWB1_GSU1_GSUASB_LBSPPB256_LPB4_LRVW2_NTA4_NLCA1_NLCB1_PLR5_SVW1_TT2_16_VW1_WG32_4_2
    SolutionIndex: 50
    SolutionNameMin: Cijk_Ailk_Bljk_CB_UserArgs_MT32x16x16_MI16x16x4x1_SN_AMAS0_DTVA0_GLVWB1_GSU1_GSUASB_LBSPPB128_LPB1_LRVW1_NTA0_NLCA1_NLCB1_PLR3_SVW1_TT1_16_VW1_WG32_4_2
    SolutionIndex: 51
    SolutionNameMin: Cijk_Ailk_Bljk_CB_UserArgs_MT128x16x16_MI16x16x4x1_SN_AMAS3_DTVA1_GLVWB1_GSU5_GSUAMB_LBSPPB128_LPB1_LRVW1_NTA4_NLCA1_NLCB1_PLR1_SVW2_TT2_16_VW2_WG64_4_1
    SolutionIndex: 52
    SolutionNameMin: Cijk_Ailk_Bljk_CB_UserArgs_MT384x16x16_MI16x16x4x1_SN_AMAS3_DTVA1_GLVWB1_GSU5_GSUAMB_LBSPPB128_LPB4_LRVW2_NTA4_NLCA3_NLCB1_PLR5_SVW2_TT6_16_VW2_WG64_4_1
    SolutionIndex: 53
    SolutionNameMin: Cijk_Ailk_Bljk_CB_UserArgs_MT16x16x64_MI16x16x4x1_SN_1LDSB0_DTVA1_GLVWB2_GSU1_GSUASB_LBSPPB512_LPB2_LRVW1_NLCB1_PLR5_TT1_16_WG16_4_4
    SolutionIndex: 54
    SolutionNameMin: Cijk_Ailk_Bljk_CB_UserArgs_MT16x16x128_MI16x16x4x1_SN_1LDSB0_DTVA1_GLVWB2_GSU9_GSUAMB_LBSPPB1024_LPB4_LRVW2_NLCB1_PLR9_TT1_16_WG16_4_4
    SolutionIndex: 55
    SolutionNameMin: Cijk_Ailk_Bljk_CB_UserArgs_MT16x16x128_MI16x16x4x1_SN_1LDSB0_DTVA1_GLVWB2_GSU8_GSUAMB_LBSPPB1024_LPB2_LRVW1_NLCB1_PLR9_TT1_16_WG16_4_4
    SolutionIndex: 56
    SolutionNameMin: Cijk_Ailk_Bljk_CB_UserArgs_MT16x16x128_MI16x16x4x1_SN_1LDSB1_DTVA0_GLVWA2_GLVWB2_GSU1_GSUASB_LBSPPB1024_LPB4_LRVW2_NLCB1_PLR9_TT1_16_WG16_4_4
    SolutionIndex: 57
    SolutionNameMin: Cijk_Ailk_Bljk_CB_UserArgs_MT16x16x128_MI16x16x4x1_SN_1LDSB1_DTVA0_GLVWA2_GLVWB2_GSU12_GSUAMB_LBSPPB1024_LPB4_LRVW2_NLCB1_PLR9_TT1_16_WG16_4_4
    SolutionIndex: 58
    SolutionNameMin: Cijk_Ailk_Bljk_CB_UserArgs_MT16x16x128_MI16x16x4x1_SN_1LDSB0_AMAS0_DTVA0_GLVWA2_GLVWB1_GSU1_GSUASB_LBSPPB0_LPB0_LRVW2_NLCB1_PLR9_SVW1_TT1_16_VW1_WG16_4_4
    SolutionIndex: 59
    SolutionNameMin: Cijk_Ailk_Bljk_CB_UserArgs_MT16x16x64_MI16x16x4x1_SN_1LDSB1_AMAS0_DTVA0_GLVWA2_GLVWB1_GSU11_GSUAMB_LBSPPB512_LPB4_LRVW2_NLCB1_PLR5_SVW1_TT1_16_VW1_WG16_4_4
    SolutionIndex: 60
    SolutionNameMin: Cijk_Ailk_Bljk_CB_UserArgs_MT16x16x128_MI16x16x4x1_SN_1LDSB1_AMAS0_DTVA0_GLVWA2_GLVWB2_GSU16_GSUAMB_LBSPPB1024_LPB2_LRVW1_NLCB1_PLR9_SVW1_TT1_16_VW1_WG16_4_4
    SolutionIndex: 61
    SolutionNameMin: Cijk_Ailk_Bljk_CB_UserArgs_MT16x16x128_MI16x16x4x1_SN_1LDSB1_AMAS0_DTVA0_GLVWA2_GLVWB2_GSU1_GSUASB_LBSPPB1024_LPB4_LRVW2_NLCA1_NLCB1_PLR9_SVW1_TT1_16_VW1_WG16_4_4
    SolutionIndex: 62
    SolutionNameMin: Cijk_Ailk_Bljk_CB_UserArgs_MT32x16x64_MI16x16x4x1_SN_1LDSB0_AMAS3_DTVA1_GLVWA2_GLVWB1_GSU13_GSUAMB_LBSPPB512_LPB4_LRVW2_NLCA1_NLCB1_PLR5_SVW2_TT2_16_VW2_WG16_4_4
    SolutionIndex: 63
    SolutionNameMin: Cijk_Ailk_Bljk_CB_UserArgs_MT32x16x64_MI16x16x4x1_SN_1LDSB1_AMAS3_DTVA1_GLVWA2_GLVWB1_GSU16_GSUAMB_LBSPPB512_LPB4_LRVW2_NLCA1_NLCB1_PLR5_SVW2_TT2_16_VW2_WG16_4_4
    SolutionIndex: 64
    SolutionNameMin: Cijk_Ailk_Bljk_CB_UserArgs_MT16x16x128_MI16x16x4x1_SN_1LDSB0_AMAS0_DTVA0_GLVWA2_GLVWB2_GSU3_LBSPPB0_LPB0_LRVW1_NLCA1_NLCB1_PLR1_SVW1_TT1_16_VW1_WG16_4_4
    SolutionIndex: 65
    SolutionNameMin: Cijk_Ailk_Bljk_CB_UserArgs_MT32x16x64_MI16x16x4x1_SN_1LDSB0_AMAS0_DTVA0_GLVWA2_GLVWB2_GSU12_LBSPPB512_LPB4_LRVW2_NLCA1_NLCB1_PLR9_SVW1_TT1_16_VW1_WG32_4_2
    SolutionIndex: 66
    SolutionNameMin: Cijk_Ailk_Bljk_CB_UserArgs_MT16x32x64_MI16x16x4x1_SN_1LDSB1_AMAS0_DTVA0_GLVWA2_GLVWB2_GSU4_LBSPPB512_LPB4_LRVW2_NLCA1_NLCB1_PLR5_SVW1_TT1_32_VW1_WG16_4_4
    SolutionIndex: 67
    SolutionNameMin: Cijk_Ailk_Bljk_CB_UserArgs_MT32x16x64_MI16x16x4x1_SN_1LDSB1_AMAS0_DTVA0_GLVWA2_GLVWB2_GSU5_LBSPPB512_LPB4_LRVW2_NLCA1_NLCB1_PLR9_SVW1_TT1_16_VW1_WG32_4_2
    SolutionIndex: 68
    SolutionNameMin: Cijk_Ailk_Bljk_CB_UserArgs_MT64x16x32_MI16x16x4x1_SN_1LDSB0_AMAS3_DTVA1_GLVWA2_GLVWB2_GSU12_LBSPPB256_LPB4_LRVW2_NLCA1_NLCB1_PLR5_SVW2_TT2_16_VW2_WG32_4_2
    SolutionIndex: 69
    SolutionNameMin: Cijk_Ailk_Bljk_CB_UserArgs_MT16x16x128_MI16x16x4x1_SN_AMAS0_DTVA0_GLVWA2_GLVWB2_GSU1_GSUASB_LBSPPB1024_LPB4_LRVW2_NLCA1_NLCB1_PLR9_SVW1_TT1_16_VW1_WG16_4_4
    SolutionIndex: 70
    SolutionNameMin: Cijk_Ailk_Bljk_CB_UserArgs_MT32x32x32_MI16x16x4x1_SN_AMAS0_DTVA0_GLVWA2_GLVWB1_GSU10_GSUAMB_LBSPPB256_LPB1_LRVW1_NLCA1_NLCB1_PLR9_SVW1_TT1_16_VW1_WG32_8_1
    SolutionIndex: 71
    SolutionNameMin: Cijk_Ailk_Bljk_CB_UserArgs_MT64x32x32_MI16x16x4x1_SN_AMAS3_DTVA1_GLVWA2_GLVWB1_GSU14_GSUAMB_LBSPPB256_LPB4_LRVW2_NLCA1_NLCB1_PLR5_SVW2_TT2_32_VW2_WG32_4_2
    SolutionIndex: 72
    SolutionNameMin: Cijk_Ailk_Bljk_CB_UserArgs_MT16x32x64_MI16x16x4x1_SN_AMAS0_DTVA0_GLVWA2_GLVWB2_GSU1_GSUASB_LBSPPB512_LPB4_LRVW2_NLCA1_NLCB1_PLR9_SVW1_TT1_16_VW1_WG16_8_2
    SolutionIndex: 73
    SolutionNameMin: Cijk_Ailk_Bljk_CB_UserArgs_MT16x32x64_MI16x16x4x1_SN_AMAS0_DTVA0_GLVWA2_GLVWB2_GSU3_GSUAMB_LBSPPB512_LPB2_LRVW1_NLCA1_NLCB1_PLR9_SVW1_TT1_16_VW1_WG16_8_2
    SolutionIndex: 74
    SolutionNameMin: Cijk_Ailk_Bljk_CB_UserArgs_MT64x16x64_MI16x16x4x1_SN_AMAS0_DTVA0_GLVWA2_GLVWB1_GSU7_GSUAMB_LBSPPB512_LPB1_LRVW1_NLCA1_NLCB1_PLR17_SVW1_TT1_16_VW1_WG64_4_1
    SolutionIndex: 75
    SolutionNameMin: Cijk_Ailk_Bljk_CB_UserArgs_MT32x16x64_MI16x16x4x1_SN_AMAS0_DTVA0_GLVWA2_GLVWB1_GSU1_GSUASB_LBSPPB512_LPB1_LRVW1_NLCA1_NLCB1_PLR9_SVW1_TT1_16_VW1_WG32_4_2
    SolutionIndex: 76
    SolutionNameMin: Cijk_Ailk_Bljk_CB_UserArgs_MT64x32x16_MI16x16x4x1_SN_AMAS0_DTVA0_GLVWA2_GLVWB1_GSU10_GSUAMB_LBSPPB128_LPB1_LRVW1_NLCA1_NLCB1_PLR5_SVW1_TT1_32_VW1_WG64_4_1
    SolutionIndex: 77
    SolutionNameMin: Cijk_Ailk_Bljk_CB_UserArgs_MT64x32x16_MI16x16x4x1_SN_AMAS3_DTVA0_GLVWA2_GLVWB2_GSU14_GSUAMB_LBSPPB128_LPB2_LRVW1_NLCA1_NLCB1_PLR5_SVW2_TT2_16_VW2_WG32_8_1
    SolutionIndex: 78
    SolutionNameMin: Cijk_Ailk_Bljk_CB_UserArgs_MT16x16x64_MI16x16x4x1_SN_AMAS0_DTVA0_GLVWA2_GLVWB2_GSU1_GSUASB_LBSPPB512_LPB2_LRVW1_NLCA1_NLCB1_PLR9_SVW1_TT1_16_VW1_WG16_4_2
    SolutionIndex: 79
    SolutionNameMin: Cijk_Ailk_Bljk_CB_UserArgs_MT32x16x128_MI16x16x4x1_SN_AMAS0_DTVA0_GLVWA2_GLVWB2_GSU1_GSUASB_LBSPPB1024_LPB4_LRVW2_NLCA1_NLCB1_PLR9_SVW1_TT2_16_VW1_WG16_4_4
    SolutionIndex: 80
    SolutionNameMin: Cijk_Ailk_Bljk_CB_UserArgs_MT64x16x32_MI16x16x4x1_SN_AMAS3_DTVA1_GLVWA2_GLVWB2_GSU4_GSUAMB_LBSPPB256_LPB2_LRVW1_NLCA1_NLCB1_PLR5_SVW2_TT2_16_VW2_WG32_4_2
    SolutionIndex: 81
    SolutionNameMin: Cijk_Ailk_Bljk_CB_UserArgs_MT16x32x32_MI16x16x4x1_SN_AMAS0_DTVA0_GLVWA2_GLVWB2_GSU1_GSUASB_LBSPPB256_LPB2_LRVW1_NLCA1_NLCB1_PLR5_SVW1_TT1_16_VW1_WG16_8_2
    SolutionIndex: 82
    SolutionNameMin: Cijk_Ailk_Bljk_CB_UserArgs_MT128x32x16_MI16x16x4x1_SN_AMAS3_DTVA1_GLVWA2_GLVWB1_GSU14_GSUAMB_LBSPPB128_LPB1_LRVW1_NLCA1_NLCB1_PLR1_SVW2_TT2_32_VW2_WG64_4_1
    SolutionIndex: 83
    SolutionNameMin: Cijk_Ailk_Bljk_CB_UserArgs_MT32x16x64_MI16x16x4x1_SN_AMAS0_DTVA0_GLVWA2_GLVWB2_GSU1_GSUASB_LBSPPB512_LPB2_LRVW1_NLCA1_NLCB1_PLR1_SVW1_TT1_16_VW1_WG32_4_2
    SolutionIndex: 84
    SolutionNameMin: Cijk_Ailk_Bljk_CB_UserArgs_MT32x32x64_MI16x16x4x1_SN_AMAS3_DTVA1_GLVWA2_GLVWB2_GSU1_GSUASB_LBSPPB512_LPB2_LRVW1_NLCA1_NLCB1_PLR1_SVW2_TT2_32_VW2_WG16_4_4
    SolutionIndex: 85
    SolutionNameMin: Cijk_Ailk_Bljk_CB_UserArgs_MT128x32x16_MI16x16x4x1_SN_AMAS3_DTVA1_GLVWA2_GLVWB2_GSU9_GSUAMB_LBSPPB128_LPB4_LRVW2_NLCA1_NLCB1_PLR5_SVW2_TT2_32_VW2_WG64_4_1
    SolutionIndex: 86
    SolutionNameMin: Cijk_Ailk_Bljk_CB_UserArgs_MT32x32x32_MI16x16x4x1_SN_AMAS0_DTVA0_GLVWA2_GLVWB1_GSU1_GSUASB_LBSPPB256_LPB4_LRVW2_NLCA1_NLCB1_PLR5_SVW1_TT1_32_VW1_WG32_4_2
    SolutionIndex: 87
    SolutionNameMin: Cijk_Ailk_Bljk_CB_UserArgs_MT32x32x64_MI16x16x4x1_SN_AMAS3_DTVA1_GLVWA2_GLVWB2_GSU1_GSUASB_LBSPPB512_LPB4_LRVW2_NLCA1_NLCB1_PLR5_SVW2_TT2_32_VW2_WG16_4_4
    SolutionIndex: 88
    SolutionNameMin: Cijk_Ailk_Bljk_CB_UserArgs_MT64x32x16_MI16x16x4x1_SN_AMAS0_DTVA0_GLVWA2_GLVWB2_GSU7_GSUAMB_LBSPPB128_LPB4_LRVW2_NLCA1_NLCB1_PLR5_SVW1_TT1_32_VW1_WG64_4_1
    SolutionIndex: 89
    SolutionNameMin: Cijk_Ailk_Bljk_CB_UserArgs_MT32x32x32_MI16x16x4x1_SN_AMAS0_DTVA0_GLVWB2_GSU1_GSUASB_LBSPPB256_LPB4_LRVW2_MIAV1_NTA0_NLCA1_PLR9_SVW1_TT1_16_VW1_WG32_8_1
    SolutionIndex: 90
    SolutionNameMin: Cijk_Ailk_Bljk_CB_UserArgs_MT32x32x64_MI16x16x4x1_SN_AMAS0_DTVA0_GLVWB2_GSU1_GSUASB_LBSPPB512_LPB2_LRVW1_MIAV1_NTA0_NLCA1_PLR1_SVW1_TT2_16_VW1_WG16_8_2
    SolutionIndex: 91
    SolutionNameMin: Cijk_Ailk_Bljk_CB_UserArgs_MT192x32x32_MI16x16x4x1_SN_AMAS0_DTVA0_GLVWB1_GSU7_GSUAMB_LBSPPB256_LPB1_LRVW1_MIAV1_NTA0_NLCA3_PLR9_SVW1_TT3_32_VW1_WG64_4_1
    SolutionIndex: 92
    SolutionNameMin: Cijk_Ailk_Bljk_CB_UserArgs_MT64x32x32_MI16x16x4x1_SN_AMAS3_DTVA1_GLVWB2_GSU1_GSUASB_LBSPPB256_LPB2_LRVW1_MIAV1_NTA0_NLCA1_PLR5_SVW2_TT2_32_VW2_WG32_4_2
    SolutionIndex: 93
    SolutionNameMin: Cijk_Ailk_Bljk_CB_UserArgs_MT64x32x32_MI16x16x4x1_SN_AMAS3_DTVA1_GLVWB2_GSU1_GSUASB_LBSPPB256_LPB2_LRVW1_MIAV1_NTA0_NLCA1_PLR1_SVW2_TT2_32_VW2_WG32_4_2
    SolutionIndex: 94
    SolutionNameMin: Cijk_Ailk_Bljk_CB_UserArgs_MT256x32x16_MI16x16x4x1_SN_AMAS3_DTVA1_GLVWB1_GSU7_GSUAMB_LBSPPB128_LPB1_LRVW1_MIAV1_NTA4_NLCA2_PLR1_SVW2_TT4_32_VW2_WG64_4_1
    SolutionIndex: 95
    SolutionNameMin: Cijk_Ailk_Bljk_CB_UserArgs_MT64x32x16_MI16x16x4x1_SN_AMAS0_DTVA0_GLVWB1_GSU1_GSUASB_LBSPPB128_LPB1_LRVW1_MIAV1_NTA0_NLCA1_PLR5_SVW1_TT1_32_VW1_WG64_4_1
    SolutionIndex: 96
    SolutionNameMin: Cijk_Ailk_Bljk_CB_UserArgs_MT64x32x32_MI16x16x4x1_SN_AMAS3_DTVA1_GLVWB2_GSU1_GSUASB_LBSPPB256_LPB4_LRVW2_MIAV1_NTA4_NLCA1_PLR5_SVW2_TT2_32_VW2_WG32_4_2
    SolutionIndex: 97
    SolutionNameMin: Cijk_Ailk_Bljk_CB_UserArgs_MT384x32x16_MI16x16x4x1_SN_AMAS3_DTVA1_GLVWB2_GSU7_GSUAMB_LBSPPB128_LPB2_LRVW1_MIAV0_NTA4_NLCA3_PLR5_SVW2_TT6_32_VW2_WG64_4_1
    SolutionIndex: 98
    SolutionNameMin: Cijk_Ailk_Bljk_CB_UserArgs_MT128x32x32_MI16x16x4x1_SN_AMAS3_DTVA1_GLVWB1_GSU1_GSUASB_LBSPPB256_LPB1_LRVW1_MIAV1_NTA0_NLCA2_PLR1_SVW2_TT4_32_VW2_WG32_4_2
    SolutionIndex: 99
    SolutionNameMin: Cijk_Ailk_Bljk_CB_UserArgs_MT128x32x16_MI16x16x4x1_SN_AMAS0_DTVA0_GLVWB1_GSU5_GSUAMB_LBSPPB128_LPB4_LRVW2_MIAV1_NTA4_NLCA1_PLR5_SVW1_TT2_32_VW1_WG64_4_1
    SolutionIndex: 100
    SolutionNameMin: Cijk_Ailk_Bljk_CB_UserArgs_MT256x32x16_MI16x16x4x1_SN_AMAS3_DTVA1_GLVWB1_GSU7_GSUAMB_LBSPPB128_LPB1_LRVW1_MIAV1_NTA4_NLCA2_PLR5_SVW2_TT4_32_VW2_WG64_4_1
    SolutionIndex: 101
    SolutionNameMin: Cijk_Ailk_Bljk_CB_UserArgs_MT16x16x128_MI16x16x4x1_SN_1LDSB0_DTVA1_GLVWB2_GSU1_GSUASB_LBSPPB1024_LPB2_LRVW1_NLCB1_PLR1_TT1_16_WG16_4_4
    SolutionIndex: 102
    SolutionNameMin: Cijk_Ailk_Bljk_CB_UserArgs_MT16x16x128_MI16x16x4x1_SN_1LDSB1_DTVA1_GLVWB2_GSU8_GSUAMB_LBSPPB1024_LPB2_LRVW1_NLCB1_PLR1_TT1_16_WG16_4_4
    SolutionIndex: 103
    SolutionNameMin: Cijk_Ailk_Bljk_CB_UserArgs_MT16x16x128_MI16x16x4x1_SN_1LDSB1_DTVA1_GLVWB2_GSU16_GSUAMB_LBSPPB1024_LPB4_LRVW2_NLCB1_PLR9_TT1_16_WG16_4_4
    SolutionIndex: 104
    SolutionNameMin: Cijk_Ailk_Bljk_CB_UserArgs_MT16x16x128_MI16x16x4x1_SN_1LDSB1_DTVA0_GLVWA2_GLVWB2_GSU1_GSUASB_LBSPPB1024_LPB4_LRVW2_NLCB1_PLR9_TT1_16_WG16_4_4
    SolutionIndex: 105
    SolutionNameMin: Cijk_Ailk_Bljk_CB_UserArgs_MT16x16x128_MI16x16x4x1_SN_1LDSB0_DTVA0_GLVWA2_GLVWB2_GSU11_GSUAMB_LBSPPB0_LPB0_LRVW2_NLCB1_PLR9_TT1_16_WG16_4_4
    SolutionIndex: 106
    SolutionNameMin: Cijk_Ailk_Bljk_CB_UserArgs_MT16x16x128_MI16x16x4x1_SN_1LDSB1_DTVA0_GLVWA2_GLVWB1_GSU14_GSUAMB_LBSPPB1024_LPB4_LRVW2_NLCB1_PLR9_TT1_16_WG16_4_4
    SolutionIndex: 107
    SolutionNameMin: Cijk_Ailk_Bljk_CB_UserArgs_MT16x16x128_MI16x16x4x1_SN_1LDSB1_AMAS0_DTVA0_GLVWA2_GLVWB2_GSU1_GSUASB_LBSPPB1024_LPB4_LRVW2_NLCB1_PLR9_SVW1_TT1_16_VW1_WG16_4_4
    SolutionIndex: 108
    SolutionNameMin: Cijk_Ailk_Bljk_CB_UserArgs_MT16x16x128_MI16x16x4x1_SN_1LDSB1_AMAS0_DTVA0_GLVWA2_GLVWB2_GSU7_GSUAMB_LBSPPB1024_LPB2_LRVW1_NLCB1_PLR9_SVW1_TT1_16_VW1_WG16_4_4
    SolutionIndex: 109
    SolutionNameMin: Cijk_Ailk_Bljk_CB_UserArgs_MT16x16x128_MI16x16x4x1_SN_1LDSB1_AMAS0_DTVA0_GLVWA2_GLVWB2_GSU13_GSUAMB_LBSPPB1024_LPB4_LRVW2_NLCB1_PLR9_SVW1_TT1_16_VW1_WG16_4_4
    SolutionIndex: 110
    SolutionNameMin: Cijk_Ailk_Bljk_CB_UserArgs_MT16x16x256_MI16x16x4x1_SN_1LDSB1_AMAS0_DTVA0_GLVWA2_GLVWB2_GSU4_LBSPPB0_LPB0_LRVW2_NLCA1_NLCB1_PLR17_SVW1_TT1_16_VW1_WG16_4_4
    SolutionIndex: 111
    SolutionNameMin: Cijk_Ailk_Bljk_CB_UserArgs_MT16x32x64_MI16x16x4x1_SN_1LDSB0_AMAS0_DTVA0_GLVWA2_GLVWB2_GSU10_LBSPPB512_LPB2_LRVW1_NLCA1_NLCB1_PLR9_SVW1_TT1_16_VW1_WG16_8_2
    SolutionIndex: 112
    SolutionNameMin: Cijk_Ailk_Bljk_CB_UserArgs_MT32x16x64_MI16x16x4x1_SN_1LDSB0_AMAS0_DTVA0_GLVWA2_GLVWB2_GSU13_LBSPPB512_LPB2_LRVW1_NLCA1_NLCB1_PLR1_SVW1_TT1_16_VW1_WG32_4_2
    SolutionIndex: 113
    SolutionNameMin: Cijk_Ailk_Bljk_CB_UserArgs_MT16x16x64_MI16x16x4x1_SN_1LDSB1_AMAS0_DTVA0_GLVWA2_GLVWB2_GSU2_LBSPPB512_LPB2_LRVW1_NLCA1_NLCB1_PLR5_SVW1_TT1_16_VW1_WG16_4_4
    SolutionIndex: 114
    SolutionNameMin: Cijk_Ailk_Bljk_CB_UserArgs_MT64x16x32_MI16x16x4x1_SN_1LDSB0_AMAS3_DTVA1_GLVWA2_GLVWB2_GSU11_LBSPPB256_LPB2_LRVW1_NLCA1_NLCB1_PLR5_SVW2_TT2_16_VW2_WG32_4_2
    SolutionIndex: 115
    SolutionNameMin: Cijk_Ailk_Bljk_CB_UserArgs_MT64x16x64_MI16x16x4x1_SN_1LDSB1_AMAS0_DTVA0_GLVWA2_GLVWB1_GSU12_LBSPPB512_LPB4_LRVW2_NLCA1_NLCB1_PLR9_SVW1_TT2_16_VW1_WG32_4_2
    SolutionIndex: 116
    SolutionNameMin: Cijk_Ailk_Bljk_CB_UserArgs_MT16x16x128_MI16x16x4x1_SN_1LDSB1_AMAS0_DTVA0_GLVWA2_GLVWB2_GSU1_GSUASB_LBSPPB1024_LPB4_LRVW2_NLCA1_NLCB1_PLR9_SVW1_TT1_16_VW1_WG16_4_4
    SolutionIndex: 117
    SolutionNameMin: Cijk_Ailk_Bljk_CB_UserArgs_MT16x16x128_MI16x16x4x1_SN_1LDSB0_AMAS0_DTVA0_GLVWA2_GLVWB2_GSU1_GSUASB_LBSPPB0_LPB0_LRVW2_NLCA1_NLCB1_PLR9_SVW1_TT1_16_VW1_WG16_4_4
    SolutionIndex: 118
    SolutionNameMin: Cijk_Ailk_Bljk_CB_UserArgs_MT64x16x32_MI16x16x4x1_SN_1LDSB0_AMAS0_DTVA0_GLVWA2_GLVWB2_GSU12_GSUAMB_LBSPPB256_LPB2_LRVW1_NLCA1_NLCB1_PLR1_SVW1_TT1_16_VW1_WG64_4_1
    SolutionIndex: 119
    SolutionNameMin: Cijk_Ailk_Bljk_CB_UserArgs_MT16x16x64_MI16x16x4x1_SN_AMAS0_DTVA0_GLVWA2_GLVWB1_GSU1_GSUASB_LBSPPB512_LPB4_LRVW2_NLCA1_NLCB1_PLR9_SVW1_TT1_16_VW1_WG16_4_2
    SolutionIndex: 120
    SolutionNameMin: Cijk_Ailk_Bljk_CB_UserArgs_MT32x64x32_MI16x16x4x1_SN_AMAS0_DTVA0_GLVWA2_GLVWB1_GSU8_GSUAMB_LBSPPB256_LPB1_LRVW1_NLCA1_NLCB1_PLR5_SVW1_TT1_64_VW1_WG32_4_2
    SolutionIndex: 121
    SolutionNameMin: Cijk_Ailk_Bljk_CB_UserArgs_MT32x64x16_MI16x16x4x1_SN_AMAS0_DTVA0_GLVWA2_GLVWB1_GSU10_GSUAMB_LBSPPB128_LPB4_LRVW2_NLCA1_NLCB1_PLR5_SVW1_TT1_32_VW1_WG32_8_1
    SolutionIndex: 122
    SolutionNameMin: Cijk_Ailk_Bljk_CB_UserArgs_MT32x16x64_MI16x16x4x1_SN_AMAS3_DTVA1_GLVWA2_GLVWB2_GSU1_GSUASB_LBSPPB512_LPB4_LRVW2_NLCA1_NLCB1_PLR5_SVW2_TT2_16_VW2_WG16_4_4
    SolutionIndex: 123
    SolutionNameMin: Cijk_Ailk_Bljk_CB_UserArgs_MT32x16x64_MI16x16x4x1_SN_AMAS3_DTVA1_GLVWA2_GLVWB1_GSU1_GSUASB_LBSPPB512_LPB4_LRVW2_NLCA1_NLCB1_PLR5_SVW2_TT2_16_VW2_WG16_4_4
    SolutionIndex: 124
    SolutionNameMin: Cijk_Ailk_Bljk_CB_UserArgs_MT64x64x16_MI16x16x4x1_SN_AMAS0_DTVA0_GLVWA2_GLVWB2_GSU14_GSUAMB_LBSPPB128_LPB4_LRVW2_NLCA1_NLCB1_PLR5_SVW1_TT2_32_VW1_WG32_8_1
    SolutionIndex: 125
    SolutionNameMin: Cijk_Ailk_Bljk_CB_UserArgs_MT32x16x128_MI16x16x4x1_SN_AMAS3_DTVA1_GLVWA2_GLVWB2_GSU1_GSUASB_LBSPPB1024_LPB4_LRVW2_NLCA1_NLCB1_PLR9_SVW2_TT2_16_VW2_WG16_4_4
    SolutionIndex: 126
    SolutionNameMin: Cijk_Ailk_Bljk_CB_UserArgs_MT64x64x16_MI16x16x4x1_SN_AMAS0_DTVA0_GLVWA2_GLVWB1_GSU14_GSUAMB_LBSPPB128_LPB1_LRVW1_NLCA1_NLCB1_PLR1_SVW1_TT2_32_VW1_WG32_8_1
    SolutionIndex: 127
    SolutionNameMin: Cijk_Ailk_Bljk_CB_UserArgs_MT64x64x32_MI16x16x4x1_SN_AMAS3_DTVA0_GLVWA2_GLVWB1_GSU14_GSUAMB_LBSPPB256_LPB4_LRVW2_NLCA1_NLCB1_PLR9_SVW2_TT2_32_VW2_WG32_8_1
    SolutionIndex: 128
    SolutionNameMin: Cijk_Ailk_Bljk_CB_UserArgs_MT32x32x64_MI16x16x4x1_SN_AMAS3_DTVA1_GLVWA2_GLVWB2_GSU1_GSUASB_LBSPPB512_LPB2_LRVW1_NLCA1_NLCB1_PLR1_SVW2_TT2_32_VW2_WG16_4_4
    SolutionIndex: 129
    SolutionNameMin: Cijk_Ailk_Bljk_CB_UserArgs_MT128x32x16_MI16x16x4x1_SN_AMAS0_DTVA0_GLVWA2_GLVWB1_GSU9_GSUAMB_LBSPPB128_LPB1_LRVW1_NLCA1_NLCB1_PLR1_SVW1_TT4_32_VW1_WG32_4_2
    SolutionIndex: 130
    SolutionNameMin: Cijk_Ailk_Bljk_CB_UserArgs_MT64x64x16_MI16x16x4x1_SN_AMAS3_DTVA1_GLVWA2_GLVWB2_GSU9_GSUAMB_LBSPPB128_LPB2_LRVW1_NLCA1_NLCB1_PLR1_SVW2_TT2_64_VW2_WG32_4_2
    SolutionIndex: 131
    SolutionNameMin: Cijk_Ailk_Bljk_CB_UserArgs_MT32x32x32_MI16x16x4x1_SN_AMAS0_DTVA0_GLVWA2_GLVWB2_GSU1_GSUASB_LBSPPB256_LPB4_LRVW2_MIAV1_NLCA1_PLR5_SVW1_TT1_32_VW1_WG32_4_2
    SolutionIndex: 132
    SolutionNameMin: Cijk_Ailk_Bljk_CB_UserArgs_MT16x64x64_MI16x16x4x1_SN_AMAS0_DTVA0_GLVWA2_GLVWB2_GSU1_GSUASB_LBSPPB512_LPB4_LRVW2_MIAV1_NLCA1_PLR9_SVW1_TT1_32_VW1_WG16_8_2
    SolutionIndex: 133
    SolutionNameMin: Cijk_Ailk_Bljk_CB_UserArgs_MT64x64x16_MI16x16x4x1_SN_AMAS0_DTVA0_GLVWA2_GLVWB2_GSU7_GSUAMB_LBSPPB128_LPB2_LRVW1_MIAV1_NLCA1_PLR1_SVW1_TT2_32_VW1_WG32_8_1
    SolutionIndex: 134
    SolutionNameMin: Cijk_Ailk_Bljk_CB_UserArgs_MT64x16x32_MI16x16x4x1_SN_AMAS3_DTVA1_GLVWA2_GLVWB1_GSU1_GSUASB_LBSPPB256_LPB1_LRVW1_MIAV1_NLCA1_PLR1_SVW2_TT2_16_VW2_WG32_4_2
    SolutionIndex: 135
    SolutionNameMin: Cijk_Ailk_Bljk_CB_UserArgs_MT32x32x64_MI16x16x4x1_SN_AMAS0_DTVA0_GLVWA2_GLVWB2_GSU1_GSUASB_LBSPPB512_LPB4_LRVW2_MIAV1_NLCA1_PLR17_SVW1_TT1_16_VW1_WG32_8_1
    SolutionIndex: 136
    SolutionNameMin: Cijk_Ailk_Bljk_CB_UserArgs_MT96x64x16_MI16x16x4x1_SN_AMAS0_DTVA0_GLVWA2_GLVWB1_GSU7_GSUAMB_LBSPPB128_LPB1_LRVW1_MIAV1_NLCA3_PLR5_SVW1_TT3_32_VW1_WG32_8_1
    SolutionIndex: 137
    SolutionNameMin: Cijk_Ailk_Bljk_CB_UserArgs_MT32x64x64_MI16x16x4x1_SN_AMAS3_DTVA1_GLVWA2_GLVWB1_GSU1_GSUASB_LBSPPB512_LPB4_LRVW2_MIAV1_NLCA1_PLR5_SVW2_TT2_64_VW2_WG16_4_4
    SolutionIndex: 138
    SolutionNameMin: Cijk_Ailk_Bljk_CB_UserArgs_MT64x64x16_MI16x16x4x1_SN_AMAS0_DTVA0_GLVWA2_GLVWB2_GSU7_GSUAMB_LBSPPB128_LPB2_LRVW1_MIAV1_NLCA1_PLR5_SVW1_TT2_32_VW1_WG32_8_1
    SolutionIndex: 139
    SolutionNameMin: Cijk_Ailk_Bljk_CB_UserArgs_MT128x64x32_MI16x16x4x1_SN_AMAS0_DTVA0_GLVWA2_GLVWB1_GSU7_GSUAMB_LBSPPB256_LPB1_LRVW1_MIAV1_NLCA1_PLR9_SVW1_TT2_64_VW1_WG64_4_1
    SolutionIndex: 140
    SolutionNameMin: Cijk_Ailk_Bljk_CB_UserArgs_MT32x64x32_MI16x16x4x1_SN_AMAS0_DTVA0_GLVWA2_GLVWB2_GSU1_GSUASB_LBSPPB256_LPB4_LRVW2_MIAV1_NTA0_NLCA1_PLR9_SVW1_TT1_32_VW1_WG32_8_1
    SolutionIndex: 141
    SolutionNameMin: Cijk_Ailk_Bljk_CB_UserArgs_MT32x64x32_MI16x16x4x1_SN_AMAS0_DTVA0_GLVWA2_GLVWB1_GSU1_GSUASB_LBSPPB256_LPB1_LRVW1_MIAV1_NTA0_NLCA1_PLR9_SVW1_TT1_32_VW1_WG32_8_1
    SolutionIndex: 142
    SolutionNameMin: Cijk_Ailk_Bljk_CB_UserArgs_MT144x64x32_MI16x16x4x1_SN_AMAS0_DTVA0_GLVWA2_GLVWB2_GSU5_GSUAMB_LBSPPB256_LPB2_LRVW1_MIAV1_NTA4_NLCA9_PLR1_SVW1_TT9_16_VW1_WG16_16_1
    SolutionIndex: 143
    SolutionNameMin: Cijk_Ailk_Bljk_CB_UserArgs_MT64x64x32_MI16x16x4x1_SN_AMAS0_DTVA0_GLVWA2_GLVWB1_GSU1_GSUASB_LBSPPB256_LPB1_LRVW1_MIAV1_NTA0_NLCA1_PLR9_SVW1_TT2_32_VW1_WG32_8_1
    SolutionIndex: 144
    SolutionNameMin: Cijk_Ailk_Bljk_CB_UserArgs_MT160x64x16_MI16x16x4x1_SN_AMAS0_DTVA0_GLVWA2_GLVWB1_GSU4_GSUAMB_LBSPPB128_LPB1_LRVW1_MIAV1_NTA0_NLCA5_PLR1_SVW1_TT5_32_VW1_WG32_8_1
    SolutionIndex: 145
    SolutionNameMin: Cijk_Ailk_Bljk_CB_UserArgs_MT320x64x16_MI16x16x4x1_SN_AMAS0_DTVA0_GLVWA2_GLVWB1_GSU8_GSUAMB_LBSPPB128_LPB1_LRVW1_MIAV0_NTA4_NLCA5_PLR1_SVW1_TT5_64_VW1_WG64_4_1
    SolutionIndex: 146
    SolutionNameMin: Cijk_Ailk_Bljk_CB_UserArgs_MT64x64x64_MI16x16x4x1_SN_AMAS3_DTVA0_GLVWA2_GLVWB2_GSU1_GSUASB_LBSPPB0_LPB0_LRVW2_MIAV1_NTA0_NLCA1_PLR17_SVW2_TT2_32_VW2_WG32_8_1
    SolutionIndex: 147
    SolutionNameMin: Cijk_Ailk_Bljk_CB_UserArgs_MT64x64x16_MI16x16x4x1_SN_AMAS0_DTVA0_GLVWA2_GLVWB2_GSU1_GSUASB_LBSPPB128_LPB2_LRVW1_MIAV1_NTA0_NLCA1_PLR1_SVW1_TT2_32_VW1_WG32_8_1
    SolutionIndex: 148
    SolutionNameMin: Cijk_Ailk_Bljk_CB_UserArgs_MT352x64x16_MI16x16x4x1_SN_AMAS0_DTVA0_GLVWA2_GLVWB1_GSU6_GSUAMB_LBSPPB128_LPB1_LRVW1_MIAV0_NTA4_NLCA11_PLR1_SVW1_TT11_32_VW1_WG32_8_1
    SolutionIndex: 149
    SolutionNameMin: Cijk_Ailk_Bljk_CB_UserArgs_MT32x32x16_MI16x16x4x1_SN_AMAS0_DTVA0_GLVWA2_GLVWB1_GSU1_GSUASB_LBSPPB128_LPB4_LRVW2_MIAV1_NTA0_NLCA1_PLR5_SVW1_TT1_16_VW1_WG32_8_1
    SolutionIndex: 150
    SolutionNameMin: Cijk_Ailk_Bljk_CB_UserArgs_MT80x64x32_MI16x16x4x1_SN_AMAS0_DTVA0_GLVWA2_GLVWB2_GSU1_GSUASB_LBSPPB256_LPB2_LRVW1_MIAV1_NTA0_NLCA5_PLR9_SVW1_TT5_16_VW1_WG16_16_1
    SolutionIndex: 151
    SolutionNameMin: Cijk_Ailk_Bljk_CB_UserArgs_MT144x64x32_MI16x16x4x1_SN_AMAS0_DTVA0_GLVWA2_GLVWB1_GSU2_GSUAMB_LBSPPB256_LPB1_LRVW1_MIAV1_NTA0_NLCA9_PLR1_SVW1_TT9_16_VW1_WG16_16_1
    SolutionIndex: 152
    SolutionNameMin: Cijk_Ailk_Bljk_CB_UserArgs_MT16x16x128_MI16x16x4x1_SN_1LDSB1_DTVA1_GLVWB2_GSU8_LBSPPB1024_LPB2_LRVW1_NLCB1_PLR9_TT1_16_WG16_4_4
    SolutionIndex: 153
    SolutionNameMin: Cijk_Ailk_Bljk_CB_UserArgs_MT16x16x128_MI16x16x4x1_SN_1LDSB1_DTVA0_GLVWB2_GSU8_LBSPPB1024_LPB2_LRVW1_NLCB1_PLR9_TT1_16_WG16_4_4
    SolutionIndex: 154
    SolutionNameMin: Cijk_Ailk_Bljk_CB_UserArgs_MT16x16x128_MI16x16x4x1_SN_1LDSB1_DTVA0_GLVWA2_GLVWB2_GSU1_GSUASB_LBSPPB1024_LPB4_LRVW2_NLCB1_PLR9_TT1_16_WG16_4_4
    SolutionIndex: 155
    SolutionNameMin: Cijk_Ailk_Bljk_CB_UserArgs_MT16x16x128_MI16x16x4x1_SN_1LDSB1_DTVA0_GLVWA2_GLVWB2_GSU14_GSUAMB_LBSPPB1024_LPB2_LRVW1_NLCB1_PLR1_TT1_16_WG16_4_4
    SolutionIndex: 156
    SolutionNameMin: Cijk_Ailk_Bljk_CB_UserArgs_MT16x16x256_MI16x16x4x1_SN_1LDSB1_AMAS0_DTVA0_GLVWA2_GLVWB1_GSU3_LBSPPB0_LPB0_LRVW2_NLCB1_PLR17_SVW1_TT1_16_VW1_WG16_4_4
    SolutionIndex: 157
    SolutionNameMin: Cijk_Ailk_Bljk_CB_UserArgs_MT16x16x64_MI16x16x4x1_SN_1LDSB0_AMAS0_DTVA0_GLVWA2_GLVWB1_GSU6_LBSPPB512_LPB1_LRVW1_NLCB1_PLR9_SVW1_TT1_16_VW1_WG16_4_2
    SolutionIndex: 158
    SolutionNameMin: Cijk_Ailk_Bljk_CB_UserArgs_MT32x16x64_MI16x16x4x1_SN_1LDSB0_AMAS0_DTVA0_GLVWA2_GLVWB2_GSU14_LBSPPB512_LPB4_LRVW2_NLCB1_PLR9_SVW1_TT1_16_VW1_WG32_4_2
    SolutionIndex: 159
    SolutionNameMin: Cijk_Ailk_Bljk_CB_UserArgs_MT16x16x128_MI16x16x4x1_SN_1LDSB0_AMAS0_DTVA0_GLVWA2_GLVWB1_GSU3_LBSPPB0_LPB0_LRVW2_NLCA1_NLCB1_PLR9_SVW1_TT1_16_VW1_WG16_4_4
    SolutionIndex: 160
    SolutionNameMin: Cijk_Ailk_Bljk_CB_UserArgs_MT32x16x64_MI16x16x4x1_SN_1LDSB1_AMAS0_DTVA0_GLVWA2_GLVWB2_GSU6_LBSPPB512_LPB4_LRVW2_NLCA1_NLCB1_PLR9_SVW1_TT1_16_VW1_WG32_4_2
    SolutionIndex: 161
    SolutionNameMin: Cijk_Ailk_Bljk_CB_UserArgs_MT64x16x64_MI16x16x4x1_SN_1LDSB1_AMAS0_DTVA0_GLVWA2_GLVWB1_GSU12_LBSPPB512_LPB4_LRVW2_NLCA1_NLCB1_PLR9_SVW1_TT2_16_VW1_WG32_4_2
    SolutionIndex: 162
    SolutionNameMin: Cijk_Ailk_Bljk_CB_UserArgs_MT16x16x64_MI16x16x4x1_SN_1LDSB1_AMAS0_DTVA0_GLVWA2_GLVWB2_GSU1_GSUASB_LBSPPB512_LPB4_LRVW2_NLCA1_NLCB1_PLR5_SVW1_TT1_16_VW1_WG16_4_4
    SolutionIndex: 163
    SolutionNameMin: Cijk_Ailk_Bljk_CB_UserArgs_MT64x16x32_MI16x16x4x1_SN_1LDSB1_AMAS0_DTVA0_GLVWA2_GLVWB2_GSU11_GSUAMB_LBSPPB256_LPB4_LRVW2_NLCA1_NLCB1_PLR9_SVW1_TT1_16_VW1_WG64_4_1
    SolutionIndex: 164
    SolutionNameMin: Cijk_Ailk_Bljk_CB_UserArgs_MT64x16x32_MI16x16x4x1_SN_1LDSB0_AMAS0_DTVA0_GLVWA2_GLVWB1_GSU11_GSUAMB_LBSPPB256_LPB1_LRVW1_NLCA1_NLCB1_PLR1_SVW1_TT1_16_VW1_WG64_4_1
    SolutionIndex: 165
    SolutionNameMin: Cijk_Ailk_Bljk_CB_UserArgs_MT32x16x64_MI16x16x4x1_SN_1LDSB1_AMAS3_DTVA1_GLVWA2_GLVWB2_GSU1_GSUASB_LBSPPB512_LPB4_LRVW2_NLCA1_NLCB1_PLR5_SVW2_TT2_16_VW2_WG16_4_4
    SolutionIndex: 166
    SolutionNameMin: Cijk_Ailk_Bljk_CB_UserArgs_MT32x16x64_MI16x16x4x1_SN_1LDSB0_AMAS3_DTVA1_GLVWA2_GLVWB2_GSU1_GSUASB_LBSPPB512_LPB4_LRVW2_NLCA1_NLCB1_PLR5_SVW2_TT2_16_VW2_WG16_4_4
    SolutionIndex: 167
    SolutionNameMin: Cijk_Ailk_Bljk_CB_UserArgs_MT64x32x16_MI16x16x4x1_SN_1LDSB1_AMAS3_DTVA0_GLVWA2_GLVWB1_GSU10_GSUAMB_LBSPPB128_LPB4_LRVW2_NLCA1_NLCB1_PLR5_SVW2_TT2_16_VW2_WG32_8_1
    SolutionIndex: 168
    SolutionNameMin: Cijk_Ailk_Bljk_CB_UserArgs_MT32x16x128_MI16x16x4x1_SN_AMAS0_DTVA0_GLVWA2_GLVWB2_GSU1_GSUASB_LBSPPB1024_LPB4_LRVW2_NLCA1_NLCB1_PLR17_SVW1_TT1_16_VW1_WG32_4_2
    SolutionIndex: 169
    SolutionNameMin: Cijk_Ailk_Bljk_CB_UserArgs_MT16x32x64_MI16x16x4x1_SN_AMAS0_DTVA0_GLVWA2_GLVWB2_GSU1_GSUASB_LBSPPB512_LPB4_LRVW2_NLCA1_NLCB1_PLR9_SVW1_TT1_16_VW1_WG16_8_2
    SolutionIndex: 170
    SolutionNameMin: Cijk_Ailk_Bljk_CB_UserArgs_MT128x32x16_MI16x16x4x1_SN_AMAS3_DTVA1_GLVWA2_GLVWB2_GSU14_GSUAMB_LBSPPB128_LPB2_LRVW1_NLCA1_NLCB1_PLR5_SVW2_TT2_32_VW2_WG64_4_1
    SolutionIndex: 171
    SolutionNameMin: Cijk_Ailk_Bljk_CB_UserArgs_MT32x32x64_MI16x16x4x1_SN_AMAS3_DTVA1_GLVWA2_GLVWB2_GSU1_GSUASB_LBSPPB512_LPB4_LRVW2_MIAV1_NLCA1_NLCB1_PLR5_SVW2_TT2_32_VW2_WG16_4_4
    SolutionIndex: 172
    SolutionNameMin: Cijk_Ailk_Bljk_CB_UserArgs_MT32x32x64_MI16x16x4x1_SN_AMAS3_DTVA1_GLVWA2_GLVWB2_GSU1_GSUASB_LBSPPB512_LPB2_LRVW1_MIAV1_NLCA1_NLCB1_PLR5_SVW2_TT2_32_VW2_WG16_4_4
    SolutionIndex: 173
    SolutionNameMin: Cijk_Ailk_Bljk_CB_UserArgs_MT128x32x16_MI16x16x4x1_SN_AMAS3_DTVA1_GLVWA2_GLVWB2_GSU9_GSUAMB_LBSPPB128_LPB4_LRVW2_MIAV1_NLCA1_NLCB1_PLR5_SVW2_TT2_32_VW2_WG64_4_1
    SolutionIndex: 174
    SolutionNameMin: Cijk_Ailk_Bljk_CB_UserArgs_MT64x16x128_MI16x16x4x1_SN_AMAS3_DTVA1_GLVWA2_GLVWB2_GSU1_GSUASB_LBSPPB1024_LPB2_LRVW1_MIAV1_NLCA1_NLCB1_PLR1_SVW2_TT2_16_VW2_WG32_4_2
    SolutionIndex: 175
    SolutionNameMin: Cijk_Ailk_Bljk_CB_UserArgs_MT16x64x32_MI16x16x4x1_SN_AMAS0_DTVA0_GLVWA2_GLVWB1_GSU1_GSUASB_LBSPPB256_LPB1_LRVW1_MIAV1_NLCA1_NLCB1_PLR1_SVW1_TT1_64_VW1_WG16_4_4
    SolutionIndex: 176
    SolutionNameMin: Cijk_Ailk_Bljk_CB_UserArgs_MT64x64x16_MI16x16x4x1_SN_AMAS0_DTVA0_GLVWA2_GLVWB1_GSU7_GSUAMB_LBSPPB128_LPB4_LRVW2_MIAV1_NLCA1_NLCB1_PLR5_SVW1_TT1_64_VW1_WG64_4_1
    SolutionIndex: 177
    SolutionNameMin: Cijk_Ailk_Bljk_CB_UserArgs_MT32x48x32_MI16x16x4x1_SN_AMAS3_DTVA1_GLVWA2_GLVWB2_GSU1_GSUASB_LBSPPB256_LPB2_LRVW1_MIAV1_NLCA1_NLCB1_PLR3_SVW2_TT2_48_VW2_WG16_4_4
    SolutionIndex: 178
    SolutionNameMin: Cijk_Ailk_Bljk_CB_UserArgs_MT32x32x64_MI16x16x4x1_SN_AMAS3_DTVA1_GLVWA2_GLVWB1_GSU1_GSUASB_LBSPPB512_LPB1_LRVW1_MIAV1_NLCA1_NLCB1_PLR1_SVW2_TT2_32_VW2_WG16_4_4
    SolutionIndex: 179
    SolutionNameMin: Cijk_Ailk_Bljk_CB_UserArgs_MT64x64x16_MI16x16x4x1_SN_AMAS0_DTVA0_GLVWA2_GLVWB1_GSU9_GSUAMB_LBSPPB128_LPB1_LRVW1_MIAV1_NLCA1_NLCB1_PLR1_SVW1_TT1_64_VW1_WG64_4_1
    SolutionIndex: 180
    SolutionNameMin: Cijk_Ailk_Bljk_CB_UserArgs_MT64x32x16_MI16x16x4x1_SN_AMAS3_DTVA1_GLVWA2_GLVWB2_GSU1_GSUASB_LBSPPB128_LPB2_LRVW1_MIAV1_NLCA1_PLR1_SVW2_TT2_32_VW2_WG32_4_2
    SolutionIndex: 181
    SolutionNameMin: Cijk_Ailk_Bljk_CB_UserArgs_MT64x128x16_MI16x16x4x1_SN_AMAS3_DTVA0_GLVWA2_GLVWB2_GSU7_GSUAMB_LBSPPB128_LPB2_LRVW1_MIAV1_NLCA1_PLR1_SVW2_TT2_64_VW2_WG32_8_1
    SolutionIndex: 182
    SolutionNameMin: Cijk_Ailk_Bljk_CB_UserArgs_MT64x128x16_MI16x16x4x1_SN_AMAS0_DTVA0_GLVWA2_GLVWB2_GSU7_GSUAMB_LBSPPB128_LPB4_LRVW2_MIAV1_NLCA1_PLR5_SVW1_TT1_128_VW1_WG64_4_1
    SolutionIndex: 183
    SolutionNameMin: Cijk_Ailk_Bljk_CB_UserArgs_MT32x64x64_MI16x16x4x1_SN_AMAS0_DTVA0_GLVWA2_GLVWB2_GSU1_GSUASB_LBSPPB512_LPB2_LRVW1_MIAV1_NLCA1_PLR17_SVW1_TT1_32_VW1_WG32_8_1
    SolutionIndex: 184
    SolutionNameMin: Cijk_Ailk_Bljk_CB_UserArgs_MT32x64x16_MI16x16x4x1_SN_AMAS0_DTVA0_GLVWA2_GLVWB2_GSU1_GSUASB_LBSPPB128_LPB2_LRVW1_MIAV1_NLCA1_PLR1_SVW1_TT2_32_VW1_WG16_8_2
    SolutionIndex: 185
    SolutionNameMin: Cijk_Ailk_Bljk_CB_UserArgs_MT96x128x16_MI16x16x4x1_SN_AMAS0_DTVA0_GLVWA2_GLVWB1_GSU7_GSUAMB_LBSPPB128_LPB1_LRVW1_MIAV0_NLCA3_PLR5_SVW1_TT3_64_VW1_WG32_8_1
    SolutionIndex: 186
    SolutionNameMin: Cijk_Ailk_Bljk_CB_UserArgs_MT64x64x64_MI16x16x4x1_SN_AMAS3_DTVA1_GLVWA2_GLVWB2_GSU1_GSUASB_LBSPPB512_LPB2_LRVW1_MIAV1_NLCA1_PLR1_SVW2_TT2_64_VW2_WG32_4_2
    SolutionIndex: 187
    SolutionNameMin: Cijk_Ailk_Bljk_CB_UserArgs_MT160x64x32_MI16x16x4x1_SN_AMAS0_DTVA0_GLVWA2_GLVWB1_GSU4_GSUAMB_LBSPPB256_LPB1_LRVW1_MIAV1_NLCA5_PLR9_SVW1_TT5_32_VW1_WG32_8_1
    SolutionIndex: 188
    SolutionNameMin: Cijk_Ailk_Bljk_CB_UserArgs_MT64x64x8_MI16x16x4x1_SN_AMAS0_DTVA0_GLVWA2_GLVWB1_GSU1_GSUASB_LBSPPB128_LPB1_LRVW1_MIAV1_NTA4_NLCA1_PLR1_SVW1_TT1_64_VW1_WG64_4_1
    SolutionIndex: 189
    SolutionNameMin: Cijk_Ailk_Bljk_CB_UserArgs_MT64x64x32_MI16x16x4x1_SN_AMAS0_DTVA0_GLVWA2_GLVWB1_GSU1_GSUASB_LBSPPB256_LPB1_LRVW1_MIAV1_NTA0_NLCA1_PLR9_SVW1_TT1_64_VW1_WG64_4_1
    SolutionIndex: 190
    SolutionNameMin: Cijk_Ailk_Bljk_CB_UserArgs_MT128x64x32_MI16x16x4x1_SN_AMAS3_DTVA1_GLVWA2_GLVWB1_GSU2_GSUAMB_LBSPPB256_LPB1_LRVW1_MIAV1_NTA4_NLCA1_PLR9_SVW2_TT2_64_VW2_WG64_4_1
    SolutionIndex: 191
    SolutionNameMin: Cijk_Ailk_Bljk_CB_UserArgs_MT80x64x32_MI16x16x4x1_SN_AMAS0_DTVA0_GLVWA2_GLVWB1_GSU1_GSUASB_LBSPPB256_LPB1_LRVW1_MIAV1_NTA0_NLCA5_PLR1_SVW1_TT5_16_VW1_WG16_16_1
    SolutionIndex: 192
    SolutionNameMin: Cijk_Ailk_Bljk_CB_UserArgs_MT128x64x16_MI16x16x4x1_SN_AMAS3_DTVA1_GLVWA2_GLVWB2_GSU1_GSUASB_LBSPPB128_LPB2_LRVW1_MIAV1_NTA0_NLCA1_PLR1_SVW2_TT2_64_VW2_WG64_4_1
    SolutionIndex: 193
    SolutionNameMin: Cijk_Ailk_Bljk_CB_UserArgs_MT144x64x32_MI16x16x4x1_SN_AMAS0_DTVA0_GLVWA2_GLVWB1_GSU2_GSUAMB_LBSPPB256_LPB1_LRVW1_MIAV1_NTA0_NLCA9_PLR1_SVW1_TT9_16_VW1_WG16_16_1
    SolutionIndex: 194
    SolutionNameMin: Cijk_Ailk_Bljk_CB_UserArgs_MT64x128x8_MI16x16x4x1_SN_AMAS0_DTVA0_GLVWA2_GLVWB1_GSU1_GSUASB_LBSPPB128_LPB1_LRVW1_MIAV1_NTA0_NLCA1_PLR1_SVW1_TT1_128_VW1_WG64_4_1
    SolutionIndex: 195
    SolutionNameMin: Cijk_Ailk_Bljk_CB_UserArgs_MT64x128x32_MI16x16x4x1_SN_AMAS0_DTVA0_GLVWA2_GLVWB1_GSU1_GSUASB_LBSPPB256_LPB1_LRVW1_MIAV1_NTA0_NLCA1_PLR9_SVW1_TT4_32_VW1_WG16_16_1
    SolutionIndex: 196
    SolutionNameMin: Cijk_Ailk_Bljk_CB_UserArgs_MT224x128x16_MI16x16x4x1_SN_AMAS0_DTVA0_GLVWA2_GLVWB1_GSU4_GSUAMB_LBSPPB128_LPB1_LRVW1_MIAV0_NTA4_NLCA7_PLR5_SVW1_TT7_64_VW1_WG32_8_1
    SolutionIndex: 197
    SolutionNameMin: Cijk_Ailk_Bljk_CB_UserArgs_MT144x64x32_MI16x16x4x1_SN_AMAS0_DTVA0_GLVWA2_GLVWB1_GSU1_GSUASB_LBSPPB256_LPB1_LRVW1_MIAV1_NTA4_NLCA9_PLR1_SVW1_TT9_16_VW1_WG16_16_1
    SolutionIndex: 198
    SolutionNameMin: Cijk_Ailk_Bljk_CB_UserArgs_MT80x128x32_MI16x16x4x1_SN_AMAS0_DTVA0_GLVWA2_GLVWB2_GSU1_GSUASB_LBSPPB256_LPB2_LRVW1_MIAV1_NTA0_NLCA5_PLR1_SVW1_TT5_32_VW1_WG16_16_1
    SolutionIndex: 199
    SolutionNameMin: Cijk_Ailk_Bljk_CB_UserArgs_MT144x64x32_MI16x16x4x1_SN_AMAS0_DTVA0_GLVWA2_GLVWB2_GSU1_GSUASB_LBSPPB256_LPB2_LRVW1_MIAV1_NTA4_NLCA9_PLR1_SVW1_TT9_16_VW1_WG16_16_1
    SolutionIndex: 200
    SolutionNameMin: Cijk_Ailk_Bljk_CB_UserArgs_MT16x16x64_MI16x16x4x1_SN_1LDSB0_DTVA0_GLVWB1_GSU4_LBSPPB512_LPB1_LRVW1_NLCB1_PLR1_TT1_16_WG16_4_4
    SolutionIndex: 201
    SolutionNameMin: Cijk_Ailk_Bljk_CB_UserArgs_MT16x16x64_MI16x16x4x1_SN_1LDSB0_DTVA1_GLVWB1_GSU6_LBSPPB512_LPB4_LRVW2_NLCB1_PLR5_TT1_16_WG16_4_4
    SolutionIndex: 202
    SolutionNameMin: Cijk_Ailk_Bljk_CB_UserArgs_MT16x16x128_MI16x16x4x1_SN_1LDSB0_DTVA1_GLVWB2_GSU6_LBSPPB1024_LPB2_LRVW1_NLCB1_PLR9_TT1_16_WG16_4_4
    SolutionIndex: 203
    SolutionNameMin: Cijk_Ailk_Bljk_CB_UserArgs_MT16x16x128_MI16x16x4x1_SN_1LDSB0_DTVA0_GLVWA2_GLVWB1_GSU4_LBSPPB0_LPB0_LRVW1_NLCB1_PLR1_TT1_16_WG16_4_4
    SolutionIndex: 204
    SolutionNameMin: Cijk_Ailk_Bljk_CB_UserArgs_MT16x16x64_MI16x16x4x1_SN_1LDSB0_DTVA0_GLVWA2_GLVWB2_GSU4_LBSPPB512_LPB4_LRVW2_NLCB1_PLR5_TT1_16_WG16_4_4
    SolutionIndex: 205
    SolutionNameMin: Cijk_Ailk_Bljk_CB_UserArgs_MT16x32x128_MI16x16x4x1_SN_1LDSB1_DTVA0_GLVWA2_GLVWB2_GSU10_LBSPPB1024_LPB4_LRVW2_NLCB1_PLR17_TT1_16_WG16_8_2
    SolutionIndex: 206
    SolutionNameMin: Cijk_Ailk_Bljk_CB_UserArgs_MT16x16x64_MI16x16x4x1_SN_1LDSB0_AMAS0_DTVA0_GLVWA2_GLVWB1_GSU3_LBSPPB512_LPB4_LRVW2_NLCB1_PLR9_SVW1_TT1_16_VW1_WG16_4_2
    SolutionIndex: 207
    SolutionNameMin: Cijk_Ailk_Bljk_CB_UserArgs_MT32x16x64_MI16x16x4x1_SN_1LDSB1_AMAS0_DTVA0_GLVWA2_GLVWB1_GSU6_LBSPPB512_LPB1_LRVW1_NLCB1_PLR9_SVW1_TT1_16_VW1_WG32_4_2
    SolutionIndex: 208
    SolutionNameMin: Cijk_Ailk_Bljk_CB_UserArgs_MT32x32x64_MI16x16x4x1_SN_1LDSB1_AMAS0_DTVA0_GLVWA2_GLVWB2_GSU12_LBSPPB512_LPB4_LRVW2_NLCB1_PLR9_SVW1_TT2_16_VW1_WG16_8_2
    SolutionIndex: 209
    SolutionNameMin: Cijk_Ailk_Bljk_CB_UserArgs_MT16x16x128_MI16x16x4x1_SN_1LDSB1_AMAS0_DTVA0_GLVWA2_GLVWB2_GSU1_GSUASB_LBSPPB1024_LPB2_LRVW1_NLCA1_NLCB1_PLR9_SVW1_TT1_16_VW1_WG16_4_4
    SolutionIndex: 210
    SolutionNameMin: Cijk_Ailk_Bljk_CB_UserArgs_MT64x16x32_MI16x16x4x1_SN_1LDSB1_AMAS0_DTVA0_GLVWA2_GLVWB2_GSU10_GSUAMB_LBSPPB256_LPB2_LRVW1_NLCA1_NLCB1_PLR9_SVW1_TT1_16_VW1_WG64_4_1
    SolutionIndex: 211
    SolutionNameMin: Cijk_Ailk_Bljk_CB_UserArgs_MT32x16x64_MI16x16x4x1_SN_1LDSB1_AMAS3_DTVA1_GLVWA2_GLVWB2_GSU1_GSUASB_LBSPPB512_LPB4_LRVW2_NLCA1_NLCB1_PLR5_SVW2_TT2_16_VW2_WG16_4_4
    SolutionIndex: 212
    SolutionNameMin: Cijk_Ailk_Bljk_CB_UserArgs_MT64x16x32_MI16x16x4x1_SN_1LDSB1_AMAS0_DTVA0_GLVWA2_GLVWB1_GSU5_GSUAMB_LBSPPB256_LPB1_LRVW1_NLCA1_NLCB1_PLR9_SVW1_TT1_16_VW1_WG64_4_1
    SolutionIndex: 213
    SolutionNameMin: Cijk_Ailk_Bljk_CB_UserArgs_MT64x32x16_MI16x16x4x1_SN_1LDSB0_AMAS0_DTVA0_GLVWA2_GLVWB2_GSU10_GSUAMB_LBSPPB128_LPB2_LRVW1_NLCA1_NLCB1_PLR5_SVW1_TT1_32_VW1_WG64_4_1
    SolutionIndex: 214
    SolutionNameMin: Cijk_Ailk_Bljk_CB_UserArgs_MT32x16x64_MI16x16x4x1_SN_1LDSB1_AMAS0_DTVA0_GLVWA2_GLVWB2_GSU1_GSUASB_LBSPPB512_LPB4_LRVW2_NLCA1_NLCB1_PLR9_SVW1_TT1_16_VW1_WG32_4_2
    SolutionIndex: 215
    SolutionNameMin: Cijk_Ailk_Bljk_CB_UserArgs_MT16x32x64_MI16x16x4x1_SN_1LDSB1_AMAS0_DTVA0_GLVWA2_GLVWB2_GSU1_GSUASB_LBSPPB512_LPB4_LRVW2_NLCA1_NLCB1_PLR9_SVW1_TT1_16_VW1_WG16_8_2
    SolutionIndex: 216
    SolutionNameMin: Cijk_Ailk_Bljk_CB_UserArgs_MT256x16x16_MI16x16x4x1_SN_1LDSB1_AMAS3_DTVA1_GLVWA2_GLVWB1_GSU14_GSUAMB_LBSPPB128_LPB1_LRVW1_NLCA2_NLCB1_PLR1_SVW2_TT4_16_VW2_WG64_4_1
    SolutionIndex: 217
    SolutionNameMin: Cijk_Ailk_Bljk_CB_UserArgs_MT32x32x64_MI16x16x4x1_SN_AMAS0_DTVA0_GLVWA2_GLVWB1_GSU1_GSUASB_LBSPPB512_LPB1_LRVW1_MIAV1_NLCA1_PLR9_SVW1_TT1_32_VW1_WG32_4_2
    SolutionIndex: 218
    SolutionNameMin: Cijk_Ailk_Bljk_CB_UserArgs_MT64x16x32_MI16x16x4x1_SN_AMAS3_DTVA1_GLVWA2_GLVWB2_GSU1_GSUASB_LBSPPB256_LPB4_LRVW2_MIAV1_NLCA1_PLR5_SVW2_TT2_16_VW2_WG32_4_2
    SolutionIndex: 219
    SolutionNameMin: Cijk_Ailk_Bljk_CB_UserArgs_MT128x64x16_MI16x16x4x1_SN_AMAS3_DTVA1_GLVWA2_GLVWB2_GSU14_GSUAMB_LBSPPB128_LPB2_LRVW1_MIAV1_NLCA1_PLR1_SVW2_TT2_64_VW2_WG64_4_1
    SolutionIndex: 220
    SolutionNameMin: Cijk_Ailk_Bljk_CB_UserArgs_MT32x32x16_MI16x16x4x1_SN_AMAS0_DTVA0_GLVWA2_GLVWB1_GSU1_GSUASB_LBSPPB128_LPB1_LRVW1_MIAV1_NLCA1_PLR1_SVW1_TT1_16_VW1_WG32_8_1
    SolutionIndex: 221
    SolutionNameMin: Cijk_Ailk_Bljk_CB_UserArgs_MT32x32x64_MI16x16x4x1_SN_AMAS0_DTVA0_GLVWA2_GLVWB2_GSU1_GSUASB_LBSPPB512_LPB2_LRVW1_MIAV1_NLCA1_PLR9_SVW1_TT2_16_VW1_WG16_8_2
    SolutionIndex: 222
    SolutionNameMin: Cijk_Ailk_Bljk_CB_UserArgs_MT96x64x16_MI16x16x4x1_SN_AMAS0_DTVA0_GLVWA2_GLVWB2_GSU7_GSUAMB_LBSPPB128_LPB2_LRVW1_MIAV1_NLCA3_PLR1_SVW1_TT3_32_VW1_WG32_8_1
    SolutionIndex: 223
    SolutionNameMin: Cijk_Ailk_Bljk_CB_UserArgs_MT64x32x32_MI16x16x4x1_SN_AMAS3_DTVA1_GLVWA2_GLVWB1_GSU1_GSUASB_LBSPPB256_LPB1_LRVW1_MIAV1_NLCA1_PLR1_SVW2_TT2_32_VW2_WG32_4_2
    SolutionIndex: 224
    SolutionNameMin: Cijk_Ailk_Bljk_CB_UserArgs_MT256x32x16_MI16x16x4x1_SN_AMAS3_DTVA1_GLVWA2_GLVWB2_GSU7_GSUAMB_LBSPPB128_LPB4_LRVW2_MIAV1_NLCA2_PLR5_SVW2_TT4_32_VW2_WG64_4_1
    SolutionIndex: 225
    SolutionNameMin: Cijk_Ailk_Bljk_CB_UserArgs_MT64x128x16_MI16x16x4x1_SN_AMAS0_DTVA0_GLVWA2_GLVWB2_GSU7_GSUAMB_LBSPPB128_LPB4_LRVW2_MIAV1_NLCA1_PLR5_SVW1_TT1_128_VW1_WG64_4_1
    SolutionIndex: 226
    SolutionNameMin: Cijk_Ailk_Bljk_CB_UserArgs_MT64x16x16_MI16x16x4x1_SN_AMAS0_DTVA0_GLVWA2_GLVWB1_GSU1_GSUASB_LBSPPB128_LPB1_LRVW1_MIAV1_NLCA1_PLR1_SVW1_TT1_16_VW1_WG64_4_1
    SolutionIndex: 227
    SolutionNameMin: Cijk_Ailk_Bljk_CB_UserArgs_MT64x32x64_MI16x16x4x1_SN_AMAS3_DTVA1_GLVWA2_GLVWB2_GSU1_GSUASB_LBSPPB512_LPB4_LRVW2_MIAV1_NLCA1_PLR9_SVW2_TT2_32_VW2_WG32_4_2
    SolutionIndex: 228
    SolutionNameMin: Cijk_Ailk_Bljk_CB_UserArgs_MT96x128x16_MI16x16x4x1_SN_AMAS0_DTVA0_GLVWA2_GLVWB2_GSU7_GSUAMB_LBSPPB128_LPB2_LRVW1_MIAV0_NLCA3_PLR1_SVW1_TT3_64_VW1_WG32_8_1
    SolutionIndex: 229
    SolutionNameMin: Cijk_Ailk_Bljk_CB_UserArgs_MT64x64x32_MI16x16x4x1_SN_AMAS3_DTVA1_GLVWA2_GLVWB1_GSU1_GSUASB_LBSPPB256_LPB1_LRVW1_MIAV1_NLCA1_PLR1_SVW2_TT2_64_VW2_WG32_4_2
    SolutionIndex: 230
    SolutionNameMin: Cijk_Ailk_Bljk_CB_UserArgs_MT160x64x32_MI16x16x4x1_SN_AMAS0_DTVA0_GLVWA2_GLVWB1_GSU4_GSUAMB_LBSPPB256_LPB1_LRVW1_MIAV1_NLCA5_PLR1_SVW1_TT5_32_VW1_WG32_8_1
    SolutionIndex: 231
    SolutionNameMin: Cijk_Ailk_Bljk_CB_UserArgs_MT160x128x16_MI16x16x4x1_SN_AMAS0_DTVA0_GLVWA2_GLVWB2_GSU8_GSUAMB_LBSPPB128_LPB2_LRVW1_MIAV0_NLCA5_PLR1_SVW1_TT5_64_VW1_WG32_8_1
    SolutionIndex: 232
    SolutionNameMin: Cijk_Ailk_Bljk_CB_UserArgs_MT64x64x8_MI16x16x4x1_SN_AMAS3_DTVA1_GLVWA2_GLVWB2_GSU1_GSUASB_LBSPPB128_LPB2_LRVW1_MIAV1_NLCA1_PLR1_SVW2_TT2_64_VW2_WG32_4_2
    SolutionIndex: 233
    SolutionNameMin: Cijk_Ailk_Bljk_CB_UserArgs_MT64x64x64_MI16x16x4x1_SN_AMAS3_DTVA1_GLVWA2_GLVWB2_GSU1_GSUASB_LBSPPB512_LPB4_LRVW2_MIAV1_NLCA1_PLR9_SVW2_TT2_64_VW2_WG32_4_2
    SolutionIndex: 234
    SolutionNameMin: Cijk_Ailk_Bljk_CB_UserArgs_MT256x128x16_MI16x16x4x1_SN_AMAS3_DTVA1_GLVWA2_GLVWB1_GSU9_GSUAMB_LBSPPB128_LPB1_LRVW1_MIAV0_NLCA2_PLR1_SVW2_TT4_128_VW2_WG64_4_1
    SolutionIndex: 235
    SolutionNameMin: Cijk_Ailk_Bljk_CB_UserArgs_MT32x96x16_MI16x16x4x1_SN_AMAS0_DTVA0_GLVWA2_GLVWB2_GSU1_GSUASB_LBSPPB128_LPB4_LRVW2_MIAV1_NLCA1_PLR5_SVW1_TT1_48_VW1_WG32_8_1
    SolutionIndex: 236
    SolutionNameMin: Cijk_Ailk_Bljk_CB_UserArgs_MT96x256x16_MI16x16x4x1_SN_AMAS3_DTVA0_GLVWA2_GLVWB1_GSU5_GSUAMB_LBSPPB128_LPB1_LRVW1_MIAV0_NLCA3_PLR1_SVW2_TT6_64_VW2_WG16_16_1
    SolutionIndex: 237
    SolutionNameMin: Cijk_Ailk_Bljk_CB_UserArgs_MT224x32x16_MI16x16x4x1_SN_AMAS0_DTVA0_GLVWB1_GSU1_GSUASB_LBSPPB128_LPB1_LRVW1_MIAV1_NTA4_NTC0_NTD0_NLCA7_PLR1_SVW1_TT7_16_VW1_WG32_8_1
    SolutionIndex: 238
    SolutionNameMin: Cijk_Ailk_Bljk_CB_UserArgs_MT112x64x32_MI16x16x4x1_SN_AMAS0_DTVA0_GLVWB2_GSU1_GSUASB_LBSPPB256_LPB4_LRVW2_MIAV1_NTA0_NTC0_NTD0_NLCA7_PLR9_SVW1_TT7_16_VW1_WG16_16_1
    SolutionIndex: 239
    SolutionNameMin: Cijk_Ailk_Bljk_CB_UserArgs_MT112x128x32_MI16x16x4x1_SN_AMAS0_DTVA0_GLVWB2_GSU2_GSUAMB_LBSPPB256_LPB2_LRVW1_MIAV0_NTA0_NTC0_NTD0_NLCA7_PLR1_SVW1_TT7_32_VW1_WG16_16_1
    SolutionIndex: 240
    SolutionNameMin: Cijk_Ailk_Bljk_CB_UserArgs_MT144x64x32_MI16x16x4x1_SN_AMAS0_DTVA0_GLVWB2_GSU1_GSUASB_LBSPPB256_LPB2_LRVW1_MIAV1_NTA0_NTC0_NTD0_NLCA9_PLR1_SVW1_TT9_16_VW1_WG16_16_1
    SolutionIndex: 241
    SolutionNameMin: Cijk_Ailk_Bljk_CB_UserArgs_MT144x64x32_MI16x16x4x1_SN_AMAS0_DTVA0_GLVWB2_GSU1_GSUASB_LBSPPB256_LPB2_LRVW1_MIAV1_NTA4_NTC0_NTD0_NLCA9_PLR1_SVW1_TT9_16_VW1_WG16_16_1
    SolutionIndex: 242
    SolutionNameMin: Cijk_Ailk_Bljk_CB_UserArgs_MT144x64x32_MI16x16x4x1_SN_AMAS0_DTVA0_GLVWB2_GSU1_GSUASB_LBSPPB256_LPB2_LRVW1_MIAV1_NTA0_NTC3_NTD3_NLCA9_PLR1_SVW1_TT9_16_VW1_WG16_16_1
    SolutionIndex: 243
    SolutionNameMin: Cijk_Ailk_Bljk_CB_UserArgs_MT448x32x8_MI16x16x4x1_SN_AMAS0_DTVA0_GLVWB1_GSU1_GSUASB_LBSPPB128_LPB1_LRVW1_MIAV0_NTA0_NTC3_NTD3_NLCA7_PLR1_SVW1_TT7_32_VW1_WG64_4_1
    SolutionIndex: 244
    SolutionNameMin: Cijk_Ailk_Bljk_CB_UserArgs_MT112x128x32_MI16x16x4x1_SN_AMAS0_DTVA0_GLVWB1_GSU1_GSUASB_LBSPPB256_LPB1_LRVW1_MIAV0_NTA0_NTC0_NTD0_NLCA7_PLR9_SVW1_TT7_32_VW1_WG16_16_1
    SolutionIndex: 245
    SolutionNameMin: Cijk_Ailk_Bljk_CB_UserArgs_MT112x128x32_MI16x16x4x1_SN_AMAS0_DTVA0_GLVWB2_GSU1_GSUASB_LBSPPB256_LPB2_LRVW1_MIAV0_NTA0_NTC3_NTD3_NLCA7_PLR1_SVW1_TT7_32_VW1_WG16_16_1
    SolutionIndex: 246
    SolutionNameMin: Cijk_Ailk_Bljk_CB_UserArgs_MT160x64x16_MI16x16x4x1_SN_AMAS0_DTVA0_GLVWB2_GSU1_GSUASB_LBSPPB128_LPB2_LRVW1_MIAV1_NTA0_NTC3_NTD3_NLCA5_PLR5_SVW1_TT5_32_VW1_WG32_8_1
    SolutionIndex: 247
    SolutionNameMin: Cijk_Ailk_Bljk_CB_UserArgs_MT96x64x16_MI16x16x4x1_SN_AMAS0_DTVA0_GLVWB2_GSU1_GSUASB_LBSPPB128_LPB2_LRVW1_MIAV1_NTA0_NTC3_NTD3_NLCA3_PLR5_SVW1_TT3_32_VW1_WG32_8_1
    SolutionIndex: 248
    SolutionNameMin: Cijk_Ailk_Bljk_CB_UserArgs_MT48x128x32_MI16x16x4x1_SN_AMAS0_DTVA0_GLVWB2_GSU1_GSUASB_LBSPPB256_LPB4_LRVW2_MIAV1_NTA4_NTC0_NTD0_NLCA3_PLR9_SVW1_TT3_32_VW1_WG16_16_1
    SolutionIndex: 249
    SolutionNameMin: Cijk_Ailk_Bljk_CB_UserArgs_MT16x32x256_MI16x16x4x1_SN_DTVA1_GLVWB1_GSU3_LBSPPB0_LPB0_LRVW1_NLCB1_PLR1_TT1_32_WG16_4_4
    SolutionIndex: 250
    SolutionNameMin: Cijk_Ailk_Bljk_CB_UserArgs_MT16x32x64_MI16x16x4x1_SN_DTVA0_GLVWB1_GSU11_LBSPPB512_LPB4_LRVW2_NLCB1_PLR9_TT1_16_WG16_8_2
    SolutionIndex: 251
    SolutionNameMin: Cijk_Ailk_Bljk_CB_UserArgs_MT16x48x64_MI16x16x4x1_SN_DTVA1_GLVWB2_GSU9_LBSPPB512_LPB4_LRVW2_NLCB1_PLR5_TT1_48_WG16_4_4
    SolutionIndex: 252
    SolutionNameMin: Cijk_Ailk_Bljk_CB_UserArgs_MT16x16x128_MI16x16x4x1_SN_DTVA0_GLVWA2_GLVWB2_GSU2_LBSPPB1024_LPB2_LRVW1_NLCB1_PLR9_TT1_16_WG16_4_4
    SolutionIndex: 253
    SolutionNameMin: Cijk_Ailk_Bljk_CB_UserArgs_MT16x32x64_MI16x16x4x1_SN_DTVA0_GLVWA2_GLVWB2_GSU9_LBSPPB512_LPB4_LRVW2_NLCB1_PLR9_TT1_16_WG16_8_2
    SolutionIndex: 254
    SolutionNameMin: Cijk_Ailk_Bljk_CB_UserArgs_MT16x48x64_MI16x16x4x1_SN_DTVA0_GLVWA2_GLVWB2_GSU9_LBSPPB512_LPB2_LRVW1_NLCB1_PLR5_TT1_48_WG16_4_4
    SolutionIndex: 255
    SolutionNameMin: Cijk_Ailk_Bljk_CB_UserArgs_MT16x16x128_MI16x16x4x1_SN_AMAS0_DTVA0_GLVWA2_GLVWB2_GSU1_GSUASB_LBSPPB1024_LPB4_LRVW2_NLCB1_PLR9_SVW1_TT1_16_VW1_WG16_4_4
    SolutionIndex: 256
    SolutionNameMin: Cijk_Ailk_Bljk_CB_UserArgs_MT16x16x128_MI16x16x4x1_SN_AMAS0_DTVA0_GLVWA2_GLVWB2_GSU1_GSUASB_LBSPPB1024_LPB2_LRVW1_NLCB1_PLR9_SVW1_TT1_16_VW1_WG16_4_4
    SolutionIndex: 257
    SolutionNameMin: Cijk_Ailk_Bljk_CB_UserArgs_MT32x32x32_MI16x16x4x1_SN_AMAS0_DTVA0_GLVWA2_GLVWB2_GSU12_GSUAMB_LBSPPB256_LPB4_LRVW2_NLCB1_PLR9_SVW1_TT1_16_VW1_WG32_8_1
    SolutionIndex: 258
    SolutionNameMin: Cijk_Ailk_Bljk_CB_UserArgs_MT32x16x64_MI16x16x4x1_SN_AMAS0_DTVA0_GLVWA2_GLVWB2_GSU1_GSUASB_LBSPPB512_LPB2_LRVW1_NLCA1_NLCB1_PLR5_SVW1_TT2_16_VW1_WG16_4_4
    SolutionIndex: 259
    SolutionNameMin: Cijk_Ailk_Bljk_CB_UserArgs_MT32x16x64_MI16x16x4x1_SN_AMAS3_DTVA1_GLVWA2_GLVWB2_GSU1_GSUASB_LBSPPB512_LPB2_LRVW1_NLCA1_NLCB1_PLR1_SVW2_TT2_16_VW2_WG16_4_4
    SolutionIndex: 260
    SolutionNameMin: Cijk_Ailk_Bljk_CB_UserArgs_MT64x32x32_MI16x16x4x1_SN_AMAS0_DTVA0_GLVWA2_GLVWB1_GSU8_GSUAMB_LBSPPB256_LPB1_LRVW1_NLCA1_NLCB1_PLR1_SVW1_TT2_32_VW1_WG32_4_2
    SolutionIndex: 261
    SolutionNameMin: Cijk_Ailk_Bljk_CB_UserArgs_MT32x16x64_MI16x16x4x1_SN_AMAS0_DTVA0_GLVWA2_GLVWB1_GSU1_GSUASB_LBSPPB512_LPB4_LRVW2_NLCA1_NLCB1_PLR9_SVW1_TT1_16_VW1_WG32_4_2
    SolutionIndex: 262
    SolutionNameMin: Cijk_Ailk_Bljk_CB_UserArgs_MT32x16x64_MI16x16x4x1_SN_AMAS0_DTVA0_GLVWA2_GLVWB2_GSU1_GSUASB_LBSPPB512_LPB4_LRVW2_NLCA1_NLCB1_PLR9_SVW1_TT1_16_VW1_WG32_4_2
    SolutionIndex: 263
    SolutionNameMin: Cijk_Ailk_Bljk_CB_UserArgs_MT64x64x16_MI16x16x4x1_SN_AMAS0_DTVA0_GLVWA2_GLVWB1_GSU14_GSUAMB_LBSPPB128_LPB4_LRVW2_NLCA1_NLCB1_PLR5_SVW1_TT4_16_VW1_WG16_16_1
    SolutionIndex: 264
    SolutionNameMin: Cijk_Ailk_Bljk_CB_UserArgs_MT64x16x32_MI16x16x4x1_SN_AMAS3_DTVA1_GLVWA2_GLVWB1_GSU1_GSUASB_LBSPPB256_LPB1_LRVW1_MIAV1_NLCA1_PLR1_SVW2_TT2_16_VW2_WG32_4_2
    SolutionIndex: 265
    SolutionNameMin: Cijk_Ailk_Bljk_CB_UserArgs_MT64x16x32_MI16x16x4x1_SN_AMAS3_DTVA1_GLVWA2_GLVWB2_GSU1_GSUASB_LBSPPB256_LPB4_LRVW2_MIAV1_NLCA1_PLR5_SVW2_TT2_16_VW2_WG32_4_2
    SolutionIndex: 266
    SolutionNameMin: Cijk_Ailk_Bljk_CB_UserArgs_MT128x32x16_MI16x16x4x1_SN_AMAS3_DTVA0_GLVWA2_GLVWB1_GSU7_GSUAMB_LBSPPB128_LPB1_LRVW1_MIAV1_NLCA1_PLR1_SVW2_TT2_32_VW2_WG64_4_1
    SolutionIndex: 267
    SolutionNameMin: Cijk_Ailk_Bljk_CB_UserArgs_MT64x32x64_MI16x16x4x1_SN_AMAS3_DTVA1_GLVWA2_GLVWB2_GSU1_GSUASB_LBSPPB512_LPB2_LRVW1_MIAV1_NLCA1_PLR1_SVW2_TT2_32_VW2_WG32_4_2
    SolutionIndex: 268
    SolutionNameMin: Cijk_Ailk_Bljk_CB_UserArgs_MT256x32x16_MI16x16x4x1_SN_AMAS3_DTVA1_GLVWA2_GLVWB1_GSU7_GSUAMB_LBSPPB128_LPB1_LRVW1_MIAV1_NLCA2_PLR5_SVW2_TT4_32_VW2_WG64_4_1
    SolutionIndex: 269
    SolutionNameMin: Cijk_Ailk_Bljk_CB_UserArgs_MT64x128x16_MI16x16x4x1_SN_AMAS0_DTVA0_GLVWA2_GLVWB2_GSU7_GSUAMB_LBSPPB128_LPB2_LRVW1_MIAV1_NLCA1_PLR1_SVW1_TT2_64_VW1_WG32_8_1
    SolutionIndex: 270
    SolutionNameMin: Cijk_Ailk_Bljk_CB_UserArgs_MT64x48x64_MI16x16x4x1_SN_AMAS3_DTVA1_GLVWA2_GLVWB2_GSU1_GSUASB_LBSPPB512_LPB2_LRVW1_MIAV1_NLCA1_PLR9_SVW2_TT2_48_VW2_WG32_4_2
    SolutionIndex: 271
    SolutionNameMin: Cijk_Ailk_Bljk_CB_UserArgs_MT64x32x64_MI16x16x4x1_SN_AMAS0_DTVA0_GLVWA2_GLVWB1_GSU1_GSUASB_LBSPPB512_LPB4_LRVW2_MIAV1_NLCA1_PLR17_SVW1_TT1_32_VW1_WG64_4_1
    SolutionIndex: 272
    SolutionNameMin: Cijk_Ailk_Bljk_CB_UserArgs_MT96x128x16_MI16x16x4x1_SN_AMAS0_DTVA0_GLVWA2_GLVWB2_GSU7_GSUAMB_LBSPPB128_LPB2_LRVW1_MIAV0_NLCA3_PLR1_SVW1_TT3_64_VW1_WG32_8_1
    SolutionIndex: 273
    SolutionNameMin: Cijk_Ailk_Bljk_CB_UserArgs_MT64x48x32_MI16x16x4x1_SN_AMAS3_DTVA1_GLVWA2_GLVWB2_GSU1_GSUASB_LBSPPB256_LPB2_LRVW1_MIAV1_NLCA1_PLR1_SVW2_TT2_48_VW2_WG32_4_2
    SolutionIndex: 274
    SolutionNameMin: Cijk_Ailk_Bljk_CB_UserArgs_MT32x80x16_MI16x16x4x1_SN_AMAS0_DTVA0_GLVWA2_GLVWB1_GSU1_GSUASB_LBSPPB128_LPB1_LRVW1_MIAV1_NLCA1_PLR3_SVW1_TT1_80_VW1_WG32_4_2
    SolutionIndex: 275
    SolutionNameMin: Cijk_Ailk_Bljk_CB_UserArgs_MT256x48x16_MI16x16x4x1_SN_AMAS3_DTVA1_GLVWA2_GLVWB1_GSU5_GSUAMB_LBSPPB128_LPB1_LRVW1_MIAV0_NLCA2_PLR5_SVW2_TT4_48_VW2_WG64_4_1
    SolutionIndex: 276
    SolutionNameMin: Cijk_Ailk_Bljk_CB_UserArgs_MT128x32x32_MI16x16x4x1_SN_AMAS0_DTVA0_GLVWA2_GLVWB2_GSU1_GSUASB_LBSPPB256_LPB2_LRVW1_MIAV1_NLCA1_PLR1_SVW1_TT4_32_VW1_WG32_4_2
    SolutionIndex: 277
    SolutionNameMin: Cijk_Ailk_Bljk_CB_UserArgs_MT64x64x16_MI16x16x4x1_SN_AMAS3_DTVA1_GLVWA2_GLVWB1_GSU1_GSUASB_LBSPPB128_LPB1_LRVW1_MIAV1_NLCA1_PLR1_SVW2_TT2_64_VW2_WG32_4_2
    SolutionIndex: 278
    SolutionNameMin: Cijk_Ailk_Bljk_CB_UserArgs_MT256x128x16_MI16x16x4x1_SN_AMAS3_DTVA1_GLVWA2_GLVWB2_GSU9_GSUAMB_LBSPPB128_LPB2_LRVW1_MIAV0_NLCA2_PLR1_SVW2_TT4_128_VW2_WG64_4_1
    SolutionIndex: 279
    SolutionNameMin: Cijk_Ailk_Bljk_CB_UserArgs_MT96x64x32_MI16x16x4x1_SN_AMAS0_DTVA0_GLVWA2_GLVWB2_GSU1_GSUASB_LBSPPB256_LPB4_LRVW2_MIAV1_NTC3_NTD3_NLCA3_PLR9_SVW1_TT3_32_VW1_WG32_8_1_WGM1
    SolutionIndex: 280
    SolutionNameMin: Cijk_Ailk_Bljk_CB_UserArgs_MT64x80x32_MI16x16x4x1_SN_AMAS0_DTVA0_GLVWA2_GLVWB2_GSU1_GSUASB_LBSPPB256_LPB2_LRVW1_MIAV1_NTC3_NTD3_NLCA1_PLR1_SVW1_TT1_80_VW1_WG64_4_1_WGM1
    SolutionIndex: 281
    SolutionNameMin: Cijk_Ailk_Bljk_CB_UserArgs_MT64x80x16_MI16x16x4x1_SN_AMAS0_DTVA0_GLVWA2_GLVWB1_GSU1_GSUASB_LBSPPB128_LPB1_LRVW1_MIAV1_NTC3_NTD3_NLCA1_PLR1_SVW1_TT1_80_VW1_WG64_4_1_WGM1
    SolutionIndex: 282
    SolutionNameMin: Cijk_Ailk_Bljk_CB_UserArgs_MT128x80x32_MI16x16x4x1_SN_AMAS3_DTVA1_GLVWA2_GLVWB2_GSU1_GSUASB_LBSPPB256_LPB2_LRVW1_MIAV1_NTC3_NTD3_NLCA1_PLR1_SVW2_TT2_80_VW2_WG64_4_1_WGMn12
    SolutionIndex: 283
    SolutionNameMin: Cijk_Ailk_Bljk_CB_UserArgs_MT224x32x16_MI16x16x4x1_SN_AMAS0_DTVA0_GLVWA2_GLVWB2_GSU1_GSUASB_LBSPPB128_LPB4_LRVW2_MIAV1_NTC3_NTD3_NLCA7_PLR5_SVW1_TT7_16_VW1_WG32_8_1_WGM1
    SolutionIndex: 284
    SolutionNameMin: Cijk_Ailk_Bljk_CB_UserArgs_MT128x176x16_MI16x16x4x1_SN_AMAS0_DTVA0_GLVWA2_GLVWB1_GSU3_GSUAMB_LBSPPB128_LPB1_LRVW1_MIAV0_NTC0_NTD0_NLCA1_PLR1_SVW1_TT2_176_VW1_WG64_4_1_WGM1
    SolutionIndex: 285
    SolutionNameMin: Cijk_Ailk_Bljk_CB_UserArgs_MT128x80x16_MI16x16x4x1_SN_AMAS0_DTVA0_GLVWA2_GLVWB1_GSU1_GSUASB_LBSPPB128_LPB4_LRVW2_MIAV1_NTC3_NTD3_NLCA1_PLR5_SVW1_TT2_80_VW1_WG64_4_1_WGM1
    SolutionIndex: 286
    SolutionNameMin: Cijk_Ailk_Bljk_CB_UserArgs_MT128x80x16_MI16x16x4x1_SN_AMAS0_DTVA0_GLVWA2_GLVWB1_GSU1_GSUASB_LBSPPB128_LPB1_LRVW1_MIAV1_NTC0_NTD0_NLCA1_PLR1_SVW1_TT2_80_VW1_WG64_4_1_WGM1
    SolutionIndex: 287
    SolutionNameMin: Cijk_Ailk_Bljk_CB_UserArgs_MT128x80x32_MI16x16x4x1_SN_AMAS3_DTVA1_GLVWA2_GLVWB1_GSU1_GSUASB_LBSPPB256_LPB1_LRVW1_MIAV1_NTC3_NTD3_NLCA1_PLR1_SVW2_TT2_80_VW2_WG64_4_1_WGMn12
    SolutionIndex: 288
    SolutionNameMin: Cijk_Ailk_Bljk_CB_UserArgs_MT256x80x32_MI16x16x4x1_SN_AMAS3_DTVA1_GLVWB2_GSU1_GSUASB_LBSPPB256_LPB2_LRVW1_NTC0_NTD0_NLCA2_PLR1_SVW2_TT4_80_VW2_WG64_4_1
    SolutionIndex: 289
    SolutionNameMin: Cijk_Ailk_Bljk_CB_UserArgs_MT224x64x16_MI16x16x4x1_SN_AMAS0_DTVA0_GLVWB2_GSU1_GSUASB_LBSPPB128_LPB4_LRVW2_NTC0_NTD0_NLCA7_PLR5_SVW1_TT7_32_VW1_WG32_8_1
    SolutionIndex: 290
    SolutionNameMin: Cijk_Ailk_Bljk_CB_UserArgs_MT112x128x32_MI16x16x4x1_SN_AMAS0_DTVA0_GLVWB2_GSU1_GSUASB_LBSPPB256_LPB2_LRVW1_NTC3_NTD3_NLCA7_PLR1_SVW1_TT7_32_VW1_WG16_16_1
    SolutionIndex: 291
    SolutionNameMin: Cijk_Ailk_Bljk_CB_UserArgs_MT256x128x8_MI16x16x4x1_SN_AMAS3_DTVA0_GLVWB1_GSU1_GSUASB_LBSPPB128_LPB1_LRVW1_NTC3_NTD3_NLCA1_PLR1_SVW2_TT4_128_VW2_WG64_4_1
    SolutionIndex: 292
    SolutionNameMin: Cijk_Ailk_Bljk_CB_UserArgs_MT256x80x16_MI16x16x4x1_SN_AMAS0_DTVA0_GLVWB1_GSU1_GSUASB_LBSPPB128_LPB1_LRVW1_NTC3_NTD3_NLCA1_PLR1_SVW1_TT4_80_VW1_WG64_4_1
    SolutionIndex: 293
    SolutionNameMin: Cijk_Ailk_Bljk_CB_UserArgs_MT160x128x16_MI16x16x4x1_SN_AMAS0_DTVA0_GLVWB2_GSU1_GSUASB_LBSPPB128_LPB2_LRVW1_NTC0_NTD0_NLCA5_PLR1_SVW1_TT5_64_VW1_WG32_8_1
    SolutionIndex: 294
    SolutionNameMin: Cijk_Ailk_Bljk_CB_UserArgs_MT256x128x16_MI16x16x4x1_SN_AMAS3_DTVA0_GLVWB2_GSU1_GSUASB_LBSPPB128_LPB2_LRVW1_NTC3_NTD3_NLCA1_PLR1_SVW2_TT4_128_VW2_WG64_4_1
    SolutionIndex: 295
    SolutionNameMin: Cijk_Ailk_Bljk_CB_UserArgs_MT224x128x16_MI16x16x4x1_SN_AMAS0_DTVA0_GLVWB2_GSU1_GSUASB_LBSPPB128_LPB2_LRVW1_NTC0_NTD0_NLCA7_PLR1_SVW1_TT7_64_VW1_WG32_8_1
    SolutionIndex: 296
    SolutionNameMin: Cijk_Ailk_Bljk_CB_UserArgs_MT224x128x16_MI16x16x4x1_SN_AMAS0_DTVA0_GLVWB1_GSU1_GSUASB_LBSPPB128_LPB1_LRVW1_NTC3_NTD3_NLCA7_PLR1_SVW1_TT7_64_VW1_WG32_8_1
    SolutionIndex: 297
    SolutionNameMin: Cijk_Ailk_Bljk_CB_UserArgs_MT96x128x32_MI16x16x4x1_SN_AMAS0_DTVA0_GLVWB2_GSU1_GSUASB_LBSPPB256_LPB2_LRVW1_NTC3_NTD3_NLCA3_PLR1_SVW1_TT3_64_VW1_WG32_8_1
    SolutionIndex: 298
    SolutionNameMin: Cijk_Ailk_Bljk_CB_UserArgs_MT96x128x16_MI16x16x4x1_SN_AMAS0_DTVA0_GLVWB2_GSU1_GSUASB_LBSPPB128_LPB2_LRVW1_NTC3_NTD3_NLCA3_PLR5_SVW1_TT3_64_VW1_WG32_8_1
    SolutionIndex: 299
    SolutionNameMin: Cijk_Ailk_Bljk_CB_UserArgs_MT96x128x16_MI16x16x4x1_SN_AMAS0_DTVA0_GLVWB2_GSU1_GSUASB_LBSPPB128_LPB2_LRVW1_NTC0_NTD0_NLCA3_PLR5_SVW1_TT3_64_VW1_WG32_8_1
    SolutionIndex: 300
    SolutionNameMin: Cijk_Ailk_Bljk_CB_UserArgs_MT16x16x128_MI16x16x4x1_SN_DTVA0_GLVWB2_GSU1_GSUASB_LBSPPB1024_LPB4_LRVW2_NLCB1_PLR9_TT1_16_WG16_4_4
    SolutionIndex: 301
    SolutionNameMin: Cijk_Ailk_Bljk_CB_UserArgs_MT16x16x64_MI16x16x4x1_SN_DTVA1_GLVWB2_GSU1_GSUASB_LBSPPB512_LPB2_LRVW1_NLCB1_PLR5_TT1_16_WG16_4_4
    SolutionIndex: 302
    SolutionNameMin: Cijk_Ailk_Bljk_CB_UserArgs_MT16x64x32_MI16x16x4x1_SN_DTVA0_GLVWB2_GSU11_GSUAMB_LBSPPB256_LPB2_LRVW1_NLCB1_PLR9_TT1_16_WG16_16_1
    SolutionIndex: 303
    SolutionNameMin: Cijk_Ailk_Bljk_CB_UserArgs_MT16x32x128_MI16x16x4x1_SN_DTVA1_GLVWB2_GSU4_GSUAMB_LBSPPB1024_LPB2_LRVW1_NLCB1_PLR1_TT1_32_WG16_4_4
    SolutionIndex: 304
    SolutionNameMin: Cijk_Ailk_Bljk_CB_UserArgs_MT16x16x256_MI16x16x4x1_SN_DTVA1_GLVWB1_GSU1_GSUASB_LBSPPB2048_LPB1_LRVW1_NLCB1_PLR17_TT1_16_WG16_4_4
    SolutionIndex: 305
    SolutionNameMin: Cijk_Ailk_Bljk_CB_UserArgs_MT16x16x128_MI16x16x4x1_SN_DTVA0_GLVWB2_GSU1_GSUASB_LBSPPB1024_LPB2_LRVW1_NLCB1_PLR9_TT1_16_WG16_4_4
    SolutionIndex: 306
    SolutionNameMin: Cijk_Ailk_Bljk_CB_UserArgs_MT16x32x64_MI16x16x4x1_SN_DTVA1_GLVWB2_GSU3_GSUAMB_LBSPPB512_LPB4_LRVW2_NLCB1_PLR5_TT1_32_WG16_4_4
    SolutionIndex: 307
    SolutionNameMin: Cijk_Ailk_Bljk_CB_UserArgs_MT16x16x128_MI16x16x4x1_SN_DTVA0_GLVWA2_GLVWB2_GSU1_GSUASB_LBSPPB1024_LPB2_LRVW1_NLCB1_PLR9_TT1_16_WG16_4_4
    SolutionIndex: 308
    SolutionNameMin: Cijk_Ailk_Bljk_CB_UserArgs_MT16x16x128_MI16x16x4x1_SN_DTVA0_GLVWA2_GLVWB2_GSU1_GSUASB_LBSPPB1024_LPB4_LRVW2_NLCB1_PLR9_TT1_16_WG16_4_4
    SolutionIndex: 309
    SolutionNameMin: Cijk_Ailk_Bljk_CB_UserArgs_MT16x32x128_MI16x16x4x1_SN_DTVA0_GLVWA2_GLVWB2_GSU4_GSUAMB_LBSPPB1024_LPB2_LRVW1_NLCB1_PLR17_TT1_16_WG16_8_2
    SolutionIndex: 310
    SolutionNameMin: Cijk_Ailk_Bljk_CB_UserArgs_MT16x16x128_MI16x16x4x1_SN_DTVA0_GLVWA2_GLVWB1_GSU1_GSUASB_LBSPPB1024_LPB4_LRVW2_NLCB1_PLR9_TT1_16_WG16_4_4
    SolutionIndex: 311
    SolutionNameMin: Cijk_Ailk_Bljk_CB_UserArgs_MT16x16x64_MI16x16x4x1_SN_AMAS0_DTVA0_GLVWA2_GLVWB2_GSU1_GSUASB_LBSPPB512_LPB2_LRVW1_NLCB1_PLR9_SVW1_TT1_16_VW1_WG16_4_2
    SolutionIndex: 312
    SolutionNameMin: Cijk_Ailk_Bljk_CB_UserArgs_MT32x16x64_MI16x16x4x1_SN_AMAS0_DTVA0_GLVWA2_GLVWB1_GSU3_GSUAMB_LBSPPB512_LPB4_LRVW2_NLCB1_PLR9_SVW1_TT1_16_VW1_WG32_4_2
    SolutionIndex: 313
    SolutionNameMin: Cijk_Ailk_Bljk_CB_UserArgs_MT32x16x128_MI16x16x4x1_SN_AMAS0_DTVA0_GLVWA2_GLVWB1_GSU4_GSUAMB_LBSPPB1024_LPB1_LRVW1_NLCB1_PLR17_SVW1_TT1_16_VW1_WG32_4_2
    SolutionIndex: 314
    SolutionNameMin: Cijk_Ailk_Bljk_CB_UserArgs_MT16x16x64_MI16x16x4x1_SN_AMAS0_DTVA0_GLVWA2_GLVWB1_GSU1_GSUASB_LBSPPB512_LPB4_LRVW2_NLCB1_PLR9_SVW1_TT1_16_VW1_WG16_4_2
    SolutionIndex: 315
    SolutionNameMin: Cijk_Ailk_Bljk_CB_UserArgs_MT32x16x32_MI16x16x4x1_SN_AMAS0_DTVA0_GLVWA2_GLVWB1_GSU3_GSUAMB_LBSPPB256_LPB1_LRVW1_NLCB1_PLR5_SVW1_TT1_16_VW1_WG32_4_2
    SolutionIndex: 316
    SolutionNameMin: Cijk_Ailk_Bljk_CB_UserArgs_MT32x32x32_MI16x16x4x1_SN_AMAS0_DTVA0_GLVWA2_GLVWB2_GSU7_GSUAMB_LBSPPB256_LPB4_LRVW2_NLCB1_PLR9_SVW1_TT1_16_VW1_WG32_8_1
    SolutionIndex: 317
    SolutionNameMin: Cijk_Ailk_Bljk_CB_UserArgs_MT32x32x16_MI16x16x4x1_SN_AMAS0_DTVA0_GLVWA2_GLVWB1_GSU4_GSUAMB_LBSPPB128_LPB1_LRVW1_NLCB1_PLR1_SVW1_TT2_16_VW1_WG16_8_2
    SolutionIndex: 318
    SolutionNameMin: Cijk_Ailk_Bljk_CB_UserArgs_MT32x64x32_MI16x16x4x1_SN_AMAS0_DTVA0_GLVWA2_GLVWB2_GSU8_GSUAMB_LBSPPB256_LPB4_LRVW2_NLCB1_PLR9_SVW1_TT1_32_VW1_WG32_8_1
    SolutionIndex: 319
    SolutionNameMin: Cijk_Ailk_Bljk_CB_UserArgs_MT32x16x64_MI16x16x4x1_SN_AMAS0_DTVA0_GLVWA2_GLVWB1_GSU1_GSUASB_LBSPPB512_LPB1_LRVW1_NLCA1_NLCB1_PLR5_SVW1_TT2_16_VW1_WG16_4_4
    SolutionIndex: 320
    SolutionNameMin: Cijk_Ailk_Bljk_CB_UserArgs_MT32x16x64_MI16x16x4x1_SN_AMAS3_DTVA0_GLVWA2_GLVWB2_GSU1_GSUASB_LBSPPB512_LPB4_LRVW2_NLCA1_NLCB1_PLR5_SVW2_TT2_16_VW2_WG16_4_4
    SolutionIndex: 321
    SolutionNameMin: Cijk_Ailk_Bljk_CB_UserArgs_MT64x48x32_MI16x16x4x1_SN_AMAS0_DTVA0_GLVWA2_GLVWB2_GSU10_GSUAMB_LBSPPB256_LPB2_LRVW1_NLCA1_NLCB1_PLR1_SVW1_TT1_48_VW1_WG64_4_1
    SolutionIndex: 322
    SolutionNameMin: Cijk_Ailk_Bljk_CB_UserArgs_MT32x16x64_MI16x16x4x1_SN_AMAS3_DTVA1_GLVWA2_GLVWB2_GSU1_GSUASB_LBSPPB512_LPB4_LRVW2_NLCA1_NLCB1_PLR5_SVW2_TT2_16_VW2_WG16_4_4
    SolutionIndex: 323
    SolutionNameMin: Cijk_Ailk_Bljk_CB_UserArgs_MT32x16x32_MI16x16x4x1_SN_AMAS3_DTVA1_GLVWA2_GLVWB2_GSU1_GSUASB_LBSPPB256_LPB2_LRVW1_NLCA1_NLCB1_PLR1_SVW2_TT2_16_VW2_WG16_4_4
    SolutionIndex: 324
    SolutionNameMin: Cijk_Ailk_Bljk_CB_UserArgs_MT64x64x16_MI16x16x4x1_SN_AMAS0_DTVA0_GLVWA2_GLVWB2_GSU14_GSUAMB_LBSPPB128_LPB2_LRVW1_NLCA1_NLCB1_PLR1_SVW1_TT1_64_VW1_WG64_4_1
    SolutionIndex: 325
    SolutionNameMin: Cijk_Ailk_Bljk_CB_UserArgs_MT32x32x32_MI16x16x4x1_SN_AMAS3_DTVA1_GLVWA2_GLVWB2_GSU1_GSUASB_LBSPPB256_LPB2_LRVW1_NLCA1_NLCB1_PLR3_SVW2_TT2_32_VW2_WG16_4_4
    SolutionIndex: 326
    SolutionNameMin: Cijk_Ailk_Bljk_CB_UserArgs_MT64x16x64_MI16x16x4x1_SN_AMAS3_DTVA1_GLVWA2_GLVWB1_GSU1_GSUASB_LBSPPB512_LPB4_LRVW2_NLCA2_NLCB1_PLR5_SVW2_TT4_16_VW2_WG16_4_4
    SolutionIndex: 327
    SolutionNameMin: Cijk_Ailk_Bljk_CB_UserArgs_MT64x48x64_MI16x16x4x1_SN_AMAS0_DTVA0_GLVWA2_GLVWB2_GSU7_GSUAMB_LBSPPB512_LPB4_LRVW2_NLCA1_NLCB1_PLR9_SVW1_TT2_48_VW1_WG32_4_2
    SolutionIndex: 328
    SolutionNameMin: Cijk_Ailk_Bljk_CB_UserArgs_MT16x32x32_MI16x16x4x1_SN_AMAS0_DTVA0_GLVWA2_GLVWB2_GSU1_GSUASB_LBSPPB256_LPB2_LRVW1_MIAV1_NLCA1_NLCB1_PLR5_SVW1_TT1_16_VW1_WG16_8_2
    SolutionIndex: 329
    SolutionNameMin: Cijk_Ailk_Bljk_CB_UserArgs_MT128x32x16_MI16x16x4x1_SN_AMAS0_DTVA0_GLVWA2_GLVWB1_GSU9_GSUAMB_LBSPPB128_LPB1_LRVW1_MIAV1_NLCA1_NLCB1_PLR1_SVW1_TT2_32_VW1_WG64_4_1
    SolutionIndex: 330
    SolutionNameMin: Cijk_Ailk_Bljk_CB_UserArgs_MT128x32x32_MI16x16x4x1_SN_AMAS3_DTVA1_GLVWA2_GLVWB1_GSU9_GSUAMB_LBSPPB256_LPB1_LRVW1_MIAV1_NLCA1_NLCB1_PLR1_SVW2_TT2_32_VW2_WG64_4_1
    SolutionIndex: 331
    SolutionNameMin: Cijk_Ailk_Bljk_CB_UserArgs_MT64x16x32_MI16x16x4x1_SN_AMAS3_DTVA1_GLVWA2_GLVWB1_GSU1_GSUASB_LBSPPB256_LPB1_LRVW1_MIAV1_NLCA2_NLCB1_PLR3_SVW2_TT4_16_VW2_WG16_4_4
    SolutionIndex: 332
    SolutionNameMin: Cijk_Ailk_Bljk_CB_UserArgs_MT64x16x32_MI16x16x4x1_SN_AMAS3_DTVA1_GLVWA2_GLVWB1_GSU1_GSUASB_LBSPPB256_LPB1_LRVW1_MIAV1_NLCA1_NLCB1_PLR1_SVW2_TT2_16_VW2_WG32_4_2
    SolutionIndex: 333
    SolutionNameMin: Cijk_Ailk_Bljk_CB_UserArgs_MT128x32x32_MI16x16x4x1_SN_AMAS3_DTVA1_GLVWA2_GLVWB2_GSU7_GSUAMB_LBSPPB256_LPB4_LRVW2_MIAV1_NLCA1_NLCB1_PLR9_SVW2_TT2_32_VW2_WG64_4_1
    SolutionIndex: 334
    SolutionNameMin: Cijk_Ailk_Bljk_CB_UserArgs_MT64x16x128_MI16x16x4x1_SN_AMAS3_DTVA1_GLVWA2_GLVWB1_GSU1_GSUASB_LBSPPB1024_LPB1_LRVW1_MIAV1_NLCA2_NLCB1_PLR9_SVW2_TT4_16_VW2_WG16_4_4
    SolutionIndex: 335
    SolutionNameMin: Cijk_Ailk_Bljk_CB_UserArgs_MT64x16x32_MI16x16x4x1_SN_AMAS3_DTVA1_GLVWA2_GLVWB1_GSU1_GSUASB_LBSPPB256_LPB4_LRVW2_MIAV1_NLCA1_NLCB1_PLR5_SVW2_TT2_16_VW2_WG32_4_2
    SolutionIndex: 336
    SolutionNameMin: Cijk_Ailk_Bljk_CB_UserArgs_MT128x32x32_MI16x16x4x1_SN_AMAS3_DTVA1_GLVWA2_GLVWB2_GSU9_GSUAMB_LBSPPB256_LPB4_LRVW2_MIAV1_NLCA1_NLCB1_PLR9_SVW2_TT2_32_VW2_WG64_4_1
    SolutionIndex: 337
    SolutionNameMin: Cijk_Ailk_Bljk_CB_UserArgs_MT64x32x16_MI16x16x4x1_SN_AMAS3_DTVA1_GLVWA2_GLVWB1_GSU1_GSUASB_LBSPPB128_LPB1_LRVW1_MIAV1_NLCA1_PLR3_SVW2_TT2_32_VW2_WG32_4_2
    SolutionIndex: 338
    SolutionNameMin: Cijk_Ailk_Bljk_CB_UserArgs_MT64x16x32_MI16x16x4x1_SN_AMAS0_DTVA0_GLVWA2_GLVWB2_GSU1_GSUASB_LBSPPB256_LPB4_LRVW2_MIAV1_NLCA1_PLR5_SVW1_TT2_16_VW1_WG32_4_2
    SolutionIndex: 339
    SolutionNameMin: Cijk_Ailk_Bljk_CB_UserArgs_MT128x48x16_MI16x16x4x1_SN_AMAS3_DTVA1_GLVWA2_GLVWB1_GSU7_GSUAMB_LBSPPB128_LPB1_LRVW1_MIAV1_NLCA1_PLR5_SVW2_TT2_48_VW2_WG64_4_1
    SolutionIndex: 340
    SolutionNameMin: Cijk_Ailk_Bljk_CB_UserArgs_MT128x16x32_MI16x16x4x1_SN_AMAS3_DTVA1_GLVWA2_GLVWB1_GSU1_GSUASB_LBSPPB256_LPB1_LRVW1_MIAV1_NLCA2_PLR1_SVW2_TT4_16_VW2_WG32_4_2
    SolutionIndex: 341
    SolutionNameMin: Cijk_Ailk_Bljk_CB_UserArgs_MT256x32x16_MI16x16x4x1_SN_AMAS3_DTVA1_GLVWA2_GLVWB1_GSU7_GSUAMB_LBSPPB128_LPB1_LRVW1_MIAV1_NLCA2_PLR5_SVW2_TT4_32_VW2_WG64_4_1
    SolutionIndex: 342
    SolutionNameMin: Cijk_Ailk_Bljk_CB_UserArgs_MT128x64x16_MI16x16x4x1_SN_AMAS3_DTVA1_GLVWA2_GLVWB2_GSU7_GSUAMB_LBSPPB128_LPB4_LRVW2_MIAV1_NLCA1_PLR5_SVW2_TT2_64_VW2_WG64_4_1
    SolutionIndex: 343
    SolutionNameMin: Cijk_Ailk_Bljk_CB_UserArgs_MT32x32x16_MI16x16x4x1_SN_AMAS0_DTVA0_GLVWA2_GLVWB1_GSU1_GSUASB_LBSPPB128_LPB1_LRVW1_MIAV1_NLCA1_PLR1_SVW1_TT1_16_VW1_WG32_8_1
    SolutionIndex: 344
    SolutionNameMin: Cijk_Ailk_Bljk_CB_UserArgs_MT64x32x32_MI16x16x4x1_SN_AMAS3_DTVA1_GLVWA2_GLVWB2_GSU1_GSUASB_LBSPPB256_LPB2_LRVW1_MIAV1_NLCA1_PLR1_SVW2_TT2_32_VW2_WG32_4_2
    SolutionIndex: 345
    SolutionNameMin: Cijk_Ailk_Bljk_CB_UserArgs_MT128x96x16_MI16x16x4x1_SN_AMAS3_DTVA1_GLVWA2_GLVWB2_GSU7_GSUAMB_LBSPPB128_LPB2_LRVW1_MIAV0_NLCA1_PLR1_SVW2_TT2_96_VW2_WG64_4_1
    SolutionIndex: 346
    SolutionNameMin: Cijk_Ailk_Bljk_CB_UserArgs_MT64x48x64_MI16x16x4x1_SN_AMAS0_DTVA0_GLVWA2_GLVWB1_GSU1_GSUASB_LBSPPB512_LPB1_LRVW1_MIAV1_NLCA1_PLR17_SVW1_TT1_48_VW1_WG64_4_1
    SolutionIndex: 347
    SolutionNameMin: Cijk_Ailk_Bljk_CB_UserArgs_MT128x96x16_MI16x16x4x1_SN_AMAS3_DTVA1_GLVWA2_GLVWB2_GSU7_GSUAMB_LBSPPB128_LPB4_LRVW2_MIAV0_NLCA1_PLR5_SVW2_TT2_96_VW2_WG64_4_1
    SolutionIndex: 348
    SolutionNameMin: Cijk_Ailk_Bljk_CB_UserArgs_MT128x96x16_MI16x16x4x1_SN_AMAS3_DTVA1_GLVWA2_GLVWB1_GSU7_GSUAMB_LBSPPB128_LPB1_LRVW1_MIAV0_NLCA1_PLR1_SVW2_TT2_96_VW2_WG64_4_1
    SolutionIndex: 349
    SolutionNameMin: Cijk_Ailk_Bljk_CB_UserArgs_MT32x80x32_MI16x16x4x1_SN_AMAS0_DTVA0_GLVWA2_GLVWB2_GSU1_GSUASB_LBSPPB256_LPB2_LRVW1_MIAV1_NLCA1_PLR1_SVW1_TT1_80_VW1_WG32_4_2
    SolutionIndex: 350
    SolutionNameMin: Cijk_Ailk_Bljk_CB_UserArgs_MT128x96x16_MI16x16x4x1_SN_AMAS3_DTVA1_GLVWA2_GLVWB2_GSU5_GSUAMB_LBSPPB128_LPB2_LRVW1_MIAV0_NLCA1_PLR1_SVW2_TT2_96_VW2_WG64_4_1
    SolutionIndex: 351
    SolutionNameMin: Cijk_Ailk_Bljk_CB_UserArgs_MT64x64x32_MI16x16x4x1_SN_AMAS3_DTVA1_GLVWA2_GLVWB1_GSU1_GSUASB_LBSPPB256_LPB1_LRVW1_MIAV1_NLCA1_PLR1_SVW2_TT2_64_VW2_WG32_4_2
    SolutionIndex: 352
    SolutionNameMin: Cijk_Ailk_Bljk_CB_UserArgs_MT32x112x32_MI16x16x4x1_SN_AMAS0_DTVA0_GLVWA2_GLVWB2_GSU1_GSUASB_LBSPPB256_LPB2_LRVW1_MIAV1_NLCA1_PLR1_SVW1_TT1_112_VW1_WG32_4_2
    SolutionIndex: 353
    SolutionNameMin: Cijk_Ailk_Bljk_CB_UserArgs_MT64x64x32_MI16x16x4x1_SN_AMAS0_DTVA0_GLVWA2_GLVWB2_GSU1_GSUASB_LBSPPB256_LPB2_LRVW1_MIAV1_NLCA1_PLR9_SVW1_TT2_32_VW1_WG32_8_1
    SolutionIndex: 354
    SolutionNameMin: Cijk_Ailk_Bljk_CB_UserArgs_MT128x112x32_MI16x16x4x1_SN_AMAS3_DTVA1_GLVWA2_GLVWB2_GSU5_GSUAMB_LBSPPB256_LPB2_LRVW1_MIAV0_NLCA1_PLR1_SVW2_TT2_112_VW2_WG64_4_1
    SolutionIndex: 355
    SolutionNameMin: Cijk_Ailk_Bljk_CB_UserArgs_MT128x32x8_MI16x16x4x1_SN_AMAS0_DTVA0_GLVWA2_GLVWB1_GSU1_GSUASB_LBSPPB128_LPB1_LRVW1_MIAV1_NLCA1_PLR1_SVW1_TT2_32_VW1_WG64_4_1
    SolutionIndex: 356
    SolutionNameMin: Cijk_Ailk_Bljk_CB_UserArgs_MT64x112x32_MI16x16x4x1_SN_AMAS0_DTVA0_GLVWA2_GLVWB2_GSU2_GSUAMB_LBSPPB256_LPB4_LRVW2_MIAV1_NLCA1_PLR9_SVW1_TT1_112_VW1_WG64_4_1
    SolutionIndex: 357
    SolutionNameMin: Cijk_Ailk_Bljk_CB_UserArgs_MT64x112x16_MI16x16x4x1_SN_AMAS0_DTVA0_GLVWA2_GLVWB1_GSU2_GSUAMB_LBSPPB128_LPB4_LRVW2_MIAV1_NLCA1_PLR5_SVW1_TT1_112_VW1_WG64_4_1
    SolutionIndex: 358
    SolutionNameMin: Cijk_Ailk_Bljk_CB_UserArgs_MT64x32x8_MI16x16x4x1_SN_AMAS0_DTVA0_GLVWA2_GLVWB1_GSU1_GSUASB_LBSPPB128_LPB1_LRVW1_MIAV1_NLCA1_PLR1_SVW1_TT1_32_VW1_WG64_4_1
    SolutionIndex: 359
    SolutionNameMin: Cijk_Ailk_Bljk_CB_UserArgs_MT96x64x16_MI16x16x4x1_SN_AMAS0_DTVA0_GLVWA2_GLVWB1_GSU1_GSUASB_LBSPPB128_LPB1_LRVW1_MIAV1_NLCA3_PLR1_SVW1_TT3_32_VW1_WG32_8_1
    SolutionIndex: 360
    SolutionNameMin: Cijk_Ailk_Bljk_CB_UserArgs_MT64x96x16_MI16x16x4x1_SN_AMAS3_DTVA0_GLVWA2_GLVWB2_GSU1_GSUASB_LBSPPB128_LPB4_LRVW2_MIAV1_NLCA1_PLR5_SVW2_TT2_48_VW2_WG32_8_1
    SolutionIndex: 361
    SolutionNameMin: Cijk_Ailk_Bljk_CB_UserArgs_MT32x64x8_MI16x16x4x1_SN_AMAS0_DTVA0_GLVWA1_GLVWB1_GSU1_GSUASB_LBSPPB128_LPB1_LRVW1_MIAV1_NLCA1_PLR1_SVW1_TT1_32_VW1_WG32_8_1
    SolutionIndex: 362
    SolutionNameMin: Cijk_Ailk_Bljk_CB_UserArgs_MT64x64x16_MI16x16x4x1_SN_AMAS0_DTVA0_GLVWA2_GLVWB1_GSU1_GSUASB_LBSPPB128_LPB1_LRVW1_MIAV1_NLCA1_PLR5_SVW1_TT2_32_VW1_WG32_8_1
    SolutionIndex: 363
    SolutionNameMin: Cijk_Ailk_Bljk_CB_UserArgs_MT256x80x32_MI16x16x4x1_SN_AMAS3_DTVA1_GLVWA2_GLVWB2_GSU5_GSUAMB_LBSPPB256_LPB4_LRVW2_MIAV0_NLCA2_PLR9_SVW2_TT4_80_VW2_WG64_4_1
    SolutionIndex: 364
    SolutionNameMin: Cijk_Ailk_Bljk_CB_UserArgs_MT64x80x16_MI16x16x4x1_SN_AMAS0_DTVA0_GLVWA2_GLVWB1_GSU1_GSUASB_LBSPPB128_LPB1_LRVW1_MIAV1_NLCA1_PLR1_SVW1_TT1_80_VW1_WG64_4_1
    SolutionIndex: 365
    SolutionNameMin: Cijk_Ailk_Bljk_CB_UserArgs_MT112x64x32_MI16x16x4x1_SN_AMAS0_DTVA0_GLVWA2_GLVWB1_GSU1_GSUASB_LBSPPB256_LPB1_LRVW1_MIAV1_NLCA7_PLR1_SVW1_TT7_16_VW1_WG16_16_1
    SolutionIndex: 366
    SolutionNameMin: Cijk_Ailk_Bljk_CB_UserArgs_MT64x64x16_MI16x16x4x1_SN_AMAS3_DTVA0_GLVWA2_GLVWB1_GSU1_GSUASB_LBSPPB128_LPB4_LRVW2_MIAV1_NLCA1_PLR5_SVW2_TT2_32_VW2_WG32_8_1
    SolutionIndex: 367
    SolutionNameMin: Cijk_Ailk_Bljk_CB_UserArgs_MT64x352x16_MI16x16x4x1_SN_AMAS0_DTVA0_GLVWA2_GLVWB2_GSU3_GSUAMB_LBSPPB128_LPB4_LRVW2_MIAV0_NLCA1_PLR5_SVW1_TT1_352_VW1_WG64_4_1
    SolutionIndex: 368
    SolutionNameMin: Cijk_Ailk_Bljk_CB_UserArgs_MT64x48x16_MI16x16x4x1_SN_AMAS0_DTVA0_GLVWA2_GLVWB1_GSU1_GSUASB_LBSPPB128_LPB1_LRVW1_MIAV1_NLCA1_PLR1_SVW1_TT1_48_VW1_WG64_4_1
    SolutionIndex: 369
    SolutionNameMin: Cijk_Ailk_Bljk_CB_UserArgs_MT64x96x8_MI16x16x4x1_SN_AMAS0_DTVA0_GLVWA2_GLVWB1_GSU1_GSUASB_LBSPPB128_LPB1_LRVW1_MIAV1_NLCA1_PLR3_SVW1_TT1_96_VW1_WG64_4_1
    SolutionIndex: 370
    SolutionNameMin: Cijk_Ailk_Bljk_CB_UserArgs_MT256x112x16_MI16x16x4x1_SN_AMAS3_DTVA1_GLVWA2_GLVWB1_GSU5_GSUAMB_LBSPPB128_LPB1_LRVW1_MIAV0_NLCA2_PLR1_SVW2_TT4_112_VW2_WG64_4_1
    SolutionIndex: 371
    SolutionNameMin: Cijk_Ailk_Bljk_CB_UserArgs_MT64x64x16_MI16x16x4x1_SN_AMAS0_DTVA0_GLVWA2_GLVWB2_GSU1_GSUASB_LBSPPB128_LPB2_LRVW1_MIAV1_NLCA1_PLR1_SVW1_TT2_32_VW1_WG32_8_1
    SolutionIndex: 372
    SolutionNameMin: Cijk_Ailk_Bljk_CB_UserArgs_MT64x112x16_MI16x16x4x1_SN_AMAS0_DTVA0_GLVWA2_GLVWB1_GSU1_GSUASB_LBSPPB128_LPB1_LRVW1_MIAV1_NLCA1_PLR5_SVW1_TT1_112_VW1_WG64_4_1
    SolutionIndex: 373
    SolutionNameMin: Cijk_Ailk_Bljk_CB_UserArgs_MT128x48x64_MI16x16x4x1_SN_AMAS3_DTVA1_GLVWA2_GLVWB2_GSU1_GSUASB_LBSPPB512_LPB2_LRVW1_MIAV1_NLCA1_PLR1_SVW2_TT2_48_VW2_WG64_4_1
    SolutionIndex: 374
    SolutionNameMin: Cijk_Ailk_Bljk_CB_UserArgs_MT128x256x16_MI16x16x4x1_SN_AMAS3_DTVA1_GLVWA2_GLVWB1_GSU3_GSUAMB_LBSPPB128_LPB1_LRVW1_MIAV0_NLCA1_PLR5_SVW2_TT2_256_VW2_WG64_4_1
    SolutionIndex: 375
    SolutionNameMin: Cijk_Ailk_Bljk_CB_UserArgs_MT128x80x32_MI16x16x4x1_SN_AMAS0_DTVA0_GLVWB2_GSU1_GSUASB_LBSPPB256_LPB2_LRVW1_MIAV1_NTC3_NTD3_NLCA1_PLR1_SVW1_TT2_80_VW1_WG64_4_1_WGM1
    SolutionIndex: 376
    SolutionNameMin: Cijk_Ailk_Bljk_CB_UserArgs_MT64x112x32_MI16x16x4x1_SN_AMAS0_DTVA0_GLVWB1_GSU1_GSUASB_LBSPPB256_LPB1_LRVW1_MIAV1_NTC0_NTD0_NLCA1_PLR1_SVW1_TT1_112_VW1_WG64_4_1_WGM1
    SolutionIndex: 377
    SolutionNameMin: Cijk_Ailk_Bljk_CB_UserArgs_MT64x112x32_MI16x16x4x1_SN_AMAS0_DTVA0_GLVWB2_GSU1_GSUASB_LBSPPB256_LPB4_LRVW2_MIAV1_NTC0_NTD0_NLCA1_PLR9_SVW1_TT1_112_VW1_WG64_4_1_WGMn12
    SolutionIndex: 378
    SolutionNameMin: Cijk_Ailk_Bljk_CB_UserArgs_MT128x48x32_MI16x16x4x1_SN_AMAS3_DTVA1_GLVWB2_GSU1_GSUASB_LBSPPB256_LPB2_LRVW1_MIAV1_NTC3_NTD3_NLCA1_PLR1_SVW2_TT2_48_VW2_WG64_4_1_WGMn12
    SolutionIndex: 379
    SolutionNameMin: Cijk_Ailk_Bljk_CB_UserArgs_MT128x48x32_MI16x16x4x1_SN_AMAS0_DTVA0_GLVWB1_GSU1_GSUASB_LBSPPB256_LPB4_LRVW2_MIAV1_NTC3_NTD3_NLCA1_PLR9_SVW1_TT2_48_VW1_WG64_4_1_WGMn12
    SolutionIndex: 380
    SolutionNameMin: Cijk_Ailk_Bljk_CB_UserArgs_MT256x128x8_MI16x16x4x1_SN_AMAS3_DTVA1_GLVWB1_GSU3_GSUAMB_LBSPPB128_LPB1_LRVW1_MIAV0_NTC3_NTD3_NLCA2_PLR1_SVW2_TT4_128_VW2_WG64_4_1_WGM1
    SolutionIndex: 381
    SolutionNameMin: Cijk_Ailk_Bljk_CB_UserArgs_MT64x112x16_MI16x16x4x1_SN_AMAS0_DTVA0_GLVWB1_GSU1_GSUASB_LBSPPB128_LPB1_LRVW1_MIAV1_NTC3_NTD3_NLCA1_PLR1_SVW1_TT1_112_VW1_WG64_4_1_WGM1
    SolutionIndex: 382
    SolutionNameMin: Cijk_Ailk_Bljk_CB_UserArgs_MT64x112x16_MI16x16x4x1_SN_AMAS0_DTVA0_GLVWB1_GSU1_GSUASB_LBSPPB128_LPB1_LRVW1_MIAV1_NTC0_NTD0_NLCA1_PLR1_SVW1_TT1_112_VW1_WG64_4_1_WGM1
    SolutionIndex: 383
    SolutionNameMin: Cijk_Ailk_Bljk_CB_UserArgs_MT64x112x16_MI16x16x4x1_SN_AMAS0_DTVA0_GLVWB1_GSU1_GSUASB_LBSPPB128_LPB4_LRVW2_MIAV1_NTC0_NTD0_NLCA1_PLR5_SVW1_TT1_112_VW1_WG64_4_1_WGM1
    SolutionIndex: 384
    SolutionNameMin: Cijk_Ailk_Bljk_CB_UserArgs_MT80x128x32_MI16x16x4x1_SN_AMAS0_DTVA0_GLVWB2_GSU1_GSUASB_LBSPPB256_LPB2_LRVW1_MIAV1_NTC3_NTD3_NLCA5_PLR9_SVW1_TT5_32_VW1_WG16_16_1_WGMn12
    SolutionIndex: 385
    SolutionNameMin: Cijk_Ailk_Bljk_CB_UserArgs_MT128x80x32_MI16x16x4x1_SN_AMAS0_DTVA0_GLVWB1_GSU1_GSUASB_LBSPPB256_LPB1_LRVW1_MIAV1_NTC0_NTD0_NLCA1_PLR1_SVW1_TT2_80_VW1_WG64_4_1_WGMn12
    SolutionIndex: 386
    SolutionNameMin: Cijk_Ailk_Bljk_CB_UserArgs_MT128x80x32_MI16x16x4x1_SN_AMAS3_DTVA1_GLVWB1_GSU1_GSUASB_LBSPPB256_LPB1_LRVW1_MIAV1_NTC0_NTD0_NLCA1_PLR1_SVW2_TT2_80_VW2_WG64_4_1_WGM1
    SolutionIndex: 387
    SolutionNameMin: Cijk_Ailk_Bljk_CB_UserArgs_MT160x96x16_MI16x16x4x1_SN_AMAS0_DTVA0_GLVWB2_GSU1_GSUASB_LBSPPB128_LPB4_LRVW2_MIAV0_NTC0_NTD0_NLCA5_PLR5_SVW1_TT5_48_VW1_WG32_8_1_WGMn12
    SolutionIndex: 388
    SolutionNameMin: Cijk_Ailk_Bljk_CB_UserArgs_MT448x32x16_MI16x16x4x1_SN_AMAS0_DTVA0_GLVWB1_GSU1_GSUASB_LBSPPB128_LPB4_LRVW2_MIAV0_NTC3_NTD3_NLCA7_PLR5_SVW1_TT7_32_VW1_WG64_4_1_WGMn12
    SolutionIndex: 389
    SolutionNameMin: Cijk_Ailk_Bljk_CB_UserArgs_MT224x64x16_MI16x16x4x1_SN_AMAS0_DTVA0_GLVWB1_GSU1_GSUASB_LBSPPB128_LPB1_LRVW1_MIAV0_NTC3_NTD3_NLCA7_PLR1_SVW1_TT7_32_VW1_WG32_8_1_WGM1
    SolutionIndex: 390
    SolutionNameMin: Cijk_Ailk_Bljk_CB_UserArgs_MT64x160x16_MI16x16x4x1_SN_AMAS0_DTVA0_GLVWB1_GSU1_GSUASB_LBSPPB128_LPB1_LRVW1_MIAV1_NTC3_NTD3_NLCA1_PLR5_SVW1_TT1_160_VW1_WG64_4_1_WGMn12
    SolutionIndex: 391
    SolutionNameMin: Cijk_Ailk_Bljk_CB_UserArgs_MT128x80x16_MI16x16x4x1_SN_AMAS3_DTVA0_GLVWB1_GSU1_GSUASB_LBSPPB128_LPB1_LRVW1_MIAV1_NTC0_NTD0_NLCA1_PLR5_SVW2_TT2_80_VW2_WG64_4_1_WGM1
    SolutionIndex: 392
    SolutionNameMin: Cijk_Ailk_Bljk_CB_UserArgs_MT256x80x32_MI16x16x4x1_SN_AMAS3_DTVA1_GLVWB2_GSU1_GSUASB_LBSPPB256_LPB2_LRVW1_MIAV0_NTC3_NTD3_NLCA2_PLR1_SVW2_TT4_80_VW2_WG64_4_1_WGMn12
    SolutionIndex: 393
    SolutionNameMin: Cijk_Ailk_Bljk_CB_UserArgs_MT64x112x32_MI16x16x4x1_SN_AMAS0_DTVA0_GLVWB1_GSU1_GSUASB_LBSPPB256_LPB1_LRVW1_MIAV1_NTC0_NTD0_NLCA1_PLR9_SVW1_TT1_112_VW1_WG64_4_1_WGM1
    SolutionIndex: 394
    SolutionNameMin: Cijk_Ailk_Bljk_CB_UserArgs_MT128x176x16_MI16x16x4x1_SN_AMAS0_DTVA0_GLVWB1_GSU1_GSUASB_LBSPPB128_LPB4_LRVW2_MIAV0_NTC3_NTD3_NLCA1_PLR5_SVW1_TT2_176_VW1_WG64_4_1_WGMn12
    SolutionIndex: 395
    SolutionNameMin: Cijk_Ailk_Bljk_CB_UserArgs_MT128x176x16_MI16x16x4x1_SN_AMAS3_DTVA1_GLVWB1_GSU1_GSUASB_LBSPPB128_LPB1_LRVW1_MIAV0_NTC0_NTD0_NLCA1_PLR1_SVW2_TT2_176_VW2_WG64_4_1_WGMn12
    SolutionIndex: 396
    SolutionNameMin: Cijk_Ailk_Bljk_CB_UserArgs_MT128x176x16_MI16x16x4x1_SN_AMAS3_DTVA1_GLVWB1_GSU1_GSUASB_LBSPPB128_LPB1_LRVW1_MIAV0_NTC3_NTD3_NLCA1_PLR5_SVW2_TT2_176_VW2_WG64_4_1_WGMn12
    SolutionIndex: 397
    SolutionNameMin: Cijk_Ailk_Bljk_CB_UserArgs_MT128x80x16_MI16x16x4x1_SN_AMAS3_DTVA1_GLVWB1_GSU1_GSUASB_LBSPPB128_LPB1_LRVW1_MIAV1_NTC3_NTD3_NLCA1_PLR1_SVW2_TT2_80_VW2_WG64_4_1_WGM1
    SolutionIndex: 398
    SolutionNameMin: Cijk_Ailk_Bljk_CB_UserArgs_MT64x112x16_MI16x16x4x1_SN_AMAS0_DTVA0_GLVWB1_GSU1_GSUASB_LBSPPB128_LPB4_LRVW2_MIAV1_NTC0_NTD0_NLCA1_PLR5_SVW1_TT1_112_VW1_WG64_4_1_WGMn12
    SolutionIndex: 399
    SolutionNameMin: Cijk_Ailk_Bljk_CB_UserArgs_MT256x96x16_MI16x16x4x1_SN_AMAS3_DTVA1_GLVWB1_LBSPPB128_LPB1_LRVW1_NLCA2_PLR1_SVW2_TT4_96_VW2_WG64_4_1
    SolutionIndex: 400
    SolutionNameMin: Cijk_Ailk_Bljk_CB_UserArgs_MT224x96x16_MI16x16x4x1_SN_AMAS0_DTVA0_GLVWB1_LBSPPB128_LPB1_LRVW1_NLCA7_PLR5_SVW1_TT7_48_VW1_WG32_8_1
    SolutionIndex: 401
    SolutionNameMin: Cijk_Ailk_Bljk_CB_UserArgs_MT192x112x16_MI16x16x4x1_SN_AMAS0_DTVA0_GLVWB1_LBSPPB128_LPB1_LRVW1_NLCA3_PLR1_SVW1_TT3_112_VW1_WG64_4_1
    SolutionIndex: 402
    SolutionNameMin: Cijk_Ailk_Bljk_CB_UserArgs_MT256x128x16_MI16x16x4x1_SN_AMAS3_DTVA0_GLVWB1_LBSPPB128_LPB1_LRVW1_NLCA1_PLR5_SVW2_TT4_128_VW2_WG64_4_1
    SolutionIndex: 403
    SolutionNameMin: Cijk_Ailk_Bljk_CB_UserArgs_MT256x112x32_MI16x16x4x1_SN_AMAS3_DTVA1_GLVWB1_LBSPPB256_LPB1_LRVW1_NLCA2_PLR1_SVW2_TT4_112_VW2_WG64_4_1
    SolutionIndex: 404
    SolutionNameMin: Cijk_Ailk_Bljk_CB_UserArgs_MT256x112x16_MI16x16x4x1_SN_AMAS3_DTVA1_GLVWB1_LBSPPB128_LPB1_LRVW1_NLCA2_PLR5_SVW2_TT4_112_VW2_WG64_4_1
    SolutionIndex: 405
    SolutionNameMin: Cijk_Ailk_Bljk_CB_UserArgs_MT192x112x16_MI16x16x4x1_SN_AMAS0_DTVA0_GLVWB1_LBSPPB128_LPB4_LRVW2_NLCA3_PLR5_SVW1_TT3_112_VW1_WG64_4_1
    SolutionIndex: 406
    SolutionNameMin: Cijk_Ailk_Bljk_CB_UserArgs_MT96x192x16_MI16x16x4x1_SN_AMAS0_DTVA0_GLVWB2_LBSPPB128_LPB4_LRVW2_NLCA3_PLR5_SVW1_TT6_48_VW1_WG16_16_1
    SolutionIndex: 407
    SolutionNameMin: Cijk_Ailk_Bljk_CB_UserArgs_MT96x192x16_MI16x16x4x1_SN_AMAS0_DTVA0_GLVWB2_LBSPPB128_LPB4_LRVW2_NLCA3_PLR5_SVW1_TT3_96_VW1_WG32_8_1
    SolutionIndex: 408
    SolutionNameMin: Cijk_Ailk_Bljk_CB_UserArgs_MT96x192x16_MI16x16x4x1_SN_AMAS0_DTVA0_GLVWB1_LBSPPB128_LPB1_LRVW1_NLCA3_PLR1_SVW1_TT3_96_VW1_WG32_8_1
    SolutionIndex: 409
    SolutionNameMin: Cijk_Ailk_Bljk_CB_UserArgs_MT256x128x16_MI16x16x4x1_SN_AMAS3_DTVA0_GLVWB2_LBSPPB128_LPB2_LRVW1_NLCA1_PLR1_SVW2_TT8_64_VW2_WG32_8_1
    SolutionIndex: 410
    SolutionNameMin: Cijk_Ailk_Bljk_CB_UserArgs_MT224x128x16_MI16x16x4x1_SN_AMAS0_DTVA0_GLVWB2_LBSPPB128_LPB2_LRVW1_NLCA7_PLR1_SVW1_TT7_64_VW1_WG32_8_1
    SolutionIndex: 411
    SolutionNameMin: Cijk_Ailk_Bljk_CB_UserArgs_MT128x160x8_MI16x16x4x1_SN_AMAS0_DTVA0_GLVWB1_LBSPPB128_LPB1_LRVW1_NLCA1_PLR3_SVW1_TT4_80_VW1_WG32_8_1
    SolutionIndex: 412
    SolutionNameMin: Cijk_Ailk_Bljk_CB_UserArgs_MT256x80x32_MI16x16x4x1_SN_AMAS3_DTVA1_GLVWB2_LBSPPB256_LPB2_LRVW1_NLCA2_PLR1_SVW2_TT4_80_VW2_WG64_4_1
    SolutionIndex: 413
    SolutionNameMin: Cijk_Ailk_Bljk_CB_UserArgs_MT256x80x16_MI16x16x4x1_SN_AMAS3_DTVA1_GLVWB1_LBSPPB128_LPB1_LRVW1_NLCA2_PLR5_SVW2_TT4_80_VW2_WG64_4_1
    SolutionIndex: 414
    SolutionNameMin: Cijk_Ailk_Bljk_CB_UserArgs_MT256x80x16_MI16x16x4x1_SN_AMAS3_DTVA1_GLVWB1_LBSPPB128_LPB1_LRVW1_NLCA2_PLR1_SVW2_TT4_80_VW2_WG64_4_1
    SolutionIndex: 415
    SolutionNameMin: Cijk_Ailk_Bljk_CB_UserArgs_MT224x128x16_MI16x16x4x1_SN_AMAS0_DTVA0_GLVWB1_LBSPPB128_LPB1_LRVW1_NLCA7_PLR1_SVW1_TT7_64_VW1_WG32_8_1
    SolutionIndex: 416
    SolutionNameMin: Cijk_Ailk_Bljk_CB_UserArgs_MT128x160x8_MI16x16x4x1_SN_AMAS3_DTVA1_GLVWB1_LBSPPB128_LPB1_LRVW1_NLCA1_PLR3_SVW2_TT2_160_VW2_WG64_4_1
    SolutionIndex: 417
    SolutionNameMin: Cijk_Ailk_Bljk_CB_UserArgs_MT128x176x16_MI16x16x4x1_SN_AMAS0_DTVA0_GLVWB1_LBSPPB128_LPB1_LRVW1_NLCA1_PLR5_SVW1_TT2_176_VW1_WG64_4_1
    SolutionIndex: 418
    SolutionNameMin: Cijk_Ailk_Bljk_CB_UserArgs_MT128x176x16_MI16x16x4x1_SN_AMAS3_DTVA1_GLVWB1_LBSPPB128_LPB1_LRVW1_NLCA1_PLR1_SVW2_TT2_176_VW2_WG64_4_1
    SolutionIndex: 419
    SolutionNameMin: Cijk_Ailk_Bljk_CB_UserArgs_MT256x112x16_MI16x16x4x1_SN_AMAS3_DTVA1_GLVWB1_LBSPPB128_LPB1_LRVW1_NLCA2_PLR1_SVW2_TT4_112_VW2_WG64_4_1
    SolutionIndex: 420
    SolutionNameMin: Cijk_Ailk_Bljk_CB_UserArgs_MT256x112x32_MI16x16x4x1_SN_AMAS3_DTVA1_GLVWB2_LBSPPB256_LPB2_LRVW1_NLCA2_PLR1_SVW2_TT4_112_VW2_WG64_4_1
    SolutionIndex: 421
    SolutionNameMin: Cijk_Ailk_Bljk_CB_UserArgs_MT16x16x128_MI16x16x4x1_SN_DTVA0_GLVWB2_GSU1_GSUASB_LBSPPB1024_LPB4_LRVW2_NLCB1_PLR17_TT1_16_WG16_4_2
    SolutionIndex: 422
    SolutionNameMin: Cijk_Ailk_Bljk_CB_UserArgs_MT16x64x16_MI16x16x4x1_SN_DTVA0_GLVWB1_GSU7_GSUAMB_LBSPPB128_LPB1_LRVW1_NLCB1_PLR1_TT1_16_WG16_16_1
    SolutionIndex: 423
    SolutionNameMin: Cijk_Ailk_Bljk_CB_UserArgs_MT16x128x32_MI16x16x4x1_SN_DTVA0_GLVWB2_GSU12_GSUAMB_LBSPPB256_LPB2_LRVW1_NLCB1_PLR9_TT1_32_WG16_16_1
    SolutionIndex: 424
    SolutionNameMin: Cijk_Ailk_Bljk_CB_UserArgs_MT16x32x64_MI16x16x4x1_SN_DTVA1_GLVWB1_GSU1_GSUASB_LBSPPB512_LPB4_LRVW2_NLCB1_PLR5_TT1_32_WG16_4_4
    SolutionIndex: 425
    SolutionNameMin: Cijk_Ailk_Bljk_CB_UserArgs_MT16x32x64_MI16x16x4x1_SN_DTVA1_GLVWB2_GSU1_GSUASB_LBSPPB512_LPB4_LRVW2_NLCB1_PLR5_TT1_32_WG16_4_4
    SolutionIndex: 426
    SolutionNameMin: Cijk_Ailk_Bljk_CB_UserArgs_MT16x128x32_MI16x16x4x1_SN_DTVA0_GLVWB1_GSU6_GSUAMB_LBSPPB256_LPB1_LRVW1_NLCB1_PLR9_TT1_32_WG16_16_1
    SolutionIndex: 427
    SolutionNameMin: Cijk_Ailk_Bljk_CB_UserArgs_MT16x32x64_MI16x16x4x1_SN_DTVA0_GLVWB1_GSU1_GSUASB_LBSPPB512_LPB1_LRVW1_NLCB1_PLR5_TT1_32_WG16_4_4
    SolutionIndex: 428
    SolutionNameMin: Cijk_Ailk_Bljk_CB_UserArgs_MT16x80x32_MI16x16x4x1_SN_DTVA1_GLVWB1_GSU4_GSUAMB_LBSPPB256_LPB1_LRVW1_NLCB1_PLR3_TT1_80_WG16_4_4
    SolutionIndex: 429
    SolutionNameMin: Cijk_Ailk_Bljk_CB_UserArgs_MT16x32x64_MI16x16x4x1_SN_DTVA0_GLVWA2_GLVWB2_GSU1_GSUASB_LBSPPB512_LPB4_LRVW2_NLCB1_PLR5_TT1_32_WG16_4_4
    SolutionIndex: 430
    SolutionNameMin: Cijk_Ailk_Bljk_CB_UserArgs_MT16x32x64_MI16x16x4x1_SN_DTVA0_GLVWA2_GLVWB1_GSU1_GSUASB_LBSPPB512_LPB4_LRVW2_NLCB1_PLR5_TT1_32_WG16_4_4
    SolutionIndex: 431
    SolutionNameMin: Cijk_Ailk_Bljk_CB_UserArgs_MT16x96x32_MI16x16x4x1_SN_DTVA0_GLVWA2_GLVWB1_GSU6_GSUAMB_LBSPPB256_LPB1_LRVW1_NLCB1_PLR1_TT1_48_WG16_8_2
    SolutionIndex: 432
    SolutionNameMin: Cijk_Ailk_Bljk_CB_UserArgs_MT16x32x64_MI16x16x4x1_SN_DTVA0_GLVWA2_GLVWB2_GSU1_GSUASB_LBSPPB512_LPB4_LRVW2_NLCB1_PLR9_TT1_16_WG16_8_2
    SolutionIndex: 433
    SolutionNameMin: Cijk_Ailk_Bljk_CB_UserArgs_MT16x32x128_MI16x16x4x1_SN_DTVA0_GLVWA2_GLVWB2_GSU1_GSUASB_LBSPPB1024_LPB4_LRVW2_NLCB1_PLR9_TT1_32_WG16_4_4
    SolutionIndex: 434
    SolutionNameMin: Cijk_Ailk_Bljk_CB_UserArgs_MT16x64x32_MI16x16x4x1_SN_DTVA0_GLVWA2_GLVWB1_GSU3_GSUAMB_LBSPPB256_LPB4_LRVW2_NLCB1_PLR9_TT1_16_WG16_16_1
    SolutionIndex: 435
    SolutionNameMin: Cijk_Ailk_Bljk_CB_UserArgs_MT16x32x32_MI16x16x4x1_SN_DTVA0_GLVWA2_GLVWB2_GSU1_GSUASB_LBSPPB256_LPB2_LRVW1_NLCB1_PLR1_TT1_32_WG16_4_4
    SolutionIndex: 436
    SolutionNameMin: Cijk_Ailk_Bljk_CB_UserArgs_MT16x48x64_MI16x16x4x1_SN_DTVA0_GLVWA2_GLVWB2_GSU1_GSUASB_LBSPPB512_LPB4_LRVW2_NLCB1_PLR5_TT1_48_WG16_4_4
    SolutionIndex: 437
    SolutionNameMin: Cijk_Ailk_Bljk_CB_UserArgs_MT16x128x32_MI16x16x4x1_SN_DTVA0_GLVWA2_GLVWB2_GSU6_GSUAMB_LBSPPB256_LPB4_LRVW2_NLCB1_PLR5_TT1_64_WG16_8_2
    SolutionIndex: 438
    SolutionNameMin: Cijk_Ailk_Bljk_CB_UserArgs_MT32x16x64_MI16x16x4x1_SN_AMAS0_DTVA0_GLVWA2_GLVWB2_GSU1_GSUASB_LBSPPB512_LPB4_LRVW2_NLCB1_PLR9_SVW1_TT1_16_VW1_WG32_4_2
    SolutionIndex: 439
    SolutionNameMin: Cijk_Ailk_Bljk_CB_UserArgs_MT32x16x32_MI16x16x4x1_SN_AMAS0_DTVA0_GLVWA2_GLVWB2_GSU1_GSUASB_LBSPPB256_LPB4_LRVW2_NLCB1_PLR5_SVW1_TT1_16_VW1_WG32_4_2
    SolutionIndex: 440
    SolutionNameMin: Cijk_Ailk_Bljk_CB_UserArgs_MT32x128x16_MI16x16x4x1_SN_AMAS3_DTVA0_GLVWA2_GLVWB2_GSU14_GSUAMB_LBSPPB128_LPB4_LRVW2_NLCB1_PLR5_SVW2_TT2_32_VW2_WG16_16_1
    SolutionIndex: 441
    SolutionNameMin: Cijk_Ailk_Bljk_CB_UserArgs_MT32x16x32_MI16x16x4x1_SN_AMAS0_DTVA0_GLVWA2_GLVWB1_GSU1_GSUASB_LBSPPB256_LPB4_LRVW2_NLCB1_PLR5_SVW1_TT1_16_VW1_WG32_4_2
    SolutionIndex: 442
    SolutionNameMin: Cijk_Ailk_Bljk_CB_UserArgs_MT32x96x16_MI16x16x4x1_SN_AMAS0_DTVA0_GLVWA2_GLVWB1_GSU7_GSUAMB_LBSPPB128_LPB4_LRVW2_NLCB1_PLR5_SVW1_TT1_48_VW1_WG32_8_1
    SolutionIndex: 443
    SolutionNameMin: Cijk_Ailk_Bljk_CB_UserArgs_MT32x32x64_MI16x16x4x1_SN_AMAS0_DTVA0_GLVWA2_GLVWB2_GSU1_GSUASB_LBSPPB512_LPB4_LRVW2_NLCB1_PLR5_SVW1_TT2_32_VW1_WG16_4_4
    SolutionIndex: 444
    SolutionNameMin: Cijk_Ailk_Bljk_CB_UserArgs_MT32x32x64_MI16x16x4x1_SN_AMAS3_DTVA1_GLVWA2_GLVWB1_GSU1_GSUASB_LBSPPB512_LPB1_LRVW1_NLCB1_PLR5_SVW2_TT2_32_VW2_WG16_4_4
    SolutionIndex: 445
    SolutionNameMin: Cijk_Ailk_Bljk_CB_UserArgs_MT32x96x32_MI16x16x4x1_SN_AMAS0_DTVA0_GLVWA2_GLVWB1_GSU5_GSUAMB_LBSPPB256_LPB1_LRVW1_NLCB1_PLR1_SVW1_TT1_96_VW1_WG32_4_2
    SolutionIndex: 446
    SolutionNameMin: Cijk_Ailk_Bljk_CB_UserArgs_MT64x16x32_MI16x16x4x1_SN_AMAS3_DTVA1_GLVWA2_GLVWB2_GSU1_GSUASB_LBSPPB256_LPB2_LRVW1_MIAV1_NLCA1_PLR1_SVW2_TT2_16_VW2_WG32_4_2
    SolutionIndex: 447
    SolutionNameMin: Cijk_Ailk_Bljk_CB_UserArgs_MT64x16x64_MI16x16x4x1_SN_AMAS0_DTVA0_GLVWA2_GLVWB1_GSU1_GSUASB_LBSPPB512_LPB4_LRVW2_MIAV1_NLCA1_PLR17_SVW1_TT1_16_VW1_WG64_4_1
    SolutionIndex: 448
    SolutionNameMin: Cijk_Ailk_Bljk_CB_UserArgs_MT64x64x16_MI16x16x4x1_SN_AMAS0_DTVA0_GLVWA2_GLVWB1_GSU7_GSUAMB_LBSPPB128_LPB1_LRVW1_MIAV1_NLCA1_PLR1_SVW1_TT1_64_VW1_WG64_4_1
    SolutionIndex: 449
    SolutionNameMin: Cijk_Ailk_Bljk_CB_UserArgs_MT64x32x16_MI16x16x4x1_SN_AMAS3_DTVA1_GLVWA2_GLVWB2_GSU1_GSUASB_LBSPPB128_LPB2_LRVW1_MIAV1_NLCA1_PLR1_SVW2_TT2_32_VW2_WG32_4_2
    SolutionIndex: 450
    SolutionNameMin: Cijk_Ailk_Bljk_CB_UserArgs_MT64x16x64_MI16x16x4x1_SN_AMAS3_DTVA1_GLVWA2_GLVWB2_GSU1_GSUASB_LBSPPB512_LPB2_LRVW1_MIAV1_NLCA1_PLR1_SVW2_TT2_16_VW2_WG32_4_2
    SolutionIndex: 451
    SolutionNameMin: Cijk_Ailk_Bljk_CB_UserArgs_MT64x96x16_MI16x16x4x1_SN_AMAS0_DTVA0_GLVWA2_GLVWB2_GSU7_GSUAMB_LBSPPB128_LPB2_LRVW1_MIAV1_NLCA1_PLR1_SVW1_TT2_48_VW1_WG32_8_1
    SolutionIndex: 452
    SolutionNameMin: Cijk_Ailk_Bljk_CB_UserArgs_MT64x32x64_MI16x16x4x1_SN_AMAS3_DTVA1_GLVWA2_GLVWB2_GSU1_GSUASB_LBSPPB512_LPB2_LRVW1_MIAV1_NLCA1_PLR1_SVW2_TT2_32_VW2_WG32_4_2
    SolutionIndex: 453
    SolutionNameMin: Cijk_Ailk_Bljk_CB_UserArgs_MT64x112x16_MI16x16x4x1_SN_AMAS0_DTVA0_GLVWA2_GLVWB1_GSU6_GSUAMB_LBSPPB128_LPB1_LRVW1_MIAV1_NLCA1_PLR5_SVW1_TT1_112_VW1_WG64_4_1
    SolutionIndex: 454
    SolutionNameMin: Cijk_Ailk_Bljk_CB_UserArgs_MT64x128x16_MI16x16x4x1_SN_AMAS3_DTVA0_GLVWA2_GLVWB2_GSU7_GSUAMB_LBSPPB128_LPB4_LRVW2_MIAV1_NLCA1_PLR5_SVW2_TT2_64_VW2_WG32_8_1
    SolutionIndex: 455
    SolutionNameMin: Cijk_Ailk_Bljk_CB_UserArgs_MT64x32x16_MI16x16x4x1_SN_AMAS3_DTVA1_GLVWA2_GLVWB1_GSU1_GSUASB_LBSPPB128_LPB1_LRVW1_MIAV1_NLCA1_PLR3_SVW2_TT2_32_VW2_WG32_4_2
    SolutionIndex: 456
    SolutionNameMin: Cijk_Ailk_Bljk_CB_UserArgs_MT128x64x16_MI16x16x4x1_SN_AMAS3_DTVA0_GLVWA2_GLVWB1_GSU7_GSUAMB_LBSPPB128_LPB1_LRVW1_MIAV1_NLCA1_PLR5_SVW2_TT2_64_VW2_WG64_4_1
    SolutionIndex: 457
    SolutionNameMin: Cijk_Ailk_Bljk_CB_UserArgs_MT128x64x16_MI16x16x4x1_SN_AMAS3_DTVA1_GLVWA2_GLVWB2_GSU7_GSUAMB_LBSPPB128_LPB2_LRVW1_MIAV1_NLCA1_PLR1_SVW2_TT2_64_VW2_WG64_4_1
    SolutionIndex: 458
    SolutionNameMin: Cijk_Ailk_Bljk_CB_UserArgs_MT128x16x64_MI16x16x4x1_SN_AMAS3_DTVA1_GLVWA2_GLVWB1_GSU1_GSUASB_LBSPPB512_LPB1_LRVW1_MIAV1_NLCA1_PLR1_SVW2_TT2_16_VW2_WG64_4_1
    SolutionIndex: 459
    SolutionNameMin: Cijk_Ailk_Bljk_CB_UserArgs_MT64x32x32_MI16x16x4x1_SN_AMAS3_DTVA1_GLVWA2_GLVWB2_GSU1_GSUASB_LBSPPB256_LPB4_LRVW2_MIAV1_NLCA1_PLR5_SVW2_TT2_32_VW2_WG32_4_2
    SolutionIndex: 460
    SolutionNameMin: Cijk_Ailk_Bljk_CB_UserArgs_MT128x96x16_MI16x16x4x1_SN_AMAS3_DTVA1_GLVWA2_GLVWB2_GSU7_GSUAMB_LBSPPB128_LPB2_LRVW1_MIAV0_NLCA1_PLR1_SVW2_TT2_96_VW2_WG64_4_1
    SolutionIndex: 461
    SolutionNameMin: Cijk_Ailk_Bljk_CB_UserArgs_MT64x48x64_MI16x16x4x1_SN_AMAS3_DTVA1_GLVWA2_GLVWB1_GSU1_GSUASB_LBSPPB512_LPB1_LRVW1_MIAV1_NLCA1_PLR9_SVW2_TT2_48_VW2_WG32_4_2
    SolutionIndex: 462
    SolutionNameMin: Cijk_Ailk_Bljk_CB_UserArgs_MT128x96x16_MI16x16x4x1_SN_AMAS3_DTVA1_GLVWA2_GLVWB1_GSU5_GSUAMB_LBSPPB128_LPB4_LRVW2_MIAV0_NLCA1_PLR5_SVW2_TT2_96_VW2_WG64_4_1
    SolutionIndex: 463
    SolutionNameMin: Cijk_Ailk_Bljk_CB_UserArgs_MT128x32x32_MI16x16x4x1_SN_AMAS3_DTVA1_GLVWA2_GLVWB1_GSU1_GSUASB_LBSPPB256_LPB1_LRVW1_MIAV1_NLCA2_PLR5_SVW2_TT4_32_VW2_WG32_4_2
    SolutionIndex: 464
    SolutionNameMin: Cijk_Ailk_Bljk_CB_UserArgs_MT256x48x16_MI16x16x4x1_SN_AMAS3_DTVA0_GLVWA2_GLVWB1_GSU5_GSUAMB_LBSPPB128_LPB1_LRVW1_MIAV0_NLCA1_PLR1_SVW2_TT4_48_VW2_WG64_4_1
    SolutionIndex: 465
    SolutionNameMin: Cijk_Ailk_Bljk_CB_UserArgs_MT256x48x32_MI16x16x4x1_SN_AMAS3_DTVA1_GLVWA2_GLVWB1_GSU5_GSUAMB_LBSPPB256_LPB1_LRVW1_MIAV0_NLCA2_PLR1_SVW2_TT4_48_VW2_WG64_4_1
    SolutionIndex: 466
    SolutionNameMin: Cijk_Ailk_Bljk_CB_UserArgs_MT32x112x16_MI16x16x4x1_SN_AMAS0_DTVA0_GLVWA2_GLVWB1_GSU1_GSUASB_LBSPPB128_LPB1_LRVW1_MIAV1_NLCA1_PLR1_SVW1_TT1_112_VW1_WG32_4_2
    SolutionIndex: 467
    SolutionNameMin: Cijk_Ailk_Bljk_CB_UserArgs_MT128x32x32_MI16x16x4x1_SN_AMAS3_DTVA1_GLVWA2_GLVWB2_GSU1_GSUASB_LBSPPB256_LPB2_LRVW1_MIAV1_NLCA2_PLR1_SVW2_TT4_32_VW2_WG32_4_2
    SolutionIndex: 468
    SolutionNameMin: Cijk_Ailk_Bljk_CB_UserArgs_MT256x128x16_MI16x16x4x1_SN_AMAS3_DTVA1_GLVWA2_GLVWB1_GSU9_GSUAMB_LBSPPB128_LPB1_LRVW1_MIAV0_NLCA2_PLR5_SVW2_TT4_128_VW2_WG64_4_1
    SolutionIndex: 469
    SolutionNameMin: Cijk_Ailk_Bljk_CB_UserArgs_MT64x16x16_MI16x16x4x1_SN_AMAS0_DTVA0_GLVWA2_GLVWB1_GSU1_GSUASB_LBSPPB128_LPB1_LRVW1_MIAV1_NLCA1_PLR1_SVW1_TT1_16_VW1_WG64_4_1
    SolutionIndex: 470
    SolutionNameMin: Cijk_Ailk_Bljk_CB_UserArgs_MT128x80x32_MI16x16x4x1_SN_AMAS3_DTVA0_GLVWA2_GLVWB1_GSU2_GSUAMB_LBSPPB256_LPB4_LRVW2_MIAV1_NLCA1_PLR9_SVW2_TT2_80_VW2_WG64_4_1
    SolutionIndex: 471
    SolutionNameMin: Cijk_Ailk_Bljk_CB_UserArgs_MT128x48x16_MI16x16x4x1_SN_AMAS3_DTVA1_GLVWA2_GLVWB1_GSU1_GSUASB_LBSPPB128_LPB4_LRVW2_MIAV1_NTC3_NTD3_NLCA1_PLR5_SVW2_TT2_48_VW2_WG64_4_1_WGM12
    SolutionIndex: 472
    SolutionNameMin: Cijk_Ailk_Bljk_CB_UserArgs_MT32x160x32_MI16x16x4x1_SN_AMAS0_DTVA0_GLVWA2_GLVWB2_GSU1_GSUASB_LBSPPB256_LPB2_LRVW1_MIAV1_NTC3_NTD3_NLCA1_PLR1_SVW1_TT1_80_VW1_WG32_8_1_WGM12
    SolutionIndex: 473
    SolutionNameMin: Cijk_Ailk_Bljk_CB_UserArgs_MT64x80x32_MI16x16x4x1_SN_AMAS0_DTVA0_GLVWA2_GLVWB2_GSU1_GSUASB_LBSPPB256_LPB4_LRVW2_MIAV1_NTC3_NTD3_NLCA1_PLR9_SVW1_TT1_80_VW1_WG64_4_1_WGM12
    SolutionIndex: 474
    SolutionNameMin: Cijk_Ailk_Bljk_CB_UserArgs_MT128x32x64_MI16x16x4x1_SN_AMAS3_DTVA1_GLVWA2_GLVWB2_GSU1_GSUASB_LBSPPB512_LPB2_LRVW1_MIAV1_NTC3_NTD3_NLCA1_PLR1_SVW2_TT2_32_VW2_WG64_4_1_WGM12
    SolutionIndex: 475
    SolutionNameMin: Cijk_Ailk_Bljk_CB_UserArgs_MT64x112x32_MI16x16x4x1_SN_AMAS0_DTVA0_GLVWA2_GLVWB2_GSU1_GSUASB_LBSPPB256_LPB4_LRVW2_MIAV1_NTC3_NTD3_NLCA1_PLR9_SVW1_TT1_112_VW1_WG64_4_1_WGM12
    SolutionIndex: 476
    SolutionNameMin: Cijk_Ailk_Bljk_CB_UserArgs_MT64x112x32_MI16x16x4x1_SN_AMAS0_DTVA0_GLVWA2_GLVWB1_GSU1_GSUASB_LBSPPB256_LPB1_LRVW1_MIAV1_NTC3_NTD3_NLCA1_PLR9_SVW1_TT1_112_VW1_WG64_4_1_WGM12
    SolutionIndex: 477
    SolutionNameMin: Cijk_Ailk_Bljk_CB_UserArgs_MT128x80x32_MI16x16x4x1_SN_AMAS3_DTVA0_GLVWA2_GLVWB2_GSU1_GSUASB_LBSPPB256_LPB4_LRVW2_MIAV1_NTC3_NTD3_NLCA1_PLR9_SVW2_TT2_80_VW2_WG64_4_1_WGM12
    SolutionIndex: 478
    SolutionNameMin: Cijk_Ailk_Bljk_CB_UserArgs_MT128x80x32_MI16x16x4x1_SN_AMAS0_DTVA0_GLVWA2_GLVWB1_GSU1_GSUASB_LBSPPB256_LPB1_LRVW1_MIAV1_NTC0_NTD0_NLCA1_PLR1_SVW1_TT2_80_VW1_WG64_4_1_WGM12
    SolutionIndex: 479
    SolutionNameMin: Cijk_Ailk_Bljk_CB_UserArgs_MT128x80x32_MI16x16x4x1_SN_AMAS3_DTVA1_GLVWA2_GLVWB2_GSU1_GSUASB_LBSPPB256_LPB2_LRVW1_MIAV1_NTC3_NTD3_NLCA1_PLR1_SVW2_TT2_80_VW2_WG64_4_1_WGM12
    SolutionIndex: 480
    SolutionNameMin: Cijk_Ailk_Bljk_CB_UserArgs_MT128x80x32_MI16x16x4x1_SN_AMAS0_DTVA0_GLVWA2_GLVWB2_GSU1_GSUASB_LBSPPB256_LPB4_LRVW2_MIAV1_NTC3_NTD3_NLCA1_PLR9_SVW1_TT2_80_VW1_WG64_4_1_WGM12
    SolutionIndex: 481
    SolutionNameMin: Cijk_Ailk_Bljk_CB_UserArgs_MT64x112x32_MI16x16x4x1_SN_AMAS0_DTVA0_GLVWA2_GLVWB2_GSU1_GSUASB_LBSPPB256_LPB4_LRVW2_MIAV1_NTC3_NTD3_NLCA1_PLR9_SVW1_TT1_112_VW1_WG64_4_1_WGM1
    SolutionIndex: 482
    SolutionNameMin: Cijk_Ailk_Bljk_CB_UserArgs_MT128x80x32_MI16x16x4x1_SN_AMAS3_DTVA1_GLVWA2_GLVWB2_GSU1_GSUASB_LBSPPB256_LPB2_LRVW1_MIAV1_NTC3_NTD3_NLCA1_PLR1_SVW2_TT2_80_VW2_WG64_4_1_WGM1
    SolutionIndex: 483
    SolutionNameMin: Cijk_Ailk_Bljk_CB_UserArgs_MT64x160x16_MI16x16x4x1_SN_AMAS0_DTVA0_GLVWA2_GLVWB1_GSU1_GSUASB_LBSPPB128_LPB1_LRVW1_MIAV1_NTC0_NTD0_NLCA1_PLR5_SVW1_TT2_80_VW1_WG32_8_1_WGM12
    SolutionIndex: 484
    SolutionNameMin: Cijk_Ailk_Bljk_CB_UserArgs_MT128x80x32_MI16x16x4x1_SN_AMAS3_DTVA1_GLVWA2_GLVWB2_GSU1_GSUASB_LBSPPB256_LPB2_LRVW1_MIAV1_NTC0_NTD0_NLCA1_PLR1_SVW2_TT2_80_VW2_WG64_4_1_WGM12
    SolutionIndex: 485
    SolutionNameMin: Cijk_Ailk_Bljk_CB_UserArgs_MT128x112x32_MI16x16x4x1_SN_AMAS0_DTVA0_GLVWA2_GLVWB2_GSU1_GSUASB_LBSPPB256_LPB2_LRVW1_MIAV0_NTC3_NTD3_NLCA1_PLR9_SVW1_TT2_112_VW1_WG64_4_1_WGM12
    SolutionIndex: 486
    SolutionNameMin: Cijk_Ailk_Bljk_CB_UserArgs_MT128x112x32_MI16x16x4x1_SN_AMAS0_DTVA0_GLVWA2_GLVWB2_GSU1_GSUASB_LBSPPB256_LPB2_LRVW1_MIAV0_NTC3_NTD3_NLCA1_PLR1_SVW1_TT2_112_VW1_WG64_4_1_WGM12
    SolutionIndex: 487
    SolutionNameMin: Cijk_Ailk_Bljk_CB_UserArgs_MT128x112x32_MI16x16x4x1_SN_AMAS3_DTVA1_GLVWA2_GLVWB2_GSU1_GSUASB_LBSPPB256_LPB2_LRVW1_MIAV0_NTC3_NTD3_NLCA1_PLR1_SVW2_TT2_112_VW2_WG64_4_1_WGM1
    SolutionIndex: 488
    SolutionNameMin: Cijk_Ailk_Bljk_CB_UserArgs_MT64x176x16_MI16x16x4x1_SN_AMAS0_DTVA0_GLVWA2_GLVWB1_GSU1_GSUASB_LBSPPB128_LPB1_LRVW1_MIAV0_NTC3_NTD3_NLCA1_PLR1_SVW1_TT1_176_VW1_WG64_4_1_WGM1
    SolutionIndex: 489
    SolutionNameMin: Cijk_Ailk_Bljk_CB_UserArgs_MT256x128x16_MI16x16x4x1_SN_AMAS3_DTVA1_GLVWA2_GLVWB2_GSU3_GSUAMB_LBSPPB128_LPB4_LRVW2_MIAV0_NTC0_NTD0_NLCA2_PLR5_SVW2_TT4_128_VW2_WG64_4_1_WGM12
    SolutionIndex: 490
    SolutionNameMin: Cijk_Ailk_Bljk_CB_UserArgs_MT160x96x16_MI16x16x4x1_SN_AMAS0_DTVA0_GLVWA2_GLVWB1_GSU1_GSUASB_LBSPPB128_LPB1_LRVW1_MIAV0_NTC0_NTD0_NLCA5_PLR1_SVW1_TT5_48_VW1_WG32_8_1_WGM1
    SolutionIndex: 491
    SolutionNameMin: Cijk_Ailk_Bljk_CB_UserArgs_MT128x112x32_MI16x16x4x1_SN_AMAS0_DTVA0_GLVWA2_GLVWB1_GSU1_GSUASB_LBSPPB256_LPB1_LRVW1_MIAV0_NTC0_NTD0_NLCA1_PLR1_SVW1_TT2_112_VW1_WG64_4_1_WGM12
    SolutionIndex: 492
    SolutionNameMin: Cijk_Ailk_Bljk_CB_UserArgs_MT128x112x32_MI16x16x4x1_SN_AMAS3_DTVA1_GLVWA2_GLVWB2_GSU1_GSUASB_LBSPPB256_LPB4_LRVW2_MIAV0_NTC0_NTD0_NLCA1_PLR9_SVW2_TT2_112_VW2_WG64_4_1_WGM12
    SolutionIndex: 493
    SolutionNameMin: Cijk_Ailk_Bljk_CB_UserArgs_MT128x176x32_MI16x16x4x1_SN_AMAS3_DTVA1_GLVWA2_GLVWB2_GSU1_GSUASB_LBSPPB256_LPB2_LRVW1_MIAV0_NTC0_NTD0_NLCA1_PLR1_SVW2_TT2_176_VW2_WG64_4_1_WGM1
    SolutionIndex: 494
    SolutionNameMin: Cijk_Ailk_Bljk_CB_UserArgs_MT128x176x32_MI16x16x4x1_SN_AMAS3_DTVA1_GLVWA2_GLVWB1_GSU1_GSUASB_LBSPPB256_LPB1_LRVW1_MIAV0_NTC0_NTD0_NLCA1_PLR1_SVW2_TT2_176_VW2_WG64_4_1_WGM1
    SolutionIndex: 495
    SolutionNameMin: Cijk_Ailk_Bljk_CB_UserArgs_MT128x176x32_MI16x16x4x1_SN_AMAS3_DTVA1_GLVWA2_GLVWB1_GSU1_GSUASB_LBSPPB256_LPB1_LRVW1_MIAV0_NTC3_NTD3_NLCA1_PLR1_SVW2_TT2_176_VW2_WG64_4_1_WGM12
    SolutionIndex: 496
    SolutionNameMin: Cijk_Ailk_Bljk_CB_UserArgs_MT64x112x16_MI16x16x4x1_SN_AMAS0_DTVA0_GLVWA2_GLVWB1_GSU1_GSUASB_LBSPPB128_LPB1_LRVW1_MIAV1_NTC0_NTD0_NLCA1_PLR5_SVW1_TT1_112_VW1_WG64_4_1_WGM12
    SolutionIndex: 497
    SolutionNameMin: Cijk_Ailk_Bljk_CB_UserArgs_MT128x112x16_MI16x16x4x1_SN_AMAS0_DTVA0_GLVWA2_GLVWB1_GSU1_GSUASB_LBSPPB128_LPB1_LRVW1_MIAV0_NTC3_NTD3_NLCA1_PLR1_SVW1_TT2_112_VW1_WG64_4_1_WGM12
    SolutionIndex: 498
    SolutionNameMin: Cijk_Ailk_Bljk_CB_UserArgs_MT128x160x32_MI16x16x4x1_SN_AMAS3_DTVA1_GLVWA2_GLVWB1_GSU1_GSUASB_LBSPPB256_LPB1_LRVW1_MIAV0_NTC3_NTD3_NLCA1_PLR1_SVW2_TT2_160_VW2_WG64_4_1_WGM12
    SolutionIndex: 499
    SolutionNameMin: Cijk_Ailk_Bljk_CB_UserArgs_MT128x112x16_MI16x16x4x1_SN_AMAS3_DTVA0_GLVWA2_GLVWB1_GSU1_GSUASB_LBSPPB128_LPB1_LRVW1_MIAV0_NTC3_NTD3_NLCA1_PLR5_SVW2_TT2_112_VW2_WG64_4_1_WGM12
    SolutionIndex: 500
    SolutionNameMin: Cijk_Ailk_Bljk_CB_UserArgs_MT128x112x16_MI16x16x4x1_SN_AMAS3_DTVA1_GLVWA2_GLVWB1_GSU1_GSUASB_LBSPPB128_LPB1_LRVW1_MIAV0_NTC0_NTD0_NLCA1_PLR1_SVW2_TT2_112_VW2_WG64_4_1_WGM12
    SolutionIndex: 501
    SolutionNameMin: Cijk_Ailk_Bljk_CB_UserArgs_MT128x112x16_MI16x16x4x1_SN_AMAS3_DTVA1_GLVWA2_GLVWB1_GSU1_GSUASB_LBSPPB128_LPB4_LRVW2_MIAV0_NTC3_NTD3_NLCA1_PLR5_SVW2_TT2_112_VW2_WG64_4_1_WGM12
    SolutionIndex: 502
    SolutionNameMin: Cijk_Ailk_Bljk_CB_UserArgs_MT160x128x16_MI16x16x4x1_SN_AMAS0_DTVA0_GLVWB2_LBSPPB128_LPB2_LRVW1_NLCA5_PLR5_SVW1_TT10_32_VW1_WG16_16_1_WGM12
    SolutionIndex: 503
    SolutionNameMin: Cijk_Ailk_Bljk_CB_UserArgs_MT128x160x32_MI16x16x4x1_SN_AMAS3_DTVA1_GLVWB2_LBSPPB256_LPB2_LRVW1_NLCA1_PLR1_SVW2_TT2_160_VW2_WG64_4_1_WGM12
    SolutionIndex: 504
    SolutionNameMin: Cijk_Ailk_Bljk_CB_UserArgs_MT256x80x32_MI16x16x4x1_SN_AMAS3_DTVA1_GLVWB2_LBSPPB256_LPB4_LRVW2_NLCA2_PLR9_SVW2_TT4_80_VW2_WG64_4_1_WGM12
    SolutionIndex: 505
    SolutionNameMin: Cijk_Ailk_Bljk_CB_UserArgs_MT256x128x16_MI16x16x4x1_SN_AMAS3_DTVA1_GLVWB2_LBSPPB128_LPB4_LRVW2_NLCA2_PLR5_SVW2_TT4_128_VW2_WG64_4_1_WGM12
    SolutionIndex: 506
    SolutionNameMin: Cijk_Ailk_Bljk_CB_UserArgs_MT256x112x16_MI16x16x4x1_SN_AMAS3_DTVA1_GLVWB1_LBSPPB128_LPB1_LRVW1_NLCA2_PLR5_SVW2_TT4_112_VW2_WG64_4_1_WGM12
    SolutionIndex: 507
    SolutionNameMin: Cijk_Ailk_Bljk_CB_UserArgs_MT256x112x16_MI16x16x4x1_SN_AMAS3_DTVA1_GLVWB1_LBSPPB128_LPB1_LRVW1_NLCA2_PLR5_SVW2_TT4_112_VW2_WG64_4_1_WGM1
    SolutionIndex: 508
    SolutionNameMin: Cijk_Ailk_Bljk_CB_UserArgs_MT128x160x8_MI16x16x4x1_SN_AMAS0_DTVA0_GLVWB1_LBSPPB128_LPB1_LRVW1_NLCA1_PLR3_SVW1_TT4_80_VW1_WG32_8_1_WGM12
    SolutionIndex: 509
    SolutionNameMin: Cijk_Ailk_Bljk_CB_UserArgs_MT128x160x8_MI16x16x4x1_SN_AMAS3_DTVA1_GLVWB1_LBSPPB128_LPB1_LRVW1_NLCA1_PLR3_SVW2_TT2_160_VW2_WG64_4_1_WGM12
    SolutionIndex: 510
    SolutionNameMin: Cijk_Ailk_Bljk_CB_UserArgs_MT128x160x32_MI16x16x4x1_SN_AMAS3_DTVA1_GLVWB1_LBSPPB256_LPB1_LRVW1_NLCA1_PLR1_SVW2_TT2_160_VW2_WG64_4_1_WGM12
    SolutionIndex: 511
    SolutionNameMin: Cijk_Ailk_Bljk_CB_UserArgs_MT256x128x16_MI16x16x4x1_SN_AMAS3_DTVA1_GLVWB2_LBSPPB128_LPB2_LRVW1_NLCA2_PLR1_SVW2_TT4_128_VW2_WG64_4_1_WGM12
    SolutionIndex: 512
    SolutionNameMin: Cijk_Ailk_Bljk_CB_UserArgs_MT256x112x32_MI16x16x4x1_SN_AMAS3_DTVA1_GLVWB2_LBSPPB256_LPB2_LRVW1_NLCA2_PLR1_SVW2_TT4_112_VW2_WG64_4_1_WGM12
    SolutionIndex: 513
    SolutionNameMin: Cijk_Ailk_Bljk_CB_UserArgs_MT256x112x16_MI16x16x4x1_SN_AMAS3_DTVA1_GLVWB1_LBSPPB128_LPB4_LRVW2_NLCA2_PLR5_SVW2_TT4_112_VW2_WG64_4_1_WGM12
    SolutionIndex: 514
    SolutionNameMin: Cijk_Ailk_Bljk_CB_UserArgs_MT192x112x16_MI16x16x4x1_SN_AMAS0_DTVA0_GLVWB1_LBSPPB128_LPB1_LRVW1_NLCA3_PLR5_SVW1_TT3_112_VW1_WG64_4_1_WGM12
    SolutionIndex: 515
    SolutionNameMin: Cijk_Ailk_Bljk_CB_UserArgs_MT192x112x16_MI16x16x4x1_SN_AMAS0_DTVA0_GLVWB1_LBSPPB128_LPB4_LRVW2_NLCA3_PLR5_SVW1_TT3_112_VW1_WG64_4_1_WGM12
    SolutionIndex: 516
    SolutionNameMin: Cijk_Ailk_Bljk_CB_UserArgs_MT192x112x16_MI16x16x4x1_SN_AMAS0_DTVA0_GLVWB1_LBSPPB128_LPB1_LRVW1_NLCA3_PLR1_SVW1_TT3_112_VW1_WG64_4_1_WGM12
    SolutionIndex: 517
    SolutionNameMin: Cijk_Ailk_Bljk_CB_UserArgs_MT128x160x16_MI16x16x4x1_SN_AMAS3_DTVA0_GLVWB2_LBSPPB128_LPB4_LRVW2_NLCA1_PLR5_SVW2_TT4_80_VW2_WG32_8_1_WGM12
    SolutionIndex: 518
    SolutionNameMin: Cijk_Ailk_Bljk_CB_UserArgs_MT256x112x16_MI16x16x4x1_SN_AMAS3_DTVA1_GLVWB1_LBSPPB128_LPB1_LRVW1_NLCA2_PLR1_SVW2_TT4_112_VW2_WG64_4_1_WGM12
    SolutionIndex: 519
    SolutionNameMin: Cijk_Ailk_Bljk_CB_UserArgs_MT128x160x8_MI16x16x4x1_SN_AMAS0_DTVA0_GLVWB1_LBSPPB128_LPB1_LRVW1_NLCA1_PLR3_SVW1_TT2_160_VW1_WG64_4_1_WGM12
    SolutionIndex: 520
    SolutionNameMin: Cijk_Ailk_Bljk_CB_UserArgs_MT128x160x8_MI16x16x4x1_SN_AMAS3_DTVA1_GLVWB1_LBSPPB128_LPB1_LRVW1_NLCA1_PLR1_SVW2_TT2_160_VW2_WG64_4_1_WGM1
    SolutionIndex: 521
    SolutionNameMin: Cijk_Ailk_Bljk_CB_UserArgs_MT256x112x16_MI16x16x4x1_SN_AMAS3_DTVA1_GLVWB1_LBSPPB128_LPB1_LRVW1_NLCA2_PLR1_SVW2_TT4_112_VW2_WG64_4_1_WGM1
    SolutionIndex: 522
    SolutionNameMin: Cijk_Ailk_Bljk_CB_UserArgs_MT128x160x8_MI16x16x4x1_SN_AMAS3_DTVA1_GLVWB1_LBSPPB128_LPB1_LRVW1_NLCA1_PLR1_SVW2_TT2_160_VW2_WG64_4_1_WGM12
    SolutionIndex: 523
    SolutionNameMin: Cijk_Ailk_Bljk_CB_UserArgs_MT128x112x16_MI16x16x4x1_SN_AMAS3_DTVA1_GLVWB1_LBSPPB128_LPB4_LRVW2_MIAV0_NLCA1_PLR5_SVW2_TT2_112_VW2_WG64_4_1
    SolutionIndex: 524
    SolutionNameMin: Cijk_Ailk_Bljk_CB_UserArgs_MT128x112x16_MI16x16x4x1_SN_AMAS3_DTVA1_GLVWB1_LBSPPB128_LPB1_LRVW1_MIAV0_NLCA1_PLR1_SVW2_TT2_112_VW2_WG64_4_1
    SolutionIndex: 525
    SolutionNameMin: Cijk_Ailk_Bljk_CB_UserArgs_MT128x128x16_MI16x16x4x1_SN_AMAS3_DTVA1_GLVWB1_LBSPPB128_LPB1_LRVW1_MIAV0_NLCA1_PLR1_SVW2_TT2_128_VW2_WG64_4_1
    SolutionIndex: 526
    SolutionNameMin: Cijk_Ailk_Bljk_CB_UserArgs_MT128x128x16_MI16x16x4x1_SN_AMAS3_DTVA1_GLVWB2_LBSPPB128_LPB2_LRVW1_MIAV0_NLCA1_PLR1_SVW2_TT2_128_VW2_WG64_4_1
    SolutionIndex: 527
    SolutionNameMin: Cijk_Ailk_Bljk_CB_UserArgs_MT128x96x32_MI16x16x4x1_SN_AMAS3_DTVA1_GLVWB1_LBSPPB256_LPB1_LRVW1_MIAV0_NLCA1_PLR1_SVW2_TT2_96_VW2_WG64_4_1
    SolutionIndex: 528
    SolutionNameMin: Cijk_Ailk_Bljk_CB_UserArgs_MT128x96x16_MI16x16x4x1_SN_AMAS3_DTVA1_GLVWB1_LBSPPB128_LPB4_LRVW2_MIAV0_NLCA1_PLR5_SVW2_TT2_96_VW2_WG64_4_1
    SolutionIndex: 529
    SolutionNameMin: Cijk_Ailk_Bljk_CB_UserArgs_MT256x96x16_MI16x16x4x1_SN_AMAS3_DTVA1_GLVWB2_LBSPPB128_LPB2_LRVW1_MIAV0_NLCA2_PLR1_SVW2_TT4_96_VW2_WG64_4_1
    SolutionIndex: 530
    SolutionNameMin: Cijk_Ailk_Bljk_CB_UserArgs_MT128x96x32_MI16x16x4x1_SN_AMAS3_DTVA1_GLVWB2_LBSPPB256_LPB2_LRVW1_MIAV0_NLCA1_PLR1_SVW2_TT2_96_VW2_WG64_4_1
    SolutionIndex: 531
    SolutionNameMin: Cijk_Ailk_Bljk_CB_UserArgs_MT128x112x32_MI16x16x4x1_SN_AMAS3_DTVA1_GLVWB2_LBSPPB256_LPB2_LRVW1_MIAV0_NLCA1_PLR1_SVW2_TT2_112_VW2_WG64_4_1
    SolutionIndex: 532
    SolutionNameMin: Cijk_Ailk_Bljk_CB_UserArgs_MT128x128x16_MI16x16x4x1_SN_AMAS3_DTVA1_GLVWB2_LBSPPB128_LPB4_LRVW2_MIAV0_NLCA1_PLR5_SVW2_TT2_128_VW2_WG64_4_1
    SolutionIndex: 533
    SolutionNameMin: Cijk_Ailk_Bljk_CB_UserArgs_MT256x128x16_MI16x16x4x1_SN_AMAS3_DTVA1_GLVWB1_LBSPPB128_LPB1_LRVW1_MIAV0_NLCA2_PLR1_SVW2_TT4_128_VW2_WG64_4_1
    SolutionIndex: 534
    SolutionNameMin: Cijk_Ailk_Bljk_CB_UserArgs_MT16x64x32_MI16x16x4x1_SN_DTVA0_GLVWB2_GSU1_GSUASB_LBSPPB256_LPB2_LRVW1_NTB0_PLR5_TT1_32_WG16_8_2
    SolutionIndex: 535
    SolutionNameMin: Cijk_Ailk_Bljk_CB_UserArgs_MT16x128x32_MI16x16x4x1_SN_DTVA0_GLVWB1_GSU4_GSUAMB_LBSPPB256_LPB4_LRVW2_NTB0_PLR9_TT1_32_WG16_16_1
    SolutionIndex: 536
    SolutionNameMin: Cijk_Ailk_Bljk_CB_UserArgs_MT16x192x16_MI16x16x4x1_SN_DTVA0_GLVWB2_GSU6_GSUAMB_LBSPPB128_LPB4_LRVW2_NTB4_PLR5_TT1_48_WG16_16_1
    SolutionIndex: 537
    SolutionNameMin: Cijk_Ailk_Bljk_CB_UserArgs_MT16x64x32_MI16x16x4x1_SN_DTVA0_GLVWB1_GSU1_GSUASB_LBSPPB256_LPB4_LRVW2_NTB0_PLR5_TT1_32_WG16_8_2
    SolutionIndex: 538
    SolutionNameMin: Cijk_Ailk_Bljk_CB_UserArgs_MT16x64x64_MI16x16x4x1_SN_DTVA0_GLVWB1_GSU1_GSUASB_LBSPPB512_LPB1_LRVW1_NTB0_PLR9_TT1_32_WG16_8_2
    SolutionIndex: 539
    SolutionNameMin: Cijk_Ailk_Bljk_CB_UserArgs_MT16x256x16_MI16x16x4x1_SN_DTVA0_GLVWB2_GSU7_GSUAMB_LBSPPB128_LPB4_LRVW2_NTB4_PLR5_TT1_64_WG16_16_1
    SolutionIndex: 540
    SolutionNameMin: Cijk_Ailk_Bljk_CB_UserArgs_MT16x64x16_MI16x16x4x1_SN_DTVA0_GLVWB1_GSU1_GSUASB_LBSPPB128_LPB1_LRVW1_NTB0_PLR1_TT1_32_WG16_8_2
    SolutionIndex: 541
    SolutionNameMin: Cijk_Ailk_Bljk_CB_UserArgs_MT16x64x64_MI16x16x4x1_SN_DTVA0_GLVWB2_GSU1_GSUASB_LBSPPB512_LPB4_LRVW2_NTB0_PLR17_TT1_16_WG16_16_1
    SolutionIndex: 542
    SolutionNameMin: Cijk_Ailk_Bljk_CB_UserArgs_MT16x384x16_MI16x16x4x1_SN_DTVA0_GLVWB2_GSU7_GSUAMB_LBSPPB128_LPB4_LRVW2_NTB4_PLR5_TT1_96_WG16_16_1
    SolutionIndex: 543
    SolutionNameMin: Cijk_Ailk_Bljk_CB_UserArgs_MT16x32x32_MI16x16x4x1_SN_DTVA0_GLVWA2_GLVWB2_GSU1_GSUASB_LBSPPB256_LPB2_LRVW1_NTB0_NLCB1_PLR5_TT1_16_WG16_8_2
    SolutionIndex: 544
    SolutionNameMin: Cijk_Ailk_Bljk_CB_UserArgs_MT16x32x32_MI16x16x4x1_SN_DTVA0_GLVWA2_GLVWB2_GSU1_GSUASB_LBSPPB256_LPB4_LRVW2_NTB0_NLCB1_PLR5_TT1_16_WG16_8_2
    SolutionIndex: 545
    SolutionNameMin: Cijk_Ailk_Bljk_CB_UserArgs_MT16x192x16_MI16x16x4x1_SN_DTVA0_GLVWA1_GLVWB1_GSU7_GSUAMB_LBSPPB128_LPB1_LRVW1_NTB4_NLCB1_PLR5_TT1_48_WG16_16_1
    SolutionIndex: 546
    SolutionNameMin: Cijk_Ailk_Bljk_CB_UserArgs_MT16x64x32_MI16x16x4x1_SN_DTVA0_GLVWA2_GLVWB1_GSU1_GSUASB_LBSPPB256_LPB1_LRVW1_NTB0_NLCB1_PLR3_TT1_64_WG16_4_4
    SolutionIndex: 547
    SolutionNameMin: Cijk_Ailk_Bljk_CB_UserArgs_MT16x96x64_MI16x16x4x1_SN_DTVA0_GLVWA2_GLVWB2_GSU1_GSUASB_LBSPPB512_LPB2_LRVW1_NTB0_NLCB1_PLR1_TT1_96_WG16_4_4
    SolutionIndex: 548
    SolutionNameMin: Cijk_Ailk_Bljk_CB_UserArgs_MT16x192x16_MI16x16x4x1_SN_DTVA0_GLVWA1_GLVWB1_GSU5_GSUAMB_LBSPPB128_LPB1_LRVW1_NTB4_NLCB1_PLR1_TT1_96_WG16_8_2
    SolutionIndex: 549
    SolutionNameMin: Cijk_Ailk_Bljk_CB_UserArgs_MT16x64x32_MI16x16x4x1_SN_DTVA0_GLVWA2_GLVWB1_GSU1_GSUASB_LBSPPB256_LPB4_LRVW2_NTB0_NLCB1_PLR5_TT1_32_WG16_8_2
    SolutionIndex: 550
    SolutionNameMin: Cijk_Ailk_Bljk_CB_UserArgs_MT16x64x64_MI16x16x4x1_SN_DTVA0_GLVWA2_GLVWB2_GSU1_GSUASB_LBSPPB512_LPB4_LRVW2_NTB4_NLCB1_PLR5_TT1_64_WG16_4_4
    SolutionIndex: 551
    SolutionNameMin: Cijk_Ailk_Bljk_CB_UserArgs_MT16x64x32_MI16x16x4x1_SN_DTVA0_GLVWA2_GLVWB1_GSU1_GSUASB_LBSPPB256_LPB1_LRVW1_NTB4_NLCB1_PLR5_TT1_32_WG16_8_2
    SolutionIndex: 552
    SolutionNameMin: Cijk_Ailk_Bljk_CB_UserArgs_MT32x32x32_MI16x16x4x1_SN_AMAS0_GLVWA2_GLVWB1_GSU1_GSUASB_LBSPPB256_LPB4_LRVW2_MIAV1_NTB0_PLR5_SVW1_TT1_32_VW1_WG32_4_2
    SolutionIndex: 553
    SolutionNameMin: Cijk_Ailk_Bljk_CB_UserArgs_MT32x32x32_MI16x16x4x1_SN_AMAS0_GLVWA2_GLVWB2_GSU1_GSUASB_LBSPPB256_LPB4_LRVW2_MIAV1_NTB0_PLR5_SVW1_TT2_16_VW1_WG16_8_2
    SolutionIndex: 554
    SolutionNameMin: Cijk_Ailk_Bljk_CB_UserArgs_MT32x192x16_MI16x16x4x1_SN_AMAS0_GLVWA2_GLVWB1_GSU7_GSUAMB_LBSPPB128_LPB1_LRVW1_MIAV1_NTB0_PLR5_SVW1_TT2_48_VW1_WG16_16_1
    SolutionIndex: 555
    SolutionNameMin: Cijk_Ailk_Bljk_CB_UserArgs_MT32x48x32_MI16x16x4x1_SN_AMAS0_GLVWA2_GLVWB2_GSU1_GSUASB_LBSPPB256_LPB2_LRVW1_MIAV1_NTB0_PLR1_SVW1_TT1_48_VW1_WG32_4_2
    SolutionIndex: 556
    SolutionNameMin: Cijk_Ailk_Bljk_CB_UserArgs_MT32x256x16_MI16x16x4x1_SN_AMAS0_GLVWA2_GLVWB1_GSU7_GSUAMB_LBSPPB128_LPB4_LRVW2_MIAV1_NTB4_PLR5_SVW1_TT1_128_VW1_WG32_8_1
    SolutionIndex: 557
    SolutionNameMin: Cijk_Ailk_Bljk_CB_UserArgs_MT32x64x64_MI16x16x4x1_SN_AMAS0_GLVWA2_GLVWB1_GSU1_GSUASB_LBSPPB512_LPB4_LRVW2_MIAV1_NTB4_PLR9_SVW1_TT1_64_VW1_WG32_4_2
    SolutionIndex: 558
    SolutionNameMin: Cijk_Ailk_Bljk_CB_UserArgs_MT32x112x32_MI16x16x4x1_SN_AMAS0_GLVWA2_GLVWB2_GSU2_GSUAMB_LBSPPB256_LPB4_LRVW2_MIAV1_NTB4_PLR5_SVW1_TT1_112_VW1_WG32_4_2
    SolutionIndex: 559
    SolutionNameMin: Cijk_Ailk_Bljk_CB_UserArgs_MT64x16x32_MI16x16x4x1_SN_AMAS0_DTVA0_GLVWA2_GLVWB1_GSU1_GSUASB_LBSPPB256_LPB1_LRVW1_MIAV1_NTB0_NLCA1_PLR9_SVW1_TT1_16_VW1_WG64_4_1
    SolutionIndex: 560
    SolutionNameMin: Cijk_Ailk_Bljk_CB_UserArgs_MT64x32x16_MI16x16x4x1_SN_AMAS0_DTVA0_GLVWA2_GLVWB2_GSU1_GSUASB_LBSPPB128_LPB4_LRVW2_MIAV1_NTB0_NLCA1_PLR5_SVW1_TT1_32_VW1_WG64_4_1
    SolutionIndex: 561
    SolutionNameMin: Cijk_Ailk_Bljk_CB_UserArgs_MT64x192x16_MI16x16x4x1_SN_AMAS0_DTVA0_GLVWA2_GLVWB1_GSU7_GSUAMB_LBSPPB128_LPB1_LRVW1_MIAV0_NTB4_NLCA1_PLR1_SVW1_TT1_192_VW1_WG64_4_1
    SolutionIndex: 562
    SolutionNameMin: Cijk_Ailk_Bljk_CB_UserArgs_MT64x48x32_MI16x16x4x1_SN_AMAS3_DTVA1_GLVWA2_GLVWB1_GSU1_GSUASB_LBSPPB256_LPB4_LRVW2_MIAV1_NTB0_NLCA1_PLR5_SVW2_TT2_48_VW2_WG32_4_2
    SolutionIndex: 563
    SolutionNameMin: Cijk_Ailk_Bljk_CB_UserArgs_MT32x80x64_MI16x16x4x1_SN_AMAS0_DTVA0_GLVWA2_GLVWB2_GSU1_GSUASB_LBSPPB512_LPB4_LRVW2_MIAV1_NTB0_NLCA1_PLR9_SVW1_TT1_80_VW1_WG32_4_2
    SolutionIndex: 564
    SolutionNameMin: Cijk_Ailk_Bljk_CB_UserArgs_MT64x192x16_MI16x16x4x1_SN_AMAS0_DTVA0_GLVWA2_GLVWB2_GSU5_GSUAMB_LBSPPB128_LPB2_LRVW1_MIAV0_NTB4_NLCA1_PLR1_SVW1_TT2_96_VW1_WG32_8_1
    SolutionIndex: 565
    SolutionNameMin: Cijk_Ailk_Bljk_CB_UserArgs_MT64x64x64_MI16x16x4x1_SN_AMAS3_DTVA1_GLVWA2_GLVWB1_GSU1_GSUASB_LBSPPB512_LPB1_LRVW1_MIAV1_NTB0_NLCA1_PLR1_SVW2_TT2_64_VW2_WG32_4_2
    SolutionIndex: 566
    SolutionNameMin: Cijk_Ailk_Bljk_CB_UserArgs_MT32x112x16_MI16x16x4x1_SN_AMAS0_DTVA0_GLVWA2_GLVWB1_GSU1_GSUASB_LBSPPB128_LPB1_LRVW1_MIAV1_NTB0_NLCA1_PLR1_SVW1_TT1_112_VW1_WG32_4_2
    SolutionIndex: 567
    SolutionNameMin: Cijk_Ailk_Bljk_CB_UserArgs_MT64x112x32_MI16x16x4x1_SN_AMAS0_DTVA0_GLVWA2_GLVWB2_GSU2_GSUAMB_LBSPPB256_LPB4_LRVW2_MIAV1_NTB4_NLCA1_PLR9_SVW1_TT1_112_VW1_WG64_4_1
    SolutionIndex: 568
    SolutionNameMin: Cijk_Ailk_Bljk_CB_UserArgs_MT128x32x64_MI16x16x4x1_SN_AMAS3_DTVA1_GLVWA2_GLVWB2_GSU1_GSUASB_LBSPPB512_LPB2_LRVW1_MIAV1_NTB0_NLCA1_PLR1_SVW2_TT2_32_VW2_WG64_4_1
    SolutionIndex: 569
    SolutionNameMin: Cijk_Ailk_Bljk_CB_UserArgs_MT64x112x32_MI16x16x4x1_SN_AMAS0_DTVA0_GLVWA2_GLVWB2_GSU2_GSUAMB_LBSPPB256_LPB4_LRVW2_MIAV1_NTB0_NLCA1_PLR9_SVW1_TT1_112_VW1_WG64_4_1
    SolutionIndex: 570
    SolutionNameMin: Cijk_Ailk_Bljk_CB_UserArgs_MT64x112x32_MI16x16x4x1_SN_AMAS0_DTVA0_GLVWA2_GLVWB1_GSU2_GSUAMB_LBSPPB256_LPB1_LRVW1_MIAV1_NTB0_NLCA1_PLR1_SVW1_TT1_112_VW1_WG64_4_1
    SolutionIndex: 571
    SolutionNameMin: Cijk_Ailk_Bljk_CB_UserArgs_MT128x48x32_MI16x16x4x1_SN_AMAS3_DTVA1_GLVWA2_GLVWB1_GSU1_GSUASB_LBSPPB256_LPB1_LRVW1_MIAV1_NTB0_NLCA1_PLR9_SVW2_TT2_48_VW2_WG64_4_1
    SolutionIndex: 572
    SolutionNameMin: Cijk_Ailk_Bljk_CB_UserArgs_MT128x48x32_MI16x16x4x1_SN_AMAS0_DTVA0_GLVWA2_GLVWB1_GSU1_GSUASB_LBSPPB256_LPB1_LRVW1_MIAV1_NTB0_NLCA1_PLR9_SVW1_TT2_48_VW1_WG64_4_1
    SolutionIndex: 573
    SolutionNameMin: Cijk_Ailk_Bljk_CB_UserArgs_MT64x144x16_MI16x16x4x1_SN_AMAS0_DTVA0_GLVWA2_GLVWB1_GSU2_GSUAMB_LBSPPB128_LPB1_LRVW1_MIAV1_NTB0_NLCA1_PLR1_SVW1_TT1_144_VW1_WG64_4_1
    SolutionIndex: 574
    SolutionNameMin: Cijk_Ailk_Bljk_CB_UserArgs_MT128x32x64_MI16x16x4x1_SN_AMAS3_DTVA1_GLVWA2_GLVWB1_GSU1_GSUASB_LBSPPB512_LPB1_LRVW1_MIAV1_NTB0_NLCA1_PLR1_SVW2_TT2_32_VW2_WG64_4_1
    SolutionIndex: 575
    SolutionNameMin: Cijk_Ailk_Bljk_CB_UserArgs_MT64x112x16_MI16x16x4x1_SN_AMAS0_DTVA0_GLVWA2_GLVWB1_GSU1_GSUASB_LBSPPB128_LPB1_LRVW1_MIAV1_NTB0_NLCA1_PLR5_SVW1_TT1_112_VW1_WG64_4_1
    SolutionIndex: 576
    SolutionNameMin: Cijk_Ailk_Bljk_CB_UserArgs_MT128x112x32_MI16x16x4x1_SN_AMAS0_DTVA0_GLVWA2_GLVWB1_GSU2_GSUAMB_LBSPPB256_LPB1_LRVW1_MIAV0_NTB4_NLCA1_PLR1_SVW1_TT2_112_VW1_WG64_4_1
    SolutionIndex: 577
    SolutionNameMin: Cijk_Ailk_Bljk_CB_UserArgs_MT128x64x8_MI16x16x4x1_SN_AMAS0_DTVA0_GLVWA2_GLVWB1_GSU1_GSUASB_LBSPPB128_LPB1_LRVW1_MIAV1_NTB4_NTC3_NTD3_NLCA1_PLR1_SVW1_TT2_64_VW1_WG64_4_1
    SolutionIndex: 578
    SolutionNameMin: Cijk_Ailk_Bljk_CB_UserArgs_MT64x112x16_MI16x16x4x1_SN_AMAS0_DTVA0_GLVWA2_GLVWB1_GSU1_GSUASB_LBSPPB128_LPB1_LRVW1_MIAV1_NTB0_NTC0_NTD0_NLCA1_PLR5_SVW1_TT1_112_VW1_WG64_4_1
    SolutionIndex: 579
    SolutionNameMin: Cijk_Ailk_Bljk_CB_UserArgs_MT64x112x16_MI16x16x4x1_SN_AMAS0_DTVA0_GLVWA2_GLVWB1_GSU1_GSUASB_LBSPPB128_LPB1_LRVW1_MIAV1_NTB0_NTC3_NTD3_NLCA1_PLR1_SVW1_TT1_112_VW1_WG64_4_1
    SolutionIndex: 580
    SolutionNameMin: Cijk_Ailk_Bljk_CB_UserArgs_MT128x80x32_MI16x16x4x1_SN_AMAS0_DTVA0_GLVWA2_GLVWB2_GSU1_GSUASB_LBSPPB256_LPB4_LRVW2_MIAV1_NTB0_NTC3_NTD3_NLCA1_PLR9_SVW1_TT2_80_VW1_WG64_4_1
    SolutionIndex: 581
    SolutionNameMin: Cijk_Ailk_Bljk_CB_UserArgs_MT64x144x16_MI16x16x4x1_SN_AMAS0_DTVA0_GLVWA2_GLVWB1_GSU1_GSUASB_LBSPPB128_LPB4_LRVW2_MIAV1_NTB0_NTC0_NTD0_NLCA1_PLR5_SVW1_TT1_144_VW1_WG64_4_1
    SolutionIndex: 582
    SolutionNameMin: Cijk_Ailk_Bljk_CB_UserArgs_MT64x144x32_MI16x16x4x1_SN_AMAS0_DTVA0_GLVWA2_GLVWB1_GSU1_GSUASB_LBSPPB256_LPB1_LRVW1_MIAV1_NTB0_NTC3_NTD3_NLCA1_PLR1_SVW1_TT1_144_VW1_WG64_4_1
    SolutionIndex: 583
    SolutionNameMin: Cijk_Ailk_Bljk_CB_UserArgs_MT128x64x16_MI16x16x4x1_SN_AMAS3_DTVA0_GLVWA2_GLVWB1_GSU1_GSUASB_LBSPPB128_LPB1_LRVW1_MIAV1_NTB0_NTC0_NTD0_NLCA1_PLR5_SVW2_TT2_64_VW2_WG64_4_1
    SolutionIndex: 584
    SolutionNameMin: Cijk_Ailk_Bljk_CB_UserArgs_MT128x112x32_MI16x16x4x1_SN_AMAS0_DTVA0_GLVWA2_GLVWB2_GSU1_GSUASB_LBSPPB256_LPB2_LRVW1_MIAV0_NTB0_NTC3_NTD3_NLCA1_PLR1_SVW1_TT2_112_VW1_WG64_4_1
    SolutionIndex: 585
    SolutionNameMin: Cijk_Ailk_Bljk_CB_UserArgs_MT128x112x16_MI16x16x4x1_SN_AMAS3_DTVA1_GLVWA2_GLVWB1_GSU1_GSUASB_LBSPPB128_LPB4_LRVW2_MIAV0_NTB0_NTC0_NTD0_NLCA1_PLR5_SVW2_TT2_112_VW2_WG64_4_1
    SolutionIndex: 586
    SolutionNameMin: Cijk_Ailk_Bljk_CB_UserArgs_MT64x224x8_MI16x16x4x1_SN_AMAS0_DTVA0_GLVWA2_GLVWB1_GSU1_GSUASB_LBSPPB128_LPB1_LRVW1_NTC0_NTD0_NLCA1_PLR1_SVW1_TT1_224_VW1_WG64_4_1
    SolutionIndex: 587
    SolutionNameMin: Cijk_Ailk_Bljk_CB_UserArgs_MT128x112x32_MI16x16x4x1_SN_AMAS3_DTVA1_GLVWA2_GLVWB1_GSU1_GSUASB_LBSPPB256_LPB1_LRVW1_NTC3_NTD3_NLCA1_PLR9_SVW2_TT2_112_VW2_WG64_4_1
    SolutionIndex: 588
    SolutionNameMin: Cijk_Ailk_Bljk_CB_UserArgs_MT128x112x16_MI16x16x4x1_SN_AMAS3_DTVA1_GLVWA2_GLVWB1_GSU1_GSUASB_LBSPPB128_LPB1_LRVW1_NTC0_NTD0_NLCA1_PLR5_SVW2_TT2_112_VW2_WG64_4_1
    SolutionIndex: 589
    SolutionNameMin: Cijk_Ailk_Bljk_CB_UserArgs_MT128x160x16_MI16x16x4x1_SN_AMAS0_DTVA0_GLVWA2_GLVWB2_GSU1_GSUASB_LBSPPB128_LPB2_LRVW1_NTC0_NTD0_NLCA1_PLR1_SVW1_TT4_80_VW1_WG32_8_1
    SolutionIndex: 590
    SolutionNameMin: Cijk_Ailk_Bljk_CB_UserArgs_MT128x144x16_MI16x16x4x1_SN_AMAS3_DTVA1_GLVWA2_GLVWB1_GSU1_GSUASB_LBSPPB128_LPB1_LRVW1_NTC3_NTD3_NLCA1_PLR1_SVW2_TT2_144_VW2_WG64_4_1
    SolutionIndex: 591
    SolutionNameMin: Cijk_Ailk_Bljk_CB_UserArgs_MT128x144x16_MI16x16x4x1_SN_AMAS3_DTVA1_GLVWA2_GLVWB1_GSU1_GSUASB_LBSPPB128_LPB1_LRVW1_NTC0_NTD0_NLCA1_PLR5_SVW2_TT2_144_VW2_WG64_4_1
    SolutionIndex: 592
    SolutionNameMin: Cijk_Ailk_Bljk_CB_UserArgs_MT64x224x16_MI16x16x4x1_SN_AMAS0_DTVA0_GLVWA2_GLVWB2_GSU1_GSUASB_LBSPPB128_LPB4_LRVW2_NTC3_NTD3_NLCA1_PLR5_SVW1_TT2_112_VW1_WG32_8_1
    SolutionIndex: 593
    SolutionNameMin: Cijk_Ailk_Bljk_CB_UserArgs_MT128x112x32_MI16x16x4x1_SN_AMAS3_DTVA1_GLVWA2_GLVWB2_GSU1_GSUASB_LBSPPB256_LPB2_LRVW1_NTC3_NTD3_NLCA1_PLR1_SVW2_TT2_112_VW2_WG64_4_1
    SolutionIndex: 594
    SolutionNameMin: Cijk_Ailk_Bljk_CB_UserArgs_MT256x112x16_MI16x16x4x1_SN_AMAS3_DTVA1_GLVWA2_GLVWB1_GSU1_GSUASB_LBSPPB128_LPB1_LRVW1_NTC0_NTD0_NLCA2_PLR1_SVW2_TT4_112_VW2_WG64_4_1
    SolutionIndex: 595
    SolutionNameMin: Cijk_Ailk_Bljk_CB_UserArgs_MT96x256x16_MI16x16x4x1_SN_AMAS3_DTVA0_GLVWB2_LBSPPB128_LPB4_LRVW2_NLCA3_PLR5_SVW2_TT6_64_VW2_WG16_16_1
    SolutionIndex: 596
    SolutionNameMin: Cijk_Ailk_Bljk_CB_UserArgs_MT192x112x16_MI16x16x4x1_SN_AMAS0_DTVA0_GLVWB1_LBSPPB128_LPB1_LRVW1_NLCA3_PLR1_SVW1_TT3_112_VW1_WG64_4_1
    SolutionIndex: 597
    SolutionNameMin: Cijk_Ailk_Bljk_CB_UserArgs_MT192x112x16_MI16x16x4x1_SN_AMAS0_DTVA0_GLVWB1_LBSPPB128_LPB1_LRVW1_NLCA3_PLR5_SVW1_TT3_112_VW1_WG64_4_1
    SolutionIndex: 598
    SolutionNameMin: Cijk_Ailk_Bljk_CB_UserArgs_MT128x256x8_MI16x16x4x1_SN_AMAS3_DTVA0_GLVWB2_LBSPPB128_LPB2_LRVW1_NLCA1_PLR1_SVW2_TT8_64_VW2_WG16_16_1
    SolutionIndex: 599
    SolutionNameMin: Cijk_Ailk_Bljk_CB_UserArgs_MT128x224x16_MI16x16x4x1_SN_AMAS3_DTVA1_GLVWB1_LBSPPB128_LPB1_LRVW1_NLCA1_PLR5_SVW2_TT2_224_VW2_WG64_4_1
    SolutionIndex: 600
    SolutionNameMin: Cijk_Ailk_Bljk_CB_UserArgs_MT256x112x16_MI16x16x4x1_SN_AMAS3_DTVA1_GLVWB1_LBSPPB128_LPB4_LRVW2_NLCA2_PLR5_SVW2_TT4_112_VW2_WG64_4_1
    SolutionIndex: 601
    SolutionNameMin: Cijk_Ailk_Bljk_CB_UserArgs_MT96x224x16_MI16x16x4x1_SN_AMAS0_DTVA0_GLVWB2_LBSPPB128_LPB4_LRVW2_NLCA3_PLR5_SVW1_TT3_112_VW1_WG32_8_1
    SolutionIndex: 602
    SolutionNameMin: Cijk_Ailk_Bljk_CB_UserArgs_MT256x128x16_MI16x16x4x1_SN_AMAS3_DTVA0_GLVWB2_LBSPPB128_LPB2_LRVW1_NLCA1_PLR1_SVW2_TT4_128_VW2_WG64_4_1
    SolutionIndex: 603
    SolutionNameMin: Cijk_Ailk_Bljk_CB_UserArgs_MT192x144x16_MI16x16x4x1_SN_AMAS0_DTVA0_GLVWB1_LBSPPB128_LPB4_LRVW2_NLCA3_PLR5_SVW1_TT3_144_VW1_WG64_4_1
    SolutionIndex: 604
    SolutionNameMin: Cijk_Ailk_Bljk_CB_UserArgs_MT192x144x16_MI16x16x4x1_SN_AMAS0_DTVA0_GLVWB1_LBSPPB128_LPB1_LRVW1_NLCA3_PLR1_SVW1_TT3_144_VW1_WG64_4_1
    SolutionIndex: 605
    SolutionNameMin: Cijk_Ailk_Bljk_CB_UserArgs_MT128x144x16_MI16x16x4x1_SN_AMAS3_DTVA1_GLVWB1_LBSPPB128_LPB4_LRVW2_NLCA1_PLR5_SVW2_TT2_144_VW2_WG64_4_1
    SolutionIndex: 606
    SolutionNameMin: Cijk_Ailk_Bljk_CB_UserArgs_MT128x144x16_MI16x16x4x1_SN_AMAS3_DTVA1_GLVWB1_LBSPPB128_LPB1_LRVW1_NLCA1_PLR1_SVW2_TT2_144_VW2_WG64_4_1
    SolutionIndex: 607
    SolutionNameMin: Cijk_Ailk_Bljk_CB_UserArgs_MT128x144x16_MI16x16x4x1_SN_AMAS3_DTVA1_GLVWB1_LBSPPB128_LPB1_LRVW1_NLCA1_PLR5_SVW2_TT2_144_VW2_WG64_4_1
    SolutionIndex: 608
    SolutionNameMin: Cijk_Ailk_Bljk_CB_UserArgs_MT128x176x16_MI16x16x4x1_SN_AMAS0_DTVA0_GLVWB1_LBSPPB128_LPB1_LRVW1_NLCA1_PLR1_SVW1_TT2_176_VW1_WG64_4_1
    SolutionIndex: 609
    SolutionNameMin: Cijk_Ailk_Bljk_CB_UserArgs_MT192x112x16_MI16x16x4x1_SN_AMAS0_DTVA0_GLVWB1_LBSPPB128_LPB4_LRVW2_NLCA3_PLR5_SVW1_TT3_112_VW1_WG64_4_1
    SolutionIndex: 610
    SolutionNameMin: Cijk_Ailk_Bljk_CB_UserArgs_MT256x112x16_MI16x16x4x1_SN_AMAS3_DTVA1_GLVWB1_LBSPPB128_LPB1_LRVW1_NLCA2_PLR1_SVW2_TT4_112_VW2_WG64_4_1
    SolutionIndex: 611
    SolutionNameMin: Cijk_Ailk_Bljk_CB_UserArgs_MT128x112x16_MI16x16x4x1_SN_AMAS3_DTVA1_GLVWB1_LBSPPB128_LPB4_LRVW2_MIAV0_NLCA1_PLR5_SVW2_TT2_112_VW2_WG64_4_1
    SolutionIndex: 612
    SolutionNameMin: Cijk_Ailk_Bljk_CB_UserArgs_MT128x112x32_MI16x16x4x1_SN_AMAS3_DTVA1_GLVWB2_LBSPPB256_LPB2_LRVW1_MIAV0_NLCA1_PLR1_SVW2_TT2_112_VW2_WG64_4_1
    SolutionIndex: 613
    SolutionNameMin: Cijk_Ailk_Bljk_CB_UserArgs_MT128x96x16_MI16x16x4x1_SN_AMAS3_DTVA1_GLVWB1_LBSPPB128_LPB4_LRVW2_MIAV0_NLCA1_PLR5_SVW2_TT2_96_VW2_WG64_4_1
    SolutionIndex: 614
    SolutionNameMin: Cijk_Ailk_Bljk_CB_UserArgs_MT128x128x16_MI16x16x4x1_SN_AMAS3_DTVA1_GLVWB1_LBSPPB128_LPB1_LRVW1_MIAV0_NLCA1_PLR1_SVW2_TT2_128_VW2_WG64_4_1
    SolutionIndex: 615
    SolutionNameMin: Cijk_Ailk_Bljk_CB_UserArgs_MT128x96x32_MI16x16x4x1_SN_AMAS3_DTVA1_GLVWB2_LBSPPB256_LPB2_LRVW1_MIAV0_NLCA1_PLR1_SVW2_TT2_96_VW2_WG64_4_1
    SolutionIndex: 616
    SolutionNameMin: Cijk_Ailk_Bljk_CB_UserArgs_MT128x96x32_MI16x16x4x1_SN_AMAS3_DTVA1_GLVWB1_LBSPPB256_LPB1_LRVW1_MIAV0_NLCA1_PLR1_SVW2_TT2_96_VW2_WG64_4_1
    SolutionIndex: 617
    SolutionNameMin: Cijk_Ailk_Bljk_CB_UserArgs_MT96x96x16_MI16x16x4x1_SN_AMAS0_DTVA0_GLVWB2_LBSPPB128_LPB2_LRVW1_MIAV1_NLCA3_PLR1_SVW1_TT3_48_VW1_WG32_8_1
    SolutionIndex: 618
    SolutionNameMin: Cijk_Ailk_Bljk_CB_UserArgs_MT128x96x16_MI16x16x4x1_SN_AMAS3_DTVA1_GLVWB1_LBSPPB128_LPB1_LRVW1_MIAV0_NLCA1_PLR5_SVW2_TT2_96_VW2_WG64_4_1
    SolutionIndex: 619
    SolutionNameMin: Cijk_Ailk_Bljk_CB_UserArgs_MT128x96x16_MI16x16x4x1_SN_AMAS3_DTVA1_GLVWB2_LBSPPB128_LPB4_LRVW2_MIAV0_NLCA1_PLR5_SVW2_TT2_96_VW2_WG64_4_1
    SolutionIndex: 620
    SolutionNameMin: Cijk_Ailk_Bljk_CB_UserArgs_MT96x128x16_MI16x16x4x1_SN_AMAS0_DTVA0_GLVWB2_LBSPPB128_LPB2_LRVW1_MIAV0_NLCA3_PLR1_SVW1_TT3_64_VW1_WG32_8_1
    SolutionIndex: 621
    SolutionNameMin: Cijk_Ailk_Bljk_CB_UserArgs_MT128x128x16_MI16x16x4x1_SN_AMAS3_DTVA1_GLVWB2_LBSPPB128_LPB4_LRVW2_MIAV0_NLCA1_PLR5_SVW2_TT2_128_VW2_WG64_4_1
    SolutionIndex: 622
    SolutionNameMin: Cijk_Ailk_Bljk_CB_UserArgs_MT256x128x16_MI16x16x4x1_SN_AMAS3_DTVA1_GLVWB1_LBSPPB128_LPB1_LRVW1_MIAV0_NLCA2_PLR1_SVW2_TT4_128_VW2_WG64_4_1
    SolutionIndex: 623
    SolutionNameMin: Cijk_Ailk_Bljk_CB_UserArgs_MT128x112x16_MI16x16x4x1_SN_AMAS3_DTVA1_GLVWB1_LBSPPB128_LPB1_LRVW1_MIAV0_NLCA1_PLR1_SVW2_TT2_112_VW2_WG64_4_1
    SolutionIndex: 624
    SolutionNameMin: Cijk_Ailk_Bljk_CB_UserArgs_MT16x96x16_MI16x16x4x1_SN_GLVWB2_GSU1_GSUASB_LBSPPB128_LPB2_LRVW1_NTB0_NTC0_NTD0_PLR3_TT1_48_WG16_8_2
    SolutionIndex: 625
    SolutionNameMin: Cijk_Ailk_Bljk_CB_UserArgs_MT16x224x16_MI16x16x4x1_SN_GLVWB2_GSU3_GSUAMB_LBSPPB128_LPB2_LRVW1_NTB4_NTC0_NTD0_PLR3_TT1_112_WG16_8_2
    SolutionIndex: 626
    SolutionNameMin: Cijk_Ailk_Bljk_CB_UserArgs_MT16x384x16_MI16x16x4x1_SN_GLVWB2_GSU5_GSUAMB_LBSPPB128_LPB4_LRVW2_NTB4_NTC3_NTD3_PLR5_TT1_96_WG16_16_1
    SolutionIndex: 627
    SolutionNameMin: Cijk_Ailk_Bljk_CB_UserArgs_MT16x96x32_MI16x16x4x1_SN_GLVWA2_GLVWB2_GSU1_GSUASB_LBSPPB256_LPB4_LRVW2_NTB0_NTC3_NTD3_PLR5_TT1_48_WG16_8_2
    SolutionIndex: 628
    SolutionNameMin: Cijk_Ailk_Bljk_CB_UserArgs_MT16x96x64_MI16x16x4x1_SN_GLVWA2_GLVWB1_GSU1_GSUASB_LBSPPB512_LPB4_LRVW2_NTB4_NTC0_NTD0_PLR9_TT1_48_WG16_8_2
    SolutionIndex: 629
    SolutionNameMin: Cijk_Ailk_Bljk_CB_UserArgs_MT16x160x32_MI16x16x4x1_SN_GLVWA2_GLVWB1_GSU2_GSUAMB_LBSPPB256_LPB4_LRVW2_NTB4_NTC0_NTD0_PLR5_TT1_80_WG16_8_2
    SolutionIndex: 630
    SolutionNameMin: Cijk_Ailk_Bljk_CB_UserArgs_MT32x80x16_MI16x16x4x1_SN_AMAS0_DTVA0_GLVWA2_GLVWB1_GSU1_GSUASB_LBSPPB128_LPB1_LRVW1_MIAV1_NTB0_NTC3_NTD3_PLR3_SVW1_TT1_80_VW1_WG32_4_2
    SolutionIndex: 631
    SolutionNameMin: Cijk_Ailk_Bljk_CB_UserArgs_MT32x96x16_MI16x16x4x1_SN_AMAS0_DTVA0_GLVWA2_GLVWB1_GSU1_GSUASB_LBSPPB128_LPB1_LRVW1_MIAV1_NTB4_NTC3_NTD3_PLR1_SVW1_TT2_48_VW1_WG16_8_2
    SolutionIndex: 632
    SolutionNameMin: Cijk_Ailk_Bljk_CB_UserArgs_MT32x288x16_MI16x16x4x1_SN_AMAS0_DTVA0_GLVWA2_GLVWB1_GSU4_GSUAMB_LBSPPB128_LPB4_LRVW2_MIAV1_NTB4_NTC0_NTD0_PLR5_SVW1_TT1_144_VW1_WG32_8_1
    SolutionIndex: 633
    SolutionNameMin: Cijk_Ailk_Bljk_CB_UserArgs_MT64x80x16_MI16x16x4x1_SN_AMAS0_GLVWA2_GLVWB1_GSU1_GSUASB_LBSPPB128_LPB1_LRVW1_MIAV1_NTB0_NTC0_NTD0_NLCA1_PLR1_SVW1_TT1_80_VW1_WG64_4_1
    SolutionIndex: 634
    SolutionNameMin: Cijk_Ailk_Bljk_CB_UserArgs_MT64x80x32_MI16x16x4x1_SN_AMAS0_GLVWA2_GLVWB1_GSU1_GSUASB_LBSPPB256_LPB1_LRVW1_MIAV1_NTB0_NTC3_NTD3_NLCA1_PLR1_SVW1_TT1_80_VW1_WG64_4_1
    SolutionIndex: 635
    SolutionNameMin: Cijk_Ailk_Bljk_CB_UserArgs_MT64x144x32_MI16x16x4x1_SN_AMAS0_GLVWA2_GLVWB1_GSU2_GSUAMB_LBSPPB256_LPB1_LRVW1_MIAV1_NTB4_NTC0_NTD0_NLCA1_PLR1_SVW1_TT1_144_VW1_WG64_4_1
    SolutionIndex: 636
    SolutionNameMin: Cijk_Ailk_Bljk_CB_UserArgs_MT64x144x16_MI16x16x4x1_SN_AMAS0_DTVA0_GLVWA2_GLVWB1_GSU1_GSUASB_LBSPPB128_LPB1_LRVW1_MIAV1_NTB4_NTC3_NTD3_NLCA1_PLR1_SVW1_TT1_144_VW1_WG64_4_1
    SolutionIndex: 637
    SolutionNameMin: Cijk_Ailk_Bljk_CB_UserArgs_MT128x80x32_MI16x16x4x1_SN_AMAS3_DTVA1_GLVWA2_GLVWB2_GSU1_GSUASB_LBSPPB256_LPB2_LRVW1_MIAV1_NTB0_NTC3_NTD3_NLCA1_PLR1_SVW2_TT2_80_VW2_WG64_4_1
    SolutionIndex: 638
    SolutionNameMin: Cijk_Ailk_Bljk_CB_UserArgs_MT128x144x16_MI16x16x4x1_SN_AMAS3_DTVA1_GLVWA2_GLVWB1_GSU2_GSUAMB_LBSPPB128_LPB1_LRVW1_MIAV0_NTB4_NTC0_NTD0_NLCA1_PLR1_SVW2_TT2_144_VW2_WG64_4_1
    SolutionIndex: 639
    SolutionNameMin: Cijk_Ailk_Bljk_CB_UserArgs_MT64x160x8_MI16x16x4x1_SN_AMAS0_DTVA0_GLVWB1_LBSPPB128_LPB1_LRVW1_MIAV1_NTB0_NLCA1_PLR1_SVW1_TT2_80_VW1_WG32_8_1
    SolutionIndex: 640
    SolutionNameMin: Cijk_Ailk_Bljk_CB_UserArgs_MT128x144x16_MI16x16x4x1_SN_AMAS3_DTVA0_GLVWB1_LBSPPB128_LPB1_LRVW1_MIAV0_NTB0_NLCA1_PLR1_SVW2_TT2_144_VW2_WG64_4_1
    SolutionIndex: 641
    SolutionNameMin: Cijk_Ailk_Bljk_CB_UserArgs_MT128x144x16_MI16x16x4x1_SN_AMAS3_DTVA1_GLVWB1_LBSPPB128_LPB4_LRVW2_MIAV0_NTB0_NLCA1_PLR5_SVW2_TT2_144_VW2_WG64_4_1
    SolutionIndex: 642
    SolutionNameMin: Cijk_Ailk_Bljk_CB_UserArgs_MT128x112x16_MI16x16x4x1_SN_AMAS3_DTVA0_GLVWB1_LBSPPB128_LPB1_LRVW1_MIAV0_NLCA1_PLR1_SVW2_TT2_112_VW2_WG64_4_1
    SolutionIndex: 643
    SolutionNameMin: Cijk_Ailk_Bljk_CB_UserArgs_MT128x144x32_MI16x16x4x1_SN_AMAS3_DTVA1_GLVWB1_LBSPPB256_LPB1_LRVW1_MIAV0_NLCA1_PLR1_SVW2_TT2_144_VW2_WG64_4_1
    SolutionIndex: 644
    SolutionNameMin: Cijk_Ailk_Bljk_CB_UserArgs_MT128x96x16_MI16x16x4x1_SN_AMAS3_DTVA1_GLVWB2_LBSPPB128_LPB2_LRVW1_MIAV0_NLCA1_PLR5_SVW2_TT2_96_VW2_WG64_4_1
    SolutionIndex: 645
    SolutionNameMin: Cijk_Ailk_Bljk_CB_UserArgs_MT128x144x16_MI16x16x4x1_SN_AMAS3_DTVA0_GLVWB1_LBSPPB128_LPB4_LRVW2_MIAV0_NLCA1_PLR5_SVW2_TT2_144_VW2_WG64_4_1
    SolutionIndex: 646
    SolutionNameMin: Cijk_Ailk_Bljk_CB_UserArgs_MT128x96x16_MI16x16x4x1_SN_AMAS3_DTVA1_GLVWB1_LBSPPB128_LPB1_LRVW1_MIAV0_NLCA1_PLR1_SVW2_TT2_96_VW2_WG64_4_1
- - - [4864, 3072, 1, 4096]
    - [5, 97.832]
  - - [7296, 4096, 1, 4096]
    - [6, 98.312]
  - - [7296, 4608, 1, 4096]
    - [4, 98.389]
  - - [7296, 4608, 1, 8192]
    - [0, 98.598]
  - - [9728, 6144, 1, 4096]
    - [1, 98.511]
  - - [9728, 6144, 1, 8192]
    - [3, 98.664]
  - - [16384, 16384, 1, 4096]
    - [2, 98.466]
  - - [1, 16, 1, 1024]
    - [7, 0.0]
  - - [1, 16, 1, 4096]
    - [8, 0.0]
  - - [1, 16, 1, 16384]
    - [9, 0.0]
  - - [16, 16, 1, 1024]
    - [10, 0.0]
  - - [16, 16, 1, 4096]
    - [11, 0.0]
  - - [16, 16, 1, 16384]
    - [12, 0.0]
  - - [32, 16, 1, 1024]
    - [13, 0.0]
  - - [32, 16, 1, 4096]
    - [14, 0.0]
  - - [32, 16, 1, 16384]
    - [15, 0.0]
  - - [64, 16, 1, 1024]
    - [16, 0.0]
  - - [64, 16, 1, 4096]
    - [17, 0.0]
  - - [64, 16, 1, 16384]
    - [18, 0.0]
  - - [128, 16, 1, 1024]
    - [19, 0.0]
  - - [128, 16, 1, 4096]
    - [20, 0.0]
  - - [128, 16, 1, 16384]
    - [21, 0.0]
  - - [256, 16, 1, 1024]
    - [22, 0.0]
  - - [256, 16, 1, 4096]
    - [23, 0.0]
  - - [256, 16, 1, 16384]
    - [24, 0.0]
  - - [512, 16, 1, 1024]
    - [25, 0.0]
  - - [512, 16, 1, 4096]
    - [26, 0.0]
  - - [512, 16, 1, 16384]
    - [27, 0.0]
  - - [768, 16, 1, 1024]
    - [28, 0.0]
  - - [768, 16, 1, 4096]
    - [29, 0.0]
  - - [768, 16, 1, 16384]
    - [30, 0.0]
  - - [1024, 16, 1, 1024]
    - [31, 0.0]
  - - [1024, 16, 1, 4096]
    - [31, 0.0]
  - - [1024, 16, 1, 16384]
    - [32, 0.0]
  - - [1536, 16, 1, 1024]
    - [28, 0.0]
  - - [1536, 16, 1, 4096]
    - [31, 0.0]
  - - [1536, 16, 1, 16384]
    - [33, 0.0]
  - - [2048, 16, 1, 1024]
    - [34, 0.0]
  - - [2048, 16, 1, 4096]
    - [34, 0.0]
  - - [2048, 16, 1, 16384]
    - [35, 0.0]
  - - [3072, 16, 1, 1024]
    - [36, 0.0]
  - - [3072, 16, 1, 4096]
    - [37, 0.0]
  - - [3072, 16, 1, 16384]
    - [38, 0.0]
  - - [4096, 16, 1, 1024]
    - [37, 0.0]
  - - [4096, 16, 1, 4096]
    - [39, 0.0]
  - - [4096, 16, 1, 16384]
    - [40, 0.0]
  - - [6144, 16, 1, 1024]
    - [41, 0.0]
  - - [6144, 16, 1, 4096]
    - [42, 0.0]
  - - [6144, 16, 1, 16384]
    - [43, 0.0]
  - - [8192, 16, 1, 1024]
    - [44, 0.0]
  - - [8192, 16, 1, 4096]
    - [45, 0.0]
  - - [8192, 16, 1, 16384]
    - [46, 0.0]
  - - [12288, 16, 1, 1024]
    - [47, 0.0]
  - - [12288, 16, 1, 4096]
    - [48, 0.0]
  - - [12288, 16, 1, 16384]
    - [49, 0.0]
  - - [16384, 16, 1, 1024]
    - [50, 0.0]
  - - [16384, 16, 1, 4096]
    - [51, 0.0]
  - - [16384, 16, 1, 16384]
    - [52, 0.0]
  - - [1, 32, 1, 1024]
    - [53, 0.0]
  - - [1, 32, 1, 4096]
    - [54, 0.0]
  - - [1, 32, 1, 16384]
    - [55, 0.0]
  - - [16, 32, 1, 1024]
    - [56, 0.0]
  - - [16, 32, 1, 4096]
    - [57, 0.0]
  - - [16, 32, 1, 16384]
    - [57, 0.0]
  - - [32, 32, 1, 1024]
    - [58, 0.0]
  - - [32, 32, 1, 4096]
    - [59, 0.0]
  - - [32, 32, 1, 16384]
    - [60, 0.0]
  - - [64, 32, 1, 1024]
    - [61, 0.0]
  - - [64, 32, 1, 4096]
    - [62, 0.0]
  - - [64, 32, 1, 16384]
    - [63, 0.0]
  - - [128, 32, 1, 1024]
    - [64, 0.0]
  - - [128, 32, 1, 4096]
    - [65, 0.0]
  - - [128, 32, 1, 16384]
    - [65, 0.0]
  - - [256, 32, 1, 1024]
    - [66, 0.0]
  - - [256, 32, 1, 4096]
    - [67, 0.0]
  - - [256, 32, 1, 16384]
    - [68, 0.0]
  - - [512, 32, 1, 1024]
    - [69, 0.0]
  - - [512, 32, 1, 4096]
    - [70, 0.0]
  - - [512, 32, 1, 16384]
    - [71, 0.0]
  - - [768, 32, 1, 1024]
    - [72, 0.0]
  - - [768, 32, 1, 4096]
    - [73, 0.0]
  - - [768, 32, 1, 16384]
    - [74, 0.0]
  - - [1024, 32, 1, 1024]
    - [75, 0.0]
  - - [1024, 32, 1, 4096]
    - [76, 0.0]
  - - [1024, 32, 1, 16384]
    - [77, 0.0]
  - - [1536, 32, 1, 1024]
    - [78, 0.0]
  - - [1536, 32, 1, 4096]
    - [79, 0.0]
  - - [1536, 32, 1, 16384]
    - [80, 0.0]
  - - [2048, 32, 1, 1024]
    - [72, 0.0]
  - - [2048, 32, 1, 4096]
    - [81, 0.0]
  - - [2048, 32, 1, 16384]
    - [82, 0.0]
  - - [3072, 32, 1, 1024]
    - [83, 0.0]
  - - [3072, 32, 1, 4096]
    - [84, 0.0]
  - - [3072, 32, 1, 16384]
    - [85, 0.0]
  - - [4096, 32, 1, 1024]
    - [86, 0.0]
  - - [4096, 32, 1, 4096]
    - [87, 0.0]
  - - [4096, 32, 1, 16384]
    - [88, 0.0]
  - - [6144, 32, 1, 1024]
    - [89, 0.0]
  - - [6144, 32, 1, 4096]
    - [90, 0.0]
  - - [6144, 32, 1, 16384]
    - [91, 0.0]
  - - [8192, 32, 1, 1024]
    - [92, 0.0]
  - - [8192, 32, 1, 4096]
    - [93, 0.0]
  - - [8192, 32, 1, 16384]
    - [94, 0.0]
  - - [12288, 32, 1, 1024]
    - [95, 0.0]
  - - [12288, 32, 1, 4096]
    - [96, 0.0]
  - - [12288, 32, 1, 16384]
    - [97, 0.0]
  - - [16384, 32, 1, 1024]
    - [98, 0.0]
  - - [16384, 32, 1, 4096]
    - [99, 0.0]
  - - [16384, 32, 1, 16384]
    - [100, 0.0]
  - - [1, 64, 1, 1024]
    - [101, 0.0]
  - - [1, 64, 1, 4096]
    - [102, 0.0]
  - - [1, 64, 1, 16384]
    - [103, 0.0]
  - - [16, 64, 1, 1024]
    - [104, 0.0]
  - - [16, 64, 1, 4096]
    - [105, 0.0]
  - - [16, 64, 1, 16384]
    - [106, 0.0]
  - - [32, 64, 1, 1024]
    - [107, 0.0]
  - - [32, 64, 1, 4096]
    - [108, 0.0]
  - - [32, 64, 1, 16384]
    - [109, 0.0]
  - - [64, 64, 1, 1024]
    - [110, 0.0]
  - - [64, 64, 1, 4096]
    - [111, 0.0]
  - - [64, 64, 1, 16384]
    - [112, 0.0]
  - - [128, 64, 1, 1024]
    - [113, 0.0]
  - - [128, 64, 1, 4096]
    - [114, 0.0]
  - - [128, 64, 1, 16384]
    - [115, 0.0]
  - - [256, 64, 1, 1024]
    - [116, 0.0]
  - - [256, 64, 1, 4096]
    - [117, 0.0]
  - - [256, 64, 1, 16384]
    - [118, 0.0]
  - - [512, 64, 1, 1024]
    - [119, 0.0]
  - - [512, 64, 1, 4096]
    - [120, 0.0]
  - - [512, 64, 1, 16384]
    - [121, 0.0]
  - - [768, 64, 1, 1024]
    - [122, 0.0]
  - - [768, 64, 1, 4096]
    - [123, 0.0]
  - - [768, 64, 1, 16384]
    - [124, 0.0]
  - - [1024, 64, 1, 1024]
    - [125, 0.0]
  - - [1024, 64, 1, 4096]
    - [126, 0.0]
  - - [1024, 64, 1, 16384]
    - [127, 0.0]
  - - [1536, 64, 1, 1024]
    - [128, 0.0]
  - - [1536, 64, 1, 4096]
    - [129, 0.0]
  - - [1536, 64, 1, 16384]
    - [130, 0.0]
  - - [2048, 64, 1, 1024]
    - [131, 0.0]
  - - [2048, 64, 1, 4096]
    - [132, 0.0]
  - - [2048, 64, 1, 16384]
    - [133, 0.0]
  - - [3072, 64, 1, 1024]
    - [134, 0.0]
  - - [3072, 64, 1, 4096]
    - [135, 0.0]
  - - [3072, 64, 1, 16384]
    - [136, 0.0]
  - - [4096, 64, 1, 1024]
    - [137, 0.0]
  - - [4096, 64, 1, 4096]
    - [138, 0.0]
  - - [4096, 64, 1, 16384]
    - [139, 0.0]
  - - [6144, 64, 1, 1024]
    - [140, 0.0]
  - - [6144, 64, 1, 4096]
    - [141, 0.0]
  - - [6144, 64, 1, 16384]
    - [142, 0.0]
  - - [8192, 64, 1, 1024]
    - [143, 0.0]
  - - [8192, 64, 1, 4096]
    - [144, 0.0]
  - - [8192, 64, 1, 16384]
    - [145, 0.0]
  - - [12288, 64, 1, 1024]
    - [146, 0.0]
  - - [12288, 64, 1, 4096]
    - [147, 0.0]
  - - [12288, 64, 1, 16384]
    - [148, 0.0]
  - - [16384, 64, 1, 256]
    - [149, 0.0]
  - - [16384, 64, 1, 1024]
    - [150, 0.0]
  - - [16384, 64, 1, 4096]
    - [151, 0.0]
  - - [1, 128, 1, 4096]
    - [152, 0.0]
  - - [1, 128, 1, 16384]
    - [153, 0.0]
  - - [16, 128, 1, 1024]
    - [154, 0.0]
  - - [16, 128, 1, 4096]
    - [154, 0.0]
  - - [16, 128, 1, 16384]
    - [155, 0.0]
  - - [32, 128, 1, 1024]
    - [156, 0.0]
  - - [32, 128, 1, 4096]
    - [157, 0.0]
  - - [32, 128, 1, 16384]
    - [158, 0.0]
  - - [64, 128, 1, 1024]
    - [159, 0.0]
  - - [64, 128, 1, 4096]
    - [160, 0.0]
  - - [64, 128, 1, 16384]
    - [161, 0.0]
  - - [128, 128, 1, 1024]
    - [162, 0.0]
  - - [128, 128, 1, 4096]
    - [163, 0.0]
  - - [128, 128, 1, 16384]
    - [164, 0.0]
  - - [256, 128, 1, 1024]
    - [165, 0.0]
  - - [256, 128, 1, 4096]
    - [166, 0.0]
  - - [256, 128, 1, 16384]
    - [167, 0.0]
  - - [512, 128, 1, 1024]
    - [168, 0.0]
  - - [512, 128, 1, 4096]
    - [169, 0.0]
  - - [512, 128, 1, 16384]
    - [170, 0.0]
  - - [768, 128, 1, 1024]
    - [171, 0.0]
  - - [768, 128, 1, 4096]
    - [172, 0.0]
  - - [768, 128, 1, 16384]
    - [173, 0.0]
  - - [1024, 128, 1, 1024]
    - [174, 0.0]
  - - [1024, 128, 1, 4096]
    - [175, 0.0]
  - - [1024, 128, 1, 16384]
    - [176, 0.0]
  - - [1536, 128, 1, 1024]
    - [177, 0.0]
  - - [1536, 128, 1, 4096]
    - [178, 0.0]
  - - [1536, 128, 1, 16384]
    - [179, 0.0]
  - - [2048, 128, 1, 1024]
    - [180, 0.0]
  - - [2048, 128, 1, 4096]
    - [181, 0.0]
  - - [2048, 128, 1, 16384]
    - [182, 0.0]
  - - [3072, 128, 1, 1024]
    - [183, 0.0]
  - - [3072, 128, 1, 4096]
    - [184, 0.0]
  - - [3072, 128, 1, 16384]
    - [185, 0.0]
  - - [4096, 128, 1, 1024]
    - [186, 0.0]
  - - [4096, 128, 1, 4096]
    - [187, 0.0]
  - - [4096, 128, 1, 16384]
    - [181, 0.0]
  - - [6144, 128, 1, 1024]
    - [188, 0.0]
  - - [6144, 128, 1, 4096]
    - [189, 0.0]
  - - [6144, 128, 1, 16384]
    - [190, 0.0]
  - - [8192, 128, 1, 256]
    - [191, 0.0]
  - - [8192, 128, 1, 1024]
    - [192, 0.0]
  - - [8192, 128, 1, 4096]
    - [193, 0.0]
  - - [12288, 128, 1, 256]
    - [194, 0.0]
  - - [12288, 128, 1, 1024]
    - [195, 0.0]
  - - [12288, 128, 1, 4096]
    - [196, 0.0]
  - - [16384, 128, 1, 256]
    - [197, 0.0]
  - - [16384, 128, 1, 1024]
    - [198, 0.0]
  - - [16384, 128, 1, 4096]
    - [199, 0.0]
  - - [1, 256, 1, 1024]
    - [200, 0.0]
  - - [1, 256, 1, 4096]
    - [201, 0.0]
  - - [1, 256, 1, 16384]
    - [202, 0.0]
  - - [16, 256, 1, 1024]
    - [203, 0.0]
  - - [16, 256, 1, 4096]
    - [204, 0.0]
  - - [16, 256, 1, 16384]
    - [205, 0.0]
  - - [32, 256, 1, 1024]
    - [206, 0.0]
  - - [32, 256, 1, 4096]
    - [207, 0.0]
  - - [32, 256, 1, 16384]
    - [208, 0.0]
  - - [64, 256, 1, 1024]
    - [209, 0.0]
  - - [64, 256, 1, 4096]
    - [209, 0.0]
  - - [64, 256, 1, 16384]
    - [210, 0.0]
  - - [128, 256, 1, 1024]
    - [211, 0.0]
  - - [128, 256, 1, 4096]
    - [212, 0.0]
  - - [128, 256, 1, 16384]
    - [213, 0.0]
  - - [256, 256, 1, 1024]
    - [214, 0.0]
  - - [256, 256, 1, 4096]
    - [215, 0.0]
  - - [256, 256, 1, 16384]
    - [216, 0.0]
  - - [512, 256, 1, 1024]
    - [217, 0.0]
  - - [512, 256, 1, 4096]
    - [218, 0.0]
  - - [512, 256, 1, 16384]
    - [219, 0.0]
  - - [768, 256, 1, 1024]
    - [220, 0.0]
  - - [768, 256, 1, 4096]
    - [221, 0.0]
  - - [768, 256, 1, 16384]
    - [222, 0.0]
  - - [1024, 256, 1, 1024]
    - [223, 0.0]
  - - [1024, 256, 1, 4096]
    - [224, 0.0]
  - - [1024, 256, 1, 16384]
    - [225, 0.0]
  - - [1536, 256, 1, 1024]
    - [226, 0.0]
  - - [1536, 256, 1, 4096]
    - [227, 0.0]
  - - [1536, 256, 1, 16384]
    - [228, 0.0]
  - - [2048, 256, 1, 1024]
    - [229, 0.0]
  - - [2048, 256, 1, 4096]
    - [230, 0.0]
  - - [2048, 256, 1, 16384]
    - [231, 0.0]
  - - [3072, 256, 1, 1024]
    - [232, 0.0]
  - - [3072, 256, 1, 4096]
    - [233, 0.0]
  - - [3072, 256, 1, 16384]
    - [234, 0.0]
  - - [4096, 256, 1, 256]
    - [226, 0.0]
  - - [4096, 256, 1, 1024]
    - [235, 0.0]
  - - [4096, 256, 1, 4096]
    - [236, 0.0]
  - - [6144, 256, 1, 256]
    - [237, 0.0]
  - - [6144, 256, 1, 1024]
    - [238, 0.0]
  - - [6144, 256, 1, 4096]
    - [239, 0.0]
  - - [8192, 256, 1, 256]
    - [240, 0.0]
  - - [8192, 256, 1, 1024]
    - [241, 0.0]
  - - [8192, 256, 1, 4096]
    - [242, 0.0]
  - - [12288, 256, 1, 256]
    - [243, 0.0]
  - - [12288, 256, 1, 1024]
    - [244, 0.0]
  - - [12288, 256, 1, 4096]
    - [245, 0.0]
  - - [16384, 256, 1, 256]
    - [246, 0.0]
  - - [16384, 256, 1, 1024]
    - [247, 0.0]
  - - [16384, 256, 1, 4096]
    - [248, 0.0]
  - - [1, 512, 1, 1024]
    - [249, 0.0]
  - - [1, 512, 1, 4096]
    - [250, 0.0]
  - - [1, 512, 1, 16384]
    - [251, 0.0]
  - - [16, 512, 1, 1024]
    - [252, 0.0]
  - - [16, 512, 1, 4096]
    - [253, 0.0]
  - - [16, 512, 1, 16384]
    - [254, 0.0]
  - - [32, 512, 1, 1024]
    - [255, 0.0]
  - - [32, 512, 1, 4096]
    - [256, 0.0]
  - - [32, 512, 1, 16384]
    - [257, 0.0]
  - - [64, 512, 1, 1024]
    - [258, 0.0]
  - - [64, 512, 1, 4096]
    - [259, 0.0]
  - - [64, 512, 1, 16384]
    - [260, 0.0]
  - - [128, 512, 1, 1024]
    - [261, 0.0]
  - - [128, 512, 1, 4096]
    - [262, 0.0]
  - - [128, 512, 1, 16384]
    - [263, 0.0]
  - - [256, 512, 1, 1024]
    - [264, 0.0]
  - - [256, 512, 1, 4096]
    - [265, 0.0]
  - - [256, 512, 1, 16384]
    - [266, 0.0]
  - - [512, 512, 1, 1024]
    - [267, 0.0]
  - - [512, 512, 1, 4096]
    - [268, 0.0]
  - - [512, 512, 1, 16384]
    - [269, 0.0]
  - - [768, 512, 1, 1024]
    - [270, 0.0]
  - - [768, 512, 1, 4096]
    - [271, 0.0]
  - - [768, 512, 1, 16384]
    - [272, 0.0]
  - - [1024, 512, 1, 1024]
    - [273, 0.0]
  - - [1024, 512, 1, 4096]
    - [274, 0.0]
  - - [1024, 512, 1, 16384]
    - [275, 0.0]
  - - [1536, 512, 1, 1024]
    - [276, 0.0]
  - - [1536, 512, 1, 4096]
    - [277, 0.0]
  - - [1536, 512, 1, 16384]
    - [278, 0.0]
  - - [2048, 512, 1, 256]
    - [279, 0.0]
  - - [2048, 512, 1, 1024]
    - [280, 0.0]
  - - [2048, 512, 1, 4096]
    - [281, 0.0]
  - - [3072, 512, 1, 256]
    - [282, 0.0]
  - - [3072, 512, 1, 1024]
    - [283, 0.0]
  - - [3072, 512, 1, 4096]
    - [284, 0.0]
  - - [4096, 512, 1, 256]
    - [285, 0.0]
  - - [4096, 512, 1, 1024]
    - [286, 0.0]
  - - [4096, 512, 1, 4096]
    - [287, 0.0]
  - - [6144, 512, 1, 256]
    - [288, 0.0]
  - - [6144, 512, 1, 1024]
    - [289, 0.0]
  - - [6144, 512, 1, 4096]
    - [290, 0.0]
  - - [8192, 512, 1, 256]
    - [291, 0.0]
  - - [8192, 512, 1, 1024]
    - [292, 0.0]
  - - [8192, 512, 1, 4096]
    - [293, 0.0]
  - - [12288, 512, 1, 256]
    - [294, 0.0]
  - - [12288, 512, 1, 1024]
    - [295, 0.0]
  - - [12288, 512, 1, 4096]
    - [296, 0.0]
  - - [16384, 512, 1, 256]
    - [297, 0.0]
  - - [16384, 512, 1, 1024]
    - [298, 0.0]
  - - [16384, 512, 1, 4096]
    - [299, 0.0]
  - - [1, 768, 1, 1024]
    - [300, 0.0]
  - - [1, 768, 1, 4096]
    - [301, 0.0]
  - - [1, 768, 1, 16384]
    - [302, 0.0]
  - - [1, 1024, 1, 1024]
    - [301, 0.0]
  - - [1, 1024, 1, 4096]
    - [301, 0.0]
  - - [1, 1024, 1, 16384]
    - [303, 0.0]
  - - [1, 1536, 1, 1024]
    - [304, 0.0]
  - - [1, 1536, 1, 4096]
    - [305, 0.0]
  - - [1, 1536, 1, 16384]
    - [306, 0.0]
  - - [16, 768, 1, 1024]
    - [307, 0.0]
  - - [16, 768, 1, 4096]
    - [308, 0.0]
  - - [16, 768, 1, 16384]
    - [309, 0.0]
  - - [16, 1024, 1, 1024]
    - [308, 0.0]
  - - [16, 1024, 1, 4096]
    - [308, 0.0]
  - - [16, 1024, 1, 16384]
    - [252, 0.0]
  - - [16, 1536, 1, 1024]
    - [310, 0.0]
  - - [16, 1536, 1, 4096]
    - [308, 0.0]
  - - [16, 1536, 1, 16384]
    - [308, 0.0]
  - - [32, 768, 1, 1024]
    - [311, 0.0]
  - - [32, 768, 1, 4096]
    - [312, 0.0]
  - - [32, 768, 1, 16384]
    - [313, 0.0]
  - - [32, 1024, 1, 1024]
    - [314, 0.0]
  - - [32, 1024, 1, 4096]
    - [315, 0.0]
  - - [32, 1024, 1, 16384]
    - [316, 0.0]
  - - [32, 1536, 1, 1024]
    - [311, 0.0]
  - - [32, 1536, 1, 4096]
    - [317, 0.0]
  - - [32, 1536, 1, 16384]
    - [318, 0.0]
  - - [64, 768, 1, 1024]
    - [319, 0.0]
  - - [64, 768, 1, 4096]
    - [320, 0.0]
  - - [64, 768, 1, 16384]
    - [321, 0.0]
  - - [64, 1024, 1, 1024]
    - [322, 0.0]
  - - [64, 1024, 1, 4096]
    - [323, 0.0]
  - - [64, 1024, 1, 16384]
    - [324, 0.0]
  - - [64, 1536, 1, 1024]
    - [325, 0.0]
  - - [64, 1536, 1, 4096]
    - [326, 0.0]
  - - [64, 1536, 1, 16384]
    - [327, 0.0]
  - - [128, 768, 1, 1024]
    - [328, 0.0]
  - - [128, 768, 1, 4096]
    - [329, 0.0]
  - - [128, 768, 1, 16384]
    - [330, 0.0]
  - - [128, 1024, 1, 1024]
    - [331, 0.0]
  - - [128, 1024, 1, 4096]
    - [332, 0.0]
  - - [128, 1024, 1, 16384]
    - [333, 0.0]
  - - [128, 1536, 1, 1024]
    - [334, 0.0]
  - - [128, 1536, 1, 4096]
    - [335, 0.0]
  - - [128, 1536, 1, 16384]
    - [336, 0.0]
  - - [256, 768, 1, 1024]
    - [337, 0.0]
  - - [256, 768, 1, 4096]
    - [338, 0.0]
  - - [256, 768, 1, 16384]
    - [339, 0.0]
  - - [256, 1024, 1, 1024]
    - [340, 0.0]
  - - [256, 1024, 1, 4096]
    - [341, 0.0]
  - - [256, 1024, 1, 16384]
    - [342, 0.0]
  - - [256, 1536, 1, 1024]
    - [343, 0.0]
  - - [256, 1536, 1, 4096]
    - [344, 0.0]
  - - [256, 1536, 1, 16384]
    - [345, 0.0]
  - - [512, 768, 1, 1024]
    - [346, 0.0]
  - - [512, 768, 1, 4096]
    - [347, 0.0]
  - - [512, 768, 1, 16384]
    - [348, 0.0]
  - - [512, 1024, 1, 1024]
    - [273, 0.0]
  - - [512, 1024, 1, 4096]
    - [349, 0.0]
  - - [512, 1024, 1, 16384]
    - [350, 0.0]
  - - [512, 1536, 1, 1024]
    - [351, 0.0]
  - - [512, 1536, 1, 4096]
    - [352, 0.0]
  - - [512, 1536, 1, 16384]
    - [278, 0.0]
  - - [768, 768, 1, 1024]
    - [353, 0.0]
  - - [768, 768, 1, 4096]
    - [346, 0.0]
  - - [768, 768, 1, 16384]
    - [354, 0.0]
  - - [1024, 768, 1, 1024]
    - [355, 0.0]
  - - [1024, 768, 1, 4096]
    - [356, 0.0]
  - - [1024, 768, 1, 16384]
    - [357, 0.0]
  - - [1536, 768, 1, 256]
    - [358, 0.0]
  - - [1536, 768, 1, 1024]
    - [359, 0.0]
  - - [1536, 768, 1, 4096]
    - [360, 0.0]
  - - [768, 1024, 1, 1024]
    - [361, 0.0]
  - - [768, 1024, 1, 4096]
    - [362, 0.0]
  - - [768, 1024, 1, 16384]
    - [363, 0.0]
  - - [1024, 1024, 1, 256]
    - [358, 0.0]
  - - [1024, 1024, 1, 1024]
    - [359, 0.0]
  - - [1024, 1024, 1, 4096]
    - [364, 0.0]
  - - [1536, 1024, 1, 256]
    - [365, 0.0]
  - - [1536, 1024, 1, 1024]
    - [366, 0.0]
  - - [1536, 1024, 1, 4096]
    - [367, 0.0]
  - - [768, 1536, 1, 256]
    - [368, 0.0]
  - - [768, 1536, 1, 1024]
    - [369, 0.0]
  - - [768, 1536, 1, 4096]
    - [370, 0.0]
  - - [1024, 1536, 1, 256]
    - [358, 0.0]
  - - [1024, 1536, 1, 1024]
    - [371, 0.0]
  - - [1024, 1536, 1, 4096]
    - [372, 0.0]
  - - [1536, 1536, 1, 256]
    - [358, 0.0]
  - - [1536, 1536, 1, 1024]
    - [373, 0.0]
  - - [1536, 1536, 1, 4096]
    - [374, 0.0]
  - - [2048, 768, 1, 256]
    - [375, 0.0]
  - - [2048, 768, 1, 1024]
    - [376, 0.0]
  - - [2048, 768, 1, 4096]
    - [377, 0.0]
  - - [3072, 768, 1, 256]
    - [378, 0.0]
  - - [3072, 768, 1, 1024]
    - [379, 0.0]
  - - [3072, 768, 1, 4096]
    - [380, 0.0]
  - - [4096, 768, 1, 256]
    - [381, 0.0]
  - - [4096, 768, 1, 1024]
    - [382, 0.0]
  - - [4096, 768, 1, 4096]
    - [383, 0.0]
  - - [2048, 1024, 1, 256]
    - [384, 0.0]
  - - [2048, 1024, 1, 1024]
    - [385, 0.0]
  - - [2048, 1024, 1, 4096]
    - [386, 0.0]
  - - [3072, 1024, 1, 256]
    - [387, 0.0]
  - - [3072, 1024, 1, 1024]
    - [388, 0.0]
  - - [3072, 1024, 1, 4096]
    - [389, 0.0]
  - - [4096, 1024, 1, 256]
    - [390, 0.0]
  - - [4096, 1024, 1, 1024]
    - [391, 0.0]
  - - [4096, 1024, 1, 4096]
    - [392, 0.0]
  - - [2048, 1536, 1, 256]
    - [393, 0.0]
  - - [2048, 1536, 1, 1024]
    - [372, 0.0]
  - - [2048, 1536, 1, 4096]
    - [372, 0.0]
  - - [3072, 1536, 1, 256]
    - [394, 0.0]
  - - [3072, 1536, 1, 1024]
    - [395, 0.0]
  - - [3072, 1536, 1, 4096]
    - [396, 0.0]
  - - [4096, 1536, 1, 256]
    - [397, 0.0]
  - - [4096, 1536, 1, 1024]
    - [383, 0.0]
  - - [4096, 1536, 1, 4096]
    - [398, 0.0]
  - - [6144, 768, 1, 256]
    - [399, 0.0]
  - - [6144, 768, 1, 1024]
    - [400, 0.0]
  - - [6144, 768, 1, 4096]
    - [401, 0.0]
  - - [8192, 768, 1, 256]
    - [402, 0.0]
  - - [8192, 768, 1, 1024]
    - [403, 0.0]
  - - [8192, 768, 1, 4096]
    - [404, 0.0]
  - - [12288, 768, 1, 256]
    - [401, 0.0]
  - - [12288, 768, 1, 1024]
    - [401, 0.0]
  - - [12288, 768, 1, 4096]
    - [405, 0.0]
  - - [16384, 768, 1, 256]
    - [406, 0.0]
  - - [16384, 768, 1, 1024]
    - [407, 0.0]
  - - [16384, 768, 1, 4096]
    - [408, 0.0]
  - - [6144, 1024, 1, 256]
    - [409, 0.0]
  - - [6144, 1024, 1, 1024]
    - [410, 0.0]
  - - [6144, 1024, 1, 4096]
    - [410, 0.0]
  - - [8192, 1024, 1, 256]
    - [411, 0.0]
  - - [8192, 1024, 1, 1024]
    - [412, 0.0]
  - - [8192, 1024, 1, 4096]
    - [413, 0.0]
  - - [12288, 1024, 1, 256]
    - [414, 0.0]
  - - [12288, 1024, 1, 1024]
    - [410, 0.0]
  - - [12288, 1024, 1, 4096]
    - [415, 0.0]
  - - [16384, 1024, 1, 1024]
    - [416, 0.0]
  - - [6144, 1536, 1, 256]
    - [417, 0.0]
  - - [6144, 1536, 1, 1024]
    - [418, 0.0]
  - - [6144, 1536, 1, 4096]
    - [401, 0.0]
  - - [8192, 1536, 1, 256]
    - [419, 0.0]
  - - [8192, 1536, 1, 1024]
    - [419, 0.0]
  - - [8192, 1536, 1, 4096]
    - [420, 0.0]
  - - [12288, 1536, 1, 1024]
    - [404, 0.0]
  - - [16384, 1536, 1, 1024]
    - [407, 0.0]
  - - [1, 2048, 1, 1024]
    - [421, 0.0]
  - - [1, 2048, 1, 4096]
    - [422, 0.0]
  - - [1, 2048, 1, 16384]
    - [423, 0.0]
  - - [1, 3072, 1, 1024]
    - [424, 0.0]
  - - [1, 3072, 1, 4096]
    - [425, 0.0]
  - - [1, 3072, 1, 16384]
    - [426, 0.0]
  - - [1, 4096, 1, 1024]
    - [427, 0.0]
  - - [1, 4096, 1, 4096]
    - [425, 0.0]
  - - [1, 4096, 1, 16384]
    - [428, 0.0]
  - - [16, 2048, 1, 1024]
    - [429, 0.0]
  - - [16, 2048, 1, 4096]
    - [430, 0.0]
  - - [16, 2048, 1, 16384]
    - [431, 0.0]
  - - [16, 3072, 1, 1024]
    - [432, 0.0]
  - - [16, 3072, 1, 4096]
    - [433, 0.0]
  - - [16, 3072, 1, 16384]
    - [434, 0.0]
  - - [16, 4096, 1, 1024]
    - [435, 0.0]
  - - [16, 4096, 1, 4096]
    - [436, 0.0]
  - - [16, 4096, 1, 16384]
    - [437, 0.0]
  - - [32, 2048, 1, 1024]
    - [438, 0.0]
  - - [32, 2048, 1, 4096]
    - [439, 0.0]
  - - [32, 2048, 1, 16384]
    - [440, 0.0]
  - - [32, 3072, 1, 1024]
    - [439, 0.0]
  - - [32, 3072, 1, 4096]
    - [441, 0.0]
  - - [32, 3072, 1, 16384]
    - [442, 0.0]
  - - [32, 4096, 1, 1024]
    - [443, 0.0]
  - - [32, 4096, 1, 4096]
    - [444, 0.0]
  - - [32, 4096, 1, 16384]
    - [445, 0.0]
  - - [64, 2048, 1, 1024]
    - [446, 0.0]
  - - [64, 2048, 1, 4096]
    - [447, 0.0]
  - - [64, 2048, 1, 16384]
    - [448, 0.0]
  - - [64, 3072, 1, 1024]
    - [449, 0.0]
  - - [64, 3072, 1, 4096]
    - [450, 0.0]
  - - [64, 3072, 1, 16384]
    - [451, 0.0]
  - - [64, 4096, 1, 1024]
    - [452, 0.0]
  - - [64, 4096, 1, 4096]
    - [453, 0.0]
  - - [64, 4096, 1, 16384]
    - [454, 0.0]
  - - [128, 2048, 1, 1024]
    - [455, 0.0]
  - - [128, 2048, 1, 4096]
    - [456, 0.0]
  - - [128, 2048, 1, 16384]
    - [457, 0.0]
  - - [128, 3072, 1, 1024]
    - [458, 0.0]
  - - [128, 3072, 1, 4096]
    - [459, 0.0]
  - - [128, 3072, 1, 16384]
    - [460, 0.0]
  - - [128, 4096, 1, 1024]
    - [461, 0.0]
  - - [128, 4096, 1, 4096]
    - [462, 0.0]
  - - [128, 4096, 1, 16384]
    - [457, 0.0]
  - - [256, 2048, 1, 1024]
    - [463, 0.0]
  - - [256, 2048, 1, 4096]
    - [464, 0.0]
  - - [256, 2048, 1, 16384]
    - [465, 0.0]
  - - [256, 3072, 1, 1024]
    - [466, 0.0]
  - - [256, 3072, 1, 4096]
    - [467, 0.0]
  - - [256, 3072, 1, 16384]
    - [468, 0.0]
  - - [256, 4096, 1, 256]
    - [469, 0.0]
  - - [256, 4096, 1, 1024]
    - [469, 0.0]
  - - [256, 4096, 1, 4096]
    - [470, 0.0]
  - - [512, 2048, 1, 256]
    - [471, 0.0]
  - - [512, 2048, 1, 1024]
    - [472, 0.0]
  - - [512, 2048, 1, 4096]
    - [473, 0.0]
  - - [512, 3072, 1, 256]
    - [474, 0.0]
  - - [512, 3072, 1, 1024]
    - [475, 0.0]
  - - [512, 3072, 1, 4096]
    - [476, 0.0]
  - - [512, 4096, 1, 256]
    - [477, 0.0]
  - - [512, 4096, 1, 1024]
    - [478, 0.0]
  - - [512, 4096, 1, 4096]
    - [479, 0.0]
  - - [768, 2048, 1, 256]
    - [480, 0.0]
  - - [768, 2048, 1, 1024]
    - [481, 0.0]
  - - [768, 2048, 1, 4096]
    - [475, 0.0]
  - - [1024, 2048, 1, 256]
    - [482, 0.0]
  - - [1024, 2048, 1, 1024]
    - [483, 0.0]
  - - [1024, 2048, 1, 4096]
    - [484, 0.0]
  - - [1536, 2048, 1, 256]
    - [485, 0.0]
  - - [1536, 2048, 1, 1024]
    - [486, 0.0]
  - - [1536, 2048, 1, 4096]
    - [487, 0.0]
  - - [768, 3072, 1, 256]
    - [487, 0.0]
  - - [768, 3072, 1, 1024]
    - [488, 0.0]
  - - [768, 3072, 1, 4096]
    - [489, 0.0]
  - - [1024, 3072, 1, 256]
    - [490, 0.0]
  - - [1024, 3072, 1, 1024]
    - [491, 0.0]
  - - [1024, 3072, 1, 4096]
    - [492, 0.0]
  - - [1536, 3072, 1, 256]
    - [493, 0.0]
  - - [1536, 3072, 1, 1024]
    - [494, 0.0]
  - - [1536, 3072, 1, 4096]
    - [495, 0.0]
  - - [768, 4096, 1, 256]
    - [496, 0.0]
  - - [768, 4096, 1, 1024]
    - [497, 0.0]
  - - [768, 4096, 1, 4096]
    - [492, 0.0]
  - - [1024, 4096, 1, 256]
    - [479, 0.0]
  - - [1024, 4096, 1, 1024]
    - [479, 0.0]
  - - [1024, 4096, 1, 4096]
    - [498, 0.0]
  - - [1536, 4096, 1, 256]
    - [499, 0.0]
  - - [1536, 4096, 1, 1024]
    - [500, 0.0]
  - - [1536, 4096, 1, 4096]
    - [501, 0.0]
  - - [2048, 2048, 1, 256]
    - [502, 0.0]
  - - [2048, 2048, 1, 1024]
    - [503, 0.0]
  - - [2048, 2048, 1, 4096]
    - [504, 0.0]
  - - [3072, 2048, 1, 256]
    - [505, 0.0]
  - - [3072, 2048, 1, 1024]
    - [506, 0.0]
  - - [3072, 2048, 1, 4096]
    - [507, 0.0]
  - - [4096, 2048, 1, 256]
    - [508, 0.0]
  - - [4096, 2048, 1, 1024]
    - [509, 0.0]
  - - [4096, 2048, 1, 4096]
    - [510, 0.0]
  - - [2048, 3072, 1, 256]
    - [511, 0.0]
  - - [2048, 3072, 1, 1024]
    - [512, 0.0]
  - - [2048, 3072, 1, 4096]
    - [513, 0.0]
  - - [3072, 3072, 1, 256]
    - [514, 0.0]
  - - [3072, 3072, 1, 1024]
    - [515, 0.0]
  - - [3072, 3072, 1, 4096]
    - [516, 0.0]
  - - [4096, 3072, 1, 256]
    - [517, 0.0]
  - - [4096, 3072, 1, 1024]
    - [518, 0.0]
  - - [4096, 3072, 1, 4096]
    - [518, 0.0]
  - - [2048, 4096, 1, 256]
    - [508, 0.0]
  - - [2048, 4096, 1, 1024]
    - [519, 0.0]
  - - [2048, 4096, 1, 4096]
    - [504, 0.0]
  - - [3072, 4096, 1, 256]
    - [520, 0.0]
  - - [3072, 4096, 1, 1024]
    - [521, 0.0]
  - - [3072, 4096, 1, 4096]
    - [513, 0.0]
  - - [4096, 4096, 1, 1024]
    - [522, 0.0]
  - - [6144, 2048, 1, 256]
    - [523, 0.0]
  - - [6144, 2048, 1, 1024]
    - [524, 0.0]
  - - [6144, 2048, 1, 4096]
    - [419, 0.0]
  - - [8192, 2048, 1, 1024]
    - [525, 0.0]
  - - [12288, 2048, 1, 1024]
    - [526, 0.0]
  - - [16384, 2048, 1, 1024]
    - [526, 0.0]
  - - [6144, 3072, 1, 1024]
    - [527, 0.0]
  - - [8192, 3072, 1, 1024]
    - [528, 0.0]
  - - [12288, 3072, 1, 1024]
    - [529, 0.0]
  - - [16384, 3072, 1, 1024]
    - [530, 0.0]
  - - [6144, 4096, 1, 1024]
    - [531, 0.0]
  - - [8192, 4096, 1, 1024]
    - [532, 0.0]
  - - [12288, 4096, 1, 1024]
    - [533, 0.0]
  - - [16384, 4096, 1, 1024]
    - [525, 0.0]
  - - [1, 6144, 1, 1024]
    - [534, 0.0]
  - - [1, 6144, 1, 4096]
    - [535, 0.0]
  - - [1, 6144, 1, 16384]
    - [536, 0.0]
  - - [1, 8192, 1, 1024]
    - [537, 0.0]
  - - [1, 8192, 1, 4096]
    - [538, 0.0]
  - - [1, 8192, 1, 16384]
    - [539, 0.0]
  - - [1, 12288, 1, 1024]
    - [540, 0.0]
  - - [1, 12288, 1, 4096]
    - [541, 0.0]
  - - [1, 12288, 1, 16384]
    - [542, 0.0]
  - - [16, 6144, 1, 1024]
    - [543, 0.0]
  - - [16, 6144, 1, 4096]
    - [544, 0.0]
  - - [16, 6144, 1, 16384]
    - [545, 0.0]
  - - [16, 8192, 1, 1024]
    - [546, 0.0]
  - - [16, 8192, 1, 4096]
    - [547, 0.0]
  - - [16, 8192, 1, 16384]
    - [548, 0.0]
  - - [16, 12288, 1, 1024]
    - [549, 0.0]
  - - [16, 12288, 1, 4096]
    - [550, 0.0]
  - - [16, 12288, 1, 16384]
    - [551, 0.0]
  - - [32, 6144, 1, 1024]
    - [552, 0.0]
  - - [32, 6144, 1, 4096]
    - [553, 0.0]
  - - [32, 6144, 1, 16384]
    - [554, 0.0]
  - - [32, 8192, 1, 1024]
    - [555, 0.0]
  - - [32, 8192, 1, 4096]
    - [555, 0.0]
  - - [32, 8192, 1, 16384]
    - [556, 0.0]
  - - [32, 12288, 1, 1024]
    - [553, 0.0]
  - - [32, 12288, 1, 4096]
    - [557, 0.0]
  - - [32, 12288, 1, 16384]
    - [558, 0.0]
  - - [64, 6144, 1, 1024]
    - [559, 0.0]
  - - [64, 6144, 1, 4096]
    - [560, 0.0]
  - - [64, 6144, 1, 16384]
    - [561, 0.0]
  - - [64, 8192, 1, 1024]
    - [562, 0.0]
  - - [64, 8192, 1, 4096]
    - [563, 0.0]
  - - [64, 8192, 1, 16384]
    - [564, 0.0]
  - - [64, 12288, 1, 1024]
    - [565, 0.0]
  - - [64, 12288, 1, 4096]
    - [566, 0.0]
  - - [64, 12288, 1, 16384]
    - [567, 0.0]
  - - [128, 6144, 1, 1024]
    - [568, 0.0]
  - - [128, 6144, 1, 4096]
    - [569, 0.0]
  - - [128, 6144, 1, 16384]
    - [570, 0.0]
  - - [128, 8192, 1, 256]
    - [571, 0.0]
  - - [128, 8192, 1, 1024]
    - [572, 0.0]
  - - [128, 8192, 1, 4096]
    - [573, 0.0]
  - - [128, 12288, 1, 256]
    - [574, 0.0]
  - - [128, 12288, 1, 1024]
    - [575, 0.0]
  - - [128, 12288, 1, 4096]
    - [576, 0.0]
  - - [256, 6144, 1, 256]
    - [577, 0.0]
  - - [256, 6144, 1, 1024]
    - [578, 0.0]
  - - [256, 6144, 1, 4096]
    - [579, 0.0]
  - - [256, 8192, 1, 256]
    - [580, 0.0]
  - - [256, 8192, 1, 1024]
    - [581, 0.0]
  - - [256, 8192, 1, 4096]
    - [582, 0.0]
  - - [256, 12288, 1, 256]
    - [583, 0.0]
  - - [256, 12288, 1, 1024]
    - [584, 0.0]
  - - [256, 12288, 1, 4096]
    - [585, 0.0]
  - - [512, 6144, 1, 256]
    - [586, 0.0]
  - - [512, 6144, 1, 1024]
    - [587, 0.0]
  - - [512, 6144, 1, 4096]
    - [588, 0.0]
  - - [512, 8192, 1, 256]
    - [589, 0.0]
  - - [512, 8192, 1, 1024]
    - [590, 0.0]
  - - [512, 8192, 1, 4096]
    - [591, 0.0]
  - - [512, 12288, 1, 256]
    - [592, 0.0]
  - - [512, 12288, 1, 1024]
    - [593, 0.0]
  - - [512, 12288, 1, 4096]
    - [594, 0.0]
  - - [768, 6144, 1, 256]
    - [595, 0.0]
  - - [768, 6144, 1, 1024]
    - [596, 0.0]
  - - [768, 6144, 1, 4096]
    - [597, 0.0]
  - - [1024, 6144, 1, 256]
    - [598, 0.0]
  - - [1024, 6144, 1, 1024]
    - [599, 0.0]
  - - [1024, 6144, 1, 4096]
    - [600, 0.0]
  - - [1536, 6144, 1, 256]
    - [601, 0.0]
  - - [1536, 6144, 1, 1024]
    - [597, 0.0]
  - - [1536, 6144, 1, 4096]
    - [596, 0.0]
  - - [768, 8192, 1, 256]
    - [602, 0.0]
  - - [768, 8192, 1, 1024]
    - [603, 0.0]
  - - [768, 8192, 1, 4096]
    - [604, 0.0]
  - - [1024, 8192, 1, 256]
    - [605, 0.0]
  - - [1024, 8192, 1, 1024]
    - [606, 0.0]
  - - [1024, 8192, 1, 4096]
    - [606, 0.0]
  - - [1536, 8192, 1, 256]
    - [606, 0.0]
  - - [1536, 8192, 1, 1024]
    - [606, 0.0]
  - - [1536, 8192, 1, 4096]
    - [607, 0.0]
  - - [768, 12288, 1, 256]
    - [608, 0.0]
  - - [768, 12288, 1, 1024]
    - [609, 0.0]
  - - [768, 12288, 1, 4096]
    - [596, 0.0]
  - - [1024, 12288, 1, 256]
    - [610, 0.0]
  - - [1024, 12288, 1, 1024]
    - [610, 0.0]
  - - [1024, 12288, 1, 4096]
    - [610, 0.0]
  - - [1536, 12288, 1, 1024]
    - [610, 0.0]
  - - [2048, 6144, 1, 256]
    - [611, 0.0]
  - - [2048, 6144, 1, 1024]
    - [611, 0.0]
  - - [2048, 6144, 1, 4096]
    - [612, 0.0]
  - - [3072, 6144, 1, 1024]
    - [612, 0.0]
  - - [4096, 6144, 1, 1024]
    - [613, 0.0]
  - - [2048, 8192, 1, 1024]
    - [607, 0.0]
  - - [3072, 8192, 1, 1024]
    - [606, 0.0]
  - - [4096, 8192, 1, 1024]
    - [614, 0.0]
  - - [2048, 12288, 1, 1024]
    - [615, 0.0]
  - - [3072, 12288, 1, 1024]
    - [611, 0.0]
  - - [4096, 12288, 1, 1024]
    - [616, 0.0]
  - - [6144, 6144, 1, 1024]
    - [617, 0.0]
  - - [8192, 6144, 1, 1024]
    - [618, 0.0]
  - - [12288, 6144, 1, 1024]
    - [619, 0.0]
  - - [16384, 6144, 1, 1024]
    - [614, 0.0]
  - - [6144, 8192, 1, 1024]
    - [620, 0.0]
  - - [8192, 8192, 1, 1024]
    - [614, 0.0]
  - - [12288, 8192, 1, 1024]
    - [621, 0.0]
  - - [16384, 8192, 1, 1024]
    - [622, 0.0]
  - - [6144, 12288, 1, 1024]
    - [618, 0.0]
  - - [8192, 12288, 1, 1024]
    - [623, 0.0]
  - - [1, 16384, 1, 1024]
    - [624, 0.0]
  - - [1, 16384, 1, 4096]
    - [625, 0.0]
  - - [1, 16384, 1, 16384]
    - [626, 0.0]
  - - [16, 16384, 1, 1024]
    - [627, 0.0]
  - - [16, 16384, 1, 4096]
    - [628, 0.0]
  - - [16, 16384, 1, 16384]
    - [629, 0.0]
  - - [32, 16384, 1, 1024]
    - [630, 0.0]
  - - [32, 16384, 1, 4096]
    - [631, 0.0]
  - - [32, 16384, 1, 16384]
    - [632, 0.0]
  - - [64, 16384, 1, 256]
    - [633, 0.0]
  - - [64, 16384, 1, 1024]
    - [634, 0.0]
  - - [64, 16384, 1, 4096]
    - [635, 0.0]
  - - [128, 16384, 1, 256]
    - [636, 0.0]
  - - [128, 16384, 1, 1024]
    - [637, 0.0]
  - - [128, 16384, 1, 4096]
    - [638, 0.0]
  - - [256, 16384, 1, 256]
    - [639, 0.0]
  - - [256, 16384, 1, 1024]
    - [640, 0.0]
  - - [256, 16384, 1, 4096]
    - [641, 0.0]
  - - [512, 16384, 1, 256]
    - [618, 0.0]
  - - [512, 16384, 1, 1024]
    - [618, 0.0]
  - - [512, 16384, 1, 4096]
    - [616, 0.0]
  - - [768, 16384, 1, 256]
    - [642, 0.0]
  - - [768, 16384, 1, 1024]
    - [606, 0.0]
  - - [768, 16384, 1, 4096]
    - [643, 0.0]
  - - [1024, 16384, 1, 1024]
    - [606, 0.0]
  - - [1536, 16384, 1, 1024]
    - [618, 0.0]
  - - [2048, 16384, 1, 1024]
    - [644, 0.0]
  - - [3072, 16384, 1, 1024]
    - [645, 0.0]
  - - [4096, 16384, 1, 1024]
    - [619, 0.0]
  - - [6144, 16384, 1, 1024]
    - [623, 0.0]
  - - [8192, 16384, 1, 1024]
    - [646, 0.0]
- null
- null
- DeviceEfficiency
- GridBased
