projects/hipblaslt/library/src/amd_detail/rocblaslt/src/Tensile/Logic/asm_full/aquavanjaram/gfx942/GridBased/aquavanjaram_Cijk_Alik_Bljk_HSS_STA_BH_Bias_HA_S_SAV_UserArgs.yaml
- {MinimumRequiredVersion: 5.0.0}
- aquavanjaram
- gfx942
- [Device 0049, Device 0050]
    SolutionIndex: 0
    SolutionNameMin: Cijk_Alik_Bljk_HSS_STA_BH_Bias_HA_S_SAV_UserArgs_MT32x16x64_MI16x16x1_SN_LDSB0_AFC1_AFEM1_AFEM1_ASEM1_CLR1_CADS0_DTVA1_DTVB0_EPS0_FDSI0_GRPM1_GRVWA8_GRVWB8_GSU1_GSUAMB_GSUC0_GSUWGMRR0_GLS0_ISA942_IU1_K1_LBSPPA0_LBSPPB128_LBSPPM0_LPA0_LPB16_LPM0_LRVW8_LWPMn1_MIAV0_MIWT1_1_MO40_NTn1_NTA0_NTB0_NTC0_NTD4_NTM0_NEPBS16_NLCA2_NLCB1_ONLL1_PGR2_PLR1_PKA1_SIA3_SS1_SU8_SUM1_SUS128_SPO0_SRVW0_SSO0_SVW1_SK0_SKXCCM0_TLDS1_ULSGRO0_USL1_UIOFGRO0_USFGROn1_VSn1_VWA1_VWB1_WSGRA0_WSGRB0_WS64_WG32_4_1_WGM6_WGMXCC8_WGMXCCGn1
    SolutionIndex: 1
    SolutionNameMin: Cijk_Alik_Bljk_HSS_STA_BH_Bias_HA_S_SAV_UserArgs_MT16x16x128_MI16x16x1_SN_LDSB0_AFC1_AFEM1_AFEM1_ASEM1_CLR1_CADS0_DTVA1_DTVB0_EPS0_FDSI0_GRPM1_GRVWA8_GRVWB8_GSU1_GSUAMB_GSUC0_GSUWGMRR0_GLS0_ISA942_IU1_K1_LBSPPA0_LBSPPB256_LBSPPM0_LPA0_LPB16_LPM0_LRVW8_LWPMn1_MIAV0_MIWT1_1_MO40_NTn1_NTA0_NTB0_NTC0_NTD4_NTM0_NEPBS16_NLCA4_NLCB1_ONLL1_PGR2_PLR1_PKA1_SIA3_SS1_SU8_SUM1_SUS256_SPO0_SRVW0_SSO0_SVW1_SK0_SKXCCM0_TLDS1_ULSGRO0_USL1_UIOFGRO0_USFGROn1_VSn1_VWA1_VWB1_WSGRA0_WSGRB0_WS64_WG16_4_1_WGM6_WGMXCC8_WGMXCCGn1
    SolutionIndex: 2
    SolutionNameMin: Cijk_Alik_Bljk_HSS_STA_BH_Bias_HA_S_SAV_UserArgs_MT32x16x64_MI16x16x1_SN_LDSB0_AFC1_AFEM1_AFEM1_ASEM1_CLR1_CADS0_DTVA1_DTVB0_EPS0_FDSI0_GRPM1_GRVWA8_GRVWB8_GSU1_GSUAMB_GSUC0_GSUWGMRR0_GLS0_ISA942_IU1_K1_LBSPPA0_LBSPPB128_LBSPPM0_LPA0_LPB16_LPM0_LRVW8_LWPMn1_MIAV0_MIWT1_1_MO40_NTn1_NTA0_NTB0_NTC0_NTD4_NTM0_NEPBS16_NLCA2_NLCB1_ONLL1_PGR2_PLR1_PKA1_SIA3_SS1_SU8_SUM1_SUS128_SPO0_SRVW0_SSO0_SVW1_SK0_SKXCCM0_TLDS1_ULSGRO0_USL1_UIOFGRO0_USFGROn1_VSn1_VWA1_VWB1_WSGRA0_WSGRB0_WS64_WG32_4_1_WGM1_WGMXCC8_WGMXCCGn1
    SolutionIndex: 3
    SolutionNameMin: Cijk_Alik_Bljk_HSS_STA_BH_Bias_HA_S_SAV_UserArgs_MT320x16x128_MI16x16x1_SN_LDSB0_AFC1_AFEM1_AFEM1_ASEM1_CLR1_CADS0_DTVA1_DTVB0_EPS0_FDSI0_GRPM1_GRVWA8_GRVWB8_GSU1_GSUAMB_GSUC0_GSUWGMRR0_GLS0_ISA942_IU1_K1_LBSPPA0_LBSPPB256_LBSPPM0_LPA0_LPB16_LPM0_LRVW8_LWPMn1_MIAV0_MIWT5_1_MO40_NTn1_NTA4_NTB0_NTC0_NTD4_NTM0_NEPBS16_NLCA4_NLCB1_ONLL1_PGR2_PLR1_PKA1_SIA3_SS1_SU16_SUM1_SUS256_SPO0_SRVW0_SSO0_SVW1_SK0_SKXCCM0_TLDS1_ULSGRO0_USL1_UIOFGRO0_USFGROn1_VSn1_VWA1_VWB1_WSGRA0_WSGRB0_WS64_WG64_4_1_WGM8_WGMXCC8_WGMXCCGn1
    SolutionIndex: 4
    SolutionNameMin: Cijk_Alik_Bljk_HSS_STA_BH_Bias_HA_S_SAV_UserArgs_MT64x16x256_MI16x16x1_SN_LDSB0_AFC1_AFEM1_AFEM1_ASEM1_CLR1_CADS0_DTVA1_DTVB0_EPS0_FDSI0_GRPM1_GRVWA8_GRVWB8_GSU1_GSUAMB_GSUC0_GSUWGMRR0_GLS0_ISA942_IU1_K1_LBSPPA0_LBSPPB512_LBSPPM0_LPA0_LPB16_LPM0_LRVW8_LWPMn1_MIAV0_MIWT1_1_MO40_NTn1_NTA4_NTB0_NTC0_NTD4_NTM0_NEPBS16_NLCA8_NLCB1_ONLL1_PGR2_PLR1_PKA1_SIA3_SS1_SU8_SUM1_SUS512_SPO0_SRVW0_SSO0_SVW1_SK0_SKXCCM0_TLDS1_ULSGRO0_USL1_UIOFGRO0_USFGROn1_VSn1_VWA1_VWB1_WSGRA0_WSGRB0_WS64_WG64_4_1_WGM1_WGMXCC8_WGMXCCGn1
    SolutionIndex: 5
    SolutionNameMin: Cijk_Alik_Bljk_HSS_STA_BH_Bias_HA_S_SAV_UserArgs_MT128x16x256_MI16x16x1_SN_LDSB0_AFC1_AFEM1_AFEM1_ASEM1_CLR1_CADS0_DTVA1_DTVB0_EPS0_FDSI0_GRPM1_GRVWA8_GRVWB8_GSU1_GSUAMB_GSUC0_GSUWGMRR0_GLS0_ISA942_IU1_K1_LBSPPA0_LBSPPB512_LBSPPM0_LPA0_LPB16_LPM0_LRVW8_LWPMn1_MIAV0_MIWT2_1_MO40_NTn1_NTA4_NTB0_NTC0_NTD4_NTM0_NEPBS16_NLCA8_NLCB1_ONLL1_PGR2_PLR1_PKA1_SIA3_SS1_SU8_SUM1_SUS512_SPO0_SRVW0_SSO0_SVW1_SK0_SKXCCM0_TLDS1_ULSGRO0_USL1_UIOFGRO0_USFGROn1_VSn1_VWA1_VWB1_WSGRA0_WSGRB0_WS64_WG64_4_1_WGM1_WGMXCC8_WGMXCCGn1
    SolutionIndex: 6
    SolutionNameMin: Cijk_Alik_Bljk_HSS_STA_BH_Bias_HA_S_SAV_UserArgs_MT192x16x128_MI16x16x1_SN_LDSB0_AFC1_AFEM1_AFEM1_ASEM1_CLR1_CADS0_DTVA1_DTVB0_EPS0_FDSI0_GRPM1_GRVWA8_GRVWB8_GSU1_GSUAMB_GSUC0_GSUWGMRR0_GLS0_ISA942_IU1_K1_LBSPPA0_LBSPPB256_LBSPPM0_LPA0_LPB16_LPM0_LRVW8_LWPMn1_MIAV0_MIWT3_1_MO40_NTn1_NTA4_NTB0_NTC0_NTD4_NTM0_NEPBS16_NLCA4_NLCB1_ONLL1_PGR2_PLR1_PKA1_SIA3_SS1_SU16_SUM1_SUS256_SPO0_SRVW0_SSO0_SVW1_SK0_SKXCCM0_TLDS1_ULSGRO0_USL1_UIOFGRO0_USFGROn1_VSn1_VWA1_VWB1_WSGRA0_WSGRB0_WS64_WG64_4_1_WGM1_WGMXCC8_WGMXCCGn1
    SolutionIndex: 7
    SolutionNameMin: Cijk_Alik_Bljk_HSS_STA_BH_Bias_HA_S_SAV_UserArgs_MT64x16x512_MI16x16x1_SN_LDSB1_AFC1_AFEM1_AFEM1_ASEM1_CLR1_CADS0_DTVA1_DTVB0_EPS0_FDSI0_GRPM1_GRVWA8_GRVWB8_GSU1_GSUAMB_GSUC0_GSUWGMRR0_GLS0_ISA942_IU1_K1_LBSPPA0_LBSPPB1024_LBSPPM0_LPA0_LPB16_LPM0_LRVW8_LWPMn1_MIAV0_MIWT1_1_MO40_NTn1_NTA4_NTB0_NTC0_NTD4_NTM0_NEPBS16_NLCA16_NLCB1_ONLL1_PGR2_PLR1_PKA1_SIA3_SS1_SU8_SUM1_SUS1024_SPO0_SRVW0_SSO0_SVW1_SK0_SKXCCM0_TLDS1_ULSGRO0_USL1_UIOFGRO0_USFGROn1_VSn1_VWA1_VWB1_WSGRA0_WSGRB0_WS64_WG64_4_1_WGM8_WGMXCC8_WGMXCCGn1
    SolutionIndex: 8
    SolutionNameMin: Cijk_Alik_Bljk_HSS_STA_BH_Bias_HA_S_SAV_UserArgs_MT128x16x128_MI16x16x1_SN_LDSB0_AFC1_AFEM1_AFEM1_ASEM1_CLR1_CADS0_DTVA1_DTVB0_EPS0_FDSI0_GRPM1_GRVWA8_GRVWB8_GSU1_GSUAMB_GSUC0_GSUWGMRR0_GLS0_ISA942_IU1_K1_LBSPPA0_LBSPPB256_LBSPPM0_LPA0_LPB16_LPM0_LRVW8_LWPMn1_MIAV0_MIWT2_1_MO40_NTn1_NTA4_NTB0_NTC0_NTD4_NTM0_NEPBS16_NLCA4_NLCB1_ONLL1_PGR2_PLR1_PKA1_SIA3_SS1_SU8_SUM1_SUS256_SPO0_SRVW0_SSO0_SVW1_SK0_SKXCCM0_TLDS1_ULSGRO0_USL1_UIOFGRO0_USFGROn1_VSn1_VWA1_VWB1_WSGRA0_WSGRB0_WS64_WG64_4_1_WGM1_WGMXCC8_WGMXCCGn1
    SolutionIndex: 9
    SolutionNameMin: Cijk_Alik_Bljk_HSS_STA_BH_Bias_HA_S_SAV_UserArgs_MT128x16x64_MI16x16x1_SN_LDSB0_AFC1_AFEM1_AFEM1_ASEM1_CLR1_CADS0_DTVA1_DTVB0_EPS0_FDSI0_GRPM1_GRVWA8_GRVWB4_GSU1_GSUAMB_GSUC0_GSUWGMRR0_GLS0_ISA942_IU1_K1_LBSPPA0_LBSPPB128_LBSPPM0_LPA0_LPB16_LPM0_LRVW8_LWPMn1_MIAV0_MIWT2_1_MO40_NTn1_NTA4_NTB0_NTC0_NTD4_NTM0_NEPBS16_NLCA2_NLCB1_ONLL1_PGR2_PLR1_PKA1_SIA3_SS1_SU8_SUM1_SUS128_SPO0_SRVW0_SSO0_SVW1_SK0_SKXCCM0_TLDS1_ULSGRO0_USL1_UIOFGRO0_USFGROn1_VSn1_VWA1_VWB1_WSGRA0_WSGRB0_WS64_WG64_4_1_WGM1_WGMXCC8_WGMXCCGn1
    SolutionIndex: 10
    SolutionNameMin: Cijk_Alik_Bljk_HSS_STA_BH_Bias_HA_S_SAV_UserArgs_MT384x16x128_MI16x16x1_SN_LDSB0_AFC1_AFEM1_AFEM1_ASEM1_CLR1_CADS0_DTVA1_DTVB0_EPS0_FDSI0_GRPM1_GRVWA8_GRVWB8_GSU1_GSUAMB_GSUC0_GSUWGMRR0_GLS0_ISA942_IU1_K1_LBSPPA0_LBSPPB256_LBSPPM0_LPA0_LPB16_LPM0_LRVW8_LWPMn1_MIAV0_MIWT6_1_MO40_NTn1_NTA4_NTB0_NTC0_NTD4_NTM0_NEPBS16_NLCA4_NLCB1_ONLL1_PGR2_PLR1_PKA1_SIA3_SS1_SU16_SUM1_SUS256_SPO0_SRVW0_SSO0_SVW1_SK0_SKXCCM0_TLDS1_ULSGRO0_USL1_UIOFGRO0_USFGROn1_VSn1_VWA1_VWB1_WSGRA0_WSGRB0_WS64_WG64_4_1_WGM1_WGMXCC8_WGMXCCGn1
    SolutionIndex: 11
    SolutionNameMin: Cijk_Alik_Bljk_HSS_STA_BH_Bias_HA_S_SAV_UserArgs_MT320x16x64_MI16x16x1_SN_LDSB0_AFC1_AFEM1_AFEM1_ASEM1_CLR1_CADS0_DTVA1_DTVB0_EPS0_FDSI0_GRPM1_GRVWA8_GRVWB4_GSU1_GSUAMB_GSUC0_GSUWGMRR0_GLS0_ISA942_IU1_K1_LBSPPA0_LBSPPB128_LBSPPM0_LPA0_LPB16_LPM0_LRVW8_LWPMn1_MIAV0_MIWT5_1_MO40_NTn1_NTA4_NTB0_NTC0_NTD4_NTM0_NEPBS16_NLCA2_NLCB1_ONLL1_PGR2_PLR1_PKA1_SIA3_SS1_SU8_SUM1_SUS128_SPO0_SRVW0_SSO0_SVW1_SK0_SKXCCM0_TLDS1_ULSGRO0_USL1_UIOFGRO0_USFGROn1_VSn1_VWA1_VWB1_WSGRA0_WSGRB0_WS64_WG64_4_1_WGM1_WGMXCC8_WGMXCCGn1
    SolutionIndex: 12
    SolutionNameMin: Cijk_Alik_Bljk_HSS_STA_BH_Bias_HA_S_SAV_UserArgs_MT64x16x512_MI16x16x1_SN_LDSB1_AFC1_AFEM1_AFEM1_ASEM1_CLR1_CADS0_DTVA1_DTVB0_EPS0_FDSI0_GRPM1_GRVWA8_GRVWB8_GSU1_GSUAMB_GSUC0_GSUWGMRR0_GLS0_ISA942_IU1_K1_LBSPPA0_LBSPPB1024_LBSPPM0_LPA0_LPB16_LPM0_LRVW8_LWPMn1_MIAV0_MIWT1_1_MO40_NTn1_NTA4_NTB0_NTC0_NTD4_NTM0_NEPBS16_NLCA16_NLCB1_ONLL1_PGR2_PLR1_PKA1_SIA3_SS1_SU16_SUM1_SUS1024_SPO0_SRVW0_SSO0_SVW1_SK0_SKXCCM0_TLDS1_ULSGRO0_USL1_UIOFGRO0_USFGROn1_VSn1_VWA1_VWB1_WSGRA0_WSGRB0_WS64_WG64_4_1_WGM8_WGMXCC8_WGMXCCGn1
    SolutionIndex: 13
    SolutionNameMin: Cijk_Alik_Bljk_HSS_STA_BH_Bias_HA_S_SAV_UserArgs_MT256x16x64_MI16x16x1_SN_LDSB0_AFC1_AFEM1_AFEM1_ASEM1_CLR1_CADS0_DTVA1_DTVB0_EPS0_FDSI0_GRPM1_GRVWA8_GRVWB4_GSU1_GSUAMB_GSUC0_GSUWGMRR0_GLS0_ISA942_IU1_K1_LBSPPA0_LBSPPB128_LBSPPM0_LPA0_LPB16_LPM0_LRVW8_LWPMn1_MIAV0_MIWT4_1_MO40_NTn1_NTA4_NTB0_NTC0_NTD4_NTM0_NEPBS16_NLCA2_NLCB1_ONLL1_PGR2_PLR1_PKA1_SIA3_SS1_SU8_SUM1_SUS128_SPO0_SRVW0_SSO0_SVW1_SK0_SKXCCM0_TLDS1_ULSGRO0_USL1_UIOFGRO0_USFGROn1_VSn1_VWA1_VWB1_WSGRA0_WSGRB0_WS64_WG64_4_1_WGM1_WGMXCC8_WGMXCCGn1
    SolutionIndex: 14
    SolutionNameMin: Cijk_Alik_Bljk_HSS_STA_BH_Bias_HA_S_SAV_UserArgs_MT256x16x128_MI16x16x1_SN_LDSB0_AFC1_AFEM1_AFEM1_ASEM1_CLR1_CADS0_DTVA1_DTVB0_EPS0_FDSI0_GRPM1_GRVWA8_GRVWB8_GSU1_GSUAMB_GSUC0_GSUWGMRR0_GLS0_ISA942_IU1_K1_LBSPPA0_LBSPPB256_LBSPPM0_LPA0_LPB16_LPM0_LRVW8_LWPMn1_MIAV0_MIWT4_1_MO40_NTn1_NTA4_NTB0_NTC0_NTD4_NTM0_NEPBS16_NLCA4_NLCB1_ONLL1_PGR2_PLR1_PKA1_SIA3_SS1_SU8_SUM1_SUS256_SPO0_SRVW0_SSO0_SVW1_SK0_SKXCCM0_TLDS1_ULSGRO0_USL1_UIOFGRO0_USFGROn1_VSn1_VWA1_VWB1_WSGRA0_WSGRB0_WS64_WG64_4_1_WGM1_WGMXCC8_WGMXCCGn1
    SolutionIndex: 15
    SolutionNameMin: Cijk_Alik_Bljk_HSS_STA_BH_Bias_HA_S_SAV_UserArgs_MT320x16x128_MI16x16x1_SN_LDSB0_AFC1_AFEM1_AFEM1_ASEM1_CLR1_CADS0_DTVA1_DTVB0_EPS0_FDSI0_GRPM1_GRVWA8_GRVWB8_GSU1_GSUAMB_GSUC0_GSUWGMRR0_GLS0_ISA942_IU1_K1_LBSPPA0_LBSPPB256_LBSPPM0_LPA0_LPB16_LPM0_LRVW8_LWPMn1_MIAV0_MIWT5_1_MO40_NTn1_NTA4_NTB0_NTC0_NTD4_NTM0_NEPBS16_NLCA4_NLCB1_ONLL1_PGR2_PLR1_PKA1_SIA3_SS1_SU8_SUM1_SUS256_SPO0_SRVW0_SSO0_SVW1_SK0_SKXCCM0_TLDS1_ULSGRO0_USL1_UIOFGRO0_USFGROn1_VSn1_VWA1_VWB1_WSGRA0_WSGRB0_WS64_WG64_4_1_WGM1_WGMXCC8_WGMXCCGn1
- - - [1, 1, 1, 1]
    - [0, 0.0]
  - - [127, 127, 1, 127]
    - [0, 0.32]
  - - [127, 128, 1, 127]
    - [2, 0.33]
  - - [1, 127, 1, 127]
    - [0, 0.0]
  - - [128, 128, 1, 128]
    - [1, 0.49]
  - - [37984, 1, 1, 2048]
    - [4, 1.95]
  - - [37984, 2, 1, 2048]
    - [5, 3.86]
  - - [37984, 4, 1, 2048]
    - [5, 7.61]
  - - [37984, 6, 1, 2048]
    - [6, 11.31]
  - - [37984, 8, 1, 2048]
    - [6, 14.86]
  - - [75968, 1, 1, 2048]
    - [7, 2.07]
  - - [75968, 2, 1, 2048]
    - [8, 4.14]
  - - [75968, 4, 1, 2048]
    - [9, 8.1]
  - - [75968, 6, 1, 2048]
    - [10, 12.01]
  - - [75968, 8, 1, 2048]
    - [11, 15.83]
  - - [151936, 1, 1, 2048]
    - [12, 2.15]
  - - [151936, 2, 1, 2048]
    - [3, 4.19]
  - - [151936, 4, 1, 2048]
    - [13, 8.42]
  - - [151936, 6, 1, 2048]
    - [14, 12.6]
  - - [151936, 8, 1, 2048]
    - [15, 16.59]
- null
- null
- DeviceEfficiency
- GridBased
