projects/hipblaslt/library/src/amd_detail/rocblaslt/src/Tensile/Logic/asm_full/aquavanjaram/gfx942/GridBased/aquavanjaram_Cijk_Alik_Bljk_BBS_STA_BH_Bias_HAS_SAV_UserArgs.yaml
- {MinimumRequiredVersion: 4.33.0}
- aquavanjaram
- gfx942
- [Device 0049, Device 0050]
    SolutionIndex: 0
    SolutionNameMin: Cijk_Alik_Bljk_BBS_STA_BH_Bias_HAS_SAV_UserArgs_MT64x32x256_MI16x16x1_SN_LDSB1_GRVWB8_GSU1_GSUAMB_GSUC1_GSUWGMRR1_K1_LBSPPB1024_MIWT2_2_NTA0_NLCA8_SU0_SUM0_SUS0_VWB2_WG32_4_1_WGM1_WGMXCC8_WGMXCCGn1
    SolutionIndex: 1
    SolutionNameMin: Cijk_Alik_Bljk_BBS_STA_BH_Bias_HAS_SAV_UserArgs_MT64x16x256_MI16x16x1_SN_LDSB0_GRVWB8_GSU3_GSUAMBSK_GSUC1_GSUWGMRR1_K1_LBSPPB512_MIWT1_1_NTA4_NLCA8_SU0_SUM0_SUS0_VWB1_WG64_4_1_WGM1_WGMXCC8_WGMXCCGn1
    SolutionIndex: 2
    SolutionNameMin: Cijk_Alik_Bljk_BBS_STA_BH_Bias_HAS_SAV_UserArgs_MT64x32x256_MI16x16x1_SN_LDSB1_GRVWB8_GSU1_GSUC0_GSUWGMRR0_K1_LBSPPB1024_MIWT2_2_NLCA8_SU0_SUM0_SUS0_VWB2_WG32_4_1_WGM6_WGMXCC8_WGMXCCGn1
    SolutionIndex: 3
    SolutionNameMin: Cijk_Alik_Bljk_BBS_STA_BH_Bias_HAS_SAV_UserArgs_MT64x32x256_MI16x16x1_SN_LDSB1_GRVWB8_GSU1_GSUC0_GSUWGMRR0_K1_LBSPPB1024_MIWT2_2_NLCA8_SU0_SUM0_SUS0_VWB2_WG32_4_1_WGM8_WGMXCC8_WGMXCCGn1
    SolutionIndex: 4
    SolutionNameMin: Cijk_Alik_Bljk_BBS_STA_BH_Bias_HAS_SAV_UserArgs_MT128x32x256_MI16x16x1_SN_LDSB1_GRVWB8_GSU1_GSUC0_GSUWGMRR0_K1_LBSPPB1024_MIWT2_2_NLCA8_SU0_SUM0_SUS0_VWB2_WG64_4_1_WGM6_WGMXCC8_WGMXCCGn1
    SolutionIndex: 5
    SolutionNameMin: Cijk_Alik_Bljk_BBS_STA_BH_Bias_HAS_SAV_UserArgs_MT128x32x256_MI16x16x1_SN_LDSB1_GRVWB8_GSU1_GSUC0_GSUWGMRR0_K1_LBSPPB1024_MIWT2_2_NLCA8_SU8_SUM0_SUS512_VWB2_WG64_4_1_WGM8_WGMXCC8_WGMXCCGn1
    SolutionIndex: 6
    SolutionNameMin: Cijk_Alik_Bljk_BBS_STA_BH_Bias_HAS_SAV_UserArgs_MT128x32x256_MI16x16x1_SN_LDSB1_GRVWB8_GSU1_GSUC0_GSUWGMRR0_K1_LBSPPB1024_MIWT2_2_NLCA8_SU0_SUM0_SUS0_VWB2_WG64_4_1_WGM8_WGMXCC8_WGMXCCGn1
    SolutionIndex: 7
    SolutionNameMin: Cijk_Alik_Bljk_BBS_STA_BH_Bias_HAS_SAV_UserArgs_MT128x48x128_MI16x16x1_SN_LDSB0_GRVWB8_GSU1_GSUC0_GSUWGMRR0_K1_LBSPPB256_MIWT2_3_NLCA4_SU0_SUM0_SUS0_VWB1_WG64_4_1_WGM8_WGMXCC8_WGMXCCGn1
    SolutionIndex: 8
    SolutionNameMin: Cijk_Alik_Bljk_BBS_STA_BH_Bias_HAS_SAV_UserArgs_MT128x48x128_MI16x16x1_SN_LDSB0_GRVWB8_GSU1_GSUC0_GSUWGMRR0_K1_LBSPPB256_MIWT2_3_NLCA4_SU0_SUM0_SUS0_VWB1_WG64_4_1_WGM6_WGMXCC8_WGMXCCGn1
    SolutionIndex: 9
    SolutionNameMin: Cijk_Alik_Bljk_BBS_STA_BH_Bias_HAS_SAV_UserArgs_MT128x64x128_MI16x16x1_SN_LDSB1_GRVWB8_GSU1_GSUC0_GSUWGMRR0_K1_LBSPPB1024_MIWT2_4_NLCA4_SU0_SUM0_SUS0_VWB4_WG64_4_1_WGM8_WGMXCC8_WGMXCCGn1
    SolutionIndex: 10
    SolutionNameMin: Cijk_Alik_Bljk_BBS_STA_BH_Bias_HAS_SAV_UserArgs_MT128x64x128_MI16x16x1_SN_LDSB1_GRVWB8_GSU1_GSUC0_GSUWGMRR0_K1_LBSPPB1024_MIWT2_4_NLCA4_SU0_SUM0_SUS0_VWB4_WG64_4_1_WGM6_WGMXCC8_WGMXCCGn1
    SolutionIndex: 11
    SolutionNameMin: Cijk_Alik_Bljk_BBS_STA_BH_Bias_HAS_SAV_UserArgs_MT128x80x128_MI16x16x1_SN_LDSB1_GRVWB8_GSU1_GSUC0_GSUWGMRR0_K1_LBSPPB256_MIWT2_5_NLCA4_SU0_SUM0_SUS0_VWB1_WG64_4_1_WGM8_WGMXCC8_WGMXCCGn1
    SolutionIndex: 12
    SolutionNameMin: Cijk_Alik_Bljk_BBS_STA_BH_Bias_HAS_SAV_UserArgs_MT128x80x128_MI16x16x1_SN_LDSB1_GRVWB8_GSU1_GSUC0_GSUWGMRR0_K1_LBSPPB256_MIWT2_5_NLCA4_SU0_SUM0_SUS0_VWB1_WG64_4_1_WGM6_WGMXCC8_WGMXCCGn1
    SolutionIndex: 13
    SolutionNameMin: Cijk_Alik_Bljk_BBS_STA_BH_Bias_HAS_SAV_UserArgs_MT128x96x128_MI16x16x1_SN_LDSB1_GRVWB8_GSU1_GSUC0_GSUWGMRR0_K1_LBSPPB512_MIWT2_6_NLCA4_SU0_SUM0_SUS0_VWB2_WG64_4_1_WGM6_WGMXCC8_WGMXCCGn1
    SolutionIndex: 14
    SolutionNameMin: Cijk_Alik_Bljk_BBS_STA_BH_Bias_HAS_SAV_UserArgs_MT128x96x128_MI16x16x1_SN_LDSB1_GRVWB8_GSU1_GSUC0_GSUWGMRR0_K1_LBSPPB512_MIWT2_6_NLCA4_SU0_SUM0_SUS0_VWB2_WG64_4_1_WGM8_WGMXCC8_WGMXCCGn1
    SolutionIndex: 15
    SolutionNameMin: Cijk_Alik_Bljk_BBS_STA_BH_Bias_HAS_SAV_UserArgs_MT128x112x128_MI16x16x1_SN_LDSB1_GRVWB8_GSU1_GSUC0_GSUWGMRR0_K1_LBSPPB256_MIWT2_7_NLCA4_SU0_SUM0_SUS0_VWB1_WG64_4_1_WGM6_WGMXCC8_WGMXCCGn1
    SolutionIndex: 16
    SolutionNameMin: Cijk_Alik_Bljk_BBS_STA_BH_Bias_HAS_SAV_UserArgs_MT256x64x128_MI16x16x1_SN_LDSB1_GRVWB8_GSU1_GSUC0_GSUWGMRR0_K1_LBSPPB1024_MIWT4_4_NLCA4_SU0_SUM0_SUS0_VWB4_WG64_4_1_WGM8_WGMXCC8_WGMXCCGn1
    SolutionIndex: 17
    SolutionNameMin: Cijk_Alik_Bljk_BBS_STA_BH_Bias_HAS_SAV_UserArgs_MT256x64x128_MI16x16x1_SN_LDSB1_GRVWB8_GSU1_GSUC0_GSUWGMRR0_K1_LBSPPB1024_MIWT4_4_NLCA4_SU0_SUM0_SUS0_VWB4_WG64_4_1_WGM6_WGMXCC8_WGMXCCGn1
    SolutionIndex: 18
    SolutionNameMin: Cijk_Alik_Bljk_BBS_STA_BH_Bias_HAS_SAV_UserArgs_MT128x128x128_MI16x16x1_SN_LDSB1_GRVWB8_GSU1_GSUC0_GSUWGMRR0_K1_LBSPPB2048_MIWT2_8_NLCA4_SU0_SUM0_SUS0_VWB8_WG64_4_1_WGM6_WGMXCC8_WGMXCCGn1
    SolutionIndex: 19
    SolutionNameMin: Cijk_Alik_Bljk_BBS_STA_BH_Bias_HAS_SAV_UserArgs_MT256x64x128_MI16x16x1_SN_LDSB1_GRVWB8_GSU1_GSUC0_GSUWGMRR0_K1_LBSPPB1024_MIWT4_4_NLCA4_SU0_SUM0_SUS0_VWB4_WG64_4_1_WGM1_WGMXCC8_WGMXCCGn1
    SolutionIndex: 20
    SolutionNameMin: Cijk_Alik_Bljk_BBS_STA_BH_Bias_HAS_SAV_UserArgs_MT192x96x128_MI16x16x1_SN_LDSB1_GRVWB8_GSU1_GSUC0_GSUWGMRR0_K1_LBSPPB512_MIWT3_6_NLCA4_SU0_SUM0_SUS0_VWB2_WG64_4_1_WGM6_WGMXCC8_WGMXCCGn1
    SolutionIndex: 21
    SolutionNameMin: Cijk_Alik_Bljk_BBS_STA_BH_Bias_HAS_SAV_UserArgs_MT256x96x64_MI16x16x1_SN_LDSB0_GRVWB8_GSU1_GSUC0_GSUWGMRR0_K1_LBSPPB256_MIWT4_6_NLCA2_SU0_SUM0_SUS0_VWB2_WG64_4_1_WGM8_WGMXCC8_WGMXCCGn1
    SolutionIndex: 22
    SolutionNameMin: Cijk_Alik_Bljk_BBS_STA_BH_Bias_HAS_SAV_UserArgs_MT256x80x128_MI16x16x1_SN_LDSB1_GRVWB8_GSU1_GSUC0_GSUWGMRR0_K1_LBSPPB256_MIWT4_5_NLCA4_SU0_SUM0_SUS0_VWB1_WG64_4_1_WGM8_WGMXCC8_WGMXCCGn1
    SolutionIndex: 23
    SolutionNameMin: Cijk_Alik_Bljk_BBS_STA_BH_Bias_HAS_SAV_UserArgs_MT256x96x64_MI16x16x1_SN_LDSB0_GRVWB8_GSU1_GSUC0_GSUWGMRR0_K1_LBSPPB256_MIWT4_6_NLCA2_SU0_SUM0_SUS0_VWB2_WG64_4_1_WGM6_WGMXCC8_WGMXCCGn1
    SolutionIndex: 24
    SolutionNameMin: Cijk_Alik_Bljk_BBS_STA_BH_Bias_HAS_SAV_UserArgs_MT256x96x64_MI16x16x1_SN_LDSB0_GRVWB8_GSU1_GSUC0_GSUWGMRR0_K1_LBSPPB256_MIWT4_6_NLCA2_SU0_SUM0_SUS0_VWB2_WG64_4_1_WGM1_WGMXCC8_WGMXCCGn1
    SolutionIndex: 25
    SolutionNameMin: Cijk_Alik_Bljk_BBS_STA_BH_Bias_HAS_SAV_UserArgs_MT256x112x64_MI16x16x1_SN_LDSB1_GRVWB4_GSU1_GSUC0_GSUWGMRR0_K1_LBSPPB128_MIWT4_7_NLCA2_SU0_SUM0_SUS0_VWB1_WG64_4_1_WGM1_WGMXCC8_WGMXCCGn1
    SolutionIndex: 26
    SolutionNameMin: Cijk_Alik_Bljk_BBS_STA_BH_Bias_HAS_SAV_UserArgs_MT192x160x64_MI16x16x1_SN_LDSB1_GRVWB8_GSU1_GSUC0_GSUWGMRR0_K1_LBSPPB256_MIWT3_10_NLCA2_SU0_SUM0_SUS0_VWB2_WG64_4_1_WGM6_WGMXCC8_WGMXCCGn1
    SolutionIndex: 27
    SolutionNameMin: Cijk_Alik_Bljk_BBS_STA_BH_Bias_HAS_SAV_UserArgs_MT256x128x64_MI16x16x1_SN_LDSB1_GRVWB8_GSU1_GSUC0_GSUWGMRR0_K1_LBSPPB1024_MIWT4_8_NLCA2_SU0_SUM0_SUS0_VWB8_WG64_4_1_WGM8_WGMXCC8_WGMXCCGn1
    SolutionIndex: 28
    SolutionNameMin: Cijk_Alik_Bljk_BBS_STA_BH_Bias_HAS_SAV_UserArgs_MT128x48x128_MI16x16x1_SN_LDSB0_GRVWB8_GSU1_GSUC0_GSUWGMRR0_K1_LBSPPB256_MIWT2_3_NLCA4_SU8_SUM0_SUS256_VWB1_WG64_4_1_WGM8_WGMXCC8_WGMXCCGn1
    SolutionIndex: 29
    SolutionNameMin: Cijk_Alik_Bljk_BBS_STA_BH_Bias_HAS_SAV_UserArgs_MT128x64x128_MI16x16x1_SN_LDSB1_GRVWB8_GSU1_GSUC0_GSUWGMRR0_K1_LBSPPB1024_MIWT2_4_NLCA4_SU8_SUM0_SUS256_VWB4_WG64_4_1_WGM8_WGMXCC8_WGMXCCGn1
    SolutionIndex: 30
    SolutionNameMin: Cijk_Alik_Bljk_BBS_STA_BH_Bias_HAS_SAV_UserArgs_MT128x80x128_MI16x16x1_SN_LDSB1_GRVWB8_GSU1_GSUC0_GSUWGMRR0_K1_LBSPPB256_MIWT2_5_NLCA4_SU8_SUM0_SUS256_VWB1_WG64_4_1_WGM8_WGMXCC8_WGMXCCGn1
    SolutionIndex: 31
    SolutionNameMin: Cijk_Alik_Bljk_BBS_STA_BH_Bias_HAS_SAV_UserArgs_MT128x112x128_MI16x16x1_SN_LDSB1_GRVWB8_GSU1_GSUC0_GSUWGMRR0_K1_LBSPPB256_MIWT2_7_NLCA4_SU0_SUM0_SUS0_VWB1_WG64_4_1_WGM8_WGMXCC8_WGMXCCGn1
    SolutionIndex: 32
    SolutionNameMin: Cijk_Alik_Bljk_BBS_STA_BH_Bias_HAS_SAV_UserArgs_MT192x80x128_MI16x16x1_SN_LDSB1_GRVWB8_GSU1_GSUC0_GSUWGMRR0_K1_LBSPPB256_MIWT3_5_NLCA4_SU0_SUM0_SUS0_VWB1_WG64_4_1_WGM6_WGMXCC8_WGMXCCGn1
    SolutionIndex: 33
    SolutionNameMin: Cijk_Alik_Bljk_BBS_STA_BH_Bias_HAS_SAV_UserArgs_MT320x64x64_MI16x16x1_SN_LDSB0_GRVWB8_GSU1_GSUC0_GSUWGMRR0_K1_LBSPPB512_MIWT5_4_NLCA2_SU0_SUM0_SUS0_VWB4_WG64_4_1_WGM8_WGMXCC8_WGMXCCGn1
    SolutionIndex: 34
    SolutionNameMin: Cijk_Alik_Bljk_BBS_STA_BH_Bias_HAS_SAV_UserArgs_MT320x96x64_MI16x16x1_SN_LDSB0_GRVWB8_GSU1_GSUC0_GSUWGMRR0_K1_LBSPPB256_MIWT5_6_NLCA2_SU0_SUM0_SUS0_VWB2_WG64_4_1_WGM8_WGMXCC8_WGMXCCGn1
    SolutionIndex: 35
    SolutionNameMin: Cijk_Alik_Bljk_BBS_STA_BH_Bias_HAS_SAV_UserArgs_MT256x112x64_MI16x16x1_SN_LDSB1_GRVWB4_GSU1_GSUC0_GSUWGMRR0_K1_LBSPPB128_MIWT4_7_NLCA2_SU0_SUM0_SUS0_VWB1_WG64_4_1_WGM8_WGMXCC8_WGMXCCGn1
    SolutionIndex: 36
    SolutionNameMin: Cijk_Alik_Bljk_BBS_STA_BH_Bias_HAS_SAV_UserArgs_MT320x96x64_MI16x16x1_SN_LDSB0_GRVWB8_GSU1_GSUC0_GSUWGMRR0_K1_LBSPPB256_MIWT5_6_NLCA2_SU0_SUM0_SUS0_VWB2_WG64_4_1_WGM6_WGMXCC8_WGMXCCGn1
    SolutionIndex: 37
    SolutionNameMin: Cijk_Alik_Bljk_BBS_STA_BH_Bias_HAS_SAV_UserArgs_MT256x128x64_MI16x16x1_SN_LDSB1_GRVWB8_GSU1_GSUC0_GSUWGMRR0_K1_LBSPPB1024_MIWT4_8_NLCA2_SU0_SUM0_SUS0_VWB8_WG64_4_1_WGM6_WGMXCC8_WGMXCCGn1
    SolutionIndex: 38
    SolutionNameMin: Cijk_Alik_Bljk_BBS_STA_BH_Bias_HAS_SAV_UserArgs_MT256x160x64_MI16x16x1_SN_LDSB0_GRVWB8_GSU1_GSUC0_GSUWGMRR0_K1_LBSPPB256_MIWT4_10_NLCA2_SU0_SUM0_SUS0_VWB2_WG64_4_1_WGM6_WGMXCC8_WGMXCCGn1
    SolutionIndex: 39
    SolutionNameMin: Cijk_Alik_Bljk_BBS_STA_BH_Bias_HAS_SAV_UserArgs_MT256x160x64_MI16x16x1_SN_LDSB0_GRVWB8_GSU1_GSUC0_GSUWGMRR0_K1_LBSPPB256_MIWT4_10_NLCA2_SU0_SUM0_SUS0_VWB2_WG64_4_1_WGM8_WGMXCC8_WGMXCCGn1
    SolutionIndex: 40
    SolutionNameMin: Cijk_Alik_Bljk_BBS_STA_BH_Bias_HAS_SAV_UserArgs_MT256x160x64_MI16x16x1_SN_LDSB0_GRVWB8_GSU1_GSUC0_GSUWGMRR0_K1_LBSPPB256_MIWT4_10_NLCA2_SU8_SUM0_SUS128_VWB2_WG64_4_1_WGM8_WGMXCC8_WGMXCCGn1
    SolutionIndex: 41
    SolutionNameMin: Cijk_Alik_Bljk_BBS_STA_BH_Bias_HAS_SAV_UserArgs_MT256x192x64_MI16x16x1_SN_LDSB0_GRVWB8_GSU1_GSUC0_GSUWGMRR0_K1_LBSPPB512_MIWT4_12_NLCA2_SU0_SUM0_SUS0_VWB4_WG64_4_1_WGM6_WGMXCC8_WGMXCCGn1
    SolutionIndex: 42
    SolutionNameMin: Cijk_Alik_Bljk_BBS_STA_BH_Bias_HAS_SAV_UserArgs_MT256x192x64_MI16x16x1_SN_LDSB0_GRVWB8_GSU1_GSUC0_GSUWGMRR0_K1_LBSPPB512_MIWT4_12_NLCA2_SU0_SUM0_SUS0_VWB4_WG64_4_1_WGM8_WGMXCC8_WGMXCCGn1
    SolutionIndex: 43
    SolutionNameMin: Cijk_Alik_Bljk_BBS_STA_BH_Bias_HAS_SAV_UserArgs_MT256x176x64_MI16x16x1_SN_LDSB0_GRVWB4_GSU1_GSUC0_GSUWGMRR0_K1_LBSPPB128_MIWT4_11_NLCA2_SU0_SUM0_SUS0_VWB1_WG64_4_1_WGM6_WGMXCC8_WGMXCCGn1
    SolutionIndex: 44
    SolutionNameMin: Cijk_Alik_Bljk_BBS_STA_BH_Bias_HAS_SAV_UserArgs_MT256x224x64_MI16x16x1_SN_LDSB0_GRVWB8_GSU1_GSUC0_GSUWGMRR0_K1_LBSPPB256_MIWT4_14_NLCA2_SU0_SUM0_SUS0_VWB2_WG64_4_1_WGM8_WGMXCC8_WGMXCCGn1
    SolutionIndex: 45
    SolutionNameMin: Cijk_Alik_Bljk_BBS_STA_BH_Bias_HAS_SAV_UserArgs_MT256x224x64_MI16x16x1_SN_LDSB0_GRVWB8_GSU1_GSUC0_GSUWGMRR0_K1_LBSPPB256_MIWT4_14_NLCA2_SU0_SUM0_SUS0_VWB2_WG64_4_1_WGM1_WGMXCC8_WGMXCCGn1
    SolutionIndex: 46
    SolutionNameMin: Cijk_Alik_Bljk_BBS_STA_BH_Bias_HAS_SAV_UserArgs_MT128x96x128_MI16x16x1_SN_LDSB1_GRVWB8_GSU1_GSUC0_GSUWGMRR0_K1_LBSPPB512_MIWT2_6_NLCA4_SU8_SUM0_SUS256_VWB2_WG64_4_1_WGM8_WGMXCC8_WGMXCCGn1
    SolutionIndex: 47
    SolutionNameMin: Cijk_Alik_Bljk_BBS_STA_BH_Bias_HAS_SAV_UserArgs_MT128x112x128_MI16x16x1_SN_LDSB1_GRVWB8_GSU1_GSUC0_GSUWGMRR0_K1_LBSPPB256_MIWT2_7_NLCA4_SU8_SUM0_SUS256_VWB1_WG64_4_1_WGM8_WGMXCC8_WGMXCCGn1
    SolutionIndex: 48
    SolutionNameMin: Cijk_Alik_Bljk_BBS_STA_BH_Bias_HAS_SAV_UserArgs_MT192x80x128_MI16x16x1_SN_LDSB1_GRVWB8_GSU1_GSUC0_GSUWGMRR0_K1_LBSPPB256_MIWT3_5_NLCA4_SU0_SUM0_SUS0_VWB1_WG64_4_1_WGM8_WGMXCC8_WGMXCCGn1
    SolutionIndex: 49
    SolutionNameMin: Cijk_Alik_Bljk_BBS_STA_BH_Bias_HAS_SAV_UserArgs_MT192x96x64_MI16x16x1_SN_LDSB0_GRVWB8_GSU1_GSUC0_GSUWGMRR0_K1_LBSPPB256_MIWT3_6_NLCA2_SU0_SUM0_SUS0_VWB2_WG64_4_1_WGM6_WGMXCC8_WGMXCCGn1
    SolutionIndex: 50
    SolutionNameMin: Cijk_Alik_Bljk_BBS_STA_BH_Bias_HAS_SAV_UserArgs_MT320x80x64_MI16x16x1_SN_LDSB0_GRVWB4_GSU1_GSUC0_GSUWGMRR0_K1_LBSPPB128_MIWT5_5_NLCA2_SU0_SUM0_SUS0_VWB1_WG64_4_1_WGM6_WGMXCC8_WGMXCCGn1
    SolutionIndex: 51
    SolutionNameMin: Cijk_Alik_Bljk_BBS_STA_BH_Bias_HAS_SAV_UserArgs_MT384x64x64_MI16x16x1_SN_LDSB0_GRVWB8_GSU1_GSUC0_GSUWGMRR0_K1_LBSPPB512_MIWT6_4_NLCA2_SU0_SUM0_SUS0_VWB4_WG64_4_1_WGM8_WGMXCC8_WGMXCCGn1
    SolutionIndex: 52
    SolutionNameMin: Cijk_Alik_Bljk_BBS_STA_BH_Bias_HAS_SAV_UserArgs_MT448x64x64_MI16x16x1_SN_LDSB0_GRVWB8_GSU1_GSUC0_GSUWGMRR0_K1_LBSPPB512_MIWT7_4_NLCA2_SU0_SUM0_SUS0_VWB4_WG64_4_1_WGM8_WGMXCC8_WGMXCCGn1
    SolutionIndex: 53
    SolutionNameMin: Cijk_Alik_Bljk_BBS_STA_BH_Bias_HAS_SAV_UserArgs_MT192x192x64_MI16x16x1_SN_LDSB0_GRVWB8_GSU1_GSUC0_GSUWGMRR0_K1_LBSPPB512_MIWT3_12_NLCA2_SU0_SUM0_SUS0_VWB4_WG64_4_1_WGM6_WGMXCC8_WGMXCCGn1
    SolutionIndex: 54
    SolutionNameMin: Cijk_Alik_Bljk_BBS_STA_BH_Bias_HAS_SAV_UserArgs_MT256x144x64_MI16x16x1_SN_LDSB0_GRVWB4_GSU1_GSUC0_GSUWGMRR0_K1_LBSPPB128_MIWT4_9_NLCA2_SU8_SUM0_SUS128_VWB1_WG64_4_1_WGM6_WGMXCC8_WGMXCCGn1
    SolutionIndex: 55
    SolutionNameMin: Cijk_Alik_Bljk_BBS_STA_BH_Bias_HAS_SAV_UserArgs_MT256x160x64_MI16x16x1_SN_LDSB0_GRVWB8_GSU1_GSUC0_GSUWGMRR0_K1_LBSPPB256_MIWT4_10_NLCA2_SU8_SUM0_SUS128_VWB2_WG64_4_1_WGM6_WGMXCC8_WGMXCCGn1
    SolutionIndex: 56
    SolutionNameMin: Cijk_Alik_Bljk_BBS_STA_BH_Bias_HAS_SAV_UserArgs_MT192x224x64_MI16x16x1_SN_LDSB0_GRVWB8_GSU1_GSUC0_GSUWGMRR0_K1_LBSPPB256_MIWT3_14_NLCA2_SU0_SUM0_SUS0_VWB2_WG64_4_1_WGM8_WGMXCC8_WGMXCCGn1
    SolutionIndex: 57
    SolutionNameMin: Cijk_Alik_Bljk_BBS_STA_BH_Bias_HAS_SAV_UserArgs_MT320x160x64_MI16x16x1_SN_LDSB0_GRVWB8_GSU1_GSUC0_GSUWGMRR0_K1_LBSPPB256_MIWT5_10_NLCA2_SU0_SUM0_SUS0_VWB2_WG64_4_1_WGM8_WGMXCC8_WGMXCCGn1
    SolutionIndex: 58
    SolutionNameMin: Cijk_Alik_Bljk_BBS_STA_BH_Bias_HAS_SAV_UserArgs_MT256x208x64_MI16x16x1_SN_LDSB1_GRVWB4_GSU1_GSUC0_GSUWGMRR0_K1_LBSPPB128_MIWT4_13_NLCA2_SU0_SUM0_SUS0_VWB1_WG64_4_1_WGM6_WGMXCC8_WGMXCCGn1
    SolutionIndex: 59
    SolutionNameMin: Cijk_Alik_Bljk_BBS_STA_BH_Bias_HAS_SAV_UserArgs_MT256x224x64_MI16x16x1_SN_LDSB0_GRVWB8_GSU1_GSUC0_GSUWGMRR0_K1_LBSPPB256_MIWT4_14_NLCA2_SU0_SUM0_SUS0_VWB2_WG64_4_1_WGM6_WGMXCC8_WGMXCCGn1
    SolutionIndex: 60
    SolutionNameMin: Cijk_Alik_Bljk_BBS_STA_BH_Bias_HAS_SAV_UserArgs_MT384x128x64_MI16x16x1_SN_LDSB0_GRVWB8_GSU1_GSUC0_GSUWGMRR0_K1_LBSPPB1024_MIWT6_8_NLCA2_SU0_SUM0_SUS0_VWB8_WG64_4_1_WGM8_WGMXCC8_WGMXCCGn1
    SolutionIndex: 61
    SolutionNameMin: Cijk_Alik_Bljk_BBS_STA_BH_Bias_HAS_SAV_UserArgs_MT384x160x64_MI16x16x1_SN_LDSB0_GRVWB8_GSU1_GSUC0_GSUWGMRR0_K1_LBSPPB256_MIWT6_10_NLCA2_SU0_SUM0_SUS0_VWB2_WG64_4_1_WGM6_WGMXCC8_WGMXCCGn1
    SolutionIndex: 62
    SolutionNameMin: Cijk_Alik_Bljk_BBS_STA_BH_Bias_HAS_SAV_UserArgs_MT384x160x64_MI16x16x1_SN_LDSB0_GRVWB8_GSU1_GSUC0_GSUWGMRR0_K1_LBSPPB256_MIWT6_10_NLCA2_SU8_SUM0_SUS128_VWB2_WG64_4_1_WGM8_WGMXCC8_WGMXCCGn1
    SolutionIndex: 63
    SolutionNameMin: Cijk_Alik_Bljk_BBS_STA_BH_Bias_HAS_SAV_UserArgs_MT384x144x64_MI16x16x1_SN_LDSB0_GRVWB4_GSU1_GSUC0_GSUWGMRR0_K1_LBSPPB128_MIWT6_9_NLCA2_SU0_SUM0_SUS0_VWB1_WG64_4_1_WGM8_WGMXCC8_WGMXCCGn1
    SolutionIndex: 64
    SolutionNameMin: Cijk_Alik_Bljk_BBS_STA_BH_Bias_HAS_SAV_UserArgs_MT448x128x64_MI16x16x1_SN_LDSB0_GRVWB8_GSU1_GSUC0_GSUWGMRR0_K1_LBSPPB1024_MIWT7_8_NLCA2_SU0_SUM0_SUS0_VWB8_WG64_4_1_WGM8_WGMXCC8_WGMXCCGn1
    SolutionIndex: 65
    SolutionNameMin: Cijk_Alik_Bljk_BBS_STA_BH_Bias_HAS_SAV_UserArgs_MT384x160x64_MI16x16x1_SN_LDSB0_GRVWB8_GSU1_GSUC0_GSUWGMRR0_K1_LBSPPB256_MIWT6_10_NLCA2_SU0_SUM0_SUS0_VWB2_WG64_4_1_WGM8_WGMXCC8_WGMXCCGn1
    SolutionIndex: 66
    SolutionNameMin: Cijk_Alik_Bljk_BBS_STA_BH_Bias_HAS_SAV_UserArgs_MT512x128x64_MI16x16x1_SN_LDSB0_GRVWB8_GSU1_GSUC0_GSUWGMRR0_K1_LBSPPB1024_MIWT8_8_NLCA2_SU0_SUM0_SUS0_VWB8_WG64_4_1_WGM6_WGMXCC8_WGMXCCGn1
    SolutionIndex: 67
    SolutionNameMin: Cijk_Alik_Bljk_BBS_STA_BH_Bias_HAS_SAV_UserArgs_MT384x176x64_MI16x16x1_SN_LDSB0_GRVWB4_GSU1_GSUC0_GSUWGMRR0_K1_LBSPPB128_MIWT6_11_NLCA2_SU0_SUM0_SUS0_VWB1_WG64_4_1_WGM8_WGMXCC8_WGMXCCGn1
    SolutionIndex: 68
    SolutionNameMin: Cijk_Alik_Bljk_BBS_STA_BH_Bias_HAS_SAV_UserArgs_MT512x128x64_MI16x16x1_SN_LDSB0_GRVWB8_GSU1_GSUC0_GSUWGMRR0_K1_LBSPPB1024_MIWT8_8_NLCA2_SU0_SUM0_SUS0_VWB8_WG64_4_1_WGM8_WGMXCC8_WGMXCCGn1
    SolutionIndex: 69
    SolutionNameMin: Cijk_Alik_Bljk_BBS_STA_BH_Bias_HAS_SAV_UserArgs_MT320x128x64_MI16x16x1_SN_LDSB0_GRVWB8_GSU1_GSUC0_GSUWGMRR0_K1_LBSPPB1024_MIWT5_8_NLCA2_SU0_SUM0_SUS0_VWB8_WG64_4_1_WGM8_WGMXCC8_WGMXCCGn1
    SolutionIndex: 70
    SolutionNameMin: Cijk_Alik_Bljk_BBS_STA_BH_Bias_HAS_SAV_UserArgs_MT256x96x64_MI16x16x1_SN_LDSB0_GRVWB8_GSU1_GSUC0_GSUWGMRR0_K1_LBSPPB256_MIWT4_6_NLCA2_SU8_SUM0_SUS128_VWB2_WG64_4_1_WGM8_WGMXCC8_WGMXCCGn1
    SolutionIndex: 71
    SolutionNameMin: Cijk_Alik_Bljk_BBS_STA_BH_Bias_HAS_SAV_UserArgs_MT192x48x128_MI16x16x1_SN_LDSB0_GRVWB8_GSU1_GSUC0_GSUWGMRR0_K1_LBSPPB256_MIWT3_3_NLCA4_SU0_SUM0_SUS0_VWB1_WG64_4_1_WGM8_WGMXCC8_WGMXCCGn1
    SolutionIndex: 72
    SolutionNameMin: Cijk_Alik_Bljk_BBS_STA_BH_Bias_HAS_SAV_UserArgs_MT192x64x128_MI16x16x1_SN_LDSB1_GRVWB8_GSU1_GSUC0_GSUWGMRR0_K1_LBSPPB1024_MIWT3_4_NLCA4_SU0_SUM0_SUS0_VWB4_WG64_4_1_WGM6_WGMXCC8_WGMXCCGn1
    SolutionIndex: 73
    SolutionNameMin: Cijk_Alik_Bljk_BBS_STA_BH_Bias_HAS_SAV_UserArgs_MT128x128x128_MI16x16x1_SN_LDSB1_GRVWB8_GSU1_GSUC0_GSUWGMRR0_K1_LBSPPB2048_MIWT2_8_NLCA4_SU8_SUM0_SUS256_VWB8_WG64_4_1_WGM8_WGMXCC8_WGMXCCGn1
    SolutionIndex: 74
    SolutionNameMin: Cijk_Alik_Bljk_BBS_STA_BH_Bias_HAS_SAV_UserArgs_MT192x96x64_MI16x16x1_SN_LDSB0_GRVWB8_GSU1_GSUC0_GSUWGMRR0_K1_LBSPPB256_MIWT3_6_NLCA2_SU8_SUM0_SUS128_VWB2_WG64_4_1_WGM8_WGMXCC8_WGMXCCGn1
    SolutionIndex: 75
    SolutionNameMin: Cijk_Alik_Bljk_BBS_STA_BH_Bias_HAS_SAV_UserArgs_MT256x80x64_MI16x16x1_SN_LDSB0_GRVWB4_GSU1_GSUC0_GSUWGMRR0_K1_LBSPPB128_MIWT4_5_NLCA2_SU0_SUM0_SUS0_VWB1_WG64_4_1_WGM6_WGMXCC8_WGMXCCGn1
    SolutionIndex: 76
    SolutionNameMin: Cijk_Alik_Bljk_BBS_STA_BH_Bias_HAS_SAV_UserArgs_MT320x80x64_MI16x16x1_SN_LDSB0_GRVWB4_GSU1_GSUC0_GSUWGMRR0_K1_LBSPPB128_MIWT5_5_NLCA2_SU8_SUM0_SUS128_VWB1_WG64_4_1_WGM8_WGMXCC8_WGMXCCGn1
    SolutionIndex: 77
    SolutionNameMin: Cijk_Alik_Bljk_BBS_STA_BH_Bias_HAS_SAV_UserArgs_MT192x128x64_MI16x16x1_SN_LDSB1_GRVWB8_GSU1_GSUC0_GSUWGMRR0_K1_LBSPPB1024_MIWT3_8_NLCA2_SU0_SUM0_SUS0_VWB8_WG64_4_1_WGM6_WGMXCC8_WGMXCCGn1
    SolutionIndex: 78
    SolutionNameMin: Cijk_Alik_Bljk_BBS_STA_BH_Bias_HAS_SAV_UserArgs_MT320x80x64_MI16x16x1_SN_LDSB0_GRVWB4_GSU1_GSUC0_GSUWGMRR0_K1_LBSPPB128_MIWT5_5_NLCA2_SU0_SUM0_SUS0_VWB1_WG64_4_1_WGM8_WGMXCC8_WGMXCCGn1
    SolutionIndex: 79
    SolutionNameMin: Cijk_Alik_Bljk_BBS_STA_BH_Bias_HAS_SAV_UserArgs_MT256x112x64_MI16x16x1_SN_LDSB1_GRVWB4_GSU1_GSUC0_GSUWGMRR0_K1_LBSPPB128_MIWT4_7_NLCA2_SU8_SUM0_SUS128_VWB1_WG64_4_1_WGM8_WGMXCC8_WGMXCCGn1
    SolutionIndex: 80
    SolutionNameMin: Cijk_Alik_Bljk_BBS_STA_BH_Bias_HAS_SAV_UserArgs_MT320x112x64_MI16x16x1_SN_LDSB0_GRVWB4_GSU1_GSUC0_GSUWGMRR0_K1_LBSPPB128_MIWT5_7_NLCA2_SU0_SUM0_SUS0_VWB1_WG64_4_1_WGM8_WGMXCC8_WGMXCCGn1
    SolutionIndex: 81
    SolutionNameMin: Cijk_Alik_Bljk_BBS_STA_BH_Bias_HAS_SAV_UserArgs_MT320x128x64_MI16x16x1_SN_LDSB0_GRVWB8_GSU1_GSUC0_GSUWGMRR0_K1_LBSPPB1024_MIWT5_8_NLCA2_SU8_SUM0_SUS128_VWB8_WG64_4_1_WGM8_WGMXCC8_WGMXCCGn1
    SolutionIndex: 82
    SolutionNameMin: Cijk_Alik_Bljk_BBS_STA_BH_Bias_HAS_SAV_UserArgs_MT320x128x64_MI16x16x1_SN_LDSB0_GRVWB8_GSU1_GSUC0_GSUWGMRR0_K1_LBSPPB1024_MIWT5_8_NLCA2_SU0_SUM0_SUS0_VWB8_WG64_4_1_WGM6_WGMXCC8_WGMXCCGn1
    SolutionIndex: 83
    SolutionNameMin: Cijk_Alik_Bljk_BBS_STA_BH_Bias_HAS_SAV_UserArgs_MT320x144x64_MI16x16x1_SN_LDSB0_GRVWB4_GSU1_GSUC0_GSUWGMRR0_K1_LBSPPB128_MIWT5_9_NLCA2_SU0_SUM0_SUS0_VWB1_WG64_4_1_WGM6_WGMXCC8_WGMXCCGn1
    SolutionIndex: 84
    SolutionNameMin: Cijk_Alik_Bljk_BBS_STA_BH_Bias_HAS_SAV_UserArgs_MT320x144x64_MI16x16x1_SN_LDSB0_GRVWB4_GSU1_GSUC0_GSUWGMRR0_K1_LBSPPB128_MIWT5_9_NLCA2_SU8_SUM0_SUS128_VWB1_WG64_4_1_WGM8_WGMXCC8_WGMXCCGn1
    SolutionIndex: 85
    SolutionNameMin: Cijk_Alik_Bljk_BBS_STA_BH_Bias_HAS_SAV_UserArgs_MT256x192x64_MI16x16x1_SN_LDSB0_GRVWB8_GSU1_GSUC0_GSUWGMRR0_K1_LBSPPB512_MIWT4_12_NLCA2_SU8_SUM0_SUS128_VWB4_WG64_4_1_WGM6_WGMXCC8_WGMXCCGn1
    SolutionIndex: 86
    SolutionNameMin: Cijk_Alik_Bljk_BBS_STA_BH_Bias_HAS_SAV_UserArgs_MT320x160x64_MI16x16x1_SN_LDSB0_GRVWB8_GSU1_GSUC0_GSUWGMRR0_K1_LBSPPB256_MIWT5_10_NLCA2_SU0_SUM0_SUS0_VWB2_WG64_4_1_WGM6_WGMXCC8_WGMXCCGn1
    SolutionIndex: 87
    SolutionNameMin: Cijk_Alik_Bljk_BBS_STA_BH_Bias_HAS_SAV_UserArgs_MT256x208x64_MI16x16x1_SN_LDSB1_GRVWB4_GSU1_GSUC0_GSUWGMRR0_K1_LBSPPB128_MIWT4_13_NLCA2_SU8_SUM0_SUS128_VWB1_WG64_4_1_WGM8_WGMXCC8_WGMXCCGn1
    SolutionIndex: 88
    SolutionNameMin: Cijk_Alik_Bljk_BBS_STA_BH_Bias_HAS_SAV_UserArgs_MT320x176x64_MI16x16x1_SN_LDSB0_GRVWB4_GSU1_GSUC0_GSUWGMRR0_K1_LBSPPB128_MIWT5_11_NLCA2_SU8_SUM0_SUS128_VWB1_WG64_4_1_WGM6_WGMXCC8_WGMXCCGn1
    SolutionIndex: 89
    SolutionNameMin: Cijk_Alik_Bljk_BBS_STA_BH_Bias_HAS_SAV_UserArgs_MT320x176x64_MI16x16x1_SN_LDSB0_GRVWB4_GSU1_GSUC0_GSUWGMRR0_K1_LBSPPB128_MIWT5_11_NLCA2_SU0_SUM0_SUS0_VWB1_WG64_4_1_WGM6_WGMXCC8_WGMXCCGn1
    SolutionIndex: 90
    SolutionNameMin: Cijk_Alik_Bljk_BBS_STA_BH_Bias_HAS_SAV_UserArgs_MT320x192x64_MI16x16x1_SN_LDSB0_GRVWB8_GSU1_GSUC0_GSUWGMRR0_K1_LBSPPB512_MIWT5_12_NLCA2_SU0_SUM0_SUS0_VWB4_WG64_4_1_WGM8_WGMXCC8_WGMXCCGn1
    SolutionIndex: 91
    SolutionNameMin: Cijk_Alik_Bljk_BBS_STA_BH_Bias_HAS_SAV_UserArgs_MT512x128x64_MI16x16x1_SN_LDSB0_GRVWB8_GSU1_GSUC0_GSUWGMRR0_K1_LBSPPB1024_MIWT8_8_NLCA2_SU0_SUM0_SUS0_VWB8_WG64_4_1_WGM1_WGMXCC8_WGMXCCGn1
    SolutionIndex: 92
    SolutionNameMin: Cijk_Alik_Bljk_BBS_STA_BH_Bias_HAS_SAV_UserArgs_MT256x256x64_MI16x16x1_SN_LDSB1_GRVWB8_GSU1_GSUC0_GSUWGMRR0_K1_LBSPPB1024_MIWT4_16_NLCA2_SU0_SUM0_SUS0_VWB8_WG64_4_1_WGM6_WGMXCC8_WGMXCCGn1
    SolutionIndex: 93
    SolutionNameMin: Cijk_Alik_Bljk_BBS_STA_BH_Bias_HAS_SAV_UserArgs_MT320x48x128_MI16x16x1_SN_LDSB0_GRVWB8_GSU1_GSUC0_GSUWGMRR0_K1_LBSPPB256_MIWT5_3_NLCA4_SU0_SUM0_SUS0_VWB1_WG64_4_1_WGM8_WGMXCC8_WGMXCCGn1
    SolutionIndex: 94
    SolutionNameMin: Cijk_Alik_Bljk_BBS_STA_BH_Bias_HAS_SAV_UserArgs_MT320x48x128_MI16x16x1_SN_LDSB0_GRVWB8_GSU1_GSUC0_GSUWGMRR0_K1_LBSPPB256_MIWT5_3_NLCA4_SU0_SUM0_SUS0_VWB1_WG64_4_1_WGM6_WGMXCC8_WGMXCCGn1
    SolutionIndex: 95
    SolutionNameMin: Cijk_Alik_Bljk_BBS_STA_BH_Bias_HAS_SAV_UserArgs_MT256x64x64_MI16x16x1_SN_LDSB0_GRVWB8_GSU1_GSUC0_GSUWGMRR0_K1_LBSPPB512_MIWT4_4_NLCA2_SU0_SUM0_SUS0_VWB4_WG64_4_1_WGM8_WGMXCC8_WGMXCCGn1
    SolutionIndex: 96
    SolutionNameMin: Cijk_Alik_Bljk_BBS_STA_BH_Bias_HAS_SAV_UserArgs_MT192x128x64_MI16x16x1_SN_LDSB1_GRVWB8_GSU1_GSUC0_GSUWGMRR0_K1_LBSPPB1024_MIWT3_8_NLCA2_SU8_SUM0_SUS128_VWB8_WG64_4_1_WGM8_WGMXCC8_WGMXCCGn1
    SolutionIndex: 97
    SolutionNameMin: Cijk_Alik_Bljk_BBS_STA_BH_Bias_HAS_SAV_UserArgs_MT256x112x64_MI16x16x1_SN_LDSB1_GRVWB4_GSU1_GSUC0_GSUWGMRR0_K1_LBSPPB128_MIWT4_7_NLCA2_SU0_SUM0_SUS0_VWB1_WG64_4_1_WGM6_WGMXCC8_WGMXCCGn1
    SolutionIndex: 98
    SolutionNameMin: Cijk_Alik_Bljk_BBS_STA_BH_Bias_HAS_SAV_UserArgs_MT512x64x64_MI16x16x1_SN_LDSB0_GRVWB8_GSU1_GSUC0_GSUWGMRR0_K1_LBSPPB512_MIWT8_4_NLCA2_SU0_SUM0_SUS0_VWB4_WG64_4_1_WGM8_WGMXCC8_WGMXCCGn1
    SolutionIndex: 99
    SolutionNameMin: Cijk_Alik_Bljk_BBS_STA_BH_Bias_HAS_SAV_UserArgs_MT320x192x64_MI16x16x1_SN_LDSB0_GRVWB8_GSU1_GSUC0_GSUWGMRR0_K1_LBSPPB512_MIWT5_12_NLCA2_SU0_SUM0_SUS0_VWB4_WG64_4_1_WGM6_WGMXCC8_WGMXCCGn1
    SolutionIndex: 100
    SolutionNameMin: Cijk_Alik_Bljk_BBS_STA_BH_Bias_HAS_SAV_UserArgs_MT256x256x64_MI16x16x1_SN_LDSB1_GRVWB8_GSU1_GSUC0_GSUWGMRR0_K1_LBSPPB1024_MIWT4_16_NLCA2_SU0_SUM0_SUS0_VWB8_WG64_4_1_WGM1_WGMXCC8_WGMXCCGn1
    SolutionIndex: 101
    SolutionNameMin: Cijk_Alik_Bljk_BBS_STA_BH_Bias_HAS_SAV_UserArgs_MT192x128x64_MI16x16x1_SN_LDSB1_GRVWB8_GSU1_GSUC0_GSUWGMRR0_K1_LBSPPB1024_MIWT3_8_NLCA2_SU0_SUM0_SUS0_VWB8_WG64_4_1_WGM8_WGMXCC8_WGMXCCGn1
    SolutionIndex: 102
    SolutionNameMin: Cijk_Alik_Bljk_BBS_STA_BH_Bias_HAS_SAV_UserArgs_MT16x16x256_MI16x16x1_SN_LDSB0_GRVWB8_GSU6_GSUAMBSK_GSUC1_GSUWGMRR1_K1_LBSPPB512_MIWT1_1_NTA4_NLCA8_SU0_SUM0_SUS0_VWB1_WG16_4_1_WGM1_WGMXCC8_WGMXCCGn1
    SolutionIndex: 103
    SolutionNameMin: Cijk_Alik_Bljk_BBS_STA_BH_Bias_HAS_SAV_UserArgs_MT64x16x256_MI16x16x1_SN_LDSB0_GRVWB8_GSU8_GSUAMBSK_GSUC1_GSUWGMRR1_K1_LBSPPB512_MIWT1_1_NTA4_NLCA8_SU0_SUM0_SUS0_VWB1_WG64_4_1_WGM1_WGMXCC8_WGMXCCGn1
    SolutionIndex: 104
    SolutionNameMin: Cijk_Alik_Bljk_BBS_STA_BH_Bias_HAS_SAV_UserArgs_MT64x16x256_MI16x16x1_SN_LDSB0_GRVWB8_GSU4_GSUAMBSK_GSUC1_GSUWGMRR1_K1_LBSPPB512_MIWT1_1_NTA4_NLCA8_SU0_SUM0_SUS0_VWB1_WG64_4_1_WGM1_WGMXCC8_WGMXCCGn1
    SolutionIndex: 105
    SolutionNameMin: Cijk_Alik_Bljk_BBS_STA_BH_Bias_HAS_SAV_UserArgs_MT64x16x256_MI16x16x1_SN_LDSB0_GRVWB8_GSU5_GSUAMBSK_GSUC1_GSUWGMRR1_K1_LBSPPB512_MIWT1_1_NTA0_NLCA8_SU0_SUM0_SUS0_VWB1_WG64_4_1_WGM1_WGMXCC8_WGMXCCGn1
    SolutionIndex: 106
    SolutionNameMin: Cijk_Alik_Bljk_BBS_STA_BH_Bias_HAS_SAV_UserArgs_MT64x16x256_MI16x16x1_SN_LDSB0_GRVWB8_GSU4_GSUAMBSK_GSUC1_GSUWGMRR1_K1_LBSPPB512_MIWT1_1_NTA0_NLCA8_SU0_SUM0_SUS0_VWB1_WG64_4_1_WGM1_WGMXCC8_WGMXCCGn1
    SolutionIndex: 107
    SolutionNameMin: Cijk_Alik_Bljk_BBS_STA_BH_Bias_HAS_SAV_UserArgs_MT128x32x256_MI16x16x1_SN_LDSB1_GRVWB8_GSU1_GSUAMB_GSUC1_GSUWGMRR1_K1_LBSPPB1024_MIWT2_2_NTA0_NLCA8_SU0_SUM0_SUS0_VWB2_WG64_4_1_WGM1_WGMXCC8_WGMXCCGn1
    SolutionIndex: 108
    SolutionNameMin: Cijk_Alik_Bljk_BBS_STA_BH_Bias_HAS_SAV_UserArgs_MT64x32x256_MI16x16x1_SN_LDSB1_GRVWB8_GSU1_GSUC0_GSUWGMRR0_K1_LBSPPB1024_MIWT2_2_NLCA8_SU8_SUM0_SUS512_VWB2_WG32_4_1_WGM6_WGMXCC8_WGMXCCGn1
    SolutionIndex: 109
    SolutionNameMin: Cijk_Alik_Bljk_BBS_STA_BH_Bias_HAS_SAV_UserArgs_MT64x32x256_MI16x16x1_SN_LDSB1_GRVWB8_GSU1_GSUC0_GSUWGMRR0_K1_LBSPPB1024_MIWT2_2_NLCA8_SU8_SUM0_SUS512_VWB2_WG32_4_1_WGM8_WGMXCC8_WGMXCCGn1
    SolutionIndex: 110
    SolutionNameMin: Cijk_Alik_Bljk_BBS_STA_BH_Bias_HAS_SAV_UserArgs_MT128x32x256_MI16x16x1_SN_LDSB1_GRVWB8_GSU1_GSUC0_GSUWGMRR0_K1_LBSPPB1024_MIWT2_2_NLCA8_SU0_SUM0_SUS0_VWB2_WG64_4_1_WGM1_WGMXCC8_WGMXCCGn1
    SolutionIndex: 111
    SolutionNameMin: Cijk_Alik_Bljk_BBS_STA_BH_Bias_HAS_SAV_UserArgs_MT128x48x128_MI16x16x1_SN_LDSB0_GRVWB8_GSU1_GSUC0_GSUWGMRR0_K1_LBSPPB256_MIWT2_3_NLCA4_SU0_SUM0_SUS0_VWB1_WG64_4_1_WGM1_WGMXCC8_WGMXCCGn1
    SolutionIndex: 112
    SolutionNameMin: Cijk_Alik_Bljk_BBS_STA_BH_Bias_HAS_SAV_UserArgs_MT128x64x128_MI16x16x1_SN_LDSB1_GRVWB8_GSU1_GSUC0_GSUWGMRR0_K1_LBSPPB1024_MIWT2_4_NLCA4_SU8_SUM0_SUS256_VWB4_WG64_4_1_WGM1_WGMXCC8_WGMXCCGn1
    SolutionIndex: 113
    SolutionNameMin: Cijk_Alik_Bljk_BBS_STA_BH_Bias_HAS_SAV_UserArgs_MT128x48x128_MI16x16x1_SN_LDSB0_GRVWB8_GSU1_GSUC0_GSUWGMRR0_K1_LBSPPB256_MIWT2_3_NLCA4_SU8_SUM0_SUS256_VWB1_WG64_4_1_WGM1_WGMXCC8_WGMXCCGn1
    SolutionIndex: 114
    SolutionNameMin: Cijk_Alik_Bljk_BBS_STA_BH_Bias_HAS_SAV_UserArgs_MT128x64x128_MI16x16x1_SN_LDSB1_GRVWB8_GSU1_GSUC0_GSUWGMRR0_K1_LBSPPB1024_MIWT2_4_NLCA4_SU0_SUM0_SUS0_VWB4_WG64_4_1_WGM1_WGMXCC8_WGMXCCGn1
    SolutionIndex: 115
    SolutionNameMin: Cijk_Alik_Bljk_BBS_STA_BH_Bias_HAS_SAV_UserArgs_MT192x48x128_MI16x16x1_SN_LDSB0_GRVWB8_GSU1_GSUC0_GSUWGMRR0_K1_LBSPPB256_MIWT3_3_NLCA4_SU0_SUM0_SUS0_VWB1_WG64_4_1_WGM1_WGMXCC8_WGMXCCGn1
    SolutionIndex: 116
    SolutionNameMin: Cijk_Alik_Bljk_BBS_STA_BH_Bias_HAS_SAV_UserArgs_MT128x80x128_MI16x16x1_SN_LDSB1_GRVWB8_GSU1_GSUC0_GSUWGMRR0_K1_LBSPPB256_MIWT2_5_NLCA4_SU0_SUM0_SUS0_VWB1_WG64_4_1_WGM1_WGMXCC8_WGMXCCGn1
    SolutionIndex: 117
    SolutionNameMin: Cijk_Alik_Bljk_BBS_STA_BH_Bias_HAS_SAV_UserArgs_MT128x96x128_MI16x16x1_SN_LDSB1_GRVWB8_GSU1_GSUC0_GSUWGMRR0_K1_LBSPPB512_MIWT2_6_NLCA4_SU0_SUM0_SUS0_VWB2_WG64_4_1_WGM1_WGMXCC8_WGMXCCGn1
    SolutionIndex: 118
    SolutionNameMin: Cijk_Alik_Bljk_BBS_STA_BH_Bias_HAS_SAV_UserArgs_MT128x112x128_MI16x16x1_SN_LDSB1_GRVWB8_GSU1_GSUC0_GSUWGMRR0_K1_LBSPPB256_MIWT2_7_NLCA4_SU0_SUM0_SUS0_VWB1_WG64_4_1_WGM1_WGMXCC8_WGMXCCGn1
    SolutionIndex: 119
    SolutionNameMin: Cijk_Alik_Bljk_BBS_STA_BH_Bias_HAS_SAV_UserArgs_MT128x32x128_MI16x16x1_SN_LDSB0_GRVWB8_GSU1_GSUC0_GSUWGMRR0_K1_LBSPPB512_MIWT2_2_NLCA4_SU0_SUM0_SUS0_VWB2_WG64_4_1_WGM8_WGMXCC8_WGMXCCGn1
    SolutionIndex: 120
    SolutionNameMin: Cijk_Alik_Bljk_BBS_STA_BH_Bias_HAS_SAV_UserArgs_MT128x64x64_MI16x16x1_SN_LDSB0_GRVWB8_GSU1_GSUC0_GSUWGMRR0_K1_LBSPPB512_MIWT2_4_NLCA2_SU0_SUM0_SUS0_VWB4_WG64_4_1_WGM8_WGMXCC8_WGMXCCGn1
    SolutionIndex: 121
    SolutionNameMin: Cijk_Alik_Bljk_BBS_STA_BH_Bias_HAS_SAV_UserArgs_MT320x64x64_MI16x16x1_SN_LDSB0_GRVWB8_GSU1_GSUC0_GSUWGMRR0_K1_LBSPPB512_MIWT5_4_NLCA2_SU0_SUM0_SUS0_VWB4_WG64_4_1_WGM6_WGMXCC8_WGMXCCGn1
    SolutionIndex: 122
    SolutionNameMin: Cijk_Alik_Bljk_BBS_STA_BH_Bias_HAS_SAV_UserArgs_MT128x96x64_MI16x16x1_SN_LDSB0_GRVWB8_GSU1_GSUC0_GSUWGMRR0_K1_LBSPPB256_MIWT2_6_NLCA2_SU8_SUM0_SUS128_VWB2_WG64_4_1_WGM8_WGMXCC8_WGMXCCGn1
    SolutionIndex: 123
    SolutionNameMin: Cijk_Alik_Bljk_BBS_STA_BH_Bias_HAS_SAV_UserArgs_MT128x64x128_MI16x16x1_SN_LDSB1_GRVWB8_GSU1_GSUC0_GSUWGMRR0_K1_LBSPPB1024_MIWT2_4_NLCA4_SU8_SUM0_SUS256_VWB4_WG64_4_1_WGM6_WGMXCC8_WGMXCCGn1
    SolutionIndex: 124
    SolutionNameMin: Cijk_Alik_Bljk_BBS_STA_BH_Bias_HAS_SAV_UserArgs_MT128x128x64_MI16x16x1_SN_LDSB1_GRVWB8_GSU1_GSUC0_GSUWGMRR0_K1_LBSPPB1024_MIWT2_8_NLCA2_SU0_SUM0_SUS0_VWB8_WG64_4_1_WGM6_WGMXCC8_WGMXCCGn1
    SolutionIndex: 125
    SolutionNameMin: Cijk_Alik_Bljk_BBS_STA_BH_Bias_HAS_SAV_UserArgs_MT192x80x128_MI16x16x1_SN_LDSB1_GRVWB8_GSU1_GSUC0_GSUWGMRR0_K1_LBSPPB256_MIWT3_5_NLCA4_SU8_SUM0_SUS256_VWB1_WG64_4_1_WGM6_WGMXCC8_WGMXCCGn1
    SolutionIndex: 126
    SolutionNameMin: Cijk_Alik_Bljk_BBS_STA_BH_Bias_HAS_SAV_UserArgs_MT192x96x64_MI16x16x1_SN_LDSB0_GRVWB8_GSU1_GSUC0_GSUWGMRR0_K1_LBSPPB256_MIWT3_6_NLCA2_SU8_SUM0_SUS128_VWB2_WG64_4_1_WGM6_WGMXCC8_WGMXCCGn1
    SolutionIndex: 127
    SolutionNameMin: Cijk_Alik_Bljk_BBS_STA_BH_Bias_HAS_SAV_UserArgs_MT256x80x64_MI16x16x1_SN_LDSB0_GRVWB4_GSU1_GSUC0_GSUWGMRR0_K1_LBSPPB128_MIWT4_5_NLCA2_SU0_SUM0_SUS0_VWB1_WG64_4_1_WGM8_WGMXCC8_WGMXCCGn1
    SolutionIndex: 128
    SolutionNameMin: Cijk_Alik_Bljk_BBS_STA_BH_Bias_HAS_SAV_UserArgs_MT320x208x64_MI16x16x1_SN_LDSB1_GRVWB4_GSU1_GSUC0_GSUWGMRR0_K1_LBSPPB128_MIWT5_13_NLCA2_SU0_SUM0_SUS0_VWB1_WG64_4_1_WGM6_WGMXCC8_WGMXCCGn1
    SolutionIndex: 129
    SolutionNameMin: Cijk_Alik_Bljk_BBS_STA_BH_Bias_HAS_SAV_UserArgs_MT128x112x128_MI16x16x1_SN_LDSB1_GRVWB8_GSU1_GSUC0_GSUWGMRR0_K1_LBSPPB256_MIWT2_7_NLCA4_SU0_SUM0_SUS256_VWB1_WG64_4_1_WGM1_WGMXCC8_WGMXCCGn1
    SolutionIndex: 130
    SolutionNameMin: Cijk_Alik_Bljk_BBS_STA_BH_Bias_HAS_SAV_UserArgs_MT128x128x128_MI16x16x1_SN_LDSB1_GRVWB8_GSU1_GSUC0_GSUWGMRR0_K1_LBSPPB2048_MIWT2_8_NLCA4_SU8_SUM0_SUS256_VWB8_WG64_4_1_WGM1_WGMXCC8_WGMXCCGn1
    SolutionIndex: 131
    SolutionNameMin: Cijk_Alik_Bljk_BBS_STA_BH_Bias_HAS_SAV_UserArgs_MT128x128x128_MI16x16x1_SN_LDSB1_GRVWB8_GSU1_GSUC0_GSUWGMRR0_K1_LBSPPB2048_MIWT2_8_NLCA4_SU0_SUM0_SUS256_VWB8_WG64_4_1_WGM1_WGMXCC8_WGMXCCGn1
    SolutionIndex: 132
    SolutionNameMin: Cijk_Alik_Bljk_BBS_STA_BH_Bias_HAS_SAV_UserArgs_MT192x96x64_MI16x16x1_SN_LDSB0_GRVWB8_GSU1_GSUC0_GSUWGMRR0_K1_LBSPPB256_MIWT3_6_NLCA2_SU0_SUM0_SUS128_VWB2_WG64_4_1_WGM1_WGMXCC8_WGMXCCGn1
    SolutionIndex: 133
    SolutionNameMin: Cijk_Alik_Bljk_BBS_STA_BH_Bias_HAS_SAV_UserArgs_MT320x64x64_MI16x16x1_SN_LDSB0_GRVWB8_GSU1_GSUC0_GSUWGMRR0_K1_LBSPPB512_MIWT5_4_NLCA2_SU0_SUM0_SUS128_VWB4_WG64_4_1_WGM1_WGMXCC8_WGMXCCGn1
    SolutionIndex: 134
    SolutionNameMin: Cijk_Alik_Bljk_BBS_STA_BH_Bias_HAS_SAV_UserArgs_MT320x64x64_MI16x16x1_SN_LDSB0_GRVWB8_GSU1_GSUC0_GSUWGMRR0_K1_LBSPPB512_MIWT5_4_NLCA2_SU8_SUM0_SUS128_VWB4_WG64_4_1_WGM1_WGMXCC8_WGMXCCGn1
    SolutionIndex: 135
    SolutionNameMin: Cijk_Alik_Bljk_BBS_STA_BH_Bias_HAS_SAV_UserArgs_MT320x64x64_MI16x16x1_SN_LDSB0_GRVWB8_GSU1_GSUC0_GSUWGMRR0_K1_LBSPPB512_MIWT5_4_NLCA2_SU0_SUM0_SUS128_VWB4_WG64_4_1_WGM8_WGMXCC8_WGMXCCGn1
    SolutionIndex: 136
    SolutionNameMin: Cijk_Alik_Bljk_BBS_STA_BH_Bias_HAS_SAV_UserArgs_MT128x80x128_MI16x16x1_SN_LDSB1_GRVWB8_GSU1_GSUC0_GSUWGMRR0_K1_LBSPPB256_MIWT2_5_NLCA4_SU0_SUM0_SUS256_VWB1_WG64_4_1_WGM1_WGMXCC8_WGMXCCGn1
    SolutionIndex: 137
    SolutionNameMin: Cijk_Alik_Bljk_BBS_STA_BH_Bias_HAS_SAV_UserArgs_MT256x96x64_MI16x16x1_SN_LDSB0_GRVWB8_GSU1_GSUC0_GSUWGMRR0_K1_LBSPPB256_MIWT4_6_NLCA2_SU0_SUM0_SUS128_VWB2_WG64_4_1_WGM1_WGMXCC8_WGMXCCGn1
    SolutionIndex: 138
    SolutionNameMin: Cijk_Alik_Bljk_BBS_STA_BH_Bias_HAS_SAV_UserArgs_MT128x96x128_MI16x16x1_SN_LDSB1_GRVWB8_GSU1_GSUC0_GSUWGMRR0_K1_LBSPPB512_MIWT2_6_NLCA4_SU0_SUM0_SUS256_VWB2_WG64_4_1_WGM1_WGMXCC8_WGMXCCGn1
    SolutionIndex: 139
    SolutionNameMin: Cijk_Alik_Bljk_BBS_STA_BH_Bias_HAS_SAV_UserArgs_MT192x128x64_MI16x16x1_SN_LDSB1_GRVWB8_GSU1_GSUC0_GSUWGMRR0_K1_LBSPPB1024_MIWT3_8_NLCA2_SU0_SUM0_SUS128_VWB8_WG64_4_1_WGM6_WGMXCC8_WGMXCCGn1
    SolutionIndex: 140
    SolutionNameMin: Cijk_Alik_Bljk_BBS_STA_BH_Bias_HAS_SAV_UserArgs_MT448x64x64_MI16x16x1_SN_LDSB0_GRVWB8_GSU1_GSUC0_GSUWGMRR0_K1_LBSPPB512_MIWT7_4_NLCA2_SU0_SUM0_SUS128_VWB4_WG64_4_1_WGM8_WGMXCC8_WGMXCCGn1
    SolutionIndex: 141
    SolutionNameMin: Cijk_Alik_Bljk_BBS_STA_BH_Bias_HAS_SAV_UserArgs_MT448x64x64_MI16x16x1_SN_LDSB0_GRVWB8_GSU1_GSUC0_GSUWGMRR0_K1_LBSPPB512_MIWT7_4_NLCA2_SU0_SUM0_SUS128_VWB4_WG64_4_1_WGM6_WGMXCC8_WGMXCCGn1
    SolutionIndex: 142
    SolutionNameMin: Cijk_Alik_Bljk_BBS_STA_BH_Bias_HAS_SAV_UserArgs_MT448x64x64_MI16x16x1_SN_LDSB0_GRVWB8_GSU1_GSUC0_GSUWGMRR0_K1_LBSPPB512_MIWT7_4_NLCA2_SU0_SUM0_SUS128_VWB4_WG64_4_1_WGM1_WGMXCC8_WGMXCCGn1
    SolutionIndex: 143
    SolutionNameMin: Cijk_Alik_Bljk_BBS_STA_BH_Bias_HAS_SAV_UserArgs_MT448x64x64_MI16x16x1_SN_LDSB0_GRVWB8_GSU1_GSUC0_GSUWGMRR0_K1_LBSPPB512_MIWT7_4_NLCA2_SU8_SUM0_SUS128_VWB4_WG64_4_1_WGM1_WGMXCC8_WGMXCCGn1
    SolutionIndex: 144
    SolutionNameMin: Cijk_Alik_Bljk_BBS_STA_BH_Bias_HAS_SAV_UserArgs_MT320x112x64_MI16x16x1_SN_LDSB0_GRVWB4_GSU1_GSUC0_GSUWGMRR0_K1_LBSPPB128_MIWT5_7_NLCA2_SU0_SUM0_SUS128_VWB1_WG64_4_1_WGM6_WGMXCC8_WGMXCCGn1
    SolutionIndex: 145
    SolutionNameMin: Cijk_Alik_Bljk_BBS_STA_BH_Bias_HAS_SAV_UserArgs_MT320x112x64_MI16x16x1_SN_LDSB0_GRVWB4_GSU1_GSUC0_GSUWGMRR0_K1_LBSPPB128_MIWT5_7_NLCA2_SU0_SUM0_SUS128_VWB1_WG64_4_1_WGM1_WGMXCC8_WGMXCCGn1
    SolutionIndex: 146
    SolutionNameMin: Cijk_Alik_Bljk_BBS_STA_BH_Bias_HAS_SAV_UserArgs_MT192x192x64_MI16x16x1_SN_LDSB0_GRVWB8_GSU1_GSUC0_GSUWGMRR0_K1_LBSPPB512_MIWT3_12_NLCA2_SU8_SUM0_SUS128_VWB4_WG64_4_1_WGM1_WGMXCC8_WGMXCCGn1
    SolutionIndex: 147
    SolutionNameMin: Cijk_Alik_Bljk_BBS_STA_BH_Bias_HAS_SAV_UserArgs_MT192x192x64_MI16x16x1_SN_LDSB0_GRVWB8_GSU1_GSUC0_GSUWGMRR0_K1_LBSPPB512_MIWT3_12_NLCA2_SU8_SUM0_SUS128_VWB4_WG64_4_1_WGM6_WGMXCC8_WGMXCCGn1
    SolutionIndex: 148
    SolutionNameMin: Cijk_Alik_Bljk_BBS_STA_BH_Bias_HAS_SAV_UserArgs_MT320x128x64_MI16x16x1_SN_LDSB0_GRVWB8_GSU1_GSUC0_GSUWGMRR0_K1_LBSPPB1024_MIWT5_8_NLCA2_SU0_SUM0_SUS128_VWB8_WG64_4_1_WGM6_WGMXCC8_WGMXCCGn1
    SolutionIndex: 149
    SolutionNameMin: Cijk_Alik_Bljk_BBS_STA_BH_Bias_HAS_SAV_UserArgs_MT320x128x64_MI16x16x1_SN_LDSB0_GRVWB8_GSU1_GSUC0_GSUWGMRR0_K1_LBSPPB1024_MIWT5_8_NLCA2_SU0_SUM0_SUS128_VWB8_WG64_4_1_WGM1_WGMXCC8_WGMXCCGn1
    SolutionIndex: 150
    SolutionNameMin: Cijk_Alik_Bljk_BBS_STA_BH_Bias_HAS_SAV_UserArgs_MT320x128x64_MI16x16x1_SN_LDSB0_GRVWB8_GSU1_GSUC0_GSUWGMRR0_K1_LBSPPB1024_MIWT5_8_NLCA2_SU8_SUM0_SUS128_VWB8_WG64_4_1_WGM1_WGMXCC8_WGMXCCGn1
    SolutionIndex: 151
    SolutionNameMin: Cijk_Alik_Bljk_BBS_STA_BH_Bias_HAS_SAV_UserArgs_MT192x224x64_MI16x16x1_SN_LDSB0_GRVWB8_GSU1_GSUC0_GSUWGMRR0_K1_LBSPPB256_MIWT3_14_NLCA2_SU8_SUM0_SUS128_VWB2_WG64_4_1_WGM6_WGMXCC8_WGMXCCGn1
    SolutionIndex: 152
    SolutionNameMin: Cijk_Alik_Bljk_BBS_STA_BH_Bias_HAS_SAV_UserArgs_MT320x144x64_MI16x16x1_SN_LDSB0_GRVWB4_GSU1_GSUC0_GSUWGMRR0_K1_LBSPPB128_MIWT5_9_NLCA2_SU8_SUM0_SUS128_VWB1_WG64_4_1_WGM1_WGMXCC8_WGMXCCGn1
    SolutionIndex: 153
    SolutionNameMin: Cijk_Alik_Bljk_BBS_STA_BH_Bias_HAS_SAV_UserArgs_MT320x144x64_MI16x16x1_SN_LDSB0_GRVWB4_GSU1_GSUC0_GSUWGMRR0_K1_LBSPPB128_MIWT5_9_NLCA2_SU0_SUM0_SUS128_VWB1_WG64_4_1_WGM1_WGMXCC8_WGMXCCGn1
    SolutionIndex: 154
    SolutionNameMin: Cijk_Alik_Bljk_BBS_STA_BH_Bias_HAS_SAV_UserArgs_MT320x160x64_MI16x16x1_SN_LDSB0_GRVWB8_GSU1_GSUC0_GSUWGMRR0_K1_LBSPPB256_MIWT5_10_NLCA2_SU0_SUM0_SUS128_VWB2_WG64_4_1_WGM1_WGMXCC8_WGMXCCGn1
    SolutionIndex: 155
    SolutionNameMin: Cijk_Alik_Bljk_BBS_STA_BH_Bias_HAS_SAV_UserArgs_MT320x160x64_MI16x16x1_SN_LDSB0_GRVWB8_GSU1_GSUC0_GSUWGMRR0_K1_LBSPPB256_MIWT5_10_NLCA2_SU0_SUM0_SUS128_VWB2_WG64_4_1_WGM6_WGMXCC8_WGMXCCGn1
    SolutionIndex: 156
    SolutionNameMin: Cijk_Alik_Bljk_BBS_STA_BH_Bias_HAS_SAV_UserArgs_MT320x160x64_MI16x16x1_SN_LDSB0_GRVWB8_GSU1_GSUC0_GSUWGMRR0_K1_LBSPPB256_MIWT5_10_NLCA2_SU0_SUM0_SUS128_VWB2_WG64_4_1_WGM8_WGMXCC8_WGMXCCGn1
    SolutionIndex: 157
    SolutionNameMin: Cijk_Alik_Bljk_BBS_STA_BH_Bias_HAS_SAV_UserArgs_MT320x160x64_MI16x16x1_SN_LDSB0_GRVWB8_GSU1_GSUC0_GSUWGMRR0_K1_LBSPPB256_MIWT5_10_NLCA2_SU8_SUM0_SUS128_VWB2_WG64_4_1_WGM1_WGMXCC8_WGMXCCGn1
    SolutionIndex: 158
    SolutionNameMin: Cijk_Alik_Bljk_BBS_STA_BH_Bias_HAS_SAV_UserArgs_MT448x128x64_MI16x16x1_SN_LDSB0_GRVWB8_GSU1_GSUC0_GSUWGMRR0_K1_LBSPPB1024_MIWT7_8_NLCA2_SU0_SUM0_SUS128_VWB8_WG64_4_1_WGM1_WGMXCC8_WGMXCCGn1
    SolutionIndex: 159
    SolutionNameMin: Cijk_Alik_Bljk_BBS_STA_BH_Bias_HAS_SAV_UserArgs_MT448x128x64_MI16x16x1_SN_LDSB0_GRVWB8_GSU1_GSUC0_GSUWGMRR0_K1_LBSPPB1024_MIWT7_8_NLCA2_SU0_SUM0_SUS128_VWB8_WG64_4_1_WGM8_WGMXCC8_WGMXCCGn1
    SolutionIndex: 160
    SolutionNameMin: Cijk_Alik_Bljk_BBS_STA_BH_Bias_HAS_SAV_UserArgs_MT448x128x64_MI16x16x1_SN_LDSB0_GRVWB8_GSU1_GSUC0_GSUWGMRR0_K1_LBSPPB1024_MIWT7_8_NLCA2_SU8_SUM0_SUS128_VWB8_WG64_4_1_WGM1_WGMXCC8_WGMXCCGn1
    SolutionIndex: 161
    SolutionNameMin: Cijk_Alik_Bljk_BBS_STA_BH_Bias_HAS_SAV_UserArgs_MT448x128x64_MI16x16x1_SN_LDSB0_GRVWB8_GSU1_GSUC0_GSUWGMRR0_K1_LBSPPB1024_MIWT7_8_NLCA2_SU8_SUM0_SUS128_VWB8_WG64_4_1_WGM8_WGMXCC8_WGMXCCGn1
    SolutionIndex: 162
    SolutionNameMin: Cijk_Alik_Bljk_BBS_STA_BH_Bias_HAS_SAV_UserArgs_MT448x128x64_MI16x16x1_SN_LDSB0_GRVWB8_GSU1_GSUC0_GSUWGMRR0_K1_LBSPPB1024_MIWT7_8_NLCA2_SU0_SUM0_SUS128_VWB8_WG64_4_1_WGM6_WGMXCC8_WGMXCCGn1
    SolutionIndex: 163
    SolutionNameMin: Cijk_Alik_Bljk_BBS_STA_BH_Bias_HAS_SAV_UserArgs_MT448x144x64_MI16x16x1_SN_LDSB0_GRVWB4_GSU1_GSUC0_GSUWGMRR0_K1_LBSPPB128_MIWT7_9_NLCA2_SU0_SUM0_SUS128_VWB1_WG64_4_1_WGM1_WGMXCC8_WGMXCCGn1
    SolutionIndex: 164
    SolutionNameMin: Cijk_Alik_Bljk_BBS_STA_BH_Bias_HAS_SAV_UserArgs_MT448x144x64_MI16x16x1_SN_LDSB0_GRVWB4_GSU1_GSUC0_GSUWGMRR0_K1_LBSPPB128_MIWT7_9_NLCA2_SU8_SUM0_SUS128_VWB1_WG64_4_1_WGM1_WGMXCC8_WGMXCCGn1
    SolutionIndex: 165
    SolutionNameMin: Cijk_Alik_Bljk_BBS_STA_BH_Bias_HAS_SAV_UserArgs_MT192x128x64_MI16x16x1_SN_LDSB1_GRVWB8_GSU1_GSUC0_GSUWGMRR0_K1_LBSPPB1024_MIWT3_8_NLCA2_SU8_SUM0_SUS128_VWB8_WG64_4_1_WGM1_WGMXCC8_WGMXCCGn1
    SolutionIndex: 166
    SolutionNameMin: Cijk_Alik_Bljk_BBS_STA_BH_Bias_HAS_SAV_UserArgs_MT192x128x64_MI16x16x1_SN_LDSB1_GRVWB8_GSU1_GSUC0_GSUWGMRR0_K1_LBSPPB1024_MIWT3_8_NLCA2_SU0_SUM0_SUS128_VWB8_WG64_4_1_WGM1_WGMXCC8_WGMXCCGn1
    SolutionIndex: 167
    SolutionNameMin: Cijk_Alik_Bljk_BBS_STA_BH_Bias_HAS_SAV_UserArgs_MT320x80x64_MI16x16x1_SN_LDSB0_GRVWB4_GSU1_GSUC0_GSUWGMRR0_K1_LBSPPB128_MIWT5_5_NLCA2_SU0_SUM0_SUS128_VWB1_WG64_4_1_WGM6_WGMXCC8_WGMXCCGn1
    SolutionIndex: 168
    SolutionNameMin: Cijk_Alik_Bljk_BBS_STA_BH_Bias_HAS_SAV_UserArgs_MT320x128x64_MI16x16x1_SN_LDSB0_GRVWB8_GSU1_GSUC0_GSUWGMRR0_K1_LBSPPB1024_MIWT5_8_NLCA2_SU8_SUM0_SUS128_VWB8_WG64_4_1_WGM8_WGMXCC8_WGMXCCGn1
    SolutionIndex: 169
    SolutionNameMin: Cijk_Alik_Bljk_BBS_STA_BH_Bias_HAS_SAV_UserArgs_MT192x224x64_MI16x16x1_SN_LDSB0_GRVWB8_GSU1_GSUC0_GSUWGMRR0_K1_LBSPPB256_MIWT3_14_NLCA2_SU0_SUM0_SUS128_VWB2_WG64_4_1_WGM1_WGMXCC8_WGMXCCGn1
    SolutionIndex: 170
    SolutionNameMin: Cijk_Alik_Bljk_BBS_STA_BH_Bias_HAS_SAV_UserArgs_MT192x224x64_MI16x16x1_SN_LDSB0_GRVWB8_GSU1_GSUC0_GSUWGMRR0_K1_LBSPPB256_MIWT3_14_NLCA2_SU8_SUM0_SUS128_VWB2_WG64_4_1_WGM1_WGMXCC8_WGMXCCGn1
    SolutionIndex: 171
    SolutionNameMin: Cijk_Alik_Bljk_BBS_STA_BH_Bias_HAS_SAV_UserArgs_MT128x160x64_MI16x16x1_SN_LDSB1_GRVWB8_GSU1_GSUC0_GSUWGMRR0_K1_LBSPPB256_MIWT2_10_NLCA2_SU0_SUM0_SUS128_VWB2_WG64_4_1_WGM1_WGMXCC8_WGMXCCGn1
    SolutionIndex: 172
    SolutionNameMin: Cijk_Alik_Bljk_BBS_STA_BH_Bias_HAS_SAV_UserArgs_MT320x160x64_MI16x16x1_SN_LDSB0_GRVWB8_GSU1_GSUC0_GSUWGMRR0_K1_LBSPPB256_MIWT5_10_NLCA2_SU8_SUM0_SUS128_VWB2_WG64_4_1_WGM6_WGMXCC8_WGMXCCGn1
    SolutionIndex: 173
    SolutionNameMin: Cijk_Alik_Bljk_BBS_STA_BH_Bias_HAS_SAV_UserArgs_MT448x128x64_MI16x16x1_SN_LDSB0_GRVWB8_GSU1_GSUC0_GSUWGMRR0_K1_LBSPPB1024_MIWT7_8_NLCA2_SU8_SUM0_SUS128_VWB8_WG64_4_1_WGM6_WGMXCC8_WGMXCCGn1
    SolutionIndex: 174
    SolutionNameMin: Cijk_Alik_Bljk_BBS_STA_BH_Bias_HAS_SAV_UserArgs_MT448x144x64_MI16x16x1_SN_LDSB0_GRVWB4_GSU1_GSUC0_GSUWGMRR0_K1_LBSPPB128_MIWT7_9_NLCA2_SU8_SUM0_SUS128_VWB1_WG64_4_1_WGM6_WGMXCC8_WGMXCCGn1
    SolutionIndex: 175
    SolutionNameMin: Cijk_Alik_Bljk_BBS_STA_BH_Bias_HAS_SAV_UserArgs_MT448x144x64_MI16x16x1_SN_LDSB0_GRVWB4_GSU1_GSUC0_GSUWGMRR0_K1_LBSPPB128_MIWT7_9_NLCA2_SU0_SUM0_SUS128_VWB1_WG64_4_1_WGM6_WGMXCC8_WGMXCCGn1
    SolutionIndex: 176
    SolutionNameMin: Cijk_Alik_Bljk_BBS_STA_BH_Bias_HAS_SAV_UserArgs_MT448x144x64_MI16x16x1_SN_LDSB0_GRVWB4_GSU1_GSUC0_GSUWGMRR0_K1_LBSPPB128_MIWT7_9_NLCA2_SU0_SUM0_SUS128_VWB1_WG64_4_1_WGM8_WGMXCC8_WGMXCCGn1
    SolutionIndex: 177
    SolutionNameMin: Cijk_Alik_Bljk_BBS_STA_BH_Bias_HAS_SAV_UserArgs_MT320x160x64_MI16x16x1_SN_LDSB0_GRVWB8_GSU1_GSUC0_GSUWGMRR0_K1_LBSPPB256_MIWT5_10_NLCA2_SU8_SUM0_SUS128_VWB2_WG64_4_1_WGM8_WGMXCC8_WGMXCCGn1
    SolutionIndex: 178
    SolutionNameMin: Cijk_Alik_Bljk_BBS_STA_BH_Bias_HAS_SAV_UserArgs_MT448x144x64_MI16x16x1_SN_LDSB0_GRVWB4_GSU1_GSUC0_GSUWGMRR0_K1_LBSPPB128_MIWT7_9_NLCA2_SU8_SUM0_SUS128_VWB1_WG64_4_1_WGM8_WGMXCC8_WGMXCCGn1
    SolutionIndex: 179
    SolutionNameMin: Cijk_Alik_Bljk_BBS_STA_BH_Bias_HAS_SAV_UserArgs_MT320x192x64_MI16x16x1_SN_LDSB0_GRVWB8_GSU1_GSUC0_GSUWGMRR0_K1_LBSPPB512_MIWT5_12_NLCA2_SU8_SUM0_SUS128_VWB4_WG64_4_1_WGM8_WGMXCC8_WGMXCCGn1
    SolutionIndex: 180
    SolutionNameMin: Cijk_Alik_Bljk_BBS_STA_BH_Bias_HAS_SAV_UserArgs_MT256x256x64_MI16x16x1_SN_LDSB1_GRVWB8_GSU1_GSUC0_GSUWGMRR0_K1_LBSPPB1024_MIWT4_16_NLCA2_SU0_SUM0_SUS128_VWB8_WG64_4_1_WGM6_WGMXCC8_WGMXCCGn1
    SolutionIndex: 181
    SolutionNameMin: Cijk_Alik_Bljk_BBS_STA_BH_Bias_HAS_SAV_UserArgs_MT512x128x64_MI16x16x1_SN_LDSB0_GRVWB8_GSU1_GSUC0_GSUWGMRR0_K1_LBSPPB1024_MIWT8_8_NLCA2_SU0_SUM0_SUS128_VWB8_WG64_4_1_WGM8_WGMXCC8_WGMXCCGn1
    SolutionIndex: 182
    SolutionNameMin: Cijk_Alik_Bljk_BBS_STA_BH_Bias_HAS_SAV_UserArgs_MT256x96x64_MI16x16x1_SN_LDSB0_GRVWB8_GSU1_GSUC0_GSUWGMRR0_K1_LBSPPB256_MIWT4_6_NLCA2_SU0_SUM0_SUS128_VWB2_WG64_4_1_WGM8_WGMXCC8_WGMXCCGn1
    SolutionIndex: 183
    SolutionNameMin: Cijk_Alik_Bljk_BBS_STA_BH_Bias_HAS_SAV_UserArgs_MT256x160x64_MI16x16x1_SN_LDSB0_GRVWB8_GSU1_GSUC0_GSUWGMRR0_K1_LBSPPB256_MIWT4_10_NLCA2_SU0_SUM0_SUS128_VWB2_WG64_4_1_WGM8_WGMXCC8_WGMXCCGn1
    SolutionIndex: 184
    SolutionNameMin: Cijk_Alik_Bljk_BBS_STA_BH_Bias_HAS_SAV_UserArgs_MT256x160x64_MI16x16x1_SN_LDSB0_GRVWB8_GSU1_GSUC0_GSUWGMRR0_K1_LBSPPB256_MIWT4_10_NLCA2_SU8_SUM0_SUS128_VWB2_WG64_4_1_WGM6_WGMXCC8_WGMXCCGn1
    SolutionIndex: 185
    SolutionNameMin: Cijk_Alik_Bljk_BBS_STA_BH_Bias_HAS_SAV_UserArgs_MT256x192x64_MI16x16x1_SN_LDSB0_GRVWB8_GSU1_GSUC0_GSUWGMRR0_K1_LBSPPB512_MIWT4_12_NLCA2_SU0_SUM0_SUS128_VWB4_WG64_4_1_WGM8_WGMXCC8_WGMXCCGn1
    SolutionIndex: 186
    SolutionNameMin: Cijk_Alik_Bljk_BBS_STA_BH_Bias_HAS_SAV_UserArgs_MT256x192x64_MI16x16x1_SN_LDSB0_GRVWB8_GSU1_GSUC0_GSUWGMRR0_K1_LBSPPB512_MIWT4_12_NLCA2_SU8_SUM0_SUS128_VWB4_WG64_4_1_WGM6_WGMXCC8_WGMXCCGn1
    SolutionIndex: 187
    SolutionNameMin: Cijk_Alik_Bljk_BBS_STA_BH_Bias_HAS_SAV_UserArgs_MT256x176x64_MI16x16x1_SN_LDSB0_GRVWB4_GSU1_GSUC0_GSUWGMRR0_K1_LBSPPB128_MIWT4_11_NLCA2_SU0_SUM0_SUS128_VWB1_WG64_4_1_WGM6_WGMXCC8_WGMXCCGn1
    SolutionIndex: 188
    SolutionNameMin: Cijk_Alik_Bljk_BBS_STA_BH_Bias_HAS_SAV_UserArgs_MT256x96x64_MI16x16x1_SN_LDSB0_GRVWB8_GSU1_GSUC0_GSUWGMRR0_K1_LBSPPB256_MIWT4_6_NLCA2_SU0_SUM0_SUS128_VWB2_WG64_4_1_WGM6_WGMXCC8_WGMXCCGn1
    SolutionIndex: 189
    SolutionNameMin: Cijk_Alik_Bljk_BBS_STA_BH_Bias_HAS_SAV_UserArgs_MT256x192x64_MI16x16x1_SN_LDSB0_GRVWB8_GSU1_GSUC0_GSUWGMRR0_K1_LBSPPB512_MIWT4_12_NLCA2_SU0_SUM0_SUS128_VWB4_WG64_4_1_WGM1_WGMXCC8_WGMXCCGn1
    SolutionIndex: 190
    SolutionNameMin: Cijk_Alik_Bljk_BBS_STA_BH_Bias_HAS_SAV_UserArgs_MT256x224x64_MI16x16x1_SN_LDSB0_GRVWB8_GSU1_GSUC0_GSUWGMRR0_K1_LBSPPB256_MIWT4_14_NLCA2_SU0_SUM0_SUS128_VWB2_WG64_4_1_WGM8_WGMXCC8_WGMXCCGn1
    SolutionIndex: 191
    SolutionNameMin: Cijk_Alik_Bljk_BBS_STA_BH_Bias_HAS_SAV_UserArgs_MT256x224x64_MI16x16x1_SN_LDSB0_GRVWB8_GSU1_GSUC0_GSUWGMRR0_K1_LBSPPB256_MIWT4_14_NLCA2_SU0_SUM0_SUS128_VWB2_WG64_4_1_WGM6_WGMXCC8_WGMXCCGn1
    SolutionIndex: 192
    SolutionNameMin: Cijk_Alik_Bljk_BBS_STA_BH_Bias_HAS_SAV_UserArgs_MT256x160x64_MI16x16x1_SN_LDSB0_GRVWB8_GSU1_GSUC0_GSUWGMRR0_K1_LBSPPB256_MIWT4_10_NLCA2_SU0_SUM0_SUS128_VWB2_WG64_4_1_WGM1_WGMXCC8_WGMXCCGn1
    SolutionIndex: 193
    SolutionNameMin: Cijk_Alik_Bljk_BBS_STA_BH_Bias_HAS_SAV_UserArgs_MT512x128x64_MI16x16x1_SN_LDSB0_GRVWB8_GSU1_GSUC0_GSUWGMRR0_K1_LBSPPB1024_MIWT8_8_NLCA2_SU8_SUM0_SUS128_VWB8_WG64_4_1_WGM8_WGMXCC8_WGMXCCGn1
    SolutionIndex: 194
    SolutionNameMin: Cijk_Alik_Bljk_BBS_STA_BH_Bias_HAS_SAV_UserArgs_MT256x176x64_MI16x16x1_SN_LDSB0_GRVWB4_GSU1_GSUC0_GSUWGMRR0_K1_LBSPPB128_MIWT4_11_NLCA2_SU8_SUM0_SUS128_VWB1_WG64_4_1_WGM6_WGMXCC8_WGMXCCGn1
    SolutionIndex: 195
    SolutionNameMin: Cijk_Alik_Bljk_BBS_STA_BH_Bias_HAS_SAV_UserArgs_MT256x208x64_MI16x16x1_SN_LDSB1_GRVWB4_GSU1_GSUC0_GSUWGMRR0_K1_LBSPPB128_MIWT4_13_NLCA2_SU8_SUM0_SUS128_VWB1_WG64_4_1_WGM8_WGMXCC8_WGMXCCGn1
    SolutionIndex: 196
    SolutionNameMin: Cijk_Alik_Bljk_BBS_STA_BH_Bias_HAS_SAV_UserArgs_MT384x160x64_MI16x16x1_SN_LDSB0_GRVWB8_GSU1_GSUC0_GSUWGMRR0_K1_LBSPPB256_MIWT6_10_NLCA2_SU0_SUM0_SUS128_VWB2_WG64_4_1_WGM8_WGMXCC8_WGMXCCGn1
    SolutionIndex: 197
    SolutionNameMin: Cijk_Alik_Bljk_BBS_STA_BH_Bias_HAS_SAV_UserArgs_MT384x160x64_MI16x16x1_SN_LDSB0_GRVWB8_GSU1_GSUC0_GSUWGMRR0_K1_LBSPPB256_MIWT6_10_NLCA2_SU0_SUM0_SUS128_VWB2_WG64_4_1_WGM6_WGMXCC8_WGMXCCGn1
    SolutionIndex: 198
    SolutionNameMin: Cijk_Alik_Bljk_BBS_STA_BH_Bias_HAS_SAV_UserArgs_MT320x192x64_MI16x16x1_SN_LDSB0_GRVWB8_GSU1_GSUC0_GSUWGMRR0_K1_LBSPPB512_MIWT5_12_NLCA2_SU0_SUM0_SUS128_VWB4_WG64_4_1_WGM6_WGMXCC8_WGMXCCGn1
    SolutionIndex: 199
    SolutionNameMin: Cijk_Alik_Bljk_BBS_STA_BH_Bias_HAS_SAV_UserArgs_MT512x128x64_MI16x16x1_SN_LDSB0_GRVWB8_GSU1_GSUC0_GSUWGMRR0_K1_LBSPPB1024_MIWT8_8_NLCA2_SU8_SUM0_SUS128_VWB8_WG64_4_1_WGM1_WGMXCC8_WGMXCCGn1
    SolutionIndex: 200
    SolutionNameMin: Cijk_Alik_Bljk_BBS_STA_BH_Bias_HAS_SAV_UserArgs_MT256x224x64_MI16x16x1_SN_LDSB0_GRVWB8_GSU1_GSUC0_GSUWGMRR0_K1_LBSPPB256_MIWT4_14_NLCA2_SU8_SUM0_SUS128_VWB2_WG64_4_1_WGM6_WGMXCC8_WGMXCCGn1
    SolutionIndex: 201
    SolutionNameMin: Cijk_Alik_Bljk_BBS_STA_BH_Bias_HAS_SAV_UserArgs_MT512x128x64_MI16x16x1_SN_LDSB0_GRVWB8_GSU1_GSUC0_GSUWGMRR0_K1_LBSPPB1024_MIWT8_8_NLCA2_SU0_SUM0_SUS128_VWB8_WG64_4_1_WGM6_WGMXCC8_WGMXCCGn1
    SolutionIndex: 202
    SolutionNameMin: Cijk_Alik_Bljk_BBS_STA_BH_Bias_HAS_SAV_UserArgs_MT256x192x64_MI16x16x1_SN_LDSB0_GRVWB8_GSU1_GSUC0_GSUWGMRR0_K1_LBSPPB512_MIWT4_12_NLCA2_SU8_SUM0_SUS128_VWB4_WG64_4_1_WGM8_WGMXCC8_WGMXCCGn1
    SolutionIndex: 203
    SolutionNameMin: Cijk_Alik_Bljk_BBS_STA_BH_Bias_HAS_SAV_UserArgs_MT320x192x64_MI16x16x1_SN_LDSB0_GRVWB8_GSU1_GSUC0_GSUWGMRR0_K1_LBSPPB512_MIWT5_12_NLCA2_SU0_SUM0_SUS128_VWB4_WG64_4_1_WGM8_WGMXCC8_WGMXCCGn1
    SolutionIndex: 204
    SolutionNameMin: Cijk_Alik_Bljk_BBS_STA_BH_Bias_HAS_SAV_UserArgs_MT256x256x64_MI16x16x1_SN_LDSB1_GRVWB8_GSU1_GSUC0_GSUWGMRR0_K1_LBSPPB1024_MIWT4_16_NLCA2_SU0_SUM0_SUS128_VWB8_WG64_4_1_WGM8_WGMXCC8_WGMXCCGn1
    SolutionIndex: 205
    SolutionNameMin: Cijk_Alik_Bljk_BBS_STA_BH_Bias_HAS_SAV_UserArgs_MT256x256x64_MI16x16x1_SN_LDSB1_GRVWB8_GSU1_GSUC0_GSUWGMRR0_K1_LBSPPB1024_MIWT4_16_NLCA2_SU8_SUM0_SUS128_VWB8_WG64_4_1_WGM8_WGMXCC8_WGMXCCGn1
    SolutionIndex: 206
    SolutionNameMin: Cijk_Alik_Bljk_BBS_STA_BH_Bias_HAS_SAV_UserArgs_MT512x128x64_MI16x16x1_SN_LDSB0_GRVWB8_GSU1_GSUC0_GSUWGMRR0_K1_LBSPPB1024_MIWT8_8_NLCA2_SU0_SUM0_SUS128_VWB8_WG64_4_1_WGM1_WGMXCC8_WGMXCCGn1
    SolutionIndex: 207
    SolutionNameMin: Cijk_Alik_Bljk_BBS_STA_BH_Bias_HAS_SAV_UserArgs_MT320x192x64_MI16x16x1_SN_LDSB0_GRVWB8_GSU1_GSUC0_GSUWGMRR0_K1_LBSPPB512_MIWT5_12_NLCA2_SU8_SUM0_SUS128_VWB4_WG64_4_1_WGM6_WGMXCC8_WGMXCCGn1
    SolutionIndex: 208
    SolutionNameMin: Cijk_Alik_Bljk_BBS_STA_BH_Bias_HAS_SAV_UserArgs_MT256x160x64_MI16x16x1_SN_LDSB0_GRVWB8_GSU1_GSUC0_GSUWGMRR0_K1_LBSPPB256_MIWT4_10_NLCA2_SU0_SUM0_SUS128_VWB2_WG64_4_1_WGM6_WGMXCC8_WGMXCCGn1
    SolutionIndex: 209
    SolutionNameMin: Cijk_Alik_Bljk_BBS_STA_BH_Bias_HAS_SAV_UserArgs_MT256x224x64_MI16x16x1_SN_LDSB0_GRVWB8_GSU1_GSUC0_GSUWGMRR0_K1_LBSPPB256_MIWT4_14_NLCA2_SU8_SUM0_SUS128_VWB2_WG64_4_1_WGM8_WGMXCC8_WGMXCCGn1
    SolutionIndex: 210
    SolutionNameMin: Cijk_Alik_Bljk_BBS_STA_BH_Bias_HAS_SAV_UserArgs_MT256x192x64_MI16x16x1_SN_LDSB0_GRVWB8_GSU1_GSUC0_GSUWGMRR0_K1_LBSPPB512_MIWT4_12_NLCA2_SU0_SUM0_SUS128_VWB4_WG64_4_1_WGM6_WGMXCC8_WGMXCCGn1
    SolutionIndex: 211
    SolutionNameMin: Cijk_Alik_Bljk_BBS_STA_BH_Bias_HAS_SAV_UserArgs_MT256x64x128_MI16x16x1_SN_LDSB1_GRVWB8_GSU1_GSUC0_GSUWGMRR0_K1_LBSPPB1024_MIWT4_4_NLCA4_SU0_SUM0_SUS256_VWB4_WG64_4_1_WGM6_WGMXCC8_WGMXCCGn1
    SolutionIndex: 212
    SolutionNameMin: Cijk_Alik_Bljk_BBS_STA_BH_Bias_HAS_SAV_UserArgs_MT256x64x128_MI16x16x1_SN_LDSB1_GRVWB8_GSU1_GSUC0_GSUWGMRR0_K1_LBSPPB1024_MIWT4_4_NLCA4_SU0_SUM0_SUS256_VWB4_WG64_4_1_WGM1_WGMXCC8_WGMXCCGn1
    SolutionIndex: 213
    SolutionNameMin: Cijk_Alik_Bljk_BBS_STA_BH_Bias_HAS_SAV_UserArgs_MT256x80x64_MI16x16x1_SN_LDSB0_GRVWB4_GSU1_GSUC0_GSUWGMRR0_K1_LBSPPB128_MIWT4_5_NLCA2_SU0_SUM0_SUS128_VWB1_WG64_4_1_WGM8_WGMXCC8_WGMXCCGn1
    SolutionIndex: 214
    SolutionNameMin: Cijk_Alik_Bljk_BBS_STA_BH_Bias_HAS_SAV_UserArgs_MT256x80x128_MI16x16x1_SN_LDSB1_GRVWB8_GSU1_GSUC0_GSUWGMRR0_K1_LBSPPB256_MIWT4_5_NLCA4_SU0_SUM0_SUS256_VWB1_WG64_4_1_WGM1_WGMXCC8_WGMXCCGn1
    SolutionIndex: 215
    SolutionNameMin: Cijk_Alik_Bljk_BBS_STA_BH_Bias_HAS_SAV_UserArgs_MT256x80x64_MI16x16x1_SN_LDSB0_GRVWB4_GSU1_GSUC0_GSUWGMRR0_K1_LBSPPB128_MIWT4_5_NLCA2_SU0_SUM0_SUS128_VWB1_WG64_4_1_WGM1_WGMXCC8_WGMXCCGn1
    SolutionIndex: 216
    SolutionNameMin: Cijk_Alik_Bljk_BBS_STA_BH_Bias_HAS_SAV_UserArgs_MT256x80x64_MI16x16x1_SN_LDSB0_GRVWB4_GSU1_GSUC0_GSUWGMRR0_K1_LBSPPB128_MIWT4_5_NLCA2_SU8_SUM0_SUS128_VWB1_WG64_4_1_WGM1_WGMXCC8_WGMXCCGn1
    SolutionIndex: 217
    SolutionNameMin: Cijk_Alik_Bljk_BBS_STA_BH_Bias_HAS_SAV_UserArgs_MT256x96x64_MI16x16x1_SN_LDSB0_GRVWB8_GSU1_GSUC0_GSUWGMRR0_K1_LBSPPB256_MIWT4_6_NLCA2_SU8_SUM0_SUS128_VWB2_WG64_4_1_WGM8_WGMXCC8_WGMXCCGn1
    SolutionIndex: 218
    SolutionNameMin: Cijk_Alik_Bljk_BBS_STA_BH_Bias_HAS_SAV_UserArgs_MT256x96x64_MI16x16x1_SN_LDSB0_GRVWB8_GSU1_GSUC0_GSUWGMRR0_K1_LBSPPB256_MIWT4_6_NLCA2_SU8_SUM0_SUS128_VWB2_WG64_4_1_WGM6_WGMXCC8_WGMXCCGn1
    SolutionIndex: 219
    SolutionNameMin: Cijk_Alik_Bljk_BBS_STA_BH_Bias_HAS_SAV_UserArgs_MT256x112x64_MI16x16x1_SN_LDSB1_GRVWB4_GSU1_GSUC0_GSUWGMRR0_K1_LBSPPB128_MIWT4_7_NLCA2_SU8_SUM0_SUS128_VWB1_WG64_4_1_WGM1_WGMXCC8_WGMXCCGn1
    SolutionIndex: 220
    SolutionNameMin: Cijk_Alik_Bljk_BBS_STA_BH_Bias_HAS_SAV_UserArgs_MT256x112x64_MI16x16x1_SN_LDSB1_GRVWB4_GSU1_GSUC0_GSUWGMRR0_K1_LBSPPB128_MIWT4_7_NLCA2_SU0_SUM0_SUS128_VWB1_WG64_4_1_WGM1_WGMXCC8_WGMXCCGn1
    SolutionIndex: 221
    SolutionNameMin: Cijk_Alik_Bljk_BBS_STA_BH_Bias_HAS_SAV_UserArgs_MT256x128x64_MI16x16x1_SN_LDSB1_GRVWB8_GSU1_GSUC0_GSUWGMRR0_K1_LBSPPB1024_MIWT4_8_NLCA2_SU8_SUM0_SUS128_VWB8_WG64_4_1_WGM1_WGMXCC8_WGMXCCGn1
    SolutionIndex: 222
    SolutionNameMin: Cijk_Alik_Bljk_BBS_STA_BH_Bias_HAS_SAV_UserArgs_MT512x64x64_MI16x16x1_SN_LDSB0_GRVWB8_GSU1_GSUC0_GSUWGMRR0_K1_LBSPPB512_MIWT8_4_NLCA2_SU0_SUM0_SUS128_VWB4_WG64_4_1_WGM8_WGMXCC8_WGMXCCGn1
    SolutionIndex: 223
    SolutionNameMin: Cijk_Alik_Bljk_BBS_STA_BH_Bias_HAS_SAV_UserArgs_MT256x128x64_MI16x16x1_SN_LDSB1_GRVWB8_GSU1_GSUC0_GSUWGMRR0_K1_LBSPPB1024_MIWT4_8_NLCA2_SU0_SUM0_SUS128_VWB8_WG64_4_1_WGM1_WGMXCC8_WGMXCCGn1
    SolutionIndex: 224
    SolutionNameMin: Cijk_Alik_Bljk_BBS_STA_BH_Bias_HAS_SAV_UserArgs_MT256x144x64_MI16x16x1_SN_LDSB0_GRVWB4_GSU1_GSUC0_GSUWGMRR0_K1_LBSPPB128_MIWT4_9_NLCA2_SU0_SUM0_SUS128_VWB1_WG64_4_1_WGM1_WGMXCC8_WGMXCCGn1
    SolutionIndex: 225
    SolutionNameMin: Cijk_Alik_Bljk_BBS_STA_BH_Bias_HAS_SAV_UserArgs_MT256x176x64_MI16x16x1_SN_LDSB0_GRVWB4_GSU1_GSUC0_GSUWGMRR0_K1_LBSPPB128_MIWT4_11_NLCA2_SU0_SUM0_SUS128_VWB1_WG64_4_1_WGM1_WGMXCC8_WGMXCCGn1
    SolutionIndex: 226
    SolutionNameMin: Cijk_Alik_Bljk_BBS_STA_BH_Bias_HAS_SAV_UserArgs_MT256x176x64_MI16x16x1_SN_LDSB0_GRVWB4_GSU1_GSUC0_GSUWGMRR0_K1_LBSPPB128_MIWT4_11_NLCA2_SU8_SUM0_SUS128_VWB1_WG64_4_1_WGM1_WGMXCC8_WGMXCCGn1
    SolutionIndex: 227
    SolutionNameMin: Cijk_Alik_Bljk_BBS_STA_BH_Bias_HAS_SAV_UserArgs_MT256x224x64_MI16x16x1_SN_LDSB0_GRVWB8_GSU1_GSUC0_GSUWGMRR0_K1_LBSPPB256_MIWT4_14_NLCA2_SU0_SUM0_SUS128_VWB2_WG64_4_1_WGM1_WGMXCC8_WGMXCCGn1
    SolutionIndex: 228
    SolutionNameMin: Cijk_Alik_Bljk_BBS_STA_BH_Bias_HAS_SAV_UserArgs_MT256x224x64_MI16x16x1_SN_LDSB0_GRVWB8_GSU1_GSUC0_GSUWGMRR0_K1_LBSPPB256_MIWT4_14_NLCA2_SU8_SUM0_SUS128_VWB2_WG64_4_1_WGM1_WGMXCC8_WGMXCCGn1
    SolutionIndex: 229
    SolutionNameMin: Cijk_Alik_Bljk_BBS_STA_BH_Bias_HAS_SAV_UserArgs_MT256x240x64_MI16x16x1_SN_LDSB1_GRVWB4_GSU1_GSUC0_GSUWGMRR0_K1_LBSPPB128_MIWT4_15_NLCA2_SU0_SUM0_SUS128_VWB1_WG64_4_1_WGM1_WGMXCC8_WGMXCCGn1
    SolutionIndex: 230
    SolutionNameMin: Cijk_Alik_Bljk_BBS_STA_BH_Bias_HAS_SAV_UserArgs_MT512x128x64_MI16x16x1_SN_LDSB0_GRVWB8_GSU1_GSUC0_GSUWGMRR0_K1_LBSPPB1024_MIWT8_8_NLCA2_SU8_SUM0_SUS128_VWB8_WG64_4_1_WGM6_WGMXCC8_WGMXCCGn1
    SolutionIndex: 231
    SolutionNameMin: Cijk_Alik_Bljk_BBS_STA_BH_Bias_HAS_SAV_UserArgs_MT256x96x64_MI16x16x1_SN_LDSB0_GRVWB8_GSU1_GSUC0_GSUWGMRR0_K1_LBSPPB256_MIWT4_6_NLCA2_SU8_SUM0_SUS128_VWB2_WG64_4_1_WGM1_WGMXCC8_WGMXCCGn1
    SolutionIndex: 232
    SolutionNameMin: Cijk_Alik_Bljk_BBS_STA_BH_Bias_HAS_SAV_UserArgs_MT256x160x64_MI16x16x1_SN_LDSB0_GRVWB8_GSU1_GSUC0_GSUWGMRR0_K1_LBSPPB256_MIWT4_10_NLCA2_SU8_SUM0_SUS128_VWB2_WG64_4_1_WGM1_WGMXCC8_WGMXCCGn1
    SolutionIndex: 233
    SolutionNameMin: Cijk_Alik_Bljk_BBS_STA_BH_Bias_HAS_SAV_UserArgs_MT256x176x64_MI16x16x1_SN_LDSB0_GRVWB4_GSU1_GSUC0_GSUWGMRR0_K1_LBSPPB128_MIWT4_11_NLCA2_SU0_SUM0_SUS128_VWB1_WG64_4_1_WGM8_WGMXCC8_WGMXCCGn1
    SolutionIndex: 234
    SolutionNameMin: Cijk_Alik_Bljk_BBS_STA_BH_Bias_HAS_SAV_UserArgs_MT256x192x64_MI16x16x1_SN_LDSB0_GRVWB8_GSU1_GSUC0_GSUWGMRR0_K1_LBSPPB512_MIWT4_12_NLCA2_SU8_SUM0_SUS128_VWB4_WG64_4_1_WGM1_WGMXCC8_WGMXCCGn1
    SolutionIndex: 235
    SolutionNameMin: Cijk_Alik_Bljk_BBS_STA_BH_Bias_HAS_SAV_UserArgs_MT256x208x64_MI16x16x1_SN_LDSB1_GRVWB4_GSU1_GSUC0_GSUWGMRR0_K1_LBSPPB128_MIWT4_13_NLCA2_SU8_SUM0_SUS128_VWB1_WG64_4_1_WGM1_WGMXCC8_WGMXCCGn1
    SolutionIndex: 236
    SolutionNameMin: Cijk_Alik_Bljk_BBS_STA_BH_Bias_HAS_SAV_UserArgs_MT256x160x64_MI16x16x1_SN_LDSB0_GRVWB8_GSU1_GSUC0_GSUWGMRR0_K1_LBSPPB256_MIWT4_10_NLCA2_SU8_SUM0_SUS128_VWB2_WG64_4_1_WGM8_WGMXCC8_WGMXCCGn1
    SolutionIndex: 237
    SolutionNameMin: Cijk_Alik_Bljk_BBS_STA_BH_Bias_HAS_SAV_UserArgs_MT256x128x64_MI16x16x1_SN_LDSB1_GRVWB8_GSU1_GSUC0_GSUWGMRR0_K1_LBSPPB1024_MIWT4_8_NLCA2_SU8_SUM0_SUS128_VWB8_WG64_4_1_WGM8_WGMXCC8_WGMXCCGn1
    SolutionIndex: 238
    SolutionNameMin: Cijk_Alik_Bljk_BBS_STA_BH_Bias_HAS_SAV_UserArgs_MT256x128x64_MI16x16x1_SN_LDSB1_GRVWB8_GSU1_GSUC0_GSUWGMRR0_K1_LBSPPB1024_MIWT4_8_NLCA2_SU0_SUM0_SUS128_VWB8_WG64_4_1_WGM8_WGMXCC8_WGMXCCGn1
    SolutionIndex: 239
    SolutionNameMin: Cijk_Alik_Bljk_BBS_STA_BH_Bias_HAS_SAV_UserArgs_MT192x224x64_MI16x16x1_SN_LDSB0_GRVWB8_GSU1_GSUC0_GSUWGMRR0_K1_LBSPPB256_MIWT3_14_NLCA2_SU0_SUM0_SUS128_VWB2_WG64_4_1_WGM6_WGMXCC8_WGMXCCGn1
    SolutionIndex: 240
    SolutionNameMin: Cijk_Alik_Bljk_BBS_STA_BH_Bias_HAS_SAV_UserArgs_MT256x176x64_MI16x16x1_SN_LDSB0_GRVWB4_GSU1_GSUC0_GSUWGMRR0_K1_LBSPPB128_MIWT4_11_NLCA2_SU8_SUM0_SUS128_VWB1_WG64_4_1_WGM8_WGMXCC8_WGMXCCGn1
    SolutionIndex: 241
    SolutionNameMin: Cijk_Alik_Bljk_BBS_STA_BH_Bias_HAS_SAV_UserArgs_MT256x208x64_MI16x16x1_SN_LDSB1_GRVWB4_GSU1_GSUC0_GSUWGMRR0_K1_LBSPPB128_MIWT4_13_NLCA2_SU0_SUM0_SUS128_VWB1_WG64_4_1_WGM1_WGMXCC8_WGMXCCGn1
    SolutionIndex: 242
    SolutionNameMin: Cijk_Alik_Bljk_BBS_STA_BH_Bias_HAS_SAV_UserArgs_MT256x256x64_MI16x16x1_SN_LDSB1_GRVWB8_GSU1_GSUC0_GSUWGMRR0_K1_LBSPPB1024_MIWT4_16_NLCA2_SU8_SUM0_SUS128_VWB8_WG64_4_1_WGM1_WGMXCC8_WGMXCCGn1
    SolutionIndex: 243
    SolutionNameMin: Cijk_Alik_Bljk_BBS_STA_BH_Bias_HAS_SAV_UserArgs_MT256x256x64_MI16x16x1_SN_LDSB1_GRVWB8_GSU1_GSUC0_GSUWGMRR0_K1_LBSPPB1024_MIWT4_16_NLCA2_SU0_SUM0_SUS128_VWB8_WG64_4_1_WGM1_WGMXCC8_WGMXCCGn1
    SolutionIndex: 244
    SolutionNameMin: Cijk_Alik_Bljk_BBS_STA_BH_Bias_HAS_SAV_UserArgs_MT384x160x64_MI16x16x1_SN_LDSB0_GRVWB8_GSU1_GSUC0_GSUWGMRR0_K1_LBSPPB256_MIWT6_10_NLCA2_SU8_SUM0_SUS128_VWB2_WG64_4_1_WGM8_WGMXCC8_WGMXCCGn1
    SolutionIndex: 245
    SolutionNameMin: Cijk_Alik_Bljk_BBS_STA_BH_Bias_HAS_SAV_UserArgs_MT384x160x64_MI16x16x1_SN_LDSB0_GRVWB8_GSU1_GSUC0_GSUWGMRR0_K1_LBSPPB256_MIWT6_10_NLCA2_SU8_SUM0_SUS128_VWB2_WG64_4_1_WGM6_WGMXCC8_WGMXCCGn1
    SolutionIndex: 246
    SolutionNameMin: Cijk_Alik_Bljk_BBS_STA_BH_Bias_HAS_SAV_UserArgs_MT128x128x64_MI16x16x1_SN_LDSB1_GRVWB8_GSU1_GSUC0_GSUWGMRR0_K1_LBSPPB1024_MIWT2_8_NLCA2_SU0_SUM0_SUS128_VWB8_WG64_4_1_WGM8_WGMXCC8_WGMXCCGn1
    SolutionIndex: 247
    SolutionNameMin: Cijk_Alik_Bljk_BBS_STA_BH_Bias_HAS_SAV_UserArgs_MT128x128x64_MI16x16x1_SN_LDSB1_GRVWB8_GSU1_GSUC0_GSUWGMRR0_K1_LBSPPB1024_MIWT2_8_NLCA2_SU8_SUM0_SUS128_VWB8_WG64_4_1_WGM8_WGMXCC8_WGMXCCGn1
    SolutionIndex: 248
    SolutionNameMin: Cijk_Alik_Bljk_BBS_STA_BH_Bias_HAS_SAV_UserArgs_MT256x96x64_MI16x16x1_SN_LDSB0_GRVWB8_GSU1_GSUC0_GSUWGMRR0_K1_LBSPPB256_MIWT4_6_NLCA2_SU0_SUM0_SUS128_VWB2_WG64_4_1_WGM8_WGMXCC8_WGMXCCGn1
    SolutionIndex: 249
    SolutionNameMin: Cijk_Alik_Bljk_BBS_STA_BH_Bias_HAS_SAV_UserArgs_MT320x80x64_MI16x16x1_SN_LDSB0_GRVWB4_GSU1_GSUC0_GSUWGMRR0_K1_LBSPPB128_MIWT5_5_NLCA2_SU0_SUM0_SUS128_VWB1_WG64_4_1_WGM6_WGMXCC8_WGMXCCGn1
    SolutionIndex: 250
    SolutionNameMin: Cijk_Alik_Bljk_BBS_STA_BH_Bias_HAS_SAV_UserArgs_MT192x96x64_MI16x16x1_SN_LDSB0_GRVWB8_GSU1_GSUC0_GSUWGMRR0_K1_LBSPPB256_MIWT3_6_NLCA2_SU0_SUM0_SUS128_VWB2_WG64_4_1_WGM6_WGMXCC8_WGMXCCGn1
    SolutionIndex: 251
    SolutionNameMin: Cijk_Alik_Bljk_BBS_STA_BH_Bias_HAS_SAV_UserArgs_MT256x96x64_MI16x16x1_SN_LDSB0_GRVWB8_GSU1_GSUC0_GSUWGMRR0_K1_LBSPPB256_MIWT4_6_NLCA2_SU0_SUM0_SUS128_VWB2_WG64_4_1_WGM6_WGMXCC8_WGMXCCGn1
    SolutionIndex: 252
    SolutionNameMin: Cijk_Alik_Bljk_BBS_STA_BH_Bias_HAS_SAV_UserArgs_MT256x96x64_MI16x16x1_SN_LDSB0_GRVWB8_GSU1_GSUC0_GSUWGMRR0_K1_LBSPPB256_MIWT4_6_NLCA2_SU8_SUM0_SUS128_VWB2_WG64_4_1_WGM8_WGMXCC8_WGMXCCGn1
    SolutionIndex: 253
    SolutionNameMin: Cijk_Alik_Bljk_BBS_STA_BH_Bias_HAS_SAV_UserArgs_MT192x128x64_MI16x16x1_SN_LDSB1_GRVWB8_GSU1_GSUC0_GSUWGMRR0_K1_LBSPPB1024_MIWT3_8_NLCA2_SU0_SUM0_SUS128_VWB8_WG64_4_1_WGM6_WGMXCC8_WGMXCCGn1
    SolutionIndex: 254
    SolutionNameMin: Cijk_Alik_Bljk_BBS_STA_BH_Bias_HAS_SAV_UserArgs_MT320x80x64_MI16x16x1_SN_LDSB0_GRVWB4_GSU1_GSUC0_GSUWGMRR0_K1_LBSPPB128_MIWT5_5_NLCA2_SU0_SUM0_SUS128_VWB1_WG64_4_1_WGM8_WGMXCC8_WGMXCCGn1
    SolutionIndex: 255
    SolutionNameMin: Cijk_Alik_Bljk_BBS_STA_BH_Bias_HAS_SAV_UserArgs_MT192x128x64_MI16x16x1_SN_LDSB1_GRVWB8_GSU1_GSUC0_GSUWGMRR0_K1_LBSPPB1024_MIWT3_8_NLCA2_SU0_SUM0_SUS128_VWB8_WG64_4_1_WGM8_WGMXCC8_WGMXCCGn1
    SolutionIndex: 256
    SolutionNameMin: Cijk_Alik_Bljk_BBS_STA_BH_Bias_HAS_SAV_UserArgs_MT192x96x64_MI16x16x1_SN_LDSB0_GRVWB8_GSU1_GSUC0_GSUWGMRR0_K1_LBSPPB256_MIWT3_6_NLCA2_SU8_SUM0_SUS128_VWB2_WG64_4_1_WGM6_WGMXCC8_WGMXCCGn1
    SolutionIndex: 257
    SolutionNameMin: Cijk_Alik_Bljk_BBS_STA_BH_Bias_HAS_SAV_UserArgs_MT256x256x64_MI16x16x1_SN_LDSB1_GRVWB8_GSU1_GSUC0_GSUWGMRR0_K1_LBSPPB1024_MIWT4_16_NLCA2_SU0_SUM0_SUS128_VWB8_WG64_4_1_WGM6_WGMXCC8_WGMXCCGn1
    SolutionIndex: 258
    SolutionNameMin: Cijk_Alik_Bljk_BBS_STA_BH_Bias_HAS_SAV_UserArgs_MT192x128x64_MI16x16x1_SN_LDSB1_GRVWB8_GSU1_GSUC0_GSUWGMRR0_K1_LBSPPB1024_MIWT3_8_NLCA2_SU8_SUM0_SUS128_VWB8_WG64_4_1_WGM6_WGMXCC8_WGMXCCGn1
    SolutionIndex: 259
    SolutionNameMin: Cijk_Alik_Bljk_BBS_STA_BH_Bias_HAS_SAV_UserArgs_MT320x128x64_MI16x16x1_SN_LDSB0_GRVWB8_GSU1_GSUC0_GSUWGMRR0_K1_LBSPPB1024_MIWT5_8_NLCA2_SU0_SUM0_SUS128_VWB8_WG64_4_1_WGM8_WGMXCC8_WGMXCCGn1
    SolutionIndex: 260
    SolutionNameMin: Cijk_Alik_Bljk_BBS_STA_BH_Bias_HAS_SAV_UserArgs_MT192x96x64_MI16x16x1_SN_LDSB0_GRVWB8_GSU1_GSUC0_GSUWGMRR0_K1_LBSPPB256_MIWT3_6_NLCA2_SU0_SUM0_SUS128_VWB2_WG64_4_1_WGM8_WGMXCC8_WGMXCCGn1
    SolutionIndex: 261
    SolutionNameMin: Cijk_Alik_Bljk_BBS_STA_BH_Bias_HAS_SAV_UserArgs_MT320x80x64_MI16x16x1_SN_LDSB0_GRVWB4_GSU1_GSUC0_GSUWGMRR0_K1_LBSPPB128_MIWT5_5_NLCA2_SU0_SUM0_SUS128_VWB1_WG64_4_1_WGM8_WGMXCC8_WGMXCCGn1
    SolutionIndex: 262
    SolutionNameMin: Cijk_Alik_Bljk_BBS_STA_BH_Bias_HAS_SAV_UserArgs_MT192x112x64_MI16x16x1_SN_LDSB1_GRVWB4_GSU1_GSUC0_GSUWGMRR0_K1_LBSPPB128_MIWT3_7_NLCA2_SU0_SUM0_SUS128_VWB1_WG64_4_1_WGM8_WGMXCC8_WGMXCCGn1
    SolutionIndex: 263
    SolutionNameMin: Cijk_Alik_Bljk_BBS_STA_BH_Bias_HAS_SAV_UserArgs_MT320x176x64_MI16x16x1_SN_LDSB0_GRVWB4_GSU1_GSUC0_GSUWGMRR0_K1_LBSPPB128_MIWT5_11_NLCA2_SU8_SUM0_SUS128_VWB1_WG64_4_1_WGM6_WGMXCC8_WGMXCCGn1
    SolutionIndex: 264
    SolutionNameMin: Cijk_Alik_Bljk_BBS_STA_BH_Bias_HAS_SAV_UserArgs_MT192x128x64_MI16x16x1_SN_LDSB1_GRVWB8_GSU1_GSUC0_GSUWGMRR0_K1_LBSPPB1024_MIWT3_8_NLCA2_SU0_SUM0_SUS128_VWB8_WG64_4_1_WGM8_WGMXCC8_WGMXCCGn1
    SolutionIndex: 265
    SolutionNameMin: Cijk_Alik_Bljk_BBS_STA_BH_Bias_HAS_SAV_UserArgs_MT320x208x64_MI16x16x1_SN_LDSB1_GRVWB4_GSU1_GSUC0_GSUWGMRR0_K1_LBSPPB128_MIWT5_13_NLCA2_SU8_SUM0_SUS128_VWB1_WG64_4_1_WGM8_WGMXCC8_WGMXCCGn1
    SolutionIndex: 266
    SolutionNameMin: Cijk_Alik_Bljk_BBS_STA_BH_Bias_HAS_SAV_UserArgs_MT192x128x64_MI16x16x1_SN_LDSB1_GRVWB8_GSU1_GSUC0_GSUWGMRR0_K1_LBSPPB1024_MIWT3_8_NLCA2_SU8_SUM0_SUS128_VWB8_WG64_4_1_WGM6_WGMXCC8_WGMXCCGn1
    SolutionIndex: 267
    SolutionNameMin: Cijk_Alik_Bljk_BBS_STA_BH_Bias_HAS_SAV_UserArgs_MT320x208x64_MI16x16x1_SN_LDSB1_GRVWB4_GSU1_GSUC0_GSUWGMRR0_K1_LBSPPB128_MIWT5_13_NLCA2_SU0_SUM0_SUS128_VWB1_WG64_4_1_WGM8_WGMXCC8_WGMXCCGn1
    SolutionIndex: 268
    SolutionNameMin: Cijk_Alik_Bljk_BBS_STA_BH_Bias_HAS_SAV_UserArgs_MT320x208x64_MI16x16x1_SN_LDSB1_GRVWB4_GSU1_GSUC0_GSUWGMRR0_K1_LBSPPB128_MIWT5_13_NLCA2_SU0_SUM0_SUS128_VWB1_WG64_4_1_WGM6_WGMXCC8_WGMXCCGn1
    SolutionIndex: 269
    SolutionNameMin: Cijk_Alik_Bljk_BBS_STA_BH_Bias_HAS_SAV_UserArgs_MT320x128x64_MI16x16x1_SN_LDSB0_GRVWB8_GSU1_GSUC0_GSUWGMRR0_K1_LBSPPB1024_MIWT5_8_NLCA2_SU8_SUM0_SUS128_VWB8_WG64_4_1_WGM6_WGMXCC8_WGMXCCGn1
    SolutionIndex: 270
    SolutionNameMin: Cijk_Alik_Bljk_BBS_STA_BH_Bias_HAS_SAV_UserArgs_MT320x144x64_MI16x16x1_SN_LDSB0_GRVWB4_GSU1_GSUC0_GSUWGMRR0_K1_LBSPPB128_MIWT5_9_NLCA2_SU0_SUM0_SUS128_VWB1_WG64_4_1_WGM6_WGMXCC8_WGMXCCGn1
    SolutionIndex: 271
    SolutionNameMin: Cijk_Alik_Bljk_BBS_STA_BH_Bias_HAS_SAV_UserArgs_MT320x144x64_MI16x16x1_SN_LDSB0_GRVWB4_GSU1_GSUC0_GSUWGMRR0_K1_LBSPPB128_MIWT5_9_NLCA2_SU8_SUM0_SUS128_VWB1_WG64_4_1_WGM6_WGMXCC8_WGMXCCGn1
    SolutionIndex: 272
    SolutionNameMin: Cijk_Alik_Bljk_BBS_STA_BH_Bias_HAS_SAV_UserArgs_MT256x208x64_MI16x16x1_SN_LDSB1_GRVWB4_GSU1_GSUC0_GSUWGMRR0_K1_LBSPPB128_MIWT4_13_NLCA2_SU8_SUM0_SUS128_VWB1_WG64_4_1_WGM6_WGMXCC8_WGMXCCGn1
    SolutionIndex: 273
    SolutionNameMin: Cijk_Alik_Bljk_BBS_STA_BH_Bias_HAS_SAV_UserArgs_MT320x176x64_MI16x16x1_SN_LDSB0_GRVWB4_GSU1_GSUC0_GSUWGMRR0_K1_LBSPPB128_MIWT5_11_NLCA2_SU0_SUM0_SUS128_VWB1_WG64_4_1_WGM6_WGMXCC8_WGMXCCGn1
    SolutionIndex: 274
    SolutionNameMin: Cijk_Alik_Bljk_BBS_STA_BH_Bias_HAS_SAV_UserArgs_MT320x176x64_MI16x16x1_SN_LDSB0_GRVWB4_GSU1_GSUC0_GSUWGMRR0_K1_LBSPPB128_MIWT5_11_NLCA2_SU8_SUM0_SUS128_VWB1_WG64_4_1_WGM8_WGMXCC8_WGMXCCGn1
    SolutionIndex: 275
    SolutionNameMin: Cijk_Alik_Bljk_BBS_STA_BH_Bias_HAS_SAV_UserArgs_MT320x192x64_MI16x16x1_SN_LDSB0_GRVWB8_GSU1_GSUC0_GSUWGMRR0_K1_LBSPPB512_MIWT5_12_NLCA2_SU0_SUM0_SUS128_VWB4_WG64_4_1_WGM1_WGMXCC8_WGMXCCGn1
    SolutionIndex: 276
    SolutionNameMin: Cijk_Alik_Bljk_BBS_STA_BH_Bias_HAS_SAV_UserArgs_MT320x144x64_MI16x16x1_SN_LDSB0_GRVWB4_GSU1_GSUC0_GSUWGMRR0_K1_LBSPPB128_MIWT5_9_NLCA2_SU0_SUM0_SUS128_VWB1_WG64_4_1_WGM8_WGMXCC8_WGMXCCGn1
    SolutionIndex: 277
    SolutionNameMin: Cijk_Alik_Bljk_BBS_STA_BH_Bias_HAS_SAV_UserArgs_MT320x144x64_MI16x16x1_SN_LDSB0_GRVWB4_GSU1_GSUC0_GSUWGMRR0_K1_LBSPPB128_MIWT5_9_NLCA2_SU8_SUM0_SUS128_VWB1_WG64_4_1_WGM8_WGMXCC8_WGMXCCGn1
    SolutionIndex: 278
    SolutionNameMin: Cijk_Alik_Bljk_BBS_STA_BH_Bias_HAS_SAV_UserArgs_MT256x208x64_MI16x16x1_SN_LDSB1_GRVWB4_GSU1_GSUC0_GSUWGMRR0_K1_LBSPPB128_MIWT4_13_NLCA2_SU0_SUM0_SUS128_VWB1_WG64_4_1_WGM8_WGMXCC8_WGMXCCGn1
    SolutionIndex: 279
    SolutionNameMin: Cijk_Alik_Bljk_BBS_STA_BH_Bias_HAS_SAV_UserArgs_MT320x112x64_MI16x16x1_SN_LDSB0_GRVWB4_GSU1_GSUC0_GSUWGMRR0_K1_LBSPPB128_MIWT5_7_NLCA2_SU8_SUM0_SUS128_VWB1_WG64_4_1_WGM8_WGMXCC8_WGMXCCGn1
    SolutionIndex: 280
    SolutionNameMin: Cijk_Alik_Bljk_BBS_STA_BH_Bias_HAS_SAV_UserArgs_MT320x176x64_MI16x16x1_SN_LDSB0_GRVWB4_GSU1_GSUC0_GSUWGMRR0_K1_LBSPPB128_MIWT5_11_NLCA2_SU0_SUM0_SUS128_VWB1_WG64_4_1_WGM8_WGMXCC8_WGMXCCGn1
    SolutionIndex: 281
    SolutionNameMin: Cijk_Alik_Bljk_BBS_STA_BH_Bias_HAS_SAV_UserArgs_MT320x208x64_MI16x16x1_SN_LDSB1_GRVWB4_GSU1_GSUC0_GSUWGMRR0_K1_LBSPPB128_MIWT5_13_NLCA2_SU8_SUM0_SUS128_VWB1_WG64_4_1_WGM6_WGMXCC8_WGMXCCGn1
    SolutionIndex: 282
    SolutionNameMin: Cijk_Alik_Bljk_BBS_STA_BH_Bias_HAS_SAV_UserArgs_MT320x208x64_MI16x16x1_SN_LDSB1_GRVWB4_GSU1_GSUC0_GSUWGMRR0_K1_LBSPPB128_MIWT5_13_NLCA2_SU0_SUM0_SUS128_VWB1_WG64_4_1_WGM1_WGMXCC8_WGMXCCGn1
    SolutionIndex: 283
    SolutionNameMin: Cijk_Alik_Bljk_BBS_STA_BH_Bias_HAS_SAV_UserArgs_MT256x240x64_MI16x16x1_SN_LDSB1_GRVWB4_GSU1_GSUC0_GSUWGMRR0_K1_LBSPPB128_MIWT4_15_NLCA2_SU8_SUM0_SUS128_VWB1_WG64_4_1_WGM8_WGMXCC8_WGMXCCGn1
    SolutionIndex: 284
    SolutionNameMin: Cijk_Alik_Bljk_BBS_STA_BH_Bias_HAS_SAV_UserArgs_MT32x16x512_MI16x16x1_SN_LDSB1_GRVWB8_GSU1_GSUC0_GSUWGMRR0_K1_LBSPPB1024_MIWT1_1_NTA0_NLCA16_SU8_SUM0_SUS1024_VWB1_WG32_4_1_WGM8_WGMXCC8_WGMXCCGn1
    SolutionIndex: 285
    SolutionNameMin: Cijk_Alik_Bljk_BBS_STA_BH_Bias_HAS_SAV_UserArgs_MT32x16x512_MI16x16x1_SN_LDSB1_GRVWB8_GSU1_GSUC0_GSUWGMRR0_K1_LBSPPB1024_MIWT1_1_NTA0_NLCA16_SU0_SUM0_SUS1024_VWB1_WG32_4_1_WGM8_WGMXCC8_WGMXCCGn1
    SolutionIndex: 286
    SolutionNameMin: Cijk_Alik_Bljk_BBS_STA_BH_Bias_HAS_SAV_UserArgs_MT64x16x512_MI16x16x1_SN_LDSB1_GRVWB8_GSU1_GSUC0_GSUWGMRR0_K1_LBSPPB1024_MIWT1_1_NTA0_NLCA16_SU8_SUM0_SUS1024_VWB1_WG64_4_1_WGM8_WGMXCC8_WGMXCCGn1
    SolutionIndex: 287
    SolutionNameMin: Cijk_Alik_Bljk_BBS_STA_BH_Bias_HAS_SAV_UserArgs_MT128x32x256_MI16x16x1_SN_LDSB1_GRVWB8_GSU4_GSUC0_GSUWGMRR0_K1_LBSPPB1024_MIWT2_2_NTA0_NLCA8_SU0_SUM0_SUS512_VWB2_WG64_4_1_WGM8_WGMXCC8_WGMXCCGn1
    SolutionIndex: 288
    SolutionNameMin: Cijk_Alik_Bljk_BBS_STA_BH_Bias_HAS_SAV_UserArgs_MT64x16x256_MI16x16x1_SN_LDSB0_GRVWB8_GSU1_GSUC0_GSUWGMRR0_K1_LBSPPB512_MIWT1_1_NTA0_NLCA8_SU8_SUM0_SUS512_VWB1_WG64_4_1_WGM8_WGMXCC8_WGMXCCGn1
    SolutionIndex: 289
    SolutionNameMin: Cijk_Alik_Bljk_BBS_STA_BH_Bias_HAS_SAV_UserArgs_MT64x32x256_MI16x16x1_SN_LDSB1_GRVWB8_GSU3_GSUC0_GSUWGMRR0_K1_LBSPPB1024_MIWT1_2_NTA0_NLCA8_SU0_SUM0_SUS512_VWB2_WG64_4_1_WGM8_WGMXCC8_WGMXCCGn1
    SolutionIndex: 290
    SolutionNameMin: Cijk_Alik_Bljk_BBS_STA_BH_Bias_HAS_SAV_UserArgs_MT64x16x256_MI16x16x1_SN_LDSB0_GRVWB8_GSU1_GSUC0_GSUWGMRR0_K1_LBSPPB512_MIWT1_1_NTA0_NLCA8_SU0_SUM0_SUS512_VWB1_WG64_4_1_WGM8_WGMXCC8_WGMXCCGn1
    SolutionIndex: 291
    SolutionNameMin: Cijk_Alik_Bljk_BBS_STA_BH_Bias_HAS_SAV_UserArgs_MT64x16x512_MI16x16x1_SN_LDSB1_GRVWB8_GSU1_GSUC0_GSUWGMRR0_K1_LBSPPB1024_MIWT1_1_NTA0_NLCA16_SU0_SUM0_SUS1024_VWB1_WG64_4_1_WGM8_WGMXCC8_WGMXCCGn1
    SolutionIndex: 292
    SolutionNameMin: Cijk_Alik_Bljk_BBS_STA_BH_Bias_HAS_SAV_UserArgs_MT128x48x128_MI16x16x1_SN_LDSB0_GRVWB8_GSU4_GSUC0_GSUWGMRR0_K1_LBSPPB256_MIWT2_3_NTA0_NLCA4_SU0_SUM0_SUS256_VWB1_WG64_4_1_WGM8_WGMXCC8_WGMXCCGn1
    SolutionIndex: 293
    SolutionNameMin: Cijk_Alik_Bljk_BBS_STA_BH_Bias_HAS_SAV_UserArgs_MT64x64x256_MI16x16x1_SN_LDSB1_GRVWB8_GSU4_GSUC0_GSUWGMRR0_K1_LBSPPB1024_MIWT2_2_NTA0_NLCA8_SU0_SUM0_SUS512_VWB2_WG32_8_1_WGM8_WGMXCC8_WGMXCCGn1
    SolutionIndex: 294
    SolutionNameMin: Cijk_Alik_Bljk_BBS_STA_BH_Bias_HAS_SAV_UserArgs_MT128x32x256_MI16x16x1_SN_LDSB1_GRVWB8_GSU3_GSUC0_GSUWGMRR0_K1_LBSPPB1024_MIWT2_2_NTA0_NLCA8_SU0_SUM0_SUS512_VWB2_WG64_4_1_WGM8_WGMXCC8_WGMXCCGn1
    SolutionIndex: 295
    SolutionNameMin: Cijk_Alik_Bljk_BBS_STA_BH_Bias_HAS_SAV_UserArgs_MT128x64x128_MI16x16x1_SN_LDSB1_GRVWB8_GSU5_GSUC0_GSUWGMRR0_K1_LBSPPB1024_MIWT2_4_NTA0_NLCA4_SU0_SUM0_SUS256_VWB4_WG64_4_1_WGM8_WGMXCC8_WGMXCCGn1
    SolutionIndex: 296
    SolutionNameMin: Cijk_Alik_Bljk_BBS_STA_BH_Bias_HAS_SAV_UserArgs_MT128x64x128_MI16x16x1_SN_LDSB1_GRVWB8_GSU4_GSUC0_GSUWGMRR0_K1_LBSPPB1024_MIWT2_4_NTA4_NLCA4_SU0_SUM0_SUS256_VWB4_WG64_4_1_WGM8_WGMXCC8_WGMXCCGn1
    SolutionIndex: 297
    SolutionNameMin: Cijk_Alik_Bljk_BBS_STA_BH_Bias_HAS_SAV_UserArgs_MT32x16x512_MI16x16x1_SN_LDSB1_GRVWB8_GSU1_GSUC0_GSUWGMRR0_K1_LBSPPB1024_MIWT1_1_NTA4_NLCA16_SU0_SUM0_SUS1024_VWB1_WG32_4_1_WGM8_WGMXCC8_WGMXCCGn1
    SolutionIndex: 298
    SolutionNameMin: Cijk_Alik_Bljk_BBS_STA_BH_Bias_HAS_SAV_UserArgs_MT128x32x128_MI16x16x1_SN_LDSB0_GRVWB8_GSU4_GSUC0_GSUWGMRR0_K1_LBSPPB512_MIWT2_2_NTA0_NLCA4_SU0_SUM0_SUS256_VWB2_WG64_4_1_WGM8_WGMXCC8_WGMXCCGn1
    SolutionIndex: 299
    SolutionNameMin: Cijk_Alik_Bljk_BBS_STA_BH_Bias_HAS_SAV_UserArgs_MT128x64x128_MI16x16x1_SN_LDSB1_GRVWB8_GSU6_GSUC0_GSUWGMRR0_K1_LBSPPB1024_MIWT2_4_NTA0_NLCA4_SU0_SUM0_SUS256_VWB4_WG64_4_1_WGM8_WGMXCC8_WGMXCCGn1
    SolutionIndex: 300
    SolutionNameMin: Cijk_Alik_Bljk_BBS_STA_BH_Bias_HAS_SAV_UserArgs_MT128x48x128_MI16x16x1_SN_LDSB0_GRVWB8_GSU5_GSUC0_GSUWGMRR0_K1_LBSPPB256_MIWT2_3_NTA0_NLCA4_SU0_SUM0_SUS256_VWB1_WG64_4_1_WGM8_WGMXCC8_WGMXCCGn1
    SolutionIndex: 301
    SolutionNameMin: Cijk_Alik_Bljk_BBS_STA_BH_Bias_HAS_SAV_UserArgs_MT128x48x128_MI16x16x1_SN_LDSB0_GRVWB8_GSU4_GSUC0_GSUWGMRR0_K1_LBSPPB256_MIWT2_3_NTA4_NLCA4_SU0_SUM0_SUS256_VWB1_WG64_4_1_WGM8_WGMXCC8_WGMXCCGn1
    SolutionIndex: 302
    SolutionNameMin: Cijk_Alik_Bljk_BBS_STA_BH_Bias_HAS_SAV_UserArgs_MT64x16x256_MI16x16x1_SN_LDSB0_GRVWB8_GSU1_GSUC0_GSUWGMRR0_K1_LBSPPB512_MIWT1_1_NTA4_NLCA8_SU0_SUM0_SUS512_VWB1_WG64_4_1_WGM8_WGMXCC8_WGMXCCGn1
    SolutionIndex: 303
    SolutionNameMin: Cijk_Alik_Bljk_BBS_STA_BH_Bias_HAS_SAV_UserArgs_MT128x64x128_MI16x16x1_SN_LDSB1_GRVWB8_GSU3_GSUC0_GSUWGMRR0_K1_LBSPPB1024_MIWT2_4_NTA0_NLCA4_SU0_SUM0_SUS256_VWB4_WG64_4_1_WGM8_WGMXCC8_WGMXCCGn1
    SolutionIndex: 304
    SolutionNameMin: Cijk_Alik_Bljk_BBS_STA_BH_Bias_HAS_SAV_UserArgs_MT128x48x128_MI16x16x1_SN_LDSB0_GRVWB8_GSU2_GSUC0_GSUWGMRR0_K1_LBSPPB256_MIWT2_3_NTA0_NLCA4_SU0_SUM0_SUS256_VWB1_WG64_4_1_WGM8_WGMXCC8_WGMXCCGn1
    SolutionIndex: 305
    SolutionNameMin: Cijk_Alik_Bljk_BBS_STA_BH_Bias_HAS_SAV_UserArgs_MT128x48x128_MI16x16x1_SN_LDSB0_GRVWB8_GSU2_GSUC0_GSUWGMRR0_K1_LBSPPB256_MIWT2_3_NTA4_NLCA4_SU0_SUM0_SUS256_VWB1_WG64_4_1_WGM8_WGMXCC8_WGMXCCGn1
    SolutionIndex: 306
    SolutionNameMin: Cijk_Alik_Bljk_BBS_STA_BH_Bias_HAS_SAV_UserArgs_MT256x48x128_MI16x16x1_SN_LDSB0_GRVWB8_GSU4_GSUC0_GSUWGMRR0_K1_LBSPPB256_MIWT4_3_NTA4_NLCA4_SU0_SUM0_SUS256_VWB1_WG64_4_1_WGM8_WGMXCC8_WGMXCCGn1
    SolutionIndex: 307
    SolutionNameMin: Cijk_Alik_Bljk_BBS_STA_BH_Bias_HAS_SAV_UserArgs_MT32x16x512_MI16x16x1_SN_LDSB1_GRVWB8_GSU1_GSUC0_GSUWGMRR0_K1_LBSPPB1024_MIWT1_1_NTA4_NLCA16_SU0_SUM0_SUS1024_VWB1_WG32_4_1_WGM1_WGMXCC8_WGMXCCGn1
    SolutionIndex: 308
    SolutionNameMin: Cijk_Alik_Bljk_BBS_STA_BH_Bias_HAS_SAV_UserArgs_MT64x32x256_MI16x16x1_SN_LDSB1_GRVWB8_GSU1_GSUC0_GSUWGMRR0_K1_LBSPPB1024_MIWT1_2_NTA4_NLCA8_SU0_SUM0_SUS512_VWB2_WG64_4_1_WGM8_WGMXCC8_WGMXCCGn1
    SolutionIndex: 309
    SolutionNameMin: Cijk_Alik_Bljk_BBS_STA_BH_Bias_HAS_SAV_UserArgs_MT128x64x128_MI16x16x1_SN_LDSB1_GRVWB8_GSU4_GSUC0_GSUWGMRR0_K1_LBSPPB1024_MIWT2_4_NTA0_NLCA4_SU0_SUM0_SUS256_VWB4_WG64_4_1_WGM8_WGMXCC8_WGMXCCGn1
    SolutionIndex: 310
    SolutionNameMin: Cijk_Alik_Bljk_BBS_STA_BH_Bias_HAS_SAV_UserArgs_MT64x32x256_MI16x16x1_SN_LDSB1_GRVWB8_GSU1_GSUC0_GSUWGMRR0_K1_LBSPPB1024_MIWT1_2_NTA0_NLCA8_SU0_SUM0_SUS512_VWB2_WG64_4_1_WGM8_WGMXCC8_WGMXCCGn1
    SolutionIndex: 311
    SolutionNameMin: Cijk_Alik_Bljk_BBS_STA_BH_Bias_HAS_SAV_UserArgs_MT128x48x128_MI16x16x1_SN_LDSB0_GRVWB8_GSU3_GSUC0_GSUWGMRR0_K1_LBSPPB256_MIWT2_3_NTA0_NLCA4_SU0_SUM0_SUS256_VWB1_WG64_4_1_WGM8_WGMXCC8_WGMXCCGn1
    SolutionIndex: 312
    SolutionNameMin: Cijk_Alik_Bljk_BBS_STA_BH_Bias_HAS_SAV_UserArgs_MT128x80x128_MI16x16x1_SN_LDSB1_GRVWB8_GSU4_GSUC0_GSUWGMRR0_K1_LBSPPB256_MIWT2_5_NTA0_NLCA4_SU0_SUM0_SUS256_VWB1_WG64_4_1_WGM8_WGMXCC8_WGMXCCGn1
    SolutionIndex: 313
    SolutionNameMin: Cijk_Alik_Bljk_BBS_STA_BH_Bias_HAS_SAV_UserArgs_MT128x32x256_MI16x16x1_SN_LDSB1_GRVWB8_GSU1_GSUC0_GSUWGMRR0_K1_LBSPPB1024_MIWT2_2_NTA4_NLCA8_SU0_SUM0_SUS512_VWB2_WG64_4_1_WGM8_WGMXCC8_WGMXCCGn1
    SolutionIndex: 314
    SolutionNameMin: Cijk_Alik_Bljk_BBS_STA_BH_Bias_HAS_SAV_UserArgs_MT128x80x128_MI16x16x1_SN_LDSB1_GRVWB8_GSU2_GSUC0_GSUWGMRR0_K1_LBSPPB256_MIWT2_5_NTA0_NLCA4_SU0_SUM0_SUS256_VWB1_WG64_4_1_WGM8_WGMXCC8_WGMXCCGn1
    SolutionIndex: 315
    SolutionNameMin: Cijk_Alik_Bljk_BBS_STA_BH_Bias_HAS_SAV_UserArgs_MT128x48x128_MI16x16x1_SN_LDSB0_GRVWB8_GSU1_GSUC0_GSUWGMRR0_K1_LBSPPB256_MIWT2_3_NTA0_NLCA4_SU8_SUM0_SUS256_VWB1_WG64_4_1_WGM8_WGMXCC8_WGMXCCGn1
    SolutionIndex: 316
    SolutionNameMin: Cijk_Alik_Bljk_BBS_STA_BH_Bias_HAS_SAV_UserArgs_MT128x48x128_MI16x16x1_SN_LDSB0_GRVWB8_GSU1_GSUC0_GSUWGMRR0_K1_LBSPPB256_MIWT2_3_NTA4_NLCA4_SU0_SUM0_SUS256_VWB1_WG64_4_1_WGM8_WGMXCC8_WGMXCCGn1
    SolutionIndex: 317
    SolutionNameMin: Cijk_Alik_Bljk_BBS_STA_BH_Bias_HAS_SAV_UserArgs_MT128x48x128_MI16x16x1_SN_LDSB0_GRVWB8_GSU1_GSUC0_GSUWGMRR0_K1_LBSPPB256_MIWT2_3_NTA0_NLCA4_SU0_SUM0_SUS256_VWB1_WG64_4_1_WGM8_WGMXCC8_WGMXCCGn1
    SolutionIndex: 318
    SolutionNameMin: Cijk_Alik_Bljk_BBS_STA_BH_Bias_HAS_SAV_UserArgs_MT128x16x256_MI16x16x1_SN_LDSB0_GRVWB8_GSU1_GSUC0_GSUWGMRR0_K1_LBSPPB512_MIWT2_1_NTA4_NLCA8_SU8_SUM0_SUS512_VWB1_WG64_4_1_WGM8_WGMXCC8_WGMXCCGn1
    SolutionIndex: 319
    SolutionNameMin: Cijk_Alik_Bljk_BBS_STA_BH_Bias_HAS_SAV_UserArgs_MT64x32x128_MI16x16x1_SN_LDSB0_GRVWB8_GSU1_GSUC0_GSUWGMRR0_K1_LBSPPB512_MIWT1_2_NTA4_NLCA4_SU8_SUM0_SUS256_VWB2_WG64_4_1_WGM1_WGMXCC8_WGMXCCGn1
    SolutionIndex: 320
    SolutionNameMin: Cijk_Alik_Bljk_BBS_STA_BH_Bias_HAS_SAV_UserArgs_MT64x48x128_MI16x16x1_SN_LDSB0_GRVWB8_GSU1_GSUC0_GSUWGMRR0_K1_LBSPPB256_MIWT1_3_NTA4_NLCA4_SU8_SUM0_SUS256_VWB1_WG64_4_1_WGM1_WGMXCC8_WGMXCCGn1
    SolutionIndex: 321
    SolutionNameMin: Cijk_Alik_Bljk_BBS_STA_BH_Bias_HAS_SAV_UserArgs_MT128x80x128_MI16x16x1_SN_LDSB1_GRVWB8_GSU1_GSUC0_GSUWGMRR0_K1_LBSPPB256_MIWT2_5_NTA4_NLCA4_SU0_SUM0_SUS256_VWB1_WG64_4_1_WGM1_WGMXCC8_WGMXCCGn1
    SolutionIndex: 322
    SolutionNameMin: Cijk_Alik_Bljk_BBS_STA_BH_Bias_HAS_SAV_UserArgs_MT128x64x128_MI16x16x1_SN_LDSB1_GRVWB8_GSU1_GSUC0_GSUWGMRR0_K1_LBSPPB1024_MIWT2_4_NTA4_NLCA4_SU0_SUM0_SUS256_VWB4_WG64_4_1_WGM8_WGMXCC8_WGMXCCGn1
    SolutionIndex: 323
    SolutionNameMin: Cijk_Alik_Bljk_BBS_STA_BH_Bias_HAS_SAV_UserArgs_MT192x48x128_MI16x16x1_SN_LDSB0_GRVWB8_GSU1_GSUC0_GSUWGMRR0_K1_LBSPPB256_MIWT3_3_NTA4_NLCA4_SU0_SUM0_SUS256_VWB1_WG64_4_1_WGM8_WGMXCC8_WGMXCCGn1
    SolutionIndex: 324
    SolutionNameMin: Cijk_Alik_Bljk_BBS_STA_BH_Bias_HAS_SAV_UserArgs_MT128x80x128_MI16x16x1_SN_LDSB1_GRVWB8_GSU1_GSUC0_GSUWGMRR0_K1_LBSPPB256_MIWT2_5_NTA4_NLCA4_SU0_SUM0_SUS256_VWB1_WG64_4_1_WGM8_WGMXCC8_WGMXCCGn1
    SolutionIndex: 325
    SolutionNameMin: Cijk_Alik_Bljk_BBS_STA_BH_Bias_HAS_SAV_UserArgs_MT128x96x128_MI16x16x1_SN_LDSB1_GRVWB8_GSU1_GSUC0_GSUWGMRR0_K1_LBSPPB512_MIWT2_6_NTA4_NLCA4_SU0_SUM0_SUS256_VWB2_WG64_4_1_WGM8_WGMXCC8_WGMXCCGn1
    SolutionIndex: 326
    SolutionNameMin: Cijk_Alik_Bljk_BBS_STA_BH_Bias_HAS_SAV_UserArgs_MT128x112x128_MI16x16x1_SN_LDSB1_GRVWB8_GSU1_GSUC0_GSUWGMRR0_K1_LBSPPB256_MIWT2_7_NTA4_NLCA4_SU0_SUM0_SUS256_VWB1_WG64_4_1_WGM8_WGMXCC8_WGMXCCGn1
    SolutionIndex: 327
    SolutionNameMin: Cijk_Alik_Bljk_BBS_STA_BH_Bias_HAS_SAV_UserArgs_MT256x64x128_MI16x16x1_SN_LDSB1_GRVWB8_GSU1_GSUC0_GSUWGMRR0_K1_LBSPPB1024_MIWT4_4_NTA4_NLCA4_SU0_SUM0_SUS256_VWB4_WG64_4_1_WGM8_WGMXCC8_WGMXCCGn1
    SolutionIndex: 328
    SolutionNameMin: Cijk_Alik_Bljk_BBS_STA_BH_Bias_HAS_SAV_UserArgs_MT192x96x64_MI16x16x1_SN_LDSB0_GRVWB8_GSU1_GSUC0_GSUWGMRR0_K1_LBSPPB256_MIWT3_6_NTA4_NLCA2_SU0_SUM0_SUS128_VWB2_WG64_4_1_WGM8_WGMXCC8_WGMXCCGn1
    SolutionIndex: 329
    SolutionNameMin: Cijk_Alik_Bljk_BBS_STA_BH_Bias_HAS_SAV_UserArgs_MT128x160x64_MI16x16x1_SN_LDSB1_GRVWB8_GSU1_GSUC0_GSUWGMRR0_K1_LBSPPB256_MIWT2_10_NTA4_NLCA2_SU0_SUM0_SUS128_VWB2_WG64_4_1_WGM8_WGMXCC8_WGMXCCGn1
    SolutionIndex: 330
    SolutionNameMin: Cijk_Alik_Bljk_BBS_STA_BH_Bias_HAS_SAV_UserArgs_MT192x112x64_MI16x16x1_SN_LDSB1_GRVWB4_GSU1_GSUC0_GSUWGMRR0_K1_LBSPPB128_MIWT3_7_NTA0_NLCA2_SU0_SUM0_SUS128_VWB1_WG64_4_1_WGM8_WGMXCC8_WGMXCCGn1
    SolutionIndex: 331
    SolutionNameMin: Cijk_Alik_Bljk_BBS_STA_BH_Bias_HAS_SAV_UserArgs_MT256x96x64_MI16x16x1_SN_LDSB0_GRVWB8_GSU1_GSUC0_GSUWGMRR0_K1_LBSPPB256_MIWT4_6_NTA4_NLCA2_SU0_SUM0_SUS128_VWB2_WG64_4_1_WGM8_WGMXCC8_WGMXCCGn1
    SolutionIndex: 332
    SolutionNameMin: Cijk_Alik_Bljk_BBS_STA_BH_Bias_HAS_SAV_UserArgs_MT256x96x64_MI16x16x1_SN_LDSB0_GRVWB8_GSU1_GSUC0_GSUWGMRR0_K1_LBSPPB256_MIWT4_6_NTA0_NLCA2_SU0_SUM0_SUS128_VWB2_WG64_4_1_WGM8_WGMXCC8_WGMXCCGn1
    SolutionIndex: 333
    SolutionNameMin: Cijk_Alik_Bljk_BBS_STA_BH_Bias_HAS_SAV_UserArgs_MT128x32x128_MI16x16x1_SN_LDSB0_GRVWB8_GSU1_GSUC0_GSUWGMRR0_K1_LBSPPB512_MIWT2_2_NTA4_NLCA4_SU0_SUM0_SUS256_VWB2_WG64_4_1_WGM8_WGMXCC8_WGMXCCGn1
    SolutionIndex: 334
    SolutionNameMin: Cijk_Alik_Bljk_BBS_STA_BH_Bias_HAS_SAV_UserArgs_MT32x16x512_MI16x16x1_SN_LDSB1_GRVWB8_GSU1_GSUC0_GSUWGMRR0_K1_LBSPPB1024_MIWT1_1_NTA4_NLCA16_SU8_SUM0_SUS1024_VWB1_WG32_4_1_WGM1_WGMXCC8_WGMXCCGn1
    SolutionIndex: 335
    SolutionNameMin: Cijk_Alik_Bljk_BBS_STA_BH_Bias_HAS_SAV_UserArgs_MT64x16x512_MI16x16x1_SN_LDSB1_GRVWB8_GSU1_GSUC0_GSUWGMRR0_K1_LBSPPB1024_MIWT1_1_NTA4_NLCA16_SU0_SUM0_SUS1024_VWB1_WG64_4_1_WGM8_WGMXCC8_WGMXCCGn1
    SolutionIndex: 336
    SolutionNameMin: Cijk_Alik_Bljk_BBS_STA_BH_Bias_HAS_SAV_UserArgs_MT128x16x256_MI16x16x1_SN_LDSB0_GRVWB8_GSU1_GSUC0_GSUWGMRR0_K1_LBSPPB512_MIWT2_1_NTA4_NLCA8_SU0_SUM0_SUS512_VWB1_WG64_4_1_WGM8_WGMXCC8_WGMXCCGn1
    SolutionIndex: 337
    SolutionNameMin: Cijk_Alik_Bljk_BBS_STA_BH_Bias_HAS_SAV_UserArgs_MT64x48x256_MI16x16x1_SN_LDSB1_GRVWB8_GSU1_GSUC0_GSUWGMRR0_K1_LBSPPB512_MIWT1_3_NTA4_NLCA8_SU0_SUM0_SUS512_VWB1_WG64_4_1_WGM8_WGMXCC8_WGMXCCGn1
    SolutionIndex: 338
    SolutionNameMin: Cijk_Alik_Bljk_BBS_STA_BH_Bias_HAS_SAV_UserArgs_MT192x32x128_MI16x16x1_SN_LDSB0_GRVWB8_GSU1_GSUC0_GSUWGMRR0_K1_LBSPPB512_MIWT3_2_NTA0_NLCA4_SU0_SUM0_SUS256_VWB2_WG64_4_1_WGM8_WGMXCC8_WGMXCCGn1
    SolutionIndex: 339
    SolutionNameMin: Cijk_Alik_Bljk_BBS_STA_BH_Bias_HAS_SAV_UserArgs_MT32x16x256_MI16x16x1_SN_LDSB0_GRVWB8_GSU1_GSUC0_GSUWGMRR0_K1_LBSPPB512_MIWT1_1_NTA4_NLCA8_SU8_SUM0_SUS512_VWB1_WG32_4_1_WGM1_WGMXCC8_WGMXCCGn1
    SolutionIndex: 340
    SolutionNameMin: Cijk_Alik_Bljk_BBS_STA_BH_Bias_HAS_SAV_UserArgs_MT128x16x256_MI16x16x1_SN_LDSB0_GRVWB8_GSU1_GSUC0_GSUWGMRR0_K1_LBSPPB512_MIWT2_1_NTA0_NLCA8_SU0_SUM0_SUS512_VWB1_WG64_4_1_WGM8_WGMXCC8_WGMXCCGn1
    SolutionIndex: 341
    SolutionNameMin: Cijk_Alik_Bljk_BBS_STA_BH_Bias_HAS_SAV_UserArgs_MT64x32x256_MI16x16x1_SN_LDSB1_GRVWB8_GSU3_GSUC0_GSUWGMRR0_K1_LBSPPB1024_MIWT1_2_NTA4_NLCA8_SU8_SUM0_SUS512_VWB2_WG64_4_1_WGM1_WGMXCC8_WGMXCCGn1
    SolutionIndex: 342
    SolutionNameMin: Cijk_Alik_Bljk_BBS_STA_BH_Bias_HAS_SAV_UserArgs_MT128x48x128_MI16x16x1_SN_LDSB0_GRVWB8_GSU6_GSUC0_GSUWGMRR0_K1_LBSPPB256_MIWT2_3_NTA4_NLCA4_SU8_SUM0_SUS256_VWB1_WG64_4_1_WGM1_WGMXCC8_WGMXCCGn1
    SolutionIndex: 343
    SolutionNameMin: Cijk_Alik_Bljk_BBS_STA_BH_Bias_HAS_SAV_UserArgs_MT128x64x128_MI16x16x1_SN_LDSB1_GRVWB8_GSU7_GSUC0_GSUWGMRR0_K1_LBSPPB1024_MIWT2_4_NTA0_NLCA4_SU0_SUM0_SUS256_VWB4_WG64_4_1_WGM1_WGMXCC8_WGMXCCGn1
    SolutionIndex: 344
    SolutionNameMin: Cijk_Alik_Bljk_BBS_STA_BH_Bias_HAS_SAV_UserArgs_MT128x80x128_MI16x16x1_SN_LDSB1_GRVWB8_GSU5_GSUC0_GSUWGMRR0_K1_LBSPPB256_MIWT2_5_NTA0_NLCA4_SU8_SUM0_SUS256_VWB1_WG64_4_1_WGM1_WGMXCC8_WGMXCCGn1
    SolutionIndex: 345
    SolutionNameMin: Cijk_Alik_Bljk_BBS_STA_BH_Bias_HAS_SAV_UserArgs_MT128x48x128_MI16x16x1_SN_LDSB0_GRVWB8_GSU3_GSUC0_GSUWGMRR0_K1_LBSPPB256_MIWT2_3_NTA4_NLCA4_SU0_SUM0_SUS256_VWB1_WG64_4_1_WGM8_WGMXCC8_WGMXCCGn1
    SolutionIndex: 346
    SolutionNameMin: Cijk_Alik_Bljk_BBS_STA_BH_Bias_HAS_SAV_UserArgs_MT128x112x128_MI16x16x1_SN_LDSB1_GRVWB8_GSU6_GSUC0_GSUWGMRR0_K1_LBSPPB256_MIWT2_7_NTA0_NLCA4_SU0_SUM0_SUS256_VWB1_WG64_4_1_WGM1_WGMXCC8_WGMXCCGn1
    SolutionIndex: 347
    SolutionNameMin: Cijk_Alik_Bljk_BBS_STA_BH_Bias_HAS_SAV_UserArgs_MT128x64x128_MI16x16x1_SN_LDSB1_GRVWB8_GSU3_GSUC0_GSUWGMRR0_K1_LBSPPB1024_MIWT2_4_NTA4_NLCA4_SU0_SUM0_SUS256_VWB4_WG64_4_1_WGM8_WGMXCC8_WGMXCCGn1
    SolutionIndex: 348
    SolutionNameMin: Cijk_Alik_Bljk_BBS_STA_BH_Bias_HAS_SAV_UserArgs_MT192x48x128_MI16x16x1_SN_LDSB0_GRVWB8_GSU3_GSUC0_GSUWGMRR0_K1_LBSPPB256_MIWT3_3_NTA0_NLCA4_SU0_SUM0_SUS256_VWB1_WG64_4_1_WGM8_WGMXCC8_WGMXCCGn1
    SolutionIndex: 349
    SolutionNameMin: Cijk_Alik_Bljk_BBS_STA_BH_Bias_HAS_SAV_UserArgs_MT128x80x128_MI16x16x1_SN_LDSB1_GRVWB8_GSU3_GSUC0_GSUWGMRR0_K1_LBSPPB256_MIWT2_5_NTA0_NLCA4_SU0_SUM0_SUS256_VWB1_WG64_4_1_WGM8_WGMXCC8_WGMXCCGn1
    SolutionIndex: 350
    SolutionNameMin: Cijk_Alik_Bljk_BBS_STA_BH_Bias_HAS_SAV_UserArgs_MT192x48x128_MI16x16x1_SN_LDSB0_GRVWB8_GSU2_GSUC0_GSUWGMRR0_K1_LBSPPB256_MIWT3_3_NTA0_NLCA4_SU0_SUM0_SUS256_VWB1_WG64_4_1_WGM8_WGMXCC8_WGMXCCGn1
    SolutionIndex: 351
    SolutionNameMin: Cijk_Alik_Bljk_BBS_STA_BH_Bias_HAS_SAV_UserArgs_MT128x96x128_MI16x16x1_SN_LDSB1_GRVWB8_GSU3_GSUC0_GSUWGMRR0_K1_LBSPPB512_MIWT2_6_NTA0_NLCA4_SU0_SUM0_SUS256_VWB2_WG64_4_1_WGM8_WGMXCC8_WGMXCCGn1
    SolutionIndex: 352
    SolutionNameMin: Cijk_Alik_Bljk_BBS_STA_BH_Bias_HAS_SAV_UserArgs_MT128x80x128_MI16x16x1_SN_LDSB1_GRVWB8_GSU2_GSUC0_GSUWGMRR0_K1_LBSPPB256_MIWT2_5_NTA4_NLCA4_SU0_SUM0_SUS256_VWB1_WG64_4_1_WGM8_WGMXCC8_WGMXCCGn1
    SolutionIndex: 353
    SolutionNameMin: Cijk_Alik_Bljk_BBS_STA_BH_Bias_HAS_SAV_UserArgs_MT320x64x64_MI16x16x1_SN_LDSB0_GRVWB8_GSU4_GSUC0_GSUWGMRR0_K1_LBSPPB512_MIWT5_4_NTA4_NLCA2_SU0_SUM0_SUS128_VWB4_WG64_4_1_WGM8_WGMXCC8_WGMXCCGn1
    SolutionIndex: 354
    SolutionNameMin: Cijk_Alik_Bljk_BBS_STA_BH_Bias_HAS_SAV_UserArgs_MT320x80x64_MI16x16x1_SN_LDSB0_GRVWB4_GSU4_GSUC0_GSUWGMRR0_K1_LBSPPB128_MIWT5_5_NTA4_NLCA2_SU0_SUM0_SUS128_VWB1_WG64_4_1_WGM8_WGMXCC8_WGMXCCGn1
    SolutionIndex: 355
    SolutionNameMin: Cijk_Alik_Bljk_BBS_STA_BH_Bias_HAS_SAV_UserArgs_MT128x96x128_MI16x16x1_SN_LDSB1_GRVWB8_GSU2_GSUC0_GSUWGMRR0_K1_LBSPPB512_MIWT2_6_NTA4_NLCA4_SU0_SUM0_SUS256_VWB2_WG64_4_1_WGM8_WGMXCC8_WGMXCCGn1
    SolutionIndex: 356
    SolutionNameMin: Cijk_Alik_Bljk_BBS_STA_BH_Bias_HAS_SAV_UserArgs_MT256x64x64_MI16x16x1_SN_LDSB0_GRVWB8_GSU3_GSUC0_GSUWGMRR0_K1_LBSPPB512_MIWT4_4_NTA0_NLCA2_SU0_SUM0_SUS128_VWB4_WG64_4_1_WGM8_WGMXCC8_WGMXCCGn1
    SolutionIndex: 357
    SolutionNameMin: Cijk_Alik_Bljk_BBS_STA_BH_Bias_HAS_SAV_UserArgs_MT64x32x128_MI16x16x1_SN_LDSB0_GRVWB8_GSU1_GSUC0_GSUWGMRR0_K1_LBSPPB256_MIWT2_1_NLCA4_SU0_SUM0_SUS256_SVW1_VWA1_VWB1_WG32_8_1_WGM6_WGMXCC8_WGMXCCGn1
    SolutionIndex: 358
    SolutionNameMin: Cijk_Alik_Bljk_BBS_STA_BH_Bias_HAS_SAV_UserArgs_MT16x32x128_MI16x16x1_SN_LDSB0_GRVWB8_GSU1_GSUC0_GSUWGMRR0_K1_LBSPPB256_MIWT1_1_NLCA4_SU8_SUM0_SUS256_SVW1_VWA1_VWB1_WG16_8_1_WGM1_WGMXCC8_WGMXCCGn1
    SolutionIndex: 359
    SolutionNameMin: Cijk_Alik_Bljk_BBS_STA_BH_Bias_HAS_SAV_UserArgs_MT64x16x128_MI16x16x1_SN_LDSB0_GRVWB8_GSU1_GSUC0_GSUWGMRR0_K1_LBSPPB256_MIWT1_1_NLCA4_SU0_SUM0_SUS256_SVW1_VWA1_VWB1_WG64_4_1_WGM6_WGMXCC8_WGMXCCGn1
    SolutionIndex: 360
    SolutionNameMin: Cijk_Alik_Bljk_BBS_STA_BH_Bias_HAS_SAV_UserArgs_MT64x32x128_MI16x16x1_SN_LDSB0_GRVWB8_GSU1_GSUC0_GSUWGMRR0_K1_LBSPPB256_MIWT2_1_NLCA4_SU8_SUM0_SUS256_SVW2_VWA2_VWB1_WG32_8_1_WGM1_WGMXCC8_WGMXCCGn1
    SolutionIndex: 361
    SolutionNameMin: Cijk_Alik_Bljk_BBS_STA_BH_Bias_HAS_SAV_UserArgs_MT128x16x128_MI16x16x1_SN_LDSB0_GRVWB8_GSU1_GSUC0_GSUWGMRR0_K1_LBSPPB256_MIWT2_1_NLCA4_SU0_SUM0_SUS256_SVW2_VWA2_VWB1_WG64_4_1_WGM8_WGMXCC8_WGMXCCGn1
    SolutionIndex: 362
    SolutionNameMin: Cijk_Alik_Bljk_BBS_STA_BH_Bias_HAS_SAV_UserArgs_MT64x32x128_MI16x16x1_SN_LDSB0_GRVWB8_GSU1_GSUC0_GSUWGMRR0_K1_LBSPPB256_MIWT2_1_NLCA4_SU0_SUM0_SUS256_SVW2_VWA2_VWB1_WG32_8_1_WGM6_WGMXCC8_WGMXCCGn1
    SolutionIndex: 363
    SolutionNameMin: Cijk_Alik_Bljk_BBS_STA_BH_Bias_HAS_SAV_UserArgs_MT64x64x128_MI16x16x1_SN_LDSB1_GRVWB8_GSU1_GSUC0_GSUWGMRR0_K1_LBSPPB512_MIWT2_2_NLCA4_SU0_SUM0_SUS256_SVW2_VWA2_VWB2_WG32_8_1_WGM1_WGMXCC8_WGMXCCGn1
    SolutionIndex: 364
    SolutionNameMin: Cijk_Alik_Bljk_BBS_STA_BH_Bias_HAS_SAV_UserArgs_MT128x32x128_MI16x16x1_SN_LDSB0_GRVWB8_GSU1_GSUC0_GSUWGMRR0_K1_LBSPPB512_MIWT2_2_NLCA4_SU0_SUM0_SUS256_SVW2_VWA2_VWB2_WG64_4_1_WGM6_WGMXCC8_WGMXCCGn1
    SolutionIndex: 365
    SolutionNameMin: Cijk_Alik_Bljk_BBS_STA_BH_Bias_HAS_SAV_UserArgs_MT192x16x128_MI16x16x1_SN_LDSB0_GRVWB8_GSU1_GSUC0_GSUWGMRR0_K1_LBSPPB256_MIWT3_1_NLCA4_SU0_SUM0_SUS256_SVW1_VWA1_VWB1_WG64_4_1_WGM6_WGMXCC8_WGMXCCGn1
    SolutionIndex: 366
    SolutionNameMin: Cijk_Alik_Bljk_BBS_STA_BH_Bias_HAS_SAV_UserArgs_MT128x32x128_MI16x16x1_SN_LDSB0_GRVWB8_GSU1_GSUC0_GSUWGMRR0_K1_LBSPPB512_MIWT2_2_NLCA4_SU0_SUM0_SUS256_SVW2_VWA2_VWB2_WG64_4_1_WGM8_WGMXCC8_WGMXCCGn1
    SolutionIndex: 367
    SolutionNameMin: Cijk_Alik_Bljk_BBS_STA_BH_Bias_HAS_SAV_UserArgs_MT128x48x128_MI16x16x1_SN_LDSB0_GRVWB8_GSU1_GSUC0_GSUWGMRR0_K1_LBSPPB256_MIWT2_3_NLCA4_SU0_SUM0_SUS256_SVW2_VWA2_VWB1_WG64_4_1_WGM8_WGMXCC8_WGMXCCGn1
    SolutionIndex: 368
    SolutionNameMin: Cijk_Alik_Bljk_BBS_STA_BH_Bias_HAS_SAV_UserArgs_MT128x64x128_MI16x16x1_SN_LDSB1_GRVWB8_GSU1_GSUC0_GSUWGMRR0_K1_LBSPPB1024_MIWT2_4_NLCA4_SU8_SUM0_SUS256_SVW2_VWA2_VWB4_WG64_4_1_WGM8_WGMXCC8_WGMXCCGn1
    SolutionIndex: 369
    SolutionNameMin: Cijk_Alik_Bljk_BBS_STA_BH_Bias_HAS_SAV_UserArgs_MT128x80x128_MI16x16x1_SN_LDSB1_GRVWB8_GSU1_GSUC0_GSUWGMRR0_K1_LBSPPB256_MIWT2_5_NLCA4_SU0_SUM0_SUS256_SVW1_VWA1_VWB1_WG64_4_1_WGM8_WGMXCC8_WGMXCCGn1
    SolutionIndex: 370
    SolutionNameMin: Cijk_Alik_Bljk_BBS_STA_BH_Bias_HAS_SAV_UserArgs_MT128x80x128_MI16x16x1_SN_LDSB1_GRVWB8_GSU1_GSUC0_GSUWGMRR0_K1_LBSPPB256_MIWT2_5_NLCA4_SU8_SUM0_SUS256_SVW2_VWA2_VWB1_WG64_4_1_WGM6_WGMXCC8_WGMXCCGn1
    SolutionIndex: 371
    SolutionNameMin: Cijk_Alik_Bljk_BBS_STA_BH_Bias_HAS_SAV_UserArgs_MT160x64x128_MI16x16x1_SN_LDSB1_GRVWB8_GSU1_GSUC0_GSUWGMRR0_K1_LBSPPB512_MIWT5_2_NLCA4_SU8_SUM0_SUS256_SVW1_VWA1_VWB2_WG32_8_1_WGM8_WGMXCC8_WGMXCCGn1
    SolutionIndex: 372
    SolutionNameMin: Cijk_Alik_Bljk_BBS_STA_BH_Bias_HAS_SAV_UserArgs_MT128x80x64_MI16x16x1_SN_LDSB0_GRVWB4_GSU1_GSUC0_GSUWGMRR0_K1_LBSPPB128_MIWT2_5_NLCA2_SU0_SUM0_SUS128_SVW2_VWA2_VWB1_WG64_4_1_WGM8_WGMXCC8_WGMXCCGn1
    SolutionIndex: 373
    SolutionNameMin: Cijk_Alik_Bljk_BBS_STA_BH_Bias_HAS_SAV_UserArgs_MT128x96x128_MI16x16x1_SN_LDSB1_GRVWB8_GSU1_GSUC0_GSUWGMRR0_K1_LBSPPB512_MIWT2_6_NLCA4_SU8_SUM0_SUS256_SVW2_VWA2_VWB2_WG64_4_1_WGM8_WGMXCC8_WGMXCCGn1
    SolutionIndex: 374
    SolutionNameMin: Cijk_Alik_Bljk_BBS_STA_BH_Bias_HAS_SAV_UserArgs_MT128x96x128_MI16x16x1_SN_LDSB1_GRVWB8_GSU1_GSUC0_GSUWGMRR0_K1_LBSPPB512_MIWT2_6_NLCA4_SU8_SUM0_SUS256_SVW2_VWA2_VWB2_WG64_4_1_WGM6_WGMXCC8_WGMXCCGn1
    SolutionIndex: 375
    SolutionNameMin: Cijk_Alik_Bljk_BBS_STA_BH_Bias_HAS_SAV_UserArgs_MT128x96x128_MI16x16x1_SN_LDSB1_GRVWB8_GSU1_GSUC0_GSUWGMRR0_K1_LBSPPB512_MIWT2_6_NLCA4_SU0_SUM0_SUS256_SVW2_VWA2_VWB2_WG64_4_1_WGM6_WGMXCC8_WGMXCCGn1
    SolutionIndex: 376
    SolutionNameMin: Cijk_Alik_Bljk_BBS_STA_BH_Bias_HAS_SAV_UserArgs_MT128x96x128_MI16x16x1_SN_LDSB1_GRVWB8_GSU1_GSUC0_GSUWGMRR0_K1_LBSPPB256_MIWT4_3_NLCA4_SU8_SUM0_SUS256_SVW4_VWA4_VWB1_WG32_8_1_WGM8_WGMXCC8_WGMXCCGn1
    SolutionIndex: 377
    SolutionNameMin: Cijk_Alik_Bljk_BBS_STA_BH_Bias_HAS_SAV_UserArgs_MT256x48x128_MI16x16x1_SN_LDSB0_GRVWB8_GSU1_GSUC0_GSUWGMRR0_K1_LBSPPB256_MIWT4_3_NLCA4_SU8_SUM0_SUS256_SVW4_VWA4_VWB1_WG64_4_1_WGM8_WGMXCC8_WGMXCCGn1
    SolutionIndex: 378
    SolutionNameMin: Cijk_Alik_Bljk_BBS_STA_BH_Bias_HAS_SAV_UserArgs_MT128x112x128_MI16x16x1_SN_LDSB1_GRVWB8_GSU1_GSUC0_GSUWGMRR0_K1_LBSPPB256_MIWT2_7_NLCA4_SU0_SUM0_SUS256_SVW2_VWA2_VWB1_WG64_4_1_WGM6_WGMXCC8_WGMXCCGn1
    SolutionIndex: 379
    SolutionNameMin: Cijk_Alik_Bljk_BBS_STA_BH_Bias_HAS_SAV_UserArgs_MT256x64x64_MI16x16x1_SN_LDSB0_GRVWB8_GSU1_GSUC0_GSUWGMRR0_K1_LBSPPB512_MIWT4_4_NLCA2_SU8_SUM0_SUS128_SVW4_VWA4_VWB4_WG64_4_1_WGM6_WGMXCC8_WGMXCCGn1
    SolutionIndex: 380
    SolutionNameMin: Cijk_Alik_Bljk_BBS_STA_BH_Bias_HAS_SAV_UserArgs_MT128x64x128_MI16x16x1_SN_LDSB1_GRVWB8_GSU1_GSUC0_GSUWGMRR0_K1_LBSPPB1024_MIWT2_4_NLCA4_SU0_SUM0_SUS256_SVW2_VWA2_VWB4_WG64_4_1_WGM6_WGMXCC8_WGMXCCGn1
    SolutionIndex: 381
    SolutionNameMin: Cijk_Alik_Bljk_BBS_STA_BH_Bias_HAS_SAV_UserArgs_MT128x64x128_MI16x16x1_SN_LDSB1_GRVWB8_GSU1_GSUC0_GSUWGMRR0_K1_LBSPPB1024_MIWT2_4_NLCA4_SU0_SUM0_SUS256_SVW2_VWA2_VWB4_WG64_4_1_WGM8_WGMXCC8_WGMXCCGn1
    SolutionIndex: 382
    SolutionNameMin: Cijk_Alik_Bljk_BBS_STA_BH_Bias_HAS_SAV_UserArgs_MT128x80x128_MI16x16x1_SN_LDSB1_GRVWB8_GSU1_GSUC0_GSUWGMRR0_K1_LBSPPB256_MIWT2_5_NLCA4_SU8_SUM0_SUS256_SVW2_VWA2_VWB1_WG64_4_1_WGM8_WGMXCC8_WGMXCCGn1
    SolutionIndex: 383
    SolutionNameMin: Cijk_Alik_Bljk_BBS_STA_BH_Bias_HAS_SAV_UserArgs_MT256x80x128_MI16x16x1_SN_LDSB1_GRVWB8_GSU1_GSUC0_GSUWGMRR0_K1_LBSPPB256_MIWT4_5_NLCA4_SU8_SUM0_SUS256_SVW4_VWA4_VWB1_WG64_4_1_WGM8_WGMXCC8_WGMXCCGn1
    SolutionIndex: 384
    SolutionNameMin: Cijk_Alik_Bljk_BBS_STA_BH_Bias_HAS_SAV_UserArgs_MT256x96x64_MI16x16x1_SN_LDSB0_GRVWB8_GSU1_GSUC0_GSUWGMRR0_K1_LBSPPB256_MIWT4_6_NLCA2_SU8_SUM0_SUS128_SVW4_VWA4_VWB2_WG64_4_1_WGM6_WGMXCC8_WGMXCCGn1
    SolutionIndex: 385
    SolutionNameMin: Cijk_Alik_Bljk_BBS_STA_BH_Bias_HAS_SAV_UserArgs_MT256x96x64_MI16x16x1_SN_LDSB0_GRVWB8_GSU1_GSUC0_GSUWGMRR0_K1_LBSPPB256_MIWT4_6_NLCA2_SU8_SUM0_SUS128_SVW4_VWA4_VWB2_WG64_4_1_WGM8_WGMXCC8_WGMXCCGn1
    SolutionIndex: 386
    SolutionNameMin: Cijk_Alik_Bljk_BBS_STA_BH_Bias_HAS_SAV_UserArgs_MT128x96x64_MI16x16x1_SN_LDSB0_GRVWB8_GSU1_GSUC0_GSUWGMRR0_K1_LBSPPB256_MIWT2_6_NLCA2_SU0_SUM0_SUS128_SVW2_VWA2_VWB2_WG64_4_1_WGM8_WGMXCC8_WGMXCCGn1
    SolutionIndex: 387
    SolutionNameMin: Cijk_Alik_Bljk_BBS_STA_BH_Bias_HAS_SAV_UserArgs_MT128x96x128_MI16x16x1_SN_LDSB1_GRVWB8_GSU1_GSUC0_GSUWGMRR0_K1_LBSPPB512_MIWT2_6_NLCA4_SU0_SUM0_SUS256_SVW2_VWA2_VWB2_WG64_4_1_WGM8_WGMXCC8_WGMXCCGn1
    SolutionIndex: 388
    SolutionNameMin: Cijk_Alik_Bljk_BBS_STA_BH_Bias_HAS_SAV_UserArgs_MT256x128x64_MI16x16x1_SN_LDSB1_GRVWB8_GSU1_GSUC0_GSUWGMRR0_K1_LBSPPB1024_MIWT4_8_NLCA2_SU8_SUM0_SUS128_SVW4_VWA4_VWB8_WG64_4_1_WGM6_WGMXCC8_WGMXCCGn1
    SolutionIndex: 389
    SolutionNameMin: Cijk_Alik_Bljk_BBS_STA_BH_Bias_HAS_SAV_UserArgs_MT256x112x64_MI16x16x1_SN_LDSB1_GRVWB4_GSU1_GSUC0_GSUWGMRR0_K1_LBSPPB128_MIWT4_7_NLCA2_SU8_SUM0_SUS128_SVW4_VWA4_VWB1_WG64_4_1_WGM8_WGMXCC8_WGMXCCGn1
    SolutionIndex: 390
    SolutionNameMin: Cijk_Alik_Bljk_BBS_STA_BH_Bias_HAS_SAV_UserArgs_MT256x128x64_MI16x16x1_SN_LDSB1_GRVWB8_GSU1_GSUC0_GSUWGMRR0_K1_LBSPPB1024_MIWT4_8_NLCA2_SU8_SUM0_SUS128_SVW4_VWA4_VWB8_WG64_4_1_WGM8_WGMXCC8_WGMXCCGn1
    SolutionIndex: 391
    SolutionNameMin: Cijk_Alik_Bljk_BBS_STA_BH_Bias_HAS_SAV_UserArgs_MT128x128x64_MI16x16x1_SN_LDSB1_GRVWB8_GSU1_GSUC0_GSUWGMRR0_K1_LBSPPB1024_MIWT2_8_NLCA2_SU8_SUM0_SUS128_SVW2_VWA2_VWB8_WG64_4_1_WGM8_WGMXCC8_WGMXCCGn1
    SolutionIndex: 392
    SolutionNameMin: Cijk_Alik_Bljk_BBS_STA_BH_Bias_HAS_SAV_UserArgs_MT256x160x64_MI16x16x1_SN_LDSB0_GRVWB8_GSU1_GSUC0_GSUWGMRR0_K1_LBSPPB256_MIWT4_10_NLCA2_SU8_SUM0_SUS128_SVW4_VWA4_VWB2_WG64_4_1_WGM8_WGMXCC8_WGMXCCGn1
    SolutionIndex: 393
    SolutionNameMin: Cijk_Alik_Bljk_BBS_STA_BH_Bias_HAS_SAV_UserArgs_MT256x160x64_MI16x16x1_SN_LDSB0_GRVWB8_GSU1_GSUC0_GSUWGMRR0_K1_LBSPPB256_MIWT4_10_NLCA2_SU8_SUM0_SUS128_SVW4_VWA4_VWB2_WG64_4_1_WGM6_WGMXCC8_WGMXCCGn1
    SolutionIndex: 394
    SolutionNameMin: Cijk_Alik_Bljk_BBS_STA_BH_Bias_HAS_SAV_UserArgs_MT256x176x64_MI16x16x1_SN_LDSB0_GRVWB4_GSU1_GSUC0_GSUWGMRR0_K1_LBSPPB128_MIWT4_11_NLCA2_SU8_SUM0_SUS128_SVW4_VWA4_VWB1_WG64_4_1_WGM6_WGMXCC8_WGMXCCGn1
    SolutionIndex: 395
    SolutionNameMin: Cijk_Alik_Bljk_BBS_STA_BH_Bias_HAS_SAV_UserArgs_MT256x192x64_MI16x16x1_SN_LDSB0_GRVWB8_GSU1_GSUC0_GSUWGMRR0_K1_LBSPPB512_MIWT4_12_NLCA2_SU8_SUM0_SUS128_SVW4_VWA4_VWB4_WG64_4_1_WGM6_WGMXCC8_WGMXCCGn1
    SolutionIndex: 396
    SolutionNameMin: Cijk_Alik_Bljk_BBS_STA_BH_Bias_HAS_SAV_UserArgs_MT256x96x64_MI16x16x1_SN_LDSB0_GRVWB8_GSU1_GSUC0_GSUWGMRR0_K1_LBSPPB256_MIWT4_6_NLCA2_SU0_SUM0_SUS128_SVW4_VWA4_VWB2_WG64_4_1_WGM8_WGMXCC8_WGMXCCGn1
    SolutionIndex: 397
    SolutionNameMin: Cijk_Alik_Bljk_BBS_STA_BH_Bias_HAS_SAV_UserArgs_MT256x208x64_MI16x16x1_SN_LDSB1_GRVWB4_GSU1_GSUC0_GSUWGMRR0_K1_LBSPPB128_MIWT4_13_NLCA2_SU8_SUM0_SUS128_SVW4_VWA4_VWB1_WG64_4_1_WGM6_WGMXCC8_WGMXCCGn1
    SolutionIndex: 398
    SolutionNameMin: Cijk_Alik_Bljk_BBS_STA_BH_Bias_HAS_SAV_UserArgs_MT256x224x64_MI16x16x1_SN_LDSB0_GRVWB8_GSU1_GSUC0_GSUWGMRR0_K1_LBSPPB256_MIWT4_14_NLCA2_SU0_SUM0_SUS128_SVW4_VWA4_VWB2_WG64_4_1_WGM6_WGMXCC8_WGMXCCGn1
    SolutionIndex: 399
    SolutionNameMin: Cijk_Alik_Bljk_BBS_STA_BH_Bias_HAS_SAV_UserArgs_MT256x224x64_MI16x16x1_SN_LDSB0_GRVWB8_GSU1_GSUC0_GSUWGMRR0_K1_LBSPPB256_MIWT4_14_NLCA2_SU8_SUM0_SUS128_SVW4_VWA4_VWB2_WG64_4_1_WGM6_WGMXCC8_WGMXCCGn1
    SolutionIndex: 400
    SolutionNameMin: Cijk_Alik_Bljk_BBS_STA_BH_Bias_HAS_SAV_UserArgs_MT256x240x64_MI16x16x1_SN_LDSB1_GRVWB4_GSU1_GSUC0_GSUWGMRR0_K1_LBSPPB128_MIWT4_15_NLCA2_SU0_SUM0_SUS128_SVW4_VWA4_VWB1_WG64_4_1_WGM6_WGMXCC8_WGMXCCGn1
    SolutionIndex: 401
    SolutionNameMin: Cijk_Alik_Bljk_BBS_STA_BH_Bias_HAS_SAV_UserArgs_MT256x256x64_MI16x16x1_SN_LDSB1_GRVWB8_GSU1_GSUC0_GSUWGMRR0_K1_LBSPPB1024_MIWT4_16_NLCA2_SU0_SUM0_SUS128_SVW4_VWA4_VWB8_WG64_4_1_WGM8_WGMXCC8_WGMXCCGn1
    SolutionIndex: 402
    SolutionNameMin: Cijk_Alik_Bljk_BBS_STA_BH_Bias_HAS_SAV_UserArgs_MT256x256x64_MI16x16x1_SN_LDSB1_GRVWB8_GSU1_GSUC0_GSUWGMRR0_K1_LBSPPB1024_MIWT4_16_NLCA2_SU8_SUM0_SUS128_SVW4_VWA4_VWB8_WG64_4_1_WGM8_WGMXCC8_WGMXCCGn1
    SolutionIndex: 403
    SolutionNameMin: Cijk_Alik_Bljk_BBS_STA_BH_Bias_HAS_SAV_UserArgs_MT256x160x64_MI16x16x1_SN_LDSB0_GRVWB8_GSU1_GSUC0_GSUWGMRR0_K1_LBSPPB256_MIWT4_10_NLCA2_SU0_SUM0_SUS128_SVW4_VWA4_VWB2_WG64_4_1_WGM6_WGMXCC8_WGMXCCGn1
    SolutionIndex: 404
    SolutionNameMin: Cijk_Alik_Bljk_BBS_STA_BH_Bias_HAS_SAV_UserArgs_MT256x160x64_MI16x16x1_SN_LDSB0_GRVWB8_GSU1_GSUC0_GSUWGMRR0_K1_LBSPPB256_MIWT4_10_NLCA2_SU0_SUM0_SUS128_SVW4_VWA4_VWB2_WG64_4_1_WGM8_WGMXCC8_WGMXCCGn1
    SolutionIndex: 405
    SolutionNameMin: Cijk_Alik_Bljk_BBS_STA_BH_Bias_HAS_SAV_UserArgs_MT320x64x64_MI16x16x1_SN_LDSB0_GRVWB8_GSU1_GSUC0_GSUWGMRR0_K1_LBSPPB512_MIWT5_4_NLCA2_SU0_SUM0_SUS128_SVW1_VWA1_VWB4_WG64_4_1_WGM6_WGMXCC8_WGMXCCGn1
    SolutionIndex: 406
    SolutionNameMin: Cijk_Alik_Bljk_BBS_STA_BH_Bias_HAS_SAV_UserArgs_MT256x176x64_MI16x16x1_SN_LDSB0_GRVWB4_GSU1_GSUC0_GSUWGMRR0_K1_LBSPPB128_MIWT4_11_NLCA2_SU8_SUM0_SUS128_SVW4_VWA4_VWB1_WG64_4_1_WGM8_WGMXCC8_WGMXCCGn1
    SolutionIndex: 407
    SolutionNameMin: Cijk_Alik_Bljk_BBS_STA_BH_Bias_HAS_SAV_UserArgs_MT128x160x64_MI16x16x1_SN_LDSB1_GRVWB8_GSU1_GSUC0_GSUWGMRR0_K1_LBSPPB256_MIWT2_10_NLCA2_SU0_SUM0_SUS128_SVW2_VWA2_VWB2_WG64_4_1_WGM8_WGMXCC8_WGMXCCGn1
    SolutionIndex: 408
    SolutionNameMin: Cijk_Alik_Bljk_BBS_STA_BH_Bias_HAS_SAV_UserArgs_MT256x96x64_MI16x16x1_SN_LDSB0_GRVWB8_GSU1_GSUC0_GSUWGMRR0_K1_LBSPPB256_MIWT4_6_NLCA2_SU8_SUM0_SUS128_SVW1_VWA1_VWB2_WG64_4_1_WGM8_WGMXCC8_WGMXCCGn1
    SolutionIndex: 409
    SolutionNameMin: Cijk_Alik_Bljk_BBS_STA_BH_Bias_HAS_SAV_UserArgs_MT256x256x64_MI16x16x1_SN_LDSB1_GRVWB8_GSU1_GSUC0_GSUWGMRR0_K1_LBSPPB1024_MIWT4_16_NLCA2_SU0_SUM0_SUS128_SVW4_VWA4_VWB8_WG64_4_1_WGM6_WGMXCC8_WGMXCCGn1
    SolutionIndex: 410
    SolutionNameMin: Cijk_Alik_Bljk_BBS_STA_BH_Bias_HAS_SAV_UserArgs_MT256x96x64_MI16x16x1_SN_LDSB0_GRVWB8_GSU1_GSUC0_GSUWGMRR0_K1_LBSPPB256_MIWT4_6_NLCA2_SU0_SUM0_SUS128_SVW1_VWA1_VWB2_WG64_4_1_WGM8_WGMXCC8_WGMXCCGn1
    SolutionIndex: 411
    SolutionNameMin: Cijk_Alik_Bljk_BBS_STA_BH_Bias_HAS_SAV_UserArgs_MT320x80x64_MI16x16x1_SN_LDSB0_GRVWB4_GSU1_GSUC0_GSUWGMRR0_K1_LBSPPB128_MIWT5_5_NLCA2_SU0_SUM0_SUS128_SVW1_VWA1_VWB1_WG64_4_1_WGM8_WGMXCC8_WGMXCCGn1
    SolutionIndex: 412
    SolutionNameMin: Cijk_Alik_Bljk_BBS_STA_BH_Bias_HAS_SAV_UserArgs_MT256x224x64_MI16x16x1_SN_LDSB0_GRVWB8_GSU1_GSUC0_GSUWGMRR0_K1_LBSPPB256_MIWT4_14_NLCA2_SU0_SUM0_SUS128_SVW4_VWA4_VWB2_WG64_4_1_WGM8_WGMXCC8_WGMXCCGn1
    SolutionIndex: 413
    SolutionNameMin: Cijk_Alik_Bljk_BBS_STA_BH_Bias_HAS_SAV_UserArgs_MT256x240x64_MI16x16x1_SN_LDSB1_GRVWB4_GSU1_GSUC0_GSUWGMRR0_K1_LBSPPB128_MIWT4_15_NLCA2_SU0_SUM0_SUS128_SVW4_VWA4_VWB1_WG64_4_1_WGM8_WGMXCC8_WGMXCCGn1
    SolutionIndex: 414
    SolutionNameMin: Cijk_Alik_Bljk_BBS_STA_BH_Bias_HAS_SAV_UserArgs_MT256x96x64_MI16x16x1_SN_LDSB0_GRVWB8_GSU1_GSUC0_GSUWGMRR0_K1_LBSPPB256_MIWT4_6_NLCA2_SU0_SUM0_SUS128_SVW1_VWA1_VWB2_WG64_4_1_WGM6_WGMXCC8_WGMXCCGn1
- - - [2048, 16, 1, 5120]
    - [1, 14.29]
  - - [2048, 32, 1, 5120]
    - [297, 26.54]
  - - [2048, 48, 1, 5120]
    - [297, 36.49]
  - - [2048, 64, 1, 5120]
    - [297, 44.38]
  - - [2048, 80, 1, 5120]
    - [302, 48.28]
  - - [2048, 96, 1, 5120]
    - [288, 55.01]
  - - [2048, 112, 1, 5120]
    - [302, 61.78]
  - - [2048, 128, 1, 5120]
    - [302, 67.39]
  - - [2048, 144, 1, 5120]
    - [292, 70.3]
  - - [2048, 160, 1, 5120]
    - [294, 76.21]
  - - [4096, 16, 1, 5120]
    - [307, 22.26]
  - - [4096, 32, 1, 5120]
    - [297, 38.06]
  - - [4096, 48, 1, 5120]
    - [302, 48.34]
  - - [4096, 64, 1, 5120]
    - [302, 60.23]
  - - [4096, 80, 1, 5120]
    - [292, 65.2]
  - - [4096, 96, 1, 5120]
    - [308, 76.44]
  - - [4096, 112, 1, 5120]
    - [309, 79.4]
  - - [4096, 128, 1, 5120]
    - [310, 91.44]
  - - [4096, 144, 1, 5120]
    - [311, 98.05]
  - - [4096, 160, 1, 5120]
    - [312, 102.09]
  - - [16384, 16, 1, 5120]
    - [318, 32.63]
  - - [16384, 32, 1, 5120]
    - [319, 57.27]
  - - [16384, 48, 1, 5120]
    - [320, 78.99]
  - - [16384, 64, 1, 5120]
    - [313, 99.17]
  - - [16384, 80, 1, 5120]
    - [321, 104.05]
  - - [16384, 96, 1, 5120]
    - [316, 124.01]
  - - [16384, 112, 1, 5120]
    - [322, 127.98]
  - - [16384, 128, 1, 5120]
    - [322, 153.52]
  - - [16384, 144, 1, 5120]
    - [323, 155.27]
  - - [16384, 160, 1, 5120]
    - [324, 168.06]
  - - [5120, 16, 1, 8192]
    - [307, 26.99]
  - - [5120, 32, 1, 8192]
    - [341, 46.31]
  - - [5120, 48, 1, 8192]
    - [342, 61.58]
  - - [5120, 64, 1, 8192]
    - [343, 76.4]
  - - [5120, 80, 1, 8192]
    - [344, 85.53]
  - - [5120, 96, 1, 8192]
    - [345, 95.39]
  - - [5120, 112, 1, 8192]
    - [346, 102.02]
  - - [5120, 128, 1, 8192]
    - [347, 110.87]
  - - [5120, 144, 1, 8192]
    - [348, 117.93]
  - - [5120, 160, 1, 8192]
    - [349, 126.99]
  - - [5120, 176, 1, 8192]
    - [350, 126.31]
  - - [5120, 192, 1, 8192]
    - [351, 136.27]
  - - [5120, 208, 1, 8192]
    - [352, 138.8]
  - - [5120, 224, 1, 8192]
    - [352, 145.61]
  - - [5120, 240, 1, 8192]
    - [352, 156.02]
  - - [5120, 256, 1, 8192]
    - [353, 157.78]
  - - [2048, 176, 1, 5120]
    - [294, 77.95]
  - - [2048, 192, 1, 5120]
    - [2, 85.44]
  - - [2048, 208, 1, 5120]
    - [3, 85.99]
  - - [2048, 224, 1, 5120]
    - [3, 94.13]
  - - [2048, 240, 1, 5120]
    - [3, 95.44]
  - - [2048, 256, 1, 5120]
    - [3, 103.7]
  - - [2048, 272, 1, 5120]
    - [2, 102.03]
  - - [2048, 288, 1, 5120]
    - [2, 109.0]
  - - [2048, 304, 1, 5120]
    - [303, 105.08]
  - - [2048, 320, 1, 5120]
    - [303, 111.39]
  - - [2048, 336, 1, 5120]
    - [304, 109.69]
  - - [2048, 352, 1, 5120]
    - [305, 113.31]
  - - [2048, 368, 1, 5120]
    - [306, 116.96]
  - - [2048, 384, 1, 5120]
    - [303, 122.35]
  - - [2048, 400, 1, 5120]
    - [6, 118.57]
  - - [2048, 416, 1, 5120]
    - [6, 126.11]
  - - [2048, 432, 1, 5120]
    - [6, 126.75]
  - - [2048, 448, 1, 5120]
    - [6, 128.53]
  - - [2048, 464, 1, 5120]
    - [4, 126.8]
  - - [2048, 480, 1, 5120]
    - [5, 132.13]
  - - [2048, 496, 1, 5120]
    - [6, 134.16]
  - - [2048, 512, 1, 5120]
    - [6, 140.03]
  - - [2048, 544, 1, 5120]
    - [4, 140.89]
  - - [2048, 576, 1, 5120]
    - [4, 145.95]
  - - [2048, 608, 1, 5120]
    - [6, 146.97]
  - - [2048, 640, 1, 5120]
    - [7, 148.87]
  - - [2048, 672, 1, 5120]
    - [7, 154.45]
  - - [2048, 704, 1, 5120]
    - [7, 155.12]
  - - [2048, 736, 1, 5120]
    - [8, 157.67]
  - - [2048, 768, 1, 5120]
    - [7, 167.88]
  - - [2048, 800, 1, 5120]
    - [7, 164.44]
  - - [2048, 832, 1, 5120]
    - [9, 171.28]
  - - [2048, 864, 1, 5120]
    - [8, 177.33]
  - - [2048, 896, 1, 5120]
    - [7, 178.3]
  - - [2048, 928, 1, 5120]
    - [9, 175.69]
  - - [2048, 960, 1, 5120]
    - [9, 182.5]
  - - [2048, 992, 1, 5120]
    - [9, 186.56]
  - - [2048, 1024, 1, 5120]
    - [9, 192.72]
  - - [2048, 1088, 1, 5120]
    - [9, 193.56]
  - - [2048, 1152, 1, 5120]
    - [10, 202.76]
  - - [2048, 1216, 1, 5120]
    - [10, 206.77]
  - - [2048, 1280, 1, 5120]
    - [11, 204.01]
  - - [2048, 1344, 1, 5120]
    - [11, 205.35]
  - - [2048, 1408, 1, 5120]
    - [12, 214.86]
  - - [2048, 1472, 1, 5120]
    - [12, 214.02]
  - - [2048, 1536, 1, 5120]
    - [13, 219.16]
  - - [2048, 1600, 1, 5120]
    - [14, 216.16]
  - - [2048, 1664, 1, 5120]
    - [14, 220.24]
  - - [2048, 1728, 1, 5120]
    - [14, 230.08]
  - - [2048, 1792, 1, 5120]
    - [14, 229.78]
  - - [2048, 1856, 1, 5120]
    - [15, 219.27]
  - - [2048, 1920, 1, 5120]
    - [15, 224.81]
  - - [2048, 1984, 1, 5120]
    - [15, 231.85]
  - - [2048, 2048, 1, 5120]
    - [16, 232.68]
  - - [2048, 2176, 1, 5120]
    - [17, 235.89]
  - - [2048, 2304, 1, 5120]
    - [18, 241.16]
  - - [2048, 2432, 1, 5120]
    - [19, 247.76]
  - - [2048, 2560, 1, 5120]
    - [20, 242.38]
  - - [2048, 2688, 1, 5120]
    - [21, 238.14]
  - - [2048, 2816, 1, 5120]
    - [22, 244.02]
  - - [2048, 2944, 1, 5120]
    - [21, 249.23]
  - - [2048, 3072, 1, 5120]
    - [21, 258.38]
  - - [2048, 3200, 1, 5120]
    - [23, 259.52]
  - - [2048, 3328, 1, 5120]
    - [24, 262.49]
  - - [2048, 3456, 1, 5120]
    - [24, 267.65]
  - - [2048, 3584, 1, 5120]
    - [24, 271.66]
  - - [2048, 3712, 1, 5120]
    - [25, 252.84]
  - - [2048, 3840, 1, 5120]
    - [26, 255.89]
  - - [2048, 3968, 1, 5120]
    - [27, 261.84]
  - - [2048, 4096, 1, 5120]
    - [27, 264.14]
  - - [4096, 176, 1, 5120]
    - [313, 104.9]
  - - [4096, 192, 1, 5120]
    - [313, 115.91]
  - - [4096, 208, 1, 5120]
    - [6, 114.99]
  - - [4096, 224, 1, 5120]
    - [313, 124.71]
  - - [4096, 240, 1, 5120]
    - [6, 126.83]
  - - [4096, 256, 1, 5120]
    - [313, 137.83]
  - - [4096, 272, 1, 5120]
    - [4, 130.5]
  - - [4096, 288, 1, 5120]
    - [4, 139.1]
  - - [4096, 304, 1, 5120]
    - [314, 140.02]
  - - [4096, 320, 1, 5120]
    - [314, 146.57]
  - - [4096, 336, 1, 5120]
    - [315, 147.03]
  - - [4096, 352, 1, 5120]
    - [316, 151.56]
  - - [4096, 368, 1, 5120]
    - [316, 155.13]
  - - [4096, 384, 1, 5120]
    - [317, 161.58]
  - - [4096, 400, 1, 5120]
    - [8, 159.12]
  - - [4096, 416, 1, 5120]
    - [8, 164.05]
  - - [4096, 432, 1, 5120]
    - [8, 169.86]
  - - [4096, 448, 1, 5120]
    - [9, 175.6]
  - - [4096, 464, 1, 5120]
    - [9, 168.85]
  - - [4096, 480, 1, 5120]
    - [11, 174.32]
  - - [4096, 496, 1, 5120]
    - [29, 177.21]
  - - [4096, 512, 1, 5120]
    - [9, 190.41]
  - - [4096, 544, 1, 5120]
    - [10, 186.51]
  - - [4096, 576, 1, 5120]
    - [10, 196.33]
  - - [4096, 608, 1, 5120]
    - [30, 190.6]
  - - [4096, 640, 1, 5120]
    - [30, 201.28]
  - - [4096, 672, 1, 5120]
    - [14, 202.21]
  - - [4096, 704, 1, 5120]
    - [12, 201.51]
  - - [4096, 736, 1, 5120]
    - [14, 204.57]
  - - [4096, 768, 1, 5120]
    - [14, 212.42]
  - - [4096, 800, 1, 5120]
    - [13, 208.47]
  - - [4096, 832, 1, 5120]
    - [13, 216.76]
  - - [4096, 864, 1, 5120]
    - [13, 227.01]
  - - [4096, 896, 1, 5120]
    - [31, 218.24]
  - - [4096, 928, 1, 5120]
    - [15, 211.98]
  - - [4096, 960, 1, 5120]
    - [32, 219.46]
  - - [4096, 992, 1, 5120]
    - [15, 221.43]
  - - [4096, 1024, 1, 5120]
    - [16, 229.24]
  - - [4096, 1088, 1, 5120]
    - [16, 230.49]
  - - [4096, 1152, 1, 5120]
    - [17, 239.97]
  - - [4096, 1216, 1, 5120]
    - [17, 241.02]
  - - [4096, 1280, 1, 5120]
    - [22, 234.75]
  - - [4096, 1344, 1, 5120]
    - [21, 238.35]
  - - [4096, 1408, 1, 5120]
    - [33, 243.1]
  - - [4096, 1472, 1, 5120]
    - [33, 247.63]
  - - [4096, 1536, 1, 5120]
    - [21, 259.0]
  - - [4096, 1600, 1, 5120]
    - [21, 254.32]
  - - [4096, 1664, 1, 5120]
    - [23, 260.5]
  - - [4096, 1728, 1, 5120]
    - [23, 266.96]
  - - [4096, 1792, 1, 5120]
    - [23, 267.61]
  - - [4096, 1856, 1, 5120]
    - [34, 255.08]
  - - [4096, 1920, 1, 5120]
    - [34, 260.03]
  - - [4096, 1984, 1, 5120]
    - [35, 259.66]
  - - [4096, 2048, 1, 5120]
    - [27, 264.66]
  - - [4096, 2176, 1, 5120]
    - [36, 269.5]
  - - [4096, 2304, 1, 5120]
    - [37, 275.63]
  - - [4096, 2432, 1, 5120]
    - [27, 280.34]
  - - [4096, 2560, 1, 5120]
    - [38, 281.19]
  - - [4096, 2688, 1, 5120]
    - [39, 280.55]
  - - [4096, 2816, 1, 5120]
    - [40, 284.42]
  - - [4096, 2944, 1, 5120]
    - [38, 285.36]
  - - [4096, 3072, 1, 5120]
    - [41, 280.57]
  - - [4096, 3200, 1, 5120]
    - [42, 279.92]
  - - [4096, 3328, 1, 5120]
    - [43, 282.58]
  - - [4096, 3456, 1, 5120]
    - [42, 291.58]
  - - [4096, 3584, 1, 5120]
    - [41, 292.37]
  - - [4096, 3712, 1, 5120]
    - [44, 286.32]
  - - [4096, 3840, 1, 5120]
    - [44, 292.28]
  - - [4096, 3968, 1, 5120]
    - [45, 294.43]
  - - [4096, 4096, 1, 5120]
    - [45, 295.87]
  - - [16384, 176, 1, 5120]
    - [325, 167.65]
  - - [16384, 192, 1, 5120]
    - [325, 183.59]
  - - [16384, 208, 1, 5120]
    - [326, 176.6]
  - - [16384, 224, 1, 5120]
    - [326, 188.0]
  - - [16384, 240, 1, 5120]
    - [48, 190.29]
  - - [16384, 256, 1, 5120]
    - [327, 206.81]
  - - [16384, 272, 1, 5120]
    - [328, 200.03]
  - - [16384, 288, 1, 5120]
    - [328, 216.22]
  - - [16384, 304, 1, 5120]
    - [329, 205.91]
  - - [16384, 320, 1, 5120]
    - [329, 220.64]
  - - [16384, 336, 1, 5120]
    - [330, 212.58]
  - - [16384, 352, 1, 5120]
    - [331, 216.22]
  - - [16384, 368, 1, 5120]
    - [331, 220.71]
  - - [16384, 384, 1, 5120]
    - [332, 234.42]
  - - [16384, 400, 1, 5120]
    - [50, 222.1]
  - - [16384, 416, 1, 5120]
    - [51, 219.33]
  - - [16384, 432, 1, 5120]
    - [51, 226.88]
  - - [16384, 448, 1, 5120]
    - [51, 236.4]
  - - [16384, 464, 1, 5120]
    - [34, 234.14]
  - - [16384, 480, 1, 5120]
    - [34, 242.04]
  - - [16384, 496, 1, 5120]
    - [52, 234.8]
  - - [16384, 512, 1, 5120]
    - [27, 246.02]
  - - [16384, 544, 1, 5120]
    - [53, 235.61]
  - - [16384, 576, 1, 5120]
    - [54, 249.37]
  - - [16384, 608, 1, 5120]
    - [40, 251.62]
  - - [16384, 640, 1, 5120]
    - [55, 264.29]
  - - [16384, 672, 1, 5120]
    - [56, 257.85]
  - - [16384, 704, 1, 5120]
    - [43, 258.51]
  - - [16384, 736, 1, 5120]
    - [42, 251.37]
  - - [16384, 768, 1, 5120]
    - [41, 272.03]
  - - [16384, 800, 1, 5120]
    - [57, 268.25]
  - - [16384, 832, 1, 5120]
    - [58, 263.86]
  - - [16384, 864, 1, 5120]
    - [59, 265.87]
  - - [16384, 896, 1, 5120]
    - [60, 275.03]
  - - [16384, 928, 1, 5120]
    - [61, 268.63]
  - - [16384, 960, 1, 5120]
    - [62, 273.6]
  - - [16384, 992, 1, 5120]
    - [63, 270.25]
  - - [16384, 1024, 1, 5120]
    - [64, 283.24]
  - - [16384, 1088, 1, 5120]
    - [65, 285.48]
  - - [16384, 1152, 1, 5120]
    - [66, 287.46]
  - - [16384, 1216, 1, 5120]
    - [67, 281.42]
  - - [16384, 1280, 1, 5120]
    - [40, 274.17]
  - - [16384, 1344, 1, 5120]
    - [21, 280.1]
  - - [16384, 1408, 1, 5120]
    - [39, 279.48]
  - - [16384, 1472, 1, 5120]
    - [56, 272.22]
  - - [16384, 1536, 1, 5120]
    - [56, 279.34]
  - - [16384, 1600, 1, 5120]
    - [57, 276.05]
  - - [16384, 1664, 1, 5120]
    - [41, 279.26]
  - - [16384, 1728, 1, 5120]
    - [41, 292.07]
  - - [16384, 1792, 1, 5120]
    - [60, 288.31]
  - - [16384, 1856, 1, 5120]
    - [58, 279.19]
  - - [16384, 1920, 1, 5120]
    - [59, 284.77]
  - - [16384, 1984, 1, 5120]
    - [59, 293.24]
  - - [16384, 2048, 1, 5120]
    - [64, 294.49]
  - - [16384, 2176, 1, 5120]
    - [65, 299.7]
  - - [16384, 2304, 1, 5120]
    - [66, 300.3]
  - - [16384, 2432, 1, 5120]
    - [68, 307.85]
  - - [16384, 2560, 1, 5120]
    - [57, 298.03]
  - - [16384, 2688, 1, 5120]
    - [42, 305.07]
  - - [16384, 2816, 1, 5120]
    - [38, 295.24]
  - - [16384, 2944, 1, 5120]
    - [39, 301.02]
  - - [16384, 3072, 1, 5120]
    - [64, 305.53]
  - - [16384, 3200, 1, 5120]
    - [65, 307.54]
  - - [16384, 3328, 1, 5120]
    - [65, 313.47]
  - - [16384, 3456, 1, 5120]
    - [66, 307.9]
  - - [16384, 3584, 1, 5120]
    - [68, 311.46]
  - - [16384, 3712, 1, 5120]
    - [69, 299.11]
  - - [16384, 3840, 1, 5120]
    - [70, 299.13]
  - - [16384, 3968, 1, 5120]
    - [59, 305.59]
  - - [16384, 4096, 1, 5120]
    - [59, 308.84]
  - - [5120, 272, 1, 8192]
    - [354, 155.51]
  - - [5120, 288, 1, 8192]
    - [355, 167.87]
  - - [5120, 304, 1, 8192]
    - [7, 157.7]
  - - [5120, 320, 1, 8192]
    - [356, 173.02]
  - - [5120, 336, 1, 8192]
    - [28, 170.28]
  - - [5120, 352, 1, 8192]
    - [10, 169.97]
  - - [5120, 368, 1, 8192]
    - [322, 178.12]
  - - [5120, 384, 1, 8192]
    - [322, 187.5]
  - - [5120, 400, 1, 8192]
    - [11, 185.12]
  - - [5120, 416, 1, 8192]
    - [9, 182.75]
  - - [5120, 432, 1, 8192]
    - [9, 189.83]
  - - [5120, 448, 1, 8192]
    - [9, 197.01]
  - - [5120, 464, 1, 8192]
    - [12, 196.01]
  - - [5120, 480, 1, 8192]
    - [12, 202.71]
  - - [5120, 496, 1, 8192]
    - [71, 195.25]
  - - [5120, 512, 1, 8192]
    - [11, 201.38]
  - - [5120, 544, 1, 8192]
    - [30, 208.38]
  - - [5120, 576, 1, 8192]
    - [13, 207.92]
  - - [5120, 608, 1, 8192]
    - [14, 208.03]
  - - [5120, 640, 1, 8192]
    - [14, 215.8]
  - - [5120, 672, 1, 8192]
    - [14, 222.15]
  - - [5120, 704, 1, 8192]
    - [72, 219.94]
  - - [5120, 736, 1, 8192]
    - [31, 217.7]
  - - [5120, 768, 1, 8192]
    - [31, 225.13]
  - - [5120, 800, 1, 8192]
    - [32, 222.73]
  - - [5120, 832, 1, 8192]
    - [16, 226.65]
  - - [5120, 864, 1, 8192]
    - [32, 229.08]
  - - [5120, 896, 1, 8192]
    - [73, 235.73]
  - - [5120, 928, 1, 8192]
    - [16, 230.16]
  - - [5120, 960, 1, 8192]
    - [16, 236.9]
  - - [5120, 992, 1, 8192]
    - [74, 234.28]
  - - [5120, 1024, 1, 8192]
    - [20, 238.95]
  - - [5120, 1088, 1, 8192]
    - [75, 238.79]
  - - [5120, 1152, 1, 8192]
    - [23, 244.63]
  - - [5120, 1216, 1, 8192]
    - [33, 250.39]
  - - [5120, 1280, 1, 8192]
    - [76, 251.82]
  - - [5120, 1344, 1, 8192]
    - [70, 258.88]
  - - [5120, 1408, 1, 8192]
    - [77, 261.79]
  - - [5120, 1472, 1, 8192]
    - [78, 256.31]
  - - [5120, 1536, 1, 8192]
    - [27, 260.22]
  - - [5120, 1600, 1, 8192]
    - [79, 259.73]
  - - [5120, 1664, 1, 8192]
    - [79, 267.34]
  - - [5120, 1728, 1, 8192]
    - [36, 268.37]
  - - [5120, 1792, 1, 8192]
    - [27, 271.82]
  - - [5120, 1856, 1, 8192]
    - [27, 268.51]
  - - [5120, 1920, 1, 8192]
    - [27, 278.97]
  - - [5120, 1984, 1, 8192]
    - [80, 271.38]
  - - [5120, 2048, 1, 8192]
    - [81, 276.84]
  - - [5120, 2176, 1, 8192]
    - [81, 278.35]
  - - [5120, 2304, 1, 8192]
    - [69, 283.81]
  - - [5120, 2432, 1, 8192]
    - [82, 288.38]
  - - [5120, 2560, 1, 8192]
    - [83, 284.23]
  - - [5120, 2688, 1, 8192]
    - [84, 285.83]
  - - [5120, 2816, 1, 8192]
    - [85, 285.03]
  - - [5120, 2944, 1, 8192]
    - [86, 286.76]
  - - [5120, 3072, 1, 8192]
    - [87, 287.73]
  - - [5120, 3200, 1, 8192]
    - [88, 289.23]
  - - [5120, 3328, 1, 8192]
    - [89, 295.18]
  - - [5120, 3456, 1, 8192]
    - [66, 296.82]
  - - [5120, 3584, 1, 8192]
    - [90, 297.14]
  - - [5120, 3712, 1, 8192]
    - [91, 301.27]
  - - [5120, 3840, 1, 8192]
    - [92, 304.14]
  - - [5120, 3968, 1, 8192]
    - [80, 283.2]
  - - [5120, 4096, 1, 8192]
    - [80, 288.1]
  - - [5120, 16, 1, 2048]
    - [339, 18.2]
  - - [5120, 32, 1, 2048]
    - [302, 30.96]
  - - [5120, 48, 1, 2048]
    - [302, 42.08]
  - - [5120, 64, 1, 2048]
    - [308, 50.18]
  - - [5120, 80, 1, 2048]
    - [336, 56.93]
  - - [5120, 96, 1, 2048]
    - [308, 68.05]
  - - [5120, 112, 1, 2048]
    - [340, 70.27]
  - - [5120, 128, 1, 2048]
    - [313, 79.59]
  - - [5120, 144, 1, 2048]
    - [337, 85.47]
  - - [5120, 160, 1, 2048]
    - [313, 91.04]
  - - [5120, 176, 1, 2048]
    - [313, 92.22]
  - - [5120, 192, 1, 2048]
    - [313, 102.55]
  - - [5120, 208, 1, 2048]
    - [313, 102.9]
  - - [5120, 224, 1, 2048]
    - [313, 112.71]
  - - [5120, 240, 1, 2048]
    - [316, 114.03]
  - - [5120, 256, 1, 2048]
    - [322, 116.82]
  - - [5120, 272, 1, 2048]
    - [316, 117.44]
  - - [5120, 288, 1, 2048]
    - [316, 127.68]
  - - [5120, 304, 1, 2048]
    - [316, 125.51]
  - - [5120, 320, 1, 2048]
    - [322, 132.95]
  - - [5120, 336, 1, 2048]
    - [316, 138.84]
  - - [5120, 352, 1, 2048]
    - [322, 130.2]
  - - [5120, 368, 1, 2048]
    - [322, 133.8]
  - - [5120, 384, 1, 2048]
    - [322, 146.36]
  - - [5120, 400, 1, 2048]
    - [11, 145.64]
  - - [5120, 416, 1, 2048]
    - [9, 146.78]
  - - [5120, 432, 1, 2048]
    - [9, 151.58]
  - - [5120, 448, 1, 2048]
    - [9, 161.89]
  - - [5120, 464, 1, 2048]
    - [12, 153.97]
  - - [5120, 480, 1, 2048]
    - [12, 164.03]
  - - [5120, 496, 1, 2048]
    - [11, 154.59]
  - - [5120, 512, 1, 2048]
    - [11, 158.87]
  - - [5120, 544, 1, 2048]
    - [11, 165.32]
  - - [5120, 576, 1, 2048]
    - [13, 172.07]
  - - [5120, 608, 1, 2048]
    - [46, 165.36]
  - - [5120, 640, 1, 2048]
    - [14, 171.22]
  - - [5120, 672, 1, 2048]
    - [14, 181.79]
  - - [5120, 704, 1, 2048]
    - [72, 179.86]
  - - [5120, 736, 1, 2048]
    - [31, 177.18]
  - - [5120, 768, 1, 2048]
    - [93, 182.51]
  - - [5120, 800, 1, 2048]
    - [48, 181.06]
  - - [5120, 832, 1, 2048]
    - [16, 190.82]
  - - [5120, 864, 1, 2048]
    - [94, 188.24]
  - - [5120, 896, 1, 2048]
    - [95, 195.42]
  - - [5120, 928, 1, 2048]
    - [16, 189.68]
  - - [5120, 960, 1, 2048]
    - [95, 199.31]
  - - [5120, 992, 1, 2048]
    - [49, 190.69]
  - - [5120, 1024, 1, 2048]
    - [33, 199.31]
  - - [5120, 1088, 1, 2048]
    - [33, 199.61]
  - - [5120, 1152, 1, 2048]
    - [33, 206.28]
  - - [5120, 1216, 1, 2048]
    - [33, 211.87]
  - - [5120, 1280, 1, 2048]
    - [50, 208.82]
  - - [5120, 1344, 1, 2048]
    - [21, 221.93]
  - - [5120, 1408, 1, 2048]
    - [96, 217.63]
  - - [5120, 1472, 1, 2048]
    - [78, 219.42]
  - - [5120, 1536, 1, 2048]
    - [34, 219.5]
  - - [5120, 1600, 1, 2048]
    - [97, 219.04]
  - - [5120, 1664, 1, 2048]
    - [27, 226.71]
  - - [5120, 1728, 1, 2048]
    - [36, 233.8]
  - - [5120, 1792, 1, 2048]
    - [27, 233.59]
  - - [5120, 1856, 1, 2048]
    - [98, 230.04]
  - - [5120, 1920, 1, 2048]
    - [27, 240.15]
  - - [5120, 1984, 1, 2048]
    - [80, 232.64]
  - - [5120, 2048, 1, 2048]
    - [82, 235.77]
  - - [5120, 2176, 1, 2048]
    - [82, 240.66]
  - - [5120, 2304, 1, 2048]
    - [82, 247.71]
  - - [5120, 2432, 1, 2048]
    - [69, 251.93]
  - - [5120, 2560, 1, 2048]
    - [57, 243.02]
  - - [5120, 2688, 1, 2048]
    - [42, 251.07]
  - - [5120, 2816, 1, 2048]
    - [89, 246.11]
  - - [5120, 2944, 1, 2048]
    - [86, 248.75]
  - - [5120, 3072, 1, 2048]
    - [99, 250.42]
  - - [5120, 3200, 1, 2048]
    - [66, 245.83]
  - - [5120, 3328, 1, 2048]
    - [89, 255.94]
  - - [5120, 3456, 1, 2048]
    - [90, 263.47]
  - - [5120, 3584, 1, 2048]
    - [66, 257.11]
  - - [5120, 3712, 1, 2048]
    - [68, 261.59]
  - - [5120, 3840, 1, 2048]
    - [100, 264.81]
  - - [5120, 3968, 1, 2048]
    - [23, 251.65]
  - - [5120, 4096, 1, 2048]
    - [101, 255.37]
  - - [896, 16, 1, 5120]
    - [102, 7.35]
  - - [896, 32, 1, 5120]
    - [103, 13.78]
  - - [896, 48, 1, 5120]
    - [104, 19.07]
  - - [896, 64, 1, 5120]
    - [105, 24.81]
  - - [896, 80, 1, 5120]
    - [106, 29.58]
  - - [896, 96, 1, 5120]
    - [284, 36.95]
  - - [896, 112, 1, 5120]
    - [284, 41.13]
  - - [896, 128, 1, 5120]
    - [284, 45.27]
  - - [896, 144, 1, 5120]
    - [285, 45.91]
  - - [896, 160, 1, 5120]
    - [285, 49.59]
  - - [1024, 16, 1, 5120]
    - [102, 8.35]
  - - [1024, 32, 1, 5120]
    - [103, 15.87]
  - - [1024, 48, 1, 5120]
    - [106, 21.61]
  - - [1024, 64, 1, 5120]
    - [106, 27.27]
  - - [1024, 80, 1, 5120]
    - [284, 34.58]
  - - [1024, 96, 1, 5120]
    - [297, 40.43]
  - - [1024, 112, 1, 5120]
    - [297, 44.54]
  - - [1024, 128, 1, 5120]
    - [297, 49.18]
  - - [1024, 144, 1, 5120]
    - [285, 48.31]
  - - [1024, 160, 1, 5120]
    - [286, 50.89]
  - - [1024, 176, 1, 5120]
    - [288, 53.66]
  - - [1024, 192, 1, 5120]
    - [289, 57.64]
  - - [1024, 208, 1, 5120]
    - [290, 60.34]
  - - [1024, 224, 1, 5120]
    - [290, 63.57]
  - - [1024, 240, 1, 5120]
    - [290, 66.46]
  - - [1024, 256, 1, 5120]
    - [298, 70.06]
  - - [1024, 272, 1, 5120]
    - [292, 71.35]
  - - [1024, 288, 1, 5120]
    - [292, 74.79]
  - - [1024, 304, 1, 5120]
    - [295, 75.43]
  - - [1024, 320, 1, 5120]
    - [299, 80.1]
  - - [1024, 336, 1, 5120]
    - [300, 80.78]
  - - [1024, 352, 1, 5120]
    - [301, 84.34]
  - - [1024, 368, 1, 5120]
    - [301, 87.41]
  - - [1024, 384, 1, 5120]
    - [301, 90.83]
  - - [1024, 400, 1, 5120]
    - [0, 81.31]
  - - [1024, 416, 1, 5120]
    - [0, 85.25]
  - - [1024, 432, 1, 5120]
    - [0, 86.06]
  - - [1024, 448, 1, 5120]
    - [0, 89.97]
  - - [1024, 464, 1, 5120]
    - [0, 90.81]
  - - [1024, 480, 1, 5120]
    - [0, 93.94]
  - - [1024, 496, 1, 5120]
    - [0, 94.34]
  - - [1024, 512, 1, 5120]
    - [0, 97.86]
  - - [1024, 544, 1, 5120]
    - [0, 102.13]
  - - [1024, 576, 1, 5120]
    - [0, 105.68]
  - - [1024, 608, 1, 5120]
    - [0, 109.51]
  - - [1024, 640, 1, 5120]
    - [107, 104.53]
  - - [1024, 672, 1, 5120]
    - [107, 107.08]
  - - [1024, 704, 1, 5120]
    - [107, 112.03]
  - - [1024, 736, 1, 5120]
    - [107, 116.4]
  - - [1024, 768, 1, 5120]
    - [107, 119.26]
  - - [1024, 800, 1, 5120]
    - [107, 121.61]
  - - [1024, 832, 1, 5120]
    - [107, 125.02]
  - - [1024, 864, 1, 5120]
    - [107, 128.96]
  - - [1024, 896, 1, 5120]
    - [107, 131.72]
  - - [1024, 928, 1, 5120]
    - [107, 131.8]
  - - [1024, 960, 1, 5120]
    - [107, 136.0]
  - - [1024, 992, 1, 5120]
    - [107, 138.0]
  - - [1024, 1024, 1, 5120]
    - [107, 140.17]
  - - [5120, 16, 1, 1024]
    - [334, 12.98]
  - - [5120, 32, 1, 1024]
    - [335, 23.98]
  - - [5120, 48, 1, 1024]
    - [302, 33.09]
  - - [5120, 64, 1, 1024]
    - [308, 40.44]
  - - [5120, 80, 1, 1024]
    - [336, 46.07]
  - - [5120, 96, 1, 1024]
    - [337, 53.51]
  - - [5120, 112, 1, 1024]
    - [336, 57.46]
  - - [5120, 128, 1, 1024]
    - [313, 62.91]
  - - [5120, 144, 1, 1024]
    - [337, 68.21]
  - - [5120, 160, 1, 1024]
    - [313, 72.62]
  - - [896, 176, 1, 5120]
    - [286, 49.76]
  - - [896, 192, 1, 5120]
    - [287, 53.04]
  - - [896, 208, 1, 5120]
    - [288, 55.56]
  - - [896, 224, 1, 5120]
    - [289, 58.68]
  - - [896, 240, 1, 5120]
    - [290, 60.95]
  - - [896, 256, 1, 5120]
    - [291, 64.92]
  - - [896, 272, 1, 5120]
    - [291, 65.81]
  - - [896, 288, 1, 5120]
    - [292, 69.07]
  - - [896, 304, 1, 5120]
    - [293, 70.35]
  - - [896, 320, 1, 5120]
    - [293, 73.38]
  - - [896, 336, 1, 5120]
    - [292, 75.22]
  - - [896, 352, 1, 5120]
    - [294, 75.91]
  - - [896, 368, 1, 5120]
    - [295, 77.68]
  - - [896, 384, 1, 5120]
    - [296, 81.56]
  - - [896, 400, 1, 5120]
    - [108, 80.43]
  - - [896, 416, 1, 5120]
    - [3, 83.81]
  - - [896, 432, 1, 5120]
    - [109, 84.05]
  - - [896, 448, 1, 5120]
    - [3, 87.46]
  - - [896, 464, 1, 5120]
    - [3, 87.41]
  - - [896, 480, 1, 5120]
    - [109, 91.59]
  - - [896, 496, 1, 5120]
    - [3, 92.15]
  - - [896, 512, 1, 5120]
    - [3, 96.31]
  - - [896, 544, 1, 5120]
    - [2, 97.78]
  - - [896, 576, 1, 5120]
    - [2, 101.28]
  - - [896, 608, 1, 5120]
    - [3, 105.96]
  - - [896, 640, 1, 5120]
    - [3, 108.25]
  - - [896, 672, 1, 5120]
    - [2, 111.59]
  - - [896, 704, 1, 5120]
    - [3, 102.7]
  - - [896, 736, 1, 5120]
    - [5, 104.98]
  - - [896, 768, 1, 5120]
    - [4, 108.33]
  - - [896, 800, 1, 5120]
    - [4, 111.46]
  - - [896, 832, 1, 5120]
    - [6, 113.41]
  - - [896, 864, 1, 5120]
    - [6, 116.68]
  - - [896, 896, 1, 5120]
    - [6, 120.7]
  - - [896, 928, 1, 5120]
    - [110, 122.43]
  - - [896, 960, 1, 5120]
    - [4, 125.0]
  - - [896, 992, 1, 5120]
    - [110, 126.56]
  - - [896, 1024, 1, 5120]
    - [6, 131.28]
  - - [896, 1088, 1, 5120]
    - [110, 135.01]
  - - [896, 1152, 1, 5120]
    - [6, 133.59]
  - - [896, 1216, 1, 5120]
    - [110, 138.71]
  - - [896, 1280, 1, 5120]
    - [6, 143.17]
  - - [896, 1344, 1, 5120]
    - [110, 145.36]
  - - [896, 1408, 1, 5120]
    - [7, 143.48]
  - - [896, 1472, 1, 5120]
    - [111, 147.1]
  - - [896, 1536, 1, 5120]
    - [28, 153.67]
  - - [896, 1600, 1, 5120]
    - [112, 153.27]
  - - [896, 1664, 1, 5120]
    - [113, 155.23]
  - - [896, 1728, 1, 5120]
    - [111, 159.87]
  - - [896, 1792, 1, 5120]
    - [10, 162.35]
  - - [896, 1856, 1, 5120]
    - [114, 167.22]
  - - [896, 1920, 1, 5120]
    - [111, 172.31]
  - - [896, 1984, 1, 5120]
    - [9, 172.48]
  - - [896, 2048, 1, 5120]
    - [10, 175.15]
  - - [896, 2176, 1, 5120]
    - [112, 178.76]
  - - [896, 2304, 1, 5120]
    - [114, 183.94]
  - - [896, 2432, 1, 5120]
    - [114, 191.21]
  - - [896, 2560, 1, 5120]
    - [114, 197.41]
  - - [896, 2688, 1, 5120]
    - [9, 197.75]
  - - [896, 2816, 1, 5120]
    - [115, 190.75]
  - - [896, 2944, 1, 5120]
    - [116, 198.46]
  - - [896, 3072, 1, 5120]
    - [117, 205.74]
  - - [896, 3200, 1, 5120]
    - [11, 206.81]
  - - [896, 3328, 1, 5120]
    - [116, 210.93]
  - - [896, 3456, 1, 5120]
    - [13, 207.06]
  - - [896, 3584, 1, 5120]
    - [117, 213.95]
  - - [896, 3712, 1, 5120]
    - [117, 216.51]
  - - [896, 3840, 1, 5120]
    - [117, 224.21]
  - - [896, 3968, 1, 5120]
    - [13, 223.55]
  - - [896, 4096, 1, 5120]
    - [117, 228.13]
  - - [896, 4352, 1, 5120]
    - [129, 223.15]
  - - [896, 4608, 1, 5120]
    - [129, 226.28]
  - - [896, 4864, 1, 5120]
    - [130, 222.63]
  - - [896, 5120, 1, 5120]
    - [131, 230.95]
  - - [896, 5376, 1, 5120]
    - [130, 230.76]
  - - [896, 5632, 1, 5120]
    - [132, 224.32]
  - - [896, 5888, 1, 5120]
    - [133, 220.23]
  - - [896, 6144, 1, 5120]
    - [134, 226.75]
  - - [896, 6400, 1, 5120]
    - [135, 229.73]
  - - [896, 6656, 1, 5120]
    - [136, 224.18]
  - - [896, 6912, 1, 5120]
    - [137, 227.11]
  - - [896, 7168, 1, 5120]
    - [137, 229.96]
  - - [896, 7424, 1, 5120]
    - [138, 231.17]
  - - [896, 7680, 1, 5120]
    - [139, 235.36]
  - - [896, 7936, 1, 5120]
    - [138, 236.88]
  - - [896, 8192, 1, 5120]
    - [138, 241.97]
  - - [896, 8448, 1, 5120]
    - [140, 243.83]
  - - [896, 8704, 1, 5120]
    - [141, 246.47]
  - - [896, 8960, 1, 5120]
    - [142, 250.93]
  - - [896, 9216, 1, 5120]
    - [143, 253.23]
  - - [896, 9728, 1, 5120]
    - [142, 258.65]
  - - [896, 9984, 1, 5120]
    - [144, 231.37]
  - - [5120, 16, 1, 640]
    - [357, 6.61]
  - - [5120, 32, 1, 640]
    - [358, 12.56]
  - - [5120, 48, 1, 640]
    - [359, 19.11]
  - - [5120, 64, 1, 640]
    - [360, 24.69]
  - - [5120, 80, 1, 640]
    - [361, 29.59]
  - - [5120, 96, 1, 640]
    - [362, 34.98]
  - - [5120, 112, 1, 640]
    - [363, 33.58]
  - - [5120, 128, 1, 640]
    - [364, 38.87]
  - - [5120, 144, 1, 640]
    - [365, 41.39]
  - - [5120, 160, 1, 640]
    - [366, 49.2]
  - - [5120, 176, 1, 640]
    - [366, 50.5]
  - - [5120, 192, 1, 640]
    - [364, 56.6]
  - - [5120, 208, 1, 640]
    - [366, 57.77]
  - - [5120, 224, 1, 640]
    - [333, 72.71]
  - - [5120, 240, 1, 640]
    - [316, 75.04]
  - - [5120, 256, 1, 640]
    - [322, 74.62]
  - - [5120, 272, 1, 640]
    - [316, 76.36]
  - - [5120, 288, 1, 640]
    - [316, 85.34]
  - - [5120, 304, 1, 640]
    - [316, 82.4]
  - - [5120, 320, 1, 640]
    - [322, 85.9]
  - - [5120, 336, 1, 640]
    - [367, 81.91]
  - - [5120, 352, 1, 640]
    - [119, 91.98]
  - - [5120, 368, 1, 640]
    - [366, 78.21]
  - - [5120, 384, 1, 640]
    - [368, 86.74]
  - - [5120, 400, 1, 640]
    - [369, 90.88]
  - - [5120, 416, 1, 640]
    - [119, 102.33]
  - - [5120, 432, 1, 640]
    - [368, 90.33]
  - - [5120, 448, 1, 640]
    - [9, 111.33]
  - - [5120, 464, 1, 640]
    - [119, 103.1]
  - - [5120, 480, 1, 640]
    - [12, 111.71]
  - - [5120, 496, 1, 640]
    - [370, 90.81]
  - - [5120, 512, 1, 640]
    - [371, 97.26]
  - - [5120, 544, 1, 640]
    - [372, 100.64]
  - - [5120, 576, 1, 640]
    - [373, 106.37]
  - - [5120, 608, 1, 640]
    - [374, 104.92]
  - - [5120, 640, 1, 640]
    - [375, 108.84]
  - - [5120, 672, 1, 640]
    - [376, 117.06]
  - - [5120, 704, 1, 640]
    - [377, 111.8]
  - - [5120, 736, 1, 640]
    - [378, 112.83]
  - - [5120, 768, 1, 640]
    - [379, 116.85]
  - - [5120, 800, 1, 640]
    - [380, 115.48]
  - - [5120, 832, 1, 640]
    - [368, 121.75]
  - - [5120, 864, 1, 640]
    - [381, 120.45]
  - - [5120, 896, 1, 640]
    - [368, 126.85]
  - - [5120, 928, 1, 640]
    - [368, 126.15]
  - - [5120, 960, 1, 640]
    - [368, 132.22]
  - - [5120, 992, 1, 640]
    - [382, 126.26]
  - - [5120, 1024, 1, 640]
    - [370, 129.93]
  - - [5120, 1088, 1, 640]
    - [383, 135.39]
  - - [5120, 1152, 1, 640]
    - [384, 139.05]
  - - [5120, 1216, 1, 640]
    - [384, 140.99]
  - - [5120, 1280, 1, 640]
    - [385, 143.15]
  - - [5120, 1344, 1, 640]
    - [386, 158.83]
  - - [5120, 1408, 1, 640]
    - [387, 156.42]
  - - [5120, 1472, 1, 640]
    - [388, 148.02]
  - - [5120, 1536, 1, 640]
    - [388, 154.05]
  - - [5120, 1600, 1, 640]
    - [389, 155.09]
  - - [5120, 1664, 1, 640]
    - [390, 160.7]
  - - [5120, 1728, 1, 640]
    - [388, 161.33]
  - - [5120, 1792, 1, 640]
    - [390, 168.22]
  - - [5120, 1856, 1, 640]
    - [388, 169.26]
  - - [5120, 1920, 1, 640]
    - [391, 177.33]
  - - [5120, 1984, 1, 640]
    - [392, 165.42]
  - - [5120, 2048, 1, 640]
    - [393, 168.83]
  - - [5120, 2176, 1, 640]
    - [392, 175.05]
  - - [5120, 2304, 1, 640]
    - [393, 178.2]
  - - [5120, 2432, 1, 640]
    - [394, 176.05]
  - - [5120, 2560, 1, 640]
    - [394, 179.98]
  - - [5120, 2688, 1, 640]
    - [395, 186.23]
  - - [5120, 2816, 1, 640]
    - [396, 187.01]
  - - [5120, 2944, 1, 640]
    - [397, 182.62]
  - - [5120, 3072, 1, 640]
    - [397, 187.45]
  - - [5120, 3200, 1, 640]
    - [398, 187.99]
  - - [5120, 3328, 1, 640]
    - [399, 191.6]
  - - [5120, 3456, 1, 640]
    - [400, 188.77]
  - - [5120, 3584, 1, 640]
    - [401, 200.27]
  - - [5120, 3712, 1, 640]
    - [402, 195.06]
  - - [5120, 3840, 1, 640]
    - [402, 206.23]
  - - [5120, 3968, 1, 640]
    - [396, 187.35]
  - - [5120, 4096, 1, 640]
    - [396, 191.69]
  - - [5120, 4352, 1, 640]
    - [403, 186.25]
  - - [5120, 4608, 1, 640]
    - [404, 195.06]
  - - [5120, 4864, 1, 640]
    - [405, 190.91]
  - - [5120, 5120, 1, 640]
    - [406, 192.69]
  - - [5120, 5376, 1, 640]
    - [396, 200.25]
  - - [5120, 5632, 1, 640]
    - [396, 202.01]
  - - [5120, 5888, 1, 640]
    - [407, 197.3]
  - - [5120, 6144, 1, 640]
    - [398, 200.34]
  - - [5120, 6400, 1, 640]
    - [398, 205.67]
  - - [5120, 6656, 1, 640]
    - [398, 207.28]
  - - [5120, 6912, 1, 640]
    - [408, 208.44]
  - - [5120, 7168, 1, 640]
    - [409, 211.37]
  - - [5120, 7424, 1, 640]
    - [409, 215.33]
  - - [5120, 7680, 1, 640]
    - [409, 218.24]
  - - [5120, 7936, 1, 640]
    - [396, 202.15]
  - - [5120, 8192, 1, 640]
    - [396, 204.52]
  - - [5120, 8448, 1, 640]
    - [410, 212.33]
  - - [5120, 8704, 1, 640]
    - [396, 212.17]
  - - [5120, 8960, 1, 640]
    - [411, 206.55]
  - - [5120, 9216, 1, 640]
    - [408, 209.36]
  - - [5120, 9728, 1, 640]
    - [412, 212.03]
  - - [5120, 9984, 1, 640]
    - [412, 216.28]
  - - [1024, 1088, 1, 5120]
    - [6, 140.38]
  - - [1024, 1152, 1, 5120]
    - [4, 144.31]
  - - [1024, 1216, 1, 5120]
    - [6, 147.82]
  - - [1024, 1280, 1, 5120]
    - [7, 146.83]
  - - [1024, 1344, 1, 5120]
    - [7, 151.92]
  - - [1024, 1408, 1, 5120]
    - [9, 154.21]
  - - [1024, 1472, 1, 5120]
    - [29, 157.12]
  - - [1024, 1536, 1, 5120]
    - [7, 166.1]
  - - [1024, 1600, 1, 5120]
    - [123, 165.08]
  - - [1024, 1664, 1, 5120]
    - [114, 168.65]
  - - [1024, 1728, 1, 5120]
    - [8, 174.75]
  - - [1024, 1792, 1, 5120]
    - [8, 175.58]
  - - [1024, 1856, 1, 5120]
    - [114, 174.72]
  - - [1024, 1920, 1, 5120]
    - [9, 177.78]
  - - [1024, 1984, 1, 5120]
    - [112, 179.98]
  - - [1024, 2048, 1, 5120]
    - [9, 191.23]
  - - [1024, 2176, 1, 5120]
    - [114, 193.42]
  - - [1024, 2304, 1, 5120]
    - [10, 198.46]
  - - [1024, 2432, 1, 5120]
    - [114, 205.49]
  - - [1024, 2560, 1, 5120]
    - [116, 200.88]
  - - [1024, 2688, 1, 5120]
    - [11, 206.22]
  - - [1024, 2816, 1, 5120]
    - [11, 211.75]
  - - [1024, 2944, 1, 5120]
    - [30, 216.69]
  - - [1024, 3072, 1, 5120]
    - [14, 213.68]
  - - [1024, 3200, 1, 5120]
    - [117, 218.06]
  - - [1024, 3328, 1, 5120]
    - [117, 219.64]
  - - [1024, 3456, 1, 5120]
    - [117, 227.4]
  - - [1024, 3584, 1, 5120]
    - [117, 230.91]
  - - [1024, 3712, 1, 5120]
    - [118, 221.22]
  - - [1024, 3840, 1, 5120]
    - [118, 222.33]
  - - [1024, 3968, 1, 5120]
    - [19, 226.35]
  - - [1024, 4096, 1, 5120]
    - [118, 228.91]
  - - [1024, 4352, 1, 5120]
    - [211, 229.0]
  - - [1024, 4608, 1, 5120]
    - [212, 236.53]
  - - [1024, 4864, 1, 5120]
    - [212, 239.75]
  - - [1024, 5120, 1, 5120]
    - [213, 225.34]
  - - [1024, 5376, 1, 5120]
    - [214, 231.01]
  - - [1024, 5632, 1, 5120]
    - [215, 235.57]
  - - [5120, 176, 1, 1024]
    - [313, 73.27]
  - - [5120, 192, 1, 1024]
    - [313, 81.93]
  - - [5120, 208, 1, 1024]
    - [313, 81.73]
  - - [5120, 224, 1, 1024]
    - [313, 90.95]
  - - [5120, 240, 1, 1024]
    - [316, 91.74]
  - - [5120, 256, 1, 1024]
    - [322, 91.66]
  - - [5120, 272, 1, 1024]
    - [316, 94.11]
  - - [5120, 288, 1, 1024]
    - [316, 103.27]
  - - [5120, 304, 1, 1024]
    - [316, 100.51]
  - - [5120, 320, 1, 1024]
    - [322, 106.16]
  - - [5120, 336, 1, 1024]
    - [316, 114.34]
  - - [5120, 352, 1, 1024]
    - [338, 104.43]
  - - [5120, 368, 1, 1024]
    - [322, 107.97]
  - - [5120, 384, 1, 1024]
    - [322, 119.42]
  - - [5120, 400, 1, 1024]
    - [12, 119.09]
  - - [5120, 416, 1, 1024]
    - [9, 115.63]
  - - [5120, 432, 1, 1024]
    - [9, 120.3]
  - - [5120, 448, 1, 1024]
    - [9, 130.22]
  - - [5120, 464, 1, 1024]
    - [11, 122.57]
  - - [5120, 480, 1, 1024]
    - [11, 133.0]
  - - [5120, 496, 1, 1024]
    - [11, 125.88]
  - - [5120, 512, 1, 1024]
    - [11, 129.35]
  - - [5120, 544, 1, 1024]
    - [11, 136.02]
  - - [5120, 576, 1, 1024]
    - [14, 139.87]
  - - [5120, 608, 1, 1024]
    - [46, 133.36]
  - - [5120, 640, 1, 1024]
    - [46, 138.43]
  - - [5120, 672, 1, 1024]
    - [14, 151.76]
  - - [5120, 704, 1, 1024]
    - [72, 145.76]
  - - [5120, 736, 1, 1024]
    - [47, 144.66]
  - - [5120, 768, 1, 1024]
    - [124, 151.91]
  - - [5120, 800, 1, 1024]
    - [125, 147.14]
  - - [5120, 832, 1, 1024]
    - [29, 155.27]
  - - [5120, 864, 1, 1024]
    - [94, 158.32]
  - - [5120, 896, 1, 1024]
    - [73, 165.9]
  - - [5120, 928, 1, 1024]
    - [120, 158.76]
  - - [5120, 960, 1, 1024]
    - [16, 168.15]
  - - [5120, 992, 1, 1024]
    - [126, 156.5]
  - - [5120, 1024, 1, 1024]
    - [33, 163.69]
  - - [5120, 1088, 1, 1024]
    - [33, 170.39]
  - - [5120, 1152, 1, 1024]
    - [121, 177.82]
  - - [5120, 1216, 1, 1024]
    - [33, 182.81]
  - - [5120, 1280, 1, 1024]
    - [78, 180.67]
  - - [5120, 1344, 1, 1024]
    - [14, 183.32]
  - - [5120, 1408, 1, 1024]
    - [122, 180.68]
  - - [5120, 1472, 1, 1024]
    - [50, 180.38]
  - - [5120, 1536, 1, 1024]
    - [37, 187.84]
  - - [5120, 1600, 1, 1024]
    - [11, 188.34]
  - - [5120, 1664, 1, 1024]
    - [27, 193.7]
  - - [5120, 1728, 1, 1024]
    - [36, 201.96]
  - - [5120, 1792, 1, 1024]
    - [37, 202.07]
  - - [5120, 1856, 1, 1024]
    - [95, 198.45]
  - - [5120, 1920, 1, 1024]
    - [27, 207.53]
  - - [5120, 1984, 1, 1024]
    - [33, 194.08]
  - - [5120, 2048, 1, 1024]
    - [82, 200.99]
  - - [5120, 2176, 1, 1024]
    - [82, 206.79]
  - - [5120, 2304, 1, 1024]
    - [82, 213.91]
  - - [5120, 2432, 1, 1024]
    - [69, 219.1]
  - - [5120, 2560, 1, 1024]
    - [86, 211.97]
  - - [5120, 2688, 1, 1024]
    - [21, 218.84]
  - - [5120, 2816, 1, 1024]
    - [89, 216.89]
  - - [5120, 2944, 1, 1024]
    - [78, 213.15]
  - - [5120, 3072, 1, 1024]
    - [99, 215.87]
  - - [5120, 3200, 1, 1024]
    - [127, 218.45]
  - - [5120, 3328, 1, 1024]
    - [128, 221.09]
  - - [5120, 3456, 1, 1024]
    - [99, 228.71]
  - - [5120, 3584, 1, 1024]
    - [100, 230.96]
  - - [5120, 3712, 1, 1024]
    - [66, 228.71]
  - - [5120, 3840, 1, 1024]
    - [92, 234.55]
  - - [5120, 3968, 1, 1024]
    - [23, 224.17]
  - - [5120, 4096, 1, 1024]
    - [101, 228.08]
  - - [5120, 4352, 1, 1024]
    - [254, 219.05]
  - - [5120, 4608, 1, 1024]
    - [246, 226.1]
  - - [5120, 4864, 1, 1024]
    - [247, 229.86]
  - - [5120, 5120, 1, 1024]
    - [255, 222.59]
  - - [5120, 5376, 1, 1024]
    - [252, 229.55]
  - - [5120, 5632, 1, 1024]
    - [251, 229.71]
  - - [896, 10240, 1, 5120]
    - [131, 234.0]
  - - [896, 10752, 1, 5120]
    - [145, 239.75]
  - - [896, 11264, 1, 5120]
    - [146, 248.43]
  - - [896, 11520, 1, 5120]
    - [147, 246.89]
  - - [896, 11776, 1, 5120]
    - [148, 244.45]
  - - [896, 12288, 1, 5120]
    - [149, 248.33]
  - - [896, 12544, 1, 5120]
    - [150, 249.27]
  - - [896, 12800, 1, 5120]
    - [150, 254.18]
  - - [896, 13056, 1, 5120]
    - [151, 244.96]
  - - [896, 13312, 1, 5120]
    - [151, 249.16]
  - - [896, 13824, 1, 5120]
    - [152, 244.82]
  - - [896, 14080, 1, 5120]
    - [153, 248.14]
  - - [896, 14336, 1, 5120]
    - [152, 248.18]
  - - [896, 14592, 1, 5120]
    - [154, 247.42]
  - - [896, 14848, 1, 5120]
    - [155, 250.61]
  - - [896, 15360, 1, 5120]
    - [154, 256.41]
  - - [896, 15872, 1, 5120]
    - [156, 257.96]
  - - [896, 16128, 1, 5120]
    - [157, 259.92]
  - - [896, 16384, 1, 5120]
    - [158, 254.6]
  - - [896, 16640, 1, 5120]
    - [159, 254.31]
  - - [896, 16896, 1, 5120]
    - [160, 255.32]
  - - [896, 17408, 1, 5120]
    - [160, 262.61]
  - - [896, 17664, 1, 5120]
    - [161, 261.76]
  - - [896, 17920, 1, 5120]
    - [160, 263.73]
  - - [896, 18432, 1, 5120]
    - [162, 269.12]
  - - [896, 19200, 1, 5120]
    - [160, 272.01]
  - - [896, 19456, 1, 5120]
    - [161, 273.8]
  - - [896, 19712, 1, 5120]
    - [163, 259.9]
  - - [896, 19968, 1, 5120]
    - [163, 262.23]
  - - [896, 20480, 1, 5120]
    - [164, 263.6]
  - - [896, 20736, 1, 5120]
    - [163, 266.56]
  - - [896, 21504, 1, 5120]
    - [163, 267.53]
  - - [896, 21760, 1, 5120]
    - [164, 268.39]
  - - [896, 22272, 1, 5120]
    - [165, 246.98]
  - - [896, 22528, 1, 5120]
    - [132, 246.6]
  - - [896, 23040, 1, 5120]
    - [139, 250.16]
  - - [896, 23296, 1, 5120]
    - [166, 252.77]
  - - [896, 23552, 1, 5120]
    - [167, 247.24]
  - - [896, 23808, 1, 5120]
    - [167, 248.89]
  - - [896, 24320, 1, 5120]
    - [138, 254.76]
  - - [896, 24576, 1, 5120]
    - [138, 251.84]
  - - [896, 25088, 1, 5120]
    - [168, 253.58]
  - - [896, 25344, 1, 5120]
    - [168, 253.95]
  - - [896, 25600, 1, 5120]
    - [150, 255.61]
  - - [896, 26112, 1, 5120]
    - [151, 253.04]
  - - [896, 26624, 1, 5120]
    - [169, 253.6]
  - - [896, 26880, 1, 5120]
    - [170, 256.27]
  - - [896, 27648, 1, 5120]
    - [171, 254.74]
  - - [896, 28160, 1, 5120]
    - [143, 262.18]
  - - [896, 28672, 1, 5120]
    - [143, 266.46]
  - - [896, 29184, 1, 5120]
    - [140, 265.73]
  - - [896, 29440, 1, 5120]
    - [157, 256.65]
  - - [896, 29696, 1, 5120]
    - [154, 257.4]
  - - [896, 29952, 1, 5120]
    - [154, 258.35]
  - - [896, 30464, 1, 5120]
    - [157, 260.0]
  - - [896, 30720, 1, 5120]
    - [154, 258.07]
  - - [896, 30976, 1, 5120]
    - [166, 260.3]
  - - [896, 31744, 1, 5120]
    - [172, 268.45]
  - - [896, 32000, 1, 5120]
    - [157, 263.41]
  - - [896, 32256, 1, 5120]
    - [154, 263.06]
  - - [896, 32768, 1, 5120]
    - [160, 263.45]
  - - [896, 33280, 1, 5120]
    - [173, 263.83]
  - - [896, 33792, 1, 5120]
    - [158, 266.9]
  - - [896, 34048, 1, 5120]
    - [158, 266.93]
  - - [896, 34560, 1, 5120]
    - [162, 267.82]
  - - [896, 34816, 1, 5120]
    - [159, 267.43]
  - - [896, 35328, 1, 5120]
    - [160, 269.81]
  - - [896, 35840, 1, 5120]
    - [160, 272.83]
  - - [896, 36608, 1, 5120]
    - [162, 279.68]
  - - [896, 36864, 1, 5120]
    - [159, 279.34]
  - - [896, 37120, 1, 5120]
    - [160, 277.87]
  - - [896, 37632, 1, 5120]
    - [173, 281.42]
  - - [896, 38400, 1, 5120]
    - [158, 285.55]
  - - [896, 38912, 1, 5120]
    - [160, 286.6]
  - - [896, 39168, 1, 5120]
    - [163, 267.4]
  - - [896, 39424, 1, 5120]
    - [163, 268.44]
  - - [896, 39680, 1, 5120]
    - [174, 274.15]
  - - [896, 39936, 1, 5120]
    - [175, 269.56]
  - - [896, 40960, 1, 5120]
    - [164, 278.61]
  - - [896, 41216, 1, 5120]
    - [174, 278.32]
  - - [896, 41472, 1, 5120]
    - [174, 276.0]
  - - [896, 42240, 1, 5120]
    - [164, 282.36]
  - - [896, 43008, 1, 5120]
    - [163, 286.12]
  - - [896, 43264, 1, 5120]
    - [163, 283.41]
  - - [896, 43520, 1, 5120]
    - [176, 284.56]
  - - [896, 43776, 1, 5120]
    - [164, 285.89]
  - - [896, 44544, 1, 5120]
    - [177, 267.66]
  - - [896, 44800, 1, 5120]
    - [157, 263.51]
  - - [896, 45056, 1, 5120]
    - [157, 264.82]
  - - [896, 46080, 1, 5120]
    - [157, 265.61]
  - - [896, 46592, 1, 5120]
    - [154, 265.95]
  - - [896, 47104, 1, 5120]
    - [154, 268.75]
  - - [896, 47616, 1, 5120]
    - [154, 268.47]
  - - [896, 47872, 1, 5120]
    - [154, 271.13]
  - - [896, 48384, 1, 5120]
    - [155, 272.89]
  - - [896, 48640, 1, 5120]
    - [155, 273.53]
  - - [896, 49152, 1, 5120]
    - [158, 266.57]
  - - [896, 49920, 1, 5120]
    - [162, 269.75]
  - - [896, 50176, 1, 5120]
    - [158, 270.73]
  - - [896, 50688, 1, 5120]
    - [162, 268.93]
  - - [896, 51200, 1, 5120]
    - [158, 270.2]
  - - [896, 51968, 1, 5120]
    - [158, 274.43]
  - - [896, 52224, 1, 5120]
    - [161, 272.12]
  - - [896, 52992, 1, 5120]
    - [158, 272.85]
  - - [896, 53248, 1, 5120]
    - [159, 281.99]
  - - [896, 53504, 1, 5120]
    - [158, 283.57]
  - - [896, 53760, 1, 5120]
    - [159, 282.14]
  - - [896, 55296, 1, 5120]
    - [158, 286.01]
  - - [896, 55552, 1, 5120]
    - [160, 286.64]
  - - [896, 56320, 1, 5120]
    - [158, 288.51]
  - - [896, 56576, 1, 5120]
    - [158, 286.12]
  - - [896, 57344, 1, 5120]
    - [158, 287.97]
  - - [896, 57600, 1, 5120]
    - [158, 290.0]
  - - [896, 58368, 1, 5120]
    - [162, 289.03]
  - - [896, 58880, 1, 5120]
    - [175, 278.35]
  - - [896, 59136, 1, 5120]
    - [176, 278.61]
  - - [896, 59392, 1, 5120]
    - [178, 277.28]
  - - [896, 59904, 1, 5120]
    - [176, 277.7]
  - - [896, 60928, 1, 5120]
    - [176, 282.38]
  - - [896, 61440, 1, 5120]
    - [163, 284.3]
  - - [896, 61952, 1, 5120]
    - [164, 282.89]
  - - [896, 62208, 1, 5120]
    - [175, 283.92]
  - - [896, 63232, 1, 5120]
    - [176, 285.07]
  - - [896, 63488, 1, 5120]
    - [178, 284.87]
  - - [896, 64000, 1, 5120]
    - [176, 286.91]
  - - [896, 64512, 1, 5120]
    - [163, 289.05]
  - - [896, 64768, 1, 5120]
    - [176, 285.4]
  - - [896, 65280, 1, 5120]
    - [178, 287.16]
  - - [896, 65536, 1, 5120]
    - [176, 289.66]
  - - [896, 66560, 1, 5120]
    - [160, 273.53]
  - - [896, 66816, 1, 5120]
    - [173, 275.08]
  - - [896, 67584, 1, 5120]
    - [161, 278.14]
  - - [896, 68096, 1, 5120]
    - [162, 276.78]
  - - [896, 69120, 1, 5120]
    - [162, 281.97]
  - - [896, 69632, 1, 5120]
    - [173, 281.55]
  - - [896, 69888, 1, 5120]
    - [162, 282.31]
  - - [896, 70400, 1, 5120]
    - [158, 283.22]
  - - [896, 70656, 1, 5120]
    - [160, 282.55]
  - - [896, 71424, 1, 5120]
    - [158, 284.57]
  - - [896, 71680, 1, 5120]
    - [158, 285.63]
  - - [896, 72960, 1, 5120]
    - [158, 286.11]
  - - [896, 73216, 1, 5120]
    - [160, 288.21]
  - - [896, 73728, 1, 5120]
    - [158, 289.82]
  - - [896, 74240, 1, 5120]
    - [173, 287.37]
  - - [896, 75264, 1, 5120]
    - [158, 290.23]
  - - [896, 76032, 1, 5120]
    - [159, 290.2]
  - - [896, 76544, 1, 5120]
    - [158, 292.6]
  - - [896, 76800, 1, 5120]
    - [159, 290.47]
  - - [896, 77824, 1, 5120]
    - [173, 292.06]
  - - [896, 78848, 1, 5120]
    - [164, 283.05]
  - - [896, 79360, 1, 5120]
    - [163, 281.14]
  - - [896, 79872, 1, 5120]
    - [163, 283.73]
  - - [896, 80640, 1, 5120]
    - [176, 284.85]
  - - [896, 81664, 1, 5120]
    - [178, 284.4]
  - - [896, 81920, 1, 5120]
    - [174, 285.13]
  - - [896, 82432, 1, 5120]
    - [163, 286.99]
  - - [896, 82944, 1, 5120]
    - [175, 285.79]
  - - [896, 83200, 1, 5120]
    - [163, 288.9]
  - - [896, 84480, 1, 5120]
    - [163, 289.04]
  - - [896, 86016, 1, 5120]
    - [163, 289.28]
  - - [896, 86528, 1, 5120]
    - [176, 290.17]
  - - [896, 87296, 1, 5120]
    - [163, 290.57]
  - - [896, 88320, 1, 5120]
    - [158, 285.42]
  - - [896, 89088, 1, 5120]
    - [158, 286.19]
  - - [896, 89600, 1, 5120]
    - [159, 286.51]
  - - [896, 89856, 1, 5120]
    - [158, 291.07]
  - - [896, 90112, 1, 5120]
    - [160, 287.35]
  - - [896, 92160, 1, 5120]
    - [158, 290.64]
  - - [896, 93184, 1, 5120]
    - [158, 292.05]
  - - [896, 94208, 1, 5120]
    - [158, 291.84]
  - - [896, 95232, 1, 5120]
    - [158, 292.95]
  - - [896, 96000, 1, 5120]
    - [158, 295.18]
  - - [896, 96512, 1, 5120]
    - [158, 294.78]
  - - [896, 96768, 1, 5120]
    - [158, 294.93]
  - - [896, 98304, 1, 5120]
    - [176, 284.4]
  - - [896, 99840, 1, 5120]
    - [164, 284.15]
  - - [896, 100352, 1, 5120]
    - [164, 286.56]
  - - [896, 102400, 1, 5120]
    - [163, 288.55]
  - - [896, 103168, 1, 5120]
    - [164, 288.13]
  - - [896, 103680, 1, 5120]
    - [163, 291.65]
  - - [896, 103936, 1, 5120]
    - [164, 289.31]
  - - [896, 106496, 1, 5120]
    - [163, 292.04]
  - - [896, 107520, 1, 5120]
    - [175, 289.85]
  - - [896, 110592, 1, 5120]
    - [158, 291.03]
  - - [896, 111104, 1, 5120]
    - [158, 292.55]
  - - [896, 111360, 1, 5120]
    - [160, 291.12]
  - - [896, 114688, 1, 5120]
    - [158, 293.08]
  - - [896, 115200, 1, 5120]
    - [158, 294.11]
  - - [896, 118784, 1, 5120]
    - [176, 284.03]
  - - [896, 119040, 1, 5120]
    - [176, 283.93]
  - - [896, 122880, 1, 5120]
    - [164, 286.89]
  - - [896, 126976, 1, 5120]
    - [158, 291.62]
  - - [896, 131072, 1, 5120]
    - [159, 293.47]
  - - [4096, 4352, 1, 5120]
    - [179, 284.29]
  - - [4096, 4608, 1, 5120]
    - [180, 283.69]
  - - [4096, 4864, 1, 5120]
    - [181, 291.3]
  - - [4096, 5120, 1, 5120]
    - [182, 278.08]
  - - [4096, 5376, 1, 5120]
    - [182, 285.14]
  - - [4096, 5632, 1, 5120]
    - [183, 277.25]
  - - [4096, 5888, 1, 5120]
    - [184, 283.96]
  - - [4096, 6144, 1, 5120]
    - [185, 276.97]
  - - [4096, 6400, 1, 5120]
    - [186, 274.47]
  - - [4096, 6656, 1, 5120]
    - [187, 288.85]
  - - [4096, 6912, 1, 5120]
    - [188, 287.24]
  - - [4096, 7168, 1, 5120]
    - [189, 291.27]
  - - [4096, 7424, 1, 5120]
    - [190, 279.66]
  - - [4096, 7680, 1, 5120]
    - [191, 284.35]
  - - [4096, 7936, 1, 5120]
    - [190, 288.7]
  - - [4096, 8192, 1, 5120]
    - [190, 296.33]
  - - [4096, 8448, 1, 5120]
    - [191, 299.89]
  - - [4096, 8704, 1, 5120]
    - [182, 291.0]
  - - [4096, 8960, 1, 5120]
    - [192, 293.59]
  - - [4096, 9216, 1, 5120]
    - [193, 291.94]
  - - [4096, 9728, 1, 5120]
    - [181, 296.58]
  - - [4096, 9984, 1, 5120]
    - [194, 290.19]
  - - [4096, 10240, 1, 5120]
    - [182, 293.41]
  - - [4096, 10752, 1, 5120]
    - [182, 298.92]
  - - [4096, 11264, 1, 5120]
    - [195, 289.37]
  - - [4096, 11520, 1, 5120]
    - [183, 293.11]
  - - [4096, 11776, 1, 5120]
    - [183, 295.03]
  - - [4096, 12288, 1, 5120]
    - [182, 296.22]
  - - [4096, 12544, 1, 5120]
    - [190, 303.57]
  - - [4096, 12800, 1, 5120]
    - [196, 296.56]
  - - [4096, 13056, 1, 5120]
    - [197, 296.95]
  - - [4096, 13312, 1, 5120]
    - [198, 296.79]
  - - [4096, 13824, 1, 5120]
    - [181, 300.43]
  - - [4096, 14080, 1, 5120]
    - [199, 300.01]
  - - [4096, 14336, 1, 5120]
    - [193, 300.92]
  - - [4096, 14592, 1, 5120]
    - [181, 305.22]
  - - [4096, 14848, 1, 5120]
    - [184, 303.83]
  - - [4096, 15360, 1, 5120]
    - [182, 297.7]
  - - [4096, 15872, 1, 5120]
    - [182, 300.48]
  - - [4096, 16128, 1, 5120]
    - [191, 303.91]
  - - [4096, 16384, 1, 5120]
    - [188, 303.96]
  - - [4096, 16640, 1, 5120]
    - [190, 305.45]
  - - [4096, 16896, 1, 5120]
    - [200, 311.79]
  - - [4096, 17408, 1, 5120]
    - [197, 302.58]
  - - [4096, 17664, 1, 5120]
    - [198, 304.96]
  - - [4096, 17920, 1, 5120]
    - [183, 307.16]
  - - [4096, 18432, 1, 5120]
    - [181, 304.02]
  - - [4096, 19200, 1, 5120]
    - [201, 310.79]
  - - [4096, 19456, 1, 5120]
    - [201, 312.96]
  - - [4096, 19712, 1, 5120]
    - [190, 302.35]
  - - [4096, 19968, 1, 5120]
    - [182, 305.11]
  - - [4096, 20480, 1, 5120]
    - [190, 308.55]
  - - [4096, 20736, 1, 5120]
    - [190, 309.09]
  - - [4096, 21504, 1, 5120]
    - [185, 306.89]
  - - [4096, 21760, 1, 5120]
    - [202, 309.98]
  - - [4096, 22272, 1, 5120]
    - [203, 306.65]
  - - [4096, 22528, 1, 5120]
    - [201, 303.37]
  - - [4096, 23040, 1, 5120]
    - [182, 304.93]
  - - [4096, 23296, 1, 5120]
    - [182, 306.32]
  - - [4096, 23552, 1, 5120]
    - [204, 306.23]
  - - [4096, 23808, 1, 5120]
    - [205, 311.59]
  - - [4096, 24320, 1, 5120]
    - [206, 313.22]
  - - [4096, 24576, 1, 5120]
    - [190, 310.1]
  - - [4096, 25088, 1, 5120]
    - [190, 314.16]
  - - [4096, 25344, 1, 5120]
    - [191, 318.45]
  - - [4096, 25600, 1, 5120]
    - [196, 306.27]
  - - [4096, 26112, 1, 5120]
    - [196, 307.52]
  - - [4096, 26624, 1, 5120]
    - [207, 306.23]
  - - [4096, 26880, 1, 5120]
    - [208, 311.75]
  - - [4096, 27648, 1, 5120]
    - [190, 308.47]
  - - [4096, 28160, 1, 5120]
    - [181, 311.79]
  - - [4096, 28672, 1, 5120]
    - [206, 313.69]
  - - [4096, 29184, 1, 5120]
    - [201, 317.28]
  - - [4096, 29440, 1, 5120]
    - [209, 317.65]
  - - [4096, 29696, 1, 5120]
    - [191, 315.72]
  - - [4096, 29952, 1, 5120]
    - [208, 312.27]
  - - [4096, 30464, 1, 5120]
    - [197, 310.87]
  - - [4096, 30720, 1, 5120]
    - [196, 311.9]
  - - [4096, 30976, 1, 5120]
    - [182, 307.58]
  - - [4096, 31744, 1, 5120]
    - [210, 309.36]
  - - [4096, 32000, 1, 5120]
    - [210, 311.42]
  - - [4096, 32256, 1, 5120]
    - [185, 312.66]
  - - [4096, 32768, 1, 5120]
    - [190, 314.83]
  - - [4096, 33280, 1, 5120]
    - [191, 317.19]
  - - [4096, 33792, 1, 5120]
    - [190, 319.44]
  - - [4096, 34048, 1, 5120]
    - [191, 320.55]
  - - [4096, 34560, 1, 5120]
    - [197, 310.13]
  - - [4096, 34816, 1, 5120]
    - [196, 313.1]
  - - [4096, 35328, 1, 5120]
    - [197, 311.94]
  - - [4096, 35840, 1, 5120]
    - [198, 312.39]
  - - [4096, 36608, 1, 5120]
    - [191, 312.96]
  - - [4096, 36864, 1, 5120]
    - [190, 315.51]
  - - [4096, 37120, 1, 5120]
    - [191, 316.2]
  - - [4096, 37632, 1, 5120]
    - [190, 318.52]
  - - [4096, 38400, 1, 5120]
    - [206, 316.73]
  - - [4096, 38912, 1, 5120]
    - [181, 317.82]
  - - [4096, 39168, 1, 5120]
    - [208, 312.44]
  - - [4096, 39424, 1, 5120]
    - [183, 313.4]
  - - [4096, 39680, 1, 5120]
    - [185, 314.08]
  - - [4096, 39936, 1, 5120]
    - [210, 313.71]
  - - [4096, 40960, 1, 5120]
    - [190, 313.24]
  - - [4096, 41216, 1, 5120]
    - [190, 314.94]
  - - [4096, 41472, 1, 5120]
    - [191, 315.88]
  - - [4096, 42240, 1, 5120]
    - [190, 318.15]
  - - [4096, 43008, 1, 5120]
    - [181, 315.34]
  - - [4096, 43264, 1, 5120]
    - [206, 315.48]
  - - [4096, 43520, 1, 5120]
    - [181, 317.55]
  - - [4096, 43776, 1, 5120]
    - [181, 316.37]
  - - [4096, 44544, 1, 5120]
    - [156, 313.17]
  - - [4096, 44800, 1, 5120]
    - [156, 312.97]
  - - [4096, 45056, 1, 5120]
    - [190, 313.01]
  - - [4096, 46080, 1, 5120]
    - [190, 317.08]
  - - [4096, 46592, 1, 5120]
    - [190, 320.73]
  - - [4096, 47104, 1, 5120]
    - [181, 312.46]
  - - [4096, 47616, 1, 5120]
    - [193, 312.92]
  - - [4096, 47872, 1, 5120]
    - [181, 314.1]
  - - [4096, 48384, 1, 5120]
    - [181, 316.5]
  - - [4096, 48640, 1, 5120]
    - [181, 316.52]
  - - [4096, 49152, 1, 5120]
    - [190, 312.95]
  - - [4096, 49920, 1, 5120]
    - [191, 315.87]
  - - [4096, 50176, 1, 5120]
    - [190, 317.09]
  - - [4096, 50688, 1, 5120]
    - [190, 318.74]
  - - [4096, 51200, 1, 5120]
    - [183, 311.04]
  - - [4096, 51968, 1, 5120]
    - [155, 311.72]
  - - [4096, 52224, 1, 5120]
    - [201, 313.42]
  - - [4096, 52992, 1, 5120]
    - [181, 313.24]
  - - [4096, 53248, 1, 5120]
    - [181, 316.58]
  - - [4096, 53504, 1, 5120]
    - [181, 315.47]
  - - [4096, 53760, 1, 5120]
    - [190, 314.1]
  - - [4096, 55296, 1, 5120]
    - [190, 320.71]
  - - [4096, 55552, 1, 5120]
    - [156, 311.2]
  - - [4096, 56320, 1, 5120]
    - [181, 309.55]
  - - [4096, 56576, 1, 5120]
    - [181, 310.94]
  - - [4096, 57344, 1, 5120]
    - [181, 312.7]
  - - [4096, 57600, 1, 5120]
    - [181, 314.23]
  - - [4096, 58368, 1, 5120]
    - [190, 315.76]
  - - [4096, 58880, 1, 5120]
    - [191, 316.6]
  - - [4096, 59136, 1, 5120]
    - [191, 317.85]
  - - [4096, 59392, 1, 5120]
    - [191, 319.02]
  - - [4096, 59904, 1, 5120]
    - [208, 310.83]
  - - [4096, 60928, 1, 5120]
    - [210, 310.16]
  - - [4096, 61440, 1, 5120]
    - [210, 313.29]
  - - [4096, 61952, 1, 5120]
    - [190, 316.54]
  - - [4096, 62208, 1, 5120]
    - [191, 317.7]
  - - [4096, 63232, 1, 5120]
    - [190, 319.81]
  - - [4096, 63488, 1, 5120]
    - [190, 322.31]
  - - [4096, 64000, 1, 5120]
    - [185, 313.03]
  - - [4096, 64512, 1, 5120]
    - [185, 314.82]
  - - [4096, 64768, 1, 5120]
    - [185, 315.3]
  - - [4096, 65280, 1, 5120]
    - [185, 315.37]
  - - [4096, 65536, 1, 5120]
    - [210, 316.89]
  - - [4096, 66560, 1, 5120]
    - [191, 318.13]
  - - [4096, 66816, 1, 5120]
    - [190, 318.85]
  - - [4096, 67584, 1, 5120]
    - [191, 321.71]
  - - [4096, 68096, 1, 5120]
    - [191, 323.0]
  - - [4096, 69120, 1, 5120]
    - [210, 318.36]
  - - [4096, 69632, 1, 5120]
    - [183, 314.61]
  - - [4096, 69888, 1, 5120]
    - [190, 316.24]
  - - [4096, 70400, 1, 5120]
    - [191, 317.71]
  - - [4096, 70656, 1, 5120]
    - [191, 317.53]
  - - [4096, 71424, 1, 5120]
    - [190, 320.38]
  - - [4096, 71680, 1, 5120]
    - [191, 320.51]
  - - [4096, 72960, 1, 5120]
    - [181, 318.8]
  - - [4096, 73216, 1, 5120]
    - [191, 312.56]
  - - [4096, 73728, 1, 5120]
    - [190, 314.15]
  - - [4096, 74240, 1, 5120]
    - [191, 315.94]
  - - [4096, 75264, 1, 5120]
    - [190, 318.98]
  - - [4096, 76032, 1, 5120]
    - [191, 321.94]
  - - [4096, 76544, 1, 5120]
    - [191, 322.06]
  - - [4096, 76800, 1, 5120]
    - [181, 316.71]
  - - [4096, 77824, 1, 5120]
    - [181, 319.08]
  - - [4096, 78848, 1, 5120]
    - [191, 317.59]
  - - [4096, 79360, 1, 5120]
    - [191, 318.2]
  - - [4096, 79872, 1, 5120]
    - [190, 319.79]
  - - [4096, 80640, 1, 5120]
    - [190, 322.61]
  - - [4096, 81664, 1, 5120]
    - [181, 317.1]
  - - [4096, 81920, 1, 5120]
    - [181, 316.47]
  - - [4096, 82432, 1, 5120]
    - [181, 317.93]
  - - [4096, 82944, 1, 5120]
    - [190, 317.14]
  - - [4096, 83200, 1, 5120]
    - [191, 316.87]
  - - [4096, 84480, 1, 5120]
    - [190, 322.1]
  - - [4096, 86016, 1, 5120]
    - [206, 314.04]
  - - [4096, 86528, 1, 5120]
    - [181, 316.34]
  - - [4096, 87296, 1, 5120]
    - [181, 318.13]
  - - [4096, 88320, 1, 5120]
    - [190, 320.24]
  - - [4096, 89088, 1, 5120]
    - [190, 321.25]
  - - [4096, 89600, 1, 5120]
    - [181, 312.5]
  - - [4096, 89856, 1, 5120]
    - [181, 312.3]
  - - [4096, 90112, 1, 5120]
    - [190, 312.14]
  - - [4096, 92160, 1, 5120]
    - [191, 316.46]
  - - [4096, 93184, 1, 5120]
    - [209, 318.68]
  - - [4096, 94208, 1, 5120]
    - [208, 312.33]
  - - [4096, 95232, 1, 5120]
    - [190, 311.79]
  - - [4096, 96000, 1, 5120]
    - [191, 313.34]
  - - [4096, 96512, 1, 5120]
    - [190, 316.1]
  - - [4096, 96768, 1, 5120]
    - [190, 315.96]
  - - [4096, 98304, 1, 5120]
    - [185, 314.37]
  - - [4096, 99840, 1, 5120]
    - [190, 314.58]
  - - [4096, 100352, 1, 5120]
    - [191, 314.62]
  - - [4096, 102400, 1, 5120]
    - [183, 309.22]
  - - [4096, 103168, 1, 5120]
    - [190, 311.57]
  - - [4096, 103680, 1, 5120]
    - [190, 311.83]
  - - [4096, 103936, 1, 5120]
    - [191, 313.08]
  - - [4096, 106496, 1, 5120]
    - [181, 313.49]
  - - [4096, 107520, 1, 5120]
    - [190, 311.8]
  - - [4096, 110592, 1, 5120]
    - [190, 318.98]
  - - [4096, 111104, 1, 5120]
    - [181, 313.01]
  - - [4096, 111360, 1, 5120]
    - [181, 313.48]
  - - [4096, 114688, 1, 5120]
    - [190, 319.41]
  - - [4096, 115200, 1, 5120]
    - [204, 311.89]
  - - [4096, 118784, 1, 5120]
    - [190, 318.16]
  - - [4096, 119040, 1, 5120]
    - [191, 318.56]
  - - [4096, 122880, 1, 5120]
    - [190, 317.03]
  - - [4096, 126976, 1, 5120]
    - [190, 315.91]
  - - [4096, 131072, 1, 5120]
    - [190, 315.63]
  - - [1024, 5888, 1, 5120]
    - [216, 239.11]
  - - [1024, 6144, 1, 5120]
    - [188, 242.68]
  - - [1024, 6400, 1, 5120]
    - [137, 244.84]
  - - [1024, 6656, 1, 5120]
    - [217, 250.26]
  - - [1024, 6912, 1, 5120]
    - [218, 253.03]
  - - [1024, 7168, 1, 5120]
    - [188, 254.97]
  - - [1024, 7424, 1, 5120]
    - [219, 242.22]
  - - [1024, 7680, 1, 5120]
    - [219, 246.7]
  - - [1024, 7936, 1, 5120]
    - [219, 249.07]
  - - [1024, 8192, 1, 5120]
    - [220, 252.17]
  - - [1024, 8448, 1, 5120]
    - [220, 256.21]
  - - [1024, 8704, 1, 5120]
    - [221, 253.63]
  - - [1024, 8960, 1, 5120]
    - [222, 257.35]
  - - [1024, 9216, 1, 5120]
    - [223, 261.42]
  - - [1024, 9728, 1, 5120]
    - [223, 268.2]
  - - [1024, 9984, 1, 5120]
    - [224, 254.29]
  - - [1024, 10240, 1, 5120]
    - [224, 258.71]
  - - [1024, 10752, 1, 5120]
    - [224, 263.53]
  - - [1024, 11264, 1, 5120]
    - [192, 269.01]
  - - [1024, 11520, 1, 5120]
    - [208, 270.95]
  - - [1024, 11776, 1, 5120]
    - [192, 276.67]
  - - [1024, 12288, 1, 5120]
    - [185, 258.68]
  - - [1024, 12544, 1, 5120]
    - [187, 260.14]
  - - [1024, 12800, 1, 5120]
    - [225, 265.28]
  - - [1024, 13056, 1, 5120]
    - [225, 266.36]
  - - [1024, 13312, 1, 5120]
    - [226, 266.42]
  - - [1024, 13824, 1, 5120]
    - [189, 272.0]
  - - [1024, 14080, 1, 5120]
    - [189, 273.31]
  - - [1024, 14336, 1, 5120]
    - [189, 276.1]
  - - [1024, 14592, 1, 5120]
    - [189, 280.23]
  - - [1024, 14848, 1, 5120]
    - [190, 263.67]
  - - [1024, 15360, 1, 5120]
    - [227, 267.58]
  - - [1024, 15872, 1, 5120]
    - [227, 272.17]
  - - [1024, 16128, 1, 5120]
    - [209, 275.45]
  - - [1024, 16384, 1, 5120]
    - [191, 274.97]
  - - [1024, 16640, 1, 5120]
    - [227, 281.97]
  - - [1024, 16896, 1, 5120]
    - [228, 279.22]
  - - [1024, 17408, 1, 5120]
    - [229, 268.48]
  - - [1024, 17664, 1, 5120]
    - [201, 270.89]
  - - [1024, 17920, 1, 5120]
    - [230, 271.23]
  - - [1024, 18432, 1, 5120]
    - [199, 274.61]
  - - [1024, 19200, 1, 5120]
    - [199, 280.97]
  - - [1024, 19456, 1, 5120]
    - [206, 281.42]
  - - [1024, 19712, 1, 5120]
    - [188, 260.44]
  - - [1024, 19968, 1, 5120]
    - [188, 264.1]
  - - [1024, 20480, 1, 5120]
    - [188, 265.65]
  - - [1024, 20736, 1, 5120]
    - [188, 268.68]
  - - [1024, 21504, 1, 5120]
    - [231, 271.92]
  - - [1024, 21760, 1, 5120]
    - [137, 272.59]
  - - [1024, 22272, 1, 5120]
    - [192, 265.98]
  - - [1024, 22528, 1, 5120]
    - [232, 266.48]
  - - [1024, 23040, 1, 5120]
    - [192, 271.42]
  - - [1024, 23296, 1, 5120]
    - [192, 275.85]
  - - [1024, 23552, 1, 5120]
    - [192, 273.3]
  - - [1024, 23808, 1, 5120]
    - [192, 279.08]
  - - [1024, 24320, 1, 5120]
    - [192, 280.99]
  - - [1024, 24576, 1, 5120]
    - [225, 260.36]
  - - [1024, 25088, 1, 5120]
    - [233, 263.27]
  - - [1024, 25344, 1, 5120]
    - [226, 264.38]
  - - [1024, 25600, 1, 5120]
    - [194, 265.99]
  - - [1024, 26112, 1, 5120]
    - [225, 270.0]
  - - [1024, 26624, 1, 5120]
    - [137, 269.39]
  - - [1024, 26880, 1, 5120]
    - [202, 268.63]
  - - [1024, 27648, 1, 5120]
    - [234, 276.73]
  - - [1024, 28160, 1, 5120]
    - [189, 281.33]
  - - [1024, 28672, 1, 5120]
    - [189, 281.52]
  - - [1024, 29184, 1, 5120]
    - [189, 284.12]
  - - [1024, 29440, 1, 5120]
    - [227, 270.16]
  - - [1024, 29696, 1, 5120]
    - [227, 272.06]
  - - [1024, 29952, 1, 5120]
    - [228, 270.31]
  - - [1024, 30464, 1, 5120]
    - [228, 274.28]
  - - [1024, 30720, 1, 5120]
    - [228, 273.24]
  - - [1024, 30976, 1, 5120]
    - [235, 275.29]
  - - [1024, 31744, 1, 5120]
    - [227, 276.98]
  - - [1024, 32000, 1, 5120]
    - [228, 277.02]
  - - [1024, 32256, 1, 5120]
    - [200, 283.82]
  - - [1024, 32768, 1, 5120]
    - [209, 286.02]
  - - [1024, 33280, 1, 5120]
    - [228, 285.8]
  - - [1024, 33792, 1, 5120]
    - [228, 292.59]
  - - [1024, 34048, 1, 5120]
    - [228, 293.33]
  - - [1024, 34560, 1, 5120]
    - [183, 278.28]
  - - [1024, 34816, 1, 5120]
    - [236, 281.91]
  - - [1024, 35328, 1, 5120]
    - [232, 285.46]
  - - [1024, 35840, 1, 5120]
    - [183, 283.06]
  - - [1024, 36608, 1, 5120]
    - [193, 281.2]
  - - [1024, 36864, 1, 5120]
    - [201, 284.28]
  - - [1024, 37120, 1, 5120]
    - [201, 285.63]
  - - [1024, 37632, 1, 5120]
    - [230, 288.33]
  - - [1024, 38400, 1, 5120]
    - [230, 288.73]
  - - [1024, 38912, 1, 5120]
    - [199, 290.65]
  - - [1024, 39168, 1, 5120]
    - [225, 277.75]
  - - [1024, 39424, 1, 5120]
    - [225, 278.42]
  - - [1024, 39680, 1, 5120]
    - [234, 278.08]
  - - [1024, 39936, 1, 5120]
    - [225, 277.41]
  - - [1024, 40960, 1, 5120]
    - [189, 281.31]
  - - [1024, 41216, 1, 5120]
    - [189, 281.26]
  - - [1024, 41472, 1, 5120]
    - [185, 281.37]
  - - [1024, 42240, 1, 5120]
    - [137, 281.42]
  - - [1024, 43008, 1, 5120]
    - [189, 286.96]
  - - [1024, 43264, 1, 5120]
    - [189, 289.9]
  - - [1024, 43520, 1, 5120]
    - [189, 291.5]
  - - [1024, 43776, 1, 5120]
    - [189, 290.25]
  - - [1024, 44544, 1, 5120]
    - [184, 280.21]
  - - [1024, 44800, 1, 5120]
    - [208, 280.08]
  - - [1024, 45056, 1, 5120]
    - [184, 283.0]
  - - [1024, 46080, 1, 5120]
    - [183, 281.53]
  - - [1024, 46592, 1, 5120]
    - [208, 285.43]
  - - [1024, 47104, 1, 5120]
    - [232, 286.41]
  - - [1024, 47616, 1, 5120]
    - [232, 287.79]
  - - [1024, 47872, 1, 5120]
    - [232, 290.47]
  - - [1024, 48384, 1, 5120]
    - [192, 296.2]
  - - [1024, 48640, 1, 5120]
    - [232, 292.19]
  - - [1024, 49152, 1, 5120]
    - [228, 291.22]
  - - [1024, 49920, 1, 5120]
    - [227, 291.86]
  - - [1024, 50176, 1, 5120]
    - [227, 294.9]
  - - [1024, 50688, 1, 5120]
    - [228, 293.48]
  - - [1024, 51200, 1, 5120]
    - [229, 277.9]
  - - [1024, 51968, 1, 5120]
    - [229, 280.4]
  - - [1024, 52224, 1, 5120]
    - [201, 280.78]
  - - [1024, 52992, 1, 5120]
    - [234, 281.91]
  - - [1024, 53248, 1, 5120]
    - [229, 280.82]
  - - [1024, 53504, 1, 5120]
    - [229, 282.82]
  - - [1024, 53760, 1, 5120]
    - [193, 286.46]
  - - [1024, 55296, 1, 5120]
    - [206, 291.11]
  - - [1024, 55552, 1, 5120]
    - [201, 290.6]
  - - [1024, 56320, 1, 5120]
    - [181, 291.81]
  - - [1024, 56576, 1, 5120]
    - [193, 291.32]
  - - [1024, 57344, 1, 5120]
    - [199, 292.98]
  - - [1024, 57600, 1, 5120]
    - [193, 293.32]
  - - [1024, 58368, 1, 5120]
    - [206, 295.84]
  - - [1024, 58880, 1, 5120]
    - [236, 290.24]
  - - [1024, 59136, 1, 5120]
    - [232, 290.03]
  - - [1024, 59392, 1, 5120]
    - [192, 291.78]
  - - [1024, 59904, 1, 5120]
    - [232, 290.53]
  - - [1024, 60928, 1, 5120]
    - [190, 284.55]
  - - [1024, 61440, 1, 5120]
    - [137, 284.14]
  - - [1024, 61952, 1, 5120]
    - [227, 284.56]
  - - [1024, 62208, 1, 5120]
    - [190, 285.73]
  - - [1024, 63232, 1, 5120]
    - [190, 285.96]
  - - [1024, 63488, 1, 5120]
    - [227, 286.84]
  - - [1024, 64000, 1, 5120]
    - [191, 288.33]
  - - [1024, 64512, 1, 5120]
    - [227, 291.71]
  - - [1024, 64768, 1, 5120]
    - [191, 292.24]
  - - [1024, 65280, 1, 5120]
    - [227, 294.82]
  - - [1024, 65536, 1, 5120]
    - [228, 294.49]
  - - [1024, 66560, 1, 5120]
    - [200, 294.32]
  - - [1024, 66816, 1, 5120]
    - [227, 297.16]
  - - [1024, 67584, 1, 5120]
    - [227, 299.73]
  - - [1024, 68096, 1, 5120]
    - [228, 298.21]
  - - [1024, 69120, 1, 5120]
    - [234, 289.94]
  - - [1024, 69632, 1, 5120]
    - [137, 287.84]
  - - [1024, 69888, 1, 5120]
    - [189, 291.11]
  - - [1024, 70400, 1, 5120]
    - [234, 292.48]
  - - [1024, 70656, 1, 5120]
    - [234, 291.96]
  - - [1024, 71424, 1, 5120]
    - [234, 293.66]
  - - [1024, 71680, 1, 5120]
    - [234, 292.75]
  - - [1024, 72960, 1, 5120]
    - [189, 293.68]
  - - [1024, 73216, 1, 5120]
    - [201, 293.36]
  - - [1024, 73728, 1, 5120]
    - [206, 292.73]
  - - [1024, 74240, 1, 5120]
    - [201, 294.95]
  - - [1024, 75264, 1, 5120]
    - [206, 294.6]
  - - [1024, 76032, 1, 5120]
    - [206, 294.28]
  - - [1024, 76544, 1, 5120]
    - [206, 296.5]
  - - [1024, 76800, 1, 5120]
    - [199, 296.5]
  - - [1024, 77824, 1, 5120]
    - [199, 299.36]
  - - [1024, 78848, 1, 5120]
    - [191, 291.11]
  - - [1024, 79360, 1, 5120]
    - [228, 290.52]
  - - [1024, 79872, 1, 5120]
    - [227, 294.61]
  - - [1024, 80640, 1, 5120]
    - [228, 294.01]
  - - [1024, 81664, 1, 5120]
    - [227, 296.41]
  - - [1024, 81920, 1, 5120]
    - [228, 296.24]
  - - [1024, 82432, 1, 5120]
    - [227, 298.85]
  - - [1024, 82944, 1, 5120]
    - [228, 298.67]
  - - [1024, 83200, 1, 5120]
    - [227, 299.74]
  - - [1024, 84480, 1, 5120]
    - [227, 301.41]
  - - [1024, 86016, 1, 5120]
    - [189, 295.67]
  - - [1024, 86528, 1, 5120]
    - [189, 296.32]
  - - [1024, 87296, 1, 5120]
    - [189, 297.72]
  - - [1024, 88320, 1, 5120]
    - [201, 290.13]
  - - [1024, 89088, 1, 5120]
    - [201, 290.79]
  - - [1024, 89600, 1, 5120]
    - [193, 291.07]
  - - [1024, 89856, 1, 5120]
    - [199, 292.28]
  - - [1024, 90112, 1, 5120]
    - [206, 292.45]
  - - [1024, 92160, 1, 5120]
    - [206, 295.01]
  - - [1024, 93184, 1, 5120]
    - [206, 295.45]
  - - [1024, 94208, 1, 5120]
    - [206, 295.74]
  - - [1024, 95232, 1, 5120]
    - [206, 298.25]
  - - [1024, 96000, 1, 5120]
    - [199, 298.03]
  - - [1024, 96512, 1, 5120]
    - [206, 300.31]
  - - [1024, 96768, 1, 5120]
    - [199, 299.02]
  - - [1024, 98304, 1, 5120]
    - [227, 300.61]
  - - [1024, 99840, 1, 5120]
    - [227, 302.86]
  - - [1024, 100352, 1, 5120]
    - [228, 298.86]
  - - [1024, 102400, 1, 5120]
    - [232, 294.02]
  - - [1024, 103168, 1, 5120]
    - [192, 293.1]
  - - [1024, 103680, 1, 5120]
    - [232, 292.82]
  - - [1024, 103936, 1, 5120]
    - [192, 294.0]
  - - [1024, 106496, 1, 5120]
    - [192, 295.15]
  - - [1024, 107520, 1, 5120]
    - [232, 295.75]
  - - [1024, 110592, 1, 5120]
    - [227, 295.08]
  - - [1024, 111104, 1, 5120]
    - [227, 295.7]
  - - [1024, 111360, 1, 5120]
    - [201, 295.5]
  - - [1024, 114688, 1, 5120]
    - [206, 299.71]
  - - [1024, 115200, 1, 5120]
    - [206, 299.09]
  - - [1024, 118784, 1, 5120]
    - [228, 300.25]
  - - [1024, 119040, 1, 5120]
    - [227, 302.51]
  - - [1024, 122880, 1, 5120]
    - [227, 290.35]
  - - [1024, 126976, 1, 5120]
    - [227, 294.69]
  - - [1024, 131072, 1, 5120]
    - [206, 297.77]
  - - [2048, 4352, 1, 5120]
    - [237, 256.09]
  - - [2048, 4608, 1, 5120]
    - [223, 266.46]
  - - [2048, 4864, 1, 5120]
    - [238, 272.88]
  - - [2048, 5120, 1, 5120]
    - [183, 264.14]
  - - [2048, 5376, 1, 5120]
    - [224, 270.71]
  - - [2048, 5632, 1, 5120]
    - [192, 270.89]
  - - [2048, 5888, 1, 5120]
    - [183, 278.45]
  - - [2048, 6144, 1, 5120]
    - [225, 269.59]
  - - [2048, 6400, 1, 5120]
    - [225, 270.87]
  - - [2048, 6656, 1, 5120]
    - [225, 277.39]
  - - [2048, 6912, 1, 5120]
    - [189, 277.88]
  - - [2048, 7168, 1, 5120]
    - [186, 280.73]
  - - [2048, 7424, 1, 5120]
    - [195, 272.59]
  - - [2048, 7680, 1, 5120]
    - [227, 276.39]
  - - [2048, 7936, 1, 5120]
    - [227, 283.05]
  - - [2048, 8192, 1, 5120]
    - [227, 283.53]
  - - [2048, 8448, 1, 5120]
    - [227, 287.64]
  - - [2048, 8704, 1, 5120]
    - [201, 277.79]
  - - [2048, 8960, 1, 5120]
    - [206, 283.73]
  - - [2048, 9216, 1, 5120]
    - [206, 284.48]
  - - [2048, 9728, 1, 5120]
    - [199, 289.21]
  - - [2048, 9984, 1, 5120]
    - [182, 271.77]
  - - [2048, 10240, 1, 5120]
    - [182, 271.84]
  - - [2048, 10752, 1, 5120]
    - [182, 281.23]
  - - [2048, 11264, 1, 5120]
    - [183, 274.0]
  - - [2048, 11520, 1, 5120]
    - [208, 278.24]
  - - [2048, 11776, 1, 5120]
    - [208, 280.17]
  - - [2048, 12288, 1, 5120]
    - [239, 271.16]
  - - [2048, 12544, 1, 5120]
    - [225, 275.78]
  - - [2048, 12800, 1, 5120]
    - [240, 275.81]
  - - [2048, 13056, 1, 5120]
    - [189, 274.85]
  - - [2048, 13312, 1, 5120]
    - [233, 280.43]
  - - [2048, 13824, 1, 5120]
    - [234, 280.23]
  - - [2048, 14080, 1, 5120]
    - [185, 284.32]
  - - [2048, 14336, 1, 5120]
    - [185, 288.12]
  - - [2048, 14592, 1, 5120]
    - [202, 288.98]
  - - [2048, 14848, 1, 5120]
    - [191, 277.06]
  - - [2048, 15360, 1, 5120]
    - [241, 282.72]
  - - [2048, 15872, 1, 5120]
    - [227, 285.3]
  - - [2048, 16128, 1, 5120]
    - [227, 289.34]
  - - [2048, 16384, 1, 5120]
    - [228, 288.85]
  - - [2048, 16640, 1, 5120]
    - [209, 295.91]
  - - [2048, 16896, 1, 5120]
    - [228, 297.26]
  - - [2048, 17408, 1, 5120]
    - [188, 285.68]
  - - [2048, 17664, 1, 5120]
    - [236, 287.62]
  - - [2048, 17920, 1, 5120]
    - [192, 287.38]
  - - [2048, 18432, 1, 5120]
    - [206, 290.34]
  - - [2048, 19200, 1, 5120]
    - [230, 295.99]
  - - [2048, 19456, 1, 5120]
    - [242, 298.03]
  - - [2048, 19712, 1, 5120]
    - [225, 283.78]
  - - [2048, 19968, 1, 5120]
    - [225, 283.88]
  - - [2048, 20480, 1, 5120]
    - [210, 286.77]
  - - [2048, 20736, 1, 5120]
    - [189, 285.99]
  - - [2048, 21504, 1, 5120]
    - [202, 293.2]
  - - [2048, 21760, 1, 5120]
    - [202, 291.66]
  - - [2048, 22272, 1, 5120]
    - [192, 284.7]
  - - [2048, 22528, 1, 5120]
    - [228, 283.85]
  - - [2048, 23040, 1, 5120]
    - [227, 286.92]
  - - [2048, 23296, 1, 5120]
    - [184, 292.8]
  - - [2048, 23552, 1, 5120]
    - [190, 293.99]
  - - [2048, 23808, 1, 5120]
    - [183, 294.26]
  - - [2048, 24320, 1, 5120]
    - [208, 300.55]
  - - [2048, 24576, 1, 5120]
    - [227, 293.49]
  - - [2048, 25088, 1, 5120]
    - [191, 301.95]
  - - [2048, 25344, 1, 5120]
    - [190, 297.94]
  - - [2048, 25600, 1, 5120]
    - [181, 283.85]
  - - [2048, 26112, 1, 5120]
    - [206, 286.6]
  - - [2048, 26624, 1, 5120]
    - [199, 287.46]
  - - [2048, 26880, 1, 5120]
    - [206, 291.48]
  - - [2048, 27648, 1, 5120]
    - [185, 294.28]
  - - [2048, 28160, 1, 5120]
    - [193, 298.62]
  - - [2048, 28672, 1, 5120]
    - [206, 304.25]
  - - [2048, 29184, 1, 5120]
    - [243, 301.62]
  - - [2048, 29440, 1, 5120]
    - [192, 299.22]
  - - [2048, 29696, 1, 5120]
    - [183, 296.03]
  - - [2048, 29952, 1, 5120]
    - [232, 298.41]
  - - [2048, 30464, 1, 5120]
    - [228, 289.55]
  - - [2048, 30720, 1, 5120]
    - [227, 290.93]
  - - [2048, 30976, 1, 5120]
    - [227, 291.92]
  - - [2048, 31744, 1, 5120]
    - [227, 297.45]
  - - [2048, 32000, 1, 5120]
    - [227, 297.28]
  - - [2048, 32256, 1, 5120]
    - [191, 300.74]
  - - [2048, 32768, 1, 5120]
    - [228, 295.43]
  - - [2048, 33280, 1, 5120]
    - [191, 303.97]
  - - [2048, 33792, 1, 5120]
    - [227, 303.14]
  - - [2048, 34048, 1, 5120]
    - [228, 303.41]
  - - [2048, 34560, 1, 5120]
    - [234, 293.4]
  - - [2048, 34816, 1, 5120]
    - [234, 295.73]
  - - [2048, 35328, 1, 5120]
    - [208, 299.94]
  - - [2048, 35840, 1, 5120]
    - [210, 301.84]
  - - [2048, 36608, 1, 5120]
    - [206, 298.0]
  - - [2048, 36864, 1, 5120]
    - [206, 299.74]
  - - [2048, 37120, 1, 5120]
    - [206, 304.52]
  - - [2048, 37632, 1, 5120]
    - [201, 301.93]
  - - [2048, 38400, 1, 5120]
    - [243, 306.21]
  - - [2048, 38912, 1, 5120]
    - [206, 310.15]
  - - [2048, 39168, 1, 5120]
    - [190, 297.78]
  - - [2048, 39424, 1, 5120]
    - [227, 297.92]
  - - [2048, 39680, 1, 5120]
    - [227, 299.76]
  - - [2048, 39936, 1, 5120]
    - [228, 298.51]
  - - [2048, 40960, 1, 5120]
    - [191, 305.43]
  - - [2048, 41216, 1, 5120]
    - [209, 306.2]
  - - [2048, 41472, 1, 5120]
    - [191, 308.04]
  - - [2048, 42240, 1, 5120]
    - [227, 310.82]
  - - [2048, 43008, 1, 5120]
    - [189, 303.68]
  - - [2048, 43264, 1, 5120]
    - [234, 303.3]
  - - [2048, 43520, 1, 5120]
    - [210, 304.49]
  - - [2048, 43776, 1, 5120]
    - [189, 306.11]
  - - [2048, 44544, 1, 5120]
    - [193, 297.63]
  - - [2048, 44800, 1, 5120]
    - [201, 299.1]
  - - [2048, 45056, 1, 5120]
    - [206, 301.48]
  - - [2048, 46080, 1, 5120]
    - [181, 304.54]
  - - [2048, 46592, 1, 5120]
    - [206, 308.3]
  - - [2048, 47104, 1, 5120]
    - [206, 307.35]
  - - [2048, 47616, 1, 5120]
    - [206, 309.7]
  - - [2048, 47872, 1, 5120]
    - [181, 307.76]
  - - [2048, 48384, 1, 5120]
    - [181, 309.56]
  - - [2048, 48640, 1, 5120]
    - [199, 309.59]
  - - [2048, 49152, 1, 5120]
    - [227, 310.16]
  - - [2048, 49920, 1, 5120]
    - [227, 310.0]
  - - [2048, 50176, 1, 5120]
    - [190, 310.79]
  - - [2048, 50688, 1, 5120]
    - [227, 312.32]
  - - [2048, 51200, 1, 5120]
    - [183, 297.36]
  - - [2048, 51968, 1, 5120]
    - [192, 299.34]
  - - [2048, 52224, 1, 5120]
    - [236, 298.4]
  - - [2048, 52992, 1, 5120]
    - [183, 302.74]
  - - [2048, 53248, 1, 5120]
    - [192, 304.45]
  - - [2048, 53504, 1, 5120]
    - [192, 302.63]
  - - [2048, 53760, 1, 5120]
    - [183, 303.72]
  - - [2048, 55296, 1, 5120]
    - [199, 303.15]
  - - [2048, 55552, 1, 5120]
    - [206, 304.94]
  - - [2048, 56320, 1, 5120]
    - [206, 306.15]
  - - [2048, 56576, 1, 5120]
    - [206, 308.45]
  - - [2048, 57344, 1, 5120]
    - [206, 308.64]
  - - [2048, 57600, 1, 5120]
    - [181, 309.73]
  - - [2048, 58368, 1, 5120]
    - [206, 311.8]
  - - [2048, 58880, 1, 5120]
    - [190, 310.37]
  - - [2048, 59136, 1, 5120]
    - [227, 311.71]
  - - [2048, 59392, 1, 5120]
    - [227, 313.73]
  - - [2048, 59904, 1, 5120]
    - [184, 303.66]
  - - [2048, 60928, 1, 5120]
    - [189, 297.12]
  - - [2048, 61440, 1, 5120]
    - [189, 298.13]
  - - [2048, 61952, 1, 5120]
    - [189, 298.75]
  - - [2048, 62208, 1, 5120]
    - [206, 301.39]
  - - [2048, 63232, 1, 5120]
    - [227, 303.53]
  - - [2048, 63488, 1, 5120]
    - [190, 302.26]
  - - [2048, 64000, 1, 5120]
    - [227, 305.75]
  - - [2048, 64512, 1, 5120]
    - [227, 305.88]
  - - [2048, 64768, 1, 5120]
    - [185, 306.09]
  - - [2048, 65280, 1, 5120]
    - [206, 307.74]
  - - [2048, 65536, 1, 5120]
    - [227, 307.18]
  - - [2048, 66560, 1, 5120]
    - [206, 310.66]
  - - [2048, 66816, 1, 5120]
    - [201, 309.51]
  - - [2048, 67584, 1, 5120]
    - [206, 312.24]
  - - [2048, 68096, 1, 5120]
    - [206, 313.65]
  - - [2048, 69120, 1, 5120]
    - [189, 300.29]
  - - [2048, 69632, 1, 5120]
    - [189, 301.48]
  - - [2048, 69888, 1, 5120]
    - [192, 301.34]
  - - [2048, 70400, 1, 5120]
    - [192, 302.0]
  - - [2048, 70656, 1, 5120]
    - [234, 303.52]
  - - [2048, 71424, 1, 5120]
    - [189, 304.99]
  - - [2048, 71680, 1, 5120]
    - [192, 304.33]
  - - [2048, 72960, 1, 5120]
    - [189, 306.66]
  - - [2048, 73216, 1, 5120]
    - [228, 308.25]
  - - [2048, 73728, 1, 5120]
    - [227, 307.58]
  - - [2048, 74240, 1, 5120]
    - [227, 310.71]
  - - [2048, 75264, 1, 5120]
    - [190, 310.72]
  - - [2048, 76032, 1, 5120]
    - [228, 311.31]
  - - [2048, 76544, 1, 5120]
    - [227, 312.35]
  - - [2048, 76800, 1, 5120]
    - [206, 312.41]
  - - [2048, 77824, 1, 5120]
    - [201, 312.15]
  - - [2048, 78848, 1, 5120]
    - [192, 307.04]
  - - [2048, 79360, 1, 5120]
    - [234, 305.42]
  - - [2048, 79872, 1, 5120]
    - [189, 306.5]
  - - [2048, 80640, 1, 5120]
    - [191, 305.35]
  - - [2048, 81664, 1, 5120]
    - [227, 309.48]
  - - [2048, 81920, 1, 5120]
    - [227, 308.47]
  - - [2048, 82432, 1, 5120]
    - [191, 306.59]
  - - [2048, 82944, 1, 5120]
    - [228, 307.49]
  - - [2048, 83200, 1, 5120]
    - [227, 310.78]
  - - [2048, 84480, 1, 5120]
    - [227, 315.79]
  - - [2048, 86016, 1, 5120]
    - [206, 309.6]
  - - [2048, 86528, 1, 5120]
    - [206, 311.91]
  - - [2048, 87296, 1, 5120]
    - [206, 312.84]
  - - [2048, 88320, 1, 5120]
    - [227, 303.69]
  - - [2048, 89088, 1, 5120]
    - [227, 305.98]
  - - [2048, 89600, 1, 5120]
    - [191, 305.88]
  - - [2048, 89856, 1, 5120]
    - [227, 307.44]
  - - [2048, 90112, 1, 5120]
    - [191, 307.05]
  - - [2048, 92160, 1, 5120]
    - [227, 311.7]
  - - [2048, 93184, 1, 5120]
    - [227, 313.3]
  - - [2048, 94208, 1, 5120]
    - [206, 307.16]
  - - [2048, 95232, 1, 5120]
    - [206, 308.1]
  - - [2048, 96000, 1, 5120]
    - [201, 308.37]
  - - [2048, 96512, 1, 5120]
    - [206, 309.52]
  - - [2048, 96768, 1, 5120]
    - [206, 310.41]
  - - [2048, 98304, 1, 5120]
    - [227, 307.59]
  - - [2048, 99840, 1, 5120]
    - [227, 311.1]
  - - [2048, 100352, 1, 5120]
    - [228, 309.94]
  - - [2048, 102400, 1, 5120]
    - [206, 306.48]
  - - [2048, 103168, 1, 5120]
    - [206, 306.19]
  - - [2048, 103680, 1, 5120]
    - [206, 306.15]
  - - [2048, 103936, 1, 5120]
    - [206, 307.62]
  - - [2048, 106496, 1, 5120]
    - [206, 311.32]
  - - [2048, 107520, 1, 5120]
    - [227, 309.11]
  - - [2048, 110592, 1, 5120]
    - [228, 312.91]
  - - [2048, 111104, 1, 5120]
    - [206, 303.68]
  - - [2048, 111360, 1, 5120]
    - [206, 304.27]
  - - [2048, 114688, 1, 5120]
    - [206, 308.78]
  - - [2048, 115200, 1, 5120]
    - [206, 309.77]
  - - [2048, 118784, 1, 5120]
    - [227, 313.33]
  - - [2048, 119040, 1, 5120]
    - [227, 313.37]
  - - [2048, 122880, 1, 5120]
    - [206, 307.64]
  - - [2048, 126976, 1, 5120]
    - [227, 312.06]
  - - [2048, 131072, 1, 5120]
    - [206, 307.2]
  - - [16384, 4352, 1, 5120]
    - [244, 323.2]
  - - [16384, 4608, 1, 5120]
    - [156, 318.23]
  - - [16384, 4864, 1, 5120]
    - [201, 325.33]
  - - [16384, 5120, 1, 5120]
    - [200, 321.63]
  - - [16384, 5376, 1, 5120]
    - [244, 325.47]
  - - [16384, 5632, 1, 5120]
    - [188, 317.52]
  - - [16384, 5888, 1, 5120]
    - [181, 323.89]
  - - [16384, 6144, 1, 5120]
    - [182, 326.24]
  - - [16384, 6400, 1, 5120]
    - [197, 322.76]
  - - [16384, 6656, 1, 5120]
    - [244, 330.98]
  - - [16384, 6912, 1, 5120]
    - [188, 323.54]
  - - [16384, 7168, 1, 5120]
    - [182, 328.72]
  - - [16384, 7424, 1, 5120]
    - [182, 325.26]
  - - [16384, 7680, 1, 5120]
    - [245, 332.05]
  - - [16384, 7936, 1, 5120]
    - [182, 326.63]
  - - [16384, 8192, 1, 5120]
    - [209, 328.19]
  - - [16384, 8448, 1, 5120]
    - [201, 332.47]
  - - [16384, 8704, 1, 5120]
    - [197, 333.66]
  - - [16384, 8960, 1, 5120]
    - [245, 340.34]
  - - [16384, 9216, 1, 5120]
    - [155, 331.26]
  - - [16384, 9728, 1, 5120]
    - [181, 336.77]
  - - [16384, 9984, 1, 5120]
    - [244, 337.75]
  - - [16384, 10240, 1, 5120]
    - [172, 335.42]
  - - [16384, 10752, 1, 5120]
    - [181, 333.33]
  - - [16384, 11264, 1, 5120]
    - [188, 332.36]
  - - [16384, 11520, 1, 5120]
    - [191, 333.39]
  - - [16384, 11776, 1, 5120]
    - [182, 332.27]
  - - [16384, 12288, 1, 5120]
    - [244, 340.6]
  - - [16384, 12544, 1, 5120]
    - [200, 337.49]
  - - [16384, 12800, 1, 5120]
    - [172, 331.44]
  - - [16384, 13056, 1, 5120]
    - [181, 333.31]
  - - [16384, 13312, 1, 5120]
    - [181, 336.97]
  - - [16384, 13824, 1, 5120]
    - [177, 331.25]
  - - [16384, 14080, 1, 5120]
    - [182, 333.39]
  - - [16384, 14336, 1, 5120]
    - [197, 335.58]
  - - [16384, 14592, 1, 5120]
    - [181, 335.61]
  - - [16384, 14848, 1, 5120]
    - [155, 331.51]
  - - [16384, 15360, 1, 5120]
    - [196, 333.7]
  - - [16384, 15872, 1, 5120]
    - [200, 336.08]
  - - [16384, 16128, 1, 5120]
    - [188, 330.9]
  - - [16384, 16384, 1, 5120]
    - [182, 333.39]
  - - [16384, 16640, 1, 5120]
    - [197, 335.5]
  - - [16384, 16896, 1, 5120]
    - [197, 337.31]
  - - [16384, 17408, 1, 5120]
    - [182, 331.19]
  - - [16384, 17664, 1, 5120]
    - [197, 334.04]
  - - [16384, 17920, 1, 5120]
    - [200, 338.7]
  - - [16384, 18432, 1, 5120]
    - [182, 331.25]
  - - [16384, 19200, 1, 5120]
    - [197, 339.01]
  - - [16384, 19456, 1, 5120]
    - [201, 335.52]
  - - [16384, 19712, 1, 5120]
    - [191, 331.57]
  - - [16384, 19968, 1, 5120]
    - [196, 333.34]
  - - [16384, 20480, 1, 5120]
    - [181, 333.92]
  - - [16384, 20736, 1, 5120]
    - [182, 331.29]
  - - [16384, 21504, 1, 5120]
    - [181, 332.46]
  - - [16384, 21760, 1, 5120]
    - [181, 333.89]
  - - [16384, 22272, 1, 5120]
    - [196, 333.79]
  - - [16384, 22528, 1, 5120]
    - [245, 338.28]
  - - [16384, 23040, 1, 5120]
    - [181, 334.41]
  - - [16384, 23296, 1, 5120]
    - [191, 336.02]
  - - [16384, 23552, 1, 5120]
    - [197, 335.09]
  - - [16384, 23808, 1, 5120]
    - [181, 331.17]
  - - [16384, 24320, 1, 5120]
    - [181, 335.89]
  - - [16384, 24576, 1, 5120]
    - [197, 334.11]
  - - [16384, 25088, 1, 5120]
    - [191, 332.8]
  - - [16384, 25200, 1, 5120]
    - [200, 332.72]
  - - [16384, 25344, 1, 5120]
    - [181, 333.29]
  - - [16384, 25600, 1, 5120]
    - [197, 335.04]
  - - [16384, 26112, 1, 5120]
    - [191, 331.06]
  - - [16384, 26624, 1, 5120]
    - [181, 333.19]
  - - [16384, 26880, 1, 5120]
    - [197, 336.45]
  - - [16384, 27648, 1, 5120]
    - [196, 333.16]
  - - [16384, 28160, 1, 5120]
    - [197, 336.08]
  - - [16384, 28672, 1, 5120]
    - [191, 337.39]
  - - [16384, 29184, 1, 5120]
    - [197, 339.22]
  - - [16384, 29440, 1, 5120]
    - [191, 332.3]
  - - [16384, 29696, 1, 5120]
    - [200, 336.7]
  - - [16384, 29952, 1, 5120]
    - [197, 334.51]
  - - [16384, 30464, 1, 5120]
    - [191, 332.68]
  - - [16384, 30720, 1, 5120]
    - [197, 331.07]
  - - [16384, 30976, 1, 5120]
    - [197, 333.62]
  - - [16384, 31744, 1, 5120]
    - [200, 335.15]
  - - [16384, 32000, 1, 5120]
    - [197, 332.76]
  - - [16384, 32256, 1, 5120]
    - [197, 332.64]
  - - [16384, 32768, 1, 5120]
    - [197, 337.98]
  - - [5120, 10240, 1, 640]
    - [413, 209.53]
  - - [5120, 10752, 1, 640]
    - [400, 213.67]
  - - [5120, 11264, 1, 640]
    - [409, 220.6]
  - - [5120, 11520, 1, 640]
    - [401, 220.59]
  - - [5120, 11776, 1, 640]
    - [408, 209.41]
  - - [5120, 12288, 1, 640]
    - [408, 215.07]
  - - [5120, 12544, 1, 640]
    - [410, 214.67]
  - - [5120, 12800, 1, 640]
    - [410, 217.47]
  - - [5120, 13056, 1, 640]
    - [408, 220.27]
  - - [5120, 13312, 1, 640]
    - [412, 217.8]
  - - [5120, 13824, 1, 640]
    - [408, 220.46]
  - - [5120, 14080, 1, 640]
    - [414, 217.15]
  - - [5120, 14336, 1, 640]
    - [409, 216.78]
  - - [5120, 14592, 1, 640]
    - [408, 220.79]
  - - [5120, 14848, 1, 640]
    - [409, 221.22]
  - - [5120, 15360, 1, 640]
    - [401, 224.4]
  - - [5120, 15872, 1, 640]
    - [408, 221.16]
  - - [5120, 16128, 1, 640]
    - [408, 218.47]
  - - [5120, 16384, 1, 640]
    - [408, 218.28]
  - - [5120, 16640, 1, 640]
    - [398, 220.7]
  - - [5120, 16896, 1, 640]
    - [408, 222.97]
  - - [5120, 17408, 1, 640]
    - [408, 221.88]
  - - [5120, 17664, 1, 640]
    - [408, 220.07]
  - - [5120, 17920, 1, 640]
    - [410, 218.41]
  - - [5120, 18432, 1, 640]
    - [408, 223.01]
  - - [5120, 19200, 1, 640]
    - [409, 225.22]
  - - [5120, 19456, 1, 640]
    - [401, 226.61]
  - - [5120, 19712, 1, 640]
    - [408, 221.43]
  - - [5120, 19968, 1, 640]
    - [408, 224.64]
  - - [5120, 20480, 1, 640]
    - [408, 221.8]
  - - [5120, 20736, 1, 640]
    - [408, 222.25]
  - - [5120, 21504, 1, 640]
    - [408, 224.34]
  - - [5120, 21760, 1, 640]
    - [408, 225.04]
  - - [5120, 22272, 1, 640]
    - [408, 223.12]
  - - [5120, 22528, 1, 640]
    - [408, 223.55]
  - - [5120, 23040, 1, 640]
    - [401, 225.94]
  - - [5120, 23296, 1, 640]
    - [401, 227.93]
  - - [5120, 23552, 1, 640]
    - [412, 223.11]
  - - [5120, 23808, 1, 640]
    - [408, 223.41]
  - - [5120, 24320, 1, 640]
    - [408, 222.57]
  - - [5120, 24576, 1, 640]
    - [408, 226.61]
  - - [5120, 25088, 1, 640]
    - [408, 222.54]
  - - [5120, 25344, 1, 640]
    - [408, 223.46]
  - - [5120, 25600, 1, 640]
    - [408, 225.51]
  - - [5120, 26112, 1, 640]
    - [408, 225.84]
  - - [5120, 26624, 1, 640]
    - [401, 225.57]
  - - [5120, 26880, 1, 640]
    - [408, 226.92]
  - - [5120, 27648, 1, 640]
    - [408, 226.65]
  - - [5120, 28160, 1, 640]
    - [410, 222.91]
  - - [5120, 28672, 1, 640]
    - [408, 227.29]
  - - [5120, 29184, 1, 640]
    - [408, 227.26]
  - - [5120, 29440, 1, 640]
    - [414, 224.23]
  - - [5120, 29696, 1, 640]
    - [410, 225.35]
  - - [5120, 29952, 1, 640]
    - [408, 227.91]
  - - [5120, 30464, 1, 640]
    - [409, 228.18]
  - - [5120, 30720, 1, 640]
    - [409, 227.3]
  - - [5120, 30976, 1, 640]
    - [409, 228.13]
  - - [5120, 31744, 1, 640]
    - [410, 226.53]
  - - [5120, 32000, 1, 640]
    - [414, 227.79]
  - - [5120, 32256, 1, 640]
    - [408, 226.54]
  - - [5120, 32768, 1, 640]
    - [408, 224.06]
  - - [5120, 33280, 1, 640]
    - [408, 230.2]
  - - [5120, 33792, 1, 640]
    - [408, 225.73]
  - - [5120, 34048, 1, 640]
    - [408, 226.11]
  - - [5120, 34560, 1, 640]
    - [408, 229.28]
  - - [5120, 34816, 1, 640]
    - [408, 227.97]
  - - [5120, 35328, 1, 640]
    - [408, 227.71]
  - - [5120, 35840, 1, 640]
    - [408, 227.5]
  - - [5120, 36608, 1, 640]
    - [408, 226.19]
  - - [5120, 36864, 1, 640]
    - [408, 228.17]
  - - [5120, 37120, 1, 640]
    - [408, 227.22]
  - - [5120, 37632, 1, 640]
    - [408, 226.56]
  - - [5120, 38400, 1, 640]
    - [408, 228.73]
  - - [5120, 38912, 1, 640]
    - [401, 228.49]
  - - [5120, 39168, 1, 640]
    - [408, 228.94]
  - - [5120, 39424, 1, 640]
    - [408, 228.31]
  - - [5120, 39680, 1, 640]
    - [408, 228.23]
  - - [5120, 39936, 1, 640]
    - [408, 228.06]
  - - [5120, 40960, 1, 640]
    - [408, 227.21]
  - - [5120, 41216, 1, 640]
    - [408, 228.88]
  - - [5120, 41472, 1, 640]
    - [408, 228.7]
  - - [5120, 42240, 1, 640]
    - [408, 231.9]
  - - [5120, 43008, 1, 640]
    - [408, 228.91]
  - - [5120, 43264, 1, 640]
    - [408, 229.97]
  - - [5120, 43520, 1, 640]
    - [408, 228.44]
  - - [5120, 43776, 1, 640]
    - [408, 230.34]
  - - [5120, 44544, 1, 640]
    - [408, 229.01]
  - - [5120, 44800, 1, 640]
    - [408, 229.3]
  - - [5120, 45056, 1, 640]
    - [408, 229.78]
  - - [5120, 46080, 1, 640]
    - [408, 231.82]
  - - [5120, 46592, 1, 640]
    - [408, 229.75]
  - - [5120, 47104, 1, 640]
    - [410, 228.76]
  - - [5120, 47616, 1, 640]
    - [408, 230.44]
  - - [5120, 47872, 1, 640]
    - [408, 230.94]
  - - [5120, 48384, 1, 640]
    - [408, 230.29]
  - - [5120, 48640, 1, 640]
    - [408, 229.66]
  - - [5120, 49152, 1, 640]
    - [408, 229.47]
  - - [5120, 49920, 1, 640]
    - [401, 230.23]
  - - [5120, 50176, 1, 640]
    - [408, 231.28]
  - - [5120, 50688, 1, 640]
    - [408, 228.99]
  - - [5120, 51200, 1, 640]
    - [408, 228.99]
  - - [5120, 51968, 1, 640]
    - [408, 230.64]
  - - [5120, 52224, 1, 640]
    - [408, 230.78]
  - - [5120, 52992, 1, 640]
    - [408, 229.88]
  - - [5120, 53248, 1, 640]
    - [408, 230.85]
  - - [5120, 53504, 1, 640]
    - [408, 230.7]
  - - [5120, 53760, 1, 640]
    - [408, 231.82]
  - - [5120, 55296, 1, 640]
    - [408, 234.67]
  - - [5120, 55552, 1, 640]
    - [408, 230.68]
  - - [5120, 56320, 1, 640]
    - [408, 232.83]
  - - [5120, 56576, 1, 640]
    - [408, 233.15]
  - - [5120, 57344, 1, 640]
    - [409, 232.0]
  - - [5120, 57600, 1, 640]
    - [408, 231.41]
  - - [5120, 58368, 1, 640]
    - [408, 235.58]
  - - [5120, 58880, 1, 640]
    - [408, 231.28]
  - - [5120, 59136, 1, 640]
    - [408, 232.75]
  - - [5120, 59392, 1, 640]
    - [408, 231.28]
  - - [5120, 59904, 1, 640]
    - [408, 232.16]
  - - [5120, 60928, 1, 640]
    - [408, 233.28]
  - - [5120, 61440, 1, 640]
    - [408, 232.37]
  - - [5120, 61952, 1, 640]
    - [401, 231.77]
  - - [5120, 62208, 1, 640]
    - [408, 231.72]
  - - [5120, 63232, 1, 640]
    - [408, 231.66]
  - - [5120, 63488, 1, 640]
    - [408, 231.45]
  - - [5120, 64000, 1, 640]
    - [408, 234.17]
  - - [5120, 64512, 1, 640]
    - [408, 233.73]
  - - [5120, 64768, 1, 640]
    - [408, 230.49]
  - - [5120, 65280, 1, 640]
    - [408, 233.47]
  - - [5120, 65536, 1, 640]
    - [408, 233.06]
  - - [5120, 66560, 1, 640]
    - [408, 231.49]
  - - [5120, 66816, 1, 640]
    - [408, 233.55]
  - - [5120, 67584, 1, 640]
    - [408, 233.49]
  - - [5120, 68096, 1, 640]
    - [408, 232.55]
  - - [5120, 69120, 1, 640]
    - [408, 232.98]
  - - [5120, 69632, 1, 640]
    - [408, 233.44]
  - - [5120, 69888, 1, 640]
    - [401, 233.41]
  - - [5120, 70400, 1, 640]
    - [408, 233.1]
  - - [5120, 70656, 1, 640]
    - [410, 231.99]
  - - [5120, 71424, 1, 640]
    - [408, 233.77]
  - - [5120, 71680, 1, 640]
    - [408, 235.35]
  - - [5120, 72960, 1, 640]
    - [408, 234.15]
  - - [5120, 73216, 1, 640]
    - [409, 232.78]
  - - [5120, 73728, 1, 640]
    - [408, 233.7]
  - - [5120, 74240, 1, 640]
    - [408, 232.79]
  - - [5120, 75264, 1, 640]
    - [408, 231.63]
  - - [5120, 76032, 1, 640]
    - [410, 233.5]
  - - [5120, 76544, 1, 640]
    - [409, 232.08]
  - - [5120, 76800, 1, 640]
    - [409, 234.65]
  - - [5120, 77824, 1, 640]
    - [401, 234.11]
  - - [5120, 78848, 1, 640]
    - [408, 233.54]
  - - [5120, 79360, 1, 640]
    - [408, 233.92]
  - - [5120, 79872, 1, 640]
    - [408, 237.14]
  - - [5120, 80640, 1, 640]
    - [408, 233.89]
  - - [5120, 81664, 1, 640]
    - [408, 237.3]
  - - [5120, 81920, 1, 640]
    - [408, 233.69]
  - - [5120, 82432, 1, 640]
    - [408, 233.78]
  - - [5120, 82944, 1, 640]
    - [408, 234.7]
  - - [5120, 83200, 1, 640]
    - [408, 232.71]
  - - [5120, 84480, 1, 640]
    - [408, 236.85]
  - - [5120, 86016, 1, 640]
    - [408, 235.1]
  - - [5120, 86528, 1, 640]
    - [408, 233.33]
  - - [5120, 87296, 1, 640]
    - [408, 234.98]
  - - [5120, 88320, 1, 640]
    - [410, 234.63]
  - - [5120, 89088, 1, 640]
    - [408, 234.57]
  - - [5120, 89600, 1, 640]
    - [409, 233.14]
  - - [5120, 89856, 1, 640]
    - [408, 233.13]
  - - [5120, 90112, 1, 640]
    - [408, 233.82]
  - - [5120, 92160, 1, 640]
    - [408, 233.35]
  - - [5120, 93184, 1, 640]
    - [408, 235.28]
  - - [5120, 94208, 1, 640]
    - [408, 233.67]
  - - [5120, 95232, 1, 640]
    - [410, 233.79]
  - - [5120, 96000, 1, 640]
    - [408, 235.59]
  - - [5120, 96512, 1, 640]
    - [401, 234.41]
  - - [5120, 96768, 1, 640]
    - [408, 235.42]
  - - [5120, 98304, 1, 640]
    - [408, 236.66]
  - - [5120, 99840, 1, 640]
    - [408, 236.27]
  - - [5120, 100352, 1, 640]
    - [408, 235.91]
  - - [5120, 102400, 1, 640]
    - [408, 234.95]
  - - [5120, 103168, 1, 640]
    - [408, 236.16]
  - - [5120, 103680, 1, 640]
    - [408, 237.66]
  - - [5120, 103936, 1, 640]
    - [409, 235.4]
  - - [5120, 106496, 1, 640]
    - [408, 236.58]
  - - [5120, 107520, 1, 640]
    - [408, 235.81]
  - - [5120, 110592, 1, 640]
    - [408, 235.11]
  - - [5120, 111104, 1, 640]
    - [408, 235.73]
  - - [5120, 111360, 1, 640]
    - [401, 234.84]
  - - [5120, 114688, 1, 640]
    - [408, 236.35]
  - - [5120, 115200, 1, 640]
    - [408, 235.74]
  - - [5120, 118784, 1, 640]
    - [408, 236.13]
  - - [5120, 119040, 1, 640]
    - [408, 237.02]
  - - [5120, 122880, 1, 640]
    - [408, 236.0]
  - - [5120, 126976, 1, 640]
    - [401, 236.14]
  - - [5120, 131072, 1, 640]
    - [408, 236.99]
  - - [5120, 5888, 1, 1024]
    - [254, 235.58]
  - - [5120, 6144, 1, 1024]
    - [250, 228.98]
  - - [5120, 6400, 1, 1024]
    - [256, 229.0]
  - - [5120, 6656, 1, 1024]
    - [255, 234.74]
  - - [5120, 6912, 1, 1024]
    - [251, 237.52]
  - - [5120, 7168, 1, 1024]
    - [253, 236.86]
  - - [5120, 7424, 1, 1024]
    - [254, 237.14]
  - - [5120, 7680, 1, 1024]
    - [257, 232.43]
  - - [5120, 7936, 1, 1024]
    - [253, 234.53]
  - - [5120, 8192, 1, 1024]
    - [253, 237.02]
  - - [5120, 8448, 1, 1024]
    - [248, 240.97]
  - - [5120, 8704, 1, 1024]
    - [248, 239.77]
  - - [5120, 8960, 1, 1024]
    - [249, 241.29]
  - - [5120, 9216, 1, 1024]
    - [255, 237.89]
  - - [5120, 9728, 1, 1024]
    - [251, 238.75]
  - - [5120, 9984, 1, 1024]
    - [248, 245.09]
  - - [5120, 10240, 1, 1024]
    - [254, 243.37]
  - - [5120, 10752, 1, 1024]
    - [252, 240.62]
  - - [5120, 11264, 1, 1024]
    - [255, 241.08]
  - - [5120, 11520, 1, 1024]
    - [252, 246.27]
  - - [5120, 11776, 1, 1024]
    - [254, 240.78]
  - - [5120, 12288, 1, 1024]
    - [248, 243.31]
  - - [5120, 12544, 1, 1024]
    - [253, 242.13]
  - - [5120, 12800, 1, 1024]
    - [253, 243.82]
  - - [5120, 13056, 1, 1024]
    - [248, 249.02]
  - - [5120, 13312, 1, 1024]
    - [254, 241.88]
  - - [5120, 13824, 1, 1024]
    - [252, 245.7]
  - - [5120, 14080, 1, 1024]
    - [253, 242.22]
  - - [5120, 14336, 1, 1024]
    - [252, 245.1]
  - - [5120, 14592, 1, 1024]
    - [252, 248.44]
  - - [5120, 14848, 1, 1024]
    - [254, 245.15]
  - - [5120, 15360, 1, 1024]
    - [248, 244.15]
  - - [5120, 15872, 1, 1024]
    - [248, 248.92]
  - - [5120, 16128, 1, 1024]
    - [254, 244.15]
  - - [5120, 16384, 1, 1024]
    - [254, 243.48]
  - - [5120, 16640, 1, 1024]
    - [253, 243.58]
  - - [5120, 16896, 1, 1024]
    - [252, 244.93]
  - - [5120, 17408, 1, 1024]
    - [248, 246.48]
  - - [5120, 17664, 1, 1024]
    - [248, 243.79]
  - - [5120, 17920, 1, 1024]
    - [252, 242.95]
  - - [5120, 18432, 1, 1024]
    - [253, 245.75]
  - - [5120, 19200, 1, 1024]
    - [252, 246.13]
  - - [5120, 19456, 1, 1024]
    - [255, 245.92]
  - - [5120, 19712, 1, 1024]
    - [254, 247.44]
  - - [5120, 19968, 1, 1024]
    - [252, 248.83]
  - - [5120, 20480, 1, 1024]
    - [252, 248.26]
  - - [5120, 20736, 1, 1024]
    - [252, 247.51]
  - - [5120, 21504, 1, 1024]
    - [248, 247.36]
  - - [5120, 21760, 1, 1024]
    - [251, 248.55]
  - - [5120, 22272, 1, 1024]
    - [252, 247.47]
  - - [5120, 22528, 1, 1024]
    - [254, 247.5]
  - - [5120, 23040, 1, 1024]
    - [252, 249.66]
  - - [5120, 23296, 1, 1024]
    - [252, 247.92]
  - - [5120, 23552, 1, 1024]
    - [254, 246.88]
  - - [5120, 23808, 1, 1024]
    - [248, 247.3]
  - - [5120, 24320, 1, 1024]
    - [248, 246.68]
  - - [5120, 24576, 1, 1024]
    - [252, 249.79]
  - - [5120, 25088, 1, 1024]
    - [258, 248.83]
  - - [5120, 25344, 1, 1024]
    - [252, 250.21]
  - - [5120, 25600, 1, 1024]
    - [248, 250.11]
  - - [5120, 26112, 1, 1024]
    - [248, 250.8]
  - - [5120, 26624, 1, 1024]
    - [252, 250.45]
  - - [5120, 26880, 1, 1024]
    - [252, 251.39]
  - - [5120, 27648, 1, 1024]
    - [252, 250.7]
  - - [5120, 28160, 1, 1024]
    - [252, 249.07]
  - - [5120, 28672, 1, 1024]
    - [258, 249.55]
  - - [5120, 29184, 1, 1024]
    - [252, 250.61]
  - - [5120, 29440, 1, 1024]
    - [248, 247.83]
  - - [5120, 29696, 1, 1024]
    - [252, 248.34]
  - - [5120, 29952, 1, 1024]
    - [252, 250.4]
  - - [5120, 30464, 1, 1024]
    - [252, 250.76]
  - - [5120, 30720, 1, 1024]
    - [248, 251.87]
  - - [5120, 30976, 1, 1024]
    - [248, 249.53]
  - - [5120, 31744, 1, 1024]
    - [252, 250.79]
  - - [5120, 32000, 1, 1024]
    - [248, 252.01]
  - - [5120, 32256, 1, 1024]
    - [248, 251.53]
  - - [5120, 32768, 1, 1024]
    - [248, 251.5]
  - - [5120, 33280, 1, 1024]
    - [248, 252.48]
  - - [5120, 33792, 1, 1024]
    - [253, 250.1]
  - - [5120, 34048, 1, 1024]
    - [258, 250.16]
  - - [5120, 34560, 1, 1024]
    - [252, 252.7]
  - - [5120, 34816, 1, 1024]
    - [252, 253.75]
  - - [5120, 35328, 1, 1024]
    - [252, 251.47]
  - - [5120, 35840, 1, 1024]
    - [252, 250.81]
  - - [5120, 36608, 1, 1024]
    - [258, 249.37]
  - - [5120, 36864, 1, 1024]
    - [248, 252.33]
  - - [5120, 37120, 1, 1024]
    - [254, 250.78]
  - - [5120, 37632, 1, 1024]
    - [251, 252.22]
  - - [5120, 38400, 1, 1024]
    - [248, 254.48]
  - - [5120, 38912, 1, 1024]
    - [248, 250.79]
  - - [5120, 39168, 1, 1024]
    - [252, 252.31]
  - - [5120, 39424, 1, 1024]
    - [252, 251.71]
  - - [5120, 39680, 1, 1024]
    - [248, 252.49]
  - - [5120, 39936, 1, 1024]
    - [252, 253.37]
  - - [5120, 40960, 1, 1024]
    - [258, 251.05]
  - - [5120, 41216, 1, 1024]
    - [248, 251.76]
  - - [5120, 41472, 1, 1024]
    - [252, 252.96]
  - - [5120, 42240, 1, 1024]
    - [252, 253.68]
  - - [5120, 43008, 1, 1024]
    - [258, 252.86]
  - - [5120, 43264, 1, 1024]
    - [254, 253.03]
  - - [5120, 43520, 1, 1024]
    - [248, 252.66]
  - - [5120, 43776, 1, 1024]
    - [248, 253.96]
  - - [5120, 44544, 1, 1024]
    - [248, 253.78]
  - - [5120, 44800, 1, 1024]
    - [251, 254.7]
  - - [5120, 45056, 1, 1024]
    - [251, 256.27]
  - - [5120, 46080, 1, 1024]
    - [252, 252.71]
  - - [5120, 46592, 1, 1024]
    - [248, 253.42]
  - - [5120, 47104, 1, 1024]
    - [252, 254.01]
  - - [5120, 47616, 1, 1024]
    - [248, 252.76]
  - - [5120, 47872, 1, 1024]
    - [248, 254.71]
  - - [5120, 48384, 1, 1024]
    - [248, 254.37]
  - - [5120, 48640, 1, 1024]
    - [251, 253.54]
  - - [5120, 49152, 1, 1024]
    - [252, 254.04]
  - - [5120, 49920, 1, 1024]
    - [253, 253.36]
  - - [5120, 50176, 1, 1024]
    - [252, 254.75]
  - - [5120, 50688, 1, 1024]
    - [252, 255.61]
  - - [5120, 51200, 1, 1024]
    - [254, 254.53]
  - - [5120, 51968, 1, 1024]
    - [252, 254.04]
  - - [5120, 52224, 1, 1024]
    - [251, 255.37]
  - - [5120, 52992, 1, 1024]
    - [252, 253.67]
  - - [5120, 53248, 1, 1024]
    - [251, 256.22]
  - - [5120, 53504, 1, 1024]
    - [252, 254.55]
  - - [5120, 53760, 1, 1024]
    - [252, 257.39]
  - - [5120, 55296, 1, 1024]
    - [252, 256.18]
  - - [5120, 55552, 1, 1024]
    - [252, 254.12]
  - - [5120, 56320, 1, 1024]
    - [252, 256.05]
  - - [5120, 56576, 1, 1024]
    - [252, 253.66]
  - - [5120, 57344, 1, 1024]
    - [254, 255.88]
  - - [5120, 57600, 1, 1024]
    - [254, 257.06]
  - - [5120, 58368, 1, 1024]
    - [252, 256.88]
  - - [5120, 58880, 1, 1024]
    - [254, 256.79]
  - - [5120, 59136, 1, 1024]
    - [252, 259.68]
  - - [5120, 59392, 1, 1024]
    - [252, 258.57]
  - - [5120, 59904, 1, 1024]
    - [252, 256.03]
  - - [5120, 60928, 1, 1024]
    - [252, 258.0]
  - - [5120, 61440, 1, 1024]
    - [248, 255.48]
  - - [5120, 61952, 1, 1024]
    - [248, 256.93]
  - - [5120, 62208, 1, 1024]
    - [248, 256.3]
  - - [5120, 63232, 1, 1024]
    - [254, 256.33]
  - - [5120, 63488, 1, 1024]
    - [252, 257.01]
  - - [5120, 64000, 1, 1024]
    - [248, 259.16]
  - - [5120, 64512, 1, 1024]
    - [252, 255.71]
  - - [5120, 64768, 1, 1024]
    - [252, 258.75]
  - - [5120, 65280, 1, 1024]
    - [252, 257.2]
  - - [5120, 65536, 1, 1024]
    - [255, 255.59]
  - - [5120, 66560, 1, 1024]
    - [252, 257.22]
  - - [5120, 66816, 1, 1024]
    - [252, 257.63]
  - - [5120, 67584, 1, 1024]
    - [252, 258.05]
  - - [5120, 68096, 1, 1024]
    - [252, 257.49]
  - - [5120, 69120, 1, 1024]
    - [252, 257.01]
  - - [5120, 69632, 1, 1024]
    - [252, 257.11]
  - - [5120, 69888, 1, 1024]
    - [248, 259.72]
  - - [5120, 70400, 1, 1024]
    - [252, 258.6]
  - - [5120, 70656, 1, 1024]
    - [252, 256.79]
  - - [5120, 71424, 1, 1024]
    - [254, 256.7]
  - - [5120, 71680, 1, 1024]
    - [248, 258.62]
  - - [5120, 72960, 1, 1024]
    - [252, 258.4]
  - - [5120, 73216, 1, 1024]
    - [252, 259.82]
  - - [5120, 73728, 1, 1024]
    - [248, 258.09]
  - - [5120, 74240, 1, 1024]
    - [248, 257.68]
  - - [5120, 75264, 1, 1024]
    - [252, 259.57]
  - - [5120, 76032, 1, 1024]
    - [252, 258.98]
  - - [5120, 76544, 1, 1024]
    - [252, 257.11]
  - - [5120, 76800, 1, 1024]
    - [252, 258.44]
  - - [5120, 77824, 1, 1024]
    - [252, 259.75]
  - - [5120, 78848, 1, 1024]
    - [252, 258.11]
  - - [5120, 79360, 1, 1024]
    - [252, 259.62]
  - - [5120, 79872, 1, 1024]
    - [252, 258.9]
  - - [5120, 80640, 1, 1024]
    - [252, 258.55]
  - - [5120, 81664, 1, 1024]
    - [252, 259.54]
  - - [5120, 81920, 1, 1024]
    - [252, 257.47]
  - - [5120, 82432, 1, 1024]
    - [248, 256.82]
  - - [5120, 82944, 1, 1024]
    - [252, 258.95]
  - - [5120, 83200, 1, 1024]
    - [252, 257.23]
  - - [5120, 84480, 1, 1024]
    - [248, 258.59]
  - - [5120, 86016, 1, 1024]
    - [252, 258.47]
  - - [5120, 86528, 1, 1024]
    - [252, 257.57]
  - - [5120, 87296, 1, 1024]
    - [248, 258.57]
  - - [5120, 88320, 1, 1024]
    - [252, 257.33]
  - - [5120, 89088, 1, 1024]
    - [248, 257.28]
  - - [5120, 89600, 1, 1024]
    - [248, 257.06]
  - - [5120, 89856, 1, 1024]
    - [248, 258.04]
  - - [5120, 90112, 1, 1024]
    - [248, 258.01]
  - - [5120, 92160, 1, 1024]
    - [252, 258.82]
  - - [5120, 93184, 1, 1024]
    - [252, 258.9]
  - - [5120, 94208, 1, 1024]
    - [252, 259.48]
  - - [5120, 95232, 1, 1024]
    - [252, 258.07]
  - - [5120, 96000, 1, 1024]
    - [252, 258.37]
  - - [5120, 96512, 1, 1024]
    - [248, 257.93]
  - - [5120, 96768, 1, 1024]
    - [248, 258.33]
  - - [5120, 98304, 1, 1024]
    - [248, 259.36]
  - - [5120, 99840, 1, 1024]
    - [252, 259.99]
  - - [5120, 100352, 1, 1024]
    - [252, 258.67]
  - - [5120, 102400, 1, 1024]
    - [248, 257.56]
  - - [5120, 103168, 1, 1024]
    - [248, 259.22]
  - - [5120, 103680, 1, 1024]
    - [252, 259.51]
  - - [5120, 103936, 1, 1024]
    - [252, 258.81]
  - - [5120, 106496, 1, 1024]
    - [248, 257.38]
  - - [5120, 107520, 1, 1024]
    - [252, 259.29]
  - - [5120, 110592, 1, 1024]
    - [252, 258.11]
  - - [5120, 111104, 1, 1024]
    - [252, 258.29]
  - - [5120, 111360, 1, 1024]
    - [252, 258.7]
  - - [5120, 114688, 1, 1024]
    - [248, 257.79]
  - - [5120, 115200, 1, 1024]
    - [248, 256.93]
  - - [5120, 118784, 1, 1024]
    - [252, 258.73]
  - - [5120, 119040, 1, 1024]
    - [252, 259.06]
  - - [5120, 122880, 1, 1024]
    - [252, 259.43]
  - - [5120, 126976, 1, 1024]
    - [252, 258.4]
  - - [5120, 131072, 1, 1024]
    - [252, 255.3]
  - - [5120, 4352, 1, 2048]
    - [167, 259.48]
  - - [5120, 4608, 1, 2048]
    - [135, 252.05]
  - - [5120, 4864, 1, 2048]
    - [259, 257.24]
  - - [5120, 5120, 1, 2048]
    - [260, 247.33]
  - - [5120, 5376, 1, 2048]
    - [182, 258.12]
  - - [5120, 5632, 1, 2048]
    - [188, 262.2]
  - - [5120, 5888, 1, 2048]
    - [261, 258.58]
  - - [5120, 6144, 1, 2048]
    - [262, 251.99]
  - - [5120, 6400, 1, 2048]
    - [263, 254.66]
  - - [5120, 6656, 1, 2048]
    - [264, 261.06]
  - - [5120, 6912, 1, 2048]
    - [182, 265.04]
  - - [5120, 7168, 1, 2048]
    - [264, 268.13]
  - - [5120, 7424, 1, 2048]
    - [261, 263.44]
  - - [5120, 7680, 1, 2048]
    - [205, 267.2]
  - - [5120, 7936, 1, 2048]
    - [264, 261.47]
  - - [5120, 8192, 1, 2048]
    - [264, 264.65]
  - - [5120, 8448, 1, 2048]
    - [182, 269.61]
  - - [5120, 8704, 1, 2048]
    - [188, 271.71]
  - - [5120, 8960, 1, 2048]
    - [156, 267.74]
  - - [5120, 9216, 1, 2048]
    - [135, 260.6]
  - - [5120, 9728, 1, 2048]
    - [188, 269.35]
  - - [5120, 9984, 1, 2048]
    - [182, 274.21]
  - - [5120, 10240, 1, 2048]
    - [261, 270.21]
  - - [5120, 10752, 1, 2048]
    - [203, 273.59]
  - - [5120, 11264, 1, 2048]
    - [264, 271.69]
  - - [5120, 11520, 1, 2048]
    - [188, 276.24]
  - - [5120, 11776, 1, 2048]
    - [265, 272.28]
  - - [5120, 12288, 1, 2048]
    - [139, 269.2]
  - - [5120, 12544, 1, 2048]
    - [217, 273.22]
  - - [5120, 12800, 1, 2048]
    - [188, 274.34]
  - - [5120, 13056, 1, 2048]
    - [182, 277.57]
  - - [5120, 13312, 1, 2048]
    - [261, 273.39]
  - - [5120, 13824, 1, 2048]
    - [188, 273.62]
  - - [5120, 14080, 1, 2048]
    - [182, 278.72]
  - - [5120, 14336, 1, 2048]
    - [139, 279.5]
  - - [5120, 14592, 1, 2048]
    - [182, 278.05]
  - - [5120, 14848, 1, 2048]
    - [167, 277.34]
  - - [5120, 15360, 1, 2048]
    - [188, 278.79]
  - - [5120, 15872, 1, 2048]
    - [182, 281.69]
  - - [5120, 16128, 1, 2048]
    - [261, 275.56]
  - - [5120, 16384, 1, 2048]
    - [264, 277.41]
  - - [5120, 16640, 1, 2048]
    - [167, 278.43]
  - - [5120, 16896, 1, 2048]
    - [188, 279.07]
  - - [5120, 17408, 1, 2048]
    - [188, 282.71]
  - - [5120, 17664, 1, 2048]
    - [182, 278.56]
  - - [5120, 17920, 1, 2048]
    - [139, 279.83]
  - - [5120, 18432, 1, 2048]
    - [188, 284.18]
  - - [5120, 19200, 1, 2048]
    - [264, 280.63]
  - - [5120, 19456, 1, 2048]
    - [182, 280.02]
  - - [5120, 19712, 1, 2048]
    - [188, 282.86]
  - - [5120, 19968, 1, 2048]
    - [182, 282.68]
  - - [5120, 20480, 1, 2048]
    - [261, 279.73]
  - - [5120, 20736, 1, 2048]
    - [261, 279.01]
  - - [5120, 21504, 1, 2048]
    - [182, 284.18]
  - - [5120, 21760, 1, 2048]
    - [188, 284.9]
  - - [5120, 22272, 1, 2048]
    - [217, 280.89]
  - - [5120, 22528, 1, 2048]
    - [182, 283.38]
  - - [5120, 23040, 1, 2048]
    - [264, 285.74]
  - - [5120, 23296, 1, 2048]
    - [182, 284.36]
  - - [5120, 23552, 1, 2048]
    - [182, 283.49]
  - - [5120, 23808, 1, 2048]
    - [182, 283.61]
  - - [5120, 24320, 1, 2048]
    - [139, 285.4]
  - - [5120, 24576, 1, 2048]
    - [188, 284.58]
  - - [5120, 25088, 1, 2048]
    - [182, 282.4]
  - - [5120, 25344, 1, 2048]
    - [188, 283.12]
  - - [5120, 25600, 1, 2048]
    - [182, 285.84]
  - - [5120, 26112, 1, 2048]
    - [182, 285.23]
  - - [5120, 26624, 1, 2048]
    - [182, 283.4]
  - - [5120, 26880, 1, 2048]
    - [264, 284.67]
  - - [5120, 27648, 1, 2048]
    - [188, 285.69]
  - - [5120, 28160, 1, 2048]
    - [182, 284.5]
  - - [5120, 28672, 1, 2048]
    - [139, 285.19]
  - - [5120, 29184, 1, 2048]
    - [182, 286.15]
  - - [5120, 29440, 1, 2048]
    - [188, 285.38]
  - - [5120, 29696, 1, 2048]
    - [264, 284.07]
  - - [5120, 29952, 1, 2048]
    - [261, 285.68]
  - - [5120, 30464, 1, 2048]
    - [182, 289.28]
  - - [5120, 30720, 1, 2048]
    - [182, 285.38]
  - - [5120, 30976, 1, 2048]
    - [182, 287.19]
  - - [5120, 31744, 1, 2048]
    - [261, 286.42]
  - - [5120, 32000, 1, 2048]
    - [182, 290.52]
  - - [5120, 32256, 1, 2048]
    - [182, 286.6]
  - - [5120, 32768, 1, 2048]
    - [182, 287.96]
  - - [5120, 33280, 1, 2048]
    - [182, 288.18]
  - - [5120, 33792, 1, 2048]
    - [139, 288.01]
  - - [5120, 34048, 1, 2048]
    - [188, 288.22]
  - - [5120, 34560, 1, 2048]
    - [182, 290.04]
  - - [5120, 34816, 1, 2048]
    - [182, 289.24]
  - - [5120, 35328, 1, 2048]
    - [188, 287.26]
  - - [5120, 35840, 1, 2048]
    - [139, 288.99]
  - - [5120, 36608, 1, 2048]
    - [139, 286.95]
  - - [5120, 36864, 1, 2048]
    - [188, 290.76]
  - - [5120, 37120, 1, 2048]
    - [182, 292.93]
  - - [5120, 37632, 1, 2048]
    - [188, 291.17]
  - - [5120, 38400, 1, 2048]
    - [182, 291.15]
  - - [5120, 38912, 1, 2048]
    - [188, 292.16]
  - - [5120, 39168, 1, 2048]
    - [182, 292.97]
  - - [5120, 39424, 1, 2048]
    - [167, 291.19]
  - - [5120, 39680, 1, 2048]
    - [264, 290.19]
  - - [5120, 39936, 1, 2048]
    - [182, 292.18]
  - - [5120, 40960, 1, 2048]
    - [188, 291.58]
  - - [5120, 41216, 1, 2048]
    - [264, 292.29]
  - - [5120, 41472, 1, 2048]
    - [182, 291.47]
  - - [5120, 42240, 1, 2048]
    - [182, 294.54]
  - - [5120, 43008, 1, 2048]
    - [188, 290.97]
  - - [5120, 43264, 1, 2048]
    - [182, 292.91]
  - - [5120, 43520, 1, 2048]
    - [188, 293.37]
  - - [5120, 43776, 1, 2048]
    - [182, 295.13]
  - - [5120, 44544, 1, 2048]
    - [188, 292.57]
  - - [5120, 44800, 1, 2048]
    - [182, 292.95]
  - - [5120, 45056, 1, 2048]
    - [182, 295.13]
  - - [5120, 46080, 1, 2048]
    - [182, 294.83]
  - - [5120, 46592, 1, 2048]
    - [182, 293.89]
  - - [5120, 47104, 1, 2048]
    - [167, 291.97]
  - - [5120, 47616, 1, 2048]
    - [182, 293.3]
  - - [5120, 47872, 1, 2048]
    - [188, 291.17]
  - - [5120, 48384, 1, 2048]
    - [182, 291.14]
  - - [5120, 48640, 1, 2048]
    - [182, 292.25]
  - - [5120, 49152, 1, 2048]
    - [188, 291.38]
  - - [5120, 49920, 1, 2048]
    - [188, 291.19]
  - - [5120, 50176, 1, 2048]
    - [266, 292.32]
  - - [5120, 50688, 1, 2048]
    - [203, 291.48]
  - - [5120, 51200, 1, 2048]
    - [264, 290.69]
  - - [5120, 51968, 1, 2048]
    - [182, 294.25]
  - - [5120, 52224, 1, 2048]
    - [182, 293.29]
  - - [5120, 52992, 1, 2048]
    - [264, 293.12]
  - - [5120, 53248, 1, 2048]
    - [188, 291.26]
  - - [5120, 53504, 1, 2048]
    - [264, 292.87]
  - - [5120, 53760, 1, 2048]
    - [188, 292.73]
  - - [5120, 55296, 1, 2048]
    - [188, 295.01]
  - - [5120, 55552, 1, 2048]
    - [182, 292.62]
  - - [5120, 56320, 1, 2048]
    - [182, 293.3]
  - - [5120, 56576, 1, 2048]
    - [188, 290.87]
  - - [5120, 57344, 1, 2048]
    - [182, 290.46]
  - - [5120, 57600, 1, 2048]
    - [188, 293.14]
  - - [5120, 58368, 1, 2048]
    - [182, 293.92]
  - - [5120, 58880, 1, 2048]
    - [182, 292.12]
  - - [5120, 59136, 1, 2048]
    - [188, 292.27]
  - - [5120, 59392, 1, 2048]
    - [182, 293.2]
  - - [5120, 59904, 1, 2048]
    - [188, 291.82]
  - - [5120, 60928, 1, 2048]
    - [182, 293.14]
  - - [5120, 61440, 1, 2048]
    - [182, 291.88]
  - - [5120, 61952, 1, 2048]
    - [139, 293.56]
  - - [5120, 62208, 1, 2048]
    - [181, 292.78]
  - - [5120, 63232, 1, 2048]
    - [182, 293.64]
  - - [5120, 63488, 1, 2048]
    - [139, 291.52]
  - - [5120, 64000, 1, 2048]
    - [182, 292.59]
  - - [5120, 64512, 1, 2048]
    - [264, 292.22]
  - - [5120, 64768, 1, 2048]
    - [182, 293.98]
  - - [5120, 65280, 1, 2048]
    - [182, 294.08]
  - - [5120, 65536, 1, 2048]
    - [182, 293.12]
  - - [5120, 66560, 1, 2048]
    - [139, 291.94]
  - - [5120, 66816, 1, 2048]
    - [261, 292.8]
  - - [5120, 67584, 1, 2048]
    - [188, 291.67]
  - - [5120, 68096, 1, 2048]
    - [182, 292.44]
  - - [5120, 69120, 1, 2048]
    - [198, 294.02]
  - - [5120, 69632, 1, 2048]
    - [182, 295.79]
  - - [5120, 69888, 1, 2048]
    - [182, 292.7]
  - - [5120, 70400, 1, 2048]
    - [267, 291.65]
  - - [5120, 70656, 1, 2048]
    - [182, 292.45]
  - - [5120, 71424, 1, 2048]
    - [182, 294.81]
  - - [5120, 71680, 1, 2048]
    - [139, 291.9]
  - - [5120, 72960, 1, 2048]
    - [182, 293.88]
  - - [5120, 73216, 1, 2048]
    - [182, 292.89]
  - - [5120, 73728, 1, 2048]
    - [182, 292.34]
  - - [5120, 74240, 1, 2048]
    - [182, 294.67]
  - - [5120, 75264, 1, 2048]
    - [182, 292.4]
  - - [5120, 76032, 1, 2048]
    - [182, 292.57]
  - - [5120, 76544, 1, 2048]
    - [182, 293.09]
  - - [5120, 76800, 1, 2048]
    - [217, 290.93]
  - - [5120, 77824, 1, 2048]
    - [182, 292.33]
  - - [5120, 78848, 1, 2048]
    - [268, 293.25]
  - - [5120, 79360, 1, 2048]
    - [182, 292.68]
  - - [5120, 79872, 1, 2048]
    - [203, 292.39]
  - - [5120, 80640, 1, 2048]
    - [182, 292.29]
  - - [5120, 81664, 1, 2048]
    - [188, 292.65]
  - - [5120, 81920, 1, 2048]
    - [182, 291.93]
  - - [5120, 82432, 1, 2048]
    - [188, 292.34]
  - - [5120, 82944, 1, 2048]
    - [182, 291.96]
  - - [5120, 83200, 1, 2048]
    - [182, 292.19]
  - - [5120, 84480, 1, 2048]
    - [182, 293.22]
  - - [5120, 86016, 1, 2048]
    - [188, 293.02]
  - - [5120, 86528, 1, 2048]
    - [182, 291.64]
  - - [5120, 87296, 1, 2048]
    - [182, 291.6]
  - - [5120, 88320, 1, 2048]
    - [182, 291.58]
  - - [5120, 89088, 1, 2048]
    - [181, 292.24]
  - - [5120, 89600, 1, 2048]
    - [217, 290.25]
  - - [5120, 89856, 1, 2048]
    - [182, 292.67]
  - - [5120, 90112, 1, 2048]
    - [182, 292.75]
  - - [5120, 92160, 1, 2048]
    - [182, 292.83]
  - - [5120, 93184, 1, 2048]
    - [182, 292.77]
  - - [5120, 94208, 1, 2048]
    - [188, 292.55]
  - - [5120, 95232, 1, 2048]
    - [182, 292.04]
  - - [5120, 96000, 1, 2048]
    - [182, 290.88]
  - - [5120, 96512, 1, 2048]
    - [188, 291.99]
  - - [5120, 96768, 1, 2048]
    - [201, 290.2]
  - - [5120, 98304, 1, 2048]
    - [267, 293.69]
  - - [5120, 99840, 1, 2048]
    - [188, 290.85]
  - - [5120, 100352, 1, 2048]
    - [188, 289.75]
  - - [5120, 102400, 1, 2048]
    - [268, 291.84]
  - - [5120, 103168, 1, 2048]
    - [182, 293.22]
  - - [5120, 103680, 1, 2048]
    - [182, 292.75]
  - - [5120, 103936, 1, 2048]
    - [182, 291.22]
  - - [5120, 106496, 1, 2048]
    - [182, 291.21]
  - - [5120, 107520, 1, 2048]
    - [188, 290.42]
  - - [5120, 110592, 1, 2048]
    - [188, 292.14]
  - - [5120, 111104, 1, 2048]
    - [182, 292.25]
  - - [5120, 111360, 1, 2048]
    - [182, 289.62]
  - - [5120, 114688, 1, 2048]
    - [182, 291.87]
  - - [5120, 115200, 1, 2048]
    - [182, 292.44]
  - - [5120, 118784, 1, 2048]
    - [182, 292.03]
  - - [5120, 119040, 1, 2048]
    - [188, 290.32]
  - - [5120, 122880, 1, 2048]
    - [188, 291.04]
  - - [5120, 126976, 1, 2048]
    - [188, 290.73]
  - - [5120, 131072, 1, 2048]
    - [182, 290.48]
  - - [5120, 4352, 1, 8192]
    - [261, 291.01]
  - - [5120, 4608, 1, 8192]
    - [269, 296.51]
  - - [5120, 4864, 1, 8192]
    - [259, 302.68]
  - - [5120, 5120, 1, 8192]
    - [270, 296.15]
  - - [5120, 5376, 1, 8192]
    - [271, 303.14]
  - - [5120, 5632, 1, 8192]
    - [186, 303.64]
  - - [5120, 5888, 1, 8192]
    - [155, 307.06]
  - - [5120, 6144, 1, 8192]
    - [272, 305.2]
  - - [5120, 6400, 1, 8192]
    - [273, 308.82]
  - - [5120, 6656, 1, 8192]
    - [274, 314.14]
  - - [5120, 6912, 1, 8192]
    - [179, 313.2]
  - - [5120, 7168, 1, 8192]
    - [275, 314.51]
  - - [5120, 7424, 1, 8192]
    - [181, 315.89]
  - - [5120, 7680, 1, 8192]
    - [201, 320.52]
  - - [5120, 7936, 1, 8192]
    - [276, 309.53]
  - - [5120, 8192, 1, 8192]
    - [277, 313.15]
  - - [5120, 8448, 1, 8192]
    - [185, 310.13]
  - - [5120, 8704, 1, 8192]
    - [155, 311.05]
  - - [5120, 8960, 1, 8192]
    - [156, 318.88]
  - - [5120, 9216, 1, 8192]
    - [278, 312.6]
  - - [5120, 9728, 1, 8192]
    - [273, 319.44]
  - - [5120, 9984, 1, 8192]
    - [274, 321.86]
  - - [5120, 10240, 1, 8192]
    - [203, 315.08]
  - - [5120, 10752, 1, 8192]
    - [203, 323.46]
  - - [5120, 11264, 1, 8192]
    - [201, 324.6]
  - - [5120, 11520, 1, 8192]
    - [181, 328.57]
  - - [5120, 11776, 1, 8192]
    - [267, 325.93]
  - - [5120, 12288, 1, 8192]
    - [272, 315.65]
  - - [5120, 12544, 1, 8192]
    - [279, 316.29]
  - - [5120, 12800, 1, 8192]
    - [273, 322.51]
  - - [5120, 13056, 1, 8192]
    - [280, 323.03]
  - - [5120, 13312, 1, 8192]
    - [280, 326.76]
  - - [5120, 13824, 1, 8192]
    - [207, 320.26]
  - - [5120, 14080, 1, 8192]
    - [179, 321.17]
  - - [5120, 14336, 1, 8192]
    - [203, 324.96]
  - - [5120, 14592, 1, 8192]
    - [179, 332.67]
  - - [5120, 14848, 1, 8192]
    - [181, 326.96]
  - - [5120, 15360, 1, 8192]
    - [181, 332.34]
  - - [5120, 15872, 1, 8192]
    - [273, 322.38]
  - - [5120, 16128, 1, 8192]
    - [280, 324.73]
  - - [5120, 16384, 1, 8192]
    - [270, 326.8]
  - - [5120, 16640, 1, 8192]
    - [280, 329.53]
  - - [5120, 16896, 1, 8192]
    - [190, 327.05]
  - - [5120, 17408, 1, 8192]
    - [185, 327.69]
  - - [5120, 17664, 1, 8192]
    - [179, 328.98]
  - - [5120, 17920, 1, 8192]
    - [198, 330.11]
  - - [5120, 18432, 1, 8192]
    - [181, 328.64]
  - - [5120, 19200, 1, 8192]
    - [181, 334.48]
  - - [5120, 19456, 1, 8192]
    - [201, 336.19]
  - - [5120, 19712, 1, 8192]
    - [267, 332.35]
  - - [5120, 19968, 1, 8192]
    - [280, 330.79]
  - - [5120, 20480, 1, 8192]
    - [177, 325.12]
  - - [5120, 20736, 1, 8192]
    - [156, 324.56]
  - - [5120, 21504, 1, 8192]
    - [203, 328.99]
  - - [5120, 21760, 1, 8192]
    - [203, 332.54]
  - - [5120, 22272, 1, 8192]
    - [181, 330.34]
  - - [5120, 22528, 1, 8192]
    - [181, 329.58]
  - - [5120, 23040, 1, 8192]
    - [201, 334.12]
  - - [5120, 23296, 1, 8192]
    - [201, 334.15]
  - - [5120, 23552, 1, 8192]
    - [267, 333.03]
  - - [5120, 23808, 1, 8192]
    - [156, 327.41]
  - - [5120, 24320, 1, 8192]
    - [156, 330.97]
  - - [5120, 24576, 1, 8192]
    - [276, 327.78]
  - - [5120, 25088, 1, 8192]
    - [198, 329.8]
  - - [5120, 25344, 1, 8192]
    - [207, 330.73]
  - - [5120, 25600, 1, 8192]
    - [181, 325.61]
  - - [5120, 26112, 1, 8192]
    - [181, 330.03]
  - - [5120, 26624, 1, 8192]
    - [181, 335.17]
  - - [5120, 26880, 1, 8192]
    - [181, 333.39]
  - - [5120, 27648, 1, 8192]
    - [267, 331.91]
  - - [5120, 28160, 1, 8192]
    - [203, 323.33]
  - - [5120, 28672, 1, 8192]
    - [179, 328.09]
  - - [5120, 29184, 1, 8192]
    - [198, 331.06]
  - - [5120, 29440, 1, 8192]
    - [280, 326.81]
  - - [5120, 29696, 1, 8192]
    - [280, 329.27]
  - - [5120, 29952, 1, 8192]
    - [280, 330.47]
  - - [5120, 30464, 1, 8192]
    - [181, 332.38]
  - - [5120, 30720, 1, 8192]
    - [181, 331.44]
  - - [5120, 30976, 1, 8192]
    - [181, 332.26]
  - - [5120, 31744, 1, 8192]
    - [186, 322.16]
  - - [5120, 32000, 1, 8192]
    - [207, 327.14]
  - - [5120, 32256, 1, 8192]
    - [207, 329.12]
  - - [5120, 32768, 1, 8192]
    - [179, 333.35]
  - - [5120, 33280, 1, 8192]
    - [274, 326.35]
  - - [5120, 33792, 1, 8192]
    - [200, 324.4]
  - - [5120, 34048, 1, 8192]
    - [181, 323.86]
  - - [5120, 34560, 1, 8192]
    - [206, 326.72]
  - - [5120, 34816, 1, 8192]
    - [193, 330.26]
  - - [5120, 35328, 1, 8192]
    - [267, 329.63]
  - - [5120, 35840, 1, 8192]
    - [207, 326.05]
  - - [5120, 36608, 1, 8192]
    - [273, 329.2]
  - - [5120, 36864, 1, 8192]
    - [209, 322.38]
  - - [5120, 37120, 1, 8192]
    - [190, 324.75]
  - - [5120, 37632, 1, 8192]
    - [181, 325.0]
  - - [5120, 38400, 1, 8192]
    - [180, 329.03]
  - - [5120, 38912, 1, 8192]
    - [181, 334.13]
  - - [5120, 39168, 1, 8192]
    - [265, 329.14]
  - - [5120, 39424, 1, 8192]
    - [265, 330.47]
  - - [5120, 39680, 1, 8192]
    - [179, 328.99]
  - - [5120, 39936, 1, 8192]
    - [207, 329.78]
  - - [5120, 40960, 1, 8192]
    - [278, 323.2]
  - - [5120, 41216, 1, 8192]
    - [181, 320.37]
  - - [5120, 41472, 1, 8192]
    - [181, 322.65]
  - - [5120, 42240, 1, 8192]
    - [181, 329.34]
  - - [5120, 43008, 1, 8192]
    - [265, 328.82]
  - - [5120, 43264, 1, 8192]
    - [281, 329.5]
  - - [5120, 43520, 1, 8192]
    - [198, 327.08]
  - - [5120, 43776, 1, 8192]
    - [198, 330.27]
  - - [5120, 44544, 1, 8192]
    - [155, 317.48]
  - - [5120, 44800, 1, 8192]
    - [156, 320.35]
  - - [5120, 45056, 1, 8192]
    - [156, 321.58]
  - - [5120, 46080, 1, 8192]
    - [193, 327.95]
  - - [5120, 46592, 1, 8192]
    - [193, 331.7]
  - - [5120, 47104, 1, 8192]
    - [282, 328.72]
  - - [5120, 47616, 1, 8192]
    - [194, 319.74]
  - - [5120, 47872, 1, 8192]
    - [177, 321.58]
  - - [5120, 48384, 1, 8192]
    - [155, 324.62]
  - - [5120, 48640, 1, 8192]
    - [172, 328.61]
  - - [5120, 49152, 1, 8192]
    - [270, 324.31]
  - - [5120, 49920, 1, 8192]
    - [181, 327.81]
  - - [5120, 50176, 1, 8192]
    - [181, 328.79]
  - - [5120, 50688, 1, 8192]
    - [198, 326.51]
  - - [5120, 51200, 1, 8192]
    - [268, 330.39]
  - - [5120, 51968, 1, 8192]
    - [277, 323.2]
  - - [5120, 52224, 1, 8192]
    - [186, 321.55]
  - - [5120, 52992, 1, 8192]
    - [263, 323.7]
  - - [5120, 53248, 1, 8192]
    - [274, 328.56]
  - - [5120, 53504, 1, 8192]
    - [263, 328.56]
  - - [5120, 53760, 1, 8192]
    - [201, 330.49]
  - - [5120, 55296, 1, 8192]
    - [267, 333.22]
  - - [5120, 55552, 1, 8192]
    - [259, 320.24]
  - - [5120, 56320, 1, 8192]
    - [274, 324.84]
  - - [5120, 56576, 1, 8192]
    - [273, 330.56]
  - - [5120, 57344, 1, 8192]
    - [177, 328.13]
  - - [5120, 57600, 1, 8192]
    - [180, 326.25]
  - - [5120, 58368, 1, 8192]
    - [181, 333.7]
  - - [5120, 58880, 1, 8192]
    - [268, 331.63]
  - - [5120, 59136, 1, 8192]
    - [267, 332.33]
  - - [5120, 59392, 1, 8192]
    - [263, 320.79]
  - - [5120, 59904, 1, 8192]
    - [278, 326.81]
  - - [5120, 60928, 1, 8192]
    - [181, 324.65]
  - - [5120, 61440, 1, 8192]
    - [179, 331.27]
  - - [5120, 61952, 1, 8192]
    - [179, 332.55]
  - - [5120, 62208, 1, 8192]
    - [181, 332.3]
  - - [5120, 63232, 1, 8192]
    - [265, 332.73]
  - - [5120, 63488, 1, 8192]
    - [263, 325.46]
  - - [5120, 64000, 1, 8192]
    - [200, 320.69]
  - - [5120, 64512, 1, 8192]
    - [209, 327.18]
  - - [5120, 64768, 1, 8192]
    - [179, 321.71]
  - - [5120, 65280, 1, 8192]
    - [179, 329.76]
  - - [5120, 65536, 1, 8192]
    - [198, 327.18]
  - - [5120, 66560, 1, 8192]
    - [274, 328.59]
  - - [5120, 66816, 1, 8192]
    - [268, 329.21]
  - - [5120, 67584, 1, 8192]
    - [190, 319.94]
  - - [5120, 68096, 1, 8192]
    - [209, 323.37]
  - - [5120, 69120, 1, 8192]
    - [283, 325.71]
  - - [5120, 69632, 1, 8192]
    - [181, 330.37]
  - - [5120, 69888, 1, 8192]
    - [181, 328.83]
  - - [5120, 70400, 1, 8192]
    - [265, 330.1]
  - - [5120, 70656, 1, 8192]
    - [265, 325.97]
  - - [5120, 71424, 1, 8192]
    - [209, 325.73]
  - - [5120, 71680, 1, 8192]
    - [203, 320.03]
  - - [5120, 72960, 1, 8192]
    - [207, 329.32]
  - - [5120, 73216, 1, 8192]
    - [181, 325.03]
  - - [5120, 73728, 1, 8192]
    - [181, 330.02]
  - - [5120, 74240, 1, 8192]
    - [268, 321.97]
  - - [5120, 75264, 1, 8192]
    - [203, 320.1]
  - - [5120, 76032, 1, 8192]
    - [203, 323.89]
  - - [5120, 76544, 1, 8192]
    - [179, 331.24]
  - - [5120, 76800, 1, 8192]
    - [274, 326.65]
  - - [5120, 77824, 1, 8192]
    - [205, 331.91]
  - - [5120, 78848, 1, 8192]
    - [265, 331.11]
  - - [5120, 79360, 1, 8192]
    - [203, 322.84]
  - - [5120, 79872, 1, 8192]
    - [179, 327.02]
  - - [5120, 80640, 1, 8192]
    - [181, 324.22]
  - - [5120, 81664, 1, 8192]
    - [181, 331.35]
  - - [5120, 81920, 1, 8192]
    - [177, 323.88]
  - - [5120, 82432, 1, 8192]
    - [265, 329.48]
  - - [5120, 82944, 1, 8192]
    - [265, 329.16]
  - - [5120, 83200, 1, 8192]
    - [203, 322.74]
  - - [5120, 84480, 1, 8192]
    - [201, 322.75]
  - - [5120, 86016, 1, 8192]
    - [267, 322.68]
  - - [5120, 86528, 1, 8192]
    - [265, 328.32]
  - - [5120, 87296, 1, 8192]
    - [179, 326.07]
  - - [5120, 88320, 1, 8192]
    - [200, 326.33]
  - - [5120, 89088, 1, 8192]
    - [180, 324.72]
  - - [5120, 89600, 1, 8192]
    - [280, 319.02]
  - - [5120, 89856, 1, 8192]
    - [280, 318.33]
  - - [5120, 90112, 1, 8192]
    - [273, 320.73]
  - - [5120, 92160, 1, 8192]
    - [181, 320.13]
  - - [5120, 93184, 1, 8192]
    - [181, 324.42]
  - - [5120, 94208, 1, 8192]
    - [267, 320.75]
  - - [5120, 95232, 1, 8192]
    - [181, 317.28]
  - - [5120, 96000, 1, 8192]
    - [185, 319.3]
  - - [5120, 96512, 1, 8192]
    - [181, 321.35]
  - - [5120, 96768, 1, 8192]
    - [181, 323.65]
  - - [5120, 98304, 1, 8192]
    - [203, 320.28]
  - - [5120, 99840, 1, 8192]
    - [280, 319.29]
  - - [5120, 100352, 1, 8192]
    - [181, 321.63]
  - - [5120, 102400, 1, 8192]
    - [267, 321.56]
  - - [5120, 103168, 1, 8192]
    - [156, 318.76]
  - - [5120, 103680, 1, 8192]
    - [180, 318.32]
  - - [5120, 103936, 1, 8192]
    - [180, 319.24]
  - - [5120, 106496, 1, 8192]
    - [265, 321.83]
  - - [5120, 107520, 1, 8192]
    - [181, 319.28]
  - - [5120, 110592, 1, 8192]
    - [265, 321.6]
  - - [5120, 111104, 1, 8192]
    - [181, 316.69]
  - - [5120, 111360, 1, 8192]
    - [181, 319.09]
  - - [5120, 114688, 1, 8192]
    - [181, 317.23]
  - - [5120, 115200, 1, 8192]
    - [181, 319.49]
  - - [5120, 118784, 1, 8192]
    - [181, 318.02]
  - - [5120, 119040, 1, 8192]
    - [181, 320.04]
  - - [5120, 122880, 1, 8192]
    - [181, 318.29]
  - - [5120, 126976, 1, 8192]
    - [280, 318.24]
  - - [5120, 131072, 1, 8192]
    - [198, 320.8]
- null
- null
- DeviceEfficiency
- GridBased
