projects/hipblaslt/library/src/amd_detail/rocblaslt/src/Tensile/Logic/asm_full/aquavanjaram/gfx942/GridBased/aquavanjaram_Cijk_Alik_Bljk_HHS_STA_BH_Bias_HAS_SAV_UserArgs.yaml
- {MinimumRequiredVersion: 4.33.0}
- aquavanjaram
- gfx942
- [Device 0049, Device 0050]
    SolutionIndex: 0
    SolutionNameMin: Cijk_Alik_Bljk_HHS_STA_BH_Bias_HAS_SAV_UserArgs_MT128x128x64_MI16x16x1_SN_GSU1_GSUC0_GSUWGMRR0_K1_LBSPPB1024_MIWT2_8_NLCA2_PLR1_SU0_SUM0_SUS0_VWB8_WG64_4_1_WGM8_WGMXCC8_WGMXCCGn1
    SolutionIndex: 1
    SolutionNameMin: Cijk_Alik_Bljk_HHS_STA_BH_Bias_HAS_SAV_UserArgs_MT512x128x64_MI16x16x1_SN_GSU1_GSUC0_GSUWGMRR0_K1_LBSPPB1024_MIWT8_8_NLCA2_PLR1_SU0_SUM0_SUS0_VWB8_WG64_4_1_WGM8_WGMXCC8_WGMXCCGn1
    SolutionIndex: 2
    SolutionNameMin: Cijk_Alik_Bljk_HHS_STA_BH_Bias_HAS_SAV_UserArgs_MT160x128x64_MI16x16x1_SN_GSU1_GSUC0_GSUWGMRR0_K1_LBSPPB1024_MIWT5_8_NLCA2_PLR1_SU0_SUM0_SUS0_VWB8_WG32_4_1_WGM8_WGMXCC8_WGMXCCGn1
    SolutionIndex: 3
    SolutionNameMin: Cijk_Alik_Bljk_HHS_STA_BH_Bias_HAS_SAV_UserArgs_MT64x16x128_MI16x16x1_SN_GSU1_GSUC0_GSUWGMRR0_K1_LBSPPB256_MIWT1_1_NLCA4_PLR1_SU0_SUM0_SUS0_VWB1_WG64_4_1_WGM8_WGMXCC8_WGMXCCGn1
    SolutionIndex: 4
    SolutionNameMin: Cijk_Alik_Bljk_HHS_STA_BH_Bias_HAS_SAV_UserArgs_MT64x16x128_MI16x16x1_SN_GSU1_GSUC0_GSUWGMRR0_K1_LBSPPB256_MIWT1_1_NLCA4_PLR2_SU0_SUM0_SUS0_VWB1_WG64_4_1_WGM8_WGMXCC8_WGMXCCGn1
    SolutionIndex: 5
    SolutionNameMin: Cijk_Alik_Bljk_HHS_STA_BH_Bias_HAS_SAV_UserArgs_MT64x16x128_MI16x16x1_SN_LDSB0_GRVWB8_GSU15_GSUAMBSK_GSUC0_GSUWGMRR0_K1_LBSPPB256_MIWT1_1_NLCA4_SU16_SUM0_SUS256_VWB1_WG64_4_1_WGM8_WGMXCC8_WGMXCCG304
    SolutionIndex: 6
    SolutionNameMin: Cijk_Alik_Bljk_HHS_STA_BH_Bias_HAS_SAV_UserArgs_MT16x32x128_MI16x16x1_SN_LDSB0_GRVWB8_GSU15_GSUAMBSK_GSUC0_GSUWGMRR0_K1_LBSPPB256_MIWT1_1_NLCA4_SU16_SUM0_SUS256_VWB1_WG16_8_1_WGM8_WGMXCC8_WGMXCCG304
    SolutionIndex: 7
    SolutionNameMin: Cijk_Alik_Bljk_HHS_STA_BH_Bias_HAS_SAV_UserArgs_MT16x16x128_MI16x16x1_SN_LDSB0_GRVWB8_GSU11_GSUAMBSK_GSUC0_GSUWGMRR0_K1_LBSPPB256_MIWT1_1_NLCA4_SU16_SUM0_SUS256_VWB1_WG16_4_1_WGM8_WGMXCC8_WGMXCCG304
    SolutionIndex: 8
    SolutionNameMin: Cijk_Alik_Bljk_HHS_STA_BH_Bias_HAS_SAV_UserArgs_MT16x32x128_MI16x16x1_SN_LDSB0_GRVWB8_GSU11_GSUAMBSK_GSUC0_GSUWGMRR0_K1_LBSPPB256_MIWT1_1_NLCA4_SU16_SUM0_SUS256_VWB1_WG16_8_1_WGM8_WGMXCC8_WGMXCCG304
    SolutionIndex: 9
    SolutionNameMin: Cijk_Alik_Bljk_HHS_STA_BH_Bias_HAS_SAV_UserArgs_MT16x32x128_MI16x16x1_SN_LDSB0_GRVWB8_GSU9_GSUAMBSK_GSUC0_GSUWGMRR0_K1_LBSPPB256_MIWT1_1_NLCA4_SU16_SUM0_SUS256_VWB1_WG16_8_1_WGM8_WGMXCC8_WGMXCCG304
    SolutionIndex: 10
    SolutionNameMin: Cijk_Alik_Bljk_HHS_STA_BH_Bias_HAS_SAV_UserArgs_MT16x16x128_MI16x16x1_SN_LDSB0_GRVWB8_GSU9_GSUAMBSK_GSUC0_GSUWGMRR0_K1_LBSPPB256_MIWT1_1_NLCA4_SU16_SUM0_SUS256_VWB1_WG16_4_1_WGM8_WGMXCC8_WGMXCCG304
    SolutionIndex: 11
    SolutionNameMin: Cijk_Alik_Bljk_HHS_STA_BH_Bias_HAS_SAV_UserArgs_MT16x16x128_MI16x16x1_SN_LDSB0_GRVWB8_GSU7_GSUAMBSK_GSUC0_GSUWGMRR0_K1_LBSPPB256_MIWT1_1_NLCA4_SU16_SUM0_SUS256_VWB1_WG16_4_1_WGM8_WGMXCC8_WGMXCCG304
    SolutionIndex: 12
    SolutionNameMin: Cijk_Alik_Bljk_HHS_STA_BH_Bias_HAS_SAV_UserArgs_MT16x16x128_MI16x16x1_SN_LDSB0_GRVWB8_GSU8_GSUAMB_GSUC0_GSUWGMRR0_K1_LBSPPB256_MIWT1_1_NLCA4_SU16_SUM0_SUS256_VWB1_WG16_4_1_WGM8_WGMXCC8_WGMXCCG304
    SolutionIndex: 13
    SolutionNameMin: Cijk_Alik_Bljk_HHS_STA_BH_Bias_HAS_SAV_UserArgs_MT64x16x128_MI16x16x1_SN_LDSB0_GRVWB8_GSU8_GSUAMB_GSUC0_GSUWGMRR0_K1_LBSPPB256_MIWT1_1_NLCA4_SU16_SUM0_SUS256_VWB1_WG64_4_1_WGM8_WGMXCC8_WGMXCCG304
    SolutionIndex: 14
    SolutionNameMin: Cijk_Alik_Bljk_HHS_STA_BH_Bias_HAS_SAV_UserArgs_MT16x32x128_MI16x16x1_SN_LDSB0_GRVWB8_GSU7_GSUAMBSK_GSUC0_GSUWGMRR0_K1_LBSPPB256_MIWT1_1_NLCA4_SU16_SUM0_SUS256_VWB1_WG16_8_1_WGM8_WGMXCC8_WGMXCCG304
    SolutionIndex: 15
    SolutionNameMin: Cijk_Alik_Bljk_HHS_STA_BH_Bias_HAS_SAV_UserArgs_MT16x32x128_MI16x16x1_SN_LDSB0_GRVWB8_GSU5_GSUAMBSK_GSUC0_GSUWGMRR0_K1_LBSPPB256_MIWT1_1_NLCA4_SU16_SUM0_SUS256_VWB1_WG16_8_1_WGM8_WGMXCC8_WGMXCCG304
    SolutionIndex: 16
    SolutionNameMin: Cijk_Alik_Bljk_HHS_STA_BH_Bias_HAS_SAV_UserArgs_MT16x32x128_MI16x16x1_SN_LDSB0_GRVWB8_GSU6_GSUAMBSK_GSUC0_GSUWGMRR0_K1_LBSPPB256_MIWT1_1_NLCA4_SU16_SUM0_SUS256_VWB1_WG16_8_1_WGM8_WGMXCC8_WGMXCCG304
    SolutionIndex: 17
    SolutionNameMin: Cijk_Alik_Bljk_HHS_STA_BH_Bias_HAS_SAV_UserArgs_MT16x64x128_MI16x16x1_SN_LDSB1_GRVWB8_GSU4_GSUAMBSK_GSUC0_GSUWGMRR0_K1_LBSPPB256_MIWT1_1_NLCA4_SU16_SUM0_SUS256_VWB1_WG16_16_1_WGM8_WGMXCC8_WGMXCCG304
    SolutionIndex: 18
    SolutionNameMin: Cijk_Alik_Bljk_HHS_STA_BH_Bias_HAS_SAV_UserArgs_MT16x16x128_MI16x16x1_SN_LDSB0_GRVWB8_GSU3_GSUAMBSK_GSUC0_GSUWGMRR0_K1_LBSPPB256_MIWT1_1_NLCA4_SU16_SUM0_SUS256_VWB1_WG16_4_1_WGM8_WGMXCC8_WGMXCCG304
    SolutionIndex: 19
    SolutionNameMin: Cijk_Alik_Bljk_HHS_STA_BH_Bias_HAS_SAV_UserArgs_MT16x32x128_MI16x16x1_SN_LDSB0_GRVWB8_GSU2_GSUAMBSK_GSUC0_GSUWGMRR0_K1_LBSPPB256_MIWT1_1_NLCA4_SU16_SUM0_SUS256_VWB1_WG16_8_1_WGM8_WGMXCC8_WGMXCCG304
    SolutionIndex: 20
    SolutionNameMin: Cijk_Alik_Bljk_HHS_STA_BH_Bias_HAS_SAV_UserArgs_MT16x64x128_MI16x16x1_SN_LDSB1_GRVWB8_GSU2_GSUAMBSK_GSUC0_GSUWGMRR0_K1_LBSPPB256_MIWT1_1_NLCA4_SU16_SUM0_SUS256_VWB1_WG16_16_1_WGM8_WGMXCC8_WGMXCCG304
    SolutionIndex: 21
    SolutionNameMin: Cijk_Alik_Bljk_HHS_STA_BH_Bias_HAS_SAV_UserArgs_MT16x48x128_MI16x16x1_SN_LDSB0_GRVWB8_GSU1_GSUAMB_GSUC0_GSUWGMRR0_K1_LBSPPB256_MIWT1_3_NLCA4_SU16_SUM0_SUS256_VWB1_WG16_4_1_WGM8_WGMXCC8_WGMXCCG304
    SolutionIndex: 22
    SolutionNameMin: Cijk_Alik_Bljk_HHS_STA_BH_Bias_HAS_SAV_UserArgs_MT16x64x128_MI16x16x1_SN_LDSB1_GRVWB8_GSU1_GSUAMB_GSUC0_GSUWGMRR0_K1_LBSPPB256_MIWT1_1_NLCA4_SU16_SUM0_SUS256_VWB1_WG16_16_1_WGM8_WGMXCC8_WGMXCCG304
    SolutionIndex: 23
    SolutionNameMin: Cijk_Alik_Bljk_HHS_STA_BH_Bias_HAS_SAV_UserArgs_MT16x48x128_MI16x16x1_SN_LDSB0_GRVWB8_GSU1_GSUAMBSK_GSUC0_GSUWGMRR0_K1_LBSPPB256_MIWT1_3_NLCA4_SU16_SUM0_SUS256_VWB1_WG16_4_1_WGM8_WGMXCC8_WGMXCCG304
    SolutionIndex: 24
    SolutionNameMin: Cijk_Alik_Bljk_HHS_STA_BH_Bias_HAS_SAV_UserArgs_MT16x64x128_MI16x16x1_SN_LDSB1_GRVWB8_GSU1_GSUAMBSK_GSUC0_GSUWGMRR0_K1_LBSPPB256_MIWT1_1_NLCA4_SU16_SUM0_SUS256_VWB1_WG16_16_1_WGM8_WGMXCC8_WGMXCCG304
    SolutionIndex: 25
    SolutionNameMin: Cijk_Alik_Bljk_HHS_STA_BH_Bias_HAS_SAV_UserArgs_MT16x192x128_MI16x16x1_SN_LDSB1_GRVWB8_GSU2_GSUAMBSK_GSUC0_GSUWGMRR0_K1_LBSPPB256_MIWT1_3_NLCA4_SU16_SUM0_SUS256_VWB1_WG16_16_1_WGM8_WGMXCC8_WGMXCCG304
    SolutionIndex: 26
    SolutionNameMin: Cijk_Alik_Bljk_HHS_STA_BH_Bias_HAS_SAV_UserArgs_MT16x192x128_MI16x16x1_SN_LDSB1_GRVWB8_GSU1_GSUAMB_GSUC0_GSUWGMRR0_K1_LBSPPB256_MIWT1_3_NLCA4_SU16_SUM0_SUS256_VWB1_WG16_16_1_WGM8_WGMXCC8_WGMXCCG304
    SolutionIndex: 27
    SolutionNameMin: Cijk_Alik_Bljk_HHS_STA_BH_Bias_HAS_SAV_UserArgs_MT16x192x128_MI16x16x1_SN_LDSB1_GRVWB8_GSU1_GSUAMBSK_GSUC0_GSUWGMRR0_K1_LBSPPB256_MIWT1_3_NLCA4_SU16_SUM0_SUS256_VWB1_WG16_16_1_WGM8_WGMXCC8_WGMXCCG304
    SolutionIndex: 28
    SolutionNameMin: Cijk_Alik_Bljk_HHS_STA_BH_Bias_HAS_SAV_UserArgs_MT16x64x128_MI16x16x1_SN_LDSB1_GRVWB8_GSU4_GSUAMB_GSUC0_GSUWGMRR0_K1_LBSPPB256_MIWT1_1_NLCA4_SU16_SUM0_SUS256_VWB1_WG16_16_1_WGM8_WGMXCC8_WGMXCCG304
    SolutionIndex: 29
    SolutionNameMin: Cijk_Alik_Bljk_HHS_STA_BH_Bias_HAS_SAV_UserArgs_MT16x64x128_MI16x16x1_SN_LDSB1_GRVWB8_GSU2_GSUAMB_GSUC0_GSUWGMRR0_K1_LBSPPB256_MIWT1_1_NLCA4_SU16_SUM0_SUS256_VWB1_WG16_16_1_WGM8_WGMXCC8_WGMXCCG304
    SolutionIndex: 30
    SolutionNameMin: Cijk_Alik_Bljk_HHS_STA_BH_Bias_HAS_SAV_UserArgs_MT32x16x128_MI16x16x1_SN_LDSB0_GRVWB8_GSU1_GSUAMB_GSUC0_GSUWGMRR0_K1_LBSPPB256_MIWT1_1_NLCA4_SU16_SUM0_SUS256_VWB1_WG32_4_1_WGM8_WGMXCC8_WGMXCCG304
    SolutionIndex: 31
    SolutionNameMin: Cijk_Alik_Bljk_HHS_STA_BH_Bias_HAS_SAV_UserArgs_MT32x32x128_MI16x16x1_SN_LDSB0_GRVWB8_GSU1_GSUAMB_GSUC0_GSUWGMRR0_K1_LBSPPB256_MIWT1_1_NLCA4_SU16_SUM0_SUS256_VWB1_WG32_8_1_WGM8_WGMXCC8_WGMXCCG304
    SolutionIndex: 32
    SolutionNameMin: Cijk_Alik_Bljk_HHS_STA_BH_Bias_HAS_SAV_UserArgs_MT64x32x128_MI16x16x1_SN_LDSB0_GRVWB8_GSU1_GSUAMB_GSUC0_GSUWGMRR0_K1_LBSPPB512_MIWT1_2_NLCA4_SU16_SUM0_SUS256_VWB2_WG64_4_1_WGM8_WGMXCC8_WGMXCCG304
    SolutionIndex: 33
    SolutionNameMin: Cijk_Alik_Bljk_HHS_STA_BH_Bias_HAS_SAV_UserArgs_MT64x48x128_MI16x16x1_SN_LDSB0_GRVWB8_GSU1_GSUAMB_GSUC0_GSUWGMRR0_K1_LBSPPB256_MIWT1_3_NLCA4_SU16_SUM0_SUS256_VWB1_WG64_4_1_WGM8_WGMXCC8_WGMXCCG304
    SolutionIndex: 34
    SolutionNameMin: Cijk_Alik_Bljk_HHS_STA_BH_Bias_HAS_SAV_UserArgs_MT128x32x128_MI16x16x1_SN_LDSB0_GRVWB8_GSU1_GSUAMB_GSUC0_GSUWGMRR0_K1_LBSPPB512_MIWT2_2_NLCA4_SU16_SUM0_SUS256_VWB2_WG64_4_1_WGM8_WGMXCC8_WGMXCCG304
    SolutionIndex: 35
    SolutionNameMin: Cijk_Alik_Bljk_HHS_STA_BH_Bias_HAS_SAV_UserArgs_MT128x48x128_MI16x16x1_SN_LDSB0_GRVWB8_GSU1_GSUAMB_GSUC0_GSUWGMRR0_K1_LBSPPB256_MIWT2_3_NLCA4_SU16_SUM0_SUS256_VWB1_WG64_4_1_WGM8_WGMXCC8_WGMXCCG304
    SolutionIndex: 36
    SolutionNameMin: Cijk_Alik_Bljk_HHS_STA_BH_Bias_HAS_SAV_UserArgs_MT128x64x128_MI16x16x1_SN_LDSB1_GRVWB8_GSU1_GSUAMB_GSUC0_GSUWGMRR0_K1_LBSPPB1024_MIWT2_4_NLCA4_SU16_SUM0_SUS256_VWB4_WG64_4_1_WGM8_WGMXCC8_WGMXCCG304
    SolutionIndex: 37
    SolutionNameMin: Cijk_Alik_Bljk_HHS_STA_BH_Bias_HAS_SAV_UserArgs_MT128x80x128_MI16x16x1_SN_LDSB1_GRVWB8_GSU1_GSUAMB_GSUC0_GSUWGMRR0_K1_LBSPPB256_MIWT2_5_NLCA4_SU16_SUM0_SUS256_VWB1_WG64_4_1_WGM8_WGMXCC8_WGMXCCG304
    SolutionIndex: 38
    SolutionNameMin: Cijk_Alik_Bljk_HHS_STA_BH_Bias_HAS_SAV_UserArgs_MT128x96x128_MI16x16x1_SN_LDSB1_GRVWB8_GSU1_GSUAMB_GSUC0_GSUWGMRR0_K1_LBSPPB512_MIWT2_6_NLCA4_SU16_SUM0_SUS256_VWB2_WG64_4_1_WGM8_WGMXCC8_WGMXCCG304
    SolutionIndex: 39
    SolutionNameMin: Cijk_Alik_Bljk_HHS_STA_BH_Bias_HAS_SAV_UserArgs_MT192x64x128_MI16x16x1_SN_LDSB1_GRVWB8_GSU1_GSUAMB_GSUC0_GSUWGMRR0_K1_LBSPPB1024_MIWT3_4_NLCA4_SU16_SUM0_SUS256_VWB4_WG64_4_1_WGM8_WGMXCC8_WGMXCCG304
    SolutionIndex: 40
    SolutionNameMin: Cijk_Alik_Bljk_HHS_STA_BH_Bias_HAS_SAV_UserArgs_MT128x112x128_MI16x16x1_SN_LDSB1_GRVWB8_GSU1_GSUAMB_GSUC0_GSUWGMRR0_K1_LBSPPB256_MIWT2_7_NLCA4_SU16_SUM0_SUS256_VWB1_WG64_4_1_WGM8_WGMXCC8_WGMXCCG304
    SolutionIndex: 41
    SolutionNameMin: Cijk_Alik_Bljk_HHS_STA_BH_Bias_HAS_SAV_UserArgs_MT192x80x128_MI16x16x1_SN_LDSB1_GRVWB8_GSU1_GSUAMB_GSUC0_GSUWGMRR0_K1_LBSPPB256_MIWT3_5_NLCA4_SU16_SUM0_SUS256_VWB1_WG64_4_1_WGM8_WGMXCC8_WGMXCCG304
    SolutionIndex: 42
    SolutionNameMin: Cijk_Alik_Bljk_HHS_STA_BH_Bias_HAS_SAV_UserArgs_MT128x128x128_MI16x16x1_SN_LDSB1_GRVWB8_GSU1_GSUAMB_GSUC0_GSUWGMRR0_K1_LBSPPB2048_MIWT2_8_NLCA4_SU16_SUM0_SUS256_VWB8_WG64_4_1_WGM8_WGMXCC8_WGMXCCG304
    SolutionIndex: 43
    SolutionNameMin: Cijk_Alik_Bljk_HHS_STA_BH_Bias_HAS_SAV_UserArgs_MT256x64x128_MI16x16x1_SN_LDSB1_GRVWB8_GSU1_GSUAMB_GSUC0_GSUWGMRR0_K1_LBSPPB1024_MIWT4_4_NLCA4_SU16_SUM0_SUS256_VWB4_WG64_4_1_WGM8_WGMXCC8_WGMXCCG304
    SolutionIndex: 44
    SolutionNameMin: Cijk_Alik_Bljk_HHS_STA_BH_Bias_HAS_SAV_UserArgs_MT256x96x64_MI16x16x1_SN_LDSB0_GRVWB8_GSU1_GSUAMB_GSUC0_GSUWGMRR0_K1_LBSPPB256_MIWT4_6_NLCA2_SU16_SUM0_SUS256_VWB2_WG64_4_1_WGM8_WGMXCC8_WGMXCCG304
    SolutionIndex: 45
    SolutionNameMin: Cijk_Alik_Bljk_HHS_STA_BH_Bias_HAS_SAV_UserArgs_MT192x128x64_MI16x16x1_SN_LDSB1_GRVWB8_GSU1_GSUAMB_GSUC0_GSUWGMRR0_K1_LBSPPB1024_MIWT3_8_NLCA2_SU16_SUM0_SUS256_VWB8_WG64_4_1_WGM8_WGMXCC8_WGMXCCG304
    SolutionIndex: 46
    SolutionNameMin: Cijk_Alik_Bljk_HHS_STA_BH_Bias_HAS_SAV_UserArgs_MT256x112x64_MI16x16x1_SN_LDSB1_GRVWB4_GSU1_GSUAMB_GSUC0_GSUWGMRR0_K1_LBSPPB128_MIWT4_7_NLCA2_SU16_SUM0_SUS256_VWB1_WG64_4_1_WGM8_WGMXCC8_WGMXCCG304
    SolutionIndex: 47
    SolutionNameMin: Cijk_Alik_Bljk_HHS_STA_BH_Bias_HAS_SAV_UserArgs_MT192x160x64_MI16x16x1_SN_LDSB1_GRVWB8_GSU1_GSUAMB_GSUC0_GSUWGMRR0_K1_LBSPPB256_MIWT3_10_NLCA2_SU16_SUM0_SUS256_VWB2_WG64_4_1_WGM8_WGMXCC8_WGMXCCG304
    SolutionIndex: 48
    SolutionNameMin: Cijk_Alik_Bljk_HHS_STA_BH_Bias_HAS_SAV_UserArgs_MT320x96x64_MI16x16x1_SN_LDSB0_GRVWB8_GSU1_GSUAMB_GSUC0_GSUWGMRR0_K1_LBSPPB256_MIWT5_6_NLCA2_SU16_SUM0_SUS256_VWB2_WG64_4_1_WGM8_WGMXCC8_WGMXCCG304
    SolutionIndex: 49
    SolutionNameMin: Cijk_Alik_Bljk_HHS_STA_BH_Bias_HAS_SAV_UserArgs_MT256x128x64_MI16x16x1_SN_LDSB1_GRVWB8_GSU1_GSUAMB_GSUC0_GSUWGMRR0_K1_LBSPPB1024_MIWT4_8_NLCA2_SU16_SUM0_SUS256_VWB8_WG64_4_1_WGM8_WGMXCC8_WGMXCCG304
    SolutionIndex: 50
    SolutionNameMin: Cijk_Alik_Bljk_HHS_STA_BH_Bias_HAS_SAV_UserArgs_MT256x144x64_MI16x16x1_SN_LDSB0_GRVWB4_GSU1_GSUAMB_GSUC0_GSUWGMRR0_K1_LBSPPB128_MIWT4_9_NLCA2_SU16_SUM0_SUS256_VWB1_WG64_4_1_WGM8_WGMXCC8_WGMXCCG304
    SolutionIndex: 51
    SolutionNameMin: Cijk_Alik_Bljk_HHS_STA_BH_Bias_HAS_SAV_UserArgs_MT256x160x64_MI16x16x1_SN_LDSB0_GRVWB8_GSU1_GSUAMB_GSUC0_GSUWGMRR0_K1_LBSPPB256_MIWT4_10_NLCA2_SU16_SUM0_SUS256_VWB2_WG64_4_1_WGM8_WGMXCC8_WGMXCCG304
    SolutionIndex: 52
    SolutionNameMin: Cijk_Alik_Bljk_HHS_STA_BH_Bias_HAS_SAV_UserArgs_MT256x176x64_MI16x16x1_SN_LDSB0_GRVWB4_GSU1_GSUAMB_GSUC0_GSUWGMRR0_K1_LBSPPB128_MIWT4_11_NLCA2_SU16_SUM0_SUS256_VWB1_WG64_4_1_WGM8_WGMXCC8_WGMXCCG304
    SolutionIndex: 53
    SolutionNameMin: Cijk_Alik_Bljk_HHS_STA_BH_Bias_HAS_SAV_UserArgs_MT256x192x64_MI16x16x1_SN_LDSB0_GRVWB8_GSU1_GSUAMB_GSUC0_GSUWGMRR0_K1_LBSPPB512_MIWT4_12_NLCA2_SU16_SUM0_SUS256_VWB4_WG64_4_1_WGM8_WGMXCC8_WGMXCCG304
    SolutionIndex: 54
    SolutionNameMin: Cijk_Alik_Bljk_HHS_STA_BH_Bias_HAS_SAV_UserArgs_MT192x288x64_MI16x16x1_SN_LDSB1_GRVWB8_GSU1_GSUAMB_GSUC0_GSUWGMRR0_K1_LBSPPB256_MIWT3_18_NLCA2_SU16_SUM0_SUS256_VWB2_WG64_4_1_WGM8_WGMXCC8_WGMXCCG304
    SolutionIndex: 55
    SolutionNameMin: Cijk_Alik_Bljk_HHS_STA_BH_Bias_HAS_SAV_UserArgs_MT256x208x64_MI16x16x1_SN_LDSB1_GRVWB4_GSU1_GSUAMB_GSUC0_GSUWGMRR0_K1_LBSPPB128_MIWT4_13_NLCA2_SU16_SUM0_SUS256_VWB1_WG64_4_1_WGM8_WGMXCC8_WGMXCCG304
    SolutionIndex: 56
    SolutionNameMin: Cijk_Alik_Bljk_HHS_STA_BH_Bias_HAS_SAV_UserArgs_MT256x224x64_MI16x16x1_SN_LDSB0_GRVWB8_GSU1_GSUAMB_GSUC0_GSUWGMRR0_K1_LBSPPB256_MIWT4_14_NLCA2_SU16_SUM0_SUS256_VWB2_WG64_4_1_WGM8_WGMXCC8_WGMXCCG304
    SolutionIndex: 57
    SolutionNameMin: Cijk_Alik_Bljk_HHS_STA_BH_Bias_HAS_SAV_UserArgs_MT320x192x64_MI16x16x1_SN_LDSB0_GRVWB8_GSU1_GSUAMB_GSUC0_GSUWGMRR0_K1_LBSPPB512_MIWT5_12_NLCA2_SU16_SUM0_SUS256_VWB4_WG64_4_1_WGM8_WGMXCC8_WGMXCCG304
    SolutionIndex: 58
    SolutionNameMin: Cijk_Alik_Bljk_HHS_STA_BH_Bias_HAS_SAV_UserArgs_MT256x256x64_MI16x16x1_SN_LDSB1_GRVWB8_GSU1_GSUAMB_GSUC0_GSUWGMRR0_K1_LBSPPB1024_MIWT4_16_NLCA2_SU16_SUM0_SUS256_VWB8_WG64_4_1_WGM8_WGMXCC8_WGMXCCG304
    SolutionIndex: 59
    SolutionNameMin: Cijk_Alik_Bljk_HHS_STA_BH_Bias_HAS_SAV_UserArgs_MT192x192x64_MI16x16x1_SN_LDSB0_GRVWB8_GSU1_GSUAMB_GSUC0_GSUWGMRR0_K1_LBSPPB512_MIWT3_12_NLCA2_SU16_SUM0_SUS256_VWB4_WG64_4_1_WGM8_WGMXCC8_WGMXCCG304
    SolutionIndex: 60
    SolutionNameMin: Cijk_Alik_Bljk_HHS_STA_BH_Bias_HAS_SAV_UserArgs_MT256x240x64_MI16x16x1_SN_LDSB1_GRVWB4_GSU1_GSUAMB_GSUC0_GSUWGMRR0_K1_LBSPPB128_MIWT4_15_NLCA2_SU16_SUM0_SUS256_VWB1_WG64_4_1_WGM8_WGMXCC8_WGMXCCG304
    SolutionIndex: 61
    SolutionNameMin: Cijk_Alik_Bljk_HHS_STA_BH_Bias_HAS_SAV_UserArgs_MT320x160x64_MI16x16x1_SN_LDSB0_GRVWB8_GSU1_GSUAMB_GSUC0_GSUWGMRR0_K1_LBSPPB256_MIWT5_10_NLCA2_SU16_SUM0_SUS256_VWB2_WG64_4_1_WGM8_WGMXCC8_WGMXCCG304
    SolutionIndex: 62
    SolutionNameMin: Cijk_Alik_Bljk_HHS_STA_BH_Bias_HAS_SAV_UserArgs_MT16x16x128_MI16x16x1_SN_LDSB0_GRVWB8_GSU1_GSUAMB_GSUC0_GSUWGMRR0_K1_LBSPPB256_MIWT1_1_NLCA4_SU16_SUM0_SUS256_VWB1_WG16_4_1_WGM8_WGMXCC8_WGMXCCG304
    SolutionIndex: 63
    SolutionNameMin: Cijk_Alik_Bljk_HHS_STA_BH_Bias_HAS_SAV_UserArgs_MT64x16x128_MI16x16x1_SN_LDSB0_GRVWB8_GSU1_GSUAMB_GSUC0_GSUWGMRR0_K1_LBSPPB256_MIWT1_1_NLCA4_SU16_SUM0_SUS256_VWB1_WG64_4_1_WGM8_WGMXCC8_WGMXCCG304
    SolutionIndex: 64
    SolutionNameMin: Cijk_Alik_Bljk_HHS_STA_BH_Bias_HAS_SAV_UserArgs_MT192x48x128_MI16x16x1_SN_LDSB0_GRVWB8_GSU1_GSUAMB_GSUC0_GSUWGMRR0_K1_LBSPPB256_MIWT3_3_NLCA4_SU16_SUM0_SUS256_VWB1_WG64_4_1_WGM8_WGMXCC8_WGMXCCG304
    SolutionIndex: 65
    SolutionNameMin: Cijk_Alik_Bljk_HHS_STA_BH_Bias_HAS_SAV_UserArgs_MT192x96x64_MI16x16x1_SN_LDSB0_GRVWB8_GSU1_GSUAMB_GSUC0_GSUWGMRR0_K1_LBSPPB256_MIWT3_6_NLCA2_SU16_SUM0_SUS256_VWB2_WG64_4_1_WGM8_WGMXCC8_WGMXCCG304
    SolutionIndex: 66
    SolutionNameMin: Cijk_Alik_Bljk_HHS_STA_BH_Bias_HAS_SAV_UserArgs_MT192x96x128_MI16x16x1_SN_LDSB1_GRVWB8_GSU1_GSUAMB_GSUC0_GSUWGMRR0_K1_LBSPPB512_MIWT3_6_NLCA4_SU16_SUM0_SUS256_VWB2_WG64_4_1_WGM8_WGMXCC8_WGMXCCG304
    SolutionIndex: 67
    SolutionNameMin: Cijk_Alik_Bljk_HHS_STA_BH_Bias_HAS_SAV_UserArgs_MT192x112x64_MI16x16x1_SN_LDSB1_GRVWB4_GSU1_GSUAMB_GSUC0_GSUWGMRR0_K1_LBSPPB128_MIWT3_7_NLCA2_SU16_SUM0_SUS256_VWB1_WG64_4_1_WGM8_WGMXCC8_WGMXCCG304
    SolutionIndex: 68
    SolutionNameMin: Cijk_Alik_Bljk_HHS_STA_BH_Bias_HAS_SAV_UserArgs_MT384x64x64_MI16x16x1_SN_LDSB0_GRVWB8_GSU1_GSUAMB_GSUC0_GSUWGMRR0_K1_LBSPPB512_MIWT6_4_NLCA2_SU16_SUM0_SUS256_VWB4_WG64_4_1_WGM8_WGMXCC8_WGMXCCG304
    SolutionIndex: 69
    SolutionNameMin: Cijk_Alik_Bljk_HHS_STA_BH_Bias_HAS_SAV_UserArgs_MT192x224x64_MI16x16x1_SN_LDSB0_GRVWB8_GSU1_GSUAMB_GSUC0_GSUWGMRR0_K1_LBSPPB256_MIWT3_14_NLCA2_SU16_SUM0_SUS256_VWB2_WG64_4_1_WGM8_WGMXCC8_WGMXCCG304
    SolutionIndex: 70
    SolutionNameMin: Cijk_Alik_Bljk_HHS_STA_BH_Bias_HAS_SAV_UserArgs_MT384x112x64_MI16x16x1_SN_LDSB0_GRVWB4_GSU1_GSUAMB_GSUC0_GSUWGMRR0_K1_LBSPPB128_MIWT6_7_NLCA2_SU16_SUM0_SUS256_VWB1_WG64_4_1_WGM8_WGMXCC8_WGMXCCG304
    SolutionIndex: 71
    SolutionNameMin: Cijk_Alik_Bljk_HHS_STA_BH_Bias_HAS_SAV_UserArgs_MT192x256x64_MI16x16x1_SN_LDSB1_GRVWB8_GSU1_GSUAMB_GSUC0_GSUWGMRR0_K1_LBSPPB1024_MIWT3_16_NLCA2_SU16_SUM0_SUS256_VWB8_WG64_4_1_WGM8_WGMXCC8_WGMXCCG304
    SolutionIndex: 72
    SolutionNameMin: Cijk_Alik_Bljk_HHS_STA_BH_Bias_HAS_SAV_UserArgs_MT384x128x64_MI16x16x1_SN_LDSB0_GRVWB8_GSU1_GSUAMB_GSUC0_GSUWGMRR0_K1_LBSPPB1024_MIWT6_8_NLCA2_SU16_SUM0_SUS256_VWB8_WG64_4_1_WGM8_WGMXCC8_WGMXCCG304
    SolutionIndex: 73
    SolutionNameMin: Cijk_Alik_Bljk_HHS_STA_BH_Bias_HAS_SAV_UserArgs_MT384x144x64_MI16x16x1_SN_LDSB0_GRVWB4_GSU1_GSUAMB_GSUC0_GSUWGMRR0_K1_LBSPPB128_MIWT6_9_NLCA2_SU16_SUM0_SUS256_VWB1_WG64_4_1_WGM8_WGMXCC8_WGMXCCG304
    SolutionIndex: 74
    SolutionNameMin: Cijk_Alik_Bljk_HHS_STA_BH_Bias_HAS_SAV_UserArgs_MT512x128x64_MI16x16x1_SN_LDSB0_GRVWB8_GSU1_GSUAMB_GSUC0_GSUWGMRR0_K1_LBSPPB1024_MIWT8_8_NLCA2_SU16_SUM0_SUS256_VWB8_WG64_4_1_WGM8_WGMXCC8_WGMXCCG304
    SolutionIndex: 75
    SolutionNameMin: Cijk_Alik_Bljk_HHS_STA_BH_Bias_HAS_SAV_UserArgs_MT192x176x64_MI16x16x1_SN_LDSB0_GRVWB4_GSU1_GSUAMB_GSUC0_GSUWGMRR0_K1_LBSPPB128_MIWT3_11_NLCA2_SU16_SUM0_SUS256_VWB1_WG64_4_1_WGM8_WGMXCC8_WGMXCCG304
    SolutionIndex: 76
    SolutionNameMin: Cijk_Alik_Bljk_HHS_STA_BH_Bias_HAS_SAV_UserArgs_MT384x160x64_MI16x16x1_SN_LDSB0_GRVWB8_GSU1_GSUAMB_GSUC0_GSUWGMRR0_K1_LBSPPB256_MIWT6_10_NLCA2_SU16_SUM0_SUS256_VWB2_WG64_4_1_WGM8_WGMXCC8_WGMXCCG304
    SolutionIndex: 77
    SolutionNameMin: Cijk_Alik_Bljk_HHS_STA_BH_Bias_HAS_SAV_UserArgs_MT256x16x64_MI16x16x1_SN_LDSB0_GRVWB4_GSU1_GSUAMBSK_GSUC0_GSUWGMRR0_K1_LBSPPB128_MIWT4_1_NLCA2_SU16_SUM0_SUS256_VWB1_WGM8_WGMXCC8_WGMXCCG304
    SolutionIndex: 78
    SolutionNameMin: Cijk_Alik_Bljk_HHS_STA_BH_Bias_HAS_SAV_UserArgs_MT256x32x128_MI16x16x1_SN_LDSB0_GRVWB8_GSU1_GSUAMB_GSUC0_GSUWGMRR0_K1_LBSPPB512_MIWT4_2_NLCA4_SU16_SUM0_SUS256_VWB2_WGM8_WGMXCC8_WGMXCCG304
    SolutionIndex: 79
    SolutionNameMin: Cijk_Alik_Bljk_HHS_STA_BH_Bias_HAS_SAV_UserArgs_MT256x48x128_MI16x16x1_SN_LDSB0_GRVWB8_GSU1_GSUAMB_GSUC0_GSUWGMRR0_K1_LBSPPB256_MIWT4_3_NLCA4_SU16_SUM0_SUS256_VWB1_WGM8_WGMXCC8_WGMXCCG304
    SolutionIndex: 80
    SolutionNameMin: Cijk_Alik_Bljk_HHS_STA_BH_Bias_HAS_SAV_UserArgs_MT320x32x128_MI16x16x1_SN_LDSB0_GRVWB8_GSU1_GSUAMB_GSUC0_GSUWGMRR0_K1_LBSPPB512_MIWT5_2_NLCA4_SU16_SUM0_SUS256_VWB2_WGM8_WGMXCC8_WGMXCCG304
    SolutionIndex: 81
    SolutionNameMin: Cijk_Alik_Bljk_HHS_STA_BH_Bias_HAS_SAV_UserArgs_MT320x48x128_MI16x16x1_SN_LDSB0_GRVWB8_GSU1_GSUAMB_GSUC0_GSUWGMRR0_K1_LBSPPB256_MIWT5_3_NLCA4_SU16_SUM0_SUS256_VWB1_WGM8_WGMXCC8_WGMXCCG304
    SolutionIndex: 82
    SolutionNameMin: Cijk_Alik_Bljk_HHS_STA_BH_Bias_HAS_SAV_UserArgs_MT256x64x128_MI16x16x1_SN_LDSB1_GRVWB8_GSU1_GSUAMB_GSUC0_GSUWGMRR0_K1_LBSPPB1024_MIWT4_4_NLCA4_SU16_SUM0_SUS256_VWB4_WGM8_WGMXCC8_WGMXCCG304
    SolutionIndex: 83
    SolutionNameMin: Cijk_Alik_Bljk_HHS_STA_BH_Bias_HAS_SAV_UserArgs_MT320x48x128_MI16x16x1_SN_LDSB0_GRVWB8_GSU1_GSUAMBSK_GSUC0_GSUWGMRR0_K1_LBSPPB256_MIWT5_3_NLCA4_SU16_SUM0_SUS256_VWB1_WGM8_WGMXCC8_WGMXCCG304
    SolutionIndex: 84
    SolutionNameMin: Cijk_Alik_Bljk_HHS_STA_BH_Bias_HAS_SAV_UserArgs_MT256x96x64_MI16x16x1_SN_LDSB0_GRVWB8_GSU1_GSUAMBSK_GSUC0_GSUWGMRR0_K1_LBSPPB256_MIWT4_6_NLCA2_SU16_SUM0_SUS256_VWB2_WGM8_WGMXCC8_WGMXCCG304
    SolutionIndex: 85
    SolutionNameMin: Cijk_Alik_Bljk_HHS_STA_BH_Bias_HAS_SAV_UserArgs_MT320x64x64_MI16x16x1_SN_LDSB0_GRVWB8_GSU1_GSUAMBSK_GSUC0_GSUWGMRR0_K1_LBSPPB512_MIWT5_4_NLCA2_SU16_SUM0_SUS256_VWB4_WGM8_WGMXCC8_WGMXCCG304
    SolutionIndex: 86
    SolutionNameMin: Cijk_Alik_Bljk_HHS_STA_BH_Bias_HAS_SAV_UserArgs_MT320x80x64_MI16x16x1_SN_LDSB0_GRVWB4_GSU1_GSUAMB_GSUC0_GSUWGMRR0_K1_LBSPPB128_MIWT5_5_NLCA2_SU16_SUM0_SUS256_VWB1_WGM8_WGMXCC8_WGMXCCG304
    SolutionIndex: 87
    SolutionNameMin: Cijk_Alik_Bljk_HHS_STA_BH_Bias_HAS_SAV_UserArgs_MT256x112x64_MI16x16x1_SN_LDSB1_GRVWB4_GSU1_GSUAMB_GSUC0_GSUWGMRR0_K1_LBSPPB128_MIWT4_7_NLCA2_SU16_SUM0_SUS256_VWB1_WGM8_WGMXCC8_WGMXCCG304
    SolutionIndex: 88
    SolutionNameMin: Cijk_Alik_Bljk_HHS_STA_BH_Bias_HAS_SAV_UserArgs_MT320x80x64_MI16x16x1_SN_LDSB0_GRVWB4_GSU1_GSUAMBSK_GSUC0_GSUWGMRR0_K1_LBSPPB128_MIWT5_5_NLCA2_SU16_SUM0_SUS256_VWB1_WGM8_WGMXCC8_WGMXCCG304
    SolutionIndex: 89
    SolutionNameMin: Cijk_Alik_Bljk_HHS_STA_BH_Bias_HAS_SAV_UserArgs_MT256x128x64_MI16x16x1_SN_LDSB1_GRVWB8_GSU1_GSUAMBSK_GSUC0_GSUWGMRR0_K1_LBSPPB1024_MIWT4_8_NLCA2_SU16_SUM0_SUS256_VWB8_WGM8_WGMXCC8_WGMXCCG304
    SolutionIndex: 90
    SolutionNameMin: Cijk_Alik_Bljk_HHS_STA_BH_Bias_HAS_SAV_UserArgs_MT320x96x64_MI16x16x1_SN_LDSB0_GRVWB8_GSU1_GSUAMB_GSUC0_GSUWGMRR0_K1_LBSPPB256_MIWT5_6_NLCA2_SU16_SUM0_SUS256_VWB2_WGM8_WGMXCC8_WGMXCCG304
    SolutionIndex: 91
    SolutionNameMin: Cijk_Alik_Bljk_HHS_STA_BH_Bias_HAS_SAV_UserArgs_MT320x112x64_MI16x16x1_SN_LDSB0_GRVWB4_GSU1_GSUAMB_GSUC0_GSUWGMRR0_K1_LBSPPB128_MIWT5_7_NLCA2_SU16_SUM0_SUS256_VWB1_WGM8_WGMXCC8_WGMXCCG304
    SolutionIndex: 92
    SolutionNameMin: Cijk_Alik_Bljk_HHS_STA_BH_Bias_HAS_SAV_UserArgs_MT256x176x64_MI16x16x1_SN_LDSB0_GRVWB4_GSU1_GSUAMB_GSUC0_GSUWGMRR0_K1_LBSPPB128_MIWT4_11_NLCA2_SU16_SUM0_SUS256_VWB1_WGM8_WGMXCC8_WGMXCCG304
    SolutionIndex: 93
    SolutionNameMin: Cijk_Alik_Bljk_HHS_STA_BH_Bias_HAS_SAV_UserArgs_MT384x128x64_MI16x16x1_SN_LDSB0_GRVWB8_GSU1_GSUAMB_GSUC0_GSUWGMRR0_K1_LBSPPB1024_MIWT6_8_NLCA2_SU16_SUM0_SUS256_VWB8_WGM8_WGMXCC8_WGMXCCG304
    SolutionIndex: 94
    SolutionNameMin: Cijk_Alik_Bljk_HHS_STA_BH_Bias_HAS_SAV_UserArgs_MT320x128x64_MI16x16x1_SN_LDSB0_GRVWB8_GSU1_GSUAMB_GSUC0_GSUWGMRR0_K1_LBSPPB1024_MIWT5_8_NLCA2_SU16_SUM0_SUS256_VWB8_WGM8_WGMXCC8_WGMXCCG304
    SolutionIndex: 95
    SolutionNameMin: Cijk_Alik_Bljk_HHS_STA_BH_Bias_HAS_SAV_UserArgs_MT320x144x64_MI16x16x1_SN_LDSB0_GRVWB4_GSU1_GSUAMB_GSUC0_GSUWGMRR0_K1_LBSPPB128_MIWT5_9_NLCA2_SU16_SUM0_SUS256_VWB1_WGM8_WGMXCC8_WGMXCCG304
    SolutionIndex: 96
    SolutionNameMin: Cijk_Alik_Bljk_HHS_STA_BH_Bias_HAS_SAV_UserArgs_MT256x208x64_MI16x16x1_SN_LDSB1_GRVWB4_GSU1_GSUAMB_GSUC0_GSUWGMRR0_K1_LBSPPB128_MIWT4_13_NLCA2_SU16_SUM0_SUS256_VWB1_WGM8_WGMXCC8_WGMXCCG304
    SolutionIndex: 97
    SolutionNameMin: Cijk_Alik_Bljk_HHS_STA_BH_Bias_HAS_SAV_UserArgs_MT320x160x64_MI16x16x1_SN_LDSB0_GRVWB8_GSU1_GSUAMB_GSUC0_GSUWGMRR0_K1_LBSPPB256_MIWT5_10_NLCA2_SU16_SUM0_SUS256_VWB2_WGM8_WGMXCC8_WGMXCCG304
    SolutionIndex: 98
    SolutionNameMin: Cijk_Alik_Bljk_HHS_STA_BH_Bias_HAS_SAV_UserArgs_MT320x176x64_MI16x16x1_SN_LDSB0_GRVWB4_GSU1_GSUAMB_GSUC0_GSUWGMRR0_K1_LBSPPB128_MIWT5_11_NLCA2_SU16_SUM0_SUS256_VWB1_WGM8_WGMXCC8_WGMXCCG304
    SolutionIndex: 99
    SolutionNameMin: Cijk_Alik_Bljk_HHS_STA_BH_Bias_HAS_SAV_UserArgs_MT320x192x64_MI16x16x1_SN_LDSB0_GRVWB8_GSU1_GSUAMB_GSUC0_GSUWGMRR0_K1_LBSPPB512_MIWT5_12_NLCA2_SU16_SUM0_SUS256_VWB4_WGM8_WGMXCC8_WGMXCCG304
    SolutionIndex: 100
    SolutionNameMin: Cijk_Alik_Bljk_HHS_STA_BH_Bias_HAS_SAV_UserArgs_MT256x96x64_MI16x16x1_SN_LDSB0_GRVWB8_GSU1_GSUAMB_GSUC0_GSUWGMRR0_K1_LBSPPB256_MIWT4_6_NLCA2_SU16_SUM0_SUS256_VWB2_WGM8_WGMXCC8_WGMXCCG304
    SolutionIndex: 101
    SolutionNameMin: Cijk_Alik_Bljk_HHS_STA_BH_Bias_HAS_SAV_UserArgs_MT256x160x64_MI16x16x1_SN_LDSB0_GRVWB8_GSU1_GSUAMB_GSUC0_GSUWGMRR0_K1_LBSPPB256_MIWT4_10_NLCA2_SU16_SUM0_SUS256_VWB2_WGM8_WGMXCC8_WGMXCCG304
    SolutionIndex: 102
    SolutionNameMin: Cijk_Alik_Bljk_HHS_STA_BH_Bias_HAS_SAV_UserArgs_MT256x128x64_MI16x16x1_SN_LDSB1_GRVWB8_GSU1_GSUAMB_GSUC0_GSUWGMRR0_K1_LBSPPB1024_MIWT4_8_NLCA2_SU16_SUM0_SUS256_VWB8_WGM8_WGMXCC8_WGMXCCG304
    SolutionIndex: 103
    SolutionNameMin: Cijk_Alik_Bljk_HHS_STA_BH_Bias_HAS_SAV_UserArgs_MT256x192x64_MI16x16x1_SN_LDSB0_GRVWB8_GSU1_GSUAMB_GSUC0_GSUWGMRR0_K1_LBSPPB512_MIWT4_12_NLCA2_SU16_SUM0_SUS256_VWB4_WGM8_WGMXCC8_WGMXCCG304
    SolutionIndex: 104
    SolutionNameMin: Cijk_Alik_Bljk_HHS_STA_BH_Bias_HAS_SAV_UserArgs_MT256x240x64_MI16x16x1_SN_LDSB1_GRVWB4_GSU1_GSUAMB_GSUC0_GSUWGMRR0_K1_LBSPPB128_MIWT4_15_NLCA2_SU16_SUM0_SUS256_VWB1_WGM8_WGMXCC8_WGMXCCG304
    SolutionIndex: 105
    SolutionNameMin: Cijk_Alik_Bljk_HHS_STA_BH_Bias_HAS_SAV_UserArgs_MT256x256x64_MI16x16x1_SN_LDSB1_GRVWB8_GSU1_GSUAMB_GSUC0_GSUWGMRR0_K1_LBSPPB1024_MIWT4_16_NLCA2_SU16_SUM0_SUS256_VWB8_WGM8_WGMXCC8_WGMXCCG304
    SolutionIndex: 106
    SolutionNameMin: Cijk_Alik_Bljk_HHS_STA_BH_Bias_HAS_SAV_UserArgs_MT256x144x64_MI16x16x1_SN_LDSB0_GRVWB4_GSU1_GSUAMB_GSUC0_GSUWGMRR0_K1_LBSPPB128_MIWT4_9_NLCA2_SU16_SUM0_SUS256_VWB1_WGM8_WGMXCC8_WGMXCCG304
    SolutionIndex: 107
    SolutionNameMin: Cijk_Alik_Bljk_HHS_STA_BH_Bias_HAS_SAV_UserArgs_MT256x224x64_MI16x16x1_SN_LDSB0_GRVWB8_GSU1_GSUAMB_GSUC0_GSUWGMRR0_K1_LBSPPB256_MIWT4_14_NLCA2_SU16_SUM0_SUS256_VWB2_WGM8_WGMXCC8_WGMXCCG304
    SolutionIndex: 108
    SolutionNameMin: Cijk_Alik_Bljk_HHS_STA_BH_Bias_HAS_SAV_UserArgs_MT256x80x64_MI16x16x1_SN_LDSB0_GRVWB4_GSU1_GSUAMB_GSUC0_GSUWGMRR0_K1_LBSPPB128_MIWT4_5_NLCA2_SU16_SUM0_SUS256_VWB1_WGM8_WGMXCC8_WGMXCCG304
    SolutionIndex: 109
    SolutionNameMin: Cijk_Alik_Bljk_HHS_STA_BH_Bias_HAS_SAV_UserArgs_MT256x80x64_MI16x16x1_SN_LDSB0_GRVWB4_GSU1_GSUAMB_GSUC0_GSUWGMRR0_K1_LBSPPB128_MIWT4_5_NLCA2_SU16_SUM0_SUS256_VWB1_WG64_4_1_WGM8_WGMXCC8_WGMXCCG304
    SolutionIndex: 110
    SolutionNameMin: Cijk_Alik_Bljk_HHS_STA_BH_Bias_HAS_SAV_UserArgs_MT256x112x64_MI16x16x1_SN_LDSB1_GRVWB4_GSU1_GSUAMBSK_GSUC0_GSUWGMRR0_K1_LBSPPB128_MIWT4_7_NLCA2_SU16_SUM0_SUS256_VWB1_WG64_4_1_WGM8_WGMXCC8_WGMXCCG304
    SolutionIndex: 111
    SolutionNameMin: Cijk_Alik_Bljk_HHS_STA_BH_Bias_HAS_SAV_UserArgs_MT320x96x64_MI16x16x1_SN_LDSB0_GRVWB8_GSU1_GSUAMB_GSUC0_GSUWGMRR0_K1_LBSPPB256_MIWT5_6_NLCA2_SU16_SUM0_SUS256_VWB2_WG64_4_1_WGM8_WGMXCC8_WGMXCCG304
    SolutionIndex: 112
    SolutionNameMin: Cijk_Alik_Bljk_HHS_STA_BH_Bias_HAS_SAV_UserArgs_MT320x64x64_MI16x16x1_SN_LDSB0_GRVWB8_GSU1_GSUAMB_GSUC0_GSUWGMRR0_K1_LBSPPB512_MIWT5_4_NLCA2_SU16_SUM0_SUS256_VWB4_WG64_4_1_WGM8_WGMXCC8_WGMXCCG304
    SolutionIndex: 113
    SolutionNameMin: Cijk_Alik_Bljk_HHS_STA_BH_Bias_HAS_SAV_UserArgs_MT320x64x64_MI16x16x1_SN_LDSB0_GRVWB8_GSU1_GSUAMBSK_GSUC0_GSUWGMRR0_K1_LBSPPB512_MIWT5_4_NLCA2_SU16_SUM0_SUS256_VWB4_WG64_4_1_WGM8_WGMXCC8_WGMXCCG304
    SolutionIndex: 114
    SolutionNameMin: Cijk_Alik_Bljk_HHS_STA_BH_Bias_HAS_SAV_UserArgs_MT192x256x64_MI16x16x1_SN_LDSB1_GRVWB8_GSU1_GSUAMB_GSUC0_GSUWGMRR0_K1_LBSPPB1024_MIWT3_16_NLCA2_SU16_SUM0_SUS256_VWB8_WG64_4_1_WGM8_WGMXCC8_WGMXCCG304
    SolutionIndex: 115
    SolutionNameMin: Cijk_Alik_Bljk_HHS_STA_BH_Bias_HAS_SAB_SAV_UserArgs_MT192x16x64_MI16x16x1_SN_LDSB0_GRVWB4_GSU1_GSUC0_GSUWGMRR0_K1_LBSPPB128_MIWT3_1_NLCA2_SU16_SUM0_SUS128_VWB1_WG64_4_1_WGM8_WGMXCC8_WGMXCCG304
    SolutionIndex: 116
    SolutionNameMin: Cijk_Alik_Bljk_HHS_STA_BH_Bias_HAS_SAB_SAV_UserArgs_MT192x32x128_MI16x16x1_SN_LDSB0_GRVWB8_GSU1_GSUC0_GSUWGMRR0_K1_LBSPPB512_MIWT3_2_NLCA4_SU16_SUM0_SUS256_VWB2_WG64_4_1_WGM8_WGMXCC8_WGMXCCG304
    SolutionIndex: 117
    SolutionNameMin: Cijk_Alik_Bljk_HHS_STA_BH_Bias_HAS_SAB_SAV_UserArgs_MT256x48x128_MI16x16x1_SN_LDSB0_GRVWB8_GSU1_GSUC0_GSUWGMRR0_K1_LBSPPB256_MIWT4_3_NLCA4_SU16_SUM0_SUS256_VWB1_WG64_4_1_WGM8_WGMXCC8_WGMXCCG304
    SolutionIndex: 118
    SolutionNameMin: Cijk_Alik_Bljk_HHS_STA_BH_Bias_HAS_SAB_SAV_UserArgs_MT192x64x128_MI16x16x1_SN_LDSB1_GRVWB8_GSU1_GSUC0_GSUWGMRR0_K1_LBSPPB1024_MIWT3_4_NLCA4_SU16_SUM0_SUS256_VWB4_WG64_4_1_WGM8_WGMXCC8_WGMXCCG304
    SolutionIndex: 119
    SolutionNameMin: Cijk_Alik_Bljk_HHS_STA_BH_Bias_HAS_SAB_SAV_UserArgs_MT192x80x128_MI16x16x1_SN_LDSB1_GRVWB8_GSU1_GSUC0_GSUWGMRR0_K1_LBSPPB256_MIWT3_5_NLCA4_SU16_SUM0_SUS256_VWB1_WG64_4_1_WGM8_WGMXCC8_WGMXCCG304
    SolutionIndex: 120
    SolutionNameMin: Cijk_Alik_Bljk_HHS_STA_BH_Bias_HAS_SAB_SAV_UserArgs_MT128x96x128_MI16x16x1_SN_LDSB1_GRVWB8_GSU1_GSUC0_GSUWGMRR0_K1_LBSPPB512_MIWT2_6_NLCA4_SU16_SUM0_SUS256_VWB2_WG64_4_1_WGM8_WGMXCC8_WGMXCCG304
    SolutionIndex: 121
    SolutionNameMin: Cijk_Alik_Bljk_HHS_STA_BH_Bias_HAS_SAB_SAV_UserArgs_MT128x112x128_MI16x16x1_SN_LDSB1_GRVWB8_GSU1_GSUC0_GSUWGMRR0_K1_LBSPPB256_MIWT2_7_NLCA4_SU16_SUM0_SUS256_VWB1_WG64_4_1_WGM8_WGMXCC8_WGMXCCG304
    SolutionIndex: 122
    SolutionNameMin: Cijk_Alik_Bljk_HHS_STA_BH_Bias_HAS_SAB_SAV_UserArgs_MT256x64x128_MI16x16x1_SN_LDSB1_GRVWB8_GSU1_GSUC0_GSUWGMRR0_K1_LBSPPB1024_MIWT4_4_NLCA4_SU16_SUM0_SUS256_VWB4_WG64_4_1_WGM8_WGMXCC8_WGMXCCG304
    SolutionIndex: 123
    SolutionNameMin: Cijk_Alik_Bljk_HHS_STA_BH_Bias_HAS_SAB_SAV_UserArgs_MT320x48x128_MI16x16x1_SN_LDSB0_GRVWB8_GSU1_GSUC0_GSUWGMRR0_K1_LBSPPB256_MIWT5_3_NLCA4_SU16_SUM0_SUS256_VWB1_WG64_4_1_WGM8_WGMXCC8_WGMXCCG304
    SolutionIndex: 124
    SolutionNameMin: Cijk_Alik_Bljk_HHS_STA_BH_Bias_HAS_SAB_SAV_UserArgs_MT256x80x64_MI16x16x1_SN_LDSB0_GRVWB4_GSU1_GSUC0_GSUWGMRR0_K1_LBSPPB128_MIWT4_5_NLCA2_SU16_SUM0_SUS128_VWB1_WG64_4_1_WGM8_WGMXCC8_WGMXCCG304
    SolutionIndex: 125
    SolutionNameMin: Cijk_Alik_Bljk_HHS_STA_BH_Bias_HAS_SAB_SAV_UserArgs_MT384x64x64_MI16x16x1_SN_LDSB0_GRVWB8_GSU1_GSUC0_GSUWGMRR0_K1_LBSPPB512_MIWT6_4_NLCA2_SU16_SUM0_SUS128_VWB4_WG64_4_1_WGM8_WGMXCC8_WGMXCCG304
    SolutionIndex: 126
    SolutionNameMin: Cijk_Alik_Bljk_HHS_STA_BH_Bias_HAS_SAB_SAV_UserArgs_MT320x64x64_MI16x16x1_SN_LDSB0_GRVWB8_GSU1_GSUC0_GSUWGMRR0_K1_LBSPPB512_MIWT5_4_NLCA2_SU16_SUM0_SUS128_VWB4_WG64_4_1_WGM8_WGMXCC8_WGMXCCG304
    SolutionIndex: 127
    SolutionNameMin: Cijk_Alik_Bljk_HHS_STA_BH_Bias_HAS_SAB_SAV_UserArgs_MT256x112x64_MI16x16x1_SN_LDSB1_GRVWB4_GSU1_GSUC0_GSUWGMRR0_K1_LBSPPB128_MIWT4_7_NLCA2_SU16_SUM0_SUS128_VWB1_WG64_4_1_WGM8_WGMXCC8_WGMXCCG304
    SolutionIndex: 128
    SolutionNameMin: Cijk_Alik_Bljk_HHS_STA_BH_Bias_HAS_SAB_SAV_UserArgs_MT320x80x64_MI16x16x1_SN_LDSB0_GRVWB4_GSU1_GSUC0_GSUWGMRR0_K1_LBSPPB128_MIWT5_5_NLCA2_SU16_SUM0_SUS128_VWB1_WG64_4_1_WGM8_WGMXCC8_WGMXCCG304
    SolutionIndex: 129
    SolutionNameMin: Cijk_Alik_Bljk_HHS_STA_BH_Bias_HAS_SAB_SAV_UserArgs_MT256x128x64_MI16x16x1_SN_LDSB1_GRVWB8_GSU1_GSUC0_GSUWGMRR0_K1_LBSPPB1024_MIWT4_8_NLCA2_SU16_SUM0_SUS128_VWB8_WG64_4_1_WGM8_WGMXCC8_WGMXCCG304
    SolutionIndex: 130
    SolutionNameMin: Cijk_Alik_Bljk_HHS_STA_BH_Bias_HAS_SAB_SAV_UserArgs_MT256x144x64_MI16x16x1_SN_LDSB0_GRVWB4_GSU1_GSUC0_GSUWGMRR0_K1_LBSPPB128_MIWT4_9_NLCA2_SU16_SUM0_SUS128_VWB1_WG64_4_1_WGM8_WGMXCC8_WGMXCCG304
    SolutionIndex: 131
    SolutionNameMin: Cijk_Alik_Bljk_HHS_STA_BH_Bias_HAS_SAB_SAV_UserArgs_MT320x96x64_MI16x16x1_SN_LDSB0_GRVWB8_GSU1_GSUC0_GSUWGMRR0_K1_LBSPPB256_MIWT5_6_NLCA2_SU16_SUM0_SUS128_VWB2_WG64_4_1_WGM8_WGMXCC8_WGMXCCG304
    SolutionIndex: 132
    SolutionNameMin: Cijk_Alik_Bljk_HHS_STA_BH_Bias_HAS_SAB_SAV_UserArgs_MT448x80x64_MI16x16x1_SN_LDSB0_GRVWB4_GSU1_GSUC0_GSUWGMRR0_K1_LBSPPB128_MIWT7_5_NLCA2_SU16_SUM0_SUS128_VWB1_WG64_4_1_WGM8_WGMXCC8_WGMXCCG304
    SolutionIndex: 133
    SolutionNameMin: Cijk_Alik_Bljk_HHS_STA_BH_Bias_HAS_SAB_SAV_UserArgs_MT320x112x64_MI16x16x1_SN_LDSB0_GRVWB4_GSU1_GSUC0_GSUWGMRR0_K1_LBSPPB128_MIWT5_7_NLCA2_SU16_SUM0_SUS128_VWB1_WG64_4_1_WGM8_WGMXCC8_WGMXCCG304
    SolutionIndex: 134
    SolutionNameMin: Cijk_Alik_Bljk_HHS_STA_BH_Bias_HAS_SAB_SAV_UserArgs_MT256x176x64_MI16x16x1_SN_LDSB0_GRVWB4_GSU1_GSUC0_GSUWGMRR0_K1_LBSPPB128_MIWT4_11_NLCA2_SU16_SUM0_SUS128_VWB1_WG64_4_1_WGM8_WGMXCC8_WGMXCCG304
    SolutionIndex: 135
    SolutionNameMin: Cijk_Alik_Bljk_HHS_STA_BH_Bias_HAS_SAB_SAV_UserArgs_MT320x128x64_MI16x16x1_SN_LDSB0_GRVWB8_GSU1_GSUC0_GSUWGMRR0_K1_LBSPPB1024_MIWT5_8_NLCA2_SU16_SUM0_SUS128_VWB8_WG64_4_1_WGM8_WGMXCC8_WGMXCCG304
    SolutionIndex: 136
    SolutionNameMin: Cijk_Alik_Bljk_HHS_STA_BH_Bias_HAS_SAB_SAV_UserArgs_MT320x144x64_MI16x16x1_SN_LDSB0_GRVWB4_GSU1_GSUC0_GSUWGMRR0_K1_LBSPPB128_MIWT5_9_NLCA2_SU16_SUM0_SUS128_VWB1_WG64_4_1_WGM8_WGMXCC8_WGMXCCG304
    SolutionIndex: 137
    SolutionNameMin: Cijk_Alik_Bljk_HHS_STA_BH_Bias_HAS_SAB_SAV_UserArgs_MT448x112x64_MI16x16x1_SN_LDSB0_GRVWB4_GSU1_GSUC0_GSUWGMRR0_K1_LBSPPB128_MIWT7_7_NLCA2_SU16_SUM0_SUS128_VWB1_WG64_4_1_WGM8_WGMXCC8_WGMXCCG304
    SolutionIndex: 138
    SolutionNameMin: Cijk_Alik_Bljk_HHS_STA_BH_Bias_HAS_SAB_SAV_UserArgs_MT320x160x64_MI16x16x1_SN_LDSB0_GRVWB8_GSU1_GSUC0_GSUWGMRR0_K1_LBSPPB256_MIWT5_10_NLCA2_SU16_SUM0_SUS128_VWB2_WG64_4_1_WGM8_WGMXCC8_WGMXCCG304
    SolutionIndex: 139
    SolutionNameMin: Cijk_Alik_Bljk_HHS_STA_BH_Bias_HAS_SAB_SAV_UserArgs_MT448x128x64_MI16x16x1_SN_LDSB0_GRVWB8_GSU1_GSUC0_GSUWGMRR0_K1_LBSPPB1024_MIWT7_8_NLCA2_SU16_SUM0_SUS128_VWB8_WG64_4_1_WGM8_WGMXCC8_WGMXCCG304
    SolutionIndex: 140
    SolutionNameMin: Cijk_Alik_Bljk_HHS_STA_BH_Bias_HAS_SAB_SAV_UserArgs_MT320x176x64_MI16x16x1_SN_LDSB0_GRVWB4_GSU1_GSUC0_GSUWGMRR0_K1_LBSPPB128_MIWT5_11_NLCA2_SU16_SUM0_SUS128_VWB1_WG64_4_1_WGM8_WGMXCC8_WGMXCCG304
    SolutionIndex: 141
    SolutionNameMin: Cijk_Alik_Bljk_HHS_STA_BH_Bias_HAS_SAB_SAV_UserArgs_MT448x144x64_MI16x16x1_SN_LDSB0_GRVWB4_GSU1_GSUC0_GSUWGMRR0_K1_LBSPPB128_MIWT7_9_NLCA2_SU16_SUM0_SUS128_VWB1_WG64_4_1_WGM8_WGMXCC8_WGMXCCG304
    SolutionIndex: 142
    SolutionNameMin: Cijk_Alik_Bljk_HHS_STA_BH_Bias_HAS_SAB_SAV_UserArgs_MT320x192x64_MI16x16x1_SN_LDSB0_GRVWB8_GSU1_GSUC0_GSUWGMRR0_K1_LBSPPB512_MIWT5_12_NLCA2_SU16_SUM0_SUS128_VWB4_WG64_4_1_WGM8_WGMXCC8_WGMXCCG304
    SolutionIndex: 143
    SolutionNameMin: Cijk_Alik_Bljk_HHS_STA_BH_Bias_HAS_SAB_SAV_UserArgs_MT384x96x64_MI16x16x1_SN_LDSB0_GRVWB8_GSU1_GSUC0_GSUWGMRR0_K1_LBSPPB256_MIWT6_6_NLCA2_SU16_SUM0_SUS128_VWB2_WG64_4_1_WGM8_WGMXCC8_WGMXCCG304
    SolutionIndex: 144
    SolutionNameMin: Cijk_Alik_Bljk_HHS_STA_BH_Bias_HAS_SAB_SAV_UserArgs_MT384x112x64_MI16x16x1_SN_LDSB0_GRVWB4_GSU1_GSUC0_GSUWGMRR0_K1_LBSPPB128_MIWT6_7_NLCA2_SU16_SUM0_SUS128_VWB1_WG64_4_1_WGM8_WGMXCC8_WGMXCCG304
    SolutionIndex: 145
    SolutionNameMin: Cijk_Alik_Bljk_HHS_STA_BH_Bias_HAS_SAB_SAV_UserArgs_MT384x128x64_MI16x16x1_SN_LDSB0_GRVWB8_GSU1_GSUC0_GSUWGMRR0_K1_LBSPPB1024_MIWT6_8_NLCA2_SU16_SUM0_SUS128_VWB8_WG64_4_1_WGM8_WGMXCC8_WGMXCCG304
    SolutionIndex: 146
    SolutionNameMin: Cijk_Alik_Bljk_HHS_STA_BH_Bias_HAS_SAB_SAV_UserArgs_MT384x144x64_MI16x16x1_SN_LDSB0_GRVWB4_GSU1_GSUC0_GSUWGMRR0_K1_LBSPPB128_MIWT6_9_NLCA2_SU16_SUM0_SUS128_VWB1_WG64_4_1_WGM8_WGMXCC8_WGMXCCG304
    SolutionIndex: 147
    SolutionNameMin: Cijk_Alik_Bljk_HHS_STA_BH_Bias_HAS_SAB_SAV_UserArgs_MT384x160x64_MI16x16x1_SN_LDSB0_GRVWB8_GSU1_GSUC0_GSUWGMRR0_K1_LBSPPB256_MIWT6_10_NLCA2_SU16_SUM0_SUS128_VWB2_WG64_4_1_WGM8_WGMXCC8_WGMXCCG304
    SolutionIndex: 148
    SolutionNameMin: Cijk_Alik_Bljk_HHS_STA_BH_Bias_HAS_SAB_SAV_UserArgs_MT192x256x64_MI16x16x1_SN_LDSB1_GRVWB8_GSU1_GSUC0_GSUWGMRR0_K1_LBSPPB1024_MIWT3_16_NLCA2_SU16_SUM0_SUS128_VWB8_WG64_4_1_WGM8_WGMXCC8_WGMXCCG304
    SolutionIndex: 149
    SolutionNameMin: Cijk_Alik_Bljk_HHS_STA_BH_Bias_HAS_SAB_SAV_UserArgs_MT256x192x64_MI16x16x1_SN_LDSB0_GRVWB8_GSU1_GSUC0_GSUWGMRR0_K1_LBSPPB512_MIWT4_12_NLCA2_SU16_SUM0_SUS128_VWB4_WG64_4_1_WGM8_WGMXCC8_WGMXCCG304
    SolutionIndex: 150
    SolutionNameMin: Cijk_Alik_Bljk_HHS_STA_BH_Bias_HAS_SAB_SAV_UserArgs_MT192x288x64_MI16x16x1_SN_LDSB1_GRVWB8_GSU1_GSUC0_GSUWGMRR0_K1_LBSPPB256_MIWT3_18_NLCA2_SU16_SUM0_SUS128_VWB2_WG64_4_1_WGM8_WGMXCC8_WGMXCCG304
    SolutionIndex: 151
    SolutionNameMin: Cijk_Alik_Bljk_HHS_STA_BH_Bias_HAS_SAB_SAV_UserArgs_MT256x224x64_MI16x16x1_SN_LDSB0_GRVWB8_GSU1_GSUC0_GSUWGMRR0_K1_LBSPPB256_MIWT4_14_NLCA2_SU16_SUM0_SUS128_VWB2_WG64_4_1_WGM8_WGMXCC8_WGMXCCG304
    SolutionIndex: 152
    SolutionNameMin: Cijk_Alik_Bljk_HHS_STA_BH_Bias_HAS_SAV_UserArgs_MT448x128x64_MI16x16x1_SN_LDSB0_GRVWB8_GSU1_GSUC0_GSUWGMRR0_K1_LBSPPB1024_MIWT7_8_NLCA2_SU16_SUM0_SUS128_VWB8_WG64_4_1_WGM8_WGMXCC8_WGMXCCGn1
    SolutionIndex: 153
    SolutionNameMin: Cijk_Alik_Bljk_HHS_STA_BH_Bias_HAS_SAV_UserArgs_MT256x16x128_MI16x16x1_SN_LDSB0_GRVWB8_GSU1_GSUAMB_GSUC0_GSUWGMRR0_K1_LBSPPB256_MIWT4_1_NLCA4_SU16_SUM0_SUS256_VWB1_WG64_4_1_WGM1_WGMXCC8_WGMXCCGn1
    SolutionIndex: 154
    SolutionNameMin: Cijk_Alik_Bljk_HHS_STA_BH_Bias_HAS_SAV_UserArgs_MT128x32x128_MI16x16x1_SN_LDSB0_GRVWB8_GSU1_GSUAMBSK_GSUC0_GSUWGMRR0_K1_LBSPPB512_MIWT2_2_NLCA4_SU16_SUM0_SUS256_VWB2_WG64_4_1_WGM1_WGMXCC8_WGMXCCGn1
    SolutionIndex: 155
    SolutionNameMin: Cijk_Alik_Bljk_HHS_STA_BH_Bias_HAS_SAV_UserArgs_MT128x48x64_MI16x16x1_SN_LDSB0_GRVWB4_GSU1_GSUAMBSK_GSUC0_GSUWGMRR0_K1_LBSPPB128_MIWT2_3_NLCA2_SU16_SUM0_SUS128_VWB1_WG64_4_1_WGM1_WGMXCC8_WGMXCCGn1
    SolutionIndex: 156
    SolutionNameMin: Cijk_Alik_Bljk_HHS_STA_BH_Bias_HAS_SAV_UserArgs_MT448x64x64_MI16x16x1_SN_LDSB0_GRVWB8_GSU2_GSUAMB_GSUC0_GSUWGMRR0_K1_LBSPPB512_MIWT7_4_NLCA2_SU16_SUM0_SUS128_VWB4_WG64_4_1_WGM1_WGMXCC8_WGMXCCGn1
    SolutionIndex: 157
    SolutionNameMin: Cijk_Alik_Bljk_HHS_STA_BH_Bias_HAS_SAV_UserArgs_MT384x80x64_MI16x16x1_SN_LDSB0_GRVWB4_GSU2_GSUAMB_GSUC0_GSUWGMRR0_K1_LBSPPB128_MIWT6_5_NLCA2_SU16_SUM0_SUS128_VWB1_WG64_4_1_WGM1_WGMXCC8_WGMXCCGn1
    SolutionIndex: 158
    SolutionNameMin: Cijk_Alik_Bljk_HHS_STA_BH_Bias_HAS_SAV_UserArgs_MT128x96x128_MI16x16x1_SN_LDSB1_GRVWB8_GSU1_GSUAMBSK_GSUC0_GSUWGMRR0_K1_LBSPPB512_MIWT2_6_NLCA4_SU16_SUM0_SUS256_VWB2_WG64_4_1_WGM1_WGMXCC8_WGMXCCGn1
    SolutionIndex: 159
    SolutionNameMin: Cijk_Alik_Bljk_HHS_STA_BH_Bias_HAS_SAV_UserArgs_MT128x112x128_MI16x16x1_SN_LDSB1_GRVWB8_GSU1_GSUAMB_GSUC0_GSUWGMRR0_K1_LBSPPB256_MIWT2_7_NLCA4_SU16_SUM0_SUS256_VWB1_WG64_4_1_WGM1_WGMXCC8_WGMXCCGn1
    SolutionIndex: 160
    SolutionNameMin: Cijk_Alik_Bljk_HHS_STA_BH_Bias_HAS_SAV_UserArgs_MT128x128x128_MI16x16x1_SN_LDSB1_GRVWB8_GSU1_GSUAMB_GSUC0_GSUWGMRR0_K1_LBSPPB2048_MIWT2_8_NLCA4_SU16_SUM0_SUS256_VWB8_WG64_4_1_WGM1_WGMXCC8_WGMXCCGn1
    SolutionIndex: 161
    SolutionNameMin: Cijk_Alik_Bljk_HHS_STA_BH_Bias_HAS_SAV_UserArgs_MT320x144x64_MI16x16x1_SN_LDSB0_GRVWB4_GSU3_GSUAMB_GSUC0_GSUWGMRR0_K1_LBSPPB128_MIWT5_9_NLCA2_SU16_SUM0_SUS128_VWB1_WG64_4_1_WGM1_WGMXCC8_WGMXCCGn1
    SolutionIndex: 162
    SolutionNameMin: Cijk_Alik_Bljk_HHS_STA_BH_Bias_HAS_SAV_UserArgs_MT320x160x64_MI16x16x1_SN_LDSB0_GRVWB8_GSU3_GSUAMB_GSUC0_GSUWGMRR0_K1_LBSPPB256_MIWT5_10_NLCA2_SU16_SUM0_SUS128_VWB2_WG64_4_1_WGM1_WGMXCC8_WGMXCCGn1
    SolutionIndex: 163
    SolutionNameMin: Cijk_Alik_Bljk_HHS_STA_BH_Bias_HAS_SAV_UserArgs_MT320x176x64_MI16x16x1_SN_LDSB0_GRVWB4_GSU3_GSUAMB_GSUC0_GSUWGMRR0_K1_LBSPPB128_MIWT5_11_NLCA2_SU16_SUM0_SUS128_VWB1_WG64_4_1_WGM1_WGMXCC8_WGMXCCGn1
    SolutionIndex: 164
    SolutionNameMin: Cijk_Alik_Bljk_HHS_STA_BH_Bias_HAS_SAV_UserArgs_MT320x192x64_MI16x16x1_SN_LDSB0_GRVWB8_GSU3_GSUAMB_GSUC0_GSUWGMRR0_K1_LBSPPB512_MIWT5_12_NLCA2_SU16_SUM0_SUS128_VWB4_WG64_4_1_WGM1_WGMXCC8_WGMXCCGn1
    SolutionIndex: 165
    SolutionNameMin: Cijk_Alik_Bljk_HHS_STA_BH_Bias_HAS_SAV_UserArgs_MT256x208x64_MI16x16x1_SN_LDSB1_GRVWB4_GSU2_GSUAMB_GSUC0_GSUWGMRR0_K1_LBSPPB128_MIWT4_13_NLCA2_SU16_SUM0_SUS128_VWB1_WG64_4_1_WGM1_WGMXCC8_WGMXCCGn1
    SolutionIndex: 166
    SolutionNameMin: Cijk_Alik_Bljk_HHS_STA_BH_Bias_HAS_SAV_UserArgs_MT256x224x64_MI16x16x1_SN_LDSB0_GRVWB8_GSU2_GSUAMB_GSUC0_GSUWGMRR0_K1_LBSPPB256_MIWT4_14_NLCA2_SU16_SUM0_SUS128_VWB2_WG64_4_1_WGM1_WGMXCC8_WGMXCCGn1
    SolutionIndex: 167
    SolutionNameMin: Cijk_Alik_Bljk_HHS_STA_BH_Bias_HAS_SAV_UserArgs_MT256x256x64_MI16x16x1_SN_LDSB1_GRVWB8_GSU2_GSUAMB_GSUC0_GSUWGMRR0_K1_LBSPPB1024_MIWT4_16_NLCA2_SU16_SUM0_SUS128_VWB8_WG64_4_1_WGM1_WGMXCC8_WGMXCCGn1
    SolutionIndex: 168
    SolutionNameMin: Cijk_Alik_Bljk_HHS_STA_BH_Bias_HAS_SAV_UserArgs_MT448x144x64_MI16x16x1_SN_LDSB0_GRVWB4_GSU2_GSUAMB_GSUC0_GSUWGMRR0_K1_LBSPPB128_MIWT7_9_NLCA2_SU16_SUM0_SUS128_VWB1_WG64_4_1_WGM1_WGMXCC8_WGMXCCGn1
    SolutionIndex: 169
    SolutionNameMin: Cijk_Alik_Bljk_HHS_STA_BH_Bias_HAS_SAV_UserArgs_MT256x160x64_MI16x16x1_SN_LDSB0_GRVWB8_GSU1_GSUAMB_GSUC0_GSUWGMRR0_K1_LBSPPB256_MIWT4_10_NLCA2_SU16_SUM0_SUS128_VWB2_WG64_4_1_WGM1_WGMXCC8_WGMXCCGn1
    SolutionIndex: 170
    SolutionNameMin: Cijk_Alik_Bljk_HHS_STA_BH_Bias_HAS_SAV_UserArgs_MT256x160x64_MI16x16x1_SN_LDSB0_GRVWB8_GSU1_GSUAMBSK_GSUC0_GSUWGMRR0_K1_LBSPPB256_MIWT4_10_NLCA2_SU16_SUM0_SUS128_VWB2_WG64_4_1_WGM1_WGMXCC8_WGMXCCGn1
    SolutionIndex: 171
    SolutionNameMin: Cijk_Alik_Bljk_HHS_STA_BH_Bias_HAS_SAV_UserArgs_MT256x176x64_MI16x16x1_SN_LDSB0_GRVWB4_GSU1_GSUAMB_GSUC0_GSUWGMRR0_K1_LBSPPB128_MIWT4_11_NLCA2_SU16_SUM0_SUS128_VWB1_WG64_4_1_WGM1_WGMXCC8_WGMXCCGn1
    SolutionIndex: 172
    SolutionNameMin: Cijk_Alik_Bljk_HHS_STA_BH_Bias_HAS_SAV_UserArgs_MT256x192x64_MI16x16x1_SN_LDSB0_GRVWB8_GSU1_GSUAMB_GSUC0_GSUWGMRR0_K1_LBSPPB512_MIWT4_12_NLCA2_SU16_SUM0_SUS128_VWB4_WG64_4_1_WGM1_WGMXCC8_WGMXCCGn1
    SolutionIndex: 173
    SolutionNameMin: Cijk_Alik_Bljk_HHS_STA_BH_Bias_HAS_SAV_UserArgs_MT320x144x64_MI16x16x1_SN_LDSB0_GRVWB4_GSU1_GSUAMB_GSUC0_GSUWGMRR0_K1_LBSPPB128_MIWT5_9_NLCA2_SU16_SUM0_SUS128_VWB1_WG64_4_1_WGM1_WGMXCC8_WGMXCCGn1
    SolutionIndex: 174
    SolutionNameMin: Cijk_Alik_Bljk_HHS_STA_BH_Bias_HAS_SAV_UserArgs_MT320x160x64_MI16x16x1_SN_LDSB0_GRVWB8_GSU1_GSUAMB_GSUC0_GSUWGMRR0_K1_LBSPPB256_MIWT5_10_NLCA2_SU16_SUM0_SUS128_VWB2_WG64_4_1_WGM1_WGMXCC8_WGMXCCGn1
    SolutionIndex: 175
    SolutionNameMin: Cijk_Alik_Bljk_HHS_STA_BH_Bias_HAS_SAV_UserArgs_MT256x256x64_MI16x16x1_SN_LDSB1_GRVWB8_GSU1_GSUAMB_GSUC0_GSUWGMRR0_K1_LBSPPB1024_MIWT4_16_NLCA2_SU16_SUM0_SUS128_VWB8_WG64_4_1_WGM1_WGMXCC8_WGMXCCGn1
    SolutionIndex: 176
    SolutionNameMin: Cijk_Alik_Bljk_HHS_STA_BH_Bias_HAS_SAV_UserArgs_MT32x16x128_MI16x16x1_SN_LDSB0_GRVWB8_GSU1_GSUAMB_GSUC0_GSUWGMRR0_K1_LBSPPB256_MIWT1_1_NLCA4_SU16_SUM0_SUS256_VWB1_WG32_4_1_WGM1_WGMXCC8_WGMXCCGn1
    SolutionIndex: 177
    SolutionNameMin: Cijk_Alik_Bljk_HHS_STA_BH_Bias_HAS_SAV_UserArgs_MT64x16x128_MI16x16x1_SN_LDSB0_GRVWB8_GSU1_GSUAMB_GSUC0_GSUWGMRR0_K1_LBSPPB256_MIWT1_1_NLCA4_SU16_SUM0_SUS256_VWB1_WG64_4_1_WGM1_WGMXCC8_WGMXCCGn1
    SolutionIndex: 178
    SolutionNameMin: Cijk_Alik_Bljk_HHS_STA_BH_Bias_HAS_SAV_UserArgs_MT256x16x128_MI16x16x1_SN_LDSB0_GRVWB8_GSU2_GSUAMB_GSUC0_GSUWGMRR0_K1_LBSPPB256_MIWT4_1_NLCA4_SU16_SUM0_SUS256_VWB1_WG64_4_1_WGM1_WGMXCC8_WGMXCCGn1
    SolutionIndex: 179
    SolutionNameMin: Cijk_Alik_Bljk_HHS_STA_BH_Bias_HAS_SAV_UserArgs_MT64x16x128_MI16x16x1_SN_LDSB0_GRVWB8_GSU1_GSUAMBSK_GSUC0_GSUWGMRR0_K1_LBSPPB256_MIWT1_1_NLCA4_SU16_SUM0_SUS256_VWB1_WG64_4_1_WGM1_WGMXCC8_WGMXCCGn1
    SolutionIndex: 180
    SolutionNameMin: Cijk_Alik_Bljk_HHS_STA_BH_Bias_HAS_SAV_UserArgs_MT48x16x128_MI16x16x1_SN_LDSB0_GRVWB8_GSU1_GSUAMBSK_GSUC0_GSUWGMRR0_K1_LBSPPB256_MIWT3_1_NLCA4_SU16_SUM0_SUS256_VWB1_WG16_4_1_WGM1_WGMXCC8_WGMXCCGn1
    SolutionIndex: 181
    SolutionNameMin: Cijk_Alik_Bljk_HHS_STA_BH_Bias_HAS_SAV_UserArgs_MT128x16x128_MI16x16x1_SN_LDSB0_GRVWB8_GSU1_GSUAMB_GSUC0_GSUWGMRR0_K1_LBSPPB256_MIWT2_1_NLCA4_SU16_SUM0_SUS256_VWB1_WG64_4_1_WGM1_WGMXCC8_WGMXCCGn1
    SolutionIndex: 182
    SolutionNameMin: Cijk_Alik_Bljk_HHS_STA_BH_Bias_HAS_SAV_UserArgs_MT128x16x256_MI16x16x1_SN_LDSB0_GRVWB8_GSU1_GSUAMB_GSUC0_GSUWGMRR0_K1_LBSPPB512_MIWT2_1_NLCA8_SU16_SUM0_SUS512_VWB1_WG64_4_1_WGM1_WGMXCC8_WGMXCCGn1
    SolutionIndex: 183
    SolutionNameMin: Cijk_Alik_Bljk_HHS_STA_BH_Bias_HAS_SAV_UserArgs_MT128x16x128_MI16x16x1_SN_LDSB0_GRVWB8_GSU1_GSUAMBSK_GSUC0_GSUWGMRR0_K1_LBSPPB256_MIWT2_1_NLCA4_SU16_SUM0_SUS256_VWB1_WG64_4_1_WGM1_WGMXCC8_WGMXCCGn1
    SolutionIndex: 184
    SolutionNameMin: Cijk_Alik_Bljk_HHS_STA_BH_Bias_HAS_SAV_UserArgs_MT128x32x128_MI16x16x1_SN_LDSB0_GRVWB8_GSU1_GSUAMB_GSUC0_GSUWGMRR0_K1_LBSPPB512_MIWT2_2_NLCA4_SU16_SUM0_SUS256_VWB2_WG64_4_1_WGM1_WGMXCC8_WGMXCCGn1
- - - [127, 127, 1, 127]
    - [4, 0.0]
  - - [127, 128, 1, 127]
    - [3, 0.0]
  - - [1, 127, 1, 127]
    - [3, 0.0]
  - - [128, 128, 1, 128]
    - [3, 0.0]
  - - [1248, 2048, 1, 5280]
    - [0, 0.0]
  - - [1920, 2048, 1, 5280]
    - [0, 0.0]
  - - [5280, 2048, 1, 1024]
    - [2, 0.0]
  - - [8320, 2048, 1, 5280]
    - [1, 0.0]
  - - [16, 16, 1, 4096]
    - [5, 0.0]
  - - [16, 32, 1, 4096]
    - [6, 0.0]
  - - [16, 48, 1, 4096]
    - [7, 0.0]
  - - [16, 64, 1, 4096]
    - [8, 0.0]
  - - [16, 80, 1, 4096]
    - [7, 0.0]
  - - [16, 96, 1, 4096]
    - [8, 0.0]
  - - [16, 112, 1, 4096]
    - [7, 0.0]
  - - [16, 128, 1, 4096]
    - [9, 0.0]
  - - [16, 144, 1, 4096]
    - [10, 0.0]
  - - [16, 160, 1, 4096]
    - [9, 0.0]
  - - [16, 176, 1, 4096]
    - [10, 0.0]
  - - [16, 192, 1, 4096]
    - [9, 0.0]
  - - [16, 208, 1, 4096]
    - [10, 0.0]
  - - [16, 224, 1, 4096]
    - [11, 0.0]
  - - [16, 240, 1, 4096]
    - [11, 0.0]
  - - [16, 256, 1, 4096]
    - [12, 0.0]
  - - [16, 272, 1, 4096]
    - [13, 0.0]
  - - [16, 288, 1, 4096]
    - [12, 0.0]
  - - [16, 304, 1, 4096]
    - [11, 0.0]
  - - [16, 320, 1, 4096]
    - [11, 0.0]
  - - [16, 336, 1, 4096]
    - [11, 0.0]
  - - [16, 352, 1, 4096]
    - [11, 0.0]
  - - [16, 368, 1, 4096]
    - [11, 0.0]
  - - [16, 384, 1, 4096]
    - [11, 0.0]
  - - [16, 400, 1, 4096]
    - [11, 0.0]
  - - [16, 416, 1, 4096]
    - [11, 0.0]
  - - [16, 432, 1, 4096]
    - [11, 0.0]
  - - [16, 448, 1, 4096]
    - [11, 0.0]
  - - [16, 464, 1, 4096]
    - [11, 0.0]
  - - [16, 480, 1, 4096]
    - [11, 0.0]
  - - [16, 496, 1, 4096]
    - [11, 0.0]
  - - [16, 512, 1, 4096]
    - [14, 0.0]
  - - [16, 544, 1, 4096]
    - [11, 0.0]
  - - [16, 576, 1, 4096]
    - [11, 0.0]
  - - [16, 608, 1, 4096]
    - [11, 0.0]
  - - [16, 640, 1, 4096]
    - [11, 0.0]
  - - [16, 672, 1, 4096]
    - [11, 0.0]
  - - [16, 704, 1, 4096]
    - [11, 0.0]
  - - [16, 736, 1, 4096]
    - [11, 0.0]
  - - [16, 768, 1, 4096]
    - [11, 0.0]
  - - [16, 800, 1, 4096]
    - [12, 0.0]
  - - [16, 832, 1, 4096]
    - [12, 0.0]
  - - [16, 864, 1, 4096]
    - [12, 0.0]
  - - [16, 896, 1, 4096]
    - [12, 0.0]
  - - [16, 928, 1, 4096]
    - [12, 0.0]
  - - [16, 960, 1, 4096]
    - [12, 0.0]
  - - [16, 992, 1, 4096]
    - [12, 0.0]
  - - [16, 1024, 1, 4096]
    - [12, 0.0]
  - - [16, 1088, 1, 4096]
    - [12, 0.0]
  - - [16, 1152, 1, 4096]
    - [12, 0.0]
  - - [16, 1216, 1, 4096]
    - [12, 0.0]
  - - [16, 1280, 1, 4096]
    - [15, 0.0]
  - - [16, 1344, 1, 4096]
    - [15, 0.0]
  - - [16, 1408, 1, 4096]
    - [15, 0.0]
  - - [16, 1472, 1, 4096]
    - [15, 0.0]
  - - [16, 1536, 1, 4096]
    - [15, 0.0]
  - - [16, 1600, 1, 4096]
    - [15, 0.0]
  - - [16, 1664, 1, 4096]
    - [15, 0.0]
  - - [16, 1728, 1, 4096]
    - [15, 0.0]
  - - [16, 1792, 1, 4096]
    - [15, 0.0]
  - - [16, 1856, 1, 4096]
    - [15, 0.0]
  - - [16, 1920, 1, 4096]
    - [15, 0.0]
  - - [16, 1984, 1, 4096]
    - [15, 0.0]
  - - [16, 2048, 1, 4096]
    - [15, 0.0]
  - - [16, 2176, 1, 4096]
    - [15, 0.0]
  - - [16, 2304, 1, 4096]
    - [15, 0.0]
  - - [16, 2432, 1, 4096]
    - [15, 0.0]
  - - [16, 2560, 1, 4096]
    - [15, 0.0]
  - - [16, 2688, 1, 4096]
    - [15, 0.0]
  - - [16, 2816, 1, 4096]
    - [15, 0.0]
  - - [16, 2944, 1, 4096]
    - [16, 0.0]
  - - [16, 3072, 1, 4096]
    - [17, 0.0]
  - - [16, 3200, 1, 4096]
    - [15, 0.0]
  - - [16, 3328, 1, 4096]
    - [15, 0.0]
  - - [16, 3456, 1, 4096]
    - [15, 0.0]
  - - [16, 3584, 1, 4096]
    - [15, 0.0]
  - - [16, 3712, 1, 4096]
    - [15, 0.0]
  - - [16, 3840, 1, 4096]
    - [15, 0.0]
  - - [16, 3968, 1, 4096]
    - [18, 0.0]
  - - [16, 4096, 1, 4096]
    - [19, 0.0]
  - - [16, 4352, 1, 4096]
    - [18, 0.0]
  - - [16, 4608, 1, 4096]
    - [19, 0.0]
  - - [16, 4864, 1, 4096]
    - [19, 0.0]
  - - [16, 5120, 1, 4096]
    - [20, 0.0]
  - - [16, 5376, 1, 4096]
    - [20, 0.0]
  - - [16, 5632, 1, 4096]
    - [20, 0.0]
  - - [16, 5888, 1, 4096]
    - [20, 0.0]
  - - [16, 6144, 1, 4096]
    - [20, 0.0]
  - - [16, 6400, 1, 4096]
    - [18, 0.0]
  - - [16, 6656, 1, 4096]
    - [20, 0.0]
  - - [16, 6912, 1, 4096]
    - [20, 0.0]
  - - [16, 7168, 1, 4096]
    - [20, 0.0]
  - - [16, 7424, 1, 4096]
    - [19, 0.0]
  - - [16, 7680, 1, 4096]
    - [19, 0.0]
  - - [16, 7936, 1, 4096]
    - [19, 0.0]
  - - [16, 8192, 1, 4096]
    - [19, 0.0]
  - - [16, 8704, 1, 4096]
    - [19, 0.0]
  - - [16, 9216, 1, 4096]
    - [20, 0.0]
  - - [16, 9728, 1, 4096]
    - [19, 0.0]
  - - [16, 10240, 1, 4096]
    - [21, 0.0]
  - - [16, 10752, 1, 4096]
    - [22, 0.0]
  - - [16, 11264, 1, 4096]
    - [23, 0.0]
  - - [16, 11776, 1, 4096]
    - [22, 0.0]
  - - [16, 12288, 1, 4096]
    - [22, 0.0]
  - - [16, 12800, 1, 4096]
    - [22, 0.0]
  - - [16, 13312, 1, 4096]
    - [22, 0.0]
  - - [16, 13824, 1, 4096]
    - [22, 0.0]
  - - [16, 14336, 1, 4096]
    - [22, 0.0]
  - - [16, 14848, 1, 4096]
    - [22, 0.0]
  - - [16, 15360, 1, 4096]
    - [22, 0.0]
  - - [16, 15872, 1, 4096]
    - [22, 0.0]
  - - [16, 16384, 1, 4096]
    - [24, 0.0]
  - - [16, 17408, 1, 4096]
    - [22, 0.0]
  - - [16, 18432, 1, 4096]
    - [22, 0.0]
  - - [16, 19456, 1, 4096]
    - [24, 0.0]
  - - [16, 20480, 1, 4096]
    - [25, 0.0]
  - - [16, 21504, 1, 4096]
    - [21, 0.0]
  - - [16, 22528, 1, 4096]
    - [23, 0.0]
  - - [16, 23552, 1, 4096]
    - [21, 0.0]
  - - [16, 24576, 1, 4096]
    - [26, 0.0]
  - - [16, 25600, 1, 4096]
    - [21, 0.0]
  - - [16, 26624, 1, 4096]
    - [26, 0.0]
  - - [16, 27648, 1, 4096]
    - [26, 0.0]
  - - [16, 28672, 1, 4096]
    - [27, 0.0]
  - - [16, 29696, 1, 4096]
    - [26, 0.0]
  - - [16, 30720, 1, 4096]
    - [27, 0.0]
  - - [16, 31744, 1, 4096]
    - [26, 0.0]
  - - [16, 32768, 1, 4096]
    - [26, 0.0]
  - - [16, 34816, 1, 4096]
    - [27, 0.0]
  - - [16, 36864, 1, 4096]
    - [27, 0.0]
  - - [16, 38912, 1, 4096]
    - [26, 0.0]
  - - [16, 40960, 1, 4096]
    - [27, 0.0]
  - - [16, 43008, 1, 4096]
    - [26, 0.0]
  - - [16, 45056, 1, 4096]
    - [26, 0.0]
  - - [16, 47104, 1, 4096]
    - [27, 0.0]
  - - [16, 49152, 1, 4096]
    - [27, 0.0]
  - - [16, 51200, 1, 4096]
    - [26, 0.0]
  - - [16, 53248, 1, 4096]
    - [27, 0.0]
  - - [16, 55296, 1, 4096]
    - [27, 0.0]
  - - [16, 57344, 1, 4096]
    - [26, 0.0]
  - - [16, 59392, 1, 4096]
    - [28, 0.0]
  - - [16, 61440, 1, 4096]
    - [28, 0.0]
  - - [16, 63488, 1, 4096]
    - [29, 0.0]
  - - [16, 65536, 1, 4096]
    - [22, 0.0]
  - - [4096, 16, 1, 4096]
    - [30, 0.0]
  - - [4096, 32, 1, 4096]
    - [30, 0.0]
  - - [4096, 48, 1, 4096]
    - [30, 0.0]
  - - [4096, 64, 1, 4096]
    - [31, 0.0]
  - - [4096, 80, 1, 4096]
    - [30, 0.0]
  - - [4096, 96, 1, 4096]
    - [32, 0.0]
  - - [4096, 112, 1, 4096]
    - [32, 0.0]
  - - [4096, 128, 1, 4096]
    - [32, 0.0]
  - - [4096, 144, 1, 4096]
    - [33, 0.0]
  - - [4096, 160, 1, 4096]
    - [33, 0.0]
  - - [4096, 176, 1, 4096]
    - [33, 0.0]
  - - [4096, 192, 1, 4096]
    - [33, 0.0]
  - - [4096, 208, 1, 4096]
    - [34, 0.0]
  - - [4096, 224, 1, 4096]
    - [34, 0.0]
  - - [4096, 240, 1, 4096]
    - [35, 0.0]
  - - [4096, 256, 1, 4096]
    - [34, 0.0]
  - - [4096, 272, 1, 4096]
    - [35, 0.0]
  - - [4096, 288, 1, 4096]
    - [35, 0.0]
  - - [4096, 304, 1, 4096]
    - [35, 0.0]
  - - [4096, 320, 1, 4096]
    - [36, 0.0]
  - - [4096, 336, 1, 4096]
    - [35, 0.0]
  - - [4096, 352, 1, 4096]
    - [35, 0.0]
  - - [4096, 368, 1, 4096]
    - [35, 0.0]
  - - [4096, 384, 1, 4096]
    - [35, 0.0]
  - - [4096, 400, 1, 4096]
    - [37, 0.0]
  - - [4096, 416, 1, 4096]
    - [36, 0.0]
  - - [4096, 432, 1, 4096]
    - [36, 0.0]
  - - [4096, 448, 1, 4096]
    - [36, 0.0]
  - - [4096, 464, 1, 4096]
    - [36, 0.0]
  - - [4096, 480, 1, 4096]
    - [37, 0.0]
  - - [4096, 496, 1, 4096]
    - [36, 0.0]
  - - [4096, 512, 1, 4096]
    - [36, 0.0]
  - - [4096, 544, 1, 4096]
    - [37, 0.0]
  - - [4096, 576, 1, 4096]
    - [37, 0.0]
  - - [4096, 608, 1, 4096]
    - [37, 0.0]
  - - [4096, 640, 1, 4096]
    - [37, 0.0]
  - - [4096, 672, 1, 4096]
    - [38, 0.0]
  - - [4096, 704, 1, 4096]
    - [39, 0.0]
  - - [4096, 736, 1, 4096]
    - [38, 0.0]
  - - [4096, 768, 1, 4096]
    - [38, 0.0]
  - - [4096, 800, 1, 4096]
    - [38, 0.0]
  - - [4096, 832, 1, 4096]
    - [39, 0.0]
  - - [4096, 864, 1, 4096]
    - [40, 0.0]
  - - [4096, 896, 1, 4096]
    - [40, 0.0]
  - - [4096, 928, 1, 4096]
    - [40, 0.0]
  - - [4096, 960, 1, 4096]
    - [41, 0.0]
  - - [4096, 992, 1, 4096]
    - [40, 0.0]
  - - [4096, 1024, 1, 4096]
    - [42, 0.0]
  - - [4096, 1088, 1, 4096]
    - [43, 0.0]
  - - [4096, 1152, 1, 4096]
    - [42, 0.0]
  - - [4096, 1216, 1, 4096]
    - [43, 0.0]
  - - [4096, 1280, 1, 4096]
    - [109, 0.0]
  - - [4096, 1344, 1, 4096]
    - [112, 0.0]
  - - [4096, 1408, 1, 4096]
    - [113, 0.0]
  - - [4096, 1472, 1, 4096]
    - [109, 0.0]
  - - [4096, 1536, 1, 4096]
    - [44, 0.0]
  - - [4096, 1600, 1, 4096]
    - [44, 0.0]
  - - [4096, 1664, 1, 4096]
    - [45, 0.0]
  - - [4096, 1728, 1, 4096]
    - [44, 0.0]
  - - [4096, 1792, 1, 4096]
    - [44, 0.0]
  - - [4096, 1856, 1, 4096]
    - [46, 0.0]
  - - [4096, 1920, 1, 4096]
    - [47, 0.0]
  - - [4096, 1984, 1, 4096]
    - [46, 0.0]
  - - [4096, 2048, 1, 4096]
    - [46, 0.0]
  - - [4096, 2176, 1, 4096]
    - [48, 0.0]
  - - [4096, 2304, 1, 4096]
    - [49, 0.0]
  - - [4096, 2432, 1, 4096]
    - [49, 0.0]
  - - [4096, 2560, 1, 4096]
    - [50, 0.0]
  - - [4096, 2688, 1, 4096]
    - [50, 0.0]
  - - [4096, 2816, 1, 4096]
    - [51, 0.0]
  - - [4096, 2944, 1, 4096]
    - [51, 0.0]
  - - [4096, 3072, 1, 4096]
    - [52, 0.0]
  - - [4096, 3200, 1, 4096]
    - [52, 0.0]
  - - [4096, 3328, 1, 4096]
    - [52, 0.0]
  - - [4096, 3456, 1, 4096]
    - [53, 0.0]
  - - [4096, 3584, 1, 4096]
    - [53, 0.0]
  - - [4096, 3712, 1, 4096]
    - [54, 0.0]
  - - [4096, 3840, 1, 4096]
    - [55, 0.0]
  - - [4096, 3968, 1, 4096]
    - [56, 0.0]
  - - [4096, 4096, 1, 4096]
    - [56, 0.0]
  - - [4096, 4352, 1, 4096]
    - [57, 0.0]
  - - [4096, 4608, 1, 4096]
    - [58, 0.0]
  - - [4096, 4864, 1, 4096]
    - [58, 0.0]
  - - [4096, 5120, 1, 4096]
    - [59, 0.0]
  - - [4096, 5376, 1, 4096]
    - [50, 0.0]
  - - [4096, 5632, 1, 4096]
    - [51, 0.0]
  - - [4096, 5888, 1, 4096]
    - [51, 0.0]
  - - [4096, 6144, 1, 4096]
    - [52, 0.0]
  - - [4096, 6400, 1, 4096]
    - [52, 0.0]
  - - [4096, 6656, 1, 4096]
    - [52, 0.0]
  - - [4096, 6912, 1, 4096]
    - [53, 0.0]
  - - [4096, 7168, 1, 4096]
    - [53, 0.0]
  - - [4096, 7424, 1, 4096]
    - [55, 0.0]
  - - [4096, 7680, 1, 4096]
    - [55, 0.0]
  - - [4096, 7936, 1, 4096]
    - [56, 0.0]
  - - [4096, 8192, 1, 4096]
    - [56, 0.0]
  - - [4096, 8704, 1, 4096]
    - [60, 0.0]
  - - [4096, 9216, 1, 4096]
    - [58, 0.0]
  - - [4096, 9728, 1, 4096]
    - [58, 0.0]
  - - [4096, 10240, 1, 4096]
    - [53, 0.0]
  - - [4096, 10752, 1, 4096]
    - [53, 0.0]
  - - [4096, 11264, 1, 4096]
    - [55, 0.0]
  - - [4096, 11776, 1, 4096]
    - [55, 0.0]
  - - [4096, 12288, 1, 4096]
    - [56, 0.0]
  - - [4096, 12800, 1, 4096]
    - [60, 0.0]
  - - [4096, 13312, 1, 4096]
    - [52, 0.0]
  - - [4096, 13824, 1, 4096]
    - [58, 0.0]
  - - [4096, 14336, 1, 4096]
    - [58, 0.0]
  - - [4096, 14848, 1, 4096]
    - [51, 0.0]
  - - [4096, 15360, 1, 4096]
    - [55, 0.0]
  - - [4096, 15872, 1, 4096]
    - [56, 0.0]
  - - [4096, 16384, 1, 4096]
    - [56, 0.0]
  - - [4096, 17408, 1, 4096]
    - [60, 0.0]
  - - [4096, 18432, 1, 4096]
    - [58, 0.0]
  - - [4096, 19456, 1, 4096]
    - [58, 0.0]
  - - [4096, 20480, 1, 4096]
    - [56, 0.0]
  - - [4096, 21504, 1, 4096]
    - [53, 0.0]
  - - [4096, 22528, 1, 4096]
    - [60, 0.0]
  - - [4096, 23552, 1, 4096]
    - [58, 0.0]
  - - [4096, 24576, 1, 4096]
    - [56, 0.0]
  - - [4096, 25600, 1, 4096]
    - [61, 0.0]
  - - [4096, 26624, 1, 4096]
    - [60, 0.0]
  - - [4096, 27648, 1, 4096]
    - [55, 0.0]
  - - [4096, 28672, 1, 4096]
    - [58, 0.0]
  - - [4096, 29696, 1, 4096]
    - [56, 0.0]
  - - [4096, 30720, 1, 4096]
    - [60, 0.0]
  - - [4096, 31744, 1, 4096]
    - [60, 0.0]
  - - [4096, 32768, 1, 4096]
    - [44, 0.0]
  - - [4096, 34816, 1, 4096]
    - [60, 0.0]
  - - [4096, 36864, 1, 4096]
    - [56, 0.0]
  - - [4096, 38912, 1, 4096]
    - [58, 0.0]
  - - [4096, 40960, 1, 4096]
    - [60, 0.0]
  - - [4096, 43008, 1, 4096]
    - [58, 0.0]
  - - [4096, 45056, 1, 4096]
    - [60, 0.0]
  - - [4096, 47104, 1, 4096]
    - [58, 0.0]
  - - [4096, 49152, 1, 4096]
    - [60, 0.0]
  - - [4096, 51200, 1, 4096]
    - [58, 0.0]
  - - [4096, 53248, 1, 4096]
    - [58, 0.0]
  - - [4096, 55296, 1, 4096]
    - [56, 0.0]
  - - [4096, 57344, 1, 4096]
    - [58, 0.0]
  - - [4096, 59392, 1, 4096]
    - [56, 0.0]
  - - [4096, 61440, 1, 4096]
    - [58, 0.0]
  - - [4096, 63488, 1, 4096]
    - [60, 0.0]
  - - [4096, 65536, 1, 4096]
    - [56, 0.0]
  - - [6144, 16, 1, 4096]
    - [30, 0.0]
  - - [6144, 32, 1, 4096]
    - [62, 0.0]
  - - [6144, 48, 1, 4096]
    - [63, 0.0]
  - - [6144, 64, 1, 4096]
    - [32, 0.0]
  - - [6144, 80, 1, 4096]
    - [32, 0.0]
  - - [6144, 96, 1, 4096]
    - [32, 0.0]
  - - [6144, 112, 1, 4096]
    - [33, 0.0]
  - - [6144, 128, 1, 4096]
    - [34, 0.0]
  - - [6144, 144, 1, 4096]
    - [33, 0.0]
  - - [6144, 160, 1, 4096]
    - [34, 0.0]
  - - [6144, 176, 1, 4096]
    - [35, 0.0]
  - - [6144, 192, 1, 4096]
    - [35, 0.0]
  - - [6144, 208, 1, 4096]
    - [35, 0.0]
  - - [6144, 224, 1, 4096]
    - [35, 0.0]
  - - [6144, 240, 1, 4096]
    - [35, 0.0]
  - - [6144, 256, 1, 4096]
    - [36, 0.0]
  - - [6144, 272, 1, 4096]
    - [35, 0.0]
  - - [6144, 288, 1, 4096]
    - [35, 0.0]
  - - [6144, 304, 1, 4096]
    - [36, 0.0]
  - - [6144, 320, 1, 4096]
    - [36, 0.0]
  - - [6144, 336, 1, 4096]
    - [64, 0.0]
  - - [6144, 352, 1, 4096]
    - [36, 0.0]
  - - [6144, 368, 1, 4096]
    - [36, 0.0]
  - - [6144, 384, 1, 4096]
    - [36, 0.0]
  - - [6144, 400, 1, 4096]
    - [37, 0.0]
  - - [6144, 416, 1, 4096]
    - [37, 0.0]
  - - [6144, 432, 1, 4096]
    - [37, 0.0]
  - - [6144, 448, 1, 4096]
    - [37, 0.0]
  - - [6144, 464, 1, 4096]
    - [37, 0.0]
  - - [6144, 480, 1, 4096]
    - [37, 0.0]
  - - [6144, 496, 1, 4096]
    - [38, 0.0]
  - - [6144, 512, 1, 4096]
    - [39, 0.0]
  - - [6144, 544, 1, 4096]
    - [38, 0.0]
  - - [6144, 576, 1, 4096]
    - [38, 0.0]
  - - [6144, 608, 1, 4096]
    - [40, 0.0]
  - - [6144, 640, 1, 4096]
    - [41, 0.0]
  - - [6144, 672, 1, 4096]
    - [40, 0.0]
  - - [6144, 704, 1, 4096]
    - [43, 0.0]
  - - [6144, 736, 1, 4096]
    - [42, 0.0]
  - - [6144, 768, 1, 4096]
    - [42, 0.0]
  - - [6144, 800, 1, 4096]
    - [65, 0.0]
  - - [6144, 832, 1, 4096]
    - [65, 0.0]
  - - [6144, 864, 1, 4096]
    - [66, 0.0]
  - - [6144, 896, 1, 4096]
    - [67, 0.0]
  - - [6144, 928, 1, 4096]
    - [109, 0.0]
  - - [6144, 960, 1, 4096]
    - [109, 0.0]
  - - [6144, 992, 1, 4096]
    - [45, 0.0]
  - - [6144, 1024, 1, 4096]
    - [45, 0.0]
  - - [6144, 1088, 1, 4096]
    - [45, 0.0]
  - - [6144, 1152, 1, 4096]
    - [44, 0.0]
  - - [6144, 1216, 1, 4096]
    - [68, 0.0]
  - - [6144, 1280, 1, 4096]
    - [47, 0.0]
  - - [6144, 1344, 1, 4096]
    - [110, 0.0]
  - - [6144, 1408, 1, 4096]
    - [111, 0.0]
  - - [6144, 1472, 1, 4096]
    - [49, 0.0]
  - - [6144, 1536, 1, 4096]
    - [49, 0.0]
  - - [6144, 1600, 1, 4096]
    - [65, 0.0]
  - - [6144, 1664, 1, 4096]
    - [50, 0.0]
  - - [6144, 1728, 1, 4096]
    - [50, 0.0]
  - - [6144, 1792, 1, 4096]
    - [69, 0.0]
  - - [6144, 1856, 1, 4096]
    - [51, 0.0]
  - - [6144, 1920, 1, 4096]
    - [51, 0.0]
  - - [6144, 1984, 1, 4096]
    - [70, 0.0]
  - - [6144, 2048, 1, 4096]
    - [52, 0.0]
  - - [6144, 2176, 1, 4096]
    - [53, 0.0]
  - - [6144, 2304, 1, 4096]
    - [53, 0.0]
  - - [6144, 2432, 1, 4096]
    - [72, 0.0]
  - - [6144, 2560, 1, 4096]
    - [73, 0.0]
  - - [6144, 2688, 1, 4096]
    - [56, 0.0]
  - - [6144, 2816, 1, 4096]
    - [60, 0.0]
  - - [6144, 2944, 1, 4096]
    - [58, 0.0]
  - - [6144, 3072, 1, 4096]
    - [58, 0.0]
  - - [6144, 3200, 1, 4096]
    - [74, 0.0]
  - - [6144, 3328, 1, 4096]
    - [75, 0.0]
  - - [6144, 3456, 1, 4096]
    - [45, 0.0]
  - - [6144, 3584, 1, 4096]
    - [50, 0.0]
  - - [6144, 3712, 1, 4096]
    - [51, 0.0]
  - - [6144, 3840, 1, 4096]
    - [51, 0.0]
  - - [6144, 3968, 1, 4096]
    - [51, 0.0]
  - - [6144, 4096, 1, 4096]
    - [69, 0.0]
  - - [6144, 4352, 1, 4096]
    - [52, 0.0]
  - - [6144, 4608, 1, 4096]
    - [53, 0.0]
  - - [6144, 4864, 1, 4096]
    - [71, 0.0]
  - - [6144, 5120, 1, 4096]
    - [59, 0.0]
  - - [6144, 5376, 1, 4096]
    - [56, 0.0]
  - - [6144, 5632, 1, 4096]
    - [76, 0.0]
  - - [6144, 5888, 1, 4096]
    - [60, 0.0]
  - - [6144, 6144, 1, 4096]
    - [58, 0.0]
  - - [6144, 6400, 1, 4096]
    - [58, 0.0]
  - - [6144, 6656, 1, 4096]
    - [52, 0.0]
  - - [6144, 6912, 1, 4096]
    - [53, 0.0]
  - - [6144, 7168, 1, 4096]
    - [71, 0.0]
  - - [6144, 7424, 1, 4096]
    - [55, 0.0]
  - - [6144, 7680, 1, 4096]
    - [55, 0.0]
  - - [6144, 7936, 1, 4096]
    - [56, 0.0]
  - - [6144, 8192, 1, 4096]
    - [60, 0.0]
  - - [6144, 8704, 1, 4096]
    - [76, 0.0]
  - - [6144, 9216, 1, 4096]
    - [58, 0.0]
  - - [6144, 9728, 1, 4096]
    - [58, 0.0]
  - - [6144, 10240, 1, 4096]
    - [55, 0.0]
  - - [6144, 10752, 1, 4096]
    - [56, 0.0]
  - - [6144, 11264, 1, 4096]
    - [53, 0.0]
  - - [6144, 11776, 1, 4096]
    - [76, 0.0]
  - - [6144, 12288, 1, 4096]
    - [58, 0.0]
  - - [6144, 12800, 1, 4096]
    - [58, 0.0]
  - - [6144, 13312, 1, 4096]
    - [75, 0.0]
  - - [6144, 13824, 1, 4096]
    - [53, 0.0]
  - - [6144, 14336, 1, 4096]
    - [53, 0.0]
  - - [6144, 14848, 1, 4096]
    - [60, 0.0]
  - - [6144, 15360, 1, 4096]
    - [58, 0.0]
  - - [6144, 15872, 1, 4096]
    - [71, 0.0]
  - - [6144, 16384, 1, 4096]
    - [54, 0.0]
  - - [6144, 17408, 1, 4096]
    - [60, 0.0]
  - - [6144, 18432, 1, 4096]
    - [58, 0.0]
  - - [6144, 19456, 1, 4096]
    - [45, 0.0]
  - - [6144, 20480, 1, 4096]
    - [76, 0.0]
  - - [6144, 21504, 1, 4096]
    - [45, 0.0]
  - - [6144, 22528, 1, 4096]
    - [58, 0.0]
  - - [6144, 23552, 1, 4096]
    - [55, 0.0]
  - - [6144, 24576, 1, 4096]
    - [58, 0.0]
  - - [6144, 25600, 1, 4096]
    - [58, 0.0]
  - - [6144, 26624, 1, 4096]
    - [45, 0.0]
  - - [6144, 27648, 1, 4096]
    - [44, 0.0]
  - - [6144, 28672, 1, 4096]
    - [58, 0.0]
  - - [6144, 29696, 1, 4096]
    - [60, 0.0]
  - - [6144, 30720, 1, 4096]
    - [56, 0.0]
  - - [6144, 31744, 1, 4096]
    - [58, 0.0]
  - - [6144, 32768, 1, 4096]
    - [45, 0.0]
  - - [6144, 34816, 1, 4096]
    - [58, 0.0]
  - - [6144, 36864, 1, 4096]
    - [65, 0.0]
  - - [6144, 38912, 1, 4096]
    - [45, 0.0]
  - - [6144, 40960, 1, 4096]
    - [45, 0.0]
  - - [6144, 43008, 1, 4096]
    - [69, 0.0]
  - - [6144, 45056, 1, 4096]
    - [58, 0.0]
  - - [6144, 47104, 1, 4096]
    - [58, 0.0]
  - - [6144, 49152, 1, 4096]
    - [45, 0.0]
  - - [6144, 51200, 1, 4096]
    - [56, 0.0]
  - - [6144, 53248, 1, 4096]
    - [45, 0.0]
  - - [6144, 55296, 1, 4096]
    - [53, 0.0]
  - - [6144, 57344, 1, 4096]
    - [69, 0.0]
  - - [6144, 59392, 1, 4096]
    - [45, 0.0]
  - - [6144, 61440, 1, 4096]
    - [45, 0.0]
  - - [6144, 63488, 1, 4096]
    - [55, 0.0]
  - - [6144, 65536, 1, 4096]
    - [45, 0.0]
  - - [32000, 16, 1, 4096]
    - [77, 0.0]
  - - [32000, 32, 1, 4096]
    - [78, 0.0]
  - - [32000, 48, 1, 4096]
    - [78, 0.0]
  - - [32000, 64, 1, 4096]
    - [78, 0.0]
  - - [32000, 80, 1, 4096]
    - [79, 0.0]
  - - [32000, 96, 1, 4096]
    - [80, 0.0]
  - - [32000, 112, 1, 4096]
    - [81, 0.0]
  - - [32000, 128, 1, 4096]
    - [82, 0.0]
  - - [32000, 144, 1, 4096]
    - [83, 0.0]
  - - [32000, 160, 1, 4096]
    - [108, 0.0]
  - - [32000, 176, 1, 4096]
    - [84, 0.0]
  - - [32000, 192, 1, 4096]
    - [85, 0.0]
  - - [32000, 208, 1, 4096]
    - [86, 0.0]
  - - [32000, 224, 1, 4096]
    - [87, 0.0]
  - - [32000, 240, 1, 4096]
    - [88, 0.0]
  - - [32000, 256, 1, 4096]
    - [89, 0.0]
  - - [32000, 272, 1, 4096]
    - [90, 0.0]
  - - [32000, 288, 1, 4096]
    - [90, 0.0]
  - - [32000, 304, 1, 4096]
    - [91, 0.0]
  - - [32000, 320, 1, 4096]
    - [91, 0.0]
  - - [32000, 336, 1, 4096]
    - [91, 0.0]
  - - [32000, 352, 1, 4096]
    - [92, 0.0]
  - - [32000, 368, 1, 4096]
    - [93, 0.0]
  - - [32000, 384, 1, 4096]
    - [94, 0.0]
  - - [32000, 400, 1, 4096]
    - [95, 0.0]
  - - [32000, 416, 1, 4096]
    - [96, 0.0]
  - - [32000, 432, 1, 4096]
    - [95, 0.0]
  - - [32000, 448, 1, 4096]
    - [97, 0.0]
  - - [32000, 464, 1, 4096]
    - [97, 0.0]
  - - [32000, 480, 1, 4096]
    - [97, 0.0]
  - - [32000, 496, 1, 4096]
    - [98, 0.0]
  - - [32000, 512, 1, 4096]
    - [98, 0.0]
  - - [32000, 544, 1, 4096]
    - [99, 0.0]
  - - [32000, 576, 1, 4096]
    - [99, 0.0]
  - - [32000, 608, 1, 4096]
    - [100, 0.0]
  - - [32000, 640, 1, 4096]
    - [101, 0.0]
  - - [32000, 672, 1, 4096]
    - [91, 0.0]
  - - [32000, 704, 1, 4096]
    - [92, 0.0]
  - - [32000, 736, 1, 4096]
    - [94, 0.0]
  - - [32000, 768, 1, 4096]
    - [94, 0.0]
  - - [32000, 800, 1, 4096]
    - [97, 0.0]
  - - [32000, 832, 1, 4096]
    - [95, 0.0]
  - - [32000, 864, 1, 4096]
    - [95, 0.0]
  - - [32000, 896, 1, 4096]
    - [102, 0.0]
  - - [32000, 928, 1, 4096]
    - [97, 0.0]
  - - [32000, 960, 1, 4096]
    - [97, 0.0]
  - - [32000, 992, 1, 4096]
    - [98, 0.0]
  - - [32000, 1024, 1, 4096]
    - [98, 0.0]
  - - [32000, 1088, 1, 4096]
    - [99, 0.0]
  - - [32000, 1152, 1, 4096]
    - [99, 0.0]
  - - [32000, 1216, 1, 4096]
    - [92, 0.0]
  - - [32000, 1280, 1, 4096]
    - [95, 0.0]
  - - [32000, 1344, 1, 4096]
    - [103, 0.0]
  - - [32000, 1408, 1, 4096]
    - [97, 0.0]
  - - [32000, 1472, 1, 4096]
    - [94, 0.0]
  - - [32000, 1536, 1, 4096]
    - [94, 0.0]
  - - [32000, 1600, 1, 4096]
    - [99, 0.0]
  - - [32000, 1664, 1, 4096]
    - [104, 0.0]
  - - [32000, 1728, 1, 4096]
    - [99, 0.0]
  - - [32000, 1792, 1, 4096]
    - [105, 0.0]
  - - [32000, 1856, 1, 4096]
    - [101, 0.0]
  - - [32000, 1920, 1, 4096]
    - [97, 0.0]
  - - [32000, 1984, 1, 4096]
    - [100, 0.0]
  - - [32000, 2048, 1, 4096]
    - [98, 0.0]
  - - [32000, 2176, 1, 4096]
    - [99, 0.0]
  - - [32000, 2304, 1, 4096]
    - [99, 0.0]
  - - [32000, 2432, 1, 4096]
    - [106, 0.0]
  - - [32000, 2560, 1, 4096]
    - [98, 0.0]
  - - [32000, 2688, 1, 4096]
    - [107, 0.0]
  - - [32000, 2816, 1, 4096]
    - [99, 0.0]
  - - [32000, 2944, 1, 4096]
    - [105, 0.0]
  - - [32000, 3072, 1, 4096]
    - [105, 0.0]
  - - [32000, 3200, 1, 4096]
    - [100, 0.0]
  - - [32000, 3328, 1, 4096]
    - [97, 0.0]
  - - [32000, 3456, 1, 4096]
    - [100, 0.0]
  - - [32000, 3584, 1, 4096]
    - [105, 0.0]
  - - [32000, 3712, 1, 4096]
    - [107, 0.0]
  - - [32000, 3840, 1, 4096]
    - [97, 0.0]
  - - [32000, 3968, 1, 4096]
    - [99, 0.0]
  - - [32000, 4096, 1, 4096]
    - [105, 0.0]
  - - [32000, 4352, 1, 4096]
    - [105, 0.0]
  - - [32000, 4608, 1, 4096]
    - [99, 0.0]
  - - [32000, 4864, 1, 4096]
    - [105, 0.0]
  - - [32000, 5120, 1, 4096]
    - [99, 0.0]
  - - [32000, 5376, 1, 4096]
    - [105, 0.0]
  - - [32000, 5632, 1, 4096]
    - [99, 0.0]
  - - [32000, 5888, 1, 4096]
    - [100, 0.0]
  - - [32000, 6144, 1, 4096]
    - [105, 0.0]
  - - [32000, 6400, 1, 4096]
    - [100, 0.0]
  - - [32000, 6656, 1, 4096]
    - [105, 0.0]
  - - [32000, 6912, 1, 4096]
    - [99, 0.0]
  - - [32000, 7168, 1, 4096]
    - [101, 0.0]
  - - [32000, 7424, 1, 4096]
    - [105, 0.0]
  - - [32000, 7680, 1, 4096]
    - [101, 0.0]
  - - [32000, 7936, 1, 4096]
    - [105, 0.0]
  - - [32000, 8192, 1, 4096]
    - [105, 0.0]
  - - [28672, 1004, 1, 4096]
    - [114, 0.0]
  - - [32000, 16, 1, 8192]
    - [115, 0.0]
  - - [32000, 32, 1, 8192]
    - [116, 0.0]
  - - [32000, 48, 1, 8192]
    - [117, 0.0]
  - - [32000, 64, 1, 8192]
    - [118, 0.0]
  - - [32000, 80, 1, 8192]
    - [119, 0.0]
  - - [32000, 96, 1, 8192]
    - [120, 0.0]
  - - [32000, 112, 1, 8192]
    - [121, 0.0]
  - - [32000, 128, 1, 8192]
    - [122, 0.0]
  - - [32000, 144, 1, 8192]
    - [123, 0.0]
  - - [32000, 160, 1, 8192]
    - [124, 0.0]
  - - [32000, 176, 1, 8192]
    - [125, 0.0]
  - - [32000, 192, 1, 8192]
    - [126, 0.0]
  - - [32000, 208, 1, 8192]
    - [127, 0.0]
  - - [32000, 224, 1, 8192]
    - [127, 0.0]
  - - [32000, 240, 1, 8192]
    - [128, 0.0]
  - - [32000, 256, 1, 8192]
    - [129, 0.0]
  - - [32000, 272, 1, 8192]
    - [130, 0.0]
  - - [32000, 288, 1, 8192]
    - [131, 0.0]
  - - [32000, 304, 1, 8192]
    - [132, 0.0]
  - - [32000, 320, 1, 8192]
    - [132, 0.0]
  - - [32000, 336, 1, 8192]
    - [133, 0.0]
  - - [32000, 352, 1, 8192]
    - [134, 0.0]
  - - [32000, 368, 1, 8192]
    - [135, 0.0]
  - - [32000, 384, 1, 8192]
    - [135, 0.0]
  - - [32000, 400, 1, 8192]
    - [136, 0.0]
  - - [32000, 416, 1, 8192]
    - [136, 0.0]
  - - [32000, 432, 1, 8192]
    - [137, 0.0]
  - - [32000, 448, 1, 8192]
    - [137, 0.0]
  - - [32000, 464, 1, 8192]
    - [138, 0.0]
  - - [32000, 480, 1, 8192]
    - [138, 0.0]
  - - [32000, 496, 1, 8192]
    - [139, 0.0]
  - - [32000, 512, 1, 8192]
    - [139, 0.0]
  - - [32000, 528, 1, 8192]
    - [140, 0.0]
  - - [32000, 544, 1, 8192]
    - [141, 0.0]
  - - [32000, 560, 1, 8192]
    - [141, 0.0]
  - - [32000, 576, 1, 8192]
    - [142, 0.0]
  - - [32000, 592, 1, 8192]
    - [133, 0.0]
  - - [32000, 608, 1, 8192]
    - [132, 0.0]
  - - [32000, 624, 1, 8192]
    - [135, 0.0]
  - - [32000, 640, 1, 8192]
    - [135, 0.0]
  - - [32000, 656, 1, 8192]
    - [143, 0.0]
  - - [32000, 672, 1, 8192]
    - [133, 0.0]
  - - [32000, 688, 1, 8192]
    - [134, 0.0]
  - - [32000, 704, 1, 8192]
    - [135, 0.0]
  - - [32000, 720, 1, 8192]
    - [135, 0.0]
  - - [32000, 736, 1, 8192]
    - [135, 0.0]
  - - [32000, 752, 1, 8192]
    - [135, 0.0]
  - - [32000, 768, 1, 8192]
    - [135, 0.0]
  - - [32000, 784, 1, 8192]
    - [144, 0.0]
  - - [32000, 800, 1, 8192]
    - [138, 0.0]
  - - [32000, 816, 1, 8192]
    - [136, 0.0]
  - - [32000, 832, 1, 8192]
    - [136, 0.0]
  - - [32000, 848, 1, 8192]
    - [136, 0.0]
  - - [32000, 864, 1, 8192]
    - [145, 0.0]
  - - [32000, 880, 1, 8192]
    - [145, 0.0]
  - - [32000, 896, 1, 8192]
    - [145, 0.0]
  - - [32000, 912, 1, 8192]
    - [138, 0.0]
  - - [32000, 928, 1, 8192]
    - [138, 0.0]
  - - [32000, 944, 1, 8192]
    - [138, 0.0]
  - - [32000, 960, 1, 8192]
    - [138, 0.0]
  - - [32000, 976, 1, 8192]
    - [146, 0.0]
  - - [32000, 992, 1, 8192]
    - [139, 0.0]
  - - [32000, 1008, 1, 8192]
    - [146, 0.0]
  - - [32000, 1024, 1, 8192]
    - [139, 0.0]
  - - [32000, 1056, 1, 8192]
    - [140, 0.0]
  - - [32000, 1088, 1, 8192]
    - [147, 0.0]
  - - [32000, 1120, 1, 8192]
    - [147, 0.0]
  - - [32000, 1152, 1, 8192]
    - [142, 0.0]
  - - [32000, 1184, 1, 8192]
    - [134, 0.0]
  - - [32000, 1216, 1, 8192]
    - [134, 0.0]
  - - [32000, 1248, 1, 8192]
    - [138, 0.0]
  - - [32000, 1280, 1, 8192]
    - [148, 0.0]
  - - [32000, 1312, 1, 8192]
    - [149, 0.0]
  - - [32000, 1344, 1, 8192]
    - [149, 0.0]
  - - [32000, 1376, 1, 8192]
    - [140, 0.0]
  - - [32000, 1408, 1, 8192]
    - [140, 0.0]
  - - [32000, 1440, 1, 8192]
    - [150, 0.0]
  - - [32000, 1472, 1, 8192]
    - [151, 0.0]
  - - [32000, 1504, 1, 8192]
    - [151, 0.0]
  - - [32000, 1536, 1, 8192]
    - [151, 0.0]
  - - [32064, 1024, 1, 16384]
    - [152, 0.0]
  - - [32064, 16, 1, 16384]
    - [153, 0.0]
  - - [32064, 32, 1, 16384]
    - [154, 0.0]
  - - [32064, 48, 1, 16384]
    - [155, 0.0]
  - - [32064, 64, 1, 16384]
    - [156, 0.0]
  - - [32064, 80, 1, 16384]
    - [157, 0.0]
  - - [32064, 96, 1, 16384]
    - [158, 0.0]
  - - [32064, 112, 1, 16384]
    - [159, 0.0]
  - - [32064, 128, 1, 16384]
    - [160, 0.0]
  - - [32064, 144, 1, 16384]
    - [161, 0.0]
  - - [32064, 160, 1, 16384]
    - [162, 0.0]
  - - [32064, 176, 1, 16384]
    - [163, 0.0]
  - - [32064, 192, 1, 16384]
    - [164, 0.0]
  - - [32064, 208, 1, 16384]
    - [165, 0.0]
  - - [32064, 224, 1, 16384]
    - [166, 0.0]
  - - [32064, 240, 1, 16384]
    - [167, 0.0]
  - - [32064, 256, 1, 16384]
    - [167, 0.0]
  - - [32064, 272, 1, 16384]
    - [168, 0.0]
  - - [32064, 288, 1, 16384]
    - [168, 0.0]
  - - [32064, 304, 1, 16384]
    - [169, 0.0]
  - - [32064, 320, 1, 16384]
    - [170, 0.0]
  - - [32064, 336, 1, 16384]
    - [171, 0.0]
  - - [32064, 352, 1, 16384]
    - [171, 0.0]
  - - [32064, 368, 1, 16384]
    - [172, 0.0]
  - - [32064, 384, 1, 16384]
    - [172, 0.0]
  - - [32064, 400, 1, 16384]
    - [173, 0.0]
  - - [32064, 416, 1, 16384]
    - [173, 0.0]
  - - [32064, 432, 1, 16384]
    - [173, 0.0]
  - - [32064, 448, 1, 16384]
    - [174, 0.0]
  - - [32064, 464, 1, 16384]
    - [174, 0.0]
  - - [32064, 480, 1, 16384]
    - [174, 0.0]
  - - [32064, 496, 1, 16384]
    - [175, 0.0]
  - - [32064, 512, 1, 16384]
    - [175, 0.0]
  - - [16032, 5, 1, 16384]
    - [176, 0.0]
  - - [16032, 6, 1, 16384]
    - [176, 0.0]
  - - [16032, 7, 1, 16384]
    - [177, 0.0]
  - - [16032, 8, 1, 16384]
    - [178, 0.0]
  - - [16032, 9, 1, 16384]
    - [179, 0.0]
  - - [16032, 10, 1, 16384]
    - [180, 0.0]
  - - [16032, 11, 1, 16384]
    - [181, 0.0]
  - - [16032, 12, 1, 16384]
    - [180, 0.0]
  - - [16032, 13, 1, 16384]
    - [182, 0.0]
  - - [16032, 14, 1, 16384]
    - [179, 0.0]
  - - [16032, 15, 1, 16384]
    - [182, 0.0]
  - - [16032, 16, 1, 16384]
    - [183, 0.0]
  - - [16032, 17, 1, 16384]
    - [154, 0.0]
  - - [16032, 32, 1, 16384]
    - [184, 0.0]
- null
- null
- DeviceEfficiency
- GridBased
