projects/hipblaslt/library/src/amd_detail/rocblaslt/src/Tensile/Logic/asm_full/aquavanjaram/gfx942/StreamK/aquavanjaram942_Cijk_Alik_Bjlk_I8BH_UserArgs.yaml
- {MinimumRequiredVersion: 4.33.0}
- aquavanjaram942
- gfx942
- [Device 0049, Device 0050]
    SolutionIndex: 0
    SolutionNameMin: Cijk_Alik_Bjlk_I8BH_UserArgs_MT256x256x32_MI16x16x1_SN_CLR0_GSU0_GSUC0_GSUWGMRR0_K1_LBSPPA256_LBSPPB2048_LPB64_MIWT8_8_PLR0_SU0_SUM0_SUS0_SKXCCM8_VWA8_VWB4_WGM1_WGMXCC1_WGMXCCGn1
    SolutionIndex: 1
    SolutionNameMin: Cijk_Alik_Bjlk_I8BH_UserArgs_MT256x256x32_MI16x16x1_SN_CLR0_GSU0_GSUC0_GSUWGMRR0_K1_LBSPPA128_LBSPPB2048_LPB64_MIWT8_8_PLR0_SU0_SUM0_SUS0_SKXCCM8_VWA4_VWB4_WGM4_WGMXCC1_WGMXCCGn1
    SolutionIndex: 2
    SolutionNameMin: Cijk_Alik_Bjlk_I8BH_UserArgs_MT256x256x32_MI16x16x1_SN_CLR0_GSU0_GSUC0_GSUWGMRR0_K1_LBSPPA128_LBSPPB2048_LPB64_MIWT8_8_PLR0_SU0_SUM0_SUS0_SKXCCM8_VWA4_VWB4_WGM4_WGMXCC1_WGMXCCGn1
    SolutionIndex: 3
    SolutionNameMin: Cijk_Alik_Bjlk_I8BH_UserArgs_MT256x128x32_MI16x16x1_SN_CLR0_GSU0_GSUC0_GSUWGMRR0_K1_LBSPPA256_LBSPPB1024_LPB64_MIWT8_4_PLR0_SU0_SUM0_SUS0_SKXCCM8_VWA8_VWB4_WGM1_WGMXCC1_WGMXCCGn1
    SolutionIndex: 4
    SolutionNameMin: Cijk_Alik_Bjlk_I8BH_UserArgs_MT256x128x32_MI16x16x1_SN_CLR0_GSU0_GSUC0_GSUWGMRR0_K1_LBSPPA128_LBSPPB1024_LPB64_MIWT8_4_PLR0_SU0_SUM0_SUS0_SKXCCM8_VWA4_VWB4_WGM1_WGMXCC1_WGMXCCGn1
    SolutionIndex: 5
    SolutionNameMin: Cijk_Alik_Bjlk_I8BH_UserArgs_MT256x128x32_MI16x16x1_SN_CLR0_GSU0_GSUC0_GSUWGMRR0_K1_LBSPPA256_LBSPPB1024_LPB64_MIWT8_4_PLR0_SU0_SUM0_SUS0_SKXCCM8_VWA8_VWB4_WGM1_WGMXCC1_WGMXCCGn1
    SolutionIndex: 6
    SolutionNameMin: Cijk_Alik_Bjlk_I8BH_UserArgs_MT256x128x32_MI16x16x1_SN_CLR0_GSU0_GSUC0_GSUWGMRR0_K1_LBSPPA256_LBSPPB1024_LPB64_MIWT8_4_PLR0_SU0_SUM0_SUS0_SKXCCM8_VWA8_VWB4_WGM8_WGMXCC1_WGMXCCGn1
    SolutionIndex: 7
    SolutionNameMin: Cijk_Alik_Bjlk_I8BH_UserArgs_MT128x128x32_MI16x16x1_SN_CLR0_GSU0_GSUC0_GSUWGMRR0_K1_LBSPPA128_LBSPPB1024_LPB64_MIWT4_4_PLR0_SU0_SUM0_SUS0_SKXCCM8_VWA4_VWB4_WGM1_WGMXCC1_WGMXCCGn1
    SolutionIndex: 8
    SolutionNameMin: Cijk_Alik_Bjlk_I8BH_UserArgs_MT128x64x32_MI16x16x1_SN_CLR0_GSU0_GSUC0_GSUWGMRR0_K1_LBSPPA128_LBSPPB512_LPB32_MIWT4_2_PLR0_SU0_SUM0_SUS0_SKXCCM8_VWA4_VWB2_WGM1_WGMXCC1_WGMXCCGn1
    SolutionIndex: 9
    SolutionNameMin: Cijk_Alik_Bjlk_I8BH_UserArgs_MT64x64x32_MI16x16x1_SN_CLR0_GSU0_GSUC0_GSUWGMRR0_K1_LBSPPA128_LBSPPB512_LPB32_MIWT2_2_PLR0_SU0_SUM0_SUS0_SKXCCM8_VWA2_VWB2_WGM1_WGMXCC1_WGMXCCGn1
    SolutionIndex: 10
    SolutionNameMin: Cijk_Alik_Bjlk_I8BH_UserArgs_MT32x64x32_MI16x16x1_SN_CLR0_GSU0_GSUC0_GSUWGMRR0_K1_LBSPPA128_LBSPPB512_LPB32_MIWT1_2_PLR0_SU0_SUM0_SUS0_SKXCCM8_VWA1_VWB2_WGM1_WGMXCC1_WGMXCCGn1
    SolutionIndex: 11
    SolutionNameMin: Cijk_Alik_Bjlk_I8BH_UserArgs_MT64x32x32_MI16x16x1_SN_CLR0_GSU0_GSUC0_GSUWGMRR0_K1_LBSPPA128_LBSPPB256_LPB16_MIWT2_1_PLR0_SU0_SUM0_SUS0_SKXCCM8_VWA2_VWB1_WGM1_WGMXCC1_WGMXCCGn1
    SolutionIndex: 12
    SolutionNameMin: Cijk_Alik_Bjlk_I8BH_UserArgs_MT32x32x32_MI16x16x1_SN_CLR0_GSU0_GSUC0_GSUWGMRR0_K1_LBSPPA128_LBSPPB256_LPB16_MIWT1_1_PLR0_SU0_SUM0_SUS0_SKXCCM8_VWA1_VWB1_WGM1_WGMXCC1_WGMXCCGn1
    SolutionIndex: 13
    SolutionNameMin: Cijk_Alik_Bjlk_I8BH_UserArgs_MT256x256x64_MI16x16x1_SN_CLR1_GSU0_GSUC0_GSUWGMRR0_K1_LBSPPA256_LBSPPB2048_LPB64_MIWT8_8_PLR1_SU0_SUM0_SUS0_SKXCCM8_VWA4_VWB4_WGM1_WGMXCC1_WGMXCCGn1
    SolutionIndex: 14
    SolutionNameMin: Cijk_Alik_Bjlk_I8BH_UserArgs_MT256x256x64_MI16x16x1_SN_CLR1_GSU0_GSUC0_GSUWGMRR0_K1_LBSPPA256_LBSPPB2048_LPB0_MIWT8_8_PLR1_SU0_SUM0_SUS0_SKXCCM8_VWA4_VWB8_WGM1_WGMXCC1_WGMXCCGn1
    SolutionIndex: 15
    SolutionNameMin: Cijk_Alik_Bjlk_I8BH_UserArgs_MT256x256x64_MI16x16x1_SN_CLR1_GSU0_GSUC0_GSUWGMRR0_K1_LBSPPA256_LBSPPB2048_LPB64_MIWT8_8_PLR1_SU0_SUM0_SUS0_SKXCCM8_VWA4_VWB4_WGM1_WGMXCC1_WGMXCCGn1
    SolutionIndex: 16
    SolutionNameMin: Cijk_Alik_Bjlk_I8BH_UserArgs_MT256x256x64_MI16x16x1_SN_CLR1_GSU0_GSUC0_GSUWGMRR0_K1_LBSPPA256_LBSPPB2048_LPB0_MIWT8_8_PLR1_SU0_SUM0_SUS0_SKXCCM8_VWA4_VWB8_WGM1_WGMXCC1_WGMXCCGn1
    SolutionIndex: 17
    SolutionNameMin: Cijk_Alik_Bjlk_I8BH_UserArgs_MT256x256x64_MI16x16x1_SN_CLR1_GSU0_GSUC0_GSUWGMRR0_K1_LBSPPA256_LBSPPB2048_LPB64_MIWT8_8_PLR1_SU0_SUM0_SUS0_SKXCCM8_VWA4_VWB4_WGM4_WGMXCC1_WGMXCCGn1
    SolutionIndex: 18
    SolutionNameMin: Cijk_Alik_Bjlk_I8BH_UserArgs_MT256x256x64_MI16x16x1_SN_CLR1_GSU0_GSUC0_GSUWGMRR0_K1_LBSPPA512_LBSPPB2048_LPB0_MIWT8_8_PLR1_SU0_SUM0_SUS0_SKXCCM8_VWA8_VWB8_WGM4_WGMXCC1_WGMXCCGn1
    SolutionIndex: 19
    SolutionNameMin: Cijk_Alik_Bjlk_I8BH_UserArgs_MT256x256x64_MI16x16x1_SN_CLR1_GSU0_GSUC0_GSUWGMRR0_K1_LBSPPA256_LBSPPB2048_LPB64_MIWT8_8_PLR1_SU0_SUM0_SUS0_SKXCCM8_VWA4_VWB4_WGM4_WGMXCC1_WGMXCCGn1
    SolutionIndex: 20
    SolutionNameMin: Cijk_Alik_Bjlk_I8BH_UserArgs_MT256x256x64_MI16x16x1_SN_CLR1_GSU0_GSUC0_GSUWGMRR0_K1_LBSPPA256_LBSPPB2048_LPB0_MIWT8_8_PLR1_SU0_SUM0_SUS0_SKXCCM8_VWA4_VWB8_WGM4_WGMXCC1_WGMXCCGn1
    SolutionIndex: 21
    SolutionNameMin: Cijk_Alik_Bjlk_I8BH_UserArgs_MT256x256x64_MI16x16x1_SN_CLR1_GSU0_GSUC0_GSUWGMRR0_K1_LBSPPA512_LBSPPB2048_LPB0_MIWT8_8_PLR1_SU0_SUM0_SUS0_SKXCCM8_VWA8_VWB8_WGM4_WGMXCC1_WGMXCCGn1
    SolutionIndex: 22
    SolutionNameMin: Cijk_Alik_Bjlk_I8BH_UserArgs_MT256x256x64_MI16x16x1_SN_CLR1_GSU0_GSUC0_GSUWGMRR0_K1_LBSPPA256_LBSPPB2048_LPB32_MIWT8_8_PLR1_SU0_SUM0_SUS0_SKXCCM8_VWA4_VWB2_WGM4_WGMXCC1_WGMXCCGn1
    SolutionIndex: 23
    SolutionNameMin: Cijk_Alik_Bjlk_I8BH_UserArgs_MT256x256x64_MI16x16x1_SN_CLR1_GSU0_GSUC0_GSUWGMRR0_K1_LBSPPA256_LBSPPB2048_LPB0_MIWT8_8_PLR1_SU0_SUM0_SUS0_SKXCCM8_VWA4_VWB8_WGM4_WGMXCC1_WGMXCCGn1
    SolutionIndex: 24
    SolutionNameMin: Cijk_Alik_Bjlk_I8BH_UserArgs_MT256x256x64_MI16x16x1_SN_CLR1_GSU0_GSUC0_GSUWGMRR0_K1_LBSPPA512_LBSPPB2048_LPB0_MIWT8_8_PLR1_SU0_SUM0_SUS0_SKXCCM8_VWA8_VWB8_WGM4_WGMXCC1_WGMXCCGn1
    SolutionIndex: 25
    SolutionNameMin: Cijk_Alik_Bjlk_I8BH_UserArgs_MT256x256x64_MI16x16x1_SN_CLR1_GSU0_GSUC0_GSUWGMRR0_K1_LBSPPA256_LBSPPB2048_LPB64_MIWT8_8_PLR1_SU0_SUM0_SUS0_SKXCCM8_VWA4_VWB4_WGM8_WGMXCC1_WGMXCCGn1
    SolutionIndex: 26
    SolutionNameMin: Cijk_Alik_Bjlk_I8BH_UserArgs_MT256x256x64_MI16x16x1_SN_CLR1_GSU0_GSUC0_GSUWGMRR0_K1_LBSPPA256_LBSPPB2048_LPB0_MIWT8_8_PLR1_SU0_SUM0_SUS0_SKXCCM8_VWA4_VWB8_WGM8_WGMXCC1_WGMXCCGn1
    SolutionIndex: 27
    SolutionNameMin: Cijk_Alik_Bjlk_I8BH_UserArgs_MT256x256x64_MI16x16x1_SN_CLR1_GSU0_GSUC0_GSUWGMRR0_K1_LBSPPA512_LBSPPB2048_LPB0_MIWT8_8_PLR1_SU0_SUM0_SUS0_SKXCCM8_VWA8_VWB8_WGM8_WGMXCC1_WGMXCCGn1
    SolutionIndex: 28
    SolutionNameMin: Cijk_Alik_Bjlk_I8BH_UserArgs_MT256x256x64_MI16x16x1_SN_CLR1_GSU0_GSUC0_GSUWGMRR0_K1_LBSPPA256_LBSPPB2048_LPB0_MIWT8_8_PLR1_SU0_SUM0_SUS0_SKXCCM8_VWA4_VWB8_WGM8_WGMXCC1_WGMXCCGn1
    SolutionIndex: 29
    SolutionNameMin: Cijk_Alik_Bjlk_I8BH_UserArgs_MT256x256x64_MI16x16x1_SN_CLR1_GSU0_GSUC0_GSUWGMRR0_K1_LBSPPA512_LBSPPB2048_LPB0_MIWT8_8_PLR1_SU0_SUM0_SUS0_SKXCCM8_VWA8_VWB8_WGM8_WGMXCC1_WGMXCCGn1
    SolutionIndex: 30
    SolutionNameMin: Cijk_Alik_Bjlk_I8BH_UserArgs_MT256x256x64_MI16x16x1_SN_CLR1_GSU0_GSUC0_GSUWGMRR0_K1_LBSPPA256_LBSPPB2048_LPB64_MIWT8_8_PLR1_SU0_SUM0_SUS0_SKXCCM8_VWA4_VWB4_WGM8_WGMXCC1_WGMXCCGn1
    SolutionIndex: 31
    SolutionNameMin: Cijk_Alik_Bjlk_I8BH_UserArgs_MT256x256x64_MI16x16x1_SN_CLR1_GSU0_GSUC0_GSUWGMRR0_K1_LBSPPA512_LBSPPB2048_LPB0_MIWT8_8_PLR1_SU0_SUM0_SUS0_SKXCCM8_VWA8_VWB8_WGM8_WGMXCC1_WGMXCCGn1
    SolutionIndex: 32
    SolutionNameMin: Cijk_Alik_Bjlk_I8BH_UserArgs_MT256x128x64_MI16x16x1_SN_CLR1_GSU0_GSUC0_GSUWGMRR0_K1_LBSPPA512_LBSPPB1024_LPB64_MIWT8_4_PLR1_SU0_SUM0_SUS0_SKXCCM8_VWA8_VWB4_WGM1_WGMXCC1_WGMXCCGn1
    SolutionIndex: 33
    SolutionNameMin: Cijk_Alik_Bjlk_I8BH_UserArgs_MT256x128x64_MI16x16x1_SN_CLR1_GSU0_GSUC0_GSUWGMRR0_K1_LBSPPA256_LBSPPB1024_LPB32_MIWT8_4_PLR1_SU0_SUM0_SUS0_SKXCCM8_VWA4_VWB2_WGM1_WGMXCC1_WGMXCCGn1
    SolutionIndex: 34
    SolutionNameMin: Cijk_Alik_Bjlk_I8BH_UserArgs_MT256x128x64_MI16x16x1_SN_CLR1_GSU0_GSUC0_GSUWGMRR0_K1_LBSPPA256_LBSPPB1024_LPB64_MIWT8_4_PLR1_SU0_SUM0_SUS0_SKXCCM8_VWA4_VWB4_WGM1_WGMXCC1_WGMXCCGn1
    SolutionIndex: 35
    SolutionNameMin: Cijk_Alik_Bjlk_I8BH_UserArgs_MT256x128x64_MI16x16x1_SN_CLR1_GSU0_GSUC0_GSUWGMRR0_K1_LBSPPA512_LBSPPB1024_LPB64_MIWT8_4_PLR1_SU0_SUM0_SUS0_SKXCCM8_VWA8_VWB4_WGM1_WGMXCC1_WGMXCCGn1
    SolutionIndex: 36
    SolutionNameMin: Cijk_Alik_Bjlk_I8BH_UserArgs_MT256x128x64_MI16x16x1_SN_CLR1_GSU0_GSUC0_GSUWGMRR0_K1_LBSPPA512_LBSPPB1024_LPB64_MIWT8_4_PLR1_SU0_SUM0_SUS0_SKXCCM8_VWA8_VWB4_WGM1_WGMXCC1_WGMXCCGn1
    SolutionIndex: 37
    SolutionNameMin: Cijk_Alik_Bjlk_I8BH_UserArgs_MT256x128x64_MI16x16x1_SN_CLR1_GSU0_GSUC0_GSUWGMRR0_K1_LBSPPA512_LBSPPB1024_LPB64_MIWT8_4_PLR1_SU0_SUM0_SUS0_SKXCCM8_VWA8_VWB4_WGM4_WGMXCC1_WGMXCCGn1
    SolutionIndex: 38
    SolutionNameMin: Cijk_Alik_Bjlk_I8BH_UserArgs_MT256x128x64_MI16x16x1_SN_CLR1_GSU0_GSUC0_GSUWGMRR0_K1_LBSPPA256_LBSPPB1024_LPB64_MIWT8_4_PLR1_SU0_SUM0_SUS0_SKXCCM8_VWA4_VWB4_WGM8_WGMXCC1_WGMXCCGn1
    SolutionIndex: 39
    SolutionNameMin: Cijk_Alik_Bjlk_I8BH_UserArgs_MT256x128x64_MI16x16x1_SN_CLR1_GSU0_GSUC0_GSUWGMRR0_K1_LBSPPA512_LBSPPB1024_LPB64_MIWT8_4_PLR1_SU0_SUM0_SUS0_SKXCCM8_VWA8_VWB4_WGM8_WGMXCC1_WGMXCCGn1
    SolutionIndex: 40
    SolutionNameMin: Cijk_Alik_Bjlk_I8BH_UserArgs_MT128x128x64_MI16x16x1_SN_CLR1_GSU0_GSUC0_GSUWGMRR0_K1_LBSPPA256_LBSPPB1024_LPB64_MIWT4_4_PLR1_SU0_SUM0_SUS0_SKXCCM8_VWA4_VWB4_WGM1_WGMXCC1_WGMXCCGn1
    SolutionIndex: 41
    SolutionNameMin: Cijk_Alik_Bjlk_I8BH_UserArgs_MT128x128x64_MI16x16x1_SN_CLR1_GSU0_GSUC0_GSUWGMRR0_K1_LBSPPA256_LBSPPB1024_LPB64_MIWT4_4_PLR1_SU0_SUM0_SUS0_SKXCCM8_VWA4_VWB4_WGM1_WGMXCC1_WGMXCCGn1
    SolutionIndex: 42
    SolutionNameMin: Cijk_Alik_Bjlk_I8BH_UserArgs_MT128x64x64_MI16x16x1_SN_CLR1_GSU0_GSUC0_GSUWGMRR0_K1_LBSPPA256_LBSPPB512_LPB32_MIWT4_2_PLR1_SU0_SUM0_SUS0_SKXCCM8_VWA4_VWB2_WGM1_WGMXCC1_WGMXCCGn1
    SolutionIndex: 43
    SolutionNameMin: Cijk_Alik_Bjlk_I8BH_UserArgs_MT128x64x64_MI16x16x1_SN_CLR1_GSU0_GSUC0_GSUWGMRR0_K1_LBSPPA256_LBSPPB512_LPB32_MIWT4_2_PLR1_SU0_SUM0_SUS0_SKXCCM8_VWA4_VWB2_WGM1_WGMXCC1_WGMXCCGn1
    SolutionIndex: 44
    SolutionNameMin: Cijk_Alik_Bjlk_I8BH_UserArgs_MT128x64x64_MI16x16x1_SN_CLR1_GSU0_GSUC0_GSUWGMRR0_K1_LBSPPA256_LBSPPB512_LPB32_MIWT4_2_PLR1_SU0_SUM0_SUS0_SKXCCM8_VWA4_VWB2_WGM1_WGMXCC1_WGMXCCGn1
    SolutionIndex: 45
    SolutionNameMin: Cijk_Alik_Bjlk_I8BH_UserArgs_MT128x64x64_MI16x16x1_SN_CLR1_GSU0_GSUC0_GSUWGMRR0_K1_LBSPPA256_LBSPPB512_LPB32_MIWT4_2_PLR1_SU0_SUM0_SUS0_SKXCCM8_VWA4_VWB2_WGM1_WGMXCC1_WGMXCCGn1
    SolutionIndex: 46
    SolutionNameMin: Cijk_Alik_Bjlk_I8BH_UserArgs_MT128x64x64_MI16x16x1_SN_CLR0_GSU0_GSUC0_GSUWGMRR0_K1_LBSPPA256_LBSPPB512_LPB32_MIWT4_2_PLR0_SU0_SUM0_SUS0_SKXCCM8_VWA4_VWB2_WGM1_WGMXCC1_WGMXCCGn1
    SolutionIndex: 47
    SolutionNameMin: Cijk_Alik_Bjlk_I8BH_UserArgs_MT128x32x64_MI16x16x1_SN_CLR1_GSU0_GSUC0_GSUWGMRR0_K1_LBSPPA256_LBSPPB256_LPB16_MIWT4_1_PLR1_SU0_SUM0_SUS0_SKXCCM8_VWA4_VWB1_WGM1_WGMXCC1_WGMXCCGn1
    SolutionIndex: 48
    SolutionNameMin: Cijk_Alik_Bjlk_I8BH_UserArgs_MT64x64x64_MI16x16x1_SN_CLR1_GSU0_GSUC0_GSUWGMRR0_K1_LBSPPA128_LBSPPB512_LPB32_MIWT2_2_PLR1_SU0_SUM0_SUS0_SKXCCM8_VWA2_VWB2_WGM1_WGMXCC1_WGMXCCGn1
    SolutionIndex: 49
    SolutionNameMin: Cijk_Alik_Bjlk_I8BH_UserArgs_MT64x64x64_MI16x16x1_SN_CLR1_GSU0_GSUC0_GSUWGMRR0_K1_LBSPPA128_LBSPPB512_LPB32_MIWT2_2_PLR1_SU0_SUM0_SUS0_SKXCCM8_VWA2_VWB2_WGM1_WGMXCC1_WGMXCCGn1
    SolutionIndex: 50
    SolutionNameMin: Cijk_Alik_Bjlk_I8BH_UserArgs_MT64x64x64_MI16x16x1_SN_CLR0_GSU0_GSUC0_GSUWGMRR0_K1_LBSPPA128_LBSPPB512_LPB32_MIWT2_2_PLR0_SU0_SUM0_SUS0_SKXCCM8_VWA2_VWB2_WGM1_WGMXCC1_WGMXCCGn1
    SolutionIndex: 51
    SolutionNameMin: Cijk_Alik_Bjlk_I8BH_UserArgs_MT64x64x64_MI16x16x1_SN_CLR1_GSU0_GSUC0_GSUWGMRR0_K1_LBSPPA128_LBSPPB512_LPB32_MIWT2_2_PLR1_SU0_SUM0_SUS0_SKXCCM8_VWA1_VWB2_WGM8_WGMXCC1_WGMXCCGn1
    SolutionIndex: 52
    SolutionNameMin: Cijk_Alik_Bjlk_I8BH_UserArgs_MT32x64x64_MI16x16x1_SN_CLR0_GSU0_GSUC0_GSUWGMRR0_K1_LBSPPA128_LBSPPB512_LPB16_MIWT1_2_PLR0_SU0_SUM0_SUS0_SKXCCM8_VWA1_VWB1_WGM8_WGMXCC1_WGMXCCGn1
    SolutionIndex: 53
    SolutionNameMin: Cijk_Alik_Bjlk_I8BH_UserArgs_MT64x32x64_MI16x16x1_SN_CLR1_GSU0_GSUC0_GSUWGMRR0_K1_LBSPPA128_LBSPPB256_LPB16_MIWT2_1_PLR1_SU0_SUM0_SUS0_SKXCCM8_VWA2_VWB1_WGM1_WGMXCC1_WGMXCCGn1
    SolutionIndex: 54
    SolutionNameMin: Cijk_Alik_Bjlk_I8BH_UserArgs_MT64x32x64_MI16x16x1_SN_CLR1_GSU0_GSUC0_GSUWGMRR0_K1_LBSPPA128_LBSPPB256_LPB16_MIWT2_1_PLR1_SU0_SUM0_SUS0_SKXCCM8_VWA2_VWB1_WGM1_WGMXCC1_WGMXCCGn1
    SolutionIndex: 55
    SolutionNameMin: Cijk_Alik_Bjlk_I8BH_UserArgs_MT64x32x64_MI16x16x1_SN_CLR1_GSU0_GSUC0_GSUWGMRR0_K1_LBSPPA128_LBSPPB256_LPB16_MIWT2_1_PLR1_SU0_SUM0_SUS0_SKXCCM8_VWA2_VWB1_WGM1_WGMXCC1_WGMXCCGn1
    SolutionIndex: 56
    SolutionNameMin: Cijk_Alik_Bjlk_I8BH_UserArgs_MT64x32x64_MI16x16x1_SN_CLR0_GSU0_GSUC0_GSUWGMRR0_K1_LBSPPA128_LBSPPB256_LPB16_MIWT2_1_PLR0_SU0_SUM0_SUS0_SKXCCM8_VWA1_VWB1_WGM1_WGMXCC1_WGMXCCGn1
    SolutionIndex: 57
    SolutionNameMin: Cijk_Alik_Bjlk_I8BH_UserArgs_MT32x32x64_MI16x16x1_SN_CLR1_GSU0_GSUC0_GSUWGMRR0_K1_LBSPPA128_LBSPPB256_LPB16_MIWT1_1_PLR1_SU0_SUM0_SUS0_SKXCCM8_VWA1_VWB1_WGM1_WGMXCC1_WGMXCCGn1
    SolutionIndex: 58
    SolutionNameMin: Cijk_Alik_Bjlk_I8BH_UserArgs_MT32x32x64_MI16x16x1_SN_CLR1_GSU0_GSUC0_GSUWGMRR0_K1_LBSPPA128_LBSPPB256_LPB16_MIWT1_1_PLR1_SU0_SUM0_SUS0_SKXCCM8_VWA1_VWB1_WGM1_WGMXCC1_WGMXCCGn1
    SolutionIndex: 59
    SolutionNameMin: Cijk_Alik_Bjlk_I8BH_UserArgs_MT32x32x64_MI16x16x1_SN_CLR1_GSU0_GSUC0_GSUWGMRR0_K1_LBSPPA128_LBSPPB256_LPB16_MIWT1_1_PLR1_SU0_SUM0_SUS0_SKXCCM8_VWA1_VWB1_WGM1_WGMXCC1_WGMXCCGn1
    SolutionIndex: 60
    SolutionNameMin: Cijk_Alik_Bjlk_I8BH_UserArgs_MT32x32x64_MI16x16x1_SN_CLR1_GSU0_GSUC0_GSUWGMRR0_K1_LBSPPA128_LBSPPB256_LPB16_MIWT1_1_PLR1_SU0_SUM0_SUS0_SKXCCM8_VWA1_VWB1_WGM1_WGMXCC1_WGMXCCGn1
    SolutionIndex: 61
    SolutionNameMin: Cijk_Alik_Bjlk_I8BH_UserArgs_MT32x32x64_MI16x16x1_SN_CLR0_GSU0_GSUC0_GSUWGMRR0_K1_LBSPPA128_LBSPPB256_LPB16_MIWT1_1_PLR0_SU0_SUM0_SUS0_SKXCCM8_VWA1_VWB1_WGM1_WGMXCC1_WGMXCCGn1
    SolutionIndex: 62
    SolutionNameMin: Cijk_Alik_Bjlk_I8BH_UserArgs_MT128x256x128_MI16x16x1_SN_CLR1_GSU0_GSUC0_GSUWGMRR0_K1_LBSPPA512_LBSPPB4096_LPB0_MIWT4_8_PLR1_SU0_SUM0_SUS0_SKXCCM8_VWA4_VWB8_WGM1_WGMXCC1_WGMXCCGn1
    SolutionIndex: 63
    SolutionNameMin: Cijk_Alik_Bjlk_I8BH_UserArgs_MT128x256x128_MI16x16x1_SN_CLR1_GSU0_GSUC0_GSUWGMRR0_K1_LBSPPA512_LBSPPB4096_LPB0_MIWT4_8_PLR1_SU0_SUM0_SUS0_SKXCCM8_VWA4_VWB8_WGM4_WGMXCC1_WGMXCCGn1
    SolutionIndex: 64
    SolutionNameMin: Cijk_Alik_Bjlk_I8BH_UserArgs_MT256x128x128_MI16x16x1_SN_CLR1_GSU0_GSUC0_GSUWGMRR0_K1_LBSPPA512_LBSPPB2048_LPB64_MIWT8_4_PLR1_SU0_SUM0_SUS0_SKXCCM8_VWA4_VWB4_WGM1_WGMXCC1_WGMXCCGn1
    SolutionIndex: 65
    SolutionNameMin: Cijk_Alik_Bjlk_I8BH_UserArgs_MT256x128x128_MI16x16x1_SN_CLR1_GSU0_GSUC0_GSUWGMRR0_K1_LBSPPA512_LBSPPB2048_LPB64_MIWT8_4_PLR1_SU0_SUM0_SUS0_SKXCCM8_VWA4_VWB4_WGM1_WGMXCC1_WGMXCCGn1
    SolutionIndex: 66
    SolutionNameMin: Cijk_Alik_Bjlk_I8BH_UserArgs_MT256x128x128_MI16x16x1_SN_CLR1_GSU0_GSUC0_GSUWGMRR0_K1_LBSPPA1024_LBSPPB2048_LPB32_MIWT8_4_PLR1_SU0_SUM0_SUS0_SKXCCM8_VWA8_VWB2_WGM1_WGMXCC1_WGMXCCGn1
    SolutionIndex: 67
    SolutionNameMin: Cijk_Alik_Bjlk_I8BH_UserArgs_MT256x128x128_MI16x16x1_SN_CLR1_GSU0_GSUC0_GSUWGMRR0_K1_LBSPPA512_LBSPPB2048_LPB64_MIWT8_4_PLR1_SU0_SUM0_SUS0_SKXCCM8_VWA4_VWB4_WGM1_WGMXCC1_WGMXCCGn1
    SolutionIndex: 68
    SolutionNameMin: Cijk_Alik_Bjlk_I8BH_UserArgs_MT256x128x128_MI16x16x1_SN_CLR1_GSU0_GSUC0_GSUWGMRR0_K1_LBSPPA512_LBSPPB2048_LPB64_MIWT8_4_PLR1_SU0_SUM0_SUS0_SKXCCM8_VWA4_VWB4_WGM4_WGMXCC1_WGMXCCGn1
    SolutionIndex: 69
    SolutionNameMin: Cijk_Alik_Bjlk_I8BH_UserArgs_MT256x128x128_MI16x16x1_SN_CLR1_GSU0_GSUC0_GSUWGMRR0_K1_LBSPPA512_LBSPPB2048_LPB64_MIWT8_4_PLR1_SU0_SUM0_SUS0_SKXCCM8_VWA4_VWB4_WGM4_WGMXCC1_WGMXCCGn1
    SolutionIndex: 70
    SolutionNameMin: Cijk_Alik_Bjlk_I8BH_UserArgs_MT256x128x128_MI16x16x1_SN_CLR1_GSU0_GSUC0_GSUWGMRR0_K1_LBSPPA512_LBSPPB2048_LPB64_MIWT8_4_PLR1_SU0_SUM0_SUS0_SKXCCM8_VWA4_VWB4_WGM8_WGMXCC1_WGMXCCGn1
    SolutionIndex: 71
    SolutionNameMin: Cijk_Alik_Bjlk_I8BH_UserArgs_MT256x128x128_MI16x16x1_SN_CLR1_GSU0_GSUC0_GSUWGMRR0_K1_LBSPPA512_LBSPPB2048_LPB64_MIWT8_4_PLR1_SU0_SUM0_SUS0_SKXCCM8_VWA4_VWB4_WGM8_WGMXCC1_WGMXCCGn1
    SolutionIndex: 72
    SolutionNameMin: Cijk_Alik_Bjlk_I8BH_UserArgs_MT256x128x128_MI16x16x1_SN_CLR1_GSU0_GSUC0_GSUWGMRR0_K1_LBSPPA1024_LBSPPB2048_LPB64_MIWT8_4_PLR1_SU0_SUM0_SUS0_SKXCCM8_VWA8_VWB4_WGM8_WGMXCC1_WGMXCCGn1
    SolutionIndex: 73
    SolutionNameMin: Cijk_Alik_Bjlk_I8BH_UserArgs_MT256x128x128_MI16x16x1_SN_CLR1_GSU0_GSUC0_GSUWGMRR0_K1_LBSPPA512_LBSPPB2048_LPB64_MIWT8_4_PLR2_SU0_SUM0_SUS0_SKXCCM8_VWA4_VWB4_WGM8_WGMXCC1_WGMXCCGn1
    SolutionIndex: 74
    SolutionNameMin: Cijk_Alik_Bjlk_I8BH_UserArgs_MT128x128x128_MI16x16x1_SN_CLR1_GSU0_GSUC0_GSUWGMRR0_K1_LBSPPA512_LBSPPB2048_LPB64_MIWT4_4_PLR1_SU0_SUM0_SUS0_SKXCCM8_VWA4_VWB4_WGM1_WGMXCC1_WGMXCCGn1
    SolutionIndex: 75
    SolutionNameMin: Cijk_Alik_Bjlk_I8BH_UserArgs_MT128x128x128_MI16x16x1_SN_CLR1_GSU0_GSUC0_GSUWGMRR0_K1_LBSPPA512_LBSPPB2048_LPB64_MIWT4_4_PLR1_SU0_SUM0_SUS0_SKXCCM8_VWA4_VWB4_WGM1_WGMXCC1_WGMXCCGn1
    SolutionIndex: 76
    SolutionNameMin: Cijk_Alik_Bjlk_I8BH_UserArgs_MT128x128x128_MI16x16x1_SN_CLR1_GSU0_GSUC0_GSUWGMRR0_K1_LBSPPA512_LBSPPB2048_LPB64_MIWT4_4_PLR2_SU0_SUM0_SUS0_SKXCCM8_VWA4_VWB4_WGM1_WGMXCC1_WGMXCCGn1
    SolutionIndex: 77
    SolutionNameMin: Cijk_Alik_Bjlk_I8BH_UserArgs_MT128x128x128_MI16x16x1_SN_CLR1_GSU0_GSUC0_GSUWGMRR0_K1_LBSPPA512_LBSPPB2048_LPB64_MIWT4_4_PLR1_SU0_SUM0_SUS0_SKXCCM8_VWA4_VWB4_WGM4_WGMXCC1_WGMXCCGn1
    SolutionIndex: 78
    SolutionNameMin: Cijk_Alik_Bjlk_I8BH_UserArgs_MT128x128x128_MI16x16x1_SN_CLR1_GSU0_GSUC0_GSUWGMRR0_K1_LBSPPA512_LBSPPB2048_LPB64_MIWT4_4_PLR1_SU0_SUM0_SUS0_SKXCCM8_VWA4_VWB4_WGM4_WGMXCC1_WGMXCCGn1
    SolutionIndex: 79
    SolutionNameMin: Cijk_Alik_Bjlk_I8BH_UserArgs_MT128x128x128_MI16x16x1_SN_CLR1_GSU0_GSUC0_GSUWGMRR0_K1_LBSPPA512_LBSPPB2048_LPB64_MIWT4_4_PLR2_SU0_SUM0_SUS0_SKXCCM8_VWA4_VWB4_WGM4_WGMXCC1_WGMXCCGn1
    SolutionIndex: 80
    SolutionNameMin: Cijk_Alik_Bjlk_I8BH_UserArgs_MT128x128x128_MI16x16x1_SN_CLR1_GSU0_GSUC0_GSUWGMRR0_K1_LBSPPA512_LBSPPB2048_LPB64_MIWT4_4_PLR1_SU0_SUM0_SUS0_SKXCCM8_VWA4_VWB4_WGM8_WGMXCC1_WGMXCCGn1
    SolutionIndex: 81
    SolutionNameMin: Cijk_Alik_Bjlk_I8BH_UserArgs_MT128x128x128_MI16x16x1_SN_CLR1_GSU0_GSUC0_GSUWGMRR0_K1_LBSPPA256_LBSPPB2048_LPB64_MIWT4_4_PLR1_SU0_SUM0_SUS0_SKXCCM8_VWA2_VWB4_WGM8_WGMXCC1_WGMXCCGn1
    SolutionIndex: 82
    SolutionNameMin: Cijk_Alik_Bjlk_I8BH_UserArgs_MT128x64x128_MI16x16x1_SN_CLR1_GSU0_GSUC0_GSUWGMRR0_K1_LBSPPA512_LBSPPB1024_LPB32_MIWT4_2_PLR1_SU0_SUM0_SUS0_SKXCCM8_VWA4_VWB2_WGM1_WGMXCC1_WGMXCCGn1
    SolutionIndex: 83
    SolutionNameMin: Cijk_Alik_Bjlk_I8BH_UserArgs_MT128x64x128_MI16x16x1_SN_CLR1_GSU0_GSUC0_GSUWGMRR0_K1_LBSPPA256_LBSPPB1024_LPB32_MIWT4_2_PLR1_SU0_SUM0_SUS0_SKXCCM8_VWA2_VWB2_WGM1_WGMXCC1_WGMXCCGn1
    SolutionIndex: 84
    SolutionNameMin: Cijk_Alik_Bjlk_I8BH_UserArgs_MT128x64x128_MI16x16x1_SN_CLR1_GSU0_GSUC0_GSUWGMRR0_K1_LBSPPA512_LBSPPB1024_LPB32_MIWT4_2_PLR1_SU0_SUM0_SUS0_SKXCCM8_VWA4_VWB2_WGM1_WGMXCC1_WGMXCCGn1
    SolutionIndex: 85
    SolutionNameMin: Cijk_Alik_Bjlk_I8BH_UserArgs_MT128x64x128_MI16x16x1_SN_CLR1_GSU0_GSUC0_GSUWGMRR0_K1_LBSPPA512_LBSPPB1024_LPB32_MIWT4_2_PLR2_SU0_SUM0_SUS0_SKXCCM8_VWA4_VWB2_WGM1_WGMXCC1_WGMXCCGn1
    SolutionIndex: 86
    SolutionNameMin: Cijk_Alik_Bjlk_I8BH_UserArgs_MT128x64x128_MI16x16x1_SN_CLR1_GSU0_GSUC0_GSUWGMRR0_K1_LBSPPA512_LBSPPB1024_LPB32_MIWT4_2_PLR1_SU0_SUM0_SUS0_SKXCCM8_VWA4_VWB2_WGM4_WGMXCC1_WGMXCCGn1
    SolutionIndex: 87
    SolutionNameMin: Cijk_Alik_Bjlk_I8BH_UserArgs_MT128x64x128_MI16x16x1_SN_CLR1_GSU0_GSUC0_GSUWGMRR0_K1_LBSPPA512_LBSPPB1024_LPB32_MIWT4_2_PLR1_SU0_SUM0_SUS0_SKXCCM8_VWA4_VWB2_WGM4_WGMXCC1_WGMXCCGn1
    SolutionIndex: 88
    SolutionNameMin: Cijk_Alik_Bjlk_I8BH_UserArgs_MT128x64x128_MI16x16x1_SN_CLR1_GSU0_GSUC0_GSUWGMRR0_K1_LBSPPA512_LBSPPB1024_LPB32_MIWT4_2_PLR2_SU0_SUM0_SUS0_SKXCCM8_VWA4_VWB2_WGM4_WGMXCC1_WGMXCCGn1
    SolutionIndex: 89
    SolutionNameMin: Cijk_Alik_Bjlk_I8BH_UserArgs_MT128x64x128_MI16x16x1_SN_CLR1_GSU0_GSUC0_GSUWGMRR0_K1_LBSPPA256_LBSPPB1024_LPB32_MIWT4_2_PLR1_SU0_SUM0_SUS0_SKXCCM8_VWA2_VWB2_WGM8_WGMXCC1_WGMXCCGn1
    SolutionIndex: 90
    SolutionNameMin: Cijk_Alik_Bjlk_I8BH_UserArgs_MT128x64x128_MI16x16x1_SN_CLR1_GSU0_GSUC0_GSUWGMRR0_K1_LBSPPA512_LBSPPB1024_LPB32_MIWT4_2_PLR1_SU0_SUM0_SUS0_SKXCCM8_VWA4_VWB2_WGM8_WGMXCC1_WGMXCCGn1
    SolutionIndex: 91
    SolutionNameMin: Cijk_Alik_Bjlk_I8BH_UserArgs_MT128x64x128_MI16x16x1_SN_CLR1_GSU0_GSUC0_GSUWGMRR0_K1_LBSPPA512_LBSPPB1024_LPB32_MIWT4_2_PLR2_SU0_SUM0_SUS0_SKXCCM8_VWA4_VWB2_WGM8_WGMXCC1_WGMXCCGn1
    SolutionIndex: 92
    SolutionNameMin: Cijk_Alik_Bjlk_I8BH_UserArgs_MT64x64x128_MI16x16x1_SN_CLR1_GSU0_GSUC0_GSUWGMRR0_K1_LBSPPA128_LBSPPB1024_LPB32_MIWT2_2_PLR1_SU0_SUM0_SUS0_SKXCCM8_VWA1_VWB2_WGM1_WGMXCC1_WGMXCCGn1
    SolutionIndex: 93
    SolutionNameMin: Cijk_Alik_Bjlk_I8BH_UserArgs_MT64x64x128_MI16x16x1_SN_CLR1_GSU0_GSUC0_GSUWGMRR0_K1_LBSPPA256_LBSPPB1024_LPB32_MIWT2_2_PLR1_SU0_SUM0_SUS0_SKXCCM8_VWA2_VWB2_WGM1_WGMXCC1_WGMXCCGn1
    SolutionIndex: 94
    SolutionNameMin: Cijk_Alik_Bjlk_I8BH_UserArgs_MT64x64x128_MI16x16x1_SN_CLR1_GSU0_GSUC0_GSUWGMRR0_K1_LBSPPA256_LBSPPB1024_LPB32_MIWT2_2_PLR1_SU0_SUM0_SUS0_SKXCCM8_VWA2_VWB2_WGM1_WGMXCC1_WGMXCCGn1
    SolutionIndex: 95
    SolutionNameMin: Cijk_Alik_Bjlk_I8BH_UserArgs_MT64x64x128_MI16x16x1_SN_CLR1_GSU0_GSUC0_GSUWGMRR0_K1_LBSPPA256_LBSPPB1024_LPB32_MIWT2_2_PLR1_SU0_SUM0_SUS0_SKXCCM8_VWA2_VWB2_WGM1_WGMXCC1_WGMXCCGn1
    SolutionIndex: 96
    SolutionNameMin: Cijk_Alik_Bjlk_I8BH_UserArgs_MT64x64x128_MI16x16x1_SN_CLR1_GSU0_GSUC0_GSUWGMRR0_K1_LBSPPA256_LBSPPB1024_LPB32_MIWT2_2_PLR2_SU0_SUM0_SUS0_SKXCCM8_VWA2_VWB2_WGM1_WGMXCC1_WGMXCCGn1
    SolutionIndex: 97
    SolutionNameMin: Cijk_Alik_Bjlk_I8BH_UserArgs_MT64x64x128_MI16x16x1_SN_CLR1_GSU0_GSUC0_GSUWGMRR0_K1_LBSPPA128_LBSPPB1024_LPB32_MIWT2_2_PLR1_SU0_SUM0_SUS0_SKXCCM8_VWA1_VWB2_WGM4_WGMXCC1_WGMXCCGn1
    SolutionIndex: 98
    SolutionNameMin: Cijk_Alik_Bjlk_I8BH_UserArgs_MT64x64x128_MI16x16x1_SN_CLR1_GSU0_GSUC0_GSUWGMRR0_K1_LBSPPA256_LBSPPB1024_LPB32_MIWT2_2_PLR1_SU0_SUM0_SUS0_SKXCCM8_VWA2_VWB2_WGM4_WGMXCC1_WGMXCCGn1
    SolutionIndex: 99
    SolutionNameMin: Cijk_Alik_Bjlk_I8BH_UserArgs_MT64x64x128_MI16x16x1_SN_CLR1_GSU0_GSUC0_GSUWGMRR0_K1_LBSPPA256_LBSPPB1024_LPB32_MIWT2_2_PLR1_SU0_SUM0_SUS0_SKXCCM8_VWA2_VWB2_WGM8_WGMXCC1_WGMXCCGn1
    SolutionIndex: 100
    SolutionNameMin: Cijk_Alik_Bjlk_I8BH_UserArgs_MT64x64x128_MI16x16x1_SN_CLR1_GSU0_GSUC0_GSUWGMRR0_K1_LBSPPA256_LBSPPB1024_LPB32_MIWT2_2_PLR1_SU0_SUM0_SUS0_SKXCCM8_VWA2_VWB2_WGM8_WGMXCC1_WGMXCCGn1
    SolutionIndex: 101
    SolutionNameMin: Cijk_Alik_Bjlk_I8BH_UserArgs_MT32x64x128_MI16x16x1_SN_CLR1_GSU0_GSUC0_GSUWGMRR0_K1_LBSPPA128_LBSPPB1024_LPB32_MIWT1_2_PLR1_SU0_SUM0_SUS0_SKXCCM8_VWA1_VWB2_WGM1_WGMXCC1_WGMXCCGn1
    SolutionIndex: 102
    SolutionNameMin: Cijk_Alik_Bjlk_I8BH_UserArgs_MT64x32x128_MI16x16x1_SN_CLR1_GSU0_GSUC0_GSUWGMRR0_K1_LBSPPA256_LBSPPB512_LPB16_MIWT2_1_PLR1_SU0_SUM0_SUS0_SKXCCM8_VWA2_VWB1_WGM1_WGMXCC1_WGMXCCGn1
    SolutionIndex: 103
    SolutionNameMin: Cijk_Alik_Bjlk_I8BH_UserArgs_MT64x32x128_MI16x16x1_SN_CLR1_GSU0_GSUC0_GSUWGMRR0_K1_LBSPPA256_LBSPPB512_LPB16_MIWT2_1_PLR1_SU0_SUM0_SUS0_SKXCCM8_VWA2_VWB1_WGM1_WGMXCC1_WGMXCCGn1
    SolutionIndex: 104
    SolutionNameMin: Cijk_Alik_Bjlk_I8BH_UserArgs_MT64x32x128_MI16x16x1_SN_CLR1_GSU0_GSUC0_GSUWGMRR0_K1_LBSPPA256_LBSPPB512_LPB16_MIWT2_1_PLR1_SU0_SUM0_SUS0_SKXCCM8_VWA2_VWB1_WGM1_WGMXCC1_WGMXCCGn1
    SolutionIndex: 105
    SolutionNameMin: Cijk_Alik_Bjlk_I8BH_UserArgs_MT64x32x128_MI16x16x1_SN_CLR1_GSU0_GSUC0_GSUWGMRR0_K1_LBSPPA256_LBSPPB512_LPB16_MIWT2_1_PLR1_SU0_SUM0_SUS0_SKXCCM8_VWA2_VWB1_WGM1_WGMXCC1_WGMXCCGn1
    SolutionIndex: 106
    SolutionNameMin: Cijk_Alik_Bjlk_I8BH_UserArgs_MT64x32x128_MI16x16x1_SN_CLR1_GSU0_GSUC0_GSUWGMRR0_K1_LBSPPA128_LBSPPB512_LPB16_MIWT2_1_PLR1_SU0_SUM0_SUS0_SKXCCM8_VWA1_VWB1_WGM1_WGMXCC1_WGMXCCGn1
    SolutionIndex: 107
    SolutionNameMin: Cijk_Alik_Bjlk_I8BH_UserArgs_MT64x32x128_MI16x16x1_SN_CLR1_GSU0_GSUC0_GSUWGMRR0_K1_LBSPPA256_LBSPPB512_LPB16_MIWT2_1_PLR1_SU0_SUM0_SUS0_SKXCCM8_VWA2_VWB1_WGM1_WGMXCC1_WGMXCCGn1
    SolutionIndex: 108
    SolutionNameMin: Cijk_Alik_Bjlk_I8BH_UserArgs_MT64x32x128_MI16x16x1_SN_CLR1_GSU0_GSUC0_GSUWGMRR0_K1_LBSPPA128_LBSPPB512_LPB16_MIWT2_1_PLR1_SU0_SUM0_SUS0_SKXCCM8_VWA1_VWB1_WGM4_WGMXCC1_WGMXCCGn1
    SolutionIndex: 109
    SolutionNameMin: Cijk_Alik_Bjlk_I8BH_UserArgs_MT64x32x128_MI16x16x1_SN_CLR1_GSU0_GSUC0_GSUWGMRR0_K1_LBSPPA256_LBSPPB512_LPB16_MIWT2_1_PLR1_SU0_SUM0_SUS0_SKXCCM8_VWA2_VWB1_WGM4_WGMXCC1_WGMXCCGn1
    SolutionIndex: 110
    SolutionNameMin: Cijk_Alik_Bjlk_I8BH_UserArgs_MT32x32x128_MI16x16x1_SN_CLR1_GSU0_GSUC0_GSUWGMRR0_K1_LBSPPA128_LBSPPB512_LPB16_MIWT1_1_PLR1_SU0_SUM0_SUS0_SKXCCM8_VWA1_VWB1_WGM1_WGMXCC1_WGMXCCGn1
    SolutionIndex: 111
    SolutionNameMin: Cijk_Alik_Bjlk_I8BH_UserArgs_MT32x32x128_MI16x16x1_SN_CLR1_GSU0_GSUC0_GSUWGMRR0_K1_LBSPPA128_LBSPPB512_LPB16_MIWT1_1_PLR1_SU0_SUM0_SUS0_SKXCCM8_VWA1_VWB1_WGM1_WGMXCC1_WGMXCCGn1
    SolutionIndex: 112
    SolutionNameMin: Cijk_Alik_Bjlk_I8BH_UserArgs_MT32x32x128_MI16x16x1_SN_CLR1_GSU0_GSUC0_GSUWGMRR0_K1_LBSPPA128_LBSPPB512_LPB16_MIWT1_1_PLR1_SU0_SUM0_SUS0_SKXCCM8_VWA1_VWB1_WGM1_WGMXCC1_WGMXCCGn1
    SolutionIndex: 113
    SolutionNameMin: Cijk_Alik_Bjlk_I8BH_UserArgs_MT32x32x128_MI16x16x1_SN_CLR1_GSU0_GSUC0_GSUWGMRR0_K1_LBSPPA128_LBSPPB512_LPB16_MIWT1_1_PLR1_SU0_SUM0_SUS0_SKXCCM8_VWA1_VWB1_WGM1_WGMXCC1_WGMXCCGn1
    SolutionIndex: 114
    SolutionNameMin: Cijk_Alik_Bjlk_I8BH_UserArgs_MT32x32x128_MI16x16x1_SN_CLR1_GSU0_GSUC0_GSUWGMRR0_K1_LBSPPA128_LBSPPB512_LPB16_MIWT1_1_PLR1_SU0_SUM0_SUS0_SKXCCM8_VWA1_VWB1_WGM1_WGMXCC1_WGMXCCGn1
    SolutionIndex: 115
    SolutionNameMin: Cijk_Alik_Bjlk_I8BH_UserArgs_MT32x32x128_MI16x16x1_SN_CLR1_GSU0_GSUC0_GSUWGMRR0_K1_LBSPPA128_LBSPPB512_LPB16_MIWT1_1_PLR1_SU0_SUM0_SUS0_SKXCCM8_VWA1_VWB1_WGM1_WGMXCC1_WGMXCCGn1
    SolutionIndex: 116
    SolutionNameMin: Cijk_Alik_Bjlk_I8BH_UserArgs_MT32x32x128_MI16x16x1_SN_CLR1_GSU0_GSUC0_GSUWGMRR0_K1_LBSPPA128_LBSPPB512_LPB16_MIWT1_1_PLR1_SU0_SUM0_SUS0_SKXCCM8_VWA1_VWB1_WGM1_WGMXCC1_WGMXCCGn1
    SolutionIndex: 117
    SolutionNameMin: Cijk_Alik_Bjlk_I8BH_UserArgs_MT32x32x128_MI16x16x1_SN_CLR1_GSU0_GSUC0_GSUWGMRR0_K1_LBSPPA128_LBSPPB512_LPB16_MIWT1_1_PLR2_SU0_SUM0_SUS0_SKXCCM8_VWA1_VWB1_WGM1_WGMXCC1_WGMXCCGn1
    SolutionIndex: 118
    SolutionNameMin: Cijk_Alik_Bjlk_I8BH_UserArgs_MT128x64x256_MI16x16x1_SN_CLR1_GSU0_GSUC0_GSUWGMRR0_K1_LBSPPA1024_LBSPPB1024_LPB32_MIWT4_2_PLR2_SU0_SUM0_SUS0_SKXCCM8_VWA4_VWB2_WGM4_WGMXCC1_WGMXCCGn1
    SolutionIndex: 119
    SolutionNameMin: Cijk_Alik_Bjlk_I8BH_UserArgs_MT64x64x256_MI16x16x1_SN_CLR1_GSU0_GSUC0_GSUWGMRR0_K1_LBSPPA512_LBSPPB1024_LPB32_MIWT2_2_PLR2_SU0_SUM0_SUS0_SKXCCM8_VWA2_VWB2_WGM4_WGMXCC1_WGMXCCGn1
    SolutionIndex: 120
    SolutionNameMin: Cijk_Alik_Bjlk_I8BH_UserArgs_MT64x64x256_MI16x16x1_SN_CLR1_GSU0_GSUC0_GSUWGMRR0_K1_LBSPPA256_LBSPPB1024_LPB32_MIWT2_2_PLR2_SU0_SUM0_SUS0_SKXCCM8_VWA1_VWB2_WGM8_WGMXCC1_WGMXCCGn1
    SolutionIndex: 121
    SolutionNameMin: Cijk_Alik_Bjlk_I8BH_UserArgs_MT32x64x256_MI16x16x1_SN_CLR1_GSU0_GSUC0_GSUWGMRR0_K1_LBSPPA256_LBSPPB1024_LPB32_MIWT1_2_PLR1_SU0_SUM0_SUS0_SKXCCM8_VWA1_VWB2_WGM1_WGMXCC1_WGMXCCGn1
    SolutionIndex: 122
    SolutionNameMin: Cijk_Alik_Bjlk_I8BH_UserArgs_MT64x32x256_MI16x16x1_SN_CLR1_GSU0_GSUC0_GSUWGMRR0_K1_LBSPPA256_LBSPPB512_LPB16_MIWT2_1_PLR2_SU0_SUM0_SUS0_SKXCCM8_VWA1_VWB1_WGM1_WGMXCC1_WGMXCCGn1
    SolutionIndex: 123
    SolutionNameMin: Cijk_Alik_Bjlk_I8BH_UserArgs_MT64x32x256_MI16x16x1_SN_CLR1_GSU0_GSUC0_GSUWGMRR0_K1_LBSPPA512_LBSPPB512_LPB16_MIWT2_1_PLR2_SU0_SUM0_SUS0_SKXCCM8_VWA2_VWB1_WGM1_WGMXCC1_WGMXCCGn1
    SolutionIndex: 124
    SolutionNameMin: Cijk_Alik_Bjlk_I8BH_UserArgs_MT64x32x256_MI16x16x1_SN_CLR1_GSU0_GSUC0_GSUWGMRR0_K1_LBSPPA256_LBSPPB512_LPB16_MIWT2_1_PLR2_SU0_SUM0_SUS0_SKXCCM8_VWA1_VWB1_WGM4_WGMXCC1_WGMXCCGn1
    SolutionIndex: 125
    SolutionNameMin: Cijk_Alik_Bjlk_I8BH_UserArgs_MT64x32x256_MI16x16x1_SN_CLR1_GSU0_GSUC0_GSUWGMRR0_K1_LBSPPA512_LBSPPB512_LPB16_MIWT2_1_PLR2_SU0_SUM0_SUS0_SKXCCM8_VWA2_VWB1_WGM4_WGMXCC1_WGMXCCGn1
    SolutionIndex: 126
    SolutionNameMin: Cijk_Alik_Bjlk_I8BH_UserArgs_MT64x32x256_MI16x16x1_SN_CLR1_GSU0_GSUC0_GSUWGMRR0_K1_LBSPPA256_LBSPPB512_LPB16_MIWT2_1_PLR2_SU0_SUM0_SUS0_SKXCCM8_VWA1_VWB1_WGM8_WGMXCC1_WGMXCCGn1
    SolutionIndex: 127
    SolutionNameMin: Cijk_Alik_Bjlk_I8BH_UserArgs_MT64x32x256_MI16x16x1_SN_CLR1_GSU0_GSUC0_GSUWGMRR0_K1_LBSPPA512_LBSPPB512_LPB16_MIWT2_1_PLR2_SU0_SUM0_SUS0_SKXCCM8_VWA2_VWB1_WGM8_WGMXCC1_WGMXCCGn1
    SolutionIndex: 128
    SolutionNameMin: Cijk_Alik_Bjlk_I8BH_UserArgs_MT32x32x256_MI16x16x1_SN_CLR1_GSU0_GSUC0_GSUWGMRR0_K1_LBSPPA256_LBSPPB512_LPB16_MIWT1_1_PLR1_SU0_SUM0_SUS0_SKXCCM8_VWA1_VWB1_WGM1_WGMXCC1_WGMXCCGn1
    SolutionIndex: 129
    SolutionNameMin: Cijk_Alik_Bjlk_I8BH_UserArgs_MT32x32x256_MI16x16x1_SN_CLR1_GSU0_GSUC0_GSUWGMRR0_K1_LBSPPA256_LBSPPB512_LPB16_MIWT1_1_PLR1_SU0_SUM0_SUS0_SKXCCM8_VWA1_VWB1_WGM1_WGMXCC1_WGMXCCGn1
    SolutionIndex: 130
    SolutionNameMin: Cijk_Alik_Bjlk_I8BH_UserArgs_MT32x32x256_MI16x16x1_SN_CLR1_GSU0_GSUC0_GSUWGMRR0_K1_LBSPPA256_LBSPPB512_LPB16_MIWT1_1_PLR2_SU0_SUM0_SUS0_SKXCCM8_VWA1_VWB1_WGM1_WGMXCC1_WGMXCCGn1
    SolutionIndex: 131
    SolutionNameMin: Cijk_Alik_Bjlk_I8BH_UserArgs_MT32x32x32_MI16x16x1_SN_CLR0_GSU0_GSUC0_GSUWGMRR0_K1_LBSPPA128_LBSPPB256_LPB16_MIWT1_1_PLR0_SU32_SUM0_SUS256_SKXCCM8_VWA1_VWB1_WGM1_WGMXCC1_WGMXCCGn1
- - - [128, 128, 1, 128, 128, 128, 128, 128]
    - [57, 0.56]
  - - [128, 128, 1, 256, 128, 128, 256, 128]
    - [57, 1.01]
  - - [128, 128, 1, 512, 128, 128, 512, 128]
    - [116, 1.72]
  - - [128, 128, 1, 1024, 128, 128, 1024, 128]
    - [116, 2.69]
  - - [128, 128, 1, 2048, 128, 128, 2048, 128]
    - [113, 3.83]
  - - [128, 128, 1, 4096, 128, 128, 4096, 128]
    - [60, 6.79]
  - - [128, 128, 1, 8192, 128, 128, 8192, 128]
    - [116, 10.91]
  - - [128, 256, 1, 128, 128, 128, 128, 256]
    - [58, 1.13]
  - - [128, 256, 1, 256, 128, 128, 256, 256]
    - [60, 2.02]
  - - [128, 256, 1, 512, 128, 128, 512, 256]
    - [115, 3.45]
  - - [128, 256, 1, 1024, 128, 128, 1024, 256]
    - [116, 5.39]
  - - [128, 256, 1, 2048, 128, 128, 2048, 256]
    - [116, 7.79]
  - - [128, 256, 1, 4096, 128, 128, 4096, 256]
    - [60, 13.2]
  - - [128, 256, 1, 8192, 128, 128, 8192, 256]
    - [116, 21.12]
  - - [128, 512, 1, 128, 128, 128, 128, 512]
    - [112, 2.09]
  - - [128, 512, 1, 256, 128, 128, 256, 512]
    - [113, 3.94]
  - - [128, 512, 1, 512, 128, 128, 512, 512]
    - [113, 6.88]
  - - [128, 512, 1, 1024, 128, 128, 1024, 512]
    - [128, 10.32]
  - - [128, 512, 1, 2048, 128, 128, 2048, 512]
    - [116, 15.16]
  - - [128, 512, 1, 4096, 128, 128, 4096, 512]
    - [60, 25.35]
  - - [128, 512, 1, 8192, 128, 128, 8192, 512]
    - [115, 40.79]
  - - [128, 1024, 1, 128, 128, 128, 128, 1024]
    - [113, 4.25]
  - - [128, 1024, 1, 256, 128, 128, 256, 1024]
    - [59, 7.81]
  - - [128, 1024, 1, 512, 128, 128, 512, 1024]
    - [113, 13.43]
  - - [128, 1024, 1, 1024, 128, 128, 1024, 1024]
    - [116, 20.86]
  - - [128, 1024, 1, 2048, 128, 128, 2048, 1024]
    - [130, 28.94]
  - - [128, 1024, 1, 4096, 128, 128, 4096, 1024]
    - [130, 43.89]
  - - [128, 1024, 1, 8192, 128, 128, 8192, 1024]
    - [103, 65.18]
  - - [128, 2048, 1, 128, 128, 128, 128, 2048]
    - [113, 8.2]
  - - [128, 2048, 1, 256, 128, 128, 256, 2048]
    - [114, 15.02]
  - - [128, 2048, 1, 512, 128, 128, 512, 2048]
    - [114, 25.65]
  - - [128, 2048, 1, 1024, 128, 128, 1024, 2048]
    - [116, 39.87]
  - - [128, 2048, 1, 2048, 128, 128, 2048, 2048]
    - [130, 46.3]
  - - [128, 2048, 1, 4096, 128, 128, 4096, 2048]
    - [51, 69.78]
  - - [128, 2048, 1, 8192, 128, 128, 8192, 2048]
    - [93, 109.31]
  - - [128, 4096, 1, 128, 128, 128, 128, 4096]
    - [102, 15.49]
  - - [128, 4096, 1, 256, 128, 128, 256, 4096]
    - [101, 27.63]
  - - [128, 4096, 1, 512, 128, 128, 512, 4096]
    - [105, 45.51]
  - - [128, 4096, 1, 1024, 128, 128, 1024, 4096]
    - [105, 72.5]
  - - [128, 4096, 1, 2048, 128, 128, 2048, 4096]
    - [105, 85.41]
  - - [128, 4096, 1, 4096, 128, 128, 4096, 4096]
    - [93, 122.2]
  - - [128, 4096, 1, 8192, 128, 128, 8192, 4096]
    - [82, 157.79]
  - - [128, 8192, 1, 128, 128, 128, 128, 8192]
    - [94, 28.81]
  - - [128, 8192, 1, 256, 128, 128, 256, 8192]
    - [49, 51.13]
  - - [128, 8192, 1, 512, 128, 128, 512, 8192]
    - [93, 84.66]
  - - [128, 8192, 1, 1024, 128, 128, 1024, 8192]
    - [95, 124.86]
  - - [128, 8192, 1, 2048, 128, 128, 2048, 8192]
    - [94, 147.7]
  - - [128, 8192, 1, 4096, 128, 128, 4096, 8192]
    - [84, 172.22]
  - - [128, 8192, 1, 8192, 128, 128, 8192, 8192]
    - [74, 215.93]
  - - [256, 128, 1, 128, 256, 256, 128, 128]
    - [117, 1.04]
  - - [256, 128, 1, 256, 256, 256, 256, 128]
    - [12, 1.88]
  - - [256, 128, 1, 512, 256, 256, 512, 128]
    - [113, 3.39]
  - - [256, 128, 1, 1024, 256, 256, 1024, 128]
    - [116, 5.22]
  - - [256, 128, 1, 2048, 256, 256, 2048, 128]
    - [116, 7.66]
  - - [256, 128, 1, 4096, 256, 256, 4096, 128]
    - [61, 12.92]
  - - [256, 128, 1, 8192, 256, 256, 8192, 128]
    - [115, 20.72]
  - - [256, 256, 1, 128, 256, 256, 128, 256]
    - [111, 2.12]
  - - [256, 256, 1, 256, 256, 256, 256, 256]
    - [129, 3.64]
  - - [256, 256, 1, 512, 256, 256, 512, 256]
    - [115, 6.61]
  - - [256, 256, 1, 1024, 256, 256, 1024, 256]
    - [116, 10.45]
  - - [256, 256, 1, 2048, 256, 256, 2048, 256]
    - [116, 14.89]
  - - [256, 256, 1, 4096, 256, 256, 4096, 256]
    - [61, 25.32]
  - - [256, 256, 1, 8192, 256, 256, 8192, 256]
    - [116, 40.56]
  - - [256, 512, 1, 128, 256, 256, 128, 512]
    - [52, 3.74]
  - - [256, 512, 1, 256, 256, 256, 256, 512]
    - [121, 7.03]
  - - [256, 512, 1, 512, 256, 256, 512, 512]
    - [116, 13.39]
  - - [256, 512, 1, 1024, 256, 256, 1024, 512]
    - [116, 20.93]
  - - [256, 512, 1, 2048, 256, 256, 2048, 512]
    - [116, 28.53]
  - - [256, 512, 1, 4096, 256, 256, 4096, 512]
    - [130, 43.74]
  - - [256, 512, 1, 8192, 256, 256, 8192, 512]
    - [108, 69.77]
  - - [256, 1024, 1, 128, 256, 256, 128, 1024]
    - [10, 7.75]
  - - [256, 1024, 1, 256, 256, 256, 256, 1024]
    - [58, 15.05]
  - - [256, 1024, 1, 512, 256, 256, 512, 1024]
    - [114, 25.87]
  - - [256, 1024, 1, 1024, 256, 256, 1024, 1024]
    - [116, 37.45]
  - - [256, 1024, 1, 2048, 256, 256, 2048, 1024]
    - [116, 56.1]
  - - [256, 1024, 1, 4096, 256, 256, 4096, 1024]
    - [105, 77.82]
  - - [256, 1024, 1, 8192, 256, 256, 8192, 1024]
    - [95, 109.46]
  - - [256, 2048, 1, 128, 256, 256, 128, 2048]
    - [56, 14.92]
  - - [256, 2048, 1, 256, 256, 256, 256, 2048]
    - [104, 27.29]
  - - [256, 2048, 1, 512, 256, 256, 512, 2048]
    - [105, 47.06]
  - - [256, 2048, 1, 1024, 256, 256, 1024, 2048]
    - [103, 72.89]
  - - [256, 2048, 1, 2048, 256, 256, 2048, 2048]
    - [106, 89.97]
  - - [256, 2048, 1, 4096, 256, 256, 4096, 2048]
    - [92, 122.6]
  - - [256, 2048, 1, 8192, 256, 256, 8192, 2048]
    - [82, 161.04]
  - - [256, 4096, 1, 128, 256, 256, 128, 4096]
    - [96, 28.33]
  - - [256, 4096, 1, 256, 256, 256, 256, 4096]
    - [50, 49.35]
  - - [256, 4096, 1, 512, 256, 256, 512, 4096]
    - [93, 82.25]
  - - [256, 4096, 1, 1024, 256, 256, 1024, 4096]
    - [95, 125.38]
  - - [256, 4096, 1, 2048, 256, 256, 2048, 4096]
    - [93, 150.87]
  - - [256, 4096, 1, 4096, 256, 256, 4096, 4096]
    - [82, 179.27]
  - - [256, 4096, 1, 8192, 256, 256, 8192, 4096]
    - [80, 215.65]
  - - [256, 8192, 1, 128, 256, 256, 128, 8192]
    - [8, 48.45]
  - - [256, 8192, 1, 256, 256, 256, 256, 8192]
    - [45, 85.84]
  - - [256, 8192, 1, 512, 256, 256, 512, 8192]
    - [45, 139.07]
  - - [256, 8192, 1, 1024, 256, 256, 1024, 8192]
    - [84, 197.63]
  - - [256, 8192, 1, 2048, 256, 256, 2048, 8192]
    - [84, 210.2]
  - - [256, 8192, 1, 4096, 256, 256, 4096, 8192]
    - [77, 240.28]
  - - [256, 8192, 1, 8192, 256, 256, 8192, 8192]
    - [65, 272.98]
  - - [512, 128, 1, 128, 512, 512, 128, 128]
    - [110, 2.11]
  - - [512, 128, 1, 256, 512, 512, 256, 128]
    - [59, 3.95]
  - - [512, 128, 1, 512, 512, 512, 512, 128]
    - [116, 6.8]
  - - [512, 128, 1, 1024, 512, 512, 1024, 128]
    - [128, 10.32]
  - - [512, 128, 1, 2048, 512, 512, 2048, 128]
    - [116, 15.06]
  - - [512, 128, 1, 4096, 512, 512, 4096, 128]
    - [60, 25.41]
  - - [512, 128, 1, 8192, 512, 512, 8192, 128]
    - [116, 40.96]
  - - [512, 256, 1, 128, 512, 512, 128, 256]
    - [110, 4.17]
  - - [512, 256, 1, 256, 512, 512, 256, 256]
    - [116, 7.86]
  - - [512, 256, 1, 512, 512, 512, 512, 256]
    - [113, 13.54]
  - - [512, 256, 1, 1024, 512, 512, 1024, 256]
    - [116, 21.22]
  - - [512, 256, 1, 2048, 512, 512, 2048, 256]
    - [130, 29.25]
  - - [512, 256, 1, 4096, 512, 512, 4096, 256]
    - [130, 43.95]
  - - [512, 256, 1, 8192, 512, 512, 8192, 256]
    - [109, 70.18]
  - - [512, 512, 1, 128, 512, 512, 128, 512]
    - [58, 8.18]
  - - [512, 512, 1, 256, 512, 512, 256, 512]
    - [59, 15.12]
  - - [512, 512, 1, 512, 512, 512, 512, 512]
    - [116, 25.49]
  - - [512, 512, 1, 1024, 512, 512, 1024, 512]
    - [116, 40.59]
  - - [512, 512, 1, 2048, 512, 512, 2048, 512]
    - [116, 56.58]
  - - [512, 512, 1, 4096, 512, 512, 4096, 512]
    - [122, 80.3]
  - - [512, 512, 1, 8192, 512, 512, 8192, 512]
    - [98, 110.77]
  - - [512, 1024, 1, 128, 512, 512, 128, 1024]
    - [104, 15.68]
  - - [512, 1024, 1, 256, 512, 512, 256, 1024]
    - [107, 27.93]
  - - [512, 1024, 1, 512, 512, 512, 512, 1024]
    - [107, 47.38]
  - - [512, 1024, 1, 1024, 512, 512, 1024, 1024]
    - [107, 73.57]
  - - [512, 1024, 1, 2048, 512, 512, 2048, 1024]
    - [123, 101.69]
  - - [512, 1024, 1, 4096, 512, 512, 4096, 1024]
    - [123, 125.76]
  - - [512, 1024, 1, 8192, 512, 512, 8192, 1024]
    - [84, 165.52]
  - - [512, 2048, 1, 128, 512, 512, 128, 2048]
    - [94, 28.48]
  - - [512, 2048, 1, 256, 512, 512, 256, 2048]
    - [48, 50.23]
  - - [512, 2048, 1, 512, 512, 512, 512, 2048]
    - [93, 83.2]
  - - [512, 2048, 1, 1024, 512, 512, 1024, 2048]
    - [95, 125.82]
  - - [512, 2048, 1, 2048, 512, 512, 2048, 2048]
    - [93, 151.87]
  - - [512, 2048, 1, 4096, 512, 512, 4096, 2048]
    - [86, 183.36]
  - - [512, 2048, 1, 8192, 512, 512, 8192, 2048]
    - [74, 232.84]
  - - [512, 4096, 1, 128, 512, 512, 128, 4096]
    - [82, 48.97]
  - - [512, 4096, 1, 256, 512, 512, 256, 4096]
    - [42, 85.86]
  - - [512, 4096, 1, 512, 512, 512, 512, 4096]
    - [42, 138.78]
  - - [512, 4096, 1, 1024, 512, 512, 1024, 4096]
    - [84, 198.19]
  - - [512, 4096, 1, 2048, 512, 512, 2048, 4096]
    - [84, 217.71]
  - - [512, 4096, 1, 4096, 512, 512, 4096, 4096]
    - [74, 244.95]
  - - [512, 4096, 1, 8192, 512, 512, 8192, 4096]
    - [69, 282.06]
  - - [512, 8192, 1, 128, 512, 512, 128, 8192]
    - [7, 76.91]
  - - [512, 8192, 1, 256, 512, 512, 256, 8192]
    - [40, 133.42]
  - - [512, 8192, 1, 512, 512, 512, 512, 8192]
    - [75, 204.32]
  - - [512, 8192, 1, 1024, 512, 512, 1024, 8192]
    - [74, 262.9]
  - - [512, 8192, 1, 2048, 512, 512, 2048, 8192]
    - [78, 290.18]
  - - [512, 8192, 1, 4096, 512, 512, 4096, 8192]
    - [74, 331.97]
  - - [512, 8192, 1, 8192, 512, 512, 8192, 8192]
    - [64, 341.15]
  - - [1024, 128, 1, 128, 1024, 1024, 128, 128]
    - [58, 4.18]
  - - [1024, 128, 1, 256, 1024, 1024, 256, 128]
    - [58, 7.84]
  - - [1024, 128, 1, 512, 1024, 1024, 512, 128]
    - [116, 13.37]
  - - [1024, 128, 1, 1024, 1024, 1024, 1024, 128]
    - [116, 20.94]
  - - [1024, 128, 1, 2048, 1024, 1024, 2048, 128]
    - [130, 28.87]
  - - [1024, 128, 1, 4096, 1024, 1024, 4096, 128]
    - [55, 43.74]
  - - [1024, 128, 1, 8192, 1024, 1024, 8192, 128]
    - [109, 69.54]
  - - [1024, 256, 1, 128, 1024, 1024, 128, 256]
    - [113, 8.26]
  - - [1024, 256, 1, 256, 1024, 1024, 256, 256]
    - [113, 15.14]
  - - [1024, 256, 1, 512, 1024, 1024, 512, 256]
    - [114, 25.92]
  - - [1024, 256, 1, 1024, 1024, 1024, 1024, 256]
    - [116, 40.85]
  - - [1024, 256, 1, 2048, 1024, 1024, 2048, 256]
    - [116, 56.69]
  - - [1024, 256, 1, 4096, 1024, 1024, 4096, 256]
    - [125, 79.33]
  - - [1024, 256, 1, 8192, 1024, 1024, 8192, 256]
    - [97, 112.76]
  - - [1024, 512, 1, 128, 1024, 1024, 128, 512]
    - [104, 15.88]
  - - [1024, 512, 1, 256, 1024, 1024, 256, 512]
    - [104, 28.07]
  - - [1024, 512, 1, 512, 1024, 1024, 512, 512]
    - [107, 47.57]
  - - [1024, 512, 1, 1024, 1024, 1024, 1024, 512]
    - [105, 73.44]
  - - [1024, 512, 1, 2048, 1024, 1024, 2048, 512]
    - [123, 99.66]
  - - [1024, 512, 1, 4096, 1024, 1024, 4096, 512]
    - [119, 133.71]
  - - [1024, 512, 1, 8192, 1024, 1024, 8192, 512]
    - [86, 165.7]
  - - [1024, 1024, 1, 128, 1024, 1024, 128, 1024]
    - [94, 28.68]
  - - [1024, 1024, 1, 256, 1024, 1024, 256, 1024]
    - [93, 50.85]
  - - [1024, 1024, 1, 512, 1024, 1024, 512, 1024]
    - [93, 84.02]
  - - [1024, 1024, 1, 1024, 1024, 1024, 1024, 1024]
    - [95, 127.59]
  - - [1024, 1024, 1, 2048, 1024, 1024, 2048, 1024]
    - [95, 169.5]
  - - [1024, 1024, 1, 4096, 1024, 1024, 4096, 1024]
    - [87, 180.13]
  - - [1024, 1024, 1, 8192, 1024, 1024, 8192, 1024]
    - [80, 221.41]
  - - [1024, 2048, 1, 128, 1024, 1024, 128, 2048]
    - [85, 48.88]
  - - [1024, 2048, 1, 256, 1024, 1024, 256, 2048]
    - [42, 83.6]
  - - [1024, 2048, 1, 512, 1024, 1024, 512, 2048]
    - [42, 138.54]
  - - [1024, 2048, 1, 1024, 1024, 1024, 1024, 2048]
    - [83, 194.31]
  - - [1024, 2048, 1, 2048, 1024, 1024, 2048, 2048]
    - [86, 224.03]
  - - [1024, 2048, 1, 4096, 1024, 1024, 4096, 2048]
    - [90, 243.57]
  - - [1024, 2048, 1, 8192, 1024, 1024, 8192, 2048]
    - [69, 279.9]
  - - [1024, 4096, 1, 128, 1024, 1024, 128, 4096]
    - [7, 76.9]
  - - [1024, 4096, 1, 256, 1024, 1024, 256, 4096]
    - [40, 133.01]
  - - [1024, 4096, 1, 512, 1024, 1024, 512, 4096]
    - [74, 204.3]
  - - [1024, 4096, 1, 1024, 1024, 1024, 1024, 4096]
    - [76, 265.01]
  - - [1024, 4096, 1, 2048, 1024, 1024, 2048, 4096]
    - [74, 297.29]
  - - [1024, 4096, 1, 4096, 1024, 1024, 4096, 4096]
    - [81, 326.86]
  - - [1024, 4096, 1, 8192, 1024, 1024, 8192, 4096]
    - [71, 336.92]
  - - [1024, 8192, 1, 128, 1024, 1024, 128, 8192]
    - [5, 108.87]
  - - [1024, 8192, 1, 256, 1024, 1024, 256, 8192]
    - [4, 178.37]
  - - [1024, 8192, 1, 512, 1024, 1024, 512, 8192]
    - [32, 258.8]
  - - [1024, 8192, 1, 1024, 1024, 1024, 1024, 8192]
    - [35, 320.0]
  - - [1024, 8192, 1, 2048, 1024, 1024, 2048, 8192]
    - [67, 373.41]
  - - [1024, 8192, 1, 4096, 1024, 1024, 4096, 8192]
    - [72, 415.04]
  - - [1024, 8192, 1, 8192, 1024, 1024, 8192, 8192]
    - [15, 372.26]
  - - [2048, 128, 1, 128, 2048, 2048, 128, 128]
    - [58, 8.36]
  - - [2048, 128, 1, 256, 2048, 2048, 256, 128]
    - [113, 15.02]
  - - [2048, 128, 1, 512, 2048, 2048, 512, 128]
    - [116, 25.79]
  - - [2048, 128, 1, 1024, 2048, 2048, 1024, 128]
    - [116, 40.45]
  - - [2048, 128, 1, 2048, 2048, 2048, 2048, 128]
    - [116, 56.0]
  - - [2048, 128, 1, 4096, 2048, 2048, 4096, 128]
    - [127, 78.65]
  - - [2048, 128, 1, 8192, 2048, 2048, 8192, 128]
    - [98, 111.88]
  - - [2048, 256, 1, 128, 2048, 2048, 128, 256]
    - [104, 15.95]
  - - [2048, 256, 1, 256, 2048, 2048, 256, 256]
    - [53, 28.13]
  - - [2048, 256, 1, 512, 2048, 2048, 512, 256]
    - [105, 48.01]
  - - [2048, 256, 1, 1024, 2048, 2048, 1024, 256]
    - [105, 73.37]
  - - [2048, 256, 1, 2048, 2048, 2048, 2048, 256]
    - [124, 100.53]
  - - [2048, 256, 1, 4096, 2048, 2048, 4096, 256]
    - [119, 132.22]
  - - [2048, 256, 1, 8192, 2048, 2048, 8192, 256]
    - [86, 167.69]
  - - [2048, 512, 1, 128, 2048, 2048, 128, 512]
    - [9, 28.85]
  - - [2048, 512, 1, 256, 2048, 2048, 256, 512]
    - [93, 50.71]
  - - [2048, 512, 1, 512, 2048, 2048, 512, 512]
    - [95, 84.19]
  - - [2048, 512, 1, 1024, 2048, 2048, 1024, 512]
    - [95, 127.45]
  - - [2048, 512, 1, 2048, 2048, 2048, 2048, 512]
    - [98, 166.06]
  - - [2048, 512, 1, 4096, 2048, 2048, 4096, 512]
    - [99, 190.31]
  - - [2048, 512, 1, 8192, 2048, 2048, 8192, 512]
    - [77, 230.22]
  - - [2048, 1024, 1, 128, 2048, 2048, 128, 1024]
    - [43, 49.17]
  - - [2048, 1024, 1, 256, 2048, 2048, 256, 1024]
    - [42, 87.79]
  - - [2048, 1024, 1, 512, 2048, 2048, 512, 1024]
    - [44, 138.19]
  - - [2048, 1024, 1, 1024, 2048, 2048, 1024, 1024]
    - [83, 197.2]
  - - [2048, 1024, 1, 2048, 2048, 2048, 2048, 1024]
    - [91, 226.61]
  - - [2048, 1024, 1, 4096, 2048, 2048, 4096, 1024]
    - [89, 239.4]
  - - [2048, 1024, 1, 8192, 2048, 2048, 8192, 1024]
    - [69, 281.07]
  - - [2048, 2048, 1, 128, 2048, 2048, 128, 2048]
    - [7, 76.99]
  - - [2048, 2048, 1, 256, 2048, 2048, 256, 2048]
    - [40, 131.43]
  - - [2048, 2048, 1, 512, 2048, 2048, 512, 2048]
    - [74, 204.71]
  - - [2048, 2048, 1, 1024, 2048, 2048, 1024, 2048]
    - [77, 254.15]
  - - [2048, 2048, 1, 2048, 2048, 2048, 2048, 2048]
    - [77, 297.35]
  - - [2048, 2048, 1, 4096, 2048, 2048, 4096, 2048]
    - [77, 326.3]
  - - [2048, 2048, 1, 8192, 2048, 2048, 8192, 2048]
    - [71, 333.45]
  - - [2048, 4096, 1, 128, 2048, 2048, 128, 4096]
    - [6, 109.02]
  - - [2048, 4096, 1, 256, 2048, 2048, 256, 4096]
    - [5, 178.89]
  - - [2048, 4096, 1, 512, 2048, 2048, 512, 4096]
    - [36, 256.5]
  - - [2048, 4096, 1, 1024, 2048, 2048, 1024, 4096]
    - [68, 315.57]
  - - [2048, 4096, 1, 2048, 2048, 2048, 2048, 4096]
    - [71, 359.86]
  - - [2048, 4096, 1, 4096, 2048, 2048, 4096, 4096]
    - [71, 412.45]
  - - [2048, 4096, 1, 8192, 2048, 2048, 8192, 4096]
    - [23, 372.07]
  - - [2048, 8192, 1, 128, 2048, 2048, 128, 8192]
    - [0, 133.63]
  - - [2048, 8192, 1, 256, 2048, 2048, 256, 8192]
    - [13, 208.12]
  - - [2048, 8192, 1, 512, 2048, 2048, 512, 8192]
    - [31, 285.64]
  - - [2048, 8192, 1, 1024, 2048, 2048, 1024, 8192]
    - [27, 371.37]
  - - [2048, 8192, 1, 2048, 2048, 2048, 2048, 8192]
    - [29, 441.9]
  - - [2048, 8192, 1, 4096, 2048, 2048, 4096, 8192]
    - [16, 371.07]
  - - [2048, 8192, 1, 8192, 2048, 2048, 8192, 8192]
    - [15, 419.72]
  - - [4096, 128, 1, 128, 4096, 4096, 128, 128]
    - [11, 15.6]
  - - [4096, 128, 1, 256, 4096, 4096, 256, 128]
    - [54, 27.82]
  - - [4096, 128, 1, 512, 4096, 4096, 512, 128]
    - [107, 47.58]
  - - [4096, 128, 1, 1024, 4096, 4096, 1024, 128]
    - [107, 72.33]
  - - [4096, 128, 1, 2048, 4096, 4096, 2048, 128]
    - [126, 100.46]
  - - [4096, 128, 1, 4096, 4096, 4096, 4096, 128]
    - [120, 133.08]
  - - [4096, 128, 1, 8192, 4096, 4096, 8192, 128]
    - [87, 163.49]
  - - [4096, 256, 1, 128, 4096, 4096, 128, 256]
    - [47, 28.55]
  - - [4096, 256, 1, 256, 4096, 4096, 256, 256]
    - [49, 50.3]
  - - [4096, 256, 1, 512, 4096, 4096, 512, 256]
    - [95, 82.44]
  - - [4096, 256, 1, 1024, 4096, 4096, 1024, 256]
    - [100, 124.6]
  - - [4096, 256, 1, 2048, 4096, 4096, 2048, 256]
    - [100, 166.9]
  - - [4096, 256, 1, 4096, 4096, 4096, 4096, 256]
    - [100, 195.11]
  - - [4096, 256, 1, 8192, 4096, 4096, 8192, 256]
    - [80, 229.98]
  - - [4096, 512, 1, 128, 4096, 4096, 128, 512]
    - [43, 49.7]
  - - [4096, 512, 1, 256, 4096, 4096, 256, 512]
    - [46, 84.62]
  - - [4096, 512, 1, 512, 4096, 4096, 512, 512]
    - [84, 136.67]
  - - [4096, 512, 1, 1024, 4096, 4096, 1024, 512]
    - [87, 194.7]
  - - [4096, 512, 1, 2048, 4096, 4096, 2048, 512]
    - [86, 236.76]
  - - [4096, 512, 1, 4096, 4096, 4096, 4096, 512]
    - [89, 250.45]
  - - [4096, 512, 1, 8192, 4096, 4096, 8192, 512]
    - [69, 281.06]
  - - [4096, 1024, 1, 128, 4096, 4096, 128, 1024]
    - [7, 76.67]
  - - [4096, 1024, 1, 256, 4096, 4096, 256, 1024]
    - [40, 132.27]
  - - [4096, 1024, 1, 512, 4096, 4096, 512, 1024]
    - [41, 203.94]
  - - [4096, 1024, 1, 1024, 4096, 4096, 1024, 1024]
    - [79, 259.57]
  - - [4096, 1024, 1, 2048, 4096, 4096, 2048, 1024]
    - [80, 298.55]
  - - [4096, 1024, 1, 4096, 4096, 4096, 4096, 1024]
    - [77, 325.95]
  - - [4096, 1024, 1, 8192, 4096, 4096, 8192, 1024]
    - [63, 323.41]
  - - [4096, 2048, 1, 128, 4096, 4096, 128, 2048]
    - [3, 108.73]
  - - [4096, 2048, 1, 256, 4096, 4096, 256, 2048]
    - [33, 178.88]
  - - [4096, 2048, 1, 512, 4096, 4096, 512, 2048]
    - [37, 254.56]
  - - [4096, 2048, 1, 1024, 4096, 4096, 1024, 2048]
    - [69, 317.27]
  - - [4096, 2048, 1, 2048, 4096, 4096, 2048, 2048]
    - [72, 361.24]
  - - [4096, 2048, 1, 4096, 4096, 4096, 4096, 2048]
    - [71, 411.96]
  - - [4096, 2048, 1, 8192, 4096, 4096, 8192, 2048]
    - [65, 370.95]
  - - [4096, 4096, 1, 128, 4096, 4096, 128, 4096]
    - [2, 132.75]
  - - [4096, 4096, 1, 256, 4096, 4096, 256, 4096]
    - [19, 206.05]
  - - [4096, 4096, 1, 512, 4096, 4096, 512, 4096]
    - [17, 284.1]
  - - [4096, 4096, 1, 1024, 4096, 4096, 1024, 4096]
    - [29, 365.07]
  - - [4096, 4096, 1, 2048, 4096, 4096, 2048, 4096]
    - [21, 442.53]
  - - [4096, 4096, 1, 4096, 4096, 4096, 4096, 4096]
    - [28, 374.76]
  - - [4096, 4096, 1, 8192, 4096, 4096, 8192, 4096]
    - [14, 418.72]
  - - [4096, 8192, 1, 128, 4096, 4096, 128, 8192]
    - [29, 133.06]
  - - [4096, 8192, 1, 256, 4096, 4096, 256, 8192]
    - [34, 173.86]
  - - [4096, 8192, 1, 512, 4096, 4096, 512, 8192]
    - [67, 241.63]
  - - [4096, 8192, 1, 1024, 4096, 4096, 1024, 8192]
    - [25, 306.07]
  - - [4096, 8192, 1, 2048, 4096, 4096, 2048, 8192]
    - [16, 362.28]
  - - [4096, 8192, 1, 4096, 4096, 4096, 4096, 8192]
    - [13, 415.17]
  - - [4096, 8192, 1, 8192, 4096, 4096, 8192, 8192]
    - [16, 451.78]
  - - [8192, 128, 1, 128, 8192, 8192, 128, 128]
    - [49, 28.95]
  - - [8192, 128, 1, 256, 8192, 8192, 256, 128]
    - [49, 51.51]
  - - [8192, 128, 1, 512, 8192, 8192, 512, 128]
    - [93, 84.4]
  - - [8192, 128, 1, 1024, 8192, 8192, 1024, 128]
    - [95, 126.89]
  - - [8192, 128, 1, 2048, 8192, 8192, 2048, 128]
    - [100, 164.66]
  - - [8192, 128, 1, 4096, 8192, 8192, 4096, 128]
    - [118, 174.45]
  - - [8192, 128, 1, 8192, 8192, 8192, 8192, 128]
    - [74, 216.52]
  - - [8192, 256, 1, 128, 8192, 8192, 128, 256]
    - [43, 48.41]
  - - [8192, 256, 1, 256, 8192, 8192, 256, 256]
    - [42, 85.95]
  - - [8192, 256, 1, 512, 8192, 8192, 512, 256]
    - [42, 138.28]
  - - [8192, 256, 1, 1024, 8192, 8192, 1024, 256]
    - [87, 192.83]
  - - [8192, 256, 1, 2048, 8192, 8192, 2048, 256]
    - [88, 235.13]
  - - [8192, 256, 1, 4096, 8192, 8192, 4096, 256]
    - [77, 235.92]
  - - [8192, 256, 1, 8192, 8192, 8192, 8192, 256]
    - [69, 278.12]
  - - [8192, 512, 1, 128, 8192, 8192, 128, 512]
    - [7, 78.21]
  - - [8192, 512, 1, 256, 8192, 8192, 256, 512]
    - [40, 133.07]
  - - [8192, 512, 1, 512, 8192, 8192, 512, 512]
    - [74, 202.34]
  - - [8192, 512, 1, 1024, 8192, 8192, 1024, 512]
    - [79, 260.86]
  - - [8192, 512, 1, 2048, 8192, 8192, 2048, 512]
    - [77, 301.7]
  - - [8192, 512, 1, 4096, 8192, 8192, 4096, 512]
    - [78, 323.44]
  - - [8192, 512, 1, 8192, 8192, 8192, 8192, 512]
    - [62, 328.28]
  - - [8192, 1024, 1, 128, 8192, 8192, 128, 1024]
    - [5, 108.82]
  - - [8192, 1024, 1, 256, 8192, 8192, 256, 1024]
    - [36, 177.82]
  - - [8192, 1024, 1, 512, 8192, 8192, 512, 1024]
    - [37, 252.2]
  - - [8192, 1024, 1, 1024, 8192, 8192, 1024, 1024]
    - [69, 323.36]
  - - [8192, 1024, 1, 2048, 8192, 8192, 2048, 1024]
    - [70, 375.07]
  - - [8192, 1024, 1, 4096, 8192, 8192, 4096, 1024]
    - [71, 412.97]
  - - [8192, 1024, 1, 8192, 8192, 8192, 8192, 1024]
    - [20, 367.2]
  - - [8192, 2048, 1, 128, 8192, 8192, 128, 2048]
    - [1, 131.68]
  - - [8192, 2048, 1, 256, 8192, 8192, 256, 2048]
    - [22, 202.08]
  - - [8192, 2048, 1, 512, 8192, 8192, 512, 2048]
    - [24, 279.28]
  - - [8192, 2048, 1, 1024, 8192, 8192, 1024, 2048]
    - [28, 357.94]
  - - [8192, 2048, 1, 2048, 8192, 8192, 2048, 2048]
    - [18, 437.33]
  - - [8192, 2048, 1, 4096, 8192, 8192, 4096, 2048]
    - [25, 371.68]
  - - [8192, 2048, 1, 8192, 8192, 8192, 8192, 2048]
    - [26, 416.43]
  - - [8192, 4096, 1, 128, 8192, 8192, 128, 4096]
    - [27, 132.04]
  - - [8192, 4096, 1, 256, 8192, 8192, 256, 4096]
    - [38, 170.36]
  - - [8192, 4096, 1, 512, 8192, 8192, 512, 4096]
    - [73, 238.08]
  - - [8192, 4096, 1, 1024, 8192, 8192, 1024, 4096]
    - [30, 300.87]
  - - [8192, 4096, 1, 2048, 8192, 8192, 2048, 4096]
    - [16, 361.39]
  - - [8192, 4096, 1, 4096, 8192, 8192, 4096, 4096]
    - [25, 411.84]
  - - [8192, 4096, 1, 8192, 8192, 8192, 8192, 4096]
    - [28, 451.74]
  - - [8192, 8192, 1, 128, 8192, 8192, 128, 8192]
    - [39, 136.57]
  - - [8192, 8192, 1, 256, 8192, 8192, 256, 8192]
    - [66, 196.78]
  - - [8192, 8192, 1, 512, 8192, 8192, 512, 8192]
    - [25, 251.85]
  - - [8192, 8192, 1, 1024, 8192, 8192, 1024, 8192]
    - [25, 337.98]
  - - [8192, 8192, 1, 2048, 8192, 8192, 2048, 8192]
    - [28, 402.51]
  - - [8192, 8192, 1, 4096, 8192, 8192, 4096, 8192]
    - [28, 461.9]
  - - [8192, 8192, 1, 8192, 8192, 8192, 8192, 8192]
    - [26, 497.3]
  - - [1, 1, 1, 32, 1, 1, 32, 1]
    - [131, 0.0]
- null
- null
- ExperimentalStreamK
- GridBased
