projects/hipblaslt/library/src/amd_detail/rocblaslt/src/Tensile/Logic/asm_full/aquavanjaram/gfx942/StreamK/aquavanjaram942_Cijk_Ailk_Bljk_I8BH_UserArgs.yaml
- {MinimumRequiredVersion: 4.33.0}
- aquavanjaram942
- gfx942
- [Device 0049, Device 0050]
    SolutionIndex: 0
    SolutionNameMin: Cijk_Ailk_Bljk_I8BH_UserArgs_MT256x256x32_MI16x16x1_SN_CLR0_GSU0_GSUC0_GSUWGMRR0_K1_LBSPPA2048_LBSPPB128_LPA64_MIWT8_8_PLR0_SU0_SUM0_SUS0_SKXCCM8_VWA4_VWB1_WGM1_WGMXCC1_WGMXCCGn1
    SolutionIndex: 1
    SolutionNameMin: Cijk_Ailk_Bljk_I8BH_UserArgs_MT256x256x32_MI16x16x1_SN_CLR0_GSU0_GSUC0_GSUWGMRR0_K1_LBSPPA2048_LBSPPB128_LPA0_MIWT8_8_PLR0_SU0_SUM0_SUS0_SKXCCM8_VWA8_VWB1_WGM1_WGMXCC1_WGMXCCGn1
    SolutionIndex: 2
    SolutionNameMin: Cijk_Ailk_Bljk_I8BH_UserArgs_MT256x256x32_MI16x16x1_SN_CLR0_GSU0_GSUC0_GSUWGMRR0_K1_LBSPPA2048_LBSPPB128_LPA64_MIWT8_8_PLR0_SU0_SUM0_SUS0_SKXCCM8_VWA4_VWB4_WGM4_WGMXCC1_WGMXCCGn1
    SolutionIndex: 3
    SolutionNameMin: Cijk_Ailk_Bljk_I8BH_UserArgs_MT128x256x32_MI16x16x1_SN_CLR0_GSU0_GSUC0_GSUWGMRR0_K1_LBSPPA1024_LBSPPB256_LPA64_MIWT4_8_PLR0_SU0_SUM0_SUS0_SKXCCM8_VWA4_VWB8_WGM1_WGMXCC1_WGMXCCGn1
    SolutionIndex: 4
    SolutionNameMin: Cijk_Ailk_Bljk_I8BH_UserArgs_MT256x128x32_MI16x16x1_SN_CLR0_GSU0_GSUC0_GSUWGMRR0_K1_LBSPPA2048_LBSPPB128_LPA64_MIWT8_4_PLR0_SU0_SUM0_SUS0_SKXCCM8_VWA4_VWB1_WGM1_WGMXCC1_WGMXCCGn1
    SolutionIndex: 5
    SolutionNameMin: Cijk_Ailk_Bljk_I8BH_UserArgs_MT256x128x32_MI16x16x1_SN_CLR0_GSU0_GSUC0_GSUWGMRR0_K1_LBSPPA2048_LBSPPB128_LPA0_MIWT8_4_PLR0_SU0_SUM0_SUS0_SKXCCM8_VWA8_VWB2_WGM8_WGMXCC1_WGMXCCGn1
    SolutionIndex: 6
    SolutionNameMin: Cijk_Ailk_Bljk_I8BH_UserArgs_MT256x128x32_MI16x16x1_SN_CLR0_GSU0_GSUC0_GSUWGMRR0_K1_LBSPPA2048_LBSPPB128_LPA0_MIWT8_4_PLR0_SU0_SUM0_SUS0_SKXCCM8_VWA8_VWB4_WGM8_WGMXCC1_WGMXCCGn1
    SolutionIndex: 7
    SolutionNameMin: Cijk_Ailk_Bljk_I8BH_UserArgs_MT128x128x32_MI16x16x1_SN_CLR0_GSU0_GSUC0_GSUWGMRR0_K1_LBSPPA1024_LBSPPB128_LPA64_MIWT4_4_PLR0_SU0_SUM0_SUS0_SKXCCM8_VWA4_VWB4_WGM1_WGMXCC1_WGMXCCGn1
    SolutionIndex: 8
    SolutionNameMin: Cijk_Ailk_Bljk_I8BH_UserArgs_MT128x128x32_MI16x16x1_SN_CLR0_GSU0_GSUC0_GSUWGMRR0_K1_LBSPPA1024_LBSPPB128_LPA64_MIWT4_4_PLR0_SU0_SUM0_SUS0_SKXCCM8_VWA4_VWB2_WGM1_WGMXCC1_WGMXCCGn1
    SolutionIndex: 9
    SolutionNameMin: Cijk_Ailk_Bljk_I8BH_UserArgs_MT128x128x32_MI16x16x1_SN_CLR0_GSU0_GSUC0_GSUWGMRR0_K1_LBSPPA1024_LBSPPB128_LPA64_MIWT4_4_PLR0_SU0_SUM0_SUS0_SKXCCM8_VWA4_VWB4_WGM1_WGMXCC1_WGMXCCGn1
    SolutionIndex: 10
    SolutionNameMin: Cijk_Ailk_Bljk_I8BH_UserArgs_MT64x64x32_MI16x16x1_SN_CLR0_GSU0_GSUC0_GSUWGMRR0_K1_LBSPPA512_LBSPPB128_LPA32_MIWT2_2_PLR0_SU0_SUM0_SUS0_SKXCCM8_VWA2_VWB1_WGM1_WGMXCC1_WGMXCCGn1
    SolutionIndex: 11
    SolutionNameMin: Cijk_Ailk_Bljk_I8BH_UserArgs_MT32x32x32_MI16x16x1_SN_CLR0_GSU0_GSUC0_GSUWGMRR0_K1_LBSPPA256_LBSPPB128_LPA16_MIWT1_1_PLR0_SU0_SUM0_SUS0_SKXCCM8_VWA1_VWB1_WGM1_WGMXCC1_WGMXCCGn1
    SolutionIndex: 12
    SolutionNameMin: Cijk_Ailk_Bljk_I8BH_UserArgs_MT32x32x32_MI16x16x1_SN_CLR0_GSU0_GSUC0_GSUWGMRR0_K1_LBSPPA256_LBSPPB128_LPA16_MIWT1_1_PLR0_SU0_SUM0_SUS0_SKXCCM8_VWA1_VWB1_WGM4_WGMXCC1_WGMXCCGn1
    SolutionIndex: 13
    SolutionNameMin: Cijk_Ailk_Bljk_I8BH_UserArgs_MT32x32x32_MI16x16x1_SN_CLR0_GSU0_GSUC0_GSUWGMRR0_K1_LBSPPA256_LBSPPB128_LPA16_MIWT1_1_PLR0_SU0_SUM0_SUS0_SKXCCM8_VWA1_VWB1_WGM8_WGMXCC1_WGMXCCGn1
    SolutionIndex: 14
    SolutionNameMin: Cijk_Ailk_Bljk_I8BH_UserArgs_MT256x256x64_MI16x16x1_SN_CLR1_GSU0_GSUC0_GSUWGMRR0_K1_LBSPPA2048_LBSPPB128_LPA64_MIWT8_8_PLR1_SU0_SUM0_SUS0_SKXCCM8_VWA4_VWB1_WGM1_WGMXCC1_WGMXCCGn1
    SolutionIndex: 15
    SolutionNameMin: Cijk_Ailk_Bljk_I8BH_UserArgs_MT256x256x64_MI16x16x1_SN_CLR1_GSU0_GSUC0_GSUWGMRR0_K1_LBSPPA2048_LBSPPB128_LPA64_MIWT8_8_PLR1_SU0_SUM0_SUS0_SKXCCM8_VWA4_VWB2_WGM1_WGMXCC1_WGMXCCGn1
    SolutionIndex: 16
    SolutionNameMin: Cijk_Ailk_Bljk_I8BH_UserArgs_MT256x256x64_MI16x16x1_SN_CLR1_GSU0_GSUC0_GSUWGMRR0_K1_LBSPPA2048_LBSPPB256_LPA64_MIWT8_8_PLR1_SU0_SUM0_SUS0_SKXCCM8_VWA4_VWB4_WGM1_WGMXCC1_WGMXCCGn1
    SolutionIndex: 17
    SolutionNameMin: Cijk_Ailk_Bljk_I8BH_UserArgs_MT256x256x64_MI16x16x1_SN_CLR1_GSU0_GSUC0_GSUWGMRR0_K1_LBSPPA2048_LBSPPB512_LPA64_MIWT8_8_PLR1_SU0_SUM0_SUS0_SKXCCM8_VWA4_VWB8_WGM1_WGMXCC1_WGMXCCGn1
    SolutionIndex: 18
    SolutionNameMin: Cijk_Ailk_Bljk_I8BH_UserArgs_MT256x256x64_MI16x16x1_SN_CLR1_GSU0_GSUC0_GSUWGMRR0_K1_LBSPPA2048_LBSPPB128_LPA0_MIWT8_8_PLR1_SU0_SUM0_SUS0_SKXCCM8_VWA8_VWB1_WGM1_WGMXCC1_WGMXCCGn1
    SolutionIndex: 19
    SolutionNameMin: Cijk_Ailk_Bljk_I8BH_UserArgs_MT256x256x64_MI16x16x1_SN_CLR1_GSU0_GSUC0_GSUWGMRR0_K1_LBSPPA2048_LBSPPB128_LPA64_MIWT8_8_PLR1_SU0_SUM0_SUS0_SKXCCM8_VWA4_VWB2_WGM1_WGMXCC1_WGMXCCGn1
    SolutionIndex: 20
    SolutionNameMin: Cijk_Ailk_Bljk_I8BH_UserArgs_MT256x256x64_MI16x16x1_SN_CLR1_GSU0_GSUC0_GSUWGMRR0_K1_LBSPPA2048_LBSPPB512_LPA64_MIWT8_8_PLR1_SU0_SUM0_SUS0_SKXCCM8_VWA4_VWB8_WGM1_WGMXCC1_WGMXCCGn1
    SolutionIndex: 21
    SolutionNameMin: Cijk_Ailk_Bljk_I8BH_UserArgs_MT256x256x64_MI16x16x1_SN_CLR1_GSU0_GSUC0_GSUWGMRR0_K1_LBSPPA2048_LBSPPB256_LPA64_MIWT8_8_PLR1_SU0_SUM0_SUS0_SKXCCM8_VWA4_VWB4_WGM1_WGMXCC1_WGMXCCGn1
    SolutionIndex: 22
    SolutionNameMin: Cijk_Ailk_Bljk_I8BH_UserArgs_MT256x256x64_MI16x16x1_SN_CLR1_GSU0_GSUC0_GSUWGMRR0_K1_LBSPPA2048_LBSPPB128_LPA64_MIWT8_8_PLR1_SU0_SUM0_SUS0_SKXCCM8_VWA4_VWB1_WGM4_WGMXCC1_WGMXCCGn1
    SolutionIndex: 23
    SolutionNameMin: Cijk_Ailk_Bljk_I8BH_UserArgs_MT256x256x64_MI16x16x1_SN_CLR1_GSU0_GSUC0_GSUWGMRR0_K1_LBSPPA2048_LBSPPB128_LPA0_MIWT8_8_PLR1_SU0_SUM0_SUS0_SKXCCM8_VWA8_VWB1_WGM4_WGMXCC1_WGMXCCGn1
    SolutionIndex: 24
    SolutionNameMin: Cijk_Ailk_Bljk_I8BH_UserArgs_MT256x256x64_MI16x16x1_SN_CLR1_GSU0_GSUC0_GSUWGMRR0_K1_LBSPPA2048_LBSPPB128_LPA64_MIWT8_8_PLR1_SU0_SUM0_SUS0_SKXCCM8_VWA4_VWB2_WGM4_WGMXCC1_WGMXCCGn1
    SolutionIndex: 25
    SolutionNameMin: Cijk_Ailk_Bljk_I8BH_UserArgs_MT256x256x64_MI16x16x1_SN_CLR1_GSU0_GSUC0_GSUWGMRR0_K1_LBSPPA2048_LBSPPB256_LPA0_MIWT8_8_PLR1_SU0_SUM0_SUS0_SKXCCM8_VWA8_VWB4_WGM4_WGMXCC1_WGMXCCGn1
    SolutionIndex: 26
    SolutionNameMin: Cijk_Ailk_Bljk_I8BH_UserArgs_MT256x256x64_MI16x16x1_SN_CLR1_GSU0_GSUC0_GSUWGMRR0_K1_LBSPPA2048_LBSPPB512_LPA64_MIWT8_8_PLR1_SU0_SUM0_SUS0_SKXCCM8_VWA4_VWB8_WGM4_WGMXCC1_WGMXCCGn1
    SolutionIndex: 27
    SolutionNameMin: Cijk_Ailk_Bljk_I8BH_UserArgs_MT256x256x64_MI16x16x1_SN_CLR1_GSU0_GSUC0_GSUWGMRR0_K1_LBSPPA2048_LBSPPB128_LPA64_MIWT8_8_PLR1_SU0_SUM0_SUS0_SKXCCM8_VWA4_VWB2_WGM4_WGMXCC1_WGMXCCGn1
    SolutionIndex: 28
    SolutionNameMin: Cijk_Ailk_Bljk_I8BH_UserArgs_MT256x256x64_MI16x16x1_SN_CLR1_GSU0_GSUC0_GSUWGMRR0_K1_LBSPPA2048_LBSPPB128_LPA64_MIWT8_8_PLR1_SU0_SUM0_SUS0_SKXCCM8_VWA4_VWB1_WGM4_WGMXCC1_WGMXCCGn1
    SolutionIndex: 29
    SolutionNameMin: Cijk_Ailk_Bljk_I8BH_UserArgs_MT256x256x64_MI16x16x1_SN_CLR1_GSU0_GSUC0_GSUWGMRR0_K1_LBSPPA2048_LBSPPB128_LPA0_MIWT8_8_PLR1_SU0_SUM0_SUS0_SKXCCM8_VWA8_VWB1_WGM4_WGMXCC1_WGMXCCGn1
    SolutionIndex: 30
    SolutionNameMin: Cijk_Ailk_Bljk_I8BH_UserArgs_MT256x256x64_MI16x16x1_SN_CLR1_GSU0_GSUC0_GSUWGMRR0_K1_LBSPPA2048_LBSPPB256_LPA64_MIWT8_8_PLR1_SU0_SUM0_SUS0_SKXCCM8_VWA4_VWB4_WGM4_WGMXCC1_WGMXCCGn1
    SolutionIndex: 31
    SolutionNameMin: Cijk_Ailk_Bljk_I8BH_UserArgs_MT256x256x64_MI16x16x1_SN_CLR1_GSU0_GSUC0_GSUWGMRR0_K1_LBSPPA2048_LBSPPB512_LPA64_MIWT8_8_PLR1_SU0_SUM0_SUS0_SKXCCM8_VWA4_VWB8_WGM4_WGMXCC1_WGMXCCGn1
    SolutionIndex: 32
    SolutionNameMin: Cijk_Ailk_Bljk_I8BH_UserArgs_MT256x256x64_MI16x16x1_SN_CLR1_GSU0_GSUC0_GSUWGMRR0_K1_LBSPPA2048_LBSPPB128_LPA0_MIWT8_8_PLR1_SU0_SUM0_SUS0_SKXCCM8_VWA8_VWB2_WGM8_WGMXCC1_WGMXCCGn1
    SolutionIndex: 33
    SolutionNameMin: Cijk_Ailk_Bljk_I8BH_UserArgs_MT256x256x64_MI16x16x1_SN_CLR1_GSU0_GSUC0_GSUWGMRR0_K1_LBSPPA2048_LBSPPB256_LPA64_MIWT8_8_PLR1_SU0_SUM0_SUS0_SKXCCM8_VWA4_VWB4_WGM8_WGMXCC1_WGMXCCGn1
    SolutionIndex: 34
    SolutionNameMin: Cijk_Ailk_Bljk_I8BH_UserArgs_MT256x256x64_MI16x16x1_SN_CLR1_GSU0_GSUC0_GSUWGMRR0_K1_LBSPPA2048_LBSPPB512_LPA0_MIWT8_8_PLR1_SU0_SUM0_SUS0_SKXCCM8_VWA8_VWB8_WGM8_WGMXCC1_WGMXCCGn1
    SolutionIndex: 35
    SolutionNameMin: Cijk_Ailk_Bljk_I8BH_UserArgs_MT256x256x64_MI16x16x1_SN_CLR1_GSU0_GSUC0_GSUWGMRR0_K1_LBSPPA2048_LBSPPB128_LPA0_MIWT8_8_PLR1_SU0_SUM0_SUS0_SKXCCM8_VWA8_VWB1_WGM8_WGMXCC1_WGMXCCGn1
    SolutionIndex: 36
    SolutionNameMin: Cijk_Ailk_Bljk_I8BH_UserArgs_MT256x256x64_MI16x16x1_SN_CLR1_GSU0_GSUC0_GSUWGMRR0_K1_LBSPPA2048_LBSPPB128_LPA0_MIWT8_8_PLR1_SU0_SUM0_SUS0_SKXCCM8_VWA8_VWB2_WGM8_WGMXCC1_WGMXCCGn1
    SolutionIndex: 37
    SolutionNameMin: Cijk_Ailk_Bljk_I8BH_UserArgs_MT256x256x64_MI16x16x1_SN_CLR1_GSU0_GSUC0_GSUWGMRR0_K1_LBSPPA2048_LBSPPB512_LPA0_MIWT8_8_PLR1_SU0_SUM0_SUS0_SKXCCM8_VWA8_VWB8_WGM8_WGMXCC1_WGMXCCGn1
    SolutionIndex: 38
    SolutionNameMin: Cijk_Ailk_Bljk_I8BH_UserArgs_MT256x256x64_MI16x16x1_SN_CLR1_GSU0_GSUC0_GSUWGMRR0_K1_LBSPPA2048_LBSPPB128_LPA64_MIWT8_8_PLR1_SU0_SUM0_SUS0_SKXCCM8_VWA4_VWB1_WGM8_WGMXCC1_WGMXCCGn1
    SolutionIndex: 39
    SolutionNameMin: Cijk_Ailk_Bljk_I8BH_UserArgs_MT256x256x64_MI16x16x1_SN_CLR1_GSU0_GSUC0_GSUWGMRR0_K1_LBSPPA2048_LBSPPB512_LPA0_MIWT8_8_PLR1_SU0_SUM0_SUS0_SKXCCM8_VWA8_VWB8_WGM8_WGMXCC1_WGMXCCGn1
    SolutionIndex: 40
    SolutionNameMin: Cijk_Ailk_Bljk_I8BH_UserArgs_MT128x256x64_MI16x16x1_SN_CLR1_GSU0_GSUC0_GSUWGMRR0_K1_LBSPPA1024_LBSPPB128_LPA64_MIWT4_8_PLR1_SU0_SUM0_SUS0_SKXCCM8_VWA4_VWB1_WGM1_WGMXCC1_WGMXCCGn1
    SolutionIndex: 41
    SolutionNameMin: Cijk_Ailk_Bljk_I8BH_UserArgs_MT128x256x64_MI16x16x1_SN_CLR1_GSU0_GSUC0_GSUWGMRR0_K1_LBSPPA1024_LBSPPB512_LPA64_MIWT4_8_PLR1_SU0_SUM0_SUS0_SKXCCM8_VWA4_VWB8_WGM1_WGMXCC1_WGMXCCGn1
    SolutionIndex: 42
    SolutionNameMin: Cijk_Ailk_Bljk_I8BH_UserArgs_MT256x128x64_MI16x16x1_SN_CLR1_GSU0_GSUC0_GSUWGMRR0_K1_LBSPPA2048_LBSPPB128_LPA0_MIWT8_4_PLR1_SU0_SUM0_SUS0_SKXCCM8_VWA8_VWB1_WGM1_WGMXCC1_WGMXCCGn1
    SolutionIndex: 43
    SolutionNameMin: Cijk_Ailk_Bljk_I8BH_UserArgs_MT256x128x64_MI16x16x1_SN_CLR1_GSU0_GSUC0_GSUWGMRR0_K1_LBSPPA2048_LBSPPB128_LPA0_MIWT8_4_PLR1_SU0_SUM0_SUS0_SKXCCM8_VWA8_VWB1_WGM1_WGMXCC1_WGMXCCGn1
    SolutionIndex: 44
    SolutionNameMin: Cijk_Ailk_Bljk_I8BH_UserArgs_MT256x128x64_MI16x16x1_SN_CLR1_GSU0_GSUC0_GSUWGMRR0_K1_LBSPPA2048_LBSPPB128_LPA0_MIWT8_4_PLR1_SU0_SUM0_SUS0_SKXCCM8_VWA8_VWB1_WGM4_WGMXCC1_WGMXCCGn1
    SolutionIndex: 45
    SolutionNameMin: Cijk_Ailk_Bljk_I8BH_UserArgs_MT256x128x64_MI16x16x1_SN_CLR1_GSU0_GSUC0_GSUWGMRR0_K1_LBSPPA2048_LBSPPB128_LPA0_MIWT8_4_PLR1_SU0_SUM0_SUS0_SKXCCM8_VWA8_VWB2_WGM8_WGMXCC1_WGMXCCGn1
    SolutionIndex: 46
    SolutionNameMin: Cijk_Ailk_Bljk_I8BH_UserArgs_MT256x128x64_MI16x16x1_SN_CLR1_GSU0_GSUC0_GSUWGMRR0_K1_LBSPPA2048_LBSPPB256_LPA0_MIWT8_4_PLR1_SU0_SUM0_SUS0_SKXCCM8_VWA8_VWB4_WGM8_WGMXCC1_WGMXCCGn1
    SolutionIndex: 47
    SolutionNameMin: Cijk_Ailk_Bljk_I8BH_UserArgs_MT128x128x64_MI16x16x1_SN_CLR1_GSU0_GSUC0_GSUWGMRR0_K1_LBSPPA1024_LBSPPB128_LPA64_MIWT4_4_PLR1_SU0_SUM0_SUS0_SKXCCM8_VWA4_VWB1_WGM1_WGMXCC1_WGMXCCGn1
    SolutionIndex: 48
    SolutionNameMin: Cijk_Ailk_Bljk_I8BH_UserArgs_MT128x128x64_MI16x16x1_SN_CLR1_GSU0_GSUC0_GSUWGMRR0_K1_LBSPPA1024_LBSPPB128_LPA64_MIWT4_4_PLR1_SU0_SUM0_SUS0_SKXCCM8_VWA4_VWB2_WGM1_WGMXCC1_WGMXCCGn1
    SolutionIndex: 49
    SolutionNameMin: Cijk_Ailk_Bljk_I8BH_UserArgs_MT128x128x64_MI16x16x1_SN_CLR1_GSU0_GSUC0_GSUWGMRR0_K1_LBSPPA1024_LBSPPB256_LPA64_MIWT4_4_PLR1_SU0_SUM0_SUS0_SKXCCM8_VWA4_VWB4_WGM1_WGMXCC1_WGMXCCGn1
    SolutionIndex: 50
    SolutionNameMin: Cijk_Ailk_Bljk_I8BH_UserArgs_MT128x128x64_MI16x16x1_SN_CLR1_GSU0_GSUC0_GSUWGMRR0_K1_LBSPPA1024_LBSPPB256_LPA64_MIWT4_4_PLR1_SU0_SUM0_SUS0_SKXCCM8_VWA4_VWB4_WGM8_WGMXCC1_WGMXCCGn1
    SolutionIndex: 51
    SolutionNameMin: Cijk_Ailk_Bljk_I8BH_UserArgs_MT128x128x64_MI16x16x1_SN_CLR1_GSU0_GSUC0_GSUWGMRR0_K1_LBSPPA1024_LBSPPB256_LPA64_MIWT4_4_PLR1_SU0_SUM0_SUS0_SKXCCM8_VWA4_VWB4_WGM8_WGMXCC1_WGMXCCGn1
    SolutionIndex: 52
    SolutionNameMin: Cijk_Ailk_Bljk_I8BH_UserArgs_MT64x128x64_MI16x16x1_SN_CLR1_GSU0_GSUC0_GSUWGMRR0_K1_LBSPPA512_LBSPPB128_LPA32_MIWT2_4_PLR1_SU0_SUM0_SUS0_SKXCCM8_VWA2_VWB1_WGM1_WGMXCC1_WGMXCCGn1
    SolutionIndex: 53
    SolutionNameMin: Cijk_Ailk_Bljk_I8BH_UserArgs_MT64x128x64_MI16x16x1_SN_CLR1_GSU0_GSUC0_GSUWGMRR0_K1_LBSPPA512_LBSPPB256_LPA32_MIWT2_4_PLR1_SU0_SUM0_SUS0_SKXCCM8_VWA2_VWB4_WGM1_WGMXCC1_WGMXCCGn1
    SolutionIndex: 54
    SolutionNameMin: Cijk_Ailk_Bljk_I8BH_UserArgs_MT64x128x64_MI16x16x1_SN_CLR1_GSU0_GSUC0_GSUWGMRR0_K1_LBSPPA512_LBSPPB128_LPA32_MIWT2_4_PLR1_SU0_SUM0_SUS0_SKXCCM8_VWA2_VWB1_WGM1_WGMXCC1_WGMXCCGn1
    SolutionIndex: 55
    SolutionNameMin: Cijk_Ailk_Bljk_I8BH_UserArgs_MT128x64x64_MI16x16x1_SN_CLR1_GSU0_GSUC0_GSUWGMRR0_K1_LBSPPA1024_LBSPPB128_LPA64_MIWT4_2_PLR1_SU0_SUM0_SUS0_SKXCCM8_VWA4_VWB1_WGM1_WGMXCC1_WGMXCCGn1
    SolutionIndex: 56
    SolutionNameMin: Cijk_Ailk_Bljk_I8BH_UserArgs_MT128x64x64_MI16x16x1_SN_CLR1_GSU0_GSUC0_GSUWGMRR0_K1_LBSPPA1024_LBSPPB128_LPA64_MIWT4_2_PLR1_SU0_SUM0_SUS0_SKXCCM8_VWA4_VWB2_WGM1_WGMXCC1_WGMXCCGn1
    SolutionIndex: 57
    SolutionNameMin: Cijk_Ailk_Bljk_I8BH_UserArgs_MT128x64x64_MI16x16x1_SN_CLR1_GSU0_GSUC0_GSUWGMRR0_K1_LBSPPA1024_LBSPPB128_LPA64_MIWT4_2_PLR1_SU0_SUM0_SUS0_SKXCCM8_VWA4_VWB2_WGM1_WGMXCC1_WGMXCCGn1
    SolutionIndex: 58
    SolutionNameMin: Cijk_Ailk_Bljk_I8BH_UserArgs_MT128x64x64_MI16x16x1_SN_CLR1_GSU0_GSUC0_GSUWGMRR0_K1_LBSPPA1024_LBSPPB128_LPA64_MIWT4_2_PLR1_SU0_SUM0_SUS0_SKXCCM8_VWA4_VWB2_WGM8_WGMXCC1_WGMXCCGn1
    SolutionIndex: 59
    SolutionNameMin: Cijk_Ailk_Bljk_I8BH_UserArgs_MT128x32x64_MI16x16x1_SN_CLR1_GSU0_GSUC0_GSUWGMRR0_K1_LBSPPA1024_LBSPPB128_LPA64_MIWT4_1_PLR1_SU0_SUM0_SUS0_SKXCCM8_VWA4_VWB1_WGM1_WGMXCC1_WGMXCCGn1
    SolutionIndex: 60
    SolutionNameMin: Cijk_Ailk_Bljk_I8BH_UserArgs_MT64x64x64_MI16x16x1_SN_CLR1_GSU0_GSUC0_GSUWGMRR0_K1_LBSPPA512_LBSPPB128_LPA32_MIWT2_2_PLR1_SU0_SUM0_SUS0_SKXCCM8_VWA2_VWB1_WGM1_WGMXCC1_WGMXCCGn1
    SolutionIndex: 61
    SolutionNameMin: Cijk_Ailk_Bljk_I8BH_UserArgs_MT64x64x64_MI16x16x1_SN_CLR1_GSU0_GSUC0_GSUWGMRR0_K1_LBSPPA512_LBSPPB128_LPA32_MIWT2_2_PLR1_SU0_SUM0_SUS0_SKXCCM8_VWA2_VWB2_WGM1_WGMXCC1_WGMXCCGn1
    SolutionIndex: 62
    SolutionNameMin: Cijk_Ailk_Bljk_I8BH_UserArgs_MT64x64x64_MI16x16x1_SN_CLR1_GSU0_GSUC0_GSUWGMRR0_K1_LBSPPA512_LBSPPB128_LPA32_MIWT2_2_PLR1_SU0_SUM0_SUS0_SKXCCM8_VWA2_VWB1_WGM1_WGMXCC1_WGMXCCGn1
    SolutionIndex: 63
    SolutionNameMin: Cijk_Ailk_Bljk_I8BH_UserArgs_MT64x64x64_MI16x16x1_SN_CLR1_GSU0_GSUC0_GSUWGMRR0_K1_LBSPPA512_LBSPPB128_LPA32_MIWT2_2_PLR1_SU0_SUM0_SUS0_SKXCCM8_VWA2_VWB1_WGM1_WGMXCC1_WGMXCCGn1
    SolutionIndex: 64
    SolutionNameMin: Cijk_Ailk_Bljk_I8BH_UserArgs_MT64x64x64_MI16x16x1_SN_CLR1_GSU0_GSUC0_GSUWGMRR0_K1_LBSPPA512_LBSPPB128_LPA32_MIWT2_2_PLR1_SU0_SUM0_SUS0_SKXCCM8_VWA2_VWB2_WGM1_WGMXCC1_WGMXCCGn1
    SolutionIndex: 65
    SolutionNameMin: Cijk_Ailk_Bljk_I8BH_UserArgs_MT64x64x64_MI16x16x1_SN_CLR1_GSU0_GSUC0_GSUWGMRR0_K1_LBSPPA512_LBSPPB128_LPA32_MIWT2_2_PLR1_SU0_SUM0_SUS0_SKXCCM8_VWA2_VWB2_WGM8_WGMXCC1_WGMXCCGn1
    SolutionIndex: 66
    SolutionNameMin: Cijk_Ailk_Bljk_I8BH_UserArgs_MT32x64x64_MI16x16x1_SN_CLR1_GSU0_GSUC0_GSUWGMRR0_K1_LBSPPA256_LBSPPB128_LPA16_MIWT1_2_PLR1_SU0_SUM0_SUS0_SKXCCM8_VWA1_VWB1_WGM1_WGMXCC1_WGMXCCGn1
    SolutionIndex: 67
    SolutionNameMin: Cijk_Ailk_Bljk_I8BH_UserArgs_MT64x32x64_MI16x16x1_SN_CLR1_GSU0_GSUC0_GSUWGMRR0_K1_LBSPPA512_LBSPPB128_LPA32_MIWT2_1_PLR1_SU0_SUM0_SUS0_SKXCCM8_VWA2_VWB1_WGM1_WGMXCC1_WGMXCCGn1
    SolutionIndex: 68
    SolutionNameMin: Cijk_Ailk_Bljk_I8BH_UserArgs_MT64x32x64_MI16x16x1_SN_CLR1_GSU0_GSUC0_GSUWGMRR0_K1_LBSPPA512_LBSPPB128_LPA32_MIWT2_1_PLR1_SU0_SUM0_SUS0_SKXCCM8_VWA2_VWB1_WGM1_WGMXCC1_WGMXCCGn1
    SolutionIndex: 69
    SolutionNameMin: Cijk_Ailk_Bljk_I8BH_UserArgs_MT64x32x64_MI16x16x1_SN_CLR1_GSU0_GSUC0_GSUWGMRR0_K1_LBSPPA512_LBSPPB128_LPA32_MIWT2_1_PLR1_SU0_SUM0_SUS0_SKXCCM8_VWA2_VWB1_WGM1_WGMXCC1_WGMXCCGn1
    SolutionIndex: 70
    SolutionNameMin: Cijk_Ailk_Bljk_I8BH_UserArgs_MT32x32x64_MI16x16x1_SN_CLR1_GSU0_GSUC0_GSUWGMRR0_K1_LBSPPA256_LBSPPB128_LPA16_MIWT1_1_PLR1_SU0_SUM0_SUS0_SKXCCM8_VWA1_VWB1_WGM1_WGMXCC1_WGMXCCGn1
    SolutionIndex: 71
    SolutionNameMin: Cijk_Ailk_Bljk_I8BH_UserArgs_MT32x32x64_MI16x16x1_SN_CLR1_GSU0_GSUC0_GSUWGMRR0_K1_LBSPPA256_LBSPPB128_LPA16_MIWT1_1_PLR1_SU0_SUM0_SUS0_SKXCCM8_VWA1_VWB1_WGM1_WGMXCC1_WGMXCCGn1
    SolutionIndex: 72
    SolutionNameMin: Cijk_Ailk_Bljk_I8BH_UserArgs_MT32x32x64_MI16x16x1_SN_CLR1_GSU0_GSUC0_GSUWGMRR0_K1_LBSPPA256_LBSPPB128_LPA16_MIWT1_1_PLR1_SU0_SUM0_SUS0_SKXCCM8_VWA1_VWB1_WGM1_WGMXCC1_WGMXCCGn1
    SolutionIndex: 73
    SolutionNameMin: Cijk_Ailk_Bljk_I8BH_UserArgs_MT32x32x64_MI16x16x1_SN_CLR1_GSU0_GSUC0_GSUWGMRR0_K1_LBSPPA256_LBSPPB128_LPA16_MIWT1_1_PLR1_SU0_SUM0_SUS0_SKXCCM8_VWA1_VWB1_WGM1_WGMXCC1_WGMXCCGn1
    SolutionIndex: 74
    SolutionNameMin: Cijk_Ailk_Bljk_I8BH_UserArgs_MT32x32x64_MI16x16x1_SN_CLR1_GSU0_GSUC0_GSUWGMRR0_K1_LBSPPA256_LBSPPB128_LPA16_MIWT1_1_PLR1_SU0_SUM0_SUS0_SKXCCM8_VWA1_VWB1_WGM1_WGMXCC1_WGMXCCGn1
    SolutionIndex: 75
    SolutionNameMin: Cijk_Ailk_Bljk_I8BH_UserArgs_MT32x32x64_MI16x16x1_SN_CLR1_GSU0_GSUC0_GSUWGMRR0_K1_LBSPPA256_LBSPPB128_LPA16_MIWT1_1_PLR1_SU0_SUM0_SUS0_SKXCCM8_VWA1_VWB1_WGM1_WGMXCC1_WGMXCCGn1
    SolutionIndex: 76
    SolutionNameMin: Cijk_Ailk_Bljk_I8BH_UserArgs_MT32x32x64_MI16x16x1_SN_CLR0_GSU0_GSUC0_GSUWGMRR0_K1_LBSPPA256_LBSPPB128_LPA16_MIWT1_1_PLR0_SU0_SUM0_SUS0_SKXCCM8_VWA1_VWB1_WGM1_WGMXCC1_WGMXCCGn1
    SolutionIndex: 77
    SolutionNameMin: Cijk_Ailk_Bljk_I8BH_UserArgs_MT32x32x64_MI16x16x1_SN_CLR1_GSU0_GSUC0_GSUWGMRR0_K1_LBSPPA256_LBSPPB128_LPA16_MIWT1_1_PLR1_SU0_SUM0_SUS0_SKXCCM8_VWA1_VWB1_WGM4_WGMXCC1_WGMXCCGn1
    SolutionIndex: 78
    SolutionNameMin: Cijk_Ailk_Bljk_I8BH_UserArgs_MT32x32x64_MI16x16x1_SN_CLR0_GSU0_GSUC0_GSUWGMRR0_K1_LBSPPA256_LBSPPB128_LPA16_MIWT1_1_PLR0_SU0_SUM0_SUS0_SKXCCM8_VWA1_VWB1_WGM4_WGMXCC1_WGMXCCGn1
    SolutionIndex: 79
    SolutionNameMin: Cijk_Ailk_Bljk_I8BH_UserArgs_MT32x32x64_MI16x16x1_SN_CLR1_GSU0_GSUC0_GSUWGMRR0_K1_LBSPPA256_LBSPPB128_LPA16_MIWT1_1_PLR1_SU0_SUM0_SUS0_SKXCCM8_VWA1_VWB1_WGM8_WGMXCC1_WGMXCCGn1
    SolutionIndex: 80
    SolutionNameMin: Cijk_Ailk_Bljk_I8BH_UserArgs_MT128x256x128_MI16x16x1_SN_CLR1_GSU0_GSUC0_GSUWGMRR0_K1_LBSPPA2048_LBSPPB128_LPA64_MIWT4_8_PLR1_SU0_SUM0_SUS0_SKXCCM8_VWA4_VWB1_WGM1_WGMXCC1_WGMXCCGn1
    SolutionIndex: 81
    SolutionNameMin: Cijk_Ailk_Bljk_I8BH_UserArgs_MT128x256x128_MI16x16x1_SN_CLR1_GSU0_GSUC0_GSUWGMRR0_K1_LBSPPA2048_LBSPPB256_LPA64_MIWT4_8_PLR1_SU0_SUM0_SUS0_SKXCCM8_VWA4_VWB2_WGM1_WGMXCC1_WGMXCCGn1
    SolutionIndex: 82
    SolutionNameMin: Cijk_Ailk_Bljk_I8BH_UserArgs_MT128x256x128_MI16x16x1_SN_CLR1_GSU0_GSUC0_GSUWGMRR0_K1_LBSPPA2048_LBSPPB1024_LPA64_MIWT4_8_PLR1_SU0_SUM0_SUS0_SKXCCM8_VWA4_VWB8_WGM1_WGMXCC1_WGMXCCGn1
    SolutionIndex: 83
    SolutionNameMin: Cijk_Ailk_Bljk_I8BH_UserArgs_MT128x256x128_MI16x16x1_SN_CLR1_GSU0_GSUC0_GSUWGMRR0_K1_LBSPPA2048_LBSPPB256_LPA64_MIWT4_8_PLR1_SU0_SUM0_SUS0_SKXCCM8_VWA4_VWB2_WGM1_WGMXCC1_WGMXCCGn1
    SolutionIndex: 84
    SolutionNameMin: Cijk_Ailk_Bljk_I8BH_UserArgs_MT128x256x128_MI16x16x1_SN_CLR1_GSU0_GSUC0_GSUWGMRR0_K1_LBSPPA2048_LBSPPB512_LPA64_MIWT4_8_PLR1_SU0_SUM0_SUS0_SKXCCM8_VWA4_VWB4_WGM1_WGMXCC1_WGMXCCGn1
    SolutionIndex: 85
    SolutionNameMin: Cijk_Ailk_Bljk_I8BH_UserArgs_MT128x256x128_MI16x16x1_SN_CLR1_GSU0_GSUC0_GSUWGMRR0_K1_LBSPPA2048_LBSPPB1024_LPA64_MIWT4_8_PLR1_SU0_SUM0_SUS0_SKXCCM8_VWA4_VWB8_WGM1_WGMXCC1_WGMXCCGn1
    SolutionIndex: 86
    SolutionNameMin: Cijk_Ailk_Bljk_I8BH_UserArgs_MT128x256x128_MI16x16x1_SN_CLR1_GSU0_GSUC0_GSUWGMRR0_K1_LBSPPA2048_LBSPPB128_LPA64_MIWT4_8_PLR2_SU0_SUM0_SUS0_SKXCCM8_VWA4_VWB1_WGM1_WGMXCC1_WGMXCCGn1
    SolutionIndex: 87
    SolutionNameMin: Cijk_Ailk_Bljk_I8BH_UserArgs_MT128x256x128_MI16x16x1_SN_CLR1_GSU0_GSUC0_GSUWGMRR0_K1_LBSPPA2048_LBSPPB256_LPA64_MIWT4_8_PLR1_SU0_SUM0_SUS0_SKXCCM8_VWA4_VWB2_WGM4_WGMXCC1_WGMXCCGn1
    SolutionIndex: 88
    SolutionNameMin: Cijk_Ailk_Bljk_I8BH_UserArgs_MT128x256x128_MI16x16x1_SN_CLR1_GSU0_GSUC0_GSUWGMRR0_K1_LBSPPA2048_LBSPPB512_LPA64_MIWT4_8_PLR1_SU0_SUM0_SUS0_SKXCCM8_VWA4_VWB4_WGM4_WGMXCC1_WGMXCCGn1
    SolutionIndex: 89
    SolutionNameMin: Cijk_Ailk_Bljk_I8BH_UserArgs_MT128x256x128_MI16x16x1_SN_CLR1_GSU0_GSUC0_GSUWGMRR0_K1_LBSPPA2048_LBSPPB512_LPA64_MIWT4_8_PLR1_SU0_SUM0_SUS0_SKXCCM8_VWA4_VWB4_WGM8_WGMXCC1_WGMXCCGn1
    SolutionIndex: 90
    SolutionNameMin: Cijk_Ailk_Bljk_I8BH_UserArgs_MT128x256x128_MI16x16x1_SN_CLR1_GSU0_GSUC0_GSUWGMRR0_K1_LBSPPA2048_LBSPPB1024_LPA64_MIWT4_8_PLR1_SU0_SUM0_SUS0_SKXCCM8_VWA4_VWB8_WGM8_WGMXCC1_WGMXCCGn1
    SolutionIndex: 91
    SolutionNameMin: Cijk_Ailk_Bljk_I8BH_UserArgs_MT128x256x128_MI16x16x1_SN_CLR1_GSU0_GSUC0_GSUWGMRR0_K1_LBSPPA2048_LBSPPB256_LPA64_MIWT4_8_PLR1_SU0_SUM0_SUS0_SKXCCM8_VWA4_VWB2_WGM8_WGMXCC1_WGMXCCGn1
    SolutionIndex: 92
    SolutionNameMin: Cijk_Ailk_Bljk_I8BH_UserArgs_MT256x128x128_MI16x16x1_SN_CLR1_GSU0_GSUC0_GSUWGMRR0_K1_LBSPPA4096_LBSPPB256_LPA64_MIWT8_4_PLR1_SU0_SUM0_SUS0_SKXCCM8_VWA4_VWB2_WGM1_WGMXCC1_WGMXCCGn1
    SolutionIndex: 93
    SolutionNameMin: Cijk_Ailk_Bljk_I8BH_UserArgs_MT256x128x128_MI16x16x1_SN_CLR1_GSU0_GSUC0_GSUWGMRR0_K1_LBSPPA4096_LBSPPB128_LPA64_MIWT8_4_PLR1_SU0_SUM0_SUS0_SKXCCM8_VWA4_VWB1_WGM4_WGMXCC1_WGMXCCGn1
    SolutionIndex: 94
    SolutionNameMin: Cijk_Ailk_Bljk_I8BH_UserArgs_MT256x128x128_MI16x16x1_SN_CLR1_GSU0_GSUC0_GSUWGMRR0_K1_LBSPPA4096_LBSPPB256_LPA0_MIWT8_4_PLR1_SU0_SUM0_SUS0_SKXCCM8_VWA8_VWB2_WGM4_WGMXCC1_WGMXCCGn1
    SolutionIndex: 95
    SolutionNameMin: Cijk_Ailk_Bljk_I8BH_UserArgs_MT256x128x128_MI16x16x1_SN_CLR1_GSU0_GSUC0_GSUWGMRR0_K1_LBSPPA4096_LBSPPB128_LPA0_MIWT8_4_PLR1_SU0_SUM0_SUS0_SKXCCM8_VWA8_VWB1_WGM8_WGMXCC1_WGMXCCGn1
    SolutionIndex: 96
    SolutionNameMin: Cijk_Ailk_Bljk_I8BH_UserArgs_MT256x128x128_MI16x16x1_SN_CLR1_GSU0_GSUC0_GSUWGMRR0_K1_LBSPPA4096_LBSPPB256_LPA64_MIWT8_4_PLR1_SU0_SUM0_SUS0_SKXCCM8_VWA4_VWB2_WGM8_WGMXCC1_WGMXCCGn1
    SolutionIndex: 97
    SolutionNameMin: Cijk_Ailk_Bljk_I8BH_UserArgs_MT256x128x128_MI16x16x1_SN_CLR1_GSU0_GSUC0_GSUWGMRR0_K1_LBSPPA4096_LBSPPB128_LPA64_MIWT8_4_PLR1_SU0_SUM0_SUS0_SKXCCM8_VWA4_VWB1_WGM8_WGMXCC1_WGMXCCGn1
    SolutionIndex: 98
    SolutionNameMin: Cijk_Ailk_Bljk_I8BH_UserArgs_MT128x128x128_MI16x16x1_SN_CLR1_GSU0_GSUC0_GSUWGMRR0_K1_LBSPPA2048_LBSPPB128_LPA64_MIWT4_4_PLR1_SU0_SUM0_SUS0_SKXCCM8_VWA4_VWB1_WGM1_WGMXCC1_WGMXCCGn1
    SolutionIndex: 99
    SolutionNameMin: Cijk_Ailk_Bljk_I8BH_UserArgs_MT128x128x128_MI16x16x1_SN_CLR1_GSU0_GSUC0_GSUWGMRR0_K1_LBSPPA2048_LBSPPB256_LPA64_MIWT4_4_PLR1_SU0_SUM0_SUS0_SKXCCM8_VWA4_VWB2_WGM1_WGMXCC1_WGMXCCGn1
    SolutionIndex: 100
    SolutionNameMin: Cijk_Ailk_Bljk_I8BH_UserArgs_MT128x128x128_MI16x16x1_SN_CLR1_GSU0_GSUC0_GSUWGMRR0_K1_LBSPPA2048_LBSPPB512_LPA64_MIWT4_4_PLR1_SU0_SUM0_SUS0_SKXCCM8_VWA4_VWB4_WGM1_WGMXCC1_WGMXCCGn1
    SolutionIndex: 101
    SolutionNameMin: Cijk_Ailk_Bljk_I8BH_UserArgs_MT128x128x128_MI16x16x1_SN_CLR1_GSU0_GSUC0_GSUWGMRR0_K1_LBSPPA2048_LBSPPB512_LPA64_MIWT4_4_PLR1_SU0_SUM0_SUS0_SKXCCM8_VWA4_VWB4_WGM1_WGMXCC1_WGMXCCGn1
    SolutionIndex: 102
    SolutionNameMin: Cijk_Ailk_Bljk_I8BH_UserArgs_MT128x128x128_MI16x16x1_SN_CLR1_GSU0_GSUC0_GSUWGMRR0_K1_LBSPPA2048_LBSPPB256_LPA64_MIWT4_4_PLR2_SU0_SUM0_SUS0_SKXCCM8_VWA4_VWB2_WGM1_WGMXCC1_WGMXCCGn1
    SolutionIndex: 103
    SolutionNameMin: Cijk_Ailk_Bljk_I8BH_UserArgs_MT128x128x128_MI16x16x1_SN_CLR1_GSU0_GSUC0_GSUWGMRR0_K1_LBSPPA2048_LBSPPB256_LPA64_MIWT4_4_PLR1_SU0_SUM0_SUS0_SKXCCM8_VWA4_VWB2_WGM4_WGMXCC1_WGMXCCGn1
    SolutionIndex: 104
    SolutionNameMin: Cijk_Ailk_Bljk_I8BH_UserArgs_MT128x128x128_MI16x16x1_SN_CLR1_GSU0_GSUC0_GSUWGMRR0_K1_LBSPPA2048_LBSPPB512_LPA64_MIWT4_4_PLR1_SU0_SUM0_SUS0_SKXCCM8_VWA4_VWB4_WGM4_WGMXCC1_WGMXCCGn1
    SolutionIndex: 105
    SolutionNameMin: Cijk_Ailk_Bljk_I8BH_UserArgs_MT128x128x128_MI16x16x1_SN_CLR1_GSU0_GSUC0_GSUWGMRR0_K1_LBSPPA2048_LBSPPB128_LPA64_MIWT4_4_PLR1_SU0_SUM0_SUS0_SKXCCM8_VWA4_VWB1_WGM4_WGMXCC1_WGMXCCGn1
    SolutionIndex: 106
    SolutionNameMin: Cijk_Ailk_Bljk_I8BH_UserArgs_MT128x128x128_MI16x16x1_SN_CLR1_GSU0_GSUC0_GSUWGMRR0_K1_LBSPPA2048_LBSPPB256_LPA64_MIWT4_4_PLR1_SU0_SUM0_SUS0_SKXCCM8_VWA4_VWB2_WGM4_WGMXCC1_WGMXCCGn1
    SolutionIndex: 107
    SolutionNameMin: Cijk_Ailk_Bljk_I8BH_UserArgs_MT128x128x128_MI16x16x1_SN_CLR1_GSU0_GSUC0_GSUWGMRR0_K1_LBSPPA2048_LBSPPB512_LPA64_MIWT4_4_PLR1_SU0_SUM0_SUS0_SKXCCM8_VWA4_VWB4_WGM4_WGMXCC1_WGMXCCGn1
    SolutionIndex: 108
    SolutionNameMin: Cijk_Ailk_Bljk_I8BH_UserArgs_MT128x128x128_MI16x16x1_SN_CLR1_GSU0_GSUC0_GSUWGMRR0_K1_LBSPPA2048_LBSPPB128_LPA64_MIWT4_4_PLR1_SU0_SUM0_SUS0_SKXCCM8_VWA4_VWB1_WGM8_WGMXCC1_WGMXCCGn1
    SolutionIndex: 109
    SolutionNameMin: Cijk_Ailk_Bljk_I8BH_UserArgs_MT128x128x128_MI16x16x1_SN_CLR1_GSU0_GSUC0_GSUWGMRR0_K1_LBSPPA2048_LBSPPB256_LPA64_MIWT4_4_PLR1_SU0_SUM0_SUS0_SKXCCM8_VWA4_VWB2_WGM8_WGMXCC1_WGMXCCGn1
    SolutionIndex: 110
    SolutionNameMin: Cijk_Ailk_Bljk_I8BH_UserArgs_MT128x128x128_MI16x16x1_SN_CLR1_GSU0_GSUC0_GSUWGMRR0_K1_LBSPPA2048_LBSPPB512_LPA64_MIWT4_4_PLR1_SU0_SUM0_SUS0_SKXCCM8_VWA4_VWB4_WGM8_WGMXCC1_WGMXCCGn1
    SolutionIndex: 111
    SolutionNameMin: Cijk_Ailk_Bljk_I8BH_UserArgs_MT128x128x128_MI16x16x1_SN_CLR1_GSU0_GSUC0_GSUWGMRR0_K1_LBSPPA2048_LBSPPB512_LPA64_MIWT4_4_PLR1_SU0_SUM0_SUS0_SKXCCM8_VWA4_VWB4_WGM8_WGMXCC1_WGMXCCGn1
    SolutionIndex: 112
    SolutionNameMin: Cijk_Ailk_Bljk_I8BH_UserArgs_MT128x128x128_MI16x16x1_SN_CLR1_GSU0_GSUC0_GSUWGMRR0_K1_LBSPPA2048_LBSPPB512_LPA64_MIWT4_4_PLR2_SU0_SUM0_SUS0_SKXCCM8_VWA4_VWB4_WGM8_WGMXCC1_WGMXCCGn1
    SolutionIndex: 113
    SolutionNameMin: Cijk_Ailk_Bljk_I8BH_UserArgs_MT64x128x128_MI16x16x1_SN_CLR1_GSU0_GSUC0_GSUWGMRR0_K1_LBSPPA1024_LBSPPB256_LPA32_MIWT2_4_PLR1_SU0_SUM0_SUS0_SKXCCM8_VWA2_VWB2_WGM1_WGMXCC1_WGMXCCGn1
    SolutionIndex: 114
    SolutionNameMin: Cijk_Ailk_Bljk_I8BH_UserArgs_MT64x128x128_MI16x16x1_SN_CLR1_GSU0_GSUC0_GSUWGMRR0_K1_LBSPPA1024_LBSPPB512_LPA32_MIWT2_4_PLR1_SU0_SUM0_SUS0_SKXCCM8_VWA2_VWB4_WGM1_WGMXCC1_WGMXCCGn1
    SolutionIndex: 115
    SolutionNameMin: Cijk_Ailk_Bljk_I8BH_UserArgs_MT128x64x128_MI16x16x1_SN_CLR1_GSU0_GSUC0_GSUWGMRR0_K1_LBSPPA2048_LBSPPB128_LPA64_MIWT4_2_PLR1_SU0_SUM0_SUS0_SKXCCM8_VWA4_VWB1_WGM1_WGMXCC1_WGMXCCGn1
    SolutionIndex: 116
    SolutionNameMin: Cijk_Ailk_Bljk_I8BH_UserArgs_MT128x64x128_MI16x16x1_SN_CLR1_GSU0_GSUC0_GSUWGMRR0_K1_LBSPPA2048_LBSPPB256_LPA64_MIWT4_2_PLR1_SU0_SUM0_SUS0_SKXCCM8_VWA4_VWB2_WGM1_WGMXCC1_WGMXCCGn1
    SolutionIndex: 117
    SolutionNameMin: Cijk_Ailk_Bljk_I8BH_UserArgs_MT128x64x128_MI16x16x1_SN_CLR1_GSU0_GSUC0_GSUWGMRR0_K1_LBSPPA2048_LBSPPB128_LPA64_MIWT4_2_PLR2_SU0_SUM0_SUS0_SKXCCM8_VWA4_VWB1_WGM1_WGMXCC1_WGMXCCGn1
    SolutionIndex: 118
    SolutionNameMin: Cijk_Ailk_Bljk_I8BH_UserArgs_MT128x64x128_MI16x16x1_SN_CLR1_GSU0_GSUC0_GSUWGMRR0_K1_LBSPPA2048_LBSPPB128_LPA64_MIWT4_2_PLR1_SU0_SUM0_SUS0_SKXCCM8_VWA4_VWB1_WGM4_WGMXCC1_WGMXCCGn1
    SolutionIndex: 119
    SolutionNameMin: Cijk_Ailk_Bljk_I8BH_UserArgs_MT128x64x128_MI16x16x1_SN_CLR1_GSU0_GSUC0_GSUWGMRR0_K1_LBSPPA2048_LBSPPB256_LPA64_MIWT4_2_PLR1_SU0_SUM0_SUS0_SKXCCM8_VWA4_VWB2_WGM4_WGMXCC1_WGMXCCGn1
    SolutionIndex: 120
    SolutionNameMin: Cijk_Ailk_Bljk_I8BH_UserArgs_MT128x64x128_MI16x16x1_SN_CLR1_GSU0_GSUC0_GSUWGMRR0_K1_LBSPPA2048_LBSPPB128_LPA64_MIWT4_2_PLR1_SU0_SUM0_SUS0_SKXCCM8_VWA4_VWB1_WGM8_WGMXCC1_WGMXCCGn1
    SolutionIndex: 121
    SolutionNameMin: Cijk_Ailk_Bljk_I8BH_UserArgs_MT128x64x128_MI16x16x1_SN_CLR1_GSU0_GSUC0_GSUWGMRR0_K1_LBSPPA2048_LBSPPB256_LPA64_MIWT4_2_PLR1_SU0_SUM0_SUS0_SKXCCM8_VWA4_VWB2_WGM8_WGMXCC1_WGMXCCGn1
    SolutionIndex: 122
    SolutionNameMin: Cijk_Ailk_Bljk_I8BH_UserArgs_MT128x32x128_MI16x16x1_SN_CLR1_GSU0_GSUC0_GSUWGMRR0_K1_LBSPPA2048_LBSPPB128_LPA64_MIWT4_1_PLR1_SU0_SUM0_SUS0_SKXCCM8_VWA4_VWB1_WGM1_WGMXCC1_WGMXCCGn1
    SolutionIndex: 123
    SolutionNameMin: Cijk_Ailk_Bljk_I8BH_UserArgs_MT64x64x128_MI16x16x1_SN_CLR1_GSU0_GSUC0_GSUWGMRR0_K1_LBSPPA1024_LBSPPB128_LPA32_MIWT2_2_PLR1_SU0_SUM0_SUS0_SKXCCM8_VWA2_VWB1_WGM1_WGMXCC1_WGMXCCGn1
    SolutionIndex: 124
    SolutionNameMin: Cijk_Ailk_Bljk_I8BH_UserArgs_MT64x64x128_MI16x16x1_SN_CLR1_GSU0_GSUC0_GSUWGMRR0_K1_LBSPPA1024_LBSPPB256_LPA32_MIWT2_2_PLR1_SU0_SUM0_SUS0_SKXCCM8_VWA2_VWB2_WGM1_WGMXCC1_WGMXCCGn1
    SolutionIndex: 125
    SolutionNameMin: Cijk_Ailk_Bljk_I8BH_UserArgs_MT64x64x128_MI16x16x1_SN_CLR1_GSU0_GSUC0_GSUWGMRR0_K1_LBSPPA1024_LBSPPB128_LPA32_MIWT2_2_PLR1_SU0_SUM0_SUS0_SKXCCM8_VWA2_VWB1_WGM1_WGMXCC1_WGMXCCGn1
    SolutionIndex: 126
    SolutionNameMin: Cijk_Ailk_Bljk_I8BH_UserArgs_MT64x64x128_MI16x16x1_SN_CLR1_GSU0_GSUC0_GSUWGMRR0_K1_LBSPPA1024_LBSPPB256_LPA32_MIWT2_2_PLR1_SU0_SUM0_SUS0_SKXCCM8_VWA2_VWB2_WGM4_WGMXCC1_WGMXCCGn1
    SolutionIndex: 127
    SolutionNameMin: Cijk_Ailk_Bljk_I8BH_UserArgs_MT64x64x128_MI16x16x1_SN_CLR1_GSU0_GSUC0_GSUWGMRR0_K1_LBSPPA1024_LBSPPB128_LPA32_MIWT2_2_PLR1_SU0_SUM0_SUS0_SKXCCM8_VWA2_VWB1_WGM8_WGMXCC1_WGMXCCGn1
    SolutionIndex: 128
    SolutionNameMin: Cijk_Ailk_Bljk_I8BH_UserArgs_MT32x64x128_MI16x16x1_SN_CLR1_GSU0_GSUC0_GSUWGMRR0_K1_LBSPPA512_LBSPPB128_LPA16_MIWT1_2_PLR1_SU0_SUM0_SUS0_SKXCCM8_VWA1_VWB1_WGM1_WGMXCC1_WGMXCCGn1
    SolutionIndex: 129
    SolutionNameMin: Cijk_Ailk_Bljk_I8BH_UserArgs_MT32x64x128_MI16x16x1_SN_CLR1_GSU0_GSUC0_GSUWGMRR0_K1_LBSPPA512_LBSPPB256_LPA16_MIWT1_2_PLR1_SU0_SUM0_SUS0_SKXCCM8_VWA1_VWB2_WGM1_WGMXCC1_WGMXCCGn1
    SolutionIndex: 130
    SolutionNameMin: Cijk_Ailk_Bljk_I8BH_UserArgs_MT32x64x128_MI16x16x1_SN_CLR1_GSU0_GSUC0_GSUWGMRR0_K1_LBSPPA512_LBSPPB128_LPA16_MIWT1_2_PLR1_SU0_SUM0_SUS0_SKXCCM8_VWA1_VWB1_WGM1_WGMXCC1_WGMXCCGn1
    SolutionIndex: 131
    SolutionNameMin: Cijk_Ailk_Bljk_I8BH_UserArgs_MT32x64x128_MI16x16x1_SN_CLR1_GSU0_GSUC0_GSUWGMRR0_K1_LBSPPA512_LBSPPB256_LPA16_MIWT1_2_PLR1_SU0_SUM0_SUS0_SKXCCM8_VWA1_VWB2_WGM1_WGMXCC1_WGMXCCGn1
    SolutionIndex: 132
    SolutionNameMin: Cijk_Ailk_Bljk_I8BH_UserArgs_MT32x64x128_MI16x16x1_SN_CLR1_GSU0_GSUC0_GSUWGMRR0_K1_LBSPPA512_LBSPPB256_LPA16_MIWT1_2_PLR1_SU0_SUM0_SUS0_SKXCCM8_VWA1_VWB2_WGM4_WGMXCC1_WGMXCCGn1
    SolutionIndex: 133
    SolutionNameMin: Cijk_Ailk_Bljk_I8BH_UserArgs_MT64x32x128_MI16x16x1_SN_CLR1_GSU0_GSUC0_GSUWGMRR0_K1_LBSPPA1024_LBSPPB128_LPA32_MIWT2_1_PLR1_SU0_SUM0_SUS0_SKXCCM8_VWA2_VWB1_WGM1_WGMXCC1_WGMXCCGn1
    SolutionIndex: 134
    SolutionNameMin: Cijk_Ailk_Bljk_I8BH_UserArgs_MT64x32x128_MI16x16x1_SN_CLR1_GSU0_GSUC0_GSUWGMRR0_K1_LBSPPA1024_LBSPPB128_LPA32_MIWT2_1_PLR1_SU0_SUM0_SUS0_SKXCCM8_VWA2_VWB1_WGM1_WGMXCC1_WGMXCCGn1
    SolutionIndex: 135
    SolutionNameMin: Cijk_Ailk_Bljk_I8BH_UserArgs_MT64x32x128_MI16x16x1_SN_CLR1_GSU0_GSUC0_GSUWGMRR0_K1_LBSPPA1024_LBSPPB128_LPA32_MIWT2_1_PLR1_SU0_SUM0_SUS0_SKXCCM8_VWA2_VWB1_WGM1_WGMXCC1_WGMXCCGn1
    SolutionIndex: 136
    SolutionNameMin: Cijk_Ailk_Bljk_I8BH_UserArgs_MT64x32x128_MI16x16x1_SN_CLR1_GSU0_GSUC0_GSUWGMRR0_K1_LBSPPA1024_LBSPPB128_LPA32_MIWT2_1_PLR1_SU0_SUM0_SUS0_SKXCCM8_VWA2_VWB1_WGM4_WGMXCC1_WGMXCCGn1
    SolutionIndex: 137
    SolutionNameMin: Cijk_Ailk_Bljk_I8BH_UserArgs_MT64x32x128_MI16x16x1_SN_CLR1_GSU0_GSUC0_GSUWGMRR0_K1_LBSPPA1024_LBSPPB128_LPA32_MIWT2_1_PLR1_SU0_SUM0_SUS0_SKXCCM8_VWA2_VWB1_WGM4_WGMXCC1_WGMXCCGn1
    SolutionIndex: 138
    SolutionNameMin: Cijk_Ailk_Bljk_I8BH_UserArgs_MT64x32x128_MI16x16x1_SN_CLR1_GSU0_GSUC0_GSUWGMRR0_K1_LBSPPA1024_LBSPPB128_LPA32_MIWT2_1_PLR1_SU0_SUM0_SUS0_SKXCCM8_VWA2_VWB1_WGM8_WGMXCC1_WGMXCCGn1
    SolutionIndex: 139
    SolutionNameMin: Cijk_Ailk_Bljk_I8BH_UserArgs_MT32x32x128_MI16x16x1_SN_CLR1_GSU0_GSUC0_GSUWGMRR0_K1_LBSPPA512_LBSPPB128_LPA16_MIWT1_1_PLR1_SU0_SUM0_SUS0_SKXCCM8_VWA1_VWB1_WGM1_WGMXCC1_WGMXCCGn1
    SolutionIndex: 140
    SolutionNameMin: Cijk_Ailk_Bljk_I8BH_UserArgs_MT32x32x128_MI16x16x1_SN_CLR1_GSU0_GSUC0_GSUWGMRR0_K1_LBSPPA512_LBSPPB128_LPA16_MIWT1_1_PLR1_SU0_SUM0_SUS0_SKXCCM8_VWA1_VWB1_WGM1_WGMXCC1_WGMXCCGn1
    SolutionIndex: 141
    SolutionNameMin: Cijk_Ailk_Bljk_I8BH_UserArgs_MT32x32x128_MI16x16x1_SN_CLR1_GSU0_GSUC0_GSUWGMRR0_K1_LBSPPA512_LBSPPB128_LPA16_MIWT1_1_PLR1_SU0_SUM0_SUS0_SKXCCM8_VWA1_VWB1_WGM1_WGMXCC1_WGMXCCGn1
    SolutionIndex: 142
    SolutionNameMin: Cijk_Ailk_Bljk_I8BH_UserArgs_MT32x32x128_MI16x16x1_SN_CLR1_GSU0_GSUC0_GSUWGMRR0_K1_LBSPPA512_LBSPPB128_LPA16_MIWT1_1_PLR2_SU0_SUM0_SUS0_SKXCCM8_VWA1_VWB1_WGM1_WGMXCC1_WGMXCCGn1
    SolutionIndex: 143
    SolutionNameMin: Cijk_Ailk_Bljk_I8BH_UserArgs_MT32x32x128_MI16x16x1_SN_CLR1_GSU0_GSUC0_GSUWGMRR0_K1_LBSPPA512_LBSPPB128_LPA16_MIWT1_1_PLR1_SU0_SUM0_SUS0_SKXCCM8_VWA1_VWB1_WGM8_WGMXCC1_WGMXCCGn1
    SolutionIndex: 144
    SolutionNameMin: Cijk_Ailk_Bljk_I8BH_UserArgs_MT32x32x128_MI16x16x1_SN_CLR1_GSU0_GSUC0_GSUWGMRR0_K1_LBSPPA512_LBSPPB128_LPA16_MIWT1_1_PLR1_SU0_SUM0_SUS0_SKXCCM8_VWA1_VWB1_WGM8_WGMXCC1_WGMXCCGn1
    SolutionIndex: 145
    SolutionNameMin: Cijk_Ailk_Bljk_I8BH_UserArgs_MT64x64x256_MI16x16x1_SN_CLR1_GSU0_GSUC0_GSUWGMRR0_K1_LBSPPA1024_LBSPPB256_LPA32_MIWT2_2_PLR2_SU0_SUM0_SUS0_SKXCCM8_VWA2_VWB1_WGM1_WGMXCC1_WGMXCCGn1
    SolutionIndex: 146
    SolutionNameMin: Cijk_Ailk_Bljk_I8BH_UserArgs_MT64x64x256_MI16x16x1_SN_CLR1_GSU0_GSUC0_GSUWGMRR0_K1_LBSPPA1024_LBSPPB512_LPA32_MIWT2_2_PLR2_SU0_SUM0_SUS0_SKXCCM8_VWA2_VWB2_WGM1_WGMXCC1_WGMXCCGn1
    SolutionIndex: 147
    SolutionNameMin: Cijk_Ailk_Bljk_I8BH_UserArgs_MT32x32x256_MI16x16x1_SN_CLR1_GSU0_GSUC0_GSUWGMRR0_K1_LBSPPA512_LBSPPB256_LPA16_MIWT1_1_PLR1_SU0_SUM0_SUS0_SKXCCM8_VWA1_VWB1_WGM1_WGMXCC1_WGMXCCGn1
    SolutionIndex: 148
    SolutionNameMin: Cijk_Ailk_Bljk_I8BH_UserArgs_MT32x32x256_MI16x16x1_SN_CLR1_GSU0_GSUC0_GSUWGMRR0_K1_LBSPPA512_LBSPPB256_LPA16_MIWT1_1_PLR1_SU0_SUM0_SUS0_SKXCCM8_VWA1_VWB1_WGM1_WGMXCC1_WGMXCCGn1
    SolutionIndex: 149
    SolutionNameMin: Cijk_Ailk_Bljk_I8BH_UserArgs_MT32x32x256_MI16x16x1_SN_CLR1_GSU0_GSUC0_GSUWGMRR0_K1_LBSPPA512_LBSPPB256_LPA16_MIWT1_1_PLR2_SU0_SUM0_SUS0_SKXCCM8_VWA1_VWB1_WGM1_WGMXCC1_WGMXCCGn1
    SolutionIndex: 150
    SolutionNameMin: Cijk_Ailk_Bljk_I8BH_UserArgs_MT32x32x32_MI16x16x1_SN_CLR0_GSU0_GSUC0_GSUWGMRR0_K1_LBSPPA256_LBSPPB128_LPA16_MIWT1_1_PLR0_SU32_SUM0_SUS256_SKXCCM8_VWA1_VWB1_WGM1_WGMXCC1_WGMXCCGn1
- - - [128, 128, 1, 128, 128, 128, 128, 128]
    - [139, 0.57]
  - - [128, 128, 1, 256, 128, 128, 128, 256]
    - [11, 0.97]
  - - [128, 128, 1, 512, 128, 128, 128, 512]
    - [141, 1.78]
  - - [128, 128, 1, 1024, 128, 128, 128, 1024]
    - [141, 2.74]
  - - [128, 128, 1, 2048, 128, 128, 128, 2048]
    - [140, 3.89]
  - - [128, 128, 1, 4096, 128, 128, 128, 4096]
    - [76, 6.71]
  - - [128, 128, 1, 8192, 128, 128, 128, 8192]
    - [139, 10.65]
  - - [128, 256, 1, 128, 128, 128, 128, 128]
    - [74, 1.14]
  - - [128, 256, 1, 256, 128, 128, 128, 256]
    - [141, 2.08]
  - - [128, 256, 1, 512, 128, 128, 128, 512]
    - [140, 3.56]
  - - [128, 256, 1, 1024, 128, 128, 128, 1024]
    - [141, 5.36]
  - - [128, 256, 1, 2048, 128, 128, 128, 2048]
    - [140, 7.97]
  - - [128, 256, 1, 4096, 128, 128, 128, 4096]
    - [76, 13.07]
  - - [128, 256, 1, 8192, 128, 128, 128, 8192]
    - [141, 21.37]
  - - [128, 512, 1, 128, 128, 128, 128, 128]
    - [139, 2.23]
  - - [128, 512, 1, 256, 128, 128, 128, 256]
    - [140, 4.07]
  - - [128, 512, 1, 512, 128, 128, 128, 512]
    - [141, 7.0]
  - - [128, 512, 1, 1024, 128, 128, 128, 1024]
    - [139, 10.85]
  - - [128, 512, 1, 2048, 128, 128, 128, 2048]
    - [140, 15.31]
  - - [128, 512, 1, 4096, 128, 128, 128, 4096]
    - [72, 24.91]
  - - [128, 512, 1, 8192, 128, 128, 128, 8192]
    - [140, 41.49]
  - - [128, 1024, 1, 128, 128, 128, 128, 128]
    - [74, 4.44]
  - - [128, 1024, 1, 256, 128, 128, 128, 256]
    - [75, 8.04]
  - - [128, 1024, 1, 512, 128, 128, 128, 512]
    - [141, 13.81]
  - - [128, 1024, 1, 1024, 128, 128, 128, 1024]
    - [141, 21.43]
  - - [128, 1024, 1, 2048, 128, 128, 128, 2048]
    - [149, 29.6]
  - - [128, 1024, 1, 4096, 128, 128, 128, 4096]
    - [147, 44.73]
  - - [128, 1024, 1, 8192, 128, 128, 128, 8192]
    - [128, 72.4]
  - - [128, 2048, 1, 128, 128, 128, 128, 128]
    - [141, 8.51]
  - - [128, 2048, 1, 256, 128, 128, 128, 256]
    - [71, 15.63]
  - - [128, 2048, 1, 512, 128, 128, 128, 512]
    - [140, 26.31]
  - - [128, 2048, 1, 1024, 128, 128, 128, 1024]
    - [141, 40.43]
  - - [128, 2048, 1, 2048, 128, 128, 128, 2048]
    - [141, 58.43]
  - - [128, 2048, 1, 4096, 128, 128, 128, 4096]
    - [128, 80.85]
  - - [128, 2048, 1, 8192, 128, 128, 128, 8192]
    - [124, 111.27]
  - - [128, 4096, 1, 128, 128, 128, 128, 128]
    - [69, 16.19]
  - - [128, 4096, 1, 256, 128, 128, 128, 256]
    - [135, 28.71]
  - - [128, 4096, 1, 512, 128, 128, 128, 512]
    - [134, 49.17]
  - - [128, 4096, 1, 1024, 128, 128, 128, 1024]
    - [131, 75.53]
  - - [128, 4096, 1, 2048, 128, 128, 128, 2048]
    - [128, 103.18]
  - - [128, 4096, 1, 4096, 128, 128, 128, 4096]
    - [145, 132.31]
  - - [128, 4096, 1, 8192, 128, 128, 128, 8192]
    - [115, 168.9]
  - - [128, 8192, 1, 128, 128, 128, 128, 128]
    - [62, 29.44]
  - - [128, 8192, 1, 256, 128, 128, 128, 256]
    - [62, 52.04]
  - - [128, 8192, 1, 512, 128, 128, 128, 512]
    - [123, 83.51]
  - - [128, 8192, 1, 1024, 128, 128, 128, 1024]
    - [124, 123.01]
  - - [128, 8192, 1, 2048, 128, 128, 128, 2048]
    - [145, 169.81]
  - - [128, 8192, 1, 4096, 128, 128, 128, 4096]
    - [124, 182.8]
  - - [128, 8192, 1, 8192, 128, 128, 128, 8192]
    - [109, 234.91]
  - - [256, 128, 1, 128, 256, 256, 256, 128]
    - [77, 1.01]
  - - [256, 128, 1, 256, 256, 256, 256, 256]
    - [78, 1.87]
  - - [256, 128, 1, 512, 256, 256, 256, 512]
    - [140, 3.44]
  - - [256, 128, 1, 1024, 256, 256, 256, 1024]
    - [139, 5.37]
  - - [256, 128, 1, 2048, 256, 256, 256, 2048]
    - [141, 7.82]
  - - [256, 128, 1, 4096, 256, 256, 256, 4096]
    - [75, 12.94]
  - - [256, 128, 1, 8192, 256, 256, 256, 8192]
    - [141, 21.04]
  - - [256, 256, 1, 128, 256, 256, 256, 128]
    - [12, 1.92]
  - - [256, 256, 1, 256, 256, 256, 256, 256]
    - [148, 3.91]
  - - [256, 256, 1, 512, 256, 256, 256, 512]
    - [140, 6.95]
  - - [256, 256, 1, 1024, 256, 256, 256, 1024]
    - [141, 10.75]
  - - [256, 256, 1, 2048, 256, 256, 256, 2048]
    - [141, 15.14]
  - - [256, 256, 1, 4096, 256, 256, 256, 4096]
    - [75, 24.9]
  - - [256, 256, 1, 8192, 256, 256, 256, 8192]
    - [141, 40.59]
  - - [256, 512, 1, 128, 256, 256, 256, 128]
    - [13, 4.02]
  - - [256, 512, 1, 256, 256, 256, 256, 256]
    - [79, 7.55]
  - - [256, 512, 1, 512, 256, 256, 256, 512]
    - [140, 13.25]
  - - [256, 512, 1, 1024, 256, 256, 256, 1024]
    - [141, 20.92]
  - - [256, 512, 1, 2048, 256, 256, 256, 2048]
    - [141, 29.04]
  - - [256, 512, 1, 4096, 256, 256, 256, 4096]
    - [141, 44.58]
  - - [256, 512, 1, 8192, 256, 256, 256, 8192]
    - [129, 72.93]
  - - [256, 1024, 1, 128, 256, 256, 256, 128]
    - [67, 7.82]
  - - [256, 1024, 1, 256, 256, 256, 256, 256]
    - [70, 14.68]
  - - [256, 1024, 1, 512, 256, 256, 256, 512]
    - [140, 25.88]
  - - [256, 1024, 1, 1024, 256, 256, 256, 1024]
    - [141, 40.92]
  - - [256, 1024, 1, 2048, 256, 256, 256, 2048]
    - [141, 57.21]
  - - [256, 1024, 1, 4096, 256, 256, 256, 4096]
    - [128, 80.36]
  - - [256, 1024, 1, 8192, 256, 256, 256, 8192]
    - [127, 112.11]
  - - [256, 2048, 1, 128, 256, 256, 256, 128]
    - [125, 14.77]
  - - [256, 2048, 1, 256, 256, 256, 256, 256]
    - [66, 27.57]
  - - [256, 2048, 1, 512, 256, 256, 256, 512]
    - [130, 47.42]
  - - [256, 2048, 1, 1024, 256, 256, 256, 1024]
    - [128, 75.16]
  - - [256, 2048, 1, 2048, 256, 256, 256, 2048]
    - [128, 103.57]
  - - [256, 2048, 1, 4096, 256, 256, 256, 4096]
    - [146, 133.44]
  - - [256, 2048, 1, 8192, 256, 256, 256, 8192]
    - [116, 176.89]
  - - [256, 4096, 1, 128, 256, 256, 256, 128]
    - [122, 29.21]
  - - [256, 4096, 1, 256, 256, 256, 256, 256]
    - [62, 50.9]
  - - [256, 4096, 1, 512, 256, 256, 256, 512]
    - [64, 83.41]
  - - [256, 4096, 1, 1024, 256, 256, 256, 1024]
    - [124, 124.89]
  - - [256, 4096, 1, 2048, 256, 256, 256, 2048]
    - [124, 167.72]
  - - [256, 4096, 1, 4096, 256, 256, 256, 4096]
    - [146, 207.82]
  - - [256, 4096, 1, 8192, 256, 256, 256, 8192]
    - [99, 249.92]
  - - [256, 8192, 1, 128, 256, 256, 256, 128]
    - [57, 50.24]
  - - [256, 8192, 1, 256, 256, 256, 256, 256]
    - [56, 85.94]
  - - [256, 8192, 1, 512, 256, 256, 256, 512]
    - [52, 138.09]
  - - [256, 8192, 1, 1024, 256, 256, 256, 1024]
    - [52, 199.97]
  - - [256, 8192, 1, 2048, 256, 256, 256, 2048]
    - [113, 252.92]
  - - [256, 8192, 1, 4096, 256, 256, 256, 4096]
    - [103, 254.1]
  - - [256, 8192, 1, 8192, 256, 256, 256, 8192]
    - [111, 299.05]
  - - [512, 128, 1, 128, 512, 512, 512, 128]
    - [139, 2.14]
  - - [512, 128, 1, 256, 512, 512, 512, 256]
    - [140, 4.03]
  - - [512, 128, 1, 512, 512, 512, 512, 512]
    - [140, 6.97]
  - - [512, 128, 1, 1024, 512, 512, 512, 1024]
    - [140, 10.79]
  - - [512, 128, 1, 2048, 512, 512, 512, 2048]
    - [140, 15.41]
  - - [512, 128, 1, 4096, 512, 512, 512, 4096]
    - [75, 24.94]
  - - [512, 128, 1, 8192, 512, 512, 512, 8192]
    - [143, 40.55]
  - - [512, 256, 1, 128, 512, 512, 512, 128]
    - [73, 4.34]
  - - [512, 256, 1, 256, 512, 512, 512, 256]
    - [76, 7.61]
  - - [512, 256, 1, 512, 512, 512, 512, 512]
    - [140, 13.8]
  - - [512, 256, 1, 1024, 512, 512, 512, 1024]
    - [141, 20.73]
  - - [512, 256, 1, 2048, 512, 512, 512, 2048]
    - [140, 29.03]
  - - [512, 256, 1, 4096, 512, 512, 512, 4096]
    - [141, 44.56]
  - - [512, 256, 1, 8192, 512, 512, 512, 8192]
    - [137, 68.37]
  - - [512, 512, 1, 128, 512, 512, 512, 128]
    - [71, 8.68]
  - - [512, 512, 1, 256, 512, 512, 512, 256]
    - [74, 15.64]
  - - [512, 512, 1, 512, 512, 512, 512, 512]
    - [140, 26.61]
  - - [512, 512, 1, 1024, 512, 512, 512, 1024]
    - [141, 41.8]
  - - [512, 512, 1, 2048, 512, 512, 512, 2048]
    - [140, 56.86]
  - - [512, 512, 1, 4096, 512, 512, 512, 4096]
    - [131, 78.85]
  - - [512, 512, 1, 8192, 512, 512, 512, 8192]
    - [126, 106.86]
  - - [512, 1024, 1, 128, 512, 512, 512, 128]
    - [69, 16.28]
  - - [512, 1024, 1, 256, 512, 512, 512, 256]
    - [133, 29.12]
  - - [512, 1024, 1, 512, 512, 512, 512, 512]
    - [135, 48.87]
  - - [512, 1024, 1, 1024, 512, 512, 512, 1024]
    - [134, 74.33]
  - - [512, 1024, 1, 2048, 512, 512, 512, 2048]
    - [128, 99.17]
  - - [512, 1024, 1, 4096, 512, 512, 512, 4096]
    - [145, 130.91]
  - - [512, 1024, 1, 8192, 512, 512, 512, 8192]
    - [115, 165.8]
  - - [512, 2048, 1, 128, 512, 512, 512, 128]
    - [10, 29.4]
  - - [512, 2048, 1, 256, 512, 512, 512, 256]
    - [124, 51.3]
  - - [512, 2048, 1, 512, 512, 512, 512, 512]
    - [124, 82.65]
  - - [512, 2048, 1, 1024, 512, 512, 512, 1024]
    - [124, 123.96]
  - - [512, 2048, 1, 2048, 512, 512, 512, 2048]
    - [124, 163.33]
  - - [512, 2048, 1, 4096, 512, 512, 512, 4096]
    - [145, 199.47]
  - - [512, 2048, 1, 8192, 512, 512, 512, 8192]
    - [104, 244.1]
  - - [512, 4096, 1, 128, 512, 512, 512, 128]
    - [57, 50.35]
  - - [512, 4096, 1, 256, 512, 512, 512, 256]
    - [57, 87.85]
  - - [512, 4096, 1, 512, 512, 512, 512, 512]
    - [52, 140.2]
  - - [512, 4096, 1, 1024, 512, 512, 512, 1024]
    - [53, 195.6]
  - - [512, 4096, 1, 2048, 512, 512, 512, 2048]
    - [114, 251.91]
  - - [512, 4096, 1, 4096, 512, 512, 512, 4096]
    - [101, 254.95]
  - - [512, 4096, 1, 8192, 512, 512, 512, 8192]
    - [85, 290.21]
  - - [512, 8192, 1, 128, 512, 512, 512, 128]
    - [9, 78.37]
  - - [512, 8192, 1, 256, 512, 512, 512, 256]
    - [49, 133.8]
  - - [512, 8192, 1, 512, 512, 512, 512, 512]
    - [48, 210.49]
  - - [512, 8192, 1, 1024, 512, 512, 512, 1024]
    - [49, 289.22]
  - - [512, 8192, 1, 2048, 512, 512, 512, 2048]
    - [99, 344.18]
  - - [512, 8192, 1, 4096, 512, 512, 512, 4096]
    - [106, 351.81]
  - - [512, 8192, 1, 8192, 512, 512, 512, 8192]
    - [88, 347.99]
  - - [1024, 128, 1, 128, 1024, 1024, 1024, 128]
    - [140, 4.39]
  - - [1024, 128, 1, 256, 1024, 1024, 1024, 256]
    - [140, 8.02]
  - - [1024, 128, 1, 512, 1024, 1024, 1024, 512]
    - [140, 13.39]
  - - [1024, 128, 1, 1024, 1024, 1024, 1024, 1024]
    - [141, 20.8]
  - - [1024, 128, 1, 2048, 1024, 1024, 1024, 2048]
    - [141, 28.21]
  - - [1024, 128, 1, 4096, 1024, 1024, 1024, 4096]
    - [144, 43.6]
  - - [1024, 128, 1, 8192, 1024, 1024, 1024, 8192]
    - [136, 64.22]
  - - [1024, 256, 1, 128, 1024, 1024, 1024, 128]
    - [71, 8.71]
  - - [1024, 256, 1, 256, 1024, 1024, 1024, 256]
    - [140, 15.64]
  - - [1024, 256, 1, 512, 1024, 1024, 1024, 512]
    - [140, 26.63]
  - - [1024, 256, 1, 1024, 1024, 1024, 1024, 1024]
    - [141, 40.02]
  - - [1024, 256, 1, 2048, 1024, 1024, 1024, 2048]
    - [141, 57.76]
  - - [1024, 256, 1, 4096, 1024, 1024, 1024, 4096]
    - [132, 78.25]
  - - [1024, 256, 1, 8192, 1024, 1024, 1024, 8192]
    - [124, 103.83]
  - - [1024, 512, 1, 128, 1024, 1024, 1024, 128]
    - [134, 16.21]
  - - [1024, 512, 1, 256, 1024, 1024, 1024, 256]
    - [134, 29.08]
  - - [1024, 512, 1, 512, 1024, 1024, 1024, 512]
    - [138, 47.13]
  - - [1024, 512, 1, 1024, 1024, 1024, 1024, 1024]
    - [128, 73.93]
  - - [1024, 512, 1, 2048, 1024, 1024, 1024, 2048]
    - [128, 100.81]
  - - [1024, 512, 1, 4096, 1024, 1024, 1024, 4096]
    - [55, 119.7]
  - - [1024, 512, 1, 8192, 1024, 1024, 1024, 8192]
    - [121, 166.62]
  - - [1024, 1024, 1, 128, 1024, 1024, 1024, 128]
    - [123, 29.41]
  - - [1024, 1024, 1, 256, 1024, 1024, 1024, 256]
    - [62, 52.05]
  - - [1024, 1024, 1, 512, 1024, 1024, 1024, 512]
    - [63, 83.85]
  - - [1024, 1024, 1, 1024, 1024, 1024, 1024, 1024]
    - [124, 125.15]
  - - [1024, 1024, 1, 2048, 1024, 1024, 1024, 2048]
    - [124, 168.04]
  - - [1024, 1024, 1, 4096, 1024, 1024, 1024, 4096]
    - [116, 172.71]
  - - [1024, 1024, 1, 8192, 1024, 1024, 1024, 8192]
    - [103, 243.5]
  - - [1024, 2048, 1, 128, 1024, 1024, 1024, 128]
    - [56, 50.24]
  - - [1024, 2048, 1, 256, 1024, 1024, 1024, 256]
    - [53, 87.19]
  - - [1024, 2048, 1, 512, 1024, 1024, 1024, 512]
    - [53, 140.29]
  - - [1024, 2048, 1, 1024, 1024, 1024, 1024, 1024]
    - [52, 200.41]
  - - [1024, 2048, 1, 2048, 1024, 1024, 1024, 2048]
    - [114, 249.82]
  - - [1024, 2048, 1, 4096, 1024, 1024, 1024, 4096]
    - [109, 254.63]
  - - [1024, 2048, 1, 8192, 1024, 1024, 1024, 8192]
    - [100, 295.5]
  - - [1024, 4096, 1, 128, 1024, 1024, 1024, 128]
    - [7, 78.34]
  - - [1024, 4096, 1, 256, 1024, 1024, 1024, 256]
    - [48, 134.59]
  - - [1024, 4096, 1, 512, 1024, 1024, 1024, 512]
    - [49, 210.53]
  - - [1024, 4096, 1, 1024, 1024, 1024, 1024, 1024]
    - [100, 288.1]
  - - [1024, 4096, 1, 2048, 1024, 1024, 1024, 2048]
    - [104, 343.16]
  - - [1024, 4096, 1, 4096, 1024, 1024, 1024, 4096]
    - [110, 359.56]
  - - [1024, 4096, 1, 8192, 1024, 1024, 1024, 8192]
    - [90, 343.01]
  - - [1024, 8192, 1, 128, 1024, 1024, 1024, 128]
    - [42, 106.51]
  - - [1024, 8192, 1, 256, 1024, 1024, 1024, 256]
    - [3, 183.95]
  - - [1024, 8192, 1, 512, 1024, 1024, 1024, 512]
    - [83, 274.27]
  - - [1024, 8192, 1, 1024, 1024, 1024, 1024, 1024]
    - [82, 358.92]
  - - [1024, 8192, 1, 2048, 1024, 1024, 1024, 2048]
    - [45, 392.68]
  - - [1024, 8192, 1, 4096, 1024, 1024, 1024, 4096]
    - [94, 444.47]
  - - [1024, 8192, 1, 8192, 1024, 1024, 1024, 8192]
    - [27, 406.77]
  - - [2048, 128, 1, 128, 2048, 2048, 2048, 128]
    - [140, 8.51]
  - - [2048, 128, 1, 256, 2048, 2048, 2048, 256]
    - [140, 15.41]
  - - [2048, 128, 1, 512, 2048, 2048, 2048, 512]
    - [140, 26.54]
  - - [2048, 128, 1, 1024, 2048, 2048, 2048, 1024]
    - [140, 40.99]
  - - [2048, 128, 1, 2048, 2048, 2048, 2048, 2048]
    - [142, 49.38]
  - - [2048, 128, 1, 4096, 2048, 2048, 2048, 4096]
    - [61, 70.31]
  - - [2048, 128, 1, 8192, 2048, 2048, 2048, 8192]
    - [124, 101.46]
  - - [2048, 256, 1, 128, 2048, 2048, 2048, 128]
    - [69, 16.27]
  - - [2048, 256, 1, 256, 2048, 2048, 2048, 256]
    - [134, 29.44]
  - - [2048, 256, 1, 512, 2048, 2048, 2048, 512]
    - [135, 48.7]
  - - [2048, 256, 1, 1024, 2048, 2048, 2048, 1024]
    - [133, 72.48]
  - - [2048, 256, 1, 2048, 2048, 2048, 2048, 2048]
    - [133, 86.53]
  - - [2048, 256, 1, 4096, 2048, 2048, 2048, 4096]
    - [57, 115.91]
  - - [2048, 256, 1, 8192, 2048, 2048, 2048, 8192]
    - [115, 152.28]
  - - [2048, 512, 1, 128, 2048, 2048, 2048, 128]
    - [59, 29.49]
  - - [2048, 512, 1, 256, 2048, 2048, 2048, 256]
    - [62, 51.87]
  - - [2048, 512, 1, 512, 2048, 2048, 2048, 512]
    - [62, 84.4]
  - - [2048, 512, 1, 1024, 2048, 2048, 2048, 1024]
    - [124, 121.88]
  - - [2048, 512, 1, 2048, 2048, 2048, 2048, 2048]
    - [60, 137.41]
  - - [2048, 512, 1, 4096, 2048, 2048, 2048, 4096]
    - [119, 171.62]
  - - [2048, 512, 1, 8192, 2048, 2048, 2048, 8192]
    - [103, 242.33]
  - - [2048, 1024, 1, 128, 2048, 2048, 2048, 128]
    - [57, 50.27]
  - - [2048, 1024, 1, 256, 2048, 2048, 2048, 256]
    - [57, 86.85]
  - - [2048, 1024, 1, 512, 2048, 2048, 2048, 512]
    - [53, 140.45]
  - - [2048, 1024, 1, 1024, 2048, 2048, 2048, 1024]
    - [52, 200.19]
  - - [2048, 1024, 1, 2048, 2048, 2048, 2048, 2048]
    - [58, 224.42]
  - - [2048, 1024, 1, 4096, 2048, 2048, 2048, 4096]
    - [109, 247.86]
  - - [2048, 1024, 1, 8192, 2048, 2048, 2048, 8192]
    - [93, 288.86]
  - - [2048, 2048, 1, 128, 2048, 2048, 2048, 128]
    - [48, 78.4]
  - - [2048, 2048, 1, 256, 2048, 2048, 2048, 256]
    - [48, 135.17]
  - - [2048, 2048, 1, 512, 2048, 2048, 2048, 512]
    - [49, 210.92]
  - - [2048, 2048, 1, 1024, 2048, 2048, 2048, 1024]
    - [98, 286.68]
  - - [2048, 2048, 1, 2048, 2048, 2048, 2048, 2048]
    - [110, 318.42]
  - - [2048, 2048, 1, 4096, 2048, 2048, 2048, 4096]
    - [110, 361.17]
  - - [2048, 2048, 1, 8192, 2048, 2048, 2048, 8192]
    - [81, 370.47]
  - - [2048, 4096, 1, 128, 2048, 2048, 2048, 128]
    - [6, 107.75]
  - - [2048, 4096, 1, 256, 2048, 2048, 2048, 256]
    - [41, 182.44]
  - - [2048, 4096, 1, 512, 2048, 2048, 2048, 512]
    - [85, 273.02]
  - - [2048, 4096, 1, 1024, 2048, 2048, 2048, 1024]
    - [40, 348.39]
  - - [2048, 4096, 1, 2048, 2048, 2048, 2048, 2048]
    - [91, 400.02]
  - - [2048, 4096, 1, 4096, 2048, 2048, 2048, 4096]
    - [87, 453.77]
  - - [2048, 4096, 1, 8192, 2048, 2048, 2048, 8192]
    - [81, 406.44]
  - - [2048, 8192, 1, 128, 2048, 2048, 2048, 128]
    - [1, 138.17]
  - - [2048, 8192, 1, 256, 2048, 2048, 2048, 256]
    - [18, 223.3]
  - - [2048, 8192, 1, 512, 2048, 2048, 2048, 512]
    - [25, 309.62]
  - - [2048, 8192, 1, 1024, 2048, 2048, 2048, 1024]
    - [37, 403.16]
  - - [2048, 8192, 1, 2048, 2048, 2048, 2048, 2048]
    - [39, 491.05]
  - - [2048, 8192, 1, 4096, 2048, 2048, 2048, 4096]
    - [15, 407.24]
  - - [2048, 8192, 1, 8192, 2048, 2048, 2048, 8192]
    - [14, 453.95]
  - - [4096, 128, 1, 128, 4096, 4096, 4096, 128]
    - [68, 15.72]
  - - [4096, 128, 1, 256, 4096, 4096, 4096, 256]
    - [133, 28.59]
  - - [4096, 128, 1, 512, 4096, 4096, 4096, 512]
    - [134, 46.6]
  - - [4096, 128, 1, 1024, 4096, 4096, 4096, 1024]
    - [129, 72.04]
  - - [4096, 128, 1, 2048, 4096, 4096, 4096, 2048]
    - [136, 81.44]
  - - [4096, 128, 1, 4096, 4096, 4096, 4096, 4096]
    - [55, 118.23]
  - - [4096, 128, 1, 8192, 4096, 4096, 4096, 8192]
    - [120, 156.8]
  - - [4096, 256, 1, 128, 4096, 4096, 4096, 128]
    - [59, 29.57]
  - - [4096, 256, 1, 256, 4096, 4096, 4096, 256]
    - [59, 51.37]
  - - [4096, 256, 1, 512, 4096, 4096, 4096, 512]
    - [124, 82.2]
  - - [4096, 256, 1, 1024, 4096, 4096, 4096, 1024]
    - [126, 122.79]
  - - [4096, 256, 1, 2048, 4096, 4096, 4096, 2048]
    - [65, 135.29]
  - - [4096, 256, 1, 4096, 4096, 4096, 4096, 4096]
    - [118, 172.7]
  - - [4096, 256, 1, 8192, 4096, 4096, 4096, 8192]
    - [100, 227.79]
  - - [4096, 512, 1, 128, 4096, 4096, 4096, 128]
    - [57, 50.78]
  - - [4096, 512, 1, 256, 4096, 4096, 4096, 256]
    - [57, 87.8]
  - - [4096, 512, 1, 512, 4096, 4096, 4096, 512]
    - [53, 138.21]
  - - [4096, 512, 1, 1024, 4096, 4096, 4096, 1024]
    - [52, 198.05]
  - - [4096, 512, 1, 2048, 4096, 4096, 4096, 2048]
    - [58, 224.22]
  - - [4096, 512, 1, 4096, 4096, 4096, 4096, 4096]
    - [108, 246.79]
  - - [4096, 512, 1, 8192, 4096, 4096, 4096, 8192]
    - [96, 289.04]
  - - [4096, 1024, 1, 128, 4096, 4096, 4096, 128]
    - [48, 78.23]
  - - [4096, 1024, 1, 256, 4096, 4096, 4096, 256]
    - [48, 134.78]
  - - [4096, 1024, 1, 512, 4096, 4096, 4096, 512]
    - [47, 210.73]
  - - [4096, 1024, 1, 1024, 4096, 4096, 4096, 1024]
    - [107, 275.35]
  - - [4096, 1024, 1, 2048, 4096, 4096, 4096, 2048]
    - [50, 312.45]
  - - [4096, 1024, 1, 4096, 4096, 4096, 4096, 4096]
    - [112, 358.07]
  - - [4096, 1024, 1, 8192, 4096, 4096, 4096, 8192]
    - [86, 366.27]
  - - [4096, 2048, 1, 128, 4096, 4096, 4096, 128]
    - [4, 108.19]
  - - [4096, 2048, 1, 256, 4096, 4096, 4096, 256]
    - [41, 184.25]
  - - [4096, 2048, 1, 512, 4096, 4096, 4096, 512]
    - [40, 264.97]
  - - [4096, 2048, 1, 1024, 4096, 4096, 4096, 1024]
    - [94, 335.11]
  - - [4096, 2048, 1, 2048, 4096, 4096, 4096, 2048]
    - [89, 398.93]
  - - [4096, 2048, 1, 4096, 4096, 4096, 4096, 4096]
    - [87, 451.99]
  - - [4096, 2048, 1, 8192, 4096, 4096, 4096, 8192]
    - [80, 415.93]
  - - [4096, 4096, 1, 128, 4096, 4096, 4096, 128]
    - [0, 139.68]
  - - [4096, 4096, 1, 256, 4096, 4096, 4096, 256]
    - [30, 220.5]
  - - [4096, 4096, 1, 512, 4096, 4096, 4096, 512]
    - [23, 310.67]
  - - [4096, 4096, 1, 1024, 4096, 4096, 4096, 1024]
    - [32, 396.53]
  - - [4096, 4096, 1, 2048, 4096, 4096, 4096, 2048]
    - [34, 493.31]
  - - [4096, 4096, 1, 4096, 4096, 4096, 4096, 4096]
    - [16, 426.63]
  - - [4096, 4096, 1, 8192, 4096, 4096, 4096, 8192]
    - [24, 461.04]
  - - [4096, 8192, 1, 128, 4096, 4096, 4096, 128]
    - [38, 137.63]
  - - [4096, 8192, 1, 256, 4096, 4096, 4096, 256]
    - [98, 187.71]
  - - [4096, 8192, 1, 512, 4096, 4096, 4096, 512]
    - [92, 249.94]
  - - [4096, 8192, 1, 1024, 4096, 4096, 4096, 1024]
    - [24, 319.74]
  - - [4096, 8192, 1, 2048, 4096, 4096, 4096, 2048]
    - [15, 401.74]
  - - [4096, 8192, 1, 4096, 4096, 4096, 4096, 4096]
    - [33, 453.03]
  - - [4096, 8192, 1, 8192, 4096, 4096, 4096, 8192]
    - [15, 498.18]
  - - [8192, 128, 1, 128, 8192, 8192, 8192, 128]
    - [59, 29.66]
  - - [8192, 128, 1, 256, 8192, 8192, 8192, 256]
    - [63, 51.65]
  - - [8192, 128, 1, 512, 8192, 8192, 8192, 512]
    - [124, 85.22]
  - - [8192, 128, 1, 1024, 8192, 8192, 8192, 1024]
    - [124, 124.72]
  - - [8192, 128, 1, 2048, 8192, 8192, 8192, 2048]
    - [65, 136.37]
  - - [8192, 128, 1, 4096, 8192, 8192, 8192, 4096]
    - [121, 171.19]
  - - [8192, 128, 1, 8192, 8192, 8192, 8192, 8192]
    - [98, 225.91]
  - - [8192, 256, 1, 128, 8192, 8192, 8192, 128]
    - [117, 48.62]
  - - [8192, 256, 1, 256, 8192, 8192, 8192, 256]
    - [57, 86.16]
  - - [8192, 256, 1, 512, 8192, 8192, 8192, 512]
    - [54, 135.3]
  - - [8192, 256, 1, 1024, 8192, 8192, 8192, 1024]
    - [52, 199.73]
  - - [8192, 256, 1, 2048, 8192, 8192, 8192, 2048]
    - [58, 218.22]
  - - [8192, 256, 1, 4096, 8192, 8192, 8192, 4096]
    - [112, 248.56]
  - - [8192, 256, 1, 8192, 8192, 8192, 8192, 8192]
    - [48, 286.23]
  - - [8192, 512, 1, 128, 8192, 8192, 8192, 128]
    - [8, 78.78]
  - - [8192, 512, 1, 256, 8192, 8192, 8192, 256]
    - [48, 135.71]
  - - [8192, 512, 1, 512, 8192, 8192, 8192, 512]
    - [47, 209.64]
  - - [8192, 512, 1, 1024, 8192, 8192, 8192, 1024]
    - [51, 278.46]
  - - [8192, 512, 1, 2048, 8192, 8192, 8192, 2048]
    - [109, 311.1]
  - - [8192, 512, 1, 4096, 8192, 8192, 8192, 4096]
    - [105, 351.68]
  - - [8192, 512, 1, 8192, 8192, 8192, 8192, 8192]
    - [84, 368.86]
  - - [8192, 1024, 1, 128, 8192, 8192, 8192, 128]
    - [5, 108.29]
  - - [8192, 1024, 1, 256, 8192, 8192, 8192, 256]
    - [45, 185.09]
  - - [8192, 1024, 1, 512, 8192, 8192, 8192, 512]
    - [84, 265.08]
  - - [8192, 1024, 1, 1024, 8192, 8192, 8192, 1024]
    - [44, 340.76]
  - - [8192, 1024, 1, 2048, 8192, 8192, 8192, 2048]
    - [46, 396.04]
  - - [8192, 1024, 1, 4096, 8192, 8192, 8192, 4096]
    - [87, 458.62]
  - - [8192, 1024, 1, 8192, 8192, 8192, 8192, 8192]
    - [81, 419.32]
  - - [8192, 2048, 1, 128, 8192, 8192, 8192, 128]
    - [2, 135.87]
  - - [8192, 2048, 1, 256, 8192, 8192, 8192, 256]
    - [28, 221.18]
  - - [8192, 2048, 1, 512, 8192, 8192, 8192, 512]
    - [23, 310.38]
  - - [8192, 2048, 1, 1024, 8192, 8192, 8192, 1024]
    - [35, 397.09]
  - - [8192, 2048, 1, 2048, 8192, 8192, 8192, 2048]
    - [36, 488.51]
  - - [8192, 2048, 1, 4096, 8192, 8192, 8192, 4096]
    - [17, 410.33]
  - - [8192, 2048, 1, 8192, 8192, 8192, 8192, 8192]
    - [14, 489.86]
  - - [8192, 4096, 1, 128, 8192, 8192, 8192, 128]
    - [29, 136.23]
  - - [8192, 4096, 1, 256, 8192, 8192, 8192, 256]
    - [102, 178.1]
  - - [8192, 4096, 1, 512, 8192, 8192, 8192, 512]
    - [97, 249.38]
  - - [8192, 4096, 1, 1024, 8192, 8192, 8192, 1024]
    - [20, 323.78]
  - - [8192, 4096, 1, 2048, 8192, 8192, 8192, 2048]
    - [19, 399.89]
  - - [8192, 4096, 1, 4096, 8192, 8192, 8192, 4096]
    - [21, 457.03]
  - - [8192, 4096, 1, 8192, 8192, 8192, 8192, 8192]
    - [14, 502.67]
  - - [8192, 8192, 1, 128, 8192, 8192, 8192, 128]
    - [43, 141.39]
  - - [8192, 8192, 1, 256, 8192, 8192, 8192, 256]
    - [95, 204.92]
  - - [8192, 8192, 1, 512, 8192, 8192, 8192, 512]
    - [22, 267.69]
  - - [8192, 8192, 1, 1024, 8192, 8192, 8192, 1024]
    - [15, 364.38]
  - - [8192, 8192, 1, 2048, 8192, 8192, 8192, 2048]
    - [31, 433.99]
  - - [8192, 8192, 1, 4096, 8192, 8192, 8192, 4096]
    - [22, 510.64]
  - - [8192, 8192, 1, 8192, 8192, 8192, 8192, 8192]
    - [26, 546.22]
  - - [1, 1, 1, 32, 1, 1, 1, 32]
    - [150, 0.0]
- null
- null
- ExperimentalStreamK
- GridBased
