projects/hipblaslt/library/src/amd_detail/rocblaslt/src/Tensile/Logic/asm_full/aquavanjaram/gfx942/StreamK/aquavanjaram942_Cijk_Ailk_Bjlk_I8BH_UserArgs.yaml
- {MinimumRequiredVersion: 4.33.0}
- aquavanjaram942
- gfx942
- [Device 0049, Device 0050]
    SolutionIndex: 0
    SolutionNameMin: Cijk_Ailk_Bjlk_I8BH_UserArgs_MT256x256x32_MI16x16x1_SN_CLR0_GSU0_GSUC0_GSUWGMRR0_K1_LBSPPA2048_LBSPPB2048_LPA64_LPB64_MIWT8_8_PLR0_SU0_SUM0_SUS0_SKXCCM8_VWA4_VWB4_WGM1_WGMXCC1_WGMXCCGn1
    SolutionIndex: 1
    SolutionNameMin: Cijk_Ailk_Bjlk_I8BH_UserArgs_MT256x256x32_MI16x16x1_SN_CLR0_GSU0_GSUC0_GSUWGMRR0_K1_LBSPPA2048_LBSPPB2048_LPA64_LPB64_MIWT8_8_PLR0_SU0_SUM0_SUS0_SKXCCM8_VWA4_VWB4_WGM1_WGMXCC1_WGMXCCGn1
    SolutionIndex: 2
    SolutionNameMin: Cijk_Ailk_Bjlk_I8BH_UserArgs_MT256x256x32_MI16x16x1_SN_CLR0_GSU0_GSUC0_GSUWGMRR0_K1_LBSPPA2048_LBSPPB2048_LPA64_LPB64_MIWT8_8_PLR0_SU0_SUM0_SUS0_SKXCCM8_VWA4_VWB4_WGM1_WGMXCC1_WGMXCCGn1
    SolutionIndex: 3
    SolutionNameMin: Cijk_Ailk_Bjlk_I8BH_UserArgs_MT256x256x32_MI16x16x1_SN_CLR0_GSU0_GSUC0_GSUWGMRR0_K1_LBSPPA2048_LBSPPB2048_LPA64_LPB64_MIWT8_8_PLR0_SU0_SUM0_SUS0_SKXCCM8_VWA4_VWB4_WGM4_WGMXCC1_WGMXCCGn1
    SolutionIndex: 4
    SolutionNameMin: Cijk_Ailk_Bjlk_I8BH_UserArgs_MT256x256x32_MI16x16x1_SN_CLR0_GSU0_GSUC0_GSUWGMRR0_K1_LBSPPA2048_LBSPPB2048_LPA64_LPB64_MIWT8_8_PLR0_SU0_SUM0_SUS0_SKXCCM8_VWA4_VWB4_WGM4_WGMXCC1_WGMXCCGn1
    SolutionIndex: 5
    SolutionNameMin: Cijk_Ailk_Bjlk_I8BH_UserArgs_MT128x256x32_MI16x16x1_SN_CLR0_GSU0_GSUC0_GSUWGMRR0_K1_LBSPPA1024_LBSPPB2048_LPA64_LPB64_MIWT4_8_PLR0_SU0_SUM0_SUS0_SKXCCM8_VWA4_VWB4_WGM4_WGMXCC1_WGMXCCGn1
    SolutionIndex: 6
    SolutionNameMin: Cijk_Ailk_Bjlk_I8BH_UserArgs_MT256x128x32_MI16x16x1_SN_CLR0_GSU0_GSUC0_GSUWGMRR0_K1_LBSPPA2048_LBSPPB1024_LPA64_LPB64_MIWT8_4_PLR0_SU0_SUM0_SUS0_SKXCCM8_VWA4_VWB4_WGM8_WGMXCC1_WGMXCCGn1
    SolutionIndex: 7
    SolutionNameMin: Cijk_Ailk_Bjlk_I8BH_UserArgs_MT128x128x32_MI16x16x1_SN_CLR0_GSU0_GSUC0_GSUWGMRR0_K1_LBSPPA1024_LBSPPB1024_LPA64_LPB64_MIWT4_4_PLR0_SU0_SUM0_SUS0_SKXCCM8_VWA4_VWB4_WGM1_WGMXCC1_WGMXCCGn1
    SolutionIndex: 8
    SolutionNameMin: Cijk_Ailk_Bjlk_I8BH_UserArgs_MT128x128x32_MI16x16x1_SN_CLR0_GSU0_GSUC0_GSUWGMRR0_K1_LBSPPA1024_LBSPPB1024_LPA64_LPB64_MIWT4_4_PLR0_SU0_SUM0_SUS0_SKXCCM8_VWA4_VWB4_WGM1_WGMXCC1_WGMXCCGn1
    SolutionIndex: 9
    SolutionNameMin: Cijk_Ailk_Bjlk_I8BH_UserArgs_MT128x64x32_MI16x16x1_SN_CLR0_GSU0_GSUC0_GSUWGMRR0_K1_LBSPPA1024_LBSPPB512_LPA64_LPB32_MIWT4_2_PLR0_SU0_SUM0_SUS0_SKXCCM8_VWA4_VWB2_WGM1_WGMXCC1_WGMXCCGn1
    SolutionIndex: 10
    SolutionNameMin: Cijk_Ailk_Bjlk_I8BH_UserArgs_MT128x32x32_MI16x16x1_SN_CLR0_GSU0_GSUC0_GSUWGMRR0_K1_LBSPPA1024_LBSPPB256_LPA64_LPB16_MIWT4_1_PLR0_SU0_SUM0_SUS0_SKXCCM8_VWA4_VWB1_WGM1_WGMXCC1_WGMXCCGn1
    SolutionIndex: 11
    SolutionNameMin: Cijk_Ailk_Bjlk_I8BH_UserArgs_MT128x32x32_MI16x16x1_SN_CLR0_GSU0_GSUC0_GSUWGMRR0_K1_LBSPPA1024_LBSPPB256_LPA64_LPB16_MIWT4_1_PLR0_SU0_SUM0_SUS0_SKXCCM8_VWA4_VWB1_WGM1_WGMXCC1_WGMXCCGn1
    SolutionIndex: 12
    SolutionNameMin: Cijk_Ailk_Bjlk_I8BH_UserArgs_MT64x32x32_MI16x16x1_SN_CLR0_GSU0_GSUC0_GSUWGMRR0_K1_LBSPPA512_LBSPPB256_LPA32_LPB16_MIWT2_1_PLR0_SU0_SUM0_SUS0_SKXCCM8_VWA2_VWB1_WGM1_WGMXCC1_WGMXCCGn1
    SolutionIndex: 13
    SolutionNameMin: Cijk_Ailk_Bjlk_I8BH_UserArgs_MT64x32x32_MI16x16x1_SN_CLR0_GSU0_GSUC0_GSUWGMRR0_K1_LBSPPA512_LBSPPB256_LPA32_LPB16_MIWT2_1_PLR0_SU0_SUM0_SUS0_SKXCCM8_VWA2_VWB1_WGM1_WGMXCC1_WGMXCCGn1
    SolutionIndex: 14
    SolutionNameMin: Cijk_Ailk_Bjlk_I8BH_UserArgs_MT32x32x32_MI16x16x1_SN_CLR0_GSU0_GSUC0_GSUWGMRR0_K1_LBSPPA256_LBSPPB256_LPA16_LPB16_MIWT1_1_PLR0_SU0_SUM0_SUS0_SKXCCM8_VWA1_VWB1_WGM1_WGMXCC1_WGMXCCGn1
    SolutionIndex: 15
    SolutionNameMin: Cijk_Ailk_Bjlk_I8BH_UserArgs_MT32x32x32_MI16x16x1_SN_CLR0_GSU0_GSUC0_GSUWGMRR0_K1_LBSPPA256_LBSPPB256_LPA16_LPB16_MIWT1_1_PLR0_SU0_SUM0_SUS0_SKXCCM8_VWA1_VWB1_WGM1_WGMXCC1_WGMXCCGn1
    SolutionIndex: 16
    SolutionNameMin: Cijk_Ailk_Bjlk_I8BH_UserArgs_MT32x32x32_MI16x16x1_SN_CLR0_GSU0_GSUC0_GSUWGMRR0_K1_LBSPPA256_LBSPPB256_LPA16_LPB16_MIWT1_1_PLR0_SU0_SUM0_SUS0_SKXCCM8_VWA1_VWB1_WGM1_WGMXCC1_WGMXCCGn1
    SolutionIndex: 17
    SolutionNameMin: Cijk_Ailk_Bjlk_I8BH_UserArgs_MT32x32x32_MI16x16x1_SN_CLR0_GSU0_GSUC0_GSUWGMRR0_K1_LBSPPA256_LBSPPB256_LPA16_LPB16_MIWT1_1_PLR0_SU0_SUM0_SUS0_SKXCCM8_VWA1_VWB1_WGM1_WGMXCC1_WGMXCCGn1
    SolutionIndex: 18
    SolutionNameMin: Cijk_Ailk_Bjlk_I8BH_UserArgs_MT256x256x64_MI16x16x1_SN_CLR1_GSU0_GSUC0_GSUWGMRR0_K1_LBSPPA2048_LBSPPB2048_LPA64_LPB0_MIWT8_8_PLR1_SU0_SUM0_SUS0_SKXCCM8_VWA4_VWB8_WGM1_WGMXCC1_WGMXCCGn1
    SolutionIndex: 19
    SolutionNameMin: Cijk_Ailk_Bjlk_I8BH_UserArgs_MT256x256x64_MI16x16x1_SN_CLR1_GSU0_GSUC0_GSUWGMRR0_K1_LBSPPA2048_LBSPPB2048_LPA0_LPB0_MIWT8_8_PLR1_SU0_SUM0_SUS0_SKXCCM8_VWA8_VWB8_WGM1_WGMXCC1_WGMXCCGn1
    SolutionIndex: 20
    SolutionNameMin: Cijk_Ailk_Bjlk_I8BH_UserArgs_MT256x256x64_MI16x16x1_SN_CLR1_GSU0_GSUC0_GSUWGMRR0_K1_LBSPPA2048_LBSPPB2048_LPA64_LPB0_MIWT8_8_PLR1_SU0_SUM0_SUS0_SKXCCM8_VWA4_VWB8_WGM1_WGMXCC1_WGMXCCGn1
    SolutionIndex: 21
    SolutionNameMin: Cijk_Ailk_Bjlk_I8BH_UserArgs_MT256x256x64_MI16x16x1_SN_CLR1_GSU0_GSUC0_GSUWGMRR0_K1_LBSPPA2048_LBSPPB2048_LPA64_LPB0_MIWT8_8_PLR1_SU0_SUM0_SUS0_SKXCCM8_VWA4_VWB8_WGM1_WGMXCC1_WGMXCCGn1
    SolutionIndex: 22
    SolutionNameMin: Cijk_Ailk_Bjlk_I8BH_UserArgs_MT256x256x64_MI16x16x1_SN_CLR1_GSU0_GSUC0_GSUWGMRR0_K1_LBSPPA2048_LBSPPB2048_LPA64_LPB0_MIWT8_8_PLR1_SU0_SUM0_SUS0_SKXCCM8_VWA4_VWB8_WGM1_WGMXCC1_WGMXCCGn1
    SolutionIndex: 23
    SolutionNameMin: Cijk_Ailk_Bjlk_I8BH_UserArgs_MT256x256x64_MI16x16x1_SN_CLR1_GSU0_GSUC0_GSUWGMRR0_K1_LBSPPA2048_LBSPPB2048_LPA0_LPB64_MIWT8_8_PLR1_SU0_SUM0_SUS0_SKXCCM8_VWA8_VWB4_WGM4_WGMXCC1_WGMXCCGn1
    SolutionIndex: 24
    SolutionNameMin: Cijk_Ailk_Bjlk_I8BH_UserArgs_MT256x256x64_MI16x16x1_SN_CLR1_GSU0_GSUC0_GSUWGMRR0_K1_LBSPPA2048_LBSPPB2048_LPA64_LPB0_MIWT8_8_PLR1_SU0_SUM0_SUS0_SKXCCM8_VWA4_VWB8_WGM4_WGMXCC1_WGMXCCGn1
    SolutionIndex: 25
    SolutionNameMin: Cijk_Ailk_Bjlk_I8BH_UserArgs_MT256x256x64_MI16x16x1_SN_CLR1_GSU0_GSUC0_GSUWGMRR0_K1_LBSPPA2048_LBSPPB2048_LPA0_LPB0_MIWT8_8_PLR1_SU0_SUM0_SUS0_SKXCCM8_VWA8_VWB8_WGM4_WGMXCC1_WGMXCCGn1
    SolutionIndex: 26
    SolutionNameMin: Cijk_Ailk_Bjlk_I8BH_UserArgs_MT256x256x64_MI16x16x1_SN_CLR1_GSU0_GSUC0_GSUWGMRR0_K1_LBSPPA2048_LBSPPB2048_LPA64_LPB64_MIWT8_8_PLR1_SU0_SUM0_SUS0_SKXCCM8_VWA4_VWB4_WGM4_WGMXCC1_WGMXCCGn1
    SolutionIndex: 27
    SolutionNameMin: Cijk_Ailk_Bjlk_I8BH_UserArgs_MT256x256x64_MI16x16x1_SN_CLR1_GSU0_GSUC0_GSUWGMRR0_K1_LBSPPA2048_LBSPPB2048_LPA64_LPB0_MIWT8_8_PLR1_SU0_SUM0_SUS0_SKXCCM8_VWA4_VWB8_WGM4_WGMXCC1_WGMXCCGn1
    SolutionIndex: 28
    SolutionNameMin: Cijk_Ailk_Bjlk_I8BH_UserArgs_MT256x256x64_MI16x16x1_SN_CLR1_GSU0_GSUC0_GSUWGMRR0_K1_LBSPPA2048_LBSPPB2048_LPA64_LPB64_MIWT8_8_PLR1_SU0_SUM0_SUS0_SKXCCM8_VWA4_VWB4_WGM4_WGMXCC1_WGMXCCGn1
    SolutionIndex: 29
    SolutionNameMin: Cijk_Ailk_Bjlk_I8BH_UserArgs_MT256x256x64_MI16x16x1_SN_CLR1_GSU0_GSUC0_GSUWGMRR0_K1_LBSPPA2048_LBSPPB2048_LPA64_LPB64_MIWT8_8_PLR1_SU0_SUM0_SUS0_SKXCCM8_VWA4_VWB4_WGM8_WGMXCC1_WGMXCCGn1
    SolutionIndex: 30
    SolutionNameMin: Cijk_Ailk_Bjlk_I8BH_UserArgs_MT256x256x64_MI16x16x1_SN_CLR1_GSU0_GSUC0_GSUWGMRR0_K1_LBSPPA2048_LBSPPB2048_LPA0_LPB64_MIWT8_8_PLR1_SU0_SUM0_SUS0_SKXCCM8_VWA8_VWB4_WGM8_WGMXCC1_WGMXCCGn1
    SolutionIndex: 31
    SolutionNameMin: Cijk_Ailk_Bjlk_I8BH_UserArgs_MT256x256x64_MI16x16x1_SN_CLR1_GSU0_GSUC0_GSUWGMRR0_K1_LBSPPA2048_LBSPPB2048_LPA64_LPB0_MIWT8_8_PLR1_SU0_SUM0_SUS0_SKXCCM8_VWA4_VWB8_WGM8_WGMXCC1_WGMXCCGn1
    SolutionIndex: 32
    SolutionNameMin: Cijk_Ailk_Bjlk_I8BH_UserArgs_MT256x256x64_MI16x16x1_SN_CLR1_GSU0_GSUC0_GSUWGMRR0_K1_LBSPPA2048_LBSPPB2048_LPA0_LPB0_MIWT8_8_PLR1_SU0_SUM0_SUS0_SKXCCM8_VWA8_VWB8_WGM8_WGMXCC1_WGMXCCGn1
    SolutionIndex: 33
    SolutionNameMin: Cijk_Ailk_Bjlk_I8BH_UserArgs_MT256x256x64_MI16x16x1_SN_CLR1_GSU0_GSUC0_GSUWGMRR0_K1_LBSPPA2048_LBSPPB2048_LPA64_LPB64_MIWT8_8_PLR1_SU0_SUM0_SUS0_SKXCCM8_VWA4_VWB4_WGM8_WGMXCC1_WGMXCCGn1
    SolutionIndex: 34
    SolutionNameMin: Cijk_Ailk_Bjlk_I8BH_UserArgs_MT256x256x64_MI16x16x1_SN_CLR1_GSU0_GSUC0_GSUWGMRR0_K1_LBSPPA2048_LBSPPB2048_LPA64_LPB0_MIWT8_8_PLR1_SU0_SUM0_SUS0_SKXCCM8_VWA4_VWB8_WGM8_WGMXCC1_WGMXCCGn1
    SolutionIndex: 35
    SolutionNameMin: Cijk_Ailk_Bjlk_I8BH_UserArgs_MT256x256x64_MI16x16x1_SN_CLR1_GSU0_GSUC0_GSUWGMRR0_K1_LBSPPA2048_LBSPPB2048_LPA0_LPB0_MIWT8_8_PLR1_SU0_SUM0_SUS0_SKXCCM8_VWA8_VWB8_WGM8_WGMXCC1_WGMXCCGn1
    SolutionIndex: 36
    SolutionNameMin: Cijk_Ailk_Bjlk_I8BH_UserArgs_MT128x256x64_MI16x16x1_SN_CLR1_GSU0_GSUC0_GSUWGMRR0_K1_LBSPPA1024_LBSPPB2048_LPA64_LPB0_MIWT4_8_PLR1_SU0_SUM0_SUS0_SKXCCM8_VWA4_VWB8_WGM4_WGMXCC1_WGMXCCGn1
    SolutionIndex: 37
    SolutionNameMin: Cijk_Ailk_Bjlk_I8BH_UserArgs_MT128x256x64_MI16x16x1_SN_CLR1_GSU0_GSUC0_GSUWGMRR0_K1_LBSPPA1024_LBSPPB2048_LPA64_LPB0_MIWT4_8_PLR1_SU0_SUM0_SUS0_SKXCCM8_VWA4_VWB8_WGM8_WGMXCC1_WGMXCCGn1
    SolutionIndex: 38
    SolutionNameMin: Cijk_Ailk_Bjlk_I8BH_UserArgs_MT256x128x64_MI16x16x1_SN_CLR1_GSU0_GSUC0_GSUWGMRR0_K1_LBSPPA2048_LBSPPB1024_LPA64_LPB64_MIWT8_4_PLR1_SU0_SUM0_SUS0_SKXCCM8_VWA4_VWB4_WGM1_WGMXCC1_WGMXCCGn1
    SolutionIndex: 39
    SolutionNameMin: Cijk_Ailk_Bjlk_I8BH_UserArgs_MT256x128x64_MI16x16x1_SN_CLR1_GSU0_GSUC0_GSUWGMRR0_K1_LBSPPA2048_LBSPPB1024_LPA0_LPB64_MIWT8_4_PLR1_SU0_SUM0_SUS0_SKXCCM8_VWA8_VWB4_WGM1_WGMXCC1_WGMXCCGn1
    SolutionIndex: 40
    SolutionNameMin: Cijk_Ailk_Bjlk_I8BH_UserArgs_MT256x128x64_MI16x16x1_SN_CLR1_GSU0_GSUC0_GSUWGMRR0_K1_LBSPPA2048_LBSPPB1024_LPA64_LPB64_MIWT8_4_PLR1_SU0_SUM0_SUS0_SKXCCM8_VWA4_VWB4_WGM1_WGMXCC1_WGMXCCGn1
    SolutionIndex: 41
    SolutionNameMin: Cijk_Ailk_Bjlk_I8BH_UserArgs_MT256x128x64_MI16x16x1_SN_CLR1_GSU0_GSUC0_GSUWGMRR0_K1_LBSPPA2048_LBSPPB1024_LPA0_LPB64_MIWT8_4_PLR1_SU0_SUM0_SUS0_SKXCCM8_VWA8_VWB4_WGM1_WGMXCC1_WGMXCCGn1
    SolutionIndex: 42
    SolutionNameMin: Cijk_Ailk_Bjlk_I8BH_UserArgs_MT256x128x64_MI16x16x1_SN_CLR1_GSU0_GSUC0_GSUWGMRR0_K1_LBSPPA2048_LBSPPB1024_LPA0_LPB64_MIWT8_4_PLR1_SU0_SUM0_SUS0_SKXCCM8_VWA8_VWB4_WGM1_WGMXCC1_WGMXCCGn1
    SolutionIndex: 43
    SolutionNameMin: Cijk_Ailk_Bjlk_I8BH_UserArgs_MT256x128x64_MI16x16x1_SN_CLR1_GSU0_GSUC0_GSUWGMRR0_K1_LBSPPA2048_LBSPPB1024_LPA0_LPB64_MIWT8_4_PLR1_SU0_SUM0_SUS0_SKXCCM8_VWA8_VWB4_WGM4_WGMXCC1_WGMXCCGn1
    SolutionIndex: 44
    SolutionNameMin: Cijk_Ailk_Bjlk_I8BH_UserArgs_MT256x128x64_MI16x16x1_SN_CLR1_GSU0_GSUC0_GSUWGMRR0_K1_LBSPPA2048_LBSPPB1024_LPA0_LPB64_MIWT8_4_PLR1_SU0_SUM0_SUS0_SKXCCM8_VWA8_VWB4_WGM4_WGMXCC1_WGMXCCGn1
    SolutionIndex: 45
    SolutionNameMin: Cijk_Ailk_Bjlk_I8BH_UserArgs_MT256x128x64_MI16x16x1_SN_CLR1_GSU0_GSUC0_GSUWGMRR0_K1_LBSPPA2048_LBSPPB1024_LPA0_LPB64_MIWT8_4_PLR1_SU0_SUM0_SUS0_SKXCCM8_VWA8_VWB4_WGM4_WGMXCC1_WGMXCCGn1
    SolutionIndex: 46
    SolutionNameMin: Cijk_Ailk_Bjlk_I8BH_UserArgs_MT256x128x64_MI16x16x1_SN_CLR1_GSU0_GSUC0_GSUWGMRR0_K1_LBSPPA2048_LBSPPB1024_LPA0_LPB64_MIWT8_4_PLR1_SU0_SUM0_SUS0_SKXCCM8_VWA8_VWB4_WGM8_WGMXCC1_WGMXCCGn1
    SolutionIndex: 47
    SolutionNameMin: Cijk_Ailk_Bjlk_I8BH_UserArgs_MT128x128x64_MI16x16x1_SN_CLR1_GSU0_GSUC0_GSUWGMRR0_K1_LBSPPA1024_LBSPPB1024_LPA64_LPB64_MIWT4_4_PLR1_SU0_SUM0_SUS0_SKXCCM8_VWA4_VWB4_WGM1_WGMXCC1_WGMXCCGn1
    SolutionIndex: 48
    SolutionNameMin: Cijk_Ailk_Bjlk_I8BH_UserArgs_MT128x128x64_MI16x16x1_SN_CLR1_GSU0_GSUC0_GSUWGMRR0_K1_LBSPPA1024_LBSPPB1024_LPA64_LPB64_MIWT4_4_PLR1_SU0_SUM0_SUS0_SKXCCM8_VWA4_VWB4_WGM1_WGMXCC1_WGMXCCGn1
    SolutionIndex: 49
    SolutionNameMin: Cijk_Ailk_Bjlk_I8BH_UserArgs_MT128x128x64_MI16x16x1_SN_CLR1_GSU0_GSUC0_GSUWGMRR0_K1_LBSPPA1024_LBSPPB1024_LPA64_LPB64_MIWT4_4_PLR1_SU0_SUM0_SUS0_SKXCCM8_VWA4_VWB4_WGM4_WGMXCC1_WGMXCCGn1
    SolutionIndex: 50
    SolutionNameMin: Cijk_Ailk_Bjlk_I8BH_UserArgs_MT128x128x64_MI16x16x1_SN_CLR1_GSU0_GSUC0_GSUWGMRR0_K1_LBSPPA1024_LBSPPB1024_LPA64_LPB64_MIWT4_4_PLR1_SU0_SUM0_SUS0_SKXCCM8_VWA4_VWB4_WGM8_WGMXCC1_WGMXCCGn1
    SolutionIndex: 51
    SolutionNameMin: Cijk_Ailk_Bjlk_I8BH_UserArgs_MT64x128x64_MI16x16x1_SN_CLR1_GSU0_GSUC0_GSUWGMRR0_K1_LBSPPA512_LBSPPB1024_LPA32_LPB64_MIWT2_4_PLR1_SU0_SUM0_SUS0_SKXCCM8_VWA2_VWB4_WGM1_WGMXCC1_WGMXCCGn1
    SolutionIndex: 52
    SolutionNameMin: Cijk_Ailk_Bjlk_I8BH_UserArgs_MT64x128x64_MI16x16x1_SN_CLR1_GSU0_GSUC0_GSUWGMRR0_K1_LBSPPA512_LBSPPB1024_LPA32_LPB64_MIWT2_4_PLR1_SU0_SUM0_SUS0_SKXCCM8_VWA2_VWB4_WGM4_WGMXCC1_WGMXCCGn1
    SolutionIndex: 53
    SolutionNameMin: Cijk_Ailk_Bjlk_I8BH_UserArgs_MT64x128x64_MI16x16x1_SN_CLR1_GSU0_GSUC0_GSUWGMRR0_K1_LBSPPA512_LBSPPB1024_LPA32_LPB64_MIWT2_4_PLR1_SU0_SUM0_SUS0_SKXCCM8_VWA2_VWB4_WGM8_WGMXCC1_WGMXCCGn1
    SolutionIndex: 54
    SolutionNameMin: Cijk_Ailk_Bjlk_I8BH_UserArgs_MT128x64x64_MI16x16x1_SN_CLR1_GSU0_GSUC0_GSUWGMRR0_K1_LBSPPA1024_LBSPPB512_LPA64_LPB32_MIWT4_2_PLR1_SU0_SUM0_SUS0_SKXCCM8_VWA4_VWB2_WGM1_WGMXCC1_WGMXCCGn1
    SolutionIndex: 55
    SolutionNameMin: Cijk_Ailk_Bjlk_I8BH_UserArgs_MT128x64x64_MI16x16x1_SN_CLR1_GSU0_GSUC0_GSUWGMRR0_K1_LBSPPA1024_LBSPPB512_LPA64_LPB32_MIWT4_2_PLR1_SU0_SUM0_SUS0_SKXCCM8_VWA4_VWB2_WGM1_WGMXCC1_WGMXCCGn1
    SolutionIndex: 56
    SolutionNameMin: Cijk_Ailk_Bjlk_I8BH_UserArgs_MT128x64x64_MI16x16x1_SN_CLR1_GSU0_GSUC0_GSUWGMRR0_K1_LBSPPA1024_LBSPPB512_LPA64_LPB32_MIWT4_2_PLR1_SU0_SUM0_SUS0_SKXCCM8_VWA4_VWB2_WGM1_WGMXCC1_WGMXCCGn1
    SolutionIndex: 57
    SolutionNameMin: Cijk_Ailk_Bjlk_I8BH_UserArgs_MT128x64x64_MI16x16x1_SN_CLR1_GSU0_GSUC0_GSUWGMRR0_K1_LBSPPA1024_LBSPPB512_LPA64_LPB32_MIWT4_2_PLR1_SU0_SUM0_SUS0_SKXCCM8_VWA4_VWB2_WGM8_WGMXCC1_WGMXCCGn1
    SolutionIndex: 58
    SolutionNameMin: Cijk_Ailk_Bjlk_I8BH_UserArgs_MT128x64x64_MI16x16x1_SN_CLR1_GSU0_GSUC0_GSUWGMRR0_K1_LBSPPA1024_LBSPPB512_LPA64_LPB32_MIWT4_2_PLR1_SU0_SUM0_SUS0_SKXCCM8_VWA4_VWB2_WGM8_WGMXCC1_WGMXCCGn1
    SolutionIndex: 59
    SolutionNameMin: Cijk_Ailk_Bjlk_I8BH_UserArgs_MT128x32x64_MI16x16x1_SN_CLR1_GSU0_GSUC0_GSUWGMRR0_K1_LBSPPA1024_LBSPPB256_LPA64_LPB16_MIWT4_1_PLR1_SU0_SUM0_SUS0_SKXCCM8_VWA4_VWB1_WGM1_WGMXCC1_WGMXCCGn1
    SolutionIndex: 60
    SolutionNameMin: Cijk_Ailk_Bjlk_I8BH_UserArgs_MT64x64x64_MI16x16x1_SN_CLR1_GSU0_GSUC0_GSUWGMRR0_K1_LBSPPA512_LBSPPB512_LPA32_LPB32_MIWT2_2_PLR1_SU0_SUM0_SUS0_SKXCCM8_VWA2_VWB2_WGM1_WGMXCC1_WGMXCCGn1
    SolutionIndex: 61
    SolutionNameMin: Cijk_Ailk_Bjlk_I8BH_UserArgs_MT64x64x64_MI16x16x1_SN_CLR1_GSU0_GSUC0_GSUWGMRR0_K1_LBSPPA512_LBSPPB512_LPA32_LPB32_MIWT2_2_PLR1_SU0_SUM0_SUS0_SKXCCM8_VWA2_VWB2_WGM1_WGMXCC1_WGMXCCGn1
    SolutionIndex: 62
    SolutionNameMin: Cijk_Ailk_Bjlk_I8BH_UserArgs_MT64x64x64_MI16x16x1_SN_CLR1_GSU0_GSUC0_GSUWGMRR0_K1_LBSPPA512_LBSPPB512_LPA32_LPB32_MIWT2_2_PLR1_SU0_SUM0_SUS0_SKXCCM8_VWA2_VWB2_WGM1_WGMXCC1_WGMXCCGn1
    SolutionIndex: 63
    SolutionNameMin: Cijk_Ailk_Bjlk_I8BH_UserArgs_MT64x64x64_MI16x16x1_SN_CLR1_GSU0_GSUC0_GSUWGMRR0_K1_LBSPPA512_LBSPPB512_LPA32_LPB32_MIWT2_2_PLR1_SU0_SUM0_SUS0_SKXCCM8_VWA2_VWB2_WGM1_WGMXCC1_WGMXCCGn1
    SolutionIndex: 64
    SolutionNameMin: Cijk_Ailk_Bjlk_I8BH_UserArgs_MT64x64x64_MI16x16x1_SN_CLR1_GSU0_GSUC0_GSUWGMRR0_K1_LBSPPA512_LBSPPB512_LPA32_LPB32_MIWT2_2_PLR1_SU0_SUM0_SUS0_SKXCCM8_VWA2_VWB2_WGM4_WGMXCC1_WGMXCCGn1
    SolutionIndex: 65
    SolutionNameMin: Cijk_Ailk_Bjlk_I8BH_UserArgs_MT64x64x64_MI16x16x1_SN_CLR1_GSU0_GSUC0_GSUWGMRR0_K1_LBSPPA512_LBSPPB512_LPA32_LPB32_MIWT2_2_PLR1_SU0_SUM0_SUS0_SKXCCM8_VWA2_VWB2_WGM8_WGMXCC1_WGMXCCGn1
    SolutionIndex: 66
    SolutionNameMin: Cijk_Ailk_Bjlk_I8BH_UserArgs_MT32x64x64_MI16x16x1_SN_CLR1_GSU0_GSUC0_GSUWGMRR0_K1_LBSPPA256_LBSPPB512_LPA16_LPB32_MIWT1_2_PLR1_SU0_SUM0_SUS0_SKXCCM8_VWA1_VWB2_WGM8_WGMXCC1_WGMXCCGn1
    SolutionIndex: 67
    SolutionNameMin: Cijk_Ailk_Bjlk_I8BH_UserArgs_MT64x32x64_MI16x16x1_SN_CLR1_GSU0_GSUC0_GSUWGMRR0_K1_LBSPPA512_LBSPPB256_LPA32_LPB16_MIWT2_1_PLR1_SU0_SUM0_SUS0_SKXCCM8_VWA2_VWB1_WGM1_WGMXCC1_WGMXCCGn1
    SolutionIndex: 68
    SolutionNameMin: Cijk_Ailk_Bjlk_I8BH_UserArgs_MT64x32x64_MI16x16x1_SN_CLR1_GSU0_GSUC0_GSUWGMRR0_K1_LBSPPA512_LBSPPB256_LPA32_LPB16_MIWT2_1_PLR1_SU0_SUM0_SUS0_SKXCCM8_VWA2_VWB1_WGM1_WGMXCC1_WGMXCCGn1
    SolutionIndex: 69
    SolutionNameMin: Cijk_Ailk_Bjlk_I8BH_UserArgs_MT64x32x64_MI16x16x1_SN_CLR1_GSU0_GSUC0_GSUWGMRR0_K1_LBSPPA512_LBSPPB256_LPA32_LPB16_MIWT2_1_PLR1_SU0_SUM0_SUS0_SKXCCM8_VWA2_VWB1_WGM1_WGMXCC1_WGMXCCGn1
    SolutionIndex: 70
    SolutionNameMin: Cijk_Ailk_Bjlk_I8BH_UserArgs_MT64x32x64_MI16x16x1_SN_CLR0_GSU0_GSUC0_GSUWGMRR0_K1_LBSPPA512_LBSPPB256_LPA32_LPB16_MIWT2_1_PLR0_SU0_SUM0_SUS0_SKXCCM8_VWA2_VWB1_WGM1_WGMXCC1_WGMXCCGn1
    SolutionIndex: 71
    SolutionNameMin: Cijk_Ailk_Bjlk_I8BH_UserArgs_MT32x32x64_MI16x16x1_SN_CLR1_GSU0_GSUC0_GSUWGMRR0_K1_LBSPPA256_LBSPPB256_LPA16_LPB16_MIWT1_1_PLR1_SU0_SUM0_SUS0_SKXCCM8_VWA1_VWB1_WGM1_WGMXCC1_WGMXCCGn1
    SolutionIndex: 72
    SolutionNameMin: Cijk_Ailk_Bjlk_I8BH_UserArgs_MT32x32x64_MI16x16x1_SN_CLR1_GSU0_GSUC0_GSUWGMRR0_K1_LBSPPA256_LBSPPB256_LPA16_LPB16_MIWT1_1_PLR1_SU0_SUM0_SUS0_SKXCCM8_VWA1_VWB1_WGM1_WGMXCC1_WGMXCCGn1
    SolutionIndex: 73
    SolutionNameMin: Cijk_Ailk_Bjlk_I8BH_UserArgs_MT32x32x64_MI16x16x1_SN_CLR1_GSU0_GSUC0_GSUWGMRR0_K1_LBSPPA256_LBSPPB256_LPA16_LPB16_MIWT1_1_PLR1_SU0_SUM0_SUS0_SKXCCM8_VWA1_VWB1_WGM1_WGMXCC1_WGMXCCGn1
    SolutionIndex: 74
    SolutionNameMin: Cijk_Ailk_Bjlk_I8BH_UserArgs_MT32x32x64_MI16x16x1_SN_CLR1_GSU0_GSUC0_GSUWGMRR0_K1_LBSPPA256_LBSPPB256_LPA16_LPB16_MIWT1_1_PLR1_SU0_SUM0_SUS0_SKXCCM8_VWA1_VWB1_WGM1_WGMXCC1_WGMXCCGn1
    SolutionIndex: 75
    SolutionNameMin: Cijk_Ailk_Bjlk_I8BH_UserArgs_MT32x32x64_MI16x16x1_SN_CLR1_GSU0_GSUC0_GSUWGMRR0_K1_LBSPPA256_LBSPPB256_LPA16_LPB16_MIWT1_1_PLR1_SU0_SUM0_SUS0_SKXCCM8_VWA1_VWB1_WGM1_WGMXCC1_WGMXCCGn1
    SolutionIndex: 76
    SolutionNameMin: Cijk_Ailk_Bjlk_I8BH_UserArgs_MT32x32x64_MI16x16x1_SN_CLR0_GSU0_GSUC0_GSUWGMRR0_K1_LBSPPA256_LBSPPB256_LPA16_LPB16_MIWT1_1_PLR0_SU0_SUM0_SUS0_SKXCCM8_VWA1_VWB1_WGM1_WGMXCC1_WGMXCCGn1
    SolutionIndex: 77
    SolutionNameMin: Cijk_Ailk_Bjlk_I8BH_UserArgs_MT32x32x64_MI16x16x1_SN_CLR0_GSU0_GSUC0_GSUWGMRR0_K1_LBSPPA256_LBSPPB256_LPA16_LPB16_MIWT1_1_PLR0_SU0_SUM0_SUS0_SKXCCM8_VWA1_VWB1_WGM1_WGMXCC1_WGMXCCGn1
    SolutionIndex: 78
    SolutionNameMin: Cijk_Ailk_Bjlk_I8BH_UserArgs_MT128x256x128_MI16x16x1_SN_CLR1_GSU0_GSUC0_GSUWGMRR0_K1_LBSPPA1024_LBSPPB2048_LPA64_LPB0_MIWT4_8_PLR1_SU0_SUM0_SUS0_SKXCCM8_VWA4_VWB8_WGM1_WGMXCC1_WGMXCCGn1
    SolutionIndex: 79
    SolutionNameMin: Cijk_Ailk_Bjlk_I8BH_UserArgs_MT128x256x128_MI16x16x1_SN_CLR1_GSU0_GSUC0_GSUWGMRR0_K1_LBSPPA1024_LBSPPB2048_LPA64_LPB0_MIWT4_8_PLR1_SU0_SUM0_SUS0_SKXCCM8_VWA4_VWB8_WGM4_WGMXCC1_WGMXCCGn1
    SolutionIndex: 80
    SolutionNameMin: Cijk_Ailk_Bjlk_I8BH_UserArgs_MT128x256x128_MI16x16x1_SN_CLR1_GSU0_GSUC0_GSUWGMRR0_K1_LBSPPA1024_LBSPPB2048_LPA64_LPB0_MIWT4_8_PLR1_SU0_SUM0_SUS0_SKXCCM8_VWA4_VWB8_WGM4_WGMXCC1_WGMXCCGn1
    SolutionIndex: 81
    SolutionNameMin: Cijk_Ailk_Bjlk_I8BH_UserArgs_MT256x128x128_MI16x16x1_SN_CLR1_GSU0_GSUC0_GSUWGMRR0_K1_LBSPPA2048_LBSPPB1024_LPA64_LPB64_MIWT8_4_PLR1_SU0_SUM0_SUS0_SKXCCM8_VWA4_VWB4_WGM1_WGMXCC1_WGMXCCGn1
    SolutionIndex: 82
    SolutionNameMin: Cijk_Ailk_Bjlk_I8BH_UserArgs_MT256x128x128_MI16x16x1_SN_CLR1_GSU0_GSUC0_GSUWGMRR0_K1_LBSPPA2048_LBSPPB1024_LPA64_LPB64_MIWT8_4_PLR1_SU0_SUM0_SUS0_SKXCCM8_VWA4_VWB4_WGM8_WGMXCC1_WGMXCCGn1
    SolutionIndex: 83
    SolutionNameMin: Cijk_Ailk_Bjlk_I8BH_UserArgs_MT256x128x128_MI16x16x1_SN_CLR1_GSU0_GSUC0_GSUWGMRR0_K1_LBSPPA2048_LBSPPB1024_LPA0_LPB64_MIWT8_4_PLR1_SU0_SUM0_SUS0_SKXCCM8_VWA8_VWB4_WGM8_WGMXCC1_WGMXCCGn1
    SolutionIndex: 84
    SolutionNameMin: Cijk_Ailk_Bjlk_I8BH_UserArgs_MT256x128x128_MI16x16x1_SN_CLR1_GSU0_GSUC0_GSUWGMRR0_K1_LBSPPA2048_LBSPPB1024_LPA64_LPB64_MIWT8_4_PLR1_SU0_SUM0_SUS0_SKXCCM8_VWA4_VWB4_WGM8_WGMXCC1_WGMXCCGn1
    SolutionIndex: 85
    SolutionNameMin: Cijk_Ailk_Bjlk_I8BH_UserArgs_MT256x128x128_MI16x16x1_SN_CLR1_GSU0_GSUC0_GSUWGMRR0_K1_LBSPPA2048_LBSPPB1024_LPA0_LPB64_MIWT8_4_PLR1_SU0_SUM0_SUS0_SKXCCM8_VWA8_VWB4_WGM8_WGMXCC1_WGMXCCGn1
    SolutionIndex: 86
    SolutionNameMin: Cijk_Ailk_Bjlk_I8BH_UserArgs_MT256x128x128_MI16x16x1_SN_CLR1_GSU0_GSUC0_GSUWGMRR0_K1_LBSPPA2048_LBSPPB1024_LPA0_LPB64_MIWT8_4_PLR2_SU0_SUM0_SUS0_SKXCCM8_VWA8_VWB4_WGM8_WGMXCC1_WGMXCCGn1
    SolutionIndex: 87
    SolutionNameMin: Cijk_Ailk_Bjlk_I8BH_UserArgs_MT128x128x128_MI16x16x1_SN_CLR1_GSU0_GSUC0_GSUWGMRR0_K1_LBSPPA1024_LBSPPB1024_LPA64_LPB64_MIWT4_4_PLR1_SU0_SUM0_SUS0_SKXCCM8_VWA4_VWB4_WGM1_WGMXCC1_WGMXCCGn1
    SolutionIndex: 88
    SolutionNameMin: Cijk_Ailk_Bjlk_I8BH_UserArgs_MT128x128x128_MI16x16x1_SN_CLR1_GSU0_GSUC0_GSUWGMRR0_K1_LBSPPA1024_LBSPPB1024_LPA64_LPB64_MIWT4_4_PLR2_SU0_SUM0_SUS0_SKXCCM8_VWA4_VWB4_WGM1_WGMXCC1_WGMXCCGn1
    SolutionIndex: 89
    SolutionNameMin: Cijk_Ailk_Bjlk_I8BH_UserArgs_MT128x128x128_MI16x16x1_SN_CLR1_GSU0_GSUC0_GSUWGMRR0_K1_LBSPPA1024_LBSPPB1024_LPA64_LPB64_MIWT4_4_PLR2_SU0_SUM0_SUS0_SKXCCM8_VWA4_VWB4_WGM1_WGMXCC1_WGMXCCGn1
    SolutionIndex: 90
    SolutionNameMin: Cijk_Ailk_Bjlk_I8BH_UserArgs_MT128x128x128_MI16x16x1_SN_CLR1_GSU0_GSUC0_GSUWGMRR0_K1_LBSPPA1024_LBSPPB1024_LPA64_LPB64_MIWT4_4_PLR1_SU0_SUM0_SUS0_SKXCCM8_VWA4_VWB4_WGM4_WGMXCC1_WGMXCCGn1
    SolutionIndex: 91
    SolutionNameMin: Cijk_Ailk_Bjlk_I8BH_UserArgs_MT128x128x128_MI16x16x1_SN_CLR1_GSU0_GSUC0_GSUWGMRR0_K1_LBSPPA1024_LBSPPB1024_LPA64_LPB64_MIWT4_4_PLR1_SU0_SUM0_SUS0_SKXCCM8_VWA4_VWB4_WGM8_WGMXCC1_WGMXCCGn1
    SolutionIndex: 92
    SolutionNameMin: Cijk_Ailk_Bjlk_I8BH_UserArgs_MT128x128x128_MI16x16x1_SN_CLR1_GSU0_GSUC0_GSUWGMRR0_K1_LBSPPA1024_LBSPPB1024_LPA64_LPB64_MIWT4_4_PLR2_SU0_SUM0_SUS0_SKXCCM8_VWA4_VWB4_WGM8_WGMXCC1_WGMXCCGn1
    SolutionIndex: 93
    SolutionNameMin: Cijk_Ailk_Bjlk_I8BH_UserArgs_MT128x64x128_MI16x16x1_SN_CLR1_GSU0_GSUC0_GSUWGMRR0_K1_LBSPPA1024_LBSPPB512_LPA64_LPB32_MIWT4_2_PLR1_SU0_SUM0_SUS0_SKXCCM8_VWA4_VWB2_WGM1_WGMXCC1_WGMXCCGn1
    SolutionIndex: 94
    SolutionNameMin: Cijk_Ailk_Bjlk_I8BH_UserArgs_MT128x64x128_MI16x16x1_SN_CLR1_GSU0_GSUC0_GSUWGMRR0_K1_LBSPPA1024_LBSPPB512_LPA64_LPB32_MIWT4_2_PLR2_SU0_SUM0_SUS0_SKXCCM8_VWA4_VWB2_WGM1_WGMXCC1_WGMXCCGn1
    SolutionIndex: 95
    SolutionNameMin: Cijk_Ailk_Bjlk_I8BH_UserArgs_MT128x64x128_MI16x16x1_SN_CLR1_GSU0_GSUC0_GSUWGMRR0_K1_LBSPPA1024_LBSPPB512_LPA64_LPB32_MIWT4_2_PLR2_SU0_SUM0_SUS0_SKXCCM8_VWA4_VWB2_WGM1_WGMXCC1_WGMXCCGn1
    SolutionIndex: 96
    SolutionNameMin: Cijk_Ailk_Bjlk_I8BH_UserArgs_MT128x64x128_MI16x16x1_SN_CLR1_GSU0_GSUC0_GSUWGMRR0_K1_LBSPPA1024_LBSPPB512_LPA64_LPB32_MIWT4_2_PLR2_SU0_SUM0_SUS0_SKXCCM8_VWA4_VWB2_WGM4_WGMXCC1_WGMXCCGn1
    SolutionIndex: 97
    SolutionNameMin: Cijk_Ailk_Bjlk_I8BH_UserArgs_MT128x64x128_MI16x16x1_SN_CLR1_GSU0_GSUC0_GSUWGMRR0_K1_LBSPPA1024_LBSPPB512_LPA64_LPB32_MIWT4_2_PLR2_SU0_SUM0_SUS0_SKXCCM8_VWA4_VWB2_WGM8_WGMXCC1_WGMXCCGn1
    SolutionIndex: 98
    SolutionNameMin: Cijk_Ailk_Bjlk_I8BH_UserArgs_MT128x64x128_MI16x16x1_SN_CLR1_GSU0_GSUC0_GSUWGMRR0_K1_LBSPPA1024_LBSPPB512_LPA64_LPB32_MIWT4_2_PLR2_SU0_SUM0_SUS0_SKXCCM8_VWA4_VWB2_WGM8_WGMXCC1_WGMXCCGn1
    SolutionIndex: 99
    SolutionNameMin: Cijk_Ailk_Bjlk_I8BH_UserArgs_MT64x64x128_MI16x16x1_SN_CLR1_GSU0_GSUC0_GSUWGMRR0_K1_LBSPPA512_LBSPPB512_LPA32_LPB32_MIWT2_2_PLR1_SU0_SUM0_SUS0_SKXCCM8_VWA2_VWB2_WGM1_WGMXCC1_WGMXCCGn1
    SolutionIndex: 100
    SolutionNameMin: Cijk_Ailk_Bjlk_I8BH_UserArgs_MT64x64x128_MI16x16x1_SN_CLR1_GSU0_GSUC0_GSUWGMRR0_K1_LBSPPA512_LBSPPB512_LPA32_LPB32_MIWT2_2_PLR2_SU0_SUM0_SUS0_SKXCCM8_VWA2_VWB2_WGM1_WGMXCC1_WGMXCCGn1
    SolutionIndex: 101
    SolutionNameMin: Cijk_Ailk_Bjlk_I8BH_UserArgs_MT64x64x128_MI16x16x1_SN_CLR1_GSU0_GSUC0_GSUWGMRR0_K1_LBSPPA512_LBSPPB512_LPA32_LPB32_MIWT2_2_PLR2_SU0_SUM0_SUS0_SKXCCM8_VWA2_VWB2_WGM1_WGMXCC1_WGMXCCGn1
    SolutionIndex: 102
    SolutionNameMin: Cijk_Ailk_Bjlk_I8BH_UserArgs_MT64x64x128_MI16x16x1_SN_CLR1_GSU0_GSUC0_GSUWGMRR0_K1_LBSPPA512_LBSPPB512_LPA32_LPB32_MIWT2_2_PLR1_SU0_SUM0_SUS0_SKXCCM8_VWA2_VWB2_WGM4_WGMXCC1_WGMXCCGn1
    SolutionIndex: 103
    SolutionNameMin: Cijk_Ailk_Bjlk_I8BH_UserArgs_MT64x64x128_MI16x16x1_SN_CLR1_GSU0_GSUC0_GSUWGMRR0_K1_LBSPPA512_LBSPPB512_LPA32_LPB32_MIWT2_2_PLR1_SU0_SUM0_SUS0_SKXCCM8_VWA2_VWB2_WGM8_WGMXCC1_WGMXCCGn1
    SolutionIndex: 104
    SolutionNameMin: Cijk_Ailk_Bjlk_I8BH_UserArgs_MT32x64x128_MI16x16x1_SN_CLR1_GSU0_GSUC0_GSUWGMRR0_K1_LBSPPA256_LBSPPB512_LPA16_LPB32_MIWT1_2_PLR2_SU0_SUM0_SUS0_SKXCCM8_VWA1_VWB2_WGM1_WGMXCC1_WGMXCCGn1
    SolutionIndex: 105
    SolutionNameMin: Cijk_Ailk_Bjlk_I8BH_UserArgs_MT64x32x128_MI16x16x1_SN_CLR1_GSU0_GSUC0_GSUWGMRR0_K1_LBSPPA512_LBSPPB256_LPA32_LPB16_MIWT2_1_PLR1_SU0_SUM0_SUS0_SKXCCM8_VWA2_VWB1_WGM1_WGMXCC1_WGMXCCGn1
    SolutionIndex: 106
    SolutionNameMin: Cijk_Ailk_Bjlk_I8BH_UserArgs_MT64x32x128_MI16x16x1_SN_CLR1_GSU0_GSUC0_GSUWGMRR0_K1_LBSPPA512_LBSPPB256_LPA32_LPB16_MIWT2_1_PLR1_SU0_SUM0_SUS0_SKXCCM8_VWA2_VWB1_WGM1_WGMXCC1_WGMXCCGn1
    SolutionIndex: 107
    SolutionNameMin: Cijk_Ailk_Bjlk_I8BH_UserArgs_MT64x32x128_MI16x16x1_SN_CLR1_GSU0_GSUC0_GSUWGMRR0_K1_LBSPPA512_LBSPPB256_LPA32_LPB16_MIWT2_1_PLR1_SU0_SUM0_SUS0_SKXCCM8_VWA2_VWB1_WGM1_WGMXCC1_WGMXCCGn1
    SolutionIndex: 108
    SolutionNameMin: Cijk_Ailk_Bjlk_I8BH_UserArgs_MT64x32x128_MI16x16x1_SN_CLR1_GSU0_GSUC0_GSUWGMRR0_K1_LBSPPA512_LBSPPB256_LPA32_LPB16_MIWT2_1_PLR1_SU0_SUM0_SUS0_SKXCCM8_VWA2_VWB1_WGM1_WGMXCC1_WGMXCCGn1
    SolutionIndex: 109
    SolutionNameMin: Cijk_Ailk_Bjlk_I8BH_UserArgs_MT64x32x128_MI16x16x1_SN_CLR1_GSU0_GSUC0_GSUWGMRR0_K1_LBSPPA512_LBSPPB256_LPA32_LPB16_MIWT2_1_PLR2_SU0_SUM0_SUS0_SKXCCM8_VWA2_VWB1_WGM1_WGMXCC1_WGMXCCGn1
    SolutionIndex: 110
    SolutionNameMin: Cijk_Ailk_Bjlk_I8BH_UserArgs_MT64x32x128_MI16x16x1_SN_CLR1_GSU0_GSUC0_GSUWGMRR0_K1_LBSPPA512_LBSPPB256_LPA32_LPB16_MIWT2_1_PLR2_SU0_SUM0_SUS0_SKXCCM8_VWA2_VWB1_WGM1_WGMXCC1_WGMXCCGn1
    SolutionIndex: 111
    SolutionNameMin: Cijk_Ailk_Bjlk_I8BH_UserArgs_MT64x32x128_MI16x16x1_SN_CLR1_GSU0_GSUC0_GSUWGMRR0_K1_LBSPPA512_LBSPPB256_LPA32_LPB16_MIWT2_1_PLR2_SU0_SUM0_SUS0_SKXCCM8_VWA2_VWB1_WGM1_WGMXCC1_WGMXCCGn1
    SolutionIndex: 112
    SolutionNameMin: Cijk_Ailk_Bjlk_I8BH_UserArgs_MT64x32x128_MI16x16x1_SN_CLR1_GSU0_GSUC0_GSUWGMRR0_K1_LBSPPA512_LBSPPB256_LPA32_LPB16_MIWT2_1_PLR1_SU0_SUM0_SUS0_SKXCCM8_VWA2_VWB1_WGM4_WGMXCC1_WGMXCCGn1
    SolutionIndex: 113
    SolutionNameMin: Cijk_Ailk_Bjlk_I8BH_UserArgs_MT64x32x128_MI16x16x1_SN_CLR1_GSU0_GSUC0_GSUWGMRR0_K1_LBSPPA512_LBSPPB256_LPA32_LPB16_MIWT2_1_PLR2_SU0_SUM0_SUS0_SKXCCM8_VWA2_VWB1_WGM4_WGMXCC1_WGMXCCGn1
    SolutionIndex: 114
    SolutionNameMin: Cijk_Ailk_Bjlk_I8BH_UserArgs_MT32x32x128_MI16x16x1_SN_CLR1_GSU0_GSUC0_GSUWGMRR0_K1_LBSPPA256_LBSPPB256_LPA16_LPB16_MIWT1_1_PLR1_SU0_SUM0_SUS0_SKXCCM8_VWA1_VWB1_WGM1_WGMXCC1_WGMXCCGn1
    SolutionIndex: 115
    SolutionNameMin: Cijk_Ailk_Bjlk_I8BH_UserArgs_MT32x32x128_MI16x16x1_SN_CLR1_GSU0_GSUC0_GSUWGMRR0_K1_LBSPPA256_LBSPPB256_LPA16_LPB16_MIWT1_1_PLR1_SU0_SUM0_SUS0_SKXCCM8_VWA1_VWB1_WGM1_WGMXCC1_WGMXCCGn1
    SolutionIndex: 116
    SolutionNameMin: Cijk_Ailk_Bjlk_I8BH_UserArgs_MT32x32x128_MI16x16x1_SN_CLR1_GSU0_GSUC0_GSUWGMRR0_K1_LBSPPA256_LBSPPB256_LPA16_LPB16_MIWT1_1_PLR1_SU0_SUM0_SUS0_SKXCCM8_VWA1_VWB1_WGM1_WGMXCC1_WGMXCCGn1
    SolutionIndex: 117
    SolutionNameMin: Cijk_Ailk_Bjlk_I8BH_UserArgs_MT32x32x128_MI16x16x1_SN_CLR1_GSU0_GSUC0_GSUWGMRR0_K1_LBSPPA256_LBSPPB256_LPA16_LPB16_MIWT1_1_PLR1_SU0_SUM0_SUS0_SKXCCM8_VWA1_VWB1_WGM1_WGMXCC1_WGMXCCGn1
    SolutionIndex: 118
    SolutionNameMin: Cijk_Ailk_Bjlk_I8BH_UserArgs_MT32x32x128_MI16x16x1_SN_CLR1_GSU0_GSUC0_GSUWGMRR0_K1_LBSPPA256_LBSPPB256_LPA16_LPB16_MIWT1_1_PLR2_SU0_SUM0_SUS0_SKXCCM8_VWA1_VWB1_WGM1_WGMXCC1_WGMXCCGn1
    SolutionIndex: 119
    SolutionNameMin: Cijk_Ailk_Bjlk_I8BH_UserArgs_MT32x32x128_MI16x16x1_SN_CLR1_GSU0_GSUC0_GSUWGMRR0_K1_LBSPPA256_LBSPPB256_LPA16_LPB16_MIWT1_1_PLR2_SU0_SUM0_SUS0_SKXCCM8_VWA1_VWB1_WGM1_WGMXCC1_WGMXCCGn1
    SolutionIndex: 120
    SolutionNameMin: Cijk_Ailk_Bjlk_I8BH_UserArgs_MT32x32x128_MI16x16x1_SN_CLR1_GSU0_GSUC0_GSUWGMRR0_K1_LBSPPA256_LBSPPB256_LPA16_LPB16_MIWT1_1_PLR2_SU0_SUM0_SUS0_SKXCCM8_VWA1_VWB1_WGM1_WGMXCC1_WGMXCCGn1
    SolutionIndex: 121
    SolutionNameMin: Cijk_Ailk_Bjlk_I8BH_UserArgs_MT32x32x128_MI16x16x1_SN_CLR1_GSU0_GSUC0_GSUWGMRR0_K1_LBSPPA256_LBSPPB256_LPA16_LPB16_MIWT1_1_PLR2_SU0_SUM0_SUS0_SKXCCM8_VWA1_VWB1_WGM1_WGMXCC1_WGMXCCGn1
    SolutionIndex: 122
    SolutionNameMin: Cijk_Ailk_Bjlk_I8BH_UserArgs_MT32x32x128_MI16x16x1_SN_CLR1_GSU0_GSUC0_GSUWGMRR0_K1_LBSPPA256_LBSPPB256_LPA16_LPB16_MIWT1_1_PLR1_SU0_SUM0_SUS0_SKXCCM8_VWA1_VWB1_WGM4_WGMXCC1_WGMXCCGn1
    SolutionIndex: 123
    SolutionNameMin: Cijk_Ailk_Bjlk_I8BH_UserArgs_MT32x32x32_MI16x16x1_SN_CLR0_GSU0_GSUC0_GSUWGMRR0_K1_LBSPPA256_LBSPPB256_LPA16_LPB16_MIWT1_1_PLR0_SU32_SUM0_SUS256_SKXCCM0_VWA1_VWB1_WGM8_WGMXCC1_WGMXCCGn1
- - - [128, 128, 1, 128, 128, 128, 128, 128]
    - [115, 0.51]
  - - [128, 128, 1, 256, 128, 128, 128, 128]
    - [73, 0.91]
  - - [128, 128, 1, 512, 128, 128, 128, 128]
    - [117, 1.49]
  - - [128, 128, 1, 1024, 128, 128, 128, 128]
    - [117, 2.2]
  - - [128, 128, 1, 2048, 128, 128, 128, 128]
    - [15, 3.47]
  - - [128, 128, 1, 4096, 128, 128, 128, 128]
    - [74, 5.89]
  - - [128, 128, 1, 8192, 128, 128, 128, 128]
    - [121, 8.98]
  - - [128, 256, 1, 128, 128, 128, 128, 256]
    - [120, 0.99]
  - - [128, 256, 1, 256, 128, 128, 128, 256]
    - [117, 1.82]
  - - [128, 256, 1, 512, 128, 128, 128, 256]
    - [117, 3.03]
  - - [128, 256, 1, 1024, 128, 128, 128, 256]
    - [121, 4.43]
  - - [128, 256, 1, 2048, 128, 128, 128, 256]
    - [16, 6.76]
  - - [128, 256, 1, 4096, 128, 128, 128, 256]
    - [76, 11.37]
  - - [128, 256, 1, 8192, 128, 128, 128, 256]
    - [121, 17.52]
  - - [128, 512, 1, 128, 128, 128, 128, 512]
    - [73, 2.03]
  - - [128, 512, 1, 256, 128, 128, 128, 512]
    - [115, 3.55]
  - - [128, 512, 1, 512, 128, 128, 128, 512]
    - [120, 5.86]
  - - [128, 512, 1, 1024, 128, 128, 128, 512]
    - [117, 8.69]
  - - [128, 512, 1, 2048, 128, 128, 128, 512]
    - [121, 13.32]
  - - [128, 512, 1, 4096, 128, 128, 128, 512]
    - [74, 21.63]
  - - [128, 512, 1, 8192, 128, 128, 128, 512]
    - [121, 34.23]
  - - [128, 1024, 1, 128, 128, 128, 128, 1024]
    - [16, 3.97]
  - - [128, 1024, 1, 256, 128, 128, 128, 1024]
    - [73, 7.04]
  - - [128, 1024, 1, 512, 128, 128, 128, 1024]
    - [121, 11.52]
  - - [128, 1024, 1, 1024, 128, 128, 128, 1024]
    - [121, 17.15]
  - - [128, 1024, 1, 2048, 128, 128, 128, 1024]
    - [121, 24.7]
  - - [128, 1024, 1, 4096, 128, 128, 128, 1024]
    - [69, 38.57]
  - - [128, 1024, 1, 8192, 128, 128, 128, 1024]
    - [109, 57.4]
  - - [128, 2048, 1, 128, 128, 128, 128, 2048]
    - [71, 7.66]
  - - [128, 2048, 1, 256, 128, 128, 128, 2048]
    - [76, 13.33]
  - - [128, 2048, 1, 512, 128, 128, 128, 2048]
    - [119, 21.88]
  - - [128, 2048, 1, 1024, 128, 128, 128, 2048]
    - [121, 32.6]
  - - [128, 2048, 1, 2048, 128, 128, 128, 2048]
    - [110, 42.55]
  - - [128, 2048, 1, 4096, 128, 128, 128, 2048]
    - [62, 61.57]
  - - [128, 2048, 1, 8192, 128, 128, 128, 2048]
    - [99, 95.22]
  - - [128, 4096, 1, 128, 128, 128, 128, 4096]
    - [12, 14.4]
  - - [128, 4096, 1, 256, 128, 128, 128, 4096]
    - [109, 24.76]
  - - [128, 4096, 1, 512, 128, 128, 128, 4096]
    - [110, 40.42]
  - - [128, 4096, 1, 1024, 128, 128, 128, 4096]
    - [105, 58.85]
  - - [128, 4096, 1, 2048, 128, 128, 128, 4096]
    - [99, 73.94]
  - - [128, 4096, 1, 4096, 128, 128, 128, 4096]
    - [99, 105.46]
  - - [128, 4096, 1, 8192, 128, 128, 128, 4096]
    - [95, 142.58]
  - - [128, 8192, 1, 128, 128, 128, 128, 8192]
    - [61, 26.9]
  - - [128, 8192, 1, 256, 128, 128, 128, 8192]
    - [60, 46.65]
  - - [128, 8192, 1, 512, 128, 128, 128, 8192]
    - [99, 72.28]
  - - [128, 8192, 1, 1024, 128, 128, 128, 8192]
    - [100, 104.19]
  - - [128, 8192, 1, 2048, 128, 128, 128, 8192]
    - [99, 127.04]
  - - [128, 8192, 1, 4096, 128, 128, 128, 8192]
    - [95, 155.51]
  - - [128, 8192, 1, 8192, 128, 128, 128, 8192]
    - [89, 191.17]
  - - [256, 128, 1, 128, 256, 256, 256, 128]
    - [14, 1.02]
  - - [256, 128, 1, 256, 256, 256, 256, 128]
    - [73, 1.82]
  - - [256, 128, 1, 512, 256, 256, 256, 128]
    - [114, 2.91]
  - - [256, 128, 1, 1024, 256, 256, 256, 128]
    - [117, 4.45]
  - - [256, 128, 1, 2048, 256, 256, 256, 128]
    - [17, 6.72]
  - - [256, 128, 1, 4096, 256, 256, 256, 128]
    - [77, 11.31]
  - - [256, 128, 1, 8192, 256, 256, 256, 128]
    - [121, 17.58]
  - - [256, 256, 1, 128, 256, 256, 256, 256]
    - [16, 2.03]
  - - [256, 256, 1, 256, 256, 256, 256, 256]
    - [73, 3.6]
  - - [256, 256, 1, 512, 256, 256, 256, 256]
    - [121, 5.76]
  - - [256, 256, 1, 1024, 256, 256, 256, 256]
    - [121, 8.62]
  - - [256, 256, 1, 2048, 256, 256, 256, 256]
    - [117, 13.2]
  - - [256, 256, 1, 4096, 256, 256, 256, 256]
    - [74, 21.93]
  - - [256, 256, 1, 8192, 256, 256, 256, 256]
    - [117, 34.0]
  - - [256, 512, 1, 128, 256, 256, 256, 512]
    - [75, 3.79]
  - - [256, 512, 1, 256, 256, 256, 256, 512]
    - [74, 6.92]
  - - [256, 512, 1, 512, 256, 256, 256, 512]
    - [74, 11.15]
  - - [256, 512, 1, 1024, 256, 256, 256, 512]
    - [121, 17.13]
  - - [256, 512, 1, 2048, 256, 256, 256, 512]
    - [121, 24.53]
  - - [256, 512, 1, 4096, 256, 256, 256, 512]
    - [68, 38.27]
  - - [256, 512, 1, 8192, 256, 256, 256, 512]
    - [108, 59.02]
  - - [256, 1024, 1, 128, 256, 256, 256, 1024]
    - [76, 7.49]
  - - [256, 1024, 1, 256, 256, 256, 256, 1024]
    - [76, 13.06]
  - - [256, 1024, 1, 512, 256, 256, 256, 1024]
    - [119, 21.92]
  - - [256, 1024, 1, 1024, 256, 256, 256, 1024]
    - [121, 31.89]
  - - [256, 1024, 1, 2048, 256, 256, 256, 1024]
    - [104, 44.34]
  - - [256, 1024, 1, 4096, 256, 256, 256, 1024]
    - [65, 65.53]
  - - [256, 1024, 1, 8192, 256, 256, 256, 1024]
    - [100, 97.66]
  - - [256, 2048, 1, 128, 256, 256, 256, 2048]
    - [12, 14.46]
  - - [256, 2048, 1, 256, 256, 256, 256, 2048]
    - [70, 24.6]
  - - [256, 2048, 1, 512, 256, 256, 256, 2048]
    - [105, 40.34]
  - - [256, 2048, 1, 1024, 256, 256, 256, 2048]
    - [108, 58.64]
  - - [256, 2048, 1, 2048, 256, 256, 256, 2048]
    - [99, 74.34]
  - - [256, 2048, 1, 4096, 256, 256, 256, 2048]
    - [102, 105.71]
  - - [256, 2048, 1, 8192, 256, 256, 256, 2048]
    - [94, 141.28]
  - - [256, 4096, 1, 128, 256, 256, 256, 4096]
    - [10, 26.01]
  - - [256, 4096, 1, 256, 256, 256, 256, 4096]
    - [101, 44.32]
  - - [256, 4096, 1, 512, 256, 256, 256, 4096]
    - [63, 71.92]
  - - [256, 4096, 1, 1024, 256, 256, 256, 4096]
    - [100, 100.44]
  - - [256, 4096, 1, 2048, 256, 256, 256, 4096]
    - [99, 130.25]
  - - [256, 4096, 1, 4096, 256, 256, 256, 4096]
    - [94, 157.38]
  - - [256, 4096, 1, 8192, 256, 256, 256, 4096]
    - [92, 197.45]
  - - [256, 8192, 1, 128, 256, 256, 256, 8192]
    - [54, 46.26]
  - - [256, 8192, 1, 256, 256, 256, 256, 8192]
    - [56, 78.57]
  - - [256, 8192, 1, 512, 256, 256, 256, 8192]
    - [95, 123.97]
  - - [256, 8192, 1, 1024, 256, 256, 256, 8192]
    - [95, 173.68]
  - - [256, 8192, 1, 2048, 256, 256, 256, 8192]
    - [97, 184.89]
  - - [256, 8192, 1, 4096, 256, 256, 256, 8192]
    - [88, 213.11]
  - - [256, 8192, 1, 8192, 256, 256, 256, 8192]
    - [81, 252.73]
  - - [512, 128, 1, 128, 512, 512, 512, 128]
    - [116, 1.89]
  - - [512, 128, 1, 256, 512, 512, 512, 128]
    - [115, 3.48]
  - - [512, 128, 1, 512, 512, 512, 512, 128]
    - [121, 5.79]
  - - [512, 128, 1, 1024, 512, 512, 512, 128]
    - [121, 8.61]
  - - [512, 128, 1, 2048, 512, 512, 512, 128]
    - [121, 13.13]
  - - [512, 128, 1, 4096, 512, 512, 512, 128]
    - [74, 21.79]
  - - [512, 128, 1, 8192, 512, 512, 512, 128]
    - [122, 33.66]
  - - [512, 256, 1, 128, 512, 512, 512, 256]
    - [73, 4.03]
  - - [512, 256, 1, 256, 512, 512, 512, 256]
    - [117, 6.98]
  - - [512, 256, 1, 512, 512, 512, 512, 256]
    - [121, 11.72]
  - - [512, 256, 1, 1024, 512, 512, 512, 256]
    - [121, 17.38]
  - - [512, 256, 1, 2048, 512, 512, 512, 256]
    - [121, 25.11]
  - - [512, 256, 1, 4096, 512, 512, 512, 256]
    - [69, 38.58]
  - - [512, 256, 1, 8192, 512, 512, 512, 256]
    - [113, 58.36]
  - - [512, 512, 1, 128, 512, 512, 512, 512]
    - [16, 7.82]
  - - [512, 512, 1, 256, 512, 512, 512, 512]
    - [73, 13.68]
  - - [512, 512, 1, 512, 512, 512, 512, 512]
    - [118, 22.23]
  - - [512, 512, 1, 1024, 512, 512, 512, 512]
    - [120, 33.08]
  - - [512, 512, 1, 2048, 512, 512, 512, 512]
    - [104, 44.79]
  - - [512, 512, 1, 4096, 512, 512, 512, 512]
    - [111, 63.3]
  - - [512, 512, 1, 8192, 512, 512, 512, 512]
    - [102, 93.43]
  - - [512, 1024, 1, 128, 512, 512, 512, 1024]
    - [106, 14.52]
  - - [512, 1024, 1, 256, 512, 512, 512, 1024]
    - [109, 25.41]
  - - [512, 1024, 1, 512, 512, 512, 512, 1024]
    - [110, 40.66]
  - - [512, 1024, 1, 1024, 512, 512, 512, 1024]
    - [109, 59.66]
  - - [512, 1024, 1, 2048, 512, 512, 512, 1024]
    - [108, 77.41]
  - - [512, 1024, 1, 4096, 512, 512, 512, 1024]
    - [99, 106.65]
  - - [512, 1024, 1, 8192, 512, 512, 512, 1024]
    - [95, 147.5]
  - - [512, 2048, 1, 128, 512, 512, 512, 2048]
    - [61, 26.8]
  - - [512, 2048, 1, 256, 512, 512, 512, 2048]
    - [60, 46.38]
  - - [512, 2048, 1, 512, 512, 512, 512, 2048]
    - [63, 72.24]
  - - [512, 2048, 1, 1024, 512, 512, 512, 2048]
    - [99, 103.53]
  - - [512, 2048, 1, 2048, 512, 512, 512, 2048]
    - [62, 121.71]
  - - [512, 2048, 1, 4096, 512, 512, 512, 2048]
    - [93, 162.94]
  - - [512, 2048, 1, 8192, 512, 512, 512, 2048]
    - [88, 203.3]
  - - [512, 4096, 1, 128, 512, 512, 512, 4096]
    - [54, 46.14]
  - - [512, 4096, 1, 256, 512, 512, 512, 4096]
    - [54, 78.71]
  - - [512, 4096, 1, 512, 512, 512, 512, 4096]
    - [94, 121.72]
  - - [512, 4096, 1, 1024, 512, 512, 512, 4096]
    - [93, 169.26]
  - - [512, 4096, 1, 2048, 512, 512, 512, 4096]
    - [54, 191.28]
  - - [512, 4096, 1, 4096, 512, 512, 512, 4096]
    - [88, 207.21]
  - - [512, 4096, 1, 8192, 512, 512, 512, 4096]
    - [78, 255.19]
  - - [512, 8192, 1, 128, 512, 512, 512, 8192]
    - [8, 72.7]
  - - [512, 8192, 1, 256, 512, 512, 512, 8192]
    - [48, 122.8]
  - - [512, 8192, 1, 512, 512, 512, 512, 8192]
    - [48, 186.62]
  - - [512, 8192, 1, 1024, 512, 512, 512, 8192]
    - [48, 239.98]
  - - [512, 8192, 1, 2048, 512, 512, 512, 8192]
    - [48, 259.18]
  - - [512, 8192, 1, 4096, 512, 512, 512, 8192]
    - [90, 279.95]
  - - [512, 8192, 1, 8192, 512, 512, 512, 8192]
    - [36, 309.86]
  - - [1024, 128, 1, 128, 1024, 1024, 1024, 128]
    - [73, 4.0]
  - - [1024, 128, 1, 256, 1024, 1024, 1024, 128]
    - [73, 6.99]
  - - [1024, 128, 1, 512, 1024, 1024, 1024, 128]
    - [121, 11.53]
  - - [1024, 128, 1, 1024, 1024, 1024, 1024, 128]
    - [121, 17.18]
  - - [1024, 128, 1, 2048, 1024, 1024, 1024, 128]
    - [121, 24.82]
  - - [1024, 128, 1, 4096, 1024, 1024, 1024, 128]
    - [66, 37.33]
  - - [1024, 128, 1, 8192, 1024, 1024, 1024, 128]
    - [112, 56.78]
  - - [1024, 256, 1, 128, 1024, 1024, 1024, 256]
    - [17, 7.87]
  - - [1024, 256, 1, 256, 1024, 1024, 1024, 256]
    - [73, 13.82]
  - - [1024, 256, 1, 512, 1024, 1024, 1024, 256]
    - [120, 22.48]
  - - [1024, 256, 1, 1024, 1024, 1024, 1024, 256]
    - [120, 33.32]
  - - [1024, 256, 1, 2048, 1024, 1024, 1024, 256]
    - [110, 44.75]
  - - [1024, 256, 1, 4096, 1024, 1024, 1024, 256]
    - [60, 65.63]
  - - [1024, 256, 1, 8192, 1024, 1024, 1024, 256]
    - [100, 90.42]
  - - [1024, 512, 1, 128, 1024, 1024, 1024, 512]
    - [13, 14.65]
  - - [1024, 512, 1, 256, 1024, 1024, 1024, 512]
    - [110, 25.32]
  - - [1024, 512, 1, 512, 1024, 1024, 1024, 512]
    - [109, 41.41]
  - - [1024, 512, 1, 1024, 1024, 1024, 1024, 512]
    - [110, 59.85]
  - - [1024, 512, 1, 2048, 1024, 1024, 1024, 512]
    - [110, 77.13]
  - - [1024, 512, 1, 4096, 1024, 1024, 1024, 512]
    - [54, 106.61]
  - - [1024, 512, 1, 8192, 1024, 1024, 1024, 512]
    - [98, 142.55]
  - - [1024, 1024, 1, 128, 1024, 1024, 1024, 1024]
    - [11, 26.51]
  - - [1024, 1024, 1, 256, 1024, 1024, 1024, 1024]
    - [60, 46.36]
  - - [1024, 1024, 1, 512, 1024, 1024, 1024, 1024]
    - [63, 72.89]
  - - [1024, 1024, 1, 1024, 1024, 1024, 1024, 1024]
    - [99, 103.52]
  - - [1024, 1024, 1, 2048, 1024, 1024, 1024, 1024]
    - [100, 132.42]
  - - [1024, 1024, 1, 4096, 1024, 1024, 1024, 1024]
    - [95, 153.42]
  - - [1024, 1024, 1, 8192, 1024, 1024, 1024, 1024]
    - [88, 194.64]
  - - [1024, 2048, 1, 128, 1024, 1024, 1024, 2048]
    - [54, 46.68]
  - - [1024, 2048, 1, 256, 1024, 1024, 1024, 2048]
    - [54, 79.7]
  - - [1024, 2048, 1, 512, 1024, 1024, 1024, 2048]
    - [54, 121.63]
  - - [1024, 2048, 1, 1024, 1024, 1024, 1024, 2048]
    - [95, 171.98]
  - - [1024, 2048, 1, 2048, 1024, 1024, 1024, 2048]
    - [51, 194.94]
  - - [1024, 2048, 1, 4096, 1024, 1024, 1024, 2048]
    - [88, 214.63]
  - - [1024, 2048, 1, 8192, 1024, 1024, 1024, 2048]
    - [81, 249.39]
  - - [1024, 4096, 1, 128, 1024, 1024, 1024, 4096]
    - [7, 73.13]
  - - [1024, 4096, 1, 256, 1024, 1024, 1024, 4096]
    - [48, 121.25]
  - - [1024, 4096, 1, 512, 1024, 1024, 1024, 4096]
    - [48, 186.54]
  - - [1024, 4096, 1, 1024, 1024, 1024, 1024, 4096]
    - [47, 236.43]
  - - [1024, 4096, 1, 2048, 1024, 1024, 1024, 4096]
    - [48, 265.21]
  - - [1024, 4096, 1, 4096, 1024, 1024, 1024, 4096]
    - [88, 276.74]
  - - [1024, 4096, 1, 8192, 1024, 1024, 1024, 4096]
    - [40, 298.36]
  - - [1024, 8192, 1, 128, 1024, 1024, 1024, 8192]
    - [41, 102.62]
  - - [1024, 8192, 1, 256, 1024, 1024, 1024, 8192]
    - [41, 172.82]
  - - [1024, 8192, 1, 512, 1024, 1024, 1024, 8192]
    - [41, 240.64]
  - - [1024, 8192, 1, 1024, 1024, 1024, 1024, 8192]
    - [39, 295.58]
  - - [1024, 8192, 1, 2048, 1024, 1024, 1024, 8192]
    - [39, 340.51]
  - - [1024, 8192, 1, 4096, 1024, 1024, 1024, 8192]
    - [78, 366.06]
  - - [1024, 8192, 1, 8192, 1024, 1024, 1024, 8192]
    - [26, 344.87]
  - - [2048, 128, 1, 128, 2048, 2048, 2048, 128]
    - [72, 7.61]
  - - [2048, 128, 1, 256, 2048, 2048, 2048, 128]
    - [120, 13.27]
  - - [2048, 128, 1, 512, 2048, 2048, 2048, 128]
    - [120, 22.16]
  - - [2048, 128, 1, 1024, 2048, 2048, 2048, 128]
    - [120, 32.99]
  - - [2048, 128, 1, 2048, 2048, 2048, 2048, 128]
    - [107, 41.9]
  - - [2048, 128, 1, 4096, 2048, 2048, 2048, 128]
    - [60, 61.9]
  - - [2048, 128, 1, 8192, 2048, 2048, 2048, 128]
    - [99, 88.25]
  - - [2048, 256, 1, 128, 2048, 2048, 2048, 256]
    - [67, 14.85]
  - - [2048, 256, 1, 256, 2048, 2048, 2048, 256]
    - [67, 25.53]
  - - [2048, 256, 1, 512, 2048, 2048, 2048, 256]
    - [109, 41.21]
  - - [2048, 256, 1, 1024, 2048, 2048, 2048, 256]
    - [109, 59.91]
  - - [2048, 256, 1, 2048, 2048, 2048, 2048, 256]
    - [62, 72.22]
  - - [2048, 256, 1, 4096, 2048, 2048, 2048, 256]
    - [56, 103.6]
  - - [2048, 256, 1, 8192, 2048, 2048, 2048, 256]
    - [96, 136.55]
  - - [2048, 512, 1, 128, 2048, 2048, 2048, 512]
    - [60, 27.06]
  - - [2048, 512, 1, 256, 2048, 2048, 2048, 512]
    - [60, 46.88]
  - - [2048, 512, 1, 512, 2048, 2048, 2048, 512]
    - [62, 72.77]
  - - [2048, 512, 1, 1024, 2048, 2048, 2048, 512]
    - [100, 103.11]
  - - [2048, 512, 1, 2048, 2048, 2048, 2048, 512]
    - [64, 120.08]
  - - [2048, 512, 1, 4096, 2048, 2048, 2048, 512]
    - [96, 151.79]
  - - [2048, 512, 1, 8192, 2048, 2048, 2048, 512]
    - [90, 200.41]
  - - [2048, 1024, 1, 128, 2048, 2048, 2048, 1024]
    - [55, 46.84]
  - - [2048, 1024, 1, 256, 2048, 2048, 2048, 1024]
    - [54, 79.99]
  - - [2048, 1024, 1, 512, 2048, 2048, 2048, 1024]
    - [95, 123.0]
  - - [2048, 1024, 1, 1024, 2048, 2048, 2048, 1024]
    - [93, 170.29]
  - - [2048, 1024, 1, 2048, 2048, 2048, 2048, 1024]
    - [53, 189.4]
  - - [2048, 1024, 1, 4096, 2048, 2048, 2048, 1024]
    - [92, 204.08]
  - - [2048, 1024, 1, 8192, 2048, 2048, 2048, 1024]
    - [79, 248.85]
  - - [2048, 2048, 1, 128, 2048, 2048, 2048, 2048]
    - [7, 73.0]
  - - [2048, 2048, 1, 256, 2048, 2048, 2048, 2048]
    - [48, 121.76]
  - - [2048, 2048, 1, 512, 2048, 2048, 2048, 2048]
    - [48, 186.4]
  - - [2048, 2048, 1, 1024, 2048, 2048, 2048, 2048]
    - [48, 230.16]
  - - [2048, 2048, 1, 2048, 2048, 2048, 2048, 2048]
    - [50, 263.27]
  - - [2048, 2048, 1, 4096, 2048, 2048, 2048, 2048]
    - [92, 272.44]
  - - [2048, 2048, 1, 8192, 2048, 2048, 2048, 2048]
    - [37, 301.38]
  - - [2048, 4096, 1, 128, 2048, 2048, 2048, 4096]
    - [6, 103.18]
  - - [2048, 4096, 1, 256, 2048, 2048, 2048, 4096]
    - [41, 172.96]
  - - [2048, 4096, 1, 512, 2048, 2048, 2048, 4096]
    - [41, 240.66]
  - - [2048, 4096, 1, 1024, 2048, 2048, 2048, 4096]
    - [42, 291.55]
  - - [2048, 4096, 1, 2048, 2048, 2048, 2048, 4096]
    - [46, 339.64]
  - - [2048, 4096, 1, 4096, 2048, 2048, 2048, 4096]
    - [85, 359.88]
  - - [2048, 4096, 1, 8192, 2048, 2048, 2048, 4096]
    - [21, 348.15]
  - - [2048, 8192, 1, 128, 2048, 2048, 2048, 8192]
    - [2, 132.58]
  - - [2048, 8192, 1, 256, 2048, 2048, 2048, 8192]
    - [1, 203.33]
  - - [2048, 8192, 1, 512, 2048, 2048, 2048, 8192]
    - [19, 281.41]
  - - [2048, 8192, 1, 1024, 2048, 2048, 2048, 8192]
    - [32, 352.92]
  - - [2048, 8192, 1, 2048, 2048, 2048, 2048, 8192]
    - [32, 413.24]
  - - [2048, 8192, 1, 4096, 2048, 2048, 2048, 8192]
    - [24, 349.37]
  - - [2048, 8192, 1, 8192, 2048, 2048, 2048, 8192]
    - [34, 395.91]
  - - [4096, 128, 1, 128, 4096, 4096, 4096, 128]
    - [67, 14.36]
  - - [4096, 128, 1, 256, 4096, 4096, 4096, 128]
    - [105, 24.82]
  - - [4096, 128, 1, 512, 4096, 4096, 4096, 128]
    - [110, 40.83]
  - - [4096, 128, 1, 1024, 4096, 4096, 4096, 128]
    - [107, 57.75]
  - - [4096, 128, 1, 2048, 4096, 4096, 4096, 128]
    - [112, 69.77]
  - - [4096, 128, 1, 4096, 4096, 4096, 4096, 128]
    - [58, 102.26]
  - - [4096, 128, 1, 8192, 4096, 4096, 4096, 128]
    - [98, 136.4]
  - - [4096, 256, 1, 128, 4096, 4096, 4096, 256]
    - [10, 27.07]
  - - [4096, 256, 1, 256, 4096, 4096, 4096, 256]
    - [59, 45.9]
  - - [4096, 256, 1, 512, 4096, 4096, 4096, 256]
    - [62, 71.16]
  - - [4096, 256, 1, 1024, 4096, 4096, 4096, 256]
    - [103, 100.73]
  - - [4096, 256, 1, 2048, 4096, 4096, 4096, 256]
    - [65, 120.43]
  - - [4096, 256, 1, 4096, 4096, 4096, 4096, 256]
    - [98, 151.84]
  - - [4096, 256, 1, 8192, 4096, 4096, 4096, 256]
    - [87, 191.9]
  - - [4096, 512, 1, 128, 4096, 4096, 4096, 512]
    - [9, 46.7]
  - - [4096, 512, 1, 256, 4096, 4096, 4096, 512]
    - [55, 79.47]
  - - [4096, 512, 1, 512, 4096, 4096, 4096, 512]
    - [55, 123.69]
  - - [4096, 512, 1, 1024, 4096, 4096, 4096, 512]
    - [96, 166.89]
  - - [4096, 512, 1, 2048, 4096, 4096, 4096, 512]
    - [52, 187.42]
  - - [4096, 512, 1, 4096, 4096, 4096, 4096, 512]
    - [89, 206.07]
  - - [4096, 512, 1, 8192, 4096, 4096, 4096, 512]
    - [80, 252.08]
  - - [4096, 1024, 1, 128, 4096, 4096, 4096, 1024]
    - [7, 73.06]
  - - [4096, 1024, 1, 256, 4096, 4096, 4096, 1024]
    - [48, 122.7]
  - - [4096, 1024, 1, 512, 4096, 4096, 4096, 1024]
    - [48, 187.01]
  - - [4096, 1024, 1, 1024, 4096, 4096, 4096, 1024]
    - [49, 229.57]
  - - [4096, 1024, 1, 2048, 4096, 4096, 4096, 1024]
    - [50, 262.15]
  - - [4096, 1024, 1, 4096, 4096, 4096, 4096, 1024]
    - [91, 279.21]
  - - [4096, 1024, 1, 8192, 4096, 4096, 4096, 1024]
    - [37, 301.38]
  - - [4096, 2048, 1, 128, 4096, 4096, 4096, 2048]
    - [5, 102.68]
  - - [4096, 2048, 1, 256, 4096, 4096, 4096, 2048]
    - [41, 173.12]
  - - [4096, 2048, 1, 512, 4096, 4096, 4096, 2048]
    - [44, 238.79]
  - - [4096, 2048, 1, 1024, 4096, 4096, 4096, 2048]
    - [45, 290.06]
  - - [4096, 2048, 1, 2048, 4096, 4096, 4096, 2048]
    - [36, 342.68]
  - - [4096, 2048, 1, 4096, 4096, 4096, 4096, 2048]
    - [83, 366.09]
  - - [4096, 2048, 1, 8192, 4096, 4096, 4096, 2048]
    - [29, 346.43]
  - - [4096, 4096, 1, 128, 4096, 4096, 4096, 4096]
    - [1, 131.66]
  - - [4096, 4096, 1, 256, 4096, 4096, 4096, 4096]
    - [0, 203.78]
  - - [4096, 4096, 1, 512, 4096, 4096, 4096, 4096]
    - [23, 280.03]
  - - [4096, 4096, 1, 1024, 4096, 4096, 4096, 4096]
    - [31, 351.98]
  - - [4096, 4096, 1, 2048, 4096, 4096, 4096, 4096]
    - [30, 412.97]
  - - [4096, 4096, 1, 4096, 4096, 4096, 4096, 4096]
    - [21, 349.81]
  - - [4096, 4096, 1, 8192, 4096, 4096, 4096, 4096]
    - [20, 396.27]
  - - [4096, 8192, 1, 128, 4096, 4096, 4096, 8192]
    - [35, 130.97]
  - - [4096, 8192, 1, 256, 4096, 4096, 4096, 8192]
    - [40, 163.54]
  - - [4096, 8192, 1, 512, 4096, 4096, 4096, 8192]
    - [81, 222.85]
  - - [4096, 8192, 1, 1024, 4096, 4096, 4096, 8192]
    - [31, 288.38]
  - - [4096, 8192, 1, 2048, 4096, 4096, 4096, 8192]
    - [21, 337.77]
  - - [4096, 8192, 1, 4096, 4096, 4096, 4096, 8192]
    - [18, 394.28]
  - - [4096, 8192, 1, 8192, 4096, 4096, 4096, 8192]
    - [18, 423.79]
  - - [8192, 128, 1, 128, 8192, 8192, 8192, 128]
    - [60, 27.2]
  - - [8192, 128, 1, 256, 8192, 8192, 8192, 128]
    - [60, 46.75]
  - - [8192, 128, 1, 512, 8192, 8192, 8192, 128]
    - [60, 72.76]
  - - [8192, 128, 1, 1024, 8192, 8192, 8192, 128]
    - [99, 103.25]
  - - [8192, 128, 1, 2048, 8192, 8192, 8192, 128]
    - [58, 115.52]
  - - [8192, 128, 1, 4096, 8192, 8192, 8192, 128]
    - [96, 149.32]
  - - [8192, 128, 1, 8192, 8192, 8192, 8192, 128]
    - [87, 186.54]
  - - [8192, 256, 1, 128, 8192, 8192, 8192, 256]
    - [55, 45.93]
  - - [8192, 256, 1, 256, 8192, 8192, 8192, 256]
    - [55, 79.02]
  - - [8192, 256, 1, 512, 8192, 8192, 8192, 256]
    - [55, 120.71]
  - - [8192, 256, 1, 1024, 8192, 8192, 8192, 256]
    - [98, 168.45]
  - - [8192, 256, 1, 2048, 8192, 8192, 8192, 256]
    - [57, 182.74]
  - - [8192, 256, 1, 4096, 8192, 8192, 8192, 256]
    - [91, 209.87]
  - - [8192, 256, 1, 8192, 8192, 8192, 8192, 256]
    - [84, 248.62]
  - - [8192, 512, 1, 128, 8192, 8192, 8192, 512]
    - [48, 73.22]
  - - [8192, 512, 1, 256, 8192, 8192, 8192, 512]
    - [48, 123.17]
  - - [8192, 512, 1, 512, 8192, 8192, 8192, 512]
    - [48, 185.75]
  - - [8192, 512, 1, 1024, 8192, 8192, 8192, 512]
    - [50, 233.67]
  - - [8192, 512, 1, 2048, 8192, 8192, 8192, 512]
    - [50, 262.06]
  - - [8192, 512, 1, 4096, 8192, 8192, 8192, 512]
    - [92, 279.69]
  - - [8192, 512, 1, 8192, 8192, 8192, 8192, 512]
    - [37, 308.01]
  - - [8192, 1024, 1, 128, 8192, 8192, 8192, 1024]
    - [41, 102.69]
  - - [8192, 1024, 1, 256, 8192, 8192, 8192, 1024]
    - [41, 171.74]
  - - [8192, 1024, 1, 512, 8192, 8192, 8192, 1024]
    - [43, 237.36]
  - - [8192, 1024, 1, 1024, 8192, 8192, 8192, 1024]
    - [45, 291.96]
  - - [8192, 1024, 1, 2048, 8192, 8192, 8192, 1024]
    - [46, 338.92]
  - - [8192, 1024, 1, 4096, 8192, 8192, 8192, 1024]
    - [86, 366.55]
  - - [8192, 1024, 1, 8192, 8192, 8192, 8192, 1024]
    - [28, 346.32]
  - - [8192, 2048, 1, 128, 8192, 8192, 8192, 2048]
    - [3, 131.33]
  - - [8192, 2048, 1, 256, 8192, 8192, 8192, 2048]
    - [4, 201.08]
  - - [8192, 2048, 1, 512, 8192, 8192, 8192, 2048]
    - [25, 277.59]
  - - [8192, 2048, 1, 1024, 8192, 8192, 8192, 2048]
    - [23, 347.38]
  - - [8192, 2048, 1, 2048, 8192, 8192, 8192, 2048]
    - [25, 407.36]
  - - [8192, 2048, 1, 4096, 8192, 8192, 8192, 2048]
    - [33, 343.98]
  - - [8192, 2048, 1, 8192, 8192, 8192, 8192, 2048]
    - [34, 395.52]
  - - [8192, 4096, 1, 128, 8192, 8192, 8192, 4096]
    - [31, 130.15]
  - - [8192, 4096, 1, 256, 8192, 8192, 8192, 4096]
    - [38, 163.41]
  - - [8192, 4096, 1, 512, 8192, 8192, 8192, 4096]
    - [82, 220.86]
  - - [8192, 4096, 1, 1024, 8192, 8192, 8192, 4096]
    - [22, 283.15]
  - - [8192, 4096, 1, 2048, 8192, 8192, 8192, 4096]
    - [18, 344.82]
  - - [8192, 4096, 1, 4096, 8192, 8192, 8192, 4096]
    - [21, 395.03]
  - - [8192, 4096, 1, 8192, 8192, 8192, 8192, 4096]
    - [19, 427.59]
  - - [8192, 8192, 1, 128, 8192, 8192, 8192, 8192]
    - [41, 133.07]
  - - [8192, 8192, 1, 256, 8192, 8192, 8192, 8192]
    - [24, 182.56]
  - - [8192, 8192, 1, 512, 8192, 8192, 8192, 8192]
    - [24, 244.69]
  - - [8192, 8192, 1, 1024, 8192, 8192, 8192, 8192]
    - [29, 324.27]
  - - [8192, 8192, 1, 2048, 8192, 8192, 8192, 8192]
    - [27, 381.23]
  - - [8192, 8192, 1, 4096, 8192, 8192, 8192, 8192]
    - [31, 438.11]
  - - [8192, 8192, 1, 8192, 8192, 8192, 8192, 8192]
    - [24, 469.08]
  - - [1, 1, 1, 32, 1, 1, 1, 1]
    - [123, 0.0]
- null
- null
- ExperimentalStreamK
- GridBased
