projects/hipblaslt/library/src/amd_detail/rocblaslt/src/Tensile/Logic/asm_full/aquavanjaram/gfx942/StreamK/aquavanjaram942_Cijk_Alik_Bljk_I8II_BH_UserArgs.yaml
- {MinimumRequiredVersion: 4.33.0}
- aquavanjaram942
- gfx942
- [Device 0049, Device 0050]
    SolutionIndex: 0
    SolutionNameMin: Cijk_Alik_Bljk_I8II_BH_UserArgs_MT256x256x32_MI16x16x1_SN_CLR0_GSU0_GSUC0_GSUWGMRR0_K1_LBSPPA128_LBSPPB256_MIWT8_8_PLR0_SU0_SUM0_SUS0_SKXCCM8_VWA4_VWB8_WGM1_WGMXCC1_WGMXCCGn1
    SolutionIndex: 1
    SolutionNameMin: Cijk_Alik_Bljk_I8II_BH_UserArgs_MT256x256x32_MI16x16x1_SN_CLR0_GSU0_GSUC0_GSUWGMRR0_K1_LBSPPA128_LBSPPB128_MIWT8_8_PLR0_SU0_SUM0_SUS0_SKXCCM8_VWA4_VWB4_WGM4_WGMXCC1_WGMXCCGn1
    SolutionIndex: 2
    SolutionNameMin: Cijk_Alik_Bljk_I8II_BH_UserArgs_MT128x64x32_MI16x16x1_SN_CLR0_GSU0_GSUC0_GSUWGMRR0_K1_LBSPPA128_LBSPPB128_MIWT4_2_PLR0_SU0_SUM0_SUS0_SKXCCM8_VWA4_VWB1_WGM1_WGMXCC1_WGMXCCGn1
    SolutionIndex: 3
    SolutionNameMin: Cijk_Alik_Bljk_I8II_BH_UserArgs_MT128x64x32_MI16x16x1_SN_CLR0_GSU0_GSUC0_GSUWGMRR0_K1_LBSPPA128_LBSPPB128_MIWT4_2_PLR0_SU0_SUM0_SUS0_SKXCCM8_VWA1_VWB2_WGM1_WGMXCC1_WGMXCCGn1
    SolutionIndex: 4
    SolutionNameMin: Cijk_Alik_Bljk_I8II_BH_UserArgs_MT64x64x32_MI16x16x1_SN_CLR0_GSU0_GSUC0_GSUWGMRR0_K1_LBSPPA128_LBSPPB128_MIWT2_2_PLR0_SU0_SUM0_SUS0_SKXCCM8_VWA1_VWB1_WGM1_WGMXCC1_WGMXCCGn1
    SolutionIndex: 5
    SolutionNameMin: Cijk_Alik_Bljk_I8II_BH_UserArgs_MT64x64x32_MI16x16x1_SN_CLR0_GSU0_GSUC0_GSUWGMRR0_K1_LBSPPA128_LBSPPB128_MIWT2_2_PLR0_SU0_SUM0_SUS0_SKXCCM8_VWA1_VWB2_WGM1_WGMXCC1_WGMXCCGn1
    SolutionIndex: 6
    SolutionNameMin: Cijk_Alik_Bljk_I8II_BH_UserArgs_MT32x64x32_MI16x16x1_SN_CLR0_GSU0_GSUC0_GSUWGMRR0_K1_LBSPPA128_LBSPPB128_MIWT1_2_PLR0_SU0_SUM0_SUS0_SKXCCM8_VWA1_VWB1_WGM1_WGMXCC1_WGMXCCGn1
    SolutionIndex: 7
    SolutionNameMin: Cijk_Alik_Bljk_I8II_BH_UserArgs_MT64x32x32_MI16x16x1_SN_CLR0_GSU0_GSUC0_GSUWGMRR0_K1_LBSPPA128_LBSPPB128_MIWT2_1_PLR0_SU0_SUM0_SUS0_SKXCCM8_VWA1_VWB1_WGM1_WGMXCC1_WGMXCCGn1
    SolutionIndex: 8
    SolutionNameMin: Cijk_Alik_Bljk_I8II_BH_UserArgs_MT64x32x32_MI16x16x1_SN_CLR0_GSU0_GSUC0_GSUWGMRR0_K1_LBSPPA128_LBSPPB128_MIWT2_1_PLR0_SU0_SUM0_SUS0_SKXCCM8_VWA2_VWB1_WGM1_WGMXCC1_WGMXCCGn1
    SolutionIndex: 9
    SolutionNameMin: Cijk_Alik_Bljk_I8II_BH_UserArgs_MT32x32x32_MI16x16x1_SN_CLR0_GSU0_GSUC0_GSUWGMRR0_K1_LBSPPA128_LBSPPB128_MIWT1_1_PLR0_SU0_SUM0_SUS0_SKXCCM8_VWA1_VWB1_WGM4_WGMXCC1_WGMXCCGn1
    SolutionIndex: 10
    SolutionNameMin: Cijk_Alik_Bljk_I8II_BH_UserArgs_MT32x32x32_MI16x16x1_SN_CLR0_GSU0_GSUC0_GSUWGMRR0_K1_LBSPPA128_LBSPPB128_MIWT1_1_PLR0_SU0_SUM0_SUS0_SKXCCM8_VWA1_VWB1_WGM8_WGMXCC1_WGMXCCGn1
    SolutionIndex: 11
    SolutionNameMin: Cijk_Alik_Bljk_I8II_BH_UserArgs_MT32x32x32_MI16x16x1_SN_CLR0_GSU0_GSUC0_GSUWGMRR0_K1_LBSPPA128_LBSPPB128_MIWT1_1_PLR0_SU0_SUM0_SUS0_SKXCCM8_VWA1_VWB1_WGM8_WGMXCC1_WGMXCCGn1
    SolutionIndex: 12
    SolutionNameMin: Cijk_Alik_Bljk_I8II_BH_UserArgs_MT256x256x64_MI16x16x1_SN_CLR1_GSU0_GSUC0_GSUWGMRR0_K1_LBSPPA128_LBSPPB128_MIWT8_8_PLR1_SU0_SUM0_SUS0_SKXCCM8_VWA2_VWB1_WGM1_WGMXCC1_WGMXCCGn1
    SolutionIndex: 13
    SolutionNameMin: Cijk_Alik_Bljk_I8II_BH_UserArgs_MT256x256x64_MI16x16x1_SN_CLR1_GSU0_GSUC0_GSUWGMRR0_K1_LBSPPA256_LBSPPB128_MIWT8_8_PLR1_SU0_SUM0_SUS0_SKXCCM8_VWA4_VWB1_WGM1_WGMXCC1_WGMXCCGn1
    SolutionIndex: 14
    SolutionNameMin: Cijk_Alik_Bljk_I8II_BH_UserArgs_MT256x256x64_MI16x16x1_SN_CLR1_GSU0_GSUC0_GSUWGMRR0_K1_LBSPPA256_LBSPPB128_MIWT8_8_PLR1_SU0_SUM0_SUS0_SKXCCM8_VWA4_VWB2_WGM1_WGMXCC1_WGMXCCGn1
    SolutionIndex: 15
    SolutionNameMin: Cijk_Alik_Bljk_I8II_BH_UserArgs_MT256x256x64_MI16x16x1_SN_CLR1_GSU0_GSUC0_GSUWGMRR0_K1_LBSPPA128_LBSPPB256_MIWT8_8_PLR1_SU0_SUM0_SUS0_SKXCCM8_VWA2_VWB4_WGM1_WGMXCC1_WGMXCCGn1
    SolutionIndex: 16
    SolutionNameMin: Cijk_Alik_Bljk_I8II_BH_UserArgs_MT256x256x64_MI16x16x1_SN_CLR1_GSU0_GSUC0_GSUWGMRR0_K1_LBSPPA256_LBSPPB256_MIWT8_8_PLR1_SU0_SUM0_SUS0_SKXCCM8_VWA4_VWB4_WGM1_WGMXCC1_WGMXCCGn1
    SolutionIndex: 17
    SolutionNameMin: Cijk_Alik_Bljk_I8II_BH_UserArgs_MT256x256x64_MI16x16x1_SN_CLR1_GSU0_GSUC0_GSUWGMRR0_K1_LBSPPA128_LBSPPB512_MIWT8_8_PLR1_SU0_SUM0_SUS0_SKXCCM8_VWA2_VWB8_WGM1_WGMXCC1_WGMXCCGn1
    SolutionIndex: 18
    SolutionNameMin: Cijk_Alik_Bljk_I8II_BH_UserArgs_MT256x256x64_MI16x16x1_SN_CLR1_GSU0_GSUC0_GSUWGMRR0_K1_LBSPPA256_LBSPPB256_MIWT8_8_PLR1_SU0_SUM0_SUS0_SKXCCM8_VWA4_VWB4_WGM1_WGMXCC1_WGMXCCGn1
    SolutionIndex: 19
    SolutionNameMin: Cijk_Alik_Bljk_I8II_BH_UserArgs_MT256x256x64_MI16x16x1_SN_CLR1_GSU0_GSUC0_GSUWGMRR0_K1_LBSPPA256_LBSPPB128_MIWT8_8_PLR1_SU0_SUM0_SUS0_SKXCCM8_VWA4_VWB1_WGM1_WGMXCC1_WGMXCCGn1
    SolutionIndex: 20
    SolutionNameMin: Cijk_Alik_Bljk_I8II_BH_UserArgs_MT256x256x64_MI16x16x1_SN_CLR1_GSU0_GSUC0_GSUWGMRR0_K1_LBSPPA128_LBSPPB128_MIWT8_8_PLR1_SU0_SUM0_SUS0_SKXCCM8_VWA1_VWB2_WGM1_WGMXCC1_WGMXCCGn1
    SolutionIndex: 21
    SolutionNameMin: Cijk_Alik_Bljk_I8II_BH_UserArgs_MT256x256x64_MI16x16x1_SN_CLR1_GSU0_GSUC0_GSUWGMRR0_K1_LBSPPA256_LBSPPB256_MIWT8_8_PLR1_SU0_SUM0_SUS0_SKXCCM8_VWA4_VWB4_WGM1_WGMXCC1_WGMXCCGn1
    SolutionIndex: 22
    SolutionNameMin: Cijk_Alik_Bljk_I8II_BH_UserArgs_MT256x256x64_MI16x16x1_SN_CLR1_GSU0_GSUC0_GSUWGMRR0_K1_LBSPPA128_LBSPPB512_MIWT8_8_PLR1_SU0_SUM0_SUS0_SKXCCM8_VWA2_VWB8_WGM1_WGMXCC1_WGMXCCGn1
    SolutionIndex: 23
    SolutionNameMin: Cijk_Alik_Bljk_I8II_BH_UserArgs_MT256x256x64_MI16x16x1_SN_CLR1_GSU0_GSUC0_GSUWGMRR0_K1_LBSPPA256_LBSPPB512_MIWT8_8_PLR1_SU0_SUM0_SUS0_SKXCCM8_VWA4_VWB8_WGM1_WGMXCC1_WGMXCCGn1
    SolutionIndex: 24
    SolutionNameMin: Cijk_Alik_Bljk_I8II_BH_UserArgs_MT256x256x64_MI16x16x1_SN_CLR1_GSU0_GSUC0_GSUWGMRR0_K1_LBSPPA128_LBSPPB128_MIWT8_8_PLR1_SU0_SUM0_SUS0_SKXCCM8_VWA2_VWB2_WGM4_WGMXCC1_WGMXCCGn1
    SolutionIndex: 25
    SolutionNameMin: Cijk_Alik_Bljk_I8II_BH_UserArgs_MT256x256x64_MI16x16x1_SN_CLR1_GSU0_GSUC0_GSUWGMRR0_K1_LBSPPA256_LBSPPB256_MIWT8_8_PLR1_SU0_SUM0_SUS0_SKXCCM8_VWA4_VWB4_WGM4_WGMXCC1_WGMXCCGn1
    SolutionIndex: 26
    SolutionNameMin: Cijk_Alik_Bljk_I8II_BH_UserArgs_MT256x256x64_MI16x16x1_SN_CLR1_GSU0_GSUC0_GSUWGMRR0_K1_LBSPPA128_LBSPPB128_MIWT8_8_PLR1_SU0_SUM0_SUS0_SKXCCM8_VWA2_VWB2_WGM4_WGMXCC1_WGMXCCGn1
    SolutionIndex: 27
    SolutionNameMin: Cijk_Alik_Bljk_I8II_BH_UserArgs_MT256x256x64_MI16x16x1_SN_CLR1_GSU0_GSUC0_GSUWGMRR0_K1_LBSPPA256_LBSPPB512_MIWT8_8_PLR1_SU0_SUM0_SUS0_SKXCCM8_VWA4_VWB8_WGM4_WGMXCC1_WGMXCCGn1
    SolutionIndex: 28
    SolutionNameMin: Cijk_Alik_Bljk_I8II_BH_UserArgs_MT256x256x64_MI16x16x1_SN_CLR1_GSU0_GSUC0_GSUWGMRR0_K1_LBSPPA128_LBSPPB256_MIWT8_8_PLR1_SU0_SUM0_SUS0_SKXCCM8_VWA2_VWB4_WGM8_WGMXCC1_WGMXCCGn1
    SolutionIndex: 29
    SolutionNameMin: Cijk_Alik_Bljk_I8II_BH_UserArgs_MT256x256x64_MI16x16x1_SN_CLR1_GSU0_GSUC0_GSUWGMRR0_K1_LBSPPA256_LBSPPB256_MIWT8_8_PLR1_SU0_SUM0_SUS0_SKXCCM8_VWA4_VWB4_WGM8_WGMXCC1_WGMXCCGn1
    SolutionIndex: 30
    SolutionNameMin: Cijk_Alik_Bljk_I8II_BH_UserArgs_MT256x256x64_MI16x16x1_SN_CLR1_GSU0_GSUC0_GSUWGMRR0_K1_LBSPPA256_LBSPPB256_MIWT8_8_PLR1_SU0_SUM0_SUS0_SKXCCM8_VWA4_VWB4_WGM8_WGMXCC1_WGMXCCGn1
    SolutionIndex: 31
    SolutionNameMin: Cijk_Alik_Bljk_I8II_BH_UserArgs_MT256x128x64_MI16x16x1_SN_CLR1_GSU0_GSUC0_GSUWGMRR0_K1_LBSPPA128_LBSPPB256_MIWT8_4_PLR1_SU0_SUM0_SUS0_SKXCCM8_VWA1_VWB4_WGM1_WGMXCC1_WGMXCCGn1
    SolutionIndex: 32
    SolutionNameMin: Cijk_Alik_Bljk_I8II_BH_UserArgs_MT256x128x64_MI16x16x1_SN_CLR1_GSU0_GSUC0_GSUWGMRR0_K1_LBSPPA128_LBSPPB256_MIWT8_4_PLR1_SU0_SUM0_SUS0_SKXCCM8_VWA2_VWB4_WGM1_WGMXCC1_WGMXCCGn1
    SolutionIndex: 33
    SolutionNameMin: Cijk_Alik_Bljk_I8II_BH_UserArgs_MT256x128x64_MI16x16x1_SN_CLR1_GSU0_GSUC0_GSUWGMRR0_K1_LBSPPA128_LBSPPB128_MIWT8_4_PLR1_SU0_SUM0_SUS0_SKXCCM8_VWA2_VWB2_WGM4_WGMXCC1_WGMXCCGn1
    SolutionIndex: 34
    SolutionNameMin: Cijk_Alik_Bljk_I8II_BH_UserArgs_MT256x128x64_MI16x16x1_SN_CLR1_GSU0_GSUC0_GSUWGMRR0_K1_LBSPPA256_LBSPPB256_MIWT8_4_PLR1_SU0_SUM0_SUS0_SKXCCM8_VWA4_VWB4_WGM4_WGMXCC1_WGMXCCGn1
    SolutionIndex: 35
    SolutionNameMin: Cijk_Alik_Bljk_I8II_BH_UserArgs_MT256x64x64_MI16x16x1_SN_CLR1_GSU0_GSUC0_GSUWGMRR0_K1_LBSPPA256_LBSPPB128_MIWT8_2_PLR1_SU0_SUM0_SUS0_SKXCCM8_VWA4_VWB1_WGM8_WGMXCC1_WGMXCCGn1
    SolutionIndex: 36
    SolutionNameMin: Cijk_Alik_Bljk_I8II_BH_UserArgs_MT256x64x64_MI16x16x1_SN_CLR1_GSU0_GSUC0_GSUWGMRR0_K1_LBSPPA256_LBSPPB128_MIWT8_2_PLR1_SU0_SUM0_SUS0_SKXCCM8_VWA4_VWB1_WGM8_WGMXCC1_WGMXCCGn1
    SolutionIndex: 37
    SolutionNameMin: Cijk_Alik_Bljk_I8II_BH_UserArgs_MT128x128x64_MI16x16x1_SN_CLR1_GSU0_GSUC0_GSUWGMRR0_K1_LBSPPA256_LBSPPB128_MIWT4_4_PLR1_SU0_SUM0_SUS0_SKXCCM8_VWA4_VWB1_WGM1_WGMXCC1_WGMXCCGn1
    SolutionIndex: 38
    SolutionNameMin: Cijk_Alik_Bljk_I8II_BH_UserArgs_MT128x128x64_MI16x16x1_SN_CLR1_GSU0_GSUC0_GSUWGMRR0_K1_LBSPPA256_LBSPPB128_MIWT4_4_PLR1_SU0_SUM0_SUS0_SKXCCM8_VWA4_VWB2_WGM1_WGMXCC1_WGMXCCGn1
    SolutionIndex: 39
    SolutionNameMin: Cijk_Alik_Bljk_I8II_BH_UserArgs_MT128x128x64_MI16x16x1_SN_CLR1_GSU0_GSUC0_GSUWGMRR0_K1_LBSPPA256_LBSPPB256_MIWT4_4_PLR1_SU0_SUM0_SUS0_SKXCCM8_VWA4_VWB4_WGM1_WGMXCC1_WGMXCCGn1
    SolutionIndex: 40
    SolutionNameMin: Cijk_Alik_Bljk_I8II_BH_UserArgs_MT128x128x64_MI16x16x1_SN_CLR1_GSU0_GSUC0_GSUWGMRR0_K1_LBSPPA256_LBSPPB256_MIWT4_4_PLR1_SU0_SUM0_SUS0_SKXCCM8_VWA4_VWB4_WGM4_WGMXCC1_WGMXCCGn1
    SolutionIndex: 41
    SolutionNameMin: Cijk_Alik_Bljk_I8II_BH_UserArgs_MT128x128x64_MI16x16x1_SN_CLR1_GSU0_GSUC0_GSUWGMRR0_K1_LBSPPA256_LBSPPB256_MIWT4_4_PLR1_SU0_SUM0_SUS0_SKXCCM8_VWA4_VWB4_WGM4_WGMXCC1_WGMXCCGn1
    SolutionIndex: 42
    SolutionNameMin: Cijk_Alik_Bljk_I8II_BH_UserArgs_MT128x128x64_MI16x16x1_SN_CLR1_GSU0_GSUC0_GSUWGMRR0_K1_LBSPPA256_LBSPPB256_MIWT4_4_PLR1_SU0_SUM0_SUS0_SKXCCM8_VWA4_VWB4_WGM8_WGMXCC1_WGMXCCGn1
    SolutionIndex: 43
    SolutionNameMin: Cijk_Alik_Bljk_I8II_BH_UserArgs_MT128x128x64_MI16x16x1_SN_CLR1_GSU0_GSUC0_GSUWGMRR0_K1_LBSPPA256_LBSPPB256_MIWT4_4_PLR1_SU0_SUM0_SUS0_SKXCCM8_VWA4_VWB4_WGM8_WGMXCC1_WGMXCCGn1
    SolutionIndex: 44
    SolutionNameMin: Cijk_Alik_Bljk_I8II_BH_UserArgs_MT64x128x64_MI16x16x1_SN_CLR1_GSU0_GSUC0_GSUWGMRR0_K1_LBSPPA128_LBSPPB128_MIWT2_4_PLR1_SU0_SUM0_SUS0_SKXCCM8_VWA1_VWB2_WGM1_WGMXCC1_WGMXCCGn1
    SolutionIndex: 45
    SolutionNameMin: Cijk_Alik_Bljk_I8II_BH_UserArgs_MT64x128x64_MI16x16x1_SN_CLR1_GSU0_GSUC0_GSUWGMRR0_K1_LBSPPA128_LBSPPB256_MIWT2_4_PLR1_SU0_SUM0_SUS0_SKXCCM8_VWA1_VWB4_WGM1_WGMXCC1_WGMXCCGn1
    SolutionIndex: 46
    SolutionNameMin: Cijk_Alik_Bljk_I8II_BH_UserArgs_MT64x128x64_MI16x16x1_SN_CLR1_GSU0_GSUC0_GSUWGMRR0_K1_LBSPPA128_LBSPPB128_MIWT2_4_PLR1_SU0_SUM0_SUS0_SKXCCM8_VWA1_VWB1_WGM1_WGMXCC1_WGMXCCGn1
    SolutionIndex: 47
    SolutionNameMin: Cijk_Alik_Bljk_I8II_BH_UserArgs_MT64x128x64_MI16x16x1_SN_CLR1_GSU0_GSUC0_GSUWGMRR0_K1_LBSPPA128_LBSPPB256_MIWT2_4_PLR1_SU0_SUM0_SUS0_SKXCCM8_VWA1_VWB4_WGM1_WGMXCC1_WGMXCCGn1
    SolutionIndex: 48
    SolutionNameMin: Cijk_Alik_Bljk_I8II_BH_UserArgs_MT128x64x64_MI16x16x1_SN_CLR1_GSU0_GSUC0_GSUWGMRR0_K1_LBSPPA256_LBSPPB128_MIWT4_2_PLR1_SU0_SUM0_SUS0_SKXCCM8_VWA4_VWB1_WGM1_WGMXCC1_WGMXCCGn1
    SolutionIndex: 49
    SolutionNameMin: Cijk_Alik_Bljk_I8II_BH_UserArgs_MT128x64x64_MI16x16x1_SN_CLR1_GSU0_GSUC0_GSUWGMRR0_K1_LBSPPA128_LBSPPB128_MIWT4_2_PLR1_SU0_SUM0_SUS0_SKXCCM8_VWA1_VWB2_WGM1_WGMXCC1_WGMXCCGn1
    SolutionIndex: 50
    SolutionNameMin: Cijk_Alik_Bljk_I8II_BH_UserArgs_MT128x64x64_MI16x16x1_SN_CLR1_GSU0_GSUC0_GSUWGMRR0_K1_LBSPPA256_LBSPPB128_MIWT4_2_PLR1_SU0_SUM0_SUS0_SKXCCM8_VWA4_VWB2_WGM1_WGMXCC1_WGMXCCGn1
    SolutionIndex: 51
    SolutionNameMin: Cijk_Alik_Bljk_I8II_BH_UserArgs_MT128x32x64_MI16x16x1_SN_CLR1_GSU0_GSUC0_GSUWGMRR0_K1_LBSPPA256_LBSPPB128_MIWT4_1_PLR1_SU0_SUM0_SUS0_SKXCCM8_VWA4_VWB1_WGM1_WGMXCC1_WGMXCCGn1
    SolutionIndex: 52
    SolutionNameMin: Cijk_Alik_Bljk_I8II_BH_UserArgs_MT128x32x64_MI16x16x1_SN_CLR0_GSU0_GSUC0_GSUWGMRR0_K1_LBSPPA256_LBSPPB128_MIWT4_1_PLR0_SU0_SUM0_SUS0_SKXCCM8_VWA4_VWB1_WGM1_WGMXCC1_WGMXCCGn1
    SolutionIndex: 53
    SolutionNameMin: Cijk_Alik_Bljk_I8II_BH_UserArgs_MT64x64x64_MI16x16x1_SN_CLR1_GSU0_GSUC0_GSUWGMRR0_K1_LBSPPA128_LBSPPB128_MIWT2_2_PLR1_SU0_SUM0_SUS0_SKXCCM8_VWA1_VWB1_WGM1_WGMXCC1_WGMXCCGn1
    SolutionIndex: 54
    SolutionNameMin: Cijk_Alik_Bljk_I8II_BH_UserArgs_MT64x64x64_MI16x16x1_SN_CLR1_GSU0_GSUC0_GSUWGMRR0_K1_LBSPPA128_LBSPPB128_MIWT2_2_PLR1_SU0_SUM0_SUS0_SKXCCM8_VWA1_VWB1_WGM1_WGMXCC1_WGMXCCGn1
    SolutionIndex: 55
    SolutionNameMin: Cijk_Alik_Bljk_I8II_BH_UserArgs_MT64x64x64_MI16x16x1_SN_CLR1_GSU0_GSUC0_GSUWGMRR0_K1_LBSPPA128_LBSPPB128_MIWT2_2_PLR1_SU0_SUM0_SUS0_SKXCCM8_VWA1_VWB2_WGM1_WGMXCC1_WGMXCCGn1
    SolutionIndex: 56
    SolutionNameMin: Cijk_Alik_Bljk_I8II_BH_UserArgs_MT64x64x64_MI16x16x1_SN_CLR1_GSU0_GSUC0_GSUWGMRR0_K1_LBSPPA128_LBSPPB128_MIWT2_2_PLR1_SU0_SUM0_SUS0_SKXCCM8_VWA1_VWB1_WGM8_WGMXCC1_WGMXCCGn1
    SolutionIndex: 57
    SolutionNameMin: Cijk_Alik_Bljk_I8II_BH_UserArgs_MT64x64x64_MI16x16x1_SN_CLR1_GSU0_GSUC0_GSUWGMRR0_K1_LBSPPA128_LBSPPB128_MIWT2_2_PLR1_SU0_SUM0_SUS0_SKXCCM8_VWA1_VWB1_WGM8_WGMXCC1_WGMXCCGn1
    SolutionIndex: 58
    SolutionNameMin: Cijk_Alik_Bljk_I8II_BH_UserArgs_MT32x64x64_MI16x16x1_SN_CLR1_GSU0_GSUC0_GSUWGMRR0_K1_LBSPPA128_LBSPPB128_MIWT1_2_PLR1_SU0_SUM0_SUS0_SKXCCM8_VWA1_VWB1_WGM1_WGMXCC1_WGMXCCGn1
    SolutionIndex: 59
    SolutionNameMin: Cijk_Alik_Bljk_I8II_BH_UserArgs_MT64x32x64_MI16x16x1_SN_CLR1_GSU0_GSUC0_GSUWGMRR0_K1_LBSPPA128_LBSPPB128_MIWT2_1_PLR1_SU0_SUM0_SUS0_SKXCCM8_VWA1_VWB1_WGM1_WGMXCC1_WGMXCCGn1
    SolutionIndex: 60
    SolutionNameMin: Cijk_Alik_Bljk_I8II_BH_UserArgs_MT64x32x64_MI16x16x1_SN_CLR0_GSU0_GSUC0_GSUWGMRR0_K1_LBSPPA128_LBSPPB128_MIWT2_1_PLR0_SU0_SUM0_SUS0_SKXCCM8_VWA1_VWB1_WGM1_WGMXCC1_WGMXCCGn1
    SolutionIndex: 61
    SolutionNameMin: Cijk_Alik_Bljk_I8II_BH_UserArgs_MT64x32x64_MI16x16x1_SN_CLR1_GSU0_GSUC0_GSUWGMRR0_K1_LBSPPA128_LBSPPB128_MIWT2_1_PLR1_SU0_SUM0_SUS0_SKXCCM8_VWA1_VWB1_WGM4_WGMXCC1_WGMXCCGn1
    SolutionIndex: 62
    SolutionNameMin: Cijk_Alik_Bljk_I8II_BH_UserArgs_MT64x32x64_MI16x16x1_SN_CLR1_GSU0_GSUC0_GSUWGMRR0_K1_LBSPPA128_LBSPPB128_MIWT2_1_PLR1_SU0_SUM0_SUS0_SKXCCM8_VWA1_VWB1_WGM8_WGMXCC1_WGMXCCGn1
    SolutionIndex: 63
    SolutionNameMin: Cijk_Alik_Bljk_I8II_BH_UserArgs_MT64x32x64_MI16x16x1_SN_CLR1_GSU0_GSUC0_GSUWGMRR0_K1_LBSPPA128_LBSPPB128_MIWT2_1_PLR1_SU0_SUM0_SUS0_SKXCCM8_VWA2_VWB1_WGM8_WGMXCC1_WGMXCCGn1
    SolutionIndex: 64
    SolutionNameMin: Cijk_Alik_Bljk_I8II_BH_UserArgs_MT32x32x64_MI16x16x1_SN_CLR1_GSU0_GSUC0_GSUWGMRR0_K1_LBSPPA128_LBSPPB128_MIWT1_1_PLR1_SU0_SUM0_SUS0_SKXCCM8_VWA1_VWB1_WGM1_WGMXCC1_WGMXCCGn1
    SolutionIndex: 65
    SolutionNameMin: Cijk_Alik_Bljk_I8II_BH_UserArgs_MT32x32x64_MI16x16x1_SN_CLR0_GSU0_GSUC0_GSUWGMRR0_K1_LBSPPA128_LBSPPB128_MIWT1_1_PLR0_SU0_SUM0_SUS0_SKXCCM8_VWA1_VWB1_WGM1_WGMXCC1_WGMXCCGn1
    SolutionIndex: 66
    SolutionNameMin: Cijk_Alik_Bljk_I8II_BH_UserArgs_MT32x32x64_MI16x16x1_SN_CLR0_GSU0_GSUC0_GSUWGMRR0_K1_LBSPPA128_LBSPPB128_MIWT1_1_PLR0_SU0_SUM0_SUS0_SKXCCM8_VWA1_VWB1_WGM1_WGMXCC1_WGMXCCGn1
    SolutionIndex: 67
    SolutionNameMin: Cijk_Alik_Bljk_I8II_BH_UserArgs_MT32x32x64_MI16x16x1_SN_CLR0_GSU0_GSUC0_GSUWGMRR0_K1_LBSPPA128_LBSPPB128_MIWT1_1_PLR0_SU0_SUM0_SUS0_SKXCCM8_VWA1_VWB1_WGM4_WGMXCC1_WGMXCCGn1
    SolutionIndex: 68
    SolutionNameMin: Cijk_Alik_Bljk_I8II_BH_UserArgs_MT32x32x64_MI16x16x1_SN_CLR1_GSU0_GSUC0_GSUWGMRR0_K1_LBSPPA128_LBSPPB128_MIWT1_1_PLR1_SU0_SUM0_SUS0_SKXCCM8_VWA1_VWB1_WGM8_WGMXCC1_WGMXCCGn1
    SolutionIndex: 69
    SolutionNameMin: Cijk_Alik_Bljk_I8II_BH_UserArgs_MT32x32x64_MI16x16x1_SN_CLR1_GSU0_GSUC0_GSUWGMRR0_K1_LBSPPA128_LBSPPB128_MIWT1_1_PLR1_SU0_SUM0_SUS0_SKXCCM8_VWA1_VWB1_WGM8_WGMXCC1_WGMXCCGn1
    SolutionIndex: 70
    SolutionNameMin: Cijk_Alik_Bljk_I8II_BH_UserArgs_MT32x32x64_MI16x16x1_SN_CLR0_GSU0_GSUC0_GSUWGMRR0_K1_LBSPPA128_LBSPPB128_MIWT1_1_PLR0_SU0_SUM0_SUS0_SKXCCM8_VWA1_VWB1_WGM8_WGMXCC1_WGMXCCGn1
    SolutionIndex: 71
    SolutionNameMin: Cijk_Alik_Bljk_I8II_BH_UserArgs_MT128x256x128_MI16x16x1_SN_CLR1_GSU0_GSUC0_GSUWGMRR0_K1_LBSPPA128_LBSPPB128_MIWT4_8_PLR1_SU0_SUM0_SUS0_SKXCCM8_VWA1_VWB1_WGM1_WGMXCC1_WGMXCCGn1
    SolutionIndex: 72
    SolutionNameMin: Cijk_Alik_Bljk_I8II_BH_UserArgs_MT128x256x128_MI16x16x1_SN_CLR1_GSU0_GSUC0_GSUWGMRR0_K1_LBSPPA512_LBSPPB128_MIWT4_8_PLR1_SU0_SUM0_SUS0_SKXCCM8_VWA4_VWB1_WGM1_WGMXCC1_WGMXCCGn1
    SolutionIndex: 73
    SolutionNameMin: Cijk_Alik_Bljk_I8II_BH_UserArgs_MT128x256x128_MI16x16x1_SN_CLR1_GSU0_GSUC0_GSUWGMRR0_K1_LBSPPA256_LBSPPB256_MIWT4_8_PLR1_SU0_SUM0_SUS0_SKXCCM8_VWA2_VWB2_WGM1_WGMXCC1_WGMXCCGn1
    SolutionIndex: 74
    SolutionNameMin: Cijk_Alik_Bljk_I8II_BH_UserArgs_MT128x256x128_MI16x16x1_SN_CLR1_GSU0_GSUC0_GSUWGMRR0_K1_LBSPPA512_LBSPPB256_MIWT4_8_PLR1_SU0_SUM0_SUS0_SKXCCM8_VWA4_VWB2_WGM1_WGMXCC1_WGMXCCGn1
    SolutionIndex: 75
    SolutionNameMin: Cijk_Alik_Bljk_I8II_BH_UserArgs_MT128x256x128_MI16x16x1_SN_CLR1_GSU0_GSUC0_GSUWGMRR0_K1_LBSPPA512_LBSPPB512_MIWT4_8_PLR1_SU0_SUM0_SUS0_SKXCCM8_VWA4_VWB4_WGM1_WGMXCC1_WGMXCCGn1
    SolutionIndex: 76
    SolutionNameMin: Cijk_Alik_Bljk_I8II_BH_UserArgs_MT128x256x128_MI16x16x1_SN_CLR1_GSU0_GSUC0_GSUWGMRR0_K1_LBSPPA512_LBSPPB128_MIWT4_8_PLR1_SU0_SUM0_SUS0_SKXCCM8_VWA4_VWB1_WGM1_WGMXCC1_WGMXCCGn1
    SolutionIndex: 77
    SolutionNameMin: Cijk_Alik_Bljk_I8II_BH_UserArgs_MT128x256x128_MI16x16x1_SN_CLR1_GSU0_GSUC0_GSUWGMRR0_K1_LBSPPA512_LBSPPB512_MIWT4_8_PLR1_SU0_SUM0_SUS0_SKXCCM8_VWA4_VWB4_WGM1_WGMXCC1_WGMXCCGn1
    SolutionIndex: 78
    SolutionNameMin: Cijk_Alik_Bljk_I8II_BH_UserArgs_MT128x256x128_MI16x16x1_SN_CLR1_GSU0_GSUC0_GSUWGMRR0_K1_LBSPPA128_LBSPPB1024_MIWT4_8_PLR1_SU0_SUM0_SUS0_SKXCCM8_VWA1_VWB8_WGM1_WGMXCC1_WGMXCCGn1
    SolutionIndex: 79
    SolutionNameMin: Cijk_Alik_Bljk_I8II_BH_UserArgs_MT128x256x128_MI16x16x1_SN_CLR1_GSU0_GSUC0_GSUWGMRR0_K1_LBSPPA512_LBSPPB512_MIWT4_8_PLR1_SU0_SUM0_SUS0_SKXCCM8_VWA4_VWB4_WGM4_WGMXCC1_WGMXCCGn1
    SolutionIndex: 80
    SolutionNameMin: Cijk_Alik_Bljk_I8II_BH_UserArgs_MT128x256x128_MI16x16x1_SN_CLR1_GSU0_GSUC0_GSUWGMRR0_K1_LBSPPA512_LBSPPB128_MIWT4_8_PLR1_SU0_SUM0_SUS0_SKXCCM8_VWA4_VWB1_WGM8_WGMXCC1_WGMXCCGn1
    SolutionIndex: 81
    SolutionNameMin: Cijk_Alik_Bljk_I8II_BH_UserArgs_MT128x256x128_MI16x16x1_SN_CLR1_GSU0_GSUC0_GSUWGMRR0_K1_LBSPPA512_LBSPPB1024_MIWT4_8_PLR1_SU0_SUM0_SUS0_SKXCCM8_VWA4_VWB8_WGM8_WGMXCC1_WGMXCCGn1
    SolutionIndex: 82
    SolutionNameMin: Cijk_Alik_Bljk_I8II_BH_UserArgs_MT128x256x128_MI16x16x1_SN_CLR1_GSU0_GSUC0_GSUWGMRR0_K1_LBSPPA512_LBSPPB512_MIWT4_8_PLR1_SU0_SUM0_SUS0_SKXCCM8_VWA4_VWB4_WGM8_WGMXCC1_WGMXCCGn1
    SolutionIndex: 83
    SolutionNameMin: Cijk_Alik_Bljk_I8II_BH_UserArgs_MT256x128x128_MI16x16x1_SN_CLR1_GSU0_GSUC0_GSUWGMRR0_K1_LBSPPA128_LBSPPB512_MIWT8_4_PLR1_SU0_SUM0_SUS0_SKXCCM8_VWA1_VWB4_WGM1_WGMXCC1_WGMXCCGn1
    SolutionIndex: 84
    SolutionNameMin: Cijk_Alik_Bljk_I8II_BH_UserArgs_MT256x128x128_MI16x16x1_SN_CLR1_GSU0_GSUC0_GSUWGMRR0_K1_LBSPPA256_LBSPPB512_MIWT8_4_PLR2_SU0_SUM0_SUS0_SKXCCM8_VWA2_VWB4_WGM1_WGMXCC1_WGMXCCGn1
    SolutionIndex: 85
    SolutionNameMin: Cijk_Alik_Bljk_I8II_BH_UserArgs_MT256x128x128_MI16x16x1_SN_CLR1_GSU0_GSUC0_GSUWGMRR0_K1_LBSPPA256_LBSPPB512_MIWT8_4_PLR2_SU0_SUM0_SUS0_SKXCCM8_VWA2_VWB4_WGM1_WGMXCC1_WGMXCCGn1
    SolutionIndex: 86
    SolutionNameMin: Cijk_Alik_Bljk_I8II_BH_UserArgs_MT256x128x128_MI16x16x1_SN_CLR1_GSU0_GSUC0_GSUWGMRR0_K1_LBSPPA512_LBSPPB256_MIWT8_4_PLR1_SU0_SUM0_SUS0_SKXCCM8_VWA4_VWB2_WGM4_WGMXCC1_WGMXCCGn1
    SolutionIndex: 87
    SolutionNameMin: Cijk_Alik_Bljk_I8II_BH_UserArgs_MT256x128x128_MI16x16x1_SN_CLR1_GSU0_GSUC0_GSUWGMRR0_K1_LBSPPA128_LBSPPB512_MIWT8_4_PLR1_SU0_SUM0_SUS0_SKXCCM8_VWA1_VWB4_WGM4_WGMXCC1_WGMXCCGn1
    SolutionIndex: 88
    SolutionNameMin: Cijk_Alik_Bljk_I8II_BH_UserArgs_MT256x128x128_MI16x16x1_SN_CLR1_GSU0_GSUC0_GSUWGMRR0_K1_LBSPPA512_LBSPPB128_MIWT8_4_PLR1_SU0_SUM0_SUS0_SKXCCM8_VWA4_VWB1_WGM4_WGMXCC1_WGMXCCGn1
    SolutionIndex: 89
    SolutionNameMin: Cijk_Alik_Bljk_I8II_BH_UserArgs_MT256x128x128_MI16x16x1_SN_CLR1_GSU0_GSUC0_GSUWGMRR0_K1_LBSPPA128_LBSPPB512_MIWT8_4_PLR1_SU0_SUM0_SUS0_SKXCCM8_VWA1_VWB4_WGM4_WGMXCC1_WGMXCCGn1
    SolutionIndex: 90
    SolutionNameMin: Cijk_Alik_Bljk_I8II_BH_UserArgs_MT256x128x128_MI16x16x1_SN_CLR1_GSU0_GSUC0_GSUWGMRR0_K1_LBSPPA256_LBSPPB256_MIWT8_4_PLR2_SU0_SUM0_SUS0_SKXCCM8_VWA2_VWB2_WGM4_WGMXCC1_WGMXCCGn1
    SolutionIndex: 91
    SolutionNameMin: Cijk_Alik_Bljk_I8II_BH_UserArgs_MT256x128x128_MI16x16x1_SN_CLR1_GSU0_GSUC0_GSUWGMRR0_K1_LBSPPA512_LBSPPB256_MIWT8_4_PLR1_SU0_SUM0_SUS0_SKXCCM8_VWA4_VWB2_WGM8_WGMXCC1_WGMXCCGn1
    SolutionIndex: 92
    SolutionNameMin: Cijk_Alik_Bljk_I8II_BH_UserArgs_MT256x128x128_MI16x16x1_SN_CLR1_GSU0_GSUC0_GSUWGMRR0_K1_LBSPPA128_LBSPPB512_MIWT8_4_PLR1_SU0_SUM0_SUS0_SKXCCM8_VWA1_VWB4_WGM8_WGMXCC1_WGMXCCGn1
    SolutionIndex: 93
    SolutionNameMin: Cijk_Alik_Bljk_I8II_BH_UserArgs_MT256x128x128_MI16x16x1_SN_CLR1_GSU0_GSUC0_GSUWGMRR0_K1_LBSPPA256_LBSPPB512_MIWT8_4_PLR1_SU0_SUM0_SUS0_SKXCCM8_VWA2_VWB4_WGM8_WGMXCC1_WGMXCCGn1
    SolutionIndex: 94
    SolutionNameMin: Cijk_Alik_Bljk_I8II_BH_UserArgs_MT256x128x128_MI16x16x1_SN_CLR1_GSU0_GSUC0_GSUWGMRR0_K1_LBSPPA128_LBSPPB256_MIWT8_4_PLR1_SU0_SUM0_SUS0_SKXCCM8_VWA1_VWB2_WGM8_WGMXCC1_WGMXCCGn1
    SolutionIndex: 95
    SolutionNameMin: Cijk_Alik_Bljk_I8II_BH_UserArgs_MT256x128x128_MI16x16x1_SN_CLR1_GSU0_GSUC0_GSUWGMRR0_K1_LBSPPA128_LBSPPB512_MIWT8_4_PLR1_SU0_SUM0_SUS0_SKXCCM8_VWA1_VWB4_WGM8_WGMXCC1_WGMXCCGn1
    SolutionIndex: 96
    SolutionNameMin: Cijk_Alik_Bljk_I8II_BH_UserArgs_MT256x128x128_MI16x16x1_SN_CLR1_GSU0_GSUC0_GSUWGMRR0_K1_LBSPPA512_LBSPPB512_MIWT8_4_PLR1_SU0_SUM0_SUS0_SKXCCM8_VWA4_VWB4_WGM8_WGMXCC1_WGMXCCGn1
    SolutionIndex: 97
    SolutionNameMin: Cijk_Alik_Bljk_I8II_BH_UserArgs_MT256x128x128_MI16x16x1_SN_CLR1_GSU0_GSUC0_GSUWGMRR0_K1_LBSPPA128_LBSPPB256_MIWT8_4_PLR1_SU0_SUM0_SUS0_SKXCCM8_VWA1_VWB2_WGM8_WGMXCC1_WGMXCCGn1
    SolutionIndex: 98
    SolutionNameMin: Cijk_Alik_Bljk_I8II_BH_UserArgs_MT256x128x128_MI16x16x1_SN_CLR1_GSU0_GSUC0_GSUWGMRR0_K1_LBSPPA128_LBSPPB512_MIWT8_4_PLR1_SU0_SUM0_SUS0_SKXCCM8_VWA1_VWB4_WGM8_WGMXCC1_WGMXCCGn1
    SolutionIndex: 99
    SolutionNameMin: Cijk_Alik_Bljk_I8II_BH_UserArgs_MT256x128x128_MI16x16x1_SN_CLR1_GSU0_GSUC0_GSUWGMRR0_K1_LBSPPA256_LBSPPB512_MIWT8_4_PLR2_SU0_SUM0_SUS0_SKXCCM8_VWA2_VWB4_WGM8_WGMXCC1_WGMXCCGn1
    SolutionIndex: 100
    SolutionNameMin: Cijk_Alik_Bljk_I8II_BH_UserArgs_MT64x256x128_MI16x16x1_SN_CLR1_GSU0_GSUC0_GSUWGMRR0_K1_LBSPPA256_LBSPPB1024_MIWT2_8_PLR2_SU0_SUM0_SUS0_SKXCCM8_VWA2_VWB8_WGM4_WGMXCC1_WGMXCCGn1
    SolutionIndex: 101
    SolutionNameMin: Cijk_Alik_Bljk_I8II_BH_UserArgs_MT128x128x128_MI16x16x1_SN_CLR1_GSU0_GSUC0_GSUWGMRR0_K1_LBSPPA512_LBSPPB256_MIWT4_4_PLR1_SU0_SUM0_SUS0_SKXCCM8_VWA4_VWB2_WGM1_WGMXCC1_WGMXCCGn1
    SolutionIndex: 102
    SolutionNameMin: Cijk_Alik_Bljk_I8II_BH_UserArgs_MT128x128x128_MI16x16x1_SN_CLR1_GSU0_GSUC0_GSUWGMRR0_K1_LBSPPA512_LBSPPB512_MIWT4_4_PLR1_SU0_SUM0_SUS0_SKXCCM8_VWA4_VWB4_WGM1_WGMXCC1_WGMXCCGn1
    SolutionIndex: 103
    SolutionNameMin: Cijk_Alik_Bljk_I8II_BH_UserArgs_MT128x128x128_MI16x16x1_SN_CLR1_GSU0_GSUC0_GSUWGMRR0_K1_LBSPPA512_LBSPPB512_MIWT4_4_PLR1_SU0_SUM0_SUS0_SKXCCM8_VWA4_VWB4_WGM1_WGMXCC1_WGMXCCGn1
    SolutionIndex: 104
    SolutionNameMin: Cijk_Alik_Bljk_I8II_BH_UserArgs_MT128x128x128_MI16x16x1_SN_CLR1_GSU0_GSUC0_GSUWGMRR0_K1_LBSPPA512_LBSPPB512_MIWT4_4_PLR1_SU0_SUM0_SUS0_SKXCCM8_VWA4_VWB4_WGM1_WGMXCC1_WGMXCCGn1
    SolutionIndex: 105
    SolutionNameMin: Cijk_Alik_Bljk_I8II_BH_UserArgs_MT128x128x128_MI16x16x1_SN_CLR1_GSU0_GSUC0_GSUWGMRR0_K1_LBSPPA128_LBSPPB256_MIWT4_4_PLR1_SU0_SUM0_SUS0_SKXCCM8_VWA1_VWB2_WGM1_WGMXCC1_WGMXCCGn1
    SolutionIndex: 106
    SolutionNameMin: Cijk_Alik_Bljk_I8II_BH_UserArgs_MT128x128x128_MI16x16x1_SN_CLR1_GSU0_GSUC0_GSUWGMRR0_K1_LBSPPA128_LBSPPB512_MIWT4_4_PLR1_SU0_SUM0_SUS0_SKXCCM8_VWA1_VWB4_WGM1_WGMXCC1_WGMXCCGn1
    SolutionIndex: 107
    SolutionNameMin: Cijk_Alik_Bljk_I8II_BH_UserArgs_MT128x128x128_MI16x16x1_SN_CLR1_GSU0_GSUC0_GSUWGMRR0_K1_LBSPPA512_LBSPPB512_MIWT4_4_PLR1_SU0_SUM0_SUS0_SKXCCM8_VWA4_VWB4_WGM1_WGMXCC1_WGMXCCGn1
    SolutionIndex: 108
    SolutionNameMin: Cijk_Alik_Bljk_I8II_BH_UserArgs_MT128x128x128_MI16x16x1_SN_CLR1_GSU0_GSUC0_GSUWGMRR0_K1_LBSPPA512_LBSPPB128_MIWT4_4_PLR1_SU0_SUM0_SUS0_SKXCCM8_VWA4_VWB1_WGM4_WGMXCC1_WGMXCCGn1
    SolutionIndex: 109
    SolutionNameMin: Cijk_Alik_Bljk_I8II_BH_UserArgs_MT128x128x128_MI16x16x1_SN_CLR1_GSU0_GSUC0_GSUWGMRR0_K1_LBSPPA128_LBSPPB256_MIWT4_4_PLR1_SU0_SUM0_SUS0_SKXCCM8_VWA1_VWB2_WGM4_WGMXCC1_WGMXCCGn1
    SolutionIndex: 110
    SolutionNameMin: Cijk_Alik_Bljk_I8II_BH_UserArgs_MT128x128x128_MI16x16x1_SN_CLR1_GSU0_GSUC0_GSUWGMRR0_K1_LBSPPA512_LBSPPB512_MIWT4_4_PLR1_SU0_SUM0_SUS0_SKXCCM8_VWA4_VWB4_WGM4_WGMXCC1_WGMXCCGn1
    SolutionIndex: 111
    SolutionNameMin: Cijk_Alik_Bljk_I8II_BH_UserArgs_MT128x128x128_MI16x16x1_SN_CLR1_GSU0_GSUC0_GSUWGMRR0_K1_LBSPPA128_LBSPPB512_MIWT4_4_PLR1_SU0_SUM0_SUS0_SKXCCM8_VWA1_VWB4_WGM4_WGMXCC1_WGMXCCGn1
    SolutionIndex: 112
    SolutionNameMin: Cijk_Alik_Bljk_I8II_BH_UserArgs_MT128x128x128_MI16x16x1_SN_CLR1_GSU0_GSUC0_GSUWGMRR0_K1_LBSPPA512_LBSPPB128_MIWT4_4_PLR1_SU0_SUM0_SUS0_SKXCCM8_VWA4_VWB1_WGM4_WGMXCC1_WGMXCCGn1
    SolutionIndex: 113
    SolutionNameMin: Cijk_Alik_Bljk_I8II_BH_UserArgs_MT128x128x128_MI16x16x1_SN_CLR1_GSU0_GSUC0_GSUWGMRR0_K1_LBSPPA512_LBSPPB128_MIWT4_4_PLR1_SU0_SUM0_SUS0_SKXCCM8_VWA4_VWB1_WGM8_WGMXCC1_WGMXCCGn1
    SolutionIndex: 114
    SolutionNameMin: Cijk_Alik_Bljk_I8II_BH_UserArgs_MT128x128x128_MI16x16x1_SN_CLR1_GSU0_GSUC0_GSUWGMRR0_K1_LBSPPA128_LBSPPB512_MIWT4_4_PLR1_SU0_SUM0_SUS0_SKXCCM8_VWA1_VWB4_WGM8_WGMXCC1_WGMXCCGn1
    SolutionIndex: 115
    SolutionNameMin: Cijk_Alik_Bljk_I8II_BH_UserArgs_MT128x128x128_MI16x16x1_SN_CLR1_GSU0_GSUC0_GSUWGMRR0_K1_LBSPPA512_LBSPPB512_MIWT4_4_PLR1_SU0_SUM0_SUS0_SKXCCM8_VWA4_VWB4_WGM8_WGMXCC1_WGMXCCGn1
    SolutionIndex: 116
    SolutionNameMin: Cijk_Alik_Bljk_I8II_BH_UserArgs_MT128x128x128_MI16x16x1_SN_CLR1_GSU0_GSUC0_GSUWGMRR0_K1_LBSPPA512_LBSPPB128_MIWT4_4_PLR1_SU0_SUM0_SUS0_SKXCCM8_VWA4_VWB1_WGM8_WGMXCC1_WGMXCCGn1
    SolutionIndex: 117
    SolutionNameMin: Cijk_Alik_Bljk_I8II_BH_UserArgs_MT128x128x128_MI16x16x1_SN_CLR1_GSU0_GSUC0_GSUWGMRR0_K1_LBSPPA512_LBSPPB512_MIWT4_4_PLR1_SU0_SUM0_SUS0_SKXCCM8_VWA4_VWB4_WGM8_WGMXCC1_WGMXCCGn1
    SolutionIndex: 118
    SolutionNameMin: Cijk_Alik_Bljk_I8II_BH_UserArgs_MT128x128x128_MI16x16x1_SN_CLR1_GSU0_GSUC0_GSUWGMRR0_K1_LBSPPA512_LBSPPB128_MIWT4_4_PLR1_SU0_SUM0_SUS0_SKXCCM8_VWA4_VWB1_WGM8_WGMXCC1_WGMXCCGn1
    SolutionIndex: 119
    SolutionNameMin: Cijk_Alik_Bljk_I8II_BH_UserArgs_MT128x128x128_MI16x16x1_SN_CLR1_GSU0_GSUC0_GSUWGMRR0_K1_LBSPPA128_LBSPPB256_MIWT4_4_PLR1_SU0_SUM0_SUS0_SKXCCM8_VWA1_VWB2_WGM8_WGMXCC1_WGMXCCGn1
    SolutionIndex: 120
    SolutionNameMin: Cijk_Alik_Bljk_I8II_BH_UserArgs_MT128x128x128_MI16x16x1_SN_CLR1_GSU0_GSUC0_GSUWGMRR0_K1_LBSPPA128_LBSPPB512_MIWT4_4_PLR1_SU0_SUM0_SUS0_SKXCCM8_VWA1_VWB4_WGM8_WGMXCC1_WGMXCCGn1
    SolutionIndex: 121
    SolutionNameMin: Cijk_Alik_Bljk_I8II_BH_UserArgs_MT128x128x128_MI16x16x1_SN_CLR1_GSU0_GSUC0_GSUWGMRR0_K1_LBSPPA512_LBSPPB512_MIWT4_4_PLR2_SU0_SUM0_SUS0_SKXCCM8_VWA4_VWB4_WGM8_WGMXCC1_WGMXCCGn1
    SolutionIndex: 122
    SolutionNameMin: Cijk_Alik_Bljk_I8II_BH_UserArgs_MT128x128x128_MI16x16x1_SN_CLR1_GSU0_GSUC0_GSUWGMRR0_K1_LBSPPA512_LBSPPB512_MIWT4_4_PLR2_SU0_SUM0_SUS0_SKXCCM8_VWA4_VWB4_WGM8_WGMXCC1_WGMXCCGn1
    SolutionIndex: 123
    SolutionNameMin: Cijk_Alik_Bljk_I8II_BH_UserArgs_MT64x128x128_MI16x16x1_SN_CLR1_GSU0_GSUC0_GSUWGMRR0_K1_LBSPPA128_LBSPPB512_MIWT2_4_PLR1_SU0_SUM0_SUS0_SKXCCM8_VWA1_VWB4_WGM1_WGMXCC1_WGMXCCGn1
    SolutionIndex: 124
    SolutionNameMin: Cijk_Alik_Bljk_I8II_BH_UserArgs_MT64x128x128_MI16x16x1_SN_CLR1_GSU0_GSUC0_GSUWGMRR0_K1_LBSPPA128_LBSPPB256_MIWT2_4_PLR1_SU0_SUM0_SUS0_SKXCCM8_VWA1_VWB2_WGM8_WGMXCC1_WGMXCCGn1
    SolutionIndex: 125
    SolutionNameMin: Cijk_Alik_Bljk_I8II_BH_UserArgs_MT128x64x128_MI16x16x1_SN_CLR1_GSU0_GSUC0_GSUWGMRR0_K1_LBSPPA512_LBSPPB128_MIWT4_2_PLR1_SU0_SUM0_SUS0_SKXCCM8_VWA4_VWB1_WGM1_WGMXCC1_WGMXCCGn1
    SolutionIndex: 126
    SolutionNameMin: Cijk_Alik_Bljk_I8II_BH_UserArgs_MT128x64x128_MI16x16x1_SN_CLR1_GSU0_GSUC0_GSUWGMRR0_K1_LBSPPA128_LBSPPB128_MIWT4_2_PLR1_SU0_SUM0_SUS0_SKXCCM8_VWA1_VWB1_WGM1_WGMXCC1_WGMXCCGn1
    SolutionIndex: 127
    SolutionNameMin: Cijk_Alik_Bljk_I8II_BH_UserArgs_MT128x64x128_MI16x16x1_SN_CLR1_GSU0_GSUC0_GSUWGMRR0_K1_LBSPPA512_LBSPPB128_MIWT4_2_PLR1_SU0_SUM0_SUS0_SKXCCM8_VWA4_VWB1_WGM1_WGMXCC1_WGMXCCGn1
    SolutionIndex: 128
    SolutionNameMin: Cijk_Alik_Bljk_I8II_BH_UserArgs_MT128x64x128_MI16x16x1_SN_CLR1_GSU0_GSUC0_GSUWGMRR0_K1_LBSPPA128_LBSPPB256_MIWT4_2_PLR1_SU0_SUM0_SUS0_SKXCCM8_VWA1_VWB2_WGM1_WGMXCC1_WGMXCCGn1
    SolutionIndex: 129
    SolutionNameMin: Cijk_Alik_Bljk_I8II_BH_UserArgs_MT128x64x128_MI16x16x1_SN_CLR1_GSU0_GSUC0_GSUWGMRR0_K1_LBSPPA512_LBSPPB256_MIWT4_2_PLR1_SU0_SUM0_SUS0_SKXCCM8_VWA4_VWB2_WGM1_WGMXCC1_WGMXCCGn1
    SolutionIndex: 130
    SolutionNameMin: Cijk_Alik_Bljk_I8II_BH_UserArgs_MT128x64x128_MI16x16x1_SN_CLR1_GSU0_GSUC0_GSUWGMRR0_K1_LBSPPA512_LBSPPB128_MIWT4_2_PLR1_SU0_SUM0_SUS0_SKXCCM8_VWA4_VWB1_WGM4_WGMXCC1_WGMXCCGn1
    SolutionIndex: 131
    SolutionNameMin: Cijk_Alik_Bljk_I8II_BH_UserArgs_MT128x64x128_MI16x16x1_SN_CLR1_GSU0_GSUC0_GSUWGMRR0_K1_LBSPPA128_LBSPPB256_MIWT4_2_PLR1_SU0_SUM0_SUS0_SKXCCM8_VWA1_VWB2_WGM4_WGMXCC1_WGMXCCGn1
    SolutionIndex: 132
    SolutionNameMin: Cijk_Alik_Bljk_I8II_BH_UserArgs_MT128x64x128_MI16x16x1_SN_CLR1_GSU0_GSUC0_GSUWGMRR0_K1_LBSPPA512_LBSPPB128_MIWT4_2_PLR1_SU0_SUM0_SUS0_SKXCCM8_VWA4_VWB1_WGM8_WGMXCC1_WGMXCCGn1
    SolutionIndex: 133
    SolutionNameMin: Cijk_Alik_Bljk_I8II_BH_UserArgs_MT128x64x128_MI16x16x1_SN_CLR1_GSU0_GSUC0_GSUWGMRR0_K1_LBSPPA512_LBSPPB128_MIWT4_2_PLR1_SU0_SUM0_SUS0_SKXCCM8_VWA4_VWB1_WGM8_WGMXCC1_WGMXCCGn1
    SolutionIndex: 134
    SolutionNameMin: Cijk_Alik_Bljk_I8II_BH_UserArgs_MT128x64x128_MI16x16x1_SN_CLR1_GSU0_GSUC0_GSUWGMRR0_K1_LBSPPA128_LBSPPB256_MIWT4_2_PLR1_SU0_SUM0_SUS0_SKXCCM8_VWA1_VWB2_WGM8_WGMXCC1_WGMXCCGn1
    SolutionIndex: 135
    SolutionNameMin: Cijk_Alik_Bljk_I8II_BH_UserArgs_MT128x64x128_MI16x16x1_SN_CLR1_GSU0_GSUC0_GSUWGMRR0_K1_LBSPPA512_LBSPPB256_MIWT4_2_PLR1_SU0_SUM0_SUS0_SKXCCM8_VWA4_VWB2_WGM8_WGMXCC1_WGMXCCGn1
    SolutionIndex: 136
    SolutionNameMin: Cijk_Alik_Bljk_I8II_BH_UserArgs_MT64x64x128_MI16x16x1_SN_CLR1_GSU0_GSUC0_GSUWGMRR0_K1_LBSPPA128_LBSPPB128_MIWT2_2_PLR1_SU0_SUM0_SUS0_SKXCCM8_VWA1_VWB1_WGM1_WGMXCC1_WGMXCCGn1
    SolutionIndex: 137
    SolutionNameMin: Cijk_Alik_Bljk_I8II_BH_UserArgs_MT64x64x128_MI16x16x1_SN_CLR1_GSU0_GSUC0_GSUWGMRR0_K1_LBSPPA128_LBSPPB256_MIWT2_2_PLR1_SU0_SUM0_SUS0_SKXCCM8_VWA1_VWB2_WGM1_WGMXCC1_WGMXCCGn1
    SolutionIndex: 138
    SolutionNameMin: Cijk_Alik_Bljk_I8II_BH_UserArgs_MT64x64x128_MI16x16x1_SN_CLR1_GSU0_GSUC0_GSUWGMRR0_K1_LBSPPA256_LBSPPB256_MIWT2_2_PLR1_SU0_SUM0_SUS0_SKXCCM8_VWA2_VWB2_WGM1_WGMXCC1_WGMXCCGn1
    SolutionIndex: 139
    SolutionNameMin: Cijk_Alik_Bljk_I8II_BH_UserArgs_MT64x64x128_MI16x16x1_SN_CLR1_GSU0_GSUC0_GSUWGMRR0_K1_LBSPPA128_LBSPPB256_MIWT2_2_PLR1_SU0_SUM0_SUS0_SKXCCM8_VWA1_VWB2_WGM1_WGMXCC1_WGMXCCGn1
    SolutionIndex: 140
    SolutionNameMin: Cijk_Alik_Bljk_I8II_BH_UserArgs_MT64x64x128_MI16x16x1_SN_CLR1_GSU0_GSUC0_GSUWGMRR0_K1_LBSPPA128_LBSPPB256_MIWT2_2_PLR1_SU0_SUM0_SUS0_SKXCCM8_VWA1_VWB2_WGM4_WGMXCC1_WGMXCCGn1
    SolutionIndex: 141
    SolutionNameMin: Cijk_Alik_Bljk_I8II_BH_UserArgs_MT64x64x128_MI16x16x1_SN_CLR1_GSU0_GSUC0_GSUWGMRR0_K1_LBSPPA128_LBSPPB256_MIWT2_2_PLR1_SU0_SUM0_SUS0_SKXCCM8_VWA1_VWB2_WGM8_WGMXCC1_WGMXCCGn1
    SolutionIndex: 142
    SolutionNameMin: Cijk_Alik_Bljk_I8II_BH_UserArgs_MT32x64x128_MI16x16x1_SN_CLR1_GSU0_GSUC0_GSUWGMRR0_K1_LBSPPA128_LBSPPB256_MIWT1_2_PLR1_SU0_SUM0_SUS0_SKXCCM8_VWA1_VWB2_WGM1_WGMXCC1_WGMXCCGn1
    SolutionIndex: 143
    SolutionNameMin: Cijk_Alik_Bljk_I8II_BH_UserArgs_MT32x64x128_MI16x16x1_SN_CLR1_GSU0_GSUC0_GSUWGMRR0_K1_LBSPPA128_LBSPPB128_MIWT1_2_PLR1_SU0_SUM0_SUS0_SKXCCM8_VWA1_VWB1_WGM1_WGMXCC1_WGMXCCGn1
    SolutionIndex: 144
    SolutionNameMin: Cijk_Alik_Bljk_I8II_BH_UserArgs_MT32x64x128_MI16x16x1_SN_CLR1_GSU0_GSUC0_GSUWGMRR0_K1_LBSPPA128_LBSPPB128_MIWT1_2_PLR1_SU0_SUM0_SUS0_SKXCCM8_VWA1_VWB1_WGM1_WGMXCC1_WGMXCCGn1
    SolutionIndex: 145
    SolutionNameMin: Cijk_Alik_Bljk_I8II_BH_UserArgs_MT32x64x128_MI16x16x1_SN_CLR1_GSU0_GSUC0_GSUWGMRR0_K1_LBSPPA128_LBSPPB128_MIWT1_2_PLR1_SU0_SUM0_SUS0_SKXCCM8_VWA1_VWB1_WGM1_WGMXCC1_WGMXCCGn1
    SolutionIndex: 146
    SolutionNameMin: Cijk_Alik_Bljk_I8II_BH_UserArgs_MT32x64x128_MI16x16x1_SN_CLR1_GSU0_GSUC0_GSUWGMRR0_K1_LBSPPA128_LBSPPB256_MIWT1_2_PLR1_SU0_SUM0_SUS0_SKXCCM8_VWA1_VWB2_WGM1_WGMXCC1_WGMXCCGn1
    SolutionIndex: 147
    SolutionNameMin: Cijk_Alik_Bljk_I8II_BH_UserArgs_MT32x64x128_MI16x16x1_SN_CLR1_GSU0_GSUC0_GSUWGMRR0_K1_LBSPPA128_LBSPPB128_MIWT1_2_PLR1_SU0_SUM0_SUS0_SKXCCM8_VWA1_VWB1_WGM1_WGMXCC1_WGMXCCGn1
    SolutionIndex: 148
    SolutionNameMin: Cijk_Alik_Bljk_I8II_BH_UserArgs_MT32x64x128_MI16x16x1_SN_CLR1_GSU0_GSUC0_GSUWGMRR0_K1_LBSPPA128_LBSPPB256_MIWT1_2_PLR2_SU0_SUM0_SUS0_SKXCCM8_VWA1_VWB2_WGM1_WGMXCC1_WGMXCCGn1
    SolutionIndex: 149
    SolutionNameMin: Cijk_Alik_Bljk_I8II_BH_UserArgs_MT32x64x128_MI16x16x1_SN_CLR1_GSU0_GSUC0_GSUWGMRR0_K1_LBSPPA128_LBSPPB256_MIWT1_2_PLR1_SU0_SUM0_SUS0_SKXCCM8_VWA1_VWB2_WGM4_WGMXCC1_WGMXCCGn1
    SolutionIndex: 150
    SolutionNameMin: Cijk_Alik_Bljk_I8II_BH_UserArgs_MT32x64x128_MI16x16x1_SN_CLR1_GSU0_GSUC0_GSUWGMRR0_K1_LBSPPA128_LBSPPB256_MIWT1_2_PLR1_SU0_SUM0_SUS0_SKXCCM8_VWA1_VWB2_WGM8_WGMXCC1_WGMXCCGn1
    SolutionIndex: 151
    SolutionNameMin: Cijk_Alik_Bljk_I8II_BH_UserArgs_MT64x32x128_MI16x16x1_SN_CLR1_GSU0_GSUC0_GSUWGMRR0_K1_LBSPPA128_LBSPPB128_MIWT2_1_PLR1_SU0_SUM0_SUS0_SKXCCM8_VWA1_VWB1_WGM1_WGMXCC1_WGMXCCGn1
    SolutionIndex: 152
    SolutionNameMin: Cijk_Alik_Bljk_I8II_BH_UserArgs_MT64x32x128_MI16x16x1_SN_CLR1_GSU0_GSUC0_GSUWGMRR0_K1_LBSPPA128_LBSPPB128_MIWT2_1_PLR1_SU0_SUM0_SUS0_SKXCCM8_VWA1_VWB1_WGM1_WGMXCC1_WGMXCCGn1
    SolutionIndex: 153
    SolutionNameMin: Cijk_Alik_Bljk_I8II_BH_UserArgs_MT64x32x128_MI16x16x1_SN_CLR1_GSU0_GSUC0_GSUWGMRR0_K1_LBSPPA256_LBSPPB128_MIWT2_1_PLR1_SU0_SUM0_SUS0_SKXCCM8_VWA2_VWB1_WGM1_WGMXCC1_WGMXCCGn1
    SolutionIndex: 154
    SolutionNameMin: Cijk_Alik_Bljk_I8II_BH_UserArgs_MT64x32x128_MI16x16x1_SN_CLR1_GSU0_GSUC0_GSUWGMRR0_K1_LBSPPA128_LBSPPB128_MIWT2_1_PLR1_SU0_SUM0_SUS0_SKXCCM8_VWA1_VWB1_WGM1_WGMXCC1_WGMXCCGn1
    SolutionIndex: 155
    SolutionNameMin: Cijk_Alik_Bljk_I8II_BH_UserArgs_MT64x32x128_MI16x16x1_SN_CLR1_GSU0_GSUC0_GSUWGMRR0_K1_LBSPPA256_LBSPPB128_MIWT2_1_PLR1_SU0_SUM0_SUS0_SKXCCM8_VWA2_VWB1_WGM1_WGMXCC1_WGMXCCGn1
    SolutionIndex: 156
    SolutionNameMin: Cijk_Alik_Bljk_I8II_BH_UserArgs_MT64x32x128_MI16x16x1_SN_CLR1_GSU0_GSUC0_GSUWGMRR0_K1_LBSPPA256_LBSPPB128_MIWT2_1_PLR1_SU0_SUM0_SUS0_SKXCCM8_VWA2_VWB1_WGM1_WGMXCC1_WGMXCCGn1
    SolutionIndex: 157
    SolutionNameMin: Cijk_Alik_Bljk_I8II_BH_UserArgs_MT64x32x128_MI16x16x1_SN_CLR1_GSU0_GSUC0_GSUWGMRR0_K1_LBSPPA128_LBSPPB128_MIWT2_1_PLR2_SU0_SUM0_SUS0_SKXCCM8_VWA1_VWB1_WGM1_WGMXCC1_WGMXCCGn1
    SolutionIndex: 158
    SolutionNameMin: Cijk_Alik_Bljk_I8II_BH_UserArgs_MT64x32x128_MI16x16x1_SN_CLR1_GSU0_GSUC0_GSUWGMRR0_K1_LBSPPA256_LBSPPB128_MIWT2_1_PLR2_SU0_SUM0_SUS0_SKXCCM8_VWA2_VWB1_WGM1_WGMXCC1_WGMXCCGn1
    SolutionIndex: 159
    SolutionNameMin: Cijk_Alik_Bljk_I8II_BH_UserArgs_MT64x32x128_MI16x16x1_SN_CLR1_GSU0_GSUC0_GSUWGMRR0_K1_LBSPPA128_LBSPPB128_MIWT2_1_PLR1_SU0_SUM0_SUS0_SKXCCM8_VWA1_VWB1_WGM4_WGMXCC1_WGMXCCGn1
    SolutionIndex: 160
    SolutionNameMin: Cijk_Alik_Bljk_I8II_BH_UserArgs_MT64x32x128_MI16x16x1_SN_CLR1_GSU0_GSUC0_GSUWGMRR0_K1_LBSPPA128_LBSPPB128_MIWT2_1_PLR2_SU0_SUM0_SUS0_SKXCCM8_VWA1_VWB1_WGM8_WGMXCC1_WGMXCCGn1
    SolutionIndex: 161
    SolutionNameMin: Cijk_Alik_Bljk_I8II_BH_UserArgs_MT32x32x128_MI16x16x1_SN_CLR1_GSU0_GSUC0_GSUWGMRR0_K1_LBSPPA128_LBSPPB128_MIWT1_1_PLR1_SU0_SUM0_SUS0_SKXCCM8_VWA1_VWB1_WGM1_WGMXCC1_WGMXCCGn1
    SolutionIndex: 162
    SolutionNameMin: Cijk_Alik_Bljk_I8II_BH_UserArgs_MT32x32x128_MI16x16x1_SN_CLR1_GSU0_GSUC0_GSUWGMRR0_K1_LBSPPA128_LBSPPB128_MIWT1_1_PLR1_SU0_SUM0_SUS0_SKXCCM8_VWA1_VWB1_WGM1_WGMXCC1_WGMXCCGn1
    SolutionIndex: 163
    SolutionNameMin: Cijk_Alik_Bljk_I8II_BH_UserArgs_MT32x32x128_MI16x16x1_SN_CLR1_GSU0_GSUC0_GSUWGMRR0_K1_LBSPPA128_LBSPPB128_MIWT1_1_PLR1_SU0_SUM0_SUS0_SKXCCM8_VWA1_VWB1_WGM1_WGMXCC1_WGMXCCGn1
    SolutionIndex: 164
    SolutionNameMin: Cijk_Alik_Bljk_I8II_BH_UserArgs_MT32x32x128_MI16x16x1_SN_CLR1_GSU0_GSUC0_GSUWGMRR0_K1_LBSPPA128_LBSPPB128_MIWT1_1_PLR1_SU0_SUM0_SUS0_SKXCCM8_VWA1_VWB1_WGM1_WGMXCC1_WGMXCCGn1
    SolutionIndex: 165
    SolutionNameMin: Cijk_Alik_Bljk_I8II_BH_UserArgs_MT32x32x128_MI16x16x1_SN_CLR1_GSU0_GSUC0_GSUWGMRR0_K1_LBSPPA128_LBSPPB128_MIWT1_1_PLR1_SU0_SUM0_SUS0_SKXCCM8_VWA1_VWB1_WGM1_WGMXCC1_WGMXCCGn1
    SolutionIndex: 166
    SolutionNameMin: Cijk_Alik_Bljk_I8II_BH_UserArgs_MT32x32x128_MI16x16x1_SN_CLR1_GSU0_GSUC0_GSUWGMRR0_K1_LBSPPA128_LBSPPB128_MIWT1_1_PLR2_SU0_SUM0_SUS0_SKXCCM8_VWA1_VWB1_WGM1_WGMXCC1_WGMXCCGn1
    SolutionIndex: 167
    SolutionNameMin: Cijk_Alik_Bljk_I8II_BH_UserArgs_MT32x32x128_MI16x16x1_SN_CLR1_GSU0_GSUC0_GSUWGMRR0_K1_LBSPPA128_LBSPPB128_MIWT1_1_PLR2_SU0_SUM0_SUS0_SKXCCM8_VWA1_VWB1_WGM1_WGMXCC1_WGMXCCGn1
    SolutionIndex: 168
    SolutionNameMin: Cijk_Alik_Bljk_I8II_BH_UserArgs_MT32x32x128_MI16x16x1_SN_CLR1_GSU0_GSUC0_GSUWGMRR0_K1_LBSPPA128_LBSPPB128_MIWT1_1_PLR1_SU0_SUM0_SUS0_SKXCCM8_VWA1_VWB1_WGM4_WGMXCC1_WGMXCCGn1
    SolutionIndex: 169
    SolutionNameMin: Cijk_Alik_Bljk_I8II_BH_UserArgs_MT32x32x128_MI16x16x1_SN_CLR1_GSU0_GSUC0_GSUWGMRR0_K1_LBSPPA128_LBSPPB128_MIWT1_1_PLR2_SU0_SUM0_SUS0_SKXCCM8_VWA1_VWB1_WGM4_WGMXCC1_WGMXCCGn1
    SolutionIndex: 170
    SolutionNameMin: Cijk_Alik_Bljk_I8II_BH_UserArgs_MT32x32x128_MI16x16x1_SN_CLR1_GSU0_GSUC0_GSUWGMRR0_K1_LBSPPA128_LBSPPB128_MIWT1_1_PLR1_SU0_SUM0_SUS0_SKXCCM8_VWA1_VWB1_WGM8_WGMXCC1_WGMXCCGn1
    SolutionIndex: 171
    SolutionNameMin: Cijk_Alik_Bljk_I8II_BH_UserArgs_MT32x32x128_MI16x16x1_SN_CLR1_GSU0_GSUC0_GSUWGMRR0_K1_LBSPPA128_LBSPPB128_MIWT1_1_PLR1_SU0_SUM0_SUS0_SKXCCM8_VWA1_VWB1_WGM8_WGMXCC1_WGMXCCGn1
    SolutionIndex: 172
    SolutionNameMin: Cijk_Alik_Bljk_I8II_BH_UserArgs_MT32x32x128_MI16x16x1_SN_CLR1_GSU0_GSUC0_GSUWGMRR0_K1_LBSPPA128_LBSPPB128_MIWT1_1_PLR2_SU0_SUM0_SUS0_SKXCCM8_VWA1_VWB1_WGM8_WGMXCC1_WGMXCCGn1
    SolutionIndex: 173
    SolutionNameMin: Cijk_Alik_Bljk_I8II_BH_UserArgs_MT32x32x128_MI16x16x1_SN_CLR1_GSU0_GSUC0_GSUWGMRR0_K1_LBSPPA128_LBSPPB128_MIWT1_1_PLR2_SU0_SUM0_SUS0_SKXCCM8_VWA1_VWB1_WGM8_WGMXCC1_WGMXCCGn1
    SolutionIndex: 174
    SolutionNameMin: Cijk_Alik_Bljk_I8II_BH_UserArgs_MT64x128x256_MI16x16x1_SN_CLR1_GSU0_GSUC0_GSUWGMRR0_K1_LBSPPA512_LBSPPB256_MIWT2_4_PLR2_SU0_SUM0_SUS0_SKXCCM8_VWA2_VWB1_WGM1_WGMXCC1_WGMXCCGn1
    SolutionIndex: 175
    SolutionNameMin: Cijk_Alik_Bljk_I8II_BH_UserArgs_MT64x128x256_MI16x16x1_SN_CLR1_GSU0_GSUC0_GSUWGMRR0_K1_LBSPPA512_LBSPPB256_MIWT2_4_PLR1_SU0_SUM0_SUS0_SKXCCM8_VWA2_VWB1_WGM4_WGMXCC1_WGMXCCGn1
    SolutionIndex: 176
    SolutionNameMin: Cijk_Alik_Bljk_I8II_BH_UserArgs_MT128x64x256_MI16x16x1_SN_CLR1_GSU0_GSUC0_GSUWGMRR0_K1_LBSPPA1024_LBSPPB512_MIWT4_2_PLR2_SU0_SUM0_SUS0_SKXCCM8_VWA4_VWB2_WGM1_WGMXCC1_WGMXCCGn1
    SolutionIndex: 177
    SolutionNameMin: Cijk_Alik_Bljk_I8II_BH_UserArgs_MT128x64x256_MI16x16x1_SN_CLR1_GSU0_GSUC0_GSUWGMRR0_K1_LBSPPA1024_LBSPPB512_MIWT4_2_PLR2_SU0_SUM0_SUS0_SKXCCM8_VWA4_VWB2_WGM1_WGMXCC1_WGMXCCGn1
    SolutionIndex: 178
    SolutionNameMin: Cijk_Alik_Bljk_I8II_BH_UserArgs_MT128x64x256_MI16x16x1_SN_CLR1_GSU0_GSUC0_GSUWGMRR0_K1_LBSPPA256_LBSPPB256_MIWT4_2_PLR1_SU0_SUM0_SUS0_SKXCCM8_VWA1_VWB1_WGM4_WGMXCC1_WGMXCCGn1
    SolutionIndex: 179
    SolutionNameMin: Cijk_Alik_Bljk_I8II_BH_UserArgs_MT128x64x256_MI16x16x1_SN_CLR1_GSU0_GSUC0_GSUWGMRR0_K1_LBSPPA1024_LBSPPB256_MIWT4_2_PLR1_SU0_SUM0_SUS0_SKXCCM8_VWA4_VWB1_WGM4_WGMXCC1_WGMXCCGn1
    SolutionIndex: 180
    SolutionNameMin: Cijk_Alik_Bljk_I8II_BH_UserArgs_MT128x64x256_MI16x16x1_SN_CLR1_GSU0_GSUC0_GSUWGMRR0_K1_LBSPPA1024_LBSPPB512_MIWT4_2_PLR1_SU0_SUM0_SUS0_SKXCCM8_VWA4_VWB2_WGM4_WGMXCC1_WGMXCCGn1
    SolutionIndex: 181
    SolutionNameMin: Cijk_Alik_Bljk_I8II_BH_UserArgs_MT128x64x256_MI16x16x1_SN_CLR1_GSU0_GSUC0_GSUWGMRR0_K1_LBSPPA1024_LBSPPB512_MIWT4_2_PLR1_SU0_SUM0_SUS0_SKXCCM8_VWA4_VWB2_WGM4_WGMXCC1_WGMXCCGn1
    SolutionIndex: 182
    SolutionNameMin: Cijk_Alik_Bljk_I8II_BH_UserArgs_MT128x64x256_MI16x16x1_SN_CLR1_GSU0_GSUC0_GSUWGMRR0_K1_LBSPPA1024_LBSPPB512_MIWT4_2_PLR2_SU0_SUM0_SUS0_SKXCCM8_VWA4_VWB2_WGM4_WGMXCC1_WGMXCCGn1
    SolutionIndex: 183
    SolutionNameMin: Cijk_Alik_Bljk_I8II_BH_UserArgs_MT128x64x256_MI16x16x1_SN_CLR1_GSU0_GSUC0_GSUWGMRR0_K1_LBSPPA256_LBSPPB256_MIWT4_2_PLR1_SU0_SUM0_SUS0_SKXCCM8_VWA1_VWB1_WGM8_WGMXCC1_WGMXCCGn1
    SolutionIndex: 184
    SolutionNameMin: Cijk_Alik_Bljk_I8II_BH_UserArgs_MT128x64x256_MI16x16x1_SN_CLR1_GSU0_GSUC0_GSUWGMRR0_K1_LBSPPA1024_LBSPPB512_MIWT4_2_PLR1_SU0_SUM0_SUS0_SKXCCM8_VWA4_VWB2_WGM8_WGMXCC1_WGMXCCGn1
    SolutionIndex: 185
    SolutionNameMin: Cijk_Alik_Bljk_I8II_BH_UserArgs_MT128x64x256_MI16x16x1_SN_CLR1_GSU0_GSUC0_GSUWGMRR0_K1_LBSPPA1024_LBSPPB256_MIWT4_2_PLR2_SU0_SUM0_SUS0_SKXCCM8_VWA4_VWB1_WGM8_WGMXCC1_WGMXCCGn1
    SolutionIndex: 186
    SolutionNameMin: Cijk_Alik_Bljk_I8II_BH_UserArgs_MT128x64x256_MI16x16x1_SN_CLR1_GSU0_GSUC0_GSUWGMRR0_K1_LBSPPA1024_LBSPPB512_MIWT4_2_PLR2_SU0_SUM0_SUS0_SKXCCM8_VWA4_VWB2_WGM8_WGMXCC1_WGMXCCGn1
    SolutionIndex: 187
    SolutionNameMin: Cijk_Alik_Bljk_I8II_BH_UserArgs_MT128x64x256_MI16x16x1_SN_CLR1_GSU0_GSUC0_GSUWGMRR0_K1_LBSPPA1024_LBSPPB256_MIWT4_2_PLR2_SU0_SUM0_SUS0_SKXCCM8_VWA4_VWB1_WGM8_WGMXCC1_WGMXCCGn1
    SolutionIndex: 188
    SolutionNameMin: Cijk_Alik_Bljk_I8II_BH_UserArgs_MT128x64x256_MI16x16x1_SN_CLR1_GSU0_GSUC0_GSUWGMRR0_K1_LBSPPA256_LBSPPB512_MIWT4_2_PLR2_SU0_SUM0_SUS0_SKXCCM8_VWA1_VWB2_WGM8_WGMXCC1_WGMXCCGn1
    SolutionIndex: 189
    SolutionNameMin: Cijk_Alik_Bljk_I8II_BH_UserArgs_MT64x64x256_MI16x16x1_SN_CLR1_GSU0_GSUC0_GSUWGMRR0_K1_LBSPPA256_LBSPPB512_MIWT2_2_PLR1_SU0_SUM0_SUS0_SKXCCM8_VWA1_VWB2_WGM1_WGMXCC1_WGMXCCGn1
    SolutionIndex: 190
    SolutionNameMin: Cijk_Alik_Bljk_I8II_BH_UserArgs_MT64x64x256_MI16x16x1_SN_CLR1_GSU0_GSUC0_GSUWGMRR0_K1_LBSPPA256_LBSPPB512_MIWT2_2_PLR1_SU0_SUM0_SUS0_SKXCCM8_VWA1_VWB2_WGM4_WGMXCC1_WGMXCCGn1
    SolutionIndex: 191
    SolutionNameMin: Cijk_Alik_Bljk_I8II_BH_UserArgs_MT64x64x256_MI16x16x1_SN_CLR1_GSU0_GSUC0_GSUWGMRR0_K1_LBSPPA256_LBSPPB512_MIWT2_2_PLR2_SU0_SUM0_SUS0_SKXCCM8_VWA1_VWB2_WGM4_WGMXCC1_WGMXCCGn1
    SolutionIndex: 192
    SolutionNameMin: Cijk_Alik_Bljk_I8II_BH_UserArgs_MT64x64x256_MI16x16x1_SN_CLR1_GSU0_GSUC0_GSUWGMRR0_K1_LBSPPA256_LBSPPB256_MIWT2_2_PLR2_SU0_SUM0_SUS0_SKXCCM8_VWA1_VWB1_WGM8_WGMXCC1_WGMXCCGn1
    SolutionIndex: 193
    SolutionNameMin: Cijk_Alik_Bljk_I8II_BH_UserArgs_MT32x32x256_MI16x16x1_SN_CLR1_GSU0_GSUC0_GSUWGMRR0_K1_LBSPPA256_LBSPPB256_MIWT1_1_PLR1_SU0_SUM0_SUS0_SKXCCM8_VWA1_VWB1_WGM1_WGMXCC1_WGMXCCGn1
    SolutionIndex: 194
    SolutionNameMin: Cijk_Alik_Bljk_I8II_BH_UserArgs_MT32x32x256_MI16x16x1_SN_CLR1_GSU0_GSUC0_GSUWGMRR0_K1_LBSPPA256_LBSPPB256_MIWT1_1_PLR1_SU0_SUM0_SUS0_SKXCCM8_VWA1_VWB1_WGM1_WGMXCC1_WGMXCCGn1
    SolutionIndex: 195
    SolutionNameMin: Cijk_Alik_Bljk_I8II_BH_UserArgs_MT32x32x256_MI16x16x1_SN_CLR1_GSU0_GSUC0_GSUWGMRR0_K1_LBSPPA256_LBSPPB256_MIWT1_1_PLR2_SU0_SUM0_SUS0_SKXCCM8_VWA1_VWB1_WGM1_WGMXCC1_WGMXCCGn1
    SolutionIndex: 196
    SolutionNameMin: Cijk_Alik_Bljk_I8II_BH_UserArgs_MT32x32x256_MI16x16x1_SN_CLR1_GSU0_GSUC0_GSUWGMRR0_K1_LBSPPA256_LBSPPB256_MIWT1_1_PLR2_SU0_SUM0_SUS0_SKXCCM8_VWA1_VWB1_WGM1_WGMXCC1_WGMXCCGn1
    SolutionIndex: 197
    SolutionNameMin: Cijk_Alik_Bljk_I8II_BH_UserArgs_MT32x32x256_MI16x16x1_SN_CLR1_GSU0_GSUC0_GSUWGMRR0_K1_LBSPPA256_LBSPPB256_MIWT1_1_PLR2_SU0_SUM0_SUS0_SKXCCM8_VWA1_VWB1_WGM4_WGMXCC1_WGMXCCGn1
    SolutionIndex: 198
    SolutionNameMin: Cijk_Alik_Bljk_I8II_BH_UserArgs_MT32x32x256_MI16x16x1_SN_CLR1_GSU0_GSUC0_GSUWGMRR0_K1_LBSPPA256_LBSPPB256_MIWT1_1_PLR2_SU0_SUM0_SUS0_SKXCCM8_VWA1_VWB1_WGM8_WGMXCC1_WGMXCCGn1
    SolutionIndex: 199
    SolutionNameMin: Cijk_Alik_Bljk_I8II_BH_UserArgs_MT32x32x32_MI16x16x1_SN_CLR0_GSU0_GSUC0_GSUWGMRR0_K1_LBSPPA128_LBSPPB128_MIWT1_1_PLR0_SU32_SUM0_SUS256_SKXCCM0_VWA1_VWB1_WGM8_WGMXCC1_WGMXCCGn1
- - - [128, 128, 1, 128, 128, 128, 128, 128]
    - [66, 0.52]
  - - [128, 128, 1, 256, 128, 128, 256, 256]
    - [67, 1.04]
  - - [128, 128, 1, 512, 128, 128, 512, 512]
    - [162, 1.97]
  - - [128, 128, 1, 1024, 128, 128, 1024, 1024]
    - [162, 3.52]
  - - [128, 128, 1, 2048, 128, 128, 2048, 2048]
    - [196, 5.42]
  - - [128, 128, 1, 4096, 128, 128, 4096, 4096]
    - [196, 7.81]
  - - [128, 128, 1, 8192, 128, 128, 8192, 8192]
    - [164, 14.59]
  - - [128, 256, 1, 128, 128, 128, 128, 128]
    - [160, 1.04]
  - - [128, 256, 1, 256, 128, 128, 256, 256]
    - [195, 2.05]
  - - [128, 256, 1, 512, 128, 128, 512, 512]
    - [170, 3.94]
  - - [128, 256, 1, 1024, 128, 128, 1024, 1024]
    - [162, 7.0]
  - - [128, 256, 1, 2048, 128, 128, 2048, 2048]
    - [196, 10.9]
  - - [128, 256, 1, 4096, 128, 128, 4096, 4096]
    - [196, 15.73]
  - - [128, 256, 1, 8192, 128, 128, 8192, 8192]
    - [164, 28.38]
  - - [128, 512, 1, 128, 128, 128, 128, 128]
    - [171, 2.1]
  - - [128, 512, 1, 256, 128, 128, 256, 256]
    - [60, 4.09]
  - - [128, 512, 1, 512, 128, 128, 512, 512]
    - [166, 7.78]
  - - [128, 512, 1, 1024, 128, 128, 1024, 1024]
    - [162, 14.19]
  - - [128, 512, 1, 2048, 128, 128, 2048, 2048]
    - [196, 21.63]
  - - [128, 512, 1, 4096, 128, 128, 4096, 4096]
    - [194, 30.94]
  - - [128, 512, 1, 8192, 128, 128, 8192, 8192]
    - [171, 54.47]
  - - [128, 1024, 1, 128, 128, 128, 128, 128]
    - [6, 4.15]
  - - [128, 1024, 1, 256, 128, 128, 256, 256]
    - [161, 8.25]
  - - [128, 1024, 1, 512, 128, 128, 512, 512]
    - [166, 15.71]
  - - [128, 1024, 1, 1024, 128, 128, 1024, 1024]
    - [194, 27.02]
  - - [128, 1024, 1, 2048, 128, 128, 2048, 2048]
    - [196, 42.43]
  - - [128, 1024, 1, 4096, 128, 128, 4096, 4096]
    - [164, 59.77]
  - - [128, 1024, 1, 8192, 128, 128, 8192, 8192]
    - [196, 90.59]
  - - [128, 2048, 1, 128, 128, 128, 128, 128]
    - [63, 8.27]
  - - [128, 2048, 1, 256, 128, 128, 256, 256]
    - [161, 15.9]
  - - [128, 2048, 1, 512, 128, 128, 512, 512]
    - [164, 30.85]
  - - [128, 2048, 1, 1024, 128, 128, 1024, 1024]
    - [164, 53.52]
  - - [128, 2048, 1, 2048, 128, 128, 2048, 2048]
    - [196, 84.72]
  - - [128, 2048, 1, 4096, 128, 128, 4096, 4096]
    - [196, 119.51]
  - - [128, 2048, 1, 8192, 128, 128, 8192, 8192]
    - [196, 152.42]
  - - [128, 4096, 1, 128, 128, 128, 128, 128]
    - [7, 15.97]
  - - [128, 4096, 1, 256, 128, 128, 256, 256]
    - [152, 29.41]
  - - [128, 4096, 1, 512, 128, 128, 512, 512]
    - [147, 54.32]
  - - [128, 4096, 1, 1024, 128, 128, 1024, 1024]
    - [145, 91.01]
  - - [128, 4096, 1, 2048, 128, 128, 2048, 2048]
    - [155, 134.18]
  - - [128, 4096, 1, 4096, 128, 128, 4096, 4096]
    - [146, 184.02]
  - - [128, 4096, 1, 8192, 128, 128, 8192, 8192]
    - [123, 192.7]
  - - [128, 8192, 1, 128, 128, 128, 128, 128]
    - [137, 27.12]
  - - [128, 8192, 1, 256, 128, 128, 256, 256]
    - [53, 50.21]
  - - [128, 8192, 1, 512, 128, 128, 512, 512]
    - [137, 88.11]
  - - [128, 8192, 1, 1024, 128, 128, 1024, 1024]
    - [137, 145.24]
  - - [128, 8192, 1, 2048, 128, 128, 2048, 2048]
    - [137, 216.19]
  - - [128, 8192, 1, 4096, 128, 128, 4096, 4096]
    - [189, 220.51]
  - - [128, 8192, 1, 8192, 128, 128, 8192, 8192]
    - [135, 260.66]
  - - [256, 128, 1, 128, 256, 256, 128, 128]
    - [11, 1.05]
  - - [256, 128, 1, 256, 256, 256, 256, 256]
    - [70, 2.03]
  - - [256, 128, 1, 512, 256, 256, 512, 512]
    - [165, 4.01]
  - - [256, 128, 1, 1024, 256, 256, 1024, 1024]
    - [162, 7.03]
  - - [256, 128, 1, 2048, 256, 256, 2048, 2048]
    - [194, 10.8]
  - - [256, 128, 1, 4096, 256, 256, 4096, 4096]
    - [196, 15.79]
  - - [256, 128, 1, 8192, 256, 256, 8192, 8192]
    - [164, 27.68]
  - - [256, 256, 1, 128, 256, 256, 128, 128]
    - [62, 2.08]
  - - [256, 256, 1, 256, 256, 256, 256, 256]
    - [69, 4.16]
  - - [256, 256, 1, 512, 256, 256, 512, 512]
    - [164, 8.13]
  - - [256, 256, 1, 1024, 256, 256, 1024, 1024]
    - [162, 13.93]
  - - [256, 256, 1, 2048, 256, 256, 2048, 2048]
    - [194, 21.07]
  - - [256, 256, 1, 4096, 256, 256, 4096, 4096]
    - [196, 30.82]
  - - [256, 256, 1, 8192, 256, 256, 8192, 8192]
    - [164, 55.22]
  - - [256, 512, 1, 128, 256, 256, 128, 128]
    - [159, 4.21]
  - - [256, 512, 1, 256, 256, 256, 256, 256]
    - [193, 8.43]
  - - [256, 512, 1, 512, 256, 256, 512, 512]
    - [162, 15.82]
  - - [256, 512, 1, 1024, 256, 256, 1024, 1024]
    - [164, 27.78]
  - - [256, 512, 1, 2048, 256, 256, 2048, 2048]
    - [196, 42.76]
  - - [256, 512, 1, 4096, 256, 256, 4096, 4096]
    - [164, 59.57]
  - - [256, 512, 1, 8192, 256, 256, 8192, 8192]
    - [196, 91.1]
  - - [256, 1024, 1, 128, 256, 256, 128, 128]
    - [8, 8.27]
  - - [256, 1024, 1, 256, 256, 256, 256, 256]
    - [65, 16.46]
  - - [256, 1024, 1, 512, 256, 256, 512, 512]
    - [163, 30.54]
  - - [256, 1024, 1, 1024, 256, 256, 1024, 1024]
    - [194, 51.82]
  - - [256, 1024, 1, 2048, 256, 256, 2048, 2048]
    - [196, 83.65]
  - - [256, 1024, 1, 4096, 256, 256, 4096, 4096]
    - [196, 119.26]
  - - [256, 1024, 1, 8192, 256, 256, 8192, 8192]
    - [196, 152.2]
  - - [256, 2048, 1, 128, 256, 256, 128, 128]
    - [142, 15.75]
  - - [256, 2048, 1, 256, 256, 256, 256, 256]
    - [144, 29.75]
  - - [256, 2048, 1, 512, 256, 256, 512, 512]
    - [146, 54.38]
  - - [256, 2048, 1, 1024, 256, 256, 1024, 1024]
    - [146, 91.05]
  - - [256, 2048, 1, 2048, 256, 256, 2048, 2048]
    - [146, 137.53]
  - - [256, 2048, 1, 4096, 256, 256, 4096, 4096]
    - [146, 185.11]
  - - [256, 2048, 1, 8192, 256, 256, 8192, 8192]
    - [189, 208.12]
  - - [256, 4096, 1, 128, 256, 256, 128, 128]
    - [4, 26.87]
  - - [256, 4096, 1, 256, 256, 256, 256, 256]
    - [54, 49.97]
  - - [256, 4096, 1, 512, 256, 256, 512, 512]
    - [137, 88.66]
  - - [256, 4096, 1, 1024, 256, 256, 1024, 1024]
    - [137, 145.04]
  - - [256, 4096, 1, 2048, 256, 256, 2048, 2048]
    - [137, 214.02]
  - - [256, 4096, 1, 4096, 256, 256, 4096, 4096]
    - [138, 274.34]
  - - [256, 4096, 1, 8192, 256, 256, 8192, 8192]
    - [179, 271.19]
  - - [256, 8192, 1, 128, 256, 256, 128, 128]
    - [2, 40.78]
  - - [256, 8192, 1, 256, 256, 256, 256, 256]
    - [48, 74.96]
  - - [256, 8192, 1, 512, 256, 256, 512, 512]
    - [45, 127.5]
  - - [256, 8192, 1, 1024, 256, 256, 1024, 1024]
    - [127, 205.47]
  - - [256, 8192, 1, 2048, 256, 256, 2048, 2048]
    - [123, 266.56]
  - - [256, 8192, 1, 4096, 256, 256, 4096, 4096]
    - [177, 285.21]
  - - [256, 8192, 1, 8192, 256, 256, 8192, 8192]
    - [174, 342.4]
  - - [512, 128, 1, 128, 512, 512, 128, 128]
    - [167, 2.09]
  - - [512, 128, 1, 256, 512, 512, 256, 256]
    - [172, 4.11]
  - - [512, 128, 1, 512, 512, 512, 512, 512]
    - [196, 7.86]
  - - [512, 128, 1, 1024, 512, 512, 1024, 1024]
    - [165, 13.67]
  - - [512, 128, 1, 2048, 512, 512, 2048, 2048]
    - [194, 21.69]
  - - [512, 128, 1, 4096, 512, 512, 4096, 4096]
    - [196, 30.66]
  - - [512, 128, 1, 8192, 512, 512, 8192, 8192]
    - [164, 54.9]
  - - [512, 256, 1, 128, 512, 512, 128, 128]
    - [10, 4.1]
  - - [512, 256, 1, 256, 512, 512, 256, 256]
    - [168, 8.01]
  - - [512, 256, 1, 512, 512, 512, 512, 512]
    - [193, 14.85]
  - - [512, 256, 1, 1024, 512, 512, 1024, 1024]
    - [164, 27.52]
  - - [512, 256, 1, 2048, 512, 512, 2048, 2048]
    - [196, 43.13]
  - - [512, 256, 1, 4096, 512, 512, 4096, 4096]
    - [164, 59.86]
  - - [512, 256, 1, 8192, 512, 512, 8192, 8192]
    - [146, 90.55]
  - - [512, 512, 1, 128, 512, 512, 128, 128]
    - [61, 8.2]
  - - [512, 512, 1, 256, 512, 512, 256, 256]
    - [144, 15.87]
  - - [512, 512, 1, 512, 512, 512, 512, 512]
    - [164, 31.5]
  - - [512, 512, 1, 1024, 512, 512, 1024, 1024]
    - [193, 51.16]
  - - [512, 512, 1, 2048, 512, 512, 2048, 2048]
    - [162, 85.02]
  - - [512, 512, 1, 4096, 512, 512, 4096, 4096]
    - [196, 118.59]
  - - [512, 512, 1, 8192, 512, 512, 8192, 8192]
    - [197, 150.93]
  - - [512, 1024, 1, 128, 512, 512, 128, 128]
    - [59, 16.01]
  - - [512, 1024, 1, 256, 512, 512, 256, 256]
    - [156, 30.31]
  - - [512, 1024, 1, 512, 512, 512, 512, 512]
    - [143, 54.3]
  - - [512, 1024, 1, 1024, 512, 512, 1024, 1024]
    - [146, 90.89]
  - - [512, 1024, 1, 2048, 512, 512, 2048, 2048]
    - [146, 137.96]
  - - [512, 1024, 1, 4096, 512, 512, 4096, 4096]
    - [146, 185.3]
  - - [512, 1024, 1, 8192, 512, 512, 8192, 8192]
    - [191, 205.93]
  - - [512, 2048, 1, 128, 512, 512, 128, 128]
    - [55, 27.2]
  - - [512, 2048, 1, 256, 512, 512, 256, 256]
    - [137, 49.9]
  - - [512, 2048, 1, 512, 512, 512, 512, 512]
    - [137, 88.62]
  - - [512, 2048, 1, 1024, 512, 512, 1024, 1024]
    - [137, 143.78]
  - - [512, 2048, 1, 2048, 512, 512, 2048, 2048]
    - [138, 210.88]
  - - [512, 2048, 1, 4096, 512, 512, 4096, 4096]
    - [138, 269.75]
  - - [512, 2048, 1, 8192, 512, 512, 8192, 8192]
    - [180, 272.82]
  - - [512, 4096, 1, 128, 512, 512, 128, 128]
    - [47, 40.79]
  - - [512, 4096, 1, 256, 512, 512, 256, 256]
    - [45, 74.94]
  - - [512, 4096, 1, 512, 512, 512, 512, 512]
    - [129, 127.73]
  - - [512, 4096, 1, 1024, 512, 512, 1024, 1024]
    - [127, 205.98]
  - - [512, 4096, 1, 2048, 512, 512, 2048, 2048]
    - [125, 288.21]
  - - [512, 4096, 1, 4096, 512, 512, 4096, 4096]
    - [176, 292.57]
  - - [512, 4096, 1, 8192, 512, 512, 8192, 8192]
    - [184, 350.68]
  - - [512, 8192, 1, 128, 512, 512, 128, 128]
    - [39, 58.54]
  - - [512, 8192, 1, 256, 512, 512, 256, 256]
    - [39, 104.67]
  - - [512, 8192, 1, 512, 512, 512, 512, 512]
    - [106, 158.33]
  - - [512, 8192, 1, 1024, 512, 512, 1024, 1024]
    - [107, 240.75]
  - - [512, 8192, 1, 2048, 512, 512, 2048, 2048]
    - [103, 300.73]
  - - [512, 8192, 1, 4096, 512, 512, 4096, 4096]
    - [102, 366.45]
  - - [512, 8192, 1, 8192, 512, 512, 8192, 8192]
    - [81, 386.23]
  - - [1024, 128, 1, 128, 1024, 1024, 128, 128]
    - [9, 4.16]
  - - [1024, 128, 1, 256, 1024, 1024, 256, 256]
    - [173, 8.24]
  - - [1024, 128, 1, 512, 1024, 1024, 512, 512]
    - [163, 15.57]
  - - [1024, 128, 1, 1024, 1024, 1024, 1024, 1024]
    - [164, 27.34]
  - - [1024, 128, 1, 2048, 1024, 1024, 2048, 2048]
    - [194, 42.37]
  - - [1024, 128, 1, 4096, 1024, 1024, 4096, 4096]
    - [164, 59.32]
  - - [1024, 128, 1, 8192, 1024, 1024, 8192, 8192]
    - [146, 89.61]
  - - [1024, 256, 1, 128, 1024, 1024, 128, 128]
    - [68, 8.21]
  - - [1024, 256, 1, 256, 1024, 1024, 256, 256]
    - [169, 16.12]
  - - [1024, 256, 1, 512, 1024, 1024, 512, 512]
    - [165, 31.21]
  - - [1024, 256, 1, 1024, 1024, 1024, 1024, 1024]
    - [164, 52.67]
  - - [1024, 256, 1, 2048, 1024, 1024, 2048, 2048]
    - [197, 81.88]
  - - [1024, 256, 1, 4096, 1024, 1024, 4096, 4096]
    - [198, 116.95]
  - - [1024, 256, 1, 8192, 1024, 1024, 8192, 8192]
    - [198, 150.35]
  - - [1024, 512, 1, 128, 1024, 1024, 128, 128]
    - [157, 16.16]
  - - [1024, 512, 1, 256, 1024, 1024, 256, 256]
    - [148, 29.9]
  - - [1024, 512, 1, 512, 1024, 1024, 512, 512]
    - [154, 53.84]
  - - [1024, 512, 1, 1024, 1024, 1024, 1024, 1024]
    - [151, 90.3]
  - - [1024, 512, 1, 2048, 1024, 1024, 2048, 2048]
    - [145, 135.89]
  - - [1024, 512, 1, 4096, 1024, 1024, 4096, 4096]
    - [149, 181.67]
  - - [1024, 512, 1, 8192, 1024, 1024, 8192, 8192]
    - [190, 206.54]
  - - [1024, 1024, 1, 128, 1024, 1024, 128, 128]
    - [5, 27.1]
  - - [1024, 1024, 1, 256, 1024, 1024, 256, 256]
    - [54, 50.27]
  - - [1024, 1024, 1, 512, 1024, 1024, 512, 512]
    - [141, 86.52]
  - - [1024, 1024, 1, 1024, 1024, 1024, 1024, 1024]
    - [137, 145.6]
  - - [1024, 1024, 1, 2048, 1024, 1024, 2048, 2048]
    - [137, 215.41]
  - - [1024, 1024, 1, 4096, 1024, 1024, 4096, 4096]
    - [140, 271.73]
  - - [1024, 1024, 1, 8192, 1024, 1024, 8192, 8192]
    - [182, 275.7]
  - - [1024, 2048, 1, 128, 1024, 1024, 128, 128]
    - [3, 41.1]
  - - [1024, 2048, 1, 256, 1024, 1024, 256, 256]
    - [50, 75.57]
  - - [1024, 2048, 1, 512, 1024, 1024, 512, 512]
    - [129, 128.9]
  - - [1024, 2048, 1, 1024, 1024, 1024, 1024, 1024]
    - [128, 206.67]
  - - [1024, 2048, 1, 2048, 1024, 1024, 2048, 2048]
    - [134, 287.08]
  - - [1024, 2048, 1, 4096, 1024, 1024, 4096, 4096]
    - [188, 293.22]
  - - [1024, 2048, 1, 8192, 1024, 1024, 8192, 8192]
    - [185, 351.55]
  - - [1024, 4096, 1, 128, 1024, 1024, 128, 128]
    - [38, 59.32]
  - - [1024, 4096, 1, 256, 1024, 1024, 256, 256]
    - [38, 105.98]
  - - [1024, 4096, 1, 512, 1024, 1024, 512, 512]
    - [105, 158.12]
  - - [1024, 4096, 1, 1024, 1024, 1024, 1024, 1024]
    - [106, 240.95]
  - - [1024, 4096, 1, 2048, 1024, 1024, 2048, 2048]
    - [107, 306.44]
  - - [1024, 4096, 1, 4096, 1024, 1024, 4096, 4096]
    - [114, 370.4]
  - - [1024, 4096, 1, 8192, 1024, 1024, 8192, 8192]
    - [81, 386.77]
  - - [1024, 8192, 1, 128, 1024, 1024, 128, 128]
    - [84, 56.7]
  - - [1024, 8192, 1, 256, 1024, 1024, 256, 256]
    - [32, 103.12]
  - - [1024, 8192, 1, 512, 1024, 1024, 512, 512]
    - [78, 172.96]
  - - [1024, 8192, 1, 1024, 1024, 1024, 1024, 1024]
    - [83, 266.92]
  - - [1024, 8192, 1, 2048, 1024, 1024, 2048, 2048]
    - [83, 359.78]
  - - [1024, 8192, 1, 4096, 1024, 1024, 4096, 4096]
    - [92, 438.49]
  - - [1024, 8192, 1, 8192, 1024, 1024, 8192, 8192]
    - [80, 422.28]
  - - [2048, 128, 1, 128, 2048, 2048, 128, 128]
    - [10, 8.16]
  - - [2048, 128, 1, 256, 2048, 2048, 256, 256]
    - [64, 16.36]
  - - [2048, 128, 1, 512, 2048, 2048, 512, 512]
    - [162, 30.62]
  - - [2048, 128, 1, 1024, 2048, 2048, 1024, 1024]
    - [171, 52.56]
  - - [2048, 128, 1, 2048, 2048, 2048, 2048, 2048]
    - [171, 82.85]
  - - [2048, 128, 1, 4096, 2048, 2048, 4096, 4096]
    - [197, 116.88]
  - - [2048, 128, 1, 8192, 2048, 2048, 8192, 8192]
    - [198, 150.55]
  - - [2048, 256, 1, 128, 2048, 2048, 128, 128]
    - [153, 16.09]
  - - [2048, 256, 1, 256, 2048, 2048, 256, 256]
    - [158, 29.81]
  - - [2048, 256, 1, 512, 2048, 2048, 512, 512]
    - [145, 52.82]
  - - [2048, 256, 1, 1024, 2048, 2048, 1024, 1024]
    - [154, 89.43]
  - - [2048, 256, 1, 2048, 2048, 2048, 2048, 2048]
    - [150, 135.04]
  - - [2048, 256, 1, 4096, 2048, 2048, 4096, 4096]
    - [150, 181.55]
  - - [2048, 256, 1, 8192, 2048, 2048, 8192, 8192]
    - [191, 207.53]
  - - [2048, 512, 1, 128, 2048, 2048, 128, 128]
    - [139, 27.3]
  - - [2048, 512, 1, 256, 2048, 2048, 256, 256]
    - [55, 50.5]
  - - [2048, 512, 1, 512, 2048, 2048, 512, 512]
    - [136, 87.94]
  - - [2048, 512, 1, 1024, 2048, 2048, 1024, 1024]
    - [136, 145.8]
  - - [2048, 512, 1, 2048, 2048, 2048, 2048, 2048]
    - [141, 211.33]
  - - [2048, 512, 1, 4096, 2048, 2048, 4096, 4096]
    - [140, 274.87]
  - - [2048, 512, 1, 8192, 2048, 2048, 8192, 8192]
    - [180, 276.12]
  - - [2048, 1024, 1, 128, 2048, 2048, 128, 128]
    - [2, 41.35]
  - - [2048, 1024, 1, 256, 2048, 2048, 256, 256]
    - [46, 75.3]
  - - [2048, 1024, 1, 512, 2048, 2048, 512, 512]
    - [49, 128.56]
  - - [2048, 1024, 1, 1024, 2048, 2048, 1024, 1024]
    - [131, 202.77]
  - - [2048, 1024, 1, 2048, 2048, 2048, 2048, 2048]
    - [135, 287.44]
  - - [2048, 1024, 1, 4096, 2048, 2048, 4096, 4096]
    - [183, 294.08]
  - - [2048, 1024, 1, 8192, 2048, 2048, 8192, 8192]
    - [175, 349.97]
  - - [2048, 2048, 1, 128, 2048, 2048, 128, 128]
    - [35, 57.91]
  - - [2048, 2048, 1, 256, 2048, 2048, 256, 256]
    - [36, 101.12]
  - - [2048, 2048, 1, 512, 2048, 2048, 512, 512]
    - [120, 157.54]
  - - [2048, 2048, 1, 1024, 2048, 2048, 1024, 1024]
    - [119, 240.19]
  - - [2048, 2048, 1, 2048, 2048, 2048, 2048, 2048]
    - [111, 303.46]
  - - [2048, 2048, 1, 4096, 2048, 2048, 4096, 4096]
    - [110, 371.15]
  - - [2048, 2048, 1, 8192, 2048, 2048, 8192, 8192]
    - [104, 396.5]
  - - [2048, 4096, 1, 128, 2048, 2048, 128, 128]
    - [85, 56.86]
  - - [2048, 4096, 1, 256, 2048, 2048, 256, 256]
    - [31, 104.06]
  - - [2048, 4096, 1, 512, 2048, 2048, 512, 512]
    - [83, 173.53]
  - - [2048, 4096, 1, 1024, 2048, 2048, 1024, 1024]
    - [98, 266.15]
  - - [2048, 4096, 1, 2048, 2048, 2048, 2048, 2048]
    - [95, 360.1]
  - - [2048, 4096, 1, 4096, 2048, 2048, 4096, 4096]
    - [93, 440.29]
  - - [2048, 4096, 1, 8192, 2048, 2048, 8192, 8192]
    - [71, 434.27]
  - - [2048, 8192, 1, 128, 2048, 2048, 128, 128]
    - [0, 62.2]
  - - [2048, 8192, 1, 256, 2048, 2048, 256, 256]
    - [22, 115.68]
  - - [2048, 8192, 1, 512, 2048, 2048, 512, 512]
    - [27, 188.35]
  - - [2048, 8192, 1, 1024, 2048, 2048, 1024, 1024]
    - [23, 288.15]
  - - [2048, 8192, 1, 2048, 2048, 2048, 2048, 2048]
    - [17, 389.38]
  - - [2048, 8192, 1, 4096, 2048, 2048, 4096, 4096]
    - [72, 407.69]
  - - [2048, 8192, 1, 8192, 2048, 2048, 8192, 8192]
    - [15, 445.33]
  - - [4096, 128, 1, 128, 4096, 4096, 128, 128]
    - [58, 16.01]
  - - [4096, 128, 1, 256, 4096, 4096, 256, 256]
    - [144, 29.63]
  - - [4096, 128, 1, 512, 4096, 4096, 512, 512]
    - [154, 53.35]
  - - [4096, 128, 1, 1024, 4096, 4096, 1024, 1024]
    - [154, 87.88]
  - - [4096, 128, 1, 2048, 4096, 4096, 2048, 2048]
    - [145, 131.42]
  - - [4096, 128, 1, 4096, 4096, 4096, 4096, 4096]
    - [150, 176.75]
  - - [4096, 128, 1, 8192, 4096, 4096, 8192, 8192]
    - [135, 198.49]
  - - [4096, 256, 1, 128, 4096, 4096, 128, 128]
    - [51, 26.77]
  - - [4096, 256, 1, 256, 4096, 4096, 256, 256]
    - [57, 48.91]
  - - [4096, 256, 1, 512, 4096, 4096, 512, 512]
    - [141, 86.42]
  - - [4096, 256, 1, 1024, 4096, 4096, 1024, 1024]
    - [140, 142.43]
  - - [4096, 256, 1, 2048, 4096, 4096, 2048, 2048]
    - [140, 211.44]
  - - [4096, 256, 1, 4096, 4096, 4096, 4096, 4096]
    - [140, 273.32]
  - - [4096, 256, 1, 8192, 4096, 4096, 8192, 8192]
    - [181, 273.24]
  - - [4096, 512, 1, 128, 4096, 4096, 128, 128]
    - [2, 41.22]
  - - [4096, 512, 1, 256, 4096, 4096, 256, 256]
    - [48, 75.01]
  - - [4096, 512, 1, 512, 4096, 4096, 512, 512]
    - [126, 127.56]
  - - [4096, 512, 1, 1024, 4096, 4096, 1024, 1024]
    - [133, 204.15]
  - - [4096, 512, 1, 2048, 4096, 4096, 2048, 2048]
    - [132, 284.94]
  - - [4096, 512, 1, 4096, 4096, 4096, 4096, 4096]
    - [186, 292.77]
  - - [4096, 512, 1, 8192, 4096, 4096, 8192, 8192]
    - [185, 349.92]
  - - [4096, 1024, 1, 128, 4096, 4096, 128, 128]
    - [37, 56.92]
  - - [4096, 1024, 1, 256, 4096, 4096, 256, 256]
    - [41, 95.34]
  - - [4096, 1024, 1, 512, 4096, 4096, 512, 512]
    - [118, 157.18]
  - - [4096, 1024, 1, 1024, 4096, 4096, 1024, 1024]
    - [118, 241.03]
  - - [4096, 1024, 1, 2048, 4096, 4096, 2048, 2048]
    - [109, 302.22]
  - - [4096, 1024, 1, 4096, 4096, 4096, 4096, 4096]
    - [108, 370.11]
  - - [4096, 1024, 1, 8192, 4096, 4096, 8192, 8192]
    - [101, 385.23]
  - - [4096, 2048, 1, 128, 4096, 4096, 128, 128]
    - [99, 55.55]
  - - [4096, 2048, 1, 256, 4096, 4096, 256, 256]
    - [34, 102.12]
  - - [4096, 2048, 1, 512, 4096, 4096, 512, 512]
    - [89, 171.36]
  - - [4096, 2048, 1, 1024, 4096, 4096, 1024, 1024]
    - [95, 264.18]
  - - [4096, 2048, 1, 2048, 4096, 4096, 2048, 2048]
    - [87, 355.66]
  - - [4096, 2048, 1, 4096, 4096, 4096, 4096, 4096]
    - [86, 434.0]
  - - [4096, 2048, 1, 8192, 4096, 4096, 8192, 8192]
    - [76, 457.52]
  - - [4096, 4096, 1, 128, 4096, 4096, 128, 128]
    - [1, 60.64]
  - - [4096, 4096, 1, 256, 4096, 4096, 256, 256]
    - [1, 111.25]
  - - [4096, 4096, 1, 512, 4096, 4096, 512, 512]
    - [26, 185.31]
  - - [4096, 4096, 1, 1024, 4096, 4096, 1024, 1024]
    - [24, 282.47]
  - - [4096, 4096, 1, 2048, 4096, 4096, 2048, 2048]
    - [28, 384.2]
  - - [4096, 4096, 1, 4096, 4096, 4096, 4096, 4096]
    - [75, 435.47]
  - - [4096, 4096, 1, 8192, 4096, 4096, 8192, 8192]
    - [20, 454.02]
  - - [4096, 8192, 1, 128, 4096, 4096, 128, 128]
    - [100, 61.43]
  - - [4096, 8192, 1, 256, 4096, 4096, 256, 256]
    - [100, 105.29]
  - - [4096, 8192, 1, 512, 4096, 4096, 512, 512]
    - [77, 167.82]
  - - [4096, 8192, 1, 1024, 4096, 4096, 1024, 1024]
    - [113, 246.67]
  - - [4096, 8192, 1, 2048, 4096, 4096, 2048, 2048]
    - [12, 339.36]
  - - [4096, 8192, 1, 4096, 4096, 4096, 4096, 4096]
    - [21, 407.97]
  - - [4096, 8192, 1, 8192, 4096, 4096, 8192, 8192]
    - [13, 451.39]
  - - [8192, 128, 1, 128, 8192, 8192, 128, 128]
    - [52, 26.46]
  - - [8192, 128, 1, 256, 8192, 8192, 256, 256]
    - [56, 48.54]
  - - [8192, 128, 1, 512, 8192, 8192, 512, 512]
    - [141, 86.49]
  - - [8192, 128, 1, 1024, 8192, 8192, 1024, 1024]
    - [140, 142.59]
  - - [8192, 128, 1, 2048, 8192, 8192, 2048, 2048]
    - [141, 211.7]
  - - [8192, 128, 1, 4096, 8192, 8192, 4096, 4096]
    - [192, 219.69]
  - - [8192, 128, 1, 8192, 8192, 8192, 8192, 8192]
    - [186, 258.72]
  - - [8192, 256, 1, 128, 8192, 8192, 128, 128]
    - [2, 40.56]
  - - [8192, 256, 1, 256, 8192, 8192, 256, 256]
    - [45, 74.73]
  - - [8192, 256, 1, 512, 8192, 8192, 512, 512]
    - [44, 127.88]
  - - [8192, 256, 1, 1024, 8192, 8192, 1024, 1024]
    - [130, 202.95]
  - - [8192, 256, 1, 2048, 8192, 8192, 2048, 2048]
    - [124, 268.66]
  - - [8192, 256, 1, 4096, 8192, 8192, 4096, 4096]
    - [187, 287.29]
  - - [8192, 256, 1, 8192, 8192, 8192, 8192, 8192]
    - [178, 345.29]
  - - [8192, 512, 1, 128, 8192, 8192, 128, 128]
    - [40, 57.1]
  - - [8192, 512, 1, 256, 8192, 8192, 256, 256]
    - [43, 103.15]
  - - [8192, 512, 1, 512, 8192, 8192, 512, 512]
    - [112, 154.44]
  - - [8192, 512, 1, 1024, 8192, 8192, 1024, 1024]
    - [112, 237.97]
  - - [8192, 512, 1, 2048, 8192, 8192, 2048, 2048]
    - [116, 299.59]
  - - [8192, 512, 1, 4096, 8192, 8192, 4096, 4096]
    - [110, 369.27]
  - - [8192, 512, 1, 8192, 8192, 8192, 8192, 8192]
    - [74, 387.44]
  - - [8192, 1024, 1, 128, 8192, 8192, 128, 128]
    - [90, 55.24]
  - - [8192, 1024, 1, 256, 8192, 8192, 256, 256]
    - [33, 101.76]
  - - [8192, 1024, 1, 512, 8192, 8192, 512, 512]
    - [88, 169.18]
  - - [8192, 1024, 1, 1024, 8192, 8192, 1024, 1024]
    - [97, 260.81]
  - - [8192, 1024, 1, 2048, 8192, 8192, 2048, 2048]
    - [93, 351.96]
  - - [8192, 1024, 1, 4096, 8192, 8192, 4096, 4096]
    - [94, 435.14]
  - - [8192, 1024, 1, 8192, 8192, 8192, 8192, 8192]
    - [73, 454.69]
  - - [8192, 2048, 1, 128, 8192, 8192, 128, 128]
    - [122, 60.88]
  - - [8192, 2048, 1, 256, 8192, 8192, 256, 256]
    - [18, 111.7]
  - - [8192, 2048, 1, 512, 8192, 8192, 512, 512]
    - [16, 180.98]
  - - [8192, 2048, 1, 1024, 8192, 8192, 1024, 1024]
    - [25, 278.34]
  - - [8192, 2048, 1, 2048, 8192, 8192, 2048, 2048]
    - [29, 381.57]
  - - [8192, 2048, 1, 4096, 8192, 8192, 4096, 4096]
    - [72, 433.38]
  - - [8192, 2048, 1, 8192, 8192, 8192, 8192, 8192]
    - [76, 469.96]
  - - [8192, 4096, 1, 128, 8192, 8192, 128, 128]
    - [42, 66.09]
  - - [8192, 4096, 1, 256, 8192, 8192, 256, 256]
    - [115, 113.85]
  - - [8192, 4096, 1, 512, 8192, 8192, 512, 512]
    - [82, 170.34]
  - - [8192, 4096, 1, 1024, 8192, 8192, 1024, 1024]
    - [117, 247.18]
  - - [8192, 4096, 1, 2048, 8192, 8192, 2048, 2048]
    - [14, 338.24]
  - - [8192, 4096, 1, 4096, 8192, 8192, 4096, 4096]
    - [19, 414.76]
  - - [8192, 4096, 1, 8192, 8192, 8192, 8192, 8192]
    - [16, 462.05]
  - - [8192, 8192, 1, 128, 8192, 8192, 128, 128]
    - [121, 54.79]
  - - [8192, 8192, 1, 256, 8192, 8192, 256, 256]
    - [43, 98.92]
  - - [8192, 8192, 1, 512, 8192, 8192, 512, 512]
    - [79, 154.38]
  - - [8192, 8192, 1, 1024, 8192, 8192, 1024, 1024]
    - [96, 248.31]
  - - [8192, 8192, 1, 2048, 8192, 8192, 2048, 2048]
    - [30, 342.41]
  - - [8192, 8192, 1, 4096, 8192, 8192, 4096, 4096]
    - [91, 422.19]
  - - [8192, 8192, 1, 8192, 8192, 8192, 8192, 8192]
    - [91, 484.27]
  - - [1, 1, 1, 32, 1, 1, 32, 32]
    - [199, 0.0]
- null
- null
- ExperimentalStreamK
- GridBased
