projects/hipblaslt/library/src/amd_detail/rocblaslt/src/Tensile/Logic/asm_full/aquavanjaram/gfx942/StreamK/aquavanjaram942_Cijk_Alik_Bjlk_I8II_BH_UserArgs.yaml
- {MinimumRequiredVersion: 4.33.0}
- aquavanjaram942
- gfx942
- [Device 0049, Device 0050]
    SolutionIndex: 0
    SolutionNameMin: Cijk_Alik_Bjlk_I8II_BH_UserArgs_MT256x256x32_MI16x16x1_SN_CLR0_GSU0_GSUC0_GSUWGMRR0_K1_LBSPPA128_LBSPPB2048_LPB0_MIWT8_8_PLR0_SU0_SUM0_SUS0_SKXCCM8_VWA2_VWB8_WGM1_WGMXCC1_WGMXCCGn1
    SolutionIndex: 1
    SolutionNameMin: Cijk_Alik_Bjlk_I8II_BH_UserArgs_MT256x256x32_MI16x16x1_SN_CLR0_GSU0_GSUC0_GSUWGMRR0_K1_LBSPPA128_LBSPPB2048_LPB64_MIWT8_8_PLR0_SU0_SUM0_SUS0_SKXCCM8_VWA4_VWB4_WGM8_WGMXCC1_WGMXCCGn1
    SolutionIndex: 2
    SolutionNameMin: Cijk_Alik_Bjlk_I8II_BH_UserArgs_MT64x128x32_MI16x16x1_SN_CLR0_GSU0_GSUC0_GSUWGMRR0_K1_LBSPPA128_LBSPPB1024_LPB64_MIWT2_4_PLR0_SU0_SUM0_SUS0_SKXCCM8_VWA1_VWB4_WGM1_WGMXCC1_WGMXCCGn1
    SolutionIndex: 3
    SolutionNameMin: Cijk_Alik_Bjlk_I8II_BH_UserArgs_MT64x128x32_MI16x16x1_SN_CLR0_GSU0_GSUC0_GSUWGMRR0_K1_LBSPPA128_LBSPPB1024_LPB64_MIWT2_4_PLR0_SU0_SUM0_SUS0_SKXCCM8_VWA1_VWB4_WGM1_WGMXCC1_WGMXCCGn1
    SolutionIndex: 4
    SolutionNameMin: Cijk_Alik_Bjlk_I8II_BH_UserArgs_MT128x64x32_MI16x16x1_SN_CLR0_GSU0_GSUC0_GSUWGMRR0_K1_LBSPPA128_LBSPPB512_LPB32_MIWT4_2_PLR0_SU0_SUM0_SUS0_SKXCCM8_VWA4_VWB2_WGM1_WGMXCC1_WGMXCCGn1
    SolutionIndex: 5
    SolutionNameMin: Cijk_Alik_Bjlk_I8II_BH_UserArgs_MT256x256x64_MI16x16x1_SN_CLR1_GSU0_GSUC0_GSUWGMRR0_K1_LBSPPA256_LBSPPB2048_LPB64_MIWT8_8_PLR1_SU0_SUM0_SUS0_SKXCCM8_VWA4_VWB4_WGM1_WGMXCC1_WGMXCCGn1
    SolutionIndex: 6
    SolutionNameMin: Cijk_Alik_Bjlk_I8II_BH_UserArgs_MT256x256x64_MI16x16x1_SN_CLR1_GSU0_GSUC0_GSUWGMRR0_K1_LBSPPA256_LBSPPB2048_LPB0_MIWT8_8_PLR1_SU0_SUM0_SUS0_SKXCCM8_VWA4_VWB8_WGM1_WGMXCC1_WGMXCCGn1
    SolutionIndex: 7
    SolutionNameMin: Cijk_Alik_Bjlk_I8II_BH_UserArgs_MT256x256x64_MI16x16x1_SN_CLR1_GSU0_GSUC0_GSUWGMRR0_K1_LBSPPA256_LBSPPB2048_LPB64_MIWT8_8_PLR1_SU0_SUM0_SUS0_SKXCCM8_VWA4_VWB4_WGM1_WGMXCC1_WGMXCCGn1
    SolutionIndex: 8
    SolutionNameMin: Cijk_Alik_Bjlk_I8II_BH_UserArgs_MT256x256x64_MI16x16x1_SN_CLR1_GSU0_GSUC0_GSUWGMRR0_K1_LBSPPA256_LBSPPB2048_LPB0_MIWT8_8_PLR1_SU0_SUM0_SUS0_SKXCCM8_VWA4_VWB8_WGM1_WGMXCC1_WGMXCCGn1
    SolutionIndex: 9
    SolutionNameMin: Cijk_Alik_Bjlk_I8II_BH_UserArgs_MT256x256x64_MI16x16x1_SN_CLR1_GSU0_GSUC0_GSUWGMRR0_K1_LBSPPA128_LBSPPB2048_LPB0_MIWT8_8_PLR1_SU0_SUM0_SUS0_SKXCCM8_VWA2_VWB8_WGM1_WGMXCC1_WGMXCCGn1
    SolutionIndex: 10
    SolutionNameMin: Cijk_Alik_Bjlk_I8II_BH_UserArgs_MT256x256x64_MI16x16x1_SN_CLR1_GSU0_GSUC0_GSUWGMRR0_K1_LBSPPA256_LBSPPB2048_LPB0_MIWT8_8_PLR1_SU0_SUM0_SUS0_SKXCCM8_VWA4_VWB8_WGM1_WGMXCC1_WGMXCCGn1
    SolutionIndex: 11
    SolutionNameMin: Cijk_Alik_Bjlk_I8II_BH_UserArgs_MT256x256x64_MI16x16x1_SN_CLR1_GSU0_GSUC0_GSUWGMRR0_K1_LBSPPA256_LBSPPB2048_LPB0_MIWT8_8_PLR1_SU0_SUM0_SUS0_SKXCCM8_VWA4_VWB8_WGM1_WGMXCC1_WGMXCCGn1
    SolutionIndex: 12
    SolutionNameMin: Cijk_Alik_Bjlk_I8II_BH_UserArgs_MT256x256x64_MI16x16x1_SN_CLR1_GSU0_GSUC0_GSUWGMRR0_K1_LBSPPA256_LBSPPB2048_LPB64_MIWT8_8_PLR1_SU0_SUM0_SUS0_SKXCCM8_VWA4_VWB4_WGM4_WGMXCC1_WGMXCCGn1
    SolutionIndex: 13
    SolutionNameMin: Cijk_Alik_Bjlk_I8II_BH_UserArgs_MT256x256x64_MI16x16x1_SN_CLR1_GSU0_GSUC0_GSUWGMRR0_K1_LBSPPA128_LBSPPB2048_LPB0_MIWT8_8_PLR1_SU0_SUM0_SUS0_SKXCCM8_VWA2_VWB8_WGM4_WGMXCC1_WGMXCCGn1
    SolutionIndex: 14
    SolutionNameMin: Cijk_Alik_Bjlk_I8II_BH_UserArgs_MT256x256x64_MI16x16x1_SN_CLR1_GSU0_GSUC0_GSUWGMRR0_K1_LBSPPA256_LBSPPB2048_LPB0_MIWT8_8_PLR1_SU0_SUM0_SUS0_SKXCCM8_VWA4_VWB8_WGM4_WGMXCC1_WGMXCCGn1
    SolutionIndex: 15
    SolutionNameMin: Cijk_Alik_Bjlk_I8II_BH_UserArgs_MT256x256x64_MI16x16x1_SN_CLR1_GSU0_GSUC0_GSUWGMRR0_K1_LBSPPA256_LBSPPB2048_LPB64_MIWT8_8_PLR1_SU0_SUM0_SUS0_SKXCCM8_VWA4_VWB4_WGM4_WGMXCC1_WGMXCCGn1
    SolutionIndex: 16
    SolutionNameMin: Cijk_Alik_Bjlk_I8II_BH_UserArgs_MT256x256x64_MI16x16x1_SN_CLR1_GSU0_GSUC0_GSUWGMRR0_K1_LBSPPA128_LBSPPB2048_LPB0_MIWT8_8_PLR1_SU0_SUM0_SUS0_SKXCCM8_VWA2_VWB8_WGM4_WGMXCC1_WGMXCCGn1
    SolutionIndex: 17
    SolutionNameMin: Cijk_Alik_Bjlk_I8II_BH_UserArgs_MT256x256x64_MI16x16x1_SN_CLR1_GSU0_GSUC0_GSUWGMRR0_K1_LBSPPA256_LBSPPB2048_LPB0_MIWT8_8_PLR1_SU0_SUM0_SUS0_SKXCCM8_VWA4_VWB8_WGM4_WGMXCC1_WGMXCCGn1
    SolutionIndex: 18
    SolutionNameMin: Cijk_Alik_Bjlk_I8II_BH_UserArgs_MT256x256x64_MI16x16x1_SN_CLR1_GSU0_GSUC0_GSUWGMRR0_K1_LBSPPA128_LBSPPB2048_LPB0_MIWT8_8_PLR1_SU0_SUM0_SUS0_SKXCCM8_VWA2_VWB8_WGM4_WGMXCC1_WGMXCCGn1
    SolutionIndex: 19
    SolutionNameMin: Cijk_Alik_Bjlk_I8II_BH_UserArgs_MT256x256x64_MI16x16x1_SN_CLR1_GSU0_GSUC0_GSUWGMRR0_K1_LBSPPA256_LBSPPB2048_LPB0_MIWT8_8_PLR1_SU0_SUM0_SUS0_SKXCCM8_VWA4_VWB8_WGM4_WGMXCC1_WGMXCCGn1
    SolutionIndex: 20
    SolutionNameMin: Cijk_Alik_Bjlk_I8II_BH_UserArgs_MT256x256x64_MI16x16x1_SN_CLR1_GSU0_GSUC0_GSUWGMRR0_K1_LBSPPA256_LBSPPB2048_LPB64_MIWT8_8_PLR1_SU0_SUM0_SUS0_SKXCCM8_VWA4_VWB4_WGM8_WGMXCC1_WGMXCCGn1
    SolutionIndex: 21
    SolutionNameMin: Cijk_Alik_Bjlk_I8II_BH_UserArgs_MT256x256x64_MI16x16x1_SN_CLR1_GSU0_GSUC0_GSUWGMRR0_K1_LBSPPA256_LBSPPB2048_LPB64_MIWT8_8_PLR1_SU0_SUM0_SUS0_SKXCCM8_VWA4_VWB4_WGM8_WGMXCC1_WGMXCCGn1
    SolutionIndex: 22
    SolutionNameMin: Cijk_Alik_Bjlk_I8II_BH_UserArgs_MT256x256x64_MI16x16x1_SN_CLR1_GSU0_GSUC0_GSUWGMRR0_K1_LBSPPA256_LBSPPB2048_LPB0_MIWT8_8_PLR1_SU0_SUM0_SUS0_SKXCCM8_VWA4_VWB8_WGM8_WGMXCC1_WGMXCCGn1
    SolutionIndex: 23
    SolutionNameMin: Cijk_Alik_Bjlk_I8II_BH_UserArgs_MT256x256x64_MI16x16x1_SN_CLR1_GSU0_GSUC0_GSUWGMRR0_K1_LBSPPA256_LBSPPB2048_LPB64_MIWT8_8_PLR1_SU0_SUM0_SUS0_SKXCCM8_VWA4_VWB4_WGM8_WGMXCC1_WGMXCCGn1
    SolutionIndex: 24
    SolutionNameMin: Cijk_Alik_Bjlk_I8II_BH_UserArgs_MT256x256x64_MI16x16x1_SN_CLR1_GSU0_GSUC0_GSUWGMRR0_K1_LBSPPA256_LBSPPB2048_LPB0_MIWT8_8_PLR1_SU0_SUM0_SUS0_SKXCCM8_VWA4_VWB8_WGM8_WGMXCC1_WGMXCCGn1
    SolutionIndex: 25
    SolutionNameMin: Cijk_Alik_Bjlk_I8II_BH_UserArgs_MT128x256x64_MI16x16x1_SN_CLR1_GSU0_GSUC0_GSUWGMRR0_K1_LBSPPA128_LBSPPB2048_LPB0_MIWT4_8_PLR1_SU0_SUM0_SUS0_SKXCCM8_VWA1_VWB8_WGM1_WGMXCC1_WGMXCCGn1
    SolutionIndex: 26
    SolutionNameMin: Cijk_Alik_Bjlk_I8II_BH_UserArgs_MT128x256x64_MI16x16x1_SN_CLR1_GSU0_GSUC0_GSUWGMRR0_K1_LBSPPA256_LBSPPB2048_LPB0_MIWT4_8_PLR1_SU0_SUM0_SUS0_SKXCCM8_VWA4_VWB8_WGM1_WGMXCC1_WGMXCCGn1
    SolutionIndex: 27
    SolutionNameMin: Cijk_Alik_Bjlk_I8II_BH_UserArgs_MT256x128x64_MI16x16x1_SN_CLR1_GSU0_GSUC0_GSUWGMRR0_K1_LBSPPA128_LBSPPB1024_LPB32_MIWT8_4_PLR1_SU0_SUM0_SUS0_SKXCCM8_VWA1_VWB2_WGM4_WGMXCC1_WGMXCCGn1
    SolutionIndex: 28
    SolutionNameMin: Cijk_Alik_Bjlk_I8II_BH_UserArgs_MT256x128x64_MI16x16x1_SN_CLR1_GSU0_GSUC0_GSUWGMRR0_K1_LBSPPA128_LBSPPB1024_LPB64_MIWT8_4_PLR1_SU0_SUM0_SUS0_SKXCCM8_VWA2_VWB4_WGM4_WGMXCC1_WGMXCCGn1
    SolutionIndex: 29
    SolutionNameMin: Cijk_Alik_Bjlk_I8II_BH_UserArgs_MT256x128x64_MI16x16x1_SN_CLR1_GSU0_GSUC0_GSUWGMRR0_K1_LBSPPA256_LBSPPB1024_LPB64_MIWT8_4_PLR1_SU0_SUM0_SUS0_SKXCCM8_VWA4_VWB4_WGM4_WGMXCC1_WGMXCCGn1
    SolutionIndex: 30
    SolutionNameMin: Cijk_Alik_Bjlk_I8II_BH_UserArgs_MT256x128x64_MI16x16x1_SN_CLR1_GSU0_GSUC0_GSUWGMRR0_K1_LBSPPA256_LBSPPB1024_LPB64_MIWT8_4_PLR1_SU0_SUM0_SUS0_SKXCCM8_VWA4_VWB4_WGM8_WGMXCC1_WGMXCCGn1
    SolutionIndex: 31
    SolutionNameMin: Cijk_Alik_Bjlk_I8II_BH_UserArgs_MT128x128x64_MI16x16x1_SN_CLR1_GSU0_GSUC0_GSUWGMRR0_K1_LBSPPA256_LBSPPB1024_LPB32_MIWT4_4_PLR1_SU0_SUM0_SUS0_SKXCCM8_VWA4_VWB2_WGM1_WGMXCC1_WGMXCCGn1
    SolutionIndex: 32
    SolutionNameMin: Cijk_Alik_Bjlk_I8II_BH_UserArgs_MT128x128x64_MI16x16x1_SN_CLR1_GSU0_GSUC0_GSUWGMRR0_K1_LBSPPA256_LBSPPB1024_LPB32_MIWT4_4_PLR1_SU0_SUM0_SUS0_SKXCCM8_VWA4_VWB2_WGM1_WGMXCC1_WGMXCCGn1
    SolutionIndex: 33
    SolutionNameMin: Cijk_Alik_Bjlk_I8II_BH_UserArgs_MT128x128x64_MI16x16x1_SN_CLR1_GSU0_GSUC0_GSUWGMRR0_K1_LBSPPA256_LBSPPB1024_LPB64_MIWT4_4_PLR1_SU0_SUM0_SUS0_SKXCCM8_VWA4_VWB4_WGM1_WGMXCC1_WGMXCCGn1
    SolutionIndex: 34
    SolutionNameMin: Cijk_Alik_Bjlk_I8II_BH_UserArgs_MT128x128x64_MI16x16x1_SN_CLR1_GSU0_GSUC0_GSUWGMRR0_K1_LBSPPA256_LBSPPB1024_LPB64_MIWT4_4_PLR1_SU0_SUM0_SUS0_SKXCCM8_VWA4_VWB4_WGM4_WGMXCC1_WGMXCCGn1
    SolutionIndex: 35
    SolutionNameMin: Cijk_Alik_Bjlk_I8II_BH_UserArgs_MT128x128x64_MI16x16x1_SN_CLR1_GSU0_GSUC0_GSUWGMRR0_K1_LBSPPA256_LBSPPB1024_LPB32_MIWT4_4_PLR1_SU0_SUM0_SUS0_SKXCCM8_VWA4_VWB2_WGM8_WGMXCC1_WGMXCCGn1
    SolutionIndex: 36
    SolutionNameMin: Cijk_Alik_Bjlk_I8II_BH_UserArgs_MT128x128x64_MI16x16x1_SN_CLR1_GSU0_GSUC0_GSUWGMRR0_K1_LBSPPA256_LBSPPB1024_LPB64_MIWT4_4_PLR1_SU0_SUM0_SUS0_SKXCCM8_VWA4_VWB4_WGM8_WGMXCC1_WGMXCCGn1
    SolutionIndex: 37
    SolutionNameMin: Cijk_Alik_Bjlk_I8II_BH_UserArgs_MT128x128x64_MI16x16x1_SN_CLR1_GSU0_GSUC0_GSUWGMRR0_K1_LBSPPA256_LBSPPB1024_LPB64_MIWT4_4_PLR1_SU0_SUM0_SUS0_SKXCCM8_VWA4_VWB4_WGM8_WGMXCC1_WGMXCCGn1
    SolutionIndex: 38
    SolutionNameMin: Cijk_Alik_Bjlk_I8II_BH_UserArgs_MT64x128x64_MI16x16x1_SN_CLR1_GSU0_GSUC0_GSUWGMRR0_K1_LBSPPA128_LBSPPB1024_LPB64_MIWT2_4_PLR1_SU0_SUM0_SUS0_SKXCCM8_VWA1_VWB4_WGM1_WGMXCC1_WGMXCCGn1
    SolutionIndex: 39
    SolutionNameMin: Cijk_Alik_Bjlk_I8II_BH_UserArgs_MT64x128x64_MI16x16x1_SN_CLR1_GSU0_GSUC0_GSUWGMRR0_K1_LBSPPA128_LBSPPB1024_LPB64_MIWT2_4_PLR1_SU0_SUM0_SUS0_SKXCCM8_VWA1_VWB4_WGM1_WGMXCC1_WGMXCCGn1
    SolutionIndex: 40
    SolutionNameMin: Cijk_Alik_Bjlk_I8II_BH_UserArgs_MT128x64x64_MI16x16x1_SN_CLR1_GSU0_GSUC0_GSUWGMRR0_K1_LBSPPA256_LBSPPB512_LPB32_MIWT4_2_PLR1_SU0_SUM0_SUS0_SKXCCM8_VWA4_VWB2_WGM1_WGMXCC1_WGMXCCGn1
    SolutionIndex: 41
    SolutionNameMin: Cijk_Alik_Bjlk_I8II_BH_UserArgs_MT128x64x64_MI16x16x1_SN_CLR1_GSU0_GSUC0_GSUWGMRR0_K1_LBSPPA256_LBSPPB512_LPB32_MIWT4_2_PLR1_SU0_SUM0_SUS0_SKXCCM8_VWA4_VWB2_WGM1_WGMXCC1_WGMXCCGn1
    SolutionIndex: 42
    SolutionNameMin: Cijk_Alik_Bjlk_I8II_BH_UserArgs_MT128x64x64_MI16x16x1_SN_CLR1_GSU0_GSUC0_GSUWGMRR0_K1_LBSPPA256_LBSPPB512_LPB32_MIWT4_2_PLR1_SU0_SUM0_SUS0_SKXCCM8_VWA4_VWB2_WGM1_WGMXCC1_WGMXCCGn1
    SolutionIndex: 43
    SolutionNameMin: Cijk_Alik_Bjlk_I8II_BH_UserArgs_MT128x64x64_MI16x16x1_SN_CLR1_GSU0_GSUC0_GSUWGMRR0_K1_LBSPPA256_LBSPPB512_LPB32_MIWT4_2_PLR1_SU0_SUM0_SUS0_SKXCCM8_VWA4_VWB2_WGM8_WGMXCC1_WGMXCCGn1
    SolutionIndex: 44
    SolutionNameMin: Cijk_Alik_Bjlk_I8II_BH_UserArgs_MT128x64x64_MI16x16x1_SN_CLR1_GSU0_GSUC0_GSUWGMRR0_K1_LBSPPA128_LBSPPB512_LPB32_MIWT4_2_PLR1_SU0_SUM0_SUS0_SKXCCM8_VWA1_VWB2_WGM8_WGMXCC1_WGMXCCGn1
    SolutionIndex: 45
    SolutionNameMin: Cijk_Alik_Bjlk_I8II_BH_UserArgs_MT128x64x64_MI16x16x1_SN_CLR1_GSU0_GSUC0_GSUWGMRR0_K1_LBSPPA128_LBSPPB512_LPB32_MIWT4_2_PLR1_SU0_SUM0_SUS0_SKXCCM8_VWA1_VWB2_WGM8_WGMXCC1_WGMXCCGn1
    SolutionIndex: 46
    SolutionNameMin: Cijk_Alik_Bjlk_I8II_BH_UserArgs_MT128x64x64_MI16x16x1_SN_CLR1_GSU0_GSUC0_GSUWGMRR0_K1_LBSPPA256_LBSPPB512_LPB32_MIWT4_2_PLR1_SU0_SUM0_SUS0_SKXCCM8_VWA4_VWB2_WGM8_WGMXCC1_WGMXCCGn1
    SolutionIndex: 47
    SolutionNameMin: Cijk_Alik_Bjlk_I8II_BH_UserArgs_MT128x32x64_MI16x16x1_SN_CLR1_GSU0_GSUC0_GSUWGMRR0_K1_LBSPPA256_LBSPPB256_LPB16_MIWT4_1_PLR1_SU0_SUM0_SUS0_SKXCCM8_VWA4_VWB1_WGM1_WGMXCC1_WGMXCCGn1
    SolutionIndex: 48
    SolutionNameMin: Cijk_Alik_Bjlk_I8II_BH_UserArgs_MT64x64x64_MI16x16x1_SN_CLR1_GSU0_GSUC0_GSUWGMRR0_K1_LBSPPA128_LBSPPB512_LPB32_MIWT2_2_PLR1_SU0_SUM0_SUS0_SKXCCM8_VWA1_VWB2_WGM1_WGMXCC1_WGMXCCGn1
    SolutionIndex: 49
    SolutionNameMin: Cijk_Alik_Bjlk_I8II_BH_UserArgs_MT64x64x64_MI16x16x1_SN_CLR1_GSU0_GSUC0_GSUWGMRR0_K1_LBSPPA128_LBSPPB512_LPB32_MIWT2_2_PLR1_SU0_SUM0_SUS0_SKXCCM8_VWA1_VWB2_WGM1_WGMXCC1_WGMXCCGn1
    SolutionIndex: 50
    SolutionNameMin: Cijk_Alik_Bjlk_I8II_BH_UserArgs_MT64x64x64_MI16x16x1_SN_CLR0_GSU0_GSUC0_GSUWGMRR0_K1_LBSPPA128_LBSPPB512_LPB32_MIWT2_2_PLR0_SU0_SUM0_SUS0_SKXCCM8_VWA1_VWB2_WGM1_WGMXCC1_WGMXCCGn1
    SolutionIndex: 51
    SolutionNameMin: Cijk_Alik_Bjlk_I8II_BH_UserArgs_MT64x64x64_MI16x16x1_SN_CLR1_GSU0_GSUC0_GSUWGMRR0_K1_LBSPPA128_LBSPPB512_LPB32_MIWT2_2_PLR1_SU0_SUM0_SUS0_SKXCCM8_VWA1_VWB2_WGM4_WGMXCC1_WGMXCCGn1
    SolutionIndex: 52
    SolutionNameMin: Cijk_Alik_Bjlk_I8II_BH_UserArgs_MT64x64x64_MI16x16x1_SN_CLR1_GSU0_GSUC0_GSUWGMRR0_K1_LBSPPA128_LBSPPB512_LPB32_MIWT2_2_PLR1_SU0_SUM0_SUS0_SKXCCM8_VWA1_VWB2_WGM8_WGMXCC1_WGMXCCGn1
    SolutionIndex: 53
    SolutionNameMin: Cijk_Alik_Bjlk_I8II_BH_UserArgs_MT64x64x64_MI16x16x1_SN_CLR1_GSU0_GSUC0_GSUWGMRR0_K1_LBSPPA128_LBSPPB512_LPB32_MIWT2_2_PLR1_SU0_SUM0_SUS0_SKXCCM8_VWA1_VWB2_WGM8_WGMXCC1_WGMXCCGn1
    SolutionIndex: 54
    SolutionNameMin: Cijk_Alik_Bjlk_I8II_BH_UserArgs_MT32x64x64_MI16x16x1_SN_CLR1_GSU0_GSUC0_GSUWGMRR0_K1_LBSPPA128_LBSPPB512_LPB32_MIWT1_2_PLR1_SU0_SUM0_SUS0_SKXCCM8_VWA1_VWB2_WGM1_WGMXCC1_WGMXCCGn1
    SolutionIndex: 55
    SolutionNameMin: Cijk_Alik_Bjlk_I8II_BH_UserArgs_MT32x64x64_MI16x16x1_SN_CLR1_GSU0_GSUC0_GSUWGMRR0_K1_LBSPPA128_LBSPPB512_LPB32_MIWT1_2_PLR1_SU0_SUM0_SUS0_SKXCCM8_VWA1_VWB2_WGM1_WGMXCC1_WGMXCCGn1
    SolutionIndex: 56
    SolutionNameMin: Cijk_Alik_Bjlk_I8II_BH_UserArgs_MT64x32x64_MI16x16x1_SN_CLR1_GSU0_GSUC0_GSUWGMRR0_K1_LBSPPA128_LBSPPB256_LPB16_MIWT2_1_PLR1_SU0_SUM0_SUS0_SKXCCM8_VWA1_VWB1_WGM1_WGMXCC1_WGMXCCGn1
    SolutionIndex: 57
    SolutionNameMin: Cijk_Alik_Bjlk_I8II_BH_UserArgs_MT64x32x64_MI16x16x1_SN_CLR1_GSU0_GSUC0_GSUWGMRR0_K1_LBSPPA128_LBSPPB256_LPB16_MIWT2_1_PLR1_SU0_SUM0_SUS0_SKXCCM8_VWA1_VWB1_WGM1_WGMXCC1_WGMXCCGn1
    SolutionIndex: 58
    SolutionNameMin: Cijk_Alik_Bjlk_I8II_BH_UserArgs_MT64x32x64_MI16x16x1_SN_CLR1_GSU0_GSUC0_GSUWGMRR0_K1_LBSPPA128_LBSPPB256_LPB16_MIWT2_1_PLR1_SU0_SUM0_SUS0_SKXCCM8_VWA1_VWB1_WGM1_WGMXCC1_WGMXCCGn1
    SolutionIndex: 59
    SolutionNameMin: Cijk_Alik_Bjlk_I8II_BH_UserArgs_MT64x32x64_MI16x16x1_SN_CLR0_GSU0_GSUC0_GSUWGMRR0_K1_LBSPPA128_LBSPPB256_LPB16_MIWT2_1_PLR0_SU0_SUM0_SUS0_SKXCCM8_VWA1_VWB1_WGM1_WGMXCC1_WGMXCCGn1
    SolutionIndex: 60
    SolutionNameMin: Cijk_Alik_Bjlk_I8II_BH_UserArgs_MT64x32x64_MI16x16x1_SN_CLR0_GSU0_GSUC0_GSUWGMRR0_K1_LBSPPA128_LBSPPB256_LPB16_MIWT2_1_PLR0_SU0_SUM0_SUS0_SKXCCM8_VWA1_VWB1_WGM1_WGMXCC1_WGMXCCGn1
    SolutionIndex: 61
    SolutionNameMin: Cijk_Alik_Bjlk_I8II_BH_UserArgs_MT32x32x64_MI16x16x1_SN_CLR1_GSU0_GSUC0_GSUWGMRR0_K1_LBSPPA128_LBSPPB256_LPB16_MIWT1_1_PLR1_SU0_SUM0_SUS0_SKXCCM8_VWA1_VWB1_WGM1_WGMXCC1_WGMXCCGn1
    SolutionIndex: 62
    SolutionNameMin: Cijk_Alik_Bjlk_I8II_BH_UserArgs_MT32x32x64_MI16x16x1_SN_CLR1_GSU0_GSUC0_GSUWGMRR0_K1_LBSPPA128_LBSPPB256_LPB16_MIWT1_1_PLR1_SU0_SUM0_SUS0_SKXCCM8_VWA1_VWB1_WGM1_WGMXCC1_WGMXCCGn1
    SolutionIndex: 63
    SolutionNameMin: Cijk_Alik_Bjlk_I8II_BH_UserArgs_MT32x32x64_MI16x16x1_SN_CLR1_GSU0_GSUC0_GSUWGMRR0_K1_LBSPPA128_LBSPPB256_LPB16_MIWT1_1_PLR1_SU0_SUM0_SUS0_SKXCCM8_VWA1_VWB1_WGM1_WGMXCC1_WGMXCCGn1
    SolutionIndex: 64
    SolutionNameMin: Cijk_Alik_Bjlk_I8II_BH_UserArgs_MT32x32x64_MI16x16x1_SN_CLR1_GSU0_GSUC0_GSUWGMRR0_K1_LBSPPA128_LBSPPB256_LPB16_MIWT1_1_PLR1_SU0_SUM0_SUS0_SKXCCM8_VWA1_VWB1_WGM1_WGMXCC1_WGMXCCGn1
    SolutionIndex: 65
    SolutionNameMin: Cijk_Alik_Bjlk_I8II_BH_UserArgs_MT32x32x64_MI16x16x1_SN_CLR1_GSU0_GSUC0_GSUWGMRR0_K1_LBSPPA128_LBSPPB256_LPB16_MIWT1_1_PLR1_SU0_SUM0_SUS0_SKXCCM8_VWA1_VWB1_WGM1_WGMXCC1_WGMXCCGn1
    SolutionIndex: 66
    SolutionNameMin: Cijk_Alik_Bjlk_I8II_BH_UserArgs_MT32x32x64_MI16x16x1_SN_CLR1_GSU0_GSUC0_GSUWGMRR0_K1_LBSPPA128_LBSPPB256_LPB16_MIWT1_1_PLR1_SU0_SUM0_SUS0_SKXCCM8_VWA1_VWB1_WGM1_WGMXCC1_WGMXCCGn1
    SolutionIndex: 67
    SolutionNameMin: Cijk_Alik_Bjlk_I8II_BH_UserArgs_MT32x32x64_MI16x16x1_SN_CLR0_GSU0_GSUC0_GSUWGMRR0_K1_LBSPPA128_LBSPPB256_LPB16_MIWT1_1_PLR0_SU0_SUM0_SUS0_SKXCCM8_VWA1_VWB1_WGM1_WGMXCC1_WGMXCCGn1
    SolutionIndex: 68
    SolutionNameMin: Cijk_Alik_Bjlk_I8II_BH_UserArgs_MT32x32x64_MI16x16x1_SN_CLR0_GSU0_GSUC0_GSUWGMRR0_K1_LBSPPA128_LBSPPB256_LPB16_MIWT1_1_PLR0_SU0_SUM0_SUS0_SKXCCM8_VWA1_VWB1_WGM1_WGMXCC1_WGMXCCGn1
    SolutionIndex: 69
    SolutionNameMin: Cijk_Alik_Bjlk_I8II_BH_UserArgs_MT32x32x64_MI16x16x1_SN_CLR0_GSU0_GSUC0_GSUWGMRR0_K1_LBSPPA128_LBSPPB256_LPB16_MIWT1_1_PLR0_SU0_SUM0_SUS0_SKXCCM8_VWA1_VWB1_WGM1_WGMXCC1_WGMXCCGn1
    SolutionIndex: 70
    SolutionNameMin: Cijk_Alik_Bjlk_I8II_BH_UserArgs_MT32x32x64_MI16x16x1_SN_CLR0_GSU0_GSUC0_GSUWGMRR0_K1_LBSPPA128_LBSPPB256_LPB16_MIWT1_1_PLR0_SU0_SUM0_SUS0_SKXCCM8_VWA1_VWB1_WGM1_WGMXCC1_WGMXCCGn1
    SolutionIndex: 71
    SolutionNameMin: Cijk_Alik_Bjlk_I8II_BH_UserArgs_MT32x32x64_MI16x16x1_SN_CLR0_GSU0_GSUC0_GSUWGMRR0_K1_LBSPPA128_LBSPPB256_LPB16_MIWT1_1_PLR0_SU0_SUM0_SUS0_SKXCCM8_VWA1_VWB1_WGM1_WGMXCC1_WGMXCCGn1
    SolutionIndex: 72
    SolutionNameMin: Cijk_Alik_Bjlk_I8II_BH_UserArgs_MT32x32x64_MI16x16x1_SN_CLR0_GSU0_GSUC0_GSUWGMRR0_K1_LBSPPA128_LBSPPB256_LPB16_MIWT1_1_PLR0_SU0_SUM0_SUS0_SKXCCM8_VWA1_VWB1_WGM4_WGMXCC1_WGMXCCGn1
    SolutionIndex: 73
    SolutionNameMin: Cijk_Alik_Bjlk_I8II_BH_UserArgs_MT32x32x64_MI16x16x1_SN_CLR0_GSU0_GSUC0_GSUWGMRR0_K1_LBSPPA128_LBSPPB256_LPB16_MIWT1_1_PLR0_SU0_SUM0_SUS0_SKXCCM8_VWA1_VWB1_WGM8_WGMXCC1_WGMXCCGn1
    SolutionIndex: 74
    SolutionNameMin: Cijk_Alik_Bjlk_I8II_BH_UserArgs_MT128x256x128_MI16x16x1_SN_CLR1_GSU0_GSUC0_GSUWGMRR0_K1_LBSPPA512_LBSPPB4096_LPB0_MIWT4_8_PLR1_SU0_SUM0_SUS0_SKXCCM8_VWA4_VWB8_WGM1_WGMXCC1_WGMXCCGn1
    SolutionIndex: 75
    SolutionNameMin: Cijk_Alik_Bjlk_I8II_BH_UserArgs_MT128x256x128_MI16x16x1_SN_CLR1_GSU0_GSUC0_GSUWGMRR0_K1_LBSPPA512_LBSPPB4096_LPB64_MIWT4_8_PLR1_SU0_SUM0_SUS0_SKXCCM8_VWA4_VWB4_WGM8_WGMXCC1_WGMXCCGn1
    SolutionIndex: 76
    SolutionNameMin: Cijk_Alik_Bjlk_I8II_BH_UserArgs_MT256x128x128_MI16x16x1_SN_CLR1_GSU0_GSUC0_GSUWGMRR0_K1_LBSPPA512_LBSPPB2048_LPB64_MIWT8_4_PLR1_SU0_SUM0_SUS0_SKXCCM8_VWA4_VWB4_WGM1_WGMXCC1_WGMXCCGn1
    SolutionIndex: 77
    SolutionNameMin: Cijk_Alik_Bjlk_I8II_BH_UserArgs_MT256x128x128_MI16x16x1_SN_CLR1_GSU0_GSUC0_GSUWGMRR0_K1_LBSPPA128_LBSPPB2048_LPB64_MIWT8_4_PLR1_SU0_SUM0_SUS0_SKXCCM8_VWA1_VWB4_WGM1_WGMXCC1_WGMXCCGn1
    SolutionIndex: 78
    SolutionNameMin: Cijk_Alik_Bjlk_I8II_BH_UserArgs_MT256x128x128_MI16x16x1_SN_CLR1_GSU0_GSUC0_GSUWGMRR0_K1_LBSPPA512_LBSPPB2048_LPB64_MIWT8_4_PLR1_SU0_SUM0_SUS0_SKXCCM8_VWA4_VWB4_WGM1_WGMXCC1_WGMXCCGn1
    SolutionIndex: 79
    SolutionNameMin: Cijk_Alik_Bjlk_I8II_BH_UserArgs_MT256x128x128_MI16x16x1_SN_CLR1_GSU0_GSUC0_GSUWGMRR0_K1_LBSPPA512_LBSPPB2048_LPB64_MIWT8_4_PLR1_SU0_SUM0_SUS0_SKXCCM8_VWA4_VWB4_WGM1_WGMXCC1_WGMXCCGn1
    SolutionIndex: 80
    SolutionNameMin: Cijk_Alik_Bjlk_I8II_BH_UserArgs_MT256x128x128_MI16x16x1_SN_CLR1_GSU0_GSUC0_GSUWGMRR0_K1_LBSPPA256_LBSPPB2048_LPB64_MIWT8_4_PLR2_SU0_SUM0_SUS0_SKXCCM8_VWA2_VWB4_WGM1_WGMXCC1_WGMXCCGn1
    SolutionIndex: 81
    SolutionNameMin: Cijk_Alik_Bjlk_I8II_BH_UserArgs_MT256x128x128_MI16x16x1_SN_CLR1_GSU0_GSUC0_GSUWGMRR0_K1_LBSPPA512_LBSPPB2048_LPB64_MIWT8_4_PLR1_SU0_SUM0_SUS0_SKXCCM8_VWA4_VWB4_WGM4_WGMXCC1_WGMXCCGn1
    SolutionIndex: 82
    SolutionNameMin: Cijk_Alik_Bjlk_I8II_BH_UserArgs_MT256x128x128_MI16x16x1_SN_CLR1_GSU0_GSUC0_GSUWGMRR0_K1_LBSPPA512_LBSPPB2048_LPB32_MIWT8_4_PLR1_SU0_SUM0_SUS0_SKXCCM8_VWA4_VWB2_WGM4_WGMXCC1_WGMXCCGn1
    SolutionIndex: 83
    SolutionNameMin: Cijk_Alik_Bjlk_I8II_BH_UserArgs_MT256x128x128_MI16x16x1_SN_CLR1_GSU0_GSUC0_GSUWGMRR0_K1_LBSPPA256_LBSPPB2048_LPB64_MIWT8_4_PLR1_SU0_SUM0_SUS0_SKXCCM8_VWA2_VWB4_WGM4_WGMXCC1_WGMXCCGn1
    SolutionIndex: 84
    SolutionNameMin: Cijk_Alik_Bjlk_I8II_BH_UserArgs_MT256x128x128_MI16x16x1_SN_CLR1_GSU0_GSUC0_GSUWGMRR0_K1_LBSPPA512_LBSPPB2048_LPB64_MIWT8_4_PLR1_SU0_SUM0_SUS0_SKXCCM8_VWA4_VWB4_WGM4_WGMXCC1_WGMXCCGn1
    SolutionIndex: 85
    SolutionNameMin: Cijk_Alik_Bjlk_I8II_BH_UserArgs_MT256x128x128_MI16x16x1_SN_CLR1_GSU0_GSUC0_GSUWGMRR0_K1_LBSPPA256_LBSPPB2048_LPB64_MIWT8_4_PLR2_SU0_SUM0_SUS0_SKXCCM8_VWA2_VWB4_WGM4_WGMXCC1_WGMXCCGn1
    SolutionIndex: 86
    SolutionNameMin: Cijk_Alik_Bjlk_I8II_BH_UserArgs_MT256x128x128_MI16x16x1_SN_CLR1_GSU0_GSUC0_GSUWGMRR0_K1_LBSPPA128_LBSPPB2048_LPB64_MIWT8_4_PLR1_SU0_SUM0_SUS0_SKXCCM8_VWA1_VWB4_WGM8_WGMXCC1_WGMXCCGn1
    SolutionIndex: 87
    SolutionNameMin: Cijk_Alik_Bjlk_I8II_BH_UserArgs_MT256x128x128_MI16x16x1_SN_CLR1_GSU0_GSUC0_GSUWGMRR0_K1_LBSPPA256_LBSPPB2048_LPB64_MIWT8_4_PLR1_SU0_SUM0_SUS0_SKXCCM8_VWA2_VWB4_WGM8_WGMXCC1_WGMXCCGn1
    SolutionIndex: 88
    SolutionNameMin: Cijk_Alik_Bjlk_I8II_BH_UserArgs_MT256x128x128_MI16x16x1_SN_CLR1_GSU0_GSUC0_GSUWGMRR0_K1_LBSPPA512_LBSPPB2048_LPB64_MIWT8_4_PLR1_SU0_SUM0_SUS0_SKXCCM8_VWA4_VWB4_WGM8_WGMXCC1_WGMXCCGn1
    SolutionIndex: 89
    SolutionNameMin: Cijk_Alik_Bjlk_I8II_BH_UserArgs_MT256x128x128_MI16x16x1_SN_CLR1_GSU0_GSUC0_GSUWGMRR0_K1_LBSPPA128_LBSPPB2048_LPB64_MIWT8_4_PLR1_SU0_SUM0_SUS0_SKXCCM8_VWA1_VWB4_WGM8_WGMXCC1_WGMXCCGn1
    SolutionIndex: 90
    SolutionNameMin: Cijk_Alik_Bjlk_I8II_BH_UserArgs_MT256x128x128_MI16x16x1_SN_CLR1_GSU0_GSUC0_GSUWGMRR0_K1_LBSPPA256_LBSPPB2048_LPB64_MIWT8_4_PLR1_SU0_SUM0_SUS0_SKXCCM8_VWA2_VWB4_WGM8_WGMXCC1_WGMXCCGn1
    SolutionIndex: 91
    SolutionNameMin: Cijk_Alik_Bjlk_I8II_BH_UserArgs_MT256x128x128_MI16x16x1_SN_CLR1_GSU0_GSUC0_GSUWGMRR0_K1_LBSPPA512_LBSPPB2048_LPB64_MIWT8_4_PLR1_SU0_SUM0_SUS0_SKXCCM8_VWA4_VWB4_WGM8_WGMXCC1_WGMXCCGn1
    SolutionIndex: 92
    SolutionNameMin: Cijk_Alik_Bjlk_I8II_BH_UserArgs_MT128x128x128_MI16x16x1_SN_CLR1_GSU0_GSUC0_GSUWGMRR0_K1_LBSPPA512_LBSPPB2048_LPB64_MIWT4_4_PLR1_SU0_SUM0_SUS0_SKXCCM8_VWA4_VWB4_WGM1_WGMXCC1_WGMXCCGn1
    SolutionIndex: 93
    SolutionNameMin: Cijk_Alik_Bjlk_I8II_BH_UserArgs_MT128x128x128_MI16x16x1_SN_CLR1_GSU0_GSUC0_GSUWGMRR0_K1_LBSPPA512_LBSPPB2048_LPB64_MIWT4_4_PLR1_SU0_SUM0_SUS0_SKXCCM8_VWA4_VWB4_WGM4_WGMXCC1_WGMXCCGn1
    SolutionIndex: 94
    SolutionNameMin: Cijk_Alik_Bjlk_I8II_BH_UserArgs_MT128x128x128_MI16x16x1_SN_CLR1_GSU0_GSUC0_GSUWGMRR0_K1_LBSPPA512_LBSPPB2048_LPB64_MIWT4_4_PLR1_SU0_SUM0_SUS0_SKXCCM8_VWA4_VWB4_WGM4_WGMXCC1_WGMXCCGn1
    SolutionIndex: 95
    SolutionNameMin: Cijk_Alik_Bjlk_I8II_BH_UserArgs_MT128x128x128_MI16x16x1_SN_CLR1_GSU0_GSUC0_GSUWGMRR0_K1_LBSPPA512_LBSPPB2048_LPB64_MIWT4_4_PLR1_SU0_SUM0_SUS0_SKXCCM8_VWA4_VWB4_WGM4_WGMXCC1_WGMXCCGn1
    SolutionIndex: 96
    SolutionNameMin: Cijk_Alik_Bjlk_I8II_BH_UserArgs_MT128x128x128_MI16x16x1_SN_CLR1_GSU0_GSUC0_GSUWGMRR0_K1_LBSPPA512_LBSPPB2048_LPB64_MIWT4_4_PLR2_SU0_SUM0_SUS0_SKXCCM8_VWA4_VWB4_WGM4_WGMXCC1_WGMXCCGn1
    SolutionIndex: 97
    SolutionNameMin: Cijk_Alik_Bjlk_I8II_BH_UserArgs_MT128x128x128_MI16x16x1_SN_CLR1_GSU0_GSUC0_GSUWGMRR0_K1_LBSPPA512_LBSPPB2048_LPB64_MIWT4_4_PLR1_SU0_SUM0_SUS0_SKXCCM8_VWA4_VWB4_WGM8_WGMXCC1_WGMXCCGn1
    SolutionIndex: 98
    SolutionNameMin: Cijk_Alik_Bjlk_I8II_BH_UserArgs_MT128x128x128_MI16x16x1_SN_CLR1_GSU0_GSUC0_GSUWGMRR0_K1_LBSPPA128_LBSPPB2048_LPB64_MIWT4_4_PLR1_SU0_SUM0_SUS0_SKXCCM8_VWA1_VWB4_WGM8_WGMXCC1_WGMXCCGn1
    SolutionIndex: 99
    SolutionNameMin: Cijk_Alik_Bjlk_I8II_BH_UserArgs_MT128x128x128_MI16x16x1_SN_CLR1_GSU0_GSUC0_GSUWGMRR0_K1_LBSPPA512_LBSPPB2048_LPB64_MIWT4_4_PLR1_SU0_SUM0_SUS0_SKXCCM8_VWA4_VWB4_WGM8_WGMXCC1_WGMXCCGn1
    SolutionIndex: 100
    SolutionNameMin: Cijk_Alik_Bjlk_I8II_BH_UserArgs_MT128x128x128_MI16x16x1_SN_CLR1_GSU0_GSUC0_GSUWGMRR0_K1_LBSPPA512_LBSPPB2048_LPB64_MIWT4_4_PLR1_SU0_SUM0_SUS0_SKXCCM8_VWA4_VWB4_WGM8_WGMXCC1_WGMXCCGn1
    SolutionIndex: 101
    SolutionNameMin: Cijk_Alik_Bjlk_I8II_BH_UserArgs_MT128x128x128_MI16x16x1_SN_CLR1_GSU0_GSUC0_GSUWGMRR0_K1_LBSPPA512_LBSPPB2048_LPB64_MIWT4_4_PLR1_SU0_SUM0_SUS0_SKXCCM8_VWA4_VWB4_WGM8_WGMXCC1_WGMXCCGn1
    SolutionIndex: 102
    SolutionNameMin: Cijk_Alik_Bjlk_I8II_BH_UserArgs_MT128x128x128_MI16x16x1_SN_CLR1_GSU0_GSUC0_GSUWGMRR0_K1_LBSPPA512_LBSPPB2048_LPB64_MIWT4_4_PLR2_SU0_SUM0_SUS0_SKXCCM8_VWA4_VWB4_WGM8_WGMXCC1_WGMXCCGn1
    SolutionIndex: 103
    SolutionNameMin: Cijk_Alik_Bjlk_I8II_BH_UserArgs_MT64x128x128_MI16x16x1_SN_CLR1_GSU0_GSUC0_GSUWGMRR0_K1_LBSPPA128_LBSPPB2048_LPB64_MIWT2_4_PLR1_SU0_SUM0_SUS0_SKXCCM8_VWA1_VWB4_WGM1_WGMXCC1_WGMXCCGn1
    SolutionIndex: 104
    SolutionNameMin: Cijk_Alik_Bjlk_I8II_BH_UserArgs_MT128x64x128_MI16x16x1_SN_CLR1_GSU0_GSUC0_GSUWGMRR0_K1_LBSPPA512_LBSPPB1024_LPB32_MIWT4_2_PLR1_SU0_SUM0_SUS0_SKXCCM8_VWA4_VWB2_WGM1_WGMXCC1_WGMXCCGn1
    SolutionIndex: 105
    SolutionNameMin: Cijk_Alik_Bjlk_I8II_BH_UserArgs_MT128x64x128_MI16x16x1_SN_CLR1_GSU0_GSUC0_GSUWGMRR0_K1_LBSPPA512_LBSPPB1024_LPB32_MIWT4_2_PLR1_SU0_SUM0_SUS0_SKXCCM8_VWA4_VWB2_WGM1_WGMXCC1_WGMXCCGn1
    SolutionIndex: 106
    SolutionNameMin: Cijk_Alik_Bjlk_I8II_BH_UserArgs_MT128x64x128_MI16x16x1_SN_CLR1_GSU0_GSUC0_GSUWGMRR0_K1_LBSPPA512_LBSPPB1024_LPB32_MIWT4_2_PLR2_SU0_SUM0_SUS0_SKXCCM8_VWA4_VWB2_WGM1_WGMXCC1_WGMXCCGn1
    SolutionIndex: 107
    SolutionNameMin: Cijk_Alik_Bjlk_I8II_BH_UserArgs_MT128x64x128_MI16x16x1_SN_CLR1_GSU0_GSUC0_GSUWGMRR0_K1_LBSPPA512_LBSPPB1024_LPB32_MIWT4_2_PLR2_SU0_SUM0_SUS0_SKXCCM8_VWA4_VWB2_WGM1_WGMXCC1_WGMXCCGn1
    SolutionIndex: 108
    SolutionNameMin: Cijk_Alik_Bjlk_I8II_BH_UserArgs_MT128x64x128_MI16x16x1_SN_CLR1_GSU0_GSUC0_GSUWGMRR0_K1_LBSPPA512_LBSPPB1024_LPB32_MIWT4_2_PLR2_SU0_SUM0_SUS0_SKXCCM8_VWA4_VWB2_WGM1_WGMXCC1_WGMXCCGn1
    SolutionIndex: 109
    SolutionNameMin: Cijk_Alik_Bjlk_I8II_BH_UserArgs_MT128x64x128_MI16x16x1_SN_CLR1_GSU0_GSUC0_GSUWGMRR0_K1_LBSPPA512_LBSPPB1024_LPB32_MIWT4_2_PLR1_SU0_SUM0_SUS0_SKXCCM8_VWA4_VWB2_WGM4_WGMXCC1_WGMXCCGn1
    SolutionIndex: 110
    SolutionNameMin: Cijk_Alik_Bjlk_I8II_BH_UserArgs_MT128x64x128_MI16x16x1_SN_CLR1_GSU0_GSUC0_GSUWGMRR0_K1_LBSPPA128_LBSPPB1024_LPB32_MIWT4_2_PLR1_SU0_SUM0_SUS0_SKXCCM8_VWA1_VWB2_WGM4_WGMXCC1_WGMXCCGn1
    SolutionIndex: 111
    SolutionNameMin: Cijk_Alik_Bjlk_I8II_BH_UserArgs_MT128x64x128_MI16x16x1_SN_CLR1_GSU0_GSUC0_GSUWGMRR0_K1_LBSPPA512_LBSPPB1024_LPB32_MIWT4_2_PLR1_SU0_SUM0_SUS0_SKXCCM8_VWA4_VWB2_WGM4_WGMXCC1_WGMXCCGn1
    SolutionIndex: 112
    SolutionNameMin: Cijk_Alik_Bjlk_I8II_BH_UserArgs_MT128x64x128_MI16x16x1_SN_CLR1_GSU0_GSUC0_GSUWGMRR0_K1_LBSPPA512_LBSPPB1024_LPB32_MIWT4_2_PLR2_SU0_SUM0_SUS0_SKXCCM8_VWA4_VWB2_WGM4_WGMXCC1_WGMXCCGn1
    SolutionIndex: 113
    SolutionNameMin: Cijk_Alik_Bjlk_I8II_BH_UserArgs_MT128x64x128_MI16x16x1_SN_CLR1_GSU0_GSUC0_GSUWGMRR0_K1_LBSPPA256_LBSPPB1024_LPB32_MIWT4_2_PLR1_SU0_SUM0_SUS0_SKXCCM8_VWA2_VWB2_WGM8_WGMXCC1_WGMXCCGn1
    SolutionIndex: 114
    SolutionNameMin: Cijk_Alik_Bjlk_I8II_BH_UserArgs_MT128x64x128_MI16x16x1_SN_CLR1_GSU0_GSUC0_GSUWGMRR0_K1_LBSPPA128_LBSPPB1024_LPB32_MIWT4_2_PLR1_SU0_SUM0_SUS0_SKXCCM8_VWA1_VWB2_WGM8_WGMXCC1_WGMXCCGn1
    SolutionIndex: 115
    SolutionNameMin: Cijk_Alik_Bjlk_I8II_BH_UserArgs_MT128x64x128_MI16x16x1_SN_CLR1_GSU0_GSUC0_GSUWGMRR0_K1_LBSPPA256_LBSPPB1024_LPB32_MIWT4_2_PLR1_SU0_SUM0_SUS0_SKXCCM8_VWA2_VWB2_WGM8_WGMXCC1_WGMXCCGn1
    SolutionIndex: 116
    SolutionNameMin: Cijk_Alik_Bjlk_I8II_BH_UserArgs_MT128x64x128_MI16x16x1_SN_CLR1_GSU0_GSUC0_GSUWGMRR0_K1_LBSPPA512_LBSPPB1024_LPB32_MIWT4_2_PLR1_SU0_SUM0_SUS0_SKXCCM8_VWA4_VWB2_WGM8_WGMXCC1_WGMXCCGn1
    SolutionIndex: 117
    SolutionNameMin: Cijk_Alik_Bjlk_I8II_BH_UserArgs_MT128x64x128_MI16x16x1_SN_CLR1_GSU0_GSUC0_GSUWGMRR0_K1_LBSPPA512_LBSPPB1024_LPB32_MIWT4_2_PLR2_SU0_SUM0_SUS0_SKXCCM8_VWA4_VWB2_WGM8_WGMXCC1_WGMXCCGn1
    SolutionIndex: 118
    SolutionNameMin: Cijk_Alik_Bjlk_I8II_BH_UserArgs_MT64x64x128_MI16x16x1_SN_CLR1_GSU0_GSUC0_GSUWGMRR0_K1_LBSPPA128_LBSPPB1024_LPB32_MIWT2_2_PLR1_SU0_SUM0_SUS0_SKXCCM8_VWA1_VWB2_WGM1_WGMXCC1_WGMXCCGn1
    SolutionIndex: 119
    SolutionNameMin: Cijk_Alik_Bjlk_I8II_BH_UserArgs_MT64x64x128_MI16x16x1_SN_CLR1_GSU0_GSUC0_GSUWGMRR0_K1_LBSPPA256_LBSPPB1024_LPB32_MIWT2_2_PLR1_SU0_SUM0_SUS0_SKXCCM8_VWA2_VWB2_WGM1_WGMXCC1_WGMXCCGn1
    SolutionIndex: 120
    SolutionNameMin: Cijk_Alik_Bjlk_I8II_BH_UserArgs_MT64x64x128_MI16x16x1_SN_CLR1_GSU0_GSUC0_GSUWGMRR0_K1_LBSPPA128_LBSPPB1024_LPB32_MIWT2_2_PLR1_SU0_SUM0_SUS0_SKXCCM8_VWA1_VWB2_WGM1_WGMXCC1_WGMXCCGn1
    SolutionIndex: 121
    SolutionNameMin: Cijk_Alik_Bjlk_I8II_BH_UserArgs_MT64x64x128_MI16x16x1_SN_CLR1_GSU0_GSUC0_GSUWGMRR0_K1_LBSPPA128_LBSPPB1024_LPB32_MIWT2_2_PLR1_SU0_SUM0_SUS0_SKXCCM8_VWA1_VWB2_WGM1_WGMXCC1_WGMXCCGn1
    SolutionIndex: 122
    SolutionNameMin: Cijk_Alik_Bjlk_I8II_BH_UserArgs_MT64x64x128_MI16x16x1_SN_CLR1_GSU0_GSUC0_GSUWGMRR0_K1_LBSPPA256_LBSPPB1024_LPB32_MIWT2_2_PLR1_SU0_SUM0_SUS0_SKXCCM8_VWA2_VWB2_WGM1_WGMXCC1_WGMXCCGn1
    SolutionIndex: 123
    SolutionNameMin: Cijk_Alik_Bjlk_I8II_BH_UserArgs_MT64x64x128_MI16x16x1_SN_CLR1_GSU0_GSUC0_GSUWGMRR0_K1_LBSPPA128_LBSPPB1024_LPB32_MIWT2_2_PLR1_SU0_SUM0_SUS0_SKXCCM8_VWA1_VWB2_WGM4_WGMXCC1_WGMXCCGn1
    SolutionIndex: 124
    SolutionNameMin: Cijk_Alik_Bjlk_I8II_BH_UserArgs_MT64x64x128_MI16x16x1_SN_CLR1_GSU0_GSUC0_GSUWGMRR0_K1_LBSPPA128_LBSPPB1024_LPB32_MIWT2_2_PLR1_SU0_SUM0_SUS0_SKXCCM8_VWA1_VWB2_WGM4_WGMXCC1_WGMXCCGn1
    SolutionIndex: 125
    SolutionNameMin: Cijk_Alik_Bjlk_I8II_BH_UserArgs_MT64x64x128_MI16x16x1_SN_CLR1_GSU0_GSUC0_GSUWGMRR0_K1_LBSPPA256_LBSPPB1024_LPB32_MIWT2_2_PLR1_SU0_SUM0_SUS0_SKXCCM8_VWA2_VWB2_WGM4_WGMXCC1_WGMXCCGn1
    SolutionIndex: 126
    SolutionNameMin: Cijk_Alik_Bjlk_I8II_BH_UserArgs_MT64x64x128_MI16x16x1_SN_CLR1_GSU0_GSUC0_GSUWGMRR0_K1_LBSPPA128_LBSPPB1024_LPB32_MIWT2_2_PLR1_SU0_SUM0_SUS0_SKXCCM8_VWA1_VWB2_WGM8_WGMXCC1_WGMXCCGn1
    SolutionIndex: 127
    SolutionNameMin: Cijk_Alik_Bjlk_I8II_BH_UserArgs_MT64x64x128_MI16x16x1_SN_CLR1_GSU0_GSUC0_GSUWGMRR0_K1_LBSPPA128_LBSPPB1024_LPB32_MIWT2_2_PLR1_SU0_SUM0_SUS0_SKXCCM8_VWA1_VWB2_WGM8_WGMXCC1_WGMXCCGn1
    SolutionIndex: 128
    SolutionNameMin: Cijk_Alik_Bjlk_I8II_BH_UserArgs_MT64x64x128_MI16x16x1_SN_CLR1_GSU0_GSUC0_GSUWGMRR0_K1_LBSPPA256_LBSPPB1024_LPB32_MIWT2_2_PLR1_SU0_SUM0_SUS0_SKXCCM8_VWA2_VWB2_WGM8_WGMXCC1_WGMXCCGn1
    SolutionIndex: 129
    SolutionNameMin: Cijk_Alik_Bjlk_I8II_BH_UserArgs_MT32x64x128_MI16x16x1_SN_CLR1_GSU0_GSUC0_GSUWGMRR0_K1_LBSPPA128_LBSPPB1024_LPB32_MIWT1_2_PLR1_SU0_SUM0_SUS0_SKXCCM8_VWA1_VWB2_WGM1_WGMXCC1_WGMXCCGn1
    SolutionIndex: 130
    SolutionNameMin: Cijk_Alik_Bjlk_I8II_BH_UserArgs_MT32x64x128_MI16x16x1_SN_CLR1_GSU0_GSUC0_GSUWGMRR0_K1_LBSPPA128_LBSPPB1024_LPB32_MIWT1_2_PLR1_SU0_SUM0_SUS0_SKXCCM8_VWA1_VWB2_WGM1_WGMXCC1_WGMXCCGn1
    SolutionIndex: 131
    SolutionNameMin: Cijk_Alik_Bjlk_I8II_BH_UserArgs_MT64x32x128_MI16x16x1_SN_CLR1_GSU0_GSUC0_GSUWGMRR0_K1_LBSPPA128_LBSPPB512_LPB16_MIWT2_1_PLR1_SU0_SUM0_SUS0_SKXCCM8_VWA1_VWB1_WGM1_WGMXCC1_WGMXCCGn1
    SolutionIndex: 132
    SolutionNameMin: Cijk_Alik_Bjlk_I8II_BH_UserArgs_MT64x32x128_MI16x16x1_SN_CLR1_GSU0_GSUC0_GSUWGMRR0_K1_LBSPPA256_LBSPPB512_LPB16_MIWT2_1_PLR1_SU0_SUM0_SUS0_SKXCCM8_VWA2_VWB1_WGM1_WGMXCC1_WGMXCCGn1
    SolutionIndex: 133
    SolutionNameMin: Cijk_Alik_Bjlk_I8II_BH_UserArgs_MT64x32x128_MI16x16x1_SN_CLR1_GSU0_GSUC0_GSUWGMRR0_K1_LBSPPA128_LBSPPB512_LPB16_MIWT2_1_PLR1_SU0_SUM0_SUS0_SKXCCM8_VWA1_VWB1_WGM1_WGMXCC1_WGMXCCGn1
    SolutionIndex: 134
    SolutionNameMin: Cijk_Alik_Bjlk_I8II_BH_UserArgs_MT64x32x128_MI16x16x1_SN_CLR1_GSU0_GSUC0_GSUWGMRR0_K1_LBSPPA128_LBSPPB512_LPB16_MIWT2_1_PLR1_SU0_SUM0_SUS0_SKXCCM8_VWA1_VWB1_WGM1_WGMXCC1_WGMXCCGn1
    SolutionIndex: 135
    SolutionNameMin: Cijk_Alik_Bjlk_I8II_BH_UserArgs_MT64x32x128_MI16x16x1_SN_CLR1_GSU0_GSUC0_GSUWGMRR0_K1_LBSPPA256_LBSPPB512_LPB16_MIWT2_1_PLR1_SU0_SUM0_SUS0_SKXCCM8_VWA2_VWB1_WGM1_WGMXCC1_WGMXCCGn1
    SolutionIndex: 136
    SolutionNameMin: Cijk_Alik_Bjlk_I8II_BH_UserArgs_MT64x32x128_MI16x16x1_SN_CLR1_GSU0_GSUC0_GSUWGMRR0_K1_LBSPPA128_LBSPPB512_LPB16_MIWT2_1_PLR1_SU0_SUM0_SUS0_SKXCCM8_VWA1_VWB1_WGM1_WGMXCC1_WGMXCCGn1
    SolutionIndex: 137
    SolutionNameMin: Cijk_Alik_Bjlk_I8II_BH_UserArgs_MT64x32x128_MI16x16x1_SN_CLR1_GSU0_GSUC0_GSUWGMRR0_K1_LBSPPA256_LBSPPB512_LPB16_MIWT2_1_PLR1_SU0_SUM0_SUS0_SKXCCM8_VWA2_VWB1_WGM4_WGMXCC1_WGMXCCGn1
    SolutionIndex: 138
    SolutionNameMin: Cijk_Alik_Bjlk_I8II_BH_UserArgs_MT64x32x128_MI16x16x1_SN_CLR1_GSU0_GSUC0_GSUWGMRR0_K1_LBSPPA128_LBSPPB512_LPB16_MIWT2_1_PLR1_SU0_SUM0_SUS0_SKXCCM8_VWA1_VWB1_WGM4_WGMXCC1_WGMXCCGn1
    SolutionIndex: 139
    SolutionNameMin: Cijk_Alik_Bjlk_I8II_BH_UserArgs_MT64x32x128_MI16x16x1_SN_CLR1_GSU0_GSUC0_GSUWGMRR0_K1_LBSPPA128_LBSPPB512_LPB16_MIWT2_1_PLR1_SU0_SUM0_SUS0_SKXCCM8_VWA1_VWB1_WGM8_WGMXCC1_WGMXCCGn1
    SolutionIndex: 140
    SolutionNameMin: Cijk_Alik_Bjlk_I8II_BH_UserArgs_MT32x32x128_MI16x16x1_SN_CLR1_GSU0_GSUC0_GSUWGMRR0_K1_LBSPPA128_LBSPPB512_LPB16_MIWT1_1_PLR1_SU0_SUM0_SUS0_SKXCCM8_VWA1_VWB1_WGM1_WGMXCC1_WGMXCCGn1
    SolutionIndex: 141
    SolutionNameMin: Cijk_Alik_Bjlk_I8II_BH_UserArgs_MT32x32x128_MI16x16x1_SN_CLR1_GSU0_GSUC0_GSUWGMRR0_K1_LBSPPA128_LBSPPB512_LPB16_MIWT1_1_PLR1_SU0_SUM0_SUS0_SKXCCM8_VWA1_VWB1_WGM1_WGMXCC1_WGMXCCGn1
    SolutionIndex: 142
    SolutionNameMin: Cijk_Alik_Bjlk_I8II_BH_UserArgs_MT32x32x128_MI16x16x1_SN_CLR1_GSU0_GSUC0_GSUWGMRR0_K1_LBSPPA128_LBSPPB512_LPB16_MIWT1_1_PLR1_SU0_SUM0_SUS0_SKXCCM8_VWA1_VWB1_WGM1_WGMXCC1_WGMXCCGn1
    SolutionIndex: 143
    SolutionNameMin: Cijk_Alik_Bjlk_I8II_BH_UserArgs_MT32x32x128_MI16x16x1_SN_CLR1_GSU0_GSUC0_GSUWGMRR0_K1_LBSPPA128_LBSPPB512_LPB16_MIWT1_1_PLR1_SU0_SUM0_SUS0_SKXCCM8_VWA1_VWB1_WGM1_WGMXCC1_WGMXCCGn1
    SolutionIndex: 144
    SolutionNameMin: Cijk_Alik_Bjlk_I8II_BH_UserArgs_MT32x32x128_MI16x16x1_SN_CLR1_GSU0_GSUC0_GSUWGMRR0_K1_LBSPPA128_LBSPPB512_LPB16_MIWT1_1_PLR1_SU0_SUM0_SUS0_SKXCCM8_VWA1_VWB1_WGM1_WGMXCC1_WGMXCCGn1
    SolutionIndex: 145
    SolutionNameMin: Cijk_Alik_Bjlk_I8II_BH_UserArgs_MT32x32x128_MI16x16x1_SN_CLR1_GSU0_GSUC0_GSUWGMRR0_K1_LBSPPA128_LBSPPB512_LPB16_MIWT1_1_PLR1_SU0_SUM0_SUS0_SKXCCM8_VWA1_VWB1_WGM1_WGMXCC1_WGMXCCGn1
    SolutionIndex: 146
    SolutionNameMin: Cijk_Alik_Bjlk_I8II_BH_UserArgs_MT32x32x128_MI16x16x1_SN_CLR1_GSU0_GSUC0_GSUWGMRR0_K1_LBSPPA128_LBSPPB512_LPB16_MIWT1_1_PLR2_SU0_SUM0_SUS0_SKXCCM8_VWA1_VWB1_WGM1_WGMXCC1_WGMXCCGn1
    SolutionIndex: 147
    SolutionNameMin: Cijk_Alik_Bjlk_I8II_BH_UserArgs_MT32x32x128_MI16x16x1_SN_CLR1_GSU0_GSUC0_GSUWGMRR0_K1_LBSPPA128_LBSPPB512_LPB16_MIWT1_1_PLR1_SU0_SUM0_SUS0_SKXCCM8_VWA1_VWB1_WGM4_WGMXCC1_WGMXCCGn1
    SolutionIndex: 148
    SolutionNameMin: Cijk_Alik_Bjlk_I8II_BH_UserArgs_MT32x32x128_MI16x16x1_SN_CLR1_GSU0_GSUC0_GSUWGMRR0_K1_LBSPPA128_LBSPPB512_LPB16_MIWT1_1_PLR1_SU0_SUM0_SUS0_SKXCCM8_VWA1_VWB1_WGM4_WGMXCC1_WGMXCCGn1
    SolutionIndex: 149
    SolutionNameMin: Cijk_Alik_Bjlk_I8II_BH_UserArgs_MT32x32x128_MI16x16x1_SN_CLR1_GSU0_GSUC0_GSUWGMRR0_K1_LBSPPA128_LBSPPB512_LPB16_MIWT1_1_PLR1_SU0_SUM0_SUS0_SKXCCM8_VWA1_VWB1_WGM8_WGMXCC1_WGMXCCGn1
    SolutionIndex: 150
    SolutionNameMin: Cijk_Alik_Bjlk_I8II_BH_UserArgs_MT128x64x256_MI16x16x1_SN_CLR1_GSU0_GSUC0_GSUWGMRR0_K1_LBSPPA1024_LBSPPB1024_LPB32_MIWT4_2_PLR2_SU0_SUM0_SUS0_SKXCCM8_VWA4_VWB2_WGM4_WGMXCC1_WGMXCCGn1
    SolutionIndex: 151
    SolutionNameMin: Cijk_Alik_Bjlk_I8II_BH_UserArgs_MT64x64x256_MI16x16x1_SN_CLR1_GSU0_GSUC0_GSUWGMRR0_K1_LBSPPA256_LBSPPB1024_LPB32_MIWT2_2_PLR2_SU0_SUM0_SUS0_SKXCCM8_VWA1_VWB2_WGM4_WGMXCC1_WGMXCCGn1
    SolutionIndex: 152
    SolutionNameMin: Cijk_Alik_Bjlk_I8II_BH_UserArgs_MT64x64x256_MI16x16x1_SN_CLR1_GSU0_GSUC0_GSUWGMRR0_K1_LBSPPA256_LBSPPB1024_LPB32_MIWT2_2_PLR2_SU0_SUM0_SUS0_SKXCCM8_VWA1_VWB2_WGM8_WGMXCC1_WGMXCCGn1
    SolutionIndex: 153
    SolutionNameMin: Cijk_Alik_Bjlk_I8II_BH_UserArgs_MT64x32x256_MI16x16x1_SN_CLR1_GSU0_GSUC0_GSUWGMRR0_K1_LBSPPA256_LBSPPB512_LPB16_MIWT2_1_PLR2_SU0_SUM0_SUS0_SKXCCM8_VWA1_VWB1_WGM1_WGMXCC1_WGMXCCGn1
    SolutionIndex: 154
    SolutionNameMin: Cijk_Alik_Bjlk_I8II_BH_UserArgs_MT64x32x256_MI16x16x1_SN_CLR1_GSU0_GSUC0_GSUWGMRR0_K1_LBSPPA256_LBSPPB512_LPB16_MIWT2_1_PLR2_SU0_SUM0_SUS0_SKXCCM8_VWA1_VWB1_WGM4_WGMXCC1_WGMXCCGn1
    SolutionIndex: 155
    SolutionNameMin: Cijk_Alik_Bjlk_I8II_BH_UserArgs_MT64x32x256_MI16x16x1_SN_CLR1_GSU0_GSUC0_GSUWGMRR0_K1_LBSPPA256_LBSPPB512_LPB16_MIWT2_1_PLR2_SU0_SUM0_SUS0_SKXCCM8_VWA1_VWB1_WGM8_WGMXCC1_WGMXCCGn1
    SolutionIndex: 156
    SolutionNameMin: Cijk_Alik_Bjlk_I8II_BH_UserArgs_MT32x32x256_MI16x16x1_SN_CLR1_GSU0_GSUC0_GSUWGMRR0_K1_LBSPPA256_LBSPPB512_LPB16_MIWT1_1_PLR1_SU0_SUM0_SUS0_SKXCCM8_VWA1_VWB1_WGM1_WGMXCC1_WGMXCCGn1
    SolutionIndex: 157
    SolutionNameMin: Cijk_Alik_Bjlk_I8II_BH_UserArgs_MT32x32x256_MI16x16x1_SN_CLR1_GSU0_GSUC0_GSUWGMRR0_K1_LBSPPA256_LBSPPB512_LPB16_MIWT1_1_PLR1_SU0_SUM0_SUS0_SKXCCM8_VWA1_VWB1_WGM1_WGMXCC1_WGMXCCGn1
    SolutionIndex: 158
    SolutionNameMin: Cijk_Alik_Bjlk_I8II_BH_UserArgs_MT32x32x256_MI16x16x1_SN_CLR1_GSU0_GSUC0_GSUWGMRR0_K1_LBSPPA256_LBSPPB512_LPB16_MIWT1_1_PLR1_SU0_SUM0_SUS0_SKXCCM8_VWA1_VWB1_WGM1_WGMXCC1_WGMXCCGn1
    SolutionIndex: 159
    SolutionNameMin: Cijk_Alik_Bjlk_I8II_BH_UserArgs_MT32x32x256_MI16x16x1_SN_CLR1_GSU0_GSUC0_GSUWGMRR0_K1_LBSPPA256_LBSPPB512_LPB16_MIWT1_1_PLR2_SU0_SUM0_SUS0_SKXCCM8_VWA1_VWB1_WGM1_WGMXCC1_WGMXCCGn1
    SolutionIndex: 160
    SolutionNameMin: Cijk_Alik_Bjlk_I8II_BH_UserArgs_MT32x32x32_MI16x16x1_SN_CLR0_GSU0_GSUC0_GSUWGMRR0_K1_LBSPPA128_LBSPPB256_LPB16_MIWT1_1_PLR0_SU32_SUM0_SUS256_SKXCCM8_VWA1_VWB1_WGM1_WGMXCC1_WGMXCCGn1
- - - [128, 128, 1, 128, 128, 128, 128, 128]
    - [70, 0.53]
  - - [128, 128, 1, 256, 128, 128, 256, 128]
    - [68, 0.95]
  - - [128, 128, 1, 512, 128, 128, 512, 128]
    - [145, 1.66]
  - - [128, 128, 1, 1024, 128, 128, 1024, 128]
    - [157, 2.55]
  - - [128, 128, 1, 2048, 128, 128, 2048, 128]
    - [145, 3.83]
  - - [128, 128, 1, 4096, 128, 128, 4096, 128]
    - [66, 6.4]
  - - [128, 128, 1, 8192, 128, 128, 8192, 128]
    - [145, 10.67]
  - - [128, 256, 1, 128, 128, 128, 128, 256]
    - [61, 1.03]
  - - [128, 256, 1, 256, 128, 128, 256, 256]
    - [147, 1.9]
  - - [128, 256, 1, 512, 128, 128, 512, 256]
    - [144, 3.42]
  - - [128, 256, 1, 1024, 128, 128, 1024, 256]
    - [145, 5.3]
  - - [128, 256, 1, 2048, 128, 128, 2048, 256]
    - [145, 7.77]
  - - [128, 256, 1, 4096, 128, 128, 4096, 256]
    - [73, 12.86]
  - - [128, 256, 1, 8192, 128, 128, 8192, 256]
    - [145, 20.93]
  - - [128, 512, 1, 128, 128, 128, 128, 512]
    - [64, 2.16]
  - - [128, 512, 1, 256, 128, 128, 256, 512]
    - [71, 3.94]
  - - [128, 512, 1, 512, 128, 128, 512, 512]
    - [141, 6.78]
  - - [128, 512, 1, 1024, 128, 128, 1024, 512]
    - [145, 10.58]
  - - [128, 512, 1, 2048, 128, 128, 2048, 512]
    - [145, 15.17]
  - - [128, 512, 1, 4096, 128, 128, 4096, 512]
    - [66, 25.16]
  - - [128, 512, 1, 8192, 128, 128, 8192, 512]
    - [144, 40.34]
  - - [128, 1024, 1, 128, 128, 128, 128, 1024]
    - [69, 3.94]
  - - [128, 1024, 1, 256, 128, 128, 256, 1024]
    - [156, 7.4]
  - - [128, 1024, 1, 512, 128, 128, 512, 1024]
    - [142, 13.31]
  - - [128, 1024, 1, 1024, 128, 128, 1024, 1024]
    - [145, 20.91]
  - - [128, 1024, 1, 2048, 128, 128, 2048, 1024]
    - [159, 28.82]
  - - [128, 1024, 1, 4096, 128, 128, 4096, 1024]
    - [159, 43.48]
  - - [128, 1024, 1, 8192, 128, 128, 8192, 1024]
    - [132, 65.05]
  - - [128, 2048, 1, 128, 128, 128, 128, 2048]
    - [146, 8.06]
  - - [128, 2048, 1, 256, 128, 128, 256, 2048]
    - [67, 14.38]
  - - [128, 2048, 1, 512, 128, 128, 512, 2048]
    - [141, 25.14]
  - - [128, 2048, 1, 1024, 128, 128, 1024, 2048]
    - [145, 39.78]
  - - [128, 2048, 1, 2048, 128, 128, 2048, 2048]
    - [131, 46.53]
  - - [128, 2048, 1, 4096, 128, 128, 4096, 2048]
    - [52, 70.61]
  - - [128, 2048, 1, 8192, 128, 128, 8192, 2048]
    - [123, 108.25]
  - - [128, 4096, 1, 128, 128, 128, 128, 4096]
    - [59, 14.8]
  - - [128, 4096, 1, 256, 128, 128, 256, 4096]
    - [136, 26.26]
  - - [128, 4096, 1, 512, 128, 128, 512, 4096]
    - [136, 45.62]
  - - [128, 4096, 1, 1024, 128, 128, 1024, 4096]
    - [136, 70.37]
  - - [128, 4096, 1, 2048, 128, 128, 2048, 4096]
    - [118, 83.02]
  - - [128, 4096, 1, 4096, 128, 128, 4096, 4096]
    - [118, 119.62]
  - - [128, 4096, 1, 8192, 128, 128, 8192, 4096]
    - [104, 156.77]
  - - [128, 8192, 1, 128, 128, 128, 128, 8192]
    - [118, 25.28]
  - - [128, 8192, 1, 256, 128, 128, 256, 8192]
    - [49, 45.62]
  - - [128, 8192, 1, 512, 128, 128, 512, 8192]
    - [49, 75.71]
  - - [128, 8192, 1, 1024, 128, 128, 1024, 8192]
    - [122, 116.83]
  - - [128, 8192, 1, 2048, 128, 128, 2048, 8192]
    - [120, 141.33]
  - - [128, 8192, 1, 4096, 128, 128, 4096, 8192]
    - [105, 168.72]
  - - [128, 8192, 1, 8192, 128, 128, 8192, 8192]
    - [95, 215.36]
  - - [256, 128, 1, 128, 256, 256, 128, 128]
    - [57, 1.02]
  - - [256, 128, 1, 256, 256, 256, 256, 128]
    - [66, 2.01]
  - - [256, 128, 1, 512, 256, 256, 512, 128]
    - [63, 3.3]
  - - [256, 128, 1, 1024, 256, 256, 1024, 128]
    - [144, 5.22]
  - - [256, 128, 1, 2048, 256, 256, 2048, 128]
    - [141, 7.63]
  - - [256, 128, 1, 4096, 256, 256, 4096, 128]
    - [63, 12.91]
  - - [256, 128, 1, 8192, 256, 256, 8192, 128]
    - [148, 20.12]
  - - [256, 256, 1, 128, 256, 256, 128, 256]
    - [61, 2.18]
  - - [256, 256, 1, 256, 256, 256, 256, 256]
    - [63, 3.99]
  - - [256, 256, 1, 512, 256, 256, 512, 256]
    - [142, 6.75]
  - - [256, 256, 1, 1024, 256, 256, 1024, 256]
    - [144, 10.44]
  - - [256, 256, 1, 2048, 256, 256, 2048, 256]
    - [145, 15.19]
  - - [256, 256, 1, 4096, 256, 256, 4096, 256]
    - [66, 24.54]
  - - [256, 256, 1, 8192, 256, 256, 8192, 256]
    - [144, 40.61]
  - - [256, 512, 1, 128, 256, 256, 128, 512]
    - [62, 4.17]
  - - [256, 512, 1, 256, 256, 256, 256, 512]
    - [68, 7.54]
  - - [256, 512, 1, 512, 256, 256, 512, 512]
    - [142, 13.57]
  - - [256, 512, 1, 1024, 256, 256, 1024, 512]
    - [141, 20.82]
  - - [256, 512, 1, 2048, 256, 256, 2048, 512]
    - [156, 28.17]
  - - [256, 512, 1, 4096, 256, 256, 4096, 512]
    - [144, 43.96]
  - - [256, 512, 1, 8192, 256, 256, 8192, 512]
    - [138, 69.74]
  - - [256, 1024, 1, 128, 256, 256, 128, 1024]
    - [58, 7.98]
  - - [256, 1024, 1, 256, 256, 256, 256, 1024]
    - [68, 14.59]
  - - [256, 1024, 1, 512, 256, 256, 512, 1024]
    - [142, 25.33]
  - - [256, 1024, 1, 1024, 256, 256, 1024, 1024]
    - [145, 39.56]
  - - [256, 1024, 1, 2048, 256, 256, 2048, 1024]
    - [159, 54.89]
  - - [256, 1024, 1, 4096, 256, 256, 4096, 1024]
    - [153, 78.6]
  - - [256, 1024, 1, 8192, 256, 256, 8192, 1024]
    - [122, 107.9]
  - - [256, 2048, 1, 128, 256, 256, 128, 2048]
    - [129, 14.64]
  - - [256, 2048, 1, 256, 256, 256, 256, 2048]
    - [54, 25.84]
  - - [256, 2048, 1, 512, 256, 256, 512, 2048]
    - [130, 44.63]
  - - [256, 2048, 1, 1024, 256, 256, 1024, 2048]
    - [132, 69.64]
  - - [256, 2048, 1, 2048, 256, 256, 2048, 2048]
    - [135, 88.4]
  - - [256, 2048, 1, 4096, 256, 256, 4096, 2048]
    - [126, 121.33]
  - - [256, 2048, 1, 8192, 256, 256, 8192, 2048]
    - [104, 160.61]
  - - [256, 4096, 1, 128, 256, 256, 128, 4096]
    - [120, 24.82]
  - - [256, 4096, 1, 256, 256, 256, 256, 4096]
    - [48, 44.51]
  - - [256, 4096, 1, 512, 256, 256, 512, 4096]
    - [119, 75.39]
  - - [256, 4096, 1, 1024, 256, 256, 1024, 4096]
    - [121, 117.05]
  - - [256, 4096, 1, 2048, 256, 256, 2048, 4096]
    - [118, 144.21]
  - - [256, 4096, 1, 4096, 256, 256, 4096, 4096]
    - [107, 176.08]
  - - [256, 4096, 1, 8192, 256, 256, 8192, 4096]
    - [92, 222.25]
  - - [256, 8192, 1, 128, 256, 256, 128, 8192]
    - [2, 37.87]
  - - [256, 8192, 1, 256, 256, 256, 256, 8192]
    - [38, 68.23]
  - - [256, 8192, 1, 512, 256, 256, 512, 8192]
    - [42, 112.97]
  - - [256, 8192, 1, 1024, 256, 256, 1024, 8192]
    - [105, 166.89]
  - - [256, 8192, 1, 2048, 256, 256, 2048, 8192]
    - [116, 196.84]
  - - [256, 8192, 1, 4096, 256, 256, 4096, 8192]
    - [115, 232.49]
  - - [256, 8192, 1, 8192, 256, 256, 8192, 8192]
    - [78, 277.33]
  - - [512, 128, 1, 128, 512, 512, 128, 128]
    - [141, 2.07]
  - - [512, 128, 1, 256, 512, 512, 256, 128]
    - [140, 3.82]
  - - [512, 128, 1, 512, 512, 512, 512, 128]
    - [141, 6.61]
  - - [512, 128, 1, 1024, 512, 512, 1024, 128]
    - [145, 10.43]
  - - [512, 128, 1, 2048, 512, 512, 2048, 128]
    - [141, 14.99]
  - - [512, 128, 1, 4096, 512, 512, 4096, 128]
    - [66, 24.85]
  - - [512, 128, 1, 8192, 512, 512, 8192, 128]
    - [145, 40.12]
  - - [512, 256, 1, 128, 512, 512, 128, 256]
    - [133, 4.01]
  - - [512, 256, 1, 256, 512, 512, 256, 256]
    - [65, 7.61]
  - - [512, 256, 1, 512, 512, 512, 512, 256]
    - [141, 13.17]
  - - [512, 256, 1, 1024, 512, 512, 1024, 256]
    - [145, 20.82]
  - - [512, 256, 1, 2048, 512, 512, 2048, 256]
    - [157, 28.82]
  - - [512, 256, 1, 4096, 512, 512, 4096, 256]
    - [159, 43.72]
  - - [512, 256, 1, 8192, 512, 512, 8192, 256]
    - [137, 69.66]
  - - [512, 512, 1, 128, 512, 512, 128, 512]
    - [63, 7.87]
  - - [512, 512, 1, 256, 512, 512, 256, 512]
    - [158, 14.38]
  - - [512, 512, 1, 512, 512, 512, 512, 512]
    - [145, 25.8]
  - - [512, 512, 1, 1024, 512, 512, 1024, 512]
    - [145, 39.6]
  - - [512, 512, 1, 2048, 512, 512, 2048, 512]
    - [159, 56.42]
  - - [512, 512, 1, 4096, 512, 512, 4096, 512]
    - [153, 79.79]
  - - [512, 512, 1, 8192, 512, 512, 8192, 512]
    - [124, 110.28]
  - - [512, 1024, 1, 128, 512, 512, 128, 1024]
    - [129, 14.87]
  - - [512, 1024, 1, 256, 512, 512, 256, 1024]
    - [133, 26.9]
  - - [512, 1024, 1, 512, 512, 512, 512, 1024]
    - [132, 45.38]
  - - [512, 1024, 1, 1024, 512, 512, 1024, 1024]
    - [135, 70.72]
  - - [512, 1024, 1, 2048, 512, 512, 2048, 1024]
    - [153, 99.94]
  - - [512, 1024, 1, 4096, 512, 512, 4096, 1024]
    - [122, 119.9]
  - - [512, 1024, 1, 8192, 512, 512, 8192, 1024]
    - [105, 163.89]
  - - [512, 2048, 1, 128, 512, 512, 128, 2048]
    - [120, 25.75]
  - - [512, 2048, 1, 256, 512, 512, 256, 2048]
    - [49, 44.93]
  - - [512, 2048, 1, 512, 512, 512, 512, 2048]
    - [122, 75.71]
  - - [512, 2048, 1, 1024, 512, 512, 1024, 2048]
    - [122, 116.96]
  - - [512, 2048, 1, 2048, 512, 512, 2048, 2048]
    - [118, 147.02]
  - - [512, 2048, 1, 4096, 512, 512, 4096, 2048]
    - [109, 177.13]
  - - [512, 2048, 1, 8192, 512, 512, 8192, 2048]
    - [92, 232.66]
  - - [512, 4096, 1, 128, 512, 512, 128, 4096]
    - [38, 38.68]
  - - [512, 4096, 1, 256, 512, 512, 256, 4096]
    - [39, 68.99]
  - - [512, 4096, 1, 512, 512, 512, 512, 4096]
    - [41, 115.36]
  - - [512, 4096, 1, 1024, 512, 512, 1024, 4096]
    - [105, 168.56]
  - - [512, 4096, 1, 2048, 512, 512, 2048, 4096]
    - [112, 203.44]
  - - [512, 4096, 1, 4096, 512, 512, 4096, 4096]
    - [106, 237.79]
  - - [512, 4096, 1, 8192, 512, 512, 8192, 4096]
    - [78, 279.07]
  - - [512, 8192, 1, 128, 512, 512, 128, 8192]
    - [33, 56.09]
  - - [512, 8192, 1, 256, 512, 512, 256, 8192]
    - [33, 99.98]
  - - [512, 8192, 1, 512, 512, 512, 512, 8192]
    - [33, 152.35]
  - - [512, 8192, 1, 1024, 512, 512, 1024, 8192]
    - [33, 202.31]
  - - [512, 8192, 1, 2048, 512, 512, 2048, 8192]
    - [99, 261.01]
  - - [512, 8192, 1, 4096, 512, 512, 4096, 8192]
    - [92, 307.46]
  - - [512, 8192, 1, 8192, 512, 512, 8192, 8192]
    - [76, 340.51]
  - - [1024, 128, 1, 128, 1024, 1024, 128, 128]
    - [143, 4.06]
  - - [1024, 128, 1, 256, 1024, 1024, 256, 128]
    - [141, 7.73]
  - - [1024, 128, 1, 512, 1024, 1024, 512, 128]
    - [66, 12.9]
  - - [1024, 128, 1, 1024, 1024, 1024, 1024, 128]
    - [149, 20.48]
  - - [1024, 128, 1, 2048, 1024, 1024, 2048, 128]
    - [159, 28.99]
  - - [1024, 128, 1, 4096, 1024, 1024, 4096, 128]
    - [145, 43.68]
  - - [1024, 128, 1, 8192, 1024, 1024, 8192, 128]
    - [138, 69.92]
  - - [1024, 256, 1, 128, 1024, 1024, 128, 256]
    - [72, 7.84]
  - - [1024, 256, 1, 256, 1024, 1024, 256, 256]
    - [144, 14.93]
  - - [1024, 256, 1, 512, 1024, 1024, 512, 256]
    - [141, 25.54]
  - - [1024, 256, 1, 1024, 1024, 1024, 1024, 256]
    - [145, 40.06]
  - - [1024, 256, 1, 2048, 1024, 1024, 2048, 256]
    - [157, 56.46]
  - - [1024, 256, 1, 4096, 1024, 1024, 4096, 256]
    - [154, 78.63]
  - - [1024, 256, 1, 8192, 1024, 1024, 8192, 256]
    - [121, 109.86]
  - - [1024, 512, 1, 128, 1024, 1024, 128, 512]
    - [133, 14.89]
  - - [1024, 512, 1, 256, 1024, 1024, 256, 512]
    - [134, 26.59]
  - - [1024, 512, 1, 512, 1024, 1024, 512, 512]
    - [131, 45.82]
  - - [1024, 512, 1, 1024, 1024, 1024, 1024, 512]
    - [134, 69.04]
  - - [1024, 512, 1, 2048, 1024, 1024, 2048, 512]
    - [153, 98.79]
  - - [1024, 512, 1, 4096, 1024, 1024, 4096, 512]
    - [155, 125.78]
  - - [1024, 512, 1, 8192, 1024, 1024, 8192, 512]
    - [112, 163.14]
  - - [1024, 1024, 1, 128, 1024, 1024, 128, 1024]
    - [120, 25.71]
  - - [1024, 1024, 1, 256, 1024, 1024, 256, 1024]
    - [49, 45.66]
  - - [1024, 1024, 1, 512, 1024, 1024, 512, 1024]
    - [49, 76.19]
  - - [1024, 1024, 1, 1024, 1024, 1024, 1024, 1024]
    - [121, 118.17]
  - - [1024, 1024, 1, 2048, 1024, 1024, 2048, 1024]
    - [121, 161.4]
  - - [1024, 1024, 1, 4096, 1024, 1024, 4096, 1024]
    - [111, 175.61]
  - - [1024, 1024, 1, 8192, 1024, 1024, 8192, 1024]
    - [93, 225.55]
  - - [1024, 2048, 1, 128, 1024, 1024, 128, 2048]
    - [103, 38.62]
  - - [1024, 2048, 1, 256, 1024, 1024, 256, 2048]
    - [40, 69.63]
  - - [1024, 2048, 1, 512, 1024, 1024, 512, 2048]
    - [40, 116.37]
  - - [1024, 2048, 1, 1024, 1024, 1024, 1024, 2048]
    - [105, 169.0]
  - - [1024, 2048, 1, 2048, 1024, 1024, 2048, 2048]
    - [104, 211.03]
  - - [1024, 2048, 1, 4096, 1024, 1024, 4096, 2048]
    - [113, 240.68]
  - - [1024, 2048, 1, 8192, 1024, 1024, 8192, 2048]
    - [81, 280.08]
  - - [1024, 4096, 1, 128, 1024, 1024, 128, 4096]
    - [32, 56.1]
  - - [1024, 4096, 1, 256, 1024, 1024, 256, 4096]
    - [32, 97.59]
  - - [1024, 4096, 1, 512, 1024, 1024, 512, 4096]
    - [32, 154.23]
  - - [1024, 4096, 1, 1024, 1024, 1024, 1024, 4096]
    - [92, 203.07]
  - - [1024, 4096, 1, 2048, 1024, 1024, 2048, 4096]
    - [92, 261.59]
  - - [1024, 4096, 1, 4096, 1024, 1024, 4096, 4096]
    - [97, 305.71]
  - - [1024, 4096, 1, 8192, 1024, 1024, 8192, 4096]
    - [79, 331.56]
  - - [1024, 8192, 1, 128, 1024, 1024, 128, 8192]
    - [26, 55.14]
  - - [1024, 8192, 1, 256, 1024, 1024, 256, 8192]
    - [25, 100.6]
  - - [1024, 8192, 1, 512, 1024, 1024, 512, 8192]
    - [25, 160.95]
  - - [1024, 8192, 1, 1024, 1024, 1024, 1024, 8192]
    - [89, 238.19]
  - - [1024, 8192, 1, 2048, 1024, 1024, 2048, 8192]
    - [77, 314.53]
  - - [1024, 8192, 1, 4096, 1024, 1024, 4096, 8192]
    - [78, 379.37]
  - - [1024, 8192, 1, 8192, 1024, 1024, 8192, 8192]
    - [22, 370.43]
  - - [2048, 128, 1, 128, 2048, 2048, 128, 128]
    - [144, 8.17]
  - - [2048, 128, 1, 256, 2048, 2048, 256, 128]
    - [63, 15.04]
  - - [2048, 128, 1, 512, 2048, 2048, 512, 128]
    - [145, 25.64]
  - - [2048, 128, 1, 1024, 2048, 2048, 1024, 128]
    - [141, 39.49]
  - - [2048, 128, 1, 2048, 2048, 2048, 2048, 128]
    - [145, 56.6]
  - - [2048, 128, 1, 4096, 2048, 2048, 4096, 128]
    - [154, 77.45]
  - - [2048, 128, 1, 8192, 2048, 2048, 8192, 128]
    - [121, 110.08]
  - - [2048, 256, 1, 128, 2048, 2048, 128, 256]
    - [56, 14.77]
  - - [2048, 256, 1, 256, 2048, 2048, 256, 256]
    - [60, 27.03]
  - - [2048, 256, 1, 512, 2048, 2048, 512, 256]
    - [136, 45.88]
  - - [2048, 256, 1, 1024, 2048, 2048, 1024, 256]
    - [139, 69.96]
  - - [2048, 256, 1, 2048, 2048, 2048, 2048, 256]
    - [155, 99.16]
  - - [2048, 256, 1, 4096, 2048, 2048, 4096, 256]
    - [152, 132.64]
  - - [2048, 256, 1, 8192, 2048, 2048, 8192, 256]
    - [116, 165.77]
  - - [2048, 512, 1, 128, 2048, 2048, 128, 512]
    - [50, 25.0]
  - - [2048, 512, 1, 256, 2048, 2048, 256, 512]
    - [49, 45.26]
  - - [2048, 512, 1, 512, 2048, 2048, 512, 512]
    - [49, 76.43]
  - - [2048, 512, 1, 1024, 2048, 2048, 1024, 512]
    - [122, 117.96]
  - - [2048, 512, 1, 2048, 2048, 2048, 2048, 512]
    - [125, 159.3]
  - - [2048, 512, 1, 4096, 2048, 2048, 4096, 512]
    - [128, 186.21]
  - - [2048, 512, 1, 8192, 2048, 2048, 8192, 512]
    - [93, 231.3]
  - - [2048, 1024, 1, 128, 2048, 2048, 128, 1024]
    - [108, 38.54]
  - - [2048, 1024, 1, 256, 2048, 2048, 256, 1024]
    - [40, 69.76]
  - - [2048, 1024, 1, 512, 2048, 2048, 512, 1024]
    - [40, 116.64]
  - - [2048, 1024, 1, 1024, 2048, 2048, 1024, 1024]
    - [110, 170.6]
  - - [2048, 1024, 1, 2048, 2048, 2048, 2048, 1024]
    - [117, 213.24]
  - - [2048, 1024, 1, 4096, 2048, 2048, 4096, 1024]
    - [114, 233.73]
  - - [2048, 1024, 1, 8192, 2048, 2048, 8192, 1024]
    - [84, 280.28]
  - - [2048, 2048, 1, 128, 2048, 2048, 128, 2048]
    - [34, 52.49]
  - - [2048, 2048, 1, 256, 2048, 2048, 256, 2048]
    - [35, 95.97]
  - - [2048, 2048, 1, 512, 2048, 2048, 512, 2048]
    - [101, 147.03]
  - - [2048, 2048, 1, 1024, 2048, 2048, 1024, 2048]
    - [96, 203.97]
  - - [2048, 2048, 1, 2048, 2048, 2048, 2048, 2048]
    - [93, 260.99]
  - - [2048, 2048, 1, 4096, 2048, 2048, 4096, 2048]
    - [97, 310.84]
  - - [2048, 2048, 1, 8192, 2048, 2048, 8192, 2048]
    - [88, 336.93]
  - - [2048, 4096, 1, 128, 2048, 2048, 128, 4096]
    - [80, 55.06]
  - - [2048, 4096, 1, 256, 2048, 2048, 256, 4096]
    - [77, 100.18]
  - - [2048, 4096, 1, 512, 2048, 2048, 512, 4096]
    - [76, 159.6]
  - - [2048, 4096, 1, 1024, 2048, 2048, 1024, 4096]
    - [78, 237.7]
  - - [2048, 4096, 1, 2048, 2048, 2048, 2048, 4096]
    - [89, 314.92]
  - - [2048, 4096, 1, 4096, 2048, 2048, 4096, 4096]
    - [86, 377.98]
  - - [2048, 4096, 1, 8192, 2048, 2048, 8192, 4096]
    - [17, 366.01]
  - - [2048, 8192, 1, 128, 2048, 2048, 128, 8192]
    - [0, 60.85]
  - - [2048, 8192, 1, 256, 2048, 2048, 256, 8192]
    - [8, 111.53]
  - - [2048, 8192, 1, 512, 2048, 2048, 512, 8192]
    - [18, 178.68]
  - - [2048, 8192, 1, 1024, 2048, 2048, 1024, 8192]
    - [9, 267.44]
  - - [2048, 8192, 1, 2048, 2048, 2048, 2048, 8192]
    - [16, 366.51]
  - - [2048, 8192, 1, 4096, 2048, 2048, 4096, 8192]
    - [22, 355.61]
  - - [2048, 8192, 1, 8192, 2048, 2048, 8192, 8192]
    - [11, 399.66]
  - - [4096, 128, 1, 128, 4096, 4096, 128, 128]
    - [55, 14.76]
  - - [4096, 128, 1, 256, 4096, 4096, 256, 128]
    - [55, 27.11]
  - - [4096, 128, 1, 512, 4096, 4096, 512, 128]
    - [136, 45.84]
  - - [4096, 128, 1, 1024, 4096, 4096, 1024, 128]
    - [131, 71.04]
  - - [4096, 128, 1, 2048, 4096, 4096, 2048, 128]
    - [154, 95.75]
  - - [4096, 128, 1, 4096, 4096, 4096, 4096, 128]
    - [151, 129.48]
  - - [4096, 128, 1, 8192, 4096, 4096, 8192, 128]
    - [111, 162.99]
  - - [4096, 256, 1, 128, 4096, 4096, 128, 256]
    - [51, 24.94]
  - - [4096, 256, 1, 256, 4096, 4096, 256, 256]
    - [51, 44.72]
  - - [4096, 256, 1, 512, 4096, 4096, 512, 256]
    - [127, 74.56]
  - - [4096, 256, 1, 1024, 4096, 4096, 1024, 256]
    - [125, 115.65]
  - - [4096, 256, 1, 2048, 4096, 4096, 2048, 256]
    - [124, 159.26]
  - - [4096, 256, 1, 4096, 4096, 4096, 4096, 256]
    - [124, 192.67]
  - - [4096, 256, 1, 8192, 4096, 4096, 8192, 256]
    - [100, 230.55]
  - - [4096, 512, 1, 128, 4096, 4096, 128, 512]
    - [4, 38.67]
  - - [4096, 512, 1, 256, 4096, 4096, 256, 512]
    - [44, 69.16]
  - - [4096, 512, 1, 512, 4096, 4096, 512, 512]
    - [45, 115.16]
  - - [4096, 512, 1, 1024, 4096, 4096, 1024, 512]
    - [111, 170.98]
  - - [4096, 512, 1, 2048, 4096, 4096, 2048, 512]
    - [116, 220.55]
  - - [4096, 512, 1, 4096, 4096, 4096, 4096, 512]
    - [93, 230.37]
  - - [4096, 512, 1, 8192, 4096, 4096, 8192, 512]
    - [84, 281.57]
  - - [4096, 1024, 1, 128, 4096, 4096, 128, 1024]
    - [31, 51.89]
  - - [4096, 1024, 1, 256, 4096, 4096, 256, 1024]
    - [34, 92.44]
  - - [4096, 1024, 1, 512, 4096, 4096, 512, 1024]
    - [98, 146.04]
  - - [4096, 1024, 1, 1024, 4096, 4096, 1024, 1024]
    - [102, 202.63]
  - - [4096, 1024, 1, 2048, 4096, 4096, 2048, 1024]
    - [94, 257.75]
  - - [4096, 1024, 1, 4096, 4096, 4096, 4096, 1024]
    - [93, 302.11]
  - - [4096, 1024, 1, 8192, 4096, 4096, 8192, 1024]
    - [91, 323.34]
  - - [4096, 2048, 1, 128, 4096, 4096, 128, 2048]
    - [85, 54.42]
  - - [4096, 2048, 1, 256, 4096, 4096, 256, 2048]
    - [28, 99.63]
  - - [4096, 2048, 1, 512, 4096, 4096, 512, 2048]
    - [83, 159.08]
  - - [4096, 2048, 1, 1024, 4096, 4096, 1024, 2048]
    - [87, 237.41]
  - - [4096, 2048, 1, 2048, 4096, 4096, 2048, 2048]
    - [89, 311.6]
  - - [4096, 2048, 1, 4096, 4096, 4096, 4096, 2048]
    - [89, 381.15]
  - - [4096, 2048, 1, 8192, 4096, 4096, 8192, 2048]
    - [14, 361.88]
  - - [4096, 4096, 1, 128, 4096, 4096, 128, 4096]
    - [1, 59.56]
  - - [4096, 4096, 1, 256, 4096, 4096, 256, 4096]
    - [12, 107.19]
  - - [4096, 4096, 1, 512, 4096, 4096, 512, 4096]
    - [11, 173.01]
  - - [4096, 4096, 1, 1024, 4096, 4096, 1024, 4096]
    - [11, 261.12]
  - - [4096, 4096, 1, 2048, 4096, 4096, 2048, 4096]
    - [6, 354.22]
  - - [4096, 4096, 1, 4096, 4096, 4096, 4096, 4096]
    - [22, 349.04]
  - - [4096, 4096, 1, 8192, 4096, 4096, 8192, 4096]
    - [6, 404.1]
  - - [4096, 8192, 1, 128, 4096, 4096, 128, 8192]
    - [10, 60.36]
  - - [4096, 8192, 1, 256, 4096, 4096, 256, 8192]
    - [30, 102.34]
  - - [4096, 8192, 1, 512, 4096, 4096, 512, 8192]
    - [88, 160.03]
  - - [4096, 8192, 1, 1024, 4096, 4096, 1024, 8192]
    - [22, 224.09]
  - - [4096, 8192, 1, 2048, 4096, 4096, 2048, 8192]
    - [5, 308.25]
  - - [4096, 8192, 1, 4096, 4096, 4096, 4096, 8192]
    - [6, 375.57]
  - - [4096, 8192, 1, 8192, 4096, 4096, 8192, 8192]
    - [16, 422.63]
  - - [8192, 128, 1, 128, 8192, 8192, 128, 128]
    - [47, 24.81]
  - - [8192, 128, 1, 256, 8192, 8192, 256, 128]
    - [51, 44.71]
  - - [8192, 128, 1, 512, 8192, 8192, 512, 128]
    - [53, 74.63]
  - - [8192, 128, 1, 1024, 8192, 8192, 1024, 128]
    - [126, 114.76]
  - - [8192, 128, 1, 2048, 8192, 8192, 2048, 128]
    - [124, 158.69]
  - - [8192, 128, 1, 4096, 8192, 8192, 4096, 128]
    - [150, 169.47]
  - - [8192, 128, 1, 8192, 8192, 8192, 8192, 128]
    - [97, 216.85]
  - - [8192, 256, 1, 128, 8192, 8192, 128, 256]
    - [3, 38.68]
  - - [8192, 256, 1, 256, 8192, 8192, 256, 256]
    - [40, 69.09]
  - - [8192, 256, 1, 512, 8192, 8192, 512, 256]
    - [46, 114.52]
  - - [8192, 256, 1, 1024, 8192, 8192, 1024, 256]
    - [43, 170.06]
  - - [8192, 256, 1, 2048, 8192, 8192, 2048, 256]
    - [116, 209.87]
  - - [8192, 256, 1, 4096, 8192, 8192, 4096, 256]
    - [97, 230.01]
  - - [8192, 256, 1, 8192, 8192, 8192, 8192, 256]
    - [88, 276.49]
  - - [8192, 512, 1, 128, 8192, 8192, 128, 512]
    - [37, 55.07]
  - - [8192, 512, 1, 256, 8192, 8192, 256, 512]
    - [37, 98.56]
  - - [8192, 512, 1, 512, 8192, 8192, 512, 512]
    - [37, 151.2]
  - - [8192, 512, 1, 1024, 8192, 8192, 1024, 512]
    - [97, 200.67]
  - - [8192, 512, 1, 2048, 8192, 8192, 2048, 512]
    - [99, 249.94]
  - - [8192, 512, 1, 4096, 8192, 8192, 4096, 512]
    - [100, 301.03]
  - - [8192, 512, 1, 8192, 8192, 8192, 8192, 512]
    - [74, 326.82]
  - - [8192, 1024, 1, 128, 8192, 8192, 128, 1024]
    - [82, 54.07]
  - - [8192, 1024, 1, 256, 8192, 8192, 256, 1024]
    - [27, 99.64]
  - - [8192, 1024, 1, 512, 8192, 8192, 512, 1024]
    - [74, 158.62]
  - - [8192, 1024, 1, 1024, 8192, 8192, 1024, 1024]
    - [90, 233.02]
  - - [8192, 1024, 1, 2048, 8192, 8192, 2048, 1024]
    - [91, 309.01]
  - - [8192, 1024, 1, 4096, 8192, 8192, 4096, 1024]
    - [90, 378.14]
  - - [8192, 1024, 1, 8192, 8192, 8192, 8192, 1024]
    - [19, 365.53]
  - - [8192, 2048, 1, 128, 8192, 8192, 128, 2048]
    - [7, 58.92]
  - - [8192, 2048, 1, 256, 8192, 8192, 256, 2048]
    - [18, 107.52]
  - - [8192, 2048, 1, 512, 8192, 8192, 512, 2048]
    - [13, 173.87]
  - - [8192, 2048, 1, 1024, 8192, 8192, 1024, 2048]
    - [18, 261.0]
  - - [8192, 2048, 1, 2048, 8192, 8192, 2048, 2048]
    - [15, 354.15]
  - - [8192, 2048, 1, 4096, 8192, 8192, 4096, 2048]
    - [24, 350.83]
  - - [8192, 2048, 1, 8192, 8192, 8192, 8192, 2048]
    - [22, 396.94]
  - - [8192, 4096, 1, 128, 8192, 8192, 128, 4096]
    - [36, 64.33]
  - - [8192, 4096, 1, 256, 8192, 8192, 256, 4096]
    - [100, 105.31]
  - - [8192, 4096, 1, 512, 8192, 8192, 512, 4096]
    - [75, 161.77]
  - - [8192, 4096, 1, 1024, 8192, 8192, 1024, 4096]
    - [20, 225.87]
  - - [8192, 4096, 1, 2048, 8192, 8192, 2048, 4096]
    - [11, 310.3]
  - - [8192, 4096, 1, 4096, 8192, 8192, 4096, 4096]
    - [10, 375.97]
  - - [8192, 4096, 1, 8192, 8192, 8192, 8192, 4096]
    - [22, 426.45]
  - - [8192, 8192, 1, 128, 8192, 8192, 128, 8192]
    - [37, 53.08]
  - - [8192, 8192, 1, 256, 8192, 8192, 256, 8192]
    - [36, 93.48]
  - - [8192, 8192, 1, 512, 8192, 8192, 512, 8192]
    - [29, 150.91]
  - - [8192, 8192, 1, 1024, 8192, 8192, 1024, 8192]
    - [23, 228.37]
  - - [8192, 8192, 1, 2048, 8192, 8192, 2048, 8192]
    - [21, 323.35]
  - - [8192, 8192, 1, 4096, 8192, 8192, 4096, 8192]
    - [20, 403.28]
  - - [8192, 8192, 1, 8192, 8192, 8192, 8192, 8192]
    - [22, 464.39]
  - - [1, 1, 1, 32, 1, 1, 32, 1]
    - [160, 0.0]
- null
- null
- ExperimentalStreamK
- GridBased
