projects/hipblaslt/library/src/amd_detail/rocblaslt/src/Tensile/Logic/asm_full/aquavanjaram/gfx942/StreamK/aquavanjaram942_Cijk_Ailk_Bjlk_I8II_BH_UserArgs.yaml
- {MinimumRequiredVersion: 4.33.0}
- aquavanjaram942
- gfx942
- [Device 0049, Device 0050]
    SolutionIndex: 0
    SolutionNameMin: Cijk_Ailk_Bjlk_I8II_BH_UserArgs_MT256x256x32_MI16x16x1_SN_CLR0_GSU0_GSUC0_GSUWGMRR0_K1_LBSPPA2048_LBSPPB2048_LPA64_LPB64_MIWT8_8_PLR0_SU0_SUM0_SUS0_SKXCCM8_VWA4_VWB4_WGM1_WGMXCC1_WGMXCCGn1
    SolutionIndex: 1
    SolutionNameMin: Cijk_Ailk_Bjlk_I8II_BH_UserArgs_MT256x256x32_MI16x16x1_SN_CLR0_GSU0_GSUC0_GSUWGMRR0_K1_LBSPPA2048_LBSPPB2048_LPA64_LPB0_MIWT8_8_PLR0_SU0_SUM0_SUS0_SKXCCM8_VWA4_VWB8_WGM1_WGMXCC1_WGMXCCGn1
    SolutionIndex: 2
    SolutionNameMin: Cijk_Ailk_Bjlk_I8II_BH_UserArgs_MT256x128x32_MI16x16x1_SN_CLR0_GSU0_GSUC0_GSUWGMRR0_K1_LBSPPA2048_LBSPPB1024_LPA64_LPB64_MIWT8_4_PLR0_SU0_SUM0_SUS0_SKXCCM8_VWA4_VWB4_WGM1_WGMXCC1_WGMXCCGn1
    SolutionIndex: 3
    SolutionNameMin: Cijk_Ailk_Bjlk_I8II_BH_UserArgs_MT128x128x32_MI16x16x1_SN_CLR0_GSU0_GSUC0_GSUWGMRR0_K1_LBSPPA1024_LBSPPB1024_LPA64_LPB64_MIWT4_4_PLR0_SU0_SUM0_SUS0_SKXCCM8_VWA4_VWB4_WGM1_WGMXCC1_WGMXCCGn1
    SolutionIndex: 4
    SolutionNameMin: Cijk_Ailk_Bjlk_I8II_BH_UserArgs_MT128x128x32_MI16x16x1_SN_CLR0_GSU0_GSUC0_GSUWGMRR0_K1_LBSPPA1024_LBSPPB1024_LPA64_LPB64_MIWT4_4_PLR0_SU0_SUM0_SUS0_SKXCCM8_VWA4_VWB4_WGM1_WGMXCC1_WGMXCCGn1
    SolutionIndex: 5
    SolutionNameMin: Cijk_Ailk_Bjlk_I8II_BH_UserArgs_MT128x64x32_MI16x16x1_SN_CLR0_GSU0_GSUC0_GSUWGMRR0_K1_LBSPPA1024_LBSPPB512_LPA64_LPB32_MIWT4_2_PLR0_SU0_SUM0_SUS0_SKXCCM8_VWA4_VWB2_WGM1_WGMXCC1_WGMXCCGn1
    SolutionIndex: 6
    SolutionNameMin: Cijk_Ailk_Bjlk_I8II_BH_UserArgs_MT64x64x32_MI16x16x1_SN_CLR0_GSU0_GSUC0_GSUWGMRR0_K1_LBSPPA512_LBSPPB512_LPA16_LPB32_MIWT2_2_PLR0_SU0_SUM0_SUS0_SKXCCM8_VWA1_VWB2_WGM1_WGMXCC1_WGMXCCGn1
    SolutionIndex: 7
    SolutionNameMin: Cijk_Ailk_Bjlk_I8II_BH_UserArgs_MT64x64x32_MI16x16x1_SN_CLR0_GSU0_GSUC0_GSUWGMRR0_K1_LBSPPA512_LBSPPB512_LPA32_LPB32_MIWT2_2_PLR0_SU0_SUM0_SUS0_SKXCCM8_VWA2_VWB2_WGM1_WGMXCC1_WGMXCCGn1
    SolutionIndex: 8
    SolutionNameMin: Cijk_Ailk_Bjlk_I8II_BH_UserArgs_MT32x64x32_MI16x16x1_SN_CLR0_GSU0_GSUC0_GSUWGMRR0_K1_LBSPPA256_LBSPPB512_LPA16_LPB32_MIWT1_2_PLR0_SU0_SUM0_SUS0_SKXCCM8_VWA1_VWB2_WGM1_WGMXCC1_WGMXCCGn1
    SolutionIndex: 9
    SolutionNameMin: Cijk_Ailk_Bjlk_I8II_BH_UserArgs_MT64x32x32_MI16x16x1_SN_CLR0_GSU0_GSUC0_GSUWGMRR0_K1_LBSPPA512_LBSPPB256_LPA32_LPB16_MIWT2_1_PLR0_SU0_SUM0_SUS0_SKXCCM8_VWA2_VWB1_WGM1_WGMXCC1_WGMXCCGn1
    SolutionIndex: 10
    SolutionNameMin: Cijk_Ailk_Bjlk_I8II_BH_UserArgs_MT32x32x32_MI16x16x1_SN_CLR0_GSU0_GSUC0_GSUWGMRR0_K1_LBSPPA256_LBSPPB256_LPA16_LPB16_MIWT1_1_PLR0_SU0_SUM0_SUS0_SKXCCM8_VWA1_VWB1_WGM1_WGMXCC1_WGMXCCGn1
    SolutionIndex: 11
    SolutionNameMin: Cijk_Ailk_Bjlk_I8II_BH_UserArgs_MT32x32x32_MI16x16x1_SN_CLR0_GSU0_GSUC0_GSUWGMRR0_K1_LBSPPA256_LBSPPB256_LPA16_LPB16_MIWT1_1_PLR0_SU0_SUM0_SUS0_SKXCCM8_VWA1_VWB1_WGM1_WGMXCC1_WGMXCCGn1
    SolutionIndex: 12
    SolutionNameMin: Cijk_Ailk_Bjlk_I8II_BH_UserArgs_MT32x32x32_MI16x16x1_SN_CLR0_GSU0_GSUC0_GSUWGMRR0_K1_LBSPPA256_LBSPPB256_LPA16_LPB16_MIWT1_1_PLR0_SU0_SUM0_SUS0_SKXCCM8_VWA1_VWB1_WGM1_WGMXCC1_WGMXCCGn1
    SolutionIndex: 13
    SolutionNameMin: Cijk_Ailk_Bjlk_I8II_BH_UserArgs_MT256x256x64_MI16x16x1_SN_CLR1_GSU0_GSUC0_GSUWGMRR0_K1_LBSPPA2048_LBSPPB2048_LPA64_LPB64_MIWT8_8_PLR1_SU0_SUM0_SUS0_SKXCCM8_VWA4_VWB4_WGM1_WGMXCC1_WGMXCCGn1
    SolutionIndex: 14
    SolutionNameMin: Cijk_Ailk_Bjlk_I8II_BH_UserArgs_MT256x256x64_MI16x16x1_SN_CLR1_GSU0_GSUC0_GSUWGMRR0_K1_LBSPPA2048_LBSPPB2048_LPA64_LPB64_MIWT8_8_PLR1_SU0_SUM0_SUS0_SKXCCM8_VWA4_VWB4_WGM1_WGMXCC1_WGMXCCGn1
    SolutionIndex: 15
    SolutionNameMin: Cijk_Ailk_Bjlk_I8II_BH_UserArgs_MT256x256x64_MI16x16x1_SN_CLR1_GSU0_GSUC0_GSUWGMRR0_K1_LBSPPA2048_LBSPPB2048_LPA64_LPB0_MIWT8_8_PLR1_SU0_SUM0_SUS0_SKXCCM8_VWA4_VWB8_WGM1_WGMXCC1_WGMXCCGn1
    SolutionIndex: 16
    SolutionNameMin: Cijk_Ailk_Bjlk_I8II_BH_UserArgs_MT256x256x64_MI16x16x1_SN_CLR1_GSU0_GSUC0_GSUWGMRR0_K1_LBSPPA2048_LBSPPB2048_LPA64_LPB64_MIWT8_8_PLR1_SU0_SUM0_SUS0_SKXCCM8_VWA4_VWB4_WGM1_WGMXCC1_WGMXCCGn1
    SolutionIndex: 17
    SolutionNameMin: Cijk_Ailk_Bjlk_I8II_BH_UserArgs_MT256x256x64_MI16x16x1_SN_CLR1_GSU0_GSUC0_GSUWGMRR0_K1_LBSPPA2048_LBSPPB2048_LPA64_LPB0_MIWT8_8_PLR1_SU0_SUM0_SUS0_SKXCCM8_VWA4_VWB8_WGM1_WGMXCC1_WGMXCCGn1
    SolutionIndex: 18
    SolutionNameMin: Cijk_Ailk_Bjlk_I8II_BH_UserArgs_MT256x256x64_MI16x16x1_SN_CLR1_GSU0_GSUC0_GSUWGMRR0_K1_LBSPPA2048_LBSPPB2048_LPA64_LPB64_MIWT8_8_PLR1_SU0_SUM0_SUS0_SKXCCM8_VWA4_VWB4_WGM1_WGMXCC1_WGMXCCGn1
    SolutionIndex: 19
    SolutionNameMin: Cijk_Ailk_Bjlk_I8II_BH_UserArgs_MT256x256x64_MI16x16x1_SN_CLR1_GSU0_GSUC0_GSUWGMRR0_K1_LBSPPA2048_LBSPPB2048_LPA64_LPB0_MIWT8_8_PLR1_SU0_SUM0_SUS0_SKXCCM8_VWA4_VWB8_WGM1_WGMXCC1_WGMXCCGn1
    SolutionIndex: 20
    SolutionNameMin: Cijk_Ailk_Bjlk_I8II_BH_UserArgs_MT256x256x64_MI16x16x1_SN_CLR1_GSU0_GSUC0_GSUWGMRR0_K1_LBSPPA2048_LBSPPB2048_LPA64_LPB64_MIWT8_8_PLR1_SU0_SUM0_SUS0_SKXCCM8_VWA4_VWB4_WGM1_WGMXCC1_WGMXCCGn1
    SolutionIndex: 21
    SolutionNameMin: Cijk_Ailk_Bjlk_I8II_BH_UserArgs_MT256x256x64_MI16x16x1_SN_CLR1_GSU0_GSUC0_GSUWGMRR0_K1_LBSPPA2048_LBSPPB2048_LPA64_LPB64_MIWT8_8_PLR1_SU0_SUM0_SUS0_SKXCCM8_VWA4_VWB4_WGM4_WGMXCC1_WGMXCCGn1
    SolutionIndex: 22
    SolutionNameMin: Cijk_Ailk_Bjlk_I8II_BH_UserArgs_MT256x256x64_MI16x16x1_SN_CLR1_GSU0_GSUC0_GSUWGMRR0_K1_LBSPPA2048_LBSPPB2048_LPA64_LPB0_MIWT8_8_PLR1_SU0_SUM0_SUS0_SKXCCM8_VWA4_VWB8_WGM4_WGMXCC1_WGMXCCGn1
    SolutionIndex: 23
    SolutionNameMin: Cijk_Ailk_Bjlk_I8II_BH_UserArgs_MT256x256x64_MI16x16x1_SN_CLR1_GSU0_GSUC0_GSUWGMRR0_K1_LBSPPA2048_LBSPPB2048_LPA64_LPB64_MIWT8_8_PLR1_SU0_SUM0_SUS0_SKXCCM8_VWA4_VWB4_WGM4_WGMXCC1_WGMXCCGn1
    SolutionIndex: 24
    SolutionNameMin: Cijk_Ailk_Bjlk_I8II_BH_UserArgs_MT256x256x64_MI16x16x1_SN_CLR1_GSU0_GSUC0_GSUWGMRR0_K1_LBSPPA2048_LBSPPB2048_LPA64_LPB0_MIWT8_8_PLR1_SU0_SUM0_SUS0_SKXCCM8_VWA4_VWB8_WGM4_WGMXCC1_WGMXCCGn1
    SolutionIndex: 25
    SolutionNameMin: Cijk_Ailk_Bjlk_I8II_BH_UserArgs_MT256x256x64_MI16x16x1_SN_CLR1_GSU0_GSUC0_GSUWGMRR0_K1_LBSPPA2048_LBSPPB2048_LPA64_LPB0_MIWT8_8_PLR1_SU0_SUM0_SUS0_SKXCCM8_VWA4_VWB8_WGM4_WGMXCC1_WGMXCCGn1
    SolutionIndex: 26
    SolutionNameMin: Cijk_Ailk_Bjlk_I8II_BH_UserArgs_MT256x256x64_MI16x16x1_SN_CLR1_GSU0_GSUC0_GSUWGMRR0_K1_LBSPPA2048_LBSPPB2048_LPA64_LPB0_MIWT8_8_PLR1_SU0_SUM0_SUS0_SKXCCM8_VWA4_VWB8_WGM8_WGMXCC1_WGMXCCGn1
    SolutionIndex: 27
    SolutionNameMin: Cijk_Ailk_Bjlk_I8II_BH_UserArgs_MT256x256x64_MI16x16x1_SN_CLR1_GSU0_GSUC0_GSUWGMRR0_K1_LBSPPA2048_LBSPPB2048_LPA64_LPB64_MIWT8_8_PLR1_SU0_SUM0_SUS0_SKXCCM8_VWA4_VWB4_WGM8_WGMXCC1_WGMXCCGn1
    SolutionIndex: 28
    SolutionNameMin: Cijk_Ailk_Bjlk_I8II_BH_UserArgs_MT256x256x64_MI16x16x1_SN_CLR1_GSU0_GSUC0_GSUWGMRR0_K1_LBSPPA2048_LBSPPB2048_LPA64_LPB0_MIWT8_8_PLR1_SU0_SUM0_SUS0_SKXCCM8_VWA4_VWB8_WGM8_WGMXCC1_WGMXCCGn1
    SolutionIndex: 29
    SolutionNameMin: Cijk_Ailk_Bjlk_I8II_BH_UserArgs_MT256x256x64_MI16x16x1_SN_CLR1_GSU0_GSUC0_GSUWGMRR0_K1_LBSPPA2048_LBSPPB2048_LPA64_LPB0_MIWT8_8_PLR1_SU0_SUM0_SUS0_SKXCCM8_VWA4_VWB8_WGM8_WGMXCC1_WGMXCCGn1
    SolutionIndex: 30
    SolutionNameMin: Cijk_Ailk_Bjlk_I8II_BH_UserArgs_MT128x256x64_MI16x16x1_SN_CLR1_GSU0_GSUC0_GSUWGMRR0_K1_LBSPPA1024_LBSPPB2048_LPA64_LPB0_MIWT4_8_PLR1_SU0_SUM0_SUS0_SKXCCM8_VWA4_VWB8_WGM1_WGMXCC1_WGMXCCGn1
    SolutionIndex: 31
    SolutionNameMin: Cijk_Ailk_Bjlk_I8II_BH_UserArgs_MT128x256x64_MI16x16x1_SN_CLR1_GSU0_GSUC0_GSUWGMRR0_K1_LBSPPA1024_LBSPPB2048_LPA32_LPB0_MIWT4_8_PLR1_SU0_SUM0_SUS0_SKXCCM8_VWA2_VWB8_WGM1_WGMXCC1_WGMXCCGn1
    SolutionIndex: 32
    SolutionNameMin: Cijk_Ailk_Bjlk_I8II_BH_UserArgs_MT128x256x64_MI16x16x1_SN_CLR1_GSU0_GSUC0_GSUWGMRR0_K1_LBSPPA1024_LBSPPB2048_LPA64_LPB64_MIWT4_8_PLR1_SU0_SUM0_SUS0_SKXCCM8_VWA4_VWB4_WGM1_WGMXCC1_WGMXCCGn1
    SolutionIndex: 33
    SolutionNameMin: Cijk_Ailk_Bjlk_I8II_BH_UserArgs_MT128x256x64_MI16x16x1_SN_CLR1_GSU0_GSUC0_GSUWGMRR0_K1_LBSPPA1024_LBSPPB2048_LPA32_LPB0_MIWT4_8_PLR1_SU0_SUM0_SUS0_SKXCCM8_VWA2_VWB8_WGM1_WGMXCC1_WGMXCCGn1
    SolutionIndex: 34
    SolutionNameMin: Cijk_Ailk_Bjlk_I8II_BH_UserArgs_MT128x256x64_MI16x16x1_SN_CLR1_GSU0_GSUC0_GSUWGMRR0_K1_LBSPPA1024_LBSPPB2048_LPA64_LPB0_MIWT4_8_PLR1_SU0_SUM0_SUS0_SKXCCM8_VWA4_VWB8_WGM1_WGMXCC1_WGMXCCGn1
    SolutionIndex: 35
    SolutionNameMin: Cijk_Ailk_Bjlk_I8II_BH_UserArgs_MT128x256x64_MI16x16x1_SN_CLR1_GSU0_GSUC0_GSUWGMRR0_K1_LBSPPA1024_LBSPPB2048_LPA64_LPB0_MIWT4_8_PLR1_SU0_SUM0_SUS0_SKXCCM8_VWA4_VWB8_WGM1_WGMXCC1_WGMXCCGn1
    SolutionIndex: 36
    SolutionNameMin: Cijk_Ailk_Bjlk_I8II_BH_UserArgs_MT128x256x64_MI16x16x1_SN_CLR1_GSU0_GSUC0_GSUWGMRR0_K1_LBSPPA1024_LBSPPB2048_LPA64_LPB64_MIWT4_8_PLR1_SU0_SUM0_SUS0_SKXCCM8_VWA4_VWB4_WGM1_WGMXCC1_WGMXCCGn1
    SolutionIndex: 37
    SolutionNameMin: Cijk_Ailk_Bjlk_I8II_BH_UserArgs_MT128x256x64_MI16x16x1_SN_CLR1_GSU0_GSUC0_GSUWGMRR0_K1_LBSPPA1024_LBSPPB2048_LPA64_LPB0_MIWT4_8_PLR1_SU0_SUM0_SUS0_SKXCCM8_VWA4_VWB8_WGM1_WGMXCC1_WGMXCCGn1
    SolutionIndex: 38
    SolutionNameMin: Cijk_Ailk_Bjlk_I8II_BH_UserArgs_MT128x256x64_MI16x16x1_SN_CLR1_GSU0_GSUC0_GSUWGMRR0_K1_LBSPPA1024_LBSPPB2048_LPA64_LPB0_MIWT4_8_PLR1_SU0_SUM0_SUS0_SKXCCM8_VWA4_VWB8_WGM4_WGMXCC1_WGMXCCGn1
    SolutionIndex: 39
    SolutionNameMin: Cijk_Ailk_Bjlk_I8II_BH_UserArgs_MT128x256x64_MI16x16x1_SN_CLR1_GSU0_GSUC0_GSUWGMRR0_K1_LBSPPA1024_LBSPPB2048_LPA64_LPB64_MIWT4_8_PLR1_SU0_SUM0_SUS0_SKXCCM8_VWA4_VWB4_WGM4_WGMXCC1_WGMXCCGn1
    SolutionIndex: 40
    SolutionNameMin: Cijk_Ailk_Bjlk_I8II_BH_UserArgs_MT128x256x64_MI16x16x1_SN_CLR1_GSU0_GSUC0_GSUWGMRR0_K1_LBSPPA1024_LBSPPB2048_LPA64_LPB0_MIWT4_8_PLR1_SU0_SUM0_SUS0_SKXCCM8_VWA4_VWB8_WGM4_WGMXCC1_WGMXCCGn1
    SolutionIndex: 41
    SolutionNameMin: Cijk_Ailk_Bjlk_I8II_BH_UserArgs_MT128x256x64_MI16x16x1_SN_CLR1_GSU0_GSUC0_GSUWGMRR0_K1_LBSPPA1024_LBSPPB2048_LPA64_LPB0_MIWT4_8_PLR1_SU0_SUM0_SUS0_SKXCCM8_VWA4_VWB8_WGM4_WGMXCC1_WGMXCCGn1
    SolutionIndex: 42
    SolutionNameMin: Cijk_Ailk_Bjlk_I8II_BH_UserArgs_MT128x256x64_MI16x16x1_SN_CLR1_GSU0_GSUC0_GSUWGMRR0_K1_LBSPPA1024_LBSPPB2048_LPA64_LPB0_MIWT4_8_PLR1_SU0_SUM0_SUS0_SKXCCM8_VWA4_VWB8_WGM8_WGMXCC1_WGMXCCGn1
    SolutionIndex: 43
    SolutionNameMin: Cijk_Ailk_Bjlk_I8II_BH_UserArgs_MT128x256x64_MI16x16x1_SN_CLR1_GSU0_GSUC0_GSUWGMRR0_K1_LBSPPA1024_LBSPPB2048_LPA64_LPB64_MIWT4_8_PLR1_SU0_SUM0_SUS0_SKXCCM8_VWA4_VWB4_WGM8_WGMXCC1_WGMXCCGn1
    SolutionIndex: 44
    SolutionNameMin: Cijk_Ailk_Bjlk_I8II_BH_UserArgs_MT128x256x64_MI16x16x1_SN_CLR1_GSU0_GSUC0_GSUWGMRR0_K1_LBSPPA1024_LBSPPB2048_LPA64_LPB0_MIWT4_8_PLR1_SU0_SUM0_SUS0_SKXCCM8_VWA4_VWB8_WGM8_WGMXCC1_WGMXCCGn1
    SolutionIndex: 45
    SolutionNameMin: Cijk_Ailk_Bjlk_I8II_BH_UserArgs_MT128x256x64_MI16x16x1_SN_CLR1_GSU0_GSUC0_GSUWGMRR0_K1_LBSPPA1024_LBSPPB2048_LPA64_LPB0_MIWT4_8_PLR1_SU0_SUM0_SUS0_SKXCCM8_VWA4_VWB8_WGM8_WGMXCC1_WGMXCCGn1
    SolutionIndex: 46
    SolutionNameMin: Cijk_Ailk_Bjlk_I8II_BH_UserArgs_MT256x128x64_MI16x16x1_SN_CLR1_GSU0_GSUC0_GSUWGMRR0_K1_LBSPPA2048_LBSPPB1024_LPA32_LPB64_MIWT8_4_PLR1_SU0_SUM0_SUS0_SKXCCM8_VWA2_VWB4_WGM1_WGMXCC1_WGMXCCGn1
    SolutionIndex: 47
    SolutionNameMin: Cijk_Ailk_Bjlk_I8II_BH_UserArgs_MT256x128x64_MI16x16x1_SN_CLR1_GSU0_GSUC0_GSUWGMRR0_K1_LBSPPA2048_LBSPPB1024_LPA32_LPB64_MIWT8_4_PLR1_SU0_SUM0_SUS0_SKXCCM8_VWA2_VWB4_WGM1_WGMXCC1_WGMXCCGn1
    SolutionIndex: 48
    SolutionNameMin: Cijk_Ailk_Bjlk_I8II_BH_UserArgs_MT256x128x64_MI16x16x1_SN_CLR1_GSU0_GSUC0_GSUWGMRR0_K1_LBSPPA2048_LBSPPB1024_LPA32_LPB64_MIWT8_4_PLR1_SU0_SUM0_SUS0_SKXCCM8_VWA2_VWB4_WGM4_WGMXCC1_WGMXCCGn1
    SolutionIndex: 49
    SolutionNameMin: Cijk_Ailk_Bjlk_I8II_BH_UserArgs_MT256x128x64_MI16x16x1_SN_CLR1_GSU0_GSUC0_GSUWGMRR0_K1_LBSPPA2048_LBSPPB1024_LPA64_LPB64_MIWT8_4_PLR1_SU0_SUM0_SUS0_SKXCCM8_VWA4_VWB4_WGM8_WGMXCC1_WGMXCCGn1
    SolutionIndex: 50
    SolutionNameMin: Cijk_Ailk_Bjlk_I8II_BH_UserArgs_MT256x128x64_MI16x16x1_SN_CLR1_GSU0_GSUC0_GSUWGMRR0_K1_LBSPPA2048_LBSPPB1024_LPA64_LPB64_MIWT8_4_PLR1_SU0_SUM0_SUS0_SKXCCM8_VWA4_VWB4_WGM8_WGMXCC1_WGMXCCGn1
    SolutionIndex: 51
    SolutionNameMin: Cijk_Ailk_Bjlk_I8II_BH_UserArgs_MT128x128x64_MI16x16x1_SN_CLR1_GSU0_GSUC0_GSUWGMRR0_K1_LBSPPA1024_LBSPPB1024_LPA64_LPB32_MIWT4_4_PLR1_SU0_SUM0_SUS0_SKXCCM8_VWA4_VWB2_WGM1_WGMXCC1_WGMXCCGn1
    SolutionIndex: 52
    SolutionNameMin: Cijk_Ailk_Bjlk_I8II_BH_UserArgs_MT128x128x64_MI16x16x1_SN_CLR1_GSU0_GSUC0_GSUWGMRR0_K1_LBSPPA1024_LBSPPB1024_LPA64_LPB64_MIWT4_4_PLR1_SU0_SUM0_SUS0_SKXCCM8_VWA4_VWB4_WGM1_WGMXCC1_WGMXCCGn1
    SolutionIndex: 53
    SolutionNameMin: Cijk_Ailk_Bjlk_I8II_BH_UserArgs_MT128x128x64_MI16x16x1_SN_CLR1_GSU0_GSUC0_GSUWGMRR0_K1_LBSPPA1024_LBSPPB1024_LPA64_LPB64_MIWT4_4_PLR1_SU0_SUM0_SUS0_SKXCCM8_VWA4_VWB4_WGM4_WGMXCC1_WGMXCCGn1
    SolutionIndex: 54
    SolutionNameMin: Cijk_Ailk_Bjlk_I8II_BH_UserArgs_MT128x128x64_MI16x16x1_SN_CLR1_GSU0_GSUC0_GSUWGMRR0_K1_LBSPPA1024_LBSPPB1024_LPA64_LPB64_MIWT4_4_PLR1_SU0_SUM0_SUS0_SKXCCM8_VWA4_VWB4_WGM4_WGMXCC1_WGMXCCGn1
    SolutionIndex: 55
    SolutionNameMin: Cijk_Ailk_Bjlk_I8II_BH_UserArgs_MT128x128x64_MI16x16x1_SN_CLR1_GSU0_GSUC0_GSUWGMRR0_K1_LBSPPA1024_LBSPPB1024_LPA64_LPB32_MIWT4_4_PLR1_SU0_SUM0_SUS0_SKXCCM8_VWA4_VWB2_WGM8_WGMXCC1_WGMXCCGn1
    SolutionIndex: 56
    SolutionNameMin: Cijk_Ailk_Bjlk_I8II_BH_UserArgs_MT128x128x64_MI16x16x1_SN_CLR1_GSU0_GSUC0_GSUWGMRR0_K1_LBSPPA1024_LBSPPB1024_LPA64_LPB64_MIWT4_4_PLR1_SU0_SUM0_SUS0_SKXCCM8_VWA4_VWB4_WGM8_WGMXCC1_WGMXCCGn1
    SolutionIndex: 57
    SolutionNameMin: Cijk_Ailk_Bjlk_I8II_BH_UserArgs_MT64x128x64_MI16x16x1_SN_CLR1_GSU0_GSUC0_GSUWGMRR0_K1_LBSPPA512_LBSPPB1024_LPA16_LPB64_MIWT2_4_PLR1_SU0_SUM0_SUS0_SKXCCM8_VWA1_VWB4_WGM1_WGMXCC1_WGMXCCGn1
    SolutionIndex: 58
    SolutionNameMin: Cijk_Ailk_Bjlk_I8II_BH_UserArgs_MT64x128x64_MI16x16x1_SN_CLR1_GSU0_GSUC0_GSUWGMRR0_K1_LBSPPA512_LBSPPB1024_LPA32_LPB64_MIWT2_4_PLR1_SU0_SUM0_SUS0_SKXCCM8_VWA2_VWB4_WGM1_WGMXCC1_WGMXCCGn1
    SolutionIndex: 59
    SolutionNameMin: Cijk_Ailk_Bjlk_I8II_BH_UserArgs_MT64x128x64_MI16x16x1_SN_CLR1_GSU0_GSUC0_GSUWGMRR0_K1_LBSPPA512_LBSPPB1024_LPA32_LPB64_MIWT2_4_PLR1_SU0_SUM0_SUS0_SKXCCM8_VWA2_VWB4_WGM1_WGMXCC1_WGMXCCGn1
    SolutionIndex: 60
    SolutionNameMin: Cijk_Ailk_Bjlk_I8II_BH_UserArgs_MT64x128x64_MI16x16x1_SN_CLR1_GSU0_GSUC0_GSUWGMRR0_K1_LBSPPA512_LBSPPB1024_LPA32_LPB64_MIWT2_4_PLR1_SU0_SUM0_SUS0_SKXCCM8_VWA2_VWB4_WGM4_WGMXCC1_WGMXCCGn1
    SolutionIndex: 61
    SolutionNameMin: Cijk_Ailk_Bjlk_I8II_BH_UserArgs_MT128x64x64_MI16x16x1_SN_CLR1_GSU0_GSUC0_GSUWGMRR0_K1_LBSPPA1024_LBSPPB512_LPA64_LPB32_MIWT4_2_PLR1_SU0_SUM0_SUS0_SKXCCM8_VWA4_VWB2_WGM1_WGMXCC1_WGMXCCGn1
    SolutionIndex: 62
    SolutionNameMin: Cijk_Ailk_Bjlk_I8II_BH_UserArgs_MT128x64x64_MI16x16x1_SN_CLR1_GSU0_GSUC0_GSUWGMRR0_K1_LBSPPA1024_LBSPPB512_LPA64_LPB32_MIWT4_2_PLR1_SU0_SUM0_SUS0_SKXCCM8_VWA4_VWB2_WGM1_WGMXCC1_WGMXCCGn1
    SolutionIndex: 63
    SolutionNameMin: Cijk_Ailk_Bjlk_I8II_BH_UserArgs_MT128x64x64_MI16x16x1_SN_CLR0_GSU0_GSUC0_GSUWGMRR0_K1_LBSPPA1024_LBSPPB512_LPA64_LPB32_MIWT4_2_PLR0_SU0_SUM0_SUS0_SKXCCM8_VWA4_VWB2_WGM1_WGMXCC1_WGMXCCGn1
    SolutionIndex: 64
    SolutionNameMin: Cijk_Ailk_Bjlk_I8II_BH_UserArgs_MT128x64x64_MI16x16x1_SN_CLR1_GSU0_GSUC0_GSUWGMRR0_K1_LBSPPA1024_LBSPPB512_LPA64_LPB32_MIWT4_2_PLR1_SU0_SUM0_SUS0_SKXCCM8_VWA4_VWB2_WGM4_WGMXCC1_WGMXCCGn1
    SolutionIndex: 65
    SolutionNameMin: Cijk_Ailk_Bjlk_I8II_BH_UserArgs_MT128x64x64_MI16x16x1_SN_CLR1_GSU0_GSUC0_GSUWGMRR0_K1_LBSPPA1024_LBSPPB512_LPA64_LPB32_MIWT4_2_PLR1_SU0_SUM0_SUS0_SKXCCM8_VWA4_VWB2_WGM4_WGMXCC1_WGMXCCGn1
    SolutionIndex: 66
    SolutionNameMin: Cijk_Ailk_Bjlk_I8II_BH_UserArgs_MT128x64x64_MI16x16x1_SN_CLR1_GSU0_GSUC0_GSUWGMRR0_K1_LBSPPA1024_LBSPPB512_LPA64_LPB32_MIWT4_2_PLR1_SU0_SUM0_SUS0_SKXCCM8_VWA4_VWB2_WGM8_WGMXCC1_WGMXCCGn1
    SolutionIndex: 67
    SolutionNameMin: Cijk_Ailk_Bjlk_I8II_BH_UserArgs_MT128x64x64_MI16x16x1_SN_CLR1_GSU0_GSUC0_GSUWGMRR0_K1_LBSPPA1024_LBSPPB512_LPA64_LPB32_MIWT4_2_PLR1_SU0_SUM0_SUS0_SKXCCM8_VWA4_VWB2_WGM8_WGMXCC1_WGMXCCGn1
    SolutionIndex: 68
    SolutionNameMin: Cijk_Ailk_Bjlk_I8II_BH_UserArgs_MT128x32x64_MI16x16x1_SN_CLR1_GSU0_GSUC0_GSUWGMRR0_K1_LBSPPA1024_LBSPPB256_LPA64_LPB16_MIWT4_1_PLR1_SU0_SUM0_SUS0_SKXCCM8_VWA4_VWB1_WGM1_WGMXCC1_WGMXCCGn1
    SolutionIndex: 69
    SolutionNameMin: Cijk_Ailk_Bjlk_I8II_BH_UserArgs_MT128x32x64_MI16x16x1_SN_CLR1_GSU0_GSUC0_GSUWGMRR0_K1_LBSPPA1024_LBSPPB256_LPA64_LPB16_MIWT4_1_PLR1_SU0_SUM0_SUS0_SKXCCM8_VWA4_VWB1_WGM1_WGMXCC1_WGMXCCGn1
    SolutionIndex: 70
    SolutionNameMin: Cijk_Ailk_Bjlk_I8II_BH_UserArgs_MT128x32x64_MI16x16x1_SN_CLR1_GSU0_GSUC0_GSUWGMRR0_K1_LBSPPA1024_LBSPPB256_LPA64_LPB16_MIWT4_1_PLR1_SU0_SUM0_SUS0_SKXCCM8_VWA4_VWB1_WGM1_WGMXCC1_WGMXCCGn1
    SolutionIndex: 71
    SolutionNameMin: Cijk_Ailk_Bjlk_I8II_BH_UserArgs_MT128x32x64_MI16x16x1_SN_CLR1_GSU0_GSUC0_GSUWGMRR0_K1_LBSPPA1024_LBSPPB256_LPA64_LPB16_MIWT4_1_PLR1_SU0_SUM0_SUS0_SKXCCM8_VWA4_VWB1_WGM4_WGMXCC1_WGMXCCGn1
    SolutionIndex: 72
    SolutionNameMin: Cijk_Ailk_Bjlk_I8II_BH_UserArgs_MT64x64x64_MI16x16x1_SN_CLR1_GSU0_GSUC0_GSUWGMRR0_K1_LBSPPA512_LBSPPB512_LPA32_LPB32_MIWT2_2_PLR1_SU0_SUM0_SUS0_SKXCCM8_VWA2_VWB2_WGM1_WGMXCC1_WGMXCCGn1
    SolutionIndex: 73
    SolutionNameMin: Cijk_Ailk_Bjlk_I8II_BH_UserArgs_MT64x64x64_MI16x16x1_SN_CLR1_GSU0_GSUC0_GSUWGMRR0_K1_LBSPPA512_LBSPPB512_LPA32_LPB32_MIWT2_2_PLR1_SU0_SUM0_SUS0_SKXCCM8_VWA2_VWB2_WGM1_WGMXCC1_WGMXCCGn1
    SolutionIndex: 74
    SolutionNameMin: Cijk_Ailk_Bjlk_I8II_BH_UserArgs_MT64x64x64_MI16x16x1_SN_CLR1_GSU0_GSUC0_GSUWGMRR0_K1_LBSPPA512_LBSPPB512_LPA32_LPB32_MIWT2_2_PLR1_SU0_SUM0_SUS0_SKXCCM8_VWA2_VWB2_WGM1_WGMXCC1_WGMXCCGn1
    SolutionIndex: 75
    SolutionNameMin: Cijk_Ailk_Bjlk_I8II_BH_UserArgs_MT64x64x64_MI16x16x1_SN_CLR1_GSU0_GSUC0_GSUWGMRR0_K1_LBSPPA512_LBSPPB512_LPA32_LPB32_MIWT2_2_PLR1_SU0_SUM0_SUS0_SKXCCM8_VWA2_VWB2_WGM1_WGMXCC1_WGMXCCGn1
    SolutionIndex: 76
    SolutionNameMin: Cijk_Ailk_Bjlk_I8II_BH_UserArgs_MT64x64x64_MI16x16x1_SN_CLR1_GSU0_GSUC0_GSUWGMRR0_K1_LBSPPA512_LBSPPB512_LPA32_LPB32_MIWT2_2_PLR1_SU0_SUM0_SUS0_SKXCCM8_VWA2_VWB2_WGM4_WGMXCC1_WGMXCCGn1
    SolutionIndex: 77
    SolutionNameMin: Cijk_Ailk_Bjlk_I8II_BH_UserArgs_MT64x64x64_MI16x16x1_SN_CLR1_GSU0_GSUC0_GSUWGMRR0_K1_LBSPPA512_LBSPPB512_LPA32_LPB32_MIWT2_2_PLR1_SU0_SUM0_SUS0_SKXCCM8_VWA2_VWB2_WGM8_WGMXCC1_WGMXCCGn1
    SolutionIndex: 78
    SolutionNameMin: Cijk_Ailk_Bjlk_I8II_BH_UserArgs_MT32x64x64_MI16x16x1_SN_CLR1_GSU0_GSUC0_GSUWGMRR0_K1_LBSPPA256_LBSPPB512_LPA16_LPB32_MIWT1_2_PLR1_SU0_SUM0_SUS0_SKXCCM8_VWA1_VWB2_WGM1_WGMXCC1_WGMXCCGn1
    SolutionIndex: 79
    SolutionNameMin: Cijk_Ailk_Bjlk_I8II_BH_UserArgs_MT32x64x64_MI16x16x1_SN_CLR1_GSU0_GSUC0_GSUWGMRR0_K1_LBSPPA256_LBSPPB512_LPA16_LPB32_MIWT1_2_PLR1_SU0_SUM0_SUS0_SKXCCM8_VWA1_VWB2_WGM1_WGMXCC1_WGMXCCGn1
    SolutionIndex: 80
    SolutionNameMin: Cijk_Ailk_Bjlk_I8II_BH_UserArgs_MT32x64x64_MI16x16x1_SN_CLR1_GSU0_GSUC0_GSUWGMRR0_K1_LBSPPA256_LBSPPB512_LPA16_LPB32_MIWT1_2_PLR1_SU0_SUM0_SUS0_SKXCCM8_VWA1_VWB2_WGM8_WGMXCC1_WGMXCCGn1
    SolutionIndex: 81
    SolutionNameMin: Cijk_Ailk_Bjlk_I8II_BH_UserArgs_MT64x32x64_MI16x16x1_SN_CLR1_GSU0_GSUC0_GSUWGMRR0_K1_LBSPPA512_LBSPPB256_LPA32_LPB16_MIWT2_1_PLR1_SU0_SUM0_SUS0_SKXCCM8_VWA2_VWB1_WGM1_WGMXCC1_WGMXCCGn1
    SolutionIndex: 82
    SolutionNameMin: Cijk_Ailk_Bjlk_I8II_BH_UserArgs_MT64x32x64_MI16x16x1_SN_CLR1_GSU0_GSUC0_GSUWGMRR0_K1_LBSPPA512_LBSPPB256_LPA32_LPB16_MIWT2_1_PLR1_SU0_SUM0_SUS0_SKXCCM8_VWA2_VWB1_WGM1_WGMXCC1_WGMXCCGn1
    SolutionIndex: 83
    SolutionNameMin: Cijk_Ailk_Bjlk_I8II_BH_UserArgs_MT32x32x64_MI16x16x1_SN_CLR1_GSU0_GSUC0_GSUWGMRR0_K1_LBSPPA256_LBSPPB256_LPA16_LPB16_MIWT1_1_PLR1_SU0_SUM0_SUS0_SKXCCM8_VWA1_VWB1_WGM1_WGMXCC1_WGMXCCGn1
    SolutionIndex: 84
    SolutionNameMin: Cijk_Ailk_Bjlk_I8II_BH_UserArgs_MT32x32x64_MI16x16x1_SN_CLR1_GSU0_GSUC0_GSUWGMRR0_K1_LBSPPA256_LBSPPB256_LPA16_LPB16_MIWT1_1_PLR1_SU0_SUM0_SUS0_SKXCCM8_VWA1_VWB1_WGM1_WGMXCC1_WGMXCCGn1
    SolutionIndex: 85
    SolutionNameMin: Cijk_Ailk_Bjlk_I8II_BH_UserArgs_MT32x32x64_MI16x16x1_SN_CLR1_GSU0_GSUC0_GSUWGMRR0_K1_LBSPPA256_LBSPPB256_LPA16_LPB16_MIWT1_1_PLR1_SU0_SUM0_SUS0_SKXCCM8_VWA1_VWB1_WGM1_WGMXCC1_WGMXCCGn1
    SolutionIndex: 86
    SolutionNameMin: Cijk_Ailk_Bjlk_I8II_BH_UserArgs_MT32x32x64_MI16x16x1_SN_CLR1_GSU0_GSUC0_GSUWGMRR0_K1_LBSPPA256_LBSPPB256_LPA16_LPB16_MIWT1_1_PLR1_SU0_SUM0_SUS0_SKXCCM8_VWA1_VWB1_WGM1_WGMXCC1_WGMXCCGn1
    SolutionIndex: 87
    SolutionNameMin: Cijk_Ailk_Bjlk_I8II_BH_UserArgs_MT32x32x64_MI16x16x1_SN_CLR1_GSU0_GSUC0_GSUWGMRR0_K1_LBSPPA256_LBSPPB256_LPA16_LPB16_MIWT1_1_PLR1_SU0_SUM0_SUS0_SKXCCM8_VWA1_VWB1_WGM1_WGMXCC1_WGMXCCGn1
    SolutionIndex: 88
    SolutionNameMin: Cijk_Ailk_Bjlk_I8II_BH_UserArgs_MT32x32x64_MI16x16x1_SN_CLR1_GSU0_GSUC0_GSUWGMRR0_K1_LBSPPA256_LBSPPB256_LPA16_LPB16_MIWT1_1_PLR1_SU0_SUM0_SUS0_SKXCCM8_VWA1_VWB1_WGM1_WGMXCC1_WGMXCCGn1
    SolutionIndex: 89
    SolutionNameMin: Cijk_Ailk_Bjlk_I8II_BH_UserArgs_MT32x32x64_MI16x16x1_SN_CLR0_GSU0_GSUC0_GSUWGMRR0_K1_LBSPPA256_LBSPPB256_LPA16_LPB16_MIWT1_1_PLR0_SU0_SUM0_SUS0_SKXCCM8_VWA1_VWB1_WGM1_WGMXCC1_WGMXCCGn1
    SolutionIndex: 90
    SolutionNameMin: Cijk_Ailk_Bjlk_I8II_BH_UserArgs_MT32x32x64_MI16x16x1_SN_CLR0_GSU0_GSUC0_GSUWGMRR0_K1_LBSPPA256_LBSPPB256_LPA16_LPB16_MIWT1_1_PLR0_SU0_SUM0_SUS0_SKXCCM8_VWA1_VWB1_WGM1_WGMXCC1_WGMXCCGn1
    SolutionIndex: 91
    SolutionNameMin: Cijk_Ailk_Bjlk_I8II_BH_UserArgs_MT32x32x64_MI16x16x1_SN_CLR0_GSU0_GSUC0_GSUWGMRR0_K1_LBSPPA256_LBSPPB256_LPA16_LPB16_MIWT1_1_PLR0_SU0_SUM0_SUS0_SKXCCM8_VWA1_VWB1_WGM1_WGMXCC1_WGMXCCGn1
    SolutionIndex: 92
    SolutionNameMin: Cijk_Ailk_Bjlk_I8II_BH_UserArgs_MT128x256x128_MI16x16x1_SN_CLR1_GSU0_GSUC0_GSUWGMRR0_K1_LBSPPA1024_LBSPPB2048_LPA64_LPB0_MIWT4_8_PLR1_SU0_SUM0_SUS0_SKXCCM8_VWA4_VWB8_WGM1_WGMXCC1_WGMXCCGn1
    SolutionIndex: 93
    SolutionNameMin: Cijk_Ailk_Bjlk_I8II_BH_UserArgs_MT128x256x128_MI16x16x1_SN_CLR1_GSU0_GSUC0_GSUWGMRR0_K1_LBSPPA1024_LBSPPB2048_LPA64_LPB0_MIWT4_8_PLR1_SU0_SUM0_SUS0_SKXCCM8_VWA4_VWB8_WGM4_WGMXCC1_WGMXCCGn1
    SolutionIndex: 94
    SolutionNameMin: Cijk_Ailk_Bjlk_I8II_BH_UserArgs_MT128x256x128_MI16x16x1_SN_CLR1_GSU0_GSUC0_GSUWGMRR0_K1_LBSPPA1024_LBSPPB2048_LPA64_LPB0_MIWT4_8_PLR1_SU0_SUM0_SUS0_SKXCCM8_VWA4_VWB8_WGM4_WGMXCC1_WGMXCCGn1
    SolutionIndex: 95
    SolutionNameMin: Cijk_Ailk_Bjlk_I8II_BH_UserArgs_MT128x256x128_MI16x16x1_SN_CLR1_GSU0_GSUC0_GSUWGMRR0_K1_LBSPPA1024_LBSPPB2048_LPA64_LPB0_MIWT4_8_PLR1_SU0_SUM0_SUS0_SKXCCM8_VWA4_VWB8_WGM8_WGMXCC1_WGMXCCGn1
    SolutionIndex: 96
    SolutionNameMin: Cijk_Ailk_Bjlk_I8II_BH_UserArgs_MT256x128x128_MI16x16x1_SN_CLR1_GSU0_GSUC0_GSUWGMRR0_K1_LBSPPA2048_LBSPPB1024_LPA64_LPB64_MIWT8_4_PLR1_SU0_SUM0_SUS0_SKXCCM8_VWA4_VWB4_WGM1_WGMXCC1_WGMXCCGn1
    SolutionIndex: 97
    SolutionNameMin: Cijk_Ailk_Bjlk_I8II_BH_UserArgs_MT256x128x128_MI16x16x1_SN_CLR1_GSU0_GSUC0_GSUWGMRR0_K1_LBSPPA2048_LBSPPB1024_LPA64_LPB64_MIWT8_4_PLR1_SU0_SUM0_SUS0_SKXCCM8_VWA4_VWB4_WGM8_WGMXCC1_WGMXCCGn1
    SolutionIndex: 98
    SolutionNameMin: Cijk_Ailk_Bjlk_I8II_BH_UserArgs_MT256x128x128_MI16x16x1_SN_CLR1_GSU0_GSUC0_GSUWGMRR0_K1_LBSPPA2048_LBSPPB1024_LPA64_LPB64_MIWT8_4_PLR2_SU0_SUM0_SUS0_SKXCCM8_VWA4_VWB4_WGM8_WGMXCC1_WGMXCCGn1
    SolutionIndex: 99
    SolutionNameMin: Cijk_Ailk_Bjlk_I8II_BH_UserArgs_MT128x128x128_MI16x16x1_SN_CLR1_GSU0_GSUC0_GSUWGMRR0_K1_LBSPPA1024_LBSPPB1024_LPA64_LPB64_MIWT4_4_PLR1_SU0_SUM0_SUS0_SKXCCM8_VWA4_VWB4_WGM1_WGMXCC1_WGMXCCGn1
    SolutionIndex: 100
    SolutionNameMin: Cijk_Ailk_Bjlk_I8II_BH_UserArgs_MT128x128x128_MI16x16x1_SN_CLR1_GSU0_GSUC0_GSUWGMRR0_K1_LBSPPA1024_LBSPPB1024_LPA64_LPB64_MIWT4_4_PLR1_SU0_SUM0_SUS0_SKXCCM8_VWA4_VWB4_WGM1_WGMXCC1_WGMXCCGn1
    SolutionIndex: 101
    SolutionNameMin: Cijk_Ailk_Bjlk_I8II_BH_UserArgs_MT128x128x128_MI16x16x1_SN_CLR1_GSU0_GSUC0_GSUWGMRR0_K1_LBSPPA1024_LBSPPB1024_LPA64_LPB64_MIWT4_4_PLR2_SU0_SUM0_SUS0_SKXCCM8_VWA4_VWB4_WGM1_WGMXCC1_WGMXCCGn1
    SolutionIndex: 102
    SolutionNameMin: Cijk_Ailk_Bjlk_I8II_BH_UserArgs_MT128x128x128_MI16x16x1_SN_CLR1_GSU0_GSUC0_GSUWGMRR0_K1_LBSPPA1024_LBSPPB1024_LPA64_LPB64_MIWT4_4_PLR2_SU0_SUM0_SUS0_SKXCCM8_VWA4_VWB4_WGM1_WGMXCC1_WGMXCCGn1
    SolutionIndex: 103
    SolutionNameMin: Cijk_Ailk_Bjlk_I8II_BH_UserArgs_MT128x128x128_MI16x16x1_SN_CLR1_GSU0_GSUC0_GSUWGMRR0_K1_LBSPPA1024_LBSPPB1024_LPA64_LPB64_MIWT4_4_PLR2_SU0_SUM0_SUS0_SKXCCM8_VWA4_VWB4_WGM1_WGMXCC1_WGMXCCGn1
    SolutionIndex: 104
    SolutionNameMin: Cijk_Ailk_Bjlk_I8II_BH_UserArgs_MT128x128x128_MI16x16x1_SN_CLR1_GSU0_GSUC0_GSUWGMRR0_K1_LBSPPA1024_LBSPPB1024_LPA64_LPB64_MIWT4_4_PLR1_SU0_SUM0_SUS0_SKXCCM8_VWA4_VWB4_WGM4_WGMXCC1_WGMXCCGn1
    SolutionIndex: 105
    SolutionNameMin: Cijk_Ailk_Bjlk_I8II_BH_UserArgs_MT128x128x128_MI16x16x1_SN_CLR1_GSU0_GSUC0_GSUWGMRR0_K1_LBSPPA1024_LBSPPB1024_LPA64_LPB64_MIWT4_4_PLR2_SU0_SUM0_SUS0_SKXCCM8_VWA4_VWB4_WGM4_WGMXCC1_WGMXCCGn1
    SolutionIndex: 106
    SolutionNameMin: Cijk_Ailk_Bjlk_I8II_BH_UserArgs_MT128x128x128_MI16x16x1_SN_CLR1_GSU0_GSUC0_GSUWGMRR0_K1_LBSPPA1024_LBSPPB1024_LPA64_LPB64_MIWT4_4_PLR1_SU0_SUM0_SUS0_SKXCCM8_VWA4_VWB4_WGM8_WGMXCC1_WGMXCCGn1
    SolutionIndex: 107
    SolutionNameMin: Cijk_Ailk_Bjlk_I8II_BH_UserArgs_MT128x128x128_MI16x16x1_SN_CLR1_GSU0_GSUC0_GSUWGMRR0_K1_LBSPPA1024_LBSPPB1024_LPA64_LPB64_MIWT4_4_PLR2_SU0_SUM0_SUS0_SKXCCM8_VWA4_VWB4_WGM8_WGMXCC1_WGMXCCGn1
    SolutionIndex: 108
    SolutionNameMin: Cijk_Ailk_Bjlk_I8II_BH_UserArgs_MT128x128x128_MI16x16x1_SN_CLR1_GSU0_GSUC0_GSUWGMRR0_K1_LBSPPA1024_LBSPPB1024_LPA64_LPB64_MIWT4_4_PLR2_SU0_SUM0_SUS0_SKXCCM8_VWA4_VWB4_WGM8_WGMXCC1_WGMXCCGn1
    SolutionIndex: 109
    SolutionNameMin: Cijk_Ailk_Bjlk_I8II_BH_UserArgs_MT128x64x128_MI16x16x1_SN_CLR1_GSU0_GSUC0_GSUWGMRR0_K1_LBSPPA1024_LBSPPB512_LPA64_LPB32_MIWT4_2_PLR2_SU0_SUM0_SUS0_SKXCCM8_VWA4_VWB2_WGM1_WGMXCC1_WGMXCCGn1
    SolutionIndex: 110
    SolutionNameMin: Cijk_Ailk_Bjlk_I8II_BH_UserArgs_MT128x64x128_MI16x16x1_SN_CLR1_GSU0_GSUC0_GSUWGMRR0_K1_LBSPPA1024_LBSPPB512_LPA64_LPB32_MIWT4_2_PLR2_SU0_SUM0_SUS0_SKXCCM8_VWA4_VWB2_WGM4_WGMXCC1_WGMXCCGn1
    SolutionIndex: 111
    SolutionNameMin: Cijk_Ailk_Bjlk_I8II_BH_UserArgs_MT128x64x128_MI16x16x1_SN_CLR1_GSU0_GSUC0_GSUWGMRR0_K1_LBSPPA1024_LBSPPB512_LPA64_LPB32_MIWT4_2_PLR2_SU0_SUM0_SUS0_SKXCCM8_VWA4_VWB2_WGM8_WGMXCC1_WGMXCCGn1
    SolutionIndex: 112
    SolutionNameMin: Cijk_Ailk_Bjlk_I8II_BH_UserArgs_MT128x32x128_MI16x16x1_SN_CLR1_GSU0_GSUC0_GSUWGMRR0_K1_LBSPPA1024_LBSPPB256_LPA64_LPB16_MIWT4_1_PLR1_SU0_SUM0_SUS0_SKXCCM8_VWA4_VWB1_WGM1_WGMXCC1_WGMXCCGn1
    SolutionIndex: 113
    SolutionNameMin: Cijk_Ailk_Bjlk_I8II_BH_UserArgs_MT128x32x128_MI16x16x1_SN_CLR1_GSU0_GSUC0_GSUWGMRR0_K1_LBSPPA1024_LBSPPB256_LPA64_LPB16_MIWT4_1_PLR2_SU0_SUM0_SUS0_SKXCCM8_VWA4_VWB1_WGM8_WGMXCC1_WGMXCCGn1
    SolutionIndex: 114
    SolutionNameMin: Cijk_Ailk_Bjlk_I8II_BH_UserArgs_MT64x64x128_MI16x16x1_SN_CLR1_GSU0_GSUC0_GSUWGMRR0_K1_LBSPPA512_LBSPPB512_LPA32_LPB32_MIWT2_2_PLR1_SU0_SUM0_SUS0_SKXCCM8_VWA2_VWB2_WGM1_WGMXCC1_WGMXCCGn1
    SolutionIndex: 115
    SolutionNameMin: Cijk_Ailk_Bjlk_I8II_BH_UserArgs_MT64x64x128_MI16x16x1_SN_CLR1_GSU0_GSUC0_GSUWGMRR0_K1_LBSPPA512_LBSPPB512_LPA32_LPB32_MIWT2_2_PLR2_SU0_SUM0_SUS0_SKXCCM8_VWA2_VWB2_WGM1_WGMXCC1_WGMXCCGn1
    SolutionIndex: 116
    SolutionNameMin: Cijk_Ailk_Bjlk_I8II_BH_UserArgs_MT64x64x128_MI16x16x1_SN_CLR1_GSU0_GSUC0_GSUWGMRR0_K1_LBSPPA512_LBSPPB512_LPA32_LPB32_MIWT2_2_PLR1_SU0_SUM0_SUS0_SKXCCM8_VWA2_VWB2_WGM4_WGMXCC1_WGMXCCGn1
    SolutionIndex: 117
    SolutionNameMin: Cijk_Ailk_Bjlk_I8II_BH_UserArgs_MT64x64x128_MI16x16x1_SN_CLR1_GSU0_GSUC0_GSUWGMRR0_K1_LBSPPA512_LBSPPB512_LPA32_LPB32_MIWT2_2_PLR1_SU0_SUM0_SUS0_SKXCCM8_VWA2_VWB2_WGM8_WGMXCC1_WGMXCCGn1
    SolutionIndex: 118
    SolutionNameMin: Cijk_Ailk_Bjlk_I8II_BH_UserArgs_MT32x64x128_MI16x16x1_SN_CLR1_GSU0_GSUC0_GSUWGMRR0_K1_LBSPPA256_LBSPPB512_LPA16_LPB32_MIWT1_2_PLR1_SU0_SUM0_SUS0_SKXCCM8_VWA1_VWB2_WGM1_WGMXCC1_WGMXCCGn1
    SolutionIndex: 119
    SolutionNameMin: Cijk_Ailk_Bjlk_I8II_BH_UserArgs_MT32x64x128_MI16x16x1_SN_CLR1_GSU0_GSUC0_GSUWGMRR0_K1_LBSPPA256_LBSPPB512_LPA16_LPB32_MIWT1_2_PLR1_SU0_SUM0_SUS0_SKXCCM8_VWA1_VWB2_WGM1_WGMXCC1_WGMXCCGn1
    SolutionIndex: 120
    SolutionNameMin: Cijk_Ailk_Bjlk_I8II_BH_UserArgs_MT32x64x128_MI16x16x1_SN_CLR1_GSU0_GSUC0_GSUWGMRR0_K1_LBSPPA256_LBSPPB512_LPA16_LPB32_MIWT1_2_PLR2_SU0_SUM0_SUS0_SKXCCM8_VWA1_VWB2_WGM1_WGMXCC1_WGMXCCGn1
    SolutionIndex: 121
    SolutionNameMin: Cijk_Ailk_Bjlk_I8II_BH_UserArgs_MT64x32x128_MI16x16x1_SN_CLR1_GSU0_GSUC0_GSUWGMRR0_K1_LBSPPA512_LBSPPB256_LPA32_LPB16_MIWT2_1_PLR1_SU0_SUM0_SUS0_SKXCCM8_VWA2_VWB1_WGM1_WGMXCC1_WGMXCCGn1
    SolutionIndex: 122
    SolutionNameMin: Cijk_Ailk_Bjlk_I8II_BH_UserArgs_MT64x32x128_MI16x16x1_SN_CLR1_GSU0_GSUC0_GSUWGMRR0_K1_LBSPPA512_LBSPPB256_LPA32_LPB16_MIWT2_1_PLR1_SU0_SUM0_SUS0_SKXCCM8_VWA2_VWB1_WGM1_WGMXCC1_WGMXCCGn1
    SolutionIndex: 123
    SolutionNameMin: Cijk_Ailk_Bjlk_I8II_BH_UserArgs_MT64x32x128_MI16x16x1_SN_CLR1_GSU0_GSUC0_GSUWGMRR0_K1_LBSPPA512_LBSPPB256_LPA32_LPB16_MIWT2_1_PLR1_SU0_SUM0_SUS0_SKXCCM8_VWA2_VWB1_WGM1_WGMXCC1_WGMXCCGn1
    SolutionIndex: 124
    SolutionNameMin: Cijk_Ailk_Bjlk_I8II_BH_UserArgs_MT64x32x128_MI16x16x1_SN_CLR1_GSU0_GSUC0_GSUWGMRR0_K1_LBSPPA512_LBSPPB256_LPA32_LPB16_MIWT2_1_PLR2_SU0_SUM0_SUS0_SKXCCM8_VWA2_VWB1_WGM1_WGMXCC1_WGMXCCGn1
    SolutionIndex: 125
    SolutionNameMin: Cijk_Ailk_Bjlk_I8II_BH_UserArgs_MT64x32x128_MI16x16x1_SN_CLR1_GSU0_GSUC0_GSUWGMRR0_K1_LBSPPA512_LBSPPB256_LPA32_LPB16_MIWT2_1_PLR2_SU0_SUM0_SUS0_SKXCCM8_VWA2_VWB1_WGM1_WGMXCC1_WGMXCCGn1
    SolutionIndex: 126
    SolutionNameMin: Cijk_Ailk_Bjlk_I8II_BH_UserArgs_MT64x32x128_MI16x16x1_SN_CLR1_GSU0_GSUC0_GSUWGMRR0_K1_LBSPPA512_LBSPPB256_LPA32_LPB16_MIWT2_1_PLR2_SU0_SUM0_SUS0_SKXCCM8_VWA2_VWB1_WGM1_WGMXCC1_WGMXCCGn1
    SolutionIndex: 127
    SolutionNameMin: Cijk_Ailk_Bjlk_I8II_BH_UserArgs_MT64x32x128_MI16x16x1_SN_CLR1_GSU0_GSUC0_GSUWGMRR0_K1_LBSPPA512_LBSPPB256_LPA32_LPB16_MIWT2_1_PLR1_SU0_SUM0_SUS0_SKXCCM8_VWA2_VWB1_WGM4_WGMXCC1_WGMXCCGn1
    SolutionIndex: 128
    SolutionNameMin: Cijk_Ailk_Bjlk_I8II_BH_UserArgs_MT64x32x128_MI16x16x1_SN_CLR1_GSU0_GSUC0_GSUWGMRR0_K1_LBSPPA512_LBSPPB256_LPA32_LPB16_MIWT2_1_PLR2_SU0_SUM0_SUS0_SKXCCM8_VWA2_VWB1_WGM4_WGMXCC1_WGMXCCGn1
    SolutionIndex: 129
    SolutionNameMin: Cijk_Ailk_Bjlk_I8II_BH_UserArgs_MT32x32x128_MI16x16x1_SN_CLR1_GSU0_GSUC0_GSUWGMRR0_K1_LBSPPA256_LBSPPB256_LPA16_LPB16_MIWT1_1_PLR1_SU0_SUM0_SUS0_SKXCCM8_VWA1_VWB1_WGM1_WGMXCC1_WGMXCCGn1
    SolutionIndex: 130
    SolutionNameMin: Cijk_Ailk_Bjlk_I8II_BH_UserArgs_MT32x32x128_MI16x16x1_SN_CLR1_GSU0_GSUC0_GSUWGMRR0_K1_LBSPPA256_LBSPPB256_LPA16_LPB16_MIWT1_1_PLR1_SU0_SUM0_SUS0_SKXCCM8_VWA1_VWB1_WGM1_WGMXCC1_WGMXCCGn1
    SolutionIndex: 131
    SolutionNameMin: Cijk_Ailk_Bjlk_I8II_BH_UserArgs_MT32x32x128_MI16x16x1_SN_CLR1_GSU0_GSUC0_GSUWGMRR0_K1_LBSPPA256_LBSPPB256_LPA16_LPB16_MIWT1_1_PLR2_SU0_SUM0_SUS0_SKXCCM8_VWA1_VWB1_WGM1_WGMXCC1_WGMXCCGn1
    SolutionIndex: 132
    SolutionNameMin: Cijk_Ailk_Bjlk_I8II_BH_UserArgs_MT32x32x128_MI16x16x1_SN_CLR1_GSU0_GSUC0_GSUWGMRR0_K1_LBSPPA256_LBSPPB256_LPA16_LPB16_MIWT1_1_PLR2_SU0_SUM0_SUS0_SKXCCM8_VWA1_VWB1_WGM1_WGMXCC1_WGMXCCGn1
    SolutionIndex: 133
    SolutionNameMin: Cijk_Ailk_Bjlk_I8II_BH_UserArgs_MT32x32x128_MI16x16x1_SN_CLR1_GSU0_GSUC0_GSUWGMRR0_K1_LBSPPA256_LBSPPB256_LPA16_LPB16_MIWT1_1_PLR2_SU0_SUM0_SUS0_SKXCCM8_VWA1_VWB1_WGM1_WGMXCC1_WGMXCCGn1
    SolutionIndex: 134
    SolutionNameMin: Cijk_Ailk_Bjlk_I8II_BH_UserArgs_MT32x32x128_MI16x16x1_SN_CLR1_GSU0_GSUC0_GSUWGMRR0_K1_LBSPPA256_LBSPPB256_LPA16_LPB16_MIWT1_1_PLR2_SU0_SUM0_SUS0_SKXCCM8_VWA1_VWB1_WGM1_WGMXCC1_WGMXCCGn1
    SolutionIndex: 135
    SolutionNameMin: Cijk_Ailk_Bjlk_I8II_BH_UserArgs_MT32x32x128_MI16x16x1_SN_CLR1_GSU0_GSUC0_GSUWGMRR0_K1_LBSPPA256_LBSPPB256_LPA16_LPB16_MIWT1_1_PLR1_SU0_SUM0_SUS0_SKXCCM8_VWA1_VWB1_WGM4_WGMXCC1_WGMXCCGn1
    SolutionIndex: 136
    SolutionNameMin: Cijk_Ailk_Bjlk_I8II_BH_UserArgs_MT32x32x128_MI16x16x1_SN_CLR1_GSU0_GSUC0_GSUWGMRR0_K1_LBSPPA256_LBSPPB256_LPA16_LPB16_MIWT1_1_PLR1_SU0_SUM0_SUS0_SKXCCM8_VWA1_VWB1_WGM8_WGMXCC1_WGMXCCGn1
    SolutionIndex: 137
    SolutionNameMin: Cijk_Ailk_Bjlk_I8II_BH_UserArgs_MT32x32x32_MI16x16x1_SN_CLR0_GSU0_GSUC0_GSUWGMRR0_K1_LBSPPA256_LBSPPB256_LPA16_LPB16_MIWT1_1_PLR0_SU32_SUM0_SUS256_SKXCCM0_VWA1_VWB1_WGM4_WGMXCC1_WGMXCCGn1
- - - [128, 128, 1, 128, 128, 128, 128, 128]
    - [12, 0.48]
  - - [128, 128, 1, 256, 128, 128, 128, 128]
    - [129, 0.86]
  - - [128, 128, 1, 512, 128, 128, 128, 128]
    - [130, 1.43]
  - - [128, 128, 1, 1024, 128, 128, 128, 128]
    - [130, 2.15]
  - - [128, 128, 1, 2048, 128, 128, 128, 128]
    - [130, 3.31]
  - - [128, 128, 1, 4096, 128, 128, 128, 128]
    - [88, 5.69]
  - - [128, 128, 1, 8192, 128, 128, 128, 128]
    - [130, 8.84]
  - - [128, 256, 1, 128, 128, 128, 128, 256]
    - [85, 1.01]
  - - [128, 256, 1, 256, 128, 128, 128, 256]
    - [85, 1.77]
  - - [128, 256, 1, 512, 128, 128, 128, 256]
    - [129, 2.93]
  - - [128, 256, 1, 1024, 128, 128, 128, 256]
    - [130, 4.39]
  - - [128, 256, 1, 2048, 128, 128, 128, 256]
    - [11, 6.68]
  - - [128, 256, 1, 4096, 128, 128, 128, 256]
    - [88, 11.37]
  - - [128, 256, 1, 8192, 128, 128, 128, 256]
    - [130, 17.49]
  - - [128, 512, 1, 128, 128, 128, 128, 512]
    - [87, 2.0]
  - - [128, 512, 1, 256, 128, 128, 128, 512]
    - [129, 3.49]
  - - [128, 512, 1, 512, 128, 128, 128, 512]
    - [134, 5.8]
  - - [128, 512, 1, 1024, 128, 128, 128, 512]
    - [134, 8.66]
  - - [128, 512, 1, 2048, 128, 128, 128, 512]
    - [130, 12.98]
  - - [128, 512, 1, 4096, 128, 128, 128, 512]
    - [86, 21.77]
  - - [128, 512, 1, 8192, 128, 128, 128, 512]
    - [130, 33.89]
  - - [128, 1024, 1, 128, 128, 128, 128, 1024]
    - [85, 3.95]
  - - [128, 1024, 1, 256, 128, 128, 128, 1024]
    - [86, 6.85]
  - - [128, 1024, 1, 512, 128, 128, 128, 1024]
    - [134, 11.4]
  - - [128, 1024, 1, 1024, 128, 128, 128, 1024]
    - [134, 17.08]
  - - [128, 1024, 1, 2048, 128, 128, 128, 1024]
    - [133, 24.34]
  - - [128, 1024, 1, 4096, 128, 128, 128, 1024]
    - [82, 37.93]
  - - [128, 1024, 1, 8192, 128, 128, 128, 1024]
    - [119, 57.09]
  - - [128, 2048, 1, 128, 128, 128, 128, 2048]
    - [84, 7.45]
  - - [128, 2048, 1, 256, 128, 128, 128, 2048]
    - [90, 12.96]
  - - [128, 2048, 1, 512, 128, 128, 128, 2048]
    - [132, 21.49]
  - - [128, 2048, 1, 1024, 128, 128, 128, 2048]
    - [134, 32.06]
  - - [128, 2048, 1, 2048, 128, 128, 128, 2048]
    - [122, 41.45]
  - - [128, 2048, 1, 4096, 128, 128, 128, 2048]
    - [75, 61.65]
  - - [128, 2048, 1, 8192, 128, 128, 128, 2048]
    - [114, 94.47]
  - - [128, 4096, 1, 128, 128, 128, 128, 4096]
    - [81, 13.32]
  - - [128, 4096, 1, 256, 128, 128, 128, 4096]
    - [82, 23.47]
  - - [128, 4096, 1, 512, 128, 128, 128, 4096]
    - [124, 38.83]
  - - [128, 4096, 1, 1024, 128, 128, 128, 4096]
    - [123, 57.11]
  - - [128, 4096, 1, 2048, 128, 128, 128, 4096]
    - [114, 72.37]
  - - [128, 4096, 1, 4096, 128, 128, 128, 4096]
    - [114, 104.01]
  - - [128, 4096, 1, 8192, 128, 128, 128, 4096]
    - [109, 142.24]
  - - [128, 8192, 1, 128, 128, 128, 128, 8192]
    - [74, 23.22]
  - - [128, 8192, 1, 256, 128, 128, 128, 8192]
    - [72, 40.85]
  - - [128, 8192, 1, 512, 128, 128, 128, 8192]
    - [114, 65.88]
  - - [128, 8192, 1, 1024, 128, 128, 128, 8192]
    - [115, 96.85]
  - - [128, 8192, 1, 2048, 128, 128, 128, 8192]
    - [114, 122.31]
  - - [128, 8192, 1, 4096, 128, 128, 128, 8192]
    - [109, 150.32]
  - - [128, 8192, 1, 8192, 128, 128, 128, 8192]
    - [103, 189.68]
  - - [256, 128, 1, 128, 256, 256, 256, 128]
    - [85, 1.01]
  - - [256, 128, 1, 256, 256, 256, 256, 128]
    - [132, 1.77]
  - - [256, 128, 1, 512, 256, 256, 256, 128]
    - [134, 2.93]
  - - [256, 128, 1, 1024, 256, 256, 256, 128]
    - [130, 4.35]
  - - [256, 128, 1, 2048, 256, 256, 256, 128]
    - [130, 6.68]
  - - [256, 128, 1, 4096, 256, 256, 256, 128]
    - [88, 11.26]
  - - [256, 128, 1, 8192, 256, 256, 256, 128]
    - [130, 17.43]
  - - [256, 256, 1, 128, 256, 256, 256, 256]
    - [84, 1.99]
  - - [256, 256, 1, 256, 256, 256, 256, 256]
    - [130, 3.53]
  - - [256, 256, 1, 512, 256, 256, 256, 256]
    - [130, 5.87]
  - - [256, 256, 1, 1024, 256, 256, 256, 256]
    - [130, 8.67]
  - - [256, 256, 1, 2048, 256, 256, 256, 256]
    - [130, 13.06]
  - - [256, 256, 1, 4096, 256, 256, 256, 256]
    - [88, 21.85]
  - - [256, 256, 1, 8192, 256, 256, 256, 256]
    - [134, 33.88]
  - - [256, 512, 1, 128, 256, 256, 256, 512]
    - [87, 3.94]
  - - [256, 512, 1, 256, 256, 256, 256, 512]
    - [86, 6.9]
  - - [256, 512, 1, 512, 256, 256, 256, 512]
    - [130, 11.36]
  - - [256, 512, 1, 1024, 256, 256, 256, 512]
    - [130, 17.14]
  - - [256, 512, 1, 2048, 256, 256, 256, 512]
    - [134, 24.85]
  - - [256, 512, 1, 4096, 256, 256, 256, 512]
    - [79, 38.25]
  - - [256, 512, 1, 8192, 256, 256, 256, 512]
    - [119, 58.78]
  - - [256, 1024, 1, 128, 256, 256, 256, 1024]
    - [83, 7.51]
  - - [256, 1024, 1, 256, 256, 256, 256, 1024]
    - [85, 13.02]
  - - [256, 1024, 1, 512, 256, 256, 256, 1024]
    - [132, 21.46]
  - - [256, 1024, 1, 1024, 256, 256, 256, 1024]
    - [134, 32.25]
  - - [256, 1024, 1, 2048, 256, 256, 256, 1024]
    - [125, 43.95]
  - - [256, 1024, 1, 4096, 256, 256, 256, 1024]
    - [77, 65.45]
  - - [256, 1024, 1, 8192, 256, 256, 256, 1024]
    - [114, 96.34]
  - - [256, 2048, 1, 128, 256, 256, 256, 2048]
    - [121, 13.27]
  - - [256, 2048, 1, 256, 256, 256, 256, 2048]
    - [79, 23.5]
  - - [256, 2048, 1, 512, 256, 256, 256, 2048]
    - [118, 38.58]
  - - [256, 2048, 1, 1024, 256, 256, 256, 2048]
    - [119, 57.24]
  - - [256, 2048, 1, 2048, 256, 256, 256, 2048]
    - [115, 73.28]
  - - [256, 2048, 1, 4096, 256, 256, 256, 2048]
    - [115, 104.49]
  - - [256, 2048, 1, 8192, 256, 256, 256, 2048]
    - [111, 140.77]
  - - [256, 4096, 1, 128, 256, 256, 256, 4096]
    - [68, 22.97]
  - - [256, 4096, 1, 256, 256, 256, 256, 4096]
    - [73, 40.46]
  - - [256, 4096, 1, 512, 256, 256, 256, 4096]
    - [75, 64.31]
  - - [256, 4096, 1, 1024, 256, 256, 256, 4096]
    - [115, 96.33]
  - - [256, 4096, 1, 2048, 256, 256, 256, 4096]
    - [114, 125.38]
  - - [256, 4096, 1, 4096, 256, 256, 256, 4096]
    - [109, 158.21]
  - - [256, 4096, 1, 8192, 256, 256, 256, 4096]
    - [101, 197.84]
  - - [256, 8192, 1, 128, 256, 256, 256, 8192]
    - [57, 36.21]
  - - [256, 8192, 1, 256, 256, 256, 256, 8192]
    - [61, 64.02]
  - - [256, 8192, 1, 512, 256, 256, 256, 8192]
    - [61, 101.88]
  - - [256, 8192, 1, 1024, 256, 256, 256, 8192]
    - [109, 148.34]
  - - [256, 8192, 1, 2048, 256, 256, 256, 8192]
    - [64, 174.5]
  - - [256, 8192, 1, 4096, 256, 256, 256, 8192]
    - [104, 210.71]
  - - [256, 8192, 1, 8192, 256, 256, 256, 8192]
    - [93, 250.65]
  - - [512, 128, 1, 128, 512, 512, 512, 128]
    - [90, 1.97]
  - - [512, 128, 1, 256, 512, 512, 512, 128]
    - [131, 3.49]
  - - [512, 128, 1, 512, 512, 512, 512, 128]
    - [134, 5.74]
  - - [512, 128, 1, 1024, 512, 512, 512, 128]
    - [134, 8.6]
  - - [512, 128, 1, 2048, 512, 512, 512, 128]
    - [134, 12.89]
  - - [512, 128, 1, 4096, 512, 512, 512, 128]
    - [86, 21.69]
  - - [512, 128, 1, 8192, 512, 512, 512, 128]
    - [136, 33.42]
  - - [512, 256, 1, 128, 512, 512, 512, 256]
    - [135, 3.56]
  - - [512, 256, 1, 256, 512, 512, 512, 256]
    - [129, 6.65]
  - - [512, 256, 1, 512, 512, 512, 512, 256]
    - [134, 11.42]
  - - [512, 256, 1, 1024, 512, 512, 512, 256]
    - [130, 17.07]
  - - [512, 256, 1, 2048, 512, 512, 512, 256]
    - [134, 24.92]
  - - [512, 256, 1, 4096, 512, 512, 512, 256]
    - [82, 38.59]
  - - [512, 256, 1, 8192, 512, 512, 512, 256]
    - [128, 58.1]
  - - [512, 512, 1, 128, 512, 512, 512, 512]
    - [85, 7.49]
  - - [512, 512, 1, 256, 512, 512, 512, 512]
    - [85, 13.13]
  - - [512, 512, 1, 512, 512, 512, 512, 512]
    - [131, 21.58]
  - - [512, 512, 1, 1024, 512, 512, 512, 512]
    - [133, 32.39]
  - - [512, 512, 1, 2048, 512, 512, 512, 512]
    - [125, 44.26]
  - - [512, 512, 1, 4096, 512, 512, 512, 512]
    - [126, 63.24]
  - - [512, 512, 1, 8192, 512, 512, 512, 512]
    - [113, 91.53]
  - - [512, 1024, 1, 128, 512, 512, 512, 1024]
    - [78, 13.54]
  - - [512, 1024, 1, 256, 512, 512, 512, 1024]
    - [120, 23.78]
  - - [512, 1024, 1, 512, 512, 512, 512, 1024]
    - [126, 38.35]
  - - [512, 1024, 1, 1024, 512, 512, 512, 1024]
    - [124, 57.62]
  - - [512, 1024, 1, 2048, 512, 512, 512, 1024]
    - [124, 75.16]
  - - [512, 1024, 1, 4096, 512, 512, 512, 1024]
    - [67, 105.07]
  - - [512, 1024, 1, 8192, 512, 512, 512, 1024]
    - [109, 143.75]
  - - [512, 2048, 1, 128, 512, 512, 512, 2048]
    - [7, 23.28]
  - - [512, 2048, 1, 256, 512, 512, 512, 2048]
    - [72, 40.69]
  - - [512, 2048, 1, 512, 512, 512, 512, 2048]
    - [115, 65.9]
  - - [512, 2048, 1, 1024, 512, 512, 512, 2048]
    - [114, 97.21]
  - - [512, 2048, 1, 2048, 512, 512, 512, 2048]
    - [109, 119.95]
  - - [512, 2048, 1, 4096, 512, 512, 512, 2048]
    - [109, 161.16]
  - - [512, 2048, 1, 8192, 512, 512, 512, 2048]
    - [99, 203.83]
  - - [512, 4096, 1, 128, 512, 512, 512, 4096]
    - [61, 36.5]
  - - [512, 4096, 1, 256, 512, 512, 512, 4096]
    - [58, 63.39]
  - - [512, 4096, 1, 512, 512, 512, 512, 4096]
    - [109, 102.8]
  - - [512, 4096, 1, 1024, 512, 512, 512, 4096]
    - [59, 147.28]
  - - [512, 4096, 1, 2048, 512, 512, 512, 4096]
    - [61, 179.64]
  - - [512, 4096, 1, 4096, 512, 512, 512, 4096]
    - [101, 210.64]
  - - [512, 4096, 1, 8192, 512, 512, 512, 4096]
    - [92, 258.68]
  - - [512, 8192, 1, 128, 512, 512, 512, 8192]
    - [52, 53.94]
  - - [512, 8192, 1, 256, 512, 512, 512, 8192]
    - [52, 93.77]
  - - [512, 8192, 1, 512, 512, 512, 512, 8192]
    - [56, 144.58]
  - - [512, 8192, 1, 1024, 512, 512, 512, 8192]
    - [52, 191.69]
  - - [512, 8192, 1, 2048, 512, 512, 512, 8192]
    - [52, 239.93]
  - - [512, 8192, 1, 4096, 512, 512, 512, 8192]
    - [108, 266.15]
  - - [512, 8192, 1, 8192, 512, 512, 512, 8192]
    - [45, 297.67]
  - - [1024, 128, 1, 128, 1024, 1024, 1024, 128]
    - [89, 3.88]
  - - [1024, 128, 1, 256, 1024, 1024, 1024, 128]
    - [91, 6.82]
  - - [1024, 128, 1, 512, 1024, 1024, 1024, 128]
    - [134, 11.22]
  - - [1024, 128, 1, 1024, 1024, 1024, 1024, 128]
    - [129, 16.83]
  - - [1024, 128, 1, 2048, 1024, 1024, 1024, 128]
    - [130, 24.9]
  - - [1024, 128, 1, 4096, 1024, 1024, 1024, 128]
    - [80, 37.8]
  - - [1024, 128, 1, 8192, 1024, 1024, 1024, 128]
    - [127, 55.74]
  - - [1024, 256, 1, 128, 1024, 1024, 1024, 256]
    - [91, 7.56]
  - - [1024, 256, 1, 256, 1024, 1024, 1024, 256]
    - [85, 13.34]
  - - [1024, 256, 1, 512, 1024, 1024, 1024, 256]
    - [91, 21.67]
  - - [1024, 256, 1, 1024, 1024, 1024, 1024, 256]
    - [129, 32.75]
  - - [1024, 256, 1, 2048, 1024, 1024, 1024, 256]
    - [125, 44.3]
  - - [1024, 256, 1, 4096, 1024, 1024, 1024, 256]
    - [74, 65.98]
  - - [1024, 256, 1, 8192, 1024, 1024, 1024, 256]
    - [115, 89.0]
  - - [1024, 512, 1, 128, 1024, 1024, 1024, 512]
    - [8, 13.53]
  - - [1024, 512, 1, 256, 1024, 1024, 1024, 512]
    - [124, 24.04]
  - - [1024, 512, 1, 512, 1024, 1024, 1024, 512]
    - [122, 39.75]
  - - [1024, 512, 1, 1024, 1024, 1024, 1024, 512]
    - [125, 58.56]
  - - [1024, 512, 1, 2048, 1024, 1024, 1024, 512]
    - [114, 76.0]
  - - [1024, 512, 1, 4096, 1024, 1024, 1024, 512]
    - [62, 106.13]
  - - [1024, 512, 1, 8192, 1024, 1024, 1024, 512]
    - [111, 142.92]
  - - [1024, 1024, 1, 128, 1024, 1024, 1024, 1024]
    - [6, 23.61]
  - - [1024, 1024, 1, 256, 1024, 1024, 1024, 1024]
    - [72, 41.57]
  - - [1024, 1024, 1, 512, 1024, 1024, 1024, 1024]
    - [114, 66.78]
  - - [1024, 1024, 1, 1024, 1024, 1024, 1024, 1024]
    - [114, 97.78]
  - - [1024, 1024, 1, 2048, 1024, 1024, 1024, 1024]
    - [114, 126.76]
  - - [1024, 1024, 1, 4096, 1024, 1024, 1024, 1024]
    - [56, 152.26]
  - - [1024, 1024, 1, 8192, 1024, 1024, 1024, 1024]
    - [102, 194.95]
  - - [1024, 2048, 1, 128, 1024, 1024, 1024, 2048]
    - [5, 36.86]
  - - [1024, 2048, 1, 256, 1024, 1024, 1024, 2048]
    - [62, 64.29]
  - - [1024, 2048, 1, 512, 1024, 1024, 1024, 2048]
    - [61, 104.39]
  - - [1024, 2048, 1, 1024, 1024, 1024, 1024, 2048]
    - [58, 148.09]
  - - [1024, 2048, 1, 2048, 1024, 1024, 1024, 2048]
    - [61, 183.57]
  - - [1024, 2048, 1, 4096, 1024, 1024, 1024, 2048]
    - [100, 206.67]
  - - [1024, 2048, 1, 8192, 1024, 1024, 1024, 2048]
    - [92, 255.34]
  - - [1024, 4096, 1, 128, 1024, 1024, 1024, 4096]
    - [51, 54.88]
  - - [1024, 4096, 1, 256, 1024, 1024, 1024, 4096]
    - [51, 95.53]
  - - [1024, 4096, 1, 512, 1024, 1024, 1024, 4096]
    - [51, 150.54]
  - - [1024, 4096, 1, 1024, 1024, 1024, 1024, 4096]
    - [3, 189.92]
  - - [1024, 4096, 1, 2048, 1024, 1024, 1024, 4096]
    - [56, 242.94]
  - - [1024, 4096, 1, 4096, 1024, 1024, 1024, 4096]
    - [108, 261.82]
  - - [1024, 4096, 1, 8192, 1024, 1024, 1024, 4096]
    - [38, 292.99]
  - - [1024, 8192, 1, 128, 1024, 1024, 1024, 8192]
    - [31, 54.45]
  - - [1024, 8192, 1, 256, 1024, 1024, 1024, 8192]
    - [33, 97.49]
  - - [1024, 8192, 1, 512, 1024, 1024, 1024, 8192]
    - [34, 155.74]
  - - [1024, 8192, 1, 1024, 1024, 1024, 1024, 8192]
    - [92, 221.24]
  - - [1024, 8192, 1, 2048, 1024, 1024, 1024, 8192]
    - [44, 289.47]
  - - [1024, 8192, 1, 4096, 1024, 1024, 1024, 8192]
    - [93, 329.73]
  - - [1024, 8192, 1, 8192, 1024, 1024, 1024, 8192]
    - [14, 341.73]
  - - [2048, 128, 1, 128, 2048, 2048, 2048, 128]
    - [10, 7.61]
  - - [2048, 128, 1, 256, 2048, 2048, 2048, 128]
    - [85, 13.57]
  - - [2048, 128, 1, 512, 2048, 2048, 2048, 128]
    - [131, 21.87]
  - - [2048, 128, 1, 1024, 2048, 2048, 2048, 128]
    - [134, 32.39]
  - - [2048, 128, 1, 2048, 2048, 2048, 2048, 128]
    - [127, 41.67]
  - - [2048, 128, 1, 4096, 2048, 2048, 2048, 128]
    - [71, 61.23]
  - - [2048, 128, 1, 8192, 2048, 2048, 2048, 128]
    - [114, 87.58]
  - - [2048, 256, 1, 128, 2048, 2048, 2048, 256]
    - [9, 13.96]
  - - [2048, 256, 1, 256, 2048, 2048, 2048, 256]
    - [125, 24.19]
  - - [2048, 256, 1, 512, 2048, 2048, 2048, 256]
    - [122, 40.07]
  - - [2048, 256, 1, 1024, 2048, 2048, 2048, 256]
    - [123, 58.39]
  - - [2048, 256, 1, 2048, 2048, 2048, 2048, 256]
    - [74, 71.82]
  - - [2048, 256, 1, 4096, 2048, 2048, 2048, 256]
    - [62, 103.38]
  - - [2048, 256, 1, 8192, 2048, 2048, 2048, 256]
    - [109, 136.86]
  - - [2048, 512, 1, 128, 2048, 2048, 2048, 512]
    - [69, 23.82]
  - - [2048, 512, 1, 256, 2048, 2048, 2048, 512]
    - [72, 41.43]
  - - [2048, 512, 1, 512, 2048, 2048, 2048, 512]
    - [74, 66.09]
  - - [2048, 512, 1, 1024, 2048, 2048, 2048, 512]
    - [115, 97.43]
  - - [2048, 512, 1, 2048, 2048, 2048, 2048, 512]
    - [65, 117.96]
  - - [2048, 512, 1, 4096, 2048, 2048, 2048, 512]
    - [110, 150.49]
  - - [2048, 512, 1, 8192, 2048, 2048, 2048, 512]
    - [107, 200.42]
  - - [2048, 1024, 1, 128, 2048, 2048, 2048, 1024]
    - [61, 36.94]
  - - [2048, 1024, 1, 256, 2048, 2048, 2048, 1024]
    - [62, 65.3]
  - - [2048, 1024, 1, 512, 2048, 2048, 2048, 1024]
    - [62, 104.62]
  - - [2048, 1024, 1, 1024, 2048, 2048, 2048, 1024]
    - [109, 148.1]
  - - [2048, 1024, 1, 2048, 2048, 2048, 2048, 1024]
    - [66, 178.62]
  - - [2048, 1024, 1, 4096, 2048, 2048, 2048, 1024]
    - [108, 202.83]
  - - [2048, 1024, 1, 8192, 2048, 2048, 2048, 1024]
    - [95, 251.21]
  - - [2048, 2048, 1, 128, 2048, 2048, 2048, 2048]
    - [4, 50.97]
  - - [2048, 2048, 1, 256, 2048, 2048, 2048, 2048]
    - [55, 88.06]
  - - [2048, 2048, 1, 512, 2048, 2048, 2048, 2048]
    - [56, 140.69]
  - - [2048, 2048, 1, 1024, 2048, 2048, 2048, 2048]
    - [54, 190.42]
  - - [2048, 2048, 1, 2048, 2048, 2048, 2048, 2048]
    - [56, 233.04]
  - - [2048, 2048, 1, 4096, 2048, 2048, 2048, 2048]
    - [106, 264.62]
  - - [2048, 2048, 1, 8192, 2048, 2048, 2048, 2048]
    - [42, 300.73]
  - - [2048, 4096, 1, 128, 2048, 2048, 2048, 4096]
    - [47, 54.64]
  - - [2048, 4096, 1, 256, 2048, 2048, 2048, 4096]
    - [46, 98.32]
  - - [2048, 4096, 1, 512, 2048, 2048, 2048, 4096]
    - [49, 155.48]
  - - [2048, 4096, 1, 1024, 2048, 2048, 2048, 4096]
    - [96, 218.97]
  - - [2048, 4096, 1, 2048, 2048, 2048, 2048, 4096]
    - [44, 290.29]
  - - [2048, 4096, 1, 4096, 2048, 2048, 2048, 4096]
    - [93, 332.65]
  - - [2048, 4096, 1, 8192, 2048, 2048, 2048, 4096]
    - [26, 341.68]
  - - [2048, 8192, 1, 128, 2048, 2048, 2048, 8192]
    - [1, 60.9]
  - - [2048, 8192, 1, 256, 2048, 2048, 2048, 8192]
    - [15, 107.53]
  - - [2048, 8192, 1, 512, 2048, 2048, 2048, 8192]
    - [24, 174.25]
  - - [2048, 8192, 1, 1024, 2048, 2048, 2048, 8192]
    - [19, 260.51]
  - - [2048, 8192, 1, 2048, 2048, 2048, 2048, 8192]
    - [28, 340.0]
  - - [2048, 8192, 1, 4096, 2048, 2048, 2048, 8192]
    - [24, 323.58]
  - - [2048, 8192, 1, 8192, 2048, 2048, 2048, 8192]
    - [17, 370.32]
  - - [4096, 128, 1, 128, 4096, 4096, 4096, 128]
    - [9, 13.37]
  - - [4096, 128, 1, 256, 4096, 4096, 4096, 128]
    - [125, 23.56]
  - - [4096, 128, 1, 512, 4096, 4096, 4096, 128]
    - [125, 38.67]
  - - [4096, 128, 1, 1024, 4096, 4096, 4096, 128]
    - [125, 56.67]
  - - [4096, 128, 1, 2048, 4096, 4096, 4096, 128]
    - [114, 68.35]
  - - [4096, 128, 1, 4096, 4096, 4096, 4096, 128]
    - [63, 101.6]
  - - [4096, 128, 1, 8192, 4096, 4096, 4096, 128]
    - [110, 136.62]
  - - [4096, 256, 1, 128, 4096, 4096, 4096, 256]
    - [69, 23.82]
  - - [4096, 256, 1, 256, 4096, 4096, 4096, 256]
    - [70, 40.49]
  - - [4096, 256, 1, 512, 4096, 4096, 4096, 256]
    - [112, 64.67]
  - - [4096, 256, 1, 1024, 4096, 4096, 4096, 256]
    - [116, 95.42]
  - - [4096, 256, 1, 2048, 4096, 4096, 4096, 256]
    - [77, 117.03]
  - - [4096, 256, 1, 4096, 4096, 4096, 4096, 256]
    - [111, 152.31]
  - - [4096, 256, 1, 8192, 4096, 4096, 4096, 256]
    - [105, 192.5]
  - - [4096, 512, 1, 128, 4096, 4096, 4096, 512]
    - [62, 37.4]
  - - [4096, 512, 1, 256, 4096, 4096, 4096, 512]
    - [62, 65.15]
  - - [4096, 512, 1, 512, 4096, 4096, 4096, 512]
    - [67, 102.71]
  - - [4096, 512, 1, 1024, 4096, 4096, 4096, 512]
    - [110, 146.11]
  - - [4096, 512, 1, 2048, 4096, 4096, 4096, 512]
    - [66, 178.52]
  - - [4096, 512, 1, 4096, 4096, 4096, 4096, 512]
    - [105, 204.66]
  - - [4096, 512, 1, 8192, 4096, 4096, 4096, 512]
    - [94, 252.9]
  - - [4096, 1024, 1, 128, 4096, 4096, 4096, 1024]
    - [51, 49.68]
  - - [4096, 1024, 1, 256, 4096, 4096, 4096, 1024]
    - [53, 87.0]
  - - [4096, 1024, 1, 512, 4096, 4096, 4096, 1024]
    - [54, 141.22]
  - - [4096, 1024, 1, 1024, 4096, 4096, 4096, 1024]
    - [54, 189.76]
  - - [4096, 1024, 1, 2048, 4096, 4096, 4096, 1024]
    - [54, 238.45]
  - - [4096, 1024, 1, 4096, 4096, 4096, 4096, 1024]
    - [105, 262.81]
  - - [4096, 1024, 1, 8192, 4096, 4096, 4096, 1024]
    - [41, 293.34]
  - - [4096, 2048, 1, 128, 4096, 4096, 4096, 2048]
    - [2, 53.23]
  - - [4096, 2048, 1, 256, 4096, 4096, 4096, 2048]
    - [47, 96.3]
  - - [4096, 2048, 1, 512, 4096, 4096, 4096, 2048]
    - [48, 152.93]
  - - [4096, 2048, 1, 1024, 4096, 4096, 4096, 2048]
    - [40, 219.82]
  - - [4096, 2048, 1, 2048, 4096, 4096, 4096, 2048]
    - [40, 286.54]
  - - [4096, 2048, 1, 4096, 4096, 4096, 4096, 2048]
    - [93, 328.61]
  - - [4096, 2048, 1, 8192, 4096, 4096, 4096, 2048]
    - [25, 339.84]
  - - [4096, 4096, 1, 128, 4096, 4096, 4096, 4096]
    - [0, 58.81]
  - - [4096, 4096, 1, 256, 4096, 4096, 4096, 4096]
    - [14, 105.07]
  - - [4096, 4096, 1, 512, 4096, 4096, 4096, 4096]
    - [14, 169.79]
  - - [4096, 4096, 1, 1024, 4096, 4096, 4096, 4096]
    - [21, 251.92]
  - - [4096, 4096, 1, 2048, 4096, 4096, 4096, 4096]
    - [22, 337.0]
  - - [4096, 4096, 1, 4096, 4096, 4096, 4096, 4096]
    - [22, 330.95]
  - - [4096, 4096, 1, 8192, 4096, 4096, 4096, 4096]
    - [15, 373.72]
  - - [4096, 8192, 1, 128, 4096, 4096, 4096, 8192]
    - [19, 59.47]
  - - [4096, 8192, 1, 256, 4096, 4096, 4096, 8192]
    - [37, 98.61]
  - - [4096, 8192, 1, 512, 4096, 4096, 4096, 8192]
    - [92, 152.33]
  - - [4096, 8192, 1, 1024, 4096, 4096, 4096, 8192]
    - [17, 211.51]
  - - [4096, 8192, 1, 2048, 4096, 4096, 4096, 8192]
    - [15, 294.78]
  - - [4096, 8192, 1, 4096, 4096, 4096, 4096, 8192]
    - [20, 351.53]
  - - [4096, 8192, 1, 8192, 4096, 4096, 4096, 8192]
    - [15, 396.35]
  - - [8192, 128, 1, 128, 8192, 8192, 8192, 128]
    - [69, 23.77]
  - - [8192, 128, 1, 256, 8192, 8192, 8192, 128]
    - [68, 40.94]
  - - [8192, 128, 1, 512, 8192, 8192, 8192, 128]
    - [76, 64.8]
  - - [8192, 128, 1, 1024, 8192, 8192, 8192, 128]
    - [117, 95.02]
  - - [8192, 128, 1, 2048, 8192, 8192, 8192, 128]
    - [67, 114.95]
  - - [8192, 128, 1, 4096, 8192, 8192, 8192, 128]
    - [111, 149.98]
  - - [8192, 128, 1, 8192, 8192, 8192, 8192, 128]
    - [101, 185.95]
  - - [8192, 256, 1, 128, 8192, 8192, 8192, 256]
    - [57, 36.61]
  - - [8192, 256, 1, 256, 8192, 8192, 8192, 256]
    - [61, 64.34]
  - - [8192, 256, 1, 512, 8192, 8192, 8192, 256]
    - [59, 103.8]
  - - [8192, 256, 1, 1024, 8192, 8192, 8192, 256]
    - [59, 147.94]
  - - [8192, 256, 1, 2048, 8192, 8192, 8192, 256]
    - [60, 173.06]
  - - [8192, 256, 1, 4096, 8192, 8192, 8192, 256]
    - [107, 206.46]
  - - [8192, 256, 1, 8192, 8192, 8192, 8192, 256]
    - [97, 245.41]
  - - [8192, 512, 1, 128, 8192, 8192, 8192, 512]
    - [54, 53.37]
  - - [8192, 512, 1, 256, 8192, 8192, 8192, 512]
    - [54, 92.84]
  - - [8192, 512, 1, 512, 8192, 8192, 8192, 512]
    - [56, 147.37]
  - - [8192, 512, 1, 1024, 8192, 8192, 8192, 512]
    - [56, 194.1]
  - - [8192, 512, 1, 2048, 8192, 8192, 8192, 512]
    - [54, 242.03]
  - - [8192, 512, 1, 4096, 8192, 8192, 8192, 512]
    - [105, 262.77]
  - - [8192, 512, 1, 8192, 8192, 8192, 8192, 512]
    - [35, 301.06]
  - - [8192, 1024, 1, 128, 8192, 8192, 8192, 1024]
    - [34, 54.42]
  - - [8192, 1024, 1, 256, 8192, 8192, 8192, 1024]
    - [30, 97.55]
  - - [8192, 1024, 1, 512, 8192, 8192, 8192, 1024]
    - [34, 153.26]
  - - [8192, 1024, 1, 1024, 8192, 8192, 8192, 1024]
    - [50, 216.63]
  - - [8192, 1024, 1, 2048, 8192, 8192, 8192, 1024]
    - [39, 283.57]
  - - [8192, 1024, 1, 4096, 8192, 8192, 8192, 1024]
    - [93, 322.71]
  - - [8192, 1024, 1, 8192, 8192, 8192, 8192, 1024]
    - [29, 340.88]
  - - [8192, 2048, 1, 128, 8192, 8192, 8192, 2048]
    - [13, 59.38]
  - - [8192, 2048, 1, 256, 8192, 8192, 8192, 2048]
    - [16, 106.53]
  - - [8192, 2048, 1, 512, 8192, 8192, 8192, 2048]
    - [16, 171.12]
  - - [8192, 2048, 1, 1024, 8192, 8192, 8192, 2048]
    - [14, 252.58]
  - - [8192, 2048, 1, 2048, 8192, 8192, 8192, 2048]
    - [22, 331.17]
  - - [8192, 2048, 1, 4096, 8192, 8192, 8192, 2048]
    - [25, 319.53]
  - - [8192, 2048, 1, 8192, 8192, 8192, 8192, 2048]
    - [26, 368.86]
  - - [8192, 4096, 1, 128, 8192, 8192, 8192, 4096]
    - [14, 61.18]
  - - [8192, 4096, 1, 256, 8192, 8192, 8192, 4096]
    - [36, 98.97]
  - - [8192, 4096, 1, 512, 8192, 8192, 8192, 4096]
    - [98, 150.85]
  - - [8192, 4096, 1, 1024, 8192, 8192, 8192, 4096]
    - [14, 216.05]
  - - [8192, 4096, 1, 2048, 8192, 8192, 8192, 4096]
    - [18, 287.67]
  - - [8192, 4096, 1, 4096, 8192, 8192, 8192, 4096]
    - [19, 356.99]
  - - [8192, 4096, 1, 8192, 8192, 8192, 8192, 4096]
    - [19, 399.94]
  - - [8192, 8192, 1, 128, 8192, 8192, 8192, 8192]
    - [32, 51.97]
  - - [8192, 8192, 1, 256, 8192, 8192, 8192, 8192]
    - [14, 89.64]
  - - [8192, 8192, 1, 512, 8192, 8192, 8192, 8192]
    - [43, 146.89]
  - - [8192, 8192, 1, 1024, 8192, 8192, 8192, 8192]
    - [27, 219.39]
  - - [8192, 8192, 1, 2048, 8192, 8192, 8192, 8192]
    - [17, 307.75]
  - - [8192, 8192, 1, 4096, 8192, 8192, 8192, 8192]
    - [23, 383.99]
  - - [8192, 8192, 1, 8192, 8192, 8192, 8192, 8192]
    - [22, 434.14]
  - - [1, 1, 1, 32, 1, 1, 1, 1]
    - [137, 0.0]
- null
- null
- ExperimentalStreamK
- GridBased
