projects/hipblaslt/library/src/amd_detail/rocblaslt/src/Tensile/Logic/asm_full/aquavanjaram/gfx942/StreamK/aquavanjaram942_Cijk_Alik_Bljk_I8BH_UserArgs.yaml
- {MinimumRequiredVersion: 4.33.0}
- aquavanjaram942
- gfx942
- [Device 0049, Device 0050]
    SolutionIndex: 0
    SolutionNameMin: Cijk_Alik_Bljk_I8BH_UserArgs_MT256x256x32_MI16x16x1_SN_CLR0_GSU0_GSUC0_GSUWGMRR0_K1_LBSPPA128_LBSPPB128_MIWT8_8_PLR0_SU0_SUM0_SUS0_SKXCCM8_VWA4_VWB4_WGM1_WGMXCC1_WGMXCCGn1
    SolutionIndex: 1
    SolutionNameMin: Cijk_Alik_Bljk_I8BH_UserArgs_MT256x256x32_MI16x16x1_SN_CLR0_GSU0_GSUC0_GSUWGMRR0_K1_LBSPPA128_LBSPPB128_MIWT8_8_PLR0_SU0_SUM0_SUS0_SKXCCM8_VWA4_VWB4_WGM4_WGMXCC1_WGMXCCGn1
    SolutionIndex: 2
    SolutionNameMin: Cijk_Alik_Bljk_I8BH_UserArgs_MT128x128x32_MI16x16x1_SN_CLR0_GSU0_GSUC0_GSUWGMRR0_K1_LBSPPA128_LBSPPB128_MIWT4_4_PLR0_SU0_SUM0_SUS0_SKXCCM8_VWA4_VWB1_WGM1_WGMXCC1_WGMXCCGn1
    SolutionIndex: 3
    SolutionNameMin: Cijk_Alik_Bljk_I8BH_UserArgs_MT32x32x32_MI16x16x1_SN_CLR0_GSU0_GSUC0_GSUWGMRR0_K1_LBSPPA128_LBSPPB128_MIWT1_1_PLR0_SU0_SUM0_SUS0_SKXCCM8_VWA1_VWB1_WGM1_WGMXCC1_WGMXCCGn1
    SolutionIndex: 4
    SolutionNameMin: Cijk_Alik_Bljk_I8BH_UserArgs_MT256x256x64_MI16x16x1_SN_CLR1_GSU0_GSUC0_GSUWGMRR0_K1_LBSPPA256_LBSPPB128_MIWT8_8_PLR1_SU0_SUM0_SUS0_SKXCCM8_VWA4_VWB1_WGM1_WGMXCC1_WGMXCCGn1
    SolutionIndex: 5
    SolutionNameMin: Cijk_Alik_Bljk_I8BH_UserArgs_MT256x256x64_MI16x16x1_SN_CLR1_GSU0_GSUC0_GSUWGMRR0_K1_LBSPPA256_LBSPPB128_MIWT8_8_PLR1_SU0_SUM0_SUS0_SKXCCM8_VWA4_VWB2_WGM1_WGMXCC1_WGMXCCGn1
    SolutionIndex: 6
    SolutionNameMin: Cijk_Alik_Bljk_I8BH_UserArgs_MT256x256x64_MI16x16x1_SN_CLR1_GSU0_GSUC0_GSUWGMRR0_K1_LBSPPA256_LBSPPB256_MIWT8_8_PLR1_SU0_SUM0_SUS0_SKXCCM8_VWA4_VWB4_WGM1_WGMXCC1_WGMXCCGn1
    SolutionIndex: 7
    SolutionNameMin: Cijk_Alik_Bljk_I8BH_UserArgs_MT256x256x64_MI16x16x1_SN_CLR1_GSU0_GSUC0_GSUWGMRR0_K1_LBSPPA256_LBSPPB512_MIWT8_8_PLR1_SU0_SUM0_SUS0_SKXCCM8_VWA4_VWB8_WGM1_WGMXCC1_WGMXCCGn1
    SolutionIndex: 8
    SolutionNameMin: Cijk_Alik_Bljk_I8BH_UserArgs_MT256x256x64_MI16x16x1_SN_CLR1_GSU0_GSUC0_GSUWGMRR0_K1_LBSPPA256_LBSPPB256_MIWT8_8_PLR1_SU0_SUM0_SUS0_SKXCCM8_VWA4_VWB4_WGM1_WGMXCC1_WGMXCCGn1
    SolutionIndex: 9
    SolutionNameMin: Cijk_Alik_Bljk_I8BH_UserArgs_MT256x256x64_MI16x16x1_SN_CLR1_GSU0_GSUC0_GSUWGMRR0_K1_LBSPPA256_LBSPPB128_MIWT8_8_PLR1_SU0_SUM0_SUS0_SKXCCM8_VWA4_VWB2_WGM1_WGMXCC1_WGMXCCGn1
    SolutionIndex: 10
    SolutionNameMin: Cijk_Alik_Bljk_I8BH_UserArgs_MT256x256x64_MI16x16x1_SN_CLR1_GSU0_GSUC0_GSUWGMRR0_K1_LBSPPA256_LBSPPB256_MIWT8_8_PLR1_SU0_SUM0_SUS0_SKXCCM8_VWA4_VWB4_WGM1_WGMXCC1_WGMXCCGn1
    SolutionIndex: 11
    SolutionNameMin: Cijk_Alik_Bljk_I8BH_UserArgs_MT256x256x64_MI16x16x1_SN_CLR1_GSU0_GSUC0_GSUWGMRR0_K1_LBSPPA256_LBSPPB512_MIWT8_8_PLR1_SU0_SUM0_SUS0_SKXCCM8_VWA4_VWB8_WGM1_WGMXCC1_WGMXCCGn1
    SolutionIndex: 12
    SolutionNameMin: Cijk_Alik_Bljk_I8BH_UserArgs_MT256x256x64_MI16x16x1_SN_CLR1_GSU0_GSUC0_GSUWGMRR0_K1_LBSPPA512_LBSPPB128_MIWT8_8_PLR1_SU0_SUM0_SUS0_SKXCCM8_VWA8_VWB1_WGM4_WGMXCC1_WGMXCCGn1
    SolutionIndex: 13
    SolutionNameMin: Cijk_Alik_Bljk_I8BH_UserArgs_MT256x256x64_MI16x16x1_SN_CLR1_GSU0_GSUC0_GSUWGMRR0_K1_LBSPPA256_LBSPPB128_MIWT8_8_PLR1_SU0_SUM0_SUS0_SKXCCM8_VWA4_VWB2_WGM4_WGMXCC1_WGMXCCGn1
    SolutionIndex: 14
    SolutionNameMin: Cijk_Alik_Bljk_I8BH_UserArgs_MT256x256x64_MI16x16x1_SN_CLR1_GSU0_GSUC0_GSUWGMRR0_K1_LBSPPA256_LBSPPB256_MIWT8_8_PLR1_SU0_SUM0_SUS0_SKXCCM8_VWA4_VWB4_WGM4_WGMXCC1_WGMXCCGn1
    SolutionIndex: 15
    SolutionNameMin: Cijk_Alik_Bljk_I8BH_UserArgs_MT256x256x64_MI16x16x1_SN_CLR1_GSU0_GSUC0_GSUWGMRR0_K1_LBSPPA512_LBSPPB128_MIWT8_8_PLR1_SU0_SUM0_SUS0_SKXCCM8_VWA8_VWB1_WGM4_WGMXCC1_WGMXCCGn1
    SolutionIndex: 16
    SolutionNameMin: Cijk_Alik_Bljk_I8BH_UserArgs_MT256x256x64_MI16x16x1_SN_CLR1_GSU0_GSUC0_GSUWGMRR0_K1_LBSPPA256_LBSPPB256_MIWT8_8_PLR1_SU0_SUM0_SUS0_SKXCCM8_VWA4_VWB4_WGM4_WGMXCC1_WGMXCCGn1
    SolutionIndex: 17
    SolutionNameMin: Cijk_Alik_Bljk_I8BH_UserArgs_MT256x256x64_MI16x16x1_SN_CLR1_GSU0_GSUC0_GSUWGMRR0_K1_LBSPPA512_LBSPPB128_MIWT8_8_PLR1_SU0_SUM0_SUS0_SKXCCM8_VWA8_VWB1_WGM8_WGMXCC1_WGMXCCGn1
    SolutionIndex: 18
    SolutionNameMin: Cijk_Alik_Bljk_I8BH_UserArgs_MT256x256x64_MI16x16x1_SN_CLR1_GSU0_GSUC0_GSUWGMRR0_K1_LBSPPA256_LBSPPB256_MIWT8_8_PLR1_SU0_SUM0_SUS0_SKXCCM8_VWA4_VWB4_WGM8_WGMXCC1_WGMXCCGn1
    SolutionIndex: 19
    SolutionNameMin: Cijk_Alik_Bljk_I8BH_UserArgs_MT256x256x64_MI16x16x1_SN_CLR1_GSU0_GSUC0_GSUWGMRR0_K1_LBSPPA256_LBSPPB512_MIWT8_8_PLR1_SU0_SUM0_SUS0_SKXCCM8_VWA4_VWB8_WGM8_WGMXCC1_WGMXCCGn1
    SolutionIndex: 20
    SolutionNameMin: Cijk_Alik_Bljk_I8BH_UserArgs_MT256x256x64_MI16x16x1_SN_CLR1_GSU0_GSUC0_GSUWGMRR0_K1_LBSPPA512_LBSPPB512_MIWT8_8_PLR1_SU0_SUM0_SUS0_SKXCCM8_VWA8_VWB8_WGM8_WGMXCC1_WGMXCCGn1
    SolutionIndex: 21
    SolutionNameMin: Cijk_Alik_Bljk_I8BH_UserArgs_MT256x128x64_MI16x16x1_SN_CLR1_GSU0_GSUC0_GSUWGMRR0_K1_LBSPPA512_LBSPPB128_MIWT8_4_PLR1_SU0_SUM0_SUS0_SKXCCM8_VWA8_VWB1_WGM1_WGMXCC1_WGMXCCGn1
    SolutionIndex: 22
    SolutionNameMin: Cijk_Alik_Bljk_I8BH_UserArgs_MT256x128x64_MI16x16x1_SN_CLR1_GSU0_GSUC0_GSUWGMRR0_K1_LBSPPA512_LBSPPB128_MIWT8_4_PLR1_SU0_SUM0_SUS0_SKXCCM8_VWA8_VWB1_WGM1_WGMXCC1_WGMXCCGn1
    SolutionIndex: 23
    SolutionNameMin: Cijk_Alik_Bljk_I8BH_UserArgs_MT256x128x64_MI16x16x1_SN_CLR1_GSU0_GSUC0_GSUWGMRR0_K1_LBSPPA256_LBSPPB128_MIWT8_4_PLR1_SU0_SUM0_SUS0_SKXCCM8_VWA4_VWB2_WGM1_WGMXCC1_WGMXCCGn1
    SolutionIndex: 24
    SolutionNameMin: Cijk_Alik_Bljk_I8BH_UserArgs_MT256x128x64_MI16x16x1_SN_CLR1_GSU0_GSUC0_GSUWGMRR0_K1_LBSPPA512_LBSPPB128_MIWT8_4_PLR1_SU0_SUM0_SUS0_SKXCCM8_VWA8_VWB1_WGM1_WGMXCC1_WGMXCCGn1
    SolutionIndex: 25
    SolutionNameMin: Cijk_Alik_Bljk_I8BH_UserArgs_MT256x128x64_MI16x16x1_SN_CLR1_GSU0_GSUC0_GSUWGMRR0_K1_LBSPPA256_LBSPPB256_MIWT8_4_PLR1_SU0_SUM0_SUS0_SKXCCM8_VWA4_VWB4_WGM8_WGMXCC1_WGMXCCGn1
    SolutionIndex: 26
    SolutionNameMin: Cijk_Alik_Bljk_I8BH_UserArgs_MT128x128x64_MI16x16x1_SN_CLR1_GSU0_GSUC0_GSUWGMRR0_K1_LBSPPA256_LBSPPB128_MIWT4_4_PLR1_SU0_SUM0_SUS0_SKXCCM8_VWA4_VWB1_WGM1_WGMXCC1_WGMXCCGn1
    SolutionIndex: 27
    SolutionNameMin: Cijk_Alik_Bljk_I8BH_UserArgs_MT128x128x64_MI16x16x1_SN_CLR1_GSU0_GSUC0_GSUWGMRR0_K1_LBSPPA256_LBSPPB128_MIWT4_4_PLR1_SU0_SUM0_SUS0_SKXCCM8_VWA4_VWB2_WGM1_WGMXCC1_WGMXCCGn1
    SolutionIndex: 28
    SolutionNameMin: Cijk_Alik_Bljk_I8BH_UserArgs_MT128x128x64_MI16x16x1_SN_CLR1_GSU0_GSUC0_GSUWGMRR0_K1_LBSPPA256_LBSPPB128_MIWT4_4_PLR1_SU0_SUM0_SUS0_SKXCCM8_VWA4_VWB1_WGM1_WGMXCC1_WGMXCCGn1
    SolutionIndex: 29
    SolutionNameMin: Cijk_Alik_Bljk_I8BH_UserArgs_MT128x64x64_MI16x16x1_SN_CLR1_GSU0_GSUC0_GSUWGMRR0_K1_LBSPPA128_LBSPPB128_MIWT4_2_PLR1_SU0_SUM0_SUS0_SKXCCM8_VWA2_VWB1_WGM1_WGMXCC1_WGMXCCGn1
    SolutionIndex: 30
    SolutionNameMin: Cijk_Alik_Bljk_I8BH_UserArgs_MT128x64x64_MI16x16x1_SN_CLR1_GSU0_GSUC0_GSUWGMRR0_K1_LBSPPA256_LBSPPB128_MIWT4_2_PLR1_SU0_SUM0_SUS0_SKXCCM8_VWA4_VWB1_WGM1_WGMXCC1_WGMXCCGn1
    SolutionIndex: 31
    SolutionNameMin: Cijk_Alik_Bljk_I8BH_UserArgs_MT128x64x64_MI16x16x1_SN_CLR1_GSU0_GSUC0_GSUWGMRR0_K1_LBSPPA256_LBSPPB128_MIWT4_2_PLR1_SU0_SUM0_SUS0_SKXCCM8_VWA4_VWB2_WGM1_WGMXCC1_WGMXCCGn1
    SolutionIndex: 32
    SolutionNameMin: Cijk_Alik_Bljk_I8BH_UserArgs_MT64x64x64_MI16x16x1_SN_CLR1_GSU0_GSUC0_GSUWGMRR0_K1_LBSPPA128_LBSPPB128_MIWT2_2_PLR1_SU0_SUM0_SUS0_SKXCCM8_VWA2_VWB1_WGM1_WGMXCC1_WGMXCCGn1
    SolutionIndex: 33
    SolutionNameMin: Cijk_Alik_Bljk_I8BH_UserArgs_MT64x64x64_MI16x16x1_SN_CLR1_GSU0_GSUC0_GSUWGMRR0_K1_LBSPPA128_LBSPPB128_MIWT2_2_PLR1_SU0_SUM0_SUS0_SKXCCM8_VWA2_VWB2_WGM1_WGMXCC1_WGMXCCGn1
    SolutionIndex: 34
    SolutionNameMin: Cijk_Alik_Bljk_I8BH_UserArgs_MT64x32x64_MI16x16x1_SN_CLR1_GSU0_GSUC0_GSUWGMRR0_K1_LBSPPA128_LBSPPB128_MIWT2_1_PLR1_SU0_SUM0_SUS0_SKXCCM8_VWA2_VWB1_WGM1_WGMXCC1_WGMXCCGn1
    SolutionIndex: 35
    SolutionNameMin: Cijk_Alik_Bljk_I8BH_UserArgs_MT64x32x64_MI16x16x1_SN_CLR1_GSU0_GSUC0_GSUWGMRR0_K1_LBSPPA128_LBSPPB128_MIWT2_1_PLR1_SU0_SUM0_SUS0_SKXCCM8_VWA2_VWB1_WGM1_WGMXCC1_WGMXCCGn1
    SolutionIndex: 36
    SolutionNameMin: Cijk_Alik_Bljk_I8BH_UserArgs_MT64x32x64_MI16x16x1_SN_CLR0_GSU0_GSUC0_GSUWGMRR0_K1_LBSPPA128_LBSPPB128_MIWT2_1_PLR0_SU0_SUM0_SUS0_SKXCCM8_VWA1_VWB1_WGM1_WGMXCC1_WGMXCCGn1
    SolutionIndex: 37
    SolutionNameMin: Cijk_Alik_Bljk_I8BH_UserArgs_MT64x32x64_MI16x16x1_SN_CLR0_GSU0_GSUC0_GSUWGMRR0_K1_LBSPPA128_LBSPPB128_MIWT2_1_PLR0_SU0_SUM0_SUS0_SKXCCM8_VWA2_VWB1_WGM4_WGMXCC1_WGMXCCGn1
    SolutionIndex: 38
    SolutionNameMin: Cijk_Alik_Bljk_I8BH_UserArgs_MT32x32x64_MI16x16x1_SN_CLR1_GSU0_GSUC0_GSUWGMRR0_K1_LBSPPA128_LBSPPB128_MIWT1_1_PLR1_SU0_SUM0_SUS0_SKXCCM8_VWA1_VWB1_WGM1_WGMXCC1_WGMXCCGn1
    SolutionIndex: 39
    SolutionNameMin: Cijk_Alik_Bljk_I8BH_UserArgs_MT32x32x64_MI16x16x1_SN_CLR1_GSU0_GSUC0_GSUWGMRR0_K1_LBSPPA128_LBSPPB128_MIWT1_1_PLR1_SU0_SUM0_SUS0_SKXCCM8_VWA1_VWB1_WGM1_WGMXCC1_WGMXCCGn1
    SolutionIndex: 40
    SolutionNameMin: Cijk_Alik_Bljk_I8BH_UserArgs_MT32x32x64_MI16x16x1_SN_CLR0_GSU0_GSUC0_GSUWGMRR0_K1_LBSPPA128_LBSPPB128_MIWT1_1_PLR0_SU0_SUM0_SUS0_SKXCCM8_VWA1_VWB1_WGM1_WGMXCC1_WGMXCCGn1
    SolutionIndex: 41
    SolutionNameMin: Cijk_Alik_Bljk_I8BH_UserArgs_MT32x32x64_MI16x16x1_SN_CLR0_GSU0_GSUC0_GSUWGMRR0_K1_LBSPPA128_LBSPPB128_MIWT1_1_PLR0_SU0_SUM0_SUS0_SKXCCM8_VWA1_VWB1_WGM1_WGMXCC1_WGMXCCGn1
    SolutionIndex: 42
    SolutionNameMin: Cijk_Alik_Bljk_I8BH_UserArgs_MT32x32x64_MI16x16x1_SN_CLR0_GSU0_GSUC0_GSUWGMRR0_K1_LBSPPA128_LBSPPB128_MIWT1_1_PLR0_SU0_SUM0_SUS0_SKXCCM8_VWA1_VWB1_WGM1_WGMXCC1_WGMXCCGn1
    SolutionIndex: 43
    SolutionNameMin: Cijk_Alik_Bljk_I8BH_UserArgs_MT128x256x128_MI16x16x1_SN_CLR1_GSU0_GSUC0_GSUWGMRR0_K1_LBSPPA512_LBSPPB128_MIWT4_8_PLR1_SU0_SUM0_SUS0_SKXCCM8_VWA4_VWB1_WGM1_WGMXCC1_WGMXCCGn1
    SolutionIndex: 44
    SolutionNameMin: Cijk_Alik_Bljk_I8BH_UserArgs_MT128x256x128_MI16x16x1_SN_CLR1_GSU0_GSUC0_GSUWGMRR0_K1_LBSPPA512_LBSPPB256_MIWT4_8_PLR1_SU0_SUM0_SUS0_SKXCCM8_VWA4_VWB2_WGM1_WGMXCC1_WGMXCCGn1
    SolutionIndex: 45
    SolutionNameMin: Cijk_Alik_Bljk_I8BH_UserArgs_MT128x256x128_MI16x16x1_SN_CLR1_GSU0_GSUC0_GSUWGMRR0_K1_LBSPPA512_LBSPPB512_MIWT4_8_PLR1_SU0_SUM0_SUS0_SKXCCM8_VWA4_VWB4_WGM1_WGMXCC1_WGMXCCGn1
    SolutionIndex: 46
    SolutionNameMin: Cijk_Alik_Bljk_I8BH_UserArgs_MT128x256x128_MI16x16x1_SN_CLR1_GSU0_GSUC0_GSUWGMRR0_K1_LBSPPA512_LBSPPB256_MIWT4_8_PLR1_SU0_SUM0_SUS0_SKXCCM8_VWA4_VWB2_WGM1_WGMXCC1_WGMXCCGn1
    SolutionIndex: 47
    SolutionNameMin: Cijk_Alik_Bljk_I8BH_UserArgs_MT128x256x128_MI16x16x1_SN_CLR1_GSU0_GSUC0_GSUWGMRR0_K1_LBSPPA512_LBSPPB256_MIWT4_8_PLR1_SU0_SUM0_SUS0_SKXCCM8_VWA4_VWB2_WGM4_WGMXCC1_WGMXCCGn1
    SolutionIndex: 48
    SolutionNameMin: Cijk_Alik_Bljk_I8BH_UserArgs_MT128x256x128_MI16x16x1_SN_CLR1_GSU0_GSUC0_GSUWGMRR0_K1_LBSPPA512_LBSPPB128_MIWT4_8_PLR1_SU0_SUM0_SUS0_SKXCCM8_VWA4_VWB1_WGM8_WGMXCC1_WGMXCCGn1
    SolutionIndex: 49
    SolutionNameMin: Cijk_Alik_Bljk_I8BH_UserArgs_MT256x128x128_MI16x16x1_SN_CLR1_GSU0_GSUC0_GSUWGMRR0_K1_LBSPPA512_LBSPPB128_MIWT8_4_PLR1_SU0_SUM0_SUS0_SKXCCM8_VWA4_VWB1_WGM1_WGMXCC1_WGMXCCGn1
    SolutionIndex: 50
    SolutionNameMin: Cijk_Alik_Bljk_I8BH_UserArgs_MT256x128x128_MI16x16x1_SN_CLR1_GSU0_GSUC0_GSUWGMRR0_K1_LBSPPA512_LBSPPB128_MIWT8_4_PLR1_SU0_SUM0_SUS0_SKXCCM8_VWA4_VWB1_WGM1_WGMXCC1_WGMXCCGn1
    SolutionIndex: 51
    SolutionNameMin: Cijk_Alik_Bljk_I8BH_UserArgs_MT256x128x128_MI16x16x1_SN_CLR1_GSU0_GSUC0_GSUWGMRR0_K1_LBSPPA512_LBSPPB256_MIWT8_4_PLR1_SU0_SUM0_SUS0_SKXCCM8_VWA4_VWB2_WGM1_WGMXCC1_WGMXCCGn1
    SolutionIndex: 52
    SolutionNameMin: Cijk_Alik_Bljk_I8BH_UserArgs_MT256x128x128_MI16x16x1_SN_CLR1_GSU0_GSUC0_GSUWGMRR0_K1_LBSPPA1024_LBSPPB512_MIWT8_4_PLR1_SU0_SUM0_SUS0_SKXCCM8_VWA8_VWB4_WGM1_WGMXCC1_WGMXCCGn1
    SolutionIndex: 53
    SolutionNameMin: Cijk_Alik_Bljk_I8BH_UserArgs_MT256x128x128_MI16x16x1_SN_CLR1_GSU0_GSUC0_GSUWGMRR0_K1_LBSPPA512_LBSPPB512_MIWT8_4_PLR1_SU0_SUM0_SUS0_SKXCCM8_VWA4_VWB4_WGM1_WGMXCC1_WGMXCCGn1
    SolutionIndex: 54
    SolutionNameMin: Cijk_Alik_Bljk_I8BH_UserArgs_MT256x128x128_MI16x16x1_SN_CLR1_GSU0_GSUC0_GSUWGMRR0_K1_LBSPPA512_LBSPPB512_MIWT8_4_PLR1_SU0_SUM0_SUS0_SKXCCM8_VWA4_VWB4_WGM4_WGMXCC1_WGMXCCGn1
    SolutionIndex: 55
    SolutionNameMin: Cijk_Alik_Bljk_I8BH_UserArgs_MT256x128x128_MI16x16x1_SN_CLR1_GSU0_GSUC0_GSUWGMRR0_K1_LBSPPA512_LBSPPB128_MIWT8_4_PLR1_SU0_SUM0_SUS0_SKXCCM8_VWA4_VWB1_WGM4_WGMXCC1_WGMXCCGn1
    SolutionIndex: 56
    SolutionNameMin: Cijk_Alik_Bljk_I8BH_UserArgs_MT256x128x128_MI16x16x1_SN_CLR1_GSU0_GSUC0_GSUWGMRR0_K1_LBSPPA512_LBSPPB256_MIWT8_4_PLR1_SU0_SUM0_SUS0_SKXCCM8_VWA4_VWB2_WGM8_WGMXCC1_WGMXCCGn1
    SolutionIndex: 57
    SolutionNameMin: Cijk_Alik_Bljk_I8BH_UserArgs_MT256x128x128_MI16x16x1_SN_CLR1_GSU0_GSUC0_GSUWGMRR0_K1_LBSPPA512_LBSPPB128_MIWT8_4_PLR1_SU0_SUM0_SUS0_SKXCCM8_VWA4_VWB1_WGM8_WGMXCC1_WGMXCCGn1
    SolutionIndex: 58
    SolutionNameMin: Cijk_Alik_Bljk_I8BH_UserArgs_MT256x128x128_MI16x16x1_SN_CLR1_GSU0_GSUC0_GSUWGMRR0_K1_LBSPPA1024_LBSPPB128_MIWT8_4_PLR1_SU0_SUM0_SUS0_SKXCCM8_VWA8_VWB1_WGM8_WGMXCC1_WGMXCCGn1
    SolutionIndex: 59
    SolutionNameMin: Cijk_Alik_Bljk_I8BH_UserArgs_MT256x128x128_MI16x16x1_SN_CLR1_GSU0_GSUC0_GSUWGMRR0_K1_LBSPPA512_LBSPPB256_MIWT8_4_PLR1_SU0_SUM0_SUS0_SKXCCM8_VWA4_VWB2_WGM8_WGMXCC1_WGMXCCGn1
    SolutionIndex: 60
    SolutionNameMin: Cijk_Alik_Bljk_I8BH_UserArgs_MT256x128x128_MI16x16x1_SN_CLR1_GSU0_GSUC0_GSUWGMRR0_K1_LBSPPA1024_LBSPPB256_MIWT8_4_PLR1_SU0_SUM0_SUS0_SKXCCM8_VWA8_VWB2_WGM8_WGMXCC1_WGMXCCGn1
    SolutionIndex: 61
    SolutionNameMin: Cijk_Alik_Bljk_I8BH_UserArgs_MT256x128x128_MI16x16x1_SN_CLR1_GSU0_GSUC0_GSUWGMRR0_K1_LBSPPA1024_LBSPPB512_MIWT8_4_PLR1_SU0_SUM0_SUS0_SKXCCM8_VWA8_VWB4_WGM8_WGMXCC1_WGMXCCGn1
    SolutionIndex: 62
    SolutionNameMin: Cijk_Alik_Bljk_I8BH_UserArgs_MT256x128x128_MI16x16x1_SN_CLR1_GSU0_GSUC0_GSUWGMRR0_K1_LBSPPA512_LBSPPB512_MIWT8_4_PLR1_SU0_SUM0_SUS0_SKXCCM8_VWA4_VWB4_WGM8_WGMXCC1_WGMXCCGn1
    SolutionIndex: 63
    SolutionNameMin: Cijk_Alik_Bljk_I8BH_UserArgs_MT128x128x128_MI16x16x1_SN_CLR1_GSU0_GSUC0_GSUWGMRR0_K1_LBSPPA512_LBSPPB128_MIWT4_4_PLR1_SU0_SUM0_SUS0_SKXCCM8_VWA4_VWB1_WGM1_WGMXCC1_WGMXCCGn1
    SolutionIndex: 64
    SolutionNameMin: Cijk_Alik_Bljk_I8BH_UserArgs_MT128x128x128_MI16x16x1_SN_CLR1_GSU0_GSUC0_GSUWGMRR0_K1_LBSPPA512_LBSPPB512_MIWT4_4_PLR1_SU0_SUM0_SUS0_SKXCCM8_VWA4_VWB4_WGM1_WGMXCC1_WGMXCCGn1
    SolutionIndex: 65
    SolutionNameMin: Cijk_Alik_Bljk_I8BH_UserArgs_MT128x128x128_MI16x16x1_SN_CLR1_GSU0_GSUC0_GSUWGMRR0_K1_LBSPPA512_LBSPPB128_MIWT4_4_PLR1_SU0_SUM0_SUS0_SKXCCM8_VWA4_VWB1_WGM1_WGMXCC1_WGMXCCGn1
    SolutionIndex: 66
    SolutionNameMin: Cijk_Alik_Bljk_I8BH_UserArgs_MT128x128x128_MI16x16x1_SN_CLR1_GSU0_GSUC0_GSUWGMRR0_K1_LBSPPA512_LBSPPB256_MIWT4_4_PLR1_SU0_SUM0_SUS0_SKXCCM8_VWA4_VWB2_WGM1_WGMXCC1_WGMXCCGn1
    SolutionIndex: 67
    SolutionNameMin: Cijk_Alik_Bljk_I8BH_UserArgs_MT128x128x128_MI16x16x1_SN_CLR1_GSU0_GSUC0_GSUWGMRR0_K1_LBSPPA512_LBSPPB512_MIWT4_4_PLR1_SU0_SUM0_SUS0_SKXCCM8_VWA4_VWB4_WGM1_WGMXCC1_WGMXCCGn1
    SolutionIndex: 68
    SolutionNameMin: Cijk_Alik_Bljk_I8BH_UserArgs_MT128x128x128_MI16x16x1_SN_CLR1_GSU0_GSUC0_GSUWGMRR0_K1_LBSPPA512_LBSPPB128_MIWT4_4_PLR2_SU0_SUM0_SUS0_SKXCCM8_VWA4_VWB1_WGM1_WGMXCC1_WGMXCCGn1
    SolutionIndex: 69
    SolutionNameMin: Cijk_Alik_Bljk_I8BH_UserArgs_MT128x128x128_MI16x16x1_SN_CLR1_GSU0_GSUC0_GSUWGMRR0_K1_LBSPPA512_LBSPPB256_MIWT4_4_PLR2_SU0_SUM0_SUS0_SKXCCM8_VWA4_VWB2_WGM1_WGMXCC1_WGMXCCGn1
    SolutionIndex: 70
    SolutionNameMin: Cijk_Alik_Bljk_I8BH_UserArgs_MT128x128x128_MI16x16x1_SN_CLR1_GSU0_GSUC0_GSUWGMRR0_K1_LBSPPA512_LBSPPB512_MIWT4_4_PLR2_SU0_SUM0_SUS0_SKXCCM8_VWA4_VWB4_WGM1_WGMXCC1_WGMXCCGn1
    SolutionIndex: 71
    SolutionNameMin: Cijk_Alik_Bljk_I8BH_UserArgs_MT128x128x128_MI16x16x1_SN_CLR1_GSU0_GSUC0_GSUWGMRR0_K1_LBSPPA512_LBSPPB128_MIWT4_4_PLR1_SU0_SUM0_SUS0_SKXCCM8_VWA4_VWB1_WGM4_WGMXCC1_WGMXCCGn1
    SolutionIndex: 72
    SolutionNameMin: Cijk_Alik_Bljk_I8BH_UserArgs_MT128x128x128_MI16x16x1_SN_CLR1_GSU0_GSUC0_GSUWGMRR0_K1_LBSPPA256_LBSPPB512_MIWT4_4_PLR1_SU0_SUM0_SUS0_SKXCCM8_VWA2_VWB4_WGM4_WGMXCC1_WGMXCCGn1
    SolutionIndex: 73
    SolutionNameMin: Cijk_Alik_Bljk_I8BH_UserArgs_MT128x128x128_MI16x16x1_SN_CLR1_GSU0_GSUC0_GSUWGMRR0_K1_LBSPPA512_LBSPPB128_MIWT4_4_PLR1_SU0_SUM0_SUS0_SKXCCM8_VWA4_VWB1_WGM4_WGMXCC1_WGMXCCGn1
    SolutionIndex: 74
    SolutionNameMin: Cijk_Alik_Bljk_I8BH_UserArgs_MT128x128x128_MI16x16x1_SN_CLR1_GSU0_GSUC0_GSUWGMRR0_K1_LBSPPA512_LBSPPB256_MIWT4_4_PLR1_SU0_SUM0_SUS0_SKXCCM8_VWA4_VWB2_WGM4_WGMXCC1_WGMXCCGn1
    SolutionIndex: 75
    SolutionNameMin: Cijk_Alik_Bljk_I8BH_UserArgs_MT128x128x128_MI16x16x1_SN_CLR1_GSU0_GSUC0_GSUWGMRR0_K1_LBSPPA512_LBSPPB512_MIWT4_4_PLR1_SU0_SUM0_SUS0_SKXCCM8_VWA4_VWB4_WGM4_WGMXCC1_WGMXCCGn1
    SolutionIndex: 76
    SolutionNameMin: Cijk_Alik_Bljk_I8BH_UserArgs_MT128x128x128_MI16x16x1_SN_CLR1_GSU0_GSUC0_GSUWGMRR0_K1_LBSPPA512_LBSPPB128_MIWT4_4_PLR2_SU0_SUM0_SUS0_SKXCCM8_VWA4_VWB1_WGM4_WGMXCC1_WGMXCCGn1
    SolutionIndex: 77
    SolutionNameMin: Cijk_Alik_Bljk_I8BH_UserArgs_MT128x128x128_MI16x16x1_SN_CLR1_GSU0_GSUC0_GSUWGMRR0_K1_LBSPPA512_LBSPPB256_MIWT4_4_PLR1_SU0_SUM0_SUS0_SKXCCM8_VWA4_VWB2_WGM8_WGMXCC1_WGMXCCGn1
    SolutionIndex: 78
    SolutionNameMin: Cijk_Alik_Bljk_I8BH_UserArgs_MT128x128x128_MI16x16x1_SN_CLR1_GSU0_GSUC0_GSUWGMRR0_K1_LBSPPA512_LBSPPB256_MIWT4_4_PLR1_SU0_SUM0_SUS0_SKXCCM8_VWA4_VWB2_WGM8_WGMXCC1_WGMXCCGn1
    SolutionIndex: 79
    SolutionNameMin: Cijk_Alik_Bljk_I8BH_UserArgs_MT64x128x128_MI16x16x1_SN_CLR1_GSU0_GSUC0_GSUWGMRR0_K1_LBSPPA256_LBSPPB256_MIWT2_4_PLR1_SU0_SUM0_SUS0_SKXCCM8_VWA2_VWB2_WGM1_WGMXCC1_WGMXCCGn1
    SolutionIndex: 80
    SolutionNameMin: Cijk_Alik_Bljk_I8BH_UserArgs_MT128x64x128_MI16x16x1_SN_CLR1_GSU0_GSUC0_GSUWGMRR0_K1_LBSPPA512_LBSPPB256_MIWT4_2_PLR1_SU0_SUM0_SUS0_SKXCCM8_VWA4_VWB2_WGM1_WGMXCC1_WGMXCCGn1
    SolutionIndex: 81
    SolutionNameMin: Cijk_Alik_Bljk_I8BH_UserArgs_MT128x64x128_MI16x16x1_SN_CLR1_GSU0_GSUC0_GSUWGMRR0_K1_LBSPPA512_LBSPPB128_MIWT4_2_PLR1_SU0_SUM0_SUS0_SKXCCM8_VWA4_VWB1_WGM1_WGMXCC1_WGMXCCGn1
    SolutionIndex: 82
    SolutionNameMin: Cijk_Alik_Bljk_I8BH_UserArgs_MT128x64x128_MI16x16x1_SN_CLR1_GSU0_GSUC0_GSUWGMRR0_K1_LBSPPA512_LBSPPB256_MIWT4_2_PLR1_SU0_SUM0_SUS0_SKXCCM8_VWA4_VWB2_WGM1_WGMXCC1_WGMXCCGn1
    SolutionIndex: 83
    SolutionNameMin: Cijk_Alik_Bljk_I8BH_UserArgs_MT128x64x128_MI16x16x1_SN_CLR1_GSU0_GSUC0_GSUWGMRR0_K1_LBSPPA512_LBSPPB128_MIWT4_2_PLR1_SU0_SUM0_SUS0_SKXCCM8_VWA4_VWB1_WGM1_WGMXCC1_WGMXCCGn1
    SolutionIndex: 84
    SolutionNameMin: Cijk_Alik_Bljk_I8BH_UserArgs_MT128x64x128_MI16x16x1_SN_CLR1_GSU0_GSUC0_GSUWGMRR0_K1_LBSPPA512_LBSPPB256_MIWT4_2_PLR1_SU0_SUM0_SUS0_SKXCCM8_VWA4_VWB2_WGM1_WGMXCC1_WGMXCCGn1
    SolutionIndex: 85
    SolutionNameMin: Cijk_Alik_Bljk_I8BH_UserArgs_MT128x64x128_MI16x16x1_SN_CLR1_GSU0_GSUC0_GSUWGMRR0_K1_LBSPPA512_LBSPPB128_MIWT4_2_PLR1_SU0_SUM0_SUS0_SKXCCM8_VWA4_VWB1_WGM4_WGMXCC1_WGMXCCGn1
    SolutionIndex: 86
    SolutionNameMin: Cijk_Alik_Bljk_I8BH_UserArgs_MT128x64x128_MI16x16x1_SN_CLR1_GSU0_GSUC0_GSUWGMRR0_K1_LBSPPA512_LBSPPB256_MIWT4_2_PLR1_SU0_SUM0_SUS0_SKXCCM8_VWA4_VWB2_WGM4_WGMXCC1_WGMXCCGn1
    SolutionIndex: 87
    SolutionNameMin: Cijk_Alik_Bljk_I8BH_UserArgs_MT128x64x128_MI16x16x1_SN_CLR1_GSU0_GSUC0_GSUWGMRR0_K1_LBSPPA512_LBSPPB128_MIWT4_2_PLR1_SU0_SUM0_SUS0_SKXCCM8_VWA4_VWB1_WGM8_WGMXCC1_WGMXCCGn1
    SolutionIndex: 88
    SolutionNameMin: Cijk_Alik_Bljk_I8BH_UserArgs_MT128x64x128_MI16x16x1_SN_CLR1_GSU0_GSUC0_GSUWGMRR0_K1_LBSPPA512_LBSPPB128_MIWT4_2_PLR1_SU0_SUM0_SUS0_SKXCCM8_VWA4_VWB1_WGM8_WGMXCC1_WGMXCCGn1
    SolutionIndex: 89
    SolutionNameMin: Cijk_Alik_Bljk_I8BH_UserArgs_MT128x64x128_MI16x16x1_SN_CLR1_GSU0_GSUC0_GSUWGMRR0_K1_LBSPPA512_LBSPPB256_MIWT4_2_PLR1_SU0_SUM0_SUS0_SKXCCM8_VWA4_VWB2_WGM8_WGMXCC1_WGMXCCGn1
    SolutionIndex: 90
    SolutionNameMin: Cijk_Alik_Bljk_I8BH_UserArgs_MT128x32x128_MI16x16x1_SN_CLR1_GSU0_GSUC0_GSUWGMRR0_K1_LBSPPA512_LBSPPB128_MIWT4_1_PLR2_SU0_SUM0_SUS0_SKXCCM8_VWA4_VWB1_WGM1_WGMXCC1_WGMXCCGn1
    SolutionIndex: 91
    SolutionNameMin: Cijk_Alik_Bljk_I8BH_UserArgs_MT64x64x128_MI16x16x1_SN_CLR1_GSU0_GSUC0_GSUWGMRR0_K1_LBSPPA256_LBSPPB128_MIWT2_2_PLR1_SU0_SUM0_SUS0_SKXCCM8_VWA2_VWB1_WGM1_WGMXCC1_WGMXCCGn1
    SolutionIndex: 92
    SolutionNameMin: Cijk_Alik_Bljk_I8BH_UserArgs_MT64x64x128_MI16x16x1_SN_CLR1_GSU0_GSUC0_GSUWGMRR0_K1_LBSPPA256_LBSPPB128_MIWT2_2_PLR1_SU0_SUM0_SUS0_SKXCCM8_VWA2_VWB1_WGM1_WGMXCC1_WGMXCCGn1
    SolutionIndex: 93
    SolutionNameMin: Cijk_Alik_Bljk_I8BH_UserArgs_MT64x64x128_MI16x16x1_SN_CLR1_GSU0_GSUC0_GSUWGMRR0_K1_LBSPPA256_LBSPPB256_MIWT2_2_PLR1_SU0_SUM0_SUS0_SKXCCM8_VWA2_VWB2_WGM1_WGMXCC1_WGMXCCGn1
    SolutionIndex: 94
    SolutionNameMin: Cijk_Alik_Bljk_I8BH_UserArgs_MT64x64x128_MI16x16x1_SN_CLR1_GSU0_GSUC0_GSUWGMRR0_K1_LBSPPA256_LBSPPB128_MIWT2_2_PLR1_SU0_SUM0_SUS0_SKXCCM8_VWA2_VWB1_WGM4_WGMXCC1_WGMXCCGn1
    SolutionIndex: 95
    SolutionNameMin: Cijk_Alik_Bljk_I8BH_UserArgs_MT64x64x128_MI16x16x1_SN_CLR1_GSU0_GSUC0_GSUWGMRR0_K1_LBSPPA256_LBSPPB128_MIWT2_2_PLR1_SU0_SUM0_SUS0_SKXCCM8_VWA2_VWB1_WGM8_WGMXCC1_WGMXCCGn1
    SolutionIndex: 96
    SolutionNameMin: Cijk_Alik_Bljk_I8BH_UserArgs_MT32x64x128_MI16x16x1_SN_CLR1_GSU0_GSUC0_GSUWGMRR0_K1_LBSPPA128_LBSPPB128_MIWT1_2_PLR1_SU0_SUM0_SUS0_SKXCCM8_VWA1_VWB1_WGM1_WGMXCC1_WGMXCCGn1
    SolutionIndex: 97
    SolutionNameMin: Cijk_Alik_Bljk_I8BH_UserArgs_MT32x64x128_MI16x16x1_SN_CLR1_GSU0_GSUC0_GSUWGMRR0_K1_LBSPPA128_LBSPPB256_MIWT1_2_PLR1_SU0_SUM0_SUS0_SKXCCM8_VWA1_VWB2_WGM1_WGMXCC1_WGMXCCGn1
    SolutionIndex: 98
    SolutionNameMin: Cijk_Alik_Bljk_I8BH_UserArgs_MT32x64x128_MI16x16x1_SN_CLR1_GSU0_GSUC0_GSUWGMRR0_K1_LBSPPA128_LBSPPB128_MIWT1_2_PLR1_SU0_SUM0_SUS0_SKXCCM8_VWA1_VWB1_WGM1_WGMXCC1_WGMXCCGn1
    SolutionIndex: 99
    SolutionNameMin: Cijk_Alik_Bljk_I8BH_UserArgs_MT32x64x128_MI16x16x1_SN_CLR1_GSU0_GSUC0_GSUWGMRR0_K1_LBSPPA128_LBSPPB128_MIWT1_2_PLR2_SU0_SUM0_SUS0_SKXCCM8_VWA1_VWB1_WGM1_WGMXCC1_WGMXCCGn1
    SolutionIndex: 100
    SolutionNameMin: Cijk_Alik_Bljk_I8BH_UserArgs_MT32x64x128_MI16x16x1_SN_CLR1_GSU0_GSUC0_GSUWGMRR0_K1_LBSPPA128_LBSPPB128_MIWT1_2_PLR1_SU0_SUM0_SUS0_SKXCCM8_VWA1_VWB1_WGM4_WGMXCC1_WGMXCCGn1
    SolutionIndex: 101
    SolutionNameMin: Cijk_Alik_Bljk_I8BH_UserArgs_MT32x64x128_MI16x16x1_SN_CLR1_GSU0_GSUC0_GSUWGMRR0_K1_LBSPPA128_LBSPPB256_MIWT1_2_PLR1_SU0_SUM0_SUS0_SKXCCM8_VWA1_VWB2_WGM4_WGMXCC1_WGMXCCGn1
    SolutionIndex: 102
    SolutionNameMin: Cijk_Alik_Bljk_I8BH_UserArgs_MT32x64x128_MI16x16x1_SN_CLR1_GSU0_GSUC0_GSUWGMRR0_K1_LBSPPA128_LBSPPB256_MIWT1_2_PLR1_SU0_SUM0_SUS0_SKXCCM8_VWA1_VWB2_WGM8_WGMXCC1_WGMXCCGn1
    SolutionIndex: 103
    SolutionNameMin: Cijk_Alik_Bljk_I8BH_UserArgs_MT64x32x128_MI16x16x1_SN_CLR1_GSU0_GSUC0_GSUWGMRR0_K1_LBSPPA256_LBSPPB128_MIWT2_1_PLR1_SU0_SUM0_SUS0_SKXCCM8_VWA2_VWB1_WGM1_WGMXCC1_WGMXCCGn1
    SolutionIndex: 104
    SolutionNameMin: Cijk_Alik_Bljk_I8BH_UserArgs_MT64x32x128_MI16x16x1_SN_CLR1_GSU0_GSUC0_GSUWGMRR0_K1_LBSPPA128_LBSPPB128_MIWT2_1_PLR1_SU0_SUM0_SUS0_SKXCCM8_VWA1_VWB1_WGM1_WGMXCC1_WGMXCCGn1
    SolutionIndex: 105
    SolutionNameMin: Cijk_Alik_Bljk_I8BH_UserArgs_MT64x32x128_MI16x16x1_SN_CLR1_GSU0_GSUC0_GSUWGMRR0_K1_LBSPPA256_LBSPPB128_MIWT2_1_PLR1_SU0_SUM0_SUS0_SKXCCM8_VWA2_VWB1_WGM1_WGMXCC1_WGMXCCGn1
    SolutionIndex: 106
    SolutionNameMin: Cijk_Alik_Bljk_I8BH_UserArgs_MT64x32x128_MI16x16x1_SN_CLR1_GSU0_GSUC0_GSUWGMRR0_K1_LBSPPA128_LBSPPB128_MIWT2_1_PLR1_SU0_SUM0_SUS0_SKXCCM8_VWA1_VWB1_WGM1_WGMXCC1_WGMXCCGn1
    SolutionIndex: 107
    SolutionNameMin: Cijk_Alik_Bljk_I8BH_UserArgs_MT64x32x128_MI16x16x1_SN_CLR1_GSU0_GSUC0_GSUWGMRR0_K1_LBSPPA256_LBSPPB128_MIWT2_1_PLR1_SU0_SUM0_SUS0_SKXCCM8_VWA2_VWB1_WGM1_WGMXCC1_WGMXCCGn1
    SolutionIndex: 108
    SolutionNameMin: Cijk_Alik_Bljk_I8BH_UserArgs_MT64x32x128_MI16x16x1_SN_CLR1_GSU0_GSUC0_GSUWGMRR0_K1_LBSPPA256_LBSPPB128_MIWT2_1_PLR2_SU0_SUM0_SUS0_SKXCCM8_VWA2_VWB1_WGM1_WGMXCC1_WGMXCCGn1
    SolutionIndex: 109
    SolutionNameMin: Cijk_Alik_Bljk_I8BH_UserArgs_MT64x32x128_MI16x16x1_SN_CLR1_GSU0_GSUC0_GSUWGMRR0_K1_LBSPPA256_LBSPPB128_MIWT2_1_PLR1_SU0_SUM0_SUS0_SKXCCM8_VWA2_VWB1_WGM8_WGMXCC1_WGMXCCGn1
    SolutionIndex: 110
    SolutionNameMin: Cijk_Alik_Bljk_I8BH_UserArgs_MT32x32x128_MI16x16x1_SN_CLR1_GSU0_GSUC0_GSUWGMRR0_K1_LBSPPA128_LBSPPB128_MIWT1_1_PLR1_SU0_SUM0_SUS0_SKXCCM8_VWA1_VWB1_WGM1_WGMXCC1_WGMXCCGn1
    SolutionIndex: 111
    SolutionNameMin: Cijk_Alik_Bljk_I8BH_UserArgs_MT32x32x128_MI16x16x1_SN_CLR1_GSU0_GSUC0_GSUWGMRR0_K1_LBSPPA128_LBSPPB128_MIWT1_1_PLR1_SU0_SUM0_SUS0_SKXCCM8_VWA1_VWB1_WGM1_WGMXCC1_WGMXCCGn1
    SolutionIndex: 112
    SolutionNameMin: Cijk_Alik_Bljk_I8BH_UserArgs_MT32x32x128_MI16x16x1_SN_CLR1_GSU0_GSUC0_GSUWGMRR0_K1_LBSPPA128_LBSPPB128_MIWT1_1_PLR1_SU0_SUM0_SUS0_SKXCCM8_VWA1_VWB1_WGM1_WGMXCC1_WGMXCCGn1
    SolutionIndex: 113
    SolutionNameMin: Cijk_Alik_Bljk_I8BH_UserArgs_MT32x32x128_MI16x16x1_SN_CLR1_GSU0_GSUC0_GSUWGMRR0_K1_LBSPPA128_LBSPPB128_MIWT1_1_PLR1_SU0_SUM0_SUS0_SKXCCM8_VWA1_VWB1_WGM1_WGMXCC1_WGMXCCGn1
    SolutionIndex: 114
    SolutionNameMin: Cijk_Alik_Bljk_I8BH_UserArgs_MT32x32x128_MI16x16x1_SN_CLR1_GSU0_GSUC0_GSUWGMRR0_K1_LBSPPA128_LBSPPB128_MIWT1_1_PLR2_SU0_SUM0_SUS0_SKXCCM8_VWA1_VWB1_WGM1_WGMXCC1_WGMXCCGn1
    SolutionIndex: 115
    SolutionNameMin: Cijk_Alik_Bljk_I8BH_UserArgs_MT32x32x128_MI16x16x1_SN_CLR1_GSU0_GSUC0_GSUWGMRR0_K1_LBSPPA128_LBSPPB128_MIWT1_1_PLR2_SU0_SUM0_SUS0_SKXCCM8_VWA1_VWB1_WGM1_WGMXCC1_WGMXCCGn1
    SolutionIndex: 116
    SolutionNameMin: Cijk_Alik_Bljk_I8BH_UserArgs_MT32x32x128_MI16x16x1_SN_CLR1_GSU0_GSUC0_GSUWGMRR0_K1_LBSPPA128_LBSPPB128_MIWT1_1_PLR2_SU0_SUM0_SUS0_SKXCCM8_VWA1_VWB1_WGM1_WGMXCC1_WGMXCCGn1
    SolutionIndex: 117
    SolutionNameMin: Cijk_Alik_Bljk_I8BH_UserArgs_MT32x32x128_MI16x16x1_SN_CLR1_GSU0_GSUC0_GSUWGMRR0_K1_LBSPPA128_LBSPPB128_MIWT1_1_PLR2_SU0_SUM0_SUS0_SKXCCM8_VWA1_VWB1_WGM1_WGMXCC1_WGMXCCGn1
    SolutionIndex: 118
    SolutionNameMin: Cijk_Alik_Bljk_I8BH_UserArgs_MT32x32x128_MI16x16x1_SN_CLR1_GSU0_GSUC0_GSUWGMRR0_K1_LBSPPA128_LBSPPB128_MIWT1_1_PLR1_SU0_SUM0_SUS0_SKXCCM8_VWA1_VWB1_WGM4_WGMXCC1_WGMXCCGn1
    SolutionIndex: 119
    SolutionNameMin: Cijk_Alik_Bljk_I8BH_UserArgs_MT32x32x128_MI16x16x1_SN_CLR1_GSU0_GSUC0_GSUWGMRR0_K1_LBSPPA128_LBSPPB128_MIWT1_1_PLR1_SU0_SUM0_SUS0_SKXCCM8_VWA1_VWB1_WGM4_WGMXCC1_WGMXCCGn1
    SolutionIndex: 120
    SolutionNameMin: Cijk_Alik_Bljk_I8BH_UserArgs_MT32x32x128_MI16x16x1_SN_CLR1_GSU0_GSUC0_GSUWGMRR0_K1_LBSPPA128_LBSPPB128_MIWT1_1_PLR1_SU0_SUM0_SUS0_SKXCCM8_VWA1_VWB1_WGM8_WGMXCC1_WGMXCCGn1
    SolutionIndex: 121
    SolutionNameMin: Cijk_Alik_Bljk_I8BH_UserArgs_MT64x128x256_MI16x16x1_SN_CLR1_GSU0_GSUC0_GSUWGMRR0_K1_LBSPPA512_LBSPPB1024_MIWT2_4_PLR2_SU0_SUM0_SUS0_SKXCCM8_VWA2_VWB4_WGM1_WGMXCC1_WGMXCCGn1
    SolutionIndex: 122
    SolutionNameMin: Cijk_Alik_Bljk_I8BH_UserArgs_MT64x128x256_MI16x16x1_SN_CLR1_GSU0_GSUC0_GSUWGMRR0_K1_LBSPPA512_LBSPPB512_MIWT2_4_PLR2_SU0_SUM0_SUS0_SKXCCM8_VWA2_VWB2_WGM4_WGMXCC1_WGMXCCGn1
    SolutionIndex: 123
    SolutionNameMin: Cijk_Alik_Bljk_I8BH_UserArgs_MT64x128x256_MI16x16x1_SN_CLR1_GSU0_GSUC0_GSUWGMRR0_K1_LBSPPA512_LBSPPB256_MIWT2_4_PLR2_SU0_SUM0_SUS0_SKXCCM8_VWA2_VWB1_WGM8_WGMXCC1_WGMXCCGn1
    SolutionIndex: 124
    SolutionNameMin: Cijk_Alik_Bljk_I8BH_UserArgs_MT128x64x256_MI16x16x1_SN_CLR1_GSU0_GSUC0_GSUWGMRR0_K1_LBSPPA1024_LBSPPB256_MIWT4_2_PLR1_SU0_SUM0_SUS0_SKXCCM8_VWA4_VWB1_WGM4_WGMXCC1_WGMXCCGn1
    SolutionIndex: 125
    SolutionNameMin: Cijk_Alik_Bljk_I8BH_UserArgs_MT128x64x256_MI16x16x1_SN_CLR1_GSU0_GSUC0_GSUWGMRR0_K1_LBSPPA1024_LBSPPB256_MIWT4_2_PLR2_SU0_SUM0_SUS0_SKXCCM8_VWA4_VWB1_WGM4_WGMXCC1_WGMXCCGn1
    SolutionIndex: 126
    SolutionNameMin: Cijk_Alik_Bljk_I8BH_UserArgs_MT128x64x256_MI16x16x1_SN_CLR1_GSU0_GSUC0_GSUWGMRR0_K1_LBSPPA1024_LBSPPB512_MIWT4_2_PLR2_SU0_SUM0_SUS0_SKXCCM8_VWA4_VWB2_WGM4_WGMXCC1_WGMXCCGn1
    SolutionIndex: 127
    SolutionNameMin: Cijk_Alik_Bljk_I8BH_UserArgs_MT128x64x256_MI16x16x1_SN_CLR1_GSU0_GSUC0_GSUWGMRR0_K1_LBSPPA512_LBSPPB256_MIWT4_2_PLR2_SU0_SUM0_SUS0_SKXCCM8_VWA2_VWB1_WGM8_WGMXCC1_WGMXCCGn1
    SolutionIndex: 128
    SolutionNameMin: Cijk_Alik_Bljk_I8BH_UserArgs_MT128x64x256_MI16x16x1_SN_CLR1_GSU0_GSUC0_GSUWGMRR0_K1_LBSPPA1024_LBSPPB256_MIWT4_2_PLR2_SU0_SUM0_SUS0_SKXCCM8_VWA4_VWB1_WGM8_WGMXCC1_WGMXCCGn1
    SolutionIndex: 129
    SolutionNameMin: Cijk_Alik_Bljk_I8BH_UserArgs_MT128x64x256_MI16x16x1_SN_CLR1_GSU0_GSUC0_GSUWGMRR0_K1_LBSPPA1024_LBSPPB512_MIWT4_2_PLR2_SU0_SUM0_SUS0_SKXCCM8_VWA4_VWB2_WGM8_WGMXCC1_WGMXCCGn1
    SolutionIndex: 130
    SolutionNameMin: Cijk_Alik_Bljk_I8BH_UserArgs_MT128x64x256_MI16x16x1_SN_CLR1_GSU0_GSUC0_GSUWGMRR0_K1_LBSPPA512_LBSPPB256_MIWT4_2_PLR2_SU0_SUM0_SUS0_SKXCCM8_VWA2_VWB1_WGM8_WGMXCC1_WGMXCCGn1
    SolutionIndex: 131
    SolutionNameMin: Cijk_Alik_Bljk_I8BH_UserArgs_MT64x64x256_MI16x16x1_SN_CLR1_GSU0_GSUC0_GSUWGMRR0_K1_LBSPPA512_LBSPPB256_MIWT2_2_PLR1_SU0_SUM0_SUS0_SKXCCM8_VWA2_VWB1_WGM1_WGMXCC1_WGMXCCGn1
    SolutionIndex: 132
    SolutionNameMin: Cijk_Alik_Bljk_I8BH_UserArgs_MT64x64x256_MI16x16x1_SN_CLR1_GSU0_GSUC0_GSUWGMRR0_K1_LBSPPA512_LBSPPB256_MIWT2_2_PLR2_SU0_SUM0_SUS0_SKXCCM8_VWA2_VWB1_WGM1_WGMXCC1_WGMXCCGn1
    SolutionIndex: 133
    SolutionNameMin: Cijk_Alik_Bljk_I8BH_UserArgs_MT64x64x256_MI16x16x1_SN_CLR1_GSU0_GSUC0_GSUWGMRR0_K1_LBSPPA512_LBSPPB256_MIWT2_2_PLR1_SU0_SUM0_SUS0_SKXCCM8_VWA2_VWB1_WGM4_WGMXCC1_WGMXCCGn1
    SolutionIndex: 134
    SolutionNameMin: Cijk_Alik_Bljk_I8BH_UserArgs_MT64x64x256_MI16x16x1_SN_CLR1_GSU0_GSUC0_GSUWGMRR0_K1_LBSPPA512_LBSPPB512_MIWT2_2_PLR1_SU0_SUM0_SUS0_SKXCCM8_VWA2_VWB2_WGM4_WGMXCC1_WGMXCCGn1
    SolutionIndex: 135
    SolutionNameMin: Cijk_Alik_Bljk_I8BH_UserArgs_MT64x64x256_MI16x16x1_SN_CLR1_GSU0_GSUC0_GSUWGMRR0_K1_LBSPPA512_LBSPPB512_MIWT2_2_PLR1_SU0_SUM0_SUS0_SKXCCM8_VWA2_VWB2_WGM8_WGMXCC1_WGMXCCGn1
    SolutionIndex: 136
    SolutionNameMin: Cijk_Alik_Bljk_I8BH_UserArgs_MT64x64x256_MI16x16x1_SN_CLR1_GSU0_GSUC0_GSUWGMRR0_K1_LBSPPA512_LBSPPB512_MIWT2_2_PLR2_SU0_SUM0_SUS0_SKXCCM8_VWA2_VWB2_WGM8_WGMXCC1_WGMXCCGn1
    SolutionIndex: 137
    SolutionNameMin: Cijk_Alik_Bljk_I8BH_UserArgs_MT32x32x256_MI16x16x1_SN_CLR1_GSU0_GSUC0_GSUWGMRR0_K1_LBSPPA256_LBSPPB256_MIWT1_1_PLR1_SU0_SUM0_SUS0_SKXCCM8_VWA1_VWB1_WGM1_WGMXCC1_WGMXCCGn1
    SolutionIndex: 138
    SolutionNameMin: Cijk_Alik_Bljk_I8BH_UserArgs_MT32x32x256_MI16x16x1_SN_CLR1_GSU0_GSUC0_GSUWGMRR0_K1_LBSPPA256_LBSPPB256_MIWT1_1_PLR2_SU0_SUM0_SUS0_SKXCCM8_VWA1_VWB1_WGM1_WGMXCC1_WGMXCCGn1
    SolutionIndex: 139
    SolutionNameMin: Cijk_Alik_Bljk_I8BH_UserArgs_MT32x32x256_MI16x16x1_SN_CLR1_GSU0_GSUC0_GSUWGMRR0_K1_LBSPPA256_LBSPPB256_MIWT1_1_PLR1_SU0_SUM0_SUS0_SKXCCM8_VWA1_VWB1_WGM4_WGMXCC1_WGMXCCGn1
    SolutionIndex: 140
    SolutionNameMin: Cijk_Alik_Bljk_I8BH_UserArgs_MT32x32x256_MI16x16x1_SN_CLR1_GSU0_GSUC0_GSUWGMRR0_K1_LBSPPA256_LBSPPB256_MIWT1_1_PLR2_SU0_SUM0_SUS0_SKXCCM8_VWA1_VWB1_WGM4_WGMXCC1_WGMXCCGn1
    SolutionIndex: 141
    SolutionNameMin: Cijk_Alik_Bljk_I8BH_UserArgs_MT32x32x256_MI16x16x1_SN_CLR1_GSU0_GSUC0_GSUWGMRR0_K1_LBSPPA256_LBSPPB256_MIWT1_1_PLR2_SU0_SUM0_SUS0_SKXCCM8_VWA1_VWB1_WGM4_WGMXCC1_WGMXCCGn1
    SolutionIndex: 142
    SolutionNameMin: Cijk_Alik_Bljk_I8BH_UserArgs_MT32x32x256_MI16x16x1_SN_CLR1_GSU0_GSUC0_GSUWGMRR0_K1_LBSPPA256_LBSPPB256_MIWT1_1_PLR2_SU0_SUM0_SUS0_SKXCCM8_VWA1_VWB1_WGM8_WGMXCC1_WGMXCCGn1
    SolutionIndex: 143
    SolutionNameMin: Cijk_Alik_Bljk_I8BH_UserArgs_MT32x32x32_MI16x16x1_SN_CLR0_GSU0_GSUC0_GSUWGMRR0_K1_LBSPPA128_LBSPPB128_MIWT1_1_PLR0_SU32_SUM0_SUS256_SKXCCM8_VWA1_VWB1_WGM1_WGMXCC1_WGMXCCGn1
- - - [128, 128, 1, 128, 128, 128, 128, 128]
    - [40, 0.59]
  - - [128, 128, 1, 256, 128, 128, 256, 256]
    - [113, 1.14]
  - - [128, 128, 1, 512, 128, 128, 512, 512]
    - [112, 2.12]
  - - [128, 128, 1, 1024, 128, 128, 1024, 1024]
    - [112, 3.65]
  - - [128, 128, 1, 2048, 128, 128, 2048, 2048]
    - [137, 5.56]
  - - [128, 128, 1, 4096, 128, 128, 4096, 4096]
    - [41, 7.96]
  - - [128, 128, 1, 8192, 128, 128, 8192, 8192]
    - [112, 14.41]
  - - [128, 256, 1, 128, 128, 128, 128, 128]
    - [106, 0.96]
  - - [128, 256, 1, 256, 128, 128, 256, 256]
    - [140, 1.95]
  - - [128, 256, 1, 512, 128, 128, 512, 512]
    - [120, 3.77]
  - - [128, 256, 1, 1024, 128, 128, 1024, 1024]
    - [111, 7.04]
  - - [128, 256, 1, 2048, 128, 128, 2048, 2048]
    - [138, 10.7]
  - - [128, 256, 1, 4096, 128, 128, 4096, 4096]
    - [138, 15.51]
  - - [128, 256, 1, 8192, 128, 128, 8192, 8192]
    - [112, 28.01]
  - - [128, 512, 1, 128, 128, 128, 128, 128]
    - [37, 1.89]
  - - [128, 512, 1, 256, 128, 128, 256, 256]
    - [139, 3.87]
  - - [128, 512, 1, 512, 128, 128, 512, 512]
    - [138, 7.61]
  - - [128, 512, 1, 1024, 128, 128, 1024, 1024]
    - [112, 13.67]
  - - [128, 512, 1, 2048, 128, 128, 2048, 2048]
    - [138, 21.59]
  - - [128, 512, 1, 4096, 128, 128, 4096, 4096]
    - [137, 30.48]
  - - [128, 512, 1, 8192, 128, 128, 8192, 8192]
    - [111, 53.89]
  - - [128, 1024, 1, 128, 128, 128, 128, 128]
    - [111, 3.79]
  - - [128, 1024, 1, 256, 128, 128, 256, 256]
    - [141, 7.74]
  - - [128, 1024, 1, 512, 128, 128, 512, 512]
    - [110, 14.75]
  - - [128, 1024, 1, 1024, 128, 128, 1024, 1024]
    - [112, 27.52]
  - - [128, 1024, 1, 2048, 128, 128, 2048, 2048]
    - [138, 42.98]
  - - [128, 1024, 1, 4096, 128, 128, 4096, 4096]
    - [112, 59.95]
  - - [128, 1024, 1, 8192, 128, 128, 8192, 8192]
    - [138, 90.8]
  - - [128, 2048, 1, 128, 128, 128, 128, 128]
    - [109, 7.64]
  - - [128, 2048, 1, 256, 128, 128, 256, 256]
    - [115, 16.69]
  - - [128, 2048, 1, 512, 128, 128, 512, 512]
    - [112, 31.83]
  - - [128, 2048, 1, 1024, 128, 128, 1024, 1024]
    - [111, 56.37]
  - - [128, 2048, 1, 2048, 128, 128, 2048, 2048]
    - [111, 86.89]
  - - [128, 2048, 1, 4096, 128, 128, 4096, 4096]
    - [137, 121.03]
  - - [128, 2048, 1, 8192, 128, 128, 8192, 8192]
    - [138, 153.26]
  - - [128, 4096, 1, 128, 128, 128, 128, 128]
    - [108, 17.53]
  - - [128, 4096, 1, 256, 128, 128, 256, 256]
    - [104, 32.45]
  - - [128, 4096, 1, 512, 128, 128, 512, 512]
    - [105, 57.98]
  - - [128, 4096, 1, 1024, 128, 128, 1024, 1024]
    - [98, 95.89]
  - - [128, 4096, 1, 2048, 128, 128, 2048, 2048]
    - [96, 142.95]
  - - [128, 4096, 1, 4096, 128, 128, 4096, 4096]
    - [97, 189.66]
  - - [128, 4096, 1, 8192, 128, 128, 8192, 8192]
    - [131, 194.98]
  - - [128, 8192, 1, 128, 128, 128, 128, 128]
    - [33, 31.76]
  - - [128, 8192, 1, 256, 128, 128, 256, 256]
    - [32, 57.98]
  - - [128, 8192, 1, 512, 128, 128, 512, 512]
    - [92, 101.01]
  - - [128, 8192, 1, 1024, 128, 128, 1024, 1024]
    - [92, 161.34]
  - - [128, 8192, 1, 2048, 128, 128, 2048, 2048]
    - [92, 229.83]
  - - [128, 8192, 1, 4096, 128, 128, 4096, 4096]
    - [91, 232.46]
  - - [128, 8192, 1, 8192, 128, 128, 8192, 8192]
    - [81, 269.32]
  - - [256, 128, 1, 128, 256, 256, 128, 128]
    - [3, 1.14]
  - - [256, 128, 1, 256, 256, 256, 256, 256]
    - [112, 2.31]
  - - [256, 128, 1, 512, 256, 256, 512, 512]
    - [117, 4.05]
  - - [256, 128, 1, 1024, 256, 256, 1024, 1024]
    - [112, 7.24]
  - - [256, 128, 1, 2048, 256, 256, 2048, 2048]
    - [138, 11.1]
  - - [256, 128, 1, 4096, 256, 256, 4096, 4096]
    - [138, 16.12]
  - - [256, 128, 1, 8192, 256, 256, 8192, 8192]
    - [112, 28.08]
  - - [256, 256, 1, 128, 256, 256, 128, 128]
    - [114, 2.36]
  - - [256, 256, 1, 256, 256, 256, 256, 256]
    - [111, 4.54]
  - - [256, 256, 1, 512, 256, 256, 512, 512]
    - [112, 8.39]
  - - [256, 256, 1, 1024, 256, 256, 1024, 1024]
    - [137, 14.01]
  - - [256, 256, 1, 2048, 256, 256, 2048, 2048]
    - [137, 22.39]
  - - [256, 256, 1, 4096, 256, 256, 4096, 4096]
    - [138, 31.4]
  - - [256, 256, 1, 8192, 256, 256, 8192, 8192]
    - [112, 55.15]
  - - [256, 512, 1, 128, 256, 256, 128, 128]
    - [116, 4.68]
  - - [256, 512, 1, 256, 256, 256, 256, 256]
    - [112, 9.02]
  - - [256, 512, 1, 512, 256, 256, 512, 512]
    - [111, 16.54]
  - - [256, 512, 1, 1024, 256, 256, 1024, 1024]
    - [111, 28.67]
  - - [256, 512, 1, 2048, 256, 256, 2048, 2048]
    - [138, 43.98]
  - - [256, 512, 1, 4096, 256, 256, 4096, 4096]
    - [112, 61.15]
  - - [256, 512, 1, 8192, 256, 256, 8192, 8192]
    - [138, 92.93]
  - - [256, 1024, 1, 128, 256, 256, 128, 128]
    - [42, 9.26]
  - - [256, 1024, 1, 256, 256, 256, 256, 256]
    - [112, 17.75]
  - - [256, 1024, 1, 512, 256, 256, 512, 512]
    - [112, 32.7]
  - - [256, 1024, 1, 1024, 256, 256, 1024, 1024]
    - [112, 56.2]
  - - [256, 1024, 1, 2048, 256, 256, 2048, 2048]
    - [111, 88.06]
  - - [256, 1024, 1, 4096, 256, 256, 4096, 4096]
    - [138, 121.87]
  - - [256, 1024, 1, 8192, 256, 256, 8192, 8192]
    - [138, 154.18]
  - - [256, 2048, 1, 128, 256, 256, 128, 128]
    - [35, 17.69]
  - - [256, 2048, 1, 256, 256, 256, 256, 256]
    - [103, 32.37]
  - - [256, 2048, 1, 512, 256, 256, 512, 512]
    - [98, 57.93]
  - - [256, 2048, 1, 1024, 256, 256, 1024, 1024]
    - [96, 96.02]
  - - [256, 2048, 1, 2048, 256, 256, 2048, 2048]
    - [97, 143.26]
  - - [256, 2048, 1, 4096, 256, 256, 4096, 4096]
    - [97, 189.28]
  - - [256, 2048, 1, 8192, 256, 256, 8192, 8192]
    - [132, 214.27]
  - - [256, 4096, 1, 128, 256, 256, 128, 128]
    - [33, 31.61]
  - - [256, 4096, 1, 256, 256, 256, 256, 256]
    - [32, 57.96]
  - - [256, 4096, 1, 512, 256, 256, 512, 512]
    - [92, 100.88]
  - - [256, 4096, 1, 1024, 256, 256, 1024, 1024]
    - [92, 161.57]
  - - [256, 4096, 1, 2048, 256, 256, 2048, 2048]
    - [92, 230.94]
  - - [256, 4096, 1, 4096, 256, 256, 4096, 4096]
    - [92, 283.54]
  - - [256, 4096, 1, 8192, 256, 256, 8192, 8192]
    - [124, 271.01]
  - - [256, 8192, 1, 128, 256, 256, 128, 128]
    - [83, 53.25]
  - - [256, 8192, 1, 256, 256, 256, 256, 256]
    - [30, 96.35]
  - - [256, 8192, 1, 512, 256, 256, 512, 512]
    - [82, 159.61]
  - - [256, 8192, 1, 1024, 256, 256, 1024, 1024]
    - [82, 241.47]
  - - [256, 8192, 1, 2048, 256, 256, 2048, 2048]
    - [80, 314.6]
  - - [256, 8192, 1, 4096, 256, 256, 4096, 4096]
    - [79, 301.33]
  - - [256, 8192, 1, 8192, 256, 256, 8192, 8192]
    - [122, 344.1]
  - - [512, 128, 1, 128, 512, 512, 128, 128]
    - [113, 2.37]
  - - [512, 128, 1, 256, 512, 512, 256, 256]
    - [113, 4.29]
  - - [512, 128, 1, 512, 512, 512, 512, 512]
    - [117, 8.0]
  - - [512, 128, 1, 1024, 512, 512, 1024, 1024]
    - [112, 14.42]
  - - [512, 128, 1, 2048, 512, 512, 2048, 2048]
    - [138, 22.05]
  - - [512, 128, 1, 4096, 512, 512, 4096, 4096]
    - [137, 31.18]
  - - [512, 128, 1, 8192, 512, 512, 8192, 8192]
    - [111, 54.72]
  - - [512, 256, 1, 128, 512, 512, 128, 128]
    - [38, 4.63]
  - - [512, 256, 1, 256, 512, 512, 256, 256]
    - [111, 9.0]
  - - [512, 256, 1, 512, 512, 512, 512, 512]
    - [112, 16.48]
  - - [512, 256, 1, 1024, 512, 512, 1024, 1024]
    - [112, 28.48]
  - - [512, 256, 1, 2048, 512, 512, 2048, 2048]
    - [138, 43.77]
  - - [512, 256, 1, 4096, 512, 512, 4096, 4096]
    - [112, 60.43]
  - - [512, 256, 1, 8192, 512, 512, 8192, 8192]
    - [97, 90.47]
  - - [512, 512, 1, 128, 512, 512, 128, 128]
    - [115, 9.29]
  - - [512, 512, 1, 256, 512, 512, 256, 256]
    - [111, 17.69]
  - - [512, 512, 1, 512, 512, 512, 512, 512]
    - [112, 32.39]
  - - [512, 512, 1, 1024, 512, 512, 1024, 1024]
    - [112, 55.18]
  - - [512, 512, 1, 2048, 512, 512, 2048, 2048]
    - [111, 87.86]
  - - [512, 512, 1, 4096, 512, 512, 4096, 4096]
    - [138, 119.97]
  - - [512, 512, 1, 8192, 512, 512, 8192, 8192]
    - [142, 151.83]
  - - [512, 1024, 1, 128, 512, 512, 128, 128]
    - [34, 17.52]
  - - [512, 1024, 1, 256, 512, 512, 256, 256]
    - [105, 32.7]
  - - [512, 1024, 1, 512, 512, 512, 512, 512]
    - [98, 58.55]
  - - [512, 1024, 1, 1024, 512, 512, 1024, 1024]
    - [98, 95.83]
  - - [512, 1024, 1, 2048, 512, 512, 2048, 2048]
    - [96, 142.91]
  - - [512, 1024, 1, 4096, 512, 512, 4096, 4096]
    - [97, 189.12]
  - - [512, 1024, 1, 8192, 512, 512, 8192, 8192]
    - [133, 211.16]
  - - [512, 2048, 1, 128, 512, 512, 128, 128]
    - [32, 31.67]
  - - [512, 2048, 1, 256, 512, 512, 256, 256]
    - [32, 57.98]
  - - [512, 2048, 1, 512, 512, 512, 512, 512]
    - [92, 100.53]
  - - [512, 2048, 1, 1024, 512, 512, 1024, 1024]
    - [92, 162.87]
  - - [512, 2048, 1, 2048, 512, 512, 2048, 2048]
    - [92, 230.4]
  - - [512, 2048, 1, 4096, 512, 512, 4096, 4096]
    - [92, 283.82]
  - - [512, 2048, 1, 8192, 512, 512, 8192, 8192]
    - [126, 275.33]
  - - [512, 4096, 1, 128, 512, 512, 128, 128]
    - [82, 53.43]
  - - [512, 4096, 1, 256, 512, 512, 256, 256]
    - [30, 95.57]
  - - [512, 4096, 1, 512, 512, 512, 512, 512]
    - [81, 159.13]
  - - [512, 4096, 1, 1024, 512, 512, 1024, 1024]
    - [81, 244.55]
  - - [512, 4096, 1, 2048, 512, 512, 2048, 2048]
    - [81, 314.1]
  - - [512, 4096, 1, 4096, 512, 512, 4096, 4096]
    - [121, 319.94]
  - - [512, 4096, 1, 8192, 512, 512, 8192, 8192]
    - [124, 352.09]
  - - [512, 8192, 1, 128, 512, 512, 128, 128]
    - [2, 80.75]
  - - [512, 8192, 1, 256, 512, 512, 256, 256]
    - [28, 144.74]
  - - [512, 8192, 1, 512, 512, 512, 512, 512]
    - [65, 236.29]
  - - [512, 8192, 1, 1024, 512, 512, 1024, 1024]
    - [69, 332.47]
  - - [512, 8192, 1, 2048, 512, 512, 2048, 2048]
    - [65, 422.49]
  - - [512, 8192, 1, 4096, 512, 512, 4096, 4096]
    - [72, 395.57]
  - - [512, 8192, 1, 8192, 512, 512, 8192, 8192]
    - [48, 386.63]
  - - [1024, 128, 1, 128, 1024, 1024, 128, 128]
    - [111, 4.69]
  - - [1024, 128, 1, 256, 1024, 1024, 256, 256]
    - [111, 8.96]
  - - [1024, 128, 1, 512, 1024, 1024, 512, 512]
    - [112, 16.47]
  - - [1024, 128, 1, 1024, 1024, 1024, 1024, 1024]
    - [112, 28.42]
  - - [1024, 128, 1, 2048, 1024, 1024, 2048, 2048]
    - [138, 43.72]
  - - [1024, 128, 1, 4096, 1024, 1024, 4096, 4096]
    - [112, 60.39]
  - - [1024, 128, 1, 8192, 1024, 1024, 8192, 8192]
    - [142, 90.52]
  - - [1024, 256, 1, 128, 1024, 1024, 128, 128]
    - [118, 8.36]
  - - [1024, 256, 1, 256, 1024, 1024, 256, 256]
    - [39, 16.62]
  - - [1024, 256, 1, 512, 1024, 1024, 512, 512]
    - [112, 31.49]
  - - [1024, 256, 1, 1024, 1024, 1024, 1024, 1024]
    - [119, 52.85]
  - - [1024, 256, 1, 2048, 1024, 1024, 2048, 2048]
    - [120, 83.17]
  - - [1024, 256, 1, 4096, 1024, 1024, 4096, 4096]
    - [142, 117.87]
  - - [1024, 256, 1, 8192, 1024, 1024, 8192, 8192]
    - [142, 150.94]
  - - [1024, 512, 1, 128, 1024, 1024, 128, 128]
    - [99, 16.69]
  - - [1024, 512, 1, 256, 1024, 1024, 256, 256]
    - [35, 31.59]
  - - [1024, 512, 1, 512, 1024, 1024, 512, 512]
    - [105, 56.42]
  - - [1024, 512, 1, 1024, 1024, 1024, 1024, 1024]
    - [97, 92.05]
  - - [1024, 512, 1, 2048, 1024, 1024, 2048, 2048]
    - [97, 139.37]
  - - [1024, 512, 1, 4096, 1024, 1024, 4096, 4096]
    - [102, 183.8]
  - - [1024, 512, 1, 8192, 1024, 1024, 8192, 8192]
    - [134, 209.87]
  - - [1024, 1024, 1, 128, 1024, 1024, 128, 128]
    - [33, 30.53]
  - - [1024, 1024, 1, 256, 1024, 1024, 256, 256]
    - [33, 55.95]
  - - [1024, 1024, 1, 512, 1024, 1024, 512, 512]
    - [93, 97.33]
  - - [1024, 1024, 1, 1024, 1024, 1024, 1024, 1024]
    - [93, 157.46]
  - - [1024, 1024, 1, 2048, 1024, 1024, 2048, 2048]
    - [92, 227.83]
  - - [1024, 1024, 1, 4096, 1024, 1024, 4096, 4096]
    - [94, 277.82]
  - - [1024, 1024, 1, 8192, 1024, 1024, 8192, 8192]
    - [126, 272.59]
  - - [1024, 2048, 1, 128, 1024, 1024, 128, 128]
    - [84, 51.47]
  - - [1024, 2048, 1, 256, 1024, 1024, 256, 256]
    - [31, 92.6]
  - - [1024, 2048, 1, 512, 1024, 1024, 512, 512]
    - [81, 155.12]
  - - [1024, 2048, 1, 1024, 1024, 1024, 1024, 1024]
    - [81, 239.91]
  - - [1024, 2048, 1, 2048, 1024, 1024, 2048, 2048]
    - [81, 312.44]
  - - [1024, 2048, 1, 4096, 1024, 1024, 4096, 4096]
    - [88, 324.63]
  - - [1024, 2048, 1, 8192, 1024, 1024, 8192, 8192]
    - [127, 353.8]
  - - [1024, 4096, 1, 128, 1024, 1024, 128, 128]
    - [2, 79.25]
  - - [1024, 4096, 1, 256, 1024, 1024, 256, 256]
    - [63, 140.7]
  - - [1024, 4096, 1, 512, 1024, 1024, 512, 512]
    - [66, 235.39]
  - - [1024, 4096, 1, 1024, 1024, 1024, 1024, 1024]
    - [70, 330.75]
  - - [1024, 4096, 1, 2048, 1024, 1024, 2048, 2048]
    - [65, 419.33]
  - - [1024, 4096, 1, 4096, 1024, 1024, 4096, 4096]
    - [78, 400.93]
  - - [1024, 4096, 1, 8192, 1024, 1024, 8192, 8192]
    - [49, 382.37]
  - - [1024, 8192, 1, 128, 1024, 1024, 128, 128]
    - [23, 110.55]
  - - [1024, 8192, 1, 256, 1024, 1024, 256, 256]
    - [24, 194.63]
  - - [1024, 8192, 1, 512, 1024, 1024, 512, 512]
    - [50, 300.2]
  - - [1024, 8192, 1, 1024, 1024, 1024, 1024, 1024]
    - [50, 403.32]
  - - [1024, 8192, 1, 2048, 1024, 1024, 2048, 2048]
    - [52, 417.45]
  - - [1024, 8192, 1, 4096, 1024, 1024, 4096, 4096]
    - [49, 485.89]
  - - [1024, 8192, 1, 8192, 1024, 1024, 8192, 8192]
    - [53, 431.14]
  - - [2048, 128, 1, 128, 2048, 2048, 128, 128]
    - [113, 8.69]
  - - [2048, 128, 1, 256, 2048, 2048, 256, 256]
    - [112, 17.0]
  - - [2048, 128, 1, 512, 2048, 2048, 512, 512]
    - [112, 31.74]
  - - [2048, 128, 1, 1024, 2048, 2048, 1024, 1024]
    - [112, 53.37]
  - - [2048, 128, 1, 2048, 2048, 2048, 2048, 2048]
    - [120, 84.7]
  - - [2048, 128, 1, 4096, 2048, 2048, 4096, 4096]
    - [142, 118.35]
  - - [2048, 128, 1, 8192, 2048, 2048, 8192, 8192]
    - [142, 151.86]
  - - [2048, 256, 1, 128, 2048, 2048, 128, 128]
    - [106, 17.15]
  - - [2048, 256, 1, 256, 2048, 2048, 256, 256]
    - [105, 31.98]
  - - [2048, 256, 1, 512, 2048, 2048, 512, 512]
    - [107, 56.99]
  - - [2048, 256, 1, 1024, 2048, 2048, 1024, 1024]
    - [105, 93.69]
  - - [2048, 256, 1, 2048, 2048, 2048, 2048, 2048]
    - [97, 139.29]
  - - [2048, 256, 1, 4096, 2048, 2048, 4096, 4096]
    - [102, 184.47]
  - - [2048, 256, 1, 8192, 2048, 2048, 8192, 8192]
    - [135, 211.48]
  - - [2048, 512, 1, 128, 2048, 2048, 128, 128]
    - [33, 31.18]
  - - [2048, 512, 1, 256, 2048, 2048, 256, 256]
    - [33, 57.92]
  - - [2048, 512, 1, 512, 2048, 2048, 512, 512]
    - [92, 99.04]
  - - [2048, 512, 1, 1024, 2048, 2048, 1024, 1024]
    - [92, 159.45]
  - - [2048, 512, 1, 2048, 2048, 2048, 2048, 2048]
    - [94, 224.45]
  - - [2048, 512, 1, 4096, 2048, 2048, 4096, 4096]
    - [94, 278.39]
  - - [2048, 512, 1, 8192, 2048, 2048, 8192, 8192]
    - [125, 275.14]
  - - [2048, 1024, 1, 128, 2048, 2048, 128, 128]
    - [84, 53.06]
  - - [2048, 1024, 1, 256, 2048, 2048, 256, 256]
    - [30, 95.6]
  - - [2048, 1024, 1, 512, 2048, 2048, 512, 512]
    - [81, 159.02]
  - - [2048, 1024, 1, 1024, 2048, 2048, 1024, 1024]
    - [81, 244.21]
  - - [2048, 1024, 1, 2048, 2048, 2048, 2048, 2048]
    - [87, 308.02]
  - - [2048, 1024, 1, 4096, 2048, 2048, 4096, 4096]
    - [89, 336.81]
  - - [2048, 1024, 1, 8192, 2048, 2048, 8192, 8192]
    - [130, 351.05]
  - - [2048, 2048, 1, 128, 2048, 2048, 128, 128]
    - [26, 80.83]
  - - [2048, 2048, 1, 256, 2048, 2048, 256, 256]
    - [26, 143.04]
  - - [2048, 2048, 1, 512, 2048, 2048, 512, 512]
    - [65, 234.35]
  - - [2048, 2048, 1, 1024, 2048, 2048, 1024, 1024]
    - [70, 328.51]
  - - [2048, 2048, 1, 2048, 2048, 2048, 2048, 2048]
    - [73, 395.64]
  - - [2048, 2048, 1, 4096, 2048, 2048, 4096, 4096]
    - [71, 398.66]
  - - [2048, 2048, 1, 8192, 2048, 2048, 8192, 8192]
    - [63, 410.27]
  - - [2048, 4096, 1, 128, 2048, 2048, 128, 128]
    - [25, 111.0]
  - - [2048, 4096, 1, 256, 2048, 2048, 256, 256]
    - [24, 195.02]
  - - [2048, 4096, 1, 512, 2048, 2048, 512, 512]
    - [49, 299.8]
  - - [2048, 4096, 1, 1024, 2048, 2048, 1024, 1024]
    - [43, 383.03]
  - - [2048, 4096, 1, 2048, 2048, 2048, 2048, 2048]
    - [61, 450.62]
  - - [2048, 4096, 1, 4096, 2048, 2048, 4096, 4096]
    - [60, 488.6]
  - - [2048, 4096, 1, 8192, 2048, 2048, 8192, 8192]
    - [46, 465.39]
  - - [2048, 8192, 1, 128, 2048, 2048, 128, 128]
    - [0, 138.85]
  - - [2048, 8192, 1, 256, 2048, 2048, 256, 256]
    - [10, 235.6]
  - - [2048, 8192, 1, 512, 2048, 2048, 512, 512]
    - [11, 322.58]
  - - [2048, 8192, 1, 1024, 2048, 2048, 1024, 1024]
    - [19, 417.66]
  - - [2048, 8192, 1, 2048, 2048, 2048, 2048, 2048]
    - [20, 495.6]
  - - [2048, 8192, 1, 4096, 2048, 2048, 4096, 4096]
    - [51, 430.88]
  - - [2048, 8192, 1, 8192, 2048, 2048, 8192, 8192]
    - [4, 484.04]
  - - [4096, 128, 1, 128, 4096, 4096, 128, 128]
    - [36, 15.8]
  - - [4096, 128, 1, 256, 4096, 4096, 256, 256]
    - [100, 29.58]
  - - [4096, 128, 1, 512, 4096, 4096, 512, 512]
    - [107, 57.07]
  - - [4096, 128, 1, 1024, 4096, 4096, 1024, 1024]
    - [97, 92.25]
  - - [4096, 128, 1, 2048, 4096, 4096, 2048, 2048]
    - [97, 138.54]
  - - [4096, 128, 1, 4096, 4096, 4096, 4096, 4096]
    - [101, 185.34]
  - - [4096, 128, 1, 8192, 4096, 4096, 8192, 8192]
    - [86, 200.96]
  - - [4096, 256, 1, 128, 4096, 4096, 128, 128]
    - [90, 30.76]
  - - [4096, 256, 1, 256, 4096, 4096, 256, 256]
    - [33, 55.21]
  - - [4096, 256, 1, 512, 4096, 4096, 512, 512]
    - [92, 96.33]
  - - [4096, 256, 1, 1024, 4096, 4096, 1024, 1024]
    - [92, 155.45]
  - - [4096, 256, 1, 2048, 4096, 4096, 2048, 2048]
    - [94, 224.86]
  - - [4096, 256, 1, 4096, 4096, 4096, 4096, 4096]
    - [94, 278.83]
  - - [4096, 256, 1, 8192, 4096, 4096, 8192, 8192]
    - [128, 274.93]
  - - [4096, 512, 1, 128, 4096, 4096, 128, 128]
    - [30, 53.21]
  - - [4096, 512, 1, 256, 4096, 4096, 256, 256]
    - [30, 95.54]
  - - [4096, 512, 1, 512, 4096, 4096, 512, 512]
    - [82, 157.93]
  - - [4096, 512, 1, 1024, 4096, 4096, 1024, 1024]
    - [86, 237.67]
  - - [4096, 512, 1, 2048, 4096, 4096, 2048, 2048]
    - [85, 311.7]
  - - [4096, 512, 1, 4096, 4096, 4096, 4096, 4096]
    - [88, 337.18]
  - - [4096, 512, 1, 8192, 4096, 4096, 8192, 8192]
    - [123, 350.13]
  - - [4096, 1024, 1, 128, 4096, 4096, 128, 128]
    - [28, 80.16]
  - - [4096, 1024, 1, 256, 4096, 4096, 256, 256]
    - [26, 142.56]
  - - [4096, 1024, 1, 512, 4096, 4096, 512, 512]
    - [63, 234.6]
  - - [4096, 1024, 1, 1024, 4096, 4096, 1024, 1024]
    - [73, 327.04]
  - - [4096, 1024, 1, 2048, 4096, 4096, 2048, 2048]
    - [74, 397.94]
  - - [4096, 1024, 1, 4096, 4096, 4096, 4096, 4096]
    - [74, 397.56]
  - - [4096, 1024, 1, 8192, 4096, 4096, 8192, 8192]
    - [66, 397.34]
  - - [4096, 2048, 1, 128, 4096, 4096, 128, 128]
    - [21, 108.84]
  - - [4096, 2048, 1, 256, 4096, 4096, 256, 256]
    - [24, 192.21]
  - - [4096, 2048, 1, 512, 4096, 4096, 512, 512]
    - [55, 295.92]
  - - [4096, 2048, 1, 1024, 4096, 4096, 1024, 1024]
    - [55, 379.47]
  - - [4096, 2048, 1, 2048, 4096, 4096, 2048, 2048]
    - [61, 451.82]
  - - [4096, 2048, 1, 4096, 4096, 4096, 4096, 4096]
    - [56, 488.3]
  - - [4096, 2048, 1, 8192, 4096, 4096, 8192, 8192]
    - [45, 471.22]
  - - [4096, 4096, 1, 128, 4096, 4096, 128, 128]
    - [1, 138.96]
  - - [4096, 4096, 1, 256, 4096, 4096, 256, 256]
    - [16, 231.98]
  - - [4096, 4096, 1, 512, 4096, 4096, 512, 512]
    - [12, 319.05]
  - - [4096, 4096, 1, 1024, 4096, 4096, 1024, 1024]
    - [19, 417.22]
  - - [4096, 4096, 1, 2048, 4096, 4096, 2048, 2048]
    - [19, 495.98]
  - - [4096, 4096, 1, 4096, 4096, 4096, 4096, 4096]
    - [5, 469.82]
  - - [4096, 4096, 1, 8192, 4096, 4096, 8192, 8192]
    - [9, 491.54]
  - - [4096, 8192, 1, 128, 4096, 4096, 128, 128]
    - [17, 142.75]
  - - [4096, 8192, 1, 256, 4096, 4096, 256, 256]
    - [68, 204.23]
  - - [4096, 8192, 1, 512, 4096, 4096, 512, 512]
    - [54, 271.81]
  - - [4096, 8192, 1, 1024, 4096, 4096, 1024, 1024]
    - [59, 344.11]
  - - [4096, 8192, 1, 2048, 4096, 4096, 2048, 2048]
    - [9, 420.92]
  - - [4096, 8192, 1, 4096, 4096, 4096, 4096, 4096]
    - [4, 461.71]
  - - [4096, 8192, 1, 8192, 4096, 4096, 8192, 8192]
    - [45, 496.93]
  - - [8192, 128, 1, 128, 8192, 8192, 128, 128]
    - [33, 31.46]
  - - [8192, 128, 1, 256, 8192, 8192, 256, 256]
    - [33, 57.63]
  - - [8192, 128, 1, 512, 8192, 8192, 512, 512]
    - [92, 99.37]
  - - [8192, 128, 1, 1024, 8192, 8192, 1024, 1024]
    - [92, 159.43]
  - - [8192, 128, 1, 2048, 8192, 8192, 2048, 2048]
    - [95, 224.95]
  - - [8192, 128, 1, 4096, 8192, 8192, 4096, 4096]
    - [136, 229.59]
  - - [8192, 128, 1, 8192, 8192, 8192, 8192, 8192]
    - [126, 263.58]
  - - [8192, 256, 1, 128, 8192, 8192, 128, 128]
    - [83, 52.04]
  - - [8192, 256, 1, 256, 8192, 8192, 256, 256]
    - [29, 92.43]
  - - [8192, 256, 1, 512, 8192, 8192, 512, 512]
    - [82, 155.22]
  - - [8192, 256, 1, 1024, 8192, 8192, 1024, 1024]
    - [88, 237.03]
  - - [8192, 256, 1, 2048, 8192, 8192, 2048, 2048]
    - [85, 311.42]
  - - [8192, 256, 1, 4096, 8192, 8192, 4096, 4096]
    - [89, 305.32]
  - - [8192, 256, 1, 8192, 8192, 8192, 8192, 8192]
    - [129, 343.84]
  - - [8192, 512, 1, 128, 8192, 8192, 128, 128]
    - [2, 80.89]
  - - [8192, 512, 1, 256, 8192, 8192, 256, 256]
    - [27, 143.4]
  - - [8192, 512, 1, 512, 8192, 8192, 512, 512]
    - [73, 230.8]
  - - [8192, 512, 1, 1024, 8192, 8192, 1024, 1024]
    - [76, 326.43]
  - - [8192, 512, 1, 2048, 8192, 8192, 2048, 2048]
    - [75, 398.37]
  - - [8192, 512, 1, 4096, 8192, 8192, 4096, 4096]
    - [77, 400.72]
  - - [8192, 512, 1, 8192, 8192, 8192, 8192, 8192]
    - [67, 393.09]
  - - [8192, 1024, 1, 128, 8192, 8192, 128, 128]
    - [22, 110.49]
  - - [8192, 1024, 1, 256, 8192, 8192, 256, 256]
    - [24, 193.24]
  - - [8192, 1024, 1, 512, 8192, 8192, 512, 512]
    - [55, 296.31]
  - - [8192, 1024, 1, 1024, 8192, 8192, 1024, 1024]
    - [55, 379.34]
  - - [8192, 1024, 1, 2048, 8192, 8192, 2048, 2048]
    - [59, 450.53]
  - - [8192, 1024, 1, 4096, 8192, 8192, 4096, 4096]
    - [58, 487.1]
  - - [8192, 1024, 1, 8192, 8192, 8192, 8192, 8192]
    - [45, 468.94]
  - - [8192, 2048, 1, 128, 8192, 8192, 128, 128]
    - [1, 137.86]
  - - [8192, 2048, 1, 256, 8192, 8192, 256, 256]
    - [14, 229.1]
  - - [8192, 2048, 1, 512, 8192, 8192, 512, 512]
    - [15, 317.99]
  - - [8192, 2048, 1, 1024, 8192, 8192, 1024, 1024]
    - [17, 412.28]
  - - [8192, 2048, 1, 2048, 8192, 8192, 2048, 2048]
    - [12, 495.64]
  - - [8192, 2048, 1, 4096, 8192, 8192, 4096, 4096]
    - [44, 457.18]
  - - [8192, 2048, 1, 8192, 8192, 8192, 8192, 8192]
    - [7, 489.33]
  - - [8192, 4096, 1, 128, 8192, 8192, 128, 128]
    - [19, 140.62]
  - - [8192, 4096, 1, 256, 8192, 8192, 256, 256]
    - [64, 192.47]
  - - [8192, 4096, 1, 512, 8192, 8192, 512, 512]
    - [62, 267.97]
  - - [8192, 4096, 1, 1024, 8192, 8192, 1024, 1024]
    - [56, 341.86]
  - - [8192, 4096, 1, 2048, 8192, 8192, 2048, 2048]
    - [6, 428.26]
  - - [8192, 4096, 1, 4096, 8192, 8192, 4096, 4096]
    - [8, 483.1]
  - - [8192, 4096, 1, 8192, 8192, 8192, 8192, 8192]
    - [6, 504.38]
  - - [8192, 8192, 1, 128, 8192, 8192, 128, 128]
    - [21, 148.16]
  - - [8192, 8192, 1, 256, 8192, 8192, 256, 256]
    - [57, 224.31]
  - - [8192, 8192, 1, 512, 8192, 8192, 512, 512]
    - [62, 275.19]
  - - [8192, 8192, 1, 1024, 8192, 8192, 1024, 1024]
    - [18, 377.85]
  - - [8192, 8192, 1, 2048, 8192, 8192, 2048, 2048]
    - [13, 445.13]
  - - [8192, 8192, 1, 4096, 8192, 8192, 4096, 4096]
    - [47, 486.66]
  - - [8192, 8192, 1, 8192, 8192, 8192, 8192, 8192]
    - [47, 522.55]
  - - [1, 1, 1, 32, 1, 1, 32, 32]
    - [143, 0.0]
- null
- null
- ExperimentalStreamK
- GridBased
