projects/hipblaslt/library/src/amd_detail/rocblaslt/src/Tensile/Logic/asm_full/aquavanjaram/gfx942/StreamK/aquavanjaram942_Cijk_Ailk_Bljk_I8II_BH_UserArgs.yaml
- {MinimumRequiredVersion: 4.33.0}
- aquavanjaram942
- gfx942
- [Device 0049, Device 0050]
    SolutionIndex: 0
    SolutionNameMin: Cijk_Ailk_Bljk_I8II_BH_UserArgs_MT256x256x32_MI16x16x1_SN_CLR0_GSU0_GSUC0_GSUWGMRR0_K1_LBSPPA2048_LBSPPB256_LPA64_MIWT8_8_PLR0_SU0_SUM0_SUS0_SKXCCM8_VWA4_VWB8_WGM1_WGMXCC1_WGMXCCGn1
    SolutionIndex: 1
    SolutionNameMin: Cijk_Ailk_Bljk_I8II_BH_UserArgs_MT256x256x32_MI16x16x1_SN_CLR0_GSU0_GSUC0_GSUWGMRR0_K1_LBSPPA2048_LBSPPB128_LPA32_MIWT8_8_PLR0_SU0_SUM0_SUS0_SKXCCM8_VWA2_VWB2_WGM4_WGMXCC1_WGMXCCGn1
    SolutionIndex: 2
    SolutionNameMin: Cijk_Ailk_Bljk_I8II_BH_UserArgs_MT256x256x32_MI16x16x1_SN_CLR0_GSU0_GSUC0_GSUWGMRR0_K1_LBSPPA2048_LBSPPB256_LPA64_MIWT8_8_PLR0_SU0_SUM0_SUS0_SKXCCM8_VWA4_VWB8_WGM4_WGMXCC1_WGMXCCGn1
    SolutionIndex: 3
    SolutionNameMin: Cijk_Ailk_Bljk_I8II_BH_UserArgs_MT128x64x32_MI16x16x1_SN_CLR0_GSU0_GSUC0_GSUWGMRR0_K1_LBSPPA1024_LBSPPB128_LPA64_MIWT4_2_PLR0_SU0_SUM0_SUS0_SKXCCM8_VWA4_VWB2_WGM1_WGMXCC1_WGMXCCGn1
    SolutionIndex: 4
    SolutionNameMin: Cijk_Ailk_Bljk_I8II_BH_UserArgs_MT128x64x32_MI16x16x1_SN_CLR0_GSU0_GSUC0_GSUWGMRR0_K1_LBSPPA1024_LBSPPB128_LPA64_MIWT4_2_PLR0_SU0_SUM0_SUS0_SKXCCM8_VWA4_VWB1_WGM1_WGMXCC1_WGMXCCGn1
    SolutionIndex: 5
    SolutionNameMin: Cijk_Ailk_Bljk_I8II_BH_UserArgs_MT64x64x32_MI16x16x1_SN_CLR0_GSU0_GSUC0_GSUWGMRR0_K1_LBSPPA512_LBSPPB128_LPA32_MIWT2_2_PLR0_SU0_SUM0_SUS0_SKXCCM8_VWA2_VWB1_WGM1_WGMXCC1_WGMXCCGn1
    SolutionIndex: 6
    SolutionNameMin: Cijk_Ailk_Bljk_I8II_BH_UserArgs_MT32x32x32_MI16x16x1_SN_CLR0_GSU0_GSUC0_GSUWGMRR0_K1_LBSPPA256_LBSPPB128_LPA16_MIWT1_1_PLR0_SU0_SUM0_SUS0_SKXCCM8_VWA1_VWB1_WGM1_WGMXCC1_WGMXCCGn1
    SolutionIndex: 7
    SolutionNameMin: Cijk_Ailk_Bljk_I8II_BH_UserArgs_MT32x32x32_MI16x16x1_SN_CLR0_GSU0_GSUC0_GSUWGMRR0_K1_LBSPPA256_LBSPPB128_LPA16_MIWT1_1_PLR0_SU0_SUM0_SUS0_SKXCCM8_VWA1_VWB1_WGM1_WGMXCC1_WGMXCCGn1
    SolutionIndex: 8
    SolutionNameMin: Cijk_Ailk_Bljk_I8II_BH_UserArgs_MT256x256x64_MI16x16x1_SN_CLR1_GSU0_GSUC0_GSUWGMRR0_K1_LBSPPA2048_LBSPPB128_LPA64_MIWT8_8_PLR1_SU0_SUM0_SUS0_SKXCCM8_VWA4_VWB1_WGM1_WGMXCC1_WGMXCCGn1
    SolutionIndex: 9
    SolutionNameMin: Cijk_Ailk_Bljk_I8II_BH_UserArgs_MT256x256x64_MI16x16x1_SN_CLR1_GSU0_GSUC0_GSUWGMRR0_K1_LBSPPA2048_LBSPPB128_LPA64_MIWT8_8_PLR1_SU0_SUM0_SUS0_SKXCCM8_VWA4_VWB2_WGM1_WGMXCC1_WGMXCCGn1
    SolutionIndex: 10
    SolutionNameMin: Cijk_Ailk_Bljk_I8II_BH_UserArgs_MT256x256x64_MI16x16x1_SN_CLR1_GSU0_GSUC0_GSUWGMRR0_K1_LBSPPA2048_LBSPPB256_LPA64_MIWT8_8_PLR1_SU0_SUM0_SUS0_SKXCCM8_VWA4_VWB4_WGM1_WGMXCC1_WGMXCCGn1
    SolutionIndex: 11
    SolutionNameMin: Cijk_Ailk_Bljk_I8II_BH_UserArgs_MT256x256x64_MI16x16x1_SN_CLR1_GSU0_GSUC0_GSUWGMRR0_K1_LBSPPA2048_LBSPPB512_LPA64_MIWT8_8_PLR1_SU0_SUM0_SUS0_SKXCCM8_VWA4_VWB8_WGM1_WGMXCC1_WGMXCCGn1
    SolutionIndex: 12
    SolutionNameMin: Cijk_Ailk_Bljk_I8II_BH_UserArgs_MT256x256x64_MI16x16x1_SN_CLR1_GSU0_GSUC0_GSUWGMRR0_K1_LBSPPA2048_LBSPPB128_LPA64_MIWT8_8_PLR1_SU0_SUM0_SUS0_SKXCCM8_VWA4_VWB2_WGM1_WGMXCC1_WGMXCCGn1
    SolutionIndex: 13
    SolutionNameMin: Cijk_Ailk_Bljk_I8II_BH_UserArgs_MT256x256x64_MI16x16x1_SN_CLR1_GSU0_GSUC0_GSUWGMRR0_K1_LBSPPA2048_LBSPPB256_LPA64_MIWT8_8_PLR1_SU0_SUM0_SUS0_SKXCCM8_VWA4_VWB4_WGM1_WGMXCC1_WGMXCCGn1
    SolutionIndex: 14
    SolutionNameMin: Cijk_Ailk_Bljk_I8II_BH_UserArgs_MT256x256x64_MI16x16x1_SN_CLR1_GSU0_GSUC0_GSUWGMRR0_K1_LBSPPA2048_LBSPPB512_LPA64_MIWT8_8_PLR1_SU0_SUM0_SUS0_SKXCCM8_VWA4_VWB8_WGM1_WGMXCC1_WGMXCCGn1
    SolutionIndex: 15
    SolutionNameMin: Cijk_Ailk_Bljk_I8II_BH_UserArgs_MT256x256x64_MI16x16x1_SN_CLR1_GSU0_GSUC0_GSUWGMRR0_K1_LBSPPA2048_LBSPPB256_LPA64_MIWT8_8_PLR1_SU0_SUM0_SUS0_SKXCCM8_VWA4_VWB4_WGM1_WGMXCC1_WGMXCCGn1
    SolutionIndex: 16
    SolutionNameMin: Cijk_Ailk_Bljk_I8II_BH_UserArgs_MT256x256x64_MI16x16x1_SN_CLR1_GSU0_GSUC0_GSUWGMRR0_K1_LBSPPA2048_LBSPPB128_LPA64_MIWT8_8_PLR1_SU0_SUM0_SUS0_SKXCCM8_VWA4_VWB1_WGM1_WGMXCC1_WGMXCCGn1
    SolutionIndex: 17
    SolutionNameMin: Cijk_Ailk_Bljk_I8II_BH_UserArgs_MT256x256x64_MI16x16x1_SN_CLR1_GSU0_GSUC0_GSUWGMRR0_K1_LBSPPA2048_LBSPPB128_LPA64_MIWT8_8_PLR1_SU0_SUM0_SUS0_SKXCCM8_VWA4_VWB2_WGM1_WGMXCC1_WGMXCCGn1
    SolutionIndex: 18
    SolutionNameMin: Cijk_Ailk_Bljk_I8II_BH_UserArgs_MT256x256x64_MI16x16x1_SN_CLR1_GSU0_GSUC0_GSUWGMRR0_K1_LBSPPA2048_LBSPPB256_LPA64_MIWT8_8_PLR1_SU0_SUM0_SUS0_SKXCCM8_VWA4_VWB4_WGM1_WGMXCC1_WGMXCCGn1
    SolutionIndex: 19
    SolutionNameMin: Cijk_Ailk_Bljk_I8II_BH_UserArgs_MT256x256x64_MI16x16x1_SN_CLR1_GSU0_GSUC0_GSUWGMRR0_K1_LBSPPA2048_LBSPPB512_LPA64_MIWT8_8_PLR1_SU0_SUM0_SUS0_SKXCCM8_VWA4_VWB8_WGM1_WGMXCC1_WGMXCCGn1
    SolutionIndex: 20
    SolutionNameMin: Cijk_Ailk_Bljk_I8II_BH_UserArgs_MT256x256x64_MI16x16x1_SN_CLR1_GSU0_GSUC0_GSUWGMRR0_K1_LBSPPA2048_LBSPPB128_LPA64_MIWT8_8_PLR1_SU0_SUM0_SUS0_SKXCCM8_VWA4_VWB1_WGM4_WGMXCC1_WGMXCCGn1
    SolutionIndex: 21
    SolutionNameMin: Cijk_Ailk_Bljk_I8II_BH_UserArgs_MT256x256x64_MI16x16x1_SN_CLR1_GSU0_GSUC0_GSUWGMRR0_K1_LBSPPA2048_LBSPPB128_LPA64_MIWT8_8_PLR1_SU0_SUM0_SUS0_SKXCCM8_VWA4_VWB2_WGM4_WGMXCC1_WGMXCCGn1
    SolutionIndex: 22
    SolutionNameMin: Cijk_Ailk_Bljk_I8II_BH_UserArgs_MT256x256x64_MI16x16x1_SN_CLR1_GSU0_GSUC0_GSUWGMRR0_K1_LBSPPA2048_LBSPPB512_LPA64_MIWT8_8_PLR1_SU0_SUM0_SUS0_SKXCCM8_VWA4_VWB8_WGM4_WGMXCC1_WGMXCCGn1
    SolutionIndex: 23
    SolutionNameMin: Cijk_Ailk_Bljk_I8II_BH_UserArgs_MT256x256x64_MI16x16x1_SN_CLR1_GSU0_GSUC0_GSUWGMRR0_K1_LBSPPA2048_LBSPPB128_LPA64_MIWT8_8_PLR1_SU0_SUM0_SUS0_SKXCCM8_VWA4_VWB2_WGM4_WGMXCC1_WGMXCCGn1
    SolutionIndex: 24
    SolutionNameMin: Cijk_Ailk_Bljk_I8II_BH_UserArgs_MT256x256x64_MI16x16x1_SN_CLR1_GSU0_GSUC0_GSUWGMRR0_K1_LBSPPA2048_LBSPPB256_LPA64_MIWT8_8_PLR1_SU0_SUM0_SUS0_SKXCCM8_VWA4_VWB4_WGM4_WGMXCC1_WGMXCCGn1
    SolutionIndex: 25
    SolutionNameMin: Cijk_Ailk_Bljk_I8II_BH_UserArgs_MT128x256x64_MI16x16x1_SN_CLR1_GSU0_GSUC0_GSUWGMRR0_K1_LBSPPA1024_LBSPPB256_LPA64_MIWT4_8_PLR1_SU0_SUM0_SUS0_SKXCCM8_VWA4_VWB4_WGM1_WGMXCC1_WGMXCCGn1
    SolutionIndex: 26
    SolutionNameMin: Cijk_Ailk_Bljk_I8II_BH_UserArgs_MT128x256x64_MI16x16x1_SN_CLR1_GSU0_GSUC0_GSUWGMRR0_K1_LBSPPA1024_LBSPPB512_LPA32_MIWT4_8_PLR1_SU0_SUM0_SUS0_SKXCCM8_VWA2_VWB8_WGM1_WGMXCC1_WGMXCCGn1
    SolutionIndex: 27
    SolutionNameMin: Cijk_Ailk_Bljk_I8II_BH_UserArgs_MT128x256x64_MI16x16x1_SN_CLR1_GSU0_GSUC0_GSUWGMRR0_K1_LBSPPA1024_LBSPPB256_LPA64_MIWT4_8_PLR1_SU0_SUM0_SUS0_SKXCCM8_VWA4_VWB4_WGM4_WGMXCC1_WGMXCCGn1
    SolutionIndex: 28
    SolutionNameMin: Cijk_Ailk_Bljk_I8II_BH_UserArgs_MT256x128x64_MI16x16x1_SN_CLR1_GSU0_GSUC0_GSUWGMRR0_K1_LBSPPA2048_LBSPPB256_LPA64_MIWT8_4_PLR1_SU0_SUM0_SUS0_SKXCCM8_VWA4_VWB4_WGM1_WGMXCC1_WGMXCCGn1
    SolutionIndex: 29
    SolutionNameMin: Cijk_Ailk_Bljk_I8II_BH_UserArgs_MT256x128x64_MI16x16x1_SN_CLR1_GSU0_GSUC0_GSUWGMRR0_K1_LBSPPA2048_LBSPPB256_LPA32_MIWT8_4_PLR1_SU0_SUM0_SUS0_SKXCCM8_VWA2_VWB4_WGM1_WGMXCC1_WGMXCCGn1
    SolutionIndex: 30
    SolutionNameMin: Cijk_Ailk_Bljk_I8II_BH_UserArgs_MT256x128x64_MI16x16x1_SN_CLR1_GSU0_GSUC0_GSUWGMRR0_K1_LBSPPA2048_LBSPPB256_LPA64_MIWT8_4_PLR1_SU0_SUM0_SUS0_SKXCCM8_VWA4_VWB4_WGM8_WGMXCC1_WGMXCCGn1
    SolutionIndex: 31
    SolutionNameMin: Cijk_Ailk_Bljk_I8II_BH_UserArgs_MT256x64x64_MI16x16x1_SN_CLR1_GSU0_GSUC0_GSUWGMRR0_K1_LBSPPA2048_LBSPPB128_LPA64_MIWT8_2_PLR1_SU0_SUM0_SUS0_SKXCCM8_VWA4_VWB1_WGM8_WGMXCC1_WGMXCCGn1
    SolutionIndex: 32
    SolutionNameMin: Cijk_Ailk_Bljk_I8II_BH_UserArgs_MT128x128x64_MI16x16x1_SN_CLR1_GSU0_GSUC0_GSUWGMRR0_K1_LBSPPA1024_LBSPPB128_LPA64_MIWT4_4_PLR1_SU0_SUM0_SUS0_SKXCCM8_VWA4_VWB1_WGM1_WGMXCC1_WGMXCCGn1
    SolutionIndex: 33
    SolutionNameMin: Cijk_Ailk_Bljk_I8II_BH_UserArgs_MT128x128x64_MI16x16x1_SN_CLR1_GSU0_GSUC0_GSUWGMRR0_K1_LBSPPA1024_LBSPPB128_LPA64_MIWT4_4_PLR1_SU0_SUM0_SUS0_SKXCCM8_VWA4_VWB1_WGM1_WGMXCC1_WGMXCCGn1
    SolutionIndex: 34
    SolutionNameMin: Cijk_Ailk_Bljk_I8II_BH_UserArgs_MT128x128x64_MI16x16x1_SN_CLR1_GSU0_GSUC0_GSUWGMRR0_K1_LBSPPA1024_LBSPPB256_LPA64_MIWT4_4_PLR1_SU0_SUM0_SUS0_SKXCCM8_VWA4_VWB4_WGM1_WGMXCC1_WGMXCCGn1
    SolutionIndex: 35
    SolutionNameMin: Cijk_Ailk_Bljk_I8II_BH_UserArgs_MT128x128x64_MI16x16x1_SN_CLR1_GSU0_GSUC0_GSUWGMRR0_K1_LBSPPA1024_LBSPPB128_LPA64_MIWT4_4_PLR1_SU0_SUM0_SUS0_SKXCCM8_VWA4_VWB1_WGM1_WGMXCC1_WGMXCCGn1
    SolutionIndex: 36
    SolutionNameMin: Cijk_Ailk_Bljk_I8II_BH_UserArgs_MT128x128x64_MI16x16x1_SN_CLR1_GSU0_GSUC0_GSUWGMRR0_K1_LBSPPA1024_LBSPPB128_LPA64_MIWT4_4_PLR1_SU0_SUM0_SUS0_SKXCCM8_VWA4_VWB2_WGM1_WGMXCC1_WGMXCCGn1
    SolutionIndex: 37
    SolutionNameMin: Cijk_Ailk_Bljk_I8II_BH_UserArgs_MT128x128x64_MI16x16x1_SN_CLR1_GSU0_GSUC0_GSUWGMRR0_K1_LBSPPA1024_LBSPPB256_LPA64_MIWT4_4_PLR1_SU0_SUM0_SUS0_SKXCCM8_VWA4_VWB4_WGM1_WGMXCC1_WGMXCCGn1
    SolutionIndex: 38
    SolutionNameMin: Cijk_Ailk_Bljk_I8II_BH_UserArgs_MT128x128x64_MI16x16x1_SN_CLR1_GSU0_GSUC0_GSUWGMRR0_K1_LBSPPA1024_LBSPPB256_LPA64_MIWT4_4_PLR1_SU0_SUM0_SUS0_SKXCCM8_VWA4_VWB4_WGM4_WGMXCC1_WGMXCCGn1
    SolutionIndex: 39
    SolutionNameMin: Cijk_Ailk_Bljk_I8II_BH_UserArgs_MT128x128x64_MI16x16x1_SN_CLR1_GSU0_GSUC0_GSUWGMRR0_K1_LBSPPA1024_LBSPPB256_LPA64_MIWT4_4_PLR1_SU0_SUM0_SUS0_SKXCCM8_VWA4_VWB4_WGM4_WGMXCC1_WGMXCCGn1
    SolutionIndex: 40
    SolutionNameMin: Cijk_Ailk_Bljk_I8II_BH_UserArgs_MT128x128x64_MI16x16x1_SN_CLR1_GSU0_GSUC0_GSUWGMRR0_K1_LBSPPA1024_LBSPPB256_LPA64_MIWT4_4_PLR1_SU0_SUM0_SUS0_SKXCCM8_VWA4_VWB4_WGM8_WGMXCC1_WGMXCCGn1
    SolutionIndex: 41
    SolutionNameMin: Cijk_Ailk_Bljk_I8II_BH_UserArgs_MT128x128x64_MI16x16x1_SN_CLR1_GSU0_GSUC0_GSUWGMRR0_K1_LBSPPA1024_LBSPPB256_LPA64_MIWT4_4_PLR1_SU0_SUM0_SUS0_SKXCCM8_VWA4_VWB4_WGM8_WGMXCC1_WGMXCCGn1
    SolutionIndex: 42
    SolutionNameMin: Cijk_Ailk_Bljk_I8II_BH_UserArgs_MT128x128x64_MI16x16x1_SN_CLR1_GSU0_GSUC0_GSUWGMRR0_K1_LBSPPA1024_LBSPPB128_LPA64_MIWT4_4_PLR1_SU0_SUM0_SUS0_SKXCCM8_VWA4_VWB2_WGM8_WGMXCC1_WGMXCCGn1
    SolutionIndex: 43
    SolutionNameMin: Cijk_Ailk_Bljk_I8II_BH_UserArgs_MT64x128x64_MI16x16x1_SN_CLR1_GSU0_GSUC0_GSUWGMRR0_K1_LBSPPA512_LBSPPB128_LPA32_MIWT2_4_PLR1_SU0_SUM0_SUS0_SKXCCM8_VWA2_VWB1_WGM1_WGMXCC1_WGMXCCGn1
    SolutionIndex: 44
    SolutionNameMin: Cijk_Ailk_Bljk_I8II_BH_UserArgs_MT64x128x64_MI16x16x1_SN_CLR1_GSU0_GSUC0_GSUWGMRR0_K1_LBSPPA512_LBSPPB128_LPA32_MIWT2_4_PLR1_SU0_SUM0_SUS0_SKXCCM8_VWA2_VWB2_WGM1_WGMXCC1_WGMXCCGn1
    SolutionIndex: 45
    SolutionNameMin: Cijk_Ailk_Bljk_I8II_BH_UserArgs_MT64x128x64_MI16x16x1_SN_CLR1_GSU0_GSUC0_GSUWGMRR0_K1_LBSPPA512_LBSPPB256_LPA32_MIWT2_4_PLR1_SU0_SUM0_SUS0_SKXCCM8_VWA2_VWB4_WGM1_WGMXCC1_WGMXCCGn1
    SolutionIndex: 46
    SolutionNameMin: Cijk_Ailk_Bljk_I8II_BH_UserArgs_MT64x128x64_MI16x16x1_SN_CLR1_GSU0_GSUC0_GSUWGMRR0_K1_LBSPPA512_LBSPPB128_LPA32_MIWT2_4_PLR1_SU0_SUM0_SUS0_SKXCCM8_VWA2_VWB1_WGM1_WGMXCC1_WGMXCCGn1
    SolutionIndex: 47
    SolutionNameMin: Cijk_Ailk_Bljk_I8II_BH_UserArgs_MT64x128x64_MI16x16x1_SN_CLR1_GSU0_GSUC0_GSUWGMRR0_K1_LBSPPA512_LBSPPB256_LPA32_MIWT2_4_PLR1_SU0_SUM0_SUS0_SKXCCM8_VWA2_VWB4_WGM1_WGMXCC1_WGMXCCGn1
    SolutionIndex: 48
    SolutionNameMin: Cijk_Ailk_Bljk_I8II_BH_UserArgs_MT64x128x64_MI16x16x1_SN_CLR1_GSU0_GSUC0_GSUWGMRR0_K1_LBSPPA512_LBSPPB128_LPA32_MIWT2_4_PLR1_SU0_SUM0_SUS0_SKXCCM8_VWA2_VWB2_WGM4_WGMXCC1_WGMXCCGn1
    SolutionIndex: 49
    SolutionNameMin: Cijk_Ailk_Bljk_I8II_BH_UserArgs_MT64x128x64_MI16x16x1_SN_CLR1_GSU0_GSUC0_GSUWGMRR0_K1_LBSPPA512_LBSPPB128_LPA32_MIWT2_4_PLR1_SU0_SUM0_SUS0_SKXCCM8_VWA2_VWB2_WGM8_WGMXCC1_WGMXCCGn1
    SolutionIndex: 50
    SolutionNameMin: Cijk_Ailk_Bljk_I8II_BH_UserArgs_MT128x64x64_MI16x16x1_SN_CLR1_GSU0_GSUC0_GSUWGMRR0_K1_LBSPPA1024_LBSPPB128_LPA64_MIWT4_2_PLR1_SU0_SUM0_SUS0_SKXCCM8_VWA4_VWB1_WGM1_WGMXCC1_WGMXCCGn1
    SolutionIndex: 51
    SolutionNameMin: Cijk_Ailk_Bljk_I8II_BH_UserArgs_MT128x64x64_MI16x16x1_SN_CLR1_GSU0_GSUC0_GSUWGMRR0_K1_LBSPPA1024_LBSPPB128_LPA64_MIWT4_2_PLR1_SU0_SUM0_SUS0_SKXCCM8_VWA4_VWB1_WGM1_WGMXCC1_WGMXCCGn1
    SolutionIndex: 52
    SolutionNameMin: Cijk_Ailk_Bljk_I8II_BH_UserArgs_MT128x64x64_MI16x16x1_SN_CLR1_GSU0_GSUC0_GSUWGMRR0_K1_LBSPPA1024_LBSPPB128_LPA64_MIWT4_2_PLR1_SU0_SUM0_SUS0_SKXCCM8_VWA4_VWB2_WGM1_WGMXCC1_WGMXCCGn1
    SolutionIndex: 53
    SolutionNameMin: Cijk_Ailk_Bljk_I8II_BH_UserArgs_MT128x64x64_MI16x16x1_SN_CLR1_GSU0_GSUC0_GSUWGMRR0_K1_LBSPPA1024_LBSPPB128_LPA64_MIWT4_2_PLR1_SU0_SUM0_SUS0_SKXCCM8_VWA4_VWB2_WGM1_WGMXCC1_WGMXCCGn1
    SolutionIndex: 54
    SolutionNameMin: Cijk_Ailk_Bljk_I8II_BH_UserArgs_MT128x64x64_MI16x16x1_SN_CLR1_GSU0_GSUC0_GSUWGMRR0_K1_LBSPPA1024_LBSPPB128_LPA64_MIWT4_2_PLR1_SU0_SUM0_SUS0_SKXCCM8_VWA4_VWB1_WGM4_WGMXCC1_WGMXCCGn1
    SolutionIndex: 55
    SolutionNameMin: Cijk_Ailk_Bljk_I8II_BH_UserArgs_MT128x64x64_MI16x16x1_SN_CLR1_GSU0_GSUC0_GSUWGMRR0_K1_LBSPPA1024_LBSPPB128_LPA64_MIWT4_2_PLR1_SU0_SUM0_SUS0_SKXCCM8_VWA4_VWB2_WGM8_WGMXCC1_WGMXCCGn1
    SolutionIndex: 56
    SolutionNameMin: Cijk_Ailk_Bljk_I8II_BH_UserArgs_MT128x64x64_MI16x16x1_SN_CLR1_GSU0_GSUC0_GSUWGMRR0_K1_LBSPPA1024_LBSPPB128_LPA64_MIWT4_2_PLR1_SU0_SUM0_SUS0_SKXCCM8_VWA4_VWB2_WGM8_WGMXCC1_WGMXCCGn1
    SolutionIndex: 57
    SolutionNameMin: Cijk_Ailk_Bljk_I8II_BH_UserArgs_MT128x32x64_MI16x16x1_SN_CLR1_GSU0_GSUC0_GSUWGMRR0_K1_LBSPPA1024_LBSPPB128_LPA64_MIWT4_1_PLR1_SU0_SUM0_SUS0_SKXCCM8_VWA4_VWB1_WGM1_WGMXCC1_WGMXCCGn1
    SolutionIndex: 58
    SolutionNameMin: Cijk_Ailk_Bljk_I8II_BH_UserArgs_MT128x32x64_MI16x16x1_SN_CLR1_GSU0_GSUC0_GSUWGMRR0_K1_LBSPPA1024_LBSPPB128_LPA64_MIWT4_1_PLR1_SU0_SUM0_SUS0_SKXCCM8_VWA4_VWB1_WGM1_WGMXCC1_WGMXCCGn1
    SolutionIndex: 59
    SolutionNameMin: Cijk_Ailk_Bljk_I8II_BH_UserArgs_MT64x64x64_MI16x16x1_SN_CLR1_GSU0_GSUC0_GSUWGMRR0_K1_LBSPPA512_LBSPPB128_LPA32_MIWT2_2_PLR1_SU0_SUM0_SUS0_SKXCCM8_VWA2_VWB1_WGM1_WGMXCC1_WGMXCCGn1
    SolutionIndex: 60
    SolutionNameMin: Cijk_Ailk_Bljk_I8II_BH_UserArgs_MT64x64x64_MI16x16x1_SN_CLR1_GSU0_GSUC0_GSUWGMRR0_K1_LBSPPA512_LBSPPB128_LPA32_MIWT2_2_PLR1_SU0_SUM0_SUS0_SKXCCM8_VWA2_VWB1_WGM1_WGMXCC1_WGMXCCGn1
    SolutionIndex: 61
    SolutionNameMin: Cijk_Ailk_Bljk_I8II_BH_UserArgs_MT64x64x64_MI16x16x1_SN_CLR1_GSU0_GSUC0_GSUWGMRR0_K1_LBSPPA512_LBSPPB128_LPA32_MIWT2_2_PLR1_SU0_SUM0_SUS0_SKXCCM8_VWA2_VWB2_WGM1_WGMXCC1_WGMXCCGn1
    SolutionIndex: 62
    SolutionNameMin: Cijk_Ailk_Bljk_I8II_BH_UserArgs_MT64x64x64_MI16x16x1_SN_CLR1_GSU0_GSUC0_GSUWGMRR0_K1_LBSPPA512_LBSPPB128_LPA32_MIWT2_2_PLR1_SU0_SUM0_SUS0_SKXCCM8_VWA2_VWB1_WGM1_WGMXCC1_WGMXCCGn1
    SolutionIndex: 63
    SolutionNameMin: Cijk_Ailk_Bljk_I8II_BH_UserArgs_MT64x64x64_MI16x16x1_SN_CLR1_GSU0_GSUC0_GSUWGMRR0_K1_LBSPPA512_LBSPPB128_LPA32_MIWT2_2_PLR1_SU0_SUM0_SUS0_SKXCCM8_VWA2_VWB1_WGM4_WGMXCC1_WGMXCCGn1
    SolutionIndex: 64
    SolutionNameMin: Cijk_Ailk_Bljk_I8II_BH_UserArgs_MT64x64x64_MI16x16x1_SN_CLR1_GSU0_GSUC0_GSUWGMRR0_K1_LBSPPA512_LBSPPB128_LPA32_MIWT2_2_PLR1_SU0_SUM0_SUS0_SKXCCM8_VWA2_VWB2_WGM8_WGMXCC1_WGMXCCGn1
    SolutionIndex: 65
    SolutionNameMin: Cijk_Ailk_Bljk_I8II_BH_UserArgs_MT32x64x64_MI16x16x1_SN_CLR1_GSU0_GSUC0_GSUWGMRR0_K1_LBSPPA256_LBSPPB128_LPA16_MIWT1_2_PLR1_SU0_SUM0_SUS0_SKXCCM8_VWA1_VWB1_WGM1_WGMXCC1_WGMXCCGn1
    SolutionIndex: 66
    SolutionNameMin: Cijk_Ailk_Bljk_I8II_BH_UserArgs_MT32x64x64_MI16x16x1_SN_CLR1_GSU0_GSUC0_GSUWGMRR0_K1_LBSPPA256_LBSPPB128_LPA16_MIWT1_2_PLR1_SU0_SUM0_SUS0_SKXCCM8_VWA1_VWB1_WGM1_WGMXCC1_WGMXCCGn1
    SolutionIndex: 67
    SolutionNameMin: Cijk_Ailk_Bljk_I8II_BH_UserArgs_MT32x64x64_MI16x16x1_SN_CLR1_GSU0_GSUC0_GSUWGMRR0_K1_LBSPPA256_LBSPPB128_LPA16_MIWT1_2_PLR1_SU0_SUM0_SUS0_SKXCCM8_VWA1_VWB1_WGM1_WGMXCC1_WGMXCCGn1
    SolutionIndex: 68
    SolutionNameMin: Cijk_Ailk_Bljk_I8II_BH_UserArgs_MT32x64x64_MI16x16x1_SN_CLR0_GSU0_GSUC0_GSUWGMRR0_K1_LBSPPA256_LBSPPB128_LPA16_MIWT1_2_PLR0_SU0_SUM0_SUS0_SKXCCM8_VWA1_VWB2_WGM1_WGMXCC1_WGMXCCGn1
    SolutionIndex: 69
    SolutionNameMin: Cijk_Ailk_Bljk_I8II_BH_UserArgs_MT32x32x64_MI16x16x1_SN_CLR1_GSU0_GSUC0_GSUWGMRR0_K1_LBSPPA256_LBSPPB128_LPA16_MIWT1_1_PLR1_SU0_SUM0_SUS0_SKXCCM8_VWA1_VWB1_WGM1_WGMXCC1_WGMXCCGn1
    SolutionIndex: 70
    SolutionNameMin: Cijk_Ailk_Bljk_I8II_BH_UserArgs_MT32x32x64_MI16x16x1_SN_CLR1_GSU0_GSUC0_GSUWGMRR0_K1_LBSPPA256_LBSPPB128_LPA16_MIWT1_1_PLR1_SU0_SUM0_SUS0_SKXCCM8_VWA1_VWB1_WGM1_WGMXCC1_WGMXCCGn1
    SolutionIndex: 71
    SolutionNameMin: Cijk_Ailk_Bljk_I8II_BH_UserArgs_MT32x32x64_MI16x16x1_SN_CLR1_GSU0_GSUC0_GSUWGMRR0_K1_LBSPPA256_LBSPPB128_LPA16_MIWT1_1_PLR1_SU0_SUM0_SUS0_SKXCCM8_VWA1_VWB1_WGM1_WGMXCC1_WGMXCCGn1
    SolutionIndex: 72
    SolutionNameMin: Cijk_Ailk_Bljk_I8II_BH_UserArgs_MT32x32x64_MI16x16x1_SN_CLR1_GSU0_GSUC0_GSUWGMRR0_K1_LBSPPA256_LBSPPB128_LPA16_MIWT1_1_PLR1_SU0_SUM0_SUS0_SKXCCM8_VWA1_VWB1_WGM1_WGMXCC1_WGMXCCGn1
    SolutionIndex: 73
    SolutionNameMin: Cijk_Ailk_Bljk_I8II_BH_UserArgs_MT32x32x64_MI16x16x1_SN_CLR1_GSU0_GSUC0_GSUWGMRR0_K1_LBSPPA256_LBSPPB128_LPA16_MIWT1_1_PLR1_SU0_SUM0_SUS0_SKXCCM8_VWA1_VWB1_WGM1_WGMXCC1_WGMXCCGn1
    SolutionIndex: 74
    SolutionNameMin: Cijk_Ailk_Bljk_I8II_BH_UserArgs_MT32x32x64_MI16x16x1_SN_CLR1_GSU0_GSUC0_GSUWGMRR0_K1_LBSPPA256_LBSPPB128_LPA16_MIWT1_1_PLR1_SU0_SUM0_SUS0_SKXCCM8_VWA1_VWB1_WGM1_WGMXCC1_WGMXCCGn1
    SolutionIndex: 75
    SolutionNameMin: Cijk_Ailk_Bljk_I8II_BH_UserArgs_MT32x32x64_MI16x16x1_SN_CLR0_GSU0_GSUC0_GSUWGMRR0_K1_LBSPPA256_LBSPPB128_LPA16_MIWT1_1_PLR0_SU0_SUM0_SUS0_SKXCCM8_VWA1_VWB1_WGM1_WGMXCC1_WGMXCCGn1
    SolutionIndex: 76
    SolutionNameMin: Cijk_Ailk_Bljk_I8II_BH_UserArgs_MT32x32x64_MI16x16x1_SN_CLR0_GSU0_GSUC0_GSUWGMRR0_K1_LBSPPA256_LBSPPB128_LPA16_MIWT1_1_PLR0_SU0_SUM0_SUS0_SKXCCM8_VWA1_VWB1_WGM1_WGMXCC1_WGMXCCGn1
    SolutionIndex: 77
    SolutionNameMin: Cijk_Ailk_Bljk_I8II_BH_UserArgs_MT32x32x64_MI16x16x1_SN_CLR0_GSU0_GSUC0_GSUWGMRR0_K1_LBSPPA256_LBSPPB128_LPA16_MIWT1_1_PLR0_SU0_SUM0_SUS0_SKXCCM8_VWA1_VWB1_WGM1_WGMXCC1_WGMXCCGn1
    SolutionIndex: 78
    SolutionNameMin: Cijk_Ailk_Bljk_I8II_BH_UserArgs_MT32x32x64_MI16x16x1_SN_CLR0_GSU0_GSUC0_GSUWGMRR0_K1_LBSPPA256_LBSPPB128_LPA16_MIWT1_1_PLR0_SU0_SUM0_SUS0_SKXCCM8_VWA1_VWB1_WGM1_WGMXCC1_WGMXCCGn1
    SolutionIndex: 79
    SolutionNameMin: Cijk_Ailk_Bljk_I8II_BH_UserArgs_MT32x32x64_MI16x16x1_SN_CLR0_GSU0_GSUC0_GSUWGMRR0_K1_LBSPPA256_LBSPPB128_LPA16_MIWT1_1_PLR0_SU0_SUM0_SUS0_SKXCCM8_VWA1_VWB1_WGM1_WGMXCC1_WGMXCCGn1
    SolutionIndex: 80
    SolutionNameMin: Cijk_Ailk_Bljk_I8II_BH_UserArgs_MT32x32x64_MI16x16x1_SN_CLR0_GSU0_GSUC0_GSUWGMRR0_K1_LBSPPA256_LBSPPB128_LPA16_MIWT1_1_PLR0_SU0_SUM0_SUS0_SKXCCM8_VWA1_VWB1_WGM1_WGMXCC1_WGMXCCGn1
    SolutionIndex: 81
    SolutionNameMin: Cijk_Ailk_Bljk_I8II_BH_UserArgs_MT32x32x64_MI16x16x1_SN_CLR1_GSU0_GSUC0_GSUWGMRR0_K1_LBSPPA256_LBSPPB128_LPA16_MIWT1_1_PLR1_SU0_SUM0_SUS0_SKXCCM8_VWA1_VWB1_WGM4_WGMXCC1_WGMXCCGn1
    SolutionIndex: 82
    SolutionNameMin: Cijk_Ailk_Bljk_I8II_BH_UserArgs_MT32x32x64_MI16x16x1_SN_CLR1_GSU0_GSUC0_GSUWGMRR0_K1_LBSPPA256_LBSPPB128_LPA16_MIWT1_1_PLR1_SU0_SUM0_SUS0_SKXCCM8_VWA1_VWB1_WGM8_WGMXCC1_WGMXCCGn1
    SolutionIndex: 83
    SolutionNameMin: Cijk_Ailk_Bljk_I8II_BH_UserArgs_MT32x32x64_MI16x16x1_SN_CLR1_GSU0_GSUC0_GSUWGMRR0_K1_LBSPPA256_LBSPPB128_LPA16_MIWT1_1_PLR1_SU0_SUM0_SUS0_SKXCCM8_VWA1_VWB1_WGM8_WGMXCC1_WGMXCCGn1
    SolutionIndex: 84
    SolutionNameMin: Cijk_Ailk_Bljk_I8II_BH_UserArgs_MT32x32x64_MI16x16x1_SN_CLR0_GSU0_GSUC0_GSUWGMRR0_K1_LBSPPA256_LBSPPB128_LPA16_MIWT1_1_PLR0_SU0_SUM0_SUS0_SKXCCM8_VWA1_VWB1_WGM8_WGMXCC1_WGMXCCGn1
    SolutionIndex: 85
    SolutionNameMin: Cijk_Ailk_Bljk_I8II_BH_UserArgs_MT128x256x128_MI16x16x1_SN_CLR1_GSU0_GSUC0_GSUWGMRR0_K1_LBSPPA2048_LBSPPB128_LPA64_MIWT4_8_PLR1_SU0_SUM0_SUS0_SKXCCM8_VWA4_VWB1_WGM1_WGMXCC1_WGMXCCGn1
    SolutionIndex: 86
    SolutionNameMin: Cijk_Ailk_Bljk_I8II_BH_UserArgs_MT128x256x128_MI16x16x1_SN_CLR1_GSU0_GSUC0_GSUWGMRR0_K1_LBSPPA2048_LBSPPB256_LPA64_MIWT4_8_PLR1_SU0_SUM0_SUS0_SKXCCM8_VWA4_VWB2_WGM1_WGMXCC1_WGMXCCGn1
    SolutionIndex: 87
    SolutionNameMin: Cijk_Ailk_Bljk_I8II_BH_UserArgs_MT128x256x128_MI16x16x1_SN_CLR1_GSU0_GSUC0_GSUWGMRR0_K1_LBSPPA2048_LBSPPB512_LPA64_MIWT4_8_PLR1_SU0_SUM0_SUS0_SKXCCM8_VWA4_VWB4_WGM1_WGMXCC1_WGMXCCGn1
    SolutionIndex: 88
    SolutionNameMin: Cijk_Ailk_Bljk_I8II_BH_UserArgs_MT128x256x128_MI16x16x1_SN_CLR1_GSU0_GSUC0_GSUWGMRR0_K1_LBSPPA2048_LBSPPB1024_LPA64_MIWT4_8_PLR1_SU0_SUM0_SUS0_SKXCCM8_VWA4_VWB8_WGM1_WGMXCC1_WGMXCCGn1
    SolutionIndex: 89
    SolutionNameMin: Cijk_Ailk_Bljk_I8II_BH_UserArgs_MT128x256x128_MI16x16x1_SN_CLR1_GSU0_GSUC0_GSUWGMRR0_K1_LBSPPA2048_LBSPPB1024_LPA64_MIWT4_8_PLR2_SU0_SUM0_SUS0_SKXCCM8_VWA4_VWB8_WGM1_WGMXCC1_WGMXCCGn1
    SolutionIndex: 90
    SolutionNameMin: Cijk_Ailk_Bljk_I8II_BH_UserArgs_MT128x256x128_MI16x16x1_SN_CLR1_GSU0_GSUC0_GSUWGMRR0_K1_LBSPPA2048_LBSPPB512_LPA64_MIWT4_8_PLR1_SU0_SUM0_SUS0_SKXCCM8_VWA4_VWB4_WGM4_WGMXCC1_WGMXCCGn1
    SolutionIndex: 91
    SolutionNameMin: Cijk_Ailk_Bljk_I8II_BH_UserArgs_MT128x256x128_MI16x16x1_SN_CLR1_GSU0_GSUC0_GSUWGMRR0_K1_LBSPPA2048_LBSPPB512_LPA64_MIWT4_8_PLR1_SU0_SUM0_SUS0_SKXCCM8_VWA4_VWB4_WGM4_WGMXCC1_WGMXCCGn1
    SolutionIndex: 92
    SolutionNameMin: Cijk_Ailk_Bljk_I8II_BH_UserArgs_MT128x256x128_MI16x16x1_SN_CLR1_GSU0_GSUC0_GSUWGMRR0_K1_LBSPPA2048_LBSPPB512_LPA64_MIWT4_8_PLR1_SU0_SUM0_SUS0_SKXCCM8_VWA4_VWB4_WGM8_WGMXCC1_WGMXCCGn1
    SolutionIndex: 93
    SolutionNameMin: Cijk_Ailk_Bljk_I8II_BH_UserArgs_MT128x256x128_MI16x16x1_SN_CLR1_GSU0_GSUC0_GSUWGMRR0_K1_LBSPPA2048_LBSPPB512_LPA64_MIWT4_8_PLR1_SU0_SUM0_SUS0_SKXCCM8_VWA4_VWB4_WGM8_WGMXCC1_WGMXCCGn1
    SolutionIndex: 94
    SolutionNameMin: Cijk_Ailk_Bljk_I8II_BH_UserArgs_MT256x128x128_MI16x16x1_SN_CLR1_GSU0_GSUC0_GSUWGMRR0_K1_LBSPPA4096_LBSPPB256_LPA64_MIWT8_4_PLR1_SU0_SUM0_SUS0_SKXCCM8_VWA4_VWB2_WGM1_WGMXCC1_WGMXCCGn1
    SolutionIndex: 95
    SolutionNameMin: Cijk_Ailk_Bljk_I8II_BH_UserArgs_MT256x128x128_MI16x16x1_SN_CLR1_GSU0_GSUC0_GSUWGMRR0_K1_LBSPPA4096_LBSPPB128_LPA64_MIWT8_4_PLR1_SU0_SUM0_SUS0_SKXCCM8_VWA4_VWB1_WGM4_WGMXCC1_WGMXCCGn1
    SolutionIndex: 96
    SolutionNameMin: Cijk_Ailk_Bljk_I8II_BH_UserArgs_MT256x128x128_MI16x16x1_SN_CLR1_GSU0_GSUC0_GSUWGMRR0_K1_LBSPPA4096_LBSPPB256_LPA64_MIWT8_4_PLR1_SU0_SUM0_SUS0_SKXCCM8_VWA4_VWB2_WGM4_WGMXCC1_WGMXCCGn1
    SolutionIndex: 97
    SolutionNameMin: Cijk_Ailk_Bljk_I8II_BH_UserArgs_MT256x128x128_MI16x16x1_SN_CLR1_GSU0_GSUC0_GSUWGMRR0_K1_LBSPPA4096_LBSPPB512_LPA64_MIWT8_4_PLR1_SU0_SUM0_SUS0_SKXCCM8_VWA4_VWB4_WGM4_WGMXCC1_WGMXCCGn1
    SolutionIndex: 98
    SolutionNameMin: Cijk_Ailk_Bljk_I8II_BH_UserArgs_MT256x128x128_MI16x16x1_SN_CLR1_GSU0_GSUC0_GSUWGMRR0_K1_LBSPPA4096_LBSPPB128_LPA64_MIWT8_4_PLR1_SU0_SUM0_SUS0_SKXCCM8_VWA4_VWB1_WGM4_WGMXCC1_WGMXCCGn1
    SolutionIndex: 99
    SolutionNameMin: Cijk_Ailk_Bljk_I8II_BH_UserArgs_MT256x128x128_MI16x16x1_SN_CLR1_GSU0_GSUC0_GSUWGMRR0_K1_LBSPPA4096_LBSPPB128_LPA0_MIWT8_4_PLR1_SU0_SUM0_SUS0_SKXCCM8_VWA8_VWB1_WGM4_WGMXCC1_WGMXCCGn1
    SolutionIndex: 100
    SolutionNameMin: Cijk_Ailk_Bljk_I8II_BH_UserArgs_MT256x128x128_MI16x16x1_SN_CLR1_GSU0_GSUC0_GSUWGMRR0_K1_LBSPPA4096_LBSPPB256_LPA64_MIWT8_4_PLR1_SU0_SUM0_SUS0_SKXCCM8_VWA4_VWB2_WGM4_WGMXCC1_WGMXCCGn1
    SolutionIndex: 101
    SolutionNameMin: Cijk_Ailk_Bljk_I8II_BH_UserArgs_MT256x128x128_MI16x16x1_SN_CLR1_GSU0_GSUC0_GSUWGMRR0_K1_LBSPPA4096_LBSPPB512_LPA64_MIWT8_4_PLR1_SU0_SUM0_SUS0_SKXCCM8_VWA4_VWB4_WGM4_WGMXCC1_WGMXCCGn1
    SolutionIndex: 102
    SolutionNameMin: Cijk_Ailk_Bljk_I8II_BH_UserArgs_MT256x128x128_MI16x16x1_SN_CLR1_GSU0_GSUC0_GSUWGMRR0_K1_LBSPPA4096_LBSPPB256_LPA64_MIWT8_4_PLR1_SU0_SUM0_SUS0_SKXCCM8_VWA4_VWB2_WGM8_WGMXCC1_WGMXCCGn1
    SolutionIndex: 103
    SolutionNameMin: Cijk_Ailk_Bljk_I8II_BH_UserArgs_MT256x128x128_MI16x16x1_SN_CLR1_GSU0_GSUC0_GSUWGMRR0_K1_LBSPPA4096_LBSPPB512_LPA64_MIWT8_4_PLR1_SU0_SUM0_SUS0_SKXCCM8_VWA4_VWB4_WGM8_WGMXCC1_WGMXCCGn1
    SolutionIndex: 104
    SolutionNameMin: Cijk_Ailk_Bljk_I8II_BH_UserArgs_MT256x128x128_MI16x16x1_SN_CLR1_GSU0_GSUC0_GSUWGMRR0_K1_LBSPPA4096_LBSPPB256_LPA64_MIWT8_4_PLR1_SU0_SUM0_SUS0_SKXCCM8_VWA4_VWB2_WGM8_WGMXCC1_WGMXCCGn1
    SolutionIndex: 105
    SolutionNameMin: Cijk_Ailk_Bljk_I8II_BH_UserArgs_MT256x128x128_MI16x16x1_SN_CLR1_GSU0_GSUC0_GSUWGMRR0_K1_LBSPPA4096_LBSPPB512_LPA64_MIWT8_4_PLR1_SU0_SUM0_SUS0_SKXCCM8_VWA4_VWB4_WGM8_WGMXCC1_WGMXCCGn1
    SolutionIndex: 106
    SolutionNameMin: Cijk_Ailk_Bljk_I8II_BH_UserArgs_MT256x128x128_MI16x16x1_SN_CLR1_GSU0_GSUC0_GSUWGMRR0_K1_LBSPPA4096_LBSPPB128_LPA64_MIWT8_4_PLR1_SU0_SUM0_SUS0_SKXCCM8_VWA4_VWB1_WGM8_WGMXCC1_WGMXCCGn1
    SolutionIndex: 107
    SolutionNameMin: Cijk_Ailk_Bljk_I8II_BH_UserArgs_MT256x128x128_MI16x16x1_SN_CLR1_GSU0_GSUC0_GSUWGMRR0_K1_LBSPPA4096_LBSPPB512_LPA64_MIWT8_4_PLR1_SU0_SUM0_SUS0_SKXCCM8_VWA4_VWB4_WGM8_WGMXCC1_WGMXCCGn1
    SolutionIndex: 108
    SolutionNameMin: Cijk_Ailk_Bljk_I8II_BH_UserArgs_MT128x128x128_MI16x16x1_SN_CLR1_GSU0_GSUC0_GSUWGMRR0_K1_LBSPPA2048_LBSPPB256_LPA64_MIWT4_4_PLR1_SU0_SUM0_SUS0_SKXCCM8_VWA4_VWB2_WGM1_WGMXCC1_WGMXCCGn1
    SolutionIndex: 109
    SolutionNameMin: Cijk_Ailk_Bljk_I8II_BH_UserArgs_MT128x128x128_MI16x16x1_SN_CLR1_GSU0_GSUC0_GSUWGMRR0_K1_LBSPPA2048_LBSPPB512_LPA64_MIWT4_4_PLR1_SU0_SUM0_SUS0_SKXCCM8_VWA4_VWB4_WGM1_WGMXCC1_WGMXCCGn1
    SolutionIndex: 110
    SolutionNameMin: Cijk_Ailk_Bljk_I8II_BH_UserArgs_MT128x128x128_MI16x16x1_SN_CLR1_GSU0_GSUC0_GSUWGMRR0_K1_LBSPPA2048_LBSPPB256_LPA64_MIWT4_4_PLR1_SU0_SUM0_SUS0_SKXCCM8_VWA4_VWB2_WGM1_WGMXCC1_WGMXCCGn1
    SolutionIndex: 111
    SolutionNameMin: Cijk_Ailk_Bljk_I8II_BH_UserArgs_MT128x128x128_MI16x16x1_SN_CLR1_GSU0_GSUC0_GSUWGMRR0_K1_LBSPPA2048_LBSPPB512_LPA64_MIWT4_4_PLR1_SU0_SUM0_SUS0_SKXCCM8_VWA4_VWB4_WGM1_WGMXCC1_WGMXCCGn1
    SolutionIndex: 112
    SolutionNameMin: Cijk_Ailk_Bljk_I8II_BH_UserArgs_MT128x128x128_MI16x16x1_SN_CLR1_GSU0_GSUC0_GSUWGMRR0_K1_LBSPPA2048_LBSPPB512_LPA64_MIWT4_4_PLR2_SU0_SUM0_SUS0_SKXCCM8_VWA4_VWB4_WGM1_WGMXCC1_WGMXCCGn1
    SolutionIndex: 113
    SolutionNameMin: Cijk_Ailk_Bljk_I8II_BH_UserArgs_MT128x128x128_MI16x16x1_SN_CLR1_GSU0_GSUC0_GSUWGMRR0_K1_LBSPPA2048_LBSPPB512_LPA64_MIWT4_4_PLR2_SU0_SUM0_SUS0_SKXCCM8_VWA4_VWB4_WGM1_WGMXCC1_WGMXCCGn1
    SolutionIndex: 114
    SolutionNameMin: Cijk_Ailk_Bljk_I8II_BH_UserArgs_MT128x128x128_MI16x16x1_SN_CLR1_GSU0_GSUC0_GSUWGMRR0_K1_LBSPPA2048_LBSPPB256_LPA64_MIWT4_4_PLR1_SU0_SUM0_SUS0_SKXCCM8_VWA4_VWB2_WGM4_WGMXCC1_WGMXCCGn1
    SolutionIndex: 115
    SolutionNameMin: Cijk_Ailk_Bljk_I8II_BH_UserArgs_MT128x128x128_MI16x16x1_SN_CLR1_GSU0_GSUC0_GSUWGMRR0_K1_LBSPPA2048_LBSPPB512_LPA64_MIWT4_4_PLR1_SU0_SUM0_SUS0_SKXCCM8_VWA4_VWB4_WGM4_WGMXCC1_WGMXCCGn1
    SolutionIndex: 116
    SolutionNameMin: Cijk_Ailk_Bljk_I8II_BH_UserArgs_MT128x128x128_MI16x16x1_SN_CLR1_GSU0_GSUC0_GSUWGMRR0_K1_LBSPPA2048_LBSPPB128_LPA64_MIWT4_4_PLR1_SU0_SUM0_SUS0_SKXCCM8_VWA4_VWB1_WGM4_WGMXCC1_WGMXCCGn1
    SolutionIndex: 117
    SolutionNameMin: Cijk_Ailk_Bljk_I8II_BH_UserArgs_MT128x128x128_MI16x16x1_SN_CLR1_GSU0_GSUC0_GSUWGMRR0_K1_LBSPPA2048_LBSPPB256_LPA64_MIWT4_4_PLR1_SU0_SUM0_SUS0_SKXCCM8_VWA4_VWB2_WGM4_WGMXCC1_WGMXCCGn1
    SolutionIndex: 118
    SolutionNameMin: Cijk_Ailk_Bljk_I8II_BH_UserArgs_MT128x128x128_MI16x16x1_SN_CLR1_GSU0_GSUC0_GSUWGMRR0_K1_LBSPPA2048_LBSPPB512_LPA64_MIWT4_4_PLR1_SU0_SUM0_SUS0_SKXCCM8_VWA4_VWB4_WGM4_WGMXCC1_WGMXCCGn1
    SolutionIndex: 119
    SolutionNameMin: Cijk_Ailk_Bljk_I8II_BH_UserArgs_MT128x128x128_MI16x16x1_SN_CLR1_GSU0_GSUC0_GSUWGMRR0_K1_LBSPPA2048_LBSPPB128_LPA64_MIWT4_4_PLR1_SU0_SUM0_SUS0_SKXCCM8_VWA4_VWB1_WGM8_WGMXCC1_WGMXCCGn1
    SolutionIndex: 120
    SolutionNameMin: Cijk_Ailk_Bljk_I8II_BH_UserArgs_MT128x128x128_MI16x16x1_SN_CLR1_GSU0_GSUC0_GSUWGMRR0_K1_LBSPPA2048_LBSPPB512_LPA64_MIWT4_4_PLR1_SU0_SUM0_SUS0_SKXCCM8_VWA4_VWB4_WGM8_WGMXCC1_WGMXCCGn1
    SolutionIndex: 121
    SolutionNameMin: Cijk_Ailk_Bljk_I8II_BH_UserArgs_MT128x128x128_MI16x16x1_SN_CLR1_GSU0_GSUC0_GSUWGMRR0_K1_LBSPPA2048_LBSPPB256_LPA64_MIWT4_4_PLR1_SU0_SUM0_SUS0_SKXCCM8_VWA4_VWB2_WGM8_WGMXCC1_WGMXCCGn1
    SolutionIndex: 122
    SolutionNameMin: Cijk_Ailk_Bljk_I8II_BH_UserArgs_MT128x128x128_MI16x16x1_SN_CLR1_GSU0_GSUC0_GSUWGMRR0_K1_LBSPPA2048_LBSPPB512_LPA64_MIWT4_4_PLR1_SU0_SUM0_SUS0_SKXCCM8_VWA4_VWB4_WGM8_WGMXCC1_WGMXCCGn1
    SolutionIndex: 123
    SolutionNameMin: Cijk_Ailk_Bljk_I8II_BH_UserArgs_MT128x128x128_MI16x16x1_SN_CLR1_GSU0_GSUC0_GSUWGMRR0_K1_LBSPPA2048_LBSPPB128_LPA64_MIWT4_4_PLR2_SU0_SUM0_SUS0_SKXCCM8_VWA4_VWB1_WGM8_WGMXCC1_WGMXCCGn1
    SolutionIndex: 124
    SolutionNameMin: Cijk_Ailk_Bljk_I8II_BH_UserArgs_MT128x128x128_MI16x16x1_SN_CLR1_GSU0_GSUC0_GSUWGMRR0_K1_LBSPPA2048_LBSPPB256_LPA64_MIWT4_4_PLR2_SU0_SUM0_SUS0_SKXCCM8_VWA4_VWB2_WGM8_WGMXCC1_WGMXCCGn1
    SolutionIndex: 125
    SolutionNameMin: Cijk_Ailk_Bljk_I8II_BH_UserArgs_MT64x128x128_MI16x16x1_SN_CLR1_GSU0_GSUC0_GSUWGMRR0_K1_LBSPPA1024_LBSPPB512_LPA32_MIWT2_4_PLR1_SU0_SUM0_SUS0_SKXCCM8_VWA2_VWB4_WGM1_WGMXCC1_WGMXCCGn1
    SolutionIndex: 126
    SolutionNameMin: Cijk_Ailk_Bljk_I8II_BH_UserArgs_MT128x64x128_MI16x16x1_SN_CLR1_GSU0_GSUC0_GSUWGMRR0_K1_LBSPPA2048_LBSPPB128_LPA64_MIWT4_2_PLR1_SU0_SUM0_SUS0_SKXCCM8_VWA4_VWB1_WGM1_WGMXCC1_WGMXCCGn1
    SolutionIndex: 127
    SolutionNameMin: Cijk_Ailk_Bljk_I8II_BH_UserArgs_MT128x64x128_MI16x16x1_SN_CLR1_GSU0_GSUC0_GSUWGMRR0_K1_LBSPPA2048_LBSPPB256_LPA64_MIWT4_2_PLR1_SU0_SUM0_SUS0_SKXCCM8_VWA4_VWB2_WGM1_WGMXCC1_WGMXCCGn1
    SolutionIndex: 128
    SolutionNameMin: Cijk_Ailk_Bljk_I8II_BH_UserArgs_MT128x64x128_MI16x16x1_SN_CLR1_GSU0_GSUC0_GSUWGMRR0_K1_LBSPPA2048_LBSPPB128_LPA64_MIWT4_2_PLR1_SU0_SUM0_SUS0_SKXCCM8_VWA4_VWB1_WGM4_WGMXCC1_WGMXCCGn1
    SolutionIndex: 129
    SolutionNameMin: Cijk_Ailk_Bljk_I8II_BH_UserArgs_MT128x64x128_MI16x16x1_SN_CLR1_GSU0_GSUC0_GSUWGMRR0_K1_LBSPPA2048_LBSPPB128_LPA64_MIWT4_2_PLR1_SU0_SUM0_SUS0_SKXCCM8_VWA4_VWB1_WGM8_WGMXCC1_WGMXCCGn1
    SolutionIndex: 130
    SolutionNameMin: Cijk_Ailk_Bljk_I8II_BH_UserArgs_MT128x64x128_MI16x16x1_SN_CLR1_GSU0_GSUC0_GSUWGMRR0_K1_LBSPPA2048_LBSPPB256_LPA64_MIWT4_2_PLR1_SU0_SUM0_SUS0_SKXCCM8_VWA4_VWB2_WGM8_WGMXCC1_WGMXCCGn1
    SolutionIndex: 131
    SolutionNameMin: Cijk_Ailk_Bljk_I8II_BH_UserArgs_MT128x32x128_MI16x16x1_SN_CLR1_GSU0_GSUC0_GSUWGMRR0_K1_LBSPPA2048_LBSPPB128_LPA64_MIWT4_1_PLR1_SU0_SUM0_SUS0_SKXCCM8_VWA4_VWB1_WGM1_WGMXCC1_WGMXCCGn1
    SolutionIndex: 132
    SolutionNameMin: Cijk_Ailk_Bljk_I8II_BH_UserArgs_MT128x32x128_MI16x16x1_SN_CLR1_GSU0_GSUC0_GSUWGMRR0_K1_LBSPPA2048_LBSPPB128_LPA64_MIWT4_1_PLR1_SU0_SUM0_SUS0_SKXCCM8_VWA4_VWB1_WGM1_WGMXCC1_WGMXCCGn1
    SolutionIndex: 133
    SolutionNameMin: Cijk_Ailk_Bljk_I8II_BH_UserArgs_MT64x64x128_MI16x16x1_SN_CLR1_GSU0_GSUC0_GSUWGMRR0_K1_LBSPPA1024_LBSPPB128_LPA32_MIWT2_2_PLR1_SU0_SUM0_SUS0_SKXCCM8_VWA2_VWB1_WGM1_WGMXCC1_WGMXCCGn1
    SolutionIndex: 134
    SolutionNameMin: Cijk_Ailk_Bljk_I8II_BH_UserArgs_MT64x64x128_MI16x16x1_SN_CLR1_GSU0_GSUC0_GSUWGMRR0_K1_LBSPPA1024_LBSPPB256_LPA32_MIWT2_2_PLR1_SU0_SUM0_SUS0_SKXCCM8_VWA2_VWB2_WGM1_WGMXCC1_WGMXCCGn1
    SolutionIndex: 135
    SolutionNameMin: Cijk_Ailk_Bljk_I8II_BH_UserArgs_MT64x64x128_MI16x16x1_SN_CLR1_GSU0_GSUC0_GSUWGMRR0_K1_LBSPPA1024_LBSPPB256_LPA32_MIWT2_2_PLR1_SU0_SUM0_SUS0_SKXCCM8_VWA2_VWB2_WGM4_WGMXCC1_WGMXCCGn1
    SolutionIndex: 136
    SolutionNameMin: Cijk_Ailk_Bljk_I8II_BH_UserArgs_MT64x64x128_MI16x16x1_SN_CLR1_GSU0_GSUC0_GSUWGMRR0_K1_LBSPPA1024_LBSPPB128_LPA32_MIWT2_2_PLR1_SU0_SUM0_SUS0_SKXCCM8_VWA2_VWB1_WGM8_WGMXCC1_WGMXCCGn1
    SolutionIndex: 137
    SolutionNameMin: Cijk_Ailk_Bljk_I8II_BH_UserArgs_MT64x64x128_MI16x16x1_SN_CLR1_GSU0_GSUC0_GSUWGMRR0_K1_LBSPPA1024_LBSPPB128_LPA32_MIWT2_2_PLR1_SU0_SUM0_SUS0_SKXCCM8_VWA2_VWB1_WGM8_WGMXCC1_WGMXCCGn1
    SolutionIndex: 138
    SolutionNameMin: Cijk_Ailk_Bljk_I8II_BH_UserArgs_MT64x64x128_MI16x16x1_SN_CLR1_GSU0_GSUC0_GSUWGMRR0_K1_LBSPPA1024_LBSPPB256_LPA32_MIWT2_2_PLR1_SU0_SUM0_SUS0_SKXCCM8_VWA2_VWB2_WGM8_WGMXCC1_WGMXCCGn1
    SolutionIndex: 139
    SolutionNameMin: Cijk_Ailk_Bljk_I8II_BH_UserArgs_MT32x64x128_MI16x16x1_SN_CLR1_GSU0_GSUC0_GSUWGMRR0_K1_LBSPPA512_LBSPPB256_LPA16_MIWT1_2_PLR1_SU0_SUM0_SUS0_SKXCCM8_VWA1_VWB2_WGM1_WGMXCC1_WGMXCCGn1
    SolutionIndex: 140
    SolutionNameMin: Cijk_Ailk_Bljk_I8II_BH_UserArgs_MT32x64x128_MI16x16x1_SN_CLR1_GSU0_GSUC0_GSUWGMRR0_K1_LBSPPA512_LBSPPB128_LPA16_MIWT1_2_PLR1_SU0_SUM0_SUS0_SKXCCM8_VWA1_VWB1_WGM1_WGMXCC1_WGMXCCGn1
    SolutionIndex: 141
    SolutionNameMin: Cijk_Ailk_Bljk_I8II_BH_UserArgs_MT32x64x128_MI16x16x1_SN_CLR1_GSU0_GSUC0_GSUWGMRR0_K1_LBSPPA512_LBSPPB256_LPA16_MIWT1_2_PLR1_SU0_SUM0_SUS0_SKXCCM8_VWA1_VWB2_WGM1_WGMXCC1_WGMXCCGn1
    SolutionIndex: 142
    SolutionNameMin: Cijk_Ailk_Bljk_I8II_BH_UserArgs_MT32x64x128_MI16x16x1_SN_CLR1_GSU0_GSUC0_GSUWGMRR0_K1_LBSPPA512_LBSPPB128_LPA16_MIWT1_2_PLR1_SU0_SUM0_SUS0_SKXCCM8_VWA1_VWB1_WGM1_WGMXCC1_WGMXCCGn1
    SolutionIndex: 143
    SolutionNameMin: Cijk_Ailk_Bljk_I8II_BH_UserArgs_MT32x64x128_MI16x16x1_SN_CLR1_GSU0_GSUC0_GSUWGMRR0_K1_LBSPPA512_LBSPPB256_LPA16_MIWT1_2_PLR1_SU0_SUM0_SUS0_SKXCCM8_VWA1_VWB2_WGM1_WGMXCC1_WGMXCCGn1
    SolutionIndex: 144
    SolutionNameMin: Cijk_Ailk_Bljk_I8II_BH_UserArgs_MT32x64x128_MI16x16x1_SN_CLR1_GSU0_GSUC0_GSUWGMRR0_K1_LBSPPA512_LBSPPB256_LPA16_MIWT1_2_PLR1_SU0_SUM0_SUS0_SKXCCM8_VWA1_VWB2_WGM8_WGMXCC1_WGMXCCGn1
    SolutionIndex: 145
    SolutionNameMin: Cijk_Ailk_Bljk_I8II_BH_UserArgs_MT64x32x128_MI16x16x1_SN_CLR1_GSU0_GSUC0_GSUWGMRR0_K1_LBSPPA1024_LBSPPB128_LPA32_MIWT2_1_PLR1_SU0_SUM0_SUS0_SKXCCM8_VWA2_VWB1_WGM1_WGMXCC1_WGMXCCGn1
    SolutionIndex: 146
    SolutionNameMin: Cijk_Ailk_Bljk_I8II_BH_UserArgs_MT64x32x128_MI16x16x1_SN_CLR1_GSU0_GSUC0_GSUWGMRR0_K1_LBSPPA1024_LBSPPB128_LPA32_MIWT2_1_PLR1_SU0_SUM0_SUS0_SKXCCM8_VWA2_VWB1_WGM1_WGMXCC1_WGMXCCGn1
    SolutionIndex: 147
    SolutionNameMin: Cijk_Ailk_Bljk_I8II_BH_UserArgs_MT64x32x128_MI16x16x1_SN_CLR1_GSU0_GSUC0_GSUWGMRR0_K1_LBSPPA1024_LBSPPB128_LPA32_MIWT2_1_PLR1_SU0_SUM0_SUS0_SKXCCM8_VWA2_VWB1_WGM1_WGMXCC1_WGMXCCGn1
    SolutionIndex: 148
    SolutionNameMin: Cijk_Ailk_Bljk_I8II_BH_UserArgs_MT64x32x128_MI16x16x1_SN_CLR1_GSU0_GSUC0_GSUWGMRR0_K1_LBSPPA1024_LBSPPB128_LPA32_MIWT2_1_PLR1_SU0_SUM0_SUS0_SKXCCM8_VWA2_VWB1_WGM4_WGMXCC1_WGMXCCGn1
    SolutionIndex: 149
    SolutionNameMin: Cijk_Ailk_Bljk_I8II_BH_UserArgs_MT64x32x128_MI16x16x1_SN_CLR1_GSU0_GSUC0_GSUWGMRR0_K1_LBSPPA1024_LBSPPB128_LPA32_MIWT2_1_PLR1_SU0_SUM0_SUS0_SKXCCM8_VWA2_VWB1_WGM4_WGMXCC1_WGMXCCGn1
    SolutionIndex: 150
    SolutionNameMin: Cijk_Ailk_Bljk_I8II_BH_UserArgs_MT64x32x128_MI16x16x1_SN_CLR1_GSU0_GSUC0_GSUWGMRR0_K1_LBSPPA1024_LBSPPB128_LPA32_MIWT2_1_PLR1_SU0_SUM0_SUS0_SKXCCM8_VWA2_VWB1_WGM8_WGMXCC1_WGMXCCGn1
    SolutionIndex: 151
    SolutionNameMin: Cijk_Ailk_Bljk_I8II_BH_UserArgs_MT32x32x128_MI16x16x1_SN_CLR1_GSU0_GSUC0_GSUWGMRR0_K1_LBSPPA512_LBSPPB128_LPA16_MIWT1_1_PLR1_SU0_SUM0_SUS0_SKXCCM8_VWA1_VWB1_WGM1_WGMXCC1_WGMXCCGn1
    SolutionIndex: 152
    SolutionNameMin: Cijk_Ailk_Bljk_I8II_BH_UserArgs_MT32x32x128_MI16x16x1_SN_CLR1_GSU0_GSUC0_GSUWGMRR0_K1_LBSPPA512_LBSPPB128_LPA16_MIWT1_1_PLR1_SU0_SUM0_SUS0_SKXCCM8_VWA1_VWB1_WGM1_WGMXCC1_WGMXCCGn1
    SolutionIndex: 153
    SolutionNameMin: Cijk_Ailk_Bljk_I8II_BH_UserArgs_MT32x32x128_MI16x16x1_SN_CLR1_GSU0_GSUC0_GSUWGMRR0_K1_LBSPPA512_LBSPPB128_LPA16_MIWT1_1_PLR1_SU0_SUM0_SUS0_SKXCCM8_VWA1_VWB1_WGM1_WGMXCC1_WGMXCCGn1
    SolutionIndex: 154
    SolutionNameMin: Cijk_Ailk_Bljk_I8II_BH_UserArgs_MT32x32x128_MI16x16x1_SN_CLR1_GSU0_GSUC0_GSUWGMRR0_K1_LBSPPA512_LBSPPB128_LPA16_MIWT1_1_PLR1_SU0_SUM0_SUS0_SKXCCM8_VWA1_VWB1_WGM1_WGMXCC1_WGMXCCGn1
    SolutionIndex: 155
    SolutionNameMin: Cijk_Ailk_Bljk_I8II_BH_UserArgs_MT32x32x128_MI16x16x1_SN_CLR1_GSU0_GSUC0_GSUWGMRR0_K1_LBSPPA512_LBSPPB128_LPA16_MIWT1_1_PLR2_SU0_SUM0_SUS0_SKXCCM8_VWA1_VWB1_WGM1_WGMXCC1_WGMXCCGn1
    SolutionIndex: 156
    SolutionNameMin: Cijk_Ailk_Bljk_I8II_BH_UserArgs_MT32x32x128_MI16x16x1_SN_CLR1_GSU0_GSUC0_GSUWGMRR0_K1_LBSPPA512_LBSPPB128_LPA16_MIWT1_1_PLR2_SU0_SUM0_SUS0_SKXCCM8_VWA1_VWB1_WGM1_WGMXCC1_WGMXCCGn1
    SolutionIndex: 157
    SolutionNameMin: Cijk_Ailk_Bljk_I8II_BH_UserArgs_MT32x32x128_MI16x16x1_SN_CLR1_GSU0_GSUC0_GSUWGMRR0_K1_LBSPPA512_LBSPPB128_LPA16_MIWT1_1_PLR2_SU0_SUM0_SUS0_SKXCCM8_VWA1_VWB1_WGM1_WGMXCC1_WGMXCCGn1
    SolutionIndex: 158
    SolutionNameMin: Cijk_Ailk_Bljk_I8II_BH_UserArgs_MT32x32x128_MI16x16x1_SN_CLR1_GSU0_GSUC0_GSUWGMRR0_K1_LBSPPA512_LBSPPB128_LPA16_MIWT1_1_PLR2_SU0_SUM0_SUS0_SKXCCM8_VWA1_VWB1_WGM1_WGMXCC1_WGMXCCGn1
    SolutionIndex: 159
    SolutionNameMin: Cijk_Ailk_Bljk_I8II_BH_UserArgs_MT32x32x128_MI16x16x1_SN_CLR1_GSU0_GSUC0_GSUWGMRR0_K1_LBSPPA512_LBSPPB128_LPA16_MIWT1_1_PLR1_SU0_SUM0_SUS0_SKXCCM8_VWA1_VWB1_WGM4_WGMXCC1_WGMXCCGn1
    SolutionIndex: 160
    SolutionNameMin: Cijk_Ailk_Bljk_I8II_BH_UserArgs_MT32x32x128_MI16x16x1_SN_CLR1_GSU0_GSUC0_GSUWGMRR0_K1_LBSPPA512_LBSPPB128_LPA16_MIWT1_1_PLR1_SU0_SUM0_SUS0_SKXCCM8_VWA1_VWB1_WGM4_WGMXCC1_WGMXCCGn1
    SolutionIndex: 161
    SolutionNameMin: Cijk_Ailk_Bljk_I8II_BH_UserArgs_MT32x32x128_MI16x16x1_SN_CLR1_GSU0_GSUC0_GSUWGMRR0_K1_LBSPPA512_LBSPPB128_LPA16_MIWT1_1_PLR1_SU0_SUM0_SUS0_SKXCCM8_VWA1_VWB1_WGM8_WGMXCC1_WGMXCCGn1
    SolutionIndex: 162
    SolutionNameMin: Cijk_Ailk_Bljk_I8II_BH_UserArgs_MT64x64x256_MI16x16x1_SN_CLR1_GSU0_GSUC0_GSUWGMRR0_K1_LBSPPA1024_LBSPPB256_LPA32_MIWT2_2_PLR2_SU0_SUM0_SUS0_SKXCCM8_VWA2_VWB1_WGM1_WGMXCC1_WGMXCCGn1
    SolutionIndex: 163
    SolutionNameMin: Cijk_Ailk_Bljk_I8II_BH_UserArgs_MT64x64x256_MI16x16x1_SN_CLR1_GSU0_GSUC0_GSUWGMRR0_K1_LBSPPA1024_LBSPPB512_LPA32_MIWT2_2_PLR2_SU0_SUM0_SUS0_SKXCCM8_VWA2_VWB2_WGM1_WGMXCC1_WGMXCCGn1
    SolutionIndex: 164
    SolutionNameMin: Cijk_Ailk_Bljk_I8II_BH_UserArgs_MT64x64x256_MI16x16x1_SN_CLR1_GSU0_GSUC0_GSUWGMRR0_K1_LBSPPA1024_LBSPPB256_LPA32_MIWT2_2_PLR2_SU0_SUM0_SUS0_SKXCCM8_VWA2_VWB1_WGM8_WGMXCC1_WGMXCCGn1
    SolutionIndex: 165
    SolutionNameMin: Cijk_Ailk_Bljk_I8II_BH_UserArgs_MT32x32x256_MI16x16x1_SN_CLR1_GSU0_GSUC0_GSUWGMRR0_K1_LBSPPA512_LBSPPB256_LPA16_MIWT1_1_PLR1_SU0_SUM0_SUS0_SKXCCM8_VWA1_VWB1_WGM1_WGMXCC1_WGMXCCGn1
    SolutionIndex: 166
    SolutionNameMin: Cijk_Ailk_Bljk_I8II_BH_UserArgs_MT32x32x256_MI16x16x1_SN_CLR1_GSU0_GSUC0_GSUWGMRR0_K1_LBSPPA512_LBSPPB256_LPA16_MIWT1_1_PLR1_SU0_SUM0_SUS0_SKXCCM8_VWA1_VWB1_WGM1_WGMXCC1_WGMXCCGn1
    SolutionIndex: 167
    SolutionNameMin: Cijk_Ailk_Bljk_I8II_BH_UserArgs_MT32x32x256_MI16x16x1_SN_CLR1_GSU0_GSUC0_GSUWGMRR0_K1_LBSPPA512_LBSPPB256_LPA16_MIWT1_1_PLR1_SU0_SUM0_SUS0_SKXCCM8_VWA1_VWB1_WGM1_WGMXCC1_WGMXCCGn1
    SolutionIndex: 168
    SolutionNameMin: Cijk_Ailk_Bljk_I8II_BH_UserArgs_MT32x32x256_MI16x16x1_SN_CLR1_GSU0_GSUC0_GSUWGMRR0_K1_LBSPPA512_LBSPPB256_LPA16_MIWT1_1_PLR2_SU0_SUM0_SUS0_SKXCCM8_VWA1_VWB1_WGM1_WGMXCC1_WGMXCCGn1
    SolutionIndex: 169
    SolutionNameMin: Cijk_Ailk_Bljk_I8II_BH_UserArgs_MT32x32x256_MI16x16x1_SN_CLR1_GSU0_GSUC0_GSUWGMRR0_K1_LBSPPA512_LBSPPB256_LPA16_MIWT1_1_PLR2_SU0_SUM0_SUS0_SKXCCM8_VWA1_VWB1_WGM1_WGMXCC1_WGMXCCGn1
    SolutionIndex: 170
    SolutionNameMin: Cijk_Ailk_Bljk_I8II_BH_UserArgs_MT32x32x32_MI16x16x1_SN_CLR0_GSU0_GSUC0_GSUWGMRR0_K1_LBSPPA256_LBSPPB128_LPA16_MIWT1_1_PLR0_SU32_SUM0_SUS256_SKXCCM8_VWA1_VWB1_WGM4_WGMXCC1_WGMXCCGn1
- - - [128, 128, 1, 128, 128, 128, 128, 128]
    - [82, 0.49]
  - - [128, 128, 1, 256, 128, 128, 128, 256]
    - [69, 0.95]
  - - [128, 128, 1, 512, 128, 128, 128, 512]
    - [152, 1.7]
  - - [128, 128, 1, 1024, 128, 128, 128, 1024]
    - [153, 2.65]
  - - [128, 128, 1, 2048, 128, 128, 128, 2048]
    - [154, 3.89]
  - - [128, 128, 1, 4096, 128, 128, 128, 4096]
    - [74, 6.75]
  - - [128, 128, 1, 8192, 128, 128, 128, 8192]
    - [153, 11.01]
  - - [128, 256, 1, 128, 128, 128, 128, 128]
    - [84, 1.05]
  - - [128, 256, 1, 256, 128, 128, 128, 256]
    - [167, 1.96]
  - - [128, 256, 1, 512, 128, 128, 128, 512]
    - [152, 3.45]
  - - [128, 256, 1, 1024, 128, 128, 128, 1024]
    - [168, 5.39]
  - - [128, 256, 1, 2048, 128, 128, 128, 2048]
    - [153, 7.89]
  - - [128, 256, 1, 4096, 128, 128, 128, 4096]
    - [83, 12.81]
  - - [128, 256, 1, 8192, 128, 128, 128, 8192]
    - [154, 20.99]
  - - [128, 512, 1, 128, 128, 128, 128, 128]
    - [151, 2.11]
  - - [128, 512, 1, 256, 128, 128, 128, 256]
    - [158, 3.85]
  - - [128, 512, 1, 512, 128, 128, 128, 512]
    - [152, 6.78]
  - - [128, 512, 1, 1024, 128, 128, 128, 1024]
    - [154, 10.83]
  - - [128, 512, 1, 2048, 128, 128, 128, 2048]
    - [154, 15.3]
  - - [128, 512, 1, 4096, 128, 128, 128, 4096]
    - [74, 25.11]
  - - [128, 512, 1, 8192, 128, 128, 128, 8192]
    - [161, 40.79]
  - - [128, 1024, 1, 128, 128, 128, 128, 128]
    - [72, 4.26]
  - - [128, 1024, 1, 256, 128, 128, 128, 256]
    - [154, 7.44]
  - - [128, 1024, 1, 512, 128, 128, 128, 512]
    - [154, 13.37]
  - - [128, 1024, 1, 1024, 128, 128, 128, 1024]
    - [153, 21.27]
  - - [128, 1024, 1, 2048, 128, 128, 128, 2048]
    - [166, 29.93]
  - - [128, 1024, 1, 4096, 128, 128, 128, 4096]
    - [169, 45.02]
  - - [128, 1024, 1, 8192, 128, 128, 128, 8192]
    - [141, 72.97]
  - - [128, 2048, 1, 128, 128, 128, 128, 128]
    - [157, 7.99]
  - - [128, 2048, 1, 256, 128, 128, 128, 256]
    - [76, 14.64]
  - - [128, 2048, 1, 512, 128, 128, 128, 512]
    - [140, 25.06]
  - - [128, 2048, 1, 1024, 128, 128, 128, 1024]
    - [154, 40.52]
  - - [128, 2048, 1, 2048, 128, 128, 128, 2048]
    - [154, 56.8]
  - - [128, 2048, 1, 4096, 128, 128, 128, 4096]
    - [140, 78.78]
  - - [128, 2048, 1, 8192, 128, 128, 128, 8192]
    - [136, 109.74]
  - - [128, 4096, 1, 128, 128, 128, 128, 128]
    - [65, 15.13]
  - - [128, 4096, 1, 256, 128, 128, 128, 256]
    - [65, 26.77]
  - - [128, 4096, 1, 512, 128, 128, 128, 512]
    - [143, 46.1]
  - - [128, 4096, 1, 1024, 128, 128, 128, 1024]
    - [141, 71.93]
  - - [128, 4096, 1, 2048, 128, 128, 128, 2048]
    - [140, 101.8]
  - - [128, 4096, 1, 4096, 128, 128, 128, 4096]
    - [162, 129.62]
  - - [128, 4096, 1, 8192, 128, 128, 128, 8192]
    - [126, 169.74]
  - - [128, 8192, 1, 128, 128, 128, 128, 128]
    - [59, 25.34]
  - - [128, 8192, 1, 256, 128, 128, 128, 256]
    - [60, 45.54]
  - - [128, 8192, 1, 512, 128, 128, 128, 512]
    - [62, 75.16]
  - - [128, 8192, 1, 1024, 128, 128, 128, 1024]
    - [162, 113.53]
  - - [128, 8192, 1, 2048, 128, 128, 128, 2048]
    - [162, 160.02]
  - - [128, 8192, 1, 4096, 128, 128, 128, 4096]
    - [126, 177.79]
  - - [128, 8192, 1, 8192, 128, 128, 128, 8192]
    - [110, 237.39]
  - - [256, 128, 1, 128, 256, 256, 256, 128]
    - [70, 1.07]
  - - [256, 128, 1, 256, 256, 256, 256, 256]
    - [154, 2.03]
  - - [256, 128, 1, 512, 256, 256, 256, 512]
    - [152, 3.42]
  - - [256, 128, 1, 1024, 256, 256, 256, 1024]
    - [154, 5.45]
  - - [256, 128, 1, 2048, 256, 256, 256, 2048]
    - [154, 7.87]
  - - [256, 128, 1, 4096, 256, 256, 256, 4096]
    - [77, 12.94]
  - - [256, 128, 1, 8192, 256, 256, 256, 8192]
    - [154, 21.43]
  - - [256, 256, 1, 128, 256, 256, 256, 128]
    - [71, 2.19]
  - - [256, 256, 1, 256, 256, 256, 256, 256]
    - [165, 3.74]
  - - [256, 256, 1, 512, 256, 256, 256, 512]
    - [154, 6.91]
  - - [256, 256, 1, 1024, 256, 256, 256, 1024]
    - [154, 10.99]
  - - [256, 256, 1, 2048, 256, 256, 256, 2048]
    - [153, 15.62]
  - - [256, 256, 1, 4096, 256, 256, 256, 4096]
    - [81, 25.42]
  - - [256, 256, 1, 8192, 256, 256, 256, 8192]
    - [154, 41.9]
  - - [256, 512, 1, 128, 256, 256, 256, 128]
    - [157, 4.29]
  - - [256, 512, 1, 256, 256, 256, 256, 256]
    - [76, 7.71]
  - - [256, 512, 1, 512, 256, 256, 256, 512]
    - [152, 13.45]
  - - [256, 512, 1, 1024, 256, 256, 256, 1024]
    - [167, 20.83]
  - - [256, 512, 1, 2048, 256, 256, 256, 2048]
    - [153, 29.3]
  - - [256, 512, 1, 4096, 256, 256, 256, 4096]
    - [169, 44.54]
  - - [256, 512, 1, 8192, 256, 256, 256, 8192]
    - [141, 72.42]
  - - [256, 1024, 1, 128, 256, 256, 256, 128]
    - [6, 8.12]
  - - [256, 1024, 1, 256, 256, 256, 256, 256]
    - [154, 15.07]
  - - [256, 1024, 1, 512, 256, 256, 256, 512]
    - [154, 25.72]
  - - [256, 1024, 1, 1024, 256, 256, 256, 1024]
    - [153, 40.91]
  - - [256, 1024, 1, 2048, 256, 256, 256, 2048]
    - [153, 56.33]
  - - [256, 1024, 1, 4096, 256, 256, 256, 4096]
    - [141, 78.57]
  - - [256, 1024, 1, 8192, 256, 256, 256, 8192]
    - [138, 113.3]
  - - [256, 2048, 1, 128, 256, 256, 256, 128]
    - [67, 14.79]
  - - [256, 2048, 1, 256, 256, 256, 256, 256]
    - [139, 26.76]
  - - [256, 2048, 1, 512, 256, 256, 256, 512]
    - [143, 46.62]
  - - [256, 2048, 1, 1024, 256, 256, 256, 1024]
    - [140, 72.88]
  - - [256, 2048, 1, 2048, 256, 256, 256, 2048]
    - [140, 101.78]
  - - [256, 2048, 1, 4096, 256, 256, 256, 4096]
    - [164, 128.55]
  - - [256, 2048, 1, 8192, 256, 256, 256, 8192]
    - [126, 176.45]
  - - [256, 4096, 1, 128, 256, 256, 256, 128]
    - [5, 25.06]
  - - [256, 4096, 1, 256, 256, 256, 256, 256]
    - [61, 45.61]
  - - [256, 4096, 1, 512, 256, 256, 256, 512]
    - [133, 74.86]
  - - [256, 4096, 1, 1024, 256, 256, 256, 1024]
    - [133, 114.98]
  - - [256, 4096, 1, 2048, 256, 256, 256, 2048]
    - [138, 156.52]
  - - [256, 4096, 1, 4096, 256, 256, 256, 4096]
    - [163, 200.35]
  - - [256, 4096, 1, 8192, 256, 256, 256, 8192]
    - [108, 248.59]
  - - [256, 8192, 1, 128, 256, 256, 256, 128]
    - [52, 37.46]
  - - [256, 8192, 1, 256, 256, 256, 256, 256]
    - [51, 67.25]
  - - [256, 8192, 1, 512, 256, 256, 256, 512]
    - [47, 114.7]
  - - [256, 8192, 1, 1024, 256, 256, 256, 1024]
    - [45, 172.98]
  - - [256, 8192, 1, 2048, 256, 256, 256, 2048]
    - [126, 221.39]
  - - [256, 8192, 1, 4096, 256, 256, 256, 4096]
    - [114, 247.16]
  - - [256, 8192, 1, 8192, 256, 256, 256, 8192]
    - [88, 295.39]
  - - [512, 128, 1, 128, 512, 512, 512, 128]
    - [159, 2.02]
  - - [512, 128, 1, 256, 512, 512, 512, 256]
    - [73, 3.82]
  - - [512, 128, 1, 512, 512, 512, 512, 512]
    - [153, 6.68]
  - - [512, 128, 1, 1024, 512, 512, 512, 1024]
    - [152, 10.45]
  - - [512, 128, 1, 2048, 512, 512, 512, 2048]
    - [154, 15.23]
  - - [512, 128, 1, 4096, 512, 512, 512, 4096]
    - [80, 24.97]
  - - [512, 128, 1, 8192, 512, 512, 512, 8192]
    - [160, 40.26]
  - - [512, 256, 1, 128, 512, 512, 512, 128]
    - [155, 3.99]
  - - [512, 256, 1, 256, 512, 512, 512, 256]
    - [158, 7.63]
  - - [512, 256, 1, 512, 512, 512, 512, 512]
    - [153, 13.39]
  - - [512, 256, 1, 1024, 512, 512, 512, 1024]
    - [153, 21.28]
  - - [512, 256, 1, 2048, 512, 512, 512, 2048]
    - [153, 28.51]
  - - [512, 256, 1, 4096, 512, 512, 512, 4096]
    - [153, 44.43]
  - - [512, 256, 1, 8192, 512, 512, 512, 8192]
    - [149, 67.15]
  - - [512, 512, 1, 128, 512, 512, 512, 128]
    - [75, 8.19]
  - - [512, 512, 1, 256, 512, 512, 512, 256]
    - [79, 14.87]
  - - [512, 512, 1, 512, 512, 512, 512, 512]
    - [153, 25.5]
  - - [512, 512, 1, 1024, 512, 512, 512, 1024]
    - [154, 40.73]
  - - [512, 512, 1, 2048, 512, 512, 512, 2048]
    - [154, 57.4]
  - - [512, 512, 1, 4096, 512, 512, 512, 4096]
    - [141, 77.55]
  - - [512, 512, 1, 8192, 512, 512, 512, 8192]
    - [134, 105.34]
  - - [512, 1024, 1, 128, 512, 512, 512, 128]
    - [68, 14.62]
  - - [512, 1024, 1, 256, 512, 512, 512, 256]
    - [145, 26.67]
  - - [512, 1024, 1, 512, 512, 512, 512, 512]
    - [141, 45.74]
  - - [512, 1024, 1, 1024, 512, 512, 512, 1024]
    - [143, 71.23]
  - - [512, 1024, 1, 2048, 512, 512, 512, 2048]
    - [140, 98.78]
  - - [512, 1024, 1, 4096, 512, 512, 512, 4096]
    - [134, 126.98]
  - - [512, 1024, 1, 8192, 512, 512, 512, 8192]
    - [126, 165.09]
  - - [512, 2048, 1, 128, 512, 512, 512, 128]
    - [58, 24.77]
  - - [512, 2048, 1, 256, 512, 512, 512, 256]
    - [61, 44.68]
  - - [512, 2048, 1, 512, 512, 512, 512, 512]
    - [134, 75.16]
  - - [512, 2048, 1, 1024, 512, 512, 512, 1024]
    - [134, 115.79]
  - - [512, 2048, 1, 2048, 512, 512, 512, 2048]
    - [134, 158.45]
  - - [512, 2048, 1, 4096, 512, 512, 512, 4096]
    - [162, 193.94]
  - - [512, 2048, 1, 8192, 512, 512, 512, 8192]
    - [117, 240.03]
  - - [512, 4096, 1, 128, 512, 512, 512, 128]
    - [4, 38.43]
  - - [512, 4096, 1, 256, 512, 512, 512, 256]
    - [52, 68.55]
  - - [512, 4096, 1, 512, 512, 512, 512, 512]
    - [45, 114.66]
  - - [512, 4096, 1, 1024, 512, 512, 512, 1024]
    - [45, 173.77]
  - - [512, 4096, 1, 2048, 512, 512, 512, 2048]
    - [125, 230.73]
  - - [512, 4096, 1, 4096, 512, 512, 512, 4096]
    - [110, 241.07]
  - - [512, 4096, 1, 8192, 512, 512, 512, 8192]
    - [88, 290.19]
  - - [512, 8192, 1, 128, 512, 512, 512, 128]
    - [34, 55.46]
  - - [512, 8192, 1, 256, 512, 512, 512, 256]
    - [37, 102.21]
  - - [512, 8192, 1, 512, 512, 512, 512, 512]
    - [37, 151.5]
  - - [512, 8192, 1, 1024, 512, 512, 512, 1024]
    - [112, 218.43]
  - - [512, 8192, 1, 2048, 512, 512, 512, 2048]
    - [112, 267.86]
  - - [512, 8192, 1, 4096, 512, 512, 512, 4096]
    - [111, 322.9]
  - - [512, 8192, 1, 8192, 512, 512, 512, 8192]
    - [92, 342.43]
  - - [1024, 128, 1, 128, 1024, 1024, 1024, 128]
    - [78, 4.05]
  - - [1024, 128, 1, 256, 1024, 1024, 1024, 256]
    - [157, 7.63]
  - - [1024, 128, 1, 512, 1024, 1024, 1024, 512]
    - [153, 13.42]
  - - [1024, 128, 1, 1024, 1024, 1024, 1024, 1024]
    - [153, 20.88]
  - - [1024, 128, 1, 2048, 1024, 1024, 1024, 2048]
    - [154, 28.49]
  - - [1024, 128, 1, 4096, 1024, 1024, 1024, 4096]
    - [161, 43.39]
  - - [1024, 128, 1, 8192, 1024, 1024, 1024, 8192]
    - [150, 62.7]
  - - [1024, 256, 1, 128, 1024, 1024, 1024, 128]
    - [7, 7.88]
  - - [1024, 256, 1, 256, 1024, 1024, 1024, 256]
    - [73, 15.01]
  - - [1024, 256, 1, 512, 1024, 1024, 1024, 512]
    - [153, 25.45]
  - - [1024, 256, 1, 1024, 1024, 1024, 1024, 1024]
    - [153, 39.9]
  - - [1024, 256, 1, 2048, 1024, 1024, 1024, 2048]
    - [154, 56.88]
  - - [1024, 256, 1, 4096, 1024, 1024, 1024, 4096]
    - [144, 74.95]
  - - [1024, 256, 1, 8192, 1024, 1024, 1024, 8192]
    - [134, 103.36]
  - - [1024, 512, 1, 128, 1024, 1024, 1024, 128]
    - [66, 14.82]
  - - [1024, 512, 1, 256, 1024, 1024, 1024, 256]
    - [147, 26.58]
  - - [1024, 512, 1, 512, 1024, 1024, 1024, 512]
    - [141, 46.1]
  - - [1024, 512, 1, 1024, 1024, 1024, 1024, 1024]
    - [140, 71.57]
  - - [1024, 512, 1, 2048, 1024, 1024, 1024, 2048]
    - [142, 97.49]
  - - [1024, 512, 1, 4096, 1024, 1024, 1024, 4096]
    - [50, 119.2]
  - - [1024, 512, 1, 8192, 1024, 1024, 1024, 8192]
    - [130, 164.43]
  - - [1024, 1024, 1, 128, 1024, 1024, 1024, 128]
    - [61, 25.1]
  - - [1024, 1024, 1, 256, 1024, 1024, 1024, 256]
    - [61, 45.34]
  - - [1024, 1024, 1, 512, 1024, 1024, 1024, 512]
    - [133, 75.63]
  - - [1024, 1024, 1, 1024, 1024, 1024, 1024, 1024]
    - [134, 115.64]
  - - [1024, 1024, 1, 2048, 1024, 1024, 1024, 2048]
    - [134, 158.34]
  - - [1024, 1024, 1, 4096, 1024, 1024, 1024, 4096]
    - [127, 170.04]
  - - [1024, 1024, 1, 8192, 1024, 1024, 1024, 8192]
    - [114, 241.69]
  - - [1024, 2048, 1, 128, 1024, 1024, 1024, 128]
    - [3, 38.8]
  - - [1024, 2048, 1, 256, 1024, 1024, 1024, 256]
    - [52, 69.73]
  - - [1024, 2048, 1, 512, 1024, 1024, 1024, 512]
    - [44, 115.25]
  - - [1024, 2048, 1, 1024, 1024, 1024, 1024, 1024]
    - [43, 174.34]
  - - [1024, 2048, 1, 2048, 1024, 1024, 1024, 2048]
    - [125, 217.89]
  - - [1024, 2048, 1, 4096, 1024, 1024, 1024, 4096]
    - [120, 245.45]
  - - [1024, 2048, 1, 8192, 1024, 1024, 1024, 8192]
    - [108, 291.98]
  - - [1024, 4096, 1, 128, 1024, 1024, 1024, 128]
    - [36, 56.59]
  - - [1024, 4096, 1, 256, 1024, 1024, 1024, 256]
    - [36, 103.84]
  - - [1024, 4096, 1, 512, 1024, 1024, 1024, 512]
    - [35, 160.27]
  - - [1024, 4096, 1, 1024, 1024, 1024, 1024, 1024]
    - [113, 219.13]
  - - [1024, 4096, 1, 2048, 1024, 1024, 1024, 2048]
    - [120, 280.5]
  - - [1024, 4096, 1, 4096, 1024, 1024, 1024, 4096]
    - [109, 327.78]
  - - [1024, 4096, 1, 8192, 1024, 1024, 1024, 8192]
    - [86, 341.03]
  - - [1024, 8192, 1, 128, 1024, 1024, 1024, 128]
    - [26, 54.86]
  - - [1024, 8192, 1, 256, 1024, 1024, 1024, 256]
    - [26, 99.41]
  - - [1024, 8192, 1, 512, 1024, 1024, 1024, 512]
    - [94, 168.36]
  - - [1024, 8192, 1, 1024, 1024, 1024, 1024, 1024]
    - [97, 249.2]
  - - [1024, 8192, 1, 2048, 1024, 1024, 1024, 2048]
    - [103, 328.87]
  - - [1024, 8192, 1, 4096, 1024, 1024, 1024, 4096]
    - [100, 392.43]
  - - [1024, 8192, 1, 8192, 1024, 1024, 1024, 8192]
    - [20, 393.68]
  - - [2048, 128, 1, 128, 2048, 2048, 2048, 128]
    - [156, 8.02]
  - - [2048, 128, 1, 256, 2048, 2048, 2048, 256]
    - [157, 14.88]
  - - [2048, 128, 1, 512, 2048, 2048, 2048, 512]
    - [153, 25.59]
  - - [2048, 128, 1, 1024, 2048, 2048, 2048, 1024]
    - [153, 40.11]
  - - [2048, 128, 1, 2048, 2048, 2048, 2048, 2048]
    - [145, 46.01]
  - - [2048, 128, 1, 4096, 2048, 2048, 2048, 4096]
    - [59, 69.32]
  - - [2048, 128, 1, 8192, 2048, 2048, 2048, 8192]
    - [134, 99.86]
  - - [2048, 256, 1, 128, 2048, 2048, 2048, 128]
    - [146, 14.58]
  - - [2048, 256, 1, 256, 2048, 2048, 2048, 256]
    - [145, 26.72]
  - - [2048, 256, 1, 512, 2048, 2048, 2048, 512]
    - [140, 44.19]
  - - [2048, 256, 1, 1024, 2048, 2048, 2048, 1024]
    - [146, 69.19]
  - - [2048, 256, 1, 2048, 2048, 2048, 2048, 2048]
    - [148, 82.24]
  - - [2048, 256, 1, 4096, 2048, 2048, 2048, 4096]
    - [52, 118.26]
  - - [2048, 256, 1, 8192, 2048, 2048, 2048, 8192]
    - [126, 155.54]
  - - [2048, 512, 1, 128, 2048, 2048, 2048, 128]
    - [58, 25.2]
  - - [2048, 512, 1, 256, 2048, 2048, 2048, 256]
    - [60, 46.14]
  - - [2048, 512, 1, 512, 2048, 2048, 2048, 512]
    - [134, 75.96]
  - - [2048, 512, 1, 1024, 2048, 2048, 2048, 1024]
    - [133, 112.33]
  - - [2048, 512, 1, 2048, 2048, 2048, 2048, 2048]
    - [64, 133.55]
  - - [2048, 512, 1, 4096, 2048, 2048, 2048, 4096]
    - [128, 171.57]
  - - [2048, 512, 1, 8192, 2048, 2048, 2048, 8192]
    - [115, 242.25]
  - - [2048, 1024, 1, 128, 2048, 2048, 2048, 128]
    - [50, 38.98]
  - - [2048, 1024, 1, 256, 2048, 2048, 2048, 256]
    - [52, 69.38]
  - - [2048, 1024, 1, 512, 2048, 2048, 2048, 512]
    - [46, 115.01]
  - - [2048, 1024, 1, 1024, 2048, 2048, 2048, 1024]
    - [44, 167.28]
  - - [2048, 1024, 1, 2048, 2048, 2048, 2048, 2048]
    - [55, 209.7]
  - - [2048, 1024, 1, 4096, 2048, 2048, 2048, 4096]
    - [114, 247.22]
  - - [2048, 1024, 1, 8192, 2048, 2048, 2048, 8192]
    - [95, 291.22]
  - - [2048, 2048, 1, 128, 2048, 2048, 2048, 128]
    - [31, 53.46]
  - - [2048, 2048, 1, 256, 2048, 2048, 2048, 256]
    - [32, 98.5]
  - - [2048, 2048, 1, 512, 2048, 2048, 2048, 512]
    - [42, 152.97]
  - - [2048, 2048, 1, 1024, 2048, 2048, 2048, 1024]
    - [124, 217.6]
  - - [2048, 2048, 1, 2048, 2048, 2048, 2048, 2048]
    - [121, 277.83]
  - - [2048, 2048, 1, 4096, 2048, 2048, 2048, 4096]
    - [114, 331.72]
  - - [2048, 2048, 1, 8192, 2048, 2048, 2048, 8192]
    - [86, 364.91]
  - - [2048, 4096, 1, 128, 2048, 2048, 2048, 128]
    - [29, 55.37]
  - - [2048, 4096, 1, 256, 2048, 2048, 2048, 256]
    - [28, 99.9]
  - - [2048, 4096, 1, 512, 2048, 2048, 2048, 512]
    - [105, 166.95]
  - - [2048, 4096, 1, 1024, 2048, 2048, 2048, 1024]
    - [101, 247.56]
  - - [2048, 4096, 1, 2048, 2048, 2048, 2048, 2048]
    - [107, 325.27]
  - - [2048, 4096, 1, 4096, 2048, 2048, 2048, 4096]
    - [106, 387.4]
  - - [2048, 4096, 1, 8192, 2048, 2048, 2048, 8192]
    - [8, 395.26]
  - - [2048, 8192, 1, 128, 2048, 2048, 2048, 128]
    - [0, 62.07]
  - - [2048, 8192, 1, 256, 2048, 2048, 2048, 256]
    - [2, 115.03]
  - - [2048, 8192, 1, 512, 2048, 2048, 2048, 512]
    - [22, 187.84]
  - - [2048, 8192, 1, 1024, 2048, 2048, 2048, 1024]
    - [14, 282.69]
  - - [2048, 8192, 1, 2048, 2048, 2048, 2048, 2048]
    - [22, 387.35]
  - - [2048, 8192, 1, 4096, 2048, 2048, 2048, 4096]
    - [87, 369.48]
  - - [2048, 8192, 1, 8192, 2048, 2048, 2048, 8192]
    - [17, 429.29]
  - - [4096, 128, 1, 128, 4096, 4096, 4096, 128]
    - [145, 14.79]
  - - [4096, 128, 1, 256, 4096, 4096, 4096, 256]
    - [141, 27.13]
  - - [4096, 128, 1, 512, 4096, 4096, 4096, 512]
    - [146, 46.34]
  - - [4096, 128, 1, 1024, 4096, 4096, 4096, 1024]
    - [141, 70.0]
  - - [4096, 128, 1, 2048, 4096, 4096, 4096, 2048]
    - [59, 78.75]
  - - [4096, 128, 1, 4096, 4096, 4096, 4096, 4096]
    - [51, 120.91]
  - - [4096, 128, 1, 8192, 4096, 4096, 4096, 8192]
    - [126, 155.24]
  - - [4096, 256, 1, 128, 4096, 4096, 4096, 128]
    - [57, 25.23]
  - - [4096, 256, 1, 256, 4096, 4096, 4096, 256]
    - [131, 44.1]
  - - [4096, 256, 1, 512, 4096, 4096, 4096, 512]
    - [137, 73.74]
  - - [4096, 256, 1, 1024, 4096, 4096, 4096, 1024]
    - [134, 111.76]
  - - [4096, 256, 1, 2048, 4096, 4096, 4096, 2048]
    - [63, 133.93]
  - - [4096, 256, 1, 4096, 4096, 4096, 4096, 4096]
    - [129, 171.81]
  - - [4096, 256, 1, 8192, 4096, 4096, 4096, 8192]
    - [115, 226.68]
  - - [4096, 512, 1, 128, 4096, 4096, 4096, 128]
    - [51, 39.01]
  - - [4096, 512, 1, 256, 4096, 4096, 4096, 256]
    - [53, 69.59]
  - - [4096, 512, 1, 512, 4096, 4096, 4096, 512]
    - [49, 112.85]
  - - [4096, 512, 1, 1024, 4096, 4096, 4096, 1024]
    - [48, 165.53]
  - - [4096, 512, 1, 2048, 4096, 4096, 4096, 2048]
    - [56, 209.43]
  - - [4096, 512, 1, 4096, 4096, 4096, 4096, 4096]
    - [119, 248.69]
  - - [4096, 512, 1, 8192, 4096, 4096, 4096, 8192]
    - [95, 290.65]
  - - [4096, 1024, 1, 128, 4096, 4096, 4096, 128]
    - [33, 55.41]
  - - [4096, 1024, 1, 256, 4096, 4096, 4096, 256]
    - [33, 93.04]
  - - [4096, 1024, 1, 512, 4096, 4096, 4096, 512]
    - [41, 147.05]
  - - [4096, 1024, 1, 1024, 4096, 4096, 4096, 1024]
    - [124, 216.0]
  - - [4096, 1024, 1, 2048, 4096, 4096, 4096, 2048]
    - [123, 278.44]
  - - [4096, 1024, 1, 4096, 4096, 4096, 4096, 4096]
    - [114, 326.36]
  - - [4096, 1024, 1, 8192, 4096, 4096, 4096, 8192]
    - [85, 364.19]
  - - [4096, 2048, 1, 128, 4096, 4096, 4096, 128]
    - [29, 54.7]
  - - [4096, 2048, 1, 256, 4096, 4096, 4096, 256]
    - [28, 99.76]
  - - [4096, 2048, 1, 512, 4096, 4096, 4096, 512]
    - [104, 166.13]
  - - [4096, 2048, 1, 1024, 4096, 4096, 4096, 1024]
    - [96, 247.69]
  - - [4096, 2048, 1, 2048, 4096, 4096, 4096, 2048]
    - [96, 326.3]
  - - [4096, 2048, 1, 4096, 4096, 4096, 4096, 4096]
    - [99, 383.92]
  - - [4096, 2048, 1, 8192, 4096, 4096, 4096, 8192]
    - [88, 402.09]
  - - [4096, 4096, 1, 128, 4096, 4096, 4096, 128]
    - [1, 60.07]
  - - [4096, 4096, 1, 256, 4096, 4096, 4096, 256]
    - [1, 111.3]
  - - [4096, 4096, 1, 512, 4096, 4096, 4096, 512]
    - [21, 183.25]
  - - [4096, 4096, 1, 1024, 4096, 4096, 4096, 1024]
    - [23, 277.92]
  - - [4096, 4096, 1, 2048, 4096, 4096, 4096, 2048]
    - [18, 378.75]
  - - [4096, 4096, 1, 4096, 4096, 4096, 4096, 4096]
    - [87, 387.79]
  - - [4096, 4096, 1, 8192, 4096, 4096, 4096, 8192]
    - [10, 429.92]
  - - [4096, 8192, 1, 128, 4096, 4096, 4096, 128]
    - [24, 60.45]
  - - [4096, 8192, 1, 256, 4096, 4096, 4096, 256]
    - [30, 102.39]
  - - [4096, 8192, 1, 512, 4096, 4096, 4096, 512]
    - [103, 162.68]
  - - [4096, 8192, 1, 1024, 4096, 4096, 4096, 1024]
    - [11, 242.79]
  - - [4096, 8192, 1, 2048, 4096, 4096, 4096, 2048]
    - [9, 324.91]
  - - [4096, 8192, 1, 4096, 4096, 4096, 4096, 4096]
    - [8, 395.11]
  - - [4096, 8192, 1, 8192, 4096, 4096, 4096, 8192]
    - [14, 453.5]
  - - [8192, 128, 1, 128, 8192, 8192, 8192, 128]
    - [132, 25.14]
  - - [8192, 128, 1, 256, 8192, 8192, 8192, 256]
    - [58, 44.93]
  - - [8192, 128, 1, 512, 8192, 8192, 8192, 512]
    - [135, 73.54]
  - - [8192, 128, 1, 1024, 8192, 8192, 8192, 1024]
    - [134, 112.11]
  - - [8192, 128, 1, 2048, 8192, 8192, 8192, 2048]
    - [64, 133.25]
  - - [8192, 128, 1, 4096, 8192, 8192, 8192, 4096]
    - [128, 170.6]
  - - [8192, 128, 1, 8192, 8192, 8192, 8192, 8192]
    - [108, 225.21]
  - - [8192, 256, 1, 128, 8192, 8192, 8192, 128]
    - [4, 38.64]
  - - [8192, 256, 1, 256, 8192, 8192, 8192, 256]
    - [50, 69.07]
  - - [8192, 256, 1, 512, 8192, 8192, 8192, 512]
    - [45, 115.5]
  - - [8192, 256, 1, 1024, 8192, 8192, 8192, 1024]
    - [43, 169.95]
  - - [8192, 256, 1, 2048, 8192, 8192, 8192, 2048]
    - [54, 203.78]
  - - [8192, 256, 1, 4096, 8192, 8192, 8192, 4096]
    - [114, 245.68]
  - - [8192, 256, 1, 8192, 8192, 8192, 8192, 8192]
    - [98, 282.36]
  - - [8192, 512, 1, 128, 8192, 8192, 8192, 128]
    - [41, 54.66]
  - - [8192, 512, 1, 256, 8192, 8192, 8192, 256]
    - [39, 97.25]
  - - [8192, 512, 1, 512, 8192, 8192, 8192, 512]
    - [39, 156.73]
  - - [8192, 512, 1, 1024, 8192, 8192, 8192, 1024]
    - [38, 217.22]
  - - [8192, 512, 1, 2048, 8192, 8192, 8192, 2048]
    - [116, 276.09]
  - - [8192, 512, 1, 4096, 8192, 8192, 8192, 4096]
    - [118, 329.96]
  - - [8192, 512, 1, 8192, 8192, 8192, 8192, 8192]
    - [88, 367.06]
  - - [8192, 1024, 1, 128, 8192, 8192, 8192, 128]
    - [89, 55.34]
  - - [8192, 1024, 1, 256, 8192, 8192, 8192, 256]
    - [25, 101.49]
  - - [8192, 1024, 1, 512, 8192, 8192, 8192, 512]
    - [104, 167.33]
  - - [8192, 1024, 1, 1024, 8192, 8192, 8192, 1024]
    - [102, 248.87]
  - - [8192, 1024, 1, 2048, 8192, 8192, 8192, 2048]
    - [91, 326.38]
  - - [8192, 1024, 1, 4096, 8192, 8192, 8192, 4096]
    - [90, 388.97]
  - - [8192, 1024, 1, 8192, 8192, 8192, 8192, 8192]
    - [88, 404.48]
  - - [8192, 2048, 1, 128, 8192, 8192, 8192, 128]
    - [15, 60.79]
  - - [8192, 2048, 1, 256, 8192, 8192, 8192, 256]
    - [18, 111.2]
  - - [8192, 2048, 1, 512, 8192, 8192, 8192, 512]
    - [13, 184.11]
  - - [8192, 2048, 1, 1024, 8192, 8192, 8192, 1024]
    - [13, 275.84]
  - - [8192, 2048, 1, 2048, 8192, 8192, 8192, 2048]
    - [22, 377.03]
  - - [8192, 2048, 1, 4096, 8192, 8192, 8192, 4096]
    - [10, 384.21]
  - - [8192, 2048, 1, 8192, 8192, 8192, 8192, 8192]
    - [10, 436.5]
  - - [8192, 4096, 1, 128, 8192, 8192, 8192, 128]
    - [40, 63.28]
  - - [8192, 4096, 1, 256, 8192, 8192, 8192, 256]
    - [122, 106.34]
  - - [8192, 4096, 1, 512, 8192, 8192, 8192, 512]
    - [93, 165.81]
  - - [8192, 4096, 1, 1024, 8192, 8192, 8192, 1024]
    - [16, 240.69]
  - - [8192, 4096, 1, 2048, 8192, 8192, 8192, 2048]
    - [19, 329.86]
  - - [8192, 4096, 1, 4096, 8192, 8192, 8192, 4096]
    - [14, 403.0]
  - - [8192, 4096, 1, 8192, 8192, 8192, 8192, 8192]
    - [8, 457.62]
  - - [8192, 8192, 1, 128, 8192, 8192, 8192, 128]
    - [25, 53.37]
  - - [8192, 8192, 1, 256, 8192, 8192, 8192, 256]
    - [41, 93.11]
  - - [8192, 8192, 1, 512, 8192, 8192, 8192, 512]
    - [27, 152.19]
  - - [8192, 8192, 1, 1024, 8192, 8192, 8192, 1024]
    - [21, 235.65]
  - - [8192, 8192, 1, 2048, 8192, 8192, 8192, 2048]
    - [12, 331.95]
  - - [8192, 8192, 1, 4096, 8192, 8192, 8192, 4096]
    - [10, 430.93]
  - - [8192, 8192, 1, 8192, 8192, 8192, 8192, 8192]
    - [21, 496.4]
  - - [1, 1, 1, 32, 1, 1, 1, 32]
    - [170, 0.0]
- null
- null
- ExperimentalStreamK
- GridBased
