projects/hipblaslt/library/src/amd_detail/rocblaslt/src/Tensile/Logic/asm_full/aquavanjaram/gfx942_152cu/GridBased/aquavanjaram_Cijk_Ailk_Bjlk_HHS_BH_Bias_HAS_SAV_UserArgs.yaml
- {MinimumRequiredVersion: 4.33.0}
- {Architecture: gfx942, CUCount: 152}
- gfx942
- [Device 0049, Device 0050]
    SolutionIndex: 0
    SolutionNameMin: Cijk_Ailk_Bjlk_HHS_BH_Bias_HA_S_SAV_UserArgs_MT16x16x64_MI16x16x1_SN_LDSB0_AA0_AFC1_AF1_AAIGTEn1_AAILTEn1_AFEM1_AFEM1_ASEM1_BL1_BS1_CLR0_CADS0_DSK0_DU64_DTL0_DTVA0_DTVB0_DTVSM0_EPS0_FDSI0_GRPM1_GRVWA2_GRVWB2_GSU4_GSUAMBSK_GSUC0_GSUWGMRR0_GLS0_ISA942_IU1_IA0_KLA_LBSPPA128_LBSPPB128_LBSPPM0_LPA16_LPB16_LPM0_LRVW4_LWPMn1_MIAV0_MIWT1_1_MDA2_MI16_16_16_1_MO40_NR0_NTn1_NTA0_NTB0_NTC0_NTD0_NTE0_NTM0_NTWS0_NEPBS0_NLCA1_NLCB1_ONLL1_PGR2_PLR0_PKA1_SGR1_SIA3_SLW1_SS1_SU0_SUM0_SUS0_SPO0_SRVW0_SSO0_SVW1_SK0_SKA0_SKXCCM0_SNLL0_TT1_1_TLDS0_ULSGRO0_USL1_UIOFGRO0_USFGROn1_VSn1_VWA1_VWB1_WSGRA0_WSGRB0_WS64_WG16_4_4_WGM1_WGMXCC8_WGMXCCGn1_WGR0
    SolutionIndex: 1
    SolutionNameMin: Cijk_Ailk_Bjlk_HHS_BH_Bias_HA_S_SAV_UserArgs_MT16x16x128_MI16x16x1_SN_LDSB0_AA0_AFC1_AF1_AAIGTEn1_AAILTEn1_AFEM1_AFEM1_ASEM1_BL1_BS1_CLR1_CADS0_DSK0_DU128_DTL0_DTVA0_DTVB0_DTVSM0_EPS0_FDSI0_GRPM1_GRVWA8_GRVWB8_GSU10_GSUAMBSK_GSUC0_GSUWGMRR0_GLS0_ISA942_IU1_IA0_KLA_LBSPPA128_LBSPPB128_LBSPPM0_LPA16_LPB16_LPM0_LRVW4_LWPMn1_MIAV0_MIWT1_1_MDA2_MI16_16_16_1_MO40_NR0_NTn1_NTA0_NTB0_NTC0_NTD0_NTE0_NTM0_NTWS0_NEPBS0_NLCA1_NLCB1_ONLL1_PGR2_PLR1_PKA1_SGR1_SIA3_SLW1_SS1_SU0_SUM0_SUS0_SPO0_SRVW0_SSO0_SVW1_SK0_SKA0_SKXCCM0_SNLL0_TT1_1_TLDS0_ULSGRO0_USL1_UIOFGRO0_USFGROn1_VSn1_VWA1_VWB1_WSGRA0_WSGRB0_WS64_WG16_4_4_WGM1_WGMXCC8_WGMXCCGn1_WGR0
    SolutionIndex: 2
    SolutionNameMin: Cijk_Ailk_Bjlk_HHS_BH_Bias_HA_S_SAV_UserArgs_MT16x16x128_MI16x16x1_SN_LDSB0_AA0_AFC1_AF1_AAIGTEn1_AAILTEn1_AFEM1_AFEM1_ASEM1_BL1_BS1_CLR1_CADS0_DSK0_DU128_DTL0_DTVA0_DTVB0_DTVSM0_EPS0_FDSI0_GRPM1_GRVWA8_GRVWB8_GSU16_GSUAMBSK_GSUC0_GSUWGMRR0_GLS0_ISA942_IU1_IA0_KLA_LBSPPA128_LBSPPB128_LBSPPM0_LPA16_LPB16_LPM0_LRVW4_LWPMn1_MIAV0_MIWT1_1_MDA2_MI16_16_16_1_MO40_NR0_NTn1_NTA0_NTB0_NTC0_NTD0_NTE0_NTM0_NTWS0_NEPBS0_NLCA1_NLCB1_ONLL1_PGR2_PLR1_PKA1_SGR1_SIA3_SLW1_SS1_SU0_SUM0_SUS0_SPO0_SRVW0_SSO0_SVW1_SK0_SKA0_SKXCCM0_SNLL0_TT1_1_TLDS0_ULSGRO0_USL1_UIOFGRO0_USFGROn1_VSn1_VWA1_VWB1_WSGRA0_WSGRB0_WS64_WG16_4_4_WGM1_WGMXCC8_WGMXCCGn1_WGR0
    SolutionIndex: 3
    SolutionNameMin: Cijk_Ailk_Bjlk_HHS_BH_UserArgs_MT16x32x128_MI16x16x1_SN_GSU1_GSUC0_GSUWGMRR1_K1_MIWT1_1_SU4_SUM4_SUS512_WGM0_WGMXCC16_WGMXCCG0
    SolutionIndex: 4
    SolutionNameMin: Cijk_Ailk_Bjlk_HHS_BH_Bias_HA_S_SAV_UserArgs_MT16x16x256_MI16x16x1_SN_LDSB1_AA0_AFC1_AF1_AAIGTEn1_AAILTEn1_AFEM1_AFEM1_ASEM1_BL1_BS1_CLR1_CADS0_DSK0_DU256_DTL0_DTVA0_DTVB0_DTVSM0_EPS0_FDSI0_GRPM1_GRVWA8_GRVWB8_GSU12_GSUAMBSK_GSUC0_GSUWGMRR0_GLS0_ISA942_IU1_IA0_KLA_LBSPPA128_LBSPPB128_LBSPPM0_LPA16_LPB16_LPM0_LRVW4_LWPMn1_MIAV0_MIWT1_1_MDA2_MI16_16_16_1_MO40_NR0_NTn1_NTA0_NTB0_NTC0_NTD0_NTE0_NTM0_NTWS0_NEPBS0_NLCA1_NLCB1_ONLL1_PGR2_PLR1_PKA1_SGR1_SIA3_SLW1_SS1_SU0_SUM0_SUS0_SPO0_SRVW0_SSO0_SVW1_SK0_SKA0_SKXCCM0_SNLL0_TT1_1_TLDS0_ULSGRO0_USL1_UIOFGRO0_USFGROn1_VSn1_VWA1_VWB1_WSGRA0_WSGRB0_WS64_WG16_4_4_WGM1_WGMXCC8_WGMXCCGn1_WGR0
    SolutionIndex: 5
    SolutionNameMin: Cijk_Ailk_Bjlk_HHS_BH_Bias_HA_S_SAV_UserArgs_MT16x16x64_MI16x16x1_SN_LDSB0_AA0_AFC1_AF1_AAIGTEn1_AAILTEn1_AFEM1_AFEM1_ASEM1_BL1_BS1_CLR0_CADS0_DSK0_DU64_DTL0_DTVA0_DTVB0_DTVSM0_EPS0_FDSI0_GRPM1_GRVWA4_GRVWB1_GSU4_GSUAMBSK_GSUC0_GSUWGMRR0_GLS0_ISA942_IU1_IA0_KLA_LBSPPA128_LBSPPB128_LBSPPM0_LPA16_LPB16_LPM0_LRVW4_LWPMn1_MIAV0_MIWT1_1_MDA2_MI16_16_16_1_MO40_NR0_NTn1_NTA4_NTB0_NTC0_NTD0_NTE0_NTM0_NTWS0_NEPBS16_NLCA1_NLCB1_ONLL1_PGR2_PLR0_PKA1_SGR1_SIA3_SLW1_SS1_SU16_SUM0_SUS128_SPO0_SRVW0_SSO0_SVW1_SK0_SKA0_SKXCCM0_SNLL0_TT1_1_TLDS0_ULSGRO0_USL1_UIOFGRO0_USFGROn1_VSn1_VWA1_VWB1_WSGRA0_WSGRB0_WS64_WG16_4_4_WGM1_WGMXCC8_WGMXCCGn1_WGR0
    SolutionIndex: 6
    SolutionNameMin: Cijk_Ailk_Bjlk_HHS_BH_MT16x64x64_MI16x16x1_SN_LDSB0_GRVWB8_GSU15_LBSPPB512_LWPM0p40_MIWT1_1_NTB1_SU0_SUM0_SUS0_SPO1_VWB1_WGM1
    SolutionIndex: 7
    SolutionNameMin: Cijk_Ailk_Bjlk_HHS_BH_Bias_HA_S_SAV_UserArgs_MT16x16x256_MI16x16x1_SN_LDSB1_AA0_AFC1_AF1_AAIGTEn1_AAILTEn1_AFEM1_AFEM1_ASEM1_BL1_BS1_CLR1_CADS0_DSK0_DU256_DTL0_DTVA0_DTVB0_DTVSM0_EPS0_FDSI0_GRPM1_GRVWA8_GRVWB8_GSU6_GSUAMBSK_GSUC0_GSUWGMRR0_GLS0_ISA942_IU1_IA0_KLA_LBSPPA128_LBSPPB128_LBSPPM0_LPA16_LPB16_LPM0_LRVW4_LWPMn1_MIAV0_MIWT1_1_MDA2_MI16_16_16_1_MO40_NR0_NTn1_NTA0_NTB0_NTC0_NTD0_NTE0_NTM0_NTWS0_NEPBS0_NLCA1_NLCB1_ONLL1_PGR2_PLR1_PKA1_SGR1_SIA3_SLW1_SS1_SU0_SUM0_SUS0_SPO0_SRVW0_SSO0_SVW1_SK0_SKA0_SKXCCM0_SNLL0_TT1_1_TLDS0_ULSGRO0_USL1_UIOFGRO0_USFGROn1_VSn1_VWA1_VWB1_WSGRA0_WSGRB0_WS64_WG16_4_4_WGM1_WGMXCC8_WGMXCCGn1_WGR0
    SolutionIndex: 8
    SolutionNameMin: Cijk_Ailk_Bjlk_HHS_BH_Bias_HA_S_SAV_UserArgs_MT16x16x128_MI16x16x1_SN_LDSB0_AA0_AFC1_AF1_AAIGTEn1_AAILTEn1_AFEM1_AFEM1_ASEM1_BL1_BS1_CLR1_CADS0_DSK0_DU128_DTL0_DTVA0_DTVB0_DTVSM0_EPS0_FDSI0_GRPM1_GRVWA8_GRVWB8_GSU5_GSUAMBSK_GSUC0_GSUWGMRR0_GLS0_ISA942_IU1_IA0_KLA_LBSPPA128_LBSPPB128_LBSPPM0_LPA16_LPB16_LPM0_LRVW4_LWPMn1_MIAV0_MIWT1_1_MDA2_MI16_16_16_1_MO40_NR0_NTn1_NTA0_NTB0_NTC0_NTD0_NTE0_NTM0_NTWS0_NEPBS0_NLCA1_NLCB1_ONLL1_PGR2_PLR1_PKA1_SGR1_SIA3_SLW1_SS1_SU0_SUM0_SUS0_SPO0_SRVW0_SSO0_SVW1_SK0_SKA0_SKXCCM0_SNLL0_TT1_1_TLDS0_ULSGRO0_USL1_UIOFGRO0_USFGROn1_VSn1_VWA1_VWB1_WSGRA0_WSGRB0_WS64_WG16_4_4_WGM1_WGMXCC8_WGMXCCGn1_WGR0
    SolutionIndex: 9
    SolutionNameMin: Cijk_Ailk_Bjlk_HHS_BH_Bias_HA_S_SAV_UserArgs_MT16x16x128_MI16x16x1_SN_LDSB0_AA0_AFC1_AF1_AAIGTEn1_AAILTEn1_AFEM1_AFEM1_ASEM1_BL1_BS1_CLR1_CADS0_DSK0_DU128_DTL0_DTVA0_DTVB0_DTVSM0_EPS0_FDSI0_GRPM1_GRVWA8_GRVWB8_GSU6_GSUAMBSK_GSUC0_GSUWGMRR0_GLS0_ISA942_IU1_IA0_KLA_LBSPPA128_LBSPPB128_LBSPPM0_LPA16_LPB16_LPM0_LRVW4_LWPMn1_MIAV0_MIWT1_1_MDA2_MI16_16_16_1_MO40_NR0_NTn1_NTA0_NTB0_NTC0_NTD0_NTE0_NTM0_NTWS0_NEPBS0_NLCA1_NLCB1_ONLL1_PGR2_PLR1_PKA1_SGR1_SIA3_SLW1_SS1_SU0_SUM0_SUS0_SPO0_SRVW0_SSO0_SVW1_SK0_SKA0_SKXCCM0_SNLL0_TT1_1_TLDS0_ULSGRO0_USL1_UIOFGRO0_USFGROn1_VSn1_VWA1_VWB1_WSGRA0_WSGRB0_WS64_WG16_4_4_WGM1_WGMXCC8_WGMXCCGn1_WGR0
    SolutionIndex: 10
    SolutionNameMin: Cijk_Ailk_Bjlk_HHS_BH_Bias_HA_S_SAV_UserArgs_MT16x16x64_MI16x16x1_SN_LDSB0_AA0_AFC1_AF1_AAIGTEn1_AAILTEn1_AFEM1_AFEM1_ASEM1_BL1_BS1_CLR0_CADS0_DSK0_DU64_DTL0_DTVA0_DTVB0_DTVSM0_EPS0_FDSI0_GRPM1_GRVWA4_GRVWB4_GSU1_GSUAMB_GSUC0_GSUWGMRR0_GLS0_ISA942_IU1_IA0_KLA_LBSPPA128_LBSPPB128_LBSPPM0_LPA16_LPB16_LPM0_LRVW4_LWPMn1_MIAV0_MIWT1_1_MDA2_MI16_16_16_1_MO40_NR0_NTn1_NTA0_NTB4_NTC0_NTD0_NTE0_NTM0_NTWS0_NEPBS16_NLCA1_NLCB1_ONLL1_PGR2_PLR0_PKA1_SGR1_SIA3_SLW1_SS1_SU16_SUM0_SUS128_SPO0_SRVW0_SSO0_SVW1_SK0_SKA0_SKXCCM0_SNLL0_TT1_1_TLDS0_ULSGRO0_USL1_UIOFGRO0_USFGROn1_VSn1_VWA1_VWB1_WSGRA0_WSGRB0_WS64_WG16_4_4_WGM1_WGMXCC8_WGMXCCGn1_WGR0
    SolutionIndex: 11
    SolutionNameMin: Cijk_Ailk_Bjlk_HHS_BH_Bias_HA_S_SAV_UserArgs_MT16x16x128_MI16x16x1_SN_LDSB0_AA0_AFC1_AF1_AAIGTEn1_AAILTEn1_AFEM1_AFEM1_ASEM1_BL1_BS1_CLR1_CADS0_DSK0_DU128_DTL0_DTVA0_DTVB0_DTVSM0_EPS0_FDSI0_GRPM1_GRVWA8_GRVWB8_GSU4_GSUAMBSK_GSUC0_GSUWGMRR0_GLS0_ISA942_IU1_IA0_KLA_LBSPPA128_LBSPPB128_LBSPPM0_LPA16_LPB16_LPM0_LRVW4_LWPMn1_MIAV0_MIWT1_1_MDA2_MI16_16_16_1_MO40_NR0_NTn1_NTA0_NTB0_NTC0_NTD0_NTE0_NTM0_NTWS0_NEPBS0_NLCA1_NLCB1_ONLL1_PGR2_PLR1_PKA1_SGR1_SIA3_SLW1_SS1_SU0_SUM0_SUS0_SPO0_SRVW0_SSO0_SVW1_SK0_SKA0_SKXCCM0_SNLL0_TT1_1_TLDS0_ULSGRO0_USL1_UIOFGRO0_USFGROn1_VSn1_VWA1_VWB1_WSGRA0_WSGRB0_WS64_WG16_4_4_WGM1_WGMXCC8_WGMXCCGn1_WGR0
    SolutionIndex: 12
    SolutionNameMin: Cijk_Ailk_Bjlk_HHS_BH_Bias_HA_S_SAV_UserArgs_MT16x16x256_MI16x16x1_SN_LDSB1_AA0_AFC1_AF1_AAIGTEn1_AAILTEn1_AFEM1_AFEM1_ASEM1_BL1_BS1_CLR1_CADS0_DSK0_DU256_DTL0_DTVA0_DTVB0_DTVSM0_EPS0_FDSI0_GRPM1_GRVWA8_GRVWB8_GSU3_GSUAMBSK_GSUC0_GSUWGMRR0_GLS0_ISA942_IU1_IA0_KLA_LBSPPA128_LBSPPB128_LBSPPM0_LPA16_LPB16_LPM0_LRVW4_LWPMn1_MIAV0_MIWT1_1_MDA2_MI16_16_16_1_MO40_NR0_NTn1_NTA0_NTB0_NTC0_NTD0_NTE0_NTM0_NTWS0_NEPBS0_NLCA1_NLCB1_ONLL1_PGR2_PLR1_PKA1_SGR1_SIA3_SLW1_SS1_SU0_SUM0_SUS0_SPO0_SRVW0_SSO0_SVW1_SK0_SKA0_SKXCCM0_SNLL0_TT1_1_TLDS0_ULSGRO0_USL1_UIOFGRO0_USFGROn1_VSn1_VWA1_VWB1_WSGRA0_WSGRB0_WS64_WG16_4_4_WGM1_WGMXCC8_WGMXCCGn1_WGR0
    SolutionIndex: 13
    SolutionNameMin: Cijk_Ailk_Bjlk_HHS_BH_Bias_HA_S_SAV_UserArgs_MT16x64x64_MI16x16x1_SN_LDSB0_AA0_AFC1_AF1_AAIGTEn1_AAILTEn1_AFEM1_AFEM1_ASEM1_BL1_BS1_CLR1_CADS0_DSK0_DU64_DTL0_DTVA0_DTVB0_DTVSM0_EPS0_FDSI0_GRPM1_GRVWA4_GRVWB8_GSU12_GSUAMBSK_GSUC0_GSUWGMRR0_GLS0_ISA942_IU1_IA0_KLA_LBSPPA128_LBSPPB512_LBSPPM0_LPA16_LPB16_LPM0_LRVW4_LWPMn1_MIAV0_MIWT1_1_MDA2_MI16_16_16_1_MO40_NR0_NTn1_NTA0_NTB4_NTC0_NTD0_NTE0_NTM0_NTWS0_NEPBS0_NLCA1_NLCB1_ONLL1_PGR2_PLR1_PKA1_SGR1_SIA3_SLW1_SS1_SU0_SUM0_SUS0_SPO0_SRVW0_SSO0_SVW1_SK0_SKA0_SKXCCM0_SNLL0_TT1_1_TLDS0_ULSGRO0_USL1_UIOFGRO0_USFGROn1_VSn1_VWA1_VWB1_WSGRA0_WSGRB0_WS64_WG16_16_1_WGM1_WGMXCC8_WGMXCCGn1_WGR0
    SolutionIndex: 14
    SolutionNameMin: Cijk_Ailk_Bjlk_HHS_BH_Bias_HA_S_SAV_UserArgs_MT16x16x256_MI16x16x1_SN_LDSB1_AA0_AFC1_AF1_AAIGTEn1_AAILTEn1_AFEM1_AFEM1_ASEM1_BL1_BS1_CLR1_CADS0_DSK0_DU256_DTL0_DTVA0_DTVB0_DTVSM0_EPS0_FDSI0_GRPM1_GRVWA8_GRVWB8_GSU2_GSUAMBSK_GSUC0_GSUWGMRR0_GLS0_ISA942_IU1_IA0_KLA_LBSPPA128_LBSPPB128_LBSPPM0_LPA16_LPB16_LPM0_LRVW4_LWPMn1_MIAV0_MIWT1_1_MDA2_MI16_16_16_1_MO40_NR0_NTn1_NTA0_NTB0_NTC0_NTD0_NTE0_NTM0_NTWS0_NEPBS0_NLCA1_NLCB1_ONLL1_PGR2_PLR1_PKA1_SGR1_SIA3_SLW1_SS1_SU0_SUM0_SUS0_SPO0_SRVW0_SSO0_SVW1_SK0_SKA0_SKXCCM0_SNLL0_TT1_1_TLDS0_ULSGRO0_USL1_UIOFGRO0_USFGROn1_VSn1_VWA1_VWB1_WSGRA0_WSGRB0_WS64_WG16_4_4_WGM1_WGMXCC8_WGMXCCGn1_WGR0
    SolutionIndex: 15
    SolutionNameMin: Cijk_Ailk_Bjlk_HHS_BH_Bias_HA_S_SAV_UserArgs_MT32x64x64_MI16x16x1_SN_LDSB0_AA0_AFC1_AF1_AAIGTEn1_AAILTEn1_AFEM1_AFEM1_ASEM1_BL1_BS1_CLR1_CADS0_DSK0_DU64_DTL0_DTVA0_DTVB0_DTVSM0_EPS0_FDSI0_GRPM1_GRVWA8_GRVWB8_GSU8_GSUAMB_GSUC0_GSUWGMRR0_GLS0_ISA942_IU1_IA0_KLA_LBSPPA256_LBSPPB512_LBSPPM0_LPA16_LPB32_LPM0_LRVW4_LWPMn1_MIAV0_MIWT1_2_MDA2_MI16_16_16_1_MO40_NR0_NTn1_NTA0_NTB0_NTC0_NTD0_NTE0_NTM0_NTWS0_NEPBS16_NLCA1_NLCB1_ONLL1_PGR2_PLR1_PKA1_SGR1_SIA3_SLW1_SS1_SU0_SUM0_SUS0_SPO0_SRVW0_SSO0_SVW1_SK0_SKA0_SKXCCM0_SNLL0_TT1_1_TLDS0_ULSGRO0_USL1_UIOFGRO0_USFGROn1_VSn1_VWA1_VWB2_WSGRA0_WSGRB0_WS64_WG32_8_1_WGM1_WGMXCC8_WGMXCCGn1_WGR0
    SolutionIndex: 16
    SolutionNameMin: Cijk_Ailk_Bjlk_HHS_BH_Bias_HA_S_SAV_UserArgs_MT32x64x128_MI16x16x1_SN_LDSB1_AA0_AFC1_AF1_AAIGTEn1_AAILTEn1_AFEM1_AFEM1_ASEM1_BL1_BS1_CLR1_CADS0_DSK0_DU128_DTL0_DTVA0_DTVB0_DTVSM0_EPS0_FDSI0_GRPM1_GRVWA8_GRVWB8_GSU4_GSUAMB_GSUC0_GSUWGMRR0_GLS0_ISA942_IU1_IA0_KLA_LBSPPA256_LBSPPB512_LBSPPM0_LPA16_LPB32_LPM0_LRVW4_LWPMn1_MIAV0_MIWT1_2_MDA2_MI16_16_16_1_MO40_NR0_NTn1_NTA0_NTB0_NTC0_NTD0_NTE0_NTM0_NTWS0_NEPBS16_NLCA1_NLCB1_ONLL1_PGR2_PLR1_PKA1_SGR1_SIA3_SLW1_SS1_SU0_SUM0_SUS0_SPO0_SRVW0_SSO0_SVW1_SK0_SKA0_SKXCCM0_SNLL0_TT1_1_TLDS0_ULSGRO0_USL1_UIOFGRO0_USFGROn1_VSn1_VWA1_VWB2_WSGRA0_WSGRB0_WS64_WG32_8_1_WGM1_WGMXCC8_WGMXCCGn1_WGR0
    SolutionIndex: 17
    SolutionNameMin: Cijk_Ailk_Bjlk_HHS_BH_Bias_HA_S_SAV_UserArgs_MT16x128x128_MI16x16x1_SN_LDSB1_AA0_AFC1_AF1_AAIGTEn1_AAILTEn1_AFEM1_AFEM1_ASEM1_BL1_BS1_CLR1_CADS0_DSK0_DU128_DTL0_DTVA0_DTVB0_DTVSM0_EPS0_FDSI0_GRPM1_GRVWA1_GRVWB8_GSU8_GSUAMB_GSUC0_GSUWGMRR0_GLS0_ISA942_IU1_IA0_KLA_LBSPPA128_LBSPPB1024_LBSPPM0_LPA16_LPB32_LPM0_LRVW4_LWPMn1_MIAV0_MIWT1_2_MDA2_MI16_16_16_1_MO40_NR0_NTn1_NTA0_NTB4_NTC0_NTD0_NTE0_NTM0_NTWS0_NEPBS16_NLCA1_NLCB1_ONLL1_PGR2_PLR1_PKA1_SGR1_SIA3_SLW1_SS1_SU16_SUM0_SUS256_SPO0_SRVW0_SSO0_SVW1_SK0_SKA0_SKXCCM0_SNLL0_TT1_1_TLDS0_ULSGRO0_USL1_UIOFGRO0_USFGROn1_VSn1_VWA1_VWB2_WSGRA0_WSGRB0_WS64_WG16_16_1_WGM1_WGMXCC8_WGMXCCGn1_WGR0
    SolutionIndex: 18
    SolutionNameMin: Cijk_Ailk_Bjlk_HHS_BH_Bias_HA_S_SAV_UserArgs_MT16x256x32_MI16x16x1_SN_LDSB1_AA0_AFC1_AF1_AAIGTEn1_AAILTEn1_AFEM1_AFEM1_ASEM1_BL1_BS1_CLR1_CADS0_DSK0_DU32_DTL0_DTVA0_DTVB0_DTVSM0_EPS0_FDSI0_GRPM1_GRVWA2_GRVWB8_GSU6_GSUAMB_GSUC0_GSUWGMRR0_GLS0_ISA942_IU1_IA0_KLA_LBSPPA128_LBSPPB2048_LBSPPM0_LPA16_LPB0_LPM0_LRVW4_LWPMn1_MIAV0_MIWT1_4_MDA2_MI16_16_16_1_MO40_NR0_NTn1_NTA0_NTB4_NTC0_NTD0_NTE0_NTM0_NTWS0_NEPBS16_NLCA1_NLCB1_ONLL1_PGR2_PLR1_PKA1_SGR1_SIA3_SLW1_SS1_SU0_SUM0_SUS0_SPO0_SRVW0_SSO0_SVW1_SK0_SKA0_SKXCCM0_SNLL0_TT1_1_TLDS0_ULSGRO0_USL1_UIOFGRO0_USFGROn1_VSn1_VWA1_VWB4_WSGRA0_WSGRB0_WS64_WG16_16_1_WGM1_WGMXCC8_WGMXCCGn1_WGR0
    SolutionIndex: 19
    SolutionNameMin: Cijk_Ailk_Bjlk_HHS_BH_MT16x256x32_MI16x16x1_SN_LDSB1_GRVWB8_GSU8_LBSPPB2048_LWPM0p40_MIWT1_4_NTB0_SU0_SUM0_SUS0_SPO0_VWB4_WGM1
    SolutionIndex: 20
    SolutionNameMin: Cijk_Ailk_Bjlk_HHS_BH_Bias_HA_S_SAV_UserArgs_MT16x64x256_MI16x16x1_SN_LDSB1_AA0_AFC1_AF1_AAIGTEn1_AAILTEn1_AFEM1_AFEM1_ASEM1_BL1_BS1_CLR1_CADS0_DSK0_DU256_DTL0_DTVA0_DTVB0_DTVSM0_EPS0_FDSI0_GRPM1_GRVWA4_GRVWB8_GSU1_GSUAMB_GSUC0_GSUWGMRR0_GLS0_ISA942_IU1_IA0_KLA_LBSPPA128_LBSPPB512_LBSPPM0_LPA16_LPB0_LPM0_LRVW4_LWPMn1_MIAV0_MIWT1_4_MDA2_MI16_16_16_1_MO40_NR0_NTn1_NTA0_NTB4_NTC0_NTD0_NTE0_NTM0_NTWS0_NEPBS16_NLCA1_NLCB1_ONLL1_PGR2_PLR1_PKA1_SGR1_SIA3_SLW1_SS1_SU16_SUM0_SUS512_SPO0_SRVW0_SSO0_SVW1_SK0_SKA0_SKXCCM0_SNLL0_TT1_1_TLDS0_ULSGRO0_USL1_UIOFGRO0_USFGROn1_VSn1_VWA1_VWB4_WSGRA0_WSGRB0_WS64_WG16_4_4_WGM1_WGMXCC8_WGMXCCGn1_WGR0
    SolutionIndex: 21
    SolutionNameMin: Cijk_Ailk_Bjlk_HHS_BH_Bias_HA_S_SAV_UserArgs_MT16x128x128_MI16x16x1_SN_LDSB1_AA0_AFC1_AF1_AAIGTEn1_AAILTEn1_AFEM1_AFEM1_ASEM1_BL1_BS1_CLR1_CADS0_DSK0_DU128_DTL0_DTVA0_DTVB0_DTVSM0_EPS0_FDSI0_GRPM1_GRVWA8_GRVWB8_GSU2_GSUAMBSK_GSUC0_GSUWGMRR0_GLS0_ISA942_IU1_IA0_KLA_LBSPPA128_LBSPPB1024_LBSPPM0_LPA16_LPB32_LPM0_LRVW4_LWPMn1_MIAV0_MIWT1_2_MDA2_MI16_16_16_1_MO40_NR0_NTn1_NTA0_NTB4_NTC0_NTD0_NTE0_NTM0_NTWS0_NEPBS0_NLCA1_NLCB1_ONLL1_PGR2_PLR1_PKA1_SGR1_SIA3_SLW1_SS1_SU0_SUM0_SUS0_SPO0_SRVW0_SSO0_SVW1_SK0_SKA0_SKXCCM0_SNLL0_TT1_1_TLDS0_ULSGRO0_USL1_UIOFGRO0_USFGROn1_VSn1_VWA1_VWB2_WSGRA0_WSGRB0_WS64_WG16_16_1_WGM1_WGMXCC8_WGMXCCGn1_WGR0
    SolutionIndex: 22
    SolutionNameMin: Cijk_Ailk_Bjlk_HHS_BH_Bias_HA_S_SAV_UserArgs_MT16x256x64_MI16x16x1_SN_LDSB1_AA0_AFC1_AF1_AAIGTEn1_AAILTEn1_AFEM1_AFEM1_ASEM1_BL1_BS1_CLR1_CADS0_DSK0_DU64_DTL0_DTVA0_DTVB0_DTVSM0_EPS0_FDSI0_GRPM1_GRVWA4_GRVWB8_GSU4_GSUAMB_GSUC0_GSUWGMRR0_GLS0_ISA942_IU1_IA0_KLA_LBSPPA128_LBSPPB2048_LBSPPM0_LPA16_LPB0_LPM0_LRVW4_LWPMn1_MIAV0_MIWT1_4_MDA2_MI16_16_16_1_MO40_NR0_NTn1_NTA0_NTB4_NTC0_NTD0_NTE0_NTM0_NTWS0_NEPBS16_NLCA1_NLCB1_ONLL1_PGR2_PLR1_PKA1_SGR1_SIA3_SLW1_SS1_SU0_SUM0_SUS0_SPO0_SRVW0_SSO0_SVW1_SK0_SKA0_SKXCCM0_SNLL0_TT1_1_TLDS0_ULSGRO0_USL1_UIOFGRO0_USFGROn1_VSn1_VWA1_VWB4_WSGRA0_WSGRB0_WS64_WG16_16_1_WGM1_WGMXCC8_WGMXCCGn1_WGR0
    SolutionIndex: 23
    SolutionNameMin: Cijk_Ailk_Bjlk_HHS_BH_Bias_HA_S_SAV_UserArgs_MT16x128x64_MI16x16x1_SN_LDSB1_AA0_AFC1_AF1_AAIGTEn1_AAILTEn1_AFEM1_AFEM1_ASEM1_BL1_BS1_CLR1_CADS0_DSK0_DU64_DTL0_DTVA0_DTVB0_DTVSM0_EPS0_FDSI0_GRPM1_GRVWA4_GRVWB8_GSU1_GSUAMB_GSUC0_GSUWGMRR0_GLS0_ISA942_IU1_IA0_KLA_LBSPPA128_LBSPPB1024_LBSPPM0_LPA16_LPB32_LPM0_LRVW4_LWPMn1_MIAV0_MIWT1_2_MDA2_MI16_16_16_1_MO40_NR0_NTn1_NTA0_NTB4_NTC0_NTD4_NTE0_NTM0_NTWS0_NEPBS16_NLCA1_NLCB1_ONLL1_PGR2_PLR1_PKA1_SGR1_SIA3_SLW1_SS1_SU8_SUM0_SUS128_SPO0_SRVW0_SSO0_SVW1_SK0_SKA0_SKXCCM0_SNLL0_TT1_1_TLDS0_ULSGRO0_USL1_UIOFGRO0_USFGROn1_VSn1_VWA1_VWB2_WSGRA0_WSGRB0_WS64_WG16_16_1_WGM1_WGMXCC8_WGMXCCGn1_WGR0
    SolutionIndex: 24
    SolutionNameMin: Cijk_Ailk_Bjlk_HHS_BH_Bias_HA_S_SAV_UserArgs_MT16x128x128_MI16x16x1_SN_LDSB1_AA0_AFC1_AF1_AAIGTEn1_AAILTEn1_AFEM1_AFEM1_ASEM1_BL1_BS1_CLR1_CADS0_DSK0_DU128_DTL0_DTVA0_DTVB0_DTVSM0_EPS0_FDSI0_GRPM1_GRVWA8_GRVWB8_GSU1_GSUAMB_GSUC0_GSUWGMRR0_GLS0_ISA942_IU1_IA0_KLA_LBSPPA128_LBSPPB1024_LBSPPM0_LPA16_LPB32_LPM0_LRVW4_LWPMn1_MIAV0_MIWT1_2_MDA2_MI16_16_16_1_MO40_NR0_NTn1_NTA0_NTB4_NTC0_NTD4_NTE0_NTM0_NTWS0_NEPBS16_NLCA1_NLCB1_ONLL1_PGR2_PLR1_PKA1_SGR1_SIA3_SLW1_SS1_SU8_SUM0_SUS256_SPO0_SRVW0_SSO0_SVW1_SK0_SKA0_SKXCCM0_SNLL0_TT1_1_TLDS0_ULSGRO0_USL1_UIOFGRO0_USFGROn1_VSn1_VWA1_VWB2_WSGRA0_WSGRB0_WS64_WG16_16_1_WGM1_WGMXCC8_WGMXCCGn1_WGR0
    SolutionIndex: 25
    SolutionNameMin: Cijk_Ailk_Bjlk_HHS_BH_Bias_HA_S_SAV_UserArgs_MT16x256x32_MI16x16x1_SN_LDSB1_AA0_AFC1_AF1_AAIGTEn1_AAILTEn1_AFEM1_AFEM1_ASEM1_BL1_BS1_CLR1_CADS0_DSK0_DU32_DTL0_DTVA0_DTVB0_DTVSM0_EPS0_FDSI0_GRPM1_GRVWA2_GRVWB8_GSU3_GSUAMB_GSUC0_GSUWGMRR0_GLS0_ISA942_IU1_IA0_KLA_LBSPPA128_LBSPPB2048_LBSPPM0_LPA16_LPB0_LPM0_LRVW4_LWPMn1_MIAV0_MIWT1_4_MDA2_MI16_16_16_1_MO40_NR0_NTn1_NTA0_NTB4_NTC0_NTD0_NTE0_NTM0_NTWS0_NEPBS16_NLCA1_NLCB1_ONLL1_PGR2_PLR1_PKA1_SGR1_SIA3_SLW1_SS1_SU0_SUM0_SUS0_SPO0_SRVW0_SSO0_SVW1_SK0_SKA0_SKXCCM0_SNLL0_TT1_1_TLDS0_ULSGRO0_USL1_UIOFGRO0_USFGROn1_VSn1_VWA1_VWB4_WSGRA0_WSGRB0_WS64_WG16_16_1_WGM1_WGMXCC8_WGMXCCGn1_WGR0
    SolutionIndex: 26
    SolutionNameMin: Cijk_Ailk_Bjlk_HHS_BH_Bias_HA_S_SAV_UserArgs_MT16x128x32_MI16x16x1_SN_LDSB0_AA0_AFC1_AF1_AAIGTEn1_AAILTEn1_AFEM1_AFEM1_ASEM1_BL1_BS1_CLR1_CADS0_DSK0_DU32_DTL0_DTVA0_DTVB0_DTVSM0_EPS0_FDSI0_GRPM1_GRVWA2_GRVWB8_GSU1_GSUAMB_GSUC0_GSUWGMRR0_GLS0_ISA942_IU1_IA0_KLA_LBSPPA128_LBSPPB1024_LBSPPM0_LPA16_LPB32_LPM0_LRVW4_LWPMn1_MIAV0_MIWT1_2_MDA2_MI16_16_16_1_MO40_NR0_NTn1_NTA0_NTB4_NTC0_NTD4_NTE0_NTM0_NTWS0_NEPBS16_NLCA1_NLCB1_ONLL1_PGR2_PLR1_PKA1_SGR1_SIA3_SLW1_SS1_SU8_SUM0_SUS64_SPO0_SRVW0_SSO0_SVW1_SK0_SKA0_SKXCCM0_SNLL0_TT1_1_TLDS0_ULSGRO0_USL1_UIOFGRO0_USFGROn1_VSn1_VWA1_VWB2_WSGRA0_WSGRB0_WS64_WG16_16_1_WGM1_WGMXCC8_WGMXCCGn1_WGR0
    SolutionIndex: 27
    SolutionNameMin: Cijk_Ailk_Bjlk_HHS_BH_Bias_HA_S_SAV_UserArgs_MT16x256x64_MI16x16x1_SN_LDSB1_AA0_AFC1_AF1_AAIGTEn1_AAILTEn1_AFEM1_AFEM1_ASEM1_BL1_BS1_CLR1_CADS0_DSK0_DU64_DTL0_DTVA0_DTVB0_DTVSM0_EPS0_FDSI0_GRPM1_GRVWA1_GRVWB8_GSU1_GSUAMB_GSUC0_GSUWGMRR0_GLS0_ISA942_IU1_IA0_KLA_LBSPPA128_LBSPPB2048_LBSPPM0_LPA16_LPB0_LPM0_LRVW4_LWPMn1_MIAV0_MIWT1_4_MDA2_MI16_16_16_1_MO40_NR0_NTn1_NTA0_NTB4_NTC0_NTD4_NTE0_NTM0_NTWS0_NEPBS16_NLCA1_NLCB1_ONLL1_PGR2_PLR1_PKA1_SGR1_SIA3_SLW1_SS1_SU16_SUM0_SUS128_SPO0_SRVW0_SSO0_SVW1_SK0_SKA0_SKXCCM0_SNLL0_TT1_1_TLDS0_ULSGRO0_USL1_UIOFGRO0_USFGROn1_VSn1_VWA1_VWB4_WSGRA0_WSGRB0_WS64_WG16_16_1_WGM6_WGMXCC8_WGMXCCG304_WGR0
    SolutionIndex: 28
    SolutionNameMin: Cijk_Ailk_Bjlk_HHS_BH_Bias_HA_S_SAV_UserArgs_MT16x192x32_MI16x16x1_SN_LDSB0_AA0_AFC1_AF1_AAIGTEn1_AAILTEn1_AFEM1_AFEM1_ASEM1_BL1_BS1_CLR1_CADS0_DSK0_DU32_DTL0_DTVA0_DTVB0_DTVSM0_EPS0_FDSI0_GRPM1_GRVWA2_GRVWB8_GSU1_GSUAMB_GSUC0_GSUWGMRR0_GLS0_ISA942_IU1_IA0_KLA_LBSPPA128_LBSPPB1536_LBSPPM0_LPA16_LPB16_LPM0_LRVW4_LWPMn1_MIAV0_MIWT1_3_MDA2_MI16_16_16_1_MO40_NR0_NTn1_NTA0_NTB4_NTC0_NTD4_NTE0_NTM0_NTWS0_NEPBS16_NLCA1_NLCB3_ONLL1_PGR2_PLR1_PKA1_SGR1_SIA3_SLW1_SS1_SU8_SUM0_SUS64_SPO0_SRVW0_SSO0_SVW1_SK0_SKA0_SKXCCM0_SNLL0_TT1_1_TLDS0_ULSGRO0_USL1_UIOFGRO0_USFGROn1_VSn1_VWA1_VWB1_WSGRA0_WSGRB0_WS64_WG16_16_1_WGM1_WGMXCC8_WGMXCCGn1_WGR0
    SolutionIndex: 29
    SolutionNameMin: Cijk_Ailk_Bjlk_HHS_BH_Bias_HA_S_SAV_UserArgs_MT16x192x32_MI16x16x1_SN_LDSB0_AA0_AFC1_AF1_AAIGTEn1_AAILTEn1_AFEM1_AFEM1_ASEM1_BL1_BS1_CLR1_CADS0_DSK0_DU32_DTL0_DTVA0_DTVB0_DTVSM0_EPS0_FDSI0_GRPM1_GRVWA1_GRVWB8_GSU1_GSUAMB_GSUC0_GSUWGMRR0_GLS0_ISA942_IU1_IA0_KLA_LBSPPA128_LBSPPB1536_LBSPPM0_LPA16_LPB16_LPM0_LRVW4_LWPMn1_MIAV0_MIWT1_3_MDA2_MI16_16_16_1_MO40_NR0_NTn1_NTA0_NTB4_NTC0_NTD4_NTE0_NTM0_NTWS0_NEPBS16_NLCA1_NLCB3_ONLL1_PGR2_PLR1_PKA1_SGR1_SIA3_SLW1_SS1_SU16_SUM0_SUS64_SPO0_SRVW0_SSO0_SVW1_SK0_SKA0_SKXCCM0_SNLL0_TT1_1_TLDS0_ULSGRO0_USL1_UIOFGRO0_USFGROn1_VSn1_VWA1_VWB1_WSGRA0_WSGRB0_WS64_WG16_16_1_WGM6_WGMXCC8_WGMXCCG304_WGR0
    SolutionIndex: 30
    SolutionNameMin: Cijk_Ailk_Bjlk_HHS_BH_Bias_HA_S_SAV_UserArgs_MT16x256x32_MI16x16x1_SN_LDSB1_AA0_AFC1_AF1_AAIGTEn1_AAILTEn1_AFEM1_AFEM1_ASEM1_BL1_BS1_CLR1_CADS0_DSK0_DU32_DTL0_DTVA0_DTVB0_DTVSM0_EPS0_FDSI0_GRPM1_GRVWA1_GRVWB8_GSU1_GSUAMB_GSUC0_GSUWGMRR0_GLS0_ISA942_IU1_IA0_KLA_LBSPPA128_LBSPPB2048_LBSPPM0_LPA16_LPB0_LPM0_LRVW4_LWPMn1_MIAV0_MIWT1_4_MDA2_MI16_16_16_1_MO40_NR0_NTn1_NTA0_NTB4_NTC0_NTD4_NTE0_NTM0_NTWS0_NEPBS16_NLCA1_NLCB1_ONLL1_PGR2_PLR1_PKA1_SGR1_SIA3_SLW1_SS1_SU16_SUM0_SUS64_SPO0_SRVW0_SSO0_SVW1_SK0_SKA0_SKXCCM0_SNLL0_TT1_1_TLDS0_ULSGRO0_USL1_UIOFGRO0_USFGROn1_VSn1_VWA1_VWB4_WSGRA0_WSGRB0_WS64_WG16_16_1_WGM6_WGMXCC8_WGMXCCG304_WGR0
    SolutionIndex: 31
    SolutionNameMin: Cijk_Ailk_Bjlk_HHS_BH_Bias_HA_S_SAV_UserArgs_MT16x256x32_MI16x16x1_SN_LDSB1_AA0_AFC1_AF1_AAIGTEn1_AAILTEn1_AFEM1_AFEM1_ASEM1_BL1_BS1_CLR1_CADS0_DSK0_DU32_DTL0_DTVA0_DTVB0_DTVSM0_EPS0_FDSI0_GRPM1_GRVWA2_GRVWB8_GSU1_GSUAMB_GSUC0_GSUWGMRR0_GLS0_ISA942_IU1_IA0_KLA_LBSPPA128_LBSPPB2048_LBSPPM0_LPA16_LPB0_LPM0_LRVW4_LWPMn1_MIAV0_MIWT1_4_MDA2_MI16_16_16_1_MO40_NR0_NTn1_NTA0_NTB4_NTC0_NTD4_NTE0_NTM0_NTWS0_NEPBS16_NLCA1_NLCB1_ONLL1_PGR2_PLR1_PKA1_SGR1_SIA3_SLW1_SS1_SU16_SUM0_SUS64_SPO0_SRVW0_SSO0_SVW1_SK0_SKA0_SKXCCM0_SNLL0_TT1_1_TLDS0_ULSGRO0_USL1_UIOFGRO0_USFGROn1_VSn1_VWA1_VWB4_WSGRA0_WSGRB0_WS64_WG16_16_1_WGM6_WGMXCC8_WGMXCCGn1_WGR0
    SolutionIndex: 32
    SolutionNameMin: Cijk_Ailk_Bjlk_HHS_BH_Bias_HA_S_SAV_UserArgs_MT16x128x32_MI16x16x1_SN_LDSB0_AA0_AFC1_AF1_AAIGTEn1_AAILTEn1_AFEM1_AFEM1_ASEM1_BL1_BS1_CLR1_CADS0_DSK0_DU32_DTL0_DTVA0_DTVB0_DTVSM0_EPS0_FDSI0_GRPM1_GRVWA1_GRVWB8_GSU1_GSUAMB_GSUC0_GSUWGMRR0_GLS0_ISA942_IU1_IA0_KLA_LBSPPA128_LBSPPB1024_LBSPPM0_LPA16_LPB32_LPM0_LRVW4_LWPMn1_MIAV0_MIWT1_2_MDA2_MI16_16_16_1_MO40_NR0_NTn1_NTA0_NTB4_NTC0_NTD4_NTE0_NTM0_NTWS0_NEPBS16_NLCA1_NLCB1_ONLL1_PGR2_PLR1_PKA1_SGR1_SIA3_SLW1_SS1_SU16_SUM0_SUS64_SPO0_SRVW0_SSO0_SVW1_SK0_SKA0_SKXCCM0_SNLL0_TT1_1_TLDS0_ULSGRO0_USL1_UIOFGRO0_USFGROn1_VSn1_VWA1_VWB2_WSGRA0_WSGRB0_WS64_WG16_16_1_WGM6_WGMXCC8_WGMXCCG304_WGR0
    SolutionIndex: 33
    SolutionNameMin: Cijk_Ailk_Bjlk_HHS_BH_Bias_HA_S_SAV_UserArgs_MT16x256x64_MI16x16x1_SN_LDSB1_AA0_AFC1_AF1_AAIGTEn1_AAILTEn1_AFEM1_AFEM1_ASEM1_BL1_BS1_CLR1_CADS0_DSK0_DU64_DTL0_DTVA0_DTVB0_DTVSM0_EPS0_FDSI0_GRPM1_GRVWA4_GRVWB8_GSU1_GSUAMB_GSUC0_GSUWGMRR0_GLS0_ISA942_IU1_IA0_KLA_LBSPPA128_LBSPPB2048_LBSPPM0_LPA16_LPB0_LPM0_LRVW4_LWPMn1_MIAV0_MIWT1_4_MDA2_MI16_16_16_1_MO40_NR0_NTn1_NTA0_NTB4_NTC0_NTD4_NTE0_NTM0_NTWS0_NEPBS16_NLCA1_NLCB1_ONLL1_PGR2_PLR1_PKA1_SGR1_SIA3_SLW1_SS1_SU16_SUM0_SUS128_SPO0_SRVW0_SSO0_SVW1_SK0_SKA0_SKXCCM0_SNLL0_TT1_1_TLDS0_ULSGRO0_USL1_UIOFGRO0_USFGROn1_VSn1_VWA1_VWB4_WSGRA0_WSGRB0_WS64_WG16_16_1_WGM6_WGMXCC8_WGMXCCG304_WGR0
    SolutionIndex: 34
    SolutionNameMin: Cijk_Ailk_Bjlk_HHS_BH_Bias_HA_S_SAV_UserArgs_MT16x256x32_MI16x16x1_SN_LDSB1_AA0_AFC1_AF1_AAIGTEn1_AAILTEn1_AFEM1_AFEM1_ASEM1_BL1_BS1_CLR1_CADS0_DSK0_DU32_DTL0_DTVA0_DTVB0_DTVSM0_EPS0_FDSI0_GRPM1_GRVWA2_GRVWB8_GSU1_GSUAMB_GSUC0_GSUWGMRR0_GLS0_ISA942_IU1_IA0_KLA_LBSPPA128_LBSPPB2048_LBSPPM0_LPA16_LPB0_LPM0_LRVW4_LWPMn1_MIAV0_MIWT1_4_MDA2_MI16_16_16_1_MO40_NR0_NTn1_NTA0_NTB4_NTC0_NTD4_NTE0_NTM0_NTWS0_NEPBS16_NLCA1_NLCB1_ONLL1_PGR2_PLR1_PKA1_SGR1_SIA3_SLW1_SS1_SU16_SUM0_SUS64_SPO0_SRVW0_SSO0_SVW1_SK0_SKA0_SKXCCM0_SNLL0_TT1_1_TLDS0_ULSGRO0_USL1_UIOFGRO0_USFGROn1_VSn1_VWA1_VWB4_WSGRA0_WSGRB0_WS64_WG16_16_1_WGM8_WGMXCC8_WGMXCCGn1_WGR0
    SolutionIndex: 35
    SolutionNameMin: Cijk_Ailk_Bjlk_HHS_BH_Bias_HA_S_SAV_UserArgs_MT16x16x64_MI16x16x1_SN_LDSB0_AA0_AFC1_AF1_AAIGTEn1_AAILTEn1_AFEM1_AFEM1_ASEM1_BL1_BS1_CLR0_CADS0_DSK0_DU64_DTL0_DTVA0_DTVB0_DTVSM0_EPS0_FDSI0_GRPM1_GRVWA2_GRVWB2_GSU4_GSUAMBSK_GSUC0_GSUWGMRR0_GLS0_ISA942_IU1_IA0_KLA_LBSPPA128_LBSPPB128_LBSPPM0_LPA16_LPB16_LPM0_LRVW4_LWPMn1_MIAV0_MIWT1_1_MDA2_MI16_16_16_1_MO40_NR0_NTn1_NTA0_NTB4_NTC0_NTD0_NTE0_NTM0_NTWS0_NEPBS0_NLCA1_NLCB1_ONLL1_PGR2_PLR0_PKA1_SGR1_SIA3_SLW1_SS1_SU0_SUM0_SUS0_SPO0_SRVW0_SSO0_SVW1_SK0_SKA0_SKXCCM0_SNLL0_TT1_1_TLDS0_ULSGRO0_USL1_UIOFGRO0_USFGROn1_VSn1_VWA1_VWB1_WSGRA0_WSGRB0_WS64_WG16_4_4_WGM1_WGMXCC8_WGMXCCGn1_WGR0
    SolutionIndex: 36
    SolutionNameMin: Cijk_Ailk_Bjlk_HHS_BH_Bias_HA_S_SAV_UserArgs_MT32x16x32_MI16x16x1_SN_LDSB0_AA0_AFC1_AF1_AAIGTEn1_AAILTEn1_AFEM1_AFEM1_ASEM1_BL1_BS1_CLR1_CADS0_DSK0_DU32_DTL0_DTVA0_DTVB0_DTVSM0_EPS0_FDSI0_GRPM1_GRVWA8_GRVWB4_GSU1_GSUAMB_GSUC0_GSUWGMRR0_GLS0_ISA942_IU1_IA0_KLA_LBSPPA256_LBSPPB128_LBSPPM0_LPA16_LPB16_LPM0_LRVW4_LWPM0p25_MIAV0_MIWT1_1_MDA2_MI16_16_16_1_MO40_NR0_NTn1_NTA0_NTB0_NTC0_NTD4_NTE0_NTM0_NTWS0_NEPBS0_NLCA1_NLCB1_ONLL1_PGR2_PLR1_PKA1_SGR1_SIA3_SLW1_SS1_SU4_SUM4_SUS64_SPO0_SRVW0_SSO0_SVW1_SK0_SKA0_SKXCCM0_SNLL0_TT1_1_TLDS0_ULSGRO0_USL1_UIOFGRO0_USFGROn1_VSn1_VWA1_VWB1_WSGRA0_WSGRB0_WS64_WG32_4_1_WGM1_WGMXCC8_WGMXCCGn1_WGR0
    SolutionIndex: 37
    SolutionNameMin: Cijk_Ailk_Bjlk_HHS_BH_Bias_HA_S_SAV_UserArgs_MT32x32x64_MI16x16x1_SN_LDSB0_AA0_AFC1_AF1_AAIGTEn1_AAILTEn1_AFEM1_AFEM1_ASEM1_BL1_BS1_CLR1_CADS0_DSK0_DU64_DTL0_DTVA0_DTVB0_DTVSM0_EPS0_FDSI0_GRPM1_GRVWA8_GRVWB8_GSU16_GSUAMB_GSUC0_GSUWGMRR0_GLS0_ISA942_IU1_IA0_KLA_LBSPPA256_LBSPPB256_LBSPPM0_LPA16_LPB16_LPM0_LRVW4_LWPMn1_MIAV0_MIWT1_1_MDA2_MI16_16_16_1_MO40_NR0_NTn1_NTA0_NTB0_NTC0_NTD0_NTE0_NTM0_NTWS0_NEPBS16_NLCA1_NLCB1_ONLL1_PGR2_PLR1_PKA1_SGR1_SIA3_SLW1_SS1_SU2_SUM0_SUS128_SPO0_SRVW0_SSO0_SVW1_SK0_SKA0_SKXCCM0_SNLL0_TT1_1_TLDS0_ULSGRO0_USL1_UIOFGRO0_USFGROn1_VSn1_VWA1_VWB1_WSGRA0_WSGRB0_WS64_WG32_8_1_WGM285_WGMXCC8_WGMXCCG8_WGR0
    SolutionIndex: 38
    SolutionNameMin: Cijk_Ailk_Bjlk_HHS_BH_Bias_HA_S_SAV_UserArgs_MT16x16x128_MI16x16x1_SN_LDSB0_AA0_AFC1_AF1_AAIGTEn1_AAILTEn1_AFEM1_AFEM1_ASEM1_BL1_BS1_CLR1_CADS0_DSK0_DU128_DTL0_DTVA0_DTVB0_DTVSM0_EPS0_FDSI0_GRPM1_GRVWA1_GRVWB8_GSU1_GSUAMB_GSUC0_GSUWGMRR0_GLS0_ISA942_IU1_IA0_KLA_LDSTI0_LBSPPA128_LBSPPB128_LBSPPM0_LPA16_LPB16_LPM0_LRVW4_LWPMn1_MIAV0_MIWT1_1_MDA2_MI16_16_16_1_MO40_MPO0_NR0_NTn1_NTA0_NTB0_NTC0_NTD4_NTE0_NTM0_NTWS0_NEPBS16_NLCA1_NLCB1_ONLL1_PGR2_PLR1_PKA1_SGR1_SIA3_SLW1_SS1_SU8_SUM1_SUS256_SPO0_SRVW0_SSO0_SVW1_SK0_SKA0_SKXCCM0_SNLL0_TT1_1_TLDS0_ULSGRO0_USL1_UIOFGRO0_USFGROn1_VSn1_VWA1_VWB1_WSGRA0_WSGRB0_WSK0_WS64_WG16_4_4_WGM1_WGMXCC8_WGMXCCGn1_WGR0
    SolutionIndex: 39
    SolutionNameMin: Cijk_Ailk_Bjlk_HHS_BH_Bias_HA_S_SAV_UserArgs_MT16x16x128_MI16x16x1_SN_LDSB0_AA0_AFC1_AF1_AAIGTEn1_AAILTEn1_AFEM1_AFEM1_ASEM1_BL1_BS1_CLR1_CADS0_DSK0_DU128_DTL0_DTVA0_DTVB0_DTVSM0_EPS0_FDSI0_GRPM1_GRVWA4_GRVWB8_GSU1_GSUAMB_GSUC0_GSUWGMRR0_GLS0_ISA942_IU1_IA0_KLA_LDSTI0_LBSPPA128_LBSPPB128_LBSPPM0_LPA16_LPB16_LPM0_LRVW4_LWPMn1_MIAV0_MIWT1_1_MDA2_MI16_16_16_1_MO40_MPO0_NR0_NTn1_NTA0_NTB0_NTC0_NTD4_NTE0_NTM0_NTWS0_NEPBS16_NLCA1_NLCB1_ONLL1_PGR2_PLR1_PKA1_SGR1_SIA3_SLW1_SS1_SU8_SUM1_SUS256_SPO0_SRVW0_SSO0_SVW1_SK0_SKA0_SKXCCM0_SNLL0_TT1_1_TLDS0_ULSGRO0_USL1_UIOFGRO0_USFGROn1_VSn1_VWA1_VWB1_WSGRA0_WSGRB0_WSK0_WS64_WG16_4_4_WGM1_WGMXCC8_WGMXCCGn1_WGR0
    SolutionIndex: 40
    SolutionNameMin: Cijk_Ailk_Bjlk_HHS_BH_Bias_HA_S_SAV_UserArgs_MT16x16x128_MI16x16x1_SN_LDSB0_AA0_AFC1_AF1_AAIGTEn1_AAILTEn1_AFEM1_AFEM1_ASEM1_BL1_BS1_CLR1_CADS0_DSK0_DU128_DTL0_DTVA0_DTVB0_DTVSM0_EPS0_FDSI0_GRPM1_GRVWA8_GRVWB8_GSU3_GSUAMBSK_GSUC0_GSUWGMRR0_GLS0_ISA942_IU1_IA0_KLA_LBSPPA128_LBSPPB128_LBSPPM0_LPA16_LPB16_LPM0_LRVW4_LWPMn1_MIAV0_MIWT1_1_MDA2_MI16_16_16_1_MO40_NR0_NTn1_NTA0_NTB0_NTC0_NTD0_NTE0_NTM0_NTWS0_NEPBS0_NLCA1_NLCB1_ONLL1_PGR2_PLR1_PKA1_SGR1_SIA3_SLW1_SS1_SU0_SUM0_SUS0_SPO0_SRVW0_SSO0_SVW1_SK0_SKA0_SKXCCM0_SNLL0_TT1_1_TLDS0_ULSGRO0_USL1_UIOFGRO0_USFGROn1_VSn1_VWA1_VWB1_WSGRA0_WSGRB0_WS64_WG16_4_4_WGM1_WGMXCC8_WGMXCCGn1_WGR0
    SolutionIndex: 41
    SolutionNameMin: Cijk_Ailk_Bjlk_HHS_BH_UserArgs_MT32x32x128_MI16x16x1_SN_GSU8_GSUC0_GSUWGMRR0_K1_LBSPPA256_LBSPPB256_LPA16_LPB16_MIWT1_1_SU32_SUM0_SUS512_WG32_8_1_WGM0_WGMXCC16_WGMXCCG0
    SolutionIndex: 42
    SolutionNameMin: Cijk_Ailk_Bjlk_HHS_BH_Bias_HA_S_SAV_UserArgs_MT16x16x256_MI16x16x1_SN_LDSB1_AA0_AFC1_AF1_AAIGTEn1_AAILTEn1_AFEM1_AFEM1_ASEM1_BL1_BS1_CLR1_CADS0_DSK0_DU256_DTL0_DTVA0_DTVB0_DTVSM0_EPS0_FDSI0_GRPM1_GRVWA8_GRVWB8_GSU5_GSUAMBSK_GSUC0_GSUWGMRR0_GLS0_ISA942_IU1_IA0_KLA_LBSPPA128_LBSPPB128_LBSPPM0_LPA16_LPB16_LPM0_LRVW4_LWPMn1_MIAV0_MIWT1_1_MDA2_MI16_16_16_1_MO40_NR0_NTn1_NTA0_NTB0_NTC0_NTD0_NTE0_NTM0_NTWS0_NEPBS0_NLCA1_NLCB1_ONLL1_PGR2_PLR1_PKA1_SGR1_SIA3_SLW1_SS1_SU0_SUM0_SUS0_SPO0_SRVW0_SSO0_SVW1_SK0_SKA0_SKXCCM0_SNLL0_TT1_1_TLDS0_ULSGRO0_USL1_UIOFGRO0_USFGROn1_VSn1_VWA1_VWB1_WSGRA0_WSGRB0_WS64_WG16_4_4_WGM1_WGMXCC8_WGMXCCGn1_WGR0
    SolutionIndex: 43
    SolutionNameMin: Cijk_Ailk_Bjlk_HHS_BH_Bias_HA_S_SAV_UserArgs_MT32x32x64_MI16x16x1_SN_LDSB0_AA0_AFC1_AF1_AAIGTEn1_AAILTEn1_AFEM1_AFEM1_ASEM1_BL1_BS1_CLR1_CADS0_DSK0_DU64_DTL0_DTVA0_DTVB0_DTVSM0_EPS0_FDSI0_GRPM1_GRVWA8_GRVWB8_GSU8_GSUAMBSK_GSUC0_GSUWGMRR0_GLS0_ISA942_IU1_IA0_KLA_LBSPPA256_LBSPPB256_LBSPPM0_LPA16_LPB16_LPM0_LRVW4_LWPMn1_MIAV0_MIWT1_1_MDA2_MI16_16_16_1_MO40_NR0_NTn1_NTA0_NTB0_NTC0_NTD0_NTE0_NTM0_NTWS0_NEPBS12_NLCA1_NLCB1_ONLL1_PGR2_PLR1_PKA1_SGR1_SIA3_SLW1_SS1_SU16_SUM0_SUS128_SPO0_SRVW0_SSO0_SVW1_SK0_SKA0_SKXCCM0_SNLL0_TT1_1_TLDS0_ULSGRO0_USL1_UIOFGRO0_USFGROn1_VSn1_VWA1_VWB1_WSGRA0_WSGRB0_WS64_WG32_8_1_WGM0_WGMXCC4_WGMXCCGn1_WGR0
    SolutionIndex: 44
    SolutionNameMin: Cijk_Ailk_Bjlk_HHS_BH_Bias_HA_S_SAV_UserArgs_MT16x16x256_MI16x16x1_SN_LDSB1_AA0_AFC1_AF1_AAIGTEn1_AAILTEn1_AFEM1_AFEM1_ASEM1_BL1_BS1_CLR1_CADS0_DSK0_DU256_DTL0_DTVA0_DTVB0_DTVSM0_EPS0_FDSI0_GRPM1_GRVWA8_GRVWB8_GSU1_GSUAMB_GSUC0_GSUWGMRR0_GLS0_ISA942_IU1_IA0_KLA_LBSPPA128_LBSPPB128_LBSPPM0_LPA16_LPB16_LPM0_LRVW4_LWPMn1_MIAV0_MIWT1_1_MDA2_MI16_16_16_1_MO40_NR0_NTn1_NTA0_NTB0_NTC0_NTD4_NTE0_NTM0_NTWS0_NEPBS16_NLCA1_NLCB1_ONLL1_PGR2_PLR1_PKA1_SGR1_SIA3_SLW1_SS1_SU8_SUM0_SUS512_SPO0_SRVW0_SSO0_SVW1_SK0_SKA0_SKXCCM0_SNLL0_TT1_1_TLDS0_ULSGRO0_USL1_UIOFGRO0_USFGROn1_VSn1_VWA1_VWB1_WSGRA0_WSGRB0_WS64_WG16_4_4_WGM1_WGMXCC8_WGMXCCGn1_WGR0
    SolutionIndex: 45
    SolutionNameMin: Cijk_Ailk_Bjlk_HHS_BH_Bias_HA_S_SAV_UserArgs_MT32x32x128_MI16x16x1_SN_LDSB1_AA0_AFC1_AF1_AAIGTEn1_AAILTEn1_AFEM1_AFEM1_ASEM1_BL1_BS1_CLR1_CADS0_DSK0_DU128_DTL0_DTVA0_DTVB0_DTVSM0_EPS0_FDSI0_GRPM1_GRVWA8_GRVWB8_GSU8_GSUAMB_GSUC0_GSUWGMRR0_GLS0_ISA942_IU1_IA0_KLA_LBSPPA256_LBSPPB256_LBSPPM0_LPA16_LPB16_LPM0_LRVW4_LWPMn1_MIAV0_MIWT1_1_MDA2_MI16_16_16_1_MO40_NR0_NTn1_NTA0_NTB0_NTC0_NTD0_NTE0_NTM0_NTWS0_NEPBS16_NLCA1_NLCB1_ONLL1_PGR2_PLR1_PKA1_SGR1_SIA3_SLW1_SS1_SU0_SUM0_SUS0_SPO0_SRVW0_SSO0_SVW1_SK0_SKA0_SKXCCM0_SNLL0_TT1_1_TLDS0_ULSGRO0_USL1_UIOFGRO0_USFGROn1_VSn1_VWA1_VWB1_WSGRA0_WSGRB0_WS64_WG32_8_1_WGM1_WGMXCC8_WGMXCCGn1_WGR0
    SolutionIndex: 46
    SolutionNameMin: Cijk_Ailk_Bjlk_HHS_BH_Bias_HA_S_SAV_UserArgs_MT32x32x128_MI16x16x1_SN_LDSB1_AA0_AFC1_AF1_AAIGTEn1_AAILTEn1_AFEM1_AFEM1_ASEM1_BL1_BS1_CLR1_CADS0_DSK0_DU128_DTL0_DTVA0_DTVB0_DTVSM0_EPS0_FDSI0_GRPM1_GRVWA8_GRVWB8_GSU6_GSUAMBSK_GSUC0_GSUWGMRR0_GLS0_ISA942_IU1_IA0_KLA_LBSPPA256_LBSPPB256_LBSPPM0_LPA16_LPB16_LPM0_LRVW4_LWPMn1_MIAV0_MIWT1_1_MDA2_MI16_16_16_1_MO40_NR0_NTn1_NTA0_NTB0_NTC0_NTD0_NTE0_NTM0_NTWS0_NEPBS0_NLCA1_NLCB1_ONLL1_PGR2_PLR1_PKA1_SGR1_SIA3_SLW1_SS1_SU0_SUM0_SUS0_SPO0_SRVW0_SSO0_SVW1_SK0_SKA0_SKXCCM0_SNLL0_TT1_1_TLDS0_ULSGRO0_USL1_UIOFGRO0_USFGROn1_VSn1_VWA1_VWB1_WSGRA0_WSGRB0_WS64_WG32_8_1_WGM1_WGMXCC8_WGMXCCGn1_WGR0
    SolutionIndex: 47
    SolutionNameMin: Cijk_Ailk_Bjlk_HHS_BH_Bias_HA_S_SAV_UserArgs_MT32x64x64_MI16x16x1_SN_LDSB1_AA0_AFC1_AF1_AAIGTEn1_AAILTEn1_AFEM1_AFEM1_ASEM1_BL1_BS1_CLR1_CADS0_DSK0_DU64_DTL0_DTVA0_DTVB0_DTVSM0_EPS0_FDSI0_GRPM0p90_GRVWA8_GRVWB8_GSU6_GSUAMBSK_GSUC0_GSUWGMRR0_GLS0_ISA942_IU1_IA0_KLA_LBSPPA256_LBSPPB512_LBSPPM0_LPA16_LPB32_LPM0_LRVW4_LWPMn1_MIAV0_MIWT1_2_MDA2_MI16_16_16_1_MO40_NR0_NTn1_NTA0_NTB7_NTC0_NTD6_NTE0_NTM0_NTWS0_NEPBS0_NLCA1_NLCB1_ONLL2_PGR2_PLR1_PKA1_SGR1_SIA3_SLW1_SS0_SU0_SUM0_SUS0_SPO0_SRVW0_SSO0_SVW4_SK0_SKA0_SKXCCM0_SNLL0_TT1_1_TLDS0_ULSGRO0_USL1_UIOFGRO0_USFGROn1_VSn1_VWA1_VWB2_WSGRA0_WSGRB0_WS64_WG32_8_1_WGM0_WGMXCC8_WGMXCCGn1_WGR0
    SolutionIndex: 48
    SolutionNameMin: Cijk_Ailk_Bjlk_HHS_BH_Bias_HA_S_SAV_UserArgs_MT32x64x128_MI16x16x1_SN_LDSB1_AA0_AFC1_AF1_AAIGTEn1_AAILTEn1_AFEM1_AFEM1_ASEM1_BL1_BS1_CLR1_CADS0_DSK0_DU128_DTL0_DTVA0_DTVB0_DTVSM0_EPS0_FDSI0_GRPM1_GRVWA8_GRVWB8_GSU4_GSUAMBSK_GSUC0_GSUWGMRR0_GLS0_ISA942_IU1_IA0_KLA_LBSPPA256_LBSPPB512_LBSPPM0_LPA32_LPB16_LPM0_LRVW4_LWPMn1_MIAV0_MIWT2_1_MDA2_MI16_16_16_1_MO40_NR0_NTn1_NTA0_NTB0_NTC0_NTD0_NTE0_NTM0_NTWS0_NEPBS0_NLCA1_NLCB1_ONLL1_PGR2_PLR1_PKA1_SGR1_SIA3_SLW1_SS1_SU0_SUM0_SUS0_SPO0_SRVW0_SSO0_SVW2_SK0_SKA0_SKXCCM0_SNLL0_TT1_1_TLDS0_ULSGRO0_USL1_UIOFGRO0_USFGROn1_VSn1_VWA2_VWB1_WSGRA0_WSGRB0_WS64_WG16_16_1_WGM1_WGMXCC8_WGMXCCGn1_WGR0
    SolutionIndex: 49
    SolutionNameMin: Cijk_Ailk_Bjlk_HHS_BH_Bias_HA_S_SAV_UserArgs_MT32x128x64_MI16x16x1_SN_LDSB1_AA0_AFC1_AF1_AAIGTEn1_AAILTEn1_AFEM1_AFEM1_ASEM1_BL1_BS1_CLR1_CADS0_DSK0_DU64_DTL0_DTVA0_DTVB0_DTVSM0_EPS0_FDSI0_GRPM1_GRVWA8_GRVWB8_GSU6_GSUAMB_GSUC0_GSUWGMRR0_GLS0_ISA942_IU1_IA0_KLA_LBSPPA256_LBSPPB1024_LBSPPM0_LPA32_LPB32_LPM0_LRVW4_LWPMn1_MIAV0_MIWT2_2_MDA2_MI16_16_16_1_MO40_NR0_NTn1_NTA0_NTB0_NTC0_NTD0_NTE0_NTM0_NTWS0_NEPBS16_NLCA1_NLCB1_ONLL1_PGR2_PLR1_PKA1_SGR1_SIA3_SLW1_SS1_SU0_SUM0_SUS0_SPO0_SRVW0_SSO0_SVW2_SK0_SKA0_SKXCCM0_SNLL0_TT1_1_TLDS0_ULSGRO0_USL1_UIOFGRO0_USFGROn1_VSn1_VWA2_VWB2_WSGRA0_WSGRB0_WS64_WG16_16_1_WGM1_WGMXCC8_WGMXCCGn1_WGR0
    SolutionIndex: 50
    SolutionNameMin: Cijk_Ailk_Bjlk_HHS_BH_Bias_HA_S_SAV_UserArgs_MT16x64x128_MI16x16x1_SN_LDSB1_AA0_AFC1_AF1_AAIGTEn1_AAILTEn1_AFEM1_AFEM1_ASEM1_BL1_BS1_CLR1_CADS0_DSK0_DU128_DTL0_DTVA0_DTVB0_DTVSM0_EPS0_FDSI0_GRPM1_GRVWA8_GRVWB8_GSU1_GSUAMB_GSUC0_GSUWGMRR0_GLS0_ISA942_IU1_IA0_KLA_LBSPPA128_LBSPPB512_LBSPPM0_LPA16_LPB16_LPM0_LRVW4_LWPMn1_MIAV0_MIWT1_1_MDA2_MI16_16_16_1_MO40_NR0_NTn1_NTA0_NTB4_NTC0_NTD4_NTE0_NTM0_NTWS0_NEPBS16_NLCA1_NLCB1_ONLL1_PGR2_PLR1_PKA1_SGR1_SIA3_SLW1_SS1_SU8_SUM0_SUS256_SPO0_SRVW0_SSO0_SVW1_SK0_SKA0_SKXCCM0_SNLL0_TT1_1_TLDS0_ULSGRO0_USL1_UIOFGRO0_USFGROn1_VSn1_VWA1_VWB1_WSGRA0_WSGRB0_WS64_WG16_16_1_WGM1_WGMXCC8_WGMXCCGn1_WGR0
    SolutionIndex: 51
    SolutionNameMin: Cijk_Ailk_Bjlk_HHS_BH_Bias_HA_S_SAV_UserArgs_MT32x128x64_MI16x16x1_SN_LDSB1_AA0_AFC1_AF1_AAIGTEn1_AAILTEn1_AFEM1_AFEM1_ASEM1_BL1_BS1_CLR1_CADS0_DSK0_DU64_DTL0_DTVA0_DTVB0_DTVSM0_EPS0_FDSI0_GRPM1_GRVWA8_GRVWB8_GSU3_GSUAMB_GSUC0_GSUWGMRR0_GLS0_ISA942_IU1_IA0_KLA_LBSPPA256_LBSPPB1024_LBSPPM0_LPA32_LPB32_LPM0_LRVW4_LWPMn1_MIAV0_MIWT2_2_MDA2_MI16_16_16_1_MO40_NR0_NTn1_NTA0_NTB0_NTC0_NTD0_NTE0_NTM0_NTWS0_NEPBS16_NLCA1_NLCB1_ONLL1_PGR2_PLR1_PKA1_SGR1_SIA3_SLW1_SS1_SU0_SUM0_SUS0_SPO0_SRVW0_SSO0_SVW2_SK0_SKA0_SKXCCM0_SNLL0_TT1_1_TLDS0_ULSGRO0_USL1_UIOFGRO0_USFGROn1_VSn1_VWA2_VWB2_WSGRA0_WSGRB0_WS64_WG16_16_1_WGM1_WGMXCC8_WGMXCCGn1_WGR0
    SolutionIndex: 52
    SolutionNameMin: Cijk_Ailk_Bjlk_HHS_BH_Bias_HA_S_SAV_UserArgs_MT32x64x64_MI16x16x1_SN_LDSB0_AA0_AFC1_AF1_AAIGTEn1_AAILTEn1_AFEM1_AFEM1_ASEM1_BL1_BS1_CLR1_CADS0_DSK0_DU64_DTL0_DTVA0_DTVB0_DTVSM0_EPS0_FDSI0_GRPM1_GRVWA8_GRVWB8_GSU1_GSUAMB_GSUC0_GSUWGMRR0_GLS0_ISA942_IU1_IA0_KLA_LBSPPA256_LBSPPB512_LBSPPM0_LPA32_LPB16_LPM0_LRVW4_LWPMn1_MIAV0_MIWT2_1_MDA2_MI16_16_16_1_MO40_NR0_NTn1_NTA0_NTB4_NTC0_NTD4_NTE0_NTM0_NTWS0_NEPBS16_NLCA1_NLCB1_ONLL1_PGR2_PLR1_PKA1_SGR1_SIA3_SLW1_SS1_SU8_SUM0_SUS128_SPO0_SRVW0_SSO0_SVW2_SK0_SKA0_SKXCCM0_SNLL0_TT1_1_TLDS0_ULSGRO0_USL1_UIOFGRO0_USFGROn1_VSn1_VWA2_VWB1_WSGRA0_WSGRB0_WS64_WG16_16_1_WGM1_WGMXCC8_WGMXCCGn1_WGR0
    SolutionIndex: 53
    SolutionNameMin: Cijk_Ailk_Bjlk_HHS_BH_Bias_HA_S_SAV_UserArgs_MT32x64x256_MI16x16x1_SN_LDSB1_AA0_AFC1_AF1_AAIGTEn1_AAILTEn1_AFEM1_AFEM1_ASEM1_BL1_BS1_CLR1_CADS0_DSK0_DU256_DTL0_DTVA0_DTVB0_DTVSM0_EPS0_FDSI0_GRPM1_GRVWA8_GRVWB8_GSU1_GSUAMB_GSUC0_GSUWGMRR0_GLS0_ISA942_IU1_IA0_KLA_LBSPPA256_LBSPPB512_LBSPPM0_LPA32_LPB16_LPM0_LRVW4_LWPMn1_MIAV0_MIWT2_1_MDA2_MI16_16_16_1_MO40_NR0_NTn1_NTA0_NTB4_NTC0_NTD4_NTE0_NTM0_NTWS0_NEPBS16_NLCA1_NLCB1_ONLL1_PGR2_PLR1_PKA1_SGR1_SIA3_SLW1_SS1_SU8_SUM0_SUS512_SPO0_SRVW0_SSO0_SVW2_SK0_SKA0_SKXCCM0_SNLL0_TT1_1_TLDS0_ULSGRO0_USL1_UIOFGRO0_USFGROn1_VSn1_VWA2_VWB1_WSGRA0_WSGRB0_WS64_WG16_16_1_WGM1_WGMXCC8_WGMXCCGn1_WGR0
    SolutionIndex: 54
    SolutionNameMin: Cijk_Ailk_Bjlk_HHS_BH_Bias_HA_S_SAV_UserArgs_MT32x128x128_MI16x16x1_SN_LDSB1_AA0_AFC1_AF1_AAIGTEn1_AAILTEn1_AFEM1_AFEM1_ASEM1_BL1_BS1_CLR1_CADS0_DSK0_DU128_DTL0_DTVA0_DTVB0_DTVSM0_EPS0_FDSI0_GRPM1_GRVWA8_GRVWB8_GSU2_GSUAMBSK_GSUC0_GSUWGMRR0_GLS0_ISA942_IU1_IA0_KLA_LBSPPA256_LBSPPB1024_LBSPPM0_LPA32_LPB32_LPM0_LRVW4_LWPMn1_MIAV0_MIWT2_2_MDA2_MI16_16_16_1_MO40_NR0_NTn1_NTA0_NTB4_NTC0_NTD0_NTE0_NTM0_NTWS0_NEPBS0_NLCA1_NLCB1_ONLL1_PGR2_PLR1_PKA1_SGR1_SIA3_SLW1_SS1_SU0_SUM0_SUS0_SPO0_SRVW0_SSO0_SVW2_SK0_SKA0_SKXCCM0_SNLL0_TT1_1_TLDS0_ULSGRO0_USL1_UIOFGRO0_USFGROn1_VSn1_VWA2_VWB2_WSGRA0_WSGRB0_WS64_WG16_16_1_WGM1_WGMXCC8_WGMXCCGn1_WGR0
    SolutionIndex: 55
    SolutionNameMin: Cijk_Ailk_Bjlk_HHS_BH_Bias_HA_S_SAV_UserArgs_MT32x128x128_MI16x16x1_SN_LDSB1_AA0_AFC1_AF1_AAIGTEn1_AAILTEn1_AFEM1_AFEM1_ASEM1_BL1_BS1_CLR1_CADS0_DSK0_DU128_DTL0_DTVA0_DTVB0_DTVSM0_EPS0_FDSI0_GRPM1_GRVWA8_GRVWB8_GSU2_GSUAMB_GSUC0_GSUWGMRR0_GLS0_ISA942_IU1_IA0_KLA_LBSPPA256_LBSPPB1024_LBSPPM0_LPA32_LPB32_LPM0_LRVW4_LWPMn1_MIAV0_MIWT2_2_MDA2_MI16_16_16_1_MO40_NR0_NTn1_NTA0_NTB4_NTC0_NTD0_NTE0_NTM0_NTWS0_NEPBS16_NLCA1_NLCB1_ONLL1_PGR2_PLR1_PKA1_SGR1_SIA3_SLW1_SS1_SU0_SUM0_SUS0_SPO0_SRVW0_SSO0_SVW2_SK0_SKA0_SKXCCM0_SNLL0_TT1_1_TLDS0_ULSGRO0_USL1_UIOFGRO0_USFGROn1_VSn1_VWA2_VWB2_WSGRA0_WSGRB0_WS64_WG16_16_1_WGM1_WGMXCC8_WGMXCCGn1_WGR0
    SolutionIndex: 56
    SolutionNameMin: Cijk_Ailk_Bjlk_HHS_BH_Bias_HA_S_SAV_UserArgs_MT32x128x64_MI16x16x1_SN_LDSB1_AA0_AFC1_AF1_AAIGTEn1_AAILTEn1_AFEM1_AFEM1_ASEM1_BL1_BS1_CLR1_CADS0_DSK0_DU64_DTL0_DTVA0_DTVB0_DTVSM0_EPS0_FDSI0_GRPM1_GRVWA8_GRVWB8_GSU1_GSUAMB_GSUC0_GSUWGMRR0_GLS0_ISA942_IU1_IA0_KLA_LBSPPA256_LBSPPB1024_LBSPPM0_LPA32_LPB32_LPM0_LRVW4_LWPMn1_MIAV0_MIWT2_2_MDA2_MI16_16_16_1_MO40_NR0_NTn1_NTA0_NTB4_NTC0_NTD4_NTE0_NTM0_NTWS0_NEPBS16_NLCA1_NLCB1_ONLL1_PGR2_PLR1_PKA1_SGR1_SIA3_SLW1_SS1_SU8_SUM0_SUS128_SPO0_SRVW0_SSO0_SVW2_SK0_SKA0_SKXCCM0_SNLL0_TT1_1_TLDS0_ULSGRO0_USL1_UIOFGRO0_USFGROn1_VSn1_VWA2_VWB2_WSGRA0_WSGRB0_WS64_WG16_16_1_WGM1_WGMXCC8_WGMXCCGn1_WGR0
    SolutionIndex: 57
    SolutionNameMin: Cijk_Ailk_Bjlk_HHS_BH_Bias_HA_S_SAV_UserArgs_MT32x128x128_MI16x16x1_SN_LDSB1_AA0_AFC1_AF1_AAIGTEn1_AAILTEn1_AFEM1_AFEM1_ASEM1_BL1_BS1_CLR1_CADS0_DSK0_DU128_DTL0_DTVA0_DTVB0_DTVSM0_EPS0_FDSI0_GRPM1_GRVWA8_GRVWB8_GSU1_GSUAMB_GSUC0_GSUWGMRR0_GLS0_ISA942_IU1_IA0_KLA_LBSPPA256_LBSPPB1024_LBSPPM0_LPA32_LPB32_LPM0_LRVW4_LWPMn1_MIAV0_MIWT2_2_MDA2_MI16_16_16_1_MO40_NR0_NTn1_NTA0_NTB4_NTC0_NTD4_NTE0_NTM0_NTWS0_NEPBS16_NLCA1_NLCB1_ONLL1_PGR2_PLR1_PKA1_SGR1_SIA3_SLW1_SS1_SU16_SUM0_SUS256_SPO0_SRVW0_SSO0_SVW2_SK0_SKA0_SKXCCM0_SNLL0_TT1_1_TLDS0_ULSGRO0_USL1_UIOFGRO0_USFGROn1_VSn1_VWA2_VWB2_WSGRA0_WSGRB0_WS64_WG16_16_1_WGM6_WGMXCC8_WGMXCCGn1_WGR0
    SolutionIndex: 58
    SolutionNameMin: Cijk_Ailk_Bjlk_HHS_BH_Bias_HA_S_SAV_UserArgs_MT32x128x128_MI16x16x1_SN_LDSB1_AA0_AFC1_AF1_AAIGTEn1_AAILTEn1_AFEM1_AFEM1_ASEM1_BL1_BS1_CLR1_CADS0_DSK0_DU128_DTL0_DTVA0_DTVB0_DTVSM0_EPS0_FDSI0_GRPM1_GRVWA8_GRVWB8_GSU1_GSUAMB_GSUC0_GSUWGMRR0_GLS0_ISA942_IU1_IA0_KLA_LBSPPA256_LBSPPB1024_LBSPPM0_LPA16_LPB0_LPM0_LRVW4_LWPMn1_MIAV0_MIWT1_4_MDA2_MI16_16_16_1_MO40_NR0_NTn1_NTA0_NTB4_NTC0_NTD4_NTE0_NTM0_NTWS0_NEPBS16_NLCA1_NLCB1_ONLL1_PGR2_PLR1_PKA1_SGR1_SIA3_SLW1_SS1_SU16_SUM0_SUS256_SPO0_SRVW0_SSO0_SVW1_SK0_SKA0_SKXCCM0_SNLL0_TT1_1_TLDS0_ULSGRO0_USL1_UIOFGRO0_USFGROn1_VSn1_VWA1_VWB4_WSGRA0_WSGRB0_WS64_WG32_8_1_WGM8_WGMXCC8_WGMXCCGn1_WGR0
    SolutionIndex: 59
    SolutionNameMin: Cijk_Ailk_Bjlk_HHS_BH_Bias_HA_S_SAV_UserArgs_MT32x128x32_MI16x16x1_SN_LDSB0_AA0_AFC1_AF1_AAIGTEn1_AAILTEn1_AFEM1_AFEM1_ASEM1_BL1_BS1_CLR1_CADS0_DSK0_DU32_DTL0_DTVA0_DTVB0_DTVSM0_EPS0_FDSI0_GRPM1_GRVWA4_GRVWB8_GSU1_GSUAMB_GSUC0_GSUWGMRR0_GLS0_ISA942_IU1_IA0_KLA_LBSPPA256_LBSPPB1024_LBSPPM0_LPA32_LPB32_LPM0_LRVW4_LWPMn1_MIAV0_MIWT2_2_MDA2_MI16_16_16_1_MO40_NR0_NTn1_NTA0_NTB4_NTC0_NTD4_NTE0_NTM0_NTWS0_NEPBS16_NLCA1_NLCB1_ONLL1_PGR2_PLR1_PKA1_SGR1_SIA3_SLW1_SS1_SU8_SUM0_SUS64_SPO0_SRVW0_SSO0_SVW2_SK0_SKA0_SKXCCM0_SNLL0_TT1_1_TLDS0_ULSGRO0_USL1_UIOFGRO0_USFGROn1_VSn1_VWA2_VWB2_WSGRA0_WSGRB0_WS64_WG16_16_1_WGM1_WGMXCC8_WGMXCCGn1_WGR0
    SolutionIndex: 60
    SolutionNameMin: Cijk_Ailk_Bjlk_HHS_BH_UserArgs_MT32x256x32_MI16x16x1_SN_GSU1_GSUC0_GSUWGMRR0_K1_MIWT2_4_SU2_SUM4_SUS128_WGM0_WGMXCC1_WGMXCCGn1
    SolutionIndex: 61
    SolutionNameMin: Cijk_Ailk_Bjlk_HHS_BH_Bias_HA_S_SAV_UserArgs_MT32x128x128_MI16x16x1_SN_LDSB1_AA0_AFC1_AF1_AAIGTEn1_AAILTEn1_AFEM1_AFEM1_ASEM1_BL1_BS1_CLR1_CADS0_DSK0_DU128_DTL0_DTVA0_DTVB0_DTVSM0_EPS0_FDSI0_GRPM1_GRVWA8_GRVWB8_GSU1_GSUAMB_GSUC0_GSUWGMRR0_GLS0_ISA942_IU1_IA0_KLA_LBSPPA256_LBSPPB1024_LBSPPM0_LPA32_LPB32_LPM0_LRVW4_LWPMn1_MIAV0_MIWT2_2_MDA2_MI16_16_16_1_MO40_NR0_NTn1_NTA0_NTB4_NTC0_NTD4_NTE0_NTM0_NTWS0_NEPBS16_NLCA1_NLCB1_ONLL1_PGR2_PLR1_PKA1_SGR1_SIA3_SLW1_SS1_SU8_SUM0_SUS256_SPO0_SRVW0_SSO0_SVW2_SK0_SKA0_SKXCCM0_SNLL0_TT1_1_TLDS0_ULSGRO0_USL1_UIOFGRO0_USFGROn1_VSn1_VWA2_VWB2_WSGRA0_WSGRB0_WS64_WG16_16_1_WGM1_WGMXCC8_WGMXCCGn1_WGR0
    SolutionIndex: 62
    SolutionNameMin: Cijk_Ailk_Bjlk_HHS_BH_Bias_HA_S_SAV_UserArgs_MT16x256x64_MI16x16x1_SN_LDSB1_AA0_AFC1_AF1_AAIGTEn1_AAILTEn1_AFEM1_AFEM1_ASEM1_BL1_BS1_CLR1_CADS0_DSK0_DU64_DTL0_DTVA0_DTVB0_DTVSM0_EPS0_FDSI0_GRPM1_GRVWA4_GRVWB8_GSU1_GSUAMB_GSUC0_GSUWGMRR0_GLS0_ISA942_IU1_IA0_KLA_LBSPPA128_LBSPPB2048_LBSPPM0_LPA16_LPB0_LPM0_LRVW4_LWPMn1_MIAV0_MIWT1_4_MDA2_MI16_16_16_1_MO40_NR0_NTn1_NTA0_NTB4_NTC0_NTD4_NTE0_NTM0_NTWS0_NEPBS16_NLCA1_NLCB1_ONLL1_PGR2_PLR1_PKA1_SGR1_SIA3_SLW1_SS1_SU8_SUM0_SUS128_SPO0_SRVW0_SSO0_SVW1_SK0_SKA0_SKXCCM0_SNLL0_TT1_1_TLDS0_ULSGRO0_USL1_UIOFGRO0_USFGROn1_VSn1_VWA1_VWB4_WSGRA0_WSGRB0_WS64_WG16_16_1_WGM1_WGMXCC8_WGMXCCGn1_WGR0
    SolutionIndex: 63
    SolutionNameMin: Cijk_Ailk_Bjlk_HHS_BH_Bias_HA_S_SAV_UserArgs_MT32x256x32_MI16x16x1_SN_LDSB1_AA0_AFC1_AF1_AAIGTEn1_AAILTEn1_AFEM1_AFEM1_ASEM1_BL1_BS1_CLR1_CADS0_DSK0_DU32_DTL0_DTVA0_DTVB0_DTVSM0_EPS0_FDSI0_GRPM1_GRVWA4_GRVWB8_GSU1_GSUAMB_GSUC0_GSUWGMRR0_GLS0_ISA942_IU1_IA0_KLA_LBSPPA256_LBSPPB2048_LBSPPM0_LPA32_LPB0_LPM0_LRVW4_LWPMn1_MIAV0_MIWT2_4_MDA2_MI16_16_16_1_MO40_NR0_NTn1_NTA0_NTB4_NTC0_NTD4_NTE0_NTM0_NTWS0_NEPBS16_NLCA1_NLCB1_ONLL1_PGR2_PLR1_PKA1_SGR1_SIA3_SLW1_SS1_SU8_SUM0_SUS64_SPO0_SRVW0_SSO0_SVW2_SK0_SKA0_SKXCCM0_SNLL0_TT1_1_TLDS0_ULSGRO0_USL1_UIOFGRO0_USFGROn1_VSn1_VWA2_VWB4_WSGRA0_WSGRB0_WS64_WG16_16_1_WGM1_WGMXCC8_WGMXCCGn1_WGR0
    SolutionIndex: 64
    SolutionNameMin: Cijk_Ailk_Bjlk_HHS_BH_Bias_HA_S_SAV_UserArgs_MT32x192x32_MI16x16x1_SN_LDSB0_AA0_AFC1_AF1_AAIGTEn1_AAILTEn1_AFEM1_AFEM1_ASEM1_BL1_BS1_CLR1_CADS0_DSK0_DU32_DTL0_DTVA0_DTVB0_DTVSM0_EPS0_FDSI0_GRPM1_GRVWA4_GRVWB8_GSU1_GSUAMB_GSUC0_GSUWGMRR0_GLS0_ISA942_IU1_IA0_KLA_LBSPPA256_LBSPPB1536_LBSPPM0_LPA32_LPB16_LPM0_LRVW4_LWPMn1_MIAV0_MIWT2_3_MDA2_MI16_16_16_1_MO40_NR0_NTn1_NTA0_NTB4_NTC0_NTD4_NTE0_NTM0_NTWS0_NEPBS16_NLCA1_NLCB3_ONLL1_PGR2_PLR1_PKA1_SGR1_SIA3_SLW1_SS1_SU8_SUM0_SUS64_SPO0_SRVW0_SSO0_SVW2_SK0_SKA0_SKXCCM0_SNLL0_TT1_1_TLDS0_ULSGRO0_USL1_UIOFGRO0_USFGROn1_VSn1_VWA2_VWB1_WSGRA0_WSGRB0_WS64_WG16_16_1_WGM1_WGMXCC8_WGMXCCGn1_WGR0
    SolutionIndex: 65
    SolutionNameMin: Cijk_Ailk_Bjlk_HHS_BH_Bias_HAS_SAV_UserArgs_MT32x256x32_MI16x16x1_SN_GRPM1_GSU1_GSUAMBSK_GSUC0_GSUWGMRR0_K1_LWPMn1_MIWT2_4_NTB4_SU16_SUM0_SUS64_WGM1_WGMXCC8_WGMXCCG0
    SolutionIndex: 66
    SolutionNameMin: Cijk_Ailk_Bjlk_HHS_BH_Bias_HA_S_SAV_UserArgs_MT32x256x32_MI16x16x1_SN_LDSB1_AA0_AFC1_AF1_AAIGTEn1_AAILTEn1_AFEM1_AFEM1_ASEM1_BL1_BS1_CLR1_CADS0_DSK0_DU32_DTL0_DTVA0_DTVB0_DTVSM0_EPS0_FDSI0_GRPM1_GRVWA4_GRVWB8_GSU1_GSUAMB_GSUC0_GSUWGMRR0_GLS0_ISA942_IU1_IA0_KLA_LBSPPA256_LBSPPB2048_LBSPPM0_LPA32_LPB0_LPM0_LRVW4_LWPMn1_MIAV0_MIWT2_4_MDA2_MI16_16_16_1_MO40_NR0_NTn1_NTA0_NTB4_NTC0_NTD4_NTE0_NTM0_NTWS0_NEPBS16_NLCA1_NLCB1_ONLL1_PGR2_PLR1_PKA1_SGR1_SIA3_SLW1_SS1_SU16_SUM0_SUS64_SPO0_SRVW0_SSO0_SVW2_SK0_SKA0_SKXCCM0_SNLL0_TT1_1_TLDS0_ULSGRO0_USL1_UIOFGRO0_USFGROn1_VSn1_VWA2_VWB4_WSGRA0_WSGRB0_WS64_WG16_16_1_WGM6_WGMXCC8_WGMXCCGn1_WGR0
    SolutionIndex: 67
    SolutionNameMin: Cijk_Ailk_Bjlk_HHS_BH_Bias_HA_S_SAV_UserArgs_MT16x16x128_MI16x16x1_SN_LDSB0_AA0_AFC1_AF1_AAIGTEn1_AAILTEn1_AFEM1_AFEM1_ASEM1_BL1_BS1_CLR1_CADS0_DSK0_DU128_DTL0_DTVA0_DTVB0_DTVSM0_EPS0_FDSI0_GRPM1_GRVWA2_GRVWB8_GSU1_GSUAMB_GSUC0_GSUWGMRR0_GLS0_ISA942_IU1_IA0_KLA_LDSTI0_LBSPPA128_LBSPPB128_LBSPPM0_LPA16_LPB16_LPM0_LRVW4_LWPMn1_MIAV0_MIWT1_1_MDA2_MI16_16_16_1_MO40_MPO0_NR0_NTn1_NTA0_NTB0_NTC0_NTD4_NTE0_NTM0_NTWS0_NEPBS16_NLCA1_NLCB1_ONLL1_PGR2_PLR1_PKA1_SGR1_SIA3_SLW1_SS1_SU8_SUM1_SUS256_SPO0_SRVW0_SSO0_SVW1_SK0_SKA0_SKXCCM0_SNLL0_TT1_1_TLDS0_ULSGRO0_USL1_UIOFGRO0_USFGROn1_VSn1_VWA1_VWB1_WSGRA0_WSGRB0_WSK0_WS64_WG16_4_4_WGM1_WGMXCC8_WGMXCCGn1_WGR0
    SolutionIndex: 68
    SolutionNameMin: Cijk_Ailk_Bjlk_HHS_BH_Bias_HA_S_SAV_UserArgs_MT16x16x128_MI16x16x1_SN_LDSB0_AA0_AFC1_AF1_AAIGTEn1_AAILTEn1_AFEM1_AFEM1_ASEM1_BL1_BS1_CLR1_CADS0_DSK0_DU128_DTL0_DTVA0_DTVB0_DTVSM0_EPS0_FDSI0_GRPM1_GRVWA8_GRVWB2_GSU1_GSUAMB_GSUC0_GSUWGMRR0_GLS0_ISA942_IU1_IA0_KLA_LDSTI0_LBSPPA128_LBSPPB128_LBSPPM0_LPA16_LPB16_LPM0_LRVW4_LWPMn1_MIAV0_MIWT1_1_MDA2_MI16_16_16_1_MO40_MPO0_NR0_NTn1_NTA0_NTB0_NTC0_NTD4_NTE0_NTM0_NTWS0_NEPBS16_NLCA1_NLCB1_ONLL1_PGR2_PLR1_PKA1_SGR1_SIA3_SLW1_SS1_SU8_SUM1_SUS256_SPO0_SRVW0_SSO0_SVW1_SK0_SKA0_SKXCCM0_SNLL0_TT1_1_TLDS0_ULSGRO0_USL1_UIOFGRO0_USFGROn1_VSn1_VWA1_VWB1_WSGRA0_WSGRB0_WSK0_WS64_WG16_4_4_WGM1_WGMXCC8_WGMXCCGn1_WGR0
    SolutionIndex: 69
    SolutionNameMin: Cijk_Ailk_Bjlk_HHS_BH_Bias_HA_S_SAV_UserArgs_MT16x16x256_MI16x16x1_SN_LDSB1_AA0_AFC1_AF1_AAIGTEn1_AAILTEn1_AFEM1_AFEM1_ASEM1_BL1_BS1_CLR1_CADS0_DSK0_DU256_DTL0_DTVA0_DTVB0_DTVSM0_EPS0_FDSI0_GRPM1_GRVWA4_GRVWB8_GSU1_GSUAMB_GSUC0_GSUWGMRR0_GLS0_ISA942_IU1_IA0_KLA_LDSTI0_LBSPPA128_LBSPPB128_LBSPPM0_LPA16_LPB16_LPM0_LRVW4_LWPMn1_MIAV0_MIWT1_1_MDA2_MI16_16_16_1_MO40_MPO0_NR0_NTn1_NTA0_NTB0_NTC0_NTD4_NTE0_NTM0_NTWS0_NEPBS16_NLCA1_NLCB1_ONLL1_PGR2_PLR1_PKA1_SGR1_SIA3_SLW1_SS1_SU8_SUM1_SUS512_SPO0_SRVW0_SSO0_SVW1_SK0_SKA0_SKXCCM0_SNLL0_TT1_1_TLDS0_ULSGRO0_USL1_UIOFGRO0_USFGROn1_VSn1_VWA1_VWB1_WSGRA0_WSGRB0_WSK0_WS64_WG16_4_4_WGM1_WGMXCC8_WGMXCCGn1_WGR0
    SolutionIndex: 70
    SolutionNameMin: Cijk_Ailk_Bjlk_HHS_BH_Bias_HA_S_SAV_UserArgs_MT16x16x128_MI16x16x1_SN_LDSB0_AA0_AFC1_AF1_AAIGTEn1_AAILTEn1_AFEM1_AFEM1_ASEM1_BL1_BS1_CLR1_CADS0_DSK0_DU128_DTL0_DTVA0_DTVB0_DTVSM0_EPS0_FDSI0_GRPM1_GRVWA1_GRVWB8_GSU1_GSUAMB_GSUC0_GSUWGMRR0_GLS0_ISA942_IU1_IA0_KLA_LDSTI0_LBSPPA128_LBSPPB128_LBSPPM0_LPA16_LPB16_LPM0_LRVW4_LWPMn1_MIAV0_MIWT1_1_MDA2_MI16_16_16_1_MO40_MPO0_NR0_NTn1_NTA0_NTB4_NTC0_NTD4_NTE0_NTM0_NTWS0_NEPBS16_NLCA1_NLCB1_ONLL1_PGR2_PLR1_PKA1_SGR1_SIA3_SLW1_SS1_SU8_SUM1_SUS256_SPO0_SRVW0_SSO0_SVW1_SK0_SKA0_SKXCCM0_SNLL0_TT1_1_TLDS0_ULSGRO0_USL1_UIOFGRO0_USFGROn1_VSn1_VWA1_VWB1_WSGRA0_WSGRB0_WSK0_WS64_WG16_4_4_WGM1_WGMXCC8_WGMXCCGn1_WGR0
    SolutionIndex: 71
    SolutionNameMin: Cijk_Ailk_Bjlk_HHS_BH_Bias_HA_S_SAV_UserArgs_MT64x16x128_MI16x16x1_SN_LDSB1_AA0_AFC1_AF1_AAIGTEn1_AAILTEn1_AFEM1_AFEM1_ASEM1_BL1_BS1_CLR1_CADS0_DSK0_DU128_DTL0_DTVA0_DTVB0_DTVSM0_EPS0_FDSI0_GRPM1_GRVWA8_GRVWB8_GSU6_GSUAMBSK_GSUC0_GSUWGMRR0_GLS0_ISA942_IU1_IA0_KLA_LBSPPA512_LBSPPB128_LBSPPM0_LPA16_LPB16_LPM0_LRVW4_LWPMn1_MIAV0_MIWT1_1_MDA2_MI16_16_16_1_MO40_NR0_NTn1_NTA0_NTB0_NTC0_NTD0_NTE0_NTM0_NTWS0_NEPBS0_NLCA1_NLCB1_ONLL1_PGR2_PLR1_PKA1_SGR1_SIA3_SLW1_SS1_SU0_SUM0_SUS0_SPO0_SRVW0_SSO0_SVW1_SK0_SKA0_SKXCCM0_SNLL0_TT1_1_TLDS0_ULSGRO0_USL1_UIOFGRO0_USFGROn1_VSn1_VWA1_VWB1_WSGRA0_WSGRB0_WS64_WG64_4_1_WGM1_WGMXCC8_WGMXCCGn1_WGR0
    SolutionIndex: 72
    SolutionNameMin: Cijk_Ailk_Bjlk_HHS_BH_Bias_HA_S_SAV_UserArgs_MT16x16x64_MI16x16x1_SN_LDSB0_AA0_AFC1_AF1_AAIGTEn1_AAILTEn1_AFEM1_AFEM1_ASEM1_BL1_BS1_CLR0_CADS0_DSK0_DU64_DTL0_DTVA0_DTVB0_DTVSM0_EPS0_FDSI0_GRPM1_GRVWA1_GRVWB4_GSU1_GSUAMB_GSUC0_GSUWGMRR0_GLS0_ISA942_IU1_IA0_KLA_LBSPPA128_LBSPPB128_LBSPPM0_LPA16_LPB16_LPM0_LRVW4_LWPMn1_MIAV0_MIWT1_1_MDA2_MI16_16_16_1_MO40_NR0_NTn1_NTA0_NTB4_NTC0_NTD0_NTE0_NTM0_NTWS0_NEPBS16_NLCA1_NLCB1_ONLL1_PGR2_PLR0_PKA1_SGR1_SIA3_SLW1_SS1_SU16_SUM0_SUS128_SPO0_SRVW0_SSO0_SVW1_SK0_SKA0_SKXCCM0_SNLL0_TT1_1_TLDS0_ULSGRO0_USL1_UIOFGRO0_USFGROn1_VSn1_VWA1_VWB1_WSGRA0_WSGRB0_WS64_WG16_4_4_WGM1_WGMXCC8_WGMXCCGn1_WGR0
    SolutionIndex: 73
    SolutionNameMin: Cijk_Ailk_Bjlk_HHS_BH_Bias_HA_S_SAV_UserArgs_MT64x32x128_MI16x16x1_SN_LDSB1_AA0_AFC1_AF1_AAIGTEn1_AAILTEn1_AFEM1_AFEM1_ASEM1_BL1_BS1_CLR1_CADS0_DSK0_DU128_DTL0_DTVA0_DTVB0_DTVSM0_EPS0_FDSI0_GRPM1_GRVWA8_GRVWB8_GSU7_GSUAMBSK_GSUC0_GSUWGMRR0_GLS0_ISA942_IU1_IA0_KLA_LBSPPA512_LBSPPB256_LBSPPM0_LPA32_LPB16_LPM0_LRVW4_LWPMn1_MIAV0_MIWT2_1_MDA2_MI16_16_16_1_MO40_NR0_NTn1_NTA0_NTB0_NTC0_NTD0_NTE0_NTM0_NTWS0_NEPBS0_NLCA1_NLCB1_ONLL1_PGR2_PLR1_PKA1_SGR1_SIA3_SLW1_SS1_SU0_SUM0_SUS0_SPO0_SRVW0_SSO0_SVW2_SK0_SKA0_SKXCCM0_SNLL0_TT1_1_TLDS0_ULSGRO0_USL1_UIOFGRO0_USFGROn1_VSn1_VWA2_VWB1_WSGRA0_WSGRB0_WS64_WG32_8_1_WGM1_WGMXCC8_WGMXCCGn1_WGR0
    SolutionIndex: 74
    SolutionNameMin: Cijk_Ailk_Bjlk_HHS_BH_Bias_HA_S_SAV_UserArgs_MT64x32x128_MI16x16x1_SN_LDSB1_AA0_AFC1_AF1_AAIGTEn1_AAILTEn1_AFEM1_AFEM1_ASEM1_BL1_BS1_CLR1_CADS0_DSK0_DU128_DTL0_DTVA0_DTVB0_DTVSM0_EPS0_FDSI0_GRPM1_GRVWA8_GRVWB8_GSU6_GSUAMBSK_GSUC0_GSUWGMRR0_GLS0_ISA942_IU1_IA0_KLA_LBSPPA512_LBSPPB256_LBSPPM0_LPA32_LPB16_LPM0_LRVW4_LWPMn1_MIAV0_MIWT2_1_MDA2_MI16_16_16_1_MO40_NR0_NTn1_NTA0_NTB0_NTC0_NTD0_NTE0_NTM0_NTWS0_NEPBS0_NLCA1_NLCB1_ONLL1_PGR2_PLR1_PKA1_SGR1_SIA3_SLW1_SS1_SU0_SUM0_SUS0_SPO0_SRVW0_SSO0_SVW2_SK0_SKA0_SKXCCM0_SNLL0_TT1_1_TLDS0_ULSGRO0_USL1_UIOFGRO0_USFGROn1_VSn1_VWA2_VWB1_WSGRA0_WSGRB0_WS64_WG32_8_1_WGM1_WGMXCC8_WGMXCCGn1_WGR0
    SolutionIndex: 75
    SolutionNameMin: Cijk_Ailk_Bjlk_HHS_BH_Bias_HA_S_SAV_UserArgs_MT64x64x64_MI16x16x1_SN_LDSB1_AA0_AFC1_AF1_AAIGTEn1_AAILTEn1_AFEM1_AFEM1_ASEM1_BL1_BS1_CLR1_CADS0_DSK0_DU64_DTL0_DTVA0_DTVB0_DTVSM0_EPS0_FDSI0_GRPM1_GRVWA8_GRVWB8_GSU8_GSUAMB_GSUC0_GSUWGMRR0_GLS0_ISA942_IU1_IA0_KLA_LBSPPA512_LBSPPB512_LBSPPM0_LPA32_LPB32_LPM0_LRVW4_LWPMn1_MIAV0_MIWT2_2_MDA2_MI16_16_16_1_MO40_NR0_NTn1_NTA0_NTB0_NTC0_NTD0_NTE0_NTM0_NTWS0_NEPBS16_NLCA1_NLCB1_ONLL1_PGR2_PLR1_PKA1_SGR1_SIA3_SLW1_SS1_SU0_SUM0_SUS0_SPO0_SRVW0_SSO0_SVW2_SK0_SKA0_SKXCCM0_SNLL0_TT1_1_TLDS0_ULSGRO0_USL1_UIOFGRO0_USFGROn1_VSn1_VWA2_VWB2_WSGRA0_WSGRB0_WS64_WG32_8_1_WGM1_WGMXCC8_WGMXCCGn1_WGR0
    SolutionIndex: 76
    SolutionNameMin: Cijk_Ailk_Bjlk_HHS_BH_Bias_HA_S_SAV_UserArgs_MT64x64x64_MI16x16x1_SN_LDSB1_AA0_AFC1_AF1_AAIGTEn1_AAILTEn1_AFEM1_AFEM1_ASEM1_BL1_BS1_CLR1_CADS0_DSK0_DU64_DTL0_DTVA0_DTVB0_DTVSM0_EPS0_FDSI0_GRPM1_GRVWA8_GRVWB8_GSU8_GSUAMB_GSUC0_GSUWGMRR0_GLS0_ISA942_IU1_IA0_KLA_LBSPPA512_LBSPPB512_LBSPPM0_LPA0_LPB16_LPM0_LRVW4_LWPMn1_MIAV0_MIWT4_1_MDA2_MI16_16_16_1_MO40_NR0_NTn1_NTA0_NTB0_NTC0_NTD0_NTE0_NTM0_NTWS0_NEPBS16_NLCA1_NLCB1_ONLL1_PGR2_PLR1_PKA1_SGR1_SIA3_SLW1_SS1_SU0_SUM0_SUS0_SPO0_SRVW0_SSO0_SVW4_SK0_SKA0_SKXCCM0_SNLL0_TT1_1_TLDS0_ULSGRO0_USL1_UIOFGRO0_USFGROn1_VSn1_VWA4_VWB1_WSGRA0_WSGRB0_WS64_WG16_16_1_WGM1_WGMXCC8_WGMXCCGn1_WGR0
    SolutionIndex: 77
    SolutionNameMin: Cijk_Ailk_Bjlk_HHS_BH_Bias_HA_S_SAV_UserArgs_MT32x32x128_MI16x16x1_SN_LDSB1_AA0_AFC1_AF1_AAIGTEn1_AAILTEn1_AFEM1_AFEM1_ASEM1_BL1_BS1_CLR1_CADS0_DSK0_DU128_DTL0_DTVA0_DTVB0_DTVSM0_EPS0_FDSI0_GRPM1_GRVWA8_GRVWB8_GSU1_GSUAMB_GSUC0_GSUWGMRR0_GLS0_ISA942_IU1_IA0_KLA_LBSPPA256_LBSPPB256_LBSPPM0_LPA16_LPB16_LPM0_LRVW4_LWPMn1_MIAV0_MIWT1_1_MDA2_MI16_16_16_1_MO40_NR0_NTn1_NTA0_NTB0_NTC0_NTD4_NTE0_NTM0_NTWS0_NEPBS16_NLCA1_NLCB1_ONLL1_PGR2_PLR1_PKA1_SGR1_SIA3_SLW1_SS1_SU8_SUM0_SUS256_SPO0_SRVW0_SSO0_SVW1_SK0_SKA0_SKXCCM0_SNLL0_TT1_1_TLDS0_ULSGRO0_USL1_UIOFGRO0_USFGROn1_VSn1_VWA1_VWB1_WSGRA0_WSGRB0_WS64_WG32_8_1_WGM1_WGMXCC8_WGMXCCGn1_WGR0
    SolutionIndex: 78
    SolutionNameMin: Cijk_Ailk_Bjlk_HHS_BH_Bias_HA_S_SAV_UserArgs_MT64x64x64_MI16x16x1_SN_LDSB1_AA0_AFC1_AF1_AAIGTEn1_AAILTEn1_AFEM1_AFEM1_ASEM1_BL1_BS1_CLR1_CADS0_DSK0_DU64_DTL0_DTVA0_DTVB0_DTVSM0_EPS0_FDSI0_GRPM1_GRVWA8_GRVWB8_GSU4_GSUAMB_GSUC0_GSUWGMRR0_GLS0_ISA942_IU1_IA0_KLA_LBSPPA512_LBSPPB512_LBSPPM0_LPA32_LPB32_LPM0_LRVW4_LWPMn1_MIAV0_MIWT2_2_MDA2_MI16_16_16_1_MO40_NR0_NTn1_NTA0_NTB0_NTC0_NTD0_NTE0_NTM0_NTWS0_NEPBS16_NLCA1_NLCB1_ONLL1_PGR2_PLR1_PKA1_SGR1_SIA3_SLW1_SS1_SU0_SUM0_SUS0_SPO0_SRVW0_SSO0_SVW2_SK0_SKA0_SKXCCM0_SNLL0_TT1_1_TLDS0_ULSGRO0_USL1_UIOFGRO0_USFGROn1_VSn1_VWA2_VWB2_WSGRA0_WSGRB0_WS64_WG32_8_1_WGM1_WGMXCC8_WGMXCCGn1_WGR0
    SolutionIndex: 79
    SolutionNameMin: Cijk_Ailk_Bjlk_HHS_BH_Bias_HA_S_SAV_UserArgs_MT32x64x128_MI16x16x1_SN_LDSB1_AA0_AFC1_AF1_AAIGTEn1_AAILTEn1_AFEM1_AFEM1_ASEM1_BL1_BS1_CLR1_CADS0_DSK0_DU128_DTL0_DTVA0_DTVB0_DTVSM0_EPS0_FDSI0_GRPM1_GRVWA8_GRVWB8_GSU1_GSUAMB_GSUC0_GSUWGMRR0_GLS0_ISA942_IU1_IA0_KLA_LBSPPA256_LBSPPB512_LBSPPM0_LPA16_LPB32_LPM0_LRVW4_LWPMn1_MIAV0_MIWT1_2_MDA2_MI16_16_16_1_MO40_NR0_NTn1_NTA0_NTB4_NTC0_NTD4_NTE0_NTM0_NTWS0_NEPBS16_NLCA1_NLCB1_ONLL1_PGR2_PLR1_PKA1_SGR1_SIA3_SLW1_SS1_SU8_SUM0_SUS256_SPO0_SRVW0_SSO0_SVW1_SK0_SKA0_SKXCCM0_SNLL0_TT1_1_TLDS0_ULSGRO0_USL1_UIOFGRO0_USFGROn1_VSn1_VWA1_VWB2_WSGRA0_WSGRB0_WS64_WG32_8_1_WGM1_WGMXCC8_WGMXCCGn1_WGR0
    SolutionIndex: 80
    SolutionNameMin: Cijk_Ailk_Bjlk_HHS_BH_Bias_HA_S_SAV_UserArgs_MT64x64x128_MI16x16x1_SN_LDSB1_AA0_AFC1_AF1_AAIGTEn1_AAILTEn1_AFEM1_AFEM1_ASEM1_BL1_BS1_CLR1_CADS0_DSK0_DU128_DTL0_DTVA0_DTVB0_DTVSM0_EPS0_FDSI0_GRPM1_GRVWA8_GRVWB8_GSU2_GSUAMBSK_GSUC0_GSUWGMRR0_GLS0_ISA942_IU1_IA0_KLA_LBSPPA512_LBSPPB512_LBSPPM0_LPA0_LPB16_LPM0_LRVW4_LWPMn1_MIAV0_MIWT4_1_MDA2_MI16_16_16_1_MO40_NR0_NTn1_NTA0_NTB4_NTC0_NTD0_NTE0_NTM0_NTWS0_NEPBS0_NLCA1_NLCB1_ONLL1_PGR2_PLR1_PKA1_SGR1_SIA3_SLW1_SS1_SU0_SUM0_SUS0_SPO0_SRVW0_SSO0_SVW4_SK0_SKA0_SKXCCM0_SNLL0_TT1_1_TLDS0_ULSGRO0_USL1_UIOFGRO0_USFGROn1_VSn1_VWA4_VWB1_WSGRA0_WSGRB0_WS64_WG16_16_1_WGM1_WGMXCC8_WGMXCCGn1_WGR0
    SolutionIndex: 81
    SolutionNameMin: Cijk_Ailk_Bjlk_HHS_BH_Bias_HA_S_SAV_UserArgs_MT64x128x64_MI16x16x1_SN_LDSB1_AA0_AFC1_AF1_AAIGTEn1_AAILTEn1_AFEM1_AFEM1_ASEM1_BL1_BS1_CLR1_CADS0_DSK0_DU64_DTL0_DTVA0_DTVB0_DTVSM0_EPS0_FDSI0_GRPM1_GRVWA8_GRVWB8_GSU4_GSUAMB_GSUC0_GSUWGMRR0_GLS0_ISA942_IU1_IA0_KLA_LBSPPA512_LBSPPB1024_LBSPPM0_LPA0_LPB32_LPM0_LRVW4_LWPMn1_MIAV0_MIWT4_2_MDA2_MI16_16_16_1_MO40_NR0_NTn1_NTA0_NTB0_NTC0_NTD0_NTE0_NTM0_NTWS0_NEPBS16_NLCA1_NLCB1_ONLL1_PGR2_PLR1_PKA1_SGR1_SIA3_SLW1_SS1_SU0_SUM0_SUS0_SPO0_SRVW0_SSO0_SVW4_SK0_SKA0_SKXCCM0_SNLL0_TT1_1_TLDS0_ULSGRO0_USL1_UIOFGRO0_USFGROn1_VSn1_VWA4_VWB2_WSGRA0_WSGRB0_WS64_WG16_16_1_WGM1_WGMXCC8_WGMXCCGn1_WGR0
    SolutionIndex: 82
    SolutionNameMin: Cijk_Ailk_Bjlk_HHS_BH_Bias_HA_S_SAV_UserArgs_MT64x64x64_MI16x16x1_SN_LDSB1_AA0_AFC1_AF1_AAIGTEn1_AAILTEn1_AFEM1_AFEM1_ASEM1_BL1_BS1_CLR1_CADS0_DSK0_DU64_DTL0_DTVA0_DTVB0_DTVSM0_EPS0_FDSI0_GRPM1_GRVWA8_GRVWB8_GSU1_GSUAMB_GSUC0_GSUWGMRR0_GLS0_ISA942_IU1_IA0_KLA_LBSPPA512_LBSPPB512_LBSPPM0_LPA0_LPB16_LPM0_LRVW4_LWPMn1_MIAV0_MIWT4_1_MDA2_MI16_16_16_1_MO40_NR0_NTn1_NTA0_NTB4_NTC0_NTD4_NTE0_NTM0_NTWS0_NEPBS16_NLCA1_NLCB1_ONLL1_PGR2_PLR1_PKA1_SGR1_SIA3_SLW1_SS1_SU8_SUM0_SUS128_SPO0_SRVW0_SSO0_SVW4_SK0_SKA0_SKXCCM0_SNLL0_TT1_1_TLDS0_ULSGRO0_USL1_UIOFGRO0_USFGROn1_VSn1_VWA4_VWB1_WSGRA0_WSGRB0_WS64_WG16_16_1_WGM1_WGMXCC8_WGMXCCGn1_WGR0
    SolutionIndex: 83
    SolutionNameMin: Cijk_Ailk_Bjlk_HHS_BH_Bias_HA_S_SAV_UserArgs_MT64x64x128_MI16x16x1_SN_LDSB1_AA0_AFC1_AF1_AAIGTEn1_AAILTEn1_AFEM1_AFEM1_ASEM1_BL1_BS1_CLR1_CADS0_DSK0_DU128_DTL0_DTVA0_DTVB0_DTVSM0_EPS0_FDSI0_GRPM1_GRVWA8_GRVWB8_GSU1_GSUAMB_GSUC0_GSUWGMRR0_GLS0_ISA942_IU1_IA0_KLA_LBSPPA512_LBSPPB512_LBSPPM0_LPA32_LPB32_LPM0_LRVW4_LWPMn1_MIAV0_MIWT2_2_MDA2_MI16_16_16_1_MO40_NR0_NTn1_NTA0_NTB4_NTC0_NTD4_NTE0_NTM0_NTWS0_NEPBS16_NLCA1_NLCB1_ONLL1_PGR2_PLR1_PKA1_SGR1_SIA3_SLW1_SS1_SU16_SUM0_SUS256_SPO0_SRVW0_SSO0_SVW2_SK0_SKA0_SKXCCM0_SNLL0_TT1_1_TLDS0_ULSGRO0_USL1_UIOFGRO0_USFGROn1_VSn1_VWA2_VWB2_WSGRA0_WSGRB0_WS64_WG32_8_1_WGM6_WGMXCC8_WGMXCCGn1_WGR0
    SolutionIndex: 84
    SolutionNameMin: Cijk_Ailk_Bjlk_HHS_BH_Bias_HA_S_SAV_UserArgs_MT64x64x64_MI16x16x1_SN_LDSB1_AA0_AFC1_AF1_AAIGTEn1_AAILTEn1_AFEM1_AFEM1_ASEM1_BL1_BS1_CLR1_CADS0_DSK0_DU64_DTL0_DTVA0_DTVB0_DTVSM0_EPS0_FDSI0_GRPM1_GRVWA8_GRVWB8_GSU1_GSUAMB_GSUC0_GSUWGMRR0_GLS0_ISA942_IU1_IA0_KLA_LBSPPA512_LBSPPB512_LBSPPM0_LPA32_LPB32_LPM0_LRVW4_LWPMn1_MIAV0_MIWT2_2_MDA2_MI16_16_16_1_MO40_NR0_NTn1_NTA0_NTB4_NTC0_NTD4_NTE0_NTM0_NTWS0_NEPBS16_NLCA1_NLCB1_ONLL1_PGR2_PLR1_PKA1_SGR1_SIA3_SLW1_SS1_SU8_SUM0_SUS128_SPO0_SRVW0_SSO0_SVW2_SK0_SKA0_SKXCCM0_SNLL0_TT1_1_TLDS0_ULSGRO0_USL1_UIOFGRO0_USFGROn1_VSn1_VWA2_VWB2_WSGRA0_WSGRB0_WS64_WG32_8_1_WGM1_WGMXCC8_WGMXCCGn1_WGR0
    SolutionIndex: 85
    SolutionNameMin: Cijk_Ailk_Bjlk_HHS_BH_Bias_HA_S_SAV_UserArgs_MT64x64x64_MI16x16x1_SN_LDSB1_AA0_AFC1_AF1_AAIGTEn1_AAILTEn1_AFEM1_AFEM1_ASEM1_BL1_BS1_CLR1_CADS0_DSK0_DU64_DTL0_DTVA0_DTVB0_DTVSM0_EPS0_FDSI0_GRPM1_GRVWA8_GRVWB8_GSU1_GSUAMB_GSUC0_GSUWGMRR0_GLS0_ISA942_IU1_IA0_KLA_LBSPPA512_LBSPPB512_LBSPPM0_LPA32_LPB32_LPM0_LRVW4_LWPMn1_MIAV0_MIWT2_2_MDA2_MI16_16_16_1_MO40_NR0_NTn1_NTA0_NTB4_NTC0_NTD4_NTE0_NTM0_NTWS0_NEPBS16_NLCA1_NLCB1_ONLL1_PGR2_PLR1_PKA1_SGR1_SIA3_SLW1_SS1_SU16_SUM0_SUS128_SPO0_SRVW0_SSO0_SVW2_SK0_SKA0_SKXCCM0_SNLL0_TT1_1_TLDS0_ULSGRO0_USL1_UIOFGRO0_USFGROn1_VSn1_VWA2_VWB2_WSGRA0_WSGRB0_WS64_WG32_8_1_WGM8_WGMXCC8_WGMXCCGn1_WGR0
    SolutionIndex: 86
    SolutionNameMin: Cijk_Ailk_Bjlk_HHS_BH_Bias_HA_S_SAV_UserArgs_MT64x128x32_MI16x16x1_SN_LDSB0_AA0_AFC1_AF1_AAIGTEn1_AAILTEn1_AFEM1_AFEM1_ASEM1_BL1_BS1_CLR1_CADS0_DSK0_DU32_DTL0_DTVA0_DTVB0_DTVSM0_EPS0_FDSI0_GRPM1_GRVWA8_GRVWB8_GSU1_GSUAMB_GSUC0_GSUWGMRR0_GLS0_ISA942_IU1_IA0_KLA_LBSPPA512_LBSPPB1024_LBSPPM0_LPA0_LPB32_LPM0_LRVW4_LWPMn1_MIAV0_MIWT4_2_MDA2_MI16_16_16_1_MO40_NR0_NTn1_NTA0_NTB4_NTC0_NTD4_NTE0_NTM0_NTWS0_NEPBS16_NLCA1_NLCB1_ONLL1_PGR2_PLR1_PKA1_SGR1_SIA3_SLW1_SS1_SU8_SUM0_SUS64_SPO0_SRVW0_SSO0_SVW4_SK0_SKA0_SKXCCM0_SNLL0_TT1_1_TLDS0_ULSGRO0_USL1_UIOFGRO0_USFGROn1_VSn1_VWA4_VWB2_WSGRA0_WSGRB0_WS64_WG16_16_1_WGM1_WGMXCC8_WGMXCCGn1_WGR0
    SolutionIndex: 87
    SolutionNameMin: Cijk_Ailk_Bjlk_HHS_BH_Bias_HA_S_SAV_UserArgs_MT64x128x64_MI16x16x1_SN_LDSB1_AA0_AFC1_AF1_AAIGTEn1_AAILTEn1_AFEM1_AFEM1_ASEM1_BL1_BS1_CLR1_CADS0_DSK0_DU64_DTL0_DTVA0_DTVB0_DTVSM0_EPS0_FDSI0_GRPM1_GRVWA8_GRVWB8_GSU1_GSUAMB_GSUC0_GSUWGMRR0_GLS0_ISA942_IU1_IA0_KLA_LBSPPA512_LBSPPB1024_LBSPPM0_LPA0_LPB32_LPM0_LRVW4_LWPMn1_MIAV0_MIWT4_2_MDA2_MI16_16_16_1_MO40_NR0_NTn1_NTA0_NTB4_NTC0_NTD4_NTE0_NTM0_NTWS0_NEPBS16_NLCA1_NLCB1_ONLL1_PGR2_PLR1_PKA1_SGR1_SIA3_SLW1_SS1_SU8_SUM0_SUS128_SPO0_SRVW0_SSO0_SVW4_SK0_SKA0_SKXCCM0_SNLL0_TT1_1_TLDS0_ULSGRO0_USL1_UIOFGRO0_USFGROn1_VSn1_VWA4_VWB2_WSGRA0_WSGRB0_WS64_WG16_16_1_WGM1_WGMXCC8_WGMXCCGn1_WGR0
    SolutionIndex: 88
    SolutionNameMin: Cijk_Ailk_Bjlk_HHS_BH_Bias_HA_S_SAV_UserArgs_MT64x128x128_MI16x16x1_SN_LDSB1_AA0_AFC1_AF1_AAIGTEn1_AAILTEn1_AFEM1_AFEM1_ASEM1_BL1_BS1_CLR1_CADS0_DSK0_DU128_DTL0_DTVA0_DTVB0_DTVSM0_EPS0_FDSI0_GRPM1_GRVWA8_GRVWB8_GSU1_GSUAMB_GSUC0_GSUWGMRR0_GLS0_ISA942_IU1_IA0_KLA_LBSPPA512_LBSPPB1024_LBSPPM0_LPA0_LPB32_LPM0_LRVW4_LWPMn1_MIAV0_MIWT4_2_MDA2_MI16_16_16_1_MO40_NR0_NTn1_NTA0_NTB4_NTC0_NTD4_NTE0_NTM0_NTWS0_NEPBS16_NLCA1_NLCB1_ONLL1_PGR2_PLR1_PKA1_SGR1_SIA3_SLW1_SS1_SU8_SUM0_SUS256_SPO0_SRVW0_SSO0_SVW4_SK0_SKA0_SKXCCM0_SNLL0_TT1_1_TLDS0_ULSGRO0_USL1_UIOFGRO0_USFGROn1_VSn1_VWA4_VWB2_WSGRA0_WSGRB0_WS64_WG16_16_1_WGM1_WGMXCC8_WGMXCCGn1_WGR0
    SolutionIndex: 89
    SolutionNameMin: Cijk_Ailk_Bjlk_HHS_BH_Bias_HA_S_SAV_UserArgs_MT64x256x64_MI16x16x1_SN_LDSB1_AA0_AFC1_AF1_AAIGTEn1_AAILTEn1_AFEM1_AFEM1_ASEM1_BL1_BS1_CLR1_CADS0_DSK0_DU64_DTL0_DTVA0_DTVB0_DTVSM0_EPS0_FDSI0_GRPM1_GRVWA8_GRVWB8_GSU2_GSUAMB_GSUC0_GSUWGMRR0_GLS0_ISA942_IU1_IA0_KLA_LBSPPA512_LBSPPB2048_LBSPPM0_LPA0_LPB0_LPM0_LRVW4_LWPMn1_MIAV0_MIWT4_4_MDA2_MI16_16_16_1_MO40_NR0_NTn1_NTA0_NTB4_NTC0_NTD0_NTE0_NTM0_NTWS0_NEPBS16_NLCA1_NLCB1_ONLL1_PGR2_PLR1_PKA1_SGR1_SIA3_SLW1_SS1_SU0_SUM0_SUS0_SPO0_SRVW0_SSO0_SVW4_SK0_SKA0_SKXCCM0_SNLL0_TT1_1_TLDS0_ULSGRO0_USL1_UIOFGRO0_USFGROn1_VSn1_VWA4_VWB4_WSGRA0_WSGRB0_WS64_WG16_16_1_WGM1_WGMXCC8_WGMXCCGn1_WGR0
    SolutionIndex: 90
    SolutionNameMin: Cijk_Ailk_Bjlk_HHS_BH_Bias_HA_S_SAV_UserArgs_MT64x192x32_MI16x16x1_SN_LDSB1_AA0_AFC1_AF1_AAIGTEn1_AAILTEn1_AFEM1_AFEM1_ASEM1_BL1_BS1_CLR1_CADS0_DSK0_DU32_DTL0_DTVA0_DTVB0_DTVSM0_EPS0_FDSI0_GRPM1_GRVWA8_GRVWB8_GSU1_GSUAMB_GSUC0_GSUWGMRR0_GLS0_ISA942_IU1_IA0_KLA_LBSPPA512_LBSPPB1536_LBSPPM0_LPA0_LPB16_LPM0_LRVW4_LWPMn1_MIAV0_MIWT4_3_MDA2_MI16_16_16_1_MO40_NR0_NTn1_NTA0_NTB4_NTC0_NTD4_NTE0_NTM0_NTWS0_NEPBS16_NLCA1_NLCB3_ONLL1_PGR2_PLR1_PKA1_SGR1_SIA3_SLW1_SS1_SU16_SUM0_SUS64_SPO0_SRVW0_SSO0_SVW4_SK0_SKA0_SKXCCM0_SNLL0_TT1_1_TLDS0_ULSGRO0_USL1_UIOFGRO0_USFGROn1_VSn1_VWA4_VWB1_WSGRA0_WSGRB0_WS64_WG16_16_1_WGM8_WGMXCC8_WGMXCCGn1_WGR0
    SolutionIndex: 91
    SolutionNameMin: Cijk_Ailk_Bjlk_HHS_BH_Bias_HA_S_SAV_UserArgs_MT64x192x32_MI16x16x1_SN_LDSB1_AA0_AFC1_AF1_AAIGTEn1_AAILTEn1_AFEM1_AFEM1_ASEM1_BL1_BS1_CLR1_CADS0_DSK0_DU32_DTL0_DTVA0_DTVB0_DTVSM0_EPS0_FDSI0_GRPM1_GRVWA8_GRVWB8_GSU1_GSUAMB_GSUC0_GSUWGMRR0_GLS0_ISA942_IU1_IA0_KLA_LBSPPA512_LBSPPB1536_LBSPPM0_LPA0_LPB16_LPM0_LRVW4_LWPMn1_MIAV0_MIWT4_3_MDA2_MI16_16_16_1_MO40_NR0_NTn1_NTA0_NTB4_NTC0_NTD4_NTE0_NTM0_NTWS0_NEPBS16_NLCA1_NLCB3_ONLL1_PGR2_PLR1_PKA1_SGR1_SIA3_SLW1_SS1_SU8_SUM0_SUS64_SPO0_SRVW0_SSO0_SVW4_SK0_SKA0_SKXCCM0_SNLL0_TT1_1_TLDS0_ULSGRO0_USL1_UIOFGRO0_USFGROn1_VSn1_VWA4_VWB1_WSGRA0_WSGRB0_WS64_WG16_16_1_WGM1_WGMXCC8_WGMXCCGn1_WGR0
    SolutionIndex: 92
    SolutionNameMin: Cijk_Ailk_Bjlk_HHS_BH_Bias_HA_S_SAV_UserArgs_MT64x256x64_MI16x16x1_SN_LDSB1_AA0_AFC1_AF1_AAIGTEn1_AAILTEn1_AFEM1_AFEM1_ASEM1_BL1_BS1_CLR1_CADS0_DSK0_DU64_DTL0_DTVA0_DTVB0_DTVSM0_EPS0_FDSI0_GRPM1_GRVWA8_GRVWB8_GSU1_GSUAMB_GSUC0_GSUWGMRR0_GLS0_ISA942_IU1_IA0_KLA_LBSPPA512_LBSPPB2048_LBSPPM0_LPA0_LPB0_LPM0_LRVW4_LWPMn1_MIAV0_MIWT4_4_MDA2_MI16_16_16_1_MO40_NR0_NTn1_NTA0_NTB4_NTC0_NTD4_NTE0_NTM0_NTWS0_NEPBS16_NLCA1_NLCB1_ONLL1_PGR2_PLR1_PKA1_SGR1_SIA3_SLW1_SS1_SU8_SUM0_SUS128_SPO0_SRVW0_SSO0_SVW4_SK0_SKA0_SKXCCM0_SNLL0_TT1_1_TLDS0_ULSGRO0_USL1_UIOFGRO0_USFGROn1_VSn1_VWA4_VWB4_WSGRA0_WSGRB0_WS64_WG16_16_1_WGM1_WGMXCC8_WGMXCCGn1_WGR0
    SolutionIndex: 93
    SolutionNameMin: Cijk_Ailk_Bjlk_HHS_BH_Bias_HA_S_SAV_UserArgs_MT64x256x32_MI16x16x1_SN_LDSB1_AA0_AFC1_AF1_AAIGTEn1_AAILTEn1_AFEM1_AFEM1_ASEM1_BL1_BS1_CLR1_CADS0_DSK0_DU32_DTL0_DTVA0_DTVB0_DTVSM0_EPS0_FDSI0_GRPM1_GRVWA8_GRVWB8_GSU1_GSUAMB_GSUC0_GSUWGMRR0_GLS0_ISA942_IU1_IA0_KLA_LBSPPA512_LBSPPB2048_LBSPPM0_LPA0_LPB0_LPM0_LRVW4_LWPMn1_MIAV0_MIWT4_4_MDA2_MI16_16_16_1_MO40_NR0_NTn1_NTA0_NTB4_NTC0_NTD4_NTE0_NTM0_NTWS0_NEPBS16_NLCA1_NLCB1_ONLL1_PGR2_PLR1_PKA1_SGR1_SIA3_SLW1_SS1_SU8_SUM0_SUS64_SPO0_SRVW0_SSO0_SVW4_SK0_SKA0_SKXCCM0_SNLL0_TT1_1_TLDS0_ULSGRO0_USL1_UIOFGRO0_USFGROn1_VSn1_VWA4_VWB4_WSGRA0_WSGRB0_WS64_WG16_16_1_WGM1_WGMXCC8_WGMXCCGn1_WGR0
    SolutionIndex: 94
    SolutionNameMin: Cijk_Ailk_Bjlk_HHS_BH_Bias_HA_S_SAV_UserArgs_MT64x256x32_MI16x16x1_SN_LDSB1_AA0_AFC1_AF1_AAIGTEn1_AAILTEn1_AFEM1_AFEM1_ASEM1_BL1_BS1_CLR1_CADS0_DSK0_DU32_DTL0_DTVA0_DTVB0_DTVSM0_EPS0_FDSI0_GRPM1_GRVWA8_GRVWB8_GSU1_GSUAMB_GSUC0_GSUWGMRR0_GLS0_ISA942_IU1_IA0_KLA_LBSPPA512_LBSPPB2048_LBSPPM0_LPA0_LPB0_LPM0_LRVW4_LWPMn1_MIAV0_MIWT4_4_MDA2_MI16_16_16_1_MO40_NR0_NTn1_NTA0_NTB4_NTC0_NTD4_NTE0_NTM0_NTWS0_NEPBS16_NLCA1_NLCB1_ONLL1_PGR2_PLR1_PKA1_SGR1_SIA3_SLW1_SS1_SU16_SUM0_SUS64_SPO0_SRVW0_SSO0_SVW4_SK0_SKA0_SKXCCM0_SNLL0_TT1_1_TLDS0_ULSGRO0_USL1_UIOFGRO0_USFGROn1_VSn1_VWA4_VWB4_WSGRA0_WSGRB0_WS64_WG16_16_1_WGM8_WGMXCC8_WGMXCCGn1_WGR0
    SolutionIndex: 95
    SolutionNameMin: Cijk_Ailk_Bjlk_HHS_BH_Bias_HA_S_SAV_UserArgs_MT64x256x32_MI16x16x1_SN_LDSB1_AA0_AFC1_AF1_AAIGTEn1_AAILTEn1_AFEM1_AFEM1_ASEM1_BL1_BS1_CLR1_CADS0_DSK0_DU32_DTL0_DTVA0_DTVB0_DTVSM0_EPS0_FDSI0_GRPM1_GRVWA8_GRVWB8_GSU1_GSUAMB_GSUC0_GSUWGMRR0_GLS0_ISA942_IU1_IA0_KLA_LBSPPA512_LBSPPB2048_LBSPPM0_LPA0_LPB0_LPM0_LRVW4_LWPMn1_MIAV0_MIWT4_4_MDA2_MI16_16_16_1_MO40_NR0_NTn1_NTA0_NTB4_NTC0_NTD4_NTE0_NTM0_NTWS0_NEPBS16_NLCA1_NLCB1_ONLL1_PGR2_PLR1_PKA1_SGR1_SIA3_SLW1_SS1_SU16_SUM0_SUS64_SPO0_SRVW0_SSO0_SVW4_SK0_SKA0_SKXCCM0_SNLL0_TT1_1_TLDS0_ULSGRO0_USL1_UIOFGRO0_USFGROn1_VSn1_VWA4_VWB4_WSGRA0_WSGRB0_WS64_WG16_16_1_WGM6_WGMXCC8_WGMXCCGn1_WGR0
    SolutionIndex: 96
    SolutionNameMin: Cijk_Ailk_Bjlk_HHS_BH_Bias_HA_S_SAV_UserArgs_MT16x16x256_MI16x16x1_SN_LDSB1_AA0_AFC1_AF1_AAIGTEn1_AAILTEn1_AFEM1_AFEM1_ASEM1_BL1_BS1_CLR1_CADS0_DSK0_DU256_DTL0_DTVA0_DTVB0_DTVSM0_EPS0_FDSI0_GRPM1_GRVWA8_GRVWB8_GSU9_GSUAMBSK_GSUC0_GSUWGMRR0_GLS0_ISA942_IU1_IA0_KLA_LBSPPA128_LBSPPB128_LBSPPM0_LPA16_LPB16_LPM0_LRVW4_LWPMn1_MIAV0_MIWT1_1_MDA2_MI16_16_16_1_MO40_NR0_NTn1_NTA0_NTB0_NTC0_NTD0_NTE0_NTM0_NTWS0_NEPBS0_NLCA1_NLCB1_ONLL1_PGR2_PLR1_PKA1_SGR1_SIA3_SLW1_SS1_SU0_SUM0_SUS0_SPO0_SRVW0_SSO0_SVW1_SK0_SKA0_SKXCCM0_SNLL0_TT1_1_TLDS0_ULSGRO0_USL1_UIOFGRO0_USFGROn1_VSn1_VWA1_VWB1_WSGRA0_WSGRB0_WS64_WG16_4_4_WGM1_WGMXCC8_WGMXCCGn1_WGR0
    SolutionIndex: 97
    SolutionNameMin: Cijk_Ailk_Bjlk_HHS_BH_Bias_HA_S_SAV_UserArgs_MT16x16x128_MI16x16x1_SN_LDSB0_AA0_AFC1_AF1_AAIGTEn1_AAILTEn1_AFEM1_AFEM1_ASEM1_BL1_BS1_CLR1_CADS0_DSK0_DU128_DTL0_DTVA0_DTVB0_DTVSM0_EPS0_FDSI0_GRPM1_GRVWA8_GRVWB4_GSU1_GSUAMB_GSUC0_GSUWGMRR0_GLS0_ISA942_IU1_IA0_KLA_LDSTI0_LBSPPA128_LBSPPB128_LBSPPM0_LPA16_LPB16_LPM0_LRVW4_LWPMn1_MIAV0_MIWT1_1_MDA2_MI16_16_16_1_MO40_MPO0_NR0_NTn1_NTA0_NTB0_NTC0_NTD4_NTE0_NTM0_NTWS0_NEPBS16_NLCA1_NLCB1_ONLL1_PGR2_PLR1_PKA1_SGR1_SIA3_SLW1_SS1_SU8_SUM1_SUS256_SPO0_SRVW0_SSO0_SVW1_SK0_SKA0_SKXCCM0_SNLL0_TT1_1_TLDS0_ULSGRO0_USL1_UIOFGRO0_USFGROn1_VSn1_VWA1_VWB1_WSGRA0_WSGRB0_WSK0_WS64_WG16_4_4_WGM1_WGMXCC8_WGMXCCGn1_WGR0
    SolutionIndex: 98
    SolutionNameMin: Cijk_Ailk_Bjlk_HHS_BH_Bias_HA_S_SAV_UserArgs_MT32x64x64_MI16x16x1_SN_LDSB0_AA0_AFC1_AF1_AAIGTEn1_AAILTEn1_AFEM1_AFEM1_ASEM1_BL1_BS1_CLR1_CADS0_DSK0_DU64_DTL0_DTVA0_DTVB0_DTVSM0_EPS0_FDSI0_GRPM1_GRVWA8_GRVWB8_GSU6_GSUAMBSK_GSUC0_GSUWGMRR0_GLS0_ISA942_IU1_IA0_KLA_LBSPPA256_LBSPPB512_LBSPPM0_LPA32_LPB16_LPM0_LRVW4_LWPMn1_MIAV0_MIWT2_1_MDA2_MI16_16_16_1_MO40_NR0_NTn1_NTA0_NTB0_NTC0_NTD0_NTE0_NTM0_NTWS0_NEPBS6_NLCA1_NLCB1_ONLL1_PGR2_PLR1_PKA1_SGR1_SIA3_SLW1_SS1_SU16_SUM0_SUS128_SPO0_SRVW0_SSO0_SVW2_SK0_SKA0_SKXCCM0_SNLL0_TT1_1_TLDS0_ULSGRO0_USL1_UIOFGRO0_USFGROn1_VSn1_VWA2_VWB1_WSGRA0_WSGRB0_WS64_WG16_16_1_WGM0_WGMXCC4_WGMXCCGn1_WGR0
    SolutionIndex: 99
    SolutionNameMin: Cijk_Ailk_Bjlk_HHS_BH_Bias_HA_S_SAV_UserArgs_MT32x64x64_MI16x16x1_SN_LDSB0_AA0_AFC1_AF1_AAIGTEn1_AAILTEn1_AFEM1_AFEM1_ASEM1_BL1_BS1_CLR1_CADS0_DSK0_DU64_DTL0_DTVA0_DTVB0_DTVSM0_EPS0_FDSI0_GRPM1_GRVWA8_GRVWB8_GSU8_GSUAMB_GSUC0_GSUWGMRR0_GLS0_ISA942_IU1_IA0_KLA_LBSPPA256_LBSPPB512_LBSPPM0_LPA32_LPB16_LPM0_LRVW4_LWPMn1_MIAV0_MIWT2_1_MDA2_MI16_16_16_1_MO40_NR0_NTn1_NTA0_NTB0_NTC0_NTD0_NTE0_NTM0_NTWS0_NEPBS16_NLCA1_NLCB1_ONLL1_PGR2_PLR1_PKA1_SGR1_SIA3_SLW1_SS1_SU0_SUM0_SUS0_SPO0_SRVW0_SSO0_SVW2_SK0_SKA0_SKXCCM0_SNLL0_TT1_1_TLDS0_ULSGRO0_USL1_UIOFGRO0_USFGROn1_VSn1_VWA2_VWB1_WSGRA0_WSGRB0_WS64_WG16_16_1_WGM1_WGMXCC8_WGMXCCGn1_WGR0
    SolutionIndex: 100
    SolutionNameMin: Cijk_Ailk_Bjlk_HHS_BH_Bias_HA_S_SAV_UserArgs_MT32x16x128_MI16x16x1_SN_LDSB0_AA0_AFC1_AF1_AAIGTEn1_AAILTEn1_AFEM1_AFEM1_ASEM1_BL1_BS1_CLR1_CADS0_DSK0_DU128_DTL0_DTVA0_DTVB0_DTVSM0_EPS0_FDSI0_GRPM1_GRVWA8_GRVWB4_GSU1_GSUAMB_GSUC0_GSUWGMRR0_GLS0_ISA942_IU1_IA0_KLA_LDSTI0_LBSPPA256_LBSPPB128_LBSPPM0_LPA32_LPB16_LPM0_LRVW4_LWPMn1_MIAV0_MIWT2_1_MDA2_MI16_16_16_1_MO40_MPO0_NR0_NTn1_NTA0_NTB0_NTC0_NTD4_NTE0_NTM0_NTWS0_NEPBS16_NLCA1_NLCB1_ONLL1_PGR2_PLR1_PKA1_SGR1_SIA3_SLW1_SS1_SU8_SUM1_SUS256_SPO0_SRVW0_SSO0_SVW2_SK0_SKA0_SKXCCM0_SNLL0_TT1_1_TLDS0_ULSGRO0_USL1_UIOFGRO0_USFGROn1_VSn1_VWA2_VWB1_WSGRA0_WSGRB0_WSK0_WS64_WG16_4_4_WGM1_WGMXCC8_WGMXCCGn1_WGR0
    SolutionIndex: 101
    SolutionNameMin: Cijk_Ailk_Bjlk_HHS_BH_Bias_HA_S_SAV_UserArgs_MT32x128x64_MI16x16x1_SN_LDSB1_AA0_AFC1_AF1_AAIGTEn1_AAILTEn1_AFEM1_AFEM1_ASEM1_BL1_BS1_CLR1_CADS0_DSK0_DU64_DTL0_DTVA0_DTVB0_DTVSM0_EPS0_FDSI0_GRPM1_GRVWA8_GRVWB8_GSU8_GSUAMB_GSUC0_GSUWGMRR0_GLS0_ISA942_IU1_IA0_KLA_LBSPPA256_LBSPPB1024_LBSPPM0_LPA32_LPB32_LPM0_LRVW4_LWPMn1_MIAV0_MIWT2_2_MDA2_MI16_16_16_1_MO40_NR0_NTn1_NTA0_NTB0_NTC0_NTD0_NTE0_NTM0_NTWS0_NEPBS16_NLCA1_NLCB1_ONLL1_PGR2_PLR1_PKA1_SGR1_SIA3_SLW1_SS1_SU0_SUM0_SUS0_SPO0_SRVW0_SSO0_SVW2_SK0_SKA0_SKXCCM0_SNLL0_TT1_1_TLDS0_ULSGRO0_USL1_UIOFGRO0_USFGROn1_VSn1_VWA2_VWB2_WSGRA0_WSGRB0_WS64_WG16_16_1_WGM1_WGMXCC8_WGMXCCGn1_WGR0
    SolutionIndex: 102
    SolutionNameMin: Cijk_Ailk_Bjlk_HHS_BH_Bias_HA_S_SAV_UserArgs_MT96x128x32_MI16x16x1_SN_LDSB0_AA0_AFC1_AF1_AAIGTEn1_AAILTEn1_AFEM1_AFEM1_ASEM1_BL1_BS1_CLR1_CADS0_DSK0_DU32_DTL0_DTVA0_DTVB0_DTVSM0_EPS0_FDSI0_GRPM1_GRVWA4_GRVWB8_GSU8_GSUAMB_GSUC0_GSUWGMRR0_GLS0_ISA942_IU1_IA0_KLA_LBSPPA768_LBSPPB1024_LBSPPM0_LPA16_LPB0_LPM0_LRVW4_LWPMn1_MIAV0_MIWT3_4_MDA2_MI16_16_16_1_MO40_NR0_NTn1_NTA0_NTB0_NTC0_NTD0_NTE0_NTM0_NTWS0_NEPBS16_NLCA3_NLCB1_ONLL1_PGR2_PLR1_PKA1_SGR1_SIA3_SLW1_SS1_SU0_SUM0_SUS0_SPO0_SRVW0_SSO0_SVW1_SK0_SKA0_SKXCCM0_SNLL0_TT1_1_TLDS0_ULSGRO0_USL1_UIOFGRO0_USFGROn1_VSn1_VWA1_VWB4_WSGRA0_WSGRB0_WS64_WG32_8_1_WGM1_WGMXCC8_WGMXCCGn1_WGR0
    SolutionIndex: 103
    SolutionNameMin: Cijk_Ailk_Bjlk_HHS_BH_Bias_HA_S_SAV_UserArgs_MT32x64x64_MI16x16x1_SN_LDSB0_AA0_AFC1_AF1_AAIGTEn1_AAILTEn1_AFEM1_AFEM1_ASEM1_BL1_BS1_CLR1_CADS0_DSK0_DU64_DTL0_DTVA0_DTVB0_DTVSM0_EPS0_FDSI0_GRPM1_GRVWA8_GRVWB8_GSU1_GSUAMB_GSUC0_GSUWGMRR0_GLS0_ISA942_IU1_IA0_KLA_LBSPPA256_LBSPPB512_LBSPPM0_LPA32_LPB16_LPM0_LRVW4_LWPMn1_MIAV0_MIWT2_1_MDA2_MI16_16_16_1_MO40_NR0_NTn1_NTA0_NTB0_NTC0_NTD4_NTE0_NTM0_NTWS0_NEPBS16_NLCA1_NLCB1_ONLL1_PGR2_PLR1_PKA1_SGR1_SIA3_SLW1_SS1_SU8_SUM0_SUS128_SPO0_SRVW0_SSO0_SVW2_SK0_SKA0_SKXCCM0_SNLL0_TT1_1_TLDS0_ULSGRO0_USL1_UIOFGRO0_USFGROn1_VSn1_VWA2_VWB1_WSGRA0_WSGRB0_WS64_WG16_16_1_WGM1_WGMXCC8_WGMXCCGn1_WGR0
    SolutionIndex: 104
    SolutionNameMin: Cijk_Ailk_Bjlk_HHS_BH_Bias_HA_S_SAV_UserArgs_MT96x128x32_MI16x16x1_SN_LDSB0_AA0_AFC1_AF1_AAIGTEn1_AAILTEn1_AFEM1_AFEM1_ASEM1_BL1_BS1_CLR1_CADS0_DSK0_DU32_DTL0_DTVA0_DTVB0_DTVSM0_EPS0_FDSI0_GRPM1_GRVWA4_GRVWB8_GSU4_GSUAMB_GSUC0_GSUWGMRR0_GLS0_ISA942_IU1_IA0_KLA_LBSPPA768_LBSPPB1024_LBSPPM0_LPA16_LPB0_LPM0_LRVW4_LWPMn1_MIAV0_MIWT3_4_MDA2_MI16_16_16_1_MO40_NR0_NTn1_NTA0_NTB4_NTC0_NTD0_NTE0_NTM0_NTWS0_NEPBS16_NLCA3_NLCB1_ONLL1_PGR2_PLR1_PKA1_SGR1_SIA3_SLW1_SS1_SU0_SUM0_SUS0_SPO0_SRVW0_SSO0_SVW1_SK0_SKA0_SKXCCM0_SNLL0_TT1_1_TLDS0_ULSGRO0_USL1_UIOFGRO0_USFGROn1_VSn1_VWA1_VWB4_WSGRA0_WSGRB0_WS64_WG32_8_1_WGM1_WGMXCC8_WGMXCCGn1_WGR0
    SolutionIndex: 105
    SolutionNameMin: Cijk_Ailk_Bjlk_HHS_BH_UserArgs_MT128x128x64_MI16x16x1_SN_GSU4_GSUC0_GSUWGMRR0_K1_MIWT4_4_SU0_SUM0_SUS128_WGM133_WGMXCC1_WGMXCCGn1
    SolutionIndex: 106
    SolutionNameMin: Cijk_Ailk_Bjlk_HHS_BH_Bias_HA_S_SAV_UserArgs_MT32x128x32_MI16x16x1_SN_LDSB0_AA0_AFC1_AF1_AAIGTEn1_AAILTEn1_AFEM1_AFEM1_ASEM1_BL1_BS1_CLR1_CADS0_DSK0_DU32_DTL0_DTVA0_DTVB0_DTVSM0_EPS0_FDSI0_GRPM1_GRVWA4_GRVWB8_GSU1_GSUAMB_GSUC0_GSUWGMRR0_GLS0_ISA942_IU1_IA0_KLA_LBSPPA256_LBSPPB1024_LBSPPM0_LPA32_LPB32_LPM0_LRVW4_LWPMn1_MIAV0_MIWT2_2_MDA2_MI16_16_16_1_MO40_NR0_NTn1_NTA0_NTB0_NTC0_NTD4_NTE0_NTM0_NTWS0_NEPBS16_NLCA1_NLCB1_ONLL1_PGR2_PLR1_PKA1_SGR1_SIA3_SLW1_SS1_SU8_SUM0_SUS64_SPO0_SRVW0_SSO0_SVW2_SK0_SKA0_SKXCCM0_SNLL0_TT1_1_TLDS0_ULSGRO0_USL1_UIOFGRO0_USFGROn1_VSn1_VWA2_VWB2_WSGRA0_WSGRB0_WS64_WG16_16_1_WGM1_WGMXCC8_WGMXCCGn1_WGR0
    SolutionIndex: 107
    SolutionNameMin: Cijk_Ailk_Bjlk_HHS_BH_Bias_HA_S_SAV_UserArgs_MT96x64x128_MI16x16x1_SN_LDSB1_AA0_AFC1_AF1_AAIGTEn1_AAILTEn1_AFEM1_AFEM1_ASEM1_BL1_BS1_CLR1_CADS0_DSK0_DU128_DTL0_DTVA0_DTVB0_DTVSM0_EPS0_FDSI0_GRPM1_GRVWA8_GRVWB8_GSU1_GSUAMB_GSUC0_GSUWGMRR0_GLS0_ISA942_IU1_IA0_KLA_LBSPPA768_LBSPPB512_LBSPPM0_LPA16_LPB32_LPM0_LRVW4_LWPMn1_MIAV0_MIWT3_2_MDA2_MI16_16_16_1_MO40_NR0_NTn1_NTA0_NTB4_NTC0_NTD4_NTE0_NTM0_NTWS0_NEPBS16_NLCA3_NLCB1_ONLL1_PGR2_PLR1_PKA1_SGR1_SIA3_SLW1_SS1_SU16_SUM0_SUS256_SPO0_SRVW0_SSO0_SVW1_SK0_SKA0_SKXCCM0_SNLL0_TT1_1_TLDS0_ULSGRO0_USL1_UIOFGRO0_USFGROn1_VSn1_VWA1_VWB2_WSGRA0_WSGRB0_WS64_WG32_8_1_WGM6_WGMXCC8_WGMXCCGn1_WGR0
    SolutionIndex: 108
    SolutionNameMin: Cijk_Ailk_Bjlk_HHS_BH_Bias_HA_S_SAV_UserArgs_MT96x256x32_MI16x16x1_SN_LDSB1_AA0_AFC1_AF1_AAIGTEn1_AAILTEn1_AFEM1_AFEM1_ASEM1_BL1_BS1_CLR1_CADS0_DSK0_DU32_DTL0_DTVA0_DTVB0_DTVSM0_EPS0_FDSI0_GRPM1_GRVWA4_GRVWB8_GSU4_GSUAMB_GSUC0_GSUWGMRR0_GLS0_ISA942_IU1_IA0_KLA_LBSPPA768_LBSPPB2048_LBSPPM0_LPA32_LPB0_LPM0_LRVW4_LWPMn1_MIAV0_MIWT6_4_MDA2_MI16_16_16_1_MO40_NR0_NTn1_NTA0_NTB4_NTC0_NTD0_NTE0_NTM0_NTWS0_NEPBS16_NLCA3_NLCB1_ONLL1_PGR2_PLR1_PKA1_SGR1_SIA3_SLW1_SS1_SU0_SUM0_SUS0_SPO0_SRVW0_SSO0_SVW2_SK0_SKA0_SKXCCM0_SNLL0_TT1_1_TLDS0_ULSGRO0_USL1_UIOFGRO0_USFGROn1_VSn1_VWA2_VWB4_WSGRA0_WSGRB0_WS64_WG16_16_1_WGM1_WGMXCC8_WGMXCCGn1_WGR0
    SolutionIndex: 109
    SolutionNameMin: Cijk_Ailk_Bjlk_HHS_BH_Bias_HA_S_SAV_UserArgs_MT32x256x64_MI16x16x1_SN_LDSB1_AA0_AFC1_AF1_AAIGTEn1_AAILTEn1_AFEM1_AFEM1_ASEM1_BL1_BS1_CLR1_CADS0_DSK0_DU64_DTL0_DTVA0_DTVB0_DTVSM0_EPS0_FDSI0_GRPM1_GRVWA8_GRVWB8_GSU1_GSUAMB_GSUC0_GSUWGMRR0_GLS0_ISA942_IU1_IA0_KLA_LBSPPA256_LBSPPB2048_LBSPPM0_LPA32_LPB0_LPM0_LRVW4_LWPMn1_MIAV0_MIWT2_4_MDA2_MI16_16_16_1_MO40_NR0_NTn1_NTA0_NTB4_NTC0_NTD4_NTE0_NTM0_NTWS0_NEPBS16_NLCA1_NLCB1_ONLL1_PGR2_PLR1_PKA1_SGR1_SIA3_SLW1_SS1_SU8_SUM0_SUS128_SPO0_SRVW0_SSO0_SVW2_SK0_SKA0_SKXCCM0_SNLL0_TT1_1_TLDS0_ULSGRO0_USL1_UIOFGRO0_USFGROn1_VSn1_VWA2_VWB4_WSGRA0_WSGRB0_WS64_WG16_16_1_WGM1_WGMXCC8_WGMXCCGn1_WGR0
    SolutionIndex: 110
    SolutionNameMin: Cijk_Ailk_Bjlk_HHS_BH_Bias_HA_S_SAV_UserArgs_MT96x256x32_MI16x16x1_SN_LDSB1_AA0_AFC1_AF1_AAIGTEn1_AAILTEn1_AFEM1_AFEM1_ASEM1_BL1_BS1_CLR1_CADS0_DSK0_DU32_DTL0_DTVA0_DTVB0_DTVSM0_EPS0_FDSI0_GRPM1_GRVWA4_GRVWB8_GSU3_GSUAMB_GSUC0_GSUWGMRR0_GLS0_ISA942_IU1_IA0_KLA_LBSPPA768_LBSPPB2048_LBSPPM0_LPA32_LPB0_LPM0_LRVW4_LWPMn1_MIAV0_MIWT6_4_MDA2_MI16_16_16_1_MO40_NR0_NTn1_NTA0_NTB4_NTC0_NTD0_NTE0_NTM0_NTWS0_NEPBS16_NLCA3_NLCB1_ONLL1_PGR2_PLR1_PKA1_SGR1_SIA3_SLW1_SS1_SU0_SUM0_SUS0_SPO0_SRVW0_SSO0_SVW2_SK0_SKA0_SKXCCM0_SNLL0_TT1_1_TLDS0_ULSGRO0_USL1_UIOFGRO0_USFGROn1_VSn1_VWA2_VWB4_WSGRA0_WSGRB0_WS64_WG16_16_1_WGM1_WGMXCC8_WGMXCCGn1_WGR0
    SolutionIndex: 111
    SolutionNameMin: Cijk_Ailk_Bjlk_HHS_BH_Bias_HA_S_SAV_UserArgs_MT96x256x64_MI16x16x1_SN_LDSB1_AA0_AFC1_AF1_AAIGTEn1_AAILTEn1_AFEM1_AFEM1_ASEM1_BL1_BS1_CLR1_CADS0_DSK0_DU64_DTL0_DTVA0_DTVB0_DTVSM0_EPS0_FDSI0_GRPM1_GRVWA8_GRVWB8_GSU3_GSUAMB_GSUC0_GSUWGMRR0_GLS0_ISA942_IU1_IA0_KLA_LBSPPA768_LBSPPB2048_LBSPPM0_LPA32_LPB0_LPM0_LRVW4_LWPMn1_MIAV0_MIWT6_4_MDA2_MI16_16_16_1_MO40_NR0_NTn1_NTA0_NTB4_NTC0_NTD0_NTE0_NTM0_NTWS0_NEPBS16_NLCA3_NLCB1_ONLL1_PGR2_PLR1_PKA1_SGR1_SIA3_SLW1_SS1_SU0_SUM0_SUS0_SPO0_SRVW0_SSO0_SVW2_SK0_SKA0_SKXCCM0_SNLL0_TT1_1_TLDS0_ULSGRO0_USL1_UIOFGRO0_USFGROn1_VSn1_VWA2_VWB4_WSGRA0_WSGRB0_WS64_WG16_16_1_WGM1_WGMXCC8_WGMXCCGn1_WGR0
    SolutionIndex: 112
    SolutionNameMin: Cijk_Ailk_Bjlk_HHS_BH_Bias_HA_S_SAV_UserArgs_MT96x128x32_MI16x16x1_SN_LDSB0_AA0_AFC1_AF1_AAIGTEn1_AAILTEn1_AFEM1_AFEM1_ASEM1_BL1_BS1_CLR1_CADS0_DSK0_DU32_DTL0_DTVA0_DTVB0_DTVSM0_EPS0_FDSI0_GRPM1_GRVWA4_GRVWB8_GSU1_GSUAMB_GSUC0_GSUWGMRR0_GLS0_ISA942_IU1_IA0_KLA_LBSPPA768_LBSPPB1024_LBSPPM0_LPA32_LPB32_LPM0_LRVW4_LWPMn1_MIAV0_MIWT6_2_MDA2_MI16_16_16_1_MO40_NR0_NTn1_NTA0_NTB4_NTC0_NTD4_NTE0_NTM0_NTWS0_NEPBS16_NLCA3_NLCB1_ONLL1_PGR2_PLR1_PKA1_SGR1_SIA3_SLW1_SS1_SU8_SUM0_SUS64_SPO0_SRVW0_SSO0_SVW2_SK0_SKA0_SKXCCM0_SNLL0_TT1_1_TLDS0_ULSGRO0_USL1_UIOFGRO0_USFGROn1_VSn1_VWA2_VWB2_WSGRA0_WSGRB0_WS64_WG16_16_1_WGM1_WGMXCC8_WGMXCCGn1_WGR0
    SolutionIndex: 113
    SolutionNameMin: Cijk_Ailk_Bjlk_HHS_BH_Bias_HA_S_SAV_UserArgs_MT96x128x64_MI16x16x1_SN_LDSB1_AA0_AFC1_AF1_AAIGTEn1_AAILTEn1_AFEM1_AFEM1_ASEM1_BL1_BS1_CLR1_CADS0_DSK0_DU64_DTL0_DTVA0_DTVB0_DTVSM0_EPS0_FDSI0_GRPM1_GRVWA8_GRVWB8_GSU1_GSUAMB_GSUC0_GSUWGMRR0_GLS0_ISA942_IU1_IA0_KLA_LBSPPA768_LBSPPB1024_LBSPPM0_LPA16_LPB0_LPM0_LRVW4_LWPMn1_MIAV0_MIWT3_4_MDA2_MI16_16_16_1_MO40_NR0_NTn1_NTA0_NTB4_NTC0_NTD4_NTE0_NTM0_NTWS0_NEPBS16_NLCA3_NLCB1_ONLL1_PGR2_PLR1_PKA1_SGR1_SIA3_SLW1_SS1_SU8_SUM0_SUS128_SPO0_SRVW0_SSO0_SVW1_SK0_SKA0_SKXCCM0_SNLL0_TT1_1_TLDS0_ULSGRO0_USL1_UIOFGRO0_USFGROn1_VSn1_VWA1_VWB4_WSGRA0_WSGRB0_WS64_WG32_8_1_WGM1_WGMXCC8_WGMXCCGn1_WGR0
    SolutionIndex: 114
    SolutionNameMin: Cijk_Ailk_Bjlk_HHS_BH_UserArgs_MT128x128x64_MI16x16x1_SN_LDSB1_CLR1_GRVWA8_GRVWB8_GSU1_GSUC0_GSUWGMRR0_K1_LBSPPA1024_LBSPPB1024_LPA0_LPB0_MIWT4_4_NLCA1_NLCB1_PLR1_SU16_SUM0_SUS128_SVW4_VWA4_VWB4_WG32_8_1_WGM8_WGMXCC8_WGMXCCG304
    SolutionIndex: 115
    SolutionNameMin: Cijk_Ailk_Bjlk_HHS_BH_Bias_HA_S_SAV_UserArgs_MT96x384x32_MI16x16x1_SN_LDSB0_AA0_AFC1_AF1_AAIGTEn1_AAILTEn1_AFEM1_AFEM1_ASEM1_BL1_BS1_CLR1_CADS0_DSK0_DU32_DTL0_DTVA0_DTVB0_DTVSM0_EPS0_FDSI0_GRPM1_GRVWA4_GRVWB8_GSU3_GSUAMB_GSUC0_GSUWGMRR0_GLS0_ISA942_IU1_IA0_KLA_LBSPPA768_LBSPPB3072_LBSPPM0_LPA32_LPB32_LPM0_LRVW4_LWPMn1_MIAV0_MIWT6_6_MDA2_MI16_16_16_1_MO40_NR0_NTn1_NTA0_NTB4_NTC0_NTD0_NTE0_NTM0_NTWS0_NEPBS16_NLCA3_NLCB3_ONLL1_PGR2_PLR1_PKA1_SGR1_SIA3_SLW1_SS1_SU0_SUM0_SUS0_SPO0_SRVW0_SSO0_SVW2_SK0_SKA0_SKXCCM0_SNLL0_TT1_1_TLDS0_ULSGRO0_USL1_UIOFGRO0_USFGROn1_VSn1_VWA2_VWB2_WSGRA0_WSGRB0_WS64_WG16_16_1_WGM1_WGMXCC8_WGMXCCGn1_WGR0
    SolutionIndex: 116
    SolutionNameMin: Cijk_Ailk_Bjlk_HHS_BH_Bias_HA_S_SAV_UserArgs_MT32x256x32_MI16x16x1_SN_LDSB1_AA0_AFC1_AF1_AAIGTEn1_AAILTEn1_AFEM1_AFEM1_ASEM1_BL1_BS1_CLR1_CADS0_DSK0_DU32_DTL0_DTVA0_DTVB0_DTVSM0_EPS0_FDSI0_GRPM1_GRVWA4_GRVWB8_GSU1_GSUAMB_GSUC0_GSUWGMRR0_GLS0_ISA942_IU1_IA0_KLA_LBSPPA256_LBSPPB2048_LBSPPM0_LPA32_LPB0_LPM0_LRVW4_LWPMn1_MIAV0_MIWT2_4_MDA2_MI16_16_16_1_MO40_NR0_NTn1_NTA0_NTB0_NTC0_NTD4_NTE0_NTM0_NTWS0_NEPBS16_NLCA1_NLCB1_ONLL1_PGR2_PLR1_PKA1_SGR1_SIA3_SLW1_SS1_SU8_SUM0_SUS64_SPO0_SRVW0_SSO0_SVW2_SK0_SKA0_SKXCCM0_SNLL0_TT1_1_TLDS0_ULSGRO0_USL1_UIOFGRO0_USFGROn1_VSn1_VWA2_VWB4_WSGRA0_WSGRB0_WS64_WG16_16_1_WGM1_WGMXCC8_WGMXCCGn1_WGR0
    SolutionIndex: 117
    SolutionNameMin: Cijk_Ailk_Bjlk_HHS_BH_Bias_HA_S_SAV_UserArgs_MT96x192x32_MI16x16x1_SN_LDSB1_AA0_AFC1_AF1_AAIGTEn1_AAILTEn1_AFEM1_AFEM1_ASEM1_BL1_BS1_CLR1_CADS0_DSK0_DU32_DTL0_DTVA0_DTVB0_DTVSM0_EPS0_FDSI0_GRPM1_GRVWA4_GRVWB8_GSU1_GSUAMB_GSUC0_GSUWGMRR0_GLS0_ISA942_IU1_IA0_KLA_LBSPPA768_LBSPPB1536_LBSPPM0_LPA32_LPB16_LPM0_LRVW4_LWPMn1_MIAV0_MIWT6_3_MDA2_MI16_16_16_1_MO40_NR0_NTn1_NTA0_NTB0_NTC0_NTD4_NTE0_NTM0_NTWS0_NEPBS16_NLCA3_NLCB3_ONLL1_PGR2_PLR1_PKA1_SGR1_SIA3_SLW1_SS1_SU16_SUM0_SUS64_SPO0_SRVW0_SSO0_SVW2_SK0_SKA0_SKXCCM0_SNLL0_TT1_1_TLDS0_ULSGRO0_USL1_UIOFGRO0_USFGROn1_VSn1_VWA2_VWB1_WSGRA0_WSGRB0_WS64_WG16_16_1_WGM8_WGMXCC8_WGMXCCGn1_WGR0
    SolutionIndex: 118
    SolutionNameMin: Cijk_Ailk_Bjlk_HHS_BH_Bias_HA_S_SAV_UserArgs_MT96x384x32_MI16x16x1_SN_LDSB0_AA0_AFC1_AF1_AAIGTEn1_AAILTEn1_AFEM1_AFEM1_ASEM1_BL1_BS1_CLR1_CADS0_DSK0_DU32_DTL0_DTVA0_DTVB0_DTVSM0_EPS0_FDSI0_GRPM1_GRVWA4_GRVWB8_GSU2_GSUAMB_GSUC0_GSUWGMRR0_GLS0_ISA942_IU1_IA0_KLA_LBSPPA768_LBSPPB3072_LBSPPM0_LPA32_LPB32_LPM0_LRVW4_LWPMn1_MIAV0_MIWT6_6_MDA2_MI16_16_16_1_MO40_NR0_NTn1_NTA0_NTB4_NTC0_NTD0_NTE0_NTM0_NTWS0_NEPBS16_NLCA3_NLCB3_ONLL1_PGR2_PLR1_PKA1_SGR1_SIA3_SLW1_SS1_SU0_SUM0_SUS0_SPO0_SRVW0_SSO0_SVW2_SK0_SKA0_SKXCCM0_SNLL0_TT1_1_TLDS0_ULSGRO0_USL1_UIOFGRO0_USFGROn1_VSn1_VWA2_VWB2_WSGRA0_WSGRB0_WS64_WG16_16_1_WGM1_WGMXCC8_WGMXCCGn1_WGR0
    SolutionIndex: 119
    SolutionNameMin: Cijk_Ailk_Bjlk_HHS_BH_Bias_HA_S_SAV_UserArgs_MT96x192x32_MI16x16x1_SN_LDSB1_AA0_AFC1_AF1_AAIGTEn1_AAILTEn1_AFEM1_AFEM1_ASEM1_BL1_BS1_CLR1_CADS0_DSK0_DU32_DTL0_DTVA0_DTVB0_DTVSM0_EPS0_FDSI0_GRPM1_GRVWA4_GRVWB8_GSU1_GSUAMB_GSUC0_GSUWGMRR0_GLS0_ISA942_IU1_IA0_KLA_LBSPPA768_LBSPPB1536_LBSPPM0_LPA32_LPB16_LPM0_LRVW4_LWPMn1_MIAV0_MIWT6_3_MDA2_MI16_16_16_1_MO40_NR0_NTn1_NTA0_NTB0_NTC0_NTD4_NTE0_NTM0_NTWS0_NEPBS16_NLCA3_NLCB3_ONLL1_PGR2_PLR1_PKA1_SGR1_SIA3_SLW1_SS1_SU8_SUM1_SUS64_SPO0_SRVW0_SSO0_SVW2_SK0_SKA0_SKXCCM0_SNLL0_TT1_1_TLDS0_ULSGRO0_USL1_UIOFGRO0_USFGROn1_VSn1_VWA2_VWB1_WSGRA0_WSGRB0_WS64_WG16_16_1_WGM6_WGMXCC8_WGMXCCGn1_WGR0
    SolutionIndex: 120
    SolutionNameMin: Cijk_Ailk_Bjlk_HHS_BH_Bias_HA_S_SAV_UserArgs_MT96x512x32_MI16x16x1_SN_LDSB1_AA0_AFC1_AF1_AAIGTEn1_AAILTEn1_AFEM1_AFEM1_ASEM1_BL1_BS1_CLR1_CADS0_DSK0_DU32_DTL0_DTVA0_DTVB0_DTVSM0_EPS0_FDSI0_GRPM1_GRVWA4_GRVWB8_GSU2_GSUAMB_GSUC0_GSUWGMRR0_GLS0_ISA942_IU1_IA0_KLA_LBSPPA768_LBSPPB4096_LBSPPM0_LPA32_LPB0_LPM0_LRVW4_LWPMn1_MIAV0_MIWT6_8_MDA2_MI16_16_16_1_MO40_NR0_NTn1_NTA0_NTB4_NTC0_NTD0_NTE0_NTM0_NTWS0_NEPBS16_NLCA3_NLCB1_ONLL1_PGR2_PLR1_PKA1_SGR1_SIA3_SLW1_SS1_SU0_SUM0_SUS0_SPO0_SRVW0_SSO0_SVW2_SK0_SKA0_SKXCCM0_SNLL0_TT1_1_TLDS0_ULSGRO0_USL1_UIOFGRO0_USFGROn1_VSn1_VWA2_VWB8_WSGRA0_WSGRB0_WS64_WG16_16_1_WGM1_WGMXCC8_WGMXCCGn1_WGR0
    SolutionIndex: 121
    SolutionNameMin: Cijk_Ailk_Bjlk_HHS_BH_Bias_HA_S_SAV_UserArgs_MT16x16x256_MI16x16x1_SN_LDSB1_AA0_AFC1_AF1_AAIGTEn1_AAILTEn1_AFEM1_AFEM1_ASEM1_BL1_BS1_CLR1_CADS0_DSK0_DU256_DTL0_DTVA0_DTVB0_DTVSM0_EPS0_FDSI0_GRPM1_GRVWA8_GRVWB8_GSU8_GSUAMBSK_GSUC0_GSUWGMRR0_GLS0_ISA942_IU1_IA0_KLA_LBSPPA128_LBSPPB128_LBSPPM0_LPA16_LPB16_LPM0_LRVW4_LWPMn1_MIAV0_MIWT1_1_MDA2_MI16_16_16_1_MO40_NR0_NTn1_NTA0_NTB0_NTC0_NTD0_NTE0_NTM0_NTWS0_NEPBS0_NLCA1_NLCB1_ONLL1_PGR2_PLR1_PKA1_SGR1_SIA3_SLW1_SS1_SU0_SUM0_SUS0_SPO0_SRVW0_SSO0_SVW1_SK0_SKA0_SKXCCM0_SNLL0_TT1_1_TLDS0_ULSGRO0_USL1_UIOFGRO0_USFGROn1_VSn1_VWA1_VWB1_WSGRA0_WSGRB0_WS64_WG16_4_4_WGM1_WGMXCC8_WGMXCCGn1_WGR0
    SolutionIndex: 122
    SolutionNameMin: Cijk_Ailk_Bjlk_HHS_BH_Bias_HA_S_SAV_UserArgs_MT16x64x128_MI16x16x1_SN_LDSB1_AA0_AFC1_AF1_AAIGTEn1_AAILTEn1_AFEM1_AFEM1_ASEM1_BL1_BS1_CLR1_CADS0_DSK0_DU128_DTL0_DTVA0_DTVB0_DTVSM0_EPS0_FDSI0_GRPM1_GRVWA2_GRVWB8_GSU8_GSUAMB_GSUC0_GSUWGMRR0_GLS0_ISA942_IU1_IA0_KLA_LBSPPA128_LBSPPB512_LBSPPM0_LPA16_LPB0_LPM0_LRVW4_LWPMn1_MIAV0_MIWT1_4_MDA2_MI16_16_16_1_MO40_NR0_NTn1_NTA0_NTB4_NTC0_NTD0_NTE0_NTM0_NTWS0_NEPBS16_NLCA1_NLCB1_ONLL1_PGR2_PLR1_PKA1_SGR1_SIA3_SLW1_SS1_SU16_SUM0_SUS256_SPO0_SRVW0_SSO0_SVW1_SK0_SKA0_SKXCCM0_SNLL0_TT1_1_TLDS0_ULSGRO0_USL1_UIOFGRO0_USFGROn1_VSn1_VWA1_VWB4_WSGRA0_WSGRB0_WS64_WG16_4_4_WGM1_WGMXCC8_WGMXCCGn1_WGR0
    SolutionIndex: 123
    SolutionNameMin: Cijk_Ailk_Bjlk_HHS_BH_Bias_HA_S_SAV_UserArgs_MT64x16x128_MI16x16x1_SN_LDSB1_AA0_AFC1_AF1_AAIGTEn1_AAILTEn1_AFEM1_AFEM1_ASEM1_BL1_BS1_CLR1_CADS0_DSK0_DU128_DTL0_DTVA0_DTVB0_DTVSM0_EPS0_FDSI0_GRPM1_GRVWA8_GRVWB8_GSU4_GSUAMB_GSUC0_GSUWGMRR0_GLS0_ISA942_IU1_IA0_KLA_LBSPPA512_LBSPPB128_LBSPPM0_LPA16_LPB16_LPM0_LRVW4_LWPMn1_MIAV0_MIWT1_1_MDA2_MI16_16_16_1_MO40_NR0_NTn1_NTA0_NTB0_NTC0_NTD0_NTE0_NTM0_NTWS0_NEPBS16_NLCA1_NLCB1_ONLL1_PGR2_PLR1_PKA1_SGR1_SIA3_SLW1_SS1_SU0_SUM0_SUS0_SPO0_SRVW0_SSO0_SVW1_SK0_SKA0_SKXCCM0_SNLL0_TT1_1_TLDS0_ULSGRO0_USL1_UIOFGRO0_USFGROn1_VSn1_VWA1_VWB1_WSGRA0_WSGRB0_WS64_WG64_4_1_WGM1_WGMXCC8_WGMXCCGn1_WGR0
    SolutionIndex: 124
    SolutionNameMin: Cijk_Ailk_Bjlk_HHS_BH_Bias_HA_S_SAV_UserArgs_MT64x64x64_MI16x16x1_SN_LDSB1_AA0_AFC1_AF1_AAIGTEn1_AAILTEn1_AFEM1_AFEM1_ASEM1_BL1_BS1_CLR1_CADS0_DSK0_DU64_DTL0_DTVA0_DTVB0_DTVSM0_EPS0_FDSI0_GRPM1_GRVWA8_GRVWB8_GSU16_GSUAMB_GSUC0_GSUWGMRR0_GLS0_ISA942_IU1_IA0_KLA_LBSPPA512_LBSPPB512_LBSPPM0_LPA0_LPB16_LPM0_LRVW4_LWPMn1_MIAV0_MIWT4_1_MDA2_MI16_16_16_1_MO40_NR0_NTn1_NTA0_NTB0_NTC0_NTD0_NTE0_NTM0_NTWS0_NEPBS16_NLCA1_NLCB1_ONLL1_PGR2_PLR1_PKA1_SGR1_SIA3_SLW1_SS1_SU0_SUM0_SUS0_SPO0_SRVW0_SSO0_SVW4_SK0_SKA0_SKXCCM0_SNLL0_TT1_1_TLDS0_ULSGRO0_USL1_UIOFGRO0_USFGROn1_VSn1_VWA4_VWB1_WSGRA0_WSGRB0_WS64_WG16_16_1_WGM1_WGMXCC8_WGMXCCGn1_WGR0
    SolutionIndex: 125
    SolutionNameMin: Cijk_Ailk_Bjlk_HHS_BH_Bias_HA_S_SAV_UserArgs_MT16x64x64_MI16x16x1_SN_LDSB0_AA0_AFC1_AF1_AAIGTEn1_AAILTEn1_AFEM1_AFEM1_ASEM1_BL1_BS1_CLR1_CADS0_DSK0_DU64_DTL0_DTVA0_DTVB0_DTVSM0_EPS0_FDSI0_GRPM1_GRVWA4_GRVWB8_GSU1_GSUAMB_GSUC0_GSUWGMRR0_GLS0_ISA942_IU1_IA0_KLA_LBSPPA128_LBSPPB512_LBSPPM0_LPA16_LPB16_LPM0_LRVW4_LWPMn1_MIAV0_MIWT1_1_MDA2_MI16_16_16_1_MO40_NR0_NTn1_NTA0_NTB0_NTC0_NTD4_NTE0_NTM0_NTWS0_NEPBS16_NLCA1_NLCB1_ONLL1_PGR2_PLR1_PKA1_SGR1_SIA3_SLW1_SS1_SU8_SUM0_SUS128_SPO0_SRVW0_SSO0_SVW1_SK0_SKA0_SKXCCM0_SNLL0_TT1_1_TLDS0_ULSGRO0_USL1_UIOFGRO0_USFGROn1_VSn1_VWA1_VWB1_WSGRA0_WSGRB0_WS64_WG16_16_1_WGM1_WGMXCC8_WGMXCCGn1_WGR0
    SolutionIndex: 126
    SolutionNameMin: Cijk_Ailk_Bjlk_HHS_BH_Bias_HA_S_SAV_UserArgs_MT16x32x128_MI16x16x1_SN_LDSB0_AA0_AFC1_AF1_AAIGTEn1_AAILTEn1_AFEM1_AFEM1_ASEM1_BL1_BS1_CLR1_CADS0_DSK0_DU128_DTL0_DTVA0_DTVB0_DTVSM0_EPS0_FDSI0_GRPM1_GRVWA2_GRVWB8_GSU1_GSUAMB_GSUC0_GSUWGMRR0_GLS0_ISA942_IU1_IA0_KLA_LDSTI0_LBSPPA128_LBSPPB256_LBSPPM0_LPA16_LPB32_LPM0_LRVW4_LWPMn1_MIAV0_MIWT1_2_MDA2_MI16_16_16_1_MO40_MPO0_NR0_NTn1_NTA0_NTB0_NTC0_NTD4_NTE0_NTM0_NTWS0_NEPBS16_NLCA1_NLCB1_ONLL1_PGR2_PLR1_PKA1_SGR1_SIA3_SLW1_SS1_SU8_SUM1_SUS256_SPO0_SRVW0_SSO0_SVW1_SK0_SKA0_SKXCCM0_SNLL0_TT1_1_TLDS0_ULSGRO0_USL1_UIOFGRO0_USFGROn1_VSn1_VWA1_VWB2_WSGRA0_WSGRB0_WSK0_WS64_WG16_4_4_WGM1_WGMXCC8_WGMXCCGn1_WGR0
    SolutionIndex: 127
    SolutionNameMin: Cijk_Ailk_Bjlk_HHS_BH_Bias_HA_S_SAV_UserArgs_MT16x32x256_MI16x16x1_SN_LDSB1_AA0_AFC1_AF1_AAIGTEn1_AAILTEn1_AFEM1_AFEM1_ASEM1_BL1_BS1_CLR1_CADS0_DSK0_DU256_DTL0_DTVA0_DTVB0_DTVSM0_EPS0_FDSI0_GRPM1_GRVWA2_GRVWB8_GSU1_GSUAMB_GSUC0_GSUWGMRR0_GLS0_ISA942_IU1_IA0_KLA_LDSTI0_LBSPPA128_LBSPPB256_LBSPPM0_LPA16_LPB32_LPM0_LRVW4_LWPMn1_MIAV0_MIWT1_2_MDA2_MI16_16_16_1_MO40_MPO0_NR0_NTn1_NTA0_NTB0_NTC0_NTD4_NTE0_NTM0_NTWS0_NEPBS16_NLCA1_NLCB1_ONLL1_PGR2_PLR1_PKA1_SGR1_SIA3_SLW1_SS1_SU8_SUM1_SUS512_SPO0_SRVW0_SSO0_SVW1_SK0_SKA0_SKXCCM0_SNLL0_TT1_1_TLDS0_ULSGRO0_USL1_UIOFGRO0_USFGROn1_VSn1_VWA1_VWB2_WSGRA0_WSGRB0_WSK0_WS64_WG16_4_4_WGM1_WGMXCC8_WGMXCCGn1_WGR0
    SolutionIndex: 128
    SolutionNameMin: Cijk_Ailk_Bjlk_HHS_BH_UserArgs_MT64x64x64_MI16x16x1_SN_GSU8_GSUC0_GSUWGMRR1_K1_LBSPPA512_LBSPPB512_LPA32_LPB32_MIWT2_2_SU4_SUM0_SUS128_WG32_8_1_WGM76_WGMXCC16_WGMXCCG0
    SolutionIndex: 129
    SolutionNameMin: Cijk_Ailk_Bjlk_HHS_BH_Bias_HA_S_SAV_UserArgs_MT64x64x64_MI16x16x1_SN_LDSB1_AA0_AFC1_AF1_AAIGTEn1_AAILTEn1_AFEM1_AFEM1_ASEM1_BL1_BS1_CLR1_CADS0_DSK0_DU64_DTL0_DTVA0_DTVB0_DTVSM0_EPS0_FDSI0_GRPM1_GRVWA8_GRVWB8_GSU6_GSUAMB_GSUC0_GSUWGMRR0_GLS0_ISA942_IU1_IA0_KLA_LBSPPA512_LBSPPB512_LBSPPM0_LPA32_LPB32_LPM0_LRVW4_LWPMn1_MIAV0_MIWT2_2_MDA2_MI16_16_16_1_MO40_NR0_NTn1_NTA0_NTB0_NTC0_NTD0_NTE0_NTM0_NTWS0_NEPBS16_NLCA1_NLCB1_ONLL1_PGR2_PLR1_PKA1_SGR1_SIA3_SLW1_SS1_SU0_SUM0_SUS0_SPO0_SRVW0_SSO0_SVW2_SK0_SKA0_SKXCCM0_SNLL0_TT1_1_TLDS0_ULSGRO0_USL1_UIOFGRO0_USFGROn1_VSn1_VWA2_VWB2_WSGRA0_WSGRB0_WS64_WG32_8_1_WGM1_WGMXCC8_WGMXCCGn1_WGR0
    SolutionIndex: 130
    SolutionNameMin: Cijk_Ailk_Bjlk_HHS_BH_Bias_HA_S_SAV_UserArgs_MT16x64x128_MI16x16x1_SN_LDSB1_AA0_AFC1_AF1_AAIGTEn1_AAILTEn1_AFEM1_AFEM1_ASEM1_BL1_BS1_CLR1_CADS0_DSK0_DU128_DTL0_DTVA0_DTVB0_DTVSM0_EPS0_FDSI0_GRPM1_GRVWA4_GRVWB8_GSU1_GSUAMB_GSUC0_GSUWGMRR0_GLS0_ISA942_IU1_IA0_KLA_LDSTI0_LBSPPA128_LBSPPB512_LBSPPM0_LPA16_LPB0_LPM0_LRVW4_LWPMn1_MIAV0_MIWT1_4_MDA2_MI16_16_16_1_MO40_MPO0_NR0_NTn1_NTA0_NTB0_NTC0_NTD4_NTE0_NTM0_NTWS0_NEPBS16_NLCA1_NLCB1_ONLL1_PGR2_PLR1_PKA1_SGR1_SIA3_SLW1_SS1_SU8_SUM1_SUS256_SPO0_SRVW0_SSO0_SVW1_SK0_SKA0_SKXCCM0_SNLL0_TT1_1_TLDS0_ULSGRO0_USL1_UIOFGRO0_USFGROn1_VSn1_VWA1_VWB4_WSGRA0_WSGRB0_WSK0_WS64_WG16_4_4_WGM1_WGMXCC8_WGMXCCGn1_WGR0
    SolutionIndex: 131
    SolutionNameMin: Cijk_Ailk_Bjlk_HHS_BH_Bias_HA_S_SAV_UserArgs_MT64x64x64_MI16x16x1_SN_LDSB1_AA0_AFC1_AF1_AAIGTEn1_AAILTEn1_AFEM1_AFEM1_ASEM1_BL1_BS1_CLR1_CADS0_DSK0_DU64_DTL0_DTVA0_DTVB0_DTVSM0_EPS0_FDSI0_GRPM1_GRVWA8_GRVWB8_GSU4_GSUAMBSK_GSUC0_GSUWGMRR0_GLS0_ISA942_IU1_IA0_KLA_LBSPPA512_LBSPPB512_LBSPPM0_LPA0_LPB16_LPM0_LRVW4_LWPMn1_MIAV0_MIWT4_1_MDA2_MI16_16_16_1_MO40_NR0_NTn1_NTA0_NTB0_NTC0_NTD0_NTE0_NTM0_NTWS0_NEPBS0_NLCA1_NLCB1_ONLL1_PGR2_PLR1_PKA1_SGR1_SIA3_SLW1_SS1_SU0_SUM0_SUS0_SPO0_SRVW0_SSO0_SVW4_SK0_SKA0_SKXCCM0_SNLL0_TT1_1_TLDS0_ULSGRO0_USL1_UIOFGRO0_USFGROn1_VSn1_VWA4_VWB1_WSGRA0_WSGRB0_WS64_WG16_16_1_WGM1_WGMXCC8_WGMXCCGn1_WGR0
    SolutionIndex: 132
    SolutionNameMin: Cijk_Ailk_Bjlk_HHS_BH_UserArgs_MT64x128x64_MI16x16x1_SN_GSU8_GSUC0_GSUWGMRR1_K1_MIWT4_2_SU2_SUM4_SUS256_WGM0_WGMXCC4_WGMXCCG48
    SolutionIndex: 133
    SolutionNameMin: Cijk_Ailk_Bjlk_HHS_BH_Bias_HA_S_SAV_UserArgs_MT128x128x64_MI16x16x1_SN_LDSB1_AA0_AFC1_AF1_AAIGTEn1_AAILTEn1_AFEM1_AFEM1_ASEM1_BL1_BS1_CLR1_CADS0_DSK0_DU64_DTL0_DTVA0_DTVB0_DTVSM0_EPS0_FDSI0_GRPM1_GRVWA8_GRVWB8_GSU3_GSUAMB_GSUC0_GSUWGMRR0_GLS0_ISA942_IU1_IA0_KLA_LBSPPA1024_LBSPPB1024_LBSPPM0_LPA0_LPB0_LPM0_LRVW4_LWPMn1_MIAV0_MIWT4_4_MDA2_MI16_16_16_1_MO40_NR0_NTn1_NTA0_NTB0_NTC0_NTD0_NTE0_NTM0_NTWS0_NEPBS16_NLCA1_NLCB1_ONLL1_PGR2_PLR1_PKA1_SGR1_SIA3_SLW1_SS1_SU0_SUM0_SUS0_SPO0_SRVW0_SSO0_SVW4_SK0_SKA0_SKXCCM0_SNLL0_TT1_1_TLDS0_ULSGRO0_USL1_UIOFGRO0_USFGROn1_VSn1_VWA4_VWB4_WSGRA0_WSGRB0_WS64_WG32_8_1_WGM1_WGMXCC8_WGMXCCGn1_WGR0
    SolutionIndex: 134
    SolutionNameMin: Cijk_Ailk_Bjlk_HHS_BH_UserArgs_MT128x128x64_MI16x16x1_SN_GSU4_GSUC0_GSUWGMRR0_K1_MIWT4_4_SU4_SUM0_SUS256_WGM0_WGMXCC32_WGMXCCG0
    SolutionIndex: 135
    SolutionNameMin: Cijk_Ailk_Bjlk_HHS_BH_Bias_HA_S_SAV_UserArgs_MT128x64x64_MI16x16x1_SN_LDSB1_AA0_AFC1_AF1_AAIGTEn1_AAILTEn1_AFEM1_AFEM1_ASEM1_BL1_BS1_CLR1_CADS0_DSK0_DU64_DTL0_DTVA0_DTVB0_DTVSM0_EPS0_FDSI0_GRPM1_GRVWA8_GRVWB8_GSU1_GSUAMB_GSUC0_GSUWGMRR0_GLS0_ISA942_IU1_IA0_KLA_LBSPPA1024_LBSPPB512_LBSPPM0_LPA0_LPB32_LPM0_LRVW4_LWPMn1_MIAV0_MIWT4_2_MDA2_MI16_16_16_1_MO40_NR0_NTn1_NTA0_NTB4_NTC0_NTD4_NTE0_NTM0_NTWS0_NEPBS16_NLCA1_NLCB1_ONLL1_PGR2_PLR1_PKA1_SGR1_SIA3_SLW1_SS1_SU16_SUM0_SUS128_SPO0_SRVW0_SSO0_SVW4_SK0_SKA0_SKXCCM0_SNLL0_TT1_1_TLDS0_ULSGRO0_USL1_UIOFGRO0_USFGROn1_VSn1_VWA4_VWB2_WSGRA0_WSGRB0_WS64_WG32_8_1_WGM8_WGMXCC8_WGMXCCGn1_WGR0
    SolutionIndex: 136
    SolutionNameMin: Cijk_Ailk_Bjlk_HHS_BH_Bias_HA_S_SAV_UserArgs_MT128x64x64_MI16x16x1_SN_LDSB1_AA0_AFC1_AF1_AAIGTEn1_AAILTEn1_AFEM1_AFEM1_ASEM1_BL1_BS1_CLR1_CADS0_DSK0_DU64_DTL0_DTVA0_DTVB0_DTVSM0_EPS0_FDSI0_GRPM1_GRVWA8_GRVWB8_GSU1_GSUAMB_GSUC0_GSUWGMRR0_GLS0_ISA942_IU1_IA0_KLA_LBSPPA1024_LBSPPB512_LBSPPM0_LPA0_LPB32_LPM0_LRVW4_LWPMn1_MIAV0_MIWT4_2_MDA2_MI16_16_16_1_MO40_NR0_NTn1_NTA0_NTB4_NTC0_NTD4_NTE0_NTM0_NTWS0_NEPBS16_NLCA1_NLCB1_ONLL1_PGR2_PLR1_PKA1_SGR1_SIA3_SLW1_SS1_SU8_SUM0_SUS128_SPO0_SRVW0_SSO0_SVW4_SK0_SKA0_SKXCCM0_SNLL0_TT1_1_TLDS0_ULSGRO0_USL1_UIOFGRO0_USFGROn1_VSn1_VWA4_VWB2_WSGRA0_WSGRB0_WS64_WG32_8_1_WGM1_WGMXCC8_WGMXCCGn1_WGR0
    SolutionIndex: 137
    SolutionNameMin: Cijk_Ailk_Bjlk_HHS_BH_Bias_HA_S_SAV_UserArgs_MT128x128x64_MI16x16x1_SN_LDSB1_AA0_AFC1_AF1_AAIGTEn1_AAILTEn1_AFEM1_AFEM1_ASEM1_BL1_BS1_CLR1_CADS0_DSK0_DU64_DTL0_DTVA0_DTVB0_DTVSM0_EPS0_FDSI0_GRPM1_GRVWA8_GRVWB8_GSU2_GSUAMBSK_GSUC0_GSUWGMRR0_GLS0_ISA942_IU1_IA0_KLA_LBSPPA1024_LBSPPB1024_LBSPPM0_LPA0_LPB0_LPM0_LRVW4_LWPMn1_MIAV0_MIWT4_4_MDA2_MI16_16_16_1_MO40_NR0_NTn1_NTA0_NTB4_NTC0_NTD0_NTE0_NTM0_NTWS0_NEPBS0_NLCA1_NLCB1_ONLL1_PGR2_PLR1_PKA1_SGR1_SIA3_SLW1_SS1_SU0_SUM0_SUS0_SPO0_SRVW0_SSO0_SVW4_SK0_SKA0_SKXCCM0_SNLL0_TT1_1_TLDS0_ULSGRO0_USL1_UIOFGRO0_USFGROn1_VSn1_VWA4_VWB4_WSGRA0_WSGRB0_WS64_WG32_8_1_WGM1_WGMXCC8_WGMXCCGn1_WGR0
    SolutionIndex: 138
    SolutionNameMin: Cijk_Ailk_Bjlk_HHS_BH_Bias_HA_S_SAV_UserArgs_MT128x256x32_MI16x16x1_SN_LDSB1_AA0_AFC1_AF1_AAIGTEn1_AAILTEn1_AFEM1_AFEM1_ASEM1_BL1_BS1_CLR1_CADS0_DSK0_DU32_DTL0_DTVA0_DTVB0_DTVSM0_EPS0_FDSI0_GRPM1_GRVWA8_GRVWB8_GSU4_GSUAMB_GSUC0_GSUWGMRR0_GLS0_ISA942_IU1_IA0_KLA_LBSPPA1024_LBSPPB2048_LBSPPM0_LPA0_LPB0_LPM0_LRVW4_LWPMn1_MIAV0_MIWT4_8_MDA2_MI16_16_16_1_MO40_NR0_NTn1_NTA0_NTB0_NTC0_NTD0_NTE0_NTM0_NTWS0_NEPBS16_NLCA1_NLCB1_ONLL1_PGR2_PLR1_PKA1_SGR1_SIA3_SLW1_SS1_SU0_SUM0_SUS0_SPO0_SRVW0_SSO0_SVW4_SK0_SKA0_SKXCCM0_SNLL0_TT1_1_TLDS0_ULSGRO0_USL1_UIOFGRO0_USFGROn1_VSn1_VWA4_VWB8_WSGRA0_WSGRB0_WS64_WG32_8_1_WGM1_WGMXCC8_WGMXCCGn1_WGR0
    SolutionIndex: 139
    SolutionNameMin: Cijk_Ailk_Bjlk_HHS_BH_Bias_HA_S_SAV_UserArgs_MT128x128x64_MI16x16x1_SN_LDSB1_AA0_AFC1_AF1_AAIGTEn1_AAILTEn1_AFEM1_AFEM1_ASEM1_BL1_BS1_CLR1_CADS0_DSK0_DU64_DTL0_DTVA0_DTVB0_DTVSM0_EPS0_FDSI0_GRPM1_GRVWA8_GRVWB8_GSU1_GSUAMB_GSUC0_GSUWGMRR0_GLS0_ISA942_IU1_IA0_KLA_LBSPPA1024_LBSPPB1024_LBSPPM0_LPA0_LPB0_LPM0_LRVW4_LWPMn1_MIAV0_MIWT4_4_MDA2_MI16_16_16_1_MO40_NR0_NTn1_NTA0_NTB4_NTC0_NTD4_NTE0_NTM0_NTWS0_NEPBS16_NLCA1_NLCB1_ONLL1_PGR2_PLR1_PKA1_SGR1_SIA3_SLW1_SS1_SU8_SUM0_SUS128_SPO0_SRVW0_SSO0_SVW4_SK0_SKA0_SKXCCM0_SNLL0_TT1_1_TLDS0_ULSGRO0_USL1_UIOFGRO0_USFGROn1_VSn1_VWA4_VWB4_WSGRA0_WSGRB0_WS64_WG32_8_1_WGM1_WGMXCC8_WGMXCCGn1_WGR0
    SolutionIndex: 140
    SolutionNameMin: Cijk_Ailk_Bjlk_HHS_BH_Bias_HA_S_SAV_UserArgs_MT128x256x32_MI16x16x1_SN_LDSB1_AA0_AFC1_AF1_AAIGTEn1_AAILTEn1_AFEM1_AFEM1_ASEM1_BL1_BS1_CLR1_CADS0_DSK0_DU32_DTL0_DTVA0_DTVB0_DTVSM0_EPS0_FDSI0_GRPM1_GRVWA8_GRVWB8_GSU3_GSUAMB_GSUC0_GSUWGMRR0_GLS0_ISA942_IU1_IA0_KLA_LBSPPA1024_LBSPPB2048_LBSPPM0_LPA0_LPB0_LPM0_LRVW4_LWPMn1_MIAV0_MIWT4_8_MDA2_MI16_16_16_1_MO40_NR0_NTn1_NTA4_NTB0_NTC0_NTD0_NTE0_NTM0_NTWS0_NEPBS16_NLCA1_NLCB1_ONLL1_PGR2_PLR1_PKA1_SGR1_SIA3_SLW1_SS1_SU0_SUM0_SUS0_SPO0_SRVW0_SSO0_SVW4_SK0_SKA0_SKXCCM0_SNLL0_TT1_1_TLDS0_ULSGRO0_USL1_UIOFGRO0_USFGROn1_VSn1_VWA4_VWB8_WSGRA0_WSGRB0_WS64_WG32_8_1_WGM1_WGMXCC8_WGMXCCGn1_WGR0
    SolutionIndex: 141
    SolutionNameMin: Cijk_Ailk_Bjlk_HHS_BH_Bias_HA_S_SAV_UserArgs_MT128x128x64_MI16x16x1_SN_LDSB1_AA0_AFC0_AF1_AFEM1_AFEM1_ASEM1_BL1_BS1_CLR1_CADS0_DU64_DTL0_DTVSM0_EPS0_FDSI0_GRPM1_GRVWA8_GRVWB8_GSU1_GSUAMB_GSUC0_GSUWGMRR0_GLS0_ISA942_IU1_IA0_KLA_LBSPPA1024_LBSPPB1024_LBSPPM0_LPA0_LPB0_LPM0_LRVW4_LWPMn1_MIAV0_MIWT4_4_MDA2_MI16_16_16_1_MO40_NR0_NTn1_NTA0_NTB0_NTC0_NTD4_NTE0_NTM0_NEPBS16_NLCA1_NLCB1_ONLL1_PGR2_PLR1_PKA1_SGR1_SIA3_SLW1_SS1_SU16_SUM0_SUS128_SPO0_SRVW0_SSO0_SVW4_SNLL0_TT1_1_TLDS0_ULSGRO0_USL1_UIOFGRO0_USFGROn1_VSn1_VWA4_VWB4_WSGRA1_WSGRB1_WS64_WG32_8_1_WGM8_WGMXCC8_WGMXCCG304_WGR0
    SolutionIndex: 142
    SolutionNameMin: Cijk_Ailk_Bjlk_HHS_BH_Bias_HA_S_SAV_UserArgs_MT128x128x64_MI16x16x1_SN_LDSB1_AA0_AFC1_AF1_AAIGTEn1_AAILTEn1_AFEM1_AFEM1_ASEM1_BL1_BS1_CLR1_CADS0_DSK0_DU64_DTL0_DTVA0_DTVB0_DTVSM0_EPS0_FDSI0_GRPM1_GRVWA8_GRVWB8_GSU1_GSUAMB_GSUC0_GSUWGMRR0_GLS0_ISA942_IU1_IA0_KLA_LBSPPA1024_LBSPPB1024_LBSPPM0_LPA0_LPB0_LPM0_LRVW4_LWPMn1_MIAV0_MIWT4_4_MDA2_MI16_16_16_1_MO40_NR0_NTn1_NTA0_NTB4_NTC0_NTD4_NTE0_NTM0_NTWS0_NEPBS16_NLCA1_NLCB1_ONLL1_PGR2_PLR1_PKA1_SGR1_SIA3_SLW1_SS1_SU16_SUM0_SUS128_SPO0_SRVW0_SSO0_SVW4_SK0_SKA0_SKXCCM0_SNLL0_TT1_1_TLDS0_ULSGRO0_USL1_UIOFGRO0_USFGROn1_VSn1_VWA4_VWB4_WSGRA0_WSGRB0_WS64_WG32_8_1_WGM6_WGMXCC8_WGMXCCGn1_WGR0
    SolutionIndex: 143
    SolutionNameMin: Cijk_Ailk_Bjlk_HHS_BH_Bias_HA_S_SAV_UserArgs_MT128x192x32_MI16x16x1_SN_LDSB1_AA0_AFC1_AF1_AAIGTEn1_AAILTEn1_AFEM1_AFEM1_ASEM1_BL1_BS1_CLR1_CADS0_DSK0_DU32_DTL0_DTVA0_DTVB0_DTVSM0_EPS0_FDSI0_GRPM1_GRVWA8_GRVWB8_GSU1_GSUAMB_GSUC0_GSUWGMRR0_GLS0_ISA942_IU1_IA0_KLA_LBSPPA1024_LBSPPB1536_LBSPPM0_LPA0_LPB16_LPM0_LRVW4_LWPMn1_MIAV0_MIWT8_3_MDA2_MI16_16_16_1_MO40_NR0_NTn1_NTA0_NTB4_NTC0_NTD4_NTE0_NTM0_NTWS0_NEPBS16_NLCA1_NLCB3_ONLL1_PGR2_PLR1_PKA1_SGR1_SIA3_SLW1_SS1_SU8_SUM0_SUS64_SPO0_SRVW0_SSO0_SVW8_SK0_SKA0_SKXCCM0_SNLL0_TT1_1_TLDS0_ULSGRO0_USL1_UIOFGRO0_USFGROn1_VSn1_VWA8_VWB1_WSGRA0_WSGRB0_WS64_WG16_16_1_WGM1_WGMXCC8_WGMXCCGn1_WGR0
    SolutionIndex: 144
    SolutionNameMin: Cijk_Ailk_Bjlk_HHS_BH_Bias_HA_S_SAV_UserArgs_MT128x192x32_MI16x16x1_SN_LDSB1_AA0_AFC1_AF1_AAIGTEn1_AAILTEn1_AFEM1_AFEM1_ASEM1_BL1_BS1_CLR1_CADS0_DSK0_DU32_DTL0_DTVA0_DTVB0_DTVSM0_EPS0_FDSI0_GRPM1_GRVWA8_GRVWB8_GSU1_GSUAMB_GSUC0_GSUWGMRR0_GLS0_ISA942_IU1_IA0_KLA_LBSPPA1024_LBSPPB1536_LBSPPM0_LPA0_LPB32_LPM0_LRVW4_LWPMn1_MIAV0_MIWT4_6_MDA2_MI16_16_16_1_MO40_NR0_NTn1_NTA0_NTB4_NTC0_NTD4_NTE0_NTM0_NTWS0_NEPBS16_NLCA1_NLCB3_ONLL1_PGR2_PLR1_PKA1_SGR1_SIA3_SLW1_SS1_SU8_SUM1_SUS64_SPO0_SRVW0_SSO0_SVW4_SK0_SKA0_SKXCCM0_SNLL0_TT1_1_TLDS0_ULSGRO0_USL1_UIOFGRO0_USFGROn1_VSn1_VWA4_VWB2_WSGRA0_WSGRB0_WS64_WG32_8_1_WGM6_WGMXCC8_WGMXCCGn1_WGR0
    SolutionIndex: 145
    SolutionNameMin: Cijk_Ailk_Bjlk_HHS_BH_Bias_HAS_SAV_UserArgs_MT128x192x64_MI16x16x1_SN_GSU1_GSUC0_GSUWGMRR0_K1_MIWT4_6_SU8_SUM0_SUS2048_WGM190_WGMXCC1_WGMXCCG0
    SolutionIndex: 146
    SolutionNameMin: Cijk_Ailk_Bjlk_HHS_BH_Bias_HA_S_SAV_UserArgs_MT128x128x32_MI16x16x1_SN_LDSB0_AA0_AFC1_AF1_AAIGTEn1_AAILTEn1_AFEM1_AFEM1_ASEM1_BL1_BS1_CLR1_CADS0_DSK0_DU32_DTL0_DTVA0_DTVB0_DTVSM0_EPS0_FDSI0_GRPM1_GRVWA8_GRVWB8_GSU1_GSUAMB_GSUC0_GSUWGMRR0_GLS0_ISA942_IU1_IA0_KLA_LBSPPA1024_LBSPPB1024_LBSPPM0_LPA0_LPB0_LPM0_LRVW4_LWPMn1_MIAV0_MIWT4_4_MDA2_MI16_16_16_1_MO40_NR0_NTn1_NTA0_NTB4_NTC0_NTD4_NTE0_NTM0_NTWS0_NEPBS16_NLCA1_NLCB1_ONLL1_PGR2_PLR1_PKA1_SGR1_SIA3_SLW1_SS1_SU8_SUM0_SUS64_SPO0_SRVW0_SSO0_SVW4_SK0_SKA0_SKXCCM0_SNLL0_TT1_1_TLDS0_ULSGRO0_USL1_UIOFGRO0_USFGROn1_VSn1_VWA4_VWB4_WSGRA0_WSGRB0_WS64_WG32_8_1_WGM1_WGMXCC8_WGMXCCGn1_WGR0
    SolutionIndex: 147
    SolutionNameMin: Cijk_Ailk_Bjlk_HHS_BH_UserArgs_MT128x256x32_MI16x16x1_SN_GSU1_K1_LBSPPA1024_LPA0_LPB0_MIAV0_MIWT4_8_NTA0_NTB0_NTC5_NTD5_SS1_SU0_SUM0_SUS0_SPO0_SVW4_VWA4_VWB8_WG32_8_1_WGM16
    SolutionIndex: 148
    SolutionNameMin: Cijk_Ailk_Bjlk_HHS_BH_Bias_HA_S_SAV_UserArgs_MT128x256x32_MI16x16x1_SN_LDSB1_AA0_AFC1_AF1_AAIGTEn1_AAILTEn1_AFEM1_AFEM1_ASEM1_BL1_BS1_CLR1_CADS0_DSK0_DU32_DTL0_DTVA0_DTVB0_DTVSM0_EPS0_FDSI0_GRPM1_GRVWA8_GRVWB8_GSU1_GSUAMB_GSUC0_GSUWGMRR0_GLS0_ISA942_IU1_IA0_KLA_LBSPPA1024_LBSPPB2048_LBSPPM0_LPA0_LPB0_LPM0_LRVW4_LWPMn1_MIAV0_MIWT4_8_MDA2_MI16_16_16_1_MO40_NR0_NTn1_NTA0_NTB4_NTC0_NTD4_NTE0_NTM0_NTWS0_NEPBS16_NLCA1_NLCB1_ONLL1_PGR2_PLR1_PKA1_SGR1_SIA3_SLW1_SS1_SU16_SUM0_SUS64_SPO0_SRVW0_SSO0_SVW4_SK0_SKA0_SKXCCM0_SNLL0_TT1_1_TLDS0_ULSGRO0_USL1_UIOFGRO0_USFGROn1_VSn1_VWA4_VWB8_WSGRA0_WSGRB0_WS64_WG32_8_1_WGM8_WGMXCC8_WGMXCCGn1_WGR0
    SolutionIndex: 149
    SolutionNameMin: Cijk_Ailk_Bjlk_HHS_BH_Bias_HA_S_SAV_UserArgs_MT16x16x256_MI16x16x1_SN_LDSB1_AA0_AFC1_AF1_AAIGTEn1_AAILTEn1_AFEM1_AFEM1_ASEM1_BL1_BS1_CLR1_CADS0_DSK0_DU256_DTL0_DTVA0_DTVB0_DTVSM0_EPS0_FDSI0_GRPM1_GRVWA8_GRVWB8_GSU7_GSUAMBSK_GSUC0_GSUWGMRR0_GLS0_ISA942_IU1_IA0_KLA_LBSPPA128_LBSPPB128_LBSPPM0_LPA16_LPB16_LPM0_LRVW4_LWPMn1_MIAV0_MIWT1_1_MDA2_MI16_16_16_1_MO40_NR0_NTn1_NTA0_NTB0_NTC0_NTD0_NTE0_NTM0_NTWS0_NEPBS0_NLCA1_NLCB1_ONLL1_PGR2_PLR1_PKA1_SGR1_SIA3_SLW1_SS1_SU0_SUM0_SUS0_SPO0_SRVW0_SSO0_SVW1_SK0_SKA0_SKXCCM0_SNLL0_TT1_1_TLDS0_ULSGRO0_USL1_UIOFGRO0_USFGROn1_VSn1_VWA1_VWB1_WSGRA0_WSGRB0_WS64_WG16_4_4_WGM1_WGMXCC8_WGMXCCGn1_WGR0
    SolutionIndex: 150
    SolutionNameMin: Cijk_Ailk_Bjlk_HHS_BH_Bias_HA_S_SAV_UserArgs_MT64x16x128_MI16x16x1_SN_LDSB1_AA0_AFC1_AF1_AAIGTEn1_AAILTEn1_AFEM1_AFEM1_ASEM1_BL1_BS1_CLR1_CADS0_DSK0_DU128_DTL0_DTVA0_DTVB0_DTVSM0_EPS0_FDSI0_GRPM1_GRVWA8_GRVWB1_GSU12_GSUAMBSK_GSUC0_GSUWGMRR0_GLS0_ISA942_IU1_IA0_KLA_LBSPPA512_LBSPPB128_LBSPPM0_LPA0_LPB16_LPM0_LRVW4_LWPMn1_MIAV0_MIWT4_1_MDA2_MI16_16_16_1_MO40_NR0_NTn1_NTA4_NTB0_NTC0_NTD0_NTE0_NTM0_NTWS0_NEPBS16_NLCA1_NLCB1_ONLL1_PGR2_PLR1_PKA1_SGR1_SIA3_SLW1_SS1_SU16_SUM0_SUS256_SPO0_SRVW0_SSO0_SVW4_SK0_SKA0_SKXCCM0_SNLL0_TT1_1_TLDS0_ULSGRO0_USL1_UIOFGRO0_USFGROn1_VSn1_VWA4_VWB1_WSGRA0_WSGRB0_WS64_WG16_4_4_WGM1_WGMXCC8_WGMXCCGn1_WGR0
    SolutionIndex: 151
    SolutionNameMin: Cijk_Ailk_Bjlk_HHS_BH_Bias_HA_S_SAV_UserArgs_MT16x16x64_MI16x16x1_SN_LDSB0_AA0_AFC1_AF1_AAIGTEn1_AAILTEn1_AFEM1_AFEM1_ASEM1_BL1_BS1_CLR0_CADS0_DSK0_DU64_DTL0_DTVA0_DTVB0_DTVSM0_EPS0_FDSI0_GRPM1_GRVWA2_GRVWB2_GSU3_GSUAMBSK_GSUC0_GSUWGMRR0_GLS0_ISA942_IU1_IA0_KLA_LBSPPA128_LBSPPB128_LBSPPM0_LPA16_LPB16_LPM0_LRVW4_LWPMn1_MIAV0_MIWT1_1_MDA2_MI16_16_16_1_MO40_NR0_NTn1_NTA0_NTB0_NTC0_NTD0_NTE0_NTM0_NTWS0_NEPBS0_NLCA1_NLCB1_ONLL1_PGR2_PLR0_PKA1_SGR1_SIA3_SLW1_SS1_SU0_SUM0_SUS0_SPO0_SRVW0_SSO0_SVW1_SK0_SKA0_SKXCCM0_SNLL0_TT1_1_TLDS0_ULSGRO0_USL1_UIOFGRO0_USFGROn1_VSn1_VWA1_VWB1_WSGRA0_WSGRB0_WS64_WG16_4_4_WGM1_WGMXCC8_WGMXCCGn1_WGR0
    SolutionIndex: 152
    SolutionNameMin: Cijk_Ailk_Bjlk_HHS_BH_Bias_HA_S_SAV_UserArgs_MT32x32x128_MI16x16x1_SN_LDSB1_AA0_AFC1_AF1_AAIGTEn1_AAILTEn1_AFEM1_AFEM1_ASEM1_BL1_BS1_CLR1_CADS0_DSK0_DU128_DTL0_DTVA0_DTVB0_DTVSM0_EPS0_FDSI0_GRPM1_GRVWA8_GRVWB8_GSU1_GSUAMB_GSUC0_GSUWGMRR0_GLS0_ISA942_IU1_IA0_KLA_LBSPPA256_LBSPPB256_LBSPPM0_LPA16_LPB16_LPM0_LRVW4_LWPMn1_MIAV0_MIWT1_1_MDA2_MI16_16_16_1_MO40_NR0_NTn1_NTA0_NTB4_NTC0_NTD4_NTE0_NTM0_NTWS0_NEPBS16_NLCA1_NLCB1_ONLL1_PGR2_PLR1_PKA1_SGR1_SIA3_SLW1_SS1_SU8_SUM0_SUS256_SPO0_SRVW0_SSO0_SVW1_SK0_SKA0_SKXCCM0_SNLL0_TT1_1_TLDS0_ULSGRO0_USL1_UIOFGRO0_USFGROn1_VSn1_VWA1_VWB1_WSGRA0_WSGRB0_WS64_WG32_8_1_WGM1_WGMXCC8_WGMXCCGn1_WGR0
    SolutionIndex: 153
    SolutionNameMin: Cijk_Ailk_Bjlk_HHS_BH_Bias_HA_S_SAV_UserArgs_MT64x32x64_MI16x16x1_SN_LDSB0_AA0_AFC1_AF1_AAIGTEn1_AAILTEn1_AFEM1_AFEM1_ASEM1_BL1_BS1_CLR1_CADS0_DSK0_DU64_DTL0_DTVA0_DTVB0_DTVSM0_EPS0_FDSI0_GRPM1_GRVWA8_GRVWB8_GSU1_GSUAMB_GSUC0_GSUWGMRR0_GLS0_ISA942_IU1_IA0_KLA_LBSPPA512_LBSPPB256_LBSPPM0_LPA32_LPB16_LPM0_LRVW4_LWPMn1_MIAV0_MIWT2_1_MDA2_MI16_16_16_1_MO40_NR0_NTn1_NTA0_NTB4_NTC0_NTD4_NTE0_NTM0_NTWS0_NEPBS16_NLCA1_NLCB1_ONLL1_PGR2_PLR1_PKA1_SGR1_SIA3_SLW1_SS1_SU8_SUM0_SUS128_SPO0_SRVW0_SSO0_SVW2_SK0_SKA0_SKXCCM0_SNLL0_TT1_1_TLDS0_ULSGRO0_USL1_UIOFGRO0_USFGROn1_VSn1_VWA2_VWB1_WSGRA0_WSGRB0_WS64_WG32_8_1_WGM1_WGMXCC8_WGMXCCGn1_WGR0
    SolutionIndex: 154
    SolutionNameMin: Cijk_Ailk_Bjlk_HHS_BH_Bias_HA_S_SAV_UserArgs_MT32x64x128_MI16x16x1_SN_LDSB1_AA0_AFC1_AF1_AAIGTEn1_AAILTEn1_AFEM1_AFEM1_ASEM1_BL1_BS1_CLR1_CADS0_DSK0_DU128_DTL0_DTVA0_DTVB0_DTVSM0_EPS0_FDSI0_GRPM1_GRVWA8_GRVWB8_GSU1_GSUAMB_GSUC0_GSUWGMRR0_GLS0_ISA942_IU1_IA0_KLA_LBSPPA256_LBSPPB512_LBSPPM0_LPA32_LPB16_LPM0_LRVW4_LWPMn1_MIAV0_MIWT2_1_MDA2_MI16_16_16_1_MO40_NR0_NTn1_NTA0_NTB0_NTC0_NTD4_NTE0_NTM0_NTWS0_NEPBS16_NLCA1_NLCB1_ONLL1_PGR2_PLR1_PKA1_SGR1_SIA3_SLW1_SS1_SU8_SUM0_SUS256_SPO0_SRVW0_SSO0_SVW2_SK0_SKA0_SKXCCM0_SNLL0_TT1_1_TLDS0_ULSGRO0_USL1_UIOFGRO0_USFGROn1_VSn1_VWA2_VWB1_WSGRA0_WSGRB0_WS64_WG16_16_1_WGM1_WGMXCC8_WGMXCCGn1_WGR0
    SolutionIndex: 155
    SolutionNameMin: Cijk_Ailk_Bjlk_HHS_BH_Bias_HA_S_SAV_UserArgs_MT64x64x64_MI16x16x1_SN_LDSB1_AA0_AFC1_AF1_AAIGTEn1_AAILTEn1_AFEM1_AFEM1_ASEM1_BL1_BS1_CLR1_CADS0_DSK0_DU64_DTL0_DTVA0_DTVB0_DTVSM0_EPS0_FDSI0_GRPM1_GRVWA8_GRVWB8_GSU6_GSUAMBSK_GSUC0_GSUWGMRR0_GLS0_ISA942_IU1_IA0_KLA_LBSPPA512_LBSPPB512_LBSPPM0_LPA0_LPB16_LPM0_LRVW4_LWPMn1_MIAV0_MIWT4_1_MDA2_MI16_16_16_1_MO40_NR0_NTn1_NTA0_NTB0_NTC0_NTD0_NTE0_NTM0_NTWS0_NEPBS0_NLCA1_NLCB1_ONLL1_PGR2_PLR1_PKA1_SGR1_SIA3_SLW1_SS1_SU0_SUM0_SUS0_SPO0_SRVW0_SSO0_SVW4_SK0_SKA0_SKXCCM0_SNLL0_TT1_1_TLDS0_ULSGRO0_USL1_UIOFGRO0_USFGROn1_VSn1_VWA4_VWB1_WSGRA0_WSGRB0_WS64_WG16_16_1_WGM1_WGMXCC8_WGMXCCGn1_WGR0
    SolutionIndex: 156
    SolutionNameMin: Cijk_Ailk_Bjlk_HHS_BH_Bias_HA_S_SAV_UserArgs_MT64x64x64_MI16x16x1_SN_LDSB1_AA0_AFC1_AF1_AAIGTEn1_AAILTEn1_AFEM1_AFEM1_ASEM1_BL1_BS1_CLR1_CADS0_DSK0_DU64_DTL0_DTVA0_DTVB0_DTVSM0_EPS0_FDSI0_GRPM1_GRVWA8_GRVWB8_GSU3_GSUAMBSK_GSUC0_GSUWGMRR0_GLS0_ISA942_IU1_IA0_KLA_LBSPPA512_LBSPPB512_LBSPPM0_LPA0_LPB16_LPM0_LRVW4_LWPMn1_MIAV0_MIWT4_1_MDA2_MI16_16_16_1_MO40_NR0_NTn1_NTA0_NTB0_NTC0_NTD0_NTE0_NTM0_NTWS0_NEPBS0_NLCA1_NLCB1_ONLL1_PGR2_PLR1_PKA1_SGR1_SIA3_SLW1_SS1_SU0_SUM0_SUS0_SPO0_SRVW0_SSO0_SVW4_SK0_SKA0_SKXCCM0_SNLL0_TT1_1_TLDS0_ULSGRO0_USL1_UIOFGRO0_USFGROn1_VSn1_VWA4_VWB1_WSGRA0_WSGRB0_WS64_WG16_16_1_WGM1_WGMXCC8_WGMXCCGn1_WGR0
    SolutionIndex: 157
    SolutionNameMin: Cijk_Ailk_Bjlk_HHS_BH_Bias_HA_S_SAV_UserArgs_MT64x256x64_MI16x16x1_SN_LDSB1_AA0_AFC1_AF1_AAIGTEn1_AAILTEn1_AFEM1_AFEM1_ASEM1_BL1_BS1_CLR1_CADS0_DSK0_DU64_DTL0_DTVA0_DTVB0_DTVSM0_EPS0_FDSI0_GRPM1_GRVWA8_GRVWB8_GSU6_GSUAMB_GSUC0_GSUWGMRR0_GLS0_ISA942_IU1_IA0_KLA_LBSPPA512_LBSPPB2048_LBSPPM0_LPA0_LPB0_LPM0_LRVW4_LWPMn1_MIAV0_MIWT4_4_MDA2_MI16_16_16_1_MO40_NR0_NTn1_NTA0_NTB0_NTC0_NTD0_NTE0_NTM0_NTWS0_NEPBS16_NLCA1_NLCB1_ONLL1_PGR2_PLR1_PKA1_SGR1_SIA3_SLW1_SS1_SU0_SUM0_SUS0_SPO0_SRVW0_SSO0_SVW4_SK0_SKA0_SKXCCM0_SNLL0_TT1_1_TLDS0_ULSGRO0_USL1_UIOFGRO0_USFGROn1_VSn1_VWA4_VWB4_WSGRA0_WSGRB0_WS64_WG16_16_1_WGM1_WGMXCC8_WGMXCCGn1_WGR0
    SolutionIndex: 158
    SolutionNameMin: Cijk_Ailk_Bjlk_HHS_BH_Bias_HA_S_SAV_UserArgs_MT64x64x64_MI16x16x1_SN_LDSB1_AA0_AFC1_AF1_AAIGTEn1_AAILTEn1_AFEM1_AFEM1_ASEM1_BL1_BS1_CLR1_CADS0_DSK0_DU64_DTL0_DTVA0_DTVB0_DTVSM0_EPS0_FDSI0_GRPM1_GRVWA8_GRVWB8_GSU1_GSUAMB_GSUC0_GSUWGMRR0_GLS0_ISA942_IU1_IA0_KLA_LBSPPA512_LBSPPB512_LBSPPM0_LPA32_LPB32_LPM0_LRVW4_LWPMn1_MIAV0_MIWT2_2_MDA2_MI16_16_16_1_MO40_NR0_NTn1_NTA0_NTB0_NTC0_NTD4_NTE0_NTM0_NTWS0_NEPBS16_NLCA1_NLCB1_ONLL1_PGR2_PLR1_PKA1_SGR1_SIA3_SLW1_SS1_SU8_SUM0_SUS128_SPO0_SRVW0_SSO0_SVW2_SK0_SKA0_SKXCCM0_SNLL0_TT1_1_TLDS0_ULSGRO0_USL1_UIOFGRO0_USFGROn1_VSn1_VWA2_VWB2_WSGRA0_WSGRB0_WS64_WG32_8_1_WGM1_WGMXCC8_WGMXCCGn1_WGR0
    SolutionIndex: 159
    SolutionNameMin: Cijk_Ailk_Bjlk_HHS_BH_Bias_HA_S_SAV_UserArgs_MT64x128x64_MI16x16x1_SN_LDSB1_AA0_AFC1_AF1_AAIGTEn1_AAILTEn1_AFEM1_AFEM1_ASEM1_BL1_BS1_CLR1_CADS0_DSK0_DU64_DTL0_DTVA0_DTVB0_DTVSM0_EPS0_FDSI0_GRPM1_GRVWA8_GRVWB8_GSU1_GSUAMB_GSUC0_GSUWGMRR0_GLS0_ISA942_IU1_IA0_KLA_LBSPPA512_LBSPPB1024_LBSPPM0_LPA0_LPB32_LPM0_LRVW4_LWPMn1_MIAV0_MIWT4_2_MDA2_MI16_16_16_1_MO40_NR0_NTn1_NTA0_NTB4_NTC0_NTD4_NTE0_NTM0_NTWS0_NEPBS16_NLCA1_NLCB1_ONLL1_PGR2_PLR1_PKA1_SGR1_SIA3_SLW1_SS1_SU16_SUM0_SUS128_SPO0_SRVW0_SSO0_SVW4_SK0_SKA0_SKXCCM0_SNLL0_TT1_1_TLDS0_ULSGRO0_USL1_UIOFGRO0_USFGROn1_VSn1_VWA4_VWB2_WSGRA0_WSGRB0_WS64_WG16_16_1_WGM8_WGMXCC8_WGMXCCGn1_WGR0
    SolutionIndex: 160
    SolutionNameMin: Cijk_Ailk_Bjlk_HHS_BH_Bias_HA_S_SAV_UserArgs_MT64x128x64_MI16x16x1_SN_LDSB1_AA0_AFC1_AF1_AAIGTEn1_AAILTEn1_AFEM1_AFEM1_ASEM1_BL1_BS1_CLR1_CADS0_DSK0_DU64_DTL0_DTVA0_DTVB0_DTVSM0_EPS0_FDSI0_GRPM1_GRVWA8_GRVWB8_GSU3_GSUAMBSK_GSUC0_GSUWGMRR0_GLS0_ISA942_IU1_IA0_KLA_LBSPPA512_LBSPPB1024_LBSPPM0_LPA0_LPB32_LPM0_LRVW4_LWPMn1_MIAV0_MIWT4_2_MDA2_MI16_16_16_1_MO40_NR0_NTn1_NTA0_NTB0_NTC0_NTD0_NTE0_NTM0_NTWS0_NEPBS0_NLCA1_NLCB1_ONLL1_PGR2_PLR1_PKA1_SGR1_SIA3_SLW1_SS1_SU0_SUM0_SUS0_SPO0_SRVW0_SSO0_SVW4_SK0_SKA0_SKXCCM0_SNLL0_TT1_1_TLDS0_ULSGRO0_USL1_UIOFGRO0_USFGROn1_VSn1_VWA4_VWB2_WSGRA0_WSGRB0_WS64_WG16_16_1_WGM1_WGMXCC8_WGMXCCGn1_WGR0
    SolutionIndex: 161
    SolutionNameMin: Cijk_Ailk_Bjlk_HHS_BH_Bias_HA_S_SAV_UserArgs_MT192x128x32_MI16x16x1_SN_LDSB1_AA0_AFC1_AF1_AAIGTEn1_AAILTEn1_AFEM1_AFEM1_ASEM1_BL1_BS1_CLR1_CADS0_DSK0_DU32_DTL0_DTVA0_DTVB0_DTVSM0_EPS0_FDSI0_GRPM1_GRVWA8_GRVWB8_GSU4_GSUAMB_GSUC0_GSUWGMRR0_GLS0_ISA942_IU1_IA0_KLA_LBSPPA1536_LBSPPB1024_LBSPPM0_LPA32_LPB0_LPM0_LRVW4_LWPMn1_MIAV0_MIWT6_4_MDA2_MI16_16_16_1_MO40_NR0_NTn1_NTA0_NTB0_NTC0_NTD0_NTE0_NTM0_NTWS0_NEPBS16_NLCA3_NLCB1_ONLL1_PGR2_PLR1_PKA1_SGR1_SIA3_SLW1_SS1_SU0_SUM0_SUS0_SPO0_SRVW0_SSO0_SVW2_SK0_SKA0_SKXCCM0_SNLL0_TT1_1_TLDS0_ULSGRO0_USL1_UIOFGRO0_USFGROn1_VSn1_VWA2_VWB4_WSGRA0_WSGRB0_WS64_WG32_8_1_WGM1_WGMXCC8_WGMXCCGn1_WGR0
    SolutionIndex: 162
    SolutionNameMin: Cijk_Ailk_Bjlk_HHS_BH_Bias_HA_S_SAV_UserArgs_MT64x128x32_MI16x16x1_SN_LDSB0_AA0_AFC1_AF1_AAIGTEn1_AAILTEn1_AFEM1_AFEM1_ASEM1_BL1_BS1_CLR1_CADS0_DSK0_DU32_DTL0_DTVA0_DTVB0_DTVSM0_EPS0_FDSI0_GRPM1_GRVWA8_GRVWB8_GSU1_GSUAMB_GSUC0_GSUWGMRR0_GLS0_ISA942_IU1_IA0_KLA_LBSPPA512_LBSPPB1024_LBSPPM0_LPA0_LPB32_LPM0_LRVW4_LWPMn1_MIAV0_MIWT4_2_MDA2_MI16_16_16_1_MO40_NR0_NTn1_NTA0_NTB0_NTC0_NTD4_NTE0_NTM0_NTWS0_NEPBS16_NLCA1_NLCB1_ONLL1_PGR2_PLR1_PKA1_SGR1_SIA3_SLW1_SS1_SU8_SUM0_SUS64_SPO0_SRVW0_SSO0_SVW4_SK0_SKA0_SKXCCM0_SNLL0_TT1_1_TLDS0_ULSGRO0_USL1_UIOFGRO0_USFGROn1_VSn1_VWA4_VWB2_WSGRA0_WSGRB0_WS64_WG16_16_1_WGM1_WGMXCC8_WGMXCCGn1_WGR0
    SolutionIndex: 163
    SolutionNameMin: Cijk_Ailk_Bjlk_HHS_BH_Bias_HA_S_SAV_UserArgs_MT192x192x32_MI16x16x1_SN_LDSB0_AA0_AFC1_AF1_AAIGTEn1_AAILTEn1_AFEM1_AFEM1_ASEM1_BL1_BS1_CLR1_CADS0_DSK0_DU32_DTL0_DTVA0_DTVB0_DTVSM0_EPS0_FDSI0_GRPM1_GRVWA8_GRVWB8_GSU3_GSUAMB_GSUC0_GSUWGMRR0_GLS0_ISA942_IU1_IA0_KLA_LBSPPA1536_LBSPPB1536_LBSPPM0_LPA32_LPB32_LPM0_LRVW4_LWPMn1_MIAV0_MIWT6_6_MDA2_MI16_16_16_1_MO40_NR0_NTn1_NTA0_NTB4_NTC0_NTD0_NTE0_NTM0_NTWS0_NEPBS16_NLCA3_NLCB3_ONLL1_PGR2_PLR1_PKA1_SGR1_SIA3_SLW1_SS1_SU0_SUM0_SUS0_SPO0_SRVW0_SSO0_SVW2_SK0_SKA0_SKXCCM0_SNLL0_TT1_1_TLDS0_ULSGRO0_USL1_UIOFGRO0_USFGROn1_VSn1_VWA2_VWB2_WSGRA0_WSGRB0_WS64_WG32_8_1_WGM1_WGMXCC8_WGMXCCGn1_WGR0
    SolutionIndex: 164
    SolutionNameMin: Cijk_Ailk_Bjlk_HHS_BH_Bias_HA_S_SAV_UserArgs_MT64x256x64_MI16x16x1_SN_LDSB1_AA0_AFC1_AF1_AAIGTEn1_AAILTEn1_AFEM1_AFEM1_ASEM1_BL1_BS1_CLR1_CADS0_DSK0_DU64_DTL0_DTVA0_DTVB0_DTVSM0_EPS0_FDSI0_GRPM1_GRVWA8_GRVWB8_GSU1_GSUAMB_GSUC0_GSUWGMRR0_GLS0_ISA942_IU1_IA0_KLA_LBSPPA512_LBSPPB2048_LBSPPM0_LPA0_LPB0_LPM0_LRVW4_LWPMn1_MIAV0_MIWT4_4_MDA2_MI16_16_16_1_MO40_NR0_NTn1_NTA0_NTB0_NTC0_NTD4_NTE0_NTM0_NTWS0_NEPBS16_NLCA1_NLCB1_ONLL1_PGR2_PLR1_PKA1_SGR1_SIA3_SLW1_SS1_SU16_SUM0_SUS128_SPO0_SRVW0_SSO0_SVW4_SK0_SKA0_SKXCCM0_SNLL0_TT1_1_TLDS0_ULSGRO0_USL1_UIOFGRO0_USFGROn1_VSn1_VWA4_VWB4_WSGRA0_WSGRB0_WS64_WG16_16_1_WGM6_WGMXCC8_WGMXCCGn1_WGR0
    SolutionIndex: 165
    SolutionNameMin: Cijk_Ailk_Bjlk_HHS_BH_Bias_HA_S_SAV_UserArgs_MT192x256x32_MI16x16x1_SN_LDSB0_AA0_AFC1_AF1_AAIGTEn1_AAILTEn1_AFEM1_AFEM1_ASEM1_BL1_BS1_CLR1_CADS0_DSK0_DU32_DTL0_DTVA0_DTVB0_DTVSM0_EPS0_FDSI0_GRPM1_GRVWA8_GRVWB8_GSU3_GSUAMB_GSUC0_GSUWGMRR0_GLS0_ISA942_IU1_IA0_KLA_LBSPPA1536_LBSPPB2048_LBSPPM0_LPA32_LPB0_LPM0_LRVW4_LWPMn1_MIAV0_MIWT6_8_MDA2_MI16_16_16_1_MO40_NR0_NTn1_NTA4_NTB0_NTC0_NTD0_NTE0_NTM0_NTWS0_NEPBS16_NLCA3_NLCB1_ONLL1_PGR2_PLR1_PKA1_SGR1_SIA3_SLW1_SS1_SU0_SUM0_SUS0_SPO0_SRVW0_SSO0_SVW2_SK0_SKA0_SKXCCM0_SNLL0_TT1_1_TLDS0_ULSGRO0_USL1_UIOFGRO0_USFGROn1_VSn1_VWA2_VWB8_WSGRA0_WSGRB0_WS64_WG32_8_1_WGM1_WGMXCC8_WGMXCCGn1_WGR0
    SolutionIndex: 166
    SolutionNameMin: Cijk_Ailk_Bjlk_HHS_BH_Bias_HA_S_SAV_UserArgs_MT192x128x32_MI16x16x1_SN_LDSB1_AA0_AFC1_AF1_AAIGTEn1_AAILTEn1_AFEM1_AFEM1_ASEM1_BL1_BS1_CLR1_CADS0_DSK0_DU32_DTL0_DTVA0_DTVB0_DTVSM0_EPS0_FDSI0_GRPM1_GRVWA8_GRVWB8_GSU1_GSUAMB_GSUC0_GSUWGMRR0_GLS0_ISA942_IU1_IA0_KLA_LBSPPA1536_LBSPPB1024_LBSPPM0_LPA0_LPB32_LPM0_LRVW4_LWPMn1_MIAV0_MIWT12_2_MDA2_MI16_16_16_1_MO40_NR0_NTn1_NTA0_NTB4_NTC0_NTD4_NTE0_NTM0_NTWS0_NEPBS16_NLCA3_NLCB1_ONLL1_PGR2_PLR1_PKA1_SGR1_SIA3_SLW1_SS1_SU8_SUM0_SUS64_SPO0_SRVW0_SSO0_SVW4_SK0_SKA0_SKXCCM0_SNLL0_TT1_1_TLDS0_ULSGRO0_USL1_UIOFGRO0_USFGROn1_VSn1_VWA4_VWB2_WSGRA0_WSGRB0_WS64_WG16_16_1_WGM1_WGMXCC8_WGMXCCGn1_WGR0
    SolutionIndex: 167
    SolutionNameMin: Cijk_Ailk_Bjlk_HHS_BH_Bias_HA_S_SAV_UserArgs_MT192x128x64_MI16x16x1_SN_LDSB1_AA0_AFC1_AF1_AAIGTEn1_AAILTEn1_AFEM1_AFEM1_ASEM1_BL1_BS1_CLR1_CADS0_DSK0_DU64_DTL0_DTVA0_DTVB0_DTVSM0_EPS0_FDSI0_GRPM1_GRVWA8_GRVWB8_GSU1_GSUAMB_GSUC0_GSUWGMRR0_GLS0_ISA942_IU1_IA0_KLA_LBSPPA1536_LBSPPB1024_LBSPPM0_LPA0_LPB32_LPM0_LRVW4_LWPMn1_MIAV0_MIWT12_2_MDA2_MI16_16_16_1_MO40_NR0_NTn1_NTA0_NTB4_NTC0_NTD4_NTE0_NTM0_NTWS0_NEPBS16_NLCA3_NLCB1_ONLL1_PGR2_PLR1_PKA1_SGR1_SIA3_SLW1_SS1_SU8_SUM0_SUS128_SPO0_SRVW0_SSO0_SVW4_SK0_SKA0_SKXCCM0_SNLL0_TT1_1_TLDS0_ULSGRO0_USL1_UIOFGRO0_USFGROn1_VSn1_VWA4_VWB2_WSGRA0_WSGRB0_WS64_WG16_16_1_WGM1_WGMXCC8_WGMXCCGn1_WGR0
    SolutionIndex: 168
    SolutionNameMin: Cijk_Ailk_Bjlk_HHS_BH_Bias_HA_S_SAV_UserArgs_MT192x128x64_MI16x16x1_SN_LDSB1_AA0_AFC1_AF1_AAIGTEn1_AAILTEn1_AFEM1_AFEM1_ASEM1_BL1_BS1_CLR1_CADS0_DSK0_DU64_DTL0_DTVA0_DTVB0_DTVSM0_EPS0_FDSI0_GRPM1_GRVWA8_GRVWB8_GSU1_GSUAMB_GSUC0_GSUWGMRR0_GLS0_ISA942_IU1_IA0_KLA_LBSPPA1536_LBSPPB1024_LBSPPM0_LPA32_LPB0_LPM0_LRVW4_LWPMn1_MIAV0_MIWT6_4_MDA2_MI16_16_16_1_MO40_NR0_NTn1_NTA0_NTB4_NTC0_NTD4_NTE0_NTM0_NTWS0_NEPBS16_NLCA3_NLCB1_ONLL1_PGR2_PLR1_PKA1_SGR1_SIA3_SLW1_SS1_SU16_SUM0_SUS128_SPO0_SRVW0_SSO0_SVW2_SK0_SKA0_SKXCCM0_SNLL0_TT1_1_TLDS0_ULSGRO0_USL1_UIOFGRO0_USFGROn1_VSn1_VWA2_VWB4_WSGRA0_WSGRB0_WS64_WG32_8_1_WGM8_WGMXCC8_WGMXCCGn1_WGR0
    SolutionIndex: 169
    SolutionNameMin: Cijk_Ailk_Bjlk_HHS_BH_Bias_HA_S_SAV_UserArgs_MT192x128x64_MI16x16x1_SN_LDSB1_AA0_AFC1_AF1_AAIGTEn1_AAILTEn1_AFEM1_AFEM1_ASEM1_BL1_BS1_CLR1_CADS0_DSK0_DU64_DTL0_DTVA0_DTVB0_DTVSM0_EPS0_FDSI0_GRPM1_GRVWA8_GRVWB8_GSU1_GSUAMB_GSUC0_GSUWGMRR0_GLS0_ISA942_IU1_IA0_KLA_LBSPPA1536_LBSPPB1024_LBSPPM0_LPA0_LPB32_LPM0_LRVW4_LWPMn1_MIAV0_MIWT12_2_MDA2_MI16_16_16_1_MO40_NR0_NTn1_NTA0_NTB4_NTC0_NTD4_NTE0_NTM0_NTWS0_NEPBS16_NLCA3_NLCB1_ONLL1_PGR2_PLR1_PKA1_SGR1_SIA3_SLW1_SS1_SU16_SUM0_SUS128_SPO0_SRVW0_SSO0_SVW4_SK0_SKA0_SKXCCM0_SNLL0_TT1_1_TLDS0_ULSGRO0_USL1_UIOFGRO0_USFGROn1_VSn1_VWA4_VWB2_WSGRA0_WSGRB0_WS64_WG16_16_1_WGM8_WGMXCC8_WGMXCCGn1_WGR0
    SolutionIndex: 170
    SolutionNameMin: Cijk_Ailk_Bjlk_HHS_BH_Bias_HA_S_SAV_UserArgs_MT192x192x32_MI16x16x1_SN_LDSB0_AA0_AFC1_AF1_AAIGTEn1_AAILTEn1_AFEM1_AFEM1_ASEM1_BL1_BS1_CLR1_CADS0_DSK0_DU32_DTL0_DTVA0_DTVB0_DTVSM0_EPS0_FDSI0_GRPM1_GRVWA8_GRVWB8_GSU1_GSUAMB_GSUC0_GSUWGMRR0_GLS0_ISA942_IU1_IA0_KLA_LBSPPA1536_LBSPPB1536_LBSPPM0_LPA0_LPB16_LPM0_LRVW4_LWPMn1_MIAV0_MIWT12_3_MDA2_MI16_16_16_1_MO40_NR0_NTn1_NTA0_NTB4_NTC0_NTD4_NTE0_NTM0_NTWS0_NEPBS16_NLCA3_NLCB3_ONLL1_PGR2_PLR1_PKA1_SGR1_SIA3_SLW1_SS1_SU8_SUM1_SUS64_SPO0_SRVW0_SSO0_SVW4_SK0_SKA0_SKXCCM0_SNLL0_TT1_1_TLDS0_ULSGRO0_USL1_UIOFGRO0_USFGROn1_VSn1_VWA4_VWB1_WSGRA0_WSGRB0_WS64_WG16_16_1_WGM6_WGMXCC8_WGMXCCGn1_WGR0
    SolutionIndex: 171
    SolutionNameMin: Cijk_Ailk_Bjlk_HHS_BH_Bias_HA_S_SAV_UserArgs_MT192x192x32_MI16x16x1_SN_LDSB0_AA0_AFC1_AF1_AAIGTEn1_AAILTEn1_AFEM1_AFEM1_ASEM1_BL1_BS1_CLR1_CADS0_DSK0_DU32_DTL0_DTVA0_DTVB0_DTVSM0_EPS0_FDSI0_GRPM1_GRVWA8_GRVWB8_GSU1_GSUAMB_GSUC0_GSUWGMRR0_GLS0_ISA942_IU1_IA0_KLA_LBSPPA1536_LBSPPB1536_LBSPPM0_LPA32_LPB32_LPM0_LRVW4_LWPMn1_MIAV0_MIWT6_6_MDA2_MI16_16_16_1_MO40_NR0_NTn1_NTA0_NTB4_NTC0_NTD4_NTE0_NTM0_NTWS0_NEPBS16_NLCA3_NLCB3_ONLL1_PGR2_PLR1_PKA1_SGR1_SIA3_SLW1_SS1_SU16_SUM0_SUS64_SPO0_SRVW0_SSO0_SVW2_SK0_SKA0_SKXCCM0_SNLL0_TT1_1_TLDS0_ULSGRO0_USL1_UIOFGRO0_USFGROn1_VSn1_VWA2_VWB2_WSGRA0_WSGRB0_WS64_WG32_8_1_WGM6_WGMXCC8_WGMXCCGn1_WGR0
    SolutionIndex: 172
    SolutionNameMin: Cijk_Ailk_Bjlk_HHS_BH_Bias_HA_S_SAV_UserArgs_MT192x192x32_MI16x16x1_SN_LDSB0_AA0_AFC1_AF1_AAIGTEn1_AAILTEn1_AFEM1_AFEM1_ASEM1_BL1_BS1_CLR1_CADS0_DSK0_DU32_DTL0_DTVA0_DTVB0_DTVSM0_EPS0_FDSI0_GRPM1_GRVWA8_GRVWB8_GSU1_GSUAMB_GSUC0_GSUWGMRR0_GLS0_ISA942_IU1_IA0_KLA_LBSPPA1536_LBSPPB1536_LBSPPM0_LPA32_LPB32_LPM0_LRVW4_LWPMn1_MIAV0_MIWT6_6_MDA2_MI16_16_16_1_MO40_NR0_NTn1_NTA0_NTB4_NTC0_NTD4_NTE0_NTM0_NTWS0_NEPBS16_NLCA3_NLCB3_ONLL1_PGR2_PLR1_PKA1_SGR1_SIA3_SLW1_SS1_SU8_SUM0_SUS64_SPO0_SRVW0_SSO0_SVW2_SK0_SKA0_SKXCCM0_SNLL0_TT1_1_TLDS0_ULSGRO0_USL1_UIOFGRO0_USFGROn1_VSn1_VWA2_VWB2_WSGRA0_WSGRB0_WS64_WG32_8_1_WGM1_WGMXCC8_WGMXCCGn1_WGR0
    SolutionIndex: 173
    SolutionNameMin: Cijk_Ailk_Bjlk_HHS_BH_Bias_HA_S_SAV_UserArgs_MT192x192x64_MI16x16x1_SN_LDSB1_AA0_AFC1_AF1_AAIGTEn1_AAILTEn1_AFEM1_AFEM1_ASEM1_BL1_BS1_CLR1_CADS0_DSK0_DU64_DTL0_DTVA0_DTVB0_DTVSM0_EPS0_FDSI0_GRPM1_GRVWA8_GRVWB8_GSU1_GSUAMB_GSUC0_GSUWGMRR0_GLS0_ISA942_IU1_IA0_KLA_LBSPPA1536_LBSPPB1536_LBSPPM0_LPA32_LPB32_LPM0_LRVW4_LWPMn1_MIAV0_MIWT6_6_MDA2_MI16_16_16_1_MO40_NR0_NTn1_NTA0_NTB4_NTC0_NTD4_NTE0_NTM0_NTWS0_NEPBS16_NLCA3_NLCB3_ONLL1_PGR2_PLR1_PKA1_SGR1_SIA3_SLW1_SS1_SU16_SUM0_SUS128_SPO0_SRVW0_SSO0_SVW2_SK0_SKA0_SKXCCM0_SNLL0_TT1_1_TLDS0_ULSGRO0_USL1_UIOFGRO0_USFGROn1_VSn1_VWA2_VWB2_WSGRA0_WSGRB0_WS64_WG32_8_1_WGM6_WGMXCC8_WGMXCCGn1_WGR0
    SolutionIndex: 174
    SolutionNameMin: Cijk_Ailk_Bjlk_HHS_BH_Bias_HA_S_SAV_UserArgs_MT192x128x32_MI16x16x1_SN_LDSB1_AA0_AFC1_AF1_AAIGTEn1_AAILTEn1_AFEM1_AFEM1_ASEM1_BL1_BS1_CLR1_CADS0_DSK0_DU32_DTL0_DTVA0_DTVB0_DTVSM0_EPS0_FDSI0_GRPM1_GRVWA8_GRVWB8_GSU1_GSUAMB_GSUC0_GSUWGMRR0_GLS0_ISA942_IU1_IA0_KLA_LBSPPA1536_LBSPPB1024_LBSPPM0_LPA0_LPB32_LPM0_LRVW4_LWPMn1_MIAV0_MIWT12_2_MDA2_MI16_16_16_1_MO40_NR0_NTn1_NTA0_NTB4_NTC0_NTD4_NTE0_NTM0_NTWS0_NEPBS16_NLCA3_NLCB1_ONLL1_PGR2_PLR1_PKA1_SGR1_SIA3_SLW1_SS1_SU16_SUM0_SUS64_SPO0_SRVW0_SSO0_SVW4_SK0_SKA0_SKXCCM0_SNLL0_TT1_1_TLDS0_ULSGRO0_USL1_UIOFGRO0_USFGROn1_VSn1_VWA4_VWB2_WSGRA0_WSGRB0_WS64_WG16_16_1_WGM8_WGMXCC8_WGMXCCGn1_WGR0
    SolutionIndex: 175
    SolutionNameMin: Cijk_Ailk_Bjlk_HHS_BH_MT256x128x32_MI16x16x1_SN_LDSB1_GRVWB8_GSU1_LBSPPA2048_LBSPPB1024_LPA16_LPB48_MIWT4_8_NLCB1_SU0_SUM0_SUS0_SPO0_SVW4_VWA4_VWB8_WG64_4_1_WGM1
    SolutionIndex: 176
    SolutionNameMin: Cijk_Ailk_Bjlk_HHS_BH_Bias_HA_S_SAV_UserArgs_MT192x256x32_MI16x16x1_SN_LDSB0_AA0_AFC1_AF1_AAIGTEn1_AAILTEn1_AFEM1_AFEM1_ASEM1_BL1_BS1_CLR1_CADS0_DSK0_DU32_DTL0_DTVA0_DTVB0_DTVSM0_EPS0_FDSI0_GRPM1_GRVWA8_GRVWB8_GSU1_GSUAMB_GSUC0_GSUWGMRR0_GLS0_ISA942_IU1_IA0_KLA_LBSPPA1536_LBSPPB2048_LBSPPM0_LPA32_LPB0_LPM0_LRVW4_LWPMn1_MIAV0_MIWT6_8_MDA2_MI16_16_16_1_MO40_NR0_NTn1_NTA0_NTB4_NTC0_NTD4_NTE0_NTM0_NTWS0_NEPBS16_NLCA3_NLCB1_ONLL1_PGR2_PLR1_PKA1_SGR1_SIA3_SLW1_SS1_SU8_SUM1_SUS64_SPO0_SRVW0_SSO0_SVW2_SK0_SKA0_SKXCCM0_SNLL0_TT1_1_TLDS0_ULSGRO0_USL1_UIOFGRO0_USFGROn1_VSn1_VWA2_VWB8_WSGRA0_WSGRB0_WS64_WG32_8_1_WGM6_WGMXCC8_WGMXCCGn1_WGR0
    SolutionIndex: 177
    SolutionNameMin: Cijk_Ailk_Bjlk_HHS_BH_Bias_HA_S_SAV_UserArgs_MT192x256x32_MI16x16x1_SN_LDSB0_AA0_AFC1_AF1_AAIGTEn1_AAILTEn1_AFEM1_AFEM1_ASEM1_BL1_BS1_CLR1_CADS0_DSK0_DU32_DTL0_DTVA0_DTVB0_DTVSM0_EPS0_FDSI0_GRPM1_GRVWA8_GRVWB8_GSU1_GSUAMB_GSUC0_GSUWGMRR0_GLS0_ISA942_IU1_IA0_KLA_LBSPPA1536_LBSPPB2048_LBSPPM0_LPA32_LPB0_LPM0_LRVW4_LWPMn1_MIAV0_MIWT6_8_MDA2_MI16_16_16_1_MO40_NR0_NTn1_NTA0_NTB0_NTC0_NTD4_NTE0_NTM0_NTWS0_NEPBS16_NLCA3_NLCB1_ONLL1_PGR2_PLR1_PKA1_SGR1_SIA3_SLW1_SS1_SU16_SUM0_SUS64_SPO0_SRVW0_SSO0_SVW2_SK0_SKA0_SKXCCM0_SNLL0_TT1_1_TLDS0_ULSGRO0_USL1_UIOFGRO0_USFGROn1_VSn1_VWA2_VWB8_WSGRA0_WSGRB0_WS64_WG32_8_1_WGM6_WGMXCC8_WGMXCCGn1_WGR0
    SolutionIndex: 178
    SolutionNameMin: Cijk_Ailk_Bjlk_HHS_BH_Bias_HA_S_SAV_UserArgs_MT16x16x256_MI16x16x1_SN_LDSB1_AA0_AFC1_AF1_AAIGTEn1_AAILTEn1_AFEM1_AFEM1_ASEM1_BL1_BS1_CLR1_CADS0_DSK0_DU256_DTL0_DTVA0_DTVB0_DTVSM0_EPS0_FDSI0_GRPM1_GRVWA8_GRVWB8_GSU4_GSUAMBSK_GSUC0_GSUWGMRR0_GLS0_ISA942_IU1_IA0_KLA_LBSPPA128_LBSPPB128_LBSPPM0_LPA16_LPB16_LPM0_LRVW4_LWPMn1_MIAV0_MIWT1_1_MDA2_MI16_16_16_1_MO40_NR0_NTn1_NTA0_NTB0_NTC0_NTD0_NTE0_NTM0_NTWS0_NEPBS0_NLCA1_NLCB1_ONLL1_PGR2_PLR1_PKA1_SGR1_SIA3_SLW1_SS1_SU0_SUM0_SUS0_SPO0_SRVW0_SSO0_SVW1_SK0_SKA0_SKXCCM0_SNLL0_TT1_1_TLDS0_ULSGRO0_USL1_UIOFGRO0_USFGROn1_VSn1_VWA1_VWB1_WSGRA0_WSGRB0_WS64_WG16_4_4_WGM1_WGMXCC8_WGMXCCGn1_WGR0
    SolutionIndex: 179
    SolutionNameMin: Cijk_Ailk_Bjlk_HHS_BH_Bias_HA_S_SAV_UserArgs_MT16x32x128_MI16x16x1_SN_LDSB0_AA0_AFC1_AF1_AAIGTEn1_AAILTEn1_AFEM1_AFEM1_ASEM1_BL1_BS1_CLR1_CADS0_DSK0_DU128_DTL0_DTVA0_DTVB0_DTVSM0_EPS0_FDSI0_GRPM1_GRVWA4_GRVWB8_GSU1_GSUAMB_GSUC0_GSUWGMRR0_GLS0_ISA942_IU1_IA0_KLA_LDSTI0_LBSPPA128_LBSPPB256_LBSPPM0_LPA16_LPB32_LPM0_LRVW4_LWPMn1_MIAV0_MIWT1_2_MDA2_MI16_16_16_1_MO40_MPO0_NR0_NTn1_NTA0_NTB0_NTC0_NTD4_NTE0_NTM0_NTWS0_NEPBS16_NLCA1_NLCB1_ONLL1_PGR2_PLR1_PKA1_SGR1_SIA3_SLW1_SS1_SU8_SUM1_SUS256_SPO0_SRVW0_SSO0_SVW1_SK0_SKA0_SKXCCM0_SNLL0_TT1_1_TLDS0_ULSGRO0_USL1_UIOFGRO0_USFGROn1_VSn1_VWA1_VWB2_WSGRA0_WSGRB0_WSK0_WS64_WG16_4_4_WGM1_WGMXCC8_WGMXCCGn1_WGR0
    SolutionIndex: 180
    SolutionNameMin: Cijk_Ailk_Bjlk_HHS_BH_Bias_HA_S_SAV_UserArgs_MT64x16x128_MI16x16x1_SN_LDSB1_AA0_AFC1_AF1_AAIGTEn1_AAILTEn1_AFEM1_AFEM1_ASEM1_BL1_BS1_CLR1_CADS0_DSK0_DU128_DTL0_DTVA0_DTVB0_DTVSM0_EPS0_FDSI0_GRPM1_GRVWA8_GRVWB4_GSU1_GSUAMB_GSUC0_GSUWGMRR0_GLS0_ISA942_IU1_IA0_KLA_LDSTI0_LBSPPA512_LBSPPB128_LBSPPM0_LPA0_LPB16_LPM0_LRVW4_LWPMn1_MIAV0_MIWT4_1_MDA2_MI16_16_16_1_MO40_MPO0_NR0_NTn1_NTA0_NTB0_NTC0_NTD4_NTE0_NTM0_NTWS0_NEPBS16_NLCA1_NLCB1_ONLL1_PGR2_PLR1_PKA1_SGR1_SIA3_SLW1_SS1_SU8_SUM1_SUS256_SPO0_SRVW0_SSO0_SVW4_SK0_SKA0_SKXCCM0_SNLL0_TT1_1_TLDS0_ULSGRO0_USL1_UIOFGRO0_USFGROn1_VSn1_VWA4_VWB1_WSGRA0_WSGRB0_WSK0_WS64_WG16_4_4_WGM1_WGMXCC8_WGMXCCGn1_WGR0
    SolutionIndex: 181
    SolutionNameMin: Cijk_Ailk_Bjlk_HHS_BH_UserArgs_MT64x128x64_MI16x16x1_SN_GSU8_GSUC0_GSUWGMRR0_K1_MIWT4_2_SU2_SUM2_SUS256_WGM0_WGMXCC8_WGMXCCG0
    SolutionIndex: 182
    SolutionNameMin: Cijk_Ailk_Bjlk_HHS_BH_Bias_HA_S_SAV_UserArgs_MT64x64x64_MI16x16x1_SN_LDSB1_AA0_AFC1_AF1_AAIGTEn1_AAILTEn1_AFEM1_AFEM1_ASEM1_BL1_BS1_CLR1_CADS0_DSK0_DU64_DTL0_DTVA0_DTVB0_DTVSM0_EPS0_FDSI0_GRPM1_GRVWA8_GRVWB8_GSU5_GSUAMBSK_GSUC0_GSUWGMRR0_GLS0_ISA942_IU1_IA0_KLA_LBSPPA512_LBSPPB512_LBSPPM0_LPA0_LPB16_LPM0_LRVW4_LWPMn1_MIAV0_MIWT4_1_MDA2_MI16_16_16_1_MO40_NR0_NTn1_NTA0_NTB0_NTC0_NTD0_NTE0_NTM0_NTWS0_NEPBS0_NLCA1_NLCB1_ONLL1_PGR2_PLR1_PKA1_SGR1_SIA3_SLW1_SS1_SU0_SUM0_SUS0_SPO0_SRVW0_SSO0_SVW4_SK0_SKA0_SKXCCM0_SNLL0_TT1_1_TLDS0_ULSGRO0_USL1_UIOFGRO0_USFGROn1_VSn1_VWA4_VWB1_WSGRA0_WSGRB0_WS64_WG16_16_1_WGM1_WGMXCC8_WGMXCCGn1_WGR0
    SolutionIndex: 183
    SolutionNameMin: Cijk_Ailk_Bjlk_HHS_BH_Bias_HA_S_SAV_UserArgs_MT32x64x64_MI16x16x1_SN_LDSB0_AA0_AFC1_AF1_AAIGTEn1_AAILTEn1_AFEM1_AFEM1_ASEM1_BL1_BS1_CLR1_CADS0_DSK0_DU64_DTL0_DTVA0_DTVB0_DTVSM0_EPS0_FDSI0_GRPM1_GRVWA8_GRVWB8_GSU1_GSUAMB_GSUC0_GSUWGMRR0_GLS0_ISA942_IU1_IA0_KLA_LBSPPA256_LBSPPB512_LBSPPM0_LPA32_LPB16_LPM0_LRVW4_LWPMn1_MIAV0_MIWT2_1_MDA2_MI16_16_16_1_MO40_NR0_NTn1_NTA0_NTB0_NTC0_NTD4_NTE0_NTM0_NTWS0_NEPBS16_NLCA1_NLCB1_ONLL1_PGR2_PLR1_PKA1_SGR1_SIA3_SLW1_SS1_SU16_SUM0_SUS128_SPO0_SRVW0_SSO0_SVW2_SK0_SKA0_SKXCCM0_SNLL0_TT1_1_TLDS0_ULSGRO0_USL1_UIOFGRO0_USFGROn1_VSn1_VWA2_VWB1_WSGRA0_WSGRB0_WS64_WG16_16_1_WGM8_WGMXCC8_WGMXCCGn1_WGR0
    SolutionIndex: 184
    SolutionNameMin: Cijk_Ailk_Bjlk_HHS_BH_Bias_HA_S_SAV_UserArgs_MT128x64x64_MI16x16x1_SN_LDSB1_AA0_AFC1_AF1_AAIGTEn1_AAILTEn1_AFEM1_AFEM1_ASEM1_BL1_BS1_CLR1_CADS0_DSK0_DU64_DTL0_DTVA0_DTVB0_DTVSM0_EPS0_FDSI0_GRPM1_GRVWA8_GRVWB8_GSU4_GSUAMBSK_GSUC0_GSUWGMRR0_GLS0_ISA942_IU1_IA0_KLA_LBSPPA1024_LBSPPB512_LBSPPM0_LPA0_LPB32_LPM0_LRVW4_LWPMn1_MIAV0_MIWT4_2_MDA2_MI16_16_16_1_MO40_NR0_NTn1_NTA0_NTB0_NTC0_NTD0_NTE0_NTM0_NTWS0_NEPBS0_NLCA1_NLCB1_ONLL1_PGR2_PLR1_PKA1_SGR1_SIA3_SLW1_SS1_SU0_SUM0_SUS0_SPO0_SRVW0_SSO0_SVW4_SK0_SKA0_SKXCCM0_SNLL0_TT1_1_TLDS0_ULSGRO0_USL1_UIOFGRO0_USFGROn1_VSn1_VWA4_VWB2_WSGRA0_WSGRB0_WS64_WG32_8_1_WGM1_WGMXCC8_WGMXCCGn1_WGR0
    SolutionIndex: 185
    SolutionNameMin: Cijk_Ailk_Bjlk_HHS_BH_Bias_HA_S_SAV_UserArgs_MT64x64x64_MI16x16x1_SN_LDSB1_AA0_AFC1_AF1_AAIGTEn1_AAILTEn1_AFEM1_AFEM1_ASEM1_BL1_BS1_CLR1_CADS0_DSK0_DU64_DTL0_DTVA0_DTVB0_DTVSM0_EPS0_FDSI0_GRPM1_GRVWA8_GRVWB8_GSU1_GSUAMB_GSUC0_GSUWGMRR0_GLS0_ISA942_IU1_IA0_KLA_LBSPPA512_LBSPPB512_LBSPPM0_LPA0_LPB16_LPM0_LRVW4_LWPMn1_MIAV0_MIWT4_1_MDA2_MI16_16_16_1_MO40_NR0_NTn1_NTA0_NTB0_NTC0_NTD4_NTE0_NTM0_NTWS0_NEPBS16_NLCA1_NLCB1_ONLL1_PGR2_PLR1_PKA1_SGR1_SIA3_SLW1_SS1_SU16_SUM0_SUS128_SPO0_SRVW0_SSO0_SVW4_SK0_SKA0_SKXCCM0_SNLL0_TT1_1_TLDS0_ULSGRO0_USL1_UIOFGRO0_USFGROn1_VSn1_VWA4_VWB1_WSGRA0_WSGRB0_WS64_WG16_16_1_WGM8_WGMXCC8_WGMXCCGn1_WGR0
    SolutionIndex: 186
    SolutionNameMin: Cijk_Ailk_Bjlk_HHS_BH_Bias_HA_S_SAV_UserArgs_MT256x96x64_MI16x16x1_SN_LDSB1_AA0_AFC1_AF1_AAIGTEn1_AAILTEn1_AFEM1_AFEM1_ASEM1_BL1_BS1_CLR1_CADS0_DSK0_DU64_DTL0_DTVA0_DTVB0_DTVSM0_EPS0_FDSI0_GRPM1_GRVWA8_GRVWB8_GSU3_GSUAMB_GSUC0_GSUWGMRR0_GLS0_ISA942_IU1_IA0_KLA_LBSPPA2048_LBSPPB768_LBSPPM0_LPA0_LPB32_LPM0_LRVW4_LWPMn1_MIAV0_MIWT4_6_MDA2_MI16_16_16_1_MO40_NR0_NTn1_NTA0_NTB0_NTC0_NTD0_NTE0_NTM0_NTWS0_NEPBS16_NLCA1_NLCB3_ONLL1_PGR2_PLR1_PKA1_SGR1_SIA3_SLW1_SS1_SU0_SUM0_SUS0_SPO0_SRVW0_SSO0_SVW4_SK0_SKA0_SKXCCM0_SNLL0_TT1_1_TLDS0_ULSGRO0_USL1_UIOFGRO0_USFGROn1_VSn1_VWA4_VWB2_WSGRA0_WSGRB0_WS64_WG64_4_1_WGM1_WGMXCC8_WGMXCCGn1_WGR0
    SolutionIndex: 187
    SolutionNameMin: Cijk_Ailk_Bjlk_HHS_BH_UserArgs_MT128x128x64_MI16x16x1_SN_GSU1_GSUC0_GSUWGMRR0_K1_MIWT4_4_SU8_SUM2_SUS128_WGM6_WGMXCC8_WGMXCCGn1
    SolutionIndex: 188
    SolutionNameMin: Cijk_Ailk_Bjlk_HHS_BH_Bias_HA_S_SAV_UserArgs_MT128x192x64_MI16x16x1_SN_LDSB1_AA0_AFC1_AF1_AAIGTEn1_AAILTEn1_AFEM1_AFEM1_ASEM1_BL1_BS1_CLR1_CADS0_DSK0_DU64_DTL0_DTVA0_DTVB0_DTVSM0_EPS0_FDSI0_GRPM1_GRVWA8_GRVWB8_GSU1_GSUAMB_GSUC0_GSUWGMRR0_GLS0_ISA942_IU1_IA0_KLA_LBSPPA1024_LBSPPB1536_LBSPPM0_LPA0_LPB32_LPM0_LRVW4_LWPMn1_MIAV0_MIWT4_6_MDA2_MI16_16_16_1_MO40_NR0_NTn1_NTA0_NTB4_NTC0_NTD4_NTE0_NTM0_NTWS0_NEPBS16_NLCA1_NLCB3_ONLL1_PGR2_PLR1_PKA1_SGR1_SIA3_SLW1_SS1_SU8_SUM0_SUS128_SPO0_SRVW0_SSO0_SVW4_SK0_SKA0_SKXCCM0_SNLL0_TT1_1_TLDS0_ULSGRO0_USL1_UIOFGRO0_USFGROn1_VSn1_VWA4_VWB2_WSGRA0_WSGRB0_WS64_WG32_8_1_WGM1_WGMXCC8_WGMXCCGn1_WGR0
    SolutionIndex: 189
    SolutionNameMin: Cijk_Ailk_Bjlk_HHS_BH_Bias_HA_S_SAV_UserArgs_MT128x192x32_MI16x16x1_SN_LDSB1_AA0_AFC1_AF1_AAIGTEn1_AAILTEn1_AFEM1_AFEM1_ASEM1_BL1_BS1_CLR1_CADS0_DSK0_DU32_DTL0_DTVA0_DTVB0_DTVSM0_EPS0_FDSI0_GRPM1_GRVWA8_GRVWB8_GSU1_GSUAMB_GSUC0_GSUWGMRR0_GLS0_ISA942_IU1_IA0_KLA_LBSPPA1024_LBSPPB1536_LBSPPM0_LPA0_LPB32_LPM0_LRVW4_LWPMn1_MIAV0_MIWT4_6_MDA2_MI16_16_16_1_MO40_NR0_NTn1_NTA0_NTB4_NTC0_NTD4_NTE0_NTM0_NTWS0_NEPBS16_NLCA1_NLCB3_ONLL1_PGR2_PLR1_PKA1_SGR1_SIA3_SLW1_SS1_SU8_SUM0_SUS64_SPO0_SRVW0_SSO0_SVW4_SK0_SKA0_SKXCCM0_SNLL0_TT1_1_TLDS0_ULSGRO0_USL1_UIOFGRO0_USFGROn1_VSn1_VWA4_VWB2_WSGRA0_WSGRB0_WS64_WG32_8_1_WGM1_WGMXCC8_WGMXCCGn1_WGR0
    SolutionIndex: 190
    SolutionNameMin: Cijk_Ailk_Bjlk_HHS_BH_Bias_HA_S_SAV_UserArgs_MT128x512x32_MI16x16x1_SN_LDSB1_AA0_AFC1_AF1_AAIGTEn1_AAILTEn1_AFEM1_AFEM1_ASEM1_BL1_BS1_CLR1_CADS0_DSK0_DU32_DTL0_DTVA0_DTVB0_DTVSM0_EPS0_FDSI0_GRPM1_GRVWA8_GRVWB8_GSU3_GSUAMB_GSUC0_GSUWGMRR0_GLS0_ISA942_IU1_IA0_KLA_LBSPPA1024_LBSPPB4096_LBSPPM0_LPA0_LPB0_LPM0_LRVW4_LWPMn1_MIAV0_MIWT4_16_MDA2_MI16_16_16_1_MO40_NR0_NTn1_NTA4_NTB0_NTC0_NTD0_NTE0_NTM0_NTWS0_NEPBS16_NLCA1_NLCB1_ONLL1_PGR2_PLR1_PKA1_SGR1_SIA3_SLW1_SS1_SU0_SUM0_SUS0_SPO0_SRVW0_SSO0_SVW4_SK0_SKA0_SKXCCM0_SNLL0_TT1_1_TLDS0_ULSGRO0_USL1_UIOFGRO0_USFGROn1_VSn1_VWA4_VWB8_WSGRA0_WSGRB0_WS64_WG32_8_1_WGM1_WGMXCC8_WGMXCCGn1_WGR0
    SolutionIndex: 191
    SolutionNameMin: Cijk_Ailk_Bjlk_HHS_BH_Bias_HA_S_SAV_UserArgs_MT256x128x32_MI16x16x1_SN_LDSB1_AA0_AFC1_AF1_AAIGTEn1_AAILTEn1_AFEM1_AFEM1_ASEM1_BL1_BS1_CLR1_CADS0_DSK0_DU32_DTL0_DTVA0_DTVB0_DTVSM0_EPS0_FDSI0_GRPM1_GRVWA8_GRVWB8_GSU1_GSUAMB_GSUC0_GSUWGMRR0_GLS0_ISA942_IU1_IA0_KLA_LBSPPA2048_LBSPPB1024_LBSPPM0_LPA0_LPB0_LPM0_LRVW4_LWPMn1_MIAV0_MIWT4_8_MDA2_MI16_16_16_1_MO40_NR0_NTn1_NTA0_NTB4_NTC0_NTD4_NTE0_NTM0_NTWS0_NEPBS16_NLCA1_NLCB1_ONLL1_PGR2_PLR1_PKA1_SGR1_SIA3_SLW1_SS1_SU8_SUM0_SUS64_SPO0_SRVW0_SSO0_SVW4_SK0_SKA0_SKXCCM0_SNLL0_TT1_1_TLDS0_ULSGRO0_USL1_UIOFGRO0_USFGROn1_VSn1_VWA4_VWB8_WSGRA0_WSGRB0_WS64_WG64_4_1_WGM1_WGMXCC8_WGMXCCGn1_WGR0
    SolutionIndex: 192
    SolutionNameMin: Cijk_Ailk_Bjlk_HHS_BH_Bias_HA_S_SAV_UserArgs_MT128x256x32_MI16x16x1_SN_LDSB1_AA0_AFC1_AF1_AAIGTEn1_AAILTEn1_AFEM1_AFEM1_ASEM1_BL1_BS1_CLR1_CADS0_DSK0_DU32_DTL0_DTVA0_DTVB0_DTVSM0_EPS0_FDSI0_GRPM1_GRVWA8_GRVWB8_GSU1_GSUAMB_GSUC0_GSUWGMRR0_GLS0_ISA942_IU1_IA0_KLA_LBSPPA1024_LBSPPB2048_LBSPPM0_LPA0_LPB0_LPM0_LRVW4_LWPMn1_MIAV0_MIWT4_8_MDA2_MI16_16_16_1_MO40_NR0_NTn1_NTA0_NTB0_NTC0_NTD4_NTE0_NTM0_NTWS0_NEPBS16_NLCA1_NLCB1_ONLL1_PGR2_PLR1_PKA1_SGR1_SIA3_SLW1_SS1_SU8_SUM0_SUS64_SPO0_SRVW0_SSO0_SVW4_SK0_SKA0_SKXCCM0_SNLL0_TT1_1_TLDS0_ULSGRO0_USL1_UIOFGRO0_USFGROn1_VSn1_VWA4_VWB8_WSGRA0_WSGRB0_WS64_WG32_8_1_WGM1_WGMXCC8_WGMXCCGn1_WGR0
    SolutionIndex: 193
    SolutionNameMin: Cijk_Ailk_Bjlk_HHS_BH_Bias_HA_S_SAV_UserArgs_MT256x192x32_MI16x16x1_SN_LDSB0_AA0_AFC1_AF1_AAIGTEn1_AAILTEn1_AFEM1_AFEM1_ASEM1_BL1_BS1_CLR1_CADS0_DSK0_DU32_DTL0_DTVA0_DTVB0_DTVSM0_EPS0_FDSI0_GRPM1_GRVWA8_GRVWB8_GSU1_GSUAMB_GSUC0_GSUWGMRR0_GLS0_ISA942_IU1_IA0_KLA_LBSPPA2048_LBSPPB1536_LBSPPM0_LPA0_LPB0_LPM0_LRVW4_LWPMn1_MIAV0_MIWT4_12_MDA2_MI16_16_16_1_MO40_NR0_NTn1_NTA0_NTB4_NTC0_NTD4_NTE0_NTM0_NTWS0_NEPBS16_NLCA1_NLCB3_ONLL1_PGR2_PLR1_PKA1_SGR1_SIA3_SLW1_SS1_SU8_SUM1_SUS64_SPO0_SRVW0_SSO0_SVW4_SK0_SKA0_SKXCCM0_SNLL0_TT1_1_TLDS0_ULSGRO0_USL1_UIOFGRO0_USFGROn1_VSn1_VWA4_VWB4_WSGRA0_WSGRB0_WS64_WG64_4_1_WGM6_WGMXCC8_WGMXCCGn1_WGR0
    SolutionIndex: 194
    SolutionNameMin: Cijk_Ailk_Bjlk_HHS_BH_Bias_HA_S_SAV_UserArgs_MT256x192x32_MI16x16x1_SN_LDSB0_AA0_AFC1_AF1_AAIGTEn1_AAILTEn1_AFEM1_AFEM1_ASEM1_BL1_BS1_CLR1_CADS0_DSK0_DU32_DTL0_DTVA0_DTVB0_DTVSM0_EPS0_FDSI0_GRPM1_GRVWA8_GRVWB8_GSU1_GSUAMB_GSUC0_GSUWGMRR0_GLS0_ISA942_IU1_IA0_KLA_LBSPPA2048_LBSPPB1536_LBSPPM0_LPA0_LPB32_LPM0_LRVW4_LWPMn1_MIAV0_MIWT8_6_MDA2_MI16_16_16_1_MO40_NR0_NTn1_NTA0_NTB4_NTC0_NTD4_NTE0_NTM0_NTWS0_NEPBS16_NLCA1_NLCB3_ONLL1_PGR2_PLR1_PKA1_SGR1_SIA3_SLW1_SS1_SU16_SUM0_SUS64_SPO0_SRVW0_SSO0_SVW8_SK0_SKA0_SKXCCM0_SNLL0_TT1_1_TLDS0_ULSGRO0_USL1_UIOFGRO0_USFGROn1_VSn1_VWA8_VWB2_WSGRA0_WSGRB0_WS64_WG32_8_1_WGM6_WGMXCC8_WGMXCCGn1_WGR0
    SolutionIndex: 195
    SolutionNameMin: Cijk_Ailk_Bjlk_HHS_BH_UserArgs_MT256x192x32_MI16x16x1_SN_LDSB0_CLR1_GRVWA8_GRVWB8_GSU1_GSUC0_GSUWGMRR0_K1_LBSPPA2048_LBSPPB1536_LPA0_LPB32_MIWT8_6_NLCA1_NLCB3_PLR1_SU16_SUM0_SUS64_SVW8_VWA8_VWB2_WG32_8_1_WGM8_WGMXCC8_WGMXCCG304
    SolutionIndex: 196
    SolutionNameMin: Cijk_Ailk_Bjlk_HHS_BH_Bias_HA_S_SAV_UserArgs_MT256x128x32_MI16x16x1_SN_LDSB1_AA0_AFC1_AF1_AAIGTEn1_AAILTEn1_AFEM1_AFEM1_ASEM1_BL1_BS1_CLR1_CADS0_DSK0_DU32_DTL0_DTVA0_DTVB0_DTVSM0_EPS0_FDSI0_GRPM1_GRVWA8_GRVWB8_GSU1_GSUAMB_GSUC0_GSUWGMRR0_GLS0_ISA942_IU1_IA0_KLA_LBSPPA2048_LBSPPB1024_LBSPPM0_LPA0_LPB0_LPM0_LRVW4_LWPMn1_MIAV0_MIWT4_8_MDA2_MI16_16_16_1_MO40_NR0_NTn1_NTA0_NTB0_NTC0_NTD4_NTE0_NTM0_NTWS0_NEPBS16_NLCA1_NLCB1_ONLL1_PGR2_PLR1_PKA1_SGR1_SIA3_SLW1_SS1_SU8_SUM0_SUS64_SPO0_SRVW0_SSO0_SVW4_SK0_SKA0_SKXCCM0_SNLL0_TT1_1_TLDS0_ULSGRO0_USL1_UIOFGRO0_USFGROn1_VSn1_VWA4_VWB8_WSGRA0_WSGRB0_WS64_WG64_4_1_WGM1_WGMXCC8_WGMXCCGn1_WGR0
    SolutionIndex: 197
    SolutionNameMin: Cijk_Ailk_Bjlk_HHS_BH_Bias_HA_S_SAV_UserArgs_MT256x256x32_MI16x16x1_SN_LDSB0_AA0_AFC1_AF1_AAIGTEn1_AAILTEn1_AFEM1_AFEM1_ASEM1_BL1_BS1_CLR1_CADS0_DSK0_DU32_DTL0_DTVA0_DTVB0_DTVSM0_EPS0_FDSI0_GRPM1_GRVWA8_GRVWB8_GSU1_GSUAMB_GSUC0_GSUWGMRR0_GLS0_ISA942_IU1_IA0_KLA_LBSPPA2048_LBSPPB2048_LBSPPM0_LPA0_LPB0_LPM0_LRVW4_LWPMn1_MIAV0_MIWT8_8_MDA2_MI16_16_16_1_MO40_NR0_NTn1_NTA0_NTB4_NTC0_NTD4_NTE0_NTM0_NTWS0_NEPBS16_NLCA1_NLCB1_ONLL1_PGR2_PLR1_PKA1_SGR1_SIA3_SLW1_SS1_SU16_SUM0_SUS64_SPO0_SRVW0_SSO0_SVW8_SK0_SKA0_SKXCCM0_SNLL0_TT1_1_TLDS0_ULSGRO0_USL1_UIOFGRO0_USFGROn1_VSn1_VWA8_VWB8_WSGRA0_WSGRB0_WS64_WG32_8_1_WGM8_WGMXCC8_WGMXCCGn1_WGR0
    SolutionIndex: 198
    SolutionNameMin: Cijk_Ailk_Bjlk_HHS_BH_Bias_HA_S_SAV_UserArgs_MT16x16x256_MI16x16x1_SN_LDSB1_AA0_AFC1_AF1_AAIGTEn1_AAILTEn1_AFEM1_AFEM1_ASEM1_BL1_BS1_CLR1_CADS0_DSK0_DU256_DTL0_DTVA0_DTVB0_DTVSM0_EPS0_FDSI0_GRPM1_GRVWA1_GRVWB8_GSU1_GSUAMB_GSUC0_GSUWGMRR0_GLS0_ISA942_IU1_IA0_KLA_LDSTI0_LBSPPA128_LBSPPB128_LBSPPM0_LPA16_LPB16_LPM0_LRVW4_LWPMn1_MIAV0_MIWT1_1_MDA2_MI16_16_16_1_MO40_MPO0_NR0_NTn1_NTA0_NTB0_NTC0_NTD4_NTE0_NTM0_NTWS0_NEPBS16_NLCA1_NLCB1_ONLL1_PGR2_PLR1_PKA1_SGR1_SIA3_SLW1_SS1_SU8_SUM1_SUS512_SPO0_SRVW0_SSO0_SVW1_SK0_SKA0_SKXCCM0_SNLL0_TT1_1_TLDS0_ULSGRO0_USL1_UIOFGRO0_USFGROn1_VSn1_VWA1_VWB1_WSGRA0_WSGRB0_WSK0_WS64_WG16_4_4_WGM1_WGMXCC8_WGMXCCGn1_WGR0
    SolutionIndex: 199
    SolutionNameMin: Cijk_Ailk_Bjlk_HHS_BH_Bias_HA_S_SAV_UserArgs_MT64x16x64_MI16x16x1_SN_LDSB0_AA0_AFC1_AF1_AAIGTEn1_AAILTEn1_AFEM1_AFEM1_ASEM1_BL1_BS1_CLR0_CADS0_DSK0_DU64_DTL0_DTVA0_DTVB0_DTVSM0_EPS0_FDSI0_GRPM1_GRVWA8_GRVWB1_GSU6_GSUAMBSK_GSUC0_GSUWGMRR0_GLS0_ISA942_IU1_IA0_KLA_LBSPPA512_LBSPPB128_LBSPPM0_LPA0_LPB16_LPM0_LRVW4_LWPMn1_MIAV0_MIWT4_1_MDA2_MI16_16_16_1_MO40_NR0_NTn1_NTA4_NTB0_NTC0_NTD0_NTE0_NTM0_NTWS0_NEPBS16_NLCA1_NLCB1_ONLL1_PGR2_PLR0_PKA1_SGR1_SIA3_SLW1_SS1_SU16_SUM0_SUS128_SPO0_SRVW0_SSO0_SVW4_SK0_SKA0_SKXCCM0_SNLL0_TT1_1_TLDS0_ULSGRO0_USL1_UIOFGRO0_USFGROn1_VSn1_VWA4_VWB1_WSGRA0_WSGRB0_WS64_WG16_4_4_WGM1_WGMXCC8_WGMXCCGn1_WGR0
    SolutionIndex: 200
    SolutionNameMin: Cijk_Ailk_Bjlk_HHS_BH_Bias_HA_S_SAV_UserArgs_MT64x64x64_MI16x16x1_SN_LDSB1_AA0_AFC1_AF1_AAIGTEn1_AAILTEn1_AFEM1_AFEM1_ASEM1_BL1_BS1_CLR1_CADS0_DSK0_DU64_DTL0_DTVA0_DTVB0_DTVSM0_EPS0_FDSI0_GRPM1_GRVWA8_GRVWB8_GSU1_GSUAMB_GSUC0_GSUWGMRR0_GLS0_ISA942_IU1_IA0_KLA_LBSPPA512_LBSPPB512_LBSPPM0_LPA32_LPB32_LPM0_LRVW4_LWPMn1_MIAV0_MIWT2_2_MDA2_MI16_16_16_1_MO40_NR0_NTn1_NTA0_NTB0_NTC0_NTD4_NTE0_NTM0_NTWS0_NEPBS16_NLCA1_NLCB1_ONLL1_PGR2_PLR1_PKA1_SGR1_SIA3_SLW1_SS1_SU16_SUM0_SUS128_SPO0_SRVW0_SSO0_SVW2_SK0_SKA0_SKXCCM0_SNLL0_TT1_1_TLDS0_ULSGRO0_USL1_UIOFGRO0_USFGROn1_VSn1_VWA2_VWB2_WSGRA0_WSGRB0_WS64_WG32_8_1_WGM8_WGMXCC8_WGMXCCGn1_WGR0
    SolutionIndex: 201
    SolutionNameMin: Cijk_Ailk_Bjlk_HHS_BH_Bias_HA_S_SAV_UserArgs_MT64x128x32_MI16x16x1_SN_LDSB0_AA0_AFC1_AF1_AAIGTEn1_AAILTEn1_AFEM1_AFEM1_ASEM1_BL1_BS1_CLR1_CADS0_DSK0_DU32_DTL0_DTVA0_DTVB0_DTVSM0_EPS0_FDSI0_GRPM1_GRVWA8_GRVWB8_GSU6_GSUAMB_GSUC0_GSUWGMRR0_GLS0_ISA942_IU1_IA0_KLA_LBSPPA512_LBSPPB1024_LBSPPM0_LPA32_LPB0_LPM0_LRVW4_LWPMn1_MIAV0_MIWT2_4_MDA2_MI16_16_16_1_MO40_NR0_NTn1_NTA0_NTB0_NTC0_NTD0_NTE0_NTM0_NTWS0_NEPBS16_NLCA1_NLCB1_ONLL1_PGR2_PLR1_PKA1_SGR1_SIA3_SLW1_SS1_SU0_SUM0_SUS0_SPO0_SRVW0_SSO0_SVW2_SK0_SKA0_SKXCCM0_SNLL0_TT1_1_TLDS0_ULSGRO0_USL1_UIOFGRO0_USFGROn1_VSn1_VWA2_VWB4_WSGRA0_WSGRB0_WS64_WG32_8_1_WGM1_WGMXCC8_WGMXCCGn1_WGR0
    SolutionIndex: 202
    SolutionNameMin: Cijk_Ailk_Bjlk_HHS_BH_Bias_HA_S_SAV_UserArgs_MT128x128x128_MI16x16x1_SN_LDSB1_AA0_AFC1_AF1_AAIGTEn1_AAILTEn1_AFEM1_AFEM1_ASEM1_BL1_BS1_CLR1_CADS0_DSK0_DU128_DTL0_DTVA0_DTVB0_DTVSM0_EPS0_FDSI0_GRPM1_GRVWA8_GRVWB8_GSU3_GSUAMB_GSUC0_GSUWGMRR0_GLS0_ISA942_IU1_IA0_KLA_LBSPPA1024_LBSPPB1024_LBSPPM0_LPA0_LPB0_LPM0_LRVW4_LWPMn1_MIAV0_MIWT4_4_MDA2_MI16_16_16_1_MO40_NR0_NTn1_NTA0_NTB0_NTC0_NTD0_NTE0_NTM0_NTWS0_NEPBS16_NLCA1_NLCB1_ONLL1_PGR2_PLR1_PKA1_SGR1_SIA3_SLW1_SS1_SU0_SUM0_SUS0_SPO0_SRVW0_SSO0_SVW4_SK0_SKA0_SKXCCM0_SNLL0_TT1_1_TLDS0_ULSGRO0_USL1_UIOFGRO0_USFGROn1_VSn1_VWA4_VWB4_WSGRA0_WSGRB0_WS64_WG32_8_1_WGM1_WGMXCC8_WGMXCCGn1_WGR0
    SolutionIndex: 203
    SolutionNameMin: Cijk_Ailk_Bjlk_HHS_BH_Bias_HA_S_SAV_UserArgs_MT128x128x128_MI16x16x1_SN_LDSB1_AA0_AFC1_AF1_AAIGTEn1_AAILTEn1_AFEM1_AFEM1_ASEM1_BL1_BS1_CLR1_CADS0_DSK0_DU128_DTL0_DTVA0_DTVB0_DTVSM0_EPS0_FDSI0_GRPM1_GRVWA8_GRVWB8_GSU1_GSUAMB_GSUC0_GSUWGMRR0_GLS0_ISA942_IU1_IA0_KLA_LBSPPA1024_LBSPPB1024_LBSPPM0_LPA0_LPB0_LPM0_LRVW4_LWPMn1_MIAV0_MIWT4_4_MDA2_MI16_16_16_1_MO40_NR0_NTn1_NTA0_NTB0_NTC0_NTD4_NTE0_NTM0_NTWS0_NEPBS16_NLCA1_NLCB1_ONLL1_PGR2_PLR1_PKA1_SGR1_SIA3_SLW1_SS1_SU8_SUM0_SUS256_SPO0_SRVW0_SSO0_SVW4_SK0_SKA0_SKXCCM0_SNLL0_TT1_1_TLDS0_ULSGRO0_USL1_UIOFGRO0_USFGROn1_VSn1_VWA4_VWB4_WSGRA0_WSGRB0_WS64_WG32_8_1_WGM1_WGMXCC8_WGMXCCGn1_WGR0
    SolutionIndex: 204
    SolutionNameMin: Cijk_Ailk_Bjlk_HHS_BH_Bias_HA_S_SAV_UserArgs_MT128x256x32_MI16x16x1_SN_LDSB1_AA0_AFC1_AF1_AAIGTEn1_AAILTEn1_AFEM1_AFEM1_ASEM1_BL1_BS1_CLR1_CADS0_DSK0_DU32_DTL0_DTVA0_DTVB0_DTVSM0_EPS0_FDSI0_GRPM1_GRVWA8_GRVWB8_GSU3_GSUAMB_GSUC0_GSUWGMRR0_GLS0_ISA942_IU1_IA0_KLA_LBSPPA1024_LBSPPB2048_LBSPPM0_LPA0_LPB0_LPM0_LRVW4_LWPMn1_MIAV0_MIWT4_8_MDA2_MI16_16_16_1_MO40_NR0_NTn1_NTA0_NTB0_NTC0_NTD0_NTE0_NTM0_NTWS0_NEPBS16_NLCA1_NLCB1_ONLL1_PGR2_PLR1_PKA1_SGR1_SIA3_SLW1_SS1_SU0_SUM0_SUS0_SPO0_SRVW0_SSO0_SVW4_SK0_SKA0_SKXCCM0_SNLL0_TT1_1_TLDS0_ULSGRO0_USL1_UIOFGRO0_USFGROn1_VSn1_VWA4_VWB8_WSGRA0_WSGRB0_WS64_WG32_8_1_WGM1_WGMXCC8_WGMXCCGn1_WGR0
    SolutionIndex: 205
    SolutionNameMin: Cijk_Ailk_Bjlk_HHS_BH_Bias_HA_S_SAV_UserArgs_MT128x256x32_MI16x16x1_SN_LDSB1_AA0_AFC1_AF1_AAIGTEn1_AAILTEn1_AFEM1_AFEM1_ASEM1_BL1_BS1_CLR1_CADS0_DSK0_DU32_DTL0_DTVA0_DTVB0_DTVSM0_EPS0_FDSI0_GRPM1_GRVWA8_GRVWB8_GSU3_GSUAMB_GSUC0_GSUWGMRR0_GLS0_ISA942_IU1_IA0_KLA_LBSPPA1024_LBSPPB2048_LBSPPM0_LPA0_LPB0_LPM0_LRVW4_LWPMn1_MIAV0_MIWT4_8_MDA2_MI16_16_16_1_MO40_NR0_NTn1_NTA0_NTB4_NTC0_NTD0_NTE0_NTM0_NTWS0_NEPBS16_NLCA1_NLCB1_ONLL1_PGR2_PLR1_PKA1_SGR1_SIA3_SLW1_SS1_SU0_SUM0_SUS0_SPO0_SRVW0_SSO0_SVW4_SK0_SKA0_SKXCCM0_SNLL0_TT1_1_TLDS0_ULSGRO0_USL1_UIOFGRO0_USFGROn1_VSn1_VWA4_VWB8_WSGRA0_WSGRB0_WS64_WG32_8_1_WGM1_WGMXCC8_WGMXCCGn1_WGR0
    SolutionIndex: 206
    SolutionNameMin: Cijk_Ailk_Bjlk_HHS_BH_UserArgs_MT128x256x32_MI16x16x1_SN_LDSB1_CLR1_GRVWA8_GRVWB8_GSU1_GSUC0_GSUWGMRR0_K1_LBSPPA1024_LBSPPB2048_LPA0_LPB0_MIWT4_8_NLCA1_NLCB1_PLR1_SU16_SUM0_SUS64_SVW4_VWA4_VWB8_WG32_8_1_WGM8_WGMXCC8_WGMXCCG304
    SolutionIndex: 207
    SolutionNameMin: Cijk_Ailk_Bjlk_HHS_BH_Bias_HA_S_SAV_UserArgs_MT192x256x32_MI16x16x1_SN_LDSB0_AA0_AFC1_AF1_AAIGTEn1_AAILTEn1_AFEM1_AFEM1_ASEM1_BL1_BS1_CLR1_CADS0_DSK0_DU32_DTL0_DTVA0_DTVB0_DTVSM0_EPS0_FDSI0_GRPM1_GRVWA8_GRVWB8_GSU1_GSUAMB_GSUC0_GSUWGMRR0_GLS0_ISA942_IU1_IA0_KLA_LBSPPA1536_LBSPPB2048_LBSPPM0_LPA32_LPB0_LPM0_LRVW4_LWPMn1_MIAV0_MIWT6_8_MDA2_MI16_16_16_1_MO40_NR0_NTn1_NTA0_NTB4_NTC0_NTD4_NTE0_NTM0_NTWS0_NEPBS16_NLCA3_NLCB1_ONLL1_PGR2_PLR1_PKA1_SGR1_SIA3_SLW1_SS1_SU16_SUM0_SUS64_SPO0_SRVW0_SSO0_SVW2_SK0_SKA0_SKXCCM0_SNLL0_TT1_1_TLDS0_ULSGRO0_USL1_UIOFGRO0_USFGROn1_VSn1_VWA2_VWB8_WSGRA0_WSGRB0_WS64_WG32_8_1_WGM8_WGMXCC8_WGMXCCGn1_WGR0
    SolutionIndex: 208
    SolutionNameMin: Cijk_Ailk_Bjlk_HHS_BH_UserArgs_MT128x256x32_MI16x16x1_SN_GSU1_GSUC0_GSUWGMRR0_K1_MIWT4_8_SU64_SUM1_SUS128_WGM6_WGMXCC8_WGMXCCG0
    SolutionIndex: 209
    SolutionNameMin: Cijk_Ailk_Bjlk_HHS_BH_UserArgs_MT128x256x32_MI16x16x1_SN_GSU1_K1_LBSPPA1024_LPA0_LPB0_MIAV0_MIWT4_8_NTA0_NTB0_NTC5_NTD5_SS1_SU0_SUM0_SUS0_SPO0_SVW4_VWA4_VWB8_WG32_8_1_WGM16
    SolutionIndex: 210
    SolutionNameMin: Cijk_Ailk_Bjlk_HHS_BH_Bias_HA_S_SAV_UserArgs_MT128x512x32_MI16x16x1_SN_LDSB1_AA0_AFC1_AF1_AAIGTEn1_AAILTEn1_AFEM1_AFEM1_ASEM1_BL1_BS1_CLR1_CADS0_DSK0_DU32_DTL0_DTVA0_DTVB0_DTVSM0_EPS0_FDSI0_GRPM1_GRVWA8_GRVWB8_GSU1_GSUAMB_GSUC0_GSUWGMRR0_GLS0_ISA942_IU1_IA0_KLA_LBSPPA1024_LBSPPB4096_LBSPPM0_LPA0_LPB0_LPM0_LRVW4_LWPMn1_MIAV0_MIWT8_8_MDA2_MI16_16_16_1_MO40_NR0_NTn1_NTA0_NTB4_NTC0_NTD4_NTE0_NTM0_NTWS0_NEPBS16_NLCA1_NLCB1_ONLL1_PGR2_PLR1_PKA1_SGR1_SIA3_SLW1_SS1_SU16_SUM0_SUS64_SPO0_SRVW0_SSO0_SVW8_SK0_SKA0_SKXCCM0_SNLL0_TT1_1_TLDS0_ULSGRO0_USL1_UIOFGRO0_USFGROn1_VSn1_VWA8_VWB8_WSGRA0_WSGRB0_WS64_WG16_16_1_WGM6_WGMXCC8_WGMXCCGn1_WGR0
    SolutionIndex: 211
    SolutionNameMin: Cijk_Ailk_Bjlk_HHS_BH_Bias_HA_S_SAV_UserArgs_MT128x256x32_MI16x16x1_SN_LDSB1_AA0_AFC1_AF1_AAIGTEn1_AAILTEn1_AFEM1_AFEM1_ASEM1_BL1_BS1_CLR1_CADS0_DSK0_DU32_DTL0_DTVA0_DTVB0_DTVSM0_EPS0_FDSI0_GRPM1_GRVWA8_GRVWB8_GSU1_GSUAMB_GSUC0_GSUWGMRR0_GLS0_ISA942_IU1_IA0_KLA_LBSPPA1024_LBSPPB2048_LBSPPM0_LPA0_LPB0_LPM0_LRVW4_LWPMn1_MIAV0_MIWT4_8_MDA2_MI16_16_16_1_MO40_NR0_NTn1_NTA0_NTB4_NTC0_NTD4_NTE0_NTM0_NTWS0_NEPBS16_NLCA1_NLCB1_ONLL1_PGR2_PLR1_PKA1_SGR1_SIA3_SLW1_SS1_SU8_SUM0_SUS64_SPO0_SRVW0_SSO0_SVW4_SK0_SKA0_SKXCCM0_SNLL0_TT1_1_TLDS0_ULSGRO0_USL1_UIOFGRO0_USFGROn1_VSn1_VWA4_VWB8_WSGRA0_WSGRB0_WS64_WG32_8_1_WGM1_WGMXCC8_WGMXCCGn1_WGR0
    SolutionIndex: 212
    SolutionNameMin: Cijk_Ailk_Bjlk_HHS_BH_Bias_HA_S_SAV_UserArgs_MT192x448x32_MI16x16x1_SN_LDSB1_AA0_AFC1_AF1_AAIGTEn1_AAILTEn1_AFEM1_AFEM1_ASEM1_BL1_BS1_CLR1_CADS0_DSK0_DU32_DTL0_DTVA0_DTVB0_DTVSM0_EPS0_FDSI0_GRPM1_GRVWA8_GRVWB8_GSU1_GSUAMB_GSUC0_GSUWGMRR0_GLS0_ISA942_IU1_IA0_KLA_LBSPPA1536_LBSPPB3584_LBSPPM0_LPA32_LPB32_LPM0_LRVW4_LWPMn1_MIAV0_MIWT6_14_MDA2_MI16_16_16_1_MO40_NR0_NTn1_NTA0_NTB4_NTC0_NTD4_NTE0_NTM0_NTWS0_NEPBS16_NLCA3_NLCB7_ONLL1_PGR2_PLR1_PKA1_SGR1_SIA3_SLW1_SS1_SU8_SUM0_SUS64_SPO0_SRVW0_SSO0_SVW2_SK0_SKA0_SKXCCM0_SNLL0_TT1_1_TLDS0_ULSGRO0_USL1_UIOFGRO0_USFGROn1_VSn1_VWA2_VWB2_WSGRA0_WSGRB0_WS64_WG32_8_1_WGM1_WGMXCC8_WGMXCCGn1_WGR0
    SolutionIndex: 213
    SolutionNameMin: Cijk_Ailk_Bjlk_HHS_BH_Bias_HA_S_SAV_UserArgs_MT64x16x128_MI16x16x1_SN_LDSB1_AA0_AFC1_AF1_AAIGTEn1_AAILTEn1_AFEM1_AFEM1_ASEM1_BL1_BS1_CLR1_CADS0_DSK0_DU128_DTL0_DTVA0_DTVB0_DTVSM0_EPS0_FDSI0_GRPM1_GRVWA8_GRVWB1_GSU14_GSUAMBSK_GSUC0_GSUWGMRR0_GLS0_ISA942_IU1_IA0_KLA_LBSPPA512_LBSPPB128_LBSPPM0_LPA0_LPB16_LPM0_LRVW4_LWPMn1_MIAV0_MIWT4_1_MDA2_MI16_16_16_1_MO40_NR0_NTn1_NTA4_NTB0_NTC0_NTD0_NTE0_NTM0_NTWS0_NEPBS16_NLCA1_NLCB1_ONLL1_PGR2_PLR1_PKA1_SGR1_SIA3_SLW1_SS1_SU16_SUM0_SUS256_SPO0_SRVW0_SSO0_SVW4_SK0_SKA0_SKXCCM0_SNLL0_TT1_1_TLDS0_ULSGRO0_USL1_UIOFGRO0_USFGROn1_VSn1_VWA4_VWB1_WSGRA0_WSGRB0_WS64_WG16_4_4_WGM1_WGMXCC8_WGMXCCGn1_WGR0
    SolutionIndex: 214
    SolutionNameMin: Cijk_Ailk_Bjlk_HHS_BH_Bias_HA_S_SAV_UserArgs_MT64x16x64_MI16x16x1_SN_LDSB0_AA0_AFC1_AF1_AAIGTEn1_AAILTEn1_AFEM1_AFEM1_ASEM1_BL1_BS1_CLR0_CADS0_DSK0_DU64_DTL0_DTVA0_DTVB0_DTVSM0_EPS0_FDSI0_GRPM1_GRVWA8_GRVWB4_GSU9_GSUAMBSK_GSUC0_GSUWGMRR0_GLS0_ISA942_IU1_IA0_KLA_LBSPPA512_LBSPPB128_LBSPPM0_LPA0_LPB16_LPM0_LRVW4_LWPMn1_MIAV0_MIWT4_1_MDA2_MI16_16_16_1_MO40_NR0_NTn1_NTA4_NTB0_NTC0_NTD0_NTE0_NTM0_NTWS0_NEPBS16_NLCA1_NLCB1_ONLL1_PGR2_PLR0_PKA1_SGR1_SIA3_SLW1_SS1_SU16_SUM0_SUS128_SPO0_SRVW0_SSO0_SVW4_SK0_SKA0_SKXCCM0_SNLL0_TT1_1_TLDS0_ULSGRO0_USL1_UIOFGRO0_USFGROn1_VSn1_VWA4_VWB1_WSGRA0_WSGRB0_WS64_WG16_4_4_WGM1_WGMXCC8_WGMXCCGn1_WGR0
    SolutionIndex: 215
    SolutionNameMin: Cijk_Ailk_Bjlk_HHS_BH_Bias_HA_S_SAV_UserArgs_MT64x32x64_MI16x16x1_SN_LDSB0_AA0_AFC1_AF1_AAIGTEn1_AAILTEn1_AFEM1_AFEM1_ASEM1_BL1_BS1_CLR1_CADS0_DSK0_DU64_DTL0_DTVA0_DTVB0_DTVSM0_EPS0_FDSI0_GRPM1_GRVWA8_GRVWB8_GSU8_GSUAMB_GSUC0_GSUWGMRR0_GLS0_ISA942_IU1_IA0_KLA_LBSPPA512_LBSPPB256_LBSPPM0_LPA16_LPB32_LPM0_LRVW4_LWPMn1_MIAV0_MIWT1_2_MDA2_MI16_16_16_1_MO40_NR0_NTn1_NTA0_NTB0_NTC0_NTD0_NTE0_NTM0_NTWS0_NEPBS16_NLCA1_NLCB1_ONLL1_PGR2_PLR1_PKA1_SGR1_SIA3_SLW1_SS1_SU0_SUM0_SUS0_SPO0_SRVW0_SSO0_SVW1_SK0_SKA0_SKXCCM0_SNLL0_TT1_1_TLDS0_ULSGRO0_USL1_UIOFGRO0_USFGROn1_VSn1_VWA1_VWB2_WSGRA0_WSGRB0_WS64_WG64_4_1_WGM1_WGMXCC8_WGMXCCGn1_WGR0
    SolutionIndex: 216
    SolutionNameMin: Cijk_Ailk_Bjlk_HHS_BH_Bias_HA_S_SAV_UserArgs_MT16x32x256_MI16x16x1_SN_LDSB1_AA0_AFC1_AF1_AAIGTEn1_AAILTEn1_AFEM1_AFEM1_ASEM1_BL1_BS1_CLR1_CADS0_DSK0_DU256_DTL0_DTVA0_DTVB0_DTVSM0_EPS0_FDSI0_GRPM1_GRVWA4_GRVWB8_GSU1_GSUAMB_GSUC0_GSUWGMRR0_GLS0_ISA942_IU1_IA0_KLA_LDSTI0_LBSPPA128_LBSPPB256_LBSPPM0_LPA16_LPB32_LPM0_LRVW4_LWPMn1_MIAV0_MIWT1_2_MDA2_MI16_16_16_1_MO40_MPO0_NR0_NTn1_NTA0_NTB0_NTC0_NTD4_NTE0_NTM0_NTWS0_NEPBS16_NLCA1_NLCB1_ONLL1_PGR2_PLR1_PKA1_SGR1_SIA3_SLW1_SS1_SU8_SUM1_SUS512_SPO0_SRVW0_SSO0_SVW1_SK0_SKA0_SKXCCM0_SNLL0_TT1_1_TLDS0_ULSGRO0_USL1_UIOFGRO0_USFGROn1_VSn1_VWA1_VWB2_WSGRA0_WSGRB0_WSK0_WS64_WG16_4_4_WGM1_WGMXCC8_WGMXCCGn1_WGR0
    SolutionIndex: 217
    SolutionNameMin: Cijk_Ailk_Bjlk_HHS_BH_Bias_HA_S_SAV_UserArgs_MT64x64x128_MI16x16x1_SN_LDSB1_AA0_AFC1_AF1_AAIGTEn1_AAILTEn1_AFEM1_AFEM1_ASEM1_BL1_BS1_CLR1_CADS0_DSK0_DU128_DTL0_DTVA0_DTVB0_DTVSM0_EPS0_FDSI0_GRPM1_GRVWA8_GRVWB8_GSU8_GSUAMB_GSUC0_GSUWGMRR0_GLS0_ISA942_IU1_IA0_KLA_LBSPPA512_LBSPPB512_LBSPPM0_LPA32_LPB32_LPM0_LRVW4_LWPMn1_MIAV0_MIWT2_2_MDA2_MI16_16_16_1_MO40_NR0_NTn1_NTA0_NTB4_NTC0_NTD0_NTE0_NTM0_NTWS0_NEPBS16_NLCA1_NLCB1_ONLL1_PGR2_PLR1_PKA1_SGR1_SIA3_SLW1_SS1_SU0_SUM0_SUS0_SPO0_SRVW0_SSO0_SVW2_SK0_SKA0_SKXCCM0_SNLL0_TT1_1_TLDS0_ULSGRO0_USL1_UIOFGRO0_USFGROn1_VSn1_VWA2_VWB2_WSGRA0_WSGRB0_WS64_WG32_8_1_WGM1_WGMXCC8_WGMXCCGn1_WGR0
    SolutionIndex: 218
    SolutionNameMin: Cijk_Ailk_Bjlk_HHS_BH_Bias_HA_S_SAV_UserArgs_MT128x32x64_MI16x16x1_SN_LDSB1_AA0_AFC1_AF1_AAIGTEn1_AAILTEn1_AFEM1_AFEM1_ASEM1_BL1_BS1_CLR1_CADS0_DSK0_DU64_DTL0_DTVA0_DTVB0_DTVSM0_EPS0_FDSI0_GRPM1_GRVWA8_GRVWB8_GSU8_GSUAMB_GSUC0_GSUWGMRR0_GLS0_ISA942_IU1_IA0_KLA_LBSPPA1024_LBSPPB256_LBSPPM0_LPA32_LPB32_LPM0_LRVW4_LWPMn1_MIAV0_MIWT2_2_MDA2_MI16_16_16_1_MO40_NR0_NTn1_NTA0_NTB0_NTC0_NTD0_NTE0_NTM0_NTWS0_NEPBS16_NLCA1_NLCB1_ONLL1_PGR2_PLR1_PKA1_SGR1_SIA3_SLW1_SS1_SU0_SUM0_SUS0_SPO0_SRVW0_SSO0_SVW2_SK0_SKA0_SKXCCM0_SNLL0_TT1_1_TLDS0_ULSGRO0_USL1_UIOFGRO0_USFGROn1_VSn1_VWA2_VWB2_WSGRA0_WSGRB0_WS64_WG64_4_1_WGM1_WGMXCC8_WGMXCCGn1_WGR0
    SolutionIndex: 219
    SolutionNameMin: Cijk_Ailk_Bjlk_HHS_BH_Bias_HA_S_SAV_UserArgs_MT64x64x64_MI16x16x1_SN_LDSB1_AA0_AFC1_AF1_AAIGTEn1_AAILTEn1_AFEM1_AFEM1_ASEM1_BL1_BS1_CLR1_CADS0_DSK0_DU64_DTL0_DTVA0_DTVB0_DTVSM0_EPS0_FDSI0_GRPM1_GRVWA8_GRVWB8_GSU6_GSUAMB_GSUC0_GSUWGMRR0_GLS0_ISA942_IU1_IA0_KLA_LBSPPA512_LBSPPB512_LBSPPM0_LPA0_LPB16_LPM0_LRVW4_LWPMn1_MIAV0_MIWT4_1_MDA2_MI16_16_16_1_MO40_NR0_NTn1_NTA0_NTB0_NTC0_NTD0_NTE0_NTM0_NTWS0_NEPBS16_NLCA1_NLCB1_ONLL1_PGR2_PLR1_PKA1_SGR1_SIA3_SLW1_SS1_SU0_SUM0_SUS0_SPO0_SRVW0_SSO0_SVW4_SK0_SKA0_SKXCCM0_SNLL0_TT1_1_TLDS0_ULSGRO0_USL1_UIOFGRO0_USFGROn1_VSn1_VWA4_VWB1_WSGRA0_WSGRB0_WS64_WG16_16_1_WGM1_WGMXCC8_WGMXCCGn1_WGR0
    SolutionIndex: 220
    SolutionNameMin: Cijk_Ailk_Bjlk_HHS_BH_Bias_HA_S_SAV_UserArgs_MT64x256x64_MI16x16x1_SN_LDSB1_AA0_AFC1_AF1_AAIGTEn1_AAILTEn1_AFEM1_AFEM1_ASEM1_BL1_BS1_CLR1_CADS0_DSK0_DU64_DTL0_DTVA0_DTVB0_DTVSM0_EPS0_FDSI0_GRPM1_GRVWA8_GRVWB8_GSU8_GSUAMB_GSUC0_GSUWGMRR0_GLS0_ISA942_IU1_IA0_KLA_LBSPPA512_LBSPPB2048_LBSPPM0_LPA0_LPB0_LPM0_LRVW4_LWPMn1_MIAV0_MIWT4_4_MDA2_MI16_16_16_1_MO40_NR0_NTn1_NTA0_NTB0_NTC0_NTD0_NTE0_NTM0_NTWS0_NEPBS16_NLCA1_NLCB1_ONLL1_PGR2_PLR1_PKA1_SGR1_SIA3_SLW1_SS1_SU0_SUM0_SUS0_SPO0_SRVW0_SSO0_SVW4_SK0_SKA0_SKXCCM0_SNLL0_TT1_1_TLDS0_ULSGRO0_USL1_UIOFGRO0_USFGROn1_VSn1_VWA4_VWB4_WSGRA0_WSGRB0_WS64_WG16_16_1_WGM1_WGMXCC8_WGMXCCGn1_WGR0
    SolutionIndex: 221
    SolutionNameMin: Cijk_Ailk_Bjlk_HHS_BH_Bias_HA_S_SAV_UserArgs_MT128x128x64_MI16x16x1_SN_LDSB1_AA0_AFC1_AF1_AAIGTEn1_AAILTEn1_AFEM1_AFEM1_ASEM1_BL1_BS1_CLR1_CADS0_DSK0_DU64_DTL0_DTVA0_DTVB0_DTVSM0_EPS0_FDSI0_GRPM1_GRVWA8_GRVWB8_GSU6_GSUAMB_GSUC0_GSUWGMRR0_GLS0_ISA942_IU1_IA0_KLA_LBSPPA1024_LBSPPB1024_LBSPPM0_LPA0_LPB0_LPM0_LRVW4_LWPMn1_MIAV0_MIWT4_4_MDA2_MI16_16_16_1_MO40_NR0_NTn1_NTA0_NTB0_NTC0_NTD0_NTE0_NTM0_NTWS0_NEPBS16_NLCA1_NLCB1_ONLL1_PGR2_PLR1_PKA1_SGR1_SIA3_SLW1_SS1_SU0_SUM0_SUS0_SPO0_SRVW0_SSO0_SVW4_SK0_SKA0_SKXCCM0_SNLL0_TT1_1_TLDS0_ULSGRO0_USL1_UIOFGRO0_USFGROn1_VSn1_VWA4_VWB4_WSGRA0_WSGRB0_WS64_WG32_8_1_WGM1_WGMXCC8_WGMXCCGn1_WGR0
    SolutionIndex: 222
    SolutionNameMin: Cijk_Ailk_Bjlk_HHS_BH_Bias_HA_S_SAV_UserArgs_MT256x128x32_MI16x16x1_SN_LDSB1_AA0_AFC1_AF1_AAIGTEn1_AAILTEn1_AFEM1_AFEM1_ASEM1_BL1_BS1_CLR1_CADS0_DSK0_DU32_DTL0_DTVA0_DTVB0_DTVSM0_EPS0_FDSI0_GRPM1_GRVWA8_GRVWB8_GSU4_GSUAMB_GSUC0_GSUWGMRR0_GLS0_ISA942_IU1_IA0_KLA_LBSPPA2048_LBSPPB1024_LBSPPM0_LPA0_LPB0_LPM0_LRVW4_LWPMn1_MIAV0_MIWT4_8_MDA2_MI16_16_16_1_MO40_NR0_NTn1_NTA0_NTB0_NTC0_NTD0_NTE0_NTM0_NTWS0_NEPBS16_NLCA1_NLCB1_ONLL1_PGR2_PLR1_PKA1_SGR1_SIA3_SLW1_SS1_SU0_SUM0_SUS0_SPO0_SRVW0_SSO0_SVW4_SK0_SKA0_SKXCCM0_SNLL0_TT1_1_TLDS0_ULSGRO0_USL1_UIOFGRO0_USFGROn1_VSn1_VWA4_VWB8_WSGRA0_WSGRB0_WS64_WG64_4_1_WGM1_WGMXCC8_WGMXCCGn1_WGR0
    SolutionIndex: 223
    SolutionNameMin: Cijk_Ailk_Bjlk_HHS_BH_UserArgs_MT128x256x32_MI16x16x1_SN_GSU1_K1_LBSPPA1024_LPA0_LPB0_MIAV0_MIWT4_8_NTA3_NTB2_NTC1_NTD1_SS1_SU0_SUM0_SUS0_SPO0_SVW4_VWA4_VWB8_WG32_8_1_WGMn8
    SolutionIndex: 224
    SolutionNameMin: Cijk_Ailk_Bjlk_HHS_BH_Bias_HA_S_SAV_UserArgs_MT256x192x64_MI16x16x1_SN_LDSB1_AA0_AFC1_AF1_AAIGTEn1_AAILTEn1_AFEM1_AFEM1_ASEM1_BL1_BS1_CLR1_CADS0_DSK0_DU64_DTL0_DTVA0_DTVB0_DTVSM0_EPS0_FDSI0_GRPM1_GRVWA8_GRVWB8_GSU1_GSUAMB_GSUC0_GSUWGMRR0_GLS0_ISA942_IU1_IA0_KLA_LBSPPA2048_LBSPPB1536_LBSPPM0_LPA0_LPB0_LPM0_LRVW4_LWPMn1_MIAV0_MIWT4_12_MDA2_MI16_16_16_1_MO40_NR0_NTn1_NTA0_NTB4_NTC0_NTD4_NTE0_NTM0_NTWS0_NEPBS16_NLCA1_NLCB3_ONLL1_PGR2_PLR1_PKA1_SGR1_SIA3_SLW1_SS1_SU16_SUM0_SUS128_SPO0_SRVW0_SSO0_SVW4_SK0_SKA0_SKXCCM0_SNLL0_TT1_1_TLDS0_ULSGRO0_USL1_UIOFGRO0_USFGROn1_VSn1_VWA4_VWB4_WSGRA0_WSGRB0_WS64_WG64_4_1_WGM8_WGMXCC8_WGMXCCGn1_WGR0
    SolutionIndex: 225
    SolutionNameMin: Cijk_Ailk_Bjlk_HHS_BH_Bias_HAS_SAV_UserArgs_MT128x256x32_MI16x16x1_SN_GSU1_GSUC1_GSUWGMRR1_K1_MIWT4_8_NEPBS0_SU16_SUM0_SUS64_WSGRA0_WSGRB0_WGM1_WGMXCC8_WGMXCCGn1
    SolutionIndex: 226
    SolutionNameMin: Cijk_Ailk_Bjlk_HHS_BH_Bias_HA_S_SAV_UserArgs_MT256x128x32_MI16x16x1_SN_LDSB1_AA0_AFC1_AF1_AAIGTEn1_AAILTEn1_AFEM1_AFEM1_ASEM1_BL1_BS1_CLR1_CADS0_DSK0_DU32_DTL0_DTVA0_DTVB0_DTVSM0_EPS0_FDSI0_GRPM1_GRVWA8_GRVWB8_GSU1_GSUAMB_GSUC0_GSUWGMRR0_GLS0_ISA942_IU1_IA0_KLA_LBSPPA2048_LBSPPB1024_LBSPPM0_LPA0_LPB0_LPM0_LRVW4_LWPMn1_MIAV0_MIWT4_8_MDA2_MI16_16_16_1_MO40_NR0_NTn1_NTA0_NTB4_NTC0_NTD4_NTE0_NTM0_NTWS0_NEPBS16_NLCA1_NLCB1_ONLL1_PGR2_PLR1_PKA1_SGR1_SIA3_SLW1_SS1_SU16_SUM0_SUS64_SPO0_SRVW0_SSO0_SVW4_SK0_SKA0_SKXCCM0_SNLL0_TT1_1_TLDS0_ULSGRO0_USL1_UIOFGRO0_USFGROn1_VSn1_VWA4_VWB8_WSGRA0_WSGRB0_WS64_WG64_4_1_WGM6_WGMXCC8_WGMXCCGn1_WGR0
    SolutionIndex: 227
    SolutionNameMin: Cijk_Ailk_Bjlk_HHS_BH_Bias_HAS_SAV_UserArgs_MT256x128x32_MI16x16x1_SN_GSU1_GSUC0_GSUWGMRR0_K1_MIWT4_8_NTA0_NTB0_NTD4_NEPBS0_SU0_SUM0_SUS0_WGM0_WGMXCC1_WGMXCCGn1
    SolutionIndex: 228
    SolutionNameMin: Cijk_Ailk_Bjlk_HHS_BH_UserArgs_MT256x128x32_MI16x16x1_SN_LDSB1_CLR1_GRVWA8_GRVWB8_GSU1_GSUC0_GSUWGMRR0_K1_LBSPPA2048_LBSPPB1024_LPA0_LPB0_MIWT4_8_NLCA1_NLCB1_PLR1_SU8_SUM1_SUS64_SVW4_VWA4_VWB8_WG64_4_1_WGM1_WGMXCC1_WGMXCCG0
    SolutionIndex: 229
    SolutionNameMin: Cijk_Ailk_Bjlk_HHS_BH_Bias_HAS_SAV_UserArgs_MT512x128x32_MI16x16x1_SN_LDSB0_DTVA1_GRVWA8_GRVWB8_GSU1_GSUC0_GSUWGMRR0_K1_LBSPPA0_LBSPPB1024_LPA0_LPB0_MIWT8_8_NLCA1_NLCB1_SU32_SUM1_SUS64_SVW8_USFGRO1_VWA8_VWB8_WG64_4_1_WGM32_WGMXCC1_WGMXCCGn1
    SolutionIndex: 230
    SolutionNameMin: Cijk_Ailk_Bjlk_HHS_BH_Bias_HA_S_SAV_UserArgs_MT64x16x128_MI16x16x1_SN_LDSB1_AA0_AFC1_AF1_AAIGTEn1_AAILTEn1_AFEM1_AFEM1_ASEM1_BL1_BS1_CLR1_CADS0_DSK0_DU128_DTL0_DTVA0_DTVB0_DTVSM0_EPS0_FDSI0_GRPM1_GRVWA8_GRVWB1_GSU11_GSUAMBSK_GSUC0_GSUWGMRR0_GLS0_ISA942_IU1_IA0_KLA_LBSPPA512_LBSPPB128_LBSPPM0_LPA0_LPB16_LPM0_LRVW4_LWPMn1_MIAV0_MIWT4_1_MDA2_MI16_16_16_1_MO40_NR0_NTn1_NTA4_NTB0_NTC0_NTD0_NTE0_NTM0_NTWS0_NEPBS16_NLCA1_NLCB1_ONLL1_PGR2_PLR1_PKA1_SGR1_SIA3_SLW1_SS1_SU16_SUM0_SUS256_SPO0_SRVW0_SSO0_SVW4_SK0_SKA0_SKXCCM0_SNLL0_TT1_1_TLDS0_ULSGRO0_USL1_UIOFGRO0_USFGROn1_VSn1_VWA4_VWB1_WSGRA0_WSGRB0_WS64_WG16_4_4_WGM1_WGMXCC8_WGMXCCGn1_WGR0
    SolutionIndex: 231
    SolutionNameMin: Cijk_Ailk_Bjlk_HHS_BH_Bias_HA_S_SAV_UserArgs_MT64x32x128_MI16x16x1_SN_LDSB1_AA0_AFC1_AF1_AAIGTEn1_AAILTEn1_AFEM1_AFEM1_ASEM1_BL1_BS1_CLR1_CADS0_DSK0_DU128_DTL0_DTVA0_DTVB0_DTVSM0_EPS0_FDSI0_GRPM1_GRVWA8_GRVWB8_GSU11_GSUAMBSK_GSUC0_GSUWGMRR0_GLS0_ISA942_IU1_IA0_KLA_LBSPPA512_LBSPPB256_LBSPPM0_LPA32_LPB16_LPM0_LRVW4_LWPMn1_MIAV0_MIWT2_1_MDA2_MI16_16_16_1_MO40_NR0_NTn1_NTA4_NTB0_NTC0_NTD0_NTE0_NTM0_NTWS0_NEPBS0_NLCA1_NLCB1_ONLL1_PGR2_PLR1_PKA1_SGR1_SIA3_SLW1_SS1_SU0_SUM0_SUS0_SPO0_SRVW0_SSO0_SVW2_SK0_SKA0_SKXCCM0_SNLL0_TT1_1_TLDS0_ULSGRO0_USL1_UIOFGRO0_USFGROn1_VSn1_VWA2_VWB1_WSGRA0_WSGRB0_WS64_WG32_8_1_WGM1_WGMXCC8_WGMXCCGn1_WGR0
    SolutionIndex: 232
    SolutionNameMin: Cijk_Ailk_Bjlk_HHS_BH_Bias_HA_S_SAV_UserArgs_MT128x128x64_MI16x16x1_SN_LDSB1_AA0_AFC1_AF1_AAIGTEn1_AAILTEn1_AFEM1_AFEM1_ASEM1_BL1_BS1_CLR1_CADS0_DSK0_DU64_DTL0_DTVSM0_EPS0_FDSI0_GRPM1_GRVWA8_GRVWB8_GSU8_GSUAMB_GSUC1_GSUWGMRR1_GLS0_ISA942_IU1_IA0_KLA_LBSPPA1024_LBSPPB1024_LBSPPM0_LPA0_LPB0_LPM0_LRVW4_LWPMn1_MIAV0_MIWT4_4_MDA2_MI16_16_16_1_MO40_NR0_NTn1_NTA0_NTB0_NTC0_NTD0_NTE0_NTM0_NTWS0_NEPBS16_NLCA1_NLCB1_ONLL1_PGR2_PLR1_PKA1_SGR1_SIA3_SLW1_SS1_SU8_SUM0_SUS256_SPO0_SRVW0_SSO0_SVW4_SK0_SKA0_SKXCCM0_SNLL0_TT1_1_TLDS0_ULSGRO0_USL1_UIOFGRO0_USFGROn1_VSn1_VWA4_VWB4_WSGRA0_WSGRB0_WS64_WG32_8_1_WGM8_WGMXCC8_WGMXCCGn1_WGR0
    SolutionIndex: 233
    SolutionNameMin: Cijk_Ailk_Bjlk_HHS_BH_Bias_HA_S_SAV_UserArgs_MT64x32x64_MI16x16x1_SN_LDSB0_AA0_AFC1_AF1_AAIGTEn1_AAILTEn1_AFEM1_AFEM1_ASEM1_BL1_BS1_CLR1_CADS0_DSK0_DU64_DTL0_DTVA0_DTVB0_DTVSM0_EPS0_FDSI0_GRPM1_GRVWA8_GRVWB8_GSU1_GSUAMB_GSUC0_GSUWGMRR0_GLS0_ISA942_IU1_IA0_KLA_LBSPPA512_LBSPPB256_LBSPPM0_LPA32_LPB16_LPM0_LRVW4_LWPMn1_MIAV0_MIWT2_1_MDA2_MI16_16_16_1_MO40_NR0_NTn1_NTA0_NTB0_NTC0_NTD4_NTE0_NTM0_NTWS0_NEPBS16_NLCA1_NLCB1_ONLL1_PGR2_PLR1_PKA1_SGR1_SIA3_SLW1_SS1_SU8_SUM0_SUS128_SPO0_SRVW0_SSO0_SVW2_SK0_SKA0_SKXCCM0_SNLL0_TT1_1_TLDS0_ULSGRO0_USL1_UIOFGRO0_USFGROn1_VSn1_VWA2_VWB1_WSGRA0_WSGRB0_WS64_WG32_8_1_WGM1_WGMXCC8_WGMXCCGn1_WGR0
    SolutionIndex: 234
    SolutionNameMin: Cijk_Ailk_Bjlk_HHS_BH_UserArgs_MT64x64x64_MI16x16x1_SN_LDSB1_CLR1_GRVWA8_GRVWB8_GSU1_GSUAMB_GSUC0_GSUWGMRR0_K1_LBSPPA512_LBSPPB512_LPA32_LPB0_MIWT2_4_NTD4_NEPBS16_NLCA1_NLCB1_PLR1_SU16_SUM1_SUS128_SVW2_VWA2_VWB4_WG32_4_2_WGM8_WGMXCC8_WGMXCCG304
    SolutionIndex: 235
    SolutionNameMin: Cijk_Ailk_Bjlk_HHS_BH_Bias_HA_S_SAV_UserArgs_MT128x64x64_MI16x16x1_SN_LDSB1_AA0_AFC1_AF1_AAIGTEn1_AAILTEn1_AFEM1_AFEM1_ASEM1_BL1_BS1_CLR1_CADS0_DSK0_DU64_DTL0_DTVA0_DTVB0_DTVSM0_EPS0_FDSI0_GRPM1_GRVWA8_GRVWB8_GSU3_GSUAMB_GSUC0_GSUWGMRR0_GLS0_ISA942_IU1_IA0_KLA_LBSPPA1024_LBSPPB512_LBSPPM0_LPA32_LPB0_LPM0_LRVW4_LWPMn1_MIAV0_MIWT2_4_MDA2_MI16_16_16_1_MO40_NR0_NTn1_NTA0_NTB0_NTC0_NTD0_NTE0_NTM0_NTWS0_NEPBS16_NLCA1_NLCB1_ONLL1_PGR2_PLR1_PKA1_SGR1_SIA3_SLW1_SS1_SU0_SUM0_SUS0_SPO0_SRVW0_SSO0_SVW2_SK0_SKA0_SKXCCM0_SNLL0_TT1_1_TLDS0_ULSGRO0_USL1_UIOFGRO0_USFGROn1_VSn1_VWA2_VWB4_WSGRA0_WSGRB0_WS64_WG64_4_1_WGM1_WGMXCC8_WGMXCCGn1_WGR0
    SolutionIndex: 236
    SolutionNameMin: Cijk_Ailk_Bjlk_HHS_BH_Bias_HA_S_SAV_UserArgs_MT128x128x64_MI16x16x1_SN_LDSB1_AA0_AFC1_AF1_AAIGTEn1_AAILTEn1_AFEM1_AFEM1_ASEM1_BL1_BS1_CLR1_CADS0_DSK0_DU64_DTL0_DTVA0_DTVB0_DTVSM0_EPS0_FDSI0_GRPM1_GRVWA8_GRVWB8_GSU3_GSUAMB_GSUC0_GSUWGMRR0_GLS0_ISA942_IU1_IA0_KLA_LBSPPA1024_LBSPPB1024_LBSPPM0_LPA0_LPB0_LPM0_LRVW4_LWPMn1_MIAV0_MIWT4_4_MDA2_MI16_16_16_1_MO40_NR0_NTn1_NTA4_NTB0_NTC0_NTD0_NTE0_NTM0_NTWS0_NEPBS16_NLCA1_NLCB1_ONLL1_PGR2_PLR1_PKA1_SGR1_SIA3_SLW1_SS1_SU0_SUM0_SUS0_SPO0_SRVW0_SSO0_SVW4_SK0_SKA0_SKXCCM0_SNLL0_TT1_1_TLDS0_ULSGRO0_USL1_UIOFGRO0_USFGROn1_VSn1_VWA4_VWB4_WSGRA0_WSGRB0_WS64_WG32_8_1_WGM1_WGMXCC8_WGMXCCGn1_WGR0
    SolutionIndex: 237
    SolutionNameMin: Cijk_Ailk_Bjlk_HHS_BH_Bias_HA_S_SAV_UserArgs_MT256x128x32_MI16x16x1_SN_LDSB1_AA0_AFC1_AF1_AAIGTEn1_AAILTEn1_AFEM1_AFEM1_ASEM1_BL1_BS1_CLR1_CADS0_DSK0_DU32_DTL0_DTVA0_DTVB0_DTVSM0_EPS0_FDSI0_GRPM1_GRVWA8_GRVWB8_GSU3_GSUAMB_GSUC0_GSUWGMRR0_GLS0_ISA942_IU1_IA0_KLA_LBSPPA2048_LBSPPB1024_LBSPPM0_LPA0_LPB0_LPM0_LRVW4_LWPMn1_MIAV0_MIWT4_8_MDA2_MI16_16_16_1_MO40_NR0_NTn1_NTA0_NTB0_NTC0_NTD0_NTE0_NTM0_NTWS0_NEPBS16_NLCA1_NLCB1_ONLL1_PGR2_PLR1_PKA1_SGR1_SIA3_SLW1_SS1_SU0_SUM0_SUS0_SPO0_SRVW0_SSO0_SVW4_SK0_SKA0_SKXCCM0_SNLL0_TT1_1_TLDS0_ULSGRO0_USL1_UIOFGRO0_USFGROn1_VSn1_VWA4_VWB8_WSGRA0_WSGRB0_WS64_WG64_4_1_WGM1_WGMXCC8_WGMXCCGn1_WGR0
    SolutionIndex: 238
    SolutionNameMin: Cijk_Ailk_Bjlk_HHS_BH_Bias_HA_S_SAV_UserArgs_MT256x128x32_MI16x16x1_SN_LDSB1_AA0_AFC1_AF1_AAIGTEn1_AAILTEn1_AFEM1_AFEM1_ASEM1_BL1_BS1_CLR1_CADS0_DSK0_DU32_DTL0_DTVA0_DTVB0_DTVSM0_EPS0_FDSI0_GRPM1_GRVWA8_GRVWB8_GSU3_GSUAMB_GSUC0_GSUWGMRR0_GLS0_ISA942_IU1_IA0_KLA_LBSPPA2048_LBSPPB1024_LBSPPM0_LPA0_LPB0_LPM0_LRVW4_LWPMn1_MIAV0_MIWT4_8_MDA2_MI16_16_16_1_MO40_NR0_NTn1_NTA0_NTB4_NTC0_NTD0_NTE0_NTM0_NTWS0_NEPBS16_NLCA1_NLCB1_ONLL1_PGR2_PLR1_PKA1_SGR1_SIA3_SLW1_SS1_SU0_SUM0_SUS0_SPO0_SRVW0_SSO0_SVW4_SK0_SKA0_SKXCCM0_SNLL0_TT1_1_TLDS0_ULSGRO0_USL1_UIOFGRO0_USFGROn1_VSn1_VWA4_VWB8_WSGRA0_WSGRB0_WS64_WG64_4_1_WGM1_WGMXCC8_WGMXCCGn1_WGR0
    SolutionIndex: 239
    SolutionNameMin: Cijk_Ailk_Bjlk_HHS_BH_Bias_HA_S_SAV_UserArgs_MT192x128x32_MI16x16x1_SN_LDSB1_AA0_AFC1_AF1_AAIGTEn1_AAILTEn1_AFEM1_AFEM1_ASEM1_BL1_BS1_CLR1_CADS0_DSK0_DU32_DTL0_DTVA0_DTVB0_DTVSM0_EPS0_FDSI0_GRPM1_GRVWA8_GRVWB8_GSU1_GSUAMB_GSUC0_GSUWGMRR0_GLS0_ISA942_IU1_IA0_KLA_LBSPPA1536_LBSPPB1024_LBSPPM0_LPA0_LPB32_LPM0_LRVW4_LWPMn1_MIAV0_MIWT12_2_MDA2_MI16_16_16_1_MO40_NR0_NTn1_NTA0_NTB0_NTC0_NTD4_NTE0_NTM0_NTWS0_NEPBS16_NLCA3_NLCB1_ONLL1_PGR2_PLR1_PKA1_SGR1_SIA3_SLW1_SS1_SU8_SUM1_SUS64_SPO0_SRVW0_SSO0_SVW4_SK0_SKA0_SKXCCM0_SNLL0_TT1_1_TLDS0_ULSGRO0_USL1_UIOFGRO0_USFGROn1_VSn1_VWA4_VWB2_WSGRA0_WSGRB0_WS64_WG16_16_1_WGM6_WGMXCC8_WGMXCCGn1_WGR0
    SolutionIndex: 240
    SolutionNameMin: Cijk_Ailk_Bjlk_HHS_BH_Bias_HA_S_SAV_UserArgs_MT256x192x32_MI16x16x1_SN_LDSB0_AA0_AFC1_AF1_AAIGTEn1_AAILTEn1_AFEM1_AFEM1_ASEM1_BL1_BS1_CLR1_CADS0_DSK0_DU32_DTL0_DTVA0_DTVB0_DTVSM0_EPS0_FDSI0_GRPM1_GRVWA8_GRVWB8_GSU1_GSUAMB_GSUC0_GSUWGMRR0_GLS0_ISA942_IU1_IA0_KLA_LBSPPA2048_LBSPPB1536_LBSPPM0_LPA0_LPB32_LPM0_LRVW4_LWPMn1_MIAV0_MIWT8_6_MDA2_MI16_16_16_1_MO40_NR0_NTn1_NTA0_NTB4_NTC0_NTD4_NTE0_NTM0_NTWS0_NEPBS16_NLCA1_NLCB3_ONLL1_PGR2_PLR1_PKA1_SGR1_SIA3_SLW1_SS1_SU8_SUM0_SUS64_SPO0_SRVW0_SSO0_SVW8_SK0_SKA0_SKXCCM0_SNLL0_TT1_1_TLDS0_ULSGRO0_USL1_UIOFGRO0_USFGROn1_VSn1_VWA8_VWB2_WSGRA0_WSGRB0_WS64_WG32_8_1_WGM1_WGMXCC8_WGMXCCGn1_WGR0
    SolutionIndex: 241
    SolutionNameMin: Cijk_Ailk_Bjlk_HHS_BH_Bias_HA_S_SAV_UserArgs_MT384x128x32_MI16x16x1_SN_LDSB1_AA0_AFC1_AF1_AAIGTEn1_AAILTEn1_AFEM1_AFEM1_ASEM1_BL1_BS1_CLR1_CADS0_DSK0_DU32_DTL0_DTVA0_DTVB0_DTVSM0_EPS0_FDSI0_GRPM1_GRVWA8_GRVWB8_GSU1_GSUAMB_GSUC0_GSUWGMRR0_GLS0_ISA942_IU1_IA0_KLA_LBSPPA3072_LBSPPB1024_LBSPPM0_LPA32_LPB0_LPM0_LRVW4_LWPMn1_MIAV0_MIWT6_8_MDA2_MI16_16_16_1_MO40_NR0_NTn1_NTA0_NTB4_NTC0_NTD4_NTE0_NTM0_NTWS0_NEPBS16_NLCA3_NLCB1_ONLL1_PGR2_PLR1_PKA1_SGR1_SIA3_SLW1_SS1_SU16_SUM0_SUS64_SPO0_SRVW0_SSO0_SVW2_SK0_SKA0_SKXCCM0_SNLL0_TT1_1_TLDS0_ULSGRO0_USL1_UIOFGRO0_USFGROn1_VSn1_VWA2_VWB8_WSGRA0_WSGRB0_WS64_WG64_4_1_WGM8_WGMXCC8_WGMXCCGn1_WGR0
    SolutionIndex: 242
    SolutionNameMin: Cijk_Ailk_Bjlk_HHS_BH_UserArgs_MT128x256x32_MI16x16x1_SN_LDSB1_CLR1_GRVWA8_GRVWB8_GSU1_GSUC0_GSUWGMRR0_K1_LBSPPA1024_LBSPPB2048_LPA0_LPB0_MIWT4_8_NLCA1_NLCB1_PLR1_SU8_SUM1_SUS64_SVW4_VWA4_VWB8_WG32_8_1_WGM6_WGMXCC8_WGMXCCG304
    SolutionIndex: 243
    SolutionNameMin: Cijk_Ailk_Bjlk_HHS_BH_UserArgs_MT256x256x32_MI16x16x1_SN_LDSB0_CLR1_GRVWA8_GRVWB8_GSU1_GSUC0_GSUWGMRR0_K1_LBSPPA2048_LBSPPB2048_LPA0_LPB0_MIWT8_8_NLCA1_NLCB1_PLR1_SU8_SUM1_SUS64_SVW8_VWA8_VWB8_WG32_8_1_WGM6_WGMXCC8_WGMXCCG304
    SolutionIndex: 244
    SolutionNameMin: Cijk_Ailk_Bjlk_HHS_BH_Bias_HA_S_SAV_UserArgs_MT128x128x32_MI16x16x1_SN_LDSB1_AA0_AFC1_AF1_AAIGTEn1_AAILTEn1_AFEM1_AFEM1_ASEM1_BL1_BS1_CLR1_CADS0_DSK0_DU32_DTL0_DTVA0_DTVB0_DTVSM0_EPS0_FDSI0_GRPM1_GRVWA8_GRVWB8_GSU1_GSUAMB_GSUC0_GSUWGMRR0_GLS0_ISA942_IU1_IA0_KLA_LBSPPA1024_LBSPPB1024_LBSPPM0_LPA0_LPB0_LPM0_LRVW4_LWPMn1_MIAV0_MIWT4_4_MDA2_MI16_16_16_1_MO40_NR0_NTn1_NTA0_NTB0_NTC0_NTD4_NTE0_NTM0_NTWS0_NEPBS16_NLCA1_NLCB1_ONLL1_PGR2_PLR1_PKA1_SGR1_SIA3_SLW1_SS1_SU2_SUM3_SUS1024_SPO0_SRVW0_SSO0_SVW4_SK0_SKA0_SKXCCM0_SNLL0_TT1_1_TLDS0_ULSGRO0_USL1_UIOFGRO0_USFGROn1_VSn1_VWA4_VWB4_WSGRA0_WSGRB0_WS64_WG32_8_1_WGM1_WGMXCC8_WGMXCCGn1_WGR0
    SolutionIndex: 245
    SolutionNameMin: Cijk_Ailk_Bjlk_HHS_BH_Bias_HA_S_SAV_UserArgs_MT128x256x32_MI16x16x1_SN_LDSB1_AA0_AFC1_AF1_AAIGTEn1_AAILTEn1_AFEM1_AFEM1_ASEM1_BL1_BS1_CLR1_CADS0_DSK0_DU32_DTL0_DTVA0_DTVB0_DTVSM0_EPS0_FDSI0_GRPM1_GRVWA8_GRVWB8_GSU1_GSUAMB_GSUC0_GSUWGMRR0_GLS0_ISA942_IU1_IA0_KLA_LBSPPA1024_LBSPPB2048_LBSPPM0_LPA0_LPB0_LPM0_LRVW4_LWPMn1_MIAV0_MIWT4_8_MDA2_MI16_16_16_1_MO40_NR0_NTn1_NTA0_NTB4_NTC0_NTD4_NTE0_NTM0_NTWS0_NEPBS16_NLCA1_NLCB1_ONLL1_PGR2_PLR1_PKA1_SGR1_SIA3_SLW1_SS1_SU16_SUM0_SUS64_SPO0_SRVW0_SSO0_SVW4_SK0_SKA0_SKXCCM0_SNLL0_TT1_1_TLDS0_ULSGRO0_USL1_UIOFGRO0_USFGROn1_VSn1_VWA4_VWB8_WSGRA0_WSGRB0_WS64_WG32_8_1_WGM6_WGMXCC8_WGMXCCGn1_WGR0
    SolutionIndex: 246
    SolutionNameMin: Cijk_Ailk_Bjlk_HHS_BH_MT128x128x64_MI32x32x1_SN_LDSB1_GRVWB8_GSU1_LBSPPA0_LBSPPB0_LPA0_LPB0_MIWT2_2_NLCB1_SVW2_VWA2_VWB2_WG64_4_1
    SolutionIndex: 247
    SolutionNameMin: Cijk_Ailk_Bjlk_HHS_BH_UserArgs_MT256x256x32_MI16x16x1_SN_LDSB0_CLR1_GRVWA8_GRVWB8_GSU1_GSUC0_GSUWGMRR0_K1_LBSPPA2048_LBSPPB2048_LPA0_LPB0_MIWT8_8_NLCA1_NLCB1_PLR1_SU8_SUM1_SUS64_SVW8_VWA8_VWB8_WG32_8_1_WGM6_WGMXCC8_WGMXCCG304
    SolutionIndex: 248
    SolutionNameMin: Cijk_Ailk_Bjlk_HHS_BH_UserArgs_MT256x128x32_MI16x16x1_SN_LDSB1_CLR1_GRVWA8_GRVWB8_GSU1_GSUC0_GSUWGMRR0_K1_LBSPPA2048_LBSPPB1024_LPA0_LPB0_MIWT4_8_NLCA1_NLCB1_PLR1_SU16_SUM0_SUS64_SVW4_VWA4_VWB8_WG64_4_1_WGM8_WGMXCC8_WGMXCCG304
    SolutionIndex: 249
    SolutionNameMin: Cijk_Ailk_Bjlk_HHS_BH_Bias_HA_S_SAV_UserArgs_MT64x16x128_MI16x16x1_SN_LDSB1_AA0_AFC1_AF1_AAIGTEn1_AAILTEn1_AFEM1_AFEM1_ASEM1_BL1_BS1_CLR1_CADS0_DSK0_DU128_DTL0_DTVA0_DTVB0_DTVSM0_EPS0_FDSI0_GRPM1_GRVWA8_GRVWB1_GSU9_GSUAMBSK_GSUC0_GSUWGMRR0_GLS0_ISA942_IU1_IA0_KLA_LBSPPA512_LBSPPB128_LBSPPM0_LPA0_LPB16_LPM0_LRVW4_LWPMn1_MIAV0_MIWT4_1_MDA2_MI16_16_16_1_MO40_NR0_NTn1_NTA4_NTB0_NTC0_NTD0_NTE0_NTM0_NTWS0_NEPBS16_NLCA1_NLCB1_ONLL1_PGR2_PLR1_PKA1_SGR1_SIA3_SLW1_SS1_SU16_SUM0_SUS256_SPO0_SRVW0_SSO0_SVW4_SK0_SKA0_SKXCCM0_SNLL0_TT1_1_TLDS0_ULSGRO0_USL1_UIOFGRO0_USFGROn1_VSn1_VWA4_VWB1_WSGRA0_WSGRB0_WS64_WG16_4_4_WGM1_WGMXCC8_WGMXCCGn1_WGR0
    SolutionIndex: 250
    SolutionNameMin: Cijk_Ailk_Bjlk_HHS_BH_Bias_HA_S_SAV_UserArgs_MT64x16x128_MI16x16x1_SN_LDSB1_AA0_AFC1_AF1_AAIGTEn1_AAILTEn1_AFEM1_AFEM1_ASEM1_BL1_BS1_CLR1_CADS0_DSK0_DU128_DTL0_DTVA0_DTVB0_DTVSM0_EPS0_FDSI0_GRPM1_GRVWA8_GRVWB1_GSU4_GSUAMBSK_GSUC0_GSUWGMRR0_GLS0_ISA942_IU1_IA0_KLA_LBSPPA512_LBSPPB128_LBSPPM0_LPA0_LPB16_LPM0_LRVW4_LWPMn1_MIAV0_MIWT4_1_MDA2_MI16_16_16_1_MO40_NR0_NTn1_NTA4_NTB0_NTC0_NTD0_NTE0_NTM0_NTWS0_NEPBS16_NLCA1_NLCB1_ONLL1_PGR2_PLR1_PKA1_SGR1_SIA3_SLW1_SS1_SU16_SUM0_SUS256_SPO0_SRVW0_SSO0_SVW4_SK0_SKA0_SKXCCM0_SNLL0_TT1_1_TLDS0_ULSGRO0_USL1_UIOFGRO0_USFGROn1_VSn1_VWA4_VWB1_WSGRA0_WSGRB0_WS64_WG16_4_4_WGM1_WGMXCC8_WGMXCCGn1_WGR0
    SolutionIndex: 251
    SolutionNameMin: Cijk_Ailk_Bjlk_HHS_BH_Bias_HA_S_SAV_UserArgs_MT128x16x64_MI16x16x1_SN_LDSB1_AA0_AFC1_AF1_AAIGTEn1_AAILTEn1_AFEM1_AFEM1_ASEM1_BL1_BS1_CLR0_CADS0_DSK0_DU64_DTL0_DTVA0_DTVB0_DTVSM0_EPS0_FDSI0_GRPM1_GRVWA8_GRVWB2_GSU6_GSUAMBSK_GSUC0_GSUWGMRR0_GLS0_ISA942_IU1_IA0_KLA_LBSPPA1024_LBSPPB128_LBSPPM0_LPA0_LPB16_LPM0_LRVW4_LWPMn1_MIAV0_MIWT8_1_MDA2_MI16_16_16_1_MO40_NR0_NTn1_NTA4_NTB0_NTC0_NTD0_NTE0_NTM0_NTWS0_NEPBS16_NLCA1_NLCB1_ONLL1_PGR2_PLR0_PKA1_SGR1_SIA3_SLW1_SS1_SU16_SUM0_SUS128_SPO0_SRVW0_SSO0_SVW8_SK0_SKA0_SKXCCM0_SNLL0_TT1_1_TLDS0_ULSGRO0_USL1_UIOFGRO0_USFGROn1_VSn1_VWA8_VWB1_WSGRA0_WSGRB0_WS64_WG16_4_4_WGM1_WGMXCC8_WGMXCCGn1_WGR0
    SolutionIndex: 252
    SolutionNameMin: Cijk_Ailk_Bjlk_HHS_BH_UserArgs_MT64x128x64_MI16x16x1_SN_GSU8_GSUC0_GSUWGMRR0_K1_MIWT4_2_SU2_SUM2_SUS128_WGM6_WGMXCC1_WGMXCCGn1
    SolutionIndex: 253
    SolutionNameMin: Cijk_Ailk_Bjlk_HHS_BH_Bias_HA_S_SAV_UserArgs_MT128x64x64_MI16x16x1_SN_LDSB1_AA0_AFC1_AF1_AAIGTEn1_AAILTEn1_AFEM1_AFEM1_ASEM1_BL1_BS1_CLR1_CADS0_DSK0_DU64_DTL0_DTVA0_DTVB0_DTVSM0_EPS0_FDSI0_GRPM1_GRVWA8_GRVWB8_GSU8_GSUAMB_GSUC0_GSUWGMRR0_GLS0_ISA942_IU1_IA0_KLA_LBSPPA1024_LBSPPB512_LBSPPM0_LPA32_LPB0_LPM0_LRVW4_LWPMn1_MIAV0_MIWT2_4_MDA2_MI16_16_16_1_MO40_NR0_NTn1_NTA4_NTB0_NTC0_NTD0_NTE0_NTM0_NTWS0_NEPBS16_NLCA1_NLCB1_ONLL1_PGR2_PLR1_PKA1_SGR1_SIA3_SLW1_SS1_SU0_SUM0_SUS0_SPO0_SRVW0_SSO0_SVW2_SK0_SKA0_SKXCCM0_SNLL0_TT1_1_TLDS0_ULSGRO0_USL1_UIOFGRO0_USFGROn1_VSn1_VWA2_VWB4_WSGRA0_WSGRB0_WS64_WG64_4_1_WGM1_WGMXCC8_WGMXCCGn1_WGR0
    SolutionIndex: 254
    SolutionNameMin: Cijk_Ailk_Bjlk_HHS_BH_Bias_HA_S_SAV_UserArgs_MT32x64x64_MI16x16x1_SN_LDSB0_AA0_AFC1_AF1_AAIGTEn1_AAILTEn1_AFEM1_AFEM1_ASEM1_BL1_BS1_CLR1_CADS0_DSK0_DU64_DTL0_DTVA0_DTVB0_DTVSM0_EPS0_FDSI0_GRPM1_GRVWA8_GRVWB8_GSU3_GSUAMBSK_GSUC0_GSUWGMRR0_GLS0_ISA942_IU1_IA0_KLA_LBSPPA256_LBSPPB512_LBSPPM0_LPA32_LPB16_LPM0_LRVW4_LWPMn1_MIAV0_MIWT2_1_MDA2_MI16_16_16_1_MO40_NR0_NTn1_NTA0_NTB0_NTC0_NTD0_NTE0_NTM0_NTWS0_NEPBS0_NLCA1_NLCB1_ONLL1_PGR2_PLR1_PKA1_SGR1_SIA3_SLW1_SS1_SU0_SUM0_SUS0_SPO0_SRVW0_SSO0_SVW2_SK0_SKA0_SKXCCM0_SNLL0_TT1_1_TLDS0_ULSGRO0_USL1_UIOFGRO0_USFGROn1_VSn1_VWA2_VWB1_WSGRA0_WSGRB0_WS64_WG16_16_1_WGM1_WGMXCC8_WGMXCCGn1_WGR0
    SolutionIndex: 255
    SolutionNameMin: Cijk_Ailk_Bjlk_HHS_BH_Bias_HA_S_SAV_UserArgs_MT128x128x64_MI16x16x1_SN_LDSB1_AA0_AFC1_AF1_AAIGTEn1_AAILTEn1_AFEM1_AFEM1_ASEM1_BL1_BS1_CLR1_CADS0_DSK0_DU64_DTL0_DTVSM0_EPS0_FDSI0_GRPM1_GRVWA8_GRVWB8_GSU8_GSUAMB_GSUC1_GSUWGMRR0_GLS0_ISA942_IU1_IA0_KLA_LBSPPA1024_LBSPPB1024_LBSPPM0_LPA0_LPB0_LPM0_LRVW4_LWPMn1_MIAV0_MIWT4_4_MDA2_MI16_16_16_1_MO40_NR0_NTn1_NTA0_NTB0_NTC0_NTD0_NTE0_NTM0_NTWS0_NEPBS16_NLCA1_NLCB1_ONLL1_PGR2_PLR1_PKA1_SGR1_SIA3_SLW1_SS1_SU8_SUM0_SUS256_SPO0_SRVW0_SSO0_SVW4_SK0_SKA0_SKXCCM0_SNLL0_TT1_1_TLDS0_ULSGRO0_USL1_UIOFGRO0_USFGROn1_VSn1_VWA4_VWB4_WSGRA0_WSGRB0_WS64_WG32_8_1_WGM1_WGMXCC8_WGMXCCG32_WGR0
    SolutionIndex: 256
    SolutionNameMin: Cijk_Ailk_Bjlk_HHS_BH_Bias_HA_S_SAV_UserArgs_MT64x128x64_MI16x16x1_SN_LDSB1_AA0_AFC1_AF1_AAIGTEn1_AAILTEn1_AFEM1_AFEM1_ASEM1_BL1_BS1_CLR1_CADS0_DSK0_DU64_DTL0_DTVA0_DTVB0_DTVSM0_EPS0_FDSI0_GRPM1_GRVWA8_GRVWB8_GSU4_GSUAMB_GSUC0_GSUWGMRR0_GLS0_ISA942_IU1_IA0_KLA_LBSPPA512_LBSPPB1024_LBSPPM0_LPA32_LPB0_LPM0_LRVW4_LWPMn1_MIAV0_MIWT2_4_MDA2_MI16_16_16_1_MO40_NR0_NTn1_NTA0_NTB0_NTC0_NTD0_NTE0_NTM0_NTWS0_NEPBS16_NLCA1_NLCB1_ONLL1_PGR2_PLR1_PKA1_SGR1_SIA3_SLW1_SS1_SU0_SUM0_SUS0_SPO0_SRVW0_SSO0_SVW2_SK0_SKA0_SKXCCM0_SNLL0_TT1_1_TLDS0_ULSGRO0_USL1_UIOFGRO0_USFGROn1_VSn1_VWA2_VWB4_WSGRA0_WSGRB0_WS64_WG32_8_1_WGM1_WGMXCC8_WGMXCCGn1_WGR0
    SolutionIndex: 257
    SolutionNameMin: Cijk_Ailk_Bjlk_HHS_BH_Bias_HA_S_SAV_UserArgs_MT128x128x64_MI16x16x1_SN_LDSB1_AA0_AFC1_AF1_AAIGTEn1_AAILTEn1_AFEM1_AFEM1_ASEM1_BL1_BS1_CLR1_CADS0_DSK0_DU64_DTL0_DTVA0_DTVB0_DTVSM0_EPS0_FDSI0_GRPM1_GRVWA8_GRVWB8_GSU4_GSUAMB_GSUC0_GSUWGMRR0_GLS0_ISA942_IU1_IA0_KLA_LBSPPA1024_LBSPPB1024_LBSPPM0_LPA0_LPB0_LPM0_LRVW4_LWPMn1_MIAV0_MIWT4_4_MDA2_MI16_16_16_1_MO40_NR0_NTn1_NTA0_NTB4_NTC0_NTD0_NTE0_NTM0_NTWS0_NEPBS16_NLCA1_NLCB1_ONLL1_PGR2_PLR1_PKA1_SGR1_SIA3_SLW1_SS1_SU0_SUM0_SUS0_SPO0_SRVW0_SSO0_SVW4_SK0_SKA0_SKXCCM0_SNLL0_TT1_1_TLDS0_ULSGRO0_USL1_UIOFGRO0_USFGROn1_VSn1_VWA4_VWB4_WSGRA0_WSGRB0_WS64_WG32_8_1_WGM1_WGMXCC8_WGMXCCGn1_WGR0
    SolutionIndex: 258
    SolutionNameMin: Cijk_Ailk_Bjlk_HHS_BH_Bias_HA_S_SAV_UserArgs_MT256x128x32_MI16x16x1_SN_LDSB1_AA0_AFC1_AF1_AAIGTEn1_AAILTEn1_AFEM1_AFEM1_ASEM1_BL1_BS1_CLR1_CADS0_DSK0_DU32_DTL0_DTVA0_DTVB0_DTVSM0_EPS0_FDSI0_GRPM1_GRVWA8_GRVWB8_GSU6_GSUAMB_GSUC0_GSUWGMRR0_GLS0_ISA942_IU1_IA0_KLA_LBSPPA2048_LBSPPB1024_LBSPPM0_LPA0_LPB0_LPM0_LRVW4_LWPMn1_MIAV0_MIWT4_8_MDA2_MI16_16_16_1_MO40_NR0_NTn1_NTA0_NTB4_NTC0_NTD0_NTE0_NTM0_NTWS0_NEPBS16_NLCA1_NLCB1_ONLL1_PGR2_PLR1_PKA1_SGR1_SIA3_SLW1_SS1_SU0_SUM0_SUS0_SPO0_SRVW0_SSO0_SVW4_SK0_SKA0_SKXCCM0_SNLL0_TT1_1_TLDS0_ULSGRO0_USL1_UIOFGRO0_USFGROn1_VSn1_VWA4_VWB8_WSGRA0_WSGRB0_WS64_WG64_4_1_WGM1_WGMXCC8_WGMXCCGn1_WGR0
    SolutionIndex: 259
    SolutionNameMin: Cijk_Ailk_Bjlk_HHS_BH_Bias_HA_S_SAV_UserArgs_MT64x128x32_MI16x16x1_SN_LDSB0_AA0_AFC1_AF1_AAIGTEn1_AAILTEn1_AFEM1_AFEM1_ASEM1_BL1_BS1_CLR1_CADS0_DSK0_DU32_DTL0_DTVA0_DTVB0_DTVSM0_EPS0_FDSI0_GRPM1_GRVWA8_GRVWB8_GSU1_GSUAMB_GSUC0_GSUWGMRR0_GLS0_ISA942_IU1_IA0_KLA_LBSPPA512_LBSPPB1024_LBSPPM0_LPA0_LPB32_LPM0_LRVW4_LWPMn1_MIAV0_MIWT4_2_MDA2_MI16_16_16_1_MO40_NR0_NTn1_NTA4_NTB0_NTC0_NTD4_NTE0_NTM0_NTWS0_NEPBS16_NLCA1_NLCB1_ONLL1_PGR2_PLR1_PKA1_SGR1_SIA3_SLW1_SS1_SU16_SUM0_SUS64_SPO0_SRVW0_SSO0_SVW4_SK0_SKA0_SKXCCM0_SNLL0_TT1_1_TLDS0_ULSGRO0_USL1_UIOFGRO0_USFGROn1_VSn1_VWA4_VWB2_WSGRA0_WSGRB0_WS64_WG16_16_1_WGM8_WGMXCC8_WGMXCCGn1_WGR0
    SolutionIndex: 260
    SolutionNameMin: Cijk_Ailk_Bjlk_HHS_BH_Bias_HA_S_SAV_UserArgs_MT64x128x64_MI16x16x1_SN_LDSB1_AA0_AFC1_AF1_AAIGTEn1_AAILTEn1_AFEM1_AFEM1_ASEM1_BL1_BS1_CLR1_CADS0_DSK0_DU64_DTL0_DTVA0_DTVB0_DTVSM0_EPS0_FDSI0_GRPM1_GRVWA8_GRVWB8_GSU1_GSUAMB_GSUC0_GSUWGMRR0_GLS0_ISA942_IU1_IA0_KLA_LBSPPA512_LBSPPB1024_LBSPPM0_LPA0_LPB32_LPM0_LRVW4_LWPMn1_MIAV0_MIWT4_2_MDA2_MI16_16_16_1_MO40_NR0_NTn1_NTA4_NTB0_NTC0_NTD4_NTE0_NTM0_NTWS0_NEPBS16_NLCA1_NLCB1_ONLL1_PGR2_PLR1_PKA1_SGR1_SIA3_SLW1_SS1_SU16_SUM0_SUS128_SPO0_SRVW0_SSO0_SVW4_SK0_SKA0_SKXCCM0_SNLL0_TT1_1_TLDS0_ULSGRO0_USL1_UIOFGRO0_USFGROn1_VSn1_VWA4_VWB2_WSGRA0_WSGRB0_WS64_WG16_16_1_WGM8_WGMXCC8_WGMXCCGn1_WGR0
    SolutionIndex: 261
    SolutionNameMin: Cijk_Ailk_Bjlk_HHS_BH_Bias_HA_S_SAV_UserArgs_MT256x64x64_MI16x16x1_SN_LDSB1_AA0_AFC1_AF1_AAIGTEn1_AAILTEn1_AFEM1_AFEM1_ASEM1_BL1_BS1_CLR1_CADS0_DSK0_DU64_DTL0_DTVA0_DTVB0_DTVSM0_EPS0_FDSI0_GRPM1_GRVWA8_GRVWB8_GSU2_GSUAMBSK_GSUC0_GSUWGMRR0_GLS0_ISA942_IU1_IA0_KLA_LBSPPA2048_LBSPPB512_LBSPPM0_LPA0_LPB0_LPM0_LRVW4_LWPMn1_MIAV0_MIWT4_4_MDA2_MI16_16_16_1_MO40_NR0_NTn1_NTA0_NTB4_NTC0_NTD0_NTE0_NTM0_NTWS0_NEPBS0_NLCA1_NLCB1_ONLL1_PGR2_PLR1_PKA1_SGR1_SIA3_SLW1_SS1_SU0_SUM0_SUS0_SPO0_SRVW0_SSO0_SVW4_SK0_SKA0_SKXCCM0_SNLL0_TT1_1_TLDS0_ULSGRO0_USL1_UIOFGRO0_USFGROn1_VSn1_VWA4_VWB4_WSGRA0_WSGRB0_WS64_WG64_4_1_WGM1_WGMXCC8_WGMXCCGn1_WGR0
    SolutionIndex: 262
    SolutionNameMin: Cijk_Ailk_Bjlk_HHS_BH_Bias_HA_S_SAV_UserArgs_MT128x64x32_MI16x16x1_SN_LDSB0_AA0_AFC1_AF1_AAIGTEn1_AAILTEn1_AFEM1_AFEM1_ASEM1_BL1_BS1_CLR1_CADS0_DSK0_DU32_DTL0_DTVA0_DTVB0_DTVSM0_EPS0_FDSI0_GRPM1_GRVWA8_GRVWB8_GSU1_GSUAMB_GSUC0_GSUWGMRR0_GLS0_ISA942_IU1_IA0_KLA_LBSPPA1024_LBSPPB512_LBSPPM0_LPA0_LPB32_LPM0_LRVW4_LWPMn1_MIAV0_MIWT4_2_MDA2_MI16_16_16_1_MO40_NR0_NTn1_NTA0_NTB4_NTC0_NTD4_NTE0_NTM0_NTWS0_NEPBS16_NLCA1_NLCB1_ONLL1_PGR2_PLR1_PKA1_SGR1_SIA3_SLW1_SS1_SU8_SUM0_SUS64_SPO0_SRVW0_SSO0_SVW4_SK0_SKA0_SKXCCM0_SNLL0_TT1_1_TLDS0_ULSGRO0_USL1_UIOFGRO0_USFGROn1_VSn1_VWA4_VWB2_WSGRA0_WSGRB0_WS64_WG32_8_1_WGM1_WGMXCC8_WGMXCCGn1_WGR0
    SolutionIndex: 263
    SolutionNameMin: Cijk_Ailk_Bjlk_HHS_BH_Bias_HA_S_SAV_UserArgs_MT128x128x64_MI16x16x1_SN_LDSB1_AA0_AFC1_AF1_AAIGTEn1_AAILTEn1_AFEM1_AFEM1_ASEM1_BL1_BS1_CLR1_CADS0_DSK0_DU64_DTL0_DTVA0_DTVB0_DTVSM0_EPS0_FDSI0_GRPM1_GRVWA8_GRVWB8_GSU1_GSUAMB_GSUC0_GSUWGMRR0_GLS0_ISA942_IU1_IA0_KLA_LBSPPA1024_LBSPPB1024_LBSPPM0_LPA0_LPB0_LPM0_LRVW4_LWPMn1_MIAV0_MIWT4_4_MDA2_MI16_16_16_1_MO40_NR0_NTn1_NTA0_NTB4_NTC0_NTD4_NTE0_NTM0_NTWS0_NEPBS16_NLCA1_NLCB1_ONLL1_PGR2_PLR1_PKA1_SGR1_SIA3_SLW1_SS1_SU16_SUM0_SUS128_SPO0_SRVW0_SSO0_SVW4_SK0_SKA0_SKXCCM0_SNLL0_TT1_1_TLDS0_ULSGRO0_USL1_UIOFGRO0_USFGROn1_VSn1_VWA4_VWB4_WSGRA0_WSGRB0_WS64_WG32_8_1_WGM8_WGMXCC8_WGMXCCGn1_WGR0
    SolutionIndex: 264
    SolutionNameMin: Cijk_Ailk_Bjlk_HHS_BH_Bias_HA_S_SAV_UserArgs_MT128x128x64_MI16x16x1_SN_LDSB1_AA0_AFC1_AF1_AAIGTEn1_AAILTEn1_AFEM1_AFEM1_ASEM1_BL1_BS1_CLR1_CADS0_DSK0_DU64_DTL0_DTVA0_DTVB0_DTVSM0_EPS0_FDSI0_GRPM1_GRVWA8_GRVWB8_GSU1_GSUAMB_GSUC0_GSUWGMRR0_GLS0_ISA942_IU1_IA0_KLA_LBSPPA1024_LBSPPB1024_LBSPPM0_LPA0_LPB0_LPM0_LRVW4_LWPMn1_MIAV0_MIWT4_4_MDA2_MI16_16_16_1_MO40_NR0_NTn1_NTA4_NTB0_NTC0_NTD4_NTE0_NTM0_NTWS0_NEPBS16_NLCA1_NLCB1_ONLL1_PGR2_PLR1_PKA1_SGR1_SIA3_SLW1_SS1_SU8_SUM0_SUS128_SPO0_SRVW0_SSO0_SVW4_SK0_SKA0_SKXCCM0_SNLL0_TT1_1_TLDS0_ULSGRO0_USL1_UIOFGRO0_USFGROn1_VSn1_VWA4_VWB4_WSGRA0_WSGRB0_WS64_WG32_8_1_WGM1_WGMXCC8_WGMXCCGn1_WGR0
    SolutionIndex: 265
    SolutionNameMin: Cijk_Ailk_Bjlk_HHS_BH_Bias_HAS_SAV_UserArgs_MT512x128x32_MI16x16x1_SN_LDSB0_DTVA1_GRVWA8_GRVWB8_GSU1_GSUC0_GSUWGMRR0_K1_LBSPPA0_LBSPPB1024_LPA0_LPB0_MIWT8_8_NLCA1_NLCB1_SU32_SUM0_SUS64_SVW8_USFGRO1_VWA8_VWB8_WG64_4_1_WGM1_WGMXCC1_WGMXCCGn1
    SolutionIndex: 266
    SolutionNameMin: Cijk_Ailk_Bjlk_HHS_BH_UserArgs_MT256x256x32_MI16x16x1_SN_GRVWB8_GSU1_GSUC0_GSUWGMRR0_K1_LBSPPB2048_LPB0_MIWT8_8_NEPBS0_NLCB1_SU8_SUM0_SUS64_SVW8_VWA8_VWB8_WG32_8_1_WGM1_WGMXCC8_WGMXCCGn1
    SolutionIndex: 267
    SolutionNameMin: Cijk_Ailk_Bjlk_HHS_BH_UserArgs_MT256x256x32_MI16x16x1_SN_GSU1_K1_LBSPPA2048_LPA0_LPB0_MIAV0_MIWT8_8_NTA3_NTB3_NTC4_NTD4_SS1_SU32_SUM0_SUS64_SPO1_SVW8_VWA8_VWB8_WG32_8_1_WGMn8
    SolutionIndex: 268
    SolutionNameMin: Cijk_Ailk_Bjlk_HHS_BH_Bias_HA_S_SAV_UserArgs_MT128x256x32_MI16x16x1_SN_LDSB1_AA0_AFC1_AF1_AAIGTEn1_AAILTEn1_AFEM1_AFEM1_ASEM1_BL1_BS1_CLR1_CADS0_DSK0_DU32_DTL0_DTVA0_DTVB0_DTVSM0_EPS0_FDSI0_GRPM1_GRVWA8_GRVWB8_GSU1_GSUAMB_GSUC0_GSUWGMRR0_GLS0_ISA942_IU1_IA0_KLA_LBSPPA1024_LBSPPB2048_LBSPPM0_LPA0_LPB0_LPM0_LRVW4_LWPMn1_MIAV0_MIWT4_8_MDA2_MI16_16_16_1_MO40_NR0_NTn1_NTA4_NTB0_NTC0_NTD4_NTE0_NTM0_NTWS0_NEPBS16_NLCA1_NLCB1_ONLL1_PGR2_PLR1_PKA1_SGR1_SIA3_SLW1_SS1_SU8_SUM1_SUS64_SPO0_SRVW0_SSO0_SVW4_SK0_SKA0_SKXCCM0_SNLL0_TT1_1_TLDS0_ULSGRO0_USL1_UIOFGRO0_USFGROn1_VSn1_VWA4_VWB8_WSGRA0_WSGRB0_WS64_WG32_8_1_WGM6_WGMXCC8_WGMXCCGn1_WGR0
    SolutionIndex: 269
    SolutionNameMin: Cijk_Ailk_Bjlk_HHS_BH_Bias_HA_S_SAV_UserArgs_MT256x128x32_MI16x16x1_SN_LDSB1_AA0_AFC1_AF1_AAIGTEn1_AAILTEn1_AFEM1_AFEM1_ASEM1_BL1_BS1_CLR1_CADS0_DSK0_DU32_DTL0_DTVA0_DTVB0_DTVSM0_EPS0_FDSI0_GRPM1_GRVWA8_GRVWB8_GSU1_GSUAMB_GSUC0_GSUWGMRR0_GLS0_ISA942_IU1_IA0_KLA_LBSPPA2048_LBSPPB1024_LBSPPM0_LPA0_LPB0_LPM0_LRVW4_LWPMn1_MIAV0_MIWT8_4_MDA2_MI16_16_16_1_MO40_NR0_NTn1_NTA0_NTB4_NTC0_NTD4_NTE0_NTM0_NTWS0_NEPBS16_NLCA1_NLCB1_ONLL1_PGR2_PLR1_PKA1_SGR1_SIA3_SLW1_SS1_SU16_SUM0_SUS64_SPO0_SRVW0_SSO0_SVW8_SK0_SKA0_SKXCCM0_SNLL0_TT1_1_TLDS0_ULSGRO0_USL1_UIOFGRO0_USFGROn1_VSn1_VWA8_VWB4_WSGRA0_WSGRB0_WS64_WG32_8_1_WGM6_WGMXCC8_WGMXCCGn1_WGR0
    SolutionIndex: 270
    SolutionNameMin: Cijk_Ailk_Bjlk_HHS_BH_Bias_HAS_SAV_UserArgs_MT512x128x32_MI16x16x1_SN_GSU1_GSUC0_GSUWGMRR0_K1_MIWT8_8_SU32_SUM0_SUS64_WGM1_WGMXCC1_WGMXCCGn1
    SolutionIndex: 271
    SolutionNameMin: Cijk_Ailk_Bjlk_HHS_BH_Bias_HA_S_SAV_UserArgs_MT128x16x128_MI16x16x1_SN_LDSB1_AA0_AFC1_AF1_AAIGTEn1_AAILTEn1_AFEM1_AFEM1_ASEM1_BL1_BS1_CLR1_CADS0_DSK0_DU128_DTL0_DTVA0_DTVB0_DTVSM0_EPS0_FDSI0_GRPM1_GRVWA8_GRVWB4_GSU8_GSUAMBSK_GSUC0_GSUWGMRR0_GLS0_ISA942_IU1_IA0_KLA_LBSPPA1024_LBSPPB128_LBSPPM0_LPA0_LPB16_LPM0_LRVW4_LWPMn1_MIAV0_MIWT4_1_MDA2_MI16_16_16_1_MO40_NR0_NTn1_NTA4_NTB0_NTC0_NTD0_NTE0_NTM0_NTWS0_NEPBS16_NLCA1_NLCB1_ONLL1_PGR2_PLR1_PKA1_SGR1_SIA3_SLW1_SS1_SU16_SUM0_SUS256_SPO0_SRVW0_SSO0_SVW4_SK0_SKA0_SKXCCM0_SNLL0_TT1_1_TLDS0_ULSGRO0_USL1_UIOFGRO0_USFGROn1_VSn1_VWA4_VWB1_WSGRA0_WSGRB0_WS64_WG32_4_2_WGM1_WGMXCC8_WGMXCCGn1_WGR0
    SolutionIndex: 272
    SolutionNameMin: Cijk_Ailk_Bjlk_HHS_BH_Bias_HA_S_SAV_UserArgs_MT128x16x64_MI16x16x1_SN_LDSB1_AA0_AFC1_AF1_AAIGTEn1_AAILTEn1_AFEM1_AFEM1_ASEM1_BL1_BS1_CLR0_CADS0_DSK0_DU64_DTL0_DTVA0_DTVB0_DTVSM0_EPS0_FDSI0_GRPM1_GRVWA8_GRVWB4_GSU4_GSUAMBSK_GSUC0_GSUWGMRR0_GLS0_ISA942_IU1_IA0_KLA_LBSPPA1024_LBSPPB128_LBSPPM0_LPA0_LPB16_LPM0_LRVW4_LWPMn1_MIAV0_MIWT8_1_MDA2_MI16_16_16_1_MO40_NR0_NTn1_NTA4_NTB0_NTC0_NTD0_NTE0_NTM0_NTWS0_NEPBS16_NLCA1_NLCB1_ONLL1_PGR2_PLR0_PKA1_SGR1_SIA3_SLW1_SS1_SU16_SUM0_SUS128_SPO0_SRVW0_SSO0_SVW8_SK0_SKA0_SKXCCM0_SNLL0_TT1_1_TLDS0_ULSGRO0_USL1_UIOFGRO0_USFGROn1_VSn1_VWA8_VWB1_WSGRA0_WSGRB0_WS64_WG16_4_4_WGM1_WGMXCC8_WGMXCCGn1_WGR0
    SolutionIndex: 273
    SolutionNameMin: Cijk_Ailk_Bjlk_HHS_BH_Bias_HA_S_SAV_UserArgs_MT128x32x64_MI16x16x1_SN_LDSB1_AA0_AFC1_AF1_AAIGTEn1_AAILTEn1_AFEM1_AFEM1_ASEM1_BL1_BS1_CLR1_CADS0_DSK0_DU64_DTL0_DTVA0_DTVB0_DTVSM0_EPS0_FDSI0_GRPM1_GRVWA8_GRVWB8_GSU6_GSUAMBSK_GSUC0_GSUWGMRR0_GLS0_ISA942_IU1_IA0_KLA_LBSPPA1024_LBSPPB256_LBSPPM0_LPA0_LPB16_LPM0_LRVW4_LWPMn1_MIAV0_MIWT4_1_MDA2_MI16_16_16_1_MO40_NR0_NTn1_NTA4_NTB0_NTC0_NTD0_NTE0_NTM0_NTWS0_NEPBS0_NLCA1_NLCB1_ONLL1_PGR2_PLR1_PKA1_SGR1_SIA3_SLW1_SS1_SU0_SUM0_SUS0_SPO0_SRVW0_SSO0_SVW4_SK0_SKA0_SKXCCM0_SNLL0_TT1_1_TLDS0_ULSGRO0_USL1_UIOFGRO0_USFGROn1_VSn1_VWA4_VWB1_WSGRA0_WSGRB0_WS64_WG32_8_1_WGM1_WGMXCC8_WGMXCCGn1_WGR0
    SolutionIndex: 274
    SolutionNameMin: Cijk_Ailk_Bjlk_HHS_BH_Bias_HA_S_SAV_UserArgs_MT128x32x64_MI16x16x1_SN_LDSB1_AA0_AFC1_AF1_AAIGTEn1_AAILTEn1_AFEM1_AFEM1_ASEM1_BL1_BS1_CLR1_CADS0_DSK0_DU64_DTL0_DTVA0_DTVB0_DTVSM0_EPS0_FDSI0_GRPM1_GRVWA8_GRVWB8_GSU8_GSUAMB_GSUC0_GSUWGMRR0_GLS0_ISA942_IU1_IA0_KLA_LBSPPA1024_LBSPPB256_LBSPPM0_LPA0_LPB16_LPM0_LRVW4_LWPMn1_MIAV0_MIWT4_1_MDA2_MI16_16_16_1_MO40_NR0_NTn1_NTA0_NTB0_NTC0_NTD0_NTE0_NTM0_NTWS0_NEPBS16_NLCA1_NLCB1_ONLL1_PGR2_PLR1_PKA1_SGR1_SIA3_SLW1_SS1_SU0_SUM0_SUS0_SPO0_SRVW0_SSO0_SVW4_SK0_SKA0_SKXCCM0_SNLL0_TT1_1_TLDS0_ULSGRO0_USL1_UIOFGRO0_USFGROn1_VSn1_VWA4_VWB1_WSGRA0_WSGRB0_WS64_WG32_8_1_WGM1_WGMXCC8_WGMXCCGn1_WGR0
    SolutionIndex: 275
    SolutionNameMin: Cijk_Ailk_Bjlk_HHS_BH_UserArgs_MT128x64x64_MI16x16x1_SN_GSU8_GSUC0_GSUWGMRR0_K1_MIWT4_2_SU4_SUM0_SUS512_WGM76_WGMXCC32_WGMXCCG0
    SolutionIndex: 276
    SolutionNameMin: Cijk_Ailk_Bjlk_HHS_BH_Bias_HA_S_SAV_UserArgs_MT32x32x64_MI16x16x1_SN_LDSB0_AA0_AFC1_AF1_AAIGTEn1_AAILTEn1_AFEM1_AFEM1_ASEM1_BL1_BS1_CLR1_CADS0_DSK0_DU64_DTL0_DTVA0_DTVB0_DTVSM0_EPS0_FDSI0_GRPM1_GRVWA8_GRVWB8_GSU1_GSUAMB_GSUC0_GSUWGMRR0_GLS0_ISA942_IU1_IA0_KLA_LBSPPA256_LBSPPB256_LBSPPM0_LPA16_LPB16_LPM0_LRVW4_LWPMn1_MIAV0_MIWT1_1_MDA2_MI16_16_16_1_MO40_NR0_NTn1_NTA0_NTB0_NTC0_NTD4_NTE0_NTM0_NTWS0_NEPBS16_NLCA1_NLCB1_ONLL1_PGR2_PLR1_PKA1_SGR1_SIA3_SLW1_SS1_SU16_SUM0_SUS128_SPO0_SRVW0_SSO0_SVW1_SK0_SKA0_SKXCCM0_SNLL0_TT1_1_TLDS0_ULSGRO0_USL1_UIOFGRO0_USFGROn1_VSn1_VWA1_VWB1_WSGRA0_WSGRB0_WS64_WG32_8_1_WGM8_WGMXCC8_WGMXCCGn1_WGR0
    SolutionIndex: 277
    SolutionNameMin: Cijk_Ailk_Bjlk_HHS_BH_Bias_HA_S_SAV_UserArgs_MT64x32x64_MI16x16x1_SN_LDSB0_AA0_AFC1_AF1_AAIGTEn1_AAILTEn1_AFEM1_AFEM1_ASEM1_BL1_BS1_CLR1_CADS0_DSK0_DU64_DTL0_DTVA0_DTVB0_DTVSM0_EPS0_FDSI0_GRPM1_GRVWA8_GRVWB8_GSU1_GSUAMB_GSUC0_GSUWGMRR0_GLS0_ISA942_IU1_IA0_KLA_LBSPPA512_LBSPPB256_LBSPPM0_LPA16_LPB32_LPM0_LRVW4_LWPMn1_MIAV0_MIWT1_2_MDA2_MI16_16_16_1_MO40_NR0_NTn1_NTA0_NTB0_NTC0_NTD4_NTE0_NTM0_NTWS0_NEPBS16_NLCA1_NLCB1_ONLL1_PGR2_PLR1_PKA1_SGR1_SIA3_SLW1_SS1_SU16_SUM0_SUS128_SPO0_SRVW0_SSO0_SVW1_SK0_SKA0_SKXCCM0_SNLL0_TT1_1_TLDS0_ULSGRO0_USL1_UIOFGRO0_USFGROn1_VSn1_VWA1_VWB2_WSGRA0_WSGRB0_WS64_WG64_4_1_WGM8_WGMXCC8_WGMXCCGn1_WGR0
    SolutionIndex: 278
    SolutionNameMin: Cijk_Ailk_Bjlk_HHS_BH_UserArgs_MT64x128x64_MI16x16x1_SN_GSU8_GSUC0_GSUWGMRR0_K1_MIWT4_2_SU2_SUM2_SUS128_WGM6_WGMXCC1_WGMXCCGn1
    SolutionIndex: 279
    SolutionNameMin: Cijk_Ailk_Bjlk_HHS_BH_Bias_HA_S_SAV_UserArgs_MT64x32x64_MI16x16x1_SN_LDSB0_AA0_AFC1_AF1_AAIGTEn1_AAILTEn1_AFEM1_AFEM1_ASEM1_BL1_BS1_CLR1_CADS0_DSK0_DU64_DTL0_DTVA0_DTVB0_DTVSM0_EPS0_FDSI0_GRPM1_GRVWA8_GRVWB8_GSU1_GSUAMB_GSUC0_GSUWGMRR0_GLS0_ISA942_IU1_IA0_KLA_LBSPPA512_LBSPPB256_LBSPPM0_LPA32_LPB16_LPM0_LRVW4_LWPMn1_MIAV0_MIWT2_1_MDA2_MI16_16_16_1_MO40_NR0_NTn1_NTA0_NTB0_NTC0_NTD4_NTE0_NTM0_NTWS0_NEPBS16_NLCA1_NLCB1_ONLL1_PGR2_PLR1_PKA1_SGR1_SIA3_SLW1_SS1_SU16_SUM0_SUS128_SPO0_SRVW0_SSO0_SVW2_SK0_SKA0_SKXCCM0_SNLL0_TT1_1_TLDS0_ULSGRO0_USL1_UIOFGRO0_USFGROn1_VSn1_VWA2_VWB1_WSGRA0_WSGRB0_WS64_WG32_8_1_WGM8_WGMXCC8_WGMXCCGn1_WGR0
    SolutionIndex: 280
    SolutionNameMin: Cijk_Ailk_Bjlk_HHS_BH_UserArgs_MT256x128x32_MI16x16x1_SN_GSU6_GSUC0_GSUWGMRR0_K1_MIWT4_8_SU4_SUM2_SUS512_WGM6_WGMXCC32_WGMXCCG0
    SolutionIndex: 281
    SolutionNameMin: Cijk_Ailk_Bjlk_HHS_BH_Bias_HA_S_SAV_UserArgs_MT128x128x64_MI16x16x1_SN_LDSB1_AA0_AFC1_AF1_AAIGTEn1_AAILTEn1_AFEM1_AFEM1_ASEM1_BL1_BS1_CLR1_CADS0_DSK0_DU64_DTL0_DTVA0_DTVB0_DTVSM0_EPS0_FDSI0_GRPM1_GRVWA8_GRVWB8_GSU4_GSUAMB_GSUC0_GSUWGMRR0_GLS0_ISA942_IU1_IA0_KLA_LBSPPA1024_LBSPPB1024_LBSPPM0_LPA0_LPB0_LPM0_LRVW4_LWPMn1_MIAV0_MIWT4_4_MDA2_MI16_16_16_1_MO40_NR0_NTn1_NTA0_NTB0_NTC0_NTD0_NTE0_NTM0_NTWS0_NEPBS16_NLCA1_NLCB1_ONLL1_PGR2_PLR1_PKA1_SGR1_SIA3_SLW1_SS1_SU0_SUM0_SUS0_SPO0_SRVW0_SSO0_SVW4_SK0_SKA0_SKXCCM0_SNLL0_TT1_1_TLDS0_ULSGRO0_USL1_UIOFGRO0_USFGROn1_VSn1_VWA4_VWB4_WSGRA0_WSGRB0_WS64_WG32_8_1_WGM1_WGMXCC8_WGMXCCGn1_WGR0
    SolutionIndex: 282
    SolutionNameMin: Cijk_Ailk_Bjlk_HHS_BH_Bias_HA_S_SAV_UserArgs_MT128x128x64_MI16x16x1_SN_LDSB1_AA0_AFC1_AF1_AAIGTEn1_AAILTEn1_AFEM1_AFEM1_ASEM1_BL1_BS1_CLR1_CADS0_DSK0_DU64_DTL0_DTVA0_DTVB0_DTVSM0_EPS0_FDSI0_GRPM1_GRVWA8_GRVWB8_GSU1_GSUAMB_GSUC0_GSUWGMRR0_GLS0_ISA942_IU1_IA0_KLA_LBSPPA1024_LBSPPB1024_LBSPPM0_LPA0_LPB0_LPM0_LRVW4_LWPMn1_MIAV0_MIWT4_4_MDA2_MI16_16_16_1_MO40_NR0_NTn1_NTA4_NTB0_NTC0_NTD4_NTE0_NTM0_NTWS0_NEPBS16_NLCA1_NLCB1_ONLL1_PGR2_PLR1_PKA1_SGR1_SIA3_SLW1_SS1_SU16_SUM0_SUS128_SPO0_SRVW0_SSO0_SVW4_SK0_SKA0_SKXCCM0_SNLL0_TT1_1_TLDS0_ULSGRO0_USL1_UIOFGRO0_USFGROn1_VSn1_VWA4_VWB4_WSGRA0_WSGRB0_WS64_WG32_8_1_WGM6_WGMXCC8_WGMXCCGn1_WGR0
    SolutionIndex: 283
    SolutionNameMin: Cijk_Ailk_Bjlk_HHS_BH_Bias_HA_S_SAV_UserArgs_MT64x128x32_MI16x16x1_SN_LDSB0_AA0_AFC1_AF1_AAIGTEn1_AAILTEn1_AFEM1_AFEM1_ASEM1_BL1_BS1_CLR1_CADS0_DSK0_DU32_DTL0_DTVA0_DTVB0_DTVSM0_EPS0_FDSI0_GRPM1_GRVWA8_GRVWB8_GSU1_GSUAMB_GSUC0_GSUWGMRR0_GLS0_ISA942_IU1_IA0_KLA_LBSPPA512_LBSPPB1024_LBSPPM0_LPA0_LPB32_LPM0_LRVW4_LWPMn1_MIAV0_MIWT4_2_MDA2_MI16_16_16_1_MO40_NR0_NTn1_NTA0_NTB0_NTC0_NTD4_NTE0_NTM0_NTWS0_NEPBS16_NLCA1_NLCB1_ONLL1_PGR2_PLR1_PKA1_SGR1_SIA3_SLW1_SS1_SU16_SUM0_SUS64_SPO0_SRVW0_SSO0_SVW4_SK0_SKA0_SKXCCM0_SNLL0_TT1_1_TLDS0_ULSGRO0_USL1_UIOFGRO0_USFGROn1_VSn1_VWA4_VWB2_WSGRA0_WSGRB0_WS64_WG16_16_1_WGM8_WGMXCC8_WGMXCCGn1_WGR0
    SolutionIndex: 284
    SolutionNameMin: Cijk_Ailk_Bjlk_HHS_BH_Bias_HA_S_SAV_UserArgs_MT256x128x32_MI16x16x1_SN_LDSB1_AA0_AFC1_AF1_AAIGTEn1_AAILTEn1_AFEM1_AFEM1_ASEM1_BL1_BS1_CLR1_CADS0_DSK0_DU32_DTL0_DTVA0_DTVB0_DTVSM0_EPS0_FDSI0_GRPM1_GRVWA8_GRVWB8_GSU1_GSUAMB_GSUC0_GSUWGMRR0_GLS0_ISA942_IU1_IA0_KLA_LBSPPA2048_LBSPPB1024_LBSPPM0_LPA0_LPB0_LPM0_LRVW4_LWPMn1_MIAV0_MIWT8_4_MDA2_MI16_16_16_1_MO40_NR0_NTn1_NTA0_NTB0_NTC0_NTD4_NTE0_NTM0_NTWS0_NEPBS16_NLCA1_NLCB1_ONLL1_PGR2_PLR1_PKA1_SGR1_SIA3_SLW1_SS1_SU16_SUM0_SUS64_SPO0_SRVW0_SSO0_SVW8_SK0_SKA0_SKXCCM0_SNLL0_TT1_1_TLDS0_ULSGRO0_USL1_UIOFGRO0_USFGROn1_VSn1_VWA8_VWB4_WSGRA0_WSGRB0_WS64_WG32_8_1_WGM6_WGMXCC8_WGMXCCGn1_WGR0
    SolutionIndex: 285
    SolutionNameMin: Cijk_Ailk_Bjlk_HHS_BH_Bias_HAS_SAV_UserArgs_MT128x256x32_MI16x16x1_SN_LDSB1_DTVA0_GRVWA8_GRVWB8_GSU1_GSUC0_GSUWGMRR0_K1_LBSPPA1024_LBSPPB2048_LPA0_LPB0_MIWT4_8_NLCA1_NLCB1_SU8_SUM0_SUS64_SVW4_USFGRO1_VWA4_VWB8_WG32_8_1_WGM8_WGMXCC1_WGMXCCGn1
    SolutionIndex: 286
    SolutionNameMin: Cijk_Ailk_Bjlk_HHS_BH_Bias_HA_S_SAV_UserArgs_MT128x256x32_MI16x16x1_SN_LDSB1_AA0_AFC1_AF1_AAIGTEn1_AAILTEn1_AFEM1_AFEM1_ASEM1_BL1_BS1_CLR1_CADS0_DSK0_DU32_DTL0_DTVA0_DTVB0_DTVSM0_EPS0_FDSI0_GRPM1_GRVWA8_GRVWB8_GSU1_GSUAMB_GSUC0_GSUWGMRR0_GLS0_ISA942_IU1_IA0_KLA_LBSPPA1024_LBSPPB2048_LBSPPM0_LPA0_LPB0_LPM0_LRVW4_LWPM0p50_MIAV0_MIWT8_4_MDA2_MI16_16_16_1_MO40_NR0_NTn1_NTA0_NTB4_NTC0_NTD4_NTE0_NTM0_NTWS0_NEPBS16_NLCA1_NLCB1_ONLL1_PGR2_PLR1_PKA1_SGR1_SIA3_SLW1_SS1_SU0_SUM0_SUS0_SPO0_SRVW0_SSO0_SVW8_SK0_SKA0_SKXCCM0_SNLL0_TT1_1_TLDS0_ULSGRO0_USL1_UIOFGRO0_USFGROn1_VSn1_VWA8_VWB4_WSGRA1_WSGRB0_WS64_WG16_16_1_WGM0_WGMXCC8_WGMXCCGn1_WGR0
    SolutionIndex: 287
    SolutionNameMin: Cijk_Ailk_Bjlk_HHS_BH_Bias_HAS_SAV_UserArgs_MT128x256x32_MI16x16x1_SN_LDSB1_DTVA0_GRVWA8_GRVWB8_GSU1_GSUC0_GSUWGMRR0_K1_LBSPPA1024_LBSPPB2048_LPA0_LPB0_MIWT4_8_NLCA1_NLCB1_SU0_SUM0_SUS0_SVW4_USFGRO1_VWA4_VWB8_WG32_8_1_WGM32_WGMXCC1_WGMXCCGn1
    SolutionIndex: 288
    SolutionNameMin: Cijk_Ailk_Bjlk_HHS_BH_Bias_HA_S_SAV_UserArgs_MT64x16x64_MI16x16x1_SN_LDSB0_AA0_AFC1_AF1_AAIGTEn1_AAILTEn1_AFEM1_AFEM1_ASEM1_BL1_BS1_CLR1_CADS0_DSK0_DU64_DTL0_DTVA0_DTVB0_DTVSM0_EPS0_FDSI0_GRPM1_GRVWA8_GRVWB4_GSU1_GSUAMB_GSUC0_GSUWGMRR0_GLS0_ISA942_IU1_IA0_KLA_LBSPPA512_LBSPPB128_LBSPPM0_LPA16_LPB16_LPM0_LRVW4_LWPMn1_MIAV0_MIWT1_1_MDA2_MI16_16_16_1_MO40_NR0_NTn1_NTA4_NTB0_NTC0_NTD4_NTE0_NTM0_NTWS0_NEPBS16_NLCA1_NLCB1_ONLL1_PGR2_PLR1_PKA1_SGR1_SIA3_SLW1_SS1_SU8_SUM0_SUS128_SPO0_SRVW0_SSO0_SVW1_SK0_SKA0_SKXCCM0_SNLL0_TT1_1_TLDS0_ULSGRO0_USL1_UIOFGRO0_USFGROn1_VSn1_VWA1_VWB1_WSGRA0_WSGRB0_WS64_WG64_4_1_WGM1_WGMXCC8_WGMXCCGn1_WGR0
    SolutionIndex: 289
    SolutionNameMin: Cijk_Ailk_Bjlk_HHS_BH_Bias_HA_S_SAV_UserArgs_MT128x16x64_MI16x16x1_SN_LDSB1_AA0_AFC1_AF1_AAIGTEn1_AAILTEn1_AFEM1_AFEM1_ASEM1_BL1_BS1_CLR1_CADS0_DSK0_DU64_DTL0_DTVA0_DTVB0_DTVSM0_EPS0_FDSI0_GRPM1_GRVWA8_GRVWB1_GSU4_GSUAMBSK_GSUC0_GSUWGMRR0_GLS0_ISA942_IU1_IA0_KLA_LBSPPA1024_LBSPPB128_LBSPPM0_LPA0_LPB16_LPM0_LRVW4_LWPMn1_MIAV0_MIWT4_1_MDA2_MI16_16_16_1_MO40_NR0_NTn1_NTA4_NTB0_NTC0_NTD0_NTE0_NTM0_NTWS0_NEPBS16_NLCA1_NLCB1_ONLL1_PGR2_PLR1_PKA1_SGR1_SIA3_SLW1_SS1_SU16_SUM0_SUS128_SPO0_SRVW0_SSO0_SVW4_SK0_SKA0_SKXCCM0_SNLL0_TT1_1_TLDS0_ULSGRO0_USL1_UIOFGRO0_USFGROn1_VSn1_VWA4_VWB1_WSGRA0_WSGRB0_WS64_WG32_4_2_WGM1_WGMXCC8_WGMXCCGn1_WGR0
    SolutionIndex: 290
    SolutionNameMin: Cijk_Ailk_Bjlk_HHS_BH_Bias_HA_S_SAV_UserArgs_MT128x16x128_MI16x16x1_SN_LDSB1_AA0_AFC1_AF1_AAIGTEn1_AAILTEn1_AFEM1_AFEM1_ASEM1_BL1_BS1_CLR1_CADS0_DSK0_DU128_DTL0_DTVA0_DTVB0_DTVSM0_EPS0_FDSI0_GRPM1_GRVWA8_GRVWB2_GSU4_GSUAMBSK_GSUC0_GSUWGMRR0_GLS0_ISA942_IU1_IA0_KLA_LBSPPA1024_LBSPPB128_LBSPPM0_LPA0_LPB16_LPM0_LRVW4_LWPMn1_MIAV0_MIWT4_1_MDA2_MI16_16_16_1_MO40_NR0_NTn1_NTA4_NTB0_NTC0_NTD0_NTE0_NTM0_NTWS0_NEPBS16_NLCA1_NLCB1_ONLL1_PGR2_PLR1_PKA1_SGR1_SIA3_SLW1_SS1_SU16_SUM0_SUS256_SPO0_SRVW0_SSO0_SVW4_SK0_SKA0_SKXCCM0_SNLL0_TT1_1_TLDS0_ULSGRO0_USL1_UIOFGRO0_USFGROn1_VSn1_VWA4_VWB1_WSGRA0_WSGRB0_WS64_WG32_4_2_WGM1_WGMXCC8_WGMXCCGn1_WGR0
    SolutionIndex: 291
    SolutionNameMin: Cijk_Ailk_Bjlk_HHS_BH_Bias_HA_S_SAV_UserArgs_MT128x16x128_MI16x16x1_SN_LDSB1_AA0_AFC1_AF1_AAIGTEn1_AAILTEn1_AFEM1_AFEM1_ASEM1_BL1_BS1_CLR1_CADS0_DSK0_DU128_DTL0_DTVA0_DTVB0_DTVSM0_EPS0_FDSI0_GRPM1_GRVWA8_GRVWB1_GSU4_GSUAMBSK_GSUC0_GSUWGMRR0_GLS0_ISA942_IU1_IA0_KLA_LBSPPA1024_LBSPPB128_LBSPPM0_LPA0_LPB16_LPM0_LRVW4_LWPMn1_MIAV0_MIWT8_1_MDA2_MI16_16_16_1_MO40_NR0_NTn1_NTA4_NTB0_NTC0_NTD0_NTE0_NTM0_NTWS0_NEPBS16_NLCA1_NLCB1_ONLL1_PGR2_PLR1_PKA1_SGR1_SIA3_SLW1_SS1_SU16_SUM0_SUS256_SPO0_SRVW0_SSO0_SVW8_SK0_SKA0_SKXCCM0_SNLL0_TT1_1_TLDS0_ULSGRO0_USL1_UIOFGRO0_USFGROn1_VSn1_VWA8_VWB1_WSGRA0_WSGRB0_WS64_WG16_4_4_WGM1_WGMXCC8_WGMXCCGn1_WGR0
    SolutionIndex: 292
    SolutionNameMin: Cijk_Ailk_Bjlk_HHS_BH_Bias_HA_S_SAV_UserArgs_MT32x32x128_MI16x16x1_SN_LDSB1_AA0_AFC1_AF1_AAIGTEn1_AAILTEn1_AFEM1_AFEM1_ASEM1_BL1_BS1_CLR1_CADS0_DSK0_DU128_DTL0_DTVA0_DTVB0_DTVSM0_EPS0_FDSI0_GRPM1_GRVWA8_GRVWB8_GSU1_GSUAMB_GSUC0_GSUWGMRR0_GLS0_ISA942_IU1_IA0_KLA_LBSPPA256_LBSPPB256_LBSPPM0_LPA16_LPB16_LPM0_LRVW4_LWPMn1_MIAV0_MIWT1_1_MDA2_MI16_16_16_1_MO40_NR0_NTn1_NTA4_NTB0_NTC0_NTD4_NTE0_NTM0_NTWS0_NEPBS16_NLCA1_NLCB1_ONLL1_PGR2_PLR1_PKA1_SGR1_SIA3_SLW1_SS1_SU16_SUM0_SUS256_SPO0_SRVW0_SSO0_SVW1_SK0_SKA0_SKXCCM0_SNLL0_TT1_1_TLDS0_ULSGRO0_USL1_UIOFGRO0_USFGROn1_VSn1_VWA1_VWB1_WSGRA0_WSGRB0_WS64_WG32_8_1_WGM8_WGMXCC8_WGMXCCGn1_WGR0
    SolutionIndex: 293
    SolutionNameMin: Cijk_Ailk_Bjlk_HHS_BH_Bias_HA_S_SAV_UserArgs_MT128x32x128_MI16x16x1_SN_LDSB1_AA0_AFC1_AF1_AAIGTEn1_AAILTEn1_AFEM1_AFEM1_ASEM1_BL1_BS1_CLR1_CADS0_DSK0_DU128_DTL0_DTVA0_DTVB0_DTVSM0_EPS0_FDSI0_GRPM1_GRVWA8_GRVWB8_GSU4_GSUAMBSK_GSUC0_GSUWGMRR0_GLS0_ISA942_IU1_IA0_KLA_LBSPPA1024_LBSPPB256_LBSPPM0_LPA0_LPB16_LPM0_LRVW4_LWPMn1_MIAV0_MIWT4_1_MDA2_MI16_16_16_1_MO40_NR0_NTn1_NTA4_NTB0_NTC0_NTD0_NTE0_NTM0_NTWS0_NEPBS0_NLCA1_NLCB1_ONLL1_PGR2_PLR1_PKA1_SGR1_SIA3_SLW1_SS1_SU0_SUM0_SUS0_SPO0_SRVW0_SSO0_SVW4_SK0_SKA0_SKXCCM0_SNLL0_TT1_1_TLDS0_ULSGRO0_USL1_UIOFGRO0_USFGROn1_VSn1_VWA4_VWB1_WSGRA0_WSGRB0_WS64_WG32_8_1_WGM1_WGMXCC8_WGMXCCGn1_WGR0
    SolutionIndex: 294
    SolutionNameMin: Cijk_Ailk_Bjlk_HHS_BH_Bias_HA_S_SAV_UserArgs_MT128x32x64_MI16x16x1_SN_LDSB1_AA0_AFC1_AF1_AAIGTEn1_AAILTEn1_AFEM1_AFEM1_ASEM1_BL1_BS1_CLR1_CADS0_DSK0_DU64_DTL0_DTVA0_DTVB0_DTVSM0_EPS0_FDSI0_GRPM1_GRVWA8_GRVWB8_GSU4_GSUAMBSK_GSUC0_GSUWGMRR0_GLS0_ISA942_IU1_IA0_KLA_LBSPPA1024_LBSPPB256_LBSPPM0_LPA0_LPB16_LPM0_LRVW4_LWPMn1_MIAV0_MIWT4_1_MDA2_MI16_16_16_1_MO40_NR0_NTn1_NTA0_NTB0_NTC0_NTD0_NTE0_NTM0_NTWS0_NEPBS0_NLCA1_NLCB1_ONLL1_PGR2_PLR1_PKA1_SGR1_SIA3_SLW1_SS1_SU0_SUM0_SUS0_SPO0_SRVW0_SSO0_SVW4_SK0_SKA0_SKXCCM0_SNLL0_TT1_1_TLDS0_ULSGRO0_USL1_UIOFGRO0_USFGROn1_VSn1_VWA4_VWB1_WSGRA0_WSGRB0_WS64_WG32_8_1_WGM1_WGMXCC8_WGMXCCGn1_WGR0
    SolutionIndex: 295
    SolutionNameMin: Cijk_Ailk_Bjlk_HHS_BH_Bias_HA_S_SAV_UserArgs_MT32x64x64_MI16x16x1_SN_LDSB0_AA0_AFC1_AF1_AAIGTEn1_AAILTEn1_AFEM1_AFEM1_ASEM1_BL1_BS1_CLR1_CADS0_DSK0_DU64_DTL0_DTVA0_DTVB0_DTVSM0_EPS0_FDSI0_GRPM1_GRVWA8_GRVWB8_GSU1_GSUAMB_GSUC0_GSUWGMRR0_GLS0_ISA942_IU1_IA0_KLA_LBSPPA256_LBSPPB512_LBSPPM0_LPA32_LPB16_LPM0_LRVW4_LWPMn1_MIAV0_MIWT2_1_MDA2_MI16_16_16_1_MO40_NR0_NTn1_NTA4_NTB0_NTC0_NTD4_NTE0_NTM0_NTWS0_NEPBS16_NLCA1_NLCB1_ONLL1_PGR2_PLR1_PKA1_SGR1_SIA3_SLW1_SS1_SU8_SUM0_SUS128_SPO0_SRVW0_SSO0_SVW2_SK0_SKA0_SKXCCM0_SNLL0_TT1_1_TLDS0_ULSGRO0_USL1_UIOFGRO0_USFGROn1_VSn1_VWA2_VWB1_WSGRA0_WSGRB0_WS64_WG16_16_1_WGM1_WGMXCC8_WGMXCCGn1_WGR0
    SolutionIndex: 296
    SolutionNameMin: Cijk_Ailk_Bjlk_HHS_BH_Bias_HA_S_SAV_UserArgs_MT64x32x128_MI16x16x1_SN_LDSB1_AA0_AFC1_AF1_AAIGTEn1_AAILTEn1_AFEM1_AFEM1_ASEM1_BL1_BS1_CLR1_CADS0_DSK0_DU128_DTL0_DTVA0_DTVB0_DTVSM0_EPS0_FDSI0_GRPM1_GRVWA8_GRVWB8_GSU1_GSUAMB_GSUC0_GSUWGMRR0_GLS0_ISA942_IU1_IA0_KLA_LBSPPA512_LBSPPB256_LBSPPM0_LPA32_LPB16_LPM0_LRVW4_LWPMn1_MIAV0_MIWT2_1_MDA2_MI16_16_16_1_MO40_NR0_NTn1_NTA0_NTB0_NTC0_NTD4_NTE0_NTM0_NTWS0_NEPBS16_NLCA1_NLCB1_ONLL1_PGR2_PLR1_PKA1_SGR1_SIA3_SLW1_SS1_SU8_SUM0_SUS256_SPO0_SRVW0_SSO0_SVW2_SK0_SKA0_SKXCCM0_SNLL0_TT1_1_TLDS0_ULSGRO0_USL1_UIOFGRO0_USFGROn1_VSn1_VWA2_VWB1_WSGRA0_WSGRB0_WS64_WG32_8_1_WGM1_WGMXCC8_WGMXCCGn1_WGR0
    SolutionIndex: 297
    SolutionNameMin: Cijk_Ailk_Bjlk_HHS_BH_Bias_HA_S_SAV_UserArgs_MT256x32x64_MI16x16x1_SN_LDSB1_AA0_AFC1_AF1_AAIGTEn1_AAILTEn1_AFEM1_AFEM1_ASEM1_BL1_BS1_CLR1_CADS0_DSK0_DU64_DTL0_DTVA0_DTVB0_DTVSM0_EPS0_FDSI0_GRPM1_GRVWA8_GRVWB8_GSU4_GSUAMB_GSUC0_GSUWGMRR0_GLS0_ISA942_IU1_IA0_KLA_LBSPPA2048_LBSPPB256_LBSPPM0_LPA0_LPB32_LPM0_LRVW4_LWPMn1_MIAV0_MIWT4_2_MDA2_MI16_16_16_1_MO40_NR0_NTn1_NTA4_NTB0_NTC0_NTD0_NTE0_NTM0_NTWS0_NEPBS16_NLCA1_NLCB1_ONLL1_PGR2_PLR1_PKA1_SGR1_SIA3_SLW1_SS1_SU0_SUM0_SUS0_SPO0_SRVW0_SSO0_SVW4_SK0_SKA0_SKXCCM0_SNLL0_TT1_1_TLDS0_ULSGRO0_USL1_UIOFGRO0_USFGROn1_VSn1_VWA4_VWB2_WSGRA0_WSGRB0_WS64_WG64_4_1_WGM1_WGMXCC8_WGMXCCGn1_WGR0
    SolutionIndex: 298
    SolutionNameMin: Cijk_Ailk_Bjlk_HHS_BH_Bias_HA_S_SAV_UserArgs_MT128x64x64_MI16x16x1_SN_LDSB1_AA0_AFC1_AF1_AAIGTEn1_AAILTEn1_AFEM1_AFEM1_ASEM1_BL1_BS1_CLR1_CADS0_DSK0_DU64_DTL0_DTVA0_DTVB0_DTVSM0_EPS0_FDSI0_GRPM1_GRVWA8_GRVWB8_GSU4_GSUAMB_GSUC0_GSUWGMRR0_GLS0_ISA942_IU1_IA0_KLA_LBSPPA1024_LBSPPB512_LBSPPM0_LPA32_LPB0_LPM0_LRVW4_LWPMn1_MIAV0_MIWT2_4_MDA2_MI16_16_16_1_MO40_NR0_NTn1_NTA0_NTB4_NTC0_NTD0_NTE0_NTM0_NTWS0_NEPBS16_NLCA1_NLCB1_ONLL1_PGR2_PLR1_PKA1_SGR1_SIA3_SLW1_SS1_SU0_SUM0_SUS0_SPO0_SRVW0_SSO0_SVW2_SK0_SKA0_SKXCCM0_SNLL0_TT1_1_TLDS0_ULSGRO0_USL1_UIOFGRO0_USFGROn1_VSn1_VWA2_VWB4_WSGRA0_WSGRB0_WS64_WG64_4_1_WGM1_WGMXCC8_WGMXCCGn1_WGR0
    SolutionIndex: 299
    SolutionNameMin: Cijk_Ailk_Bjlk_HHS_BH_Bias_HA_S_SAV_UserArgs_MT64x64x64_MI16x16x1_SN_LDSB1_AA0_AFC1_AF1_AAIGTEn1_AAILTEn1_AFEM1_AFEM1_ASEM1_BL1_BS1_CLR1_CADS0_DSK0_DU64_DTL0_DTVA0_DTVB0_DTVSM0_EPS0_FDSI0_GRPM1_GRVWA8_GRVWB8_GSU1_GSUAMB_GSUC0_GSUWGMRR0_GLS0_ISA942_IU1_IA0_KLA_LBSPPA512_LBSPPB512_LBSPPM0_LPA0_LPB16_LPM0_LRVW4_LWPMn1_MIAV0_MIWT4_1_MDA2_MI16_16_16_1_MO40_NR0_NTn1_NTA4_NTB0_NTC0_NTD4_NTE0_NTM0_NTWS0_NEPBS16_NLCA1_NLCB1_ONLL1_PGR2_PLR1_PKA1_SGR1_SIA3_SLW1_SS1_SU8_SUM0_SUS128_SPO0_SRVW0_SSO0_SVW4_SK0_SKA0_SKXCCM0_SNLL0_TT1_1_TLDS0_ULSGRO0_USL1_UIOFGRO0_USFGROn1_VSn1_VWA4_VWB1_WSGRA0_WSGRB0_WS64_WG16_16_1_WGM1_WGMXCC8_WGMXCCGn1_WGR0
    SolutionIndex: 300
    SolutionNameMin: Cijk_Ailk_Bjlk_HHS_BH_Bias_HA_S_SAV_UserArgs_MT128x96x64_MI16x16x1_SN_LDSB1_AA0_AFC1_AF1_AAIGTEn1_AAILTEn1_AFEM1_AFEM1_ASEM1_BL1_BS1_CLR1_CADS0_DSK0_DU64_DTL0_DTVA0_DTVB0_DTVSM0_EPS0_FDSI0_GRPM1_GRVWA8_GRVWB8_GSU4_GSUAMB_GSUC0_GSUWGMRR0_GLS0_ISA942_IU1_IA0_KLA_LBSPPA1024_LBSPPB768_LBSPPM0_LPA0_LPB16_LPM0_LRVW4_LWPMn1_MIAV0_MIWT4_3_MDA2_MI16_16_16_1_MO40_NR0_NTn1_NTA4_NTB0_NTC0_NTD0_NTE0_NTM0_NTWS0_NEPBS16_NLCA1_NLCB3_ONLL1_PGR2_PLR1_PKA1_SGR1_SIA3_SLW1_SS1_SU0_SUM0_SUS0_SPO0_SRVW0_SSO0_SVW4_SK0_SKA0_SKXCCM0_SNLL0_TT1_1_TLDS0_ULSGRO0_USL1_UIOFGRO0_USFGROn1_VSn1_VWA4_VWB1_WSGRA0_WSGRB0_WS64_WG32_8_1_WGM1_WGMXCC8_WGMXCCGn1_WGR0
    SolutionIndex: 301
    SolutionNameMin: Cijk_Ailk_Bjlk_HHS_BH_Bias_HA_S_SAV_UserArgs_MT32x128x64_MI16x16x1_SN_LDSB1_AA0_AFC1_AF1_AAIGTEn1_AAILTEn1_AFEM1_AFEM1_ASEM1_BL1_BS1_CLR1_CADS0_DSK0_DU64_DTL0_DTVA0_DTVB0_DTVSM0_EPS0_FDSI0_GRPM1_GRVWA8_GRVWB8_GSU1_GSUAMB_GSUC0_GSUWGMRR0_GLS0_ISA942_IU1_IA0_KLA_LBSPPA256_LBSPPB1024_LBSPPM0_LPA32_LPB32_LPM0_LRVW4_LWPMn1_MIAV0_MIWT2_2_MDA2_MI16_16_16_1_MO40_NR0_NTn1_NTA4_NTB0_NTC0_NTD4_NTE0_NTM0_NTWS0_NEPBS16_NLCA1_NLCB1_ONLL1_PGR2_PLR1_PKA1_SGR1_SIA3_SLW1_SS1_SU8_SUM0_SUS128_SPO0_SRVW0_SSO0_SVW2_SK0_SKA0_SKXCCM0_SNLL0_TT1_1_TLDS0_ULSGRO0_USL1_UIOFGRO0_USFGROn1_VSn1_VWA2_VWB2_WSGRA0_WSGRB0_WS64_WG16_16_1_WGM1_WGMXCC8_WGMXCCGn1_WGR0
    SolutionIndex: 302
    SolutionNameMin: Cijk_Ailk_Bjlk_HHS_BH_Bias_HA_S_SAV_UserArgs_MT64x64x32_MI16x16x1_SN_LDSB0_AA0_AFC1_AF1_AAIGTEn1_AAILTEn1_AFEM1_AFEM1_ASEM1_BL1_BS1_CLR1_CADS0_DSK0_DU32_DTL0_DTVA0_DTVB0_DTVSM0_EPS0_FDSI0_GRPM1_GRVWA8_GRVWB8_GSU1_GSUAMB_GSUC0_GSUWGMRR0_GLS0_ISA942_IU1_IA0_KLA_LBSPPA512_LBSPPB512_LBSPPM0_LPA0_LPB16_LPM0_LRVW4_LWPMn1_MIAV0_MIWT4_1_MDA2_MI16_16_16_1_MO40_NR0_NTn1_NTA0_NTB0_NTC0_NTD4_NTE0_NTM0_NTWS0_NEPBS16_NLCA1_NLCB1_ONLL1_PGR2_PLR1_PKA1_SGR1_SIA3_SLW1_SS1_SU8_SUM0_SUS64_SPO0_SRVW0_SSO0_SVW4_SK0_SKA0_SKXCCM0_SNLL0_TT1_1_TLDS0_ULSGRO0_USL1_UIOFGRO0_USFGROn1_VSn1_VWA4_VWB1_WSGRA0_WSGRB0_WS64_WG16_16_1_WGM1_WGMXCC8_WGMXCCGn1_WGR0
    SolutionIndex: 303
    SolutionNameMin: Cijk_Ailk_Bjlk_HHS_BH_Bias_HA_S_SAV_UserArgs_MT64x96x64_MI16x16x1_SN_LDSB1_AA0_AFC1_AF1_AAIGTEn1_AAILTEn1_AFEM1_AFEM1_ASEM1_BL1_BS1_CLR1_CADS0_DSK0_DU64_DTL0_DTVA0_DTVB0_DTVSM0_EPS0_FDSI0_GRPM1_GRVWA8_GRVWB8_GSU1_GSUAMB_GSUC0_GSUWGMRR0_GLS0_ISA942_IU1_IA0_KLA_LBSPPA512_LBSPPB768_LBSPPM0_LPA32_LPB16_LPM0_LRVW4_LWPMn1_MIAV0_MIWT2_3_MDA2_MI16_16_16_1_MO40_NR0_NTn1_NTA4_NTB0_NTC0_NTD4_NTE0_NTM0_NTWS0_NEPBS16_NLCA1_NLCB3_ONLL1_PGR2_PLR1_PKA1_SGR1_SIA3_SLW1_SS1_SU16_SUM0_SUS128_SPO0_SRVW0_SSO0_SVW2_SK0_SKA0_SKXCCM0_SNLL0_TT1_1_TLDS0_ULSGRO0_USL1_UIOFGRO0_USFGROn1_VSn1_VWA2_VWB1_WSGRA0_WSGRB0_WS64_WG32_8_1_WGM8_WGMXCC8_WGMXCCGn1_WGR0
    SolutionIndex: 304
    SolutionNameMin: Cijk_Ailk_Bjlk_HHS_BH_Bias_HA_S_SAV_UserArgs_MT128x128x64_MI16x16x1_SN_LDSB1_AA0_AFC1_AF1_AAIGTEn1_AAILTEn1_AFEM1_AFEM1_ASEM1_BL1_BS1_CLR1_CADS0_DSK0_DU64_DTL0_DTVA0_DTVB0_DTVSM0_EPS0_FDSI0_GRPM1_GRVWA8_GRVWB8_GSU2_GSUAMB_GSUC0_GSUWGMRR0_GLS0_ISA942_IU1_IA0_KLA_LBSPPA1024_LBSPPB1024_LBSPPM0_LPA0_LPB0_LPM0_LRVW4_LWPMn1_MIAV0_MIWT4_4_MDA2_MI16_16_16_1_MO40_NR0_NTn1_NTA4_NTB0_NTC0_NTD0_NTE0_NTM0_NTWS0_NEPBS16_NLCA1_NLCB1_ONLL1_PGR2_PLR1_PKA1_SGR1_SIA3_SLW1_SS1_SU0_SUM0_SUS0_SPO0_SRVW0_SSO0_SVW4_SK0_SKA0_SKXCCM0_SNLL0_TT1_1_TLDS0_ULSGRO0_USL1_UIOFGRO0_USFGROn1_VSn1_VWA4_VWB4_WSGRA0_WSGRB0_WS64_WG32_8_1_WGM1_WGMXCC8_WGMXCCGn1_WGR0
    SolutionIndex: 305
    SolutionNameMin: Cijk_Ailk_Bjlk_HHS_BH_Bias_HA_S_SAV_UserArgs_MT192x192x32_MI16x16x1_SN_LDSB0_AA0_AFC1_AF1_AAIGTEn1_AAILTEn1_AFEM1_AFEM1_ASEM1_BL1_BS1_CLR1_CADS0_DSK0_DU32_DTL0_DTVA0_DTVB0_DTVSM0_EPS0_FDSI0_GRPM1_GRVWA8_GRVWB8_GSU5_GSUAMB_GSUC0_GSUWGMRR0_GLS0_ISA942_IU1_IA0_KLA_LBSPPA1536_LBSPPB1536_LBSPPM0_LPA32_LPB32_LPM0_LRVW4_LWPMn1_MIAV0_MIWT6_6_MDA2_MI16_16_16_1_MO40_NR0_NTn1_NTA0_NTB4_NTC0_NTD0_NTE0_NTM0_NTWS0_NEPBS16_NLCA3_NLCB3_ONLL1_PGR2_PLR1_PKA1_SGR1_SIA3_SLW1_SS1_SU0_SUM0_SUS0_SPO0_SRVW0_SSO0_SVW2_SK0_SKA0_SKXCCM0_SNLL0_TT1_1_TLDS0_ULSGRO0_USL1_UIOFGRO0_USFGROn1_VSn1_VWA2_VWB2_WSGRA0_WSGRB0_WS64_WG32_8_1_WGM1_WGMXCC8_WGMXCCGn1_WGR0
    SolutionIndex: 306
    SolutionNameMin: Cijk_Ailk_Bjlk_HHS_BH_Bias_HA_S_SAV_UserArgs_MT64x128x32_MI16x16x1_SN_LDSB0_AA0_AFC1_AF1_AAIGTEn1_AAILTEn1_AFEM1_AFEM1_ASEM1_BL1_BS1_CLR1_CADS0_DSK0_DU32_DTL0_DTVA0_DTVB0_DTVSM0_EPS0_FDSI0_GRPM1_GRVWA8_GRVWB8_GSU1_GSUAMB_GSUC0_GSUWGMRR0_GLS0_ISA942_IU1_IA0_KLA_LBSPPA512_LBSPPB1024_LBSPPM0_LPA0_LPB32_LPM0_LRVW4_LWPMn1_MIAV0_MIWT4_2_MDA2_MI16_16_16_1_MO40_NR0_NTn1_NTA4_NTB0_NTC0_NTD4_NTE0_NTM0_NTWS0_NEPBS16_NLCA1_NLCB1_ONLL1_PGR2_PLR1_PKA1_SGR1_SIA3_SLW1_SS1_SU8_SUM0_SUS64_SPO0_SRVW0_SSO0_SVW4_SK0_SKA0_SKXCCM0_SNLL0_TT1_1_TLDS0_ULSGRO0_USL1_UIOFGRO0_USFGROn1_VSn1_VWA4_VWB2_WSGRA0_WSGRB0_WS64_WG16_16_1_WGM1_WGMXCC8_WGMXCCGn1_WGR0
    SolutionIndex: 307
    SolutionNameMin: Cijk_Ailk_Bjlk_HHS_BH_Bias_HA_S_SAV_UserArgs_MT128x256x32_MI16x16x1_SN_LDSB1_AA0_AFC1_AF1_AAIGTEn1_AAILTEn1_AFEM1_AFEM1_ASEM1_BL1_BS1_CLR1_CADS0_DSK0_DU32_DTL0_DTVA0_DTVB0_DTVSM0_EPS0_FDSI0_GRPM1_GRVWA8_GRVWB8_GSU8_GSUAMB_GSUC0_GSUWGMRR0_GLS0_ISA942_IU1_IA0_KLA_LBSPPA1024_LBSPPB2048_LBSPPM0_LPA0_LPB0_LPM0_LRVW4_LWPMn1_MIAV0_MIWT4_8_MDA2_MI16_16_16_1_MO40_NR0_NTn1_NTA0_NTB0_NTC0_NTD0_NTE0_NTM0_NTWS0_NEPBS16_NLCA1_NLCB1_ONLL1_PGR2_PLR1_PKA1_SGR1_SIA3_SLW1_SS1_SU0_SUM0_SUS0_SPO0_SRVW0_SSO0_SVW4_SK0_SKA0_SKXCCM0_SNLL0_TT1_1_TLDS0_ULSGRO0_USL1_UIOFGRO0_USFGROn1_VSn1_VWA4_VWB8_WSGRA0_WSGRB0_WS64_WG32_8_1_WGM1_WGMXCC8_WGMXCCGn1_WGR0
    SolutionIndex: 308
    SolutionNameMin: Cijk_Ailk_Bjlk_HHS_BH_Bias_HA_S_SAV_UserArgs_MT128x128x64_MI16x16x1_SN_LDSB1_AA0_AFC0_AF1_AAIGTEn1_AAILTEn1_AFEM1_AFEM1_ASEM1_BL1_BS1_CLR1_CADS0_DSK0_DU64_DTL0_DTVA0_DTVB0_DTVSM0_EPS0_FDSI0_GRPM0p90_GRVWA8_GRVWB8_GSU1_GSUAMB_GSUC0_GSUWGMRR0_GLS0_ISA942_IU1_IA0_KLA_LDSTI0_LBSPPA1024_LBSPPB1024_LBSPPM0_LPA0_LPB0_LPM0_LRVW4_LWPMn1_MIAV0_MIWT4_4_MDA2_MI16_16_16_1_MO40_MPO0_NR0_NTn1_NTA0_NTB0_NTC0_NTD4_NTE0_NTM0_NTWS0_NEPBS0_NLCA1_NLCB1_ONLL1_PGR2_PLR1_PKA1_SGR1_SIA3_SLW1_SS1_SU8_SUM2_SUS128_SPO0_SRVW0_SSO0_SVW4_SK0_SKA0_SKXCCM0_SNLL0_TT1_1_TLDS0_ULSGRO0_USL1_UIOFGRO0_USFGRO0_VSn1_VWA4_VWB4_WSGRA0_WSGRB2_WSK0_WS64_WG32_8_1_WGM6_WGMXCC8_WGMXCCGn1_WGR0
    SolutionIndex: 309
    SolutionNameMin: Cijk_Ailk_Bjlk_HHS_BH_Bias_HA_S_SAV_UserArgs_MT128x128x64_MI16x16x1_SN_LDSB1_AA0_AFC1_AF1_AAIGTEn1_AAILTEn1_AFEM1_AFEM1_ASEM1_BL1_BS1_CLR1_CADS0_DSK0_DU64_DTL0_DTVA0_DTVB0_DTVSM0_EPS0_FDSI0_GRPM1_GRVWA8_GRVWB8_GSU1_GSUAMB_GSUC0_GSUWGMRR0_GLS0_ISA942_IU1_IA0_KLA_LBSPPA1024_LBSPPB1024_LBSPPM0_LPA0_LPB0_LPM0_LRVW4_LWPMn1_MIAV0_MIWT4_4_MDA2_MI16_16_16_1_MO40_NR0_NTn1_NTA0_NTB0_NTC0_NTD4_NTE0_NTM0_NTWS0_NEPBS16_NLCA1_NLCB1_ONLL1_PGR2_PLR1_PKA1_SGR1_SIA3_SLW1_SS1_SU16_SUM0_SUS128_SPO0_SRVW0_SSO0_SVW4_SK0_SKA0_SKXCCM0_SNLL0_TT1_1_TLDS0_ULSGRO0_USL1_UIOFGRO0_USFGROn1_VSn1_VWA4_VWB4_WSGRA0_WSGRB0_WS64_WG32_8_1_WGM6_WGMXCC8_WGMXCCGn1_WGR0
    SolutionIndex: 310
    SolutionNameMin: Cijk_Ailk_Bjlk_HHS_BH_Bias_HA_S_SAV_UserArgs_MT128x256x32_MI16x16x1_SN_LDSB1_AA0_AFC1_AF1_AAIGTEn1_AAILTEn1_AFEM1_AFEM1_ASEM1_BL1_BS1_CLR1_CADS0_DSK0_DU32_DTL0_DTVA0_DTVB0_DTVSM0_EPS0_FDSI0_GRPM1_GRVWA8_GRVWB8_GSU2_GSUAMB_GSUC0_GSUWGMRR0_GLS0_ISA942_IU1_IA0_KLA_LBSPPA1024_LBSPPB2048_LBSPPM0_LPA0_LPB0_LPM0_LRVW4_LWPMn1_MIAV0_MIWT4_8_MDA2_MI16_16_16_1_MO40_NR0_NTn1_NTA0_NTB4_NTC0_NTD0_NTE0_NTM0_NTWS0_NEPBS16_NLCA1_NLCB1_ONLL1_PGR2_PLR1_PKA1_SGR1_SIA3_SLW1_SS1_SU0_SUM0_SUS0_SPO0_SRVW0_SSO0_SVW4_SK0_SKA0_SKXCCM0_SNLL0_TT1_1_TLDS0_ULSGRO0_USL1_UIOFGRO0_USFGROn1_VSn1_VWA4_VWB8_WSGRA0_WSGRB0_WS64_WG32_8_1_WGM1_WGMXCC8_WGMXCCGn1_WGR0
    SolutionIndex: 311
    SolutionNameMin: Cijk_Ailk_Bjlk_HHS_BH_UserArgs_MT256x96x64_MI16x16x1_SN_GSU1_GSUAMBSK_GSUC0_GSUWGMRR1_K1_MIWT4_6_SU16_SUM0_SUS128_SK0_WGM8_WGMXCC8_WGMXCCG304
    SolutionIndex: 312
    SolutionNameMin: Cijk_Ailk_Bjlk_HHS_BH_MT256x128x32_MI16x16x1_SN_LDSB1_GRVWB8_GSU1_LBSPPA2048_LBSPPB1024_LPA16_LPB48_MIWT4_8_NLCB1_SU4_SUM2_SUS256_SPO0_SVW4_VWA4_VWB8_WG64_4_1_WGM1
    SolutionIndex: 313
    SolutionNameMin: Cijk_Ailk_Bjlk_HHS_BH_Bias_HAS_SAV_UserArgs_MT256x128x32_MI16x16x1_SN_GSU1_GSUC0_GSUWGMRR0_K1_LBSPPA2048_LBSPPB1024_MIWT4_8_SU8_SUM0_SUS64_WG64_4_1_WGM8_WGMXCC8_WGMXCCG0
    SolutionIndex: 314
    SolutionNameMin: Cijk_Ailk_Bjlk_HHS_BH_UserArgs_MT512x144x32_MI16x16x1_SN_GSU1_GSUC0_GSUWGMRR0_K1_MIWT8_9_SU4_SUM0_SUS128_WGM0_WGMXCC4_WGMXCCGn1
    SolutionIndex: 315
    SolutionNameMin: Cijk_Ailk_Bjlk_HHS_BH_Bias_HA_S_SAV_UserArgs_MT64x16x256_MI16x16x1_SN_LDSB1_AA0_AFC1_AF1_AAIGTEn1_AAILTEn1_AFEM1_AFEM1_ASEM1_BL1_BS1_CLR1_CADS0_DSK0_DU256_DTL0_DTVA0_DTVB0_DTVSM0_EPS0_FDSI0_GRPM1_GRVWA8_GRVWB8_GSU1_GSUAMB_GSUC0_GSUWGMRR0_GLS0_ISA942_IU1_IA0_KLA_LBSPPA512_LBSPPB128_LBSPPM0_LPA16_LPB16_LPM0_LRVW4_LWPMn1_MIAV0_MIWT1_1_MDA2_MI16_16_16_1_MO40_NR0_NTn1_NTA4_NTB0_NTC0_NTD4_NTE0_NTM0_NTWS0_NEPBS16_NLCA1_NLCB1_ONLL1_PGR2_PLR1_PKA1_SGR1_SIA3_SLW1_SS1_SU16_SUM0_SUS512_SPO0_SRVW0_SSO0_SVW1_SK0_SKA0_SKXCCM0_SNLL0_TT1_1_TLDS0_ULSGRO0_USL1_UIOFGRO0_USFGROn1_VSn1_VWA1_VWB1_WSGRA0_WSGRB0_WS64_WG64_4_1_WGM6_WGMXCC8_WGMXCCGn1_WGR0
    SolutionIndex: 316
    SolutionNameMin: Cijk_Ailk_Bjlk_HHS_BH_Bias_HA_S_SAV_UserArgs_MT128x16x128_MI16x16x1_SN_LDSB1_AA0_AFC1_AF1_AAIGTEn1_AAILTEn1_AFEM1_AFEM1_ASEM1_BL1_BS1_CLR1_CADS0_DSK0_DU128_DTL0_DTVA0_DTVB0_DTVSM0_EPS0_FDSI0_GRPM1_GRVWA8_GRVWB2_GSU2_GSUAMBSK_GSUC0_GSUWGMRR0_GLS0_ISA942_IU1_IA0_KLA_LBSPPA1024_LBSPPB128_LBSPPM0_LPA0_LPB16_LPM0_LRVW4_LWPMn1_MIAV0_MIWT4_1_MDA2_MI16_16_16_1_MO40_NR0_NTn1_NTA4_NTB0_NTC0_NTD0_NTE0_NTM0_NTWS0_NEPBS16_NLCA1_NLCB1_ONLL1_PGR2_PLR1_PKA1_SGR1_SIA3_SLW1_SS1_SU16_SUM0_SUS256_SPO0_SRVW0_SSO0_SVW4_SK0_SKA0_SKXCCM0_SNLL0_TT1_1_TLDS0_ULSGRO0_USL1_UIOFGRO0_USFGROn1_VSn1_VWA4_VWB1_WSGRA0_WSGRB0_WS64_WG32_4_2_WGM1_WGMXCC8_WGMXCCGn1_WGR0
    SolutionIndex: 340
    SolutionNameMin: Cijk_Ailk_Bjlk_HHS_BH_Bias_HA_S_SAV_UserArgs_MT256x128x32_MI16x16x1_SN_LDSB1_AA0_AFC1_AF1_AAIGTEn1_AAILTEn1_AFEM1_AFEM1_ASEM1_BL1_BS1_CLR1_CADS0_DSK0_DU32_DTL0_DTVA0_DTVB0_DTVSM0_EPS0_FDSI0_GRPM1_GRVWA8_GRVWB8_GSU1_GSUAMB_GSUC0_GSUWGMRR0_GLS0_ISA942_IU1_IA0_KLA_LBSPPA2048_LBSPPB1024_LBSPPM0_LPA0_LPB0_LPM0_LRVW4_LWPMn1_MIAV0_MIWT4_8_MDA2_MI16_16_16_1_MO40_NR0_NTn1_NTA0_NTB4_NTC0_NTD4_NTE0_NTM0_NTWS0_NEPBS16_NLCA1_NLCB1_ONLL1_PGR2_PLR1_PKA1_SGR1_SIA3_SLW1_SS1_SU16_SUM0_SUS64_SPO0_SRVW0_SSO0_SVW4_SK0_SKA0_SKXCCM0_SNLL0_TT1_1_TLDS0_ULSGRO0_USL1_UIOFGRO0_USFGROn1_VSn1_VWA4_VWB8_WSGRA0_WSGRB0_WS64_WG64_4_1_WGM8_WGMXCC8_WGMXCCGn1_WGR0
    SolutionIndex: 365
    SolutionNameMin: Cijk_Ailk_Bjlk_HHS_BH_Bias_HA_S_SAV_UserArgs_MT128x256x32_MI16x16x1_SN_LDSB1_AA0_AFC1_AF1_AAIGTEn1_AAILTEn1_AFEM1_AFEM1_ASEM1_BL1_BS1_CLR1_CADS0_DSK0_DU32_DTL0_DTVA0_DTVB0_DTVSM0_EPS0_FDSI0_GRPM1_GRVWA8_GRVWB8_GSU1_GSUAMB_GSUC0_GSUWGMRR0_GLS0_ISA942_IU1_IA0_KLA_LBSPPA1024_LBSPPB2048_LBSPPM0_LPA0_LPB0_LPM0_LRVW4_LWPMn1_MIAV0_MIWT4_8_MDA2_MI16_16_16_1_MO40_NR0_NTn1_NTA0_NTB0_NTC0_NTD4_NTE0_NTM0_NTWS0_NEPBS16_NLCA1_NLCB1_ONLL1_PGR2_PLR1_PKA1_SGR1_SIA3_SLW1_SS1_SU16_SUM0_SUS64_SPO0_SRVW0_SSO0_SVW4_SK0_SKA0_SKXCCM0_SNLL0_TT1_1_TLDS0_ULSGRO0_USL1_UIOFGRO0_USFGROn1_VSn1_VWA4_VWB8_WSGRA0_WSGRB0_WS64_WG32_8_1_WGM8_WGMXCC8_WGMXCCGn1_WGR0
    SolutionIndex: 397
    SolutionNameMin: Cijk_Ailk_Bjlk_HHS_BH_Bias_HA_S_SAV_UserArgs_MT128x96x32_MI16x16x1_SN_LDSB0_AA0_AFC1_AF1_AAIGTEn1_AAILTEn1_AFEM1_AFEM1_ASEM1_BL1_BS1_CLR1_CADS0_DSK0_DU32_DTL0_DTVA0_DTVB0_DTVSM0_EPS0_FDSI0_GRPM1_GRVWA8_GRVWB4_GSU1_GSUAMB_GSUC0_GSUWGMRR0_GLS0_ISA942_IU1_IA0_KLA_LBSPPA1024_LBSPPB768_LBSPPM0_LPA0_LPB16_LPM0_LRVW4_LWPMn1_MIAV0_MIWT4_3_MDA2_MI16_16_16_1_MO40_NR0_NTn1_NTA4_NTB0_NTC0_NTD4_NTE0_NTM0_NTWS0_NEPBS16_NLCA1_NLCB3_ONLL1_PGR2_PLR1_PKA1_SGR1_SIA3_SLW1_SS1_SU16_SUM0_SUS64_SPO0_SRVW0_SSO0_SVW4_SK0_SKA0_SKXCCM0_SNLL0_TT1_1_TLDS0_ULSGRO0_USL1_UIOFGRO0_USFGROn1_VSn1_VWA4_VWB1_WSGRA0_WSGRB0_WS64_WG32_8_1_WGM8_WGMXCC8_WGMXCCGn1_WGR0
    SolutionIndex: 431
    SolutionNameMin: Cijk_Ailk_Bjlk_HHS_BH_Bias_HA_S_SAV_UserArgs_MT16x16x256_MI16x16x1_SN_LDSB1_AA0_AFC1_AF1_AAIGTEn1_AAILTEn1_AFEM1_AFEM1_ASEM1_BL1_BS1_CLR1_CADS0_DSK0_DU256_DTL0_DTVA0_DTVB0_DTVSM0_EPS0_FDSI0_GRPM1_GRVWA8_GRVWB8_GSU16_GSUAMBSK_GSUC0_GSUWGMRR0_GLS0_ISA942_IU1_IA0_KLA_LBSPPA128_LBSPPB128_LBSPPM0_LPA16_LPB16_LPM0_LRVW4_LWPMn1_MIAV0_MIWT1_1_MDA2_MI16_16_16_1_MO40_NR0_NTn1_NTA0_NTB0_NTC0_NTD0_NTE0_NTM0_NTWS0_NEPBS0_NLCA1_NLCB1_ONLL1_PGR2_PLR1_PKA1_SGR1_SIA3_SLW1_SS1_SU0_SUM0_SUS0_SPO0_SRVW0_SSO0_SVW1_SK0_SKA0_SKXCCM0_SNLL0_TT1_1_TLDS0_ULSGRO0_USL1_UIOFGRO0_USFGROn1_VSn1_VWA1_VWB1_WSGRA0_WSGRB0_WS64_WG16_4_4_WGM1_WGMXCC8_WGMXCCGn1_WGR0
    SolutionIndex: 432
    SolutionNameMin: Cijk_Ailk_Bjlk_HHS_BH_Bias_HA_S_SAV_UserArgs_MT16x16x64_MI16x16x1_SN_LDSB0_AA0_AFC1_AF1_AAIGTEn1_AAILTEn1_AFEM1_AFEM1_ASEM1_BL1_BS1_CLR0_CADS0_DSK0_DU64_DTL0_DTVA0_DTVB0_DTVSM0_EPS0_FDSI0_GRPM1_GRVWA2_GRVWB2_GSU1_GSUAMB_GSUC0_GSUWGMRR0_GLS0_ISA942_IU1_IA0_KLA_LBSPPA128_LBSPPB128_LBSPPM0_LPA16_LPB16_LPM0_LRVW4_LWPMn1_MIAV0_MIWT1_1_MDA2_MI16_16_16_1_MO40_NR0_NTn1_NTA0_NTB4_NTC0_NTD4_NTE0_NTM0_NTWS0_NEPBS16_NLCA1_NLCB1_ONLL1_PGR2_PLR0_PKA1_SGR1_SIA3_SLW1_SS1_SU16_SUM0_SUS128_SPO0_SRVW0_SSO0_SVW1_SK0_SKA0_SKXCCM0_SNLL0_TT1_1_TLDS0_ULSGRO0_USL1_UIOFGRO0_USFGROn1_VSn1_VWA1_VWB1_WSGRA0_WSGRB0_WS64_WG16_4_4_WGM6_WGMXCC8_WGMXCCGn1_WGR0
    SolutionIndex: 433
    SolutionNameMin: Cijk_Ailk_Bjlk_HHS_BH_Bias_HA_S_SAV_UserArgs_MT16x16x128_MI16x16x1_SN_LDSB0_AA0_AFC1_AF1_AAIGTEn1_AAILTEn1_AFEM1_AFEM1_ASEM1_BL1_BS1_CLR1_CADS0_DSK0_DU128_DTL0_DTVA0_DTVB0_DTVSM0_EPS0_FDSI0_GRPM1_GRVWA8_GRVWB8_GSU1_GSUAMB_GSUC0_GSUWGMRR0_GLS0_ISA942_IU1_IA0_KLA_LBSPPA128_LBSPPB128_LBSPPM0_LPA16_LPB16_LPM0_LRVW4_LWPMn1_MIAV0_MIWT1_1_MDA2_MI16_16_16_1_MO40_NR0_NTn1_NTA0_NTB0_NTC0_NTD4_NTE0_NTM0_NTWS0_NEPBS16_NLCA1_NLCB1_ONLL1_PGR2_PLR1_PKA1_SGR1_SIA3_SLW1_SS1_SU16_SUM0_SUS256_SPO0_SRVW0_SSO0_SVW1_SK0_SKA0_SKXCCM0_SNLL0_TT1_1_TLDS0_ULSGRO0_USL1_UIOFGRO0_USFGROn1_VSn1_VWA1_VWB1_WSGRA0_WSGRB0_WS64_WG16_4_4_WGM6_WGMXCC8_WGMXCCGn1_WGR0
    SolutionIndex: 434
    SolutionNameMin: Cijk_Ailk_Bjlk_HHS_BH_Bias_HA_S_SAV_UserArgs_MT32x256x64_MI16x16x1_SN_LDSB1_AA0_AFC1_AF1_AAIGTEn1_AAILTEn1_AFEM1_AFEM1_ASEM1_BL1_BS1_CLR1_CADS0_DSK0_DU64_DTL0_DTVA0_DTVB0_DTVSM0_EPS0_FDSI0_GRPM1_GRVWA8_GRVWB8_GSU3_GSUAMB_GSUC0_GSUWGMRR0_GLS0_ISA942_IU1_IA0_KLA_LBSPPA256_LBSPPB2048_LBSPPM0_LPA32_LPB0_LPM0_LRVW4_LWPMn1_MIAV0_MIWT2_4_MDA2_MI16_16_16_1_MO40_NR0_NTn1_NTA0_NTB4_NTC0_NTD0_NTE0_NTM0_NTWS0_NEPBS16_NLCA1_NLCB1_ONLL1_PGR2_PLR1_PKA1_SGR1_SIA3_SLW1_SS1_SU0_SUM0_SUS0_SPO0_SRVW0_SSO0_SVW2_SK0_SKA0_SKXCCM0_SNLL0_TT1_1_TLDS0_ULSGRO0_USL1_UIOFGRO0_USFGROn1_VSn1_VWA2_VWB4_WSGRA0_WSGRB0_WS64_WG16_16_1_WGM1_WGMXCC8_WGMXCCGn1_WGR0
    SolutionIndex: 435
    SolutionNameMin: Cijk_Ailk_Bjlk_HHS_BH_Bias_HA_S_SAV_UserArgs_MT16x16x256_MI16x16x1_SN_LDSB1_AA0_AFC1_AF1_AAIGTEn1_AAILTEn1_AFEM1_AFEM1_ASEM1_BL1_BS1_CLR1_CADS0_DSK0_DU256_DTL0_DTVA0_DTVB0_DTVSM0_EPS0_FDSI0_GRPM1_GRVWA8_GRVWB8_GSU1_GSUAMB_GSUC0_GSUWGMRR0_GLS0_ISA942_IU1_IA0_KLA_LBSPPA128_LBSPPB128_LBSPPM0_LPA16_LPB16_LPM0_LRVW4_LWPMn1_MIAV0_MIWT1_1_MDA2_MI16_16_16_1_MO40_NR0_NTn1_NTA0_NTB0_NTC0_NTD4_NTE0_NTM0_NTWS0_NEPBS16_NLCA1_NLCB1_ONLL1_PGR2_PLR1_PKA1_SGR1_SIA3_SLW1_SS1_SU16_SUM0_SUS512_SPO0_SRVW0_SSO0_SVW1_SK0_SKA0_SKXCCM0_SNLL0_TT1_1_TLDS0_ULSGRO0_USL1_UIOFGRO0_USFGROn1_VSn1_VWA1_VWB1_WSGRA0_WSGRB0_WS64_WG16_4_4_WGM6_WGMXCC8_WGMXCCGn1_WGR0
    SolutionIndex: 436
    SolutionNameMin: Cijk_Ailk_Bjlk_HHS_BH_Bias_HA_S_SAV_UserArgs_MT64x128x64_MI16x16x1_SN_LDSB1_AA0_AFC1_AF1_AAIGTEn1_AAILTEn1_AFEM1_AFEM1_ASEM1_BL1_BS1_CLR1_CADS0_DSK0_DU64_DTL0_DTVA0_DTVB0_DTVSM0_EPS0_FDSI0_GRPM1_GRVWA8_GRVWB8_GSU8_GSUAMB_GSUC0_GSUWGMRR0_GLS0_ISA942_IU1_IA0_KLA_LBSPPA512_LBSPPB1024_LBSPPM0_LPA0_LPB32_LPM0_LRVW4_LWPMn1_MIAV0_MIWT4_2_MDA2_MI16_16_16_1_MO40_NR0_NTn1_NTA0_NTB4_NTC0_NTD0_NTE0_NTM0_NTWS0_NEPBS16_NLCA1_NLCB1_ONLL1_PGR2_PLR1_PKA1_SGR1_SIA3_SLW1_SS1_SU0_SUM0_SUS0_SPO0_SRVW0_SSO0_SVW4_SK0_SKA0_SKXCCM0_SNLL0_TT1_1_TLDS0_ULSGRO0_USL1_UIOFGRO0_USFGROn1_VSn1_VWA4_VWB2_WSGRA0_WSGRB0_WS64_WG16_16_1_WGM1_WGMXCC8_WGMXCCGn1_WGR0
    SolutionIndex: 437
    SolutionNameMin: Cijk_Ailk_Bjlk_HHS_BH_Bias_HA_S_SAV_UserArgs_MT32x64x128_MI16x16x1_SN_LDSB1_AA0_AFC1_AF1_AAIGTEn1_AAILTEn1_AFEM1_AFEM1_ASEM1_BL1_BS1_CLR1_CADS0_DSK0_DU128_DTL0_DTVA0_DTVB0_DTVSM0_EPS0_FDSI0_GRPM1_GRVWA8_GRVWB8_GSU8_GSUAMB_GSUC0_GSUWGMRR0_GLS0_ISA942_IU1_IA0_KLA_LBSPPA256_LBSPPB512_LBSPPM0_LPA16_LPB32_LPM0_LRVW4_LWPMn1_MIAV0_MIWT1_2_MDA2_MI16_16_16_1_MO40_NR0_NTn1_NTA0_NTB0_NTC0_NTD0_NTE0_NTM0_NTWS0_NEPBS16_NLCA1_NLCB1_ONLL1_PGR2_PLR1_PKA1_SGR1_SIA3_SLW1_SS1_SU0_SUM0_SUS0_SPO0_SRVW0_SSO0_SVW1_SK0_SKA0_SKXCCM0_SNLL0_TT1_1_TLDS0_ULSGRO0_USL1_UIOFGRO0_USFGROn1_VSn1_VWA1_VWB2_WSGRA0_WSGRB0_WS64_WG32_8_1_WGM1_WGMXCC8_WGMXCCGn1_WGR0
    SolutionIndex: 438
    SolutionNameMin: Cijk_Ailk_Bjlk_HHS_BH_Bias_HA_S_SAV_UserArgs_MT96x128x32_MI16x16x1_SN_LDSB0_AA0_AFC1_AF1_AAIGTEn1_AAILTEn1_AFEM1_AFEM1_ASEM1_BL1_BS1_CLR1_CADS0_DSK0_DU32_DTL0_DTVA0_DTVB0_DTVSM0_EPS0_FDSI0_GRPM1_GRVWA4_GRVWB8_GSU1_GSUAMB_GSUC0_GSUWGMRR0_GLS0_ISA942_IU1_IA0_KLA_LBSPPA768_LBSPPB1024_LBSPPM0_LPA32_LPB32_LPM0_LRVW4_LWPMn1_MIAV0_MIWT6_2_MDA2_MI16_16_16_1_MO40_NR0_NTn1_NTA0_NTB4_NTC0_NTD4_NTE0_NTM0_NTWS0_NEPBS16_NLCA3_NLCB1_ONLL1_PGR2_PLR1_PKA1_SGR1_SIA3_SLW1_SS1_SU16_SUM0_SUS64_SPO0_SRVW0_SSO0_SVW2_SK0_SKA0_SKXCCM0_SNLL0_TT1_1_TLDS0_ULSGRO0_USL1_UIOFGRO0_USFGROn1_VSn1_VWA2_VWB2_WSGRA0_WSGRB0_WS64_WG16_16_1_WGM8_WGMXCC8_WGMXCCGn1_WGR0
    SolutionIndex: 439
    SolutionNameMin: Cijk_Ailk_Bjlk_HHS_BH_Bias_HA_S_SAV_UserArgs_MT96x128x64_MI16x16x1_SN_LDSB1_AA0_AFC1_AF1_AAIGTEn1_AAILTEn1_AFEM1_AFEM1_ASEM1_BL1_BS1_CLR1_CADS0_DSK0_DU64_DTL0_DTVA0_DTVB0_DTVSM0_EPS0_FDSI0_GRPM1_GRVWA8_GRVWB8_GSU1_GSUAMB_GSUC0_GSUWGMRR0_GLS0_ISA942_IU1_IA0_KLA_LBSPPA768_LBSPPB1024_LBSPPM0_LPA16_LPB0_LPM0_LRVW4_LWPMn1_MIAV0_MIWT3_4_MDA2_MI16_16_16_1_MO40_NR0_NTn1_NTA0_NTB4_NTC0_NTD4_NTE0_NTM0_NTWS0_NEPBS16_NLCA3_NLCB1_ONLL1_PGR2_PLR1_PKA1_SGR1_SIA3_SLW1_SS1_SU16_SUM0_SUS128_SPO0_SRVW0_SSO0_SVW1_SK0_SKA0_SKXCCM0_SNLL0_TT1_1_TLDS0_ULSGRO0_USL1_UIOFGRO0_USFGROn1_VSn1_VWA1_VWB4_WSGRA0_WSGRB0_WS64_WG32_8_1_WGM8_WGMXCC8_WGMXCCGn1_WGR0
    SolutionIndex: 440
    SolutionNameMin: Cijk_Ailk_Bjlk_HHS_BH_Bias_HA_S_SAV_UserArgs_MT16x16x64_MI16x16x1_SN_LDSB0_AA0_AFC1_AF1_AAIGTEn1_AAILTEn1_AFEM1_AFEM1_ASEM1_BL1_BS1_CLR0_CADS0_DSK0_DU64_DTL0_DTVA0_DTVB0_DTVSM0_EPS0_FDSI0_GRPM1_GRVWA2_GRVWB2_GSU4_GSUAMBSK_GSUC0_GSUWGMRR0_GLS0_ISA942_IU1_IA0_KLA_LBSPPA128_LBSPPB128_LBSPPM0_LPA16_LPB16_LPM0_LRVW4_LWPMn1_MIAV0_MIWT1_1_MDA2_MI16_16_16_1_MO40_NR0_NTn1_NTA4_NTB0_NTC0_NTD0_NTE0_NTM0_NTWS0_NEPBS0_NLCA1_NLCB1_ONLL1_PGR2_PLR0_PKA1_SGR1_SIA3_SLW1_SS1_SU0_SUM0_SUS0_SPO0_SRVW0_SSO0_SVW1_SK0_SKA0_SKXCCM0_SNLL0_TT1_1_TLDS0_ULSGRO0_USL1_UIOFGRO0_USFGROn1_VSn1_VWA1_VWB1_WSGRA0_WSGRB0_WS64_WG16_4_4_WGM1_WGMXCC8_WGMXCCGn1_WGR0
    SolutionIndex: 441
    SolutionNameMin: Cijk_Ailk_Bjlk_HHS_BH_Bias_HA_S_SAV_UserArgs_MT64x16x64_MI16x16x1_SN_LDSB0_AA0_AFC1_AF1_AAIGTEn1_AAILTEn1_AFEM1_AFEM1_ASEM1_BL1_BS1_CLR1_CADS0_DSK0_DU64_DTL0_DTVA0_DTVB0_DTVSM0_EPS0_FDSI0_GRPM1_GRVWA8_GRVWB4_GSU1_GSUAMB_GSUC0_GSUWGMRR0_GLS0_ISA942_IU1_IA0_KLA_LBSPPA512_LBSPPB128_LBSPPM0_LPA16_LPB16_LPM0_LRVW4_LWPMn1_MIAV0_MIWT1_1_MDA2_MI16_16_16_1_MO40_NR0_NTn1_NTA0_NTB4_NTC0_NTD4_NTE0_NTM0_NTWS0_NEPBS16_NLCA1_NLCB1_ONLL1_PGR2_PLR1_PKA1_SGR1_SIA3_SLW1_SS1_SU16_SUM0_SUS128_SPO0_SRVW0_SSO0_SVW1_SK0_SKA0_SKXCCM0_SNLL0_TT1_1_TLDS0_ULSGRO0_USL1_UIOFGRO0_USFGROn1_VSn1_VWA1_VWB1_WSGRA0_WSGRB0_WS64_WG64_4_1_WGM8_WGMXCC8_WGMXCCGn1_WGR0
    SolutionIndex: 442
    SolutionNameMin: Cijk_Ailk_Bjlk_HHS_BH_Bias_HA_S_SAV_UserArgs_MT128x64x64_MI16x16x1_SN_LDSB1_AA0_AFC1_AF1_AAIGTEn1_AAILTEn1_AFEM1_AFEM1_ASEM1_BL1_BS1_CLR1_CADS0_DSK0_DU64_DTL0_DTVA0_DTVB0_DTVSM0_EPS0_FDSI0_GRPM1_GRVWA8_GRVWB8_GSU8_GSUAMB_GSUC0_GSUWGMRR0_GLS0_ISA942_IU1_IA0_KLA_LBSPPA1024_LBSPPB512_LBSPPM0_LPA32_LPB0_LPM0_LRVW4_LWPMn1_MIAV0_MIWT2_4_MDA2_MI16_16_16_1_MO40_NR0_NTn1_NTA0_NTB4_NTC0_NTD0_NTE0_NTM0_NTWS0_NEPBS16_NLCA1_NLCB1_ONLL1_PGR2_PLR1_PKA1_SGR1_SIA3_SLW1_SS1_SU0_SUM0_SUS0_SPO0_SRVW0_SSO0_SVW2_SK0_SKA0_SKXCCM0_SNLL0_TT1_1_TLDS0_ULSGRO0_USL1_UIOFGRO0_USFGROn1_VSn1_VWA2_VWB4_WSGRA0_WSGRB0_WS64_WG64_4_1_WGM1_WGMXCC8_WGMXCCGn1_WGR0
    SolutionIndex: 443
    SolutionNameMin: Cijk_Ailk_Bjlk_HHS_BH_Bias_HA_S_SAV_UserArgs_MT128x64x64_MI16x16x1_SN_LDSB1_AA0_AFC1_AF1_AAIGTEn1_AAILTEn1_AFEM1_AFEM1_ASEM1_BL1_BS1_CLR1_CADS0_DSK0_DU64_DTL0_DTVA0_DTVB0_DTVSM0_EPS0_FDSI0_GRPM1_GRVWA8_GRVWB8_GSU8_GSUAMB_GSUC0_GSUWGMRR0_GLS0_ISA942_IU1_IA0_KLA_LBSPPA1024_LBSPPB512_LBSPPM0_LPA0_LPB32_LPM0_LRVW4_LWPMn1_MIAV0_MIWT4_2_MDA2_MI16_16_16_1_MO40_NR0_NTn1_NTA0_NTB0_NTC0_NTD0_NTE0_NTM0_NTWS0_NEPBS16_NLCA1_NLCB1_ONLL1_PGR2_PLR1_PKA1_SGR1_SIA3_SLW1_SS1_SU0_SUM0_SUS0_SPO0_SRVW0_SSO0_SVW4_SK0_SKA0_SKXCCM0_SNLL0_TT1_1_TLDS0_ULSGRO0_USL1_UIOFGRO0_USFGROn1_VSn1_VWA4_VWB2_WSGRA0_WSGRB0_WS64_WG32_8_1_WGM1_WGMXCC8_WGMXCCGn1_WGR0
    SolutionIndex: 444
    SolutionNameMin: Cijk_Ailk_Bjlk_HHS_BH_Bias_HA_S_SAV_UserArgs_MT128x128x64_MI16x16x1_SN_LDSB1_AA0_AFC1_AF1_AAIGTEn1_AAILTEn1_AFEM1_AFEM1_ASEM1_BL1_BS1_CLR1_CADS0_DSK0_DU64_DTL0_DTVA0_DTVB0_DTVSM0_EPS0_FDSI0_GRPM1_GRVWA8_GRVWB8_GSU8_GSUAMB_GSUC0_GSUWGMRR0_GLS0_ISA942_IU1_IA0_KLA_LBSPPA1024_LBSPPB1024_LBSPPM0_LPA0_LPB0_LPM0_LRVW4_LWPMn1_MIAV0_MIWT4_4_MDA2_MI16_16_16_1_MO40_NR0_NTn1_NTA0_NTB0_NTC0_NTD0_NTE0_NTM0_NTWS0_NEPBS16_NLCA1_NLCB1_ONLL1_PGR2_PLR1_PKA1_SGR1_SIA3_SLW1_SS1_SU0_SUM0_SUS0_SPO0_SRVW0_SSO0_SVW4_SK0_SKA0_SKXCCM0_SNLL0_TT1_1_TLDS0_ULSGRO0_USL1_UIOFGRO0_USFGROn1_VSn1_VWA4_VWB4_WSGRA0_WSGRB0_WS64_WG32_8_1_WGM1_WGMXCC8_WGMXCCGn1_WGR0
    SolutionIndex: 445
    SolutionNameMin: Cijk_Ailk_Bjlk_HHS_BH_Bias_HA_S_SAV_UserArgs_MT256x128x32_MI16x16x1_SN_LDSB1_AA0_AFC1_AF1_AAIGTEn1_AAILTEn1_AFEM1_AFEM1_ASEM1_BL1_BS1_CLR1_CADS0_DSK0_DU32_DTL0_DTVA0_DTVB0_DTVSM0_EPS0_FDSI0_GRPM1_GRVWA8_GRVWB8_GSU1_GSUAMB_GSUC0_GSUWGMRR0_GLS0_ISA942_IU1_IA0_KLA_LBSPPA2048_LBSPPB1024_LBSPPM0_LPA0_LPB0_LPM0_LRVW4_LWPMn1_MIAV0_MIWT8_4_MDA2_MI16_16_16_1_MO40_NR0_NTn1_NTA0_NTB4_NTC0_NTD4_NTE0_NTM0_NTWS0_NEPBS16_NLCA1_NLCB1_ONLL1_PGR2_PLR1_PKA1_SGR1_SIA3_SLW1_SS1_SU16_SUM0_SUS64_SPO0_SRVW0_SSO0_SVW8_SK0_SKA0_SKXCCM0_SNLL0_TT1_1_TLDS0_ULSGRO0_USL1_UIOFGRO0_USFGROn1_VSn1_VWA8_VWB4_WSGRA0_WSGRB0_WS64_WG32_8_1_WGM8_WGMXCC8_WGMXCCGn1_WGR0
    SolutionIndex: 446
    SolutionNameMin: Cijk_Ailk_Bjlk_HHS_BH_Bias_HA_S_SAV_UserArgs_MT64x32x128_MI16x16x1_SN_LDSB1_AA0_AFC1_AF1_AAIGTEn1_AAILTEn1_AFEM1_AFEM1_ASEM1_BL1_BS1_CLR1_CADS0_DSK0_DU128_DTL0_DTVA0_DTVB0_DTVSM0_EPS0_FDSI0_GRPM1_GRVWA8_GRVWB8_GSU8_GSUAMB_GSUC0_GSUWGMRR0_GLS0_ISA942_IU1_IA0_KLA_LBSPPA512_LBSPPB256_LBSPPM0_LPA32_LPB16_LPM0_LRVW4_LWPMn1_MIAV0_MIWT2_1_MDA2_MI16_16_16_1_MO40_NR0_NTn1_NTA0_NTB0_NTC0_NTD0_NTE0_NTM0_NTWS0_NEPBS16_NLCA1_NLCB1_ONLL1_PGR2_PLR1_PKA1_SGR1_SIA3_SLW1_SS1_SU0_SUM0_SUS0_SPO0_SRVW0_SSO0_SVW2_SK0_SKA0_SKXCCM0_SNLL0_TT1_1_TLDS0_ULSGRO0_USL1_UIOFGRO0_USFGROn1_VSn1_VWA2_VWB1_WSGRA0_WSGRB0_WS64_WG32_8_1_WGM1_WGMXCC8_WGMXCCGn1_WGR0
    SolutionIndex: 447
    SolutionNameMin: Cijk_Ailk_Bjlk_HHS_BH_Bias_HA_S_SAV_UserArgs_MT64x64x128_MI16x16x1_SN_LDSB1_AA0_AFC1_AF1_AAIGTEn1_AAILTEn1_AFEM1_AFEM1_ASEM1_BL1_BS1_CLR1_CADS0_DSK0_DU128_DTL0_DTVA0_DTVB0_DTVSM0_EPS0_FDSI0_GRPM1_GRVWA8_GRVWB8_GSU6_GSUAMB_GSUC0_GSUWGMRR0_GLS0_ISA942_IU1_IA0_KLA_LBSPPA512_LBSPPB512_LBSPPM0_LPA32_LPB32_LPM0_LRVW4_LWPMn1_MIAV0_MIWT2_2_MDA2_MI16_16_16_1_MO40_NR0_NTn1_NTA0_NTB0_NTC0_NTD0_NTE0_NTM0_NTWS0_NEPBS16_NLCA1_NLCB1_ONLL1_PGR2_PLR1_PKA1_SGR1_SIA3_SLW1_SS1_SU0_SUM0_SUS0_SPO0_SRVW0_SSO0_SVW2_SK0_SKA0_SKXCCM0_SNLL0_TT1_1_TLDS0_ULSGRO0_USL1_UIOFGRO0_USFGROn1_VSn1_VWA2_VWB2_WSGRA0_WSGRB0_WS64_WG32_8_1_WGM1_WGMXCC8_WGMXCCGn1_WGR0
    SolutionIndex: 448
    SolutionNameMin: Cijk_Ailk_Bjlk_HHS_BH_Bias_HA_S_SAV_UserArgs_MT64x128x64_MI16x16x1_SN_LDSB1_AA0_AFC1_AF1_AAIGTEn1_AAILTEn1_AFEM1_AFEM1_ASEM1_BL1_BS1_CLR1_CADS0_DSK0_DU64_DTL0_DTVA0_DTVB0_DTVSM0_EPS0_FDSI0_GRPM1_GRVWA8_GRVWB8_GSU8_GSUAMB_GSUC0_GSUWGMRR0_GLS0_ISA942_IU1_IA0_KLA_LBSPPA512_LBSPPB1024_LBSPPM0_LPA0_LPB32_LPM0_LRVW4_LWPMn1_MIAV0_MIWT4_2_MDA2_MI16_16_16_1_MO40_NR0_NTn1_NTA0_NTB0_NTC0_NTD0_NTE0_NTM0_NTWS0_NEPBS16_NLCA1_NLCB1_ONLL1_PGR2_PLR1_PKA1_SGR1_SIA3_SLW1_SS1_SU0_SUM0_SUS0_SPO0_SRVW0_SSO0_SVW4_SK0_SKA0_SKXCCM0_SNLL0_TT1_1_TLDS0_ULSGRO0_USL1_UIOFGRO0_USFGROn1_VSn1_VWA4_VWB2_WSGRA0_WSGRB0_WS64_WG16_16_1_WGM1_WGMXCC8_WGMXCCGn1_WGR0
    SolutionIndex: 449
    SolutionNameMin: Cijk_Ailk_Bjlk_HHS_BH_Bias_HA_S_SAV_UserArgs_MT256x256x32_MI16x16x1_SN_LDSB0_AA0_AFC1_AF1_AAIGTEn1_AAILTEn1_AFEM1_AFEM1_ASEM1_BL1_BS1_CLR1_CADS0_DSK0_DU32_DTL0_DTVA0_DTVB0_DTVSM0_EPS0_FDSI0_GRPM1_GRVWA8_GRVWB8_GSU1_GSUAMB_GSUC0_GSUWGMRR0_GLS0_ISA942_IU1_IA0_KLA_LBSPPA2048_LBSPPB2048_LBSPPM0_LPA0_LPB0_LPM0_LRVW4_LWPMn1_MIAV0_MIWT8_8_MDA2_MI16_16_16_1_MO40_NR0_NTn1_NTA0_NTB0_NTC0_NTD4_NTE0_NTM0_NTWS0_NEPBS16_NLCA1_NLCB1_ONLL1_PGR2_PLR1_PKA1_SGR1_SIA3_SLW1_SS1_SU16_SUM0_SUS64_SPO0_SRVW0_SSO0_SVW8_SK0_SKA0_SKXCCM0_SNLL0_TT1_1_TLDS0_ULSGRO0_USL1_UIOFGRO0_USFGROn1_VSn1_VWA8_VWB8_WSGRA0_WSGRB0_WS64_WG32_8_1_WGM8_WGMXCC8_WGMXCCGn1_WGR0
    SolutionIndex: 450
    SolutionNameMin: Cijk_Ailk_Bjlk_HHS_BH_Bias_HA_S_SAV_UserArgs_MT16x16x64_MI16x16x1_SN_LDSB0_AA0_AFC1_AF1_AAIGTEn1_AAILTEn1_AFEM1_AFEM1_ASEM1_BL1_BS1_CLR0_CADS0_DSK0_DU64_DTL0_DTVA0_DTVB0_DTVSM0_EPS0_FDSI0_GRPM1_GRVWA2_GRVWB2_GSU6_GSUAMBSK_GSUC0_GSUWGMRR0_GLS0_ISA942_IU1_IA0_KLA_LBSPPA128_LBSPPB128_LBSPPM0_LPA16_LPB16_LPM0_LRVW4_LWPMn1_MIAV0_MIWT1_1_MDA2_MI16_16_16_1_MO40_NR0_NTn1_NTA4_NTB0_NTC0_NTD0_NTE0_NTM0_NTWS0_NEPBS0_NLCA1_NLCB1_ONLL1_PGR2_PLR0_PKA1_SGR1_SIA3_SLW1_SS1_SU0_SUM0_SUS0_SPO0_SRVW0_SSO0_SVW1_SK0_SKA0_SKXCCM0_SNLL0_TT1_1_TLDS0_ULSGRO0_USL1_UIOFGRO0_USFGROn1_VSn1_VWA1_VWB1_WSGRA0_WSGRB0_WS64_WG16_4_4_WGM1_WGMXCC8_WGMXCCGn1_WGR0
    SolutionIndex: 451
    SolutionNameMin: Cijk_Ailk_Bjlk_HHS_BH_Bias_HA_S_SAV_UserArgs_MT64x96x64_MI16x16x1_SN_LDSB1_AA0_AFC1_AF1_AAIGTEn1_AAILTEn1_AFEM1_AFEM1_ASEM1_BL1_BS1_CLR1_CADS0_DSK0_DU64_DTL0_DTVA0_DTVB0_DTVSM0_EPS0_FDSI0_GRPM1_GRVWA8_GRVWB8_GSU7_GSUAMB_GSUC0_GSUWGMRR0_GLS0_ISA942_IU1_IA0_KLA_LBSPPA512_LBSPPB768_LBSPPM0_LPA32_LPB16_LPM0_LRVW4_LWPMn1_MIAV0_MIWT2_3_MDA2_MI16_16_16_1_MO40_NR0_NTn1_NTA0_NTB0_NTC0_NTD0_NTE0_NTM0_NTWS0_NEPBS16_NLCA1_NLCB3_ONLL1_PGR2_PLR1_PKA1_SGR1_SIA3_SLW1_SS1_SU0_SUM0_SUS0_SPO0_SRVW0_SSO0_SVW2_SK0_SKA0_SKXCCM0_SNLL0_TT1_1_TLDS0_ULSGRO0_USL1_UIOFGRO0_USFGROn1_VSn1_VWA2_VWB1_WSGRA0_WSGRB0_WS64_WG32_8_1_WGM1_WGMXCC8_WGMXCCGn1_WGR0
    SolutionIndex: 452
    SolutionNameMin: Cijk_Ailk_Bjlk_HHS_BH_Bias_HA_S_SAV_UserArgs_MT128x64x128_MI16x16x1_SN_LDSB1_AA0_AFC1_AF1_AAIGTEn1_AAILTEn1_AFEM1_AFEM1_ASEM1_BL1_BS1_CLR1_CADS0_DSK0_DU128_DTL0_DTVA0_DTVB0_DTVSM0_EPS0_FDSI0_GRPM1_GRVWA8_GRVWB8_GSU8_GSUAMB_GSUC0_GSUWGMRR0_GLS0_ISA942_IU1_IA0_KLA_LBSPPA1024_LBSPPB512_LBSPPM0_LPA32_LPB0_LPM0_LRVW4_LWPMn1_MIAV0_MIWT2_4_MDA2_MI16_16_16_1_MO40_NR0_NTn1_NTA0_NTB0_NTC0_NTD0_NTE0_NTM0_NTWS0_NEPBS16_NLCA1_NLCB1_ONLL1_PGR2_PLR1_PKA1_SGR1_SIA3_SLW1_SS1_SU0_SUM0_SUS0_SPO0_SRVW0_SSO0_SVW2_SK0_SKA0_SKXCCM0_SNLL0_TT1_1_TLDS0_ULSGRO0_USL1_UIOFGRO0_USFGROn1_VSn1_VWA2_VWB4_WSGRA0_WSGRB0_WS64_WG64_4_1_WGM1_WGMXCC8_WGMXCCGn1_WGR0
    SolutionIndex: 453
    SolutionNameMin: Cijk_Ailk_Bjlk_HHS_BH_Bias_HA_S_SAV_UserArgs_MT256x128x32_MI16x16x1_SN_LDSB1_AA0_AFC1_AF1_AAIGTEn1_AAILTEn1_AFEM1_AFEM1_ASEM1_BL1_BS1_CLR1_CADS0_DSK0_DU32_DTL0_DTVA0_DTVB0_DTVSM0_EPS0_FDSI0_GRPM1_GRVWA8_GRVWB8_GSU1_GSUAMB_GSUC0_GSUWGMRR0_GLS0_ISA942_IU1_IA0_KLA_LBSPPA2048_LBSPPB1024_LBSPPM0_LPA0_LPB0_LPM0_LRVW4_LWPMn1_MIAV0_MIWT4_8_MDA2_MI16_16_16_1_MO40_NR0_NTn1_NTA0_NTB0_NTC0_NTD4_NTE0_NTM0_NTWS0_NEPBS16_NLCA1_NLCB1_ONLL1_PGR2_PLR1_PKA1_SGR1_SIA3_SLW1_SS1_SU8_SUM1_SUS64_SPO0_SRVW0_SSO0_SVW4_SK0_SKA0_SKXCCM0_SNLL0_TT1_1_TLDS0_ULSGRO0_USL1_UIOFGRO0_USFGROn1_VSn1_VWA4_VWB8_WSGRA0_WSGRB0_WS64_WG64_4_1_WGM6_WGMXCC8_WGMXCCGn1_WGR0
    SolutionIndex: 454
    SolutionNameMin: Cijk_Ailk_Bjlk_HHS_BH_Bias_HA_S_SAV_UserArgs_MT192x256x32_MI16x16x1_SN_LDSB0_AA0_AFC1_AF1_AAIGTEn1_AAILTEn1_AFEM1_AFEM1_ASEM1_BL1_BS1_CLR1_CADS0_DSK0_DU32_DTL0_DTVA0_DTVB0_DTVSM0_EPS0_FDSI0_GRPM1_GRVWA8_GRVWB8_GSU1_GSUAMB_GSUC0_GSUWGMRR0_GLS0_ISA942_IU1_IA0_KLA_LBSPPA1536_LBSPPB2048_LBSPPM0_LPA0_LPB0_LPM0_LRVW4_LWPMn1_MIAV0_MIWT12_4_MDA2_MI16_16_16_1_MO40_NR0_NTn1_NTA0_NTB0_NTC0_NTD4_NTE0_NTM0_NTWS0_NEPBS16_NLCA3_NLCB1_ONLL1_PGR2_PLR1_PKA1_SGR1_SIA3_SLW1_SS1_SU8_SUM1_SUS64_SPO0_SRVW0_SSO0_SVW4_SK0_SKA0_SKXCCM0_SNLL0_TT1_1_TLDS0_ULSGRO0_USL1_UIOFGRO0_USFGROn1_VSn1_VWA4_VWB4_WSGRA0_WSGRB0_WS64_WG16_16_1_WGM6_WGMXCC8_WGMXCCGn1_WGR0
    SolutionIndex: 455
    SolutionNameMin: Cijk_Ailk_Bjlk_HHS_BH_Bias_HA_S_SAV_UserArgs_MT64x16x64_MI16x16x1_SN_LDSB0_AA0_AFC1_AF1_AAIGTEn1_AAILTEn1_AFEM1_AFEM1_ASEM1_BL1_BS1_CLR1_CADS0_DSK0_DU64_DTL0_DTVA0_DTVB0_DTVSM0_EPS0_FDSI0_GRPM1_GRVWA8_GRVWB4_GSU1_GSUAMB_GSUC0_GSUWGMRR0_GLS0_ISA942_IU1_IA0_KLA_LBSPPA512_LBSPPB128_LBSPPM0_LPA16_LPB16_LPM0_LRVW4_LWPMn1_MIAV0_MIWT1_1_MDA2_MI16_16_16_1_MO40_NR0_NTn1_NTA4_NTB0_NTC0_NTD4_NTE0_NTM0_NTWS0_NEPBS16_NLCA1_NLCB1_ONLL1_PGR2_PLR1_PKA1_SGR1_SIA3_SLW1_SS1_SU16_SUM0_SUS128_SPO0_SRVW0_SSO0_SVW1_SK0_SKA0_SKXCCM0_SNLL0_TT1_1_TLDS0_ULSGRO0_USL1_UIOFGRO0_USFGROn1_VSn1_VWA1_VWB1_WSGRA0_WSGRB0_WS64_WG64_4_1_WGM8_WGMXCC8_WGMXCCGn1_WGR0
- - - [16, 16, 1, 256]
    - [0, 0.0]
  - - [16, 64, 1, 1024]
    - [0, 0.0]
  - - [16, 128, 1, 1024]
    - [0, 0.0]
  - - [16, 192, 1, 1024]
    - [0, 0.0]
  - - [16, 1024, 1, 1024]
    - [0, 0.0]
  - - [32, 96, 1, 1024]
    - [0, 0.0]
  - - [16, 16, 1, 1024]
    - [2, 0.0]
  - - [16, 32, 1, 1024]
    - [1, 0.0]
  - - [16, 64, 1, 4096]
    - [1, 0.0]
  - - [16, 96, 1, 1024]
    - [42, 0.0]
  - - [16, 96, 1, 4096]
    - [1, 0.0]
  - - [16, 96, 1, 8192]
    - [1, 0.0]
  - - [16, 192, 1, 4096]
    - [1, 0.0]
  - - [32, 16, 1, 1024]
    - [1, 0.0]
  - - [32, 16, 1, 4096]
    - [1, 0.0]
  - - [32, 32, 1, 4096]
    - [1, 0.0]
  - - [32, 64, 1, 4096]
    - [1, 0.0]
  - - [32, 64, 1, 8192]
    - [4, 0.0]
  - - [32, 96, 1, 4096]
    - [1, 0.0]
  - - [32, 96, 1, 8192]
    - [1, 0.0]
  - - [64, 16, 1, 4096]
    - [1, 0.0]
  - - [64, 32, 1, 4096]
    - [1, 0.0]
  - - [16, 16, 1, 4096]
    - [2, 0.0]
  - - [16, 16, 1, 8192]
    - [431, 0.0]
  - - [16, 32, 1, 4096]
    - [2, 0.0]
  - - [16, 32, 1, 8192]
    - [2, 0.0]
  - - [32, 16, 1, 8192]
    - [2, 0.0]
  - - [16, 32, 1, 256]
    - [3, 0.0]
  - - [16, 64, 1, 256]
    - [3, 0.0]
  - - [16, 128, 1, 256]
    - [35, 0.0]
  - - [16, 192, 1, 256]
    - [3, 0.0]
  - - [16, 256, 1, 256]
    - [3, 0.0]
  - - [16, 384, 1, 256]
    - [3, 0.0]
  - - [16, 768, 1, 256]
    - [432, 0.0]
  - - [16, 1024, 1, 256]
    - [432, 0.0]
  - - [16, 2048, 1, 256]
    - [3, 0.0]
  - - [16, 4096, 1, 256]
    - [3, 0.0]
  - - [16, 4096, 1, 1024]
    - [3, 0.0]
  - - [16, 8192, 1, 256]
    - [3, 0.0]
  - - [32, 64, 1, 256]
    - [3, 0.0]
  - - [32, 128, 1, 256]
    - [3, 0.0]
  - - [32, 256, 1, 256]
    - [3, 0.0]
  - - [32, 384, 1, 256]
    - [3, 0.0]
  - - [32, 512, 1, 256]
    - [3, 0.0]
  - - [32, 768, 1, 256]
    - [3, 0.0]
  - - [32, 1024, 1, 256]
    - [3, 0.0]
  - - [32, 2048, 1, 256]
    - [3, 0.0]
  - - [32, 2048, 1, 1024]
    - [3, 0.0]
  - - [32, 4096, 1, 256]
    - [3, 0.0]
  - - [64, 128, 1, 256]
    - [3, 0.0]
  - - [64, 192, 1, 256]
    - [3, 0.0]
  - - [64, 512, 1, 1024]
    - [3, 0.0]
  - - [64, 768, 1, 256]
    - [3, 0.0]
  - - [64, 768, 1, 1024]
    - [3, 0.0]
  - - [64, 1024, 1, 256]
    - [3, 0.0]
  - - [64, 1024, 1, 1024]
    - [3, 0.0]
  - - [64, 2048, 1, 256]
    - [3, 0.0]
  - - [96, 64, 1, 256]
    - [3, 0.0]
  - - [96, 96, 1, 256]
    - [3, 0.0]
  - - [96, 128, 1, 256]
    - [3, 0.0]
  - - [96, 192, 1, 256]
    - [3, 0.0]
  - - [96, 256, 1, 256]
    - [3, 0.0]
  - - [96, 512, 1, 256]
    - [3, 0.0]
  - - [96, 768, 1, 256]
    - [3, 0.0]
  - - [96, 768, 1, 1024]
    - [3, 0.0]
  - - [96, 1024, 1, 256]
    - [3, 0.0]
  - - [96, 1024, 1, 1024]
    - [3, 0.0]
  - - [128, 16, 1, 256]
    - [440, 0.0]
  - - [128, 32, 1, 256]
    - [3, 0.0]
  - - [128, 64, 1, 256]
    - [3, 0.0]
  - - [128, 128, 1, 256]
    - [3, 0.0]
  - - [128, 192, 1, 256]
    - [3, 0.0]
  - - [128, 256, 1, 256]
    - [3, 0.0]
  - - [128, 256, 1, 1024]
    - [3, 0.0]
  - - [128, 512, 1, 256]
    - [3, 0.0]
  - - [128, 768, 1, 256]
    - [3, 0.0]
  - - [128, 768, 1, 1024]
    - [3, 0.0]
  - - [128, 1024, 1, 256]
    - [441, 0.0]
  - - [192, 16, 1, 256]
    - [3, 0.0]
  - - [192, 64, 1, 256]
    - [3, 0.0]
  - - [192, 96, 1, 256]
    - [3, 0.0]
  - - [192, 128, 1, 256]
    - [3, 0.0]
  - - [192, 192, 1, 256]
    - [3, 0.0]
  - - [192, 256, 1, 256]
    - [3, 0.0]
  - - [192, 256, 1, 1024]
    - [3, 0.0]
  - - [192, 384, 1, 1024]
    - [3, 0.0]
  - - [192, 512, 1, 256]
    - [3, 0.0]
  - - [256, 32, 1, 256]
    - [3, 0.0]
  - - [256, 64, 1, 256]
    - [3, 0.0]
  - - [256, 96, 1, 256]
    - [3, 0.0]
  - - [256, 128, 1, 256]
    - [3, 0.0]
  - - [256, 192, 1, 256]
    - [3, 0.0]
  - - [256, 256, 1, 256]
    - [3, 0.0]
  - - [256, 384, 1, 256]
    - [3, 0.0]
  - - [256, 512, 1, 256]
    - [3, 0.0]
  - - [384, 32, 1, 256]
    - [3, 0.0]
  - - [384, 64, 1, 256]
    - [3, 0.0]
  - - [384, 128, 1, 256]
    - [3, 0.0]
  - - [384, 128, 1, 1024]
    - [3, 0.0]
  - - [384, 192, 1, 256]
    - [3, 0.0]
  - - [384, 192, 1, 1024]
    - [3, 0.0]
  - - [384, 256, 1, 256]
    - [3, 0.0]
  - - [384, 256, 1, 1024]
    - [3, 0.0]
  - - [384, 384, 1, 256]
    - [3, 0.0]
  - - [512, 32, 1, 256]
    - [3, 0.0]
  - - [512, 64, 1, 256]
    - [3, 0.0]
  - - [512, 64, 1, 1024]
    - [3, 0.0]
  - - [512, 96, 1, 256]
    - [3, 0.0]
  - - [512, 128, 1, 256]
    - [3, 0.0]
  - - [512, 128, 1, 1024]
    - [3, 0.0]
  - - [512, 192, 1, 256]
    - [3, 0.0]
  - - [512, 192, 1, 1024]
    - [3, 0.0]
  - - [512, 256, 1, 256]
    - [3, 0.0]
  - - [768, 16, 1, 256]
    - [3, 0.0]
  - - [768, 32, 1, 256]
    - [3, 0.0]
  - - [768, 64, 1, 256]
    - [3, 0.0]
  - - [768, 64, 1, 1024]
    - [3, 0.0]
  - - [768, 96, 1, 256]
    - [3, 0.0]
  - - [768, 128, 1, 256]
    - [3, 0.0]
  - - [768, 128, 1, 1024]
    - [3, 0.0]
  - - [768, 192, 1, 256]
    - [3, 0.0]
  - - [1024, 32, 1, 256]
    - [3, 0.0]
  - - [1024, 64, 1, 256]
    - [3, 0.0]
  - - [1024, 64, 1, 1024]
    - [3, 0.0]
  - - [1024, 96, 1, 256]
    - [3, 0.0]
  - - [1024, 96, 1, 1024]
    - [3, 0.0]
  - - [1024, 128, 1, 256]
    - [455, 0.0]
  - - [1024, 128, 1, 1024]
    - [3, 0.0]
  - - [2048, 16, 1, 256]
    - [3, 0.0]
  - - [2048, 32, 1, 256]
    - [3, 0.0]
  - - [2048, 64, 1, 256]
    - [3, 0.0]
  - - [4096, 32, 1, 256]
    - [3, 0.0]
  - - [16, 64, 1, 8192]
    - [4, 0.0]
  - - [64, 16, 1, 8192]
    - [4, 0.0]
  - - [64, 32, 1, 8192]
    - [4, 0.0]
  - - [96, 32, 1, 8192]
    - [4, 0.0]
  - - [128, 16, 1, 8192]
    - [4, 0.0]
  - - [192, 16, 1, 8192]
    - [4, 0.0]
  - - [16, 96, 1, 256]
    - [5, 0.0]
  - - [96, 16, 1, 256]
    - [5, 0.0]
  - - [16, 128, 1, 4096]
    - [6, 0.0]
  - - [16, 128, 1, 8192]
    - [6, 0.0]
  - - [16, 192, 1, 8192]
    - [6, 0.0]
  - - [16, 384, 1, 8192]
    - [6, 0.0]
  - - [32, 128, 1, 8192]
    - [6, 0.0]
  - - [16, 256, 1, 1024]
    - [7, 0.0]
  - - [16, 384, 1, 1024]
    - [7, 0.0]
  - - [16, 768, 1, 1024]
    - [7, 0.0]
  - - [192, 32, 1, 4096]
    - [7, 0.0]
  - - [192, 32, 1, 8192]
    - [7, 0.0]
  - - [384, 16, 1, 8192]
    - [7, 0.0]
  - - [768, 16, 1, 1024]
    - [450, 0.0]
  - - [1024, 16, 1, 1024]
    - [7, 0.0]
  - - [16, 256, 1, 4096]
    - [8, 0.0]
  - - [16, 384, 1, 4096]
    - [8, 0.0]
  - - [32, 128, 1, 4096]
    - [8, 0.0]
  - - [64, 16, 1, 1024]
    - [8, 0.0]
  - - [64, 32, 1, 1024]
    - [7, 0.0]
  - - [64, 64, 1, 8192]
    - [8, 0.0]
  - - [16, 256, 1, 8192]
    - [9, 0.0]
  - - [32, 192, 1, 4096]
    - [9, 0.0]
  - - [64, 64, 1, 4096]
    - [9, 0.0]
  - - [64, 96, 1, 4096]
    - [9, 0.0]
  - - [64, 96, 1, 8192]
    - [9, 0.0]
  - - [64, 128, 1, 4096]
    - [9, 0.0]
  - - [96, 16, 1, 1024]
    - [9, 0.0]
  - - [96, 64, 1, 4096]
    - [9, 0.0]
  - - [96, 64, 1, 8192]
    - [9, 0.0]
  - - [128, 32, 1, 4096]
    - [9, 0.0]
  - - [256, 16, 1, 4096]
    - [9, 0.0]
  - - [384, 16, 1, 4096]
    - [9, 0.0]
  - - [16, 512, 1, 256]
    - [10, 0.0]
  - - [16, 512, 1, 1024]
    - [11, 0.0]
  - - [16, 512, 1, 4096]
    - [11, 0.0]
  - - [16, 512, 1, 8192]
    - [11, 0.0]
  - - [32, 32, 1, 1024]
    - [11, 0.0]
  - - [32, 64, 1, 1024]
    - [8, 0.0]
  - - [32, 128, 1, 1024]
    - [11, 0.0]
  - - [32, 192, 1, 1024]
    - [11, 0.0]
  - - [64, 64, 1, 1024]
    - [11, 0.0]
  - - [64, 96, 1, 1024]
    - [11, 0.0]
  - - [96, 32, 1, 1024]
    - [7, 0.0]
  - - [96, 64, 1, 1024]
    - [11, 0.0]
  - - [96, 96, 1, 1024]
    - [7, 0.0]
  - - [96, 96, 1, 4096]
    - [11, 0.0]
  - - [96, 128, 1, 1024]
    - [11, 0.0]
  - - [128, 64, 1, 1024]
    - [11, 0.0]
  - - [128, 64, 1, 4096]
    - [11, 0.0]
  - - [192, 16, 1, 1024]
    - [11, 0.0]
  - - [256, 16, 1, 1024]
    - [11, 0.0]
  - - [384, 16, 1, 1024]
    - [11, 0.0]
  - - [384, 32, 1, 1024]
    - [11, 0.0]
  - - [512, 16, 1, 1024]
    - [11, 0.0]
  - - [16, 768, 1, 4096]
    - [12, 0.0]
  - - [32, 384, 1, 4096]
    - [12, 0.0]
  - - [16, 768, 1, 8192]
    - [13, 0.0]
  - - [16, 1024, 1, 4096]
    - [14, 0.0]
  - - [16, 2048, 1, 1024]
    - [14, 0.0]
  - - [16, 1024, 1, 8192]
    - [15, 0.0]
  - - [32, 512, 1, 4096]
    - [15, 0.0]
  - - [32, 1024, 1, 8192]
    - [15, 0.0]
  - - [96, 768, 1, 4096]
    - [15, 0.0]
  - - [192, 192, 1, 8192]
    - [15, 0.0]
  - - [384, 64, 1, 8192]
    - [15, 0.0]
  - - [16, 2048, 1, 4096]
    - [16, 0.0]
  - - [16, 2048, 1, 8192]
    - [17, 0.0]
  - - [16, 4096, 1, 4096]
    - [18, 0.0]
  - - [16, 4096, 1, 8192]
    - [19, 0.0]
  - - [16, 8192, 1, 1024]
    - [20, 0.0]
  - - [16, 8192, 1, 4096]
    - [21, 0.0]
  - - [16, 8192, 1, 8192]
    - [22, 0.0]
  - - [32, 4096, 1, 4096]
    - [22, 0.0]
  - - [16, 12288, 1, 256]
    - [23, 0.0]
  - - [16, 12288, 1, 1024]
    - [24, 0.0]
  - - [16, 12288, 1, 4096]
    - [24, 0.0]
  - - [16, 16384, 1, 4096]
    - [24, 0.0]
  - - [16, 12288, 1, 8192]
    - [25, 0.0]
  - - [16, 16384, 1, 256]
    - [26, 0.0]
  - - [16, 16384, 1, 1024]
    - [26, 0.0]
  - - [16, 16384, 1, 8192]
    - [27, 0.0]
  - - [16, 24576, 1, 256]
    - [28, 0.0]
  - - [16, 24576, 1, 1024]
    - [29, 0.0]
  - - [16, 24576, 1, 4096]
    - [30, 0.0]
  - - [16, 32768, 1, 4096]
    - [30, 0.0]
  - - [16, 24576, 1, 8192]
    - [31, 0.0]
  - - [16, 32768, 1, 256]
    - [32, 0.0]
  - - [16, 32768, 1, 1024]
    - [33, 0.0]
  - - [16, 32768, 1, 8192]
    - [34, 0.0]
  - - [32, 16, 1, 256]
    - [0, 0.0]
  - - [32, 32, 1, 256]
    - [36, 0.0]
  - - [64, 32, 1, 256]
    - [36, 0.0]
  - - [32, 32, 1, 8192]
    - [96, 0.0]
  - - [32, 192, 1, 8192]
    - [37, 0.0]
  - - [32, 96, 1, 256]
    - [38, 0.0]
  - - [64, 16, 1, 256]
    - [38, 0.0]
  - - [96, 32, 1, 256]
    - [38, 0.0]
  - - [192, 192, 1, 1024]
    - [38, 0.0]
  - - [384, 96, 1, 256]
    - [38, 0.0]
  - - [32, 192, 1, 256]
    - [433, 0.0]
  - - [96, 256, 1, 1024]
    - [39, 0.0]
  - - [256, 16, 1, 256]
    - [39, 0.0]
  - - [256, 96, 1, 1024]
    - [39, 0.0]
  - - [384, 16, 1, 256]
    - [39, 0.0]
  - - [512, 16, 1, 256]
    - [39, 0.0]
  - - [1024, 16, 1, 256]
    - [39, 0.0]
  - - [32, 256, 1, 1024]
    - [40, 0.0]
  - - [32, 256, 1, 4096]
    - [40, 0.0]
  - - [64, 128, 1, 1024]
    - [40, 0.0]
  - - [64, 192, 1, 4096]
    - [40, 0.0]
  - - [64, 384, 1, 1024]
    - [40, 0.0]
  - - [96, 128, 1, 4096]
    - [40, 0.0]
  - - [128, 32, 1, 1024]
    - [40, 0.0]
  - - [192, 32, 1, 1024]
    - [40, 0.0]
  - - [192, 64, 1, 1024]
    - [40, 0.0]
  - - [256, 32, 1, 1024]
    - [40, 0.0]
  - - [32, 256, 1, 8192]
    - [41, 0.0]
  - - [64, 128, 1, 8192]
    - [41, 0.0]
  - - [64, 256, 1, 8192]
    - [41, 0.0]
  - - [96, 128, 1, 8192]
    - [41, 0.0]
  - - [128, 64, 1, 8192]
    - [41, 0.0]
  - - [128, 96, 1, 4096]
    - [41, 0.0]
  - - [128, 96, 1, 8192]
    - [41, 0.0]
  - - [192, 64, 1, 8192]
    - [41, 0.0]
  - - [192, 96, 1, 4096]
    - [41, 0.0]
  - - [192, 96, 1, 8192]
    - [41, 0.0]
  - - [256, 32, 1, 8192]
    - [41, 0.0]
  - - [256, 64, 1, 4096]
    - [41, 0.0]
  - - [256, 64, 1, 8192]
    - [41, 0.0]
  - - [384, 32, 1, 8192]
    - [41, 0.0]
  - - [512, 32, 1, 8192]
    - [41, 0.0]
  - - [32, 384, 1, 1024]
    - [42, 0.0]
  - - [128, 16, 1, 1024]
    - [42, 0.0]
  - - [128, 96, 1, 1024]
    - [8, 0.0]
  - - [512, 32, 1, 1024]
    - [42, 0.0]
  - - [32, 384, 1, 8192]
    - [43, 0.0]
  - - [64, 512, 1, 4096]
    - [43, 0.0]
  - - [96, 192, 1, 4096]
    - [43, 0.0]
  - - [96, 192, 1, 8192]
    - [43, 0.0]
  - - [128, 128, 1, 8192]
    - [45, 0.0]
  - - [192, 128, 1, 8192]
    - [43, 0.0]
  - - [256, 96, 1, 8192]
    - [43, 0.0]
  - - [256, 128, 1, 4096]
    - [43, 0.0]
  - - [256, 128, 1, 8192]
    - [43, 0.0]
  - - [512, 64, 1, 4096]
    - [43, 0.0]
  - - [32, 512, 1, 1024]
    - [44, 0.0]
  - - [32, 768, 1, 1024]
    - [44, 0.0]
  - - [32, 1024, 1, 1024]
    - [44, 0.0]
  - - [96, 192, 1, 1024]
    - [44, 0.0]
  - - [32, 512, 1, 8192]
    - [45, 0.0]
  - - [64, 192, 1, 8192]
    - [45, 0.0]
  - - [96, 96, 1, 8192]
    - [45, 0.0]
  - - [32, 768, 1, 4096]
    - [46, 0.0]
  - - [32, 768, 1, 8192]
    - [46, 0.0]
  - - [64, 384, 1, 4096]
    - [46, 0.0]
  - - [96, 256, 1, 4096]
    - [46, 0.0]
  - - [96, 256, 1, 8192]
    - [46, 0.0]
  - - [128, 192, 1, 8192]
    - [46, 0.0]
  - - [192, 128, 1, 4096]
    - [46, 0.0]
  - - [192, 192, 1, 4096]
    - [46, 0.0]
  - - [256, 96, 1, 4096]
    - [46, 0.0]
  - - [256, 192, 1, 4096]
    - [46, 0.0]
  - - [384, 64, 1, 4096]
    - [46, 0.0]
  - - [384, 96, 1, 4096]
    - [46, 0.0]
  - - [384, 96, 1, 8192]
    - [446, 0.0]
  - - [768, 32, 1, 4096]
    - [46, 0.0]
  - - [768, 64, 1, 4096]
    - [46, 0.0]
  - - [32, 1024, 1, 4096]
    - [47, 0.0]
  - - [96, 512, 1, 4096]
    - [47, 0.0]
  - - [128, 384, 1, 4096]
    - [47, 0.0]
  - - [32, 2048, 1, 4096]
    - [48, 0.0]
  - - [256, 512, 1, 4096]
    - [48, 0.0]
  - - [384, 384, 1, 4096]
    - [182, 0.0]
  - - [512, 256, 1, 4096]
    - [155, 0.0]
  - - [32, 2048, 1, 8192]
    - [49, 0.0]
  - - [96, 1024, 1, 8192]
    - [49, 0.0]
  - - [32, 4096, 1, 1024]
    - [50, 0.0]
  - - [32, 4096, 1, 8192]
    - [51, 0.0]
  - - [96, 2048, 1, 4096]
    - [51, 0.0]
  - - [32, 8192, 1, 256]
    - [52, 0.0]
  - - [64, 4096, 1, 256]
    - [52, 0.0]
  - - [96, 2048, 1, 256]
    - [52, 0.0]
  - - [96, 2048, 1, 1024]
    - [52, 0.0]
  - - [128, 2048, 1, 256]
    - [52, 0.0]
  - - [128, 2048, 1, 1024]
    - [52, 0.0]
  - - [256, 1024, 1, 256]
    - [52, 0.0]
  - - [384, 512, 1, 256]
    - [52, 0.0]
  - - [384, 768, 1, 256]
    - [52, 0.0]
  - - [512, 512, 1, 256]
    - [52, 0.0]
  - - [512, 512, 1, 1024]
    - [52, 0.0]
  - - [32, 8192, 1, 1024]
    - [53, 0.0]
  - - [32, 8192, 1, 4096]
    - [54, 0.0]
  - - [32, 8192, 1, 8192]
    - [55, 0.0]
  - - [32, 12288, 1, 256]
    - [56, 0.0]
  - - [96, 4096, 1, 1024]
    - [56, 0.0]
  - - [32, 12288, 1, 1024]
    - [57, 0.0]
  - - [32, 12288, 1, 4096]
    - [58, 0.0]
  - - [32, 12288, 1, 8192]
    - [434, 0.0]
  - - [32, 16384, 1, 256]
    - [59, 0.0]
  - - [32, 16384, 1, 1024]
    - [60, 0.0]
  - - [32, 32768, 1, 1024]
    - [60, 0.0]
  - - [32, 16384, 1, 4096]
    - [61, 0.0]
  - - [32, 16384, 1, 8192]
    - [62, 0.0]
  - - [32, 24576, 1, 256]
    - [63, 0.0]
  - - [32, 24576, 1, 1024]
    - [64, 0.0]
  - - [32, 24576, 1, 4096]
    - [65, 0.0]
  - - [32, 24576, 1, 8192]
    - [65, 0.0]
  - - [32, 32768, 1, 256]
    - [65, 0.0]
  - - [32, 32768, 1, 8192]
    - [65, 0.0]
  - - [32, 32768, 1, 4096]
    - [66, 0.0]
  - - [64, 64, 1, 256]
    - [67, 0.0]
  - - [64, 256, 1, 256]
    - [67, 0.0]
  - - [96, 384, 1, 256]
    - [67, 0.0]
  - - [128, 96, 1, 256]
    - [67, 0.0]
  - - [192, 32, 1, 256]
    - [67, 0.0]
  - - [64, 96, 1, 256]
    - [68, 0.0]
  - - [256, 64, 1, 1024]
    - [68, 0.0]
  - - [64, 192, 1, 1024]
    - [435, 0.0]
  - - [64, 256, 1, 1024]
    - [69, 0.0]
  - - [64, 256, 1, 4096]
    - [45, 0.0]
  - - [64, 384, 1, 256]
    - [70, 0.0]
  - - [64, 384, 1, 8192]
    - [71, 0.0]
  - - [128, 192, 1, 4096]
    - [71, 0.0]
  - - [64, 512, 1, 256]
    - [72, 0.0]
  - - [64, 512, 1, 8192]
    - [73, 0.0]
  - - [64, 768, 1, 4096]
    - [74, 0.0]
  - - [192, 256, 1, 4096]
    - [74, 0.0]
  - - [192, 384, 1, 4096]
    - [74, 0.0]
  - - [384, 128, 1, 4096]
    - [74, 0.0]
  - - [384, 256, 1, 4096]
    - [74, 0.0]
  - - [64, 768, 1, 8192]
    - [75, 0.0]
  - - [128, 512, 1, 8192]
    - [75, 0.0]
  - - [128, 1024, 1, 8192]
    - [442, 0.0]
  - - [192, 384, 1, 8192]
    - [75, 0.0]
  - - [192, 768, 1, 8192]
    - [75, 0.0]
  - - [256, 256, 1, 4096]
    - [75, 0.0]
  - - [256, 256, 1, 8192]
    - [75, 0.0]
  - - [384, 128, 1, 8192]
    - [75, 0.0]
  - - [384, 192, 1, 8192]
    - [75, 0.0]
  - - [512, 96, 1, 4096]
    - [75, 0.0]
  - - [768, 64, 1, 8192]
    - [75, 0.0]
  - - [1024, 64, 1, 8192]
    - [75, 0.0]
  - - [64, 1024, 1, 4096]
    - [76, 0.0]
  - - [64, 1024, 1, 8192]
    - [76, 0.0]
  - - [64, 2048, 1, 1024]
    - [77, 0.0]
  - - [768, 192, 1, 1024]
    - [77, 0.0]
  - - [2048, 64, 1, 1024]
    - [77, 0.0]
  - - [64, 2048, 1, 4096]
    - [436, 0.0]
  - - [64, 2048, 1, 8192]
    - [78, 0.0]
  - - [128, 1024, 1, 4096]
    - [78, 0.0]
  - - [192, 768, 1, 4096]
    - [78, 0.0]
  - - [256, 1024, 1, 4096]
    - [78, 0.0]
  - - [384, 384, 1, 8192]
    - [78, 0.0]
  - - [64, 4096, 1, 1024]
    - [79, 0.0]
  - - [64, 4096, 1, 4096]
    - [80, 0.0]
  - - [64, 4096, 1, 8192]
    - [81, 0.0]
  - - [64, 8192, 1, 256]
    - [82, 0.0]
  - - [64, 8192, 1, 1024]
    - [83, 0.0]
  - - [64, 8192, 1, 4096]
    - [84, 0.0]
  - - [192, 2048, 1, 1024]
    - [84, 0.0]
  - - [256, 2048, 1, 1024]
    - [84, 0.0]
  - - [512, 768, 1, 1024]
    - [84, 0.0]
  - - [512, 1024, 1, 1024]
    - [84, 0.0]
  - - [64, 8192, 1, 8192]
    - [85, 0.0]
  - - [128, 4096, 1, 1024]
    - [85, 0.0]
  - - [64, 12288, 1, 256]
    - [86, 0.0]
  - - [64, 16384, 1, 256]
    - [86, 0.0]
  - - [64, 12288, 1, 1024]
    - [87, 0.0]
  - - [64, 16384, 1, 1024]
    - [87, 0.0]
  - - [64, 16384, 1, 4096]
    - [87, 0.0]
  - - [64, 16384, 1, 8192]
    - [87, 0.0]
  - - [256, 4096, 1, 1024]
    - [87, 0.0]
  - - [512, 2048, 1, 1024]
    - [87, 0.0]
  - - [64, 12288, 1, 4096]
    - [88, 0.0]
  - - [64, 12288, 1, 8192]
    - [89, 0.0]
  - - [64, 24576, 1, 256]
    - [90, 0.0]
  - - [64, 24576, 1, 1024]
    - [91, 0.0]
  - - [64, 24576, 1, 4096]
    - [92, 0.0]
  - - [64, 24576, 1, 8192]
    - [92, 0.0]
  - - [64, 32768, 1, 8192]
    - [92, 0.0]
  - - [192, 8192, 1, 1024]
    - [92, 0.0]
  - - [192, 8192, 1, 4096]
    - [92, 0.0]
  - - [192, 12288, 1, 1024]
    - [92, 0.0]
  - - [192, 12288, 1, 4096]
    - [92, 0.0]
  - - [64, 32768, 1, 256]
    - [93, 0.0]
  - - [64, 32768, 1, 1024]
    - [94, 0.0]
  - - [64, 32768, 1, 4096]
    - [95, 0.0]
  - - [96, 16, 1, 4096]
    - [96, 0.0]
  - - [128, 32, 1, 8192]
    - [96, 0.0]
  - - [256, 16, 1, 8192]
    - [96, 0.0]
  - - [96, 16, 1, 8192]
    - [4, 0.0]
  - - [96, 32, 1, 4096]
    - [7, 0.0]
  - - [96, 384, 1, 1024]
    - [97, 0.0]
  - - [128, 128, 1, 1024]
    - [97, 0.0]
  - - [128, 192, 1, 1024]
    - [97, 0.0]
  - - [192, 128, 1, 1024]
    - [97, 0.0]
  - - [96, 384, 1, 4096]
    - [98, 0.0]
  - - [96, 512, 1, 8192]
    - [437, 0.0]
  - - [96, 1024, 1, 4096]
    - [98, 0.0]
  - - [128, 384, 1, 8192]
    - [98, 0.0]
  - - [128, 768, 1, 4096]
    - [98, 0.0]
  - - [192, 256, 1, 8192]
    - [98, 0.0]
  - - [192, 512, 1, 4096]
    - [98, 0.0]
  - - [256, 192, 1, 8192]
    - [98, 0.0]
  - - [256, 384, 1, 4096]
    - [98, 0.0]
  - - [256, 384, 1, 8192]
    - [98, 0.0]
  - - [384, 256, 1, 8192]
    - [447, 0.0]
  - - [512, 192, 1, 4096]
    - [98, 0.0]
  - - [768, 96, 1, 8192]
    - [98, 0.0]
  - - [768, 128, 1, 4096]
    - [98, 0.0]
  - - [768, 128, 1, 8192]
    - [75, 0.0]
  - - [1024, 64, 1, 4096]
    - [98, 0.0]
  - - [96, 384, 1, 8192]
    - [99, 0.0]
  - - [384, 192, 1, 4096]
    - [99, 0.0]
  - - [96, 512, 1, 1024]
    - [100, 0.0]
  - - [256, 256, 1, 1024]
    - [3, 0.0]
  - - [768, 96, 1, 1024]
    - [100, 0.0]
  - - [96, 768, 1, 8192]
    - [101, 0.0]
  - - [96, 2048, 1, 8192]
    - [102, 0.0]
  - - [96, 4096, 1, 256]
    - [103, 0.0]
  - - [128, 4096, 1, 256]
    - [103, 0.0]
  - - [192, 2048, 1, 256]
    - [103, 0.0]
  - - [384, 512, 1, 1024]
    - [103, 0.0]
  - - [384, 1024, 1, 256]
    - [103, 0.0]
  - - [512, 384, 1, 1024]
    - [103, 0.0]
  - - [512, 768, 1, 256]
    - [103, 0.0]
  - - [512, 1024, 1, 256]
    - [103, 0.0]
  - - [768, 256, 1, 256]
    - [103, 0.0]
  - - [768, 256, 1, 1024]
    - [103, 0.0]
  - - [768, 384, 1, 1024]
    - [103, 0.0]
  - - [1024, 256, 1, 1024]
    - [103, 0.0]
  - - [1024, 384, 1, 256]
    - [103, 0.0]
  - - [1024, 512, 1, 256]
    - [103, 0.0]
  - - [2048, 128, 1, 256]
    - [103, 0.0]
  - - [2048, 128, 1, 1024]
    - [103, 0.0]
  - - [2048, 192, 1, 256]
    - [103, 0.0]
  - - [4096, 128, 1, 256]
    - [103, 0.0]
  - - [96, 4096, 1, 4096]
    - [104, 0.0]
  - - [96, 4096, 1, 8192]
    - [105, 0.0]
  - - [512, 1024, 1, 8192]
    - [105, 0.0]
  - - [768, 768, 1, 8192]
    - [105, 0.0]
  - - [2048, 192, 1, 8192]
    - [105, 0.0]
  - - [96, 8192, 1, 256]
    - [106, 0.0]
  - - [96, 12288, 1, 256]
    - [106, 0.0]
  - - [96, 8192, 1, 1024]
    - [107, 0.0]
  - - [96, 8192, 1, 4096]
    - [108, 0.0]
  - - [96, 8192, 1, 8192]
    - [108, 0.0]
  - - [96, 12288, 1, 1024]
    - [109, 0.0]
  - - [96, 12288, 1, 4096]
    - [110, 0.0]
  - - [96, 12288, 1, 8192]
    - [111, 0.0]
  - - [96, 16384, 1, 256]
    - [112, 0.0]
  - - [96, 32768, 1, 256]
    - [112, 0.0]
  - - [96, 16384, 1, 1024]
    - [113, 0.0]
  - - [96, 16384, 1, 4096]
    - [114, 0.0]
  - - [128, 12288, 1, 256]
    - [114, 0.0]
  - - [128, 12288, 1, 1024]
    - [114, 0.0]
  - - [128, 16384, 1, 1024]
    - [114, 0.0]
  - - [256, 16384, 1, 256]
    - [114, 0.0]
  - - [384, 4096, 1, 256]
    - [114, 0.0]
  - - [512, 4096, 1, 4096]
    - [114, 0.0]
  - - [512, 8192, 1, 256]
    - [114, 0.0]
  - - [512, 8192, 1, 1024]
    - [114, 0.0]
  - - [768, 2048, 1, 256]
    - [114, 0.0]
  - - [1024, 4096, 1, 256]
    - [114, 0.0]
  - - [1024, 4096, 1, 1024]
    - [114, 0.0]
  - - [2048, 768, 1, 4096]
    - [114, 0.0]
  - - [2048, 2048, 1, 256]
    - [114, 0.0]
  - - [2048, 2048, 1, 1024]
    - [114, 0.0]
  - - [4096, 384, 1, 4096]
    - [114, 0.0]
  - - [4096, 512, 1, 4096]
    - [114, 0.0]
  - - [8192, 256, 1, 4096]
    - [114, 0.0]
  - - [12288, 128, 1, 1024]
    - [114, 0.0]
  - - [96, 16384, 1, 8192]
    - [115, 0.0]
  - - [96, 24576, 1, 256]
    - [116, 0.0]
  - - [96, 24576, 1, 1024]
    - [117, 0.0]
  - - [96, 24576, 1, 4096]
    - [118, 0.0]
  - - [96, 24576, 1, 8192]
    - [119, 0.0]
  - - [96, 32768, 1, 1024]
    - [438, 0.0]
  - - [96, 32768, 1, 4096]
    - [439, 0.0]
  - - [96, 32768, 1, 8192]
    - [120, 0.0]
  - - [128, 16, 1, 4096]
    - [121, 0.0]
  - - [512, 16, 1, 4096]
    - [121, 0.0]
  - - [128, 128, 1, 4096]
    - [122, 0.0]
  - - [128, 256, 1, 4096]
    - [123, 0.0]
  - - [128, 256, 1, 8192]
    - [124, 0.0]
  - - [128, 384, 1, 256]
    - [125, 0.0]
  - - [192, 384, 1, 256]
    - [125, 0.0]
  - - [256, 768, 1, 256]
    - [125, 0.0]
  - - [512, 384, 1, 256]
    - [125, 0.0]
  - - [768, 384, 1, 256]
    - [125, 0.0]
  - - [128, 384, 1, 1024]
    - [126, 0.0]
  - - [256, 128, 1, 1024]
    - [126, 0.0]
  - - [128, 512, 1, 1024]
    - [127, 0.0]
  - - [128, 512, 1, 4096]
    - [128, 0.0]
  - - [128, 768, 1, 8192]
    - [129, 0.0]
  - - [192, 512, 1, 8192]
    - [129, 0.0]
  - - [768, 256, 1, 8192]
    - [129, 0.0]
  - - [128, 1024, 1, 1024]
    - [130, 0.0]
  - - [192, 512, 1, 1024]
    - [130, 0.0]
  - - [192, 768, 1, 1024]
    - [130, 0.0]
  - - [256, 512, 1, 1024]
    - [130, 0.0]
  - - [512, 256, 1, 1024]
    - [130, 0.0]
  - - [128, 2048, 1, 4096]
    - [131, 0.0]
  - - [384, 768, 1, 4096]
    - [131, 0.0]
  - - [768, 384, 1, 4096]
    - [131, 0.0]
  - - [2048, 128, 1, 4096]
    - [131, 0.0]
  - - [128, 2048, 1, 8192]
    - [132, 0.0]
  - - [1024, 96, 1, 4096]
    - [132, 0.0]
  - - [1024, 128, 1, 4096]
    - [132, 0.0]
  - - [128, 4096, 1, 4096]
    - [133, 0.0]
  - - [384, 2048, 1, 4096]
    - [133, 0.0]
  - - [1024, 768, 1, 4096]
    - [133, 0.0]
  - - [128, 4096, 1, 8192]
    - [134, 0.0]
  - - [512, 2048, 1, 8192]
    - [134, 0.0]
  - - [2048, 192, 1, 4096]
    - [134, 0.0]
  - - [2048, 256, 1, 4096]
    - [134, 0.0]
  - - [2048, 512, 1, 4096]
    - [134, 0.0]
  - - [4096, 96, 1, 8192]
    - [134, 0.0]
  - - [4096, 128, 1, 4096]
    - [134, 0.0]
  - - [4096, 128, 1, 8192]
    - [134, 0.0]
  - - [128, 8192, 1, 256]
    - [135, 0.0]
  - - [512, 2048, 1, 4096]
    - [135, 0.0]
  - - [128, 8192, 1, 1024]
    - [136, 0.0]
  - - [128, 8192, 1, 4096]
    - [137, 0.0]
  - - [256, 4096, 1, 4096]
    - [137, 0.0]
  - - [128, 8192, 1, 8192]
    - [138, 0.0]
  - - [128, 12288, 1, 4096]
    - [139, 0.0]
  - - [128, 16384, 1, 8192]
    - [139, 0.0]
  - - [256, 8192, 1, 4096]
    - [139, 0.0]
  - - [384, 8192, 1, 1024]
    - [139, 0.0]
  - - [512, 4096, 1, 256]
    - [139, 0.0]
  - - [1024, 2048, 1, 1024]
    - [139, 0.0]
  - - [128, 12288, 1, 8192]
    - [140, 0.0]
  - - [12288, 256, 1, 8192]
    - [140, 0.0]
  - - [128, 16384, 1, 256]
    - [141, 0.0]
  - - [256, 8192, 1, 256]
    - [141, 0.0]
  - - [384, 8192, 1, 256]
    - [141, 0.0]
  - - [768, 2048, 1, 4096]
    - [141, 0.0]
  - - [2048, 1024, 1, 1024]
    - [141, 0.0]
  - - [128, 16384, 1, 4096]
    - [142, 0.0]
  - - [256, 8192, 1, 1024]
    - [142, 0.0]
  - - [128, 24576, 1, 256]
    - [143, 0.0]
  - - [256, 12288, 1, 256]
    - [143, 0.0]
  - - [512, 24576, 1, 256]
    - [143, 0.0]
  - - [128, 24576, 1, 1024]
    - [144, 0.0]
  - - [128, 24576, 1, 4096]
    - [145, 0.0]
  - - [128, 24576, 1, 8192]
    - [145, 0.0]
  - - [4096, 768, 1, 4096]
    - [145, 0.0]
  - - [128, 32768, 1, 256]
    - [146, 0.0]
  - - [128, 32768, 1, 1024]
    - [146, 0.0]
  - - [384, 12288, 1, 256]
    - [146, 0.0]
  - - [128, 32768, 1, 4096]
    - [147, 0.0]
  - - [256, 16384, 1, 1024]
    - [147, 0.0]
  - - [384, 12288, 1, 1024]
    - [147, 0.0]
  - - [384, 12288, 1, 4096]
    - [147, 0.0]
  - - [384, 12288, 1, 8192]
    - [147, 0.0]
  - - [384, 16384, 1, 1024]
    - [147, 0.0]
  - - [384, 32768, 1, 1024]
    - [147, 0.0]
  - - [512, 12288, 1, 1024]
    - [147, 0.0]
  - - [512, 12288, 1, 4096]
    - [147, 0.0]
  - - [512, 16384, 1, 1024]
    - [365, 0.0]
  - - [512, 24576, 1, 4096]
    - [147, 0.0]
  - - [768, 16384, 1, 4096]
    - [147, 0.0]
  - - [768, 32768, 1, 1024]
    - [454, 0.0]
  - - [1024, 4096, 1, 4096]
    - [147, 0.0]
  - - [1024, 12288, 1, 1024]
    - [147, 0.0]
  - - [1024, 12288, 1, 4096]
    - [147, 0.0]
  - - [1024, 32768, 1, 1024]
    - [147, 0.0]
  - - [1024, 32768, 1, 4096]
    - [147, 0.0]
  - - [2048, 4096, 1, 1024]
    - [147, 0.0]
  - - [2048, 8192, 1, 1024]
    - [449, 0.0]
  - - [2048, 12288, 1, 256]
    - [147, 0.0]
  - - [2048, 12288, 1, 1024]
    - [147, 0.0]
  - - [2048, 16384, 1, 256]
    - [147, 0.0]
  - - [4096, 2048, 1, 1024]
    - [147, 0.0]
  - - [4096, 4096, 1, 256]
    - [147, 0.0]
  - - [4096, 4096, 1, 1024]
    - [147, 0.0]
  - - [4096, 8192, 1, 256]
    - [147, 0.0]
  - - [4096, 8192, 1, 1024]
    - [147, 0.0]
  - - [8192, 2048, 1, 1024]
    - [147, 0.0]
  - - [12288, 2048, 1, 256]
    - [147, 0.0]
  - - [16384, 2048, 1, 1024]
    - [147, 0.0]
  - - [128, 32768, 1, 8192]
    - [148, 0.0]
  - - [2048, 2048, 1, 4096]
    - [148, 0.0]
  - - [24576, 512, 1, 4096]
    - [148, 0.0]
  - - [192, 16, 1, 4096]
    - [149, 0.0]
  - - [192, 64, 1, 4096]
    - [150, 0.0]
  - - [384, 32, 1, 4096]
    - [150, 0.0]
  - - [768, 16, 1, 4096]
    - [150, 0.0]
  - - [192, 96, 1, 1024]
    - [151, 0.0]
  - - [192, 768, 1, 256]
    - [152, 0.0]
  - - [192, 1024, 1, 256]
    - [153, 0.0]
  - - [256, 1024, 1, 1024]
    - [153, 0.0]
  - - [192, 1024, 1, 1024]
    - [154, 0.0]
  - - [256, 768, 1, 1024]
    - [154, 0.0]
  - - [384, 768, 1, 1024]
    - [154, 0.0]
  - - [192, 1024, 1, 4096]
    - [155, 0.0]
  - - [192, 1024, 1, 8192]
    - [155, 0.0]
  - - [256, 768, 1, 8192]
    - [155, 0.0]
  - - [384, 512, 1, 8192]
    - [155, 0.0]
  - - [768, 192, 1, 8192]
    - [452, 0.0]
  - - [192, 2048, 1, 4096]
    - [156, 0.0]
  - - [384, 1024, 1, 4096]
    - [156, 0.0]
  - - [512, 768, 1, 4096]
    - [156, 0.0]
  - - [768, 512, 1, 4096]
    - [156, 0.0]
  - - [192, 2048, 1, 8192]
    - [157, 0.0]
  - - [192, 4096, 1, 256]
    - [158, 0.0]
  - - [384, 2048, 1, 256]
    - [158, 0.0]
  - - [384, 2048, 1, 1024]
    - [158, 0.0]
  - - [512, 2048, 1, 256]
    - [158, 0.0]
  - - [768, 512, 1, 1024]
    - [158, 0.0]
  - - [768, 768, 1, 1024]
    - [158, 0.0]
  - - [768, 1024, 1, 256]
    - [158, 0.0]
  - - [1024, 768, 1, 256]
    - [158, 0.0]
  - - [2048, 384, 1, 256]
    - [158, 0.0]
  - - [192, 4096, 1, 1024]
    - [159, 0.0]
  - - [192, 4096, 1, 4096]
    - [160, 0.0]
  - - [2048, 384, 1, 4096]
    - [160, 0.0]
  - - [192, 4096, 1, 8192]
    - [161, 0.0]
  - - [192, 8192, 1, 256]
    - [162, 0.0]
  - - [192, 8192, 1, 8192]
    - [163, 0.0]
  - - [192, 12288, 1, 256]
    - [164, 0.0]
  - - [192, 12288, 1, 8192]
    - [165, 0.0]
  - - [192, 16384, 1, 256]
    - [166, 0.0]
  - - [192, 16384, 1, 1024]
    - [167, 0.0]
  - - [768, 4096, 1, 1024]
    - [167, 0.0]
  - - [192, 16384, 1, 4096]
    - [168, 0.0]
  - - [384, 8192, 1, 4096]
    - [168, 0.0]
  - - [768, 4096, 1, 4096]
    - [168, 0.0]
  - - [192, 16384, 1, 8192]
    - [169, 0.0]
  - - [192, 24576, 1, 256]
    - [170, 0.0]
  - - [192, 24576, 1, 1024]
    - [171, 0.0]
  - - [192, 24576, 1, 4096]
    - [172, 0.0]
  - - [192, 24576, 1, 8192]
    - [173, 0.0]
  - - [192, 32768, 1, 256]
    - [174, 0.0]
  - - [192, 32768, 1, 1024]
    - [169, 0.0]
  - - [8192, 1024, 1, 1024]
    - [175, 0.0]
  - - [192, 32768, 1, 4096]
    - [176, 0.0]
  - - [384, 16384, 1, 4096]
    - [176, 0.0]
  - - [192, 32768, 1, 8192]
    - [177, 0.0]
  - - [256, 32, 1, 4096]
    - [178, 0.0]
  - - [256, 192, 1, 1024]
    - [179, 0.0]
  - - [256, 384, 1, 1024]
    - [180, 0.0]
  - - [384, 384, 1, 1024]
    - [180, 0.0]
  - - [256, 512, 1, 8192]
    - [443, 0.0]
  - - [256, 1024, 1, 8192]
    - [444, 0.0]
  - - [384, 768, 1, 8192]
    - [181, 0.0]
  - - [1024, 192, 1, 8192]
    - [181, 0.0]
  - - [1024, 256, 1, 8192]
    - [181, 0.0]
  - - [256, 768, 1, 4096]
    - [182, 0.0]
  - - [384, 512, 1, 4096]
    - [182, 0.0]
  - - [512, 384, 1, 4096]
    - [182, 0.0]
  - - [512, 384, 1, 8192]
    - [182, 0.0]
  - - [768, 256, 1, 4096]
    - [182, 0.0]
  - - [256, 2048, 1, 256]
    - [183, 0.0]
  - - [768, 768, 1, 256]
    - [183, 0.0]
  - - [1024, 192, 1, 1024]
    - [183, 0.0]
  - - [256, 2048, 1, 4096]
    - [184, 0.0]
  - - [256, 2048, 1, 8192]
    - [184, 0.0]
  - - [512, 1024, 1, 4096]
    - [184, 0.0]
  - - [768, 768, 1, 4096]
    - [184, 0.0]
  - - [256, 4096, 1, 256]
    - [185, 0.0]
  - - [256, 4096, 1, 8192]
    - [186, 0.0]
  - - [256, 8192, 1, 8192]
    - [187, 0.0]
  - - [384, 4096, 1, 1024]
    - [187, 0.0]
  - - [512, 4096, 1, 1024]
    - [187, 0.0]
  - - [768, 2048, 1, 1024]
    - [187, 0.0]
  - - [2048, 768, 1, 256]
    - [187, 0.0]
  - - [2048, 1024, 1, 8192]
    - [187, 0.0]
  - - [4096, 512, 1, 256]
    - [187, 0.0]
  - - [4096, 512, 1, 1024]
    - [187, 0.0]
  - - [4096, 768, 1, 256]
    - [187, 0.0]
  - - [4096, 1024, 1, 256]
    - [187, 0.0]
  - - [8192, 256, 1, 256]
    - [187, 0.0]
  - - [12288, 128, 1, 256]
    - [187, 0.0]
  - - [12288, 256, 1, 256]
    - [187, 0.0]
  - - [12288, 384, 1, 256]
    - [187, 0.0]
  - - [256, 12288, 1, 1024]
    - [188, 0.0]
  - - [256, 12288, 1, 4096]
    - [189, 0.0]
  - - [256, 24576, 1, 256]
    - [189, 0.0]
  - - [512, 12288, 1, 256]
    - [189, 0.0]
  - - [256, 12288, 1, 8192]
    - [190, 0.0]
  - - [256, 16384, 1, 4096]
    - [191, 0.0]
  - - [512, 32768, 1, 1024]
    - [197, 0.0]
  - - [256, 16384, 1, 8192]
    - [192, 0.0]
  - - [256, 24576, 1, 1024]
    - [193, 0.0]
  - - [256, 24576, 1, 4096]
    - [194, 0.0]
  - - [256, 24576, 1, 8192]
    - [195, 0.0]
  - - [8192, 768, 1, 8192]
    - [195, 0.0]
  - - [256, 32768, 1, 256]
    - [445, 0.0]
  - - [256, 32768, 1, 1024]
    - [445, 0.0]
  - - [1024, 12288, 1, 8192]
    - [196, 0.0]
  - - [1024, 24576, 1, 1024]
    - [196, 0.0]
  - - [12288, 1024, 1, 256]
    - [196, 0.0]
  - - [256, 32768, 1, 4096]
    - [197, 0.0]
  - - [256, 32768, 1, 8192]
    - [340, 0.0]
  - - [384, 64, 1, 1024]
    - [198, 0.0]
  - - [384, 96, 1, 1024]
    - [199, 0.0]
  - - [768, 32, 1, 1024]
    - [199, 0.0]
  - - [384, 1024, 1, 1024]
    - [200, 0.0]
  - - [1024, 512, 1, 1024]
    - [200, 0.0]
  - - [384, 1024, 1, 8192]
    - [201, 0.0]
  - - [384, 2048, 1, 8192]
    - [202, 0.0]
  - - [384, 4096, 1, 4096]
    - [203, 0.0]
  - - [384, 4096, 1, 8192]
    - [204, 0.0]
  - - [4096, 768, 1, 8192]
    - [204, 0.0]
  - - [384, 8192, 1, 8192]
    - [205, 0.0]
  - - [384, 16384, 1, 256]
    - [206, 0.0]
  - - [384, 32768, 1, 256]
    - [206, 0.0]
  - - [512, 16384, 1, 256]
    - [365, 0.0]
  - - [4096, 1024, 1, 8192]
    - [206, 0.0]
  - - [12288, 768, 1, 256]
    - [206, 0.0]
  - - [12288, 1024, 1, 4096]
    - [206, 0.0]
  - - [24576, 1024, 1, 256]
    - [206, 0.0]
  - - [32768, 1024, 1, 8192]
    - [206, 0.0]
  - - [384, 16384, 1, 8192]
    - [207, 0.0]
  - - [768, 8192, 1, 4096]
    - [207, 0.0]
  - - [384, 24576, 1, 256]
    - [208, 0.0]
  - - [1024, 32768, 1, 256]
    - [208, 0.0]
  - - [4096, 2048, 1, 256]
    - [208, 0.0]
  - - [16384, 1024, 1, 256]
    - [208, 0.0]
  - - [384, 24576, 1, 1024]
    - [209, 0.0]
  - - [512, 8192, 1, 4096]
    - [209, 0.0]
  - - [768, 4096, 1, 256]
    - [209, 0.0]
  - - [1024, 4096, 1, 8192]
    - [209, 0.0]
  - - [1024, 8192, 1, 1024]
    - [209, 0.0]
  - - [1024, 16384, 1, 1024]
    - [209, 0.0]
  - - [2048, 8192, 1, 256]
    - [449, 0.0]
  - - [8192, 4096, 1, 1024]
    - [209, 0.0]
  - - [384, 24576, 1, 4096]
    - [210, 0.0]
  - - [512, 16384, 1, 8192]
    - [365, 0.0]
  - - [384, 24576, 1, 8192]
    - [211, 0.0]
  - - [2048, 12288, 1, 4096]
    - [211, 0.0]
  - - [384, 32768, 1, 4096]
    - [212, 0.0]
  - - [384, 32768, 1, 8192]
    - [212, 0.0]
  - - [768, 16384, 1, 8192]
    - [212, 0.0]
  - - [768, 32768, 1, 8192]
    - [212, 0.0]
  - - [512, 16, 1, 8192]
    - [213, 0.0]
  - - [512, 32, 1, 4096]
    - [214, 0.0]
  - - [1024, 16, 1, 4096]
    - [214, 0.0]
  - - [512, 64, 1, 8192]
    - [215, 0.0]
  - - [1024, 32, 1, 8192]
    - [215, 0.0]
  - - [512, 96, 1, 1024]
    - [216, 0.0]
  - - [512, 96, 1, 8192]
    - [217, 0.0]
  - - [512, 128, 1, 8192]
    - [217, 0.0]
  - - [512, 128, 1, 4096]
    - [218, 0.0]
  - - [512, 192, 1, 8192]
    - [219, 0.0]
  - - [768, 96, 1, 4096]
    - [219, 0.0]
  - - [512, 256, 1, 8192]
    - [448, 0.0]
  - - [512, 512, 1, 4096]
    - [156, 0.0]
  - - [512, 512, 1, 8192]
    - [220, 0.0]
  - - [512, 768, 1, 8192]
    - [221, 0.0]
  - - [512, 4096, 1, 8192]
    - [222, 0.0]
  - - [512, 8192, 1, 8192]
    - [223, 0.0]
  - - [512, 32768, 1, 4096]
    - [449, 0.0]
  - - [4096, 2048, 1, 4096]
    - [223, 0.0]
  - - [16384, 256, 1, 4096]
    - [223, 0.0]
  - - [512, 12288, 1, 8192]
    - [224, 0.0]
  - - [512, 16384, 1, 4096]
    - [225, 0.0]
  - - [1024, 24576, 1, 4096]
    - [225, 0.0]
  - - [512, 24576, 1, 1024]
    - [226, 0.0]
  - - [512, 24576, 1, 8192]
    - [227, 0.0]
  - - [512, 32768, 1, 256]
    - [449, 0.0]
  - - [1024, 32768, 1, 8192]
    - [228, 0.0]
  - - [8192, 512, 1, 1024]
    - [228, 0.0]
  - - [8192, 2048, 1, 256]
    - [228, 0.0]
  - - [8192, 4096, 1, 256]
    - [228, 0.0]
  - - [12288, 384, 1, 8192]
    - [228, 0.0]
  - - [12288, 512, 1, 1024]
    - [228, 0.0]
  - - [12288, 768, 1, 1024]
    - [228, 0.0]
  - - [12288, 2048, 1, 1024]
    - [228, 0.0]
  - - [16384, 768, 1, 1024]
    - [228, 0.0]
  - - [16384, 1024, 1, 1024]
    - [228, 0.0]
  - - [16384, 2048, 1, 256]
    - [228, 0.0]
  - - [24576, 384, 1, 256]
    - [228, 0.0]
  - - [24576, 768, 1, 256]
    - [228, 0.0]
  - - [32768, 512, 1, 256]
    - [228, 0.0]
  - - [512, 32768, 1, 8192]
    - [229, 0.0]
  - - [768, 16, 1, 8192]
    - [230, 0.0]
  - - [768, 32, 1, 8192]
    - [231, 0.0]
  - - [768, 192, 1, 4096]
    - [451, 0.0]
  - - [768, 384, 1, 8192]
    - [232, 0.0]
  - - [768, 512, 1, 256]
    - [279, 0.0]
  - - [1024, 192, 1, 256]
    - [233, 0.0]
  - - [1024, 256, 1, 256]
    - [233, 0.0]
  - - [4096, 96, 1, 256]
    - [233, 0.0]
  - - [768, 512, 1, 8192]
    - [444, 0.0]
  - - [768, 1024, 1, 1024]
    - [234, 0.0]
  - - [1024, 384, 1, 1024]
    - [234, 0.0]
  - - [1024, 768, 1, 1024]
    - [234, 0.0]
  - - [1024, 1024, 1, 4096]
    - [234, 0.0]
  - - [2048, 192, 1, 1024]
    - [234, 0.0]
  - - [2048, 256, 1, 1024]
    - [234, 0.0]
  - - [2048, 384, 1, 1024]
    - [234, 0.0]
  - - [768, 1024, 1, 4096]
    - [235, 0.0]
  - - [768, 1024, 1, 8192]
    - [236, 0.0]
  - - [768, 2048, 1, 8192]
    - [237, 0.0]
  - - [2048, 768, 1, 8192]
    - [237, 0.0]
  - - [4096, 384, 1, 8192]
    - [237, 0.0]
  - - [768, 4096, 1, 8192]
    - [238, 0.0]
  - - [768, 8192, 1, 256]
    - [239, 0.0]
  - - [768, 8192, 1, 1024]
    - [240, 0.0]
  - - [8192, 768, 1, 4096]
    - [240, 0.0]
  - - [768, 8192, 1, 8192]
    - [241, 0.0]
  - - [768, 12288, 1, 256]
    - [242, 0.0]
  - - [8192, 1024, 1, 256]
    - [242, 0.0]
  - - [768, 12288, 1, 1024]
    - [243, 0.0]
  - - [768, 12288, 1, 4096]
    - [243, 0.0]
  - - [768, 12288, 1, 8192]
    - [243, 0.0]
  - - [768, 24576, 1, 1024]
    - [243, 0.0]
  - - [768, 24576, 1, 8192]
    - [243, 0.0]
  - - [8192, 1024, 1, 4096]
    - [243, 0.0]
  - - [8192, 1024, 1, 8192]
    - [243, 0.0]
  - - [12288, 2048, 1, 4096]
    - [243, 0.0]
  - - [16384, 1024, 1, 4096]
    - [243, 0.0]
  - - [16384, 1024, 1, 8192]
    - [243, 0.0]
  - - [24576, 768, 1, 4096]
    - [243, 0.0]
  - - [24576, 1024, 1, 4096]
    - [243, 0.0]
  - - [32768, 768, 1, 4096]
    - [243, 0.0]
  - - [768, 16384, 1, 256]
    - [244, 0.0]
  - - [1024, 16384, 1, 256]
    - [244, 0.0]
  - - [768, 16384, 1, 1024]
    - [245, 0.0]
  - - [768, 24576, 1, 256]
    - [453, 0.0]
  - - [4096, 1024, 1, 1024]
    - [246, 0.0]
  - - [8192, 768, 1, 1024]
    - [246, 0.0]
  - - [12288, 384, 1, 1024]
    - [246, 0.0]
  - - [768, 24576, 1, 4096]
    - [247, 0.0]
  - - [24576, 768, 1, 8192]
    - [247, 0.0]
  - - [768, 32768, 1, 256]
    - [453, 0.0]
  - - [768, 32768, 1, 4096]
    - [248, 0.0]
  - - [1024, 8192, 1, 256]
    - [248, 0.0]
  - - [1024, 12288, 1, 256]
    - [248, 0.0]
  - - [12288, 512, 1, 256]
    - [248, 0.0]
  - - [16384, 512, 1, 256]
    - [248, 0.0]
  - - [32768, 384, 1, 8192]
    - [248, 0.0]
  - - [32768, 512, 1, 1024]
    - [248, 0.0]
  - - [32768, 768, 1, 256]
    - [248, 0.0]
  - - [32768, 768, 1, 1024]
    - [248, 0.0]
  - - [32768, 1024, 1, 1024]
    - [248, 0.0]
  - - [32768, 1024, 1, 4096]
    - [248, 0.0]
  - - [1024, 16, 1, 8192]
    - [249, 0.0]
  - - [1024, 32, 1, 1024]
    - [250, 0.0]
  - - [2048, 16, 1, 1024]
    - [250, 0.0]
  - - [1024, 32, 1, 4096]
    - [251, 0.0]
  - - [1024, 96, 1, 8192]
    - [252, 0.0]
  - - [1024, 256, 1, 4096]
    - [131, 0.0]
  - - [2048, 96, 1, 4096]
    - [252, 0.0]
  - - [2048, 96, 1, 8192]
    - [252, 0.0]
  - - [1024, 128, 1, 8192]
    - [253, 0.0]
  - - [1024, 192, 1, 4096]
    - [254, 0.0]
  - - [1024, 384, 1, 4096]
    - [156, 0.0]
  - - [1024, 384, 1, 8192]
    - [255, 0.0]
  - - [1024, 512, 1, 4096]
    - [256, 0.0]
  - - [1024, 512, 1, 8192]
    - [257, 0.0]
  - - [1024, 768, 1, 8192]
    - [258, 0.0]
  - - [1024, 1024, 1, 256]
    - [259, 0.0]
  - - [8192, 128, 1, 256]
    - [259, 0.0]
  - - [1024, 1024, 1, 1024]
    - [260, 0.0]
  - - [2048, 512, 1, 1024]
    - [260, 0.0]
  - - [4096, 256, 1, 1024]
    - [260, 0.0]
  - - [4096, 256, 1, 4096]
    - [260, 0.0]
  - - [1024, 1024, 1, 8192]
    - [261, 0.0]
  - - [1024, 2048, 1, 256]
    - [262, 0.0]
  - - [1024, 2048, 1, 4096]
    - [263, 0.0]
  - - [2048, 1024, 1, 4096]
    - [263, 0.0]
  - - [8192, 256, 1, 1024]
    - [263, 0.0]
  - - [1024, 2048, 1, 8192]
    - [264, 0.0]
  - - [16384, 128, 1, 4096]
    - [264, 0.0]
  - - [16384, 128, 1, 8192]
    - [264, 0.0]
  - - [1024, 8192, 1, 4096]
    - [265, 0.0]
  - - [12288, 768, 1, 4096]
    - [265, 0.0]
  - - [12288, 768, 1, 8192]
    - [265, 0.0]
  - - [16384, 512, 1, 8192]
    - [265, 0.0]
  - - [1024, 8192, 1, 8192]
    - [365, 0.0]
  - - [32768, 256, 1, 8192]
    - [266, 0.0]
  - - [1024, 16384, 1, 4096]
    - [267, 0.0]
  - - [1024, 16384, 1, 8192]
    - [449, 0.0]
  - - [24576, 1024, 1, 1024]
    - [268, 0.0]
  - - [1024, 24576, 1, 256]
    - [269, 0.0]
  - - [1024, 24576, 1, 8192]
    - [270, 0.0]
  - - [24576, 384, 1, 4096]
    - [270, 0.0]
  - - [24576, 384, 1, 8192]
    - [270, 0.0]
  - - [2048, 16, 1, 4096]
    - [271, 0.0]
  - - [2048, 16, 1, 8192]
    - [271, 0.0]
  - - [2048, 32, 1, 1024]
    - [272, 0.0]
  - - [2048, 32, 1, 4096]
    - [273, 0.0]
  - - [2048, 32, 1, 8192]
    - [274, 0.0]
  - - [2048, 64, 1, 4096]
    - [275, 0.0]
  - - [2048, 64, 1, 8192]
    - [275, 0.0]
  - - [2048, 96, 1, 256]
    - [276, 0.0]
  - - [2048, 96, 1, 1024]
    - [277, 0.0]
  - - [2048, 128, 1, 8192]
    - [278, 0.0]
  - - [2048, 256, 1, 256]
    - [279, 0.0]
  - - [2048, 256, 1, 8192]
    - [280, 0.0]
  - - [2048, 384, 1, 8192]
    - [280, 0.0]
  - - [2048, 512, 1, 256]
    - [200, 0.0]
  - - [2048, 512, 1, 8192]
    - [281, 0.0]
  - - [2048, 768, 1, 1024]
    - [282, 0.0]
  - - [16384, 128, 1, 1024]
    - [282, 0.0]
  - - [32768, 96, 1, 256]
    - [397, 0.0]
  - - [2048, 1024, 1, 256]
    - [283, 0.0]
  - - [2048, 4096, 1, 256]
    - [284, 0.0]
  - - [2048, 4096, 1, 4096]
    - [285, 0.0]
  - - [2048, 8192, 1, 4096]
    - [449, 0.0]
  - - [2048, 16384, 1, 1024]
    - [286, 0.0]
  - - [2048, 16384, 1, 4096]
    - [287, 0.0]
  - - [4096, 16, 1, 256]
    - [288, 0.0]
  - - [8192, 16, 1, 256]
    - [288, 0.0]
  - - [4096, 16, 1, 1024]
    - [289, 0.0]
  - - [4096, 16, 1, 4096]
    - [290, 0.0]
  - - [4096, 16, 1, 8192]
    - [291, 0.0]
  - - [4096, 32, 1, 1024]
    - [292, 0.0]
  - - [4096, 32, 1, 4096]
    - [293, 0.0]
  - - [4096, 32, 1, 8192]
    - [294, 0.0]
  - - [4096, 64, 1, 256]
    - [295, 0.0]
  - - [4096, 64, 1, 1024]
    - [296, 0.0]
  - - [4096, 64, 1, 4096]
    - [297, 0.0]
  - - [4096, 64, 1, 8192]
    - [298, 0.0]
  - - [4096, 96, 1, 1024]
    - [299, 0.0]
  - - [4096, 96, 1, 4096]
    - [300, 0.0]
  - - [4096, 128, 1, 1024]
    - [301, 0.0]
  - - [4096, 192, 1, 256]
    - [302, 0.0]
  - - [4096, 192, 1, 1024]
    - [303, 0.0]
  - - [4096, 192, 1, 4096]
    - [304, 0.0]
  - - [4096, 192, 1, 8192]
    - [305, 0.0]
  - - [4096, 256, 1, 256]
    - [306, 0.0]
  - - [16384, 128, 1, 256]
    - [306, 0.0]
  - - [4096, 256, 1, 8192]
    - [307, 0.0]
  - - [4096, 384, 1, 256]
    - [308, 0.0]
  - - [8192, 512, 1, 256]
    - [308, 0.0]
  - - [16384, 256, 1, 256]
    - [308, 0.0]
  - - [4096, 384, 1, 1024]
    - [309, 0.0]
  - - [4096, 512, 1, 8192]
    - [310, 0.0]
  - - [8192, 256, 1, 8192]
    - [310, 0.0]
  - - [4096, 768, 1, 1024]
    - [311, 0.0]
  - - [8192, 384, 1, 1024]
    - [311, 0.0]
  - - [8192, 384, 1, 4096]
    - [311, 0.0]
  - - [4096, 1024, 1, 4096]
    - [312, 0.0]
  - - [4096, 4096, 1, 4096]
    - [313, 0.0]
  - - [4096, 8192, 1, 4096]
    - [314, 0.0]
  - - [8192, 16, 1, 1024]
    - [315, 0.0]
  - - [8192, 16, 1, 4096]
    - [316, 0.0]
