projects/hipblaslt/library/src/amd_detail/rocblaslt/src/Tensile/Logic/asm_full/aquavanjaram/gfx942_152cu/GridBased/aquavanjaram_Cijk_Alik_Bljk_F8NHS_BH_BiasSH_HAS_SAB_SAV_UserArgs.yaml
- {MinimumRequiredVersion: 5.0.0}
- aquavanjaram
- {Architecture: gfx942, CUCount: 152}
- [Device 0049, Device 0050]
    SolutionIndex: 0
    SolutionNameMin: Cijk_Alik_Bljk_F8NHS_BH_BiasSH_HAS_SAB_SAV_UserArgs_MT16x16x256_MI16x16x1_SN_LDSB0_GRVWA16_GRVWB16_GSU1_GSUC0_GSUWGMRR0_K1_LBSPPA256_LBSPPB256_LPA32_LPB32_LRVW16_MIWT1_1_NTA0_NTB0_SU8_SUM0_SUS256_SVW1_VWA1_VWB1_WG16_4_4_WGM1_WGMXCC8_WGMXCCG304
    SolutionIndex: 1
    SolutionNameMin: Cijk_Alik_Bljk_F8NHS_BH_BiasSH_HAS_SAB_SAV_UserArgs_MT16x16x1024_MI16x16x1_SN_LDSB1_GRVWA16_GRVWB16_GSU1_GSUC0_GSUWGMRR0_K1_LBSPPA1024_LBSPPB1024_LPA32_LPB32_LRVW16_MIWT1_1_NTA4_NTB4_SU8_SUM0_SUS1024_SVW1_VWA1_VWB1_WG16_4_4_WGM1_WGMXCC8_WGMXCCG304
    SolutionIndex: 2
    SolutionNameMin: Cijk_Alik_Bljk_F8NHS_BH_BiasSH_HAS_SAB_SAV_UserArgs_MT16x16x512_MI16x16x1_SN_LDSB1_GRVWA16_GRVWB16_GSU12_GSUAMBSK_GSUC0_GSUWGMRR0_K1_LBSPPA512_LBSPPB512_LPA32_LPB32_LRVW16_MIWT1_1_NTD0_NEPBS0_SU0_SUM0_SUS0_SVW1_VWA1_VWB1_WG16_4_4_WGM1_WGMXCC1_WGMXCCG0
    SolutionIndex: 3
    SolutionNameMin: Cijk_Alik_Bljk_F8NHS_BH_BiasSH_HAS_SAB_SAV_UserArgs_MT16x16x512_MI16x16x1_SN_LDSB1_GRVWA16_GRVWB16_GSU14_GSUAMBSK_GSUC0_GSUWGMRR0_K1_LBSPPA512_LBSPPB512_LPA32_LPB32_LRVW16_MIWT1_1_NTD0_NEPBS0_SU0_SUM0_SUS0_SVW1_VWA1_VWB1_WG16_4_4_WGM1_WGMXCC1_WGMXCCG0
    SolutionIndex: 4
    SolutionNameMin: Cijk_Alik_Bljk_F8NHS_BH_BiasSH_HAS_SAB_SAV_UserArgs_MT64x16x256_MI16x16x1_SN_LDSB1_GRVWA16_GRVWB16_GSU1_GSUC0_GSUWGMRR0_K1_LBSPPA256_LBSPPB256_LPA32_LPB32_LRVW16_MIWT1_1_SU16_SUM0_SUS256_SVW1_VWA1_VWB1_WG64_4_1_WGM8_WGMXCC8_WGMXCCG304
    SolutionIndex: 5
    SolutionNameMin: Cijk_Alik_Bljk_F8NHS_BH_BiasSH_HAS_SAB_SAV_UserArgs_MT16x16x512_MI16x16x1_SN_LDSB1_GRVWA16_GRVWB16_GSU1_GSUAMB_GSUC0_GSUWGMRR0_K1_LBSPPA512_LBSPPB512_LPA32_LPB32_LRVW16_MIWT1_1_NTD4_NEPBS16_SU16_SUM0_SUS512_SVW1_VWA1_VWB1_WG16_4_4_WGM6_WGMXCC8_WGMXCCG304
    SolutionIndex: 6
    SolutionNameMin: Cijk_Alik_Bljk_F8NHS_BH_BiasSH_HAS_SAB_SAV_UserArgs_MT16x16x512_MI16x16x1_SN_LDSB1_GRVWA16_GRVWB16_GSU10_GSUAMBSK_GSUC0_GSUWGMRR0_K1_LBSPPA512_LBSPPB512_LPA32_LPB32_LRVW16_MIWT1_1_NTD0_NEPBS0_SU0_SUM0_SUS0_SVW1_VWA1_VWB1_WG16_4_4_WGM1_WGMXCC1_WGMXCCG0
    SolutionIndex: 7
    SolutionNameMin: Cijk_Alik_Bljk_F8NHS_BH_BiasSH_HAS_SAB_SAV_UserArgs_MT16x64x256_MI16x16x1_SN_LDSB1_GRVWA16_GRVWB16_GSU1_GSUC0_GSUWGMRR0_K1_LBSPPA256_LBSPPB256_LPA32_LPB32_LRVW16_MIWT1_1_NTA4_NTB4_SU8_SUM0_SUS256_SVW1_VWA1_VWB1_WG16_16_1_WGM1_WGMXCC8_WGMXCCG304
    SolutionIndex: 8
    SolutionNameMin: Cijk_Alik_Bljk_F8NHS_BH_BiasSH_HAS_SAB_SAV_UserArgs_MT16x16x1024_MI16x16x1_SN_LDSB1_GRVWA16_GRVWB16_GSU1_GSUC0_GSUWGMRR0_K1_LBSPPA1024_LBSPPB1024_LPA32_LPB32_LRVW16_MIWT1_1_NTA0_NTB4_SU8_SUM0_SUS1024_SVW1_VWA1_VWB1_WG16_4_4_WGM1_WGMXCC8_WGMXCCG304
    SolutionIndex: 9
    SolutionNameMin: Cijk_Alik_Bljk_F8NHS_BH_BiasSH_HAS_SAB_SAV_UserArgs_MT16x16x512_MI16x16x1_SN_LDSB1_GRVWA16_GRVWB16_GSU6_GSUAMBSK_GSUC0_GSUWGMRR0_K1_LBSPPA512_LBSPPB512_LPA32_LPB32_LRVW16_MIWT1_1_NTD0_NEPBS0_SU0_SUM0_SUS0_SVW1_VWA1_VWB1_WG16_4_4_WGM1_WGMXCC1_WGMXCCG0
    SolutionIndex: 10
    SolutionNameMin: Cijk_Alik_Bljk_F8NHS_BH_BiasSH_HAS_SAB_SAV_UserArgs_MT32x64x256_MI16x16x1_SN_LDSB1_GRVWA16_GRVWB16_GSU1_LBSPPA512_LBSPPB256_LPA32_LPB32_LRVW16_MIWT2_1_NEPBS16_SU0_SUM0_SUS0_SVW2_VWA2_WG16_16_1_WGM1
    SolutionIndex: 11
    SolutionNameMin: Cijk_Alik_Bljk_F8NHS_BH_BiasSH_HAS_SAB_SAV_UserArgs_MT16x16x512_MI16x16x1_SN_LDSB1_GRVWA16_GRVWB16_GSU5_GSUAMBSK_GSUC0_GSUWGMRR0_K1_LBSPPA512_LBSPPB512_LPA32_LPB32_LRVW16_MIWT1_1_NTD0_NEPBS0_SU0_SUM0_SUS0_SVW1_VWA1_VWB1_WG16_4_4_WGM1_WGMXCC1_WGMXCCG0
    SolutionIndex: 12
    SolutionNameMin: Cijk_Alik_Bljk_F8NHS_BH_BiasSH_HAS_SAB_SAV_UserArgs_MT16x16x1024_MI16x16x1_SN_LDSB1_GRVWA16_GRVWB16_GSU1_GSUC0_GSUWGMRR0_K1_LBSPPA1024_LBSPPB1024_LPA32_LPB32_LRVW16_MIWT1_1_NTA0_NTB0_SU8_SUM0_SUS1024_SVW1_VWA1_VWB1_WG16_4_4_WGM1_WGMXCC8_WGMXCCG304
    SolutionIndex: 13
    SolutionNameMin: Cijk_Alik_Bljk_F8NHS_BH_Bias_HAS_SAV_UserArgs_MT32x16x256_MI16x16x1_SN_GRVWA16_GRVWB16_GSU1_LBSPPA256_LBSPPB256_MIWT1_1_NTA0_NLCA1_NLCB1_SU0_SUM0_SUS0_SVW1_VWA1_WG32_4_2_WGM1
    SolutionIndex: 14
    SolutionNameMin: Cijk_Alik_Bljk_F8NHS_BH_BiasSH_HAS_SAB_SAV_UserArgs_MT16x16x256_MI16x16x1_SN_LDSB0_GRVWA16_GRVWB16_GSU1_GSUC0_GSUWGMRR0_K1_LBSPPA256_LBSPPB256_LPA32_LPB32_LRVW16_MIWT1_1_NTA0_NTB4_SU8_SUM0_SUS256_SVW1_VWA1_VWB1_WG16_4_4_WGM1_WGMXCC8_WGMXCCG304
    SolutionIndex: 15
    SolutionNameMin: Cijk_Alik_Bljk_F8NHS_BH_BiasSH_HAS_SAB_SAV_UserArgs_MT16x16x512_MI16x16x1_SN_LDSB1_GRVWA16_GRVWB16_GSU1_GSUC0_GSUWGMRR0_K1_LBSPPA512_LBSPPB512_LPA32_LPB32_LRVW16_MIWT1_1_NTA0_NTB4_SU8_SUM0_SUS512_SVW1_VWA1_VWB1_WG16_4_4_WGM1_WGMXCC8_WGMXCCG304
    SolutionIndex: 16
    SolutionNameMin: Cijk_Alik_Bljk_F8NHS_BH_BiasSH_HAS_SAB_SAV_UserArgs_MT16x16x512_MI16x16x1_SN_LDSB1_GRVWA16_GRVWB16_GSU3_GSUAMBSK_GSUC0_GSUWGMRR0_K1_LBSPPA512_LBSPPB512_LPA32_LPB32_LRVW16_MIWT1_1_NTD0_NEPBS0_SU0_SUM0_SUS0_SVW1_VWA1_VWB1_WG16_4_4_WGM1_WGMXCC1_WGMXCCG0
    SolutionIndex: 17
    SolutionNameMin: Cijk_Alik_Bljk_F8NHS_BH_BiasSH_HAS_SAB_SAV_UserArgs_MT16x16x512_MI16x16x1_SN_LDSB1_GRVWA16_GRVWB16_GSU1_GSUAMB_GSUC0_GSUWGMRR0_K1_LBSPPA512_LBSPPB512_LPA32_LPB32_LRVW16_MIWT1_1_NTD4_NEPBS16_SU16_SUM0_SUS512_SVW1_VWA1_VWB1_WG16_4_4_WGM6_WGMXCC8_WGMXCCG304
    SolutionIndex: 18
    SolutionNameMin: Cijk_Alik_Bljk_F8NHS_BH_BiasSH_HAS_SAB_SAV_UserArgs_MT16x16x512_MI16x16x1_SN_LDSB1_GRVWA16_GRVWB16_GSU4_GSUAMBSK_GSUC0_GSUWGMRR0_K1_LBSPPA512_LBSPPB512_LPA32_LPB32_LRVW16_MIWT1_1_NTD0_NEPBS0_SU0_SUM0_SUS0_SVW1_VWA1_VWB1_WG16_4_4_WGM1_WGMXCC1_WGMXCCG0
    SolutionIndex: 19
    SolutionNameMin: Cijk_Alik_Bljk_F8NHS_BH_BiasSH_HAS_SAB_SAV_UserArgs_MT64x16x256_MI16x16x1_SN_LDSB0_GRVWA16_GRVWB16_GSU1_LBSPPA256_LBSPPB256_LPA32_LPB32_LRVW16_MIWT1_1_NEPBS0_SU0_SUM0_SUS0_SVW1_VWA1_WG64_4_1_WGM1
    SolutionIndex: 20
    SolutionNameMin: Cijk_Alik_Bljk_F8NHS_BH_BiasSH_HAS_SAB_SAV_UserArgs_MT16x16x512_MI16x16x1_SN_LDSB1_GRVWA16_GRVWB16_GSU1_GSUC0_GSUWGMRR0_K1_LBSPPA512_LBSPPB512_LPA32_LPB32_LRVW16_MIWT1_1_NTA0_NTB0_SU8_SUM0_SUS512_SVW1_VWA1_VWB1_WG16_4_4_WGM1_WGMXCC8_WGMXCCG304
    SolutionIndex: 21
    SolutionNameMin: Cijk_Alik_Bljk_F8NHS_BH_BiasSH_HAS_SAB_SAV_UserArgs_MT16x16x256_MI16x16x1_SN_LDSB0_GRVWA16_GRVWB16_GSU1_LBSPPA256_LBSPPB256_LPA32_LPB32_LRVW16_MIWT1_1_NEPBS16_SU0_SUM0_SUS0_SVW1_VWA1_WG16_4_1_WGM1
    SolutionIndex: 22
    SolutionNameMin: Cijk_Alik_Bljk_F8NHS_BH_BiasSH_HAS_SAB_SAV_UserArgs_MT16x64x128_MI16x16x1_SN_LDSB0_GRVWA8_GRVWB16_GSU1_LBSPPA128_LBSPPB128_LPA32_LPB32_LRVW16_MIWT1_1_NEPBS16_SU0_SUM0_SUS0_SVW1_VWA1_WG16_16_1_WGM1
    SolutionIndex: 23
    SolutionNameMin: Cijk_Alik_Bljk_F8NHS_BH_BiasSH_HAS_SAB_SAV_UserArgs_MT16x64x256_MI16x16x1_SN_LDSB1_GRVWA16_GRVWB16_GSU1_GSUC0_GSUWGMRR0_K1_LBSPPA256_LBSPPB256_LPA32_LPB32_LRVW16_MIWT1_1_NTA0_NTB4_SU8_SUM0_SUS256_SVW1_VWA1_VWB1_WG16_16_1_WGM1_WGMXCC8_WGMXCCG304
    SolutionIndex: 24
    SolutionNameMin: Cijk_Alik_Bljk_F8NHS_BH_BiasSH_HAS_SAB_SAV_UserArgs_MT16x64x512_MI16x16x1_SN_LDSB1_GRVWA16_GRVWB16_GSU1_GSUC0_GSUWGMRR0_K1_LBSPPA512_LBSPPB512_LPA32_LPB32_LRVW16_MIWT1_1_NTA0_NTB4_SU8_SUM0_SUS512_SVW1_VWA1_VWB1_WG16_16_1_WGM1_WGMXCC8_WGMXCCG304
    SolutionIndex: 25
    SolutionNameMin: Cijk_Alik_Bljk_F8NHS_BH_BiasSH_HAS_SAB_SAV_UserArgs_MT32x96x256_MI16x16x1_SN_LDSB1_GRVWA16_GRVWB16_GSU1_GSUC0_GSUWGMRR0_K1_LBSPPA256_LBSPPB256_LPA32_LPB32_LRVW16_MIWT1_3_NTA4_NTB4_SU8_SUM0_SUS256_SVW1_VWA1_VWB1_WG32_8_1_WGM1_WGMXCC8_WGMXCCG304
    SolutionIndex: 26
    SolutionNameMin: Cijk_Alik_Bljk_F8NHS_BH_BiasSH_HAS_SAB_SAV_UserArgs_MT16x128x256_MI16x16x1_SN_LDSB1_GRVWA16_GRVWB16_GSU1_GSUC0_GSUWGMRR0_K1_LBSPPA256_LBSPPB512_LPA32_LPB32_LRVW16_MIWT1_2_NTA0_NTB4_SU8_SUM0_SUS256_SVW1_VWA1_VWB2_WG16_16_1_WGM1_WGMXCC8_WGMXCCG304
    SolutionIndex: 27
    SolutionNameMin: Cijk_Alik_Bljk_F8NHS_BH_BiasSH_HAS_SAB_SAV_UserArgs_MT32x96x256_MI16x16x1_SN_LDSB1_GRVWA16_GRVWB16_GSU1_GSUC0_GSUWGMRR0_K1_LBSPPA256_LBSPPB256_LPA32_LPB32_LRVW16_MIWT1_3_NTA0_NTB4_SU8_SUM0_SUS256_SVW1_VWA1_VWB1_WG32_8_1_WGM1_WGMXCC8_WGMXCCG304
    SolutionIndex: 28
    SolutionNameMin: Cijk_Alik_Bljk_F8NHS_BH_BiasSH_HAS_SAB_SAV_UserArgs_MT16x128x256_MI16x16x1_SN_LDSB1_GRVWA16_GRVWB16_GSU1_GSUAMB_GSUC0_GSUWGMRR0_K1_LBSPPA256_LBSPPB512_LPA32_LPB32_LRVW16_MIWT1_2_NTD4_NEPBS16_SU16_SUM0_SUS256_SVW1_VWA1_VWB2_WG16_16_1_WGM6_WGMXCC8_WGMXCCG304
    SolutionIndex: 29
    SolutionNameMin: Cijk_Alik_Bljk_F8NHS_BH_BiasSH_HAS_SAB_SAV_UserArgs_MT16x64x128_MI16x16x1_SN_LDSB0_GRVWA8_GRVWB16_GSU1_GSUC0_GSUWGMRR0_K1_LBSPPA128_LBSPPB128_LPA32_LPB32_LRVW16_MIWT1_1_NTA0_NTB4_SU8_SUM0_SUS128_SVW1_VWA1_VWB1_WG16_16_1_WGM1_WGMXCC8_WGMXCCG304
    SolutionIndex: 30
    SolutionNameMin: Cijk_Alik_Bljk_F8NHS_BH_BiasSH_HAS_SAB_SAV_UserArgs_MT16x128x256_MI16x16x1_SN_LDSB1_GRVWA16_GRVWB16_GSU1_GSUC0_GSUWGMRR0_K1_LBSPPA256_LBSPPB512_LPA32_LPB32_LRVW16_MIWT1_2_SU16_SUM0_SUS256_SVW1_VWA1_VWB2_WG16_16_1_WGM8_WGMXCC8_WGMXCCG304
    SolutionIndex: 31
    SolutionNameMin: Cijk_Alik_Bljk_F8NHS_BH_BiasSH_HAS_SAB_SAV_UserArgs_MT16x192x256_MI16x16x1_SN_LDSB1_GRVWA16_GRVWB16_GSU1_GSUC0_GSUWGMRR0_K1_LBSPPA256_LBSPPB256_LPA32_LPB32_LRVW16_MIWT1_3_NTA0_NTB4_SU8_SUM0_SUS256_SVW1_VWA1_VWB1_WG16_16_1_WGM1_WGMXCC8_WGMXCCG304
    SolutionIndex: 32
    SolutionNameMin: Cijk_Alik_Bljk_F8NHS_BH_BiasSH_HAS_SAB_SAV_UserArgs_MT16x128x128_MI16x16x1_SN_LDSB1_GRVWA8_GRVWB16_GSU1_GSUC0_GSUWGMRR0_K1_LBSPPA128_LBSPPB256_LPA32_LPB32_LRVW16_MIWT1_2_NTA0_NTB4_SU8_SUM0_SUS128_SVW1_VWA1_VWB2_WG16_16_1_WGM1_WGMXCC8_WGMXCCG304
    SolutionIndex: 33
    SolutionNameMin: Cijk_Alik_Bljk_F8NHS_BH_BiasSH_HAS_SAB_SAV_UserArgs_MT16x192x256_MI16x16x1_SN_LDSB1_GRVWA16_GRVWB16_GSU1_GSUAMB_GSUC0_GSUWGMRR0_K1_LBSPPA256_LBSPPB256_LPA32_LPB32_LRVW16_MIWT1_3_NTD4_NEPBS16_SU16_SUM0_SUS256_SVW1_VWA1_VWB1_WG16_16_1_WGM6_WGMXCC8_WGMXCCG304
    SolutionIndex: 34
    SolutionNameMin: Cijk_Alik_Bljk_F8NHS_BH_BiasSH_HAS_SAB_SAV_UserArgs_MT16x256x128_MI16x16x1_SN_LDSB1_GRVWA8_GRVWB16_GSU1_GSUAMB_GSUC0_GSUWGMRR0_K1_LBSPPA128_LBSPPB512_LPA32_LPB32_LRVW16_MIWT1_4_NTD4_NEPBS16_SU16_SUM0_SUS128_SVW1_VWA1_VWB4_WG16_16_1_WGM6_WGMXCC8_WGMXCCG304
    SolutionIndex: 35
    SolutionNameMin: Cijk_Alik_Bljk_F8NHS_BH_BiasSH_HAS_SAB_SAV_UserArgs_MT16x16x512_MI16x16x1_SN_LDSB1_GRVWA16_GRVWB16_GSU10_GSUAMBSK_GSUC0_GSUWGMRR0_K1_LBSPPA512_LBSPPB512_LPA32_LPB32_LRVW16_MIWT1_1_NTD0_NEPBS0_SU0_SUM0_SUS0_SVW1_VWA1_VWB1_WG16_4_4_WGM1_WGMXCC1_WGMXCCG0
    SolutionIndex: 36
    SolutionNameMin: Cijk_Alik_Bljk_F8NHS_BH_BiasSH_HAS_SAB_SAV_UserArgs_MT16x16x256_MI16x16x1_SN_LDSB0_GRVWA16_GRVWB16_GSU1_GSUC0_GSUWGMRR0_K1_LBSPPA256_LBSPPB256_LPA32_LPB32_LRVW16_MIWT1_1_SU16_SUM0_SUS256_SVW1_VWA1_VWB1_WG16_4_4_WGM8_WGMXCC8_WGMXCCG304
    SolutionIndex: 37
    SolutionNameMin: Cijk_Alik_Bljk_F8NHS_BH_BiasSH_HAS_SAB_SAV_UserArgs_MT16x16x256_MI16x16x1_SN_LDSB0_GRVWA16_GRVWB16_GSU1_GSUC0_GSUWGMRR0_K1_LBSPPA256_LBSPPB256_LPA32_LPB32_LRVW16_MIWT1_1_NTA4_NTB0_SU8_SUM0_SUS256_SVW1_VWA1_VWB1_WG16_4_4_WGM1_WGMXCC8_WGMXCCG304
    SolutionIndex: 38
    SolutionNameMin: Cijk_Alik_Bljk_F8NHS_BH_BiasSH_HAS_SAB_SAV_UserArgs_MT32x32x256_MI16x16x1_SN_LDSB1_GRVWA16_GRVWB16_GSU1_GSUC0_GSUWGMRR0_K1_LBSPPA256_LBSPPB256_LPA32_LPB32_LRVW16_MIWT1_1_NTA0_NTB0_SU8_SUM0_SUS256_SVW1_VWA1_VWB1_WG32_8_1_WGM1_WGMXCC8_WGMXCCG304
    SolutionIndex: 39
    SolutionNameMin: Cijk_Alik_Bljk_F8NHS_BH_BiasSH_HAS_SAB_SAV_UserArgs_MT32x32x256_MI16x16x1_SN_LDSB1_GRVWA16_GRVWB16_GSU1_GSUC0_GSUWGMRR0_K1_LBSPPA256_LBSPPB256_LPA32_LPB32_LRVW16_MIWT1_1_NTA0_NTB4_SU8_SUM0_SUS256_SVW1_VWA1_VWB1_WG32_8_1_WGM1_WGMXCC8_WGMXCCG304
    SolutionIndex: 40
    SolutionNameMin: Cijk_Alik_Bljk_F8NHS_BH_BiasSH_HAS_SAB_SAV_UserArgs_MT64x16x128_MI16x16x1_SN_LDSB0_GRVWA16_GRVWB8_GSU1_LBSPPA128_LBSPPB128_LPA32_LPB32_LRVW16_MIWT1_1_NEPBS16_SU0_SUM0_SUS0_SVW1_VWA1_WG64_4_1_WGM1
    SolutionIndex: 41
    SolutionNameMin: Cijk_Alik_Bljk_F8NHS_BH_BiasSH_HAS_SAB_SAV_UserArgs_MT32x32x256_MI16x16x1_SN_LDSB0_GRVWA16_GRVWB16_GSU1_LBSPPA256_LBSPPB256_LPA32_LPB32_LRVW16_MIWT1_1_NEPBS0_SU0_SUM0_SUS0_SVW1_VWA1_WG32_8_1_WGM1
    SolutionIndex: 42
    SolutionNameMin: Cijk_Alik_Bljk_F8NHS_BH_BiasSH_HAS_SAB_SAV_UserArgs_MT16x16x512_MI16x16x1_SN_LDSB1_GRVWA16_GRVWB16_GSU2_GSUAMBSK_GSUC0_GSUWGMRR0_K1_LBSPPA512_LBSPPB512_LPA32_LPB32_LRVW16_MIWT1_1_NTD0_NEPBS0_SU0_SUM0_SUS0_SVW1_VWA1_VWB1_WG16_4_4_WGM1_WGMXCC1_WGMXCCG0
    SolutionIndex: 43
    SolutionNameMin: Cijk_Alik_Bljk_F8NHS_BH_BiasSH_HAS_SAB_SAV_UserArgs_MT32x32x512_MI16x16x1_SN_LDSB1_GRVWA16_GRVWB16_GSU1_GSUAMB_GSUC0_GSUWGMRR0_K1_LBSPPA512_LBSPPB512_LPA32_LPB32_LRVW16_MIWT1_1_NTD4_NEPBS16_SU16_SUM0_SUS512_SVW1_VWA1_VWB1_WG32_8_1_WGM6_WGMXCC8_WGMXCCG304
    SolutionIndex: 44
    SolutionNameMin: Cijk_Alik_Bljk_F8NHS_BH_BiasSH_HAS_SAB_SAV_UserArgs_MT32x32x512_MI16x16x1_SN_LDSB1_GRVWA16_GRVWB16_GSU1_GSUC0_GSUWGMRR0_K1_LBSPPA512_LBSPPB512_LPA32_LPB32_LRVW16_MIWT1_1_NTA0_NTB4_SU8_SUM0_SUS512_SVW1_VWA1_VWB1_WG32_8_1_WGM1_WGMXCC8_WGMXCCG304
    SolutionIndex: 45
    SolutionNameMin: Cijk_Alik_Bljk_F8NHS_BH_BiasSH_HAS_SAB_SAV_UserArgs_MT32x32x128_MI16x16x1_SN_LDSB0_GRVWA16_GRVWB16_GSU1_LBSPPA128_LBSPPB128_LPA32_LPB32_LRVW16_MIWT1_1_NEPBS16_SU0_SUM0_SUS0_SVW1_VWA1_WG32_8_1_WGM1
    SolutionIndex: 46
    SolutionNameMin: Cijk_Alik_Bljk_F8NHS_BH_BiasSH_HAS_SAB_SAV_UserArgs_MT32x64x256_MI16x16x1_SN_LDSB1_GRVWA16_GRVWB16_GSU1_GSUC0_GSUWGMRR0_K1_LBSPPA512_LBSPPB256_LPA32_LPB32_LRVW16_MIWT2_1_NTA0_NTB4_SU8_SUM0_SUS256_SVW2_VWA2_VWB1_WG16_16_1_WGM1_WGMXCC8_WGMXCCG304
    SolutionIndex: 47
    SolutionNameMin: Cijk_Alik_Bljk_F8NHS_BH_BiasSH_HAS_SAB_SAV_UserArgs_MT32x64x512_MI16x16x1_SN_LDSB1_GRVWA16_GRVWB16_GSU1_GSUC0_GSUWGMRR0_K1_LBSPPA1024_LBSPPB512_LPA32_LPB32_LRVW16_MIWT2_1_NTA0_NTB4_SU8_SUM0_SUS512_SVW2_VWA2_VWB1_WG16_16_1_WGM1_WGMXCC8_WGMXCCG304
    SolutionIndex: 48
    SolutionNameMin: Cijk_Alik_Bljk_F8NHS_BH_BiasSH_HAS_SAB_SAV_UserArgs_MT32x64x128_MI16x16x1_SN_LDSB0_GRVWA16_GRVWB16_GSU1_LBSPPA256_LBSPPB128_LPA32_LPB32_LRVW16_MIWT2_1_NEPBS16_SU0_SUM0_SUS0_SVW2_VWA2_WG16_16_1_WGM1
    SolutionIndex: 49
    SolutionNameMin: Cijk_Alik_Bljk_F8NHS_BH_BiasSH_HAS_SAB_SAV_UserArgs_MT32x128x256_MI16x16x1_SN_LDSB1_GRVWA16_GRVWB16_GSU1_GSUC0_GSUWGMRR0_K1_LBSPPA512_LBSPPB512_LPA32_LPB32_LRVW16_MIWT2_2_NTA0_NTB4_SU8_SUM0_SUS256_SVW2_VWA2_VWB2_WG16_16_1_WGM1_WGMXCC8_WGMXCCG304
    SolutionIndex: 50
    SolutionNameMin: Cijk_Alik_Bljk_F8NHS_BH_BiasSH_HAS_SAB_SAV_UserArgs_MT32x96x256_MI16x16x1_SN_LDSB1_GRVWA16_GRVWB16_GSU1_GSUAMB_GSUC0_GSUWGMRR0_K1_LBSPPA256_LBSPPB256_LPA32_LPB32_LRVW16_MIWT1_3_NTD4_NEPBS16_SU16_SUM0_SUS256_SVW1_VWA1_VWB1_WG32_8_1_WGM6_WGMXCC8_WGMXCCG304
    SolutionIndex: 51
    SolutionNameMin: Cijk_Alik_Bljk_F8NHS_BH_BiasSH_HAS_SAB_SAV_UserArgs_MT32x128x256_MI16x16x1_SN_LDSB1_GRVWA16_GRVWB16_GSU1_GSUC0_GSUWGMRR0_K1_LBSPPA512_LBSPPB512_LPA32_LPB32_LRVW16_MIWT2_2_SU16_SUM0_SUS256_SVW2_VWA2_VWB2_WG16_16_1_WGM8_WGMXCC8_WGMXCCG304
    SolutionIndex: 52
    SolutionNameMin: Cijk_Alik_Bljk_F8NHS_BH_BiasSH_HAS_SAB_SAV_UserArgs_MT32x64x128_MI16x16x1_SN_LDSB0_GRVWA16_GRVWB16_GSU1_GSUC0_GSUWGMRR0_K1_LBSPPA256_LBSPPB128_LPA32_LPB32_LRVW16_MIWT2_1_NTA0_NTB4_SU8_SUM0_SUS128_SVW2_VWA2_VWB1_WG16_16_1_WGM1_WGMXCC8_WGMXCCG304
    SolutionIndex: 53
    SolutionNameMin: Cijk_Alik_Bljk_F8NHS_BH_BiasSH_HAS_SAB_SAV_UserArgs_MT32x128x256_MI16x16x1_SN_LDSB1_GRVWA16_GRVWB16_GSU1_GSUAMB_GSUC0_GSUWGMRR0_K1_LBSPPA512_LBSPPB512_LPA32_LPB32_LRVW16_MIWT2_2_NTD4_NEPBS16_SU16_SUM0_SUS256_SVW2_VWA2_VWB2_WG16_16_1_WGM6_WGMXCC8_WGMXCCG304
    SolutionIndex: 54
    SolutionNameMin: Cijk_Alik_Bljk_F8NHS_BH_BiasSH_HAS_SAB_SAV_UserArgs_MT32x128x128_MI16x16x1_SN_LDSB1_GRVWA16_GRVWB16_GSU1_GSUC0_GSUWGMRR0_K1_LBSPPA256_LBSPPB256_LPA32_LPB32_LRVW16_MIWT2_2_NTA0_NTB4_SU8_SUM0_SUS128_SVW2_VWA2_VWB2_WG16_16_1_WGM1_WGMXCC8_WGMXCCG304
    SolutionIndex: 55
    SolutionNameMin: Cijk_Alik_Bljk_F8NHS_BH_BiasSH_HAS_SAB_SAV_UserArgs_MT32x192x256_MI16x16x1_SN_LDSB1_GRVWA16_GRVWB16_GSU1_GSUC0_GSUWGMRR0_K1_LBSPPA512_LBSPPB256_LPA32_LPB32_LRVW16_MIWT2_3_SU16_SUM0_SUS256_SVW2_VWA2_VWB1_WG16_16_1_WGM8_WGMXCC8_WGMXCCG304
    SolutionIndex: 56
    SolutionNameMin: Cijk_Alik_Bljk_F8NHS_BH_BiasSH_HAS_SAB_SAV_UserArgs_MT32x192x256_MI16x16x1_SN_LDSB1_GRVWA16_GRVWB16_GSU1_GSUAMB_GSUC0_GSUWGMRR0_K1_LBSPPA512_LBSPPB256_LPA32_LPB32_LRVW16_MIWT2_3_NTD4_NEPBS16_SU16_SUM0_SUS256_SVW2_VWA2_VWB1_WG16_16_1_WGM6_WGMXCC8_WGMXCCG304
    SolutionIndex: 57
    SolutionNameMin: Cijk_Alik_Bljk_F8NHS_BH_BiasSH_HAS_SAB_SAV_UserArgs_MT32x320x128_MI16x16x1_SN_LDSB1_GRVWA16_GRVWB16_GSU1_GSUC0_GSUWGMRR0_K1_LBSPPA256_LBSPPB128_LPA32_LPB32_LRVW16_MIWT2_5_NTA0_NTB4_SU8_SUM0_SUS128_SVW2_VWA2_VWB1_WG16_16_1_WGM1_WGMXCC8_WGMXCCG304
    SolutionIndex: 58
    SolutionNameMin: Cijk_Alik_Bljk_F8NHS_BH_BiasSH_HAS_SAB_SAV_UserArgs_MT32x224x128_MI16x16x1_SN_LDSB1_GRVWA16_GRVWB16_GSU1_GSUC0_GSUWGMRR0_K1_LBSPPA128_LBSPPB128_LPA32_LPB32_LRVW16_MIWT1_7_NTA0_NTB4_SU8_SUM0_SUS128_SVW1_VWA1_VWB1_WG32_8_1_WGM1_WGMXCC8_WGMXCCG304
    SolutionIndex: 59
    SolutionNameMin: Cijk_Alik_Bljk_F8NHS_BH_BiasSH_HAS_SAB_SAV_UserArgs_MT32x224x128_MI16x16x1_SN_LDSB1_GRVWA16_GRVWB16_GSU1_GSUC0_GSUWGMRR0_K1_LBSPPA128_LBSPPB128_LPA32_LPB32_LRVW16_MIWT1_7_SU16_SUM0_SUS128_SVW1_VWA1_VWB1_WG32_8_1_WGM8_WGMXCC8_WGMXCCG304
    SolutionIndex: 60
    SolutionNameMin: Cijk_Alik_Bljk_F8NHS_BH_BiasSH_HAS_SAB_SAV_UserArgs_MT64x16x128_MI16x16x1_SN_LDSB0_GRVWA16_GRVWB8_GSU1_GSUC0_GSUWGMRR0_K1_LBSPPA128_LBSPPB128_LPA32_LPB32_LRVW16_MIWT1_1_SU16_SUM0_SUS128_SVW1_VWA1_VWB1_WG64_4_1_WGM8_WGMXCC8_WGMXCCG304
    SolutionIndex: 61
    SolutionNameMin: Cijk_Alik_Bljk_F8NHS_BH_BiasSH_HAS_SAB_SAV_UserArgs_MT16x16x1024_MI16x16x1_SN_LDSB1_GRVWA16_GRVWB16_GSU1_GSUC0_GSUWGMRR0_K1_LBSPPA1024_LBSPPB1024_LPA32_LPB32_LRVW16_MIWT1_1_NTA4_NTB0_SU8_SUM0_SUS1024_SVW1_VWA1_VWB1_WG16_4_4_WGM1_WGMXCC8_WGMXCCG304
    SolutionIndex: 62
    SolutionNameMin: Cijk_Alik_Bljk_F8NHS_BH_BiasSH_HAS_SAB_SAV_UserArgs_MT16x16x512_MI16x16x1_SN_LDSB1_GRVWA16_GRVWB16_GSU6_GSUAMBSK_GSUC0_GSUWGMRR0_K1_LBSPPA512_LBSPPB512_LPA32_LPB32_LRVW16_MIWT1_1_NTD0_NEPBS0_SU0_SUM0_SUS0_SVW1_VWA1_VWB1_WG16_4_4_WGM1_WGMXCC1_WGMXCCG0
    SolutionIndex: 63
    SolutionNameMin: Cijk_Alik_Bljk_F8NHS_BH_BiasSH_HAS_SAB_SAV_UserArgs_MT64x32x128_MI16x16x1_SN_LDSB0_GRVWA16_GRVWB16_GSU1_GSUC0_GSUWGMRR0_K1_LBSPPA128_LBSPPB256_LPA32_LPB32_LRVW16_MIWT1_2_NTA4_NTB0_SU8_SUM0_SUS128_SVW1_VWA1_VWB2_WG64_4_1_WGM1_WGMXCC8_WGMXCCG304
    SolutionIndex: 64
    SolutionNameMin: Cijk_Alik_Bljk_F8NHS_BH_BiasSH_HAS_SAB_SAV_UserArgs_MT16x16x512_MI16x16x1_SN_LDSB1_GRVWA16_GRVWB16_GSU6_GSUAMBSK_GSUC0_GSUWGMRR0_K1_LBSPPA512_LBSPPB512_LPA32_LPB32_LRVW16_MIWT1_1_NTD0_NEPBS0_SU0_SUM0_SUS0_SVW1_VWA1_VWB1_WG16_4_4_WGM1_WGMXCC1_WGMXCCG0
    SolutionIndex: 65
    SolutionNameMin: Cijk_Alik_Bljk_F8NHS_BH_BiasSH_HAS_SAB_SAV_UserArgs_MT16x16x512_MI16x16x1_SN_LDSB1_GRVWA16_GRVWB16_GSU5_GSUAMBSK_GSUC0_GSUWGMRR0_K1_LBSPPA512_LBSPPB512_LPA32_LPB32_LRVW16_MIWT1_1_NTD0_NEPBS0_SU0_SUM0_SUS0_SVW1_VWA1_VWB1_WG16_4_4_WGM1_WGMXCC1_WGMXCCG0
    SolutionIndex: 66
    SolutionNameMin: Cijk_Alik_Bljk_F8NHS_BH_BiasSH_HAS_SAB_SAV_UserArgs_MT64x32x256_MI16x16x1_SN_LDSB1_GRVWA16_GRVWB16_GSU1_GSUAMB_GSUC0_GSUWGMRR0_K1_LBSPPA512_LBSPPB256_LPA32_LPB32_LRVW16_MIWT2_1_NTD4_NEPBS16_SU16_SUM0_SUS256_SVW2_VWA2_VWB1_WG32_8_1_WGM6_WGMXCC8_WGMXCCG304
    SolutionIndex: 67
    SolutionNameMin: Cijk_Alik_Bljk_F8NHS_BH_BiasSH_HAS_SAB_SAV_UserArgs_MT64x16x256_MI16x16x1_SN_LDSB1_GRVWA16_GRVWB16_GSU1_GSUC0_GSUWGMRR0_K1_LBSPPA256_LBSPPB256_LPA32_LPB32_LRVW16_MIWT1_1_NTA0_NTB0_SU8_SUM0_SUS256_SVW1_VWA1_VWB1_WG64_4_1_WGM1_WGMXCC8_WGMXCCG304
    SolutionIndex: 68
    SolutionNameMin: Cijk_Alik_Bljk_F8NHS_BH_BiasSH_HAS_SAB_SAV_UserArgs_MT16x16x512_MI16x16x1_SN_LDSB1_GRVWA16_GRVWB16_GSU4_GSUAMBSK_GSUC0_GSUWGMRR0_K1_LBSPPA512_LBSPPB512_LPA32_LPB32_LRVW16_MIWT1_1_NTD0_NEPBS0_SU0_SUM0_SUS0_SVW1_VWA1_VWB1_WG16_4_4_WGM1_WGMXCC1_WGMXCCG0
    SolutionIndex: 69
    SolutionNameMin: Cijk_Alik_Bljk_F8NHS_BH_BiasSH_HAS_SAB_SAV_UserArgs_MT64x16x256_MI16x16x1_SN_LDSB1_GRVWA16_GRVWB16_GSU1_GSUC0_GSUWGMRR0_K1_LBSPPA256_LBSPPB256_LPA32_LPB32_LRVW16_MIWT1_1_SU16_SUM0_SUS256_SVW1_VWA1_VWB1_WG64_4_1_WGM8_WGMXCC8_WGMXCCG304
    SolutionIndex: 70
    SolutionNameMin: Cijk_Alik_Bljk_F8NHS_BH_BiasSH_HAS_SAB_SAV_UserArgs_MT64x16x256_MI16x16x1_SN_LDSB1_GRVWA16_GRVWB16_GSU1_GSUC0_GSUWGMRR0_K1_LBSPPA256_LBSPPB256_LPA32_LPB32_LRVW16_MIWT1_1_NTA0_NTB4_SU8_SUM0_SUS256_SVW1_VWA1_VWB1_WG64_4_1_WGM1_WGMXCC8_WGMXCCG304
    SolutionIndex: 71
    SolutionNameMin: Cijk_Alik_Bljk_F8NHS_BH_BiasSH_HAS_SAB_SAV_UserArgs_MT32x32x512_MI16x16x1_SN_LDSB1_GRVWA16_GRVWB16_GSU3_GSUAMBSK_GSUC0_GSUWGMRR0_K1_LBSPPA512_LBSPPB512_LPA32_LPB32_LRVW16_MIWT1_1_NTD0_NEPBS0_SU0_SUM0_SUS0_SVW1_VWA1_VWB1_WG32_8_1_WGM1_WGMXCC1_WGMXCCG0
    SolutionIndex: 72
    SolutionNameMin: Cijk_Alik_Bljk_F8NHS_BH_BiasSH_HAS_SAB_SAV_UserArgs_MT64x32x512_MI16x16x1_SN_LDSB1_GRVWA16_GRVWB16_GSU6_GSUAMBSK_GSUC0_GSUWGMRR0_K1_LBSPPA1024_LBSPPB512_LPA32_LPB32_LRVW16_MIWT2_1_NTD0_NEPBS0_SU0_SUM0_SUS0_SVW2_VWA2_VWB1_WG32_8_1_WGM1_WGMXCC1_WGMXCCG0
    SolutionIndex: 73
    SolutionNameMin: Cijk_Alik_Bljk_F8NHS_BH_BiasSH_HAS_SAB_SAV_UserArgs_MT32x32x512_MI16x16x1_SN_LDSB1_GRVWA16_GRVWB16_GSU2_GSUAMBSK_GSUC0_GSUWGMRR0_K1_LBSPPA512_LBSPPB512_LPA32_LPB32_LRVW16_MIWT1_1_NTD0_NEPBS0_SU0_SUM0_SUS0_SVW1_VWA1_VWB1_WG32_8_1_WGM1_WGMXCC1_WGMXCCG0
    SolutionIndex: 74
    SolutionNameMin: Cijk_Alik_Bljk_F8NHS_BH_BiasSH_HAS_SAB_SAV_UserArgs_MT32x32x512_MI16x16x1_SN_LDSB1_GRVWA16_GRVWB16_GSU1_GSUAMB_GSUC0_GSUWGMRR0_K1_LBSPPA512_LBSPPB512_LPA32_LPB32_LRVW16_MIWT1_1_NTD4_NEPBS16_SU16_SUM0_SUS512_SVW1_VWA1_VWB1_WG32_8_1_WGM6_WGMXCC8_WGMXCCG304
    SolutionIndex: 75
    SolutionNameMin: Cijk_Alik_Bljk_F8NHS_BH_BiasSH_HAS_SAB_SAV_UserArgs_MT64x32x256_MI16x16x1_SN_LDSB1_GRVWA16_GRVWB16_GSU1_LBSPPA512_LBSPPB256_LPA32_LPB32_LRVW16_MIWT2_1_NEPBS16_SU0_SUM0_SUS0_SVW2_VWA2_WG32_8_1_WGM1
    SolutionIndex: 76
    SolutionNameMin: Cijk_Alik_Bljk_F8NHS_BH_BiasSH_HAS_SAB_SAV_UserArgs_MT64x32x512_MI16x16x1_SN_LDSB1_GRVWA16_GRVWB16_GSU1_GSUC0_GSUWGMRR0_K1_LBSPPA1024_LBSPPB512_LPA32_LPB32_LRVW16_MIWT2_1_NTA0_NTB4_SU8_SUM0_SUS512_SVW2_VWA2_VWB1_WG32_8_1_WGM1_WGMXCC8_WGMXCCG304
    SolutionIndex: 77
    SolutionNameMin: Cijk_Alik_Bljk_F8NHS_BH_BiasSH_HAS_SAB_SAV_UserArgs_MT64x32x512_MI16x16x1_SN_LDSB1_GRVWA16_GRVWB16_GSU1_GSUAMB_GSUC0_GSUWGMRR0_K1_LBSPPA512_LBSPPB1024_LPA32_LPB32_LRVW16_MIWT1_2_NTD4_NEPBS16_SU16_SUM0_SUS512_SVW1_VWA1_VWB2_WG64_4_1_WGM6_WGMXCC8_WGMXCCG304
    SolutionIndex: 78
    SolutionNameMin: Cijk_Alik_Bljk_F8NHS_BH_BiasSH_HAS_SAB_SAV_UserArgs_MT64x48x256_MI16x16x1_SN_LDSB1_GRVWA16_GRVWB16_GSU1_GSUC0_GSUWGMRR0_K1_LBSPPA256_LBSPPB256_LPA32_LPB32_LRVW16_MIWT1_3_NTA0_NTB4_SU8_SUM0_SUS256_SVW1_VWA1_VWB1_WG64_4_1_WGM1_WGMXCC8_WGMXCCG304
    SolutionIndex: 79
    SolutionNameMin: Cijk_Alik_Bljk_F8NHS_BH_BiasSH_HAS_SAB_SAV_UserArgs_MT64x32x256_MI16x16x1_SN_LDSB1_GRVWA16_GRVWB16_GSU1_GSUC0_GSUWGMRR0_K1_LBSPPA512_LBSPPB256_LPA32_LPB32_LRVW16_MIWT2_1_NTA0_NTB4_SU8_SUM0_SUS256_SVW2_VWA2_VWB1_WG32_8_1_WGM1_WGMXCC8_WGMXCCG304
    SolutionIndex: 80
    SolutionNameMin: Cijk_Alik_Bljk_F8NHS_BH_BiasSH_HAS_SAB_SAV_UserArgs_MT64x64x256_MI16x16x1_SN_LDSB1_GRVWA16_GRVWB16_GSU1_GSUC0_GSUWGMRR0_K1_LBSPPA512_LBSPPB512_LPA32_LPB32_LRVW16_MIWT2_2_NTB4_SU16_SUM0_SUS256_SVW2_VWA2_VWB2_WG32_8_1_WGM8_WGMXCC8_WGMXCCG304
    SolutionIndex: 81
    SolutionNameMin: Cijk_Alik_Bljk_F8NHS_BH_BiasSH_HAS_SAB_SAV_UserArgs_MT64x64x256_MI16x16x1_SN_LDSB1_GRVWA16_GRVWB16_GSU1_GSUAMB_GSUC0_GSUWGMRR0_K1_LBSPPA512_LBSPPB512_LPA32_LPB32_LRVW16_MIWT2_2_NTD4_NEPBS16_SU16_SUM0_SUS256_SVW2_VWA2_VWB2_WG32_8_1_WGM6_WGMXCC8_WGMXCCG304
    SolutionIndex: 82
    SolutionNameMin: Cijk_Alik_Bljk_F8NHS_BH_BiasSH_HAS_SAB_SAV_UserArgs_MT64x64x128_MI16x16x1_SN_LDSB1_GRVWA16_GRVWB16_GSU1_GSUC0_GSUWGMRR0_K1_LBSPPA256_LBSPPB256_LPA32_LPB32_LRVW16_MIWT2_2_SU16_SUM0_SUS128_SVW2_VWA2_VWB2_WG32_8_1_WGM8_WGMXCC8_WGMXCCG304
    SolutionIndex: 83
    SolutionNameMin: Cijk_Alik_Bljk_F8NHS_BH_BiasSH_HAS_SAB_SAV_UserArgs_MT64x128x256_MI16x16x1_SN_LDSB1_GRVWA16_GRVWB16_GSU1_GSUC0_GSUWGMRR0_K1_LBSPPA1024_LBSPPB512_LPA32_LPB32_LRVW16_MIWT4_2_NTA0_NTB4_SU8_SUM0_SUS256_SVW4_VWA4_VWB2_WG16_16_1_WGM1_WGMXCC8_WGMXCCG304
    SolutionIndex: 84
    SolutionNameMin: Cijk_Alik_Bljk_F8NHS_BH_BiasSH_HAS_SAB_SAV_UserArgs_MT64x96x256_MI16x16x1_SN_LDSB1_GRVWA16_GRVWB16_GSU1_GSUAMB_GSUC0_GSUWGMRR0_K1_LBSPPA512_LBSPPB256_LPA32_LPB32_LRVW16_MIWT2_3_NTD4_NEPBS16_SU16_SUM0_SUS256_SVW2_VWA2_VWB1_WG32_8_1_WGM6_WGMXCC8_WGMXCCG304
    SolutionIndex: 85
    SolutionNameMin: Cijk_Alik_Bljk_F8NHS_BH_BiasSH_HAS_SAB_SAV_UserArgs_MT64x112x256_MI16x16x1_SN_LDSB1_GRVWA16_GRVWB16_GSU1_GSUC0_GSUWGMRR0_K1_LBSPPA256_LBSPPB256_LPA32_LPB32_LRVW16_MIWT1_7_NTA0_NTB4_SU8_SUM0_SUS256_SVW1_VWA1_VWB1_WG64_4_1_WGM1_WGMXCC8_WGMXCCG304
    SolutionIndex: 86
    SolutionNameMin: Cijk_Alik_Bljk_F8NHS_BH_BiasSH_HAS_SAB_SAV_UserArgs_MT64x64x128_MI16x16x1_SN_LDSB1_GRVWA16_GRVWB16_GSU1_GSUC0_GSUWGMRR0_K1_LBSPPA256_LBSPPB256_LPA32_LPB32_LRVW16_MIWT2_2_NTA0_NTB4_SU8_SUM0_SUS128_SVW2_VWA2_VWB2_WG32_8_1_WGM1_WGMXCC8_WGMXCCG304
    SolutionIndex: 87
    SolutionNameMin: Cijk_Alik_Bljk_F8NHS_BH_BiasSH_HAS_SAB_SAV_UserArgs_MT64x128x256_MI16x16x1_SN_LDSB1_GRVWA16_GRVWB16_GSU1_GSUAMB_GSUC0_GSUWGMRR0_K1_LBSPPA1024_LBSPPB512_LPA32_LPB32_LRVW16_MIWT4_2_NTD4_NEPBS16_SU16_SUM0_SUS256_SVW4_VWA4_VWB2_WG16_16_1_WGM6_WGMXCC8_WGMXCCG304
    SolutionIndex: 88
    SolutionNameMin: Cijk_Alik_Bljk_F8NHS_BH_BiasSH_HAS_SAB_SAV_UserArgs_MT64x128x256_MI16x16x1_SN_LDSB1_GRVWA16_GRVWB16_GSU1_GSUC0_GSUWGMRR0_K1_LBSPPA512_LBSPPB1024_LPA32_LPB32_LRVW16_MIWT2_4_SU16_SUM0_SUS256_SVW2_VWA2_VWB4_WG32_8_1_WGM8_WGMXCC8_WGMXCCG304
    SolutionIndex: 89
    SolutionNameMin: Cijk_Alik_Bljk_F8NHS_BH_BiasSH_HAS_SAB_SAV_UserArgs_MT64x192x128_MI16x16x1_SN_LDSB1_GRVWA16_GRVWB16_GSU1_GSUC0_GSUWGMRR0_K1_LBSPPA512_LBSPPB128_LPA32_LPB32_LRVW16_MIWT4_3_SU16_SUM0_SUS128_SVW4_VWA4_VWB1_WG16_16_1_WGM8_WGMXCC8_WGMXCCG304
    SolutionIndex: 90
    SolutionNameMin: Cijk_Alik_Bljk_F8NHS_BH_BiasSH_HAS_SAB_SAV_UserArgs_MT64x128x128_MI16x16x1_SN_LDSB1_GRVWA16_GRVWB16_GSU1_GSUC0_GSUWGMRR0_K1_LBSPPA512_LBSPPB256_LPA32_LPB32_LRVW16_MIWT4_2_SU16_SUM0_SUS128_SVW4_VWA4_VWB2_WG16_16_1_WGM8_WGMXCC8_WGMXCCG304
    SolutionIndex: 91
    SolutionNameMin: Cijk_Alik_Bljk_F8NHS_BH_BiasSH_HAS_SAB_SAV_UserArgs_MT64x224x128_MI16x16x1_SN_LDSB1_GRVWA16_GRVWB16_GSU1_GSUAMB_GSUC0_GSUWGMRR0_K1_LBSPPA256_LBSPPB128_LPA32_LPB32_LRVW16_MIWT2_7_NTD4_NEPBS16_SU16_SUM0_SUS128_SVW2_VWA2_VWB1_WG32_8_1_WGM6_WGMXCC8_WGMXCCG304
    SolutionIndex: 92
    SolutionNameMin: Cijk_Alik_Bljk_F8NHS_BH_BiasSH_HAS_SAB_SAV_UserArgs_MT64x128x256_MI16x16x1_SN_LDSB1_GRVWA16_GRVWB16_GSU1_GSUAMB_GSUC0_GSUWGMRR0_K1_LBSPPA1024_LBSPPB512_LPA32_LPB32_LRVW16_MIWT4_2_NTD4_NEPBS16_SU16_SUM0_SUS256_SVW4_VWA4_VWB2_WG16_16_1_WGM6_WGMXCC8_WGMXCCG304
    SolutionIndex: 93
    SolutionNameMin: Cijk_Alik_Bljk_F8NHS_BH_BiasSH_HAS_SAB_SAV_UserArgs_MT64x32x256_MI16x16x1_SN_LDSB1_GRVWA16_GRVWB16_GSU1_GSUC0_GSUWGMRR0_K1_LBSPPA256_LBSPPB512_LPA32_LPB32_LRVW16_MIWT1_2_SU16_SUM0_SUS256_SVW1_VWA1_VWB2_WG64_4_1_WGM8_WGMXCC8_WGMXCCG304
    SolutionIndex: 94
    SolutionNameMin: Cijk_Alik_Bljk_F8NHS_BH_BiasSH_HAS_SAB_SAV_UserArgs_MT16x16x512_MI16x16x1_SN_LDSB1_GRVWA16_GRVWB16_GSU5_GSUAMBSK_GSUC0_GSUWGMRR0_K1_LBSPPA512_LBSPPB512_LPA32_LPB32_LRVW16_MIWT1_1_NTD0_NEPBS0_SU0_SUM0_SUS0_SVW1_VWA1_VWB1_WG16_4_4_WGM1_WGMXCC1_WGMXCCG0
    SolutionIndex: 95
    SolutionNameMin: Cijk_Alik_Bljk_F8NHS_BH_BiasSH_HAS_SAB_SAV_UserArgs_MT16x16x256_MI16x16x1_SN_LDSB0_GRVWA16_GRVWB16_GSU1_GSUC0_GSUWGMRR0_K1_LBSPPA256_LBSPPB256_LPA32_LPB32_LRVW16_MIWT1_1_SU16_SUM0_SUS256_SVW1_VWA1_VWB1_WG16_4_4_WGM8_WGMXCC8_WGMXCCG304
    SolutionIndex: 96
    SolutionNameMin: Cijk_Alik_Bljk_F8NHS_BH_BiasSH_HAS_SAB_SAV_UserArgs_MT32x64x512_MI16x16x1_SN_LDSB1_GRVWA16_GRVWB16_GSU3_GSUAMBSK_GSUC0_GSUWGMRR0_K1_LBSPPA1024_LBSPPB512_LPA32_LPB32_LRVW16_MIWT2_1_NTD0_NEPBS0_SU0_SUM0_SUS0_SVW2_VWA2_VWB1_WG16_16_1_WGM1_WGMXCC1_WGMXCCG0
    SolutionIndex: 97
    SolutionNameMin: Cijk_Alik_Bljk_F8NHS_BH_BiasSH_HAS_SAB_SAV_UserArgs_MT32x64x512_MI16x16x1_SN_LDSB1_GRVWA16_GRVWB16_GSU1_GSUC0_GSUWGMRR0_K1_LBSPPA512_LBSPPB1024_LPA32_LPB32_LRVW16_MIWT1_2_NTA0_NTB4_SU8_SUM0_SUS512_SVW1_VWA1_VWB2_WG32_8_1_WGM1_WGMXCC8_WGMXCCG304
    SolutionIndex: 98
    SolutionNameMin: Cijk_Alik_Bljk_F8NHS_BH_BiasSH_HAS_SAB_SAV_UserArgs_MT48x64x256_MI16x16x1_SN_LDSB1_GRVWA16_GRVWB16_GSU1_GSUC0_GSUWGMRR0_K1_LBSPPA256_LBSPPB256_LPA32_LPB32_LRVW16_MIWT3_1_NTA0_NTB4_SU8_SUM0_SUS256_SVW1_VWA1_VWB1_WG16_16_1_WGM1_WGMXCC8_WGMXCCG304
    SolutionIndex: 99
    SolutionNameMin: Cijk_Alik_Bljk_F8NHS_BH_BiasSH_HAS_SAB_SAV_UserArgs_MT96x32x256_MI16x16x1_SN_LDSB1_GRVWA16_GRVWB16_GSU1_GSUC0_GSUWGMRR0_K1_LBSPPA256_LBSPPB256_LPA32_LPB32_LRVW16_MIWT3_1_NTA0_NTB4_SU8_SUM0_SUS256_SVW1_VWA1_VWB1_WG32_8_1_WGM1_WGMXCC8_WGMXCCG304
    SolutionIndex: 100
    SolutionNameMin: Cijk_Alik_Bljk_F8NHS_BH_BiasSH_HAS_SAB_SAV_UserArgs_MT48x64x512_MI16x16x1_SN_LDSB1_GRVWA16_GRVWB16_GSU1_GSUC0_GSUWGMRR0_K1_LBSPPA512_LBSPPB512_LPA32_LPB32_LRVW16_MIWT3_1_NTA0_NTB4_SU8_SUM0_SUS512_SVW1_VWA1_VWB1_WG16_16_1_WGM1_WGMXCC8_WGMXCCG304
    SolutionIndex: 101
    SolutionNameMin: Cijk_Alik_Bljk_F8NHS_BH_BiasSH_HAS_SAB_SAV_UserArgs_MT96x64x256_MI16x16x1_SN_LDSB1_GRVWA16_GRVWB16_GSU1_GSUC0_GSUWGMRR0_K1_LBSPPA512_LBSPPB256_LPA32_LPB32_LRVW16_MIWT6_1_NTA0_NTB4_SU8_SUM0_SUS256_SVW2_VWA2_VWB1_WG16_16_1_WGM1_WGMXCC8_WGMXCCG304
    SolutionIndex: 102
    SolutionNameMin: Cijk_Alik_Bljk_F8NHS_BH_BiasSH_HAS_SAB_SAV_UserArgs_MT96x64x256_MI16x16x1_SN_LDSB1_GRVWA16_GRVWB16_GSU1_GSUC0_GSUWGMRR0_K1_LBSPPA256_LBSPPB512_LPA32_LPB32_LRVW16_MIWT3_2_NTA0_NTB4_SU8_SUM0_SUS256_SVW1_VWA1_VWB2_WG32_8_1_WGM1_WGMXCC8_WGMXCCG304
    SolutionIndex: 103
    SolutionNameMin: Cijk_Alik_Bljk_F8NHS_BH_BiasSH_HAS_SAB_SAV_UserArgs_MT96x64x256_MI16x16x1_SN_LDSB1_GRVWA16_GRVWB16_GSU1_GSUC0_GSUWGMRR0_K1_LBSPPA256_LBSPPB512_LPA32_LPB32_LRVW16_MIWT3_2_NTB4_SU16_SUM0_SUS256_SVW1_VWA1_VWB2_WG32_8_1_WGM8_WGMXCC8_WGMXCCG304
    SolutionIndex: 104
    SolutionNameMin: Cijk_Alik_Bljk_F8NHS_BH_BiasSH_HAS_SAB_SAV_UserArgs_MT32x128x128_MI16x16x1_SN_LDSB1_GRVWA16_GRVWB16_GSU1_GSUC0_GSUWGMRR0_K1_LBSPPA256_LBSPPB256_LPA32_LPB32_LRVW16_MIWT2_2_NTA0_NTB0_SU8_SUM0_SUS128_SVW2_VWA2_VWB2_WG16_16_1_WGM1_WGMXCC8_WGMXCCG304
    SolutionIndex: 105
    SolutionNameMin: Cijk_Alik_Bljk_F8NHS_BH_BiasSH_HAS_SAB_SAV_UserArgs_MT96x96x256_MI16x16x1_SN_LDSB1_GRVWA16_GRVWB16_GSU1_GSUC0_GSUWGMRR0_K1_LBSPPA256_LBSPPB256_LPA32_LPB32_LRVW16_MIWT3_3_NTB4_SU16_SUM0_SUS256_SVW1_VWA1_VWB1_WG32_8_1_WGM8_WGMXCC8_WGMXCCG304
    SolutionIndex: 106
    SolutionNameMin: Cijk_Alik_Bljk_F8NHS_BH_BiasSH_HAS_SAB_SAV_UserArgs_MT96x96x256_MI16x16x1_SN_LDSB1_GRVWA16_GRVWB16_GSU1_GSUAMB_GSUC0_GSUWGMRR0_K1_LBSPPA256_LBSPPB256_LPA32_LPB32_LRVW16_MIWT3_3_NTD4_NEPBS16_SU16_SUM0_SUS256_SVW1_VWA1_VWB1_WG32_8_1_WGM6_WGMXCC8_WGMXCCG304
    SolutionIndex: 107
    SolutionNameMin: Cijk_Alik_Bljk_F8NHS_BH_BiasSH_HAS_SAB_SAV_UserArgs_MT96x96x256_MI16x16x1_SN_LDSB1_GRVWA16_GRVWB16_GSU1_GSUC0_GSUWGMRR0_K1_LBSPPA256_LBSPPB256_LPA32_LPB32_LRVW16_MIWT3_3_SU16_SUM0_SUS256_SVW1_VWA1_VWB1_WG32_8_1_WGM8_WGMXCC8_WGMXCCG304
    SolutionIndex: 108
    SolutionNameMin: Cijk_Alik_Bljk_F8NHS_BH_BiasSH_HAS_SAB_SAV_UserArgs_MT96x64x128_MI16x16x1_SN_LDSB1_GRVWA16_GRVWB16_GSU1_GSUC0_GSUWGMRR0_K1_LBSPPA128_LBSPPB256_LPA32_LPB32_LRVW16_MIWT3_2_SU16_SUM0_SUS128_SVW1_VWA1_VWB2_WG32_8_1_WGM8_WGMXCC8_WGMXCCG304
    SolutionIndex: 109
    SolutionNameMin: Cijk_Alik_Bljk_F8NHS_BH_BiasSH_HAS_SAB_SAV_UserArgs_MT96x128x256_MI16x16x1_SN_LDSB1_GRVWA16_GRVWB16_GSU1_GSUC0_GSUWGMRR0_K1_LBSPPA512_LBSPPB512_LPA32_LPB32_LRVW16_MIWT6_2_SU16_SUM0_SUS256_SVW2_VWA2_VWB2_WG16_16_1_WGM8_WGMXCC8_WGMXCCG304
    SolutionIndex: 110
    SolutionNameMin: Cijk_Alik_Bljk_F8NHS_BH_BiasSH_HAS_SAB_SAV_UserArgs_MT96x128x256_MI16x16x1_SN_LDSB1_GRVWA16_GRVWB16_GSU1_GSUAMB_GSUC0_GSUWGMRR0_K1_LBSPPA512_LBSPPB512_LPA32_LPB32_LRVW16_MIWT6_2_NTD4_NEPBS16_SU16_SUM0_SUS256_SVW2_VWA2_VWB2_WG16_16_1_WGM6_WGMXCC8_WGMXCCG304
    SolutionIndex: 111
    SolutionNameMin: Cijk_Alik_Bljk_F8NHS_BH_BiasSH_HAS_SAB_SAV_UserArgs_MT96x128x256_MI16x16x1_SN_LDSB1_GRVWA16_GRVWB16_GSU1_GSUC0_GSUWGMRR0_K1_LBSPPA256_LBSPPB1024_LPA32_LPB32_LRVW16_MIWT3_4_SU16_SUM0_SUS256_SVW1_VWA1_VWB4_WG32_8_1_WGM8_WGMXCC8_WGMXCCG304
    SolutionIndex: 112
    SolutionNameMin: Cijk_Alik_Bljk_F8NHS_BH_BiasSH_HAS_SAB_SAV_UserArgs_MT96x96x128_MI16x16x1_SN_LDSB1_GRVWA16_GRVWB16_GSU1_GSUC0_GSUWGMRR0_K1_LBSPPA128_LBSPPB128_LPA32_LPB32_LRVW16_MIWT3_3_NTA0_NTB4_SU8_SUM0_SUS128_SVW1_VWA1_VWB1_WG32_8_1_WGM1_WGMXCC8_WGMXCCG304
    SolutionIndex: 113
    SolutionNameMin: Cijk_Alik_Bljk_F8NHS_BH_BiasSH_HAS_SAB_SAV_UserArgs_MT96x192x128_MI16x16x1_SN_LDSB1_GRVWA16_GRVWB16_GSU1_GSUC0_GSUWGMRR0_K1_LBSPPA256_LBSPPB128_LPA32_LPB32_LRVW16_MIWT6_3_SU16_SUM0_SUS128_SVW2_VWA2_VWB1_WG16_16_1_WGM8_WGMXCC8_WGMXCCG304
    SolutionIndex: 114
    SolutionNameMin: Cijk_Alik_Bljk_F8NHS_BH_BiasSH_HAS_SAB_SAV_UserArgs_MT96x96x256_MI16x16x1_SN_LDSB1_GRVWA16_GRVWB16_GSU1_GSUC0_GSUWGMRR0_K1_LBSPPA256_LBSPPB256_LPA32_LPB32_LRVW16_MIWT3_3_NTA0_NTB4_SU8_SUM0_SUS256_SVW1_VWA1_VWB1_WG32_8_1_WGM1_WGMXCC8_WGMXCCG304
    SolutionIndex: 115
    SolutionNameMin: Cijk_Alik_Bljk_F8NHS_BH_BiasSH_HAS_SAB_SAV_UserArgs_MT96x192x128_MI16x16x1_SN_LDSB1_GRVWA16_GRVWB16_GSU1_GSUAMB_GSUC0_GSUWGMRR0_K1_LBSPPA256_LBSPPB128_LPA32_LPB32_LRVW16_MIWT6_3_NTD4_NEPBS16_SU16_SUM0_SUS128_SVW2_VWA2_VWB1_WG16_16_1_WGM6_WGMXCC8_WGMXCCG304
    SolutionIndex: 116
    SolutionNameMin: Cijk_Alik_Bljk_F8NHS_BH_BiasSH_HAS_SAB_SAV_UserArgs_MT96x128x128_MI16x16x1_SN_LDSB1_GRVWA16_GRVWB16_GSU1_GSUC0_GSUWGMRR0_K1_LBSPPA256_LBSPPB256_LPA32_LPB32_LRVW16_MIWT6_2_SU16_SUM0_SUS128_SVW2_VWA2_VWB2_WG16_16_1_WGM8_WGMXCC8_WGMXCCG304
    SolutionIndex: 117
    SolutionNameMin: Cijk_Alik_Bljk_F8NHS_BH_BiasSH_HAS_SAB_SAV_UserArgs_MT96x256x128_MI16x16x1_SN_LDSB1_GRVWA16_GRVWB16_GSU1_GSUC0_GSUWGMRR0_K1_LBSPPA256_LBSPPB512_LPA32_LPB32_LRVW16_MIWT6_4_NTA0_NTB4_SU8_SUM0_SUS128_SVW2_VWA2_VWB4_WG16_16_1_WGM1_WGMXCC8_WGMXCCG304
    SolutionIndex: 118
    SolutionNameMin: Cijk_Alik_Bljk_F8NHS_BH_BiasSH_HAS_SAB_SAV_UserArgs_MT96x128x256_MI16x16x1_SN_LDSB1_GRVWA16_GRVWB16_GSU1_GSUAMB_GSUC0_GSUWGMRR0_K1_LBSPPA512_LBSPPB512_LPA32_LPB32_LRVW16_MIWT6_2_NTD4_NEPBS16_SU16_SUM0_SUS256_SVW2_VWA2_VWB2_WG16_16_1_WGM6_WGMXCC8_WGMXCCG304
    SolutionIndex: 119
    SolutionNameMin: Cijk_Alik_Bljk_F8NHS_BH_BiasSH_HAS_SAB_SAV_UserArgs_MT64x64x256_MI16x16x1_SN_LDSB1_GRVWA16_GRVWB16_GSU1_GSUC0_GSUWGMRR0_K1_LBSPPA1024_LBSPPB256_LPA32_LPB32_LRVW16_MIWT4_1_NTA4_NTB0_SU8_SUM0_SUS256_SVW4_VWA4_VWB1_WG16_16_1_WGM1_WGMXCC8_WGMXCCG304
    SolutionIndex: 120
    SolutionNameMin: Cijk_Alik_Bljk_F8NHS_BH_BiasSH_HAS_SAB_SAV_UserArgs_MT16x16x512_MI16x16x1_SN_LDSB1_GRVWA16_GRVWB16_GSU3_GSUAMBSK_GSUC0_GSUWGMRR0_K1_LBSPPA512_LBSPPB512_LPA32_LPB32_LRVW16_MIWT1_1_NTD0_NEPBS0_SU0_SUM0_SUS0_SVW1_VWA1_VWB1_WG16_4_4_WGM1_WGMXCC1_WGMXCCG0
    SolutionIndex: 121
    SolutionNameMin: Cijk_Alik_Bljk_F8NHS_BH_BiasSH_HAS_SAB_SAV_UserArgs_MT16x16x256_MI16x16x1_SN_LDSB0_GRVWA16_GRVWB16_GSU1_GSUC0_GSUWGMRR0_K1_LBSPPA256_LBSPPB256_LPA32_LPB32_LRVW16_MIWT1_1_SU16_SUM0_SUS256_SVW1_VWA1_VWB1_WG16_4_4_WGM8_WGMXCC8_WGMXCCG304
    SolutionIndex: 122
    SolutionNameMin: Cijk_Alik_Bljk_F8NHS_BH_BiasSH_HAS_SAB_SAV_UserArgs_MT32x32x512_MI16x16x1_SN_LDSB1_GRVWA16_GRVWB16_GSU3_GSUAMBSK_GSUC0_GSUWGMRR0_K1_LBSPPA512_LBSPPB512_LPA32_LPB32_LRVW16_MIWT1_1_NTD0_NEPBS0_SU0_SUM0_SUS0_SVW1_VWA1_VWB1_WG32_8_1_WGM1_WGMXCC1_WGMXCCG0
    SolutionIndex: 123
    SolutionNameMin: Cijk_Alik_Bljk_F8NHS_BH_BiasSH_HAS_SAB_SAV_UserArgs_MT64x32x512_MI16x16x1_SN_LDSB1_GRVWA16_GRVWB16_GSU3_GSUAMBSK_GSUC0_GSUWGMRR0_K1_LBSPPA1024_LBSPPB512_LPA32_LPB32_LRVW16_MIWT2_1_NTD0_NEPBS0_SU0_SUM0_SUS0_SVW2_VWA2_VWB1_WG32_8_1_WGM1_WGMXCC1_WGMXCCG0
    SolutionIndex: 124
    SolutionNameMin: Cijk_Alik_Bljk_F8NHS_BH_BiasSH_HAS_SAB_SAV_UserArgs_MT64x64x256_MI16x16x1_SN_LDSB1_GRVWA16_GRVWB16_GSU1_GSUC0_GSUWGMRR0_K1_LBSPPA512_LBSPPB512_LPA32_LPB32_LRVW16_MIWT2_2_NTA0_NTB4_SU8_SUM0_SUS256_SVW2_VWA2_VWB2_WG32_8_1_WGM1_WGMXCC8_WGMXCCG304
    SolutionIndex: 125
    SolutionNameMin: Cijk_Alik_Bljk_F8NHS_BH_BiasSH_HAS_SAB_SAV_UserArgs_MT64x64x256_MI16x16x1_SN_LDSB1_GRVWA16_GRVWB16_GSU1_GSUC0_GSUWGMRR0_K1_LBSPPA512_LBSPPB512_LPA32_LPB32_LRVW16_MIWT2_2_SU16_SUM0_SUS256_SVW2_VWA2_VWB2_WG32_8_1_WGM8_WGMXCC8_WGMXCCG304
    SolutionIndex: 126
    SolutionNameMin: Cijk_Alik_Bljk_F8NHS_BH_BiasSH_HAS_SAB_SAV_UserArgs_MT64x128x256_MI16x16x1_SN_LDSB1_GRVWA16_GRVWB16_GSU1_GSUC0_GSUWGMRR0_K1_LBSPPA1024_LBSPPB512_LPA32_LPB32_LRVW16_MIWT4_2_NTA0_NTB0_SU8_SUM0_SUS256_SVW4_VWA4_VWB2_WG16_16_1_WGM1_WGMXCC8_WGMXCCG304
    SolutionIndex: 127
    SolutionNameMin: Cijk_Alik_Bljk_F8NHS_BH_BiasSH_HAS_SAB_SAV_UserArgs_MT128x64x256_MI16x16x1_SN_LDSB1_GRVWA16_GRVWB16_GSU1_GSUC0_GSUWGMRR0_K1_LBSPPA512_LBSPPB1024_LPA32_LPB32_LRVW16_MIWT2_4_NTB4_SU16_SUM0_SUS256_SVW2_VWA2_VWB4_WG64_4_1_WGM8_WGMXCC8_WGMXCCG304
    SolutionIndex: 128
    SolutionNameMin: Cijk_Alik_Bljk_F8NHS_BH_BiasSH_HAS_SAB_SAV_UserArgs_MT64x128x256_MI16x16x1_SN_LDSB1_GRVWA16_GRVWB16_GSU1_GSUC0_GSUWGMRR0_K1_LBSPPA1024_LBSPPB512_LPA32_LPB32_LRVW16_MIWT4_2_SU16_SUM0_SUS256_SVW4_VWA4_VWB2_WG16_16_1_WGM8_WGMXCC8_WGMXCCG304
    SolutionIndex: 129
    SolutionNameMin: Cijk_Alik_Bljk_F8NHS_BH_BiasSH_HAS_SAB_SAV_UserArgs_MT64x192x128_MI16x16x1_SN_LDSB1_GRVWA16_GRVWB16_GSU1_GSUC0_GSUWGMRR0_K1_LBSPPA512_LBSPPB128_LPA32_LPB32_LRVW16_MIWT4_3_NTA0_NTB4_SU8_SUM0_SUS128_SVW4_VWA4_VWB1_WG16_16_1_WGM1_WGMXCC8_WGMXCCG304
    SolutionIndex: 130
    SolutionNameMin: Cijk_Alik_Bljk_F8NHS_BH_BiasSH_HAS_SAB_SAV_UserArgs_MT128x96x256_MI16x16x1_SN_LDSB1_GRVWA16_GRVWB16_GSU1_GSUC0_GSUWGMRR0_K1_LBSPPA1024_LBSPPB256_LPA32_LPB32_LRVW16_MIWT4_3_SU16_SUM0_SUS256_SVW4_VWA4_VWB1_WG32_8_1_WGM8_WGMXCC8_WGMXCCG304
    SolutionIndex: 131
    SolutionNameMin: Cijk_Alik_Bljk_F8NHS_BH_BiasSH_HAS_SAB_SAV_UserArgs_MT128x96x256_MI16x16x1_SN_LDSB1_GRVWA16_GRVWB16_GSU1_GSUAMB_GSUC0_GSUWGMRR0_K1_LBSPPA1024_LBSPPB256_LPA32_LPB32_LRVW16_MIWT4_3_NTB4_NTD4_NEPBS16_SU16_SUM0_SUS256_SVW4_VWA4_VWB1_WG32_8_1_WGM6_WGMXCC8_WGMXCCG304
    SolutionIndex: 132
    SolutionNameMin: Cijk_Alik_Bljk_F8NHS_BH_BiasSH_HAS_SAB_SAV_UserArgs_MT128x96x256_MI16x16x1_SN_LDSB1_GRVWA16_GRVWB16_GSU1_GSUAMB_GSUC0_GSUWGMRR0_K1_LBSPPA1024_LBSPPB256_LPA32_LPB32_LRVW16_MIWT4_3_NTD4_NEPBS16_SU16_SUM0_SUS256_SVW4_VWA4_VWB1_WG32_8_1_WGM6_WGMXCC8_WGMXCCG304
    SolutionIndex: 133
    SolutionNameMin: Cijk_Alik_Bljk_F8NHS_BH_BiasSH_HAS_SAB_SAV_UserArgs_MT128x64x128_MI16x16x1_SN_LDSB1_GRVWA16_GRVWB16_GSU1_GSUC0_GSUWGMRR0_K1_LBSPPA256_LBSPPB512_LPA32_LPB32_LRVW16_MIWT2_4_SU16_SUM0_SUS128_SVW2_VWA2_VWB4_WG64_4_1_WGM8_WGMXCC8_WGMXCCG304
    SolutionIndex: 134
    SolutionNameMin: Cijk_Alik_Bljk_F8NHS_BH_BiasSH_HAS_SAB_SAV_UserArgs_MT128x128x128_MI16x16x1_SN_LDSB1_GRVWA16_GRVWB16_GSU1_GSUAMB_GSUC0_GSUWGMRR0_K1_LBSPPA512_LBSPPB512_LPA32_LPB32_LRVW16_MIWT4_4_NTD4_NEPBS16_SU16_SUM0_SUS128_SVW4_VWA4_VWB4_WG32_8_1_WGM6_WGMXCC8_WGMXCCG304
    SolutionIndex: 135
    SolutionNameMin: Cijk_Alik_Bljk_F8NHS_BH_BiasSH_HAS_SAB_SAV_UserArgs_MT128x112x256_MI16x16x1_SN_LDSB1_GRVWA8_GRVWB8_GSU1_GSUAMB_GSUC0_GSUWGMRR0_K1_LBSPPA512_LBSPPB256_LPA8_LPB8_LRVW8_MIWT2_7_NTD4_NEPBS16_SU16_SUM0_SUS256_SVW2_VWA2_VWB1_WG64_4_1_WGM6_WGMXCC8_WGMXCCG304
    SolutionIndex: 136
    SolutionNameMin: Cijk_Alik_Bljk_F8NHS_BH_BiasSH_HAS_SAB_SAV_UserArgs_MT128x128x128_MI16x16x1_SN_LDSB1_GRVWA16_GRVWB16_GSU1_GSUAMB_GSUC0_GSUWGMRR0_K1_LBSPPA1024_LBSPPB256_LPA32_LPB32_LRVW16_MIWT8_2_NTB4_NTD4_NEPBS16_SU16_SUM0_SUS128_SVW8_VWA8_VWB2_WG16_16_1_WGM6_WGMXCC8_WGMXCCG304
    SolutionIndex: 137
    SolutionNameMin: Cijk_Alik_Bljk_F8NHS_BH_BiasSH_HAS_SAB_SAV_UserArgs_MT128x96x128_MI16x16x1_SN_LDSB1_GRVWA16_GRVWB16_GSU1_GSUC0_GSUWGMRR0_K1_LBSPPA512_LBSPPB128_LPA32_LPB32_LRVW16_MIWT4_3_NTA0_NTB4_SU8_SUM0_SUS128_SVW4_VWA4_VWB1_WG32_8_1_WGM1_WGMXCC8_WGMXCCG304
    SolutionIndex: 138
    SolutionNameMin: Cijk_Alik_Bljk_F8NHS_BH_BiasSH_HAS_SAB_SAV_UserArgs_MT128x192x128_MI16x16x1_SN_LDSB1_GRVWA16_GRVWB16_GSU1_GSUAMB_GSUC0_GSUWGMRR0_K1_LBSPPA1024_LBSPPB128_LPA32_LPB32_LRVW16_MIWT8_3_NTD4_NEPBS16_SU16_SUM0_SUS128_SVW8_VWA8_VWB1_WG16_16_1_WGM6_WGMXCC8_WGMXCCG304
    SolutionIndex: 139
    SolutionNameMin: Cijk_Alik_Bljk_F8NHS_BH_BiasSH_HAS_SAB_SAV_UserArgs_MT128x192x128_MI16x16x1_SN_LDSB1_GRVWA16_GRVWB16_GSU1_GSUAMB_GSUC0_GSUWGMRR0_K1_LBSPPA1024_LBSPPB128_LPA32_LPB32_LRVW16_MIWT8_3_NTB4_NTD4_NEPBS16_SU16_SUM0_SUS128_SVW8_VWA8_VWB1_WG16_16_1_WGM6_WGMXCC8_WGMXCCG304
    SolutionIndex: 140
    SolutionNameMin: Cijk_Alik_Bljk_F8NHS_BH_BiasSH_HAS_SAB_SAV_UserArgs_MT128x128x64_MI16x16x1_SN_LDSB1_GRVWA8_GRVWB8_GSU1_GSUC0_GSUWGMRR0_K1_LBSPPA256_LBSPPB256_LPA8_LPB8_LRVW8_MIWT4_4_NTA0_NTB0_SU8_SUM0_SUS64_SVW4_VWA4_VWB4_WG32_8_1_WGM1_WGMXCC8_WGMXCCG304
    SolutionIndex: 141
    SolutionNameMin: Cijk_Alik_Bljk_F8NHS_BH_BiasSH_HAS_SAB_SAV_UserArgs_MT128x256x128_MI16x16x1_SN_LDSB1_GRVWA16_GRVWB16_GSU1_GSUAMB_GSUC0_GSUWGMRR0_K1_LBSPPA1024_LBSPPB512_LPA32_LPB32_LRVW16_MIWT8_4_NTD4_NEPBS16_SU16_SUM0_SUS128_SVW8_VWA8_VWB4_WG16_16_1_WGM6_WGMXCC8_WGMXCCG304
    SolutionIndex: 142
    SolutionNameMin: Cijk_Alik_Bljk_F8NHS_BH_BiasSH_HAS_SAB_SAV_UserArgs_MT128x224x128_MI16x16x1_SN_LDSB1_GRVWA16_GRVWB16_GSU1_GSUAMB_GSUC0_GSUWGMRR0_K1_LBSPPA512_LBSPPB128_LPA32_LPB32_LRVW16_MIWT4_7_NTD4_NEPBS16_SU16_SUM0_SUS128_SVW4_VWA4_VWB1_WG32_8_1_WGM6_WGMXCC8_WGMXCCG304
    SolutionIndex: 143
    SolutionNameMin: Cijk_Alik_Bljk_F8NHS_BH_BiasSH_HAS_SAB_SAV_UserArgs_MT128x224x128_MI16x16x1_SN_LDSB1_GRVWA16_GRVWB16_GSU1_GSUAMB_GSUC0_GSUWGMRR0_K1_LBSPPA512_LBSPPB128_LPA32_LPB32_LRVW16_MIWT4_7_NTB4_NTD4_NEPBS16_SU16_SUM0_SUS128_SVW4_VWA4_VWB1_WG32_8_1_WGM6_WGMXCC8_WGMXCCG304
    SolutionIndex: 144
    SolutionNameMin: Cijk_Alik_Bljk_F8NHS_BH_BiasSH_HAS_SAB_SAV_UserArgs_MT16x16x512_MI16x16x1_SN_LDSB1_GRVWA16_GRVWB16_GSU1_GSUC0_GSUWGMRR0_K1_LBSPPA512_LBSPPB512_LPA32_LPB32_LRVW16_MIWT1_1_NTA4_NTB0_SU8_SUM0_SUS512_SVW1_VWA1_VWB1_WG16_4_4_WGM1_WGMXCC8_WGMXCCG304
    SolutionIndex: 145
    SolutionNameMin: Cijk_Alik_Bljk_F8NHS_BH_BiasSH_HAS_SAB_SAV_UserArgs_MT16x64x256_MI16x16x1_SN_LDSB0_GRVWA16_GRVWB16_GSU1_LBSPPA256_LBSPPB256_LPA32_LPB32_LRVW16_MIWT1_1_NEPBS0_SU0_SUM0_SUS0_SVW1_VWA1_WG16_16_1_WGM1
    SolutionIndex: 146
    SolutionNameMin: Cijk_Alik_Bljk_F8NHS_BH_BiasSH_HAS_SAB_SAV_UserArgs_MT32x32x512_MI16x16x1_SN_LDSB1_GRVWA16_GRVWB16_GSU1_GSUC0_GSUWGMRR0_K1_LBSPPA512_LBSPPB512_LPA32_LPB32_LRVW16_MIWT1_1_NTA0_NTB0_SU8_SUM0_SUS512_SVW1_VWA1_VWB1_WG32_8_1_WGM1_WGMXCC8_WGMXCCG304
    SolutionIndex: 147
    SolutionNameMin: Cijk_Alik_Bljk_F8NHS_BH_BiasSH_HAS_SAB_SAV_UserArgs_MT32x64x256_MI16x16x1_SN_LDSB1_GRVWA16_GRVWB16_GSU1_GSUC0_GSUWGMRR0_K1_LBSPPA256_LBSPPB512_LPA32_LPB32_LRVW16_MIWT1_2_NTA0_NTB4_SU8_SUM0_SUS256_SVW1_VWA1_VWB2_WG32_8_1_WGM1_WGMXCC8_WGMXCCG304
    SolutionIndex: 148
    SolutionNameMin: Cijk_Alik_Bljk_F8NHS_BH_BiasSH_HAS_SAB_SAV_UserArgs_MT64x64x256_MI16x16x1_SN_LDSB1_GRVWA16_GRVWB16_GSU3_GSUAMBSK_GSUC0_GSUWGMRR0_K1_LBSPPA1024_LBSPPB256_LPA32_LPB32_LRVW16_MIWT4_1_NTD0_NEPBS0_SU0_SUM0_SUS0_SVW4_VWA4_VWB1_WG16_16_1_WGM1_WGMXCC1_WGMXCCG0
    SolutionIndex: 149
    SolutionNameMin: Cijk_Alik_Bljk_F8NHS_BH_BiasSH_HAS_SAB_SAV_UserArgs_MT64x128x256_MI16x16x1_SN_LDSB1_GRVWA16_GRVWB16_GSU3_GSUAMBSK_GSUC0_GSUWGMRR0_K1_LBSPPA1024_LBSPPB512_LPA32_LPB32_LRVW16_MIWT4_2_NTD0_NEPBS0_SU0_SUM0_SUS0_SVW4_VWA4_VWB2_WG16_16_1_WGM1_WGMXCC1_WGMXCCG0
    SolutionIndex: 150
    SolutionNameMin: Cijk_Alik_Bljk_F8NHS_BH_BiasSH_HAS_SAB_SAV_UserArgs_MT96x64x256_MI16x16x1_SN_LDSB1_GRVWA16_GRVWB16_GSU1_GSUC0_GSUWGMRR0_K1_LBSPPA256_LBSPPB512_LPA32_LPB32_LRVW16_MIWT3_2_SU16_SUM0_SUS256_SVW1_VWA1_VWB2_WG32_8_1_WGM8_WGMXCC8_WGMXCCG304
    SolutionIndex: 151
    SolutionNameMin: Cijk_Alik_Bljk_F8NHS_BH_BiasSH_HAS_SAB_SAV_UserArgs_MT96x64x256_MI16x16x1_SN_LDSB1_GRVWA16_GRVWB16_GSU1_GSUAMB_GSUC0_GSUWGMRR0_K1_LBSPPA256_LBSPPB512_LPA32_LPB32_LRVW16_MIWT3_2_NTD4_NEPBS16_SU16_SUM0_SUS256_SVW1_VWA1_VWB2_WG32_8_1_WGM6_WGMXCC8_WGMXCCG304
    SolutionIndex: 152
    SolutionNameMin: Cijk_Alik_Bljk_F8NHS_BH_BiasSH_HAS_SAB_SAV_UserArgs_MT96x128x256_MI16x16x1_SN_LDSB1_GRVWA16_GRVWB16_GSU1_GSUC0_GSUWGMRR0_K1_LBSPPA512_LBSPPB512_LPA32_LPB32_LRVW16_MIWT6_2_SU16_SUM0_SUS256_SVW2_VWA2_VWB2_WG16_16_1_WGM8_WGMXCC8_WGMXCCG304
    SolutionIndex: 153
    SolutionNameMin: Cijk_Alik_Bljk_F8NHS_BH_BiasSH_HAS_SAB_SAV_UserArgs_MT96x128x256_MI16x16x1_SN_LDSB1_GRVWA16_GRVWB16_GSU1_GSUAMB_GSUC0_GSUWGMRR0_K1_LBSPPA256_LBSPPB1024_LPA32_LPB32_LRVW16_MIWT3_4_NTD4_NEPBS16_SU16_SUM0_SUS256_SVW1_VWA1_VWB4_WG32_8_1_WGM6_WGMXCC8_WGMXCCG304
    SolutionIndex: 154
    SolutionNameMin: Cijk_Alik_Bljk_F8NHS_BH_BiasSH_HAS_SAB_SAV_UserArgs_MT192x96x128_MI16x16x1_SN_LDSB1_GRVWA16_GRVWB16_GSU1_GSUAMB_GSUC0_GSUWGMRR0_K1_LBSPPA256_LBSPPB128_LPA32_LPB32_LRVW16_MIWT6_3_NTD4_NEPBS16_SU16_SUM0_SUS128_SVW2_VWA2_VWB1_WG32_8_1_WGM6_WGMXCC8_WGMXCCG304
    SolutionIndex: 155
    SolutionNameMin: Cijk_Alik_Bljk_F8NHS_BH_BiasSH_HAS_SAB_SAV_UserArgs_MT192x96x128_MI16x16x1_SN_LDSB1_GRVWA16_GRVWB16_GSU1_GSUAMB_GSUC0_GSUWGMRR0_K1_LBSPPA256_LBSPPB128_LPA32_LPB32_LRVW16_MIWT6_3_NTD4_NEPBS16_SU16_SUM0_SUS128_SVW2_VWA2_VWB1_WG32_8_1_WGM6_WGMXCC8_WGMXCCG304
    SolutionIndex: 156
    SolutionNameMin: Cijk_Alik_Bljk_F8NHS_BH_BiasSH_HAS_SAB_SAV_UserArgs_MT192x128x128_MI16x16x1_SN_LDSB1_GRVWA16_GRVWB16_GSU1_GSUAMB_GSUC0_GSUWGMRR0_K1_LBSPPA512_LBSPPB256_LPA32_LPB32_LRVW16_MIWT12_2_NTD4_NEPBS16_SU16_SUM0_SUS128_SVW4_VWA4_VWB2_WG16_16_1_WGM6_WGMXCC8_WGMXCCG304
    SolutionIndex: 157
    SolutionNameMin: Cijk_Alik_Bljk_F8NHS_BH_BiasSH_HAS_SAB_SAV_UserArgs_MT192x128x128_MI16x16x1_SN_LDSB1_GRVWA16_GRVWB16_GSU1_GSUC0_GSUWGMRR0_K1_LBSPPA512_LBSPPB256_LPA32_LPB32_LRVW16_MIWT12_2_NTA0_NTB4_SU8_SUM0_SUS128_SVW4_VWA4_VWB2_WG16_16_1_WGM1_WGMXCC8_WGMXCCG304
    SolutionIndex: 158
    SolutionNameMin: Cijk_Alik_Bljk_F8NHS_BH_BiasSH_HAS_SAB_SAV_UserArgs_MT192x128x128_MI16x16x1_SN_LDSB1_GRVWA16_GRVWB16_GSU1_GSUAMB_GSUC0_GSUWGMRR0_K1_LBSPPA128_LBSPPB1024_LPA32_LPB32_LRVW16_MIWT3_8_NTB4_NTD4_NEPBS16_SU16_SUM0_SUS128_SVW1_VWA1_VWB8_WG64_4_1_WGM6_WGMXCC8_WGMXCCG304
    SolutionIndex: 159
    SolutionNameMin: Cijk_Alik_Bljk_F8NHS_BH_BiasSH_HAS_SAB_SAV_UserArgs_MT192x192x128_MI16x16x1_SN_LDSB1_GRVWA16_GRVWB16_GSU1_GSUC0_GSUWGMRR0_K1_LBSPPA512_LBSPPB128_LPA32_LPB32_LRVW16_MIWT12_3_NTA0_NTB4_SU8_SUM0_SUS128_SVW4_VWA4_VWB1_WG16_16_1_WGM1_WGMXCC8_WGMXCCG304
    SolutionIndex: 160
    SolutionNameMin: Cijk_Alik_Bljk_F8NHS_BH_BiasSH_HAS_SAB_SAV_UserArgs_MT192x192x128_MI16x16x1_SN_LDSB1_GRVWA16_GRVWB16_GSU1_GSUC0_GSUWGMRR0_K1_LBSPPA512_LBSPPB128_LPA32_LPB32_LRVW16_MIWT12_3_SU16_SUM0_SUS128_SVW4_VWA4_VWB1_WG16_16_1_WGM8_WGMXCC8_WGMXCCG304
    SolutionIndex: 161
    SolutionNameMin: Cijk_Alik_Bljk_F8NHS_BH_BiasSH_HAS_SAB_SAV_UserArgs_MT192x192x128_MI16x16x1_SN_LDSB1_GRVWA16_GRVWB16_GSU1_GSUAMB_GSUC0_GSUWGMRR0_K1_LBSPPA256_LBSPPB256_LPA32_LPB32_LRVW16_MIWT6_6_NTD4_NEPBS16_SU16_SUM0_SUS128_SVW2_VWA2_VWB2_WG32_8_1_WGM6_WGMXCC8_WGMXCCG304
    SolutionIndex: 162
    SolutionNameMin: Cijk_Alik_Bljk_F8NHS_BH_BiasSH_HAS_SAB_SAV_UserArgs_MT192x192x128_MI16x16x1_SN_LDSB1_GRVWA16_GRVWB16_GSU1_GSUAMB_GSUC0_GSUWGMRR0_K1_LBSPPA512_LBSPPB128_LPA32_LPB32_LRVW16_MIWT12_3_NTD4_NEPBS16_SU16_SUM0_SUS128_SVW4_VWA4_VWB1_WG16_16_1_WGM6_WGMXCC8_WGMXCCG304
    SolutionIndex: 163
    SolutionNameMin: Cijk_Alik_Bljk_F8NHS_BH_BiasSH_HAS_SAB_SAV_UserArgs_MT192x128x64_MI16x16x1_SN_LDSB1_GRVWA8_GRVWB8_GSU1_GSUC0_GSUWGMRR0_K1_LBSPPA256_LBSPPB128_LPA8_LPB8_LRVW8_MIWT12_2_NTB0_SU8_SUM1_SUS64_SVW4_VWA4_VWB2_WG16_16_1_WGM6_WGMXCC8_WGMXCCG304
    SolutionIndex: 164
    SolutionNameMin: Cijk_Alik_Bljk_F8NHS_BH_BiasSH_HAS_SAB_SAV_UserArgs_MT192x224x128_MI16x16x1_SN_LDSB1_GRVWA16_GRVWB16_GSU1_GSUC0_GSUWGMRR0_K1_LBSPPA256_LBSPPB128_LPA32_LPB32_LRVW16_MIWT6_7_NTA0_NTB4_SU8_SUM0_SUS128_SVW2_VWA2_VWB1_WG32_8_1_WGM1_WGMXCC8_WGMXCCG304
    SolutionIndex: 165
    SolutionNameMin: Cijk_Alik_Bljk_F8NHS_BH_BiasSH_HAS_SAB_SAV_UserArgs_MT192x256x128_MI16x16x1_SN_CLR1_GRVWA16_GRVWB16_GSU1_GSUC0_GSUWGMRR0_K1_LBSPPA512_LBSPPB256_LPA32_LPB32_LRVW16_MIAV0_MIWT12_4_NTC4_NTD4_SU8_SUM0_SUS256_SPO1_SSO4_SVW4_TLDS2_VWA4_VWB2_WG16_16_1_WGM16_WGMXCC1_WGMXCCGn1
    SolutionIndex: 166
    SolutionNameMin: Cijk_Alik_Bljk_F8NHS_BH_BiasSH_HAS_SAB_SAV_UserArgs_MT16x16x512_MI16x16x1_SN_LDSB1_GRVWA16_GRVWB16_GSU4_GSUAMBSK_GSUC0_GSUWGMRR0_K1_LBSPPA512_LBSPPB512_LPA32_LPB32_LRVW16_MIWT1_1_NTD0_NEPBS0_SU0_SUM0_SUS0_SVW1_VWA1_VWB1_WG16_4_4_WGM1_WGMXCC1_WGMXCCG0
    SolutionIndex: 167
    SolutionNameMin: Cijk_Alik_Bljk_F8NHS_BH_BiasSH_HAS_SAB_SAV_UserArgs_MT64x64x256_MI16x16x1_SN_LDSB1_GRVWA16_GRVWB16_GSU1_GSUAMB_GSUC0_GSUWGMRR0_K1_LBSPPA512_LBSPPB512_LPA32_LPB32_LRVW16_MIWT2_2_NTD4_NEPBS16_SU16_SUM0_SUS256_SVW2_VWA2_VWB2_WG32_8_1_WGM6_WGMXCC8_WGMXCCG304
    SolutionIndex: 168
    SolutionNameMin: Cijk_Alik_Bljk_F8NHS_BH_BiasSH_HAS_SAB_SAV_UserArgs_MT128x64x256_MI16x16x1_SN_LDSB1_GRVWA16_GRVWB16_GSU1_GSUC0_GSUWGMRR0_K1_LBSPPA1024_LBSPPB512_LPA32_LPB32_LRVW16_MIWT4_2_NTA0_NTB4_SU8_SUM0_SUS256_SVW4_VWA4_VWB2_WG32_8_1_WGM1_WGMXCC8_WGMXCCG304
    SolutionIndex: 169
    SolutionNameMin: Cijk_Alik_Bljk_F8NHS_BH_BiasSH_HAS_SAB_SAV_UserArgs_MT128x64x256_MI16x16x1_SN_LDSB1_GRVWA16_GRVWB16_GSU1_GSUC0_GSUWGMRR0_K1_LBSPPA1024_LBSPPB512_LPA32_LPB32_LRVW16_MIWT4_2_NTB4_SU16_SUM0_SUS256_SVW4_VWA4_VWB2_WG32_8_1_WGM8_WGMXCC8_WGMXCCG304
    SolutionIndex: 170
    SolutionNameMin: Cijk_Alik_Bljk_F8NHS_BH_BiasSH_HAS_SAB_SAV_UserArgs_MT64x128x256_MI16x16x1_SN_LDSB1_GRVWA16_GRVWB16_GSU1_GSUC0_GSUWGMRR0_K1_LBSPPA512_LBSPPB1024_LPA32_LPB32_LRVW16_MIWT2_4_NTA0_NTB4_SU8_SUM0_SUS256_SVW2_VWA2_VWB4_WG32_8_1_WGM1_WGMXCC8_WGMXCCG304
    SolutionIndex: 171
    SolutionNameMin: Cijk_Alik_Bljk_F8NHS_BH_BiasSH_HAS_SAB_SAV_UserArgs_MT128x64x128_MI16x16x1_SN_LDSB1_GRVWA16_GRVWB16_GSU1_GSUC0_GSUWGMRR0_K1_LBSPPA512_LBSPPB256_LPA32_LPB32_LRVW16_MIWT4_2_SU16_SUM0_SUS128_SVW4_VWA4_VWB2_WG32_8_1_WGM8_WGMXCC8_WGMXCCG304
    SolutionIndex: 172
    SolutionNameMin: Cijk_Alik_Bljk_F8NHS_BH_BiasSH_HAS_SAB_SAV_UserArgs_MT128x128x128_MI16x16x1_SN_LDSB1_GRVWA16_GRVWB16_GSU1_GSUC0_GSUWGMRR0_K1_LBSPPA1024_LBSPPB256_LPA32_LPB32_LRVW16_MIWT8_2_NTA0_NTB0_SU8_SUM0_SUS128_SVW8_VWA8_VWB2_WG16_16_1_WGM1_WGMXCC8_WGMXCCG304
    SolutionIndex: 173
    SolutionNameMin: Cijk_Alik_Bljk_F8NHS_BH_Bias_HAS_SAV_UserArgs_MT128x128x128_MI16x16x1_SN_CLR1_GRVWA16_GRVWB16_GSU1_GSUC0_GSUWGMRR0_K1_LBSPPA512_LBSPPB256_LPA32_LPB32_LRVW16_MIAV1_MIWT8_2_NTC4_NTD4_SU8_SUM0_SUS256_SPO1_SSO4_SVW4_TLDS1_VWA4_VWB2_WG16_16_1_WGM32_WGMXCC1_WGMXCCGn1
    SolutionIndex: 174
    SolutionNameMin: Cijk_Alik_Bljk_F8NHS_BH_BiasSH_HAS_SAB_SAV_UserArgs_MT128x128x128_MI16x16x1_SN_LDSB1_GRVWA16_GRVWB16_GSU1_GSUC0_GSUWGMRR0_K1_LBSPPA512_LBSPPB512_LPA32_LPB32_LRVW16_MIWT4_4_NTB4_SU16_SUM0_SUS128_SVW4_VWA4_VWB4_WG32_8_1_WGM8_WGMXCC8_WGMXCCG304
    SolutionIndex: 175
    SolutionNameMin: Cijk_Alik_Bljk_F8NHS_BH_BiasSH_HAS_SAB_SAV_UserArgs_MT128x96x128_MI16x16x1_SN_LDSB1_GRVWA16_GRVWB16_GSU1_GSUC0_GSUWGMRR0_K1_LBSPPA512_LBSPPB128_LPA32_LPB32_LRVW16_MIWT4_3_NTA0_NTB0_SU8_SUM0_SUS128_SVW4_VWA4_VWB1_WG32_8_1_WGM1_WGMXCC8_WGMXCCG304
    SolutionIndex: 176
    SolutionNameMin: Cijk_Alik_Bljk_F8NHS_BH_BiasSH_HAS_SAB_SAV_UserArgs_MT256x96x128_MI16x16x1_SN_LDSB1_GRVWA16_GRVWB16_GSU1_GSUC0_GSUWGMRR0_K1_LBSPPA512_LBSPPB256_LPA32_LPB32_LRVW16_MIWT4_6_SU16_SUM0_SUS128_SVW4_VWA4_VWB2_WG64_4_1_WGM8_WGMXCC8_WGMXCCG304
    SolutionIndex: 177
    SolutionNameMin: Cijk_Alik_Bljk_F8NHS_BH_BiasSH_HAS_SAB_SAV_UserArgs_MT256x96x128_MI16x16x1_SN_LDSB1_GRVWA16_GRVWB16_GSU1_GSUC0_GSUWGMRR0_K1_LBSPPA1024_LBSPPB128_LPA32_LPB32_LRVW16_MIWT8_3_SU16_SUM0_SUS128_SVW8_VWA8_VWB1_WG32_8_1_WGM8_WGMXCC8_WGMXCCG304
    SolutionIndex: 178
    SolutionNameMin: Cijk_Alik_Bljk_F8NHS_BH_BiasSH_HAS_SAB_SAV_UserArgs_MT256x96x128_MI16x16x1_SN_LDSB1_GRVWA16_GRVWB16_GSU1_GSUC0_GSUWGMRR0_K1_LBSPPA512_LBSPPB256_LPA32_LPB32_LRVW16_MIWT4_6_NTB4_SU16_SUM0_SUS128_SVW4_VWA4_VWB2_WG64_4_1_WGM8_WGMXCC8_WGMXCCG304
    SolutionIndex: 179
    SolutionNameMin: Cijk_Alik_Bljk_F8NHS_BH_BiasSH_HAS_SAB_SAV_UserArgs_MT256x112x128_MI16x16x1_SN_LDSB1_GRVWA16_GRVWB8_GSU1_GSUC0_GSUWGMRR0_K1_LBSPPA512_LBSPPB128_LPA32_LPB32_LRVW16_MIWT4_7_NTA0_NTB4_SU8_SUM0_SUS128_SVW4_VWA4_VWB1_WG64_4_1_WGM1_WGMXCC8_WGMXCCG304
    SolutionIndex: 180
    SolutionNameMin: Cijk_Alik_Bljk_F8NHS_BH_BiasSH_HAS_SAB_SAV_UserArgs_MT256x128x128_MI16x16x1_SN_LDSB1_GRVWA16_GRVWB16_GSU1_GSUC0_GSUWGMRR0_K1_LBSPPA512_LBSPPB1024_LPA32_LPB32_LRVW16_MIWT4_8_SU16_SUM0_SUS128_SVW4_VWA4_VWB8_WG64_4_1_WGM8_WGMXCC8_WGMXCCG304
    SolutionIndex: 181
    SolutionNameMin: Cijk_Alik_Bljk_F8NHS_BH_BiasSH_HAS_SAB_SAV_UserArgs_MT256x112x128_MI16x16x1_SN_LDSB1_GRVWA16_GRVWB8_GSU1_GSUC0_GSUWGMRR0_K1_LBSPPA512_LBSPPB128_LPA32_LPB32_LRVW16_MIWT4_7_NTB4_SU16_SUM0_SUS128_SVW4_VWA4_VWB1_WG64_4_1_WGM8_WGMXCC8_WGMXCCG304
    SolutionIndex: 182
    SolutionNameMin: Cijk_Alik_Bljk_F8NHS_BH_BiasSH_HAS_SAB_SAV_UserArgs_MT128x192x64_MI16x16x1_SN_LDSB1_GRVWA8_GRVWB8_GSU1_GSUC0_GSUWGMRR0_K1_LBSPPA512_LBSPPB128_LPA8_LPB8_LRVW8_MIWT8_3_SU8_SUM1_SUS64_SVW8_VWA8_VWB1_WG16_16_1_WGM6_WGMXCC8_WGMXCCG304
    SolutionIndex: 183
    SolutionNameMin: Cijk_Alik_Bljk_F8NHS_BH_BiasSH_HAS_SAB_SAV_UserArgs_MT256x192x128_MI16x16x1_SN_LDSB1_GRVWA16_GRVWB16_GSU1_GSUC0_GSUWGMRR0_K1_LBSPPA512_LBSPPB512_LPA32_LPB32_LRVW16_MIWT4_12_NTA0_NTB4_SU8_SUM0_SUS128_SVW4_VWA4_VWB4_WG64_4_1_WGM1_WGMXCC8_WGMXCCG304
    SolutionIndex: 184
    SolutionNameMin: Cijk_Alik_Bljk_F8NHS_BH_BiasSH_HAS_SAB_SAV_UserArgs_MT256x192x128_MI16x16x1_SN_LDSB1_GRVWA16_GRVWB16_GSU1_GSUAMB_GSUC0_GSUWGMRR0_K1_LBSPPA1024_LBSPPB256_LPA32_LPB32_LRVW16_MIWT8_6_NTD4_NEPBS16_SU16_SUM0_SUS128_SVW8_VWA8_VWB2_WG32_8_1_WGM6_WGMXCC8_WGMXCCG304
    SolutionIndex: 185
    SolutionNameMin: Cijk_Alik_Bljk_F8NHS_BH_BiasSH_HAS_SAB_SAV_UserArgs_MT256x192x128_MI16x16x1_SN_LDSB1_GRVWA16_GRVWB16_GSU1_GSUC0_GSUWGMRR0_K1_LBSPPA1024_LBSPPB256_LPA32_LPB32_LRVW16_MIWT8_6_SU16_SUM0_SUS128_SVW8_VWA8_VWB2_WG32_8_1_WGM8_WGMXCC8_WGMXCCG304
    SolutionIndex: 186
    SolutionNameMin: Cijk_Alik_Bljk_F8NHS_BH_BiasSH_HAS_SAB_SAV_UserArgs_MT256x224x128_MI16x16x1_SN_LDSB1_GRVWA8_GRVWB8_GSU1_GSUAMB_GSUC0_GSUWGMRR0_K1_LBSPPA1024_LBSPPB128_LPA8_LPB8_LRVW8_MIWT8_7_NTB4_NTD4_NEPBS16_SU16_SUM0_SUS128_SVW8_VWA8_VWB1_WG32_8_1_WGM6_WGMXCC8_WGMXCCG304
    SolutionIndex: 187
    SolutionNameMin: Cijk_Alik_Bljk_F8NHS_BH_BiasSH_HAS_SAB_SAV_UserArgs_MT256x224x128_MI16x16x1_SN_LDSB1_GRVWA8_GRVWB8_GSU1_GSUAMB_GSUC0_GSUWGMRR0_K1_LBSPPA1024_LBSPPB128_LPA8_LPB8_LRVW8_MIWT8_7_NTD4_NEPBS16_SU16_SUM0_SUS128_SVW8_VWA8_VWB1_WG32_8_1_WGM6_WGMXCC8_WGMXCCG304
    SolutionIndex: 188
    SolutionNameMin: Cijk_Alik_Bljk_F8NHS_BH_BiasSH_HAS_SAB_SAV_UserArgs_MT256x224x128_MI16x16x1_SN_GRVWA4_GRVWB4_GSU1_GSUC0_GSUWGMRR0_K1_LBSPPA512_LBSPPB128_LPA8_LPB8_LRVW8_MIWT8_7_NTA0_NTB0_NTC4_NTD4_SU8_SUM0_SUS256_SPO1_SSO0_SVW4_VWA4_VWB1_WG32_8_1_WGM0_WGMXCC1_WGMXCCGn1
    SolutionIndex: 189
    SolutionNameMin: Cijk_Alik_Bljk_F8NHS_BH_Bias_HAS_SAV_UserArgs_MT256x224x128_MI16x16x1_SN_GRVWA4_GRVWB4_GSU1_GSUC0_GSUWGMRR0_K1_LBSPPA1024_LBSPPB128_LPA8_LPB8_LRVW8_MIWT8_7_NTC4_NTD4_SU8_SUM0_SUS256_SPO0_SSO4_SVW8_VWA8_VWB1_WG32_8_1_WGMn1_WGMXCC1_WGMXCCGn1
    SolutionIndex: 190
    SolutionNameMin: Cijk_Alik_Bljk_F8NHS_BH_BiasSH_HAS_SAB_SAV_UserArgs_MT16x16x256_MI16x16x1_SN_LDSB0_GRVWA16_GRVWB16_GSU1_GSUAMB_GSUC0_GSUWGMRR0_K1_LBSPPA256_LBSPPB256_LPA32_LPB32_LRVW16_MIWT1_1_NTD4_NEPBS16_SU16_SUM0_SUS256_SVW1_VWA1_VWB1_WG16_4_4_WGM6_WGMXCC8_WGMXCCG304
    SolutionIndex: 191
    SolutionNameMin: Cijk_Alik_Bljk_F8NHS_BH_BiasSH_HAS_SAB_SAV_UserArgs_MT16x16x512_MI16x16x1_SN_LDSB1_GRVWA16_GRVWB16_GSU3_GSUAMBSK_GSUC0_GSUWGMRR0_K1_LBSPPA512_LBSPPB512_LPA32_LPB32_LRVW16_MIWT1_1_NTD0_NEPBS0_SU0_SUM0_SUS0_SVW1_VWA1_VWB1_WG16_4_4_WGM1_WGMXCC1_WGMXCCG0
    SolutionIndex: 192
    SolutionNameMin: Cijk_Alik_Bljk_F8NHS_BH_BiasSH_HAS_SAB_SAV_UserArgs_MT32x32x512_MI16x16x1_SN_LDSB1_GRVWA16_GRVWB16_GSU3_GSUAMBSK_GSUC0_GSUWGMRR0_K1_LBSPPA512_LBSPPB512_LPA32_LPB32_LRVW16_MIWT1_1_NTD0_NEPBS0_SU0_SUM0_SUS0_SVW1_VWA1_VWB1_WG32_8_1_WGM1_WGMXCC1_WGMXCCG0
    SolutionIndex: 193
    SolutionNameMin: Cijk_Alik_Bljk_F8NHS_BH_BiasSH_HAS_SAB_SAV_UserArgs_MT64x16x256_MI16x16x1_SN_LDSB1_GRVWA16_GRVWB16_GSU1_GSUAMB_GSUC0_GSUWGMRR0_K1_LBSPPA256_LBSPPB256_LPA32_LPB32_LRVW16_MIWT1_1_NTD4_NEPBS16_SU16_SUM0_SUS256_SVW1_VWA1_VWB1_WG64_4_1_WGM6_WGMXCC8_WGMXCCG304
    SolutionIndex: 194
    SolutionNameMin: Cijk_Alik_Bljk_F8NHS_BH_BiasSH_HAS_SAB_SAV_UserArgs_MT64x64x256_MI16x16x1_SN_LDSB1_GRVWA16_GRVWB16_GSU4_GSUAMBSK_GSUC0_GSUWGMRR0_K1_LBSPPA1024_LBSPPB256_LPA32_LPB32_LRVW16_MIWT4_1_NTD0_NEPBS0_SU0_SUM0_SUS0_SVW4_VWA4_VWB1_WG16_16_1_WGM1_WGMXCC1_WGMXCCG0
    SolutionIndex: 195
    SolutionNameMin: Cijk_Alik_Bljk_F8NHS_BH_BiasSH_HAS_SAB_SAV_UserArgs_MT64x64x256_MI16x16x1_SN_LDSB1_GRVWA16_GRVWB16_GSU2_GSUAMBSK_GSUC0_GSUWGMRR0_K1_LBSPPA1024_LBSPPB256_LPA32_LPB32_LRVW16_MIWT4_1_NTD0_NEPBS0_SU0_SUM0_SUS0_SVW4_VWA4_VWB1_WG16_16_1_WGM1_WGMXCC1_WGMXCCG0
    SolutionIndex: 196
    SolutionNameMin: Cijk_Alik_Bljk_F8NHS_BH_BiasSH_HAS_SAB_SAV_UserArgs_MT128x64x256_MI16x16x1_SN_LDSB1_GRVWA16_GRVWB16_GSU3_GSUAMBSK_GSUC0_GSUWGMRR0_K1_LBSPPA1024_LBSPPB512_LPA32_LPB32_LRVW16_MIWT4_2_NTD0_NEPBS0_SU0_SUM0_SUS0_SVW4_VWA4_VWB2_WG32_8_1_WGM1_WGMXCC1_WGMXCCG0
    SolutionIndex: 197
    SolutionNameMin: Cijk_Alik_Bljk_F8NHS_BH_BiasSH_HAS_SAB_SAV_UserArgs_MT96x64x128_MI16x16x1_SN_LDSB1_GRVWA16_GRVWB16_GSU1_GSUC0_GSUWGMRR0_K1_LBSPPA256_LBSPPB128_LPA32_LPB32_LRVW16_MIWT6_1_NTA0_NTB4_SU8_SUM0_SUS128_SVW2_VWA2_VWB1_WG16_16_1_WGM1_WGMXCC8_WGMXCCG304
    SolutionIndex: 198
    SolutionNameMin: Cijk_Alik_Bljk_F8NHS_BH_BiasSH_HAS_SAB_SAV_UserArgs_MT64x96x256_MI16x16x1_SN_LDSB1_GRVWA16_GRVWB16_GSU1_GSUC0_GSUWGMRR0_K1_LBSPPA512_LBSPPB256_LPA32_LPB32_LRVW16_MIWT2_3_NTA0_NTB0_SU8_SUM0_SUS256_SVW2_VWA2_VWB1_WG32_8_1_WGM1_WGMXCC8_WGMXCCG304
    SolutionIndex: 199
    SolutionNameMin: Cijk_Alik_Bljk_F8NHS_BH_BiasSH_HAS_SAB_SAV_UserArgs_MT128x48x256_MI16x16x1_SN_LDSB1_GRVWA16_GRVWB16_GSU1_GSUC0_GSUWGMRR0_K1_LBSPPA512_LBSPPB256_LPA32_LPB32_LRVW16_MIWT2_3_NTA0_NTB0_SU8_SUM0_SUS256_SVW2_VWA2_VWB1_WG64_4_1_WGM1_WGMXCC8_WGMXCCG304
    SolutionIndex: 200
    SolutionNameMin: Cijk_Alik_Bljk_F8NHS_BH_BiasSH_HAS_SAB_SAV_UserArgs_MT128x96x256_MI16x16x1_SN_LDSB1_GRVWA16_GRVWB16_GSU2_GSUAMBSK_GSUC0_GSUWGMRR0_K1_LBSPPA1024_LBSPPB256_LPA32_LPB32_LRVW16_MIWT4_3_NTD0_NEPBS0_SU0_SUM0_SUS0_SVW4_VWA4_VWB1_WG32_8_1_WGM1_WGMXCC1_WGMXCCG0
    SolutionIndex: 201
    SolutionNameMin: Cijk_Alik_Bljk_F8NHS_BH_BiasSH_HAS_SAB_SAV_UserArgs_MT128x96x256_MI16x16x1_SN_LDSB1_GRVWA16_GRVWB16_GSU1_GSUC0_GSUWGMRR0_K1_LBSPPA1024_LBSPPB256_LPA32_LPB32_LRVW16_MIWT4_3_NTA0_NTB4_SU8_SUM0_SUS256_SVW4_VWA4_VWB1_WG32_8_1_WGM1_WGMXCC8_WGMXCCG304
    SolutionIndex: 202
    SolutionNameMin: Cijk_Alik_Bljk_F8NHS_BH_BiasSH_HAS_SAB_SAV_UserArgs_MT128x96x256_MI16x16x1_SN_LDSB1_GRVWA16_GRVWB16_GSU1_GSUC0_GSUWGMRR0_K1_LBSPPA1024_LBSPPB256_LPA32_LPB32_LRVW16_MIWT4_3_NTA0_NTB0_SU8_SUM0_SUS256_SVW4_VWA4_VWB1_WG32_8_1_WGM1_WGMXCC8_WGMXCCG304
    SolutionIndex: 203
    SolutionNameMin: Cijk_Alik_Bljk_F8NHS_BH_BiasSH_HAS_SAB_SAV_UserArgs_MT192x128x128_MI16x16x1_SN_LDSB1_GRVWA16_GRVWB16_GSU1_GSUC0_GSUWGMRR0_K1_LBSPPA512_LBSPPB256_LPA32_LPB32_LRVW16_MIWT12_2_SU16_SUM0_SUS128_SVW4_VWA4_VWB2_WG16_16_1_WGM8_WGMXCC8_WGMXCCG304
    SolutionIndex: 204
    SolutionNameMin: Cijk_Alik_Bljk_F8NHS_BH_BiasSH_HAS_SAB_SAV_UserArgs_MT192x128x128_MI16x16x1_SN_LDSB1_GRVWA16_GRVWB16_GSU1_GSUAMB_GSUC0_GSUWGMRR0_K1_LBSPPA512_LBSPPB256_LPA32_LPB32_LRVW16_MIWT12_2_NTD4_NEPBS16_SU16_SUM0_SUS128_SVW4_VWA4_VWB2_WG16_16_1_WGM6_WGMXCC8_WGMXCCG304
    SolutionIndex: 205
    SolutionNameMin: Cijk_Alik_Bljk_F8NHS_BH_BiasSH_HAS_SAB_SAV_UserArgs_MT128x192x128_MI16x16x1_SN_LDSB1_GRVWA16_GRVWB16_GSU1_GSUC0_GSUWGMRR0_K1_LBSPPA1024_LBSPPB128_LPA32_LPB32_LRVW16_MIWT8_3_SU8_SUM1_SUS128_SVW8_VWA8_VWB1_WG16_16_1_WGM6_WGMXCC8_WGMXCCG304
    SolutionIndex: 206
    SolutionNameMin: Cijk_Alik_Bljk_F8NHS_BH_BiasSH_HAS_SAB_SAV_UserArgs_MT192x128x128_MI16x16x1_SN_LDSB1_GRVWA16_GRVWB16_GSU1_GSUC0_GSUWGMRR0_K1_LBSPPA128_LBSPPB1024_LPA32_LPB32_LRVW16_MIWT3_8_NTB4_SU16_SUM0_SUS128_SVW1_VWA1_VWB8_WG64_4_1_WGM8_WGMXCC8_WGMXCCG304
    SolutionIndex: 207
    SolutionNameMin: Cijk_Alik_Bljk_F8NHS_BH_BiasSH_HAS_SAB_SAV_UserArgs_MT128x192x64_MI16x16x1_SN_LDSB1_GRVWA8_GRVWB8_GSU1_GSUC0_GSUWGMRR0_K1_LBSPPA256_LBSPPB128_LPA8_LPB8_LRVW8_MIWT4_6_NTA0_NTB0_SU8_SUM0_SUS64_SVW4_VWA4_VWB2_WG32_8_1_WGM1_WGMXCC8_WGMXCCG304
    SolutionIndex: 208
    SolutionNameMin: Cijk_Alik_Bljk_F8NHS_BH_BiasSH_HAS_SAB_SAV_UserArgs_MT128x256x128_MI16x16x1_SN_LDSB1_GRVWA16_GRVWB16_GSU1_GSUAMB_GSUC0_GSUWGMRR0_K1_LBSPPA512_LBSPPB1024_LPA32_LPB32_LRVW16_MIWT4_8_NTB0_NTD4_NEPBS16_SU16_SUM0_SUS128_SVW4_VWA4_VWB8_WG32_8_1_WGM6_WGMXCC8_WGMXCCG304
    SolutionIndex: 209
    SolutionNameMin: Cijk_Alik_Bljk_F8NHS_BH_BiasSH_HAS_SAB_SAV_UserArgs_MT128x256x128_MI16x16x1_SN_LDSB1_GRVWA16_GRVWB16_GSU1_GSUC0_GSUWGMRR0_K1_LBSPPA256_LBSPPB2048_LPA32_LPB32_LRVW16_MIWT2_16_NTA0_NTB4_SU8_SUM0_SUS128_SVW2_VWA2_VWB16_WG64_4_1_WGM1_WGMXCC8_WGMXCCG304
    SolutionIndex: 210
    SolutionNameMin: Cijk_Alik_Bljk_F8NHS_BH_BiasSH_HAS_SAB_SAV_UserArgs_MT192x256x128_MI16x16x1_SN_LDSB1_GRVWA16_GRVWB16_GSU1_GSUC0_GSUWGMRR0_K1_LBSPPA512_LBSPPB512_LPA32_LPB32_LRVW16_MIWT12_4_SU16_SUM0_SUS128_SVW4_VWA4_VWB4_WG16_16_1_WGM8_WGMXCC8_WGMXCCG304
    SolutionIndex: 211
    SolutionNameMin: Cijk_Alik_Bljk_F8NHS_BH_BiasSH_HAS_SAB_SAV_UserArgs_MT192x224x128_MI16x16x1_SN_LDSB1_GRVWA16_GRVWB16_GSU1_GSUAMB_GSUC0_GSUWGMRR0_K1_LBSPPA256_LBSPPB128_LPA32_LPB32_LRVW16_MIWT6_7_NTD4_NEPBS16_SU16_SUM0_SUS128_SVW2_VWA2_VWB1_WG32_8_1_WGM6_WGMXCC8_WGMXCCG304
    SolutionIndex: 212
    SolutionNameMin: Cijk_Alik_Bljk_F8NHS_BH_BiasSH_HAS_SAB_SAV_UserArgs_MT192x224x128_MI16x16x1_SN_LDSB1_GRVWA16_GRVWB16_GSU1_GSUC0_GSUWGMRR0_K1_LBSPPA256_LBSPPB128_LPA32_LPB32_LRVW16_MIWT6_7_NTB4_SU16_SUM0_SUS128_SVW2_VWA2_VWB1_WG32_8_1_WGM8_WGMXCC8_WGMXCCG304
    SolutionIndex: 213
    SolutionNameMin: Cijk_Alik_Bljk_F8NHS_BH_BiasSH_HAS_SAB_SAV_UserArgs_MT128x192x64_MI16x16x1_SN_LDSB1_GRVWA8_GRVWB8_GSU1_GSUC0_GSUWGMRR0_K1_LBSPPA256_LBSPPB128_LPA8_LPB8_LRVW8_MIWT4_6_NTB0_SU8_SUM1_SUS64_SVW4_VWA4_VWB2_WG32_8_1_WGM6_WGMXCC8_WGMXCCG304
    SolutionIndex: 214
    SolutionNameMin: Cijk_Alik_Bljk_F8NHS_BH_BiasSH_HAS_SAB_SAV_UserArgs_MT128x288x128_MI16x16x1_SN_LDSB1_GRVWA16_GRVWB16_GSU1_GSUC0_GSUWGMRR0_K1_LBSPPA512_LBSPPB128_LPA32_LPB32_LRVW16_MIWT4_9_NTA0_NTB0_SU8_SUM0_SUS128_SVW4_VWA4_VWB1_WG32_8_1_WGM1_WGMXCC8_WGMXCCG304
    SolutionIndex: 215
    SolutionNameMin: Cijk_Alik_Bljk_F8NHS_BH_BiasSH_HAS_SAB_SAV_UserArgs_MT128x256x128_MI16x16x1_SN_LDSB1_GRVWA16_GRVWB16_GSU1_GSUAMB_GSUC0_GSUWGMRR0_K1_LBSPPA512_LBSPPB1024_LPA32_LPB32_LRVW16_MIWT4_8_NTD4_NEPBS16_SU16_SUM0_SUS128_SVW4_VWA4_VWB8_WG32_8_1_WGM6_WGMXCC8_WGMXCCG304
    SolutionIndex: 216
    SolutionNameMin: Cijk_Alik_Bljk_F8NHS_BH_BiasSH_HAS_SAB_SAV_UserArgs_MT192x224x128_MI16x16x1_SN_LDSB1_GRVWA16_GRVWB16_GSU1_GSUC0_GSUWGMRR0_K1_LBSPPA256_LBSPPB128_LPA32_LPB32_LRVW16_MIWT6_7_NTB0_SU16_SUM0_SUS128_SVW2_VWA2_VWB1_WG32_8_1_WGM8_WGMXCC8_WGMXCCG304
    SolutionIndex: 217
    SolutionNameMin: Cijk_Alik_Bljk_F8NHS_BH_Bias_HAS_SAV_UserArgs_MT192x256x128_MI16x16x1_SN_CLR1_GRVWA16_GRVWB16_GSU1_GSUC0_GSUWGMRR0_K1_LBSPPA512_LBSPPB256_LPA32_LPB32_LRVW16_MIAV0_MIWT12_4_NTC4_NTD4_SU8_SUM0_SUS256_SPO1_SSO4_SVW4_TLDS2_VWA4_VWB2_WG16_16_1_WGM16_WGMXCC1_WGMXCCGn1
    SolutionIndex: 218
    SolutionNameMin: Cijk_Alik_Bljk_F8NHS_BH_BiasSH_HAS_SAB_SAV_UserArgs_MT192x224x128_MI16x16x1_SN_LDSB1_GRVWA16_GRVWB16_GSU1_GSUAMB_GSUC0_GSUWGMRR0_K1_LBSPPA256_LBSPPB128_LPA32_LPB32_LRVW16_MIWT6_7_NTD4_NEPBS16_SU16_SUM0_SUS128_SVW2_VWA2_VWB1_WG32_8_1_WGM6_WGMXCC8_WGMXCCG304
    SolutionIndex: 219
    SolutionNameMin: Cijk_Alik_Bljk_F8NHS_BH_BiasSH_HAS_SAB_SAV_UserArgs_MT64x16x512_MI16x16x1_SN_LDSB1_GRVWA16_GRVWB16_GSU3_GSUAMBSK_GSUC0_GSUWGMRR0_K1_LBSPPA512_LBSPPB512_LPA32_LPB32_LRVW16_MIWT1_1_NTD0_NEPBS0_SU0_SUM0_SUS0_SVW1_VWA1_VWB1_WG64_4_1_WGM1_WGMXCC1_WGMXCCG0
    SolutionIndex: 220
    SolutionNameMin: Cijk_Alik_Bljk_F8NHS_BH_BiasSH_HAS_SAB_SAV_UserArgs_MT64x32x512_MI16x16x1_SN_LDSB1_GRVWA16_GRVWB16_GSU4_GSUAMB_GSUC0_GSUWGMRR0_K1_LBSPPA1024_LBSPPB512_LPA32_LPB32_LRVW16_MIWT2_1_NTD0_NEPBS16_SU0_SUM0_SUS0_SVW2_VWA2_VWB1_WG32_8_1_WGM1_WGMXCC1_WGMXCCG0
    SolutionIndex: 221
    SolutionNameMin: Cijk_Alik_Bljk_F8NHS_BH_BiasSH_HAS_SAB_SAV_UserArgs_MT64x64x256_MI16x16x1_SN_LDSB1_GRVWA16_GRVWB16_GSU4_GSUAMB_GSUC0_GSUWGMRR0_K1_LBSPPA512_LBSPPB512_LPA32_LPB32_LRVW16_MIWT2_2_NTD0_NEPBS16_SU0_SUM0_SUS0_SVW2_VWA2_VWB2_WG32_8_1_WGM1_WGMXCC1_WGMXCCG0
    SolutionIndex: 222
    SolutionNameMin: Cijk_Alik_Bljk_F8NHS_BH_BiasSH_HAS_SAB_SAV_UserArgs_MT32x64x512_MI16x16x1_SN_LDSB1_GRVWA16_GRVWB16_GSU1_GSUC0_GSUWGMRR0_K1_LBSPPA1024_LBSPPB512_LPA32_LPB32_LRVW16_MIWT2_1_NTA0_NTB0_SU8_SUM0_SUS512_SVW2_VWA2_VWB1_WG16_16_1_WGM1_WGMXCC8_WGMXCCG304
    SolutionIndex: 223
    SolutionNameMin: Cijk_Alik_Bljk_F8NHS_BH_BiasSH_HAS_SAB_SAV_UserArgs_MT32x64x256_MI16x16x1_SN_LDSB1_GRVWA16_GRVWB16_GSU1_GSUC0_GSUWGMRR0_K1_LBSPPA512_LBSPPB256_LPA32_LPB32_LRVW16_MIWT2_1_NTA0_NTB0_SU8_SUM0_SUS256_SVW2_VWA2_VWB1_WG16_16_1_WGM1_WGMXCC8_WGMXCCG304
    SolutionIndex: 224
    SolutionNameMin: Cijk_Alik_Bljk_F8NHS_BH_BiasSH_HAS_SAB_SAV_UserArgs_MT64x48x512_MI16x16x1_SN_LDSB1_GRVWA16_GRVWB16_GSU1_GSUC0_GSUWGMRR0_K1_LBSPPA512_LBSPPB512_LPA32_LPB32_LRVW16_MIWT1_3_NTA0_NTB0_SU8_SUM0_SUS512_SVW1_VWA1_VWB1_WG64_4_1_WGM1_WGMXCC8_WGMXCCG304
    SolutionIndex: 225
    SolutionNameMin: Cijk_Alik_Bljk_F8NHS_BH_BiasSH_HAS_SAB_SAV_UserArgs_MT128x64x256_MI16x16x1_SN_LDSB1_GRVWA16_GRVWB16_GSU3_GSUAMBSK_GSUC0_GSUWGMRR0_K1_LBSPPA1024_LBSPPB512_LPA32_LPB32_LRVW16_MIWT4_2_NTB0_NTD0_NEPBS0_SU0_SUM0_SUS0_SVW4_VWA4_VWB2_WG32_8_1_WGM1_WGMXCC1_WGMXCCG0
    SolutionIndex: 226
    SolutionNameMin: Cijk_Alik_Bljk_F8NHS_BH_BiasSH_HAS_SAB_SAV_UserArgs_MT64x64x256_MI16x16x1_SN_LDSB1_GRVWA16_GRVWB16_GSU1_GSUC0_GSUWGMRR0_K1_LBSPPA512_LBSPPB512_LPA32_LPB32_LRVW16_MIWT2_2_NTA0_NTB0_SU8_SUM0_SUS256_SVW2_VWA2_VWB2_WG32_8_1_WGM1_WGMXCC8_WGMXCCG304
    SolutionIndex: 227
    SolutionNameMin: Cijk_Alik_Bljk_F8NHS_BH_BiasSH_HAS_SAB_SAV_UserArgs_MT128x96x256_MI16x16x1_SN_LDSB1_GRVWA16_GRVWB16_GSU3_GSUAMB_GSUC0_GSUWGMRR0_K1_LBSPPA1024_LBSPPB256_LPA32_LPB32_LRVW16_MIWT4_3_NTB0_NTD0_NEPBS16_SU0_SUM0_SUS0_SVW4_VWA4_VWB1_WG32_8_1_WGM1_WGMXCC1_WGMXCCG0
    SolutionIndex: 228
    SolutionNameMin: Cijk_Alik_Bljk_F8NHS_BH_BiasSH_HAS_SAB_SAV_UserArgs_MT64x128x128_MI16x16x1_SN_LDSB1_GRVWA16_GRVWB16_GSU1_GSUC0_GSUWGMRR0_K1_LBSPPA512_LBSPPB256_LPA32_LPB32_LRVW16_MIWT4_2_NTA0_NTB4_SU8_SUM0_SUS128_SVW4_VWA4_VWB2_WG16_16_1_WGM1_WGMXCC8_WGMXCCG304
    SolutionIndex: 229
    SolutionNameMin: Cijk_Alik_Bljk_F8NHS_BH_BiasSH_HAS_SAB_SAV_UserArgs_MT128x64x128_MI16x16x1_SN_LDSB1_GRVWA16_GRVWB16_GSU1_GSUC0_GSUWGMRR0_K1_LBSPPA512_LBSPPB256_LPA32_LPB32_LRVW16_MIWT4_2_NTA0_NTB0_SU8_SUM0_SUS128_SVW4_VWA4_VWB2_WG32_8_1_WGM1_WGMXCC8_WGMXCCG304
    SolutionIndex: 230
    SolutionNameMin: Cijk_Alik_Bljk_F8NHS_BH_BiasSH_HAS_SAB_SAV_UserArgs_MT128x128x128_MI16x16x1_SN_LDSB1_GRVWA16_GRVWB16_GSU1_GSUC0_GSUWGMRR0_K1_LBSPPA1024_LBSPPB256_LPA32_LPB32_LRVW16_MIWT8_2_NTB4_SU16_SUM0_SUS128_SVW8_VWA8_VWB2_WG16_16_1_WGM8_WGMXCC8_WGMXCCG304
    SolutionIndex: 231
    SolutionNameMin: Cijk_Alik_Bljk_F8NHS_BH_BiasSH_HAS_SAB_SAV_UserArgs_MT128x128x128_MI16x16x1_SN_LDSB1_GRVWA16_GRVWB16_GSU1_GSUC0_GSUWGMRR0_K1_LBSPPA512_LBSPPB512_LPA32_LPB32_LRVW16_MIWT4_4_NTA0_NTB4_SU8_SUM0_SUS128_SVW4_VWA4_VWB4_WG32_8_1_WGM1_WGMXCC8_WGMXCCG304
    SolutionIndex: 232
    SolutionNameMin: Cijk_Alik_Bljk_F8NHS_BH_BiasSH_HAS_SAB_SAV_UserArgs_MT256x112x64_MI16x16x1_SN_LDSB1_GRVWA8_GRVWB4_GSU1_GSUC0_GSUWGMRR0_K1_LBSPPA256_LBSPPB128_LPA8_LPB8_LRVW8_MIWT4_7_SU8_SUM1_SUS64_SVW4_VWA4_VWB1_WG64_4_1_WGM6_WGMXCC8_WGMXCCG304
    SolutionIndex: 233
    SolutionNameMin: Cijk_Alik_Bljk_F8NHS_BH_Bias_HAS_SAV_UserArgs_MT128x224x128_MI16x16x1_SN_LDSB1_GSU1_GSUC0_GSUWGMRR0_K1_LBSPPA512_LBSPPB128_MIAV0_MIWT4_7_NTC4_NTD4_SU2_SUM0_SUS256_SPO0_SSO0_SVW4_VWA4_VWB1_WG32_8_1_WGMn48_WGMXCC1_WGMXCCGn1
    SolutionIndex: 234
    SolutionNameMin: Cijk_Alik_Bljk_F8NHS_BH_BiasSH_HAS_SAB_SAV_UserArgs_MT128x224x128_MI16x16x1_SN_LDSB1_GRVWA16_GRVWB16_GSU1_GSUAMB_GSUC0_GSUWGMRR0_K1_LBSPPA512_LBSPPB128_LPA32_LPB32_LRVW16_MIWT4_7_NTD4_NEPBS16_SU16_SUM0_SUS128_SVW4_VWA4_VWB1_WG32_8_1_WGM6_WGMXCC8_WGMXCCG304
    SolutionIndex: 235
    SolutionNameMin: Cijk_Alik_Bljk_F8NHS_BH_Bias_HAS_SAV_UserArgs_MT256x192x128_MI16x16x1_SN_CLR1_GRVWA16_GRVWB16_GSU1_GSUC0_GSUWGMRR0_K1_LBSPPA1024_LBSPPB128_LPA32_LPB32_LRVW16_MIAV0_MIWT8_6_NTC4_NTD4_SU8_SUM0_SUS256_SPO1_SSO4_SVW8_TLDS2_VWA8_VWB1_WG32_8_1_WGM48_WGMXCC1_WGMXCCGn1
    SolutionIndex: 236
    SolutionNameMin: Cijk_Alik_Bljk_F8NHS_BH_BiasSH_HAS_SAB_SAV_UserArgs_MT256x192x128_MI16x16x1_SN_LDSB1_GRVWA16_GRVWB16_GSU1_GSUAMB_GSUC0_GSUWGMRR0_K1_LBSPPA1024_LBSPPB256_LPA32_LPB32_LRVW16_MIWT8_6_NTB4_NTD4_NEPBS16_SU16_SUM0_SUS128_SVW8_VWA8_VWB2_WG32_8_1_WGM6_WGMXCC8_WGMXCCG304
    SolutionIndex: 237
    SolutionNameMin: Cijk_Alik_Bljk_F8NHS_BH_BiasSH_HAS_SAB_SAV_UserArgs_MT256x128x64_MI16x16x1_SN_LDSB1_GRVWA8_GRVWB8_GSU1_GSUC0_GSUWGMRR0_K1_LBSPPA256_LBSPPB512_LPA8_LPB8_LRVW8_MIWT4_8_SU8_SUM1_SUS64_SVW4_VWA4_VWB8_WG64_4_1_WGM6_WGMXCC8_WGMXCCG304
    SolutionIndex: 238
    SolutionNameMin: Cijk_Alik_Bljk_F8NHS_BH_Bias_HAS_SAV_UserArgs_MT256x224x128_MI16x16x1_SN_CLR0_GRVWA4_GRVWB16_GSU1_GSUC0_GSUWGMRR0_K1_LBSPPA1024_LBSPPB128_LPA8_LPB16_LRVW8_MIAV0_MIWT8_7_NTC4_NTD4_SU8_SUM0_SUS256_SPO1_SSO4_SVW8_TLDS2_VWA8_VWB1_WG32_8_1_WGM16_WGMXCC1_WGMXCCGn1
    SolutionIndex: 239
    SolutionNameMin: Cijk_Alik_Bljk_F8NHS_BH_BiasSH_HAS_SAB_SAV_UserArgs_MT256x96x64_MI16x16x1_SN_LDSB1_GRVWA8_GRVWB8_GSU1_GSUC0_GSUWGMRR0_K1_LBSPPA512_LBSPPB128_LPA8_LPB8_LRVW8_MIWT8_3_SU8_SUM1_SUS64_SVW8_VWA8_VWB1_WG32_8_1_WGM6_WGMXCC8_WGMXCCG304
    SolutionIndex: 240
    SolutionNameMin: Cijk_Alik_Bljk_F8NHS_BH_BiasSH_HAS_SAB_SAV_UserArgs_MT128x224x128_MI16x16x1_SN_LDSB1_GRVWA16_GRVWB16_GSU1_GSUC0_GSUWGMRR0_K1_LBSPPA512_LBSPPB128_LPA32_LPB32_LRVW16_MIWT4_7_NTA0_NTB4_SU8_SUM0_SUS128_SVW4_VWA4_VWB1_WG32_8_1_WGM1_WGMXCC8_WGMXCCG304
    SolutionIndex: 241
    SolutionNameMin: Cijk_Alik_Bljk_F8NHS_BH_BiasSH_HAS_SAB_SAV_UserArgs_MT256x192x128_MI16x16x1_SN_LDSB1_GRVWA16_GRVWB16_GSU1_GSUC0_GSUWGMRR0_K1_LBSPPA1024_LBSPPB256_LPA32_LPB32_LRVW16_MIWT8_6_NTA0_NTB4_SU8_SUM0_SUS128_SVW8_VWA8_VWB2_WG32_8_1_WGM1_WGMXCC8_WGMXCCG304
    SolutionIndex: 242
    SolutionNameMin: Cijk_Alik_Bljk_F8NHS_BH_BiasSH_HAS_SAB_SAV_UserArgs_MT128x160x64_MI16x16x1_SN_LDSB1_GRVWA8_GRVWB8_GSU1_GSUC0_GSUWGMRR0_K1_LBSPPA256_LBSPPB128_LPA8_LPB8_LRVW8_MIWT4_5_NTA0_NTB0_SU8_SUM0_SUS64_SVW4_VWA4_VWB1_WG32_8_1_WGM1_WGMXCC8_WGMXCCG304
    SolutionIndex: 243
    SolutionNameMin: Cijk_Alik_Bljk_F8NHS_BH_BiasSH_HAS_SAB_SAV_UserArgs_MT256x224x128_MI16x16x1_SN_LDSB1_GRVWA8_GRVWB8_GSU1_GSUC0_GSUWGMRR0_K1_LBSPPA1024_LBSPPB128_LPA8_LPB8_LRVW8_MIWT8_7_SU8_SUM1_SUS128_SVW8_VWA8_VWB1_WG32_8_1_WGM6_WGMXCC8_WGMXCCG304
    SolutionIndex: 244
    SolutionNameMin: Cijk_Alik_Bljk_F8NHS_BH_BiasSH_HAS_SAB_SAV_UserArgs_MT256x160x128_MI16x16x1_SN_LDSB1_GRVWA16_GRVWB16_GSU1_GSUAMB_GSUC0_GSUWGMRR0_K1_LBSPPA1024_LBSPPB128_LPA32_LPB32_LRVW16_MIWT8_5_NTD4_NEPBS16_SU16_SUM0_SUS128_SVW8_VWA8_VWB1_WG32_8_1_WGM6_WGMXCC8_WGMXCCG304
    SolutionIndex: 245
    SolutionNameMin: Cijk_Alik_Bljk_F8NHS_BH_BiasSH_HAS_SAB_SAV_UserArgs_MT256x224x128_MI16x16x1_SN_LDSB1_GRVWA8_GRVWB8_GSU1_GSUC0_GSUWGMRR0_K1_LBSPPA1024_LBSPPB128_LPA8_LPB8_LRVW8_MIWT8_7_SU16_SUM0_SUS128_SVW8_VWA8_VWB1_WG32_8_1_WGM8_WGMXCC8_WGMXCCG304
    SolutionIndex: 246
    SolutionNameMin: Cijk_Alik_Bljk_F8NHS_BH_BiasSH_HAS_SAB_SAV_UserArgs_MT32x32x512_MI16x16x1_SN_LDSB1_GRVWA16_GRVWB16_GSU1_GSUAMB_GSUC0_GSUWGMRR0_K1_LBSPPA512_LBSPPB512_LPA32_LPB32_LRVW16_MIWT1_1_NTD4_NEPBS16_SU16_SUM0_SUS512_SVW1_VWA1_VWB1_WG32_8_1_WGM6_WGMXCC8_WGMXCCG304
    SolutionIndex: 247
    SolutionNameMin: Cijk_Alik_Bljk_F8NHS_BH_BiasSH_HAS_SAB_SAV_UserArgs_MT32x32x512_MI16x16x1_SN_LDSB1_GRVWA16_GRVWB16_GSU1_GSUC0_GSUWGMRR0_K1_LBSPPA512_LBSPPB512_LPA32_LPB32_LRVW16_MIWT1_1_NTA4_NTB0_SU8_SUM0_SUS512_SVW1_VWA1_VWB1_WG32_8_1_WGM1_WGMXCC8_WGMXCCG304
    SolutionIndex: 248
    SolutionNameMin: Cijk_Alik_Bljk_F8NHS_BH_BiasSH_HAS_SAB_SAV_UserArgs_MT16x64x512_MI16x16x1_SN_LDSB1_GRVWA16_GRVWB16_GSU1_GSUAMB_GSUC0_GSUWGMRR0_K1_LBSPPA512_LBSPPB512_LPA32_LPB32_LRVW16_MIWT1_1_NTD4_NEPBS16_SU16_SUM0_SUS512_SVW1_VWA1_VWB1_WG16_16_1_WGM6_WGMXCC8_WGMXCCG304
    SolutionIndex: 249
    SolutionNameMin: Cijk_Alik_Bljk_F8NHS_BH_BiasSH_HAS_SAB_SAV_UserArgs_MT32x64x512_MI16x16x1_SN_LDSB1_GRVWA16_GRVWB16_GSU1_GSUC0_GSUWGMRR0_K1_LBSPPA1024_LBSPPB512_LPA32_LPB32_LRVW16_MIWT2_1_NTA4_NTB0_SU8_SUM0_SUS512_SVW2_VWA2_VWB1_WG16_16_1_WGM1_WGMXCC8_WGMXCCG304
    SolutionIndex: 250
    SolutionNameMin: Cijk_Alik_Bljk_F8NHS_BH_BiasSH_HAS_SAB_SAV_UserArgs_MT32x64x256_MI16x16x1_SN_LDSB1_GRVWA16_GRVWB16_GSU1_GSUC0_GSUWGMRR0_K1_LBSPPA512_LBSPPB256_LPA32_LPB32_LRVW16_MIWT2_1_SU16_SUM0_SUS256_SVW2_VWA2_VWB1_WG16_16_1_WGM8_WGMXCC8_WGMXCCG304
    SolutionIndex: 251
    SolutionNameMin: Cijk_Alik_Bljk_F8NHS_BH_BiasSH_HAS_SAB_SAV_UserArgs_MT32x64x512_MI16x16x1_SN_LDSB1_GRVWA16_GRVWB16_GSU1_GSUAMB_GSUC0_GSUWGMRR0_K1_LBSPPA1024_LBSPPB512_LPA32_LPB32_LRVW16_MIWT2_1_NTD4_NEPBS16_SU16_SUM0_SUS512_SVW2_VWA2_VWB1_WG16_16_1_WGM6_WGMXCC8_WGMXCCG304
    SolutionIndex: 252
    SolutionNameMin: Cijk_Alik_Bljk_F8NHS_BH_BiasSH_HAS_SAB_SAV_UserArgs_MT96x96x256_MI16x16x1_SN_LDSB1_GRVWA16_GRVWB16_GSU4_GSUAMB_GSUC0_GSUWGMRR0_K1_LBSPPA256_LBSPPB256_LPA32_LPB32_LRVW16_MIWT3_3_NTB0_NTD0_NEPBS16_SU0_SUM0_SUS0_SVW1_VWA1_VWB1_WG32_8_1_WGM1_WGMXCC1_WGMXCCG0
    SolutionIndex: 253
    SolutionNameMin: Cijk_Alik_Bljk_F8NHS_BH_BiasSH_HAS_SAB_SAV_UserArgs_MT48x64x256_MI16x16x1_SN_LDSB1_GRVWA16_GRVWB16_GSU1_GSUC0_GSUWGMRR0_K1_LBSPPA256_LBSPPB256_LPA32_LPB32_LRVW16_MIWT3_1_NTA0_NTB0_SU8_SUM0_SUS256_SVW1_VWA1_VWB1_WG16_16_1_WGM1_WGMXCC8_WGMXCCG304
    SolutionIndex: 254
    SolutionNameMin: Cijk_Alik_Bljk_F8NHS_BH_BiasSH_HAS_SAB_SAV_UserArgs_MT48x64x256_MI16x16x1_SN_LDSB1_GRVWA16_GRVWB16_GSU1_GSUC0_GSUWGMRR0_K1_LBSPPA256_LBSPPB256_LPA32_LPB32_LRVW16_MIWT3_1_NTB0_SU16_SUM0_SUS256_SVW1_VWA1_VWB1_WG16_16_1_WGM8_WGMXCC8_WGMXCCG304
    SolutionIndex: 255
    SolutionNameMin: Cijk_Alik_Bljk_F8NHS_BH_BiasSH_HAS_SAB_SAV_UserArgs_MT64x32x128_MI16x16x1_SN_LDSB0_GRVWA16_GRVWB16_GSU1_GSUC0_GSUWGMRR0_K1_LBSPPA256_LBSPPB128_LPA32_LPB32_LRVW16_MIWT2_1_NTA0_NTB0_SU8_SUM0_SUS128_SVW2_VWA2_VWB1_WG32_8_1_WGM1_WGMXCC8_WGMXCCG304
    SolutionIndex: 256
    SolutionNameMin: Cijk_Alik_Bljk_F8NHS_BH_BiasSH_HAS_SAB_SAV_UserArgs_MT64x64x256_MI16x16x1_SN_LDSB1_GRVWA16_GRVWB16_GSU1_LBSPPA512_LBSPPB256_LPA32_LPB32_LRVW16_MIWT2_2_NEPBS0_SU0_SUM0_SUS0_SVW2_VWA2_WG32_8_1_WGM1
    SolutionIndex: 257
    SolutionNameMin: Cijk_Alik_Bljk_F8NHS_BH_BiasSH_HAS_SAB_SAV_UserArgs_MT64x64x256_MI16x16x1_SN_LDSB1_GRVWA16_GRVWB16_GSU1_GSUC0_GSUWGMRR0_K1_LBSPPA512_LBSPPB512_LPA32_LPB32_LRVW16_MIWT2_2_NTB0_SU16_SUM0_SUS256_SVW2_VWA2_VWB2_WG32_8_1_WGM8_WGMXCC8_WGMXCCG304
    SolutionIndex: 258
    SolutionNameMin: Cijk_Alik_Bljk_F8NHS_BH_BiasSH_HAS_SAB_SAV_UserArgs_MT64x128x128_MI16x16x1_SN_LDSB1_GRVWA16_GRVWB16_GSU1_GSUC0_GSUWGMRR0_K1_LBSPPA512_LBSPPB256_LPA32_LPB32_LRVW16_MIWT4_2_NTA0_NTB0_SU8_SUM0_SUS128_SVW4_VWA4_VWB2_WG16_16_1_WGM1_WGMXCC8_WGMXCCG304
    SolutionIndex: 259
    SolutionNameMin: Cijk_Alik_Bljk_F8NHS_BH_BiasSH_HAS_SAB_SAV_UserArgs_MT64x64x128_MI16x16x1_SN_LDSB1_GRVWA16_GRVWB16_GSU1_GSUC0_GSUWGMRR0_K1_LBSPPA512_LBSPPB128_LPA32_LPB32_LRVW16_MIWT4_1_NTA0_NTB0_SU8_SUM0_SUS128_SVW4_VWA4_VWB1_WG16_16_1_WGM1_WGMXCC8_WGMXCCG304
    SolutionIndex: 260
    SolutionNameMin: Cijk_Alik_Bljk_F8NHS_BH_Bias_HAS_SAV_UserArgs_MT128x96x128_MI16x16x1_SN_LDSB0_GSU1_GSUC0_GSUWGMRR0_K1_LBSPPA512_LBSPPB128_MIAV0_MIWT4_3_NTC3_NTD3_SU8_SUM0_SUS256_SPO0_SSO0_SVW4_VWA4_VWB1_WG32_8_1_WGM1_WGMXCC1_WGMXCCGn1
    SolutionIndex: 261
    SolutionNameMin: Cijk_Alik_Bljk_F8NHS_BH_BiasSH_HAS_SAB_SAV_UserArgs_MT128x192x128_MI16x16x1_SN_LDSB1_GRVWA16_GRVWB16_GSU1_GSUAMB_GSUC0_GSUWGMRR0_K1_LBSPPA1024_LBSPPB128_LPA32_LPB32_LRVW16_MIWT8_3_NTD4_NEPBS16_SU16_SUM0_SUS128_SVW8_VWA8_VWB1_WG16_16_1_WGM6_WGMXCC8_WGMXCCG304
    SolutionIndex: 262
    SolutionNameMin: Cijk_Alik_Bljk_F8NHS_BH_BiasSH_HAS_SAB_SAV_UserArgs_MT192x128x128_MI16x16x1_SN_LDSB1_GRVWA16_GRVWB16_GSU1_GSUAMB_GSUC0_GSUWGMRR0_K1_LBSPPA256_LBSPPB512_LPA32_LPB32_LRVW16_MIWT6_4_NTB4_NTD4_NEPBS16_SU16_SUM0_SUS128_SVW2_VWA2_VWB4_WG32_8_1_WGM6_WGMXCC8_WGMXCCG304
    SolutionIndex: 263
    SolutionNameMin: Cijk_Alik_Bljk_F8NHS_BH_BiasSH_HAS_SAB_SAV_UserArgs_MT192x128x128_MI16x16x1_SN_LDSB1_GRVWA16_GRVWB16_GSU1_GSUC0_GSUWGMRR0_K1_LBSPPA128_LBSPPB1024_LPA32_LPB32_LRVW16_MIWT3_8_NTA0_NTB4_SU8_SUM0_SUS128_SVW1_VWA1_VWB8_WG64_4_1_WGM1_WGMXCC8_WGMXCCG304
    SolutionIndex: 264
    SolutionNameMin: Cijk_Alik_Bljk_F8NHS_BH_Bias_HAS_SAV_UserArgs_MT256x128x64_MI16x16x1_SN_CLR1_GRVWA4_GRVWB16_GSU1_GSUC0_GSUWGMRR0_K1_LBSPPA512_LBSPPB128_LPA8_LPB16_LRVW8_MIAV0_MIWT8_4_NTC4_NTD4_SU8_SUM0_SUS256_SPO1_SSO4_SVW8_TLDS2_VWA8_VWB2_WG32_8_1_WGM16_WGMXCC1_WGMXCCGn1
    SolutionIndex: 265
    SolutionNameMin: Cijk_Alik_Bljk_F8NHS_BH_BiasSH_HAS_SAB_SAV_UserArgs_MT256x128x128_MI16x16x1_SN_LDSB1_GRVWA16_GRVWB16_GSU1_GSUAMB_GSUC0_GSUWGMRR0_K1_LBSPPA1024_LBSPPB512_LPA32_LPB32_LRVW16_MIWT8_4_NTD4_NEPBS16_SU16_SUM0_SUS128_SVW8_VWA8_VWB4_WG32_8_1_WGM6_WGMXCC8_WGMXCCG304
    SolutionIndex: 266
    SolutionNameMin: Cijk_Alik_Bljk_F8NHS_BH_BiasSH_HAS_SAB_SAV_UserArgs_MT256x128x128_MI16x16x1_SN_LDSB1_GRVWA16_GRVWB16_GSU1_GSUC0_GSUWGMRR0_K1_LBSPPA512_LBSPPB1024_LPA32_LPB32_LRVW16_MIWT4_8_NTA0_NTB4_SU8_SUM0_SUS128_SVW4_VWA4_VWB8_WG64_4_1_WGM1_WGMXCC8_WGMXCCG304
    SolutionIndex: 267
    SolutionNameMin: Cijk_Alik_Bljk_F8NHS_BH_BiasSH_HAS_SAB_SAV_UserArgs_MT256x192x128_MI16x16x1_SN_LDSB1_GRVWA16_GRVWB16_GSU1_GSUC0_GSUWGMRR0_K1_LBSPPA1024_LBSPPB256_LPA32_LPB32_LRVW16_MIWT8_6_SU16_SUM0_SUS128_SVW8_VWA8_VWB2_WG32_8_1_WGM6_WGMXCC8_WGMXCCG304
    SolutionIndex: 268
    SolutionNameMin: Cijk_Alik_Bljk_F8NHS_BH_BiasSH_HAS_SAB_SAV_UserArgs_MT192x224x128_MI16x16x1_SN_LDSB1_GRVWA16_GRVWB16_GSU1_GSUC0_GSUWGMRR0_K1_LBSPPA256_LBSPPB128_LPA32_LPB32_LRVW16_MIWT6_7_SU16_SUM0_SUS128_SVW2_VWA2_VWB1_WG32_8_1_WGM8_WGMXCC8_WGMXCCG304
    SolutionIndex: 269
    SolutionNameMin: Cijk_Alik_Bljk_F8NHS_BH_BiasSH_HAS_SAB_SAV_UserArgs_MT256x224x64_MI16x16x1_SN_LDSB0_GRVWA8_GRVWB8_GSU1_GSUC0_GSUWGMRR0_K1_LBSPPA512_LBSPPB128_LPA8_LPB8_LRVW8_MIWT8_7_SU16_SUM0_SUS64_SVW8_VWA8_VWB1_WG32_8_1_WGM8_WGMXCC8_WGMXCCG304
    SolutionIndex: 270
    SolutionNameMin: Cijk_Alik_Bljk_F8NHS_BH_BiasSH_HAS_SAB_SAV_UserArgs_MT32x64x256_MI16x16x1_SN_LDSB1_GRVWA16_GRVWB16_GSU4_GSUAMBSK_GSUC0_GSUWGMRR0_K1_LBSPPA512_LBSPPB256_LPA32_LPB32_LRVW16_MIWT2_1_NTD0_NEPBS0_SU0_SUM0_SUS0_SVW2_VWA2_VWB1_WG16_16_1_WGM1_WGMXCC1_WGMXCCG0
    SolutionIndex: 271
    SolutionNameMin: Cijk_Alik_Bljk_F8NHS_BH_BiasSH_HAS_SAB_SAV_UserArgs_MT16x64x256_MI16x16x1_SN_LDSB1_GRVWA16_GRVWB16_GSU1_GSUC0_GSUWGMRR0_K1_LBSPPA256_LBSPPB256_LPA32_LPB32_LRVW16_MIWT1_1_NTA4_NTB0_SU8_SUM0_SUS256_SVW1_VWA1_VWB1_WG16_16_1_WGM1_WGMXCC8_WGMXCCG304
    SolutionIndex: 272
    SolutionNameMin: Cijk_Alik_Bljk_F8NHS_BH_BiasSH_HAS_SAB_SAV_UserArgs_MT16x64x512_MI16x16x1_SN_LDSB1_GRVWA16_GRVWB16_GSU1_GSUC0_GSUWGMRR0_K1_LBSPPA512_LBSPPB512_LPA32_LPB32_LRVW16_MIWT1_1_NTA0_NTB0_SU8_SUM0_SUS512_SVW1_VWA1_VWB1_WG16_16_1_WGM1_WGMXCC8_WGMXCCG304
    SolutionIndex: 273
    SolutionNameMin: Cijk_Alik_Bljk_F8NHS_BH_BiasSH_HAS_SAB_SAV_UserArgs_MT16x64x512_MI16x16x1_SN_LDSB1_GRVWA16_GRVWB16_GSU1_GSUC0_GSUWGMRR0_K1_LBSPPA512_LBSPPB512_LPA32_LPB32_LRVW16_MIWT1_1_NTA4_NTB0_SU8_SUM0_SUS512_SVW1_VWA1_VWB1_WG16_16_1_WGM1_WGMXCC8_WGMXCCG304
    SolutionIndex: 274
    SolutionNameMin: Cijk_Alik_Bljk_F8NHS_BH_BiasSH_HAS_SAB_SAV_UserArgs_MT16x64x256_MI16x16x1_SN_LDSB1_GRVWA16_GRVWB16_GSU1_GSUC0_GSUWGMRR0_K1_LBSPPA256_LBSPPB256_LPA32_LPB32_LRVW16_MIWT1_1_NTA0_NTB0_SU8_SUM0_SUS256_SVW1_VWA1_VWB1_WG16_16_1_WGM1_WGMXCC8_WGMXCCG304
    SolutionIndex: 275
    SolutionNameMin: Cijk_Alik_Bljk_F8NHS_BH_BiasSH_HAS_SAB_SAV_UserArgs_MT32x64x512_MI16x16x1_SN_LDSB1_GRVWA16_GRVWB16_GSU1_GSUAMB_GSUC0_GSUWGMRR0_K1_LBSPPA512_LBSPPB1024_LPA32_LPB32_LRVW16_MIWT1_2_NTD4_NEPBS16_SU16_SUM0_SUS512_SVW1_VWA1_VWB2_WG32_8_1_WGM6_WGMXCC8_WGMXCCG304
    SolutionIndex: 276
    SolutionNameMin: Cijk_Alik_Bljk_F8NHS_BH_BiasSH_HAS_SAB_SAV_UserArgs_MT64x48x256_MI16x16x1_SN_LDSB1_GRVWA16_GRVWB16_GSU1_LBSPPA256_LBSPPB256_LPA32_LPB32_LRVW16_MIWT1_3_NEPBS16_SU0_SUM0_SUS0_SVW1_VWA1_WG64_4_1_WGM1
    SolutionIndex: 277
    SolutionNameMin: Cijk_Alik_Bljk_F8NHS_BH_BiasSH_HAS_SAB_SAV_UserArgs_MT48x64x256_MI16x16x1_SN_LDSB1_GRVWA16_GRVWB16_GSU1_GSUAMB_GSUC0_GSUWGMRR0_K1_LBSPPA256_LBSPPB256_LPA32_LPB32_LRVW16_MIWT3_1_NTD4_NEPBS16_SU16_SUM0_SUS256_SVW1_VWA1_VWB1_WG16_16_1_WGM6_WGMXCC8_WGMXCCG304
    SolutionIndex: 278
    SolutionNameMin: Cijk_Alik_Bljk_F8NHS_BH_BiasSH_HAS_SAB_SAV_UserArgs_MT64x64x256_MI16x16x1_SN_LDSB1_GRVWA16_GRVWB16_GSU1_GSUC0_GSUWGMRR0_K1_LBSPPA512_LBSPPB512_LPA32_LPB32_LRVW16_MIWT2_2_SU16_SUM0_SUS256_SVW2_VWA2_VWB2_WG32_8_1_WGM8_WGMXCC8_WGMXCCG304
    SolutionIndex: 279
    SolutionNameMin: Cijk_Alik_Bljk_F8NHS_BH_BiasSH_HAS_SAB_SAV_UserArgs_MT64x96x128_MI16x16x1_SN_LDSB1_GRVWA16_GRVWB16_GSU1_GSUC0_GSUWGMRR0_K1_LBSPPA256_LBSPPB128_LPA32_LPB32_LRVW16_MIWT2_3_NTA0_NTB0_SU8_SUM0_SUS128_SVW2_VWA2_VWB1_WG32_8_1_WGM1_WGMXCC8_WGMXCCG304
    SolutionIndex: 280
    SolutionNameMin: Cijk_Alik_Bljk_F8NHS_BH_BiasSH_HAS_SAB_SAV_UserArgs_MT128x48x256_MI16x16x1_SN_LDSB1_GRVWA16_GRVWB16_GSU1_GSUC0_GSUWGMRR0_K1_LBSPPA512_LBSPPB256_LPA32_LPB32_LRVW16_MIWT2_3_SU16_SUM0_SUS256_SVW2_VWA2_VWB1_WG64_4_1_WGM8_WGMXCC8_WGMXCCG304
    SolutionIndex: 281
    SolutionNameMin: Cijk_Alik_Bljk_F8NHS_BH_BiasSH_HAS_SAB_SAV_UserArgs_MT64x64x128_MI16x16x1_SN_LDSB1_GRVWA16_GRVWB16_GSU1_GSUC0_GSUWGMRR0_K1_LBSPPA256_LBSPPB256_LPA32_LPB32_LRVW16_MIWT2_2_NTA0_NTB0_SU8_SUM0_SUS128_SVW2_VWA2_VWB2_WG32_8_1_WGM1_WGMXCC8_WGMXCCG304
    SolutionIndex: 282
    SolutionNameMin: Cijk_Alik_Bljk_F8NHS_BH_BiasSH_HAS_SAB_SAV_UserArgs_MT128x64x256_MI16x16x1_SN_LDSB1_GRVWA16_GRVWB16_GSU1_GSUC0_GSUWGMRR0_K1_LBSPPA512_LBSPPB1024_LPA32_LPB32_LRVW16_MIWT2_4_SU16_SUM0_SUS256_SVW2_VWA2_VWB4_WG64_4_1_WGM8_WGMXCC8_WGMXCCG304
    SolutionIndex: 283
    SolutionNameMin: Cijk_Alik_Bljk_F8NHS_BH_BiasSH_HAS_SAB_SAV_UserArgs_MT128x64x256_MI16x16x1_SN_LDSB1_GRVWA16_GRVWB16_GSU1_GSUC0_GSUWGMRR0_K1_LBSPPA512_LBSPPB1024_LPA32_LPB32_LRVW16_MIWT2_4_SU16_SUM0_SUS256_SVW2_VWA2_VWB4_WG64_4_1_WGM8_WGMXCC8_WGMXCCG304
    SolutionIndex: 284
    SolutionNameMin: Cijk_Alik_Bljk_F8NHS_BH_Bias_HAS_SAV_UserArgs_MT128x128x128_MI16x16x1_SN_CLR1_GRVWA16_GRVWB16_GSU1_GSUC0_GSUWGMRR0_K1_LBSPPA512_LBSPPB128_LPA32_LPB16_LRVW16_MIAV1_MIWT8_2_NTC4_NTD4_SU8_SUM0_SUS256_SPO1_SSO4_SVW4_TLDS1_VWA4_VWB1_WG16_16_1_WGM32_WGMXCC1_WGMXCCGn1
    SolutionIndex: 285
    SolutionNameMin: Cijk_Alik_Bljk_F8NHS_BH_BiasSH_HAS_SAB_SAV_UserArgs_MT256x112x128_MI16x16x1_SN_LDSB1_GRVWA16_GRVWB8_GSU1_GSUC0_GSUWGMRR0_K1_LBSPPA512_LBSPPB128_LPA32_LPB32_LRVW16_MIWT4_7_NTB0_SU16_SUM0_SUS128_SVW4_VWA4_VWB1_WG64_4_1_WGM8_WGMXCC8_WGMXCCG304
    SolutionIndex: 286
    SolutionNameMin: Cijk_Alik_Bljk_F8NHS_BH_BiasSH_HAS_SAB_SAV_UserArgs_MT128x224x128_MI16x16x1_SN_LDSB1_GRVWA16_GRVWB16_GSU1_GSUC0_GSUWGMRR0_K1_LBSPPA512_LBSPPB128_LPA32_LPB32_LRVW16_MIWT4_7_NTB0_SU8_SUM1_SUS128_SVW4_VWA4_VWB1_WG32_8_1_WGM6_WGMXCC8_WGMXCCG304
    SolutionIndex: 287
    SolutionNameMin: Cijk_Alik_Bljk_F8NHS_BH_BiasSH_HAS_SAB_SAV_UserArgs_MT256x128x64_MI16x16x1_SN_LDSB1_GRVWA8_GRVWB8_GSU1_GSUC0_GSUWGMRR0_K1_LBSPPA512_LBSPPB256_LPA8_LPB8_LRVW8_MIWT8_4_NTB0_SU16_SUM0_SUS64_SVW8_VWA8_VWB4_WG32_8_1_WGM8_WGMXCC8_WGMXCCG304
    SolutionIndex: 288
    SolutionNameMin: Cijk_Alik_Bljk_F8NHS_BH_BiasSH_HAS_SAB_SAV_UserArgs_MT256x224x128_MI16x16x1_SN_LDSB1_GRVWA8_GRVWB8_GSU1_GSUC0_GSUWGMRR0_K1_LBSPPA512_LBSPPB256_LPA8_LPB8_LRVW8_MIWT4_14_NTB0_SU16_SUM0_SUS128_SVW4_VWA4_VWB2_WG64_4_1_WGM8_WGMXCC8_WGMXCCG304
    SolutionIndex: 289
    SolutionNameMin: Cijk_Alik_Bljk_F8NHS_BH_BiasSH_HAS_SAB_SAV_UserArgs_MT256x96x64_MI16x16x1_SN_LDSB1_GRVWA8_GRVWB8_GSU1_GSUC0_GSUWGMRR0_K1_LBSPPA512_LBSPPB128_LPA8_LPB8_LRVW8_MIWT8_3_NTB0_SU16_SUM0_SUS64_SVW8_VWA8_VWB1_WG32_8_1_WGM8_WGMXCC8_WGMXCCG304
    SolutionIndex: 290
    SolutionNameMin: Cijk_Alik_Bljk_F8NHS_BH_BiasSH_HAS_SAB_SAV_UserArgs_MT256x192x128_MI16x16x1_SN_LDSB1_GRVWA16_GRVWB16_GSU1_GSUC0_GSUWGMRR0_K1_LBSPPA1024_LBSPPB256_LPA32_LPB32_LRVW16_MIWT8_6_NTA0_NTB0_SU8_SUM0_SUS128_SVW8_VWA8_VWB2_WG32_8_1_WGM1_WGMXCC8_WGMXCCG304
    SolutionIndex: 291
    SolutionNameMin: Cijk_Alik_Bljk_F8NHS_BH_BiasSH_HAS_SAB_SAV_UserArgs_MT128x192x64_MI16x16x1_SN_LDSB1_GRVWA8_GRVWB8_GSU1_GSUC0_GSUWGMRR0_K1_LBSPPA512_LBSPPB128_LPA8_LPB8_LRVW8_MIWT8_3_NTB0_SU8_SUM1_SUS64_SVW8_VWA8_VWB1_WG16_16_1_WGM6_WGMXCC8_WGMXCCG304
    SolutionIndex: 292
    SolutionNameMin: Cijk_Alik_Bljk_F8NHS_BH_BiasSH_HAS_SAB_SAV_UserArgs_MT256x224x64_MI16x16x1_SN_LDSB0_GRVWA8_GRVWB8_GSU1_GSUC0_GSUWGMRR0_K1_LBSPPA512_LBSPPB128_LPA8_LPB8_LRVW8_MIWT8_7_NTB0_SU16_SUM0_SUS64_SVW8_VWA8_VWB1_WG32_8_1_WGM8_WGMXCC8_WGMXCCG304
    SolutionIndex: 293
    SolutionNameMin: Cijk_Alik_Bljk_F8NHS_BH_BiasSH_HAS_SAB_SAV_UserArgs_MT256x192x128_MI16x16x1_SN_LDSB1_GRVWA16_GRVWB16_GSU1_GSUAMB_GSUC0_GSUWGMRR0_K1_LBSPPA1024_LBSPPB256_LPA32_LPB32_LRVW16_MIWT8_6_NTD4_NEPBS16_SU16_SUM0_SUS128_SVW8_VWA8_VWB2_WG32_8_1_WGM6_WGMXCC8_WGMXCCG304
    SolutionIndex: 294
    SolutionNameMin: Cijk_Alik_Bljk_F8NHS_BH_BiasSH_HAS_SAB_SAV_UserArgs_MT32x32x512_MI16x16x1_SN_LDSB1_GRVWA16_GRVWB16_GSU2_GSUAMBSK_GSUC0_GSUWGMRR0_K1_LBSPPA512_LBSPPB512_LPA32_LPB32_LRVW16_MIWT1_1_NTD0_NEPBS0_SU0_SUM0_SUS0_SVW1_VWA1_VWB1_WG32_8_1_WGM1_WGMXCC1_WGMXCCG0
    SolutionIndex: 295
    SolutionNameMin: Cijk_Alik_Bljk_F8NHS_BH_BiasSH_HAS_SAB_SAV_UserArgs_MT32x32x256_MI16x16x1_SN_LDSB1_GRVWA16_GRVWB16_GSU1_GSUC0_GSUWGMRR0_K1_LBSPPA256_LBSPPB256_LPA32_LPB32_LRVW16_MIWT1_1_NTA4_NTB0_SU8_SUM0_SUS256_SVW1_VWA1_VWB1_WG32_8_1_WGM1_WGMXCC8_WGMXCCG304
    SolutionIndex: 296
    SolutionNameMin: Cijk_Alik_Bljk_F8NHS_BH_BiasSH_HAS_SAB_SAV_UserArgs_MT64x32x512_MI16x16x1_SN_LDSB1_GRVWA16_GRVWB16_GSU1_GSUAMB_GSUC0_GSUWGMRR0_K1_LBSPPA512_LBSPPB1024_LPA32_LPB32_LRVW16_MIWT1_2_NTD4_NEPBS16_SU16_SUM0_SUS512_SVW1_VWA1_VWB2_WG64_4_1_WGM6_WGMXCC8_WGMXCCG304
    SolutionIndex: 297
    SolutionNameMin: Cijk_Alik_Bljk_F8NHS_BH_BiasSH_HAS_SAB_SAV_UserArgs_MT32x64x256_MI16x16x1_SN_LDSB1_GRVWA16_GRVWB16_GSU1_GSUC0_GSUWGMRR0_K1_LBSPPA512_LBSPPB256_LPA32_LPB32_LRVW16_MIWT2_1_NTA4_NTB0_SU8_SUM0_SUS256_SVW2_VWA2_VWB1_WG16_16_1_WGM1_WGMXCC8_WGMXCCG304
    SolutionIndex: 298
    SolutionNameMin: Cijk_Alik_Bljk_F8NHS_BH_BiasSH_HAS_SAB_SAV_UserArgs_MT32x96x256_MI16x16x1_SN_LDSB1_GRVWA16_GRVWB16_GSU1_GSUC0_GSUWGMRR0_K1_LBSPPA256_LBSPPB256_LPA32_LPB32_LRVW16_MIWT1_3_NTA4_NTB0_SU8_SUM0_SUS256_SVW1_VWA1_VWB1_WG32_8_1_WGM1_WGMXCC8_WGMXCCG304
    SolutionIndex: 299
    SolutionNameMin: Cijk_Alik_Bljk_F8NHS_BH_BiasSH_HAS_SAB_SAV_UserArgs_MT64x32x128_MI16x16x1_SN_LDSB0_GRVWA16_GRVWB16_GSU1_LBSPPA256_LBSPPB128_LPA32_LPB32_LRVW16_MIWT2_1_NEPBS16_SU0_SUM0_SUS0_SVW2_VWA2_WG32_8_1_WGM1
    SolutionIndex: 300
    SolutionNameMin: Cijk_Alik_Bljk_F8NHS_BH_BiasSH_HAS_SAB_SAV_UserArgs_MT64x64x256_MI16x16x1_SN_LDSB1_GRVWA16_GRVWB16_GSU1_GSUAMB_GSUC0_GSUWGMRR0_K1_LBSPPA512_LBSPPB512_LPA32_LPB32_LRVW16_MIWT2_2_NTB0_NTD4_NEPBS16_SU16_SUM0_SUS256_SVW2_VWA2_VWB2_WG32_8_1_WGM6_WGMXCC8_WGMXCCG304
    SolutionIndex: 301
    SolutionNameMin: Cijk_Alik_Bljk_F8NHS_BH_Bias_HAS_SAV_UserArgs_MT64x64x256_MI16x16x1_SN_LDSB1_GSU1_GSUC0_GSUWGMRR0_K1_LBSPPA512_LBSPPB512_MIAV0_MIWT2_2_NTC1_NTD1_SU0_SUM0_SUS0_SPO0_SSO4_SVW2_VWA2_VWB2_WG32_8_1_WGM1_WGMXCC1_WGMXCCGn1
    SolutionIndex: 302
    SolutionNameMin: Cijk_Alik_Bljk_F8NHS_BH_BiasSH_HAS_SAB_SAV_UserArgs_MT64x64x128_MI16x16x1_SN_LDSB1_GRVWA16_GRVWB16_GSU1_LBSPPA256_LBSPPB128_LPA32_LPB32_LRVW16_MIWT2_2_NEPBS16_SU0_SUM0_SUS0_SVW2_VWA2_WG32_8_1_WGM1
    SolutionIndex: 303
    SolutionNameMin: Cijk_Alik_Bljk_F8NHS_BH_BiasSH_HAS_SAB_SAV_UserArgs_MT64x96x256_MI16x16x1_SN_LDSB1_GRVWA16_GRVWB16_GSU1_GSUAMB_GSUC0_GSUWGMRR0_K1_LBSPPA512_LBSPPB256_LPA32_LPB32_LRVW16_MIWT2_3_NTD4_NEPBS16_SU16_SUM0_SUS256_SVW2_VWA2_VWB1_WG32_8_1_WGM6_WGMXCC8_WGMXCCG304
    SolutionIndex: 304
    SolutionNameMin: Cijk_Alik_Bljk_F8NHS_BH_BiasSH_HAS_SAB_SAV_UserArgs_MT160x192x128_MI16x16x1_SN_LDSB1_GRVWA16_GRVWB16_GSU5_GSUAMB_GSUC0_GSUWGMRR0_K1_LBSPPA128_LBSPPB256_LPA32_LPB32_LRVW16_MIWT5_6_NTD0_NEPBS16_SU0_SUM0_SUS0_SVW1_VWA1_VWB2_WG32_8_1_WGM1_WGMXCC1_WGMXCCG0
    SolutionIndex: 305
    SolutionNameMin: Cijk_Alik_Bljk_F8NHS_BH_BiasSH_HAS_SAB_SAV_UserArgs_MT128x64x256_MI16x16x1_SN_LDSB1_GRVWA16_GRVWB16_GSU1_GSUAMB_GSUC0_GSUWGMRR0_K1_LBSPPA1024_LBSPPB512_LPA32_LPB32_LRVW16_MIWT4_2_NTD4_NEPBS16_SU16_SUM0_SUS256_SVW4_VWA4_VWB2_WG32_8_1_WGM6_WGMXCC8_WGMXCCG304
    SolutionIndex: 306
    SolutionNameMin: Cijk_Alik_Bljk_F8NHS_BH_BiasSH_HAS_SAB_SAV_UserArgs_MT128x64x256_MI16x16x1_SN_LDSB1_GRVWA16_GRVWB16_GSU1_GSUAMB_GSUC0_GSUWGMRR0_K1_LBSPPA512_LBSPPB1024_LPA32_LPB32_LRVW16_MIWT2_4_NTB0_NTD4_NEPBS16_SU16_SUM0_SUS256_SVW2_VWA2_VWB4_WG64_4_1_WGM6_WGMXCC8_WGMXCCG304
    SolutionIndex: 307
    SolutionNameMin: Cijk_Alik_Bljk_F8NHS_BH_BiasSH_HAS_SAB_SAV_UserArgs_MT128x96x256_MI16x16x1_SN_LDSB1_GRVWA16_GRVWB16_GSU1_GSUAMB_GSUC0_GSUWGMRR0_K1_LBSPPA1024_LBSPPB256_LPA32_LPB32_LRVW16_MIWT4_3_NTB0_NTD4_NEPBS16_SU16_SUM0_SUS256_SVW4_VWA4_VWB1_WG32_8_1_WGM6_WGMXCC8_WGMXCCG304
    SolutionIndex: 308
    SolutionNameMin: Cijk_Alik_Bljk_F8NHS_BH_BiasSH_HAS_SAB_SAV_UserArgs_MT128x96x256_MI16x16x1_SN_LDSB1_GRVWA16_GRVWB16_GSU1_GSUC0_GSUWGMRR0_K1_LBSPPA1024_LBSPPB256_LPA32_LPB32_LRVW16_MIWT4_3_SU16_SUM0_SUS256_SVW4_VWA4_VWB1_WG32_8_1_WGM8_WGMXCC8_WGMXCCG304
    SolutionIndex: 309
    SolutionNameMin: Cijk_Alik_Bljk_F8NHS_BH_BiasSH_HAS_SAB_SAV_UserArgs_MT112x128x128_MI16x16x1_SN_LDSB1_GRVWA8_GRVWB16_GSU1_GSUAMB_GSUC0_GSUWGMRR0_K1_LBSPPA128_LBSPPB256_LPA32_LPB32_LRVW16_MIWT7_2_NTD4_NEPBS16_SU16_SUM0_SUS128_SVW1_VWA1_VWB2_WG16_16_1_WGM6_WGMXCC8_WGMXCCG304
    SolutionIndex: 310
    SolutionNameMin: Cijk_Alik_Bljk_F8NHS_BH_BiasSH_HAS_SAB_SAV_UserArgs_MT128x128x128_MI16x16x1_SN_LDSB1_GRVWA16_GRVWB16_GSU1_GSUAMB_GSUC0_GSUWGMRR0_K1_LBSPPA512_LBSPPB512_LPA32_LPB32_LRVW16_MIWT4_4_NTB0_NTD4_NEPBS16_SU16_SUM0_SUS128_SVW4_VWA4_VWB4_WG32_8_1_WGM6_WGMXCC8_WGMXCCG304
    SolutionIndex: 311
    SolutionNameMin: Cijk_Alik_Bljk_F8NHS_BH_BiasSH_HAS_SAB_SAV_UserArgs_MT256x128x128_MI16x16x1_SN_CLR1_GRVWA16_GRVWB16_GSU1_GSUC0_GSUWGMRR0_K1_LBSPPA1024_LBSPPB256_LPA32_LPB32_LRVW16_MIAV0_MIWT8_4_NTC4_NTD4_SU8_SUM0_SUS256_SPO1_SSO4_SVW8_TLDS1_VWA8_VWB2_WG32_8_1_WGM1_WGMXCC1_WGMXCCGn1
    SolutionIndex: 312
    SolutionNameMin: Cijk_Alik_Bljk_F8NHS_BH_BiasSH_HAS_SAB_SAV_UserArgs_MT256x256x64_MI16x16x1_SN_LDSB1_GRVWA8_GRVWB8_GSU1_GSUC0_GSUWGMRR0_K1_LBSPPA512_LBSPPB512_LPA8_LPB8_LRVW8_MIWT8_8_SU16_SUM0_SUS64_SVW8_VWA8_VWB8_WG32_8_1_WGM8_WGMXCC8_WGMXCCG304
    SolutionIndex: 313
    SolutionNameMin: Cijk_Alik_Bljk_F8NHS_BH_BiasSH_HAS_SAB_SAV_UserArgs_MT256x224x128_MI16x16x1_SN_LDSB1_GRVWA8_GRVWB8_GSU1_LBSPPA512_LBSPPB128_LPA8_LPB8_LRVW8_MIWT4_14_NEPBS0_SU0_SUM0_SUS0_SVW4_VWA4_WG64_4_1_WGM1
    SolutionIndex: 314
    SolutionNameMin: Cijk_Alik_Bljk_F8NHS_BH_BiasSH_HAS_SAB_SAV_UserArgs_MT256x192x128_MI16x16x1_SN_LDSB1_GRVWA16_GRVWB16_GSU1_GSUAMB_GSUC0_GSUWGMRR0_K1_LBSPPA1024_LBSPPB256_LPA32_LPB32_LRVW16_MIWT8_6_NTD4_NEPBS16_SU16_SUM0_SUS128_SVW8_VWA8_VWB2_WG32_8_1_WGM6_WGMXCC8_WGMXCCG304
    SolutionIndex: 315
    SolutionNameMin: Cijk_Alik_Bljk_F8NHS_BH_BiasSH_HAS_SAB_SAV_UserArgs_MT256x224x128_MI16x16x1_SN_LDSB1_GRVWA8_GRVWB8_GSU1_GSUC0_GSUWGMRR0_K1_LBSPPA1024_LBSPPB128_LPA8_LPB8_LRVW8_MIWT8_7_NTA0_NTB0_SU8_SUM0_SUS128_SVW8_VWA8_VWB1_WG32_8_1_WGM1_WGMXCC8_WGMXCCG304
    SolutionIndex: 316
    SolutionNameMin: Cijk_Alik_Bljk_F8NHS_BH_BiasSH_HAS_SAB_SAV_UserArgs_MT32x32x256_MI16x16x1_SN_LDSB1_GRVWA16_GRVWB16_GSU1_GSUC0_GSUWGMRR0_K1_LBSPPA256_LBSPPB256_LPA32_LPB32_LRVW16_MIWT1_1_SU16_SUM0_SUS256_SVW1_VWA1_VWB1_WG32_8_1_WGM8_WGMXCC8_WGMXCCG304
    SolutionIndex: 317
    SolutionNameMin: Cijk_Alik_Bljk_F8NHS_BH_BiasSH_HAS_SAB_SAV_UserArgs_MT32x96x256_MI16x16x1_SN_LDSB1_GRVWA16_GRVWB16_GSU1_GSUC0_GSUWGMRR0_K1_LBSPPA256_LBSPPB256_LPA32_LPB32_LRVW16_MIWT1_3_SU16_SUM0_SUS256_SVW1_VWA1_VWB1_WG32_8_1_WGM8_WGMXCC8_WGMXCCG304
    SolutionIndex: 318
    SolutionNameMin: Cijk_Alik_Bljk_F8NHS_BH_BiasSH_HAS_SAB_SAV_UserArgs_MT128x64x256_MI16x16x1_SN_LDSB1_GRVWA16_GRVWB16_GSU2_GSUAMBSK_GSUC0_GSUWGMRR0_K1_LBSPPA1024_LBSPPB512_LPA32_LPB32_LRVW16_MIWT4_2_NTB0_NTD0_NEPBS0_SU0_SUM0_SUS0_SVW4_VWA4_VWB2_WG32_8_1_WGM1_WGMXCC1_WGMXCCG0
    SolutionIndex: 319
    SolutionNameMin: Cijk_Alik_Bljk_F8NHS_BH_BiasSH_HAS_SAB_SAV_UserArgs_MT64x96x256_MI16x16x1_SN_LDSB1_GRVWA16_GRVWB16_GSU1_LBSPPA512_LBSPPB256_LPA32_LPB32_LRVW16_MIWT2_3_NEPBS0_SU0_SUM0_SUS0_SVW2_VWA2_WG32_8_1_WGM1
    SolutionIndex: 320
    SolutionNameMin: Cijk_Alik_Bljk_F8NHS_BH_BiasSH_HAS_SAB_SAV_UserArgs_MT128x96x256_MI16x16x1_SN_LDSB1_GRVWA16_GRVWB16_GSU2_GSUAMBSK_GSUC0_GSUWGMRR0_K1_LBSPPA1024_LBSPPB256_LPA32_LPB32_LRVW16_MIWT4_3_NTB0_NTD0_NEPBS0_SU0_SUM0_SUS0_SVW4_VWA4_VWB1_WG32_8_1_WGM1_WGMXCC1_WGMXCCG0
    SolutionIndex: 321
    SolutionNameMin: Cijk_Alik_Bljk_F8NHS_BH_BiasSH_HAS_SAB_SAV_UserArgs_MT64x96x128_MI16x16x1_SN_LDSB1_GRVWA16_GRVWB16_GSU1_GSUC0_GSUWGMRR0_K1_LBSPPA256_LBSPPB128_LPA32_LPB32_LRVW16_MIWT2_3_SU16_SUM0_SUS128_SVW2_VWA2_VWB1_WG32_8_1_WGM8_WGMXCC8_WGMXCCG304
    SolutionIndex: 322
    SolutionNameMin: Cijk_Alik_Bljk_F8NHS_BH_BiasSH_HAS_SAB_SAV_UserArgs_MT128x96x256_MI16x16x1_SN_LDSB1_GRVWA16_GRVWB16_GSU1_GSUC0_GSUWGMRR0_K1_LBSPPA1024_LBSPPB256_LPA32_LPB32_LRVW16_MIWT4_3_NTB0_SU16_SUM0_SUS256_SVW4_VWA4_VWB1_WG32_8_1_WGM8_WGMXCC8_WGMXCCG304
    SolutionIndex: 323
    SolutionNameMin: Cijk_Alik_Bljk_F8NHS_BH_BiasSH_HAS_SAB_SAV_UserArgs_MT96x128x256_MI16x16x1_SN_LDSB1_GRVWA16_GRVWB16_GSU1_GSUC0_GSUWGMRR0_K1_LBSPPA256_LBSPPB1024_LPA32_LPB32_LRVW16_MIWT3_4_SU16_SUM0_SUS256_SVW1_VWA1_VWB4_WG32_8_1_WGM8_WGMXCC8_WGMXCCG304
    SolutionIndex: 324
    SolutionNameMin: Cijk_Alik_Bljk_F8NHS_BH_BiasSH_HAS_SAB_SAV_UserArgs_MT128x128x128_MI16x16x1_SN_LDSB1_GRVWA16_GRVWB16_GSU1_GSUAMB_GSUC0_GSUWGMRR0_K1_LBSPPA1024_LBSPPB256_LPA32_LPB32_LRVW16_MIWT8_2_NTB0_NTD4_NEPBS16_SU16_SUM0_SUS128_SVW8_VWA8_VWB2_WG16_16_1_WGM6_WGMXCC8_WGMXCCG304
    SolutionIndex: 325
    SolutionNameMin: Cijk_Alik_Bljk_F8NHS_BH_BiasSH_HAS_SAB_SAV_UserArgs_MT112x128x256_MI16x16x1_SN_LDSB1_GRVWA8_GRVWB8_GSU1_GSUC0_GSUWGMRR0_K1_LBSPPA256_LBSPPB512_LPA8_LPB8_LRVW8_MIWT7_2_SU16_SUM0_SUS256_SVW1_VWA1_VWB2_WG16_16_1_WGM8_WGMXCC8_WGMXCCG304
    SolutionIndex: 326
    SolutionNameMin: Cijk_Alik_Bljk_F8NHS_BH_BiasSH_HAS_SAB_SAV_UserArgs_MT128x96x128_MI16x16x1_SN_LDSB1_GRVWA16_GRVWB16_GSU1_GSUC0_GSUWGMRR0_K1_LBSPPA512_LBSPPB128_LPA32_LPB32_LRVW16_MIWT4_3_SU16_SUM0_SUS128_SVW4_VWA4_VWB1_WG32_8_1_WGM8_WGMXCC8_WGMXCCG304
    SolutionIndex: 327
    SolutionNameMin: Cijk_Alik_Bljk_F8NHS_BH_BiasSH_HAS_SAB_SAV_UserArgs_MT128x96x128_MI16x16x1_SN_LDSB1_GRVWA16_GRVWB16_GSU1_GSUC0_GSUWGMRR0_K1_LBSPPA512_LBSPPB128_LPA32_LPB32_LRVW16_MIWT4_3_SU16_SUM0_SUS128_SVW4_VWA4_VWB1_WG32_8_1_WGM8_WGMXCC8_WGMXCCG304
    SolutionIndex: 328
    SolutionNameMin: Cijk_Alik_Bljk_F8NHS_BH_BiasSH_HAS_SAB_SAV_UserArgs_MT128x192x128_MI16x16x1_SN_LDSB1_GRVWA16_GRVWB16_GSU1_GSUC0_GSUWGMRR0_K1_LBSPPA1024_LBSPPB128_LPA32_LPB32_LRVW16_MIWT8_3_NTB0_SU8_SUM1_SUS128_SVW8_VWA8_VWB1_WG16_16_1_WGM6_WGMXCC8_WGMXCCG304
    SolutionIndex: 329
    SolutionNameMin: Cijk_Alik_Bljk_F8NHS_BH_BiasSH_HAS_SAB_SAV_UserArgs_MT192x128x128_MI16x16x1_SN_LDSB1_GRVWA16_GRVWB16_GSU1_GSUC0_GSUWGMRR0_K1_LBSPPA256_LBSPPB512_LPA32_LPB32_LRVW16_MIWT6_4_NTB0_SU16_SUM0_SUS128_SVW2_VWA2_VWB4_WG32_8_1_WGM8_WGMXCC8_WGMXCCG304
    SolutionIndex: 330
    SolutionNameMin: Cijk_Alik_Bljk_F8NHS_BH_BiasSH_HAS_SAB_SAV_UserArgs_MT256x128x64_MI16x16x1_SN_LDSB1_GRVWA8_GRVWB8_GSU1_GSUC0_GSUWGMRR0_K1_LBSPPA512_LBSPPB256_LPA8_LPB8_LRVW8_MIWT8_4_SU8_SUM1_SUS64_SVW8_VWA8_VWB4_WG32_8_1_WGM6_WGMXCC8_WGMXCCG304
    SolutionIndex: 331
    SolutionNameMin: Cijk_Alik_Bljk_F8NHS_BH_BiasSH_HAS_SAB_SAV_UserArgs_MT128x256x128_MI16x16x1_SN_LDSB1_GRVWA16_GRVWB16_GSU1_GSUC0_GSUWGMRR0_K1_LBSPPA1024_LBSPPB512_LPA32_LPB32_LRVW16_MIWT8_4_SU8_SUM1_SUS128_SVW8_VWA8_VWB4_WG16_16_1_WGM6_WGMXCC8_WGMXCCG304
    SolutionIndex: 332
    SolutionNameMin: Cijk_Alik_Bljk_F8NHS_BH_BiasSH_HAS_SAB_SAV_UserArgs_MT128x256x128_MI16x16x1_SN_LDSB1_GRVWA16_GRVWB16_GSU1_GSUC0_GSUWGMRR0_K1_LBSPPA1024_LBSPPB512_LPA32_LPB32_LRVW16_MIWT8_4_NTB0_SU8_SUM1_SUS128_SVW8_VWA8_VWB4_WG16_16_1_WGM6_WGMXCC8_WGMXCCG304
    SolutionIndex: 333
    SolutionNameMin: Cijk_Alik_Bljk_F8NHS_BH_BiasSH_HAS_SAB_SAV_UserArgs_MT224x128x128_MI16x16x1_SN_LDSB1_GRVWA16_GRVWB16_GSU1_GSUC0_GSUWGMRR0_K1_LBSPPA128_LBSPPB512_LPA32_LPB32_LRVW16_MIWT7_4_NTB0_SU16_SUM0_SUS128_SVW1_VWA1_VWB4_WG32_8_1_WGM8_WGMXCC8_WGMXCCG304
    SolutionIndex: 334
    SolutionNameMin: Cijk_Alik_Bljk_F8NHS_BH_BiasSH_HAS_SAB_SAV_UserArgs_MT128x160x64_MI16x16x1_SN_LDSB1_GRVWA8_GRVWB8_GSU1_GSUC0_GSUWGMRR0_K1_LBSPPA256_LBSPPB128_LPA8_LPB8_LRVW8_MIWT4_5_NTB0_SU16_SUM0_SUS64_SVW4_VWA4_VWB1_WG32_8_1_WGM8_WGMXCC8_WGMXCCG304
    SolutionIndex: 335
    SolutionNameMin: Cijk_Alik_Bljk_F8NHS_BH_BiasSH_HAS_SAB_SAV_UserArgs_MT224x256x128_MI16x16x1_SN_LDSB1_GRVWA8_GRVWB8_GSU1_GSUC0_GSUWGMRR0_K1_LBSPPA256_LBSPPB512_LPA8_LPB8_LRVW8_MIWT14_4_NTB0_SU16_SUM0_SUS128_SVW2_VWA2_VWB4_WG16_16_1_WGM8_WGMXCC8_WGMXCCG304
    SolutionIndex: 336
    SolutionNameMin: Cijk_Alik_Bljk_F8NHS_BH_BiasSH_HAS_SAB_SAV_UserArgs_MT128x256x64_MI16x16x1_SN_LDSB1_GRVWA8_GRVWB8_GSU1_GSUC0_GSUWGMRR0_K1_LBSPPA512_LBSPPB256_LPA8_LPB8_LRVW8_MIWT8_4_NTB0_SU8_SUM1_SUS64_SVW8_VWA8_VWB4_WG16_16_1_WGM6_WGMXCC8_WGMXCCG304
    SolutionIndex: 337
    SolutionNameMin: Cijk_Alik_Bljk_F8NHS_BH_BiasSH_HAS_SAB_SAV_UserArgs_MT256x160x128_MI16x16x1_SN_LDSB1_GRVWA16_GRVWB16_GSU1_GSUAMB_GSUC0_GSUWGMRR0_K1_LBSPPA512_LBSPPB256_LPA32_LPB32_LRVW16_MIWT4_10_NTB4_NTD4_NEPBS16_SU16_SUM0_SUS128_SVW4_VWA4_VWB2_WG64_4_1_WGM6_WGMXCC8_WGMXCCG304
    SolutionIndex: 338
    SolutionNameMin: Cijk_Alik_Bljk_F8NHS_BH_BiasSH_HAS_SAB_SAV_UserArgs_MT128x160x64_MI16x16x1_SN_LDSB1_GRVWA8_GRVWB8_GSU1_GSUC0_GSUWGMRR0_K1_LBSPPA256_LBSPPB128_LPA8_LPB8_LRVW8_MIWT4_5_SU16_SUM0_SUS64_SVW4_VWA4_VWB1_WG32_8_1_WGM8_WGMXCC8_WGMXCCG304
    SolutionIndex: 339
    SolutionNameMin: Cijk_Alik_Bljk_F8NHS_BH_BiasSH_HAS_SAB_SAV_UserArgs_MT64x16x128_MI16x16x1_SN_LDSB0_GRVWA16_GRVWB8_GSU1_GSUC0_GSUWGMRR0_K1_LBSPPA128_LBSPPB128_LPA32_LPB32_LRVW16_MIWT1_1_NTA4_NTB0_SU8_SUM0_SUS128_SVW1_VWA1_VWB1_WG64_4_1_WGM1_WGMXCC8_WGMXCCG304
    SolutionIndex: 340
    SolutionNameMin: Cijk_Alik_Bljk_F8NHS_BH_BiasSH_HAS_SAB_SAV_UserArgs_MT32x32x256_MI16x16x1_SN_LDSB1_GRVWA16_GRVWB16_GSU1_GSUAMB_GSUC0_GSUWGMRR0_K1_LBSPPA256_LBSPPB256_LPA32_LPB32_LRVW16_MIWT1_1_NTD4_NEPBS16_SU16_SUM0_SUS256_SVW1_VWA1_VWB1_WG32_8_1_WGM6_WGMXCC8_WGMXCCG304
    SolutionIndex: 341
    SolutionNameMin: Cijk_Alik_Bljk_F8NHS_BH_BiasSH_HAS_SAB_SAV_UserArgs_MT192x16x256_MI16x16x1_SN_LDSB1_GRVWA16_GRVWB16_GSU3_GSUAMB_GSUC0_GSUWGMRR0_K1_LBSPPA256_LBSPPB256_LPA32_LPB32_LRVW16_MIWT3_1_NTD0_NEPBS16_SU0_SUM0_SUS0_SVW1_VWA1_VWB1_WG64_4_1_WGM1_WGMXCC1_WGMXCCG0
    SolutionIndex: 342
    SolutionNameMin: Cijk_Alik_Bljk_F8NHS_BH_BiasSH_HAS_SAB_SAV_UserArgs_MT64x64x256_MI16x16x1_SN_LDSB1_GRVWA16_GRVWB16_GSU1_GSUC0_GSUWGMRR0_K1_LBSPPA512_LBSPPB512_LPA32_LPB32_LRVW16_MIWT2_2_NTA4_NTB0_SU8_SUM0_SUS256_SVW2_VWA2_VWB2_WG32_8_1_WGM1_WGMXCC8_WGMXCCG304
    SolutionIndex: 343
    SolutionNameMin: Cijk_Alik_Bljk_F8NHS_BH_BiasSH_HAS_SAB_SAV_UserArgs_MT64x96x128_MI16x16x1_SN_LDSB1_GRVWA16_GRVWB16_GSU1_GSUC0_GSUWGMRR0_K1_LBSPPA256_LBSPPB128_LPA32_LPB32_LRVW16_MIWT2_3_NTA4_NTB0_SU8_SUM0_SUS128_SVW2_VWA2_VWB1_WG32_8_1_WGM1_WGMXCC8_WGMXCCG304
    SolutionIndex: 344
    SolutionNameMin: Cijk_Alik_Bljk_F8NHS_BH_BiasSH_HAS_SAB_SAV_UserArgs_MT64x96x256_MI16x16x1_SN_LDSB1_GRVWA16_GRVWB16_GSU1_GSUC0_GSUWGMRR0_K1_LBSPPA512_LBSPPB256_LPA32_LPB32_LRVW16_MIWT2_3_NTB0_SU16_SUM0_SUS256_SVW2_VWA2_VWB1_WG32_8_1_WGM8_WGMXCC8_WGMXCCG304
    SolutionIndex: 345
    SolutionNameMin: Cijk_Alik_Bljk_F8NHS_BH_BiasSH_HAS_SAB_SAV_UserArgs_MT64x96x256_MI16x16x1_SN_LDSB1_GRVWA16_GRVWB16_GSU1_GSUC0_GSUWGMRR0_K1_LBSPPA512_LBSPPB256_LPA32_LPB32_LRVW16_MIWT2_3_SU16_SUM0_SUS256_SVW2_VWA2_VWB1_WG32_8_1_WGM8_WGMXCC8_WGMXCCG304
    SolutionIndex: 346
    SolutionNameMin: Cijk_Alik_Bljk_F8NHS_BH_BiasSH_HAS_SAB_SAV_UserArgs_MT64x128x256_MI16x16x1_SN_LDSB1_GRVWA16_GRVWB16_GSU1_GSUC0_GSUWGMRR0_K1_LBSPPA1024_LBSPPB512_LPA32_LPB32_LRVW16_MIWT4_2_SU16_SUM0_SUS256_SVW4_VWA4_VWB2_WG16_16_1_WGM8_WGMXCC8_WGMXCCG304
    SolutionIndex: 347
    SolutionNameMin: Cijk_Alik_Bljk_F8NHS_BH_BiasSH_HAS_SAB_SAV_UserArgs_MT128x96x256_MI16x16x1_SN_LDSB1_GRVWA16_GRVWB16_GSU1_GSUAMB_GSUC0_GSUWGMRR0_K1_LBSPPA1024_LBSPPB256_LPA32_LPB32_LRVW16_MIWT4_3_NTD4_NEPBS16_SU16_SUM0_SUS256_SVW4_VWA4_VWB1_WG32_8_1_WGM6_WGMXCC8_WGMXCCG304
    SolutionIndex: 348
    SolutionNameMin: Cijk_Alik_Bljk_F8NHS_BH_BiasSH_HAS_SAB_SAV_UserArgs_MT64x128x128_MI16x16x1_SN_LDSB1_GRVWA16_GRVWB16_GSU1_GSUC0_GSUWGMRR0_K1_LBSPPA512_LBSPPB256_LPA32_LPB32_LRVW16_MIWT4_2_NTA4_NTB0_SU8_SUM0_SUS128_SVW4_VWA4_VWB2_WG16_16_1_WGM1_WGMXCC8_WGMXCCG304
    SolutionIndex: 349
    SolutionNameMin: Cijk_Alik_Bljk_F8NHS_BH_BiasSH_HAS_SAB_SAV_UserArgs_MT128x128x128_MI16x16x1_SN_LDSB1_GRVWA16_GRVWB16_GSU1_GSUC0_GSUWGMRR0_K1_LBSPPA1024_LBSPPB256_LPA32_LPB32_LRVW16_MIWT8_2_NTB0_SU16_SUM0_SUS128_SVW8_VWA8_VWB2_WG16_16_1_WGM8_WGMXCC8_WGMXCCG304
    SolutionIndex: 350
    SolutionNameMin: Cijk_Alik_Bljk_F8NHS_BH_BiasSH_HAS_SAB_SAV_UserArgs_MT64x256x128_MI16x16x1_SN_LDSB1_GRVWA16_GRVWB16_GSU1_GSUC0_GSUWGMRR0_K1_LBSPPA512_LBSPPB512_LPA32_LPB32_LRVW16_MIWT4_4_NTB0_SU16_SUM0_SUS128_SVW4_VWA4_VWB4_WG16_16_1_WGM8_WGMXCC8_WGMXCCG304
    SolutionIndex: 351
    SolutionNameMin: Cijk_Alik_Bljk_F8NHS_BH_BiasSH_HAS_SAB_SAV_UserArgs_MT128x192x128_MI16x16x1_SN_LDSB1_GRVWA16_GRVWB16_GSU1_GSUC0_GSUWGMRR0_K1_LBSPPA512_LBSPPB256_LPA32_LPB32_LRVW16_MIWT4_6_SU8_SUM1_SUS128_SVW4_VWA4_VWB2_WG32_8_1_WGM6_WGMXCC8_WGMXCCG304
    SolutionIndex: 352
    SolutionNameMin: Cijk_Alik_Bljk_F8NHS_BH_BiasSH_HAS_SAB_SAV_UserArgs_MT128x192x128_MI16x16x1_SN_LDSB1_GRVWA16_GRVWB16_GSU1_GSUC0_GSUWGMRR0_K1_LBSPPA1024_LBSPPB128_LPA32_LPB32_LRVW16_MIWT8_3_NTB0_SU16_SUM0_SUS128_SVW8_VWA8_VWB1_WG16_16_1_WGM8_WGMXCC8_WGMXCCG304
    SolutionIndex: 353
    SolutionNameMin: Cijk_Alik_Bljk_F8NHS_BH_BiasSH_HAS_SAB_SAV_UserArgs_MT128x128x64_MI16x16x1_SN_LDSB1_GRVWA8_GRVWB8_GSU1_GSUC0_GSUWGMRR0_K1_LBSPPA256_LBSPPB256_LPA8_LPB8_LRVW8_MIWT4_4_SU16_SUM0_SUS64_SVW4_VWA4_VWB4_WG32_8_1_WGM8_WGMXCC8_WGMXCCG304
    SolutionIndex: 354
    SolutionNameMin: Cijk_Alik_Bljk_F8NHS_BH_BiasSH_HAS_SAB_SAV_UserArgs_MT224x128x128_MI16x16x1_SN_LDSB1_GRVWA16_GRVWB16_GSU1_GSUC0_GSUWGMRR0_K1_LBSPPA128_LBSPPB512_LPA32_LPB32_LRVW16_MIWT7_4_SU8_SUM1_SUS128_SVW1_VWA1_VWB4_WG32_8_1_WGM6_WGMXCC8_WGMXCCG304
    SolutionIndex: 355
    SolutionNameMin: Cijk_Alik_Bljk_F8NHS_BH_BiasSH_HAS_SAB_SAV_UserArgs_MT224x128x128_MI16x16x1_SN_LDSB1_GRVWA16_GRVWB16_GSU1_GSUC0_GSUWGMRR0_K1_LBSPPA128_LBSPPB512_LPA32_LPB32_LRVW16_MIWT7_4_NTB0_SU8_SUM1_SUS128_SVW1_VWA1_VWB4_WG32_8_1_WGM6_WGMXCC8_WGMXCCG304
    SolutionIndex: 356
    SolutionNameMin: Cijk_Alik_Bljk_F8NHS_BH_BiasSH_HAS_SAB_SAV_UserArgs_MT256x192x128_MI16x16x1_SN_LDSB1_GRVWA16_GRVWB16_GSU1_GSUC0_GSUWGMRR0_K1_LBSPPA1024_LBSPPB256_LPA32_LPB32_LRVW16_MIWT8_6_NTB0_SU16_SUM0_SUS128_SVW8_VWA8_VWB2_WG32_8_1_WGM8_WGMXCC8_WGMXCCG304
    SolutionIndex: 357
    SolutionNameMin: Cijk_Alik_Bljk_F8NHS_BH_BiasSH_HAS_SAB_SAV_UserArgs_MT192x256x128_MI16x16x1_SN_LDSB1_GRVWA16_GRVWB16_GSU1_GSUC0_GSUWGMRR0_K1_LBSPPA128_LBSPPB2048_LPA32_LPB32_LRVW16_MIWT3_16_SU8_SUM1_SUS128_SVW1_VWA1_VWB16_WG64_4_1_WGM6_WGMXCC8_WGMXCCG304
    SolutionIndex: 358
    SolutionNameMin: Cijk_Alik_Bljk_F8NHS_BH_BiasSH_HAS_SAB_SAV_UserArgs_MT128x256x64_MI16x16x1_SN_LDSB1_GRVWA8_GRVWB8_GSU1_GSUC0_GSUWGMRR0_K1_LBSPPA512_LBSPPB256_LPA8_LPB8_LRVW8_MIWT8_4_SU16_SUM0_SUS64_SVW8_VWA8_VWB4_WG16_16_1_WGM8_WGMXCC8_WGMXCCG304
    SolutionIndex: 359
    SolutionNameMin: Cijk_Alik_Bljk_F8NHS_BH_BiasSH_HAS_SAB_SAV_UserArgs_MT512x128x64_MI16x16x1_SN_LDSB1_GRVWA8_GRVWB8_GSU1_GSUC0_GSUWGMRR0_K1_LBSPPA512_LBSPPB512_LPA8_LPB8_LRVW8_MIWT8_8_NTB0_SU16_SUM0_SUS64_SVW8_VWA8_VWB8_WG64_4_1_WGM8_WGMXCC8_WGMXCCG304
    SolutionIndex: 360
    SolutionNameMin: Cijk_Alik_Bljk_F8NHS_BH_BiasSH_HAS_SAB_SAV_UserArgs_MT224x256x128_MI16x16x1_SN_LDSB1_GRVWA8_GRVWB8_GSU1_GSUC0_GSUWGMRR0_K1_LBSPPA128_LBSPPB1024_LPA8_LPB8_LRVW8_MIWT7_8_NTB0_SU8_SUM1_SUS128_SVW1_VWA1_VWB8_WG32_8_1_WGM6_WGMXCC8_WGMXCCG304
    SolutionIndex: 361
    SolutionNameMin: Cijk_Alik_Bljk_F8NHS_BH_BiasSH_HAS_SAB_SAV_UserArgs_MT224x256x128_MI16x16x1_SN_LDSB1_GRVWA8_GRVWB8_GSU1_GSUC0_GSUWGMRR0_K1_LBSPPA256_LBSPPB512_LPA8_LPB8_LRVW8_MIWT14_4_NTB0_SU8_SUM1_SUS128_SVW2_VWA2_VWB4_WG16_16_1_WGM6_WGMXCC8_WGMXCCG304
    SolutionIndex: 362
    SolutionNameMin: Cijk_Alik_Bljk_F8NHS_BH_BiasSH_HAS_SAB_SAV_UserArgs_MT256x160x128_MI16x16x1_SN_LDSB1_GRVWA16_GRVWB16_GSU1_GSUC0_GSUWGMRR0_K1_LBSPPA512_LBSPPB256_LPA32_LPB32_LRVW16_MIWT4_10_SU16_SUM0_SUS128_SVW4_VWA4_VWB2_WG64_4_1_WGM8_WGMXCC8_WGMXCCG304
    SolutionIndex: 363
    SolutionNameMin: Cijk_Alik_Bljk_F8NHS_BH_BiasSH_HAS_SAB_SAV_UserArgs_MT256x192x128_MI16x16x1_SN_LDSB1_GRVWA16_GRVWB16_GSU1_GSUC0_GSUWGMRR0_K1_LBSPPA1024_LBSPPB256_LPA32_LPB32_LRVW16_MIWT8_6_SU16_SUM0_SUS128_SVW8_VWA8_VWB2_WG32_8_1_WGM8_WGMXCC8_WGMXCCG304
    SolutionIndex: 364
    SolutionNameMin: Cijk_Alik_Bljk_F8NHS_BH_BiasSH_HAS_SAB_SAV_UserArgs_MT64x32x128_MI16x16x1_SN_LDSB0_GRVWA16_GRVWB16_GSU1_GSUC0_GSUWGMRR0_K1_LBSPPA256_LBSPPB128_LPA32_LPB32_LRVW16_MIWT2_1_NTA4_NTB0_SU8_SUM0_SUS128_SVW2_VWA2_VWB1_WG32_8_1_WGM1_WGMXCC8_WGMXCCG304
    SolutionIndex: 365
    SolutionNameMin: Cijk_Alik_Bljk_F8NHS_BH_BiasSH_HAS_SAB_SAV_UserArgs_MT48x64x256_MI16x16x1_SN_LDSB1_GRVWA16_GRVWB16_GSU1_GSUC0_GSUWGMRR0_K1_LBSPPA256_LBSPPB256_LPA32_LPB32_LRVW16_MIWT3_1_NTA4_NTB0_SU8_SUM0_SUS256_SVW1_VWA1_VWB1_WG16_16_1_WGM1_WGMXCC8_WGMXCCG304
    SolutionIndex: 366
    SolutionNameMin: Cijk_Alik_Bljk_F8NHS_BH_BiasSH_HAS_SAB_SAV_UserArgs_MT64x64x128_MI16x16x1_SN_LDSB1_GRVWA16_GRVWB16_GSU1_GSUC0_GSUWGMRR0_K1_LBSPPA256_LBSPPB256_LPA32_LPB32_LRVW16_MIWT2_2_NTA4_NTB0_SU8_SUM0_SUS128_SVW2_VWA2_VWB2_WG32_8_1_WGM1_WGMXCC8_WGMXCCG304
    SolutionIndex: 367
    SolutionNameMin: Cijk_Alik_Bljk_F8NHS_BH_BiasSH_HAS_SAB_SAV_UserArgs_MT96x64x256_MI16x16x1_SN_LDSB1_GRVWA16_GRVWB16_GSU1_GSUC0_GSUWGMRR0_K1_LBSPPA512_LBSPPB256_LPA32_LPB32_LRVW16_MIWT6_1_SU16_SUM0_SUS256_SVW2_VWA2_VWB1_WG16_16_1_WGM8_WGMXCC8_WGMXCCG304
    SolutionIndex: 368
    SolutionNameMin: Cijk_Alik_Bljk_F8NHS_BH_BiasSH_HAS_SAB_SAV_UserArgs_MT48x64x512_MI16x16x1_SN_LDSB1_GRVWA16_GRVWB16_GSU1_GSUAMB_GSUC0_GSUWGMRR0_K1_LBSPPA512_LBSPPB512_LPA32_LPB32_LRVW16_MIWT3_1_NTD4_NEPBS16_SU16_SUM0_SUS512_SVW1_VWA1_VWB1_WG16_16_1_WGM6_WGMXCC8_WGMXCCG304
    SolutionIndex: 369
    SolutionNameMin: Cijk_Alik_Bljk_F8NHS_BH_BiasSH_HAS_SAB_SAV_UserArgs_MT48x64x256_MI16x16x1_SN_LDSB1_GRVWA16_GRVWB16_GSU1_GSUC0_GSUWGMRR0_K1_LBSPPA256_LBSPPB256_LPA32_LPB32_LRVW16_MIWT3_1_SU16_SUM0_SUS256_SVW1_VWA1_VWB1_WG16_16_1_WGM8_WGMXCC8_WGMXCCG304
    SolutionIndex: 370
    SolutionNameMin: Cijk_Alik_Bljk_F8NHS_BH_BiasSH_HAS_SAB_SAV_UserArgs_MT96x96x256_MI16x16x1_SN_LDSB1_GRVWA16_GRVWB16_GSU1_GSUC0_GSUWGMRR0_K1_LBSPPA256_LBSPPB256_LPA32_LPB32_LRVW16_MIWT3_3_NTA4_NTB0_SU8_SUM0_SUS256_SVW1_VWA1_VWB1_WG32_8_1_WGM1_WGMXCC8_WGMXCCG304
    SolutionIndex: 371
    SolutionNameMin: Cijk_Alik_Bljk_F8NHS_BH_BiasSH_HAS_SAB_SAV_UserArgs_MT64x64x128_MI16x16x1_SN_LDSB1_GRVWA16_GRVWB16_GSU1_GSUC0_GSUWGMRR0_K1_LBSPPA512_LBSPPB128_LPA32_LPB32_LRVW16_MIWT4_1_SU16_SUM0_SUS128_SVW4_VWA4_VWB1_WG16_16_1_WGM8_WGMXCC8_WGMXCCG304
    SolutionIndex: 372
    SolutionNameMin: Cijk_Alik_Bljk_F8NHS_BH_BiasSH_HAS_SAB_SAV_UserArgs_MT96x128x256_MI16x16x1_SN_LDSB1_GRVWA16_GRVWB16_GSU1_GSUC0_GSUWGMRR0_K1_LBSPPA512_LBSPPB512_LPA32_LPB32_LRVW16_MIWT6_2_NTA0_NTB0_SU8_SUM0_SUS256_SVW2_VWA2_VWB2_WG16_16_1_WGM1_WGMXCC8_WGMXCCG304
    SolutionIndex: 373
    SolutionNameMin: Cijk_Alik_Bljk_F8NHS_BH_BiasSH_HAS_SAB_SAV_UserArgs_MT96x128x256_MI16x16x1_SN_LDSB1_GRVWA16_GRVWB16_GSU1_GSUC0_GSUWGMRR0_K1_LBSPPA512_LBSPPB512_LPA32_LPB32_LRVW16_MIWT6_2_NTA4_NTB0_SU8_SUM0_SUS256_SVW2_VWA2_VWB2_WG16_16_1_WGM1_WGMXCC8_WGMXCCG304
    SolutionIndex: 374
    SolutionNameMin: Cijk_Alik_Bljk_F8NHS_BH_BiasSH_HAS_SAB_SAV_UserArgs_MT128x64x128_MI16x16x1_SN_LDSB1_GRVWA16_GRVWB16_GSU1_GSUC0_GSUWGMRR0_K1_LBSPPA512_LBSPPB256_LPA32_LPB32_LRVW16_MIWT4_2_SU16_SUM0_SUS128_SVW4_VWA4_VWB2_WG32_8_1_WGM8_WGMXCC8_WGMXCCG304
    SolutionIndex: 375
    SolutionNameMin: Cijk_Alik_Bljk_F8NHS_BH_BiasSH_HAS_SAB_SAV_UserArgs_MT128x64x256_MI16x16x1_SN_LDSB1_GRVWA16_GRVWB16_GSU1_GSUC0_GSUWGMRR0_K1_LBSPPA1024_LBSPPB512_LPA32_LPB32_LRVW16_MIWT4_2_NTB0_SU16_SUM0_SUS256_SVW4_VWA4_VWB2_WG32_8_1_WGM8_WGMXCC8_WGMXCCG304
    SolutionIndex: 376
    SolutionNameMin: Cijk_Alik_Bljk_F8NHS_BH_BiasSH_HAS_SAB_SAV_UserArgs_MT128x96x128_MI16x16x1_SN_LDSB1_GRVWA16_GRVWB16_GSU1_GSUC0_GSUWGMRR0_K1_LBSPPA512_LBSPPB128_LPA32_LPB32_LRVW16_MIWT4_3_NTB0_SU16_SUM0_SUS128_SVW4_VWA4_VWB1_WG32_8_1_WGM8_WGMXCC8_WGMXCCG304
    SolutionIndex: 377
    SolutionNameMin: Cijk_Alik_Bljk_F8NHS_BH_BiasSH_HAS_SAB_SAV_UserArgs_MT192x128x128_MI16x16x1_SN_LDSB1_GRVWA16_GRVWB16_GSU1_GSUC0_GSUWGMRR0_K1_LBSPPA512_LBSPPB256_LPA32_LPB32_LRVW16_MIWT12_2_NTB0_SU8_SUM1_SUS128_SVW4_VWA4_VWB2_WG16_16_1_WGM6_WGMXCC8_WGMXCCG304
    SolutionIndex: 378
    SolutionNameMin: Cijk_Alik_Bljk_F8NHS_BH_BiasSH_HAS_SAB_SAV_UserArgs_MT192x128x128_MI16x16x1_SN_LDSB1_GRVWA16_GRVWB16_GSU1_GSUC0_GSUWGMRR0_K1_LBSPPA256_LBSPPB512_LPA32_LPB32_LRVW16_MIWT6_4_SU8_SUM1_SUS128_SVW2_VWA2_VWB4_WG32_8_1_WGM6_WGMXCC8_WGMXCCG304
    SolutionIndex: 379
    SolutionNameMin: Cijk_Alik_Bljk_F8NHS_BH_BiasSH_HAS_SAB_SAV_UserArgs_MT192x128x128_MI16x16x1_SN_LDSB1_GRVWA16_GRVWB16_GSU1_GSUC0_GSUWGMRR0_K1_LBSPPA256_LBSPPB512_LPA32_LPB32_LRVW16_MIWT6_4_NTB0_SU8_SUM1_SUS128_SVW2_VWA2_VWB4_WG32_8_1_WGM6_WGMXCC8_WGMXCCG304
    SolutionIndex: 380
    SolutionNameMin: Cijk_Alik_Bljk_F8NHS_BH_BiasSH_HAS_SAB_SAV_UserArgs_MT256x128x128_MI16x16x1_SN_LDSB1_GRVWA16_GRVWB16_GSU1_GSUC0_GSUWGMRR0_K1_LBSPPA512_LBSPPB1024_LPA32_LPB32_LRVW16_MIWT4_8_NTB0_SU8_SUM1_SUS128_SVW4_VWA4_VWB8_WG64_4_1_WGM6_WGMXCC8_WGMXCCG304
    SolutionIndex: 381
    SolutionNameMin: Cijk_Alik_Bljk_F8NHS_BH_BiasSH_HAS_SAB_SAV_UserArgs_MT192x192x128_MI16x16x1_SN_LDSB1_GRVWA16_GRVWB16_GSU1_GSUC0_GSUWGMRR0_K1_LBSPPA256_LBSPPB256_LPA32_LPB32_LRVW16_MIWT6_6_SU8_SUM1_SUS128_SVW2_VWA2_VWB2_WG32_8_1_WGM6_WGMXCC8_WGMXCCG304
    SolutionIndex: 382
    SolutionNameMin: Cijk_Alik_Bljk_F8NHS_BH_BiasSH_HAS_SAB_SAV_UserArgs_MT256x128x128_MI16x16x1_SN_LDSB1_GRVWA16_GRVWB16_GSU1_GSUC0_GSUWGMRR0_K1_LBSPPA1024_LBSPPB512_LPA32_LPB32_LRVW16_MIWT8_4_NTB0_SU8_SUM1_SUS128_SVW8_VWA8_VWB4_WG32_8_1_WGM6_WGMXCC8_WGMXCCG304
    SolutionIndex: 383
    SolutionNameMin: Cijk_Alik_Bljk_F8NHS_BH_BiasSH_HAS_SAB_SAV_UserArgs_MT192x256x128_MI16x16x1_SN_LDSB1_GRVWA16_GRVWB16_GSU1_GSUC0_GSUWGMRR0_K1_LBSPPA512_LBSPPB512_LPA32_LPB32_LRVW16_MIWT12_4_NTA0_NTB0_SU8_SUM0_SUS128_SVW4_VWA4_VWB4_WG16_16_1_WGM1_WGMXCC8_WGMXCCG304
    SolutionIndex: 384
    SolutionNameMin: Cijk_Alik_Bljk_F8NHS_BH_BiasSH_HAS_SAB_SAV_UserArgs_MT192x256x128_MI16x16x1_SN_LDSB1_GRVWA16_GRVWB16_GSU1_GSUC0_GSUWGMRR0_K1_LBSPPA256_LBSPPB1024_LPA32_LPB32_LRVW16_MIWT6_8_NTB0_SU8_SUM1_SUS128_SVW2_VWA2_VWB8_WG32_8_1_WGM6_WGMXCC8_WGMXCCG304
    SolutionIndex: 385
    SolutionNameMin: Cijk_Alik_Bljk_F8NHS_BH_BiasSH_HAS_SAB_SAV_UserArgs_MT128x192x64_MI16x16x1_SN_LDSB1_GRVWA8_GRVWB8_GSU1_GSUC0_GSUWGMRR0_K1_LBSPPA256_LBSPPB128_LPA8_LPB8_LRVW8_MIWT4_6_SU16_SUM0_SUS64_SVW4_VWA4_VWB2_WG32_8_1_WGM8_WGMXCC8_WGMXCCG304
    SolutionIndex: 386
    SolutionNameMin: Cijk_Alik_Bljk_F8NHS_BH_BiasSH_HAS_SAB_SAV_UserArgs_MT256x256x64_MI16x16x1_SN_LDSB1_GRVWA8_GRVWB8_GSU1_GSUC0_GSUWGMRR0_K1_LBSPPA256_LBSPPB1024_LPA8_LPB8_LRVW8_MIWT4_16_SU8_SUM1_SUS64_SVW4_VWA4_VWB16_WG64_4_1_WGM6_WGMXCC8_WGMXCCG304
    SolutionIndex: 387
    SolutionNameMin: Cijk_Alik_Bljk_F8NHS_BH_BiasSH_HAS_SAB_SAV_UserArgs_MT128x256x128_MI16x16x1_SN_LDSB1_GRVWA16_GRVWB16_GSU1_GSUC0_GSUWGMRR0_K1_LBSPPA1024_LBSPPB512_LPA32_LPB32_LRVW16_MIWT8_4_NTB0_SU8_SUM1_SUS128_SVW8_VWA8_VWB4_WG16_16_1_WGM6_WGMXCC8_WGMXCCG304
    SolutionIndex: 388
    SolutionNameMin: Cijk_Alik_Bljk_F8NHS_BH_BiasSH_HAS_SAB_SAV_UserArgs_MT192x256x128_MI16x16x1_SN_LDSB1_GRVWA16_GRVWB16_GSU1_GSUC0_GSUWGMRR0_K1_LBSPPA128_LBSPPB2048_LPA32_LPB32_LRVW16_MIWT3_16_NTB0_SU8_SUM1_SUS128_SVW1_VWA1_VWB16_WG64_4_1_WGM6_WGMXCC8_WGMXCCG304
    SolutionIndex: 389
    SolutionNameMin: Cijk_Alik_Bljk_F8NHS_BH_BiasSH_HAS_SAB_SAV_UserArgs_MT64x16x256_MI16x16x1_SN_LDSB1_GRVWA16_GRVWB16_GSU1_GSUC0_GSUWGMRR0_K1_LBSPPA256_LBSPPB256_LPA32_LPB32_LRVW16_MIWT1_1_NTA4_NTB0_SU8_SUM0_SUS256_SVW1_VWA1_VWB1_WG64_4_1_WGM1_WGMXCC8_WGMXCCG304
    SolutionIndex: 390
    SolutionNameMin: Cijk_Alik_Bljk_F8NHS_BH_BiasSH_HAS_SAB_SAV_UserArgs_MT64x48x256_MI16x16x1_SN_LDSB1_GRVWA16_GRVWB16_GSU1_GSUC0_GSUWGMRR0_K1_LBSPPA256_LBSPPB256_LPA32_LPB32_LRVW16_MIWT1_3_NTA4_NTB0_SU8_SUM0_SUS256_SVW1_VWA1_VWB1_WG64_4_1_WGM1_WGMXCC8_WGMXCCG304
    SolutionIndex: 391
    SolutionNameMin: Cijk_Alik_Bljk_F8NHS_BH_BiasSH_HAS_SAB_SAV_UserArgs_MT64x16x256_MI16x16x1_SN_LDSB1_GRVWA16_GRVWB16_GSU1_GSUC0_GSUWGMRR0_K1_LBSPPA256_LBSPPB256_LPA32_LPB32_LRVW16_MIWT1_1_SU16_SUM0_SUS256_SVW1_VWA1_VWB1_WG64_4_1_WGM8_WGMXCC8_WGMXCCG304
    SolutionIndex: 392
    SolutionNameMin: Cijk_Alik_Bljk_F8NHS_BH_BiasSH_HAS_SAB_SAV_UserArgs_MT64x32x256_MI16x16x1_SN_LDSB1_GRVWA16_GRVWB16_GSU1_GSUC0_GSUWGMRR0_K1_LBSPPA512_LBSPPB256_LPA32_LPB32_LRVW16_MIWT2_1_NTA4_NTB0_SU8_SUM0_SUS256_SVW2_VWA2_VWB1_WG32_8_1_WGM1_WGMXCC8_WGMXCCG304
    SolutionIndex: 393
    SolutionNameMin: Cijk_Alik_Bljk_F8NHS_BH_BiasSH_HAS_SAB_SAV_UserArgs_MT64x32x256_MI16x16x1_SN_LDSB1_GRVWA16_GRVWB16_GSU1_GSUAMB_GSUC0_GSUWGMRR0_K1_LBSPPA512_LBSPPB256_LPA32_LPB32_LRVW16_MIWT2_1_NTD4_NEPBS16_SU16_SUM0_SUS256_SVW2_VWA2_VWB1_WG32_8_1_WGM6_WGMXCC8_WGMXCCG304
    SolutionIndex: 394
    SolutionNameMin: Cijk_Alik_Bljk_F8NHS_BH_BiasSH_HAS_SAB_SAV_UserArgs_MT128x64x128_MI16x16x1_SN_LDSB1_GRVWA16_GRVWB16_GSU1_GSUC0_GSUWGMRR0_K1_LBSPPA512_LBSPPB256_LPA32_LPB32_LRVW16_MIWT4_2_NTA4_NTB0_SU8_SUM0_SUS128_SVW4_VWA4_VWB2_WG32_8_1_WGM1_WGMXCC8_WGMXCCG304
    SolutionIndex: 395
    SolutionNameMin: Cijk_Alik_Bljk_F8NHS_BH_BiasSH_HAS_SAB_SAV_UserArgs_MT64x64x256_MI16x16x1_SN_LDSB1_GRVWA16_GRVWB16_GSU1_GSUC0_GSUWGMRR0_K1_LBSPPA512_LBSPPB512_LPA32_LPB32_LRVW16_MIWT2_2_SU16_SUM0_SUS256_SVW2_VWA2_VWB2_WG32_8_1_WGM8_WGMXCC8_WGMXCCG304
    SolutionIndex: 396
    SolutionNameMin: Cijk_Alik_Bljk_F8NHS_BH_BiasSH_HAS_SAB_SAV_UserArgs_MT64x96x128_MI16x16x1_SN_LDSB1_GRVWA16_GRVWB16_GSU1_GSUC0_GSUWGMRR0_K1_LBSPPA256_LBSPPB128_LPA32_LPB32_LRVW16_MIWT2_3_SU16_SUM0_SUS128_SVW2_VWA2_VWB1_WG32_8_1_WGM8_WGMXCC8_WGMXCCG304
    SolutionIndex: 397
    SolutionNameMin: Cijk_Alik_Bljk_F8NHS_BH_BiasSH_HAS_SAB_SAV_UserArgs_MT128x96x256_MI16x16x1_SN_LDSB1_GRVWA16_GRVWB16_GSU1_GSUC0_GSUWGMRR0_K1_LBSPPA1024_LBSPPB256_LPA32_LPB32_LRVW16_MIWT4_3_SU16_SUM0_SUS256_SVW4_VWA4_VWB1_WG32_8_1_WGM8_WGMXCC8_WGMXCCG304
    SolutionIndex: 398
    SolutionNameMin: Cijk_Alik_Bljk_F8NHS_BH_BiasSH_HAS_SAB_SAV_UserArgs_MT64x128x128_MI16x16x1_SN_LDSB1_GRVWA16_GRVWB16_GSU1_GSUC0_GSUWGMRR0_K1_LBSPPA512_LBSPPB256_LPA32_LPB32_LRVW16_MIWT4_2_NTB0_SU16_SUM0_SUS128_SVW4_VWA4_VWB2_WG16_16_1_WGM8_WGMXCC8_WGMXCCG304
    SolutionIndex: 399
    SolutionNameMin: Cijk_Alik_Bljk_F8NHS_BH_BiasSH_HAS_SAB_SAV_UserArgs_MT128x128x128_MI16x16x1_SN_LDSB1_GRVWA16_GRVWB16_GSU1_GSUAMB_GSUC0_GSUWGMRR0_K1_LBSPPA1024_LBSPPB256_LPA32_LPB32_LRVW16_MIWT8_2_NTD4_NEPBS16_SU16_SUM0_SUS128_SVW8_VWA8_VWB2_WG16_16_1_WGM6_WGMXCC8_WGMXCCG304
    SolutionIndex: 400
    SolutionNameMin: Cijk_Alik_Bljk_F8NHS_BH_BiasSH_HAS_SAB_SAV_UserArgs_MT64x128x128_MI16x16x1_SN_LDSB1_GRVWA16_GRVWB16_GSU1_LBSPPA512_LBSPPB128_LPA32_LPB32_LRVW16_MIWT4_2_NEPBS16_SU0_SUM0_SUS0_SVW4_VWA4_WG16_16_1_WGM1
    SolutionIndex: 401
    SolutionNameMin: Cijk_Alik_Bljk_F8NHS_BH_BiasSH_HAS_SAB_SAV_UserArgs_MT128x128x128_MI16x16x1_SN_LDSB1_GRVWA16_GRVWB16_GSU1_GSUC0_GSUWGMRR0_K1_LBSPPA512_LBSPPB512_LPA32_LPB32_LRVW16_MIWT4_4_NTA4_NTB0_SU8_SUM0_SUS128_SVW4_VWA4_VWB4_WG32_8_1_WGM1_WGMXCC8_WGMXCCG304
    SolutionIndex: 402
    SolutionNameMin: Cijk_Alik_Bljk_F8NHS_BH_BiasSH_HAS_SAB_SAV_UserArgs_MT128x192x128_MI16x16x1_SN_LDSB1_GRVWA16_GRVWB16_GSU1_GSUC0_GSUWGMRR0_K1_LBSPPA512_LBSPPB256_LPA32_LPB32_LRVW16_MIWT4_6_NTA4_NTB0_SU8_SUM0_SUS128_SVW4_VWA4_VWB2_WG32_8_1_WGM1_WGMXCC8_WGMXCCG304
    SolutionIndex: 403
    SolutionNameMin: Cijk_Alik_Bljk_F8NHS_BH_BiasSH_HAS_SAB_SAV_UserArgs_MT128x256x128_MI16x16x1_SN_LDSB1_GRVWA16_GRVWB16_GSU1_GSUC0_GSUWGMRR0_K1_LBSPPA1024_LBSPPB512_LPA32_LPB32_LRVW16_MIWT8_4_NTB0_SU16_SUM0_SUS128_SVW8_VWA8_VWB4_WG16_16_1_WGM8_WGMXCC8_WGMXCCG304
    SolutionIndex: 404
    SolutionNameMin: Cijk_Alik_Bljk_F8NHS_BH_BiasSH_HAS_SAB_SAV_UserArgs_MT128x256x128_MI16x16x1_SN_LDSB1_GRVWA16_GRVWB16_GSU1_GSUAMB_GSUC0_GSUWGMRR0_K1_LBSPPA1024_LBSPPB512_LPA32_LPB32_LRVW16_MIWT8_4_NTD4_NEPBS16_SU16_SUM0_SUS128_SVW8_VWA8_VWB4_WG16_16_1_WGM6_WGMXCC8_WGMXCCG304
    SolutionIndex: 405
    SolutionNameMin: Cijk_Alik_Bljk_F8NHS_BH_BiasSH_HAS_SAB_SAV_UserArgs_MT224x192x128_MI16x16x1_SN_LDSB1_GRVWA16_GRVWB16_GSU1_GSUC0_GSUWGMRR0_K1_LBSPPA128_LBSPPB256_LPA32_LPB32_LRVW16_MIWT7_6_NTB0_SU8_SUM1_SUS128_SVW1_VWA1_VWB2_WG32_8_1_WGM6_WGMXCC8_WGMXCCG304
    SolutionIndex: 406
    SolutionNameMin: Cijk_Alik_Bljk_F8NHS_BH_BiasSH_HAS_SAB_SAV_UserArgs_MT224x192x128_MI16x16x1_SN_LDSB1_GRVWA16_GRVWB16_GSU1_GSUC0_GSUWGMRR0_K1_LBSPPA128_LBSPPB256_LPA32_LPB32_LRVW16_MIWT7_6_SU8_SUM1_SUS128_SVW1_VWA1_VWB2_WG32_8_1_WGM6_WGMXCC8_WGMXCCG304
    SolutionIndex: 407
    SolutionNameMin: Cijk_Alik_Bljk_F8NHS_BH_BiasSH_HAS_SAB_SAV_UserArgs_MT224x192x128_MI16x16x1_SN_LDSB1_GRVWA16_GRVWB16_GSU1_GSUC0_GSUWGMRR0_K1_LBSPPA128_LBSPPB256_LPA32_LPB32_LRVW16_MIWT7_6_NTB0_SU16_SUM0_SUS128_SVW1_VWA1_VWB2_WG32_8_1_WGM8_WGMXCC8_WGMXCCG304
    SolutionIndex: 408
    SolutionNameMin: Cijk_Alik_Bljk_F8NHS_BH_BiasSH_HAS_SAB_SAV_UserArgs_MT128x256x64_MI16x16x1_SN_LDSB1_GRVWA8_GRVWB8_GSU1_GSUC0_GSUWGMRR0_K1_LBSPPA512_LBSPPB256_LPA8_LPB8_LRVW8_MIWT8_4_SU8_SUM1_SUS64_SVW8_VWA8_VWB4_WG16_16_1_WGM6_WGMXCC8_WGMXCCG304
    SolutionIndex: 409
    SolutionNameMin: Cijk_Alik_Bljk_F8NHS_BH_BiasSH_HAS_SAB_SAV_UserArgs_MT224x256x128_MI16x16x1_SN_LDSB1_GRVWA8_GRVWB8_GSU1_GSUC0_GSUWGMRR0_K1_LBSPPA256_LBSPPB512_LPA8_LPB8_LRVW8_MIWT14_4_SU8_SUM1_SUS128_SVW2_VWA2_VWB4_WG16_16_1_WGM6_WGMXCC8_WGMXCCG304
    SolutionIndex: 410
    SolutionNameMin: Cijk_Alik_Bljk_F8NHS_BH_BiasSH_HAS_SAB_SAV_UserArgs_MT128x256x64_MI16x16x1_SN_LDSB1_GRVWA8_GRVWB8_GSU1_GSUC0_GSUWGMRR0_K1_LBSPPA256_LBSPPB512_LPA8_LPB8_LRVW8_MIWT4_8_SU8_SUM1_SUS64_SVW4_VWA4_VWB8_WG32_8_1_WGM6_WGMXCC8_WGMXCCG304
    SolutionIndex: 411
    SolutionNameMin: Cijk_Alik_Bljk_F8NHS_BH_BiasSH_HAS_SAB_SAV_UserArgs_MT128x16x128_MI16x16x1_SN_LDSB1_GRVWA16_GRVWB8_GSU1_GSUC0_GSUWGMRR0_K1_LBSPPA256_LBSPPB128_LPA32_LPB32_LRVW16_MIWT2_1_NTA4_NTB0_SU8_SUM0_SUS128_SVW2_VWA2_VWB1_WG64_4_1_WGM1_WGMXCC8_WGMXCCG304
    SolutionIndex: 412
    SolutionNameMin: Cijk_Alik_Bljk_F8NHS_BH_BiasSH_HAS_SAB_SAV_UserArgs_MT192x16x256_MI16x16x1_SN_LDSB1_GRVWA16_GRVWB16_GSU1_GSUC0_GSUWGMRR0_K1_LBSPPA256_LBSPPB256_LPA32_LPB32_LRVW16_MIWT3_1_NTA4_NTB0_SU8_SUM0_SUS256_SVW1_VWA1_VWB1_WG64_4_1_WGM1_WGMXCC8_WGMXCCG304
    SolutionIndex: 413
    SolutionNameMin: Cijk_Alik_Bljk_F8NHS_BH_BiasSH_HAS_SAB_SAV_UserArgs_MT64x32x512_MI16x16x1_SN_LDSB1_GRVWA16_GRVWB16_GSU1_GSUAMB_GSUC0_GSUWGMRR0_K1_LBSPPA1024_LBSPPB512_LPA32_LPB32_LRVW16_MIWT2_1_NTD4_NEPBS16_SU16_SUM0_SUS512_SVW2_VWA2_VWB1_WG32_8_1_WGM6_WGMXCC8_WGMXCCG304
    SolutionIndex: 414
    SolutionNameMin: Cijk_Alik_Bljk_F8NHS_BH_BiasSH_HAS_SAB_SAV_UserArgs_MT96x32x128_MI16x16x1_SN_LDSB1_GRVWA16_GRVWB16_GSU1_GSUC0_GSUWGMRR0_K1_LBSPPA128_LBSPPB128_LPA32_LPB32_LRVW16_MIWT3_1_NTA4_NTB0_SU8_SUM0_SUS128_SVW1_VWA1_VWB1_WG32_8_1_WGM1_WGMXCC8_WGMXCCG304
    SolutionIndex: 415
    SolutionNameMin: Cijk_Alik_Bljk_F8NHS_BH_BiasSH_HAS_SAB_SAV_UserArgs_MT192x64x128_MI16x16x1_SN_LDSB1_GRVWA16_GRVWB16_GSU1_GSUC0_GSUWGMRR0_K1_LBSPPA512_LBSPPB128_LPA32_LPB32_LRVW16_MIWT12_1_SU16_SUM0_SUS128_SVW4_VWA4_VWB1_WG16_16_1_WGM8_WGMXCC8_WGMXCCG304
    SolutionIndex: 416
    SolutionNameMin: Cijk_Alik_Bljk_F8NHS_BH_BiasSH_HAS_SAB_SAV_UserArgs_MT96x32x256_MI16x16x1_SN_LDSB1_GRVWA16_GRVWB16_GSU1_GSUC0_GSUWGMRR0_K1_LBSPPA256_LBSPPB256_LPA32_LPB32_LRVW16_MIWT3_1_SU16_SUM0_SUS256_SVW1_VWA1_VWB1_WG32_8_1_WGM8_WGMXCC8_WGMXCCG304
    SolutionIndex: 417
    SolutionNameMin: Cijk_Alik_Bljk_F8NHS_BH_BiasSH_HAS_SAB_SAV_UserArgs_MT64x64x128_MI16x16x1_SN_LDSB1_GRVWA16_GRVWB16_GSU1_GSUC0_GSUWGMRR0_K1_LBSPPA512_LBSPPB128_LPA32_LPB32_LRVW16_MIWT4_1_NTA4_NTB0_SU8_SUM0_SUS128_SVW4_VWA4_VWB1_WG16_16_1_WGM1_WGMXCC8_WGMXCCG304
    SolutionIndex: 418
    SolutionNameMin: Cijk_Alik_Bljk_F8NHS_BH_BiasSH_HAS_SAB_SAV_UserArgs_MT192x64x128_MI16x16x1_SN_LDSB1_GRVWA16_GRVWB16_GSU1_GSUC0_GSUWGMRR0_K1_LBSPPA256_LBSPPB256_LPA32_LPB32_LRVW16_MIWT6_2_SU16_SUM0_SUS128_SVW2_VWA2_VWB2_WG32_8_1_WGM8_WGMXCC8_WGMXCCG304
    SolutionIndex: 419
    SolutionNameMin: Cijk_Alik_Bljk_F8NHS_BH_BiasSH_HAS_SAB_SAV_UserArgs_MT128x96x128_MI16x16x1_SN_LDSB1_GRVWA16_GRVWB16_GSU1_GSUC0_GSUWGMRR0_K1_LBSPPA512_LBSPPB128_LPA32_LPB32_LRVW16_MIWT4_3_NTA4_NTB0_SU8_SUM0_SUS128_SVW4_VWA4_VWB1_WG32_8_1_WGM1_WGMXCC8_WGMXCCG304
    SolutionIndex: 420
    SolutionNameMin: Cijk_Alik_Bljk_F8NHS_BH_BiasSH_HAS_SAB_SAV_UserArgs_MT192x128x128_MI16x16x1_SN_LDSB1_GRVWA16_GRVWB16_GSU1_GSUAMB_GSUC0_GSUWGMRR0_K1_LBSPPA512_LBSPPB256_LPA32_LPB32_LRVW16_MIWT12_2_NTB4_NTD4_NEPBS16_SU16_SUM0_SUS128_SVW4_VWA4_VWB2_WG16_16_1_WGM6_WGMXCC8_WGMXCCG304
    SolutionIndex: 421
    SolutionNameMin: Cijk_Alik_Bljk_F8NHS_BH_BiasSH_HAS_SAB_SAV_UserArgs_MT192x192x128_MI16x16x1_SN_LDSB1_GRVWA16_GRVWB16_GSU1_GSUC0_GSUWGMRR0_K1_LBSPPA512_LBSPPB128_LPA32_LPB32_LRVW16_MIWT12_3_NTA4_NTB0_SU8_SUM0_SUS128_SVW4_VWA4_VWB1_WG16_16_1_WGM1_WGMXCC8_WGMXCCG304
    SolutionIndex: 422
    SolutionNameMin: Cijk_Alik_Bljk_F8NHS_BH_BiasSH_HAS_SAB_SAV_UserArgs_MT192x192x128_MI16x16x1_SN_LDSB1_GRVWA16_GRVWB16_GSU1_GSUC0_GSUWGMRR0_K1_LBSPPA512_LBSPPB128_LPA32_LPB32_LRVW16_MIWT12_3_SU16_SUM0_SUS128_SVW4_VWA4_VWB1_WG16_16_1_WGM8_WGMXCC8_WGMXCCG304
    SolutionIndex: 423
    SolutionNameMin: Cijk_Alik_Bljk_F8NHS_BH_BiasSH_HAS_SAB_SAV_UserArgs_MT192x192x128_MI16x16x1_SN_LDSB1_GRVWA16_GRVWB16_GSU1_GSUC0_GSUWGMRR0_K1_LBSPPA256_LBSPPB256_LPA32_LPB32_LRVW16_MIWT6_6_NTB0_SU8_SUM1_SUS128_SVW2_VWA2_VWB2_WG32_8_1_WGM6_WGMXCC8_WGMXCCG304
    SolutionIndex: 424
    SolutionNameMin: Cijk_Alik_Bljk_F8NHS_BH_BiasSH_HAS_SAB_SAV_UserArgs_MT192x256x128_MI16x16x1_SN_LDSB1_GRVWA16_GRVWB16_GSU1_GSUC0_GSUWGMRR0_K1_LBSPPA512_LBSPPB512_LPA32_LPB32_LRVW16_MIWT12_4_NTB0_SU8_SUM1_SUS128_SVW4_VWA4_VWB4_WG16_16_1_WGM6_WGMXCC8_WGMXCCG304
    SolutionIndex: 425
    SolutionNameMin: Cijk_Alik_Bljk_F8NHS_BH_BiasSH_HAS_SAB_SAV_UserArgs_MT128x192x64_MI16x16x1_SN_LDSB1_GRVWA8_GRVWB8_GSU1_GSUC0_GSUWGMRR0_K1_LBSPPA256_LBSPPB128_LPA8_LPB8_LRVW8_MIWT4_6_SU8_SUM1_SUS64_SVW4_VWA4_VWB2_WG32_8_1_WGM6_WGMXCC8_WGMXCCG304
    SolutionIndex: 426
    SolutionNameMin: Cijk_Alik_Bljk_F8NHS_BH_BiasSH_HAS_SAB_SAV_UserArgs_MT256x128x128_MI16x16x1_SN_LDSB1_GRVWA16_GRVWB16_GSU1_GSUC0_GSUWGMRR0_K1_LBSPPA1024_LBSPPB512_LPA32_LPB32_LRVW16_MIWT8_4_SU16_SUM0_SUS128_SVW8_VWA8_VWB4_WG32_8_1_WGM8_WGMXCC8_WGMXCCG304
    SolutionIndex: 427
    SolutionNameMin: Cijk_Alik_Bljk_F8NHS_BH_BiasSH_HAS_SAB_SAV_UserArgs_MT256x128x128_MI16x16x1_SN_LDSB1_GRVWA16_GRVWB16_GSU1_GSUC0_GSUWGMRR0_K1_LBSPPA1024_LBSPPB512_LPA32_LPB32_LRVW16_MIWT8_4_NTB0_SU16_SUM0_SUS128_SVW8_VWA8_VWB4_WG32_8_1_WGM8_WGMXCC8_WGMXCCG304
    SolutionIndex: 428
    SolutionNameMin: Cijk_Alik_Bljk_F8NHS_BH_BiasSH_HAS_SAB_SAV_UserArgs_MT192x256x128_MI16x16x1_SN_LDSB1_GRVWA16_GRVWB16_GSU1_GSUC0_GSUWGMRR0_K1_LBSPPA512_LBSPPB512_LPA32_LPB32_LRVW16_MIWT12_4_SU8_SUM1_SUS128_SVW4_VWA4_VWB4_WG16_16_1_WGM6_WGMXCC8_WGMXCCG304
    SolutionIndex: 429
    SolutionNameMin: Cijk_Alik_Bljk_F8NHS_BH_BiasSH_HAS_SAB_SAV_UserArgs_MT256x128x64_MI16x16x1_SN_LDSB1_GRVWA8_GRVWB8_GSU1_GSUC0_GSUWGMRR0_K1_LBSPPA512_LBSPPB256_LPA8_LPB8_LRVW8_MIWT8_4_NTB0_SU8_SUM1_SUS64_SVW8_VWA8_VWB4_WG32_8_1_WGM6_WGMXCC8_WGMXCCG304
    SolutionIndex: 430
    SolutionNameMin: Cijk_Alik_Bljk_F8NHS_BH_BiasSH_HAS_SAB_SAV_UserArgs_MT256x256x64_MI16x16x1_SN_LDSB1_GRVWA8_GRVWB8_GSU1_GSUC0_GSUWGMRR0_K1_LBSPPA512_LBSPPB512_LPA8_LPB8_LRVW8_MIWT8_8_SU8_SUM1_SUS64_SVW8_VWA8_VWB8_WG32_8_1_WGM6_WGMXCC8_WGMXCCG304
    SolutionIndex: 431
    SolutionNameMin: Cijk_Alik_Bljk_F8NHS_BH_BiasSH_HAS_SAB_SAV_UserArgs_MT128x512x64_MI16x16x1_SN_LDSB1_GRVWA8_GRVWB8_GSU1_GSUC0_GSUWGMRR0_K1_LBSPPA512_LBSPPB512_LPA8_LPB8_LRVW8_MIWT8_8_NTB0_SU8_SUM1_SUS64_SVW8_VWA8_VWB8_WG16_16_1_WGM6_WGMXCC8_WGMXCCG304
    SolutionIndex: 432
    SolutionNameMin: Cijk_Alik_Bljk_F8NHS_BH_BiasSH_HAS_SAB_SAV_UserArgs_MT224x256x128_MI16x16x1_SN_GRVWA4_GRVWB4_GSU1_GSUC0_GSUWGMRR0_K1_LBSPPA128_LBSPPB1024_LPA8_LPB8_LRVW8_MIWT7_8_NTA1_NTB3_NTC0_NTD0_SU16_SUM0_SUS256_SPO1_SSO0_SVW1_VWA1_VWB8_WG32_8_1_WGM8_WGMXCC8_WGMXCCGn1
    SolutionIndex: 433
    SolutionNameMin: Cijk_Alik_Bljk_F8NHS_BH_BiasSH_HAS_SAB_SAV_UserArgs_MT128x16x128_MI16x16x1_SN_LDSB1_GRVWA16_GRVWB8_GSU1_GSUC0_GSUWGMRR0_K1_LBSPPA256_LBSPPB128_LPA32_LPB32_LRVW16_MIWT2_1_SU16_SUM0_SUS128_SVW2_VWA2_VWB1_WG64_4_1_WGM8_WGMXCC8_WGMXCCG304
    SolutionIndex: 434
    SolutionNameMin: Cijk_Alik_Bljk_F8NHS_BH_BiasSH_HAS_SAB_SAV_UserArgs_MT128x32x128_MI16x16x1_SN_LDSB1_GRVWA16_GRVWB16_GSU1_GSUC0_GSUWGMRR0_K1_LBSPPA512_LBSPPB128_LPA32_LPB32_LRVW16_MIWT4_1_NTA4_NTB0_SU8_SUM0_SUS128_SVW4_VWA4_VWB1_WG32_8_1_WGM1_WGMXCC8_WGMXCCG304
    SolutionIndex: 435
    SolutionNameMin: Cijk_Alik_Bljk_F8NHS_BH_BiasSH_HAS_SAB_SAV_UserArgs_MT256x64x128_MI16x16x1_SN_LDSB1_GRVWA16_GRVWB16_GSU1_GSUC0_GSUWGMRR0_K1_LBSPPA1024_LBSPPB256_LPA32_LPB32_LRVW16_MIWT8_2_NTA4_NTB0_SU8_SUM0_SUS128_SVW8_VWA8_VWB2_WG32_8_1_WGM1_WGMXCC8_WGMXCCG304
    SolutionIndex: 436
    SolutionNameMin: Cijk_Alik_Bljk_F8NHS_BH_BiasSH_HAS_SAB_SAV_UserArgs_MT256x96x128_MI16x16x1_SN_LDSB1_GRVWA16_GRVWB16_GSU1_GSUC0_GSUWGMRR0_K1_LBSPPA1024_LBSPPB128_LPA32_LPB32_LRVW16_MIWT8_3_NTA4_NTB0_SU8_SUM0_SUS128_SVW8_VWA8_VWB1_WG32_8_1_WGM1_WGMXCC8_WGMXCCG304
    SolutionIndex: 437
    SolutionNameMin: Cijk_Alik_Bljk_F8NHS_BH_BiasSH_HAS_SAB_SAV_UserArgs_MT224x96x128_MI16x16x1_SN_LDSB1_GRVWA16_GRVWB16_GSU1_GSUC0_GSUWGMRR0_K1_LBSPPA128_LBSPPB128_LPA32_LPB32_LRVW16_MIWT7_3_SU16_SUM0_SUS128_SVW1_VWA1_VWB1_WG32_8_1_WGM8_WGMXCC8_WGMXCCG304
    SolutionIndex: 438
    SolutionNameMin: Cijk_Alik_Bljk_F8NHS_BH_Bias_HAS_SAV_UserArgs_MT256x128x128_MI16x16x1_SN_GRVWA4_GSU1_GSUC0_GSUWGMRR0_K1_LBSPPA1024_LBSPPB128_LPA32_LPB32_MIWT8_4_NTA1_NTC2_NTD2_SU8_SUM0_SUS256_SVW8_VWA8_VWB1_WG32_8_1_WGM0_WGMXCC1_WGMXCCGn1
    SolutionIndex: 439
    SolutionNameMin: Cijk_Alik_Bljk_F8NHS_BH_BiasSH_HAS_SAB_SAV_UserArgs_MT256x128x128_MI16x16x1_SN_LDSB1_GRVWA16_GRVWB16_GSU1_GSUC0_GSUWGMRR0_K1_LBSPPA512_LBSPPB1024_LPA32_LPB32_LRVW16_MIWT4_8_SU8_SUM1_SUS128_SVW4_VWA4_VWB8_WG64_4_1_WGM6_WGMXCC8_WGMXCCG304
    SolutionIndex: 440
    SolutionNameMin: Cijk_Alik_Bljk_F8NHS_BH_BiasSH_HAS_SAB_SAV_UserArgs_MT256x192x128_MI16x16x1_SN_LDSB1_GRVWA16_GRVWB16_GSU1_GSUAMB_GSUC0_GSUWGMRR0_K1_LBSPPA1024_LBSPPB256_LPA32_LPB32_LRVW16_MIWT8_6_NTD4_NEPBS16_SU16_SUM0_SUS128_SVW8_VWA8_VWB2_WG32_8_1_WGM6_WGMXCC8_WGMXCCG304
    SolutionIndex: 441
    SolutionNameMin: Cijk_Alik_Bljk_F8NHS_BH_BiasSH_HAS_SAB_SAV_UserArgs_MT224x192x128_MI16x16x1_SN_LDSB1_GRVWA16_GRVWB16_GSU1_GSUC0_GSUWGMRR0_K1_LBSPPA256_LBSPPB128_LPA32_LPB32_LRVW16_MIWT14_3_NTB0_SU8_SUM1_SUS128_SVW2_VWA2_VWB1_WG16_16_1_WGM6_WGMXCC8_WGMXCCG304
    SolutionIndex: 442
    SolutionNameMin: Cijk_Alik_Bljk_F8NHS_BH_BiasSH_HAS_SAB_SAV_UserArgs_MT224x192x128_MI16x16x1_SN_LDSB1_GRVWA16_GRVWB16_GSU1_GSUC0_GSUWGMRR0_K1_LBSPPA128_LBSPPB256_LPA32_LPB32_LRVW16_MIWT7_6_NTA4_NTB0_SU8_SUM0_SUS128_SVW1_VWA1_VWB2_WG32_8_1_WGM1_WGMXCC8_WGMXCCG304
    SolutionIndex: 443
    SolutionNameMin: Cijk_Alik_Bljk_F8NHS_BH_BiasSH_HAS_SAB_SAV_UserArgs_MT256x128x64_MI16x16x1_SN_LDSB1_GRVWA8_GRVWB8_GSU1_GSUC0_GSUWGMRR0_K1_LBSPPA256_LBSPPB512_LPA8_LPB8_LRVW8_MIWT4_8_NTB0_SU8_SUM1_SUS64_SVW4_VWA4_VWB8_WG64_4_1_WGM6_WGMXCC8_WGMXCCG304
    SolutionIndex: 444
    SolutionNameMin: Cijk_Alik_Bljk_F8NHS_BH_BiasSH_HAS_SAB_SAV_UserArgs_MT256x256x64_MI16x16x1_SN_LDSB1_GRVWA8_GRVWB8_GSU1_GSUC0_GSUWGMRR0_K1_LBSPPA512_LBSPPB512_LPA8_LPB8_LRVW8_MIWT8_8_NTB0_SU8_SUM1_SUS64_SVW8_VWA8_VWB8_WG32_8_1_WGM6_WGMXCC8_WGMXCCG304
    SolutionIndex: 445
    SolutionNameMin: Cijk_Alik_Bljk_F8NHS_BH_BiasSH_HAS_SAB_SAV_UserArgs_MT224x192x128_MI16x16x1_SN_LDSB1_GRVWA16_GRVWB16_GSU1_GSUC0_GSUWGMRR0_K1_LBSPPA128_LBSPPB256_LPA32_LPB32_LRVW16_MIWT7_6_NTB0_SU8_SUM1_SUS128_SVW1_VWA1_VWB2_WG32_8_1_WGM6_WGMXCC8_WGMXCCG304
    SolutionIndex: 446
    SolutionNameMin: Cijk_Alik_Bljk_F8NHS_BH_BiasSH_HAS_SAB_SAV_UserArgs_MT224x192x128_MI16x16x1_SN_LDSB1_GRVWA16_GRVWB16_GSU1_GSUAMB_GSUC0_GSUWGMRR0_K1_LBSPPA128_LBSPPB256_LPA32_LPB32_LRVW16_MIWT7_6_NTD4_NEPBS16_SU16_SUM0_SUS128_SVW1_VWA1_VWB2_WG32_8_1_WGM6_WGMXCC8_WGMXCCG304
    SolutionIndex: 447
    SolutionNameMin: Cijk_Alik_Bljk_F8NHS_BH_BiasSH_HAS_SAB_SAV_UserArgs_MT192x256x128_MI16x16x1_SN_LDSB1_GRVWA16_GRVWB16_GSU1_GSUC0_GSUWGMRR0_K1_LBSPPA128_LBSPPB2048_LPA32_LPB32_LRVW16_MIWT3_16_NTB0_SU16_SUM0_SUS128_SVW1_VWA1_VWB16_WG64_4_1_WGM8_WGMXCC8_WGMXCCG304
    SolutionIndex: 448
    SolutionNameMin: Cijk_Alik_Bljk_F8NHS_BH_BiasSH_HAS_SAB_SAV_UserArgs_MT16x16x256_MI16x16x1_SN_LDSB0_GRVWA16_GRVWB16_GSU8_GSUAMBSK_GSUC0_GSUWGMRR0_K1_LBSPPA256_LBSPPB256_LPA32_LPB32_LRVW16_MIWT1_1_NTD0_NEPBS0_SU0_SUM0_SUS0_SVW1_VWA1_VWB1_WG16_4_4_WGM1_WGMXCC1_WGMXCCG0
    SolutionIndex: 449
    SolutionNameMin: Cijk_Alik_Bljk_F8NHS_BH_BiasSH_HAS_SAB_SAV_UserArgs_MT16x16x512_MI16x16x1_SN_LDSB1_GRVWA16_GRVWB16_GSU1_GSUAMB_GSUC0_GSUWGMRR0_K1_LBSPPA512_LBSPPB512_LPA32_LPB32_LRVW16_MIWT1_1_NTD4_NEPBS16_SU16_SUM0_SUS512_SVW1_VWA1_VWB1_WG16_4_4_WGM6_WGMXCC8_WGMXCCG304
    SolutionIndex: 450
    SolutionNameMin: Cijk_Alik_Bljk_F8NHS_BH_BiasSH_HAS_SAB_SAV_UserArgs_MT16x64x512_MI16x16x1_SN_LDSB1_GRVWA16_GRVWB16_GSU1_GSUAMB_GSUC0_GSUWGMRR0_K1_LBSPPA512_LBSPPB512_LPA32_LPB32_LRVW16_MIWT1_1_NTD4_NEPBS16_SU16_SUM0_SUS512_SVW1_VWA1_VWB1_WG16_16_1_WGM6_WGMXCC8_WGMXCCG304
    SolutionIndex: 451
    SolutionNameMin: Cijk_Alik_Bljk_F8NHS_BH_BiasSH_HAS_SAB_SAV_UserArgs_MT32x64x256_MI16x16x1_SN_LDSB1_GRVWA16_GRVWB16_GSU1_GSUC0_GSUWGMRR0_K1_LBSPPA512_LBSPPB256_LPA32_LPB32_LRVW16_MIWT2_1_SU16_SUM0_SUS256_SVW2_VWA2_VWB1_WG16_16_1_WGM8_WGMXCC8_WGMXCCG304
    SolutionIndex: 452
    SolutionNameMin: Cijk_Alik_Bljk_F8NHS_BH_BiasSH_HAS_SAB_SAV_UserArgs_MT64x32x512_MI16x16x1_SN_LDSB1_GRVWA16_GRVWB16_GSU1_GSUAMB_GSUC0_GSUWGMRR0_K1_LBSPPA1024_LBSPPB512_LPA32_LPB32_LRVW16_MIWT2_1_NTD4_NEPBS16_SU16_SUM0_SUS512_SVW2_VWA2_VWB1_WG32_8_1_WGM6_WGMXCC8_WGMXCCG304
    SolutionIndex: 453
    SolutionNameMin: Cijk_Alik_Bljk_F8NHS_BH_BiasSH_HAS_SAB_SAV_UserArgs_MT16x16x512_MI16x16x1_SN_LDSB1_GRVWA16_GRVWB16_GSU2_GSUAMBSK_GSUC0_GSUWGMRR0_K1_LBSPPA512_LBSPPB512_LPA32_LPB32_LRVW16_MIWT1_1_NTD0_NEPBS0_SU0_SUM0_SUS0_SVW1_VWA1_VWB1_WG16_4_4_WGM1_WGMXCC1_WGMXCCG0
    SolutionIndex: 454
    SolutionNameMin: Cijk_Alik_Bljk_F8NHS_BH_BiasSH_HAS_SAB_SAV_UserArgs_MT256x224x128_MI16x16x1_SN_LDSB1_GRVWA8_GRVWB8_GSU1_GSUC0_GSUWGMRR0_K1_LBSPPA512_LBSPPB256_LPA8_LPB8_LRVW8_MIWT4_14_SU16_SUM0_SUS128_SVW4_VWA4_VWB2_WG64_4_1_WGM8_WGMXCC8_WGMXCCG304
    SolutionIndex: 455
    SolutionNameMin: Cijk_Alik_Bljk_F8NHS_BH_BiasSH_HAS_SAB_SAV_UserArgs_MT128x256x128_MI16x16x1_SN_LDSB1_GRVWA16_GRVWB16_GSU1_GSUC0_GSUWGMRR0_K1_LBSPPA1024_LBSPPB512_LPA32_LPB32_LRVW16_MIWT8_4_NTB0_SU16_SUM0_SUS128_SVW8_VWA8_VWB4_WG16_16_1_WGM8_WGMXCC8_WGMXCCG304
    SolutionIndex: 456
    SolutionNameMin: Cijk_Alik_Bljk_F8NHS_BH_BiasSH_HAS_SAB_SAV_UserArgs_MT256x256x64_MI16x16x1_SN_LDSB1_GRVWA8_GRVWB8_GSU1_GSUC0_GSUWGMRR0_K1_LBSPPA512_LBSPPB512_LPA8_LPB8_LRVW8_MIWT8_8_NTB0_SU16_SUM0_SUS64_SVW8_VWA8_VWB8_WG32_8_1_WGM8_WGMXCC8_WGMXCCG304
    SolutionIndex: 457
    SolutionNameMin: Cijk_Alik_Bljk_F8NHS_BH_BiasSH_HAS_SAB_SAV_UserArgs_MT224x256x128_MI16x16x1_SN_LDSB1_GRVWA8_GRVWB8_GSU1_GSUC0_GSUWGMRR0_K1_LBSPPA128_LBSPPB1024_LPA8_LPB8_LRVW8_MIWT7_8_NTB0_SU16_SUM0_SUS128_SVW1_VWA1_VWB8_WG32_8_1_WGM8_WGMXCC8_WGMXCCG304
    SolutionIndex: 458
    SolutionNameMin: Cijk_Alik_Bljk_F8NHS_BH_BiasSH_HAS_SAB_SAV_UserArgs_MT64x16x512_MI16x16x1_SN_LDSB1_GRVWA16_GRVWB16_GSU1_GSUC0_GSUWGMRR0_K1_LBSPPA512_LBSPPB512_LPA32_LPB32_LRVW16_MIWT1_1_NTA4_NTB0_SU8_SUM0_SUS512_SVW1_VWA1_VWB1_WG64_4_1_WGM1_WGMXCC8_WGMXCCG304
    SolutionIndex: 459
    SolutionNameMin: Cijk_Alik_Bljk_F8NHS_BH_BiasSH_HAS_SAB_SAV_UserArgs_MT32x32x256_MI16x16x1_SN_LDSB1_GRVWA16_GRVWB16_GSU1_GSUC0_GSUWGMRR0_K1_LBSPPA256_LBSPPB256_LPA32_LPB32_LRVW16_MIWT1_1_NTA4_NTB4_SU8_SUM0_SUS256_SVW1_VWA1_VWB1_WG32_8_1_WGM1_WGMXCC8_WGMXCCG304
    SolutionIndex: 460
    SolutionNameMin: Cijk_Alik_Bljk_F8NHS_BH_BiasSH_HAS_SAB_SAV_UserArgs_MT192x16x256_MI16x16x1_SN_LDSB1_GRVWA16_GRVWB16_GSU3_GSUAMBSK_GSUC0_GSUWGMRR0_K1_LBSPPA256_LBSPPB256_LPA32_LPB32_LRVW16_MIWT3_1_NTD0_NEPBS0_SU0_SUM0_SUS0_SVW1_VWA1_VWB1_WG64_4_1_WGM1_WGMXCC1_WGMXCCG0
    SolutionIndex: 461
    SolutionNameMin: Cijk_Alik_Bljk_F8NHS_BH_BiasSH_HAS_SAB_SAV_UserArgs_MT192x48x256_MI16x16x1_SN_LDSB1_GRVWA8_GRVWB8_GSU3_GSUAMB_GSUC0_GSUWGMRR0_K1_LBSPPA256_LBSPPB256_LPA8_LPB8_LRVW8_MIWT3_3_NTD0_NEPBS16_SU0_SUM0_SUS0_SVW1_VWA1_VWB1_WG64_4_1_WGM1_WGMXCC1_WGMXCCG0
    SolutionIndex: 462
    SolutionNameMin: Cijk_Alik_Bljk_F8NHS_BH_BiasSH_HAS_SAB_SAV_UserArgs_MT64x16x512_MI16x16x1_SN_LDSB1_GRVWA16_GRVWB16_GSU1_GSUAMB_GSUC0_GSUWGMRR0_K1_LBSPPA512_LBSPPB512_LPA32_LPB32_LRVW16_MIWT1_1_NTD4_NEPBS16_SU16_SUM0_SUS512_SVW1_VWA1_VWB1_WG64_4_1_WGM6_WGMXCC8_WGMXCCG304
    SolutionIndex: 463
    SolutionNameMin: Cijk_Alik_Bljk_F8NHS_BH_BiasSH_HAS_SAB_SAV_UserArgs_MT192x32x256_MI16x16x1_SN_LDSB1_GRVWA16_GRVWB16_GSU3_GSUAMB_GSUC0_GSUWGMRR0_K1_LBSPPA256_LBSPPB512_LPA32_LPB32_LRVW16_MIWT3_2_NTD0_NEPBS16_SU0_SUM0_SUS0_SVW1_VWA1_VWB2_WG64_4_1_WGM1_WGMXCC1_WGMXCCG0
    SolutionIndex: 464
    SolutionNameMin: Cijk_Alik_Bljk_F8NHS_BH_BiasSH_HAS_SAB_SAV_UserArgs_MT64x64x256_MI16x16x1_SN_LDSB1_GRVWA16_GRVWB16_GSU1_GSUC0_GSUWGMRR0_K1_LBSPPA256_LBSPPB1024_LPA32_LPB32_LRVW16_MIWT1_4_SU16_SUM0_SUS256_SVW1_VWA1_VWB4_WG64_4_1_WGM8_WGMXCC8_WGMXCCG304
    SolutionIndex: 465
    SolutionNameMin: Cijk_Alik_Bljk_F8NHS_BH_BiasSH_HAS_SAB_SAV_UserArgs_MT64x48x512_MI16x16x1_SN_LDSB1_GRVWA16_GRVWB16_GSU1_GSUAMB_GSUC0_GSUWGMRR0_K1_LBSPPA512_LBSPPB512_LPA32_LPB32_LRVW16_MIWT1_3_NTD4_NEPBS16_SU16_SUM0_SUS512_SVW1_VWA1_VWB1_WG64_4_1_WGM6_WGMXCC8_WGMXCCG304
    SolutionIndex: 466
    SolutionNameMin: Cijk_Alik_Bljk_F8NHS_BH_BiasSH_HAS_SAB_SAV_UserArgs_MT64x48x256_MI16x16x1_SN_LDSB1_GRVWA16_GRVWB16_GSU1_GSUC0_GSUWGMRR0_K1_LBSPPA256_LBSPPB256_LPA32_LPB32_LRVW16_MIWT1_3_SU16_SUM0_SUS256_SVW1_VWA1_VWB1_WG64_4_1_WGM8_WGMXCC8_WGMXCCG304
    SolutionIndex: 467
    SolutionNameMin: Cijk_Alik_Bljk_F8NHS_BH_BiasSH_HAS_SAB_SAV_UserArgs_MT128x64x256_MI16x16x1_SN_LDSB1_GRVWA16_GRVWB16_GSU2_GSUAMB_GSUC0_GSUWGMRR0_K1_LBSPPA1024_LBSPPB512_LPA32_LPB32_LRVW16_MIWT4_2_NTD0_NEPBS16_SU0_SUM0_SUS0_SVW4_VWA4_VWB2_WG32_8_1_WGM1_WGMXCC1_WGMXCCG0
    SolutionIndex: 468
    SolutionNameMin: Cijk_Alik_Bljk_F8NHS_BH_BiasSH_HAS_SAB_SAV_UserArgs_MT128x64x256_MI16x16x1_SN_LDSB1_GRVWA16_GRVWB16_GSU2_GSUAMB_GSUC0_GSUWGMRR0_K1_LBSPPA512_LBSPPB1024_LPA32_LPB32_LRVW16_MIWT2_4_NTD0_NEPBS16_SU0_SUM0_SUS0_SVW2_VWA2_VWB4_WG64_4_1_WGM1_WGMXCC1_WGMXCCG0
    SolutionIndex: 469
    SolutionNameMin: Cijk_Alik_Bljk_F8NHS_BH_BiasSH_HAS_SAB_SAV_UserArgs_MT64x96x256_MI16x16x1_SN_LDSB1_GRVWA16_GRVWB16_GSU1_GSUC0_GSUWGMRR0_K1_LBSPPA512_LBSPPB256_LPA32_LPB32_LRVW16_MIWT2_3_NTA4_NTB0_SU8_SUM0_SUS256_SVW2_VWA2_VWB1_WG32_8_1_WGM1_WGMXCC8_WGMXCCG304
    SolutionIndex: 470
    SolutionNameMin: Cijk_Alik_Bljk_F8NHS_BH_BiasSH_HAS_SAB_SAV_UserArgs_MT128x96x256_MI16x16x1_SN_LDSB1_GRVWA16_GRVWB16_GSU2_GSUAMB_GSUC0_GSUWGMRR0_K1_LBSPPA512_LBSPPB512_LPA32_LPB32_LRVW16_MIWT2_6_NTD0_NEPBS16_SU0_SUM0_SUS0_SVW2_VWA2_VWB2_WG64_4_1_WGM1_WGMXCC1_WGMXCCG0
    SolutionIndex: 471
    SolutionNameMin: Cijk_Alik_Bljk_F8NHS_BH_BiasSH_HAS_SAB_SAV_UserArgs_MT64x80x256_MI16x16x1_SN_LDSB1_GRVWA16_GRVWB16_GSU1_GSUC0_GSUWGMRR0_K1_LBSPPA256_LBSPPB256_LPA32_LPB32_LRVW16_MIWT1_5_NTB0_SU16_SUM0_SUS256_SVW1_VWA1_VWB1_WG64_4_1_WGM8_WGMXCC8_WGMXCCG304
    SolutionIndex: 472
    SolutionNameMin: Cijk_Alik_Bljk_F8NHS_BH_BiasSH_HAS_SAB_SAV_UserArgs_MT128x80x256_MI16x16x1_SN_LDSB1_GRVWA16_GRVWB16_GSU4_GSUAMB_GSUC0_GSUWGMRR0_K1_LBSPPA512_LBSPPB256_LPA32_LPB32_LRVW16_MIWT2_5_NTD0_NEPBS16_SU0_SUM0_SUS0_SVW2_VWA2_VWB1_WG64_4_1_WGM1_WGMXCC1_WGMXCCG0
    SolutionIndex: 473
    SolutionNameMin: Cijk_Alik_Bljk_F8NHS_BH_BiasSH_HAS_SAB_SAV_UserArgs_MT128x64x256_MI16x16x1_SN_LDSB1_GRVWA16_GRVWB16_GSU1_GSUAMB_GSUC0_GSUWGMRR0_K1_LBSPPA1024_LBSPPB512_LPA32_LPB32_LRVW16_MIWT4_2_NTB0_NTD4_NEPBS16_SU16_SUM0_SUS256_SVW4_VWA4_VWB2_WG32_8_1_WGM6_WGMXCC8_WGMXCCG304
    SolutionIndex: 474
    SolutionNameMin: Cijk_Alik_Bljk_F8NHS_BH_BiasSH_HAS_SAB_SAV_UserArgs_MT96x96x256_MI16x16x1_SN_LDSB1_GRVWA16_GRVWB16_GSU3_GSUAMB_GSUC0_GSUWGMRR0_K1_LBSPPA256_LBSPPB256_LPA32_LPB32_LRVW16_MIWT3_3_NTD0_NEPBS16_SU0_SUM0_SUS0_SVW1_VWA1_VWB1_WG32_8_1_WGM1_WGMXCC1_WGMXCCG0
    SolutionIndex: 475
    SolutionNameMin: Cijk_Alik_Bljk_F8NHS_BH_BiasSH_HAS_SAB_SAV_UserArgs_MT64x96x256_MI16x16x1_SN_LDSB1_GRVWA16_GRVWB16_GSU1_GSUAMB_GSUC0_GSUWGMRR0_K1_LBSPPA512_LBSPPB256_LPA32_LPB32_LRVW16_MIWT2_3_NTD4_NEPBS16_SU16_SUM0_SUS256_SVW2_VWA2_VWB1_WG32_8_1_WGM6_WGMXCC8_WGMXCCG304
    SolutionIndex: 476
    SolutionNameMin: Cijk_Alik_Bljk_F8NHS_BH_BiasSH_HAS_SAB_SAV_UserArgs_MT128x96x256_MI16x16x1_SN_LDSB1_GRVWA16_GRVWB16_GSU2_GSUAMBSK_GSUC0_GSUWGMRR0_K1_LBSPPA1024_LBSPPB256_LPA32_LPB32_LRVW16_MIWT4_3_NTB0_NTD0_NEPBS0_SU0_SUM0_SUS0_SVW4_VWA4_VWB1_WG32_8_1_WGM1_WGMXCC1_WGMXCCG0
    SolutionIndex: 477
    SolutionNameMin: Cijk_Alik_Bljk_F8NHS_BH_BiasSH_HAS_SAB_SAV_UserArgs_MT64x128x256_MI16x16x1_SN_LDSB1_GRVWA16_GRVWB16_GSU1_GSUC0_GSUWGMRR0_K1_LBSPPA512_LBSPPB1024_LPA32_LPB32_LRVW16_MIWT2_4_SU16_SUM0_SUS256_SVW2_VWA2_VWB4_WG32_8_1_WGM8_WGMXCC8_WGMXCCG304
    SolutionIndex: 478
    SolutionNameMin: Cijk_Alik_Bljk_F8NHS_BH_BiasSH_HAS_SAB_SAV_UserArgs_MT192x128x128_MI16x16x1_SN_LDSB1_GRVWA16_GRVWB16_GSU3_GSUAMB_GSUC0_GSUWGMRR0_K1_LBSPPA128_LBSPPB1024_LPA32_LPB32_LRVW16_MIWT3_8_NTD0_NEPBS16_SU0_SUM0_SUS0_SVW1_VWA1_VWB8_WG64_4_1_WGM1_WGMXCC1_WGMXCCG0
    SolutionIndex: 479
    SolutionNameMin: Cijk_Alik_Bljk_F8NHS_BH_BiasSH_HAS_SAB_SAV_UserArgs_MT64x128x256_MI16x16x1_SN_LDSB1_GRVWA16_GRVWB16_GSU1_GSUC0_GSUWGMRR0_K1_LBSPPA1024_LBSPPB512_LPA32_LPB32_LRVW16_MIWT4_2_NTA4_NTB0_SU8_SUM0_SUS256_SVW4_VWA4_VWB2_WG16_16_1_WGM1_WGMXCC8_WGMXCCG304
    SolutionIndex: 480
    SolutionNameMin: Cijk_Alik_Bljk_F8NHS_BH_BiasSH_HAS_SAB_SAV_UserArgs_MT192x128x128_MI16x16x1_SN_LDSB1_GRVWA16_GRVWB16_GSU7_GSUAMB_GSUC0_GSUWGMRR0_K1_LBSPPA256_LBSPPB512_LPA32_LPB32_LRVW16_MIWT6_4_NTD0_NEPBS16_SU0_SUM0_SUS0_SVW2_VWA2_VWB4_WG32_8_1_WGM1_WGMXCC1_WGMXCCG0
    SolutionIndex: 481
    SolutionNameMin: Cijk_Alik_Bljk_F8NHS_BH_BiasSH_HAS_SAB_SAV_UserArgs_MT192x160x128_MI16x16x1_SN_LDSB1_GRVWA16_GRVWB16_GSU3_GSUAMB_GSUC0_GSUWGMRR0_K1_LBSPPA256_LBSPPB128_LPA32_LPB32_LRVW16_MIWT6_5_NTD0_NEPBS16_SU0_SUM0_SUS0_SVW2_VWA2_VWB1_WG32_8_1_WGM1_WGMXCC1_WGMXCCG0
    SolutionIndex: 482
    SolutionNameMin: Cijk_Alik_Bljk_F8NHS_BH_BiasSH_HAS_SAB_SAV_UserArgs_MT192x160x128_MI16x16x1_SN_LDSB1_GRVWA16_GRVWB16_GSU7_GSUAMB_GSUC0_GSUWGMRR0_K1_LBSPPA256_LBSPPB128_LPA32_LPB32_LRVW16_MIWT6_5_NTD0_NEPBS16_SU0_SUM0_SUS0_SVW2_VWA2_VWB1_WG32_8_1_WGM1_WGMXCC1_WGMXCCG0
    SolutionIndex: 483
    SolutionNameMin: Cijk_Alik_Bljk_F8NHS_BH_BiasSH_HAS_SAB_SAV_UserArgs_MT128x80x256_MI16x16x1_SN_LDSB1_GRVWA16_GRVWB16_GSU1_GSUAMB_GSUC0_GSUWGMRR0_K1_LBSPPA512_LBSPPB256_LPA32_LPB32_LRVW16_MIWT2_5_NTD4_NEPBS16_SU16_SUM0_SUS256_SVW2_VWA2_VWB1_WG64_4_1_WGM6_WGMXCC8_WGMXCCG304
    SolutionIndex: 484
    SolutionNameMin: Cijk_Alik_Bljk_F8NHS_BH_BiasSH_HAS_SAB_SAV_UserArgs_MT64x160x256_MI16x16x1_SN_LDSB1_GRVWA16_GRVWB16_GSU1_GSUC0_GSUWGMRR0_K1_LBSPPA512_LBSPPB256_LPA32_LPB32_LRVW16_MIWT2_5_SU16_SUM0_SUS256_SVW2_VWA2_VWB1_WG32_8_1_WGM8_WGMXCC8_WGMXCCG304
    SolutionIndex: 485
    SolutionNameMin: Cijk_Alik_Bljk_F8NHS_BH_BiasSH_HAS_SAB_SAV_UserArgs_MT160x160x128_MI16x16x1_SN_LDSB1_GRVWA16_GRVWB16_GSU5_GSUAMB_GSUC0_GSUWGMRR0_K1_LBSPPA128_LBSPPB128_LPA32_LPB32_LRVW16_MIWT5_5_NTD0_NEPBS16_SU0_SUM0_SUS0_SVW1_VWA1_VWB1_WG32_8_1_WGM1_WGMXCC1_WGMXCCG0
    SolutionIndex: 486
    SolutionNameMin: Cijk_Alik_Bljk_F8NHS_BH_BiasSH_HAS_SAB_SAV_UserArgs_MT224x160x128_MI16x16x1_SN_LDSB1_GRVWA16_GRVWB16_GSU4_GSUAMB_GSUC0_GSUWGMRR0_K1_LBSPPA128_LBSPPB128_LPA32_LPB32_LRVW16_MIWT7_5_NTB0_NTD0_NEPBS16_SU0_SUM0_SUS0_SVW1_VWA1_VWB1_WG32_8_1_WGM1_WGMXCC1_WGMXCCG0
    SolutionIndex: 487
    SolutionNameMin: Cijk_Alik_Bljk_F8NHS_BH_BiasSH_HAS_SAB_SAV_UserArgs_MT128x80x256_MI16x16x1_SN_LDSB1_GRVWA16_GRVWB16_GSU1_GSUC0_GSUWGMRR0_K1_LBSPPA512_LBSPPB256_LPA32_LPB32_LRVW16_MIWT2_5_SU16_SUM0_SUS256_SVW2_VWA2_VWB1_WG64_4_1_WGM8_WGMXCC8_WGMXCCG304
    SolutionIndex: 488
    SolutionNameMin: Cijk_Alik_Bljk_F8NHS_BH_BiasSH_HAS_SAB_SAV_UserArgs_MT192x160x128_MI16x16x1_SN_LDSB1_GRVWA16_GRVWB16_GSU3_GSUAMB_GSUC0_GSUWGMRR0_K1_LBSPPA256_LBSPPB128_LPA32_LPB32_LRVW16_MIWT6_5_NTD0_NEPBS16_SU0_SUM0_SUS0_SVW2_VWA2_VWB1_WG32_8_1_WGM1_WGMXCC1_WGMXCCG0
    SolutionIndex: 489
    SolutionNameMin: Cijk_Alik_Bljk_F8NHS_BH_BiasSH_HAS_SAB_SAV_UserArgs_MT224x160x128_MI16x16x1_SN_LDSB1_GRVWA16_GRVWB16_GSU4_GSUAMB_GSUC0_GSUWGMRR0_K1_LBSPPA128_LBSPPB128_LPA32_LPB32_LRVW16_MIWT7_5_NTB0_NTD0_NEPBS16_SU0_SUM0_SUS0_SVW1_VWA1_VWB1_WG32_8_1_WGM1_WGMXCC1_WGMXCCG0
    SolutionIndex: 490
    SolutionNameMin: Cijk_Alik_Bljk_F8NHS_BH_BiasSH_HAS_SAB_SAV_UserArgs_MT176x192x128_MI16x16x1_SN_LDSB1_GRVWA8_GRVWB16_GSU3_GSUAMB_GSUC0_GSUWGMRR0_K1_LBSPPA128_LBSPPB128_LPA32_LPB32_LRVW16_MIWT11_3_NTD0_NEPBS16_SU0_SUM0_SUS0_SVW1_VWA1_VWB1_WG16_16_1_WGM1_WGMXCC1_WGMXCCG0
    SolutionIndex: 491
    SolutionNameMin: Cijk_Alik_Bljk_F8NHS_BH_BiasSH_HAS_SAB_SAV_UserArgs_MT112x192x128_MI16x16x1_SN_LDSB1_GRVWA8_GRVWB16_GSU2_GSUAMB_GSUC0_GSUWGMRR0_K1_LBSPPA128_LBSPPB128_LPA32_LPB32_LRVW16_MIWT7_3_NTD0_NEPBS16_SU0_SUM0_SUS0_SVW1_VWA1_VWB1_WG16_16_1_WGM1_WGMXCC1_WGMXCCG0
    SolutionIndex: 492
    SolutionNameMin: Cijk_Alik_Bljk_F8NHS_BH_BiasSH_HAS_SAB_SAV_UserArgs_MT128x128x128_MI16x16x1_SN_LDSB1_GRVWA16_GRVWB16_GSU1_GSUAMB_GSUC0_GSUWGMRR0_K1_LBSPPA512_LBSPPB512_LPA32_LPB32_LRVW16_MIWT4_4_NTD4_NEPBS16_SU16_SUM0_SUS128_SVW4_VWA4_VWB4_WG32_8_1_WGM6_WGMXCC8_WGMXCCG304
    SolutionIndex: 493
    SolutionNameMin: Cijk_Alik_Bljk_F8NHS_BH_BiasSH_HAS_SAB_SAV_UserArgs_MT128x224x128_MI16x16x1_SN_LDSB1_GRVWA16_GRVWB16_GSU2_GSUAMB_GSUC0_GSUWGMRR0_K1_LBSPPA512_LBSPPB128_LPA32_LPB32_LRVW16_MIWT4_7_NTD0_NEPBS16_SU0_SUM0_SUS0_SVW4_VWA4_VWB1_WG32_8_1_WGM1_WGMXCC1_WGMXCCG0
    SolutionIndex: 494
    SolutionNameMin: Cijk_Alik_Bljk_F8NHS_BH_BiasSH_HAS_SAB_SAV_UserArgs_MT128x224x128_MI16x16x1_SN_LDSB1_GRVWA16_GRVWB16_GSU2_GSUAMB_GSUC0_GSUWGMRR0_K1_LBSPPA512_LBSPPB128_LPA32_LPB32_LRVW16_MIWT4_7_NTB0_NTD0_NEPBS16_SU0_SUM0_SUS0_SVW4_VWA4_VWB1_WG32_8_1_WGM1_WGMXCC1_WGMXCCG0
    SolutionIndex: 495
    SolutionNameMin: Cijk_Alik_Bljk_F8NHS_BH_BiasSH_HAS_SAB_SAV_UserArgs_MT64x224x128_MI16x16x1_SN_LDSB1_GRVWA16_GRVWB16_GSU1_GSUC0_GSUWGMRR0_K1_LBSPPA256_LBSPPB128_LPA32_LPB32_LRVW16_MIWT2_7_NTA4_NTB0_SU8_SUM0_SUS128_SVW2_VWA2_VWB1_WG32_8_1_WGM1_WGMXCC8_WGMXCCG304
    SolutionIndex: 496
    SolutionNameMin: Cijk_Alik_Bljk_F8NHS_BH_BiasSH_HAS_SAB_SAV_UserArgs_MT128x224x128_MI16x16x1_SN_LDSB1_GRVWA16_GRVWB16_GSU4_GSUAMB_GSUC0_GSUWGMRR0_K1_LBSPPA512_LBSPPB128_LPA32_LPB32_LRVW16_MIWT4_7_NTD0_NEPBS16_SU0_SUM0_SUS0_SVW4_VWA4_VWB1_WG32_8_1_WGM1_WGMXCC1_WGMXCCG0
    SolutionIndex: 497
    SolutionNameMin: Cijk_Alik_Bljk_F8NHS_BH_BiasSH_HAS_SAB_SAV_UserArgs_MT64x224x128_MI16x16x1_SN_LDSB1_GRVWA16_GRVWB16_GSU1_GSUC0_GSUWGMRR0_K1_LBSPPA256_LBSPPB128_LPA32_LPB32_LRVW16_MIWT2_7_SU16_SUM0_SUS128_SVW2_VWA2_VWB1_WG32_8_1_WGM8_WGMXCC8_WGMXCCG304
    SolutionIndex: 498
    SolutionNameMin: Cijk_Alik_Bljk_F8NHS_BH_BiasSH_HAS_SAB_SAV_UserArgs_MT128x256x128_MI16x16x1_SN_LDSB1_GRVWA16_GRVWB16_GSU2_GSUAMB_GSUC0_GSUWGMRR0_K1_LBSPPA1024_LBSPPB512_LPA32_LPB32_LRVW16_MIWT8_4_NTB0_NTD0_NEPBS16_SU0_SUM0_SUS0_SVW8_VWA8_VWB4_WG16_16_1_WGM1_WGMXCC1_WGMXCCG0
    SolutionIndex: 499
    SolutionNameMin: Cijk_Alik_Bljk_F8NHS_BH_BiasSH_HAS_SAB_SAV_UserArgs_MT112x256x128_MI16x16x1_SN_LDSB1_GRVWA8_GRVWB16_GSU2_GSUAMB_GSUC0_GSUWGMRR0_K1_LBSPPA128_LBSPPB512_LPA32_LPB32_LRVW16_MIWT7_4_NTD0_NEPBS16_SU0_SUM0_SUS0_SVW1_VWA1_VWB4_WG16_16_1_WGM1_WGMXCC1_WGMXCCG0
    SolutionIndex: 500
    SolutionNameMin: Cijk_Alik_Bljk_F8NHS_BH_BiasSH_HAS_SAB_SAV_UserArgs_MT128x256x128_MI16x16x1_SN_LDSB1_GRVWA16_GRVWB16_GSU4_GSUAMB_GSUC0_GSUWGMRR0_K1_LBSPPA512_LBSPPB1024_LPA32_LPB32_LRVW16_MIWT4_8_NTB0_NTD0_NEPBS16_SU0_SUM0_SUS0_SVW4_VWA4_VWB8_WG32_8_1_WGM1_WGMXCC1_WGMXCCG0
    SolutionIndex: 501
    SolutionNameMin: Cijk_Alik_Bljk_F8NHS_BH_BiasSH_HAS_SAB_SAV_UserArgs_MT112x256x128_MI16x16x1_SN_LDSB1_GRVWA8_GRVWB16_GSU2_GSUAMB_GSUC0_GSUWGMRR0_K1_LBSPPA128_LBSPPB512_LPA32_LPB32_LRVW16_MIWT7_4_NTB0_NTD0_NEPBS16_SU0_SUM0_SUS0_SVW1_VWA1_VWB4_WG16_16_1_WGM1_WGMXCC1_WGMXCCG0
    SolutionIndex: 502
    SolutionNameMin: Cijk_Alik_Bljk_F8NHS_BH_BiasSH_HAS_SAB_SAV_UserArgs_MT112x128x128_MI16x16x1_SN_LDSB1_GRVWA8_GRVWB16_GSU1_GSUC0_GSUWGMRR0_K1_LBSPPA128_LBSPPB256_LPA32_LPB32_LRVW16_MIWT7_2_SU16_SUM0_SUS128_SVW1_VWA1_VWB2_WG16_16_1_WGM8_WGMXCC8_WGMXCCG304
    SolutionIndex: 503
    SolutionNameMin: Cijk_Alik_Bljk_F8NHS_BH_BiasSH_HAS_SAB_SAV_UserArgs_MT64x288x128_MI16x16x1_SN_LDSB1_GRVWA16_GRVWB16_GSU1_GSUC0_GSUWGMRR0_K1_LBSPPA256_LBSPPB128_LPA32_LPB32_LRVW16_MIWT2_9_NTA4_NTB0_SU8_SUM0_SUS128_SVW2_VWA2_VWB1_WG32_8_1_WGM1_WGMXCC8_WGMXCCG304
    SolutionIndex: 504
    SolutionNameMin: Cijk_Alik_Bljk_F8NHS_BH_BiasSH_HAS_SAB_SAV_UserArgs_MT96x288x128_MI16x16x1_SN_LDSB1_GRVWA16_GRVWB16_GSU3_GSUAMB_GSUC0_GSUWGMRR0_K1_LBSPPA128_LBSPPB128_LPA32_LPB32_LRVW16_MIWT3_9_NTB0_NTD0_NEPBS16_SU0_SUM0_SUS0_SVW1_VWA1_VWB1_WG32_8_1_WGM1_WGMXCC1_WGMXCCG0
    SolutionIndex: 505
    SolutionNameMin: Cijk_Alik_Bljk_F8NHS_BH_BiasSH_HAS_SAB_SAV_UserArgs_MT128x288x128_MI16x16x1_SN_LDSB1_GRVWA16_GRVWB16_GSU2_GSUAMB_GSUC0_GSUWGMRR0_K1_LBSPPA512_LBSPPB128_LPA32_LPB32_LRVW16_MIWT4_9_NTB0_NTD0_NEPBS16_SU0_SUM0_SUS0_SVW4_VWA4_VWB1_WG32_8_1_WGM1_WGMXCC1_WGMXCCG0
    SolutionIndex: 506
    SolutionNameMin: Cijk_Alik_Bljk_F8NHS_BH_BiasSH_HAS_SAB_SAV_UserArgs_MT128x160x128_MI16x16x1_SN_LDSB1_GRVWA16_GRVWB16_GSU1_GSUC0_GSUWGMRR0_K1_LBSPPA512_LBSPPB128_LPA32_LPB32_LRVW16_MIWT4_5_NTB0_SU16_SUM0_SUS128_SVW4_VWA4_VWB1_WG32_8_1_WGM8_WGMXCC8_WGMXCCG304
    SolutionIndex: 507
    SolutionNameMin: Cijk_Alik_Bljk_F8NHS_BH_BiasSH_HAS_SAB_SAV_UserArgs_MT224x160x128_MI16x16x1_SN_LDSB1_GRVWA16_GRVWB16_GSU2_GSUAMB_GSUC0_GSUWGMRR0_K1_LBSPPA128_LBSPPB128_LPA32_LPB32_LRVW16_MIWT7_5_NTB0_NTD0_NEPBS16_SU0_SUM0_SUS0_SVW1_VWA1_VWB1_WG32_8_1_WGM1_WGMXCC1_WGMXCCG0
    SolutionIndex: 508
    SolutionNameMin: Cijk_Alik_Bljk_F8NHS_BH_BiasSH_HAS_SAB_SAV_UserArgs_MT96x96x256_MI16x16x1_SN_LDSB1_GRVWA16_GRVWB16_GSU1_GSUC0_GSUWGMRR0_K1_LBSPPA256_LBSPPB256_LPA32_LPB32_LRVW16_MIWT3_3_NTB0_SU16_SUM0_SUS256_SVW1_VWA1_VWB1_WG32_8_1_WGM8_WGMXCC8_WGMXCCG304
    SolutionIndex: 509
    SolutionNameMin: Cijk_Alik_Bljk_F8NHS_BH_BiasSH_HAS_SAB_SAV_UserArgs_MT224x160x128_MI16x16x1_SN_LDSB1_GRVWA16_GRVWB16_GSU2_GSUAMB_GSUC0_GSUWGMRR0_K1_LBSPPA128_LBSPPB128_LPA32_LPB32_LRVW16_MIWT7_5_NTD0_NEPBS16_SU0_SUM0_SUS0_SVW1_VWA1_VWB1_WG32_8_1_WGM1_WGMXCC1_WGMXCCG0
    SolutionIndex: 510
    SolutionNameMin: Cijk_Alik_Bljk_F8NHS_BH_BiasSH_HAS_SAB_SAV_UserArgs_MT128x160x128_MI16x16x1_SN_LDSB1_GRVWA16_GRVWB16_GSU1_GSUC0_GSUWGMRR0_K1_LBSPPA512_LBSPPB128_LPA32_LPB32_LRVW16_MIWT4_5_SU8_SUM1_SUS128_SVW4_VWA4_VWB1_WG32_8_1_WGM6_WGMXCC8_WGMXCCG304
    SolutionIndex: 511
    SolutionNameMin: Cijk_Alik_Bljk_F8NHS_BH_BiasSH_HAS_SAB_SAV_UserArgs_MT128x160x128_MI16x16x1_SN_LDSB1_GRVWA16_GRVWB16_GSU1_GSUAMB_GSUC0_GSUWGMRR0_K1_LBSPPA512_LBSPPB128_LPA32_LPB32_LRVW16_MIWT4_5_NTD4_NEPBS16_SU16_SUM0_SUS128_SVW4_VWA4_VWB1_WG32_8_1_WGM6_WGMXCC8_WGMXCCG304
    SolutionIndex: 512
    SolutionNameMin: Cijk_Alik_Bljk_F8NHS_BH_BiasSH_HAS_SAB_SAV_UserArgs_MT128x160x128_MI16x16x1_SN_LDSB1_GRVWA16_GRVWB16_GSU1_GSUC0_GSUWGMRR0_K1_LBSPPA512_LBSPPB128_LPA32_LPB32_LRVW16_MIWT4_5_SU16_SUM0_SUS128_SVW4_VWA4_VWB1_WG32_8_1_WGM8_WGMXCC8_WGMXCCG304
    SolutionIndex: 513
    SolutionNameMin: Cijk_Alik_Bljk_F8NHS_BH_BiasSH_HAS_SAB_SAV_UserArgs_MT128x160x128_MI16x16x1_SN_LDSB1_GRVWA16_GRVWB16_GSU1_GSUAMB_GSUC0_GSUWGMRR0_K1_LBSPPA512_LBSPPB128_LPA32_LPB32_LRVW16_MIWT4_5_NTD4_NEPBS16_SU16_SUM0_SUS128_SVW4_VWA4_VWB1_WG32_8_1_WGM6_WGMXCC8_WGMXCCG304
    SolutionIndex: 514
    SolutionNameMin: Cijk_Alik_Bljk_F8NHS_BH_BiasSH_HAS_SAB_SAV_UserArgs_MT128x160x128_MI16x16x1_SN_LDSB1_GRVWA16_GRVWB16_GSU1_GSUAMB_GSUC0_GSUWGMRR0_K1_LBSPPA512_LBSPPB128_LPA32_LPB32_LRVW16_MIWT4_5_NTD4_NEPBS16_SU16_SUM0_SUS128_SVW4_VWA4_VWB1_WG32_8_1_WGM6_WGMXCC8_WGMXCCG304
    SolutionIndex: 515
    SolutionNameMin: Cijk_Alik_Bljk_F8NHS_BH_BiasSH_HAS_SAB_SAV_UserArgs_MT128x192x128_MI16x16x1_SN_LDSB1_GRVWA16_GRVWB16_GSU1_GSUAMB_GSUC0_GSUWGMRR0_K1_LBSPPA512_LBSPPB256_LPA32_LPB32_LRVW16_MIWT4_6_NTB0_NTD4_NEPBS16_SU16_SUM0_SUS128_SVW4_VWA4_VWB2_WG32_8_1_WGM6_WGMXCC8_WGMXCCG304
    SolutionIndex: 516
    SolutionNameMin: Cijk_Alik_Bljk_F8NHS_BH_BiasSH_HAS_SAB_SAV_UserArgs_MT224x192x128_MI16x16x1_SN_LDSB1_GRVWA16_GRVWB16_GSU2_GSUAMB_GSUC0_GSUWGMRR0_K1_LBSPPA128_LBSPPB256_LPA32_LPB32_LRVW16_MIWT7_6_NTD0_NEPBS16_SU0_SUM0_SUS0_SVW1_VWA1_VWB2_WG32_8_1_WGM1_WGMXCC1_WGMXCCG0
    SolutionIndex: 517
    SolutionNameMin: Cijk_Alik_Bljk_F8NHS_BH_BiasSH_HAS_SAB_SAV_UserArgs_MT112x192x128_MI16x16x1_SN_LDSB1_GRVWA8_GRVWB16_GSU1_GSUC0_GSUWGMRR0_K1_LBSPPA128_LBSPPB128_LPA32_LPB32_LRVW16_MIWT7_3_SU16_SUM0_SUS128_SVW1_VWA1_VWB1_WG16_16_1_WGM8_WGMXCC8_WGMXCCG304
    SolutionIndex: 518
    SolutionNameMin: Cijk_Alik_Bljk_F8NHS_BH_BiasSH_HAS_SAB_SAV_UserArgs_MT192x128x128_MI16x16x1_SN_LDSB1_GRVWA16_GRVWB16_GSU1_GSUC0_GSUWGMRR0_K1_LBSPPA256_LBSPPB512_LPA32_LPB32_LRVW16_MIWT6_4_NTB0_SU8_SUM1_SUS128_SVW2_VWA2_VWB4_WG32_8_1_WGM6_WGMXCC8_WGMXCCG304
    SolutionIndex: 519
    SolutionNameMin: Cijk_Alik_Bljk_F8NHS_BH_BiasSH_HAS_SAB_SAV_UserArgs_MT112x192x128_MI16x16x1_SN_LDSB1_GRVWA8_GRVWB16_GSU1_GSUC0_GSUWGMRR0_K1_LBSPPA128_LBSPPB128_LPA32_LPB32_LRVW16_MIWT7_3_NTA0_NTB0_SU8_SUM0_SUS128_SVW1_VWA1_VWB1_WG16_16_1_WGM1_WGMXCC8_WGMXCCG304
    SolutionIndex: 520
    SolutionNameMin: Cijk_Alik_Bljk_F8NHS_BH_BiasSH_HAS_SAB_SAV_UserArgs_MT192x128x128_MI16x16x1_SN_LDSB1_GRVWA16_GRVWB16_GSU1_GSUAMB_GSUC0_GSUWGMRR0_K1_LBSPPA256_LBSPPB512_LPA32_LPB32_LRVW16_MIWT6_4_NTB0_NTD4_NEPBS16_SU16_SUM0_SUS128_SVW2_VWA2_VWB4_WG32_8_1_WGM6_WGMXCC8_WGMXCCG304
    SolutionIndex: 521
    SolutionNameMin: Cijk_Alik_Bljk_F8NHS_BH_BiasSH_HAS_SAB_SAV_UserArgs_MT192x128x128_MI16x16x1_SN_LDSB1_GRVWA16_GRVWB16_GSU1_GSUAMB_GSUC0_GSUWGMRR0_K1_LBSPPA256_LBSPPB512_LPA32_LPB32_LRVW16_MIWT6_4_NTD4_NEPBS16_SU16_SUM0_SUS128_SVW2_VWA2_VWB4_WG32_8_1_WGM6_WGMXCC8_WGMXCCG304
    SolutionIndex: 522
    SolutionNameMin: Cijk_Alik_Bljk_F8NHS_BH_BiasSH_HAS_SAB_SAV_UserArgs_MT128x224x128_MI16x16x1_SN_LDSB1_GRVWA16_GRVWB16_GSU1_GSUC0_GSUWGMRR0_K1_LBSPPA512_LBSPPB128_LPA32_LPB32_LRVW16_MIWT4_7_SU16_SUM0_SUS128_SVW4_VWA4_VWB1_WG32_8_1_WGM8_WGMXCC8_WGMXCCG304
    SolutionIndex: 523
    SolutionNameMin: Cijk_Alik_Bljk_F8NHS_BH_BiasSH_HAS_SAB_SAV_UserArgs_MT128x224x128_MI16x16x1_SN_LDSB1_GRVWA16_GRVWB16_GSU1_GSUAMB_GSUC0_GSUWGMRR0_K1_LBSPPA512_LBSPPB128_LPA32_LPB32_LRVW16_MIWT4_7_NTB0_NTD4_NEPBS16_SU16_SUM0_SUS128_SVW4_VWA4_VWB1_WG32_8_1_WGM6_WGMXCC8_WGMXCCG304
    SolutionIndex: 524
    SolutionNameMin: Cijk_Alik_Bljk_F8NHS_BH_BiasSH_HAS_SAB_SAV_UserArgs_MT128x224x128_MI16x16x1_SN_LDSB1_GRVWA16_GRVWB16_GSU1_GSUAMB_GSUC0_GSUWGMRR0_K1_LBSPPA512_LBSPPB128_LPA32_LPB32_LRVW16_MIWT4_7_NTB0_NTD4_NEPBS16_SU16_SUM0_SUS128_SVW4_VWA4_VWB1_WG32_8_1_WGM6_WGMXCC8_WGMXCCG304
    SolutionIndex: 525
    SolutionNameMin: Cijk_Alik_Bljk_F8NHS_BH_BiasSH_HAS_SAB_SAV_UserArgs_MT128x224x128_MI16x16x1_SN_LDSB1_GRVWA16_GRVWB16_GSU1_GSUC0_GSUWGMRR0_K1_LBSPPA512_LBSPPB128_LPA32_LPB32_LRVW16_MIWT4_7_NTB0_SU8_SUM1_SUS128_SVW4_VWA4_VWB1_WG32_8_1_WGM6_WGMXCC8_WGMXCCG304
    SolutionIndex: 526
    SolutionNameMin: Cijk_Alik_Bljk_F8NHS_BH_BiasSH_HAS_SAB_SAV_UserArgs_MT128x224x128_MI16x16x1_SN_LDSB1_GRVWA16_GRVWB16_GSU1_GSUC0_GSUWGMRR0_K1_LBSPPA512_LBSPPB128_LPA32_LPB32_LRVW16_MIWT4_7_SU16_SUM0_SUS128_SVW4_VWA4_VWB1_WG32_8_1_WGM8_WGMXCC8_WGMXCCG304
    SolutionIndex: 527
    SolutionNameMin: Cijk_Alik_Bljk_F8NHS_BH_BiasSH_HAS_SAB_SAV_UserArgs_MT112x256x128_MI16x16x1_SN_LDSB1_GRVWA8_GRVWB16_GSU1_GSUAMB_GSUC0_GSUWGMRR0_K1_LBSPPA128_LBSPPB512_LPA32_LPB32_LRVW16_MIWT7_4_NTD4_NEPBS16_SU16_SUM0_SUS128_SVW1_VWA1_VWB4_WG16_16_1_WGM6_WGMXCC8_WGMXCCG304
    SolutionIndex: 528
    SolutionNameMin: Cijk_Alik_Bljk_F8NHS_BH_BiasSH_HAS_SAB_SAV_UserArgs_MT128x224x128_MI16x16x1_SN_LDSB1_GRVWA16_GRVWB16_GSU1_GSUC0_GSUWGMRR0_K1_LBSPPA512_LBSPPB128_LPA32_LPB32_LRVW16_MIWT4_7_SU16_SUM0_SUS128_SVW4_VWA4_VWB1_WG32_8_1_WGM8_WGMXCC8_WGMXCCG304
    SolutionIndex: 529
    SolutionNameMin: Cijk_Alik_Bljk_F8NHS_BH_BiasSH_HAS_SAB_SAV_UserArgs_MT128x224x128_MI16x16x1_SN_LDSB1_GRVWA16_GRVWB16_GSU1_GSUAMB_GSUC0_GSUWGMRR0_K1_LBSPPA512_LBSPPB128_LPA32_LPB32_LRVW16_MIWT4_7_NTD4_NEPBS16_SU16_SUM0_SUS128_SVW4_VWA4_VWB1_WG32_8_1_WGM6_WGMXCC8_WGMXCCG304
    SolutionIndex: 530
    SolutionNameMin: Cijk_Alik_Bljk_F8NHS_BH_BiasSH_HAS_SAB_SAV_UserArgs_MT192x160x128_MI16x16x1_SN_LDSB1_GRVWA16_GRVWB16_GSU1_GSUC0_GSUWGMRR0_K1_LBSPPA256_LBSPPB128_LPA32_LPB32_LRVW16_MIWT6_5_NTB0_SU8_SUM1_SUS128_SVW2_VWA2_VWB1_WG32_8_1_WGM6_WGMXCC8_WGMXCCG304
    SolutionIndex: 531
    SolutionNameMin: Cijk_Alik_Bljk_F8NHS_BH_BiasSH_HAS_SAB_SAV_UserArgs_MT192x160x128_MI16x16x1_SN_LDSB1_GRVWA16_GRVWB16_GSU1_GSUAMB_GSUC0_GSUWGMRR0_K1_LBSPPA256_LBSPPB128_LPA32_LPB32_LRVW16_MIWT6_5_NTD4_NEPBS16_SU16_SUM0_SUS128_SVW2_VWA2_VWB1_WG32_8_1_WGM6_WGMXCC8_WGMXCCG304
    SolutionIndex: 532
    SolutionNameMin: Cijk_Alik_Bljk_F8NHS_BH_BiasSH_HAS_SAB_SAV_UserArgs_MT128x256x128_MI16x16x1_SN_LDSB1_GRVWA16_GRVWB16_GSU1_GSUAMB_GSUC0_GSUWGMRR0_K1_LBSPPA1024_LBSPPB512_LPA32_LPB32_LRVW16_MIWT8_4_NTD4_NEPBS16_SU16_SUM0_SUS128_SVW8_VWA8_VWB4_WG16_16_1_WGM6_WGMXCC8_WGMXCCG304
    SolutionIndex: 533
    SolutionNameMin: Cijk_Alik_Bljk_F8NHS_BH_BiasSH_HAS_SAB_SAV_UserArgs_MT192x160x128_MI16x16x1_SN_LDSB1_GRVWA16_GRVWB16_GSU1_LBSPPA256_LBSPPB128_LPA32_LPB32_LRVW16_MIWT6_5_NEPBS0_SU0_SUM0_SUS0_SVW2_VWA2_WG32_8_1_WGM1
    SolutionIndex: 534
    SolutionNameMin: Cijk_Alik_Bljk_F8NHS_BH_BiasSH_HAS_SAB_SAV_UserArgs_MT128x256x128_MI16x16x1_SN_LDSB1_GRVWA16_GRVWB16_GSU1_GSUC0_GSUWGMRR0_K1_LBSPPA1024_LBSPPB512_LPA32_LPB32_LRVW16_MIWT8_4_SU16_SUM0_SUS128_SVW8_VWA8_VWB4_WG16_16_1_WGM8_WGMXCC8_WGMXCCG304
    SolutionIndex: 535
    SolutionNameMin: Cijk_Alik_Bljk_F8NHS_BH_BiasSH_HAS_SAB_SAV_UserArgs_MT256x128x128_MI16x16x1_SN_LDSB1_GRVWA16_GRVWB16_GSU1_LBSPPA1024_LBSPPB128_LPA32_LPB32_LRVW16_MIWT8_4_NEPBS0_SU0_SUM0_SUS0_SVW8_VWA8_WG32_8_1_WGM1
    SolutionIndex: 536
    SolutionNameMin: Cijk_Alik_Bljk_F8NHS_BH_BiasSH_HAS_SAB_SAV_UserArgs_MT128x256x128_MI16x16x1_SN_LDSB1_GRVWA16_GRVWB16_GSU1_GSUC0_GSUWGMRR0_K1_LBSPPA512_LBSPPB1024_LPA32_LPB32_LRVW16_MIWT4_8_NTB0_SU16_SUM0_SUS128_SVW4_VWA4_VWB8_WG32_8_1_WGM8_WGMXCC8_WGMXCCG304
    SolutionIndex: 537
    SolutionNameMin: Cijk_Alik_Bljk_F8NHS_BH_BiasSH_HAS_SAB_SAV_UserArgs_MT128x256x128_MI16x16x1_SN_LDSB1_GRVWA16_GRVWB16_GSU1_GSUAMB_GSUC0_GSUWGMRR0_K1_LBSPPA1024_LBSPPB512_LPA32_LPB32_LRVW16_MIWT8_4_NTB0_NTD4_NEPBS16_SU16_SUM0_SUS128_SVW8_VWA8_VWB4_WG16_16_1_WGM6_WGMXCC8_WGMXCCG304
    SolutionIndex: 538
    SolutionNameMin: Cijk_Alik_Bljk_F8NHS_BH_BiasSH_HAS_SAB_SAV_UserArgs_MT192x192x128_MI16x16x1_SN_LDSB1_GRVWA16_GRVWB16_GSU1_GSUC0_GSUWGMRR0_K1_LBSPPA256_LBSPPB256_LPA32_LPB32_LRVW16_MIWT6_6_NTB0_SU8_SUM1_SUS128_SVW2_VWA2_VWB2_WG32_8_1_WGM6_WGMXCC8_WGMXCCG304
    SolutionIndex: 539
    SolutionNameMin: Cijk_Alik_Bljk_F8NHS_BH_BiasSH_HAS_SAB_SAV_UserArgs_MT192x192x128_MI16x16x1_SN_LDSB1_GRVWA16_GRVWB16_GSU1_GSUAMB_GSUC0_GSUWGMRR0_K1_LBSPPA256_LBSPPB256_LPA32_LPB32_LRVW16_MIWT6_6_NTD4_NEPBS16_SU16_SUM0_SUS128_SVW2_VWA2_VWB2_WG32_8_1_WGM6_WGMXCC8_WGMXCCG304
    SolutionIndex: 540
    SolutionNameMin: Cijk_Alik_Bljk_F8NHS_BH_BiasSH_HAS_SAB_SAV_UserArgs_MT176x192x128_MI16x16x1_SN_LDSB1_GRVWA8_GRVWB16_GSU1_LBSPPA128_LBSPPB128_LPA32_LPB32_LRVW16_MIWT11_3_NEPBS0_SU0_SUM0_SUS0_SVW1_VWA1_WG16_16_1_WGM1
    SolutionIndex: 541
    SolutionNameMin: Cijk_Alik_Bljk_F8NHS_BH_BiasSH_HAS_SAB_SAV_UserArgs_MT128x288x128_MI16x16x1_SN_LDSB1_GRVWA16_GRVWB16_GSU1_GSUC0_GSUWGMRR0_K1_LBSPPA512_LBSPPB128_LPA32_LPB32_LRVW16_MIWT4_9_NTB0_SU16_SUM0_SUS128_SVW4_VWA4_VWB1_WG32_8_1_WGM8_WGMXCC8_WGMXCCG304
    SolutionIndex: 542
    SolutionNameMin: Cijk_Alik_Bljk_F8NHS_BH_BiasSH_HAS_SAB_SAV_UserArgs_MT192x192x128_MI16x16x1_SN_LDSB1_GRVWA16_GRVWB16_GSU1_LBSPPA256_LBSPPB128_LPA32_LPB32_LRVW16_MIWT6_6_NEPBS0_SU0_SUM0_SUS0_SVW2_VWA2_WG32_8_1_WGM1
    SolutionIndex: 543
    SolutionNameMin: Cijk_Alik_Bljk_F8NHS_BH_BiasSH_HAS_SAB_SAV_UserArgs_MT224x160x128_MI16x16x1_SN_LDSB1_GRVWA16_GRVWB16_GSU1_GSUAMB_GSUC0_GSUWGMRR0_K1_LBSPPA128_LBSPPB128_LPA32_LPB32_LRVW16_MIWT7_5_NTD4_NEPBS16_SU16_SUM0_SUS128_SVW1_VWA1_VWB1_WG32_8_1_WGM6_WGMXCC8_WGMXCCG304
    SolutionIndex: 544
    SolutionNameMin: Cijk_Alik_Bljk_F8NHS_BH_BiasSH_HAS_SAB_SAV_UserArgs_MT224x160x128_MI16x16x1_SN_LDSB1_GRVWA16_GRVWB16_GSU1_GSUC0_GSUWGMRR0_K1_LBSPPA128_LBSPPB128_LPA32_LPB32_LRVW16_MIWT7_5_NTB0_SU8_SUM1_SUS128_SVW1_VWA1_VWB1_WG32_8_1_WGM6_WGMXCC8_WGMXCCG304
    SolutionIndex: 545
    SolutionNameMin: Cijk_Alik_Bljk_F8NHS_BH_BiasSH_HAS_SAB_SAV_UserArgs_MT224x160x128_MI16x16x1_SN_LDSB1_GRVWA16_GRVWB16_GSU1_GSUC0_GSUWGMRR0_K1_LBSPPA128_LBSPPB128_LPA32_LPB32_LRVW16_MIWT7_5_SU8_SUM1_SUS128_SVW1_VWA1_VWB1_WG32_8_1_WGM6_WGMXCC8_WGMXCCG304
    SolutionIndex: 546
    SolutionNameMin: Cijk_Alik_Bljk_F8NHS_BH_BiasSH_HAS_SAB_SAV_UserArgs_MT128x352x128_MI16x16x1_SN_LDSB1_GRVWA8_GRVWB8_GSU1_GSUC0_GSUWGMRR0_K1_LBSPPA512_LBSPPB128_LPA8_LPB8_LRVW8_MIWT4_11_NTB0_SU16_SUM0_SUS128_SVW4_VWA4_VWB1_WG32_8_1_WGM8_WGMXCC8_WGMXCCG304
    SolutionIndex: 547
    SolutionNameMin: Cijk_Alik_Bljk_F8NHS_BH_BiasSH_HAS_SAB_SAV_UserArgs_MT192x256x128_MI16x16x1_SN_LDSB1_GRVWA16_GRVWB16_GSU1_GSUAMB_GSUC0_GSUWGMRR0_K1_LBSPPA512_LBSPPB512_LPA32_LPB32_LRVW16_MIWT12_4_NTD4_NEPBS16_SU16_SUM0_SUS128_SVW4_VWA4_VWB4_WG16_16_1_WGM6_WGMXCC8_WGMXCCG304
    SolutionIndex: 548
    SolutionNameMin: Cijk_Alik_Bljk_F8NHS_BH_BiasSH_HAS_SAB_SAV_UserArgs_MT160x160x128_MI16x16x1_SN_LDSB1_GRVWA16_GRVWB16_GSU1_GSUC0_GSUWGMRR0_K1_LBSPPA128_LBSPPB128_LPA32_LPB32_LRVW16_MIWT5_5_SU16_SUM0_SUS128_SVW1_VWA1_VWB1_WG32_8_1_WGM8_WGMXCC8_WGMXCCG304
    SolutionIndex: 549
    SolutionNameMin: Cijk_Alik_Bljk_F8NHS_BH_BiasSH_HAS_SAB_SAV_UserArgs_MT256x208x128_MI16x16x1_SN_LDSB1_GRVWA8_GRVWB8_GSU1_GSUAMB_GSUC0_GSUWGMRR0_K1_LBSPPA512_LBSPPB128_LPA8_LPB8_LRVW8_MIWT4_13_NTD4_NEPBS16_SU16_SUM0_SUS128_SVW4_VWA4_VWB1_WG64_4_1_WGM6_WGMXCC8_WGMXCCG304
    SolutionIndex: 550
    SolutionNameMin: Cijk_Alik_Bljk_F8NHS_BH_BiasSH_HAS_SAB_SAV_UserArgs_MT192x128x128_MI16x16x1_SN_LDSB1_GRVWA16_GRVWB16_GSU1_GSUC0_GSUWGMRR0_K1_LBSPPA256_LBSPPB512_LPA32_LPB32_LRVW16_MIWT6_4_SU16_SUM0_SUS128_SVW2_VWA2_VWB4_WG32_8_1_WGM8_WGMXCC8_WGMXCCG304
    SolutionIndex: 551
    SolutionNameMin: Cijk_Alik_Bljk_F8NHS_BH_BiasSH_HAS_SAB_SAV_UserArgs_MT192x288x128_MI16x16x1_SN_LDSB1_GRVWA8_GRVWB8_GSU1_GSUC0_GSUWGMRR0_K1_LBSPPA256_LBSPPB128_LPA8_LPB8_LRVW8_MIWT6_9_NTB0_SU16_SUM0_SUS128_SVW2_VWA2_VWB1_WG32_8_1_WGM8_WGMXCC8_WGMXCCG304
    SolutionIndex: 552
    SolutionNameMin: Cijk_Alik_Bljk_F8NHS_BH_BiasSH_HAS_SAB_SAV_UserArgs_MT224x224x128_MI16x16x1_SN_LDSB1_GRVWA8_GRVWB8_GSU1_GSUAMB_GSUC0_GSUWGMRR0_K1_LBSPPA128_LBSPPB128_LPA8_LPB8_LRVW8_MIWT7_7_NTB0_NTD4_NEPBS16_SU16_SUM0_SUS128_SVW1_VWA1_VWB1_WG32_8_1_WGM6_WGMXCC8_WGMXCCG304
    SolutionIndex: 553
    SolutionNameMin: Cijk_Alik_Bljk_F8NHS_BH_BiasSH_HAS_SAB_SAV_UserArgs_MT192x288x128_MI16x16x1_SN_LDSB1_GRVWA8_GRVWB8_GSU1_GSUC0_GSUWGMRR0_K1_LBSPPA256_LBSPPB128_LPA8_LPB8_LRVW8_MIWT6_9_NTB0_SU8_SUM1_SUS128_SVW2_VWA2_VWB1_WG32_8_1_WGM6_WGMXCC8_WGMXCCG304
    SolutionIndex: 554
    SolutionNameMin: Cijk_Alik_Bljk_F8NHS_BH_BiasSH_HAS_SAB_SAV_UserArgs_MT224x224x128_MI16x16x1_SN_LDSB1_GRVWA8_GRVWB8_GSU1_GSUC0_GSUWGMRR0_K1_LBSPPA128_LBSPPB128_LPA8_LPB8_LRVW8_MIWT7_7_SU16_SUM0_SUS128_SVW1_VWA1_VWB1_WG32_8_1_WGM8_WGMXCC8_WGMXCCG304
    SolutionIndex: 555
    SolutionNameMin: Cijk_Alik_Bljk_F8NHS_BH_BiasSH_HAS_SAB_SAV_UserArgs_MT288x192x128_MI16x16x1_SN_LDSB1_GRVWA8_GRVWB8_GSU1_GSUC0_GSUWGMRR0_K1_LBSPPA256_LBSPPB128_LPA8_LPB8_LRVW8_MIWT18_3_NTB0_SU16_SUM0_SUS128_SVW2_VWA2_VWB1_WG16_16_1_WGM8_WGMXCC8_WGMXCCG304
    SolutionIndex: 556
    SolutionNameMin: Cijk_Alik_Bljk_F8NHS_BH_BiasSH_HAS_SAB_SAV_UserArgs_MT288x192x128_MI16x16x1_SN_LDSB1_GRVWA8_GRVWB8_GSU1_GSUC0_GSUWGMRR0_K1_LBSPPA128_LBSPPB256_LPA8_LPB8_LRVW8_MIWT9_6_NTB0_SU8_SUM1_SUS128_SVW1_VWA1_VWB2_WG32_8_1_WGM6_WGMXCC8_WGMXCCG304
    SolutionIndex: 557
    SolutionNameMin: Cijk_Alik_Bljk_F8NHS_BH_BiasSH_HAS_SAB_SAV_UserArgs_MT224x256x128_MI16x16x1_SN_LDSB1_GRVWA8_GRVWB8_GSU1_GSUAMB_GSUC0_GSUWGMRR0_K1_LBSPPA128_LBSPPB1024_LPA8_LPB8_LRVW8_MIWT7_8_NTB0_NTD4_NEPBS16_SU16_SUM0_SUS128_SVW1_VWA1_VWB8_WG32_8_1_WGM6_WGMXCC8_WGMXCCG304
    SolutionIndex: 558
    SolutionNameMin: Cijk_Alik_Bljk_F8NHS_BH_BiasSH_HAS_SAB_SAV_UserArgs_MT224x256x128_MI16x16x1_SN_LDSB1_GRVWA8_GRVWB8_GSU1_GSUC0_GSUWGMRR0_K1_LBSPPA128_LBSPPB1024_LPA8_LPB8_LRVW8_MIWT7_8_SU16_SUM0_SUS128_SVW1_VWA1_VWB8_WG32_8_1_WGM8_WGMXCC8_WGMXCCG304
    SolutionIndex: 559
    SolutionNameMin: Cijk_Alik_Bljk_F8NHS_BH_BiasSH_HAS_SAB_SAV_UserArgs_MT224x256x128_MI16x16x1_SN_LDSB1_GRVWA8_GRVWB8_GSU1_GSUAMB_GSUC0_GSUWGMRR0_K1_LBSPPA128_LBSPPB1024_LPA8_LPB8_LRVW8_MIWT7_8_NTD4_NEPBS16_SU16_SUM0_SUS128_SVW1_VWA1_VWB8_WG32_8_1_WGM6_WGMXCC8_WGMXCCG304
    SolutionIndex: 560
    SolutionNameMin: Cijk_Alik_Bljk_F8NHS_BH_BiasSH_HAS_SAB_SAV_UserArgs_MT224x256x128_MI16x16x1_SN_LDSB1_GRVWA8_GRVWB8_GSU1_GSUAMB_GSUC0_GSUWGMRR0_K1_LBSPPA128_LBSPPB1024_LPA8_LPB8_LRVW8_MIWT7_8_NTD4_NEPBS16_SU16_SUM0_SUS128_SVW1_VWA1_VWB8_WG32_8_1_WGM6_WGMXCC8_WGMXCCG304
    SolutionIndex: 561
    SolutionNameMin: Cijk_Alik_Bljk_F8NHS_BH_BiasSH_HAS_SAB_SAV_UserArgs_MT192x160x128_MI16x16x1_SN_LDSB1_GRVWA16_GRVWB16_GSU1_GSUC0_GSUWGMRR0_K1_LBSPPA256_LBSPPB128_LPA32_LPB32_LRVW16_MIWT6_5_SU16_SUM0_SUS128_SVW2_VWA2_VWB1_WG32_8_1_WGM8_WGMXCC8_WGMXCCG304
    SolutionIndex: 562
    SolutionNameMin: Cijk_Alik_Bljk_F8NHS_BH_BiasSH_HAS_SAB_SAV_UserArgs_MT192x160x128_MI16x16x1_SN_LDSB1_GRVWA16_GRVWB16_GSU1_GSUC0_GSUWGMRR0_K1_LBSPPA256_LBSPPB128_LPA32_LPB32_LRVW16_MIWT6_5_NTB0_SU8_SUM1_SUS128_SVW2_VWA2_VWB1_WG32_8_1_WGM6_WGMXCC8_WGMXCCG304
    SolutionIndex: 563
    SolutionNameMin: Cijk_Alik_Bljk_F8NHS_BH_BiasSH_HAS_SAB_SAV_UserArgs_MT224x288x64_MI16x16x1_SN_LDSB1_GRVWA8_GRVWB8_GSU1_GSUC0_GSUWGMRR0_K1_LBSPPA128_LBSPPB128_LPA8_LPB8_LRVW8_MIWT7_9_NTB0_SU16_SUM0_SUS64_SVW1_VWA1_VWB1_WG32_8_1_WGM8_WGMXCC8_WGMXCCG304
    SolutionIndex: 564
    SolutionNameMin: Cijk_Alik_Bljk_F8NHS_BH_BiasSH_HAS_SAB_SAV_UserArgs_MT192x192x128_MI16x16x1_SN_LDSB1_GRVWA16_GRVWB16_GSU1_GSUC0_GSUWGMRR0_K1_LBSPPA256_LBSPPB256_LPA32_LPB32_LRVW16_MIWT6_6_SU16_SUM0_SUS128_SVW2_VWA2_VWB2_WG32_8_1_WGM8_WGMXCC8_WGMXCCG304
    SolutionIndex: 565
    SolutionNameMin: Cijk_Alik_Bljk_F8NHS_BH_BiasSH_HAS_SAB_SAV_UserArgs_MT16x16x512_MI16x16x1_SN_LDSB1_GRVWA16_GRVWB16_GSU1_GSUC0_GSUWGMRR0_K1_LBSPPA512_LBSPPB512_LPA32_LPB32_LRVW16_MIWT1_1_NTA4_NTB4_SU8_SUM0_SUS512_SVW1_VWA1_VWB1_WG16_4_4_WGM1_WGMXCC8_WGMXCCG304
    SolutionIndex: 566
    SolutionNameMin: Cijk_Alik_Bljk_F8NHS_BH_BiasSH_HAS_SAB_SAV_UserArgs_MT192x16x256_MI16x16x1_SN_LDSB1_GRVWA16_GRVWB16_GSU5_GSUAMB_GSUC0_GSUWGMRR0_K1_LBSPPA256_LBSPPB256_LPA32_LPB32_LRVW16_MIWT3_1_NTD0_NEPBS16_SU0_SUM0_SUS0_SVW1_VWA1_VWB1_WG64_4_1_WGM1_WGMXCC1_WGMXCCG0
    SolutionIndex: 567
    SolutionNameMin: Cijk_Alik_Bljk_F8NHS_BH_BiasSH_HAS_SAB_SAV_UserArgs_MT96x32x256_MI16x16x1_SN_LDSB1_GRVWA16_GRVWB16_GSU1_GSUAMB_GSUC0_GSUWGMRR0_K1_LBSPPA256_LBSPPB256_LPA32_LPB32_LRVW16_MIWT3_1_NTD4_NEPBS16_SU16_SUM0_SUS256_SVW1_VWA1_VWB1_WG32_8_1_WGM6_WGMXCC8_WGMXCCG304
    SolutionIndex: 568
    SolutionNameMin: Cijk_Alik_Bljk_F8NHS_BH_BiasSH_HAS_SAB_SAV_UserArgs_MT48x64x256_MI16x16x1_SN_LDSB1_GRVWA16_GRVWB16_GSU1_GSUAMB_GSUC0_GSUWGMRR0_K1_LBSPPA256_LBSPPB256_LPA32_LPB32_LRVW16_MIWT3_1_NTB0_NTD4_NEPBS16_SU16_SUM0_SUS256_SVW1_VWA1_VWB1_WG16_16_1_WGM6_WGMXCC8_WGMXCCG304
    SolutionIndex: 569
    SolutionNameMin: Cijk_Alik_Bljk_F8NHS_BH_BiasSH_HAS_SAB_SAV_UserArgs_MT80x64x256_MI16x16x1_SN_LDSB1_GRVWA16_GRVWB16_GSU1_GSUAMB_GSUC0_GSUWGMRR0_K1_LBSPPA256_LBSPPB256_LPA32_LPB32_LRVW16_MIWT5_1_NTD4_NEPBS16_SU16_SUM0_SUS256_SVW1_VWA1_VWB1_WG16_16_1_WGM6_WGMXCC8_WGMXCCG304
    SolutionIndex: 570
    SolutionNameMin: Cijk_Alik_Bljk_F8NHS_BH_BiasSH_HAS_SAB_SAV_UserArgs_MT128x80x256_MI16x16x1_SN_LDSB1_GRVWA16_GRVWB16_GSU1_GSUC0_GSUWGMRR0_K1_LBSPPA512_LBSPPB256_LPA32_LPB32_LRVW16_MIWT2_5_SU16_SUM0_SUS256_SVW2_VWA2_VWB1_WG64_4_1_WGM8_WGMXCC8_WGMXCCG304
    SolutionIndex: 571
    SolutionNameMin: Cijk_Alik_Bljk_F8NHS_BH_BiasSH_HAS_SAB_SAV_UserArgs_MT96x96x256_MI16x16x1_SN_LDSB1_GRVWA16_GRVWB16_GSU1_GSUAMB_GSUC0_GSUWGMRR0_K1_LBSPPA256_LBSPPB256_LPA32_LPB32_LRVW16_MIWT3_3_NTD4_NEPBS16_SU16_SUM0_SUS256_SVW1_VWA1_VWB1_WG32_8_1_WGM6_WGMXCC8_WGMXCCG304
    SolutionIndex: 572
    SolutionNameMin: Cijk_Alik_Bljk_F8NHS_BH_BiasSH_HAS_SAB_SAV_UserArgs_MT80x128x256_MI16x16x1_SN_LDSB1_GRVWA16_GRVWB16_GSU1_GSUC0_GSUWGMRR0_K1_LBSPPA256_LBSPPB512_LPA32_LPB32_LRVW16_MIWT5_2_NTA4_NTB0_SU8_SUM0_SUS256_SVW1_VWA1_VWB2_WG16_16_1_WGM1_WGMXCC8_WGMXCCG304
    SolutionIndex: 573
    SolutionNameMin: Cijk_Alik_Bljk_F8NHS_BH_BiasSH_HAS_SAB_SAV_UserArgs_MT80x128x256_MI16x16x1_SN_LDSB1_GRVWA16_GRVWB16_GSU1_GSUC0_GSUWGMRR0_K1_LBSPPA256_LBSPPB512_LPA32_LPB32_LRVW16_MIWT5_2_SU16_SUM0_SUS256_SVW1_VWA1_VWB2_WG16_16_1_WGM8_WGMXCC8_WGMXCCG304
    SolutionIndex: 574
    SolutionNameMin: Cijk_Alik_Bljk_F8NHS_BH_BiasSH_HAS_SAB_SAV_UserArgs_MT160x160x128_MI16x16x1_SN_LDSB1_GRVWA16_GRVWB16_GSU2_GSUAMB_GSUC0_GSUWGMRR0_K1_LBSPPA128_LBSPPB128_LPA32_LPB32_LRVW16_MIWT5_5_NTD0_NEPBS16_SU0_SUM0_SUS0_SVW1_VWA1_VWB1_WG32_8_1_WGM1_WGMXCC1_WGMXCCG0
    SolutionIndex: 575
    SolutionNameMin: Cijk_Alik_Bljk_F8NHS_BH_BiasSH_HAS_SAB_SAV_UserArgs_MT160x160x128_MI16x16x1_SN_LDSB1_GRVWA16_GRVWB16_GSU2_GSUAMB_GSUC0_GSUWGMRR0_K1_LBSPPA128_LBSPPB128_LPA32_LPB32_LRVW16_MIWT5_5_NTB0_NTD0_NEPBS16_SU0_SUM0_SUS0_SVW1_VWA1_VWB1_WG32_8_1_WGM1_WGMXCC1_WGMXCCG0
    SolutionIndex: 576
    SolutionNameMin: Cijk_Alik_Bljk_F8NHS_BH_BiasSH_HAS_SAB_SAV_UserArgs_MT144x192x128_MI16x16x1_SN_LDSB1_GRVWA8_GRVWB16_GSU2_GSUAMB_GSUC0_GSUWGMRR0_K1_LBSPPA128_LBSPPB128_LPA32_LPB32_LRVW16_MIWT9_3_NTD0_NEPBS16_SU0_SUM0_SUS0_SVW1_VWA1_VWB1_WG16_16_1_WGM1_WGMXCC1_WGMXCCG0
    SolutionIndex: 577
    SolutionNameMin: Cijk_Alik_Bljk_F8NHS_BH_BiasSH_HAS_SAB_SAV_UserArgs_MT144x192x128_MI16x16x1_SN_LDSB1_GRVWA8_GRVWB16_GSU2_GSUAMB_GSUC0_GSUWGMRR0_K1_LBSPPA128_LBSPPB128_LPA32_LPB32_LRVW16_MIWT9_3_NTB0_NTD0_NEPBS16_SU0_SUM0_SUS0_SVW1_VWA1_VWB1_WG16_16_1_WGM1_WGMXCC1_WGMXCCG0
    SolutionIndex: 578
    SolutionNameMin: Cijk_Alik_Bljk_F8NHS_BH_BiasSH_HAS_SAB_SAV_UserArgs_MT160x224x128_MI16x16x1_SN_LDSB1_GRVWA16_GRVWB16_GSU2_GSUAMB_GSUC0_GSUWGMRR0_K1_LBSPPA128_LBSPPB128_LPA32_LPB32_LRVW16_MIWT5_7_NTB0_NTD0_NEPBS16_SU0_SUM0_SUS0_SVW1_VWA1_VWB1_WG32_8_1_WGM1_WGMXCC1_WGMXCCG0
    SolutionIndex: 579
    SolutionNameMin: Cijk_Alik_Bljk_F8NHS_BH_BiasSH_HAS_SAB_SAV_UserArgs_MT160x160x128_MI16x16x1_SN_LDSB1_GRVWA16_GRVWB16_GSU1_GSUC0_GSUWGMRR0_K1_LBSPPA128_LBSPPB128_LPA32_LPB32_LRVW16_MIWT5_5_SU8_SUM1_SUS128_SVW1_VWA1_VWB1_WG32_8_1_WGM6_WGMXCC8_WGMXCCG304
    SolutionIndex: 580
    SolutionNameMin: Cijk_Alik_Bljk_F8NHS_BH_BiasSH_HAS_SAB_SAV_UserArgs_MT160x192x128_MI16x16x1_SN_LDSB1_GRVWA16_GRVWB16_GSU1_GSUC0_GSUWGMRR0_K1_LBSPPA256_LBSPPB128_LPA32_LPB32_LRVW16_MIWT10_3_SU8_SUM1_SUS128_SVW2_VWA2_VWB1_WG16_16_1_WGM6_WGMXCC8_WGMXCCG304
    SolutionIndex: 581
    SolutionNameMin: Cijk_Alik_Bljk_F8NHS_BH_BiasSH_HAS_SAB_SAV_UserArgs_MT160x192x128_MI16x16x1_SN_LDSB1_GRVWA16_GRVWB16_GSU1_GSUC0_GSUWGMRR0_K1_LBSPPA256_LBSPPB128_LPA32_LPB32_LRVW16_MIWT10_3_NTB0_SU8_SUM1_SUS128_SVW2_VWA2_VWB1_WG16_16_1_WGM6_WGMXCC8_WGMXCCG304
    SolutionIndex: 582
    SolutionNameMin: Cijk_Alik_Bljk_F8NHS_BH_BiasSH_HAS_SAB_SAV_UserArgs_MT160x192x128_MI16x16x1_SN_LDSB1_GRVWA16_GRVWB16_GSU1_GSUC0_GSUWGMRR0_K1_LBSPPA256_LBSPPB128_LPA32_LPB32_LRVW16_MIWT10_3_NTB0_SU8_SUM1_SUS128_SVW2_VWA2_VWB1_WG16_16_1_WGM6_WGMXCC8_WGMXCCG304
    SolutionIndex: 583
    SolutionNameMin: Cijk_Alik_Bljk_F8NHS_BH_BiasSH_HAS_SAB_SAV_UserArgs_MT160x224x128_MI16x16x1_SN_LDSB1_GRVWA16_GRVWB16_GSU1_GSUC0_GSUWGMRR0_K1_LBSPPA128_LBSPPB128_LPA32_LPB32_LRVW16_MIWT5_7_NTA0_NTB0_SU8_SUM0_SUS128_SVW1_VWA1_VWB1_WG32_8_1_WGM1_WGMXCC8_WGMXCCG304
    SolutionIndex: 584
    SolutionNameMin: Cijk_Alik_Bljk_F8NHS_BH_BiasSH_HAS_SAB_SAV_UserArgs_MT160x256x128_MI16x16x1_SN_LDSB1_GRVWA16_GRVWB16_GSU1_GSUC0_GSUWGMRR0_K1_LBSPPA256_LBSPPB512_LPA32_LPB32_LRVW16_MIWT10_4_SU8_SUM1_SUS128_SVW2_VWA2_VWB4_WG16_16_1_WGM6_WGMXCC8_WGMXCCG304
    SolutionIndex: 585
    SolutionNameMin: Cijk_Alik_Bljk_F8NHS_BH_BiasSH_HAS_SAB_SAV_UserArgs_MT160x256x128_MI16x16x1_SN_LDSB1_GRVWA16_GRVWB16_GSU1_GSUC0_GSUWGMRR0_K1_LBSPPA256_LBSPPB512_LPA32_LPB32_LRVW16_MIWT10_4_NTB0_SU8_SUM1_SUS128_SVW2_VWA2_VWB4_WG16_16_1_WGM6_WGMXCC8_WGMXCCG304
    SolutionIndex: 586
    SolutionNameMin: Cijk_Alik_Bljk_F8NHS_BH_BiasSH_HAS_SAB_SAV_UserArgs_MT224x192x128_MI16x16x1_SN_LDSB1_GRVWA16_GRVWB16_GSU1_GSUC0_GSUWGMRR0_K1_LBSPPA256_LBSPPB128_LPA32_LPB32_LRVW16_MIWT14_3_NTB0_SU8_SUM1_SUS128_SVW2_VWA2_VWB1_WG16_16_1_WGM6_WGMXCC8_WGMXCCG304
    SolutionIndex: 587
    SolutionNameMin: Cijk_Alik_Bljk_F8NHS_BH_BiasSH_HAS_SAB_SAV_UserArgs_MT224x192x128_MI16x16x1_SN_LDSB1_GRVWA16_GRVWB16_GSU1_GSUC0_GSUWGMRR0_K1_LBSPPA256_LBSPPB128_LPA32_LPB32_LRVW16_MIWT14_3_SU8_SUM1_SUS128_SVW2_VWA2_VWB1_WG16_16_1_WGM6_WGMXCC8_WGMXCCG304
    SolutionIndex: 588
    SolutionNameMin: Cijk_Alik_Bljk_F8NHS_BH_BiasSH_HAS_SAB_SAV_UserArgs_MT144x320x128_MI16x16x1_SN_LDSB1_GRVWA8_GRVWB8_GSU1_GSUC0_GSUWGMRR0_K1_LBSPPA128_LBSPPB128_LPA8_LPB8_LRVW8_MIWT9_5_NTB0_SU8_SUM1_SUS128_SVW1_VWA1_VWB1_WG16_16_1_WGM6_WGMXCC8_WGMXCCG304
    SolutionIndex: 589
    SolutionNameMin: Cijk_Alik_Bljk_F8NHS_BH_BiasSH_HAS_SAB_SAV_UserArgs_MT224x224x128_MI16x16x1_SN_LDSB1_GRVWA8_GRVWB8_GSU1_GSUC0_GSUWGMRR0_K1_LBSPPA128_LBSPPB128_LPA8_LPB8_LRVW8_MIWT7_7_SU8_SUM1_SUS128_SVW1_VWA1_VWB1_WG32_8_1_WGM6_WGMXCC8_WGMXCCG304
    SolutionIndex: 590
    SolutionNameMin: Cijk_Alik_Bljk_F8NHS_BH_BiasSH_HAS_SAB_SAV_UserArgs_MT208x256x128_MI16x16x1_SN_LDSB1_GRVWA8_GRVWB8_GSU1_GSUC0_GSUWGMRR0_K1_LBSPPA128_LBSPPB512_LPA8_LPB8_LRVW8_MIWT13_4_NTB0_SU8_SUM1_SUS128_SVW1_VWA1_VWB4_WG16_16_1_WGM6_WGMXCC8_WGMXCCG304
    SolutionIndex: 591
    SolutionNameMin: Cijk_Alik_Bljk_F8NHS_BH_BiasSH_HAS_SAB_SAV_UserArgs_MT160x256x128_MI16x16x1_SN_LDSB1_GRVWA16_GRVWB16_GSU1_GSUAMB_GSUC0_GSUWGMRR0_K1_LBSPPA256_LBSPPB512_LPA32_LPB32_LRVW16_MIWT10_4_NTD4_NEPBS16_SU16_SUM0_SUS128_SVW2_VWA2_VWB4_WG16_16_1_WGM6_WGMXCC8_WGMXCCG304
    SolutionIndex: 592
    SolutionNameMin: Cijk_Alik_Bljk_F8NHS_BH_BiasSH_HAS_SAB_SAV_UserArgs_MT320x128x128_MI16x16x1_SN_LDSB1_GRVWA16_GRVWB16_GSU1_GSUC0_GSUWGMRR0_K1_LBSPPA256_LBSPPB512_LPA32_LPB32_LRVW16_MIWT10_4_SU8_SUM1_SUS128_SVW2_VWA2_VWB4_WG32_8_1_WGM6_WGMXCC8_WGMXCCG304
    SolutionIndex: 593
    SolutionNameMin: Cijk_Alik_Bljk_F8NHS_BH_BiasSH_HAS_SAB_SAV_UserArgs_MT192x16x256_MI16x16x1_SN_LDSB1_GRVWA16_GRVWB16_GSU1_GSUC0_GSUWGMRR0_K1_LBSPPA256_LBSPPB256_LPA32_LPB32_LRVW16_MIWT3_1_NTA4_NTB4_SU8_SUM0_SUS256_SVW1_VWA1_VWB1_WG64_4_1_WGM1_WGMXCC8_WGMXCCG304
- - - [16, 16, 1, 256]
    - [448, 0.0]
  - - [16, 64, 1, 1024]
    - [0, 0.0]
  - - [16, 128, 1, 256]
    - [0, 0.0]
  - - [16, 768, 1, 256]
    - [0, 0.0]
  - - [32, 256, 1, 256]
    - [0, 0.0]
  - - [32, 384, 1, 256]
    - [0, 0.0]
  - - [32, 512, 1, 256]
    - [0, 0.0]
  - - [64, 96, 1, 256]
    - [0, 0.0]
  - - [64, 256, 1, 256]
    - [0, 0.0]
  - - [64, 512, 1, 256]
    - [0, 0.0]
  - - [96, 64, 1, 256]
    - [0, 0.0]
  - - [96, 128, 1, 256]
    - [0, 0.0]
  - - [96, 192, 1, 256]
    - [0, 0.0]
  - - [128, 32, 1, 256]
    - [0, 0.0]
  - - [128, 96, 1, 256]
    - [0, 0.0]
  - - [128, 192, 1, 256]
    - [0, 0.0]
  - - [384, 64, 1, 256]
    - [0, 0.0]
  - - [384, 128, 1, 1024]
    - [0, 0.0]
  - - [512, 64, 1, 256]
    - [0, 0.0]
  - - [16, 16, 1, 1024]
    - [1, 0.0]
  - - [64, 128, 1, 4096]
    - [1, 0.0]
  - - [128, 64, 1, 1024]
    - [1, 0.0]
  - - [16, 16, 1, 4096]
    - [2, 0.0]
  - - [16, 16, 1, 8192]
    - [3, 0.0]
  - - [16, 32, 1, 256]
    - [4, 0.0]
  - - [128, 128, 1, 256]
    - [4, 0.0]
  - - [16, 32, 1, 1024]
    - [5, 0.0]
  - - [16, 96, 1, 1024]
    - [5, 0.0]
  - - [64, 384, 1, 1024]
    - [5, 0.0]
  - - [256, 256, 1, 8192]
    - [5, 0.0]
  - - [384, 32, 1, 1024]
    - [17, 0.0]
  - - [768, 96, 1, 8192]
    - [5, 0.0]
  - - [16, 32, 1, 4096]
    - [6, 0.0]
  - - [16, 32, 1, 8192]
    - [6, 0.0]
  - - [32, 16, 1, 8192]
    - [6, 0.0]
  - - [16, 64, 1, 256]
    - [7, 0.0]
  - - [16, 64, 1, 4096]
    - [8, 0.0]
  - - [16, 96, 1, 4096]
    - [8, 0.0]
  - - [16, 128, 1, 4096]
    - [8, 0.0]
  - - [16, 192, 1, 4096]
    - [8, 0.0]
  - - [16, 256, 1, 1024]
    - [8, 0.0]
  - - [16, 256, 1, 4096]
    - [8, 0.0]
  - - [16, 384, 1, 1024]
    - [8, 0.0]
  - - [16, 384, 1, 4096]
    - [8, 0.0]
  - - [16, 512, 1, 1024]
    - [8, 0.0]
  - - [16, 512, 1, 4096]
    - [8, 0.0]
  - - [16, 768, 1, 4096]
    - [8, 0.0]
  - - [16, 1024, 1, 4096]
    - [8, 0.0]
  - - [16, 2048, 1, 4096]
    - [8, 0.0]
  - - [32, 128, 1, 1024]
    - [8, 0.0]
  - - [32, 128, 1, 4096]
    - [8, 0.0]
  - - [32, 192, 1, 4096]
    - [8, 0.0]
  - - [32, 256, 1, 1024]
    - [8, 0.0]
  - - [32, 256, 1, 4096]
    - [8, 0.0]
  - - [32, 384, 1, 1024]
    - [8, 0.0]
  - - [32, 384, 1, 4096]
    - [8, 0.0]
  - - [32, 512, 1, 1024]
    - [8, 0.0]
  - - [32, 512, 1, 4096]
    - [8, 0.0]
  - - [32, 768, 1, 1024]
    - [8, 0.0]
  - - [32, 768, 1, 4096]
    - [8, 0.0]
  - - [32, 1024, 1, 1024]
    - [8, 0.0]
  - - [32, 1024, 1, 4096]
    - [8, 0.0]
  - - [64, 256, 1, 1024]
    - [8, 0.0]
  - - [64, 256, 1, 4096]
    - [8, 0.0]
  - - [64, 384, 1, 4096]
    - [8, 0.0]
  - - [64, 512, 1, 1024]
    - [8, 0.0]
  - - [64, 512, 1, 4096]
    - [8, 0.0]
  - - [64, 512, 1, 8192]
    - [8, 0.0]
  - - [96, 128, 1, 4096]
    - [8, 0.0]
  - - [96, 256, 1, 1024]
    - [8, 0.0]
  - - [96, 256, 1, 8192]
    - [8, 0.0]
  - - [96, 384, 1, 4096]
    - [8, 0.0]
  - - [128, 128, 1, 8192]
    - [8, 0.0]
  - - [128, 256, 1, 8192]
    - [8, 0.0]
  - - [192, 128, 1, 4096]
    - [8, 0.0]
  - - [256, 128, 1, 4096]
    - [8, 0.0]
  - - [16, 64, 1, 8192]
    - [9, 0.0]
  - - [16, 128, 1, 8192]
    - [9, 0.0]
  - - [16, 192, 1, 8192]
    - [9, 0.0]
  - - [16, 256, 1, 8192]
    - [9, 0.0]
  - - [16, 512, 1, 8192]
    - [9, 0.0]
  - - [32, 32, 1, 8192]
    - [9, 0.0]
  - - [32, 64, 1, 8192]
    - [9, 0.0]
  - - [32, 96, 1, 8192]
    - [9, 0.0]
  - - [32, 192, 1, 8192]
    - [9, 0.0]
  - - [96, 128, 1, 8192]
    - [9, 0.0]
  - - [16, 96, 1, 256]
    - [10, 0.0]
  - - [384, 1024, 1, 256]
    - [10, 0.0]
  - - [16, 96, 1, 8192]
    - [11, 0.0]
  - - [16, 384, 1, 8192]
    - [11, 0.0]
  - - [32, 128, 1, 8192]
    - [11, 0.0]
  - - [32, 256, 1, 8192]
    - [9, 0.0]
  - - [16, 128, 1, 1024]
    - [12, 0.0]
  - - [16, 192, 1, 1024]
    - [12, 0.0]
  - - [32, 32, 1, 1024]
    - [12, 0.0]
  - - [32, 32, 1, 4096]
    - [12, 0.0]
  - - [32, 64, 1, 1024]
    - [12, 0.0]
  - - [32, 64, 1, 4096]
    - [12, 0.0]
  - - [32, 96, 1, 1024]
    - [12, 0.0]
  - - [32, 96, 1, 4096]
    - [12, 0.0]
  - - [32, 192, 1, 1024]
    - [12, 0.0]
  - - [64, 16, 1, 1024]
    - [12, 0.0]
  - - [64, 32, 1, 1024]
    - [12, 0.0]
  - - [64, 64, 1, 4096]
    - [12, 0.0]
  - - [64, 96, 1, 1024]
    - [12, 0.0]
  - - [64, 96, 1, 4096]
    - [12, 0.0]
  - - [64, 192, 1, 1024]
    - [12, 0.0]
  - - [64, 192, 1, 4096]
    - [12, 0.0]
  - - [96, 16, 1, 1024]
    - [12, 0.0]
  - - [96, 32, 1, 1024]
    - [12, 0.0]
  - - [96, 64, 1, 1024]
    - [12, 0.0]
  - - [96, 64, 1, 4096]
    - [12, 0.0]
  - - [96, 96, 1, 4096]
    - [12, 0.0]
  - - [96, 128, 1, 1024]
    - [12, 0.0]
  - - [96, 192, 1, 1024]
    - [12, 0.0]
  - - [96, 192, 1, 4096]
    - [12, 0.0]
  - - [96, 256, 1, 4096]
    - [12, 0.0]
  - - [96, 384, 1, 1024]
    - [12, 0.0]
  - - [128, 64, 1, 4096]
    - [12, 0.0]
  - - [128, 96, 1, 1024]
    - [12, 0.0]
  - - [128, 96, 1, 4096]
    - [12, 0.0]
  - - [128, 128, 1, 1024]
    - [12, 0.0]
  - - [128, 128, 1, 4096]
    - [12, 0.0]
  - - [128, 192, 1, 1024]
    - [12, 0.0]
  - - [128, 192, 1, 4096]
    - [12, 0.0]
  - - [128, 192, 1, 8192]
    - [12, 0.0]
  - - [128, 256, 1, 4096]
    - [12, 0.0]
  - - [192, 16, 1, 1024]
    - [12, 0.0]
  - - [192, 64, 1, 1024]
    - [12, 0.0]
  - - [192, 96, 1, 1024]
    - [12, 0.0]
  - - [192, 96, 1, 4096]
    - [12, 0.0]
  - - [192, 96, 1, 8192]
    - [12, 0.0]
  - - [192, 128, 1, 1024]
    - [12, 0.0]
  - - [192, 192, 1, 1024]
    - [12, 0.0]
  - - [192, 192, 1, 4096]
    - [12, 0.0]
  - - [192, 192, 1, 8192]
    - [12, 0.0]
  - - [256, 96, 1, 4096]
    - [12, 0.0]
  - - [256, 96, 1, 8192]
    - [12, 0.0]
  - - [256, 128, 1, 8192]
    - [12, 0.0]
  - - [384, 64, 1, 4096]
    - [12, 0.0]
  - - [384, 96, 1, 4096]
    - [12, 0.0]
  - - [384, 96, 1, 8192]
    - [12, 0.0]
  - - [512, 64, 1, 8192]
    - [12, 0.0]
  - - [16, 192, 1, 256]
    - [13, 0.0]
  - - [16, 256, 1, 256]
    - [13, 0.0]
  - - [16, 512, 1, 256]
    - [13, 0.0]
  - - [16, 1024, 1, 256]
    - [13, 0.0]
  - - [32, 2048, 1, 256]
    - [13, 0.0]
  - - [64, 2048, 1, 256]
    - [13, 0.0]
  - - [96, 256, 1, 256]
    - [13, 0.0]
  - - [96, 512, 1, 256]
    - [13, 0.0]
  - - [128, 64, 1, 256]
    - [13, 0.0]
  - - [128, 384, 1, 256]
    - [13, 0.0]
  - - [128, 512, 1, 256]
    - [13, 0.0]
  - - [192, 16, 1, 256]
    - [13, 0.0]
  - - [192, 96, 1, 256]
    - [13, 0.0]
  - - [192, 128, 1, 256]
    - [13, 0.0]
  - - [192, 192, 1, 256]
    - [13, 0.0]
  - - [192, 512, 1, 256]
    - [13, 0.0]
  - - [256, 16, 1, 256]
    - [13, 0.0]
  - - [256, 128, 1, 256]
    - [13, 0.0]
  - - [256, 256, 1, 256]
    - [13, 0.0]
  - - [384, 96, 1, 256]
    - [13, 0.0]
  - - [384, 128, 1, 256]
    - [13, 0.0]
  - - [512, 32, 1, 256]
    - [13, 0.0]
  - - [512, 96, 1, 256]
    - [13, 0.0]
  - - [768, 16, 1, 256]
    - [13, 0.0]
  - - [768, 32, 1, 256]
    - [13, 0.0]
  - - [768, 96, 1, 256]
    - [13, 0.0]
  - - [768, 96, 1, 1024]
    - [13, 0.0]
  - - [768, 128, 1, 256]
    - [13, 0.0]
  - - [1024, 64, 1, 1024]
    - [13, 0.0]
  - - [2048, 16, 1, 256]
    - [13, 0.0]
  - - [2048, 32, 1, 256]
    - [13, 0.0]
  - - [16, 384, 1, 256]
    - [14, 0.0]
  - - [32, 768, 1, 256]
    - [14, 0.0]
  - - [16, 768, 1, 1024]
    - [15, 0.0]
  - - [16, 2048, 1, 8192]
    - [15, 0.0]
  - - [16, 4096, 1, 1024]
    - [15, 0.0]
  - - [16, 4096, 1, 8192]
    - [15, 0.0]
  - - [32, 16, 1, 256]
    - [15, 0.0]
  - - [32, 16, 1, 1024]
    - [15, 0.0]
  - - [64, 64, 1, 1024]
    - [15, 0.0]
  - - [128, 256, 1, 1024]
    - [15, 0.0]
  - - [16, 768, 1, 8192]
    - [16, 0.0]
  - - [32, 384, 1, 8192]
    - [16, 0.0]
  - - [32, 768, 1, 8192]
    - [16, 0.0]
  - - [64, 192, 1, 8192]
    - [16, 0.0]
  - - [64, 384, 1, 8192]
    - [16, 0.0]
  - - [16, 1024, 1, 1024]
    - [449, 0.0]
  - - [96, 96, 1, 1024]
    - [5, 0.0]
  - - [256, 32, 1, 1024]
    - [17, 0.0]
  - - [256, 96, 1, 1024]
    - [17, 0.0]
  - - [2048, 32, 1, 1024]
    - [17, 0.0]
  - - [4096, 16, 1, 1024]
    - [17, 0.0]
  - - [16, 1024, 1, 8192]
    - [68, 0.0]
  - - [32, 512, 1, 8192]
    - [68, 0.0]
  - - [96, 96, 1, 8192]
    - [64, 0.0]
  - - [96, 192, 1, 8192]
    - [18, 0.0]
  - - [16, 2048, 1, 256]
    - [19, 0.0]
  - - [128, 768, 1, 256]
    - [19, 0.0]
  - - [128, 1024, 1, 256]
    - [19, 0.0]
  - - [512, 192, 1, 256]
    - [19, 0.0]
  - - [2048, 64, 1, 256]
    - [19, 0.0]
  - - [16, 2048, 1, 1024]
    - [20, 0.0]
  - - [32, 2048, 1, 8192]
    - [20, 0.0]
  - - [64, 128, 1, 1024]
    - [20, 0.0]
  - - [64, 768, 1, 1024]
    - [20, 0.0]
  - - [64, 1024, 1, 1024]
    - [20, 0.0]
  - - [96, 512, 1, 1024]
    - [20, 0.0]
  - - [128, 384, 1, 1024]
    - [20, 0.0]
  - - [192, 256, 1, 1024]
    - [20, 0.0]
  - - [192, 256, 1, 4096]
    - [20, 0.0]
  - - [192, 384, 1, 1024]
    - [20, 0.0]
  - - [256, 128, 1, 1024]
    - [20, 0.0]
  - - [256, 192, 1, 1024]
    - [20, 0.0]
  - - [256, 256, 1, 1024]
    - [20, 0.0]
  - - [384, 16, 1, 1024]
    - [20, 0.0]
  - - [384, 96, 1, 1024]
    - [20, 0.0]
  - - [384, 128, 1, 4096]
    - [20, 0.0]
  - - [384, 192, 1, 1024]
    - [20, 0.0]
  - - [512, 96, 1, 1024]
    - [20, 0.0]
  - - [512, 96, 1, 4096]
    - [20, 0.0]
  - - [512, 128, 1, 1024]
    - [20, 0.0]
  - - [768, 64, 1, 1024]
    - [20, 0.0]
  - - [768, 64, 1, 4096]
    - [20, 0.0]
  - - [16, 4096, 1, 256]
    - [21, 0.0]
  - - [192, 256, 1, 256]
    - [21, 0.0]
  - - [256, 64, 1, 256]
    - [21, 0.0]
  - - [512, 128, 1, 256]
    - [21, 0.0]
  - - [16, 4096, 1, 4096]
    - [450, 0.0]
  - - [16, 8192, 1, 256]
    - [22, 0.0]
  - - [16, 12288, 1, 256]
    - [22, 0.0]
  - - [16, 8192, 1, 1024]
    - [23, 0.0]
  - - [16, 32768, 1, 4096]
    - [28, 0.0]
  - - [16, 8192, 1, 4096]
    - [24, 0.0]
  - - [32, 4096, 1, 4096]
    - [24, 0.0]
  - - [16, 8192, 1, 8192]
    - [25, 0.0]
  - - [16, 12288, 1, 1024]
    - [26, 0.0]
  - - [16, 12288, 1, 4096]
    - [27, 0.0]
  - - [32, 8192, 1, 8192]
    - [27, 0.0]
  - - [512, 768, 1, 1024]
    - [27, 0.0]
  - - [16, 12288, 1, 8192]
    - [28, 0.0]
  - - [16, 16384, 1, 256]
    - [29, 0.0]
  - - [16, 16384, 1, 1024]
    - [30, 0.0]
  - - [16, 16384, 1, 8192]
    - [30, 0.0]
  - - [16, 32768, 1, 8192]
    - [30, 0.0]
  - - [16, 16384, 1, 4096]
    - [31, 0.0]
  - - [16, 24576, 1, 1024]
    - [31, 0.0]
  - - [16, 24576, 1, 4096]
    - [31, 0.0]
  - - [16, 24576, 1, 256]
    - [32, 0.0]
  - - [16, 32768, 1, 256]
    - [32, 0.0]
  - - [16, 24576, 1, 8192]
    - [33, 0.0]
  - - [16, 32768, 1, 1024]
    - [34, 0.0]
  - - [32, 16, 1, 4096]
    - [35, 0.0]
  - - [32, 32, 1, 256]
    - [36, 0.0]
  - - [64, 64, 1, 256]
    - [36, 0.0]
  - - [32, 64, 1, 256]
    - [37, 0.0]
  - - [192, 32, 1, 256]
    - [37, 0.0]
  - - [256, 32, 1, 256]
    - [37, 0.0]
  - - [256, 96, 1, 256]
    - [37, 0.0]
  - - [512, 16, 1, 256]
    - [37, 0.0]
  - - [1024, 16, 1, 256]
    - [37, 0.0]
  - - [1024, 32, 1, 256]
    - [37, 0.0]
  - - [4096, 16, 1, 256]
    - [37, 0.0]
  - - [32, 96, 1, 256]
    - [38, 0.0]
  - - [384, 16, 1, 256]
    - [38, 0.0]
  - - [32, 128, 1, 256]
    - [39, 0.0]
  - - [32, 8192, 1, 256]
    - [39, 0.0]
  - - [96, 768, 1, 256]
    - [39, 0.0]
  - - [96, 1024, 1, 256]
    - [39, 0.0]
  - - [32, 192, 1, 256]
    - [40, 0.0]
  - - [96, 32, 1, 256]
    - [40, 0.0]
  - - [384, 512, 1, 256]
    - [40, 0.0]
  - - [12288, 16, 1, 256]
    - [40, 0.0]
  - - [32, 1024, 1, 256]
    - [41, 0.0]
  - - [64, 1024, 1, 256]
    - [41, 0.0]
  - - [256, 384, 1, 256]
    - [41, 0.0]
  - - [256, 384, 1, 1024]
    - [41, 0.0]
  - - [256, 512, 1, 256]
    - [41, 0.0]
  - - [384, 256, 1, 256]
    - [41, 0.0]
  - - [512, 192, 1, 1024]
    - [41, 0.0]
  - - [512, 256, 1, 1024]
    - [41, 0.0]
  - - [768, 192, 1, 256]
    - [41, 0.0]
  - - [768, 192, 1, 1024]
    - [41, 0.0]
  - - [1024, 64, 1, 256]
    - [41, 0.0]
  - - [1024, 96, 1, 1024]
    - [41, 0.0]
  - - [1024, 128, 1, 256]
    - [41, 0.0]
  - - [4096, 32, 1, 256]
    - [41, 0.0]
  - - [32, 1024, 1, 8192]
    - [42, 0.0]
  - - [96, 384, 1, 8192]
    - [453, 0.0]
  - - [32, 2048, 1, 1024]
    - [43, 0.0]
  - - [32, 4096, 1, 8192]
    - [43, 0.0]
  - - [192, 768, 1, 4096]
    - [74, 0.0]
  - - [32, 2048, 1, 4096]
    - [44, 0.0]
  - - [32, 4096, 1, 1024]
    - [44, 0.0]
  - - [64, 1024, 1, 4096]
    - [44, 0.0]
  - - [64, 2048, 1, 1024]
    - [44, 0.0]
  - - [64, 2048, 1, 4096]
    - [44, 0.0]
  - - [96, 768, 1, 1024]
    - [44, 0.0]
  - - [96, 768, 1, 4096]
    - [44, 0.0]
  - - [96, 1024, 1, 1024]
    - [44, 0.0]
  - - [96, 1024, 1, 4096]
    - [44, 0.0]
  - - [128, 512, 1, 1024]
    - [44, 0.0]
  - - [128, 512, 1, 4096]
    - [44, 0.0]
  - - [128, 768, 1, 1024]
    - [44, 0.0]
  - - [128, 768, 1, 4096]
    - [44, 0.0]
  - - [128, 1024, 1, 1024]
    - [44, 0.0]
  - - [128, 1024, 1, 4096]
    - [44, 0.0]
  - - [128, 1024, 1, 8192]
    - [44, 0.0]
  - - [192, 512, 1, 1024]
    - [44, 0.0]
  - - [192, 512, 1, 4096]
    - [44, 0.0]
  - - [192, 768, 1, 1024]
    - [44, 0.0]
  - - [192, 768, 1, 8192]
    - [44, 0.0]
  - - [256, 512, 1, 1024]
    - [44, 0.0]
  - - [256, 512, 1, 4096]
    - [74, 0.0]
  - - [256, 512, 1, 8192]
    - [44, 0.0]
  - - [384, 256, 1, 1024]
    - [44, 0.0]
  - - [384, 256, 1, 4096]
    - [44, 0.0]
  - - [384, 384, 1, 1024]
    - [44, 0.0]
  - - [384, 384, 1, 4096]
    - [74, 0.0]
  - - [32, 4096, 1, 256]
    - [45, 0.0]
  - - [768, 64, 1, 256]
    - [45, 0.0]
  - - [8192, 32, 1, 256]
    - [45, 0.0]
  - - [32, 8192, 1, 1024]
    - [46, 0.0]
  - - [96, 2048, 1, 1024]
    - [46, 0.0]
  - - [96, 4096, 1, 256]
    - [46, 0.0]
  - - [256, 1024, 1, 1024]
    - [46, 0.0]
  - - [32, 8192, 1, 4096]
    - [47, 0.0]
  - - [256, 1024, 1, 4096]
    - [47, 0.0]
  - - [32, 12288, 1, 256]
    - [48, 0.0]
  - - [32, 12288, 1, 1024]
    - [49, 0.0]
  - - [32, 12288, 1, 4096]
    - [50, 0.0]
  - - [32, 12288, 1, 8192]
    - [51, 0.0]
  - - [32, 16384, 1, 4096]
    - [51, 0.0]
  - - [32, 16384, 1, 256]
    - [52, 0.0]
  - - [32, 16384, 1, 1024]
    - [451, 0.0]
  - - [32, 16384, 1, 8192]
    - [53, 0.0]
  - - [32, 32768, 1, 4096]
    - [53, 0.0]
  - - [32, 24576, 1, 256]
    - [54, 0.0]
  - - [32, 24576, 1, 1024]
    - [55, 0.0]
  - - [32, 24576, 1, 4096]
    - [55, 0.0]
  - - [32, 24576, 1, 8192]
    - [56, 0.0]
  - - [32, 32768, 1, 256]
    - [57, 0.0]
  - - [32, 32768, 1, 1024]
    - [58, 0.0]
  - - [32, 32768, 1, 8192]
    - [59, 0.0]
  - - [64, 16, 1, 256]
    - [60, 0.0]
  - - [64, 16, 1, 4096]
    - [61, 0.0]
  - - [64, 32, 1, 4096]
    - [65, 0.0]
  - - [96, 32, 1, 4096]
    - [61, 0.0]
  - - [128, 16, 1, 1024]
    - [61, 0.0]
  - - [128, 16, 1, 4096]
    - [94, 0.0]
  - - [128, 32, 1, 1024]
    - [61, 0.0]
  - - [128, 32, 1, 4096]
    - [61, 0.0]
  - - [192, 16, 1, 4096]
    - [61, 0.0]
  - - [192, 32, 1, 4096]
    - [61, 0.0]
  - - [192, 64, 1, 4096]
    - [61, 0.0]
  - - [256, 16, 1, 1024]
    - [61, 0.0]
  - - [256, 16, 1, 4096]
    - [61, 0.0]
  - - [256, 32, 1, 4096]
    - [61, 0.0]
  - - [256, 64, 1, 1024]
    - [61, 0.0]
  - - [256, 64, 1, 4096]
    - [61, 0.0]
  - - [384, 16, 1, 4096]
    - [61, 0.0]
  - - [384, 32, 1, 4096]
    - [61, 0.0]
  - - [512, 16, 1, 4096]
    - [61, 0.0]
  - - [512, 32, 1, 1024]
    - [61, 0.0]
  - - [512, 32, 1, 4096]
    - [61, 0.0]
  - - [512, 32, 1, 8192]
    - [61, 0.0]
  - - [512, 64, 1, 4096]
    - [61, 0.0]
  - - [768, 16, 1, 1024]
    - [61, 0.0]
  - - [768, 16, 1, 4096]
    - [61, 0.0]
  - - [768, 16, 1, 8192]
    - [61, 0.0]
  - - [768, 32, 1, 1024]
    - [61, 0.0]
  - - [768, 32, 1, 4096]
    - [61, 0.0]
  - - [768, 32, 1, 8192]
    - [61, 0.0]
  - - [1024, 16, 1, 1024]
    - [61, 0.0]
  - - [1024, 16, 1, 4096]
    - [61, 0.0]
  - - [1024, 16, 1, 8192]
    - [61, 0.0]
  - - [1024, 32, 1, 1024]
    - [61, 0.0]
  - - [1024, 32, 1, 4096]
    - [61, 0.0]
  - - [1024, 32, 1, 8192]
    - [61, 0.0]
  - - [2048, 16, 1, 4096]
    - [61, 0.0]
  - - [2048, 16, 1, 8192]
    - [61, 0.0]
  - - [64, 16, 1, 8192]
    - [62, 0.0]
  - - [96, 16, 1, 8192]
    - [62, 0.0]
  - - [96, 32, 1, 8192]
    - [62, 0.0]
  - - [128, 16, 1, 8192]
    - [62, 0.0]
  - - [128, 32, 1, 8192]
    - [62, 0.0]
  - - [192, 16, 1, 8192]
    - [62, 0.0]
  - - [256, 16, 1, 8192]
    - [62, 0.0]
  - - [384, 16, 1, 8192]
    - [62, 0.0]
  - - [64, 32, 1, 256]
    - [63, 0.0]
  - - [64, 32, 1, 8192]
    - [64, 0.0]
  - - [64, 96, 1, 8192]
    - [64, 0.0]
  - - [96, 64, 1, 8192]
    - [64, 0.0]
  - - [64, 64, 1, 8192]
    - [64, 0.0]
  - - [64, 128, 1, 8192]
    - [65, 0.0]
  - - [64, 128, 1, 256]
    - [66, 0.0]
  - - [64, 192, 1, 256]
    - [67, 0.0]
  - - [96, 96, 1, 256]
    - [67, 0.0]
  - - [64, 256, 1, 8192]
    - [68, 0.0]
  - - [128, 64, 1, 8192]
    - [68, 0.0]
  - - [64, 384, 1, 256]
    - [69, 0.0]
  - - [64, 768, 1, 256]
    - [70, 0.0]
  - - [192, 384, 1, 256]
    - [70, 0.0]
  - - [192, 768, 1, 256]
    - [70, 0.0]
  - - [512, 256, 1, 256]
    - [70, 0.0]
  - - [64, 768, 1, 4096]
    - [71, 0.0]
  - - [96, 512, 1, 4096]
    - [71, 0.0]
  - - [96, 512, 1, 8192]
    - [71, 0.0]
  - - [192, 256, 1, 8192]
    - [71, 0.0]
  - - [64, 768, 1, 8192]
    - [72, 0.0]
  - - [64, 1024, 1, 8192]
    - [73, 0.0]
  - - [96, 768, 1, 8192]
    - [73, 0.0]
  - - [192, 384, 1, 8192]
    - [73, 0.0]
  - - [384, 192, 1, 8192]
    - [73, 0.0]
  - - [64, 2048, 1, 8192]
    - [74, 0.0]
  - - [512, 192, 1, 4096]
    - [74, 0.0]
  - - [512, 256, 1, 4096]
    - [74, 0.0]
  - - [768, 192, 1, 8192]
    - [74, 0.0]
  - - [1024, 128, 1, 8192]
    - [74, 0.0]
  - - [64, 4096, 1, 256]
    - [75, 0.0]
  - - [96, 2048, 1, 256]
    - [75, 0.0]
  - - [128, 2048, 1, 256]
    - [75, 0.0]
  - - [192, 1024, 1, 256]
    - [75, 0.0]
  - - [256, 768, 1, 256]
    - [75, 0.0]
  - - [256, 768, 1, 1024]
    - [75, 0.0]
  - - [256, 1024, 1, 256]
    - [75, 0.0]
  - - [384, 512, 1, 1024]
    - [75, 0.0]
  - - [384, 768, 1, 256]
    - [75, 0.0]
  - - [384, 768, 1, 1024]
    - [75, 0.0]
  - - [512, 384, 1, 256]
    - [75, 0.0]
  - - [512, 384, 1, 1024]
    - [75, 0.0]
  - - [512, 512, 1, 256]
    - [75, 0.0]
  - - [512, 512, 1, 1024]
    - [75, 0.0]
  - - [512, 1024, 1, 256]
    - [75, 0.0]
  - - [768, 256, 1, 256]
    - [75, 0.0]
  - - [768, 256, 1, 1024]
    - [75, 0.0]
  - - [768, 512, 1, 256]
    - [75, 0.0]
  - - [1024, 192, 1, 1024]
    - [75, 0.0]
  - - [1024, 256, 1, 256]
    - [75, 0.0]
  - - [1024, 256, 1, 1024]
    - [75, 0.0]
  - - [1024, 512, 1, 256]
    - [75, 0.0]
  - - [2048, 96, 1, 1024]
    - [75, 0.0]
  - - [2048, 128, 1, 1024]
    - [75, 0.0]
  - - [2048, 192, 1, 256]
    - [75, 0.0]
  - - [64, 4096, 1, 1024]
    - [76, 0.0]
  - - [128, 2048, 1, 1024]
    - [76, 0.0]
  - - [64, 4096, 1, 4096]
    - [452, 0.0]
  - - [128, 2048, 1, 8192]
    - [77, 0.0]
  - - [384, 768, 1, 4096]
    - [77, 0.0]
  - - [64, 4096, 1, 8192]
    - [78, 0.0]
  - - [64, 8192, 1, 256]
    - [79, 0.0]
  - - [128, 4096, 1, 256]
    - [79, 0.0]
  - - [192, 2048, 1, 256]
    - [79, 0.0]
  - - [256, 2048, 1, 256]
    - [79, 0.0]
  - - [768, 384, 1, 256]
    - [79, 0.0]
  - - [64, 8192, 1, 1024]
    - [80, 0.0]
  - - [64, 8192, 1, 4096]
    - [80, 0.0]
  - - [64, 8192, 1, 8192]
    - [81, 0.0]
  - - [64, 12288, 1, 256]
    - [82, 0.0]
  - - [64, 12288, 1, 1024]
    - [83, 0.0]
  - - [64, 16384, 1, 1024]
    - [83, 0.0]
  - - [192, 12288, 1, 8192]
    - [83, 0.0]
  - - [64, 12288, 1, 4096]
    - [84, 0.0]
  - - [64, 24576, 1, 4096]
    - [84, 0.0]
  - - [64, 24576, 1, 8192]
    - [84, 0.0]
  - - [64, 12288, 1, 8192]
    - [85, 0.0]
  - - [64, 32768, 1, 8192]
    - [85, 0.0]
  - - [64, 16384, 1, 256]
    - [86, 0.0]
  - - [64, 24576, 1, 256]
    - [86, 0.0]
  - - [128, 8192, 1, 256]
    - [86, 0.0]
  - - [192, 8192, 1, 256]
    - [86, 0.0]
  - - [384, 4096, 1, 256]
    - [86, 0.0]
  - - [64, 16384, 1, 4096]
    - [87, 0.0]
  - - [64, 16384, 1, 8192]
    - [88, 0.0]
  - - [64, 24576, 1, 1024]
    - [89, 0.0]
  - - [64, 32768, 1, 256]
    - [90, 0.0]
  - - [192, 12288, 1, 256]
    - [90, 0.0]
  - - [256, 4096, 1, 256]
    - [90, 0.0]
  - - [8192, 128, 1, 256]
    - [90, 0.0]
  - - [64, 32768, 1, 1024]
    - [91, 0.0]
  - - [64, 32768, 1, 4096]
    - [92, 0.0]
  - - [96, 16, 1, 256]
    - [93, 0.0]
  - - [96, 16, 1, 4096]
    - [94, 0.0]
  - - [192, 32, 1, 8192]
    - [94, 0.0]
  - - [256, 32, 1, 8192]
    - [94, 0.0]
  - - [512, 16, 1, 8192]
    - [94, 0.0]
  - - [96, 384, 1, 256]
    - [95, 0.0]
  - - [96, 1024, 1, 8192]
    - [96, 0.0]
  - - [128, 768, 1, 8192]
    - [96, 0.0]
  - - [256, 384, 1, 8192]
    - [96, 0.0]
  - - [384, 256, 1, 8192]
    - [96, 0.0]
  - - [96, 2048, 1, 4096]
    - [97, 0.0]
  - - [96, 2048, 1, 8192]
    - [97, 0.0]
  - - [128, 2048, 1, 4096]
    - [97, 0.0]
  - - [192, 1024, 1, 4096]
    - [97, 0.0]
  - - [256, 768, 1, 4096]
    - [97, 0.0]
  - - [256, 1024, 1, 8192]
    - [97, 0.0]
  - - [384, 512, 1, 4096]
    - [97, 0.0]
  - - [512, 512, 1, 4096]
    - [97, 0.0]
  - - [96, 4096, 1, 1024]
    - [98, 0.0]
  - - [96, 8192, 1, 256]
    - [98, 0.0]
  - - [192, 2048, 1, 1024]
    - [98, 0.0]
  - - [192, 2048, 1, 4096]
    - [98, 0.0]
  - - [192, 4096, 1, 256]
    - [98, 0.0]
  - - [384, 1024, 1, 1024]
    - [98, 0.0]
  - - [96, 4096, 1, 4096]
    - [99, 0.0]
  - - [96, 4096, 1, 8192]
    - [100, 0.0]
  - - [96, 8192, 1, 1024]
    - [101, 0.0]
  - - [96, 8192, 1, 4096]
    - [102, 0.0]
  - - [96, 8192, 1, 8192]
    - [103, 0.0]
  - - [96, 12288, 1, 256]
    - [104, 0.0]
  - - [96, 12288, 1, 1024]
    - [105, 0.0]
  - - [96, 12288, 1, 4096]
    - [106, 0.0]
  - - [96, 12288, 1, 8192]
    - [107, 0.0]
  - - [96, 16384, 1, 256]
    - [108, 0.0]
  - - [96, 16384, 1, 1024]
    - [109, 0.0]
  - - [96, 16384, 1, 4096]
    - [110, 0.0]
  - - [96, 16384, 1, 8192]
    - [111, 0.0]
  - - [96, 24576, 1, 256]
    - [112, 0.0]
  - - [96, 24576, 1, 1024]
    - [113, 0.0]
  - - [96, 24576, 1, 4096]
    - [114, 0.0]
  - - [96, 24576, 1, 8192]
    - [115, 0.0]
  - - [96, 32768, 1, 256]
    - [116, 0.0]
  - - [96, 32768, 1, 1024]
    - [117, 0.0]
  - - [96, 32768, 1, 4096]
    - [109, 0.0]
  - - [96, 32768, 1, 8192]
    - [109, 0.0]
  - - [192, 8192, 1, 8192]
    - [118, 0.0]
  - - [128, 16, 1, 256]
    - [119, 0.0]
  - - [8192, 64, 1, 1024]
    - [119, 0.0]
  - - [8192, 64, 1, 8192]
    - [342, 0.0]
  - - [128, 96, 1, 8192]
    - [120, 0.0]
  - - [192, 64, 1, 8192]
    - [120, 0.0]
  - - [192, 128, 1, 8192]
    - [120, 0.0]
  - - [384, 64, 1, 8192]
    - [120, 0.0]
  - - [128, 256, 1, 256]
    - [121, 0.0]
  - - [128, 384, 1, 4096]
    - [122, 0.0]
  - - [128, 384, 1, 8192]
    - [122, 0.0]
  - - [256, 192, 1, 4096]
    - [122, 0.0]
  - - [256, 192, 1, 8192]
    - [122, 0.0]
  - - [128, 512, 1, 8192]
    - [123, 0.0]
  - - [192, 512, 1, 8192]
    - [123, 0.0]
  - - [512, 192, 1, 8192]
    - [123, 0.0]
  - - [768, 128, 1, 8192]
    - [123, 0.0]
  - - [128, 4096, 1, 1024]
    - [124, 0.0]
  - - [128, 4096, 1, 8192]
    - [124, 0.0]
  - - [256, 2048, 1, 1024]
    - [124, 0.0]
  - - [256, 2048, 1, 4096]
    - [124, 0.0]
  - - [384, 1024, 1, 4096]
    - [124, 0.0]
  - - [512, 1024, 1, 1024]
    - [124, 0.0]
  - - [128, 4096, 1, 4096]
    - [125, 0.0]
  - - [128, 8192, 1, 1024]
    - [126, 0.0]
  - - [192, 4096, 1, 1024]
    - [126, 0.0]
  - - [512, 2048, 1, 1024]
    - [126, 0.0]
  - - [1024, 1024, 1, 1024]
    - [126, 0.0]
  - - [2048, 512, 1, 1024]
    - [126, 0.0]
  - - [4096, 256, 1, 1024]
    - [126, 0.0]
  - - [4096, 256, 1, 4096]
    - [126, 0.0]
  - - [128, 8192, 1, 4096]
    - [127, 0.0]
  - - [128, 8192, 1, 8192]
    - [128, 0.0]
  - - [128, 12288, 1, 256]
    - [129, 0.0]
  - - [128, 12288, 1, 1024]
    - [130, 0.0]
  - - [128, 12288, 1, 4096]
    - [131, 0.0]
  - - [768, 2048, 1, 4096]
    - [131, 0.0]
  - - [128, 12288, 1, 8192]
    - [132, 0.0]
  - - [8192, 192, 1, 4096]
    - [132, 0.0]
  - - [128, 16384, 1, 256]
    - [133, 0.0]
  - - [128, 16384, 1, 1024]
    - [134, 0.0]
  - - [1024, 2048, 1, 1024]
    - [134, 0.0]
  - - [2048, 1024, 1, 1024]
    - [134, 0.0]
  - - [4096, 512, 1, 8192]
    - [134, 0.0]
  - - [128, 16384, 1, 4096]
    - [135, 0.0]
  - - [128, 16384, 1, 8192]
    - [136, 0.0]
  - - [128, 24576, 1, 256]
    - [137, 0.0]
  - - [128, 24576, 1, 1024]
    - [138, 0.0]
  - - [128, 24576, 1, 4096]
    - [139, 0.0]
  - - [128, 24576, 1, 8192]
    - [139, 0.0]
  - - [128, 32768, 1, 256]
    - [140, 0.0]
  - - [384, 16384, 1, 256]
    - [140, 0.0]
  - - [384, 32768, 1, 256]
    - [140, 0.0]
  - - [512, 12288, 1, 256]
    - [140, 0.0]
  - - [768, 8192, 1, 256]
    - [140, 0.0]
  - - [2048, 2048, 1, 256]
    - [140, 0.0]
  - - [2048, 12288, 1, 256]
    - [140, 0.0]
  - - [12288, 384, 1, 256]
    - [140, 0.0]
  - - [128, 32768, 1, 1024]
    - [141, 0.0]
  - - [384, 12288, 1, 4096]
    - [141, 0.0]
  - - [128, 32768, 1, 4096]
    - [142, 0.0]
  - - [128, 32768, 1, 8192]
    - [143, 0.0]
  - - [192, 32, 1, 1024]
    - [144, 0.0]
  - - [384, 64, 1, 1024]
    - [144, 0.0]
  - - [512, 16, 1, 1024]
    - [144, 0.0]
  - - [512, 64, 1, 1024]
    - [144, 0.0]
  - - [2048, 16, 1, 1024]
    - [144, 0.0]
  - - [4096, 16, 1, 4096]
    - [144, 0.0]
  - - [4096, 16, 1, 8192]
    - [144, 0.0]
  - - [12288, 16, 1, 8192]
    - [144, 0.0]
  - - [24576, 16, 1, 4096]
    - [144, 0.0]
  - - [32768, 16, 1, 4096]
    - [144, 0.0]
  - - [32768, 16, 1, 8192]
    - [144, 0.0]
  - - [192, 64, 1, 256]
    - [145, 0.0]
  - - [256, 192, 1, 256]
    - [145, 0.0]
  - - [192, 384, 1, 4096]
    - [146, 0.0]
  - - [256, 256, 1, 4096]
    - [146, 0.0]
  - - [256, 384, 1, 4096]
    - [146, 0.0]
  - - [384, 192, 1, 4096]
    - [146, 0.0]
  - - [512, 128, 1, 4096]
    - [146, 0.0]
  - - [192, 1024, 1, 1024]
    - [147, 0.0]
  - - [192, 1024, 1, 8192]
    - [148, 0.0]
  - - [256, 768, 1, 8192]
    - [148, 0.0]
  - - [384, 512, 1, 8192]
    - [148, 0.0]
  - - [512, 384, 1, 8192]
    - [148, 0.0]
  - - [768, 256, 1, 8192]
    - [148, 0.0]
  - - [192, 2048, 1, 8192]
    - [149, 0.0]
  - - [768, 512, 1, 8192]
    - [149, 0.0]
  - - [192, 4096, 1, 4096]
    - [150, 0.0]
  - - [192, 4096, 1, 8192]
    - [151, 0.0]
  - - [192, 8192, 1, 1024]
    - [152, 0.0]
  - - [192, 8192, 1, 4096]
    - [153, 0.0]
  - - [192, 12288, 1, 1024]
    - [154, 0.0]
  - - [192, 12288, 1, 4096]
    - [155, 0.0]
  - - [192, 16384, 1, 256]
    - [156, 0.0]
  - - [192, 16384, 1, 4096]
    - [156, 0.0]
  - - [192, 16384, 1, 1024]
    - [157, 0.0]
  - - [192, 16384, 1, 8192]
    - [158, 0.0]
  - - [192, 24576, 1, 256]
    - [159, 0.0]
  - - [192, 24576, 1, 1024]
    - [160, 0.0]
  - - [192, 24576, 1, 4096]
    - [161, 0.0]
  - - [192, 24576, 1, 8192]
    - [162, 0.0]
  - - [192, 32768, 1, 256]
    - [163, 0.0]
  - - [192, 32768, 1, 1024]
    - [164, 0.0]
  - - [192, 32768, 1, 8192]
    - [164, 0.0]
  - - [192, 32768, 1, 4096]
    - [165, 0.0]
  - - [256, 64, 1, 8192]
    - [166, 0.0]
  - - [256, 2048, 1, 8192]
    - [167, 0.0]
  - - [768, 768, 1, 4096]
    - [167, 0.0]
  - - [256, 4096, 1, 1024]
    - [168, 0.0]
  - - [256, 4096, 1, 4096]
    - [169, 0.0]
  - - [512, 2048, 1, 4096]
    - [169, 0.0]
  - - [512, 2048, 1, 8192]
    - [169, 0.0]
  - - [256, 4096, 1, 8192]
    - [170, 0.0]
  - - [256, 8192, 1, 256]
    - [171, 0.0]
  - - [256, 8192, 1, 1024]
    - [172, 0.0]
  - - [512, 4096, 1, 1024]
    - [172, 0.0]
  - - [256, 8192, 1, 4096]
    - [173, 0.0]
  - - [1024, 2048, 1, 256]
    - [171, 0.0]
  - - [256, 8192, 1, 8192]
    - [174, 0.0]
  - - [256, 12288, 1, 256]
    - [175, 0.0]
  - - [768, 4096, 1, 256]
    - [175, 0.0]
  - - [256, 12288, 1, 1024]
    - [176, 0.0]
  - - [256, 12288, 1, 4096]
    - [177, 0.0]
  - - [256, 12288, 1, 8192]
    - [178, 0.0]
  - - [256, 16384, 1, 256]
    - [179, 0.0]
  - - [256, 16384, 1, 1024]
    - [179, 0.0]
  - - [256, 16384, 1, 4096]
    - [180, 0.0]
  - - [256, 16384, 1, 8192]
    - [181, 0.0]
  - - [256, 24576, 1, 256]
    - [182, 0.0]
  - - [8192, 2048, 1, 1024]
    - [312, 0.0]
  - - [8192, 4096, 1, 256]
    - [182, 0.0]
  - - [12288, 1024, 1, 256]
    - [182, 0.0]
  - - [24576, 512, 1, 256]
    - [182, 0.0]
  - - [32768, 192, 1, 256]
    - [182, 0.0]
  - - [256, 24576, 1, 1024]
    - [183, 0.0]
  - - [256, 24576, 1, 4096]
    - [184, 0.0]
  - - [256, 24576, 1, 8192]
    - [185, 0.0]
  - - [512, 12288, 1, 8192]
    - [185, 0.0]
  - - [768, 16384, 1, 1024]
    - [185, 0.0]
  - - [256, 32768, 1, 256]
    - [186, 0.0]
  - - [256, 32768, 1, 1024]
    - [187, 0.0]
  - - [512, 16384, 1, 4096]
    - [187, 0.0]
  - - [2048, 8192, 1, 1024]
    - [187, 0.0]
  - - [256, 32768, 1, 4096]
    - [188, 0.0]
  - - [256, 32768, 1, 8192]
    - [189, 0.0]
  - - [512, 16384, 1, 8192]
    - [189, 0.0]
  - - [1024, 32768, 1, 8192]
    - [189, 0.0]
  - - [384, 32, 1, 256]
    - [190, 0.0]
  - - [384, 32, 1, 8192]
    - [191, 0.0]
  - - [384, 128, 1, 8192]
    - [192, 0.0]
  - - [768, 64, 1, 8192]
    - [192, 0.0]
  - - [384, 192, 1, 256]
    - [193, 0.0]
  - - [384, 384, 1, 256]
    - [193, 0.0]
  - - [8192, 16, 1, 1024]
    - [193, 0.0]
  - - [384, 384, 1, 8192]
    - [194, 0.0]
  - - [384, 768, 1, 8192]
    - [195, 0.0]
  - - [512, 512, 1, 8192]
    - [195, 0.0]
  - - [384, 1024, 1, 8192]
    - [196, 0.0]
  - - [1024, 384, 1, 8192]
    - [196, 0.0]
  - - [384, 2048, 1, 256]
    - [197, 0.0]
  - - [384, 2048, 1, 1024]
    - [198, 0.0]
  - - [768, 1024, 1, 1024]
    - [198, 0.0]
  - - [768, 1024, 1, 4096]
    - [198, 0.0]
  - - [768, 1024, 1, 8192]
    - [198, 0.0]
  - - [1024, 768, 1, 1024]
    - [198, 0.0]
  - - [2048, 384, 1, 4096]
    - [198, 0.0]
  - - [4096, 192, 1, 1024]
    - [198, 0.0]
  - - [384, 2048, 1, 4096]
    - [199, 0.0]
  - - [384, 2048, 1, 8192]
    - [200, 0.0]
  - - [384, 4096, 1, 1024]
    - [201, 0.0]
  - - [384, 4096, 1, 8192]
    - [201, 0.0]
  - - [4096, 384, 1, 4096]
    - [201, 0.0]
  - - [384, 4096, 1, 4096]
    - [202, 0.0]
  - - [768, 2048, 1, 1024]
    - [202, 0.0]
  - - [384, 8192, 1, 256]
    - [203, 0.0]
  - - [384, 8192, 1, 1024]
    - [204, 0.0]
  - - [384, 8192, 1, 4096]
    - [205, 0.0]
  - - [384, 8192, 1, 8192]
    - [206, 0.0]
  - - [384, 12288, 1, 256]
    - [207, 0.0]
  - - [384, 12288, 1, 1024]
    - [208, 0.0]
  - - [384, 24576, 1, 1024]
    - [208, 0.0]
  - - [2048, 2048, 1, 1024]
    - [208, 0.0]
  - - [384, 12288, 1, 8192]
    - [209, 0.0]
  - - [768, 12288, 1, 8192]
    - [209, 0.0]
  - - [384, 16384, 1, 1024]
    - [210, 0.0]
  - - [384, 16384, 1, 4096]
    - [211, 0.0]
  - - [768, 8192, 1, 8192]
    - [211, 0.0]
  - - [384, 16384, 1, 8192]
    - [212, 0.0]
  - - [384, 24576, 1, 256]
    - [213, 0.0]
  - - [384, 24576, 1, 4096]
    - [214, 0.0]
  - - [384, 24576, 1, 8192]
    - [215, 0.0]
  - - [384, 32768, 1, 1024]
    - [216, 0.0]
  - - [768, 24576, 1, 8192]
    - [216, 0.0]
  - - [384, 32768, 1, 4096]
    - [217, 0.0]
  - - [12288, 1024, 1, 4096]
    - [217, 0.0]
  - - [24576, 768, 1, 4096]
    - [217, 0.0]
  - - [24576, 1024, 1, 4096]
    - [217, 0.0]
  - - [32768, 1024, 1, 4096]
    - [217, 0.0]
  - - [384, 32768, 1, 8192]
    - [218, 0.0]
  - - [512, 96, 1, 8192]
    - [219, 0.0]
  - - [512, 128, 1, 8192]
    - [220, 0.0]
  - - [512, 256, 1, 8192]
    - [221, 0.0]
  - - [512, 384, 1, 4096]
    - [222, 0.0]
  - - [2048, 128, 1, 8192]
    - [222, 0.0]
  - - [512, 768, 1, 256]
    - [223, 0.0]
  - - [512, 768, 1, 4096]
    - [224, 0.0]
  - - [512, 768, 1, 8192]
    - [225, 0.0]
  - - [512, 1024, 1, 4096]
    - [226, 0.0]
  - - [1024, 512, 1, 1024]
    - [226, 0.0]
  - - [4096, 128, 1, 4096]
    - [226, 0.0]
  - - [512, 1024, 1, 8192]
    - [227, 0.0]
  - - [512, 2048, 1, 256]
    - [228, 0.0]
  - - [512, 4096, 1, 256]
    - [229, 0.0]
  - - [32768, 64, 1, 256]
    - [229, 0.0]
  - - [512, 4096, 1, 4096]
    - [230, 0.0]
  - - [512, 4096, 1, 8192]
    - [231, 0.0]
  - - [1024, 2048, 1, 4096]
    - [231, 0.0]
  - - [512, 8192, 1, 256]
    - [232, 0.0]
  - - [512, 8192, 1, 1024]
    - [233, 0.0]
  - - [512, 8192, 1, 4096]
    - [234, 0.0]
  - - [512, 8192, 1, 8192]
    - [234, 0.0]
  - - [512, 12288, 1, 1024]
    - [235, 0.0]
  - - [512, 24576, 1, 8192]
    - [235, 0.0]
  - - [768, 16384, 1, 256]
    - [235, 0.0]
  - - [768, 24576, 1, 1024]
    - [235, 0.0]
  - - [1024, 12288, 1, 1024]
    - [235, 0.0]
  - - [12288, 1024, 1, 1024]
    - [235, 0.0]
  - - [24576, 768, 1, 8192]
    - [235, 0.0]
  - - [512, 12288, 1, 4096]
    - [236, 0.0]
  - - [768, 8192, 1, 4096]
    - [236, 0.0]
  - - [512, 16384, 1, 256]
    - [237, 0.0]
  - - [512, 16384, 1, 1024]
    - [238, 0.0]
  - - [768, 32768, 1, 4096]
    - [238, 0.0]
  - - [768, 32768, 1, 8192]
    - [238, 0.0]
  - - [1024, 8192, 1, 1024]
    - [238, 0.0]
  - - [1024, 8192, 1, 8192]
    - [238, 0.0]
  - - [1024, 16384, 1, 4096]
    - [238, 0.0]
  - - [1024, 16384, 1, 8192]
    - [238, 0.0]
  - - [1024, 24576, 1, 4096]
    - [238, 0.0]
  - - [1024, 24576, 1, 8192]
    - [238, 0.0]
  - - [2048, 12288, 1, 4096]
    - [238, 0.0]
  - - [4096, 4096, 1, 1024]
    - [238, 0.0]
  - - [512, 24576, 1, 256]
    - [239, 0.0]
  - - [512, 24576, 1, 1024]
    - [356, 0.0]
  - - [1024, 4096, 1, 1024]
    - [240, 0.0]
  - - [1024, 4096, 1, 8192]
    - [240, 0.0]
  - - [512, 24576, 1, 4096]
    - [241, 0.0]
  - - [768, 8192, 1, 1024]
    - [241, 0.0]
  - - [512, 32768, 1, 256]
    - [242, 0.0]
  - - [768, 32768, 1, 256]
    - [242, 0.0]
  - - [1024, 24576, 1, 256]
    - [242, 0.0]
  - - [2048, 16384, 1, 256]
    - [242, 0.0]
  - - [512, 32768, 1, 1024]
    - [243, 0.0]
  - - [512, 32768, 1, 4096]
    - [244, 0.0]
  - - [32768, 1024, 1, 1024]
    - [244, 0.0]
  - - [512, 32768, 1, 8192]
    - [245, 0.0]
  - - [768, 96, 1, 4096]
    - [246, 0.0]
  - - [1024, 64, 1, 4096]
    - [246, 0.0]
  - - [1024, 96, 1, 8192]
    - [246, 0.0]
  - - [4096, 32, 1, 4096]
    - [246, 0.0]
  - - [768, 128, 1, 1024]
    - [247, 0.0]
  - - [768, 128, 1, 4096]
    - [247, 0.0]
  - - [1024, 128, 1, 1024]
    - [247, 0.0]
  - - [2048, 32, 1, 4096]
    - [17, 0.0]
  - - [2048, 64, 1, 4096]
    - [247, 0.0]
  - - [4096, 32, 1, 1024]
    - [247, 0.0]
  - - [32768, 32, 1, 4096]
    - [247, 0.0]
  - - [768, 192, 1, 4096]
    - [248, 0.0]
  - - [768, 256, 1, 4096]
    - [249, 0.0]
  - - [1024, 192, 1, 4096]
    - [249, 0.0]
  - - [1024, 192, 1, 8192]
    - [249, 0.0]
  - - [1024, 256, 1, 8192]
    - [249, 0.0]
  - - [2048, 128, 1, 4096]
    - [249, 0.0]
  - - [4096, 64, 1, 1024]
    - [249, 0.0]
  - - [768, 384, 1, 1024]
    - [250, 0.0]
  - - [768, 384, 1, 4096]
    - [251, 0.0]
  - - [2048, 96, 1, 8192]
    - [251, 0.0]
  - - [4096, 64, 1, 4096]
    - [251, 0.0]
  - - [4096, 64, 1, 8192]
    - [251, 0.0]
  - - [768, 384, 1, 8192]
    - [252, 0.0]
  - - [768, 512, 1, 1024]
    - [253, 0.0]
  - - [768, 512, 1, 4096]
    - [254, 0.0]
  - - [768, 768, 1, 256]
    - [255, 0.0]
  - - [1024, 384, 1, 256]
    - [255, 0.0]
  - - [768, 768, 1, 1024]
    - [256, 0.0]
  - - [2048, 256, 1, 1024]
    - [256, 0.0]
  - - [768, 768, 1, 8192]
    - [257, 0.0]
  - - [4096, 128, 1, 1024]
    - [257, 0.0]
  - - [768, 1024, 1, 256]
    - [258, 0.0]
  - - [2048, 1024, 1, 256]
    - [258, 0.0]
  - - [4096, 512, 1, 256]
    - [258, 0.0]
  - - [768, 2048, 1, 256]
    - [259, 0.0]
  - - [4096, 256, 1, 256]
    - [259, 0.0]
  - - [768, 2048, 1, 8192]
    - [260, 0.0]
  - - [768, 4096, 1, 1024]
    - [261, 0.0]
  - - [768, 4096, 1, 4096]
    - [262, 0.0]
  - - [768, 4096, 1, 8192]
    - [263, 0.0]
  - - [768, 12288, 1, 256]
    - [264, 0.0]
  - - [768, 24576, 1, 256]
    - [264, 0.0]
  - - [2048, 16384, 1, 1024]
    - [264, 0.0]
  - - [4096, 2048, 1, 1024]
    - [264, 0.0]
  - - [4096, 8192, 1, 1024]
    - [264, 0.0]
  - - [8192, 4096, 1, 1024]
    - [243, 0.0]
  - - [16384, 1024, 1, 1024]
    - [264, 0.0]
  - - [768, 12288, 1, 1024]
    - [265, 0.0]
  - - [24576, 384, 1, 8192]
    - [265, 0.0]
  - - [768, 12288, 1, 4096]
    - [266, 0.0]
  - - [768, 16384, 1, 4096]
    - [267, 0.0]
  - - [768, 24576, 1, 4096]
    - [267, 0.0]
  - - [1024, 12288, 1, 4096]
    - [267, 0.0]
  - - [4096, 8192, 1, 4096]
    - [267, 0.0]
  - - [8192, 768, 1, 1024]
    - [267, 0.0]
  - - [16384, 384, 1, 4096]
    - [267, 0.0]
  - - [16384, 2048, 1, 4096]
    - [267, 0.0]
  - - [32768, 384, 1, 1024]
    - [267, 0.0]
  - - [768, 16384, 1, 8192]
    - [268, 0.0]
  - - [768, 32768, 1, 1024]
    - [269, 0.0]
  - - [1024, 24576, 1, 1024]
    - [269, 0.0]
  - - [1024, 64, 1, 8192]
    - [270, 0.0]
  - - [1024, 96, 1, 256]
    - [271, 0.0]
  - - [1024, 96, 1, 4096]
    - [272, 0.0]
  - - [1024, 128, 1, 4096]
    - [273, 0.0]
  - - [2048, 64, 1, 1024]
    - [273, 0.0]
  - - [2048, 64, 1, 8192]
    - [273, 0.0]
  - - [1024, 192, 1, 256]
    - [274, 0.0]
  - - [1024, 256, 1, 4096]
    - [275, 0.0]
  - - [1024, 384, 1, 1024]
    - [276, 0.0]
  - - [2048, 192, 1, 4096]
    - [276, 0.0]
  - - [1024, 384, 1, 4096]
    - [277, 0.0]
  - - [12288, 32, 1, 8192]
    - [277, 0.0]
  - - [1024, 512, 1, 4096]
    - [278, 0.0]
  - - [1024, 512, 1, 8192]
    - [278, 0.0]
  - - [1024, 768, 1, 256]
    - [279, 0.0]
  - - [1024, 768, 1, 4096]
    - [280, 0.0]
  - - [1024, 768, 1, 8192]
    - [280, 0.0]
  - - [1024, 1024, 1, 256]
    - [281, 0.0]
  - - [2048, 512, 1, 256]
    - [281, 0.0]
  - - [2048, 768, 1, 256]
    - [281, 0.0]
  - - [4096, 192, 1, 256]
    - [281, 0.0]
  - - [1024, 1024, 1, 4096]
    - [282, 0.0]
  - - [1024, 1024, 1, 8192]
    - [283, 0.0]
  - - [1024, 2048, 1, 8192]
    - [284, 0.0]
  - - [1024, 4096, 1, 256]
    - [285, 0.0]
  - - [1024, 4096, 1, 4096]
    - [286, 0.0]
  - - [1024, 8192, 1, 256]
    - [287, 0.0]
  - - [1024, 16384, 1, 256]
    - [287, 0.0]
  - - [2048, 4096, 1, 256]
    - [287, 0.0]
  - - [16384, 512, 1, 256]
    - [287, 0.0]
  - - [16384, 2048, 1, 256]
    - [287, 0.0]
  - - [1024, 8192, 1, 4096]
    - [288, 0.0]
  - - [1024, 12288, 1, 256]
    - [289, 0.0]
  - - [32768, 384, 1, 256]
    - [289, 0.0]
  - - [32768, 768, 1, 256]
    - [289, 0.0]
  - - [1024, 12288, 1, 8192]
    - [290, 0.0]
  - - [16384, 768, 1, 1024]
    - [290, 0.0]
  - - [1024, 16384, 1, 1024]
    - [245, 0.0]
  - - [1024, 32768, 1, 256]
    - [291, 0.0]
  - - [2048, 8192, 1, 256]
    - [291, 0.0]
  - - [8192, 768, 1, 256]
    - [291, 0.0]
  - - [8192, 2048, 1, 256]
    - [291, 0.0]
  - - [12288, 2048, 1, 256]
    - [291, 0.0]
  - - [12288, 2048, 1, 1024]
    - [291, 0.0]
  - - [16384, 384, 1, 256]
    - [291, 0.0]
  - - [32768, 512, 1, 256]
    - [291, 0.0]
  - - [1024, 32768, 1, 1024]
    - [292, 0.0]
  - - [1024, 32768, 1, 4096]
    - [293, 0.0]
  - - [2048, 16384, 1, 4096]
    - [293, 0.0]
  - - [2048, 32, 1, 8192]
    - [294, 0.0]
  - - [2048, 96, 1, 256]
    - [295, 0.0]
  - - [4096, 64, 1, 256]
    - [295, 0.0]
  - - [8192, 32, 1, 1024]
    - [295, 0.0]
  - - [8192, 32, 1, 8192]
    - [246, 0.0]
  - - [12288, 16, 1, 1024]
    - [295, 0.0]
  - - [2048, 96, 1, 4096]
    - [296, 0.0]
  - - [24576, 32, 1, 4096]
    - [296, 0.0]
  - - [2048, 128, 1, 256]
    - [297, 0.0]
  - - [8192, 64, 1, 256]
    - [297, 0.0]
  - - [2048, 192, 1, 1024]
    - [298, 0.0]
  - - [2048, 192, 1, 8192]
    - [298, 0.0]
  - - [4096, 96, 1, 4096]
    - [298, 0.0]
  - - [2048, 256, 1, 256]
    - [299, 0.0]
  - - [4096, 96, 1, 256]
    - [299, 0.0]
  - - [4096, 128, 1, 256]
    - [299, 0.0]
  - - [2048, 256, 1, 4096]
    - [300, 0.0]
  - - [2048, 256, 1, 8192]
    - [301, 0.0]
  - - [2048, 384, 1, 256]
    - [302, 0.0]
  - - [2048, 384, 1, 1024]
    - [303, 0.0]
  - - [2048, 384, 1, 8192]
    - [304, 0.0]
  - - [2048, 512, 1, 4096]
    - [305, 0.0]
  - - [12288, 192, 1, 8192]
    - [305, 0.0]
  - - [2048, 512, 1, 8192]
    - [306, 0.0]
  - - [4096, 256, 1, 8192]
    - [306, 0.0]
  - - [2048, 768, 1, 1024]
    - [307, 0.0]
  - - [2048, 768, 1, 8192]
    - [307, 0.0]
  - - [2048, 768, 1, 4096]
    - [308, 0.0]
  - - [2048, 1024, 1, 4096]
    - [309, 0.0]
  - - [2048, 1024, 1, 8192]
    - [310, 0.0]
  - - [2048, 2048, 1, 4096]
    - [311, 0.0]
  - - [2048, 4096, 1, 1024]
    - [312, 0.0]
  - - [2048, 4096, 1, 4096]
    - [313, 0.0]
  - - [2048, 8192, 1, 4096]
    - [454, 0.0]
  - - [12288, 2048, 1, 4096]
    - [314, 0.0]
  - - [16384, 384, 1, 1024]
    - [314, 0.0]
  - - [2048, 12288, 1, 1024]
    - [315, 0.0]
  - - [4096, 32, 1, 8192]
    - [316, 0.0]
  - - [8192, 32, 1, 4096]
    - [316, 0.0]
  - - [12288, 16, 1, 4096]
    - [316, 0.0]
  - - [12288, 32, 1, 1024]
    - [316, 0.0]
  - - [4096, 96, 1, 1024]
    - [317, 0.0]
  - - [4096, 96, 1, 8192]
    - [317, 0.0]
  - - [4096, 128, 1, 8192]
    - [318, 0.0]
  - - [4096, 192, 1, 4096]
    - [319, 0.0]
  - - [4096, 192, 1, 8192]
    - [320, 0.0]
  - - [4096, 384, 1, 256]
    - [321, 0.0]
  - - [4096, 384, 1, 1024]
    - [322, 0.0]
  - - [8192, 192, 1, 1024]
    - [322, 0.0]
  - - [4096, 384, 1, 8192]
    - [323, 0.0]
  - - [12288, 128, 1, 8192]
    - [323, 0.0]
  - - [4096, 512, 1, 1024]
    - [324, 0.0]
  - - [4096, 512, 1, 4096]
    - [325, 0.0]
  - - [4096, 768, 1, 256]
    - [326, 0.0]
  - - [8192, 384, 1, 256]
    - [326, 0.0]
  - - [16384, 768, 1, 256]
    - [363, 0.0]
  - - [4096, 768, 1, 1024]
    - [327, 0.0]
  - - [4096, 768, 1, 4096]
    - [328, 0.0]
  - - [8192, 384, 1, 4096]
    - [328, 0.0]
  - - [12288, 192, 1, 1024]
    - [328, 0.0]
  - - [16384, 192, 1, 1024]
    - [328, 0.0]
  - - [16384, 192, 1, 8192]
    - [328, 0.0]
  - - [4096, 768, 1, 8192]
    - [329, 0.0]
  - - [4096, 1024, 1, 256]
    - [330, 0.0]
  - - [4096, 1024, 1, 1024]
    - [331, 0.0]
  - - [4096, 1024, 1, 4096]
    - [332, 0.0]
  - - [8192, 512, 1, 1024]
    - [332, 0.0]
  - - [12288, 768, 1, 4096]
    - [332, 0.0]
  - - [16384, 256, 1, 4096]
    - [332, 0.0]
  - - [4096, 1024, 1, 8192]
    - [333, 0.0]
  - - [4096, 2048, 1, 256]
    - [334, 0.0]
  - - [32768, 1024, 1, 256]
    - [334, 0.0]
  - - [4096, 2048, 1, 4096]
    - [335, 0.0]
  - - [32768, 768, 1, 8192]
    - [335, 0.0]
  - - [4096, 4096, 1, 256]
    - [336, 0.0]
  - - [4096, 4096, 1, 4096]
    - [337, 0.0]
  - - [4096, 8192, 1, 256]
    - [338, 0.0]
  - - [24576, 1024, 1, 256]
    - [338, 0.0]
  - - [8192, 16, 1, 256]
    - [339, 0.0]
  - - [16384, 16, 1, 256]
    - [339, 0.0]
  - - [8192, 16, 1, 4096]
    - [340, 0.0]
  - - [8192, 16, 1, 8192]
    - [461, 0.0]
  - - [8192, 64, 1, 4096]
    - [342, 0.0]
  - - [16384, 64, 1, 4096]
    - [342, 0.0]
  - - [8192, 96, 1, 256]
    - [343, 0.0]
  - - [8192, 192, 1, 256]
    - [343, 0.0]
  - - [12288, 96, 1, 256]
    - [343, 0.0]
  - - [8192, 96, 1, 1024]
    - [344, 0.0]
  - - [8192, 96, 1, 4096]
    - [345, 0.0]
  - - [8192, 96, 1, 8192]
    - [475, 0.0]
  - - [8192, 128, 1, 1024]
    - [346, 0.0]
  - - [8192, 128, 1, 4096]
    - [346, 0.0]
  - - [8192, 128, 1, 8192]
    - [477, 0.0]
  - - [8192, 192, 1, 8192]
    - [491, 0.0]
  - - [8192, 256, 1, 256]
    - [348, 0.0]
  - - [8192, 256, 1, 1024]
    - [349, 0.0]
  - - [8192, 256, 1, 4096]
    - [350, 0.0]
  - - [8192, 256, 1, 8192]
    - [502, 0.0]
  - - [8192, 384, 1, 1024]
    - [351, 0.0]
  - - [8192, 384, 1, 8192]
    - [517, 0.0]
  - - [8192, 512, 1, 256]
    - [353, 0.0]
  - - [12288, 512, 1, 256]
    - [353, 0.0]
  - - [16384, 256, 1, 256]
    - [353, 0.0]
  - - [24576, 256, 1, 256]
    - [353, 0.0]
  - - [8192, 512, 1, 4096]
    - [354, 0.0]
  - - [8192, 512, 1, 8192]
    - [355, 0.0]
  - - [8192, 768, 1, 4096]
    - [356, 0.0]
  - - [32768, 768, 1, 1024]
    - [356, 0.0]
  - - [8192, 768, 1, 8192]
    - [405, 0.0]
  - - [12288, 512, 1, 8192]
    - [357, 0.0]
  - - [24576, 256, 1, 8192]
    - [357, 0.0]
  - - [8192, 1024, 1, 256]
    - [358, 0.0]
  - - [8192, 1024, 1, 1024]
    - [359, 0.0]
  - - [8192, 1024, 1, 4096]
    - [360, 0.0]
  - - [8192, 1024, 1, 8192]
    - [559, 0.0]
  - - [16384, 512, 1, 4096]
    - [361, 0.0]
  - - [16384, 512, 1, 8192]
    - [361, 0.0]
  - - [16384, 1024, 1, 8192]
    - [361, 0.0]
  - - [32768, 256, 1, 4096]
    - [361, 0.0]
  - - [32768, 256, 1, 8192]
    - [361, 0.0]
  - - [8192, 2048, 1, 4096]
    - [362, 0.0]
  - - [8192, 4096, 1, 4096]
    - [363, 0.0]
  - - [12288, 32, 1, 256]
    - [364, 0.0]
  - - [16384, 32, 1, 256]
    - [364, 0.0]
  - - [12288, 32, 1, 4096]
    - [365, 0.0]
  - - [32768, 64, 1, 8192]
    - [365, 0.0]
  - - [12288, 64, 1, 256]
    - [366, 0.0]
  - - [16384, 64, 1, 256]
    - [366, 0.0]
  - - [12288, 64, 1, 1024]
    - [367, 0.0]
  - - [12288, 64, 1, 4096]
    - [368, 0.0]
  - - [12288, 64, 1, 8192]
    - [369, 0.0]
  - - [32768, 64, 1, 4096]
    - [369, 0.0]
  - - [12288, 96, 1, 1024]
    - [370, 0.0]
  - - [12288, 96, 1, 4096]
    - [370, 0.0]
  - - [12288, 96, 1, 8192]
    - [370, 0.0]
  - - [24576, 96, 1, 8192]
    - [370, 0.0]
  - - [12288, 128, 1, 256]
    - [371, 0.0]
  - - [12288, 128, 1, 1024]
    - [372, 0.0]
  - - [12288, 128, 1, 4096]
    - [373, 0.0]
  - - [12288, 192, 1, 256]
    - [374, 0.0]
  - - [12288, 192, 1, 4096]
    - [375, 0.0]
  - - [12288, 256, 1, 256]
    - [376, 0.0]
  - - [16384, 192, 1, 256]
    - [376, 0.0]
  - - [12288, 256, 1, 1024]
    - [377, 0.0]
  - - [16384, 96, 1, 4096]
    - [377, 0.0]
  - - [24576, 96, 1, 1024]
    - [377, 0.0]
  - - [24576, 128, 1, 1024]
    - [377, 0.0]
  - - [12288, 256, 1, 4096]
    - [378, 0.0]
  - - [24576, 96, 1, 4096]
    - [378, 0.0]
  - - [24576, 128, 1, 4096]
    - [378, 0.0]
  - - [12288, 256, 1, 8192]
    - [379, 0.0]
  - - [24576, 64, 1, 4096]
    - [379, 0.0]
  - - [24576, 128, 1, 8192]
    - [379, 0.0]
  - - [12288, 384, 1, 1024]
    - [380, 0.0]
  - - [12288, 384, 1, 4096]
    - [381, 0.0]
  - - [12288, 384, 1, 8192]
    - [382, 0.0]
  - - [32768, 96, 1, 4096]
    - [382, 0.0]
  - - [32768, 128, 1, 4096]
    - [382, 0.0]
  - - [32768, 128, 1, 8192]
    - [382, 0.0]
  - - [12288, 512, 1, 1024]
    - [383, 0.0]
  - - [24576, 512, 1, 1024]
    - [383, 0.0]
  - - [12288, 512, 1, 4096]
    - [384, 0.0]
  - - [24576, 512, 1, 4096]
    - [384, 0.0]
  - - [12288, 768, 1, 256]
    - [385, 0.0]
  - - [12288, 768, 1, 1024]
    - [386, 0.0]
  - - [12288, 768, 1, 8192]
    - [387, 0.0]
  - - [12288, 1024, 1, 8192]
    - [388, 0.0]
  - - [16384, 16, 1, 1024]
    - [389, 0.0]
  - - [16384, 16, 1, 4096]
    - [390, 0.0]
  - - [16384, 32, 1, 4096]
    - [390, 0.0]
  - - [16384, 16, 1, 8192]
    - [391, 0.0]
  - - [16384, 32, 1, 1024]
    - [392, 0.0]
  - - [32768, 32, 1, 8192]
    - [392, 0.0]
  - - [16384, 32, 1, 8192]
    - [393, 0.0]
  - - [16384, 64, 1, 1024]
    - [394, 0.0]
  - - [16384, 64, 1, 8192]
    - [395, 0.0]
  - - [24576, 64, 1, 8192]
    - [395, 0.0]
  - - [16384, 96, 1, 256]
    - [396, 0.0]
  - - [16384, 96, 1, 1024]
    - [397, 0.0]
  - - [16384, 96, 1, 8192]
    - [397, 0.0]
  - - [16384, 128, 1, 256]
    - [398, 0.0]
  - - [16384, 128, 1, 1024]
    - [399, 0.0]
  - - [16384, 128, 1, 4096]
    - [400, 0.0]
  - - [16384, 128, 1, 8192]
    - [401, 0.0]
  - - [16384, 192, 1, 4096]
    - [402, 0.0]
  - - [16384, 256, 1, 1024]
    - [403, 0.0]
  - - [16384, 256, 1, 8192]
    - [404, 0.0]
  - - [16384, 384, 1, 8192]
    - [405, 0.0]
  - - [16384, 512, 1, 1024]
    - [455, 0.0]
  - - [16384, 768, 1, 4096]
    - [406, 0.0]
  - - [32768, 384, 1, 4096]
    - [406, 0.0]
  - - [16384, 768, 1, 8192]
    - [407, 0.0]
  - - [16384, 1024, 1, 256]
    - [408, 0.0]
  - - [16384, 1024, 1, 4096]
    - [409, 0.0]
  - - [16384, 2048, 1, 1024]
    - [410, 0.0]
  - - [24576, 16, 1, 256]
    - [411, 0.0]
  - - [32768, 16, 1, 1024]
    - [411, 0.0]
  - - [24576, 16, 1, 1024]
    - [412, 0.0]
  - - [24576, 16, 1, 8192]
    - [413, 0.0]
  - - [24576, 32, 1, 256]
    - [414, 0.0]
  - - [24576, 32, 1, 1024]
    - [415, 0.0]
  - - [24576, 32, 1, 8192]
    - [416, 0.0]
  - - [24576, 64, 1, 256]
    - [417, 0.0]
  - - [24576, 64, 1, 1024]
    - [418, 0.0]
  - - [24576, 96, 1, 256]
    - [419, 0.0]
  - - [32768, 96, 1, 256]
    - [419, 0.0]
  - - [24576, 128, 1, 256]
    - [420, 0.0]
  - - [24576, 192, 1, 256]
    - [421, 0.0]
  - - [24576, 192, 1, 1024]
    - [422, 0.0]
  - - [24576, 192, 1, 4096]
    - [423, 0.0]
  - - [24576, 192, 1, 8192]
    - [423, 0.0]
  - - [24576, 256, 1, 1024]
    - [424, 0.0]
  - - [24576, 256, 1, 4096]
    - [424, 0.0]
  - - [24576, 384, 1, 256]
    - [425, 0.0]
  - - [24576, 384, 1, 1024]
    - [426, 0.0]
  - - [24576, 384, 1, 4096]
    - [427, 0.0]
  - - [24576, 512, 1, 8192]
    - [428, 0.0]
  - - [24576, 768, 1, 256]
    - [429, 0.0]
  - - [24576, 768, 1, 1024]
    - [430, 0.0]
  - - [24576, 1024, 1, 1024]
    - [431, 0.0]
  - - [24576, 1024, 1, 8192]
    - [432, 0.0]
  - - [32768, 512, 1, 8192]
    - [432, 0.0]
  - - [32768, 16, 1, 256]
    - [433, 0.0]
  - - [32768, 32, 1, 256]
    - [434, 0.0]
  - - [32768, 32, 1, 1024]
    - [434, 0.0]
  - - [32768, 64, 1, 1024]
    - [435, 0.0]
  - - [32768, 96, 1, 1024]
    - [436, 0.0]
  - - [32768, 96, 1, 8192]
    - [437, 0.0]
  - - [32768, 128, 1, 256]
    - [438, 0.0]
  - - [32768, 128, 1, 1024]
    - [439, 0.0]
  - - [32768, 192, 1, 1024]
    - [440, 0.0]
  - - [32768, 192, 1, 4096]
    - [441, 0.0]
  - - [32768, 192, 1, 8192]
    - [442, 0.0]
  - - [32768, 256, 1, 256]
    - [443, 0.0]
  - - [32768, 256, 1, 1024]
    - [444, 0.0]
  - - [32768, 384, 1, 8192]
    - [445, 0.0]
  - - [32768, 512, 1, 1024]
    - [456, 0.0]
  - - [32768, 512, 1, 4096]
    - [457, 0.0]
  - - [32768, 768, 1, 4096]
    - [446, 0.0]
  - - [32768, 1024, 1, 8192]
    - [447, 0.0]
  - - [8192, 1, 1, 256]
    - [339, 0.0]
  - - [8192, 1, 1, 1024]
    - [193, 0.0]
  - - [8192, 1, 1, 4096]
    - [340, 0.0]
  - - [8192, 1, 1, 8192]
    - [247, 0.0]
  - - [8192, 1, 1, 28672]
    - [316, 0.0]
  - - [8192, 2, 1, 256]
    - [339, 0.0]
  - - [8192, 2, 1, 1024]
    - [193, 0.0]
  - - [8192, 2, 1, 4096]
    - [340, 0.0]
  - - [8192, 2, 1, 8192]
    - [341, 0.0]
  - - [8192, 2, 1, 28672]
    - [458, 0.0]
  - - [8192, 4, 1, 256]
    - [339, 0.0]
  - - [8192, 4, 1, 1024]
    - [193, 0.0]
  - - [8192, 4, 1, 4096]
    - [340, 0.0]
  - - [8192, 4, 1, 8192]
    - [341, 0.0]
  - - [8192, 4, 1, 28672]
    - [459, 0.0]
  - - [8192, 8, 1, 256]
    - [339, 0.0]
  - - [8192, 8, 1, 1024]
    - [193, 0.0]
  - - [8192, 8, 1, 4096]
    - [340, 0.0]
  - - [8192, 8, 1, 8192]
    - [460, 0.0]
  - - [8192, 8, 1, 28672]
    - [295, 0.0]
  - - [8192, 16, 1, 28672]
    - [462, 0.0]
  - - [8192, 17, 1, 256]
    - [45, 0.0]
  - - [8192, 17, 1, 1024]
    - [295, 0.0]
  - - [8192, 17, 1, 4096]
    - [316, 0.0]
  - - [8192, 17, 1, 8192]
    - [295, 0.0]
  - - [8192, 17, 1, 28672]
    - [463, 0.0]
  - - [8192, 20, 1, 256]
    - [45, 0.0]
  - - [8192, 20, 1, 1024]
    - [295, 0.0]
  - - [8192, 20, 1, 4096]
    - [316, 0.0]
  - - [8192, 20, 1, 8192]
    - [246, 0.0]
  - - [8192, 20, 1, 28672]
    - [463, 0.0]
  - - [8192, 24, 1, 256]
    - [45, 0.0]
  - - [8192, 24, 1, 1024]
    - [295, 0.0]
  - - [8192, 24, 1, 4096]
    - [316, 0.0]
  - - [8192, 24, 1, 8192]
    - [295, 0.0]
  - - [8192, 24, 1, 28672]
    - [340, 0.0]
  - - [8192, 32, 1, 28672]
    - [413, 0.0]
  - - [8192, 40, 1, 256]
    - [297, 0.0]
  - - [8192, 40, 1, 1024]
    - [119, 0.0]
  - - [8192, 40, 1, 4096]
    - [342, 0.0]
  - - [8192, 40, 1, 8192]
    - [464, 0.0]
  - - [8192, 40, 1, 28672]
    - [465, 0.0]
  - - [8192, 48, 1, 256]
    - [297, 0.0]
  - - [8192, 48, 1, 1024]
    - [119, 0.0]
  - - [8192, 48, 1, 4096]
    - [342, 0.0]
  - - [8192, 48, 1, 8192]
    - [466, 0.0]
  - - [8192, 48, 1, 28672]
    - [461, 0.0]
  - - [8192, 56, 1, 256]
    - [297, 0.0]
  - - [8192, 56, 1, 1024]
    - [119, 0.0]
  - - [8192, 56, 1, 4096]
    - [342, 0.0]
  - - [8192, 56, 1, 8192]
    - [251, 0.0]
  - - [8192, 56, 1, 28672]
    - [467, 0.0]
  - - [8192, 64, 1, 28672]
    - [468, 0.0]
  - - [8192, 72, 1, 256]
    - [343, 0.0]
  - - [8192, 72, 1, 1024]
    - [344, 0.0]
  - - [8192, 72, 1, 4096]
    - [345, 0.0]
  - - [8192, 72, 1, 8192]
    - [469, 0.0]
  - - [8192, 72, 1, 28672]
    - [470, 0.0]
  - - [8192, 80, 1, 256]
    - [343, 0.0]
  - - [8192, 80, 1, 1024]
    - [344, 0.0]
  - - [8192, 80, 1, 4096]
    - [345, 0.0]
  - - [8192, 80, 1, 8192]
    - [471, 0.0]
  - - [8192, 80, 1, 28672]
    - [472, 0.0]
  - - [8192, 81, 1, 256]
    - [343, 0.0]
  - - [8192, 81, 1, 1024]
    - [344, 0.0]
  - - [8192, 81, 1, 4096]
    - [345, 0.0]
  - - [8192, 81, 1, 8192]
    - [473, 0.0]
  - - [8192, 81, 1, 28672]
    - [474, 0.0]
  - - [8192, 88, 1, 256]
    - [343, 0.0]
  - - [8192, 88, 1, 1024]
    - [344, 0.0]
  - - [8192, 88, 1, 4096]
    - [345, 0.0]
  - - [8192, 88, 1, 8192]
    - [475, 0.0]
  - - [8192, 88, 1, 28672]
    - [469, 0.0]
  - - [8192, 96, 1, 28672]
    - [476, 0.0]
  - - [8192, 104, 1, 256]
    - [90, 0.0]
  - - [8192, 104, 1, 1024]
    - [346, 0.0]
  - - [8192, 104, 1, 4096]
    - [346, 0.0]
  - - [8192, 104, 1, 8192]
    - [477, 0.0]
  - - [8192, 104, 1, 28672]
    - [473, 0.0]
  - - [8192, 112, 1, 256]
    - [90, 0.0]
  - - [8192, 112, 1, 1024]
    - [346, 0.0]
  - - [8192, 112, 1, 4096]
    - [346, 0.0]
  - - [8192, 112, 1, 8192]
    - [346, 0.0]
  - - [8192, 112, 1, 28672]
    - [478, 0.0]
  - - [8192, 120, 1, 256]
    - [90, 0.0]
  - - [8192, 120, 1, 1024]
    - [346, 0.0]
  - - [8192, 120, 1, 4096]
    - [346, 0.0]
  - - [8192, 120, 1, 8192]
    - [479, 0.0]
  - - [8192, 120, 1, 28672]
    - [480, 0.0]
  - - [8192, 128, 1, 28672]
    - [346, 0.0]
  - - [8192, 136, 1, 256]
    - [343, 0.0]
  - - [8192, 136, 1, 1024]
    - [322, 0.0]
  - - [8192, 136, 1, 4096]
    - [132, 0.0]
  - - [8192, 136, 1, 8192]
    - [481, 0.0]
  - - [8192, 136, 1, 28672]
    - [482, 0.0]
  - - [8192, 140, 1, 256]
    - [343, 0.0]
  - - [8192, 140, 1, 1024]
    - [322, 0.0]
  - - [8192, 140, 1, 4096]
    - [132, 0.0]
  - - [8192, 140, 1, 8192]
    - [483, 0.0]
  - - [8192, 140, 1, 28672]
    - [482, 0.0]
  - - [8192, 144, 1, 256]
    - [343, 0.0]
  - - [8192, 144, 1, 1024]
    - [322, 0.0]
  - - [8192, 144, 1, 4096]
    - [132, 0.0]
  - - [8192, 144, 1, 8192]
    - [484, 0.0]
  - - [8192, 144, 1, 28672]
    - [482, 0.0]
  - - [8192, 148, 1, 256]
    - [343, 0.0]
  - - [8192, 148, 1, 1024]
    - [322, 0.0]
  - - [8192, 148, 1, 4096]
    - [132, 0.0]
  - - [8192, 148, 1, 8192]
    - [483, 0.0]
  - - [8192, 148, 1, 28672]
    - [485, 0.0]
  - - [8192, 152, 1, 256]
    - [343, 0.0]
  - - [8192, 152, 1, 1024]
    - [322, 0.0]
  - - [8192, 152, 1, 4096]
    - [132, 0.0]
  - - [8192, 152, 1, 8192]
    - [483, 0.0]
  - - [8192, 152, 1, 28672]
    - [486, 0.0]
  - - [8192, 156, 1, 256]
    - [343, 0.0]
  - - [8192, 156, 1, 1024]
    - [322, 0.0]
  - - [8192, 156, 1, 4096]
    - [132, 0.0]
  - - [8192, 156, 1, 8192]
    - [487, 0.0]
  - - [8192, 156, 1, 28672]
    - [488, 0.0]
  - - [8192, 160, 1, 256]
    - [343, 0.0]
  - - [8192, 160, 1, 1024]
    - [322, 0.0]
  - - [8192, 160, 1, 4096]
    - [132, 0.0]
  - - [8192, 160, 1, 8192]
    - [487, 0.0]
  - - [8192, 160, 1, 28672]
    - [489, 0.0]
  - - [8192, 168, 1, 256]
    - [343, 0.0]
  - - [8192, 168, 1, 1024]
    - [322, 0.0]
  - - [8192, 168, 1, 4096]
    - [132, 0.0]
  - - [8192, 168, 1, 8192]
    - [308, 0.0]
  - - [8192, 168, 1, 28672]
    - [490, 0.0]
  - - [8192, 176, 1, 256]
    - [343, 0.0]
  - - [8192, 176, 1, 1024]
    - [322, 0.0]
  - - [8192, 176, 1, 4096]
    - [132, 0.0]
  - - [8192, 176, 1, 8192]
    - [202, 0.0]
  - - [8192, 176, 1, 28672]
    - [490, 0.0]
  - - [8192, 184, 1, 256]
    - [343, 0.0]
  - - [8192, 184, 1, 1024]
    - [322, 0.0]
  - - [8192, 184, 1, 4096]
    - [132, 0.0]
  - - [8192, 184, 1, 8192]
    - [347, 0.0]
  - - [8192, 184, 1, 28672]
    - [491, 0.0]
  - - [8192, 192, 1, 28672]
    - [491, 0.0]
  - - [8192, 200, 1, 256]
    - [348, 0.0]
  - - [8192, 200, 1, 1024]
    - [349, 0.0]
  - - [8192, 200, 1, 4096]
    - [350, 0.0]
  - - [8192, 200, 1, 8192]
    - [492, 0.0]
  - - [8192, 200, 1, 28672]
    - [493, 0.0]
  - - [8192, 208, 1, 256]
    - [348, 0.0]
  - - [8192, 208, 1, 1024]
    - [349, 0.0]
  - - [8192, 208, 1, 4096]
    - [350, 0.0]
  - - [8192, 208, 1, 8192]
    - [350, 0.0]
  - - [8192, 208, 1, 28672]
    - [494, 0.0]
  - - [8192, 216, 1, 256]
    - [348, 0.0]
  - - [8192, 216, 1, 1024]
    - [349, 0.0]
  - - [8192, 216, 1, 4096]
    - [350, 0.0]
  - - [8192, 216, 1, 8192]
    - [495, 0.0]
  - - [8192, 216, 1, 28672]
    - [496, 0.0]
  - - [8192, 224, 1, 256]
    - [348, 0.0]
  - - [8192, 224, 1, 1024]
    - [349, 0.0]
  - - [8192, 224, 1, 4096]
    - [350, 0.0]
  - - [8192, 224, 1, 8192]
    - [497, 0.0]
  - - [8192, 224, 1, 28672]
    - [494, 0.0]
  - - [8192, 232, 1, 256]
    - [348, 0.0]
  - - [8192, 232, 1, 1024]
    - [349, 0.0]
  - - [8192, 232, 1, 4096]
    - [350, 0.0]
  - - [8192, 232, 1, 8192]
    - [134, 0.0]
  - - [8192, 232, 1, 28672]
    - [498, 0.0]
  - - [8192, 240, 1, 256]
    - [348, 0.0]
  - - [8192, 240, 1, 1024]
    - [349, 0.0]
  - - [8192, 240, 1, 4096]
    - [350, 0.0]
  - - [8192, 240, 1, 8192]
    - [499, 0.0]
  - - [8192, 240, 1, 28672]
    - [500, 0.0]
  - - [8192, 248, 1, 256]
    - [348, 0.0]
  - - [8192, 248, 1, 1024]
    - [349, 0.0]
  - - [8192, 248, 1, 4096]
    - [350, 0.0]
  - - [8192, 248, 1, 8192]
    - [501, 0.0]
  - - [8192, 248, 1, 28672]
    - [498, 0.0]
  - - [8192, 256, 1, 28672]
    - [499, 0.0]
  - - [8192, 257, 1, 256]
    - [326, 0.0]
  - - [8192, 257, 1, 1024]
    - [351, 0.0]
  - - [8192, 257, 1, 4096]
    - [328, 0.0]
  - - [8192, 257, 1, 8192]
    - [503, 0.0]
  - - [8192, 257, 1, 28672]
    - [504, 0.0]
  - - [8192, 264, 1, 256]
    - [326, 0.0]
  - - [8192, 264, 1, 1024]
    - [351, 0.0]
  - - [8192, 264, 1, 4096]
    - [328, 0.0]
  - - [8192, 264, 1, 8192]
    - [503, 0.0]
  - - [8192, 264, 1, 28672]
    - [505, 0.0]
  - - [8192, 272, 1, 256]
    - [326, 0.0]
  - - [8192, 272, 1, 1024]
    - [351, 0.0]
  - - [8192, 272, 1, 4096]
    - [328, 0.0]
  - - [8192, 272, 1, 8192]
    - [506, 0.0]
  - - [8192, 272, 1, 28672]
    - [507, 0.0]
  - - [8192, 280, 1, 256]
    - [326, 0.0]
  - - [8192, 280, 1, 1024]
    - [351, 0.0]
  - - [8192, 280, 1, 4096]
    - [328, 0.0]
  - - [8192, 280, 1, 8192]
    - [508, 0.0]
  - - [8192, 280, 1, 28672]
    - [509, 0.0]
  - - [8192, 288, 1, 256]
    - [326, 0.0]
  - - [8192, 288, 1, 1024]
    - [351, 0.0]
  - - [8192, 288, 1, 4096]
    - [328, 0.0]
  - - [8192, 288, 1, 8192]
    - [510, 0.0]
  - - [8192, 288, 1, 28672]
    - [509, 0.0]
  - - [8192, 296, 1, 256]
    - [326, 0.0]
  - - [8192, 296, 1, 1024]
    - [351, 0.0]
  - - [8192, 296, 1, 4096]
    - [328, 0.0]
  - - [8192, 296, 1, 8192]
    - [511, 0.0]
  - - [8192, 296, 1, 28672]
    - [509, 0.0]
  - - [8192, 304, 1, 256]
    - [326, 0.0]
  - - [8192, 304, 1, 1024]
    - [351, 0.0]
  - - [8192, 304, 1, 4096]
    - [328, 0.0]
  - - [8192, 304, 1, 8192]
    - [378, 0.0]
  - - [8192, 304, 1, 28672]
    - [512, 0.0]
  - - [8192, 312, 1, 256]
    - [326, 0.0]
  - - [8192, 312, 1, 1024]
    - [351, 0.0]
  - - [8192, 312, 1, 4096]
    - [328, 0.0]
  - - [8192, 312, 1, 8192]
    - [513, 0.0]
  - - [8192, 312, 1, 28672]
    - [507, 0.0]
  - - [8192, 320, 1, 256]
    - [326, 0.0]
  - - [8192, 320, 1, 1024]
    - [351, 0.0]
  - - [8192, 320, 1, 4096]
    - [328, 0.0]
  - - [8192, 320, 1, 8192]
    - [514, 0.0]
  - - [8192, 320, 1, 28672]
    - [507, 0.0]
  - - [8192, 328, 1, 256]
    - [326, 0.0]
  - - [8192, 328, 1, 1024]
    - [351, 0.0]
  - - [8192, 328, 1, 4096]
    - [328, 0.0]
  - - [8192, 328, 1, 8192]
    - [515, 0.0]
  - - [8192, 328, 1, 28672]
    - [516, 0.0]
  - - [8192, 336, 1, 256]
    - [326, 0.0]
  - - [8192, 336, 1, 1024]
    - [351, 0.0]
  - - [8192, 336, 1, 4096]
    - [328, 0.0]
  - - [8192, 336, 1, 8192]
    - [352, 0.0]
  - - [8192, 336, 1, 28672]
    - [205, 0.0]
  - - [8192, 344, 1, 256]
    - [326, 0.0]
  - - [8192, 344, 1, 1024]
    - [351, 0.0]
  - - [8192, 344, 1, 4096]
    - [328, 0.0]
  - - [8192, 344, 1, 8192]
    - [517, 0.0]
  - - [8192, 344, 1, 28672]
    - [517, 0.0]
  - - [8192, 352, 1, 256]
    - [326, 0.0]
  - - [8192, 352, 1, 1024]
    - [351, 0.0]
  - - [8192, 352, 1, 4096]
    - [328, 0.0]
  - - [8192, 352, 1, 8192]
    - [205, 0.0]
  - - [8192, 352, 1, 28672]
    - [328, 0.0]
  - - [8192, 360, 1, 256]
    - [326, 0.0]
  - - [8192, 360, 1, 1024]
    - [351, 0.0]
  - - [8192, 360, 1, 4096]
    - [328, 0.0]
  - - [8192, 360, 1, 8192]
    - [328, 0.0]
  - - [8192, 360, 1, 28672]
    - [516, 0.0]
  - - [8192, 368, 1, 256]
    - [326, 0.0]
  - - [8192, 368, 1, 1024]
    - [351, 0.0]
  - - [8192, 368, 1, 4096]
    - [328, 0.0]
  - - [8192, 368, 1, 8192]
    - [378, 0.0]
  - - [8192, 368, 1, 28672]
    - [518, 0.0]
  - - [8192, 376, 1, 256]
    - [326, 0.0]
  - - [8192, 376, 1, 1024]
    - [351, 0.0]
  - - [8192, 376, 1, 4096]
    - [328, 0.0]
  - - [8192, 376, 1, 8192]
    - [519, 0.0]
  - - [8192, 376, 1, 28672]
    - [520, 0.0]
  - - [8192, 384, 1, 28672]
    - [521, 0.0]
  - - [8192, 392, 1, 256]
    - [353, 0.0]
  - - [8192, 392, 1, 1024]
    - [332, 0.0]
  - - [8192, 392, 1, 4096]
    - [354, 0.0]
  - - [8192, 392, 1, 8192]
    - [286, 0.0]
  - - [8192, 392, 1, 28672]
    - [522, 0.0]
  - - [8192, 400, 1, 256]
    - [353, 0.0]
  - - [8192, 400, 1, 1024]
    - [332, 0.0]
  - - [8192, 400, 1, 4096]
    - [354, 0.0]
  - - [8192, 400, 1, 8192]
    - [286, 0.0]
  - - [8192, 400, 1, 28672]
    - [523, 0.0]
  - - [8192, 408, 1, 256]
    - [353, 0.0]
  - - [8192, 408, 1, 1024]
    - [332, 0.0]
  - - [8192, 408, 1, 4096]
    - [354, 0.0]
  - - [8192, 408, 1, 8192]
    - [522, 0.0]
  - - [8192, 408, 1, 28672]
    - [523, 0.0]
  - - [8192, 416, 1, 256]
    - [353, 0.0]
  - - [8192, 416, 1, 1024]
    - [332, 0.0]
  - - [8192, 416, 1, 4096]
    - [354, 0.0]
  - - [8192, 416, 1, 8192]
    - [524, 0.0]
  - - [8192, 416, 1, 28672]
    - [525, 0.0]
  - - [8192, 424, 1, 256]
    - [353, 0.0]
  - - [8192, 424, 1, 1024]
    - [332, 0.0]
  - - [8192, 424, 1, 4096]
    - [354, 0.0]
  - - [8192, 424, 1, 8192]
    - [526, 0.0]
  - - [8192, 424, 1, 28672]
    - [525, 0.0]
  - - [8192, 432, 1, 256]
    - [353, 0.0]
  - - [8192, 432, 1, 1024]
    - [332, 0.0]
  - - [8192, 432, 1, 4096]
    - [354, 0.0]
  - - [8192, 432, 1, 8192]
    - [527, 0.0]
  - - [8192, 432, 1, 28672]
    - [528, 0.0]
  - - [8192, 440, 1, 256]
    - [353, 0.0]
  - - [8192, 440, 1, 1024]
    - [332, 0.0]
  - - [8192, 440, 1, 4096]
    - [354, 0.0]
  - - [8192, 440, 1, 8192]
    - [527, 0.0]
  - - [8192, 440, 1, 28672]
    - [529, 0.0]
  - - [8192, 448, 1, 256]
    - [353, 0.0]
  - - [8192, 448, 1, 1024]
    - [332, 0.0]
  - - [8192, 448, 1, 4096]
    - [354, 0.0]
  - - [8192, 448, 1, 8192]
    - [265, 0.0]
  - - [8192, 448, 1, 28672]
    - [525, 0.0]
  - - [8192, 456, 1, 256]
    - [353, 0.0]
  - - [8192, 456, 1, 1024]
    - [332, 0.0]
  - - [8192, 456, 1, 4096]
    - [354, 0.0]
  - - [8192, 456, 1, 8192]
    - [215, 0.0]
  - - [8192, 456, 1, 28672]
    - [530, 0.0]
  - - [8192, 464, 1, 256]
    - [353, 0.0]
  - - [8192, 464, 1, 1024]
    - [332, 0.0]
  - - [8192, 464, 1, 4096]
    - [354, 0.0]
  - - [8192, 464, 1, 8192]
    - [531, 0.0]
  - - [8192, 464, 1, 28672]
    - [531, 0.0]
  - - [8192, 472, 1, 256]
    - [353, 0.0]
  - - [8192, 472, 1, 1024]
    - [332, 0.0]
  - - [8192, 472, 1, 4096]
    - [354, 0.0]
  - - [8192, 472, 1, 8192]
    - [532, 0.0]
  - - [8192, 472, 1, 28672]
    - [533, 0.0]
  - - [8192, 480, 1, 256]
    - [353, 0.0]
  - - [8192, 480, 1, 1024]
    - [332, 0.0]
  - - [8192, 480, 1, 4096]
    - [354, 0.0]
  - - [8192, 480, 1, 8192]
    - [531, 0.0]
  - - [8192, 480, 1, 28672]
    - [533, 0.0]
  - - [8192, 488, 1, 256]
    - [353, 0.0]
  - - [8192, 488, 1, 1024]
    - [332, 0.0]
  - - [8192, 488, 1, 4096]
    - [354, 0.0]
  - - [8192, 488, 1, 8192]
    - [331, 0.0]
  - - [8192, 488, 1, 28672]
    - [534, 0.0]
  - - [8192, 496, 1, 256]
    - [353, 0.0]
  - - [8192, 496, 1, 1024]
    - [332, 0.0]
  - - [8192, 496, 1, 4096]
    - [354, 0.0]
  - - [8192, 496, 1, 8192]
    - [535, 0.0]
  - - [8192, 496, 1, 28672]
    - [534, 0.0]
  - - [8192, 504, 1, 256]
    - [353, 0.0]
  - - [8192, 504, 1, 1024]
    - [332, 0.0]
  - - [8192, 504, 1, 4096]
    - [354, 0.0]
  - - [8192, 504, 1, 8192]
    - [214, 0.0]
  - - [8192, 504, 1, 28672]
    - [536, 0.0]
  - - [8192, 512, 1, 28672]
    - [537, 0.0]
  - - [8192, 514, 1, 256]
    - [291, 0.0]
  - - [8192, 514, 1, 1024]
    - [267, 0.0]
  - - [8192, 514, 1, 4096]
    - [356, 0.0]
  - - [8192, 514, 1, 8192]
    - [538, 0.0]
  - - [8192, 514, 1, 28672]
    - [539, 0.0]
  - - [8192, 544, 1, 256]
    - [291, 0.0]
  - - [8192, 544, 1, 1024]
    - [267, 0.0]
  - - [8192, 544, 1, 4096]
    - [356, 0.0]
  - - [8192, 544, 1, 8192]
    - [540, 0.0]
  - - [8192, 544, 1, 28672]
    - [541, 0.0]
  - - [8192, 576, 1, 256]
    - [291, 0.0]
  - - [8192, 576, 1, 1024]
    - [267, 0.0]
  - - [8192, 576, 1, 4096]
    - [356, 0.0]
  - - [8192, 576, 1, 8192]
    - [542, 0.0]
  - - [8192, 576, 1, 28672]
    - [538, 0.0]
  - - [8192, 608, 1, 256]
    - [291, 0.0]
  - - [8192, 608, 1, 1024]
    - [267, 0.0]
  - - [8192, 608, 1, 4096]
    - [356, 0.0]
  - - [8192, 608, 1, 8192]
    - [543, 0.0]
  - - [8192, 608, 1, 28672]
    - [544, 0.0]
  - - [8192, 640, 1, 256]
    - [291, 0.0]
  - - [8192, 640, 1, 1024]
    - [267, 0.0]
  - - [8192, 640, 1, 4096]
    - [356, 0.0]
  - - [8192, 640, 1, 8192]
    - [244, 0.0]
  - - [8192, 640, 1, 28672]
    - [545, 0.0]
  - - [8192, 672, 1, 256]
    - [291, 0.0]
  - - [8192, 672, 1, 1024]
    - [267, 0.0]
  - - [8192, 672, 1, 4096]
    - [356, 0.0]
  - - [8192, 672, 1, 8192]
    - [376, 0.0]
  - - [8192, 672, 1, 28672]
    - [211, 0.0]
  - - [8192, 704, 1, 256]
    - [291, 0.0]
  - - [8192, 704, 1, 1024]
    - [267, 0.0]
  - - [8192, 704, 1, 4096]
    - [356, 0.0]
  - - [8192, 704, 1, 8192]
    - [546, 0.0]
  - - [8192, 704, 1, 28672]
    - [428, 0.0]
  - - [8192, 736, 1, 256]
    - [291, 0.0]
  - - [8192, 736, 1, 1024]
    - [267, 0.0]
  - - [8192, 736, 1, 4096]
    - [356, 0.0]
  - - [8192, 736, 1, 8192]
    - [547, 0.0]
  - - [8192, 736, 1, 28672]
    - [445, 0.0]
  - - [8192, 768, 1, 28672]
    - [217, 0.0]
  - - [8192, 800, 1, 256]
    - [358, 0.0]
  - - [8192, 800, 1, 1024]
    - [359, 0.0]
  - - [8192, 800, 1, 4096]
    - [360, 0.0]
  - - [8192, 800, 1, 8192]
    - [548, 0.0]
  - - [8192, 800, 1, 28672]
    - [549, 0.0]
  - - [8192, 832, 1, 256]
    - [358, 0.0]
  - - [8192, 832, 1, 1024]
    - [359, 0.0]
  - - [8192, 832, 1, 4096]
    - [360, 0.0]
  - - [8192, 832, 1, 8192]
    - [550, 0.0]
  - - [8192, 832, 1, 28672]
    - [551, 0.0]
  - - [8192, 833, 1, 256]
    - [358, 0.0]
  - - [8192, 833, 1, 1024]
    - [359, 0.0]
  - - [8192, 833, 1, 4096]
    - [360, 0.0]
  - - [8192, 833, 1, 8192]
    - [550, 0.0]
  - - [8192, 833, 1, 28672]
    - [552, 0.0]
  - - [8192, 864, 1, 256]
    - [358, 0.0]
  - - [8192, 864, 1, 1024]
    - [359, 0.0]
  - - [8192, 864, 1, 4096]
    - [360, 0.0]
  - - [8192, 864, 1, 8192]
    - [550, 0.0]
  - - [8192, 864, 1, 28672]
    - [553, 0.0]
  - - [8192, 896, 1, 256]
    - [358, 0.0]
  - - [8192, 896, 1, 1024]
    - [359, 0.0]
  - - [8192, 896, 1, 4096]
    - [360, 0.0]
  - - [8192, 896, 1, 8192]
    - [520, 0.0]
  - - [8192, 896, 1, 28672]
    - [554, 0.0]
  - - [8192, 928, 1, 256]
    - [358, 0.0]
  - - [8192, 928, 1, 1024]
    - [359, 0.0]
  - - [8192, 928, 1, 4096]
    - [360, 0.0]
  - - [8192, 928, 1, 8192]
    - [555, 0.0]
  - - [8192, 928, 1, 28672]
    - [556, 0.0]
  - - [8192, 960, 1, 256]
    - [358, 0.0]
  - - [8192, 960, 1, 1024]
    - [359, 0.0]
  - - [8192, 960, 1, 4096]
    - [360, 0.0]
  - - [8192, 960, 1, 8192]
    - [555, 0.0]
  - - [8192, 960, 1, 28672]
    - [457, 0.0]
  - - [8192, 992, 1, 256]
    - [358, 0.0]
  - - [8192, 992, 1, 1024]
    - [359, 0.0]
  - - [8192, 992, 1, 4096]
    - [360, 0.0]
  - - [8192, 992, 1, 8192]
    - [557, 0.0]
  - - [8192, 992, 1, 28672]
    - [558, 0.0]
  - - [8192, 1024, 1, 28672]
    - [560, 0.0]
  - - [8192, 1088, 1, 256]
    - [291, 0.0]
  - - [8192, 1088, 1, 1024]
    - [312, 0.0]
  - - [8192, 1088, 1, 4096]
    - [362, 0.0]
  - - [8192, 1088, 1, 8192]
    - [561, 0.0]
  - - [8192, 1088, 1, 28672]
    - [562, 0.0]
  - - [8192, 1152, 1, 256]
    - [291, 0.0]
  - - [8192, 1152, 1, 1024]
    - [312, 0.0]
  - - [8192, 1152, 1, 4096]
    - [362, 0.0]
  - - [8192, 1152, 1, 8192]
    - [563, 0.0]
  - - [8192, 1152, 1, 28672]
    - [564, 0.0]
  - - [10240, 1, 1, 256]
    - [40, 0.0]
  - - [10240, 1, 1, 1024]
    - [295, 0.0]
  - - [10240, 1, 1, 4096]
    - [316, 0.0]
  - - [10240, 1, 1, 8192]
    - [565, 0.0]
  - - [10240, 2, 1, 256]
    - [40, 0.0]
  - - [10240, 2, 1, 1024]
    - [295, 0.0]
  - - [10240, 2, 1, 4096]
    - [316, 0.0]
  - - [10240, 2, 1, 8192]
    - [566, 0.0]
  - - [10240, 4, 1, 256]
    - [40, 0.0]
  - - [10240, 4, 1, 1024]
    - [295, 0.0]
  - - [10240, 4, 1, 4096]
    - [316, 0.0]
  - - [10240, 4, 1, 8192]
    - [566, 0.0]
  - - [10240, 8, 1, 256]
    - [40, 0.0]
  - - [10240, 8, 1, 1024]
    - [295, 0.0]
  - - [10240, 8, 1, 4096]
    - [316, 0.0]
  - - [10240, 8, 1, 8192]
    - [566, 0.0]
  - - [10240, 16, 1, 256]
    - [40, 0.0]
  - - [10240, 16, 1, 1024]
    - [295, 0.0]
  - - [10240, 16, 1, 4096]
    - [316, 0.0]
  - - [10240, 16, 1, 8192]
    - [144, 0.0]
  - - [10240, 17, 1, 256]
    - [364, 0.0]
  - - [10240, 17, 1, 1024]
    - [316, 0.0]
  - - [10240, 17, 1, 4096]
    - [365, 0.0]
  - - [10240, 17, 1, 8192]
    - [254, 0.0]
  - - [10240, 20, 1, 256]
    - [364, 0.0]
  - - [10240, 20, 1, 1024]
    - [316, 0.0]
  - - [10240, 20, 1, 4096]
    - [365, 0.0]
  - - [10240, 20, 1, 8192]
    - [567, 0.0]
  - - [10240, 24, 1, 256]
    - [364, 0.0]
  - - [10240, 24, 1, 1024]
    - [316, 0.0]
  - - [10240, 24, 1, 4096]
    - [365, 0.0]
  - - [10240, 24, 1, 8192]
    - [340, 0.0]
  - - [10240, 32, 1, 256]
    - [364, 0.0]
  - - [10240, 32, 1, 1024]
    - [316, 0.0]
  - - [10240, 32, 1, 4096]
    - [365, 0.0]
  - - [10240, 32, 1, 8192]
    - [567, 0.0]
  - - [10240, 40, 1, 256]
    - [366, 0.0]
  - - [10240, 40, 1, 1024]
    - [367, 0.0]
  - - [10240, 40, 1, 4096]
    - [368, 0.0]
  - - [10240, 40, 1, 8192]
    - [568, 0.0]
  - - [10240, 48, 1, 256]
    - [366, 0.0]
  - - [10240, 48, 1, 1024]
    - [367, 0.0]
  - - [10240, 48, 1, 4096]
    - [368, 0.0]
  - - [10240, 48, 1, 8192]
    - [568, 0.0]
  - - [10240, 56, 1, 256]
    - [366, 0.0]
  - - [10240, 56, 1, 1024]
    - [367, 0.0]
  - - [10240, 56, 1, 4096]
    - [368, 0.0]
  - - [10240, 56, 1, 8192]
    - [569, 0.0]
  - - [10240, 64, 1, 256]
    - [366, 0.0]
  - - [10240, 64, 1, 1024]
    - [367, 0.0]
  - - [10240, 64, 1, 4096]
    - [368, 0.0]
  - - [10240, 64, 1, 8192]
    - [277, 0.0]
  - - [10240, 72, 1, 256]
    - [343, 0.0]
  - - [10240, 72, 1, 1024]
    - [370, 0.0]
  - - [10240, 72, 1, 4096]
    - [370, 0.0]
  - - [10240, 72, 1, 8192]
    - [570, 0.0]
  - - [10240, 80, 1, 256]
    - [343, 0.0]
  - - [10240, 80, 1, 1024]
    - [370, 0.0]
  - - [10240, 80, 1, 4096]
    - [370, 0.0]
  - - [10240, 80, 1, 8192]
    - [487, 0.0]
  - - [10240, 81, 1, 256]
    - [343, 0.0]
  - - [10240, 81, 1, 1024]
    - [370, 0.0]
  - - [10240, 81, 1, 4096]
    - [370, 0.0]
  - - [10240, 81, 1, 8192]
    - [322, 0.0]
  - - [10240, 88, 1, 256]
    - [343, 0.0]
  - - [10240, 88, 1, 1024]
    - [370, 0.0]
  - - [10240, 88, 1, 4096]
    - [370, 0.0]
  - - [10240, 88, 1, 8192]
    - [106, 0.0]
  - - [10240, 96, 1, 256]
    - [343, 0.0]
  - - [10240, 96, 1, 1024]
    - [370, 0.0]
  - - [10240, 96, 1, 4096]
    - [370, 0.0]
  - - [10240, 96, 1, 8192]
    - [571, 0.0]
  - - [10240, 104, 1, 256]
    - [371, 0.0]
  - - [10240, 104, 1, 1024]
    - [372, 0.0]
  - - [10240, 104, 1, 4096]
    - [373, 0.0]
  - - [10240, 104, 1, 8192]
    - [572, 0.0]
  - - [10240, 112, 1, 256]
    - [371, 0.0]
  - - [10240, 112, 1, 1024]
    - [372, 0.0]
  - - [10240, 112, 1, 4096]
    - [373, 0.0]
  - - [10240, 112, 1, 8192]
    - [573, 0.0]
  - - [10240, 120, 1, 256]
    - [371, 0.0]
  - - [10240, 120, 1, 1024]
    - [372, 0.0]
  - - [10240, 120, 1, 4096]
    - [373, 0.0]
  - - [10240, 120, 1, 8192]
    - [573, 0.0]
  - - [10240, 128, 1, 256]
    - [371, 0.0]
  - - [10240, 128, 1, 1024]
    - [372, 0.0]
  - - [10240, 128, 1, 4096]
    - [373, 0.0]
  - - [10240, 128, 1, 8192]
    - [573, 0.0]
  - - [10240, 136, 1, 256]
    - [374, 0.0]
  - - [10240, 136, 1, 1024]
    - [328, 0.0]
  - - [10240, 136, 1, 4096]
    - [375, 0.0]
  - - [10240, 136, 1, 8192]
    - [574, 0.0]
  - - [10240, 140, 1, 256]
    - [374, 0.0]
  - - [10240, 140, 1, 1024]
    - [328, 0.0]
  - - [10240, 140, 1, 4096]
    - [375, 0.0]
  - - [10240, 140, 1, 8192]
    - [575, 0.0]
  - - [10240, 144, 1, 256]
    - [374, 0.0]
  - - [10240, 144, 1, 1024]
    - [328, 0.0]
  - - [10240, 144, 1, 4096]
    - [375, 0.0]
  - - [10240, 144, 1, 8192]
    - [575, 0.0]
  - - [10240, 148, 1, 256]
    - [374, 0.0]
  - - [10240, 148, 1, 1024]
    - [328, 0.0]
  - - [10240, 148, 1, 4096]
    - [375, 0.0]
  - - [10240, 148, 1, 8192]
    - [574, 0.0]
  - - [10240, 152, 1, 256]
    - [374, 0.0]
  - - [10240, 152, 1, 1024]
    - [328, 0.0]
  - - [10240, 152, 1, 4096]
    - [375, 0.0]
  - - [10240, 152, 1, 8192]
    - [575, 0.0]
  - - [10240, 156, 1, 256]
    - [374, 0.0]
  - - [10240, 156, 1, 1024]
    - [328, 0.0]
  - - [10240, 156, 1, 4096]
    - [375, 0.0]
  - - [10240, 156, 1, 8192]
    - [574, 0.0]
  - - [10240, 160, 1, 256]
    - [374, 0.0]
  - - [10240, 160, 1, 1024]
    - [328, 0.0]
  - - [10240, 160, 1, 4096]
    - [375, 0.0]
  - - [10240, 160, 1, 8192]
    - [574, 0.0]
  - - [10240, 168, 1, 256]
    - [374, 0.0]
  - - [10240, 168, 1, 1024]
    - [328, 0.0]
  - - [10240, 168, 1, 4096]
    - [375, 0.0]
  - - [10240, 168, 1, 8192]
    - [576, 0.0]
  - - [10240, 176, 1, 256]
    - [374, 0.0]
  - - [10240, 176, 1, 1024]
    - [328, 0.0]
  - - [10240, 176, 1, 4096]
    - [375, 0.0]
  - - [10240, 176, 1, 8192]
    - [576, 0.0]
  - - [10240, 184, 1, 256]
    - [374, 0.0]
  - - [10240, 184, 1, 1024]
    - [328, 0.0]
  - - [10240, 184, 1, 4096]
    - [375, 0.0]
  - - [10240, 184, 1, 8192]
    - [576, 0.0]
  - - [10240, 192, 1, 256]
    - [374, 0.0]
  - - [10240, 192, 1, 1024]
    - [328, 0.0]
  - - [10240, 192, 1, 4096]
    - [375, 0.0]
  - - [10240, 192, 1, 8192]
    - [577, 0.0]
  - - [10240, 200, 1, 256]
    - [376, 0.0]
  - - [10240, 200, 1, 1024]
    - [377, 0.0]
  - - [10240, 200, 1, 4096]
    - [378, 0.0]
  - - [10240, 200, 1, 8192]
    - [578, 0.0]
  - - [10240, 208, 1, 256]
    - [376, 0.0]
  - - [10240, 208, 1, 1024]
    - [377, 0.0]
  - - [10240, 208, 1, 4096]
    - [378, 0.0]
  - - [10240, 208, 1, 8192]
    - [578, 0.0]
  - - [10240, 216, 1, 256]
    - [376, 0.0]
  - - [10240, 216, 1, 1024]
    - [377, 0.0]
  - - [10240, 216, 1, 4096]
    - [378, 0.0]
  - - [10240, 216, 1, 8192]
    - [578, 0.0]
  - - [10240, 224, 1, 256]
    - [376, 0.0]
  - - [10240, 224, 1, 1024]
    - [377, 0.0]
  - - [10240, 224, 1, 4096]
    - [378, 0.0]
  - - [10240, 224, 1, 8192]
    - [578, 0.0]
  - - [10240, 232, 1, 256]
    - [376, 0.0]
  - - [10240, 232, 1, 1024]
    - [377, 0.0]
  - - [10240, 232, 1, 4096]
    - [378, 0.0]
  - - [10240, 232, 1, 8192]
    - [378, 0.0]
  - - [10240, 240, 1, 256]
    - [376, 0.0]
  - - [10240, 240, 1, 1024]
    - [377, 0.0]
  - - [10240, 240, 1, 4096]
    - [378, 0.0]
  - - [10240, 240, 1, 8192]
    - [378, 0.0]
  - - [10240, 248, 1, 256]
    - [376, 0.0]
  - - [10240, 248, 1, 1024]
    - [377, 0.0]
  - - [10240, 248, 1, 4096]
    - [378, 0.0]
  - - [10240, 248, 1, 8192]
    - [378, 0.0]
  - - [10240, 256, 1, 256]
    - [376, 0.0]
  - - [10240, 256, 1, 1024]
    - [377, 0.0]
  - - [10240, 256, 1, 4096]
    - [378, 0.0]
  - - [10240, 256, 1, 8192]
    - [518, 0.0]
  - - [10240, 257, 1, 256]
    - [140, 0.0]
  - - [10240, 257, 1, 1024]
    - [380, 0.0]
  - - [10240, 257, 1, 4096]
    - [381, 0.0]
  - - [10240, 257, 1, 8192]
    - [579, 0.0]
  - - [10240, 264, 1, 256]
    - [140, 0.0]
  - - [10240, 264, 1, 1024]
    - [380, 0.0]
  - - [10240, 264, 1, 4096]
    - [381, 0.0]
  - - [10240, 264, 1, 8192]
    - [579, 0.0]
  - - [10240, 272, 1, 256]
    - [140, 0.0]
  - - [10240, 272, 1, 1024]
    - [380, 0.0]
  - - [10240, 272, 1, 4096]
    - [381, 0.0]
  - - [10240, 272, 1, 8192]
    - [579, 0.0]
  - - [10240, 280, 1, 256]
    - [140, 0.0]
  - - [10240, 280, 1, 1024]
    - [380, 0.0]
  - - [10240, 280, 1, 4096]
    - [381, 0.0]
  - - [10240, 280, 1, 8192]
    - [579, 0.0]
  - - [10240, 288, 1, 256]
    - [140, 0.0]
  - - [10240, 288, 1, 1024]
    - [380, 0.0]
  - - [10240, 288, 1, 4096]
    - [381, 0.0]
  - - [10240, 288, 1, 8192]
    - [579, 0.0]
  - - [10240, 296, 1, 256]
    - [140, 0.0]
  - - [10240, 296, 1, 1024]
    - [380, 0.0]
  - - [10240, 296, 1, 4096]
    - [381, 0.0]
  - - [10240, 296, 1, 8192]
    - [579, 0.0]
  - - [10240, 304, 1, 256]
    - [140, 0.0]
  - - [10240, 304, 1, 1024]
    - [380, 0.0]
  - - [10240, 304, 1, 4096]
    - [381, 0.0]
  - - [10240, 304, 1, 8192]
    - [579, 0.0]
  - - [10240, 312, 1, 256]
    - [140, 0.0]
  - - [10240, 312, 1, 1024]
    - [380, 0.0]
  - - [10240, 312, 1, 4096]
    - [381, 0.0]
  - - [10240, 312, 1, 8192]
    - [579, 0.0]
  - - [10240, 320, 1, 256]
    - [140, 0.0]
  - - [10240, 320, 1, 1024]
    - [380, 0.0]
  - - [10240, 320, 1, 4096]
    - [381, 0.0]
  - - [10240, 320, 1, 8192]
    - [579, 0.0]
  - - [10240, 328, 1, 256]
    - [140, 0.0]
  - - [10240, 328, 1, 1024]
    - [380, 0.0]
  - - [10240, 328, 1, 4096]
    - [381, 0.0]
  - - [10240, 328, 1, 8192]
    - [354, 0.0]
  - - [10240, 336, 1, 256]
    - [140, 0.0]
  - - [10240, 336, 1, 1024]
    - [380, 0.0]
  - - [10240, 336, 1, 4096]
    - [381, 0.0]
  - - [10240, 336, 1, 8192]
    - [580, 0.0]
  - - [10240, 344, 1, 256]
    - [140, 0.0]
  - - [10240, 344, 1, 1024]
    - [380, 0.0]
  - - [10240, 344, 1, 4096]
    - [381, 0.0]
  - - [10240, 344, 1, 8192]
    - [581, 0.0]
  - - [10240, 352, 1, 256]
    - [140, 0.0]
  - - [10240, 352, 1, 1024]
    - [380, 0.0]
  - - [10240, 352, 1, 4096]
    - [381, 0.0]
  - - [10240, 352, 1, 8192]
    - [582, 0.0]
  - - [10240, 360, 1, 256]
    - [140, 0.0]
  - - [10240, 360, 1, 1024]
    - [380, 0.0]
  - - [10240, 360, 1, 4096]
    - [381, 0.0]
  - - [10240, 360, 1, 8192]
    - [582, 0.0]
  - - [10240, 368, 1, 256]
    - [140, 0.0]
  - - [10240, 368, 1, 1024]
    - [380, 0.0]
  - - [10240, 368, 1, 4096]
    - [381, 0.0]
  - - [10240, 368, 1, 8192]
    - [582, 0.0]
  - - [10240, 376, 1, 256]
    - [140, 0.0]
  - - [10240, 376, 1, 1024]
    - [380, 0.0]
  - - [10240, 376, 1, 4096]
    - [381, 0.0]
  - - [10240, 376, 1, 8192]
    - [439, 0.0]
  - - [10240, 384, 1, 256]
    - [140, 0.0]
  - - [10240, 384, 1, 1024]
    - [380, 0.0]
  - - [10240, 384, 1, 4096]
    - [381, 0.0]
  - - [10240, 384, 1, 8192]
    - [439, 0.0]
  - - [10240, 392, 1, 256]
    - [353, 0.0]
  - - [10240, 392, 1, 1024]
    - [383, 0.0]
  - - [10240, 392, 1, 4096]
    - [384, 0.0]
  - - [10240, 392, 1, 8192]
    - [583, 0.0]
  - - [10240, 400, 1, 256]
    - [353, 0.0]
  - - [10240, 400, 1, 1024]
    - [383, 0.0]
  - - [10240, 400, 1, 4096]
    - [384, 0.0]
  - - [10240, 400, 1, 8192]
    - [583, 0.0]
  - - [10240, 408, 1, 256]
    - [353, 0.0]
  - - [10240, 408, 1, 1024]
    - [383, 0.0]
  - - [10240, 408, 1, 4096]
    - [384, 0.0]
  - - [10240, 408, 1, 8192]
    - [583, 0.0]
  - - [10240, 416, 1, 256]
    - [353, 0.0]
  - - [10240, 416, 1, 1024]
    - [383, 0.0]
  - - [10240, 416, 1, 4096]
    - [384, 0.0]
  - - [10240, 416, 1, 8192]
    - [583, 0.0]
  - - [10240, 424, 1, 256]
    - [353, 0.0]
  - - [10240, 424, 1, 1024]
    - [383, 0.0]
  - - [10240, 424, 1, 4096]
    - [384, 0.0]
  - - [10240, 424, 1, 8192]
    - [583, 0.0]
  - - [10240, 432, 1, 256]
    - [353, 0.0]
  - - [10240, 432, 1, 1024]
    - [383, 0.0]
  - - [10240, 432, 1, 4096]
    - [384, 0.0]
  - - [10240, 432, 1, 8192]
    - [583, 0.0]
  - - [10240, 440, 1, 256]
    - [353, 0.0]
  - - [10240, 440, 1, 1024]
    - [383, 0.0]
  - - [10240, 440, 1, 4096]
    - [384, 0.0]
  - - [10240, 440, 1, 8192]
    - [583, 0.0]
  - - [10240, 448, 1, 256]
    - [353, 0.0]
  - - [10240, 448, 1, 1024]
    - [383, 0.0]
  - - [10240, 448, 1, 4096]
    - [384, 0.0]
  - - [10240, 448, 1, 8192]
    - [583, 0.0]
  - - [10240, 456, 1, 256]
    - [353, 0.0]
  - - [10240, 456, 1, 1024]
    - [383, 0.0]
  - - [10240, 456, 1, 4096]
    - [384, 0.0]
  - - [10240, 456, 1, 8192]
    - [545, 0.0]
  - - [10240, 464, 1, 256]
    - [353, 0.0]
  - - [10240, 464, 1, 1024]
    - [383, 0.0]
  - - [10240, 464, 1, 4096]
    - [384, 0.0]
  - - [10240, 464, 1, 8192]
    - [545, 0.0]
  - - [10240, 472, 1, 256]
    - [353, 0.0]
  - - [10240, 472, 1, 1024]
    - [383, 0.0]
  - - [10240, 472, 1, 4096]
    - [384, 0.0]
  - - [10240, 472, 1, 8192]
    - [545, 0.0]
  - - [10240, 480, 1, 256]
    - [353, 0.0]
  - - [10240, 480, 1, 1024]
    - [383, 0.0]
  - - [10240, 480, 1, 4096]
    - [384, 0.0]
  - - [10240, 480, 1, 8192]
    - [545, 0.0]
  - - [10240, 488, 1, 256]
    - [353, 0.0]
  - - [10240, 488, 1, 1024]
    - [383, 0.0]
  - - [10240, 488, 1, 4096]
    - [384, 0.0]
  - - [10240, 488, 1, 8192]
    - [584, 0.0]
  - - [10240, 496, 1, 256]
    - [353, 0.0]
  - - [10240, 496, 1, 1024]
    - [383, 0.0]
  - - [10240, 496, 1, 4096]
    - [384, 0.0]
  - - [10240, 496, 1, 8192]
    - [584, 0.0]
  - - [10240, 504, 1, 256]
    - [353, 0.0]
  - - [10240, 504, 1, 1024]
    - [383, 0.0]
  - - [10240, 504, 1, 4096]
    - [384, 0.0]
  - - [10240, 504, 1, 8192]
    - [584, 0.0]
  - - [10240, 512, 1, 256]
    - [353, 0.0]
  - - [10240, 512, 1, 1024]
    - [383, 0.0]
  - - [10240, 512, 1, 4096]
    - [384, 0.0]
  - - [10240, 512, 1, 8192]
    - [585, 0.0]
  - - [10240, 514, 1, 256]
    - [385, 0.0]
  - - [10240, 514, 1, 1024]
    - [386, 0.0]
  - - [10240, 514, 1, 4096]
    - [332, 0.0]
  - - [10240, 514, 1, 8192]
    - [586, 0.0]
  - - [10240, 544, 1, 256]
    - [385, 0.0]
  - - [10240, 544, 1, 1024]
    - [386, 0.0]
  - - [10240, 544, 1, 4096]
    - [332, 0.0]
  - - [10240, 544, 1, 8192]
    - [587, 0.0]
  - - [10240, 576, 1, 256]
    - [385, 0.0]
  - - [10240, 576, 1, 1024]
    - [386, 0.0]
  - - [10240, 576, 1, 4096]
    - [332, 0.0]
  - - [10240, 576, 1, 8192]
    - [406, 0.0]
  - - [10240, 608, 1, 256]
    - [385, 0.0]
  - - [10240, 608, 1, 1024]
    - [386, 0.0]
  - - [10240, 608, 1, 4096]
    - [332, 0.0]
  - - [10240, 608, 1, 8192]
    - [588, 0.0]
  - - [10240, 640, 1, 256]
    - [385, 0.0]
  - - [10240, 640, 1, 1024]
    - [386, 0.0]
  - - [10240, 640, 1, 4096]
    - [332, 0.0]
  - - [10240, 640, 1, 8192]
    - [588, 0.0]
  - - [10240, 672, 1, 256]
    - [385, 0.0]
  - - [10240, 672, 1, 1024]
    - [386, 0.0]
  - - [10240, 672, 1, 4096]
    - [332, 0.0]
  - - [10240, 672, 1, 8192]
    - [589, 0.0]
  - - [10240, 704, 1, 256]
    - [385, 0.0]
  - - [10240, 704, 1, 1024]
    - [386, 0.0]
  - - [10240, 704, 1, 4096]
    - [332, 0.0]
  - - [10240, 704, 1, 8192]
    - [590, 0.0]
  - - [10240, 736, 1, 256]
    - [385, 0.0]
  - - [10240, 736, 1, 1024]
    - [386, 0.0]
  - - [10240, 736, 1, 4096]
    - [332, 0.0]
  - - [10240, 736, 1, 8192]
    - [590, 0.0]
  - - [10240, 768, 1, 256]
    - [385, 0.0]
  - - [10240, 768, 1, 1024]
    - [386, 0.0]
  - - [10240, 768, 1, 4096]
    - [332, 0.0]
  - - [10240, 768, 1, 8192]
    - [590, 0.0]
  - - [10240, 800, 1, 256]
    - [182, 0.0]
  - - [10240, 800, 1, 1024]
    - [235, 0.0]
  - - [10240, 800, 1, 4096]
    - [217, 0.0]
  - - [10240, 800, 1, 8192]
    - [562, 0.0]
  - - [10240, 832, 1, 256]
    - [182, 0.0]
  - - [10240, 832, 1, 1024]
    - [235, 0.0]
  - - [10240, 832, 1, 4096]
    - [217, 0.0]
  - - [10240, 832, 1, 8192]
    - [535, 0.0]
  - - [10240, 833, 1, 256]
    - [182, 0.0]
  - - [10240, 833, 1, 1024]
    - [235, 0.0]
  - - [10240, 833, 1, 4096]
    - [217, 0.0]
  - - [10240, 833, 1, 8192]
    - [535, 0.0]
  - - [10240, 864, 1, 256]
    - [182, 0.0]
  - - [10240, 864, 1, 1024]
    - [235, 0.0]
  - - [10240, 864, 1, 4096]
    - [217, 0.0]
  - - [10240, 864, 1, 8192]
    - [535, 0.0]
  - - [10240, 896, 1, 256]
    - [182, 0.0]
  - - [10240, 896, 1, 1024]
    - [235, 0.0]
  - - [10240, 896, 1, 4096]
    - [217, 0.0]
  - - [10240, 896, 1, 8192]
    - [535, 0.0]
  - - [10240, 928, 1, 256]
    - [182, 0.0]
  - - [10240, 928, 1, 1024]
    - [235, 0.0]
  - - [10240, 928, 1, 4096]
    - [217, 0.0]
  - - [10240, 928, 1, 8192]
    - [542, 0.0]
  - - [10240, 960, 1, 256]
    - [182, 0.0]
  - - [10240, 960, 1, 1024]
    - [235, 0.0]
  - - [10240, 960, 1, 4096]
    - [217, 0.0]
  - - [10240, 960, 1, 8192]
    - [542, 0.0]
  - - [10240, 992, 1, 256]
    - [182, 0.0]
  - - [10240, 992, 1, 1024]
    - [235, 0.0]
  - - [10240, 992, 1, 4096]
    - [217, 0.0]
  - - [10240, 992, 1, 8192]
    - [591, 0.0]
  - - [10240, 1024, 1, 256]
    - [182, 0.0]
  - - [10240, 1024, 1, 1024]
    - [235, 0.0]
  - - [10240, 1024, 1, 4096]
    - [217, 0.0]
  - - [10240, 1024, 1, 8192]
    - [591, 0.0]
  - - [10240, 1088, 1, 256]
    - [291, 0.0]
  - - [10240, 1088, 1, 1024]
    - [291, 0.0]
  - - [10240, 1088, 1, 4096]
    - [314, 0.0]
  - - [10240, 1088, 1, 8192]
    - [244, 0.0]
  - - [10240, 1152, 1, 256]
    - [291, 0.0]
  - - [10240, 1152, 1, 1024]
    - [291, 0.0]
  - - [10240, 1152, 1, 4096]
    - [314, 0.0]
  - - [10240, 1152, 1, 8192]
    - [592, 0.0]
  - - [10240, 2048, 1, 256]
    - [291, 0.0]
  - - [10240, 2048, 1, 1024]
    - [291, 0.0]
  - - [10240, 2048, 1, 4096]
    - [314, 0.0]
  - - [57344, 1, 1, 256]
    - [433, 0.0]
  - - [57344, 1, 1, 1024]
    - [411, 0.0]
  - - [57344, 1, 1, 4096]
    - [144, 0.0]
  - - [57344, 1, 1, 8192]
    - [593, 0.0]
  - - [57344, 2, 1, 256]
    - [433, 0.0]
  - - [57344, 2, 1, 1024]
    - [411, 0.0]
  - - [57344, 2, 1, 4096]
    - [144, 0.0]
  - - [57344, 2, 1, 8192]
    - [389, 0.0]
  - - [57344, 4, 1, 256]
    - [433, 0.0]
  - - [57344, 4, 1, 1024]
    - [411, 0.0]
  - - [57344, 4, 1, 4096]
    - [144, 0.0]
  - - [57344, 4, 1, 8192]
    - [390, 0.0]
  - - [57344, 8, 1, 256]
    - [433, 0.0]
  - - [57344, 8, 1, 1024]
    - [411, 0.0]
  - - [57344, 8, 1, 4096]
    - [144, 0.0]
