projects/hipblaslt/library/src/amd_detail/rocblaslt/src/Tensile/Logic/asm_full/aquavanjaram/gfx942/Equality/aquavanjaram_Cijk_Ailk_Bjlk_SB_UserArgs.yaml
- {MinimumRequiredVersion: 4.33.0}
- aquavanjaram
- gfx942
- [Device 0049, Device 0050]
    SolutionIndex: 0
    SolutionNameMin: Cijk_Ailk_Bjlk_SB_UserArgs_MT128x112x32_MI16x16x1_SN_GRVWA4_GRVWB2_GSU1_LBSPPA512_LBSPPB448_LPA0_LPB0_MIWT2_7_NLCA1_NLCB7_SU0_SUM0_SUS0_SVW2_VWA2_VWB1_WG64_4_1_WGM0
    SolutionIndex: 1
    SolutionNameMin: Cijk_Ailk_Bjlk_SB_UserArgs_MT144x256x32_MI16x16x1_SN_GRVWA2_GRVWB4_GSU1_LBSPPA576_LBSPPB1024_LPA0_LPB0_MIWT9_4_NLCA9_NLCB1_SU0_SUM0_SUS0_SVW1_VWA1_VWB4_WG16_16_1_WGM40
    SolutionIndex: 2
    SolutionNameMin: Cijk_Ailk_Bjlk_SB_UserArgs_MT64x64x32_MI16x16x1_SN_GRVWA4_GRVWB4_GSU1_LBSPPA256_LBSPPB256_LPA0_LPB0_MIWT2_2_NLCA1_NLCB1_SU4_SUM0_SUS256_SVW2_VWA2_VWB2_WG32_8_1_WGM40
    SolutionIndex: 3
    SolutionNameMin: Cijk_Ailk_Bjlk_SB_UserArgs_MT224x256x32_MI16x16x1_SN_GRVWA4_GRVWB4_GSU1_LBSPPA896_LBSPPB1024_LPA0_LPB0_MIWT14_4_NLCA7_NLCB1_SU4_SUM0_SUS256_SVW2_VWA2_VWB4_WG16_16_1_WGM40
    SolutionIndex: 4
    SolutionNameMin: Cijk_Ailk_Bjlk_SB_UserArgs_MT224x256x32_MI16x16x1_SN_GRVWA4_GRVWB4_GSU1_LBSPPA896_LBSPPB1024_LPA0_LPB0_MIWT14_4_NLCA7_NLCB1_SU8_SUM0_SUS256_SVW2_VWA2_VWB4_WG16_16_1_WGM40
    SolutionIndex: 5
    SolutionNameMin: Cijk_Ailk_Bjlk_SB_UserArgs_MT256x256x32_MI16x16x1_SN_GRVWA4_GRVWB4_GSU1_LBSPPA1024_LBSPPB1024_LPA0_LPB0_MIWT8_8_NLCA1_NLCB1_SU8_SUM0_SUS256_SVW4_VWA4_VWB4_WG32_8_1_WGM8
    SolutionIndex: 6
    SolutionNameMin: Cijk_Ailk_Bjlk_SB_UserArgs_MT32x32x64_MI16x16x1_SN_GRVWA4_GRVWB4_GSU1_LBSPPA128_LBSPPB128_LPA16_LPB16_MIWT1_1_NLCA1_NLCB1_SU0_SUM0_SUS0_SVW1_VWA1_VWB1_WG32_8_1_WGM0
    SolutionIndex: 7
    SolutionNameMin: Cijk_Ailk_Bjlk_SB_UserArgs_MT16x192x32_MI16x16x1_SN_GSU1_GSUC0_GSUWGMRR1_K1_MIWT1_3_SU32_SUM0_SUS256_WGM8_WGMXCC1_WGMXCCGn1
    SolutionIndex: 8
    SolutionNameMin: Cijk_Ailk_Bjlk_SB_UserArgs_MT128x128x32_MI16x16x1_SN_GRVWB4_GSU1_GSUAMB_GSUC0_GSUWGMRR0_K1_LBSPPA512_LBSPPB512_LPB0_MIWT2_8_SU0_SUM0_SUS0_SVW2_VWA2_VWB4_WG64_4_1_WGM8_WGMXCC8_WGMXCCG304
    SolutionIndex: 9
    SolutionNameMin: Cijk_Ailk_Bjlk_SB_UserArgs_MT128x128x32_MI16x16x1_SN_GRVWB4_GSU1_GSUAMB_GSUC0_GSUWGMRR0_K1_LBSPPA512_LBSPPB512_LPB0_MIWT4_4_SU0_SUM0_SUS0_SVW4_VWA4_VWB4_WG32_8_1_WGM6_WGMXCC8_WGMXCCG304
    SolutionIndex: 10
    SolutionNameMin: Cijk_Ailk_Bjlk_SB_UserArgs_MT128x128x32_MI16x16x1_SN_GRVWB4_GSU1_GSUAMBSK_GSUC0_GSUWGMRR0_K1_LBSPPA512_LBSPPB512_LPB0_MIWT4_4_SU0_SUM0_SUS0_SVW4_VWA4_VWB4_WG32_8_1_WGM8_WGMXCC8_WGMXCCG304
    SolutionIndex: 11
    SolutionNameMin: Cijk_Ailk_Bjlk_SB_UserArgs_MT128x128x32_MI16x16x1_SN_GRVWB4_GSU1_GSUAMB_GSUC0_GSUWGMRR0_K1_LBSPPA512_LBSPPB512_LPB0_MIWT4_4_SU8_SUM1_SUS128_SVW4_VWA4_VWB4_WG32_8_1_WGM6_WGMXCC8_WGMXCCG304
    SolutionIndex: 12
    SolutionNameMin: Cijk_Ailk_Bjlk_SB_UserArgs_MT128x32x32_MI16x16x1_SN_LDSB1_GSU16_GSUC0_GSUWGMRR0_K1_LBSPPA512_LBSPPB128_LPA0_LPB16_MIWT8_1_NLCA1_NLCB1_SU0_SUM0_SUS128_SVW4_VWA4_VWB1_WG16_8_2_WGM1_WGMXCC1_WGMXCCGn1
    SolutionIndex: 13
    SolutionNameMin: Cijk_Ailk_Bjlk_SB_UserArgs_MT64x64x64_MI16x16x1_SN_LDSB1_GSU30_GSUC0_GSUWGMRR0_K1_LBSPPA256_LBSPPB256_LPA0_LPB16_MIWT4_1_NLCA1_NLCB1_SU0_SUM0_SUS256_SVW4_VWA4_VWB1_WG16_16_1_WGM1_WGMXCC1_WGMXCCGn1
    SolutionIndex: 14
    SolutionNameMin: Cijk_Ailk_Bjlk_SB_UserArgs_MT64x32x128_MI16x16x1_SN_LDSB1_GSU28_GSUC0_GSUWGMRR0_K1_LBSPPA256_LBSPPB128_LPA0_LPB0_MIWT2_2_NLCB1_SU0_SUM0_SUS512_SVW2_VWA2_VWB2_WG32_4_2_WGM1_WGMXCC1_WGMXCCGn1
    SolutionIndex: 15
    SolutionNameMin: Cijk_Ailk_Bjlk_S_B_UserArgs_MT64x64x32_MI16x16x1_SN_LDSB0_AFC0_AFEM1_AFEM1_ASEM1_CLR1_CADS0_DTVA0_DTVB1_EPS0_FDSI0_GRPM1_GRVWA4_GRVWB1_GSU1_GSUAMB_GSUC0_GSUWGMRR0_GLS0_ISA942_IU1_K1_LBSPPA256_LBSPPB0_LBSPPM0_LPA0_LPB0_LPM0_LRVW1_LWPMn1_MIAV0_MIWT4_1_MO40_NTn1_NTA0_NTB0_NTC0_NTD4_NTM0_NEPBS16_NLCA1_NLCB1_ONLL1_PGR2_PLR1_PKA1_SIA3_SS1_SU0_SUM0_SUS128_SPO1_SRVW0_SSO0_SVW4_SK0_SKXCCM0_TLDS0_ULSGRO0_USL1_UIOFGRO0_USFGROn1_VSn1_VWA4_VWB1_WSGRA1_WSGRB0_WS64_WG16_16_1_WGM8_WGMXCC1_WGMXCCG0
- - - [512, 512, 1, 512]
    - [6, 0.0]
  - - [1024, 1024, 1, 1024]
    - [2, 0.0]
  - - [2048, 2048, 1, 2048]
    - [0, 0.0]
  - - [4096, 4096, 1, 4096]
    - [4, 0.0]
  - - [4096, 4096, 1, 8192]
    - [3, 0.0]
  - - [4864, 4096, 1, 8192]
    - [5, 0.0]
  - - [8192, 8192, 1, 8192]
    - [1, 0.0]
  - - [5, 160, 2048, 707]
    - [7, 0.0]
  - - [65536, 512, 1, 256]
    - [8, 44.09]
  - - [262144, 256, 1, 256]
    - [9, 43.15]
  - - [65536, 512, 1, 512]
    - [9, 48.76]
  - - [16384, 512, 1, 512]
    - [10, 45.5]
  - - [262144, 256, 1, 128]
    - [11, 35.85]
  - - [256, 256, 1, 8000000]
    - [12, 84461.0]
  - - [256, 128, 1, 8000000]
    - [13, 71012.1]
  - - [128, 64, 1, 8000000]
    - [14, 39377.2]
  - - [1024, 1024, 1, 256]
    - [15, 29.09]
- null
- null
- DeviceEfficiency
- Equality
