projects/hipblaslt/library/src/amd_detail/rocblaslt/src/Tensile/Logic/asm_full/aquavanjaram/gfx942/Equality/aquavanjaram_Cijk_Ailk_Bjlk_BBS_BH_UserArgs.yaml
- {MinimumRequiredVersion: 4.33.0}
- aquavanjaram
- gfx942
- [Device 0049, Device 0050]
    SolutionIndex: 0
    SolutionNameMin: Cijk_Ailk_Bjlk_BBS_BH_MT128x128x64_MI32x32x1_SN_LDSB1_GRVWB8_GSU1_LBSPPA0_LBSPPB0_LPA0_LPB0_MIWT2_2_NLCB1_SVW2_VWA2_VWB2_WG64_4_1
    SolutionIndex: 1
    SolutionNameMin: Cijk_Ailk_Bjlk_BBS_BH_MT256x224x64_MI16x16x1_SN_LDSB1_GRVWB4_GSU1_LBSPPA2048_LBSPPB1792_LPA16_LPB16_MIWT4_14_NLCB7_SVW4_VWA4_VWB2_WG64_4_1
    SolutionIndex: 2
    SolutionNameMin: Cijk_Ailk_Bjlk_BBS_BH_MT256x224x64_MI16x16x1_SN_LDSB1_GRVWB8_GSU1_LBSPPA2048_LBSPPB1792_LPA16_LPB16_MIWT4_14_NLCB7_SVW4_VWA4_VWB2_WG64_4_1
    SolutionIndex: 3
    SolutionNameMin: Cijk_Ailk_Bjlk_BBS_BH_MT128x128x128_MI32x32x1_SN_LDSB1_GRVWB8_GSU1_LBSPPA0_LBSPPB0_LPA0_LPB0_MIWT2_2_NLCB1_SVW2_VWA2_VWB2_WG64_4_1
    SolutionIndex: 4
    SolutionNameMin: Cijk_Ailk_Bjlk_BBS_BH_MT256x128x32_MI16x16x1_SN_LDSB1_GRVWB8_GSU1_LBSPPA2048_LBSPPB1024_LPA16_LPB48_MIWT4_8_NLCB1_SU0_SUM0_SUS0_SPO0_SVW4_VWA4_VWB8_WG64_4_1_WGM1
    SolutionIndex: 5
    SolutionNameMin: Cijk_Ailk_Bjlk_BBS_BH_MT256x128x32_MI16x16x1_SN_LDSB1_GRVWB8_GSU1_LBSPPA2048_LBSPPB1024_LPA16_LPB48_MIWT4_8_NLCB1_SU4_SUM2_SUS256_SPO0_SVW4_VWA4_VWB8_WG64_4_1_WGM1
    SolutionIndex: 6
    SolutionNameMin: Cijk_Ailk_Bjlk_BBS_BH_MT256x144x32_MI16x16x1_SN_LDSB0_GRVWB2_GSU1_LBSPPA2048_LBSPPB1152_LPA16_LPB16_MIWT4_9_NLCB9_SU0_SUM0_SUS0_SPO0_SVW4_VWA4_VWB1_WG64_4_1_WGM1
    SolutionIndex: 7
    SolutionNameMin: Cijk_Ailk_Bjlk_BBS_BH_MT16x256x32_MI16x16x1_SN_LDSB1_GRVWB8_GSU8_LBSPPB2048_LWPM0p40_MIWT1_4_NTB0_SU0_SUM0_SUS0_SPO0_VWB4_WGM1
    SolutionIndex: 8
    SolutionNameMin: Cijk_Ailk_Bjlk_BBS_BH_MT16x128x32_MI16x16x1_SN_LDSB0_GRVWB8_GSU10_LBSPPB1024_LWPMn1_MIWT1_2_NTB1_SU0_SUM0_SUS0_SPO1_VWB2_WGM1
    SolutionIndex: 9
    SolutionNameMin: Cijk_Ailk_Bjlk_BBS_BH_MT16x64x64_MI16x16x1_SN_LDSB0_GRVWB8_GSU15_LBSPPB512_LWPM0p40_MIWT1_1_NTB1_SU0_SUM0_SUS0_SPO1_VWB1_WGM1
    SolutionIndex: 10
    SolutionNameMin: Cijk_Ailk_Bjlk_BBS_BH_UserArgs_MT128x256x32_MI16x16x1_SN_GSU1_K1_LBSPPA1024_LPA0_LPB0_MIAV0_MIWT4_8_NTA0_NTB0_NTC5_NTD5_SS1_SU0_SUM0_SUS0_SPO0_SVW4_VWA4_VWB8_WG32_8_1_WGM16
    SolutionIndex: 11
    SolutionNameMin: Cijk_Ailk_Bjlk_BBS_BH_UserArgs_MT128x256x32_MI16x16x1_SN_GSU1_K1_LBSPPA1024_LPA0_LPB0_MIAV1_MIWT8_4_NTA0_NTB0_NTC3_NTD3_SS0_SU0_SUM0_SUS0_SPO0_SVW4_VWA8_VWB4_WG16_16_1_WGM16
    SolutionIndex: 12
    SolutionNameMin: Cijk_Ailk_Bjlk_BBS_BH_UserArgs_MT256x256x32_MI16x16x1_SN_GSU1_K1_LBSPPA2048_LPA0_LPB0_MIAV0_MIWT8_8_NTA1_NTB2_NTC5_NTD5_SS1_SU32_SUM0_SUS64_SPO1_SVW8_VWA8_VWB8_WG32_8_1_WGM32
    SolutionIndex: 13
    SolutionNameMin: Cijk_Ailk_Bjlk_BBS_BH_UserArgs_MT256x256x32_MI16x16x1_SN_GSU1_K1_LBSPPA2048_LPA0_LPB0_MIAV0_MIWT8_8_NTA2_NTB3_NTC4_NTD4_SS1_SU32_SUM0_SUS64_SPO1_SVW8_VWA8_VWB8_WG32_8_1_WGM16
    SolutionIndex: 14
    SolutionNameMin: Cijk_Ailk_Bjlk_BBS_BH_UserArgs_MT256x256x32_MI16x16x1_SN_GSU1_K1_LBSPPA2048_LPA0_LPB0_MIAV0_MIWT8_8_NTA0_NTB3_NTC1_NTD1_SS1_SU32_SUM0_SUS64_SPO1_SVW8_VWA8_VWB8_WG32_8_1_WGM16
    SolutionIndex: 15
    SolutionNameMin: Cijk_Ailk_Bjlk_BBS_BH_UserArgs_MT256x256x32_MI16x16x1_SN_GSU1_K1_LBSPPA2048_LPA0_LPB0_MIAV0_MIWT8_8_NTA3_NTB3_NTC4_NTD4_SS1_SU32_SUM0_SUS64_SPO1_SVW8_VWA8_VWB8_WG32_8_1_WGMn8
    SolutionIndex: 16
    SolutionNameMin: Cijk_Ailk_Bjlk_BBS_BH_UserArgs_MT256x256x32_MI16x16x1_SN_GSU1_K1_LBSPPA2048_LPA0_LPB0_MIAV0_MIWT8_8_NTA0_NTB2_NTC5_NTD5_SS1_SU32_SUM0_SUS64_SPO1_SVW8_VWA8_VWB8_WG32_8_1_WGMn8
    SolutionIndex: 17
    SolutionNameMin: Cijk_Ailk_Bjlk_BBS_BH_UserArgs_MT256x256x32_MI16x16x1_SN_GSU1_K1_LBSPPA2048_LPA0_LPB0_MIAV0_MIWT8_8_NTA2_NTB1_NTC4_NTD4_SS1_SU32_SUM0_SUS64_SPO1_SVW8_VWA8_VWB8_WG32_8_1_WGM1
    SolutionIndex: 18
    SolutionNameMin: Cijk_Ailk_Bjlk_BBS_BH_UserArgs_MT128x256x32_MI16x16x1_SN_GSU1_K1_LBSPPA1024_LPA0_LPB0_MIAV0_MIWT4_8_NTA3_NTB2_NTC1_NTD1_SS1_SU0_SUM0_SUS0_SPO0_SVW4_VWA4_VWB8_WG32_8_1_WGMn8
    SolutionIndex: 19
    SolutionNameMin: Cijk_Ailk_Bjlk_BBS_BH_UserArgs_MT256x224x32_MI16x16x1_SN_LDSB1_GSU3_GSUC1_GSUWGMRR1_K1_MIWT4_14_NEPBS16_SU8_SUM0_SUS256_WSGRB2_WGM304_WGMXCC8_WGMXCCGn1
    SolutionIndex: 20
    SolutionNameMin: Cijk_Ailk_Bjlk_BBS_BH_UserArgs_MT128x128x64_MI16x16x1_SN_GSU32_GSUC0_GSUWGMRR0_K1_MIWT4_4_SU8_SUM0_SUS256_WGM4_WGMXCC8_WGMXCCG32
    SolutionIndex: 21
    SolutionNameMin: Cijk_Ailk_Bjlk_BBS_BH_UserArgs_MT128x128x64_MI16x16x1_SN_GSU38_GSUC1_GSUWGMRR1_K1_MIWT4_4_NTD0_NEPBS0_SU8_SUM0_SUS256_ULSGRO1_WSGRA0_WSGRB2_WGM1_WGMXCC8_WGMXCCG304
    SolutionIndex: 22
    SolutionNameMin: Cijk_Ailk_Bjlk_BBS_BH_UserArgs_MT128x128x64_MI16x16x1_SN_GSU38_GSUC1_GSUWGMRR1_K1_MIWT4_4_NTD0_NEPBS0_SU8_SUM0_SUS256_ULSGRO0_WSGRA0_WSGRB0_WGM4_WGMXCC8_WGMXCCG0
    SolutionIndex: 23
    SolutionNameMin: Cijk_Ailk_Bjlk_BBS_BH_UserArgs_MT128x128x64_MI16x16x1_SN_LDSB0_GSU38_GSUC0_GSUWGMRR1_K1_MIWT4_4_NTD0_NEPBS0_SU8_SUM0_SUS256_ULSGRO0_WSGRA2_WSGRB0_WGM8_WGMXCC8_WGMXCCG0
    SolutionIndex: 24
    SolutionNameMin: Cijk_Ailk_Bjlk_BBS_BH_UserArgs_MT128x128x64_MI16x16x1_SN_GSU38_GSUC1_GSUWGMRR1_K1_MIWT4_4_NTD0_NEPBS0_SU8_SUM0_SUS256_ULSGRO0_WSGRA0_WGM8_WGMXCC8_WGMXCCG0
    SolutionIndex: 25
    SolutionNameMin: Cijk_Ailk_Bjlk_BBS_BH_UserArgs_MT128x128x64_MI16x16x1_SN_GSU38_GSUC1_GSUWGMRR1_K1_MIWT4_4_NTD0_NEPBS16_SU8_SUM0_SUS256_ULSGRO0_WSGRA0_WSGRB2_WGM8_WGMXCC8_WGMXCCG0
    SolutionIndex: 26
    SolutionNameMin: Cijk_Ailk_Bjlk_BBS_BH_UserArgs_MT128x128x64_MI16x16x1_SN_GSU38_GSUC0_GSUWGMRR1_K1_MIWT4_4_NTD0_NEPBS16_SU8_SUM0_SUS256_ULSGRO1_WSGRA0_WGM4_WGMXCC8_WGMXCCG0
    SolutionIndex: 27
    SolutionNameMin: Cijk_Ailk_Bjlk_BBS_BH_UserArgs_MT128x128x64_MI16x16x1_SN_GSU38_GSUC0_GSUWGMRR1_K1_LPA0_LPB0_MIWT4_4_NTD0_NEPBS0_SU8_SUM0_SUS256_SVW4_ULSGRO1_VWA4_VWB4_WSGRA2_WGM8_WGMXCC8_WGMXCCG304
    SolutionIndex: 28
    SolutionNameMin: Cijk_Ailk_Bjlk_BBS_BH_UserArgs_MT128x256x32_MI16x16x1_SN_GSU19_GSUC0_GSUWGMRR1_K1_MIWT4_8_NTD0_NEPBS16_SU8_SUM0_SUS256_ULSGRO1_WSGRA0_WGM8_WGMXCC8_WGMXCCG0
    SolutionIndex: 29
    SolutionNameMin: Cijk_Ailk_Bjlk_BBS_BH_UserArgs_MT192x256x32_MI16x16x1_SN_GSU38_GSUC1_GSUWGMRR0_K1_LPB0_MIWT6_8_SU8_SUM0_SUS256_VWB8_WGM1_WGMXCC1_WGMXCCG0
    SolutionIndex: 30
    SolutionNameMin: Cijk_Ailk_Bjlk_BBS_BH_UserArgs_MT192x256x32_MI16x16x1_SN_GSU16_GSUC0_GSUWGMRR1_K1_MIWT6_8_SU8_SUM0_SUS256_WGM1_WGMXCC8_WGMXCCG0
    SolutionIndex: 31
    SolutionNameMin: Cijk_Ailk_Bjlk_BBS_BH_UserArgs_MT128x128x64_MI16x16x1_SN_GSU38_GSUC0_GSUWGMRR1_K1_MIWT4_4_NTD4_NEPBS0_SU8_SUM0_SUS256_ULSGRO0_WSGRA0_WGM1_WGMXCC8_WGMXCCG304
    SolutionIndex: 32
    SolutionNameMin: Cijk_Ailk_Bjlk_BBS_BH_UserArgs_MT128x128x64_MI16x16x1_SN_GSU38_GSUC0_GSUWGMRR1_K1_MIWT4_4_NTD4_NEPBS16_SU8_SUM0_SUS256_ULSGRO1_WSGRA2_WGM4_WGMXCC8_WGMXCCG304
    SolutionIndex: 33
    SolutionNameMin: Cijk_Ailk_Bjlk_BBS_BH_UserArgs_MT128x128x64_MI16x16x1_SN_GSU32_GSUC0_GSUWGMRR1_K1_MIWT4_4_NTD4_NEPBS16_SU8_SUM0_SUS256_ULSGRO1_WSGRA2_WSGRB2_WGM4_WGMXCC8_WGMXCCG304
    SolutionIndex: 34
    SolutionNameMin: Cijk_Ailk_Bjlk_BBS_BH_UserArgs_MT128x128x64_MI16x16x1_SN_LDSB1_CLR1_GRVWA8_GRVWB8_GSU1_GSUC0_GSUWGMRR0_K1_LBSPPA1024_LBSPPB1024_LPA0_LPB0_MIWT4_4_NLCA1_NLCB1_PLR1_SU16_SUM0_SUS128_SVW4_VWA4_VWB4_WG32_8_1_WGM8_WGMXCC8_WGMXCCG304
    SolutionIndex: 35
    SolutionNameMin: Cijk_Ailk_Bjlk_BBS_BH_UserArgs_MT128x256x32_MI16x16x1_SN_LDSB1_CLR1_GRVWA8_GRVWB8_GSU1_GSUC0_GSUWGMRR0_K1_LBSPPA1024_LBSPPB2048_LPA0_LPB0_MIWT4_8_NLCA1_NLCB1_PLR1_SU16_SUM0_SUS64_SVW4_VWA4_VWB8_WG32_8_1_WGM8_WGMXCC8_WGMXCCG304
    SolutionIndex: 36
    SolutionNameMin: Cijk_Ailk_Bjlk_BBS_BH_UserArgs_MT256x128x32_MI16x16x1_SN_LDSB1_CLR1_GRVWA8_GRVWB8_GSU1_GSUC0_GSUWGMRR0_K1_LBSPPA2048_LBSPPB1024_LPA0_LPB0_MIWT4_8_NLCA1_NLCB1_PLR1_SU16_SUM0_SUS64_SVW4_VWA4_VWB8_WG64_4_1_WGM8_WGMXCC8_WGMXCCG304
    SolutionIndex: 37
    SolutionNameMin: Cijk_Ailk_Bjlk_BBS_BH_UserArgs_MT256x192x32_MI16x16x1_SN_LDSB0_CLR1_GRVWA8_GRVWB8_GSU1_GSUC0_GSUWGMRR0_K1_LBSPPA2048_LBSPPB1536_LPA0_LPB32_MIWT8_6_NLCA1_NLCB3_PLR1_SU16_SUM0_SUS64_SVW8_VWA8_VWB2_WG32_8_1_WGM8_WGMXCC8_WGMXCCG304
    SolutionIndex: 38
    SolutionNameMin: Cijk_Ailk_Bjlk_BBS_BH_UserArgs_MT64x64x64_MI16x16x1_SN_LDSB1_CLR1_GRVWA8_GRVWB8_GSU1_GSUAMB_GSUC0_GSUWGMRR0_K1_LBSPPA512_LBSPPB512_LPA32_LPB0_MIWT2_4_NTD4_NEPBS16_NLCA1_NLCB1_PLR1_SU16_SUM1_SUS128_SVW2_VWA2_VWB4_WG32_4_2_WGM8_WGMXCC8_WGMXCCG304
    SolutionIndex: 39
    SolutionNameMin: Cijk_Ailk_Bjlk_BBS_BH_UserArgs_MT256x224x32_MI16x16x1_SN_LDSB0_CLR1_GRVWA8_GRVWB4_GSU1_GSUC0_GSUWGMRR0_K1_LBSPPA2048_LBSPPB1792_LPA0_LPB16_MIWT8_7_NLCA1_NLCB7_PLR1_SU8_SUM1_SUS64_SVW8_VWA8_VWB1_WG32_8_1_WGM6_WGMXCC8_WGMXCCG304
    SolutionIndex: 40
    SolutionNameMin: Cijk_Ailk_Bjlk_BBS_BH_UserArgs_MT256x256x32_MI16x16x1_SN_LDSB0_CLR1_GRVWA8_GRVWB8_GSU1_GSUC0_GSUWGMRR0_K1_LBSPPA2048_LBSPPB2048_LPA0_LPB0_MIWT8_8_NLCA1_NLCB1_PLR1_SU8_SUM1_SUS64_SVW8_VWA8_VWB8_WG32_8_1_WGM6_WGMXCC8_WGMXCCG304
    SolutionIndex: 41
    SolutionNameMin: Cijk_Ailk_Bjlk_BBS_BH_UserArgs_MT128x256x32_MI16x16x1_SN_LDSB1_CLR1_GRVWA8_GRVWB8_GSU1_GSUC0_GSUWGMRR0_K1_LBSPPA1024_LBSPPB2048_LPA0_LPB0_MIWT4_8_NLCA1_NLCB1_PLR1_SU8_SUM1_SUS64_SVW4_VWA4_VWB8_WG32_8_1_WGM6_WGMXCC8_WGMXCCG304
    SolutionIndex: 42
    SolutionNameMin: Cijk_Ailk_Bjlk_BBS_BH_UserArgs_MT256x128x32_MI16x16x1_SN_LDSB1_CLR1_GRVWA8_GRVWB8_GSU1_GSUC0_GSUWGMRR0_K1_LBSPPA2048_LBSPPB1024_LPA0_LPB0_MIWT4_8_NLCA1_NLCB1_PLR1_SU8_SUM1_SUS64_SVW4_VWA4_VWB8_WG64_4_1_WGM1_WGMXCC1_WGMXCCG0
    SolutionIndex: 43
    SolutionNameMin: Cijk_Ailk_Bjlk_BBS_BH_UserArgs_MT256x256x32_MI16x16x1_SN_GRVWB8_GSU1_GSUC0_GSUWGMRR0_K1_LBSPPB2048_LPB0_MIWT8_8_NEPBS0_NLCB1_SU8_SUM0_SUS64_SVW8_VWA8_VWB8_WG32_8_1_WGM1_WGMXCC8_WGMXCCGn1
    SolutionIndex: 44
    SolutionNameMin: Cijk_Ailk_Bjlk_BBS_BH_UserArgs_MT256x256x64_MI32x32x1_SN_GSU1_GSUC0_GSUWGMRR0_K1_LBSPPA0_LBSPPB0_LPA0_LPB0_MIWT4_4_NLCA1_NLCB1_SU32_SUM0_SUS256_SVW4_VWA4_VWB4_WG64_4_1_WGM8_WGMXCC1_WGMXCCGn1
    SolutionIndex: 45
    SolutionNameMin: Cijk_Ailk_Bjlk_BBS_BH_UserArgs_MT256x256x64_MI32x32x1_SN_GSU1_GSUC0_GSUWGMRR0_K1_LBSPPA0_LBSPPB0_LPA0_LPB0_MIWT4_4_NLCA1_NLCB1_SU32_SUM0_SUS256_SVW4_VWA4_VWB4_WG64_4_1_WGM32_WGMXCC1_WGMXCCGn1
    SolutionIndex: 46
    SolutionNameMin: Cijk_Ailk_Bjlk_BBS_BH_UserArgs_MT128x256x32_MI16x16x1_SN_GSU1_GSUC0_GSUWGMRR0_K1_MIWT4_8_SU32_SUM0_SUS64_WGM133_WGMXCC8_WGMXCCGn1
    SolutionIndex: 47
    SolutionNameMin: Cijk_Ailk_Bjlk_BBS_BH_UserArgs_MT256x32x64_MI16x16x1_SN_GSU304_GSUC0_GSUWGMRR0_K1_MIWT4_2_SU2_SUM0_SUS128_WGM1_WGMXCC1_WGMXCCGn1
    SolutionIndex: 48
    SolutionNameMin: Cijk_Ailk_Bjlk_BBS_BH_UserArgs_MT128x64x64_MI16x16x1_SN_GSU8_GSUC0_GSUWGMRR0_K1_MIWT4_2_SU4_SUM0_SUS512_WGM76_WGMXCC32_WGMXCCG0
    SolutionIndex: 49
    SolutionNameMin: Cijk_Ailk_Bjlk_BBS_BH_UserArgs_MT64x64x64_MI16x16x1_SN_GSU8_GSUC0_GSUWGMRR1_K1_LBSPPA512_LBSPPB512_LPA32_LPB32_MIWT2_2_SU4_SUM0_SUS128_WG32_8_1_WGM76_WGMXCC16_WGMXCCG0
    SolutionIndex: 50
    SolutionNameMin: Cijk_Ailk_Bjlk_BBS_BH_UserArgs_MT64x128x64_MI16x16x1_SN_GSU8_GSUC0_GSUWGMRR0_K1_MIWT4_2_SU2_SUM2_SUS256_WGM0_WGMXCC8_WGMXCCG0
    SolutionIndex: 51
    SolutionNameMin: Cijk_Ailk_Bjlk_BBS_BH_UserArgs_MT128x128x64_MI16x16x1_SN_GSU8_GSUC0_GSUWGMRR0_K1_MIWT4_4_SU4_SUM0_SUS256_WGM16_WGMXCC4_WGMXCCG32
    SolutionIndex: 52
    SolutionNameMin: Cijk_Ailk_Bjlk_BBS_BH_UserArgs_MT64x128x64_MI16x16x1_SN_GSU8_GSUC0_GSUWGMRR0_K1_MIWT4_2_SU2_SUM2_SUS128_WGM6_WGMXCC1_WGMXCCGn1
    SolutionIndex: 53
    SolutionNameMin: Cijk_Ailk_Bjlk_BBS_BH_UserArgs_MT256x256x32_MI16x16x1_SN_GSU152_GSUC0_GSUWGMRR1_K1_MIWT4_16_SU2_SUM0_SUS64_WGM76_WGMXCC16_WGMXCCGn1
    SolutionIndex: 54
    SolutionNameMin: Cijk_Ailk_Bjlk_BBS_BH_UserArgs_MT192x256x32_MI16x16x1_SN_GSU304_GSUC1_GSUWGMRR0_K1_MIWT6_8_SU32_SUM0_SUS256_WGM1_WGMXCC1_WGMXCCGn1
    SolutionIndex: 55
    SolutionNameMin: Cijk_Ailk_Bjlk_BBS_BH_UserArgs_MT256x16x16_MI16x16x1_SN_GSU1_GSUC0_GSUWGMRR0_K1_MIWT4_1_SU4_SUM3_SUS2048_WGM1_WGMXCC8_WGMXCCG0
    SolutionIndex: 56
    SolutionNameMin: Cijk_Ailk_Bjlk_BBS_BH_UserArgs_MT256x128x32_MI16x16x1_SN_GSU6_GSUC0_GSUWGMRR0_K1_MIWT4_8_SU4_SUM2_SUS512_WGM6_WGMXCC32_WGMXCCG0
    SolutionIndex: 57
    SolutionNameMin: Cijk_Ailk_Bjlk_BBS_BH_UserArgs_MT512x144x32_MI16x16x1_SN_GSU1_GSUC0_GSUWGMRR0_K1_MIWT8_9_SU4_SUM0_SUS128_WGM0_WGMXCC4_WGMXCCGn1
    SolutionIndex: 58
    SolutionNameMin: Cijk_Ailk_Bjlk_BBS_BH_UserArgs_MT128x128x64_MI16x16x1_SN_GSU4_GSUC0_GSUWGMRR0_K1_MIWT4_4_SU4_SUM0_SUS256_WGM0_WGMXCC32_WGMXCCG0
    SolutionIndex: 59
    SolutionNameMin: Cijk_Ailk_Bjlk_BBS_BH_UserArgs_MT128x384x32_MI16x16x1_SN_GSU76_GSUC1_GSUWGMRR0_K1_MIWT8_6_SU0_SUM0_SUS64_WGM16_WGMXCC1_WGMXCCGn1
    SolutionIndex: 60
    SolutionNameMin: Cijk_Ailk_Bjlk_BBS_BH_UserArgs_MT128x256x32_MI16x16x1_SN_GSU1_GSUC0_GSUWGMRR0_K1_MIWT4_8_SU64_SUM1_SUS128_WGM6_WGMXCC8_WGMXCCG0
    SolutionIndex: 61
    SolutionNameMin: Cijk_Ailk_Bjlk_BBS_BH_UserArgs_MT128x128x64_MI16x16x1_SN_GSU8_GSUC1_GSUWGMRR0_K1_MIWT4_4_SU16_SUM0_SUS256_WGM0_WGMXCC2_WGMXCCG32
    SolutionIndex: 62
    SolutionNameMin: Cijk_Ailk_Bjlk_BBS_BH_UserArgs_MT192x128x32_MI16x16x1_SN_GSU4_GSUC1_GSUWGMRR0_K1_MIWT6_4_SU16_SUM0_SUS256_WGM48_WGMXCC32_WGMXCCG0
    SolutionIndex: 63
    SolutionNameMin: Cijk_Ailk_Bjlk_BBS_BH_UserArgs_MT160x256x32_MI16x16x1_SN_GSU1_GSUC0_GSUWGMRR0_K1_MIWT10_4_SU16_SUM0_SUS64_WGM247_WGMXCC8_WGMXCCGn1
    SolutionIndex: 64
    SolutionNameMin: Cijk_Ailk_Bjlk_BBS_BH_UserArgs_MT32x256x16_MI32x32x1_SN_GSU1_GSUC1_GSUWGMRR0_K1_MIWT1_2_SU2_SUM0_SUS32_WGM6_WGMXCC1_WGMXCCGn1
    SolutionIndex: 65
    SolutionNameMin: Cijk_Ailk_Bjlk_BBS_BH_UserArgs_MT128x64x128_MI16x16x1_SN_GSU8_GSUC0_GSUWGMRR0_K1_MIWT4_2_SU16_SUM0_SUS256_WGM1_WGMXCC4_WGMXCCG152
    SolutionIndex: 66
    SolutionNameMin: Cijk_Ailk_Bjlk_BBS_BH_UserArgs_MT16x32x128_MI16x16x1_SN_GSU1_GSUC0_GSUWGMRR1_K1_MIWT1_1_SU4_SUM4_SUS512_WGM0_WGMXCC16_WGMXCCG0
    SolutionIndex: 67
    SolutionNameMin: Cijk_Ailk_Bjlk_BBS_BH_UserArgs_MT128x128x64_MI16x16x1_SN_GSU1_GSUC0_GSUWGMRR0_K1_MIWT4_4_SU8_SUM2_SUS128_WGM6_WGMXCC8_WGMXCCGn1
    SolutionIndex: 68
    SolutionNameMin: Cijk_Ailk_Bjlk_BBS_BH_UserArgs_MT32x32x128_MI16x16x1_SN_GSU8_GSUC0_GSUWGMRR0_K1_LBSPPA256_LBSPPB256_LPA16_LPB16_MIWT1_1_SU32_SUM0_SUS512_WG32_8_1_WGM0_WGMXCC16_WGMXCCG0
    SolutionIndex: 69
    SolutionNameMin: Cijk_Ailk_Bjlk_BBS_BH_UserArgs_MT256x128x32_MI16x16x1_SN_GSU152_GSUC0_GSUWGMRR0_K1_MIWT4_8_SU4_SUM0_SUS64_WGM6_WGMXCC1_WGMXCCGn1
    SolutionIndex: 70
    SolutionNameMin: Cijk_Ailk_Bjlk_BBS_BH_UserArgs_MT256x160x64_MI16x16x1_SN_GSU1_GSUC0_GSUWGMRR0_K1_MIWT4_10_SU4_SUM0_SUS128_WGM8_WGMXCC1_WGMXCCGn1
    SolutionIndex: 71
    SolutionNameMin: Cijk_Ailk_Bjlk_BBS_BH_UserArgs_MT32x256x32_MI16x16x1_SN_GSU1_GSUC0_GSUWGMRR0_K1_MIWT2_4_SU2_SUM4_SUS128_WGM0_WGMXCC1_WGMXCCGn1
    SolutionIndex: 72
    SolutionNameMin: Cijk_Ailk_Bjlk_BBS_BH_UserArgs_MT128x128x64_MI16x16x1_SN_GSU4_GSUC0_GSUWGMRR0_K1_MIWT4_4_SU0_SUM0_SUS128_WGM133_WGMXCC1_WGMXCCGn1
    SolutionIndex: 73
    SolutionNameMin: Cijk_Ailk_Bjlk_BBS_BH_UserArgs_MT256x32x64_MI16x16x1_SN_GSU304_GSUC0_GSUWGMRR0_K1_MIWT8_2_SU0_SUM0_SUS128_WGM0_WGMXCC1_WGMXCCGn1
    SolutionIndex: 74
    SolutionNameMin: Cijk_Ailk_Bjlk_BBS_BH_UserArgs_MT256x256x32_MI16x16x1_SN_GSU76_GSUC0_GSUWGMRR0_K1_MIWT4_16_SU16_SUM0_SUS64_WGM0_WGMXCC8_WGMXCCGn1
    SolutionIndex: 75
    SolutionNameMin: Cijk_Ailk_Bjlk_BBS_BH_UserArgs_MT64x128x64_MI16x16x1_SN_GSU8_GSUC0_GSUWGMRR1_K1_MIWT4_2_SU2_SUM4_SUS256_WGM0_WGMXCC4_WGMXCCG48
    SolutionIndex: 76
    SolutionNameMin: Cijk_Ailk_Bjlk_BBS_BH_UserArgs_MT32x16x128_MI16x16x1_SN_GSU8_GSUC0_GSUWGMRR0_K1_MIWT1_1_SU8_SUM0_SUS256_WGM0_WGMXCC1_WGMXCCG4
    SolutionIndex: 77
    SolutionNameMin: Cijk_Ailk_Bjlk_BBS_BH_UserArgs_MT256x32x64_MI16x16x1_SN_GSU304_GSUC0_GSUWGMRR1_K1_MIWT4_2_SU8_SUM0_SUS128_WGM1_WGMXCC1_WGMXCCGn1
    SolutionIndex: 78
    SolutionNameMin: Cijk_Ailk_Bjlk_BBS_BH_UserArgs_MT256x96x64_MI16x16x1_SN_GSU1_GSUAMBSK_GSUC0_GSUWGMRR1_K1_MIWT4_6_SU16_SUM0_SUS128_SK0_WGM8_WGMXCC8_WGMXCCG304
    SolutionIndex: 79
    SolutionNameMin: Cijk_Ailk_Bjlk_BBS_BH_UserArgs_MT256x96x64_MI16x16x1_SN_GSU1_GSUAMBSK_GSUC0_GSUWGMRR0_K1_MIWT4_6_SU16_SUM0_SUS128_SK0_WGM6_WGMXCC8_WGMXCCG304
    SolutionIndex: 80
    SolutionNameMin: Cijk_Ailk_Bjlk_BBS_BH_UserArgs_MT192x192x32_MI16x16x1_SN_LDSB1_GRVWB8_GSU1_GSUAMB_GSUC1_GSUWGMRR0_K1_LBSPPA1536_LBSPPB1536_LPA32_MIWT6_6_NEPBS16_NLCA3_NLCB3_SU16_SUM0_SUS64_SVW2_SK0_VWA2_WG32_8_1_WGM8_WGMXCC8_WGMXCCG304
- - - [512, 512, 1, 512]
    - [0, 0.0]
  - - [1024, 1024, 1, 1024]
    - [0, 0.0]
  - - [2048, 2048, 1, 2048]
    - [3, 0.0]
  - - [4096, 4096, 1, 4096]
    - [2, 0.0]
  - - [8192, 8192, 1, 8192]
    - [1, 0.0]
  - - [2, 7168, 1, 8192]
    - [7, 0.0]
  - - [2, 3584, 1, 8192]
    - [8, 0.0]
  - - [2, 1280, 1, 8192]
    - [9, 0.0]
  - - [8192, 7168, 1, 8192]
    - [4, 0.0]
  - - [8192, 3584, 1, 8192]
    - [5, 0.0]
  - - [8192, 1280, 1, 8192]
    - [6, 0.0]
  - - [1024, 8192, 1, 32768]
    - [10, 0.0]
  - - [11008, 4096, 1, 2048]
    - [10, 0.0]
  - - [11008, 4096, 1, 65536]
    - [11, 0.0]
  - - [28672, 8192, 1, 32768]
    - [12, 0.0]
  - - [32000, 4096, 1, 65536]
    - [13, 0.0]
  - - [32000, 8192, 1, 32768]
    - [14, 0.0]
  - - [4096, 12288, 1, 2048]
    - [15, 0.0]
  - - [4096, 22016, 1, 2048]
    - [15, 0.0]
  - - [4096, 32000, 1, 2048]
    - [16, 0.0]
  - - [4096, 4096, 1, 2048]
    - [17, 0.0]
  - - [8192, 8192, 1, 32768]
    - [10, 0.0]
  - - [11008, 4096, 1, 49152]
    - [10, 0.0]
  - - [32000, 4096, 1, 49152]
    - [45, 0.0]
  - - [8192, 8192, 1, 57344]
    - [10, 0.0]
  - - [1024, 8192, 1, 57344]
    - [18, 0.0]
  - - [32000, 8192, 1, 57344]
    - [45, 0.0]
  - - [6514, 641, 1, 393216]
    - [19, 0.0]
  - - [256, 384, 1, 180727]
    - [20, 0.0]
  - - [256, 256, 1, 365802]
    - [21, 0.0]
  - - [512, 256, 1, 331051]
    - [22, 0.0]
  - - [512, 256, 1, 395225]
    - [23, 0.0]
  - - [256, 256, 1, 395225]
    - [24, 0.0]
  - - [512, 256, 1, 401179]
    - [25, 0.0]
  - - [512, 256, 1, 365802]
    - [26, 0.0]
  - - [256, 256, 1, 401179]
    - [27, 0.0]
  - - [640, 512, 1, 181557]
    - [28, 0.0]
  - - [1536, 256, 1, 331051]
    - [29, 0.0]
  - - [1536, 512, 1, 331051]
    - [30, 0.0]
  - - [512, 256, 1, 180727]
    - [31, 0.0]
  - - [256, 256, 1, 331051]
    - [32, 0.0]
  - - [256, 384, 1, 181557]
    - [33, 0.0]
  - - [1024, 4096, 1, 2885]
    - [34, 0.0]
  - - [3072, 3072, 1, 1875]
    - [35, 0.0]
  - - [3072, 3072, 1, 757]
    - [36, 0.0]
  - - [4096, 1024, 1, 2885]
    - [34, 0.0]
  - - [4096, 3072, 1, 757]
    - [37, 0.0]
  - - [1024, 1024, 1, 2885]
    - [38, 0.0]
  - - [3072, 16384, 1, 1875]
    - [39, 0.0]
  - - [3072, 32064, 1, 1875]
    - [40, 0.0]
  - - [3072, 9216, 1, 1875]
    - [41, 0.0]
  - - [8192, 3072, 1, 1875]
    - [42, 0.0]
  - - [1600, 50304, 1, 51200]
    - [43, 0.0]
  - - [4096, 32000, 1, 49152]
    - [44, 0.0]
  - - [8192, 32000, 1, 57344]
    - [44, 0.0]
  - - [8192, 32000, 1, 106496]
    - [45, 0.0]
  - - [32000, 8192, 1, 106496]
    - [45, 0.0]
  - - [4440, 2048, 1, 5905]
    - [46, 0.0]
  - - [222, 20, 1, 1511680]
    - [47, 0.0]
  - - [512, 256, 1, 5905]
    - [48, 0.0]
  - - [256, 512, 1, 5905]
    - [49, 0.0]
  - - [1475, 128, 1, 5905]
    - [50, 0.0]
  - - [1024, 202, 1, 5905]
    - [51, 0.0]
  - - [128, 1475, 1, 5905]
    - [52, 0.0]
  - - [512, 256, 1, 795008]
    - [53, 0.0]
  - - [192, 256, 1, 795008]
    - [54, 0.0]
  - - [512, 5905, 1, 8]
    - [55, 0.0]
  - - [1024, 1475, 1, 5905]
    - [56, 0.0]
  - - [4096, 5120, 1, 5905]
    - [57, 0.0]
  - - [1475, 512, 1, 5905]
    - [58, 0.0]
  - - [256, 768, 1, 796032]
    - [59, 0.0]
  - - [4040, 2048, 1, 5905]
    - [60, 0.0]
  - - [1024, 222, 1, 5905]
    - [61, 0.0]
  - - [1475, 1024, 1, 5905]
    - [62, 0.0]
  - - [11715, 1024, 1, 5905]
    - [63, 0.0]
  - - [20, 256, 5905, 222]
    - [64, 0.0]
  - - [512, 512, 1, 5905]
    - [65, 0.0]
  - - [256, 256, 1, 1024]
    - [66, 0.0]
  - - [1475, 2048, 1, 5905]
    - [67, 0.0]
  - - [128, 256, 1, 5905]
    - [68, 0.0]
  - - [256, 256, 1, 795008]
    - [69, 0.0]
  - - [1024, 11715, 1, 5905]
    - [70, 0.0]
  - - [20, 256, 5905, 202]
    - [71, 0.0]
  - - [512, 1024, 1, 5905]
    - [72, 0.0]
  - - [202, 20, 1, 1511680]
    - [73, 0.0]
  - - [1024, 256, 1, 796032]
    - [74, 0.0]
  - - [1024, 256, 1, 5905]
    - [75, 0.0]
  - - [64, 256, 1, 5905]
    - [76, 0.0]
  - - [198, 20, 1, 1511680]
    - [77, 0.0]
  - - [6144, 1024, 1, 5905]
    - [78, 0.0]
  - - [5120, 1024, 1, 5905]
    - [79, 0.0]
  - - [5120, 2048, 1, 5905]
    - [80, 0.0]
- null
- null
- DeviceEfficiency
- Equality
