projects/hipblaslt/library/src/amd_detail/rocblaslt/src/Tensile/Logic/asm_full/aquavanjaram/gfx942/Equality/aquavanjaram_Cijk_Alik_Bljk_BBS_BH_UserArgs.yaml
- {MinimumRequiredVersion: 5.0.0}
- aquavanjaram
- gfx942
- [Device 0049, Device 0050]
    SolutionIndex: 0
    SolutionNameMin: Cijk_Alik_Bljk_BBS_BH_UserArgs_MT256x128x64_MI16x16x1_SN_LDSB1_AFC0_AFEM8_AFEM8_ASEM32_CLR1_CADS0_DTVA0_DTVB0_EPS0_FDSI0_GRPM1_GRVWA8_GRVWB8_GSU1_GSUAMB_GSUC0_GSUWGMRR0_GLS0_ISA942_IU1_LBSPPA1024_LBSPPB128_LBSPPM0_LPA16_LPB16_LPMn1_LRVW8_LWPMn1_MIAV0_MIWT8_4_MO40_NTn1_NTA0_NTB0_NTC0_NTD0_NTM0_NEPBS0_NLCA1_NLCB1_ONLL1_PGR2_PLR1_PKA1_SIA3_SS1_SU8_SUM1_SUS256_SPO0_SRVW0_SSO0_SVW8_SK0_SKXCCM0_TLDS1_ULSGRO0_USL1_UIOFGRO0_USFGROn1_VSn1_VWA8_VWB1_WSGRA0_WSGRB0_WS64_WG32_8_1_WGM40_WGMXCC1_WGMXCCGn1
    SolutionIndex: 1
    SolutionNameMin: Cijk_Alik_Bljk_BBS_BH_UserArgs_MT224x256x64_MI16x16x1_SN_LDSB1_AFC0_AFEM8_AFEM8_ASEM32_CLR1_CADS0_DTVA0_DTVB0_EPS0_FDSI0_GRPM1_GRVWA4_GRVWB4_GSU1_GSUAMB_GSUC0_GSUWGMRR0_GLS0_ISA942_IU1_LBSPPA256_LBSPPB128_LBSPPM0_LPA4_LPB4_LPMn1_LRVW4_LWPMn1_MIAV0_MIWT14_4_MO40_NTn1_NTA0_NTB0_NTC0_NTD0_NTM0_NEPBS0_NLCA1_NLCB1_ONLL1_PGR2_PLR1_PKA1_SIA3_SS1_SU8_SUM1_SUS256_SPO0_SRVW0_SSO0_SVW2_SK0_SKXCCM0_TLDS1_ULSGRO0_USL1_UIOFGRO0_USFGROn1_VSn1_VWA2_VWB1_WSGRA0_WSGRB0_WS64_WG16_16_1_WGM1_WGMXCC1_WGMXCCGn1
    SolutionIndex: 2
    SolutionNameMin: Cijk_Alik_Bljk_BBS_BH_UserArgs_MT224x224x64_MI16x16x1_SN_LDSB1_AFC0_AFEM8_AFEM8_ASEM32_CLR1_CADS0_DTVA0_DTVB0_EPS0_FDSI0_GRPM1_GRVWA4_GRVWB4_GSU1_GSUAMB_GSUC0_GSUWGMRR0_GLS0_ISA942_IU1_LBSPPA128_LBSPPB128_LBSPPM0_LPA4_LPB4_LPMn1_LRVW4_LWPMn1_MIAV0_MIWT7_7_MO40_NTn1_NTA0_NTB0_NTC0_NTD0_NTM0_NEPBS0_NLCA1_NLCB1_ONLL1_PGR2_PLR1_PKA1_SIA3_SS1_SU8_SUM1_SUS256_SPO0_SRVW0_SSO0_SVW1_SK0_SKXCCM0_TLDS1_ULSGRO0_USL1_UIOFGRO0_USFGROn1_VSn1_VWA1_VWB1_WSGRA0_WSGRB0_WS64_WG32_8_1_WGM1_WGMXCC1_WGMXCCGn1
    SolutionIndex: 3
    SolutionNameMin: Cijk_Alik_Bljk_BBS_BH_UserArgs_MT256x192x64_MI16x16x1_SN_LDSB1_AFC0_AFEM8_AFEM8_ASEM32_CLR1_CADS0_DTVA0_DTVB0_EPS0_FDSI0_GRPM1_GRVWA4_GRVWB4_GSU1_GSUAMB_GSUC0_GSUWGMRR0_GLS0_ISA942_IU1_LBSPPA1024_LBSPPB128_LBSPPM0_LPA4_LPB4_LPM0_LRVW4_LWPMn1_MIAV0_MIWT8_6_MO40_NTn1_NTA0_NTB0_NTC0_NTD0_NTM0_NEPBS0_NLCA1_NLCB1_ONLL1_PGR2_PLR1_PKA1_SIA3_SS1_SU8_SUM0_SUS256_SPO0_SRVW0_SSO0_SVW8_SK0_SKXCCM0_TLDS1_ULSGRO0_USL1_UIOFGRO0_USFGROn1_VSn1_VWA8_VWB1_WSGRA0_WSGRB0_WS64_WG32_8_1_WGM40_WGMXCC1_WGMXCCGn1
    SolutionIndex: 4
    SolutionNameMin: Cijk_Alik_Bljk_BBS_BH_UserArgs_MT128x256x64_MI16x16x1_SN_LDSB1_AFC0_AFEM8_AFEM8_ASEM32_CLR1_CADS0_DTVA0_DTVB0_EPS0_FDSI0_GRPM1_GRVWA8_GRVWB8_GSU1_GSUAMB_GSUC0_GSUWGMRR0_GLS0_ISA942_IU1_LBSPPA512_LBSPPB128_LBSPPM0_LPA16_LPB16_LPM0_LRVW8_LWPMn1_MIAV0_MIWT4_8_MO40_NTn1_NTA0_NTB0_NTC0_NTD0_NTM0_NEPBS0_NLCA1_NLCB1_ONLL1_PGR2_PLR1_PKA1_SIA3_SS1_SU8_SUM0_SUS256_SPO0_SRVW0_SSO0_SVW4_SK0_SKXCCM0_TLDS1_ULSGRO0_USL1_UIOFGRO0_USFGROn1_VSn1_VWA4_VWB1_WSGRA0_WSGRB1_WS64_WG32_8_1_WGM40_WGMXCC1_WGMXCCGn1
    SolutionIndex: 5
    SolutionNameMin: Cijk_Alik_Bljk_BBS_BH_UserArgs_MT256x224x64_MI16x16x1_SN_LDSB1_AFC0_AFEM8_AFEM8_ASEM32_CLR1_CADS0_DTVA0_DTVB0_EPS0_FDSI0_GRPM1_GRVWA4_GRVWB4_GSU1_GSUAMB_GSUC0_GSUWGMRR0_GLS0_ISA942_IU1_LBSPPA512_LBSPPB128_LBSPPM0_LPA4_LPB4_LPMn1_LRVW4_LWPMn1_MIAV0_MIWT4_14_MO40_NTn1_NTA0_NTB0_NTC0_NTD0_NTM0_NEPBS0_NLCA1_NLCB1_ONLL1_PGR2_PLR1_PKA1_SIA3_SS1_SU8_SUM1_SUS256_SPO0_SRVW0_SSO0_SVW4_SK0_SKXCCM0_TLDS1_ULSGRO0_USL1_UIOFGRO0_USFGROn1_VSn1_VWA4_VWB1_WSGRA0_WSGRB0_WS64_WG64_4_1_WGM40_WGMXCC1_WGMXCCGn1
    SolutionIndex: 6
    SolutionNameMin: Cijk_Alik_Bljk_BBS_BH_UserArgs_MT16x128x64_MI16x16x1_SN_LDSB1_AFC0_AFEM2_AFEM8_ASEM32_CLR1_CADS0_DTVA0_DTVB0_EPS0_FDSI0_GRPM1_GRVWA2_GRVWB4_GSU10_GSUAMB_GSUC0_GSUWGMRR0_GLS0_ISA942_IU1_LBSPPA128_LBSPPB128_LBSPPM0_LPA4_LPB4_LPM0_LRVW4_LWPMn1_MIAV0_MIWT1_2_MO40_NTn1_NTA0_NTB0_NTC0_NTD1_NTM0_NEPBS0_NLCA1_NLCB1_ONLL1_PGR2_PLR1_PKA1_SIA3_SS1_SU0_SUM1_SUS0_SPO1_SRVW0_SSO0_SVW1_SK0_SKXCCM0_TLDS1_ULSGRO0_USL1_UIOFGRO0_USFGROn1_VSn1_VWA1_VWB1_WSGRA2_WSGRB1_WS64_WG16_16_1_WGM1_WGMXCC1_WGMXCCGn1
    SolutionIndex: 7
    SolutionNameMin: Cijk_Alik_Bljk_BBS_BH_UserArgs_MT16x32x64_MI16x16x1_SN_LDSB0_AFC0_AFEM2_AFEM8_ASEM32_CLR1_CADS0_DTVA0_DTVB0_EPS0_FDSI0_GRPM1_GRVWA2_GRVWB4_GSU8_GSUAMB_GSUC0_GSUWGMRR0_GLS0_ISA942_IU1_LBSPPA128_LBSPPB128_LBSPPM0_LPA4_LPB4_LPM0_LRVW4_LWPMn1_MIAV0_MIWT1_1_MO40_NTn1_NTA0_NTB0_NTC0_NTD1_NTM0_NEPBS0_NLCA1_NLCB1_ONLL1_PGR2_PLR1_PKA1_SIA3_SS1_SU4_SUM0_SUS512_SPO1_SRVW0_SSO0_SVW1_SK0_SKXCCM0_TLDS1_ULSGRO0_USL1_UIOFGRO0_USFGROn1_VSn1_VWA1_VWB1_WSGRA2_WSGRB1_WS64_WG16_8_1_WGM1_WGMXCC1_WGMXCCGn1
    SolutionIndex: 8
    SolutionNameMin: Cijk_Alik_Bljk_BBS_BH_UserArgs_MT16x32x64_MI16x16x1_SN_LDSB0_AFC0_AFEM2_AFEM8_ASEM32_CLR1_CADS0_DTVA0_DTVB0_EPS0_FDSI0_GRPM1_GRVWA2_GRVWB4_GSU15_GSUAMB_GSUC0_GSUWGMRR0_GLS0_ISA942_IU1_LBSPPA128_LBSPPB128_LBSPPM0_LPA4_LPB4_LPM0_LRVW4_LWPMn1_MIAV0_MIWT1_1_MO40_NTn1_NTA0_NTB1_NTC0_NTD1_NTM0_NEPBS0_NLCA1_NLCB1_ONLL1_PGR2_PLR1_PKA1_SIA3_SS1_SU4_SUM0_SUS256_SPO1_SRVW0_SSO0_SVW1_SK0_SKXCCM0_TLDS1_ULSGRO0_USL1_UIOFGRO0_USFGROn1_VSn1_VWA1_VWB1_WSGRA2_WSGRB1_WS64_WG16_8_1_WGM1_WGMXCC1_WGMXCCGn1
    SolutionIndex: 9
    SolutionNameMin: Cijk_Alik_Bljk_BBS_BH_UserArgs_MT224x256x64_MI16x16x1_SN_LDSB1_AFC0_AFEM1_AFEM8_ASEM32_CLR1_CADS0_DTVA0_DTVB0_EPS0_FDSI0_GRPM1_GRVWA4_GRVWB4_GSU1_GSUAMB_GSUC0_GSUWGMRR0_GLS0_ISA942_IU1_LBSPPA256_LBSPPB128_LBSPPM0_LPA4_LPB4_LPMn1_LRVW4_LWPMn1_MIAV0_MIWT14_4_MO40_NTn1_NTA0_NTB0_NTC0_NTD0_NTM0_NEPBS0_NLCA1_NLCB1_ONLL1_PGR2_PLR1_PKA1_SIA3_SS1_SU8_SUM0_SUS128_SPO0_SRVW0_SSO0_SVW2_SK0_SKXCCM0_TLDS1_ULSGRO0_USL1_UIOFGRO0_USFGROn1_VSn1_VWA2_VWB1_WSGRA0_WSGRB0_WS64_WG16_16_1_WGM1_WGMXCC1_WGMXCCGn1
    SolutionIndex: 10
    SolutionNameMin: Cijk_Alik_Bljk_BBS_BH_UserArgs_MT32x16x512_MI16x16x1_SN_LDSB1_AFC0_AFEM1_AFEM8_ASEM32_CLR1_CADS0_DTVA0_DTVB0_EPS0_FDSI0_GRPM1_GRVWA8_GRVWB8_GSU1_GSUAMB_GSUC0_GSUWGMRR0_GLS0_ISA942_IU1_LBSPPA1024_LBSPPB1024_LBSPPM0_LPA16_LPB16_LPMn1_LRVW8_LWPMn1_MIAV0_MIWT1_1_MO40_NTn1_NTA0_NTB0_NTC0_NTD0_NTM0_NEPBS0_NLCA1_NLCB1_ONLL1_PGR2_PLR1_PKA1_SIA3_SS1_SU0_SUM1_SUS0_SPO0_SRVW0_SSO0_SVW1_SK0_SKXCCM0_TLDS1_ULSGRO0_USL1_UIOFGRO0_USFGROn1_VSn1_VWA1_VWB1_WSGRA0_WSGRB0_WS64_WG32_4_1_WGM1_WGMXCC1_WGMXCCGn1
    SolutionIndex: 11
    SolutionNameMin: Cijk_Alik_Bljk_BBS_BH_UserArgs_MT32x16x256_MI16x16x1_SN_LDSB0_AFC0_AFEM1_AFEM8_ASEM32_CLR1_CADS0_DTVA0_DTVB0_EPS0_FDSI0_GRPM1_GRVWA8_GRVWB8_GSU1_GSUAMB_GSUC0_GSUWGMRR0_GLS0_ISA942_IU1_LBSPPA512_LBSPPB512_LBSPPM0_LPA16_LPB16_LPMn1_LRVW8_LWPMn1_MIAV0_MIWT1_1_MO40_NTn1_NTA0_NTB0_NTC0_NTD0_NTM0_NEPBS0_NLCA1_NLCB1_ONLL1_PGR2_PLR1_PKA1_SIA3_SS1_SU0_SUM1_SUS0_SPO0_SRVW0_SSO0_SVW1_SK0_SKXCCM0_TLDS1_ULSGRO0_USL1_UIOFGRO0_USFGROn1_VSn1_VWA1_VWB1_WSGRA0_WSGRB0_WS64_WG32_4_1_WGM1_WGMXCC1_WGMXCCGn1
    SolutionIndex: 12
    SolutionNameMin: Cijk_Alik_Bljk_BBS_BH_UserArgs_MT32x32x128_MI16x16x1_SN_LDSB1_AFC0_AFEM1_AFEM8_ASEM32_CLR1_CADS0_DTVA0_DTVB0_EPS0_FDSI0_GRPM1_GRVWA8_GRVWB8_GSU1_GSUAMB_GSUC0_GSUWGMRR0_GLS0_ISA942_IU1_LBSPPA256_LBSPPB256_LBSPPM0_LPA16_LPB16_LPMn1_LRVW8_LWPMn1_MIAV0_MIWT1_1_MO40_NTn1_NTA0_NTB0_NTC0_NTD0_NTM0_NEPBS0_NLCA1_NLCB1_ONLL1_PGR2_PLR1_PKA1_SIA3_SS1_SU8_SUM0_SUS256_SPO0_SRVW0_SSO0_SVW1_SK0_SKXCCM0_TLDS1_ULSGRO0_USL1_UIOFGRO0_USFGROn1_VSn1_VWA1_VWB1_WSGRA0_WSGRB0_WS64_WG32_8_1_WGM8_WGMXCC1_WGMXCCGn1
    SolutionIndex: 13
    SolutionNameMin: Cijk_Alik_Bljk_BBS_BH_UserArgs_MT64x128x128_MI16x16x1_SN_LDSB1_AFC0_AFEM1_AFEM8_ASEM32_CLR1_CADS0_DTVA0_DTVB0_EPS0_FDSI0_GRPM1_GRVWA8_GRVWB8_GSU1_GSUAMB_GSUC0_GSUWGMRR0_GLS0_ISA942_IU1_LBSPPA512_LBSPPB256_LBSPPM0_LPA16_LPB16_LPMn1_LRVW8_LWPMn1_MIAV0_MIWT2_4_MO40_NTn1_NTA0_NTB0_NTC0_NTD0_NTM0_NEPBS0_NLCA1_NLCB1_ONLL1_PGR2_PLR1_PKA1_SIA3_SS1_SU0_SUM1_SUS0_SPO0_SRVW0_SSO0_SVW2_SK0_SKXCCM0_TLDS1_ULSGRO0_USL1_UIOFGRO0_USFGROn1_VSn1_VWA2_VWB1_WSGRA0_WSGRB0_WS64_WG32_8_1_WGM8_WGMXCC1_WGMXCCGn1
    SolutionIndex: 14
    SolutionNameMin: Cijk_Alik_Bljk_BBS_BH_UserArgs_MT32x96x128_MI16x16x1_SN_LDSB1_AFC0_AFEM1_AFEM8_ASEM32_CLR1_CADS0_DTVA0_DTVB0_EPS0_FDSI0_GRPM1_GRVWA8_GRVWB8_GSU1_GSUAMB_GSUC0_GSUWGMRR0_GLS0_ISA942_IU1_LBSPPA256_LBSPPB256_LBSPPM0_LPA16_LPB16_LPMn1_LRVW8_LWPMn1_MIAV0_MIWT1_3_MO40_NTn1_NTA0_NTB0_NTC0_NTD0_NTM0_NEPBS0_NLCA1_NLCB1_ONLL1_PGR2_PLR1_PKA1_SIA3_SS1_SU8_SUM0_SUS256_SPO0_SRVW0_SSO0_SVW1_SK0_SKXCCM0_TLDS1_ULSGRO0_USL1_UIOFGRO0_USFGROn1_VSn1_VWA1_VWB1_WSGRA0_WSGRB0_WS64_WG32_8_1_WGM8_WGMXCC1_WGMXCCGn1
    SolutionIndex: 15
    SolutionNameMin: Cijk_Alik_Bljk_BBS_BH_UserArgs_MT64x32x128_MI16x16x1_SN_LDSB0_AFC0_AFEM1_AFEM8_ASEM32_CLR1_CADS0_DTVA0_DTVB0_EPS0_FDSI0_GRPM1_GRVWA8_GRVWB8_GSU1_GSUAMB_GSUC0_GSUWGMRR0_GLS0_ISA942_IU1_LBSPPA512_LBSPPB256_LBSPPM0_LPA16_LPB16_LPMn1_LRVW8_LWPMn1_MIAV0_MIWT2_1_MO40_NTn1_NTA0_NTB0_NTC0_NTD0_NTM0_NEPBS0_NLCA1_NLCB1_ONLL1_PGR2_PLR1_PKA1_SIA3_SS0_SU8_SUM0_SUS256_SPO0_SRVW0_SSO0_SVW8_SK0_SKXCCM0_TLDS1_ULSGRO0_USL1_UIOFGRO0_USFGROn1_VSn1_VWA2_VWB1_WSGRA0_WSGRB0_WS64_WG32_8_1_WGM8_WGMXCC1_WGMXCCGn1
    SolutionIndex: 16
    SolutionNameMin: Cijk_Alik_Bljk_BBS_BH_UserArgs_MT32x16x512_MI16x16x1_SN_LDSB1_AFC0_AFEM1_AFEM8_ASEM32_CLR1_CADS0_DTVA0_DTVB0_EPS0_FDSI0_GRPM1_GRVWA8_GRVWB8_GSU1_GSUAMB_GSUC0_GSUWGMRR0_GLS0_ISA942_IU1_LBSPPA1024_LBSPPB1024_LBSPPM0_LPA16_LPB16_LPMn1_LRVW8_LWPMn1_MIAV0_MIWT1_1_MO40_NTn1_NTA0_NTB0_NTC0_NTD0_NTM0_NEPBS0_NLCA1_NLCB1_ONLL1_PGR2_PLR1_PKA1_SIA3_SS0_SU8_SUM0_SUS1024_SPO0_SRVW0_SSO0_SVW4_SK0_SKXCCM0_TLDS1_ULSGRO0_USL1_UIOFGRO0_USFGROn1_VSn1_VWA1_VWB1_WSGRA0_WSGRB0_WS64_WG32_4_1_WGM1_WGMXCC1_WGMXCCGn1
    SolutionIndex: 17
    SolutionNameMin: Cijk_Alik_Bljk_BBS_BH_UserArgs_MT64x32x256_MI16x16x1_SN_LDSB1_AFC0_AFEM1_AFEM8_ASEM32_CLR1_CADS0_DTVA0_DTVB0_EPS0_FDSI0_GRPM1_GRVWA8_GRVWB8_GSU1_GSUAMB_GSUC0_GSUWGMRR0_GLS0_ISA942_IU1_LBSPPA512_LBSPPB512_LBSPPM0_LPA16_LPB16_LPMn1_LRVW8_LWPMn1_MIAV0_MIWT1_2_MO40_NTn1_NTA0_NTB0_NTC0_NTD0_NTM0_NEPBS0_NLCA1_NLCB1_ONLL1_PGR2_PLR1_PKA1_SIA3_SS1_SU0_SUM1_SUS0_SPO0_SRVW0_SSO0_SVW1_SK0_SKXCCM0_TLDS1_ULSGRO0_USL1_UIOFGRO0_USFGROn1_VSn1_VWA1_VWB1_WSGRA0_WSGRB0_WS64_WG64_4_1_WGM8_WGMXCC1_WGMXCCGn1
    SolutionIndex: 18
    SolutionNameMin: Cijk_Alik_Bljk_BBS_BH_UserArgs_MT128x64x128_MI16x16x1_SN_LDSB1_AFC0_AFEM1_AFEM8_ASEM32_CLR1_CADS0_DTVA0_DTVB0_EPS0_FDSI0_GRPM1_GRVWA8_GRVWB8_GSU1_GSUAMB_GSUC0_GSUWGMRR0_GLS0_ISA942_IU1_LBSPPA512_LBSPPB256_LBSPPM0_LPA16_LPB16_LPMn1_LRVW8_LWPMn1_MIAV0_MIWT2_4_MO40_NTn1_NTA0_NTB0_NTC0_NTD0_NTM0_NEPBS0_NLCA1_NLCB1_ONLL1_PGR2_PLR1_PKA1_SIA3_SS1_SU8_SUM0_SUS1024_SPO0_SRVW0_SSO0_SVW2_SK0_SKXCCM0_TLDS1_ULSGRO0_USL1_UIOFGRO0_USFGROn1_VSn1_VWA2_VWB1_WSGRA0_WSGRB0_WS64_WG64_4_1_WGM8_WGMXCC1_WGMXCCGn1
    SolutionIndex: 19
    SolutionNameMin: Cijk_Alik_Bljk_BBS_BH_UserArgs_MT64x64x128_MI16x16x1_SN_LDSB1_AFC0_AFEM8_AFEM8_ASEM32_CLR1_CADS0_DTVA0_DTVB0_EPS0_FDSI0_GRPM1_GRVWA8_GRVWB8_GSU1_GSUAMB_GSUC0_GSUWGMRR0_GLS0_ISA942_IU1_LBSPPA512_LBSPPB256_LBSPPM0_LPA16_LPB16_LPMn1_LRVW8_LWPMn1_MIAV0_MIWT2_2_MO40_NTn1_NTA0_NTB0_NTC0_NTD0_NTM0_NEPBS0_NLCA1_NLCB1_ONLL1_PGR2_PLR1_PKA1_SIA3_SS1_SU8_SUM0_SUS256_SPO0_SRVW0_SSO0_SVW2_SK0_SKXCCM0_TLDS1_ULSGRO0_USL1_UIOFGRO0_USFGROn1_VSn1_VWA2_VWB1_WSGRA0_WSGRB0_WS64_WG32_8_1_WGM1_WGMXCC1_WGMXCCGn1
    SolutionIndex: 20
    SolutionNameMin: Cijk_Alik_Bljk_BBS_BH_UserArgs_MT64x96x128_MI16x16x1_SN_LDSB1_AFC0_AFEM8_AFEM8_ASEM32_CLR1_CADS0_DTVA0_DTVB0_EPS0_FDSI0_GRPM1_GRVWA8_GRVWB8_GSU1_GSUAMB_GSUC0_GSUWGMRR0_GLS0_ISA942_IU1_LBSPPA512_LBSPPB256_LBSPPM0_LPA16_LPB16_LPMn1_LRVW8_LWPMn1_MIAV0_MIWT2_3_MO40_NTn1_NTA0_NTB0_NTC0_NTD0_NTM0_NEPBS0_NLCA1_NLCB1_ONLL1_PGR2_PLR1_PKA1_SIA3_SS1_SU8_SUM0_SUS1024_SPO0_SRVW0_SSO0_SVW2_SK0_SKXCCM0_TLDS1_ULSGRO0_USL1_UIOFGRO0_USFGROn1_VSn1_VWA2_VWB1_WSGRA0_WSGRB0_WS64_WG32_8_1_WGM1_WGMXCC1_WGMXCCGn1
    SolutionIndex: 21
    SolutionNameMin: Cijk_Alik_Bljk_BBS_BH_UserArgs_MT128x192x64_MI16x16x1_SN_LDSB1_AFC0_AFEM8_AFEM8_ASEM32_CLR1_CADS0_DTVA0_DTVB0_EPS0_FDSI0_GRPM1_GRVWA8_GRVWB8_GSU1_GSUAMB_GSUC0_GSUWGMRR0_GLS0_ISA942_IU1_LBSPPA512_LBSPPB128_LBSPPM0_LPA16_LPB16_LPMn1_LRVW8_LWPMn1_MIAV0_MIWT4_6_MO40_NTn1_NTA0_NTB0_NTC0_NTD0_NTM0_NEPBS0_NLCA1_NLCB1_ONLL1_PGR2_PLR1_PKA1_SIA3_SS1_SU8_SUM0_SUS512_SPO0_SRVW0_SSO0_SVW4_SK0_SKXCCM0_TLDS1_ULSGRO0_USL1_UIOFGRO0_USFGROn1_VSn1_VWA4_VWB1_WSGRA0_WSGRB0_WS64_WG32_8_1_WGM1_WGMXCC1_WGMXCCGn1
    SolutionIndex: 22
    SolutionNameMin: Cijk_Alik_Bljk_BBS_BH_UserArgs_MT128x64x128_MI16x16x1_SN_LDSB1_AFC0_AFEM8_AFEM8_ASEM32_CLR1_CADS0_DTVA0_DTVB0_EPS0_FDSI0_GRPM1_GRVWA8_GRVWB8_GSU1_GSUAMB_GSUC0_GSUWGMRR0_GLS0_ISA942_IU1_LBSPPA512_LBSPPB256_LBSPPM0_LPA16_LPB16_LPMn1_LRVW8_LWPMn1_MIAV0_MIWT2_4_MO40_NTn1_NTA0_NTB0_NTC0_NTD0_NTM0_NEPBS0_NLCA1_NLCB1_ONLL1_PGR2_PLR1_PKA1_SIA3_SS0_SU0_SUM1_SUS0_SPO0_SRVW0_SSO0_SVW8_SK0_SKXCCM0_TLDS1_ULSGRO0_USL1_UIOFGRO0_USFGROn1_VSn1_VWA2_VWB1_WSGRA0_WSGRB0_WS64_WG64_4_1_WGM8_WGMXCC1_WGMXCCGn1
    SolutionIndex: 23
    SolutionNameMin: Cijk_Alik_Bljk_BBS_BH_UserArgs_MT32x16x512_MI16x16x1_SN_LDSB1_AFC0_AFEM8_AFEM8_ASEM32_CLR1_CADS0_DTVA0_DTVB0_EPS0_FDSI0_GRPM1_GRVWA8_GRVWB8_GSU1_GSUAMB_GSUC0_GSUWGMRR0_GLS0_ISA942_IU1_LBSPPA1024_LBSPPB1024_LBSPPM0_LPA16_LPB16_LPMn1_LRVW8_LWPMn1_MIAV0_MIWT1_1_MO40_NTn1_NTA0_NTB0_NTC0_NTD0_NTM0_NEPBS0_NLCA1_NLCB1_ONLL1_PGR2_PLR1_PKA1_SIA3_SS1_SU0_SUM1_SUS0_SPO0_SRVW0_SSO0_SVW1_SK0_SKXCCM0_TLDS1_ULSGRO0_USL1_UIOFGRO0_USFGROn1_VSn1_VWA1_VWB1_WSGRA0_WSGRB0_WS64_WG32_4_1_WGM8_WGMXCC1_WGMXCCGn1
    SolutionIndex: 24
    SolutionNameMin: Cijk_Alik_Bljk_BBS_BH_UserArgs_MT32x64x256_MI16x16x1_SN_LDSB1_AFC0_AFEM8_AFEM8_ASEM32_CLR1_CADS0_DTVA0_DTVB0_EPS0_FDSI0_GRPM1_GRVWA8_GRVWB8_GSU1_GSUAMB_GSUC0_GSUWGMRR0_GLS0_ISA942_IU1_LBSPPA1024_LBSPPB512_LBSPPM0_LPA16_LPB16_LPMn1_LRVW8_LWPMn1_MIAV0_MIWT2_1_MO40_NTn1_NTA0_NTB0_NTC0_NTD0_NTM0_NEPBS0_NLCA1_NLCB1_ONLL1_PGR2_PLR1_PKA1_SIA3_SS0_SU0_SUM1_SUS0_SPO0_SRVW0_SSO0_SVW8_SK0_SKXCCM0_TLDS1_ULSGRO0_USL1_UIOFGRO0_USFGROn1_VSn1_VWA2_VWB1_WSGRA0_WSGRB0_WS64_WG16_16_1_WGM8_WGMXCC1_WGMXCCGn1
    SolutionIndex: 25
    SolutionNameMin: Cijk_Alik_Bljk_BBS_BH_UserArgs_MT96x96x128_MI16x16x1_SN_LDSB1_AFC0_AFEM8_AFEM8_ASEM32_CLR1_CADS0_DTVA0_DTVB0_EPS0_FDSI0_GRPM1_GRVWA8_GRVWB8_GSU1_GSUAMB_GSUC0_GSUWGMRR0_GLS0_ISA942_IU1_LBSPPA256_LBSPPB256_LBSPPM0_LPA16_LPB16_LPMn1_LRVW8_LWPMn1_MIAV0_MIWT3_3_MO40_NTn1_NTA0_NTB0_NTC0_NTD0_NTM0_NEPBS0_NLCA1_NLCB1_ONLL1_PGR2_PLR1_PKA1_SIA3_SS1_SU8_SUM0_SUS512_SPO0_SRVW0_SSO0_SVW1_SK0_SKXCCM0_TLDS1_ULSGRO0_USL1_UIOFGRO0_USFGROn1_VSn1_VWA1_VWB1_WSGRA0_WSGRB0_WS64_WG32_8_1_WGM1_WGMXCC1_WGMXCCGn1
    SolutionIndex: 26
    SolutionNameMin: Cijk_Alik_Bljk_BBS_BH_UserArgs_MT256x128x64_MI16x16x1_SN_LDSB1_AFC0_AFEM8_AFEM8_ASEM32_CLR1_CADS0_DTVA0_DTVB0_EPS0_FDSI0_GRPM1_GRVWA8_GRVWB8_GSU1_GSUAMB_GSUC0_GSUWGMRR0_GLS0_ISA942_IU1_LBSPPA512_LBSPPB128_LBSPPM0_LPA16_LPB16_LPMn1_LRVW8_LWPMn1_MIAV0_MIWT4_8_MO40_NTn1_NTA0_NTB0_NTC0_NTD0_NTM0_NEPBS0_NLCA1_NLCB1_ONLL1_PGR2_PLR1_PKA1_SIA3_SS1_SU32_SUM0_SUS128_SPO0_SRVW0_SSO0_SVW4_SK0_SKXCCM0_TLDS1_ULSGRO0_USL1_UIOFGRO0_USFGROn1_VSn1_VWA4_VWB1_WSGRA0_WSGRB0_WS64_WG64_4_1_WGM1_WGMXCC1_WGMXCCGn1
    SolutionIndex: 27
    SolutionNameMin: Cijk_Alik_Bljk_BBS_BH_UserArgs_MT256x192x64_MI16x16x1_SN_LDSB1_AFC0_AFEM8_AFEM8_ASEM32_CLR1_CADS0_DTVA0_DTVB0_EPS0_FDSI0_GRPM1_GRVWA4_GRVWB4_GSU1_GSUAMB_GSUC0_GSUWGMRR0_GLS0_ISA942_IU1_LBSPPA1024_LBSPPB128_LBSPPM0_LPA4_LPB4_LPMn1_LRVW4_LWPMn1_MIAV0_MIWT8_6_MO40_NTn1_NTA0_NTB0_NTC0_NTD0_NTM0_NEPBS0_NLCA1_NLCB1_ONLL1_PGR2_PLR1_PKA1_SIA3_SS1_SU0_SUM1_SUS0_SPO0_SRVW0_SSO0_SVW8_SK0_SKXCCM0_TLDS1_ULSGRO0_USL1_UIOFGRO0_USFGROn1_VSn1_VWA8_VWB1_WSGRA0_WSGRB0_WS64_WG32_8_1_WGM8_WGMXCC1_WGMXCCGn1
    SolutionIndex: 28
    SolutionNameMin: Cijk_Alik_Bljk_BBS_BH_UserArgs_MT128x64x128_MI16x16x1_SN_LDSB1_AFC0_AFEM8_AFEM8_ASEM32_CLR1_CADS0_DTVA0_DTVB0_EPS0_FDSI0_GRPM1_GRVWA8_GRVWB8_GSU1_GSUAMB_GSUC0_GSUWGMRR0_GLS0_ISA942_IU1_LBSPPA512_LBSPPB256_LBSPPM0_LPA16_LPB16_LPMn1_LRVW8_LWPMn1_MIAV0_MIWT2_4_MO40_NTn1_NTA0_NTB0_NTC0_NTD0_NTM0_NEPBS0_NLCA1_NLCB1_ONLL1_PGR2_PLR1_PKA1_SIA3_SS0_SU8_SUM0_SUS512_SPO0_SRVW0_SSO0_SVW8_SK0_SKXCCM0_TLDS1_ULSGRO0_USL1_UIOFGRO0_USFGROn1_VSn1_VWA2_VWB1_WSGRA0_WSGRB0_WS64_WG64_4_1_WGM8_WGMXCC1_WGMXCCGn1
    SolutionIndex: 29
    SolutionNameMin: Cijk_Alik_Bljk_BBS_BH_UserArgs_MT128x192x64_MI16x16x1_SN_LDSB1_AFC0_AFEM8_AFEM8_ASEM32_CLR1_CADS0_DTVA0_DTVB0_EPS0_FDSI0_GRPM1_GRVWA8_GRVWB8_GSU1_GSUAMB_GSUC0_GSUWGMRR0_GLS0_ISA942_IU1_LBSPPA512_LBSPPB128_LBSPPM0_LPA16_LPB16_LPMn1_LRVW8_LWPMn1_MIAV0_MIWT4_6_MO40_NTn1_NTA0_NTB0_NTC0_NTD0_NTM0_NEPBS0_NLCA1_NLCB1_ONLL1_PGR2_PLR1_PKA1_SIA3_SS1_SU32_SUM0_SUS1024_SPO0_SRVW0_SSO0_SVW4_SK0_SKXCCM0_TLDS1_ULSGRO0_USL1_UIOFGRO0_USFGROn1_VSn1_VWA4_VWB1_WSGRA0_WSGRB0_WS64_WG32_8_1_WGM8_WGMXCC1_WGMXCCGn1
    SolutionIndex: 30
    SolutionNameMin: Cijk_Alik_Bljk_BBS_BH_UserArgs_MT192x256x64_MI16x16x1_SN_LDSB1_AFC0_AFEM8_AFEM8_ASEM32_CLR1_CADS0_DTVA0_DTVB0_EPS0_FDSI0_GRPM1_GRVWA4_GRVWB4_GSU1_GSUAMB_GSUC0_GSUWGMRR0_GLS0_ISA942_IU1_LBSPPA256_LBSPPB128_LBSPPM0_LPA4_LPB4_LPMn1_LRVW4_LWPMn1_MIAV0_MIWT6_8_MO40_NTn1_NTA0_NTB0_NTC0_NTD0_NTM0_NEPBS0_NLCA1_NLCB1_ONLL1_PGR2_PLR1_PKA1_SIA3_SS0_SU8_SUM0_SUS512_SPO0_SRVW0_SSO0_SVW8_SK0_SKXCCM0_TLDS1_ULSGRO0_USL1_UIOFGRO0_USFGROn1_VSn1_VWA2_VWB1_WSGRA0_WSGRB0_WS64_WG32_8_1_WGM1_WGMXCC1_WGMXCCGn1
    SolutionIndex: 31
    SolutionNameMin: Cijk_Alik_Bljk_BBS_BH_UserArgs_MT192x256x64_MI16x16x1_SN_LDSB1_AFC0_AFEM8_AFEM8_ASEM32_CLR1_CADS0_DTVA0_DTVB0_EPS0_FDSI0_GRPM1_GRVWA4_GRVWB4_GSU1_GSUAMB_GSUC0_GSUWGMRR0_GLS0_ISA942_IU1_LBSPPA256_LBSPPB128_LBSPPM0_LPA4_LPB4_LPMn1_LRVW4_LWPMn1_MIAV0_MIWT6_8_MO40_NTn1_NTA0_NTB0_NTC0_NTD0_NTM0_NEPBS0_NLCA1_NLCB1_ONLL1_PGR2_PLR1_PKA1_SIA3_SS0_SU8_SUM0_SUS1024_SPO0_SRVW0_SSO0_SVW8_SK0_SKXCCM0_TLDS1_ULSGRO0_USL1_UIOFGRO0_USFGROn1_VSn1_VWA2_VWB1_WSGRA0_WSGRB0_WS64_WG32_8_1_WGM1_WGMXCC1_WGMXCCGn1
    SolutionIndex: 32
    SolutionNameMin: Cijk_Alik_Bljk_BBS_BH_UserArgs_MT192x288x64_MI16x16x1_SN_LDSB1_AFC0_AFEM8_AFEM8_ASEM32_CLR1_CADS0_DTVA0_DTVB0_EPS0_FDSI0_GRPM1_GRVWA4_GRVWB4_GSU1_GSUAMB_GSUC0_GSUWGMRR0_GLS0_ISA942_IU1_LBSPPA256_LBSPPB128_LBSPPM0_LPA4_LPB4_LPMn1_LRVW4_LWPMn1_MIAV0_MIWT6_9_MO40_NTn1_NTA0_NTB0_NTC0_NTD0_NTM0_NEPBS0_NLCA1_NLCB1_ONLL1_PGR2_PLR1_PKA1_SIA3_SS0_SU8_SUM0_SUS1024_SPO0_SRVW0_SSO0_SVW8_SK0_SKXCCM0_TLDS1_ULSGRO0_USL1_UIOFGRO0_USFGROn1_VSn1_VWA2_VWB1_WSGRA0_WSGRB0_WS64_WG32_8_1_WGM8_WGMXCC1_WGMXCCGn1
    SolutionIndex: 33
    SolutionNameMin: Cijk_Alik_Bljk_BBS_BH_UserArgs_MT256x224x64_MI16x16x1_SN_LDSB1_AFC0_AFEM8_AFEM8_ASEM32_CLR1_CADS0_DTVA0_DTVB0_EPS0_FDSI0_GRPM1_GRVWA4_GRVWB4_GSU1_GSUAMB_GSUC0_GSUWGMRR0_GLS0_ISA942_IU1_LBSPPA1024_LBSPPB128_LBSPPM0_LPA4_LPB4_LPMn1_LRVW4_LWPMn1_MIAV0_MIWT8_7_MO40_NTn1_NTA0_NTB0_NTC0_NTD0_NTM0_NEPBS0_NLCA1_NLCB1_ONLL1_PGR2_PLR1_PKA1_SIA3_SS1_SU8_SUM0_SUS1024_SPO0_SRVW0_SSO0_SVW8_SK0_SKXCCM0_TLDS1_ULSGRO0_USL1_UIOFGRO0_USFGROn1_VSn1_VWA8_VWB1_WSGRA0_WSGRB0_WS64_WG32_8_1_WGM1_WGMXCC1_WGMXCCGn1
    SolutionIndex: 34
    SolutionNameMin: Cijk_Alik_Bljk_BBS_BH_UserArgs_MT208x192x64_MI16x16x1_SN_LDSB1_AFC0_AFEM8_AFEM8_ASEM32_CLR1_CADS0_DTVA0_DTVB0_EPS0_FDSI0_GRPM1_GRVWA4_GRVWB8_GSU1_GSUAMB_GSUC0_GSUWGMRR0_GLS0_ISA942_IU1_LBSPPA128_LBSPPB128_LBSPPM0_LPA16_LPB16_LPMn1_LRVW8_LWPMn1_MIAV0_MIWT13_3_MO40_NTn1_NTA0_NTB0_NTC0_NTD0_NTM0_NEPBS0_NLCA1_NLCB1_ONLL1_PGR2_PLR1_PKA1_SIA3_SS0_SU8_SUM0_SUS1024_SPO0_SRVW0_SSO0_SVW4_SK0_SKXCCM0_TLDS1_ULSGRO0_USL1_UIOFGRO0_USFGROn1_VSn1_VWA1_VWB1_WSGRA0_WSGRB0_WS64_WG16_16_1_WGM1_WGMXCC1_WGMXCCGn1
    SolutionIndex: 35
    SolutionNameMin: Cijk_Alik_Bljk_BBS_BH_UserArgs_MT288x192x64_MI16x16x1_SN_LDSB1_AFC0_AFEM8_AFEM8_ASEM32_CLR1_CADS0_DTVA0_DTVB0_EPS0_FDSI0_GRPM1_GRVWA4_GRVWB4_GSU1_GSUAMB_GSUC0_GSUWGMRR0_GLS0_ISA942_IU1_LBSPPA128_LBSPPB128_LBSPPM0_LPA4_LPB4_LPMn1_LRVW4_LWPMn1_MIAV0_MIWT9_6_MO40_NTn1_NTA0_NTB0_NTC0_NTD0_NTM0_NEPBS0_NLCA1_NLCB1_ONLL1_PGR2_PLR1_PKA1_SIA3_SS1_SU8_SUM0_SUS128_SPO0_SRVW0_SSO0_SVW1_SK0_SKXCCM0_TLDS1_ULSGRO0_USL1_UIOFGRO0_USFGROn1_VSn1_VWA1_VWB1_WSGRA0_WSGRB0_WS64_WG32_8_1_WGM8_WGMXCC1_WGMXCCGn1
    SolutionIndex: 36
    SolutionNameMin: Cijk_Alik_Bljk_BBS_BH_UserArgs_MT192x256x64_MI16x16x1_SN_LDSB1_AFC0_AFEM8_AFEM8_ASEM32_CLR1_CADS0_DTVA0_DTVB0_EPS0_FDSI0_GRPM1_GRVWA4_GRVWB4_GSU1_GSUAMB_GSUC0_GSUWGMRR0_GLS0_ISA942_IU1_LBSPPA256_LBSPPB128_LBSPPM0_LPA4_LPB4_LPMn1_LRVW4_LWPMn1_MIAV0_MIWT6_8_MO40_NTn1_NTA0_NTB0_NTC0_NTD0_NTM0_NEPBS0_NLCA1_NLCB1_ONLL1_PGR2_PLR1_PKA1_SIA3_SS1_SU32_SUM0_SUS128_SPO0_SRVW0_SSO0_SVW2_SK0_SKXCCM0_TLDS1_ULSGRO0_USL1_UIOFGRO0_USFGROn1_VSn1_VWA2_VWB1_WSGRA0_WSGRB0_WS64_WG32_8_1_WGM1_WGMXCC1_WGMXCCGn1
    SolutionIndex: 37
    SolutionNameMin: Cijk_Alik_Bljk_BBS_BH_UserArgs_MT64x128x128_MI16x16x1_SN_LDSB1_AFC0_AFEM8_AFEM8_ASEM32_CLR1_CADS0_DTVA0_DTVB0_EPS0_FDSI0_GRPM1_GRVWA8_GRVWB8_GSU1_GSUAMB_GSUC0_GSUWGMRR0_GLS0_ISA942_IU1_LBSPPA1024_LBSPPB256_LBSPPM0_LPA16_LPB16_LPMn1_LRVW8_LWPMn1_MIAV0_MIWT4_2_MO40_NTn1_NTA0_NTB0_NTC0_NTD0_NTM0_NEPBS0_NLCA1_NLCB1_ONLL1_PGR2_PLR1_PKA1_SIA3_SS1_SU8_SUM0_SUS256_SPO0_SRVW0_SSO0_SVW4_SK0_SKXCCM0_TLDS1_ULSGRO0_USL1_UIOFGRO0_USFGROn1_VSn1_VWA4_VWB1_WSGRA0_WSGRB0_WS64_WG16_16_1_WGM1_WGMXCC1_WGMXCCGn1
    SolutionIndex: 38
    SolutionNameMin: Cijk_Alik_Bljk_BBS_BH_UserArgs_MT256x224x64_MI16x16x1_SN_LDSB1_AFC0_AFEM8_AFEM8_ASEM32_CLR1_CADS0_DTVA0_DTVB0_EPS0_FDSI0_GRPM1_GRVWA4_GRVWB4_GSU1_GSUAMB_GSUC0_GSUWGMRR0_GLS0_ISA942_IU1_LBSPPA1024_LBSPPB128_LBSPPM0_LPA4_LPB4_LPMn1_LRVW4_LWPMn1_MIAV0_MIWT8_7_MO40_NTn1_NTA0_NTB0_NTC0_NTD0_NTM0_NEPBS0_NLCA1_NLCB1_ONLL1_PGR2_PLR1_PKA1_SIA3_SS1_SU8_SUM0_SUS512_SPO0_SRVW0_SSO0_SVW8_SK0_SKXCCM0_TLDS1_ULSGRO0_USL1_UIOFGRO0_USFGROn1_VSn1_VWA8_VWB1_WSGRA0_WSGRB0_WS64_WG32_8_1_WGM1_WGMXCC1_WGMXCCGn1
    SolutionIndex: 39
    SolutionNameMin: Cijk_Alik_Bljk_BBS_BH_UserArgs_MT64x128x128_MI16x16x1_SN_LDSB1_AFC0_AFEM8_AFEM8_ASEM32_CLR1_CADS0_DTVA0_DTVB0_EPS0_FDSI0_GRPM1_GRVWA8_GRVWB8_GSU1_GSUAMB_GSUC0_GSUWGMRR0_GLS0_ISA942_IU1_LBSPPA512_LBSPPB256_LBSPPM0_LPA16_LPB16_LPMn1_LRVW8_LWPMn1_MIAV0_MIWT2_4_MO40_NTn1_NTA0_NTB0_NTC0_NTD0_NTM0_NEPBS0_NLCA1_NLCB1_ONLL1_PGR2_PLR1_PKA1_SIA3_SS1_SU8_SUM0_SUS256_SPO0_SRVW0_SSO0_SVW2_SK0_SKXCCM0_TLDS1_ULSGRO0_USL1_UIOFGRO0_USFGROn1_VSn1_VWA2_VWB1_WSGRA0_WSGRB0_WS64_WG32_8_1_WGM1_WGMXCC1_WGMXCCGn1
    SolutionIndex: 40
    SolutionNameMin: Cijk_Alik_Bljk_BBS_BH_UserArgs_MT128x96x64_MI16x16x1_SN_LDSB1_AFC0_AFEM8_AFEM8_ASEM32_CLR1_CADS0_DTVA0_DTVB0_EPS0_FDSI0_GRPM1_GRVWA8_GRVWB8_GSU1_GSUAMB_GSUC0_GSUWGMRR0_GLS0_ISA942_IU1_LBSPPA256_LBSPPB128_LBSPPM0_LPA16_LPB16_LPMn1_LRVW8_LWPMn1_MIAV0_MIWT2_6_MO40_NTn1_NTA0_NTB0_NTC0_NTD0_NTM0_NEPBS0_NLCA1_NLCB1_ONLL1_PGR2_PLR1_PKA1_SIA3_SS0_SU8_SUM0_SUS1024_SPO0_SRVW0_SSO0_SVW8_SK0_SKXCCM0_TLDS1_ULSGRO0_USL1_UIOFGRO0_USFGROn1_VSn1_VWA2_VWB1_WSGRA0_WSGRB0_WS64_WG64_4_1_WGM8_WGMXCC1_WGMXCCGn1
    SolutionIndex: 41
    SolutionNameMin: Cijk_Alik_Bljk_BBS_BH_UserArgs_MT128x224x64_MI16x16x1_SN_LDSB1_AFC0_AFEM8_AFEM8_ASEM32_CLR1_CADS0_DTVA0_DTVB0_EPS0_FDSI0_GRPM1_GRVWA8_GRVWB8_GSU1_GSUAMB_GSUC0_GSUWGMRR0_GLS0_ISA942_IU1_LBSPPA512_LBSPPB128_LBSPPM0_LPA16_LPB16_LPMn1_LRVW8_LWPMn1_MIAV0_MIWT4_7_MO40_NTn1_NTA0_NTB0_NTC0_NTD0_NTM0_NEPBS0_NLCA1_NLCB1_ONLL1_PGR2_PLR1_PKA1_SIA3_SS1_SU32_SUM0_SUS512_SPO0_SRVW0_SSO0_SVW4_SK0_SKXCCM0_TLDS1_ULSGRO0_USL1_UIOFGRO0_USFGROn1_VSn1_VWA4_VWB1_WSGRA0_WSGRB0_WS64_WG32_8_1_WGM1_WGMXCC1_WGMXCCGn1
    SolutionIndex: 42
    SolutionNameMin: Cijk_Alik_Bljk_BBS_BH_UserArgs_MT64x16x256_MI16x16x1_SN_LDSB1_AFC0_AFEM8_AFEM8_ASEM32_CLR1_CADS0_DTVA0_DTVB0_EPS0_FDSI0_GRPM1_GRVWA8_GRVWB8_GSU1_GSUAMB_GSUC0_GSUWGMRR0_GLS0_ISA942_IU1_LBSPPA512_LBSPPB512_LBSPPM0_LPA16_LPB16_LPMn1_LRVW8_LWPMn1_MIAV0_MIWT1_1_MO40_NTn1_NTA0_NTB0_NTC0_NTD0_NTM0_NEPBS0_NLCA1_NLCB1_ONLL1_PGR2_PLR1_PKA1_SIA3_SS1_SU0_SUM1_SUS0_SPO0_SRVW0_SSO0_SVW1_SK0_SKXCCM0_TLDS1_ULSGRO0_USL1_UIOFGRO0_USFGROn1_VSn1_VWA1_VWB1_WSGRA0_WSGRB0_WS64_WG64_4_1_WGM1_WGMXCC1_WGMXCCGn1
    SolutionIndex: 43
    SolutionNameMin: Cijk_Alik_Bljk_BBS_BH_UserArgs_MT64x64x128_MI16x16x1_SN_LDSB1_AFC0_AFEM8_AFEM8_ASEM32_CLR1_CADS0_DTVA0_DTVB0_EPS0_FDSI0_GRPM1_GRVWA8_GRVWB8_GSU1_GSUAMB_GSUC0_GSUWGMRR0_GLS0_ISA942_IU1_LBSPPA512_LBSPPB256_LBSPPM0_LPA16_LPB16_LPMn1_LRVW8_LWPMn1_MIAV0_MIWT2_2_MO40_NTn1_NTA0_NTB0_NTC0_NTD0_NTM0_NEPBS0_NLCA1_NLCB1_ONLL1_PGR2_PLR1_PKA1_SIA3_SS1_SU32_SUM0_SUS512_SPO0_SRVW0_SSO0_SVW2_SK0_SKXCCM0_TLDS1_ULSGRO0_USL1_UIOFGRO0_USFGROn1_VSn1_VWA2_VWB1_WSGRA0_WSGRB0_WS64_WG32_8_1_WGM1_WGMXCC1_WGMXCCGn1
    SolutionIndex: 44
    SolutionNameMin: Cijk_Alik_Bljk_BBS_BH_UserArgs_MT64x64x128_MI16x16x1_SN_LDSB1_AFC0_AFEM8_AFEM8_ASEM32_CLR1_CADS0_DTVA0_DTVB0_EPS0_FDSI0_GRPM1_GRVWA8_GRVWB8_GSU1_GSUAMB_GSUC0_GSUWGMRR0_GLS0_ISA942_IU1_LBSPPA512_LBSPPB256_LBSPPM0_LPA16_LPB16_LPMn1_LRVW8_LWPMn1_MIAV0_MIWT2_2_MO40_NTn1_NTA0_NTB0_NTC0_NTD0_NTM0_NEPBS0_NLCA1_NLCB1_ONLL1_PGR2_PLR1_PKA1_SIA3_SS0_SU8_SUM0_SUS1024_SPO0_SRVW0_SSO0_SVW8_SK0_SKXCCM0_TLDS1_ULSGRO0_USL1_UIOFGRO0_USFGROn1_VSn1_VWA2_VWB1_WSGRA0_WSGRB0_WS64_WG32_8_1_WGM1_WGMXCC1_WGMXCCGn1
    SolutionIndex: 45
    SolutionNameMin: Cijk_Alik_Bljk_BBS_BH_UserArgs_MT128x128x64_MI16x16x1_SN_LDSB1_AFC0_AFEM8_AFEM8_ASEM32_CLR1_CADS0_DTVA0_DTVB0_EPS0_FDSI0_GRPM1_GRVWA8_GRVWB8_GSU1_GSUAMB_GSUC0_GSUWGMRR0_GLS0_ISA942_IU1_LBSPPA512_LBSPPB128_LBSPPM0_LPA16_LPB16_LPMn1_LRVW8_LWPMn1_MIAV0_MIWT4_4_MO40_NTn1_NTA0_NTB0_NTC0_NTD0_NTM0_NEPBS0_NLCA1_NLCB1_ONLL1_PGR2_PLR1_PKA1_SIA3_SS1_SU8_SUM0_SUS256_SPO0_SRVW0_SSO0_SVW4_SK0_SKXCCM0_TLDS1_ULSGRO0_USL1_UIOFGRO0_USFGROn1_VSn1_VWA4_VWB1_WSGRA0_WSGRB0_WS64_WG32_8_1_WGM8_WGMXCC1_WGMXCCGn1
    SolutionIndex: 46
    SolutionNameMin: Cijk_Alik_Bljk_BBS_BH_UserArgs_MT256x224x64_MI16x16x1_SN_LDSB1_AFC0_AFEM8_AFEM8_ASEM32_CLR1_CADS0_DTVA0_DTVB0_EPS0_FDSI0_GRPM1_GRVWA4_GRVWB4_GSU1_GSUAMB_GSUC0_GSUWGMRR0_GLS0_ISA942_IU1_LBSPPA1024_LBSPPB128_LBSPPM0_LPA4_LPB4_LPMn1_LRVW4_LWPMn1_MIAV0_MIWT8_7_MO40_NTn1_NTA0_NTB0_NTC0_NTD0_NTM0_NEPBS0_NLCA1_NLCB1_ONLL1_PGR2_PLR1_PKA1_SIA3_SS1_SU32_SUM0_SUS128_SPO0_SRVW0_SSO0_SVW8_SK0_SKXCCM0_TLDS1_ULSGRO0_USL1_UIOFGRO0_USFGROn1_VSn1_VWA8_VWB1_WSGRA0_WSGRB0_WS64_WG32_8_1_WGM8_WGMXCC1_WGMXCCGn1
    SolutionIndex: 47
    SolutionNameMin: Cijk_Alik_Bljk_BBS_BH_UserArgs_MT128x96x64_MI16x16x1_SN_LDSB0_AFC0_AFEM8_AFEM8_ASEM32_CLR1_CADS0_DTVA0_DTVB0_EPS0_FDSI0_GRPM1_GRVWA8_GRVWB8_GSU1_GSUAMB_GSUC0_GSUWGMRR0_GLS0_ISA942_IU1_LBSPPA512_LBSPPB128_LBSPPM0_LPA16_LPB16_LPMn1_LRVW8_LWPMn1_MIAV0_MIWT4_3_MO40_NTn1_NTA0_NTB0_NTC0_NTD0_NTM0_NEPBS0_NLCA1_NLCB1_ONLL1_PGR2_PLR1_PKA1_SIA3_SS1_SU32_SUM0_SUS1024_SPO0_SRVW0_SSO0_SVW4_SK0_SKXCCM0_TLDS1_ULSGRO0_USL1_UIOFGRO0_USFGROn1_VSn1_VWA4_VWB1_WSGRA0_WSGRB0_WS64_WG32_8_1_WGM1_WGMXCC1_WGMXCCGn1
    SolutionIndex: 48
    SolutionNameMin: Cijk_Alik_Bljk_BBS_BH_UserArgs_MT128x96x64_MI16x16x1_SN_LDSB0_AFC0_AFEM8_AFEM8_ASEM32_CLR1_CADS0_DTVA0_DTVB0_EPS0_FDSI0_GRPM1_GRVWA8_GRVWB8_GSU1_GSUAMB_GSUC0_GSUWGMRR0_GLS0_ISA942_IU1_LBSPPA512_LBSPPB128_LBSPPM0_LPA16_LPB16_LPMn1_LRVW8_LWPMn1_MIAV0_MIWT4_3_MO40_NTn1_NTA0_NTB0_NTC0_NTD0_NTM0_NEPBS0_NLCA1_NLCB1_ONLL1_PGR2_PLR1_PKA1_SIA3_SS1_SU8_SUM0_SUS256_SPO0_SRVW0_SSO0_SVW4_SK0_SKXCCM0_TLDS1_ULSGRO0_USL1_UIOFGRO0_USFGROn1_VSn1_VWA4_VWB1_WSGRA0_WSGRB0_WS64_WG32_8_1_WGM8_WGMXCC1_WGMXCCGn1
    SolutionIndex: 49
    SolutionNameMin: Cijk_Alik_Bljk_BBS_BH_UserArgs_MT192x160x64_MI16x16x1_SN_LDSB1_AFC0_AFEM8_AFEM8_ASEM32_CLR1_CADS0_DTVA0_DTVB0_EPS0_FDSI0_GRPM1_GRVWA8_GRVWB8_GSU1_GSUAMB_GSUC0_GSUWGMRR0_GLS0_ISA942_IU1_LBSPPA256_LBSPPB128_LBSPPM0_LPA16_LPB16_LPMn1_LRVW8_LWPMn1_MIAV0_MIWT6_5_MO40_NTn1_NTA0_NTB0_NTC0_NTD0_NTM0_NEPBS0_NLCA1_NLCB1_ONLL1_PGR2_PLR1_PKA1_SIA3_SS1_SU8_SUM0_SUS256_SPO0_SRVW0_SSO0_SVW2_SK0_SKXCCM0_TLDS1_ULSGRO0_USL1_UIOFGRO0_USFGROn1_VSn1_VWA2_VWB1_WSGRA0_WSGRB0_WS64_WG32_8_1_WGM1_WGMXCC1_WGMXCCGn1
    SolutionIndex: 50
    SolutionNameMin: Cijk_Alik_Bljk_BBS_BH_UserArgs_MT64x32x256_MI16x16x1_SN_LDSB1_AFC0_AFEM8_AFEM8_ASEM32_CLR1_CADS0_DTVA0_DTVB0_EPS0_FDSI0_GRPM1_GRVWA8_GRVWB8_GSU1_GSUAMB_GSUC0_GSUWGMRR0_GLS0_ISA942_IU1_LBSPPA1024_LBSPPB512_LBSPPM0_LPA16_LPB16_LPMn1_LRVW8_LWPMn1_MIAV0_MIWT2_1_MO40_NTn1_NTA0_NTB0_NTC0_NTD0_NTM0_NEPBS0_NLCA1_NLCB1_ONLL1_PGR2_PLR1_PKA1_SIA3_SS1_SU0_SUM1_SUS0_SPO0_SRVW0_SSO0_SVW2_SK0_SKXCCM0_TLDS1_ULSGRO0_USL1_UIOFGRO0_USFGROn1_VSn1_VWA2_VWB1_WSGRA0_WSGRB0_WS64_WG32_8_1_WGM1_WGMXCC1_WGMXCCGn1
    SolutionIndex: 51
    SolutionNameMin: Cijk_Alik_Bljk_BBS_BH_UserArgs_MT64x16x128_MI16x16x1_SN_LDSB0_AFC0_AFEM8_AFEM8_ASEM32_CLR1_CADS0_DTVA0_DTVB0_EPS0_FDSI0_GRPM1_GRVWA8_GRVWB8_GSU1_GSUAMB_GSUC0_GSUWGMRR0_GLS0_ISA942_IU1_LBSPPA256_LBSPPB256_LBSPPM0_LPA16_LPB16_LPMn1_LRVW8_LWPMn1_MIAV0_MIWT1_1_MO40_NTn1_NTA0_NTB0_NTC0_NTD0_NTM0_NEPBS0_NLCA1_NLCB1_ONLL1_PGR2_PLR1_PKA1_SIA3_SS0_SU8_SUM0_SUS1024_SPO0_SRVW0_SSO0_SVW4_SK0_SKXCCM0_TLDS1_ULSGRO0_USL1_UIOFGRO0_USFGROn1_VSn1_VWA1_VWB1_WSGRA0_WSGRB0_WS64_WG64_4_1_WGM1_WGMXCC1_WGMXCCGn1
    SolutionIndex: 52
    SolutionNameMin: Cijk_Alik_Bljk_BBS_BH_UserArgs_MT224x256x64_MI16x16x1_SN_LDSB1_AFC0_AFEM8_AFEM8_ASEM32_CLR1_CADS0_DTVA0_DTVB0_EPS0_FDSI0_GRPM1_GRVWA4_GRVWB4_GSU1_GSUAMB_GSUC0_GSUWGMRR0_GLS0_ISA942_IU1_LBSPPA128_LBSPPB128_LBSPPM0_LPA4_LPB4_LPMn1_LRVW4_LWPMn1_MIAV0_MIWT7_8_MO40_NTn1_NTA0_NTB0_NTC0_NTD0_NTM0_NEPBS0_NLCA1_NLCB1_ONLL1_PGR2_PLR1_PKA1_SIA3_SS1_SU8_SUM0_SUS512_SPO0_SRVW0_SSO0_SVW1_SK0_SKXCCM0_TLDS1_ULSGRO0_USL1_UIOFGRO0_USFGROn1_VSn1_VWA1_VWB1_WSGRA0_WSGRB0_WS64_WG32_8_1_WGM8_WGMXCC1_WGMXCCGn1
    SolutionIndex: 53
    SolutionNameMin: Cijk_Alik_Bljk_BBS_BH_UserArgs_MT128x128x64_MI16x16x1_SN_LDSB1_AFC0_AFEM8_AFEM8_ASEM32_CLR1_CADS0_DTVA0_DTVB0_EPS0_FDSI0_GRPM1_GRVWA8_GRVWB8_GSU1_GSUAMB_GSUC0_GSUWGMRR0_GLS0_ISA942_IU1_LBSPPA512_LBSPPB128_LBSPPM0_LPA16_LPB16_LPMn1_LRVW8_LWPMn1_MIAV0_MIWT4_4_MO40_NTn1_NTA0_NTB0_NTC0_NTD0_NTM0_NEPBS0_NLCA1_NLCB1_ONLL1_PGR2_PLR1_PKA1_SIA3_SS1_SU32_SUM0_SUS256_SPO0_SRVW0_SSO0_SVW4_SK0_SKXCCM0_TLDS1_ULSGRO0_USL1_UIOFGRO0_USFGROn1_VSn1_VWA4_VWB1_WSGRA0_WSGRB0_WS64_WG32_8_1_WGM8_WGMXCC1_WGMXCCGn1
    SolutionIndex: 54
    SolutionNameMin: Cijk_Alik_Bljk_BBS_BH_UserArgs_MT128x128x64_MI16x16x1_SN_LDSB1_AFC0_AFEM8_AFEM8_ASEM32_CLR1_CADS0_DTVA0_DTVB0_EPS0_FDSI0_GRPM1_GRVWA8_GRVWB8_GSU1_GSUAMB_GSUC0_GSUWGMRR0_GLS0_ISA942_IU1_LBSPPA512_LBSPPB128_LBSPPM0_LPA16_LPB16_LPMn1_LRVW8_LWPMn1_MIAV0_MIWT4_4_MO40_NTn1_NTA0_NTB0_NTC0_NTD0_NTM0_NEPBS0_NLCA1_NLCB1_ONLL1_PGR2_PLR1_PKA1_SIA3_SS1_SU8_SUM0_SUS512_SPO0_SRVW0_SSO0_SVW4_SK0_SKXCCM0_TLDS1_ULSGRO0_USL1_UIOFGRO0_USFGROn1_VSn1_VWA4_VWB1_WSGRA0_WSGRB0_WS64_WG32_8_1_WGM8_WGMXCC1_WGMXCCGn1
    SolutionIndex: 55
    SolutionNameMin: Cijk_Alik_Bljk_BBS_BH_UserArgs_MT128x256x64_MI16x16x1_SN_LDSB1_AFC0_AFEM8_AFEM8_ASEM32_CLR1_CADS0_DTVA0_DTVB0_EPS0_FDSI0_GRPM1_GRVWA8_GRVWB8_GSU1_GSUAMB_GSUC0_GSUWGMRR0_GLS0_ISA942_IU1_LBSPPA1024_LBSPPB128_LBSPPM0_LPA16_LPB16_LPMn1_LRVW8_LWPMn1_MIAV0_MIWT8_4_MO40_NTn1_NTA0_NTB0_NTC0_NTD0_NTM0_NEPBS0_NLCA1_NLCB1_ONLL1_PGR2_PLR1_PKA1_SIA3_SS1_SU8_SUM0_SUS512_SPO0_SRVW0_SSO0_SVW8_SK0_SKXCCM0_TLDS1_ULSGRO0_USL1_UIOFGRO0_USFGROn1_VSn1_VWA8_VWB1_WSGRA0_WSGRB0_WS64_WG16_16_1_WGM1_WGMXCC1_WGMXCCGn1
    SolutionIndex: 56
    SolutionNameMin: Cijk_Alik_Bljk_BBS_BH_UserArgs_MT64x16x256_MI16x16x1_SN_LDSB1_AFC0_AFEM8_AFEM8_ASEM32_CLR1_CADS0_DTVA0_DTVB0_EPS0_FDSI0_GRPM1_GRVWA8_GRVWB8_GSU1_GSUAMB_GSUC0_GSUWGMRR0_GLS0_ISA942_IU1_LBSPPA512_LBSPPB512_LBSPPM0_LPA16_LPB16_LPMn1_LRVW8_LWPMn1_MIAV0_MIWT1_1_MO40_NTn1_NTA0_NTB0_NTC0_NTD0_NTM0_NEPBS0_NLCA1_NLCB1_ONLL1_PGR2_PLR1_PKA1_SIA3_SS0_SU0_SUM1_SUS0_SPO0_SRVW0_SSO0_SVW4_SK0_SKXCCM0_TLDS1_ULSGRO0_USL1_UIOFGRO0_USFGROn1_VSn1_VWA1_VWB1_WSGRA0_WSGRB0_WS64_WG64_4_1_WGM1_WGMXCC1_WGMXCCGn1
    SolutionIndex: 57
    SolutionNameMin: Cijk_Alik_Bljk_BBS_BH_UserArgs_MT256x224x64_MI16x16x1_SN_LDSB1_AFC0_AFEM8_AFEM8_ASEM32_CLR1_CADS0_DTVA0_DTVB0_EPS0_FDSI0_GRPM1_GRVWA4_GRVWB4_GSU1_GSUAMB_GSUC0_GSUWGMRR0_GLS0_ISA942_IU1_LBSPPA1024_LBSPPB128_LBSPPM0_LPA4_LPB4_LPMn1_LRVW4_LWPMn1_MIAV0_MIWT8_7_MO40_NTn1_NTA0_NTB0_NTC0_NTD0_NTM0_NEPBS0_NLCA1_NLCB1_ONLL1_PGR2_PLR1_PKA1_SIA3_SS1_SU8_SUM0_SUS128_SPO0_SRVW0_SSO0_SVW8_SK0_SKXCCM0_TLDS1_ULSGRO0_USL1_UIOFGRO0_USFGROn1_VSn1_VWA8_VWB1_WSGRA0_WSGRB0_WS64_WG32_8_1_WGM8_WGMXCC1_WGMXCCGn1
    SolutionIndex: 58
    SolutionNameMin: Cijk_Alik_Bljk_BBS_BH_UserArgs_MT96x192x64_MI16x16x1_SN_LDSB1_AFC0_AFEM8_AFEM8_ASEM32_CLR1_CADS0_DTVA0_DTVB0_EPS0_FDSI0_GRPM1_GRVWA8_GRVWB8_GSU1_GSUAMB_GSUC0_GSUWGMRR0_GLS0_ISA942_IU1_LBSPPA256_LBSPPB128_LBSPPM0_LPA16_LPB16_LPMn1_LRVW8_LWPMn1_MIAV0_MIWT6_3_MO40_NTn1_NTA0_NTB0_NTC0_NTD0_NTM0_NEPBS0_NLCA1_NLCB1_ONLL1_PGR2_PLR1_PKA1_SIA3_SS1_SU8_SUM0_SUS1024_SPO0_SRVW0_SSO0_SVW2_SK0_SKXCCM0_TLDS1_ULSGRO0_USL1_UIOFGRO0_USFGROn1_VSn1_VWA2_VWB1_WSGRA0_WSGRB0_WS64_WG16_16_1_WGM1_WGMXCC1_WGMXCCGn1
    SolutionIndex: 59
    SolutionNameMin: Cijk_Alik_Bljk_BBS_BH_UserArgs_MT160x128x64_MI16x16x1_SN_LDSB1_AFC0_AFEM8_AFEM8_ASEM32_CLR1_CADS0_DTVA0_DTVB0_EPS0_FDSI0_GRPM1_GRVWA8_GRVWB8_GSU1_GSUAMB_GSUC0_GSUWGMRR0_GLS0_ISA942_IU1_LBSPPA256_LBSPPB128_LBSPPM0_LPA16_LPB16_LPMn1_LRVW8_LWPMn1_MIAV0_MIWT10_2_MO40_NTn1_NTA0_NTB0_NTC0_NTD0_NTM0_NEPBS0_NLCA1_NLCB1_ONLL1_PGR2_PLR1_PKA1_SIA3_SS1_SU0_SUM1_SUS0_SPO0_SRVW0_SSO0_SVW2_SK0_SKXCCM0_TLDS1_ULSGRO0_USL1_UIOFGRO0_USFGROn1_VSn1_VWA2_VWB1_WSGRA0_WSGRB0_WS64_WG16_16_1_WGM1_WGMXCC1_WGMXCCGn1
    SolutionIndex: 60
    SolutionNameMin: Cijk_Alik_Bljk_BBS_BH_UserArgs_MT192x192x64_MI16x16x1_SN_LDSB1_AFC0_AFEM8_AFEM8_ASEM32_CLR1_CADS0_DTVA0_DTVB0_EPS0_FDSI0_GRPM1_GRVWA8_GRVWB8_GSU1_GSUAMB_GSUC0_GSUWGMRR0_GLS0_ISA942_IU1_LBSPPA256_LBSPPB128_LBSPPM0_LPA16_LPB16_LPMn1_LRVW8_LWPMn1_MIAV0_MIWT6_6_MO40_NTn1_NTA0_NTB0_NTC0_NTD0_NTM0_NEPBS0_NLCA1_NLCB1_ONLL1_PGR2_PLR1_PKA1_SIA3_SS0_SU0_SUM1_SUS0_SPO0_SRVW0_SSO0_SVW8_SK0_SKXCCM0_TLDS1_ULSGRO0_USL1_UIOFGRO0_USFGROn1_VSn1_VWA2_VWB1_WSGRA0_WSGRB0_WS64_WG32_8_1_WGM8_WGMXCC1_WGMXCCGn1
    SolutionIndex: 61
    SolutionNameMin: Cijk_Alik_Bljk_BBS_BH_UserArgs_MT32x16x256_MI16x16x1_SN_LDSB0_AFC0_AFEM8_AFEM8_ASEM32_CLR1_CADS0_DTVA0_DTVB0_EPS0_FDSI0_GRPM1_GRVWA8_GRVWB8_GSU1_GSUAMB_GSUC0_GSUWGMRR0_GLS0_ISA942_IU1_LBSPPA512_LBSPPB512_LBSPPM0_LPA16_LPB16_LPMn1_LRVW8_LWPMn1_MIAV0_MIWT1_1_MO40_NTn1_NTA0_NTB0_NTC0_NTD0_NTM0_NEPBS0_NLCA1_NLCB1_ONLL1_PGR2_PLR1_PKA1_SIA3_SS1_SU0_SUM1_SUS0_SPO0_SRVW0_SSO0_SVW1_SK0_SKXCCM0_TLDS1_ULSGRO0_USL1_UIOFGRO0_USFGROn1_VSn1_VWA1_VWB1_WSGRA0_WSGRB0_WS64_WG32_4_1_WGM1_WGMXCC1_WGMXCCGn1
    SolutionIndex: 62
    SolutionNameMin: Cijk_Alik_Bljk_BBS_BH_UserArgs_MT32x16x128_MI16x16x1_SN_LDSB0_AFC0_AFEM8_AFEM8_ASEM32_CLR1_CADS0_DTVA0_DTVB0_EPS0_FDSI0_GRPM1_GRVWA8_GRVWB8_GSU1_GSUAMB_GSUC0_GSUWGMRR0_GLS0_ISA942_IU1_LBSPPA256_LBSPPB256_LBSPPM0_LPA16_LPB16_LPMn1_LRVW8_LWPMn1_MIAV0_MIWT1_1_MO40_NTn1_NTA0_NTB0_NTC0_NTD0_NTM0_NEPBS0_NLCA1_NLCB1_ONLL1_PGR2_PLR1_PKA1_SIA3_SS1_SU8_SUM0_SUS256_SPO0_SRVW0_SSO0_SVW1_SK0_SKXCCM0_TLDS1_ULSGRO0_USL1_UIOFGRO0_USFGROn1_VSn1_VWA1_VWB1_WSGRA0_WSGRB0_WS64_WG32_4_1_WGM1_WGMXCC1_WGMXCCGn1
    SolutionIndex: 63
    SolutionNameMin: Cijk_Alik_Bljk_BBS_BH_UserArgs_MT32x32x128_MI16x16x1_SN_LDSB0_AFC0_AFEM8_AFEM8_ASEM32_CLR1_CADS0_DTVA0_DTVB0_EPS0_FDSI0_GRPM1_GRVWA8_GRVWB8_GSU1_GSUAMB_GSUC0_GSUWGMRR0_GLS0_ISA942_IU1_LBSPPA256_LBSPPB256_LBSPPM0_LPA16_LPB16_LPMn1_LRVW8_LWPMn1_MIAV0_MIWT1_1_MO40_NTn1_NTA0_NTB0_NTC0_NTD0_NTM0_NEPBS0_NLCA1_NLCB1_ONLL1_PGR2_PLR1_PKA1_SIA3_SS1_SU8_SUM0_SUS256_SPO0_SRVW0_SSO0_SVW1_SK0_SKXCCM0_TLDS1_ULSGRO0_USL1_UIOFGRO0_USFGROn1_VSn1_VWA1_VWB1_WSGRA0_WSGRB0_WS64_WG32_8_1_WGM1_WGMXCC1_WGMXCCGn1
    SolutionIndex: 64
    SolutionNameMin: Cijk_Alik_Bljk_BBS_BH_UserArgs_MT32x64x128_MI16x16x1_SN_LDSB0_AFC0_AFEM8_AFEM8_ASEM32_CLR1_CADS0_DTVA0_DTVB0_EPS0_FDSI0_GRPM1_GRVWA8_GRVWB8_GSU1_GSUAMB_GSUC0_GSUWGMRR0_GLS0_ISA942_IU1_LBSPPA512_LBSPPB256_LBSPPM0_LPA16_LPB16_LPMn1_LRVW8_LWPMn1_MIAV0_MIWT2_1_MO40_NTn1_NTA0_NTB0_NTC0_NTD0_NTM0_NEPBS0_NLCA1_NLCB1_ONLL1_PGR2_PLR1_PKA1_SIA3_SS1_SU8_SUM0_SUS256_SPO0_SRVW0_SSO0_SVW2_SK0_SKXCCM0_TLDS1_ULSGRO0_USL1_UIOFGRO0_USFGROn1_VSn1_VWA2_VWB1_WSGRA0_WSGRB0_WS64_WG16_16_1_WGM1_WGMXCC1_WGMXCCGn1
    SolutionIndex: 65
    SolutionNameMin: Cijk_Alik_Bljk_BBS_BH_UserArgs_MT64x32x128_MI16x16x1_SN_LDSB0_AFC0_AFEM8_AFEM8_ASEM32_CLR1_CADS0_DTVA0_DTVB0_EPS0_FDSI0_GRPM1_GRVWA8_GRVWB8_GSU1_GSUAMB_GSUC0_GSUWGMRR0_GLS0_ISA942_IU1_LBSPPA512_LBSPPB256_LBSPPM0_LPA16_LPB16_LPMn1_LRVW8_LWPMn1_MIAV0_MIWT2_1_MO40_NTn1_NTA0_NTB0_NTC0_NTD0_NTM0_NEPBS0_NLCA1_NLCB1_ONLL1_PGR2_PLR1_PKA1_SIA3_SS1_SU8_SUM0_SUS256_SPO0_SRVW0_SSO0_SVW2_SK0_SKXCCM0_TLDS1_ULSGRO0_USL1_UIOFGRO0_USFGROn1_VSn1_VWA2_VWB1_WSGRA0_WSGRB0_WS64_WG32_8_1_WGM1_WGMXCC1_WGMXCCGn1
    SolutionIndex: 66
    SolutionNameMin: Cijk_Alik_Bljk_BBS_BH_UserArgs_MT64x48x128_MI16x16x1_SN_LDSB0_AFC0_AFEM8_AFEM8_ASEM32_CLR1_CADS0_DTVA0_DTVB0_EPS0_FDSI0_GRPM1_GRVWA8_GRVWB8_GSU1_GSUAMB_GSUC0_GSUWGMRR0_GLS0_ISA942_IU1_LBSPPA256_LBSPPB256_LBSPPM0_LPA16_LPB16_LPMn1_LRVW8_LWPMn1_MIAV0_MIWT1_3_MO40_NTn1_NTA0_NTB0_NTC0_NTD0_NTM0_NEPBS0_NLCA1_NLCB1_ONLL1_PGR2_PLR1_PKA1_SIA3_SS1_SU8_SUM0_SUS512_SPO0_SRVW0_SSO0_SVW1_SK0_SKXCCM0_TLDS1_ULSGRO0_USL1_UIOFGRO0_USFGROn1_VSn1_VWA1_VWB1_WSGRA0_WSGRB0_WS64_WG64_4_1_WGM1_WGMXCC1_WGMXCCGn1
    SolutionIndex: 67
    SolutionNameMin: Cijk_Alik_Bljk_BBS_BH_UserArgs_MT192x224x64_MI16x16x1_SN_LDSB1_AFC0_AFEM8_AFEM8_ASEM32_CLR1_CADS0_DTVA0_DTVB0_EPS0_FDSI0_GRPM1_GRVWA4_GRVWB4_GSU1_GSUAMB_GSUC0_GSUWGMRR0_GLS0_ISA942_IU1_LBSPPA256_LBSPPB128_LBSPPM0_LPA4_LPB4_LPMn1_LRVW4_LWPMn1_MIAV0_MIWT6_7_MO40_NTn1_NTA0_NTB0_NTC0_NTD0_NTM0_NEPBS0_NLCA1_NLCB1_ONLL1_PGR2_PLR1_PKA1_SIA3_SS1_SU32_SUM0_SUS256_SPO0_SRVW0_SSO0_SVW2_SK0_SKXCCM0_TLDS1_ULSGRO0_USL1_UIOFGRO0_USFGROn1_VSn1_VWA2_VWB1_WSGRA0_WSGRB0_WS64_WG32_8_1_WGM8_WGMXCC1_WGMXCCGn1
    SolutionIndex: 68
    SolutionNameMin: Cijk_Alik_Bljk_BBS_BH_UserArgs_MT192x224x64_MI16x16x1_SN_LDSB1_AFC0_AFEM8_AFEM8_ASEM32_CLR1_CADS0_DTVA0_DTVB0_EPS0_FDSI0_GRPM1_GRVWA4_GRVWB4_GSU1_GSUAMB_GSUC0_GSUWGMRR0_GLS0_ISA942_IU1_LBSPPA256_LBSPPB128_LBSPPM0_LPA4_LPB4_LPMn1_LRVW4_LWPMn1_MIAV0_MIWT6_7_MO40_NTn1_NTA0_NTB0_NTC0_NTD0_NTM0_NEPBS0_NLCA1_NLCB1_ONLL1_PGR2_PLR1_PKA1_SIA3_SS1_SU8_SUM0_SUS1024_SPO0_SRVW0_SSO0_SVW2_SK0_SKXCCM0_TLDS1_ULSGRO0_USL1_UIOFGRO0_USFGROn1_VSn1_VWA2_VWB1_WSGRA0_WSGRB0_WS64_WG32_8_1_WGM8_WGMXCC1_WGMXCCGn1
    SolutionIndex: 69
    SolutionNameMin: Cijk_Alik_Bljk_BBS_BH_UserArgs_MT32x16x128_MI16x16x1_SN_LDSB0_AFC0_AFEM8_AFEM1_ASEM32_CLR1_CADS0_DTVA0_DTVB0_EPS0_FDSI0_GRPM1_GRVWA8_GRVWB8_GSU1_GSUAMB_GSUC0_GSUWGMRR0_GLS0_ISA942_IU1_LBSPPA256_LBSPPB256_LBSPPM0_LPA16_LPB16_LPMn1_LRVW8_LWPMn1_MIAV0_MIWT1_1_MO40_NTn1_NTA0_NTB0_NTC0_NTD0_NTM0_NEPBS0_NLCA1_NLCB1_ONLL1_PGR2_PLR1_PKA1_SIA3_SS0_SU8_SUM0_SUS1024_SPO0_SRVW0_SSO0_SVW4_SK0_SKXCCM0_TLDS1_ULSGRO0_USL1_UIOFGRO0_USFGROn1_VSn1_VWA1_VWB1_WSGRA0_WSGRB0_WS64_WG32_4_1_WGM1_WGMXCC1_WGMXCCGn1
    SolutionIndex: 70
    SolutionNameMin: Cijk_Alik_Bljk_BBS_BH_UserArgs_MT64x16x256_MI16x16x1_SN_LDSB1_AFC0_AFEM8_AFEM1_ASEM32_CLR1_CADS0_DTVA0_DTVB0_EPS0_FDSI0_GRPM1_GRVWA8_GRVWB8_GSU1_GSUAMB_GSUC0_GSUWGMRR0_GLS0_ISA942_IU1_LBSPPA512_LBSPPB512_LBSPPM0_LPA16_LPB16_LPMn1_LRVW8_LWPMn1_MIAV0_MIWT1_1_MO40_NTn1_NTA0_NTB0_NTC0_NTD0_NTM0_NEPBS0_NLCA1_NLCB1_ONLL1_PGR2_PLR1_PKA1_SIA3_SS0_SU0_SUM1_SUS0_SPO0_SRVW0_SSO0_SVW4_SK0_SKXCCM0_TLDS1_ULSGRO0_USL1_UIOFGRO0_USFGROn1_VSn1_VWA1_VWB1_WSGRA0_WSGRB0_WS64_WG64_4_1_WGM1_WGMXCC1_WGMXCCGn1
    SolutionIndex: 71
    SolutionNameMin: Cijk_Alik_Bljk_BBS_BH_UserArgs_MT32x16x64_MI16x16x1_SN_LDSB0_AFC0_AFEM8_AFEM1_ASEM32_CLR1_CADS0_DTVA0_DTVB0_EPS0_FDSI0_GRPM1_GRVWA8_GRVWB8_GSU8_GSUAMBSK_GSUC0_GSUWGMRR0_GLS0_ISA942_IU1_LBSPPA128_LBSPPB128_LBSPPM0_LPA16_LPB16_LPMn1_LRVW8_LWPMn1_MIAV0_MIWT1_1_MO40_NTn1_NTA0_NTB0_NTC0_NTD0_NTM0_NEPBS0_NLCA1_NLCB1_ONLL1_PGR2_PLR1_PKA1_SIA3_SS0_SU32_SUM0_SUS128_SPO0_SRVW0_SSO0_SVW4_SK0_SKXCCM0_TLDS1_ULSGRO0_USL1_UIOFGRO0_USFGROn1_VSn1_VWA1_VWB1_WSGRA0_WSGRB0_WS64_WG32_4_1_WGM1_WGMXCC1_WGMXCCGn1
    SolutionIndex: 72
    SolutionNameMin: Cijk_Alik_Bljk_BBS_BH_UserArgs_MT80x256x64_MI16x16x1_SN_LDSB1_AFC1_AFEM1_AFEM1_ASEM1_CLR1_CADS0_DTVA0_DTVB0_EPS0_FDSI0_GRPM1_GRVWA4_GRVWB8_GSU1_GSUAMB_GSUC0_GSUWGMRR0_GLS0_ISA942_IU1_LBSPPA128_LBSPPB128_LBSPPM0_LPA16_LPB16_LPMn1_LRVW8_LWPMn1_MIAV0_MIWT5_4_MO40_NTn1_NTA0_NTB0_NTC0_NTD0_NTM0_NEPBS0_NLCA1_NLCB1_ONLL1_PGR2_PLR1_PKA1_SIA3_SS1_SU32_SUM1_SUS256_SPO0_SRVW0_SSO0_SVW1_SK0_SKXCCM0_TLDS1_ULSGRO0_USL1_UIOFGRO0_USFGROn1_VSn1_VWA1_VWB1_WSGRA0_WSGRB0_WS64_WG16_16_1_WGM32_WGMXCC1_WGMXCCGn1
    SolutionIndex: 73
    SolutionNameMin: Cijk_Alik_Bljk_BBS_BH_UserArgs_MT128x96x64_MI16x16x1_SN_LDSB1_AFC1_AFEM1_AFEM1_ASEM1_CLR1_CADS0_DTVA0_DTVB0_EPS0_FDSI0_GRPM1_GRVWA8_GRVWB8_GSU1_GSUAMB_GSUC0_GSUWGMRR0_GLS0_ISA942_IU1_LBSPPA256_LBSPPB128_LBSPPM0_LPA16_LPB16_LPMn1_LRVW8_LWPMn1_MIAV0_MIWT2_6_MO40_NTn1_NTA0_NTB0_NTC0_NTD0_NTM0_NEPBS0_NLCA1_NLCB1_ONLL1_PGR2_PLR1_PKA1_SIA3_SS1_SU4_SUM1_SUS512_SPO0_SRVW0_SSO0_SVW2_SK0_SKXCCM0_TLDS1_ULSGRO0_USL1_UIOFGRO0_USFGROn1_VSn1_VWA2_VWB1_WSGRA0_WSGRB0_WS64_WG64_4_1_WGM1_WGMXCC1_WGMXCCGn1
    SolutionIndex: 74
    SolutionNameMin: Cijk_Alik_Bljk_BBS_BH_UserArgs_MT64x128x128_MI16x16x1_SN_LDSB1_AFC0_AFEM8_AFEM8_ASEM32_CLR1_CADS0_DTVA0_DTVB0_EPS0_FDSI0_GRPM1_GRVWA8_GRVWB8_GSU1_GSUAMB_GSUC0_GSUWGMRR0_GLS0_ISA942_IU1_LBSPPA1024_LBSPPB256_LBSPPM0_LPA16_LPB16_LPMn1_LRVW8_LWPMn1_MIAV0_MIWT4_4_MO40_NTn1_NTA0_NTB0_NTC0_NTD0_NTM0_NEPBS0_NLCA1_NLCB1_ONLL1_PGR2_PLR1_PKA1_SIA3_SS1_SU8_SUM0_SUS1024_SPO0_SRVW0_SSO0_SVW4_SK0_SKXCCM0_TLDS1_ULSGRO0_USL1_UIOFGRO0_USFGROn1_VSn1_VWA4_VWB1_WSGRA0_WSGRB0_WS64_WG16_8_2_WGM1_WGMXCC1_WGMXCCGn1
    SolutionIndex: 75
    SolutionNameMin: Cijk_Alik_Bljk_BBS_BH_UserArgs_MT32x96x128_MI16x16x1_SN_LDSB1_AFC0_AFEM1_AFEM8_ASEM32_CLR1_CADS0_DTVA0_DTVB0_EPS0_FDSI0_GRPM1_GRVWA8_GRVWB8_GSU1_GSUAMB_GSUC0_GSUWGMRR0_GLS0_ISA942_IU1_LBSPPA256_LBSPPB256_LBSPPM0_LPA16_LPB16_LPMn1_LRVW8_LWPMn1_MIAV0_MIWT2_3_MO40_NTn1_NTA0_NTB0_NTC0_NTD0_NTM0_NEPBS0_NLCA1_NLCB1_ONLL1_PGR2_PLR1_PKA1_SIA3_SS1_SU8_SUM0_SUS512_SPO0_SRVW0_SSO0_SVW1_SK0_SKXCCM0_TLDS1_ULSGRO0_USL1_UIOFGRO0_USFGROn1_VSn1_VWA1_VWB1_WSGRA0_WSGRB0_WS64_WG16_8_2_WGM8_WGMXCC1_WGMXCCGn1
    SolutionIndex: 76
    SolutionNameMin: Cijk_Alik_Bljk_BBS_BH_UserArgs_MT16x32x512_MI16x16x1_SN_LDSB1_AFC0_AFEM8_AFEM8_ASEM32_CLR1_CADS0_DTVA0_DTVB0_EPS0_FDSI0_GRPM1_GRVWA8_GRVWB8_GSU1_GSUAMB_GSUC0_GSUWGMRR0_GLS0_ISA942_IU1_LBSPPA1024_LBSPPB1024_LBSPPM0_LPA16_LPB16_LPMn1_LRVW8_LWPMn1_MIAV0_MIWT1_2_MO40_NTn1_NTA0_NTB0_NTC0_NTD0_NTM0_NEPBS0_NLCA1_NLCB1_ONLL1_PGR2_PLR1_PKA1_SIA3_SS0_SU0_SUM1_SUS0_SPO0_SRVW0_SSO0_SVW1_SK0_SKXCCM0_TLDS1_ULSGRO0_USL1_UIOFGRO0_USFGROn1_VSn1_VWA1_VWB1_WSGRA0_WSGRB0_WS64_WG16_4_2_WGM8_WGMXCC1_WGMXCCGn1
    SolutionIndex: 77
    SolutionNameMin: Cijk_Alik_Bljk_BBS_BH_UserArgs_MT64x64x128_MI16x16x1_SN_LDSB1_AFC0_AFEM8_AFEM8_ASEM32_CLR1_CADS0_DTVA0_DTVB0_EPS0_FDSI0_GRPM1_GRVWA8_GRVWB8_GSU1_GSUAMB_GSUC0_GSUWGMRR0_GLS0_ISA942_IU1_LBSPPA512_LBSPPB256_LBSPPM0_LPA16_LPB16_LPMn1_LRVW8_LWPMn1_MIAV0_MIWT4_2_MO40_NTn1_NTA0_NTB0_NTC0_NTD0_NTM0_NEPBS0_NLCA1_NLCB1_ONLL1_PGR2_PLR1_PKA1_SIA3_SS1_SU0_SUM1_SUS0_SPO0_SRVW0_SSO0_SVW2_SK0_SKXCCM0_TLDS1_ULSGRO0_USL1_UIOFGRO0_USFGROn1_VSn1_VWA2_VWB1_WSGRA0_WSGRB0_WS64_WG16_8_2_WGM1_WGMXCC1_WGMXCCGn1
    SolutionIndex: 78
    SolutionNameMin: Cijk_Alik_Bljk_BBS_BH_UserArgs_MT32x64x256_MI16x16x1_SN_LDSB1_AFC0_AFEM8_AFEM8_ASEM32_CLR1_CADS0_DTVA0_DTVB0_EPS0_FDSI0_GRPM1_GRVWA8_GRVWB8_GSU1_GSUAMB_GSUC0_GSUWGMRR0_GLS0_ISA942_IU1_LBSPPA1024_LBSPPB512_LBSPPM0_LPA16_LPB16_LPMn1_LRVW8_LWPMn1_MIAV0_MIWT2_4_MO40_NTn1_NTA0_NTB0_NTC0_NTD0_NTM0_NEPBS0_NLCA1_NLCB1_ONLL1_PGR2_PLR1_PKA1_SIA3_SS1_SU8_SUM0_SUS512_SPO0_SRVW0_SSO0_SVW2_SK0_SKXCCM0_TLDS1_ULSGRO0_USL1_UIOFGRO0_USFGROn1_VSn1_VWA2_VWB1_WSGRA0_WSGRB0_WS64_WG16_4_4_WGM1_WGMXCC1_WGMXCCGn1
    SolutionIndex: 79
    SolutionNameMin: Cijk_Alik_Bljk_BBS_BH_UserArgs_MT128x64x128_MI16x16x1_SN_LDSB1_AFC0_AFEM8_AFEM8_ASEM32_CLR1_CADS0_DTVA0_DTVB0_EPS0_FDSI0_GRPM1_GRVWA8_GRVWB8_GSU1_GSUAMB_GSUC0_GSUWGMRR0_GLS0_ISA942_IU1_LBSPPA512_LBSPPB256_LBSPPM0_LPA16_LPB16_LPMn1_LRVW8_LWPMn1_MIAV0_MIWT4_4_MO40_NTn1_NTA0_NTB0_NTC0_NTD0_NTM0_NEPBS0_NLCA1_NLCB1_ONLL1_PGR2_PLR1_PKA1_SIA3_SS0_SU8_SUM0_SUS512_SPO0_SRVW0_SSO0_SVW2_SK0_SKXCCM0_TLDS1_ULSGRO0_USL1_UIOFGRO0_USFGROn1_VSn1_VWA2_VWB1_WSGRA0_WSGRB0_WS64_WG32_4_2_WGM1_WGMXCC1_WGMXCCGn1
    SolutionIndex: 80
    SolutionNameMin: Cijk_Alik_Bljk_BBS_BH_UserArgs_MT32x64x256_MI16x16x1_SN_LDSB1_AFC0_AFEM8_AFEM8_ASEM32_CLR1_CADS0_DTVA0_DTVB0_EPS0_FDSI0_GRPM1_GRVWA8_GRVWB8_GSU1_GSUAMB_GSUC0_GSUWGMRR0_GLS0_ISA942_IU1_LBSPPA512_LBSPPB512_LBSPPM0_LPA16_LPB16_LPMn1_LRVW8_LWPMn1_MIAV0_MIWT2_4_MO40_NTn1_NTA0_NTB0_NTC0_NTD0_NTM0_NEPBS0_NLCA1_NLCB1_ONLL1_PGR2_PLR1_PKA1_SIA3_SS1_SU0_SUM1_SUS0_SPO0_SRVW0_SSO0_SVW1_SK0_SKXCCM0_TLDS1_ULSGRO0_USL1_UIOFGRO0_USFGROn1_VSn1_VWA1_VWB1_WSGRA0_WSGRB0_WS64_WG16_4_4_WGM8_WGMXCC1_WGMXCCGn1
    SolutionIndex: 81
    SolutionNameMin: Cijk_Alik_Bljk_BBS_BH_UserArgs_MT32x64x256_MI16x16x1_SN_LDSB1_AFC0_AFEM8_AFEM8_ASEM32_CLR1_CADS0_DTVA0_DTVB0_EPS0_FDSI0_GRPM1_GRVWA8_GRVWB8_GSU1_GSUAMB_GSUC0_GSUWGMRR0_GLS0_ISA942_IU1_LBSPPA1024_LBSPPB512_LBSPPM0_LPA16_LPB16_LPMn1_LRVW8_LWPMn1_MIAV0_MIWT2_2_MO40_NTn1_NTA0_NTB0_NTC0_NTD0_NTM0_NEPBS0_NLCA1_NLCB1_ONLL1_PGR2_PLR1_PKA1_SIA3_SS1_SU0_SUM1_SUS0_SPO0_SRVW0_SSO0_SVW2_SK0_SKXCCM0_TLDS1_ULSGRO0_USL1_UIOFGRO0_USFGROn1_VSn1_VWA2_VWB1_WSGRA0_WSGRB0_WS64_WG16_8_2_WGM8_WGMXCC1_WGMXCCGn1
    SolutionIndex: 82
    SolutionNameMin: Cijk_Alik_Bljk_BBS_BH_UserArgs_MT256x160x64_MI16x16x1_SN_LDSB1_AFC0_AFEM1_AFEM1_ASEM1_CLR1_CADS0_DTVA0_DTVB0_EPS0_FDSI0_GRPM1_GRVWA2_GRVWB8_GSU1_GSUAMB_GSUC0_GSUWGMRR0_GLS0_ISA942_IU1_LBSPPA512_LBSPPB128_LBSPPM0_LPA16_LPB16_LPM0_LRVW8_LWPMn1_MIAV0_MIWT8_5_MO40_NTn1_NTA0_NTB0_NTC4_NTD4_NTM0_NEPBS0_NLCA1_NLCB1_ONLL1_PGR2_PLR1_PKA1_SIA3_SS1_SU0_SUM1_SUS0_SPO1_SRVW0_SSO0_SVW4_SK0_SKXCCM0_TLDS1_ULSGRO0_USL1_UIOFGRO0_USFGROn1_VSn1_VWA4_VWB1_WSGRA0_WSGRB0_WS64_WG32_8_1_WGM1_WGMXCC1_WGMXCCGn1
    SolutionIndex: 83
    SolutionNameMin: Cijk_Alik_Bljk_BBS_BH_UserArgs_MT256x192x64_MI16x16x1_SN_LDSB1_AFC0_AFEM1_AFEM1_ASEM1_CLR1_CADS0_DTVA0_DTVB0_EPS0_FDSI0_GRPM1_GRVWA2_GRVWB8_GSU1_GSUAMB_GSUC0_GSUWGMRR0_GLS0_ISA942_IU1_LBSPPA1024_LBSPPB128_LBSPPM0_LPA4_LPB8_LPM0_LRVW4_LWPMn1_MIAV0_MIWT16_3_MO40_NTn1_NTA0_NTB0_NTC4_NTD4_NTM0_NEPBS16_NLCA1_NLCB1_ONLL1_PGR2_PLR1_PKA1_SIA3_SS1_SU8_SUM1_SUS256_SPO1_SRVW0_SSO0_SVW8_SK0_SKXCCM0_TLDS1_ULSGRO0_USL1_UIOFGRO0_USFGROn1_VSn1_VWA8_VWB1_WSGRA0_WSGRB0_WS64_WG16_16_1_WGM16_WGMXCC4_WGMXCCGn1
    SolutionIndex: 84
    SolutionNameMin: Cijk_Alik_Bljk_BBS_BH_UserArgs_MT256x224x64_MI16x16x1_SN_LDSB1_AFC0_AFEM1_AFEM1_ASEM1_CLR1_CADS0_DTVA0_DTVB0_EPS0_FDSI0_GRPM1_GRVWA8_GRVWB2_GSU1_GSUAMB_GSUC0_GSUWGMRR0_GLS0_ISA942_IU1_LBSPPA1024_LBSPPB128_LBSPPM0_LPA8_LPB4_LPM0_LRVW4_LWPMn1_MIAV0_MIWT8_7_MO40_NTn1_NTA0_NTB0_NTC4_NTD4_NTM0_NEPBS16_NLCA1_NLCB1_ONLL1_PGR2_PLR1_PKA1_SIA3_SS1_SU8_SUM1_SUS256_SPO1_SRVW0_SSO0_SVW8_SK0_SKXCCM0_TLDS1_ULSGRO0_USL1_UIOFGRO0_USFGROn1_VSn1_VWA8_VWB1_WSGRA0_WSGRB0_WS64_WG32_8_1_WGM16_WGMXCC4_WGMXCCGn1
    SolutionIndex: 85
    SolutionNameMin: Cijk_Alik_Bljk_BBS_BH_UserArgs_MT224x224x64_MI16x16x1_SN_LDSB1_AFC0_AFEM1_AFEM1_ASEM1_CLR1_CADS0_DTVA0_DTVB0_EPS0_FDSI0_GRPM1_GRVWA2_GRVWB2_GSU1_GSUAMB_GSUC0_GSUWGMRR0_GLS0_ISA942_IU1_LBSPPA128_LBSPPB128_LBSPPM0_LPA4_LPB4_LPM0_LRVW4_LWPMn1_MIAV0_MIWT7_7_MO40_NTn1_NTA0_NTB0_NTC4_NTD4_NTM0_NEPBS16_NLCA1_NLCB1_ONLL1_PGR2_PLR1_PKA1_SIA3_SS1_SU8_SUM1_SUS256_SPO1_SRVW0_SSO4_SVW1_SK0_SKXCCM0_TLDS1_ULSGRO0_USL1_UIOFGRO0_USFGROn1_VSn1_VWA1_VWB1_WSGRA0_WSGRB0_WS64_WG32_8_1_WGM32_WGMXCC1_WGMXCCGn1
    SolutionIndex: 86
    SolutionNameMin: Cijk_Alik_Bljk_BBS_BH_UserArgs_MT256x224x64_MI16x16x1_SN_LDSB1_AFC0_AFEM1_AFEM1_ASEM1_CLR1_CADS0_DTVA0_DTVB0_EPS0_FDSI0_GRPM1_GRVWA2_GRVWB2_GSU1_GSUAMB_GSUC0_GSUWGMRR0_GLS0_ISA942_IU1_LBSPPA256_LBSPPB128_LBSPPM0_LPA4_LPB4_LPM0_LRVW4_LWPMn1_MIAV0_MIWT8_7_MO40_NTn1_NTA0_NTB0_NTC4_NTD4_NTM0_NEPBS16_NLCA1_NLCB1_ONLL1_PGR2_PLR1_PKA1_SIA3_SS1_SU8_SUM1_SUS256_SPO1_SRVW0_SSO0_SVW2_SK0_SKXCCM0_TLDS1_ULSGRO0_USL1_UIOFGRO0_USFGROn1_VSn1_VWA2_VWB1_WSGRA0_WSGRB0_WS64_WG32_8_1_WGM32_WGMXCC1_WGMXCCGn1
    SolutionIndex: 87
    SolutionNameMin: Cijk_Alik_Bljk_BBS_BH_UserArgs_MT256x192x64_MI16x16x1_SN_LDSB1_AFC0_AFEM1_AFEM1_ASEM1_CLR1_CADS0_DTVA0_DTVB0_EPS0_FDSI0_GRPM1_GRVWA8_GRVWB8_GSU1_GSUAMB_GSUC0_GSUWGMRR0_GLS0_ISA942_IU1_K1_LBSPPA256_LBSPPB256_LBSPPM0_LPA16_LPB16_LPM0_LRVW8_LWPMn1_MIAV0_MIWT8_6_MO40_NTn1_NTA3_NTB1_NTC4_NTD4_NTM0_NEPBS0_NLCA1_NLCB1_ONLL1_PGR2_PLR1_PKA1_SIA3_SS1_SU8_SUM1_SUS256_SPO0_SRVW0_SSO0_SVW2_SK0_SKXCCM0_TLDS1_ULSGRO0_USL1_UIOFGRO0_USFGROn1_VSn1_VWA2_VWB2_WSGRA1_WSGRB1_WS64_WG32_8_1_WGM1_WGMXCC1_WGMXCCG0
    SolutionIndex: 88
    SolutionNameMin: Cijk_Alik_Bljk_BBS_BH_UserArgs_MT224x256x64_MI16x16x1_SN_LDSB1_AFC0_AFEM1_AFEM1_ASEM1_CLR1_CADS0_DTVA0_DTVB0_EPS0_FDSI0_GRPM1_GRVWA2_GRVWB2_GSU1_GSUAMB_GSUC0_GSUWGMRR0_GLS0_ISA942_IU1_K1_LBSPPA128_LBSPPB256_LBSPPM0_LPA4_LPB4_LPM0_LRVW4_LWPMn1_MIAV0_MIWT7_8_MO40_NTn1_NTA1_NTB1_NTC4_NTD4_NTM0_NEPBS0_NLCA1_NLCB1_ONLL1_PGR2_PLR1_PKA1_SIA3_SS1_SU32_SUM1_SUS2048_SPO0_SRVW0_SSO0_SVW1_SK0_SKXCCM0_TLDS1_ULSGRO0_USL1_UIOFGRO0_USFGROn1_VSn1_VWA1_VWB2_WSGRA2_WSGRB2_WS64_WG32_8_1_WGMn16_WGMXCC1_WGMXCCG0
    SolutionIndex: 89
    SolutionNameMin: Cijk_Alik_Bljk_BBS_BH_UserArgs_MT224x128x64_MI16x16x1_SN_LDSB1_AFC0_AFEM1_AFEM1_ASEM1_CLR1_CADS0_DTVA0_DTVB0_EPS0_FDSI0_GRPM1_GRVWA8_GRVWB8_GSU1_GSUAMB_GSUC0_GSUWGMRR0_GLS0_ISA942_IU1_K1_LBSPPA128_LBSPPB256_LBSPPM0_LPA16_LPB16_LPM0_LRVW8_LWPMn1_MIAV1_MIWT7_4_MO40_NTn1_NTA1_NTB1_NTC0_NTD0_NTM0_NEPBS0_NLCA1_NLCB1_ONLL1_PGR2_PLR1_PKA1_SIA3_SS0_SU8_SUM1_SUS2048_SPO0_SRVW0_SSO0_SVW4_SK0_SKXCCM0_TLDS1_ULSGRO0_USL1_UIOFGRO0_USFGROn1_VSn1_VWA1_VWB2_WSGRA2_WSGRB2_WS64_WG32_8_1_WGM32_WGMXCC1_WGMXCCG0
    SolutionIndex: 90
    SolutionNameMin: Cijk_Alik_Bljk_BBS_BH_UserArgs_MT256x192x64_MI16x16x1_SN_LDSB1_AFC0_AFEM1_AFEM1_ASEM1_CLR1_CADS0_DTVA0_DTVB0_EPS0_FDSI0_GRPM1_GRVWA8_GRVWB8_GSU1_GSUAMB_GSUC0_GSUWGMRR0_GLS0_ISA942_IU1_K1_LBSPPA256_LBSPPB256_LBSPPM0_LPA16_LPB16_LPM0_LRVW8_LWPMn1_MIAV0_MIWT8_6_MO40_NTn1_NTA1_NTB2_NTC6_NTD6_NTM0_NEPBS0_NLCA1_NLCB1_ONLL1_PGR2_PLR1_PKA1_SIA3_SS1_SU0_SUM1_SUS0_SPO0_SRVW0_SSO0_SVW2_SK0_SKXCCM0_TLDS1_ULSGRO0_USL1_UIOFGRO0_USFGROn1_VSn1_VWA2_VWB2_WSGRA1_WSGRB1_WS64_WG32_8_1_WGM1_WGMXCC1_WGMXCCG0
    SolutionIndex: 91
    SolutionNameMin: Cijk_Alik_Bljk_BBS_BH_UserArgs_MT256x192x64_MI16x16x1_SN_LDSB1_AFC0_AFEM1_AFEM1_ASEM1_CLR1_CADS0_DTVA0_DTVB0_EPS0_FDSI0_GRPM1_GRVWA8_GRVWB8_GSU1_GSUAMB_GSUC0_GSUWGMRR0_GLS0_ISA942_IU1_K1_LBSPPA256_LBSPPB256_LBSPPM0_LPA16_LPB16_LPM0_LRVW8_LWPMn1_MIAV0_MIWT8_6_MO40_NTn1_NTA3_NTB1_NTC4_NTD4_NTM0_NEPBS0_NLCA1_NLCB1_ONLL1_PGR2_PLR1_PKA1_SIA3_SS1_SU8_SUM1_SUS256_SPO0_SRVW0_SSO0_SVW2_SK0_SKXCCM0_TLDS1_ULSGRO1_USL1_UIOFGRO0_USFGROn1_VSn1_VWA2_VWB2_WSGRA2_WSGRB2_WS64_WG32_8_1_WGM1_WGMXCC1_WGMXCCG0
    SolutionIndex: 92
    SolutionNameMin: Cijk_Alik_Bljk_BBS_BH_UserArgs_MT256x96x64_MI16x16x1_SN_LDSB1_AFC0_AFEM1_AFEM1_ASEM1_CLR1_CADS0_DTVA0_DTVB0_EPS0_FDSI0_GRPM1_GRVWA8_GRVWB8_GSU3_GSUAMB_GSUC1_GSUWGMRR0_GLS0_ISA942_IU1_K1_LBSPPA512_LBSPPB256_LBSPPM0_LPA16_LPB16_LPM0_LRVW8_LWPMn1_MIAV0_MIWT4_6_MO40_NTn1_NTA0_NTB0_NTC0_NTD3_NTM0_NEPBS16_NLCA1_NLCB1_ONLL1_PGR2_PLR1_PKA1_SIA3_SS1_SU8_SUM1_SUS128_SPO0_SRVW0_SSO0_SVW4_SK0_SKXCCM0_TLDS1_ULSGRO1_USL1_UIOFGRO0_USFGROn1_VSn1_VWA4_VWB2_WSGRA0_WSGRB0_WS64_WG64_4_1_WGM1_WGMXCC1_WGMXCCG4
    SolutionIndex: 93
    SolutionNameMin: Cijk_Alik_Bljk_BBS_BH_UserArgs_MT256x224x64_MI16x16x1_SN_LDSB1_AFC0_AFEM1_AFEM1_ASEM1_CLR1_CADS0_DTVA0_DTVB0_EPS0_FDSI0_GRPM1_GRVWA4_GRVWB4_GSU1_GSUAMB_GSUC0_GSUWGMRR0_GLS0_ISA942_IU1_K1_LBSPPA1024_LBSPPB128_LBSPPM0_LPA4_LPB4_LPM0_LRVW4_LWPMn1_MIAV0_MIWT8_7_MO40_NTn1_NTA0_NTB0_NTC4_NTD4_NTM0_NEPBS16_NLCA1_NLCB1_ONLL1_PGR2_PLR1_PKA1_SIA3_SS1_SU8_SUM1_SUS256_SPO1_SRVW0_SSO0_SVW8_SK0_SKXCCM0_TLDS1_ULSGRO0_USL1_UIOFGRO0_USFGROn1_VSn1_VWA8_VWB1_WSGRA0_WSGRB0_WS64_WG32_8_1_WGM32_WGMXCC1_WGMXCCGn1
    SolutionIndex: 94
    SolutionNameMin: Cijk_Alik_Bljk_BBS_BH_UserArgs_MT256x224x64_MI16x16x1_SN_LDSB1_AFC0_AFEM1_AFEM1_ASEM1_CLR1_CADS0_DTVA0_DTVB0_EPS0_FDSI0_GRPM1_GRVWA4_GRVWB4_GSU1_GSUAMB_GSUC0_GSUWGMRR0_GLS0_ISA942_IU1_K1_LBSPPA1024_LBSPPB128_LBSPPM0_LPA4_LPB4_LPM0_LRVW4_LWPMn1_MIAV0_MIWT8_7_MO40_NTn1_NTA0_NTB0_NTC0_NTD4_NTM0_NEPBS16_NLCA1_NLCB1_ONLL1_PGR2_PLR1_PKA1_SIA3_SS1_SU8_SUM1_SUS256_SPO1_SRVW0_SSO0_SVW8_SK0_SKXCCM0_TLDS1_ULSGRO0_USL1_UIOFGRO0_USFGROn1_VSn1_VWA8_VWB1_WSGRA0_WSGRB0_WS64_WG32_8_1_WGM16_WGMXCC4_WGMXCCG0
    SolutionIndex: 95
    SolutionNameMin: Cijk_Alik_Bljk_BBS_BH_UserArgs_MT64x16x256_MI16x16x1_SN_LDSB1_AFC0_AFEM1_AFEM1_ASEM1_CLR1_CADS0_DTVA0_DTVB0_EPS0_FDSI0_GRPM1_GRVWA2_GRVWB8_GSU1_GSUAMB_GSUC0_GSUWGMRR0_GLS0_ISA942_IU1_K1_LBSPPA512_LBSPPB512_LBSPPM0_LPA16_LPB16_LPM0_LRVW8_LWPMn1_MIAV1_MIWT1_1_MO40_NTn1_NTA4_NTB0_NTC0_NTD0_NTM0_NEPBS16_NLCA1_NLCB1_ONLL1_PGR2_PLR1_PKA1_SIA3_SS1_SU0_SUM1_SUS0_SPO0_SRVW0_SSO0_SVW1_SK0_SKXCCM0_TLDS1_ULSGRO0_USL1_UIOFGRO0_USFGROn1_VSn1_VWA1_VWB1_WSGRA0_WSGRB0_WS64_WG64_4_1_WGM1_WGMXCC1_WGMXCCGn1
    SolutionIndex: 96
    SolutionNameMin: Cijk_Alik_Bljk_BBS_BH_UserArgs_MT128x16x64_MI16x16x1_SN_LDSB1_AFC0_AFEM1_AFEM1_ASEM1_CLR1_CADS0_DTVA0_DTVB0_EPS0_FDSI0_GRPM1_GRVWA8_GRVWB2_GSU5_GSUAMB_GSUC0_GSUWGMRR0_GLS0_ISA942_IU1_K1_LBSPPA256_LBSPPB128_LBSPPM0_LPA16_LPB16_LPM0_LRVW8_LWPMn1_MIAV1_MIWT2_1_MO40_NTn1_NTA4_NTB0_NTC0_NTD0_NTM0_NEPBS16_NLCA1_NLCB1_ONLL1_PGR2_PLR1_PKA1_SIA3_SS1_SU0_SUM1_SUS0_SPO0_SRVW0_SSO0_SVW2_SK0_SKXCCM0_TLDS1_ULSGRO0_USL1_UIOFGRO0_USFGROn1_VSn1_VWA2_VWB1_WSGRA0_WSGRB0_WS64_WG64_4_1_WGM1_WGMXCC1_WGMXCCGn1
    SolutionIndex: 97
    SolutionNameMin: Cijk_Alik_Bljk_BBS_BH_UserArgs_MT64x16x64_MI16x16x1_SN_LDSB1_AFC0_AFEM1_AFEM1_ASEM1_CLR1_CADS0_DTVA0_DTVB0_EPS0_FDSI0_GRPM1_GRVWA8_GRVWB2_GSU1_GSUAMB_GSUC0_GSUWGMRR0_GLS0_ISA942_IU1_K1_LBSPPA128_LBSPPB128_LBSPPM0_LPA16_LPB16_LPM0_LRVW8_LWPMn1_MIAV1_MIWT1_1_MO40_NTn1_NTA4_NTB0_NTC0_NTD0_NTM0_NEPBS16_NLCA1_NLCB1_ONLL1_PGR2_PLR1_PKA1_SIA3_SS1_SU0_SUM1_SUS0_SPO0_SRVW0_SSO0_SVW1_SK0_SKXCCM0_TLDS1_ULSGRO0_USL1_UIOFGRO0_USFGROn1_VSn1_VWA1_VWB1_WSGRA0_WSGRB0_WS64_WG64_4_1_WGM1_WGMXCC1_WGMXCCGn1
    SolutionIndex: 98
    SolutionNameMin: Cijk_Alik_Bljk_BBS_BH_UserArgs_MT192x16x128_MI16x16x1_SN_LDSB1_AFC0_AFEM1_AFEM1_ASEM1_CLR1_CADS0_DTVA0_DTVB0_EPS0_FDSI0_GRPM1_GRVWA2_GRVWB2_GSU1_GSUAMB_GSUC0_GSUWGMRR0_GLS0_ISA942_IU1_K1_LBSPPA256_LBSPPB256_LBSPPM0_LPA16_LPB16_LPM0_LRVW8_LWPMn1_MIAV1_MIWT3_1_MO40_NTn1_NTA4_NTB0_NTC0_NTD0_NTM0_NEPBS16_NLCA1_NLCB1_ONLL1_PGR2_PLR1_PKA1_SIA3_SS1_SU0_SUM1_SUS0_SPO0_SRVW0_SSO0_SVW1_SK0_SKXCCM0_TLDS1_ULSGRO0_USL1_UIOFGRO0_USFGROn1_VSn1_VWA1_VWB1_WSGRA0_WSGRB0_WS64_WG64_4_1_WGM1_WGMXCC1_WGMXCCGn1
    SolutionIndex: 99
    SolutionNameMin: Cijk_Alik_Bljk_BBS_BH_UserArgs_MT64x16x256_MI16x16x1_SN_LDSB1_AFC0_AFEM1_AFEM1_ASEM1_CLR1_CADS0_DTVA0_DTVB0_EPS0_FDSI0_GRPM1_GRVWA2_GRVWB2_GSU1_GSUAMB_GSUC0_GSUWGMRR0_GLS0_ISA942_IU1_K1_LBSPPA512_LBSPPB512_LBSPPM0_LPA16_LPB16_LPM0_LRVW8_LWPMn1_MIAV1_MIWT1_1_MO40_NTn1_NTA4_NTB0_NTC0_NTD0_NTM0_NEPBS16_NLCA1_NLCB1_ONLL1_PGR2_PLR1_PKA1_SIA3_SS1_SU0_SUM1_SUS0_SPO0_SRVW0_SSO0_SVW1_SK0_SKXCCM0_TLDS1_ULSGRO0_USL1_UIOFGRO0_USFGROn1_VSn1_VWA1_VWB1_WSGRA0_WSGRB0_WS64_WG64_4_1_WGM1_WGMXCC1_WGMXCCGn1
    SolutionIndex: 100
    SolutionNameMin: Cijk_Alik_Bljk_BBS_BH_UserArgs_MT128x96x128_MI16x16x1_SN_LDSB1_AFC0_AFEM1_AFEM1_ASEM1_CLR1_CADS0_DTVA0_DTVB0_EPS0_FDSI0_GRPM1_GRVWA8_GRVWB8_GSU1_GSUAMB_GSUC0_GSUWGMRR0_GLS0_ISA942_IU1_K1_LBSPPA1024_LBSPPB256_LBSPPM0_LPA16_LPB16_LPM0_LRVW8_LWPMn1_MIAV0_MIWT4_3_MO40_NTn1_NTA0_NTB0_NTC0_NTD4_NTM0_NEPBS16_NLCA1_NLCB1_ONLL1_PGR2_PLR1_PKA1_SIA3_SS1_SU16_SUM1_SUS256_SPO0_SRVW0_SSO0_SVW4_SK0_SKXCCM0_TLDS1_ULSGRO0_USL1_UIOFGRO0_USFGROn1_VSn1_VWA4_VWB1_WSGRA1_WSGRB1_WS64_WG32_8_1_WGM8_WGMXCC8_WGMXCCG304
    SolutionIndex: 101
    SolutionNameMin: Cijk_Alik_Bljk_BBS_BH_UserArgs_MT160x128x64_MI16x16x1_SN_LDSB1_AFC0_AFEM1_AFEM1_ASEM1_CLR1_CADS0_DTVA0_DTVB0_EPS0_FDSI0_GRPM1_GRVWA8_GRVWB8_GSU1_GSUAMB_GSUC0_GSUWGMRR0_GLS0_ISA942_IU1_K1_LBSPPA128_LBSPPB512_LBSPPM0_LPA16_LPB16_LPM0_LRVW8_LWPMn1_MIAV0_MIWT5_4_MO40_NTn1_NTA0_NTB0_NTC0_NTD4_NTM0_NEPBS16_NLCA1_NLCB1_ONLL1_PGR2_PLR1_PKA1_SIA3_SS1_SU16_SUM1_SUS128_SPO0_SRVW0_SSO0_SVW1_SK0_SKXCCM0_TLDS1_ULSGRO0_USL1_UIOFGRO0_USFGROn1_VSn1_VWA1_VWB4_WSGRA1_WSGRB1_WS64_WG32_8_1_WGM8_WGMXCC8_WGMXCCG304
    SolutionIndex: 102
    SolutionNameMin: Cijk_Alik_Bljk_BBS_BH_UserArgs_MT128x160x64_MI16x16x1_SN_LDSB1_AFC0_AFEM1_AFEM1_ASEM1_CLR1_CADS0_DTVA0_DTVB0_EPS0_FDSI0_GRPM1_GRVWA8_GRVWB8_GSU1_GSUAMB_GSUC0_GSUWGMRR0_GLS0_ISA942_IU1_K1_LBSPPA512_LBSPPB128_LBSPPM0_LPA16_LPB16_LPM0_LRVW8_LWPMn1_MIAV0_MIWT4_5_MO40_NTn1_NTA0_NTB0_NTC0_NTD4_NTM0_NEPBS16_NLCA1_NLCB1_ONLL1_PGR2_PLR1_PKA1_SIA3_SS1_SU16_SUM1_SUS128_SPO0_SRVW0_SSO0_SVW4_SK0_SKXCCM0_TLDS1_ULSGRO0_USL1_UIOFGRO0_USFGROn1_VSn1_VWA4_VWB1_WSGRA1_WSGRB1_WS64_WG32_8_1_WGM1_WGMXCC1_WGMXCCG0
    SolutionIndex: 103
    SolutionNameMin: Cijk_Alik_Bljk_BBS_BH_UserArgs_MT64x128x128_MI16x16x1_SN_LDSB1_AFC0_AFEM1_AFEM1_ASEM1_CLR1_CADS0_DTVA0_DTVB0_EPS0_FDSI0_GRPM1_GRVWA8_GRVWB8_GSU1_GSUAMB_GSUC0_GSUWGMRR0_GLS0_ISA942_IU1_K1_LBSPPA1024_LBSPPB1024_LBSPPM0_LPA16_LPB16_LPM0_LRVW8_LWPMn1_MIAV0_MIWT4_4_MO40_NTn1_NTA0_NTB0_NTC0_NTD4_NTM0_NEPBS16_NLCA1_NLCB1_ONLL1_PGR2_PLR1_PKA1_SIA3_SS1_SU16_SUM1_SUS256_SPO0_SRVW0_SSO0_SVW4_SK0_SKXCCM0_TLDS1_ULSGRO0_USL1_UIOFGRO0_USFGROn1_VSn1_VWA4_VWB4_WSGRA1_WSGRB1_WS64_WG16_8_2_WGM1_WGMXCC1_WGMXCCG0
    SolutionIndex: 104
    SolutionNameMin: Cijk_Alik_Bljk_BBS_BH_UserArgs_MT256x160x64_MI16x16x1_SN_LDSB1_AFC0_AFEM1_AFEM1_ASEM1_CLR1_CADS0_DTVA0_DTVB0_EPS0_FDSI0_GRPM1_GRVWA8_GRVWB8_GSU1_GSUAMB_GSUC0_GSUWGMRR0_GLS0_ISA942_IU1_K1_LBSPPA1024_LBSPPB128_LBSPPM0_LPA16_LPB16_LPM0_LRVW8_LWPMn1_MIAV0_MIWT8_5_MO40_NTn1_NTA0_NTB0_NTC0_NTD4_NTM0_NEPBS16_NLCA1_NLCB1_ONLL1_PGR2_PLR1_PKA1_SIA3_SS1_SU16_SUM1_SUS128_SPO0_SRVW0_SSO0_SVW8_SK0_SKXCCM0_TLDS1_ULSGRO0_USL1_UIOFGRO0_USFGROn1_VSn1_VWA8_VWB1_WSGRA1_WSGRB1_WS64_WG32_8_1_WGM1_WGMXCC1_WGMXCCG0
    SolutionIndex: 105
    SolutionNameMin: Cijk_Alik_Bljk_BBS_BH_UserArgs_MT256x224x64_MI16x16x1_SN_LDSB1_AFC0_AFEM1_AFEM1_ASEM1_CLR1_CADS0_DTVA0_DTVB0_EPS0_FDSI0_GRPM1_GRVWA2_GRVWB2_GSU1_GSUAMB_GSUC0_GSUWGMRR0_GLS0_ISA942_IU1_K1_LBSPPA1024_LBSPPB128_LBSPPM0_LPA4_LPB4_LPM0_LRVW4_LWPMn1_MIAV0_MIWT8_7_MO40_NTn1_NTA0_NTB0_NTC0_NTD4_NTM0_NEPBS16_NLCA1_NLCB1_ONLL1_PGR2_PLR1_PKA1_SIA3_SS1_SU8_SUM0_SUS128_SPO0_SRVW0_SSO0_SVW8_SK0_SKXCCM0_TLDS1_ULSGRO0_USL1_UIOFGRO0_USFGROn1_VSn1_VWA8_VWB1_WSGRA1_WSGRB1_WS64_WG32_8_1_WGM1_WGMXCC1_WGMXCCG0
    SolutionIndex: 106
    SolutionNameMin: Cijk_Alik_Bljk_BBS_BH_UserArgs_MT160x320x64_MI16x16x1_SN_LDSB1_AFC0_AFEM1_AFEM1_ASEM1_CLR1_CADS0_DTVA0_DTVB0_EPS0_FDSI0_GRPM1_GRVWA2_GRVWB2_GSU1_GSUAMB_GSUC0_GSUWGMRR0_GLS0_ISA942_IU1_K1_LBSPPA256_LBSPPB128_LBSPPM0_LPA4_LPB4_LPM0_LRVW4_LWPMn1_MIAV0_MIWT10_5_MO40_NTn1_NTA0_NTB0_NTC0_NTD4_NTM0_NEPBS16_NLCA1_NLCB1_ONLL1_PGR2_PLR1_PKA1_SIA3_SS1_SU8_SUM0_SUS128_SPO0_SRVW0_SSO0_SVW2_SK0_SKXCCM0_TLDS1_ULSGRO0_USL1_UIOFGRO0_USFGROn1_VSn1_VWA2_VWB1_WSGRA1_WSGRB1_WS64_WG16_16_1_WGM1_WGMXCC1_WGMXCCG0
    SolutionIndex: 107
    SolutionNameMin: Cijk_Alik_Bljk_BBS_BH_UserArgs_MT192x160x64_MI16x16x1_SN_LDSB1_AFC0_AFEM1_AFEM1_ASEM1_CLR1_CADS0_DTVA0_DTVB0_EPS0_FDSI0_GRPM1_GRVWA8_GRVWB8_GSU1_GSUAMB_GSUC0_GSUWGMRR0_GLS0_ISA942_IU1_K1_LBSPPA256_LBSPPB128_LBSPPM0_LPA16_LPB16_LPM0_LRVW8_LWPMn1_MIAV0_MIWT6_5_MO40_NTn1_NTA0_NTB0_NTC0_NTD4_NTM0_NEPBS16_NLCA1_NLCB1_ONLL1_PGR2_PLR1_PKA1_SIA3_SS1_SU8_SUM0_SUS128_SPO0_SRVW0_SSO0_SVW2_SK0_SKXCCM0_TLDS1_ULSGRO0_USL1_UIOFGRO0_USFGROn1_VSn1_VWA2_VWB1_WSGRA1_WSGRB1_WS64_WG32_8_1_WGM6_WGMXCC8_WGMXCCG304
    SolutionIndex: 108
    SolutionNameMin: Cijk_Alik_Bljk_BBS_BH_UserArgs_MT128x64x128_MI16x16x1_SN_LDSB1_AFC0_AFEM1_AFEM1_ASEM1_CLR1_CADS0_DTVA0_DTVB0_EPS0_FDSI0_GRPM1_GRVWA8_GRVWB8_GSU1_GSUAMB_GSUC0_GSUWGMRR0_GLS0_ISA942_IU1_K1_LBSPPA1024_LBSPPB1024_LBSPPM0_LPA16_LPB16_LPM0_LRVW8_LWPMn1_MIAV0_MIWT4_4_MO40_NTn1_NTA0_NTB0_NTC0_NTD7_NTM0_NEPBS8_NLCA1_NLCB1_ONLL1_PGR2_PLR1_PKA1_SIA3_SS1_SU16_SUM1_SUS256_SPO0_SRVW0_SSO0_SVW4_SK0_SKXCCM0_TLDS1_ULSGRO1_USL1_UIOFGRO0_USFGROn1_VSn1_VWA4_VWB4_WSGRA0_WSGRB0_WS64_WG32_4_2_WGM1_WGMXCC1_WGMXCCG304
    SolutionIndex: 109
    SolutionNameMin: Cijk_Alik_Bljk_BBS_BH_UserArgs_MT128x128x64_MI16x16x1_SN_LDSB1_AFC0_AFEM1_AFEM1_ASEM1_CLR1_CADS0_DTVA0_DTVB0_EPS0_FDSI0_GRPM1_GRVWA8_GRVWB8_GSU1_GSUAMB_GSUC0_GSUWGMRR0_GLS0_ISA942_IU1_K1_LBSPPA512_LBSPPB512_LBSPPM0_LPA16_LPB16_LPM0_LRVW8_LWPMn1_MIAV0_MIWT4_4_MO40_NTn1_NTA0_NTB0_NTC0_NTD7_NTM0_NEPBS8_NLCA1_NLCB1_ONLL1_PGR2_PLR1_PKA1_SIA3_SS1_SU16_SUM0_SUS256_SPO0_SRVW0_SSO0_SVW4_SK0_SKXCCM0_TLDS1_ULSGRO1_USL1_UIOFGRO0_USFGROn1_VSn1_VWA4_VWB4_WSGRA0_WSGRB0_WS64_WG32_8_1_WGM1_WGMXCC8_WGMXCCG304
    SolutionIndex: 110
    SolutionNameMin: Cijk_Alik_Bljk_BBS_BH_UserArgs_MT64x64x128_MI16x16x1_SN_LDSB1_AFC0_AFEM1_AFEM1_ASEM1_CLR1_CADS0_DTVA0_DTVB0_EPS0_FDSI0_GRPM1_GRVWA8_GRVWB8_GSU1_GSUAMB_GSUC0_GSUWGMRR0_GLS0_ISA942_IU1_K1_LBSPPA1024_LBSPPB512_LBSPPM0_LPA16_LPB16_LPM0_LRVW8_LWPMn1_MIAV0_MIWT4_2_MO40_NTn1_NTA0_NTB0_NTC0_NTD7_NTM0_NEPBS8_NLCA1_NLCB1_ONLL1_PGR2_PLR1_PKA1_SIA3_SS1_SU16_SUM0_SUS256_SPO0_SRVW0_SSO0_SVW4_SK0_SKXCCM0_TLDS1_ULSGRO1_USL1_UIOFGRO0_USFGROn1_VSn1_VWA4_VWB2_WSGRA0_WSGRB0_WS64_WG16_8_2_WGM4_WGMXCC8_WGMXCCG304
    SolutionIndex: 111
    SolutionNameMin: Cijk_Alik_Bljk_BBS_BH_UserArgs_MT256x128x64_MI16x16x1_SN_LDSB1_AFC0_AFEM1_AFEM1_ASEM1_CLR1_CADS0_DTVA0_DTVB0_EPS0_FDSI0_GRPM1_GRVWA8_GRVWB8_GSU1_GSUAMB_GSUC0_GSUWGMRR0_GLS0_ISA942_IU1_K1_LBSPPA512_LBSPPB1024_LBSPPM0_LPA16_LPB16_LPM0_LRVW8_LWPMn1_MIAV0_MIWT4_8_MO40_NTn1_NTA0_NTB0_NTC0_NTD7_NTM0_NEPBS8_NLCA1_NLCB1_ONLL1_PGR2_PLR1_PKA1_SIA3_SS1_SU16_SUM0_SUS128_SPO0_SRVW0_SSO0_SVW4_SK0_SKXCCM0_TLDS1_ULSGRO1_USL1_UIOFGRO0_USFGROn1_VSn1_VWA4_VWB8_WSGRA0_WSGRB0_WS64_WG64_4_1_WGM8_WGMXCC8_WGMXCCG304
    SolutionIndex: 112
    SolutionNameMin: Cijk_Alik_Bljk_BBS_BH_UserArgs_MT256x128x64_MI16x16x1_SN_LDSB1_AFC0_AFEM1_AFEM1_ASEM1_CLR1_CADS0_DTVA0_DTVB0_EPS0_FDSI0_GRPM1_GRVWA8_GRVWB8_GSU1_GSUAMB_GSUC0_GSUWGMRR0_GLS0_ISA942_IU1_K1_LBSPPA1024_LBSPPB512_LBSPPM0_LPA16_LPB16_LPM0_LRVW8_LWPMn1_MIAV0_MIWT8_4_MO40_NTn1_NTA0_NTB0_NTC0_NTD7_NTM0_NEPBS8_NLCA1_NLCB1_ONLL1_PGR2_PLR1_PKA1_SIA3_SS1_SU16_SUM1_SUS256_SPO0_SRVW0_SSO0_SVW8_SK0_SKXCCM0_TLDS1_ULSGRO1_USL1_UIOFGRO0_USFGROn1_VSn1_VWA8_VWB4_WSGRA0_WSGRB0_WS64_WG32_8_1_WGM1_WGMXCC8_WGMXCCG304
    SolutionIndex: 113
    SolutionNameMin: Cijk_Alik_Bljk_BBS_BH_UserArgs_MT64x64x64_MI16x16x1_SN_LDSB1_AFC0_AFEM1_AFEM1_ASEM1_CLR1_CADS0_DTVA0_DTVB0_EPS0_FDSI0_GRPM1_GRVWA8_GRVWB8_GSU1_GSUAMB_GSUC0_GSUWGMRR0_GLS0_ISA942_IU1_K1_LBSPPA256_LBSPPB256_LBSPPM0_LPA16_LPB16_LPM0_LRVW8_LWPMn1_MIAV0_MIWT2_2_MO40_NTn1_NTA0_NTB0_NTC0_NTD7_NTM0_NEPBS8_NLCA1_NLCB1_ONLL1_PGR2_PLR1_PKA1_SIA3_SS1_SU16_SUM0_SUS128_SPO0_SRVW0_SSO0_SVW2_SK0_SKXCCM0_TLDS1_ULSGRO1_USL1_UIOFGRO0_USFGROn1_VSn1_VWA2_VWB2_WSGRA0_WSGRB0_WS64_WG32_8_1_WGM4_WGMXCC8_WGMXCCG304
    SolutionIndex: 114
    SolutionNameMin: Cijk_Alik_Bljk_BBS_BH_UserArgs_MT256x224x64_MI16x16x1_SN_LDSB1_AFC0_AFEM1_AFEM1_ASEM1_CLR1_CADS0_DTVA0_DTVB0_EPS0_FDSI0_GRPM1_GRVWA2_GRVWB2_GSU1_GSUAMB_GSUC0_GSUWGMRR0_GLS0_ISA942_IU1_K1_LBSPPA1024_LBSPPB128_LBSPPM0_LPA4_LPB4_LPM0_LRVW4_LWPMn1_MIAV0_MIWT8_7_MO40_NTn1_NTA0_NTB0_NTC0_NTD0_NTM0_NEPBS16_NLCA1_NLCB1_ONLL1_PGR2_PLR1_PKA1_SIA3_SS1_SU8_SUM1_SUS256_SPO0_SRVW0_SSO0_SVW8_SK0_SKXCCM0_TLDS1_ULSGRO0_USL1_UIOFGRO0_USFGROn1_VSn1_VWA8_VWB1_WSGRA0_WSGRB0_WS64_WG32_8_1_WGM32_WGMXCC1_WGMXCCGn1
    SolutionIndex: 115
    SolutionNameMin: Cijk_Alik_Bljk_BBS_BH_UserArgs_MT256x192x64_MI16x16x1_SN_LDSB1_AFC0_AFEM8_AFEM8_ASEM32_CLR1_CADS0_DTVA0_DTVB0_EPS0_FDSI0_GRPM1_GRVWA8_GRVWB8_GSU1_GSUAMB_GSUC0_GSUWGMRR0_GLS0_ISA942_IU1_K1_LBSPPA1024_LBSPPB256_LBSPPM0_LPA16_LPB16_LPM0_LRVW8_LWPMn1_MIAV0_MIWT8_6_MO40_NTn1_NTA0_NTB0_NTC0_NTD0_NTM0_NEPBS0_NLCA1_NLCB1_ONLL0_PGR2_PLR1_PKA1_SIA3_SS1_SU32_SUM1_SUS256_SPO0_SRVW0_SSO0_SVW8_SK0_SKXCCM0_TLDS1_ULSGRO0_USL1_UIOFGRO0_USFGROn1_VSn1_VWA8_VWB2_WSGRA0_WSGRB0_WS64_WG32_8_1_WGM16_WGMXCC1_WGMXCCGn1
    SolutionIndex: 116
    SolutionNameMin: Cijk_Alik_Bljk_BBS_BH_UserArgs_MT256x256x32_MI16x16x1_SN_LDSB1_AFC0_AFEM1_AFEM1_ASEM1_CLR1_CADS0_DTVA0_DTVB0_EPS0_FDSI0_GRPM1_GRVWA4_GRVWB4_GSU1_GSUAMB_GSUC0_GSUWGMRR0_GLS0_ISA942_IU1_K1_LBSPPA512_LBSPPB512_LBSPPM0_LPA4_LPB4_LPM0_LRVW4_LWPMn1_MIAV0_MIWT8_8_MO40_NTn1_NTA0_NTB0_NTC0_NTD5_NTM0_NEPBS0_NLCA1_NLCB1_ONLL0_PGR2_PLR1_PKA1_SIA3_SS1_SU8_SUM0_SUS128_SPO0_SRVW0_SSO0_SVW8_SK0_SKXCCM0_TLDS1_ULSGRO0_USL1_UIOFGRO0_USFGRO1_VSn1_VWA8_VWB8_WSGRA2_WSGRB0_WS64_WG32_8_1_WGM95_WGMXCC4_WGMXCCGn1
    SolutionIndex: 117
    SolutionNameMin: Cijk_Alik_Bljk_BBS_BH_UserArgs_MT128x80x128_MI16x16x1_SN_LDSB1_AFC0_AFEM1_AFEM1_ASEM128_CLR1_CADS0_DTVA0_DTVB0_EPS0_FDSI0_GRPM0p80_GRVWA8_GRVWB8_GSU1_GSUAMBSK_GSUC0_GSUWGMRR1_GLS0_ISA942_IU1_K1_LBSPPA512_LBSPPB256_LBSPPM0_LPA16_LPB16_LPM0_LRVW8_LWPM0p30_MIAV0_MIWT2_5_MO40_NTn1_NTA1_NTB0_NTC7_NTD4_NTM0_NEPBS0_NLCA1_NLCB1_ONLL0_PGR2_PLR1_PKA1_SIA3_SS1_SU2_SUM1_SUS1024_SPO0_SRVW0_SSO0_SVW2_SK0_SKXCCM0_TLDS1_ULSGRO1_USL1_UIOFGRO0_USFGRO1_VSn1_VWA2_VWB1_WSGRA0_WSGRB0_WS64_WG64_4_1_WGM16_WGMXCC8_WGMXCCGn1
    SolutionIndex: 118
    SolutionNameMin: Cijk_Alik_Bljk_BBS_BH_UserArgs_MT128x96x128_MI16x16x1_SN_LDSB1_AFC0_AFEM4_AFEM1_ASEM8_CLR1_CADS0_DTVA0_DTVB0_EPS0_FDSI0_GRPM0p40_GRVWA8_GRVWB8_GSU2_GSUAMBSK_GSUC0_GSUWGMRR0_GLS0_ISA942_IU1_K1_LBSPPA1024_LBSPPB256_LBSPPM0_LPA16_LPB16_LPM0_LRVW8_LWPM0p30_MIAV0_MIWT4_3_MO40_NTn1_NTA2_NTB0_NTC1_NTD3_NTM0_NEPBS0_NLCA1_NLCB1_ONLL0_PGR2_PLR1_PKA1_SIA3_SS1_SU4_SUM0_SUS1024_SPO1_SRVW0_SSO0_SVW4_SK0_SKXCCM0_TLDS2_ULSGRO1_USL1_UIOFGRO0_USFGROn1_VSn1_VWA4_VWB1_WSGRA0_WSGRB1_WS64_WG32_8_1_WGM1_WGMXCC2_WGMXCCG266
    SolutionIndex: 119
    SolutionNameMin: Cijk_Alik_Bljk_BBS_BH_UserArgs_MT256x224x64_MI16x16x1_SN_LDSB1_AFC0_AFEM16_AFEM1_ASEM1_CLR1_CADS0_DTVA0_DTVB0_EPS0_FDSI0_GRPM1_GRVWA4_GRVWB4_GSU1_GSUAMB_GSUC0_GSUWGMRR0_GLS0_ISA942_IU1_K1_LBSPPA1024_LBSPPB128_LBSPPM0_LPA4_LPB4_LPM0_LRVW4_LWPMn1_MIAV0_MIWT8_7_MO40_NTn1_NTA1_NTB0_NTC0_NTD4_NTM0_NEPBS0_NLCA1_NLCB1_ONLL0_PGR2_PLR1_PKA1_SIA3_SS1_SU8_SUM0_SUS128_SPO1_SRVW0_SSO1_SVW8_SK0_SKXCCM0_TLDS1_ULSGRO1_USL1_UIOFGRO0_USFGROn1_VSn1_VWA8_VWB1_WSGRA0_WSGRB0_WS64_WG32_8_1_WGM6_WGMXCC8_WGMXCCG304
    SolutionIndex: 120
    SolutionNameMin: Cijk_Alik_Bljk_BBS_BH_UserArgs_MT192x192x64_MI16x16x1_SN_LDSB1_AFC0_AFEM2_AFEM4_ASEM8_CLR1_CADS0_DTVA0_DTVB0_EPS0_FDSI0_GRPM1_GRVWA8_GRVWB8_GSU1_GSUAMB_GSUC0_GSUWGMRR1_GLS0_ISA942_IU1_K1_LBSPPA256_LBSPPB256_LBSPPM0_LPA16_LPB16_LPM0_LRVW8_LWPMn1_MIAV0_MIWT6_6_MO40_NTn1_NTA0_NTB0_NTC0_NTD0_NTM0_NEPBS0_NLCA1_NLCB1_ONLL0_PGR2_PLR1_PKA1_SIA3_SS1_SU4_SUM0_SUS512_SPO0_SRVW0_SSO0_SVW2_SK0_SKXCCM0_TLDS2_ULSGRO1_USL1_UIOFGRO0_USFGRO1_VSn1_VWA2_VWB2_WSGRA1_WSGRB0_WS64_WG32_8_1_WGM2_WGMXCC8_WGMXCCGn1
    SolutionIndex: 121
    SolutionNameMin: Cijk_Alik_Bljk_BBS_BH_UserArgs_MT160x128x64_MI16x16x1_SN_LDSB1_AFC0_AFEM1_AFEM1_ASEM1_CLR1_CADS0_DTVA0_DTVB0_EPS0_FDSI0_GRPM0p80_GRVWA8_GRVWB8_GSU1_GSUAMB_GSUC1_GSUWGMRR0_GLS0_ISA942_IU1_K1_LBSPPA128_LBSPPB512_LBSPPM0_LPA16_LPB16_LPM0_LRVW8_LWPMn1_MIAV0_MIWT5_4_MO40_NTn1_NTA1_NTB4_NTC3_NTD1_NTM0_NEPBS0_NLCA1_NLCB1_ONLL0_PGR2_PLR1_PKA1_SIA3_SS0_SU64_SUM1_SUS128_SPO0_SRVW0_SSO0_SVW4_SK0_SKXCCM0_TLDS1_ULSGRO0_USL1_UIOFGRO0_USFGRO1_VSn1_VWA1_VWB4_WSGRA0_WSGRB0_WS64_WG32_8_1_WGM2_WGMXCC8_WGMXCCG0
    SolutionIndex: 122
    SolutionNameMin: Cijk_Alik_Bljk_BBS_BH_UserArgs_MT128x256x64_MI16x16x1_SN_LDSB1_AFC0_AFEM4_AFEM1_ASEM32_CLR1_CADS0_DTVA0_DTVB0_EPS0_FDSI0_GRPM0p27_GRVWA8_GRVWB8_GSU1_GSUAMBSK_GSUC0_GSUWGMRR0_GLS0_ISA942_IU1_K1_LBSPPA1024_LBSPPB512_LBSPPM0_LPA16_LPB16_LPM0_LRVW8_LWPMn1_MIAV0_MIWT8_4_MO40_NTn1_NTA0_NTB0_NTC0_NTD6_NTM0_NEPBS0_NLCA1_NLCB1_ONLL0_PGR2_PLR1_PKA1_SIA3_SS1_SU4_SUM1_SUS512_SPO1_SRVW0_SSO0_SVW8_SK0_SKXCCM0_TLDS2_ULSGRO1_USL1_UIOFGRO0_USFGRO1_VSn1_VWA8_VWB4_WSGRA2_WSGRB2_WS64_WG16_16_1_WGM1_WGMXCC1_WGMXCCG152
    SolutionIndex: 123
    SolutionNameMin: Cijk_Alik_Bljk_BBS_BH_UserArgs_MT256x224x64_MI16x16x1_SN_LDSB1_AFC0_AFEM1_AFEM1_ASEM1_CLR1_CADS0_DTVA0_DTVB0_EPS0_FDSI0_GRPM1_GRVWA4_GRVWB4_GSU1_GSUAMB_GSUC0_GSUWGMRR1_GLS0_ISA942_IU1_K1_LBSPPA1024_LBSPPB128_LBSPPM0_LPA4_LPB4_LPM0_LRVW4_LWPMn1_MIAV0_MIWT8_7_MO40_NTn1_NTA0_NTB0_NTC0_NTD4_NTM0_NEPBS0_NLCA1_NLCB1_ONLL1_PGR2_PLR1_PKA1_SIA3_SS1_SU8_SUM0_SUS128_SPO0_SRVW0_SSO0_SVW8_SK0_SKXCCM0_TLDS1_ULSGRO1_USL1_UIOFGRO0_USFGRO1_VSn1_VWA8_VWB1_WSGRA1_WSGRB2_WS64_WG32_8_1_WGM1_WGMXCC1_WGMXCCG0
    SolutionIndex: 124
    SolutionNameMin: Cijk_Alik_Bljk_BBS_BH_UserArgs_MT128x256x32_MI16x16x1_SN_LDSB1_AFC0_AFEM1_AFEM1_ASEM1_CLR1_CADS0_DTVA0_DTVB0_EPS0_FDSI0_GRPM1_GRVWA4_GRVWB4_GSU1_GSUAMBSK_GSUC0_GSUWGMRR0_GLS0_ISA942_IU1_K1_LBSPPA512_LBSPPB256_LBSPPM0_LPA4_LPB4_LPM0_LRVW4_LWPMn1_MIAV0_MIWT8_4_MO40_NTn1_NTA0_NTB0_NTC0_NTD0_NTM0_NEPBS16_NLCA1_NLCB1_ONLL1_PGR2_PLR1_PKA1_SIA3_SS1_SU16_SUM1_SUS64_SPO0_SRVW0_SSO0_SVW8_SK0_SKXCCM0_TLDS1_ULSGRO0_USL1_UIOFGRO0_USFGROn1_VSn1_VWA8_VWB4_WSGRA0_WSGRB0_WS64_WG16_16_1_WGM8_WGMXCC8_WGMXCCG304
    SolutionIndex: 125
    SolutionNameMin: Cijk_Alik_Bljk_BBS_BH_UserArgs_MT192x128x32_MI16x16x1_SN_LDSB1_AFC0_AFEM1_AFEM1_ASEM1_CLR1_CADS0_DTVA0_DTVB0_EPS0_FDSI0_GRPM1_GRVWA4_GRVWB4_GSU1_GSUAMB_GSUC0_GSUWGMRR0_GLS0_ISA942_IU1_K1_LBSPPA128_LBSPPB256_LBSPPM0_LPA4_LPB4_LPM0_LRVW4_LWPMn1_MIAV0_MIWT6_4_MO40_NTn1_NTA0_NTB0_NTC0_NTD0_NTM0_NEPBS16_NLCA1_NLCB1_ONLL1_PGR2_PLR1_PKA1_SIA3_SS1_SU8_SUM1_SUS64_SPO0_SRVW0_SSO0_SVW2_SK0_SKXCCM0_TLDS1_ULSGRO0_USL1_UIOFGRO0_USFGROn1_VSn1_VWA2_VWB4_WSGRA0_WSGRB0_WS64_WG32_8_1_WGM1_WGMXCC8_WGMXCCG304
    SolutionIndex: 126
    SolutionNameMin: Cijk_Alik_Bljk_BBS_BH_UserArgs_MT128x64x64_MI16x16x1_SN_LDSB1_AFC0_AFEM1_AFEM1_ASEM1_CLR1_CADS0_DTVA0_DTVB0_EPS0_FDSI0_GRPM1_GRVWA8_GRVWB8_GSU1_GSUAMBSK_GSUC0_GSUWGMRR0_GLS0_ISA942_IU1_K1_LBSPPA512_LBSPPB256_LBSPPM0_LPA16_LPB16_LPM0_LRVW8_LWPMn1_MIAV0_MIWT4_2_MO40_NTn1_NTA0_NTB0_NTC0_NTD0_NTM0_NEPBS16_NLCA1_NLCB1_ONLL1_PGR2_PLR1_PKA1_SIA3_SS1_SU0_SUM1_SUS0_SPO0_SRVW0_SSO0_SVW4_SK0_SKXCCM0_TLDS1_ULSGRO0_USL1_UIOFGRO0_USFGROn1_VSn1_VWA4_VWB2_WSGRA0_WSGRB0_WS64_WG32_8_1_WGM1_WGMXCC8_WGMXCCG304
    SolutionIndex: 127
    SolutionNameMin: Cijk_Alik_Bljk_BBS_BH_UserArgs_MT256x192x64_MI16x16x1_SN_LDSB1_AFC0_AFEM1_AFEM1_ASEM1_CLR1_CADS0_DTVA0_DTVB0_EPS0_FDSI0_GRPM0p25_GRVWA8_GRVWB8_GSU1_GSUAMB_GSUC1_GSUWGMRR1_GLS0_ISA942_IU1_K1_LBSPPA1024_LBSPPB256_LBSPPM0_LPA16_LPB16_LPM0_LRVW8_LWPMn1_MIAV0_MIWT8_6_MO40_NTn1_NTA0_NTB4_NTC0_NTD4_NTM0_NEPBS0_NLCA1_NLCB1_ONLL2_PGR2_PLR1_PKA1_SIA3_SS1_SU32_SUM1_SUS128_SPO0_SRVW0_SSO0_SVW8_SK0_SKXCCM0_TLDS2_ULSGRO0_USL1_UIOFGRO0_USFGROn1_VSn1_VWA8_VWB2_WSGRA2_WSGRB0_WS64_WG32_8_1_WGM133_WGMXCC1_WGMXCCGn1
    SolutionIndex: 128
    SolutionNameMin: Cijk_Alik_Bljk_BBS_BH_UserArgs_MT64x80x128_MI16x16x1_SN_LDSB1_AFC0_AFEM1_AFEM1_ASEM1_CLR1_CADS0_DTVA0_DTVB0_EPS0_FDSI0_GRPM0p30_GRVWA8_GRVWB8_GSU1_GSUAMB_GSUC0_GSUWGMRR1_GLS0_ISA942_IU1_K1_LBSPPA256_LBSPPB256_LBSPPM0_LPA16_LPB16_LPM0_LRVW8_LWPM1_MIAV0_MIWT1_5_MO40_NTn1_NTA0_NTB0_NTC0_NTD4_NTM0_NEPBS0_NLCA1_NLCB1_ONLL1_PGR2_PLR1_PKA1_SIA3_SS1_SU4_SUM0_SUS1024_SPO0_SRVW0_SSO0_SVW1_SK0_SKXCCM0_TLDS2_ULSGRO0_USL1_UIOFGRO0_USFGROn1_VSn1_VWA1_VWB1_WSGRA2_WSGRB0_WS64_WG64_4_1_WGM1_WGMXCC8_WGMXCCG0
    SolutionIndex: 129
    SolutionNameMin: Cijk_Alik_Bljk_BBS_BH_UserArgs_MT64x16x64_MI16x16x1_SN_LDSB1_AFC0_AFEM1_AFEM1_ASEM1_CLR1_CADS0_DTVA0_DTVB0_EPS0_FDSI0_GRPM0p80_GRVWA8_GRVWB8_GSU1_GSUAMB_GSUC0_GSUWGMRR1_GLS0_ISA942_IU1_K1_LBSPPA256_LBSPPB128_LBSPPM0_LPA16_LPB16_LPM0_LRVW8_LWPM0p27_MIAV0_MIWT2_1_MO40_NTn1_NTA0_NTB0_NTC7_NTD7_NTM0_NEPBS8_NLCA1_NLCB1_ONLL1_PGR2_PLR1_PKA1_SIA3_SS1_SU4_SUM4_SUS128_SPO1_SRVW0_SSO0_SVW2_SK0_SKXCCM0_TLDS1_ULSGRO0_USL1_UIOFGRO0_USFGRO1_VSn1_VWA2_VWB1_WSGRA0_WSGRB0_WS64_WG32_4_1_WGM1_WGMXCC8_WGMXCCG0
    SolutionIndex: 130
    SolutionNameMin: Cijk_Alik_Bljk_BBS_BH_UserArgs_MT192x128x64_MI16x16x1_SN_LDSB1_AFC0_AFEM1_AFEM1_ASEM1_CLR1_CADS0_DTVA0_DTVB0_EPS0_FDSI0_GRPM0p26_GRVWA8_GRVWB8_GSU1_GSUAMB_GSUC1_GSUWGMRR0_GLS0_ISA942_IU1_K1_LBSPPA256_LBSPPB512_LBSPPM0_LPA16_LPB16_LPM0_LRVW8_LWPMn1_MIAV0_MIWT6_4_MO40_NTn1_NTA0_NTB0_NTC4_NTD7_NTM0_NEPBS0_NLCA1_NLCB1_ONLL0_PGR2_PLR1_PKA1_SIA3_SS1_SU8_SUM1_SUS128_SPO0_SRVW0_SSO0_SVW2_SK0_SKXCCM0_TLDS1_ULSGRO1_USL1_UIOFGRO0_USFGROn1_VSn1_VWA2_VWB4_WSGRA2_WSGRB0_WS64_WG32_8_1_WGM2_WGMXCC4_WGMXCCGn1
    SolutionIndex: 131
    SolutionNameMin: Cijk_Alik_Bljk_BBS_BH_UserArgs_MT256x160x64_MI16x16x1_SN_LDSB1_AFC0_AFEM1_AFEM1_ASEM1_CLR1_CADS0_DTVA0_DTVB0_EPS0_FDSI0_GRPM1_GRVWA8_GRVWB8_GSU1_GSUAMB_GSUC0_GSUWGMRR0_GLS0_ISA942_IU1_K1_LBSPPA1024_LBSPPB128_LBSPPM0_LPA16_LPB16_LPM0_LRVW8_LWPMn1_MIAV0_MIWT8_5_MO40_NTn1_NTA0_NTB0_NTC4_NTD7_NTM0_NEPBS0_NLCA1_NLCB1_ONLL1_PGR2_PLR1_PKA1_SIA3_SS1_SU32_SUM1_SUS256_SPO0_SRVW0_SSO0_SVW8_SK0_SKXCCM0_TLDS1_ULSGRO0_USL1_UIOFGRO0_USFGROn1_VSn1_VWA8_VWB1_WSGRA0_WSGRB0_WS64_WG32_8_1_WGM1_WGMXCC4_WGMXCCG0
    SolutionIndex: 132
    SolutionNameMin: Cijk_Alik_Bljk_BBS_BH_UserArgs_MT128x160x64_MI16x16x1_SN_LDSB1_AFC0_AFEM1_AFEM1_ASEM1_CLR1_CADS0_DTVA0_DTVB0_EPS0_FDSI0_GRPM0p50_GRVWA8_GRVWB8_GSU1_GSUAMB_GSUC0_GSUWGMRR0_GLS0_ISA942_IU1_K1_LBSPPA512_LBSPPB128_LBSPPM0_LPA16_LPB16_LPM0_LRVW8_LWPMn1_MIAV0_MIWT4_5_MO40_NTn1_NTA0_NTB0_NTC0_NTD4_NTM0_NEPBS0_NLCA1_NLCB1_ONLL0_PGR2_PLR1_PKA1_SIA3_SS1_SU8_SUM1_SUS128_SPO0_SRVW0_SSO0_SVW4_SK0_SKXCCM0_TLDS1_ULSGRO1_USL1_UIOFGRO0_USFGRO0_VSn1_VWA4_VWB1_WSGRA1_WSGRB1_WS64_WG32_8_1_WGM4_WGMXCC2_WGMXCCGn1
    SolutionIndex: 133
    SolutionNameMin: Cijk_Alik_Bljk_BBS_BH_UserArgs_MT192x224x64_MI16x16x1_SN_LDSB1_AFC0_AFEM1_AFEM1_ASEM1_CLR1_CADS0_DTVA0_DTVB0_EPS0_FDSI0_GRPM0p26_GRVWA8_GRVWB8_GSU1_GSUAMB_GSUC0_GSUWGMRR0_GLS0_ISA942_IU1_K1_LBSPPA256_LBSPPB128_LBSPPM0_LPA16_LPB16_LPM0_LRVW8_LWPMn1_MIAV0_MIWT6_7_MO40_NTn1_NTA0_NTB0_NTC7_NTD4_NTM0_NEPBS0_NLCA1_NLCB1_ONLL1_PGR2_PLR1_PKA1_SIA3_SS1_SU8_SUM1_SUS1024_SPO0_SRVW0_SSO0_SVW2_SK0_SKXCCM0_TLDS1_ULSGRO0_USL1_UIOFGRO0_USFGROn1_VSn1_VWA2_VWB1_WSGRA1_WSGRB1_WS64_WG32_8_1_WGM8_WGMXCC1_WGMXCCGn1
    SolutionIndex: 134
    SolutionNameMin: Cijk_Alik_Bljk_BBS_BH_UserArgs_MT256x160x64_MI16x16x1_SN_LDSB1_AFC0_AFEM1_AFEM1_ASEM1_CLR1_CADS0_DTVA0_DTVB0_EPS0_FDSI0_GRPM1_GRVWA8_GRVWB8_GSU1_GSUAMB_GSUC0_GSUWGMRR0_GLS0_ISA942_IU1_K1_LBSPPA1024_LBSPPB128_LBSPPM0_LPA16_LPB16_LPM0_LRVW8_LWPMn1_MIAV0_MIWT8_5_MO40_NTn1_NTA0_NTB0_NTC0_NTD4_NTM0_NEPBS0_NLCA1_NLCB1_ONLL1_PGR2_PLR1_PKA1_SIA3_SS1_SU8_SUM1_SUS128_SPO0_SRVW0_SSO0_SVW8_SK0_SKXCCM0_TLDS1_ULSGRO0_USL1_UIOFGRO0_USFGROn1_VSn1_VWA8_VWB1_WSGRA1_WSGRB0_WS64_WG32_8_1_WGM12_WGMXCC8_WGMXCCG0
    SolutionIndex: 135
    SolutionNameMin: Cijk_Alik_Bljk_BBS_BH_UserArgs_MT128x80x128_MI16x16x1_SN_LDSB1_AFC0_AFEM1_AFEM1_ASEM1_CLR1_CADS0_DTVA0_DTVB0_EPS0_FDSI0_GRPM0p80_GRVWA8_GRVWB8_GSU1_GSUAMB_GSUC0_GSUWGMRR1_GLS0_ISA942_IU1_K1_LBSPPA512_LBSPPB256_LBSPPM0_LPA16_LPB16_LPM0_LRVW8_LWPMn1_MIAV0_MIWT2_5_MO40_NTn1_NTA0_NTB0_NTC4_NTD4_NTM0_NEPBS0_NLCA1_NLCB1_ONLL0_PGR2_PLR1_PKA1_SIA3_SS1_SU4_SUM1_SUS256_SPO0_SRVW0_SSO0_SVW2_SK0_SKXCCM0_TLDS2_ULSGRO0_USL1_UIOFGRO0_USFGROn1_VSn1_VWA2_VWB1_WSGRA0_WSGRB0_WS64_WG64_4_1_WGM2_WGMXCC4_WGMXCCG0
    SolutionIndex: 136
    SolutionNameMin: Cijk_Alik_Bljk_BBS_BH_UserArgs_MT64x96x128_MI16x16x1_SN_LDSB1_AFC0_AFEM1_AFEM1_ASEM1_CLR1_CADS0_DTVA0_DTVB0_EPS0_FDSI0_GRPM0p40_GRVWA8_GRVWB8_GSU1_GSUAMBSK_GSUC0_GSUWGMRR0_GLS0_ISA942_IU1_K1_LBSPPA512_LBSPPB256_LBSPPM0_LPA16_LPB16_LPM0_LRVW8_LWPM0p90_MIAV0_MIWT2_3_MO40_NTn1_NTA0_NTB0_NTC4_NTD4_NTM0_NEPBS0_NLCA1_NLCB1_ONLL1_PGR2_PLR1_PKA1_SIA3_SS1_SU2_SUM0_SUS512_SPO0_SRVW0_SSO0_SVW2_SK0_SKXCCM0_TLDS1_ULSGRO0_USL1_UIOFGRO0_USFGRO1_VSn1_VWA2_VWB1_WSGRA0_WSGRB0_WS64_WG32_8_1_WGM1_WGMXCC8_WGMXCCG0
    SolutionIndex: 137
    SolutionNameMin: Cijk_Alik_Bljk_BBS_BH_UserArgs_MT16x32x128_MI16x16x1_SN_LDSB1_AFC0_AFEM1_AFEM1_ASEM1_CLR1_CADS0_DTVA0_DTVB0_EPS0_FDSI0_GRPM0p80_GRVWA8_GRVWB8_GSU1_GSUAMB_GSUC0_GSUWGMRR0_GLS0_ISA942_IU1_K1_LBSPPA256_LBSPPB256_LBSPPM0_LPA16_LPB16_LPM0_LRVW8_LWPM0p27_MIAV0_MIWT1_1_MO40_NTn1_NTA0_NTB0_NTC4_NTD7_NTM0_NEPBS8_NLCA1_NLCB1_ONLL1_PGR2_PLR1_PKA1_SIA3_SS1_SU4_SUM0_SUS256_SPO1_SRVW0_SSO0_SVW1_SK0_SKXCCM0_TLDS2_ULSGRO0_USL1_UIOFGRO0_USFGROn1_VSn1_VWA1_VWB1_WSGRA0_WSGRB0_WS64_WG16_8_1_WGM1_WGMXCC32_WGMXCCG0
    SolutionIndex: 138
    SolutionNameMin: Cijk_Alik_Bljk_BBS_BH_UserArgs_MT256x160x64_MI16x16x1_SN_LDSB1_AFC0_AFEM1_AFEM1_ASEM1_CLR1_CADS0_DTVA0_DTVB0_EPS0_FDSI0_GRPM0p26_GRVWA8_GRVWB8_GSU1_GSUAMB_GSUC0_GSUWGMRR0_GLS0_ISA942_IU1_K1_LBSPPA1024_LBSPPB128_LBSPPM0_LPA16_LPB16_LPM0_LRVW8_LWPMn1_MIAV0_MIWT8_5_MO40_NTn1_NTA0_NTB0_NTC0_NTD4_NTM0_NEPBS0_NLCA1_NLCB1_ONLL0_PGR2_PLR1_PKA1_SIA3_SS1_SU0_SUM1_SUS0_SPO0_SRVW0_SSO0_SVW8_SK0_SKXCCM0_TLDS2_ULSGRO0_USL1_UIOFGRO0_USFGROn1_VSn1_VWA8_VWB1_WSGRA0_WSGRB0_WS64_WG32_8_1_WGM4_WGMXCC2_WGMXCCGn1
    SolutionIndex: 139
    SolutionNameMin: Cijk_Alik_Bljk_BBS_BH_UserArgs_MT256x160x64_MI16x16x1_SN_LDSB1_AFC0_AFEM1_AFEM1_ASEM1_CLR1_CADS0_DTVA0_DTVB0_EPS0_FDSI0_GRPM0p90_GRVWA8_GRVWB8_GSU1_GSUAMB_GSUC1_GSUWGMRR0_GLS0_ISA942_IU1_K1_LBSPPA1024_LBSPPB128_LBSPPM0_LPA16_LPB16_LPM0_LRVW8_LWPMn1_MIAV0_MIWT8_5_MO40_NTn1_NTA0_NTB0_NTC4_NTD4_NTM0_NEPBS0_NLCA1_NLCB1_ONLL1_PGR2_PLR1_PKA1_SIA3_SS1_SU4_SUM1_SUS256_SPO1_SRVW0_SSO0_SVW8_SK0_SKXCCM0_TLDS2_ULSGRO0_USL1_UIOFGRO0_USFGRO0_VSn1_VWA8_VWB1_WSGRA2_WSGRB0_WS64_WG32_8_1_WGM4_WGMXCC1_WGMXCCGn1
    SolutionIndex: 140
    SolutionNameMin: Cijk_Alik_Bljk_BBS_BH_UserArgs_MT128x96x64_MI16x16x1_SN_LDSB1_AFC0_AFEM1_AFEM1_ASEM1_CLR1_CADS0_DTVA0_DTVB0_EPS0_FDSI0_GRPM0p26_GRVWA8_GRVWB8_GSU1_GSUAMB_GSUC0_GSUWGMRR0_GLS0_ISA942_IU1_K1_LBSPPA512_LBSPPB128_LBSPPM0_LPA16_LPB16_LPM0_LRVW8_LWPMn1_MIAV0_MIWT4_3_MO40_NTn1_NTA0_NTB0_NTC0_NTD4_NTM0_NEPBS0_NLCA1_NLCB1_ONLL0_PGR2_PLR1_PKA1_SIA3_SS1_SU16_SUM1_SUS128_SPO0_SRVW0_SSO4_SVW4_SK0_SKXCCM0_TLDS2_ULSGRO1_USL1_UIOFGRO0_USFGROn1_VSn1_VWA4_VWB1_WSGRA0_WSGRB1_WS64_WG32_8_1_WGM8_WGMXCC1_WGMXCCGn1
    SolutionIndex: 141
    SolutionNameMin: Cijk_Alik_Bljk_BBS_BH_UserArgs_MT256x192x64_MI16x16x1_SN_LDSB1_AFC0_AFEM1_AFEM1_ASEM1_CLR1_CADS0_DTVA0_DTVB0_EPS0_FDSI0_GRPM0p90_GRVWA8_GRVWB8_GSU1_GSUAMB_GSUC0_GSUWGMRR0_GLS0_ISA942_IU1_K1_LBSPPA1024_LBSPPB256_LBSPPM0_LPA16_LPB16_LPM0_LRVW8_LWPMn1_MIAV0_MIWT8_6_MO40_NTn1_NTA0_NTB4_NTC0_NTD7_NTM0_NEPBS0_NLCA1_NLCB1_ONLL1_PGR2_PLR1_PKA1_SIA3_SS1_SU2_SUM1_SUS128_SPO0_SRVW0_SSO0_SVW8_SK0_SKXCCM0_TLDS1_ULSGRO0_USL1_UIOFGRO0_USFGROn1_VSn1_VWA8_VWB2_WSGRA0_WSGRB0_WS64_WG32_8_1_WGM1_WGMXCC1_WGMXCCGn1
    SolutionIndex: 142
    SolutionNameMin: Cijk_Alik_Bljk_BBS_BH_UserArgs_MT192x128x64_MI16x16x1_SN_LDSB1_AFC0_AFEM1_AFEM1_ASEM1_CLR1_CADS0_DTVA0_DTVB0_EPS0_FDSI0_GRPM0p80_GRVWA8_GRVWB8_GSU1_GSUAMB_GSUC0_GSUWGMRR1_GLS0_ISA942_IU1_K1_LBSPPA256_LBSPPB512_LBSPPM0_LPA16_LPB16_LPM0_LRVW8_LWPMn1_MIAV0_MIWT6_4_MO40_NTn1_NTA0_NTB0_NTC0_NTD4_NTM0_NEPBS0_NLCA1_NLCB1_ONLL0_PGR2_PLR1_PKA1_SIA3_SS1_SU2_SUM1_SUS128_SPO1_SRVW0_SSO0_SVW2_SK0_SKXCCM0_TLDS1_ULSGRO1_USL1_UIOFGRO0_USFGRO0_VSn1_VWA2_VWB4_WSGRA2_WSGRB2_WS64_WG32_8_1_WGM4_WGMXCC2_WGMXCCGn1
    SolutionIndex: 143
    SolutionNameMin: Cijk_Alik_Bljk_BBS_BH_UserArgs_MT256x224x64_MI16x16x1_SN_LDSB1_AFC0_AFEM1_AFEM1_ASEM1_CLR1_CADS0_DTVA0_DTVB0_EPS0_FDSI0_GRPM0p80_GRVWA4_GRVWB4_GSU1_GSUAMB_GSUC0_GSUWGMRR0_GLS0_ISA942_IU1_K1_LBSPPA1024_LBSPPB128_LBSPPM0_LPA4_LPB4_LPM0_LRVW4_LWPMn1_MIAV0_MIWT8_7_MO40_NTn1_NTA0_NTB0_NTC4_NTD7_NTM0_NEPBS0_NLCA1_NLCB1_ONLL1_PGR2_PLR1_PKA1_SIA3_SS1_SU2_SUM0_SUS128_SPO1_SRVW0_SSO0_SVW8_SK0_SKXCCM0_TLDS1_ULSGRO0_USL1_UIOFGRO0_USFGROn1_VSn1_VWA8_VWB1_WSGRA0_WSGRB0_WS64_WG32_8_1_WGM48_WGMXCC1_WGMXCCGn1
    SolutionIndex: 144
    SolutionNameMin: Cijk_Alik_Bljk_BBS_BH_UserArgs_MT32x64x32_MI32x32x1_SN_LDSB1_AFC0_AFEM1_AFEM1_ASEM1_CLR1_CADS0_DTVA1_DTVB0_EPS0_FDSI0_GRPM0p27_GRVWA8_GRVWB8_GSU1_GSUAMB_GSUC0_GSUWGMRR0_GLS0_ISA942_IU1_K1_LBSPPA0_LBSPPB128_LBSPPM0_LPA0_LPB8_LPM0_LRVW8_LWPM0p80_MIAV0_MIWT1_2_MO40_NTn1_NTA0_NTB0_NTC4_NTD0_NTM0_NEPBS0_NLCA2_NLCB1_ONLL0_PGR2_PLR1_PKA1_SIA3_SS1_SU2_SUM1_SUS256_SPO0_SRVW0_SSO0_SVW1_SK0_SKXCCM0_TLDS1_ULSGRO0_USL1_UIOFGRO0_USFGRO0_VSn1_VWA1_VWB2_WSGRA0_WSGRB0_WS64_WG32_2_1_WGM266_WGMXCC1_WGMXCCG0
    SolutionIndex: 145
    SolutionNameMin: Cijk_Alik_Bljk_BBS_BH_UserArgs_MT256x224x64_MI16x16x1_SN_LDSB1_AFC0_AFEM1_AFEM1_ASEM1_CLR1_CADS0_DTVA0_DTVB0_EPS0_FDSI0_GRPM1_GRVWA2_GRVWB2_GSU1_GSUAMB_GSUC0_GSUWGMRR0_GLS0_ISA942_IU1_K1_LBSPPA1024_LBSPPB128_LBSPPM0_LPA4_LPB4_LPM0_LRVW4_LWPMn1_MIAV0_MIWT8_7_MO40_NTn1_NTA0_NTB0_NTC0_NTD4_NTM0_NEPBS0_NLCA1_NLCB1_ONLL1_PGR2_PLR1_PKA1_SIA3_SS1_SU32_SUM1_SUS128_SPO0_SRVW0_SSO0_SVW8_SK0_SKXCCM0_TLDS2_ULSGRO0_USL1_UIOFGRO0_USFGROn1_VSn1_VWA8_VWB1_WSGRA0_WSGRB0_WS64_WG32_8_1_WGM1_WGMXCC1_WGMXCCGn1
    SolutionIndex: 146
    SolutionNameMin: Cijk_Alik_Bljk_BBS_BH_UserArgs_MT192x160x64_MI16x16x1_SN_LDSB1_AFC0_AFEM1_AFEM1_ASEM1_CLR1_CADS0_DTVA0_DTVB0_EPS0_FDSI0_GRPM0p70_GRVWA8_GRVWB8_GSU1_GSUAMB_GSUC0_GSUWGMRR0_GLS0_ISA942_IU1_K1_LBSPPA128_LBSPPB256_LBSPPM0_LPA16_LPB16_LPM0_LRVW8_LWPMn1_MIAV0_MIWT3_10_MO40_NTn1_NTA0_NTB0_NTC7_NTD4_NTM0_NEPBS0_NLCA1_NLCB1_ONLL1_PGR2_PLR1_PKA1_SIA3_SS1_SU16_SUM0_SUS128_SPO0_SRVW0_SSO0_SVW1_SK0_SKXCCM0_TLDS1_ULSGRO0_USL1_UIOFGRO0_USFGROn1_VSn1_VWA1_VWB2_WSGRA2_WSGRB2_WS64_WG64_4_1_WGM1_WGMXCC8_WGMXCCGn1
    SolutionIndex: 147
    SolutionNameMin: Cijk_Alik_Bljk_BBS_BH_UserArgs_MT128x96x128_MI16x16x1_SN_LDSB1_AFC0_AFEM1_AFEM1_ASEM1_CLR1_CADS0_DTVA0_DTVB0_EPS0_FDSI0_GRPM1_GRVWA8_GRVWB8_GSU1_GSUAMBSK_GSUC0_GSUWGMRR0_GLS0_ISA942_IU1_K1_LBSPPA1024_LBSPPB256_LBSPPM0_LPA16_LPB16_LPM0_LRVW8_LWPMn1_MIAV0_MIWT4_3_MO40_NTn1_NTA0_NTB0_NTC4_NTD4_NTM0_NEPBS0_NLCA1_NLCB1_ONLL1_PGR2_PLR1_PKA1_SIA3_SS1_SU0_SUM1_SUS0_SPO0_SRVW0_SSO0_SVW4_SK0_SKXCCM0_TLDS2_ULSGRO0_USL1_UIOFGRO0_USFGROn1_VSn1_VWA4_VWB1_WSGRA0_WSGRB0_WS64_WG32_8_1_WGM1_WGMXCC8_WGMXCCG0
    SolutionIndex: 148
    SolutionNameMin: Cijk_Alik_Bljk_BBS_BH_UserArgs_MT256x80x16_MI16x16x1_SN_LDSB1_AFC0_AFEM1_AFEM1_ASEM1_CLR0_CADS0_DTVA0_DTVB0_EPS0_FDSI0_GRPM0p60_GRVWA4_GRVWB1_GSU1_GSUAMB_GSUC0_GSUWGMRR1_GLS0_ISA942_IU1_K1_LBSPPA128_LBSPPB128_LBSPPM0_LPA4_LPB4_LPM0_LRVW4_LWPMn1_MIAV0_MIWT4_5_MO40_NTn1_NTA0_NTB0_NTC4_NTD4_NTM0_NEPBS0_NLCA1_NLCB1_ONLL0_PGR2_PLR1_PKA1_SIA3_SS1_SU4_SUM1_SUS64_SPO0_SRVW0_SSO1_SVW4_SK0_SKXCCM0_TLDS1_ULSGRO0_USL1_UIOFGRO0_USFGROn1_VSn1_VWA4_VWB1_WSGRA0_WSGRB0_WS64_WG64_4_1_WGM1_WGMXCC8_WGMXCCGn1
    SolutionIndex: 149
    SolutionNameMin: Cijk_Alik_Bljk_BBS_BH_UserArgs_MT128x160x64_MI16x16x1_SN_LDSB1_AFC0_AFEM1_AFEM1_ASEM1_CLR1_CADS0_DTVA0_DTVB0_EPS0_FDSI0_GRPM1_GRVWA8_GRVWB8_GSU1_GSUAMB_GSUC0_GSUWGMRR0_GLS0_ISA942_IU1_K1_LBSPPA512_LBSPPB128_LBSPPM0_LPA16_LPB16_LPM0_LRVW8_LWPMn1_MIAV0_MIWT4_5_MO40_NTn1_NTA0_NTB0_NTC0_NTD4_NTM0_NEPBS0_NLCA1_NLCB1_ONLL0_PGR2_PLR1_PKA1_SIA3_SS1_SU64_SUM0_SUS2048_SPO1_SRVW0_SSO1_SVW4_SK0_SKXCCM0_TLDS2_ULSGRO1_USL1_UIOFGRO0_USFGROn1_VSn1_VWA4_VWB1_WSGRA0_WSGRB0_WS64_WG32_8_1_WGM1_WGMXCC8_WGMXCCG0
    SolutionIndex: 150
    SolutionNameMin: Cijk_Alik_Bljk_BBS_BH_UserArgs_MT128x128x64_MI16x16x1_SN_LDSB1_AFC0_AFEM1_AFEM1_ASEM1_CLR1_CADS0_DTVA0_DTVB1_EPS0_FDSI0_GRPM0p26_GRVWA8_GRVWB8_GSU1_GSUAMB_GSUC1_GSUWGMRR1_GLS0_ISA942_IU1_K1_LBSPPA1024_LBSPPB0_LBSPPM0_LPA16_LPB0_LPM0_LRVW8_LWPM0p80_MIAV0_MIWT8_2_MO40_NTn1_NTA0_NTB0_NTC7_NTD4_NTM0_NEPBS6_NLCA1_NLCB2_ONLL1_PGR2_PLR1_PKA1_SIA3_SS1_SU2_SUM0_SUS512_SPO0_SRVW0_SSO0_SVW8_SK0_SKXCCM0_TLDS1_ULSGRO0_USL1_UIOFGRO0_USFGRO1_VSn1_VWA8_VWB2_WSGRA0_WSGRB0_WS64_WG16_16_1_WGM4_WGMXCC2_WGMXCCGn1
    SolutionIndex: 151
    SolutionNameMin: Cijk_Alik_Bljk_BBS_BH_UserArgs_MT256x160x64_MI16x16x1_SN_LDSB1_AFC0_AFEM1_AFEM1_ASEM1_CLR1_CADS0_DTVA0_DTVB0_EPS0_FDSI0_GRPM0p26_GRVWA8_GRVWB8_GSU1_GSUAMB_GSUC1_GSUWGMRR0_GLS0_ISA942_IU1_K1_LBSPPA1024_LBSPPB128_LBSPPM0_LPA16_LPB16_LPM0_LRVW8_LWPMn1_MIAV0_MIWT8_5_MO40_NTn1_NTA0_NTB0_NTC4_NTD0_NTM0_NEPBS0_NLCA1_NLCB1_ONLL0_PGR2_PLR1_PKA1_SIA3_SS1_SU8_SUM1_SUS128_SPO0_SRVW0_SSO2_SVW8_SK0_SKXCCM0_TLDS2_ULSGRO1_USL1_UIOFGRO0_USFGRO0_VSn1_VWA8_VWB1_WSGRA0_WSGRB1_WS64_WG32_8_1_WGM4_WGMXCC1_WGMXCCGn1
    SolutionIndex: 152
    SolutionNameMin: Cijk_Alik_Bljk_BBS_BH_UserArgs_MT64x32x64_MI16x16x1_SN_LDSB1_AFC0_AFEM1_AFEM1_ASEM1_CLR1_CADS0_DTVA0_DTVB0_EPS0_FDSI0_GRPM0p26_GRVWA8_GRVWB8_GSU1_GSUAMBSK_GSUC0_GSUWGMRR1_GLS0_ISA942_IU1_K1_LBSPPA512_LBSPPB128_LBSPPM0_LPA16_LPB16_LPM0_LRVW8_LWPM0p25_MIAV0_MIWT4_1_MO40_NTn1_NTA0_NTB0_NTC4_NTD7_NTM0_NEPBS4_NLCA1_NLCB1_ONLL1_PGR2_PLR1_PKA1_SIA3_SS1_SU4_SUM4_SUS128_SPO1_SRVW0_SSO1_SVW4_SK0_SKXCCM0_TLDS1_ULSGRO0_USL1_UIOFGRO0_USFGROn1_VSn1_VWA4_VWB1_WSGRA0_WSGRB0_WS64_WG16_8_1_WGM1_WGMXCC4_WGMXCCG0
    SolutionIndex: 153
    SolutionNameMin: Cijk_Alik_Bljk_BBS_BH_UserArgs_MT256x80x16_MI16x16x1_SN_LDSB1_AFC0_AFEM1_AFEM1_ASEM1_CLR0_CADS0_DTVA0_DTVB0_EPS0_FDSI0_GRPM0p90_GRVWA8_GRVWB1_GSU1_GSUAMB_GSUC1_GSUWGMRR0_GLS0_ISA942_IU1_K1_LBSPPA128_LBSPPB128_LBSPPM0_LPA8_LPB4_LPM0_LRVW4_LWPMn1_MIAV0_MIWT4_5_MO40_NTn1_NTA0_NTB0_NTC0_NTD4_NTM0_NEPBS0_NLCA1_NLCB1_ONLL0_PGR2_PLR1_PKA1_SIA3_SS1_SU0_SUM1_SUS0_SPO0_SRVW0_SSO1_SVW4_SK0_SKXCCM0_TLDS1_ULSGRO0_USL1_UIOFGRO0_USFGROn1_VSn1_VWA4_VWB1_WSGRA0_WSGRB0_WS64_WG64_4_1_WGM95_WGMXCC8_WGMXCCGn1
    SolutionIndex: 154
    SolutionNameMin: Cijk_Alik_Bljk_BBS_BH_UserArgs_MT64x96x128_MI16x16x1_SN_LDSB1_AFC0_AFEM1_AFEM1_ASEM1_CLR1_CADS0_DTVA0_DTVB0_EPS0_FDSI0_GRPM1_GRVWA8_GRVWB8_GSU1_GSUAMB_GSUC0_GSUWGMRR1_GLS0_ISA942_IU1_K1_LBSPPA512_LBSPPB256_LBSPPM0_LPA16_LPB16_LPM0_LRVW8_LWPM0p50_MIAV0_MIWT2_3_MO40_NTn1_NTA0_NTB0_NTC4_NTD4_NTM0_NEPBS0_NLCA1_NLCB1_ONLL2_PGR2_PLR1_PKA1_SIA3_SS1_SU4_SUM0_SUS1024_SPO0_SRVW0_SSO0_SVW2_SK0_SKXCCM0_TLDS2_ULSGRO0_USL1_UIOFGRO0_USFGROn1_VSn1_VWA2_VWB1_WSGRA1_WSGRB1_WS64_WG32_8_1_WGM1_WGMXCC8_WGMXCCG0
    SolutionIndex: 155
    SolutionNameMin: Cijk_Alik_Bljk_BBS_BH_UserArgs_MT64x64x64_MI16x16x1_SN_LDSB0_AFC0_AFEM1_AFEM1_ASEM1_CLR1_CADS0_DTVA0_DTVB0_EPS0_FDSI0_GRPM0p25_GRVWA8_GRVWB8_GSU1_GSUAMB_GSUC0_GSUWGMRR0_GLS0_ISA942_IU1_K1_LBSPPA256_LBSPPB256_LBSPPM0_LPA16_LPB16_LPM0_LRVW8_LWPMn1_MIAV0_MIWT2_2_MO40_NTn1_NTA0_NTB0_NTC0_NTD4_NTM0_NEPBS0_NLCA1_NLCB1_ONLL0_PGR2_PLR1_PKA1_SIA3_SS1_SU2_SUM0_SUS1024_SPO1_SRVW0_SSO2_SVW2_SK0_SKXCCM0_TLDS2_ULSGRO0_USL1_UIOFGRO0_USFGROn1_VSn1_VWA2_VWB2_WSGRA1_WSGRB1_WS64_WG32_8_1_WGM8_WGMXCC1_WGMXCCGn1
    SolutionIndex: 156
    SolutionNameMin: Cijk_Alik_Bljk_BBS_BH_UserArgs_MT64x96x128_MI16x16x1_SN_LDSB1_AFC0_AFEM1_AFEM1_ASEM1_CLR1_CADS0_DTVA0_DTVB0_EPS0_FDSI0_GRPM0p80_GRVWA8_GRVWB8_GSU1_GSUAMBSK_GSUC0_GSUWGMRR1_GLS0_ISA942_IU1_K1_LBSPPA512_LBSPPB256_LBSPPM0_LPA16_LPB16_LPM0_LRVW8_LWPM0p27_MIAV0_MIWT2_3_MO40_NTn1_NTA0_NTB0_NTC4_NTD7_NTM0_NEPBS8_NLCA1_NLCB1_ONLL1_PGR2_PLR1_PKA1_SIA3_SS1_SU4_SUM1_SUS256_SPO1_SRVW0_SSO0_SVW2_SK0_SKXCCM0_TLDS2_ULSGRO0_USL1_UIOFGRO0_USFGRO1_VSn1_VWA2_VWB1_WSGRA0_WSGRB0_WS64_WG32_8_1_WGM1_WGMXCC8_WGMXCCG32
    SolutionIndex: 157
    SolutionNameMin: Cijk_Alik_Bljk_BBS_BH_UserArgs_MT16x16x256_MI16x16x1_SN_LDSB1_AFC0_AFEM1_AFEM1_ASEM1_CLR1_CADS0_DTVA1_DTVB0_EPS0_FDSI0_GRPM0p80_GRVWA8_GRVWB8_GSU1_GSUAMB_GSUC0_GSUWGMRR1_GLS0_ISA942_IU1_K1_LBSPPA0_LBSPPB512_LBSPPM0_LPA0_LPB16_LPM0_LRVW8_LWPM0p20_MIAV0_MIWT1_1_MO40_NTn1_NTA0_NTB4_NTC7_NTD0_NTM0_NEPBS8_NLCA8_NLCB1_ONLL1_PGR2_PLR1_PKA1_SIA3_SS1_SU4_SUM0_SUS512_SPO1_SRVW0_SSO0_SVW1_SK0_SKXCCM0_TLDS2_ULSGRO0_USL1_UIOFGRO0_USFGRO1_VSn1_VWA1_VWB1_WSGRA0_WSGRB1_WS64_WG16_4_1_WGM1_WGMXCC16_WGMXCCG0
    SolutionIndex: 158
    SolutionNameMin: Cijk_Alik_Bljk_BBS_BH_UserArgs_MT256x224x64_MI16x16x1_SN_LDSB1_AFC0_AFEM1_AFEM1_ASEM1_CLR1_CADS0_DTVA0_DTVB0_EPS0_FDSI0_GRPM0p70_GRVWA4_GRVWB4_GSU1_GSUAMB_GSUC0_GSUWGMRR0_GLS0_ISA942_IU1_K1_LBSPPA1024_LBSPPB128_LBSPPM0_LPA4_LPB4_LPM0_LRVW4_LWPM0p20_MIAV0_MIWT8_7_MO40_NTn1_NTA0_NTB7_NTC0_NTD7_NTM0_NEPBS8_NLCA1_NLCB1_ONLL1_PGR2_PLR1_PKA1_SIA3_SS1_SU16_SUM4_SUS128_SPO1_SRVW0_SSO0_SVW8_SK0_SKXCCM0_TLDS1_ULSGRO0_USL1_UIOFGRO0_USFGRO0_VSn1_VWA8_VWB1_WSGRA2_WSGRB0_WS64_WG32_8_1_WGM76_WGMXCC32_WGMXCCG0
    SolutionIndex: 159
    SolutionNameMin: Cijk_Alik_Bljk_BBS_BH_UserArgs_MT128x80x32_MI16x16x1_SN_LDSB1_AFC0_AFEM1_AFEM1_ASEM1_CLR1_CADS0_DTVA0_DTVB0_EPS0_FDSI0_GRPM0p80_GRVWA4_GRVWB2_GSU1_GSUAMB_GSUC0_GSUWGMRR0_GLS0_ISA942_IU1_K1_LBSPPA128_LBSPPB128_LBSPPM0_LPA4_LPB4_LPM0_LRVW4_LWPMn1_MIAV0_MIWT2_5_MO40_NTn1_NTA0_NTB0_NTC7_NTD4_NTM0_NEPBS0_NLCA1_NLCB1_ONLL0_PGR2_PLR1_PKA1_SIA3_SS1_SU2_SUM1_SUS64_SPO1_SRVW0_SSO3_SVW2_SK0_SKXCCM0_TLDS2_ULSGRO0_USL1_UIOFGRO0_USFGROn1_VSn1_VWA2_VWB1_WSGRA1_WSGRB0_WS64_WG64_4_1_WGM2_WGMXCC1_WGMXCCGn1
    SolutionIndex: 160
    SolutionNameMin: Cijk_Alik_Bljk_BBS_BH_UserArgs_MT128x192x32_MI16x16x1_SN_LDSB1_AFC0_AFEM1_AFEM1_ASEM1_CLR1_CADS0_DTVA0_DTVB0_EPS0_FDSI0_GRPM0p90_GRVWA4_GRVWB4_GSU1_GSUAMB_GSUC1_GSUWGMRR1_GLS0_ISA942_IU1_K1_LBSPPA256_LBSPPB128_LBSPPM0_LPA4_LPB4_LPM0_LRVW4_LWPM0p40_MIAV0_MIWT4_6_MO40_NTn1_NTA0_NTB0_NTC7_NTD7_NTM0_NEPBS16_NLCA1_NLCB1_ONLL2_PGR2_PLR1_PKA1_SIA3_SS1_SU16_SUM0_SUS256_SPO0_SRVW0_SSO1_SVW4_SK0_SKXCCM0_TLDS2_ULSGRO1_USL1_UIOFGRO0_USFGRO1_VSn1_VWA4_VWB2_WSGRA0_WSGRB0_WS64_WG32_8_1_WGM1_WGMXCC8_WGMXCCGn1
    SolutionIndex: 161
    SolutionNameMin: Cijk_Alik_Bljk_BBS_BH_UserArgs_MT64x48x256_MI16x16x1_SN_LDSB1_AFC0_AFEM1_AFEM1_ASEM1_CLR1_CADS0_DTVA0_DTVB0_EPS0_FDSI0_GRPM0p70_GRVWA8_GRVWB8_GSU1_GSUAMB_GSUC0_GSUWGMRR1_GLS0_ISA942_IU1_K1_LBSPPA512_LBSPPB512_LBSPPM0_LPA16_LPB16_LPM0_LRVW8_LWPM1_MIAV0_MIWT1_3_MO40_NTn1_NTA0_NTB0_NTC0_NTD7_NTM0_NEPBS0_NLCA1_NLCB1_ONLL1_PGR2_PLR1_PKA1_SIA3_SS0_SU4_SUM1_SUS512_SPO0_SRVW0_SSO0_SVW4_SK0_SKXCCM0_TLDS1_ULSGRO0_USL1_UIOFGRO0_USFGROn1_VSn1_VWA1_VWB1_WSGRA2_WSGRB0_WS64_WG64_4_1_WGM1_WGMXCC8_WGMXCCG0
    SolutionIndex: 162
    SolutionNameMin: Cijk_Alik_Bljk_BBS_BH_UserArgs_MT320x160x64_MI16x16x1_SN_LDSB1_AFC0_AFEM1_AFEM1_ASEM1_CLR1_CADS0_DTVA0_DTVB0_EPS0_FDSI0_GRPM0p20_GRVWA4_GRVWB4_GSU1_GSUAMB_GSUC0_GSUWGMRR0_GLS0_ISA942_IU1_K1_LBSPPA256_LBSPPB128_LBSPPM0_LPA4_LPB4_LPM0_LRVW4_LWPM0p25_MIAV0_MIWT10_5_MO40_NTn1_NTA0_NTB0_NTC0_NTD0_NTM0_NEPBS2_NLCA1_NLCB1_ONLL2_PGR2_PLR1_PKA1_SIA3_SS1_SU2_SUM1_SUS128_SPO0_SRVW0_SSO1_SVW2_SK0_SKXCCM0_TLDS2_ULSGRO0_USL1_UIOFGRO0_USFGROn1_VSn1_VWA2_VWB1_WSGRA0_WSGRB0_WS64_WG32_8_1_WGM2_WGMXCC1_WGMXCCGn1
    SolutionIndex: 163
    SolutionNameMin: Cijk_Alik_Bljk_BBS_BH_UserArgs_MT32x160x32_MI16x16x1_SN_LDSB1_AFC0_AFEM1_AFEM1_ASEM1_CLR0_CADS0_DTVA0_DTVB0_EPS0_FDSI0_GRPM1_GRVWA4_GRVWB4_GSU1_GSUAMB_GSUC0_GSUWGMRR0_GLS0_ISA942_IU1_K1_LBSPPA128_LBSPPB128_LBSPPM0_LPA4_LPB4_LPM0_LRVW4_LWPM1_MIAV0_MIWT1_5_MO40_NTn1_NTA0_NTB0_NTC4_NTD0_NTM0_NEPBS0_NLCA1_NLCB1_ONLL0_PGR2_PLR1_PKA1_SIA3_SS1_SU2_SUM1_SUS128_SPO1_SRVW0_SSO3_SVW1_SK0_SKXCCM0_TLDS2_ULSGRO0_USL1_UIOFGRO0_USFGROn1_VSn1_VWA1_VWB1_WSGRA0_WSGRB0_WS64_WG32_8_1_WGM1_WGMXCC1_WGMXCCGn1
    SolutionIndex: 164
    SolutionNameMin: Cijk_Alik_Bljk_BBS_BH_UserArgs_MT192x320x64_MI16x16x1_SN_LDSB0_AFC0_AFEM1_AFEM1_ASEM1_CLR1_CADS0_DTVA0_DTVB1_EPS0_FDSI0_GRPM0p80_GRVWA8_GRVWB8_GSU1_GSUAMB_GSUC1_GSUWGMRR1_GLS0_ISA942_IU1_K1_LBSPPA512_LBSPPB0_LBSPPM0_LPA16_LPB0_LPM0_LRVW8_LWPMn1_MIAV0_MIWT12_5_MO40_NTn1_NTA0_NTB0_NTC0_NTD4_NTM0_NEPBS2_NLCA1_NLCB2_ONLL1_PGR2_PLR1_PKA1_SIA3_SS1_SU8_SUM4_SUS256_SPO1_SRVW0_SSO0_SVW4_SK0_SKXCCM0_TLDS2_ULSGRO0_USL1_UIOFGRO0_USFGROn1_VSn1_VWA4_VWB1_WSGRA2_WSGRB0_WS64_WG16_16_1_WGM4_WGMXCC1_WGMXCCGn1
    SolutionIndex: 165
    SolutionNameMin: Cijk_Alik_Bljk_BBS_BH_UserArgs_MT128x96x64_MI16x16x1_SN_LDSB1_AFC0_AFEM1_AFEM1_ASEM1_CLR1_CADS0_DTVA0_DTVB0_EPS0_FDSI0_GRPM0p60_GRVWA8_GRVWB8_GSU1_GSUAMBSK_GSUC0_GSUWGMRR0_GLS0_ISA942_IU1_K1_LBSPPA512_LBSPPB128_LBSPPM0_LPA16_LPB16_LPM0_LRVW8_LWPMn1_MIAV0_MIWT4_3_MO40_NTn1_NTA0_NTB0_NTC7_NTD4_NTM0_NEPBS0_NLCA1_NLCB1_ONLL0_PGR2_PLR1_PKA1_SIA3_SS1_SU2_SUM1_SUS128_SPO0_SRVW0_SSO0_SVW4_SK0_SKXCCM0_TLDS1_ULSGRO0_USL1_UIOFGRO0_USFGROn1_VSn1_VWA4_VWB1_WSGRA2_WSGRB0_WS64_WG32_8_1_WGM1_WGMXCC8_WGMXCCG0
    SolutionIndex: 166
    SolutionNameMin: Cijk_Alik_Bljk_BBS_BH_UserArgs_MT32x160x32_MI16x16x1_SN_LDSB1_AFC0_AFEM1_AFEM1_ASEM1_CLR1_CADS0_DTVA0_DTVB0_EPS0_FDSI0_GRPM1_GRVWA4_GRVWB4_GSU1_GSUAMB_GSUC1_GSUWGMRR1_GLS0_ISA942_IU1_K1_LBSPPA128_LBSPPB128_LBSPPM0_LPA4_LPB4_LPM0_LRVW4_LWPM1_MIAV0_MIWT1_5_MO40_NTn1_NTA4_NTB0_NTC4_NTD0_NTM0_NEPBS0_NLCA1_NLCB1_ONLL2_PGR2_PLR1_PKA1_SIA3_SS1_SU4_SUM0_SUS512_SPO0_SRVW0_SSO0_SVW1_SK0_SKXCCM0_TLDS1_ULSGRO1_USL1_UIOFGRO0_USFGRO0_VSn1_VWA1_VWB1_WSGRA1_WSGRB0_WS64_WG32_8_1_WGM1_WGMXCC1_WGMXCCGn1
    SolutionIndex: 167
    SolutionNameMin: Cijk_Alik_Bljk_BBS_BH_UserArgs_MT128x256x64_MI16x16x1_SN_LDSB1_AFC1_AFEM1_AFEM1_ASEM1_CLR1_CADS0_DTVA0_DTVB0_EPS0_FDSI0_GRPM1_GRVWA8_GRVWB8_GSU1_GSUAMB_GSUC0_GSUWGMRR0_GLS0_ISA942_IU1_K1_LBSPPA1024_LBSPPB512_LBSPPM0_LPA16_LPB16_LPM0_LRVW8_LWPMn1_MIAV0_MIWT8_4_MO40_NTn1_NTA0_NTB0_NTC0_NTD4_NTM0_NEPBS0_NLCA1_NLCB1_ONLL1_PGR2_PLR1_PKA1_SIA3_SS1_SU8_SUM0_SUS512_SPO0_SRVW0_SSO0_SVW8_SK0_SKXCCM0_TLDS1_ULSGRO0_USL1_UIOFGRO0_USFGROn1_VSn1_VWA8_VWB4_WSGRA2_WSGRB2_WS64_WG16_16_1_WGM1_WGMXCC1_WGMXCCG0
    SolutionIndex: 168
    SolutionNameMin: Cijk_Alik_Bljk_BBS_BH_UserArgs_MT256x192x32_MI16x16x1_SN_LDSB1_AFC1_AFEM1_AFEM1_ASEM1_CLR1_CADS0_DTVA0_DTVB0_EPS0_FDSI0_GRPM0p50_GRVWA4_GRVWB4_GSU1_GSUAMB_GSUC0_GSUWGMRR1_GLS0_ISA942_IU1_K1_LBSPPA512_LBSPPB128_LBSPPM0_LPA4_LPB4_LPM0_LRVW4_LWPMn1_MIAV0_MIWT8_6_MO40_NTn1_NTA0_NTB0_NTC0_NTD4_NTM0_NEPBS16_NLCA1_NLCB1_ONLL1_PGR2_PLR1_PKA1_SIA3_SS1_SU0_SUM1_SUS0_SPO1_SRVW0_SSO0_SVW8_SK0_SKXCCM0_TLDS1_ULSGRO0_USL1_UIOFGRO0_USFGROn1_VSn1_VWA8_VWB2_WSGRA0_WSGRB0_WS64_WG32_8_1_WGM1_WGMXCC8_WGMXCCG304
    SolutionIndex: 169
    SolutionNameMin: Cijk_Alik_Bljk_BBS_BH_UserArgs_MT16x16x256_MI16x16x1_SN_LDSB1_AFC1_AFEM16_AFEM1_ASEM1_CLR1_CADS0_DTVA0_DTVB0_EPS0_FDSI0_GRPM1_GRVWA8_GRVWB8_GSU1_GSUAMB_GSUC0_GSUWGMRR0_GLS0_ISA942_IU1_K1_LBSPPA512_LBSPPB512_LBSPPM0_LPA16_LPB16_LPM0_LRVW8_LWPMn1_MIAV0_MIWT1_1_MO40_NTn1_NTA0_NTB0_NTC0_NTD4_NTM0_NEPBS16_NLCA1_NLCB1_ONLL1_PGR2_PLR1_PKA1_SIA3_SS1_SU0_SUM1_SUS0_SPO0_SRVW0_SSO0_SVW1_SK0_SKXCCM0_TLDS1_ULSGRO1_USL1_UIOFGRO0_USFGROn1_VSn1_VWA1_VWB1_WSGRA0_WSGRB0_WS64_WG16_4_4_WGM1_WGMXCC1_WGMXCCG304
    SolutionIndex: 170
    SolutionNameMin: Cijk_Alik_Bljk_BBS_BH_UserArgs_MT192x256x64_MI16x16x1_SN_LDSB1_AFC1_AFEM1_AFEM1_ASEM1_CLR1_CADS0_DTVA0_DTVB0_EPS0_FDSI0_GRPM1_GRVWA8_GRVWB8_GSU1_GSUAMB_GSUC0_GSUWGMRR0_GLS0_ISA942_IU1_K1_LBSPPA512_LBSPPB512_LBSPPM0_LPA16_LPB16_LPM0_LRVW8_LWPMn1_MIAV0_MIWT12_4_MO40_NTn1_NTA0_NTB0_NTC0_NTD4_NTM0_NEPBS0_NLCA1_NLCB1_ONLL1_PGR2_PLR1_PKA1_SIA3_SS1_SU8_SUM1_SUS256_SPO1_SRVW0_SSO0_SVW4_SK0_SKXCCM0_TLDS1_ULSGRO0_USL1_UIOFGRO0_USFGROn1_VSn1_VWA4_VWB4_WSGRA2_WSGRB0_WS64_WG16_16_1_WGM8_WGMXCC1_WGMXCCG0
    SolutionIndex: 171
    SolutionNameMin: Cijk_Alik_Bljk_BBS_BH_UserArgs_MT64x128x64_MI16x16x1_SN_LDSB1_AFC1_AFEM1_AFEM1_ASEM1_CLR1_CADS0_DTVA0_DTVB0_EPS0_FDSI0_GRPM1_GRVWA8_GRVWB8_GSUn1_GSUAMBSK_GSUC1_GSUWGMRR1_GLS0_ISA942_IU1_K1_LBSPPA512_LBSPPB256_LBSPPM0_LPA16_LPB16_LPM0_LRVW8_LWPMn1_MIAV0_MIWT4_2_MO40_NTn1_NTA0_NTB0_NTC0_NTD4_NTM0_NEPBS16_NLCA1_NLCB1_ONLL1_PGR2_PLR1_PKA1_SIA3_SS1_SU16_SUM1_SUS128_SPO0_SRVW0_SSO0_SVW4_SK0_SKXCCM0_TLDS1_ULSGRO1_USL1_UIOFGRO0_USFGROn1_VSn1_VWA4_VWB2_WSGRA0_WSGRB0_WS64_WG16_16_1_WGM1_WGMXCC8_WGMXCCGn1
    SolutionIndex: 172
    SolutionNameMin: Cijk_Alik_Bljk_BBS_BH_UserArgs_MT256x256x32_MI16x16x1_SN_LDSB1_AFC1_AFEM1_AFEM1_ASEM1_CLR1_CADS0_DTVA0_DTVB0_EPS0_FDSI0_GRPM1_GRVWA4_GRVWB4_GSU1_GSUAMB_GSUC0_GSUWGMRR0_GLS0_ISA942_IU1_LBSPPA512_LBSPPB512_LBSPPM0_LPA4_LPB4_LPM0_LRVW4_LWPMn1_MIAV0_MIWT8_8_MO40_NTn1_NTA0_NTB0_NTC0_NTD4_NTM0_NEPBS0_NLCA1_NLCB1_ONLL1_PGR2_PLR1_PKA1_SIA3_SS1_SU8_SUM1_SUS256_SPO0_SRVW0_SSO0_SVW8_SK0_SKXCCM0_TLDS1_ULSGRO1_USL1_UIOFGRO0_USFGROn1_VSn1_VWA8_VWB8_WSGRA0_WSGRB0_WS64_WG32_8_1_WGM1_WGMXCC8_WGMXCCGn1
    SolutionIndex: 173
    SolutionNameMin: Cijk_Alik_Bljk_BBS_BH_UserArgs_MT16x16x256_MI16x16x1_SN_LDSB1_AFC1_AFEM1_AFEM1_ASEM1_CLR1_CADS0_DTVA0_DTVB0_EPS0_FDSI0_GRPM1_GRVWA8_GRVWB8_GSUn1_GSUAMBSK_GSUC1_GSUWGMRR1_GLS0_ISA942_IU1_K1_LBSPPA512_LBSPPB512_LBSPPM0_LPA16_LPB16_LPM0_LRVW8_LWPMn1_MIAV0_MIWT1_1_MO40_NTn1_NTA0_NTB0_NTC0_NTD4_NTM0_NEPBS16_NLCA1_NLCB1_ONLL1_PGR2_PLR1_PKA1_SIA3_SS1_SU16_SUM1_SUS512_SPO0_SRVW0_SSO0_SVW1_SK0_SKXCCM0_TLDS1_ULSGRO0_USL1_UIOFGRO0_USFGROn1_VSn1_VWA1_VWB1_WSGRA0_WSGRB0_WS64_WG16_4_4_WGM1_WGMXCC8_WGMXCCGn1
    SolutionIndex: 174
    SolutionNameMin: Cijk_Alik_Bljk_BBS_BH_UserArgs_MT32x48x256_MI16x16x1_SN_LDSB1_AFC1_AFEM1_AFEM1_ASEM1_CLR1_CADS0_DTVA0_DTVB0_EPS0_FDSI0_GRPM1_GRVWA8_GRVWB8_GSUn1_GSUAMBSK_GSUC1_GSUWGMRR1_GLS0_ISA942_IU1_K1_LBSPPA1024_LBSPPB512_LBSPPM0_LPA16_LPB16_LPM0_LRVW8_LWPMn1_MIAV0_MIWT2_3_MO40_NTn1_NTA0_NTB0_NTC0_NTD4_NTM0_NEPBS16_NLCA1_NLCB1_ONLL1_PGR2_PLR1_PKA1_SIA3_SS1_SU16_SUM1_SUS512_SPO0_SRVW0_SSO0_SVW2_SK0_SKXCCM0_TLDS1_ULSGRO1_USL1_UIOFGRO0_USFGROn1_VSn1_VWA2_VWB1_WSGRA0_WSGRB0_WS64_WG16_4_4_WGM4_WGMXCC8_WGMXCCGn1
- - - [7168, 2097152, 1, 8192]
    - [1, 0.0]
  - - [3584, 2097152, 1, 8192]
    - [1, 0.0]
  - - [1024, 2097152, 1, 8192]
    - [0, 0.0]
  - - [7168, 1048576, 1, 8192]
    - [1, 0.0]
  - - [3584, 1048576, 1, 8192]
    - [1, 0.0]
  - - [1024, 1048576, 1, 8192]
    - [0, 0.0]
  - - [7168, 524288, 1, 8192]
    - [1, 0.0]
  - - [3584, 524288, 1, 8192]
    - [1, 0.0]
  - - [1024, 524288, 1, 8192]
    - [0, 0.0]
  - - [7168, 262144, 1, 8192]
    - [1, 0.0]
  - - [3584, 262144, 1, 8192]
    - [1, 0.0]
  - - [1024, 262144, 1, 8192]
    - [0, 0.0]
  - - [7168, 131072, 1, 8192]
    - [2, 0.0]
  - - [3584, 131072, 1, 8192]
    - [1, 0.0]
  - - [1024, 131072, 1, 8192]
    - [0, 0.0]
  - - [3584, 8192, 1, 8192]
    - [3, 0.0]
  - - [1024, 8192, 1, 8192]
    - [4, 0.0]
  - - [7168, 16384, 1, 8192]
    - [1, 0.0]
  - - [3584, 16384, 1, 8192]
    - [2, 0.0]
  - - [1024, 16384, 1, 8192]
    - [5, 0.0]
  - - [7168, 32768, 1, 8192]
    - [1, 0.0]
  - - [3584, 32768, 1, 8192]
    - [1, 0.0]
  - - [1024, 32768, 1, 8192]
    - [5, 0.0]
  - - [7168, 65536, 1, 8192]
    - [1, 0.0]
  - - [3584, 65536, 1, 8192]
    - [1, 0.0]
  - - [1024, 65536, 1, 8192]
    - [0, 0.0]
  - - [8192, 1, 1, 1024]
    - [70, 0.0]
  - - [8192, 2, 1, 1024]
    - [70, 0.0]
  - - [8192, 4, 1, 1024]
    - [70, 0.0]
  - - [8192, 8, 1, 1024]
    - [56, 0.0]
  - - [8192, 16, 1, 1024]
    - [42, 0.0]
  - - [8192, 32, 1, 1024]
    - [42, 0.0]
  - - [8192, 64, 1, 1024]
    - [50, 0.0]
  - - [8192, 64, 1, 3584]
    - [78, 0.0]
  - - [8192, 128, 1, 1024]
    - [19, 0.0]
  - - [8192, 128, 1, 3584]
    - [77, 0.0]
  - - [512, 512, 1, 512]
    - [63, 0.0]
  - - [1024, 1024, 1, 1024]
    - [19, 0.0]
  - - [2048, 2048, 1, 2048]
    - [53, 0.0]
  - - [4096, 4096, 1, 4096]
    - [33, 0.0]
  - - [4096, 4096, 1, 8192]
    - [84, 0.0]
  - - [8192, 8192, 1, 8192]
    - [86, 0.0]
  - - [2, 7168, 1, 8192]
    - [6, 0.0]
  - - [2, 3584, 1, 8192]
    - [7, 0.0]
  - - [2, 1280, 1, 8192]
    - [8, 0.0]
  - - [8192, 7168, 1, 8192]
    - [85, 0.0]
  - - [8192, 3584, 1, 8192]
    - [83, 0.0]
  - - [8192, 1280, 1, 8192]
    - [82, 0.0]
  - - [152710, 2048, 1, 512]
    - [9, 0.0]
  - - [6, 384, 1, 1536]
    - [10, 0.0]
  - - [6, 3072, 1, 768]
    - [11, 0.0]
  - - [462, 768, 1, 384]
    - [12, 0.0]
  - - [462, 4096, 1, 384]
    - [13, 0.0]
  - - [462, 1472, 1, 384]
    - [14, 0.0]
  - - [6, 3072, 1, 1536]
    - [10, 0.0]
  - - [462, 768, 1, 768]
    - [15, 0.0]
  - - [462, 4096, 1, 768]
    - [13, 0.0]
  - - [462, 1472, 1, 768]
    - [14, 0.0]
  - - [6, 3072, 1, 3072]
    - [16, 0.0]
  - - [462, 768, 1, 1536]
    - [17, 0.0]
  - - [462, 4096, 1, 1536]
    - [18, 0.0]
  - - [462, 1472, 1, 1536]
    - [75, 0.0]
  - - [16384, 128, 1, 2304]
    - [74, 0.0]
  - - [1152, 1152, 1, 1152]
    - [20, 0.0]
  - - [2560, 2560, 1, 2560]
    - [21, 0.0]
  - - [384, 1536, 1, 12288]
    - [80, 0.0]
  - - [384, 6144, 1, 1536]
    - [22, 0.0]
  - - [96, 1536, 1, 1536]
    - [23, 0.0]
  - - [96, 1536, 1, 12288]
    - [76, 0.0]
  - - [96, 6144, 1, 1536]
    - [24, 0.0]
  - - [6144, 384, 1, 3072]
    - [25, 0.0]
  - - [6144, 1536, 1, 384]
    - [26, 0.0]
  - - [2048, 131072, 1, 16384]
    - [27, 0.0]
  - - [1408, 1408, 1, 1408]
    - [28, 0.0]
  - - [2688, 2688, 1, 2688]
    - [29, 0.0]
  - - [3712, 3712, 1, 3712]
    - [30, 0.0]
  - - [3840, 3840, 1, 3840]
    - [31, 0.0]
  - - [3968, 3968, 1, 3968]
    - [32, 0.0]
  - - [3328, 3328, 1, 3328]
    - [34, 0.0]
  - - [4000, 8192, 1, 8192]
    - [35, 0.0]
  - - [64896, 2048, 1, 512]
    - [36, 0.0]
  - - [6144, 384, 1, 384]
    - [37, 0.0]
  - - [16384, 32768, 1, 2304]
    - [38, 0.0]
  - - [16384, 128, 1, 13312]
    - [79, 0.0]
  - - [1536, 1536, 1, 1536]
    - [39, 0.0]
  - - [1664, 1664, 1, 1664]
    - [40, 0.0]
  - - [2816, 2816, 1, 2816]
    - [41, 0.0]
  - - [1536, 768, 1, 768]
    - [43, 0.0]
  - - [1536, 768, 1, 6144]
    - [44, 0.0]
  - - [1536, 3072, 1, 768]
    - [45, 0.0]
  - - [384, 1536, 1, 1536]
    - [81, 0.0]
  - - [2048, 65536, 1, 16384]
    - [27, 0.0]
  - - [2048, 8192, 1, 16384]
    - [46, 0.0]
  - - [1792, 1792, 1, 1792]
    - [47, 0.0]
  - - [1920, 1920, 1, 1920]
    - [48, 0.0]
  - - [2944, 2944, 1, 2944]
    - [49, 0.0]
  - - [16384, 8, 1, 13312]
    - [51, 0.0]
  - - [16384, 4096, 1, 13312]
    - [52, 0.0]
  - - [2176, 2176, 1, 2176]
    - [54, 0.0]
  - - [3072, 3072, 1, 3072]
    - [55, 0.0]
  - - [2048, 32768, 1, 16384]
    - [57, 0.0]
  - - [2304, 2304, 1, 2304]
    - [58, 0.0]
  - - [2432, 2432, 1, 2432]
    - [59, 0.0]
  - - [3200, 3200, 1, 3200]
    - [60, 0.0]
  - - [256, 256, 1, 256]
    - [61, 0.0]
  - - [384, 384, 1, 384]
    - [62, 0.0]
  - - [640, 640, 1, 640]
    - [64, 0.0]
  - - [768, 768, 1, 768]
    - [65, 0.0]
  - - [896, 896, 1, 896]
    - [66, 0.0]
  - - [3456, 3456, 1, 3456]
    - [67, 0.0]
  - - [3584, 3584, 1, 3584]
    - [68, 0.0]
  - - [16384, 2, 1, 2304]
    - [69, 0.0]
  - - [4000, 2, 1, 8192]
    - [71, 0.0]
  - - [5560, 1024, 1, 2780]
    - [72, 0.0]
  - - [2780, 1024, 1, 5560]
    - [73, 0.0]
  - - [12288, 2048, 1, 4096]
    - [87, 0.0]
  - - [22016, 2048, 1, 4096]
    - [88, 0.0]
  - - [32000, 2048, 1, 4096]
    - [88, 0.0]
  - - [4096, 2048, 1, 4096]
    - [89, 0.0]
  - - [4096, 65536, 1, 11008]
    - [90, 0.0]
  - - [4096, 65536, 1, 32000]
    - [91, 0.0]
  - - [4096, 49152, 1, 32000]
    - [115, 0.0]
  - - [1024, 2048, 1, 16256]
    - [92, 0.0]
  - - [512, 331051, 1, 1536]
    - [93, 0.0]
  - - [512, 395225, 1, 1024]
    - [94, 0.0]
  - - [7680, 16, 1, 6144]
    - [95, 0.0]
  - - [6144, 16, 1, 19648]
    - [96, 0.0]
  - - [39296, 16, 1, 6144]
    - [97, 0.0]
  - - [39296, 8, 1, 6144]
    - [98, 0.0]
  - - [6144, 8, 1, 19648]
    - [96, 0.0]
  - - [7680, 8, 1, 6144]
    - [99, 0.0]
  - - [1024, 2885, 1, 1024]
    - [100, 0.0]
  - - [1024, 2885, 1, 4096]
    - [100, 0.0]
  - - [3072, 1875, 1, 3072]
    - [101, 0.0]
  - - [3072, 1875, 1, 8192]
    - [102, 0.0]
  - - [3072, 757, 1, 3072]
    - [103, 0.0]
  - - [3072, 757, 1, 4096]
    - [103, 0.0]
  - - [4096, 2885, 1, 1024]
    - [104, 0.0]
  - - [16384, 1875, 1, 3072]
    - [105, 0.0]
  - - [32064, 1875, 1, 3072]
    - [106, 0.0]
  - - [9216, 1875, 1, 3072]
    - [107, 0.0]
  - - [2048, 1152, 1, 2048]
    - [108, 0.0]
  - - [1024, 4608, 1, 1024]
    - [109, 0.0]
  - - [2048, 462, 1, 4096]
    - [110, 0.0]
  - - [512, 18432, 1, 512]
    - [111, 0.0]
  - - [512, 18432, 1, 2048]
    - [112, 0.0]
  - - [2048, 308, 1, 1472]
    - [113, 0.0]
  - - [50304, 51200, 1, 1600]
    - [114, 0.0]
  - - [8192, 57344, 1, 32000]
    - [115, 0.0]
  - - [8192, 106496, 1, 32000]
    - [115, 0.0]
  - - [8192, 2048, 1, 1024]
    - [116, 0.0]
  - - [1280, 2048, 1, 8192]
    - [117, 0.0]
  - - [1280, 1024, 1, 8192]
    - [118, 0.0]
  - - [8192, 4096, 1, 1024]
    - [119, 0.0]
  - - [1280, 8192, 1, 8192]
    - [120, 0.0]
  - - [1280, 4096, 1, 8192]
    - [121, 0.0]
  - - [8192, 1024, 1, 1024]
    - [122, 0.0]
  - - [8192, 8192, 1, 1024]
    - [123, 0.0]
  - - [1024, 1024, 48, 128]
    - [124, 105.88]
  - - [1357, 1024, 48, 128]
    - [125, 93.98]
  - - [256, 256, 64, 64]
    - [126, 40.77]
  - - [256, 796032, 1, 1024]
    - [127, 0.0]
  - - [222, 5905, 1, 1024]
    - [128, 0.0]
  - - [256, 5905, 1, 128]
    - [129, 0.0]
  - - [1024, 5905, 1, 6144]
    - [130, 0.0]
  - - [4096, 5905, 1, 6144]
    - [131, 0.0]
  - - [1024, 5905, 1, 11715]
    - [132, 0.0]
  - - [2048, 5905, 1, 5120]
    - [133, 0.0]
  - - [11715, 5905, 1, 1024]
    - [134, 0.0]
  - - [512, 5905, 1, 512]
    - [135, 0.0]
  - - [256, 5905, 1, 1024]
    - [136, 0.0]
  - - [256, 1024, 1, 256]
    - [137, 0.0]
  - - [2048, 5905, 1, 1475]
    - [138, 0.0]
  - - [2048, 5905, 1, 4440]
    - [139, 0.0]
  - - [512, 5905, 1, 1475]
    - [140, 0.0]
  - - [256, 795008, 1, 256]
    - [141, 0.0]
  - - [1024, 5905, 1, 5120]
    - [142, 0.0]
  - - [768, 796032, 1, 256]
    - [143, 0.0]
  - - [24, 1511680, 1, 224]
    - [144, 0.0]
  - - [5120, 5905, 1, 4096]
    - [145, 0.0]
  - - [1475, 5905, 1, 1024]
    - [146, 0.0]
  - - [512, 5905, 1, 256]
    - [147, 0.0]
  - - [256, 222, 5905, 20]
    - [148, 0.0]
  - - [1024, 5905, 1, 1475]
    - [149, 0.0]
  - - [11144, 5905, 1, 128]
    - [150, 0.0]
  - - [2048, 5905, 1, 4040]
    - [151, 0.0]
  - - [256, 5905, 1, 64]
    - [152, 0.0]
  - - [256, 202, 5905, 20]
    - [153, 0.0]
  - - [202, 5905, 1, 1024]
    - [154, 0.0]
  - - [128, 5905, 1, 1475]
    - [155, 0.0]
  - - [256, 5905, 1, 512]
    - [156, 0.0]
  - - [8, 5905, 1, 512]
    - [157, 0.0]
  - - [256, 795008, 1, 512]
    - [158, 0.0]
  - - [1475, 5905, 1, 128]
    - [159, 0.0]
  - - [256, 795008, 1, 192]
    - [160, 0.0]
  - - [128, 5905, 1, 1024]
    - [161, 0.0]
  - - [5120, 5905, 1, 11715]
    - [162, 0.0]
  - - [20, 1511680, 1, 198]
    - [163, 0.0]
  - - [6144, 5905, 1, 1024]
    - [164, 0.0]
  - - [1024, 5905, 1, 512]
    - [165, 0.0]
  - - [20, 1511680, 1, 202]
    - [166, 0.0]
  - - [8192, 2048, 1, 3584]
    - [88, 0.0]
  - - [4096, 49152, 1, 128256]
    - [122, 0.0]
  - - [4096, 49152, 1, 1024]
    - [143, 0.0]
  - - [512, 24576, 1, 2048]
    - [127, 0.0]
  - - [2048, 4112, 1, 3840]
    - [167, 0.0]
  - - [384, 384, 16, 192]
    - [152, 0.0]
  - - [2304, 528, 1, 576]
    - [152, 0.0]
  - - [96, 21, 32, 96]
    - [69, 0.0]
  - - [512, 24576, 1, 304]
    - [168, 0.0]
  - - [576, 32, 1, 576]
    - [169, 0.0]
  - - [576, 24576, 1, 576]
    - [170, 0.0]
  - - [576, 4096, 1, 576]
    - [171, 0.0]
  - - [576, 528, 1, 576]
    - [62, 0.0]
  - - [1, 64, 1, 1]
    - [97, 0.0]
  - - [8192, 4112, 1, 2048]
    - [105, 0.0]
  - - [1728, 4096, 1, 576]
    - [130, 0.0]
  - - [1728, 528, 1, 576]
    - [113, 0.0]
  - - [21, 96, 32, 96]
    - [11, 0.0]
  - - [304, 24576, 1, 512]
    - [4, 0.0]
  - - [3840, 24576, 1, 576]
    - [172, 0.0]
  - - [1024, 16, 1, 1024]
    - [10, 0.0]
  - - [1024, 16, 1, 512]
    - [61, 0.0]
  - - [2048, 4112, 1, 2048]
    - [112, 0.0]
  - - [576, 32, 1, 2304]
    - [173, 0.0]
  - - [2048, 24576, 1, 512]
    - [94, 0.0]
  - - [96, 96, 32, 96]
    - [137, 0.0]
  - - [1152, 4096, 1, 576]
    - [109, 0.0]
  - - [576, 528, 1, 2304]
    - [174, 0.0]
  - - [512, 100, 16, 128]
    - [152, 0.0]
- null
- null
- DeviceEfficiency
- Equality
