projects/hipblaslt/library/src/amd_detail/rocblaslt/src/Tensile/Logic/asm_full/aquavanjaram/gfx942/Equality/aquavanjaram_Cijk_Alik_Bljk_F8NBS_STA_BH_Bias_HAS_SAB_SAV_UserArgs.yaml
- {MinimumRequiredVersion: 4.33.0}
- aquavanjaram
- gfx942
- [Device 0049, Device 0050]
    SolutionIndex: 0
    SolutionNameMin: Cijk_Alik_Bljk_F8NBS_STA_BH_Bias_HAS_SAB_SAV_UserArgs_MT128x32x128_MI16x16x1_SN_LDSB0_GRVWB16_GSU1_GSUAMB_GSUC0_GSUWGMRR0_K1_LBSPPB256_MIWT2_2_NLCA2_SU8_SUM1_SUS128_VWB2_WG64_4_1_WGM1_WGMXCC8_WGMXCCGn1
    SolutionIndex: 1
    SolutionNameMin: Cijk_Alik_Bljk_F8NBS_STA_BH_Bias_HAS_SAB_SAV_UserArgs_MT256x48x128_MI16x16x1_SN_LDSB0_GRVWB8_GSU1_GSUAMB_GSUC0_GSUWGMRR0_K1_LBSPPB128_MIWT4_3_NLCA2_SU0_SUM0_SUS0_VWB1_WG64_4_1_WGM1_WGMXCC8_WGMXCCGn1
    SolutionIndex: 2
    SolutionNameMin: Cijk_Alik_Bljk_F8NBS_STA_BH_Bias_HAS_SAB_SAV_UserArgs_MT128x64x128_MI16x16x1_SN_LDSB0_GRVWB16_GSU1_GSUAMB_GSUC0_GSUWGMRR0_K1_LBSPPB512_MIWT2_4_NLCA2_SU8_SUM1_SUS128_VWB4_WG64_4_1_WGM1_WGMXCC8_WGMXCCGn1
    SolutionIndex: 3
    SolutionNameMin: Cijk_Alik_Bljk_F8NBS_STA_BH_Bias_HAS_SAB_SAV_UserArgs_MT128x64x128_MI16x16x1_SN_LDSB0_GRVWB16_GSU1_GSUAMB_GSUC0_GSUWGMRR0_K1_LBSPPB512_MIWT2_4_NLCA2_SU0_SUM0_SUS0_VWB4_WG64_4_1_WGM8_WGMXCC8_WGMXCCGn1
    SolutionIndex: 4
    SolutionNameMin: Cijk_Alik_Bljk_F8NBS_STA_BH_Bias_HAS_SAB_SAV_UserArgs_MT256x64x128_MI16x16x1_SN_LDSB0_GRVWB16_GSU1_GSUAMB_GSUC0_GSUWGMRR0_K1_LBSPPB512_MIWT4_4_NLCA2_SU0_SUM0_SUS0_VWB4_WG64_4_1_WGM1_WGMXCC8_WGMXCCGn1
    SolutionIndex: 5
    SolutionNameMin: Cijk_Alik_Bljk_F8NBS_STA_BH_Bias_HAS_SAB_SAV_UserArgs_MT192x96x128_MI16x16x1_SN_LDSB0_GRVWB16_GSU1_GSUAMB_GSUC0_GSUWGMRR0_K1_LBSPPB256_MIWT3_6_NLCA2_SU0_SUM0_SUS0_VWB2_WG64_4_1_WGM8_WGMXCC8_WGMXCCGn1
    SolutionIndex: 6
    SolutionNameMin: Cijk_Alik_Bljk_F8NBS_STA_BH_Bias_HAS_SAB_SAV_UserArgs_MT256x96x128_MI16x16x1_SN_LDSB0_GRVWB16_GSU1_GSUAMB_GSUC0_GSUWGMRR0_K1_LBSPPB256_MIWT4_6_NLCA2_SU8_SUM1_SUS128_VWB2_WG64_4_1_WGM1_WGMXCC8_WGMXCCGn1
    SolutionIndex: 7
    SolutionNameMin: Cijk_Alik_Bljk_F8NBS_STA_BH_Bias_HAS_SAB_SAV_UserArgs_MT128x128x128_MI16x16x1_SN_LDSB1_GRVWB16_GSU1_GSUAMB_GSUC0_GSUWGMRR0_K1_LBSPPB1024_MIWT2_8_NLCA2_SU0_SUM0_SUS0_VWB8_WG64_4_1_WGM8_WGMXCC8_WGMXCCGn1
    SolutionIndex: 8
    SolutionNameMin: Cijk_Alik_Bljk_F8NBS_STA_BH_Bias_HAS_SAB_SAV_UserArgs_MT256x128x128_MI16x16x1_SN_LDSB1_GRVWB16_GSU1_GSUAMB_GSUC0_GSUWGMRR0_K1_LBSPPB1024_MIWT4_8_NLCA2_SU0_SUM0_SUS0_VWB8_WG64_4_1_WGM1_WGMXCC8_WGMXCCGn1
    SolutionIndex: 9
    SolutionNameMin: Cijk_Alik_Bljk_F8NBS_STA_BH_Bias_HAS_SAB_SAV_UserArgs_MT512x128x128_MI16x16x1_SN_LDSB0_GRVWB16_GSU1_GSUAMB_GSUC0_GSUWGMRR0_K1_LBSPPB1024_MIWT8_8_NLCA2_SU0_SUM0_SUS0_VWB8_WG64_4_1_WGM6_WGMXCC8_WGMXCCGn1
    SolutionIndex: 10
    SolutionNameMin: Cijk_Alik_Bljk_F8NBS_STA_BH_Bias_HAS_SAB_SAV_UserArgs_MT256x144x128_MI16x16x1_SN_LDSB0_GRVWB8_GSU1_GSUAMB_GSUC0_GSUWGMRR0_K1_LBSPPB128_MIWT4_9_NLCA2_SU0_SUM0_SUS0_VWB1_WG64_4_1_WGM6_WGMXCC8_WGMXCCGn1
    SolutionIndex: 11
    SolutionNameMin: Cijk_Alik_Bljk_F8NBS_STA_BH_Bias_HAS_SAB_SAV_UserArgs_MT32x32x256_MI16x16x1_SN_LDSB0_GRVWB16_GSU1_GSUAMB_GSUC0_GSUWGMRR0_K1_LBSPPB256_MIWT1_1_NLCA4_SU0_SUM0_SUS0_VWB1_WG32_8_1_WGM1_WGMXCC8_WGMXCCGn1
    SolutionIndex: 12
    SolutionNameMin: Cijk_Alik_Bljk_F8NBS_STA_BH_Bias_HAS_SAB_SAV_UserArgs_MT128x48x256_MI16x16x1_SN_LDSB0_GRVWB16_GSU1_GSUAMB_GSUC0_GSUWGMRR0_K1_LBSPPB256_MIWT2_3_NLCA4_SU0_SUM0_SUS0_VWB1_WG64_4_1_WGM6_WGMXCC8_WGMXCCGn1
    SolutionIndex: 13
    SolutionNameMin: Cijk_Alik_Bljk_F8NBS_STA_BH_Bias_HAS_SAB_SAV_UserArgs_MT192x48x256_MI16x16x1_SN_LDSB0_GRVWB16_GSU1_GSUAMB_GSUC0_GSUWGMRR0_K1_LBSPPB256_MIWT3_3_NLCA4_SU0_SUM0_SUS0_VWB1_WG64_4_1_WGM6_WGMXCC8_WGMXCCGn1
    SolutionIndex: 14
    SolutionNameMin: Cijk_Alik_Bljk_F8NBS_STA_BH_Bias_HAS_SAB_SAV_UserArgs_MT192x48x256_MI16x16x1_SN_LDSB0_GRVWB16_GSU1_GSUAMB_GSUC0_GSUWGMRR0_K1_LBSPPB256_MIWT3_3_NLCA4_SU0_SUM0_SUS0_VWB1_WG64_4_1_WGM8_WGMXCC8_WGMXCCGn1
    SolutionIndex: 15
    SolutionNameMin: Cijk_Alik_Bljk_F8NBS_STA_BH_Bias_HAS_SAB_SAV_UserArgs_MT128x64x256_MI16x16x1_SN_LDSB1_GRVWB16_GSU1_GSUAMB_GSUC0_GSUWGMRR0_K1_LBSPPB1024_MIWT2_4_NLCA4_SU0_SUM0_SUS0_VWB4_WG64_4_1_WGM1_WGMXCC8_WGMXCCGn1
    SolutionIndex: 16
    SolutionNameMin: Cijk_Alik_Bljk_F8NBS_STA_BH_Bias_HAS_SAB_SAV_UserArgs_MT128x64x256_MI16x16x1_SN_LDSB1_GRVWB16_GSU1_GSUAMB_GSUC0_GSUWGMRR0_K1_LBSPPB1024_MIWT2_4_NLCA4_SU0_SUM0_SUS0_VWB4_WG64_4_1_WGM6_WGMXCC8_WGMXCCGn1
    SolutionIndex: 17
    SolutionNameMin: Cijk_Alik_Bljk_F8NBS_STA_BH_Bias_HAS_SAB_SAV_UserArgs_MT64x16x512_MI16x16x1_SN_LDSB0_GRVWB16_GSU1_GSUAMB_GSUC0_GSUWGMRR0_K1_LBSPPB512_MIWT1_1_NLCA8_SU8_SUM1_SUS512_VWB1_WG64_4_1_WGM1_WGMXCC8_WGMXCCGn1
    SolutionIndex: 18
    SolutionNameMin: Cijk_Alik_Bljk_F8NBS_STA_BH_Bias_HAS_SAB_SAV_UserArgs_MT64x16x512_MI16x16x1_SN_LDSB0_GRVWB16_GSU1_GSUAMB_GSUC0_GSUWGMRR0_K1_LBSPPB512_MIWT1_1_NLCA8_SU0_SUM0_SUS0_VWB1_WG64_4_1_WGM6_WGMXCC8_WGMXCCGn1
    SolutionIndex: 19
    SolutionNameMin: Cijk_Alik_Bljk_F8NBS_STA_BH_Bias_HAS_SAB_SAV_UserArgs_MT64x32x512_MI16x16x1_SN_LDSB1_GRVWB16_GSU1_GSUAMB_GSUC0_GSUWGMRR0_K1_LBSPPB1024_MIWT1_2_NLCA8_SU0_SUM0_SUS0_VWB2_WG64_4_1_WGM6_WGMXCC8_WGMXCCGn1
    SolutionIndex: 20
    SolutionNameMin: Cijk_Alik_Bljk_F8NBS_STA_BH_Bias_HAS_SAB_SAV_UserArgs_MT128x32x512_MI16x16x1_SN_LDSB1_GRVWB16_GSU1_GSUAMB_GSUC0_GSUWGMRR0_K1_LBSPPB1024_MIWT2_2_NLCA8_SU0_SUM0_SUS0_VWB2_WG64_4_1_WGM6_WGMXCC8_WGMXCCGn1
    SolutionIndex: 21
    SolutionNameMin: Cijk_Alik_Bljk_F8NBS_STA_BH_Bias_HAS_SAB_SAV_UserArgs_MT64x48x512_MI16x16x1_SN_LDSB1_GRVWB16_GSU1_GSUAMB_GSUC0_GSUWGMRR0_K1_LBSPPB512_MIWT1_3_NLCA8_SU0_SUM0_SUS0_VWB1_WG64_4_1_WGM6_WGMXCC8_WGMXCCGn1
- - - [16384, 1152, 1, 2048, 16384, 16384, 2048, 2048]
    - [9, 401.32]
  - - [2048, 1152, 1, 8192, 2048, 2048, 8192, 8192]
    - [16, 357.69]
  - - [2048, 1152, 1, 2048, 2048, 2048, 2048, 2048]
    - [16, 261.12]
  - - [8192, 4608, 1, 1024, 8192, 8192, 1024, 1024]
    - [5, 335.06]
  - - [1024, 4608, 1, 1024, 1024, 1024, 1024, 1024]
    - [3, 253.13]
  - - [1024, 4608, 1, 4096, 1024, 1024, 4096, 4096]
    - [4, 373.84]
  - - [4096, 18432, 1, 512, 4096, 4096, 512, 512]
    - [1, 272.67]
  - - [512, 18432, 1, 512, 512, 512, 512, 512]
    - [4, 228.32]
  - - [16384, 576, 1, 2048, 16384, 16384, 2048, 2048]
    - [10, 337.0]
  - - [512, 18432, 1, 2048, 512, 512, 2048, 2048]
    - [8, 347.2]
  - - [8192, 2304, 1, 1024, 8192, 8192, 1024, 1024]
    - [7, 320.35]
  - - [2048, 576, 1, 2048, 2048, 2048, 2048, 2048]
    - [20, 179.95]
  - - [4096, 9216, 1, 512, 4096, 4096, 512, 512]
    - [6, 259.59]
  - - [1024, 2304, 1, 4096, 1024, 1024, 4096, 4096]
    - [15, 315.99]
  - - [1024, 2304, 1, 1024, 1024, 1024, 1024, 1024]
    - [0, 195.04]
  - - [16384, 288, 1, 2048, 16384, 16384, 2048, 2048]
    - [14, 268.01]
  - - [2048, 576, 1, 8192, 2048, 2048, 8192, 8192]
    - [12, 270.23]
  - - [512, 9216, 1, 2048, 512, 512, 2048, 2048]
    - [4, 302.72]
  - - [512, 9216, 1, 512, 512, 512, 512, 512]
    - [2, 190.81]
  - - [2048, 288, 1, 2048, 2048, 2048, 2048, 2048]
    - [21, 123.13]
  - - [16384, 144, 1, 2048, 16384, 16384, 2048, 2048]
    - [13, 205.28]
  - - [3072, 77, 1, 768, 3072, 3072, 768, 768]
    - [11, 30.81]
  - - [768, 77, 1, 3072, 768, 768, 3072, 3072]
    - [17, 22.71]
  - - [768, 77, 1, 768, 768, 768, 768, 768]
    - [11, 7.94]
  - - [2048, 144, 1, 2048, 2048, 2048, 2048, 2048]
    - [18, 79.84]
  - - [2048, 144, 1, 8192, 2048, 2048, 8192, 8192]
    - [18, 130.02]
  - - [2048, 288, 1, 8192, 2048, 2048, 8192, 8192]
    - [19, 184.05]
- null
- null
- DeviceEfficiency
- Equality
