projects/hipblaslt/library/src/amd_detail/rocblaslt/src/Tensile/Logic/asm_full/aquavanjaram/gfx942/Equality/aquavanjaram_Cijk_Ailk_Bjlk_S_MX_B_UserArgs.yaml
- {MinimumRequiredVersion: 4.33.0}
- aquavanjaram
- gfx942
- [Device 0049, Device 0050]
    SolutionIndex: 0
    SolutionNameMin: Cijk_Ailk_Bjlk_S_MX_B_UserArgs_MT16x16x16_MI16x16x1_SN_LDSB0_GSU1_GSUC0_GSUWGMRR0_K1_MIWT1_1_NTA7_NTB0_PGR0_PLR1_SS0_SU0_SUM0_SUS0_SVW4_WGM8_WGMXCC1_WGMXCCGn1
    SolutionIndex: 1
    SolutionNameMin: Cijk_Ailk_Bjlk_S_MX_B_UserArgs_MT16x16x16_MI16x16x1_SN_LDSB0_GSU1_GSUC0_GSUWGMRR0_K1_MIWT1_1_NTA7_NTB0_PGR0_PLR1_SS0_SU8_SUM2_SUS64_SVW4_WGM8_WGMXCC1_WGMXCCGn1
    SolutionIndex: 2
    SolutionNameMin: Cijk_Ailk_Bjlk_S_MX_B_UserArgs_MT112x128x64_MI16x16x1_SN_GSU4_GSUC0_GSUWGMRR1_K1_MIWT7_2_SU2_SUM0_SUS512_WGM133_WGMXCC8_WGMXCCG0
    SolutionIndex: 3
    SolutionNameMin: Cijk_Ailk_Bjlk_S_MX_B_UserArgs_MT160x384x16_MI16x16x1_SN_GSU1_GSUC0_GSUWGMRR1_K1_MIWT10_6_SU0_SUM0_SUS0_WGM38_WGMXCC2_WGMXCCGn1
    SolutionIndex: 4
    SolutionNameMin: Cijk_Ailk_Bjlk_S_MX_B_UserArgs_MT176x192x16_MI16x16x1_SN_GSU4_GSUC1_GSUWGMRR1_K1_MIWT11_3_SU64_SUM0_SUS128_WGM6_WGMXCC4_WGMXCCG228
    SolutionIndex: 5
    SolutionNameMin: Cijk_Ailk_Bjlk_S_MX_B_UserArgs_MT144x128x16_MI16x16x1_SN_GSU4_GSUC0_GSUWGMRR1_K1_MIWT9_2_SU8_SUM0_SUS512_WGM285_WGMXCC8_WGMXCCGn1
    SolutionIndex: 6
    SolutionNameMin: Cijk_Ailk_Bjlk_S_MX_B_UserArgs_MT128x112x64_MI16x16x1_SN_GSU8_GSUC1_GSUWGMRR1_K1_MIWT2_7_SU4_SUM0_SUS256_WGM95_WGMXCC4_WGMXCCG0
    SolutionIndex: 7
    SolutionNameMin: Cijk_Ailk_Bjlk_S_MX_B_UserArgs_MT96x32x32_MI16x16x1_SN_GSU16_GSUC0_GSUWGMRR1_K1_LBSPPA768_LBSPPB256_LPA16_LPB16_MIWT3_1_SU4_SUM0_SUS128_WG32_8_1_WGM0_WGMXCC8_WGMXCCG0
    SolutionIndex: 8
    SolutionNameMin: Cijk_Ailk_Bjlk_S_MX_B_UserArgs_MT64x160x32_MI16x16x1_SN_GSU4_GSUC1_GSUWGMRR1_K1_MIWT2_5_SU4_SUM0_SUS128_WGM209_WGMXCC8_WGMXCCG0
    SolutionIndex: 9
    SolutionNameMin: Cijk_Ailk_Bjlk_S_MX_B_UserArgs_MT112x128x64_MI16x16x1_SN_GSU4_GSUC1_GSUWGMRR1_K1_MIWT7_2_SU16_SUM0_SUS256_WGM57_WGMXCC8_WGMXCCGn1
    SolutionIndex: 10
    SolutionNameMin: Cijk_Ailk_Bjlk_S_MX_B_UserArgs_MT144x128x16_MI16x16x1_SN_GSU4_GSUC1_GSUWGMRR0_K1_MIWT9_2_SU16_SUM0_SUS128_WGM4_WGMXCC8_WGMXCCG0
    SolutionIndex: 11
    SolutionNameMin: Cijk_Ailk_Bjlk_S_MX_B_UserArgs_MT128x80x64_MI16x16x1_SN_GSU8_GSUC1_GSUWGMRR1_K1_MIWT2_5_SU8_SUM4_SUS512_WGM0_WGMXCC16_WGMXCCGn1
    SolutionIndex: 12
    SolutionNameMin: Cijk_Ailk_Bjlk_S_MX_B_UserArgs_MT64x64x64_MI16x16x1_SN_GSU4_GSUC1_GSUWGMRR1_K1_MIWT2_2_SU4_SUM3_SUS2048_WGM0_WGMXCC8_WGMXCCG0
    SolutionIndex: 13
    SolutionNameMin: Cijk_Ailk_Bjlk_S_MX_B_UserArgs_MT80x192x16_MI16x16x1_SN_GSU4_GSUC1_GSUWGMRR1_K1_MIWT5_3_SU8_SUM2_SUS128_WGM1_WGMXCC8_WGMXCCG0
    SolutionIndex: 14
    SolutionNameMin: Cijk_Ailk_Bjlk_S_MX_B_UserArgs_MT80x256x16_MI16x16x1_SN_GSU4_GSUC0_GSUWGMRR0_K1_MIWT5_4_SU16_SUM0_SUS512_WGM1_WGMXCC16_WGMXCCGn1
    SolutionIndex: 15
    SolutionNameMin: Cijk_Ailk_Bjlk_S_MX_B_UserArgs_MT48x64x64_MI16x16x1_SN_GSU8_GSUC0_GSUWGMRR1_K1_MIWT3_1_SU64_SUM1_SUS1024_WGM38_WGMXCC4_WGMXCCG0
    SolutionIndex: 16
    SolutionNameMin: Cijk_Ailk_Bjlk_S_MX_B_UserArgs_MT192x256x16_MI32x32x1_SN_GSU4_GSUC0_GSUWGMRR1_K1_MIWT3_4_SU2_SUM0_SUS64_WGM0_WGMXCC8_WGMXCCGn1
    SolutionIndex: 17
    SolutionNameMin: Cijk_Ailk_Bjlk_S_MX_B_UserArgs_MT80x128x64_MI16x16x1_SN_GSU8_GSUC0_GSUWGMRR1_K1_MIWT5_2_SU32_SUM1_SUS512_WGM2_WGMXCC4_WGMXCCG0
    SolutionIndex: 18
    SolutionNameMin: Cijk_Ailk_Bjlk_S_MX_B_UserArgs_MT80x128x64_MI16x16x1_SN_GSU4_GSUC0_GSUWGMRR0_K1_MIWT5_2_SU0_SUM0_SUS0_WGM0_WGMXCC1_WGMXCCG32
    SolutionIndex: 19
    SolutionNameMin: Cijk_Ailk_Bjlk_S_MX_B_UserArgs_MT192x192x16_MI16x16x1_SN_GSU2_GSUC1_GSUWGMRR1_K1_MIWT6_6_SU2_SUM0_SUS128_WGM171_WGMXCC8_WGMXCCGn1
    SolutionIndex: 20
    SolutionNameMin: Cijk_Ailk_Bjlk_S_MX_B_UserArgs_MT80x128x32_MI16x16x1_SN_GSU4_GSUC1_GSUWGMRR1_K1_MIWT5_2_SU2_SUM0_SUS256_WGM76_WGMXCC8_WGMXCCG0
    SolutionIndex: 21
    SolutionNameMin: Cijk_Ailk_Bjlk_S_MX_B_UserArgs_MT16x64x64_MI16x16x1_SN_GSU16_GSUC0_GSUWGMRR1_K1_MIWT1_1_SU2_SUM0_SUS256_WGM0_WGMXCC16_WGMXCCG0
    SolutionIndex: 22
    SolutionNameMin: Cijk_Ailk_Bjlk_S_MX_B_UserArgs_MT320x96x32_MI16x16x1_SN_GSU8_GSUC0_GSUWGMRR0_K1_MIWT5_6_SU16_SUM0_SUS256_WGM247_WGMXCC8_WGMXCCG0
    SolutionIndex: 23
    SolutionNameMin: Cijk_Ailk_Bjlk_S_MX_B_UserArgs_MT80x128x32_MI16x16x1_SN_GSU76_GSUC0_GSUWGMRR1_K1_MIWT5_2_SU32_SUM0_SUS1024_WGM1_WGMXCC16_WGMXCCGn1
    SolutionIndex: 24
    SolutionNameMin: Cijk_Ailk_Bjlk_S_MX_B_UserArgs_MT16x16x128_MI16x16x1_SN_GSU8_GSUC0_GSUWGMRR0_K1_MIWT1_1_SU4_SUM4_SUS512_WGM1_WGMXCC1_WGMXCCG38
    SolutionIndex: 25
    SolutionNameMin: Cijk_Ailk_Bjlk_S_MX_B_UserArgs_MT224x192x16_MI16x16x1_SN_GSU1_GSUC1_GSUWGMRR1_K1_MIWT7_6_SU8_SUM2_SUS64_WGM209_WGMXCC8_WGMXCCGn1
    SolutionIndex: 26
    SolutionNameMin: Cijk_Ailk_Bjlk_S_MX_B_UserArgs_MT384x64x16_MI16x16x1_SN_GSU4_GSUC0_GSUWGMRR1_K1_MIWT6_4_SU32_SUM0_SUS64_WGM2_WGMXCC8_WGMXCCGn1
    SolutionIndex: 27
    SolutionNameMin: Cijk_Ailk_Bjlk_S_MX_B_UserArgs_MT112x64x64_MI16x16x1_SN_GSU8_GSUC0_GSUWGMRR1_K1_MIWT7_1_SU8_SUM0_SUS256_WGM0_WGMXCC4_WGMXCCG0
    SolutionIndex: 28
    SolutionNameMin: Cijk_Ailk_Bjlk_S_MX_B_UserArgs_MT160x128x16_MI16x16x1_SN_GSU4_GSUC0_GSUWGMRR1_K1_MIWT10_4_SU0_SUM0_SUS0_WGM8_WGMXCC8_WGMXCCGn1
    SolutionIndex: 29
    SolutionNameMin: Cijk_Ailk_Bjlk_S_MX_B_UserArgs_MT80x384x16_MI16x16x1_SN_GSU4_GSUC1_GSUWGMRR0_K1_MIWT5_6_SU16_SUM0_SUS512_WGM57_WGMXCC8_WGMXCCGn1
    SolutionIndex: 30
    SolutionNameMin: Cijk_Ailk_Bjlk_S_MX_B_UserArgs_MT64x32x64_MI16x16x1_SN_GSU8_GSUC1_GSUWGMRR1_K1_LBSPPA512_LBSPPB256_LPB16_MIWT2_1_SU2_SUM3_SUS2048_WG32_8_1_WGM0_WGMXCC8_WGMXCCG0
    SolutionIndex: 31
    SolutionNameMin: Cijk_Ailk_Bjlk_S_MX_B_UserArgs_MT32x128x32_MI16x16x1_SN_GSU8_GSUC0_GSUWGMRR1_K1_MIWT2_2_SU4_SUM2_SUS512_WGM1_WGMXCC2_WGMXCCG0
    SolutionIndex: 32
    SolutionNameMin: Cijk_Ailk_Bjlk_S_MX_B_UserArgs_MT64x96x32_MI16x16x1_SN_GSU8_GSUC0_GSUWGMRR1_K1_MIWT4_3_SU2_SUM0_SUS512_WGM12_WGMXCC32_WGMXCCG0
    SolutionIndex: 33
    SolutionNameMin: Cijk_Ailk_Bjlk_S_MX_B_UserArgs_MT128x144x32_MI16x16x1_SN_GSU8_GSUC0_GSUWGMRR0_K1_MIWT2_9_SU0_SUM0_SUS0_WGM1_WGMXCC8_WGMXCCG0
    SolutionIndex: 34
    SolutionNameMin: Cijk_Ailk_Bjlk_S_MX_B_UserArgs_MT256x96x32_MI32x32x1_SN_GSU8_GSUC0_GSUWGMRR0_K1_MIWT2_3_SU2_SUM0_SUS128_WGM114_WGMXCC8_WGMXCCGn1
    SolutionIndex: 35
    SolutionNameMin: Cijk_Ailk_Bjlk_S_MX_B_UserArgs_MT128x160x32_MI16x16x1_SN_GSU8_GSUC1_GSUWGMRR1_K1_MIWT4_5_SU0_SUM0_SUS0_WGM0_WGMXCC4_WGMXCCGn1
    SolutionIndex: 36
    SolutionNameMin: Cijk_Ailk_Bjlk_S_MX_B_UserArgs_MT128x144x16_MI16x16x1_SN_GSU4_GSUC1_GSUWGMRR1_K1_MIWT2_9_SU8_SUM1_SUS256_WGM16_WGMXCC4_WGMXCCG0
    SolutionIndex: 37
    SolutionNameMin: Cijk_Ailk_Bjlk_S_MX_B_UserArgs_MT80x128x32_MI16x16x1_SN_GSU8_GSUC0_GSUWGMRR1_K1_MIWT5_2_SU2_SUM1_SUS512_WGM19_WGMXCC16_WGMXCCG0
    SolutionIndex: 38
    SolutionNameMin: Cijk_Ailk_Bjlk_S_MX_B_UserArgs_MT176x128x16_MI16x16x1_SN_GSU4_GSUC0_GSUWGMRR1_K1_MIWT11_2_SU0_SUM0_SUS0_WGM95_WGMXCC8_WGMXCCG0
    SolutionIndex: 39
    SolutionNameMin: Cijk_Ailk_Bjlk_S_MX_B_UserArgs_MT112x448x16_MI16x16x1_SN_GSU4_GSUC0_GSUWGMRR1_K1_MIWT7_7_SU2_SUM0_SUS128_WGM12_WGMXCC8_WGMXCCGn1
    SolutionIndex: 40
    SolutionNameMin: Cijk_Ailk_Bjlk_S_MX_B_UserArgs_MT64x128x16_MI32x32x1_SN_GSU1_GSUC1_GSUWGMRR0_K1_MIWT1_2_SU4_SUM0_SUS128_WGM1_WGMXCC1_WGMXCCGn1
    SolutionIndex: 41
    SolutionNameMin: Cijk_Ailk_Bjlk_S_MX_B_UserArgs_MT16x128x64_MI16x16x1_SN_GSU8_GSUC0_GSUWGMRR0_K1_MIWT1_2_SU2_SUM2_SUS512_WGM1_WGMXCC4_WGMXCCG0
    SolutionIndex: 42
    SolutionNameMin: Cijk_Ailk_Bjlk_S_MX_B_UserArgs_MT144x128x32_MI16x16x1_SN_GSU8_GSUC0_GSUWGMRR0_K1_MIWT9_2_SU4_SUM0_SUS1024_WGM0_WGMXCC16_WGMXCCG0
    SolutionIndex: 43
    SolutionNameMin: Cijk_Ailk_Bjlk_S_MX_B_UserArgs_MT128x48x64_MI16x16x1_SN_GSU8_GSUC0_GSUWGMRR1_K1_MIWT2_3_SU4_SUM0_SUS256_WGM1_WGMXCC8_WGMXCCG0
    SolutionIndex: 44
    SolutionNameMin: Cijk_Ailk_Bjlk_S_MX_B_UserArgs_MT32x64x64_MI16x16x1_SN_GSU8_GSUC0_GSUWGMRR1_K1_MIWT2_1_SU2_SUM0_SUS256_WGM0_WGMXCC8_WGMXCCG0
    SolutionIndex: 45
    SolutionNameMin: Cijk_Ailk_Bjlk_S_MX_B_UserArgs_MT320x192x32_MI16x16x1_SN_GSU1_GSUC1_GSUWGMRR1_K1_MIWT10_6_SU2_SUM0_SUS128_WGM209_WGMXCC4_WGMXCCGn1
    SolutionIndex: 46
    SolutionNameMin: Cijk_Ailk_Bjlk_S_MX_B_UserArgs_MT32x128x32_MI16x16x1_SN_GSU8_GSUC0_GSUWGMRR1_K1_MIWT2_2_SU4_SUM3_SUS512_WGM1_WGMXCC2_WGMXCCG0
    SolutionIndex: 47
    SolutionNameMin: Cijk_Ailk_Bjlk_S_MX_B_UserArgs_MT112x256x16_MI16x16x1_SN_GSU4_GSUC1_GSUWGMRR1_K1_MIWT7_4_SU64_SUM0_SUS64_WGM1_WGMXCC8_WGMXCCGn1
    SolutionIndex: 48
    SolutionNameMin: Cijk_Ailk_Bjlk_S_MX_B_UserArgs_MT16x128x16_MI16x16x1_SN_GSU1_GSUC0_GSUWGMRR0_K1_MIWT1_2_SU4_SUM2_SUS64_WGM0_WGMXCC32_WGMXCCG0
    SolutionIndex: 49
    SolutionNameMin: Cijk_Ailk_Bjlk_S_MX_B_UserArgs_MT128x144x32_MI16x16x1_SN_GSU8_GSUC1_GSUWGMRR1_K1_MIWT2_9_SU2_SUM3_SUS2048_WGM1_WGMXCC8_WGMXCCG0
    SolutionIndex: 50
    SolutionNameMin: Cijk_Ailk_Bjlk_S_MX_B_UserArgs_MT192x128x16_MI32x32x1_SN_GSU8_GSUC1_GSUWGMRR0_K1_MIWT3_2_SU0_SUM0_SUS0_WGM1_WGMXCC16_WGMXCCG0
    SolutionIndex: 51
    SolutionNameMin: Cijk_Ailk_Bjlk_S_MX_B_UserArgs_MT32x128x16_MI32x32x1_SN_GSU1_GSUC1_GSUWGMRR1_K1_MIWT1_1_SU16_SUM2_SUS128_WGM1_WGMXCC1_WGMXCCG48
    SolutionIndex: 52
    SolutionNameMin: Cijk_Ailk_Bjlk_S_MX_B_UserArgs_MT128x192x16_MI16x16x1_SN_GSU8_GSUC1_GSUWGMRR1_K1_MIWT4_6_SU16_SUM1_SUS128_WGM1_WGMXCC16_WGMXCCG0
    SolutionIndex: 53
    SolutionNameMin: Cijk_Ailk_Bjlk_S_MX_B_UserArgs_MT144x256x16_MI16x16x1_SN_GSU2_GSUC1_GSUWGMRR1_K1_MIWT9_4_SU2_SUM3_SUS256_WGM304_WGMXCC4_WGMXCCGn1
    SolutionIndex: 54
    SolutionNameMin: Cijk_Ailk_Bjlk_S_MX_B_UserArgs_MT256x96x32_MI32x32x1_SN_GSU8_GSUC1_GSUWGMRR0_K1_MIWT2_3_SU8_SUM3_SUS2048_WGM0_WGMXCC1_WGMXCCG2
    SolutionIndex: 55
    SolutionNameMin: Cijk_Ailk_Bjlk_S_MX_B_UserArgs_MT256x112x16_MI16x16x1_SN_GSU4_GSUC1_GSUWGMRR1_K1_MIWT4_7_SU8_SUM2_SUS64_WGM1_WGMXCC8_WGMXCCGn1
    SolutionIndex: 56
    SolutionNameMin: Cijk_Ailk_Bjlk_S_MX_B_UserArgs_MT48x128x64_MI16x16x1_SN_GSU16_GSUC0_GSUWGMRR1_K1_MIWT3_2_SU2_SUM0_SUS256_WGM1_WGMXCC16_WGMXCCG0
    SolutionIndex: 57
    SolutionNameMin: Cijk_Ailk_Bjlk_S_MX_B_UserArgs_MT16x64x64_MI16x16x1_SN_GSU8_GSUC0_GSUWGMRR1_K1_MIWT1_1_SU4_SUM2_SUS1024_WGM1_WGMXCC8_WGMXCCG152
    SolutionIndex: 58
    SolutionNameMin: Cijk_Ailk_Bjlk_S_MX_B_UserArgs_MT256x96x32_MI16x16x1_SN_GSU8_GSUC1_GSUWGMRR1_K1_MIWT4_6_SU2_SUM4_SUS128_WGM152_WGMXCC16_WGMXCCGn1
- - - [8, 1, 265302, 128]
    - [1, 0.7]
  - - [8, 1, 127398, 128]
    - [0, 0.67]
  - - [1980, 450, 1, 4096]
    - [2, 0.0]
  - - [3024, 6048, 1, 4096]
    - [3, 0.0]
  - - [491, 3480, 1, 4096]
    - [4, 0.0]
  - - [4888, 256, 1, 4096]
    - [5, 0.0]
  - - [512, 660, 1, 4096]
    - [6, 0.0]
  - - [91, 512, 1, 4096]
    - [7, 0.0]
  - - [1980, 320, 1, 4096]
    - [8, 0.0]
  - - [1972, 492, 1, 4096]
    - [9, 0.0]
  - - [5039, 256, 1, 4096]
    - [10, 0.0]
  - - [128, 2440, 1, 4096]
    - [11, 0.0]
  - - [512, 512, 1, 4096]
    - [12, 0.0]
  - - [775, 1319, 1, 4096]
    - [13, 0.0]
  - - [2560, 512, 1, 4096]
    - [14, 0.0]
  - - [450, 128, 1, 4096]
    - [15, 0.0]
  - - [1319, 2048, 1, 4096]
    - [16, 0.0]
  - - [397, 660, 1, 4096]
    - [17, 0.0]
  - - [6048, 128, 1, 4096]
    - [18, 0.0]
  - - [3960, 1024, 1, 4096]
    - [19, 0.0]
  - - [4953, 128, 1, 4096]
    - [20, 0.0]
  - - [64, 128, 1, 4096]
    - [21, 0.0]
  - - [7320, 91, 1, 4096]
    - [22, 0.0]
  - - [290, 128, 1, 49152]
    - [23, 0.0]
  - - [35, 193, 1, 4096]
    - [24, 0.0]
  - - [6048, 2048, 1, 4096]
    - [25, 0.0]
  - - [11288, 128, 1, 4096]
    - [26, 0.0]
  - - [320, 320, 1, 4096]
    - [27, 0.0]
  - - [6048, 512, 1, 4096]
    - [28, 0.0]
  - - [1980, 768, 1, 4096]
    - [29, 0.0]
  - - [92, 397, 1, 4096]
    - [30, 0.0]
  - - [512, 128, 1, 4096]
    - [31, 0.0]
  - - [768, 279, 1, 4096]
    - [32, 0.0]
  - - [1980, 136, 1, 4096]
    - [33, 0.0]
  - - [7320, 92, 1, 4096]
    - [34, 0.0]
  - - [128, 5120, 1, 4096]
    - [35, 0.0]
  - - [512, 2560, 1, 4096]
    - [36, 0.0]
  - - [660, 256, 1, 4096]
    - [37, 0.0]
  - - [5080, 256, 1, 4096]
    - [38, 0.0]
  - - [4248, 775, 1, 4096]
    - [39, 0.0]
  - - [40, 128, 4096, 61]
    - [40, 0.0]
  - - [272, 128, 1, 4096]
    - [41, 0.0]
  - - [5120, 128, 1, 4096]
    - [42, 0.0]
  - - [1980, 35, 1, 4096]
    - [43, 0.0]
  - - [397, 120, 1, 4096]
    - [44, 0.0]
  - - [6048, 3024, 1, 4096]
    - [45, 0.0]
  - - [512, 120, 1, 4096]
    - [46, 0.0]
  - - [3480, 512, 1, 4096]
    - [47, 0.0]
  - - [4, 128, 4096, 30]
    - [48, 0.0]
  - - [1980, 272, 1, 4096]
    - [49, 0.0]
  - - [4896, 128, 1, 4096]
    - [50, 0.0]
  - - [20, 128, 4096, 33]
    - [51, 0.0]
  - - [128, 6048, 1, 4096]
    - [52, 0.0]
  - - [1980, 1972, 1, 4096]
    - [53, 0.0]
  - - [7704, 92, 1, 4096]
    - [54, 0.0]
  - - [1024, 1980, 1, 4096]
    - [55, 0.0]
  - - [120, 256, 1, 4096]
    - [56, 0.0]
  - - [128, 128, 1, 4096]
    - [57, 0.0]
  - - [7704, 91, 1, 4096]
    - [58, 0.0]
- null
- null
- DeviceEfficiency
- Equality
