projects/hipblaslt/library/src/amd_detail/rocblaslt/src/Tensile/Logic/asm_full/aquavanjaram/gfx942/Equality/aquavanjaram_Cijk_Alik_Bljk_SB_UserArgs.yaml
- {MinimumRequiredVersion: 4.33.0}
- aquavanjaram
- gfx942
- [Device 0049, Device 0050]
    SolutionIndex: 0
    SolutionNameMin: Cijk_Alik_Bljk_SB_UserArgs_MT128x128x32_MI16x16x1_SN_GRVWA4_GRVWB4_GSU1_LBSPPA512_LBSPPB128_LPA8_LPB8_LRVW4_MIWT4_4_SU4_SUM0_SUS256_SVW4_VWA4_WG32_8_1_WGM0
    SolutionIndex: 1
    SolutionNameMin: Cijk_Alik_Bljk_SB_UserArgs_MT144x256x32_MI16x16x1_SN_GRVWA2_GRVWB4_GSU1_LBSPPA128_LBSPPB128_LPA8_LPB8_LRVW4_MIWT9_4_SU0_SUM0_SUS0_SVW1_VWA1_WG16_16_1_WGM16
    SolutionIndex: 2
    SolutionNameMin: Cijk_Alik_Bljk_SB_UserArgs_MT256x224x32_MI16x16x1_SN_GRVWA2_GRVWB2_GSU1_LBSPPA512_LBSPPB128_LPA2_LPB2_LRVW2_MIWT4_14_SU0_SUM0_SUS0_SVW4_VWA4_WG64_4_1_WGM16
    SolutionIndex: 3
    SolutionNameMin: Cijk_Alik_Bljk_SB_UserArgs_MT128x256x32_MI16x16x1_SN_GRVWA4_GRVWB4_GSU1_LBSPPA512_LBSPPB128_LPA8_LPB8_LRVW4_MIWT4_8_SU4_SUM0_SUS256_SVW4_VWA4_WG32_8_1_WGM16
    SolutionIndex: 4
    SolutionNameMin: Cijk_Alik_Bljk_SB_UserArgs_MT224x256x32_MI16x16x1_SN_GRVWA2_GRVWB2_GSU1_LBSPPA256_LBSPPB128_LPA2_LPB2_LRVW2_MIWT14_4_SU0_SUM0_SUS0_SVW2_VWA2_WG16_16_1_WGM8
    SolutionIndex: 5
    SolutionNameMin: Cijk_Alik_Bljk_SB_UserArgs_MT32x32x64_MI16x16x1_SN_GRVWA4_GRVWB4_GSU1_LBSPPA256_LBSPPB256_LPA8_LPB8_LRVW4_MIWT1_1_SU8_SUM0_SUS256_SVW1_VWA1_WG32_8_1_WGM0
    SolutionIndex: 6
    SolutionNameMin: Cijk_Alik_Bljk_SB_UserArgs_MT64x64x64_MI16x16x1_SN_GRVWA4_GRVWB4_GSU1_LBSPPA512_LBSPPB256_LPA8_LPB8_LRVW4_MIWT2_2_SU8_SUM0_SUS256_SVW2_VWA2_WG32_8_1_WGM8
    SolutionIndex: 7
    SolutionNameMin: Cijk_Alik_Bljk_SB_UserArgs_MT32x16x64_MI16x16x1_SN_LDSB0_GRVWA4_GRVWB4_GSU1_GSUAMBSK_GSUC0_GSUWGMRR0_K1_LBSPPA256_LBSPPB256_MIWT1_1_NTA7_NTB4_SU0_SUM0_SUS0_SVW1_VWA1_VWB1_WG32_4_1_WGM1_WGMXCC8_WGMXCCG304
    SolutionIndex: 8
    SolutionNameMin: Cijk_Alik_Bljk_SB_UserArgs_MT64x192x32_MI16x16x1_SN_GRVWA4_GRVWB4_GSU1_GSUC0_GSUWGMRR0_K1_LBSPPA512_LBSPPB128_LPA8_LPB8_LRVW4_MIAV1_MIWT4_3_NTB4_SU8_SUM0_SUS256_SVW4_VWA4_VWB1_WG16_16_1_WGM1_WGMXCC1_WGMXCCGn1
    SolutionIndex: 9
    SolutionNameMin: Cijk_Alik_Bljk_SB_UserArgs_MT128x448x16_MI16x16x1_SN_GRVWA4_GRVWB1_GSU1_GSUC0_GSUWGMRR0_K1_LBSPPA256_LBSPPB128_LPA4_LPB2_LRVW2_MIAV0_MIWT4_14_NTB0_SU8_SUM0_SUS256_SVW4_VWA4_VWB2_WG32_8_1_WGM1_WGMXCC1_WGMXCCGn1
    SolutionIndex: 10
    SolutionNameMin: Cijk_Alik_Bljk_SB_UserArgs_MT64x320x16_MI16x16x1_SN_GRVWA4_GRVWB4_GSU1_GSUC0_GSUWGMRR0_K1_LBSPPA256_LBSPPB128_LPA4_LPB4_LRVW2_MIAV1_MIWT4_5_NTB0_SU8_SUM0_SUS256_SVW4_VWA4_VWB1_WG16_16_1_WGM1_WGMXCC1_WGMXCCGn1
    SolutionIndex: 11
    SolutionNameMin: Cijk_Alik_Bljk_SB_UserArgs_MT128x192x16_MI16x16x1_SN_GRVWA4_GRVWB4_GSU1_GSUC0_GSUWGMRR0_K1_LBSPPA256_LBSPPB128_LPA4_LPB4_LRVW2_MIWT4_6_NTB0_SU8_SUM0_SUS256_SVW4_VWA4_VWB2_WG32_8_1_WGM1_WGMXCC1_WGMXCCGn1
    SolutionIndex: 12
    SolutionNameMin: Cijk_Alik_Bljk_SB_UserArgs_MT128x192x16_MI16x16x1_SN_GRVWA4_GRVWB4_GSU1_GSUC0_GSUWGMRR0_K1_LBSPPA256_LBSPPB128_LPA4_LPB4_LRVW2_MIAV0_MIWT4_6_NTB0_SU8_SUM0_SUS256_SVW4_VWA4_VWB2_WG32_8_1_WGM1_WGMXCC1_WGMXCCGn1
    SolutionIndex: 13
    SolutionNameMin: Cijk_Alik_Bljk_SB_UserArgs_MT128x320x16_MI16x16x1_SN_GRVWA4_GRVWB4_GSU1_GSUC0_GSUWGMRR0_K1_LBSPPA256_LBSPPB128_LPA4_LPB4_LRVW2_MIWT4_10_NTB0_SU8_SUM0_SUS256_SVW4_VWA4_VWB2_WG32_8_1_WGM1_WGMXCC1_WGMXCCGn1
    SolutionIndex: 14
    SolutionNameMin: Cijk_Alik_Bljk_SB_UserArgs_MT128x320x16_MI16x16x1_SN_GRVWA4_GRVWB4_GSU1_GSUC0_GSUWGMRR0_K1_LBSPPA256_LBSPPB128_LPA4_LPB4_LRVW2_MIAV0_MIWT8_5_NTB0_SU8_SUM0_SUS256_SVW4_VWA4_VWB1_WG16_16_1_WGM1_WGMXCC1_WGMXCCGn1
    SolutionIndex: 15
    SolutionNameMin: Cijk_Alik_Bljk_SB_UserArgs_MT64x384x16_MI16x16x1_SN_GRVWA1_GRVWB4_GSU1_GSUC0_GSUWGMRR0_K1_LBSPPA256_LBSPPB128_LPA2_LPB4_LRVW2_MIAV0_MIWT4_6_NTB0_SU8_SUM0_SUS256_SVW4_VWA4_VWB2_WG16_16_1_WGM1_WGMXCC1_WGMXCCGn1
    SolutionIndex: 16
    SolutionNameMin: Cijk_Alik_Bljk_SB_UserArgs_MT128x176x16_MI16x16x1_SN_GRVWA1_GRVWB1_GSU1_GSUC0_GSUWGMRR0_K1_LBSPPA128_LBSPPB128_LPA2_LPB2_LRVW2_MIWT2_11_NTB0_SU8_SUM0_SUS256_SVW2_VWA2_VWB1_WG64_4_1_WGM1_WGMXCC1_WGMXCCGn1
- - - [512, 512, 1, 512]
    - [5, 0.0]
  - - [1024, 1024, 1, 1024]
    - [6, 0.0]
  - - [2048, 2048, 1, 2048]
    - [0, 0.0]
  - - [4096, 4096, 1, 4096]
    - [4, 0.0]
  - - [4096, 4096, 1, 8192]
    - [2, 0.0]
  - - [4864, 4096, 1, 8192]
    - [3, 0.0]
  - - [8192, 8192, 1, 8192]
    - [1, 0.0]
  - - [77, 77, 20, 64]
    - [7, 2.04]
  - - [64, 1048576, 1, 128]
    - [8, 52429.6]
  - - [128, 356305, 1, 256]
    - [9, 67929.4]
  - - [64, 356305, 1, 128]
    - [10, 49151.5]
  - - [256, 1048576, 1, 256]
    - [11, 91821.4]
  - - [128, 1048576, 1, 256]
    - [12, 83623.5]
  - - [256, 8000000, 1, 256]
    - [13, 84184.8]
  - - [128, 8000000, 1, 256]
    - [14, 78690.9]
  - - [64, 8000000, 1, 128]
    - [15, 53983.7]
  - - [256, 356305, 1, 256]
    - [16, 80556.8]
- null
- null
- DeviceEfficiency
- Equality
