projects/hipblaslt/library/src/amd_detail/rocblaslt/src/Tensile/Logic/asm_full/aquavanjaram/gfx942/Equality/aquavanjaram_Cijk_Ailk_Bljk_S_MX_B_UserArgs.yaml
- {MinimumRequiredVersion: 4.33.0}
- aquavanjaram
- gfx942
- [Device 0049, Device 0050]
    SolutionIndex: 0
    SolutionNameMin: Cijk_Ailk_Bljk_S_MX_B_UserArgs_MT128x96x16_MI16x16x1_SN_GSU1_GSUC0_GSUWGMRR0_K1_MIWT4_3_SU16_SUM2_SUS256_WGM2_WGMXCC16_WGMXCCG0
    SolutionIndex: 1
    SolutionNameMin: Cijk_Ailk_Bljk_S_MX_B_UserArgs_MT128x80x64_MI16x16x1_SN_GSU1_GSUC0_GSUWGMRR1_K1_MIWT2_5_SU8_SUM0_SUS1024_WGM0_WGMXCC8_WGMXCCG0
    SolutionIndex: 2
    SolutionNameMin: Cijk_Ailk_Bljk_S_MX_B_UserArgs_MT320x112x16_MI16x16x1_SN_GSU1_GSUC1_GSUWGMRR1_K1_MIWT5_7_SU4_SUM0_SUS128_WGM1_WGMXCC2_WGMXCCGn1
    SolutionIndex: 3
    SolutionNameMin: Cijk_Ailk_Bljk_S_MX_B_UserArgs_MT256x128x32_MI32x32x1_SN_GSU4_GSUC1_GSUWGMRR1_K1_MIWT2_4_SU4_SUM0_SUS128_WGM8_WGMXCC8_WGMXCCGn1
    SolutionIndex: 4
    SolutionNameMin: Cijk_Ailk_Bljk_S_MX_B_UserArgs_MT256x96x16_MI16x16x1_SN_GSU1_GSUC1_GSUWGMRR1_K1_MIWT4_6_SU4_SUM0_SUS64_WGM6_WGMXCC8_WGMXCCG0
    SolutionIndex: 5
    SolutionNameMin: Cijk_Ailk_Bljk_S_MX_B_UserArgs_MT256x64x16_MI32x32x1_SN_GSU1_GSUC0_GSUWGMRR1_K1_MIWT2_2_SU64_SUM0_SUS1024_WGM38_WGMXCC4_WGMXCCGn1
    SolutionIndex: 6
    SolutionNameMin: Cijk_Ailk_Bljk_S_MX_B_UserArgs_MT96x128x32_MI16x16x1_SN_GSU1_GSUC1_GSUWGMRR1_K1_MIWT3_4_SU2_SUM1_SUS512_WGM266_WGMXCC1_WGMXCCGn1
    SolutionIndex: 7
    SolutionNameMin: Cijk_Ailk_Bljk_S_MX_B_UserArgs_MT64x48x32_MI16x16x1_SN_GSU1_GSUC0_GSUWGMRR1_K1_MIWT1_3_SU0_SUM0_SUS0_WGM0_WGMXCC8_WGMXCCG0
    SolutionIndex: 8
    SolutionNameMin: Cijk_Ailk_Bljk_S_MX_B_UserArgs_MT32x64x16_MI32x32x1_SN_GSU1_GSUC0_GSUWGMRR0_K1_MIWT1_2_SU2_SUM4_SUS256_WGM0_WGMXCC32_WGMXCCG0
    SolutionIndex: 9
    SolutionNameMin: Cijk_Ailk_Bljk_S_MX_B_UserArgs_MT32x48x16_MI16x16x1_SN_GSU1_GSUC0_GSUWGMRR0_K1_MIWT1_3_SU16_SUM3_SUS128_WGM114_WGMXCC1_WGMXCCG57
    SolutionIndex: 10
    SolutionNameMin: Cijk_Ailk_Bljk_S_MX_B_UserArgs_MT128x96x16_MI16x16x1_SN_GSU1_GSUC0_GSUWGMRR0_K1_MIWT4_3_SU4_SUM0_SUS2048_WGM0_WGMXCC16_WGMXCCGn1
    SolutionIndex: 11
    SolutionNameMin: Cijk_Ailk_Bljk_S_MX_B_UserArgs_MT32x16x64_MI16x16x1_SN_GSU16_GSUC0_GSUWGMRR1_K1_MIWT2_1_SU32_SUM4_SUS256_WGM0_WGMXCC1_WGMXCCG190
    SolutionIndex: 12
    SolutionNameMin: Cijk_Ailk_Bljk_S_MX_B_UserArgs_MT128x128x32_MI32x32x1_SN_GSU8_GSUC0_GSUWGMRR1_K1_LBSPPA0_LPB4_MIWT2_2_SU2_SUM3_SUS256_WG64_4_1_WGM95_WGMXCC1_WGMXCCG32
    SolutionIndex: 13
    SolutionNameMin: Cijk_Ailk_Bljk_S_MX_B_UserArgs_MT32x32x64_MI16x16x1_SN_GSU1_GSUC0_GSUWGMRR0_K1_LBSPPA512_LPA16_LPB8_MIWT1_1_SU2_SUM2_SUS256_WG32_8_1_WGM1_WGMXCC32_WGMXCCG0
    SolutionIndex: 14
    SolutionNameMin: Cijk_Ailk_Bljk_S_MX_B_UserArgs_MT64x64x32_MI16x16x1_SN_GSU1_GSUC0_GSUWGMRR1_K1_LBSPPA1024_LPB8_MIWT2_2_SU4_SUM0_SUS256_WG32_8_1_WGM0_WGMXCC32_WGMXCCG0
    SolutionIndex: 15
    SolutionNameMin: Cijk_Ailk_Bljk_S_MX_B_UserArgs_MT224x256x16_MI32x32x1_SN_GSU1_GSUC0_GSUWGMRR0_K1_MIWT7_2_SU16_SUM3_SUS2048_WGM247_WGMXCC2_WGMXCCG0
    SolutionIndex: 16
    SolutionNameMin: Cijk_Ailk_Bljk_S_MX_B_UserArgs_MT256x128x16_MI32x32x1_SN_GSU4_GSUC1_GSUWGMRR1_K1_MIWT2_4_SU4_SUM0_SUS64_WGM1_WGMXCC8_WGMXCCG0
    SolutionIndex: 17
    SolutionNameMin: Cijk_Ailk_Bljk_S_MX_B_UserArgs_MT128x32x32_MI16x16x1_SN_GSU1_GSUC0_GSUWGMRR1_K1_MIWT2_2_SU4_SUM4_SUS2048_WGM0_WGMXCC1_WGMXCCG0
    SolutionIndex: 18
    SolutionNameMin: Cijk_Ailk_Bljk_S_MX_B_UserArgs_MT256x160x16_MI16x16x1_SN_GSU1_GSUC0_GSUWGMRR0_K1_MIWT4_10_SU4_SUM3_SUS256_WGM38_WGMXCC4_WGMXCCG0
    SolutionIndex: 19
    SolutionNameMin: Cijk_Ailk_Bljk_S_MX_B_UserArgs_MT256x64x16_MI16x16x1_SN_GSU1_GSUC0_GSUWGMRR0_K1_MIWT4_4_SU8_SUM0_SUS128_WGM171_WGMXCC1_WGMXCCGn1
    SolutionIndex: 20
    SolutionNameMin: Cijk_Ailk_Bljk_S_MX_B_UserArgs_MT16x16x64_MI16x16x1_SN_GSU1_GSUC0_GSUWGMRR1_K1_MIWT1_1_SU4_SUM2_SUS256_WGM1_WGMXCC8_WGMXCCG0
    SolutionIndex: 21
    SolutionNameMin: Cijk_Ailk_Bljk_S_MX_B_UserArgs_MT64x64x64_MI16x16x1_SN_GSU1_GSUC0_GSUWGMRR0_K1_LBSPPA1024_LPA16_LPB8_MIWT1_1_SU2_SUM3_SUS512_WG64_16_1_WGM0_WGMXCC32_WGMXCCG0
    SolutionIndex: 22
    SolutionNameMin: Cijk_Ailk_Bljk_S_MX_B_UserArgs_MT192x96x32_MI16x16x1_SN_GSU1_GSUC1_GSUWGMRR1_K1_MIWT3_6_SU4_SUM1_SUS512_WGM6_WGMXCC8_WGMXCCG0
    SolutionIndex: 23
    SolutionNameMin: Cijk_Ailk_Bljk_S_MX_B_UserArgs_MT48x128x32_MI16x16x1_SN_GSU1_GSUC0_GSUWGMRR0_K1_MIWT3_2_SU16_SUM1_SUS1024_WGM76_WGMXCC1_WGMXCCGn1
    SolutionIndex: 24
    SolutionNameMin: Cijk_Ailk_Bljk_S_MX_B_UserArgs_MT192x64x32_MI16x16x1_SN_GSU1_GSUC0_GSUWGMRR1_K1_MIWT3_4_SU0_SUM0_SUS0_WGM1_WGMXCC8_WGMXCCG0
    SolutionIndex: 25
    SolutionNameMin: Cijk_Ailk_Bljk_S_MX_B_UserArgs_MT224x384x16_MI16x16x1_SN_GSU1_GSUC0_GSUWGMRR0_K1_MIWT14_6_SU4_SUM0_SUS128_WGM304_WGMXCC8_WGMXCCG0
    SolutionIndex: 26
    SolutionNameMin: Cijk_Ailk_Bljk_S_MX_B_UserArgs_MT32x64x16_MI16x16x1_SN_GSU1_GSUC0_GSUWGMRR1_K1_MIWT2_1_SU2_SUM4_SUS512_WGM1_WGMXCC4_WGMXCCG0
    SolutionIndex: 27
    SolutionNameMin: Cijk_Ailk_Bljk_S_MX_B_UserArgs_MT128x64x64_MI16x16x1_SN_GSU1_GSUC0_GSUWGMRR0_K1_MIWT2_4_SU8_SUM1_SUS512_WGM95_WGMXCC1_WGMXCCGn1
    SolutionIndex: 28
    SolutionNameMin: Cijk_Ailk_Bljk_S_MX_B_UserArgs_MT320x128x16_MI16x16x1_SN_GSU1_GSUC0_GSUWGMRR0_K1_MIWT5_8_SU0_SUM0_SUS0_WGM2_WGMXCC1_WGMXCCG95
    SolutionIndex: 29
    SolutionNameMin: Cijk_Ailk_Bljk_S_MX_B_UserArgs_MT128x112x64_MI16x16x1_SN_GSU8_GSUC1_GSUWGMRR1_K1_MIWT2_7_SU2_SUM0_SUS256_WGM0_WGMXCC1_WGMXCCGn1
    SolutionIndex: 30
    SolutionNameMin: Cijk_Ailk_Bljk_S_MX_B_UserArgs_MT256x128x16_MI16x16x1_SN_GSU1_GSUC0_GSUWGMRR0_K1_MIWT4_8_SU4_SUM0_SUS128_WGM57_WGMXCC16_WGMXCCG0
    SolutionIndex: 31
    SolutionNameMin: Cijk_Ailk_Bljk_S_MX_B_UserArgs_MT64x32x64_MI16x16x1_SN_GSU1_GSUC1_GSUWGMRR1_K1_LBSPPA1024_LPB8_MIWT2_1_SU4_SUM3_SUS512_WG32_8_1_WGM1_WGMXCC32_WGMXCCG0
    SolutionIndex: 32
    SolutionNameMin: Cijk_Ailk_Bljk_S_MX_B_UserArgs_MT16x32x32_MI16x16x1_SN_GSU1_GSUC0_GSUWGMRR0_K1_MIWT1_1_SU2_SUM0_SUS128_WGM1_WGMXCC16_WGMXCCG0
    SolutionIndex: 33
    SolutionNameMin: Cijk_Ailk_Bljk_S_MX_B_UserArgs_MT320x256x16_MI16x16x1_SN_GSU1_GSUC0_GSUWGMRR1_K1_MIWT10_8_SU4_SUM0_SUS256_WGM171_WGMXCC2_WGMXCCGn1
    SolutionIndex: 34
    SolutionNameMin: Cijk_Ailk_Bljk_S_MX_B_UserArgs_MT320x256x16_MI16x16x1_SN_GSU1_GSUC1_GSUWGMRR1_K1_MIWT5_16_SU2_SUM1_SUS128_WGM32_WGMXCC4_WGMXCCGn1
    SolutionIndex: 35
    SolutionNameMin: Cijk_Ailk_Bljk_S_MX_B_UserArgs_MT64x64x16_MI32x32x1_SN_GSU1_GSUC0_GSUWGMRR0_K1_MIWT1_1_SU2_SUM4_SUS64_WGM0_WGMXCC16_WGMXCCG0
    SolutionIndex: 36
    SolutionNameMin: Cijk_Ailk_Bljk_S_MX_B_UserArgs_MT128x96x16_MI16x16x1_SN_GSU1_GSUC0_GSUWGMRR0_K1_MIWT4_3_SU4_SUM0_SUS512_WGM6_WGMXCC8_WGMXCCG0
    SolutionIndex: 37
    SolutionNameMin: Cijk_Ailk_Bljk_S_MX_B_UserArgs_MT256x128x32_MI32x32x1_SN_GSU1_GSUC0_GSUWGMRR0_K1_MIWT2_4_SU4_SUM0_SUS128_WGM304_WGMXCC1_WGMXCCGn1
    SolutionIndex: 38
    SolutionNameMin: Cijk_Ailk_Bljk_S_MX_B_UserArgs_MT128x32x32_MI16x16x1_SN_GSU1_GSUC0_GSUWGMRR1_K1_MIWT2_2_SU2_SUM4_SUS2048_WGM1_WGMXCC8_WGMXCCG0
    SolutionIndex: 39
    SolutionNameMin: Cijk_Ailk_Bljk_S_MX_B_UserArgs_MT128x80x32_MI16x16x1_SN_GSU5_GSUC0_GSUWGMRR0_K1_MIWT2_5_SU4_SUM0_SUS128_WGM1_WGMXCC1_WGMXCCGn1
    SolutionIndex: 40
    SolutionNameMin: Cijk_Ailk_Bljk_S_MX_B_UserArgs_MT128x112x64_MI16x16x1_SN_GSU1_GSUC1_GSUWGMRR0_K1_MIWT2_7_SU0_SUM0_SUS0_WGM1_WGMXCC16_WGMXCCGn1
    SolutionIndex: 41
    SolutionNameMin: Cijk_Ailk_Bljk_S_MX_B_UserArgs_MT320x128x16_MI16x16x1_SN_GSU1_GSUC0_GSUWGMRR0_K1_MIWT5_8_SU4_SUM1_SUS64_WGM4_WGMXCC16_WGMXCCGn1
    SolutionIndex: 42
    SolutionNameMin: Cijk_Ailk_Bljk_S_MX_B_UserArgs_MT288x256x16_MI16x16x1_SN_GSU1_GSUC1_GSUWGMRR1_K1_MIWT18_4_SU4_SUM0_SUS64_WGM304_WGMXCC2_WGMXCCG0
    SolutionIndex: 43
    SolutionNameMin: Cijk_Ailk_Bljk_S_MX_B_UserArgs_MT32x64x64_MI16x16x1_SN_GSU1_GSUC1_GSUWGMRR1_K1_MIWT2_1_SU16_SUM0_SUS512_WGM0_WGMXCC16_WGMXCCG0
    SolutionIndex: 44
    SolutionNameMin: Cijk_Ailk_Bljk_S_MX_B_UserArgs_MT320x112x16_MI16x16x1_SN_GSU1_GSUC1_GSUWGMRR1_K1_MIWT5_7_SU64_SUM3_SUS64_WGM1_WGMXCC2_WGMXCCGn1
    SolutionIndex: 45
    SolutionNameMin: Cijk_Ailk_Bljk_S_MX_B_UserArgs_MT384x128x16_MI16x16x1_SN_GSU1_GSUC0_GSUWGMRR0_K1_MIWT6_8_SU64_SUM0_SUS64_WGM171_WGMXCC4_WGMXCCGn1
    SolutionIndex: 46
    SolutionNameMin: Cijk_Ailk_Bljk_S_MX_B_UserArgs_MT64x64x16_MI16x16x1_SN_GSU1_GSUC0_GSUWGMRR1_K1_MIWT1_4_SU64_SUM0_SUS64_WGM12_WGMXCC1_WGMXCCGn1
    SolutionIndex: 47
    SolutionNameMin: Cijk_Ailk_Bljk_S_MX_B_UserArgs_MT256x96x16_MI16x16x1_SN_GSU1_GSUC0_GSUWGMRR0_K1_MIWT4_6_SU8_SUM3_SUS64_WGM8_WGMXCC8_WGMXCCG0
    SolutionIndex: 48
    SolutionNameMin: Cijk_Ailk_Bljk_S_MX_B_UserArgs_MT16x16x128_MI16x16x1_SN_GSU13_GSUC0_GSUWGMRR0_K1_MIWT1_1_SU4_SUM2_SUS512_WGM0_WGMXCC16_WGMXCCG0
    SolutionIndex: 49
    SolutionNameMin: Cijk_Ailk_Bljk_S_MX_B_UserArgs_MT320x176x16_MI16x16x1_SN_GSU1_GSUC0_GSUWGMRR0_K1_MIWT5_11_SU16_SUM0_SUS64_WGM8_WGMXCC1_WGMXCCGn1
- - - [7320, 4096, 1, 91]
    - [0, 0.0]
  - - [512, 4096, 1, 660]
    - [1, 0.0]
  - - [4888, 4096, 1, 256]
    - [2, 0.0]
  - - [512, 4096, 1, 2560]
    - [3, 0.0]
  - - [4953, 4096, 1, 128]
    - [4, 0.0]
  - - [1972, 4096, 1, 491]
    - [5, 0.0]
  - - [775, 4096, 1, 1319]
    - [6, 0.0]
  - - [272, 4096, 1, 128]
    - [7, 0.0]
  - - [256, 4096, 1, 1]
    - [8, 0.0]
  - - [20, 33, 4096, 128]
    - [9, 0.0]
  - - [7704, 4096, 1, 92]
    - [10, 0.0]
  - - [256, 1, 1, 4096]
    - [11, 0.0]
  - - [128, 4096, 1, 2440]
    - [12, 0.0]
  - - [120, 4096, 1, 256]
    - [13, 0.0]
  - - [320, 4096, 1, 320]
    - [14, 0.0]
  - - [4248, 4096, 1, 775]
    - [15, 0.0]
  - - [5039, 4096, 1, 256]
    - [47, 0.0]
  - - [491, 4096, 1, 3480]
    - [16, 0.0]
  - - [450, 4096, 1, 128]
    - [17, 0.0]
  - - [5120, 4096, 1, 128]
    - [18, 0.0]
  - - [768, 4096, 1, 279]
    - [19, 0.0]
  - - [35, 4096, 1, 193]
    - [20, 0.0]
  - - [256, 4096, 1, 256]
    - [21, 0.0]
  - - [1319, 4096, 1, 2048]
    - [22, 0.0]
  - - [397, 4096, 1, 660]
    - [23, 0.0]
  - - [660, 4096, 1, 256]
    - [24, 0.0]
  - - [6048, 4096, 1, 128]
    - [25, 0.0]
  - - [128, 4096, 1, 1]
    - [26, 0.0]
  - - [512, 4096, 1, 512]
    - [27, 0.0]
  - - [2560, 4096, 1, 512]
    - [28, 0.0]
  - - [128, 4096, 1, 5120]
    - [29, 0.0]
  - - [11288, 4096, 1, 128]
    - [30, 0.0]
  - - [92, 4096, 1, 397]
    - [31, 0.0]
  - - [4, 30, 4096, 128]
    - [32, 0.0]
  - - [6048, 4096, 1, 2048]
    - [33, 0.0]
  - - [6048, 4096, 1, 3024]
    - [34, 0.0]
  - - [397, 4096, 1, 120]
    - [35, 0.0]
  - - [7704, 4096, 1, 91]
    - [36, 0.0]
  - - [1980, 4096, 1, 1972]
    - [37, 0.0]
  - - [128, 1, 1, 4096]
    - [48, 0.0]
  - - [512, 4096, 1, 120]
    - [38, 0.0]
  - - [128, 4096, 1, 6048]
    - [39, 0.0]
  - - [290, 49152, 1, 128]
    - [49, 0.0]
  - - [1024, 4096, 1, 1980]
    - [40, 0.0]
  - - [6048, 4096, 1, 512]
    - [41, 0.0]
  - - [4896, 4096, 1, 128]
    - [42, 0.0]
  - - [91, 4096, 1, 512]
    - [43, 0.0]
  - - [5080, 4096, 1, 256]
    - [44, 0.0]
  - - [3024, 4096, 1, 6048]
    - [45, 0.0]
  - - [40, 61, 4096, 128]
    - [46, 0.0]
- null
- null
- DeviceEfficiency
- Equality
