projects/hipblaslt/library/src/amd_detail/rocblaslt/src/Tensile/Logic/asm_full/aquavanjaram/gfx942/Equality/aquavanjaram_Cijk_Alik_Bljk_BBS_BH_Bias_HAS_SAV_UserArgs.yaml
- {MinimumRequiredVersion: 5.0.0}
- aquavanjaram
- gfx942
- [Device 0049, Device 0050]
    SolutionIndex: 0
    SolutionNameMin: Cijk_Alik_Bljk_BBS_BH_Bias_HA_S_SAV_UserArgs_MT256x192x64_MI16x16x1_SN_LDSB1_AFC1_AFEM1_AFEM1_ASEM1_CLR1_CADS0_EPS0_FDSI0_GRPM1_GRVWA4_GRVWB4_GSU1_GSUAMB_GLS0_ISA942_IU1_LBSPPA1024_LBSPPB128_LBSPPM0_LPA4_LPB4_LPMn1_LRVW4_LWPMn1_MIAV0_MIWT8_6_MO40_NTn1_NTA0_NTB0_NTC0_NTD0_NTM0_NEPBS0_NLCA1_NLCB1_ONLL1_PGR2_PLR1_PKA1_SIA3_SS1_SU8_SUM0_SUS128_SPO0_SRVW0_SSO0_SVW8_TLDS1_USL1_UIOFGRO0_USFGROn1_VSn1_VWA8_VWB1_WSGRA0_WSGRB0_WS64_WG32_8_1_WGM0_WGMXCC1
    SolutionIndex: 1
    SolutionNameMin: Cijk_Alik_Bljk_BBS_BH_Bias_HA_S_SAV_UserArgs_MT16x16x256_MI16x16x1_SN_LDSB0_AFC1_AFEM1_AFEM1_ASEM1_CLR1_CADS0_EPS0_FDSI0_GRPM1_GRVWA8_GRVWB8_GSU1_GSUAMB_GLS0_ISA942_IU1_LBSPPA512_LBSPPB512_LBSPPM0_LPA16_LPB16_LPMn1_LRVW8_LWPMn1_MIAV0_MIWT1_1_MO40_NTn1_NTA0_NTB0_NTC0_NTD0_NTM0_NEPBS0_NLCA1_NLCB1_ONLL1_PGR2_PLR1_PKA1_SIA3_SS1_SU0_SUM0_SUS0_SPO0_SRVW0_SSO0_SVW1_TLDS1_USL1_UIOFGRO0_USFGROn1_VSn1_VWA1_VWB1_WSGRA0_WSGRB0_WS64_WG16_4_1_WGM1_WGMXCC1
    SolutionIndex: 2
    SolutionNameMin: Cijk_Alik_Bljk_BBS_BH_Bias_HA_S_SAV_UserArgs_MT16x16x256_MI16x16x1_SN_LDSB0_AFC1_AFEM1_AFEM1_ASEM1_CLR1_CADS0_EPS0_FDSI0_GRPM1_GRVWA8_GRVWB8_GSU1_GSUAMB_GLS0_ISA942_IU1_LBSPPA512_LBSPPB512_LBSPPM0_LPA16_LPB16_LPMn1_LRVW8_LWPMn1_MIAV0_MIWT1_1_MO40_NTn1_NTA0_NTB0_NTC0_NTD0_NTM0_NEPBS16_NLCA1_NLCB1_ONLL1_PGR2_PLR1_PKA1_SIA3_SS1_SU0_SUM0_SUS0_SPO0_SRVW0_SSO0_SVW1_TLDS1_USL1_UIOFGRO0_USFGROn1_VSn1_VWA1_VWB1_WSGRA0_WSGRB0_WS64_WG16_4_1_WGM0_WGMXCC1
    SolutionIndex: 3
    SolutionNameMin: Cijk_Alik_Bljk_BBS_BH_Bias_HA_S_SAV_UserArgs_MT256x208x64_MI16x16x1_SN_LDSB1_AFC1_AFEM1_AFEM1_ASEM1_CLR1_CADS0_EPS0_FDSI0_GRPM1_GRVWA4_GRVWB4_GSU1_GSUAMB_GLS0_ISA942_IU1_LBSPPA512_LBSPPB128_LBSPPM0_LPA4_LPB4_LPMn1_LRVW4_LWPMn1_MIAV0_MIWT4_13_MO40_NTn1_NTA0_NTB0_NTC0_NTD0_NTM0_NEPBS0_NLCA1_NLCB1_ONLL1_PGR2_PLR1_PKA1_SIA3_SS1_SU32_SUM0_SUS256_SPO0_SRVW0_SSO0_SVW4_TLDS1_USL1_UIOFGRO0_USFGROn1_VSn1_VWA4_VWB1_WSGRA0_WSGRB0_WS64_WG64_4_1_WGM0_WGMXCC1
    SolutionIndex: 4
    SolutionNameMin: Cijk_Alik_Bljk_BBS_BH_Bias_HA_S_SAV_UserArgs_MT64x96x128_MI16x16x1_SN_LDSB1_AFC1_AFEM1_AFEM1_ASEM1_CLR1_CADS0_EPS0_FDSI0_GRPM1_GRVWA8_GRVWB8_GSU1_GSUAMB_GLS0_ISA942_IU1_LBSPPA512_LBSPPB256_LBSPPM0_LPA16_LPB16_LPMn1_LRVW8_LWPMn1_MIAV0_MIWT2_3_MO40_NTn1_NTA0_NTB0_NTC0_NTD0_NTM0_NEPBS16_NLCA1_NLCB1_ONLL1_PGR2_PLR1_PKA1_SIA3_SS1_SU8_SUM1_SUS1024_SPO0_SRVW0_SSO0_SVW2_TLDS1_USL1_UIOFGRO0_USFGROn1_VSn1_VWA2_VWB1_WSGRA0_WSGRB0_WS64_WG32_8_1_WGM16_WGMXCC1
    SolutionIndex: 5
    SolutionNameMin: Cijk_Alik_Bljk_BBS_BH_Bias_HA_S_SAV_UserArgs_MT128x16x64_MI16x16x1_SN_LDSB1_AFC1_AFEM1_AFEM1_ASEM1_CLR1_CADS0_EPS0_FDSI0_GRPM1_GRVWA8_GRVWB4_GSU1_GSUAMB_GLS0_ISA942_IU1_LBSPPA256_LBSPPB128_LBSPPM0_LPA16_LPB16_LPMn1_LRVW8_LWPMn1_MIAV0_MIWT2_1_MO40_NTn1_NTA0_NTB0_NTC0_NTD0_NTM0_NEPBS16_NLCA1_NLCB1_ONLL1_PGR2_PLR1_PKA1_SIA3_SS1_SU4_SUM1_SUS128_SPO0_SRVW0_SSO0_SVW2_TLDS1_USL1_UIOFGRO0_USFGROn1_VSn1_VWA2_VWB1_WSGRA0_WSGRB0_WS64_WG64_4_1_WGM0_WGMXCC1
    SolutionIndex: 6
    SolutionNameMin: Cijk_Alik_Bljk_BBS_BH_Bias_HA_S_SAV_UserArgs_MT16x16x256_MI16x16x1_SN_LDSB0_AFC1_AFEM1_AFEM1_ASEM1_CLR1_CADS0_EPS0_FDSI0_GRPM1_GRVWA8_GRVWB8_GSU6_GSUAMBSK_GLS0_ISA942_IU1_LBSPPA512_LBSPPB512_LBSPPM0_LPA16_LPB16_LPMn1_LRVW8_LWPMn1_MIAV0_MIWT1_1_MO40_NTn1_NTA0_NTB0_NTC0_NTD0_NTM0_NEPBS16_NLCA1_NLCB1_ONLL1_PGR2_PLR1_PKA1_SIA3_SS1_SU0_SUM0_SUS0_SPO0_SRVW0_SSO0_SVW1_TLDS1_USL1_UIOFGRO0_USFGROn1_VSn1_VWA1_VWB1_WSGRA0_WSGRB0_WS64_WG16_4_1_WGM1_WGMXCC1
    SolutionIndex: 7
    SolutionNameMin: Cijk_Alik_Bljk_BBS_BH_Bias_HA_S_SAV_UserArgs_MT128x16x64_MI16x16x1_SN_LDSB1_AFC1_AFEM1_AFEM1_ASEM1_CLR1_CADS0_EPS0_FDSI0_GRPM1_GRVWA8_GRVWB4_GSU1_GSUAMB_GLS0_ISA942_IU1_LBSPPA256_LBSPPB128_LBSPPM0_LPA16_LPB16_LPMn1_LRVW8_LWPMn1_MIAV0_MIWT2_1_MO40_NTn1_NTA0_NTB0_NTC0_NTD0_NTM0_NEPBS0_NLCA1_NLCB1_ONLL1_PGR2_PLR1_PKA1_SIA3_SS1_SU4_SUM1_SUS256_SPO0_SRVW0_SSO0_SVW2_TLDS1_USL1_UIOFGRO0_USFGROn1_VSn1_VWA2_VWB1_WSGRA0_WSGRB0_WS64_WG64_4_1_WGM1_WGMXCC1
    SolutionIndex: 8
    SolutionNameMin: Cijk_Alik_Bljk_BBS_BH_Bias_HA_S_SAV_UserArgs_MT256x192x64_MI16x16x1_SN_LDSB1_AFC1_AFEM1_AFEM1_ASEM1_CLR1_CADS0_EPS0_FDSI0_GRPM1_GRVWA4_GRVWB4_GSU1_GSUAMB_GLS0_ISA942_IU1_LBSPPA1024_LBSPPB128_LBSPPM0_LPA4_LPB4_LPMn1_LRVW4_LWPMn1_MIAV0_MIWT8_6_MO40_NTn1_NTA0_NTB0_NTC0_NTD0_NTM0_NEPBS0_NLCA1_NLCB1_ONLL1_PGR2_PLR1_PKA1_SIA3_SS1_SU8_SUM0_SUS256_SPO0_SRVW0_SSO0_SVW8_TLDS1_USL1_UIOFGRO0_USFGROn1_VSn1_VWA8_VWB1_WSGRA0_WSGRB0_WS64_WG32_8_1_WGM0_WGMXCC1
    SolutionIndex: 9
    SolutionNameMin: Cijk_Alik_Bljk_BBS_BH_Bias_HA_S_SAV_UserArgs_MT16x16x256_MI16x16x1_SN_LDSB0_AFC1_AFEM1_AFEM1_ASEM1_CLR1_CADS0_EPS0_FDSI0_GRPM1_GRVWA8_GRVWB8_GSU6_GSUAMBSK_GLS0_ISA942_IU1_LBSPPA512_LBSPPB512_LBSPPM0_LPA16_LPB16_LPMn1_LRVW8_LWPMn1_MIAV0_MIWT1_1_MO40_NTn1_NTA0_NTB0_NTC0_NTD0_NTM0_NEPBS0_NLCA1_NLCB1_ONLL1_PGR2_PLR1_PKA1_SIA3_SS1_SU0_SUM0_SUS0_SPO0_SRVW0_SSO0_SVW1_TLDS1_USL1_UIOFGRO0_USFGROn1_VSn1_VWA1_VWB1_WSGRA0_WSGRB0_WS64_WG16_4_1_WGM1_WGMXCC1
    SolutionIndex: 10
    SolutionNameMin: Cijk_Alik_Bljk_BBS_BH_Bias_HA_S_SAV_UserArgs_MT128x48x128_MI16x16x1_SN_LDSB1_AFC1_AFEM1_AFEM1_ASEM1_CLR1_CADS0_EPS0_FDSI0_GRPM1_GRVWA8_GRVWB8_GSU1_GSUAMB_GLS0_ISA942_IU1_LBSPPA512_LBSPPB256_LBSPPM0_LPA16_LPB16_LPMn1_LRVW8_LWPMn1_MIAV0_MIWT2_3_MO40_NTn1_NTA0_NTB0_NTC0_NTD0_NTM0_NEPBS16_NLCA1_NLCB1_ONLL1_PGR2_PLR1_PKA1_SIA3_SS1_SU0_SUM0_SUS0_SPO0_SRVW0_SSO0_SVW2_TLDS1_USL1_UIOFGRO0_USFGROn1_VSn1_VWA2_VWB1_WSGRA0_WSGRB0_WS64_WG64_4_1_WGM16_WGMXCC1
    SolutionIndex: 11
    SolutionNameMin: Cijk_Alik_Bljk_BBS_BH_Bias_HA_S_SAV_UserArgs_MT32x16x256_MI16x16x1_SN_LDSB0_AFC1_AFEM1_AFEM1_ASEM1_CLR1_CADS0_EPS0_FDSI0_GRPM1_GRVWA8_GRVWB8_GSU1_GSUAMB_GLS0_ISA942_IU1_LBSPPA512_LBSPPB512_LBSPPM0_LPA16_LPB16_LPMn1_LRVW8_LWPMn1_MIAV0_MIWT1_1_MO40_NTn1_NTA0_NTB0_NTC0_NTD0_NTM0_NEPBS0_NLCA1_NLCB1_ONLL1_PGR2_PLR1_PKA1_SIA3_SS1_SU0_SUM0_SUS0_SPO0_SRVW0_SSO0_SVW1_TLDS1_USL1_UIOFGRO0_USFGROn1_VSn1_VWA1_VWB1_WSGRA0_WSGRB0_WS64_WG32_4_1_WGM1_WGMXCC1
    SolutionIndex: 12
    SolutionNameMin: Cijk_Alik_Bljk_BBS_BH_Bias_HA_S_SAV_UserArgs_MT128x64x64_MI16x16x1_SN_LDSB1_AFC1_AFEM1_AFEM1_ASEM1_CLR1_CADS0_EPS0_FDSI0_GRPM1_GRVWA8_GRVWB8_GSU1_GSUAMB_GLS0_ISA942_IU1_LBSPPA512_LBSPPB128_LBSPPM0_LPA16_LPB16_LPMn1_LRVW8_LWPMn1_MIAV0_MIWT4_2_MO40_NTn1_NTA0_NTB0_NTC0_NTD0_NTM0_NEPBS16_NLCA1_NLCB1_ONLL1_PGR2_PLR1_PKA1_SIA3_SS1_SU32_SUM0_SUS1024_SPO0_SRVW0_SSO0_SVW4_TLDS1_USL1_UIOFGRO0_USFGROn1_VSn1_VWA4_VWB1_WSGRA0_WSGRB0_WS64_WG32_8_1_WGM0_WGMXCC1
    SolutionIndex: 13
    SolutionNameMin: Cijk_Alik_Bljk_BBS_BH_Bias_HA_S_SAV_UserArgs_MT32x16x128_MI16x16x1_SN_LDSB0_AFC1_AFEM1_AFEM1_ASEM1_CLR1_CADS0_EPS0_FDSI0_GRPM1_GRVWA8_GRVWB8_GSU1_GSUAMB_GLS0_ISA942_IU1_LBSPPA256_LBSPPB256_LBSPPM0_LPA16_LPB16_LPMn1_LRVW8_LWPMn1_MIAV0_MIWT1_1_MO40_NTn1_NTA0_NTB0_NTC0_NTD0_NTM0_NEPBS16_NLCA1_NLCB1_ONLL1_PGR2_PLR1_PKA1_SIA3_SS1_SU0_SUM0_SUS0_SPO0_SRVW0_SSO0_SVW1_TLDS1_USL1_UIOFGRO0_USFGROn1_VSn1_VWA1_VWB1_WSGRA0_WSGRB0_WS64_WG32_4_1_WGM1_WGMXCC1
    SolutionIndex: 14
    SolutionNameMin: Cijk_Alik_Bljk_BBS_BH_Bias_HA_S_SAV_UserArgs_MT64x32x128_MI16x16x1_SN_LDSB1_AFC1_AFEM1_AFEM1_ASEM1_CLR1_CADS0_EPS0_FDSI0_GRPM1_GRVWA8_GRVWB8_GSU1_GSUAMB_GLS0_ISA942_IU1_LBSPPA512_LBSPPB256_LBSPPM0_LPA16_LPB16_LPMn1_LRVW8_LWPMn1_MIAV0_MIWT2_1_MO40_NTn1_NTA0_NTB0_NTC0_NTD0_NTM0_NEPBS16_NLCA1_NLCB1_ONLL1_PGR2_PLR1_PKA1_SIA3_SS1_SU16_SUM1_SUS1024_SPO0_SRVW0_SSO0_SVW2_TLDS1_USL1_UIOFGRO0_USFGROn1_VSn1_VWA2_VWB1_WSGRA0_WSGRB0_WS64_WG32_8_1_WGM4_WGMXCC1
    SolutionIndex: 15
    SolutionNameMin: Cijk_Alik_Bljk_BBS_BH_Bias_HA_S_SAV_UserArgs_MT128x64x64_MI16x16x1_SN_LDSB1_AFC1_AFEM1_AFEM1_ASEM1_CLR1_CADS0_EPS0_FDSI0_GRPM1_GRVWA8_GRVWB8_GSU11_GSUAMB_GLS0_ISA942_IU1_LBSPPA512_LBSPPB128_LBSPPM0_LPA16_LPB16_LPMn1_LRVW8_LWPMn1_MIAV0_MIWT4_2_MO40_NTn1_NTA0_NTB0_NTC0_NTD0_NTM0_NEPBS0_NLCA1_NLCB1_ONLL1_PGR2_PLR1_PKA1_SIA3_SS1_SU0_SUM0_SUS0_SPO0_SRVW0_SSO0_SVW4_TLDS1_USL1_UIOFGRO0_USFGROn1_VSn1_VWA4_VWB1_WSGRA0_WSGRB0_WS64_WG32_8_1_WGM1_WGMXCC1
    SolutionIndex: 16
    SolutionNameMin: Cijk_Alik_Bljk_BBS_BH_Bias_HA_S_SAV_UserArgs_MT64x32x128_MI16x16x1_SN_LDSB1_AFC1_AFEM1_AFEM1_ASEM1_CLR1_CADS0_EPS0_FDSI0_GRPM1_GRVWA8_GRVWB8_GSU1_GSUAMB_GLS0_ISA942_IU1_LBSPPA512_LBSPPB256_LBSPPM0_LPA16_LPB16_LPMn1_LRVW8_LWPMn1_MIAV0_MIWT2_1_MO40_NTn1_NTA0_NTB0_NTC0_NTD0_NTM0_NEPBS0_NLCA1_NLCB1_ONLL1_PGR2_PLR1_PKA1_SIA3_SS1_SU32_SUM1_SUS1024_SPO0_SRVW0_SSO0_SVW2_TLDS1_USL1_UIOFGRO0_USFGROn1_VSn1_VWA2_VWB1_WSGRA0_WSGRB0_WS64_WG32_8_1_WGM4_WGMXCC1
    SolutionIndex: 17
    SolutionNameMin: Cijk_Alik_Bljk_BBS_BH_Bias_HA_S_SAV_UserArgs_MT64x64x128_MI16x16x1_SN_LDSB1_AFC1_AFEM1_AFEM1_ASEM1_CLR1_CADS0_EPS0_FDSI0_GRPM1_GRVWA8_GRVWB8_GSU1_GSUAMB_GLS0_ISA942_IU1_LBSPPA512_LBSPPB256_LBSPPM0_LPA16_LPB16_LPMn1_LRVW8_LWPMn1_MIAV0_MIWT2_2_MO40_NTn1_NTA0_NTB0_NTC0_NTD0_NTM0_NEPBS16_NLCA1_NLCB1_ONLL1_PGR2_PLR1_PKA1_SIA3_SS1_SU16_SUM0_SUS1024_SPO0_SRVW0_SSO0_SVW2_TLDS1_USL1_UIOFGRO0_USFGROn1_VSn1_VWA2_VWB1_WSGRA0_WSGRB0_WS64_WG32_8_1_WGM32_WGMXCC1
    SolutionIndex: 18
    SolutionNameMin: Cijk_Alik_Bljk_BBS_BH_Bias_HA_S_SAV_UserArgs_MT64x64x64_MI16x16x1_SN_LDSB1_AFC1_AFEM1_AFEM1_ASEM1_CLR1_CADS0_EPS0_FDSI0_GRPM1_GRVWA8_GRVWB8_GSU1_GSUAMB_GLS0_ISA942_IU1_LBSPPA256_LBSPPB128_LBSPPM0_LPA16_LPB16_LPMn1_LRVW8_LWPMn1_MIAV0_MIWT2_2_MO40_NTn1_NTA0_NTB0_NTC0_NTD0_NTM0_NEPBS0_NLCA1_NLCB1_ONLL1_PGR2_PLR1_PKA1_SIA3_SS1_SU8_SUM0_SUS128_SPO0_SRVW0_SSO0_SVW2_TLDS1_USL1_UIOFGRO0_USFGROn1_VSn1_VWA2_VWB1_WSGRA0_WSGRB0_WS64_WG32_8_1_WGM32_WGMXCC1
    SolutionIndex: 19
    SolutionNameMin: Cijk_Alik_Bljk_BBS_BH_Bias_HA_S_SAV_UserArgs_MT80x128x64_MI16x16x1_SN_LDSB1_AFC1_AFEM1_AFEM1_ASEM1_CLR1_CADS0_EPS0_FDSI0_GRPM1_GRVWA4_GRVWB8_GSU1_GSUAMB_GLS0_ISA942_IU1_LBSPPA128_LBSPPB128_LBSPPM0_LPA16_LPB16_LPMn1_LRVW8_LWPMn1_MIAV0_MIWT5_2_MO40_NTn1_NTA0_NTB0_NTC0_NTD0_NTM0_NEPBS16_NLCA1_NLCB1_ONLL1_PGR2_PLR1_PKA1_SIA3_SS1_SU4_SUM1_SUS256_SPO0_SRVW0_SSO0_SVW1_TLDS1_USL1_UIOFGRO0_USFGROn1_VSn1_VWA1_VWB1_WSGRA0_WSGRB0_WS64_WG16_16_1_WGM32_WGMXCC1
    SolutionIndex: 20
    SolutionNameMin: Cijk_Alik_Bljk_BBS_BH_Bias_HA_S_SAV_UserArgs_MT32x16x128_MI16x16x1_SN_LDSB0_AFC1_AFEM1_AFEM1_ASEM1_CLR1_CADS0_EPS0_FDSI0_GRPM1_GRVWA8_GRVWB8_GSU1_GSUAMB_GLS0_ISA942_IU1_LBSPPA256_LBSPPB256_LBSPPM0_LPA16_LPB16_LPMn1_LRVW8_LWPMn1_MIAV0_MIWT1_1_MO40_NTn1_NTA0_NTB0_NTC0_NTD0_NTM0_NEPBS0_NLCA1_NLCB1_ONLL1_PGR2_PLR1_PKA1_SIA3_SS1_SU0_SUM0_SUS0_SPO0_SRVW0_SSO0_SVW1_TLDS1_USL1_UIOFGRO0_USFGROn1_VSn1_VWA1_VWB1_WSGRA0_WSGRB0_WS64_WG32_4_1_WGM1_WGMXCC1
    SolutionIndex: 21
    SolutionNameMin: Cijk_Alik_Bljk_BBS_BH_Bias_HA_S_SAV_UserArgs_MT64x64x64_MI16x16x1_SN_LDSB1_AFC1_AFEM1_AFEM1_ASEM1_CLR1_CADS0_EPS0_FDSI0_GRPM1_GRVWA8_GRVWB8_GSU9_GSUAMBSK_GLS0_ISA942_IU1_LBSPPA512_LBSPPB128_LBSPPM0_LPA16_LPB16_LPMn1_LRVW8_LWPMn1_MIAV0_MIWT4_1_MO40_NTn1_NTA0_NTB0_NTC0_NTD0_NTM0_NEPBS16_NLCA1_NLCB1_ONLL1_PGR2_PLR1_PKA1_SIA3_SS1_SU4_SUM1_SUS256_SPO0_SRVW0_SSO0_SVW4_TLDS1_USL1_UIOFGRO0_USFGROn1_VSn1_VWA4_VWB1_WSGRA0_WSGRB0_WS64_WG16_16_1_WGM16_WGMXCC1
    SolutionIndex: 22
    SolutionNameMin: Cijk_Alik_Bljk_BBS_BH_Bias_HA_S_SAV_UserArgs_MT64x64x64_MI16x16x1_SN_LDSB1_AFC1_AFEM1_AFEM1_ASEM1_CLR1_CADS0_EPS0_FDSI0_GRPM1_GRVWA8_GRVWB8_GSU9_GSUAMB_GLS0_ISA942_IU1_LBSPPA512_LBSPPB128_LBSPPM0_LPA16_LPB16_LPMn1_LRVW8_LWPMn1_MIAV0_MIWT4_1_MO40_NTn1_NTA0_NTB0_NTC0_NTD0_NTM0_NEPBS0_NLCA1_NLCB1_ONLL1_PGR2_PLR1_PKA1_SIA3_SS1_SU4_SUM1_SUS512_SPO0_SRVW0_SSO0_SVW4_TLDS1_USL1_UIOFGRO0_USFGROn1_VSn1_VWA4_VWB1_WSGRA0_WSGRB0_WS64_WG16_16_1_WGM32_WGMXCC1
    SolutionIndex: 23
    SolutionNameMin: Cijk_Alik_Bljk_BBS_BH_Bias_HA_S_SAV_UserArgs_MT64x64x64_MI16x16x1_SN_LDSB1_AFC1_AFEM1_AFEM1_ASEM1_CLR1_CADS0_EPS0_FDSI0_GRPM1_GRVWA8_GRVWB8_GSU9_GSUAMBSK_GLS0_ISA942_IU1_LBSPPA512_LBSPPB128_LBSPPM0_LPA16_LPB16_LPMn1_LRVW8_LWPMn1_MIAV0_MIWT4_1_MO40_NTn1_NTA0_NTB0_NTC0_NTD0_NTM0_NEPBS0_NLCA1_NLCB1_ONLL1_PGR2_PLR1_PKA1_SIA3_SS1_SU8_SUM1_SUS128_SPO0_SRVW0_SSO0_SVW4_TLDS1_USL1_UIOFGRO0_USFGROn1_VSn1_VWA4_VWB1_WSGRA0_WSGRB0_WS64_WG16_16_1_WGM32_WGMXCC1
    SolutionIndex: 24
    SolutionNameMin: Cijk_Alik_Bljk_BBS_BH_Bias_HA_S_SAV_UserArgs_MT64x32x64_MI16x16x1_SN_LDSB0_AFC1_AFEM1_AFEM1_ASEM1_CLR1_CADS0_EPS0_FDSI0_GRPM1_GRVWA8_GRVWB8_GSU1_GSUAMB_GLS0_ISA942_IU1_LBSPPA256_LBSPPB128_LBSPPM0_LPA16_LPB16_LPMn1_LRVW8_LWPMn1_MIAV0_MIWT2_1_MO40_NTn1_NTA0_NTB0_NTC0_NTD0_NTM0_NEPBS16_NLCA1_NLCB1_ONLL1_PGR2_PLR1_PKA1_SIA3_SS1_SU8_SUM1_SUS512_SPO0_SRVW0_SSO0_SVW2_TLDS1_USL1_UIOFGRO0_USFGROn1_VSn1_VWA2_VWB1_WSGRA0_WSGRB0_WS64_WG32_8_1_WGM16_WGMXCC1
    SolutionIndex: 25
    SolutionNameMin: Cijk_Alik_Bljk_BBS_BH_Bias_HA_S_SAV_UserArgs_MT32x32x128_MI16x16x1_SN_LDSB0_AFC1_AFEM1_AFEM1_ASEM1_CLR1_CADS0_EPS0_FDSI0_GRPM1_GRVWA8_GRVWB8_GSU1_GSUAMB_GLS0_ISA942_IU1_LBSPPA256_LBSPPB256_LBSPPM0_LPA16_LPB16_LPMn1_LRVW8_LWPMn1_MIAV0_MIWT1_1_MO40_NTn1_NTA0_NTB0_NTC0_NTD0_NTM0_NEPBS16_NLCA1_NLCB1_ONLL1_PGR2_PLR1_PKA1_SIA3_SS1_SU8_SUM1_SUS1024_SPO0_SRVW0_SSO0_SVW1_TLDS1_USL1_UIOFGRO0_USFGROn1_VSn1_VWA1_VWB1_WSGRA0_WSGRB0_WS64_WG32_8_1_WGM16_WGMXCC1
    SolutionIndex: 26
    SolutionNameMin: Cijk_Alik_Bljk_BBS_BH_Bias_HA_S_SAV_UserArgs_MT64x32x256_MI16x16x1_SN_LDSB1_AFC1_AFEM1_AFEM1_ASEM1_CLR1_CADS0_EPS0_FDSI0_GRPM1_GRVWA8_GRVWB8_GSU1_GSUAMB_GLS0_ISA942_IU1_LBSPPA1024_LBSPPB512_LBSPPM0_LPA16_LPB16_LPMn1_LRVW8_LWPMn1_MIAV0_MIWT2_1_MO40_NTn1_NTA0_NTB0_NTC0_NTD0_NTM0_NEPBS0_NLCA1_NLCB1_ONLL1_PGR2_PLR1_PKA1_SIA3_SS1_SU32_SUM0_SUS512_SPO0_SRVW0_SSO0_SVW2_TLDS1_USL1_UIOFGRO0_USFGROn1_VSn1_VWA2_VWB1_WSGRA0_WSGRB0_WS64_WG32_8_1_WGM8_WGMXCC1
    SolutionIndex: 27
    SolutionNameMin: Cijk_Alik_Bljk_BBS_BH_Bias_HA_S_SAV_UserArgs_MT80x256x64_MI16x16x1_SN_LDSB1_AFC1_AFEM1_AFEM1_ASEM1_CLR1_CADS0_EPS0_FDSI0_GRPM1_GRVWA4_GRVWB8_GSU1_GSUAMB_GLS0_ISA942_IU1_LBSPPA128_LBSPPB128_LBSPPM0_LPA16_LPB16_LPMn1_LRVW8_LWPMn1_MIAV0_MIWT5_4_MO40_NTn1_NTA0_NTB0_NTC0_NTD0_NTM0_NEPBS0_NLCA1_NLCB1_ONLL1_PGR2_PLR1_PKA1_SIA3_SS1_SU32_SUM0_SUS256_SPO0_SRVW0_SSO0_SVW1_TLDS1_USL1_UIOFGRO0_USFGROn1_VSn1_VWA1_VWB1_WSGRA0_WSGRB0_WS64_WG16_16_1_WGM32_WGMXCC1
    SolutionIndex: 28
    SolutionNameMin: Cijk_Alik_Bljk_BBS_BH_Bias_HA_S_SAV_UserArgs_MT128x96x64_MI16x16x1_SN_LDSB1_AFC1_AFEM1_AFEM1_ASEM1_CLR1_CADS0_EPS0_FDSI0_GRPM1_GRVWA8_GRVWB8_GSU1_GSUAMB_GLS0_ISA942_IU1_LBSPPA256_LBSPPB128_LBSPPM0_LPA16_LPB16_LPMn1_LRVW8_LWPMn1_MIAV0_MIWT2_6_MO40_NTn1_NTA0_NTB0_NTC0_NTD0_NTM0_NEPBS0_NLCA1_NLCB1_ONLL1_PGR2_PLR1_PKA1_SIA3_SS1_SU4_SUM0_SUS512_SPO0_SRVW0_SSO0_SVW2_TLDS1_USL1_UIOFGRO0_USFGROn1_VSn1_VWA2_VWB1_WSGRA0_WSGRB0_WS64_WG64_4_1_WGM0_WGMXCC1
    SolutionIndex: 29
    SolutionNameMin: Cijk_Alik_Bljk_BBS_BH_Bias_HA_S_SAV_UserArgs_MT64x128x128_MI16x16x1_SN_LDSB1_AFC1_AFEM1_AFEM1_ASEM1_CLR1_CADS0_EPS0_FDSI0_GRPM1_GRVWA8_GRVWB8_GSU1_GSUAMB_GLS0_ISA942_IU1_LBSPPA1024_LBSPPB256_LBSPPM0_LPA16_LPB16_LPMn1_LRVW8_LWPMn1_MIAV0_MIWT4_2_MO40_NTn1_NTA0_NTB0_NTC0_NTD0_NTM0_NEPBS16_NLCA1_NLCB1_ONLL1_PGR2_PLR1_PKA1_SIA3_SS1_SU0_SUM0_SUS0_SPO0_SRVW0_SSO0_SVW4_TLDS1_USL1_UIOFGRO0_USFGROn1_VSn1_VWA4_VWB1_WSGRA0_WSGRB0_WS64_WG16_16_1_WGM8_WGMXCC1
    SolutionIndex: 30
    SolutionNameMin: Cijk_Alik_Bljk_BBS_BH_Bias_HA_S_SAV_UserArgs_MT256x224x64_MI16x16x1_SN_LDSB1_AFC1_AFEM1_AFEM1_ASEM1_CLR1_CADS0_EPS0_FDSI0_GRPM1_GRVWA4_GRVWB4_GSU1_GSUAMB_GLS0_ISA942_IU1_LBSPPA1024_LBSPPB128_LBSPPM0_LPA4_LPB4_LPMn1_LRVW4_LWPMn1_MIAV0_MIWT8_7_MO40_NTn1_NTA0_NTB0_NTC0_NTD0_NTM0_NEPBS0_NLCA1_NLCB1_ONLL1_PGR2_PLR1_PKA1_SIA3_SS1_SU8_SUM0_SUS128_SPO0_SRVW0_SSO0_SVW8_TLDS1_USL1_UIOFGRO0_USFGROn1_VSn1_VWA8_VWB1_WSGRA0_WSGRB0_WS64_WG32_8_1_WGM0_WGMXCC1
    SolutionIndex: 31
    SolutionNameMin: Cijk_Alik_Bljk_BBS_BH_Bias_HA_S_SAV_UserArgs_MT256x64x64_MI16x16x1_SN_LDSB1_AFC1_AFEM1_AFEM1_ASEM1_CLR1_CADS0_EPS0_FDSI0_GRPM1_GRVWA8_GRVWB8_GSU1_GSUAMB_GLS0_ISA942_IU1_LBSPPA1024_LBSPPB128_LBSPPM0_LPA16_LPB16_LPMn1_LRVW8_LWPMn1_MIAV0_MIWT8_2_MO40_NTn1_NTA0_NTB0_NTC0_NTD0_NTM0_NEPBS0_NLCA1_NLCB1_ONLL1_PGR2_PLR1_PKA1_SIA3_SS1_SU16_SUM0_SUS128_SPO0_SRVW0_SSO0_SVW8_TLDS1_USL1_UIOFGRO0_USFGROn1_VSn1_VWA8_VWB1_WSGRA0_WSGRB0_WS64_WG32_8_1_WGM0_WGMXCC1
    SolutionIndex: 32
    SolutionNameMin: Cijk_Alik_Bljk_BBS_BH_Bias_HA_S_SAV_UserArgs_MT128x16x64_MI16x16x1_SN_LDSB1_AFC1_AFEM1_AFEM1_ASEM1_CLR1_CADS0_EPS0_FDSI0_GRPM1_GRVWA8_GRVWB4_GSU1_GSUAMB_GLS0_ISA942_IU1_LBSPPA256_LBSPPB128_LBSPPM0_LPA16_LPB16_LPMn1_LRVW8_LWPMn1_MIAV0_MIWT2_1_MO40_NTn1_NTA0_NTB0_NTC0_NTD0_NTM0_NEPBS0_NLCA1_NLCB1_ONLL1_PGR2_PLR1_PKA1_SIA3_SS1_SU4_SUM1_SUS128_SPO0_SRVW0_SSO0_SVW2_TLDS1_USL1_UIOFGRO0_USFGROn1_VSn1_VWA2_VWB1_WSGRA0_WSGRB0_WS64_WG64_4_1_WGM0_WGMXCC1
    SolutionIndex: 33
    SolutionNameMin: Cijk_Alik_Bljk_BBS_BH_Bias_HA_S_SAV_UserArgs_MT448x32x64_MI16x16x1_SN_LDSB1_AFC1_AFEM1_AFEM1_ASEM1_CLR1_CADS0_EPS0_FDSI0_GRPM1_GRVWA4_GRVWB4_GSU1_GSUAMB_GLS0_ISA942_IU1_LBSPPA256_LBSPPB128_LBSPPM0_LPA4_LPB4_LPMn1_LRVW4_LWPMn1_MIAV0_MIWT14_1_MO40_NTn1_NTA0_NTB0_NTC0_NTD0_NTM0_NEPBS0_NLCA1_NLCB1_ONLL1_PGR2_PLR1_PKA1_SIA3_SS1_SU4_SUM1_SUS128_SPO0_SRVW0_SSO0_SVW2_TLDS1_USL1_UIOFGRO0_USFGROn1_VSn1_VWA2_VWB1_WSGRA0_WSGRB0_WS64_WG32_8_1_WGM1_WGMXCC1
    SolutionIndex: 34
    SolutionNameMin: Cijk_Alik_Bljk_BBS_BH_Bias_HA_S_SAV_UserArgs_MT16x16x256_MI16x16x1_SN_LDSB0_AFC1_AFEM1_AFEM1_ASEM1_CLR1_CADS0_EPS0_FDSI0_GRPM1_GRVWA8_GRVWB8_GSU6_GSUAMBSK_GLS0_ISA942_IU1_LBSPPA512_LBSPPB512_LBSPPM0_LPA16_LPB16_LPMn1_LRVW8_LWPMn1_MIAV0_MIWT1_1_MO40_NTn1_NTA0_NTB0_NTC0_NTD0_NTM0_NEPBS16_NLCA1_NLCB1_ONLL1_PGR2_PLR1_PKA1_SIA3_SS1_SU0_SUM0_SUS0_SPO0_SRVW0_SSO0_SVW1_TLDS1_USL1_UIOFGRO0_USFGROn1_VSn1_VWA1_VWB1_WSGRA0_WSGRB0_WS64_WG16_4_1_WGM0_WGMXCC1
    SolutionIndex: 35
    SolutionNameMin: Cijk_Alik_Bljk_BBS_BH_Bias_HA_S_SAV_UserArgs_MT16x32x256_MI16x16x1_SN_LDSB0_AFC1_AFEM1_AFEM1_ASEM1_CLR1_CADS0_EPS0_FDSI0_GRPM1_GRVWA8_GRVWB8_GSU1_GSUAMB_GLS0_ISA942_IU1_LBSPPA512_LBSPPB512_LBSPPM0_LPA16_LPB16_LPMn1_LRVW8_LWPMn1_MIAV0_MIWT1_1_MO40_NTn1_NTA0_NTB0_NTC0_NTD0_NTM0_NEPBS16_NLCA1_NLCB1_ONLL1_PGR2_PLR1_PKA1_SIA3_SS1_SU0_SUM0_SUS0_SPO0_SRVW0_SSO0_SVW1_TLDS1_USL1_UIOFGRO0_USFGROn1_VSn1_VWA1_VWB1_WSGRA0_WSGRB0_WS64_WG16_8_1_WGM1_WGMXCC1
    SolutionIndex: 36
    SolutionNameMin: Cijk_Alik_Bljk_BBS_BH_Bias_HA_S_SAV_UserArgs_MT128x128x64_MI16x16x1_SN_LDSB1_AFC1_AFEM1_AFEM1_ASEM1_CLR1_CADS0_EPS0_FDSI0_GRPM1_GRVWA8_GRVWB8_GSU1_GSUAMB_GLS0_ISA942_IU1_LBSPPA512_LBSPPB128_LBSPPM0_LPA16_LPB16_LPMn1_LRVW8_LWPMn1_MIAV0_MIWT4_4_MO40_NTn1_NTA0_NTB0_NTC0_NTD0_NTM0_NEPBS0_NLCA1_NLCB1_ONLL1_PGR2_PLR1_PKA1_SIA3_SS1_SU8_SUM0_SUS128_SPO0_SRVW0_SSO0_SVW4_TLDS1_USL1_UIOFGRO0_USFGROn1_VSn1_VWA4_VWB1_WSGRA0_WSGRB0_WS64_WG32_8_1_WGM4_WGMXCC1
    SolutionIndex: 37
    SolutionNameMin: Cijk_Alik_Bljk_BBS_BH_Bias_HA_S_SAV_UserArgs_MT64x64x64_MI16x16x1_SN_LDSB1_AFC1_AFEM1_AFEM1_ASEM1_CLR1_CADS0_EPS0_FDSI0_GRPM1_GRVWA8_GRVWB8_GSU1_GSUAMB_GLS0_ISA942_IU1_LBSPPA256_LBSPPB128_LBSPPM0_LPA16_LPB16_LPMn1_LRVW8_LWPMn1_MIAV0_MIWT2_2_MO40_NTn1_NTA0_NTB0_NTC0_NTD0_NTM0_NEPBS0_NLCA1_NLCB1_ONLL1_PGR2_PLR1_PKA1_SIA3_SS1_SU8_SUM1_SUS1024_SPO0_SRVW0_SSO0_SVW2_TLDS1_USL1_UIOFGRO0_USFGROn1_VSn1_VWA2_VWB1_WSGRA0_WSGRB0_WS64_WG32_8_1_WGM4_WGMXCC1
    SolutionIndex: 38
    SolutionNameMin: Cijk_Alik_Bljk_BBS_BH_Bias_HA_S_SAV_UserArgs_MT128x64x64_MI16x16x1_SN_LDSB1_AFC1_AFEM1_AFEM1_ASEM1_CLR1_CADS0_EPS0_FDSI0_GRPM1_GRVWA8_GRVWB8_GSU9_GSUAMB_GLS0_ISA942_IU1_LBSPPA256_LBSPPB128_LBSPPM0_LPA16_LPB16_LPMn1_LRVW8_LWPMn1_MIAV0_MIWT2_4_MO40_NTn1_NTA0_NTB0_NTC0_NTD0_NTM0_NEPBS16_NLCA1_NLCB1_ONLL1_PGR2_PLR1_PKA1_SIA3_SS1_SU4_SUM0_SUS256_SPO0_SRVW0_SSO0_SVW2_TLDS1_USL1_UIOFGRO0_USFGROn1_VSn1_VWA2_VWB1_WSGRA0_WSGRB0_WS64_WG64_4_1_WGM0_WGMXCC1
    SolutionIndex: 39
    SolutionNameMin: Cijk_Alik_Bljk_BBS_BH_Bias_HA_S_SAV_UserArgs_MT64x64x64_MI16x16x1_SN_LDSB1_AFC1_AFEM1_AFEM1_ASEM1_CLR1_CADS0_EPS0_FDSI0_GRPM1_GRVWA8_GRVWB8_GSU1_GSUAMB_GLS0_ISA942_IU1_LBSPPA256_LBSPPB128_LBSPPM0_LPA16_LPB16_LPMn1_LRVW8_LWPMn1_MIAV0_MIWT2_2_MO40_NTn1_NTA0_NTB0_NTC0_NTD0_NTM0_NEPBS16_NLCA1_NLCB1_ONLL1_PGR2_PLR1_PKA1_SIA3_SS1_SU32_SUM1_SUS1024_SPO0_SRVW0_SSO0_SVW2_TLDS1_USL1_UIOFGRO0_USFGROn1_VSn1_VWA2_VWB1_WSGRA0_WSGRB0_WS64_WG32_8_1_WGM16_WGMXCC1
    SolutionIndex: 40
    SolutionNameMin: Cijk_Alik_Bljk_BBS_BH_Bias_HA_S_SAV_UserArgs_MT128x64x128_MI16x16x1_SN_LDSB1_AFC1_AFEM1_AFEM1_ASEM1_CLR1_CADS0_EPS0_FDSI0_GRPM1_GRVWA8_GRVWB8_GSU1_GSUAMB_GLS0_ISA942_IU1_LBSPPA512_LBSPPB256_LBSPPM0_LPA16_LPB16_LPMn1_LRVW8_LWPMn1_MIAV0_MIWT2_4_MO40_NTn1_NTA0_NTB0_NTC0_NTD0_NTM0_NEPBS16_NLCA1_NLCB1_ONLL1_PGR2_PLR1_PKA1_SIA3_SS1_SU0_SUM0_SUS0_SPO0_SRVW0_SSO0_SVW2_TLDS1_USL1_UIOFGRO0_USFGROn1_VSn1_VWA2_VWB1_WSGRA0_WSGRB0_WS64_WG64_4_1_WGM16_WGMXCC1
    SolutionIndex: 41
    SolutionNameMin: Cijk_Alik_Bljk_BBS_BH_Bias_HA_S_SAV_UserArgs_MT128x64x64_MI16x16x1_SN_LDSB1_AFC1_AFEM1_AFEM1_ASEM1_CLR1_CADS0_EPS0_FDSI0_GRPM1_GRVWA8_GRVWB8_GSU1_GSUAMB_GLS0_ISA942_IU1_LBSPPA1024_LBSPPB128_LBSPPM0_LPA16_LPB16_LPMn1_LRVW8_LWPMn1_MIAV0_MIWT8_1_MO40_NTn1_NTA0_NTB0_NTC0_NTD0_NTM0_NEPBS16_NLCA1_NLCB1_ONLL1_PGR2_PLR1_PKA1_SIA3_SS1_SU4_SUM0_SUS128_SPO0_SRVW0_SSO0_SVW8_TLDS1_USL1_UIOFGRO0_USFGROn1_VSn1_VWA8_VWB1_WSGRA0_WSGRB0_WS64_WG16_16_1_WGM8_WGMXCC1
    SolutionIndex: 42
    SolutionNameMin: Cijk_Alik_Bljk_BBS_BH_Bias_HA_S_SAV_UserArgs_MT160x128x64_MI16x16x1_SN_LDSB1_AFC1_AFEM1_AFEM1_ASEM1_CLR1_CADS0_EPS0_FDSI0_GRPM1_GRVWA8_GRVWB8_GSU1_GSUAMB_GLS0_ISA942_IU1_LBSPPA128_LBSPPB128_LBSPPM0_LPA16_LPB16_LPMn1_LRVW8_LWPMn1_MIAV0_MIWT5_4_MO40_NTn1_NTA0_NTB0_NTC0_NTD0_NTM0_NEPBS16_NLCA1_NLCB1_ONLL1_PGR2_PLR1_PKA1_SIA3_SS1_SU16_SUM0_SUS512_SPO0_SRVW0_SSO0_SVW1_TLDS1_USL1_UIOFGRO0_USFGROn1_VSn1_VWA1_VWB1_WSGRA0_WSGRB0_WS64_WG32_8_1_WGM8_WGMXCC1
    SolutionIndex: 43
    SolutionNameMin: Cijk_Alik_Bljk_BBS_BH_Bias_HA_S_SAV_UserArgs_MT32x16x128_MI16x16x1_SN_LDSB0_AFC1_AFEM1_AFEM1_ASEM1_CLR1_CADS0_EPS0_FDSI0_GRPM1_GRVWA8_GRVWB8_GSU1_GSUAMB_GLS0_ISA942_IU1_LBSPPA256_LBSPPB256_LBSPPM0_LPA16_LPB16_LPMn1_LRVW8_LWPMn1_MIAV0_MIWT1_1_MO40_NTn1_NTA0_NTB0_NTC0_NTD0_NTM0_NEPBS16_NLCA1_NLCB1_ONLL1_PGR2_PLR1_PKA1_SIA3_SS1_SU0_SUM0_SUS0_SPO0_SRVW0_SSO0_SVW1_TLDS1_USL1_UIOFGRO0_USFGROn1_VSn1_VWA1_VWB1_WSGRA0_WSGRB0_WS64_WG32_4_1_WGM0_WGMXCC1
    SolutionIndex: 44
    SolutionNameMin: Cijk_Alik_Bljk_BBS_BH_Bias_HA_S_SAV_UserArgs_MT128x48x128_MI16x16x1_SN_LDSB1_AFC1_AFEM1_AFEM1_ASEM1_CLR1_CADS0_EPS0_FDSI0_GRPM1_GRVWA8_GRVWB8_GSU7_GSUAMB_GLS0_ISA942_IU1_LBSPPA512_LBSPPB256_LBSPPM0_LPA16_LPB16_LPMn1_LRVW8_LWPMn1_MIAV0_MIWT2_3_MO40_NTn1_NTA0_NTB0_NTC0_NTD0_NTM0_NEPBS16_NLCA1_NLCB1_ONLL1_PGR2_PLR1_PKA1_SIA3_SS1_SU4_SUM1_SUS256_SPO0_SRVW0_SSO0_SVW2_TLDS1_USL1_UIOFGRO0_USFGROn1_VSn1_VWA2_VWB1_WSGRA0_WSGRB0_WS64_WG64_4_1_WGM1_WGMXCC1
    SolutionIndex: 45
    SolutionNameMin: Cijk_Alik_Bljk_BBS_BH_Bias_HA_S_SAV_UserArgs_MT128x128x64_MI16x16x1_SN_LDSB1_AFC1_AFEM1_AFEM1_ASEM1_CLR1_CADS0_EPS0_FDSI0_GRPM1_GRVWA8_GRVWB8_GSU7_GSUAMB_GLS0_ISA942_IU1_LBSPPA512_LBSPPB128_LBSPPM0_LPA16_LPB16_LPMn1_LRVW8_LWPMn1_MIAV0_MIWT4_4_MO40_NTn1_NTA0_NTB0_NTC0_NTD0_NTM0_NEPBS0_NLCA1_NLCB1_ONLL1_PGR2_PLR1_PKA1_SIA3_SS1_SU4_SUM0_SUS128_SPO0_SRVW0_SSO0_SVW4_TLDS1_USL1_UIOFGRO0_USFGROn1_VSn1_VWA4_VWB1_WSGRA0_WSGRB0_WS64_WG32_8_1_WGM0_WGMXCC1
    SolutionIndex: 46
    SolutionNameMin: Cijk_Alik_Bljk_BBS_BH_Bias_HA_S_SAV_UserArgs_MT128x64x64_MI16x16x1_SN_LDSB1_AFC1_AFEM1_AFEM1_ASEM1_CLR1_CADS0_EPS0_FDSI0_GRPM1_GRVWA8_GRVWB8_GSU9_GSUAMB_GLS0_ISA942_IU1_LBSPPA256_LBSPPB128_LBSPPM0_LPA16_LPB16_LPMn1_LRVW8_LWPMn1_MIAV0_MIWT2_4_MO40_NTn1_NTA0_NTB0_NTC0_NTD0_NTM0_NEPBS0_NLCA1_NLCB1_ONLL1_PGR2_PLR1_PKA1_SIA3_SS1_SU4_SUM1_SUS128_SPO0_SRVW0_SSO0_SVW2_TLDS1_USL1_UIOFGRO0_USFGROn1_VSn1_VWA2_VWB1_WSGRA0_WSGRB0_WS64_WG64_4_1_WGM1_WGMXCC1
    SolutionIndex: 47
    SolutionNameMin: Cijk_Alik_Bljk_BBS_BH_Bias_HA_S_SAV_UserArgs_MT64x64x64_MI16x16x1_SN_LDSB1_AFC1_AFEM1_AFEM1_ASEM1_CLR1_CADS0_EPS0_FDSI0_GRPM1_GRVWA8_GRVWB8_GSU1_GSUAMB_GLS0_ISA942_IU1_LBSPPA256_LBSPPB128_LBSPPM0_LPA16_LPB16_LPMn1_LRVW8_LWPMn1_MIAV0_MIWT2_2_MO40_NTn1_NTA0_NTB0_NTC0_NTD0_NTM0_NEPBS0_NLCA1_NLCB1_ONLL1_PGR2_PLR1_PKA1_SIA3_SS1_SU32_SUM0_SUS128_SPO0_SRVW0_SSO0_SVW2_TLDS1_USL1_UIOFGRO0_USFGROn1_VSn1_VWA2_VWB1_WSGRA0_WSGRB0_WS64_WG32_8_1_WGM8_WGMXCC1
    SolutionIndex: 48
    SolutionNameMin: Cijk_Alik_Bljk_BBS_BH_Bias_HA_S_SAV_UserArgs_MT64x32x256_MI16x16x1_SN_LDSB1_AFC1_AFEM1_AFEM1_ASEM1_CLR1_CADS0_EPS0_FDSI0_GRPM1_GRVWA8_GRVWB8_GSU1_GSUAMB_GLS0_ISA942_IU1_LBSPPA1024_LBSPPB512_LBSPPM0_LPA16_LPB16_LPMn1_LRVW8_LWPMn1_MIAV0_MIWT2_1_MO40_NTn1_NTA0_NTB0_NTC0_NTD0_NTM0_NEPBS0_NLCA1_NLCB1_ONLL1_PGR2_PLR1_PKA1_SIA3_SS1_SU0_SUM0_SUS0_SPO0_SRVW0_SSO0_SVW2_TLDS1_USL1_UIOFGRO0_USFGROn1_VSn1_VWA2_VWB1_WSGRA0_WSGRB0_WS64_WG32_8_1_WGM16_WGMXCC1
    SolutionIndex: 49
    SolutionNameMin: Cijk_Alik_Bljk_BBS_BH_Bias_HA_S_SAV_UserArgs_MT64x64x128_MI16x16x1_SN_LDSB1_AFC1_AFEM1_AFEM1_ASEM1_CLR1_CADS0_EPS0_FDSI0_GRPM1_GRVWA8_GRVWB8_GSU1_GSUAMB_GLS0_ISA942_IU1_LBSPPA512_LBSPPB256_LBSPPM0_LPA16_LPB16_LPMn1_LRVW8_LWPMn1_MIAV0_MIWT2_2_MO40_NTn1_NTA0_NTB0_NTC0_NTD0_NTM0_NEPBS16_NLCA1_NLCB1_ONLL1_PGR2_PLR1_PKA1_SIA3_SS1_SU32_SUM0_SUS512_SPO0_SRVW0_SSO0_SVW2_TLDS1_USL1_UIOFGRO0_USFGROn1_VSn1_VWA2_VWB1_WSGRA0_WSGRB0_WS64_WG32_8_1_WGM16_WGMXCC1
    SolutionIndex: 50
    SolutionNameMin: Cijk_Alik_Bljk_BBS_BH_Bias_HA_S_SAV_UserArgs_MT256x128x64_MI16x16x1_SN_LDSB1_AFC1_AFEM1_AFEM1_ASEM1_CLR1_CADS0_EPS0_FDSI0_GRPM1_GRVWA8_GRVWB8_GSU1_GSUAMB_GLS0_ISA942_IU1_LBSPPA512_LBSPPB128_LBSPPM0_LPA16_LPB16_LPMn1_LRVW8_LWPMn1_MIAV0_MIWT4_8_MO40_NTn1_NTA0_NTB0_NTC0_NTD0_NTM0_NEPBS0_NLCA1_NLCB1_ONLL1_PGR2_PLR1_PKA1_SIA3_SS1_SU4_SUM0_SUS128_SPO0_SRVW0_SSO0_SVW4_TLDS1_USL1_UIOFGRO0_USFGROn1_VSn1_VWA4_VWB1_WSGRA0_WSGRB0_WS64_WG64_4_1_WGM4_WGMXCC1
    SolutionIndex: 51
    SolutionNameMin: Cijk_Alik_Bljk_BBS_BH_Bias_HA_S_SAV_UserArgs_MT128x64x64_MI16x16x1_SN_LDSB1_AFC1_AFEM1_AFEM1_ASEM1_CLR1_CADS0_EPS0_FDSI0_GRPM1_GRVWA8_GRVWB8_GSU1_GSUAMB_GLS0_ISA942_IU1_LBSPPA512_LBSPPB128_LBSPPM0_LPA16_LPB16_LPMn1_LRVW8_LWPMn1_MIAV0_MIWT4_2_MO40_NTn1_NTA0_NTB0_NTC0_NTD0_NTM0_NEPBS0_NLCA1_NLCB1_ONLL1_PGR2_PLR1_PKA1_SIA3_SS1_SU8_SUM1_SUS128_SPO0_SRVW0_SSO0_SVW4_TLDS1_USL1_UIOFGRO0_USFGROn1_VSn1_VWA4_VWB1_WSGRA0_WSGRB0_WS64_WG32_8_1_WGM16_WGMXCC1
    SolutionIndex: 52
    SolutionNameMin: Cijk_Alik_Bljk_BBS_BH_Bias_HA_S_SAV_UserArgs_MT128x96x64_MI16x16x1_SN_LDSB1_AFC1_AFEM1_AFEM1_ASEM1_CLR1_CADS0_EPS0_FDSI0_GRPM1_GRVWA8_GRVWB8_GSU7_GSUAMB_GLS0_ISA942_IU1_LBSPPA256_LBSPPB128_LBSPPM0_LPA16_LPB16_LPMn1_LRVW8_LWPMn1_MIAV0_MIWT2_6_MO40_NTn1_NTA0_NTB0_NTC0_NTD0_NTM0_NEPBS16_NLCA1_NLCB1_ONLL1_PGR2_PLR1_PKA1_SIA3_SS1_SU4_SUM0_SUS128_SPO0_SRVW0_SSO0_SVW2_TLDS1_USL1_UIOFGRO0_USFGROn1_VSn1_VWA2_VWB1_WSGRA0_WSGRB0_WS64_WG64_4_1_WGM0_WGMXCC1
    SolutionIndex: 53
    SolutionNameMin: Cijk_Alik_Bljk_BBS_BH_Bias_HA_S_SAV_UserArgs_MT128x128x64_MI16x16x1_SN_LDSB1_AFC1_AFEM1_AFEM1_ASEM1_CLR1_CADS0_EPS0_FDSI0_GRPM1_GRVWA8_GRVWB8_GSU1_GSUAMB_GLS0_ISA942_IU1_LBSPPA1024_LBSPPB128_LBSPPM0_LPA16_LPB16_LPMn1_LRVW8_LWPMn1_MIAV0_MIWT8_2_MO40_NTn1_NTA0_NTB0_NTC0_NTD0_NTM0_NEPBS0_NLCA1_NLCB1_ONLL1_PGR2_PLR1_PKA1_SIA3_SS1_SU4_SUM1_SUS512_SPO0_SRVW0_SSO0_SVW8_TLDS1_USL1_UIOFGRO0_USFGROn1_VSn1_VWA8_VWB1_WSGRA0_WSGRB0_WS64_WG16_16_1_WGM4_WGMXCC1
    SolutionIndex: 54
    SolutionNameMin: Cijk_Alik_Bljk_BBS_BH_Bias_HA_S_SAV_UserArgs_MT128x128x64_MI16x16x1_SN_LDSB1_AFC1_AFEM1_AFEM1_ASEM1_CLR1_CADS0_EPS0_FDSI0_GRPM1_GRVWA8_GRVWB8_GSU1_GSUAMB_GLS0_ISA942_IU1_LBSPPA512_LBSPPB128_LBSPPM0_LPA16_LPB16_LPMn1_LRVW8_LWPMn1_MIAV0_MIWT4_4_MO40_NTn1_NTA0_NTB0_NTC0_NTD0_NTM0_NEPBS0_NLCA1_NLCB1_ONLL1_PGR2_PLR1_PKA1_SIA3_SS1_SU4_SUM0_SUS1024_SPO0_SRVW0_SSO0_SVW4_TLDS1_USL1_UIOFGRO0_USFGROn1_VSn1_VWA4_VWB1_WSGRA0_WSGRB0_WS64_WG32_8_1_WGM8_WGMXCC1
    SolutionIndex: 55
    SolutionNameMin: Cijk_Alik_Bljk_BBS_BH_Bias_HA_S_SAV_UserArgs_MT64x32x128_MI16x16x1_SN_LDSB1_AFC1_AFEM1_AFEM1_ASEM1_CLR1_CADS0_EPS0_FDSI0_GRPM1_GRVWA8_GRVWB8_GSU1_GSUAMB_GLS0_ISA942_IU1_LBSPPA512_LBSPPB256_LBSPPM0_LPA16_LPB16_LPMn1_LRVW8_LWPMn1_MIAV0_MIWT2_1_MO40_NTn1_NTA0_NTB0_NTC0_NTD0_NTM0_NEPBS0_NLCA1_NLCB1_ONLL1_PGR2_PLR1_PKA1_SIA3_SS1_SU4_SUM0_SUS1024_SPO0_SRVW0_SSO0_SVW2_TLDS1_USL1_UIOFGRO0_USFGROn1_VSn1_VWA2_VWB1_WSGRA0_WSGRB0_WS64_WG32_8_1_WGM8_WGMXCC1
    SolutionIndex: 56
    SolutionNameMin: Cijk_Alik_Bljk_BBS_BH_Bias_HA_S_SAV_UserArgs_MT128x128x64_MI16x16x1_SN_LDSB1_AFC1_AFEM1_AFEM1_ASEM1_CLR1_CADS0_EPS0_FDSI0_GRPM1_GRVWA8_GRVWB8_GSU5_GSUAMB_GLS0_ISA942_IU1_LBSPPA512_LBSPPB128_LBSPPM0_LPA16_LPB16_LPMn1_LRVW8_LWPMn1_MIAV0_MIWT4_4_MO40_NTn1_NTA0_NTB0_NTC0_NTD0_NTM0_NEPBS0_NLCA1_NLCB1_ONLL1_PGR2_PLR1_PKA1_SIA3_SS1_SU8_SUM0_SUS128_SPO0_SRVW0_SSO0_SVW4_TLDS1_USL1_UIOFGRO0_USFGROn1_VSn1_VWA4_VWB1_WSGRA0_WSGRB0_WS64_WG32_8_1_WGM0_WGMXCC1
    SolutionIndex: 57
    SolutionNameMin: Cijk_Alik_Bljk_BBS_BH_Bias_HA_S_SAV_UserArgs_MT64x32x128_MI16x16x1_SN_LDSB1_AFC1_AFEM1_AFEM1_ASEM1_CLR1_CADS0_EPS0_FDSI0_GRPM1_GRVWA8_GRVWB8_GSU1_GSUAMB_GLS0_ISA942_IU1_LBSPPA256_LBSPPB256_LBSPPM0_LPA16_LPB16_LPMn1_LRVW8_LWPMn1_MIAV0_MIWT1_2_MO40_NTn1_NTA0_NTB0_NTC0_NTD0_NTM0_NEPBS16_NLCA1_NLCB1_ONLL1_PGR2_PLR1_PKA1_SIA3_SS1_SU0_SUM0_SUS0_SPO0_SRVW0_SSO0_SVW1_TLDS1_USL1_UIOFGRO0_USFGROn1_VSn1_VWA1_VWB1_WSGRA0_WSGRB0_WS64_WG64_4_1_WGM8_WGMXCC1
    SolutionIndex: 58
    SolutionNameMin: Cijk_Alik_Bljk_BBS_BH_Bias_HA_S_SAV_UserArgs_MT128x64x64_MI16x16x1_SN_LDSB1_AFC1_AFEM1_AFEM1_ASEM1_CLR1_CADS0_EPS0_FDSI0_GRPM1_GRVWA8_GRVWB8_GSU1_GSUAMB_GLS0_ISA942_IU1_LBSPPA256_LBSPPB128_LBSPPM0_LPA16_LPB16_LPMn1_LRVW8_LWPMn1_MIAV0_MIWT2_4_MO40_NTn1_NTA0_NTB0_NTC0_NTD0_NTM0_NEPBS0_NLCA1_NLCB1_ONLL1_PGR2_PLR1_PKA1_SIA3_SS1_SU16_SUM1_SUS1024_SPO0_SRVW0_SSO0_SVW2_TLDS1_USL1_UIOFGRO0_USFGROn1_VSn1_VWA2_VWB1_WSGRA0_WSGRB0_WS64_WG64_4_1_WGM8_WGMXCC1
    SolutionIndex: 59
    SolutionNameMin: Cijk_Alik_Bljk_BBS_BH_Bias_HA_S_SAV_UserArgs_MT64x64x128_MI16x16x1_SN_LDSB1_AFC1_AFEM1_AFEM1_ASEM1_CLR1_CADS0_EPS0_FDSI0_GRPM1_GRVWA8_GRVWB8_GSU1_GSUAMB_GLS0_ISA942_IU1_LBSPPA512_LBSPPB256_LBSPPM0_LPA16_LPB16_LPMn1_LRVW8_LWPMn1_MIAV0_MIWT2_2_MO40_NTn1_NTA0_NTB0_NTC0_NTD0_NTM0_NEPBS0_NLCA1_NLCB1_ONLL1_PGR2_PLR1_PKA1_SIA3_SS1_SU0_SUM0_SUS0_SPO0_SRVW0_SSO0_SVW2_TLDS1_USL1_UIOFGRO0_USFGROn1_VSn1_VWA2_VWB1_WSGRA0_WSGRB0_WS64_WG32_8_1_WGM4_WGMXCC1
    SolutionIndex: 60
    SolutionNameMin: Cijk_Alik_Bljk_BBS_BH_Bias_HA_S_SAV_UserArgs_MT128x64x128_MI16x16x1_SN_LDSB1_AFC1_AFEM1_AFEM1_ASEM1_CLR1_CADS0_EPS0_FDSI0_GRPM1_GRVWA8_GRVWB8_GSU1_GSUAMB_GLS0_ISA942_IU1_LBSPPA512_LBSPPB256_LBSPPM0_LPA16_LPB16_LPMn1_LRVW8_LWPMn1_MIAV0_MIWT2_4_MO40_NTn1_NTA0_NTB0_NTC0_NTD0_NTM0_NEPBS0_NLCA1_NLCB1_ONLL1_PGR2_PLR1_PKA1_SIA3_SS1_SU4_SUM0_SUS512_SPO0_SRVW0_SSO0_SVW2_TLDS1_USL1_UIOFGRO0_USFGROn1_VSn1_VWA2_VWB1_WSGRA0_WSGRB0_WS64_WG64_4_1_WGM32_WGMXCC1
    SolutionIndex: 61
    SolutionNameMin: Cijk_Alik_Bljk_BBS_BH_Bias_HA_S_SAV_UserArgs_MT256x224x64_MI16x16x1_SN_LDSB1_AFC1_AFEM1_AFEM1_ASEM1_CLR1_CADS0_EPS0_FDSI0_GRPM1_GRVWA4_GRVWB4_GSU1_GSUAMB_GLS0_ISA942_IU1_LBSPPA1024_LBSPPB128_LBSPPM0_LPA4_LPB4_LPMn1_LRVW4_LWPMn1_MIAV0_MIWT8_7_MO40_NTn1_NTA0_NTB0_NTC0_NTD0_NTM0_NEPBS16_NLCA1_NLCB1_ONLL1_PGR2_PLR1_PKA1_SIA3_SS1_SU4_SUM1_SUS128_SPO0_SRVW0_SSO0_SVW8_TLDS1_USL1_UIOFGRO0_USFGROn1_VSn1_VWA8_VWB1_WSGRA0_WSGRB0_WS64_WG32_8_1_WGM4_WGMXCC1
    SolutionIndex: 62
    SolutionNameMin: Cijk_Alik_Bljk_BBS_BH_Bias_HA_S_SAV_UserArgs_MT32x16x256_MI16x16x1_SN_LDSB0_AFC1_AFEM1_AFEM1_ASEM1_CLR1_CADS0_EPS0_FDSI0_GRPM1_GRVWA8_GRVWB8_GSU1_GSUAMB_GLS0_ISA942_IU1_LBSPPA512_LBSPPB512_LBSPPM0_LPA16_LPB16_LPMn1_LRVW8_LWPMn1_MIAV0_MIWT1_1_MO40_NTn1_NTA0_NTB0_NTC0_NTD0_NTM0_NEPBS16_NLCA1_NLCB1_ONLL1_PGR2_PLR1_PKA1_SIA3_SS1_SU0_SUM0_SUS0_SPO0_SRVW0_SSO0_SVW1_TLDS1_USL1_UIOFGRO0_USFGROn1_VSn1_VWA1_VWB1_WSGRA0_WSGRB0_WS64_WG32_4_1_WGM0_WGMXCC1
    SolutionIndex: 63
    SolutionNameMin: Cijk_Alik_Bljk_BBS_BH_Bias_HA_S_SAV_UserArgs_MT64x128x64_MI16x16x1_SN_LDSB1_AFC1_AFEM1_AFEM1_ASEM1_CLR1_CADS0_EPS0_FDSI0_GRPM1_GRVWA8_GRVWB8_GSU1_GSUAMB_GLS0_ISA942_IU1_LBSPPA512_LBSPPB128_LBSPPM0_LPA16_LPB16_LPMn1_LRVW8_LWPMn1_MIAV0_MIWT4_2_MO40_NTn1_NTA0_NTB0_NTC0_NTD0_NTM0_NEPBS0_NLCA1_NLCB1_ONLL1_PGR2_PLR1_PKA1_SIA3_SS1_SU32_SUM1_SUS128_SPO0_SRVW0_SSO0_SVW4_TLDS1_USL1_UIOFGRO0_USFGROn1_VSn1_VWA4_VWB1_WSGRA0_WSGRB0_WS64_WG16_16_1_WGM8_WGMXCC1
    SolutionIndex: 64
    SolutionNameMin: Cijk_Alik_Bljk_BBS_BH_Bias_HA_S_SAV_UserArgs_MT32x16x512_MI16x16x1_SN_LDSB1_AFC1_AFEM1_AFEM1_ASEM1_CLR1_CADS0_EPS0_FDSI0_GRPM1_GRVWA8_GRVWB8_GSU1_GSUAMB_GSUC0_GLS0_ISA942_IU1_LBSPPA1024_LBSPPB1024_LBSPPM0_LPA16_LPB16_LPM0_LRVW8_LWPMn1_MIAV0_MIWT1_1_MO40_NTn1_NTA7_NTB0_NTC0_NTD0_NTM0_NEPBS0_NLCA1_NLCB1_ONLL0_PGR2_PLR1_PKA1_SIA3_SS0_SU8_SUM0_SUS1024_SPO0_SRVW0_SSO0_SVW4_TLDS1_USL1_UIOFGRO0_USFGROn1_VSn1_VWA1_VWB1_WSGRA0_WSGRB0_WS64_WG32_4_1_WGM0_WGMXCC1
    SolutionIndex: 65
    SolutionNameMin: Cijk_Alik_Bljk_BBS_BH_Bias_HA_S_SAV_UserArgs_MT32x16x512_MI16x16x1_SN_LDSB1_AFC1_AFEM1_AFEM1_ASEM1_CLR1_CADS0_EPS0_FDSI0_GRPM1_GRVWA8_GRVWB8_GSU1_GSUAMBSK_GSUC0_GLS0_ISA942_IU1_LBSPPA1024_LBSPPB1024_LBSPPM0_LPA16_LPB16_LPM0_LRVW8_LWPMn1_MIAV0_MIWT1_1_MO40_NTn1_NTA7_NTB0_NTC0_NTD0_NTM0_NEPBS16_NLCA1_NLCB1_ONLL0_PGR2_PLR1_PKA1_SIA3_SS0_SU0_SUM0_SUS0_SPO0_SRVW0_SSO0_SVW4_TLDS1_USL1_UIOFGRO0_USFGROn1_VSn1_VWA1_VWB1_WSGRA0_WSGRB0_WS64_WG32_4_1_WGM1_WGMXCC1
    SolutionIndex: 66
    SolutionNameMin: Cijk_Alik_Bljk_BBS_BH_Bias_HA_S_SAV_UserArgs_MT32x16x512_MI16x16x1_SN_LDSB1_AFC1_AFEM1_AFEM1_ASEM1_CLR1_CADS0_EPS0_FDSI0_GRPM1_GRVWA8_GRVWB8_GSU1_GSUAMB_GSUC0_GLS0_ISA942_IU1_LBSPPA1024_LBSPPB1024_LBSPPM0_LPA16_LPB16_LPM0_LRVW8_LWPMn1_MIAV0_MIWT1_1_MO40_NTn1_NTA7_NTB0_NTC0_NTD0_NTM0_NEPBS0_NLCA1_NLCB1_ONLL0_PGR2_PLR1_PKA1_SIA3_SS0_SU0_SUM0_SUS0_SPO0_SRVW0_SSO0_SVW4_TLDS1_USL1_UIOFGRO0_USFGROn1_VSn1_VWA1_VWB1_WSGRA0_WSGRB0_WS64_WG32_4_1_WGM1_WGMXCC1
    SolutionIndex: 67
    SolutionNameMin: Cijk_Alik_Bljk_BBS_BH_Bias_HA_S_SAV_UserArgs_MT128x48x128_MI16x16x1_SN_LDSB1_AFC1_AFEM1_AFEM1_ASEM1_CLR1_CADS0_EPS0_FDSI0_GRPM1_GRVWA8_GRVWB8_GSU8_GSUAMB_GSUC0_GLS0_ISA942_IU1_LBSPPA512_LBSPPB256_LBSPPM0_LPA16_LPB16_LPM0_LRVW8_LWPMn1_MIAV0_MIWT2_3_MO40_NTn1_NTA7_NTB0_NTC0_NTD7_NTM0_NEPBS0_NLCA1_NLCB1_ONLL0_PGR2_PLR1_PKA1_SIA3_SS1_SU8_SUM1_SUS256_SPO0_SRVW0_SSO0_SVW2_TLDS1_USL1_UIOFGRO0_USFGROn1_VSn1_VWA2_VWB1_WSGRA0_WSGRB0_WS64_WG64_4_1_WGM0_WGMXCC1
    SolutionIndex: 68
    SolutionNameMin: Cijk_Alik_Bljk_BBS_BH_Bias_HA_S_SAV_UserArgs_MT128x64x128_MI16x16x1_SN_LDSB1_AFC1_AFEM1_AFEM1_ASEM1_CLR1_CADS0_EPS0_FDSI0_GRPM1_GRVWA8_GRVWB8_GSU8_GSUAMB_GSUC0_GLS0_ISA942_IU1_LBSPPA1024_LBSPPB256_LBSPPM0_LPA16_LPB16_LPM0_LRVW8_LWPMn1_MIAV0_MIWT4_2_MO40_NTn1_NTA0_NTB0_NTC0_NTD7_NTM0_NEPBS0_NLCA1_NLCB1_ONLL0_PGR2_PLR1_PKA1_SIA3_SS1_SU8_SUM1_SUS256_SPO0_SRVW0_SSO0_SVW4_TLDS1_USL1_UIOFGRO0_USFGROn1_VSn1_VWA4_VWB1_WSGRA0_WSGRB0_WS64_WG32_8_1_WGM0_WGMXCC1
    SolutionIndex: 69
    SolutionNameMin: Cijk_Alik_Bljk_BBS_BH_Bias_HA_S_SAV_UserArgs_MT128x96x128_MI16x16x1_SN_LDSB1_AFC1_AFEM1_AFEM1_ASEM1_CLR1_CADS0_EPS0_FDSI0_GRPM1_GRVWA8_GRVWB8_GSU8_GSUAMB_GSUC0_GLS0_ISA942_IU1_LBSPPA512_LBSPPB256_LBSPPM0_LPA16_LPB16_LPM0_LRVW8_LWPMn1_MIAV0_MIWT2_6_MO40_NTn1_NTA0_NTB0_NTC0_NTD7_NTM0_NEPBS0_NLCA1_NLCB1_ONLL0_PGR2_PLR1_PKA1_SIA3_SS1_SU0_SUM0_SUS0_SPO0_SRVW0_SSO0_SVW2_TLDS1_USL1_UIOFGRO0_USFGROn1_VSn1_VWA2_VWB1_WSGRA0_WSGRB0_WS64_WG64_4_1_WGM1_WGMXCC1
    SolutionIndex: 70
    SolutionNameMin: Cijk_Alik_Bljk_BBS_BH_Bias_HA_S_SAV_UserArgs_MT16x16x256_MI16x16x1_SN_LDSB1_AFC1_AFEM1_AFEM1_ASEM1_CLR1_CADS0_EPS0_FDSI0_GRPM1_GRVWA8_GRVWB8_GSU8_GSUAMBSK_GSUC0_GLS0_ISA942_IU1_LBSPPA512_LBSPPB512_LBSPPM0_LPA16_LPB16_LPM0_LRVW8_LWPMn1_MIAV0_MIWT1_1_MO40_NTn1_NTA7_NTB0_NTC0_NTD0_NTM0_NEPBS0_NLCA1_NLCB1_ONLL0_PGR2_PLR1_PKA1_SIA3_SS0_SU0_SUM0_SUS0_SPO0_SRVW0_SSO0_SVW4_TLDS1_USL1_UIOFGRO0_USFGROn1_VSn1_VWA1_VWB1_WSGRA0_WSGRB0_WS64_WG16_4_1_WGM0_WGMXCC1
    SolutionIndex: 71
    SolutionNameMin: Cijk_Alik_Bljk_BBS_BH_Bias_HA_S_SAV_UserArgs_MT64x16x256_MI16x16x1_SN_LDSB1_AFC1_AFEM1_AFEM1_ASEM1_CLR1_CADS0_EPS0_FDSI0_GRPM1_GRVWA8_GRVWB8_GSU8_GSUAMBSK_GSUC0_GLS0_ISA942_IU1_LBSPPA1024_LBSPPB512_LBSPPM0_LPA16_LPB16_LPM0_LRVW8_LWPMn1_MIAV0_MIWT2_1_MO40_NTn1_NTA0_NTB0_NTC0_NTD0_NTM0_NEPBS0_NLCA1_NLCB1_ONLL0_PGR2_PLR1_PKA1_SIA3_SS0_SU0_SUM0_SUS0_SPO0_SRVW0_SSO0_SVW8_TLDS1_USL1_UIOFGRO0_USFGROn1_VSn1_VWA2_VWB1_WSGRA0_WSGRB0_WS64_WG32_4_1_WGM1_WGMXCC1
    SolutionIndex: 72
    SolutionNameMin: Cijk_Alik_Bljk_BBS_BH_Bias_HA_S_SAV_UserArgs_MT64x32x256_MI16x16x1_SN_LDSB1_AFC1_AFEM1_AFEM1_ASEM1_CLR1_CADS0_EPS0_FDSI0_GRPM1_GRVWA8_GRVWB8_GSU8_GSUAMB_GSUC0_GLS0_ISA942_IU1_LBSPPA1024_LBSPPB512_LBSPPM0_LPA16_LPB16_LPM0_LRVW8_LWPMn1_MIAV0_MIWT2_2_MO40_NTn1_NTA7_NTB0_NTC0_NTD7_NTM0_NEPBS16_NLCA1_NLCB1_ONLL0_PGR2_PLR1_PKA1_SIA3_SS1_SU0_SUM0_SUS0_SPO0_SRVW0_SSO0_SVW2_TLDS1_USL1_UIOFGRO0_USFGROn1_VSn1_VWA2_VWB1_WSGRA0_WSGRB0_WS64_WG32_4_1_WGM0_WGMXCC1
    SolutionIndex: 73
    SolutionNameMin: Cijk_Alik_Bljk_BBS_BH_Bias_HA_S_SAV_UserArgs_MT64x64x128_MI16x16x1_SN_LDSB1_AFC1_AFEM1_AFEM1_ASEM1_CLR1_CADS0_EPS0_FDSI0_GRPM1_GRVWA8_GRVWB8_GSU8_GSUAMB_GSUC0_GLS0_ISA942_IU1_LBSPPA512_LBSPPB256_LBSPPM0_LPA16_LPB16_LPM0_LRVW8_LWPMn1_MIAV0_MIWT2_2_MO40_NTn1_NTA7_NTB0_NTC0_NTD7_NTM0_NEPBS0_NLCA1_NLCB1_ONLL0_PGR2_PLR1_PKA1_SIA3_SS1_SU8_SUM1_SUS256_SPO0_SRVW0_SSO0_SVW2_TLDS1_USL1_UIOFGRO0_USFGROn1_VSn1_VWA2_VWB1_WSGRA0_WSGRB0_WS64_WG32_8_1_WGM1_WGMXCC1
    SolutionIndex: 74
    SolutionNameMin: Cijk_Alik_Bljk_BBS_BH_Bias_HA_S_SAV_UserArgs_MT128x48x128_MI16x16x1_SN_LDSB1_AFC1_AFEM1_AFEM1_ASEM1_CLR1_CADS0_EPS0_FDSI0_GRPM1_GRVWA8_GRVWB8_GSU8_GSUAMB_GSUC0_GLS0_ISA942_IU1_LBSPPA512_LBSPPB256_LBSPPM0_LPA16_LPB16_LPM0_LRVW8_LWPMn1_MIAV0_MIWT2_3_MO40_NTn1_NTA0_NTB0_NTC0_NTD7_NTM0_NEPBS0_NLCA1_NLCB1_ONLL0_PGR2_PLR1_PKA1_SIA3_SS1_SU8_SUM1_SUS256_SPO0_SRVW0_SSO0_SVW2_TLDS1_USL1_UIOFGRO0_USFGROn1_VSn1_VWA2_VWB1_WSGRA0_WSGRB0_WS64_WG64_4_1_WGM0_WGMXCC1
    SolutionIndex: 75
    SolutionNameMin: Cijk_Alik_Bljk_BBS_BH_Bias_HA_S_SAV_UserArgs_MT32x16x512_MI16x16x1_SN_LDSB1_AFC1_AFEM1_AFEM1_ASEM1_CLR1_CADS0_EPS0_FDSI0_GRPM1_GRVWA8_GRVWB8_GSU1_GSUAMBSK_GSUC0_GLS0_ISA942_IU1_LBSPPA1024_LBSPPB1024_LBSPPM0_LPA16_LPB16_LPM0_LRVW8_LWPMn1_MIAV0_MIWT1_1_MO40_NTn1_NTA7_NTB0_NTC0_NTD0_NTM0_NEPBS16_NLCA1_NLCB1_ONLL0_PGR2_PLR1_PKA1_SIA3_SS1_SU8_SUM1_SUS1024_SPO0_SRVW0_SSO0_SVW1_TLDS1_USL1_UIOFGRO0_USFGROn1_VSn1_VWA1_VWB1_WSGRA0_WSGRB0_WS64_WG32_4_1_WGM0_WGMXCC1
    SolutionIndex: 76
    SolutionNameMin: Cijk_Alik_Bljk_BBS_BH_Bias_HA_S_SAV_UserArgs_MT32x16x512_MI16x16x1_SN_LDSB1_AFC1_AFEM1_AFEM1_ASEM1_CLR1_CADS0_EPS0_FDSI0_GRPM1_GRVWA8_GRVWB8_GSU1_GSUAMBSK_GSUC0_GLS0_ISA942_IU1_LBSPPA1024_LBSPPB1024_LBSPPM0_LPA16_LPB16_LPM0_LRVW8_LWPMn1_MIAV0_MIWT1_1_MO40_NTn1_NTA7_NTB0_NTC0_NTD0_NTM0_NEPBS16_NLCA1_NLCB1_ONLL0_PGR2_PLR1_PKA1_SIA3_SS0_SU8_SUM1_SUS1024_SPO0_SRVW0_SSO0_SVW4_TLDS1_USL1_UIOFGRO0_USFGROn1_VSn1_VWA1_VWB1_WSGRA0_WSGRB0_WS64_WG32_4_1_WGM1_WGMXCC1
    SolutionIndex: 77
    SolutionNameMin: Cijk_Alik_Bljk_BBS_BH_Bias_HA_S_SAV_UserArgs_MT32x16x512_MI16x16x1_SN_LDSB1_AFC1_AFEM1_AFEM1_ASEM1_CLR1_CADS0_EPS0_FDSI0_GRPM1_GRVWA8_GRVWB8_GSU1_GSUAMBSK_GSUC0_GLS0_ISA942_IU1_LBSPPA1024_LBSPPB1024_LBSPPM0_LPA16_LPB16_LPM0_LRVW8_LWPMn1_MIAV0_MIWT1_1_MO40_NTn1_NTA7_NTB0_NTC0_NTD0_NTM0_NEPBS0_NLCA1_NLCB1_ONLL0_PGR2_PLR1_PKA1_SIA3_SS0_SU8_SUM1_SUS1024_SPO0_SRVW0_SSO0_SVW4_TLDS1_USL1_UIOFGRO0_USFGROn1_VSn1_VWA1_VWB1_WSGRA0_WSGRB0_WS64_WG32_4_1_WGM1_WGMXCC1
    SolutionIndex: 78
    SolutionNameMin: Cijk_Alik_Bljk_BBS_BH_Bias_HA_S_SAV_UserArgs_MT32x16x512_MI16x16x1_SN_LDSB1_AFC1_AFEM1_AFEM1_ASEM1_CLR1_CADS0_EPS0_FDSI0_GRPM1_GRVWA8_GRVWB8_GSU1_GSUAMBSK_GSUC0_GLS0_ISA942_IU1_LBSPPA1024_LBSPPB1024_LBSPPM0_LPA16_LPB16_LPM0_LRVW8_LWPMn1_MIAV0_MIWT1_1_MO40_NTn1_NTA7_NTB0_NTC0_NTD0_NTM0_NEPBS16_NLCA1_NLCB1_ONLL0_PGR2_PLR1_PKA1_SIA3_SS1_SU0_SUM0_SUS0_SPO0_SRVW0_SSO0_SVW1_TLDS1_USL1_UIOFGRO0_USFGROn1_VSn1_VWA1_VWB1_WSGRA0_WSGRB0_WS64_WG32_4_1_WGM0_WGMXCC1
    SolutionIndex: 79
    SolutionNameMin: Cijk_Alik_Bljk_BBS_BH_Bias_HA_S_SAV_UserArgs_MT64x32x256_MI16x16x1_SN_LDSB1_AFC1_AFEM1_AFEM1_ASEM1_CLR1_CADS0_EPS0_FDSI0_GRPM1_GRVWA8_GRVWB8_GSU1_GSUAMBSK_GSUC0_GLS0_ISA942_IU1_LBSPPA1024_LBSPPB512_LBSPPM0_LPA16_LPB16_LPM0_LRVW8_LWPMn1_MIAV0_MIWT2_1_MO40_NTn1_NTA7_NTB0_NTC0_NTD0_NTM0_NEPBS16_NLCA1_NLCB1_ONLL0_PGR2_PLR1_PKA1_SIA3_SS1_SU8_SUM1_SUS512_SPO0_SRVW0_SSO0_SVW2_TLDS1_USL1_UIOFGRO0_USFGROn1_VSn1_VWA2_VWB1_WSGRA0_WSGRB0_WS64_WG32_8_1_WGM1_WGMXCC1
    SolutionIndex: 80
    SolutionNameMin: Cijk_Alik_Bljk_BBS_BH_Bias_HA_S_SAV_UserArgs_MT64x64x128_MI16x16x1_SN_LDSB1_AFC1_AFEM1_AFEM1_ASEM1_CLR1_CADS0_EPS0_FDSI0_GRPM1_GRVWA8_GRVWB8_GSU1_GSUAMBSK_GSUC0_GLS0_ISA942_IU1_LBSPPA1024_LBSPPB256_LBSPPM0_LPA16_LPB16_LPM0_LRVW8_LWPMn1_MIAV0_MIWT4_1_MO40_NTn1_NTA0_NTB0_NTC0_NTD7_NTM0_NEPBS0_NLCA1_NLCB1_ONLL0_PGR2_PLR1_PKA1_SIA3_SS1_SU8_SUM1_SUS256_SPO0_SRVW0_SSO0_SVW4_TLDS1_USL1_UIOFGRO0_USFGROn1_VSn1_VWA4_VWB1_WSGRA0_WSGRB0_WS64_WG16_16_1_WGM1_WGMXCC1
    SolutionIndex: 81
    SolutionNameMin: Cijk_Alik_Bljk_BBS_BH_Bias_HA_S_SAV_UserArgs_MT128x48x128_MI16x16x1_SN_LDSB1_AFC1_AFEM1_AFEM1_ASEM1_CLR1_CADS0_EPS0_FDSI0_GRPM1_GRVWA8_GRVWB8_GSU1_GSUAMBSK_GSUC0_GLS0_ISA942_IU1_LBSPPA512_LBSPPB256_LBSPPM0_LPA16_LPB16_LPM0_LRVW8_LWPMn1_MIAV0_MIWT2_3_MO40_NTn1_NTA0_NTB0_NTC0_NTD7_NTM0_NEPBS16_NLCA1_NLCB1_ONLL0_PGR2_PLR1_PKA1_SIA3_SS1_SU8_SUM0_SUS256_SPO0_SRVW0_SSO0_SVW2_TLDS1_USL1_UIOFGRO0_USFGROn1_VSn1_VWA2_VWB1_WSGRA0_WSGRB0_WS64_WG64_4_1_WGM1_WGMXCC1
    SolutionIndex: 82
    SolutionNameMin: Cijk_Alik_Bljk_BBS_BH_Bias_HA_S_SAV_UserArgs_MT64x32x256_MI16x16x1_SN_LDSB1_AFC1_AFEM1_AFEM1_ASEM1_CLR1_CADS0_EPS0_FDSI0_GRPM1_GRVWA8_GRVWB8_GSU1_GSUAMBSK_GSUC0_GLS0_ISA942_IU1_LBSPPA1024_LBSPPB512_LBSPPM0_LPA16_LPB16_LPM0_LRVW8_LWPMn1_MIAV0_MIWT2_2_MO40_NTn1_NTA7_NTB0_NTC0_NTD0_NTM0_NEPBS16_NLCA1_NLCB1_ONLL0_PGR2_PLR1_PKA1_SIA3_SS1_SU8_SUM1_SUS512_SPO0_SRVW0_SSO0_SVW2_TLDS1_USL1_UIOFGRO0_USFGROn1_VSn1_VWA2_VWB1_WSGRA0_WSGRB0_WS64_WG32_4_1_WGM0_WGMXCC1
    SolutionIndex: 83
    SolutionNameMin: Cijk_Alik_Bljk_BBS_BH_Bias_HA_S_SAV_UserArgs_MT32x16x512_MI16x16x1_SN_LDSB1_AFC1_AFEM1_AFEM1_ASEM1_CLR1_CADS0_EPS0_FDSI0_GRPM1_GRVWA8_GRVWB8_GSU1_GSUAMBSK_GSUC0_GLS0_ISA942_IU1_LBSPPA1024_LBSPPB1024_LBSPPM0_LPA16_LPB16_LPM0_LRVW8_LWPMn1_MIAV0_MIWT1_1_MO40_NTn1_NTA7_NTB0_NTC0_NTD7_NTM0_NEPBS0_NLCA1_NLCB1_ONLL0_PGR2_PLR1_PKA1_SIA3_SS0_SU8_SUM1_SUS1024_SPO0_SRVW0_SSO0_SVW4_TLDS1_USL1_UIOFGRO0_USFGROn1_VSn1_VWA1_VWB1_WSGRA0_WSGRB0_WS64_WG32_4_1_WGM0_WGMXCC1
    SolutionIndex: 84
    SolutionNameMin: Cijk_Alik_Bljk_BBS_BH_Bias_HA_S_SAV_UserArgs_MT32x16x512_MI16x16x1_SN_LDSB1_AFC1_AFEM1_AFEM1_ASEM1_CLR1_CADS0_EPS0_FDSI0_GRPM1_GRVWA8_GRVWB8_GSU1_GSUAMBSK_GSUC0_GLS0_ISA942_IU1_LBSPPA1024_LBSPPB1024_LBSPPM0_LPA16_LPB16_LPM0_LRVW8_LWPMn1_MIAV0_MIWT1_1_MO40_NTn1_NTA7_NTB0_NTC0_NTD0_NTM0_NEPBS0_NLCA1_NLCB1_ONLL0_PGR2_PLR1_PKA1_SIA3_SS0_SU8_SUM0_SUS1024_SPO0_SRVW0_SSO0_SVW4_TLDS1_USL1_UIOFGRO0_USFGROn1_VSn1_VWA1_VWB1_WSGRA0_WSGRB0_WS64_WG32_4_1_WGM0_WGMXCC1
    SolutionIndex: 85
    SolutionNameMin: Cijk_Alik_Bljk_BBS_BH_Bias_HA_S_SAV_UserArgs_MT32x16x512_MI16x16x1_SN_LDSB1_AFC1_AFEM1_AFEM1_ASEM1_CLR1_CADS0_EPS0_FDSI0_GRPM1_GRVWA8_GRVWB8_GSU1_GSUAMBSK_GSUC0_GLS0_ISA942_IU1_LBSPPA1024_LBSPPB1024_LBSPPM0_LPA16_LPB16_LPM0_LRVW8_LWPMn1_MIAV0_MIWT1_1_MO40_NTn1_NTA7_NTB0_NTC0_NTD0_NTM0_NEPBS0_NLCA1_NLCB1_ONLL0_PGR2_PLR1_PKA1_SIA3_SS0_SU0_SUM0_SUS0_SPO0_SRVW0_SSO0_SVW4_TLDS1_USL1_UIOFGRO0_USFGROn1_VSn1_VWA1_VWB1_WSGRA0_WSGRB0_WS64_WG32_4_1_WGM0_WGMXCC1
    SolutionIndex: 86
    SolutionNameMin: Cijk_Alik_Bljk_BBS_BH_Bias_HA_S_SAV_UserArgs_MT32x16x512_MI16x16x1_SN_LDSB1_AFC1_AFEM1_AFEM1_ASEM1_CLR1_CADS0_EPS0_FDSI0_GRPM1_GRVWA8_GRVWB8_GSU1_GSUAMBSK_GSUC0_GLS0_ISA942_IU1_LBSPPA1024_LBSPPB1024_LBSPPM0_LPA16_LPB16_LPM0_LRVW8_LWPMn1_MIAV0_MIWT1_1_MO40_NTn1_NTA7_NTB0_NTC0_NTD0_NTM0_NEPBS16_NLCA1_NLCB1_ONLL0_PGR2_PLR1_PKA1_SIA3_SS0_SU8_SUM0_SUS1024_SPO0_SRVW0_SSO0_SVW4_TLDS1_USL1_UIOFGRO0_USFGROn1_VSn1_VWA1_VWB1_WSGRA0_WSGRB0_WS64_WG32_4_1_WGM0_WGMXCC1
    SolutionIndex: 87
    SolutionNameMin: Cijk_Alik_Bljk_BBS_BH_Bias_HA_S_SAV_UserArgs_MT64x32x256_MI16x16x1_SN_LDSB1_AFC1_AFEM1_AFEM1_ASEM1_CLR1_CADS0_EPS0_FDSI0_GRPM1_GRVWA8_GRVWB8_GSU1_GSUAMBSK_GSUC0_GLS0_ISA942_IU1_LBSPPA1024_LBSPPB512_LBSPPM0_LPA16_LPB16_LPM0_LRVW8_LWPMn1_MIAV0_MIWT2_2_MO40_NTn1_NTA7_NTB0_NTC0_NTD0_NTM0_NEPBS0_NLCA1_NLCB1_ONLL0_PGR2_PLR1_PKA1_SIA3_SS0_SU8_SUM1_SUS512_SPO0_SRVW0_SSO0_SVW8_TLDS1_USL1_UIOFGRO0_USFGROn1_VSn1_VWA2_VWB1_WSGRA0_WSGRB0_WS64_WG32_4_1_WGM1_WGMXCC1
    SolutionIndex: 88
    SolutionNameMin: Cijk_Alik_Bljk_BBS_BH_Bias_HA_S_SAV_UserArgs_MT64x48x128_MI16x16x1_SN_LDSB0_AFC1_AFEM1_AFEM1_ASEM1_CLR1_CADS0_EPS0_FDSI0_GRPM1_GRVWA8_GRVWB8_GSU1_GSUAMB_GSUC0_GLS0_ISA942_IU1_LBSPPA512_LBSPPB256_LBSPPM0_LPA16_LPB16_LPM0_LRVW8_LWPMn1_MIAV0_MIWT2_3_MO40_NTn1_NTA0_NTB0_NTC0_NTD7_NTM0_NEPBS0_NLCA1_NLCB1_ONLL0_PGR2_PLR1_PKA1_SIA3_SS0_SU8_SUM0_SUS256_SPO0_SRVW0_SSO0_SVW8_TLDS1_USL1_UIOFGRO0_USFGROn1_VSn1_VWA2_VWB1_WSGRA0_WSGRB0_WS64_WG32_4_1_WGM0_WGMXCC1
    SolutionIndex: 89
    SolutionNameMin: Cijk_Alik_Bljk_BBS_BH_Bias_HA_S_SAV_UserArgs_MT16x16x256_MI16x16x1_SN_LDSB1_AFC1_AFEM1_AFEM1_ASEM1_CLR1_CADS0_EPS0_FDSI0_GRPM1_GRVWA8_GRVWB8_GSU6_GSUAMBSK_GLS0_ISA942_IU1_LCS0_LBSPPA512_LBSPPB512_LBSPPM0_LPA16_LPB16_LPM0_LRVW8_LWPMn1_MIAV0_MIWT1_1_MO40_NTn1_NTA7_NTB0_NTC0_NTD0_NTM0_NEPBS16_NLCA1_NLCB1_ONLL1_PGR2_PLR1_PKA1_SIA3_SS0_SU8_SUM0_SUS512_SPO0_SRVW0_SSO0_SVW4_TLDS1_USL1_UIOFGRO0_USFGROn1_VSn1_VWA1_VWB1_WSGRA0_WSGRB0_WS64_WG16_4_1_WGM8_WGMXCC1
    SolutionIndex: 90
    SolutionNameMin: Cijk_Alik_Bljk_BBS_BH_Bias_HA_S_SAV_UserArgs_MT32x16x256_MI16x16x1_SN_LDSB0_AFC1_AFEM1_AFEM1_ASEM1_CLR1_CADS0_EPS0_FDSI0_GRPM1_GRVWA8_GRVWB8_GSU1_GSUAMB_GSUC0_GLS0_ISA942_IU1_LBSPPA512_LBSPPB512_LBSPPM0_LPA16_LPB16_LPM0_LRVW8_LWPMn1_MIAV0_MIWT1_1_MO40_NTn1_NTA7_NTB0_NTC0_NTD0_NTM0_NEPBS0_NLCA1_NLCB1_ONLL1_PGR2_PLR1_PKA1_SIA3_SS1_SU32_SUM1_SUS512_SPO0_SRVW0_SSO0_SVW1_TLDS1_USL1_UIOFGRO0_USFGROn1_VSn1_VWA1_VWB1_WSGRA0_WSGRB0_WS64_WG32_4_1_WGM8_WGMXCC1
    SolutionIndex: 91
    SolutionNameMin: Cijk_Alik_Bljk_BBS_BH_Bias_HA_S_SAV_UserArgs_MT32x16x256_MI16x16x1_SN_LDSB0_AFC1_AFEM1_AFEM1_ASEM1_CLR1_CADS0_EPS0_FDSI0_GRPM1_GRVWA8_GRVWB8_GSU1_GSUAMB_GSUC0_GLS0_ISA942_IU1_LBSPPA512_LBSPPB512_LBSPPM0_LPA16_LPB16_LPM0_LRVW8_LWPMn1_MIAV0_MIWT1_1_MO40_NTn1_NTA4_NTB0_NTC0_NTD0_NTM0_NEPBS0_NLCA1_NLCB1_ONLL1_PGR2_PLR1_PKA1_SIA3_SS1_SU32_SUM1_SUS512_SPO0_SRVW0_SSO0_SVW1_TLDS1_USL1_UIOFGRO0_USFGROn1_VSn1_VWA1_VWB1_WSGRA0_WSGRB0_WS64_WG32_4_1_WGM8_WGMXCC1
    SolutionIndex: 92
    SolutionNameMin: Cijk_Alik_Bljk_BBS_BH_Bias_HA_S_SAV_UserArgs_MT128x64x128_MI16x16x1_SN_LDSB1_AFC1_AFEM1_AFEM1_ASEM1_CLR1_CADS0_EPS0_FDSI0_GRPM1_GRVWA8_GRVWB8_GSU5_GSUAMB_GSUC0_GLS0_ISA942_IU1_LBSPPA1024_LBSPPB256_LBSPPM0_LPA16_LPB16_LPM0_LRVW8_LWPMn1_MIAV0_MIWT4_2_MO40_NTn1_NTA4_NTB0_NTC0_NTD0_NTM0_NEPBS16_NLCA1_NLCB1_ONLL1_PGR2_PLR1_PKA1_SIA3_SS1_SU0_SUM0_SUS0_SPO0_SRVW0_SSO0_SVW4_TLDS1_USL1_UIOFGRO0_USFGROn1_VSn1_VWA4_VWB1_WSGRA0_WSGRB0_WS64_WG32_8_1_WGM8_WGMXCC1
    SolutionIndex: 93
    SolutionNameMin: Cijk_Alik_Bljk_BBS_BH_Bias_HA_S_SAV_UserArgs_MT128x96x128_MI16x16x1_SN_LDSB1_AFC1_AFEM1_AFEM1_ASEM1_CLR1_CADS0_EPS0_FDSI0_GRPM1_GRVWA8_GRVWB8_GSU5_GSUAMB_GSUC0_GLS0_ISA942_IU1_LBSPPA512_LBSPPB256_LBSPPM0_LPA16_LPB16_LPM0_LRVW8_LWPMn1_MIAV0_MIWT2_6_MO40_NTn1_NTA4_NTB0_NTC0_NTD0_NTM0_NEPBS16_NLCA1_NLCB1_ONLL1_PGR2_PLR1_PKA1_SIA3_SS1_SU0_SUM0_SUS0_SPO0_SRVW0_SSO0_SVW2_TLDS1_USL1_UIOFGRO0_USFGROn1_VSn1_VWA2_VWB1_WSGRA0_WSGRB0_WS64_WG64_4_1_WGM8_WGMXCC1
    SolutionIndex: 94
    SolutionNameMin: Cijk_Alik_Bljk_BBS_BH_Bias_HA_S_SAV_UserArgs_MT64x32x256_MI16x16x1_SN_LDSB1_AFC1_AFEM1_AFEM1_ASEM1_CLR1_CADS0_EPS0_FDSI0_GRPM1_GRVWA8_GRVWB8_GSU1_GSUAMB_GLS0_ISA942_IU1_LBSPPA1024_LBSPPB512_LBSPPM0_LPA16_LPB16_LPM0_LRVW8_LWPMn1_MIAV0_MIWT2_2_MO40_NTn1_NTA7_NTB0_NTC0_NTD7_NTM0_NEPBS16_NLCA1_NLCB1_ONLL1_PGR2_PLR1_PKA1_SIA3_SS1_SU8_SUM1_SUS512_SPO0_SRVW0_SSO0_SVW2_TLDS1_USL1_UIOFGRO0_USFGROn1_VSn1_VWA2_VWB1_WSGRA0_WSGRB0_WS64_WG32_4_2_WGM0_WGMXCC1
    SolutionIndex: 95
    SolutionNameMin: Cijk_Alik_Bljk_BBS_BH_Bias_HA_S_SAV_UserArgs_MT16x16x256_MI16x16x1_SN_LDSB1_AFC1_AFEM1_AFEM1_ASEM1_CLR1_CADS0_EPS0_FDSI0_GRPM1_GRVWA8_GRVWB8_GSU1_GSUAMB_GSUC0_GLS0_ISA942_IU1_LBSPPA512_LBSPPB512_LBSPPM0_LPA16_LPB16_LPM0_LRVW8_LWPMn1_MIAV0_MIWT1_1_MO40_NTn1_NTA0_NTB0_NTC0_NTD0_NTM0_NEPBS0_NLCA1_NLCB1_ONLL1_PGR2_PLR1_PKA1_SIA3_SS1_SU0_SUM0_SUS0_SPO0_SRVW0_SSO0_SVW1_TLDS1_ULSGRO0_USL1_UIOFGRO0_USFGROn1_VSn1_VWA1_VWB1_WSGRA0_WSGRB0_WS64_WG16_4_1_WGM1_WGMXCC8_WGMXCCG304
    SolutionIndex: 96
    SolutionNameMin: Cijk_Alik_Bljk_BBS_BH_Bias_HA_S_SAV_UserArgs_MT16x16x256_MI16x16x1_SN_LDSB1_AFC1_AFEM1_AFEM1_ASEM1_CLR1_CADS0_EPS0_FDSI0_GRPM1_GRVWA8_GRVWB8_GSU1_GSUAMB_GSUC0_GLS0_ISA942_IU1_LBSPPA512_LBSPPB512_LBSPPM0_LPA16_LPB16_LPM0_LRVW8_LWPMn1_MIAV0_MIWT1_1_MO40_NTn1_NTA0_NTB0_NTC0_NTD0_NTM0_NEPBS0_NLCA1_NLCB1_ONLL1_PGR2_PLR1_PKA1_SIA3_SS1_SU0_SUM0_SUS0_SPO0_SRVW0_SSO0_SVW1_TLDS1_ULSGRO0_USL1_UIOFGRO0_USFGROn1_VSn1_VWA1_VWB1_WSGRA0_WSGRB0_WS64_WG16_4_1_WGM1_WGMXCC1_WGMXCCG304
    SolutionIndex: 97
    SolutionNameMin: Cijk_Alik_Bljk_BBS_BH_Bias_HA_S_SAV_UserArgs_MT16x32x512_MI16x16x1_SN_LDSB1_AFC1_AFEM1_AFEM1_ASEM1_CLR1_CADS0_EPS0_FDSI0_GRPM1_GRVWA8_GRVWB8_GSU1_GSUAMB_GSUC0_GLS0_ISA942_IU1_LBSPPA1024_LBSPPB1024_LBSPPM0_LPA16_LPB16_LPM0_LRVW8_LWPMn1_MIAV0_MIWT1_1_MO40_NTn1_NTA4_NTB0_NTC0_NTD0_NTM0_NEPBS16_NLCA1_NLCB1_ONLL1_PGR2_PLR1_PKA1_SIA3_SS1_SU0_SUM0_SUS0_SPO0_SRVW0_SSO0_SVW1_TLDS1_ULSGRO0_USL1_UIOFGRO0_USFGROn1_VSn1_VWA1_VWB1_WSGRA0_WSGRB0_WS64_WG16_8_1_WGM0_WGMXCC1_WGMXCCG304
    SolutionIndex: 98
    SolutionNameMin: Cijk_Alik_Bljk_BBS_BH_Bias_HA_S_SAV_UserArgs_MT16x16x256_MI16x16x1_SN_LDSB1_AFC1_AFEM1_AFEM1_ASEM1_CLR1_CADS0_EPS0_FDSI0_GRPM1_GRVWA8_GRVWB8_GSU1_GSUAMB_GSUC0_GLS0_ISA942_IU1_LBSPPA512_LBSPPB512_LBSPPM0_LPA16_LPB16_LPM0_LRVW8_LWPMn1_MIAV0_MIWT1_1_MO40_NTn1_NTA4_NTB0_NTC0_NTD0_NTM0_NEPBS0_NLCA1_NLCB1_ONLL1_PGR2_PLR1_PKA1_SIA3_SS1_SU0_SUM0_SUS0_SPO0_SRVW0_SSO0_SVW1_TLDS1_ULSGRO0_USL1_UIOFGRO0_USFGROn1_VSn1_VWA1_VWB1_WSGRA0_WSGRB0_WS64_WG16_4_1_WGM0_WGMXCC1_WGMXCCG304
    SolutionIndex: 99
    SolutionNameMin: Cijk_Alik_Bljk_BBS_BH_Bias_HA_S_SAV_UserArgs_MT128x32x64_MI16x16x1_SN_LDSB1_AFC1_AFEM1_AFEM1_ASEM1_CLR1_CADS0_EPS0_FDSI0_GRPM1_GRVWA8_GRVWB8_GSU1_GSUAMB_GSUC0_GLS0_ISA942_IU1_LBSPPA512_LBSPPB128_LBSPPM0_LPA16_LPB16_LPM0_LRVW8_LWPMn1_MIAV0_MIWT4_1_MO40_NTn1_NTA0_NTB0_NTC0_NTD0_NTM0_NEPBS0_NLCA1_NLCB1_ONLL1_PGR2_PLR1_PKA1_SIA3_SS1_SU0_SUM0_SUS0_SPO0_SRVW0_SSO0_SVW4_TLDS1_ULSGRO0_USL1_UIOFGRO0_USFGROn1_VSn1_VWA4_VWB1_WSGRA0_WSGRB0_WS64_WG32_8_1_WGM1_WGMXCC8_WGMXCCG304
    SolutionIndex: 100
    SolutionNameMin: Cijk_Alik_Bljk_BBS_BH_Bias_HA_S_SAV_UserArgs_MT128x32x32_MI16x16x1_SN_LDSB1_AFC1_AFEM1_AFEM1_ASEM1_CLR1_CADS0_EPS0_FDSI0_GRPM1_GRVWA4_GRVWB4_GSU1_GSUAMB_GSUC0_GLS0_ISA942_IU1_LBSPPA256_LBSPPB128_LBSPPM0_LPA4_LPB4_LPM0_LRVW4_LWPMn1_MIAV0_MIWT4_1_MO40_NTn1_NTA0_NTB0_NTC0_NTD0_NTM0_NEPBS0_NLCA1_NLCB1_ONLL1_PGR2_PLR1_PKA1_SIA3_SS1_SU8_SUM0_SUS64_SPO0_SRVW0_SSO0_SVW4_TLDS1_ULSGRO0_USL1_UIOFGRO0_USFGROn1_VSn1_VWA4_VWB1_WSGRA0_WSGRB0_WS64_WG32_8_1_WGM8_WGMXCC8_WGMXCCG304
    SolutionIndex: 101
    SolutionNameMin: Cijk_Alik_Bljk_BBS_BH_Bias_HA_S_SAV_UserArgs_MT16x32x256_MI16x16x1_SN_LDSB1_AFC1_AFEM1_AFEM1_ASEM1_CLR1_CADS0_EPS0_FDSI0_GRPM1_GRVWA8_GRVWB8_GSU1_GSUAMB_GSUC0_GLS0_ISA942_IU1_LBSPPA512_LBSPPB512_LBSPPM0_LPA16_LPB16_LPM0_LRVW8_LWPMn1_MIAV0_MIWT1_1_MO40_NTn1_NTA4_NTB0_NTC0_NTD0_NTM0_NEPBS16_NLCA1_NLCB1_ONLL1_PGR2_PLR1_PKA1_SIA3_SS1_SU0_SUM0_SUS0_SPO0_SRVW0_SSO0_SVW1_TLDS1_ULSGRO0_USL1_UIOFGRO0_USFGROn1_VSn1_VWA1_VWB1_WSGRA0_WSGRB0_WS64_WG16_8_1_WGM0_WGMXCC1_WGMXCCG304
    SolutionIndex: 102
    SolutionNameMin: Cijk_Alik_Bljk_BBS_BH_Bias_HA_S_SAV_UserArgs_MT16x32x256_MI16x16x1_SN_LDSB1_AFC1_AFEM1_AFEM1_ASEM1_CLR1_CADS0_EPS0_FDSI0_GRPM1_GRVWA8_GRVWB8_GSU1_GSUAMB_GSUC0_GLS0_ISA942_IU1_LBSPPA512_LBSPPB512_LBSPPM0_LPA16_LPB16_LPM0_LRVW8_LWPMn1_MIAV0_MIWT1_1_MO40_NTn1_NTA0_NTB0_NTC0_NTD0_NTM0_NEPBS16_NLCA1_NLCB1_ONLL1_PGR2_PLR1_PKA1_SIA3_SS1_SU8_SUM0_SUS512_SPO0_SRVW0_SSO0_SVW1_TLDS1_ULSGRO0_USL1_UIOFGRO0_USFGROn1_VSn1_VWA1_VWB1_WSGRA0_WSGRB0_WS64_WG16_8_1_WGM0_WGMXCC8_WGMXCCG304
    SolutionIndex: 103
    SolutionNameMin: Cijk_Alik_Bljk_BBS_BH_Bias_HA_S_SAV_UserArgs_MT128x96x64_MI16x16x1_SN_LDSB1_AFC1_AFEM1_AFEM1_ASEM1_CLR1_CADS0_EPS0_FDSI0_GRPM1_GRVWA8_GRVWB8_GSU1_GSUAMB_GSUC0_GLS0_ISA942_IU1_LBSPPA512_LBSPPB128_LBSPPM0_LPA16_LPB16_LPM0_LRVW8_LWPMn1_MIAV0_MIWT4_3_MO40_NTn1_NTA0_NTB0_NTC0_NTD0_NTM0_NEPBS16_NLCA1_NLCB1_ONLL1_PGR2_PLR1_PKA1_SIA3_SS1_SU8_SUM0_SUS128_SPO0_SRVW0_SSO0_SVW4_TLDS1_ULSGRO0_USL1_UIOFGRO0_USFGROn1_VSn1_VWA4_VWB1_WSGRA0_WSGRB0_WS64_WG32_8_1_WGM8_WGMXCC1_WGMXCCG304
    SolutionIndex: 104
    SolutionNameMin: Cijk_Alik_Bljk_BBS_BH_Bias_HA_S_SAV_UserArgs_MT16x32x256_MI16x16x1_SN_LDSB1_AFC1_AFEM1_AFEM1_ASEM1_CLR1_CADS0_EPS0_FDSI0_GRPM1_GRVWA8_GRVWB8_GSU1_GSUAMB_GSUC0_GLS0_ISA942_IU1_LBSPPA512_LBSPPB512_LBSPPM0_LPA16_LPB16_LPM0_LRVW8_LWPMn1_MIAV0_MIWT1_1_MO40_NTn1_NTA0_NTB0_NTC0_NTD0_NTM0_NEPBS16_NLCA1_NLCB1_ONLL1_PGR2_PLR1_PKA1_SIA3_SS1_SU0_SUM0_SUS0_SPO0_SRVW0_SSO0_SVW1_TLDS1_ULSGRO0_USL1_UIOFGRO0_USFGROn1_VSn1_VWA1_VWB1_WSGRA0_WSGRB0_WS64_WG16_8_1_WGM1_WGMXCC8_WGMXCCG304
    SolutionIndex: 105
    SolutionNameMin: Cijk_Alik_Bljk_BBS_BH_Bias_HA_S_SAV_UserArgs_MT16x32x256_MI16x16x1_SN_LDSB1_AFC1_AFEM1_AFEM1_ASEM1_CLR1_CADS0_EPS0_FDSI0_GRPM1_GRVWA8_GRVWB8_GSU1_GSUAMB_GSUC0_GLS0_ISA942_IU1_LBSPPA512_LBSPPB512_LBSPPM0_LPA16_LPB16_LPM0_LRVW8_LWPMn1_MIAV0_MIWT1_1_MO40_NTn1_NTA0_NTB0_NTC0_NTD0_NTM0_NEPBS0_NLCA1_NLCB1_ONLL1_PGR2_PLR1_PKA1_SIA3_SS1_SU8_SUM0_SUS512_SPO0_SRVW0_SSO0_SVW1_TLDS1_ULSGRO0_USL1_UIOFGRO0_USFGROn1_VSn1_VWA1_VWB1_WSGRA0_WSGRB0_WS64_WG16_8_1_WGM1_WGMXCC1_WGMXCCG304
    SolutionIndex: 106
    SolutionNameMin: Cijk_Alik_Bljk_BBS_BH_Bias_HA_S_SAV_UserArgs_MT16x32x32_MI16x16x1_SN_LDSB1_AFC1_AFEM1_AFEM1_ASEM1_CLR1_CADS0_EPS0_FDSI0_GRPM1_GRVWA4_GRVWB4_GSU1_GSUAMB_GSUC0_GLS0_ISA942_IU1_LBSPPA128_LBSPPB128_LBSPPM0_LPA4_LPB4_LPM0_LRVW4_LWPMn1_MIAV0_MIWT1_1_MO40_NTn1_NTA0_NTB0_NTC0_NTD0_NTM0_NEPBS16_NLCA1_NLCB1_ONLL1_PGR2_PLR1_PKA1_SIA3_SS1_SU0_SUM0_SUS0_SPO0_SRVW0_SSO0_SVW1_TLDS1_ULSGRO0_USL1_UIOFGRO0_USFGROn1_VSn1_VWA1_VWB1_WSGRA0_WSGRB0_WS64_WG16_8_1_WGM1_WGMXCC8_WGMXCCG304
    SolutionIndex: 107
    SolutionNameMin: Cijk_Alik_Bljk_BBS_BH_Bias_HA_S_SAV_UserArgs_MT32x32x64_MI16x16x1_SN_LDSB1_AFC1_AFEM1_AFEM1_ASEM1_CLR1_CADS0_EPS0_FDSI0_GRPM1_GRVWA8_GRVWB8_GSU1_GSUAMB_GSUC0_GLS0_ISA942_IU1_LBSPPA128_LBSPPB128_LBSPPM0_LPA16_LPB16_LPM0_LRVW8_LWPMn1_MIAV0_MIWT1_1_MO40_NTn1_NTA0_NTB0_NTC0_NTD0_NTM0_NEPBS0_NLCA1_NLCB1_ONLL1_PGR2_PLR1_PKA1_SIA3_SS1_SU0_SUM0_SUS0_SPO0_SRVW0_SSO0_SVW1_TLDS1_ULSGRO0_USL1_UIOFGRO0_USFGROn1_VSn1_VWA1_VWB1_WSGRA0_WSGRB0_WS64_WG32_8_1_WGM0_WGMXCC8_WGMXCCG304
    SolutionIndex: 108
    SolutionNameMin: Cijk_Alik_Bljk_BBS_BH_Bias_HA_S_SAV_UserArgs_MT16x32x64_MI16x16x1_SN_LDSB1_AFC1_AFEM1_AFEM1_ASEM1_CLR1_CADS0_EPS0_FDSI0_GRPM1_GRVWA8_GRVWB8_GSU1_GSUAMB_GSUC0_GLS0_ISA942_IU1_LBSPPA128_LBSPPB128_LBSPPM0_LPA16_LPB16_LPM0_LRVW8_LWPMn1_MIAV0_MIWT1_1_MO40_NTn1_NTA0_NTB0_NTC0_NTD0_NTM0_NEPBS16_NLCA1_NLCB1_ONLL1_PGR2_PLR1_PKA1_SIA3_SS1_SU0_SUM0_SUS0_SPO0_SRVW0_SSO0_SVW1_TLDS1_ULSGRO0_USL1_UIOFGRO0_USFGROn1_VSn1_VWA1_VWB1_WSGRA0_WSGRB0_WS64_WG16_8_1_WGM1_WGMXCC8_WGMXCCG304
    SolutionIndex: 109
    SolutionNameMin: Cijk_Alik_Bljk_BBS_BH_Bias_HA_S_SAV_UserArgs_MT16x32x128_MI16x16x1_SN_LDSB1_AFC1_AFEM1_AFEM1_ASEM1_CLR1_CADS0_EPS0_FDSI0_GRPM1_GRVWA8_GRVWB8_GSU1_GSUAMB_GSUC0_GLS0_ISA942_IU1_LBSPPA256_LBSPPB256_LBSPPM0_LPA16_LPB16_LPM0_LRVW8_LWPMn1_MIAV0_MIWT1_1_MO40_NTn1_NTA0_NTB0_NTC0_NTD0_NTM0_NEPBS0_NLCA1_NLCB1_ONLL1_PGR2_PLR1_PKA1_SIA3_SS1_SU0_SUM0_SUS0_SPO0_SRVW0_SSO0_SVW1_TLDS1_ULSGRO0_USL1_UIOFGRO0_USFGROn1_VSn1_VWA1_VWB1_WSGRA0_WSGRB0_WS64_WG16_8_1_WGM1_WGMXCC8_WGMXCCG304
    SolutionIndex: 110
    SolutionNameMin: Cijk_Alik_Bljk_BBS_BH_Bias_HA_S_SAV_UserArgs_MT64x16x64_MI16x16x1_SN_LDSB1_AFC1_AFEM1_AFEM1_ASEM1_CLR1_CADS0_EPS0_FDSI0_GRPM1_GRVWA8_GRVWB8_GSU1_GSUAMB_GSUC0_GLS0_ISA942_IU1_LBSPPA256_LBSPPB128_LBSPPM0_LPA16_LPB16_LPM0_LRVW8_LWPMn1_MIAV0_MIWT2_1_MO40_NTn1_NTA0_NTB0_NTC0_NTD0_NTM0_NEPBS16_NLCA1_NLCB1_ONLL1_PGR2_PLR1_PKA1_SIA3_SS1_SU0_SUM0_SUS0_SPO0_SRVW0_SSO0_SVW2_TLDS1_ULSGRO0_USL1_UIOFGRO0_USFGROn1_VSn1_VWA2_VWB1_WSGRA0_WSGRB0_WS64_WG32_4_1_WGM0_WGMXCC8_WGMXCCG304
    SolutionIndex: 111
    SolutionNameMin: Cijk_Alik_Bljk_BBS_BH_Bias_HA_S_SAV_UserArgs_MT48x64x64_MI16x16x1_SN_LDSB1_AFC1_AFEM1_AFEM1_ASEM1_CLR1_CADS0_EPS0_FDSI0_GRPM1_GRVWA4_GRVWB8_GSU1_GSUAMB_GSUC0_GLS0_ISA942_IU1_LBSPPA128_LBSPPB128_LBSPPM0_LPA16_LPB16_LPM0_LRVW8_LWPMn1_MIAV0_MIWT3_1_MO40_NTn1_NTA0_NTB0_NTC0_NTD0_NTM0_NEPBS16_NLCA1_NLCB1_ONLL1_PGR2_PLR1_PKA1_SIA3_SS1_SU8_SUM0_SUS128_SPO0_SRVW0_SSO0_SVW1_TLDS1_ULSGRO0_USL1_UIOFGRO0_USFGROn1_VSn1_VWA1_VWB1_WSGRA0_WSGRB0_WS64_WG16_16_1_WGM1_WGMXCC8_WGMXCCG304
    SolutionIndex: 112
    SolutionNameMin: Cijk_Alik_Bljk_BBS_BH_Bias_HA_S_SAV_UserArgs_MT128x64x64_MI16x16x1_SN_LDSB1_AFC1_AFEM1_AFEM1_ASEM1_CLR1_CADS0_EPS0_FDSI0_GRPM1_GRVWA8_GRVWB8_GSU1_GSUAMB_GSUC0_GLS0_ISA942_IU1_LBSPPA256_LBSPPB512_LBSPPM0_LPA16_LPB16_LPM0_LRVW8_LWPMn1_MIAV0_MIWT2_4_MO40_NTn1_NTA0_NTB0_NTC0_NTD0_NTM0_NEPBS0_NLCA1_NLCB1_ONLL1_PGR2_PLR1_PKA1_SIA3_SS1_SU8_SUM0_SUS128_SPO0_SRVW0_SSO0_SVW2_TLDS1_ULSGRO0_USL1_UIOFGRO0_USFGROn1_VSn1_VWA2_VWB4_WSGRA0_WSGRB0_WS64_WG64_4_1_WGM1_WGMXCC8_WGMXCCG304
    SolutionIndex: 113
    SolutionNameMin: Cijk_Alik_Bljk_BBS_BH_Bias_HA_S_SAV_UserArgs_MT128x96x128_MI16x16x1_SN_LDSB1_AFC1_AFEM1_AFEM1_ASEM1_CLR1_CADS0_EPS0_FDSI0_GRPM1_GRVWA8_GRVWB8_GSU1_GSUAMB_GSUC0_GLS0_ISA942_IU1_LBSPPA1024_LBSPPB256_LBSPPM0_LPA16_LPB16_LPM0_LRVW8_LWPMn1_MIAV0_MIWT4_3_MO40_NTn1_NTA0_NTB0_NTC0_NTD0_NTM0_NEPBS16_NLCA1_NLCB1_ONLL1_PGR2_PLR1_PKA1_SIA3_SS1_SU8_SUM0_SUS256_SPO0_SRVW0_SSO0_SVW4_TLDS1_ULSGRO0_USL1_UIOFGRO0_USFGROn1_VSn1_VWA4_VWB1_WSGRA0_WSGRB0_WS64_WG32_8_1_WGM8_WGMXCC1_WGMXCCG304
    SolutionIndex: 114
    SolutionNameMin: Cijk_Alik_Bljk_BBS_BH_Bias_HA_S_SAV_UserArgs_MT256x224x64_MI16x16x1_SN_LDSB1_AFC1_AFEM1_AFEM1_ASEM1_CLR1_CADS0_EPS0_FDSI0_GRPM1_GRVWA8_GRVWB8_GSU1_GSUAMB_GSUC0_GLS0_ISA942_IU1_LBSPPA512_LBSPPB128_LBSPPM0_LPA4_LPB4_LPM0_LRVW4_LWPMn1_MIAV0_MIWT8_7_MO40_NTn1_NTA0_NTB0_NTC4_NTD4_NTM0_NEPBS16_NLCA1_NLCB1_ONLL1_PGR2_PLR1_PKA1_SIA3_SS1_SU8_SUM0_SUS256_SPO0_SRVW0_SSO0_SVW8_TLDS1_ULSGRO0_USL1_UIOFGRO0_USFGROn1_VSn1_VWA8_VWB1_WSGRA0_WSGRB0_WS64_WG32_8_1_WGM32_WGMXCC4_WGMXCCG304
    SolutionIndex: 115
    SolutionNameMin: Cijk_Alik_Bljk_BBS_BH_Bias_HA_S_SAV_UserArgs_MT128x128x64_MI16x16x1_SN_LDSB1_AFC1_AFEM1_AFEM1_ASEM1_CLR1_CADS0_EPS0_FDSI0_GRPM1_GRVWA8_GRVWB8_GSU1_GSUAMB_GSUC0_GLS0_ISA942_IU1_LBSPPA512_LBSPPB128_LBSPPM0_LPA4_LPB4_LPM0_LRVW4_LWPMn1_MIAV0_MIWT4_4_MO40_NTn1_NTA0_NTB0_NTC4_NTD4_NTM0_NEPBS16_NLCA1_NLCB1_ONLL1_PGR2_PLR1_PKA1_SIA3_SS1_SU8_SUM0_SUS256_SPO0_SRVW0_SSO0_SVW4_TLDS1_ULSGRO0_USL1_UIOFGRO0_USFGROn1_VSn1_VWA4_VWB1_WSGRA0_WSGRB0_WS64_WG32_8_1_WGM1_WGMXCC8_WGMXCCG304
    SolutionIndex: 116
    SolutionNameMin: Cijk_Alik_Bljk_BBS_BH_Bias_HA_S_SAV_UserArgs_MT256x256x32_MI16x16x1_SN_LDSB1_AFC1_AFEM1_AFEM1_ASEM1_CLR1_CADS0_EPS0_FDSI0_GRPM1_GRVWA2_GRVWB2_GSU1_GSUAMB_GSUC0_GLS0_ISA942_IU1_LBSPPA512_LBSPPB128_LBSPPM0_LPA4_LPB4_LPM0_LRVW4_LWPMn1_MIAV0_MIWT8_8_MO40_NTn1_NTA0_NTB0_NTC4_NTD4_NTM0_NEPBS0_NLCA1_NLCB1_ONLL1_PGR2_PLR1_PKA1_SIA3_SS1_SU8_SUM0_SUS256_SPO0_SRVW0_SSO0_SVW8_TLDS1_ULSGRO0_USL1_UIOFGRO0_USFGROn1_VSn1_VWA8_VWB1_WSGRA0_WSGRB0_WS64_WG32_8_1_WGM0_WGMXCC8_WGMXCCG0
    SolutionIndex: 117
    SolutionNameMin: Cijk_Alik_Bljk_BBS_BH_Bias_HA_S_SAV_UserArgs_MT256x16x64_MI16x16x1_SN_LDSB1_AFC1_AFEM1_AFEM1_ASEM1_CLR1_CADS0_EPS0_FDSI0_GRPM1_GRVWA8_GRVWB4_GSU1_GSUAMB_GSUC0_GLS0_ISA942_IU1_LBSPPA512_LBSPPB128_LBSPPM0_LPA16_LPB16_LPM0_LRVW8_LWPMn1_MIAV0_MIWT4_1_MO40_NTn1_NTA0_NTB0_NTC0_NTD4_NTM0_NEPBS16_NLCA1_NLCB1_ONLL1_PGR2_PLR1_PKA1_SIA3_SS1_SU0_SUM0_SUS0_SPO1_SRVW0_SSO0_SVW4_TLDS1_ULSGRO0_USL1_UIOFGRO0_USFGROn1_VSn1_VWA4_VWB1_WSGRA0_WSGRB0_WS64_WG64_4_1_WGM1_WGMXCC4_WGMXCCG0
    SolutionIndex: 118
    SolutionNameMin: Cijk_Alik_Bljk_BBS_BH_Bias_HA_S_SAV_UserArgs_MT256x224x64_MI16x16x1_SN_LDSB1_AFC1_AFEM1_AFEM1_ASEM1_CLR1_CADS0_EPS0_FDSI0_GRPM1_GRVWA2_GRVWB2_GSU1_GSUAMB_GLS0_ISA942_IU1_LBSPPA512_LBSPPB128_LBSPPM0_LPA4_LPB4_LPM0_LRVW4_LWPMn1_MIAV0_MIWT8_7_MO40_NTn1_NTA0_NTB0_NTC4_NTD4_NTM0_NEPBS16_NLCA1_NLCB1_ONLL1_PGR2_PLR1_PKA1_SIA3_SS1_SU8_SUM0_SUS256_SPO1_SRVW0_SSO4_SVW4_TLDS1_USL1_UIOFGRO0_USFGROn1_VSn1_VWA4_VWB1_WSGRA0_WSGRB0_WS64_WG32_8_1_WGM1_WGMXCC1
    SolutionIndex: 119
    SolutionNameMin: Cijk_Alik_Bljk_BBS_BH_Bias_HA_S_SAV_UserArgs_MT256x256x32_MI16x16x1_SN_LDSB1_AFC1_AFEM1_AFEM1_ASEM1_CLR1_CADS0_EPS0_FDSI0_GRPM1_GRVWA4_GRVWB4_GSU1_GSUAMB_GSUC0_GLS0_ISA942_IU1_LBSPPA512_LBSPPB512_LBSPPM0_LPA4_LPB4_LPM0_LRVW4_LWPMn1_MIAV0_MIWT8_8_MO40_NTn1_NTA0_NTB0_NTC0_NTD4_NTM0_NEPBS16_NLCA1_NLCB1_ONLL1_PGR2_PLR1_PKA1_SIA3_SS1_SU8_SUM0_SUS256_SPO1_SRVW0_SSO4_SVW8_TLDS1_ULSGRO0_USL1_UIOFGRO0_USFGROn1_VSn1_VWA8_VWB8_WSGRA0_WSGRB0_WS64_WG32_8_1_WGM32_WGMXCC8_WGMXCCG0
    SolutionIndex: 120
    SolutionNameMin: Cijk_Alik_Bljk_BBS_BH_Bias_HA_S_SAV_UserArgs_MT192x224x64_MI16x16x1_SN_LDSB1_AFC1_AFEM1_AFEM1_ASEM1_CLR1_CADS0_EPS0_FDSI0_GRPM1_GRVWA8_GRVWB8_GSU1_GSUAMB_GSUC0_GLS0_ISA942_IU1_LBSPPA256_LBSPPB128_LBSPPM0_LPA16_LPB16_LPM0_LRVW8_LWPMn1_MIAV0_MIWT6_7_MO40_NTn1_NTA0_NTB0_NTC4_NTD4_NTM0_NEPBS0_NLCA1_NLCB1_ONLL1_PGR2_PLR1_PKA1_SIA3_SS1_SU8_SUM0_SUS256_SPO1_SRVW0_SSO0_SVW2_TLDS1_ULSGRO0_USL1_UIOFGRO0_USFGROn1_VSn1_VWA2_VWB1_WSGRA0_WSGRB0_WS64_WG32_8_1_WGM32_WGMXCC8_WGMXCCG0
    SolutionIndex: 121
    SolutionNameMin: Cijk_Alik_Bljk_BBS_BH_Bias_HA_S_SAV_UserArgs_MT128x128x32_MI16x16x1_SN_LDSB1_AFC1_AFEM1_AFEM1_ASEM1_CLR1_CADS0_EPS0_FDSI0_GRPM1_GRVWA4_GRVWB4_GSU1_GSUAMB_GSUC0_GLS0_ISA942_IU1_LBSPPA256_LBSPPB256_LBSPPM0_LPA4_LPB4_LPM0_LRVW4_LWPMn1_MIAV0_MIWT4_4_MO40_NTn1_NTA0_NTB0_NTC4_NTD0_NTM0_NEPBS0_NLCA1_NLCB1_ONLL1_PGR2_PLR1_PKA1_SIA3_SS1_SU8_SUM0_SUS256_SPO1_SRVW0_SSO0_SVW4_TLDS1_ULSGRO0_USL1_UIOFGRO0_USFGROn1_VSn1_VWA4_VWB4_WSGRA0_WSGRB0_WS64_WG32_8_1_WGM0_WGMXCC8_WGMXCCG32
    SolutionIndex: 122
    SolutionNameMin: Cijk_Alik_Bljk_BBS_BH_Bias_HA_S_SAV_UserArgs_MT256x128x32_MI16x16x1_SN_LDSB1_AFC1_AFEM1_AFEM1_ASEM1_CLR1_CADS0_EPS0_FDSI0_GRPM1_GRVWA4_GRVWB4_GSU1_GSUAMB_GSUC0_GLS0_ISA942_IU1_LBSPPA512_LBSPPB256_LBSPPM0_LPA4_LPB4_LPM0_LRVW4_LWPMn1_MIAV0_MIWT8_4_MO40_NTn1_NTA0_NTB0_NTC4_NTD4_NTM0_NEPBS0_NLCA1_NLCB1_ONLL1_PGR2_PLR1_PKA1_SIA3_SS1_SU8_SUM0_SUS256_SPO1_SRVW0_SSO4_SVW8_TLDS1_ULSGRO0_USL1_UIOFGRO0_USFGROn1_VSn1_VWA8_VWB4_WSGRA0_WSGRB0_WS64_WG32_8_1_WGM32_WGMXCC32_WGMXCCG0
    SolutionIndex: 123
    SolutionNameMin: Cijk_Alik_Bljk_BBS_BH_Bias_HA_S_SAV_UserArgs_MT128x96x128_MI16x16x1_SN_LDSB1_AFC1_AFEM1_AFEM1_ASEM1_CLR1_CADS0_EPS0_FDSI0_GRPM1_GRVWA8_GRVWB8_GSU8_GSUAMB_GSUC0_GLS0_ISA942_IU1_LBSPPA512_LBSPPB512_LBSPPM0_LPA16_LPB16_LPM0_LRVW8_LWPMn1_MIAV0_MIWT2_6_MO40_NTn1_NTA0_NTB0_NTC4_NTD7_NTM0_NEPBS0_NLCA1_NLCB1_ONLL1_PGR2_PLR1_PKA1_SIA3_SS1_SU0_SUM0_SUS0_SPO0_SRVW0_SSO0_SVW2_TLDS1_ULSGRO0_USL1_UIOFGRO0_USFGROn1_VSn1_VWA2_VWB2_WSGRA2_WSGRB0_WS64_WG64_4_1_WGM0_WGMXCC8_WGMXCCG32
    SolutionIndex: 124
    SolutionNameMin: Cijk_Alik_Bljk_BBS_BH_Bias_HA_S_SAV_UserArgs_MT128x128x64_MI16x16x1_SN_LDSB1_AFC1_AFEM1_AFEM1_ASEM1_CLR1_CADS0_EPS0_FDSI0_GRPM1_GRVWA8_GRVWB8_GSU1_GSUAMB_GSUC0_GLS0_ISA942_IU1_LBSPPA256_LBSPPB128_LBSPPM0_LPA16_LPB16_LPM0_LRVW8_LWPMn1_MIAV0_MIWT8_2_MO40_NTn1_NTA0_NTB0_NTC3_NTD3_NTM0_NEPBS0_NLCA1_NLCB1_ONLL1_PGR2_PLR1_PKA1_SIA3_SS1_SU0_SUM0_SUS0_SPO1_SRVW0_SSO4_SVW2_TLDS1_ULSGRO1_USL1_UIOFGRO0_USFGROn1_VSn1_VWA2_VWB1_WSGRA2_WSGRB2_WS64_WG16_16_1_WGM4_WGMXCC8_WGMXCCG0
    SolutionIndex: 125
    SolutionNameMin: Cijk_Alik_Bljk_BBS_BH_Bias_HA_S_SAV_UserArgs_MT64x16x128_MI16x16x1_SN_LDSB0_AFC1_AFEM1_AFEM1_ASEM1_CLR1_CADS0_EPS0_FDSI0_GRPM1_GRVWA8_GRVWB8_GSU7_GSUAMB_GSUC0_GLS0_ISA942_IU1_LBSPPA256_LBSPPB256_LBSPPM0_LPA16_LPB16_LPM0_LRVW8_LWPMn1_MIAV0_MIWT1_1_MO40_NTn1_NTA4_NTB0_NTC0_NTD0_NTM0_NEPBS16_NLCA1_NLCB1_ONLL1_PGR2_PLR1_PKA1_SIA3_SS1_SU0_SUM0_SUS0_SPO0_SRVW0_SSO0_SVW1_TLDS1_ULSGRO1_USL1_UIOFGRO0_USFGROn1_VSn1_VWA1_VWB1_WSGRA0_WSGRB0_WS64_WG64_4_1_WGM0_WGMXCC32_WGMXCCG0
    SolutionIndex: 126
    SolutionNameMin: Cijk_Alik_Bljk_BBS_BH_Bias_HA_S_SAV_UserArgs_MT64x16x256_MI16x16x1_SN_LDSB1_AFC1_AFEM1_AFEM1_ASEM1_CLR1_CADS0_EPS0_FDSI0_GRPM1_GRVWA8_GRVWB8_GSU1_GSUAMB_GSUC0_GLS0_ISA942_IU1_LBSPPA1024_LBSPPB512_LBSPPM0_LPA16_LPB16_LPM0_LRVW8_LWPMn1_MIAV0_MIWT2_1_MO40_NTn1_NTA4_NTB0_NTC0_NTD0_NTM0_NEPBS16_NLCA1_NLCB1_ONLL1_PGR2_PLR1_PKA1_SIA3_SS1_SU8_SUM1_SUS512_SPO0_SRVW0_SSO0_SVW2_TLDS1_ULSGRO1_USL0_UIOFGRO1_USFGRO0_VSn1_VWA2_VWB1_WSGRA0_WSGRB0_WS64_WG32_4_1_WGM38_WGMXCC8_WGMXCCG0
    SolutionIndex: 127
    SolutionNameMin: Cijk_Alik_Bljk_BBS_BH_Bias_HA_S_SAV_UserArgs_MT32x16x128_MI16x16x1_SN_LDSB0_AFC1_AFEM1_AFEM1_ASEM1_CLR1_CADS0_EPS0_FDSI0_GRPM1_GRVWA8_GRVWB8_GSU1_GSUAMB_GSUC0_GLS0_ISA942_IU1_LBSPPA256_LBSPPB256_LBSPPM0_LPA16_LPB16_LPM0_LRVW8_LWPMn1_MIAV0_MIWT1_1_MO40_NTn1_NTA4_NTB0_NTC0_NTD0_NTM0_NEPBS16_NLCA1_NLCB1_ONLL1_PGR2_PLR1_PKA1_SIA3_SS1_SU8_SUM1_SUS512_SPO0_SRVW0_SSO0_SVW1_TLDS1_ULSGRO0_USL1_UIOFGRO0_USFGROn1_VSn1_VWA1_VWB1_WSGRA0_WSGRB0_WS64_WG32_4_1_WGM1_WGMXCC8_WGMXCCG0
    SolutionIndex: 128
    SolutionNameMin: Cijk_Alik_Bljk_BBS_BH_Bias_HA_S_SAV_UserArgs_MT64x16x256_MI16x16x1_SN_LDSB1_AFC1_AFEM1_AFEM1_ASEM1_CLR1_CADS0_EPS0_FDSI0_GRPM1_GRVWA8_GRVWB8_GSU1_GSUAMB_GSUC0_GLS0_ISA942_IU1_LBSPPA1024_LBSPPB512_LBSPPM0_LPA16_LPB16_LPM0_LRVW8_LWPMn1_MIAV0_MIWT2_1_MO40_NTn1_NTA4_NTB0_NTC0_NTD0_NTM0_NEPBS16_NLCA1_NLCB1_ONLL1_PGR2_PLR1_PKA1_SIA3_SS1_SU8_SUM0_SUS512_SPO0_SRVW0_SSO0_SVW2_TLDS1_ULSGRO0_USL1_UIOFGRO0_USFGROn1_VSn1_VWA2_VWB1_WSGRA0_WSGRB0_WS64_WG32_4_1_WGM1_WGMXCC32_WGMXCCG0
    SolutionIndex: 129
    SolutionNameMin: Cijk_Alik_Bljk_BBS_BH_Bias_HA_S_SAV_UserArgs_MT256x224x64_MI16x16x1_SN_LDSB1_AFC1_AFEM1_AFEM1_ASEM1_CLR1_CADS0_EPS0_FDSI0_GRPM1_GRVWA4_GRVWB4_GSU1_GSUAMB_GSUC0_GLS0_ISA942_IU1_LBSPPA1024_LBSPPB128_LBSPPM0_LPA4_LPB4_LPM0_LRVW4_LWPMn1_MIAV0_MIWT8_7_MO40_NTn1_NTA0_NTB0_NTC4_NTD4_NTM0_NEPBS0_NLCA1_NLCB1_ONLL1_PGR2_PLR1_PKA1_SIA3_SS1_SU8_SUM0_SUS128_SPO0_SRVW0_SSO0_SVW8_TLDS1_ULSGRO1_USL1_UIOFGRO0_USFGROn1_VSn1_VWA8_VWB1_WSGRA0_WSGRB0_WS64_WG32_8_1_WGM38_WGMXCC32_WGMXCCG0
    SolutionIndex: 130
    SolutionNameMin: Custom_Cijk_Alik_Bljk_BBS_BH_Bias_AS_SAV_UserArgs_MT256x256x64_MI16x16x1_SN_K1_MIWT4_16_DTVA
    SolutionIndex: 131
    SolutionNameMin: Cijk_Alik_Bljk_BBS_BH_Bias_HA_S_SAV_UserArgs_MT64x16x256_MI16x16x1_SN_LDSB1_AFC1_AFEM1_AFEM1_ASEM1_CLR1_CADS0_EPS0_FDSI0_GRPM1_GRVWA8_GRVWB8_GSU1_GSUAMB_GSUC0_GLS0_ISA942_IU1_LBSPPA512_LBSPPB0_LBSPPM0_LPA16_LPB16_LPM0_LRVW8_LWPMn1_MIAV0_MIWT2_1_MO40_NTn1_NTA7_NTB0_NTC0_NTD0_NTM0_NEPBS16_NLCA1_NLCB1_ONLL1_PGR2_PLR1_PKA1_SIA3_SS1_SU8_SUM1_SUS512_SPO0_SRVW0_SSO0_SVW2_TLDS1_ULSGRO0_USL0_UIOFGRO0_USFGRO1_VSn1_VWA2_VWB1_WSGRA0_WSGRB0_WS64_WG32_4_1_WGM0_WGMXCC1_WGMXCCG0
    SolutionIndex: 132
    SolutionNameMin: Cijk_Alik_Bljk_BBS_BH_Bias_HA_S_SAV_UserArgs_MT128x128x64_MI16x16x1_SN_LDSB1_AFC1_AFEM1_AFEM1_ASEM1_CLR1_CADS0_EPS0_FDSI0_GRPM1_GRVWA8_GRVWB8_GSU2_GSUAMB_GSUC0_GLS0_ISA942_IU1_LBSPPA1024_LBSPPB256_LBSPPM0_LPA16_LPB16_LPM0_LRVW8_LWPMn1_MIAV0_MIWT8_2_MO40_NTn1_NTA0_NTB0_NTC0_NTD0_NTM0_NEPBS16_NLCA1_NLCB1_ONLL1_PGR2_PLR1_PKA1_SIA3_SS1_SU8_SUM0_SUS128_SPO0_SRVW0_SSO0_SVW8_TLDS1_ULSGRO1_USL1_UIOFGRO0_USFGROn1_VSn1_VWA8_VWB2_WSGRA2_WSGRB2_WS64_WG16_16_1_WGM0_WGMXCC32_WGMXCCG0
    SolutionIndex: 133
    SolutionNameMin: Cijk_Alik_Bljk_BBS_BH_Bias_HA_S_SAV_UserArgs_MT128x256x32_MI16x16x1_SN_LDSB1_AFC1_AFEM1_AFEM1_ASEM1_CLR1_CADS0_EPS0_FDSI0_GRPM1_GRVWA4_GRVWB4_GSU1_GSUAMB_GSUC0_GLS0_ISA942_IU1_LBSPPA256_LBSPPB512_LBSPPM0_LPA4_LPB4_LPM0_LRVW4_LWPMn1_MIAV0_MIWT4_8_MO40_NTn1_NTA0_NTB0_NTC0_NTD0_NTM0_NEPBS16_NLCA1_NLCB1_ONLL1_PGR2_PLR1_PKA1_SIA3_SS1_SU0_SUM0_SUS0_SPO0_SRVW0_SSO0_SVW4_TLDS1_ULSGRO1_USL1_UIOFGRO0_USFGROn1_VSn1_VWA4_VWB8_WSGRA0_WSGRB0_WS64_WG32_8_1_WGM8_WGMXCC4_WGMXCCG4
    SolutionIndex: 134
    SolutionNameMin: Cijk_Alik_Bljk_BBS_BH_Bias_HA_S_SAV_UserArgs_MT192x256x64_MI16x16x1_SN_LDSB1_AFC1_AFEM1_AFEM1_ASEM1_CLR1_CADS0_EPS0_FDSI0_GRPM1_GRVWA8_GRVWB8_GSU1_GSUAMB_GSUC0_GLS0_ISA942_IU1_LBSPPA512_LBSPPB512_LBSPPM0_LPA16_LPB16_LPM0_LRVW8_LWPMn1_MIAV0_MIWT12_4_MO40_NTn1_NTA0_NTB0_NTC0_NTD0_NTM0_NEPBS16_NLCA1_NLCB1_ONLL1_PGR2_PLR1_PKA1_SIA3_SS1_SU0_SUM0_SUS0_SPO0_SRVW0_SSO0_SVW4_TLDS1_ULSGRO1_USL1_UIOFGRO0_USFGROn1_VSn1_VWA4_VWB4_WSGRA0_WSGRB0_WS64_WG16_16_1_WGM32_WGMXCC8_WGMXCCG0
    SolutionIndex: 135
    SolutionNameMin: Cijk_Alik_Bljk_BBS_BH_Bias_HA_S_SAV_UserArgs_MT128x128x64_MI16x16x1_SN_LDSB1_AFC1_AFEM1_AFEM1_ASEM1_CLR1_CADS0_EPS0_FDSI0_GRPM1_GRVWA8_GRVWB8_GSU2_GSUAMB_GSUC0_GLS0_ISA942_IU1_LBSPPA512_LBSPPB512_LBSPPM0_LPA16_LPB16_LPM0_LRVW8_LWPMn1_MIAV0_MIWT4_4_MO40_NTn1_NTA0_NTB0_NTC0_NTD0_NTM0_NEPBS16_NLCA1_NLCB1_ONLL1_PGR2_PLR1_PKA1_SIA3_SS1_SU0_SUM0_SUS0_SPO0_SRVW0_SSO0_SVW4_TLDS1_ULSGRO0_USL1_UIOFGRO0_USFGROn1_VSn1_VWA4_VWB4_WSGRA2_WSGRB0_WS64_WG32_8_1_WGM38_WGMXCC4_WGMXCCG304
    SolutionIndex: 136
    SolutionNameMin: Cijk_Alik_Bljk_BBS_BH_Bias_HA_S_SAV_UserArgs_MT192x128x32_MI16x16x1_SN_LDSB1_AFC1_AFEM1_AFEM1_ASEM1_CLR1_CADS0_EPS0_FDSI0_GRPM1_GRVWA4_GRVWB4_GSU1_GSUAMB_GSUC0_GLS0_ISA942_IU1_LBSPPA128_LBSPPB256_LBSPPM0_LPA4_LPB4_LPM0_LRVW4_LWPMn1_MIAV0_MIWT6_4_MO40_NTn1_NTA0_NTB0_NTC0_NTD0_NTM0_NEPBS16_NLCA1_NLCB1_ONLL1_PGR2_PLR1_PKA1_SIA3_SS1_SU8_SUM0_SUS64_SPO0_SRVW0_SSO0_SVW2_TLDS1_ULSGRO1_USL1_UIOFGRO0_USFGROn1_VSn1_VWA2_VWB4_WSGRA2_WSGRB2_WS64_WG32_8_1_WGM304_WGMXCC8_WGMXCCG0
    SolutionIndex: 137
    SolutionNameMin: Cijk_Alik_Bljk_BBS_BH_Bias_HA_S_SAV_UserArgs_MT128x256x64_MI16x16x1_SN_LDSB1_AFC1_AFEM1_AFEM1_ASEM1_CLR1_CADS0_EPS0_FDSI0_GRPM1_GRVWA8_GRVWB8_GSU1_GSUAMB_GSUC0_GLS0_ISA942_IU1_LBSPPA512_LBSPPB1024_LBSPPM0_LPA16_LPB16_LPM0_LRVW8_LWPMn1_MIAV0_MIWT4_8_MO40_NTn1_NTA0_NTB0_NTC0_NTD0_NTM0_NEPBS16_NLCA1_NLCB1_ONLL1_PGR2_PLR1_PKA1_SIA3_SS1_SU0_SUM0_SUS0_SPO0_SRVW0_SSO0_SVW4_TLDS1_ULSGRO0_USL1_UIOFGRO0_USFGROn1_VSn1_VWA4_VWB8_WSGRA0_WSGRB2_WS64_WG32_8_1_WGM1_WGMXCC8_WGMXCCG32
    SolutionIndex: 138
    SolutionNameMin: Cijk_Alik_Bljk_BBS_BH_Bias_HA_S_SAV_UserArgs_MT192x256x64_MI16x16x1_SN_LDSB1_AFC1_AFEM1_AFEM1_ASEM1_CLR1_CADS0_EPS0_FDSI0_GRPM1_GRVWA8_GRVWB8_GSU1_GSUAMB_GSUC0_GLS0_ISA942_IU1_LBSPPA512_LBSPPB512_LBSPPM0_LPA16_LPB16_LPM0_LRVW8_LWPMn1_MIAV0_MIWT12_4_MO40_NTn1_NTA0_NTB0_NTC0_NTD0_NTM0_NEPBS16_NLCA1_NLCB1_ONLL1_PGR2_PLR1_PKA1_SIA3_SS1_SU8_SUM0_SUS128_SPO0_SRVW0_SSO0_SVW4_TLDS1_ULSGRO1_USL1_UIOFGRO0_USFGROn1_VSn1_VWA4_VWB4_WSGRA0_WSGRB0_WS64_WG16_16_1_WGM32_WGMXCC32_WGMXCCG0
    SolutionIndex: 139
    SolutionNameMin: Cijk_Alik_Bljk_BBS_BH_Bias_HA_S_SAV_UserArgs_MT256x96x64_MI16x16x1_SN_LDSB1_AFC1_AFEM1_AFEM1_ASEM1_CLR1_CADS0_EPS0_FDSI0_GRPM1_GRVWA8_GRVWB8_GSU6_GSUAMB_GSUC0_GLS0_ISA942_IU1_LBSPPA512_LBSPPB256_LBSPPM0_LPA16_LPB16_LPM0_LRVW8_LWPMn1_MIAV0_MIWT4_6_MO40_NTn1_NTA0_NTB0_NTC0_NTD0_NTM0_NEPBS16_NLCA1_NLCB1_ONLL1_PGR2_PLR1_PKA1_SIA3_SS1_SU0_SUM0_SUS0_SPO0_SRVW0_SSO0_SVW4_TLDS1_ULSGRO0_USL1_UIOFGRO0_USFGROn1_VSn1_VWA4_VWB2_WSGRA0_WSGRB2_WS64_WG64_4_1_WGM0_WGMXCC32_WGMXCCG32
    SolutionIndex: 140
    SolutionNameMin: Cijk_Alik_Bljk_BBS_BH_Bias_HA_S_SAV_UserArgs_MT192x128x64_MI16x16x1_SN_LDSB1_AFC1_AFEM1_AFEM1_ASEM1_CLR1_CADS0_EPS0_FDSI0_GRPM1_GRVWA8_GRVWB8_GSU6_GSUAMB_GSUC0_GLS0_ISA942_IU1_LBSPPA256_LBSPPB512_LBSPPM0_LPA16_LPB16_LPM0_LRVW8_LWPMn1_MIAV0_MIWT6_4_MO40_NTn1_NTA0_NTB0_NTC0_NTD0_NTM0_NEPBS16_NLCA1_NLCB1_ONLL1_PGR2_PLR1_PKA1_SIA3_SS1_SU8_SUM0_SUS128_SPO0_SRVW0_SSO0_SVW2_TLDS1_ULSGRO0_USL1_UIOFGRO0_USFGROn1_VSn1_VWA2_VWB4_WSGRA0_WSGRB0_WS64_WG32_8_1_WGM1_WGMXCC32_WGMXCCG0
    SolutionIndex: 141
    SolutionNameMin: Cijk_Alik_Bljk_BBS_BH_Bias_HA_S_SAV_UserArgs_MT256x96x64_MI16x16x1_SN_LDSB1_AFC1_AFEM1_AFEM1_ASEM1_CLR1_CADS0_EPS0_FDSI0_GRPM1_GRVWA8_GRVWB8_GSU6_GSUAMB_GSUC0_GLS0_ISA942_IU1_LBSPPA512_LBSPPB256_LBSPPM0_LPA16_LPB16_LPM0_LRVW8_LWPMn1_MIAV0_MIWT4_6_MO40_NTn1_NTA0_NTB0_NTC0_NTD0_NTM0_NEPBS16_NLCA1_NLCB1_ONLL1_PGR2_PLR1_PKA1_SIA3_SS1_SU0_SUM0_SUS0_SPO0_SRVW0_SSO0_SVW4_TLDS1_ULSGRO1_USL1_UIOFGRO0_USFGROn1_VSn1_VWA4_VWB2_WSGRA0_WSGRB0_WS64_WG64_4_1_WGM0_WGMXCC1_WGMXCCG4
    SolutionIndex: 142
    SolutionNameMin: Cijk_Alik_Bljk_BBS_BH_Bias_HA_S_SAV_UserArgs_MT192x128x64_MI16x16x1_SN_LDSB1_AFC1_AFEM1_AFEM1_ASEM1_CLR1_CADS0_EPS0_FDSI0_GRPM1_GRVWA8_GRVWB8_GSU6_GSUAMB_GSUC0_GLS0_ISA942_IU1_LBSPPA256_LBSPPB512_LBSPPM0_LPA16_LPB16_LPM0_LRVW8_LWPMn1_MIAV0_MIWT6_4_MO40_NTn1_NTA0_NTB0_NTC0_NTD0_NTM0_NEPBS16_NLCA1_NLCB1_ONLL1_PGR2_PLR1_PKA1_SIA3_SS1_SU0_SUM0_SUS0_SPO0_SRVW0_SSO0_SVW2_TLDS1_ULSGRO0_USL1_UIOFGRO0_USFGROn1_VSn1_VWA2_VWB4_WSGRA0_WSGRB2_WS64_WG32_8_1_WGM4_WGMXCC32_WGMXCCG0
    SolutionIndex: 143
    SolutionNameMin: Cijk_Alik_Bljk_BBS_BH_Bias_HA_S_SAV_UserArgs_MT192x128x64_MI16x16x1_SN_LDSB1_AFC1_AFEM1_AFEM1_ASEM1_CLR1_CADS0_EPS0_FDSI0_GRPM1_GRVWA8_GRVWB8_GSU6_GSUAMB_GSUC0_GLS0_ISA942_IU1_LBSPPA256_LBSPPB512_LBSPPM0_LPA16_LPB16_LPM0_LRVW8_LWPMn1_MIAV0_MIWT6_4_MO40_NTn1_NTA0_NTB0_NTC0_NTD0_NTM0_NEPBS16_NLCA1_NLCB1_ONLL1_PGR2_PLR1_PKA1_SIA3_SS1_SU0_SUM0_SUS0_SPO0_SRVW0_SSO0_SVW2_TLDS1_ULSGRO0_USL1_UIOFGRO0_USFGROn1_VSn1_VWA2_VWB4_WSGRA0_WSGRB2_WS64_WG32_8_1_WGM1_WGMXCC32_WGMXCCG0
    SolutionIndex: 144
    SolutionNameMin: Cijk_Alik_Bljk_BBS_BH_Bias_HA_S_SAV_UserArgs_MT256x96x64_MI16x16x1_SN_LDSB1_AFC1_AFEM1_AFEM1_ASEM1_CLR1_CADS0_EPS0_FDSI0_GRPM1_GRVWA8_GRVWB8_GSU6_GSUAMB_GSUC0_GLS0_ISA942_IU1_LBSPPA512_LBSPPB256_LBSPPM0_LPA16_LPB16_LPM0_LRVW8_LWPMn1_MIAV0_MIWT4_6_MO40_NTn1_NTA0_NTB0_NTC0_NTD0_NTM0_NEPBS16_NLCA1_NLCB1_ONLL1_PGR2_PLR1_PKA1_SIA3_SS1_SU8_SUM0_SUS128_SPO0_SRVW0_SSO0_SVW4_TLDS1_ULSGRO0_USL1_UIOFGRO0_USFGROn1_VSn1_VWA4_VWB2_WSGRA0_WSGRB0_WS64_WG64_4_1_WGM0_WGMXCC1_WGMXCCG0
    SolutionIndex: 145
    SolutionNameMin: Cijk_Alik_Bljk_BBS_BH_Bias_HA_S_SAV_UserArgs_MT64x64x128_MI16x16x1_SN_LDSB1_AFC1_AFEM1_AFEM1_ASEM1_CLR1_CADS0_EPS0_FDSI0_GRPM1_GRVWA8_GRVWB8_GSU1_GSUAMBSK_GSUC1_GSUWGMRR1_GLS0_ISA942_IU1_K1_LCS0_LBSPPA512_LBSPPB512_LBSPPM0_LPA16_LPB16_LPM0_LRVW8_LWPMn1_MIAV0_MIWT2_2_MO40_NTn1_NTA0_NTB0_NTC0_NTD0_NTM0_NEPBS16_NLCA1_NLCB1_ONLL1_PGR2_PLR1_PKA1_SIA3_SS1_SU0_SUM0_SUS0_SPO0_SRVW0_SSO0_SVW2_SK0_SKXCCM0_TLDS1_ULSGRO0_USL1_UIOFGRO0_USFGROn1_VSn1_VWA2_VWB2_WSGRA0_WSGRB0_WS64_WG32_8_1_WGM1_WGMXCC1_WGMXCCG304
    SolutionIndex: 146
    SolutionNameMin: Cijk_Alik_Bljk_BBS_BH_Bias_HA_S_SAV_UserArgs_MT64x64x128_MI16x16x1_SN_LDSB1_AFC1_AFEM1_AFEM1_ASEM1_CLR1_CADS0_EPS0_FDSI0_GRPM1_GRVWA8_GRVWB8_GSU1_GSUAMBSK_GSUC1_GSUWGMRR1_GLS0_ISA942_IU1_K1_LCS0_LBSPPA512_LBSPPB512_LBSPPM0_LPA16_LPB16_LPM0_LRVW8_LWPMn1_MIAV0_MIWT2_2_MO40_NTn1_NTA0_NTB0_NTC0_NTD4_NTM0_NEPBS16_NLCA1_NLCB1_ONLL1_PGR2_PLR1_PKA1_SIA3_SS1_SU16_SUM0_SUS256_SPO0_SRVW0_SSO0_SVW2_SK0_SKXCCM0_TLDS1_ULSGRO1_USL1_UIOFGRO0_USFGROn1_VSn1_VWA2_VWB2_WSGRA0_WSGRB0_WS64_WG32_8_1_WGM1_WGMXCC1_WGMXCCG304
    SolutionIndex: 147
    SolutionNameMin: Cijk_Alik_Bljk_BBS_BH_Bias_HA_S_SAV_UserArgs_MT64x64x64_MI16x16x1_SN_LDSB1_AFC1_AFEM1_AFEM1_ASEM1_CLR1_CADS0_EPS0_FDSI0_GRPM1_GRVWA8_GRVWB8_GSU1_GSUAMBSK_GSUC1_GSUWGMRR1_GLS0_ISA942_IU1_K1_LCS0_LBSPPA256_LBSPPB256_LBSPPM0_LPA16_LPB16_LPM0_LRVW8_LWPMn1_MIAV0_MIWT2_2_MO40_NTn1_NTA0_NTB0_NTC0_NTD0_NTM0_NEPBS16_NLCA1_NLCB1_ONLL1_PGR2_PLR1_PKA1_SIA3_SS1_SU16_SUM0_SUS128_SPO0_SRVW0_SSO0_SVW2_SK0_SKXCCM0_TLDS1_ULSGRO1_USL1_UIOFGRO0_USFGROn1_VSn1_VWA2_VWB2_WSGRA0_WSGRB0_WS64_WG32_8_1_WGM1_WGMXCC1_WGMXCCG304
    SolutionIndex: 148
    SolutionNameMin: Cijk_Alik_Bljk_BBS_BH_Bias_HA_S_SAV_UserArgs_MT64x64x128_MI16x16x1_SN_LDSB1_AFC1_AFEM1_AFEM1_ASEM1_CLR1_CADS0_EPS0_FDSI0_GRPM1_GRVWA8_GRVWB8_GSU1_GSUAMBSK_GSUC1_GSUWGMRR1_GLS0_ISA942_IU1_K1_LCS0_LBSPPA512_LBSPPB512_LBSPPM0_LPA16_LPB16_LPM0_LRVW8_LWPMn1_MIAV0_MIWT2_2_MO40_NTn1_NTA0_NTB0_NTC0_NTD4_NTM0_NEPBS16_NLCA1_NLCB1_ONLL1_PGR2_PLR1_PKA1_SIA3_SS1_SU16_SUM0_SUS256_SPO0_SRVW0_SSO0_SVW2_SK0_SKXCCM0_TLDS1_ULSGRO0_USL1_UIOFGRO0_USFGROn1_VSn1_VWA2_VWB2_WSGRA0_WSGRB0_WS64_WG32_8_1_WGM1_WGMXCC1_WGMXCCG304
    SolutionIndex: 149
    SolutionNameMin: Cijk_Alik_Bljk_BBS_BH_Bias_HA_S_SAV_UserArgs_MT64x32x256_MI16x16x1_SN_LDSB1_AFC1_AFEM1_AFEM1_ASEM1_CLR1_CADS0_EPS0_FDSI0_GRPM1_GRVWA8_GRVWB8_GSU2_GSUAMBSK_GSUC1_GSUWGMRR1_GLS0_ISA942_IU1_K1_LCS0_LBSPPA1024_LBSPPB512_LBSPPM0_LPA16_LPB16_LPM0_LRVW8_LWPMn1_MIAV0_MIWT2_1_MO40_NTn1_NTA0_NTB0_NTC0_NTD0_NTM0_NEPBS16_NLCA1_NLCB1_ONLL1_PGR2_PLR1_PKA1_SIA3_SS1_SU16_SUM1_SUS512_SPO0_SRVW0_SSO0_SVW2_SK0_SKXCCM0_TLDS1_ULSGRO0_USL1_UIOFGRO0_USFGROn1_VSn1_VWA2_VWB1_WSGRA0_WSGRB0_WS64_WG32_8_1_WGM1_WGMXCC1_WGMXCCG304
    SolutionIndex: 150
    SolutionNameMin: Cijk_Alik_Bljk_BBS_BH_Bias_HA_S_SAV_UserArgs_MT64x128x64_MI16x16x1_SN_LDSB1_AFC1_AFEM1_AFEM1_ASEM1_CLR1_CADS0_EPS0_FDSI0_GRPM1_GRVWA8_GRVWB8_GSU1_GSUAMBSK_GSUC1_GSUWGMRR1_GLS0_ISA942_IU1_K1_LCS0_LBSPPA512_LBSPPB256_LBSPPM0_LPA16_LPB16_LPM0_LRVW8_LWPMn1_MIAV0_MIWT4_2_MO40_NTn1_NTA0_NTB0_NTC0_NTD4_NTM0_NEPBS16_NLCA1_NLCB1_ONLL1_PGR2_PLR1_PKA1_SIA3_SS1_SU16_SUM1_SUS128_SPO0_SRVW0_SSO0_SVW4_SK0_SKXCCM0_TLDS1_ULSGRO1_USL1_UIOFGRO0_USFGROn1_VSn1_VWA4_VWB2_WSGRA0_WSGRB0_WS64_WG16_16_1_WGM4_WGMXCC8_WGMXCCG304
    SolutionIndex: 151
    SolutionNameMin: Cijk_Alik_Bljk_BBS_BH_Bias_HA_S_SAV_UserArgs_MT64x128x128_MI16x16x1_SN_LDSB1_AFC1_AFEM1_AFEM1_ASEM1_CLR1_CADS0_EPS0_FDSI0_GRPM1_GRVWA8_GRVWB8_GSU1_GSUAMBSK_GSUC1_GSUWGMRR1_GLS0_ISA942_IU1_K1_LCS0_LBSPPA1024_LBSPPB512_LBSPPM0_LPA16_LPB16_LPM0_LRVW8_LWPMn1_MIAV0_MIWT4_2_MO40_NTn1_NTA0_NTB0_NTC0_NTD4_NTM0_NEPBS16_NLCA1_NLCB1_ONLL1_PGR2_PLR1_PKA1_SIA3_SS1_SU16_SUM1_SUS256_SPO0_SRVW0_SSO0_SVW4_SK0_SKXCCM0_TLDS1_ULSGRO1_USL1_UIOFGRO0_USFGROn1_VSn1_VWA4_VWB2_WSGRA0_WSGRB0_WS64_WG16_16_1_WGM8_WGMXCC1_WGMXCCG304
    SolutionIndex: 152
    SolutionNameMin: Cijk_Alik_Bljk_BBS_BH_Bias_HA_S_SAV_UserArgs_MT128x64x128_MI16x16x1_SN_LDSB1_AFC1_AFEM1_AFEM1_ASEM1_CLR1_CADS0_EPS0_FDSI0_GRPM1_GRVWA8_GRVWB8_GSU1_GSUAMBSK_GSUC1_GSUWGMRR1_GLS0_ISA942_IU1_K1_LCS0_LBSPPA1024_LBSPPB512_LBSPPM0_LPA16_LPB16_LPM0_LRVW8_LWPMn1_MIAV0_MIWT4_2_MO40_NTn1_NTA0_NTB0_NTC0_NTD0_NTM0_NEPBS16_NLCA1_NLCB1_ONLL1_PGR2_PLR1_PKA1_SIA3_SS1_SU16_SUM0_SUS256_SPO0_SRVW0_SSO0_SVW4_SK0_SKXCCM0_TLDS1_ULSGRO1_USL1_UIOFGRO0_USFGROn1_VSn1_VWA4_VWB2_WSGRA0_WSGRB0_WS64_WG32_8_1_WGM4_WGMXCC1_WGMXCCG304
    SolutionIndex: 153
    SolutionNameMin: Cijk_Alik_Bljk_BBS_BH_Bias_HA_S_SAV_UserArgs_MT128x64x128_MI16x16x1_SN_LDSB1_AFC1_AFEM1_AFEM1_ASEM1_CLR1_CADS0_EPS0_FDSI0_GRPM1_GRVWA8_GRVWB8_GSU2_GSUAMBSK_GSUC1_GSUWGMRR1_GLS0_ISA942_IU1_K1_LCS0_LBSPPA1024_LBSPPB512_LBSPPM0_LPA16_LPB16_LPM0_LRVW8_LWPMn1_MIAV0_MIWT4_2_MO40_NTn1_NTA0_NTB0_NTC0_NTD0_NTM0_NEPBS16_NLCA1_NLCB1_ONLL1_PGR2_PLR1_PKA1_SIA3_SS1_SU16_SUM1_SUS256_SPO0_SRVW0_SSO0_SVW4_SK0_SKXCCM0_TLDS1_ULSGRO1_USL1_UIOFGRO0_USFGROn1_VSn1_VWA4_VWB2_WSGRA0_WSGRB0_WS64_WG32_8_1_WGM8_WGMXCC8_WGMXCCG304
    SolutionIndex: 154
    SolutionNameMin: Cijk_Alik_Bljk_BBS_BH_Bias_HA_S_SAV_UserArgs_MT128x64x128_MI16x16x1_SN_LDSB1_AFC1_AFEM1_AFEM1_ASEM1_CLR1_CADS0_EPS0_FDSI0_GRPM1_GRVWA8_GRVWB8_GSU1_GSUAMBSK_GSUC1_GSUWGMRR1_GLS0_ISA942_IU1_K1_LCS0_LBSPPA1024_LBSPPB512_LBSPPM0_LPA16_LPB16_LPM0_LRVW8_LWPMn1_MIAV0_MIWT4_2_MO40_NTn1_NTA0_NTB0_NTC0_NTD0_NTM0_NEPBS16_NLCA1_NLCB1_ONLL1_PGR2_PLR1_PKA1_SIA3_SS1_SU16_SUM0_SUS256_SPO0_SRVW0_SSO0_SVW4_SK0_SKXCCM0_TLDS1_ULSGRO0_USL1_UIOFGRO0_USFGROn1_VSn1_VWA4_VWB2_WSGRA0_WSGRB0_WS64_WG32_8_1_WGM4_WGMXCC1_WGMXCCG304
    SolutionIndex: 155
    SolutionNameMin: Cijk_Alik_Bljk_BBS_BH_Bias_HA_S_SAV_UserArgs_MT64x32x64_MI16x16x1_SN_LDSB0_AFC1_AFEM1_AFEM1_ASEM1_CLR1_CADS0_EPS0_FDSI0_GRPM1_GRVWA8_GRVWB8_GSU1_GSUAMBSK_GSUC1_GSUWGMRR1_GLS0_ISA942_IU1_K1_LCS0_LBSPPA256_LBSPPB128_LBSPPM0_LPA16_LPB16_LPM0_LRVW8_LWPMn1_MIAV0_MIWT2_1_MO40_NTn1_NTA0_NTB0_NTC0_NTD4_NTM0_NEPBS16_NLCA1_NLCB1_ONLL1_PGR2_PLR1_PKA1_SIA3_SS1_SU16_SUM0_SUS128_SPO0_SRVW0_SSO0_SVW2_SK0_SKXCCM0_TLDS1_ULSGRO1_USL1_UIOFGRO0_USFGROn1_VSn1_VWA2_VWB1_WSGRA0_WSGRB0_WS64_WG32_8_1_WGM1_WGMXCC1_WGMXCCG304
    SolutionIndex: 156
    SolutionNameMin: Cijk_Alik_Bljk_BBS_BH_Bias_HA_S_SAV_UserArgs_MT128x96x128_MI16x16x1_SN_LDSB1_AFC1_AFEM1_AFEM1_ASEM1_CLR1_CADS0_EPS0_FDSI0_GRPM1_GRVWA8_GRVWB8_GSU1_GSUAMBSK_GSUC1_GSUWGMRR1_GLS0_ISA942_IU1_K1_LCS0_LBSPPA512_LBSPPB512_LBSPPM0_LPA16_LPB16_LPM0_LRVW8_LWPMn1_MIAV0_MIWT2_6_MO40_NTn1_NTA0_NTB0_NTC0_NTD4_NTM0_NEPBS16_NLCA1_NLCB1_ONLL1_PGR2_PLR1_PKA1_SIA3_SS1_SU16_SUM1_SUS256_SPO0_SRVW0_SSO0_SVW2_SK0_SKXCCM0_TLDS1_ULSGRO1_USL1_UIOFGRO0_USFGROn1_VSn1_VWA2_VWB2_WSGRA0_WSGRB0_WS64_WG64_4_1_WGM1_WGMXCC1_WGMXCCG304
    SolutionIndex: 157
    SolutionNameMin: Cijk_Alik_Bljk_BBS_BH_Bias_HA_S_SAV_UserArgs_MT64x32x128_MI16x16x1_SN_LDSB1_AFC1_AFEM1_AFEM1_ASEM1_CLR1_CADS0_EPS0_FDSI0_GRPM1_GRVWA8_GRVWB8_GSU4_GSUAMBSK_GSUC1_GSUWGMRR1_GLS0_ISA942_IU1_K1_LCS0_LBSPPA512_LBSPPB256_LBSPPM0_LPA16_LPB16_LPM0_LRVW8_LWPMn1_MIAV0_MIWT2_1_MO40_NTn1_NTA0_NTB0_NTC0_NTD0_NTM0_NEPBS16_NLCA1_NLCB1_ONLL1_PGR2_PLR1_PKA1_SIA3_SS1_SU16_SUM1_SUS256_SPO0_SRVW0_SSO0_SVW2_SK0_SKXCCM0_TLDS1_ULSGRO1_USL1_UIOFGRO0_USFGROn1_VSn1_VWA2_VWB1_WSGRA0_WSGRB0_WS64_WG32_8_1_WGM8_WGMXCC8_WGMXCCG304
    SolutionIndex: 158
    SolutionNameMin: Cijk_Alik_Bljk_BBS_BH_Bias_HA_S_SAV_UserArgs_MT64x16x256_MI16x16x1_SN_LDSB1_AFC1_AFEM1_AFEM1_ASEM1_CLR1_CADS0_EPS0_FDSI0_GRPM1_GRVWA8_GRVWB8_GSU1_GSUAMBSK_GSUC1_GSUWGMRR1_GLS0_ISA942_IU1_K1_LCS0_LBSPPA512_LBSPPB512_LBSPPM0_LPA16_LPB16_LPM0_LRVW8_LWPMn1_MIAV0_MIWT1_1_MO40_NTn1_NTA0_NTB0_NTC0_NTD4_NTM0_NEPBS16_NLCA1_NLCB1_ONLL1_PGR2_PLR1_PKA1_SIA3_SS1_SU0_SUM0_SUS0_SPO0_SRVW0_SSO0_SVW1_SK0_SKXCCM0_TLDS1_ULSGRO0_USL1_UIOFGRO0_USFGROn1_VSn1_VWA1_VWB1_WSGRA0_WSGRB0_WS64_WG64_4_1_WGM1_WGMXCC1_WGMXCCG304
    SolutionIndex: 159
    SolutionNameMin: Cijk_Alik_Bljk_BBS_BH_Bias_HA_S_SAV_UserArgs_MT32x16x256_MI16x16x1_SN_LDSB1_AFC1_AFEM1_AFEM1_ASEM1_CLR1_CADS0_EPS0_FDSI0_GRPM1_GRVWA8_GRVWB8_GSU1_GSUAMBSK_GSUC1_GSUWGMRR1_GLS0_ISA942_IU1_K1_LCS0_LBSPPA512_LBSPPB512_LBSPPM0_LPA16_LPB16_LPM0_LRVW8_LWPMn1_MIAV0_MIWT1_1_MO40_NTn1_NTA0_NTB0_NTC0_NTD0_NTM0_NEPBS16_NLCA1_NLCB1_ONLL1_PGR2_PLR1_PKA1_SIA3_SS1_SU0_SUM0_SUS0_SPO0_SRVW0_SSO0_SVW1_SK0_SKXCCM0_TLDS1_ULSGRO0_USL1_UIOFGRO0_USFGROn1_VSn1_VWA1_VWB1_WSGRA0_WSGRB0_WS64_WG32_4_1_WGM1_WGMXCC1_WGMXCCG304
    SolutionIndex: 160
    SolutionNameMin: Cijk_Alik_Bljk_BBS_BH_Bias_HA_S_SAV_UserArgs_MT128x64x128_MI16x16x1_SN_LDSB1_AFC1_AFEM1_AFEM1_ASEM1_CLR1_CADS0_EPS0_FDSI0_GRPM1_GRVWA8_GRVWB8_GSU3_GSUAMBSK_GSUC1_GSUWGMRR1_GLS0_ISA942_IU1_K1_LCS0_LBSPPA1024_LBSPPB512_LBSPPM0_LPA16_LPB16_LPM0_LRVW8_LWPMn1_MIAV0_MIWT4_2_MO40_NTn1_NTA0_NTB0_NTC0_NTD0_NTM0_NEPBS16_NLCA1_NLCB1_ONLL1_PGR2_PLR1_PKA1_SIA3_SS1_SU0_SUM0_SUS0_SPO0_SRVW0_SSO0_SVW4_SK0_SKXCCM0_TLDS1_ULSGRO1_USL1_UIOFGRO0_USFGROn1_VSn1_VWA4_VWB2_WSGRA0_WSGRB0_WS64_WG32_8_1_WGM1_WGMXCC1_WGMXCCG304
    SolutionIndex: 161
    SolutionNameMin: Cijk_Alik_Bljk_BBS_BH_Bias_HA_S_SAV_UserArgs_MT256x256x32_MI16x16x1_SN_LDSB1_AFC1_AFEM1_AFEM1_ASEM1_CLR1_CADS0_EPS0_FDSI0_GRPM1_GRVWA4_GRVWB4_GSU1_GSUAMB_GSUC1_GSUWGMRR1_GLS0_ISA942_IU1_K1_LCS0_LBSPPA512_LBSPPB512_LBSPPM0_LPA4_LPB4_LPM0_LRVW4_LWPMn1_MIAV0_MIWT8_8_MO40_NTn1_NTA0_NTB0_NTC0_NTD4_NTM0_NEPBS16_NLCA1_NLCB1_ONLL1_PGR2_PLR1_PKA1_SIA3_SS1_SU16_SUM0_SUS64_SPO0_SRVW0_SSO0_SVW8_SK0_SKXCCM0_TLDS1_ULSGRO0_USL1_UIOFGRO0_USFGROn1_VSn1_VWA8_VWB8_WSGRA0_WSGRB0_WS64_WG32_8_1_WGM1_WGMXCC1_WGMXCCG304
    SolutionIndex: 162
    SolutionNameMin: Cijk_Alik_Bljk_BBS_BH_Bias_HA_S_SAV_UserArgs_MT256x256x32_MI16x16x1_SN_LDSB1_AFC1_AFEM1_AFEM1_ASEM1_CLR1_CADS0_EPS0_FDSI0_GRPM1_GRVWA4_GRVWB4_GSU1_GSUAMB_GSUC1_GSUWGMRR1_GLS0_ISA942_IU1_K1_LCS0_LBSPPA512_LBSPPB512_LBSPPM0_LPA4_LPB4_LPM0_LRVW4_LWPMn1_MIAV0_MIWT8_8_MO40_NTn1_NTA0_NTB0_NTC0_NTD4_NTM0_NEPBS16_NLCA1_NLCB1_ONLL1_PGR2_PLR1_PKA1_SIA3_SS1_SU16_SUM0_SUS64_SPO0_SRVW0_SSO0_SVW8_SK0_SKXCCM0_TLDS1_ULSGRO0_USL1_UIOFGRO0_USFGROn1_VSn1_VWA8_VWB8_WSGRA0_WSGRB0_WS64_WG32_8_1_WGM4_WGMXCC1_WGMXCCG304
    SolutionIndex: 163
    SolutionNameMin: Cijk_Alik_Bljk_BBS_BH_Bias_HA_S_SAV_UserArgs_MT256x128x64_MI16x16x1_SN_LDSB1_AFC1_AFEM1_AFEM1_ASEM1_CLR1_CADS0_EPS0_FDSI0_GRPM1_GRVWA8_GRVWB8_GSU1_GSUAMB_GSUC1_GSUWGMRR1_GLS0_ISA942_IU1_K1_LCS0_LBSPPA1024_LBSPPB512_LBSPPM0_LPA16_LPB16_LPM0_LRVW8_LWPMn1_MIAV0_MIWT8_4_MO40_NTn1_NTA0_NTB0_NTC0_NTD4_NTM0_NEPBS16_NLCA1_NLCB1_ONLL1_PGR2_PLR1_PKA1_SIA3_SS1_SU16_SUM0_SUS128_SPO0_SRVW0_SSO0_SVW8_SK0_SKXCCM0_TLDS1_ULSGRO0_USL1_UIOFGRO0_USFGROn1_VSn1_VWA8_VWB4_WSGRA0_WSGRB0_WS64_WG32_8_1_WGM8_WGMXCC1_WGMXCCG304
    SolutionIndex: 164
    SolutionNameMin: Cijk_Alik_Bljk_BBS_BH_Bias_HA_S_SAV_UserArgs_MT256x256x32_MI16x16x1_SN_LDSB1_AFC1_AFEM1_AFEM1_ASEM1_CLR1_CADS0_EPS0_FDSI0_GRPM1_GRVWA4_GRVWB4_GSU1_GSUAMB_GSUC1_GSUWGMRR1_GLS0_ISA942_IU1_K1_LCS0_LBSPPA512_LBSPPB512_LBSPPM0_LPA4_LPB4_LPM0_LRVW4_LWPMn1_MIAV0_MIWT8_8_MO40_NTn1_NTA0_NTB0_NTC0_NTD4_NTM0_NEPBS16_NLCA1_NLCB1_ONLL1_PGR2_PLR1_PKA1_SIA3_SS1_SU16_SUM0_SUS64_SPO0_SRVW0_SSO0_SVW8_SK0_SKXCCM0_TLDS1_ULSGRO1_USL1_UIOFGRO0_USFGROn1_VSn1_VWA8_VWB8_WSGRA0_WSGRB0_WS64_WG32_8_1_WGM1_WGMXCC1_WGMXCCG304
    SolutionIndex: 165
    SolutionNameMin: Cijk_Alik_Bljk_BBS_BH_Bias_HA_S_SAV_UserArgs_MT64x32x64_MI16x16x1_SN_LDSB0_AFC1_AFEM1_AFEM1_ASEM1_CLR1_CADS0_EPS0_FDSI0_GRPM1_GRVWA8_GRVWB8_GSU3_GSUAMBSK_GSUC0_GSUWGMRR0_GLS0_ISA942_IU1_K1_LCS0_LBSPPA256_LBSPPB128_LBSPPM0_LPA16_LPB16_LPM0_LRVW8_LWPMn1_MIAV0_MIWT2_1_MO40_NTn1_NTA0_NTB0_NTC0_NTD0_NTM0_NEPBS16_NLCA1_NLCB1_ONLL1_PGR2_PLR1_PKA1_SIA3_SS1_SU16_SUM0_SUS128_SPO0_SRVW0_SSO0_SVW2_TLDS1_ULSGRO1_USL1_UIOFGRO0_USFGROn1_VSn1_VWA2_VWB1_WSGRA0_WSGRB0_WS64_WG32_8_1_WGM1_WGMXCC1_WGMXCCG304
    SolutionIndex: 166
    SolutionNameMin: Cijk_Alik_Bljk_BBS_BH_Bias_HA_S_SAV_UserArgs_MT64x64x128_MI16x16x1_SN_LDSB1_AFC1_AFEM1_AFEM1_ASEM1_CLR1_CADS0_EPS0_FDSI0_GRPM1_GRVWA8_GRVWB8_GSU1_GSUAMBSK_GSUC0_GSUWGMRR0_GLS0_ISA942_IU1_K1_LCS0_LBSPPA512_LBSPPB512_LBSPPM0_LPA16_LPB16_LPM0_LRVW8_LWPMn1_MIAV0_MIWT2_2_MO40_NTn1_NTA0_NTB0_NTC0_NTD0_NTM0_NEPBS16_NLCA1_NLCB1_ONLL1_PGR2_PLR1_PKA1_SIA3_SS1_SU16_SUM1_SUS256_SPO0_SRVW0_SSO0_SVW2_TLDS1_ULSGRO1_USL1_UIOFGRO0_USFGROn1_VSn1_VWA2_VWB2_WSGRA0_WSGRB0_WS64_WG32_8_1_WGM1_WGMXCC1_WGMXCCG304
    SolutionIndex: 167
    SolutionNameMin: Cijk_Alik_Bljk_BBS_BH_Bias_HA_S_SAV_UserArgs_MT32x16x64_MI16x16x1_SN_LDSB0_AFC1_AFEM1_AFEM1_ASEM1_CLR1_CADS0_EPS0_FDSI0_GRPM1_GRVWA8_GRVWB8_GSU3_GSUAMBSK_GSUC0_GSUWGMRR0_GLS0_ISA942_IU1_K1_LCS0_LBSPPA128_LBSPPB128_LBSPPM0_LPA16_LPB16_LPM0_LRVW8_LWPMn1_MIAV0_MIWT1_1_MO40_NTn1_NTA0_NTB0_NTC0_NTD0_NTM0_NEPBS16_NLCA1_NLCB1_ONLL1_PGR2_PLR1_PKA1_SIA3_SS1_SU16_SUM0_SUS128_SPO0_SRVW0_SSO0_SVW1_TLDS1_ULSGRO1_USL1_UIOFGRO0_USFGROn1_VSn1_VWA1_VWB1_WSGRA0_WSGRB0_WS64_WG32_4_1_WGM1_WGMXCC1_WGMXCCG304
    SolutionIndex: 168
    SolutionNameMin: Cijk_Alik_Bljk_BBS_BH_Bias_HA_S_SAV_UserArgs_MT64x32x64_MI16x16x1_SN_LDSB0_AFC1_AFEM1_AFEM1_ASEM1_CLR1_CADS0_EPS0_FDSI0_GRPM1_GRVWA8_GRVWB8_GSU3_GSUAMBSK_GSUC0_GSUWGMRR0_GLS0_ISA942_IU1_K1_LCS0_LBSPPA256_LBSPPB128_LBSPPM0_LPA16_LPB16_LPM0_LRVW8_LWPMn1_MIAV0_MIWT2_1_MO40_NTn1_NTA0_NTB0_NTC0_NTD0_NTM0_NEPBS16_NLCA1_NLCB1_ONLL1_PGR2_PLR1_PKA1_SIA3_SS1_SU16_SUM1_SUS128_SPO0_SRVW0_SSO0_SVW2_TLDS1_ULSGRO1_USL1_UIOFGRO0_USFGROn1_VSn1_VWA2_VWB1_WSGRA0_WSGRB0_WS64_WG32_8_1_WGM1_WGMXCC1_WGMXCCG304
    SolutionIndex: 169
    SolutionNameMin: Cijk_Alik_Bljk_BBS_BH_Bias_HA_S_SAV_UserArgs_MT32x16x64_MI16x16x1_SN_LDSB0_AFC1_AFEM1_AFEM1_ASEM1_CLR1_CADS0_EPS0_FDSI0_GRPM1_GRVWA8_GRVWB8_GSU4_GSUAMBSK_GSUC0_GSUWGMRR0_GLS0_ISA942_IU1_K1_LCS0_LBSPPA128_LBSPPB128_LBSPPM0_LPA16_LPB16_LPM0_LRVW8_LWPMn1_MIAV0_MIWT1_1_MO40_NTn1_NTA0_NTB0_NTC0_NTD0_NTM0_NEPBS16_NLCA1_NLCB1_ONLL1_PGR2_PLR1_PKA1_SIA3_SS1_SU16_SUM0_SUS128_SPO0_SRVW0_SSO0_SVW1_TLDS1_ULSGRO1_USL1_UIOFGRO0_USFGROn1_VSn1_VWA1_VWB1_WSGRA0_WSGRB0_WS64_WG32_4_1_WGM1_WGMXCC1_WGMXCCG304
    SolutionIndex: 170
    SolutionNameMin: Cijk_Alik_Bljk_BBS_BH_Bias_HA_S_SAV_UserArgs_MT32x16x128_MI16x16x1_SN_LDSB0_AFC1_AFEM1_AFEM1_ASEM1_CLR1_CADS0_EPS0_FDSI0_GRPM1_GRVWA8_GRVWB8_GSU1_GSUAMB_GSUC0_GSUWGMRR0_GLS0_ISA942_IU1_K1_LCS0_LBSPPA256_LBSPPB256_LBSPPM0_LPA16_LPB16_LPM0_LRVW8_LWPMn1_MIAV0_MIWT1_1_MO40_NTn1_NTA0_NTB0_NTC0_NTD0_NTM0_NEPBS16_NLCA1_NLCB1_ONLL1_PGR2_PLR1_PKA1_SIA3_SS1_SU16_SUM1_SUS256_SPO0_SRVW0_SSO0_SVW1_TLDS1_ULSGRO1_USL1_UIOFGRO0_USFGROn1_VSn1_VWA1_VWB1_WSGRA0_WSGRB0_WS64_WG32_4_1_WGM1_WGMXCC1_WGMXCCG304
    SolutionIndex: 171
    SolutionNameMin: Cijk_Alik_Bljk_BBS_BH_Bias_HA_S_SAV_UserArgs_MT64x32x256_MI16x16x1_SN_LDSB1_AFC1_AFEM16_AFEM1_ASEM1_CLR1_CADS0_EPS0_FDSI0_GRPM1_GRVWA8_GRVWB8_GSU1_GSUAMB_GSUC0_GSUWGMRR0_GLS0_ISA942_IU1_K1_LCS0_LBSPPA1024_LBSPPB512_LBSPPM0_LPA16_LPB16_LPM0_LRVW8_LWPMn1_MIAV0_MIWT2_1_MO40_NTn1_NTA0_NTB0_NTC0_NTD4_NTM0_NEPBS16_NLCA1_NLCB1_ONLL1_PGR2_PLR1_PKA1_SIA3_SS1_SU0_SUM0_SUS0_SPO0_SRVW0_SSO0_SVW2_SK0_SKXCCM0_TLDS1_ULSGRO1_USL1_UIOFGRO0_USFGROn1_VSn1_VWA2_VWB1_WSGRA0_WSGRB0_WS64_WG32_8_1_WGM1_WGMXCC1_WGMXCCG304
    SolutionIndex: 172
    SolutionNameMin: Cijk_Alik_Bljk_BBS_BH_Bias_HA_S_SAV_UserArgs_MT64x32x256_MI16x16x1_SN_LDSB1_AFC1_AFEM16_AFEM1_ASEM1_CLR1_CADS0_EPS0_FDSI0_GRPM1_GRVWA8_GRVWB8_GSU1_GSUAMB_GSUC0_GSUWGMRR0_GLS0_ISA942_IU1_K1_LCS0_LBSPPA1024_LBSPPB512_LBSPPM0_LPA16_LPB16_LPM0_LRVW8_LWPMn1_MIAV0_MIWT2_1_MO40_NTn1_NTA0_NTB0_NTC0_NTD0_NTM0_NEPBS16_NLCA1_NLCB1_ONLL1_PGR2_PLR1_PKA1_SIA3_SS1_SU16_SUM1_SUS512_SPO0_SRVW0_SSO0_SVW2_SK0_SKXCCM0_TLDS1_ULSGRO1_USL1_UIOFGRO0_USFGROn1_VSn1_VWA2_VWB1_WSGRA0_WSGRB0_WS64_WG32_8_1_WGM1_WGMXCC1_WGMXCCG304
    SolutionIndex: 173
    SolutionNameMin: Cijk_Alik_Bljk_BBS_BH_Bias_HA_S_SAV_UserArgs_MT32x32x256_MI16x16x1_SN_LDSB1_AFC1_AFEM16_AFEM1_ASEM1_CLR1_CADS0_EPS0_FDSI0_GRPM1_GRVWA8_GRVWB8_GSU1_GSUAMB_GSUC0_GSUWGMRR0_GLS0_ISA942_IU1_K1_LCS0_LBSPPA1024_LBSPPB1024_LBSPPM0_LPA16_LPB16_LPM0_LRVW8_LWPMn1_MIAV0_MIWT2_2_MO40_NTn1_NTA0_NTB0_NTC0_NTD4_NTM0_NEPBS16_NLCA1_NLCB1_ONLL1_PGR2_PLR1_PKA1_SIA3_SS1_SU16_SUM0_SUS512_SPO0_SRVW0_SSO0_SVW2_SK0_SKXCCM0_TLDS1_ULSGRO0_USL1_UIOFGRO0_USFGROn1_VSn1_VWA2_VWB2_WSGRA0_WSGRB0_WS64_WG16_4_4_WGM1_WGMXCC1_WGMXCCG304
    SolutionIndex: 174
    SolutionNameMin: Cijk_Alik_Bljk_BBS_BH_Bias_HA_S_SAV_UserArgs_MT128x160x64_MI16x16x1_SN_LDSB1_AFC1_AFEM16_AFEM1_ASEM1_CLR1_CADS0_EPS0_FDSI0_GRPM1_GRVWA8_GRVWB8_GSU1_GSUAMB_GSUC0_GSUWGMRR0_GLS0_ISA942_IU1_K1_LCS0_LBSPPA512_LBSPPB128_LBSPPM0_LPA16_LPB16_LPM0_LRVW8_LWPMn1_MIAV0_MIWT4_5_MO40_NTn1_NTA0_NTB0_NTC0_NTD4_NTM0_NEPBS16_NLCA1_NLCB1_ONLL1_PGR2_PLR1_PKA1_SIA3_SS1_SU16_SUM1_SUS128_SPO0_SRVW0_SSO0_SVW4_SK0_SKXCCM0_TLDS1_ULSGRO1_USL1_UIOFGRO0_USFGROn1_VSn1_VWA4_VWB1_WSGRA0_WSGRB0_WS64_WG32_8_1_WGM1_WGMXCC1_WGMXCCG304
    SolutionIndex: 175
    SolutionNameMin: Cijk_Alik_Bljk_BBS_BH_Bias_HA_S_SAV_UserArgs_MT32x16x256_MI16x16x1_SN_LDSB1_AFC1_AFEM16_AFEM1_ASEM1_CLR1_CADS0_EPS0_FDSI0_GRPM1_GRVWA8_GRVWB8_GSU1_GSUAMB_GSUC0_GSUWGMRR0_GLS0_ISA942_IU1_K1_LCS0_LBSPPA512_LBSPPB512_LBSPPM0_LPA16_LPB16_LPM0_LRVW8_LWPMn1_MIAV0_MIWT1_1_MO40_NTn1_NTA0_NTB0_NTC0_NTD4_NTM0_NEPBS16_NLCA1_NLCB1_ONLL1_PGR2_PLR1_PKA1_SIA3_SS1_SU0_SUM0_SUS0_SPO0_SRVW0_SSO0_SVW1_SK0_SKXCCM0_TLDS1_ULSGRO0_USL1_UIOFGRO0_USFGROn1_VSn1_VWA1_VWB1_WSGRA0_WSGRB0_WS64_WG32_4_1_WGM1_WGMXCC1_WGMXCCG304
    SolutionIndex: 176
    SolutionNameMin: Cijk_Alik_Bljk_BBS_BH_Bias_HA_S_SAV_UserArgs_MT128x160x64_MI16x16x1_SN_LDSB1_AFC1_AFEM16_AFEM1_ASEM1_CLR1_CADS0_EPS0_FDSI0_GRPM1_GRVWA8_GRVWB8_GSU1_GSUAMB_GSUC0_GSUWGMRR0_GLS0_ISA942_IU1_K1_LCS0_LBSPPA512_LBSPPB128_LBSPPM0_LPA16_LPB16_LPM0_LRVW8_LWPMn1_MIAV0_MIWT4_5_MO40_NTn1_NTA0_NTB0_NTC0_NTD4_NTM0_NEPBS16_NLCA1_NLCB1_ONLL1_PGR2_PLR1_PKA1_SIA3_SS1_SU16_SUM1_SUS128_SPO0_SRVW0_SSO0_SVW4_SK0_SKXCCM0_TLDS1_ULSGRO1_USL1_UIOFGRO0_USFGROn1_VSn1_VWA4_VWB1_WSGRA0_WSGRB0_WS64_WG32_8_1_WGM1_WGMXCC8_WGMXCCG304
    SolutionIndex: 177
    SolutionNameMin: Cijk_Alik_Bljk_BBS_BH_Bias_HA_S_SAV_UserArgs_MT64x32x128_MI16x16x1_SN_LDSB1_AFC1_AFEM16_AFEM1_ASEM1_CLR1_CADS0_EPS0_FDSI0_GRPM1_GRVWA8_GRVWB8_GSU1_GSUAMB_GSUC0_GSUWGMRR0_GLS0_ISA942_IU1_K1_LCS0_LBSPPA512_LBSPPB256_LBSPPM0_LPA16_LPB16_LPM0_LRVW8_LWPMn1_MIAV0_MIWT2_1_MO40_NTn1_NTA0_NTB0_NTC0_NTD4_NTM0_NEPBS16_NLCA1_NLCB1_ONLL1_PGR2_PLR1_PKA1_SIA3_SS1_SU16_SUM0_SUS256_SPO0_SRVW0_SSO0_SVW2_SK0_SKXCCM0_TLDS1_ULSGRO0_USL1_UIOFGRO0_USFGROn1_VSn1_VWA2_VWB1_WSGRA0_WSGRB0_WS64_WG32_8_1_WGM1_WGMXCC1_WGMXCCG304
    SolutionIndex: 178
    SolutionNameMin: Cijk_Alik_Bljk_BBS_BH_Bias_HA_S_SAV_UserArgs_MT64x32x256_MI16x16x1_SN_LDSB1_AFC1_AFEM16_AFEM1_ASEM1_CLR1_CADS0_EPS0_FDSI0_GRPM1_GRVWA8_GRVWB8_GSU1_GSUAMB_GSUC0_GSUWGMRR0_GLS0_ISA942_IU1_K1_LCS0_LBSPPA1024_LBSPPB512_LBSPPM0_LPA16_LPB16_LPM0_LRVW8_LWPMn1_MIAV0_MIWT2_1_MO40_NTn1_NTA0_NTB0_NTC0_NTD0_NTM0_NEPBS16_NLCA1_NLCB1_ONLL1_PGR2_PLR1_PKA1_SIA3_SS1_SU16_SUM0_SUS512_SPO0_SRVW0_SSO0_SVW2_SK0_SKXCCM0_TLDS1_ULSGRO0_USL1_UIOFGRO0_USFGROn1_VSn1_VWA2_VWB1_WSGRA0_WSGRB0_WS64_WG32_8_1_WGM1_WGMXCC1_WGMXCCG304
    SolutionIndex: 179
    SolutionNameMin: Cijk_Alik_Bljk_BBS_BH_Bias_HA_S_SAV_UserArgs_MT16x16x256_MI16x16x1_SN_LDSB1_AFC1_AFEM16_AFEM1_ASEM1_CLR1_CADS0_EPS0_FDSI0_GRPM1_GRVWA8_GRVWB8_GSU1_GSUAMB_GSUC0_GSUWGMRR0_GLS0_ISA942_IU1_K1_LCS0_LBSPPA512_LBSPPB512_LBSPPM0_LPA16_LPB16_LPM0_LRVW8_LWPMn1_MIAV0_MIWT1_1_MO40_NTn1_NTA0_NTB0_NTC0_NTD4_NTM0_NEPBS16_NLCA1_NLCB1_ONLL1_PGR2_PLR1_PKA1_SIA3_SS1_SU0_SUM0_SUS0_SPO0_SRVW0_SSO0_SVW1_SK0_SKXCCM0_TLDS1_ULSGRO1_USL1_UIOFGRO0_USFGROn1_VSn1_VWA1_VWB1_WSGRA0_WSGRB0_WS64_WG16_4_4_WGM1_WGMXCC1_WGMXCCG304
    SolutionIndex: 180
    SolutionNameMin: Cijk_Alik_Bljk_BBS_BH_Bias_HA_S_SAV_UserArgs_MT16x16x256_MI16x16x1_SN_LDSB1_AFC1_AFEM16_AFEM1_ASEM1_CLR1_CADS0_EPS0_FDSI0_GRPM1_GRVWA8_GRVWB8_GSU1_GSUAMB_GSUC0_GSUWGMRR0_GLS0_ISA942_IU1_K1_LCS0_LBSPPA512_LBSPPB512_LBSPPM0_LPA16_LPB16_LPM0_LRVW8_LWPMn1_MIAV0_MIWT1_1_MO40_NTn1_NTA0_NTB0_NTC0_NTD4_NTM0_NEPBS16_NLCA1_NLCB1_ONLL1_PGR2_PLR1_PKA1_SIA3_SS1_SU16_SUM0_SUS512_SPO0_SRVW0_SSO0_SVW1_SK0_SKXCCM0_TLDS1_ULSGRO1_USL1_UIOFGRO0_USFGROn1_VSn1_VWA1_VWB1_WSGRA0_WSGRB0_WS64_WG16_4_4_WGM1_WGMXCC1_WGMXCCG304
    SolutionIndex: 181
    SolutionNameMin: Cijk_Alik_Bljk_BBS_BH_Bias_HA_S_SAV_UserArgs_MT32x16x256_MI16x16x1_SN_LDSB1_AFC1_AFEM16_AFEM1_ASEM1_CLR1_CADS0_EPS0_FDSI0_GRPM1_GRVWA8_GRVWB8_GSU1_GSUAMB_GSUC0_GSUWGMRR0_GLS0_ISA942_IU1_K1_LCS0_LBSPPA512_LBSPPB512_LBSPPM0_LPA16_LPB16_LPM0_LRVW8_LWPMn1_MIAV0_MIWT1_1_MO40_NTn1_NTA0_NTB0_NTC0_NTD4_NTM0_NEPBS16_NLCA1_NLCB1_ONLL1_PGR2_PLR1_PKA1_SIA3_SS1_SU16_SUM0_SUS512_SPO0_SRVW0_SSO0_SVW1_SK0_SKXCCM0_TLDS1_ULSGRO1_USL1_UIOFGRO0_USFGROn1_VSn1_VWA1_VWB1_WSGRA0_WSGRB0_WS64_WG32_4_2_WGM1_WGMXCC1_WGMXCCG304
    SolutionIndex: 182
    SolutionNameMin: Cijk_Alik_Bljk_BBS_BH_Bias_HA_S_SAV_UserArgs_MT32x48x256_MI16x16x1_SN_LDSB1_AFC1_AFEM16_AFEM1_ASEM1_CLR1_CADS0_EPS0_FDSI0_GRPM1_GRVWA8_GRVWB8_GSU1_GSUAMB_GSUC0_GSUWGMRR0_GLS0_ISA942_IU1_K1_LCS0_LBSPPA512_LBSPPB512_LBSPPM0_LPA16_LPB16_LPM0_LRVW8_LWPMn1_MIAV0_MIWT1_3_MO40_NTn1_NTA0_NTB0_NTC0_NTD0_NTM0_NEPBS16_NLCA1_NLCB1_ONLL1_PGR2_PLR1_PKA1_SIA3_SS1_SU16_SUM0_SUS512_SPO0_SRVW0_SSO0_SVW1_SK0_SKXCCM0_TLDS1_ULSGRO0_USL1_UIOFGRO0_USFGROn1_VSn1_VWA1_VWB1_WSGRA0_WSGRB0_WS64_WG32_4_2_WGM4_WGMXCC8_WGMXCCG304
    SolutionIndex: 183
    SolutionNameMin: Cijk_Alik_Bljk_BBS_BH_Bias_HA_S_SAV_UserArgs_MT32x48x256_MI16x16x1_SN_LDSB1_AFC1_AFEM16_AFEM1_ASEM1_CLR1_CADS0_EPS0_FDSI0_GRPM1_GRVWA8_GRVWB8_GSU1_GSUAMB_GSUC0_GSUWGMRR0_GLS0_ISA942_IU1_K1_LCS0_LBSPPA512_LBSPPB512_LBSPPM0_LPA16_LPB16_LPM0_LRVW8_LWPMn1_MIAV0_MIWT1_3_MO40_NTn1_NTA0_NTB0_NTC0_NTD0_NTM0_NEPBS16_NLCA1_NLCB1_ONLL1_PGR2_PLR1_PKA1_SIA3_SS1_SU16_SUM1_SUS512_SPO0_SRVW0_SSO0_SVW1_SK0_SKXCCM0_TLDS1_ULSGRO1_USL1_UIOFGRO0_USFGROn1_VSn1_VWA1_VWB1_WSGRA0_WSGRB0_WS64_WG32_4_2_WGM1_WGMXCC1_WGMXCCG304
    SolutionIndex: 184
    SolutionNameMin: Cijk_Alik_Bljk_BBS_BH_Bias_HA_S_SAV_UserArgs_MT64x32x256_MI16x16x1_SN_LDSB1_AFC1_AFEM1_AFEM1_ASEM1_CLR1_CADS0_EPS0_FDSI0_GRPM1_GRVWA8_GRVWB8_GSU1_GSUAMB_GLS0_ISA942_IU1_LBSPPA1024_LBSPPB512_LBSPPM0_LPA16_LPB16_LPM0_LRVW8_LWPMn1_MIAV0_MIWT2_2_MO40_NTn1_NTA5_NTB0_NTC0_NTD7_NTM0_NEPBS16_NLCA1_NLCB1_ONLL1_PGR2_PLR1_PKA1_SIA3_SS1_SU8_SUM1_SUS512_SPO0_SRVW0_SSO0_SVW2_TLDS1_USL1_UIOFGRO0_USFGROn1_VSn1_VWA2_VWB1_WSGRA0_WSGRB0_WS64_WG32_4_2_WGM0_WGMXCC1
    SolutionIndex: 185
    SolutionNameMin: Cijk_Alik_Bljk_BBS_BH_Bias_HA_S_SAV_UserArgs_MT128x128x32_MI16x16x1_SN_LDSB1_AFC1_AFEM1_AFEM1_ASEM1_CLR1_CADS0_EPS0_FDSI0_GRPM1_GRVWA4_GRVWB4_GSU1_GSUAMB_GSUC0_GSUWGMRR0_GLS0_ISA942_IU1_K1_LBSPPA256_LBSPPB256_LBSPPM0_LPA4_LPB4_LPM0_LRVW4_LWPMn1_MIAV0_MIWT4_4_MO40_NTn1_NTA0_NTB0_NTC4_NTD4_NTM0_NEPBS16_NLCA1_NLCB1_ONLL1_PGR2_PLR1_PKA1_SIA3_SS1_SU8_SUM0_SUS256_SPO1_SRVW0_SSO0_SVW4_TLDS1_ULSGRO1_USL1_UIOFGRO0_USFGROn1_VSn1_VWA4_VWB4_WSGRA0_WSGRB0_WS64_WG32_8_1_WGM8_WGMXCC4_WGMXCCG0
    SolutionIndex: 186
    SolutionNameMin: Cijk_Alik_Bljk_BBS_BH_Bias_HA_S_SAV_UserArgs_MT128x256x32_MI16x16x1_SN_LDSB1_AFC1_AFEM1_AFEM1_ASEM1_CLR1_CADS0_EPS0_FDSI0_GRPM1_GRVWA4_GRVWB4_GSU1_GSUAMB_GSUC0_GSUWGMRR0_GLS0_ISA942_IU1_K1_LBSPPA256_LBSPPB512_LBSPPM0_LPA4_LPB4_LPM0_LRVW4_LWPMn1_MIAV0_MIWT4_8_MO40_NTn1_NTA0_NTB0_NTC4_NTD4_NTM0_NEPBS16_NLCA1_NLCB1_ONLL1_PGR2_PLR1_PKA1_SIA3_SS1_SU0_SUM0_SUS0_SPO1_SRVW0_SSO4_SVW4_TLDS1_ULSGRO1_USL1_UIOFGRO0_USFGROn1_VSn1_VWA4_VWB8_WSGRA0_WSGRB0_WS64_WG32_8_1_WGM8_WGMXCC8_WGMXCCG0
    SolutionIndex: 187
    SolutionNameMin: Cijk_Alik_Bljk_BBS_BH_Bias_HA_S_SAV_UserArgs_MT128x256x32_MI16x16x1_SN_LDSB1_AFC1_AFEM1_AFEM1_ASEM1_CLR1_CADS0_EPS0_FDSI0_GRPM1_GRVWA4_GRVWB4_GSU1_GSUAMB_GSUC0_GSUWGMRR0_GLS0_ISA942_IU1_K1_LBSPPA256_LBSPPB512_LBSPPM0_LPA4_LPB4_LPM0_LRVW4_LWPMn1_MIAV0_MIWT4_8_MO40_NTn1_NTA0_NTB0_NTC0_NTD4_NTM0_NEPBS0_NLCA1_NLCB1_ONLL1_PGR2_PLR1_PKA1_SIA3_SS1_SU8_SUM0_SUS64_SPO1_SRVW0_SSO0_SVW4_TLDS1_ULSGRO1_USL1_UIOFGRO0_USFGROn1_VSn1_VWA4_VWB8_WSGRA0_WSGRB0_WS64_WG32_8_1_WGM1_WGMXCC8_WGMXCCG0
    SolutionIndex: 188
    SolutionNameMin: Cijk_Alik_Bljk_BBS_BH_Bias_HA_S_SAV_UserArgs_MT128x256x32_MI16x16x1_SN_LDSB1_AFC1_AFEM1_AFEM1_ASEM1_CLR1_CADS0_EPS0_FDSI0_GRPM1_GRVWA4_GRVWB4_GSU1_GSUAMB_GSUC0_GSUWGMRR0_GLS0_ISA942_IU1_K1_LBSPPA256_LBSPPB512_LBSPPM0_LPA4_LPB4_LPM0_LRVW4_LWPMn1_MIAV0_MIWT4_8_MO40_NTn1_NTA0_NTB0_NTC4_NTD4_NTM0_NEPBS0_NLCA1_NLCB1_ONLL1_PGR2_PLR1_PKA1_SIA3_SS1_SU8_SUM0_SUS64_SPO0_SRVW0_SSO0_SVW4_TLDS1_ULSGRO0_USL1_UIOFGRO0_USFGROn1_VSn1_VWA4_VWB8_WSGRA0_WSGRB0_WS64_WG32_8_1_WGM0_WGMXCC8_WGMXCCG0
    SolutionIndex: 189
    SolutionNameMin: Cijk_Alik_Bljk_BBS_BH_Bias_HA_S_SAV_UserArgs_MT224x256x64_MI16x16x1_SN_LDSB1_AFC1_AFEM1_AFEM1_ASEM1_CLR1_CADS0_EPS0_FDSI0_GRPM1_GRVWA4_GRVWB4_GSU1_GSUAMB_GSUC0_GSUWGMRR0_GLS0_ISA942_IU1_K1_LBSPPA256_LBSPPB512_LBSPPM0_LPA4_LPB4_LPM0_LRVW4_LWPMn1_MIAV0_MIWT14_4_MO40_NTn1_NTA0_NTB0_NTC0_NTD0_NTM0_NEPBS0_NLCA1_NLCB1_ONLL1_PGR2_PLR1_PKA1_SIA3_SS1_SU0_SUM0_SUS0_SPO0_SRVW0_SSO0_SVW2_TLDS1_ULSGRO1_USL1_UIOFGRO0_USFGROn1_VSn1_VWA2_VWB4_WSGRA0_WSGRB0_WS64_WG16_16_1_WGM1_WGMXCC8_WGMXCCG0
    SolutionIndex: 190
    SolutionNameMin: Cijk_Alik_Bljk_BBS_BH_Bias_HA_S_SAV_UserArgs_MT128x64x128_MI16x16x1_SN_LDSB1_AFC1_AFEM1_AFEM1_ASEM1_CLR1_CADS0_EPS0_FDSI0_GRPM1_GRVWA8_GRVWB8_GSU1_GSUAMB_GSUC0_GSUWGMRR0_GLS0_ISA942_IU1_K1_LBSPPA1024_LBSPPB512_LBSPPM0_LPA16_LPB16_LPM0_LRVW8_LWPMn1_MIAV0_MIWT4_2_MO40_NTn1_NTA0_NTB0_NTC3_NTD3_NTM0_NEPBS0_NLCA1_NLCB1_ONLL1_PGR2_PLR1_PKA1_SIA3_SS1_SU0_SUM0_SUS0_SPO1_SRVW0_SSO4_SVW4_TLDS1_ULSGRO0_USL0_UIOFGRO1_USFGROn1_VSn1_VWA4_VWB2_WSGRA2_WSGRB0_WS64_WG32_8_1_WGM304_WGMXCC32_WGMXCCG0
    SolutionIndex: 191
    SolutionNameMin: Cijk_Alik_Bljk_BBS_BH_Bias_HA_S_SAV_UserArgs_MT64x128x128_MI16x16x1_SN_LDSB1_AFC1_AFEM1_AFEM1_ASEM1_CLR1_CADS0_EPS0_FDSI0_GRPM1_GRVWA8_GRVWB8_GSU1_GSUAMB_GSUC0_GSUWGMRR0_GLS0_ISA942_IU1_K1_LBSPPA512_LBSPPB1024_LBSPPM0_LPA16_LPB16_LPM0_LRVW8_LWPMn1_MIAV0_MIWT2_4_MO40_NTn1_NTA0_NTB0_NTC0_NTD0_NTM0_NEPBS0_NLCA1_NLCB1_ONLL1_PGR2_PLR1_PKA1_SIA3_SS1_SU0_SUM0_SUS0_SPO0_SRVW0_SSO0_SVW2_TLDS1_ULSGRO0_USL1_UIOFGRO0_USFGROn1_VSn1_VWA2_VWB4_WSGRA0_WSGRB0_WS64_WG32_8_1_WGM0_WGMXCC32_WGMXCCG0
    SolutionIndex: 192
    SolutionNameMin: Cijk_Alik_Bljk_BBS_BH_Bias_HA_S_SAV_UserArgs_MT128x64x128_MI16x16x1_SN_LDSB1_AFC1_AFEM1_AFEM1_ASEM1_CLR1_CADS0_EPS0_FDSI0_GRPM1_GRVWA8_GRVWB8_GSU1_GSUAMB_GSUC0_GSUWGMRR0_GLS0_ISA942_IU1_K1_LBSPPA1024_LBSPPB512_LBSPPM0_LPA16_LPB16_LPM0_LRVW8_LWPMn1_MIAV0_MIWT4_2_MO40_NTn1_NTA0_NTB0_NTC0_NTD0_NTM0_NEPBS16_NLCA1_NLCB1_ONLL1_PGR2_PLR1_PKA1_SIA3_SS1_SU4_SUM1_SUS256_SPO0_SRVW0_SSO0_SVW4_TLDS1_ULSGRO0_USL1_UIOFGRO0_USFGROn1_VSn1_VWA4_VWB2_WSGRA0_WSGRB0_WS64_WG32_8_1_WGM32_WGMXCC32_WGMXCCG0
    SolutionIndex: 193
    SolutionNameMin: Cijk_Alik_Bljk_BBS_BH_Bias_HA_S_SAV_UserArgs_MT128x64x128_MI16x16x1_SN_LDSB1_AFC1_AFEM1_AFEM1_ASEM1_CLR1_CADS0_EPS0_FDSI0_GRPM1_GRVWA8_GRVWB8_GSU1_GSUAMB_GSUC0_GSUWGMRR0_GLS0_ISA942_IU1_K1_LBSPPA512_LBSPPB1024_LBSPPM0_LPA16_LPB16_LPM0_LRVW8_LWPMn1_MIAV0_MIWT2_4_MO40_NTn1_NTA0_NTB0_NTC0_NTD4_NTM0_NEPBS16_NLCA1_NLCB1_ONLL1_PGR2_PLR1_PKA1_SIA3_SS1_SU4_SUM0_SUS256_SPO0_SRVW0_SSO0_SVW2_TLDS1_ULSGRO0_USL1_UIOFGRO0_USFGROn1_VSn1_VWA2_VWB4_WSGRA0_WSGRB0_WS64_WG64_4_1_WGM1_WGMXCC4_WGMXCCG304
    SolutionIndex: 194
    SolutionNameMin: Cijk_Alik_Bljk_BBS_BH_Bias_HA_S_SAV_UserArgs_MT128x128x64_MI16x16x1_SN_LDSB1_AFC1_AFEM1_AFEM1_ASEM1_CLR1_CADS0_EPS0_FDSI0_GRPM1_GRVWA8_GRVWB8_GSU2_GSUAMB_GSUC0_GSUWGMRR0_GLS0_ISA942_IU1_K1_LBSPPA512_LBSPPB512_LBSPPM0_LPA16_LPB16_LPM0_LRVW8_LWPMn1_MIAV0_MIWT4_4_MO40_NTn1_NTA0_NTB0_NTC0_NTD0_NTM0_NEPBS0_NLCA1_NLCB1_ONLL1_PGR2_PLR1_PKA1_SIA3_SS1_SU0_SUM0_SUS0_SPO0_SRVW0_SSO0_SVW4_TLDS1_ULSGRO0_USL1_UIOFGRO0_USFGROn1_VSn1_VWA4_VWB4_WSGRA0_WSGRB0_WS64_WG32_8_1_WGM32_WGMXCC8_WGMXCCG32
    SolutionIndex: 195
    SolutionNameMin: Cijk_Alik_Bljk_BBS_BH_Bias_HA_S_SAV_UserArgs_MT128x128x64_MI16x16x1_SN_LDSB1_AFC1_AFEM1_AFEM1_ASEM1_CLR1_CADS0_EPS0_FDSI0_GRPM1_GRVWA8_GRVWB8_GSU1_GSUAMB_GSUC0_GSUWGMRR0_GLS0_ISA942_IU1_K1_LBSPPA1024_LBSPPB256_LBSPPM0_LPA16_LPB16_LPM0_LRVW8_LWPMn1_MIAV0_MIWT8_2_MO40_NTn1_NTA0_NTB0_NTC3_NTD3_NTM0_NEPBS0_NLCA1_NLCB1_ONLL1_PGR2_PLR1_PKA1_SIA3_SS1_SU0_SUM0_SUS0_SPO1_SRVW0_SSO4_SVW8_TLDS1_ULSGRO1_USL1_UIOFGRO0_USFGRO0_VSn1_VWA8_VWB2_WSGRA2_WSGRB2_WS64_WG16_16_1_WGM4_WGMXCC4_WGMXCCG32
    SolutionIndex: 196
    SolutionNameMin: Cijk_Alik_Bljk_BBS_BH_Bias_HA_S_SAV_UserArgs_MT256x128x64_MI16x16x1_SN_LDSB1_AFC1_AFEM1_AFEM1_ASEM1_CLR1_CADS0_EPS0_FDSI0_GRPM1_GRVWA8_GRVWB8_GSU1_GSUAMB_GSUC0_GSUWGMRR0_GLS0_ISA942_IU1_K1_LBSPPA1024_LBSPPB512_LBSPPM0_LPA16_LPB16_LPM0_LRVW8_LWPMn1_MIAV0_MIWT8_4_MO40_NTn1_NTA0_NTB0_NTC3_NTD3_NTM0_NEPBS0_NLCA1_NLCB1_ONLL1_PGR2_PLR1_PKA1_SIA3_SS1_SU0_SUM0_SUS0_SPO1_SRVW0_SSO4_SVW8_TLDS1_ULSGRO1_USL0_UIOFGRO0_USFGROn1_VSn1_VWA8_VWB4_WSGRA2_WSGRB0_WS64_WG32_8_1_WGM8_WGMXCC8_WGMXCCG0
    SolutionIndex: 197
    SolutionNameMin: Cijk_Alik_Bljk_BBS_BH_Bias_HA_S_SAV_UserArgs_MT128x96x64_MI16x16x1_SN_LDSB1_AFC1_AFEM1_AFEM1_ASEM1_CLR1_CADS0_EPS0_FDSI0_GRPM1_GRVWA8_GRVWB8_GSU1_GSUAMB_GSUC0_GSUWGMRR0_GLS0_ISA942_IU1_K1_LBSPPA512_LBSPPB128_LBSPPM0_LPA16_LPB16_LPM0_LRVW8_LWPMn1_MIAV0_MIWT4_3_MO40_NTn1_NTA0_NTB0_NTC0_NTD4_NTM0_NEPBS0_NLCA1_NLCB1_ONLL1_PGR2_PLR1_PKA1_SIA3_SS1_SU4_SUM0_SUS128_SPO0_SRVW0_SSO0_SVW4_TLDS1_ULSGRO0_USL1_UIOFGRO0_USFGROn1_VSn1_VWA4_VWB1_WSGRA0_WSGRB0_WS64_WG32_8_1_WGM304_WGMXCC4_WGMXCCG0
    SolutionIndex: 198
    SolutionNameMin: Cijk_Alik_Bljk_BBS_BH_Bias_HA_S_SAV_UserArgs_MT128x96x64_MI16x16x1_SN_LDSB1_AFC1_AFEM1_AFEM1_ASEM1_CLR1_CADS0_EPS0_FDSI0_GRPM1_GRVWA8_GRVWB8_GSU1_GSUAMB_GSUC0_GSUWGMRR0_GLS0_ISA942_IU1_K1_LBSPPA512_LBSPPB128_LBSPPM0_LPA16_LPB16_LPM0_LRVW8_LWPMn1_MIAV0_MIWT4_3_MO40_NTn1_NTA0_NTB0_NTC0_NTD4_NTM0_NEPBS0_NLCA1_NLCB1_ONLL1_PGR2_PLR1_PKA1_SIA3_SS1_SU4_SUM0_SUS128_SPO0_SRVW0_SSO4_SVW4_TLDS1_ULSGRO0_USL1_UIOFGRO0_USFGROn1_VSn1_VWA4_VWB1_WSGRA0_WSGRB0_WS64_WG32_8_1_WGM32_WGMXCC4_WGMXCCG0
    SolutionIndex: 199
    SolutionNameMin: Cijk_Alik_Bljk_BBS_BH_Bias_HA_S_SAV_UserArgs_MT256x160x32_MI16x16x1_SN_LDSB1_AFC1_AFEM1_AFEM1_ASEM1_CLR1_CADS0_EPS0_FDSI0_GRPM1_GRVWA4_GRVWB4_GSU1_GSUAMB_GSUC0_GSUWGMRR0_GLS0_ISA942_IU1_K1_LBSPPA512_LBSPPB128_LBSPPM0_LPA4_LPB4_LPM0_LRVW4_LWPMn1_MIAV0_MIWT8_5_MO40_NTn1_NTA0_NTB0_NTC0_NTD4_NTM0_NEPBS0_NLCA1_NLCB1_ONLL1_PGR2_PLR1_PKA1_SIA3_SS1_SU32_SUM0_SUS64_SPO0_SRVW0_SSO0_SVW8_TLDS1_ULSGRO0_USL1_UIOFGRO0_USFGROn1_VSn1_VWA8_VWB1_WSGRA0_WSGRB0_WS64_WG32_8_1_WGM304_WGMXCC1_WGMXCCG4
    SolutionIndex: 200
    SolutionNameMin: Cijk_Alik_Bljk_BBS_BH_Bias_HA_S_SAV_UserArgs_MT128x224x32_MI16x16x1_SN_LDSB1_AFC1_AFEM1_AFEM1_ASEM1_CLR1_CADS0_EPS0_FDSI0_GRPM1_GRVWA4_GRVWB4_GSU1_GSUAMB_GSUC0_GSUWGMRR0_GLS0_ISA942_IU1_K1_LBSPPA256_LBSPPB128_LBSPPM0_LPA4_LPB4_LPM0_LRVW4_LWPMn1_MIAV0_MIWT4_7_MO40_NTn1_NTA0_NTB0_NTC4_NTD4_NTM0_NEPBS16_NLCA1_NLCB1_ONLL1_PGR2_PLR1_PKA1_SIA3_SS1_SU32_SUM0_SUS64_SPO0_SRVW0_SSO0_SVW4_TLDS1_ULSGRO0_USL1_UIOFGRO0_USFGROn1_VSn1_VWA4_VWB1_WSGRA0_WSGRB0_WS64_WG32_8_1_WGM38_WGMXCC4_WGMXCCG0
    SolutionIndex: 201
    SolutionNameMin: Cijk_Alik_Bljk_BBS_BH_Bias_HA_S_SAV_UserArgs_MT128x224x32_MI16x16x1_SN_LDSB1_AFC1_AFEM1_AFEM1_ASEM1_CLR1_CADS0_EPS0_FDSI0_GRPM1_GRVWA4_GRVWB4_GSU1_GSUAMB_GSUC0_GSUWGMRR0_GLS0_ISA942_IU1_K1_LBSPPA256_LBSPPB128_LBSPPM0_LPA4_LPB4_LPM0_LRVW4_LWPMn1_MIAV0_MIWT4_7_MO40_NTn1_NTA0_NTB0_NTC4_NTD4_NTM0_NEPBS16_NLCA1_NLCB1_ONLL1_PGR2_PLR1_PKA1_SIA3_SS1_SU32_SUM0_SUS256_SPO0_SRVW0_SSO0_SVW4_TLDS1_ULSGRO1_USL1_UIOFGRO0_USFGROn1_VSn1_VWA4_VWB1_WSGRA0_WSGRB0_WS64_WG32_8_1_WGM38_WGMXCC4_WGMXCCG0
    SolutionIndex: 202
    SolutionNameMin: Cijk_Alik_Bljk_BBS_BH_Bias_HA_S_SAV_UserArgs_MT128x224x32_MI16x16x1_SN_LDSB1_AFC1_AFEM1_AFEM1_ASEM1_CLR1_CADS0_EPS0_FDSI0_GRPM1_GRVWA4_GRVWB4_GSU1_GSUAMB_GSUC0_GSUWGMRR0_GLS0_ISA942_IU1_K1_LBSPPA256_LBSPPB128_LBSPPM0_LPA4_LPB4_LPM0_LRVW4_LWPMn1_MIAV0_MIWT4_7_MO40_NTn1_NTA0_NTB0_NTC0_NTD4_NTM0_NEPBS0_NLCA1_NLCB1_ONLL1_PGR2_PLR1_PKA1_SIA3_SS1_SU8_SUM0_SUS256_SPO0_SRVW0_SSO0_SVW4_TLDS1_ULSGRO1_USL1_UIOFGRO0_USFGROn1_VSn1_VWA4_VWB1_WSGRA0_WSGRB0_WS64_WG32_8_1_WGM38_WGMXCC4_WGMXCCG0
    SolutionIndex: 203
    SolutionNameMin: Cijk_Alik_Bljk_BBS_BH_Bias_HA_S_SAV_UserArgs_MT128x128x64_MI16x16x1_SN_LDSB1_AFC1_AFEM1_AFEM1_ASEM1_CLR1_CADS0_EPS0_FDSI0_GRPM1_GRVWA8_GRVWB8_GSU9_GSUAMB_GSUC1_GSUWGMRR1_GLS0_ISA942_IU1_K1_LBSPPA512_LBSPPB512_LBSPPM0_LPA16_LPB16_LPM0_LRVW8_LWPMn1_MIAV0_MIWT4_4_MO40_NTn1_NTA0_NTB0_NTC0_NTD4_NTM0_NEPBS0_NLCA1_NLCB1_ONLL1_PGR2_PLR1_PKA1_SIA3_SS1_SU0_SUM0_SUS0_SPO1_SRVW0_SSO0_SVW4_SK0_SKXCCM0_TLDS1_ULSGRO0_USL1_UIOFGRO0_USFGROn1_VSn1_VWA4_VWB4_WSGRA2_WSGRB2_WS64_WG32_8_1_WGM1_WGMXCC304_WGMXCCG0
    SolutionIndex: 204
    SolutionNameMin: Cijk_Alik_Bljk_BBS_BH_Bias_HA_S_SAV_UserArgs_MT128x64x128_MI16x16x1_SN_LDSB1_AFC1_AFEM1_AFEM1_ASEM1_CLR1_CADS0_EPS0_FDSI0_GRPM1_GRVWA8_GRVWB8_GSU1_GSUAMB_GSUC0_GSUWGMRR0_GLS0_ISA942_IU1_K1_LBSPPA1024_LBSPPB512_LBSPPM0_LPA16_LPB16_LPM0_LRVW8_LWPMn1_MIAV0_MIWT4_2_MO40_NTn1_NTA0_NTB0_NTC0_NTD4_NTM0_NEPBS16_NLCA1_NLCB1_ONLL1_PGR2_PLR1_PKA1_SIA3_SS1_SU0_SUM0_SUS0_SPO0_SRVW0_SSO0_SVW4_SK0_SKXCCM0_TLDS1_ULSGRO0_USL1_UIOFGRO0_USFGROn1_VSn1_VWA4_VWB2_WSGRA0_WSGRB0_WS64_WG32_8_1_WGM1_WGMXCC8_WGMXCCG0
    SolutionIndex: 205
    SolutionNameMin: Cijk_Alik_Bljk_BBS_BH_Bias_HA_S_SAV_UserArgs_MT128x64x128_MI16x16x1_SN_LDSB1_AFC1_AFEM1_AFEM1_ASEM1_CLR1_CADS0_EPS0_FDSI0_GRPM1_GRVWA8_GRVWB8_GSU1_GSUAMB_GSUC0_GSUWGMRR0_GLS0_ISA942_IU1_K1_LBSPPA512_LBSPPB1024_LBSPPM0_LPA16_LPB16_LPM0_LRVW8_LWPMn1_MIAV0_MIWT2_4_MO40_NTn1_NTA0_NTB0_NTC0_NTD4_NTM0_NEPBS0_NLCA1_NLCB1_ONLL1_PGR2_PLR1_PKA1_SIA3_SS1_SU8_SUM1_SUS256_SPO0_SRVW0_SSO0_SVW2_SK0_SKXCCM0_TLDS1_ULSGRO1_USL1_UIOFGRO0_USFGROn1_VSn1_VWA2_VWB4_WSGRA2_WSGRB2_WS64_WG64_4_1_WGM1_WGMXCC8_WGMXCCG32
    SolutionIndex: 206
    SolutionNameMin: Cijk_Alik_Bljk_BBS_BH_Bias_HA_S_SAV_UserArgs_MT128x128x64_MI16x16x1_SN_LDSB1_AFC1_AFEM1_AFEM1_ASEM1_CLR1_CADS0_EPS0_FDSI0_GRPM1_GRVWA8_GRVWB8_GSU2_GSUAMB_GSUC0_GSUWGMRR0_GLS0_ISA942_IU1_K1_LBSPPA1024_LBSPPB256_LBSPPM0_LPA16_LPB16_LPM0_LRVW8_LWPMn1_MIAV0_MIWT8_2_MO40_NTn1_NTA0_NTB0_NTC0_NTD0_NTM0_NEPBS16_NLCA1_NLCB1_ONLL1_PGR2_PLR1_PKA1_SIA3_SS1_SU8_SUM0_SUS128_SPO1_SRVW0_SSO4_SVW8_SK0_SKXCCM0_TLDS1_ULSGRO1_USL1_UIOFGRO0_USFGROn1_VSn1_VWA8_VWB2_WSGRA2_WSGRB2_WS64_WG16_16_1_WGM0_WGMXCC32_WGMXCCG0
    SolutionIndex: 207
    SolutionNameMin: Cijk_Alik_Bljk_BBS_BH_Bias_HA_S_SAV_UserArgs_MT128x128x64_MI16x16x1_SN_LDSB1_AFC1_AFEM1_AFEM1_ASEM1_CLR1_CADS0_EPS0_FDSI0_GRPM1_GRVWA8_GRVWB8_GSU1_GSUAMB_GSUC0_GSUWGMRR0_GLS0_ISA942_IU1_K1_LBSPPA512_LBSPPB512_LBSPPM0_LPA16_LPB16_LPM0_LRVW8_LWPMn1_MIAV0_MIWT4_4_MO40_NTn1_NTA0_NTB0_NTC0_NTD0_NTM0_NEPBS16_NLCA1_NLCB1_ONLL1_PGR2_PLR1_PKA1_SIA3_SS1_SU8_SUM1_SUS128_SPO0_SRVW0_SSO4_SVW4_SK0_SKXCCM0_TLDS1_ULSGRO1_USL1_UIOFGRO0_USFGROn1_VSn1_VWA4_VWB4_WSGRA0_WSGRB0_WS64_WG32_8_1_WGM0_WGMXCC32_WGMXCCG0
    SolutionIndex: 208
    SolutionNameMin: Cijk_Alik_Bljk_BBS_BH_Bias_HA_S_SAV_UserArgs_MT128x128x64_MI16x16x1_SN_LDSB1_AFC1_AFEM1_AFEM1_ASEM1_CLR1_CADS0_EPS0_FDSI0_GRPM1_GRVWA8_GRVWB8_GSU1_GSUAMB_GSUC0_GSUWGMRR0_GLS0_ISA942_IU1_K1_LBSPPA512_LBSPPB512_LBSPPM0_LPA16_LPB16_LPM0_LRVW8_LWPMn1_MIAV0_MIWT4_4_MO40_NTn1_NTA0_NTB0_NTC0_NTD4_NTM0_NEPBS0_NLCA1_NLCB1_ONLL1_PGR2_PLR1_PKA1_SIA3_SS1_SU4_SUM0_SUS1024_SPO0_SRVW0_SSO0_SVW4_SK0_SKXCCM0_TLDS1_ULSGRO0_USL1_UIOFGRO0_USFGROn1_VSn1_VWA4_VWB4_WSGRA2_WSGRB0_WS64_WG32_8_1_WGM8_WGMXCC1_WGMXCCG0
    SolutionIndex: 209
    SolutionNameMin: Cijk_Alik_Bljk_BBS_BH_Bias_HA_S_SAV_UserArgs_MT128x256x64_MI16x16x1_SN_LDSB1_AFC1_AFEM1_AFEM1_ASEM1_CLR1_CADS0_EPS0_FDSI0_GRPM1_GRVWA8_GRVWB8_GSU1_GSUAMB_GSUC0_GSUWGMRR0_GLS0_ISA942_IU1_K1_LBSPPA1024_LBSPPB512_LBSPPM0_LPA16_LPB16_LPM0_LRVW8_LWPMn1_MIAV0_MIWT8_4_MO40_NTn1_NTA0_NTB0_NTC0_NTD4_NTM0_NEPBS0_NLCA1_NLCB1_ONLL1_PGR2_PLR1_PKA1_SIA3_SS1_SU8_SUM1_SUS512_SPO0_SRVW0_SSO0_SVW8_SK0_SKXCCM0_TLDS1_ULSGRO0_USL1_UIOFGRO0_USFGROn1_VSn1_VWA8_VWB4_WSGRA2_WSGRB2_WS64_WG16_16_1_WGM0_WGMXCC1_WGMXCCG0
    SolutionIndex: 210
    SolutionNameMin: Cijk_Alik_Bljk_BBS_BH_Bias_HA_S_SAV_UserArgs_MT192x256x64_MI16x16x1_SN_LDSB1_AFC1_AFEM1_AFEM1_ASEM1_CLR1_CADS0_EPS0_FDSI0_GRPM1_GRVWA8_GRVWB8_GSU1_GSUAMB_GSUC0_GSUWGMRR0_GLS0_ISA942_IU1_K1_LBSPPA512_LBSPPB512_LBSPPM0_LPA16_LPB16_LPM0_LRVW8_LWPMn1_MIAV0_MIWT12_4_MO40_NTn1_NTA0_NTB0_NTC0_NTD4_NTM0_NEPBS0_NLCA1_NLCB1_ONLL1_PGR2_PLR1_PKA1_SIA3_SS1_SU8_SUM0_SUS256_SPO1_SRVW0_SSO0_SVW4_SK0_SKXCCM0_TLDS1_ULSGRO0_USL1_UIOFGRO0_USFGROn1_VSn1_VWA4_VWB4_WSGRA2_WSGRB0_WS64_WG16_16_1_WGM8_WGMXCC1_WGMXCCG0
    SolutionIndex: 211
    SolutionNameMin: Cijk_Alik_Bljk_BBS_BH_Bias_HA_S_SAV_UserArgs_MT192x256x64_MI16x16x1_SN_LDSB1_AFC1_AFEM1_AFEM1_ASEM1_CLR1_CADS0_EPS0_FDSI0_GRPM1_GRVWA8_GRVWB8_GSU1_GSUAMB_GSUC0_GSUWGMRR0_GLS0_ISA942_IU1_K1_LBSPPA512_LBSPPB512_LBSPPM0_LPA16_LPB16_LPM0_LRVW8_LWPMn1_MIAV0_MIWT12_4_MO40_NTn1_NTA0_NTB0_NTC0_NTD4_NTM0_NEPBS0_NLCA1_NLCB1_ONLL1_PGR2_PLR1_PKA1_SIA3_SS1_SU8_SUM0_SUS256_SPO0_SRVW0_SSO0_SVW4_SK0_SKXCCM0_TLDS1_ULSGRO0_USL1_UIOFGRO0_USFGROn1_VSn1_VWA4_VWB4_WSGRA0_WSGRB2_WS64_WG16_16_1_WGM16_WGMXCC1_WGMXCCG0
    SolutionIndex: 212
    SolutionNameMin: Cijk_Alik_Bljk_BBS_BH_Bias_HA_S_SAV_UserArgs_MT256x256x32_MI16x16x1_SN_LDSB1_AFC1_AFEM1_AFEM1_ASEM1_CLR1_CADS0_EPS0_FDSI0_GRPM1_GRVWA4_GRVWB4_GSU1_GSUAMB_GSUC0_GSUWGMRR0_GLS0_ISA942_IU1_K1_LBSPPA512_LBSPPB512_LBSPPM0_LPA4_LPB4_LPM0_LRVW4_LWPMn1_MIAV0_MIWT8_8_MO40_NTn1_NTA0_NTB0_NTC4_NTD4_NTM0_NEPBS0_NLCA1_NLCB1_ONLL1_PGR2_PLR1_PKA1_SIA3_SS1_SU8_SUM0_SUS64_SPO0_SRVW0_SSO4_SVW8_SK0_SKXCCM0_TLDS1_ULSGRO1_USL1_UIOFGRO0_USFGROn1_VSn1_VWA8_VWB8_WSGRA2_WSGRB0_WS64_WG32_8_1_WGM0_WGMXCC32_WGMXCCG0
    SolutionIndex: 213
    SolutionNameMin: Cijk_Alik_Bljk_BBS_BH_Bias_HA_S_SAV_UserArgs_MT192x256x64_MI16x16x1_SN_LDSB1_AFC1_AFEM1_AFEM1_ASEM1_CLR1_CADS0_EPS0_FDSI0_GRPM1_GRVWA8_GRVWB8_GSU1_GSUAMB_GSUC0_GSUWGMRR0_GLS0_ISA942_IU1_K1_LBSPPA512_LBSPPB512_LBSPPM0_LPA16_LPB16_LPM0_LRVW8_LWPMn1_MIAV0_MIWT12_4_MO40_NTn1_NTA0_NTB0_NTC0_NTD4_NTM0_NEPBS16_NLCA1_NLCB1_ONLL1_PGR2_PLR1_PKA1_SIA3_SS1_SU8_SUM0_SUS256_SPO0_SRVW0_SSO0_SVW4_SK0_SKXCCM0_TLDS1_ULSGRO0_USL1_UIOFGRO0_USFGROn1_VSn1_VWA4_VWB4_WSGRA0_WSGRB0_WS64_WG16_16_1_WGM32_WGMXCC1_WGMXCCG0
    SolutionIndex: 214
    SolutionNameMin: Cijk_Alik_Bljk_BBS_BH_Bias_HA_S_SAV_UserArgs_MT256x96x64_MI16x16x1_SN_LDSB1_AFC1_AFEM1_AFEM1_ASEM1_CLR1_CADS0_DTVA0_DTVB0_EPS0_FDSI0_GRPM1_GRVWA8_GRVWB8_GSU3_GSUAMB_GSUC1_GSUWGMRR1_GLS0_ISA942_IU1_K1_LBSPPA512_LBSPPB256_LBSPPM0_LPA16_LPB16_LPM0_LRVW8_LWPMn1_MIAV0_MIWT4_6_MO40_NTn1_NTA0_NTB0_NTC0_NTD0_NTM0_NEPBS0_NLCA1_NLCB1_ONLL1_PGR2_PLR1_PKA1_SIA3_SS1_SU8_SUM0_SUS128_SPO0_SRVW0_SSO0_SVW4_SK0_SKXCCM0_TLDS1_ULSGRO1_USL1_UIOFGRO0_USFGROn1_VSn1_VWA4_VWB2_WSGRA0_WSGRB2_WS64_WG64_4_1_WGM1_WGMXCC1_WGMXCCG32
    SolutionIndex: 215
    SolutionNameMin: Cijk_Alik_Bljk_BBS_BH_Bias_HA_S_SAV_UserArgs_MT128x256x64_MI16x16x1_SN_LDSB1_AFC1_AFEM1_AFEM1_ASEM1_CLR1_CADS0_DTVA0_DTVB0_EPS0_FDSI0_GRPM1_GRVWA8_GRVWB8_GSU1_GSUAMB_GSUC0_GSUWGMRR0_GLS0_ISA942_IU1_K1_LBSPPA1024_LBSPPB256_LBSPPM0_LPA16_LPB16_LPM0_LRVW8_LWPMn1_MIAV0_MIWT8_4_MO40_NTn1_NTA1_NTB2_NTC0_NTD6_NTM0_NEPBS0_NLCA1_NLCB1_ONLL1_PGR2_PLR1_PKA1_SIA3_SS1_SU8_SUM1_SUS512_SPO0_SRVW0_SSO0_SVW8_SK0_SKXCCM0_TLDS1_ULSGRO0_USL1_UIOFGRO0_USFGROn1_VSn1_VWA8_VWB2_WSGRA2_WSGRB2_WS64_WG16_16_1_WGM0_WGMXCC1_WGMXCCG0
    SolutionIndex: 216
    SolutionNameMin: Cijk_Alik_Bljk_BBS_BH_Bias_HA_S_SAV_UserArgs_MT256x160x64_MI16x16x1_SN_LDSB1_AFC1_AFEM1_AFEM1_ASEM1_CLR1_CADS0_DTVA0_DTVB0_EPS0_FDSI0_GRPM1_GRVWA8_GRVWB8_GSU1_GSUAMB_GSUC1_GSUWGMRR1_GLS0_ISA942_IU1_K1_LBSPPA512_LBSPPB128_LBSPPM0_LPA16_LPB16_LPM0_LRVW8_LWPMn1_MIAV0_MIWT8_5_MO40_NTn1_NTA0_NTB0_NTC0_NTD4_NTM0_NEPBS0_NLCA1_NLCB1_ONLL1_PGR2_PLR1_PKA1_SIA3_SS1_SU0_SUM0_SUS0_SPO1_SRVW0_SSO0_SVW4_SK0_SKXCCM0_TLDS1_ULSGRO0_USL1_UIOFGRO0_USFGROn1_VSn1_VWA4_VWB1_WSGRA0_WSGRB0_WS64_WG32_8_1_WGM1_WGMXCC1_WGMXCCGn1
    SolutionIndex: 217
    SolutionNameMin: Cijk_Alik_Bljk_BBS_BH_Bias_HA_S_SAV_UserArgs_MT256x224x64_MI16x16x1_SN_LDSB1_AFC1_AFEM1_AFEM1_ASEM1_CLR1_CADS0_DTVA0_DTVB0_EPS0_FDSI0_GRPM1_GRVWA4_GRVWB4_GSU1_GSUAMB_GSUC0_GSUWGMRR0_GLS0_ISA942_IU1_K1_LBSPPA1024_LBSPPB128_LBSPPM0_LPA4_LPB4_LPM0_LRVW4_LWPMn1_MIAV0_MIWT8_7_MO40_NTn1_NTA0_NTB0_NTC0_NTD4_NTM0_NEPBS16_NLCA1_NLCB1_ONLL1_PGR2_PLR1_PKA1_SIA3_SS1_SU8_SUM0_SUS256_SPO1_SRVW0_SSO0_SVW8_SK0_SKXCCM0_TLDS1_ULSGRO0_USL1_UIOFGRO0_USFGROn1_VSn1_VWA8_VWB1_WSGRA2_WSGRB0_WS64_WG32_8_1_WGM32_WGMXCC1_WGMXCCGn1
    SolutionIndex: 218
    SolutionNameMin: Cijk_Alik_Bljk_BBS_BH_Bias_HA_S_SAV_UserArgs_MT256x224x64_MI16x16x1_SN_LDSB1_AFC1_AFEM1_AFEM1_ASEM1_CLR1_CADS0_DTVA0_DTVB0_EPS0_FDSI0_GRPM1_GRVWA4_GRVWB4_GSU1_GSUAMB_GSUC0_GSUWGMRR0_GLS0_ISA942_IU1_K1_LBSPPA1024_LBSPPB128_LBSPPM0_LPA4_LPB4_LPM0_LRVW4_LWPMn1_MIAV0_MIWT8_7_MO40_NTn1_NTA0_NTB0_NTC0_NTD4_NTM0_NEPBS16_NLCA1_NLCB1_ONLL1_PGR2_PLR1_PKA1_SIA3_SS1_SU8_SUM0_SUS256_SPO1_SRVW0_SSO0_SVW8_SK0_SKXCCM0_TLDS1_ULSGRO0_USL1_UIOFGRO0_USFGROn1_VSn1_VWA8_VWB1_WSGRA0_WSGRB0_WS64_WG32_8_1_WGM16_WGMXCC4_WGMXCCGn1
    SolutionIndex: 219
    SolutionNameMin: Cijk_Alik_Bljk_BBS_BH_Bias_HA_S_SAV_UserArgs_MT256x128x64_MI16x16x1_SN_LDSB1_AFC1_AFEM8_AFEM8_ASEM32_CLR1_CADS0_DTVA0_DTVB0_EPS0_FDSI0_GRPM0p50_GRVWA8_GRVWB8_GSU1_GSUAMB_GSUC0_GSUWGMRR0_GLS0_ISA942_IU1_K1_LBSPPA1024_LBSPPB512_LBSPPM0_LPA16_LPB16_LPM0_LRVW8_LWPMn1_MIAV0_MIWT8_4_MO40_NTn1_NTA4_NTB0_NTC0_NTD4_NTM0_NEPBS0_NLCA1_NLCB1_ONLL1_PGR2_PLR1_PKA1_SIA3_SS1_SU8_SUM0_SUS256_SPO0_SRVW0_SSO0_SVW8_SK0_SKXCCM0_TLDS1_ULSGRO0_USL1_UIOFGRO0_USFGROn1_VSn1_VWA8_VWB4_WSGRA0_WSGRB0_WS64_WG32_8_1_WGM40_WGMXCC1_WGMXCCGn1
    SolutionIndex: 220
    SolutionNameMin: Cijk_Alik_Bljk_BBS_BH_Bias_HA_S_SAV_UserArgs_MT192x128x32_MI16x16x1_SN_LDSB1_AFC1_AFEM1_AFEM1_ASEM1_CLR1_CADS0_DTVA0_DTVB0_EPS0_FDSI0_GRPM1_GRVWA4_GRVWB4_GSU1_GSUAMB_GSUC0_GSUWGMRR0_GLS0_ISA942_IU1_K1_LBSPPA128_LBSPPB256_LBSPPM0_LPA4_LPB4_LPM0_LRVW4_LWPM0p50_MIAV0_MIWT6_4_MO40_NTn1_NTA0_NTB0_NTC0_NTD0_NTM0_NEPBS16_NLCA1_NLCB1_ONLL1_PGR2_PLR1_PKA1_SIA3_SS1_SU8_SUM0_SUS64_SPO0_SRVW0_SSO0_SVW2_SK0_SKXCCM0_TLDS1_ULSGRO1_USL1_UIOFGRO0_USFGROn1_VSn1_VWA2_VWB4_WSGRA2_WSGRB2_WS64_WG32_8_1_WGM304_WGMXCC8_WGMXCCG0
    SolutionIndex: 221
    SolutionNameMin: Cijk_Alik_Bljk_BBS_BH_Bias_HA_S_SAV_UserArgs_MT192x128x32_MI16x16x1_SN_LDSB1_AFC1_AFEM1_AFEM1_ASEM1_CLR1_CADS0_DTVA0_DTVB0_EPS0_FDSI0_GRPM1_GRVWA4_GRVWB4_GSU1_GSUAMB_GSUC1_GSUWGMRR1_GLS0_ISA942_IU1_K1_LBSPPA128_LBSPPB256_LBSPPM0_LPA4_LPB4_LPM0_LRVW4_LWPMn1_MIAV0_MIWT6_4_MO40_NTn1_NTA0_NTB0_NTC0_NTD0_NTM0_NEPBS16_NLCA1_NLCB1_ONLL1_PGR2_PLR1_PKA1_SIA3_SS1_SU8_SUM0_SUS64_SPO0_SRVW0_SSO0_SVW2_SK0_SKXCCM0_TLDS1_ULSGRO1_USL1_UIOFGRO0_USFGROn1_VSn1_VWA2_VWB4_WSGRA2_WSGRB2_WS64_WG32_8_1_WGM304_WGMXCC8_WGMXCCG0
    SolutionIndex: 222
    SolutionNameMin: Cijk_Alik_Bljk_BBS_BH_Bias_HA_S_SAV_UserArgs_MT256x192x32_MI16x16x1_SN_LDSB1_AFC1_AFEM1_AFEM1_ASEM1_CLR1_CADS0_DTVA0_DTVB0_EPS0_FDSI0_GRPM0p50_GRVWA4_GRVWB4_GSU1_GSUAMB_GSUC0_GSUWGMRR1_GLS0_ISA942_IU1_K1_LBSPPA512_LBSPPB128_LBSPPM0_LPA4_LPB4_LPM0_LRVW4_LWPMn1_MIAV0_MIWT8_6_MO40_NTn1_NTA0_NTB0_NTC0_NTD4_NTM0_NEPBS16_NLCA1_NLCB1_ONLL1_PGR2_PLR1_PKA1_SIA3_SS1_SU0_SUM0_SUS0_SPO1_SRVW0_SSO0_SVW8_SK0_SKXCCM0_TLDS1_ULSGRO0_USL1_UIOFGRO0_USFGROn1_VSn1_VWA8_VWB2_WSGRA0_WSGRB0_WS64_WG32_8_1_WGM0_WGMXCC8_WGMXCCG304
    SolutionIndex: 223
    SolutionNameMin: Cijk_Alik_Bljk_BBS_BH_Bias_HA_S_SAV_UserArgs_MT256x128x64_MI16x16x1_SN_LDSB1_AFC1_AFEM1_AFEM1_ASEM1_CLR1_CADS0_DTVA0_DTVB0_EPS0_FDSI0_GRPM1_GRVWA8_GRVWB8_GSU1_GSUAMB_GSUC0_GSUWGMRR0_GLS0_ISA942_IU1_K1_LCS0_LBSPPA1024_LBSPPB512_LBSPPM0_LPA16_LPB16_LPM0_LRVW8_LWPMn1_MIAV0_MIWT8_4_MO40_NTn1_NTA0_NTB0_NTC0_NTD7_NTM0_NEPBS8_NLCA1_NLCB1_ONLL1_PGR2_PLR1_PKA1_SIA3_SS1_SU16_SUM0_SUS128_SPO0_SRVW0_SSO0_SVW8_SK0_SKXCCM0_TLDS1_ULSGRO1_USL1_UIOFGRO0_USFGROn1_VSn1_VWA8_VWB4_WSGRA0_WSGRB0_WS64_WG32_8_1_WGM9_WGMXCC8_WGMXCCG304
    SolutionIndex: 224
    SolutionNameMin: Cijk_Alik_Bljk_BBS_BH_Bias_HA_S_SAV_UserArgs_MT128x64x128_MI16x16x1_SN_LDSB1_AFC1_AFEM1_AFEM1_ASEM1_CLR1_CADS0_DTVA0_DTVB0_EPS0_FDSI0_GRPM1_GRVWA8_GRVWB8_GSU1_GSUAMB_GSUC0_GSUWGMRR0_GLS0_ISA942_IU1_K1_LCS0_LBSPPA1024_LBSPPB1024_LBSPPM0_LPA16_LPB16_LPM0_LRVW8_LWPMn1_MIAV0_MIWT4_4_MO40_NTn1_NTA0_NTB0_NTC0_NTD7_NTM0_NEPBS8_NLCA1_NLCB1_ONLL1_PGR2_PLR1_PKA1_SIA3_SS1_SU16_SUM1_SUS256_SPO0_SRVW0_SSO0_SVW4_SK0_SKXCCM0_TLDS1_ULSGRO1_USL1_UIOFGRO0_USFGROn1_VSn1_VWA4_VWB4_WSGRA0_WSGRB0_WS64_WG32_4_2_WGM9_WGMXCC8_WGMXCCG304
    SolutionIndex: 225
    SolutionNameMin: Cijk_Alik_Bljk_BBS_BH_Bias_HA_S_SAV_UserArgs_MT128x128x64_MI16x16x1_SN_LDSB1_AFC1_AFEM1_AFEM1_ASEM1_CLR1_CADS0_DTVA0_DTVB0_EPS0_FDSI0_GRPM1_GRVWA8_GRVWB8_GSU1_GSUAMB_GSUC0_GSUWGMRR0_GLS0_ISA942_IU1_K1_LCS0_LBSPPA512_LBSPPB512_LBSPPM0_LPA16_LPB16_LPM0_LRVW8_LWPMn1_MIAV0_MIWT4_4_MO40_NTn1_NTA0_NTB0_NTC0_NTD7_NTM0_NEPBS8_NLCA1_NLCB1_ONLL1_PGR2_PLR1_PKA1_SIA3_SS1_SU16_SUM0_SUS128_SPO0_SRVW0_SSO0_SVW4_SK0_SKXCCM0_TLDS1_ULSGRO1_USL1_UIOFGRO0_USFGROn1_VSn1_VWA4_VWB4_WSGRA0_WSGRB0_WS64_WG32_8_1_WGM9_WGMXCC8_WGMXCCG304
    SolutionIndex: 226
    SolutionNameMin: Cijk_Alik_Bljk_BBS_BH_Bias_HA_S_SAV_UserArgs_MT128x128x64_MI16x16x1_SN_LDSB1_AFC1_AFEM1_AFEM1_ASEM1_CLR1_CADS0_DTVA0_DTVB0_EPS0_FDSI0_GRPM1_GRVWA8_GRVWB8_GSU1_GSUAMB_GSUC0_GSUWGMRR0_GLS0_ISA942_IU1_K1_LCS0_LBSPPA512_LBSPPB512_LBSPPM0_LPA16_LPB16_LPM0_LRVW8_LWPMn1_MIAV0_MIWT4_4_MO40_NTn1_NTA0_NTB0_NTC0_NTD7_NTM0_NEPBS8_NLCA1_NLCB1_ONLL1_PGR2_PLR1_PKA1_SIA3_SS1_SU16_SUM1_SUS256_SPO0_SRVW0_SSO0_SVW4_SK0_SKXCCM0_TLDS1_ULSGRO1_USL1_UIOFGRO0_USFGROn1_VSn1_VWA4_VWB4_WSGRA0_WSGRB0_WS64_WG32_8_1_WGM8_WGMXCC1_WGMXCCG304
    SolutionIndex: 227
    SolutionNameMin: Cijk_Alik_Bljk_BBS_BH_Bias_HA_S_SAV_UserArgs_MT256x128x64_MI16x16x1_SN_LDSB1_AFC1_AFEM1_AFEM1_ASEM1_CLR1_CADS0_DTVA0_DTVB0_EPS0_FDSI0_GRPM1_GRVWA8_GRVWB8_GSU1_GSUAMB_GSUC0_GSUWGMRR0_GLS0_ISA942_IU1_K1_LCS0_LBSPPA512_LBSPPB1024_LBSPPM0_LPA16_LPB16_LPM0_LRVW8_LWPMn1_MIAV0_MIWT4_8_MO40_NTn1_NTA0_NTB0_NTC0_NTD7_NTM0_NEPBS8_NLCA1_NLCB1_ONLL1_PGR2_PLR1_PKA1_SIA3_SS1_SU16_SUM1_SUS256_SPO0_SRVW0_SSO0_SVW4_SK0_SKXCCM0_TLDS1_ULSGRO1_USL1_UIOFGRO0_USFGROn1_VSn1_VWA4_VWB8_WSGRA0_WSGRB0_WS64_WG64_4_1_WGM9_WGMXCC8_WGMXCCG304
    SolutionIndex: 228
    SolutionNameMin: Cijk_Alik_Bljk_BBS_BH_Bias_HA_S_SAV_UserArgs_MT256x160x64_MI16x16x1_SN_LDSB1_AFC1_AFEM1_AFEM1_ASEM1_CLR1_CADS0_DTVA0_DTVB0_EPS0_FDSI0_GRPM1_GRVWA8_GRVWB8_GSU1_GSUAMB_GSUC0_GSUWGMRR0_GLS0_ISA942_IU1_K1_LCS0_LBSPPA1024_LBSPPB128_LBSPPM0_LPA16_LPB16_LPM0_LRVW8_LWPMn1_MIAV0_MIWT8_5_MO40_NTn1_NTA0_NTB0_NTC0_NTD7_NTM0_NEPBS8_NLCA1_NLCB1_ONLL1_PGR2_PLR1_PKA1_SIA3_SS1_SU16_SUM1_SUS256_SPO0_SRVW0_SSO0_SVW8_SK0_SKXCCM0_TLDS1_ULSGRO1_USL1_UIOFGRO0_USFGROn1_VSn1_VWA8_VWB1_WSGRA0_WSGRB0_WS64_WG32_8_1_WGM4_WGMXCC8_WGMXCCG304
    SolutionIndex: 229
    SolutionNameMin: Cijk_Alik_Bljk_BBS_BH_Bias_HA_S_SAV_UserArgs_MT128x64x128_MI16x16x1_SN_LDSB1_AFC1_AFEM1_AFEM1_ASEM1_CLR1_CADS0_DTVA0_DTVB0_EPS0_FDSI0_GRPM1_GRVWA8_GRVWB8_GSU1_GSUAMB_GSUC0_GSUWGMRR0_GLS0_ISA942_IU1_K1_LCS0_LBSPPA1024_LBSPPB1024_LBSPPM0_LPA16_LPB16_LPM0_LRVW8_LWPMn1_MIAV0_MIWT4_4_MO40_NTn1_NTA0_NTB0_NTC0_NTD7_NTM0_NEPBS8_NLCA1_NLCB1_ONLL1_PGR2_PLR1_PKA1_SIA3_SS1_SU16_SUM0_SUS256_SPO0_SRVW0_SSO0_SVW4_SK0_SKXCCM0_TLDS1_ULSGRO1_USL1_UIOFGRO0_USFGROn1_VSn1_VWA4_VWB4_WSGRA0_WSGRB0_WS64_WG32_4_2_WGM1_WGMXCC1_WGMXCCG304
    SolutionIndex: 230
    SolutionNameMin: Cijk_Alik_Bljk_BBS_BH_Bias_HA_S_SAV_UserArgs_MT320x256x32_MI16x16x1_SN_LDSB1_AFC1_AFEM1_AFEM1_ASEM1_CLR1_CADS0_DTVA0_DTVB0_EPS0_FDSI0_GRPM1_GRVWA4_GRVWB4_GSU1_GSUAMB_GSUC0_GSUWGMRR0_GLS0_ISA942_IU1_K1_LBSPPA256_LBSPPB256_LBSPPM0_LPA4_LPB4_LPM0_LRVW4_LWPMn1_MIAV0_MIWT20_4_MO40_NTn1_NTA0_NTB0_NTC3_NTD6_NTM0_NEPBS0_NLCA1_NLCB1_ONLL1_PGR2_PLR1_PKA1_SIA3_SS1_SU8_SUM0_SUS256_SPO0_SRVW0_SSO0_SVW4_SK0_SKXCCM0_TLDS1_ULSGRO0_USL1_UIOFGRO0_USFGROn1_VSn1_VWA4_VWB4_WSGRA0_WSGRB0_WS64_WG16_16_1_WGM32_WGMXCC1_WGMXCCG0
    SolutionIndex: 231
    SolutionNameMin: Cijk_Alik_Bljk_BBS_BH_Bias_HA_S_SAV_UserArgs_MT256x192x64_MI16x16x1_SN_LDSB1_AFC1_AFEM1_AFEM1_ASEM1_CLR1_CADS0_DTVA0_DTVB0_EPS0_FDSI0_GRPM1_GRVWA8_GRVWB8_GSU1_GSUAMB_GSUC0_GSUWGMRR0_GLS0_ISA942_IU1_K1_LBSPPA1024_LBSPPB256_LBSPPM0_LPA16_LPB16_LPM0_LRVW8_LWPMn1_MIAV0_MIWT8_6_MO40_NTn1_NTA3_NTB0_NTC7_NTD7_NTM0_NEPBS0_NLCA1_NLCB1_ONLL1_PGR2_PLR1_PKA1_SIA3_SS1_SU16_SUM0_SUS256_SPO0_SRVW0_SSO0_SVW8_SK0_SKXCCM0_TLDS1_ULSGRO0_USL1_UIOFGRO0_USFGROn1_VSn1_VWA8_VWB2_WSGRA0_WSGRB2_WS64_WG32_8_1_WGM1_WGMXCC1_WGMXCCGn1
    SolutionIndex: 232
    SolutionNameMin: Cijk_Alik_Bljk_BBS_BH_Bias_HA_S_SAV_UserArgs_MT384x256x32_MI16x16x1_SN_LDSB1_AFC1_AFEM1_AFEM1_ASEM1_CLR1_CADS0_DTVA0_DTVB0_EPS0_FDSI0_GRPM1_GRVWA4_GRVWB4_GSU1_GSUAMB_GSUC0_GSUWGMRR1_GLS0_ISA942_IU1_K1_LBSPPA256_LBSPPB512_LBSPPM0_LPA4_LPB4_LPM0_LRVW4_LWPMn1_MIAV0_MIWT12_8_MO40_NTn1_NTA0_NTB0_NTC0_NTD7_NTM0_NEPBS0_NLCA1_NLCB1_ONLL1_PGR2_PLR1_PKA1_SIA3_SS1_SU0_SUM0_SUS0_SPO1_SRVW0_SSO0_SVW4_SK0_SKXCCM0_TLDS1_ULSGRO1_USL1_UIOFGRO0_USFGROn1_VSn1_VWA4_VWB8_WSGRA2_WSGRB0_WS64_WG32_8_1_WGM32_WGMXCC1_WGMXCCGn1
    SolutionIndex: 233
    SolutionNameMin: Cijk_Alik_Bljk_BBS_BH_Bias_HA_S_SAV_UserArgs_MT256x192x64_MI16x16x1_SN_LDSB1_AFC1_AFEM1_AFEM1_ASEM1_CLR1_CADS0_DTVA0_DTVB0_EPS0_FDSI0_GRPM1_GRVWA8_GRVWB8_GSU1_GSUAMB_GSUC0_GSUWGMRR0_GLS0_ISA942_IU1_K1_LBSPPA1024_LBSPPB256_LBSPPM0_LPA16_LPB16_LPM0_LRVW8_LWPMn1_MIAV0_MIWT8_6_MO40_NTn1_NTA1_NTB0_NTC0_NTD6_NTM0_NEPBS0_NLCA1_NLCB1_ONLL1_PGR2_PLR1_PKA1_SIA3_SS1_SU16_SUM0_SUS128_SPO0_SRVW0_SSO0_SVW8_SK0_SKXCCM0_TLDS1_ULSGRO1_USL1_UIOFGRO0_USFGRO1_VSn1_VWA8_VWB2_WSGRA0_WSGRB0_WS64_WG32_8_1_WGM1_WGMXCC1_WGMXCCGn1
    SolutionIndex: 234
    SolutionNameMin: Cijk_Alik_Bljk_BBS_BH_Bias_HA_S_SAV_UserArgs_MT256x192x64_MI16x16x1_SN_LDSB1_AFC1_AFEM1_AFEM1_ASEM1_CLR1_CADS0_DTVA0_DTVB0_EPS0_FDSI0_GRPM1_GRVWA8_GRVWB8_GSU1_GSUAMB_GSUC0_GSUWGMRR1_GLS0_ISA942_IU1_K1_LBSPPA1024_LBSPPB256_LBSPPM0_LPA16_LPB16_LPM0_LRVW8_LWPMn1_MIAV0_MIWT8_6_MO40_NTn1_NTA0_NTB0_NTC0_NTD5_NTM0_NEPBS0_NLCA1_NLCB1_ONLL1_PGR2_PLR1_PKA1_SIA3_SS1_SU8_SUM1_SUS256_SPO1_SRVW0_SSO0_SVW8_SK0_SKXCCM0_TLDS1_ULSGRO1_USL1_UIOFGRO0_USFGRO1_VSn1_VWA8_VWB2_WSGRA2_WSGRB2_WS64_WG32_8_1_WGM32_WGMXCC1_WGMXCCGn1
    SolutionIndex: 235
    SolutionNameMin: Cijk_Alik_Bljk_BBS_BH_Bias_HA_S_SAV_UserArgs_MT256x192x64_MI16x16x1_SN_LDSB1_AFC1_AFEM1_AFEM1_ASEM1_CLR1_CADS0_DTVA0_DTVB0_EPS0_FDSI0_GRPM1_GRVWA8_GRVWB8_GSU1_GSUAMB_GSUC0_GSUWGMRR0_GLS0_ISA942_IU1_K1_LBSPPA1024_LBSPPB256_LBSPPM0_LPA16_LPB16_LPM0_LRVW8_LWPMn1_MIAV0_MIWT8_6_MO40_NTn1_NTA0_NTB0_NTC0_NTD4_NTM0_NEPBS0_NLCA1_NLCB1_ONLL1_PGR2_PLR1_PKA1_SIA3_SS1_SU0_SUM0_SUS0_SPO1_SRVW0_SSO0_SVW8_SK0_SKXCCM0_TLDS1_ULSGRO0_USL1_UIOFGRO0_USFGRO1_VSn1_VWA8_VWB2_WSGRA2_WSGRB2_WS64_WG32_8_1_WGM4_WGMXCC1_WGMXCCGn1
    SolutionIndex: 236
    SolutionNameMin: Cijk_Alik_Bljk_BBS_BH_Bias_HA_S_SAV_UserArgs_MT192x448x32_MI16x16x1_SN_LDSB1_AFC1_AFEM1_AFEM1_ASEM1_CLR1_CADS0_DTVA0_DTVB0_EPS0_FDSI0_GRPM1_GRVWA4_GRVWB4_GSU1_GSUAMB_GSUC0_GSUWGMRR0_GLS0_ISA942_IU1_K1_LBSPPA256_LBSPPB128_LBSPPM0_LPA4_LPB4_LPM0_LRVW4_LWPMn1_MIAV0_MIWT12_7_MO40_NTn1_NTA0_NTB0_NTC1_NTD7_NTM0_NEPBS0_NLCA1_NLCB1_ONLL1_PGR2_PLR1_PKA1_SIA3_SS1_SU8_SUM0_SUS64_SPO0_SRVW0_SSO0_SVW4_SK0_SKXCCM0_TLDS1_ULSGRO1_USL1_UIOFGRO0_USFGROn1_VSn1_VWA4_VWB1_WSGRA2_WSGRB2_WS64_WG16_16_1_WGM4_WGMXCC8_WGMXCCG304
    SolutionIndex: 237
    SolutionNameMin: Cijk_Alik_Bljk_BBS_BH_Bias_HA_S_SAV_UserArgs_MT256x192x64_MI16x16x1_SN_LDSB1_AFC1_AFEM1_AFEM1_ASEM1_CLR1_CADS0_DTVA0_DTVB0_EPS0_FDSI0_GRPM1_GRVWA8_GRVWB8_GSU1_GSUAMB_GSUC0_GSUWGMRR0_GLS0_ISA942_IU1_K1_LBSPPA1024_LBSPPB256_LBSPPM0_LPA16_LPB16_LPM0_LRVW8_LWPMn1_MIAV0_MIWT8_6_MO40_NTn1_NTA0_NTB0_NTC0_NTD0_NTM0_NEPBS0_NLCA1_NLCB1_ONLL1_PGR2_PLR1_PKA1_SIA3_SS1_SU0_SUM0_SUS0_SPO0_SRVW0_SSO0_SVW8_SK0_SKXCCM0_TLDS1_ULSGRO0_USL1_UIOFGRO0_USFGRO1_VSn1_VWA8_VWB2_WSGRA0_WSGRB0_WS64_WG32_8_1_WGM1_WGMXCC1_WGMXCCGn1
    SolutionIndex: 238
    SolutionNameMin: Cijk_Alik_Bljk_BBS_BH_Bias_HA_S_SAV_UserArgs_MT256x192x64_MI16x16x1_SN_LDSB1_AFC1_AFEM1_AFEM1_ASEM1_CLR1_CADS0_DTVA0_DTVB0_EPS0_FDSI0_GRPM1_GRVWA8_GRVWB8_GSU1_GSUAMB_GSUC0_GSUWGMRR0_GLS0_ISA942_IU1_K1_LBSPPA1024_LBSPPB256_LBSPPM0_LPA16_LPB16_LPM0_LRVW8_LWPMn1_MIAV0_MIWT8_6_MO40_NTn1_NTA0_NTB0_NTC3_NTD6_NTM0_NEPBS0_NLCA1_NLCB1_ONLL1_PGR2_PLR1_PKA1_SIA3_SS1_SU8_SUM0_SUS256_SPO1_SRVW0_SSO4_SVW8_SK0_SKXCCM0_TLDS1_ULSGRO1_USL1_UIOFGRO0_USFGROn1_VSn1_VWA8_VWB2_WSGRA2_WSGRB2_WS64_WG32_8_1_WGM32_WGMXCC1_WGMXCCG304
    SolutionIndex: 239
    SolutionNameMin: Cijk_Alik_Bljk_BBS_BH_Bias_HA_S_SAV_UserArgs_MT256x384x32_MI16x16x1_SN_LDSB1_AFC1_AFEM1_AFEM1_ASEM1_CLR1_CADS0_DTVA0_DTVB0_EPS0_FDSI0_GRPM1_GRVWA4_GRVWB4_GSU1_GSUAMB_GSUC1_GSUWGMRR0_GLS0_ISA942_IU1_K1_LBSPPA512_LBSPPB256_LBSPPM0_LPA4_LPB4_LPM0_LRVW4_LWPMn1_MIAV0_MIWT8_12_MO40_NTn1_NTA0_NTB0_NTC0_NTD6_NTM0_NEPBS16_NLCA1_NLCB1_ONLL1_PGR2_PLR1_PKA1_SIA3_SS1_SU8_SUM1_SUS64_SPO1_SRVW0_SSO0_SVW8_SK0_SKXCCM0_TLDS1_ULSGRO1_USL1_UIOFGRO0_USFGROn1_VSn1_VWA8_VWB4_WSGRA0_WSGRB2_WS64_WG32_8_1_WGM4_WGMXCC8_WGMXCCG304
    SolutionIndex: 240
    SolutionNameMin: Cijk_Alik_Bljk_BBS_BH_Bias_HA_S_SAV_UserArgs_MT192x256x64_MI16x16x1_SN_LDSB1_AFC1_AFEM16_AFEM16_ASEM16_CLR1_CADS0_DTVA0_DTVB0_EPS0_FDSI0_GRPM1_GRVWA8_GRVWB8_GSU1_GSUAMB_GSUC0_GSUWGMRR0_GLS0_ISA942_IU1_K1_LBSPPA256_LBSPPB1024_LBSPPM0_LPA16_LPB16_LPM0_LRVW8_LWPMn1_MIAV0_MIWT6_8_MO40_NTn1_NTA0_NTB0_NTC0_NTD0_NTM0_NEPBS8_NLCA1_NLCB1_ONLL0_PGR2_PLR1_PKA1_SIA3_SS1_SU16_SUM1_SUS256_SPO0_SRVW0_SSO0_SVW2_SK0_SKXCCM0_TLDS1_ULSGRO1_USL1_UIOFGRO0_USFGROn1_VSn1_VWA2_VWB8_WSGRA0_WSGRB0_WS64_WG32_8_1_WGM32_WGMXCC1_WGMXCCGn1
    SolutionIndex: 241
    SolutionNameMin: Cijk_Alik_Bljk_BBS_BH_Bias_HA_S_SAV_UserArgs_MT192x256x64_MI16x16x1_SN_LDSB1_AFC1_AFEM16_AFEM16_ASEM16_CLR1_CADS0_DTVA0_DTVB0_EPS0_FDSI0_GRPM1_GRVWA8_GRVWB8_GSU1_GSUAMB_GSUC0_GSUWGMRR0_GLS0_ISA942_IU1_K1_LBSPPA256_LBSPPB1024_LBSPPM0_LPA16_LPB16_LPM0_LRVW8_LWPMn1_MIAV0_MIWT6_8_MO40_NTn1_NTA0_NTB0_NTC0_NTD0_NTM0_NEPBS8_NLCA1_NLCB1_ONLL0_PGR2_PLR1_PKA1_SIA3_SS1_SU0_SUM0_SUS0_SPO0_SRVW0_SSO0_SVW2_SK0_SKXCCM0_TLDS1_ULSGRO1_USL1_UIOFGRO0_USFGROn1_VSn1_VWA2_VWB8_WSGRA0_WSGRB0_WS64_WG32_8_1_WGM32_WGMXCC1_WGMXCCGn1
    SolutionIndex: 242
    SolutionNameMin: Cijk_Alik_Bljk_BBS_BH_Bias_HA_S_SAV_UserArgs_MT256x192x64_MI16x16x1_SN_LDSB1_AFC1_AFEM1_AFEM1_ASEM1_CLR1_CADS0_DTVA0_DTVB0_EPS0_FDSI0_GRPM1_GRVWA8_GRVWB8_GSU1_GSUAMB_GSUC0_GSUWGMRR0_GLS0_ISA942_IU1_K1_LBSPPA1024_LBSPPB256_LBSPPM0_LPA16_LPB16_LPM0_LRVW8_LWPMn1_MIAV0_MIWT8_6_MO40_NTn1_NTA1_NTB2_NTC6_NTD6_NTM0_NEPBS0_NLCA1_NLCB1_ONLL2_PGR2_PLR1_PKA1_SIA3_SS1_SU0_SUM0_SUS0_SPO0_SRVW0_SSO0_SVW8_SK0_SKXCCM0_TLDS1_ULSGRO0_USL1_UIOFGRO0_USFGROn1_VSn1_VWA8_VWB2_WSGRA0_WSGRB0_WS64_WG32_8_1_WGM0_WGMXCC1_WGMXCCGn1
    SolutionIndex: 243
    SolutionNameMin: Cijk_Alik_Bljk_BBS_BH_Bias_HA_S_SAV_UserArgs_MT256x224x64_MI16x16x1_SN_LDSB1_AFC1_AFEM1_AFEM1_ASEM1_CLR1_CADS0_DTVA0_DTVB0_EPS0_FDSI0_GRPM0p27_GRVWA2_GRVWB2_GSU1_GSUAMB_GSUC0_GSUWGMRR0_GLS0_ISA942_IU1_K1_LBSPPA1024_LBSPPB128_LBSPPM0_LPA4_LPB4_LPM0_LRVW4_LWPM0p40_MIAV0_MIWT8_7_MO40_NTn1_NTA0_NTB0_NTC4_NTD4_NTM0_NEPBS0_NLCA1_NLCB1_ONLL1_PGR2_PLR1_PKA1_SIA3_SS1_SU8_SUM0_SUS128_SPO0_SRVW0_SSO4_SVW8_SK0_SKXCCM0_TLDS2_ULSGRO0_USL1_UIOFGRO0_USFGROn1_VSn1_VWA8_VWB1_WSGRA0_WSGRB2_WS64_WG32_8_1_WGM1_WGMXCC4_WGMXCCG4
    SolutionIndex: 244
    SolutionNameMin: Cijk_Alik_Bljk_BBS_BH_Bias_HA_S_SAV_UserArgs_MT192x256x64_MI16x16x1_SN_LDSB1_AFC1_AFEM1_AFEM1_ASEM1_CLR1_CADS0_DTVA0_DTVB0_EPS0_FDSI0_GRPM1_GRVWA8_GRVWB8_GSU1_GSUAMB_GSUC0_GSUWGMRR1_GLS0_ISA942_IU1_K1_LBSPPA256_LBSPPB1024_LBSPPM0_LPA16_LPB16_LPM0_LRVW8_LWPMn1_MIAV0_MIWT6_8_MO40_NTn1_NTA0_NTB0_NTC0_NTD0_NTM0_NEPBS0_NLCA1_NLCB1_ONLL2_PGR2_PLR1_PKA1_SIA3_SS0_SU16_SUM0_SUS1024_SPO0_SRVW0_SSO0_SVW8_SK0_SKXCCM0_TLDS1_ULSGRO1_USL1_UIOFGRO0_USFGROn1_VSn1_VWA2_VWB8_WSGRA0_WSGRB0_WS64_WG32_8_1_WGM190_WGMXCC1_WGMXCCGn1
    SolutionIndex: 245
    SolutionNameMin: Cijk_Alik_Bljk_BBS_BH_Bias_HA_S_SAV_UserArgs_MT256x192x64_MI16x16x1_SN_LDSB1_AFC1_AFEM1_AFEM1_ASEM1_CLR1_CADS0_DTVA0_DTVB0_EPS0_FDSI0_GRPM1_GRVWA8_GRVWB8_GSU1_GSUAMB_GSUC0_GSUWGMRR1_GLS0_ISA942_IU1_K1_LBSPPA1024_LBSPPB256_LBSPPM0_LPA16_LPB16_LPM0_LRVW8_LWPMn1_MIAV0_MIWT8_6_MO40_NTn1_NTA3_NTB1_NTC4_NTD4_NTM0_NEPBS4_NLCA1_NLCB1_ONLL2_PGR2_PLR1_PKA1_SIA3_SS1_SU16_SUM2_SUS1024_SPO0_SRVW0_SSO0_SVW8_SK0_SKXCCM0_TLDS2_ULSGRO0_USL1_UIOFGRO0_USFGROn1_VSn1_VWA8_VWB2_WSGRA0_WSGRB2_WS64_WG32_8_1_WGM1_WGMXCC1_WGMXCCGn1
    SolutionIndex: 246
    SolutionNameMin: Cijk_Alik_Bljk_BBS_BH_Bias_HA_S_SAV_UserArgs_MT192x256x64_MI16x16x1_SN_LDSB1_AFC1_AFEM1_AFEM1_ASEM1_CLR1_CADS0_DTVA0_DTVB0_EPS0_FDSI0_GRPM1_GRVWA8_GRVWB8_GSU1_GSUAMB_GSUC1_GSUWGMRR0_GLS0_ISA942_IU1_K1_LBSPPA256_LBSPPB1024_LBSPPM0_LPA16_LPB16_LPM0_LRVW8_LWPMn1_MIAV0_MIWT6_8_MO40_NTn1_NTA0_NTB0_NTC4_NTD4_NTM0_NEPBS0_NLCA1_NLCB1_ONLL1_PGR2_PLR1_PKA1_SIA3_SS0_SU4_SUM1_SUS256_SPO0_SRVW0_SSO0_SVW8_SK0_SKXCCM0_TLDS2_ULSGRO1_USL1_UIOFGRO0_USFGROn1_VSn1_VWA2_VWB8_WSGRA0_WSGRB0_WS64_WG32_8_1_WGM6_WGMXCC4_WGMXCCGn1
    SolutionIndex: 247
    SolutionNameMin: Cijk_Alik_Bljk_BBS_BH_Bias_HA_S_SAV_UserArgs_MT256x224x64_MI16x16x1_SN_LDSB1_AFC1_AFEM1_AFEM1_ASEM1_CLR1_CADS0_DTVA0_DTVB0_EPS0_FDSI0_GRPM1_GRVWA2_GRVWB2_GSU1_GSUAMB_GSUC1_GSUWGMRR0_GLS0_ISA942_IU1_K1_LBSPPA1024_LBSPPB128_LBSPPM0_LPA4_LPB4_LPM0_LRVW4_LWPM0p40_MIAV0_MIWT8_7_MO40_NTn1_NTA0_NTB0_NTC0_NTD4_NTM0_NEPBS6_NLCA1_NLCB1_ONLL1_PGR2_PLR1_PKA1_SIA3_SS1_SU32_SUM0_SUS128_SPO1_SRVW0_SSO1_SVW8_SK0_SKXCCM0_TLDS1_ULSGRO0_USL1_UIOFGRO0_USFGROn1_VSn1_VWA8_VWB1_WSGRA0_WSGRB1_WS64_WG32_8_1_WGM12_WGMXCC4_WGMXCCG0
    SolutionIndex: 248
    SolutionNameMin: Cijk_Alik_Bljk_BBS_BH_Bias_HA_S_SAV_UserArgs_MT256x224x64_MI16x16x1_SN_LDSB1_AFC1_AFEM1_AFEM1_ASEM1_CLR1_CADS0_DTVA0_DTVB0_EPS0_FDSI0_GRPM0p30_GRVWA2_GRVWB8_GSU1_GSUAMB_GSUC0_GSUWGMRR1_GLS0_ISA942_IU1_K1_LBSPPA1024_LBSPPB128_LBSPPM0_LPA4_LPB8_LPM0_LRVW4_LWPMn1_MIAV0_MIWT8_7_MO40_NTn1_NTA0_NTB0_NTC4_NTD4_NTM0_NEPBS0_NLCA1_NLCB1_ONLL0_PGR2_PLR1_PKA1_SIA3_SS1_SU0_SUM0_SUS0_SPO1_SRVW0_SSO3_SVW8_SK0_SKXCCM0_TLDS1_ULSGRO0_USL1_UIOFGRO0_USFGROn1_VSn1_VWA8_VWB1_WSGRA0_WSGRB0_WS64_WG32_8_1_WGM4_WGMXCC1_WGMXCCGn1
    SolutionIndex: 249
    SolutionNameMin: Cijk_Alik_Bljk_BBS_BH_Bias_HA_S_SAV_UserArgs_MT256x224x64_MI16x16x1_SN_LDSB1_AFC1_AFEM1_AFEM1_ASEM1_CLR1_CADS0_DTVA0_DTVB0_EPS0_FDSI0_GRPM0p26_GRVWA2_GRVWB2_GSU1_GSUAMB_GSUC0_GSUWGMRR1_GLS0_ISA942_IU1_K1_LBSPPA1024_LBSPPB128_LBSPPM0_LPA4_LPB4_LPM0_LRVW4_LWPMn1_MIAV0_MIWT8_7_MO40_NTn1_NTA0_NTB0_NTC4_NTD4_NTM0_NEPBS0_NLCA1_NLCB1_ONLL0_PGR2_PLR1_PKA1_SIA3_SS1_SU8_SUM2_SUS256_SPO0_SRVW0_SSO0_SVW8_SK0_SKXCCM0_TLDS1_ULSGRO0_USL1_UIOFGRO0_USFGROn1_VSn1_VWA8_VWB1_WSGRA0_WSGRB0_WS64_WG32_8_1_WGM16_WGMXCC2_WGMXCCGn1
    SolutionIndex: 250
    SolutionNameMin: Cijk_Alik_Bljk_BBS_BH_Bias_HA_S_SAV_UserArgs_MT256x224x64_MI16x16x1_SN_LDSB1_AFC1_AFEM1_AFEM1_ASEM1_CLR1_CADS0_DTVA0_DTVB0_EPS0_FDSI0_GRPM1_GRVWA2_GRVWB8_GSU1_GSUAMB_GSUC0_GSUWGMRR1_GLS0_ISA942_IU1_K1_LBSPPA1024_LBSPPB128_LBSPPM0_LPA4_LPB8_LPM0_LRVW4_LWPMn1_MIAV0_MIWT8_7_MO40_NTn1_NTA0_NTB0_NTC4_NTD4_NTM0_NEPBS0_NLCA1_NLCB1_ONLL0_PGR2_PLR1_PKA1_SIA3_SS1_SU16_SUM0_SUS128_SPO0_SRVW0_SSO0_SVW8_SK0_SKXCCM0_TLDS2_ULSGRO0_USL1_UIOFGRO0_USFGROn1_VSn1_VWA8_VWB1_WSGRA0_WSGRB1_WS64_WG32_8_1_WGM1_WGMXCC1_WGMXCCGn1
    SolutionIndex: 251
    SolutionNameMin: Cijk_Alik_Bljk_BBS_BH_Bias_HA_S_SAV_UserArgs_MT256x192x64_MI16x16x1_SN_LDSB1_AFC1_AFEM16_AFEM16_ASEM16_CLR1_CADS0_DTVA0_DTVB0_EPS0_FDSI0_GRPM1_GRVWA8_GRVWB8_GSU1_GSUAMB_GSUC0_GSUWGMRR0_GLS0_ISA942_IU1_K1_LBSPPA1024_LBSPPB256_LBSPPM0_LPA16_LPB16_LPM0_LRVW8_LWPMn1_MIAV0_MIWT8_6_MO40_NTn1_NTA0_NTB0_NTC0_NTD0_NTM0_NEPBS8_NLCA1_NLCB1_ONLL1_PGR2_PLR1_PKA1_SIA3_SS1_SU8_SUM1_SUS128_SPO0_SRVW0_SSO0_SVW8_SK0_SKXCCM0_TLDS1_ULSGRO0_USL1_UIOFGRO0_USFGROn1_VSn1_VWA8_VWB2_WSGRA0_WSGRB0_WS64_WG32_8_1_WGM32_WGMXCC1_WGMXCCGn1
    SolutionIndex: 252
    SolutionNameMin: Cijk_Alik_Bljk_BBS_BH_Bias_HA_S_SAV_UserArgs_MT256x256x32_MI16x16x1_SN_LDSB1_AFC1_AFEM16_AFEM16_ASEM16_CLR1_CADS0_DTVA0_DTVB0_EPS0_FDSI0_GRPM1_GRVWA4_GRVWB4_GSU1_GSUAMB_GSUC0_GSUWGMRR0_GLS0_ISA942_IU1_K1_LBSPPA512_LBSPPB512_LBSPPM0_LPA4_LPB4_LPM0_LRVW4_LWPMn1_MIAV0_MIWT8_8_MO40_NTn1_NTA0_NTB0_NTC0_NTD0_NTM0_NEPBS8_NLCA1_NLCB1_ONLL1_PGR2_PLR1_PKA1_SIA3_SS1_SU0_SUM0_SUS0_SPO0_SRVW0_SSO0_SVW8_SK0_SKXCCM0_TLDS1_ULSGRO1_USL1_UIOFGRO0_USFGROn1_VSn1_VWA8_VWB8_WSGRA0_WSGRB0_WS64_WG32_8_1_WGM32_WGMXCC1_WGMXCCGn1
    SolutionIndex: 253
    SolutionNameMin: Cijk_Alik_Bljk_BBS_BH_Bias_HA_S_SAV_UserArgs_MT256x384x32_MI16x16x1_SN_LDSB1_AFC1_AFEM16_AFEM16_ASEM16_CLR1_CADS0_DTVA0_DTVB0_EPS0_FDSI0_GRPM1_GRVWA4_GRVWB4_GSU1_GSUAMB_GSUC0_GSUWGMRR0_GLS0_ISA942_IU1_K1_LBSPPA512_LBSPPB256_LBSPPM0_LPA4_LPB4_LPM0_LRVW4_LWPMn1_MIAV0_MIWT8_12_MO40_NTn1_NTA0_NTB0_NTC0_NTD0_NTM0_NEPBS8_NLCA1_NLCB1_ONLL1_PGR2_PLR1_PKA1_SIA3_SS1_SU0_SUM0_SUS0_SPO0_SRVW0_SSO0_SVW8_SK0_SKXCCM0_TLDS1_ULSGRO0_USL1_UIOFGRO0_USFGROn1_VSn1_VWA8_VWB4_WSGRA2_WSGRB0_WS64_WG32_8_1_WGM32_WGMXCC1_WGMXCCGn1
    SolutionIndex: 254
    SolutionNameMin: Cijk_Alik_Bljk_BBS_BH_Bias_HA_S_SAV_UserArgs_MT256x224x64_MI16x16x1_SN_LDSB1_AFC1_AFEM16_AFEM16_ASEM16_CLR1_CADS0_DTVA0_DTVB0_EPS0_FDSI0_GRPM1_GRVWA4_GRVWB4_GSU1_GSUAMB_GSUC0_GSUWGMRR0_GLS0_ISA942_IU1_K1_LBSPPA1024_LBSPPB128_LBSPPM0_LPA4_LPB4_LPM0_LRVW4_LWPMn1_MIAV0_MIWT8_7_MO40_NTn1_NTA0_NTB0_NTC0_NTD0_NTM0_NEPBS8_NLCA1_NLCB1_ONLL1_PGR2_PLR1_PKA1_SIA3_SS1_SU8_SUM1_SUS128_SPO0_SRVW0_SSO0_SVW8_SK0_SKXCCM0_TLDS1_ULSGRO1_USL1_UIOFGRO0_USFGROn1_VSn1_VWA8_VWB1_WSGRA0_WSGRB2_WS64_WG32_8_1_WGM6_WGMXCC1_WGMXCCGn1
    SolutionIndex: 255
    SolutionNameMin: Cijk_Alik_Bljk_BBS_BH_Bias_HA_S_SAV_UserArgs_MT256x192x64_MI16x16x1_SN_LDSB1_AFC1_AFEM16_AFEM16_ASEM16_CLR1_CADS0_DTVA0_DTVB0_EPS0_FDSI0_GRPM1_GRVWA8_GRVWB8_GSU1_GSUAMB_GSUC0_GSUWGMRR0_GLS0_ISA942_IU1_K1_LBSPPA1024_LBSPPB256_LBSPPM0_LPA16_LPB16_LPM0_LRVW8_LWPMn1_MIAV0_MIWT8_6_MO40_NTn1_NTA0_NTB0_NTC0_NTD0_NTM0_NEPBS8_NLCA1_NLCB1_ONLL1_PGR2_PLR1_PKA1_SIA3_SS1_SU8_SUM1_SUS128_SPO0_SRVW0_SSO0_SVW8_SK0_SKXCCM0_TLDS1_ULSGRO0_USL1_UIOFGRO0_USFGROn1_VSn1_VWA8_VWB2_WSGRA0_WSGRB0_WS64_WG32_8_1_WGM1_WGMXCC1_WGMXCCGn1
    SolutionIndex: 256
    SolutionNameMin: Cijk_Alik_Bljk_BBS_BH_Bias_HA_S_SAV_UserArgs_MT192x256x64_MI16x16x1_SN_LDSB1_AFC1_AFEM16_AFEM16_ASEM16_CLR1_CADS0_DTVA0_DTVB0_EPS0_FDSI0_GRPM1_GRVWA8_GRVWB8_GSU1_GSUAMB_GSUC0_GSUWGMRR0_GLS0_ISA942_IU1_K1_LBSPPA512_LBSPPB512_LBSPPM0_LPA16_LPB16_LPM0_LRVW8_LWPMn1_MIAV0_MIWT12_4_MO40_NTn1_NTA0_NTB0_NTC0_NTD0_NTM0_NEPBS8_NLCA1_NLCB1_ONLL1_PGR2_PLR1_PKA1_SIA3_SS1_SU8_SUM1_SUS256_SPO0_SRVW0_SSO0_SVW4_SK0_SKXCCM0_TLDS1_ULSGRO0_USL1_UIOFGRO0_USFGROn1_VSn1_VWA4_VWB4_WSGRA2_WSGRB0_WS64_WG16_16_1_WGM32_WGMXCC1_WGMXCCGn1
    SolutionIndex: 257
    SolutionNameMin: Cijk_Alik_Bljk_BBS_BH_Bias_HA_S_SAV_UserArgs_MT256x192x64_MI16x16x1_SN_LDSB1_AFC1_AFEM16_AFEM16_ASEM16_CLR1_CADS0_DTVA0_DTVB0_EPS0_FDSI0_GRPM1_GRVWA8_GRVWB8_GSU1_GSUAMB_GSUC0_GSUWGMRR0_GLS0_ISA942_IU1_K1_LBSPPA1024_LBSPPB256_LBSPPM0_LPA16_LPB16_LPM0_LRVW8_LWPMn1_MIAV0_MIWT8_6_MO40_NTn1_NTA0_NTB0_NTC0_NTD0_NTM0_NEPBS8_NLCA1_NLCB1_ONLL1_PGR2_PLR1_PKA1_SIA3_SS1_SU16_SUM1_SUS128_SPO0_SRVW0_SSO0_SVW8_SK0_SKXCCM0_TLDS1_ULSGRO0_USL1_UIOFGRO0_USFGROn1_VSn1_VWA8_VWB2_WSGRA0_WSGRB0_WS64_WG32_8_1_WGM1_WGMXCC1_WGMXCCGn1
    SolutionIndex: 258
    SolutionNameMin: Cijk_Alik_Bljk_BBS_BH_Bias_HA_S_SAV_UserArgs_MT192x256x64_MI16x16x1_SN_LDSB1_AFC1_AFEM16_AFEM16_ASEM16_CLR1_CADS0_DTVA0_DTVB0_EPS0_FDSI0_GRPM1_GRVWA8_GRVWB8_GSU1_GSUAMB_GSUC0_GSUWGMRR0_GLS0_ISA942_IU1_K1_LBSPPA256_LBSPPB1024_LBSPPM0_LPA16_LPB16_LPM0_LRVW8_LWPMn1_MIAV0_MIWT6_8_MO40_NTn1_NTA0_NTB0_NTC0_NTD0_NTM0_NEPBS8_NLCA1_NLCB1_ONLL1_PGR2_PLR1_PKA1_SIA3_SS1_SU32_SUM1_SUS256_SPO0_SRVW0_SSO0_SVW2_SK0_SKXCCM0_TLDS1_ULSGRO1_USL1_UIOFGRO0_USFGROn1_VSn1_VWA2_VWB8_WSGRA0_WSGRB0_WS64_WG32_8_1_WGM32_WGMXCC1_WGMXCCGn1
    SolutionIndex: 259
    SolutionNameMin: Cijk_Alik_Bljk_BBS_BH_Bias_HA_S_SAV_UserArgs_MT384x256x32_MI16x16x1_SN_LDSB1_AFC1_AFEM16_AFEM16_ASEM16_CLR1_CADS0_DTVA0_DTVB0_EPS0_FDSI0_GRPM1_GRVWA4_GRVWB4_GSU1_GSUAMB_GSUC0_GSUWGMRR0_GLS0_ISA942_IU1_K1_LBSPPA256_LBSPPB512_LBSPPM0_LPA4_LPB4_LPM0_LRVW4_LWPMn1_MIAV0_MIWT12_8_MO40_NTn1_NTA0_NTB0_NTC0_NTD0_NTM0_NEPBS8_NLCA1_NLCB1_ONLL1_PGR2_PLR1_PKA1_SIA3_SS1_SU0_SUM0_SUS0_SPO0_SRVW0_SSO0_SVW4_SK0_SKXCCM0_TLDS1_ULSGRO1_USL1_UIOFGRO0_USFGROn1_VSn1_VWA4_VWB8_WSGRA0_WSGRB0_WS64_WG32_8_1_WGM32_WGMXCC1_WGMXCCGn1
    SolutionIndex: 260
    SolutionNameMin: Cijk_Alik_Bljk_BBS_BH_Bias_HA_S_SAV_UserArgs_MT384x256x32_MI16x16x1_SN_LDSB1_AFC1_AFEM16_AFEM16_ASEM16_CLR1_CADS0_DTVA0_DTVB0_EPS0_FDSI0_GRPM1_GRVWA4_GRVWB4_GSU1_GSUAMB_GSUC0_GSUWGMRR0_GLS0_ISA942_IU1_K1_LBSPPA256_LBSPPB512_LBSPPM0_LPA4_LPB4_LPM0_LRVW4_LWPMn1_MIAV0_MIWT12_8_MO40_NTn1_NTA0_NTB0_NTC0_NTD0_NTM0_NEPBS8_NLCA1_NLCB1_ONLL1_PGR2_PLR1_PKA1_SIA3_SS1_SU8_SUM1_SUS64_SPO0_SRVW0_SSO0_SVW4_SK0_SKXCCM0_TLDS1_ULSGRO1_USL1_UIOFGRO0_USFGROn1_VSn1_VWA4_VWB8_WSGRA2_WSGRB0_WS64_WG32_8_1_WGM32_WGMXCC1_WGMXCCGn1
    SolutionIndex: 261
    SolutionNameMin: Cijk_Alik_Bljk_BBS_BH_Bias_HA_S_SAV_UserArgs_MT192x256x64_MI16x16x1_SN_LDSB1_AFC1_AFEM16_AFEM16_ASEM16_CLR1_CADS0_DTVA0_DTVB0_EPS0_FDSI0_GRPM1_GRVWA8_GRVWB8_GSU1_GSUAMB_GSUC0_GSUWGMRR0_GLS0_ISA942_IU1_K1_LBSPPA256_LBSPPB1024_LBSPPM0_LPA16_LPB16_LPM0_LRVW8_LWPMn1_MIAV0_MIWT6_8_MO40_NTn1_NTA0_NTB0_NTC0_NTD0_NTM0_NEPBS8_NLCA1_NLCB1_ONLL1_PGR2_PLR1_PKA1_SIA3_SS1_SU8_SUM1_SUS256_SPO0_SRVW0_SSO0_SVW2_SK0_SKXCCM0_TLDS1_ULSGRO1_USL1_UIOFGRO0_USFGROn1_VSn1_VWA2_VWB8_WSGRA0_WSGRB0_WS64_WG32_8_1_WGM32_WGMXCC1_WGMXCCGn1
    SolutionIndex: 262
    SolutionNameMin: Cijk_Alik_Bljk_BBS_BH_Bias_HA_S_SAV_UserArgs_MT192x256x64_MI16x16x1_SN_LDSB1_AFC1_AFEM16_AFEM16_ASEM16_CLR1_CADS0_DTVA0_DTVB0_EPS0_FDSI0_GRPM1_GRVWA8_GRVWB8_GSU1_GSUAMB_GSUC0_GSUWGMRR0_GLS0_ISA942_IU1_K1_LBSPPA256_LBSPPB1024_LBSPPM0_LPA16_LPB16_LPM0_LRVW8_LWPMn1_MIAV0_MIWT6_8_MO40_NTn1_NTA0_NTB0_NTC0_NTD0_NTM0_NEPBS8_NLCA1_NLCB1_ONLL1_PGR2_PLR1_PKA1_SIA3_SS1_SU8_SUM1_SUS128_SPO0_SRVW0_SSO0_SVW2_SK0_SKXCCM0_TLDS1_ULSGRO1_USL1_UIOFGRO0_USFGROn1_VSn1_VWA2_VWB8_WSGRA0_WSGRB2_WS64_WG32_8_1_WGM32_WGMXCC1_WGMXCCGn1
    SolutionIndex: 263
    SolutionNameMin: Cijk_Alik_Bljk_BBS_BH_Bias_HA_S_SAV_UserArgs_MT192x256x64_MI16x16x1_SN_LDSB1_AFC1_AFEM16_AFEM16_ASEM16_CLR1_CADS0_DTVA0_DTVB0_EPS0_FDSI0_GRPM1_GRVWA8_GRVWB8_GSU1_GSUAMB_GSUC0_GSUWGMRR0_GLS0_ISA942_IU1_K1_LBSPPA256_LBSPPB1024_LBSPPM0_LPA16_LPB16_LPM0_LRVW8_LWPMn1_MIAV0_MIWT6_8_MO40_NTn1_NTA0_NTB0_NTC0_NTD0_NTM0_NEPBS8_NLCA1_NLCB1_ONLL1_PGR2_PLR1_PKA1_SIA3_SS1_SU8_SUM1_SUS128_SPO0_SRVW0_SSO0_SVW2_SK0_SKXCCM0_TLDS1_ULSGRO0_USL1_UIOFGRO0_USFGROn1_VSn1_VWA2_VWB8_WSGRA2_WSGRB0_WS64_WG32_8_1_WGM32_WGMXCC1_WGMXCCGn1
    SolutionIndex: 264
    SolutionNameMin: Cijk_Alik_Bljk_BBS_BH_Bias_HA_S_SAV_UserArgs_MT256x256x32_MI16x16x1_SN_LDSB1_AFC1_AFEM16_AFEM16_ASEM16_CLR1_CADS0_DTVA0_DTVB0_EPS0_FDSI0_GRPM1_GRVWA2_GRVWB2_GSU1_GSUAMB_GSUC0_GSUWGMRR0_GLS0_ISA942_IU1_K1_LBSPPA512_LBSPPB512_LBSPPM0_LPA4_LPB4_LPM0_LRVW4_LWPMn1_MIAV0_MIWT8_8_MO40_NTn1_NTA0_NTB0_NTC0_NTD0_NTM0_NEPBS8_NLCA1_NLCB1_ONLL1_PGR2_PLR1_PKA1_SIA3_SS1_SU0_SUM0_SUS0_SPO0_SRVW0_SSO0_SVW8_SK0_SKXCCM0_TLDS1_ULSGRO1_USL1_UIOFGRO0_USFGROn1_VSn1_VWA8_VWB8_WSGRA0_WSGRB0_WS64_WG32_8_1_WGM32_WGMXCC1_WGMXCCGn1
    SolutionIndex: 265
    SolutionNameMin: Cijk_Alik_Bljk_BBS_BH_Bias_HA_S_SAV_UserArgs_MT160x256x64_MI16x16x1_SN_LDSB1_AFC1_AFEM16_AFEM16_ASEM16_CLR1_CADS0_DTVA0_DTVB0_EPS0_FDSI0_GRPM1_GRVWA8_GRVWB8_GSU1_GSUAMB_GSUC0_GSUWGMRR0_GLS0_ISA942_IU1_K1_LBSPPA256_LBSPPB512_LBSPPM0_LPA16_LPB16_LPM0_LRVW8_LWPMn1_MIAV0_MIWT10_4_MO40_NTn1_NTA0_NTB0_NTC0_NTD0_NTM0_NEPBS8_NLCA1_NLCB1_ONLL1_PGR2_PLR1_PKA1_SIA3_SS1_SU0_SUM0_SUS0_SPO0_SRVW0_SSO0_SVW2_SK0_SKXCCM0_TLDS1_ULSGRO1_USL1_UIOFGRO0_USFGROn1_VSn1_VWA2_VWB4_WSGRA0_WSGRB0_WS64_WG16_16_1_WGM8_WGMXCC1_WGMXCCGn1
    SolutionIndex: 266
    SolutionNameMin: Cijk_Alik_Bljk_BBS_BH_Bias_HA_S_SAV_UserArgs_MT192x192x64_MI16x16x1_SN_LDSB1_AFC1_AFEM16_AFEM16_ASEM16_CLR1_CADS0_DTVA0_DTVB0_EPS0_FDSI0_GRPM1_GRVWA8_GRVWB8_GSU1_GSUAMB_GSUC0_GSUWGMRR0_GLS0_ISA942_IU1_K1_LBSPPA256_LBSPPB256_LBSPPM0_LPA16_LPB16_LPM0_LRVW8_LWPMn1_MIAV0_MIWT6_6_MO40_NTn1_NTA0_NTB0_NTC0_NTD0_NTM0_NEPBS8_NLCA1_NLCB1_ONLL1_PGR2_PLR1_PKA1_SIA3_SS1_SU16_SUM1_SUS256_SPO0_SRVW0_SSO0_SVW2_SK0_SKXCCM0_TLDS1_ULSGRO1_USL1_UIOFGRO0_USFGROn1_VSn1_VWA2_VWB2_WSGRA2_WSGRB0_WS64_WG32_8_1_WGM8_WGMXCC1_WGMXCCGn1
    SolutionIndex: 267
    SolutionNameMin: Cijk_Alik_Bljk_BBS_BH_Bias_HA_S_SAV_UserArgs_MT256x192x64_MI16x16x1_SN_LDSB1_AFC1_AFEM16_AFEM16_ASEM16_CLR1_CADS0_DTVA0_DTVB0_EPS0_FDSI0_GRPM1_GRVWA8_GRVWB8_GSU1_GSUAMB_GSUC0_GSUWGMRR0_GLS0_ISA942_IU1_K1_LBSPPA1024_LBSPPB256_LBSPPM0_LPA16_LPB16_LPM0_LRVW8_LWPMn1_MIAV0_MIWT8_6_MO40_NTn1_NTA0_NTB0_NTC0_NTD0_NTM0_NEPBS8_NLCA1_NLCB1_ONLL1_PGR2_PLR1_PKA1_SIA3_SS1_SU0_SUM0_SUS0_SPO0_SRVW0_SSO0_SVW8_SK0_SKXCCM0_TLDS1_ULSGRO0_USL1_UIOFGRO0_USFGROn1_VSn1_VWA8_VWB2_WSGRA0_WSGRB0_WS64_WG32_8_1_WGM1_WGMXCC1_WGMXCCGn1
    SolutionIndex: 268
    SolutionNameMin: Cijk_Alik_Bljk_BBS_BH_Bias_HA_S_SAV_UserArgs_MT256x192x64_MI16x16x1_SN_LDSB1_AFC1_AFEM16_AFEM16_ASEM16_CLR1_CADS0_DTVA0_DTVB0_EPS0_FDSI0_GRPM1_GRVWA8_GRVWB8_GSU1_GSUAMB_GSUC0_GSUWGMRR0_GLS0_ISA942_IU1_K1_LBSPPA1024_LBSPPB256_LBSPPM0_LPA16_LPB16_LPM0_LRVW8_LWPMn1_MIAV0_MIWT8_6_MO40_NTn1_NTA0_NTB0_NTC0_NTD0_NTM0_NEPBS8_NLCA1_NLCB1_ONLL1_PGR2_PLR1_PKA1_SIA3_SS1_SU32_SUM1_SUS128_SPO0_SRVW0_SSO0_SVW8_SK0_SKXCCM0_TLDS1_ULSGRO1_USL1_UIOFGRO0_USFGROn1_VSn1_VWA8_VWB2_WSGRA0_WSGRB0_WS64_WG32_8_1_WGM32_WGMXCC1_WGMXCCGn1
    SolutionIndex: 269
    SolutionNameMin: Cijk_Alik_Bljk_BBS_BH_Bias_HA_S_SAV_UserArgs_MT224x256x64_MI16x16x1_SN_LDSB1_AFC1_AFEM16_AFEM16_ASEM16_CLR1_CADS0_DTVA0_DTVB0_EPS0_FDSI0_GRPM1_GRVWA2_GRVWB2_GSU1_GSUAMB_GSUC0_GSUWGMRR0_GLS0_ISA942_IU1_K1_LBSPPA128_LBSPPB1024_LBSPPM0_LPA4_LPB4_LPM0_LRVW4_LWPMn1_MIAV0_MIWT7_8_MO40_NTn1_NTA0_NTB0_NTC0_NTD0_NTM0_NEPBS8_NLCA1_NLCB1_ONLL1_PGR2_PLR1_PKA1_SIA3_SS1_SU8_SUM1_SUS128_SPO0_SRVW0_SSO0_SVW1_SK0_SKXCCM0_TLDS1_ULSGRO0_USL1_UIOFGRO0_USFGROn1_VSn1_VWA1_VWB8_WSGRA0_WSGRB0_WS64_WG32_8_1_WGM16_WGMXCC1_WGMXCCGn1
    SolutionIndex: 270
    SolutionNameMin: Cijk_Alik_Bljk_BBS_BH_Bias_HA_S_SAV_UserArgs_MT192x256x64_MI16x16x1_SN_LDSB1_AFC1_AFEM16_AFEM16_ASEM16_CLR1_CADS0_DTVA0_DTVB0_EPS0_FDSI0_GRPM1_GRVWA8_GRVWB8_GSU1_GSUAMB_GSUC0_GSUWGMRR0_GLS0_ISA942_IU1_K1_LBSPPA256_LBSPPB1024_LBSPPM0_LPA16_LPB16_LPM0_LRVW8_LWPMn1_MIAV0_MIWT6_8_MO40_NTn1_NTA0_NTB0_NTC0_NTD0_NTM0_NEPBS8_NLCA1_NLCB1_ONLL1_PGR2_PLR1_PKA1_SIA3_SS1_SU8_SUM1_SUS128_SPO0_SRVW0_SSO0_SVW2_SK0_SKXCCM0_TLDS1_ULSGRO1_USL1_UIOFGRO0_USFGROn1_VSn1_VWA2_VWB8_WSGRA0_WSGRB0_WS64_WG32_8_1_WGM32_WGMXCC1_WGMXCCGn1
    SolutionIndex: 271
    SolutionNameMin: Cijk_Alik_Bljk_BBS_BH_Bias_HA_S_SAV_UserArgs_MT192x256x64_MI16x16x1_SN_LDSB1_AFC1_AFEM16_AFEM16_ASEM16_CLR1_CADS0_DTVA0_DTVB0_EPS0_FDSI0_GRPM1_GRVWA8_GRVWB8_GSU1_GSUAMB_GSUC0_GSUWGMRR0_GLS0_ISA942_IU1_K1_LBSPPA256_LBSPPB1024_LBSPPM0_LPA16_LPB16_LPM0_LRVW8_LWPMn1_MIAV0_MIWT6_8_MO40_NTn1_NTA0_NTB0_NTC0_NTD0_NTM0_NEPBS8_NLCA1_NLCB1_ONLL1_PGR2_PLR1_PKA1_SIA3_SS1_SU0_SUM0_SUS0_SPO0_SRVW0_SSO0_SVW2_SK0_SKXCCM0_TLDS1_ULSGRO0_USL1_UIOFGRO0_USFGROn1_VSn1_VWA2_VWB8_WSGRA0_WSGRB0_WS64_WG32_8_1_WGM16_WGMXCC1_WGMXCCGn1
    SolutionIndex: 272
    SolutionNameMin: Cijk_Alik_Bljk_BBS_BH_Bias_HA_S_SAV_UserArgs_MT256x384x32_MI16x16x1_SN_LDSB1_AFC1_AFEM1_AFEM1_ASEM1_CLR1_CADS0_DTVA0_DTVB0_EPS0_FDSI0_GRPM1_GRVWA4_GRVWB4_GSU1_GSUAMB_GSUC0_GSUWGMRR0_GLS0_ISA942_IU1_K1_LCS0_LBSPPA512_LBSPPB256_LBSPPM0_LPA4_LPB4_LPM0_LRVW4_LWPMn1_MIAV0_MIWT8_12_MO40_NTn1_NTA0_NTB0_NTC0_NTD0_NTM0_NEPBS8_NLCA1_NLCB1_ONLL1_PGR2_PLR1_PKA1_SIA3_SS1_SU0_SUM0_SUS0_SPO0_SRVW0_SSO0_SVW8_SK0_SKXCCM0_TLDS1_ULSGRO1_USL1_UIOFGRO0_USFGROn1_VSn1_VWA8_VWB4_WSGRA0_WSGRB0_WS64_WG32_8_1_WGM8_WGMXCC8_WGMXCCGn1
    SolutionIndex: 273
    SolutionNameMin: Cijk_Alik_Bljk_BBS_BH_Bias_HA_S_SAV_UserArgs_MT320x224x32_MI16x16x1_SN_LDSB1_AFC1_AFEM1_AFEM1_ASEM1_CLR1_CADS0_DTVA0_DTVB0_EPS0_FDSI0_GRPM1_GRVWA4_GRVWB4_GSU1_GSUAMB_GSUC0_GSUWGMRR0_GLS0_ISA942_IU1_K1_LCS0_LBSPPA128_LBSPPB128_LBSPPM0_LPA4_LPB4_LPM0_LRVW4_LWPMn1_MIAV0_MIWT10_7_MO40_NTn1_NTA0_NTB0_NTC0_NTD0_NTM0_NEPBS8_NLCA1_NLCB1_ONLL1_PGR2_PLR1_PKA1_SIA3_SS1_SU8_SUM1_SUS64_SPO0_SRVW0_SSO0_SVW2_SK0_SKXCCM0_TLDS1_ULSGRO1_USL1_UIOFGRO0_USFGROn1_VSn1_VWA2_VWB1_WSGRA0_WSGRB0_WS64_WG32_8_1_WGM8_WGMXCC1_WGMXCCGn1
    SolutionIndex: 274
    SolutionNameMin: Cijk_Alik_Bljk_BBS_BH_Bias_HA_S_SAV_UserArgs_MT256x192x64_MI16x16x1_SN_LDSB1_AFC1_AFEM1_AFEM1_ASEM1_CLR1_CADS0_DTVA0_DTVB0_EPS0_FDSI0_GRPM1_GRVWA8_GRVWB8_GSU1_GSUAMB_GSUC0_GSUWGMRR0_GLS0_ISA942_IU1_K1_LCS0_LBSPPA1024_LBSPPB256_LBSPPM0_LPA16_LPB16_LPM0_LRVW8_LWPMn1_MIAV0_MIWT8_6_MO40_NTn1_NTA0_NTB0_NTC0_NTD0_NTM0_NEPBS8_NLCA1_NLCB1_ONLL1_PGR2_PLR1_PKA1_SIA3_SS1_SU8_SUM1_SUS128_SPO0_SRVW0_SSO0_SVW8_SK0_SKXCCM0_TLDS1_ULSGRO0_USL1_UIOFGRO0_USFGROn1_VSn1_VWA8_VWB2_WSGRA0_WSGRB0_WS64_WG32_8_1_WGM1_WGMXCC8_WGMXCCGn1
    SolutionIndex: 275
    SolutionNameMin: Cijk_Alik_Bljk_BBS_BH_Bias_HA_S_SAV_UserArgs_MT256x192x64_MI16x16x1_SN_LDSB1_AFC1_AFEM1_AFEM1_ASEM1_CLR1_CADS0_DTVA0_DTVB0_EPS0_FDSI0_GRPM1_GRVWA8_GRVWB8_GSU1_GSUAMB_GSUC0_GSUWGMRR0_GLS0_ISA942_IU1_K1_LCS0_LBSPPA1024_LBSPPB256_LBSPPM0_LPA16_LPB16_LPM0_LRVW8_LWPMn1_MIAV0_MIWT8_6_MO40_NTn1_NTA0_NTB0_NTC0_NTD0_NTM0_NEPBS8_NLCA1_NLCB1_ONLL1_PGR2_PLR1_PKA1_SIA3_SS1_SU8_SUM0_SUS128_SPO0_SRVW0_SSO0_SVW8_SK0_SKXCCM0_TLDS1_ULSGRO0_USL1_UIOFGRO0_USFGROn1_VSn1_VWA8_VWB2_WSGRA0_WSGRB0_WS64_WG32_8_1_WGM1_WGMXCC1_WGMXCCGn1
    SolutionIndex: 276
    SolutionNameMin: Cijk_Alik_Bljk_BBS_BH_Bias_HA_S_SAV_UserArgs_MT256x192x64_MI16x16x1_SN_LDSB1_AFC1_AFEM1_AFEM1_ASEM1_CLR1_CADS0_DTVA0_DTVB0_EPS0_FDSI0_GRPM1_GRVWA8_GRVWB8_GSU1_GSUAMB_GSUC0_GSUWGMRR0_GLS0_ISA942_IU1_K1_LCS0_LBSPPA1024_LBSPPB256_LBSPPM0_LPA16_LPB16_LPM0_LRVW8_LWPMn1_MIAV0_MIWT8_6_MO40_NTn1_NTA0_NTB0_NTC0_NTD0_NTM0_NEPBS8_NLCA1_NLCB1_ONLL1_PGR2_PLR1_PKA1_SIA3_SS1_SU8_SUM1_SUS128_SPO0_SRVW0_SSO0_SVW8_SK0_SKXCCM0_TLDS1_ULSGRO0_USL1_UIOFGRO0_USFGROn1_VSn1_VWA8_VWB2_WSGRA0_WSGRB0_WS64_WG32_8_1_WGM8_WGMXCC1_WGMXCCGn1
    SolutionIndex: 277
    SolutionNameMin: Cijk_Alik_Bljk_BBS_BH_Bias_HA_S_SAV_UserArgs_MT256x192x64_MI16x16x1_SN_LDSB1_AFC1_AFEM1_AFEM1_ASEM1_CLR1_CADS0_DTVA0_DTVB0_EPS0_FDSI0_GRPM1_GRVWA8_GRVWB8_GSU1_GSUAMB_GSUC0_GSUWGMRR0_GLS0_ISA942_IU1_K1_LCS0_LBSPPA1024_LBSPPB256_LBSPPM0_LPA16_LPB16_LPM0_LRVW8_LWPMn1_MIAV0_MIWT8_6_MO40_NTn1_NTA0_NTB0_NTC0_NTD0_NTM0_NEPBS8_NLCA1_NLCB1_ONLL1_PGR2_PLR1_PKA1_SIA3_SS1_SU8_SUM1_SUS128_SPO0_SRVW0_SSO0_SVW8_SK0_SKXCCM0_TLDS1_ULSGRO1_USL1_UIOFGRO0_USFGROn1_VSn1_VWA8_VWB2_WSGRA0_WSGRB0_WS64_WG32_8_1_WGM8_WGMXCC8_WGMXCCGn1
    SolutionIndex: 278
    SolutionNameMin: Cijk_Alik_Bljk_BBS_BH_Bias_HA_S_SAV_UserArgs_MT256x192x64_MI16x16x1_SN_LDSB1_AFC1_AFEM1_AFEM1_ASEM1_CLR1_CADS0_DTVA0_DTVB0_EPS0_FDSI0_GRPM1_GRVWA8_GRVWB8_GSU1_GSUAMB_GSUC0_GSUWGMRR0_GLS0_ISA942_IU1_K1_LCS0_LBSPPA1024_LBSPPB256_LBSPPM0_LPA16_LPB16_LPM0_LRVW8_LWPMn1_MIAV0_MIWT8_6_MO40_NTn1_NTA0_NTB0_NTC0_NTD0_NTM0_NEPBS8_NLCA1_NLCB1_ONLL1_PGR2_PLR1_PKA1_SIA3_SS1_SU0_SUM0_SUS0_SPO0_SRVW0_SSO0_SVW8_SK0_SKXCCM0_TLDS1_ULSGRO1_USL1_UIOFGRO0_USFGROn1_VSn1_VWA8_VWB2_WSGRA0_WSGRB0_WS64_WG32_8_1_WGM8_WGMXCC8_WGMXCCGn1
    SolutionIndex: 279
    SolutionNameMin: Cijk_Alik_Bljk_BBS_BH_Bias_HA_S_SAV_UserArgs_MT256x192x64_MI16x16x1_SN_LDSB1_AFC1_AFEM1_AFEM1_ASEM1_CLR1_CADS0_DTVA0_DTVB0_EPS0_FDSI0_GRPM1_GRVWA8_GRVWB8_GSU1_GSUAMB_GSUC0_GSUWGMRR0_GLS0_ISA942_IU1_K1_LCS0_LBSPPA1024_LBSPPB256_LBSPPM0_LPA16_LPB16_LPM0_LRVW8_LWPMn1_MIAV0_MIWT8_6_MO40_NTn1_NTA0_NTB0_NTC0_NTD0_NTM0_NEPBS8_NLCA1_NLCB1_ONLL1_PGR2_PLR1_PKA1_SIA3_SS1_SU8_SUM0_SUS128_SPO0_SRVW0_SSO0_SVW8_SK0_SKXCCM0_TLDS1_ULSGRO1_USL1_UIOFGRO0_USFGROn1_VSn1_VWA8_VWB2_WSGRA0_WSGRB0_WS64_WG32_8_1_WGM8_WGMXCC8_WGMXCCGn1
    SolutionIndex: 280
    SolutionNameMin: Cijk_Alik_Bljk_BBS_BH_Bias_HA_S_SAV_UserArgs_MT192x256x64_MI16x16x1_SN_LDSB1_AFC1_AFEM1_AFEM1_ASEM1_CLR1_CADS0_DTVA0_DTVB0_EPS0_FDSI0_GRPM1_GRVWA8_GRVWB8_GSU1_GSUAMB_GSUC0_GSUWGMRR0_GLS0_ISA942_IU1_K1_LCS0_LBSPPA256_LBSPPB1024_LBSPPM0_LPA16_LPB16_LPM0_LRVW8_LWPMn1_MIAV0_MIWT6_8_MO40_NTn1_NTA0_NTB0_NTC0_NTD0_NTM0_NEPBS8_NLCA1_NLCB1_ONLL1_PGR2_PLR1_PKA1_SIA3_SS1_SU8_SUM1_SUS128_SPO0_SRVW0_SSO0_SVW2_SK0_SKXCCM0_TLDS1_ULSGRO1_USL1_UIOFGRO0_USFGROn1_VSn1_VWA2_VWB8_WSGRA0_WSGRB0_WS64_WG32_8_1_WGM1_WGMXCC8_WGMXCCGn1
    SolutionIndex: 281
    SolutionNameMin: Cijk_Alik_Bljk_BBS_BH_Bias_HA_S_SAV_UserArgs_MT256x192x64_MI16x16x1_SN_LDSB1_AFC1_AFEM1_AFEM1_ASEM1_CLR1_CADS0_DTVA0_DTVB0_EPS0_FDSI0_GRPM1_GRVWA8_GRVWB8_GSU1_GSUAMB_GSUC0_GSUWGMRR0_GLS0_ISA942_IU1_K1_LCS0_LBSPPA1024_LBSPPB256_LBSPPM0_LPA16_LPB16_LPM0_LRVW8_LWPMn1_MIAV0_MIWT8_6_MO40_NTn1_NTA0_NTB0_NTC0_NTD0_NTM0_NEPBS8_NLCA1_NLCB1_ONLL1_PGR2_PLR1_PKA1_SIA3_SS1_SU8_SUM1_SUS128_SPO0_SRVW0_SSO0_SVW8_SK0_SKXCCM0_TLDS1_ULSGRO0_USL1_UIOFGRO0_USFGROn1_VSn1_VWA8_VWB2_WSGRA0_WSGRB0_WS64_WG32_8_1_WGM1_WGMXCC1_WGMXCCGn1
    SolutionIndex: 282
    SolutionNameMin: Cijk_Alik_Bljk_BBS_BH_Bias_HA_S_SAV_UserArgs_MT384x256x32_MI16x16x1_SN_LDSB1_AFC1_AFEM1_AFEM1_ASEM1_CLR1_CADS0_DTVA0_DTVB0_EPS0_FDSI0_GRPM1_GRVWA4_GRVWB4_GSU1_GSUAMB_GSUC0_GSUWGMRR0_GLS0_ISA942_IU1_K1_LCS0_LBSPPA256_LBSPPB512_LBSPPM0_LPA4_LPB4_LPM0_LRVW4_LWPMn1_MIAV0_MIWT12_8_MO40_NTn1_NTA0_NTB0_NTC0_NTD0_NTM0_NEPBS8_NLCA1_NLCB1_ONLL1_PGR2_PLR1_PKA1_SIA3_SS1_SU8_SUM0_SUS64_SPO0_SRVW0_SSO0_SVW4_SK0_SKXCCM0_TLDS1_ULSGRO0_USL1_UIOFGRO0_USFGROn1_VSn1_VWA4_VWB8_WSGRA0_WSGRB0_WS64_WG32_8_1_WGM8_WGMXCC8_WGMXCCGn1
    SolutionIndex: 283
    SolutionNameMin: Cijk_Alik_Bljk_BBS_BH_Bias_HA_S_SAV_UserArgs_MT384x256x32_MI16x16x1_SN_LDSB1_AFC1_AFEM1_AFEM1_ASEM1_CLR1_CADS0_DTVA0_DTVB0_EPS0_FDSI0_GRPM1_GRVWA4_GRVWB4_GSU1_GSUAMB_GSUC0_GSUWGMRR0_GLS0_ISA942_IU1_K1_LCS0_LBSPPA256_LBSPPB512_LBSPPM0_LPA4_LPB4_LPM0_LRVW4_LWPMn1_MIAV0_MIWT12_8_MO40_NTn1_NTA0_NTB0_NTC0_NTD0_NTM0_NEPBS8_NLCA1_NLCB1_ONLL1_PGR2_PLR1_PKA1_SIA3_SS1_SU8_SUM1_SUS64_SPO0_SRVW0_SSO0_SVW4_SK0_SKXCCM0_TLDS1_ULSGRO0_USL1_UIOFGRO0_USFGROn1_VSn1_VWA4_VWB8_WSGRA0_WSGRB0_WS64_WG32_8_1_WGM8_WGMXCC8_WGMXCCGn1
    SolutionIndex: 284
    SolutionNameMin: Cijk_Alik_Bljk_BBS_BH_Bias_HA_S_SAV_UserArgs_MT192x256x64_MI16x16x1_SN_LDSB1_AFC1_AFEM1_AFEM1_ASEM1_CLR1_CADS0_DTVA0_DTVB0_EPS0_FDSI0_GRPM1_GRVWA8_GRVWB8_GSU1_GSUAMB_GSUC0_GSUWGMRR0_GLS0_ISA942_IU1_K1_LCS0_LBSPPA256_LBSPPB1024_LBSPPM0_LPA16_LPB16_LPM0_LRVW8_LWPMn1_MIAV0_MIWT6_8_MO40_NTn1_NTA0_NTB0_NTC0_NTD0_NTM0_NEPBS8_NLCA1_NLCB1_ONLL1_PGR2_PLR1_PKA1_SIA3_SS1_SU0_SUM0_SUS0_SPO0_SRVW0_SSO0_SVW2_SK0_SKXCCM0_TLDS1_ULSGRO1_USL1_UIOFGRO0_USFGROn1_VSn1_VWA2_VWB8_WSGRA0_WSGRB0_WS64_WG32_8_1_WGM8_WGMXCC8_WGMXCCGn1
    SolutionIndex: 285
    SolutionNameMin: Cijk_Alik_Bljk_BBS_BH_Bias_HA_S_SAV_UserArgs_MT256x192x64_MI16x16x1_SN_LDSB1_AFC1_AFEM1_AFEM1_ASEM1_CLR1_CADS0_DTVA0_DTVB0_EPS0_FDSI0_GRPM1_GRVWA8_GRVWB8_GSU1_GSUAMB_GSUC0_GSUWGMRR0_GLS0_ISA942_IU1_K1_LBSPPA1024_LBSPPB256_LBSPPM0_LPA16_LPB16_LPM0_LRVW8_LWPMn1_MIAV0_MIWT8_6_MO40_NTn1_NTA0_NTB0_NTC0_NTD0_NTM0_NEPBS16_NLCA1_NLCB1_ONLL1_PGR2_PLR1_PKA1_SIA3_SS1_SU8_SUM0_SUS256_SPO0_SRVW0_SSO0_SVW8_SK0_SKXCCM0_TLDS1_ULSGRO0_USL1_UIOFGRO0_USFGRO1_VSn1_VWA8_VWB2_WSGRA0_WSGRB0_WS64_WG32_8_1_WGM8_WGMXCC1_WGMXCCGn1
    SolutionIndex: 286
    SolutionNameMin: Cijk_Alik_Bljk_BBS_BH_Bias_HA_S_SAV_UserArgs_MT256x224x64_MI16x16x1_SN_LDSB1_AFC1_AFEM1_AFEM1_ASEM1_CLR1_CADS0_DTVA0_DTVB0_EPS0_FDSI0_GRPM1_GRVWA4_GRVWB4_GSU1_GSUAMB_GSUC0_GSUWGMRR0_GLS0_ISA942_IU1_K1_LBSPPA1024_LBSPPB128_LBSPPM0_LPA4_LPB4_LPM0_LRVW4_LWPMn1_MIAV0_MIWT8_7_MO40_NTn1_NTA0_NTB0_NTC0_NTD4_NTM0_NEPBS16_NLCA1_NLCB1_ONLL1_PGR2_PLR1_PKA1_SIA3_SS1_SU16_SUM0_SUS128_SPO0_SRVW0_SSO0_SVW8_SK0_SKXCCM0_TLDS1_ULSGRO0_USL1_UIOFGRO0_USFGRO1_VSn1_VWA8_VWB1_WSGRA0_WSGRB0_WS64_WG32_8_1_WGM8_WGMXCC8_WGMXCCG304
    SolutionIndex: 287
    SolutionNameMin: Cijk_Alik_Bljk_BBS_BH_Bias_HA_S_SAV_UserArgs_MT192x256x64_MI16x16x1_SN_LDSB1_AFC1_AFEM1_AFEM1_ASEM1_CLR1_CADS0_DTVA0_DTVB0_EPS0_FDSI0_GRPM1_GRVWA8_GRVWB8_GSU1_GSUAMB_GSUC0_GSUWGMRR0_GLS0_ISA942_IU1_K1_LBSPPA256_LBSPPB1024_LBSPPM0_LPA16_LPB16_LPM0_LRVW8_LWPMn1_MIAV0_MIWT6_8_MO40_NTn1_NTA0_NTB0_NTC0_NTD0_NTM0_NEPBS8_NLCA1_NLCB1_ONLL1_PGR2_PLR1_PKA1_SIA3_SS1_SU32_SUM1_SUS256_SPO0_SRVW0_SSO0_SVW2_SK0_SKXCCM0_TLDS1_ULSGRO1_USL1_UIOFGRO0_USFGROn1_VSn1_VWA2_VWB8_WSGRA0_WSGRB0_WS64_WG32_8_1_WGM32_WGMXCC1_WGMXCCGn1
    SolutionIndex: 288
    SolutionNameMin: Cijk_Alik_Bljk_BBS_BH_Bias_HA_S_SAV_UserArgs_MT256x192x64_MI16x16x1_SN_LDSB1_AFC1_AFEM1_AFEM1_ASEM1_CLR1_CADS0_DTVA0_DTVB0_EPS0_FDSI0_GRPM1_GRVWA8_GRVWB8_GSU1_GSUAMB_GSUC0_GSUWGMRR0_GLS0_ISA942_IU1_K1_LBSPPA1024_LBSPPB256_LBSPPM0_LPA16_LPB16_LPM0_LRVW8_LWPMn1_MIAV0_MIWT8_6_MO40_NTn1_NTA1_NTB0_NTC0_NTD6_NTM0_NEPBS0_NLCA1_NLCB1_ONLL1_PGR2_PLR1_PKA1_SIA3_SS1_SU16_SUM0_SUS128_SPO0_SRVW0_SSO0_SVW8_SK0_SKXCCM0_TLDS1_ULSGRO1_USL1_UIOFGRO0_USFGROn1_VSn1_VWA8_VWB2_WSGRA0_WSGRB0_WS64_WG32_8_1_WGM1_WGMXCC1_WGMXCCGn1
    SolutionIndex: 289
    SolutionNameMin: Cijk_Alik_Bljk_BBS_BH_Bias_HA_S_SAV_UserArgs_MT256x192x64_MI16x16x1_SN_LDSB1_AFC1_AFEM1_AFEM1_ASEM1_CLR1_CADS0_DTVA0_DTVB0_EPS0_FDSI0_GRPM1_GRVWA8_GRVWB8_GSU1_GSUAMB_GSUC0_GSUWGMRR1_GLS0_ISA942_IU1_K1_LBSPPA1024_LBSPPB256_LBSPPM0_LPA16_LPB16_LPM0_LRVW8_LWPMn1_MIAV0_MIWT8_6_MO40_NTn1_NTA0_NTB0_NTC4_NTD4_NTM0_NEPBS16_NLCA1_NLCB1_ONLL1_PGR2_PLR1_PKA1_SIA3_SS1_SU8_SUM0_SUS256_SPO1_SRVW0_SSO4_SVW8_SK0_SKXCCM0_TLDS1_ULSGRO0_USL1_UIOFGRO0_USFGRO1_VSn1_VWA8_VWB2_WSGRA0_WSGRB0_WS64_WG32_8_1_WGM8_WGMXCC1_WGMXCCGn1
    SolutionIndex: 290
    SolutionNameMin: Cijk_Alik_Bljk_BBS_BH_Bias_HA_S_SAV_UserArgs_MT192x256x64_MI16x16x1_SN_LDSB1_AFC1_AFEM1_AFEM1_ASEM1_CLR1_CADS0_DTVA0_DTVB0_EPS0_FDSI0_GRPM1_GRVWA8_GRVWB8_GSU1_GSUAMB_GSUC0_GSUWGMRR0_GLS0_ISA942_IU1_K1_LBSPPA256_LBSPPB1024_LBSPPM0_LPA16_LPB16_LPM0_LRVW8_LWPMn1_MIAV0_MIWT6_8_MO40_NTn1_NTA0_NTB0_NTC0_NTD0_NTM0_NEPBS8_NLCA1_NLCB1_ONLL1_PGR2_PLR1_PKA1_SIA3_SS1_SU8_SUM1_SUS128_SPO0_SRVW0_SSO0_SVW2_SK0_SKXCCM0_TLDS1_ULSGRO1_USL1_UIOFGRO0_USFGROn1_VSn1_VWA2_VWB8_WSGRA0_WSGRB2_WS64_WG32_8_1_WGM32_WGMXCC1_WGMXCCGn1
    SolutionIndex: 291
    SolutionNameMin: Cijk_Alik_Bljk_BBS_BH_Bias_HA_S_SAV_UserArgs_MT256x224x64_MI16x16x1_SN_LDSB1_AFC1_AFEM1_AFEM1_ASEM1_CLR1_CADS0_DTVA0_DTVB0_EPS0_FDSI0_GRPM1_GRVWA4_GRVWB4_GSU1_GSUAMB_GSUC0_GSUWGMRR0_GLS0_ISA942_IU1_K1_LBSPPA1024_LBSPPB128_LBSPPM0_LPA4_LPB4_LPM0_LRVW4_LWPMn1_MIAV0_MIWT8_7_MO40_NTn1_NTA0_NTB0_NTC0_NTD0_NTM0_NEPBS0_NLCA1_NLCB1_ONLL1_PGR2_PLR1_PKA1_SIA3_SS1_SU8_SUM1_SUS512_SPO0_SRVW0_SSO0_SVW8_SK0_SKXCCM0_TLDS1_ULSGRO0_USL1_UIOFGRO0_USFGROn1_VSn1_VWA8_VWB1_WSGRA0_WSGRB0_WS64_WG32_8_1_WGM0_WGMXCC1_WGMXCCGn1
    SolutionIndex: 292
    SolutionNameMin: Cijk_Alik_Bljk_BBS_BH_Bias_HA_S_SAV_UserArgs_MT256x192x64_MI16x16x1_SN_LDSB1_AFC1_AFEM1_AFEM1_ASEM1_CLR1_CADS0_DTVA0_DTVB0_EPS0_FDSI0_GRPM1_GRVWA8_GRVWB8_GSU1_GSUAMB_GSUC0_GSUWGMRR0_GLS0_ISA942_IU1_K1_LBSPPA1024_LBSPPB256_LBSPPM0_LPA16_LPB16_LPM0_LRVW8_LWPMn1_MIAV0_MIWT8_6_MO40_NTn1_NTA0_NTB0_NTC0_NTD0_NTM0_NEPBS0_NLCA1_NLCB1_ONLL1_PGR2_PLR1_PKA1_SIA3_SS1_SU0_SUM0_SUS0_SPO0_SRVW0_SSO0_SVW8_SK0_SKXCCM0_TLDS1_ULSGRO0_USL1_UIOFGRO0_USFGROn1_VSn1_VWA8_VWB2_WSGRA0_WSGRB0_WS64_WG32_8_1_WGM1_WGMXCC1_WGMXCCGn1
    SolutionIndex: 293
    SolutionNameMin: Cijk_Alik_Bljk_BBS_BH_Bias_HA_S_SAV_UserArgs_MT192x256x64_MI16x16x1_SN_LDSB1_AFC1_AFEM1_AFEM1_ASEM1_CLR1_CADS0_DTVA0_DTVB0_EPS0_FDSI0_GRPM1_GRVWA8_GRVWB8_GSU1_GSUAMB_GSUC0_GSUWGMRR0_GLS0_ISA942_IU1_K1_LBSPPA256_LBSPPB1024_LBSPPM0_LPA16_LPB16_LPM0_LRVW8_LWPMn1_MIAV0_MIWT6_8_MO40_NTn1_NTA0_NTB0_NTC0_NTD0_NTM0_NEPBS8_NLCA1_NLCB1_ONLL0_PGR2_PLR1_PKA1_SIA3_SS1_SU16_SUM1_SUS256_SPO0_SRVW0_SSO0_SVW2_SK0_SKXCCM0_TLDS1_ULSGRO1_USL1_UIOFGRO0_USFGROn1_VSn1_VWA2_VWB8_WSGRA0_WSGRB0_WS64_WG32_8_1_WGM32_WGMXCC1_WGMXCCGn1
    SolutionIndex: 294
    SolutionNameMin: Cijk_Alik_Bljk_BBS_BH_Bias_HA_S_SAV_UserArgs_MT256x192x64_MI16x16x1_SN_LDSB1_AFC1_AFEM1_AFEM1_ASEM1_CLR1_CADS0_DTVA0_DTVB0_EPS0_FDSI0_GRPM1_GRVWA8_GRVWB8_GSU1_GSUAMB_GSUC1_GSUWGMRR0_GLS0_ISA942_IU1_K1_LBSPPA1024_LBSPPB256_LBSPPM0_LPA16_LPB16_LPM0_LRVW8_LWPMn1_MIAV0_MIWT8_6_MO40_NTn1_NTA0_NTB0_NTC4_NTD4_NTM0_NEPBS16_NLCA1_NLCB1_ONLL1_PGR2_PLR1_PKA1_SIA3_SS1_SU0_SUM0_SUS0_SPO1_SRVW0_SSO0_SVW8_SK0_SKXCCM0_TLDS1_ULSGRO0_USL1_UIOFGRO0_USFGROn1_VSn1_VWA8_VWB2_WSGRA0_WSGRB0_WS64_WG32_8_1_WGM0_WGMXCC8_WGMXCCG304
    SolutionIndex: 295
    SolutionNameMin: Cijk_Alik_Bljk_BBS_BH_Bias_HA_S_SAV_UserArgs_MT256x224x64_MI16x16x1_SN_LDSB1_AFC1_AFEM1_AFEM1_ASEM1_CLR1_CADS0_DTVA0_DTVB0_EPS0_FDSI0_GRPM1_GRVWA4_GRVWB4_GSU1_GSUAMB_GSUC0_GSUWGMRR0_GLS0_ISA942_IU1_K1_LBSPPA1024_LBSPPB128_LBSPPM0_LPA4_LPB4_LPM0_LRVW4_LWPMn1_MIAV0_MIWT8_7_MO40_NTn1_NTA0_NTB0_NTC0_NTD0_NTM0_NEPBS16_NLCA1_NLCB1_ONLL1_PGR2_PLR1_PKA1_SIA3_SS1_SU0_SUM0_SUS0_SPO0_SRVW0_SSO0_SVW8_SK0_SKXCCM0_TLDS1_ULSGRO0_USL1_UIOFGRO0_USFGROn1_VSn1_VWA8_VWB1_WSGRA0_WSGRB0_WS64_WG32_8_1_WGM1_WGMXCC1_WGMXCCGn1
    SolutionIndex: 296
    SolutionNameMin: Cijk_Alik_Bljk_BBS_BH_Bias_HA_S_SAV_UserArgs_MT192x256x64_MI16x16x1_SN_LDSB1_AFC1_AFEM1_AFEM1_ASEM1_CLR1_CADS0_DTVA0_DTVB0_EPS0_FDSI0_GRPM1_GRVWA8_GRVWB8_GSU1_GSUAMB_GSUC0_GSUWGMRR0_GLS0_ISA942_IU1_K1_LBSPPA256_LBSPPB1024_LBSPPM0_LPA16_LPB16_LPM0_LRVW8_LWPMn1_MIAV0_MIWT6_8_MO40_NTn1_NTA0_NTB0_NTC0_NTD0_NTM0_NEPBS8_NLCA1_NLCB1_ONLL0_PGR2_PLR1_PKA1_SIA3_SS1_SU8_SUM1_SUS256_SPO0_SRVW0_SSO0_SVW2_SK0_SKXCCM0_TLDS1_ULSGRO1_USL1_UIOFGRO0_USFGROn1_VSn1_VWA2_VWB8_WSGRA0_WSGRB0_WS64_WG32_8_1_WGM32_WGMXCC1_WGMXCCGn1
    SolutionIndex: 297
    SolutionNameMin: Cijk_Alik_Bljk_BBS_BH_Bias_HA_S_SAV_UserArgs_MT256x192x64_MI16x16x1_SN_LDSB1_AFC1_AFEM1_AFEM1_ASEM1_CLR1_CADS0_DTVA0_DTVB0_EPS0_FDSI0_GRPM1_GRVWA8_GRVWB8_GSU1_GSUAMB_GSUC0_GSUWGMRR0_GLS0_ISA942_IU1_K1_LBSPPA1024_LBSPPB256_LBSPPM0_LPA16_LPB16_LPM0_LRVW8_LWPMn1_MIAV0_MIWT8_6_MO40_NTn1_NTA0_NTB0_NTC0_NTD4_NTM0_NEPBS8_NLCA1_NLCB1_ONLL1_PGR2_PLR1_PKA1_SIA3_SS1_SU0_SUM0_SUS0_SPO0_SRVW0_SSO0_SVW8_SK0_SKXCCM0_TLDS1_ULSGRO0_USL1_UIOFGRO0_USFGROn1_VSn1_VWA8_VWB2_WSGRA0_WSGRB0_WS64_WG32_8_1_WGM8_WGMXCC8_WGMXCCGn1
    SolutionIndex: 298
    SolutionNameMin: Cijk_Alik_Bljk_BBS_BH_Bias_HA_S_SAV_UserArgs_MT192x256x64_MI16x16x1_SN_LDSB1_AFC1_AFEM1_AFEM1_ASEM1_CLR1_CADS0_DTVA0_DTVB0_EPS0_FDSI0_GRPM1_GRVWA8_GRVWB8_GSU1_GSUAMB_GSUC1_GSUWGMRR0_GLS0_ISA942_IU1_K1_LBSPPA256_LBSPPB1024_LBSPPM0_LPA16_LPB16_LPM0_LRVW8_LWPMn1_MIAV0_MIWT6_8_MO40_NTn1_NTA0_NTB0_NTC0_NTD0_NTM0_NEPBS8_NLCA1_NLCB1_ONLL1_PGR2_PLR1_PKA1_SIA3_SS1_SU32_SUM1_SUS256_SPO0_SRVW0_SSO0_SVW2_SK0_SKXCCM0_TLDS1_ULSGRO1_USL1_UIOFGRO0_USFGROn1_VSn1_VWA2_VWB8_WSGRA0_WSGRB0_WS64_WG32_8_1_WGM32_WGMXCC1_WGMXCCGn1
    SolutionIndex: 299
    SolutionNameMin: Cijk_Alik_Bljk_BBS_BH_Bias_HA_S_SAV_UserArgs_MT256x224x64_MI16x16x1_SN_LDSB1_AFC1_AFEM1_AFEM1_ASEM1_CLR1_CADS0_DTVA0_DTVB0_EPS0_FDSI0_GRPM1_GRVWA4_GRVWB4_GSU1_GSUAMB_GSUC0_GSUWGMRR1_GLS0_ISA942_IU1_K1_LBSPPA1024_LBSPPB128_LBSPPM0_LPA4_LPB4_LPM0_LRVW4_LWPMn1_MIAV0_MIWT8_7_MO40_NTn1_NTA0_NTB0_NTC4_NTD4_NTM0_NEPBS16_NLCA1_NLCB1_ONLL1_PGR2_PLR1_PKA1_SIA3_SS1_SU8_SUM0_SUS256_SPO1_SRVW0_SSO4_SVW8_SK0_SKXCCM0_TLDS1_ULSGRO0_USL1_UIOFGRO0_USFGRO1_VSn1_VWA8_VWB1_WSGRA0_WSGRB0_WS64_WG32_8_1_WGM16_WGMXCC1_WGMXCCGn1
    SolutionIndex: 300
    SolutionNameMin: Cijk_Alik_Bljk_BBS_BH_Bias_HA_S_SAV_UserArgs_MT224x160x64_MI16x16x1_SN_LDSB1_AFC1_AFEM1_AFEM1_ASEM1_CLR1_CADS0_DTVA0_DTVB0_EPS0_FDSI0_GRPM1_GRVWA8_GRVWB2_GSU2_GSUAMB_GSUC0_GSUWGMRR0_GLS0_ISA942_IU1_K1_LBSPPA128_LBSPPB128_LBSPPM0_LPA16_LPB16_LPM0_LRVW8_LWPMn1_MIAV0_MIWT7_5_MO40_NTn1_NTA0_NTB0_NTC4_NTD4_NTM0_NEPBS16_NLCA1_NLCB1_ONLL1_PGR2_PLR1_PKA1_SIA3_SS1_SU8_SUM0_SUS256_SPO1_SRVW0_SSO4_SVW1_SK0_SKXCCM0_TLDS1_ULSGRO0_USL1_UIOFGRO0_USFGROn1_VSn1_VWA1_VWB1_WSGRA0_WSGRB0_WS64_WG32_8_1_WGM1_WGMXCC1_WGMXCCGn1
    SolutionIndex: 301
    SolutionNameMin: Cijk_Alik_Bljk_BBS_BH_Bias_HA_S_SAV_UserArgs_MT32x16x512_MI16x16x1_SN_LDSB1_AFC1_AFEM1_AFEM1_ASEM1_CLR1_CADS0_DTVA0_DTVB0_EPS0_FDSI0_GRPM1_GRVWA8_GRVWB8_GSU1_GSUAMB_GSUC0_GSUWGMRR0_GLS0_ISA942_IU1_K1_LBSPPA1024_LBSPPB1024_LBSPPM0_LPA16_LPB16_LPM0_LRVW8_LWPMn1_MIAV1_MIWT1_1_MO40_NTn1_NTA4_NTB0_NTC0_NTD0_NTM0_NEPBS16_NLCA1_NLCB1_ONLL1_PGR2_PLR1_PKA1_SIA3_SS1_SU0_SUM0_SUS0_SPO0_SRVW0_SSO0_SVW1_SK0_SKXCCM0_TLDS1_ULSGRO0_USL1_UIOFGRO0_USFGROn1_VSn1_VWA1_VWB1_WSGRA0_WSGRB0_WS64_WG32_4_2_WGM1_WGMXCC1_WGMXCCGn1
    SolutionIndex: 302
    SolutionNameMin: Cijk_Alik_Bljk_BBS_BH_Bias_HA_S_SAV_UserArgs_MT256x192x64_MI16x16x1_SN_LDSB1_AFC1_AFEM16_AFEM16_ASEM1_CLR1_CADS0_DTVA0_DTVB0_EPS0_FDSI0_GRPM1_GRVWA8_GRVWB8_GSU1_GSUAMB_GSUC0_GSUWGMRR0_GLS0_ISA942_IU1_K1_LBSPPA1024_LBSPPB256_LBSPPM0_LPA16_LPB16_LPM0_LRVW8_LWPMn1_MIAV0_MIWT8_6_MO40_NTn1_NTA0_NTB0_NTC0_NTD0_NTM0_NEPBS8_NLCA1_NLCB1_ONLL1_PGR2_PLR1_PKA1_SIA3_SS1_SU32_SUM1_SUS128_SPO0_SRVW0_SSO0_SVW8_SK0_SKXCCM0_TLDS1_ULSGRO1_USL1_UIOFGRO0_USFGROn1_VSn1_VWA8_VWB2_WSGRA0_WSGRB0_WS64_WG32_8_1_WGM32_WGMXCC1_WGMXCCGn1
    SolutionIndex: 303
    SolutionNameMin: Cijk_Alik_Bljk_BBS_BH_Bias_HA_S_SAV_UserArgs_MT64x80x128_MI16x16x1_SN_LDSB1_AFC1_AFEM1_AFEM1_ASEM1_CLR1_CADS0_DTVA0_DTVB0_EPS0_FDSI0_GRPM0p30_GRVWA8_GRVWB8_GSU1_GSUAMB_GSUC0_GSUWGMRR1_GLS0_ISA942_IU1_K1_LBSPPA256_LBSPPB256_LBSPPM0_LPA16_LPB16_LPM0_LRVW8_LWPM1_MIAV0_MIWT1_5_MO40_NTn1_NTA0_NTB0_NTC0_NTD4_NTM0_NEPBS0_NLCA1_NLCB1_ONLL1_PGR2_PLR1_PKA1_SIA3_SS1_SU4_SUM1_SUS1024_SPO0_SRVW0_SSO0_SVW1_SK0_SKXCCM0_TLDS2_ULSGRO0_USL1_UIOFGRO0_USFGROn1_VSn1_VWA1_VWB1_WSGRA2_WSGRB0_WS64_WG64_4_1_WGM1_WGMXCC8_WGMXCCG0
    SolutionIndex: 304
    SolutionNameMin: Cijk_Alik_Bljk_BBS_BH_Bias_HA_S_SAV_UserArgs_MT64x16x64_MI16x16x1_SN_LDSB1_AFC1_AFEM1_AFEM1_ASEM1_CLR1_CADS0_DTVA0_DTVB0_EPS0_FDSI0_GRPM0p80_GRVWA8_GRVWB8_GSU1_GSUAMB_GSUC0_GSUWGMRR1_GLS0_ISA942_IU1_K1_LBSPPA256_LBSPPB128_LBSPPM0_LPA16_LPB16_LPM0_LRVW8_LWPM0p27_MIAV0_MIWT2_1_MO40_NTn1_NTA0_NTB0_NTC7_NTD7_NTM0_NEPBS8_NLCA1_NLCB1_ONLL1_PGR2_PLR1_PKA1_SIA3_SS1_SU4_SUM4_SUS128_SPO1_SRVW0_SSO0_SVW2_SK0_SKXCCM0_TLDS1_ULSGRO0_USL1_UIOFGRO0_USFGRO1_VSn1_VWA2_VWB1_WSGRA0_WSGRB0_WS64_WG32_4_1_WGM1_WGMXCC8_WGMXCCG0
    SolutionIndex: 305
    SolutionNameMin: Cijk_Alik_Bljk_BBS_BH_Bias_HA_S_SAV_UserArgs_MT192x128x64_MI16x16x1_SN_LDSB1_AFC1_AFEM1_AFEM1_ASEM1_CLR1_CADS0_DTVA0_DTVB0_EPS0_FDSI0_GRPM0p60_GRVWA8_GRVWB8_GSU1_GSUAMB_GSUC0_GSUWGMRR0_GLS0_ISA942_IU1_K1_LBSPPA256_LBSPPB512_LBSPPM0_LPA16_LPB16_LPM0_LRVW8_LWPMn1_MIAV0_MIWT6_4_MO40_NTn1_NTA0_NTB0_NTC4_NTD7_NTM0_NEPBS0_NLCA1_NLCB1_ONLL0_PGR2_PLR1_PKA1_SIA3_SS1_SU16_SUM0_SUS128_SPO0_SRVW0_SSO0_SVW2_SK0_SKXCCM0_TLDS1_ULSGRO1_USL1_UIOFGRO0_USFGRO0_VSn1_VWA2_VWB4_WSGRA2_WSGRB0_WS64_WG32_8_1_WGM1_WGMXCC8_WGMXCCGn1
    SolutionIndex: 306
    SolutionNameMin: Cijk_Alik_Bljk_BBS_BH_Bias_HA_S_SAV_UserArgs_MT256x160x64_MI16x16x1_SN_LDSB1_AFC1_AFEM1_AFEM1_ASEM1_CLR1_CADS0_DTVA0_DTVB0_EPS0_FDSI0_GRPM1_GRVWA8_GRVWB8_GSU1_GSUAMB_GSUC0_GSUWGMRR0_GLS0_ISA942_IU1_K1_LBSPPA1024_LBSPPB128_LBSPPM0_LPA16_LPB16_LPM0_LRVW8_LWPMn1_MIAV0_MIWT8_5_MO40_NTn1_NTA0_NTB0_NTC0_NTD4_NTM0_NEPBS16_NLCA1_NLCB1_ONLL1_PGR2_PLR1_PKA1_SIA3_SS1_SU16_SUM0_SUS128_SPO0_SRVW0_SSO0_SVW8_SK0_SKXCCM0_TLDS1_ULSGRO0_USL1_UIOFGRO0_USFGROn1_VSn1_VWA8_VWB1_WSGRA0_WSGRB0_WS64_WG32_8_1_WGM8_WGMXCC8_WGMXCCG304
    SolutionIndex: 307
    SolutionNameMin: Cijk_Alik_Bljk_BBS_BH_Bias_HA_S_SAV_UserArgs_MT128x160x64_MI16x16x1_SN_LDSB1_AFC1_AFEM1_AFEM1_ASEM1_CLR1_CADS0_DTVA0_DTVB0_EPS0_FDSI0_GRPM0p50_GRVWA8_GRVWB8_GSU1_GSUAMB_GSUC0_GSUWGMRR0_GLS0_ISA942_IU1_K1_LBSPPA512_LBSPPB128_LBSPPM0_LPA16_LPB16_LPM0_LRVW8_LWPMn1_MIAV0_MIWT4_5_MO40_NTn1_NTA0_NTB0_NTC0_NTD4_NTM0_NEPBS0_NLCA1_NLCB1_ONLL0_PGR2_PLR1_PKA1_SIA3_SS1_SU8_SUM0_SUS128_SPO0_SRVW0_SSO0_SVW4_SK0_SKXCCM0_TLDS1_ULSGRO1_USL1_UIOFGRO0_USFGRO0_VSn1_VWA4_VWB1_WSGRA1_WSGRB1_WS64_WG32_8_1_WGM4_WGMXCC2_WGMXCCGn1
    SolutionIndex: 308
    SolutionNameMin: Cijk_Alik_Bljk_BBS_BH_Bias_HA_S_SAV_UserArgs_MT256x160x64_MI16x16x1_SN_LDSB1_AFC1_AFEM1_AFEM1_ASEM1_CLR1_CADS0_DTVA0_DTVB0_EPS0_FDSI0_GRPM0p50_GRVWA8_GRVWB8_GSU1_GSUAMB_GSUC0_GSUWGMRR0_GLS0_ISA942_IU1_K1_LBSPPA512_LBSPPB256_LBSPPM0_LPA16_LPB16_LPM0_LRVW8_LWPMn1_MIAV0_MIWT4_10_MO40_NTn1_NTA0_NTB0_NTC0_NTD7_NTM0_NEPBS0_NLCA1_NLCB1_ONLL1_PGR2_PLR1_PKA1_SIA3_SS1_SU64_SUM0_SUS128_SPO0_SRVW0_SSO0_SVW4_SK0_SKXCCM0_TLDS1_ULSGRO1_USL1_UIOFGRO0_USFGROn1_VSn1_VWA4_VWB2_WSGRA2_WSGRB2_WS64_WG64_4_1_WGM1_WGMXCC4_WGMXCCGn1
    SolutionIndex: 309
    SolutionNameMin: Cijk_Alik_Bljk_BBS_BH_Bias_HA_S_SAV_UserArgs_MT256x160x64_MI16x16x1_SN_LDSB1_AFC1_AFEM1_AFEM1_ASEM1_CLR1_CADS0_DTVA0_DTVB0_EPS0_FDSI0_GRPM0p70_GRVWA8_GRVWB8_GSU1_GSUAMB_GSUC0_GSUWGMRR0_GLS0_ISA942_IU1_K1_LBSPPA1024_LBSPPB128_LBSPPM0_LPA16_LPB16_LPM0_LRVW8_LWPMn1_MIAV0_MIWT8_5_MO40_NTn1_NTA0_NTB0_NTC0_NTD4_NTM0_NEPBS0_NLCA1_NLCB1_ONLL2_PGR2_PLR1_PKA1_SIA3_SS1_SU64_SUM1_SUS128_SPO0_SRVW0_SSO0_SVW8_SK0_SKXCCM0_TLDS1_ULSGRO1_USL1_UIOFGRO0_USFGROn1_VSn1_VWA8_VWB1_WSGRA2_WSGRB0_WS64_WG32_8_1_WGM12_WGMXCC4_WGMXCCG0
    SolutionIndex: 310
    SolutionNameMin: Cijk_Alik_Bljk_BBS_BH_Bias_HA_S_SAV_UserArgs_MT128x80x128_MI16x16x1_SN_LDSB1_AFC1_AFEM1_AFEM1_ASEM1_CLR1_CADS0_DTVA0_DTVB0_EPS0_FDSI0_GRPM0p80_GRVWA8_GRVWB8_GSU1_GSUAMB_GSUC0_GSUWGMRR1_GLS0_ISA942_IU1_K1_LBSPPA512_LBSPPB256_LBSPPM0_LPA16_LPB16_LPM0_LRVW8_LWPMn1_MIAV0_MIWT2_5_MO40_NTn1_NTA0_NTB0_NTC4_NTD4_NTM0_NEPBS0_NLCA1_NLCB1_ONLL0_PGR2_PLR1_PKA1_SIA3_SS1_SU4_SUM0_SUS256_SPO0_SRVW0_SSO0_SVW2_SK0_SKXCCM0_TLDS2_ULSGRO0_USL1_UIOFGRO0_USFGROn1_VSn1_VWA2_VWB1_WSGRA0_WSGRB0_WS64_WG64_4_1_WGM2_WGMXCC4_WGMXCCG0
    SolutionIndex: 311
    SolutionNameMin: Cijk_Alik_Bljk_BBS_BH_Bias_HA_S_SAV_UserArgs_MT64x96x128_MI16x16x1_SN_LDSB1_AFC1_AFEM1_AFEM1_ASEM1_CLR1_CADS0_DTVA0_DTVB0_EPS0_FDSI0_GRPM0p40_GRVWA8_GRVWB8_GSU1_GSUAMBSK_GSUC0_GSUWGMRR0_GLS0_ISA942_IU1_K1_LBSPPA512_LBSPPB256_LBSPPM0_LPA16_LPB16_LPM0_LRVW8_LWPM0p90_MIAV0_MIWT2_3_MO40_NTn1_NTA0_NTB0_NTC4_NTD4_NTM0_NEPBS0_NLCA1_NLCB1_ONLL1_PGR2_PLR1_PKA1_SIA3_SS1_SU2_SUM3_SUS512_SPO0_SRVW0_SSO0_SVW2_SK0_SKXCCM0_TLDS1_ULSGRO0_USL1_UIOFGRO0_USFGRO1_VSn1_VWA2_VWB1_WSGRA0_WSGRB0_WS64_WG32_8_1_WGM0_WGMXCC8_WGMXCCG0
    SolutionIndex: 312
    SolutionNameMin: Cijk_Alik_Bljk_BBS_BH_Bias_HA_S_SAV_UserArgs_MT256x160x64_MI16x16x1_SN_LDSB1_AFC1_AFEM1_AFEM1_ASEM1_CLR1_CADS0_DTVA0_DTVB0_EPS0_FDSI0_GRPM0p26_GRVWA8_GRVWB8_GSU1_GSUAMB_GSUC0_GSUWGMRR0_GLS0_ISA942_IU1_K1_LBSPPA1024_LBSPPB128_LBSPPM0_LPA16_LPB16_LPM0_LRVW8_LWPMn1_MIAV0_MIWT8_5_MO40_NTn1_NTA0_NTB0_NTC0_NTD4_NTM0_NEPBS0_NLCA1_NLCB1_ONLL0_PGR2_PLR1_PKA1_SIA3_SS1_SU0_SUM0_SUS0_SPO0_SRVW0_SSO0_SVW8_SK0_SKXCCM0_TLDS2_ULSGRO0_USL1_UIOFGRO0_USFGROn1_VSn1_VWA8_VWB1_WSGRA0_WSGRB0_WS64_WG32_8_1_WGM4_WGMXCC2_WGMXCCGn1
    SolutionIndex: 313
    SolutionNameMin: Cijk_Alik_Bljk_BBS_BH_Bias_HA_S_SAV_UserArgs_MT256x160x64_MI16x16x1_SN_LDSB1_AFC1_AFEM1_AFEM1_ASEM1_CLR1_CADS0_DTVA0_DTVB0_EPS0_FDSI0_GRPM1_GRVWA8_GRVWB8_GSU1_GSUAMB_GSUC0_GSUWGMRR0_GLS0_ISA942_IU1_K1_LBSPPA1024_LBSPPB128_LBSPPM0_LPA16_LPB16_LPM0_LRVW8_LWPMn1_MIAV0_MIWT8_5_MO40_NTn1_NTA0_NTB0_NTC0_NTD4_NTM0_NEPBS16_NLCA1_NLCB1_ONLL1_PGR2_PLR1_PKA1_SIA3_SS1_SU16_SUM1_SUS128_SPO0_SRVW0_SSO0_SVW8_SK0_SKXCCM0_TLDS1_ULSGRO0_USL1_UIOFGRO0_USFGROn1_VSn1_VWA8_VWB1_WSGRA0_WSGRB0_WS64_WG32_8_1_WGM6_WGMXCC8_WGMXCCG304
    SolutionIndex: 314
    SolutionNameMin: Cijk_Alik_Bljk_BBS_BH_Bias_HA_S_SAV_UserArgs_MT128x96x64_MI16x16x1_SN_LDSB1_AFC1_AFEM1_AFEM1_ASEM1_CLR1_CADS0_DTVA0_DTVB0_EPS0_FDSI0_GRPM0p26_GRVWA8_GRVWB8_GSU1_GSUAMB_GSUC0_GSUWGMRR0_GLS0_ISA942_IU1_K1_LBSPPA512_LBSPPB128_LBSPPM0_LPA16_LPB16_LPM0_LRVW8_LWPMn1_MIAV0_MIWT4_3_MO40_NTn1_NTA0_NTB0_NTC0_NTD4_NTM0_NEPBS0_NLCA1_NLCB1_ONLL0_PGR2_PLR1_PKA1_SIA3_SS1_SU16_SUM0_SUS128_SPO0_SRVW0_SSO4_SVW4_SK0_SKXCCM0_TLDS2_ULSGRO1_USL1_UIOFGRO0_USFGROn1_VSn1_VWA4_VWB1_WSGRA0_WSGRB1_WS64_WG32_8_1_WGM8_WGMXCC1_WGMXCCGn1
    SolutionIndex: 315
    SolutionNameMin: Cijk_Alik_Bljk_BBS_BH_Bias_HA_S_SAV_UserArgs_MT256x192x64_MI16x16x1_SN_LDSB1_AFC1_AFEM1_AFEM1_ASEM1_CLR1_CADS0_DTVA0_DTVB0_EPS0_FDSI0_GRPM0p90_GRVWA8_GRVWB8_GSU1_GSUAMB_GSUC0_GSUWGMRR0_GLS0_ISA942_IU1_K1_LBSPPA1024_LBSPPB256_LBSPPM0_LPA16_LPB16_LPM0_LRVW8_LWPMn1_MIAV0_MIWT8_6_MO40_NTn1_NTA0_NTB4_NTC0_NTD7_NTM0_NEPBS0_NLCA1_NLCB1_ONLL1_PGR2_PLR1_PKA1_SIA3_SS1_SU2_SUM0_SUS128_SPO0_SRVW0_SSO0_SVW8_SK0_SKXCCM0_TLDS1_ULSGRO0_USL1_UIOFGRO0_USFGROn1_VSn1_VWA8_VWB2_WSGRA0_WSGRB0_WS64_WG32_8_1_WGM0_WGMXCC1_WGMXCCGn1
    SolutionIndex: 316
    SolutionNameMin: Cijk_Alik_Bljk_BBS_BH_Bias_HA_S_SAV_UserArgs_MT192x128x64_MI16x16x1_SN_LDSB1_AFC1_AFEM1_AFEM1_ASEM1_CLR1_CADS0_DTVA0_DTVB0_EPS0_FDSI0_GRPM0p80_GRVWA8_GRVWB8_GSU1_GSUAMB_GSUC0_GSUWGMRR1_GLS0_ISA942_IU1_K1_LBSPPA256_LBSPPB512_LBSPPM0_LPA16_LPB16_LPM0_LRVW8_LWPMn1_MIAV0_MIWT6_4_MO40_NTn1_NTA0_NTB0_NTC0_NTD4_NTM0_NEPBS0_NLCA1_NLCB1_ONLL0_PGR2_PLR1_PKA1_SIA3_SS1_SU2_SUM0_SUS128_SPO1_SRVW0_SSO0_SVW2_SK0_SKXCCM0_TLDS1_ULSGRO1_USL1_UIOFGRO0_USFGRO0_VSn1_VWA2_VWB4_WSGRA2_WSGRB2_WS64_WG32_8_1_WGM4_WGMXCC2_WGMXCCGn1
    SolutionIndex: 317
    SolutionNameMin: Cijk_Alik_Bljk_BBS_BH_Bias_HA_S_SAV_UserArgs_MT32x64x32_MI32x32x1_SN_LDSB1_AFC1_AFEM1_AFEM1_ASEM1_CLR1_CADS0_DTVA1_DTVB0_EPS0_FDSI0_GRPM0p27_GRVWA8_GRVWB8_GSU1_GSUAMB_GSUC0_GSUWGMRR0_GLS0_ISA942_IU1_K1_LBSPPA0_LBSPPB128_LBSPPM0_LPA0_LPB8_LPM0_LRVW8_LWPM0p80_MIAV0_MIWT1_2_MO40_NTn1_NTA0_NTB0_NTC4_NTD0_NTM0_NEPBS0_NLCA2_NLCB1_ONLL0_PGR2_PLR1_PKA1_SIA3_SS1_SU2_SUM0_SUS256_SPO0_SRVW0_SSO0_SVW1_SK0_SKXCCM0_TLDS1_ULSGRO0_USL1_UIOFGRO0_USFGRO0_VSn1_VWA1_VWB2_WSGRA0_WSGRB0_WS64_WG32_2_1_WGM266_WGMXCC1_WGMXCCG0
    SolutionIndex: 318
    SolutionNameMin: Cijk_Alik_Bljk_BBS_BH_Bias_HA_S_SAV_UserArgs_MT256x224x64_MI16x16x1_SN_LDSB1_AFC1_AFEM1_AFEM1_ASEM1_CLR1_CADS0_DTVA0_DTVB0_EPS0_FDSI0_GRPM1_GRVWA4_GRVWB4_GSU1_GSUAMB_GSUC0_GSUWGMRR0_GLS0_ISA942_IU1_K1_LBSPPA1024_LBSPPB128_LBSPPM0_LPA4_LPB4_LPM0_LRVW4_LWPMn1_MIAV0_MIWT8_7_MO40_NTn1_NTA0_NTB0_NTC0_NTD4_NTM0_NEPBS16_NLCA1_NLCB1_ONLL1_PGR2_PLR1_PKA1_SIA3_SS1_SU16_SUM0_SUS128_SPO0_SRVW0_SSO0_SVW8_SK0_SKXCCM0_TLDS1_ULSGRO0_USL1_UIOFGRO0_USFGROn1_VSn1_VWA8_VWB1_WSGRA0_WSGRB0_WS64_WG32_8_1_WGM8_WGMXCC8_WGMXCCG304
    SolutionIndex: 319
    SolutionNameMin: Cijk_Alik_Bljk_BBS_BH_Bias_HA_S_SAV_UserArgs_MT192x160x64_MI16x16x1_SN_LDSB1_AFC1_AFEM1_AFEM1_ASEM1_CLR1_CADS0_DTVA0_DTVB0_EPS0_FDSI0_GRPM0p70_GRVWA8_GRVWB8_GSU1_GSUAMB_GSUC0_GSUWGMRR0_GLS0_ISA942_IU1_K1_LBSPPA128_LBSPPB256_LBSPPM0_LPA16_LPB16_LPM0_LRVW8_LWPMn1_MIAV0_MIWT3_10_MO40_NTn1_NTA0_NTB0_NTC7_NTD4_NTM0_NEPBS0_NLCA1_NLCB1_ONLL1_PGR2_PLR1_PKA1_SIA3_SS1_SU16_SUM3_SUS128_SPO0_SRVW0_SSO0_SVW1_SK0_SKXCCM0_TLDS1_ULSGRO0_USL1_UIOFGRO0_USFGROn1_VSn1_VWA1_VWB2_WSGRA2_WSGRB2_WS64_WG64_4_1_WGM0_WGMXCC8_WGMXCCGn1
    SolutionIndex: 320
    SolutionNameMin: Cijk_Alik_Bljk_BBS_BH_Bias_HA_S_SAV_UserArgs_MT128x96x128_MI16x16x1_SN_LDSB1_AFC1_AFEM1_AFEM1_ASEM1_CLR1_CADS0_DTVA0_DTVB0_EPS0_FDSI0_GRPM1_GRVWA8_GRVWB8_GSU1_GSUAMBSK_GSUC0_GSUWGMRR0_GLS0_ISA942_IU1_K1_LBSPPA1024_LBSPPB256_LBSPPM0_LPA16_LPB16_LPM0_LRVW8_LWPMn1_MIAV0_MIWT4_3_MO40_NTn1_NTA0_NTB0_NTC4_NTD4_NTM0_NEPBS0_NLCA1_NLCB1_ONLL1_PGR2_PLR1_PKA1_SIA3_SS1_SU0_SUM0_SUS0_SPO0_SRVW0_SSO0_SVW4_SK0_SKXCCM0_TLDS2_ULSGRO0_USL1_UIOFGRO0_USFGROn1_VSn1_VWA4_VWB1_WSGRA0_WSGRB0_WS64_WG32_8_1_WGM0_WGMXCC8_WGMXCCG0
    SolutionIndex: 321
    SolutionNameMin: Cijk_Alik_Bljk_BBS_BH_Bias_HA_S_SAV_UserArgs_MT128x160x64_MI16x16x1_SN_LDSB1_AFC1_AFEM1_AFEM1_ASEM1_CLR1_CADS0_DTVA0_DTVB0_EPS0_FDSI0_GRPM1_GRVWA8_GRVWB8_GSU1_GSUAMB_GSUC0_GSUWGMRR0_GLS0_ISA942_IU1_K1_LBSPPA512_LBSPPB128_LBSPPM0_LPA16_LPB16_LPM0_LRVW8_LWPMn1_MIAV0_MIWT4_5_MO40_NTn1_NTA0_NTB0_NTC0_NTD4_NTM0_NEPBS0_NLCA1_NLCB1_ONLL0_PGR2_PLR1_PKA1_SIA3_SS1_SU64_SUM2_SUS2048_SPO1_SRVW0_SSO1_SVW4_SK0_SKXCCM0_TLDS2_ULSGRO1_USL1_UIOFGRO0_USFGROn1_VSn1_VWA4_VWB1_WSGRA0_WSGRB0_WS64_WG32_8_1_WGM0_WGMXCC8_WGMXCCG0
    SolutionIndex: 322
    SolutionNameMin: Cijk_Alik_Bljk_BBS_BH_Bias_HA_S_SAV_UserArgs_MT128x128x64_MI16x16x1_SN_LDSB1_AFC1_AFEM1_AFEM1_ASEM1_CLR1_CADS0_DTVA0_DTVB1_EPS0_FDSI0_GRPM0p26_GRVWA8_GRVWB8_GSU1_GSUAMB_GSUC1_GSUWGMRR1_GLS0_ISA942_IU1_K1_LBSPPA1024_LBSPPB0_LBSPPM0_LPA16_LPB0_LPM0_LRVW8_LWPM0p80_MIAV0_MIWT8_2_MO40_NTn1_NTA0_NTB0_NTC7_NTD4_NTM0_NEPBS6_NLCA1_NLCB2_ONLL1_PGR2_PLR1_PKA1_SIA3_SS1_SU2_SUM2_SUS512_SPO0_SRVW0_SSO0_SVW8_SK0_SKXCCM0_TLDS1_ULSGRO0_USL1_UIOFGRO0_USFGRO1_VSn1_VWA8_VWB2_WSGRA0_WSGRB0_WS64_WG16_16_1_WGM4_WGMXCC2_WGMXCCGn1
    SolutionIndex: 323
    SolutionNameMin: Cijk_Alik_Bljk_BBS_BH_Bias_HA_S_SAV_UserArgs_MT256x160x64_MI16x16x1_SN_LDSB1_AFC1_AFEM1_AFEM1_ASEM1_CLR1_CADS0_DTVA0_DTVB0_EPS0_FDSI0_GRPM0p26_GRVWA8_GRVWB8_GSU1_GSUAMB_GSUC1_GSUWGMRR0_GLS0_ISA942_IU1_K1_LBSPPA1024_LBSPPB128_LBSPPM0_LPA16_LPB16_LPM0_LRVW8_LWPMn1_MIAV0_MIWT8_5_MO40_NTn1_NTA0_NTB0_NTC4_NTD0_NTM0_NEPBS0_NLCA1_NLCB1_ONLL0_PGR2_PLR1_PKA1_SIA3_SS1_SU8_SUM0_SUS128_SPO0_SRVW0_SSO2_SVW8_SK0_SKXCCM0_TLDS2_ULSGRO1_USL1_UIOFGRO0_USFGRO0_VSn1_VWA8_VWB1_WSGRA0_WSGRB1_WS64_WG32_8_1_WGM4_WGMXCC1_WGMXCCGn1
    SolutionIndex: 324
    SolutionNameMin: Cijk_Alik_Bljk_BBS_BH_Bias_HA_S_SAV_UserArgs_MT64x32x64_MI16x16x1_SN_LDSB1_AFC1_AFEM1_AFEM1_ASEM1_CLR1_CADS0_DTVA0_DTVB0_EPS0_FDSI0_GRPM0p26_GRVWA8_GRVWB8_GSU1_GSUAMBSK_GSUC0_GSUWGMRR1_GLS0_ISA942_IU1_K1_LBSPPA512_LBSPPB128_LBSPPM0_LPA16_LPB16_LPM0_LRVW8_LWPM0p25_MIAV0_MIWT4_1_MO40_NTn1_NTA0_NTB0_NTC4_NTD7_NTM0_NEPBS4_NLCA1_NLCB1_ONLL1_PGR2_PLR1_PKA1_SIA3_SS1_SU4_SUM4_SUS128_SPO1_SRVW0_SSO1_SVW4_SK0_SKXCCM0_TLDS1_ULSGRO0_USL1_UIOFGRO0_USFGROn1_VSn1_VWA4_VWB1_WSGRA0_WSGRB0_WS64_WG16_8_1_WGM1_WGMXCC4_WGMXCCG0
    SolutionIndex: 325
    SolutionNameMin: Cijk_Alik_Bljk_BBS_BH_Bias_HA_S_SAV_UserArgs_MT64x96x128_MI16x16x1_SN_LDSB1_AFC1_AFEM1_AFEM1_ASEM1_CLR1_CADS0_DTVA0_DTVB0_EPS0_FDSI0_GRPM1_GRVWA8_GRVWB8_GSU1_GSUAMB_GSUC0_GSUWGMRR1_GLS0_ISA942_IU1_K1_LBSPPA512_LBSPPB256_LBSPPM0_LPA16_LPB16_LPM0_LRVW8_LWPM0p50_MIAV0_MIWT2_3_MO40_NTn1_NTA0_NTB0_NTC4_NTD4_NTM0_NEPBS0_NLCA1_NLCB1_ONLL2_PGR2_PLR1_PKA1_SIA3_SS1_SU4_SUM1_SUS1024_SPO0_SRVW0_SSO0_SVW2_SK0_SKXCCM0_TLDS2_ULSGRO0_USL1_UIOFGRO0_USFGROn1_VSn1_VWA2_VWB1_WSGRA1_WSGRB1_WS64_WG32_8_1_WGM1_WGMXCC8_WGMXCCG0
    SolutionIndex: 326
    SolutionNameMin: Cijk_Alik_Bljk_BBS_BH_Bias_HA_S_SAV_UserArgs_MT64x64x64_MI16x16x1_SN_LDSB0_AFC1_AFEM1_AFEM1_ASEM1_CLR1_CADS0_DTVA0_DTVB0_EPS0_FDSI0_GRPM0p25_GRVWA8_GRVWB8_GSU1_GSUAMB_GSUC0_GSUWGMRR0_GLS0_ISA942_IU1_K1_LBSPPA256_LBSPPB256_LBSPPM0_LPA16_LPB16_LPM0_LRVW8_LWPMn1_MIAV0_MIWT2_2_MO40_NTn1_NTA0_NTB0_NTC0_NTD4_NTM0_NEPBS0_NLCA1_NLCB1_ONLL0_PGR2_PLR1_PKA1_SIA3_SS1_SU2_SUM1_SUS1024_SPO1_SRVW0_SSO2_SVW2_SK0_SKXCCM0_TLDS2_ULSGRO0_USL1_UIOFGRO0_USFGROn1_VSn1_VWA2_VWB2_WSGRA1_WSGRB1_WS64_WG32_8_1_WGM8_WGMXCC1_WGMXCCGn1
    SolutionIndex: 327
    SolutionNameMin: Cijk_Alik_Bljk_BBS_BH_Bias_HA_S_SAV_UserArgs_MT64x96x128_MI16x16x1_SN_LDSB1_AFC1_AFEM1_AFEM1_ASEM1_CLR1_CADS0_DTVA0_DTVB0_EPS0_FDSI0_GRPM0p80_GRVWA8_GRVWB8_GSU1_GSUAMBSK_GSUC0_GSUWGMRR1_GLS0_ISA942_IU1_K1_LBSPPA512_LBSPPB256_LBSPPM0_LPA16_LPB16_LPM0_LRVW8_LWPM0p27_MIAV0_MIWT2_3_MO40_NTn1_NTA0_NTB0_NTC4_NTD7_NTM0_NEPBS8_NLCA1_NLCB1_ONLL1_PGR2_PLR1_PKA1_SIA3_SS1_SU4_SUM0_SUS256_SPO1_SRVW0_SSO0_SVW2_SK0_SKXCCM0_TLDS2_ULSGRO0_USL1_UIOFGRO0_USFGRO1_VSn1_VWA2_VWB1_WSGRA0_WSGRB0_WS64_WG32_8_1_WGM0_WGMXCC8_WGMXCCG32
    SolutionIndex: 328
    SolutionNameMin: Cijk_Alik_Bljk_BBS_BH_Bias_HA_S_SAV_UserArgs_MT16x16x256_MI16x16x1_SN_LDSB1_AFC1_AFEM1_AFEM1_ASEM1_CLR1_CADS0_DTVA1_DTVB0_EPS0_FDSI0_GRPM0p80_GRVWA8_GRVWB8_GSU1_GSUAMB_GSUC0_GSUWGMRR1_GLS0_ISA942_IU1_K1_LBSPPA0_LBSPPB512_LBSPPM0_LPA0_LPB16_LPM0_LRVW8_LWPM0p20_MIAV0_MIWT1_1_MO40_NTn1_NTA0_NTB4_NTC7_NTD0_NTM0_NEPBS8_NLCA8_NLCB1_ONLL1_PGR2_PLR1_PKA1_SIA3_SS1_SU4_SUM1_SUS512_SPO1_SRVW0_SSO0_SVW1_SK0_SKXCCM0_TLDS2_ULSGRO0_USL1_UIOFGRO0_USFGRO1_VSn1_VWA1_VWB1_WSGRA0_WSGRB1_WS64_WG16_4_1_WGM1_WGMXCC16_WGMXCCG0
    SolutionIndex: 329
    SolutionNameMin: Cijk_Alik_Bljk_BBS_BH_Bias_HA_S_SAV_UserArgs_MT256x224x64_MI16x16x1_SN_LDSB1_AFC1_AFEM1_AFEM1_ASEM1_CLR1_CADS0_DTVA0_DTVB0_EPS0_FDSI0_GRPM1_GRVWA4_GRVWB4_GSU1_GSUAMB_GSUC0_GSUWGMRR0_GLS0_ISA942_IU1_K1_LBSPPA1024_LBSPPB128_LBSPPM0_LPA4_LPB4_LPM0_LRVW4_LWPMn1_MIAV0_MIWT8_7_MO40_NTn1_NTA0_NTB0_NTC4_NTD4_NTM0_NEPBS16_NLCA1_NLCB1_ONLL1_PGR2_PLR1_PKA1_SIA3_SS1_SU8_SUM0_SUS256_SPO1_SRVW0_SSO0_SVW8_SK0_SKXCCM0_TLDS1_ULSGRO0_USL1_UIOFGRO0_USFGROn1_VSn1_VWA8_VWB1_WSGRA0_WSGRB0_WS64_WG32_8_1_WGM1_WGMXCC1_WGMXCCG304
    SolutionIndex: 330
    SolutionNameMin: Cijk_Alik_Bljk_BBS_BH_Bias_HA_S_SAV_UserArgs_MT128x80x32_MI16x16x1_SN_LDSB1_AFC1_AFEM1_AFEM1_ASEM1_CLR1_CADS0_DTVA0_DTVB0_EPS0_FDSI0_GRPM0p80_GRVWA4_GRVWB2_GSU1_GSUAMB_GSUC0_GSUWGMRR0_GLS0_ISA942_IU1_K1_LBSPPA128_LBSPPB128_LBSPPM0_LPA4_LPB4_LPM0_LRVW4_LWPMn1_MIAV0_MIWT2_5_MO40_NTn1_NTA0_NTB0_NTC7_NTD4_NTM0_NEPBS0_NLCA1_NLCB1_ONLL0_PGR2_PLR1_PKA1_SIA3_SS1_SU2_SUM0_SUS64_SPO1_SRVW0_SSO3_SVW2_SK0_SKXCCM0_TLDS2_ULSGRO0_USL1_UIOFGRO0_USFGROn1_VSn1_VWA2_VWB1_WSGRA1_WSGRB0_WS64_WG64_4_1_WGM2_WGMXCC1_WGMXCCGn1
    SolutionIndex: 331
    SolutionNameMin: Cijk_Alik_Bljk_BBS_BH_Bias_HA_S_SAV_UserArgs_MT256x128x32_MI16x16x1_SN_LDSB1_AFC1_AFEM1_AFEM1_ASEM1_CLR1_CADS0_DTVA0_DTVB0_EPS0_FDSI0_GRPM1_GRVWA4_GRVWB4_GSU1_GSUAMB_GSUC0_GSUWGMRR0_GLS0_ISA942_IU1_K1_LBSPPA512_LBSPPB256_LBSPPM0_LPA4_LPB4_LPM0_LRVW4_LWPMn1_MIAV0_MIWT8_4_MO40_NTn1_NTA0_NTB0_NTC0_NTD4_NTM0_NEPBS16_NLCA1_NLCB1_ONLL1_PGR2_PLR1_PKA1_SIA3_SS1_SU8_SUM1_SUS64_SPO0_SRVW0_SSO0_SVW8_SK0_SKXCCM0_TLDS1_ULSGRO0_USL1_UIOFGRO0_USFGROn1_VSn1_VWA8_VWB4_WSGRA0_WSGRB0_WS64_WG32_8_1_WGM6_WGMXCC8_WGMXCCG304
    SolutionIndex: 332
    SolutionNameMin: Cijk_Alik_Bljk_BBS_BH_Bias_HA_S_SAV_UserArgs_MT64x48x256_MI16x16x1_SN_LDSB1_AFC1_AFEM1_AFEM1_ASEM1_CLR1_CADS0_DTVA0_DTVB0_EPS0_FDSI0_GRPM0p70_GRVWA8_GRVWB8_GSU1_GSUAMB_GSUC0_GSUWGMRR1_GLS0_ISA942_IU1_K1_LBSPPA512_LBSPPB512_LBSPPM0_LPA16_LPB16_LPM0_LRVW8_LWPM1_MIAV0_MIWT1_3_MO40_NTn1_NTA0_NTB0_NTC0_NTD7_NTM0_NEPBS0_NLCA1_NLCB1_ONLL1_PGR2_PLR1_PKA1_SIA3_SS0_SU4_SUM0_SUS512_SPO0_SRVW0_SSO0_SVW4_SK0_SKXCCM0_TLDS1_ULSGRO0_USL1_UIOFGRO0_USFGROn1_VSn1_VWA1_VWB1_WSGRA2_WSGRB0_WS64_WG64_4_1_WGM0_WGMXCC8_WGMXCCG0
    SolutionIndex: 333
    SolutionNameMin: Cijk_Alik_Bljk_BBS_BH_Bias_HA_S_SAV_UserArgs_MT256x224x64_MI16x16x1_SN_LDSB1_AFC1_AFEM1_AFEM1_ASEM1_CLR1_CADS0_DTVA0_DTVB0_EPS0_FDSI0_GRPM1_GRVWA4_GRVWB4_GSU1_GSUAMB_GSUC0_GSUWGMRR0_GLS0_ISA942_IU1_K1_LBSPPA1024_LBSPPB128_LBSPPM0_LPA4_LPB4_LPM0_LRVW4_LWPMn1_MIAV0_MIWT8_7_MO40_NTn1_NTA0_NTB0_NTC0_NTD4_NTM0_NEPBS0_NLCA1_NLCB1_ONLL1_PGR2_PLR1_PKA1_SIA3_SS1_SU4_SUM0_SUS128_SPO0_SRVW0_SSO0_SVW8_SK0_SKXCCM0_TLDS1_ULSGRO0_USL1_UIOFGRO0_USFGROn1_VSn1_VWA8_VWB1_WSGRA0_WSGRB0_WS64_WG32_8_1_WGM2_WGMXCC1_WGMXCCGn1
    SolutionIndex: 334
    SolutionNameMin: Cijk_Alik_Bljk_BBS_BH_Bias_HA_S_SAV_UserArgs_MT192x320x64_MI16x16x1_SN_LDSB0_AFC1_AFEM1_AFEM1_ASEM1_CLR1_CADS0_DTVA0_DTVB1_EPS0_FDSI0_GRPM0p80_GRVWA8_GRVWB8_GSU1_GSUAMB_GSUC1_GSUWGMRR1_GLS0_ISA942_IU1_K1_LBSPPA512_LBSPPB0_LBSPPM0_LPA16_LPB0_LPM0_LRVW8_LWPMn1_MIAV0_MIWT12_5_MO40_NTn1_NTA0_NTB0_NTC0_NTD4_NTM0_NEPBS2_NLCA1_NLCB2_ONLL1_PGR2_PLR1_PKA1_SIA3_SS1_SU8_SUM4_SUS256_SPO1_SRVW0_SSO0_SVW4_SK0_SKXCCM0_TLDS2_ULSGRO0_USL1_UIOFGRO0_USFGROn1_VSn1_VWA4_VWB1_WSGRA2_WSGRB0_WS64_WG16_16_1_WGM4_WGMXCC1_WGMXCCGn1
    SolutionIndex: 335
    SolutionNameMin: Cijk_Alik_Bljk_BBS_BH_Bias_HA_S_SAV_UserArgs_MT128x96x64_MI16x16x1_SN_LDSB1_AFC1_AFEM1_AFEM1_ASEM1_CLR1_CADS0_DTVA0_DTVB0_EPS0_FDSI0_GRPM0p60_GRVWA8_GRVWB8_GSU1_GSUAMBSK_GSUC0_GSUWGMRR0_GLS0_ISA942_IU1_K1_LBSPPA512_LBSPPB128_LBSPPM0_LPA16_LPB16_LPM0_LRVW8_LWPMn1_MIAV0_MIWT4_3_MO40_NTn1_NTA0_NTB0_NTC7_NTD4_NTM0_NEPBS0_NLCA1_NLCB1_ONLL0_PGR2_PLR1_PKA1_SIA3_SS1_SU2_SUM0_SUS128_SPO0_SRVW0_SSO0_SVW4_SK0_SKXCCM0_TLDS1_ULSGRO0_USL1_UIOFGRO0_USFGROn1_VSn1_VWA4_VWB1_WSGRA2_WSGRB0_WS64_WG32_8_1_WGM1_WGMXCC8_WGMXCCG0
    SolutionIndex: 336
    SolutionNameMin: Cijk_Alik_Bljk_BBS_BH_Bias_HA_S_SAV_UserArgs_MT32x96x64_MI16x16x1_SN_LDSB1_AFC1_AFEM1_AFEM1_ASEM1_CLR1_CADS0_DTVA0_DTVB0_EPS0_FDSI0_GRPM1_GRVWA8_GRVWB8_GSU1_GSUAMB_GSUC0_GSUWGMRR1_GLS0_ISA942_IU1_K1_LBSPPA128_LBSPPB128_LBSPPM0_LPA16_LPB16_LPM0_LRVW8_LWPMn1_MIAV0_MIWT1_3_MO40_NTn1_NTA0_NTB0_NTC0_NTD0_NTM0_NEPBS16_NLCA1_NLCB1_ONLL1_PGR2_PLR1_PKA1_SIA3_SS1_SU0_SUM0_SUS0_SPO0_SRVW0_SSO0_SVW1_SK0_SKXCCM0_TLDS1_ULSGRO0_USL1_UIOFGRO0_USFGROn1_VSn1_VWA1_VWB1_WSGRA0_WSGRB0_WS64_WG32_8_1_WGM1_WGMXCC1_WGMXCCGn1
    SolutionIndex: 337
    SolutionNameMin: Cijk_Alik_Bljk_BBS_BH_Bias_HA_S_SAV_UserArgs_MT64x128x128_MI16x16x1_SN_LDSB1_AFC0_AFEM8_AFEM8_ASEM32_CLR1_CADS0_EPS0_FDSI0_GRPM1_GRVWA8_GRVWB8_GSU1_GSUAMB_GLS0_ISA942_IU1_LBSPPA1024_LBSPPB256_LBSPPM0_LPA16_LPB16_LPMn1_LRVW8_LWPMn1_MIAV0_MIWT4_4_MO40_NTn1_NTA0_NTB0_NTC0_NTD0_NTM0_NEPBS0_NLCA1_NLCB1_ONLL1_PGR2_PLR1_PKA1_SIA3_SS1_SU8_SUM1_SUS1024_SPO0_SRVW0_SSO0_SVW4_TLDS1_USL1_UIOFGRO0_USFGROn1_VSn1_VWA4_VWB1_WSGRA0_WSGRB0_WS64_WG16_8_2_WGM0_WGMXCC1
    SolutionIndex: 338
    SolutionNameMin: Cijk_Alik_Bljk_BBS_BH_Bias_HA_S_SAV_UserArgs_MT256x224x64_MI16x16x1_SN_LDSB1_AFC0_AFEM1_AFEM1_ASEM1_CLR1_CADS0_DTVA0_DTVB0_EPS0_FDSI0_GRPM1_GRVWA4_GRVWB4_GSU1_GSUAMB_GSUC0_GSUWGMRR0_GLS0_ISA942_IU1_K1_LBSPPA1024_LBSPPB128_LBSPPM0_LPA4_LPB4_LPM0_LRVW4_LWPMn1_MIAV0_MIWT8_7_MO40_NTn1_NTA0_NTB0_NTC0_NTD4_NTM0_NEPBS16_NLCA1_NLCB1_ONLL1_PGR2_PLR1_PKA1_SIA3_SS1_SU8_SUM0_SUS256_SPO1_SRVW0_SSO0_SVW8_SK0_SKXCCM0_TLDS1_ULSGRO0_USL1_UIOFGRO0_USFGROn1_VSn1_VWA8_VWB1_WSGRA0_WSGRB0_WS64_WG32_8_1_WGM16_WGMXCC4_WGMXCCG0
    SolutionIndex: 339
    SolutionNameMin: Cijk_Alik_Bljk_BBS_BH_Bias_HA_S_SAV_UserArgs_MT128x96x128_MI16x16x1_SN_LDSB1_AFC0_AFEM1_AFEM1_ASEM1_CLR1_CADS0_EPS0_FDSI0_GRPM1_GRVWA8_GRVWB8_GSU1_GSUAMB_GSUC0_GSUWGMRR0_GLS0_ISA942_IU1_K1_LBSPPA1024_LBSPPB256_LBSPPM0_LPA16_LPB16_LPM0_LRVW8_LWPMn1_MIAV0_MIWT4_3_MO40_NTn1_NTA0_NTB0_NTC0_NTD4_NTM0_NEPBS16_NLCA1_NLCB1_ONLL1_PGR2_PLR1_PKA1_SIA3_SS1_SU16_SUM0_SUS256_SPO0_SRVW0_SSO0_SVW4_TLDS1_ULSGRO0_USL1_UIOFGRO0_USFGROn1_VSn1_VWA4_VWB1_WSGRA1_WSGRB1_WS64_WG32_8_1_WGM8_WGMXCC8_WGMXCCG304
    SolutionIndex: 340
    SolutionNameMin: Cijk_Alik_Bljk_BBS_BH_Bias_HA_S_SAV_UserArgs_MT256x80x16_MI16x16x1_SN_LDSB1_AFC0_AFEM1_AFEM1_ASEM1_CLR0_CADS0_DTVA0_DTVB0_EPS0_FDSI0_GRPM0p60_GRVWA4_GRVWB1_GSU1_GSUAMB_GSUC0_GSUWGMRR1_GLS0_ISA942_IU1_K1_LBSPPA128_LBSPPB128_LBSPPM0_LPA4_LPB4_LPM0_LRVW4_LWPMn1_MIAV0_MIWT4_5_MO40_NTn1_NTA0_NTB0_NTC4_NTD4_NTM0_NEPBS0_NLCA1_NLCB1_ONLL0_PGR2_PLR1_PKA1_SIA3_SS1_SU4_SUM0_SUS64_SPO0_SRVW0_SSO1_SVW4_SK0_SKXCCM0_TLDS1_ULSGRO0_USL1_UIOFGRO0_USFGROn1_VSn1_VWA4_VWB1_WSGRA0_WSGRB0_WS64_WG64_4_1_WGM0_WGMXCC8_WGMXCCGn1
    SolutionIndex: 341
    SolutionNameMin: Cijk_Alik_Bljk_BBS_BH_Bias_HA_S_SAV_UserArgs_MT256x224x64_MI16x16x1_SN_LDSB1_AFC0_AFEM8_AFEM8_ASEM32_CLR1_EPS0_GRPM1_GRVWA4_GRVWB4_GSU1_GSUAMB_GLS0_ISA942_IU1_LBSPPA512_LBSPPB128_LBSPPM0_LPA4_LPB4_LPMn1_LRVW4_LWPMn1_MIAV0_MIWT4_14_MO40_NTn1_NTA0_NTB0_NTC0_NTD0_NTM0_NEPBS0_NLCA1_NLCB1_ONLL1_PGR2_PLR1_PKA1_SIA3_SS1_SU8_SUM0_SUS256_SPO0_SRVW0_SSO0_SVW4_TLDS1_USL1_UIOFGRO0_USFGROn1_VSn1_VWA4_VWB1_WSGRA0_WSGRB0_WS64_WG64_4_1_WGM40_WGMXCC1
    SolutionIndex: 342
    SolutionNameMin: Cijk_Alik_Bljk_BBS_BH_Bias_HA_S_SAV_UserArgs_MT64x16x256_MI16x16x1_SN_LDSB1_AFC1_AFEM1_AFEM1_ASEM1_CLR1_CADS0_DTVA0_DTVB0_EPS0_FDSI0_GRPM0p20_GRVWA8_GRVWB8_GSU1_GSUAMB_GSUC0_GSUWGMRR1_GLS0_ISA942_IU1_K1_LBSPPA512_LBSPPB512_LBSPPM0_LPA16_LPB16_LPM0_LRVW8_LWPMn1_MIAV0_MIWT1_1_MO40_NTn1_NTA5_NTB0_NTC2_NTD4_NTM0_NEPBS12_NLCA1_NLCB1_ONLL0_PGR2_PLR1_PKA1_SIA3_SS0_SU16_SUM1_SUS512_SPO0_SRVW0_SSO0_SVW4_SK0_SKXCCM0_TLDS2_ULSGRO0_USL1_UIOFGRO0_USFGROn1_VSn1_VWA1_VWB1_WSGRA0_WSGRB2_WS64_WG64_4_1_WGM0_WGMXCC8_WGMXCCGn1
    SolutionIndex: 343
    SolutionNameMin: Cijk_Alik_Bljk_BBS_BH_Bias_HA_S_SAV_UserArgs_MT160x192x32_MI16x16x1_SN_LDSB1_AFC1_AFEM1_AFEM1_ASEM1_CLR1_CADS0_DTVA0_DTVB0_EPS0_FDSI0_GRPM1_GRVWA2_GRVWB2_GSU1_GSUAMB_GSUC0_GSUWGMRR0_GLS0_ISA942_IU1_K1_LBSPPA128_LBSPPB128_LBSPPM0_LPA4_LPB4_LPM0_LRVW4_LWPMn1_MIAV0_MIWT10_3_MO40_NTn1_NTA0_NTB0_NTC0_NTD4_NTM0_NEPBS16_NLCA1_NLCB1_ONLL1_PGR2_PLR1_PKA1_SIA3_SS1_SU8_SUM1_SUS64_SPO0_SRVW0_SSO0_SVW2_SK0_SKXCCM0_TLDS1_ULSGRO0_USL1_UIOFGRO0_USFGROn1_VSn1_VWA2_VWB1_WSGRA0_WSGRB0_WS64_WG16_16_1_WGM6_WGMXCC8_WGMXCCGn1
    SolutionIndex: 344
    SolutionNameMin: Cijk_Alik_Bljk_BBS_BH_Bias_HA_S_SAV_UserArgs_MT256x192x64_MI16x16x1_SN_LDSB1_AFC1_AFEM1_AFEM1_ASEM1_CLR1_CADS0_DTVA0_DTVB0_EPS0_FDSI0_GRPM1_GRVWA8_GRVWB8_GSU1_GSUAMB_GSUC0_GSUWGMRR0_GLS0_ISA942_IU1_K1_LBSPPA1024_LBSPPB256_LBSPPM0_LPA16_LPB16_LPM0_LRVW8_LWPMn1_MIAV0_MIWT8_6_MO40_NTn1_NTA0_NTB0_NTC0_NTD4_NTM0_NEPBS16_NLCA1_NLCB1_ONLL1_PGR2_PLR1_PKA1_SIA3_SS1_SU8_SUM1_SUS128_SPO0_SRVW0_SSO0_SVW8_SK0_SKXCCM0_TLDS1_ULSGRO0_USL1_UIOFGRO0_USFGROn1_VSn1_VWA8_VWB2_WSGRA0_WSGRB0_WS64_WG32_8_1_WGM6_WGMXCC8_WGMXCCGn1
    SolutionIndex: 345
    SolutionNameMin: Cijk_Alik_Bljk_BBS_BH_Bias_HA_S_SAV_UserArgs_MT128x128x64_MI16x16x1_SN_LDSB1_AFC1_AFEM1_AFEM1_ASEM1_CLR1_CADS0_DTVA0_DTVB0_EPS0_FDSI0_GRPM1_GRVWA8_GRVWB8_GSU1_GSUAMB_GSUC0_GSUWGMRR0_GLS0_ISA942_IU1_K1_LBSPPA512_LBSPPB512_LBSPPM0_LPA16_LPB16_LPM0_LRVW8_LWPMn1_MIAV0_MIWT4_4_MO40_NTn1_NTA0_NTB0_NTC0_NTD4_NTM0_NEPBS16_NLCA1_NLCB1_ONLL1_PGR2_PLR1_PKA1_SIA3_SS1_SU16_SUM0_SUS128_SPO0_SRVW0_SSO0_SVW4_SK0_SKXCCM0_TLDS1_ULSGRO0_USL1_UIOFGRO0_USFGROn1_VSn1_VWA4_VWB4_WSGRA0_WSGRB0_WS64_WG32_8_1_WGM8_WGMXCC8_WGMXCCGn1
    SolutionIndex: 346
    SolutionNameMin: Cijk_Alik_Bljk_BBS_BH_Bias_HA_S_SAV_UserArgs_MT192x160x32_MI16x16x1_SN_LDSB1_AFC1_AFEM1_AFEM1_ASEM1_CLR1_CADS0_DTVA0_DTVB0_EPS0_FDSI0_GRPM1_GRVWA2_GRVWB2_GSU1_GSUAMB_GSUC0_GSUWGMRR0_GLS0_ISA942_IU1_K1_LBSPPA128_LBSPPB128_LBSPPM0_LPA4_LPB4_LPM0_LRVW4_LWPMn1_MIAV0_MIWT3_10_MO40_NTn1_NTA0_NTB0_NTC0_NTD4_NTM0_NEPBS16_NLCA1_NLCB1_ONLL1_PGR2_PLR1_PKA1_SIA3_SS1_SU8_SUM1_SUS64_SPO0_SRVW0_SSO0_SVW1_SK0_SKXCCM0_TLDS1_ULSGRO0_USL1_UIOFGRO0_USFGROn1_VSn1_VWA1_VWB2_WSGRA0_WSGRB0_WS64_WG64_4_1_WGM6_WGMXCC8_WGMXCCGn1
    SolutionIndex: 347
    SolutionNameMin: Cijk_Alik_Bljk_BBS_BH_Bias_HA_S_SAV_UserArgs_MT160x128x64_MI16x16x1_SN_LDSB1_AFC1_AFEM1_AFEM1_ASEM1_CLR1_CADS0_DTVA0_DTVB0_EPS0_FDSI0_GRPM1_GRVWA8_GRVWB8_GSU1_GSUAMB_GSUC0_GSUWGMRR0_GLS0_ISA942_IU1_K1_LBSPPA256_LBSPPB256_LBSPPM0_LPA16_LPB16_LPM0_LRVW8_LWPMn1_MIAV0_MIWT10_2_MO40_NTn1_NTA4_NTB0_NTC0_NTD4_NTM0_NEPBS16_NLCA1_NLCB1_ONLL1_PGR2_PLR1_PKA1_SIA3_SS1_SU8_SUM0_SUS128_SPO0_SRVW0_SSO0_SVW2_SK0_SKXCCM0_TLDS1_ULSGRO0_USL1_UIOFGRO0_USFGROn1_VSn1_VWA2_VWB2_WSGRA0_WSGRB0_WS64_WG16_16_1_WGM1_WGMXCC8_WGMXCCGn1
    SolutionIndex: 348
    SolutionNameMin: Cijk_Alik_Bljk_BBS_BH_Bias_HA_S_SAV_UserArgs_MT224x192x64_MI16x16x1_SN_LDSB1_AFC1_AFEM1_AFEM1_ASEM1_CLR1_CADS0_DTVA0_DTVB0_EPS0_FDSI0_GRPM1_GRVWA8_GRVWB8_GSU1_GSUAMB_GSUC0_GSUWGMRR0_GLS0_ISA942_IU1_K1_LBSPPA256_LBSPPB128_LBSPPM0_LPA16_LPB16_LPM0_LRVW8_LWPMn1_MIAV0_MIWT14_3_MO40_NTn1_NTA4_NTB0_NTC0_NTD4_NTM0_NEPBS16_NLCA1_NLCB1_ONLL1_PGR2_PLR1_PKA1_SIA3_SS1_SU8_SUM1_SUS128_SPO0_SRVW0_SSO0_SVW2_SK0_SKXCCM0_TLDS1_ULSGRO0_USL1_UIOFGRO0_USFGROn1_VSn1_VWA2_VWB1_WSGRA0_WSGRB0_WS64_WG16_16_1_WGM6_WGMXCC8_WGMXCCGn1
    SolutionIndex: 349
    SolutionNameMin: Cijk_Alik_Bljk_BBS_BH_Bias_HA_S_SAV_UserArgs_MT192x192x64_MI16x16x1_SN_LDSB1_AFC1_AFEM1_AFEM1_ASEM1_CLR1_CADS0_DTVA0_DTVB0_EPS0_FDSI0_GRPM1_GRVWA8_GRVWB8_GSU1_GSUAMB_GSUC0_GSUWGMRR0_GLS0_ISA942_IU1_K1_LBSPPA256_LBSPPB256_LBSPPM0_LPA16_LPB16_LPM0_LRVW8_LWPMn1_MIAV0_MIWT6_6_MO40_NTn1_NTA0_NTB0_NTC0_NTD4_NTM0_NEPBS8_NLCA1_NLCB1_ONLL1_PGR2_PLR1_PKA1_SIA3_SS1_SU0_SUM0_SUS0_SPO0_SRVW0_SSO0_SVW2_SK0_SKXCCM0_TLDS1_ULSGRO0_USL1_UIOFGRO0_USFGROn1_VSn1_VWA2_VWB2_WSGRA0_WSGRB0_WS64_WG32_8_1_WGM6_WGMXCC8_WGMXCCGn1
    SolutionIndex: 350
    SolutionNameMin: Cijk_Alik_Bljk_BBS_BH_Bias_HA_S_SAV_UserArgs_MT64x64x128_MI16x16x1_SN_LDSB1_AFC1_AFEM1_AFEM1_ASEM1_CLR1_CADS0_DTVA0_DTVB0_EPS0_FDSI0_GRPM1_GRVWA8_GRVWB8_GSU1_GSUAMB_GSUC0_GSUWGMRR0_GLS0_ISA942_IU1_K1_LBSPPA1024_LBSPPB256_LBSPPM0_LPA16_LPB16_LPM0_LRVW8_LWPMn1_MIAV0_MIWT4_1_MO40_NTn1_NTA0_NTB0_NTC0_NTD4_NTM0_NEPBS16_NLCA1_NLCB1_ONLL1_PGR2_PLR1_PKA1_SIA3_SS1_SU16_SUM0_SUS256_SPO0_SRVW0_SSO0_SVW4_SK0_SKXCCM0_TLDS1_ULSGRO0_USL1_UIOFGRO0_USFGROn1_VSn1_VWA4_VWB1_WSGRA0_WSGRB0_WS64_WG16_16_1_WGM8_WGMXCC8_WGMXCCGn1
    SolutionIndex: 351
    SolutionNameMin: Cijk_Alik_Bljk_BBS_BH_Bias_HA_S_SAV_UserArgs_MT64x64x128_MI16x16x1_SN_LDSB1_AFC1_AFEM1_AFEM1_ASEM1_CLR1_CADS0_DTVA0_DTVB0_EPS0_FDSI0_GRPM1_GRVWA8_GRVWB8_GSU1_GSUAMB_GSUC0_GSUWGMRR0_GLS0_ISA942_IU1_K1_LBSPPA512_LBSPPB512_LBSPPM0_LPA16_LPB16_LPM0_LRVW8_LWPMn1_MIAV0_MIWT2_2_MO40_NTn1_NTA0_NTB0_NTC0_NTD4_NTM0_NEPBS16_NLCA1_NLCB1_ONLL1_PGR2_PLR1_PKA1_SIA3_SS1_SU16_SUM0_SUS256_SPO0_SRVW0_SSO0_SVW2_SK0_SKXCCM0_TLDS1_ULSGRO0_USL1_UIOFGRO0_USFGROn1_VSn1_VWA2_VWB2_WSGRA0_WSGRB0_WS64_WG32_8_1_WGM8_WGMXCC8_WGMXCCGn1
    SolutionIndex: 352
    SolutionNameMin: Cijk_Alik_Bljk_BBS_BH_Bias_HA_S_SAV_UserArgs_MT256x128x64_MI16x16x1_SN_LDSB1_AFC1_AFEM1_AFEM1_ASEM1_CLR1_CADS0_DTVA0_DTVB0_EPS0_FDSI0_GRPM1_GRVWA8_GRVWB8_GSU1_GSUAMB_GSUC0_GSUWGMRR0_GLS0_ISA942_IU1_K1_LBSPPA512_LBSPPB1024_LBSPPM0_LPA16_LPB16_LPM0_LRVW8_LWPMn1_MIAV0_MIWT4_8_MO40_NTn1_NTA0_NTB0_NTC0_NTD4_NTM0_NEPBS16_NLCA1_NLCB1_ONLL1_PGR2_PLR1_PKA1_SIA3_SS1_SU8_SUM1_SUS128_SPO0_SRVW0_SSO0_SVW4_SK0_SKXCCM0_TLDS1_ULSGRO0_USL1_UIOFGRO0_USFGROn1_VSn1_VWA4_VWB8_WSGRA0_WSGRB0_WS64_WG64_4_1_WGM6_WGMXCC8_WGMXCCGn1
    SolutionIndex: 353
    SolutionNameMin: Cijk_Alik_Bljk_BBS_BH_Bias_HA_S_SAV_UserArgs_MT128x160x64_MI16x16x1_SN_LDSB1_AFC1_AFEM1_AFEM1_ASEM1_CLR1_CADS0_DTVA0_DTVB0_EPS0_FDSI0_GRPM1_GRVWA8_GRVWB8_GSU1_GSUAMB_GSUC0_GSUWGMRR0_GLS0_ISA942_IU1_K1_LBSPPA512_LBSPPB128_LBSPPM0_LPA16_LPB16_LPM0_LRVW8_LWPMn1_MIAV0_MIWT4_5_MO40_NTn1_NTA0_NTB0_NTC0_NTD4_NTM0_NEPBS16_NLCA1_NLCB1_ONLL1_PGR2_PLR1_PKA1_SIA3_SS1_SU16_SUM0_SUS128_SPO0_SRVW0_SSO0_SVW4_SK0_SKXCCM0_TLDS1_ULSGRO0_USL1_UIOFGRO0_USFGROn1_VSn1_VWA4_VWB1_WSGRA0_WSGRB0_WS64_WG32_8_1_WGM8_WGMXCC8_WGMXCCGn1
    SolutionIndex: 354
    SolutionNameMin: Cijk_Alik_Bljk_BBS_BH_Bias_HA_S_SAV_UserArgs_MT160x128x64_MI16x16x1_SN_LDSB1_AFC1_AFEM1_AFEM1_ASEM1_CLR1_CADS0_DTVA0_DTVB0_EPS0_FDSI0_GRPM1_GRVWA8_GRVWB8_GSU1_GSUAMB_GSUC0_GSUWGMRR0_GLS0_ISA942_IU1_K1_LBSPPA128_LBSPPB512_LBSPPM0_LPA16_LPB16_LPM0_LRVW8_LWPMn1_MIAV0_MIWT5_4_MO40_NTn1_NTA0_NTB0_NTC0_NTD4_NTM0_NEPBS16_NLCA1_NLCB1_ONLL1_PGR2_PLR1_PKA1_SIA3_SS1_SU16_SUM0_SUS128_SPO0_SRVW0_SSO0_SVW1_SK0_SKXCCM0_TLDS1_ULSGRO0_USL1_UIOFGRO0_USFGROn1_VSn1_VWA1_VWB4_WSGRA0_WSGRB0_WS64_WG32_8_1_WGM6_WGMXCC8_WGMXCCGn1
    SolutionIndex: 355
    SolutionNameMin: Cijk_Alik_Bljk_BBS_BH_Bias_HA_S_SAV_UserArgs_MT256x256x32_MI16x16x1_SN_LDSB1_AFC1_AFEM1_AFEM1_ASEM1_CLR1_CADS0_EPS0_FDSI0_GRPM1_GRVWA4_GRVWB4_GSU1_GSUAMB_GSUC0_GLS0_ISA942_IU1_LBSPPA512_LBSPPB512_LBSPPM0_LPA4_LPB4_LPM0_LRVW4_LWPMn1_MIAV0_MIWT8_8_MO40_NTn1_NTA0_NTB0_NTC0_NTD4_NTM0_NEPBS0_NLCA1_NLCB1_ONLL1_PGR2_PLR1_PKA1_SIA3_SS1_SU8_SUM0_SUS256_SPO0_SRVW0_SSO0_SVW8_TLDS1_ULSGRO1_USL1_UIOFGRO0_USFGROn1_VSn1_VWA8_VWB8_WSGRA0_WSGRB0_WS64_WG32_8_1_WGM0_WGMXCC8_WGMXCCGn1
    SolutionIndex: 356
    SolutionNameMin: Cijk_Alik_Bljk_BBS_BH_Bias_HA_S_SAV_UserArgs_MT128x96x128_MI16x16x1_SN_LDSB1_AFC1_AFEM1_AFEM1_ASEM1_CLR1_CADS0_DTVA0_DTVB0_EPS0_FDSI0_GRPM1_GRVWA8_GRVWB8_GSU4_GSUAMB_GSUC0_GSUWGMRR0_GLS0_ISA942_IU1_K1_LBSPPA512_LBSPPB512_LBSPPM0_LPA16_LPB16_LPM0_LRVW8_LWPMn1_MIAV0_MIWT2_6_MO40_NTn1_NTA0_NTB0_NTC0_NTD0_NTM0_NEPBS16_NLCA1_NLCB1_ONLL1_PGR2_PLR1_PKA1_SIA3_SS1_SU0_SUM0_SUS0_SPO0_SRVW0_SSO0_SVW2_SK0_SKXCCM0_TLDS1_ULSGRO0_USL1_UIOFGRO0_USFGROn1_VSn1_VWA2_VWB2_WSGRA0_WSGRB0_WS64_WG64_4_1_WGM1_WGMXCC8_WGMXCCGn1
    SolutionIndex: 357
    SolutionNameMin: Cijk_Alik_Bljk_BBS_BH_Bias_HA_S_SAV_UserArgs_MT128x128x64_MI16x16x1_SN_LDSB1_AFC1_AFEM1_AFEM1_ASEM1_CLR1_CADS0_DTVA0_DTVB0_EPS0_FDSI0_GRPM1_GRVWA8_GRVWB8_GSU1_GSUAMB_GSUC0_GSUWGMRR0_GLS0_ISA942_IU1_K1_LBSPPA1024_LBSPPB256_LBSPPM0_LPA16_LPB16_LPM0_LRVW8_LWPMn1_MIAV0_MIWT8_2_MO40_NTn1_NTA0_NTB0_NTC0_NTD4_NTM0_NEPBS16_NLCA1_NLCB1_ONLL1_PGR2_PLR1_PKA1_SIA3_SS1_SU16_SUM0_SUS128_SPO0_SRVW0_SSO0_SVW8_SK0_SKXCCM0_TLDS1_ULSGRO0_USL1_UIOFGRO0_USFGROn1_VSn1_VWA8_VWB2_WSGRA0_WSGRB0_WS64_WG16_16_1_WGM8_WGMXCC8_WGMXCCGn1
    SolutionIndex: 358
    SolutionNameMin: Cijk_Alik_Bljk_BBS_BH_Bias_HA_S_SAV_UserArgs_MT96x320x32_MI16x16x1_SN_LDSB1_AFC1_AFEM1_AFEM1_ASEM1_CLR1_CADS0_DTVA0_DTVB0_EPS0_FDSI0_GRPM1_GRVWA2_GRVWB2_GSU1_GSUAMB_GSUC0_GSUWGMRR0_GLS0_ISA942_IU1_K1_LBSPPA128_LBSPPB128_LBSPPM0_LPA4_LPB4_LPM0_LRVW4_LWPMn1_MIAV0_MIWT6_5_MO40_NTn1_NTA0_NTB0_NTC0_NTD4_NTM0_NEPBS16_NLCA1_NLCB1_ONLL1_PGR2_PLR1_PKA1_SIA3_SS1_SU8_SUM1_SUS64_SPO0_SRVW0_SSO0_SVW2_SK0_SKXCCM0_TLDS1_ULSGRO0_USL1_UIOFGRO0_USFGROn1_VSn1_VWA2_VWB1_WSGRA0_WSGRB0_WS64_WG16_16_1_WGM6_WGMXCC8_WGMXCCGn1
- - - [2048, 64896, 1, 512]
    - [0, 0.0]
  - - [2048, 17556, 1, 512]
    - [63, 0.0]
  - - [512, 14, 1, 256]
    - [1, 0.0]
  - - [2048, 16302, 1, 512]
    - [63, 0.0]
  - - [512, 13, 1, 256]
    - [2, 0.0]
  - - [8192, 3500, 1, 2048]
    - [3, 0.0]
  - - [512, 3500, 1, 512]
    - [4, 0.0]
  - - [2048, 17052, 1, 512]
    - [63, 0.0]
  - - [262144, 13, 1, 256]
    - [5, 0.0]
  - - [256, 14, 1, 2560]
    - [6, 0.0]
  - - [262144, 14, 1, 256]
    - [7, 0.0]
  - - [8192, 3250, 1, 2048]
    - [8, 0.0]
  - - [256, 13, 1, 2560]
    - [9, 0.0]
  - - [512, 3250, 1, 512]
    - [10, 0.0]
  - - [256, 14, 1, 256]
    - [11, 0.0]
  - - [2048, 1024, 1, 5560]
    - [12, 0.0]
  - - [1, 1024, 1, 256]
    - [13, 0.0]
  - - [512, 1024, 1, 5744]
    - [14, 0.0]
  - - [128, 1024, 1, 10624]
    - [15, 0.0]
  - - [512, 1024, 1, 5560]
    - [16, 0.0]
  - - [1024, 1024, 1, 3840]
    - [17, 0.0]
  - - [1024, 1024, 1, 2872]
    - [18, 0.0]
  - - [2872, 1024, 1, 512]
    - [19, 0.0]
  - - [1, 1024, 1, 128]
    - [20, 0.0]
  - - [128, 1024, 1, 7040]
    - [21, 0.0]
  - - [128, 1024, 1, 4416]
    - [22, 0.0]
  - - [128, 1024, 1, 6784]
    - [23, 0.0]
  - - [512, 1024, 1, 2872]
    - [24, 0.0]
  - - [256, 1024, 1, 4608]
    - [25, 0.0]
  - - [512, 1024, 1, 3072]
    - [26, 0.0]
  - - [5560, 1024, 1, 2780]
    - [27, 0.0]
  - - [2780, 1024, 1, 5560]
    - [28, 0.0]
  - - [512, 16, 1, 256]
    - [95, 0.0]
  - - [512, 32, 1, 256]
    - [1, 0.0]
  - - [8192, 4000, 1, 2048]
    - [114, 0.0]
  - - [512, 4000, 1, 512]
    - [29, 0.0]
  - - [8192, 8000, 1, 2048]
    - [30, 0.0]
  - - [512, 8000, 1, 512]
    - [31, 0.0]
  - - [262144, 16, 1, 256]
    - [32, 0.0]
  - - [256, 16, 1, 2560]
    - [9, 0.0]
  - - [262144, 32, 1, 256]
    - [33, 0.0]
  - - [256, 32, 1, 2560]
    - [34, 0.0]
  - - [256, 13, 1, 256]
    - [35, 0.0]
  - - [2048, 2048, 1, 5560]
    - [36, 0.0]
  - - [1, 2048, 1, 256]
    - [20, 0.0]
  - - [512, 2048, 1, 5744]
    - [37, 0.0]
  - - [128, 2048, 1, 10624]
    - [38, 0.0]
  - - [512, 2048, 1, 5560]
    - [39, 0.0]
  - - [1024, 2048, 1, 3840]
    - [40, 0.0]
  - - [1024, 2048, 1, 2872]
    - [41, 0.0]
  - - [2872, 2048, 1, 512]
    - [42, 0.0]
  - - [1, 2048, 1, 128]
    - [43, 0.0]
  - - [128, 2048, 1, 7040]
    - [44, 0.0]
  - - [128, 2048, 1, 4416]
    - [45, 0.0]
  - - [128, 2048, 1, 6784]
    - [46, 0.0]
  - - [512, 2048, 1, 2872]
    - [47, 0.0]
  - - [256, 2048, 1, 4608]
    - [48, 0.0]
  - - [512, 2048, 1, 3072]
    - [49, 0.0]
  - - [2048, 4096, 1, 5560]
    - [50, 0.0]
  - - [1, 4096, 1, 256]
    - [20, 0.0]
  - - [512, 4096, 1, 5744]
    - [51, 0.0]
  - - [128, 4096, 1, 10624]
    - [52, 0.0]
  - - [512, 4096, 1, 5560]
    - [63, 0.0]
  - - [1024, 4096, 1, 3840]
    - [53, 0.0]
  - - [1024, 4096, 1, 2872]
    - [54, 0.0]
  - - [2872, 4096, 1, 512]
    - [63, 0.0]
  - - [1, 4096, 1, 128]
    - [13, 0.0]
  - - [128, 4096, 1, 7040]
    - [55, 0.0]
  - - [128, 4096, 1, 4416]
    - [56, 0.0]
  - - [128, 4096, 1, 6784]
    - [57, 0.0]
  - - [512, 4096, 1, 2872]
    - [58, 0.0]
  - - [256, 4096, 1, 4608]
    - [59, 0.0]
  - - [512, 4096, 1, 3072]
    - [60, 0.0]
  - - [2048, 152710, 1, 512]
    - [61, 0.0]
  - - [256, 16, 1, 256]
    - [62, 0.0]
  - - [256, 32, 1, 256]
    - [2, 0.0]
  - - [4000, 2, 1, 8192]
    - [64, 0.0]
  - - [4000, 4, 1, 8192]
    - [64, 0.0]
  - - [4000, 8, 1, 8192]
    - [65, 0.0]
  - - [4000, 16, 1, 8192]
    - [66, 0.0]
  - - [4000, 32, 1, 8192]
    - [67, 0.0]
  - - [4000, 64, 1, 8192]
    - [68, 0.0]
  - - [4000, 96, 1, 8192]
    - [69, 0.0]
  - - [1280, 2, 1, 8192]
    - [70, 0.0]
  - - [1280, 16, 1, 8192]
    - [71, 0.0]
  - - [1280, 32, 1, 8192]
    - [72, 0.0]
  - - [1280, 64, 1, 8192]
    - [73, 0.0]
  - - [1280, 96, 1, 8192]
    - [74, 0.0]
  - - [8192, 2, 1, 1024]
    - [75, 0.0]
  - - [8192, 4, 1, 1024]
    - [76, 0.0]
  - - [8192, 8, 1, 1024]
    - [77, 0.0]
  - - [8192, 16, 1, 1024]
    - [78, 0.0]
  - - [8192, 32, 1, 1024]
    - [79, 0.0]
  - - [8192, 64, 1, 1024]
    - [80, 0.0]
  - - [8192, 96, 1, 1024]
    - [81, 0.0]
  - - [7168, 32, 1, 8192]
    - [82, 0.0]
  - - [8192, 2, 1, 3584]
    - [83, 0.0]
  - - [8192, 4, 1, 3584]
    - [84, 0.0]
  - - [8192, 8, 1, 3584]
    - [85, 0.0]
  - - [8192, 16, 1, 3584]
    - [86, 0.0]
  - - [8192, 32, 1, 3584]
    - [87, 0.0]
  - - [8192, 96, 1, 3584]
    - [88, 0.0]
  - - [1280, 4, 1, 8192]
    - [89, 0.0]
  - - [1280, 8, 1, 8192]
    - [89, 0.0]
  - - [7168, 2, 1, 8192]
    - [90, 0.0]
  - - [7168, 4, 1, 8192]
    - [91, 0.0]
  - - [7168, 8, 1, 8192]
    - [91, 0.0]
  - - [7168, 16, 1, 8192]
    - [91, 0.0]
  - - [7168, 64, 1, 8192]
    - [92, 0.0]
  - - [7168, 96, 1, 8192]
    - [93, 0.0]
  - - [8192, 64, 1, 3584]
    - [94, 0.0]
  - - [61440, 16, 1, 256]
    - [117, 0.0]
  - - [256, 27, 1, 256]
    - [96, 0.0]
  - - [256, 27, 1, 2560]
    - [97, 0.0]
  - - [512, 27, 1, 256]
    - [98, 0.0]
  - - [61440, 27, 1, 256]
    - [99, 0.0]
  - - [262144, 27, 1, 256]
    - [100, 0.0]
  - - [512, 33, 1, 256]
    - [101, 0.0]
  - - [8, 4000, 1, 2048]
    - [102, 0.0]
  - - [512, 4000, 1, 384]
    - [103, 0.0]
  - - [6, 5940, 1, 512]
    - [104, 0.0]
  - - [8, 5940, 1, 2048]
    - [105, 0.0]
  - - [11, 5940, 1, 512]
    - [104, 0.0]
  - - [15, 5940, 1, 32]
    - [106, 0.0]
  - - [32, 5940, 1, 64]
    - [107, 0.0]
  - - [35, 5940, 1, 128]
    - [108, 0.0]
  - - [64, 5940, 1, 128]
    - [109, 0.0]
  - - [128, 5940, 1, 128]
    - [110, 0.0]
  - - [128, 5940, 1, 548]
    - [111, 0.0]
  - - [384, 5940, 1, 513]
    - [112, 0.0]
  - - [512, 5940, 1, 384]
    - [115, 0.0]
  - - [512, 5940, 1, 512]
    - [113, 0.0]
  - - [8192, 5940, 1, 2048]
    - [118, 0.0]
  - - [512, 68850, 1, 516]
    - [116, 0.0]
  - - [208448, 1792, 1, 1024]
    - [119, 0.0]
  - - [20352, 1792, 1, 1024]
    - [120, 0.0]
  - - [200, 128, 1792, 384]
    - [121, 0.0]
  - - [208448, 1792, 1, 256]
    - [122, 0.0]
  - - [2048, 1792, 1, 208448]
    - [124, 0.0]
  - - [256, 1792, 1, 49152]
    - [123, 0.0]
  - - [2304, 2, 1, 16384]
    - [125, 0.0]
  - - [13312, 2, 1, 16384]
    - [126, 0.0]
  - - [16384, 2, 1, 2048]
    - [127, 0.0]
  - - [16384, 2, 1, 6656]
    - [131, 0.0]
  - - [128256, 2, 1, 16384]
    - [128, 0.0]
  - - [13312, 8192, 1, 16384]
    - [130, 0.0]
  - - [16384, 8192, 1, 2048]
    - [129, 0.0]
  - - [2304, 8192, 1, 16384]
    - [130, 0.0]
  - - [16384, 8192, 1, 6656]
    - [130, 0.0]
  - - [128256, 8192, 1, 16384]
    - [130, 0.0]
  - - [2048, 1024, 1, 208448]
    - [132, 0.0]
  - - [384, 204800, 1, 384]
    - [133, 0.0]
  - - [26496, 1024, 1, 1024]
    - [134, 0.0]
  - - [2048, 1024, 1, 8224]
    - [135, 0.0]
  - - [20352, 1024, 1, 1024]
    - [136, 0.0]
  - - [24448, 1024, 1, 1024]
    - [137, 0.0]
  - - [208448, 1024, 1, 1024]
    - [138, 0.0]
  - - [1024, 1024, 1, 24448]
    - [139, 0.0]
  - - [1024, 1024, 1, 26496]
    - [140, 0.0]
  - - [1024, 1024, 1, 22400]
    - [141, 0.0]
  - - [1024, 1024, 1, 20352]
    - [142, 0.0]
  - - [1024, 1024, 1, 18304]
    - [143, 0.0]
  - - [1024, 1024, 1, 16256]
    - [144, 0.0]
  - - [16032, 8192, 1, 16384]
    - [130, 0.0]
  - - [2048, 1152, 1, 2048]
    - [229, 365271.0]
  - - [2048, 462, 1, 4096]
    - [145, 238481.0]
  - - [16384, 1152, 1, 2048]
    - [223, 482015.0]
  - - [2048, 1152, 1, 8192]
    - [224, 421424.0]
  - - [8192, 4608, 1, 1024]
    - [161, 502189.0]
  - - [1024, 4608, 1, 1024]
    - [226, 382191.0]
  - - [1024, 462, 1, 4096]
    - [184, 176348.0]
  - - [1024, 4608, 1, 4096]
    - [225, 404145.0]
  - - [2048, 462, 1, 768]
    - [146, 153261.0]
  - - [4096, 18432, 1, 512]
    - [162, 447793.0]
  - - [512, 18432, 1, 512]
    - [227, 350140.0]
  - - [2048, 308, 1, 1472]
    - [147, 125200.0]
  - - [16384, 576, 1, 2048]
    - [228, 400355.0]
  - - [512, 18432, 1, 2048]
    - [163, 427482.0]
  - - [2048, 576, 1, 2048]
    - [148, 240993.0]
  - - [512, 462, 1, 4096]
    - [149, 118621.0]
  - - [1024, 308, 1, 1472]
    - [165, 80012.0]
  - - [512, 308, 1, 1472]
    - [165, 46073.5]
  - - [16384, 231, 1, 4096]
    - [150, 296176.0]
  - - [4096, 231, 1, 4096]
    - [166, 227144.0]
  - - [8192, 2304, 1, 1024]
    - [164, 487939.0]
  - - [2048, 231, 1, 4096]
    - [172, 172069.0]
  - - [1024, 231, 1, 4096]
    - [173, 131593.0]
  - - [1024, 2304, 1, 1024]
    - [151, 281901.0]
  - - [4096, 9216, 1, 512]
    - [162, 434990.0]
  - - [1024, 2304, 1, 4096]
    - [152, 358643.0]
  - - [512, 9216, 1, 512]
    - [176, 263290.0]
  - - [16384, 288, 1, 2048]
    - [174, 322408.0]
  - - [1024, 154, 1, 1472]
    - [167, 46054.0]
  - - [2048, 576, 1, 8192]
    - [153, 322361.0]
  - - [512, 462, 1, 768]
    - [175, 65492.7]
  - - [512, 9216, 1, 2048]
    - [154, 346597.0]
  - - [1024, 462, 1, 768]
    - [171, 108200.0]
  - - [2048, 231, 1, 768]
    - [177, 103786.0]
  - - [2048, 154, 1, 1472]
    - [168, 78881.1]
  - - [2048, 288, 1, 2048]
    - [178, 163245.0]
  - - [512, 154, 1, 1472]
    - [169, 25990.9]
  - - [3584, 154, 1, 1472]
    - [155, 112584.0]
  - - [16384, 144, 1, 2048]
    - [156, 226469.0]
  - - [1472, 154, 1, 3584]
    - [157, 96964.5]
  - - [384, 154, 1, 1472]
    - [169, 20044.6]
  - - [512, 231, 1, 768]
    - [179, 36458.9]
  - - [3072, 77, 1, 768]
    - [158, 58715.4]
  - - [1472, 154, 1, 384]
    - [170, 31973.7]
  - - [768, 77, 1, 3072]
    - [180, 43451.9]
  - - [512, 231, 1, 4096]
    - [181, 82791.5]
  - - [768, 77, 1, 768]
    - [180, 19256.8]
  - - [1024, 231, 1, 768]
    - [159, 62472.2]
  - - [2048, 144, 1, 2048]
    - [182, 109043.0]
  - - [2048, 144, 1, 8192]
    - [183, 160947.0]
  - - [2048, 288, 1, 8192]
    - [160, 236383.0]
  - - [128, 409600, 1, 384]
    - [185, 0.0]
  - - [256, 2048, 1, 49152]
    - [203, 0.0]
  - - [384, 393216, 1, 257]
    - [186, 0.0]
  - - [384, 409600, 1, 128]
    - [187, 0.0]
  - - [384, 409600, 1, 384]
    - [188, 0.0]
  - - [641, 393216, 1, 6514]
    - [189, 0.0]
  - - [1024, 2048, 1, 10112]
    - [190, 0.0]
  - - [1024, 2048, 1, 12160]
    - [191, 0.0]
  - - [1024, 2048, 1, 14208]
    - [192, 0.0]
  - - [1024, 2048, 1, 16256]
    - [214, 0.0]
  - - [1024, 2048, 1, 18304]
    - [193, 0.0]
  - - [1024, 2048, 1, 20352]
    - [204, 0.0]
  - - [1024, 2048, 1, 22400]
    - [205, 0.0]
  - - [1024, 2048, 1, 24448]
    - [206, 0.0]
  - - [1024, 2048, 1, 26496]
    - [194, 0.0]
  - - [2048, 2048, 1, 8224]
    - [207, 0.0]
  - - [2048, 2048, 1, 208448]
    - [195, 0.0]
  - - [2304, 2048, 1, 4800]
    - [208, 0.0]
  - - [4800, 2048, 1, 2304]
    - [209, 0.0]
  - - [4800, 2048, 1, 22400]
    - [196, 0.0]
  - - [14208, 2048, 1, 1024]
    - [210, 0.0]
  - - [16256, 2048, 1, 1024]
    - [216, 0.0]
  - - [18304, 2048, 1, 1024]
    - [215, 0.0]
  - - [20352, 2048, 1, 1024]
    - [211, 0.0]
  - - [22400, 2048, 1, 1024]
    - [197, 0.0]
  - - [24448, 2048, 1, 1024]
    - [198, 0.0]
  - - [24576, 2048, 1, 4800]
    - [212, 0.0]
  - - [26496, 2048, 1, 1024]
    - [213, 0.0]
  - - [208448, 2048, 1, 1024]
    - [130, 0.0]
  - - [256, 401179, 1, 512]
    - [199, 0.0]
  - - [384, 331051, 1, 256]
    - [200, 0.0]
  - - [384, 365802, 1, 256]
    - [200, 0.0]
  - - [384, 395225, 1, 256]
    - [201, 0.0]
  - - [384, 401179, 1, 256]
    - [202, 0.0]
  - - [512, 331051, 1, 1536]
    - [217, 0.0]
  - - [512, 395225, 1, 1024]
    - [218, 0.0]
  - - [200, 128, 3072, 384]
    - [219, 0.0]
  - - [200, 128, 4096, 384]
    - [219, 0.0]
  - - [200, 128, 2048, 384]
    - [219, 0.0]
  - - [200, 128, 1024, 384]
    - [219, 0.0]
  - - [200, 128, 512, 384]
    - [219, 0.0]
  - - [200, 128, 256, 384]
    - [219, 0.0]
  - - [200, 128, 128, 384]
    - [219, 0.0]
  - - [192, 257, 2048, 32]
    - [220, 0.0]
  - - [192, 6514, 2048, 32]
    - [221, 0.0]
  - - [6514, 192, 2048, 32]
    - [222, 0.0]
  - - [1600, 43008, 1, 1600]
    - [230, 0.0]
  - - [4096, 24576, 1, 4096]
    - [231, 0.0]
  - - [50304, 51200, 1, 1600]
    - [232, 0.0]
  - - [1600, 43008, 1, 6400]
    - [271, 0.0]
  - - [6144, 24576, 1, 4096]
    - [233, 0.0]
  - - [6400, 43008, 1, 1600]
    - [234, 0.0]
  - - [4096, 24576, 1, 14336]
    - [235, 0.0]
  - - [4800, 43008, 1, 1600]
    - [236, 0.0]
  - - [14336, 24576, 1, 4096]
    - [237, 0.0]
  - - [32000, 24576, 1, 4096]
    - [238, 0.0]
  - - [50304, 43008, 1, 1600]
    - [239, 0.0]
  - - [128256, 57344, 1, 8192]
    - [296, 0.0]
  - - [128256, 61440, 1, 8192]
    - [240, 302.55]
  - - [28672, 57344, 1, 8192]
    - [262, 0.0]
  - - [28672, 61440, 1, 8192]
    - [241, 297.67]
  - - [128256, 20480, 1, 4096]
    - [258, 0.0]
  - - [14336, 20480, 1, 4096]
    - [267, 0.0]
  - - [4096, 20480, 1, 4096]
    - [268, 0.0]
  - - [14336, 16384, 1, 4096]
    - [242, 0.0]
  - - [6144, 8192, 1, 4096]
    - [243, 0.0]
  - - [32000, 8192, 1, 4096]
    - [244, 0.0]
  - - [4096, 32768, 1, 14336]
    - [274, 368.59]
  - - [6144, 16384, 1, 4096]
    - [245, 0.0]
  - - [14336, 8192, 1, 4096]
    - [257, 0.0]
  - - [32000, 16384, 1, 4096]
    - [246, 0.0]
  - - [4096, 8192, 1, 4096]
    - [247, 0.0]
  - - [4096, 8192, 1, 14336]
    - [248, 0.0]
  - - [4096, 16384, 1, 4096]
    - [249, 0.0]
  - - [4096, 16384, 1, 14336]
    - [250, 0.0]
  - - [6144, 32768, 1, 4096]
    - [279, 365.45]
  - - [14336, 32768, 1, 4096]
    - [281, 376.58]
  - - [4096, 32768, 1, 4096]
    - [277, 368.62]
  - - [1600, 8192, 1, 1600]
    - [251, 0.0]
  - - [4800, 8192, 1, 1600]
    - [252, 0.0]
  - - [6400, 8192, 1, 1600]
    - [253, 0.0]
  - - [4096, 4096, 1, 14336]
    - [254, 0.0]
  - - [8192, 12288, 1, 8192]
    - [255, 0.0]
  - - [8192, 12288, 1, 28672]
    - [256, 0.0]
  - - [10240, 12288, 1, 8192]
    - [255, 0.0]
  - - [28672, 12288, 1, 8192]
    - [258, 0.0]
  - - [50304, 8192, 1, 1600]
    - [259, 0.0]
  - - [50304, 10240, 1, 1600]
    - [260, 0.0]
  - - [128256, 4096, 1, 4096]
    - [261, 0.0]
  - - [128256, 12288, 1, 8192]
    - [262, 0.0]
  - - [6400, 6144, 1, 1600]
    - [252, 0.0]
  - - [4800, 6144, 1, 1600]
    - [263, 0.0]
  - - [50304, 6144, 1, 1600]
    - [264, 0.0]
  - - [1600, 6144, 1, 1600]
    - [265, 0.0]
  - - [1600, 6144, 1, 6400]
    - [266, 0.0]
  - - [6144, 20480, 1, 4096]
    - [267, 0.0]
  - - [4096, 20480, 1, 14336]
    - [269, 0.0]
  - - [128256, 53248, 1, 8192]
    - [261, 0.0]
  - - [28672, 53248, 1, 8192]
    - [270, 0.0]
  - - [6400, 63488, 1, 1600]
    - [272, 360.76]
  - - [1600, 63488, 1, 1600]
    - [273, 324.89]
  - - [1600, 63488, 1, 6400]
    - [274, 331.57]
  - - [4096, 28672, 1, 4096]
    - [275, 355.96]
  - - [4096, 28672, 1, 14336]
    - [276, 360.79]
  - - [4800, 63488, 1, 1600]
    - [278, 339.58]
  - - [6144, 28672, 1, 4096]
    - [275, 377.33]
  - - [8192, 69632, 1, 8192]
    - [279, 390.72]
  - - [8192, 69632, 1, 28672]
    - [280, 317.49]
  - - [10240, 69632, 1, 8192]
    - [275, 397.78]
  - - [14336, 28672, 1, 4096]
    - [278, 376.79]
  - - [28672, 69632, 1, 8192]
    - [277, 333.44]
  - - [32000, 32768, 1, 4096]
    - [279, 339.84]
  - - [50304, 63488, 1, 1600]
    - [282, 354.53]
  - - [50304, 75776, 1, 1600]
    - [283, 348.84]
  - - [128256, 28672, 1, 4096]
    - [279, 322.79]
  - - [128256, 69632, 1, 8192]
    - [284, 340.94]
  - - [1024, 40960, 1, 8192]
    - [285, 0.0]
  - - [1024, 49152, 1, 8192]
    - [286, 0.0]
  - - [28672, 40960, 1, 8192]
    - [262, 0.0]
  - - [128256, 49152, 1, 8192]
    - [287, 0.0]
  - - [8192, 40960, 1, 8192]
    - [130, 0.0]
  - - [8192, 49152, 1, 28672]
    - [288, 0.0]
  - - [1024, 57344, 1, 8192]
    - [289, 0.0]
  - - [8192, 57344, 1, 28672]
    - [130, 0.0]
  - - [28672, 49152, 1, 8192]
    - [262, 0.0]
  - - [128256, 24576, 1, 8192]
    - [290, 0.0]
  - - [8192, 57344, 1, 8192]
    - [291, 0.0]
  - - [8192, 24576, 1, 28672]
    - [288, 0.0]
  - - [28672, 24576, 1, 8192]
    - [262, 0.0]
  - - [8192, 32768, 1, 8192]
    - [292, 0.0]
  - - [128256, 32768, 1, 8192]
    - [293, 0.0]
  - - [1024, 24576, 1, 8192]
    - [294, 0.0]
  - - [8192, 24576, 1, 8192]
    - [295, 0.0]
  - - [28672, 32768, 1, 8192]
    - [262, 0.0]
  - - [8192, 49152, 1, 8192]
    - [297, 0.0]
  - - [128256, 40960, 1, 8192]
    - [298, 0.0]
  - - [8192, 32768, 1, 28672]
    - [288, 0.0]
  - - [1024, 32768, 1, 8192]
    - [299, 0.0]
  - - [8192, 40960, 1, 28672]
    - [130, 0.0]
  - - [6144, 792, 1, 19648]
    - [300, 0.0]
  - - [7680, 8, 1, 6144]
    - [301, 0.0]
  - - [10576, 12288, 1, 2560]
    - [302, 299.53]
  - - [50288, 12288, 1, 2560]
    - [244, 319.09]
  - - [222, 5905, 1, 1024]
    - [303, 0.0]
  - - [256, 5905, 1, 128]
    - [304, 0.0]
  - - [1024, 5905, 1, 6144]
    - [305, 0.0]
  - - [4096, 5905, 1, 6144]
    - [306, 0.0]
  - - [1024, 5905, 1, 11715]
    - [307, 0.0]
  - - [2048, 5905, 1, 5120]
    - [308, 0.0]
  - - [11715, 5905, 1, 1024]
    - [309, 0.0]
  - - [512, 5905, 1, 512]
    - [310, 0.0]
  - - [256, 5905, 1, 1024]
    - [311, 0.0]
  - - [2048, 5905, 1, 1475]
    - [312, 0.0]
  - - [2048, 5905, 1, 4440]
    - [313, 0.0]
  - - [512, 5905, 1, 1475]
    - [314, 0.0]
  - - [256, 795008, 1, 256]
    - [315, 0.0]
  - - [1024, 5905, 1, 5120]
    - [316, 0.0]
  - - [24, 1511680, 1, 224]
    - [317, 0.0]
  - - [5120, 5905, 1, 4096]
    - [318, 0.0]
  - - [1475, 5905, 1, 1024]
    - [319, 0.0]
  - - [512, 5905, 1, 256]
    - [320, 0.0]
  - - [1024, 5905, 1, 1475]
    - [321, 0.0]
  - - [11144, 5905, 1, 128]
    - [322, 0.0]
  - - [2048, 5905, 1, 4040]
    - [323, 0.0]
  - - [256, 5905, 1, 64]
    - [324, 0.0]
  - - [202, 5905, 1, 1024]
    - [325, 0.0]
  - - [128, 5905, 1, 1475]
    - [326, 0.0]
  - - [256, 5905, 1, 512]
    - [327, 0.0]
  - - [8, 5905, 1, 512]
    - [328, 0.0]
  - - [256, 795008, 1, 512]
    - [329, 0.0]
  - - [1475, 5905, 1, 128]
    - [330, 0.0]
  - - [256, 795008, 1, 192]
    - [331, 0.0]
  - - [128, 5905, 1, 1024]
    - [332, 0.0]
  - - [5120, 5905, 1, 11715]
    - [333, 0.0]
  - - [6144, 5905, 1, 1024]
    - [334, 0.0]
  - - [1024, 5905, 1, 512]
    - [335, 0.0]
  - - [20, 1511680, 1, 202]
    - [336, 0.0]
  - - [5120, 1, 1, 5120]
    - [83, 0.0]
  - - [4096, 1024, 1, 10240]
    - [337, 0.0]
  - - [16384, 15683, 1, 256]
    - [338, 0.0]
  - - [5120, 21504, 1, 5120]
    - [130, 0.0]
  - - [6144, 90112, 1, 6144]
    - [130, 0.0]
  - - [5120, 21504, 1, 13824]
    - [130, 0.0]
  - - [6144, 180224, 1, 16384]
    - [130, 0.0]
  - - [6144, 90112, 1, 1024]
    - [130, 0.0]
  - - [512, 81, 1, 512]
    - [180, 0.0]
  - - [5120, 672, 1, 768]
    - [339, 0.0]
  - - [6144, 90112, 1, 8]
    - [340, 0.0]
  - - [1152, 65536, 1, 1152]
    - [236, 0.0]
  - - [4304, 65536, 1, 1152]
    - [341, 0.0]
  - - [3072, 17, 1, 768]
    - [179, 0.0]
  - - [3072, 26112, 1, 15360]
    - [294, 0.0]
  - - [3072, 17, 1, 256]
    - [98, 0.0]
  - - [9216, 17, 1, 3072]
    - [94, 0.0]
  - - [18432, 17, 1, 3072]
    - [94, 0.0]
  - - [160128, 8, 1, 4096]
    - [342, 0.0]
  - - [160, 409600, 1, 48]
    - [343, 63144.0]
  - - [6400, 2048, 1, 512]
    - [344, 367538.0]
  - - [2048, 2048, 1, 512]
    - [345, 290567.0]
  - - [160, 2048, 256, 160]
    - [343, 166407.0]
  - - [160, 863, 2048, 40]
    - [343, 54382.3]
  - - [113, 160, 2048, 40]
    - [346, 27736.1]
  - - [160, 113, 2048, 40]
    - [347, 35056.3]
  - - [6048, 2048, 1, 256]
    - [348, 214542.0]
  - - [5120, 2048, 1, 2048]
    - [349, 441963.0]
  - - [512, 2048, 1, 512]
    - [350, 137311.0]
  - - [512, 2048, 1, 2560]
    - [351, 222160.0]
  - - [512, 2048, 1, 2048]
    - [351, 206466.0]
  - - [4520, 2048, 1, 128]
    - [352, 108466.0]
  - - [2560, 2048, 1, 4520]
    - [353, 437587.0]
  - - [2560, 2048, 1, 34520]
    - [354, 481011.0]
  - - [256, 65536, 1, 160]
    - [355, 228530.0]
  - - [256, 2048, 1, 6048]
    - [356, 175096.0]
  - - [2048, 2048, 1, 6048]
    - [357, 447625.0]
  - - [2048, 2048, 1, 512]
    - [345, 286402.0]
  - - [16, 327680, 1, 113]
    - [358, 12662.0]
  - - [128, 2048, 1, 512]
    - [351, 37107.5]
- null
- null
- DeviceEfficiency
- Equality
