projects/hipblaslt/library/src/amd_detail/rocblaslt/src/Tensile/Logic/asm_full/aquavanjaram/gfx942/Equality/aquavanjaram_Cijk_Ailk_Bjlk_BBS_BH_UserArgs.yaml
- {MinimumRequiredVersion: 5.0.0}
- aquavanjaram
- gfx942
- [Device 0049, Device 0050]
    SolutionIndex: 0
    SolutionNameMin: Cijk_Ailk_Bjlk_BBS_BH_UserArgs_MT256x16x16_MI16x16x1_SN_LDSB1_AFC0_AFEM1_AFEM1_ASEM1_CLR0_CADS0_DTVA0_DTVB0_EPS0_FDSI0_GRPM0p20_GRVWA8_GRVWB1_GSU1_GSUAMB_GSUC0_GSUWGMRR0_GLS0_ISA942_IU1_K1_LBSPPA2048_LBSPPB128_LBSPPM0_LPA0_LPB16_LPM0_LRVW4_LWPM0p40_MIAV0_MIWT4_1_MO40_NTn1_NTA0_NTB0_NTC7_NTD4_NTM0_NEPBS16_NLCA1_NLCB1_ONLL1_PGR2_PLR1_PKA1_SIA3_SS1_SU4_SUM0_SUS2048_SPO1_SRVW0_SSO0_SVW4_SK0_SKXCCM0_TLDS0_ULSGRO0_USL1_UIOFGRO0_USFGRO1_VSn1_VWA4_VWB1_WSGRA0_WSGRB2_WS64_WG64_4_1_WGM1_WGMXCC8_WGMXCCG0
    SolutionIndex: 1
    SolutionNameMin: Cijk_Ailk_Bjlk_BBS_BH_UserArgs_MT64x64x64_MI16x16x1_SN_LDSB1_AFC1_AFEM1_AFEM1_ASEM1_CLR1_CADS0_DTVA0_DTVB0_EPS0_FDSI0_GRPM1_GRVWA8_GRVWB8_GSU1_GSUAMB_GSUC0_GSUWGMRR0_GLS0_ISA942_IU1_K1_LBSPPA512_LBSPPB512_LBSPPM0_LPA32_LPB32_LPM0_LRVW4_LWPMn1_MIAV0_MIWT2_2_MO40_NTn1_NTA0_NTB0_NTC0_NTD4_NTM0_NEPBS16_NLCA1_NLCB1_ONLL1_PGR2_PLR1_PKA1_SIA3_SS1_SU8_SUM1_SUS128_SPO0_SRVW0_SSO0_SVW2_SK0_SKXCCM0_TLDS0_ULSGRO0_USL1_UIOFGRO0_USFGROn1_VSn1_VWA2_VWB2_WSGRA0_WSGRB0_WS64_WG32_8_1_WGM1_WGMXCC8_WGMXCCGn1
    SolutionIndex: 2
    SolutionNameMin: Cijk_Ailk_Bjlk_BBS_BH_UserArgs_MT32x16x32_MI16x16x1_SN_LDSB0_AFC1_AFEM1_AFEM1_ASEM1_CLR1_CADS0_DTVA0_DTVB0_EPS0_FDSI0_GRPM1_GRVWA8_GRVWB4_GSU1_GSUAMB_GSUC0_GSUWGMRR0_GLS0_ISA942_IU1_K1_LBSPPA256_LBSPPB128_LBSPPM0_LPA16_LPB16_LPM0_LRVW4_LWPM0p25_MIAV0_MIWT1_1_MO40_NTn1_NTA0_NTB0_NTC0_NTD4_NTM0_NEPBS0_NLCA1_NLCB1_ONLL1_PGR2_PLR1_PKA1_SIA3_SS1_SU4_SUM4_SUS64_SPO0_SRVW0_SSO0_SVW1_SK0_SKXCCM0_TLDS0_ULSGRO0_USL1_UIOFGRO0_USFGROn1_VSn1_VWA1_VWB1_WSGRA0_WSGRB0_WS64_WG32_4_1_WGM1_WGMXCC8_WGMXCCGn1
    SolutionIndex: 3
    SolutionNameMin: Cijk_Ailk_Bjlk_BBS_BH_UserArgs_MT64x64x64_MI16x16x1_SN_LDSB1_AFC0_AFEM1_AFEM1_ASEM1_CLR1_CADS0_DTVA0_DTVB0_EPS0_FDSI0_GRPM1_GRVWA8_GRVWB8_GSU1_GSUAMB_GSUC0_GSUWGMRR0_GLS0_ISA942_IU1_K1_LBSPPA512_LBSPPB512_LBSPPM0_LPA32_LPB0_LPM0_LRVW4_LWPMn1_MIAV0_MIWT2_4_MO40_NTn1_NTA0_NTB0_NTC0_NTD4_NTM0_NEPBS16_NLCA1_NLCB1_ONLL1_PGR2_PLR1_PKA1_SIA3_SS1_SU16_SUM0_SUS128_SPO0_SRVW0_SSO0_SVW2_SK0_SKXCCM0_TLDS0_ULSGRO0_USL1_UIOFGRO0_USFGROn1_VSn1_VWA2_VWB4_WSGRA1_WSGRB1_WS64_WG32_4_2_WGM8_WGMXCC8_WGMXCCG304
    SolutionIndex: 4
    SolutionNameMin: Cijk_Ailk_Bjlk_BBS_BH_UserArgs_MT192x192x32_MI16x16x1_SN_LDSB1_AFC0_AFEM1_AFEM1_ASEM1_CLR1_CADS0_DTVA0_DTVB0_EPS0_FDSI0_GRPM1_GRVWA8_GRVWB8_GSU1_GSUAMB_GSUC1_GSUWGMRR0_GLS0_ISA942_IU1_K1_LBSPPA1536_LBSPPB1536_LBSPPM0_LPA32_LPB32_LPM0_LRVW4_LWPMn1_MIAV0_MIWT6_6_MO40_NTn1_NTA0_NTB0_NTC0_NTD4_NTM0_NEPBS16_NLCA3_NLCB3_ONLL1_PGR2_PLR1_PKA1_SIA3_SS1_SU16_SUM1_SUS64_SPO0_SRVW0_SSO0_SVW2_SK0_SKXCCM0_TLDS0_ULSGRO0_USL1_UIOFGRO0_USFGROn1_VSn1_VWA2_VWB2_WSGRA0_WSGRB0_WS64_WG32_8_1_WGM8_WGMXCC8_WGMXCCG304
    SolutionIndex: 5
    SolutionNameMin: Cijk_Ailk_Bjlk_BBS_BH_UserArgs_MT256x96x64_MI16x16x1_SN_LDSB1_AFC0_AFEM1_AFEM1_ASEM1_CLR1_CADS0_DTVA0_DTVB0_EPS0_FDSI0_GRPM1_GRVWA8_GRVWB8_GSU1_GSUAMBSK_GSUC0_GSUWGMRR0_GLS0_ISA942_IU1_K1_LBSPPA2048_LBSPPB768_LBSPPM0_LPA0_LPB32_LPM0_LRVW4_LWPMn1_MIAV0_MIWT4_6_MO40_NTn1_NTA0_NTB0_NTC0_NTD4_NTM0_NEPBS16_NLCA1_NLCB3_ONLL1_PGR2_PLR1_PKA1_SIA3_SS1_SU16_SUM1_SUS128_SPO0_SRVW0_SSO0_SVW4_SK0_SKXCCM0_TLDS0_ULSGRO0_USL1_UIOFGRO0_USFGROn1_VSn1_VWA4_VWB2_WSGRA0_WSGRB0_WS64_WG64_4_1_WGM6_WGMXCC8_WGMXCCG304
    SolutionIndex: 6
    SolutionNameMin: Cijk_Ailk_Bjlk_BBS_BH_UserArgs_MT256x32x64_MI16x16x1_SN_LDSB1_AFC0_AFEM1_AFEM1_ASEM1_CLR1_CADS0_DTVA0_DTVB0_EPS0_FDSI0_GRPM0p50_GRVWA8_GRVWB8_GSU304_GSUAMB_GSUC0_GSUWGMRR1_GLS0_ISA942_IU1_K1_LBSPPA2048_LBSPPB256_LBSPPM0_LPA0_LPB32_LPM0_LRVW4_LWPMn1_MIAV0_MIWT4_2_MO40_NTn1_NTA4_NTB0_NTC4_NTD4_NTM0_NEPBS2_NLCA1_NLCB1_ONLL0_PGR2_PLR1_PKA1_SIA3_SS1_SU8_SUM1_SUS128_SPO0_SRVW0_SSO0_SVW4_SK0_SKXCCM0_TLDS0_ULSGRO0_USL1_UIOFGRO0_USFGROn1_VSn1_VWA4_VWB2_WSGRA1_WSGRB1_WS64_WG64_4_1_WGM1_WGMXCC1_WGMXCCGn1
    SolutionIndex: 7
    SolutionNameMin: Cijk_Ailk_Bjlk_BBS_BH_UserArgs_MT64x128x64_MI16x16x1_SN_LDSB1_AFC0_AFEM1_AFEM1_ASEM1_CLR0_CADS0_DTVA0_DTVB0_EPS0_FDSI0_GRPM0p70_GRVWA8_GRVWB8_GSU8_GSUAMB_GSUC0_GSUWGMRR1_GLS0_ISA942_IU1_K1_LBSPPA512_LBSPPB1024_LBSPPM0_LPA0_LPB32_LPM0_LRVW4_LWPMn1_MIAV0_MIWT4_2_MO40_NTn1_NTA0_NTB0_NTC0_NTD4_NTM0_NEPBS0_NLCA1_NLCB1_ONLL1_PGR2_PLR1_PKA1_SIA3_SS1_SU2_SUM4_SUS256_SPO0_SRVW0_SSO2_SVW4_SK0_SKXCCM0_TLDS0_ULSGRO0_USL1_UIOFGRO0_USFGROn1_VSn1_VWA4_VWB2_WSGRA0_WSGRB2_WS64_WG16_16_1_WGM1_WGMXCC4_WGMXCCG48
    SolutionIndex: 8
    SolutionNameMin: Cijk_Ailk_Bjlk_BBS_BH_UserArgs_MT256x256x32_MI16x16x1_SN_LDSB0_AFC0_AFEM1_AFEM1_ASEM1_CLR0_CADS0_DTVA0_DTVB0_EPS0_FDSI0_GRPM1_GRVWA8_GRVWB8_GSU76_GSUAMB_GSUC0_GSUWGMRR0_GLS0_ISA942_IU1_K1_LBSPPA2048_LBSPPB2048_LBSPPM0_LPA0_LPB0_LPM0_LRVW4_LWPMn1_MIAV0_MIWT4_16_MO40_NTn1_NTA4_NTB0_NTC4_NTD0_NTM0_NEPBS0_NLCA1_NLCB1_ONLL1_PGR2_PLR1_PKA1_SIA3_SS1_SU16_SUM1_SUS64_SPO0_SRVW0_SSO0_SVW4_SK0_SKXCCM0_TLDS0_ULSGRO0_USL1_UIOFGRO0_USFGROn1_VSn1_VWA4_VWB8_WSGRA1_WSGRB0_WS64_WG64_4_1_WGM1_WGMXCC8_WGMXCCGn1
    SolutionIndex: 9
    SolutionNameMin: Cijk_Ailk_Bjlk_BBS_BH_UserArgs_MT256x32x64_MI16x16x1_SN_LDSB1_AFC0_AFEM1_AFEM1_ASEM1_CLR1_CADS0_DTVA1_DTVB0_EPS0_FDSI0_GRPM1_GRVWA8_GRVWB8_GSU304_GSUAMB_GSUC0_GSUWGMRR0_GLS0_ISA942_IU1_K1_LBSPPA0_LBSPPB256_LBSPPM0_LPA0_LPB32_LPM0_LRVW4_LWPMn1_MIAV0_MIWT8_2_MO40_NTn1_NTA4_NTB0_NTC4_NTD4_NTM0_NEPBS4_NLCA1_NLCB1_ONLL0_PGR2_PLR1_PKA1_SIA3_SS1_SU0_SUM1_SUS0_SPO1_SRVW0_SSO3_SVW8_SK0_SKXCCM0_TLDS0_ULSGRO0_USL1_UIOFGRO0_USFGROn1_VSn1_VWA8_VWB2_WSGRA0_WSGRB2_WS64_WG32_4_1_WGM1_WGMXCC1_WGMXCCGn1
    SolutionIndex: 10
    SolutionNameMin: Cijk_Ailk_Bjlk_BBS_BH_UserArgs_MT128x128x64_MI16x16x1_SN_LDSB1_AFC0_AFEM1_AFEM1_ASEM1_CLR1_CADS0_DTVA0_DTVB0_EPS0_FDSI0_GRPM1_GRVWA8_GRVWB8_GSU4_GSUAMB_GSUC0_GSUWGMRR0_GLS0_ISA942_IU1_K1_LBSPPA1024_LBSPPB1024_LBSPPM0_LPA0_LPB0_LPM0_LRVW4_LWPMn1_MIAV0_MIWT4_4_MO40_NTn1_NTA0_NTB4_NTC7_NTD4_NTM0_NEPBS2_NLCA1_NLCB1_ONLL0_PGR2_PLR1_PKA1_SIA3_SS1_SU0_SUM1_SUS0_SPO0_SRVW0_SSO0_SVW4_SK0_SKXCCM0_TLDS0_ULSGRO0_USL1_UIOFGRO0_USFGROn1_VSn1_VWA4_VWB4_WSGRA0_WSGRB1_WS64_WG32_8_1_WGM133_WGMXCC1_WGMXCCGn1
    SolutionIndex: 11
    SolutionNameMin: Cijk_Ailk_Bjlk_BBS_BH_UserArgs_MT32x256x32_MI16x16x1_SN_LDSB1_AFC0_AFEM1_AFEM1_ASEM1_CLR1_CADS0_DTVA0_DTVB0_EPS0_FDSI0_GRPM0p50_GRVWA2_GRVWB2_GSU1_GSUAMB_GSUC0_GSUWGMRR0_GLS0_ISA942_IU1_K1_LBSPPA256_LBSPPB2048_LBSPPM0_LPA32_LPB0_LPM0_LRVW4_LWPM0p50_MIAV0_MIWT2_4_MO40_NTn1_NTA0_NTB7_NTC4_NTD0_NTM0_NEPBS0_NLCA1_NLCB1_ONLL2_PGR2_PLR1_PKA1_SIA3_SS1_SU2_SUM4_SUS128_SPO0_SRVW0_SSO0_SVW2_SK0_SKXCCM0_TLDS0_ULSGRO0_USL1_UIOFGRO0_USFGROn1_VSn1_VWA2_VWB4_WSGRA0_WSGRB0_WS64_WG16_16_1_WGM1_WGMXCC1_WGMXCCGn1
    SolutionIndex: 12
    SolutionNameMin: Cijk_Ailk_Bjlk_BBS_BH_UserArgs_MT256x160x64_MI16x16x1_SN_LDSB1_AFC0_AFEM1_AFEM1_ASEM1_CLR1_CADS0_DTVA0_DTVB0_EPS0_FDSI0_GRPM0p80_GRVWA8_GRVWB8_GSU1_GSUAMB_GSUC0_GSUWGMRR0_GLS0_ISA942_IU1_K1_LBSPPA2048_LBSPPB1280_LBSPPM0_LPA0_LPB32_LPM0_LRVW4_LWPMn1_MIAV0_MIWT4_10_MO40_NTn1_NTA0_NTB0_NTC0_NTD4_NTM0_NEPBS0_NLCA1_NLCB5_ONLL1_PGR2_PLR1_PKA1_SIA3_SS1_SU4_SUM1_SUS128_SPO0_SRVW0_SSO0_SVW4_SK0_SKXCCM0_TLDS0_ULSGRO1_USL1_UIOFGRO0_USFGROn1_VSn1_VWA4_VWB2_WSGRA1_WSGRB2_WS64_WG64_4_1_WGM8_WGMXCC1_WGMXCCGn1
    SolutionIndex: 13
    SolutionNameMin: Cijk_Ailk_Bjlk_BBS_BH_UserArgs_MT128x128x64_MI16x16x1_SN_LDSB1_AFC0_AFEM1_AFEM1_ASEM1_CLR1_CADS0_DTVA0_DTVB0_EPS0_FDSI0_GRPM0p90_GRVWA8_GRVWB8_GSU1_GSUAMB_GSUC0_GSUWGMRR0_GLS0_ISA942_IU1_K1_LBSPPA1024_LBSPPB1024_LBSPPM0_LPA0_LPB0_LPM0_LRVW4_LWPMn1_MIAV0_MIWT4_4_MO40_NTn1_NTA0_NTB0_NTC0_NTD4_NTM0_NEPBS0_NLCA1_NLCB1_ONLL1_PGR2_PLR1_PKA1_SIA3_SS1_SU8_SUM0_SUS128_SPO0_SRVW0_SSO0_SVW4_SK0_SKXCCM0_TLDS0_ULSGRO0_USL1_UIOFGRO0_USFGRO0_VSn1_VWA4_VWB4_WSGRA0_WSGRB2_WS64_WG32_8_1_WGM6_WGMXCC8_WGMXCCGn1
    SolutionIndex: 14
    SolutionNameMin: Cijk_Ailk_Bjlk_BBS_BH_UserArgs_MT16x32x128_MI16x16x1_SN_LDSB0_AFC0_AFEM1_AFEM1_ASEM1_CLR0_CADS0_DTVA0_DTVB0_EPS0_FDSI0_GRPM0p27_GRVWA8_GRVWB8_GSU1_GSUAMB_GSUC0_GSUWGMRR1_GLS0_ISA942_IU1_K1_LBSPPA128_LBSPPB256_LBSPPM0_LPA16_LPB16_LPM0_LRVW4_LWPM0p30_MIAV0_MIWT1_1_MO40_NTn1_NTA0_NTB0_NTC7_NTD0_NTM0_NEPBS6_NLCA1_NLCB1_ONLL2_PGR2_PLR1_PKA1_SIA3_SS0_SU4_SUM4_SUS512_SPO0_SRVW0_SSO0_SVW4_SK0_SKXCCM0_TLDS0_ULSGRO0_USL1_UIOFGRO0_USFGRO1_VSn1_VWA1_VWB1_WSGRA0_WSGRB0_WS64_WG16_8_1_WGM1_WGMXCC16_WGMXCCG0
    SolutionIndex: 15
    SolutionNameMin: Cijk_Ailk_Bjlk_BBS_BH_UserArgs_MT128x64x128_MI16x16x1_SN_LDSB1_AFC0_AFEM1_AFEM1_ASEM1_CLR0_CADS0_DTVA0_DTVB0_EPS0_FDSI0_GRPM0p90_GRVWA8_GRVWB8_GSU8_GSUAMB_GSUC0_GSUWGMRR0_GLS0_ISA942_IU1_K1_LBSPPA1024_LBSPPB512_LBSPPM0_LPA0_LPB32_LPM0_LRVW4_LWPMn1_MIAV0_MIWT4_2_MO40_NTn1_NTA0_NTB0_NTC4_NTD7_NTM0_NEPBS0_NLCA1_NLCB1_ONLL0_PGR2_PLR1_PKA1_SIA3_SS1_SU16_SUM1_SUS256_SPO1_SRVW0_SSO3_SVW4_SK0_SKXCCM0_TLDS0_ULSGRO0_USL1_UIOFGRO0_USFGRO1_VSn1_VWA4_VWB2_WSGRA0_WSGRB0_WS64_WG32_8_1_WGM1_WGMXCC4_WGMXCCG152
    SolutionIndex: 16
    SolutionNameMin: Cijk_Ailk_Bjlk_BBS_BH_UserArgs_MT32x256x16_MI32x32x1_SN_LDSB1_AFC0_AFEM1_AFEM1_ASEM1_CLR0_CADS0_DTVA0_DTVB0_EPS0_FDSI0_GRPM0p27_GRVWA2_GRVWB8_GSU1_GSUAMB_GSUC1_GSUWGMRR0_GLS0_ISA942_IU1_K1_LBSPPA0_LBSPPB0_LBSPPM0_LPA0_LPB0_LPM0_LRVW4_LWPM0p50_MIAV0_MIWT1_2_MO40_NTn1_NTA0_NTB4_NTC0_NTD0_NTM0_NEPBS8_NLCA1_NLCB1_ONLL2_PGR2_PLR1_PKA1_SIA3_SS1_SU2_SUM1_SUS32_SPO0_SRVW0_SSO0_SVW1_SK0_SKXCCM0_TLDS0_ULSGRO0_USL1_UIOFGRO0_USFGROn1_VSn1_VWA1_VWB2_WSGRA0_WSGRB0_WS64_WG32_8_1_WGM6_WGMXCC1_WGMXCCGn1
    SolutionIndex: 17
    SolutionNameMin: Cijk_Ailk_Bjlk_BBS_BH_UserArgs_MT160x256x32_MI16x16x1_SN_LDSB0_AFC0_AFEM1_AFEM1_ASEM1_CLR1_CADS0_DTVA0_DTVB0_EPS0_FDSI0_GRPM0p25_GRVWA4_GRVWB8_GSU1_GSUAMB_GSUC0_GSUWGMRR0_GLS0_ISA942_IU1_K1_LBSPPA1280_LBSPPB2048_LBSPPM0_LPA32_LPB0_LPM0_LRVW4_LWPMn1_MIAV0_MIWT10_4_MO40_NTn1_NTA0_NTB0_NTC4_NTD0_NTM0_NEPBS0_NLCA5_NLCB1_ONLL1_PGR2_PLR1_PKA1_SIA3_SS1_SU16_SUM1_SUS64_SPO0_SRVW0_SSO0_SVW2_SK0_SKXCCM0_TLDS0_ULSGRO0_USL1_UIOFGRO0_USFGROn1_VSn1_VWA2_VWB4_WSGRA0_WSGRB0_WS64_WG16_16_1_WGM247_WGMXCC8_WGMXCCGn1
    SolutionIndex: 18
    SolutionNameMin: Cijk_Ailk_Bjlk_BBS_BH_UserArgs_MT192x128x32_MI16x16x1_SN_LDSB0_AFC0_AFEM1_AFEM1_ASEM1_CLR0_CADS0_DTVA0_DTVB0_EPS0_FDSI0_GRPM1_GRVWA8_GRVWB8_GSU4_GSUAMB_GSUC1_GSUWGMRR0_GLS0_ISA942_IU1_K1_LBSPPA1536_LBSPPB1024_LBSPPM0_LPA32_LPB0_LPM0_LRVW4_LWPMn1_MIAV0_MIWT6_4_MO40_NTn1_NTA0_NTB0_NTC4_NTD0_NTM0_NEPBS2_NLCA3_NLCB1_ONLL0_PGR2_PLR1_PKA1_SIA3_SS1_SU16_SUM1_SUS256_SPO0_SRVW0_SSO0_SVW2_SK0_SKXCCM0_TLDS0_ULSGRO0_USL1_UIOFGRO0_USFGROn1_VSn1_VWA2_VWB4_WSGRA0_WSGRB0_WS64_WG32_8_1_WGM48_WGMXCC32_WGMXCCG0
    SolutionIndex: 19
    SolutionNameMin: Cijk_Ailk_Bjlk_BBS_BH_UserArgs_MT128x128x64_MI16x16x1_SN_LDSB0_AFC0_AFEM1_AFEM1_ASEM1_CLR1_CADS0_DTVA0_DTVB0_EPS0_FDSI0_GRPM0p80_GRVWA8_GRVWB8_GSU8_GSUAMB_GSUC1_GSUWGMRR0_GLS0_ISA942_IU1_K1_LBSPPA1024_LBSPPB1024_LBSPPM0_LPA0_LPB0_LPM0_LRVW4_LWPM0p30_MIAV0_MIWT4_4_MO40_NTn1_NTA0_NTB0_NTC4_NTD7_NTM0_NEPBS2_NLCA1_NLCB1_ONLL0_PGR2_PLR1_PKA1_SIA3_SS1_SU16_SUM1_SUS256_SPO1_SRVW0_SSO0_SVW4_SK0_SKXCCM0_TLDS0_ULSGRO1_USL1_UIOFGRO0_USFGROn1_VSn1_VWA4_VWB4_WSGRA0_WSGRB1_WS64_WG32_8_1_WGM1_WGMXCC2_WGMXCCG32
    SolutionIndex: 20
    SolutionNameMin: Cijk_Ailk_Bjlk_BBS_BH_UserArgs_MT128x128x64_MI16x16x1_SN_LDSB1_AFC0_AFEM1_AFEM1_ASEM1_CLR1_CADS0_DTVA0_DTVB0_EPS0_FDSI0_GRPM1_GRVWA8_GRVWB8_GSU4_GSUAMB_GSUC0_GSUWGMRR0_GLS0_ISA942_IU1_K1_LBSPPA1024_LBSPPB1024_LBSPPM0_LPA0_LPB0_LPM0_LRVW4_LWPMn1_MIAV0_MIWT4_4_MO40_NTn1_NTA0_NTB0_NTC4_NTD0_NTM0_NEPBS2_NLCA1_NLCB1_ONLL0_PGR2_PLR1_PKA1_SIA3_SS1_SU4_SUM1_SUS256_SPO0_SRVW0_SSO0_SVW4_SK0_SKXCCM0_TLDS0_ULSGRO0_USL1_UIOFGRO0_USFGROn1_VSn1_VWA4_VWB4_WSGRA2_WSGRB0_WS64_WG32_8_1_WGM1_WGMXCC32_WGMXCCG0
    SolutionIndex: 21
    SolutionNameMin: Cijk_Ailk_Bjlk_BBS_BH_UserArgs_MT512x144x32_MI16x16x1_SN_LDSB0_AFC0_AFEM1_AFEM1_ASEM1_CLR1_CADS0_DTVA1_DTVB0_EPS0_FDSI0_GRPM1_GRVWA8_GRVWB2_GSU1_GSUAMB_GSUC0_GSUWGMRR0_GLS0_ISA942_IU1_K1_LBSPPA0_LBSPPB1152_LBSPPM0_LPA0_LPB16_LPM0_LRVW4_LWPMn1_MIAV0_MIWT8_9_MO40_NTn1_NTA0_NTB0_NTC0_NTD7_NTM0_NEPBS0_NLCA1_NLCB9_ONLL1_PGR2_PLR1_PKA1_SIA3_SS1_SU4_SUM1_SUS128_SPO0_SRVW0_SSO0_SVW8_SK0_SKXCCM0_TLDS0_ULSGRO0_USL1_UIOFGRO0_USFGROn1_VSn1_VWA8_VWB1_WSGRA0_WSGRB2_WS64_WG64_4_1_WGM1_WGMXCC4_WGMXCCGn1
    SolutionIndex: 22
    SolutionNameMin: Cijk_Ailk_Bjlk_BBS_BH_UserArgs_MT256x128x32_MI16x16x1_SN_LDSB1_AFC0_AFEM1_AFEM1_ASEM1_CLR1_CADS0_DTVA0_DTVB0_EPS0_FDSI0_GRPM0p40_GRVWA8_GRVWB8_GSU6_GSUAMB_GSUC0_GSUWGMRR0_GLS0_ISA942_IU1_K1_LBSPPA2048_LBSPPB1024_LBSPPM0_LPA0_LPB0_LPM0_LRVW4_LWPMn1_MIAV0_MIWT4_8_MO40_NTn1_NTA0_NTB0_NTC0_NTD0_NTM0_NEPBS2_NLCA1_NLCB1_ONLL1_PGR2_PLR1_PKA1_SIA3_SS1_SU4_SUM0_SUS512_SPO0_SRVW0_SSO0_SVW4_SK0_SKXCCM0_TLDS0_ULSGRO0_USL1_UIOFGRO0_USFGROn1_VSn1_VWA4_VWB8_WSGRA0_WSGRB0_WS64_WG64_4_1_WGM6_WGMXCC32_WGMXCCG0
    SolutionIndex: 23
    SolutionNameMin: Cijk_Ailk_Bjlk_BBS_BH_UserArgs_MT256x256x32_MI16x16x1_SN_LDSB0_AFC0_AFEM1_AFEM1_ASEM1_CLR0_CADS0_DTVA0_DTVB0_EPS0_FDSI0_GRPM1_GRVWA8_GRVWB8_GSU152_GSUAMB_GSUC0_GSUWGMRR1_GLS0_ISA942_IU1_K1_LBSPPA2048_LBSPPB2048_LBSPPM0_LPA0_LPB0_LPM0_LRVW4_LWPMn1_MIAV0_MIWT4_16_MO40_NTn1_NTA4_NTB0_NTC0_NTD0_NTM0_NEPBS0_NLCA1_NLCB1_ONLL1_PGR2_PLR1_PKA1_SIA3_SS1_SU2_SUM1_SUS64_SPO1_SRVW0_SSO1_SVW4_SK0_SKXCCM0_TLDS0_ULSGRO0_USL1_UIOFGRO0_USFGROn1_VSn1_VWA4_VWB8_WSGRA0_WSGRB0_WS64_WG64_4_1_WGM76_WGMXCC16_WGMXCCGn1
    SolutionIndex: 24
    SolutionNameMin: Cijk_Ailk_Bjlk_BBS_BH_UserArgs_MT64x128x64_MI16x16x1_SN_LDSB1_AFC0_AFEM1_AFEM1_ASEM1_CLR0_CADS0_DTVA0_DTVB0_EPS0_FDSI0_GRPM1_GRVWA8_GRVWB8_GSU8_GSUAMB_GSUC0_GSUWGMRR0_GLS0_ISA942_IU1_K1_LBSPPA512_LBSPPB1024_LBSPPM0_LPA0_LPB32_LPM0_LRVW4_LWPMn1_MIAV0_MIWT4_2_MO40_NTn1_NTA0_NTB0_NTC0_NTD4_NTM0_NEPBS0_NLCA1_NLCB1_ONLL1_PGR2_PLR1_PKA1_SIA3_SS1_SU2_SUM0_SUS128_SPO1_SRVW0_SSO0_SVW4_SK0_SKXCCM0_TLDS0_ULSGRO0_USL1_UIOFGRO0_USFGROn1_VSn1_VWA4_VWB2_WSGRA0_WSGRB0_WS64_WG16_16_1_WGM6_WGMXCC1_WGMXCCGn1
    SolutionIndex: 25
    SolutionNameMin: Cijk_Ailk_Bjlk_BBS_BH_UserArgs_MT128x128x64_MI16x16x1_SN_LDSB0_AFC0_AFEM1_AFEM1_ASEM1_CLR1_CADS0_DTVA0_DTVB0_EPS0_FDSI0_GRPM0p26_GRVWA8_GRVWB8_GSU8_GSUAMB_GSUC0_GSUWGMRR0_GLS0_ISA942_IU1_K1_LBSPPA1024_LBSPPB1024_LBSPPM0_LPA0_LPB0_LPM0_LRVW4_LWPM0p30_MIAV0_MIWT4_4_MO40_NTn1_NTA0_NTB0_NTC0_NTD7_NTM0_NEPBS2_NLCA1_NLCB1_ONLL0_PGR2_PLR1_PKA1_SIA3_SS1_SU4_SUM1_SUS256_SPO0_SRVW0_SSO0_SVW4_SK0_SKXCCM0_TLDS0_ULSGRO0_USL1_UIOFGRO0_USFGROn1_VSn1_VWA4_VWB4_WSGRA2_WSGRB0_WS64_WG32_8_1_WGM16_WGMXCC4_WGMXCCG32
    SolutionIndex: 26
    SolutionNameMin: Cijk_Ailk_Bjlk_BBS_BH_UserArgs_MT64x128x64_MI16x16x1_SN_LDSB1_AFC0_AFEM1_AFEM1_ASEM1_CLR1_CADS0_DTVA0_DTVB0_EPS0_FDSI0_GRPM0p50_GRVWA8_GRVWB8_GSU8_GSUAMB_GSUC0_GSUWGMRR0_GLS0_ISA942_IU1_K1_LBSPPA512_LBSPPB1024_LBSPPM0_LPA0_LPB32_LPM0_LRVW4_LWPM0p26_MIAV0_MIWT4_2_MO40_NTn1_NTA0_NTB0_NTC0_NTD4_NTM0_NEPBS6_NLCA1_NLCB1_ONLL0_PGR2_PLR1_PKA1_SIA3_SS1_SU2_SUM0_SUS256_SPO0_SRVW0_SSO0_SVW4_SK0_SKXCCM0_TLDS0_ULSGRO0_USL1_UIOFGRO0_USFGROn1_VSn1_VWA4_VWB2_WSGRA0_WSGRB1_WS64_WG16_16_1_WGM1_WGMXCC8_WGMXCCG0
    SolutionIndex: 27
    SolutionNameMin: Cijk_Ailk_Bjlk_BBS_BH_UserArgs_MT64x64x64_MI16x16x1_SN_LDSB0_AFC0_AFEM1_AFEM1_ASEM1_CLR0_CADS0_DTVA0_DTVB0_EPS0_FDSI0_GRPM0p80_GRVWA8_GRVWB8_GSU8_GSUAMB_GSUC0_GSUWGMRR1_GLS0_ISA942_IU1_K1_LBSPPA512_LBSPPB512_LBSPPM0_LPA32_LPB32_LPM0_LRVW4_LWPM0p80_MIAV0_MIWT2_2_MO40_NTn1_NTA0_NTB0_NTC4_NTD4_NTM0_NEPBS10_NLCA1_NLCB1_ONLL1_PGR2_PLR1_PKA1_SIA3_SS1_SU4_SUM1_SUS128_SPO0_SRVW0_SSO2_SVW2_SK0_SKXCCM0_TLDS0_ULSGRO0_USL1_UIOFGRO0_USFGRO1_VSn1_VWA2_VWB2_WSGRA1_WSGRB1_WS64_WG32_8_1_WGM76_WGMXCC16_WGMXCCG0
    SolutionIndex: 28
    SolutionNameMin: Cijk_Ailk_Bjlk_BBS_BH_UserArgs_MT128x64x64_MI16x16x1_SN_LDSB1_AFC0_AFEM1_AFEM1_ASEM1_CLR0_CADS0_DTVA0_DTVB0_EPS0_FDSI0_GRPM0p60_GRVWA8_GRVWB8_GSU8_GSUAMB_GSUC0_GSUWGMRR0_GLS0_ISA942_IU1_K1_LBSPPA1024_LBSPPB512_LBSPPM0_LPA0_LPB32_LPM0_LRVW4_LWPM0p40_MIAV0_MIWT4_2_MO40_NTn1_NTA0_NTB4_NTC7_NTD7_NTM0_NEPBS4_NLCA1_NLCB1_ONLL0_PGR2_PLR1_PKA1_SIA3_SS1_SU4_SUM1_SUS512_SPO1_SRVW0_SSO1_SVW4_SK0_SKXCCM0_TLDS0_ULSGRO1_USL1_UIOFGRO0_USFGROn1_VSn1_VWA4_VWB2_WSGRA1_WSGRB0_WS64_WG32_8_1_WGM76_WGMXCC32_WGMXCCG0
    SolutionIndex: 29
    SolutionNameMin: Cijk_Ailk_Bjlk_BBS_BH_UserArgs_MT256x32x64_MI16x16x1_SN_LDSB1_AFC0_AFEM1_AFEM1_ASEM1_CLR1_CADS0_DTVA0_DTVB0_EPS0_FDSI0_GRPM0p50_GRVWA8_GRVWB8_GSU304_GSUAMB_GSUC0_GSUWGMRR0_GLS0_ISA942_IU1_K1_LBSPPA2048_LBSPPB256_LBSPPM0_LPA0_LPB32_LPM0_LRVW4_LWPMn1_MIAV0_MIWT4_2_MO40_NTn1_NTA4_NTB0_NTC4_NTD4_NTM0_NEPBS2_NLCA1_NLCB1_ONLL0_PGR2_PLR1_PKA1_SIA3_SS1_SU2_SUM1_SUS128_SPO1_SRVW0_SSO0_SVW4_SK0_SKXCCM0_TLDS0_ULSGRO0_USL1_UIOFGRO0_USFGRO1_VSn1_VWA4_VWB2_WSGRA1_WSGRB1_WS64_WG64_4_1_WGM1_WGMXCC1_WGMXCCGn1
    SolutionIndex: 30
    SolutionNameMin: Cijk_Ailk_Bjlk_BBS_BH_UserArgs_MT256x128x32_MI16x16x1_SN_LDSB1_AFC0_AFEM1_AFEM1_ASEM1_CLR1_CADS0_DTVA0_DTVB0_EPS0_FDSI0_GRPM1_GRVWA8_GRVWB8_GSU1_GSUAMB_GSUC0_GSUWGMRR0_GLS0_ISA942_IU1_K1_LBSPPA2048_LBSPPB1024_LBSPPM0_LPA0_LPB0_LPM0_LRVW4_LWPMn1_MIAV0_MIWT4_8_MO40_NTn1_NTA0_NTB0_NTC0_NTD4_NTM0_NEPBS16_NLCA1_NLCB1_ONLL1_PGR2_PLR1_PKA1_SIA3_SS1_SU8_SUM0_SUS64_SPO0_SRVW0_SSO0_SVW4_SK0_SKXCCM0_TLDS0_ULSGRO0_USL1_UIOFGRO0_USFGROn1_VSn1_VWA4_VWB8_WSGRA1_WSGRB1_WS64_WG64_4_1_WGM1_WGMXCC1_WGMXCCG0
    SolutionIndex: 31
    SolutionNameMin: Cijk_Ailk_Bjlk_BBS_BH_UserArgs_MT128x256x32_MI16x16x1_SN_LDSB1_AFC0_AFEM1_AFEM1_ASEM1_CLR1_CADS0_DTVA0_DTVB0_EPS0_FDSI0_GRPM1_GRVWA8_GRVWB8_GSU1_GSUAMB_GSUC0_GSUWGMRR0_GLS0_ISA942_IU1_K1_LBSPPA1024_LBSPPB2048_LBSPPM0_LPA0_LPB0_LPM0_LRVW4_LWPMn1_MIAV0_MIWT4_8_MO40_NTn1_NTA0_NTB0_NTC0_NTD4_NTM0_NEPBS16_NLCA1_NLCB1_ONLL1_PGR2_PLR1_PKA1_SIA3_SS1_SU8_SUM0_SUS64_SPO0_SRVW0_SSO0_SVW4_SK0_SKXCCM0_TLDS0_ULSGRO0_USL1_UIOFGRO0_USFGROn1_VSn1_VWA4_VWB8_WSGRA1_WSGRB1_WS64_WG32_8_1_WGM6_WGMXCC8_WGMXCCG304
    SolutionIndex: 32
    SolutionNameMin: Cijk_Ailk_Bjlk_BBS_BH_UserArgs_MT256x256x32_MI16x16x1_SN_LDSB0_AFC0_AFEM1_AFEM1_ASEM1_CLR1_CADS0_DTVA0_DTVB0_EPS0_FDSI0_GRPM1_GRVWA8_GRVWB8_GSU1_GSUAMB_GSUC0_GSUWGMRR0_GLS0_ISA942_IU1_K1_LBSPPA2048_LBSPPB2048_LBSPPM0_LPA0_LPB0_LPM0_LRVW4_LWPMn1_MIAV0_MIWT8_8_MO40_NTn1_NTA0_NTB0_NTC0_NTD4_NTM0_NEPBS16_NLCA1_NLCB1_ONLL1_PGR2_PLR1_PKA1_SIA3_SS1_SU8_SUM0_SUS64_SPO0_SRVW0_SSO0_SVW8_SK0_SKXCCM0_TLDS0_ULSGRO0_USL1_UIOFGRO0_USFGROn1_VSn1_VWA8_VWB8_WSGRA1_WSGRB1_WS64_WG32_8_1_WGM6_WGMXCC8_WGMXCCG304
    SolutionIndex: 33
    SolutionNameMin: Cijk_Ailk_Bjlk_BBS_BH_UserArgs_MT256x224x32_MI16x16x1_SN_LDSB0_AFC0_AFEM1_AFEM1_ASEM1_CLR1_CADS0_DTVA0_DTVB0_EPS0_FDSI0_GRPM1_GRVWA8_GRVWB4_GSU1_GSUAMB_GSUC0_GSUWGMRR0_GLS0_ISA942_IU1_K1_LBSPPA2048_LBSPPB1792_LBSPPM0_LPA0_LPB16_LPM0_LRVW4_LWPMn1_MIAV0_MIWT8_7_MO40_NTn1_NTA0_NTB0_NTC0_NTD4_NTM0_NEPBS16_NLCA1_NLCB7_ONLL1_PGR2_PLR1_PKA1_SIA3_SS1_SU8_SUM0_SUS64_SPO0_SRVW0_SSO0_SVW8_SK0_SKXCCM0_TLDS0_ULSGRO0_USL1_UIOFGRO0_USFGROn1_VSn1_VWA8_VWB1_WSGRA1_WSGRB1_WS64_WG32_8_1_WGM6_WGMXCC8_WGMXCCG304
    SolutionIndex: 34
    SolutionNameMin: Cijk_Ailk_Bjlk_BBS_BH_UserArgs_MT256x192x32_MI16x16x1_SN_LDSB0_AFC0_AFEM1_AFEM1_ASEM1_CLR1_CADS0_DTVA0_DTVB0_EPS0_FDSI0_GRPM1_GRVWA8_GRVWB8_GSU1_GSUAMB_GSUC0_GSUWGMRR0_GLS0_ISA942_IU1_K1_LBSPPA2048_LBSPPB1536_LBSPPM0_LPA0_LPB32_LPM0_LRVW4_LWPMn1_MIAV0_MIWT8_6_MO40_NTn1_NTA0_NTB0_NTC0_NTD4_NTM0_NEPBS16_NLCA1_NLCB3_ONLL1_PGR2_PLR1_PKA1_SIA3_SS1_SU16_SUM1_SUS64_SPO0_SRVW0_SSO0_SVW8_SK0_SKXCCM0_TLDS0_ULSGRO0_USL1_UIOFGRO0_USFGROn1_VSn1_VWA8_VWB2_WSGRA1_WSGRB1_WS64_WG32_8_1_WGM8_WGMXCC8_WGMXCCG304
    SolutionIndex: 35
    SolutionNameMin: Cijk_Ailk_Bjlk_BBS_BH_UserArgs_MT128x128x64_MI16x16x1_SN_LDSB1_AFC0_AFEM1_AFEM1_ASEM1_CLR1_CADS0_DTVA0_DTVB0_EPS0_FDSI0_GRPM1_GRVWA8_GRVWB8_GSU1_GSUAMB_GSUC0_GSUWGMRR0_GLS0_ISA942_IU1_K1_LBSPPA1024_LBSPPB1024_LBSPPM0_LPA0_LPB0_LPM0_LRVW4_LWPMn1_MIAV0_MIWT4_4_MO40_NTn1_NTA0_NTB0_NTC0_NTD4_NTM0_NEPBS16_NLCA1_NLCB1_ONLL1_PGR2_PLR1_PKA1_SIA3_SS1_SU16_SUM1_SUS128_SPO0_SRVW0_SSO0_SVW4_SK0_SKXCCM0_TLDS0_ULSGRO0_USL1_UIOFGRO0_USFGROn1_VSn1_VWA4_VWB4_WSGRA1_WSGRB1_WS64_WG32_8_1_WGM8_WGMXCC8_WGMXCCG304
    SolutionIndex: 36
    SolutionNameMin: Cijk_Ailk_Bjlk_BBS_BH_UserArgs_MT256x128x32_MI16x16x1_SN_LDSB1_AFC0_AFEM1_AFEM1_ASEM1_CLR1_CADS0_DTVA0_DTVB0_EPS0_FDSI0_GRPM1_GRVWA8_GRVWB8_GSU1_GSUAMB_GSUC0_GSUWGMRR0_GLS0_ISA942_IU1_K1_LBSPPA2048_LBSPPB1024_LBSPPM0_LPA0_LPB0_LPM0_LRVW4_LWPMn1_MIAV0_MIWT4_8_MO40_NTn1_NTA0_NTB0_NTC0_NTD4_NTM0_NEPBS16_NLCA1_NLCB1_ONLL1_PGR2_PLR1_PKA1_SIA3_SS1_SU16_SUM1_SUS64_SPO0_SRVW0_SSO0_SVW4_SK0_SKXCCM0_TLDS0_ULSGRO0_USL1_UIOFGRO0_USFGROn1_VSn1_VWA4_VWB8_WSGRA1_WSGRB1_WS64_WG64_4_1_WGM8_WGMXCC8_WGMXCCG304
    SolutionIndex: 37
    SolutionNameMin: Cijk_Ailk_Bjlk_BBS_BH_UserArgs_MT128x256x32_MI16x16x1_SN_LDSB1_AFC0_AFEM1_AFEM1_ASEM1_CLR1_CADS0_DTVA0_DTVB0_EPS0_FDSI0_GRPM1_GRVWA8_GRVWB8_GSU1_GSUAMB_GSUC0_GSUWGMRR0_GLS0_ISA942_IU1_K1_LBSPPA1024_LBSPPB2048_LBSPPM0_LPA0_LPB0_LPM0_LRVW4_LWPMn1_MIAV0_MIWT4_8_MO40_NTn1_NTA0_NTB0_NTC0_NTD4_NTM0_NEPBS16_NLCA1_NLCB1_ONLL1_PGR2_PLR1_PKA1_SIA3_SS1_SU16_SUM1_SUS64_SPO0_SRVW0_SSO0_SVW4_SK0_SKXCCM0_TLDS0_ULSGRO0_USL1_UIOFGRO0_USFGROn1_VSn1_VWA4_VWB8_WSGRA1_WSGRB1_WS64_WG32_8_1_WGM8_WGMXCC8_WGMXCCG304
    SolutionIndex: 38
    SolutionNameMin: Cijk_Ailk_Bjlk_BBS_BH_UserArgs_MT128x128x64_MI16x16x1_SN_LDSB1_AFC0_AFEM1_AFEM1_ASEM1_CLR1_CADS0_DTVA0_DTVB0_EPS0_FDSI0_GRPM1_GRVWA8_GRVWB8_GSU38_GSUAMB_GSUC0_GSUWGMRR1_GLS0_ISA942_IU1_K1_LBSPPA1024_LBSPPB1024_LBSPPM0_LPA0_LPB0_LPM0_LRVW4_LWPMn1_MIAV0_MIWT4_4_MO40_NTn1_NTA0_NTB0_NTC0_NTD4_NTM0_NEPBS0_NLCA1_NLCB1_ONLL1_PGR2_PLR1_PKA1_SIA3_SS1_SU8_SUM1_SUS256_SPO0_SRVW0_SSO0_SVW4_SK0_SKXCCM0_TLDS0_ULSGRO0_USL1_UIOFGRO0_USFGROn1_VSn1_VWA4_VWB4_WSGRA0_WSGRB0_WS64_WG32_8_1_WGM1_WGMXCC8_WGMXCCG304
    SolutionIndex: 39
    SolutionNameMin: Cijk_Ailk_Bjlk_BBS_BH_UserArgs_MT16x128x32_MI16x16x1_SN_LDSB0_AFC0_AFEM2_AFEM8_ASEM32_CLR1_CADS0_DTVA0_DTVB0_EPS0_FDSI0_GRPM1_GRVWA2_GRVWB8_GSU10_GSUAMB_GSUC0_GSUWGMRR0_GLS0_ISA942_IU1_LBSPPA128_LBSPPB1024_LBSPPM0_LPA16_LPB16_LPM0_LRVW4_LWPMn1_MIAV0_MIWT1_2_MO40_NTn1_NTA0_NTB1_NTC0_NTD1_NTM0_NEPBS0_NLCA1_NLCB1_ONLL1_PGR2_PLR1_PKA1_SIA3_SS1_SU0_SUM1_SUS0_SPO1_SRVW0_SSO0_SVW1_SK0_SKXCCM0_TLDS0_ULSGRO0_USL1_UIOFGRO0_USFGROn1_VSn1_VWA1_VWB2_WSGRA2_WSGRB1_WS64_WG16_16_1_WGM1_WGMXCC1_WGMXCCGn1
    SolutionIndex: 40
    SolutionNameMin: Cijk_Ailk_Bjlk_BBS_BH_UserArgs_MT256x96x64_MI16x16x1_SN_LDSB0_AFC1_AFEM1_AFEM1_ASEM1_CLR1_CADS0_DTVA1_DTVB0_EPS0_FDSI1_GRPM1_GRVWA4_GRVWB8_GSUn1_GSUAMBSK_GSUC1_GSUWGMRR1_GLS0_ISA942_IU1_K1_LBSPPA0_LBSPPB768_LBSPPM0_LPA0_LPB32_LPM0_LRVW4_LWPMn1_MIAV0_MIWT4_6_MO40_NTn1_NTA0_NTB0_NTC0_NTD4_NTM0_NEPBS8_NLCA1_NLCB3_ONLL1_PGR2_PLR1_PKA1_SIA3_SS1_SU16_SUM1_SUS128_SPO0_SRVW0_SSO0_SVW4_SK0_SKXCCM0_TLDS0_ULSGRO0_USL1_UIOFGRO0_USFGROn1_VSn1_VWA4_VWB2_WSGRA0_WSGRB0_WS64_WG64_4_1_WGM8_WGMXCC8_WGMXCCGn1
    SolutionIndex: 41
    SolutionNameMin: Cijk_Ailk_Bjlk_BBS_BH_UserArgs_MT32x16x128_MI16x16x1_SN_LDSB0_AFC1_AFEM1_AFEM1_ASEM1_CLR1_CADS0_DTVA0_DTVB0_EPS0_FDSI1_GRPM1_GRVWA8_GRVWB8_GSUn1_GSUAMBSK_GSUC1_GSUWGMRR1_GLS0_ISA942_IU1_K1_LBSPPA256_LBSPPB128_LBSPPM0_LPA32_LPB16_LPM0_LRVW4_LWPMn1_MIAV0_MIWT2_1_MO40_NTn1_NTA0_NTB0_NTC0_NTD4_NTM0_NEPBS8_NLCA1_NLCB1_ONLL1_PGR2_PLR1_PKA1_SIA3_SS1_SU16_SUM1_SUS256_SPO0_SRVW0_SSO0_SVW2_SK0_SKXCCM0_TLDS0_ULSGRO0_USL1_UIOFGRO0_USFGROn1_VSn1_VWA2_VWB1_WSGRA0_WSGRB0_WS64_WG16_4_4_WGM1_WGMXCC8_WGMXCCGn1
    SolutionIndex: 42
    SolutionNameMin: Cijk_Ailk_Bjlk_BBS_BH_UserArgs_MT128x256x32_MI16x16x1_SN_LDSB0_AFC1_AFEM1_AFEM1_ASEM1_CLR1_CADS0_DTVA0_DTVB1_EPS0_FDSI1_GRPM1_GRVWA8_GRVWB8_GSUn1_GSUAMB_GSUC1_GSUWGMRR1_GLS0_ISA942_IU1_K1_LBSPPA1024_LBSPPB0_LBSPPM0_LPA0_LPB0_LPM0_LRVW4_LWPMn1_MIAV0_MIWT4_8_MO40_NTn1_NTA0_NTB0_NTC0_NTD4_NTM0_NEPBS8_NLCA1_NLCB1_ONLL1_PGR2_PLR1_PKA1_SIA3_SS1_SU16_SUM1_SUS64_SPO0_SRVW0_SSO0_SVW4_SK0_SKXCCM0_TLDS0_ULSGRO0_USL1_UIOFGRO0_USFGROn1_VSn1_VWA4_VWB8_WSGRA0_WSGRB0_WS64_WG32_8_1_WGM6_WGMXCC8_WGMXCCGn1
    SolutionIndex: 43
    SolutionNameMin: Cijk_Ailk_Bjlk_BBS_BH_UserArgs_MT64x16x128_MI16x16x1_SN_LDSB1_AFC1_AFEM1_AFEM1_ASEM1_CLR1_CADS0_DTVA0_DTVB0_EPS0_FDSI1_GRPM1_GRVWA8_GRVWB8_GSUn1_GSUAMBSK_GSUC1_GSUWGMRR1_GLS0_ISA942_IU1_K1_LBSPPA512_LBSPPB128_LBSPPM0_LPA0_LPB16_LPM0_LRVW4_LWPMn1_MIAV0_MIWT4_1_MO40_NTn1_NTA0_NTB0_NTC0_NTD4_NTM0_NEPBS8_NLCA1_NLCB1_ONLL1_PGR2_PLR1_PKA1_SIA3_SS1_SU16_SUM1_SUS256_SPO0_SRVW0_SSO0_SVW4_SK0_SKXCCM0_TLDS0_ULSGRO0_USL1_UIOFGRO0_USFGROn1_VSn1_VWA4_VWB1_WSGRA0_WSGRB0_WS64_WG16_4_4_WGM1_WGMXCC8_WGMXCCGn1
    SolutionIndex: 44
    SolutionNameMin: Cijk_Ailk_Bjlk_BBS_BH_UserArgs_MT256x128x64_MI16x16x1_SN_LDSB0_AFC1_AFEM1_AFEM1_ASEM1_CLR1_CADS0_DTVA1_DTVB0_EPS0_FDSI1_GRPM1_GRVWA4_GRVWB8_GSUn1_GSUAMBSK_GSUC1_GSUWGMRR1_GLS0_ISA942_IU1_K1_LBSPPA0_LBSPPB1024_LBSPPM0_LPA0_LPB0_LPM0_LRVW4_LWPMn1_MIAV0_MIWT4_8_MO40_NTn1_NTA0_NTB0_NTC0_NTD4_NTM0_NEPBS8_NLCA1_NLCB1_ONLL1_PGR2_PLR1_PKA1_SIA3_SS1_SU16_SUM1_SUS128_SPO0_SRVW0_SSO0_SVW4_SK0_SKXCCM0_TLDS0_ULSGRO0_USL1_UIOFGRO0_USFGROn1_VSn1_VWA4_VWB8_WSGRA0_WSGRB0_WS64_WG64_4_1_WGM8_WGMXCC8_WGMXCCGn1
    SolutionIndex: 45
    SolutionNameMin: Cijk_Ailk_Bjlk_BBS_BH_UserArgs_MT256x128x32_MI16x16x1_SN_LDSB0_AFC1_AFEM1_AFEM1_ASEM1_CLR1_CADS0_DTVA1_DTVB0_EPS0_FDSI1_GRPM1_GRVWA4_GRVWB8_GSUn1_GSUAMB_GSUC1_GSUWGMRR1_GLS0_ISA942_IU1_K1_LBSPPA0_LBSPPB1024_LBSPPM0_LPA0_LPB0_LPM0_LRVW4_LWPMn1_MIAV0_MIWT4_8_MO40_NTn1_NTA0_NTB0_NTC0_NTD4_NTM0_NEPBS8_NLCA1_NLCB1_ONLL1_PGR2_PLR1_PKA1_SIA3_SS1_SU16_SUM1_SUS64_SPO0_SRVW0_SSO0_SVW4_SK0_SKXCCM0_TLDS0_ULSGRO0_USL1_UIOFGRO0_USFGROn1_VSn1_VWA4_VWB8_WSGRA0_WSGRB0_WS64_WG64_4_1_WGM6_WGMXCC8_WGMXCCGn1
    SolutionIndex: 46
    SolutionNameMin: Cijk_Ailk_Bjlk_BBS_BH_UserArgs_MT192x128x32_MI16x16x1_SN_LDSB1_AFC1_AFEM1_AFEM1_ASEM1_CLR1_CADS0_DTVA0_DTVB0_EPS0_FDSI1_GRPM1_GRVWA8_GRVWB8_GSUn1_GSUAMB_GSUC1_GSUWGMRR1_GLS0_ISA942_IU1_K1_LBSPPA1536_LBSPPB1024_LBSPPM0_LPA32_LPB0_LPM0_LRVW4_LWPMn1_MIAV0_MIWT6_4_MO40_NTn1_NTA0_NTB0_NTC0_NTD4_NTM0_NEPBS6_NLCA3_NLCB1_ONLL1_PGR2_PLR1_PKA1_SIA3_SS1_SU16_SUM1_SUS64_SPO0_SRVW0_SSO0_SVW2_SK0_SKXCCM0_TLDS0_ULSGRO1_USL1_UIOFGRO0_USFGROn1_VSn1_VWA2_VWB4_WSGRA0_WSGRB0_WS64_WG32_8_1_WGM1_WGMXCC8_WGMXCCGn1
    SolutionIndex: 47
    SolutionNameMin: Cijk_Ailk_Bjlk_BBS_BH_UserArgs_MT128x256x64_MI16x16x1_SN_LDSB0_AFC1_AFEM1_AFEM1_ASEM1_CLR1_CADS0_DTVA0_DTVB1_EPS0_FDSI1_GRPM1_GRVWA8_GRVWB4_GSUn1_GSUAMBSK_GSUC1_GSUWGMRR1_GLS0_ISA942_IU1_K1_LBSPPA1024_LBSPPB0_LBSPPM0_LPA0_LPB0_LPM0_LRVW4_LWPMn1_MIAV0_MIWT8_4_MO40_NTn1_NTA0_NTB0_NTC0_NTD4_NTM0_NEPBS8_NLCA1_NLCB1_ONLL1_PGR2_PLR1_PKA1_SIA3_SS1_SU16_SUM1_SUS128_SPO0_SRVW0_SSO0_SVW8_SK0_SKXCCM0_TLDS0_ULSGRO0_USL1_UIOFGRO0_USFGROn1_VSn1_VWA8_VWB4_WSGRA0_WSGRB0_WS64_WG16_16_1_WGM8_WGMXCC8_WGMXCCGn1
    SolutionIndex: 48
    SolutionNameMin: Cijk_Ailk_Bjlk_BBS_BH_UserArgs_MT160x512x32_MI16x16x1_SN_LDSB0_AFC1_AFEM1_AFEM1_ASEM1_CLR1_CADS0_DTVA0_DTVB1_EPS0_FDSI1_GRPM1_GRVWA4_GRVWB8_GSUn1_GSUAMB_GSUC1_GSUWGMRR1_GLS0_ISA942_IU1_K1_LBSPPA1280_LBSPPB0_LBSPPM0_LPA32_LPB0_LPM0_LRVW4_LWPMn1_MIAV0_MIWT10_8_MO40_NTn1_NTA0_NTB0_NTC0_NTD4_NTM0_NEPBS10_NLCA5_NLCB1_ONLL1_PGR2_PLR1_PKA1_SIA3_SS1_SU16_SUM1_SUS64_SPO0_SRVW0_SSO0_SVW2_SK0_SKXCCM0_TLDS0_ULSGRO0_USL1_UIOFGRO0_USFGROn1_VSn1_VWA2_VWB8_WSGRA0_WSGRB0_WS64_WG16_16_1_WGM6_WGMXCC8_WGMXCCGn1
    SolutionIndex: 49
    SolutionNameMin: Cijk_Ailk_Bjlk_BBS_BH_UserArgs_MT512x160x32_MI16x16x1_SN_LDSB0_AFC1_AFEM1_AFEM1_ASEM1_CLR1_CADS0_DTVA1_DTVB0_EPS0_FDSI1_GRPM1_GRVWA8_GRVWB4_GSUn1_GSUAMB_GSUC1_GSUWGMRR1_GLS0_ISA942_IU1_K1_LBSPPA0_LBSPPB1280_LBSPPM0_LPA0_LPB32_LPM0_LRVW4_LWPMn1_MIAV0_MIWT8_10_MO40_NTn1_NTA0_NTB0_NTC0_NTD4_NTM0_NEPBS8_NLCA1_NLCB5_ONLL1_PGR2_PLR1_PKA1_SIA3_SS1_SU16_SUM1_SUS64_SPO0_SRVW0_SSO0_SVW8_SK0_SKXCCM0_TLDS0_ULSGRO0_USL1_UIOFGRO0_USFGROn1_VSn1_VWA8_VWB2_WSGRA0_WSGRB0_WS64_WG64_4_1_WGM8_WGMXCC8_WGMXCCGn1
    SolutionIndex: 50
    SolutionNameMin: Cijk_Ailk_Bjlk_BBS_BH_UserArgs_MT128x512x32_MI16x16x1_SN_LDSB0_AFC1_AFEM1_AFEM1_ASEM1_CLR1_CADS0_DTVA0_DTVB1_EPS0_FDSI1_GRPM1_GRVWA8_GRVWB8_GSUn1_GSUAMB_GSUC1_GSUWGMRR1_GLS0_ISA942_IU1_K1_LBSPPA1024_LBSPPB0_LBSPPM0_LPA0_LPB0_LPM0_LRVW4_LWPMn1_MIAV0_MIWT8_8_MO40_NTn1_NTA0_NTB0_NTC0_NTD4_NTM0_NEPBS8_NLCA1_NLCB1_ONLL1_PGR2_PLR1_PKA1_SIA3_SS1_SU16_SUM1_SUS64_SPO0_SRVW0_SSO0_SVW8_SK0_SKXCCM0_TLDS0_ULSGRO0_USL1_UIOFGRO0_USFGROn1_VSn1_VWA8_VWB8_WSGRA0_WSGRB0_WS64_WG16_16_1_WGM1_WGMXCC8_WGMXCCGn1
    SolutionIndex: 51
    SolutionNameMin: Cijk_Ailk_Bjlk_BBS_BH_UserArgs_MT160x448x32_MI16x16x1_SN_LDSB1_AFC1_AFEM1_AFEM1_ASEM1_CLR1_CADS0_DTVA0_DTVB0_EPS0_FDSI1_GRPM1_GRVWA4_GRVWB8_GSUn1_GSUAMB_GSUC1_GSUWGMRR1_GLS0_ISA942_IU1_K1_LBSPPA1280_LBSPPB3584_LBSPPM0_LPA32_LPB16_LPM0_LRVW4_LWPMn1_MIAV0_MIWT10_7_MO40_NTn1_NTA0_NTB0_NTC0_NTD4_NTM0_NEPBS10_NLCA5_NLCB7_ONLL1_PGR2_PLR1_PKA1_SIA3_SS1_SU16_SUM1_SUS64_SPO0_SRVW0_SSO0_SVW2_SK0_SKXCCM0_TLDS0_ULSGRO0_USL1_UIOFGRO0_USFGROn1_VSn1_VWA2_VWB1_WSGRA0_WSGRB0_WS64_WG16_16_1_WGM1_WGMXCC8_WGMXCCGn1
    SolutionIndex: 52
    SolutionNameMin: Cijk_Ailk_Bjlk_BBS_BH_UserArgs_MT64x64x128_MI16x16x1_SN_LDSB1_AFC1_AFEM1_AFEM1_ASEM1_CLR1_CADS0_DTVA0_DTVB0_EPS0_FDSI1_GRPM1_GRVWA8_GRVWB8_GSUn1_GSUAMBSK_GSUC1_GSUWGMRR1_GLS0_ISA942_IU1_K1_LBSPPA512_LBSPPB512_LBSPPM0_LPA0_LPB0_LPM0_LRVW4_LWPMn1_MIAV0_MIWT4_4_MO40_NTn1_NTA0_NTB0_NTC0_NTD4_NTM0_NEPBS8_NLCA1_NLCB1_ONLL1_PGR2_PLR1_PKA1_SIA3_SS1_SU16_SUM1_SUS256_SPO0_SRVW0_SSO0_SVW4_SK0_SKXCCM0_TLDS0_ULSGRO0_USL1_UIOFGRO0_USFGROn1_VSn1_VWA4_VWB4_WSGRA0_WSGRB0_WS64_WG16_4_4_WGM8_WGMXCC8_WGMXCCGn1
    SolutionIndex: 53
    SolutionNameMin: Cijk_Ailk_Bjlk_BBS_BH_UserArgs_MT128x192x32_MI16x16x1_SN_LDSB1_AFC1_AFEM1_AFEM1_ASEM1_CLR1_CADS0_DTVA0_DTVB0_EPS0_FDSI1_GRPM1_GRVWA8_GRVWB8_GSUn1_GSUAMB_GSUC1_GSUWGMRR1_GLS0_ISA942_IU1_K1_LBSPPA1024_LBSPPB1536_LBSPPM0_LPA0_LPB32_LPM0_LRVW4_LWPMn1_MIAV0_MIWT4_6_MO40_NTn1_NTA0_NTB0_NTC0_NTD4_NTM0_NEPBS8_NLCA1_NLCB3_ONLL1_PGR2_PLR1_PKA1_SIA3_SS1_SU16_SUM1_SUS64_SPO0_SRVW0_SSO0_SVW4_SK0_SKXCCM0_TLDS0_ULSGRO0_USL1_UIOFGRO0_USFGROn1_VSn1_VWA4_VWB2_WSGRA0_WSGRB0_WS64_WG32_8_1_WGM6_WGMXCC8_WGMXCCGn1
    SolutionIndex: 54
    SolutionNameMin: Cijk_Ailk_Bjlk_BBS_BH_UserArgs_MT128x256x32_MI16x16x1_SN_LDSB1_AFC1_AFEM1_AFEM1_ASEM1_CLR1_CADS0_DTVA0_DTVB0_EPS0_FDSI1_GRPM1_GRVWA8_GRVWB8_GSUn1_GSUAMB_GSUC1_GSUWGMRR1_GLS0_ISA942_IU1_K1_LBSPPA1024_LBSPPB2048_LBSPPM0_LPA0_LPB0_LPM0_LRVW4_LWPMn1_MIAV0_MIWT4_8_MO40_NTn1_NTA0_NTB0_NTC0_NTD4_NTM0_NEPBS8_NLCA1_NLCB1_ONLL1_PGR2_PLR1_PKA1_SIA3_SS1_SU16_SUM1_SUS64_SPO0_SRVW0_SSO0_SVW4_SK0_SKXCCM0_TLDS0_ULSGRO0_USL1_UIOFGRO0_USFGROn1_VSn1_VWA4_VWB8_WSGRA0_WSGRB0_WS64_WG32_8_1_WGM1_WGMXCC8_WGMXCCGn1
    SolutionIndex: 55
    SolutionNameMin: Cijk_Ailk_Bjlk_BBS_BH_UserArgs_MT512x128x32_MI16x16x1_SN_LDSB0_AFC1_AFEM1_AFEM1_ASEM1_CLR1_CADS0_DTVA1_DTVB0_EPS0_FDSI1_GRPM1_GRVWA8_GRVWB8_GSUn1_GSUAMB_GSUC1_GSUWGMRR1_GLS0_ISA942_IU1_K1_LBSPPA0_LBSPPB1024_LBSPPM0_LPA0_LPB0_LPM0_LRVW4_LWPMn1_MIAV0_MIWT8_8_MO40_NTn1_NTA0_NTB0_NTC0_NTD4_NTM0_NEPBS8_NLCA1_NLCB1_ONLL1_PGR2_PLR1_PKA1_SIA3_SS1_SU16_SUM1_SUS64_SPO0_SRVW0_SSO0_SVW8_SK0_SKXCCM0_TLDS0_ULSGRO0_USL1_UIOFGRO0_USFGROn1_VSn1_VWA8_VWB8_WSGRA0_WSGRB0_WS64_WG64_4_1_WGM6_WGMXCC8_WGMXCCGn1
    SolutionIndex: 56
    SolutionNameMin: Cijk_Ailk_Bjlk_BBS_BH_UserArgs_MT192x256x32_MI16x16x1_SN_LDSB0_AFC1_AFEM1_AFEM1_ASEM1_CLR1_CADS0_DTVA0_DTVB1_EPS0_FDSI1_GRPM1_GRVWA8_GRVWB4_GSUn1_GSUAMB_GSUC1_GSUWGMRR1_GLS0_ISA942_IU1_K1_LBSPPA1536_LBSPPB0_LBSPPM0_LPA0_LPB0_LPM0_LRVW4_LWPMn1_MIAV0_MIWT12_4_MO40_NTn1_NTA0_NTB0_NTC0_NTD4_NTM0_NEPBS12_NLCA3_NLCB1_ONLL1_PGR2_PLR1_PKA1_SIA3_SS1_SU16_SUM1_SUS64_SPO0_SRVW0_SSO0_SVW4_SK0_SKXCCM0_TLDS0_ULSGRO0_USL1_UIOFGRO0_USFGROn1_VSn1_VWA4_VWB4_WSGRA0_WSGRB0_WS64_WG16_16_1_WGM8_WGMXCC8_WGMXCCGn1
    SolutionIndex: 57
    SolutionNameMin: Cijk_Ailk_Bjlk_BBS_BH_UserArgs_MT256x128x32_MI16x16x1_SN_LDSB1_AFC1_AFEM1_AFEM1_ASEM1_CLR1_CADS0_DTVA0_DTVB0_EPS0_FDSI1_GRPM1_GRVWA8_GRVWB8_GSUn1_GSUAMB_GSUC1_GSUWGMRR1_GLS0_ISA942_IU1_K1_LBSPPA2048_LBSPPB1024_LBSPPM0_LPA0_LPB0_LPM0_LRVW4_LWPMn1_MIAV0_MIWT4_8_MO40_NTn1_NTA0_NTB0_NTC0_NTD4_NTM0_NEPBS8_NLCA1_NLCB1_ONLL1_PGR2_PLR1_PKA1_SIA3_SS1_SU16_SUM1_SUS64_SPO0_SRVW0_SSO0_SVW4_SK0_SKXCCM0_TLDS0_ULSGRO0_USL1_UIOFGRO0_USFGROn1_VSn1_VWA4_VWB8_WSGRA0_WSGRB0_WS64_WG64_4_1_WGM6_WGMXCC8_WGMXCCGn1
    SolutionIndex: 58
    SolutionNameMin: Cijk_Ailk_Bjlk_BBS_BH_UserArgs_MT128x256x32_MI16x16x1_SN_LDSB1_AFC1_AFEM1_AFEM1_ASEM1_CLR1_CADS0_DTVA0_DTVB0_EPS0_FDSI1_GRPM1_GRVWA8_GRVWB8_GSUn1_GSUAMB_GSUC1_GSUWGMRR1_GLS0_ISA942_IU1_K1_LBSPPA1024_LBSPPB2048_LBSPPM0_LPA0_LPB0_LPM0_LRVW4_LWPMn1_MIAV0_MIWT4_8_MO40_NTn1_NTA0_NTB0_NTC0_NTD4_NTM0_NEPBS8_NLCA1_NLCB1_ONLL1_PGR2_PLR1_PKA1_SIA3_SS1_SU16_SUM1_SUS64_SPO0_SRVW0_SSO0_SVW4_SK0_SKXCCM0_TLDS0_ULSGRO0_USL1_UIOFGRO0_USFGROn1_VSn1_VWA4_VWB8_WSGRA0_WSGRB0_WS64_WG32_8_1_WGM8_WGMXCC8_WGMXCCGn1
    SolutionIndex: 59
    SolutionNameMin: Cijk_Ailk_Bjlk_BBS_BH_UserArgs_MT256x128x32_MI16x16x1_SN_LDSB1_AFC1_AFEM1_AFEM1_ASEM1_CLR1_CADS0_DTVA0_DTVB0_EPS0_FDSI1_GRPM1_GRVWA8_GRVWB8_GSUn1_GSUAMB_GSUC1_GSUWGMRR1_GLS0_ISA942_IU1_K1_LBSPPA2048_LBSPPB1024_LBSPPM0_LPA0_LPB0_LPM0_LRVW4_LWPMn1_MIAV0_MIWT4_8_MO40_NTn1_NTA0_NTB0_NTC0_NTD4_NTM0_NEPBS8_NLCA1_NLCB1_ONLL1_PGR2_PLR1_PKA1_SIA3_SS1_SU16_SUM1_SUS64_SPO0_SRVW0_SSO0_SVW4_SK0_SKXCCM0_TLDS0_ULSGRO0_USL1_UIOFGRO0_USFGROn1_VSn1_VWA4_VWB8_WSGRA0_WSGRB0_WS64_WG64_4_1_WGM1_WGMXCC8_WGMXCCGn1
    SolutionIndex: 60
    SolutionNameMin: Cijk_Ailk_Bjlk_BBS_BH_UserArgs_MT128x256x32_MI16x16x1_SN_LDSB1_AFC1_AFEM1_AFEM1_ASEM1_CLR1_CADS0_DTVA0_DTVB0_EPS0_FDSI1_GRPM1_GRVWA8_GRVWB8_GSUn1_GSUAMB_GSUC1_GSUWGMRR1_GLS0_ISA942_IU1_K1_LBSPPA1024_LBSPPB2048_LBSPPM0_LPA0_LPB0_LPM0_LRVW4_LWPMn1_MIAV0_MIWT4_8_MO40_NTn1_NTA0_NTB0_NTC0_NTD4_NTM0_NEPBS8_NLCA1_NLCB1_ONLL1_PGR2_PLR1_PKA1_SIA3_SS1_SU16_SUM1_SUS64_SPO0_SRVW0_SSO0_SVW4_SK0_SKXCCM0_TLDS0_ULSGRO1_USL1_UIOFGRO0_USFGROn1_VSn1_VWA4_VWB8_WSGRA0_WSGRB0_WS64_WG32_8_1_WGM6_WGMXCC8_WGMXCCGn1
    SolutionIndex: 61
    SolutionNameMin: Cijk_Ailk_Bjlk_BBS_BH_UserArgs_MT256x128x32_MI16x16x1_SN_LDSB0_AFC1_AFEM1_AFEM1_ASEM1_CLR1_CADS0_DTVA1_DTVB0_EPS0_FDSI1_GRPM1_GRVWA4_GRVWB8_GSUn1_GSUAMB_GSUC1_GSUWGMRR1_GLS0_ISA942_IU1_K1_LBSPPA0_LBSPPB1024_LBSPPM0_LPA0_LPB0_LPM0_LRVW4_LWPMn1_MIAV0_MIWT4_8_MO40_NTn1_NTA0_NTB0_NTC0_NTD4_NTM0_NEPBS8_NLCA1_NLCB1_ONLL1_PGR2_PLR1_PKA1_SIA3_SS1_SU16_SUM1_SUS64_SPO0_SRVW0_SSO0_SVW4_SK0_SKXCCM0_TLDS0_ULSGRO0_USL1_UIOFGRO0_USFGROn1_VSn1_VWA4_VWB8_WSGRA0_WSGRB0_WS64_WG64_4_1_WGM8_WGMXCC8_WGMXCCGn1
    SolutionIndex: 62
    SolutionNameMin: Cijk_Ailk_Bjlk_BBS_BH_UserArgs_MT512x96x32_MI16x16x1_SN_LDSB0_AFC1_AFEM1_AFEM1_ASEM1_CLR1_CADS0_DTVA1_DTVB0_EPS0_FDSI1_GRPM1_GRVWA8_GRVWB4_GSUn1_GSUAMB_GSUC1_GSUWGMRR1_GLS0_ISA942_IU1_K1_LBSPPA0_LBSPPB768_LBSPPM0_LPA0_LPB32_LPM0_LRVW4_LWPMn1_MIAV0_MIWT8_6_MO40_NTn1_NTA0_NTB0_NTC0_NTD4_NTM0_NEPBS8_NLCA1_NLCB3_ONLL1_PGR2_PLR1_PKA1_SIA3_SS1_SU16_SUM1_SUS64_SPO0_SRVW0_SSO0_SVW8_SK0_SKXCCM0_TLDS0_ULSGRO0_USL1_UIOFGRO0_USFGROn1_VSn1_VWA8_VWB2_WSGRA0_WSGRB0_WS64_WG64_4_1_WGM8_WGMXCC8_WGMXCCGn1
    SolutionIndex: 63
    SolutionNameMin: Cijk_Ailk_Bjlk_BBS_BH_UserArgs_MT512x144x32_MI16x16x1_SN_LDSB0_AFC1_AFEM1_AFEM1_ASEM1_CLR1_CADS0_DTVA1_DTVB0_EPS0_FDSI1_GRPM1_GRVWA8_GRVWB2_GSUn1_GSUAMB_GSUC1_GSUWGMRR1_GLS0_ISA942_IU1_K1_LBSPPA0_LBSPPB1152_LBSPPM0_LPA0_LPB16_LPM0_LRVW4_LWPMn1_MIAV0_MIWT8_9_MO40_NTn1_NTA0_NTB0_NTC0_NTD4_NTM0_NEPBS8_NLCA1_NLCB9_ONLL1_PGR2_PLR1_PKA1_SIA3_SS1_SU16_SUM1_SUS64_SPO0_SRVW0_SSO0_SVW8_SK0_SKXCCM0_TLDS0_ULSGRO0_USL1_UIOFGRO0_USFGROn1_VSn1_VWA8_VWB1_WSGRA0_WSGRB0_WS64_WG64_4_1_WGM8_WGMXCC8_WGMXCCGn1
    SolutionIndex: 64
    SolutionNameMin: Cijk_Ailk_Bjlk_BBS_BH_UserArgs_MT144x512x32_MI16x16x1_SN_LDSB0_AFC1_AFEM1_AFEM1_ASEM1_CLR1_CADS0_DTVA0_DTVB1_EPS0_FDSI1_GRPM1_GRVWA2_GRVWB8_GSUn1_GSUAMB_GSUC1_GSUWGMRR1_GLS0_ISA942_IU1_K1_LBSPPA1152_LBSPPB0_LBSPPM0_LPA16_LPB0_LPM0_LRVW4_LWPMn1_MIAV0_MIWT9_8_MO40_NTn1_NTA0_NTB0_NTC0_NTD4_NTM0_NEPBS9_NLCA9_NLCB1_ONLL1_PGR2_PLR1_PKA1_SIA3_SS1_SU16_SUM1_SUS64_SPO0_SRVW0_SSO0_SVW1_SK0_SKXCCM0_TLDS0_ULSGRO0_USL1_UIOFGRO0_USFGROn1_VSn1_VWA1_VWB8_WSGRA0_WSGRB0_WS64_WG16_16_1_WGM8_WGMXCC8_WGMXCCGn1
    SolutionIndex: 65
    SolutionNameMin: Cijk_Ailk_Bjlk_BBS_BH_UserArgs_MT512x112x32_MI16x16x1_SN_LDSB0_AFC1_AFEM1_AFEM1_ASEM1_CLR1_CADS0_DTVA1_DTVB0_EPS0_FDSI1_GRPM1_GRVWA8_GRVWB2_GSUn1_GSUAMB_GSUC1_GSUWGMRR1_GLS0_ISA942_IU1_K1_LBSPPA0_LBSPPB896_LBSPPM0_LPA0_LPB16_LPM0_LRVW4_LWPMn1_MIAV0_MIWT8_7_MO40_NTn1_NTA0_NTB0_NTC0_NTD4_NTM0_NEPBS8_NLCA1_NLCB7_ONLL1_PGR2_PLR1_PKA1_SIA3_SS1_SU16_SUM1_SUS64_SPO0_SRVW0_SSO0_SVW8_SK0_SKXCCM0_TLDS0_ULSGRO0_USL1_UIOFGRO0_USFGROn1_VSn1_VWA8_VWB1_WSGRA0_WSGRB0_WS64_WG64_4_1_WGM6_WGMXCC8_WGMXCCGn1
    SolutionIndex: 66
    SolutionNameMin: Cijk_Ailk_Bjlk_BBS_BH_UserArgs_MT512x112x32_MI16x16x1_SN_LDSB0_AFC1_AFEM1_AFEM1_ASEM1_CLR1_CADS0_DTVA1_DTVB0_EPS0_FDSI1_GRPM1_GRVWA8_GRVWB2_GSUn1_GSUAMB_GSUC1_GSUWGMRR1_GLS0_ISA942_IU1_K1_LBSPPA0_LBSPPB896_LBSPPM0_LPA0_LPB16_LPM0_LRVW4_LWPMn1_MIAV0_MIWT8_7_MO40_NTn1_NTA0_NTB0_NTC0_NTD4_NTM0_NEPBS8_NLCA1_NLCB7_ONLL1_PGR2_PLR1_PKA1_SIA3_SS1_SU16_SUM1_SUS64_SPO0_SRVW0_SSO0_SVW8_SK0_SKXCCM0_TLDS0_ULSGRO0_USL1_UIOFGRO0_USFGROn1_VSn1_VWA8_VWB1_WSGRA0_WSGRB0_WS64_WG64_4_1_WGM8_WGMXCC8_WGMXCCGn1
    SolutionIndex: 67
    SolutionNameMin: Cijk_Ailk_Bjlk_BBS_BH_UserArgs_MT128x512x32_MI16x16x1_SN_LDSB0_AFC1_AFEM1_AFEM1_ASEM1_CLR1_CADS0_DTVA0_DTVB1_EPS0_FDSI1_GRPM1_GRVWA8_GRVWB8_GSUn1_GSUAMB_GSUC1_GSUWGMRR1_GLS0_ISA942_IU1_K1_LBSPPA1024_LBSPPB0_LBSPPM0_LPA0_LPB0_LPM0_LRVW4_LWPMn1_MIAV0_MIWT8_8_MO40_NTn1_NTA0_NTB0_NTC0_NTD4_NTM0_NEPBS8_NLCA1_NLCB1_ONLL1_PGR2_PLR1_PKA1_SIA3_SS1_SU16_SUM1_SUS64_SPO0_SRVW0_SSO0_SVW8_SK0_SKXCCM0_TLDS0_ULSGRO0_USL1_UIOFGRO0_USFGROn1_VSn1_VWA8_VWB8_WSGRA0_WSGRB0_WS64_WG16_16_1_WGM8_WGMXCC8_WGMXCCGn1
    SolutionIndex: 68
    SolutionNameMin: Cijk_Ailk_Bjlk_BBS_BH_UserArgs_MT128x512x32_MI16x16x1_SN_LDSB0_AFC1_AFEM1_AFEM1_ASEM1_CLR1_CADS0_DTVA0_DTVB1_EPS0_FDSI1_GRPM1_GRVWA8_GRVWB8_GSUn1_GSUAMB_GSUC1_GSUWGMRR1_GLS0_ISA942_IU1_K1_LBSPPA1024_LBSPPB0_LBSPPM0_LPA0_LPB0_LPM0_LRVW4_LWPMn1_MIAV0_MIWT8_8_MO40_NTn1_NTA0_NTB0_NTC0_NTD4_NTM0_NEPBS8_NLCA1_NLCB1_ONLL1_PGR2_PLR1_PKA1_SIA3_SS1_SU16_SUM1_SUS64_SPO0_SRVW0_SSO0_SVW8_SK0_SKXCCM0_TLDS0_ULSGRO0_USL1_UIOFGRO0_USFGROn1_VSn1_VWA8_VWB8_WSGRA0_WSGRB0_WS64_WG16_16_1_WGM6_WGMXCC8_WGMXCCGn1
    SolutionIndex: 69
    SolutionNameMin: Cijk_Ailk_Bjlk_BBS_BH_UserArgs_MT160x512x32_MI16x16x1_SN_LDSB0_AFC1_AFEM1_AFEM1_ASEM1_CLR1_CADS0_DTVA0_DTVB1_EPS0_FDSI1_GRPM1_GRVWA4_GRVWB8_GSUn1_GSUAMB_GSUC1_GSUWGMRR1_GLS0_ISA942_IU1_K1_LBSPPA1280_LBSPPB0_LBSPPM0_LPA32_LPB0_LPM0_LRVW4_LWPMn1_MIAV0_MIWT10_8_MO40_NTn1_NTA0_NTB0_NTC0_NTD4_NTM0_NEPBS10_NLCA5_NLCB1_ONLL1_PGR2_PLR1_PKA1_SIA3_SS1_SU16_SUM1_SUS64_SPO0_SRVW0_SSO0_SVW2_SK0_SKXCCM0_TLDS0_ULSGRO0_USL1_UIOFGRO0_USFGROn1_VSn1_VWA2_VWB8_WSGRA0_WSGRB0_WS64_WG16_16_1_WGM8_WGMXCC8_WGMXCCGn1
    SolutionIndex: 70
    SolutionNameMin: Cijk_Ailk_Bjlk_BBS_BH_UserArgs_MT256x320x32_MI16x16x1_SN_LDSB1_AFC1_AFEM1_AFEM1_ASEM1_CLR1_CADS0_DTVA0_DTVB0_EPS0_FDSI1_GRPM1_GRVWA8_GRVWB8_GSUn1_GSUAMB_GSUC1_GSUWGMRR1_GLS0_ISA942_IU1_K1_LBSPPA2048_LBSPPB2560_LBSPPM0_LPA0_LPB32_LPM0_LRVW4_LWPMn1_MIAV0_MIWT8_10_MO40_NTn1_NTA0_NTB0_NTC0_NTD4_NTM0_NEPBS8_NLCA1_NLCB5_ONLL1_PGR2_PLR1_PKA1_SIA3_SS1_SU16_SUM1_SUS64_SPO0_SRVW0_SSO0_SVW8_SK0_SKXCCM0_TLDS0_ULSGRO0_USL1_UIOFGRO0_USFGROn1_VSn1_VWA8_VWB2_WSGRA0_WSGRB0_WS64_WG32_8_1_WGM6_WGMXCC8_WGMXCCGn1
    SolutionIndex: 71
    SolutionNameMin: Cijk_Ailk_Bjlk_BBS_BH_UserArgs_MT256x160x64_MI16x16x1_SN_LDSB0_AFC1_AFEM1_AFEM1_ASEM1_CLR1_CADS0_DTVA1_DTVB0_EPS0_FDSI1_GRPM1_GRVWA4_GRVWB8_GSUn1_GSUAMBSK_GSUC1_GSUWGMRR1_GLS0_ISA942_IU1_K1_LBSPPA0_LBSPPB1280_LBSPPM0_LPA0_LPB32_LPM0_LRVW4_LWPMn1_MIAV0_MIWT4_10_MO40_NTn1_NTA0_NTB0_NTC0_NTD4_NTM0_NEPBS8_NLCA1_NLCB5_ONLL1_PGR2_PLR1_PKA1_SIA3_SS1_SU16_SUM1_SUS128_SPO0_SRVW0_SSO0_SVW4_SK0_SKXCCM0_TLDS0_ULSGRO0_USL1_UIOFGRO0_USFGROn1_VSn1_VWA4_VWB2_WSGRA0_WSGRB0_WS64_WG64_4_1_WGM8_WGMXCC8_WGMXCCGn1
    SolutionIndex: 72
    SolutionNameMin: Cijk_Ailk_Bjlk_BBS_BH_UserArgs_MT512x96x64_MI16x16x1_SN_LDSB0_AFC1_AFEM1_AFEM1_ASEM1_CLR1_CADS0_DTVA1_DTVB0_EPS0_FDSI1_GRPM1_GRVWA8_GRVWB8_GSUn1_GSUAMBSK_GSUC1_GSUWGMRR1_GLS0_ISA942_IU1_K1_LBSPPA0_LBSPPB768_LBSPPM0_LPA0_LPB32_LPM0_LRVW4_LWPMn1_MIAV0_MIWT8_6_MO40_NTn1_NTA0_NTB0_NTC0_NTD4_NTM0_NEPBS8_NLCA1_NLCB3_ONLL1_PGR2_PLR1_PKA1_SIA3_SS1_SU16_SUM1_SUS128_SPO0_SRVW0_SSO0_SVW8_SK0_SKXCCM0_TLDS0_ULSGRO0_USL1_UIOFGRO0_USFGROn1_VSn1_VWA8_VWB2_WSGRA0_WSGRB0_WS64_WG64_4_1_WGM8_WGMXCC8_WGMXCCGn1
    SolutionIndex: 73
    SolutionNameMin: Cijk_Ailk_Bjlk_BBS_BH_UserArgs_MT16x32x128_MI16x16x1_SN_LDSB0_AFC1_AFEM1_AFEM1_ASEM1_CLR1_CADS0_DTVA0_DTVB0_EPS0_FDSI1_GRPM1_GRVWA2_GRVWB8_GSUn1_GSUAMBSK_GSUC1_GSUWGMRR1_GLS0_ISA942_IU1_K1_LBSPPA128_LBSPPB256_LBSPPM0_LPA16_LPB32_LPM0_LRVW4_LWPMn1_MIAV0_MIWT1_2_MO40_NTn1_NTA0_NTB0_NTC0_NTD4_NTM0_NEPBS8_NLCA1_NLCB1_ONLL1_PGR2_PLR1_PKA1_SIA3_SS1_SU16_SUM1_SUS256_SPO0_SRVW0_SSO0_SVW1_SK0_SKXCCM0_TLDS0_ULSGRO0_USL1_UIOFGRO0_USFGROn1_VSn1_VWA1_VWB2_WSGRA0_WSGRB0_WS64_WG16_4_4_WGM1_WGMXCC8_WGMXCCGn1
    SolutionIndex: 74
    SolutionNameMin: Cijk_Ailk_Bjlk_BBS_BH_UserArgs_MT128x128x64_MI16x16x1_SN_LDSB1_AFC1_AFEM1_AFEM1_ASEM1_CLR1_CADS0_DTVA0_DTVB0_EPS0_FDSI1_GRPM1_GRVWA8_GRVWB8_GSUn1_GSUAMBSK_GSUC1_GSUWGMRR1_GLS0_ISA942_IU1_K1_LBSPPA1024_LBSPPB1024_LBSPPM0_LPA0_LPB0_LPM0_LRVW4_LWPMn1_MIAV0_MIWT4_4_MO40_NTn1_NTA0_NTB0_NTC0_NTD4_NTM0_NEPBS8_NLCA1_NLCB1_ONLL1_PGR2_PLR1_PKA1_SIA3_SS1_SU16_SUM1_SUS128_SPO0_SRVW0_SSO0_SVW4_SK0_SKXCCM0_TLDS0_ULSGRO0_USL1_UIOFGRO0_USFGROn1_VSn1_VWA4_VWB4_WSGRA0_WSGRB0_WS64_WG32_8_1_WGM6_WGMXCC8_WGMXCCGn1
    SolutionIndex: 75
    SolutionNameMin: Cijk_Ailk_Bjlk_BBS_BH_UserArgs_MT64x64x128_MI16x16x1_SN_LDSB1_AFC1_AFEM1_AFEM1_ASEM1_CLR1_CADS0_DTVA0_DTVB0_EPS0_FDSI1_GRPM1_GRVWA8_GRVWB8_GSUn1_GSUAMBSK_GSUC1_GSUWGMRR1_GLS0_ISA942_IU1_K1_LBSPPA512_LBSPPB512_LBSPPM0_LPA0_LPB0_LPM0_LRVW4_LWPMn1_MIAV0_MIWT4_4_MO40_NTn1_NTA0_NTB0_NTC0_NTD4_NTM0_NEPBS8_NLCA1_NLCB1_ONLL1_PGR2_PLR1_PKA1_SIA3_SS1_SU16_SUM1_SUS256_SPO0_SRVW0_SSO0_SVW4_SK0_SKXCCM0_TLDS0_ULSGRO0_USL1_UIOFGRO0_USFGROn1_VSn1_VWA4_VWB4_WSGRA0_WSGRB0_WS64_WG16_4_4_WGM6_WGMXCC8_WGMXCCGn1
    SolutionIndex: 76
    SolutionNameMin: Cijk_Ailk_Bjlk_BBS_BH_UserArgs_MT64x32x64_MI16x16x1_SN_LDSB0_AFC1_AFEM1_AFEM1_ASEM1_CLR1_CADS0_DTVA0_DTVB0_EPS0_FDSI1_GRPM1_GRVWA8_GRVWB8_GSUn1_GSUAMBSK_GSUC1_GSUWGMRR1_GLS0_ISA942_IU1_K1_LBSPPA512_LBSPPB256_LBSPPM0_LPA0_LPB16_LPM0_LRVW4_LWPMn1_MIAV0_MIWT4_1_MO40_NTn1_NTA0_NTB0_NTC0_NTD4_NTM0_NEPBS8_NLCA1_NLCB1_ONLL1_PGR2_PLR1_PKA1_SIA3_SS1_SU16_SUM1_SUS128_SPO0_SRVW0_SSO0_SVW4_SK0_SKXCCM0_TLDS0_ULSGRO0_USL1_UIOFGRO0_USFGROn1_VSn1_VWA4_VWB1_WSGRA0_WSGRB0_WS64_WG16_8_2_WGM1_WGMXCC8_WGMXCCGn1
    SolutionIndex: 77
    SolutionNameMin: Cijk_Ailk_Bjlk_BBS_BH_UserArgs_MT16x256x32_MI16x16x1_SN_LDSB1_AFC0_AFEM2_AFEM8_ASEM32_CLR1_CADS0_DTVA0_DTVB0_EPS0_FDSI0_GRPM1_GRVWA2_GRVWB8_GSU8_GSUAMB_GSUC0_GSUWGMRR0_GLS0_ISA942_IU1_LBSPPA128_LBSPPB2048_LBSPPM0_LPA16_LPB16_LPM0_LRVW4_LWPM0p40_MIAV0_MIWT1_4_MO40_NTn1_NTA0_NTB0_NTC0_NTD1_NTM0_NEPBS0_NLCA1_NLCB1_ONLL1_PGR2_PLR1_PKA1_SIA3_SS1_SU0_SUM1_SUS0_SPO0_SRVW0_SSO0_SVW1_SK0_SKXCCM0_TLDS0_ULSGRO0_USL1_UIOFGRO0_USFGROn1_VSn1_VWA1_VWB4_WSGRA2_WSGRB1_WS64_WG16_16_1_WGM1_WGMXCC1_WGMXCCGn1
- - - [2304, 576, 1, 32]
    - [0, 9475.11]
  - - [512, 1024, 1, 16]
    - [0, 1954.69]
  - - [1024, 1024, 1, 16]
    - [0, 3746.94]
  - - [576, 2304, 1, 528]
    - [1, 129853.0]
  - - [576, 576, 1, 32]
    - [2, 2398.78]
  - - [96, 96, 32, 96]
    - [2, 6680.36]
  - - [576, 1728, 1, 528]
    - [3, 111265.0]
  - - [5120, 2048, 1, 5905]
    - [4, 532900.0]
  - - [5120, 1024, 1, 5905]
    - [5, 420844.0]
  - - [198, 20, 1, 1511680]
    - [6, 67891.1]
  - - [1024, 256, 1, 5905]
    - [7, 140333.0]
  - - [1024, 256, 1, 796032]
    - [8, 452453.0]
  - - [202, 20, 1, 1511680]
    - [9, 67863.1]
  - - [512, 1024, 1, 5905]
    - [10, 200235.0]
  - - [20, 256, 5905, 202]
    - [11, 61193.5]
  - - [1024, 11715, 1, 5905]
    - [12, 535380.0]
  - - [1475, 2048, 1, 5905]
    - [13, 329676.0]
  - - [256, 256, 1, 1024]
    - [14, 17626.4]
  - - [512, 512, 1, 5905]
    - [15, 140941.0]
  - - [20, 256, 5905, 222]
    - [16, 63913.9]
  - - [11715, 1024, 1, 5905]
    - [17, 522871.0]
  - - [1475, 1024, 1, 5905]
    - [18, 273217.0]
  - - [1024, 222, 1, 5905]
    - [19, 120503.0]
  - - [1475, 512, 1, 5905]
    - [20, 212683.0]
  - - [4096, 5120, 1, 5905]
    - [21, 617376.0]
  - - [1024, 1475, 1, 5905]
    - [22, 294522.0]
  - - [512, 5905, 1, 8]
    - [0, 6184.64]
  - - [512, 256, 1, 795008]
    - [23, 426991.0]
  - - [128, 1475, 1, 5905]
    - [24, 111264.0]
  - - [1024, 202, 1, 5905]
    - [25, 115628.0]
  - - [1475, 128, 1, 5905]
    - [26, 113086.0]
  - - [256, 512, 1, 5905]
    - [27, 96439.1]
  - - [512, 256, 1, 5905]
    - [28, 92567.8]
  - - [222, 20, 1, 1511680]
    - [29, 69121.0]
  - - [8192, 3072, 1, 1875]
    - [30, 529566.0]
  - - [3072, 9216, 1, 1875]
    - [31, 543287.0]
  - - [3072, 32064, 1, 1875]
    - [32, 604357.0]
  - - [3072, 16384, 1, 1875]
    - [33, 549767.0]
  - - [4096, 3072, 1, 757]
    - [34, 419142.0]
  - - [4096, 1024, 1, 2885]
    - [35, 423745.0]
  - - [3072, 3072, 1, 757]
    - [36, 395189.0]
  - - [3072, 3072, 1, 1875]
    - [37, 488802.0]
  - - [1024, 4096, 1, 2885]
    - [35, 424381.0]
  - - [512, 256, 1, 180727]
    - [38, 333096.0]
  - - [2, 3584, 1, 8192]
    - [39, 5181.9]
  - - [2, 7168, 1, 8192]
    - [77, 6475.66]
  - - [6144, 1024, 1, 5905]
    - [40, 463765.0]
  - - [64, 256, 1, 5905]
    - [41, 20040.0]
  - - [256, 256, 1, 795008]
    - [42, 356251.0]
  - - [128, 256, 1, 5905]
    - [43, 35833.5]
  - - [4040, 2048, 1, 5905]
    - [44, 498692.0]
  - - [256, 768, 1, 796032]
    - [45, 428492.0]
  - - [192, 256, 1, 795008]
    - [46, 311135.0]
  - - [4440, 2048, 1, 5905]
    - [47, 511310.0]
  - - [32000, 8192, 1, 106496]
    - [48, 639343.0]
  - - [8192, 32000, 1, 106496]
    - [49, 623172.0]
  - - [8192, 32000, 1, 57344]
    - [48, 622901.0]
  - - [4096, 32000, 1, 49152]
    - [50, 629567.0]
  - - [1600, 50304, 1, 51200]
    - [51, 571295.0]
  - - [1024, 1024, 1, 2885]
    - [52, 194810.0]
  - - [256, 384, 1, 181557]
    - [53, 299937.0]
  - - [256, 256, 1, 331051]
    - [54, 294860.0]
  - - [1536, 512, 1, 331051]
    - [55, 537017.0]
  - - [1536, 256, 1, 331051]
    - [56, 440539.0]
  - - [640, 512, 1, 181557]
    - [54, 430238.0]
  - - [256, 256, 1, 401179]
    - [57, 309953.0]
  - - [512, 256, 1, 365802]
    - [58, 375755.0]
  - - [512, 256, 1, 401179]
    - [59, 376893.0]
  - - [256, 256, 1, 395225]
    - [57, 308880.0]
  - - [512, 256, 1, 395225]
    - [60, 375682.0]
  - - [512, 256, 1, 331051]
    - [59, 364454.0]
  - - [256, 256, 1, 365802]
    - [59, 303747.0]
  - - [256, 384, 1, 180727]
    - [61, 298587.0]
  - - [6514, 641, 1, 393216]
    - [62, 528477.0]
  - - [32000, 8192, 1, 57344]
    - [48, 635472.0]
  - - [1024, 8192, 1, 57344]
    - [50, 598541.0]
  - - [8192, 8192, 1, 57344]
    - [63, 648963.0]
  - - [32000, 4096, 1, 49152]
    - [64, 643164.0]
  - - [11008, 4096, 1, 49152]
    - [48, 641530.0]
  - - [8192, 8192, 1, 32768]
    - [63, 652977.0]
  - - [4096, 4096, 1, 2048]
    - [65, 574309.0]
  - - [4096, 32000, 1, 2048]
    - [63, 595805.0]
  - - [4096, 22016, 1, 2048]
    - [49, 594928.0]
  - - [4096, 12288, 1, 2048]
    - [66, 580268.0]
  - - [32000, 8192, 1, 32768]
    - [48, 630399.0]
  - - [32000, 4096, 1, 65536]
    - [67, 636013.0]
  - - [28672, 8192, 1, 32768]
    - [68, 641730.0]
  - - [11008, 4096, 1, 65536]
    - [69, 647973.0]
  - - [11008, 4096, 1, 2048]
    - [70, 586156.0]
  - - [1024, 8192, 1, 32768]
    - [50, 584457.0]
  - - [8192, 1280, 1, 8192]
    - [71, 548756.0]
  - - [8192, 3584, 1, 8192]
    - [72, 622072.0]
  - - [8192, 7168, 1, 8192]
    - [68, 672491.0]
  - - [2, 1280, 1, 8192]
    - [73, 2979.71]
  - - [8192, 8192, 1, 8192]
    - [63, 658378.0]
  - - [4096, 4096, 1, 4096]
    - [66, 606759.0]
  - - [2048, 2048, 1, 2048]
    - [74, 405415.0]
  - - [1024, 1024, 1, 1024]
    - [75, 153489.0]
  - - [512, 512, 1, 512]
    - [76, 28147.4]
- null
- null
- DeviceEfficiency
- Equality
