projects/hipblaslt/library/src/amd_detail/rocblaslt/src/Tensile/Logic/asm_full/aquavanjaram/gfx942/Equality/aquavanjaram_Cijk_Ailk_Bjlk_HHS_BH_UserArgs.yaml
- {MinimumRequiredVersion: 5.0.0}
- aquavanjaram
- gfx942
- [Device 0049, Device 0050]
    SolutionIndex: 0
    SolutionNameMin: Cijk_Ailk_Bjlk_HHS_BH_UserArgs_MT128x128x128_MI16x16x1_SN_LDSB1_AFC1_AFEM1_AFEM1_ASEM1_CLR1_CADS0_DTLA0_DTLB0_DTVA0_DTVB0_EPS0_FDSI1_GRPM1_GRVWA8_GRVWB8_GSUn1_GSUAMBSK_GSUC1_GSUWGMRR1_GLS0_ISA942_IU1_K1_LBSPPA1024_LBSPPB1024_LBSPPM0_LPA0_LPB0_LPM0_LRVW4_LWPMn1_MIAV0_MIWT8_8_MO40_NTn1_NTA0_NTB0_NTC0_NTD4_NTM0_NEPBS8_NLCA1_NLCB1_ONLL1_PGR2_PLR1_PKA1_SIA3_SS1_SU16_SUM1_SUS256_SPO0_SRVW0_SSO0_SVW8_SK0_SKXCCM0_TLDS0_ULSGRO0_USL1_UIOFGRO0_USFGROn1_VSn1_VWA8_VWB8_WSGRA0_WSGRB0_WS64_WG16_4_4_WGM1_WGMXCC8_WGMXCCGn1
    SolutionIndex: 1
    SolutionNameMin: Cijk_Ailk_Bjlk_HHS_BH_UserArgs_MT512x112x32_MI16x16x1_SN_LDSB0_AFC1_AFEM1_AFEM1_ASEM1_CLR1_CADS0_DTLA0_DTLB0_DTVA1_DTVB0_EPS0_FDSI1_GRPM1_GRVWA8_GRVWB2_GSUn1_GSUAMB_GSUC1_GSUWGMRR1_GLS0_ISA942_IU1_K1_LBSPPA0_LBSPPB896_LBSPPM0_LPA0_LPB16_LPM0_LRVW4_LWPMn1_MIAV0_MIWT8_7_MO40_NTn1_NTA0_NTB0_NTC0_NTD4_NTM0_NEPBS8_NLCA1_NLCB7_ONLL1_PGR2_PLR1_PKA1_SIA3_SS1_SU16_SUM1_SUS64_SPO0_SRVW0_SSO0_SVW8_SK0_SKXCCM0_TLDS0_ULSGRO0_USL1_UIOFGRO0_USFGROn1_VSn1_VWA8_VWB1_WSGRA0_WSGRB0_WS64_WG64_4_1_WGM1_WGMXCC8_WGMXCCGn1
    SolutionIndex: 2
    SolutionNameMin: Cijk_Ailk_Bjlk_HHS_BH_UserArgs_MT128x96x64_MI16x16x1_SN_LDSB1_AFC1_AFEM1_AFEM1_ASEM1_CLR1_CADS0_DTLA0_DTLB0_DTVA0_DTVB0_EPS0_FDSI1_GRPM1_GRVWA8_GRVWB8_GSUn1_GSUAMBSK_GSUC1_GSUWGMRR1_GLS0_ISA942_IU1_K1_LBSPPA1024_LBSPPB768_LBSPPM0_LPA0_LPB32_LPM0_LRVW4_LWPMn1_MIAV0_MIWT4_6_MO40_NTn1_NTA0_NTB0_NTC0_NTD4_NTM0_NEPBS8_NLCA1_NLCB3_ONLL1_PGR2_PLR1_PKA1_SIA3_SS1_SU16_SUM1_SUS128_SPO0_SRVW0_SSO0_SVW4_SK0_SKXCCM0_TLDS0_ULSGRO0_USL1_UIOFGRO0_USFGROn1_VSn1_VWA4_VWB2_WSGRA0_WSGRB0_WS64_WG32_4_2_WGM6_WGMXCC8_WGMXCCGn1
    SolutionIndex: 3
    SolutionNameMin: Cijk_Ailk_Bjlk_HHS_BH_UserArgs_MT128x128x128_MI16x16x1_SN_LDSB1_AFC1_AFEM1_AFEM1_ASEM1_CLR1_CADS0_DTLA0_DTLB0_DTVA0_DTVB0_EPS0_FDSI1_GRPM1_GRVWA8_GRVWB8_GSUn1_GSUAMBSK_GSUC1_GSUWGMRR1_GLS0_ISA942_IU1_K1_LBSPPA1024_LBSPPB1024_LBSPPM0_LPA0_LPB0_LPM0_LRVW4_LWPMn1_MIAV0_MIWT8_8_MO40_NTn1_NTA0_NTB0_NTC0_NTD4_NTM0_NEPBS8_NLCA1_NLCB1_ONLL1_PGR2_PLR1_PKA1_SIA3_SS1_SU16_SUM1_SUS256_SPO0_SRVW0_SSO0_SVW8_SK0_SKXCCM0_TLDS0_ULSGRO1_USL1_UIOFGRO0_USFGROn1_VSn1_VWA8_VWB8_WSGRA0_WSGRB0_WS64_WG16_4_4_WGM8_WGMXCC8_WGMXCCGn1
    SolutionIndex: 4
    SolutionNameMin: Cijk_Ailk_Bjlk_HHS_BH_UserArgs_MT64x32x64_MI16x16x1_SN_LDSB0_AFC1_AFEM1_AFEM1_ASEM1_CLR1_CADS0_DTLA0_DTLB0_DTVA0_DTVB0_EPS0_FDSI1_GRPM1_GRVWA8_GRVWB8_GSUn1_GSUAMBSK_GSUC1_GSUWGMRR1_GLS0_ISA942_IU1_K1_LBSPPA512_LBSPPB256_LBSPPM0_LPA0_LPB16_LPM0_LRVW4_LWPMn1_MIAV0_MIWT4_1_MO40_NTn1_NTA0_NTB0_NTC0_NTD4_NTM0_NEPBS8_NLCA1_NLCB1_ONLL1_PGR2_PLR1_PKA1_SIA3_SS1_SU16_SUM1_SUS128_SPO0_SRVW0_SSO0_SVW4_SK0_SKXCCM0_TLDS0_ULSGRO1_USL1_UIOFGRO0_USFGROn1_VSn1_VWA4_VWB1_WSGRA0_WSGRB0_WS64_WG16_8_2_WGM1_WGMXCC8_WGMXCCGn1
    SolutionIndex: 5
    SolutionNameMin: Cijk_Ailk_Bjlk_HHS_BH_UserArgs_MT64x192x32_MI16x16x1_SN_LDSB1_AFC1_AFEM1_AFEM1_ASEM1_CLR1_CADS0_DTLA0_DTLB0_DTVA0_DTVB0_EPS0_FDSI1_GRPM1_GRVWA8_GRVWB8_GSUn1_GSUAMB_GSUC1_GSUWGMRR1_GLS0_ISA942_IU1_K1_LBSPPA512_LBSPPB1536_LBSPPM0_LPA0_LPB16_LPM0_LRVW4_LWPMn1_MIAV0_MIWT4_3_MO40_NTn1_NTA0_NTB0_NTC0_NTD4_NTM0_NEPBS8_NLCA1_NLCB3_ONLL1_PGR2_PLR1_PKA1_SIA3_SS1_SU16_SUM1_SUS64_SPO0_SRVW0_SSO0_SVW4_SK0_SKXCCM0_TLDS0_ULSGRO0_USL1_UIOFGRO0_USFGROn1_VSn1_VWA4_VWB1_WSGRA0_WSGRB0_WS64_WG16_16_1_WGM1_WGMXCC8_WGMXCCGn1
    SolutionIndex: 6
    SolutionNameMin: Cijk_Ailk_Bjlk_HHS_BH_UserArgs_MT64x64x64_MI16x16x1_SN_LDSB1_AFC1_AFEM1_AFEM1_ASEM1_CLR1_CADS0_DTLA0_DTLB0_DTVA0_DTVB0_EPS0_FDSI1_GRPM1_GRVWA8_GRVWB8_GSUn1_GSUAMBSK_GSUC1_GSUWGMRR1_GLS0_ISA942_IU1_K1_LBSPPA512_LBSPPB512_LBSPPM0_LPA32_LPB32_LPM0_LRVW4_LWPMn1_MIAV0_MIWT2_2_MO40_NTn1_NTA0_NTB0_NTC0_NTD4_NTM0_NEPBS8_NLCA1_NLCB1_ONLL1_PGR2_PLR1_PKA1_SIA3_SS1_SU16_SUM1_SUS128_SPO0_SRVW0_SSO0_SVW2_SK0_SKXCCM0_TLDS0_ULSGRO1_USL1_UIOFGRO0_USFGROn1_VSn1_VWA2_VWB2_WSGRA0_WSGRB0_WS64_WG32_8_1_WGM1_WGMXCC8_WGMXCCGn1
    SolutionIndex: 7
    SolutionNameMin: Cijk_Ailk_Bjlk_HHS_BH_UserArgs_MT160x512x32_MI16x16x1_SN_LDSB0_AFC1_AFEM1_AFEM1_ASEM1_CLR1_CADS0_DTLA0_DTLB0_DTVA0_DTVB1_EPS0_FDSI1_GRPM1_GRVWA4_GRVWB8_GSUn1_GSUAMB_GSUC1_GSUWGMRR1_GLS0_ISA942_IU1_K1_LBSPPA1280_LBSPPB0_LBSPPM0_LPA32_LPB0_LPM0_LRVW4_LWPMn1_MIAV0_MIWT10_8_MO40_NTn1_NTA0_NTB0_NTC0_NTD4_NTM0_NEPBS10_NLCA5_NLCB1_ONLL1_PGR2_PLR1_PKA1_SIA3_SS1_SU16_SUM1_SUS64_SPO0_SRVW0_SSO0_SVW2_SK0_SKXCCM0_TLDS0_ULSGRO0_USL1_UIOFGRO0_USFGROn1_VSn1_VWA2_VWB8_WSGRA0_WSGRB0_WS64_WG16_16_1_WGM8_WGMXCC8_WGMXCCGn1
    SolutionIndex: 8
    SolutionNameMin: Cijk_Ailk_Bjlk_HHS_BH_UserArgs_MT128x512x32_MI16x16x1_SN_LDSB0_AFC1_AFEM1_AFEM1_ASEM1_CLR1_CADS0_DTLA0_DTLB0_DTVA0_DTVB1_EPS0_FDSI1_GRPM1_GRVWA8_GRVWB8_GSUn1_GSUAMB_GSUC1_GSUWGMRR1_GLS0_ISA942_IU1_K1_LBSPPA1024_LBSPPB0_LBSPPM0_LPA0_LPB0_LPM0_LRVW4_LWPMn1_MIAV0_MIWT8_8_MO40_NTn1_NTA0_NTB0_NTC0_NTD4_NTM0_NEPBS8_NLCA1_NLCB1_ONLL1_PGR2_PLR1_PKA1_SIA3_SS1_SU16_SUM1_SUS64_SPO0_SRVW0_SSO0_SVW8_SK0_SKXCCM0_TLDS0_ULSGRO0_USL1_UIOFGRO0_USFGROn1_VSn1_VWA8_VWB8_WSGRA0_WSGRB0_WS64_WG16_16_1_WGM6_WGMXCC8_WGMXCCGn1
    SolutionIndex: 9
    SolutionNameMin: Cijk_Ailk_Bjlk_HHS_BH_UserArgs_MT512x144x32_MI16x16x1_SN_LDSB0_AFC1_AFEM1_AFEM1_ASEM1_CLR1_CADS0_DTLA0_DTLB0_DTVA1_DTVB0_EPS0_FDSI1_GRPM1_GRVWA8_GRVWB2_GSUn1_GSUAMB_GSUC1_GSUWGMRR1_GLS0_ISA942_IU1_K1_LBSPPA0_LBSPPB1152_LBSPPM0_LPA0_LPB16_LPM0_LRVW4_LWPMn1_MIAV0_MIWT8_9_MO40_NTn1_NTA0_NTB0_NTC0_NTD4_NTM0_NEPBS8_NLCA1_NLCB9_ONLL1_PGR2_PLR1_PKA1_SIA3_SS1_SU16_SUM1_SUS64_SPO0_SRVW0_SSO0_SVW8_SK0_SKXCCM0_TLDS0_ULSGRO0_USL1_UIOFGRO0_USFGROn1_VSn1_VWA8_VWB1_WSGRA0_WSGRB0_WS64_WG64_4_1_WGM8_WGMXCC8_WGMXCCGn1
    SolutionIndex: 10
    SolutionNameMin: Cijk_Ailk_Bjlk_HHS_BH_UserArgs_MT144x512x32_MI16x16x1_SN_LDSB0_AFC1_AFEM1_AFEM1_ASEM1_CLR1_CADS0_DTLA0_DTLB0_DTVA0_DTVB1_EPS0_FDSI1_GRPM1_GRVWA2_GRVWB8_GSUn1_GSUAMB_GSUC1_GSUWGMRR1_GLS0_ISA942_IU1_K1_LBSPPA1152_LBSPPB0_LBSPPM0_LPA16_LPB0_LPM0_LRVW4_LWPMn1_MIAV0_MIWT9_8_MO40_NTn1_NTA0_NTB0_NTC0_NTD4_NTM0_NEPBS9_NLCA9_NLCB1_ONLL1_PGR2_PLR1_PKA1_SIA3_SS1_SU16_SUM1_SUS64_SPO0_SRVW0_SSO0_SVW1_SK0_SKXCCM0_TLDS0_ULSGRO0_USL1_UIOFGRO0_USFGROn1_VSn1_VWA1_VWB8_WSGRA0_WSGRB0_WS64_WG16_16_1_WGM8_WGMXCC8_WGMXCCGn1
    SolutionIndex: 11
    SolutionNameMin: Cijk_Ailk_Bjlk_HHS_BH_UserArgs_MT160x512x32_MI16x16x1_SN_LDSB0_AFC1_AFEM1_AFEM1_ASEM1_CLR1_CADS0_DTLA0_DTLB0_DTVA0_DTVB1_EPS0_FDSI1_GRPM1_GRVWA4_GRVWB8_GSUn1_GSUAMB_GSUC1_GSUWGMRR1_GLS0_ISA942_IU1_K1_LBSPPA1280_LBSPPB0_LBSPPM0_LPA32_LPB0_LPM0_LRVW4_LWPMn1_MIAV0_MIWT10_8_MO40_NTn1_NTA0_NTB0_NTC0_NTD4_NTM0_NEPBS10_NLCA5_NLCB1_ONLL1_PGR2_PLR1_PKA1_SIA3_SS1_SU16_SUM1_SUS64_SPO0_SRVW0_SSO0_SVW2_SK0_SKXCCM0_TLDS0_ULSGRO0_USL1_UIOFGRO0_USFGROn1_VSn1_VWA2_VWB8_WSGRA0_WSGRB0_WS64_WG16_16_1_WGM6_WGMXCC8_WGMXCCGn1
    SolutionIndex: 12
    SolutionNameMin: Cijk_Ailk_Bjlk_HHS_BH_UserArgs_MT512x112x32_MI16x16x1_SN_LDSB0_AFC1_AFEM1_AFEM1_ASEM1_CLR1_CADS0_DTLA0_DTLB0_DTVA1_DTVB0_EPS0_FDSI1_GRPM1_GRVWA8_GRVWB2_GSUn1_GSUAMB_GSUC1_GSUWGMRR1_GLS0_ISA942_IU1_K1_LBSPPA0_LBSPPB896_LBSPPM0_LPA0_LPB16_LPM0_LRVW4_LWPMn1_MIAV0_MIWT8_7_MO40_NTn1_NTA0_NTB0_NTC0_NTD4_NTM0_NEPBS8_NLCA1_NLCB7_ONLL1_PGR2_PLR1_PKA1_SIA3_SS1_SU16_SUM1_SUS64_SPO0_SRVW0_SSO0_SVW8_SK0_SKXCCM0_TLDS0_ULSGRO0_USL1_UIOFGRO0_USFGROn1_VSn1_VWA8_VWB1_WSGRA0_WSGRB0_WS64_WG64_4_1_WGM8_WGMXCC8_WGMXCCGn1
    SolutionIndex: 13
    SolutionNameMin: Cijk_Ailk_Bjlk_HHS_BH_UserArgs_MT256x320x32_MI16x16x1_SN_LDSB1_AFC1_AFEM1_AFEM1_ASEM1_CLR1_CADS0_DTLA0_DTLB0_DTVA0_DTVB0_EPS0_FDSI1_GRPM1_GRVWA8_GRVWB8_GSUn1_GSUAMB_GSUC1_GSUWGMRR1_GLS0_ISA942_IU1_K1_LBSPPA2048_LBSPPB2560_LBSPPM0_LPA0_LPB32_LPM0_LRVW4_LWPMn1_MIAV0_MIWT8_10_MO40_NTn1_NTA0_NTB0_NTC0_NTD4_NTM0_NEPBS8_NLCA1_NLCB5_ONLL1_PGR2_PLR1_PKA1_SIA3_SS1_SU16_SUM1_SUS64_SPO0_SRVW0_SSO0_SVW8_SK0_SKXCCM0_TLDS0_ULSGRO1_USL1_UIOFGRO0_USFGROn1_VSn1_VWA8_VWB2_WSGRA0_WSGRB0_WS64_WG32_8_1_WGM8_WGMXCC8_WGMXCCGn1
    SolutionIndex: 14
    SolutionNameMin: Cijk_Ailk_Bjlk_HHS_BH_UserArgs_MT128x512x32_MI16x16x1_SN_LDSB0_AFC1_AFEM1_AFEM1_ASEM1_CLR1_CADS0_DTLA0_DTLB0_DTVA0_DTVB1_EPS0_FDSI1_GRPM1_GRVWA8_GRVWB8_GSUn1_GSUAMB_GSUC1_GSUWGMRR1_GLS0_ISA942_IU1_K1_LBSPPA1024_LBSPPB0_LBSPPM0_LPA0_LPB0_LPM0_LRVW4_LWPMn1_MIAV0_MIWT8_8_MO40_NTn1_NTA0_NTB0_NTC0_NTD4_NTM0_NEPBS8_NLCA1_NLCB1_ONLL1_PGR2_PLR1_PKA1_SIA3_SS1_SU16_SUM1_SUS64_SPO0_SRVW0_SSO0_SVW8_SK0_SKXCCM0_TLDS0_ULSGRO0_USL1_UIOFGRO0_USFGROn1_VSn1_VWA8_VWB8_WSGRA0_WSGRB0_WS64_WG16_16_1_WGM1_WGMXCC8_WGMXCCGn1
    SolutionIndex: 15
    SolutionNameMin: Cijk_Ailk_Bjlk_HHS_BH_UserArgs_MT512x128x32_MI16x16x1_SN_LDSB0_AFC1_AFEM1_AFEM1_ASEM1_CLR1_CADS0_DTLA0_DTLB0_DTVA1_DTVB0_EPS0_FDSI1_GRPM1_GRVWA8_GRVWB8_GSUn1_GSUAMB_GSUC1_GSUWGMRR1_GLS0_ISA942_IU1_K1_LBSPPA0_LBSPPB1024_LBSPPM0_LPA0_LPB0_LPM0_LRVW4_LWPMn1_MIAV0_MIWT8_8_MO40_NTn1_NTA0_NTB0_NTC0_NTD4_NTM0_NEPBS8_NLCA1_NLCB1_ONLL1_PGR2_PLR1_PKA1_SIA3_SS1_SU16_SUM1_SUS64_SPO0_SRVW0_SSO0_SVW8_SK0_SKXCCM0_TLDS0_ULSGRO0_USL1_UIOFGRO0_USFGROn1_VSn1_VWA8_VWB8_WSGRA0_WSGRB0_WS64_WG64_4_1_WGM6_WGMXCC8_WGMXCCGn1
    SolutionIndex: 16
    SolutionNameMin: Cijk_Ailk_Bjlk_HHS_BH_UserArgs_MT128x128x64_MI16x16x1_SN_LDSB0_AFC1_AFEM1_AFEM1_ASEM1_CLR1_CADS0_DTLA0_DTLB0_DTVA0_DTVB1_EPS0_FDSI1_GRPM1_GRVWA8_GRVWB2_GSUn1_GSUAMBSK_GSUC1_GSUWGMRR1_GLS0_ISA942_IU1_K1_LBSPPA1024_LBSPPB0_LBSPPM0_LPA0_LPB0_LPM0_LRVW4_LWPMn1_MIAV0_MIWT8_2_MO40_NTn1_NTA0_NTB0_NTC0_NTD4_NTM0_NEPBS8_NLCA1_NLCB1_ONLL1_PGR2_PLR1_PKA1_SIA3_SS1_SU16_SUM1_SUS128_SPO0_SRVW0_SSO0_SVW8_SK0_SKXCCM0_TLDS0_ULSGRO0_USL1_UIOFGRO0_USFGROn1_VSn1_VWA8_VWB2_WSGRA0_WSGRB0_WS64_WG16_16_1_WGM6_WGMXCC8_WGMXCCGn1
    SolutionIndex: 17
    SolutionNameMin: Cijk_Ailk_Bjlk_HHS_BH_UserArgs_MT64x64x128_MI16x16x1_SN_LDSB1_AFC1_AFEM1_AFEM1_ASEM1_CLR1_CADS0_DTLA0_DTLB0_DTVA0_DTVB0_EPS0_FDSI1_GRPM1_GRVWA8_GRVWB8_GSUn1_GSUAMBSK_GSUC1_GSUWGMRR1_GLS0_ISA942_IU1_K1_LBSPPA512_LBSPPB512_LBSPPM0_LPA0_LPB0_LPM0_LRVW4_LWPMn1_MIAV0_MIWT4_4_MO40_NTn1_NTA0_NTB0_NTC0_NTD4_NTM0_NEPBS8_NLCA1_NLCB1_ONLL1_PGR2_PLR1_PKA1_SIA3_SS1_SU16_SUM1_SUS256_SPO0_SRVW0_SSO0_SVW4_SK0_SKXCCM0_TLDS0_ULSGRO0_USL1_UIOFGRO0_USFGROn1_VSn1_VWA4_VWB4_WSGRA0_WSGRB0_WS64_WG16_4_4_WGM6_WGMXCC8_WGMXCCGn1
    SolutionIndex: 18
    SolutionNameMin: Cijk_Ailk_Bjlk_HHS_BH_UserArgs_MT256x80x32_MI16x16x1_SN_LDSB1_AFC0_AFEM1_AFEM1_ASEM1_CLR1_CADS0_DTLA0_DTLB0_DTVA0_DTVB0_EPS0_FDSI0_GRPM1_GRVWA8_GRVWB2_GSUn1_GSUAMBSK_GSUC1_GSUWGMRR1_GLS0_ISA942_IU1_K1_LBSPPA2048_LBSPPB640_LBSPPM0_LPA0_LPB16_LPM0_LRVW4_LWPMn1_MIAV0_MIWT4_5_MO40_NTn1_NTA0_NTB0_NTC0_NTD4_NTM0_NEPBS8_NLCA1_NLCB5_ONLL1_PGR2_PLR1_PKA1_SIA3_SS1_SU0_SUM1_SUS0_SPO0_SRVW0_SSO0_SVW4_SK0_SKXCCM0_TLDS0_ULSGRO0_USL1_UIOFGRO0_USFGROn1_VSn1_VWA4_VWB1_WSGRA0_WSGRB0_WS64_WG64_4_1_WGM8_WGMXCC8_WGMXCCGn1
- - - [1024, 1024, 1, 24576]
    - [0, 391752.0]
  - - [1024, 30528, 1, 24576]
    - [1, 588374.0]
  - - [1024, 1024, 1, 8192]
    - [2, 274122.0]
  - - [1024, 4096, 1, 8192]
    - [0, 474869.0]
  - - [1024, 30000, 1, 8192]
    - [1, 573081.0]
  - - [4096, 1024, 1, 8192]
    - [3, 474014.0]
  - - [768, 768, 1, 512]
    - [4, 75461.9]
  - - [64, 178, 5604, 178]
    - [5, 111772.0]
  - - [64, 178, 6144, 178]
    - [5, 112133.0]
  - - [178, 64, 5604, 178]
    - [6, 80759.7]
  - - [178, 64, 6144, 178]
    - [6, 80930.0]
  - - [32000, 8192, 1, 57344]
    - [7, 625165.0]
  - - [1024, 8192, 1, 57344]
    - [8, 592015.0]
  - - [8192, 8192, 1, 57344]
    - [9, 641152.0]
  - - [28672, 8192, 1, 57344]
    - [8, 647616.0]
  - - [32000, 4096, 1, 49152]
    - [10, 634826.0]
  - - [11008, 4096, 1, 49152]
    - [11, 633537.0]
  - - [8192, 8192, 1, 32768]
    - [9, 646734.0]
  - - [4096, 4096, 1, 2048]
    - [12, 572556.0]
  - - [4096, 32000, 1, 2048]
    - [9, 592449.0]
  - - [4096, 12288, 1, 2048]
    - [12, 580241.0]
  - - [32000, 8192, 1, 32768]
    - [7, 627910.0]
  - - [32000, 4096, 1, 65536]
    - [10, 634409.0]
  - - [11008, 4096, 1, 65536]
    - [7, 641796.0]
  - - [11008, 4096, 1, 2048]
    - [13, 583303.0]
  - - [1024, 8192, 1, 32768]
    - [14, 585807.0]
  - - [8192, 8192, 1, 8192]
    - [9, 655973.0]
  - - [4096, 4096, 1, 8192]
    - [15, 612329.0]
  - - [4096, 4096, 1, 4096]
    - [8, 597836.0]
  - - [2048, 2048, 1, 2048]
    - [16, 408101.0]
  - - [1024, 1024, 1, 1024]
    - [17, 157193.0]
  - - [512, 512, 1, 512]
    - [4, 27801.3]
  - - [4096, 77, 16, 40]
    - [18, 22.19]
- null
- null
- DeviceEfficiency
- Equality
