projects/hipblaslt/library/src/amd_detail/rocblaslt/src/Tensile/Logic/asm_full/aquavanjaram/gfx942/Equality/aquavanjaram_Cijk_Ailk_Bljk_BBS_BH_UserArgs.yaml
- {MinimumRequiredVersion: 4.33.0}
- aquavanjaram
- gfx942
- [Device 0049, Device 0050]
    SolutionIndex: 0
    SolutionNameMin: Cijk_Ailk_Bljk_BBS_BH_MT128x128x64_MI32x32x1_SN_LDSB1_GRVWB8_GSU1_LBSPPA0_LBSPPB128_LPA0_LPB8_LRVW8_MIWT2_2_SVW2_VWA2_WG64_4_1
    SolutionIndex: 1
    SolutionNameMin: Cijk_Ailk_Bljk_BBS_BH_MT128x32x64_MI16x16x1_SN_LDSB1_GRVWB8_GSU1_LBSPPA2048_LBSPPB128_LPA16_LPB16_LRVW8_MIWT2_2_SVW2_VWA2_WG64_4_1
    SolutionIndex: 2
    SolutionNameMin: Cijk_Ailk_Bljk_BBS_BH_MT256x224x64_MI16x16x1_SN_LDSB1_GRVWB4_GSU1_LBSPPA2048_LBSPPB128_LPA16_LPB4_LRVW4_MIWT4_14_SVW4_VWA4_WG64_4_1
    SolutionIndex: 3
    SolutionNameMin: Cijk_Ailk_Bljk_BBS_BH_MT16x256x64_MI16x16x1_SN_LDSB1_GSU8_LWPM0p30_MIWT1_4_NTB0_SU4_SUM2_SUS256_SPO0_WG16_16_1
    SolutionIndex: 4
    SolutionNameMin: Cijk_Ailk_Bljk_BBS_BH_MT16x32x64_MI16x16x1_SN_LDSB0_GSU8_LWPM0p35_MIWT1_1_NTB0_SU0_SUM0_SUS0_SPO1_WG16_8_1
    SolutionIndex: 5
    SolutionNameMin: Cijk_Ailk_Bljk_BBS_BH_MT16x32x64_MI16x16x1_SN_LDSB0_GSU20_LWPM0p30_MIWT1_1_NTB1_SU0_SUM0_SUS0_SPO1_WG16_8_1
    SolutionIndex: 6
    SolutionNameMin: Cijk_Ailk_Bljk_BBS_BH_MT256x128x32_MI16x16x1_SN_LDSB1_GRVWB4_GSU1_LBSPPA2048_LBSPPB128_LPA16_LWPMn1_MIWT4_8_SU4_SUM2_SUS256_SVW4_VWA4_WG64_4_1
    SolutionIndex: 7
    SolutionNameMin: Cijk_Ailk_Bljk_BBS_BH_MT256x144x64_MI16x16x1_SN_LDSB1_GRVWB4_GSU1_LBSPPA2048_LBSPPB128_LPA16_LWPMn1_MIWT4_9_SU0_SUM0_SUS0_SVW4_VWA4_WG64_4_1
    SolutionIndex: 8
    SolutionNameMin: Cijk_Ailk_Bljk_BBS_BH_UserArgs_MT256x240x64_MI16x16x1_SN_GRVWA8_GRVWB4_GSU1_K1_LBSPPA2048_LBSPPB128_LPA0_LPB4_LRVW4_MIWT4_15_NTA1_NTB0_NTC5_NTD5_SS1_SU0_SUM0_SUS0_SPO0_SVW4_VWA4_VWB1_WGM32
    SolutionIndex: 9
    SolutionNameMin: Cijk_Ailk_Bljk_BBS_BH_UserArgs_MT256x240x64_MI16x16x1_SN_GRVWA8_GRVWB4_GSU1_K1_LBSPPA2048_LBSPPB128_LPA0_LPB4_LRVW4_MIWT4_15_NTA1_NTB3_NTC7_NTD7_SS1_SU0_SUM0_SUS0_SPO1_SVW4_VWA4_VWB1_WGM32
    SolutionIndex: 10
    SolutionNameMin: Cijk_Ailk_Bljk_BBS_BH_UserArgs_MT256x240x64_MI16x16x1_SN_GRVWA8_GRVWB4_GSU1_K1_LBSPPA2048_LBSPPB128_LPA0_LPB4_LRVW4_MIWT4_15_NTA2_NTB0_NTC6_NTD6_SS1_SU0_SUM0_SUS0_SPO0_SVW4_VWA4_VWB1_WGM32
    SolutionIndex: 11
    SolutionNameMin: Cijk_Ailk_Bljk_BBS_BH_UserArgs_MT256x240x64_MI16x16x1_SN_GRVWA8_GRVWB4_GSU1_K1_LBSPPA2048_LBSPPB128_LPA0_LPB4_LRVW4_MIWT4_15_NTA2_NTB3_NTC5_NTD5_SS1_SU0_SUM0_SUS0_SPO0_SVW4_VWA4_VWB1_WGM32
    SolutionIndex: 12
    SolutionNameMin: Cijk_Ailk_Bljk_BBS_BH_UserArgs_MT256x256x32_MI16x16x1_SN_GRVWA8_GRVWB2_GSU1_K1_LBSPPA2048_LBSPPB512_LPA0_LPB4_LRVW4_MIWT4_16_NTA0_NTB0_NTC0_NTD0_SS1_SU8_SUM0_SUS256_SPO0_SVW4_VWA4_VWB8_WGM32
    SolutionIndex: 13
    SolutionNameMin: Cijk_Ailk_Bljk_BBS_BH_UserArgs_MT256x256x32_MI16x16x1_SN_GRVWA2_GRVWB2_GSU1_K1_LBSPPA2048_LBSPPB512_LPA0_LPB4_LRVW4_MIWT4_16_NTA0_NTB0_NTC0_NTD0_SS1_SU8_SUM0_SUS2048_SPO0_SVW4_VWA4_VWB8_WGM8
    SolutionIndex: 14
    SolutionNameMin: Cijk_Ailk_Bljk_BBS_BH_UserArgs_MT32x16x32_MI16x16x1_SN_LDSB0_CLR0_GRVWA4_GRVWB2_GSU1_GSUC0_GSUWGMRR0_K1_LBSPPA256_LBSPPB128_LPA16_LPB4_LRVW4_MIWT1_1_NLCA1_PLR0_SU16_SUM0_SUS64_SVW1_VWA1_VWB1_WG32_4_2_WGM1_WGMXCC1_WGMXCCG0
    SolutionIndex: 15
    SolutionNameMin: Cijk_Ailk_Bljk_BBS_BH_UserArgs_MT128x96x64_MI16x16x1_SN_LDSB1_CLR1_GRVWA8_GRVWB8_GSU1_GSUC0_GSUWGMRR0_K1_LBSPPA2048_LBSPPB128_LPA0_LPB16_LRVW8_MIWT4_3_NLCA1_PLR1_SU16_SUM0_SUS128_SVW4_VWA4_VWB1_WG32_8_1_WGM8_WGMXCC8_WGMXCCG304
    SolutionIndex: 16
    SolutionNameMin: Cijk_Ailk_Bljk_BBS_BH_UserArgs_MT128x96x128_MI16x16x1_SN_LDSB1_CLR1_GRVWA8_GRVWB8_GSU1_GSUC0_GSUWGMRR0_K1_LBSPPA2048_LBSPPB256_LPA0_LPB16_LRVW8_MIWT4_3_NLCA1_PLR1_SU16_SUM0_SUS256_SVW4_VWA4_VWB1_WG32_8_1_WGM8_WGMXCC8_WGMXCCG304
    SolutionIndex: 17
    SolutionNameMin: Cijk_Ailk_Bljk_BBS_BH_UserArgs_MT256x80x64_MI16x16x1_SN_LDSB1_CLR1_GRVWA8_GRVWB4_GSU1_GSUC0_GSUWGMRR0_K1_LBSPPA4096_LBSPPB128_LPA0_LPB16_LRVW8_MIWT4_5_NLCA1_PLR1_SU16_SUM0_SUS128_SVW4_VWA4_VWB1_WG64_4_1_WGM8_WGMXCC8_WGMXCCG304
    SolutionIndex: 18
    SolutionNameMin: Cijk_Ailk_Bljk_BBS_BH_UserArgs_MT128x64x128_MI16x16x1_SN_LDSB1_CLR1_GRVWA8_GRVWB8_GSU1_GSUC0_GSUWGMRR0_K1_LBSPPA2048_LBSPPB1024_LPA0_LPB16_LRVW8_MIWT4_4_NLCA1_PLR1_SU16_SUM0_SUS256_SVW4_VWA4_VWB4_WG32_4_2_WGM8_WGMXCC8_WGMXCCG304
    SolutionIndex: 19
    SolutionNameMin: Cijk_Ailk_Bljk_BBS_BH_UserArgs_MT256x160x32_MI16x16x1_SN_LDSB0_CLR1_GRVWA8_GRVWB4_GSU1_GSUC0_GSUWGMRR0_K1_LBSPPA2048_LBSPPB128_LPA0_LPB4_LRVW4_MIWT4_10_NLCA1_PLR1_SU16_SUM0_SUS64_SVW4_VWA4_VWB2_WG64_4_1_WGM8_WGMXCC8_WGMXCCG304
    SolutionIndex: 20
    SolutionNameMin: Cijk_Ailk_Bljk_BBS_BH_UserArgs_MT256x224x64_MI16x16x1_SN_LDSB1_CLR1_GRVWA8_GRVWB8_GSU1_GSUC0_GSUWGMRR0_K1_LBSPPA4096_LBSPPB256_LPA0_LPB16_LRVW8_MIWT4_14_NLCA1_PLR1_SU16_SUM0_SUS128_SVW4_VWA4_VWB2_WG64_4_1_WGM8_WGMXCC8_WGMXCCG304
    SolutionIndex: 21
    SolutionNameMin: Cijk_Ailk_Bljk_BBS_BH_UserArgs_MT256x160x64_MI16x16x1_SN_LDSB1_GRVWA8_GRVWB8_GSU2_GSUAMBSK_GSUC0_GSUWGMRR0_K1_LBSPPA4096_LBSPPB256_LPA0_LPB16_LRVW8_MIWT4_10_NTD0_NEPBS0_NLCA1_SU0_SUM0_SUS0_SVW4_VWA4_VWB2_WG64_4_1_WGM1_WGMXCC1_WGMXCCG0
    SolutionIndex: 22
    SolutionNameMin: Cijk_Ailk_Bljk_BBS_BH_UserArgs_MT256x160x64_MI16x16x1_SN_LDSB1_GRVWA8_GRVWB8_GSU2_GSUAMB_GSUC0_GSUWGMRR0_K1_LBSPPA4096_LBSPPB256_LPA0_LPB16_LRVW8_MIWT4_10_NTD0_NEPBS16_NLCA1_SU0_SUM0_SUS0_SVW4_VWA4_VWB2_WG64_4_1_WGM1_WGMXCC1_WGMXCCG0
    SolutionIndex: 23
    SolutionNameMin: Cijk_Ailk_Bljk_BBS_BH_UserArgs_MT320x144x64_MI16x16x1_SN_GSU1_GSUC0_GSUWGMRR0_K1_MIWT5_9_SU8_SUM1_SUS128_WGM6_WGMXCC8_WGMXCCGn1
    SolutionIndex: 24
    SolutionNameMin: Cijk_Ailk_Bljk_BBS_BH_UserArgs_MT256x240x64_MI16x16x1_SN_GRVWB4_GSU1_GSUC0_GSUWGMRR0_K1_LBSPPA2048_LBSPPB128_LPB4_LRVW4_MIWT4_15_SU8_SUM1_SUS128_SVW4_VWA4_VWB1_WG64_4_1_WGM32_WGMXCC1_WGMXCCGn1
    SolutionIndex: 25
    SolutionNameMin: Cijk_Ailk_Bljk_BBS_BH_UserArgs_MT512x128x64_MI16x16x1_SN_LDSB0_DTVA1_GRVWA8_GSU1_GSUC0_GSUWGMRR0_K1_LBSPPA0_MIWT8_8_SU8_SUM0_SUS128_SVW8_ULSGRO0_VWA8_WG64_4_1_WGM1_WGMXCC1_WGMXCCGn1
    SolutionIndex: 26
    SolutionNameMin: Cijk_Ailk_Bljk_BBS_BH_UserArgs_MT512x128x32_MI16x16x1_SN_LDSB1_GRVWA8_GRVWB4_GSU1_GSUAMB_GSUC0_GSUWGMRR0_K1_LBSPPA4096_LBSPPB512_LPA0_LPB4_LRVW4_MIWT8_8_NLCA1_SU8_SUM0_SUS64_SVW8_VWA8_VWB8_WG64_4_1_WGM8_WGMXCC8_WGMXCCG304
    SolutionIndex: 27
    SolutionNameMin: Cijk_Ailk_Bljk_BBS_BH_UserArgs_MT128x64x128_MI16x16x1_SN_LDSB1_GRVWA8_GRVWB8_GSU1_GSUAMB_GSUC0_GSUWGMRR0_K1_LBSPPA2048_LBSPPB512_LPA0_LPB16_LRVW8_MIWT4_2_NLCA1_SU0_SUM0_SUS0_SVW4_VWA4_VWB2_WG32_8_1_WGM8_WGMXCC8_WGMXCCG304
    SolutionIndex: 28
    SolutionNameMin: Cijk_Ailk_Bljk_BBS_BH_UserArgs_MT256x128x64_MI16x16x1_SN_LDSB1_GRVWA8_GRVWB8_GSU1_GSUAMBSK_GSUC0_GSUWGMRR0_K1_LBSPPA4096_LBSPPB1024_LPA0_LPB16_LRVW8_MIWT4_8_NLCA1_SU0_SUM0_SUS0_SVW4_VWA4_VWB8_WG64_4_1_WGM8_WGMXCC8_WGMXCCG304
    SolutionIndex: 29
    SolutionNameMin: Cijk_Ailk_Bljk_BBS_BH_UserArgs_MT64x64x64_MI16x16x1_SN_LDSB1_GRVWA8_GRVWB8_GSU1_GSUAMBSK_GSUC0_GSUWGMRR0_K1_LBSPPA1024_LBSPPB256_LPA32_LPB16_LRVW8_MIWT2_2_NLCA1_SU0_SUM0_SUS0_SVW2_VWA2_VWB2_WG32_8_1_WGM8_WGMXCC8_WGMXCCG304
    SolutionIndex: 30
    SolutionNameMin: Cijk_Ailk_Bljk_BBS_BH_UserArgs_MT192x128x64_MI16x16x1_SN_LDSB1_GRVWA8_GRVWB8_GSU1_GSUAMBSK_GSUC0_GSUWGMRR0_K1_LBSPPA3072_LBSPPB512_LPA32_LPB16_LRVW8_MIWT6_4_NLCA3_SU0_SUM0_SUS0_SVW2_VWA2_VWB4_WG32_8_1_WGM6_WGMXCC8_WGMXCCG304
    SolutionIndex: 31
    SolutionNameMin: Cijk_Ailk_Bljk_BBS_BH_UserArgs_MT128x256x64_MI16x16x1_SN_LDSB1_GRVWA8_GRVWB8_GSU8_GSUAMB_GSUC0_GSUWGMRR0_K1_LBSPPA2048_LBSPPB1024_LPA0_LPB16_LRVW8_MIWT4_8_NLCA1_SU8_SUM0_SUS128_SVW4_VWA4_VWB8_WG32_8_1_WGM1_WGMXCC8_WGMXCCG304
    SolutionIndex: 32
    SolutionNameMin: Cijk_Ailk_Bljk_BBS_BH_UserArgs_MT128x128x64_MI16x16x1_SN_LDSB1_GRVWA8_GRVWB8_GSU4_GSUAMB_GSUC0_GSUWGMRR0_K1_LBSPPA2048_LBSPPB512_LPA0_LPB16_LRVW8_MIWT4_4_NLCA1_SU16_SUM1_SUS128_SVW4_VWA4_VWB4_WG32_8_1_WGM6_WGMXCC8_WGMXCCG304
    SolutionIndex: 33
    SolutionNameMin: Cijk_Ailk_Bljk_BBS_BH_UserArgs_MT256x64x64_MI16x16x1_SN_LDSB1_GRVWA8_GRVWB8_GSU2_GSUAMB_GSUC0_GSUWGMRR0_K1_LBSPPA4096_LBSPPB512_LPA0_LPB16_LRVW8_MIWT4_4_NLCA1_SU0_SUM0_SUS0_SVW4_VWA4_VWB4_WG64_4_1_WGM6_WGMXCC8_WGMXCCG304
    SolutionIndex: 34
    SolutionNameMin: Cijk_Ailk_Bljk_BBS_BH_UserArgs_MT256x64x64_MI16x16x1_SN_LDSB1_GRVWA8_GRVWB8_GSU1_GSUAMBSK_GSUC0_GSUWGMRR0_K1_LBSPPA4096_LBSPPB512_LPA0_LPB16_LRVW8_MIWT4_4_NLCA1_SU0_SUM0_SUS0_SVW4_VWA4_VWB4_WG64_4_1_WGM6_WGMXCC8_WGMXCCG304
    SolutionIndex: 35
    SolutionNameMin: Cijk_Ailk_Bljk_BBS_BH_UserArgs_MT256x64x32_MI16x16x1_SN_LDSB1_GRVWA8_GRVWB4_GSU1_GSUAMB_GSUC0_GSUWGMRR0_K1_LBSPPA2048_LBSPPB256_LPA0_LPB4_LRVW4_MIWT4_4_NLCA1_SU8_SUM0_SUS64_SVW4_VWA4_VWB4_WG64_4_1_WGM1_WGMXCC8_WGMXCCG304
    SolutionIndex: 36
    SolutionNameMin: Cijk_Ailk_Bljk_BBS_BH_UserArgs_MT128x64x64_MI16x16x1_SN_LDSB1_GRVWA8_GRVWB8_GSU2_GSUAMBSK_GSUC0_GSUWGMRR0_K1_LBSPPA2048_LBSPPB256_LPA0_LPB16_LRVW8_MIWT4_2_NLCA1_SU8_SUM0_SUS128_SVW4_VWA4_VWB2_WG32_8_1_WGM6_WGMXCC8_WGMXCCG304
    SolutionIndex: 37
    SolutionNameMin: Cijk_Ailk_Bljk_BBS_BH_UserArgs_MT64x128x128_MI16x16x1_SN_LDSB1_GRVWA8_GRVWB8_GSU1_GSUAMBSK_GSUC0_GSUWGMRR0_K1_LBSPPA1024_LBSPPB512_LPA0_LPB16_LRVW8_MIWT4_2_NLCA1_SU0_SUM0_SUS0_SVW4_VWA4_VWB2_WG16_16_1_WGM6_WGMXCC8_WGMXCCG304
    SolutionIndex: 38
    SolutionNameMin: Cijk_Ailk_Bljk_BBS_BH_UserArgs_MT224x128x16_MI16x16x1_SN_GSU1_GSUC0_GSUWGMRR1_K1_MIWT7_4_SU0_SUM0_SUS32_WGM0_WGMXCC1_WGMXCCGn1
    SolutionIndex: 39
    SolutionNameMin: Cijk_Ailk_Bljk_BBS_BH_UserArgs_MT64x96x128_MI16x16x1_SN_GSU1_GSUC0_GSUWGMRR1_K1_MIWT2_3_SU16_SUM0_SUS256_WGM0_WGMXCC8_WGMXCCG32
    SolutionIndex: 40
    SolutionNameMin: Cijk_Ailk_Bljk_BBS_BH_UserArgs_MT256x96x32_MI16x16x1_SN_GSU1_GSUC0_GSUWGMRR0_K1_MIWT8_3_SU16_SUM0_SUS64_WGM4_WGMXCC2_WGMXCCG0
    SolutionIndex: 41
    SolutionNameMin: Cijk_Ailk_Bljk_BBS_BH_UserArgs_MT512x128x32_MI16x16x1_SN_GSU1_GSUC0_GSUWGMRR0_K1_MIWT8_8_SU4_SUM4_SUS128_WGM1_WGMXCC4_WGMXCCG0
    SolutionIndex: 42
    SolutionNameMin: Cijk_Ailk_Bljk_BBS_BH_UserArgs_MT256x128x64_MI16x16x1_SN_GSU1_GSUC0_GSUWGMRR0_K1_MIWT4_8_SU4_SUM0_SUS256_WGM1_WGMXCC16_WGMXCCGn1
    SolutionIndex: 43
    SolutionNameMin: Cijk_Ailk_Bljk_BBS_BH_UserArgs_MT256x192x64_MI16x16x1_SN_GSU1_GSUC0_GSUWGMRR0_K1_MIWT4_12_SU0_SUM0_SUS128_WGM16_WGMXCC2_WGMXCCGn1
    SolutionIndex: 44
    SolutionNameMin: Cijk_Ailk_Bljk_BBS_BH_UserArgs_MT256x160x32_MI16x16x1_SN_GSU1_GSUC0_GSUWGMRR0_K1_MIWT4_10_SU32_SUM1_SUS256_WGM12_WGMXCC4_WGMXCCGn1
    SolutionIndex: 45
    SolutionNameMin: Cijk_Ailk_Bljk_BBS_BH_UserArgs_MT128x96x64_MI16x16x1_SN_GSU1_GSUC0_GSUWGMRR0_K1_MIWT4_3_SU2_SUM2_SUS512_WGM0_WGMXCC8_WGMXCCG0
    SolutionIndex: 46
    SolutionNameMin: Cijk_Ailk_Bljk_BBS_BH_UserArgs_MT512x128x32_MI16x16x1_SN_GSU1_GSUC1_GSUWGMRR0_K1_MIWT8_8_SU0_SUM0_SUS64_WGM1_WGMXCC2_WGMXCCGn1
    SolutionIndex: 47
    SolutionNameMin: Cijk_Ailk_Bljk_BBS_BH_UserArgs_MT512x128x64_MI16x16x1_SN_GSU1_GSUC0_GSUWGMRR0_K1_MIWT8_8_SU0_SUM0_SUS128_WGM8_WGMXCC8_WGMXCCG304
    SolutionIndex: 48
    SolutionNameMin: Cijk_Ailk_Bljk_BBS_BH_UserArgs_MT32x256x32_MI32x32x1_SN_GSU1_GSUC0_GSUWGMRR0_K1_MIWT1_2_SU2_SUM0_SUS64_WGM0_WGMXCC1_WGMXCCGn1
    SolutionIndex: 49
    SolutionNameMin: Cijk_Ailk_Bljk_BBS_BH_UserArgs_MT512x112x32_MI16x16x1_SN_GSU1_GSUC0_GSUWGMRR0_K1_MIWT8_7_SU8_SUM0_SUS64_WGM4_WGMXCC1_WGMXCCGn1
    SolutionIndex: 50
    SolutionNameMin: Cijk_Ailk_Bljk_BBS_BH_UserArgs_MT256x128x32_MI16x16x1_SN_GSU1_GSUC0_GSUWGMRR0_K1_MIWT4_8_SU32_SUM1_SUS256_WGM8_WGMXCC8_WGMXCCG0
    SolutionIndex: 51
    SolutionNameMin: Cijk_Ailk_Bljk_BBS_BH_UserArgs_MT128x160x64_MI16x16x1_SN_GSU1_GSUC0_GSUWGMRR0_K1_MIWT4_5_SU4_SUM0_SUS128_WGM1_WGMXCC8_WGMXCCG0
    SolutionIndex: 52
    SolutionNameMin: Cijk_Ailk_Bljk_BBS_BH_UserArgs_MT64x256x16_MI32x32x1_SN_GSU1_GSUC0_GSUWGMRR1_K1_MIWT1_4_SU0_SUM0_SUS32_WGM16_WGMXCC2_WGMXCCG16
    SolutionIndex: 53
    SolutionNameMin: Cijk_Ailk_Bljk_BBS_BH_UserArgs_MT256x80x64_MI16x16x1_SN_GSU1_GSUC0_GSUWGMRR0_K1_MIWT4_5_SU32_SUM0_SUS2048_WGM8_WGMXCC1_WGMXCCGn1
    SolutionIndex: 54
    SolutionNameMin: Cijk_Ailk_Bljk_BBS_BH_UserArgs_MT256x80x64_MI16x16x1_SN_GSU1_GSUC0_GSUWGMRR0_K1_MIWT4_5_SU4_SUM0_SUS128_WGM12_WGMXCC2_WGMXCCGn1
    SolutionIndex: 55
    SolutionNameMin: Cijk_Ailk_Bljk_BBS_BH_UserArgs_MT256x80x32_MI16x16x1_SN_GSU1_GSUC0_GSUWGMRR1_K1_MIWT4_5_SU4_SUM0_SUS64_WGM32_WGMXCC1_WGMXCCG6
    SolutionIndex: 56
    SolutionNameMin: Cijk_Ailk_Bljk_BBS_BH_UserArgs_MT224x64x16_MI16x16x1_SN_GSU1_GSUC0_GSUWGMRR1_K1_MIWT14_1_SU2_SUM0_SUS32_WGM0_WGMXCC1_WGMXCCGn1
    SolutionIndex: 57
    SolutionNameMin: Cijk_Ailk_Bljk_BBS_BH_UserArgs_MT64x16x128_MI16x16x1_SN_GSU16_GSUC0_GSUWGMRR1_K1_MIWT1_1_SU64_SUM4_SUS256_WGM1_WGMXCC8_WGMXCCG304
    SolutionIndex: 58
    SolutionNameMin: Cijk_Ailk_Bljk_BBS_BH_UserArgs_MT128x96x128_MI16x16x1_SN_GSU1_GSUC0_GSUWGMRR0_K1_MIWT4_3_SU0_SUM0_SUS256_WGM1_WGMXCC8_WGMXCCG0
    SolutionIndex: 59
    SolutionNameMin: Cijk_Ailk_Bljk_BBS_BH_UserArgs_MT256x80x64_MI16x16x1_SN_GSU1_GSUC0_GSUWGMRR0_K1_MIWT4_5_SU4_SUM2_SUS256_WGM0_WGMXCC4_WGMXCCG0
    SolutionIndex: 60
    SolutionNameMin: Cijk_Ailk_Bljk_BBS_BH_UserArgs_MT128x96x128_MI16x16x1_SN_GSU1_GSUC0_GSUWGMRR1_K1_MIWT4_3_SU4_SUM0_SUS256_WGM8_WGMXCC1_WGMXCCG4
    SolutionIndex: 61
    SolutionNameMin: Cijk_Ailk_Bljk_BBS_BH_UserArgs_MT128x128x16_MI32x32x1_SN_GSU1_GSUC0_GSUWGMRR0_K1_MIWT1_4_SU0_SUM0_SUS32_WGM152_WGMXCC1_WGMXCCG171
    SolutionIndex: 62
    SolutionNameMin: Cijk_Ailk_Bljk_BBS_BH_UserArgs_MT32x256x32_MI32x32x1_SN_GSU1_GSUC0_GSUWGMRR0_K1_MIWT1_2_SU16_SUM0_SUS256_WGM190_WGMXCC1_WGMXCCG304
    SolutionIndex: 63
    SolutionNameMin: Cijk_Ailk_Bljk_BBS_BH_UserArgs_MT512x176x32_MI16x16x1_SN_GSU1_GSUC0_GSUWGMRR0_K1_MIWT8_11_SU0_SUM0_SUS64_WGM0_WGMXCC1_WGMXCCGn1
    SolutionIndex: 64
    SolutionNameMin: Cijk_Ailk_Bljk_BBS_BH_UserArgs_MT512x160x32_MI16x16x1_SN_GSU1_GSUC1_GSUWGMRR1_K1_MIWT8_10_SU0_SUM0_SUS64_WGM1_WGMXCC4_WGMXCCGn1
    SolutionIndex: 65
    SolutionNameMin: Cijk_Ailk_Bljk_BBS_BH_UserArgs_MT64x64x64_MI16x16x1_SN_GSU1_GSUC0_GSUWGMRR0_K1_LBSPPA1024_LPA32_LPB16_MIWT2_2_SU4_SUM1_SUS1024_WG32_8_1_WGM1_WGMXCC8_WGMXCCG0
    SolutionIndex: 66
    SolutionNameMin: Cijk_Ailk_Bljk_BBS_BH_UserArgs_MT128x96x128_MI16x16x1_SN_GSU1_GSUC0_GSUWGMRR1_K1_MIWT4_3_SU4_SUM0_SUS256_WGM8_WGMXCC1_WGMXCCGn1
    SolutionIndex: 67
    SolutionNameMin: Cijk_Ailk_Bljk_BBS_BH_UserArgs_MT192x256x64_MI16x16x1_SN_GSU1_GSUC0_GSUWGMRR0_K1_MIWT12_4_SU0_SUM0_SUS128_WGM2_WGMXCC1_WGMXCCGn1
    SolutionIndex: 68
    SolutionNameMin: Cijk_Ailk_Bljk_BBS_BH_UserArgs_MT256x128x32_MI16x16x1_SN_ASEM1_DTVB0_GRVWB4_GSU1_GSUC0_GSUWGMRR0_K1_LBSPPA2048_LBSPPB512_LPB4_LRVW4_MIWT4_8_NLCB1_SU0_SUM0_SUS64_SK0_VWB8_WSGRA0_WSGRB1_WGM1_WGMXCC1_WGMXCCGn1
    SolutionIndex: 69
    SolutionNameMin: Cijk_Ailk_Bljk_BBS_BH_UserArgs_MT256x240x32_MI16x16x1_SN_GRVWB2_GSU1_GSUC0_GSUWGMRR0_K1_LBSPPA2048_LBSPPB128_LPB4_LRVW4_MIWT4_15_ONLL1_SU4_SUM1_SUS64_VWB1_WGM1_WGMXCC1_WGMXCCGn1
- - - [512, 512, 1, 512]
    - [1, 0.0]
  - - [1024, 1024, 1, 1024]
    - [0, 0.0]
  - - [2048, 2048, 1, 2048]
    - [0, 0.0]
  - - [4096, 4096, 1, 4096]
    - [2, 0.0]
  - - [4096, 4096, 1, 8192]
    - [2, 0.0]
  - - [8192, 8192, 1, 8192]
    - [2, 0.0]
  - - [2, 7168, 1, 8192]
    - [3, 0.0]
  - - [2, 3584, 1, 8192]
    - [4, 0.0]
  - - [2, 1280, 1, 8192]
    - [5, 0.0]
  - - [8192, 7168, 1, 8192]
    - [6, 0.0]
  - - [8192, 3584, 1, 8192]
    - [6, 0.0]
  - - [8192, 1280, 1, 8192]
    - [7, 0.0]
  - - [11008, 65536, 1, 4096]
    - [8, 0.0]
  - - [32000, 32768, 1, 8192]
    - [9, 0.0]
  - - [32000, 65536, 1, 4096]
    - [10, 0.0]
  - - [4096, 65536, 1, 4096]
    - [11, 0.0]
  - - [11008, 49152, 1, 4096]
    - [10, 0.0]
  - - [4096, 49152, 1, 4096]
    - [10, 0.0]
  - - [32000, 49152, 1, 4096]
    - [24, 0.0]
  - - [28672, 57344, 1, 8192]
    - [12, 0.0]
  - - [1024, 57344, 1, 8192]
    - [13, 0.0]
  - - [32000, 57344, 1, 8192]
    - [24, 0.0]
  - - [1875, 48, 1, 1]
    - [14, 0.0]
  - - [1024, 2885, 1, 1024]
    - [15, 0.0]
  - - [1024, 2885, 1, 4096]
    - [16, 0.0]
  - - [3072, 1875, 1, 3072]
    - [17, 0.0]
  - - [3072, 1875, 1, 9216]
    - [17, 0.0]
  - - [3072, 757, 1, 3072]
    - [18, 0.0]
  - - [4096, 2885, 1, 1024]
    - [19, 0.0]
  - - [4096, 757, 1, 3072]
    - [16, 0.0]
  - - [8192, 1875, 1, 3072]
    - [20, 0.0]
  - - [3072, 1875, 1, 16384]
    - [21, 0.0]
  - - [3072, 1875, 1, 32064]
    - [22, 0.0]
  - - [1600, 51200, 1, 50304]
    - [23, 0.0]
  - - [4096, 49152, 1, 32000]
    - [24, 0.0]
  - - [8192, 57344, 1, 32000]
    - [24, 0.0]
  - - [8192, 106496, 1, 32000]
    - [24, 0.0]
  - - [32000, 106496, 1, 8192]
    - [24, 0.0]
  - - [4096, 4864, 1, 32896]
    - [25, 329.07]
  - - [344064, 1280, 1, 2048]
    - [26, 263.14]
  - - [1472, 1024, 1, 3584]
    - [27, 141.92]
  - - [7168, 1024, 1, 1472]
    - [28, 223.17]
  - - [1152, 1024, 1, 1472]
    - [29, 105.86]
  - - [6144, 1024, 1, 1472]
    - [30, 214.09]
  - - [4096, 256, 1, 32128]
    - [31, 206.44]
  - - [4096, 256, 1, 10240]
    - [32, 161.49]
  - - [6144, 256, 1, 4096]
    - [33, 132.52]
  - - [10240, 256, 1, 4096]
    - [34, 157.44]
  - - [1572864, 64, 1, 32]
    - [35, 31.65]
  - - [4096, 256, 1, 4096]
    - [36, 122.12]
  - - [1472, 1024, 1, 384]
    - [37, 77.56]
  - - [198, 1511680, 1, 20]
    - [38, 0.0]
  - - [256, 5905, 1, 512]
    - [39, 0.0]
  - - [1024, 5905, 1, 222]
    - [40, 0.0]
  - - [6144, 5905, 1, 1024]
    - [41, 0.0]
  - - [1475, 5905, 1, 2048]
    - [42, 0.0]
  - - [4440, 5905, 1, 2048]
    - [43, 0.0]
  - - [4040, 5905, 1, 2048]
    - [44, 0.0]
  - - [1475, 5905, 1, 512]
    - [45, 0.0]
  - - [6144, 5905, 1, 4096]
    - [46, 0.0]
  - - [11715, 5905, 1, 5120]
    - [47, 0.0]
  - - [20, 202, 5905, 256]
    - [48, 0.0]
  - - [5120, 5905, 1, 2048]
    - [49, 0.0]
  - - [11715, 5905, 1, 1024]
    - [50, 0.0]
  - - [1024, 5905, 1, 1475]
    - [51, 0.0]
  - - [208, 1511680, 1, 24]
    - [52, 0.0]
  - - [1024, 5905, 1, 6144]
    - [53, 0.0]
  - - [1024, 5905, 1, 11715]
    - [54, 0.0]
  - - [1024, 5905, 1, 202]
    - [55, 0.0]
  - - [224, 1511680, 1, 24]
    - [56, 0.0]
  - - [512, 8, 1, 5905]
    - [57, 0.0]
  - - [512, 5905, 1, 256]
    - [58, 0.0]
  - - [1024, 5905, 1, 256]
    - [59, 0.0]
  - - [512, 5905, 1, 1024]
    - [60, 0.0]
  - - [202, 1511680, 1, 20]
    - [61, 0.0]
  - - [20, 222, 5905, 256]
    - [62, 0.0]
  - - [512, 795008, 1, 256]
    - [63, 0.0]
  - - [4096, 5905, 1, 5120]
    - [64, 0.0]
  - - [128, 5905, 1, 1475]
    - [65, 0.0]
  - - [512, 5905, 1, 512]
    - [66, 0.0]
  - - [192, 795008, 1, 256]
    - [67, 0.0]
  - - [256, 795008, 1, 256]
    - [68, 0.0]
  - - [256, 796032, 1, 768]
    - [69, 0.0]
- null
- null
- DeviceEfficiency
- Equality
