projects/hipblaslt/library/src/amd_detail/rocblaslt/src/Tensile/Logic/asm_full/aquavanjaram/gfx942/Equality/aquavanjaram_Cijk_Alik_Bljk_S_MX_B_Bias_HAS_SAV_UserArgs.yaml
- {MinimumRequiredVersion: 4.33.0}
- aquavanjaram
- gfx942
- [Device 0049, Device 0050]
    SolutionIndex: 0
    SolutionNameMin: Cijk_Alik_Bljk_S_MX_B_Bias_HAS_SAV_UserArgs_MT64x224x32_MI16x16x1_SN_GRPM1_GSU1_GSUC0_GSUWGMRR0_K1_LWPMn1_MIWT2_7_SU4_SUM0_SUS256_WGM0_WGMXCC1_WGMXCCG0
    SolutionIndex: 1
    SolutionNameMin: Cijk_Alik_Bljk_S_MX_B_Bias_HAS_SAV_UserArgs_MT208x128x16_MI16x16x1_SN_LDSB1_GRPM0p27_GSU1_GSUC0_GSUWGMRR0_K1_LWPM0p25_MIWT13_2_NEPBS2_SU4_SUM0_SUS256_SPO1_WGM0_WGMXCC1_WGMXCCG0
    SolutionIndex: 2
    SolutionNameMin: Cijk_Alik_Bljk_S_MX_B_Bias_HAS_SAV_UserArgs_MT192x224x32_MI16x16x1_SN_GRPM0p25_GSU4_GSUC0_GSUWGMRR0_K1_LWPMn1_MIWT3_14_SU2_SUM0_SUS128_WGM4_WGMXCC1_WGMXCCG0
    SolutionIndex: 3
    SolutionNameMin: Cijk_Alik_Bljk_S_MX_B_Bias_HAS_SAV_UserArgs_MT112x256x32_MI16x16x1_SN_GRPM1_GRVWA1_GRVWB4_GSU1_GSUC0_GSUWGMRR0_K1_LBSPPB128_LPA8_LPB8_LRVW4_LWPMn1_MIWT7_4_SU4_SUM0_SUS256_VWB1_WGM304_WGMXCC2_WGMXCCG0
    SolutionIndex: 4
    SolutionNameMin: Cijk_Alik_Bljk_S_MX_B_Bias_HAS_SAV_UserArgs_MT112x192x16_MI16x16x1_SN_LDSB1_GRPM0p27_GSU1_GSUC0_GSUWGMRR0_K1_LWPM0p26_MIWT7_3_NEPBS2_SU4_SUM0_SUS256_SPO1_WGM0_WGMXCC1_WGMXCCG0
    SolutionIndex: 5
    SolutionNameMin: Cijk_Alik_Bljk_S_MX_B_Bias_HAS_SAV_UserArgs_MT192x112x16_MI16x16x1_SN_LDSB1_GRPM0p27_GSU1_GSUC0_GSUWGMRR0_K1_LWPM0p26_MIWT3_7_NEPBS2_SU4_SUM0_SUS256_SPO1_WGM32_WGMXCC32_WGMXCCG0
    SolutionIndex: 6
    SolutionNameMin: Cijk_Alik_Bljk_S_MX_B_Bias_HAS_SAV_UserArgs_MT192x256x32_MI16x16x1_SN_GRPM1_GRVWA4_GRVWB4_GSU1_GSUC0_GSUWGMRR0_K1_LBSPPA512_LBSPPB512_LPA8_LPB8_LRVW4_LWPMn1_MIWT12_4_SU0_SUM0_SUS0_SVW4_VWA4_VWB4_WGM4_WGMXCC8_WGMXCCG304
    SolutionIndex: 7
    SolutionNameMin: Cijk_Alik_Bljk_S_MX_B_Bias_HAS_SAV_UserArgs_MT192x160x16_MI16x16x1_SN_LDSB1_GRPM0p26_GSU1_GSUC0_GSUWGMRR0_K1_LWPM0p27_MIWT6_5_NEPBS2_SU4_SUM0_SUS256_SPO0_WGM1_WGMXCC8_WGMXCCG304
    SolutionIndex: 8
    SolutionNameMin: Cijk_Alik_Bljk_S_MX_B_Bias_HAS_SAV_UserArgs_MT224x96x32_MI16x16x1_SN_GRPM1_GRVWA4_GRVWB4_GSU1_GSUC0_GSUWGMRR0_K1_LPA8_LPB8_LRVW4_LWPMn1_MIWT7_3_SU4_SUM0_SUS256_WGM8_WGMXCC1_WGMXCCG0
    SolutionIndex: 9
    SolutionNameMin: Cijk_Alik_Bljk_S_MX_B_Bias_HAS_SAV_UserArgs_MT240x128x16_MI16x16x1_SN_GRPM0p50_GSU1_GSUC0_GSUWGMRR0_K1_LWPMn1_MIWT15_2_SU4_SUM0_SUS256_WGM8_WGMXCC16_WGMXCCG0
    SolutionIndex: 10
    SolutionNameMin: Cijk_Alik_Bljk_S_MX_B_Bias_HAS_SAV_UserArgs_MT160x192x16_MI16x16x1_SN_LDSB1_GRPM1_GSU1_GSUC0_GSUWGMRR0_K1_LWPM0p25_MIWT10_3_NEPBS0_SU4_SUM0_SUS256_SPO0_WGM0_WGMXCC16_WGMXCCG0
    SolutionIndex: 11
    SolutionNameMin: Cijk_Alik_Bljk_S_MX_B_Bias_HAS_SAV_UserArgs_MT96x224x32_MI16x16x1_SN_GRPM0p26_GSU2_GSUC0_GSUWGMRR0_K1_LWPM0p27_MIWT3_7_SU4_SUM0_SUS256_WGM0_WGMXCC4_WGMXCCG32
    SolutionIndex: 12
    SolutionNameMin: Cijk_Alik_Bljk_S_MX_B_Bias_HAS_SAV_UserArgs_MT256x224x16_MI16x16x1_SN_GRPM0p25_GSU1_GSUC0_GSUWGMRR0_K1_LWPMn1_MIWT4_14_SU4_SUM2_SUS1024_WGM4_WGMXCC2_WGMXCCG0
    SolutionIndex: 13
    SolutionNameMin: Cijk_Alik_Bljk_S_MX_B_Bias_HAS_SAV_UserArgs_MT224x96x32_MI16x16x1_SN_GRPM1_GSU1_GSUC0_GSUWGMRR0_K1_LWPM0p27_MIWT7_3_SU4_SUM0_SUS256_WGM0_WGMXCC4_WGMXCCG0
    SolutionIndex: 14
    SolutionNameMin: Cijk_Alik_Bljk_S_MX_B_Bias_HAS_SAV_UserArgs_MT96x128x64_MI16x16x1_SN_GSU8_GSUC1_GSUWGMRR1_K1_MIWT3_4_SU2_SUM0_SUS256_WGM0_WGMXCC1_WGMXCCG228
    SolutionIndex: 15
    SolutionNameMin: Cijk_Alik_Bljk_S_MX_B_Bias_HAS_SAV_UserArgs_MT128x128x32_MI16x16x1_SN_GSU8_GSUC0_GSUWGMRR1_K1_MIWT4_4_SU2_SUM0_SUS128_WGM114_WGMXCC16_WGMXCCG0
    SolutionIndex: 16
    SolutionNameMin: Cijk_Alik_Bljk_S_MX_B_Bias_HAS_SAV_UserArgs_MT96x64x64_MI16x16x1_SN_GSU1_GSUC0_GSUWGMRR1_K1_MIWT3_2_SU2_SUM0_SUS256_WGM114_WGMXCC1_WGMXCCGn1
    SolutionIndex: 17
    SolutionNameMin: Cijk_Alik_Bljk_S_MX_B_Bias_HAS_SAV_UserArgs_MT128x128x32_MI16x16x1_SN_GSU1_GSUC0_GSUWGMRR1_K1_MIWT4_4_SU4_SUM0_SUS2048_WGM76_WGMXCC2_WGMXCCGn1
    SolutionIndex: 18
    SolutionNameMin: Cijk_Alik_Bljk_S_MX_B_Bias_HAS_SAV_UserArgs_MT32x64x64_MI16x16x1_SN_GSU1_GSUC0_GSUWGMRR1_K1_LPA8_LPB8_MIWT1_2_SU16_SUM0_SUS256_WG32_8_1_WGM1_WGMXCC32_WGMXCCG0
    SolutionIndex: 19
    SolutionNameMin: Cijk_Alik_Bljk_S_MX_B_Bias_HAS_SAV_UserArgs_MT96x64x64_MI16x16x1_SN_GSU4_GSUC1_GSUWGMRR1_K1_MIWT3_2_SU0_SUM0_SUS0_WGM57_WGMXCC4_WGMXCCG0
    SolutionIndex: 20
    SolutionNameMin: Cijk_Alik_Bljk_S_MX_B_Bias_HAS_SAV_UserArgs_MT64x32x64_MI16x16x1_SN_GSU1_GSUC0_GSUWGMRR1_K1_MIWT1_2_SU0_SUM0_SUS0_WGM1_WGMXCC32_WGMXCCG0
    SolutionIndex: 21
    SolutionNameMin: Cijk_Alik_Bljk_S_MX_B_Bias_HAS_SAV_UserArgs_MT160x64x32_MI16x16x1_SN_GSU4_GSUC1_GSUWGMRR0_K1_MIWT5_2_SU8_SUM1_SUS1024_WGM1_WGMXCC1_WGMXCCGn1
    SolutionIndex: 22
    SolutionNameMin: Cijk_Alik_Bljk_S_MX_B_Bias_HAS_SAV_UserArgs_MT64x96x64_MI16x16x1_SN_GSU1_GSUC0_GSUWGMRR0_K1_MIWT2_3_SU2_SUM2_SUS1024_WGM16_WGMXCC2_WGMXCCG16
    SolutionIndex: 23
    SolutionNameMin: Cijk_Alik_Bljk_S_MX_B_Bias_HAS_SAV_UserArgs_MT32x32x64_MI16x16x1_SN_GSU1_GSUC0_GSUWGMRR1_K1_MIWT2_1_SU4_SUM2_SUS512_WGM0_WGMXCC16_WGMXCCG0
    SolutionIndex: 24
    SolutionNameMin: Cijk_Alik_Bljk_S_MX_B_Bias_HAS_SAV_UserArgs_MT32x64x64_MI16x16x1_SN_GSU1_GSUC0_GSUWGMRR0_K1_MIWT2_1_SU16_SUM0_SUS256_WGM0_WGMXCC32_WGMXCCG0
    SolutionIndex: 25
    SolutionNameMin: Cijk_Alik_Bljk_S_MX_B_Bias_HAS_SAV_UserArgs_MT256x112x32_MI16x16x1_SN_GSU1_GSUC0_GSUWGMRR0_K1_MIWT4_7_SU8_SUM0_SUS128_WGM1_WGMXCC2_WGMXCCG0
    SolutionIndex: 26
    SolutionNameMin: Cijk_Alik_Bljk_S_MX_B_Bias_HAS_SAV_UserArgs_MT64x128x64_MI16x16x1_SN_GSU1_GSUC1_GSUWGMRR1_K1_MIWT4_4_SU2_SUM2_SUS512_WGM152_WGMXCC1_WGMXCCG19
    SolutionIndex: 27
    SolutionNameMin: Cijk_Alik_Bljk_S_MX_B_Bias_HAS_SAV_UserArgs_MT96x96x64_MI16x16x1_SN_GSU1_GSUC0_GSUWGMRR0_K1_MIWT3_3_SU4_SUM0_SUS512_WGM2_WGMXCC4_WGMXCCG0
    SolutionIndex: 28
    SolutionNameMin: Cijk_Alik_Bljk_S_MX_B_Bias_HAS_SAV_UserArgs_MT64x64x64_MI16x16x1_SN_GSU1_GSUC0_GSUWGMRR0_K1_MIWT2_2_SU64_SUM0_SUS256_WGM1_WGMXCC32_WGMXCCG0
    SolutionIndex: 29
    SolutionNameMin: Cijk_Alik_Bljk_S_MX_B_Bias_HAS_SAV_UserArgs_MT64x128x64_MI16x16x1_SN_GSU1_GSUC0_GSUWGMRR1_K1_MIWT2_4_SU4_SUM0_SUS256_WGM16_WGMXCC1_WGMXCCG247
    SolutionIndex: 30
    SolutionNameMin: Cijk_Alik_Bljk_S_MX_B_Bias_HAS_SAV_UserArgs_MT96x160x32_MI16x16x1_SN_GSU8_GSUC1_GSUWGMRR1_K1_MIWT3_5_SU2_SUM0_SUS128_WGM0_WGMXCC16_WGMXCCG0
    SolutionIndex: 31
    SolutionNameMin: Cijk_Alik_Bljk_S_MX_B_Bias_HAS_SAV_UserArgs_MT32x32x64_MI16x16x1_SN_GSU1_GSUC0_GSUWGMRR0_K1_MIWT2_1_SU4_SUM1_SUS256_WGM0_WGMXCC8_WGMXCCG0
    SolutionIndex: 32
    SolutionNameMin: Cijk_Alik_Bljk_S_MX_B_Bias_HAS_SAV_UserArgs_MT128x64x64_MI16x16x1_SN_GSU1_GSUC0_GSUWGMRR0_K1_MIWT4_2_SU4_SUM0_SUS256_WGM0_WGMXCC32_WGMXCCG0
    SolutionIndex: 33
    SolutionNameMin: Cijk_Alik_Bljk_S_MX_B_Bias_HAS_SAV_UserArgs_MT128x224x32_MI16x16x1_SN_GSU1_GSUC1_GSUWGMRR1_K1_MIWT4_7_SU2_SUM0_SUS512_WGM4_WGMXCC1_WGMXCCGn1
    SolutionIndex: 34
    SolutionNameMin: Cijk_Alik_Bljk_S_MX_B_Bias_HAS_SAV_UserArgs_MT128x160x32_MI16x16x1_SN_GSU1_GSUC1_GSUWGMRR1_K1_MIWT4_5_SU2_SUM0_SUS256_WGM0_WGMXCC8_WGMXCCGn1
    SolutionIndex: 35
    SolutionNameMin: Cijk_Alik_Bljk_S_MX_B_Bias_HAS_SAV_UserArgs_MT64x128x64_MI16x16x1_SN_GSU1_GSUC1_GSUWGMRR1_K1_MIWT4_2_SU8_SUM0_SUS256_WGM76_WGMXCC1_WGMXCCGn1
    SolutionIndex: 36
    SolutionNameMin: Cijk_Alik_Bljk_S_MX_B_Bias_HAS_SAV_UserArgs_MT128x256x32_MI16x16x1_SN_GSU1_GSUC0_GSUWGMRR0_K1_MIWT8_4_SU2_SUM0_SUS256_WGM8_WGMXCC1_WGMXCCGn1
    SolutionIndex: 37
    SolutionNameMin: Cijk_Alik_Bljk_S_MX_B_Bias_HAS_SAV_UserArgs_MT256x96x32_MI16x16x1_SN_GSU4_GSUC1_GSUWGMRR0_K1_MIWT4_6_SU64_SUM0_SUS128_WGM0_WGMXCC4_WGMXCCG228
    SolutionIndex: 38
    SolutionNameMin: Cijk_Alik_Bljk_S_MX_B_Bias_HAS_SAV_UserArgs_MT64x64x32_MI32x32x1_SN_GSU1_GSUC0_GSUWGMRR0_K1_MIWT1_1_SU2_SUM1_SUS1024_WGM0_WGMXCC8_WGMXCCG0
    SolutionIndex: 39
    SolutionNameMin: Cijk_Alik_Bljk_S_MX_B_Bias_HAS_SAV_UserArgs_MT128x64x64_MI16x16x1_SN_GSU1_GSUC1_GSUWGMRR1_K1_MIWT4_4_SU0_SUM0_SUS0_WGM95_WGMXCC1_WGMXCCGn1
    SolutionIndex: 40
    SolutionNameMin: Cijk_Alik_Bljk_S_MX_B_Bias_HAS_SAV_UserArgs_MT96x96x64_MI16x16x1_SN_GSU1_GSUC0_GSUWGMRR0_K1_MIWT3_3_SU4_SUM0_SUS256_WGM8_WGMXCC1_WGMXCCG12
    SolutionIndex: 41
    SolutionNameMin: Cijk_Alik_Bljk_S_MX_B_Bias_HAS_SAV_UserArgs_MT128x128x32_MI16x16x1_SN_GSU4_GSUC1_GSUWGMRR1_K1_MIWT4_4_SU0_SUM0_SUS0_WGM209_WGMXCC16_WGMXCCG32
    SolutionIndex: 42
    SolutionNameMin: Cijk_Alik_Bljk_S_MX_B_Bias_HAS_SAV_UserArgs_MT96x128x32_MI16x16x1_SN_GSU1_GSUC1_GSUWGMRR0_K1_MIWT6_2_SU2_SUM4_SUS512_WGM95_WGMXCC1_WGMXCCG0
    SolutionIndex: 43
    SolutionNameMin: Cijk_Alik_Bljk_S_MX_B_Bias_HAS_SAV_UserArgs_MT224x384x16_MI16x16x1_SN_GSU1_GSUC1_GSUWGMRR0_K1_MIWT14_6_SU0_SUM0_SUS0_WGM304_WGMXCC8_WGMXCCG0
    SolutionIndex: 44
    SolutionNameMin: Cijk_Alik_Bljk_S_MX_B_Bias_HAS_SAV_UserArgs_MT64x64x64_MI16x16x1_SN_GSU1_GSUC0_GSUWGMRR1_K1_MIWT2_2_SU2_SUM2_SUS1024_WGM152_WGMXCC1_WGMXCCG38
    SolutionIndex: 45
    SolutionNameMin: Cijk_Alik_Bljk_S_MX_B_Bias_HAS_SAV_UserArgs_MT64x32x64_MI16x16x1_SN_GSU1_GSUC0_GSUWGMRR0_K1_MIWT1_2_SU4_SUM0_SUS256_WGM1_WGMXCC16_WGMXCCG0
    SolutionIndex: 46
    SolutionNameMin: Cijk_Alik_Bljk_S_MX_B_Bias_HAS_SAV_UserArgs_MT128x192x32_MI16x16x1_SN_GSU1_GSUC0_GSUWGMRR0_K1_MIWT4_6_SU4_SUM0_SUS128_WGM2_WGMXCC1_WGMXCCGn1
    SolutionIndex: 47
    SolutionNameMin: Cijk_Alik_Bljk_S_MX_B_Bias_HAS_SAV_UserArgs_MT32x32x16_MI16x16x1_SN_GSU1_GSUC0_GSUWGMRR1_K1_MIWT2_1_SU2_SUM4_SUS64_WGM1_WGMXCC8_WGMXCCG0
    SolutionIndex: 48
    SolutionNameMin: Cijk_Alik_Bljk_S_MX_B_Bias_HAS_SAV_UserArgs_MT96x128x64_MI16x16x1_SN_GSU8_GSUC1_GSUWGMRR1_K1_MIWT3_4_SU0_SUM0_SUS0_WGM76_WGMXCC2_WGMXCCGn1
    SolutionIndex: 49
    SolutionNameMin: Cijk_Alik_Bljk_S_MX_B_Bias_HAS_SAV_UserArgs_MT128x128x32_MI16x16x1_SN_GSU4_GSUC1_GSUWGMRR1_K1_MIWT4_4_SU2_SUM0_SUS128_WGM57_WGMXCC4_WGMXCCG0
    SolutionIndex: 50
    SolutionNameMin: Cijk_Alik_Bljk_S_MX_B_Bias_HAS_SAV_UserArgs_MT128x128x32_MI16x16x1_SN_GSU4_GSUC1_GSUWGMRR1_K1_MIWT4_4_SU32_SUM0_SUS128_WGM0_WGMXCC4_WGMXCCG0
    SolutionIndex: 51
    SolutionNameMin: Cijk_Alik_Bljk_S_MX_B_Bias_HAS_SAV_UserArgs_MT96x128x64_MI16x16x1_SN_GSU1_GSUC1_GSUWGMRR1_K1_MIWT6_2_SU64_SUM0_SUS256_WGM1_WGMXCC8_WGMXCCGn1
    SolutionIndex: 52
    SolutionNameMin: Cijk_Alik_Bljk_S_MX_B_Bias_HAS_SAV_UserArgs_MT112x256x32_MI16x16x1_SN_GSU1_GSUC0_GSUWGMRR0_K1_MIWT7_4_SU16_SUM1_SUS2048_WGM2_WGMXCC2_WGMXCCGn1
    SolutionIndex: 53
    SolutionNameMin: Cijk_Alik_Bljk_S_MX_B_Bias_HAS_SAV_UserArgs_MT48x128x64_MI16x16x1_SN_GSU8_GSUC0_GSUWGMRR1_K1_MIWT3_2_SU4_SUM0_SUS256_WGM0_WGMXCC2_WGMXCCG0
    SolutionIndex: 54
    SolutionNameMin: Cijk_Alik_Bljk_S_MX_B_Bias_HAS_SAV_UserArgs_MT192x256x16_MI32x32x1_SN_GSU1_GSUC0_GSUWGMRR0_K1_MIWT6_2_SU2_SUM3_SUS1024_WGM8_WGMXCC8_WGMXCCG0
    SolutionIndex: 55
    SolutionNameMin: Cijk_Alik_Bljk_S_MX_B_Bias_HAS_SAV_UserArgs_MT64x64x16_MI32x32x1_SN_GSU1_GSUC0_GSUWGMRR1_K1_MIWT1_1_SU2_SUM3_SUS256_WGM0_WGMXCC16_WGMXCCG0
    SolutionIndex: 56
    SolutionNameMin: Cijk_Alik_Bljk_S_MX_B_Bias_HAS_SAV_UserArgs_MT96x64x64_MI16x16x1_SN_GSU1_GSUC1_GSUWGMRR1_K1_MIWT3_2_SU2_SUM1_SUS1024_WGM1_WGMXCC16_WGMXCCG0
    SolutionIndex: 57
    SolutionNameMin: Cijk_Alik_Bljk_S_MX_B_Bias_HAS_SAV_UserArgs_MT128x160x32_MI16x16x1_SN_GSU1_GSUC0_GSUWGMRR0_K1_MIWT4_5_SU4_SUM0_SUS1024_WGM8_WGMXCC1_WGMXCCGn1
    SolutionIndex: 58
    SolutionNameMin: Cijk_Alik_Bljk_S_MX_B_Bias_HAS_SAV_UserArgs_MT64x32x64_MI16x16x1_SN_GSU1_GSUC0_GSUWGMRR1_K1_MIWT1_2_SU4_SUM1_SUS256_WGM1_WGMXCC8_WGMXCCG0
    SolutionIndex: 59
    SolutionNameMin: Cijk_Alik_Bljk_S_MX_B_Bias_HAS_SAV_UserArgs_MT32x64x32_MI16x16x1_SN_GSU1_GSUC0_GSUWGMRR0_K1_LPA8_LPB8_MIWT1_2_SU4_SUM2_SUS128_WG32_8_1_WGM1_WGMXCC32_WGMXCCG0
    SolutionIndex: 60
    SolutionNameMin: Cijk_Alik_Bljk_S_MX_B_Bias_HAS_SAV_UserArgs_MT128x64x64_MI16x16x1_SN_GSU1_GSUC1_GSUWGMRR1_K1_MIWT4_4_SU0_SUM0_SUS0_WGM247_WGMXCC1_WGMXCCG12
    SolutionIndex: 61
    SolutionNameMin: Cijk_Alik_Bljk_S_MX_B_Bias_HAS_SAV_UserArgs_MT128x128x32_MI16x16x1_SN_GSU2_GSUC1_GSUWGMRR1_K1_MIWT4_4_SU2_SUM0_SUS128_WGM32_WGMXCC2_WGMXCCG304
    SolutionIndex: 62
    SolutionNameMin: Cijk_Alik_Bljk_S_MX_B_Bias_HAS_SAV_UserArgs_MT128x64x64_MI16x16x1_SN_GSU4_GSUC1_GSUWGMRR1_K1_MIWT4_2_SU4_SUM2_SUS512_WGM1_WGMXCC4_WGMXCCG0
- - - [57, 655360, 1, 1059]
    - [0, 0.0]
  - - [208, 655360, 1, 1059]
    - [1, 0.0]
  - - [768, 4096, 1, 5120]
    - [2, 0.0]
  - - [2048, 4096, 1, 4384]
    - [3, 0.0]
  - - [108, 160, 4096, 40]
    - [4, 0.0]
  - - [160, 105, 4096, 40]
    - [5, 0.0]
  - - [42360, 4096, 1, 256]
    - [6, 0.0]
  - - [1059, 160, 4096, 40]
    - [7, 0.0]
  - - [1536, 4096, 1, 42360]
    - [8, 0.0]
  - - [4384, 4096, 1, 768]
    - [9, 0.0]
  - - [160, 1059, 4096, 40]
    - [10, 0.0]
  - - [768, 4096, 1, 4384]
    - [11, 0.0]
  - - [3840, 4096, 1, 2048]
    - [12, 0.0]
  - - [1536, 4096, 1, 4200]
    - [13, 0.0]
  - - [92, 4096, 1, 7320]
    - [14, 0.0]
  - - [128, 4096, 1, 4896]
    - [15, 0.0]
  - - [272, 4096, 1, 1980]
    - [16, 0.0]
  - - [1024, 4096, 1, 3960]
    - [17, 0.0]
  - - [120, 4096, 1, 512]
    - [18, 0.0]
  - - [91, 4096, 1, 7320]
    - [19, 0.0]
  - - [120, 4096, 1, 397]
    - [20, 0.0]
  - - [136, 4096, 1, 1980]
    - [21, 0.0]
  - - [320, 4096, 1, 1980]
    - [22, 0.0]
  - - [128, 4096, 1, 128]
    - [23, 0.0]
  - - [128, 4096, 1, 512]
    - [24, 0.0]
  - - [2048, 4096, 1, 1319]
    - [25, 0.0]
  - - [512, 4096, 1, 3480]
    - [26, 0.0]
  - - [660, 4096, 1, 512]
    - [27, 0.0]
  - - [256, 4096, 1, 256]
    - [28, 0.0]
  - - [320, 4096, 1, 320]
    - [29, 0.0]
  - - [91, 4096, 1, 7704]
    - [30, 0.0]
  - - [128, 4096, 1, 64]
    - [31, 0.0]
  - - [512, 4096, 1, 512]
    - [32, 0.0]
  - - [2048, 4096, 1, 6048]
    - [33, 0.0]
  - - [1319, 4096, 1, 775]
    - [34, 0.0]
  - - [491, 4096, 1, 1972]
    - [35, 0.0]
  - - [1972, 4096, 1, 1980]
    - [36, 0.0]
  - - [256, 4096, 1, 5080]
    - [37, 0.0]
  - - [512, 4096, 1, 91]
    - [38, 0.0]
  - - [512, 4096, 1, 2560]
    - [39, 0.0]
  - - [660, 4096, 1, 397]
    - [40, 0.0]
  - - [256, 4096, 1, 4888]
    - [41, 0.0]
  - - [768, 4096, 1, 1980]
    - [42, 0.0]
  - - [6048, 4096, 1, 128]
    - [43, 0.0]
  - - [256, 4096, 1, 660]
    - [44, 0.0]
  - - [128, 4096, 1, 450]
    - [45, 0.0]
  - - [128, 49152, 1, 290]
    - [46, 0.0]
  - - [193, 4096, 1, 35]
    - [47, 0.0]
  - - [92, 4096, 1, 7704]
    - [48, 0.0]
  - - [256, 4096, 1, 5039]
    - [49, 0.0]
  - - [128, 4096, 1, 4953]
    - [50, 0.0]
  - - [775, 4096, 1, 4248]
    - [51, 0.0]
  - - [1980, 4096, 1, 1024]
    - [52, 0.0]
  - - [35, 4096, 1, 1980]
    - [53, 0.0]
  - - [3480, 4096, 1, 491]
    - [54, 0.0]
  - - [397, 4096, 1, 92]
    - [55, 0.0]
  - - [279, 4096, 1, 768]
    - [56, 0.0]
  - - [2440, 4096, 1, 128]
    - [57, 0.0]
  - - [128, 4096, 1, 272]
    - [58, 0.0]
  - - [256, 4096, 1, 120]
    - [59, 0.0]
  - - [450, 4096, 1, 1980]
    - [60, 0.0]
  - - [512, 4096, 1, 6048]
    - [61, 0.0]
  - - [128, 4096, 1, 5120]
    - [62, 0.0]
- null
- null
- DeviceEfficiency
- Equality
