projects/hipblaslt/library/src/amd_detail/rocblaslt/src/Tensile/Logic/asm_full/aquavanjaram/gfx942/Equality/aquavanjaram_Cijk_Alik_Bljk_S_MX_B_UserArgs.yaml
- {MinimumRequiredVersion: 4.33.0}
- aquavanjaram
- gfx942
- [Device 0049, Device 0050]
    SolutionIndex: 0
    SolutionNameMin: Cijk_Alik_Bljk_S_MX_B_UserArgs_MT16x128x8_MI16x16x1_SN_GRVWA2_GSU1_GSUC0_GSUWGMRR0_K1_MIWT1_8_NTA0_NTB0_SS0_SU0_SUM0_SUS0_SVW4_VWB4_WG16_4_1_WGM8_WGMXCC1_WGMXCCGn1
    SolutionIndex: 1
    SolutionNameMin: Cijk_Alik_Bljk_S_MX_B_UserArgs_MT16x128x8_MI16x16x1_SN_GRVWA2_GSU1_GSUC0_GSUWGMRR0_K1_MIWT1_8_NTA0_NTB0_SS0_SU8_SUM0_SUS32_SVW4_VWB4_WG16_4_1_WGM8_WGMXCC1_WGMXCCGn1
    SolutionIndex: 2
    SolutionNameMin: Cijk_Alik_Bljk_S_MX_B_UserArgs_MT128x64x16_MI16x16x1_SN_GSU1_GSUC0_GSUWGMRR0_K1_MIWT4_2_SU64_SUM0_SUS128_WGM0_WGMXCC8_WGMXCCGn1
    SolutionIndex: 3
    SolutionNameMin: Cijk_Alik_Bljk_S_MX_B_UserArgs_MT128x192x16_MI16x16x1_SN_GSU1_GSUC0_GSUWGMRR0_K1_MIWT4_6_SU16_SUM0_SUS64_WGM0_WGMXCC4_WGMXCCG0
    SolutionIndex: 4
    SolutionNameMin: Cijk_Alik_Bljk_S_MX_B_UserArgs_MT128x128x32_MI16x16x1_SN_GSU8_GSUC1_GSUWGMRR1_K1_MIWT4_4_SU2_SUM0_SUS128_WGM171_WGMXCC16_WGMXCCG0
    SolutionIndex: 5
    SolutionNameMin: Cijk_Alik_Bljk_S_MX_B_UserArgs_MT128x64x16_MI16x16x1_SN_GSU1_GSUC0_GSUWGMRR0_K1_LPA2_LPB2_LRVW2_MIWT4_2_SU64_SUM3_SUS512_WG32_8_1_WGM1_WGMXCC1_WGMXCCG2
    SolutionIndex: 6
    SolutionNameMin: Cijk_Alik_Bljk_S_MX_B_UserArgs_MT64x128x16_MI32x32x1_SN_GSU1_GSUC0_GSUWGMRR0_K1_MIWT1_2_SU2_SUM4_SUS128_WGM1_WGMXCC2_WGMXCCG0
    SolutionIndex: 7
    SolutionNameMin: Cijk_Alik_Bljk_S_MX_B_UserArgs_MT128x32x16_MI16x16x1_SN_GSU1_GSUC0_GSUWGMRR1_K1_MIWT4_2_SU2_SUM1_SUS256_WGM1_WGMXCC1_WGMXCCG16
    SolutionIndex: 8
    SolutionNameMin: Cijk_Alik_Bljk_S_MX_B_UserArgs_MT128x128x32_MI16x16x1_SN_GSU8_GSUC0_GSUWGMRR0_K1_MIWT4_4_SU2_SUM0_SUS128_WGM247_WGMXCC1_WGMXCCG12
    SolutionIndex: 9
    SolutionNameMin: Cijk_Alik_Bljk_S_MX_B_UserArgs_MT256x352x16_MI16x16x1_SN_GSU1_GSUC1_GSUWGMRR0_K1_MIWT8_11_SU32_SUM2_SUS64_WGM16_WGMXCC4_WGMXCCGn1
    SolutionIndex: 10
    SolutionNameMin: Cijk_Alik_Bljk_S_MX_B_UserArgs_MT32x128x16_MI32x32x1_SN_GSU1_GSUC0_GSUWGMRR1_K1_MIWT1_1_SU2_SUM4_SUS1024_WGM0_WGMXCC1_WGMXCCG2
    SolutionIndex: 11
    SolutionNameMin: Cijk_Alik_Bljk_S_MX_B_UserArgs_MT160x256x32_MI16x16x1_SN_GSU1_GSUC1_GSUWGMRR0_K1_MIWT5_8_SU4_SUM0_SUS128_WGM38_WGMXCC2_WGMXCCGn1
    SolutionIndex: 12
    SolutionNameMin: Cijk_Alik_Bljk_S_MX_B_UserArgs_MT128x288x32_MI16x16x1_SN_GSU1_GSUC0_GSUWGMRR1_K1_MIWT4_9_SU8_SUM0_SUS1024_WGM1_WGMXCC2_WGMXCCGn1
    SolutionIndex: 13
    SolutionNameMin: Cijk_Alik_Bljk_S_MX_B_UserArgs_MT64x128x32_MI32x32x1_SN_GSU1_GSUC1_GSUWGMRR1_K1_MIWT1_2_SU64_SUM0_SUS256_WGM0_WGMXCC8_WGMXCCG304
- - - [8, 128, 265302, 1]
    - [1, 0.57]
  - - [8, 128, 132090, 1]
    - [0, 0.56]
  - - [128, 61, 4096, 40]
    - [2, 0.0]
  - - [5120, 4096, 1, 128]
    - [3, 0.0]
  - - [128, 4096, 1, 11288]
    - [4, 0.0]
  - - [128, 33, 4096, 20]
    - [5, 0.0]
  - - [33, 128, 4096, 20]
    - [6, 0.0]
  - - [128, 30, 4096, 4]
    - [7, 0.0]
  - - [128, 4096, 1, 6048]
    - [8, 0.0]
  - - [6048, 4096, 1, 3024]
    - [9, 0.0]
  - - [30, 128, 4096, 4]
    - [10, 0.0]
  - - [3024, 4096, 1, 6048]
    - [11, 0.0]
  - - [2560, 4096, 1, 512]
    - [12, 0.0]
  - - [61, 128, 4096, 40]
    - [13, 0.0]
- null
- null
- DeviceEfficiency
- Equality
