projects/hipblaslt/library/src/amd_detail/rocblaslt/src/Tensile/Logic/asm_full/aquavanjaram/gfx942/Equality/aquavanjaram_Cijk_Alik_Bljk_HHS_BH_UserArgs.yaml
- {MinimumRequiredVersion: 4.33.0}
- aquavanjaram
- gfx942
- [Device 0049, Device 0050]
    SolutionIndex: 0
    SolutionNameMin: Cijk_Alik_Bljk_HHS_BH_MT128x128x64_MI32x32x1_SN_LDSB1_GRVWB8_GSU1_LBSPPA256_LBSPPB128_LPA8_LPB8_LRVW8_MIWT2_2_SVW2_VWA2_WG64_4_1
    SolutionIndex: 1
    SolutionNameMin: Cijk_Alik_Bljk_HHS_BH_MT128x64x64_MI16x16x1_SN_LDSB1_GRVWB8_GSU1_LBSPPA256_LBSPPB128_LPA16_LPB16_LRVW8_MIWT2_4_SVW2_VWA2_WG64_4_1
    SolutionIndex: 2
    SolutionNameMin: Cijk_Alik_Bljk_HHS_BH_MT256x224x64_MI16x16x1_SN_LDSB1_GRVWB4_GSU1_LBSPPA512_LBSPPB128_LPA8_LPB4_LRVW4_MIWT4_14_SVW4_VWA4_WG64_4_1
    SolutionIndex: 3
    SolutionNameMin: Cijk_Alik_Bljk_HHS_BH_MT128x64x128_MI16x16x1_SN_LDSB1_GRVWB8_GSU1_LBSPPA512_LBSPPB256_LPA16_LPB16_LRVW8_MIWT2_4_SVW2_VWA2_WG64_4_1
    SolutionIndex: 4
    SolutionNameMin: Cijk_Alik_Bljk_HHS_BH_MT256x256x32_MI32x32x1_SN_GSU1_LBSPPA256_LBSPPB256_MIWT4_4_VWA4_VWB4_WSGRA1_WSGRB1_WG64_4_1_WGM8
    SolutionIndex: 5
    SolutionNameMin: Cijk_Alik_Bljk_HHS_BH_MT256x192x64_MI16x16x1_SN_GSU1_LBSPPA512_LBSPPB128_LPA16_LPB8_MIWT8_6_SVW4_VWA4_VWB2_WG32_8_1_WGM1
    SolutionIndex: 6
    SolutionNameMin: Cijk_Alik_Bljk_HHS_BH_MT192x256x64_MI16x16x1_SN_GSU1_LBSPPA256_LBSPPB256_LPA16_LPB8_MIWT6_8_SVW2_VWA2_VWB4_WG32_8_1_WGM8
    SolutionIndex: 7
    SolutionNameMin: Cijk_Alik_Bljk_HHS_BH_MT192x256x64_MI16x16x1_SN_GSU1_LBSPPA256_LBSPPB256_LPA16_LPB8_MIWT6_8_SVW2_VWA2_VWB4_WG32_8_1_WGM1
    SolutionIndex: 8
    SolutionNameMin: Cijk_Alik_Bljk_HHS_BH_MT192x256x64_MI16x16x1_SN_GSU1_LBSPPA128_LBSPPB512_LPA8_LPB16_MIWT6_8_SVW2_VWA2_VWB4_WG32_8_1_WGM8
    SolutionIndex: 9
    SolutionNameMin: Cijk_Alik_Bljk_HHS_BH_MT192x256x64_MI16x16x1_SN_GRVWA4_GRVWB8_GSU1_LBSPPA512_LBSPPB128_LPA4_LPB8_LRVW4_MIWT12_4_MO40_SVW4_VWA4_VWB1_WG16_16_1_WGM8
    SolutionIndex: 10
    SolutionNameMin: Cijk_Alik_Bljk_HHS_BH_UserArgs_MT256x224x64_MI16x16x1_SN_GRVWA8_GRVWB2_GSU1_LBSPPA1024_LPA8_LPB4_LRVW4_MIWT8_7_NTC4_NTD4_SU8_SUM0_SUS256_SSO0_SVW8_VWA8_WG32_8_1_WGM16_WGMXCC4
    SolutionIndex: 11
    SolutionNameMin: Cijk_Alik_Bljk_HHS_BH_UserArgs_MT256x224x64_MI16x16x1_SN_GRVWA2_GRVWB2_GSU1_LBSPPA256_LPA4_LPB4_LRVW4_MIWT8_7_SU8_SUM0_SUS256_SSO0_SVW2_VWA2_WG32_8_1_WGM32
    SolutionIndex: 12
    SolutionNameMin: Cijk_Alik_Bljk_HHS_BH_UserArgs_MT32x16x256_MI16x16x1_SN_GRVWA8_GRVWB8_GSU1_LBSPPA512_LBSPPB512_LPA16_LPB16_LRVW8_MIWT1_1_NTA4_NTC0_NTD0_SU0_SUM0_SUS0_SVW1_VWA1_WG32_4_1_WGM1
    SolutionIndex: 13
    SolutionNameMin: Cijk_Alik_Bljk_HHS_BH_UserArgs_MT16x16x256_MI16x16x1_SN_LDSB0_GRVWA8_GRVWB8_GSU26_LBSPPA512_LBSPPB512_MIWT1_1_NLCA1_NLCB1_SU0_SUM0_SUS0_WG16_4_4_WGM1
    SolutionIndex: 14
    SolutionNameMin: Cijk_Alik_Bljk_HHS_BH_UserArgs_MT112x128x64_MI16x16x1_SN_GRVWA2_GRVWB8_GSU1_GSUC1_LBSPPA128_LBSPPB256_LPA16_LPB16_LRVW8_MIWT7_2_NTA0_SU8_SUM0_SUS256_SVW1_VWA1_VWB2_WG16_16_1_WGM1
    SolutionIndex: 15
    SolutionNameMin: Cijk_Alik_Bljk_HHS_BH_UserArgs_MT16x192x128_MI16x16x1_SN_GRVWA8_GRVWB8_GSU7_LBSPPA256_LBSPPB256_LPA16_LPB16_LRVW8_MIWT1_3_NTB4_NLCA1_NLCB1_SU0_SUM0_SUS0_SVW1_VWA1_VWB1_WG16_16_1_WGM1
    SolutionIndex: 16
    SolutionNameMin: Cijk_Alik_Bljk_HHS_BH_UserArgs_MT32x96x128_MI16x16x1_SN_GRVWA8_GRVWB8_GSU1_LBSPPA256_LBSPPB256_LPA16_LPB16_LRVW8_MIWT1_3_NTA0_SS0_SU8_SUM0_SUS256_SVW4_VWA1_VWB1_WG32_8_1_WGM8
    SolutionIndex: 17
    SolutionNameMin: Cijk_Alik_Bljk_HHS_BH_UserArgs_MT128x256x64_MI16x16x1_SN_GRVWA8_GRVWB2_GSU1_LBSPPA512_LBSPPB512_LPA16_LPB16_LRVW8_MIAV0_MIWT8_4_SS1_SU8_SUM0_SUS256_SVW4_VWA4_VWB4_WG16_16_1_WGM32
    SolutionIndex: 18
    SolutionNameMin: Cijk_Alik_Bljk_HHS_BH_UserArgs_MT256x224x32_MI16x16x1_SN_GRVWA8_GRVWB2_GSU1_LBSPPA256_LBSPPB128_LPA8_LPB4_LRVW4_MIAV0_MIWT4_14_SS1_SU0_SUM0_SUS0_SVW4_VWA4_VWB2_WG64_4_1_WGM1
    SolutionIndex: 19
    SolutionNameMin: Cijk_Alik_Bljk_HHS_BH_UserArgs_MT128x256x64_MI16x16x1_SN_GRVWA8_GRVWB8_GSU1_LBSPPA512_LBSPPB256_LPA16_LPB16_LRVW8_MIAV0_MIWT8_4_SS1_SU8_SUM0_SUS256_SVW4_VWA4_VWB2_WG16_16_1_WGM32
    SolutionIndex: 20
    SolutionNameMin: Cijk_Alik_Bljk_HHS_BH_UserArgs_MT128x16x128_MI16x16x1_SN_GRVWA8_GRVWB8_GSU1_LBSPPA2048_LBSPPB256_MIWT8_1_NTA0_NLCA1_NLCB1_SS1_SU8_SUM0_SUS256_SVW8_VWA8_WG16_4_4_WGM8
    SolutionIndex: 21
    SolutionNameMin: Cijk_Alik_Bljk_HHS_BH_UserArgs_MT64x16x128_MI16x16x1_SN_GRVWA8_GRVWB8_GSU1_LBSPPA512_LBSPPB256_MIWT2_1_NTA0_NLCA1_NLCB1_SS1_SU0_SUM0_SUS0_SVW2_VWA2_WG32_4_2_WGM16
    SolutionIndex: 22
    SolutionNameMin: Cijk_Alik_Bljk_HHS_BH_UserArgs_MT128x16x128_MI16x16x1_SN_GRVWA8_GRVWB8_GSU1_LBSPPA2048_LBSPPB256_MIWT8_1_NTA0_NLCA1_NLCB1_SS1_SU0_SUM0_SUS0_SVW8_VWA8_WG16_4_4_WGM16
    SolutionIndex: 23
    SolutionNameMin: Cijk_Alik_Bljk_HHS_BH_UserArgs_MT64x16x128_MI16x16x1_SN_GRVWA8_GRVWB2_GSU1_LBSPPA512_LBSPPB256_MIWT2_1_NTA0_NLCA1_NLCB1_SS1_SU8_SUM0_SUS256_SVW2_VWA2_WG32_4_2_WGM1
    SolutionIndex: 24
    SolutionNameMin: Cijk_Alik_Bljk_HHS_BH_UserArgs_MT128x128x64_MI16x16x1_SN_GRVWA8_GRVWB8_GSU1_LBSPPA512_LBSPPB512_LPA16_LPB16_LRVW8_MIWT4_4_NTC3_NTD3_SU0_SUM0_SUS0_SVW4_VWA4_VWB4_WG32_8_1_WGM1
    SolutionIndex: 25
    SolutionNameMin: Cijk_Alik_Bljk_HHS_BH_UserArgs_MT224x256x64_MI16x16x1_SN_GRVWA2_GRVWB2_GSU1_GSUC0_GSUWGMRR0_K1_LBSPPA128_LBSPPB256_LPA4_LPB4_LRVW4_MIAV0_MIWT7_8_NTA1_NTB1_NTC4_NTD4_SS1_SU32_SUM0_SUS2048_SPO0_SVW1_ULSGRO0_VWA1_VWB2_WSGRA2_WSGRB2_WG32_8_1_WGMn16
    SolutionIndex: 26
    SolutionNameMin: Cijk_Alik_Bljk_HHS_BH_UserArgs_MT224x128x64_MI16x16x1_SN_GRVWA8_GRVWB8_GSU1_GSUC0_GSUWGMRR0_K1_LBSPPA128_LBSPPB256_LPA16_LPB16_LRVW8_MIAV1_MIWT7_4_NTA1_NTB1_NTC0_NTD0_SS0_SU8_SUM0_SUS2048_SPO0_SVW4_ULSGRO0_VWA1_VWB2_WSGRA1_WSGRB1_WG32_8_1_WGM32
    SolutionIndex: 27
    SolutionNameMin: Cijk_Alik_Bljk_HHS_BH_UserArgs_MT256x192x64_MI16x16x1_SN_GRVWA8_GRVWB8_GSU1_GSUC0_GSUWGMRR0_K1_LBSPPA256_LBSPPB256_LPA16_LPB16_LRVW8_MIAV0_MIWT8_6_NTA3_NTB1_NTC4_NTD4_SS1_SU8_SUM0_SUS256_SPO0_SVW2_ULSGRO0_VWA2_VWB2_WSGRA1_WSGRB1_WG32_8_1_WGM0
    SolutionIndex: 28
    SolutionNameMin: Cijk_Alik_Bljk_HHS_BH_UserArgs_MT256x224x64_MI16x16x1_SN_GRVWA2_GRVWB2_GSU1_GSUC0_GSUWGMRR0_K1_LBSPPA1024_LBSPPB128_LPA4_LPB4_LRVW4_MIAV0_MIWT8_7_NTA0_NTB0_NTC0_NTD0_SS1_SU0_SUM0_SUS0_SPO0_SVW8_ULSGRO0_VWA8_VWB1_WSGRA0_WSGRB0_WG32_8_1_WGM1
    SolutionIndex: 29
    SolutionNameMin: Cijk_Alik_Bljk_HHS_BH_UserArgs_MT224x256x64_MI16x16x1_SN_GRVWA2_GRVWB8_GSU1_GSUC0_GSUWGMRR0_K1_LBSPPA256_LBSPPB256_LPA4_LPB8_LRVW4_MIAV0_MIWT14_4_NTA2_NTB2_NTC4_NTD4_SS1_SU8_SUM0_SUS1024_SPO1_SVW2_ULSGRO0_VWA2_VWB2_WSGRA1_WSGRB1_WG16_16_1_WGM32
    SolutionIndex: 30
    SolutionNameMin: Cijk_Alik_Bljk_HHS_BH_UserArgs_MT256x224x64_MI16x16x1_SN_GRVWA2_GRVWB2_GSU1_GSUC0_GSUWGMRR0_K1_LBSPPA1024_LBSPPB128_LPA4_LPB4_LRVW4_MIAV0_MIWT8_7_NTA0_NTB0_NTC0_NTD0_SS1_SU8_SUM0_SUS512_SPO1_SVW8_ULSGRO0_VWA8_VWB1_WSGRA0_WSGRB0_WG32_8_1_WGM1
    SolutionIndex: 31
    SolutionNameMin: Cijk_Alik_Bljk_HHS_BH_UserArgs_MT256x224x64_MI16x16x1_SN_GRVWA4_GRVWB8_GSU1_GSUC0_GSUWGMRR0_K1_LBSPPA1024_LBSPPB128_LPA4_LPB8_LRVW4_MIAV0_MIWT8_7_NTA0_NTB0_NTC0_NTD0_SS1_SU8_SUM0_SUS256_SPO0_SVW8_ULSGRO0_VWA8_VWB1_WSGRA0_WSGRB0_WG32_8_1_WGMn32
    SolutionIndex: 32
    SolutionNameMin: Cijk_Alik_Bljk_HHS_BH_UserArgs_MT64x256x32_MI16x16x1_SN_LDSB1_GRVWA8_GRVWB2_GSU1_GSUC0_GSUWGMRR0_K1_LBSPPA256_LBSPPB256_LPA8_LPB4_LRVW4_MIAV0_MIWT4_4_NEPBS16_SU0_SUM0_SUS0_SVW4_VWA4_VWB4_WG16_16_1_WGM1
    SolutionIndex: 33
    SolutionNameMin: Cijk_Alik_Bljk_HHS_BH_UserArgs_MT16x128x128_MI16x16x1_SN_GRVWA2_GRVWB8_GSU1_GSUC0_GSUWGMRR0_K1_MIWT1_2_PLR2_SU8_SUM0_SUS256_SPO0_SSO0_ULSGRO1_WGM1_WGMXCC1
    SolutionIndex: 34
    SolutionNameMin: Cijk_Alik_Bljk_HHS_BH_UserArgs_MT16x128x128_MI16x16x1_SN_GRVWA2_GRVWB8_GSU1_GSUC0_GSUWGMRR0_K1_MIWT1_2_PLR1_SU8_SUM0_SUS256_SPO1_SSO0_ULSGRO1_WGM1_WGMXCC1
    SolutionIndex: 35
    SolutionNameMin: Cijk_Alik_Bljk_HHS_BH_UserArgs_MT192x16x128_MI16x16x1_SN_GRVWB8_GSU1_GSUC0_GSUWGMRR0_K1_LBSPPA256_LBSPPB256_MIAV0_MIWT3_1_NTC3_NTD3_SU4_SUM0_SUS256_SSO0_SVW1_ULSGRO0_VWA1_WG64_4_1_WGM1
    SolutionIndex: 36
    SolutionNameMin: Cijk_Alik_Bljk_HHS_BH_UserArgs_MT128x16x128_MI16x16x1_SN_GRVWB2_GSU1_GSUC0_GSUWGMRR0_K1_LBSPPA512_LBSPPB256_MIAV1_MIWT2_1_NTC3_NTD3_SU8_SUM0_SUS256_SSO0_SVW2_ULSGRO1_VWA2_WG64_4_1_WGM1
    SolutionIndex: 37
    SolutionNameMin: Cijk_Alik_Bljk_HHS_BH_UserArgs_MT256x160x32_MI16x16x1_SN_GRVWA2_GRVWB2_GSU1_GSUC0_GSUWGMRR0_K1_LBSPPA512_LBSPPB128_LPA4_LPB4_LRVW4_MIWT8_5_SU8_SUM0_SUS256_SVW8_VWA8_VWB1_WG32_8_1_WGM16_WGMXCC1_WGMXCCGn1
    SolutionIndex: 38
    SolutionNameMin: Cijk_Alik_Bljk_HHS_BH_UserArgs_MT256x192x64_MI16x16x1_SN_GRVWA2_GRVWB2_GSU1_GSUC0_GSUWGMRR0_K1_LBSPPA1024_LBSPPB256_LPA16_LPB16_LRVW8_MIWT8_6_SU8_SUM0_SUS256_SVW8_VWA8_VWB2_WG32_8_1_WGM16_WGMXCC1_WGMXCCGn1
    SolutionIndex: 39
    SolutionNameMin: Cijk_Alik_Bljk_HHS_BH_UserArgs_MT192x256x64_MI16x16x1_SN_GRVWA8_GRVWB8_GSU1_GSUC0_GSUWGMRR0_K1_LBSPPA512_LBSPPB512_LPA16_LPB16_LRVW8_MIWT12_4_SU8_SUM0_SUS256_SVW4_VWA4_VWB4_WG16_16_1_WGM16_WGMXCC1_WGMXCCGn1
    SolutionIndex: 40
    SolutionNameMin: Cijk_Alik_Bljk_HHS_BH_UserArgs_MT128x224x64_MI16x16x1_SN_GSU1_GSUC0_GSUWGMRR0_K1_MIWT4_7_SU0_SUM0_SUS0_WGM8_WGMXCC4_WGMXCCGn1
    SolutionIndex: 41
    SolutionNameMin: Cijk_Alik_Bljk_HHS_BH_UserArgs_MT256x224x64_MI16x16x1_SN_GSU1_GSUC0_GSUWGMRR0_K1_MIWT8_7_SU8_SUM0_SUS512_WGM1_WGMXCC1_WGMXCCGn1
    SolutionIndex: 42
    SolutionNameMin: Cijk_Alik_Bljk_HHS_BH_UserArgs_MT192x256x64_MI16x16x1_SN_GSU1_GSUC0_GSUWGMRR0_K1_MIWT12_4_SU8_SUM0_SUS256_WGM16_WGMXCC1_WGMXCCGn1
    SolutionIndex: 43
    SolutionNameMin: Cijk_Alik_Bljk_HHS_BH_UserArgs_MT64x64x128_MI16x16x1_SN_GSU1_GSUC0_GSUWGMRR1_K1_MIWT2_2_SU4_SUM1_SUS512_WGM0_WGMXCC4_WGMXCCG0
    SolutionIndex: 44
    SolutionNameMin: Cijk_Alik_Bljk_HHS_BH_UserArgs_MT128x128x64_MI16x16x1_SN_GSU1_GSUC0_GSUWGMRR0_K1_MIWT2_8_SU2_SUM0_SUS128_WGM8_WGMXCC8_WGMXCCG0
    SolutionIndex: 45
    SolutionNameMin: Cijk_Alik_Bljk_HHS_BH_UserArgs_MT256x192x64_MI16x16x1_SN_GSU1_GSUC1_GSUWGMRR0_K1_MIWT8_6_SU2_SUM0_SUS1024_WGM1_WGMXCC1_WGMXCCGn1
    SolutionIndex: 46
    SolutionNameMin: Cijk_Alik_Bljk_HHS_BH_UserArgs_MT128x96x64_MI16x16x1_SN_GSU1_GSUC0_GSUWGMRR0_K1_MIWT4_3_SU4_SUM0_SUS128_WGM2_WGMXCC1_WGMXCCG19
    SolutionIndex: 47
    SolutionNameMin: Cijk_Alik_Bljk_HHS_BH_UserArgs_MT64x32x256_MI16x16x1_SN_GSU1_GSUC0_GSUWGMRR0_K1_MIWT2_1_SU2_SUM3_SUS1024_WGM0_WGMXCC32_WGMXCCG0
    SolutionIndex: 48
    SolutionNameMin: Cijk_Alik_Bljk_HHS_BH_UserArgs_MT160x128x64_MI16x16x1_SN_GSU1_GSUC0_GSUWGMRR0_K1_MIWT5_4_SU4_SUM0_SUS256_WGM48_WGMXCC4_WGMXCCG0
    SolutionIndex: 49
    SolutionNameMin: Cijk_Alik_Bljk_HHS_BH_UserArgs_MT128x64x128_MI16x16x1_SN_GSU1_GSUC0_GSUWGMRR1_K1_MIWT4_2_SU4_SUM0_SUS512_WGM114_WGMXCC1_WGMXCCGn1
    SolutionIndex: 50
    SolutionNameMin: Cijk_Alik_Bljk_HHS_BH_UserArgs_MT160x192x64_MI16x16x1_SN_GSU2_GSUC0_GSUWGMRR0_K1_MIWT10_3_SU2_SUM0_SUS256_WGM4_WGMXCC8_WGMXCCGn1
    SolutionIndex: 51
    SolutionNameMin: Cijk_Alik_Bljk_HHS_BH_UserArgs_MT256x128x64_MI16x16x1_SN_GSU1_GSUC0_GSUWGMRR0_K1_MIWT4_8_SU4_SUM0_SUS256_WGM38_WGMXCC4_WGMXCCG0
    SolutionIndex: 52
    SolutionNameMin: Cijk_Alik_Bljk_HHS_BH_UserArgs_MT224x128x64_MI16x16x1_SN_GSU1_GSUC1_GSUWGMRR0_K1_MIWT7_4_SU32_SUM0_SUS2048_WGM209_WGMXCC1_WGMXCCG228
    SolutionIndex: 53
    SolutionNameMin: Cijk_Alik_Bljk_HHS_BH_UserArgs_MT96x128x128_MI16x16x1_SN_GSU1_GSUC0_GSUWGMRR0_K1_MIWT3_4_SU8_SUM0_SUS512_WGM2_WGMXCC1_WGMXCCGn1
    SolutionIndex: 54
    SolutionNameMin: Cijk_Alik_Bljk_HHS_BH_UserArgs_MT192x256x64_MI16x16x1_SN_GSU4_GSUC0_GSUWGMRR1_K1_MIWT6_8_SU4_SUM0_SUS128_WGM12_WGMXCC4_WGMXCCGn1
    SolutionIndex: 55
    SolutionNameMin: Cijk_Alik_Bljk_HHS_BH_UserArgs_MT128x128x64_MI16x16x1_SN_GSU1_GSUC1_GSUWGMRR1_K1_MIWT4_4_SU8_SUM0_SUS128_WGM0_WGMXCC4_WGMXCCGn1
    SolutionIndex: 56
    SolutionNameMin: Cijk_Alik_Bljk_HHS_BH_UserArgs_MT64x64x128_MI16x16x1_SN_GSU1_GSUC0_GSUWGMRR0_K1_MIWT2_2_SU8_SUM0_SUS2048_WGM8_WGMXCC1_WGMXCCG0
    SolutionIndex: 57
    SolutionNameMin: Cijk_Alik_Bljk_HHS_BH_UserArgs_MT128x64x128_MI16x16x1_SN_GSU1_GSUC1_GSUWGMRR1_K1_MIWT4_2_SU2_SUM0_SUS256_WGM38_WGMXCC1_WGMXCCG247
    SolutionIndex: 58
    SolutionNameMin: Cijk_Alik_Bljk_HHS_BH_UserArgs_MT224x128x64_MI16x16x1_SN_GSU1_GSUC1_GSUWGMRR0_K1_MIWT7_4_SU8_SUM0_SUS2048_WGM228_WGMXCC2_WGMXCCGn1
    SolutionIndex: 59
    SolutionNameMin: Cijk_Alik_Bljk_HHS_BH_UserArgs_MT64x64x128_MI16x16x1_SN_GSU1_GSUC0_GSUWGMRR0_K1_MIWT2_2_SU8_SUM3_SUS1024_WGM0_WGMXCC4_WGMXCCG0
    SolutionIndex: 60
    SolutionNameMin: Cijk_Alik_Bljk_HHS_BH_UserArgs_MT128x128x64_MI16x16x1_SN_GSU1_GSUC1_GSUWGMRR1_K1_MIWT4_4_SU4_SUM0_SUS128_WGM2_WGMXCC1_WGMXCCGn1
    SolutionIndex: 61
    SolutionNameMin: Cijk_Alik_Bljk_HHS_BH_UserArgs_MT32x32x256_MI16x16x1_SN_GSU1_GSUC0_GSUWGMRR0_K1_MIWT1_1_SU2_SUM0_SUS1024_WGM1_WGMXCC32_WGMXCCG0
    SolutionIndex: 62
    SolutionNameMin: Cijk_Alik_Bljk_HHS_BH_UserArgs_MT384x224x32_MI16x16x1_SN_GSU1_GSUC1_GSUWGMRR1_K1_MIWT6_14_SU16_SUM0_SUS64_WGM4_WGMXCC1_WGMXCCGn1
    SolutionIndex: 63
    SolutionNameMin: Cijk_Alik_Bljk_HHS_BH_UserArgs_MT64x32x256_MI16x16x1_SN_GSU1_GSUC0_GSUWGMRR0_K1_MIWT2_2_SU2_SUM0_SUS512_WGM0_WGMXCC8_WGMXCCG0
    SolutionIndex: 64
    SolutionNameMin: Cijk_Alik_Bljk_HHS_BH_UserArgs_MT128x128x64_MI16x16x1_SN_GSU1_GSUC1_GSUWGMRR0_K1_MIWT4_4_SU8_SUM1_SUS128_WGM1_WGMXCC4_WGMXCCG0
    SolutionIndex: 65
    SolutionNameMin: Cijk_Alik_Bljk_HHS_BH_UserArgs_MT192x128x32_MI16x16x1_SN_GSU1_GSUC0_GSUWGMRR0_K1_MIWT12_2_SU2_SUM0_SUS64_WGM0_WGMXCC32_WGMXCCG0
    SolutionIndex: 66
    SolutionNameMin: Cijk_Alik_Bljk_HHS_BH_UserArgs_MT64x32x256_MI16x16x1_SN_GSU1_GSUC0_GSUWGMRR1_K1_MIWT2_1_SU2_SUM0_SUS512_WGM1_WGMXCC8_WGMXCCG0
    SolutionIndex: 67
    SolutionNameMin: Cijk_Alik_Bljk_HHS_BH_UserArgs_MT224x128x64_MI16x16x1_SN_GSU1_GSUC1_GSUWGMRR0_K1_MIWT7_4_SU8_SUM0_SUS1024_WGM1_WGMXCC16_WGMXCCGn1
    SolutionIndex: 68
    SolutionNameMin: Cijk_Alik_Bljk_HHS_BH_UserArgs_MT224x128x64_MI16x16x1_SN_GSU1_GSUC0_GSUWGMRR1_K1_MIWT7_4_SU16_SUM0_SUS1024_WGM4_WGMXCC1_WGMXCCGn1
    SolutionIndex: 69
    SolutionNameMin: Cijk_Alik_Bljk_HHS_BH_UserArgs_MT128x96x128_MI16x16x1_SN_GSU1_GSUC0_GSUWGMRR1_K1_MIWT4_3_SU2_SUM1_SUS2048_WGM6_WGMXCC8_WGMXCCG0
    SolutionIndex: 70
    SolutionNameMin: Cijk_Alik_Bljk_HHS_BH_UserArgs_MT128x64x128_MI16x16x1_SN_GSU1_GSUC0_GSUWGMRR0_K1_MIWT4_2_SU4_SUM0_SUS512_WGM0_WGMXCC4_WGMXCCG0
    SolutionIndex: 71
    SolutionNameMin: Cijk_Alik_Bljk_HHS_BH_UserArgs_MT128x64x128_MI16x16x1_SN_GSU1_GSUC0_GSUWGMRR0_K1_MIWT4_2_SU64_SUM3_SUS512_WGM4_WGMXCC1_WGMXCCG76
    SolutionIndex: 72
    SolutionNameMin: Cijk_Alik_Bljk_HHS_BH_UserArgs_MT128x256x64_MI16x16x1_SN_GSU1_GSUC0_GSUWGMRR0_K1_MIWT4_8_SU0_SUM0_SUS0_WGM2_WGMXCC16_WGMXCCG0
    SolutionIndex: 73
    SolutionNameMin: Cijk_Alik_Bljk_HHS_BH_UserArgs_MT192x160x64_MI16x16x1_SN_GSU2_GSUC0_GSUWGMRR0_K1_MIWT6_5_SU4_SUM0_SUS128_WGM209_WGMXCC4_WGMXCCGn1
    SolutionIndex: 74
    SolutionNameMin: Cijk_Alik_Bljk_HHS_BH_UserArgs_MT128x112x128_MI16x16x1_SN_GSU1_GSUC0_GSUWGMRR0_K1_MIWT2_7_SU4_SUM0_SUS256_WGM1_WGMXCC2_WGMXCCG0
    SolutionIndex: 75
    SolutionNameMin: Cijk_Alik_Bljk_HHS_BH_UserArgs_MT96x64x128_MI16x16x1_SN_GSU1_GSUC0_GSUWGMRR1_K1_MIWT3_2_SU16_SUM0_SUS256_WGM32_WGMXCC2_WGMXCCGn1
    SolutionIndex: 76
    SolutionNameMin: Cijk_Alik_Bljk_HHS_BH_UserArgs_MT64x96x128_MI16x16x1_SN_GSU1_GSUC0_GSUWGMRR0_K1_MIWT2_3_SU4_SUM3_SUS1024_WGM16_WGMXCC1_WGMXCCGn1
    SolutionIndex: 77
    SolutionNameMin: Cijk_Alik_Bljk_HHS_BH_UserArgs_MT192x256x64_MI16x16x1_SN_GSU1_GSUC0_GSUWGMRR1_K1_MIWT12_4_SU2_SUM1_SUS512_WGM285_WGMXCC4_WGMXCCG0
    SolutionIndex: 78
    SolutionNameMin: Cijk_Alik_Bljk_HHS_BH_UserArgs_MT128x96x64_MI16x16x1_SN_GSU1_GSUC1_GSUWGMRR1_K1_LPA16_LPB16_MIWT4_3_SU2_SUM0_SUS256_WG32_8_1_WGM1_WGMXCC4_WGMXCCGn1
    SolutionIndex: 79
    SolutionNameMin: Cijk_Alik_Bljk_HHS_BH_UserArgs_MT128x64x128_MI16x16x1_SN_GSU1_GSUC0_GSUWGMRR1_K1_MIWT4_2_SU64_SUM0_SUS256_WGM4_WGMXCC1_WGMXCCGn1
    SolutionIndex: 80
    SolutionNameMin: Cijk_Alik_Bljk_HHS_BH_UserArgs_MT64x352x64_MI16x16x1_SN_GSU1_GSUC0_GSUWGMRR0_K1_MIWT2_11_SU4_SUM4_SUS512_WGM114_WGMXCC16_WGMXCCGn1
    SolutionIndex: 81
    SolutionNameMin: Cijk_Alik_Bljk_HHS_BH_UserArgs_MT192x128x64_MI16x16x1_SN_GSU1_GSUC0_GSUWGMRR1_K1_MIWT6_4_SU2_SUM1_SUS128_WGM4_WGMXCC16_WGMXCCGn1
    SolutionIndex: 82
    SolutionNameMin: Cijk_Alik_Bljk_HHS_BH_UserArgs_MT48x64x128_MI16x16x1_SN_GSU8_GSUC1_GSUWGMRR0_K1_MIWT3_1_SU2_SUM0_SUS256_WGM0_WGMXCC1_WGMXCCG8
    SolutionIndex: 83
    SolutionNameMin: Cijk_Alik_Bljk_HHS_BH_UserArgs_MT192x128x64_MI16x16x1_SN_GSU1_GSUC1_GSUWGMRR1_K1_MIWT6_4_SU4_SUM0_SUS512_WGM2_WGMXCC1_WGMXCCGn1
    SolutionIndex: 84
    SolutionNameMin: Cijk_Alik_Bljk_HHS_BH_UserArgs_MT128x96x64_MI16x16x1_SN_GSU1_GSUC0_GSUWGMRR0_K1_MIWT4_3_SU32_SUM2_SUS1024_WGM0_WGMXCC4_WGMXCCG0
    SolutionIndex: 85
    SolutionNameMin: Cijk_Alik_Bljk_HHS_BH_UserArgs_MT128x128x64_MI16x16x1_SN_GSU1_GSUC0_GSUWGMRR1_K1_MIWT2_8_SU2_SUM0_SUS256_WGM8_WGMXCC8_WGMXCCG0
    SolutionIndex: 86
    SolutionNameMin: Cijk_Alik_Bljk_HHS_BH_UserArgs_MT128x128x64_MI16x16x1_SN_GSU1_GSUC0_GSUWGMRR1_K1_MIWT2_8_SU4_SUM3_SUS128_WGM266_WGMXCC4_WGMXCCGn1
    SolutionIndex: 87
    SolutionNameMin: Cijk_Alik_Bljk_HHS_BH_UserArgs_MT128x64x128_MI16x16x1_SN_GSU1_GSUC1_GSUWGMRR0_K1_MIWT2_4_SU0_SUM0_SUS0_WGM228_WGMXCC1_WGMXCCG114
    SolutionIndex: 88
    SolutionNameMin: Cijk_Alik_Bljk_HHS_BH_UserArgs_MT64x64x128_MI16x16x1_SN_GSU1_GSUC0_GSUWGMRR0_K1_MIWT2_2_SU2_SUM0_SUS256_WGM1_WGMXCC32_WGMXCCG0
    SolutionIndex: 89
    SolutionNameMin: Cijk_Alik_Bljk_HHS_BH_UserArgs_MT64x64x128_MI16x16x1_SN_GSU1_GSUC0_GSUWGMRR0_K1_MIWT2_2_SU8_SUM0_SUS256_WGM16_WGMXCC1_WGMXCCGn1
    SolutionIndex: 90
    SolutionNameMin: Cijk_Alik_Bljk_HHS_BH_UserArgs_MT128x128x64_MI16x16x1_SN_GSU1_GSUC0_GSUWGMRR1_K1_MIWT4_4_SU2_SUM2_SUS512_WGM1_WGMXCC32_WGMXCCG0
    SolutionIndex: 91
    SolutionNameMin: Cijk_Alik_Bljk_HHS_BH_UserArgs_MT128x128x64_MI16x16x1_SN_GSU1_GSUC0_GSUWGMRR1_K1_MIWT4_4_SU2_SUM1_SUS128_WGM0_WGMXCC32_WGMXCCG0
    SolutionIndex: 92
    SolutionNameMin: Cijk_Alik_Bljk_HHS_BH_UserArgs_MT96x256x64_MI16x16x1_SN_GSU1_GSUC0_GSUWGMRR0_K1_MIWT6_4_SU2_SUM1_SUS256_WGM38_WGMXCC4_WGMXCCG0
    SolutionIndex: 93
    SolutionNameMin: Cijk_Alik_Bljk_HHS_BH_UserArgs_MT256x160x64_MI16x16x1_SN_GSU1_GSUC0_GSUWGMRR1_K1_MIWT8_5_SU2_SUM0_SUS128_WGM1_WGMXCC1_WGMXCCGn1
    SolutionIndex: 94
    SolutionNameMin: Cijk_Alik_Bljk_HHS_BH_UserArgs_MT256x192x64_MI16x16x1_SN_GSU1_GSUC0_GSUWGMRR0_K1_MIWT8_6_SU16_SUM0_SUS128_WGM0_WGMXCC1_WGMXCCGn1
    SolutionIndex: 95
    SolutionNameMin: Cijk_Alik_Bljk_HHS_BH_UserArgs_MT128x128x64_MI16x16x1_SN_GSU4_GSUC0_GSUWGMRR1_K1_MIWT4_4_SU64_SUM0_SUS512_WGM8_WGMXCC1_WGMXCCGn1
    SolutionIndex: 96
    SolutionNameMin: Cijk_Alik_Bljk_HHS_BH_UserArgs_MT64x64x128_MI16x16x1_SN_GSU1_GSUC0_GSUWGMRR0_K1_MIWT2_2_SU0_SUM0_SUS0_WGM8_WGMXCC1_WGMXCCGn1
    SolutionIndex: 97
    SolutionNameMin: Cijk_Alik_Bljk_HHS_BH_UserArgs_MT128x128x64_MI16x16x1_SN_GSU1_GSUC1_GSUWGMRR0_K1_MIWT8_2_SU4_SUM0_SUS256_WGM1_WGMXCC8_WGMXCCG0
    SolutionIndex: 98
    SolutionNameMin: Cijk_Alik_Bljk_HHS_BH_UserArgs_MT32x32x128_MI16x16x1_SN_GSU1_GSUC0_GSUWGMRR0_K1_LPA16_LPB16_MIWT1_1_SU2_SUM1_SUS2048_WG32_8_1_WGM1_WGMXCC8_WGMXCCG0
    SolutionIndex: 99
    SolutionNameMin: Cijk_Alik_Bljk_HHS_BH_UserArgs_MT128x96x128_MI16x16x1_SN_GSU1_GSUC1_GSUWGMRR1_K1_MIWT4_3_SU2_SUM0_SUS1024_WGM2_WGMXCC1_WGMXCCGn1
    SolutionIndex: 100
    SolutionNameMin: Cijk_Alik_Bljk_HHS_BH_UserArgs_MT64x32x256_MI16x16x1_SN_GSU1_GSUC0_GSUWGMRR1_K1_MIWT2_1_SU2_SUM0_SUS2048_WGM0_WGMXCC16_WGMXCCG0
    SolutionIndex: 101
    SolutionNameMin: Cijk_Alik_Bljk_HHS_BH_UserArgs_MT128x96x64_MI16x16x1_SN_GSU1_GSUC1_GSUWGMRR0_K1_LPA16_LPB16_MIWT4_3_SU4_SUM3_SUS128_WG32_8_1_WGM2_WGMXCC1_WGMXCCGn1
    SolutionIndex: 102
    SolutionNameMin: Cijk_Alik_Bljk_HHS_BH_UserArgs_MT96x128x64_MI16x16x1_SN_GSU1_GSUC0_GSUWGMRR0_K1_LPA16_LPB16_MIWT3_4_SU4_SUM0_SUS2048_WG32_8_1_WGM190_WGMXCC2_WGMXCCGn1
    SolutionIndex: 103
    SolutionNameMin: Cijk_Alik_Bljk_HHS_BH_UserArgs_MT128x256x64_MI16x16x1_SN_GSU1_GSUC0_GSUWGMRR0_K1_MIWT2_16_SU2_SUM0_SUS128_WGM2_WGMXCC8_WGMXCCG304
    SolutionIndex: 104
    SolutionNameMin: Cijk_Alik_Bljk_HHS_BH_UserArgs_MT256x96x64_MI16x16x1_SN_GSU1_GSUC0_GSUWGMRR1_K1_MIWT4_6_SU2_SUM3_SUS128_WGM1_WGMXCC1_WGMXCCG0
    SolutionIndex: 105
    SolutionNameMin: Cijk_Alik_Bljk_HHS_BH_UserArgs_MT128x128x64_MI16x16x1_SN_GSU1_GSUC0_GSUWGMRR1_K1_MIWT4_4_SU8_SUM0_SUS2048_WGM247_WGMXCC2_WGMXCCG0
    SolutionIndex: 106
    SolutionNameMin: Cijk_Alik_Bljk_HHS_BH_UserArgs_MT192x128x64_MI16x16x1_SN_GSU1_GSUC0_GSUWGMRR1_K1_MIWT6_4_SU8_SUM0_SUS128_WGM0_WGMXCC32_WGMXCCG0
    SolutionIndex: 107
    SolutionNameMin: Cijk_Alik_Bljk_HHS_BH_UserArgs_MT64x64x128_MI16x16x1_SN_GSU1_GSUC0_GSUWGMRR1_K1_MIWT2_2_SU4_SUM1_SUS2048_WGM0_WGMXCC16_WGMXCCG0
    SolutionIndex: 108
    SolutionNameMin: Cijk_Alik_Bljk_HHS_BH_UserArgs_MT256x128x64_MI16x16x1_SN_GSU1_GSUC1_GSUWGMRR1_K1_MIWT4_8_SU4_SUM0_SUS128_WGM4_WGMXCC1_WGMXCCGn1
    SolutionIndex: 109
    SolutionNameMin: Cijk_Alik_Bljk_HHS_BH_UserArgs_MT128x128x64_MI16x16x1_SN_GSU1_GSUC0_GSUWGMRR1_K1_MIWT8_2_SU4_SUM0_SUS128_WGM0_WGMXCC32_WGMXCCG0
    SolutionIndex: 110
    SolutionNameMin: Cijk_Alik_Bljk_HHS_BH_UserArgs_MT128x128x64_MI16x16x1_SN_GSU1_GSUC0_GSUWGMRR1_K1_MIWT4_4_SU4_SUM4_SUS128_WGM1_WGMXCC32_WGMXCCG0
    SolutionIndex: 111
    SolutionNameMin: Cijk_Alik_Bljk_HHS_BH_UserArgs_MT160x128x64_MI16x16x1_SN_GSU1_GSUC0_GSUWGMRR0_K1_MIWT10_2_SU16_SUM0_SUS128_WGM2_WGMXCC1_WGMXCCGn1
    SolutionIndex: 112
    SolutionNameMin: Cijk_Alik_Bljk_HHS_BH_UserArgs_MT64x32x256_MI16x16x1_SN_GSU1_GSUC0_GSUWGMRR0_K1_MIWT1_2_SU4_SUM1_SUS1024_WGM0_WGMXCC16_WGMXCCG0
    SolutionIndex: 113
    SolutionNameMin: Cijk_Alik_Bljk_HHS_BH_UserArgs_MT64x64x128_MI16x16x1_SN_GSU1_GSUC0_GSUWGMRR1_K1_MIWT2_2_SU16_SUM2_SUS2048_WGM4_WGMXCC1_WGMXCCGn1
    SolutionIndex: 114
    SolutionNameMin: Cijk_Alik_Bljk_HHS_BH_UserArgs_MT96x64x128_MI16x16x1_SN_GSU1_GSUC0_GSUWGMRR1_K1_MIWT3_2_SU0_SUM0_SUS0_WGM76_WGMXCC1_WGMXCCGn1
    SolutionIndex: 115
    SolutionNameMin: Cijk_Alik_Bljk_HHS_BH_UserArgs_MT128x128x64_MI16x16x1_SN_GSU1_GSUC1_GSUWGMRR1_K1_MIWT4_4_SU4_SUM1_SUS128_WGM4_WGMXCC1_WGMXCCG247
    SolutionIndex: 116
    SolutionNameMin: Cijk_Alik_Bljk_HHS_BH_UserArgs_MT128x160x64_MI16x16x1_SN_GSU1_GSUC1_GSUWGMRR0_K1_MIWT4_5_SU32_SUM2_SUS512_WGM2_WGMXCC8_WGMXCCG32
    SolutionIndex: 117
    SolutionNameMin: Cijk_Alik_Bljk_HHS_BH_UserArgs_MT128x96x64_MI16x16x1_SN_GSU1_GSUC0_GSUWGMRR0_K1_LPA16_LPB16_MIWT4_3_SU8_SUM1_SUS512_WG32_8_1_WGM0_WGMXCC1_WGMXCCGn1
    SolutionIndex: 118
    SolutionNameMin: Cijk_Alik_Bljk_HHS_BH_UserArgs_MT128x64x128_MI16x16x1_SN_GSU1_GSUC0_GSUWGMRR0_K1_MIWT4_2_SU4_SUM0_SUS256_WGM1_WGMXCC2_WGMXCCG16
    SolutionIndex: 119
    SolutionNameMin: Cijk_Alik_Bljk_HHS_BH_UserArgs_MT96x128x64_MI16x16x1_SN_GSU2_GSUC0_GSUWGMRR0_K1_LPA16_LPB16_MIWT3_4_SU4_SUM0_SUS512_WG32_8_1_WGM0_WGMXCC32_WGMXCCG0
    SolutionIndex: 120
    SolutionNameMin: Cijk_Alik_Bljk_HHS_BH_UserArgs_MT192x128x64_MI16x16x1_SN_GSU1_GSUC1_GSUWGMRR1_K1_MIWT6_4_SU16_SUM0_SUS256_WGM0_WGMXCC2_WGMXCCGn1
    SolutionIndex: 121
    SolutionNameMin: Cijk_Alik_Bljk_HHS_BH_UserArgs_MT128x128x64_MI16x16x1_SN_GSU1_GSUC0_GSUWGMRR1_K1_MIWT4_4_SU4_SUM2_SUS256_WGM0_WGMXCC4_WGMXCCG0
    SolutionIndex: 122
    SolutionNameMin: Cijk_Alik_Bljk_HHS_BH_UserArgs_MT128x128x64_MI16x16x1_SN_GSU1_GSUC0_GSUWGMRR0_K1_MIWT8_2_SU16_SUM0_SUS128_WGM1_WGMXCC32_WGMXCCG0
    SolutionIndex: 123
    SolutionNameMin: Cijk_Alik_Bljk_HHS_BH_UserArgs_MT192x128x64_MI16x16x1_SN_GSU1_GSUC0_GSUWGMRR0_K1_MIWT6_4_SU4_SUM0_SUS128_WGM1_WGMXCC32_WGMXCCG0
    SolutionIndex: 124
    SolutionNameMin: Cijk_Alik_Bljk_HHS_BH_UserArgs_MT192x128x64_MI16x16x1_SN_GSU4_GSUC0_GSUWGMRR1_K1_MIWT3_8_SU2_SUM0_SUS128_WGM4_WGMXCC1_WGMXCCGn1
    SolutionIndex: 125
    SolutionNameMin: Cijk_Alik_Bljk_HHS_BH_UserArgs_MT192x128x64_MI16x16x1_SN_GSU1_GSUC1_GSUWGMRR0_K1_MIWT6_4_SU4_SUM0_SUS256_WGM2_WGMXCC1_WGMXCCGn1
    SolutionIndex: 126
    SolutionNameMin: Cijk_Alik_Bljk_HHS_BH_UserArgs_MT128x64x128_MI16x16x1_SN_GSU1_GSUC1_GSUWGMRR0_K1_MIWT4_2_SU0_SUM0_SUS0_WGM171_WGMXCC2_WGMXCCG32
    SolutionIndex: 127
    SolutionNameMin: Cijk_Alik_Bljk_HHS_BH_UserArgs_MT192x160x64_MI16x16x1_SN_GSU2_GSUC1_GSUWGMRR0_K1_MIWT6_5_SU4_SUM1_SUS128_WGM0_WGMXCC4_WGMXCCGn1
    SolutionIndex: 128
    SolutionNameMin: Cijk_Alik_Bljk_HHS_BH_UserArgs_MT224x256x64_MI16x16x1_SN_GSU1_GSUC0_GSUWGMRR0_K1_MIWT7_8_SU4_SUM0_SUS2048_WGM2_WGMXCC16_WGMXCCG0
    SolutionIndex: 129
    SolutionNameMin: Cijk_Alik_Bljk_HHS_BH_UserArgs_MT128x64x128_MI16x16x1_SN_GSU1_GSUC0_GSUWGMRR1_K1_MIWT4_2_SU0_SUM0_SUS0_WGM266_WGMXCC1_WGMXCCGn1
    SolutionIndex: 130
    SolutionNameMin: Cijk_Alik_Bljk_HHS_BH_Bias_HAS_SAV_UserArgs_MT256x128x64_MI16x16x1_SN_LDSB1_GRVWA8_GRVWB8_GSU1_GSUC0_GSUWGMRR0_K1_LBSPPA1024_LBSPPB512_LPA16_LPB16_LRVW8_MIWT8_4_SU8_SUM1_SUS128_SVW8_VWA8_VWB4_WG32_8_1_WGM6_WGMXCC8_WGMXCCG304
    SolutionIndex: 131
    SolutionNameMin: Cijk_Alik_Bljk_HHS_BH_UserArgs_MT128x128x64_MI16x16x1_SN_GSU1_GSUC0_GSUWGMRR1_K1_MIWT4_4_SU2_SUM1_SUS128_WGM0_WGMXCC32_WGMXCCG0
    SolutionIndex: 132
    SolutionNameMin: Cijk_Alik_Bljk_HHS_BH_Bias_HAS_SAV_UserArgs_MT192x256x64_MI16x16x1_SN_LDSB1_GRVWA8_GRVWB8_GSU1_GSUC0_GSUWGMRR0_K1_LBSPPA512_LBSPPB512_LPA16_LPB16_LRVW8_MIWT12_4_SU8_SUM1_SUS128_SVW4_VWA4_VWB4_WG16_16_1_WGM6_WGMXCC8_WGMXCCG304
    SolutionIndex: 133
    SolutionNameMin: Cijk_Alik_Bljk_HHS_BH_Bias_HAS_SAV_UserArgs_MT256x192x64_MI16x16x1_SN_LDSB1_GRVWA8_GRVWB8_GSU1_GSUAMB_GSUC0_GSUWGMRR0_K1_LBSPPA1024_LBSPPB256_LPA16_LPB16_LRVW8_MIWT8_6_NTB0_NTD4_NEPBS16_SU16_SUM0_SUS128_SVW8_VWA8_VWB2_WG32_8_1_WGM6_WGMXCC8_WGMXCCG304
    SolutionIndex: 134
    SolutionNameMin: Cijk_Alik_Bljk_HHS_BH_Bias_HAS_SAV_UserArgs_MT192x256x64_MI16x16x1_SN_LDSB1_GRVWA8_GRVWB8_GSU1_GSUC0_GSUWGMRR0_K1_LBSPPA512_LBSPPB512_LPA16_LPB16_LRVW8_MIWT12_4_NTB0_SU8_SUM1_SUS128_SVW4_VWA4_VWB4_WG16_16_1_WGM6_WGMXCC8_WGMXCCG304
    SolutionIndex: 135
    SolutionNameMin: Cijk_Alik_Bljk_HHS_BH_Bias_HAS_SAV_UserArgs_MT256x192x64_MI16x16x1_SN_LDSB1_GRVWA8_GRVWB8_GSU1_GSUAMB_GSUC0_GSUWGMRR0_K1_LBSPPA1024_LBSPPB256_LPA16_LPB16_LRVW8_MIWT8_6_NTD4_NEPBS16_SU16_SUM0_SUS128_SVW8_VWA8_VWB2_WG32_8_1_WGM6_WGMXCC8_WGMXCCG304
- - - [512, 512, 1, 512]
    - [1, 0.0]
  - - [1024, 1024, 1, 1024]
    - [3, 0.0]
  - - [2048, 2048, 1, 2048]
    - [0, 0.0]
  - - [4096, 4096, 1, 4096]
    - [2, 0.0]
  - - [4096, 4096, 1, 8192]
    - [10, 0.0]
  - - [8192, 8192, 1, 8192]
    - [11, 0.0]
  - - [4864, 4096, 1, 8192]
    - [4, 0.0]
  - - [7168, 65536, 1, 7168]
    - [5, 0.0]
  - - [7168, 65536, 1, 28672]
    - [6, 0.0]
  - - [21504, 65536, 1, 7168]
    - [7, 0.0]
  - - [28672, 65536, 1, 7168]
    - [8, 0.0]
  - - [50432, 65536, 1, 7168]
    - [9, 0.0]
  - - [16384, 8, 1, 6144]
    - [12, 0.0]
  - - [8, 8, 1, 6144]
    - [13, 0.0]
  - - [16384, 256, 1, 6144]
    - [14, 0.0]
  - - [8, 8192, 1, 6144]
    - [15, 0.0]
  - - [32, 7168, 1, 1152]
    - [16, 0.0]
  - - [1152, 7168, 1, 1152]
    - [17, 0.0]
  - - [4608, 7168, 1, 1152]
    - [18, 0.0]
  - - [512, 14336, 1, 512]
    - [19, 0.0]
  - - [6912, 28, 1, 1152]
    - [20, 0.0]
  - - [1152, 28, 1, 1152]
    - [21, 0.0]
  - - [1152, 28, 1, 256]
    - [22, 0.0]
  - - [2304, 28, 1, 1152]
    - [23, 0.0]
  - - [1024, 1024, 14, 512]
    - [24, 0.0]
  - - [12288, 2048, 1, 4096]
    - [45, 0.0]
  - - [22016, 2048, 1, 4096]
    - [25, 0.0]
  - - [32000, 2048, 1, 4096]
    - [25, 0.0]
  - - [4096, 2048, 1, 4096]
    - [26, 0.0]
  - - [4096, 65536, 1, 11008]
    - [27, 0.0]
  - - [4096, 65536, 1, 4096]
    - [27, 0.0]
  - - [8192, 32768, 1, 1024]
    - [27, 0.0]
  - - [4096, 49152, 1, 4096]
    - [28, 0.0]
  - - [4096, 49152, 1, 32000]
    - [29, 0.0]
  - - [8192, 57344, 1, 28672]
    - [28, 0.0]
  - - [8192, 57344, 1, 8192]
    - [28, 0.0]
  - - [8192, 57344, 1, 1024]
    - [30, 0.0]
  - - [8192, 57344, 1, 32000]
    - [31, 0.0]
  - - [64, 178, 5604, 178]
    - [32, 0.0]
  - - [64, 178, 6144, 178]
    - [32, 0.0]
  - - [16, 155648, 1, 8448]
    - [33, 0.0]
  - - [16, 77824, 1, 16640]
    - [34, 0.0]
  - - [155648, 16, 1, 8448]
    - [35, 0.0]
  - - [77824, 16, 1, 16640]
    - [36, 0.0]
  - - [3072, 91136, 1, 768]
    - [37, 0.0]
  - - [768, 91136, 1, 3072]
    - [38, 0.0]
  - - [768, 91136, 1, 768]
    - [39, 0.0]
  - - [1024, 8192, 1, 4096]
    - [40, 0.0]
  - - [1024, 8192, 1, 1024]
    - [130, 0.0]
  - - [4096, 8192, 1, 1024]
    - [41, 0.0]
  - - [30000, 8192, 1, 1024]
    - [42, 0.0]
  - - [512, 2048, 1, 1024]
    - [43, 0.0]
  - - [2074, 2048, 1, 512]
    - [44, 0.0]
  - - [1536, 2048, 1, 3360]
    - [46, 0.0]
  - - [256, 2048, 1, 1280]
    - [47, 0.0]
  - - [2848, 2048, 1, 512]
    - [48, 0.0]
  - - [1024, 2048, 1, 3072]
    - [49, 0.0]
  - - [2048, 2048, 1, 19520]
    - [50, 0.0]
  - - [4384, 2048, 1, 768]
    - [51, 0.0]
  - - [4096, 2048, 1, 9728]
    - [52, 0.0]
  - - [1536, 2048, 1, 2048]
    - [53, 0.0]
  - - [1536, 2048, 1, 24704]
    - [54, 0.0]
  - - [2048, 2048, 1, 6552]
    - [55, 0.0]
  - - [512, 2048, 1, 5120]
    - [56, 0.0]
  - - [1024, 2048, 1, 4096]
    - [57, 0.0]
  - - [4096, 2048, 1, 5376]
    - [58, 0.0]
  - - [512, 2048, 1, 2048]
    - [59, 0.0]
  - - [2048, 2048, 1, 19536]
    - [60, 0.0]
  - - [128, 2048, 1, 3072]
    - [61, 0.0]
  - - [355, 327680, 1, 1221]
    - [62, 0.0]
  - - [256, 2048, 1, 3072]
    - [63, 0.0]
  - - [2048, 2048, 1, 4384]
    - [64, 0.0]
  - - [192, 59392, 1, 96]
    - [65, 0.0]
  - - [256, 2048, 1, 768]
    - [66, 0.0]
  - - [4096, 2048, 1, 7936]
    - [67, 0.0]
  - - [4096, 2048, 1, 5120]
    - [68, 0.0]
  - - [3072, 2048, 1, 6144]
    - [69, 0.0]
  - - [768, 2048, 1, 1536]
    - [70, 0.0]
  - - [1024, 2048, 1, 4248]
    - [71, 0.0]
  - - [4864, 2048, 1, 896]
    - [72, 0.0]
  - - [2048, 2048, 1, 50176]
    - [73, 0.0]
  - - [1944, 2048, 1, 512]
    - [74, 0.0]
  - - [768, 2048, 1, 2048]
    - [75, 0.0]
  - - [768, 2048, 1, 3864]
    - [76, 0.0]
  - - [6144, 2048, 1, 768]
    - [77, 0.0]
  - - [1536, 2048, 1, 4096]
    - [78, 0.0]
  - - [1024, 2048, 1, 2048]
    - [79, 0.0]
  - - [64, 196608, 1, 1452]
    - [80, 0.0]
  - - [3072, 2048, 1, 3970]
    - [81, 0.0]
  - - [33, 2048, 1, 4517]
    - [82, 0.0]
  - - [3072, 2048, 1, 1536]
    - [83, 0.0]
  - - [1024, 2048, 1, 2416]
    - [84, 0.0]
  - - [2334, 2048, 1, 512]
    - [85, 0.0]
  - - [2048, 2048, 1, 3970]
    - [86, 0.0]
  - - [1024, 2048, 1, 5888]
    - [87, 0.0]
  - - [512, 2048, 1, 2304]
    - [88, 0.0]
  - - [512, 2048, 1, 4096]
    - [89, 0.0]
  - - [2048, 2048, 1, 768]
    - [90, 0.0]
  - - [2048, 2048, 1, 1536]
    - [91, 0.0]
  - - [2592, 2048, 1, 384]
    - [92, 0.0]
  - - [5120, 2048, 1, 256]
    - [93, 0.0]
  - - [12288, 2048, 1, 3072]
    - [94, 0.0]
  - - [512, 2048, 1, 4271]
    - [95, 0.0]
  - - [512, 2048, 1, 3840]
    - [96, 0.0]
  - - [2050, 2048, 1, 512]
    - [97, 0.0]
  - - [128, 2048, 1, 2049]
    - [98, 0.0]
  - - [1536, 2048, 1, 3072]
    - [99, 0.0]
  - - [192, 2048, 1, 2048]
    - [100, 0.0]
  - - [2992, 2048, 1, 512]
    - [101, 0.0]
  - - [1536, 2048, 1, 6176]
    - [102, 0.0]
  - - [4271, 2048, 1, 512]
    - [103, 0.0]
  - - [256, 49152, 1, 64]
    - [104, 0.0]
  - - [2048, 2048, 1, 6176]
    - [105, 0.0]
  - - [3072, 2048, 1, 512]
    - [106, 0.0]
  - - [384, 2048, 1, 3072]
    - [107, 0.0]
  - - [4096, 2048, 1, 1024]
    - [108, 0.0]
  - - [2304, 2048, 1, 512]
    - [109, 0.0]
  - - [2048, 2048, 1, 1024]
    - [110, 0.0]
  - - [2560, 2048, 1, 512]
    - [111, 0.0]
  - - [160, 2048, 1, 3072]
    - [112, 0.0]
  - - [512, 2048, 1, 3072]
    - [113, 0.0]
  - - [768, 2048, 1, 5376]
    - [114, 0.0]
  - - [2048, 2048, 1, 4271]
    - [115, 0.0]
  - - [2688, 2048, 1, 4096]
    - [116, 0.0]
  - - [1536, 2048, 1, 2592]
    - [117, 0.0]
  - - [1024, 2048, 1, 512]
    - [118, 0.0]
  - - [768, 2048, 1, 5120]
    - [119, 0.0]
  - - [3072, 2048, 1, 1024]
    - [120, 0.0]
  - - [1792, 2048, 1, 1944]
    - [121, 0.0]
  - - [2048, 2048, 1, 512]
    - [122, 0.0]
  - - [3072, 2048, 1, 384]
    - [123, 0.0]
  - - [768, 2048, 1, 6552]
    - [124, 0.0]
  - - [3072, 2048, 1, 768]
    - [125, 0.0]
  - - [896, 2048, 1, 4864]
    - [126, 0.0]
  - - [2048, 2048, 1, 6144]
    - [127, 0.0]
  - - [8192, 2048, 1, 4096]
    - [128, 0.0]
  - - [1024, 2048, 1, 5376]
    - [129, 0.0]
  - - [1024, 4096, 1, 1024]
    - [131, 0.0]
  - - [30528, 4096, 1, 1024]
    - [132, 0.0]
  - - [30528, 24576, 1, 1024]
    - [133, 0.0]
  - - [30528, 8192, 1, 1024]
    - [134, 0.0]
  - - [1024, 24576, 1, 1024]
    - [135, 0.0]
- null
- null
- DeviceEfficiency
- Equality
