projects/hipblaslt/library/src/amd_detail/rocblaslt/src/Tensile/Logic/asm_full/aquavanjaram/gfx942/Equality/aquavanjaram_Cijk_Alik_Bljk_F8NBS_STA_BH_SABV_UserArgs.yaml
- {MinimumRequiredVersion: 4.33.0}
- aquavanjaram
- gfx942
- [Device 0049, Device 0050]
    SolutionIndex: 0
    SolutionNameMin: Cijk_Alik_Bljk_F8NBS_STA_BH_SABV_UserArgs_MT64x16x128_MI16x16x1_SN_LDSB0_GRVWB8_GSU1_GSUAMB_GSUC0_GSUWGMRR0_K1_LBSPPB128_MIWT1_1_NLCA2_SU0_SUM0_SUS0_VWB1_WG64_4_1_WGM1_WGMXCC8_WGMXCCGn1
    SolutionIndex: 1
    SolutionNameMin: Cijk_Alik_Bljk_F8NBS_STA_BH_SABV_UserArgs_MT128x64x128_MI16x16x1_SN_LDSB0_GRVWB16_GSU1_GSUAMB_GSUC0_GSUWGMRR0_K1_LBSPPB512_MIWT2_4_NLCA2_SU8_SUM1_SUS128_VWB4_WG64_4_1_WGM1_WGMXCC8_WGMXCCGn1
    SolutionIndex: 2
    SolutionNameMin: Cijk_Alik_Bljk_F8NBS_STA_BH_SABV_UserArgs_MT128x128x128_MI16x16x1_SN_LDSB1_GRVWB16_GSU1_GSUAMB_GSUC0_GSUWGMRR0_K1_LBSPPB1024_MIWT2_8_NLCA2_SU0_SUM0_SUS0_VWB8_WG64_4_1_WGM1_WGMXCC8_WGMXCCGn1
    SolutionIndex: 3
    SolutionNameMin: Cijk_Alik_Bljk_F8NBS_STA_BH_SABV_UserArgs_MT256x128x128_MI16x16x1_SN_LDSB1_GRVWB16_GSU1_GSUAMB_GSUC0_GSUWGMRR0_K1_LBSPPB1024_MIWT4_8_NLCA2_SU0_SUM0_SUS0_VWB8_WG64_4_1_WGM6_WGMXCC8_WGMXCCGn1
    SolutionIndex: 4
    SolutionNameMin: Cijk_Alik_Bljk_F8NBS_STA_BH_SABV_UserArgs_MT64x16x256_MI16x16x1_SN_LDSB0_GRVWB16_GSU1_GSUAMB_GSUC0_GSUWGMRR0_K1_LBSPPB256_MIWT1_1_NLCA4_SU0_SUM0_SUS0_VWB1_WG64_4_1_WGM1_WGMXCC8_WGMXCCGn1
    SolutionIndex: 5
    SolutionNameMin: Cijk_Alik_Bljk_F8NBS_STA_BH_SABV_UserArgs_MT64x16x256_MI16x16x1_SN_LDSB0_GRVWB16_GSU1_GSUAMB_GSUC0_GSUWGMRR0_K1_LBSPPB256_MIWT1_1_NLCA4_SU8_SUM1_SUS256_VWB1_WG64_4_1_WGM1_WGMXCC8_WGMXCCGn1
    SolutionIndex: 6
    SolutionNameMin: Cijk_Alik_Bljk_F8NBS_STA_BH_SABV_UserArgs_MT64x16x256_MI16x16x1_SN_LDSB0_GRVWB16_GSU1_GSUAMB_GSUC0_GSUWGMRR0_K1_LBSPPB256_MIWT1_1_NLCA4_SU0_SUM0_SUS0_VWB1_WG64_4_1_WGM6_WGMXCC8_WGMXCCGn1
    SolutionIndex: 7
    SolutionNameMin: Cijk_Alik_Bljk_F8NBS_STA_BH_SABV_UserArgs_MT64x16x256_MI16x16x1_SN_LDSB0_GRVWB16_GSU1_GSUAMB_GSUC0_GSUWGMRR0_K1_LBSPPB256_MIWT1_1_NLCA4_SU0_SUM0_SUS0_VWB1_WG64_4_1_WGM8_WGMXCC8_WGMXCCGn1
    SolutionIndex: 8
    SolutionNameMin: Cijk_Alik_Bljk_F8NBS_STA_BH_SABV_UserArgs_MT64x16x256_MI16x16x1_SN_LDSB0_GRVWB16_GSU1_GSUAMB_GSUC0_GSUWGMRR0_K1_LBSPPB256_MIWT1_1_NLCA4_SU8_SUM1_SUS256_VWB1_WG64_4_1_WGM8_WGMXCC8_WGMXCCGn1
    SolutionIndex: 9
    SolutionNameMin: Cijk_Alik_Bljk_F8NBS_STA_BH_SABV_UserArgs_MT32x32x256_MI16x16x1_SN_LDSB0_GRVWB16_GSU1_GSUAMB_GSUC0_GSUWGMRR0_K1_LBSPPB256_MIWT1_1_NLCA4_SU0_SUM0_SUS0_VWB1_WG32_8_1_WGM1_WGMXCC8_WGMXCCGn1
    SolutionIndex: 10
    SolutionNameMin: Cijk_Alik_Bljk_F8NBS_STA_BH_SABV_UserArgs_MT64x32x256_MI16x16x1_SN_LDSB0_GRVWB16_GSU1_GSUAMB_GSUC0_GSUWGMRR0_K1_LBSPPB512_MIWT1_2_NLCA4_SU8_SUM1_SUS256_VWB2_WG64_4_1_WGM6_WGMXCC8_WGMXCCGn1
    SolutionIndex: 11
    SolutionNameMin: Cijk_Alik_Bljk_F8NBS_STA_BH_SABV_UserArgs_MT128x32x256_MI16x16x1_SN_LDSB0_GRVWB16_GSU1_GSUAMB_GSUC0_GSUWGMRR0_K1_LBSPPB512_MIWT2_2_NLCA4_SU0_SUM0_SUS0_VWB2_WG64_4_1_WGM8_WGMXCC8_WGMXCCGn1
    SolutionIndex: 12
    SolutionNameMin: Cijk_Alik_Bljk_F8NBS_STA_BH_SABV_UserArgs_MT64x48x256_MI16x16x1_SN_LDSB0_GRVWB16_GSU1_GSUAMB_GSUC0_GSUWGMRR0_K1_LBSPPB256_MIWT1_3_NLCA4_SU0_SUM0_SUS0_VWB1_WG64_4_1_WGM6_WGMXCC8_WGMXCCGn1
    SolutionIndex: 13
    SolutionNameMin: Cijk_Alik_Bljk_F8NBS_STA_BH_SABV_UserArgs_MT128x48x256_MI16x16x1_SN_LDSB0_GRVWB16_GSU1_GSUAMB_GSUC0_GSUWGMRR0_K1_LBSPPB256_MIWT2_3_NLCA4_SU8_SUM1_SUS256_VWB1_WG64_4_1_WGM6_WGMXCC8_WGMXCCGn1
    SolutionIndex: 14
    SolutionNameMin: Cijk_Alik_Bljk_F8NBS_STA_BH_SABV_UserArgs_MT128x64x256_MI16x16x1_SN_LDSB1_GRVWB16_GSU1_GSUAMB_GSUC0_GSUWGMRR0_K1_LBSPPB1024_MIWT2_4_NLCA4_SU8_SUM1_SUS256_VWB4_WG64_4_1_WGM1_WGMXCC8_WGMXCCGn1
    SolutionIndex: 15
    SolutionNameMin: Cijk_Alik_Bljk_F8NBS_STA_BH_SABV_UserArgs_MT128x64x256_MI16x16x1_SN_LDSB1_GRVWB16_GSU1_GSUAMB_GSUC0_GSUWGMRR0_K1_LBSPPB1024_MIWT2_4_NLCA4_SU0_SUM0_SUS0_VWB4_WG64_4_1_WGM6_WGMXCC8_WGMXCCGn1
    SolutionIndex: 16
    SolutionNameMin: Cijk_Alik_Bljk_F8NBS_STA_BH_SABV_UserArgs_MT192x80x256_MI16x16x1_SN_LDSB1_GRVWB16_GSU1_GSUAMB_GSUC0_GSUWGMRR0_K1_LBSPPB256_MIWT3_5_NLCA4_SU0_SUM0_SUS0_VWB1_WG64_4_1_WGM6_WGMXCC8_WGMXCCGn1
    SolutionIndex: 17
    SolutionNameMin: Cijk_Alik_Bljk_F8NBS_STA_BH_SABV_UserArgs_MT64x16x512_MI16x16x1_SN_LDSB0_GRVWB16_GSU1_GSUAMB_GSUC0_GSUWGMRR0_K1_LBSPPB512_MIWT1_1_NLCA8_SU0_SUM0_SUS0_VWB1_WG64_4_1_WGM6_WGMXCC8_WGMXCCGn1
    SolutionIndex: 18
    SolutionNameMin: Cijk_Alik_Bljk_F8NBS_STA_BH_SABV_UserArgs_MT64x16x512_MI16x16x1_SN_LDSB0_GRVWB16_GSU1_GSUAMB_GSUC0_GSUWGMRR0_K1_LBSPPB512_MIWT1_1_NLCA8_SU0_SUM0_SUS0_VWB1_WG64_4_1_WGM8_WGMXCC8_WGMXCCGn1
    SolutionIndex: 19
    SolutionNameMin: Cijk_Alik_Bljk_F8NBS_STA_BH_SABV_UserArgs_MT64x16x512_MI16x16x1_SN_LDSB0_GRVWB16_GSU1_GSUAMB_GSUC0_GSUWGMRR0_K1_LBSPPB512_MIWT1_1_NLCA8_SU8_SUM1_SUS512_VWB1_WG64_4_1_WGM8_WGMXCC8_WGMXCCGn1
    SolutionIndex: 20
    SolutionNameMin: Cijk_Alik_Bljk_F8NBS_STA_BH_SABV_UserArgs_MT64x32x512_MI16x16x1_SN_LDSB1_GRVWB16_GSU1_GSUAMB_GSUC0_GSUWGMRR0_K1_LBSPPB1024_MIWT1_2_NLCA8_SU0_SUM0_SUS0_VWB2_WG64_4_1_WGM6_WGMXCC8_WGMXCCGn1
    SolutionIndex: 21
    SolutionNameMin: Cijk_Alik_Bljk_F8NBS_STA_BH_SABV_UserArgs_MT64x32x512_MI16x16x1_SN_LDSB1_GRVWB16_GSU1_GSUAMB_GSUC0_GSUWGMRR0_K1_LBSPPB1024_MIWT1_2_NLCA8_SU0_SUM0_SUS0_VWB2_WG64_4_1_WGM8_WGMXCC8_WGMXCCGn1
    SolutionIndex: 22
    SolutionNameMin: Cijk_Alik_Bljk_F8NBS_STA_BH_SABV_UserArgs_MT128x32x512_MI16x16x1_SN_LDSB1_GRVWB16_GSU1_GSUAMB_GSUC0_GSUWGMRR0_K1_LBSPPB1024_MIWT2_2_NLCA8_SU0_SUM0_SUS0_VWB2_WG64_4_1_WGM6_WGMXCC8_WGMXCCGn1
    SolutionIndex: 23
    SolutionNameMin: Cijk_Alik_Bljk_F8NBS_STA_BH_SABV_UserArgs_MT128x32x512_MI16x16x1_SN_LDSB1_GRVWB16_GSU1_GSUAMB_GSUC0_GSUWGMRR0_K1_LBSPPB1024_MIWT2_2_NLCA8_SU0_SUM0_SUS0_VWB2_WG64_4_1_WGM8_WGMXCC8_WGMXCCGn1
- - - [2048, 1152, 1, 2048, 2048, 2048, 2048, 2048]
    - [15, 284.85]
  - - [2048, 462, 1, 4096, 2048, 2048, 4096, 4096]
    - [22, 201.25]
  - - [1024, 4608, 1, 1024, 1024, 1024, 1024, 1024]
    - [2, 282.9]
  - - [1024, 462, 1, 4096, 1024, 1024, 4096, 4096]
    - [21, 145.26]
  - - [2048, 462, 1, 768, 2048, 2048, 768, 768]
    - [11, 103.2]
  - - [512, 18432, 1, 512, 512, 512, 512, 512]
    - [3, 250.73]
  - - [2048, 308, 1, 1472, 2048, 2048, 1472, 1472]
    - [12, 90.88]
  - - [2048, 576, 1, 2048, 2048, 2048, 2048, 2048]
    - [13, 194.63]
  - - [512, 462, 1, 4096, 512, 512, 4096, 4096]
    - [19, 97.22]
  - - [1024, 308, 1, 1472, 1024, 1024, 1472, 1472]
    - [8, 54.94]
  - - [512, 308, 1, 1472, 512, 512, 1472, 1472]
    - [5, 29.7]
  - - [16384, 231, 1, 4096, 16384, 16384, 4096, 4096]
    - [16, 299.81]
  - - [4096, 231, 1, 4096, 4096, 4096, 4096, 4096]
    - [23, 195.51]
  - - [2048, 231, 1, 4096, 2048, 2048, 4096, 4096]
    - [21, 140.68]
  - - [1024, 231, 1, 4096, 1024, 1024, 4096, 4096]
    - [18, 95.95]
  - - [1024, 2304, 1, 1024, 1024, 1024, 1024, 1024]
    - [14, 219.07]
  - - [512, 9216, 1, 512, 512, 512, 512, 512]
    - [1, 209.69]
  - - [1024, 154, 1, 1472, 1024, 1024, 1472, 1472]
    - [6, 29.25]
  - - [512, 462, 1, 768, 512, 512, 768, 768]
    - [9, 33.67]
  - - [1024, 462, 1, 768, 1024, 1024, 768, 768]
    - [4, 62.58]
  - - [2048, 231, 1, 768, 2048, 2048, 768, 768]
    - [7, 61.56]
  - - [2048, 154, 1, 1472, 2048, 2048, 1472, 1472]
    - [6, 54.99]
  - - [2048, 288, 1, 2048, 2048, 2048, 2048, 2048]
    - [20, 128.44]
  - - [512, 154, 1, 1472, 512, 512, 1472, 1472]
    - [5, 14.89]
  - - [3584, 154, 1, 1472, 3584, 3584, 1472, 1472]
    - [10, 86.07]
  - - [1472, 154, 1, 3584, 1472, 1472, 3584, 3584]
    - [18, 85.36]
  - - [384, 154, 1, 1472, 384, 384, 1472, 1472]
    - [5, 11.32]
  - - [512, 231, 1, 768, 512, 512, 768, 768]
    - [9, 17.29]
  - - [1472, 154, 1, 384, 1472, 1472, 384, 384]
    - [0, 17.01]
  - - [512, 231, 1, 4096, 512, 512, 4096, 4096]
    - [18, 54.8]
  - - [1024, 231, 1, 768, 1024, 1024, 768, 768]
    - [9, 32.78]
  - - [2048, 144, 1, 2048, 2048, 2048, 2048, 2048]
    - [17, 80.3]
- null
- null
- DeviceEfficiency
- Equality
