projects/hipblaslt/library/src/amd_detail/rocblaslt/src/Tensile/Logic/asm_full/aquavanjaram/gfx942/Equality/aquavanjaram_Cijk_Ailk_Bjlk_S_MX_B_UserArgs.yaml
- {MinimumRequiredVersion: 5.0.0}
- aquavanjaram
- gfx942
- [Device 0049, Device 0050]
    SolutionIndex: 0
    SolutionNameMin: Cijk_Ailk_Bjlk_S_MX_B_UserArgs_MT16x16x16_MI16x16x1_SN_LDSB0_AFC0_AFEM8_AFEM1_ASEM1_CLR1_CADS0_DTLA0_DTLB0_DTVA0_DTVB0_EPS0_FDSI0_GRPM1_GRVWA4_GRVWB1_GSU1_GSUAMB_GSUC0_GSUWGMRR0_GLS0_ISA942_IU1_K1_LBSPPA128_LBSPPB128_LBSPPM0_LPA16_LPB16_LPM0_LRVW2_LWPMn1_MIAV0_MIWT1_1_MO40_NTn1_NTA7_NTB0_NTC0_NTD0_NTM0_NEPBS8_NLCA1_NLCB1_ONLL1_PGR0_PLR1_PKA1_SIA3_SS0_SU0_SUM1_SUS0_SPO0_SRVW0_SSO0_SVW4_SK0_SKXCCM0_TLDS0_ULSGRO0_USL1_UIOFGRO0_USFGROn1_VSn1_VWA1_VWB1_WSGRA0_WSGRB0_WS64_WG16_4_1_WGM8_WGMXCC1_WGMXCCGn1
    SolutionIndex: 1
    SolutionNameMin: Cijk_Ailk_Bjlk_S_MX_B_UserArgs_MT16x16x16_MI16x16x1_SN_LDSB0_AFC0_AFEM8_AFEM1_ASEM1_CLR1_CADS0_DTLA0_DTLB0_DTVA0_DTVB0_EPS0_FDSI0_GRPM1_GRVWA4_GRVWB1_GSU1_GSUAMB_GSUC0_GSUWGMRR0_GLS0_ISA942_IU1_K1_LBSPPA128_LBSPPB128_LBSPPM0_LPA16_LPB16_LPM0_LRVW2_LWPMn1_MIAV0_MIWT1_1_MO40_NTn1_NTA7_NTB0_NTC0_NTD0_NTM0_NEPBS8_NLCA1_NLCB1_ONLL1_PGR0_PLR1_PKA1_SIA3_SS0_SU8_SUM0_SUS64_SPO0_SRVW0_SSO0_SVW4_SK0_SKXCCM0_TLDS0_ULSGRO0_USL1_UIOFGRO0_USFGROn1_VSn1_VWA1_VWB1_WSGRA0_WSGRB0_WS64_WG16_4_1_WGM8_WGMXCC1_WGMXCCGn1
    SolutionIndex: 2
    SolutionNameMin: Cijk_Ailk_Bjlk_S_MX_B_UserArgs_MT112x128x64_MI16x16x1_SN_LDSB1_AFC0_AFEM1_AFEM1_ASEM1_CLR1_CADS0_DTLA0_DTLB0_DTVA0_DTVB0_EPS0_FDSI0_GRPM0p25_GRVWA4_GRVWB4_GSU4_GSUAMB_GSUC0_GSUWGMRR1_GLS0_ISA942_IU1_K1_LBSPPA896_LBSPPB1024_LBSPPM0_LPA16_LPB0_LPM0_LRVW2_LWPM0p30_MIAV0_MIWT7_2_MO40_NTn1_NTA0_NTB0_NTC7_NTD4_NTM0_NEPBS2_NLCA7_NLCB1_ONLL1_PGR2_PLR1_PKA1_SIA3_SS1_SU2_SUM1_SUS512_SPO0_SRVW0_SSO0_SVW1_SK0_SKXCCM0_TLDS0_ULSGRO0_USL1_UIOFGRO0_USFGRO0_VSn1_VWA1_VWB2_WSGRA0_WSGRB1_WS64_WG16_16_1_WGM133_WGMXCC8_WGMXCCG0
    SolutionIndex: 3
    SolutionNameMin: Cijk_Ailk_Bjlk_S_MX_B_UserArgs_MT160x384x16_MI16x16x1_SN_LDSB1_AFC0_AFEM1_AFEM1_ASEM1_CLR1_CADS0_DTLA0_DTLB0_DTVA0_DTVB0_EPS0_FDSI0_GRPM1_GRVWA2_GRVWB4_GSU1_GSUAMB_GSUC0_GSUWGMRR1_GLS0_ISA942_IU1_K1_LBSPPA1280_LBSPPB3072_LBSPPM0_LPA0_LPB0_LPM0_LRVW2_LWPMn1_MIAV0_MIWT10_6_MO40_NTn1_NTA0_NTB0_NTC0_NTD0_NTM0_NEPBS0_NLCA5_NLCB3_ONLL0_PGR2_PLR1_PKA1_SIA3_SS1_SU0_SUM1_SUS0_SPO0_SRVW0_SSO0_SVW2_SK0_SKXCCM0_TLDS0_ULSGRO0_USL1_UIOFGRO0_USFGROn1_VSn1_VWA2_VWB2_WSGRA0_WSGRB0_WS64_WG16_16_1_WGM38_WGMXCC2_WGMXCCGn1
    SolutionIndex: 4
    SolutionNameMin: Cijk_Ailk_Bjlk_S_MX_B_UserArgs_MT176x192x16_MI16x16x1_SN_LDSB0_AFC0_AFEM1_AFEM1_ASEM1_CLR0_CADS0_DTLA0_DTLB0_DTVA0_DTVB0_EPS0_FDSI0_GRPM1_GRVWA1_GRVWB2_GSU4_GSUAMB_GSUC1_GSUWGMRR1_GLS0_ISA942_IU1_K1_LBSPPA128_LBSPPB128_LBSPPM0_LPA2_LPB2_LPM0_LRVW2_LWPMn1_MIAV0_MIWT11_3_MO40_NTn1_NTA0_NTB0_NTC7_NTD0_NTM0_NEPBS4_NLCA11_NLCB3_ONLL0_PGR2_PLR1_PKA1_SIA3_SS1_SU64_SUM1_SUS128_SPO0_SRVW0_SSO0_SVW1_SK0_SKXCCM0_TLDS2_ULSGRO0_USL1_UIOFGRO0_USFGROn1_VSn1_VWA1_VWB1_WSGRA2_WSGRB2_WS64_WG16_16_1_WGM6_WGMXCC4_WGMXCCG228
    SolutionIndex: 5
    SolutionNameMin: Cijk_Ailk_Bjlk_S_MX_B_UserArgs_MT144x128x16_MI16x16x1_SN_LDSB0_AFC0_AFEM1_AFEM1_ASEM1_CLR0_CADS0_DTLA0_DTLB0_DTVA0_DTVB0_EPS0_FDSI0_GRPM0p80_GRVWA1_GRVWB2_GSU4_GSUAMB_GSUC0_GSUWGMRR1_GLS0_ISA942_IU1_K1_LBSPPA128_LBSPPB128_LBSPPM0_LPA2_LPB2_LPM0_LRVW2_LWPM1_MIAV0_MIWT9_2_MO40_NTn1_NTA0_NTB7_NTC7_NTD4_NTM0_NEPBS2_NLCA9_NLCB1_ONLL0_PGR2_PLR1_PKA1_SIA3_SS1_SU8_SUM1_SUS512_SPO0_SRVW0_SSO0_SVW1_SK0_SKXCCM0_TLDS2_ULSGRO0_USL1_UIOFGRO0_USFGROn1_VSn1_VWA1_VWB2_WSGRA1_WSGRB2_WS64_WG16_16_1_WGM285_WGMXCC8_WGMXCCGn1
    SolutionIndex: 6
    SolutionNameMin: Cijk_Ailk_Bjlk_S_MX_B_UserArgs_MT128x112x64_MI16x16x1_SN_LDSB1_AFC0_AFEM1_AFEM1_ASEM1_CLR1_CADS0_DTLA0_DTLB0_DTVA0_DTVB0_EPS0_FDSI0_GRPM0p27_GRVWA4_GRVWB4_GSU8_GSUAMB_GSUC1_GSUWGMRR1_GLS0_ISA942_IU1_K1_LBSPPA1024_LBSPPB896_LBSPPM0_LPA0_LPB16_LPM0_LRVW2_LWPM0p60_MIAV0_MIWT2_7_MO40_NTn1_NTA0_NTB0_NTC4_NTD7_NTM0_NEPBS6_NLCA1_NLCB7_ONLL0_PGR2_PLR1_PKA1_SIA3_SS1_SU4_SUM1_SUS256_SPO0_SRVW0_SSO0_SVW2_SK0_SKXCCM0_TLDS0_ULSGRO0_USL1_UIOFGRO0_USFGROn1_VSn1_VWA2_VWB1_WSGRA0_WSGRB1_WS64_WG64_4_1_WGM95_WGMXCC4_WGMXCCG0
    SolutionIndex: 7
    SolutionNameMin: Cijk_Ailk_Bjlk_S_MX_B_UserArgs_MT96x32x32_MI16x16x1_SN_LDSB1_AFC0_AFEM1_AFEM1_ASEM1_CLR1_CADS0_DTLA0_DTLB0_DTVA0_DTVB0_EPS0_FDSI0_GRPM0p50_GRVWA4_GRVWB4_GSU16_GSUAMB_GSUC0_GSUWGMRR1_GLS0_ISA942_IU1_K1_LBSPPA768_LBSPPB256_LBSPPM0_LPA16_LPB16_LPM0_LRVW2_LWPMn1_MIAV0_MIWT3_1_MO40_NTn1_NTA0_NTB0_NTC7_NTD4_NTM0_NEPBS4_NLCA3_NLCB1_ONLL0_PGR2_PLR1_PKA1_SIA3_SS1_SU4_SUM1_SUS128_SPO0_SRVW0_SSO0_SVW1_SK0_SKXCCM0_TLDS0_ULSGRO0_USL1_UIOFGRO0_USFGRO0_VSn1_VWA1_VWB1_WSGRA2_WSGRB0_WS64_WG32_8_1_WGM1_WGMXCC8_WGMXCCG0
    SolutionIndex: 8
    SolutionNameMin: Cijk_Ailk_Bjlk_S_MX_B_UserArgs_MT64x160x32_MI16x16x1_SN_LDSB1_AFC0_AFEM1_AFEM1_ASEM1_CLR1_CADS0_DTLA0_DTLB0_DTVA0_DTVB0_EPS0_FDSI0_GRPM0p10_GRVWA4_GRVWB4_GSU4_GSUAMB_GSUC1_GSUWGMRR1_GLS0_ISA942_IU1_K1_LBSPPA512_LBSPPB1280_LBSPPM0_LPA0_LPB16_LPM0_LRVW2_LWPM0p70_MIAV0_MIWT2_5_MO40_NTn1_NTA0_NTB0_NTC0_NTD4_NTM0_NEPBS2_NLCA1_NLCB5_ONLL1_PGR2_PLR1_PKA1_SIA3_SS1_SU4_SUM1_SUS128_SPO0_SRVW0_SSO0_SVW2_SK0_SKXCCM0_TLDS0_ULSGRO0_USL1_UIOFGRO0_USFGROn1_VSn1_VWA2_VWB1_WSGRA2_WSGRB2_WS64_WG32_8_1_WGM209_WGMXCC8_WGMXCCG0
    SolutionIndex: 9
    SolutionNameMin: Cijk_Ailk_Bjlk_S_MX_B_UserArgs_MT112x128x64_MI16x16x1_SN_LDSB1_AFC0_AFEM1_AFEM1_ASEM1_CLR1_CADS0_DTLA0_DTLB0_DTVA0_DTVB0_EPS0_FDSI0_GRPM0p27_GRVWA4_GRVWB4_GSU4_GSUAMB_GSUC1_GSUWGMRR1_GLS0_ISA942_IU1_K1_LBSPPA896_LBSPPB1024_LBSPPM0_LPA16_LPB0_LPM0_LRVW2_LWPM0p40_MIAV0_MIWT7_2_MO40_NTn1_NTA0_NTB0_NTC0_NTD4_NTM0_NEPBS2_NLCA7_NLCB1_ONLL0_PGR2_PLR1_PKA1_SIA3_SS1_SU16_SUM1_SUS256_SPO1_SRVW0_SSO0_SVW1_SK0_SKXCCM0_TLDS0_ULSGRO1_USL1_UIOFGRO0_USFGRO0_VSn1_VWA1_VWB2_WSGRA1_WSGRB0_WS64_WG16_16_1_WGM57_WGMXCC8_WGMXCCGn1
    SolutionIndex: 10
    SolutionNameMin: Cijk_Ailk_Bjlk_S_MX_B_UserArgs_MT144x128x16_MI16x16x1_SN_LDSB0_AFC0_AFEM1_AFEM1_ASEM1_CLR0_CADS0_DTLA0_DTLB0_DTVA0_DTVB0_EPS0_FDSI0_GRPM0p90_GRVWA1_GRVWB2_GSU4_GSUAMB_GSUC1_GSUWGMRR0_GLS0_ISA942_IU1_K1_LBSPPA128_LBSPPB128_LBSPPM0_LPA2_LPB2_LPM0_LRVW2_LWPM1_MIAV0_MIWT9_2_MO40_NTn1_NTA0_NTB0_NTC0_NTD0_NTM0_NEPBS0_NLCA9_NLCB1_ONLL2_PGR2_PLR1_PKA1_SIA3_SS1_SU16_SUM1_SUS128_SPO0_SRVW0_SSO0_SVW1_SK0_SKXCCM0_TLDS2_ULSGRO0_USL1_UIOFGRO0_USFGRO0_VSn1_VWA1_VWB2_WSGRA2_WSGRB2_WS64_WG16_16_1_WGM4_WGMXCC8_WGMXCCG0
    SolutionIndex: 11
    SolutionNameMin: Cijk_Ailk_Bjlk_S_MX_B_UserArgs_MT128x80x64_MI16x16x1_SN_LDSB1_AFC0_AFEM1_AFEM1_ASEM1_CLR1_CADS0_DTLA0_DTLB0_DTVA0_DTVB0_EPS0_FDSI0_GRPM0p50_GRVWA4_GRVWB4_GSU8_GSUAMB_GSUC1_GSUWGMRR1_GLS0_ISA942_IU1_K1_LBSPPA1024_LBSPPB640_LBSPPM0_LPA0_LPB16_LPM0_LRVW2_LWPM0p60_MIAV0_MIWT2_5_MO40_NTn1_NTA0_NTB0_NTC0_NTD7_NTM0_NEPBS0_NLCA1_NLCB5_ONLL0_PGR2_PLR1_PKA1_SIA3_SS1_SU8_SUM4_SUS512_SPO0_SRVW0_SSO0_SVW2_SK0_SKXCCM0_TLDS0_ULSGRO0_USL1_UIOFGRO0_USFGROn1_VSn1_VWA2_VWB1_WSGRA1_WSGRB0_WS64_WG64_4_1_WGM1_WGMXCC16_WGMXCCGn1
    SolutionIndex: 12
    SolutionNameMin: Cijk_Ailk_Bjlk_S_MX_B_UserArgs_MT64x64x64_MI16x16x1_SN_LDSB1_AFC0_AFEM1_AFEM1_ASEM1_CLR1_CADS0_DTLA0_DTLB0_DTVA0_DTVB0_EPS0_FDSI0_GRPM1_GRVWA4_GRVWB4_GSU4_GSUAMB_GSUC1_GSUWGMRR1_GLS0_ISA942_IU1_K1_LBSPPA512_LBSPPB512_LBSPPM0_LPA0_LPB0_LPM0_LRVW2_LWPMn1_MIAV0_MIWT2_2_MO40_NTn1_NTA0_NTB0_NTC7_NTD4_NTM0_NEPBS0_NLCA1_NLCB1_ONLL1_PGR2_PLR1_PKA1_SIA3_SS1_SU4_SUM0_SUS2048_SPO0_SRVW0_SSO0_SVW2_SK0_SKXCCM0_TLDS0_ULSGRO0_USL1_UIOFGRO0_USFGROn1_VSn1_VWA2_VWB2_WSGRA0_WSGRB1_WS64_WG32_8_1_WGM1_WGMXCC8_WGMXCCG0
    SolutionIndex: 13
    SolutionNameMin: Cijk_Ailk_Bjlk_S_MX_B_UserArgs_MT80x192x16_MI16x16x1_SN_LDSB0_AFC0_AFEM1_AFEM1_ASEM1_CLR1_CADS0_DTLA0_DTLB0_DTVA0_DTVB0_EPS0_FDSI0_GRPM0p40_GRVWA1_GRVWB4_GSU4_GSUAMB_GSUC1_GSUWGMRR1_GLS0_ISA942_IU1_K1_LBSPPA640_LBSPPB1536_LBSPPM0_LPA16_LPB16_LPM0_LRVW2_LWPM0p80_MIAV0_MIWT5_3_MO40_NTn1_NTA0_NTB0_NTC0_NTD4_NTM0_NEPBS0_NLCA5_NLCB3_ONLL0_PGR2_PLR1_PKA1_SIA3_SS1_SU8_SUM0_SUS128_SPO0_SRVW0_SSO0_SVW1_SK0_SKXCCM0_TLDS0_ULSGRO0_USL1_UIOFGRO0_USFGROn1_VSn1_VWA1_VWB1_WSGRA1_WSGRB0_WS64_WG16_16_1_WGM1_WGMXCC8_WGMXCCG0
    SolutionIndex: 14
    SolutionNameMin: Cijk_Ailk_Bjlk_S_MX_B_UserArgs_MT80x256x16_MI16x16x1_SN_LDSB0_AFC0_AFEM1_AFEM1_ASEM1_CLR1_CADS0_DTLA0_DTLB0_DTVA0_DTVB0_EPS0_FDSI0_GRPM0p27_GRVWA1_GRVWB4_GSU4_GSUAMB_GSUC0_GSUWGMRR0_GLS0_ISA942_IU1_K1_LBSPPA640_LBSPPB2048_LBSPPM0_LPA16_LPB0_LPM0_LRVW2_LWPM0p60_MIAV0_MIWT5_4_MO40_NTn1_NTA0_NTB0_NTC0_NTD0_NTM0_NEPBS0_NLCA5_NLCB1_ONLL2_PGR2_PLR1_PKA1_SIA3_SS1_SU16_SUM1_SUS512_SPO0_SRVW0_SSO1_SVW1_SK0_SKXCCM0_TLDS0_ULSGRO0_USL1_UIOFGRO0_USFGRO0_VSn1_VWA1_VWB4_WSGRA1_WSGRB1_WS64_WG16_16_1_WGM1_WGMXCC16_WGMXCCGn1
    SolutionIndex: 15
    SolutionNameMin: Cijk_Ailk_Bjlk_S_MX_B_UserArgs_MT48x64x64_MI16x16x1_SN_LDSB1_AFC0_AFEM1_AFEM1_ASEM1_CLR1_CADS0_DTLA0_DTLB0_DTVA0_DTVB0_EPS0_FDSI0_GRPM0p90_GRVWA4_GRVWB4_GSU8_GSUAMB_GSUC0_GSUWGMRR1_GLS0_ISA942_IU1_K1_LBSPPA384_LBSPPB512_LBSPPM0_LPA16_LPB16_LPM0_LRVW2_LWPMn1_MIAV0_MIWT3_1_MO40_NTn1_NTA0_NTB0_NTC0_NTD4_NTM0_NEPBS8_NLCA3_NLCB1_ONLL0_PGR2_PLR1_PKA1_SIA3_SS1_SU64_SUM0_SUS1024_SPO0_SRVW0_SSO0_SVW1_SK0_SKXCCM0_TLDS0_ULSGRO1_USL1_UIOFGRO0_USFGRO0_VSn1_VWA1_VWB1_WSGRA0_WSGRB0_WS64_WG16_16_1_WGM38_WGMXCC4_WGMXCCG0
    SolutionIndex: 16
    SolutionNameMin: Cijk_Ailk_Bjlk_S_MX_B_UserArgs_MT192x256x16_MI32x32x1_SN_LDSB0_AFC0_AFEM1_AFEM1_ASEM1_CLR0_CADS0_DTLA0_DTLB0_DTVA0_DTVB0_EPS0_FDSI0_GRPM1_GRVWA4_GRVWB4_GSU4_GSUAMB_GSUC0_GSUWGMRR1_GLS0_ISA942_IU1_K1_LBSPPA0_LBSPPB0_LBSPPM0_LPA0_LPB0_LPM0_LRVW2_LWPMn1_MIAV0_MIWT3_4_MO40_NTn1_NTA0_NTB7_NTC7_NTD0_NTM0_NEPBS6_NLCA3_NLCB1_ONLL2_PGR2_PLR1_PKA1_SIA3_SS1_SU2_SUM1_SUS64_SPO0_SRVW0_SSO1_SVW1_SK0_SKXCCM0_TLDS0_ULSGRO1_USL1_UIOFGRO0_USFGROn1_VSn1_VWA1_VWB4_WSGRA0_WSGRB0_WS64_WG64_4_1_WGM1_WGMXCC8_WGMXCCGn1
    SolutionIndex: 17
    SolutionNameMin: Cijk_Ailk_Bjlk_S_MX_B_UserArgs_MT80x128x64_MI16x16x1_SN_LDSB1_AFC0_AFEM1_AFEM1_ASEM1_CLR1_CADS0_DTLA0_DTLB0_DTVA0_DTVB0_EPS0_FDSI0_GRPM0p26_GRVWA4_GRVWB4_GSU8_GSUAMB_GSUC0_GSUWGMRR1_GLS0_ISA942_IU1_K1_LBSPPA640_LBSPPB1024_LBSPPM0_LPA16_LPB0_LPM0_LRVW2_LWPM0p30_MIAV0_MIWT5_2_MO40_NTn1_NTA0_NTB0_NTC0_NTD4_NTM0_NEPBS0_NLCA5_NLCB1_ONLL0_PGR2_PLR1_PKA1_SIA3_SS1_SU32_SUM0_SUS512_SPO0_SRVW0_SSO0_SVW1_SK0_SKXCCM0_TLDS0_ULSGRO0_USL1_UIOFGRO0_USFGROn1_VSn1_VWA1_VWB2_WSGRA1_WSGRB0_WS64_WG16_16_1_WGM2_WGMXCC4_WGMXCCG0
    SolutionIndex: 18
    SolutionNameMin: Cijk_Ailk_Bjlk_S_MX_B_UserArgs_MT80x128x64_MI16x16x1_SN_LDSB1_AFC0_AFEM1_AFEM1_ASEM1_CLR1_CADS0_DTLA0_DTLB0_DTVA0_DTVB0_EPS0_FDSI0_GRPM0p90_GRVWA4_GRVWB4_GSU4_GSUAMB_GSUC0_GSUWGMRR0_GLS0_ISA942_IU1_K1_LBSPPA640_LBSPPB1024_LBSPPM0_LPA16_LPB0_LPM0_LRVW2_LWPMn1_MIAV0_MIWT5_2_MO40_NTn1_NTA0_NTB0_NTC4_NTD4_NTM0_NEPBS14_NLCA5_NLCB1_ONLL0_PGR2_PLR1_PKA1_SIA3_SS0_SU0_SUM1_SUS0_SPO0_SRVW0_SSO1_SVW4_SK0_SKXCCM0_TLDS0_ULSGRO1_USL1_UIOFGRO0_USFGROn1_VSn1_VWA1_VWB2_WSGRA2_WSGRB1_WS64_WG16_16_1_WGM1_WGMXCC1_WGMXCCG32
    SolutionIndex: 19
    SolutionNameMin: Cijk_Ailk_Bjlk_S_MX_B_UserArgs_MT192x192x16_MI16x16x1_SN_LDSB1_AFC0_AFEM1_AFEM1_ASEM1_CLR0_CADS0_DTLA0_DTLB0_DTVA0_DTVB0_EPS0_FDSI0_GRPM1_GRVWA4_GRVWB4_GSU2_GSUAMB_GSUC1_GSUWGMRR1_GLS0_ISA942_IU1_K1_LBSPPA1536_LBSPPB1536_LBSPPM0_LPA0_LPB0_LPM0_LRVW2_LWPMn1_MIAV0_MIWT6_6_MO40_NTn1_NTA0_NTB0_NTC7_NTD0_NTM0_NEPBS6_NLCA3_NLCB3_ONLL0_PGR2_PLR1_PKA1_SIA3_SS1_SU2_SUM1_SUS128_SPO0_SRVW0_SSO0_SVW2_SK0_SKXCCM0_TLDS0_ULSGRO0_USL1_UIOFGRO0_USFGROn1_VSn1_VWA2_VWB2_WSGRA1_WSGRB0_WS64_WG32_8_1_WGM171_WGMXCC8_WGMXCCGn1
    SolutionIndex: 20
    SolutionNameMin: Cijk_Ailk_Bjlk_S_MX_B_UserArgs_MT80x128x32_MI16x16x1_SN_LDSB0_AFC0_AFEM1_AFEM1_ASEM1_CLR0_CADS0_DTLA0_DTLB0_DTVA0_DTVB0_EPS0_FDSI0_GRPM0p20_GRVWA2_GRVWB4_GSU4_GSUAMB_GSUC1_GSUWGMRR1_GLS0_ISA942_IU1_K1_LBSPPA640_LBSPPB1024_LBSPPM0_LPA16_LPB0_LPM0_LRVW2_LWPM0p26_MIAV0_MIWT5_2_MO40_NTn1_NTA0_NTB0_NTC0_NTD4_NTM0_NEPBS2_NLCA5_NLCB1_ONLL1_PGR2_PLR1_PKA1_SIA3_SS1_SU2_SUM1_SUS256_SPO1_SRVW0_SSO0_SVW1_SK0_SKXCCM0_TLDS0_ULSGRO0_USL1_UIOFGRO0_USFGRO1_VSn1_VWA1_VWB2_WSGRA1_WSGRB0_WS64_WG16_16_1_WGM76_WGMXCC8_WGMXCCG0
    SolutionIndex: 21
    SolutionNameMin: Cijk_Ailk_Bjlk_S_MX_B_UserArgs_MT16x64x64_MI16x16x1_SN_LDSB0_AFC0_AFEM1_AFEM1_ASEM1_CLR1_CADS0_DTLA0_DTLB0_DTVA0_DTVB0_EPS0_FDSI0_GRPM0p25_GRVWA4_GRVWB4_GSU16_GSUAMB_GSUC0_GSUWGMRR1_GLS0_ISA942_IU1_K1_LBSPPA128_LBSPPB512_LBSPPM0_LPA16_LPB16_LPM0_LRVW2_LWPM0p90_MIAV0_MIWT1_1_MO40_NTn1_NTA0_NTB7_NTC4_NTD7_NTM0_NEPBS6_NLCA1_NLCB1_ONLL0_PGR2_PLR1_PKA1_SIA3_SS1_SU2_SUM1_SUS256_SPO1_SRVW0_SSO0_SVW1_SK0_SKXCCM0_TLDS0_ULSGRO0_USL1_UIOFGRO0_USFGRO0_VSn1_VWA1_VWB1_WSGRA1_WSGRB1_WS64_WG16_16_1_WGM1_WGMXCC16_WGMXCCG0
    SolutionIndex: 22
    SolutionNameMin: Cijk_Ailk_Bjlk_S_MX_B_UserArgs_MT320x96x32_MI16x16x1_SN_LDSB1_AFC0_AFEM1_AFEM1_ASEM1_CLR0_CADS0_DTLA0_DTLB0_DTVA0_DTVB0_EPS0_FDSI0_GRPM0p80_GRVWA4_GRVWB4_GSU8_GSUAMB_GSUC0_GSUWGMRR0_GLS0_ISA942_IU1_K1_LBSPPA2560_LBSPPB768_LBSPPM0_LPA16_LPB0_LPM0_LRVW2_LWPMn1_MIAV0_MIWT5_6_MO40_NTn1_NTA0_NTB0_NTC7_NTD4_NTM0_NEPBS4_NLCA5_NLCB3_ONLL2_PGR2_PLR1_PKA1_SIA3_SS1_SU16_SUM1_SUS256_SPO1_SRVW0_SSO1_SVW1_SK0_SKXCCM0_TLDS0_ULSGRO1_USL1_UIOFGRO0_USFGROn1_VSn1_VWA1_VWB2_WSGRA0_WSGRB2_WS64_WG64_4_1_WGM247_WGMXCC8_WGMXCCG0
    SolutionIndex: 23
    SolutionNameMin: Cijk_Ailk_Bjlk_S_MX_B_UserArgs_MT80x128x32_MI16x16x1_SN_LDSB1_AFC0_AFEM1_AFEM1_ASEM1_CLR1_CADS0_DTLA0_DTLB0_DTVA0_DTVB0_EPS0_FDSI0_GRPM0p60_GRVWA2_GRVWB4_GSU76_GSUAMB_GSUC0_GSUWGMRR1_GLS0_ISA942_IU1_K1_LBSPPA640_LBSPPB1024_LBSPPM0_LPA16_LPB0_LPM0_LRVW2_LWPM0p50_MIAV0_MIWT5_2_MO40_NTn1_NTA0_NTB0_NTC0_NTD4_NTM0_NEPBS0_NLCA5_NLCB1_ONLL1_PGR2_PLR1_PKA1_SIA3_SS1_SU32_SUM1_SUS1024_SPO0_SRVW0_SSO0_SVW1_SK0_SKXCCM0_TLDS0_ULSGRO0_USL1_UIOFGRO0_USFGRO1_VSn1_VWA1_VWB2_WSGRA0_WSGRB1_WS64_WG16_16_1_WGM1_WGMXCC16_WGMXCCGn1
    SolutionIndex: 24
    SolutionNameMin: Cijk_Ailk_Bjlk_S_MX_B_UserArgs_MT16x16x128_MI16x16x1_SN_LDSB1_AFC0_AFEM1_AFEM1_ASEM1_CLR1_CADS0_DTLA0_DTLB0_DTVA0_DTVB0_EPS0_FDSI0_GRPM1_GRVWA2_GRVWB2_GSU8_GSUAMBSK_GSUC0_GSUWGMRR0_GLS0_ISA942_IU1_K1_LBSPPA128_LBSPPB128_LBSPPM0_LPA16_LPB16_LPM0_LRVW2_LWPM0p50_MIAV0_MIWT1_1_MO40_NTn1_NTA0_NTB0_NTC0_NTD0_NTM0_NEPBS12_NLCA1_NLCB1_ONLL1_PGR2_PLR1_PKA1_SIA3_SS1_SU4_SUM4_SUS512_SPO0_SRVW0_SSO0_SVW1_SK0_SKXCCM0_TLDS0_ULSGRO0_USL1_UIOFGRO0_USFGROn1_VSn1_VWA1_VWB1_WSGRA0_WSGRB0_WS64_WG16_4_1_WGM1_WGMXCC1_WGMXCCG38
    SolutionIndex: 25
    SolutionNameMin: Cijk_Ailk_Bjlk_S_MX_B_UserArgs_MT224x192x16_MI16x16x1_SN_LDSB0_AFC0_AFEM1_AFEM1_ASEM1_CLR0_CADS0_DTLA0_DTLB0_DTVA0_DTVB0_EPS0_FDSI0_GRPM1_GRVWA2_GRVWB2_GSU1_GSUAMB_GSUC1_GSUWGMRR1_GLS0_ISA942_IU1_K1_LBSPPA128_LBSPPB128_LBSPPM0_LPA2_LPB2_LPM0_LRVW2_LWPMn1_MIAV0_MIWT7_6_MO40_NTn1_NTA0_NTB0_NTC0_NTD0_NTM0_NEPBS0_NLCA7_NLCB3_ONLL2_PGR2_PLR1_PKA1_SIA3_SS1_SU8_SUM0_SUS64_SPO1_SRVW0_SSO3_SVW1_SK0_SKXCCM0_TLDS2_ULSGRO1_USL1_UIOFGRO0_USFGRO1_VSn1_VWA1_VWB2_WSGRA0_WSGRB1_WS64_WG32_8_1_WGM209_WGMXCC8_WGMXCCGn1
    SolutionIndex: 26
    SolutionNameMin: Cijk_Ailk_Bjlk_S_MX_B_UserArgs_MT384x64x16_MI16x16x1_SN_LDSB0_AFC0_AFEM1_AFEM1_ASEM1_CLR0_CADS0_DTLA0_DTLB0_DTVA0_DTVB0_EPS0_FDSI0_GRPM0p26_GRVWA4_GRVWB4_GSU4_GSUAMB_GSUC0_GSUWGMRR1_GLS0_ISA942_IU1_K1_LBSPPA3072_LBSPPB512_LBSPPM0_LPA0_LPB0_LPM0_LRVW2_LWPM0p70_MIAV0_MIWT6_4_MO40_NTn1_NTA0_NTB0_NTC4_NTD4_NTM0_NEPBS4_NLCA3_NLCB1_ONLL0_PGR2_PLR1_PKA1_SIA3_SS1_SU32_SUM1_SUS64_SPO0_SRVW0_SSO0_SVW2_SK0_SKXCCM0_TLDS0_ULSGRO0_USL1_UIOFGRO0_USFGRO0_VSn1_VWA2_VWB4_WSGRA2_WSGRB0_WS64_WG64_4_1_WGM2_WGMXCC8_WGMXCCGn1
    SolutionIndex: 27
    SolutionNameMin: Cijk_Ailk_Bjlk_S_MX_B_UserArgs_MT112x64x64_MI16x16x1_SN_LDSB1_AFC0_AFEM1_AFEM1_ASEM1_CLR0_CADS0_DTLA0_DTLB0_DTVA0_DTVB0_EPS0_FDSI0_GRPM0p90_GRVWA4_GRVWB4_GSU8_GSUAMB_GSUC0_GSUWGMRR1_GLS0_ISA942_IU1_K1_LBSPPA896_LBSPPB512_LBSPPM0_LPA16_LPB16_LPM0_LRVW2_LWPMn1_MIAV0_MIWT7_1_MO40_NTn1_NTA0_NTB0_NTC0_NTD7_NTM0_NEPBS0_NLCA7_NLCB1_ONLL2_PGR2_PLR1_PKA1_SIA3_SS1_SU8_SUM1_SUS256_SPO0_SRVW0_SSO1_SVW1_SK0_SKXCCM0_TLDS0_ULSGRO0_USL1_UIOFGRO0_USFGROn1_VSn1_VWA1_VWB1_WSGRA1_WSGRB1_WS64_WG16_16_1_WGM1_WGMXCC4_WGMXCCG0
    SolutionIndex: 28
    SolutionNameMin: Cijk_Ailk_Bjlk_S_MX_B_UserArgs_MT160x128x16_MI16x16x1_SN_LDSB1_AFC0_AFEM1_AFEM1_ASEM1_CLR1_CADS0_DTLA0_DTLB0_DTVA0_DTVB0_EPS0_FDSI0_GRPM1_GRVWA4_GRVWB4_GSU4_GSUAMB_GSUC0_GSUWGMRR1_GLS0_ISA942_IU1_K1_LBSPPA1280_LBSPPB1024_LBSPPM0_LPA0_LPB0_LPM0_LRVW2_LWPMn1_MIAV0_MIWT10_4_MO40_NTn1_NTA0_NTB0_NTC0_NTD4_NTM0_NEPBS4_NLCA5_NLCB1_ONLL0_PGR2_PLR1_PKA1_SIA3_SS1_SU0_SUM1_SUS0_SPO0_SRVW0_SSO0_SVW2_SK0_SKXCCM0_TLDS0_ULSGRO0_USL1_UIOFGRO0_USFGRO0_VSn1_VWA2_VWB4_WSGRA0_WSGRB1_WS64_WG16_8_1_WGM8_WGMXCC8_WGMXCCGn1
    SolutionIndex: 29
    SolutionNameMin: Cijk_Ailk_Bjlk_S_MX_B_UserArgs_MT80x384x16_MI16x16x1_SN_LDSB0_AFC0_AFEM1_AFEM1_ASEM1_CLR0_CADS0_DTLA0_DTLB0_DTVA0_DTVB0_EPS0_FDSI0_GRPM0p60_GRVWA1_GRVWB4_GSU4_GSUAMB_GSUC1_GSUWGMRR0_GLS0_ISA942_IU1_K1_LBSPPA640_LBSPPB3072_LBSPPM0_LPA16_LPB0_LPM0_LRVW2_LWPM0p70_MIAV0_MIWT5_6_MO40_NTn1_NTA0_NTB0_NTC0_NTD4_NTM0_NEPBS0_NLCA5_NLCB3_ONLL1_PGR2_PLR1_PKA1_SIA3_SS1_SU16_SUM1_SUS512_SPO0_SRVW0_SSO0_SVW1_SK0_SKXCCM0_TLDS0_ULSGRO0_USL1_UIOFGRO0_USFGROn1_VSn1_VWA1_VWB2_WSGRA0_WSGRB0_WS64_WG16_16_1_WGM57_WGMXCC8_WGMXCCGn1
    SolutionIndex: 30
    SolutionNameMin: Cijk_Ailk_Bjlk_S_MX_B_UserArgs_MT64x32x64_MI16x16x1_SN_LDSB1_AFC0_AFEM1_AFEM1_ASEM1_CLR1_CADS0_DTLA0_DTLB0_DTVA0_DTVB0_EPS0_FDSI0_GRPM1_GRVWA4_GRVWB4_GSU8_GSUAMB_GSUC1_GSUWGMRR1_GLS0_ISA942_IU1_K1_LBSPPA512_LBSPPB256_LBSPPM0_LPA0_LPB16_LPM0_LRVW2_LWPM0p40_MIAV0_MIWT2_1_MO40_NTn1_NTA0_NTB4_NTC7_NTD4_NTM0_NEPBS12_NLCA1_NLCB1_ONLL1_PGR2_PLR1_PKA1_SIA3_SS1_SU2_SUM0_SUS2048_SPO0_SRVW0_SSO0_SVW2_SK0_SKXCCM0_TLDS0_ULSGRO0_USL1_UIOFGRO0_USFGROn1_VSn1_VWA2_VWB1_WSGRA0_WSGRB0_WS64_WG32_8_1_WGM1_WGMXCC8_WGMXCCG0
    SolutionIndex: 31
    SolutionNameMin: Cijk_Ailk_Bjlk_S_MX_B_UserArgs_MT32x128x32_MI16x16x1_SN_LDSB0_AFC0_AFEM1_AFEM1_ASEM1_CLR0_CADS0_DTLA0_DTLB0_DTVA0_DTVB0_EPS0_FDSI0_GRPM0p26_GRVWA4_GRVWB4_GSU8_GSUAMB_GSUC0_GSUWGMRR1_GLS0_ISA942_IU1_K1_LBSPPA256_LBSPPB1024_LBSPPM0_LPA0_LPB0_LPM0_LRVW2_LWPM0p60_MIAV0_MIWT2_2_MO40_NTn1_NTA7_NTB0_NTC4_NTD7_NTM0_NEPBS12_NLCA1_NLCB1_ONLL0_PGR2_PLR1_PKA1_SIA3_SS1_SU4_SUM0_SUS512_SPO0_SRVW0_SSO2_SVW2_SK0_SKXCCM0_TLDS0_ULSGRO0_USL1_UIOFGRO0_USFGRO1_VSn1_VWA2_VWB2_WSGRA0_WSGRB1_WS64_WG16_16_1_WGM1_WGMXCC2_WGMXCCG0
    SolutionIndex: 32
    SolutionNameMin: Cijk_Ailk_Bjlk_S_MX_B_UserArgs_MT64x96x32_MI16x16x1_SN_LDSB0_AFC0_AFEM1_AFEM1_ASEM1_CLR0_CADS0_DTLA0_DTLB0_DTVA0_DTVB0_EPS0_FDSI0_GRPM0p80_GRVWA4_GRVWB4_GSU8_GSUAMB_GSUC0_GSUWGMRR1_GLS0_ISA942_IU1_K1_LBSPPA512_LBSPPB768_LBSPPM0_LPA0_LPB16_LPM0_LRVW2_LWPM0p60_MIAV0_MIWT4_3_MO40_NTn1_NTA0_NTB0_NTC4_NTD7_NTM0_NEPBS2_NLCA1_NLCB3_ONLL0_PGR2_PLR1_PKA1_SIA3_SS1_SU2_SUM1_SUS512_SPO0_SRVW0_SSO0_SVW4_SK0_SKXCCM0_TLDS0_ULSGRO0_USL1_UIOFGRO0_USFGRO1_VSn1_VWA4_VWB1_WSGRA0_WSGRB1_WS64_WG16_8_1_WGM12_WGMXCC32_WGMXCCG0
    SolutionIndex: 33
    SolutionNameMin: Cijk_Ailk_Bjlk_S_MX_B_UserArgs_MT128x144x32_MI16x16x1_SN_LDSB1_AFC0_AFEM1_AFEM1_ASEM1_CLR0_CADS0_DTLA0_DTLB0_DTVA0_DTVB0_EPS0_FDSI0_GRPM0p30_GRVWA4_GRVWB2_GSU8_GSUAMB_GSUC0_GSUWGMRR0_GLS0_ISA942_IU1_K1_LBSPPA1024_LBSPPB1152_LBSPPM0_LPA0_LPB16_LPM0_LRVW2_LWPM0p90_MIAV0_MIWT2_9_MO40_NTn1_NTA0_NTB0_NTC0_NTD4_NTM0_NEPBS4_NLCA1_NLCB9_ONLL1_PGR2_PLR1_PKA1_SIA3_SS1_SU0_SUM1_SUS0_SPO0_SRVW0_SSO0_SVW2_SK0_SKXCCM0_TLDS0_ULSGRO0_USL1_UIOFGRO0_USFGROn1_VSn1_VWA2_VWB1_WSGRA1_WSGRB1_WS64_WG64_4_1_WGM1_WGMXCC8_WGMXCCG0
    SolutionIndex: 34
    SolutionNameMin: Cijk_Ailk_Bjlk_S_MX_B_UserArgs_MT256x96x32_MI32x32x1_SN_LDSB1_AFC0_AFEM1_AFEM1_ASEM1_CLR1_CADS0_DTLA0_DTLB0_DTVA0_DTVB0_EPS0_FDSI0_GRPM0p70_GRVWA4_GRVWB4_GSU8_GSUAMB_GSUC0_GSUWGMRR0_GLS0_ISA942_IU1_K1_LBSPPA0_LBSPPB0_LBSPPM0_LPA0_LPB0_LPM0_LRVW2_LWPMn1_MIAV0_MIWT2_3_MO40_NTn1_NTA0_NTB4_NTC0_NTD4_NTM0_NEPBS2_NLCA1_NLCB3_ONLL1_PGR2_PLR1_PKA1_SIA3_SS1_SU2_SUM1_SUS128_SPO0_SRVW0_SSO0_SVW2_SK0_SKXCCM0_TLDS0_ULSGRO0_USL1_UIOFGRO0_USFGROn1_VSn1_VWA2_VWB1_WSGRA2_WSGRB0_WS64_WG128_2_1_WGM114_WGMXCC8_WGMXCCGn1
    SolutionIndex: 35
    SolutionNameMin: Cijk_Ailk_Bjlk_S_MX_B_UserArgs_MT128x160x32_MI16x16x1_SN_LDSB1_AFC0_AFEM1_AFEM1_ASEM1_CLR0_CADS0_DTLA0_DTLB0_DTVA0_DTVB0_EPS0_FDSI0_GRPM0p30_GRVWA4_GRVWB4_GSU8_GSUAMB_GSUC1_GSUWGMRR1_GLS0_ISA942_IU1_K1_LBSPPA1024_LBSPPB1280_LBSPPM0_LPA0_LPB16_LPM0_LRVW2_LWPMn1_MIAV0_MIWT4_5_MO40_NTn1_NTA0_NTB0_NTC4_NTD7_NTM0_NEPBS0_NLCA1_NLCB5_ONLL0_PGR2_PLR1_PKA1_SIA3_SS1_SU0_SUM1_SUS0_SPO0_SRVW0_SSO0_SVW4_SK0_SKXCCM0_TLDS0_ULSGRO0_USL1_UIOFGRO0_USFGROn1_VSn1_VWA4_VWB1_WSGRA2_WSGRB0_WS64_WG32_8_1_WGM1_WGMXCC4_WGMXCCGn1
    SolutionIndex: 36
    SolutionNameMin: Cijk_Ailk_Bjlk_S_MX_B_UserArgs_MT128x144x16_MI16x16x1_SN_LDSB0_AFC0_AFEM1_AFEM1_ASEM1_CLR1_CADS0_DTLA0_DTLB0_DTVA0_DTVB0_EPS0_FDSI0_GRPM0p20_GRVWA4_GRVWB1_GSU4_GSUAMB_GSUC1_GSUWGMRR1_GLS0_ISA942_IU1_K1_LBSPPA1024_LBSPPB1152_LBSPPM0_LPA0_LPB16_LPM0_LRVW2_LWPM0p70_MIAV0_MIWT2_9_MO40_NTn1_NTA0_NTB0_NTC0_NTD4_NTM0_NEPBS10_NLCA1_NLCB9_ONLL0_PGR2_PLR1_PKA1_SIA3_SS1_SU8_SUM0_SUS256_SPO1_SRVW0_SSO0_SVW2_SK0_SKXCCM0_TLDS0_ULSGRO0_USL1_UIOFGRO0_USFGRO0_VSn1_VWA2_VWB1_WSGRA1_WSGRB0_WS64_WG64_4_1_WGM16_WGMXCC4_WGMXCCG0
    SolutionIndex: 37
    SolutionNameMin: Cijk_Ailk_Bjlk_S_MX_B_UserArgs_MT80x128x32_MI16x16x1_SN_LDSB0_AFC0_AFEM1_AFEM1_ASEM1_CLR0_CADS0_DTLA0_DTLB0_DTVA0_DTVB0_EPS0_FDSI0_GRPM0p40_GRVWA2_GRVWB4_GSU8_GSUAMB_GSUC0_GSUWGMRR1_GLS0_ISA942_IU1_K1_LBSPPA640_LBSPPB1024_LBSPPM0_LPA16_LPB0_LPM0_LRVW2_LWPM0p50_MIAV0_MIWT5_2_MO40_NTn1_NTA0_NTB0_NTC4_NTD4_NTM0_NEPBS2_NLCA5_NLCB1_ONLL1_PGR2_PLR1_PKA1_SIA3_SS1_SU2_SUM0_SUS512_SPO0_SRVW0_SSO0_SVW1_SK0_SKXCCM0_TLDS0_ULSGRO0_USL1_UIOFGRO0_USFGRO1_VSn1_VWA1_VWB2_WSGRA0_WSGRB0_WS64_WG16_16_1_WGM19_WGMXCC16_WGMXCCG0
    SolutionIndex: 38
    SolutionNameMin: Cijk_Ailk_Bjlk_S_MX_B_UserArgs_MT176x128x16_MI16x16x1_SN_LDSB0_AFC0_AFEM1_AFEM1_ASEM1_CLR0_CADS0_DTLA0_DTLB0_DTVA0_DTVB0_EPS0_FDSI0_GRPM1_GRVWA1_GRVWB2_GSU4_GSUAMB_GSUC0_GSUWGMRR1_GLS0_ISA942_IU1_K1_LBSPPA128_LBSPPB128_LBSPPM0_LPA2_LPB2_LPM0_LRVW2_LWPMn1_MIAV0_MIWT11_2_MO40_NTn1_NTA0_NTB0_NTC4_NTD4_NTM0_NEPBS12_NLCA11_NLCB1_ONLL1_PGR2_PLR1_PKA1_SIA3_SS1_SU0_SUM1_SUS0_SPO0_SRVW0_SSO0_SVW1_SK0_SKXCCM0_TLDS2_ULSGRO0_USL1_UIOFGRO0_USFGROn1_VSn1_VWA1_VWB2_WSGRA2_WSGRB0_WS64_WG16_16_1_WGM95_WGMXCC8_WGMXCCG0
    SolutionIndex: 39
    SolutionNameMin: Cijk_Ailk_Bjlk_S_MX_B_UserArgs_MT112x448x16_MI16x16x1_SN_LDSB1_AFC0_AFEM1_AFEM1_ASEM1_CLR0_CADS0_DTLA0_DTLB0_DTVA0_DTVB0_EPS0_FDSI0_GRPM0p20_GRVWA1_GRVWB4_GSU4_GSUAMB_GSUC0_GSUWGMRR1_GLS0_ISA942_IU1_K1_LBSPPA896_LBSPPB3584_LBSPPM0_LPA16_LPB16_LPM0_LRVW2_LWPMn1_MIAV0_MIWT7_7_MO40_NTn1_NTA0_NTB0_NTC0_NTD0_NTM0_NEPBS12_NLCA7_NLCB7_ONLL0_PGR2_PLR1_PKA1_SIA3_SS1_SU2_SUM1_SUS128_SPO0_SRVW0_SSO0_SVW1_SK0_SKXCCM0_TLDS0_ULSGRO0_USL1_UIOFGRO0_USFGRO1_VSn1_VWA1_VWB1_WSGRA2_WSGRB2_WS64_WG16_16_1_WGM12_WGMXCC8_WGMXCCGn1
    SolutionIndex: 40
    SolutionNameMin: Cijk_Ailk_Bjlk_S_MX_B_UserArgs_MT64x128x16_MI32x32x1_SN_LDSB1_AFC0_AFEM1_AFEM1_ASEM1_CLR1_CADS0_DTLA0_DTLB0_DTVA0_DTVB0_EPS0_FDSI0_GRPM0p20_GRVWA4_GRVWB4_GSU1_GSUAMB_GSUC1_GSUWGMRR0_GLS0_ISA942_IU1_K1_LBSPPA0_LBSPPB0_LBSPPM0_LPA0_LPB0_LPM0_LRVW2_LWPMn1_MIAV0_MIWT1_2_MO40_NTn1_NTA0_NTB7_NTC4_NTD4_NTM0_NEPBS10_NLCA1_NLCB1_ONLL1_PGR2_PLR1_PKA1_SIA3_SS1_SU4_SUM1_SUS128_SPO0_SRVW0_SSO0_SVW1_SK0_SKXCCM0_TLDS0_ULSGRO1_USL1_UIOFGRO0_USFGRO1_VSn1_VWA1_VWB2_WSGRA2_WSGRB1_WS64_WG64_4_1_WGM1_WGMXCC1_WGMXCCGn1
    SolutionIndex: 41
    SolutionNameMin: Cijk_Ailk_Bjlk_S_MX_B_UserArgs_MT16x128x64_MI16x16x1_SN_LDSB1_AFC0_AFEM1_AFEM1_ASEM1_CLR1_CADS0_DTLA0_DTLB0_DTVA0_DTVB0_EPS0_FDSI0_GRPM0p30_GRVWA4_GRVWB4_GSU8_GSUAMB_GSUC0_GSUWGMRR0_GLS0_ISA942_IU1_K1_LBSPPA128_LBSPPB1024_LBSPPM0_LPA16_LPB0_LPM0_LRVW2_LWPM0p30_MIAV0_MIWT1_2_MO40_NTn1_NTA4_NTB0_NTC4_NTD0_NTM0_NEPBS16_NLCA1_NLCB1_ONLL0_PGR2_PLR1_PKA1_SIA3_SS1_SU2_SUM0_SUS512_SPO0_SRVW0_SSO1_SVW1_SK0_SKXCCM0_TLDS0_ULSGRO0_USL1_UIOFGRO0_USFGRO1_VSn1_VWA1_VWB2_WSGRA0_WSGRB1_WS64_WG16_16_1_WGM1_WGMXCC4_WGMXCCG0
    SolutionIndex: 42
    SolutionNameMin: Cijk_Ailk_Bjlk_S_MX_B_UserArgs_MT144x128x32_MI16x16x1_SN_LDSB1_AFC0_AFEM1_AFEM1_ASEM1_CLR0_CADS0_DTLA0_DTLB0_DTVA0_DTVB0_EPS0_FDSI0_GRPM0p90_GRVWA2_GRVWB4_GSU8_GSUAMB_GSUC0_GSUWGMRR0_GLS0_ISA942_IU1_K1_LBSPPA1152_LBSPPB1024_LBSPPM0_LPA16_LPB0_LPM0_LRVW2_LWPM0p90_MIAV0_MIWT9_2_MO40_NTn1_NTA0_NTB0_NTC0_NTD7_NTM0_NEPBS4_NLCA9_NLCB1_ONLL0_PGR2_PLR1_PKA1_SIA3_SS1_SU4_SUM1_SUS1024_SPO1_SRVW0_SSO2_SVW1_SK0_SKXCCM0_TLDS0_ULSGRO0_USL1_UIOFGRO0_USFGRO0_VSn1_VWA1_VWB2_WSGRA1_WSGRB2_WS64_WG16_16_1_WGM1_WGMXCC16_WGMXCCG0
    SolutionIndex: 43
    SolutionNameMin: Cijk_Ailk_Bjlk_S_MX_B_UserArgs_MT128x48x64_MI16x16x1_SN_LDSB1_AFC0_AFEM1_AFEM1_ASEM1_CLR1_CADS0_DTLA0_DTLB0_DTVA0_DTVB0_EPS0_FDSI0_GRPM0p80_GRVWA4_GRVWB4_GSU8_GSUAMB_GSUC0_GSUWGMRR1_GLS0_ISA942_IU1_K1_LBSPPA1024_LBSPPB384_LBSPPM0_LPA0_LPB16_LPM0_LRVW2_LWPMn1_MIAV0_MIWT2_3_MO40_NTn1_NTA7_NTB0_NTC7_NTD7_NTM0_NEPBS2_NLCA1_NLCB3_ONLL2_PGR2_PLR1_PKA1_SIA3_SS1_SU4_SUM1_SUS256_SPO1_SRVW0_SSO0_SVW2_SK0_SKXCCM0_TLDS0_ULSGRO0_USL1_UIOFGRO0_USFGRO0_VSn1_VWA2_VWB1_WSGRA0_WSGRB0_WS64_WG64_4_1_WGM1_WGMXCC8_WGMXCCG0
    SolutionIndex: 44
    SolutionNameMin: Cijk_Ailk_Bjlk_S_MX_B_UserArgs_MT32x64x64_MI16x16x1_SN_LDSB0_AFC0_AFEM1_AFEM1_ASEM1_CLR1_CADS0_DTLA0_DTLB0_DTVA0_DTVB0_EPS0_FDSI0_GRPM0p90_GRVWA4_GRVWB4_GSU8_GSUAMB_GSUC0_GSUWGMRR1_GLS0_ISA942_IU1_K1_LBSPPA256_LBSPPB512_LBSPPM0_LPA0_LPB16_LPM0_LRVW2_LWPMn1_MIAV0_MIWT2_1_MO40_NTn1_NTA7_NTB0_NTC4_NTD7_NTM0_NEPBS12_NLCA1_NLCB1_ONLL0_PGR2_PLR1_PKA1_SIA3_SS1_SU2_SUM1_SUS256_SPO0_SRVW0_SSO1_SVW2_SK0_SKXCCM0_TLDS0_ULSGRO0_USL1_UIOFGRO0_USFGRO1_VSn1_VWA2_VWB1_WSGRA0_WSGRB1_WS64_WG16_16_1_WGM1_WGMXCC8_WGMXCCG0
    SolutionIndex: 45
    SolutionNameMin: Cijk_Ailk_Bjlk_S_MX_B_UserArgs_MT320x192x32_MI16x16x1_SN_LDSB1_AFC0_AFEM1_AFEM1_ASEM1_CLR0_CADS0_DTLA0_DTLB0_DTVA0_DTVB0_EPS0_FDSI0_GRPM0p80_GRVWA4_GRVWB4_GSU1_GSUAMB_GSUC1_GSUWGMRR1_GLS0_ISA942_IU1_K1_LBSPPA2560_LBSPPB1536_LBSPPM0_LPA0_LPB0_LPM0_LRVW2_LWPMn1_MIAV0_MIWT10_6_MO40_NTn1_NTA0_NTB0_NTC0_NTD4_NTM0_NEPBS0_NLCA5_NLCB3_ONLL2_PGR2_PLR1_PKA1_SIA3_SS1_SU2_SUM1_SUS128_SPO0_SRVW0_SSO0_SVW2_SK0_SKXCCM0_TLDS0_ULSGRO0_USL1_UIOFGRO0_USFGROn1_VSn1_VWA2_VWB2_WSGRA2_WSGRB1_WS64_WG32_8_1_WGM209_WGMXCC4_WGMXCCGn1
    SolutionIndex: 46
    SolutionNameMin: Cijk_Ailk_Bjlk_S_MX_B_UserArgs_MT32x128x32_MI16x16x1_SN_LDSB0_AFC0_AFEM1_AFEM1_ASEM1_CLR0_CADS0_DTLA0_DTLB0_DTVA0_DTVB0_EPS0_FDSI0_GRPM0p90_GRVWA4_GRVWB4_GSU8_GSUAMB_GSUC0_GSUWGMRR1_GLS0_ISA942_IU1_K1_LBSPPA256_LBSPPB1024_LBSPPM0_LPA0_LPB0_LPM0_LRVW2_LWPM0p26_MIAV0_MIWT2_2_MO40_NTn1_NTA4_NTB0_NTC4_NTD7_NTM0_NEPBS2_NLCA1_NLCB1_ONLL0_PGR2_PLR1_PKA1_SIA3_SS1_SU4_SUM0_SUS512_SPO0_SRVW0_SSO0_SVW2_SK0_SKXCCM0_TLDS0_ULSGRO0_USL1_UIOFGRO0_USFGRO1_VSn1_VWA2_VWB2_WSGRA0_WSGRB2_WS64_WG16_16_1_WGM1_WGMXCC2_WGMXCCG0
    SolutionIndex: 47
    SolutionNameMin: Cijk_Ailk_Bjlk_S_MX_B_UserArgs_MT112x256x16_MI16x16x1_SN_LDSB0_AFC0_AFEM1_AFEM1_ASEM1_CLR0_CADS0_DTLA0_DTLB0_DTVA0_DTVB0_EPS0_FDSI0_GRPM0p80_GRVWA1_GRVWB4_GSU4_GSUAMB_GSUC1_GSUWGMRR1_GLS0_ISA942_IU1_K1_LBSPPA896_LBSPPB2048_LBSPPM0_LPA16_LPB0_LPM0_LRVW2_LWPMn1_MIAV0_MIWT7_4_MO40_NTn1_NTA0_NTB7_NTC0_NTD4_NTM0_NEPBS2_NLCA7_NLCB1_ONLL0_PGR2_PLR1_PKA1_SIA3_SS1_SU64_SUM1_SUS64_SPO0_SRVW0_SSO0_SVW1_SK0_SKXCCM0_TLDS0_ULSGRO0_USL1_UIOFGRO0_USFGRO1_VSn1_VWA1_VWB4_WSGRA0_WSGRB1_WS64_WG16_16_1_WGM1_WGMXCC8_WGMXCCGn1
    SolutionIndex: 48
    SolutionNameMin: Cijk_Ailk_Bjlk_S_MX_B_UserArgs_MT16x128x16_MI16x16x1_SN_LDSB1_AFC0_AFEM1_AFEM1_ASEM1_CLR1_CADS0_DTLA0_DTLB0_DTVA0_DTVB0_EPS0_FDSI0_GRPM0p26_GRVWA1_GRVWB4_GSU1_GSUAMB_GSUC0_GSUWGMRR0_GLS0_ISA942_IU1_K1_LBSPPA128_LBSPPB1024_LBSPPM0_LPA16_LPB0_LPM0_LRVW2_LWPM0p60_MIAV0_MIWT1_2_MO40_NTn1_NTA0_NTB7_NTC0_NTD0_NTM0_NEPBS12_NLCA1_NLCB1_ONLL2_PGR2_PLR1_PKA1_SIA3_SS1_SU4_SUM0_SUS64_SPO0_SRVW0_SSO0_SVW1_SK0_SKXCCM0_TLDS0_ULSGRO0_USL1_UIOFGRO0_USFGRO1_VSn1_VWA1_VWB2_WSGRA0_WSGRB1_WS64_WG16_16_1_WGM1_WGMXCC32_WGMXCCG0
    SolutionIndex: 49
    SolutionNameMin: Cijk_Ailk_Bjlk_S_MX_B_UserArgs_MT128x144x32_MI16x16x1_SN_LDSB1_AFC0_AFEM1_AFEM1_ASEM1_CLR1_CADS0_DTLA0_DTLB0_DTVA0_DTVB0_EPS0_FDSI0_GRPM0p30_GRVWA4_GRVWB2_GSU8_GSUAMB_GSUC1_GSUWGMRR1_GLS0_ISA942_IU1_K1_LBSPPA1024_LBSPPB1152_LBSPPM0_LPA0_LPB16_LPM0_LRVW2_LWPM0p30_MIAV0_MIWT2_9_MO40_NTn1_NTA0_NTB0_NTC7_NTD4_NTM0_NEPBS4_NLCA1_NLCB9_ONLL2_PGR2_PLR1_PKA1_SIA3_SS1_SU2_SUM0_SUS2048_SPO0_SRVW0_SSO1_SVW2_SK0_SKXCCM0_TLDS0_ULSGRO0_USL1_UIOFGRO0_USFGRO0_VSn1_VWA2_VWB1_WSGRA0_WSGRB1_WS64_WG64_4_1_WGM1_WGMXCC8_WGMXCCG0
    SolutionIndex: 50
    SolutionNameMin: Cijk_Ailk_Bjlk_S_MX_B_UserArgs_MT192x128x16_MI32x32x1_SN_LDSB0_AFC0_AFEM1_AFEM1_ASEM1_CLR0_CADS0_DTLA0_DTLB0_DTVA0_DTVB0_EPS0_FDSI0_GRPM0p10_GRVWA4_GRVWB4_GSU8_GSUAMB_GSUC1_GSUWGMRR0_GLS0_ISA942_IU1_K1_LBSPPA0_LBSPPB0_LBSPPM0_LPA0_LPB0_LPM0_LRVW2_LWPM0p80_MIAV0_MIWT3_2_MO40_NTn1_NTA0_NTB0_NTC0_NTD4_NTM0_NEPBS0_NLCA3_NLCB1_ONLL0_PGR2_PLR1_PKA1_SIA3_SS1_SU0_SUM1_SUS0_SPO0_SRVW0_SSO0_SVW1_SK0_SKXCCM0_TLDS0_ULSGRO0_USL1_UIOFGRO0_USFGROn1_VSn1_VWA1_VWB2_WSGRA1_WSGRB0_WS64_WG64_4_1_WGM1_WGMXCC16_WGMXCCG0
    SolutionIndex: 51
    SolutionNameMin: Cijk_Ailk_Bjlk_S_MX_B_UserArgs_MT32x128x16_MI32x32x1_SN_LDSB1_AFC0_AFEM1_AFEM1_ASEM1_CLR1_CADS0_DTLA0_DTLB0_DTVA0_DTVB0_EPS0_FDSI0_GRPM0p80_GRVWA2_GRVWB4_GSU1_GSUAMB_GSUC1_GSUWGMRR1_GLS0_ISA942_IU1_K1_LBSPPA0_LBSPPB0_LBSPPM0_LPA0_LPB0_LPM0_LRVW2_LWPM0p80_MIAV0_MIWT1_1_MO40_NTn1_NTA0_NTB4_NTC7_NTD0_NTM0_NEPBS0_NLCA1_NLCB1_ONLL2_PGR2_PLR1_PKA1_SIA3_SS1_SU16_SUM0_SUS128_SPO0_SRVW0_SSO0_SVW1_SK0_SKXCCM0_TLDS0_ULSGRO0_USL1_UIOFGRO0_USFGROn1_VSn1_VWA1_VWB1_WSGRA1_WSGRB0_WS64_WG32_8_1_WGM1_WGMXCC1_WGMXCCG48
    SolutionIndex: 52
    SolutionNameMin: Cijk_Ailk_Bjlk_S_MX_B_UserArgs_MT128x192x16_MI16x16x1_SN_LDSB0_AFC0_AFEM1_AFEM1_ASEM1_CLR0_CADS0_DTLA0_DTLB0_DTVA0_DTVB0_EPS0_FDSI0_GRPM0p60_GRVWA4_GRVWB4_GSU8_GSUAMB_GSUC1_GSUWGMRR1_GLS0_ISA942_IU1_K1_LBSPPA1024_LBSPPB1536_LBSPPM0_LPA0_LPB0_LPM0_LRVW2_LWPM1_MIAV0_MIWT4_6_MO40_NTn1_NTA0_NTB0_NTC7_NTD4_NTM0_NEPBS0_NLCA1_NLCB3_ONLL2_PGR2_PLR1_PKA1_SIA3_SS1_SU16_SUM0_SUS128_SPO1_SRVW0_SSO1_SVW4_SK0_SKXCCM0_TLDS0_ULSGRO0_USL1_UIOFGRO0_USFGROn1_VSn1_VWA4_VWB2_WSGRA1_WSGRB1_WS64_WG32_8_1_WGM1_WGMXCC16_WGMXCCG0
    SolutionIndex: 53
    SolutionNameMin: Cijk_Ailk_Bjlk_S_MX_B_UserArgs_MT144x256x16_MI16x16x1_SN_LDSB0_AFC0_AFEM1_AFEM1_ASEM1_CLR0_CADS0_DTLA0_DTLB0_DTVA0_DTVB0_EPS0_FDSI0_GRPM0p70_GRVWA1_GRVWB2_GSU2_GSUAMB_GSUC1_GSUWGMRR1_GLS0_ISA942_IU1_K1_LBSPPA128_LBSPPB256_LBSPPM0_LPA2_LPB2_LPM0_LRVW2_LWPMn1_MIAV0_MIWT9_4_MO40_NTn1_NTA0_NTB0_NTC7_NTD0_NTM0_NEPBS10_NLCA9_NLCB1_ONLL1_PGR2_PLR1_PKA1_SIA3_SS1_SU2_SUM0_SUS256_SPO0_SRVW0_SSO0_SVW1_SK0_SKXCCM0_TLDS2_ULSGRO0_USL1_UIOFGRO0_USFGRO0_VSn1_VWA1_VWB4_WSGRA1_WSGRB0_WS64_WG16_16_1_WGM304_WGMXCC4_WGMXCCGn1
    SolutionIndex: 54
    SolutionNameMin: Cijk_Ailk_Bjlk_S_MX_B_UserArgs_MT256x96x32_MI32x32x1_SN_LDSB1_AFC0_AFEM1_AFEM1_ASEM1_CLR1_CADS0_DTLA0_DTLB0_DTVA0_DTVB0_EPS0_FDSI0_GRPM0p90_GRVWA4_GRVWB4_GSU8_GSUAMB_GSUC1_GSUWGMRR0_GLS0_ISA942_IU1_K1_LBSPPA0_LBSPPB0_LBSPPM0_LPA0_LPB0_LPM0_LRVW2_LWPMn1_MIAV0_MIWT2_3_MO40_NTn1_NTA0_NTB0_NTC7_NTD4_NTM0_NEPBS2_NLCA1_NLCB3_ONLL1_PGR2_PLR1_PKA1_SIA3_SS1_SU8_SUM0_SUS2048_SPO1_SRVW0_SSO0_SVW2_SK0_SKXCCM0_TLDS0_ULSGRO0_USL1_UIOFGRO0_USFGRO1_VSn1_VWA2_VWB1_WSGRA1_WSGRB2_WS64_WG128_2_1_WGM1_WGMXCC1_WGMXCCG2
    SolutionIndex: 55
    SolutionNameMin: Cijk_Ailk_Bjlk_S_MX_B_UserArgs_MT256x112x16_MI16x16x1_SN_LDSB0_AFC0_AFEM1_AFEM1_ASEM1_CLR1_CADS0_DTLA0_DTLB0_DTVA0_DTVB0_EPS0_FDSI0_GRPM0p30_GRVWA4_GRVWB1_GSU4_GSUAMB_GSUC1_GSUWGMRR1_GLS0_ISA942_IU1_K1_LBSPPA2048_LBSPPB896_LBSPPM0_LPA0_LPB16_LPM0_LRVW2_LWPM0p80_MIAV0_MIWT4_7_MO40_NTn1_NTA0_NTB0_NTC7_NTD7_NTM0_NEPBS6_NLCA1_NLCB7_ONLL2_PGR2_PLR1_PKA1_SIA3_SS1_SU8_SUM0_SUS64_SPO1_SRVW0_SSO3_SVW4_SK0_SKXCCM0_TLDS0_ULSGRO0_USL1_UIOFGRO0_USFGRO0_VSn1_VWA4_VWB1_WSGRA0_WSGRB0_WS64_WG64_4_1_WGM1_WGMXCC8_WGMXCCGn1
    SolutionIndex: 56
    SolutionNameMin: Cijk_Ailk_Bjlk_S_MX_B_UserArgs_MT48x128x64_MI16x16x1_SN_LDSB1_AFC0_AFEM1_AFEM1_ASEM1_CLR0_CADS0_DTLA0_DTLB0_DTVA0_DTVB0_EPS0_FDSI0_GRPM0p70_GRVWA4_GRVWB4_GSU16_GSUAMB_GSUC0_GSUWGMRR1_GLS0_ISA942_IU1_K1_LBSPPA384_LBSPPB1024_LBSPPM0_LPA16_LPB0_LPM0_LRVW2_LWPMn1_MIAV0_MIWT3_2_MO40_NTn1_NTA0_NTB4_NTC4_NTD7_NTM0_NEPBS2_NLCA3_NLCB1_ONLL0_PGR2_PLR1_PKA1_SIA3_SS1_SU2_SUM1_SUS256_SPO0_SRVW0_SSO0_SVW1_SK0_SKXCCM0_TLDS0_ULSGRO0_USL1_UIOFGRO0_USFGRO0_VSn1_VWA1_VWB2_WSGRA0_WSGRB1_WS64_WG16_16_1_WGM1_WGMXCC16_WGMXCCG0
    SolutionIndex: 57
    SolutionNameMin: Cijk_Ailk_Bjlk_S_MX_B_UserArgs_MT16x64x64_MI16x16x1_SN_LDSB0_AFC0_AFEM1_AFEM1_ASEM1_CLR1_CADS0_DTLA0_DTLB0_DTVA0_DTVB0_EPS0_FDSI0_GRPM0p70_GRVWA4_GRVWB4_GSU8_GSUAMB_GSUC0_GSUWGMRR1_GLS0_ISA942_IU1_K1_LBSPPA128_LBSPPB512_LBSPPM0_LPA16_LPB16_LPM0_LRVW2_LWPM0p27_MIAV0_MIWT1_1_MO40_NTn1_NTA0_NTB0_NTC0_NTD0_NTM0_NEPBS16_NLCA1_NLCB1_ONLL1_PGR2_PLR1_PKA1_SIA3_SS1_SU4_SUM0_SUS1024_SPO0_SRVW0_SSO0_SVW1_SK0_SKXCCM0_TLDS0_ULSGRO0_USL1_UIOFGRO0_USFGROn1_VSn1_VWA1_VWB1_WSGRA1_WSGRB0_WS64_WG16_16_1_WGM1_WGMXCC8_WGMXCCG152
    SolutionIndex: 58
    SolutionNameMin: Cijk_Ailk_Bjlk_S_MX_B_UserArgs_MT256x96x32_MI16x16x1_SN_LDSB1_AFC0_AFEM1_AFEM1_ASEM1_CLR0_CADS0_DTLA0_DTLB0_DTVA0_DTVB0_EPS0_FDSI0_GRPM0p90_GRVWA4_GRVWB4_GSU8_GSUAMB_GSUC1_GSUWGMRR1_GLS0_ISA942_IU1_K1_LBSPPA2048_LBSPPB768_LBSPPM0_LPA0_LPB0_LPM0_LRVW2_LWPM0p60_MIAV0_MIWT4_6_MO40_NTn1_NTA0_NTB0_NTC7_NTD4_NTM0_NEPBS12_NLCA1_NLCB3_ONLL0_PGR2_PLR1_PKA1_SIA3_SS1_SU2_SUM4_SUS128_SPO0_SRVW0_SSO0_SVW4_SK0_SKXCCM0_TLDS0_ULSGRO0_USL1_UIOFGRO0_USFGROn1_VSn1_VWA4_VWB2_WSGRA1_WSGRB0_WS64_WG64_4_1_WGM152_WGMXCC16_WGMXCCGn1
    SolutionIndex: 59
    SolutionNameMin: Cijk_Ailk_Bjlk_S_MX_B_UserArgs_MT64x96x64_MI16x16x1_SN_LDSB1_AFC0_AFEM1_AFEM1_ASEM1_CLR1_CADS0_DTLA0_DTLB0_DTVA0_DTVB0_EPS0_FDSI0_GRPM1_GRVWA4_GRVWB4_GSUn1_GSUAMBSK_GSUC1_GSUWGMRR1_GLS0_ISA942_IU1_K1_LBSPPA512_LBSPPB768_LBSPPM0_LPA0_LPB16_LPM0_LRVW2_LWPMn1_MIAV0_MIWT2_3_MO40_NTn1_NTA0_NTB0_NTC0_NTD4_NTM0_NEPBS8_NLCA1_NLCB3_ONLL1_PGR2_PLR1_PKA1_SIA3_SS1_SU0_SUM1_SUS0_SPO0_SRVW0_SSO0_SVW2_SK0_SKXCCM0_TLDS0_ULSGRO0_USL1_UIOFGRO0_USFGROn1_VSn1_VWA2_VWB1_WSGRA0_WSGRB0_WS64_WG32_8_1_WGM1_WGMXCC8_WGMXCCGn1
    SolutionIndex: 60
    SolutionNameMin: Cijk_Ailk_Bjlk_S_MX_B_UserArgs_MT64x32x64_MI16x16x1_SN_LDSB1_AFC0_AFEM1_AFEM1_ASEM1_CLR1_CADS0_DTLA0_DTLB0_DTVA0_DTVB0_EPS0_FDSI0_GRPM1_GRVWA4_GRVWB4_GSUn1_GSUAMBSK_GSUC1_GSUWGMRR1_GLS0_ISA942_IU1_K1_LBSPPA512_LBSPPB256_LBSPPM0_LPA16_LPB0_LPM0_LRVW2_LWPMn1_MIAV0_MIWT1_2_MO40_NTn1_NTA0_NTB4_NTC0_NTD4_NTM0_NEPBS8_NLCA1_NLCB1_ONLL1_PGR2_PLR1_PKA1_SIA3_SS1_SU0_SUM1_SUS0_SPO0_SRVW0_SSO0_SVW1_SK0_SKXCCM0_TLDS0_ULSGRO0_USL1_UIOFGRO0_USFGROn1_VSn1_VWA1_VWB2_WSGRA0_WSGRB0_WS64_WG64_4_1_WGM1_WGMXCC8_WGMXCCGn1
    SolutionIndex: 61
    SolutionNameMin: Cijk_Ailk_Bjlk_S_MX_B_UserArgs_MT96x96x64_MI16x16x1_SN_LDSB1_AFC0_AFEM1_AFEM1_ASEM1_CLR1_CADS0_DTLA0_DTLB0_DTVA0_DTVB0_EPS0_FDSI0_GRPM1_GRVWA4_GRVWB4_GSUn1_GSUAMBSK_GSUC1_GSUWGMRR1_GLS0_ISA942_IU1_K1_LBSPPA768_LBSPPB768_LBSPPM0_LPA16_LPB16_LPM0_LRVW2_LWPMn1_MIAV0_MIWT3_3_MO40_NTn1_NTA0_NTB0_NTC0_NTD4_NTM0_NEPBS6_NLCA3_NLCB3_ONLL1_PGR2_PLR1_PKA1_SIA3_SS1_SU0_SUM1_SUS0_SPO0_SRVW0_SSO0_SVW1_SK0_SKXCCM0_TLDS0_ULSGRO1_USL1_UIOFGRO0_USFGROn1_VSn1_VWA1_VWB1_WSGRA0_WSGRB0_WS64_WG32_8_1_WGM8_WGMXCC8_WGMXCCGn1
    SolutionIndex: 62
    SolutionNameMin: Cijk_Ailk_Bjlk_S_MX_B_UserArgs_MT64x32x64_MI16x16x1_SN_LDSB1_AFC0_AFEM1_AFEM1_ASEM1_CLR1_CADS0_DTLA0_DTLB0_DTVA0_DTVB0_EPS0_FDSI0_GRPM1_GRVWA4_GRVWB4_GSUn1_GSUAMBSK_GSUC1_GSUWGMRR1_GLS0_ISA942_IU1_K1_LBSPPA512_LBSPPB256_LBSPPM0_LPA0_LPB0_LPM0_LRVW2_LWPMn1_MIAV0_MIWT2_2_MO40_NTn1_NTA0_NTB0_NTC0_NTD4_NTM0_NEPBS8_NLCA1_NLCB1_ONLL1_PGR2_PLR1_PKA1_SIA3_SS1_SU0_SUM1_SUS0_SPO0_SRVW0_SSO0_SVW2_SK0_SKXCCM0_TLDS0_ULSGRO0_USL1_UIOFGRO0_USFGROn1_VSn1_VWA2_VWB2_WSGRA0_WSGRB0_WS64_WG32_4_2_WGM8_WGMXCC8_WGMXCCGn1
    SolutionIndex: 63
    SolutionNameMin: Cijk_Ailk_Bjlk_S_MX_B_UserArgs_MT64x32x64_MI16x16x1_SN_LDSB1_AFC0_AFEM1_AFEM1_ASEM1_CLR1_CADS0_DTLA0_DTLB0_DTVA0_DTVB0_EPS0_FDSI0_GRPM1_GRVWA4_GRVWB4_GSUn1_GSUAMBSK_GSUC1_GSUWGMRR1_GLS0_ISA942_IU1_K1_LBSPPA512_LBSPPB256_LBSPPM0_LPA0_LPB0_LPM0_LRVW2_LWPMn1_MIAV0_MIWT4_2_MO40_NTn1_NTA4_NTB0_NTC0_NTD4_NTM0_NEPBS8_NLCA1_NLCB1_ONLL1_PGR2_PLR1_PKA1_SIA3_SS1_SU0_SUM1_SUS0_SPO0_SRVW0_SSO0_SVW4_SK0_SKXCCM0_TLDS0_ULSGRO1_USL1_UIOFGRO0_USFGROn1_VSn1_VWA4_VWB2_WSGRA0_WSGRB0_WS64_WG16_4_4_WGM6_WGMXCC8_WGMXCCGn1
    SolutionIndex: 64
    SolutionNameMin: Cijk_Ailk_Bjlk_S_MX_B_UserArgs_MT128x80x64_MI16x16x1_SN_LDSB1_AFC0_AFEM1_AFEM1_ASEM1_CLR1_CADS0_DTLA0_DTLB0_DTVA0_DTVB0_EPS0_FDSI0_GRPM1_GRVWA4_GRVWB4_GSUn1_GSUAMBSK_GSUC1_GSUWGMRR1_GLS0_ISA942_IU1_K1_LBSPPA1024_LBSPPB640_LBSPPM0_LPA0_LPB16_LPM0_LRVW2_LWPMn1_MIAV0_MIWT2_5_MO40_NTn1_NTA0_NTB0_NTC0_NTD4_NTM0_NEPBS8_NLCA1_NLCB5_ONLL1_PGR2_PLR1_PKA1_SIA3_SS1_SU0_SUM1_SUS0_SPO0_SRVW0_SSO0_SVW2_SK0_SKXCCM0_TLDS0_ULSGRO0_USL1_UIOFGRO0_USFGROn1_VSn1_VWA2_VWB1_WSGRA0_WSGRB0_WS64_WG64_4_1_WGM8_WGMXCC8_WGMXCCGn1
    SolutionIndex: 65
    SolutionNameMin: Cijk_Ailk_Bjlk_S_MX_B_UserArgs_MT32x128x32_MI16x16x1_SN_LDSB1_AFC0_AFEM1_AFEM1_ASEM1_CLR1_CADS0_DTLA0_DTLB0_DTVA0_DTVB0_EPS0_FDSI0_GRPM1_GRVWA4_GRVWB4_GSUn1_GSUAMBSK_GSUC1_GSUWGMRR1_GLS0_ISA942_IU1_K1_LBSPPA256_LBSPPB1024_LBSPPM0_LPA0_LPB0_LPM0_LRVW2_LWPMn1_MIAV0_MIWT2_2_MO40_NTn1_NTA0_NTB4_NTC0_NTD4_NTM0_NEPBS8_NLCA1_NLCB1_ONLL1_PGR2_PLR1_PKA1_SIA3_SS1_SU0_SUM1_SUS0_SPO0_SRVW0_SSO0_SVW2_SK0_SKXCCM0_TLDS0_ULSGRO0_USL1_UIOFGRO0_USFGROn1_VSn1_VWA2_VWB2_WSGRA0_WSGRB0_WS64_WG16_16_1_WGM1_WGMXCC8_WGMXCCGn1
    SolutionIndex: 66
    SolutionNameMin: Cijk_Ailk_Bjlk_S_MX_B_UserArgs_MT64x64x64_MI16x16x1_SN_LDSB1_AFC0_AFEM1_AFEM1_ASEM1_CLR1_CADS0_DTLA0_DTLB0_DTVA0_DTVB0_EPS0_FDSI0_GRPM1_GRVWA4_GRVWB4_GSUn1_GSUAMBSK_GSUC1_GSUWGMRR1_GLS0_ISA942_IU1_K1_LBSPPA512_LBSPPB512_LBSPPM0_LPA0_LPB0_LPM0_LRVW2_LWPMn1_MIAV0_MIWT2_2_MO40_NTn1_NTA4_NTB0_NTC0_NTD4_NTM0_NEPBS8_NLCA1_NLCB1_ONLL1_PGR2_PLR1_PKA1_SIA3_SS1_SU0_SUM1_SUS0_SPO0_SRVW0_SSO0_SVW2_SK0_SKXCCM0_TLDS0_ULSGRO1_USL1_UIOFGRO0_USFGROn1_VSn1_VWA2_VWB2_WSGRA0_WSGRB0_WS64_WG32_8_1_WGM8_WGMXCC8_WGMXCCGn1
    SolutionIndex: 67
    SolutionNameMin: Cijk_Ailk_Bjlk_S_MX_B_UserArgs_MT32x32x256_MI16x16x1_SN_LDSB1_AFC0_AFEM1_AFEM1_ASEM1_CLR1_CADS0_DTLA0_DTLB0_DTVA0_DTVB0_EPS0_FDSI0_GRPM1_GRVWA4_GRVWB4_GSUn1_GSUAMBSK_GSUC1_GSUWGMRR1_GLS0_ISA942_IU1_K1_LBSPPA256_LBSPPB256_LBSPPM0_LPA0_LPB0_LPM0_LRVW2_LWPMn1_MIAV0_MIWT2_2_MO40_NTn1_NTA0_NTB0_NTC0_NTD4_NTM0_NEPBS8_NLCA1_NLCB1_ONLL1_PGR2_PLR1_PKA1_SIA3_SS1_SU0_SUM1_SUS0_SPO0_SRVW0_SSO0_SVW2_SK0_SKXCCM0_TLDS0_ULSGRO0_USL1_UIOFGRO0_USFGROn1_VSn1_VWA2_VWB2_WSGRA0_WSGRB0_WS64_WG16_4_4_WGM1_WGMXCC8_WGMXCCGn1
    SolutionIndex: 68
    SolutionNameMin: Cijk_Ailk_Bjlk_S_MX_B_UserArgs_MT16x128x32_MI16x16x1_SN_LDSB1_AFC0_AFEM1_AFEM1_ASEM1_CLR1_CADS0_DTLA0_DTLB0_DTVA0_DTVB0_EPS0_FDSI0_GRPM1_GRVWA2_GRVWB4_GSUn1_GSUAMBSK_GSUC1_GSUWGMRR1_GLS0_ISA942_IU1_K1_LBSPPA128_LBSPPB1024_LBSPPM0_LPA16_LPB0_LPM0_LRVW2_LWPMn1_MIAV0_MIWT1_2_MO40_NTn1_NTA0_NTB4_NTC0_NTD4_NTM0_NEPBS8_NLCA1_NLCB1_ONLL1_PGR2_PLR1_PKA1_SIA3_SS1_SU0_SUM1_SUS0_SPO0_SRVW0_SSO0_SVW1_SK0_SKXCCM0_TLDS0_ULSGRO0_USL1_UIOFGRO0_USFGROn1_VSn1_VWA1_VWB2_WSGRA0_WSGRB0_WS64_WG16_16_1_WGM1_WGMXCC8_WGMXCCGn1
    SolutionIndex: 69
    SolutionNameMin: Cijk_Ailk_Bjlk_S_MX_B_UserArgs_MT32x32x256_MI16x16x1_SN_LDSB1_AFC0_AFEM1_AFEM1_ASEM1_CLR1_CADS0_DTLA0_DTLB0_DTVA0_DTVB0_EPS0_FDSI0_GRPM1_GRVWA4_GRVWB4_GSUn1_GSUAMBSK_GSUC1_GSUWGMRR1_GLS0_ISA942_IU1_K1_LBSPPA256_LBSPPB256_LBSPPM0_LPA0_LPB0_LPM0_LRVW2_LWPMn1_MIAV0_MIWT2_2_MO40_NTn1_NTA0_NTB4_NTC0_NTD4_NTM0_NEPBS8_NLCA1_NLCB1_ONLL1_PGR2_PLR1_PKA1_SIA3_SS1_SU0_SUM1_SUS0_SPO0_SRVW0_SSO0_SVW2_SK0_SKXCCM0_TLDS0_ULSGRO0_USL1_UIOFGRO0_USFGROn1_VSn1_VWA2_VWB2_WSGRA0_WSGRB0_WS64_WG16_4_4_WGM1_WGMXCC8_WGMXCCGn1
    SolutionIndex: 70
    SolutionNameMin: Cijk_Ailk_Bjlk_S_MX_B_UserArgs_MT64x32x64_MI16x16x1_SN_LDSB1_AFC0_AFEM1_AFEM1_ASEM1_CLR1_CADS0_DTLA0_DTLB0_DTVA0_DTVB0_EPS0_FDSI0_GRPM1_GRVWA4_GRVWB4_GSUn1_GSUAMBSK_GSUC1_GSUWGMRR1_GLS0_ISA942_IU1_K1_LBSPPA512_LBSPPB256_LBSPPM0_LPA0_LPB0_LPM0_LRVW2_LWPMn1_MIAV0_MIWT4_2_MO40_NTn1_NTA0_NTB0_NTC0_NTD4_NTM0_NEPBS8_NLCA1_NLCB1_ONLL1_PGR2_PLR1_PKA1_SIA3_SS1_SU0_SUM1_SUS0_SPO0_SRVW0_SSO0_SVW4_SK0_SKXCCM0_TLDS0_ULSGRO0_USL1_UIOFGRO0_USFGROn1_VSn1_VWA4_VWB2_WSGRA0_WSGRB0_WS64_WG16_4_4_WGM1_WGMXCC8_WGMXCCGn1
    SolutionIndex: 71
    SolutionNameMin: Cijk_Ailk_Bjlk_S_MX_B_UserArgs_MT128x96x64_MI16x16x1_SN_LDSB1_AFC0_AFEM1_AFEM1_ASEM1_CLR1_CADS0_DTLA0_DTLB0_DTVA0_DTVB0_EPS0_FDSI0_GRPM1_GRVWA4_GRVWB4_GSUn1_GSUAMBSK_GSUC1_GSUWGMRR1_GLS0_ISA942_IU1_K1_LBSPPA1024_LBSPPB768_LBSPPM0_LPA0_LPB0_LPM0_LRVW2_LWPMn1_MIAV0_MIWT8_6_MO40_NTn1_NTA4_NTB0_NTC0_NTD4_NTM0_NEPBS8_NLCA1_NLCB3_ONLL1_PGR2_PLR1_PKA1_SIA3_SS1_SU0_SUM1_SUS0_SPO0_SRVW0_SSO0_SVW4_SK0_SKXCCM0_TLDS0_ULSGRO0_USL1_UIOFGRO0_USFGROn1_VSn1_VWA4_VWB2_WSGRA0_WSGRB0_WS64_WG16_4_4_WGM8_WGMXCC8_WGMXCCGn1
    SolutionIndex: 72
    SolutionNameMin: Cijk_Ailk_Bjlk_S_MX_B_UserArgs_MT64x32x64_MI16x16x1_SN_LDSB1_AFC0_AFEM1_AFEM1_ASEM1_CLR1_CADS0_DTLA0_DTLB0_DTVA0_DTVB0_EPS0_FDSI0_GRPM1_GRVWA4_GRVWB4_GSUn1_GSUAMBSK_GSUC1_GSUWGMRR1_GLS0_ISA942_IU1_K1_LBSPPA512_LBSPPB256_LBSPPM0_LPA0_LPB0_LPM0_LRVW2_LWPMn1_MIAV0_MIWT4_2_MO40_NTn1_NTA0_NTB4_NTC0_NTD4_NTM0_NEPBS8_NLCA1_NLCB1_ONLL1_PGR2_PLR1_PKA1_SIA3_SS1_SU0_SUM1_SUS0_SPO0_SRVW0_SSO0_SVW4_SK0_SKXCCM0_TLDS0_ULSGRO0_USL1_UIOFGRO0_USFGROn1_VSn1_VWA4_VWB2_WSGRA0_WSGRB0_WS64_WG16_4_4_WGM1_WGMXCC8_WGMXCCGn1
    SolutionIndex: 73
    SolutionNameMin: Cijk_Ailk_Bjlk_S_MX_B_UserArgs_MT128x64x64_MI16x16x1_SN_LDSB1_AFC0_AFEM1_AFEM1_ASEM1_CLR1_CADS0_DTLA0_DTLB0_DTVA0_DTVB0_EPS0_FDSI0_GRPM1_GRVWA4_GRVWB4_GSUn1_GSUAMBSK_GSUC1_GSUWGMRR1_GLS0_ISA942_IU1_K1_LBSPPA1024_LBSPPB512_LBSPPM0_LPA0_LPB0_LPM0_LRVW2_LWPMn1_MIAV0_MIWT8_4_MO40_NTn1_NTA0_NTB0_NTC0_NTD4_NTM0_NEPBS8_NLCA1_NLCB1_ONLL1_PGR2_PLR1_PKA1_SIA3_SS1_SU0_SUM1_SUS0_SPO0_SRVW0_SSO0_SVW4_SK0_SKXCCM0_TLDS0_ULSGRO1_USL1_UIOFGRO0_USFGROn1_VSn1_VWA4_VWB4_WSGRA0_WSGRB0_WS64_WG16_4_4_WGM8_WGMXCC8_WGMXCCGn1
    SolutionIndex: 74
    SolutionNameMin: Cijk_Ailk_Bjlk_S_MX_B_UserArgs_MT128x64x64_MI16x16x1_SN_LDSB1_AFC0_AFEM1_AFEM1_ASEM1_CLR1_CADS0_DTLA0_DTLB0_DTVA0_DTVB0_EPS0_FDSI0_GRPM1_GRVWA4_GRVWB4_GSUn1_GSUAMBSK_GSUC1_GSUWGMRR1_GLS0_ISA942_IU1_K1_LBSPPA1024_LBSPPB512_LBSPPM0_LPA0_LPB0_LPM0_LRVW2_LWPMn1_MIAV0_MIWT8_4_MO40_NTn1_NTA4_NTB0_NTC0_NTD4_NTM0_NEPBS8_NLCA1_NLCB1_ONLL1_PGR2_PLR1_PKA1_SIA3_SS1_SU0_SUM1_SUS0_SPO0_SRVW0_SSO0_SVW4_SK0_SKXCCM0_TLDS0_ULSGRO0_USL1_UIOFGRO0_USFGROn1_VSn1_VWA4_VWB4_WSGRA0_WSGRB0_WS64_WG16_4_4_WGM6_WGMXCC8_WGMXCCGn1
    SolutionIndex: 75
    SolutionNameMin: Cijk_Ailk_Bjlk_S_MX_B_UserArgs_MT128x64x64_MI16x16x1_SN_LDSB1_AFC0_AFEM1_AFEM1_ASEM1_CLR1_CADS0_DTLA0_DTLB0_DTVA0_DTVB0_EPS0_FDSI0_GRPM1_GRVWA4_GRVWB4_GSUn1_GSUAMBSK_GSUC1_GSUWGMRR1_GLS0_ISA942_IU1_K1_LBSPPA1024_LBSPPB512_LBSPPM0_LPA0_LPB0_LPM0_LRVW2_LWPMn1_MIAV0_MIWT8_4_MO40_NTn1_NTA4_NTB0_NTC0_NTD4_NTM0_NEPBS8_NLCA1_NLCB1_ONLL1_PGR2_PLR1_PKA1_SIA3_SS1_SU0_SUM1_SUS0_SPO0_SRVW0_SSO0_SVW4_SK0_SKXCCM0_TLDS0_ULSGRO0_USL1_UIOFGRO0_USFGROn1_VSn1_VWA4_VWB4_WSGRA0_WSGRB0_WS64_WG16_4_4_WGM8_WGMXCC8_WGMXCCGn1
    SolutionIndex: 76
    SolutionNameMin: Cijk_Ailk_Bjlk_S_MX_B_UserArgs_MT48x128x32_MI16x16x1_SN_LDSB1_AFC0_AFEM1_AFEM1_ASEM1_CLR1_CADS0_DTLA0_DTLB0_DTVA0_DTVB0_EPS0_FDSI0_GRPM1_GRVWA2_GRVWB4_GSUn1_GSUAMBSK_GSUC1_GSUWGMRR1_GLS0_ISA942_IU1_K1_LBSPPA384_LBSPPB1024_LBSPPM0_LPA16_LPB0_LPM0_LRVW2_LWPMn1_MIAV0_MIWT3_2_MO40_NTn1_NTA0_NTB4_NTC0_NTD4_NTM0_NEPBS6_NLCA3_NLCB1_ONLL1_PGR2_PLR1_PKA1_SIA3_SS1_SU0_SUM1_SUS0_SPO0_SRVW0_SSO0_SVW1_SK0_SKXCCM0_TLDS0_ULSGRO0_USL1_UIOFGRO0_USFGROn1_VSn1_VWA1_VWB2_WSGRA0_WSGRB0_WS64_WG16_16_1_WGM1_WGMXCC8_WGMXCCGn1
    SolutionIndex: 77
    SolutionNameMin: Cijk_Ailk_Bjlk_S_MX_B_UserArgs_MT64x48x64_MI16x16x1_SN_LDSB1_AFC0_AFEM1_AFEM1_ASEM1_CLR1_CADS0_DTLA0_DTLB0_DTVA0_DTVB0_EPS0_FDSI0_GRPM1_GRVWA4_GRVWB4_GSUn1_GSUAMBSK_GSUC1_GSUWGMRR1_GLS0_ISA942_IU1_K1_LBSPPA512_LBSPPB384_LBSPPM0_LPA0_LPB16_LPM0_LRVW2_LWPMn1_MIAV0_MIWT2_3_MO40_NTn1_NTA0_NTB0_NTC0_NTD4_NTM0_NEPBS8_NLCA1_NLCB3_ONLL1_PGR2_PLR1_PKA1_SIA3_SS1_SU0_SUM1_SUS0_SPO0_SRVW0_SSO0_SVW2_SK0_SKXCCM0_TLDS0_ULSGRO1_USL1_UIOFGRO0_USFGROn1_VSn1_VWA2_VWB1_WSGRA0_WSGRB0_WS64_WG32_4_2_WGM1_WGMXCC8_WGMXCCGn1
    SolutionIndex: 78
    SolutionNameMin: Cijk_Ailk_Bjlk_S_MX_B_UserArgs_MT112x128x64_MI16x16x1_SN_LDSB1_AFC0_AFEM1_AFEM1_ASEM1_CLR1_CADS0_DTLA0_DTLB0_DTVA0_DTVB0_EPS0_FDSI0_GRPM1_GRVWA4_GRVWB4_GSUn1_GSUAMBSK_GSUC1_GSUWGMRR1_GLS0_ISA942_IU1_K1_LBSPPA896_LBSPPB1024_LBSPPM0_LPA16_LPB0_LPM0_LRVW2_LWPMn1_MIAV0_MIWT7_2_MO40_NTn1_NTA0_NTB0_NTC0_NTD4_NTM0_NEPBS7_NLCA7_NLCB1_ONLL1_PGR2_PLR1_PKA1_SIA3_SS1_SU0_SUM1_SUS0_SPO0_SRVW0_SSO0_SVW1_SK0_SKXCCM0_TLDS0_ULSGRO0_USL1_UIOFGRO0_USFGROn1_VSn1_VWA1_VWB2_WSGRA0_WSGRB0_WS64_WG16_16_1_WGM8_WGMXCC8_WGMXCCGn1
    SolutionIndex: 79
    SolutionNameMin: Cijk_Ailk_Bjlk_S_MX_B_UserArgs_MT128x64x64_MI16x16x1_SN_LDSB1_AFC0_AFEM1_AFEM1_ASEM1_CLR1_CADS0_DTLA0_DTLB0_DTVA0_DTVB0_EPS0_FDSI0_GRPM1_GRVWA4_GRVWB4_GSUn1_GSUAMBSK_GSUC1_GSUWGMRR1_GLS0_ISA942_IU1_K1_LBSPPA1024_LBSPPB512_LBSPPM0_LPA0_LPB0_LPM0_LRVW2_LWPMn1_MIAV0_MIWT8_4_MO40_NTn1_NTA4_NTB0_NTC0_NTD4_NTM0_NEPBS8_NLCA1_NLCB1_ONLL1_PGR2_PLR1_PKA1_SIA3_SS1_SU0_SUM1_SUS0_SPO0_SRVW0_SSO0_SVW4_SK0_SKXCCM0_TLDS0_ULSGRO1_USL1_UIOFGRO0_USFGROn1_VSn1_VWA4_VWB4_WSGRA0_WSGRB0_WS64_WG16_4_4_WGM6_WGMXCC8_WGMXCCGn1
    SolutionIndex: 80
    SolutionNameMin: Cijk_Ailk_Bjlk_S_MX_B_UserArgs_MT64x80x64_MI16x16x1_SN_LDSB1_AFC0_AFEM1_AFEM1_ASEM1_CLR1_CADS0_DTLA0_DTLB0_DTVA0_DTVB0_EPS0_FDSI0_GRPM1_GRVWA4_GRVWB4_GSUn1_GSUAMBSK_GSUC1_GSUWGMRR1_GLS0_ISA942_IU1_K1_LBSPPA512_LBSPPB640_LBSPPM0_LPA0_LPB16_LPM0_LRVW2_LWPMn1_MIAV0_MIWT4_5_MO40_NTn1_NTA4_NTB0_NTC0_NTD4_NTM0_NEPBS8_NLCA1_NLCB5_ONLL1_PGR2_PLR1_PKA1_SIA3_SS1_SU0_SUM1_SUS0_SPO0_SRVW0_SSO0_SVW4_SK0_SKXCCM0_TLDS0_ULSGRO0_USL1_UIOFGRO0_USFGROn1_VSn1_VWA4_VWB1_WSGRA0_WSGRB0_WS64_WG16_4_4_WGM8_WGMXCC8_WGMXCCGn1
    SolutionIndex: 81
    SolutionNameMin: Cijk_Ailk_Bjlk_S_MX_B_UserArgs_MT128x80x64_MI16x16x1_SN_LDSB1_AFC0_AFEM1_AFEM1_ASEM1_CLR1_CADS0_DTLA0_DTLB0_DTVA0_DTVB0_EPS0_FDSI0_GRPM1_GRVWA4_GRVWB4_GSUn1_GSUAMBSK_GSUC1_GSUWGMRR1_GLS0_ISA942_IU1_K1_LBSPPA1024_LBSPPB640_LBSPPM0_LPA0_LPB16_LPM0_LRVW2_LWPMn1_MIAV0_MIWT8_5_MO40_NTn1_NTA0_NTB0_NTC0_NTD4_NTM0_NEPBS8_NLCA1_NLCB5_ONLL1_PGR2_PLR1_PKA1_SIA3_SS1_SU0_SUM1_SUS0_SPO0_SRVW0_SSO0_SVW4_SK0_SKXCCM0_TLDS0_ULSGRO0_USL1_UIOFGRO0_USFGROn1_VSn1_VWA4_VWB1_WSGRA0_WSGRB0_WS64_WG16_4_4_WGM1_WGMXCC8_WGMXCCGn1
    SolutionIndex: 82
    SolutionNameMin: Cijk_Ailk_Bjlk_S_MX_B_UserArgs_MT96x64x64_MI16x16x1_SN_LDSB1_AFC0_AFEM1_AFEM1_ASEM1_CLR1_CADS0_DTLA0_DTLB0_DTVA0_DTVB0_EPS0_FDSI0_GRPM1_GRVWA4_GRVWB4_GSUn1_GSUAMBSK_GSUC1_GSUWGMRR1_GLS0_ISA942_IU1_K1_LBSPPA768_LBSPPB512_LBSPPM0_LPA16_LPB0_LPM0_LRVW2_LWPMn1_MIAV0_MIWT3_2_MO40_NTn1_NTA4_NTB0_NTC0_NTD4_NTM0_NEPBS6_NLCA3_NLCB1_ONLL1_PGR2_PLR1_PKA1_SIA3_SS1_SU0_SUM1_SUS0_SPO0_SRVW0_SSO0_SVW1_SK0_SKXCCM0_TLDS0_ULSGRO0_USL1_UIOFGRO0_USFGROn1_VSn1_VWA1_VWB2_WSGRA0_WSGRB0_WS64_WG32_8_1_WGM6_WGMXCC8_WGMXCCGn1
    SolutionIndex: 83
    SolutionNameMin: Cijk_Ailk_Bjlk_S_MX_B_UserArgs_MT64x64x64_MI16x16x1_SN_LDSB1_AFC0_AFEM1_AFEM1_ASEM1_CLR1_CADS0_DTLA0_DTLB0_DTVA0_DTVB0_EPS0_FDSI0_GRPM1_GRVWA4_GRVWB4_GSUn1_GSUAMBSK_GSUC1_GSUWGMRR1_GLS0_ISA942_IU1_K1_LBSPPA512_LBSPPB512_LBSPPM0_LPA0_LPB0_LPM0_LRVW2_LWPMn1_MIAV0_MIWT4_4_MO40_NTn1_NTA4_NTB0_NTC0_NTD4_NTM0_NEPBS8_NLCA1_NLCB1_ONLL1_PGR2_PLR1_PKA1_SIA3_SS1_SU0_SUM1_SUS0_SPO0_SRVW0_SSO0_SVW4_SK0_SKXCCM0_TLDS0_ULSGRO0_USL1_UIOFGRO0_USFGROn1_VSn1_VWA4_VWB4_WSGRA0_WSGRB0_WS64_WG16_4_4_WGM6_WGMXCC8_WGMXCCGn1
    SolutionIndex: 84
    SolutionNameMin: Cijk_Ailk_Bjlk_S_MX_B_UserArgs_MT32x32x256_MI16x16x1_SN_LDSB1_AFC0_AFEM1_AFEM1_ASEM1_CLR1_CADS0_DTLA0_DTLB0_DTVA0_DTVB0_EPS0_FDSI0_GRPM1_GRVWA4_GRVWB4_GSUn1_GSUAMBSK_GSUC1_GSUWGMRR1_GLS0_ISA942_IU1_K1_LBSPPA256_LBSPPB256_LBSPPM0_LPA0_LPB0_LPM0_LRVW2_LWPMn1_MIAV0_MIWT2_2_MO40_NTn1_NTA0_NTB4_NTC0_NTD4_NTM0_NEPBS8_NLCA1_NLCB1_ONLL1_PGR2_PLR1_PKA1_SIA3_SS1_SU0_SUM1_SUS0_SPO0_SRVW0_SSO0_SVW2_SK0_SKXCCM0_TLDS0_ULSGRO1_USL1_UIOFGRO0_USFGROn1_VSn1_VWA2_VWB2_WSGRA0_WSGRB0_WS64_WG16_4_4_WGM1_WGMXCC8_WGMXCCGn1
    SolutionIndex: 85
    SolutionNameMin: Cijk_Ailk_Bjlk_S_MX_B_UserArgs_MT64x64x64_MI16x16x1_SN_LDSB1_AFC0_AFEM1_AFEM1_ASEM1_CLR1_CADS0_DTLA0_DTLB0_DTVA0_DTVB0_EPS0_FDSI0_GRPM1_GRVWA4_GRVWB4_GSUn1_GSUAMBSK_GSUC1_GSUWGMRR1_GLS0_ISA942_IU1_K1_LBSPPA512_LBSPPB512_LBSPPM0_LPA0_LPB0_LPM0_LRVW2_LWPMn1_MIAV0_MIWT4_4_MO40_NTn1_NTA0_NTB0_NTC0_NTD4_NTM0_NEPBS8_NLCA1_NLCB1_ONLL1_PGR2_PLR1_PKA1_SIA3_SS1_SU0_SUM1_SUS0_SPO0_SRVW0_SSO0_SVW4_SK0_SKXCCM0_TLDS0_ULSGRO1_USL1_UIOFGRO0_USFGROn1_VSn1_VWA4_VWB4_WSGRA0_WSGRB0_WS64_WG16_4_4_WGM8_WGMXCC8_WGMXCCGn1
    SolutionIndex: 86
    SolutionNameMin: Cijk_Ailk_Bjlk_S_MX_B_UserArgs_MT64x64x64_MI16x16x1_SN_LDSB1_AFC0_AFEM1_AFEM1_ASEM1_CLR1_CADS0_DTLA0_DTLB0_DTVA0_DTVB0_EPS0_FDSI0_GRPM1_GRVWA4_GRVWB4_GSUn1_GSUAMBSK_GSUC1_GSUWGMRR1_GLS0_ISA942_IU1_K1_LBSPPA512_LBSPPB512_LBSPPM0_LPA0_LPB0_LPM0_LRVW2_LWPMn1_MIAV0_MIWT4_4_MO40_NTn1_NTA0_NTB0_NTC0_NTD4_NTM0_NEPBS8_NLCA1_NLCB1_ONLL1_PGR2_PLR1_PKA1_SIA3_SS1_SU0_SUM1_SUS0_SPO0_SRVW0_SSO0_SVW4_SK0_SKXCCM0_TLDS0_ULSGRO0_USL1_UIOFGRO0_USFGROn1_VSn1_VWA4_VWB4_WSGRA0_WSGRB0_WS64_WG16_4_4_WGM1_WGMXCC8_WGMXCCGn1
    SolutionIndex: 87
    SolutionNameMin: Cijk_Ailk_Bjlk_S_MX_B_UserArgs_MT16x32x128_MI16x16x1_SN_LDSB1_AFC0_AFEM1_AFEM1_ASEM1_CLR1_CADS0_DTLA0_DTLB0_DTVA0_DTVB0_EPS0_FDSI0_GRPM1_GRVWA4_GRVWB4_GSUn1_GSUAMBSK_GSUC1_GSUWGMRR1_GLS0_ISA942_IU1_K1_LBSPPA128_LBSPPB256_LBSPPM0_LPA16_LPB16_LPM0_LRVW2_LWPMn1_MIAV0_MIWT1_1_MO40_NTn1_NTA0_NTB0_NTC0_NTD4_NTM0_NEPBS8_NLCA1_NLCB1_ONLL1_PGR2_PLR1_PKA1_SIA3_SS1_SU0_SUM1_SUS0_SPO0_SRVW0_SSO0_SVW1_SK0_SKXCCM0_TLDS0_ULSGRO0_USL1_UIOFGRO0_USFGROn1_VSn1_VWA1_VWB1_WSGRA0_WSGRB0_WS64_WG16_8_2_WGM1_WGMXCC8_WGMXCCGn1
    SolutionIndex: 88
    SolutionNameMin: Cijk_Ailk_Bjlk_S_MX_B_UserArgs_MT64x64x64_MI16x16x1_SN_LDSB1_AFC0_AFEM1_AFEM1_ASEM1_CLR1_CADS0_DTLA0_DTLB0_DTVA0_DTVB0_EPS0_FDSI0_GRPM1_GRVWA4_GRVWB4_GSUn1_GSUAMBSK_GSUC1_GSUWGMRR1_GLS0_ISA942_IU1_K1_LBSPPA512_LBSPPB512_LBSPPM0_LPA0_LPB0_LPM0_LRVW2_LWPMn1_MIAV0_MIWT4_4_MO40_NTn1_NTA4_NTB0_NTC0_NTD4_NTM0_NEPBS8_NLCA1_NLCB1_ONLL1_PGR2_PLR1_PKA1_SIA3_SS1_SU0_SUM1_SUS0_SPO0_SRVW0_SSO0_SVW4_SK0_SKXCCM0_TLDS0_ULSGRO0_USL1_UIOFGRO0_USFGROn1_VSn1_VWA4_VWB4_WSGRA0_WSGRB0_WS64_WG16_4_4_WGM8_WGMXCC8_WGMXCCGn1
    SolutionIndex: 89
    SolutionNameMin: Cijk_Ailk_Bjlk_S_MX_B_UserArgs_MT80x128x64_MI16x16x1_SN_LDSB1_AFC0_AFEM1_AFEM1_ASEM1_CLR1_CADS0_DTLA0_DTLB0_DTVA0_DTVB0_EPS0_FDSI0_GRPM1_GRVWA4_GRVWB4_GSUn1_GSUAMBSK_GSUC1_GSUWGMRR1_GLS0_ISA942_IU1_K1_LBSPPA640_LBSPPB1024_LBSPPM0_LPA16_LPB0_LPM0_LRVW2_LWPMn1_MIAV0_MIWT5_2_MO40_NTn1_NTA0_NTB0_NTC0_NTD4_NTM0_NEPBS5_NLCA5_NLCB1_ONLL1_PGR2_PLR1_PKA1_SIA3_SS1_SU0_SUM1_SUS0_SPO0_SRVW0_SSO0_SVW1_SK0_SKXCCM0_TLDS0_ULSGRO1_USL1_UIOFGRO0_USFGROn1_VSn1_VWA1_VWB2_WSGRA0_WSGRB0_WS64_WG16_16_1_WGM8_WGMXCC8_WGMXCCGn1
    SolutionIndex: 90
    SolutionNameMin: Cijk_Ailk_Bjlk_S_MX_B_UserArgs_MT192x288x32_MI16x16x1_SN_LDSB1_AFC0_AFEM1_AFEM1_ASEM1_CLR1_CADS0_DTLA0_DTLB0_DTVA0_DTVB0_EPS0_FDSI0_GRPM1_GRVWA4_GRVWB4_GSUn1_GSUAMBSK_GSUC1_GSUWGMRR1_GLS0_ISA942_IU1_K1_LBSPPA1536_LBSPPB2304_LBSPPM0_LPA0_LPB16_LPM0_LRVW2_LWPMn1_MIAV0_MIWT6_9_MO40_NTn1_NTA0_NTB0_NTC0_NTD4_NTM0_NEPBS6_NLCA3_NLCB9_ONLL1_PGR2_PLR1_PKA1_SIA3_SS1_SU0_SUM1_SUS0_SPO0_SRVW0_SSO0_SVW2_SK0_SKXCCM0_TLDS0_ULSGRO1_USL1_UIOFGRO0_USFGROn1_VSn1_VWA2_VWB1_WSGRA0_WSGRB0_WS64_WG32_8_1_WGM6_WGMXCC8_WGMXCCGn1
    SolutionIndex: 91
    SolutionNameMin: Cijk_Ailk_Bjlk_S_MX_B_UserArgs_MT64x96x64_MI16x16x1_SN_LDSB1_AFC0_AFEM1_AFEM1_ASEM1_CLR1_CADS0_DTLA0_DTLB0_DTVA0_DTVB0_EPS0_FDSI0_GRPM1_GRVWA4_GRVWB4_GSUn1_GSUAMBSK_GSUC1_GSUWGMRR1_GLS0_ISA942_IU1_K1_LBSPPA512_LBSPPB768_LBSPPM0_LPA0_LPB0_LPM0_LRVW2_LWPMn1_MIAV0_MIWT4_6_MO40_NTn1_NTA0_NTB0_NTC0_NTD4_NTM0_NEPBS8_NLCA1_NLCB3_ONLL1_PGR2_PLR1_PKA1_SIA3_SS1_SU0_SUM1_SUS0_SPO0_SRVW0_SSO0_SVW4_SK0_SKXCCM0_TLDS0_ULSGRO0_USL1_UIOFGRO0_USFGROn1_VSn1_VWA4_VWB2_WSGRA0_WSGRB0_WS64_WG16_4_4_WGM1_WGMXCC8_WGMXCCGn1
    SolutionIndex: 92
    SolutionNameMin: Cijk_Ailk_Bjlk_S_MX_B_UserArgs_MT128x96x64_MI16x16x1_SN_LDSB1_AFC0_AFEM1_AFEM1_ASEM1_CLR1_CADS0_DTLA0_DTLB0_DTVA0_DTVB0_EPS0_FDSI0_GRPM1_GRVWA4_GRVWB4_GSUn1_GSUAMBSK_GSUC1_GSUWGMRR1_GLS0_ISA942_IU1_K1_LBSPPA1024_LBSPPB768_LBSPPM0_LPA0_LPB0_LPM0_LRVW2_LWPMn1_MIAV0_MIWT8_6_MO40_NTn1_NTA0_NTB4_NTC0_NTD4_NTM0_NEPBS8_NLCA1_NLCB3_ONLL1_PGR2_PLR1_PKA1_SIA3_SS1_SU0_SUM1_SUS0_SPO0_SRVW0_SSO0_SVW4_SK0_SKXCCM0_TLDS0_ULSGRO0_USL1_UIOFGRO0_USFGROn1_VSn1_VWA4_VWB2_WSGRA0_WSGRB0_WS64_WG16_4_4_WGM1_WGMXCC8_WGMXCCGn1
    SolutionIndex: 93
    SolutionNameMin: Cijk_Ailk_Bjlk_S_MX_B_UserArgs_MT224x192x32_MI16x16x1_SN_LDSB1_AFC0_AFEM1_AFEM1_ASEM1_CLR1_CADS0_DTLA0_DTLB0_DTVA0_DTVB0_EPS0_FDSI0_GRPM1_GRVWA4_GRVWB4_GSUn1_GSUAMBSK_GSUC1_GSUWGMRR1_GLS0_ISA942_IU1_K1_LBSPPA1792_LBSPPB1536_LBSPPM0_LPA16_LPB0_LPM0_LRVW2_LWPMn1_MIAV0_MIWT7_6_MO40_NTn1_NTA0_NTB0_NTC0_NTD4_NTM0_NEPBS7_NLCA7_NLCB3_ONLL1_PGR2_PLR1_PKA1_SIA3_SS1_SU0_SUM1_SUS0_SPO0_SRVW0_SSO0_SVW1_SK0_SKXCCM0_TLDS0_ULSGRO0_USL1_UIOFGRO0_USFGROn1_VSn1_VWA1_VWB2_WSGRA0_WSGRB0_WS64_WG32_8_1_WGM6_WGMXCC8_WGMXCCGn1
    SolutionIndex: 94
    SolutionNameMin: Cijk_Ailk_Bjlk_S_MX_B_UserArgs_MT128x96x64_MI16x16x1_SN_LDSB1_AFC0_AFEM1_AFEM1_ASEM1_CLR1_CADS0_DTLA0_DTLB0_DTVA0_DTVB0_EPS0_FDSI0_GRPM1_GRVWA4_GRVWB4_GSUn1_GSUAMBSK_GSUC1_GSUWGMRR1_GLS0_ISA942_IU1_K1_LBSPPA1024_LBSPPB768_LBSPPM0_LPA0_LPB0_LPM0_LRVW2_LWPMn1_MIAV0_MIWT8_6_MO40_NTn1_NTA0_NTB4_NTC0_NTD4_NTM0_NEPBS8_NLCA1_NLCB3_ONLL1_PGR2_PLR1_PKA1_SIA3_SS1_SU0_SUM1_SUS0_SPO0_SRVW0_SSO0_SVW4_SK0_SKXCCM0_TLDS0_ULSGRO0_USL1_UIOFGRO0_USFGROn1_VSn1_VWA4_VWB2_WSGRA0_WSGRB0_WS64_WG16_4_4_WGM8_WGMXCC8_WGMXCCGn1
    SolutionIndex: 95
    SolutionNameMin: Cijk_Ailk_Bjlk_S_MX_B_UserArgs_MT64x80x64_MI16x16x1_SN_LDSB1_AFC0_AFEM1_AFEM1_ASEM1_CLR1_CADS0_DTLA0_DTLB0_DTVA0_DTVB0_EPS0_FDSI0_GRPM1_GRVWA4_GRVWB4_GSUn1_GSUAMBSK_GSUC1_GSUWGMRR1_GLS0_ISA942_IU1_K1_LBSPPA512_LBSPPB640_LBSPPM0_LPA0_LPB16_LPM0_LRVW2_LWPMn1_MIAV0_MIWT4_5_MO40_NTn1_NTA0_NTB0_NTC0_NTD4_NTM0_NEPBS8_NLCA1_NLCB5_ONLL1_PGR2_PLR1_PKA1_SIA3_SS1_SU0_SUM1_SUS0_SPO0_SRVW0_SSO0_SVW4_SK0_SKXCCM0_TLDS0_ULSGRO0_USL1_UIOFGRO0_USFGROn1_VSn1_VWA4_VWB1_WSGRA0_WSGRB0_WS64_WG16_4_4_WGM1_WGMXCC8_WGMXCCGn1
    SolutionIndex: 96
    SolutionNameMin: Cijk_Ailk_Bjlk_S_MX_B_UserArgs_MT320x176x32_MI16x16x1_SN_LDSB1_AFC0_AFEM1_AFEM1_ASEM1_CLR1_CADS0_DTLA0_DTLB0_DTVA0_DTVB0_EPS0_FDSI0_GRPM1_GRVWA4_GRVWB2_GSUn1_GSUAMBSK_GSUC1_GSUWGMRR1_GLS0_ISA942_IU1_K1_LBSPPA2560_LBSPPB1408_LBSPPM0_LPA16_LPB16_LPM0_LRVW2_LWPMn1_MIAV0_MIWT5_11_MO40_NTn1_NTA0_NTB0_NTC0_NTD4_NTM0_NEPBS5_NLCA5_NLCB11_ONLL1_PGR2_PLR1_PKA1_SIA3_SS1_SU0_SUM1_SUS0_SPO0_SRVW0_SSO0_SVW1_SK0_SKXCCM0_TLDS0_ULSGRO0_USL1_UIOFGRO0_USFGROn1_VSn1_VWA1_VWB1_WSGRA0_WSGRB0_WS64_WG64_4_1_WGM6_WGMXCC8_WGMXCCGn1
    SolutionIndex: 97
    SolutionNameMin: Cijk_Ailk_Bjlk_S_MX_B_UserArgs_MT64x80x64_MI16x16x1_SN_LDSB1_AFC0_AFEM1_AFEM1_ASEM1_CLR1_CADS0_DTLA0_DTLB0_DTVA0_DTVB0_EPS0_FDSI0_GRPM1_GRVWA4_GRVWB4_GSUn1_GSUAMBSK_GSUC1_GSUWGMRR1_GLS0_ISA942_IU1_K1_LBSPPA512_LBSPPB640_LBSPPM0_LPA0_LPB16_LPM0_LRVW2_LWPMn1_MIAV0_MIWT4_5_MO40_NTn1_NTA0_NTB0_NTC0_NTD4_NTM0_NEPBS8_NLCA1_NLCB5_ONLL1_PGR2_PLR1_PKA1_SIA3_SS1_SU0_SUM1_SUS0_SPO0_SRVW0_SSO0_SVW4_SK0_SKXCCM0_TLDS0_ULSGRO1_USL1_UIOFGRO0_USFGROn1_VSn1_VWA4_VWB1_WSGRA0_WSGRB0_WS64_WG16_4_4_WGM1_WGMXCC8_WGMXCCGn1
    SolutionIndex: 98
    SolutionNameMin: Cijk_Ailk_Bjlk_S_MX_B_UserArgs_MT128x64x64_MI16x16x1_SN_LDSB1_AFC0_AFEM1_AFEM1_ASEM1_CLR1_CADS0_DTLA0_DTLB0_DTVA0_DTVB0_EPS0_FDSI0_GRPM1_GRVWA4_GRVWB4_GSUn1_GSUAMBSK_GSUC1_GSUWGMRR1_GLS0_ISA942_IU1_K1_LBSPPA1024_LBSPPB512_LBSPPM0_LPA0_LPB0_LPM0_LRVW2_LWPMn1_MIAV0_MIWT8_4_MO40_NTn1_NTA4_NTB0_NTC0_NTD4_NTM0_NEPBS8_NLCA1_NLCB1_ONLL1_PGR2_PLR1_PKA1_SIA3_SS1_SU0_SUM1_SUS0_SPO0_SRVW0_SSO0_SVW4_SK0_SKXCCM0_TLDS0_ULSGRO1_USL1_UIOFGRO0_USFGROn1_VSn1_VWA4_VWB4_WSGRA0_WSGRB0_WS64_WG16_4_4_WGM8_WGMXCC8_WGMXCCGn1
    SolutionIndex: 99
    SolutionNameMin: Cijk_Ailk_Bjlk_S_MX_B_UserArgs_MT128x208x16_MI16x16x1_SN_LDSB1_AFC0_AFEM1_AFEM1_ASEM1_CLR1_CADS0_DTLA0_DTLB0_DTVA0_DTVB0_EPS0_FDSI0_GRPM1_GRVWA4_GRVWB1_GSUn1_GSUAMBSK_GSUC1_GSUWGMRR1_GLS0_ISA942_IU1_K1_LBSPPA1024_LBSPPB1664_LBSPPM0_LPA0_LPB16_LPM0_LRVW2_LWPMn1_MIAV0_MIWT2_13_MO40_NTn1_NTA0_NTB0_NTC0_NTD4_NTM0_NEPBS8_NLCA1_NLCB13_ONLL1_PGR2_PLR1_PKA1_SIA3_SS1_SU0_SUM1_SUS0_SPO0_SRVW0_SSO0_SVW2_SK0_SKXCCM0_TLDS0_ULSGRO0_USL1_UIOFGRO0_USFGROn1_VSn1_VWA2_VWB1_WSGRA0_WSGRB0_WS64_WG64_4_1_WGM1_WGMXCC8_WGMXCCGn1
    SolutionIndex: 100
    SolutionNameMin: Cijk_Ailk_Bjlk_S_MX_B_UserArgs_MT192x144x16_MI16x16x1_SN_LDSB1_AFC0_AFEM1_AFEM1_ASEM1_CLR1_CADS0_DTLA0_DTLB0_DTVA0_DTVB0_EPS0_FDSI0_GRPM1_GRVWA4_GRVWB1_GSUn1_GSUAMBSK_GSUC1_GSUWGMRR1_GLS0_ISA942_IU1_K1_LBSPPA1536_LBSPPB1152_LBSPPM0_LPA16_LPB16_LPM0_LRVW2_LWPMn1_MIAV0_MIWT3_9_MO40_NTn1_NTA0_NTB0_NTC0_NTD4_NTM0_NEPBS6_NLCA3_NLCB9_ONLL1_PGR2_PLR1_PKA1_SIA3_SS1_SU0_SUM1_SUS0_SPO0_SRVW0_SSO0_SVW1_SK0_SKXCCM0_TLDS0_ULSGRO0_USL1_UIOFGRO0_USFGROn1_VSn1_VWA1_VWB1_WSGRA0_WSGRB0_WS64_WG64_4_1_WGM1_WGMXCC8_WGMXCCGn1
    SolutionIndex: 101
    SolutionNameMin: Cijk_Ailk_Bjlk_S_MX_B_UserArgs_MT64x96x64_MI16x16x1_SN_LDSB1_AFC0_AFEM1_AFEM1_ASEM1_CLR1_CADS0_DTLA0_DTLB0_DTVA0_DTVB0_EPS0_FDSI0_GRPM1_GRVWA4_GRVWB4_GSUn1_GSUAMBSK_GSUC1_GSUWGMRR1_GLS0_ISA942_IU1_K1_LBSPPA512_LBSPPB768_LBSPPM0_LPA0_LPB0_LPM0_LRVW2_LWPMn1_MIAV0_MIWT4_6_MO40_NTn1_NTA0_NTB4_NTC0_NTD4_NTM0_NEPBS8_NLCA1_NLCB3_ONLL1_PGR2_PLR1_PKA1_SIA3_SS1_SU0_SUM1_SUS0_SPO0_SRVW0_SSO0_SVW4_SK0_SKXCCM0_TLDS0_ULSGRO0_USL1_UIOFGRO0_USFGROn1_VSn1_VWA4_VWB2_WSGRA0_WSGRB0_WS64_WG16_4_4_WGM1_WGMXCC8_WGMXCCGn1
    SolutionIndex: 102
    SolutionNameMin: Cijk_Ailk_Bjlk_S_MX_B_UserArgs_MT64x48x64_MI16x16x1_SN_LDSB1_AFC0_AFEM1_AFEM1_ASEM1_CLR1_CADS0_DTLA0_DTLB0_DTVA0_DTVB0_EPS0_FDSI0_GRPM1_GRVWA4_GRVWB4_GSUn1_GSUAMBSK_GSUC1_GSUWGMRR1_GLS0_ISA942_IU1_K1_LBSPPA512_LBSPPB384_LBSPPM0_LPA0_LPB16_LPM0_LRVW2_LWPMn1_MIAV0_MIWT4_3_MO40_NTn1_NTA4_NTB0_NTC0_NTD4_NTM0_NEPBS8_NLCA1_NLCB3_ONLL1_PGR2_PLR1_PKA1_SIA3_SS1_SU0_SUM1_SUS0_SPO0_SRVW0_SSO0_SVW4_SK0_SKXCCM0_TLDS0_ULSGRO1_USL1_UIOFGRO0_USFGROn1_VSn1_VWA4_VWB1_WSGRA0_WSGRB0_WS64_WG16_4_4_WGM1_WGMXCC8_WGMXCCGn1
    SolutionIndex: 103
    SolutionNameMin: Cijk_Ailk_Bjlk_S_MX_B_UserArgs_MT64x64x64_MI16x16x1_SN_LDSB1_AFC0_AFEM1_AFEM1_ASEM1_CLR1_CADS0_DTLA0_DTLB0_DTVA0_DTVB0_EPS0_FDSI0_GRPM1_GRVWA4_GRVWB4_GSUn1_GSUAMBSK_GSUC1_GSUWGMRR1_GLS0_ISA942_IU1_K1_LBSPPA512_LBSPPB512_LBSPPM0_LPA0_LPB0_LPM0_LRVW2_LWPMn1_MIAV0_MIWT4_4_MO40_NTn1_NTA0_NTB4_NTC0_NTD4_NTM0_NEPBS8_NLCA1_NLCB1_ONLL1_PGR2_PLR1_PKA1_SIA3_SS1_SU0_SUM1_SUS0_SPO0_SRVW0_SSO0_SVW4_SK0_SKXCCM0_TLDS0_ULSGRO0_USL1_UIOFGRO0_USFGROn1_VSn1_VWA4_VWB4_WSGRA0_WSGRB0_WS64_WG16_4_4_WGM1_WGMXCC8_WGMXCCGn1
    SolutionIndex: 104
    SolutionNameMin: Cijk_Ailk_Bjlk_S_MX_B_UserArgs_MT32x48x64_MI16x16x1_SN_LDSB1_AFC0_AFEM1_AFEM1_ASEM1_CLR1_CADS0_DTLA0_DTLB0_DTVA0_DTVB0_EPS0_FDSI0_GRPM1_GRVWA4_GRVWB4_GSUn1_GSUAMBSK_GSUC1_GSUWGMRR1_GLS0_ISA942_IU1_K1_LBSPPA256_LBSPPB384_LBSPPM0_LPA16_LPB16_LPM0_LRVW2_LWPMn1_MIAV0_MIWT1_3_MO40_NTn1_NTA0_NTB4_NTC0_NTD4_NTM0_NEPBS8_NLCA1_NLCB3_ONLL1_PGR2_PLR1_PKA1_SIA3_SS1_SU0_SUM1_SUS0_SPO0_SRVW0_SSO0_SVW1_SK0_SKXCCM0_TLDS0_ULSGRO0_USL1_UIOFGRO0_USFGROn1_VSn1_VWA1_VWB1_WSGRA0_WSGRB0_WS64_WG32_4_2_WGM1_WGMXCC8_WGMXCCGn1
    SolutionIndex: 105
    SolutionNameMin: Cijk_Ailk_Bjlk_S_MX_B_UserArgs_MT32x32x128_MI16x16x1_SN_LDSB1_AFC0_AFEM1_AFEM1_ASEM1_CLR1_CADS0_DTLA0_DTLB0_DTVA0_DTVB0_EPS0_FDSI0_GRPM1_GRVWA4_GRVWB4_GSUn1_GSUAMBSK_GSUC1_GSUWGMRR1_GLS0_ISA942_IU1_K1_LBSPPA256_LBSPPB256_LBSPPM0_LPA0_LPB0_LPM0_LRVW2_LWPMn1_MIAV0_MIWT2_2_MO40_NTn1_NTA4_NTB0_NTC0_NTD4_NTM0_NEPBS8_NLCA1_NLCB1_ONLL1_PGR2_PLR1_PKA1_SIA3_SS1_SU0_SUM1_SUS0_SPO0_SRVW0_SSO0_SVW2_SK0_SKXCCM0_TLDS0_ULSGRO1_USL1_UIOFGRO0_USFGROn1_VSn1_VWA2_VWB2_WSGRA0_WSGRB0_WS64_WG16_4_4_WGM8_WGMXCC8_WGMXCCGn1
    SolutionIndex: 106
    SolutionNameMin: Cijk_Ailk_Bjlk_S_MX_B_UserArgs_MT32x32x128_MI16x16x1_SN_LDSB1_AFC0_AFEM1_AFEM1_ASEM1_CLR1_CADS0_DTLA0_DTLB0_DTVA0_DTVB0_EPS0_FDSI0_GRPM1_GRVWA4_GRVWB4_GSUn1_GSUAMBSK_GSUC1_GSUWGMRR1_GLS0_ISA942_IU1_K1_LBSPPA256_LBSPPB256_LBSPPM0_LPA0_LPB0_LPM0_LRVW2_LWPMn1_MIAV0_MIWT2_2_MO40_NTn1_NTA0_NTB0_NTC0_NTD4_NTM0_NEPBS8_NLCA1_NLCB1_ONLL1_PGR2_PLR1_PKA1_SIA3_SS1_SU0_SUM1_SUS0_SPO0_SRVW0_SSO0_SVW2_SK0_SKXCCM0_TLDS0_ULSGRO1_USL1_UIOFGRO0_USFGROn1_VSn1_VWA2_VWB2_WSGRA0_WSGRB0_WS64_WG16_4_4_WGM1_WGMXCC8_WGMXCCGn1
    SolutionIndex: 107
    SolutionNameMin: Cijk_Ailk_Bjlk_S_MX_B_UserArgs_MT128x208x16_MI16x16x1_SN_LDSB1_AFC0_AFEM1_AFEM1_ASEM1_CLR1_CADS0_DTLA0_DTLB0_DTVA0_DTVB0_EPS0_FDSI0_GRPM1_GRVWA4_GRVWB1_GSUn1_GSUAMBSK_GSUC1_GSUWGMRR1_GLS0_ISA942_IU1_K1_LBSPPA1024_LBSPPB1664_LBSPPM0_LPA0_LPB16_LPM0_LRVW2_LWPMn1_MIAV0_MIWT2_13_MO40_NTn1_NTA0_NTB0_NTC0_NTD4_NTM0_NEPBS8_NLCA1_NLCB13_ONLL1_PGR2_PLR1_PKA1_SIA3_SS1_SU0_SUM1_SUS0_SPO0_SRVW0_SSO0_SVW2_SK0_SKXCCM0_TLDS0_ULSGRO0_USL1_UIOFGRO0_USFGROn1_VSn1_VWA2_VWB1_WSGRA0_WSGRB0_WS64_WG64_4_1_WGM8_WGMXCC8_WGMXCCGn1
    SolutionIndex: 108
    SolutionNameMin: Cijk_Ailk_Bjlk_S_MX_B_UserArgs_MT64x64x64_MI16x16x1_SN_LDSB1_AFC0_AFEM1_AFEM1_ASEM1_CLR1_CADS0_DTLA0_DTLB0_DTVA0_DTVB0_EPS0_FDSI0_GRPM1_GRVWA4_GRVWB4_GSUn1_GSUAMBSK_GSUC1_GSUWGMRR1_GLS0_ISA942_IU1_K1_LBSPPA512_LBSPPB512_LBSPPM0_LPA0_LPB0_LPM0_LRVW2_LWPMn1_MIAV0_MIWT4_4_MO40_NTn1_NTA0_NTB0_NTC0_NTD4_NTM0_NEPBS8_NLCA1_NLCB1_ONLL1_PGR2_PLR1_PKA1_SIA3_SS1_SU0_SUM1_SUS0_SPO0_SRVW0_SSO0_SVW4_SK0_SKXCCM0_TLDS0_ULSGRO1_USL1_UIOFGRO0_USFGROn1_VSn1_VWA4_VWB4_WSGRA0_WSGRB0_WS64_WG16_4_4_WGM6_WGMXCC8_WGMXCCGn1
    SolutionIndex: 109
    SolutionNameMin: Cijk_Ailk_Bjlk_S_MX_B_UserArgs_MT48x128x16_MI16x16x1_SN_LDSB0_AFC0_AFEM1_AFEM1_ASEM1_CLR1_CADS0_DTLA0_DTLB0_DTVA0_DTVB0_EPS0_FDSI0_GRPM1_GRVWA1_GRVWB4_GSUn1_GSUAMBSK_GSUC1_GSUWGMRR1_GLS0_ISA942_IU1_K1_LBSPPA384_LBSPPB1024_LBSPPM0_LPA16_LPB0_LPM0_LRVW2_LWPMn1_MIAV0_MIWT3_2_MO40_NTn1_NTA0_NTB0_NTC0_NTD4_NTM0_NEPBS6_NLCA3_NLCB1_ONLL1_PGR2_PLR1_PKA1_SIA3_SS1_SU0_SUM1_SUS0_SPO0_SRVW0_SSO0_SVW1_SK0_SKXCCM0_TLDS0_ULSGRO0_USL1_UIOFGRO0_USFGROn1_VSn1_VWA1_VWB2_WSGRA0_WSGRB0_WS64_WG16_16_1_WGM1_WGMXCC8_WGMXCCGn1
    SolutionIndex: 110
    SolutionNameMin: Cijk_Ailk_Bjlk_S_MX_B_UserArgs_MT272x256x16_MI16x16x1_SN_LDSB1_AFC0_AFEM1_AFEM1_ASEM1_CLR1_CADS0_DTLA0_DTLB0_DTVA0_DTVB0_EPS0_FDSI0_GRPM1_GRVWA1_GRVWB4_GSUn1_GSUAMBSK_GSUC1_GSUWGMRR1_GLS0_ISA942_IU1_K1_LBSPPA2176_LBSPPB2048_LBSPPM0_LPA16_LPB0_LPM0_LRVW2_LWPMn1_MIAV0_MIWT17_4_MO40_NTn1_NTA0_NTB0_NTC0_NTD4_NTM0_NEPBS17_NLCA17_NLCB1_ONLL1_PGR2_PLR1_PKA1_SIA3_SS1_SU0_SUM1_SUS0_SPO0_SRVW0_SSO0_SVW1_SK0_SKXCCM0_TLDS0_ULSGRO0_USL1_UIOFGRO0_USFGROn1_VSn1_VWA1_VWB4_WSGRA0_WSGRB0_WS64_WG16_16_1_WGM8_WGMXCC8_WGMXCCGn1
    SolutionIndex: 111
    SolutionNameMin: Cijk_Ailk_Bjlk_S_MX_B_UserArgs_MT192x352x16_MI16x16x1_SN_LDSB1_AFC0_AFEM1_AFEM1_ASEM1_CLR1_CADS0_DTLA0_DTLB0_DTVA0_DTVB0_EPS0_FDSI0_GRPM1_GRVWA4_GRVWB2_GSUn1_GSUAMBSK_GSUC1_GSUWGMRR1_GLS0_ISA942_IU1_K1_LBSPPA1536_LBSPPB2816_LBSPPM0_LPA0_LPB16_LPM0_LRVW2_LWPMn1_MIAV0_MIWT6_11_MO40_NTn1_NTA0_NTB0_NTC0_NTD4_NTM0_NEPBS6_NLCA3_NLCB11_ONLL1_PGR2_PLR1_PKA1_SIA3_SS1_SU0_SUM1_SUS0_SPO0_SRVW0_SSO0_SVW2_SK0_SKXCCM0_TLDS0_ULSGRO0_USL1_UIOFGRO0_USFGROn1_VSn1_VWA2_VWB1_WSGRA0_WSGRB0_WS64_WG32_8_1_WGM6_WGMXCC8_WGMXCCGn1
    SolutionIndex: 112
    SolutionNameMin: Cijk_Ailk_Bjlk_S_MX_B_UserArgs_MT320x288x16_MI16x16x1_SN_LDSB1_AFC0_AFEM1_AFEM1_ASEM1_CLR1_CADS0_DTLA0_DTLB0_DTVA0_DTVB0_EPS0_FDSI0_GRPM1_GRVWA4_GRVWB2_GSUn1_GSUAMBSK_GSUC1_GSUWGMRR1_GLS0_ISA942_IU1_K1_LBSPPA2560_LBSPPB2304_LBSPPM0_LPA0_LPB16_LPM0_LRVW2_LWPMn1_MIAV0_MIWT10_9_MO40_NTn1_NTA0_NTB0_NTC0_NTD4_NTM0_NEPBS10_NLCA5_NLCB9_ONLL1_PGR2_PLR1_PKA1_SIA3_SS1_SU0_SUM1_SUS0_SPO0_SRVW0_SSO0_SVW2_SK0_SKXCCM0_TLDS0_ULSGRO0_USL1_UIOFGRO0_USFGROn1_VSn1_VWA2_VWB1_WSGRA0_WSGRB0_WS64_WG32_8_1_WGM6_WGMXCC8_WGMXCCGn1
    SolutionIndex: 113
    SolutionNameMin: Cijk_Ailk_Bjlk_S_MX_B_UserArgs_MT112x192x32_MI16x16x1_SN_LDSB1_AFC0_AFEM1_AFEM1_ASEM1_CLR1_CADS0_DTLA0_DTLB0_DTVA0_DTVB0_EPS0_FDSI0_GRPM1_GRVWA2_GRVWB4_GSUn1_GSUAMBSK_GSUC1_GSUWGMRR1_GLS0_ISA942_IU1_K1_LBSPPA896_LBSPPB1536_LBSPPM0_LPA16_LPB16_LPM0_LRVW2_LWPMn1_MIAV0_MIWT7_3_MO40_NTn1_NTA0_NTB0_NTC0_NTD4_NTM0_NEPBS7_NLCA7_NLCB3_ONLL1_PGR2_PLR1_PKA1_SIA3_SS1_SU0_SUM1_SUS0_SPO0_SRVW0_SSO0_SVW1_SK0_SKXCCM0_TLDS0_ULSGRO0_USL1_UIOFGRO0_USFGROn1_VSn1_VWA1_VWB1_WSGRA0_WSGRB0_WS64_WG16_16_1_WGM6_WGMXCC8_WGMXCCGn1
    SolutionIndex: 114
    SolutionNameMin: Cijk_Ailk_Bjlk_S_MX_B_UserArgs_MT160x96x32_MI16x16x1_SN_LDSB1_AFC0_AFEM1_AFEM1_ASEM1_CLR1_CADS0_DTLA0_DTLB0_DTVA0_DTVB0_EPS0_FDSI0_GRPM1_GRVWA4_GRVWB4_GSUn1_GSUAMBSK_GSUC1_GSUWGMRR1_GLS0_ISA942_IU1_K1_LBSPPA1280_LBSPPB768_LBSPPM0_LPA16_LPB16_LPM0_LRVW2_LWPMn1_MIAV0_MIWT5_3_MO40_NTn1_NTA0_NTB0_NTC0_NTD4_NTM0_NEPBS5_NLCA5_NLCB3_ONLL1_PGR2_PLR1_PKA1_SIA3_SS1_SU0_SUM1_SUS0_SPO0_SRVW0_SSO0_SVW1_SK0_SKXCCM0_TLDS0_ULSGRO1_USL1_UIOFGRO0_USFGROn1_VSn1_VWA1_VWB1_WSGRA0_WSGRB0_WS64_WG32_8_1_WGM8_WGMXCC8_WGMXCCGn1
    SolutionIndex: 115
    SolutionNameMin: Cijk_Ailk_Bjlk_S_MX_B_UserArgs_MT192x160x16_MI16x16x1_SN_LDSB1_AFC0_AFEM1_AFEM1_ASEM1_CLR1_CADS0_DTLA0_DTLB0_DTVA0_DTVB0_EPS0_FDSI0_GRPM1_GRVWA4_GRVWB2_GSUn1_GSUAMBSK_GSUC1_GSUWGMRR1_GLS0_ISA942_IU1_K1_LBSPPA1536_LBSPPB1280_LBSPPM0_LPA0_LPB16_LPM0_LRVW2_LWPMn1_MIAV0_MIWT6_5_MO40_NTn1_NTA0_NTB0_NTC0_NTD4_NTM0_NEPBS6_NLCA3_NLCB5_ONLL1_PGR2_PLR1_PKA1_SIA3_SS1_SU0_SUM1_SUS0_SPO0_SRVW0_SSO0_SVW2_SK0_SKXCCM0_TLDS0_ULSGRO0_USL1_UIOFGRO0_USFGROn1_VSn1_VWA2_VWB1_WSGRA0_WSGRB0_WS64_WG32_8_1_WGM6_WGMXCC8_WGMXCCGn1
    SolutionIndex: 116
    SolutionNameMin: Cijk_Ailk_Bjlk_S_MX_B_UserArgs_MT128x176x16_MI16x16x1_SN_LDSB1_AFC0_AFEM1_AFEM1_ASEM1_CLR1_CADS0_DTLA0_DTLB0_DTVA0_DTVB0_EPS0_FDSI0_GRPM1_GRVWA4_GRVWB1_GSUn1_GSUAMBSK_GSUC1_GSUWGMRR1_GLS0_ISA942_IU1_K1_LBSPPA1024_LBSPPB1408_LBSPPM0_LPA0_LPB16_LPM0_LRVW2_LWPMn1_MIAV0_MIWT2_11_MO40_NTn1_NTA0_NTB0_NTC0_NTD4_NTM0_NEPBS8_NLCA1_NLCB11_ONLL1_PGR2_PLR1_PKA1_SIA3_SS1_SU0_SUM1_SUS0_SPO0_SRVW0_SSO0_SVW2_SK0_SKXCCM0_TLDS0_ULSGRO0_USL1_UIOFGRO0_USFGROn1_VSn1_VWA2_VWB1_WSGRA0_WSGRB0_WS64_WG64_4_1_WGM6_WGMXCC8_WGMXCCGn1
    SolutionIndex: 117
    SolutionNameMin: Cijk_Ailk_Bjlk_S_MX_B_UserArgs_MT128x160x16_MI16x16x1_SN_LDSB1_AFC0_AFEM1_AFEM1_ASEM1_CLR1_CADS0_DTLA0_DTLB0_DTVA0_DTVB0_EPS0_FDSI0_GRPM1_GRVWA4_GRVWB2_GSUn1_GSUAMBSK_GSUC1_GSUWGMRR1_GLS0_ISA942_IU1_K1_LBSPPA1024_LBSPPB1280_LBSPPM0_LPA0_LPB16_LPM0_LRVW2_LWPMn1_MIAV0_MIWT4_5_MO40_NTn1_NTA0_NTB0_NTC0_NTD4_NTM0_NEPBS8_NLCA1_NLCB5_ONLL1_PGR2_PLR1_PKA1_SIA3_SS1_SU0_SUM1_SUS0_SPO0_SRVW0_SSO0_SVW4_SK0_SKXCCM0_TLDS0_ULSGRO0_USL1_UIOFGRO0_USFGROn1_VSn1_VWA4_VWB1_WSGRA0_WSGRB0_WS64_WG32_8_1_WGM6_WGMXCC8_WGMXCCGn1
    SolutionIndex: 118
    SolutionNameMin: Cijk_Ailk_Bjlk_S_MX_B_UserArgs_MT16x16x128_MI16x16x1_SN_LDSB1_AFC0_AFEM1_AFEM1_ASEM1_CLR1_CADS0_DTLA0_DTLB0_DTVA0_DTVB0_EPS0_FDSI0_GRPM1_GRVWA4_GRVWB4_GSUn1_GSUAMBSK_GSUC1_GSUWGMRR1_GLS0_ISA942_IU1_K1_LBSPPA128_LBSPPB128_LBSPPM0_LPA16_LPB16_LPM0_LRVW2_LWPMn1_MIAV0_MIWT1_1_MO40_NTn1_NTA0_NTB0_NTC0_NTD4_NTM0_NEPBS8_NLCA1_NLCB1_ONLL1_PGR2_PLR1_PKA1_SIA3_SS1_SU0_SUM1_SUS0_SPO0_SRVW0_SSO0_SVW1_SK0_SKXCCM0_TLDS0_ULSGRO0_USL1_UIOFGRO0_USFGROn1_VSn1_VWA1_VWB1_WSGRA0_WSGRB0_WS64_WG16_4_4_WGM1_WGMXCC8_WGMXCCGn1
    SolutionIndex: 119
    SolutionNameMin: Cijk_Ailk_Bjlk_S_MX_B_UserArgs_MT32x320x16_MI16x16x1_SN_LDSB1_AFC0_AFEM1_AFEM1_ASEM1_CLR1_CADS0_DTLA0_DTLB0_DTVA0_DTVB0_EPS0_FDSI0_GRPM1_GRVWA2_GRVWB4_GSUn1_GSUAMBSK_GSUC1_GSUWGMRR1_GLS0_ISA942_IU1_K1_LBSPPA256_LBSPPB2560_LBSPPM0_LPA0_LPB16_LPM0_LRVW2_LWPMn1_MIAV0_MIWT2_5_MO40_NTn1_NTA4_NTB4_NTC0_NTD4_NTM0_NEPBS8_NLCA1_NLCB5_ONLL1_PGR2_PLR1_PKA1_SIA3_SS1_SU0_SUM1_SUS0_SPO0_SRVW0_SSO0_SVW2_SK0_SKXCCM0_TLDS0_ULSGRO0_USL1_UIOFGRO0_USFGROn1_VSn1_VWA2_VWB1_WSGRA0_WSGRB0_WS64_WG16_16_1_WGM1_WGMXCC8_WGMXCCGn1
    SolutionIndex: 120
    SolutionNameMin: Cijk_Ailk_Bjlk_S_MX_B_UserArgs_MT192x320x16_MI16x16x1_SN_LDSB0_AFC0_AFEM1_AFEM1_ASEM1_CLR1_CADS0_DTLA0_DTLB0_DTVA0_DTVB0_EPS0_FDSI0_GRPM1_GRVWA4_GRVWB4_GSUn1_GSUAMBSK_GSUC1_GSUWGMRR1_GLS0_ISA942_IU1_K1_LBSPPA1536_LBSPPB2560_LBSPPM0_LPA0_LPB0_LPM0_LRVW2_LWPMn1_MIAV0_MIWT6_10_MO40_NTn1_NTA0_NTB0_NTC0_NTD4_NTM0_NEPBS6_NLCA3_NLCB5_ONLL1_PGR2_PLR1_PKA1_SIA3_SS1_SU0_SUM1_SUS0_SPO0_SRVW0_SSO0_SVW2_SK0_SKXCCM0_TLDS0_ULSGRO1_USL1_UIOFGRO0_USFGROn1_VSn1_VWA2_VWB2_WSGRA0_WSGRB0_WS64_WG32_8_1_WGM6_WGMXCC8_WGMXCCGn1
    SolutionIndex: 121
    SolutionNameMin: Cijk_Ailk_Bjlk_S_MX_B_UserArgs_MT32x32x64_MI16x16x1_SN_LDSB1_AFC0_AFEM1_AFEM1_ASEM1_CLR1_CADS0_DTLA0_DTLB0_DTVA0_DTVB0_EPS0_FDSI0_GRPM1_GRVWA4_GRVWB4_GSUn1_GSUAMBSK_GSUC1_GSUWGMRR1_GLS0_ISA942_IU1_K1_LBSPPA256_LBSPPB256_LBSPPM0_LPA16_LPB16_LPM0_LRVW2_LWPMn1_MIAV0_MIWT1_1_MO40_NTn1_NTA0_NTB0_NTC0_NTD4_NTM0_NEPBS8_NLCA1_NLCB1_ONLL1_PGR2_PLR1_PKA1_SIA3_SS1_SU0_SUM1_SUS0_SPO0_SRVW0_SSO0_SVW1_SK0_SKXCCM0_TLDS0_ULSGRO1_USL1_UIOFGRO0_USFGROn1_VSn1_VWA1_VWB1_WSGRA0_WSGRB0_WS64_WG32_8_1_WGM1_WGMXCC8_WGMXCCGn1
    SolutionIndex: 122
    SolutionNameMin: Cijk_Ailk_Bjlk_S_MX_B_UserArgs_MT16x16x128_MI16x16x1_SN_LDSB1_AFC0_AFEM1_AFEM1_ASEM1_CLR1_CADS0_DTLA0_DTLB0_DTVA0_DTVB0_EPS0_FDSI0_GRPM1_GRVWA4_GRVWB4_GSUn1_GSUAMBSK_GSUC1_GSUWGMRR1_GLS0_ISA942_IU1_K1_LBSPPA128_LBSPPB128_LBSPPM0_LPA16_LPB16_LPM0_LRVW2_LWPMn1_MIAV0_MIWT1_1_MO40_NTn1_NTA4_NTB0_NTC0_NTD4_NTM0_NEPBS8_NLCA1_NLCB1_ONLL1_PGR2_PLR1_PKA1_SIA3_SS1_SU0_SUM1_SUS0_SPO0_SRVW0_SSO0_SVW1_SK0_SKXCCM0_TLDS0_ULSGRO0_USL1_UIOFGRO0_USFGROn1_VSn1_VWA1_VWB1_WSGRA0_WSGRB0_WS64_WG16_4_4_WGM1_WGMXCC8_WGMXCCGn1
    SolutionIndex: 123
    SolutionNameMin: Cijk_Ailk_Bjlk_S_MX_B_UserArgs_MT16x16x128_MI16x16x1_SN_LDSB1_AFC0_AFEM1_AFEM1_ASEM1_CLR1_CADS0_DTLA0_DTLB0_DTVA0_DTVB0_EPS0_FDSI0_GRPM1_GRVWA4_GRVWB4_GSUn1_GSUAMBSK_GSUC1_GSUWGMRR1_GLS0_ISA942_IU1_K1_LBSPPA128_LBSPPB128_LBSPPM0_LPA16_LPB16_LPM0_LRVW2_LWPMn1_MIAV0_MIWT1_1_MO40_NTn1_NTA4_NTB0_NTC0_NTD4_NTM0_NEPBS8_NLCA1_NLCB1_ONLL1_PGR2_PLR1_PKA1_SIA3_SS1_SU0_SUM1_SUS0_SPO0_SRVW0_SSO0_SVW1_SK0_SKXCCM0_TLDS0_ULSGRO1_USL1_UIOFGRO0_USFGROn1_VSn1_VWA1_VWB1_WSGRA0_WSGRB0_WS64_WG16_4_4_WGM1_WGMXCC8_WGMXCCGn1
    SolutionIndex: 124
    SolutionNameMin: Cijk_Ailk_Bjlk_S_MX_B_UserArgs_MT32x16x256_MI16x16x1_SN_LDSB1_AFC0_AFEM1_AFEM1_ASEM1_CLR1_CADS0_DTLA0_DTLB0_DTVA0_DTVB0_EPS0_FDSI0_GRPM1_GRVWA4_GRVWB4_GSUn1_GSUAMBSK_GSUC1_GSUWGMRR1_GLS0_ISA942_IU1_K1_LBSPPA256_LBSPPB128_LBSPPM0_LPA0_LPB16_LPM0_LRVW2_LWPMn1_MIAV0_MIWT2_1_MO40_NTn1_NTA4_NTB0_NTC0_NTD4_NTM0_NEPBS8_NLCA1_NLCB1_ONLL1_PGR2_PLR1_PKA1_SIA3_SS1_SU0_SUM1_SUS0_SPO0_SRVW0_SSO0_SVW2_SK0_SKXCCM0_TLDS0_ULSGRO0_USL1_UIOFGRO0_USFGROn1_VSn1_VWA2_VWB1_WSGRA0_WSGRB0_WS64_WG16_4_4_WGM1_WGMXCC8_WGMXCCGn1
    SolutionIndex: 125
    SolutionNameMin: Cijk_Ailk_Bjlk_S_MX_B_UserArgs_MT32x32x256_MI16x16x1_SN_LDSB1_AFC0_AFEM1_AFEM1_ASEM1_CLR1_CADS0_DTLA0_DTLB0_DTVA0_DTVB0_EPS0_FDSI0_GRPM1_GRVWA4_GRVWB4_GSUn1_GSUAMBSK_GSUC1_GSUWGMRR1_GLS0_ISA942_IU1_K1_LBSPPA256_LBSPPB256_LBSPPM0_LPA0_LPB0_LPM0_LRVW2_LWPMn1_MIAV0_MIWT2_2_MO40_NTn1_NTA4_NTB4_NTC0_NTD4_NTM0_NEPBS8_NLCA1_NLCB1_ONLL1_PGR2_PLR1_PKA1_SIA3_SS1_SU0_SUM1_SUS0_SPO0_SRVW0_SSO0_SVW2_SK0_SKXCCM0_TLDS0_ULSGRO0_USL1_UIOFGRO0_USFGROn1_VSn1_VWA2_VWB2_WSGRA0_WSGRB0_WS64_WG16_4_4_WGM1_WGMXCC8_WGMXCCGn1
    SolutionIndex: 126
    SolutionNameMin: Cijk_Ailk_Bjlk_S_MX_B_UserArgs_MT32x16x256_MI16x16x1_SN_LDSB1_AFC0_AFEM1_AFEM1_ASEM1_CLR1_CADS0_DTLA0_DTLB0_DTVA0_DTVB0_EPS0_FDSI0_GRPM1_GRVWA4_GRVWB4_GSUn1_GSUAMBSK_GSUC1_GSUWGMRR1_GLS0_ISA942_IU1_K1_LBSPPA256_LBSPPB128_LBSPPM0_LPA0_LPB16_LPM0_LRVW2_LWPMn1_MIAV0_MIWT2_1_MO40_NTn1_NTA0_NTB4_NTC0_NTD4_NTM0_NEPBS8_NLCA1_NLCB1_ONLL1_PGR2_PLR1_PKA1_SIA3_SS1_SU0_SUM1_SUS0_SPO0_SRVW0_SSO0_SVW2_SK0_SKXCCM0_TLDS0_ULSGRO0_USL1_UIOFGRO0_USFGROn1_VSn1_VWA2_VWB1_WSGRA0_WSGRB0_WS64_WG16_4_4_WGM1_WGMXCC8_WGMXCCGn1
    SolutionIndex: 127
    SolutionNameMin: Cijk_Ailk_Bjlk_S_MX_B_UserArgs_MT32x32x128_MI16x16x1_SN_LDSB1_AFC0_AFEM1_AFEM1_ASEM1_CLR1_CADS0_DTLA0_DTLB0_DTVA0_DTVB0_EPS0_FDSI0_GRPM1_GRVWA4_GRVWB4_GSUn1_GSUAMBSK_GSUC1_GSUWGMRR1_GLS0_ISA942_IU1_K1_LBSPPA256_LBSPPB256_LBSPPM0_LPA16_LPB16_LPM0_LRVW2_LWPMn1_MIAV0_MIWT1_1_MO40_NTn1_NTA0_NTB0_NTC0_NTD4_NTM0_NEPBS8_NLCA1_NLCB1_ONLL1_PGR2_PLR1_PKA1_SIA3_SS1_SU0_SUM1_SUS0_SPO0_SRVW0_SSO0_SVW1_SK0_SKXCCM0_TLDS0_ULSGRO0_USL1_UIOFGRO0_USFGROn1_VSn1_VWA1_VWB1_WSGRA0_WSGRB0_WS64_WG32_8_1_WGM8_WGMXCC8_WGMXCCGn1
    SolutionIndex: 128
    SolutionNameMin: Cijk_Ailk_Bjlk_S_MX_B_UserArgs_MT384x208x16_MI16x16x1_SN_LDSB1_AFC0_AFEM1_AFEM1_ASEM1_CLR1_CADS0_DTLA0_DTLB0_DTVA0_DTVB0_EPS0_FDSI0_GRPM1_GRVWA4_GRVWB1_GSUn1_GSUAMBSK_GSUC1_GSUWGMRR1_GLS0_ISA942_IU1_K1_LBSPPA3072_LBSPPB1664_LBSPPM0_LPA0_LPB16_LPM0_LRVW2_LWPMn1_MIAV0_MIWT6_13_MO40_NTn1_NTA0_NTB0_NTC0_NTD4_NTM0_NEPBS6_NLCA3_NLCB13_ONLL1_PGR2_PLR1_PKA1_SIA3_SS1_SU0_SUM1_SUS0_SPO0_SRVW0_SSO0_SVW2_SK0_SKXCCM0_TLDS0_ULSGRO0_USL1_UIOFGRO0_USFGROn1_VSn1_VWA2_VWB1_WSGRA0_WSGRB0_WS64_WG64_4_1_WGM8_WGMXCC8_WGMXCCGn1
    SolutionIndex: 129
    SolutionNameMin: Cijk_Ailk_Bjlk_S_MX_B_UserArgs_MT16x16x256_MI16x16x1_SN_LDSB1_AFC0_AFEM1_AFEM1_ASEM1_CLR1_CADS0_DTLA0_DTLB0_DTVA0_DTVB0_EPS0_FDSI0_GRPM1_GRVWA4_GRVWB4_GSUn1_GSUAMBSK_GSUC1_GSUWGMRR1_GLS0_ISA942_IU1_K1_LBSPPA128_LBSPPB128_LBSPPM0_LPA16_LPB16_LPM0_LRVW2_LWPMn1_MIAV0_MIWT1_1_MO40_NTn1_NTA4_NTB0_NTC0_NTD4_NTM0_NEPBS8_NLCA1_NLCB1_ONLL1_PGR2_PLR1_PKA1_SIA3_SS1_SU0_SUM1_SUS0_SPO0_SRVW0_SSO0_SVW1_SK0_SKXCCM0_TLDS0_ULSGRO1_USL1_UIOFGRO0_USFGROn1_VSn1_VWA1_VWB1_WSGRA0_WSGRB0_WS64_WG16_4_4_WGM1_WGMXCC8_WGMXCCGn1
- - - [8, 1, 265302, 128]
    - [1, 0.7]
  - - [8, 1, 127398, 128]
    - [0, 0.67]
  - - [1980, 450, 1, 4096]
    - [2, 0.0]
  - - [3024, 6048, 1, 4096]
    - [3, 0.0]
  - - [491, 3480, 1, 4096]
    - [4, 0.0]
  - - [4888, 256, 1, 4096]
    - [5, 0.0]
  - - [512, 660, 1, 4096]
    - [6, 0.0]
  - - [91, 512, 1, 4096]
    - [7, 0.0]
  - - [1980, 320, 1, 4096]
    - [8, 0.0]
  - - [1972, 492, 1, 4096]
    - [9, 0.0]
  - - [5039, 256, 1, 4096]
    - [10, 0.0]
  - - [128, 2440, 1, 4096]
    - [11, 0.0]
  - - [512, 512, 1, 4096]
    - [12, 0.0]
  - - [775, 1319, 1, 4096]
    - [13, 0.0]
  - - [2560, 512, 1, 4096]
    - [14, 0.0]
  - - [450, 128, 1, 4096]
    - [15, 0.0]
  - - [1319, 2048, 1, 4096]
    - [16, 0.0]
  - - [397, 660, 1, 4096]
    - [17, 0.0]
  - - [6048, 128, 1, 4096]
    - [18, 0.0]
  - - [3960, 1024, 1, 4096]
    - [19, 0.0]
  - - [4953, 128, 1, 4096]
    - [20, 0.0]
  - - [64, 128, 1, 4096]
    - [21, 0.0]
  - - [7320, 91, 1, 4096]
    - [22, 0.0]
  - - [290, 128, 1, 49152]
    - [23, 0.0]
  - - [35, 193, 1, 4096]
    - [24, 0.0]
  - - [6048, 2048, 1, 4096]
    - [25, 0.0]
  - - [11288, 128, 1, 4096]
    - [26, 0.0]
  - - [320, 320, 1, 4096]
    - [27, 0.0]
  - - [6048, 512, 1, 4096]
    - [28, 0.0]
  - - [1980, 768, 1, 4096]
    - [29, 0.0]
  - - [92, 397, 1, 4096]
    - [30, 0.0]
  - - [512, 128, 1, 4096]
    - [31, 0.0]
  - - [768, 279, 1, 4096]
    - [32, 0.0]
  - - [1980, 136, 1, 4096]
    - [33, 0.0]
  - - [7320, 92, 1, 4096]
    - [34, 0.0]
  - - [128, 5120, 1, 4096]
    - [35, 0.0]
  - - [512, 2560, 1, 4096]
    - [36, 0.0]
  - - [660, 256, 1, 4096]
    - [37, 0.0]
  - - [5080, 256, 1, 4096]
    - [38, 0.0]
  - - [4248, 775, 1, 4096]
    - [39, 0.0]
  - - [40, 128, 4096, 61]
    - [40, 0.0]
  - - [272, 128, 1, 4096]
    - [41, 0.0]
  - - [5120, 128, 1, 4096]
    - [42, 0.0]
  - - [1980, 35, 1, 4096]
    - [43, 0.0]
  - - [397, 120, 1, 4096]
    - [44, 0.0]
  - - [6048, 3024, 1, 4096]
    - [45, 0.0]
  - - [512, 120, 1, 4096]
    - [46, 0.0]
  - - [3480, 512, 1, 4096]
    - [47, 0.0]
  - - [4, 128, 4096, 30]
    - [48, 0.0]
  - - [1980, 272, 1, 4096]
    - [49, 0.0]
  - - [4896, 128, 1, 4096]
    - [50, 0.0]
  - - [20, 128, 4096, 33]
    - [51, 0.0]
  - - [128, 6048, 1, 4096]
    - [52, 0.0]
  - - [1980, 1972, 1, 4096]
    - [53, 0.0]
  - - [7704, 92, 1, 4096]
    - [54, 0.0]
  - - [1024, 1980, 1, 4096]
    - [55, 0.0]
  - - [120, 256, 1, 4096]
    - [56, 0.0]
  - - [128, 128, 1, 4096]
    - [57, 0.0]
  - - [7704, 91, 1, 4096]
    - [58, 0.0]
  - - [128, 7456, 1, 1024]
    - [59, 42.53]
  - - [128, 4096, 1, 1024]
    - [60, 33.27]
  - - [7968, 256, 1, 1024]
    - [61, 63.86]
  - - [4096, 128, 1, 1024]
    - [62, 30.79]
  - - [233, 56, 1, 131072]
    - [63, 23.28]
  - - [256, 7968, 1, 1024]
    - [64, 65.47]
  - - [32, 128, 1024, 233]
    - [65, 19.69]
  - - [2011, 512, 1, 1024]
    - [66, 47.74]
  - - [256, 120, 1, 8192]
    - [67, 14.8]
  - - [4, 128, 8192, 30]
    - [68, 1.93]
  - - [128, 256, 1, 8192]
    - [69, 16.63]
  - - [512, 120, 1, 8192]
    - [70, 21.7]
  - - [2048, 512, 1, 8192]
    - [71, 78.5]
  - - [256, 256, 1, 8192]
    - [72, 23.06]
  - - [4352, 128, 1, 8192]
    - [73, 54.39]
  - - [4608, 256, 1, 8192]
    - [74, 75.04]
  - - [1024, 512, 1, 8192]
    - [75, 66.57]
  - - [40, 128, 8192, 64]
    - [76, 17.39]
  - - [256, 528, 1, 8192]
    - [77, 35.94]
  - - [3960, 512, 1, 8192]
    - [78, 88.66]
  - - [512, 128, 1, 8192]
    - [70, 23.5]
  - - [4352, 256, 1, 8192]
    - [79, 73.16]
  - - [512, 528, 1, 8192]
    - [80, 50.9]
  - - [128, 5120, 1, 8192]
    - [81, 57.37]
  - - [16, 128, 8192, 33]
    - [68, 7.47]
  - - [7296, 128, 1, 8192]
    - [82, 59.87]
  - - [256, 128, 1, 98304]
    - [83, 41.04]
  - - [120, 256, 1, 8192]
    - [84, 15.69]
  - - [512, 256, 1, 8192]
    - [85, 34.63]
  - - [256, 512, 1, 8192]
    - [86, 34.87]
  - - [128, 128, 1, 8192]
    - [87, 10.36]
  - - [512, 512, 1, 8192]
    - [88, 51.76]
  - - [5640, 512, 1, 8192]
    - [89, 97.12]
  - - [5640, 2820, 1, 8192]
    - [90, 148.76]
  - - [256, 2048, 1, 8192]
    - [91, 63.5]
  - - [512, 2048, 1, 8192]
    - [92, 82.64]
  - - [5640, 2048, 1, 8192]
    - [93, 135.66]
  - - [512, 3072, 1, 8192]
    - [94, 89.94]
  - - [512, 1980, 1, 8192]
    - [81, 83.0]
  - - [128, 5640, 1, 8192]
    - [95, 58.67]
  - - [2820, 5640, 1, 8192]
    - [96, 145.7]
  - - [128, 2440, 1, 8192]
    - [97, 46.6]
  - - [5120, 128, 1, 8192]
    - [73, 55.49]
  - - [5640, 128, 1, 8192]
    - [98, 55.07]
  - - [384, 17711, 1, 246]
    - [99, 64.85]
  - - [384, 17711, 1, 768]
    - [100, 91.75]
  - - [128, 2480, 1, 17711]
    - [101, 57.64]
  - - [128, 960, 1, 17711]
    - [102, 42.9]
  - - [128, 128, 6, 17711]
    - [103, 35.1]
  - - [20, 48, 17711, 124]
    - [104, 8.8]
  - - [768, 96, 1, 17711]
    - [70, 32.91]
  - - [252, 128, 1, 17711]
    - [105, 21.19]
  - - [256, 128, 1, 17711]
    - [106, 21.77]
  - - [128, 17711, 6, 128]
    - [107, 47.65]
  - - [928, 128, 1, 17711]
    - [108, 39.6]
  - - [128, 17711, 1, 41]
    - [109, 12.88]
  - - [128, 128, 1, 17711]
    - [84, 14.31]
  - - [41, 128, 17711, 6]
    - [109, 3.1]
  - - [14976, 4096, 1, 337]
    - [110, 96.02]
  - - [8448, 4096, 1, 337]
    - [111, 94.83]
  - - [6400, 4096, 1, 337]
    - [112, 100.38]
  - - [128, 2048, 1, 20480]
    - [101, 56.57]
  - - [2632, 2048, 1, 2048]
    - [113, 109.94]
  - - [2048, 2048, 1, 2048]
    - [114, 106.54]
  - - [4096, 2048, 1, 337]
    - [115, 76.7]
  - - [2048, 2048, 1, 337]
    - [116, 60.85]
  - - [4096, 1280, 1, 337]
    - [117, 66.77]
  - - [4096, 512, 1, 337]
    - [89, 45.05]
  - - [256, 256, 1, 337]
    - [118, 3.24]
  - - [32, 8388608, 1, 12]
    - [119, 7.92]
  - - [4096, 4096, 1, 337]
    - [120, 89.75]
  - - [512, 512, 1, 337]
    - [121, 11.55]
  - - [9, 4, 1, 2048]
    - [122, 0.01]
  - - [188, 94, 1, 337]
    - [118, 0.93]
  - - [58, 32, 1, 86272]
    - [123, 6.28]
  - - [32, 7, 1, 86272]
    - [124, 1.19]
  - - [4, 9, 1, 2048]
    - [122, 0.01]
  - - [32, 32, 1, 8388608]
    - [125, 15.52]
  - - [58, 58, 1, 86272]
    - [126, 9.72]
  - - [474, 128, 1, 337]
    - [118, 2.86]
  - - [94, 188, 1, 337]
    - [118, 0.9]
  - - [2048, 128, 1, 2048]
    - [127, 25.72]
  - - [8448, 8448, 1, 337]
    - [128, 104.76]
  - - [7, 7, 1, 86272]
    - [129, 0.28]
- null
- null
- DeviceEfficiency
- Equality
