projects/hipblaslt/library/src/amd_detail/rocblaslt/src/Tensile/Logic/asm_full/aquavanjaram/gfx942_80cu/StreamK/aquavanjaram942_Cijk_Ailk_Bjlk_I8II_BH_UserArgs.yaml
- {MinimumRequiredVersion: 4.33.0}
- aquavanjaram942
- {Architecture: gfx942, CUCount: 80}
- [Device 0049, Device 0050]
    SolutionIndex: 0
    SolutionNameMin: Cijk_Ailk_Bjlk_I8II_BH_UserArgs_MT256x256x32_MI16x16x1_SN_LDSB0_AFC0_AFEM1_AFEM1_ASEM1_CLR0_CADS0_DTVA0_DTVB0_EPS0_FDSI0_GRPM1_GRVWA4_GRVWB4_GSU0_GSUAMB_GSUC0_GSUWGMRR0_GLS0_ISA942_IU1_K1_LBSPPA2048_LBSPPB2048_LBSPPM0_LPA64_LPB0_LPM0_LRVW8_LWPMn1_MIAV0_MIWT8_8_MO40_NTn1_NTA0_NTB0_NTC0_NTD0_NTM0_NEPBS0_NLCA1_NLCB1_ONLL1_PGR2_PLR0_PKA1_SIA3_SS1_SU0_SUM0_SUS32_SPO0_SRVW0_SSO0_SVW4_SK3_SKXCCM8_TLDS0_ULSGRO0_USL1_UIOFGRO0_USFGRO0_VSn1_VWA4_VWB8_WSGRA0_WSGRB0_WS64_WG32_8_1_WGM1_WGMXCC1_WGMXCCGn1
    SolutionIndex: 1
    SolutionNameMin: Cijk_Ailk_Bjlk_I8II_BH_UserArgs_MT256x256x32_MI16x16x1_SN_LDSB0_AFC0_AFEM1_AFEM1_ASEM1_CLR0_CADS0_DTVA0_DTVB0_EPS0_FDSI0_GRPM1_GRVWA4_GRVWB8_GSU0_GSUAMB_GSUC0_GSUWGMRR0_GLS0_ISA942_IU1_K1_LBSPPA2048_LBSPPB2048_LBSPPM0_LPA64_LPB64_LPM0_LRVW8_LWPMn1_MIAV0_MIWT8_8_MO40_NTn1_NTA0_NTB0_NTC0_NTD0_NTM0_NEPBS0_NLCA1_NLCB1_ONLL1_PGR2_PLR0_PKA1_SIA3_SS1_SU0_SUM0_SUS32_SPO0_SRVW0_SSO0_SVW4_SK3_SKXCCM8_TLDS0_ULSGRO0_USL1_UIOFGRO0_USFGRO0_VSn1_VWA4_VWB4_WSGRA0_WSGRB0_WS64_WG32_8_1_WGM1_WGMXCC1_WGMXCCGn1
    SolutionIndex: 2
    SolutionNameMin: Cijk_Ailk_Bjlk_I8II_BH_UserArgs_MT256x256x32_MI16x16x1_SN_LDSB0_AFC0_AFEM1_AFEM1_ASEM1_CLR0_CADS0_DTVA0_DTVB0_EPS0_FDSI0_GRPM1_GRVWA4_GRVWB8_GSU0_GSUAMB_GSUC0_GSUWGMRR0_GLS0_ISA942_IU1_K1_LBSPPA2048_LBSPPB2048_LBSPPM0_LPA64_LPB0_LPM0_LRVW8_LWPMn1_MIAV0_MIWT8_8_MO40_NTn1_NTA0_NTB0_NTC0_NTD0_NTM0_NEPBS0_NLCA1_NLCB1_ONLL1_PGR2_PLR0_PKA1_SIA3_SS1_SU0_SUM0_SUS32_SPO0_SRVW0_SSO0_SVW4_SK3_SKXCCM8_TLDS0_ULSGRO0_USL1_UIOFGRO0_USFGRO0_VSn1_VWA4_VWB8_WSGRA0_WSGRB0_WS64_WG32_8_1_WGM1_WGMXCC1_WGMXCCGn1
    SolutionIndex: 3
    SolutionNameMin: Cijk_Ailk_Bjlk_I8II_BH_UserArgs_MT256x256x32_MI16x16x1_SN_LDSB0_AFC0_AFEM1_AFEM1_ASEM1_CLR0_CADS0_DTVA0_DTVB0_EPS0_FDSI0_GRPM1_GRVWA4_GRVWB8_GSU0_GSUAMB_GSUC0_GSUWGMRR0_GLS0_ISA942_IU1_K1_LBSPPA2048_LBSPPB2048_LBSPPM0_LPA64_LPB0_LPM0_LRVW8_LWPMn1_MIAV0_MIWT8_8_MO40_NTn1_NTA0_NTB0_NTC0_NTD0_NTM0_NEPBS0_NLCA1_NLCB1_ONLL1_PGR2_PLR0_PKA1_SIA3_SS1_SU0_SUM0_SUS32_SPO0_SRVW0_SSO0_SVW4_SK3_SKXCCM8_TLDS0_ULSGRO0_USL1_UIOFGRO0_USFGRO0_VSn1_VWA4_VWB8_WSGRA0_WSGRB0_WS64_WG32_8_1_WGM4_WGMXCC1_WGMXCCGn1
    SolutionIndex: 4
    SolutionNameMin: Cijk_Ailk_Bjlk_I8II_BH_UserArgs_MT256x256x32_MI16x16x1_SN_LDSB0_AFC0_AFEM1_AFEM1_ASEM1_CLR0_CADS0_DTVA0_DTVB0_EPS0_FDSI0_GRPM1_GRVWA4_GRVWB8_GSU0_GSUAMB_GSUC0_GSUWGMRR0_GLS0_ISA942_IU1_K1_LBSPPA2048_LBSPPB2048_LBSPPM0_LPA64_LPB0_LPM0_LRVW8_LWPMn1_MIAV0_MIWT8_8_MO40_NTn1_NTA0_NTB0_NTC0_NTD0_NTM0_NEPBS0_NLCA1_NLCB1_ONLL1_PGR2_PLR0_PKA1_SIA3_SS1_SU0_SUM0_SUS32_SPO0_SRVW0_SSO0_SVW4_SK3_SKXCCM8_TLDS0_ULSGRO0_USL1_UIOFGRO0_USFGRO0_VSn1_VWA4_VWB8_WSGRA0_WSGRB0_WS64_WG32_8_1_WGM8_WGMXCC1_WGMXCCGn1
    SolutionIndex: 5
    SolutionNameMin: Cijk_Ailk_Bjlk_I8II_BH_UserArgs_MT128x256x32_MI16x16x1_SN_LDSB0_AFC0_AFEM1_AFEM1_ASEM1_CLR0_CADS0_DTVA0_DTVB0_EPS0_FDSI0_GRPM1_GRVWA4_GRVWB4_GSU0_GSUAMB_GSUC0_GSUWGMRR0_GLS0_ISA942_IU1_K1_LBSPPA1024_LBSPPB2048_LBSPPM0_LPA64_LPB64_LPM0_LRVW8_LWPMn1_MIAV0_MIWT4_8_MO40_NTn1_NTA0_NTB0_NTC0_NTD0_NTM0_NEPBS0_NLCA1_NLCB1_ONLL1_PGR2_PLR0_PKA1_SIA3_SS1_SU0_SUM0_SUS32_SPO0_SRVW0_SSO0_SVW4_SK3_SKXCCM8_TLDS0_ULSGRO0_USL1_UIOFGRO0_USFGRO0_VSn1_VWA4_VWB4_WSGRA0_WSGRB0_WS64_WG32_8_1_WGM1_WGMXCC1_WGMXCCGn1
    SolutionIndex: 6
    SolutionNameMin: Cijk_Ailk_Bjlk_I8II_BH_UserArgs_MT256x128x32_MI16x16x1_SN_LDSB0_AFC0_AFEM1_AFEM1_ASEM1_CLR0_CADS0_DTVA0_DTVB0_EPS0_FDSI0_GRPM1_GRVWA4_GRVWB4_GSU0_GSUAMB_GSUC0_GSUWGMRR0_GLS0_ISA942_IU1_K1_LBSPPA2048_LBSPPB1024_LBSPPM0_LPA64_LPB32_LPM0_LRVW8_LWPMn1_MIAV0_MIWT8_4_MO40_NTn1_NTA0_NTB0_NTC0_NTD0_NTM0_NEPBS0_NLCA1_NLCB1_ONLL1_PGR2_PLR0_PKA1_SIA3_SS1_SU0_SUM0_SUS32_SPO0_SRVW0_SSO0_SVW4_SK3_SKXCCM8_TLDS0_ULSGRO0_USL1_UIOFGRO0_USFGRO0_VSn1_VWA4_VWB2_WSGRA0_WSGRB0_WS64_WG32_8_1_WGM1_WGMXCC1_WGMXCCGn1
    SolutionIndex: 7
    SolutionNameMin: Cijk_Ailk_Bjlk_I8II_BH_UserArgs_MT128x64x32_MI16x16x1_SN_LDSB0_AFC0_AFEM1_AFEM1_ASEM1_CLR0_CADS0_DTVA0_DTVB0_EPS0_FDSI0_GRPM1_GRVWA8_GRVWB8_GSU0_GSUAMB_GSUC0_GSUWGMRR0_GLS0_ISA942_IU1_K1_LBSPPA1024_LBSPPB512_LBSPPM0_LPA64_LPB32_LPM0_LRVW8_LWPMn1_MIAV0_MIWT4_2_MO40_NTn1_NTA0_NTB0_NTC0_NTD0_NTM0_NEPBS0_NLCA1_NLCB1_ONLL1_PGR2_PLR0_PKA1_SIA3_SS1_SU0_SUM0_SUS32_SPO0_SRVW0_SSO0_SVW4_SK3_SKXCCM8_TLDS0_ULSGRO0_USL1_UIOFGRO0_USFGRO0_VSn1_VWA4_VWB2_WSGRA0_WSGRB0_WS64_WG32_8_1_WGM1_WGMXCC1_WGMXCCGn1
    SolutionIndex: 8
    SolutionNameMin: Cijk_Ailk_Bjlk_I8II_BH_UserArgs_MT32x32x32_MI16x16x1_SN_LDSB0_AFC0_AFEM1_AFEM1_ASEM1_CLR0_CADS0_DTVA0_DTVB0_EPS0_FDSI0_GRPM1_GRVWA4_GRVWB4_GSU0_GSUAMB_GSUC0_GSUWGMRR0_GLS0_ISA942_IU1_K1_LBSPPA256_LBSPPB256_LBSPPM0_LPA16_LPB16_LPM0_LRVW8_LWPMn1_MIAV0_MIWT1_1_MO40_NTn1_NTA0_NTB0_NTC0_NTD0_NTM0_NEPBS0_NLCA1_NLCB1_ONLL1_PGR2_PLR0_PKA1_SIA3_SS1_SU0_SUM0_SUS32_SPO0_SRVW0_SSO0_SVW1_SK3_SKXCCM8_TLDS0_ULSGRO0_USL1_UIOFGRO0_USFGRO0_VSn1_VWA1_VWB1_WSGRA0_WSGRB0_WS64_WG32_8_1_WGM1_WGMXCC1_WGMXCCGn1
    SolutionIndex: 9
    SolutionNameMin: Cijk_Ailk_Bjlk_I8II_BH_UserArgs_MT256x256x64_MI16x16x1_SN_LDSB1_AFC0_AFEM1_AFEM1_ASEM1_CLR1_CADS0_DTVA0_DTVB0_EPS0_FDSI0_GRPM1_GRVWA4_GRVWB4_GSU0_GSUAMB_GSUC0_GSUWGMRR0_GLS0_ISA942_IU1_K1_LBSPPA2048_LBSPPB2048_LBSPPM0_LPA64_LPB32_LPM0_LRVW8_LWPMn1_MIAV0_MIWT8_8_MO40_NTn1_NTA0_NTB0_NTC0_NTD0_NTM0_NEPBS0_NLCA1_NLCB1_ONLL1_PGR2_PLR1_PKA1_SIA3_SS1_SU0_SUM0_SUS64_SPO0_SRVW0_SSO0_SVW4_SK3_SKXCCM8_TLDS0_ULSGRO0_USL1_UIOFGRO0_USFGRO0_VSn1_VWA4_VWB2_WSGRA0_WSGRB0_WS64_WG32_8_1_WGM1_WGMXCC1_WGMXCCGn1
    SolutionIndex: 10
    SolutionNameMin: Cijk_Ailk_Bjlk_I8II_BH_UserArgs_MT256x256x64_MI16x16x1_SN_LDSB1_AFC0_AFEM1_AFEM1_ASEM1_CLR1_CADS0_DTVA0_DTVB0_EPS0_FDSI0_GRPM1_GRVWA4_GRVWB4_GSU0_GSUAMB_GSUC0_GSUWGMRR0_GLS0_ISA942_IU1_K1_LBSPPA2048_LBSPPB2048_LBSPPM0_LPA64_LPB64_LPM0_LRVW8_LWPMn1_MIAV0_MIWT8_8_MO40_NTn1_NTA0_NTB0_NTC0_NTD0_NTM0_NEPBS0_NLCA1_NLCB1_ONLL1_PGR2_PLR1_PKA1_SIA3_SS1_SU0_SUM0_SUS64_SPO0_SRVW0_SSO0_SVW4_SK3_SKXCCM8_TLDS0_ULSGRO0_USL1_UIOFGRO0_USFGRO0_VSn1_VWA4_VWB4_WSGRA0_WSGRB0_WS64_WG32_8_1_WGM1_WGMXCC1_WGMXCCGn1
    SolutionIndex: 11
    SolutionNameMin: Cijk_Ailk_Bjlk_I8II_BH_UserArgs_MT256x256x64_MI16x16x1_SN_LDSB1_AFC0_AFEM1_AFEM1_ASEM1_CLR1_CADS0_DTVA0_DTVB0_EPS0_FDSI0_GRPM1_GRVWA4_GRVWB4_GSU0_GSUAMB_GSUC0_GSUWGMRR0_GLS0_ISA942_IU1_K1_LBSPPA2048_LBSPPB2048_LBSPPM0_LPA64_LPB0_LPM0_LRVW8_LWPMn1_MIAV0_MIWT8_8_MO40_NTn1_NTA0_NTB0_NTC0_NTD0_NTM0_NEPBS0_NLCA1_NLCB1_ONLL1_PGR2_PLR1_PKA1_SIA3_SS1_SU0_SUM0_SUS64_SPO0_SRVW0_SSO0_SVW4_SK3_SKXCCM8_TLDS0_ULSGRO0_USL1_UIOFGRO0_USFGRO0_VSn1_VWA4_VWB8_WSGRA0_WSGRB0_WS64_WG32_8_1_WGM1_WGMXCC1_WGMXCCGn1
    SolutionIndex: 12
    SolutionNameMin: Cijk_Ailk_Bjlk_I8II_BH_UserArgs_MT256x256x64_MI16x16x1_SN_LDSB1_AFC0_AFEM1_AFEM1_ASEM1_CLR1_CADS0_DTVA0_DTVB0_EPS0_FDSI0_GRPM1_GRVWA4_GRVWB8_GSU0_GSUAMB_GSUC0_GSUWGMRR0_GLS0_ISA942_IU1_K1_LBSPPA2048_LBSPPB2048_LBSPPM0_LPA64_LPB32_LPM0_LRVW8_LWPMn1_MIAV0_MIWT8_8_MO40_NTn1_NTA0_NTB0_NTC0_NTD0_NTM0_NEPBS0_NLCA1_NLCB1_ONLL1_PGR2_PLR1_PKA1_SIA3_SS1_SU0_SUM0_SUS64_SPO0_SRVW0_SSO0_SVW4_SK3_SKXCCM8_TLDS0_ULSGRO0_USL1_UIOFGRO0_USFGRO0_VSn1_VWA4_VWB2_WSGRA0_WSGRB0_WS64_WG32_8_1_WGM1_WGMXCC1_WGMXCCGn1
    SolutionIndex: 13
    SolutionNameMin: Cijk_Ailk_Bjlk_I8II_BH_UserArgs_MT256x256x64_MI16x16x1_SN_LDSB1_AFC0_AFEM1_AFEM1_ASEM1_CLR1_CADS0_DTVA0_DTVB0_EPS0_FDSI0_GRPM1_GRVWA4_GRVWB8_GSU0_GSUAMB_GSUC0_GSUWGMRR0_GLS0_ISA942_IU1_K1_LBSPPA2048_LBSPPB2048_LBSPPM0_LPA64_LPB0_LPM0_LRVW8_LWPMn1_MIAV0_MIWT8_8_MO40_NTn1_NTA0_NTB0_NTC0_NTD0_NTM0_NEPBS0_NLCA1_NLCB1_ONLL1_PGR2_PLR1_PKA1_SIA3_SS1_SU0_SUM0_SUS64_SPO0_SRVW0_SSO0_SVW4_SK3_SKXCCM8_TLDS0_ULSGRO0_USL1_UIOFGRO0_USFGRO0_VSn1_VWA4_VWB8_WSGRA0_WSGRB0_WS64_WG32_8_1_WGM1_WGMXCC1_WGMXCCGn1
    SolutionIndex: 14
    SolutionNameMin: Cijk_Ailk_Bjlk_I8II_BH_UserArgs_MT256x256x64_MI16x16x1_SN_LDSB1_AFC0_AFEM1_AFEM1_ASEM1_CLR1_CADS0_DTVA0_DTVB0_EPS0_FDSI0_GRPM1_GRVWA4_GRVWB4_GSU0_GSUAMB_GSUC0_GSUWGMRR0_GLS0_ISA942_IU1_K1_LBSPPA2048_LBSPPB2048_LBSPPM0_LPA64_LPB0_LPM0_LRVW8_LWPMn1_MIAV0_MIWT8_8_MO40_NTn1_NTA0_NTB0_NTC0_NTD0_NTM0_NEPBS0_NLCA1_NLCB1_ONLL1_PGR2_PLR1_PKA1_SIA3_SS1_SU0_SUM0_SUS64_SPO0_SRVW0_SSO0_SVW4_SK3_SKXCCM8_TLDS0_ULSGRO0_USL1_UIOFGRO0_USFGRO0_VSn1_VWA4_VWB8_WSGRA0_WSGRB0_WS64_WG32_8_1_WGM4_WGMXCC1_WGMXCCGn1
    SolutionIndex: 15
    SolutionNameMin: Cijk_Ailk_Bjlk_I8II_BH_UserArgs_MT256x256x64_MI16x16x1_SN_LDSB1_AFC0_AFEM1_AFEM1_ASEM1_CLR1_CADS0_DTVA0_DTVB0_EPS0_FDSI0_GRPM1_GRVWA4_GRVWB4_GSU0_GSUAMB_GSUC0_GSUWGMRR0_GLS0_ISA942_IU1_K1_LBSPPA2048_LBSPPB2048_LBSPPM0_LPA64_LPB0_LPM0_LRVW8_LWPMn1_MIAV0_MIWT8_8_MO40_NTn1_NTA0_NTB0_NTC0_NTD0_NTM0_NEPBS0_NLCA1_NLCB1_ONLL1_PGR2_PLR1_PKA1_SIA3_SS1_SU0_SUM0_SUS64_SPO0_SRVW0_SSO0_SVW4_SK3_SKXCCM8_TLDS0_ULSGRO0_USL1_UIOFGRO0_USFGRO0_VSn1_VWA4_VWB8_WSGRA0_WSGRB0_WS64_WG32_8_1_WGM8_WGMXCC1_WGMXCCGn1
    SolutionIndex: 16
    SolutionNameMin: Cijk_Ailk_Bjlk_I8II_BH_UserArgs_MT128x256x64_MI16x16x1_SN_LDSB1_AFC0_AFEM1_AFEM1_ASEM1_CLR1_CADS0_DTVA0_DTVB0_EPS0_FDSI0_GRPM1_GRVWA4_GRVWB8_GSU0_GSUAMB_GSUC0_GSUWGMRR0_GLS0_ISA942_IU1_K1_LBSPPA1024_LBSPPB2048_LBSPPM0_LPA64_LPB0_LPM0_LRVW8_LWPMn1_MIAV0_MIWT4_8_MO40_NTn1_NTA0_NTB0_NTC0_NTD0_NTM0_NEPBS0_NLCA1_NLCB1_ONLL1_PGR2_PLR1_PKA1_SIA3_SS1_SU0_SUM0_SUS64_SPO0_SRVW0_SSO0_SVW4_SK3_SKXCCM8_TLDS0_ULSGRO0_USL1_UIOFGRO0_USFGRO0_VSn1_VWA4_VWB8_WSGRA0_WSGRB0_WS64_WG32_8_1_WGM1_WGMXCC1_WGMXCCGn1
    SolutionIndex: 17
    SolutionNameMin: Cijk_Ailk_Bjlk_I8II_BH_UserArgs_MT128x256x64_MI16x16x1_SN_LDSB1_AFC0_AFEM1_AFEM1_ASEM1_CLR1_CADS0_DTVA0_DTVB0_EPS0_FDSI0_GRPM1_GRVWA8_GRVWB8_GSU0_GSUAMB_GSUC0_GSUWGMRR0_GLS0_ISA942_IU1_K1_LBSPPA1024_LBSPPB2048_LBSPPM0_LPA64_LPB0_LPM0_LRVW8_LWPMn1_MIAV0_MIWT4_8_MO40_NTn1_NTA0_NTB0_NTC0_NTD0_NTM0_NEPBS0_NLCA1_NLCB1_ONLL1_PGR2_PLR1_PKA1_SIA3_SS1_SU0_SUM0_SUS64_SPO0_SRVW0_SSO0_SVW4_SK3_SKXCCM8_TLDS0_ULSGRO0_USL1_UIOFGRO0_USFGRO0_VSn1_VWA4_VWB8_WSGRA0_WSGRB0_WS64_WG32_8_1_WGM1_WGMXCC1_WGMXCCGn1
    SolutionIndex: 18
    SolutionNameMin: Cijk_Ailk_Bjlk_I8II_BH_UserArgs_MT128x256x64_MI16x16x1_SN_LDSB1_AFC0_AFEM1_AFEM1_ASEM1_CLR1_CADS0_DTVA0_DTVB0_EPS0_FDSI0_GRPM1_GRVWA4_GRVWB8_GSU0_GSUAMB_GSUC0_GSUWGMRR0_GLS0_ISA942_IU1_K1_LBSPPA1024_LBSPPB2048_LBSPPM0_LPA64_LPB0_LPM0_LRVW8_LWPMn1_MIAV0_MIWT4_8_MO40_NTn1_NTA0_NTB0_NTC0_NTD0_NTM0_NEPBS0_NLCA1_NLCB1_ONLL1_PGR2_PLR1_PKA1_SIA3_SS1_SU0_SUM0_SUS64_SPO0_SRVW0_SSO0_SVW4_SK3_SKXCCM8_TLDS0_ULSGRO0_USL1_UIOFGRO0_USFGRO0_VSn1_VWA4_VWB8_WSGRA0_WSGRB0_WS64_WG32_8_1_WGM4_WGMXCC1_WGMXCCGn1
    SolutionIndex: 19
    SolutionNameMin: Cijk_Ailk_Bjlk_I8II_BH_UserArgs_MT256x128x64_MI16x16x1_SN_LDSB1_AFC0_AFEM1_AFEM1_ASEM1_CLR1_CADS0_DTVA0_DTVB0_EPS0_FDSI0_GRPM1_GRVWA4_GRVWB4_GSU0_GSUAMB_GSUC0_GSUWGMRR0_GLS0_ISA942_IU1_K1_LBSPPA2048_LBSPPB1024_LBSPPM0_LPA64_LPB64_LPM0_LRVW8_LWPMn1_MIAV0_MIWT8_4_MO40_NTn1_NTA0_NTB0_NTC0_NTD0_NTM0_NEPBS0_NLCA1_NLCB1_ONLL1_PGR2_PLR1_PKA1_SIA3_SS1_SU0_SUM0_SUS64_SPO0_SRVW0_SSO0_SVW4_SK3_SKXCCM8_TLDS0_ULSGRO0_USL1_UIOFGRO0_USFGRO0_VSn1_VWA4_VWB4_WSGRA0_WSGRB0_WS64_WG32_8_1_WGM1_WGMXCC1_WGMXCCGn1
    SolutionIndex: 20
    SolutionNameMin: Cijk_Ailk_Bjlk_I8II_BH_UserArgs_MT256x128x64_MI16x16x1_SN_LDSB1_AFC0_AFEM1_AFEM1_ASEM1_CLR1_CADS0_DTVA0_DTVB0_EPS0_FDSI0_GRPM1_GRVWA4_GRVWB8_GSU0_GSUAMB_GSUC0_GSUWGMRR0_GLS0_ISA942_IU1_K1_LBSPPA2048_LBSPPB1024_LBSPPM0_LPA64_LPB64_LPM0_LRVW8_LWPMn1_MIAV0_MIWT8_4_MO40_NTn1_NTA0_NTB0_NTC0_NTD0_NTM0_NEPBS0_NLCA1_NLCB1_ONLL1_PGR2_PLR1_PKA1_SIA3_SS1_SU0_SUM0_SUS64_SPO0_SRVW0_SSO0_SVW4_SK3_SKXCCM8_TLDS0_ULSGRO0_USL1_UIOFGRO0_USFGRO0_VSn1_VWA4_VWB4_WSGRA0_WSGRB0_WS64_WG32_8_1_WGM1_WGMXCC1_WGMXCCGn1
    SolutionIndex: 21
    SolutionNameMin: Cijk_Ailk_Bjlk_I8II_BH_UserArgs_MT256x128x64_MI16x16x1_SN_LDSB1_AFC0_AFEM1_AFEM1_ASEM1_CLR1_CADS0_DTVA0_DTVB0_EPS0_FDSI0_GRPM1_GRVWA4_GRVWB4_GSU0_GSUAMB_GSUC0_GSUWGMRR0_GLS0_ISA942_IU1_K1_LBSPPA2048_LBSPPB1024_LBSPPM0_LPA64_LPB64_LPM0_LRVW8_LWPMn1_MIAV0_MIWT8_4_MO40_NTn1_NTA0_NTB0_NTC0_NTD0_NTM0_NEPBS0_NLCA1_NLCB1_ONLL1_PGR2_PLR1_PKA1_SIA3_SS1_SU0_SUM0_SUS64_SPO0_SRVW0_SSO0_SVW4_SK3_SKXCCM8_TLDS0_ULSGRO0_USL1_UIOFGRO0_USFGRO0_VSn1_VWA4_VWB4_WSGRA0_WSGRB0_WS64_WG32_8_1_WGM8_WGMXCC1_WGMXCCGn1
    SolutionIndex: 22
    SolutionNameMin: Cijk_Ailk_Bjlk_I8II_BH_UserArgs_MT256x128x64_MI16x16x1_SN_LDSB1_AFC0_AFEM1_AFEM1_ASEM1_CLR1_CADS0_DTVA0_DTVB0_EPS0_FDSI0_GRPM1_GRVWA4_GRVWB8_GSU0_GSUAMB_GSUC0_GSUWGMRR0_GLS0_ISA942_IU1_K1_LBSPPA2048_LBSPPB1024_LBSPPM0_LPA64_LPB64_LPM0_LRVW8_LWPMn1_MIAV0_MIWT8_4_MO40_NTn1_NTA0_NTB0_NTC0_NTD0_NTM0_NEPBS0_NLCA1_NLCB1_ONLL1_PGR2_PLR1_PKA1_SIA3_SS1_SU0_SUM0_SUS64_SPO0_SRVW0_SSO0_SVW4_SK3_SKXCCM8_TLDS0_ULSGRO0_USL1_UIOFGRO0_USFGRO0_VSn1_VWA4_VWB4_WSGRA0_WSGRB0_WS64_WG32_8_1_WGM8_WGMXCC1_WGMXCCGn1
    SolutionIndex: 23
    SolutionNameMin: Cijk_Ailk_Bjlk_I8II_BH_UserArgs_MT128x128x64_MI16x16x1_SN_LDSB1_AFC0_AFEM1_AFEM1_ASEM1_CLR1_CADS0_DTVA0_DTVB0_EPS0_FDSI0_GRPM1_GRVWA4_GRVWB4_GSU0_GSUAMB_GSUC0_GSUWGMRR0_GLS0_ISA942_IU1_K1_LBSPPA1024_LBSPPB1024_LBSPPM0_LPA64_LPB64_LPM0_LRVW8_LWPMn1_MIAV0_MIWT4_4_MO40_NTn1_NTA0_NTB0_NTC0_NTD0_NTM0_NEPBS0_NLCA1_NLCB1_ONLL1_PGR2_PLR1_PKA1_SIA3_SS1_SU0_SUM0_SUS64_SPO0_SRVW0_SSO0_SVW4_SK3_SKXCCM8_TLDS0_ULSGRO0_USL1_UIOFGRO0_USFGRO0_VSn1_VWA4_VWB4_WSGRA0_WSGRB0_WS64_WG32_8_1_WGM1_WGMXCC1_WGMXCCGn1
    SolutionIndex: 24
    SolutionNameMin: Cijk_Ailk_Bjlk_I8II_BH_UserArgs_MT128x128x64_MI16x16x1_SN_LDSB1_AFC0_AFEM1_AFEM1_ASEM1_CLR1_CADS0_DTVA0_DTVB0_EPS0_FDSI0_GRPM1_GRVWA4_GRVWB8_GSU0_GSUAMB_GSUC0_GSUWGMRR0_GLS0_ISA942_IU1_K1_LBSPPA1024_LBSPPB1024_LBSPPM0_LPA64_LPB32_LPM0_LRVW8_LWPMn1_MIAV0_MIWT4_4_MO40_NTn1_NTA0_NTB0_NTC0_NTD0_NTM0_NEPBS0_NLCA1_NLCB1_ONLL1_PGR2_PLR1_PKA1_SIA3_SS1_SU0_SUM0_SUS64_SPO0_SRVW0_SSO0_SVW4_SK3_SKXCCM8_TLDS0_ULSGRO0_USL1_UIOFGRO0_USFGRO0_VSn1_VWA4_VWB2_WSGRA0_WSGRB0_WS64_WG32_8_1_WGM1_WGMXCC1_WGMXCCGn1
    SolutionIndex: 25
    SolutionNameMin: Cijk_Ailk_Bjlk_I8II_BH_UserArgs_MT128x128x64_MI16x16x1_SN_LDSB1_AFC0_AFEM1_AFEM1_ASEM1_CLR1_CADS0_DTVA0_DTVB0_EPS0_FDSI0_GRPM1_GRVWA4_GRVWB8_GSU0_GSUAMB_GSUC0_GSUWGMRR0_GLS0_ISA942_IU1_K1_LBSPPA1024_LBSPPB1024_LBSPPM0_LPA64_LPB64_LPM0_LRVW8_LWPMn1_MIAV0_MIWT4_4_MO40_NTn1_NTA0_NTB0_NTC0_NTD0_NTM0_NEPBS0_NLCA1_NLCB1_ONLL1_PGR2_PLR1_PKA1_SIA3_SS1_SU0_SUM0_SUS64_SPO0_SRVW0_SSO0_SVW4_SK3_SKXCCM8_TLDS0_ULSGRO0_USL1_UIOFGRO0_USFGRO0_VSn1_VWA4_VWB4_WSGRA0_WSGRB0_WS64_WG32_8_1_WGM1_WGMXCC1_WGMXCCGn1
    SolutionIndex: 26
    SolutionNameMin: Cijk_Ailk_Bjlk_I8II_BH_UserArgs_MT64x128x64_MI16x16x1_SN_LDSB0_AFC0_AFEM1_AFEM1_ASEM1_CLR1_CADS0_DTVA0_DTVB0_EPS0_FDSI0_GRPM1_GRVWA4_GRVWB8_GSU0_GSUAMB_GSUC0_GSUWGMRR0_GLS0_ISA942_IU1_K1_LBSPPA512_LBSPPB1024_LBSPPM0_LPA16_LPB64_LPM0_LRVW8_LWPMn1_MIAV0_MIWT2_4_MO40_NTn1_NTA0_NTB0_NTC0_NTD0_NTM0_NEPBS0_NLCA1_NLCB1_ONLL1_PGR2_PLR1_PKA1_SIA3_SS1_SU0_SUM0_SUS64_SPO0_SRVW0_SSO0_SVW1_SK3_SKXCCM8_TLDS0_ULSGRO0_USL1_UIOFGRO0_USFGRO0_VSn1_VWA1_VWB4_WSGRA0_WSGRB0_WS64_WG32_8_1_WGM1_WGMXCC1_WGMXCCGn1
    SolutionIndex: 27
    SolutionNameMin: Cijk_Ailk_Bjlk_I8II_BH_UserArgs_MT64x128x64_MI16x16x1_SN_LDSB0_AFC0_AFEM1_AFEM1_ASEM1_CLR1_CADS0_DTVA0_DTVB0_EPS0_FDSI0_GRPM1_GRVWA4_GRVWB8_GSU0_GSUAMB_GSUC0_GSUWGMRR0_GLS0_ISA942_IU1_K1_LBSPPA512_LBSPPB1024_LBSPPM0_LPA32_LPB64_LPM0_LRVW8_LWPMn1_MIAV0_MIWT2_4_MO40_NTn1_NTA0_NTB0_NTC0_NTD0_NTM0_NEPBS0_NLCA1_NLCB1_ONLL1_PGR2_PLR1_PKA1_SIA3_SS1_SU0_SUM0_SUS64_SPO0_SRVW0_SSO0_SVW2_SK3_SKXCCM8_TLDS0_ULSGRO0_USL1_UIOFGRO0_USFGRO0_VSn1_VWA2_VWB4_WSGRA0_WSGRB0_WS64_WG32_8_1_WGM1_WGMXCC1_WGMXCCGn1
    SolutionIndex: 28
    SolutionNameMin: Cijk_Ailk_Bjlk_I8II_BH_UserArgs_MT128x64x64_MI16x16x1_SN_LDSB0_AFC0_AFEM1_AFEM1_ASEM1_CLR1_CADS0_DTVA0_DTVB0_EPS0_FDSI0_GRPM1_GRVWA4_GRVWB4_GSU0_GSUAMB_GSUC0_GSUWGMRR0_GLS0_ISA942_IU1_K1_LBSPPA1024_LBSPPB512_LBSPPM0_LPA64_LPB32_LPM0_LRVW8_LWPMn1_MIAV0_MIWT4_2_MO40_NTn1_NTA0_NTB0_NTC0_NTD0_NTM0_NEPBS0_NLCA1_NLCB1_ONLL1_PGR2_PLR1_PKA1_SIA3_SS1_SU0_SUM0_SUS64_SPO0_SRVW0_SSO0_SVW4_SK3_SKXCCM8_TLDS0_ULSGRO0_USL1_UIOFGRO0_USFGRO0_VSn1_VWA4_VWB2_WSGRA0_WSGRB0_WS64_WG32_8_1_WGM1_WGMXCC1_WGMXCCGn1
    SolutionIndex: 29
    SolutionNameMin: Cijk_Ailk_Bjlk_I8II_BH_UserArgs_MT128x64x64_MI16x16x1_SN_LDSB0_AFC0_AFEM1_AFEM1_ASEM1_CLR1_CADS0_DTVA0_DTVB0_EPS0_FDSI0_GRPM1_GRVWA4_GRVWB8_GSU0_GSUAMB_GSUC0_GSUWGMRR0_GLS0_ISA942_IU1_K1_LBSPPA1024_LBSPPB512_LBSPPM0_LPA64_LPB32_LPM0_LRVW8_LWPMn1_MIAV0_MIWT4_2_MO40_NTn1_NTA0_NTB0_NTC0_NTD0_NTM0_NEPBS0_NLCA1_NLCB1_ONLL1_PGR2_PLR1_PKA1_SIA3_SS1_SU0_SUM0_SUS64_SPO0_SRVW0_SSO0_SVW4_SK3_SKXCCM8_TLDS0_ULSGRO0_USL1_UIOFGRO0_USFGRO0_VSn1_VWA4_VWB2_WSGRA0_WSGRB0_WS64_WG32_8_1_WGM1_WGMXCC1_WGMXCCGn1
    SolutionIndex: 30
    SolutionNameMin: Cijk_Ailk_Bjlk_I8II_BH_UserArgs_MT128x64x64_MI16x16x1_SN_LDSB0_AFC0_AFEM1_AFEM1_ASEM1_CLR1_CADS0_DTVA0_DTVB0_EPS0_FDSI0_GRPM1_GRVWA4_GRVWB8_GSU0_GSUAMB_GSUC0_GSUWGMRR0_GLS0_ISA942_IU1_K1_LBSPPA1024_LBSPPB512_LBSPPM0_LPA64_LPB32_LPM0_LRVW8_LWPMn1_MIAV0_MIWT4_2_MO40_NTn1_NTA0_NTB0_NTC0_NTD0_NTM0_NEPBS0_NLCA1_NLCB1_ONLL1_PGR2_PLR1_PKA1_SIA3_SS1_SU0_SUM0_SUS64_SPO0_SRVW0_SSO0_SVW4_SK3_SKXCCM8_TLDS0_ULSGRO0_USL1_UIOFGRO0_USFGRO0_VSn1_VWA4_VWB2_WSGRA0_WSGRB0_WS64_WG32_8_1_WGM4_WGMXCC1_WGMXCCGn1
    SolutionIndex: 31
    SolutionNameMin: Cijk_Ailk_Bjlk_I8II_BH_UserArgs_MT128x32x64_MI16x16x1_SN_LDSB0_AFC0_AFEM1_AFEM1_ASEM1_CLR1_CADS0_DTVA0_DTVB0_EPS0_FDSI0_GRPM1_GRVWA4_GRVWB4_GSU0_GSUAMB_GSUC0_GSUWGMRR0_GLS0_ISA942_IU1_K1_LBSPPA1024_LBSPPB256_LBSPPM0_LPA64_LPB16_LPM0_LRVW8_LWPMn1_MIAV0_MIWT4_1_MO40_NTn1_NTA0_NTB0_NTC0_NTD0_NTM0_NEPBS0_NLCA1_NLCB1_ONLL1_PGR2_PLR1_PKA1_SIA3_SS1_SU0_SUM0_SUS64_SPO0_SRVW0_SSO0_SVW4_SK3_SKXCCM8_TLDS0_ULSGRO0_USL1_UIOFGRO0_USFGRO0_VSn1_VWA4_VWB1_WSGRA0_WSGRB0_WS64_WG32_8_1_WGM1_WGMXCC1_WGMXCCGn1
    SolutionIndex: 32
    SolutionNameMin: Cijk_Ailk_Bjlk_I8II_BH_UserArgs_MT128x32x64_MI16x16x1_SN_LDSB0_AFC0_AFEM1_AFEM1_ASEM1_CLR1_CADS0_DTVA0_DTVB0_EPS0_FDSI0_GRPM1_GRVWA4_GRVWB8_GSU0_GSUAMB_GSUC0_GSUWGMRR0_GLS0_ISA942_IU1_K1_LBSPPA1024_LBSPPB256_LBSPPM0_LPA64_LPB16_LPM0_LRVW8_LWPMn1_MIAV0_MIWT4_1_MO40_NTn1_NTA0_NTB0_NTC0_NTD0_NTM0_NEPBS0_NLCA1_NLCB1_ONLL1_PGR2_PLR1_PKA1_SIA3_SS1_SU0_SUM0_SUS64_SPO0_SRVW0_SSO0_SVW4_SK3_SKXCCM8_TLDS0_ULSGRO0_USL1_UIOFGRO0_USFGRO0_VSn1_VWA4_VWB1_WSGRA0_WSGRB0_WS64_WG32_8_1_WGM1_WGMXCC1_WGMXCCGn1
    SolutionIndex: 33
    SolutionNameMin: Cijk_Ailk_Bjlk_I8II_BH_UserArgs_MT64x64x64_MI16x16x1_SN_LDSB0_AFC0_AFEM1_AFEM1_ASEM1_CLR1_CADS0_DTVA0_DTVB0_EPS0_FDSI0_GRPM1_GRVWA4_GRVWB4_GSU0_GSUAMB_GSUC0_GSUWGMRR0_GLS0_ISA942_IU1_K1_LBSPPA512_LBSPPB512_LBSPPM0_LPA32_LPB32_LPM0_LRVW8_LWPMn1_MIAV0_MIWT2_2_MO40_NTn1_NTA0_NTB0_NTC0_NTD0_NTM0_NEPBS0_NLCA1_NLCB1_ONLL1_PGR2_PLR1_PKA1_SIA3_SS1_SU0_SUM0_SUS64_SPO0_SRVW0_SSO0_SVW2_SK3_SKXCCM8_TLDS0_ULSGRO0_USL1_UIOFGRO0_USFGRO0_VSn1_VWA2_VWB2_WSGRA0_WSGRB0_WS64_WG32_8_1_WGM1_WGMXCC1_WGMXCCGn1
    SolutionIndex: 34
    SolutionNameMin: Cijk_Ailk_Bjlk_I8II_BH_UserArgs_MT64x64x64_MI16x16x1_SN_LDSB0_AFC0_AFEM1_AFEM1_ASEM1_CLR1_CADS0_DTVA0_DTVB0_EPS0_FDSI0_GRPM1_GRVWA4_GRVWB8_GSU0_GSUAMB_GSUC0_GSUWGMRR0_GLS0_ISA942_IU1_K1_LBSPPA512_LBSPPB512_LBSPPM0_LPA32_LPB32_LPM0_LRVW8_LWPMn1_MIAV0_MIWT2_2_MO40_NTn1_NTA0_NTB0_NTC0_NTD0_NTM0_NEPBS0_NLCA1_NLCB1_ONLL1_PGR2_PLR1_PKA1_SIA3_SS1_SU0_SUM0_SUS64_SPO0_SRVW0_SSO0_SVW2_SK3_SKXCCM8_TLDS0_ULSGRO0_USL1_UIOFGRO0_USFGRO0_VSn1_VWA2_VWB2_WSGRA0_WSGRB0_WS64_WG32_8_1_WGM1_WGMXCC1_WGMXCCGn1
    SolutionIndex: 35
    SolutionNameMin: Cijk_Ailk_Bjlk_I8II_BH_UserArgs_MT64x64x64_MI16x16x1_SN_LDSB0_AFC0_AFEM1_AFEM1_ASEM1_CLR1_CADS0_DTVA0_DTVB0_EPS0_FDSI0_GRPM1_GRVWA8_GRVWB8_GSU0_GSUAMB_GSUC0_GSUWGMRR0_GLS0_ISA942_IU1_K1_LBSPPA512_LBSPPB512_LBSPPM0_LPA32_LPB32_LPM0_LRVW8_LWPMn1_MIAV0_MIWT2_2_MO40_NTn1_NTA0_NTB0_NTC0_NTD0_NTM0_NEPBS0_NLCA1_NLCB1_ONLL1_PGR2_PLR1_PKA1_SIA3_SS1_SU0_SUM0_SUS64_SPO0_SRVW0_SSO0_SVW2_SK3_SKXCCM8_TLDS0_ULSGRO0_USL1_UIOFGRO0_USFGRO0_VSn1_VWA2_VWB2_WSGRA0_WSGRB0_WS64_WG32_8_1_WGM1_WGMXCC1_WGMXCCGn1
    SolutionIndex: 36
    SolutionNameMin: Cijk_Ailk_Bjlk_I8II_BH_UserArgs_MT32x64x64_MI16x16x1_SN_LDSB0_AFC0_AFEM1_AFEM1_ASEM1_CLR1_CADS0_DTVA0_DTVB0_EPS0_FDSI0_GRPM1_GRVWA4_GRVWB4_GSU0_GSUAMB_GSUC0_GSUWGMRR0_GLS0_ISA942_IU1_K1_LBSPPA256_LBSPPB512_LBSPPM0_LPA16_LPB32_LPM0_LRVW8_LWPMn1_MIAV0_MIWT1_2_MO40_NTn1_NTA0_NTB0_NTC0_NTD0_NTM0_NEPBS0_NLCA1_NLCB1_ONLL1_PGR2_PLR1_PKA1_SIA3_SS1_SU0_SUM0_SUS64_SPO0_SRVW0_SSO0_SVW1_SK3_SKXCCM8_TLDS0_ULSGRO0_USL1_UIOFGRO0_USFGRO0_VSn1_VWA1_VWB2_WSGRA0_WSGRB0_WS64_WG32_8_1_WGM1_WGMXCC1_WGMXCCGn1
    SolutionIndex: 37
    SolutionNameMin: Cijk_Ailk_Bjlk_I8II_BH_UserArgs_MT64x32x64_MI16x16x1_SN_LDSB0_AFC0_AFEM1_AFEM1_ASEM1_CLR1_CADS0_DTVA0_DTVB0_EPS0_FDSI0_GRPM1_GRVWA4_GRVWB4_GSU0_GSUAMB_GSUC0_GSUWGMRR0_GLS0_ISA942_IU1_K1_LBSPPA512_LBSPPB256_LBSPPM0_LPA32_LPB16_LPM0_LRVW8_LWPMn1_MIAV0_MIWT2_1_MO40_NTn1_NTA0_NTB0_NTC0_NTD0_NTM0_NEPBS0_NLCA1_NLCB1_ONLL1_PGR2_PLR1_PKA1_SIA3_SS1_SU0_SUM0_SUS64_SPO0_SRVW0_SSO0_SVW2_SK3_SKXCCM8_TLDS0_ULSGRO0_USL1_UIOFGRO0_USFGRO0_VSn1_VWA2_VWB1_WSGRA0_WSGRB0_WS64_WG32_8_1_WGM1_WGMXCC1_WGMXCCGn1
    SolutionIndex: 38
    SolutionNameMin: Cijk_Ailk_Bjlk_I8II_BH_UserArgs_MT64x32x64_MI16x16x1_SN_LDSB0_AFC0_AFEM1_AFEM1_ASEM1_CLR1_CADS0_DTVA0_DTVB0_EPS0_FDSI0_GRPM1_GRVWA8_GRVWB4_GSU0_GSUAMB_GSUC0_GSUWGMRR0_GLS0_ISA942_IU1_K1_LBSPPA512_LBSPPB256_LBSPPM0_LPA32_LPB16_LPM0_LRVW8_LWPMn1_MIAV0_MIWT2_1_MO40_NTn1_NTA0_NTB0_NTC0_NTD0_NTM0_NEPBS0_NLCA1_NLCB1_ONLL1_PGR2_PLR1_PKA1_SIA3_SS1_SU0_SUM0_SUS64_SPO0_SRVW0_SSO0_SVW2_SK3_SKXCCM8_TLDS0_ULSGRO0_USL1_UIOFGRO0_USFGRO0_VSn1_VWA2_VWB1_WSGRA0_WSGRB0_WS64_WG32_8_1_WGM1_WGMXCC1_WGMXCCGn1
    SolutionIndex: 39
    SolutionNameMin: Cijk_Ailk_Bjlk_I8II_BH_UserArgs_MT32x32x64_MI16x16x1_SN_LDSB0_AFC0_AFEM1_AFEM1_ASEM1_CLR1_CADS0_DTVA0_DTVB0_EPS0_FDSI0_GRPM1_GRVWA4_GRVWB4_GSU0_GSUAMB_GSUC0_GSUWGMRR0_GLS0_ISA942_IU1_K1_LBSPPA256_LBSPPB256_LBSPPM0_LPA16_LPB16_LPM0_LRVW8_LWPMn1_MIAV0_MIWT1_1_MO40_NTn1_NTA0_NTB0_NTC0_NTD0_NTM0_NEPBS0_NLCA1_NLCB1_ONLL1_PGR2_PLR1_PKA1_SIA3_SS1_SU0_SUM0_SUS64_SPO0_SRVW0_SSO0_SVW1_SK3_SKXCCM8_TLDS0_ULSGRO0_USL1_UIOFGRO0_USFGRO0_VSn1_VWA1_VWB1_WSGRA0_WSGRB0_WS64_WG32_8_1_WGM1_WGMXCC1_WGMXCCGn1
    SolutionIndex: 40
    SolutionNameMin: Cijk_Ailk_Bjlk_I8II_BH_UserArgs_MT32x32x64_MI16x16x1_SN_LDSB0_AFC0_AFEM1_AFEM1_ASEM1_CLR1_CADS0_DTVA0_DTVB0_EPS0_FDSI0_GRPM1_GRVWA8_GRVWB4_GSU0_GSUAMB_GSUC0_GSUWGMRR0_GLS0_ISA942_IU1_K1_LBSPPA256_LBSPPB256_LBSPPM0_LPA16_LPB16_LPM0_LRVW8_LWPMn1_MIAV0_MIWT1_1_MO40_NTn1_NTA0_NTB0_NTC0_NTD0_NTM0_NEPBS0_NLCA1_NLCB1_ONLL1_PGR2_PLR1_PKA1_SIA3_SS1_SU0_SUM0_SUS64_SPO0_SRVW0_SSO0_SVW1_SK3_SKXCCM8_TLDS0_ULSGRO0_USL1_UIOFGRO0_USFGRO0_VSn1_VWA1_VWB1_WSGRA0_WSGRB0_WS64_WG32_8_1_WGM1_WGMXCC1_WGMXCCGn1
    SolutionIndex: 41
    SolutionNameMin: Cijk_Ailk_Bjlk_I8II_BH_UserArgs_MT32x32x64_MI16x16x1_SN_LDSB0_AFC0_AFEM1_AFEM1_ASEM1_CLR1_CADS0_DTVA0_DTVB0_EPS0_FDSI0_GRPM1_GRVWA4_GRVWB8_GSU0_GSUAMB_GSUC0_GSUWGMRR0_GLS0_ISA942_IU1_K1_LBSPPA256_LBSPPB256_LBSPPM0_LPA16_LPB16_LPM0_LRVW8_LWPMn1_MIAV0_MIWT1_1_MO40_NTn1_NTA0_NTB0_NTC0_NTD0_NTM0_NEPBS0_NLCA1_NLCB1_ONLL1_PGR2_PLR1_PKA1_SIA3_SS1_SU0_SUM0_SUS64_SPO0_SRVW0_SSO0_SVW1_SK3_SKXCCM8_TLDS0_ULSGRO0_USL1_UIOFGRO0_USFGRO0_VSn1_VWA1_VWB1_WSGRA0_WSGRB0_WS64_WG32_8_1_WGM1_WGMXCC1_WGMXCCGn1
    SolutionIndex: 42
    SolutionNameMin: Cijk_Ailk_Bjlk_I8II_BH_UserArgs_MT32x32x64_MI16x16x1_SN_LDSB0_AFC0_AFEM1_AFEM1_ASEM1_CLR0_CADS0_DTVA0_DTVB0_EPS0_FDSI0_GRPM1_GRVWA4_GRVWB4_GSU0_GSUAMB_GSUC0_GSUWGMRR0_GLS0_ISA942_IU1_K1_LBSPPA256_LBSPPB256_LBSPPM0_LPA16_LPB16_LPM0_LRVW8_LWPMn1_MIAV0_MIWT1_1_MO40_NTn1_NTA0_NTB0_NTC0_NTD0_NTM0_NEPBS0_NLCA1_NLCB1_ONLL1_PGR2_PLR0_PKA1_SIA3_SS1_SU0_SUM0_SUS64_SPO0_SRVW0_SSO0_SVW1_SK3_SKXCCM8_TLDS0_ULSGRO0_USL1_UIOFGRO0_USFGRO0_VSn1_VWA1_VWB1_WSGRA0_WSGRB0_WS64_WG32_8_1_WGM1_WGMXCC1_WGMXCCGn1
    SolutionIndex: 43
    SolutionNameMin: Cijk_Ailk_Bjlk_I8II_BH_UserArgs_MT128x128x128_MI16x16x1_SN_LDSB1_AFC0_AFEM1_AFEM1_ASEM1_CLR1_CADS0_DTVA0_DTVB0_EPS0_FDSI0_GRPM1_GRVWA4_GRVWB4_GSU0_GSUAMB_GSUC0_GSUWGMRR0_GLS0_ISA942_IU1_K1_LBSPPA1024_LBSPPB1024_LBSPPM0_LPA64_LPB64_LPM0_LRVW8_LWPMn1_MIAV0_MIWT4_4_MO40_NTn1_NTA0_NTB0_NTC0_NTD0_NTM0_NEPBS0_NLCA1_NLCB1_ONLL1_PGR2_PLR2_PKA1_SIA3_SS1_SU0_SUM0_SUS128_SPO0_SRVW0_SSO0_SVW4_SK3_SKXCCM8_TLDS0_ULSGRO0_USL1_UIOFGRO0_USFGRO0_VSn1_VWA4_VWB4_WSGRA0_WSGRB0_WS64_WG32_8_1_WGM1_WGMXCC1_WGMXCCGn1
    SolutionIndex: 44
    SolutionNameMin: Cijk_Ailk_Bjlk_I8II_BH_UserArgs_MT128x64x128_MI16x16x1_SN_LDSB1_AFC0_AFEM1_AFEM1_ASEM1_CLR1_CADS0_DTVA0_DTVB0_EPS0_FDSI0_GRPM1_GRVWA4_GRVWB8_GSU0_GSUAMB_GSUC0_GSUWGMRR0_GLS0_ISA942_IU1_K1_LBSPPA1024_LBSPPB512_LBSPPM0_LPA64_LPB32_LPM0_LRVW8_LWPMn1_MIAV0_MIWT4_2_MO40_NTn1_NTA0_NTB0_NTC0_NTD0_NTM0_NEPBS0_NLCA1_NLCB1_ONLL1_PGR2_PLR2_PKA1_SIA3_SS1_SU0_SUM0_SUS128_SPO0_SRVW0_SSO0_SVW4_SK3_SKXCCM8_TLDS0_ULSGRO0_USL1_UIOFGRO0_USFGRO0_VSn1_VWA4_VWB2_WSGRA0_WSGRB0_WS64_WG32_8_1_WGM1_WGMXCC1_WGMXCCGn1
    SolutionIndex: 45
    SolutionNameMin: Cijk_Ailk_Bjlk_I8II_BH_UserArgs_MT64x64x128_MI16x16x1_SN_LDSB1_AFC0_AFEM1_AFEM1_ASEM1_CLR1_CADS0_DTVA0_DTVB0_EPS0_FDSI0_GRPM1_GRVWA4_GRVWB8_GSU0_GSUAMB_GSUC0_GSUWGMRR0_GLS0_ISA942_IU1_K1_LBSPPA512_LBSPPB512_LBSPPM0_LPA32_LPB32_LPM0_LRVW8_LWPMn1_MIAV0_MIWT2_2_MO40_NTn1_NTA0_NTB0_NTC0_NTD0_NTM0_NEPBS0_NLCA1_NLCB1_ONLL1_PGR2_PLR1_PKA1_SIA3_SS1_SU0_SUM0_SUS128_SPO0_SRVW0_SSO0_SVW2_SK3_SKXCCM8_TLDS0_ULSGRO0_USL1_UIOFGRO0_USFGRO0_VSn1_VWA2_VWB2_WSGRA0_WSGRB0_WS64_WG32_8_1_WGM1_WGMXCC1_WGMXCCGn1
    SolutionIndex: 46
    SolutionNameMin: Cijk_Ailk_Bjlk_I8II_BH_UserArgs_MT64x64x128_MI16x16x1_SN_LDSB1_AFC0_AFEM1_AFEM1_ASEM1_CLR1_CADS0_DTVA0_DTVB0_EPS0_FDSI0_GRPM1_GRVWA4_GRVWB8_GSU0_GSUAMB_GSUC0_GSUWGMRR0_GLS0_ISA942_IU1_K1_LBSPPA512_LBSPPB512_LBSPPM0_LPA32_LPB32_LPM0_LRVW8_LWPMn1_MIAV0_MIWT2_2_MO40_NTn1_NTA0_NTB0_NTC0_NTD0_NTM0_NEPBS0_NLCA1_NLCB1_ONLL1_PGR2_PLR2_PKA1_SIA3_SS1_SU0_SUM0_SUS128_SPO0_SRVW0_SSO0_SVW2_SK3_SKXCCM8_TLDS0_ULSGRO0_USL1_UIOFGRO0_USFGRO0_VSn1_VWA2_VWB2_WSGRA0_WSGRB0_WS64_WG32_8_1_WGM1_WGMXCC1_WGMXCCGn1
    SolutionIndex: 47
    SolutionNameMin: Cijk_Ailk_Bjlk_I8II_BH_UserArgs_MT64x64x128_MI16x16x1_SN_LDSB1_AFC0_AFEM1_AFEM1_ASEM1_CLR1_CADS0_DTVA0_DTVB0_EPS0_FDSI0_GRPM1_GRVWA4_GRVWB8_GSU0_GSUAMB_GSUC0_GSUWGMRR0_GLS0_ISA942_IU1_K1_LBSPPA512_LBSPPB512_LBSPPM0_LPA32_LPB32_LPM0_LRVW8_LWPMn1_MIAV0_MIWT2_2_MO40_NTn1_NTA0_NTB0_NTC0_NTD0_NTM0_NEPBS0_NLCA1_NLCB1_ONLL1_PGR2_PLR1_PKA1_SIA3_SS1_SU0_SUM0_SUS128_SPO0_SRVW0_SSO0_SVW2_SK3_SKXCCM8_TLDS0_ULSGRO0_USL1_UIOFGRO0_USFGRO0_VSn1_VWA2_VWB2_WSGRA0_WSGRB0_WS64_WG32_8_1_WGM8_WGMXCC1_WGMXCCGn1
    SolutionIndex: 48
    SolutionNameMin: Cijk_Ailk_Bjlk_I8II_BH_UserArgs_MT32x64x128_MI16x16x1_SN_LDSB0_AFC0_AFEM1_AFEM1_ASEM1_CLR1_CADS0_DTVA0_DTVB0_EPS0_FDSI0_GRPM1_GRVWA4_GRVWB8_GSU0_GSUAMB_GSUC0_GSUWGMRR0_GLS0_ISA942_IU1_K1_LBSPPA256_LBSPPB512_LBSPPM0_LPA16_LPB32_LPM0_LRVW8_LWPMn1_MIAV0_MIWT1_2_MO40_NTn1_NTA0_NTB0_NTC0_NTD0_NTM0_NEPBS0_NLCA1_NLCB1_ONLL1_PGR2_PLR1_PKA1_SIA3_SS1_SU0_SUM0_SUS128_SPO0_SRVW0_SSO0_SVW1_SK3_SKXCCM8_TLDS0_ULSGRO0_USL1_UIOFGRO0_USFGRO0_VSn1_VWA1_VWB2_WSGRA0_WSGRB0_WS64_WG32_8_1_WGM1_WGMXCC1_WGMXCCGn1
    SolutionIndex: 49
    SolutionNameMin: Cijk_Ailk_Bjlk_I8II_BH_UserArgs_MT32x64x128_MI16x16x1_SN_LDSB0_AFC0_AFEM1_AFEM1_ASEM1_CLR1_CADS0_DTVA0_DTVB0_EPS0_FDSI0_GRPM1_GRVWA4_GRVWB8_GSU0_GSUAMB_GSUC0_GSUWGMRR0_GLS0_ISA942_IU1_K1_LBSPPA256_LBSPPB512_LBSPPM0_LPA16_LPB32_LPM0_LRVW8_LWPMn1_MIAV0_MIWT1_2_MO40_NTn1_NTA0_NTB0_NTC0_NTD0_NTM0_NEPBS0_NLCA1_NLCB1_ONLL1_PGR2_PLR2_PKA1_SIA3_SS1_SU0_SUM0_SUS128_SPO0_SRVW0_SSO0_SVW1_SK3_SKXCCM8_TLDS0_ULSGRO0_USL1_UIOFGRO0_USFGRO0_VSn1_VWA1_VWB2_WSGRA0_WSGRB0_WS64_WG32_8_1_WGM1_WGMXCC1_WGMXCCGn1
    SolutionIndex: 50
    SolutionNameMin: Cijk_Ailk_Bjlk_I8II_BH_UserArgs_MT32x64x128_MI16x16x1_SN_LDSB0_AFC0_AFEM1_AFEM1_ASEM1_CLR1_CADS0_DTVA0_DTVB0_EPS0_FDSI0_GRPM1_GRVWA4_GRVWB8_GSU0_GSUAMB_GSUC0_GSUWGMRR0_GLS0_ISA942_IU1_K1_LBSPPA256_LBSPPB512_LBSPPM0_LPA16_LPB32_LPM0_LRVW8_LWPMn1_MIAV0_MIWT1_2_MO40_NTn1_NTA0_NTB0_NTC0_NTD0_NTM0_NEPBS0_NLCA1_NLCB1_ONLL1_PGR2_PLR2_PKA1_SIA3_SS1_SU0_SUM0_SUS128_SPO0_SRVW0_SSO0_SVW1_SK3_SKXCCM8_TLDS0_ULSGRO0_USL1_UIOFGRO0_USFGRO0_VSn1_VWA1_VWB2_WSGRA0_WSGRB0_WS64_WG32_8_1_WGM8_WGMXCC1_WGMXCCGn1
    SolutionIndex: 51
    SolutionNameMin: Cijk_Ailk_Bjlk_I8II_BH_UserArgs_MT64x32x128_MI16x16x1_SN_LDSB0_AFC0_AFEM1_AFEM1_ASEM1_CLR1_CADS0_DTVA0_DTVB0_EPS0_FDSI0_GRPM1_GRVWA8_GRVWB8_GSU0_GSUAMB_GSUC0_GSUWGMRR0_GLS0_ISA942_IU1_K1_LBSPPA512_LBSPPB256_LBSPPM0_LPA32_LPB16_LPM0_LRVW8_LWPMn1_MIAV0_MIWT2_1_MO40_NTn1_NTA0_NTB0_NTC0_NTD0_NTM0_NEPBS0_NLCA1_NLCB1_ONLL1_PGR2_PLR1_PKA1_SIA3_SS1_SU0_SUM0_SUS128_SPO0_SRVW0_SSO0_SVW2_SK3_SKXCCM8_TLDS0_ULSGRO0_USL1_UIOFGRO0_USFGRO0_VSn1_VWA2_VWB1_WSGRA0_WSGRB0_WS64_WG32_8_1_WGM1_WGMXCC1_WGMXCCGn1
    SolutionIndex: 52
    SolutionNameMin: Cijk_Ailk_Bjlk_I8II_BH_UserArgs_MT64x32x128_MI16x16x1_SN_LDSB0_AFC0_AFEM1_AFEM1_ASEM1_CLR1_CADS0_DTVA0_DTVB0_EPS0_FDSI0_GRPM1_GRVWA4_GRVWB8_GSU0_GSUAMB_GSUC0_GSUWGMRR0_GLS0_ISA942_IU1_K1_LBSPPA512_LBSPPB256_LBSPPM0_LPA32_LPB16_LPM0_LRVW8_LWPMn1_MIAV0_MIWT2_1_MO40_NTn1_NTA0_NTB0_NTC0_NTD0_NTM0_NEPBS0_NLCA1_NLCB1_ONLL1_PGR2_PLR2_PKA1_SIA3_SS1_SU0_SUM0_SUS128_SPO0_SRVW0_SSO0_SVW2_SK3_SKXCCM8_TLDS0_ULSGRO0_USL1_UIOFGRO0_USFGRO0_VSn1_VWA2_VWB1_WSGRA0_WSGRB0_WS64_WG32_8_1_WGM1_WGMXCC1_WGMXCCGn1
    SolutionIndex: 53
    SolutionNameMin: Cijk_Ailk_Bjlk_I8II_BH_UserArgs_MT64x32x128_MI16x16x1_SN_LDSB0_AFC0_AFEM1_AFEM1_ASEM1_CLR1_CADS0_DTVA0_DTVB0_EPS0_FDSI0_GRPM1_GRVWA8_GRVWB8_GSU0_GSUAMB_GSUC0_GSUWGMRR0_GLS0_ISA942_IU1_K1_LBSPPA512_LBSPPB256_LBSPPM0_LPA32_LPB16_LPM0_LRVW8_LWPMn1_MIAV0_MIWT2_1_MO40_NTn1_NTA0_NTB0_NTC0_NTD0_NTM0_NEPBS0_NLCA1_NLCB1_ONLL1_PGR2_PLR1_PKA1_SIA3_SS1_SU0_SUM0_SUS128_SPO0_SRVW0_SSO0_SVW2_SK3_SKXCCM8_TLDS0_ULSGRO0_USL1_UIOFGRO0_USFGRO0_VSn1_VWA2_VWB1_WSGRA0_WSGRB0_WS64_WG32_8_1_WGM8_WGMXCC1_WGMXCCGn1
    SolutionIndex: 54
    SolutionNameMin: Cijk_Ailk_Bjlk_I8II_BH_UserArgs_MT32x32x128_MI16x16x1_SN_LDSB0_AFC0_AFEM1_AFEM1_ASEM1_CLR1_CADS0_DTVA0_DTVB0_EPS0_FDSI0_GRPM1_GRVWA4_GRVWB8_GSU0_GSUAMB_GSUC0_GSUWGMRR0_GLS0_ISA942_IU1_K1_LBSPPA256_LBSPPB256_LBSPPM0_LPA16_LPB16_LPM0_LRVW8_LWPMn1_MIAV0_MIWT1_1_MO40_NTn1_NTA0_NTB0_NTC0_NTD0_NTM0_NEPBS0_NLCA1_NLCB1_ONLL1_PGR2_PLR1_PKA1_SIA3_SS1_SU0_SUM0_SUS128_SPO0_SRVW0_SSO0_SVW1_SK3_SKXCCM8_TLDS0_ULSGRO0_USL1_UIOFGRO0_USFGRO0_VSn1_VWA1_VWB1_WSGRA0_WSGRB0_WS64_WG32_8_1_WGM1_WGMXCC1_WGMXCCGn1
    SolutionIndex: 55
    SolutionNameMin: Cijk_Ailk_Bjlk_I8II_BH_UserArgs_MT32x32x128_MI16x16x1_SN_LDSB0_AFC0_AFEM1_AFEM1_ASEM1_CLR1_CADS0_DTVA0_DTVB0_EPS0_FDSI0_GRPM1_GRVWA8_GRVWB8_GSU0_GSUAMB_GSUC0_GSUWGMRR0_GLS0_ISA942_IU1_K1_LBSPPA256_LBSPPB256_LBSPPM0_LPA16_LPB16_LPM0_LRVW8_LWPMn1_MIAV0_MIWT1_1_MO40_NTn1_NTA0_NTB0_NTC0_NTD0_NTM0_NEPBS0_NLCA1_NLCB1_ONLL1_PGR2_PLR1_PKA1_SIA3_SS1_SU0_SUM0_SUS128_SPO0_SRVW0_SSO0_SVW1_SK3_SKXCCM8_TLDS0_ULSGRO0_USL1_UIOFGRO0_USFGRO0_VSn1_VWA1_VWB1_WSGRA0_WSGRB0_WS64_WG32_8_1_WGM1_WGMXCC1_WGMXCCGn1
    SolutionIndex: 56
    SolutionNameMin: Cijk_Ailk_Bjlk_I8II_BH_UserArgs_MT32x32x128_MI16x16x1_SN_LDSB0_AFC0_AFEM1_AFEM1_ASEM1_CLR1_CADS0_DTVA0_DTVB0_EPS0_FDSI0_GRPM1_GRVWA8_GRVWB8_GSU0_GSUAMB_GSUC0_GSUWGMRR0_GLS0_ISA942_IU1_K1_LBSPPA256_LBSPPB256_LBSPPM0_LPA16_LPB16_LPM0_LRVW8_LWPMn1_MIAV0_MIWT1_1_MO40_NTn1_NTA0_NTB0_NTC0_NTD0_NTM0_NEPBS0_NLCA1_NLCB1_ONLL1_PGR2_PLR2_PKA1_SIA3_SS1_SU0_SUM0_SUS128_SPO0_SRVW0_SSO0_SVW1_SK3_SKXCCM8_TLDS0_ULSGRO0_USL1_UIOFGRO0_USFGRO0_VSn1_VWA1_VWB1_WSGRA0_WSGRB0_WS64_WG32_8_1_WGM1_WGMXCC1_WGMXCCGn1
    SolutionIndex: 57
    SolutionNameMin: Cijk_Ailk_Bjlk_I8II_BH_UserArgs_MT32x32x128_MI16x16x1_SN_LDSB0_AFC0_AFEM1_AFEM1_ASEM1_CLR1_CADS0_DTVA0_DTVB0_EPS0_FDSI0_GRPM1_GRVWA8_GRVWB8_GSU0_GSUAMB_GSUC0_GSUWGMRR0_GLS0_ISA942_IU1_K1_LBSPPA256_LBSPPB256_LBSPPM0_LPA16_LPB16_LPM0_LRVW8_LWPMn1_MIAV0_MIWT1_1_MO40_NTn1_NTA0_NTB0_NTC0_NTD0_NTM0_NEPBS0_NLCA1_NLCB1_ONLL1_PGR2_PLR1_PKA1_SIA3_SS1_SU0_SUM0_SUS128_SPO0_SRVW0_SSO0_SVW1_SK3_SKXCCM8_TLDS0_ULSGRO0_USL1_UIOFGRO0_USFGRO0_VSn1_VWA1_VWB1_WSGRA0_WSGRB0_WS64_WG32_8_1_WGM4_WGMXCC1_WGMXCCGn1
    SolutionIndex: 58
    SolutionNameMin: Cijk_Ailk_Bjlk_I8II_BH_UserArgs_MT32x32x128_MI16x16x1_SN_LDSB0_AFC0_AFEM1_AFEM1_ASEM1_CLR1_CADS0_DTVA0_DTVB0_EPS0_FDSI0_GRPM1_GRVWA8_GRVWB8_GSU0_GSUAMB_GSUC0_GSUWGMRR0_GLS0_ISA942_IU1_K1_LBSPPA256_LBSPPB256_LBSPPM0_LPA16_LPB16_LPM0_LRVW8_LWPMn1_MIAV0_MIWT1_1_MO40_NTn1_NTA0_NTB0_NTC0_NTD0_NTM0_NEPBS0_NLCA1_NLCB1_ONLL1_PGR2_PLR2_PKA1_SIA3_SS1_SU0_SUM0_SUS128_SPO0_SRVW0_SSO0_SVW1_SK3_SKXCCM8_TLDS0_ULSGRO0_USL1_UIOFGRO0_USFGRO0_VSn1_VWA1_VWB1_WSGRA0_WSGRB0_WS64_WG32_8_1_WGM8_WGMXCC1_WGMXCCGn1
    SolutionIndex: 59
    SolutionNameMin: Cijk_Ailk_Bjlk_I8II_BH_UserArgs_MT128x64x256_MI16x16x1_SN_LDSB1_AFC0_AFEM1_AFEM1_ASEM1_CLR1_CADS0_DTVA0_DTVB0_EPS0_FDSI0_GRPM1_GRVWA4_GRVWB4_GSU0_GSUAMB_GSUC0_GSUWGMRR0_GLS0_ISA942_IU1_K1_LBSPPA1024_LBSPPB512_LBSPPM0_LPA64_LPB32_LPM0_LRVW8_LWPMn1_MIAV0_MIWT4_2_MO40_NTn1_NTA0_NTB0_NTC0_NTD0_NTM0_NEPBS0_NLCA1_NLCB1_ONLL1_PGR2_PLR2_PKA1_SIA3_SS1_SU0_SUM0_SUS256_SPO0_SRVW0_SSO0_SVW4_SK3_SKXCCM8_TLDS0_ULSGRO0_USL1_UIOFGRO0_USFGRO0_VSn1_VWA4_VWB2_WSGRA0_WSGRB0_WS64_WG32_8_1_WGM1_WGMXCC1_WGMXCCGn1
    SolutionIndex: 60
    SolutionNameMin: Cijk_Ailk_Bjlk_I8II_BH_UserArgs_MT64x64x256_MI16x16x1_SN_LDSB1_AFC0_AFEM1_AFEM1_ASEM1_CLR1_CADS0_DTVA0_DTVB0_EPS0_FDSI0_GRPM1_GRVWA4_GRVWB8_GSU0_GSUAMB_GSUC0_GSUWGMRR0_GLS0_ISA942_IU1_K1_LBSPPA512_LBSPPB512_LBSPPM0_LPA32_LPB32_LPM0_LRVW8_LWPMn1_MIAV0_MIWT2_2_MO40_NTn1_NTA0_NTB0_NTC0_NTD0_NTM0_NEPBS0_NLCA1_NLCB1_ONLL1_PGR2_PLR2_PKA1_SIA3_SS1_SU0_SUM0_SUS256_SPO0_SRVW0_SSO0_SVW2_SK3_SKXCCM8_TLDS0_ULSGRO0_USL1_UIOFGRO0_USFGRO0_VSn1_VWA2_VWB2_WSGRA0_WSGRB0_WS64_WG32_8_1_WGM1_WGMXCC1_WGMXCCGn1
    SolutionIndex: 61
    SolutionNameMin: Cijk_Ailk_Bjlk_I8II_BH_UserArgs_MT64x32x256_MI16x16x1_SN_LDSB1_AFC0_AFEM1_AFEM1_ASEM1_CLR1_CADS0_DTVA0_DTVB0_EPS0_FDSI0_GRPM1_GRVWA4_GRVWB8_GSU0_GSUAMB_GSUC0_GSUWGMRR0_GLS0_ISA942_IU1_K1_LBSPPA512_LBSPPB256_LBSPPM0_LPA32_LPB16_LPM0_LRVW8_LWPMn1_MIAV0_MIWT2_1_MO40_NTn1_NTA0_NTB0_NTC0_NTD0_NTM0_NEPBS0_NLCA1_NLCB1_ONLL1_PGR2_PLR2_PKA1_SIA3_SS1_SU0_SUM0_SUS256_SPO0_SRVW0_SSO0_SVW2_SK3_SKXCCM8_TLDS0_ULSGRO0_USL1_UIOFGRO0_USFGRO0_VSn1_VWA2_VWB1_WSGRA0_WSGRB0_WS64_WG32_8_1_WGM1_WGMXCC1_WGMXCCGn1
    SolutionIndex: 62
    SolutionNameMin: Cijk_Ailk_Bjlk_I8II_BH_UserArgs_MT64x32x256_MI16x16x1_SN_LDSB1_AFC0_AFEM1_AFEM1_ASEM1_CLR1_CADS0_DTVA0_DTVB0_EPS0_FDSI0_GRPM1_GRVWA4_GRVWB8_GSU0_GSUAMB_GSUC0_GSUWGMRR0_GLS0_ISA942_IU1_K1_LBSPPA512_LBSPPB256_LBSPPM0_LPA32_LPB16_LPM0_LRVW8_LWPMn1_MIAV0_MIWT2_1_MO40_NTn1_NTA0_NTB0_NTC0_NTD0_NTM0_NEPBS0_NLCA1_NLCB1_ONLL1_PGR2_PLR2_PKA1_SIA3_SS1_SU0_SUM0_SUS256_SPO0_SRVW0_SSO0_SVW2_SK3_SKXCCM8_TLDS0_ULSGRO0_USL1_UIOFGRO0_USFGRO0_VSn1_VWA2_VWB1_WSGRA0_WSGRB0_WS64_WG32_8_1_WGM4_WGMXCC1_WGMXCCGn1
    SolutionIndex: 63
    SolutionNameMin: Cijk_Ailk_Bjlk_I8II_BH_UserArgs_MT32x32x32_MI16x16x1_SN_LDSB0_AFC0_AFEM1_AFEM1_ASEM1_CLR0_CADS0_DTVA0_DTVB0_EPS0_FDSI0_GRPM1_GRVWA1_GRVWB1_GSU0_GSUAMB_GSUC0_GSUWGMRR0_GLS0_ISA942_IU1_K1_LBSPPA256_LBSPPB256_LBSPPM0_LPA16_LPB16_LPM0_LRVW8_LWPMn1_MIAV0_MIWT1_1_MO40_NTn1_NTA0_NTB0_NTC0_NTD0_NTM0_NEPBS0_NLCA1_NLCB1_ONLL1_PGR2_PLR0_PKA1_SIA3_SS1_SU32_SUM0_SUS256_SPO0_SRVW0_SSO0_SVW1_SK3_SKXCCM0_TLDS0_ULSGRO0_USL1_UIOFGRO0_USFGROn1_VSn1_VWA1_VWB1_WSGRA0_WSGRB0_WS64_WG32_8_1_WGM1_WGMXCC1_WGMXCCGn1
- - - [128, 128, 1, 128, 128, 128, 128, 128]
    - [39, 0.59]
  - - [128, 128, 1, 256, 128, 128, 128, 128]
    - [42, 1.01]
  - - [128, 128, 1, 512, 128, 128, 128, 128]
    - [54, 1.64]
  - - [128, 128, 1, 1024, 128, 128, 128, 128]
    - [55, 2.38]
  - - [128, 128, 1, 2048, 128, 128, 128, 128]
    - [55, 3.08]
  - - [128, 128, 1, 4096, 128, 128, 128, 128]
    - [55, 3.57]
  - - [128, 128, 1, 8192, 128, 128, 128, 128]
    - [8, 3.92]
  - - [128, 256, 1, 128, 128, 128, 128, 256]
    - [39, 1.22]
  - - [128, 256, 1, 256, 128, 128, 128, 256]
    - [42, 2.02]
  - - [128, 256, 1, 512, 128, 128, 128, 256]
    - [56, 3.29]
  - - [128, 256, 1, 1024, 128, 128, 128, 256]
    - [55, 4.76]
  - - [128, 256, 1, 2048, 128, 128, 128, 256]
    - [55, 6.14]
  - - [128, 256, 1, 4096, 128, 128, 128, 256]
    - [55, 7.13]
  - - [128, 256, 1, 8192, 128, 128, 128, 256]
    - [8, 7.93]
  - - [128, 512, 1, 128, 128, 128, 128, 512]
    - [41, 2.32]
  - - [128, 512, 1, 256, 128, 128, 128, 512]
    - [39, 4.03]
  - - [128, 512, 1, 512, 128, 128, 128, 512]
    - [56, 6.46]
  - - [128, 512, 1, 1024, 128, 128, 128, 512]
    - [56, 9.33]
  - - [128, 512, 1, 2048, 128, 128, 128, 512]
    - [56, 12.08]
  - - [128, 512, 1, 4096, 128, 128, 128, 512]
    - [55, 14.13]
  - - [128, 512, 1, 8192, 128, 128, 128, 512]
    - [55, 15.48]
  - - [128, 1024, 1, 128, 128, 128, 128, 1024]
    - [36, 4.24]
  - - [128, 1024, 1, 256, 128, 128, 128, 1024]
    - [36, 7.21]
  - - [128, 1024, 1, 512, 128, 128, 128, 1024]
    - [49, 11.5]
  - - [128, 1024, 1, 1024, 128, 128, 128, 1024]
    - [49, 16.45]
  - - [128, 1024, 1, 2048, 128, 128, 128, 1024]
    - [49, 20.81]
  - - [128, 1024, 1, 4096, 128, 128, 128, 1024]
    - [49, 24.06]
  - - [128, 1024, 1, 8192, 128, 128, 128, 1024]
    - [61, 25.9]
  - - [128, 2048, 1, 128, 128, 128, 128, 2048]
    - [31, 7.53]
  - - [128, 2048, 1, 256, 128, 128, 128, 2048]
    - [32, 12.57]
  - - [128, 2048, 1, 512, 128, 128, 128, 2048]
    - [46, 19.76]
  - - [128, 2048, 1, 1024, 128, 128, 128, 2048]
    - [45, 28.14]
  - - [128, 2048, 1, 2048, 128, 128, 128, 2048]
    - [45, 35.08]
  - - [128, 2048, 1, 4096, 128, 128, 128, 2048]
    - [45, 40.7]
  - - [128, 2048, 1, 8192, 128, 128, 128, 2048]
    - [45, 44.11]
  - - [128, 4096, 1, 128, 128, 128, 128, 4096]
    - [28, 12.51]
  - - [128, 4096, 1, 256, 128, 128, 128, 4096]
    - [29, 21.18]
  - - [128, 4096, 1, 512, 128, 128, 128, 4096]
    - [44, 32.6]
  - - [128, 4096, 1, 1024, 128, 128, 128, 4096]
    - [44, 44.38]
  - - [128, 4096, 1, 2048, 128, 128, 128, 4096]
    - [44, 55.84]
  - - [128, 4096, 1, 4096, 128, 128, 128, 4096]
    - [44, 64.24]
  - - [128, 4096, 1, 8192, 128, 128, 128, 4096]
    - [44, 69.47]
  - - [128, 8192, 1, 128, 128, 128, 128, 8192]
    - [23, 19.15]
  - - [128, 8192, 1, 256, 128, 128, 128, 8192]
    - [25, 32.32]
  - - [128, 8192, 1, 512, 128, 128, 128, 8192]
    - [25, 48.94]
  - - [128, 8192, 1, 1024, 128, 128, 128, 8192]
    - [25, 66.19]
  - - [128, 8192, 1, 2048, 128, 128, 128, 8192]
    - [25, 80.45]
  - - [128, 8192, 1, 4096, 128, 128, 128, 8192]
    - [25, 89.93]
  - - [128, 8192, 1, 8192, 128, 128, 128, 8192]
    - [25, 94.5]
  - - [256, 128, 1, 128, 256, 256, 256, 128]
    - [39, 1.18]
  - - [256, 128, 1, 256, 256, 256, 256, 128]
    - [42, 2.03]
  - - [256, 128, 1, 512, 256, 256, 256, 128]
    - [55, 3.29]
  - - [256, 128, 1, 1024, 256, 256, 256, 128]
    - [56, 4.81]
  - - [256, 128, 1, 2048, 256, 256, 256, 128]
    - [55, 6.13]
  - - [256, 128, 1, 4096, 256, 256, 256, 128]
    - [55, 7.14]
  - - [256, 128, 1, 8192, 256, 256, 256, 128]
    - [8, 7.93]
  - - [256, 256, 1, 128, 256, 256, 256, 256]
    - [42, 2.31]
  - - [256, 256, 1, 256, 256, 256, 256, 256]
    - [40, 4.02]
  - - [256, 256, 1, 512, 256, 256, 256, 256]
    - [55, 6.51]
  - - [256, 256, 1, 1024, 256, 256, 256, 256]
    - [56, 9.4]
  - - [256, 256, 1, 2048, 256, 256, 256, 256]
    - [55, 12.14]
  - - [256, 256, 1, 4096, 256, 256, 256, 256]
    - [56, 14.18]
  - - [256, 256, 1, 8192, 256, 256, 256, 256]
    - [57, 15.39]
  - - [256, 512, 1, 128, 256, 256, 256, 512]
    - [38, 4.26]
  - - [256, 512, 1, 256, 256, 256, 256, 512]
    - [37, 7.26]
  - - [256, 512, 1, 512, 256, 256, 256, 512]
    - [52, 11.47]
  - - [256, 512, 1, 1024, 256, 256, 256, 512]
    - [48, 16.27]
  - - [256, 512, 1, 2048, 256, 256, 256, 512]
    - [49, 20.85]
  - - [256, 512, 1, 4096, 256, 256, 256, 512]
    - [49, 24.05]
  - - [256, 512, 1, 8192, 256, 256, 256, 512]
    - [62, 25.96]
  - - [256, 1024, 1, 128, 256, 256, 256, 1024]
    - [33, 7.57]
  - - [256, 1024, 1, 256, 256, 256, 256, 1024]
    - [34, 12.85]
  - - [256, 1024, 1, 512, 256, 256, 256, 1024]
    - [45, 20.0]
  - - [256, 1024, 1, 1024, 256, 256, 256, 1024]
    - [45, 28.31]
  - - [256, 1024, 1, 2048, 256, 256, 256, 1024]
    - [45, 35.75]
  - - [256, 1024, 1, 4096, 256, 256, 256, 1024]
    - [60, 41.62]
  - - [256, 1024, 1, 8192, 256, 256, 256, 1024]
    - [45, 44.12]
  - - [256, 2048, 1, 128, 256, 256, 256, 2048]
    - [29, 12.72]
  - - [256, 2048, 1, 256, 256, 256, 256, 2048]
    - [29, 21.5]
  - - [256, 2048, 1, 512, 256, 256, 256, 2048]
    - [44, 32.9]
  - - [256, 2048, 1, 1024, 256, 256, 256, 2048]
    - [44, 45.95]
  - - [256, 2048, 1, 2048, 256, 256, 256, 2048]
    - [44, 56.3]
  - - [256, 2048, 1, 4096, 256, 256, 256, 2048]
    - [44, 64.46]
  - - [256, 2048, 1, 8192, 256, 256, 256, 2048]
    - [44, 69.49]
  - - [256, 4096, 1, 128, 256, 256, 256, 4096]
    - [24, 19.37]
  - - [256, 4096, 1, 256, 256, 256, 256, 4096]
    - [25, 32.21]
  - - [256, 4096, 1, 512, 256, 256, 256, 4096]
    - [25, 48.97]
  - - [256, 4096, 1, 1024, 256, 256, 256, 4096]
    - [25, 66.08]
  - - [256, 4096, 1, 2048, 256, 256, 256, 4096]
    - [25, 80.31]
  - - [256, 4096, 1, 4096, 256, 256, 256, 4096]
    - [43, 91.25]
  - - [256, 4096, 1, 8192, 256, 256, 256, 4096]
    - [43, 97.78]
  - - [256, 8192, 1, 128, 256, 256, 256, 8192]
    - [6, 26.48]
  - - [256, 8192, 1, 256, 256, 256, 256, 8192]
    - [17, 44.42]
  - - [256, 8192, 1, 512, 256, 256, 256, 8192]
    - [16, 67.97]
  - - [256, 8192, 1, 1024, 256, 256, 256, 8192]
    - [16, 92.42]
  - - [256, 8192, 1, 2048, 256, 256, 256, 8192]
    - [16, 112.98]
  - - [256, 8192, 1, 4096, 256, 256, 256, 8192]
    - [16, 126.96]
  - - [256, 8192, 1, 8192, 256, 256, 256, 8192]
    - [16, 135.22]
  - - [512, 128, 1, 128, 512, 512, 512, 128]
    - [39, 2.3]
  - - [512, 128, 1, 256, 512, 512, 512, 128]
    - [56, 3.98]
  - - [512, 128, 1, 512, 512, 512, 512, 128]
    - [56, 6.42]
  - - [512, 128, 1, 1024, 512, 512, 512, 128]
    - [56, 9.33]
  - - [512, 128, 1, 2048, 512, 512, 512, 128]
    - [56, 12.06]
  - - [512, 128, 1, 4096, 512, 512, 512, 128]
    - [56, 14.14]
  - - [512, 128, 1, 8192, 512, 512, 512, 128]
    - [58, 15.39]
  - - [512, 256, 1, 128, 512, 512, 512, 256]
    - [38, 4.28]
  - - [512, 256, 1, 256, 512, 512, 512, 256]
    - [37, 7.27]
  - - [512, 256, 1, 512, 512, 512, 512, 256]
    - [52, 11.49]
  - - [512, 256, 1, 1024, 512, 512, 512, 256]
    - [52, 16.39]
  - - [512, 256, 1, 2048, 512, 512, 512, 256]
    - [52, 20.78]
  - - [512, 256, 1, 4096, 512, 512, 512, 256]
    - [52, 23.99]
  - - [512, 256, 1, 8192, 512, 512, 512, 256]
    - [53, 25.65]
  - - [512, 512, 1, 128, 512, 512, 512, 512]
    - [33, 7.59]
  - - [512, 512, 1, 256, 512, 512, 512, 512]
    - [33, 12.86]
  - - [512, 512, 1, 512, 512, 512, 512, 512]
    - [46, 20.29]
  - - [512, 512, 1, 1024, 512, 512, 512, 512]
    - [45, 28.41]
  - - [512, 512, 1, 2048, 512, 512, 512, 512]
    - [45, 35.83]
  - - [512, 512, 1, 4096, 512, 512, 512, 512]
    - [45, 41.09]
  - - [512, 512, 1, 8192, 512, 512, 512, 512]
    - [35, 40.88]
  - - [512, 1024, 1, 128, 512, 512, 512, 1024]
    - [29, 12.73]
  - - [512, 1024, 1, 256, 512, 512, 512, 1024]
    - [29, 21.5]
  - - [512, 1024, 1, 512, 512, 512, 512, 1024]
    - [44, 32.97]
  - - [512, 1024, 1, 1024, 512, 512, 512, 1024]
    - [44, 45.98]
  - - [512, 1024, 1, 2048, 512, 512, 512, 1024]
    - [59, 57.21]
  - - [512, 1024, 1, 4096, 512, 512, 512, 1024]
    - [27, 62.06]
  - - [512, 1024, 1, 8192, 512, 512, 512, 1024]
    - [27, 66.42]
  - - [512, 2048, 1, 128, 512, 512, 512, 2048]
    - [25, 19.2]
  - - [512, 2048, 1, 256, 512, 512, 512, 2048]
    - [25, 32.43]
  - - [512, 2048, 1, 512, 512, 512, 512, 2048]
    - [25, 49.18]
  - - [512, 2048, 1, 1024, 512, 512, 512, 2048]
    - [25, 66.24]
  - - [512, 2048, 1, 2048, 512, 512, 512, 2048]
    - [25, 80.42]
  - - [512, 2048, 1, 4096, 512, 512, 512, 2048]
    - [25, 90.0]
  - - [512, 2048, 1, 8192, 512, 512, 512, 2048]
    - [25, 95.97]
  - - [512, 4096, 1, 128, 512, 512, 512, 4096]
    - [19, 26.71]
  - - [512, 4096, 1, 256, 512, 512, 512, 4096]
    - [19, 44.57]
  - - [512, 4096, 1, 512, 512, 512, 512, 4096]
    - [17, 68.02]
  - - [512, 4096, 1, 1024, 512, 512, 512, 4096]
    - [17, 92.43]
  - - [512, 4096, 1, 2048, 512, 512, 512, 4096]
    - [16, 112.9]
  - - [512, 4096, 1, 4096, 512, 512, 512, 4096]
    - [16, 126.97]
  - - [512, 4096, 1, 8192, 512, 512, 512, 4096]
    - [16, 135.22]
  - - [512, 8192, 1, 128, 512, 512, 512, 8192]
    - [15, 32.25]
  - - [512, 8192, 1, 256, 512, 512, 512, 8192]
    - [15, 54.63]
  - - [512, 8192, 1, 512, 512, 512, 512, 8192]
    - [15, 83.98]
  - - [512, 8192, 1, 1024, 512, 512, 512, 8192]
    - [15, 114.44]
  - - [512, 8192, 1, 2048, 512, 512, 512, 8192]
    - [15, 139.61]
  - - [512, 8192, 1, 4096, 512, 512, 512, 8192]
    - [15, 157.37]
  - - [512, 8192, 1, 8192, 512, 512, 512, 8192]
    - [15, 167.74]
  - - [1024, 128, 1, 128, 1024, 1024, 1024, 128]
    - [37, 4.29]
  - - [1024, 128, 1, 256, 1024, 1024, 1024, 128]
    - [37, 7.28]
  - - [1024, 128, 1, 512, 1024, 1024, 1024, 128]
    - [52, 11.55]
  - - [1024, 128, 1, 1024, 1024, 1024, 1024, 128]
    - [52, 16.37]
  - - [1024, 128, 1, 2048, 1024, 1024, 1024, 128]
    - [49, 20.74]
  - - [1024, 128, 1, 4096, 1024, 1024, 1024, 128]
    - [50, 23.75]
  - - [1024, 128, 1, 8192, 1024, 1024, 1024, 128]
    - [51, 25.64]
  - - [1024, 256, 1, 128, 1024, 1024, 1024, 256]
    - [31, 7.62]
  - - [1024, 256, 1, 256, 1024, 1024, 1024, 256]
    - [31, 12.71]
  - - [1024, 256, 1, 512, 1024, 1024, 1024, 256]
    - [46, 19.68]
  - - [1024, 256, 1, 1024, 1024, 1024, 1024, 256]
    - [45, 27.97]
  - - [1024, 256, 1, 2048, 1024, 1024, 1024, 256]
    - [45, 35.42]
  - - [1024, 256, 1, 4096, 1024, 1024, 1024, 256]
    - [47, 38.99]
  - - [1024, 256, 1, 8192, 1024, 1024, 1024, 256]
    - [35, 40.21]
  - - [1024, 512, 1, 128, 1024, 1024, 1024, 512]
    - [28, 12.87]
  - - [1024, 512, 1, 256, 1024, 1024, 1024, 512]
    - [29, 21.74]
  - - [1024, 512, 1, 512, 1024, 1024, 1024, 512]
    - [44, 33.47]
  - - [1024, 512, 1, 1024, 1024, 1024, 1024, 512]
    - [44, 46.15]
  - - [1024, 512, 1, 2048, 1024, 1024, 1024, 512]
    - [59, 57.29]
  - - [1024, 512, 1, 4096, 1024, 1024, 1024, 512]
    - [27, 62.07]
  - - [1024, 512, 1, 8192, 1024, 1024, 1024, 512]
    - [27, 66.47]
  - - [1024, 1024, 1, 128, 1024, 1024, 1024, 1024]
    - [24, 19.53]
  - - [1024, 1024, 1, 256, 1024, 1024, 1024, 1024]
    - [24, 32.6]
  - - [1024, 1024, 1, 512, 1024, 1024, 1024, 1024]
    - [25, 49.47]
  - - [1024, 1024, 1, 1024, 1024, 1024, 1024, 1024]
    - [25, 66.69]
  - - [1024, 1024, 1, 2048, 1024, 1024, 1024, 1024]
    - [25, 80.31]
  - - [1024, 1024, 1, 4096, 1024, 1024, 1024, 1024]
    - [25, 89.94]
  - - [1024, 1024, 1, 8192, 1024, 1024, 1024, 1024]
    - [25, 95.89]
  - - [1024, 2048, 1, 128, 1024, 1024, 1024, 2048]
    - [19, 26.99]
  - - [1024, 2048, 1, 256, 1024, 1024, 1024, 2048]
    - [19, 44.71]
  - - [1024, 2048, 1, 512, 1024, 1024, 1024, 2048]
    - [17, 67.43]
  - - [1024, 2048, 1, 1024, 1024, 1024, 1024, 2048]
    - [16, 91.88]
  - - [1024, 2048, 1, 2048, 1024, 1024, 1024, 2048]
    - [16, 112.14]
  - - [1024, 2048, 1, 4096, 1024, 1024, 1024, 2048]
    - [16, 126.35]
  - - [1024, 2048, 1, 8192, 1024, 1024, 1024, 2048]
    - [18, 135.02]
  - - [1024, 4096, 1, 128, 1024, 1024, 1024, 4096]
    - [4, 32.37]
  - - [1024, 4096, 1, 256, 1024, 1024, 1024, 4096]
    - [15, 54.15]
  - - [1024, 4096, 1, 512, 1024, 1024, 1024, 4096]
    - [15, 83.37]
  - - [1024, 4096, 1, 1024, 1024, 1024, 1024, 4096]
    - [15, 114.1]
  - - [1024, 4096, 1, 2048, 1024, 1024, 1024, 4096]
    - [14, 139.5]
  - - [1024, 4096, 1, 4096, 1024, 1024, 1024, 4096]
    - [11, 157.4]
  - - [1024, 4096, 1, 8192, 1024, 1024, 1024, 4096]
    - [11, 167.69]
  - - [1024, 8192, 1, 128, 1024, 1024, 1024, 8192]
    - [4, 35.15]
  - - [1024, 8192, 1, 256, 1024, 1024, 1024, 8192]
    - [15, 58.87]
  - - [1024, 8192, 1, 512, 1024, 1024, 1024, 8192]
    - [15, 88.72]
  - - [1024, 8192, 1, 1024, 1024, 1024, 1024, 8192]
    - [11, 119.28]
  - - [1024, 8192, 1, 2048, 1024, 1024, 1024, 8192]
    - [11, 143.53]
  - - [1024, 8192, 1, 4096, 1024, 1024, 1024, 8192]
    - [11, 159.72]
  - - [1024, 8192, 1, 8192, 1024, 1024, 1024, 8192]
    - [15, 169.0]
  - - [2048, 128, 1, 128, 2048, 2048, 2048, 128]
    - [31, 7.67]
  - - [2048, 128, 1, 256, 2048, 2048, 2048, 128]
    - [33, 12.79]
  - - [2048, 128, 1, 512, 2048, 2048, 2048, 128]
    - [46, 19.94]
  - - [2048, 128, 1, 1024, 2048, 2048, 2048, 128]
    - [45, 28.24]
  - - [2048, 128, 1, 2048, 2048, 2048, 2048, 128]
    - [34, 32.74]
  - - [2048, 128, 1, 4096, 2048, 2048, 2048, 128]
    - [34, 37.12]
  - - [2048, 128, 1, 8192, 2048, 2048, 2048, 128]
    - [7, 40.16]
  - - [2048, 256, 1, 128, 2048, 2048, 2048, 256]
    - [29, 12.85]
  - - [2048, 256, 1, 256, 2048, 2048, 2048, 256]
    - [28, 21.75]
  - - [2048, 256, 1, 512, 2048, 2048, 2048, 256]
    - [29, 33.05]
  - - [2048, 256, 1, 1024, 2048, 2048, 2048, 256]
    - [44, 46.11]
  - - [2048, 256, 1, 2048, 2048, 2048, 2048, 256]
    - [27, 54.8]
  - - [2048, 256, 1, 4096, 2048, 2048, 2048, 256]
    - [27, 62.07]
  - - [2048, 256, 1, 8192, 2048, 2048, 2048, 256]
    - [27, 66.63]
  - - [2048, 512, 1, 128, 2048, 2048, 2048, 512]
    - [24, 19.08]
  - - [2048, 512, 1, 256, 2048, 2048, 2048, 512]
    - [24, 31.84]
  - - [2048, 512, 1, 512, 2048, 2048, 2048, 512]
    - [24, 48.72]
  - - [2048, 512, 1, 1024, 2048, 2048, 2048, 512]
    - [25, 66.01]
  - - [2048, 512, 1, 2048, 2048, 2048, 2048, 512]
    - [25, 80.16]
  - - [2048, 512, 1, 4096, 2048, 2048, 2048, 512]
    - [25, 90.04]
  - - [2048, 512, 1, 8192, 2048, 2048, 2048, 512]
    - [25, 95.87]
  - - [2048, 1024, 1, 128, 2048, 2048, 2048, 1024]
    - [20, 26.74]
  - - [2048, 1024, 1, 256, 2048, 2048, 2048, 1024]
    - [20, 44.86]
  - - [2048, 1024, 1, 512, 2048, 2048, 2048, 1024]
    - [16, 67.59]
  - - [2048, 1024, 1, 1024, 2048, 2048, 2048, 1024]
    - [16, 92.12]
  - - [2048, 1024, 1, 2048, 2048, 2048, 2048, 1024]
    - [16, 112.68]
  - - [2048, 1024, 1, 4096, 2048, 2048, 2048, 1024]
    - [16, 126.72]
  - - [2048, 1024, 1, 8192, 2048, 2048, 2048, 1024]
    - [16, 135.17]
  - - [2048, 2048, 1, 128, 2048, 2048, 2048, 2048]
    - [3, 32.27]
  - - [2048, 2048, 1, 256, 2048, 2048, 2048, 2048]
    - [10, 54.42]
  - - [2048, 2048, 1, 512, 2048, 2048, 2048, 2048]
    - [10, 83.19]
  - - [2048, 2048, 1, 1024, 2048, 2048, 2048, 2048]
    - [14, 113.73]
  - - [2048, 2048, 1, 2048, 2048, 2048, 2048, 2048]
    - [14, 139.43]
  - - [2048, 2048, 1, 4096, 2048, 2048, 2048, 2048]
    - [14, 157.01]
  - - [2048, 2048, 1, 8192, 2048, 2048, 2048, 2048]
    - [11, 167.61]
  - - [2048, 4096, 1, 128, 2048, 2048, 2048, 4096]
    - [3, 35.35]
  - - [2048, 4096, 1, 256, 2048, 2048, 2048, 4096]
    - [11, 58.63]
  - - [2048, 4096, 1, 512, 2048, 2048, 2048, 4096]
    - [11, 88.42]
  - - [2048, 4096, 1, 1024, 2048, 2048, 2048, 4096]
    - [11, 118.85]
  - - [2048, 4096, 1, 2048, 2048, 2048, 2048, 4096]
    - [11, 143.12]
  - - [2048, 4096, 1, 4096, 2048, 2048, 2048, 4096]
    - [14, 159.37]
  - - [2048, 4096, 1, 8192, 2048, 2048, 2048, 4096]
    - [11, 169.1]
  - - [2048, 8192, 1, 128, 2048, 2048, 2048, 8192]
    - [2, 37.6]
  - - [2048, 8192, 1, 256, 2048, 2048, 2048, 8192]
    - [11, 62.04]
  - - [2048, 8192, 1, 512, 2048, 2048, 2048, 8192]
    - [14, 92.06]
  - - [2048, 8192, 1, 1024, 2048, 2048, 2048, 8192]
    - [11, 122.27]
  - - [2048, 8192, 1, 2048, 2048, 2048, 2048, 8192]
    - [0, 145.53]
  - - [2048, 8192, 1, 4096, 2048, 2048, 2048, 8192]
    - [11, 191.48]
  - - [2048, 8192, 1, 8192, 2048, 2048, 2048, 8192]
    - [11, 206.08]
  - - [4096, 128, 1, 128, 4096, 4096, 4096, 128]
    - [26, 12.46]
  - - [4096, 128, 1, 256, 4096, 4096, 4096, 128]
    - [30, 21.06]
  - - [4096, 128, 1, 512, 4096, 4096, 4096, 128]
    - [27, 32.7]
  - - [4096, 128, 1, 1024, 4096, 4096, 4096, 128]
    - [27, 44.2]
  - - [4096, 128, 1, 2048, 4096, 4096, 4096, 128]
    - [27, 54.6]
  - - [4096, 128, 1, 4096, 4096, 4096, 4096, 128]
    - [27, 61.91]
  - - [4096, 128, 1, 8192, 4096, 4096, 4096, 128]
    - [27, 66.46]
  - - [4096, 256, 1, 128, 4096, 4096, 4096, 256]
    - [25, 18.98]
  - - [4096, 256, 1, 256, 4096, 4096, 4096, 256]
    - [25, 32.34]
  - - [4096, 256, 1, 512, 4096, 4096, 4096, 256]
    - [25, 49.26]
  - - [4096, 256, 1, 1024, 4096, 4096, 4096, 256]
    - [25, 66.22]
  - - [4096, 256, 1, 2048, 4096, 4096, 4096, 256]
    - [25, 80.29]
  - - [4096, 256, 1, 4096, 4096, 4096, 4096, 256]
    - [25, 90.06]
  - - [4096, 256, 1, 8192, 4096, 4096, 4096, 256]
    - [25, 95.87]
  - - [4096, 512, 1, 128, 4096, 4096, 4096, 512]
    - [21, 26.33]
  - - [4096, 512, 1, 256, 4096, 4096, 4096, 512]
    - [22, 43.84]
  - - [4096, 512, 1, 512, 4096, 4096, 4096, 512]
    - [17, 67.14]
  - - [4096, 512, 1, 1024, 4096, 4096, 4096, 512]
    - [17, 91.4]
  - - [4096, 512, 1, 2048, 4096, 4096, 4096, 512]
    - [16, 112.12]
  - - [4096, 512, 1, 4096, 4096, 4096, 4096, 512]
    - [16, 126.5]
  - - [4096, 512, 1, 8192, 4096, 4096, 4096, 512]
    - [16, 135.01]
  - - [4096, 1024, 1, 128, 4096, 4096, 4096, 1024]
    - [2, 32.02]
  - - [4096, 1024, 1, 256, 4096, 4096, 4096, 1024]
    - [13, 53.48]
  - - [4096, 1024, 1, 512, 4096, 4096, 4096, 1024]
    - [11, 82.72]
  - - [4096, 1024, 1, 1024, 4096, 4096, 4096, 1024]
    - [11, 113.41]
  - - [4096, 1024, 1, 2048, 4096, 4096, 4096, 1024]
    - [11, 139.23]
  - - [4096, 1024, 1, 4096, 4096, 4096, 4096, 1024]
    - [11, 156.91]
  - - [4096, 1024, 1, 8192, 4096, 4096, 4096, 1024]
    - [11, 167.48]
  - - [4096, 2048, 1, 128, 4096, 4096, 4096, 2048]
    - [2, 35.18]
  - - [4096, 2048, 1, 256, 4096, 4096, 4096, 2048]
    - [11, 58.52]
  - - [4096, 2048, 1, 512, 4096, 4096, 4096, 2048]
    - [11, 88.41]
  - - [4096, 2048, 1, 1024, 4096, 4096, 4096, 2048]
    - [11, 118.68]
  - - [4096, 2048, 1, 2048, 4096, 4096, 4096, 2048]
    - [11, 143.2]
  - - [4096, 2048, 1, 4096, 4096, 4096, 4096, 2048]
    - [11, 159.42]
  - - [4096, 2048, 1, 8192, 4096, 4096, 4096, 2048]
    - [11, 169.12]
  - - [4096, 4096, 1, 128, 4096, 4096, 4096, 4096]
    - [2, 37.76]
  - - [4096, 4096, 1, 256, 4096, 4096, 4096, 4096]
    - [11, 62.2]
  - - [4096, 4096, 1, 512, 4096, 4096, 4096, 4096]
    - [11, 92.73]
  - - [4096, 4096, 1, 1024, 4096, 4096, 4096, 4096]
    - [11, 122.43]
  - - [4096, 4096, 1, 2048, 4096, 4096, 4096, 4096]
    - [11, 145.88]
  - - [4096, 4096, 1, 4096, 4096, 4096, 4096, 4096]
    - [11, 190.55]
  - - [4096, 4096, 1, 8192, 4096, 4096, 4096, 4096]
    - [11, 205.4]
  - - [4096, 8192, 1, 128, 4096, 4096, 4096, 8192]
    - [9, 39.12]
  - - [4096, 8192, 1, 256, 4096, 4096, 4096, 8192]
    - [10, 64.01]
  - - [4096, 8192, 1, 512, 4096, 4096, 4096, 8192]
    - [10, 94.2]
  - - [4096, 8192, 1, 1024, 4096, 4096, 4096, 8192]
    - [10, 121.4]
  - - [4096, 8192, 1, 2048, 4096, 4096, 4096, 8192]
    - [11, 160.32]
  - - [4096, 8192, 1, 4096, 4096, 4096, 4096, 8192]
    - [11, 180.82]
  - - [4096, 8192, 1, 8192, 4096, 4096, 4096, 8192]
    - [11, 197.89]
  - - [8192, 128, 1, 128, 8192, 8192, 8192, 128]
    - [24, 19.14]
  - - [8192, 128, 1, 256, 8192, 8192, 8192, 128]
    - [25, 32.18]
  - - [8192, 128, 1, 512, 8192, 8192, 8192, 128]
    - [25, 48.36]
  - - [8192, 128, 1, 1024, 8192, 8192, 8192, 128]
    - [25, 65.94]
  - - [8192, 128, 1, 2048, 8192, 8192, 8192, 128]
    - [25, 80.51]
  - - [8192, 128, 1, 4096, 8192, 8192, 8192, 128]
    - [25, 90.1]
  - - [8192, 128, 1, 8192, 8192, 8192, 8192, 128]
    - [25, 94.25]
  - - [8192, 256, 1, 128, 8192, 8192, 8192, 256]
    - [20, 26.17]
  - - [8192, 256, 1, 256, 8192, 8192, 8192, 256]
    - [17, 43.82]
  - - [8192, 256, 1, 512, 8192, 8192, 8192, 256]
    - [16, 67.55]
  - - [8192, 256, 1, 1024, 8192, 8192, 8192, 256]
    - [16, 91.66]
  - - [8192, 256, 1, 2048, 8192, 8192, 8192, 256]
    - [16, 112.14]
  - - [8192, 256, 1, 4096, 8192, 8192, 8192, 256]
    - [16, 126.42]
  - - [8192, 256, 1, 8192, 8192, 8192, 8192, 256]
    - [16, 133.59]
  - - [8192, 512, 1, 128, 8192, 8192, 8192, 512]
    - [4, 31.98]
  - - [8192, 512, 1, 256, 8192, 8192, 8192, 512]
    - [15, 53.49]
  - - [8192, 512, 1, 512, 8192, 8192, 8192, 512]
    - [14, 82.05]
  - - [8192, 512, 1, 1024, 8192, 8192, 8192, 512]
    - [14, 112.88]
  - - [8192, 512, 1, 2048, 8192, 8192, 8192, 512]
    - [15, 138.91]
  - - [8192, 512, 1, 4096, 8192, 8192, 8192, 512]
    - [14, 156.71]
  - - [8192, 512, 1, 8192, 8192, 8192, 8192, 512]
    - [15, 166.98]
  - - [8192, 1024, 1, 128, 8192, 8192, 8192, 1024]
    - [1, 34.89]
  - - [8192, 1024, 1, 256, 8192, 8192, 8192, 1024]
    - [10, 57.76]
  - - [8192, 1024, 1, 512, 8192, 8192, 8192, 1024]
    - [10, 86.82]
  - - [8192, 1024, 1, 1024, 8192, 8192, 8192, 1024]
    - [11, 116.65]
  - - [8192, 1024, 1, 2048, 8192, 8192, 8192, 1024]
    - [11, 141.72]
  - - [8192, 1024, 1, 4096, 8192, 8192, 8192, 1024]
    - [11, 158.01]
  - - [8192, 1024, 1, 8192, 8192, 8192, 8192, 1024]
    - [11, 168.15]
  - - [8192, 2048, 1, 128, 8192, 8192, 8192, 2048]
    - [1, 36.89]
  - - [8192, 2048, 1, 256, 8192, 8192, 8192, 2048]
    - [11, 60.77]
  - - [8192, 2048, 1, 512, 8192, 8192, 8192, 2048]
    - [15, 90.68]
  - - [8192, 2048, 1, 1024, 8192, 8192, 8192, 2048]
    - [15, 120.57]
  - - [8192, 2048, 1, 2048, 8192, 8192, 8192, 2048]
    - [15, 144.37]
  - - [8192, 2048, 1, 4096, 8192, 8192, 8192, 2048]
    - [11, 190.29]
  - - [8192, 2048, 1, 8192, 8192, 8192, 8192, 2048]
    - [11, 205.38]
  - - [8192, 4096, 1, 128, 8192, 8192, 8192, 4096]
    - [1, 38.46]
  - - [8192, 4096, 1, 256, 8192, 8192, 8192, 4096]
    - [12, 62.77]
  - - [8192, 4096, 1, 512, 8192, 8192, 8192, 4096]
    - [10, 92.2]
  - - [8192, 4096, 1, 1024, 8192, 8192, 8192, 4096]
    - [16, 120.68]
  - - [8192, 4096, 1, 2048, 8192, 8192, 8192, 4096]
    - [11, 160.43]
  - - [8192, 4096, 1, 4096, 8192, 8192, 8192, 4096]
    - [11, 180.77]
  - - [8192, 4096, 1, 8192, 8192, 8192, 8192, 4096]
    - [11, 197.97]
  - - [8192, 8192, 1, 128, 8192, 8192, 8192, 8192]
    - [5, 37.86]
  - - [8192, 8192, 1, 256, 8192, 8192, 8192, 8192]
    - [1, 67.75]
  - - [8192, 8192, 1, 512, 8192, 8192, 8192, 8192]
    - [11, 107.43]
  - - [8192, 8192, 1, 1024, 8192, 8192, 8192, 8192]
    - [11, 144.59]
  - - [8192, 8192, 1, 2048, 8192, 8192, 8192, 8192]
    - [11, 174.71]
  - - [8192, 8192, 1, 4096, 8192, 8192, 8192, 8192]
    - [11, 195.0]
  - - [8192, 8192, 1, 8192, 8192, 8192, 8192, 8192]
    - [11, 209.66]
  - - [1, 1, 1, 32, 1, 1, 1, 1]
    - [63, 0.0]
- null
- null
- ExperimentalStreamK
- GridBased
