projects/hipblaslt/library/src/amd_detail/rocblaslt/src/Tensile/Logic/asm_full/aquavanjaram/gfx942_80cu/StreamK/aquavanjaram942_Cijk_Ailk_Bljk_I8BH_UserArgs.yaml
- {MinimumRequiredVersion: 4.33.0}
- aquavanjaram942
- {Architecture: gfx942, CUCount: 80}
- [Device 0049, Device 0050]
    SolutionIndex: 0
    SolutionNameMin: Cijk_Ailk_Bljk_I8BH_UserArgs_MT256x256x32_MI16x16x1_SN_LDSB0_AFC0_AFEM1_AFEM1_ASEM1_CLR0_CADS0_DTVA0_DTVB0_EPS0_FDSI0_GRPM1_GRVWA4_GRVWB8_GSU0_GSUAMB_GSUC0_GSUWGMRR0_GLS0_ISA942_IU1_K1_LBSPPA2048_LBSPPB128_LBSPPM0_LPA64_LPB8_LPM0_LRVW8_LWPMn1_MIAV0_MIWT8_8_MO40_NTn1_NTA0_NTB0_NTC0_NTD0_NTM0_NEPBS0_NLCA1_NLCB1_ONLL1_PGR2_PLR0_PKA1_SIA3_SS1_SU0_SUM0_SUS32_SPO0_SRVW0_SSO0_SVW4_SK3_SKXCCM8_TLDS1_ULSGRO0_USL1_UIOFGRO0_USFGRO0_VSn1_VWA4_VWB1_WSGRA0_WSGRB0_WS64_WG32_8_1_WGM1_WGMXCC1_WGMXCCGn1
    SolutionIndex: 1
    SolutionNameMin: Cijk_Ailk_Bljk_I8BH_UserArgs_MT256x256x32_MI16x16x1_SN_LDSB0_AFC0_AFEM1_AFEM1_ASEM1_CLR0_CADS0_DTVA0_DTVB0_EPS0_FDSI0_GRPM1_GRVWA4_GRVWB8_GSU0_GSUAMB_GSUC0_GSUWGMRR0_GLS0_ISA942_IU1_K1_LBSPPA2048_LBSPPB128_LBSPPM0_LPA0_LPB8_LPM0_LRVW8_LWPMn1_MIAV0_MIWT8_8_MO40_NTn1_NTA0_NTB0_NTC0_NTD0_NTM0_NEPBS0_NLCA1_NLCB1_ONLL1_PGR2_PLR0_PKA1_SIA3_SS1_SU0_SUM0_SUS32_SPO0_SRVW0_SSO0_SVW8_SK3_SKXCCM8_TLDS1_ULSGRO0_USL1_UIOFGRO0_USFGRO0_VSn1_VWA8_VWB1_WSGRA0_WSGRB0_WS64_WG32_8_1_WGM1_WGMXCC1_WGMXCCGn1
    SolutionIndex: 2
    SolutionNameMin: Cijk_Ailk_Bljk_I8BH_UserArgs_MT256x256x32_MI16x16x1_SN_LDSB0_AFC0_AFEM1_AFEM1_ASEM1_CLR0_CADS0_DTVA0_DTVB0_EPS0_FDSI0_GRPM1_GRVWA4_GRVWB8_GSU0_GSUAMB_GSUC0_GSUWGMRR0_GLS0_ISA942_IU1_K1_LBSPPA2048_LBSPPB128_LBSPPM0_LPA64_LPB8_LPM0_LRVW8_LWPMn1_MIAV0_MIWT8_8_MO40_NTn1_NTA0_NTB0_NTC0_NTD0_NTM0_NEPBS0_NLCA1_NLCB1_ONLL1_PGR2_PLR0_PKA1_SIA3_SS1_SU0_SUM0_SUS32_SPO0_SRVW0_SSO0_SVW4_SK3_SKXCCM8_TLDS1_ULSGRO0_USL1_UIOFGRO0_USFGRO0_VSn1_VWA4_VWB4_WSGRA0_WSGRB0_WS64_WG32_8_1_WGM1_WGMXCC1_WGMXCCGn1
    SolutionIndex: 3
    SolutionNameMin: Cijk_Ailk_Bljk_I8BH_UserArgs_MT128x256x32_MI16x16x1_SN_LDSB0_AFC0_AFEM1_AFEM1_ASEM1_CLR0_CADS0_DTVA0_DTVB0_EPS0_FDSI0_GRPM1_GRVWA4_GRVWB4_GSU0_GSUAMB_GSUC0_GSUWGMRR0_GLS0_ISA942_IU1_K1_LBSPPA1024_LBSPPB128_LBSPPM0_LPA64_LPB8_LPM0_LRVW8_LWPMn1_MIAV0_MIWT4_8_MO40_NTn1_NTA0_NTB0_NTC0_NTD0_NTM0_NEPBS0_NLCA1_NLCB1_ONLL1_PGR2_PLR0_PKA1_SIA3_SS1_SU0_SUM0_SUS32_SPO0_SRVW0_SSO0_SVW4_SK3_SKXCCM8_TLDS1_ULSGRO0_USL1_UIOFGRO0_USFGRO0_VSn1_VWA4_VWB1_WSGRA0_WSGRB0_WS64_WG32_8_1_WGM1_WGMXCC1_WGMXCCGn1
    SolutionIndex: 4
    SolutionNameMin: Cijk_Ailk_Bljk_I8BH_UserArgs_MT128x256x32_MI16x16x1_SN_LDSB0_AFC0_AFEM1_AFEM1_ASEM1_CLR0_CADS0_DTVA0_DTVB0_EPS0_FDSI0_GRPM1_GRVWA4_GRVWB8_GSU0_GSUAMB_GSUC0_GSUWGMRR0_GLS0_ISA942_IU1_K1_LBSPPA1024_LBSPPB128_LBSPPM0_LPA64_LPB8_LPM0_LRVW8_LWPMn1_MIAV0_MIWT4_8_MO40_NTn1_NTA0_NTB0_NTC0_NTD0_NTM0_NEPBS0_NLCA1_NLCB1_ONLL1_PGR2_PLR0_PKA1_SIA3_SS1_SU0_SUM0_SUS32_SPO0_SRVW0_SSO0_SVW4_SK3_SKXCCM8_TLDS1_ULSGRO0_USL1_UIOFGRO0_USFGRO0_VSn1_VWA4_VWB1_WSGRA0_WSGRB0_WS64_WG32_8_1_WGM1_WGMXCC1_WGMXCCGn1
    SolutionIndex: 5
    SolutionNameMin: Cijk_Ailk_Bljk_I8BH_UserArgs_MT128x256x32_MI16x16x1_SN_LDSB0_AFC0_AFEM1_AFEM1_ASEM1_CLR0_CADS0_DTVA0_DTVB0_EPS0_FDSI0_GRPM1_GRVWA4_GRVWB8_GSU0_GSUAMB_GSUC0_GSUWGMRR0_GLS0_ISA942_IU1_K1_LBSPPA1024_LBSPPB256_LBSPPM0_LPA64_LPB8_LPM0_LRVW8_LWPMn1_MIAV0_MIWT4_8_MO40_NTn1_NTA0_NTB0_NTC0_NTD0_NTM0_NEPBS0_NLCA1_NLCB1_ONLL1_PGR2_PLR0_PKA1_SIA3_SS1_SU0_SUM0_SUS32_SPO0_SRVW0_SSO0_SVW4_SK3_SKXCCM8_TLDS1_ULSGRO0_USL1_UIOFGRO0_USFGRO0_VSn1_VWA4_VWB8_WSGRA0_WSGRB0_WS64_WG32_8_1_WGM1_WGMXCC1_WGMXCCGn1
    SolutionIndex: 6
    SolutionNameMin: Cijk_Ailk_Bljk_I8BH_UserArgs_MT256x256x64_MI16x16x1_SN_LDSB1_AFC0_AFEM1_AFEM1_ASEM1_CLR1_CADS0_DTVA0_DTVB0_EPS0_FDSI0_GRPM1_GRVWA4_GRVWB4_GSU0_GSUAMB_GSUC0_GSUWGMRR0_GLS0_ISA942_IU1_K1_LBSPPA2048_LBSPPB128_LBSPPM0_LPA64_LPB8_LPM0_LRVW8_LWPMn1_MIAV0_MIWT8_8_MO40_NTn1_NTA0_NTB0_NTC0_NTD0_NTM0_NEPBS0_NLCA1_NLCB1_ONLL1_PGR2_PLR1_PKA1_SIA3_SS1_SU0_SUM0_SUS64_SPO0_SRVW0_SSO0_SVW4_SK3_SKXCCM8_TLDS1_ULSGRO0_USL1_UIOFGRO0_USFGRO0_VSn1_VWA4_VWB1_WSGRA0_WSGRB0_WS64_WG32_8_1_WGM1_WGMXCC1_WGMXCCGn1
    SolutionIndex: 7
    SolutionNameMin: Cijk_Ailk_Bljk_I8BH_UserArgs_MT256x256x64_MI16x16x1_SN_LDSB1_AFC0_AFEM1_AFEM1_ASEM1_CLR1_CADS0_DTVA0_DTVB0_EPS0_FDSI0_GRPM1_GRVWA4_GRVWB4_GSU0_GSUAMB_GSUC0_GSUWGMRR0_GLS0_ISA942_IU1_K1_LBSPPA2048_LBSPPB128_LBSPPM0_LPA0_LPB8_LPM0_LRVW8_LWPMn1_MIAV0_MIWT8_8_MO40_NTn1_NTA0_NTB0_NTC0_NTD0_NTM0_NEPBS0_NLCA1_NLCB1_ONLL1_PGR2_PLR1_PKA1_SIA3_SS1_SU0_SUM0_SUS64_SPO0_SRVW0_SSO0_SVW8_SK3_SKXCCM8_TLDS1_ULSGRO0_USL1_UIOFGRO0_USFGRO0_VSn1_VWA8_VWB1_WSGRA0_WSGRB0_WS64_WG32_8_1_WGM1_WGMXCC1_WGMXCCGn1
    SolutionIndex: 8
    SolutionNameMin: Cijk_Ailk_Bljk_I8BH_UserArgs_MT256x256x64_MI16x16x1_SN_LDSB1_AFC0_AFEM1_AFEM1_ASEM1_CLR1_CADS0_DTVA0_DTVB0_EPS0_FDSI0_GRPM1_GRVWA4_GRVWB4_GSU0_GSUAMB_GSUC0_GSUWGMRR0_GLS0_ISA942_IU1_K1_LBSPPA2048_LBSPPB128_LBSPPM0_LPA64_LPB8_LPM0_LRVW8_LWPMn1_MIAV0_MIWT8_8_MO40_NTn1_NTA0_NTB0_NTC0_NTD0_NTM0_NEPBS0_NLCA1_NLCB1_ONLL1_PGR2_PLR1_PKA1_SIA3_SS1_SU0_SUM0_SUS64_SPO0_SRVW0_SSO0_SVW4_SK3_SKXCCM8_TLDS1_ULSGRO0_USL1_UIOFGRO0_USFGRO0_VSn1_VWA4_VWB2_WSGRA0_WSGRB0_WS64_WG32_8_1_WGM1_WGMXCC1_WGMXCCGn1
    SolutionIndex: 9
    SolutionNameMin: Cijk_Ailk_Bljk_I8BH_UserArgs_MT256x256x64_MI16x16x1_SN_LDSB1_AFC0_AFEM1_AFEM1_ASEM1_CLR1_CADS0_DTVA0_DTVB0_EPS0_FDSI0_GRPM1_GRVWA4_GRVWB4_GSU0_GSUAMB_GSUC0_GSUWGMRR0_GLS0_ISA942_IU1_K1_LBSPPA2048_LBSPPB512_LBSPPM0_LPA64_LPB8_LPM0_LRVW8_LWPMn1_MIAV0_MIWT8_8_MO40_NTn1_NTA0_NTB0_NTC0_NTD0_NTM0_NEPBS0_NLCA1_NLCB1_ONLL1_PGR2_PLR1_PKA1_SIA3_SS1_SU0_SUM0_SUS64_SPO0_SRVW0_SSO0_SVW4_SK3_SKXCCM8_TLDS1_ULSGRO0_USL1_UIOFGRO0_USFGRO0_VSn1_VWA4_VWB8_WSGRA0_WSGRB0_WS64_WG32_8_1_WGM1_WGMXCC1_WGMXCCGn1
    SolutionIndex: 10
    SolutionNameMin: Cijk_Ailk_Bljk_I8BH_UserArgs_MT256x256x64_MI16x16x1_SN_LDSB1_AFC0_AFEM1_AFEM1_ASEM1_CLR1_CADS0_DTVA0_DTVB0_EPS0_FDSI0_GRPM1_GRVWA4_GRVWB8_GSU0_GSUAMB_GSUC0_GSUWGMRR0_GLS0_ISA942_IU1_K1_LBSPPA2048_LBSPPB128_LBSPPM0_LPA64_LPB8_LPM0_LRVW8_LWPMn1_MIAV0_MIWT8_8_MO40_NTn1_NTA0_NTB0_NTC0_NTD0_NTM0_NEPBS0_NLCA1_NLCB1_ONLL1_PGR2_PLR1_PKA1_SIA3_SS1_SU0_SUM0_SUS64_SPO0_SRVW0_SSO0_SVW4_SK3_SKXCCM8_TLDS1_ULSGRO0_USL1_UIOFGRO0_USFGRO0_VSn1_VWA4_VWB1_WSGRA0_WSGRB0_WS64_WG32_8_1_WGM1_WGMXCC1_WGMXCCGn1
    SolutionIndex: 11
    SolutionNameMin: Cijk_Ailk_Bljk_I8BH_UserArgs_MT128x256x64_MI16x16x1_SN_LDSB1_AFC0_AFEM1_AFEM1_ASEM1_CLR1_CADS0_DTVA0_DTVB0_EPS0_FDSI0_GRPM1_GRVWA4_GRVWB8_GSU0_GSUAMB_GSUC0_GSUWGMRR0_GLS0_ISA942_IU1_K1_LBSPPA1024_LBSPPB128_LBSPPM0_LPA64_LPB8_LPM0_LRVW8_LWPMn1_MIAV0_MIWT4_8_MO40_NTn1_NTA0_NTB0_NTC0_NTD0_NTM0_NEPBS0_NLCA1_NLCB1_ONLL1_PGR2_PLR1_PKA1_SIA3_SS1_SU0_SUM0_SUS64_SPO0_SRVW0_SSO0_SVW4_SK3_SKXCCM8_TLDS1_ULSGRO0_USL1_UIOFGRO0_USFGRO0_VSn1_VWA4_VWB1_WSGRA0_WSGRB0_WS64_WG32_8_1_WGM1_WGMXCC1_WGMXCCGn1
    SolutionIndex: 12
    SolutionNameMin: Cijk_Ailk_Bljk_I8BH_UserArgs_MT128x256x64_MI16x16x1_SN_LDSB1_AFC0_AFEM1_AFEM1_ASEM1_CLR1_CADS0_DTVA0_DTVB0_EPS0_FDSI0_GRPM1_GRVWA4_GRVWB8_GSU0_GSUAMB_GSUC0_GSUWGMRR0_GLS0_ISA942_IU1_K1_LBSPPA1024_LBSPPB128_LBSPPM0_LPA64_LPB8_LPM0_LRVW8_LWPMn1_MIAV0_MIWT4_8_MO40_NTn1_NTA0_NTB0_NTC0_NTD0_NTM0_NEPBS0_NLCA1_NLCB1_ONLL1_PGR2_PLR1_PKA1_SIA3_SS1_SU0_SUM0_SUS64_SPO0_SRVW0_SSO0_SVW4_SK3_SKXCCM8_TLDS1_ULSGRO0_USL1_UIOFGRO0_USFGRO0_VSn1_VWA4_VWB2_WSGRA0_WSGRB0_WS64_WG32_8_1_WGM1_WGMXCC1_WGMXCCGn1
    SolutionIndex: 13
    SolutionNameMin: Cijk_Ailk_Bljk_I8BH_UserArgs_MT128x256x64_MI16x16x1_SN_LDSB1_AFC0_AFEM1_AFEM1_ASEM1_CLR1_CADS0_DTVA0_DTVB0_EPS0_FDSI0_GRPM1_GRVWA4_GRVWB8_GSU0_GSUAMB_GSUC0_GSUWGMRR0_GLS0_ISA942_IU1_K1_LBSPPA1024_LBSPPB512_LBSPPM0_LPA64_LPB8_LPM0_LRVW8_LWPMn1_MIAV0_MIWT4_8_MO40_NTn1_NTA0_NTB0_NTC0_NTD0_NTM0_NEPBS0_NLCA1_NLCB1_ONLL1_PGR2_PLR1_PKA1_SIA3_SS1_SU0_SUM0_SUS64_SPO0_SRVW0_SSO0_SVW4_SK3_SKXCCM8_TLDS1_ULSGRO0_USL1_UIOFGRO0_USFGRO0_VSn1_VWA4_VWB8_WSGRA0_WSGRB0_WS64_WG32_8_1_WGM1_WGMXCC1_WGMXCCGn1
    SolutionIndex: 14
    SolutionNameMin: Cijk_Ailk_Bljk_I8BH_UserArgs_MT256x128x64_MI16x16x1_SN_LDSB1_AFC0_AFEM1_AFEM1_ASEM1_CLR1_CADS0_DTVA0_DTVB0_EPS0_FDSI0_GRPM1_GRVWA4_GRVWB8_GSU0_GSUAMB_GSUC0_GSUWGMRR0_GLS0_ISA942_IU1_K1_LBSPPA2048_LBSPPB256_LBSPPM0_LPA0_LPB8_LPM0_LRVW8_LWPMn1_MIAV0_MIWT8_4_MO40_NTn1_NTA0_NTB0_NTC0_NTD0_NTM0_NEPBS0_NLCA1_NLCB1_ONLL1_PGR2_PLR1_PKA1_SIA3_SS1_SU0_SUM0_SUS64_SPO0_SRVW0_SSO0_SVW8_SK3_SKXCCM8_TLDS1_ULSGRO0_USL1_UIOFGRO0_USFGRO0_VSn1_VWA8_VWB4_WSGRA0_WSGRB0_WS64_WG32_8_1_WGM1_WGMXCC1_WGMXCCGn1
    SolutionIndex: 15
    SolutionNameMin: Cijk_Ailk_Bljk_I8BH_UserArgs_MT256x128x64_MI16x16x1_SN_LDSB1_AFC0_AFEM1_AFEM1_ASEM1_CLR1_CADS0_DTVA0_DTVB0_EPS0_FDSI0_GRPM1_GRVWA8_GRVWB8_GSU0_GSUAMB_GSUC0_GSUWGMRR0_GLS0_ISA942_IU1_K1_LBSPPA2048_LBSPPB128_LBSPPM0_LPA0_LPB8_LPM0_LRVW8_LWPMn1_MIAV0_MIWT8_4_MO40_NTn1_NTA0_NTB0_NTC0_NTD0_NTM0_NEPBS0_NLCA1_NLCB1_ONLL1_PGR2_PLR1_PKA1_SIA3_SS1_SU0_SUM0_SUS64_SPO0_SRVW0_SSO0_SVW8_SK3_SKXCCM8_TLDS1_ULSGRO0_USL1_UIOFGRO0_USFGRO0_VSn1_VWA8_VWB1_WSGRA0_WSGRB0_WS64_WG32_8_1_WGM1_WGMXCC1_WGMXCCGn1
    SolutionIndex: 16
    SolutionNameMin: Cijk_Ailk_Bljk_I8BH_UserArgs_MT128x128x64_MI16x16x1_SN_LDSB1_AFC0_AFEM1_AFEM1_ASEM1_CLR1_CADS0_DTVA0_DTVB0_EPS0_FDSI0_GRPM1_GRVWA4_GRVWB8_GSU0_GSUAMB_GSUC0_GSUWGMRR0_GLS0_ISA942_IU1_K1_LBSPPA1024_LBSPPB128_LBSPPM0_LPA64_LPB8_LPM0_LRVW8_LWPMn1_MIAV0_MIWT4_4_MO40_NTn1_NTA0_NTB0_NTC0_NTD0_NTM0_NEPBS0_NLCA1_NLCB1_ONLL1_PGR2_PLR1_PKA1_SIA3_SS1_SU0_SUM0_SUS64_SPO0_SRVW0_SSO0_SVW4_SK3_SKXCCM8_TLDS1_ULSGRO0_USL1_UIOFGRO0_USFGRO0_VSn1_VWA4_VWB1_WSGRA0_WSGRB0_WS64_WG32_8_1_WGM1_WGMXCC1_WGMXCCGn1
    SolutionIndex: 17
    SolutionNameMin: Cijk_Ailk_Bljk_I8BH_UserArgs_MT128x128x64_MI16x16x1_SN_LDSB1_AFC0_AFEM1_AFEM1_ASEM1_CLR1_CADS0_DTVA0_DTVB0_EPS0_FDSI0_GRPM1_GRVWA4_GRVWB8_GSU0_GSUAMB_GSUC0_GSUWGMRR0_GLS0_ISA942_IU1_K1_LBSPPA1024_LBSPPB128_LBSPPM0_LPA64_LPB8_LPM0_LRVW8_LWPMn1_MIAV0_MIWT4_4_MO40_NTn1_NTA0_NTB0_NTC0_NTD0_NTM0_NEPBS0_NLCA1_NLCB1_ONLL1_PGR2_PLR1_PKA1_SIA3_SS1_SU0_SUM0_SUS64_SPO0_SRVW0_SSO0_SVW4_SK3_SKXCCM8_TLDS1_ULSGRO0_USL1_UIOFGRO0_USFGRO0_VSn1_VWA4_VWB2_WSGRA0_WSGRB0_WS64_WG32_8_1_WGM1_WGMXCC1_WGMXCCGn1
    SolutionIndex: 18
    SolutionNameMin: Cijk_Ailk_Bljk_I8BH_UserArgs_MT128x128x64_MI16x16x1_SN_LDSB1_AFC0_AFEM1_AFEM1_ASEM1_CLR1_CADS0_DTVA0_DTVB0_EPS0_FDSI0_GRPM1_GRVWA4_GRVWB8_GSU0_GSUAMB_GSUC0_GSUWGMRR0_GLS0_ISA942_IU1_K1_LBSPPA1024_LBSPPB256_LBSPPM0_LPA64_LPB8_LPM0_LRVW8_LWPMn1_MIAV0_MIWT4_4_MO40_NTn1_NTA0_NTB0_NTC0_NTD0_NTM0_NEPBS0_NLCA1_NLCB1_ONLL1_PGR2_PLR1_PKA1_SIA3_SS1_SU0_SUM0_SUS64_SPO0_SRVW0_SSO0_SVW4_SK3_SKXCCM8_TLDS1_ULSGRO0_USL1_UIOFGRO0_USFGRO0_VSn1_VWA4_VWB4_WSGRA0_WSGRB0_WS64_WG32_8_1_WGM1_WGMXCC1_WGMXCCGn1
    SolutionIndex: 19
    SolutionNameMin: Cijk_Ailk_Bljk_I8BH_UserArgs_MT64x128x64_MI16x16x1_SN_LDSB0_AFC0_AFEM1_AFEM1_ASEM1_CLR1_CADS0_DTVA0_DTVB0_EPS0_FDSI0_GRPM1_GRVWA4_GRVWB4_GSU0_GSUAMB_GSUC0_GSUWGMRR0_GLS0_ISA942_IU1_K1_LBSPPA512_LBSPPB128_LBSPPM0_LPA32_LPB8_LPM0_LRVW8_LWPMn1_MIAV0_MIWT2_4_MO40_NTn1_NTA0_NTB0_NTC0_NTD0_NTM0_NEPBS0_NLCA1_NLCB1_ONLL1_PGR2_PLR1_PKA1_SIA3_SS1_SU0_SUM0_SUS64_SPO0_SRVW0_SSO0_SVW2_SK3_SKXCCM8_TLDS1_ULSGRO0_USL1_UIOFGRO0_USFGRO0_VSn1_VWA2_VWB1_WSGRA0_WSGRB0_WS64_WG32_8_1_WGM1_WGMXCC1_WGMXCCGn1
    SolutionIndex: 20
    SolutionNameMin: Cijk_Ailk_Bljk_I8BH_UserArgs_MT64x128x64_MI16x16x1_SN_LDSB0_AFC0_AFEM1_AFEM1_ASEM1_CLR1_CADS0_DTVA0_DTVB0_EPS0_FDSI0_GRPM1_GRVWA4_GRVWB4_GSU0_GSUAMB_GSUC0_GSUWGMRR0_GLS0_ISA942_IU1_K1_LBSPPA512_LBSPPB256_LBSPPM0_LPA32_LPB8_LPM0_LRVW8_LWPMn1_MIAV0_MIWT2_4_MO40_NTn1_NTA0_NTB0_NTC0_NTD0_NTM0_NEPBS0_NLCA1_NLCB1_ONLL1_PGR2_PLR1_PKA1_SIA3_SS1_SU0_SUM0_SUS64_SPO0_SRVW0_SSO0_SVW2_SK3_SKXCCM8_TLDS1_ULSGRO0_USL1_UIOFGRO0_USFGRO0_VSn1_VWA2_VWB4_WSGRA0_WSGRB0_WS64_WG32_8_1_WGM1_WGMXCC1_WGMXCCGn1
    SolutionIndex: 21
    SolutionNameMin: Cijk_Ailk_Bljk_I8BH_UserArgs_MT64x128x64_MI16x16x1_SN_LDSB0_AFC0_AFEM1_AFEM1_ASEM1_CLR1_CADS0_DTVA0_DTVB0_EPS0_FDSI0_GRPM1_GRVWA4_GRVWB8_GSU0_GSUAMB_GSUC0_GSUWGMRR0_GLS0_ISA942_IU1_K1_LBSPPA512_LBSPPB128_LBSPPM0_LPA32_LPB8_LPM0_LRVW8_LWPMn1_MIAV0_MIWT2_4_MO40_NTn1_NTA0_NTB0_NTC0_NTD0_NTM0_NEPBS0_NLCA1_NLCB1_ONLL1_PGR2_PLR1_PKA1_SIA3_SS1_SU0_SUM0_SUS64_SPO0_SRVW0_SSO0_SVW2_SK3_SKXCCM8_TLDS1_ULSGRO0_USL1_UIOFGRO0_USFGRO0_VSn1_VWA2_VWB1_WSGRA0_WSGRB0_WS64_WG32_8_1_WGM1_WGMXCC1_WGMXCCGn1
    SolutionIndex: 22
    SolutionNameMin: Cijk_Ailk_Bljk_I8BH_UserArgs_MT64x128x64_MI16x16x1_SN_LDSB0_AFC0_AFEM1_AFEM1_ASEM1_CLR1_CADS0_DTVA0_DTVB0_EPS0_FDSI0_GRPM1_GRVWA4_GRVWB8_GSU0_GSUAMB_GSUC0_GSUWGMRR0_GLS0_ISA942_IU1_K1_LBSPPA512_LBSPPB128_LBSPPM0_LPA32_LPB8_LPM0_LRVW8_LWPMn1_MIAV0_MIWT2_4_MO40_NTn1_NTA0_NTB0_NTC0_NTD0_NTM0_NEPBS0_NLCA1_NLCB1_ONLL1_PGR2_PLR1_PKA1_SIA3_SS1_SU0_SUM0_SUS64_SPO0_SRVW0_SSO0_SVW2_SK3_SKXCCM8_TLDS1_ULSGRO0_USL1_UIOFGRO0_USFGRO0_VSn1_VWA2_VWB2_WSGRA0_WSGRB0_WS64_WG32_8_1_WGM1_WGMXCC1_WGMXCCGn1
    SolutionIndex: 23
    SolutionNameMin: Cijk_Ailk_Bljk_I8BH_UserArgs_MT64x128x64_MI16x16x1_SN_LDSB0_AFC0_AFEM1_AFEM1_ASEM1_CLR1_CADS0_DTVA0_DTVB0_EPS0_FDSI0_GRPM1_GRVWA4_GRVWB8_GSU0_GSUAMB_GSUC0_GSUWGMRR0_GLS0_ISA942_IU1_K1_LBSPPA512_LBSPPB256_LBSPPM0_LPA32_LPB8_LPM0_LRVW8_LWPMn1_MIAV0_MIWT2_4_MO40_NTn1_NTA0_NTB0_NTC0_NTD0_NTM0_NEPBS0_NLCA1_NLCB1_ONLL1_PGR2_PLR1_PKA1_SIA3_SS1_SU0_SUM0_SUS64_SPO0_SRVW0_SSO0_SVW2_SK3_SKXCCM8_TLDS1_ULSGRO0_USL1_UIOFGRO0_USFGRO0_VSn1_VWA2_VWB4_WSGRA0_WSGRB0_WS64_WG32_8_1_WGM1_WGMXCC1_WGMXCCGn1
    SolutionIndex: 24
    SolutionNameMin: Cijk_Ailk_Bljk_I8BH_UserArgs_MT64x128x64_MI16x16x1_SN_LDSB0_AFC0_AFEM1_AFEM1_ASEM1_CLR1_CADS0_DTVA0_DTVB0_EPS0_FDSI0_GRPM1_GRVWA4_GRVWB4_GSU0_GSUAMB_GSUC0_GSUWGMRR0_GLS0_ISA942_IU1_K1_LBSPPA512_LBSPPB256_LBSPPM0_LPA32_LPB8_LPM0_LRVW8_LWPMn1_MIAV0_MIWT2_4_MO40_NTn1_NTA0_NTB0_NTC0_NTD0_NTM0_NEPBS0_NLCA1_NLCB1_ONLL1_PGR2_PLR1_PKA1_SIA3_SS1_SU0_SUM0_SUS64_SPO0_SRVW0_SSO0_SVW2_SK3_SKXCCM8_TLDS1_ULSGRO0_USL1_UIOFGRO0_USFGRO0_VSn1_VWA2_VWB4_WSGRA0_WSGRB0_WS64_WG32_8_1_WGM8_WGMXCC1_WGMXCCGn1
    SolutionIndex: 25
    SolutionNameMin: Cijk_Ailk_Bljk_I8BH_UserArgs_MT128x64x64_MI16x16x1_SN_LDSB0_AFC0_AFEM1_AFEM1_ASEM1_CLR1_CADS0_DTVA0_DTVB0_EPS0_FDSI0_GRPM1_GRVWA4_GRVWB8_GSU0_GSUAMB_GSUC0_GSUWGMRR0_GLS0_ISA942_IU1_K1_LBSPPA1024_LBSPPB128_LBSPPM0_LPA64_LPB8_LPM0_LRVW8_LWPMn1_MIAV0_MIWT4_2_MO40_NTn1_NTA0_NTB0_NTC0_NTD0_NTM0_NEPBS0_NLCA1_NLCB1_ONLL1_PGR2_PLR1_PKA1_SIA3_SS1_SU0_SUM0_SUS64_SPO0_SRVW0_SSO0_SVW4_SK3_SKXCCM8_TLDS1_ULSGRO0_USL1_UIOFGRO0_USFGRO0_VSn1_VWA4_VWB2_WSGRA0_WSGRB0_WS64_WG32_8_1_WGM1_WGMXCC1_WGMXCCGn1
    SolutionIndex: 26
    SolutionNameMin: Cijk_Ailk_Bljk_I8BH_UserArgs_MT64x64x64_MI16x16x1_SN_LDSB0_AFC0_AFEM1_AFEM1_ASEM1_CLR1_CADS0_DTVA0_DTVB0_EPS0_FDSI0_GRPM1_GRVWA4_GRVWB8_GSU0_GSUAMB_GSUC0_GSUWGMRR0_GLS0_ISA942_IU1_K1_LBSPPA512_LBSPPB128_LBSPPM0_LPA32_LPB8_LPM0_LRVW8_LWPMn1_MIAV0_MIWT2_2_MO40_NTn1_NTA0_NTB0_NTC0_NTD0_NTM0_NEPBS0_NLCA1_NLCB1_ONLL1_PGR2_PLR1_PKA1_SIA3_SS1_SU0_SUM0_SUS64_SPO0_SRVW0_SSO0_SVW2_SK3_SKXCCM8_TLDS1_ULSGRO0_USL1_UIOFGRO0_USFGRO0_VSn1_VWA2_VWB1_WSGRA0_WSGRB0_WS64_WG32_8_1_WGM1_WGMXCC1_WGMXCCGn1
    SolutionIndex: 27
    SolutionNameMin: Cijk_Ailk_Bljk_I8BH_UserArgs_MT64x64x64_MI16x16x1_SN_LDSB0_AFC0_AFEM1_AFEM1_ASEM1_CLR1_CADS0_DTVA0_DTVB0_EPS0_FDSI0_GRPM1_GRVWA4_GRVWB8_GSU0_GSUAMB_GSUC0_GSUWGMRR0_GLS0_ISA942_IU1_K1_LBSPPA512_LBSPPB128_LBSPPM0_LPA32_LPB8_LPM0_LRVW8_LWPMn1_MIAV0_MIWT2_2_MO40_NTn1_NTA0_NTB0_NTC0_NTD0_NTM0_NEPBS0_NLCA1_NLCB1_ONLL1_PGR2_PLR1_PKA1_SIA3_SS1_SU0_SUM0_SUS64_SPO0_SRVW0_SSO0_SVW2_SK3_SKXCCM8_TLDS1_ULSGRO0_USL1_UIOFGRO0_USFGRO0_VSn1_VWA2_VWB2_WSGRA0_WSGRB0_WS64_WG32_8_1_WGM1_WGMXCC1_WGMXCCGn1
    SolutionIndex: 28
    SolutionNameMin: Cijk_Ailk_Bljk_I8BH_UserArgs_MT64x64x64_MI16x16x1_SN_LDSB0_AFC0_AFEM1_AFEM1_ASEM1_CLR1_CADS0_DTVA0_DTVB0_EPS0_FDSI0_GRPM1_GRVWA8_GRVWB8_GSU0_GSUAMB_GSUC0_GSUWGMRR0_GLS0_ISA942_IU1_K1_LBSPPA512_LBSPPB128_LBSPPM0_LPA32_LPB8_LPM0_LRVW8_LWPMn1_MIAV0_MIWT2_2_MO40_NTn1_NTA0_NTB0_NTC0_NTD0_NTM0_NEPBS0_NLCA1_NLCB1_ONLL1_PGR2_PLR1_PKA1_SIA3_SS1_SU0_SUM0_SUS64_SPO0_SRVW0_SSO0_SVW2_SK3_SKXCCM8_TLDS1_ULSGRO0_USL1_UIOFGRO0_USFGRO0_VSn1_VWA2_VWB1_WSGRA0_WSGRB0_WS64_WG32_8_1_WGM1_WGMXCC1_WGMXCCGn1
    SolutionIndex: 29
    SolutionNameMin: Cijk_Ailk_Bljk_I8BH_UserArgs_MT64x32x64_MI16x16x1_SN_LDSB0_AFC0_AFEM1_AFEM1_ASEM1_CLR1_CADS0_DTVA0_DTVB0_EPS0_FDSI0_GRPM1_GRVWA4_GRVWB8_GSU0_GSUAMB_GSUC0_GSUWGMRR0_GLS0_ISA942_IU1_K1_LBSPPA512_LBSPPB128_LBSPPM0_LPA32_LPB8_LPM0_LRVW8_LWPMn1_MIAV0_MIWT2_1_MO40_NTn1_NTA0_NTB0_NTC0_NTD0_NTM0_NEPBS0_NLCA1_NLCB1_ONLL1_PGR2_PLR1_PKA1_SIA3_SS1_SU0_SUM0_SUS64_SPO0_SRVW0_SSO0_SVW2_SK3_SKXCCM8_TLDS1_ULSGRO0_USL1_UIOFGRO0_USFGRO0_VSn1_VWA2_VWB1_WSGRA0_WSGRB0_WS64_WG32_8_1_WGM1_WGMXCC1_WGMXCCGn1
    SolutionIndex: 30
    SolutionNameMin: Cijk_Ailk_Bljk_I8BH_UserArgs_MT32x32x64_MI16x16x1_SN_LDSB0_AFC0_AFEM1_AFEM1_ASEM1_CLR1_CADS0_DTVA0_DTVB0_EPS0_FDSI0_GRPM1_GRVWA4_GRVWB4_GSU0_GSUAMB_GSUC0_GSUWGMRR0_GLS0_ISA942_IU1_K1_LBSPPA256_LBSPPB128_LBSPPM0_LPA16_LPB8_LPM0_LRVW8_LWPMn1_MIAV0_MIWT1_1_MO40_NTn1_NTA0_NTB0_NTC0_NTD0_NTM0_NEPBS0_NLCA1_NLCB1_ONLL1_PGR2_PLR1_PKA1_SIA3_SS1_SU0_SUM0_SUS64_SPO0_SRVW0_SSO0_SVW1_SK3_SKXCCM8_TLDS1_ULSGRO0_USL1_UIOFGRO0_USFGRO0_VSn1_VWA1_VWB1_WSGRA0_WSGRB0_WS64_WG32_8_1_WGM1_WGMXCC1_WGMXCCGn1
    SolutionIndex: 31
    SolutionNameMin: Cijk_Ailk_Bljk_I8BH_UserArgs_MT32x32x64_MI16x16x1_SN_LDSB0_AFC0_AFEM1_AFEM1_ASEM1_CLR1_CADS0_DTVA0_DTVB0_EPS0_FDSI0_GRPM1_GRVWA2_GRVWB8_GSU0_GSUAMB_GSUC0_GSUWGMRR0_GLS0_ISA942_IU1_K1_LBSPPA256_LBSPPB128_LBSPPM0_LPA16_LPB8_LPM0_LRVW8_LWPMn1_MIAV0_MIWT1_1_MO40_NTn1_NTA0_NTB0_NTC0_NTD0_NTM0_NEPBS0_NLCA1_NLCB1_ONLL1_PGR2_PLR1_PKA1_SIA3_SS1_SU0_SUM0_SUS64_SPO0_SRVW0_SSO0_SVW1_SK3_SKXCCM8_TLDS1_ULSGRO0_USL1_UIOFGRO0_USFGRO0_VSn1_VWA1_VWB1_WSGRA0_WSGRB0_WS64_WG32_8_1_WGM1_WGMXCC1_WGMXCCGn1
    SolutionIndex: 32
    SolutionNameMin: Cijk_Ailk_Bljk_I8BH_UserArgs_MT32x32x64_MI16x16x1_SN_LDSB0_AFC0_AFEM1_AFEM1_ASEM1_CLR1_CADS0_DTVA0_DTVB0_EPS0_FDSI0_GRPM1_GRVWA4_GRVWB8_GSU0_GSUAMB_GSUC0_GSUWGMRR0_GLS0_ISA942_IU1_K1_LBSPPA256_LBSPPB128_LBSPPM0_LPA16_LPB8_LPM0_LRVW8_LWPMn1_MIAV0_MIWT1_1_MO40_NTn1_NTA0_NTB0_NTC0_NTD0_NTM0_NEPBS0_NLCA1_NLCB1_ONLL1_PGR2_PLR1_PKA1_SIA3_SS1_SU0_SUM0_SUS64_SPO0_SRVW0_SSO0_SVW1_SK3_SKXCCM8_TLDS1_ULSGRO0_USL1_UIOFGRO0_USFGRO0_VSn1_VWA1_VWB1_WSGRA0_WSGRB0_WS64_WG32_8_1_WGM1_WGMXCC1_WGMXCCGn1
    SolutionIndex: 33
    SolutionNameMin: Cijk_Ailk_Bljk_I8BH_UserArgs_MT128x256x128_MI16x16x1_SN_LDSB1_AFC0_AFEM1_AFEM1_ASEM1_CLR1_CADS0_DTVA0_DTVB0_EPS0_FDSI0_GRPM1_GRVWA4_GRVWB4_GSU0_GSUAMB_GSUC0_GSUWGMRR0_GLS0_ISA942_IU1_K1_LBSPPA2048_LBSPPB256_LBSPPM0_LPA64_LPB32_LPM0_LRVW16_LWPMn1_MIAV0_MIWT4_8_MO40_NTn1_NTA0_NTB0_NTC0_NTD0_NTM0_NEPBS0_NLCA1_NLCB1_ONLL1_PGR2_PLR1_PKA1_SIA3_SS1_SU0_SUM0_SUS128_SPO0_SRVW0_SSO0_SVW4_SK3_SKXCCM8_TLDS1_ULSGRO0_USL1_UIOFGRO0_USFGRO0_VSn1_VWA4_VWB2_WSGRA0_WSGRB0_WS64_WG32_8_1_WGM1_WGMXCC1_WGMXCCGn1
    SolutionIndex: 34
    SolutionNameMin: Cijk_Ailk_Bljk_I8BH_UserArgs_MT128x256x128_MI16x16x1_SN_LDSB1_AFC0_AFEM1_AFEM1_ASEM1_CLR1_CADS0_DTVA0_DTVB0_EPS0_FDSI0_GRPM1_GRVWA4_GRVWB4_GSU0_GSUAMB_GSUC0_GSUWGMRR0_GLS0_ISA942_IU1_K1_LBSPPA2048_LBSPPB512_LBSPPM0_LPA64_LPB32_LPM0_LRVW16_LWPMn1_MIAV0_MIWT4_8_MO40_NTn1_NTA0_NTB0_NTC0_NTD0_NTM0_NEPBS0_NLCA1_NLCB1_ONLL1_PGR2_PLR1_PKA1_SIA3_SS1_SU0_SUM0_SUS128_SPO0_SRVW0_SSO0_SVW4_SK3_SKXCCM8_TLDS1_ULSGRO0_USL1_UIOFGRO0_USFGRO0_VSn1_VWA4_VWB4_WSGRA0_WSGRB0_WS64_WG32_8_1_WGM1_WGMXCC1_WGMXCCGn1
    SolutionIndex: 35
    SolutionNameMin: Cijk_Ailk_Bljk_I8BH_UserArgs_MT128x256x128_MI16x16x1_SN_LDSB1_AFC0_AFEM1_AFEM1_ASEM1_CLR1_CADS0_DTVA0_DTVB0_EPS0_FDSI0_GRPM1_GRVWA4_GRVWB4_GSU0_GSUAMB_GSUC0_GSUWGMRR0_GLS0_ISA942_IU1_K1_LBSPPA2048_LBSPPB1024_LBSPPM0_LPA64_LPB32_LPM0_LRVW16_LWPMn1_MIAV0_MIWT4_8_MO40_NTn1_NTA0_NTB0_NTC0_NTD0_NTM0_NEPBS0_NLCA1_NLCB1_ONLL1_PGR2_PLR1_PKA1_SIA3_SS1_SU0_SUM0_SUS128_SPO0_SRVW0_SSO0_SVW4_SK3_SKXCCM8_TLDS1_ULSGRO0_USL1_UIOFGRO0_USFGRO0_VSn1_VWA4_VWB8_WSGRA0_WSGRB0_WS64_WG32_8_1_WGM1_WGMXCC1_WGMXCCGn1
    SolutionIndex: 36
    SolutionNameMin: Cijk_Ailk_Bljk_I8BH_UserArgs_MT128x256x128_MI16x16x1_SN_LDSB1_AFC0_AFEM1_AFEM1_ASEM1_CLR1_CADS0_DTVA0_DTVB0_EPS0_FDSI0_GRPM1_GRVWA4_GRVWB4_GSU0_GSUAMB_GSUC0_GSUWGMRR0_GLS0_ISA942_IU1_K1_LBSPPA2048_LBSPPB256_LBSPPM0_LPA64_LPB32_LPM0_LRVW16_LWPMn1_MIAV0_MIWT4_8_MO40_NTn1_NTA0_NTB0_NTC0_NTD0_NTM0_NEPBS0_NLCA1_NLCB1_ONLL1_PGR2_PLR1_PKA1_SIA3_SS1_SU0_SUM0_SUS128_SPO0_SRVW0_SSO0_SVW4_SK3_SKXCCM8_TLDS1_ULSGRO0_USL1_UIOFGRO0_USFGRO0_VSn1_VWA4_VWB2_WSGRA0_WSGRB0_WS64_WG32_8_1_WGM4_WGMXCC1_WGMXCCGn1
    SolutionIndex: 37
    SolutionNameMin: Cijk_Ailk_Bljk_I8BH_UserArgs_MT128x256x128_MI16x16x1_SN_LDSB1_AFC0_AFEM1_AFEM1_ASEM1_CLR1_CADS0_DTVA0_DTVB0_EPS0_FDSI0_GRPM1_GRVWA4_GRVWB4_GSU0_GSUAMB_GSUC0_GSUWGMRR0_GLS0_ISA942_IU1_K1_LBSPPA2048_LBSPPB512_LBSPPM0_LPA64_LPB32_LPM0_LRVW16_LWPMn1_MIAV0_MIWT4_8_MO40_NTn1_NTA0_NTB0_NTC0_NTD0_NTM0_NEPBS0_NLCA1_NLCB1_ONLL1_PGR2_PLR1_PKA1_SIA3_SS1_SU0_SUM0_SUS128_SPO0_SRVW0_SSO0_SVW4_SK3_SKXCCM8_TLDS1_ULSGRO0_USL1_UIOFGRO0_USFGRO0_VSn1_VWA4_VWB4_WSGRA0_WSGRB0_WS64_WG32_8_1_WGM4_WGMXCC1_WGMXCCGn1
    SolutionIndex: 38
    SolutionNameMin: Cijk_Ailk_Bljk_I8BH_UserArgs_MT128x256x128_MI16x16x1_SN_LDSB1_AFC0_AFEM1_AFEM1_ASEM1_CLR1_CADS0_DTVA0_DTVB0_EPS0_FDSI0_GRPM1_GRVWA4_GRVWB4_GSU0_GSUAMB_GSUC0_GSUWGMRR0_GLS0_ISA942_IU1_K1_LBSPPA2048_LBSPPB256_LBSPPM0_LPA64_LPB32_LPM0_LRVW16_LWPMn1_MIAV0_MIWT4_8_MO40_NTn1_NTA0_NTB0_NTC0_NTD0_NTM0_NEPBS0_NLCA1_NLCB1_ONLL1_PGR2_PLR1_PKA1_SIA3_SS1_SU0_SUM0_SUS128_SPO0_SRVW0_SSO0_SVW4_SK3_SKXCCM8_TLDS1_ULSGRO0_USL1_UIOFGRO0_USFGRO0_VSn1_VWA4_VWB2_WSGRA0_WSGRB0_WS64_WG32_8_1_WGM8_WGMXCC1_WGMXCCGn1
    SolutionIndex: 39
    SolutionNameMin: Cijk_Ailk_Bljk_I8BH_UserArgs_MT128x256x128_MI16x16x1_SN_LDSB1_AFC0_AFEM1_AFEM1_ASEM1_CLR1_CADS0_DTVA0_DTVB0_EPS0_FDSI0_GRPM1_GRVWA4_GRVWB4_GSU0_GSUAMB_GSUC0_GSUWGMRR0_GLS0_ISA942_IU1_K1_LBSPPA2048_LBSPPB512_LBSPPM0_LPA64_LPB32_LPM0_LRVW16_LWPMn1_MIAV0_MIWT4_8_MO40_NTn1_NTA0_NTB0_NTC0_NTD0_NTM0_NEPBS0_NLCA1_NLCB1_ONLL1_PGR2_PLR1_PKA1_SIA3_SS1_SU0_SUM0_SUS128_SPO0_SRVW0_SSO0_SVW4_SK3_SKXCCM8_TLDS1_ULSGRO0_USL1_UIOFGRO0_USFGRO0_VSn1_VWA4_VWB4_WSGRA0_WSGRB0_WS64_WG32_8_1_WGM8_WGMXCC1_WGMXCCGn1
    SolutionIndex: 40
    SolutionNameMin: Cijk_Ailk_Bljk_I8BH_UserArgs_MT128x128x128_MI16x16x1_SN_LDSB1_AFC0_AFEM1_AFEM1_ASEM1_CLR1_CADS0_DTVA0_DTVB0_EPS0_FDSI0_GRPM1_GRVWA4_GRVWB4_GSU0_GSUAMB_GSUC0_GSUWGMRR0_GLS0_ISA942_IU1_K1_LBSPPA2048_LBSPPB256_LBSPPM0_LPA64_LPB32_LPM0_LRVW16_LWPMn1_MIAV0_MIWT4_4_MO40_NTn1_NTA0_NTB0_NTC0_NTD0_NTM0_NEPBS0_NLCA1_NLCB1_ONLL1_PGR2_PLR1_PKA1_SIA3_SS1_SU0_SUM0_SUS128_SPO0_SRVW0_SSO0_SVW4_SK3_SKXCCM8_TLDS1_ULSGRO0_USL1_UIOFGRO0_USFGRO0_VSn1_VWA4_VWB2_WSGRA0_WSGRB0_WS64_WG32_8_1_WGM1_WGMXCC1_WGMXCCGn1
    SolutionIndex: 41
    SolutionNameMin: Cijk_Ailk_Bljk_I8BH_UserArgs_MT128x128x128_MI16x16x1_SN_LDSB1_AFC0_AFEM1_AFEM1_ASEM1_CLR1_CADS0_DTVA0_DTVB0_EPS0_FDSI0_GRPM1_GRVWA4_GRVWB4_GSU0_GSUAMB_GSUC0_GSUWGMRR0_GLS0_ISA942_IU1_K1_LBSPPA2048_LBSPPB512_LBSPPM0_LPA64_LPB32_LPM0_LRVW16_LWPMn1_MIAV0_MIWT4_4_MO40_NTn1_NTA0_NTB0_NTC0_NTD0_NTM0_NEPBS0_NLCA1_NLCB1_ONLL1_PGR2_PLR1_PKA1_SIA3_SS1_SU0_SUM0_SUS128_SPO0_SRVW0_SSO0_SVW4_SK3_SKXCCM8_TLDS1_ULSGRO0_USL1_UIOFGRO0_USFGRO0_VSn1_VWA4_VWB4_WSGRA0_WSGRB0_WS64_WG32_8_1_WGM1_WGMXCC1_WGMXCCGn1
    SolutionIndex: 42
    SolutionNameMin: Cijk_Ailk_Bljk_I8BH_UserArgs_MT128x128x128_MI16x16x1_SN_LDSB1_AFC0_AFEM1_AFEM1_ASEM1_CLR1_CADS0_DTVA0_DTVB0_EPS0_FDSI0_GRPM1_GRVWA4_GRVWB4_GSU0_GSUAMB_GSUC0_GSUWGMRR0_GLS0_ISA942_IU1_K1_LBSPPA2048_LBSPPB256_LBSPPM0_LPA64_LPB32_LPM0_LRVW16_LWPMn1_MIAV0_MIWT4_4_MO40_NTn1_NTA0_NTB0_NTC0_NTD0_NTM0_NEPBS0_NLCA1_NLCB1_ONLL1_PGR2_PLR1_PKA1_SIA3_SS1_SU0_SUM0_SUS128_SPO0_SRVW0_SSO0_SVW4_SK3_SKXCCM8_TLDS1_ULSGRO0_USL1_UIOFGRO0_USFGRO0_VSn1_VWA4_VWB2_WSGRA0_WSGRB0_WS64_WG32_8_1_WGM4_WGMXCC1_WGMXCCGn1
    SolutionIndex: 43
    SolutionNameMin: Cijk_Ailk_Bljk_I8BH_UserArgs_MT128x128x128_MI16x16x1_SN_LDSB1_AFC0_AFEM1_AFEM1_ASEM1_CLR1_CADS0_DTVA0_DTVB0_EPS0_FDSI0_GRPM1_GRVWA4_GRVWB4_GSU0_GSUAMB_GSUC0_GSUWGMRR0_GLS0_ISA942_IU1_K1_LBSPPA2048_LBSPPB256_LBSPPM0_LPA64_LPB32_LPM0_LRVW16_LWPMn1_MIAV0_MIWT4_4_MO40_NTn1_NTA0_NTB0_NTC0_NTD0_NTM0_NEPBS0_NLCA1_NLCB1_ONLL1_PGR2_PLR1_PKA1_SIA3_SS1_SU0_SUM0_SUS128_SPO0_SRVW0_SSO0_SVW4_SK3_SKXCCM8_TLDS1_ULSGRO0_USL1_UIOFGRO0_USFGRO0_VSn1_VWA4_VWB2_WSGRA0_WSGRB0_WS64_WG32_8_1_WGM8_WGMXCC1_WGMXCCGn1
    SolutionIndex: 44
    SolutionNameMin: Cijk_Ailk_Bljk_I8BH_UserArgs_MT128x128x128_MI16x16x1_SN_LDSB1_AFC0_AFEM1_AFEM1_ASEM1_CLR1_CADS0_DTVA0_DTVB0_EPS0_FDSI0_GRPM1_GRVWA4_GRVWB4_GSU0_GSUAMB_GSUC0_GSUWGMRR0_GLS0_ISA942_IU1_K1_LBSPPA2048_LBSPPB512_LBSPPM0_LPA64_LPB32_LPM0_LRVW16_LWPMn1_MIAV0_MIWT4_4_MO40_NTn1_NTA0_NTB0_NTC0_NTD0_NTM0_NEPBS0_NLCA1_NLCB1_ONLL1_PGR2_PLR1_PKA1_SIA3_SS1_SU0_SUM0_SUS128_SPO0_SRVW0_SSO0_SVW4_SK3_SKXCCM8_TLDS1_ULSGRO0_USL1_UIOFGRO0_USFGRO0_VSn1_VWA4_VWB4_WSGRA0_WSGRB0_WS64_WG32_8_1_WGM8_WGMXCC1_WGMXCCGn1
    SolutionIndex: 45
    SolutionNameMin: Cijk_Ailk_Bljk_I8BH_UserArgs_MT128x64x128_MI16x16x1_SN_LDSB1_AFC0_AFEM1_AFEM1_ASEM1_CLR1_CADS0_DTVA0_DTVB0_EPS0_FDSI0_GRPM1_GRVWA4_GRVWB8_GSU0_GSUAMB_GSUC0_GSUWGMRR0_GLS0_ISA942_IU1_K1_LBSPPA2048_LBSPPB128_LBSPPM0_LPA64_LPB32_LPM0_LRVW16_LWPMn1_MIAV0_MIWT4_2_MO40_NTn1_NTA0_NTB0_NTC0_NTD0_NTM0_NEPBS0_NLCA1_NLCB1_ONLL1_PGR2_PLR1_PKA1_SIA3_SS1_SU0_SUM0_SUS128_SPO0_SRVW0_SSO0_SVW4_SK3_SKXCCM8_TLDS1_ULSGRO0_USL1_UIOFGRO0_USFGRO0_VSn1_VWA4_VWB1_WSGRA0_WSGRB0_WS64_WG32_8_1_WGM1_WGMXCC1_WGMXCCGn1
    SolutionIndex: 46
    SolutionNameMin: Cijk_Ailk_Bljk_I8BH_UserArgs_MT64x64x128_MI16x16x1_SN_LDSB1_AFC0_AFEM1_AFEM1_ASEM1_CLR1_CADS0_DTVA0_DTVB0_EPS0_FDSI0_GRPM1_GRVWA4_GRVWB4_GSU0_GSUAMB_GSUC0_GSUWGMRR0_GLS0_ISA942_IU1_K1_LBSPPA1024_LBSPPB128_LBSPPM0_LPA32_LPB32_LPM0_LRVW16_LWPMn1_MIAV0_MIWT2_2_MO40_NTn1_NTA0_NTB0_NTC0_NTD0_NTM0_NEPBS0_NLCA1_NLCB1_ONLL1_PGR2_PLR1_PKA1_SIA3_SS1_SU0_SUM0_SUS128_SPO0_SRVW0_SSO0_SVW2_SK3_SKXCCM8_TLDS1_ULSGRO0_USL1_UIOFGRO0_USFGRO0_VSn1_VWA2_VWB1_WSGRA0_WSGRB0_WS64_WG32_8_1_WGM1_WGMXCC1_WGMXCCGn1
    SolutionIndex: 47
    SolutionNameMin: Cijk_Ailk_Bljk_I8BH_UserArgs_MT64x64x128_MI16x16x1_SN_LDSB1_AFC0_AFEM1_AFEM1_ASEM1_CLR1_CADS0_DTVA0_DTVB0_EPS0_FDSI0_GRPM1_GRVWA4_GRVWB8_GSU0_GSUAMB_GSUC0_GSUWGMRR0_GLS0_ISA942_IU1_K1_LBSPPA1024_LBSPPB256_LBSPPM0_LPA32_LPB32_LPM0_LRVW16_LWPMn1_MIAV0_MIWT2_2_MO40_NTn1_NTA0_NTB0_NTC0_NTD0_NTM0_NEPBS0_NLCA1_NLCB1_ONLL1_PGR2_PLR1_PKA1_SIA3_SS1_SU0_SUM0_SUS128_SPO0_SRVW0_SSO0_SVW2_SK3_SKXCCM8_TLDS1_ULSGRO0_USL1_UIOFGRO0_USFGRO0_VSn1_VWA2_VWB2_WSGRA0_WSGRB0_WS64_WG32_8_1_WGM1_WGMXCC1_WGMXCCGn1
    SolutionIndex: 48
    SolutionNameMin: Cijk_Ailk_Bljk_I8BH_UserArgs_MT64x64x128_MI16x16x1_SN_LDSB1_AFC0_AFEM1_AFEM1_ASEM1_CLR1_CADS0_DTVA0_DTVB0_EPS0_FDSI0_GRPM1_GRVWA4_GRVWB8_GSU0_GSUAMB_GSUC0_GSUWGMRR0_GLS0_ISA942_IU1_K1_LBSPPA1024_LBSPPB256_LBSPPM0_LPA32_LPB32_LPM0_LRVW16_LWPMn1_MIAV0_MIWT2_2_MO40_NTn1_NTA0_NTB0_NTC0_NTD0_NTM0_NEPBS0_NLCA1_NLCB1_ONLL1_PGR2_PLR1_PKA1_SIA3_SS1_SU0_SUM0_SUS128_SPO0_SRVW0_SSO0_SVW2_SK3_SKXCCM8_TLDS1_ULSGRO0_USL1_UIOFGRO0_USFGRO0_VSn1_VWA2_VWB2_WSGRA0_WSGRB0_WS64_WG32_8_1_WGM4_WGMXCC1_WGMXCCGn1
    SolutionIndex: 49
    SolutionNameMin: Cijk_Ailk_Bljk_I8BH_UserArgs_MT32x64x128_MI16x16x1_SN_LDSB0_AFC0_AFEM1_AFEM1_ASEM1_CLR1_CADS0_DTVA0_DTVB0_EPS0_FDSI0_GRPM1_GRVWA4_GRVWB8_GSU0_GSUAMB_GSUC0_GSUWGMRR0_GLS0_ISA942_IU1_K1_LBSPPA512_LBSPPB128_LBSPPM0_LPA16_LPB32_LPM0_LRVW16_LWPMn1_MIAV0_MIWT1_2_MO40_NTn1_NTA0_NTB0_NTC0_NTD0_NTM0_NEPBS0_NLCA1_NLCB1_ONLL1_PGR2_PLR1_PKA1_SIA3_SS1_SU0_SUM0_SUS128_SPO0_SRVW0_SSO0_SVW1_SK3_SKXCCM8_TLDS1_ULSGRO0_USL1_UIOFGRO0_USFGRO0_VSn1_VWA1_VWB1_WSGRA0_WSGRB0_WS64_WG32_8_1_WGM1_WGMXCC1_WGMXCCGn1
    SolutionIndex: 50
    SolutionNameMin: Cijk_Ailk_Bljk_I8BH_UserArgs_MT32x64x128_MI16x16x1_SN_LDSB0_AFC0_AFEM1_AFEM1_ASEM1_CLR1_CADS0_DTVA0_DTVB0_EPS0_FDSI0_GRPM1_GRVWA4_GRVWB8_GSU0_GSUAMB_GSUC0_GSUWGMRR0_GLS0_ISA942_IU1_K1_LBSPPA512_LBSPPB256_LBSPPM0_LPA16_LPB32_LPM0_LRVW16_LWPMn1_MIAV0_MIWT1_2_MO40_NTn1_NTA0_NTB0_NTC0_NTD0_NTM0_NEPBS0_NLCA1_NLCB1_ONLL1_PGR2_PLR1_PKA1_SIA3_SS1_SU0_SUM0_SUS128_SPO0_SRVW0_SSO0_SVW1_SK3_SKXCCM8_TLDS1_ULSGRO0_USL1_UIOFGRO0_USFGRO0_VSn1_VWA1_VWB2_WSGRA0_WSGRB0_WS64_WG32_8_1_WGM1_WGMXCC1_WGMXCCGn1
    SolutionIndex: 51
    SolutionNameMin: Cijk_Ailk_Bljk_I8BH_UserArgs_MT32x64x128_MI16x16x1_SN_LDSB0_AFC0_AFEM1_AFEM1_ASEM1_CLR1_CADS0_DTVA0_DTVB0_EPS0_FDSI0_GRPM1_GRVWA4_GRVWB8_GSU0_GSUAMB_GSUC0_GSUWGMRR0_GLS0_ISA942_IU1_K1_LBSPPA512_LBSPPB128_LBSPPM0_LPA16_LPB32_LPM0_LRVW16_LWPMn1_MIAV0_MIWT1_2_MO40_NTn1_NTA0_NTB0_NTC0_NTD0_NTM0_NEPBS0_NLCA1_NLCB1_ONLL1_PGR2_PLR1_PKA1_SIA3_SS1_SU0_SUM0_SUS128_SPO0_SRVW0_SSO0_SVW1_SK3_SKXCCM8_TLDS1_ULSGRO0_USL1_UIOFGRO0_USFGRO0_VSn1_VWA1_VWB1_WSGRA0_WSGRB0_WS64_WG32_8_1_WGM8_WGMXCC1_WGMXCCGn1
    SolutionIndex: 52
    SolutionNameMin: Cijk_Ailk_Bljk_I8BH_UserArgs_MT64x32x128_MI16x16x1_SN_LDSB0_AFC0_AFEM1_AFEM1_ASEM1_CLR1_CADS0_DTVA0_DTVB0_EPS0_FDSI0_GRPM1_GRVWA4_GRVWB4_GSU0_GSUAMB_GSUC0_GSUWGMRR0_GLS0_ISA942_IU1_K1_LBSPPA1024_LBSPPB128_LBSPPM0_LPA32_LPB32_LPM0_LRVW16_LWPMn1_MIAV0_MIWT2_1_MO40_NTn1_NTA0_NTB0_NTC0_NTD0_NTM0_NEPBS0_NLCA1_NLCB1_ONLL1_PGR2_PLR1_PKA1_SIA3_SS1_SU0_SUM0_SUS128_SPO0_SRVW0_SSO0_SVW2_SK3_SKXCCM8_TLDS1_ULSGRO0_USL1_UIOFGRO0_USFGRO0_VSn1_VWA2_VWB1_WSGRA0_WSGRB0_WS64_WG32_8_1_WGM1_WGMXCC1_WGMXCCGn1
    SolutionIndex: 53
    SolutionNameMin: Cijk_Ailk_Bljk_I8BH_UserArgs_MT64x32x128_MI16x16x1_SN_LDSB0_AFC0_AFEM1_AFEM1_ASEM1_CLR1_CADS0_DTVA0_DTVB0_EPS0_FDSI0_GRPM1_GRVWA4_GRVWB8_GSU0_GSUAMB_GSUC0_GSUWGMRR0_GLS0_ISA942_IU1_K1_LBSPPA1024_LBSPPB128_LBSPPM0_LPA32_LPB32_LPM0_LRVW16_LWPMn1_MIAV0_MIWT2_1_MO40_NTn1_NTA0_NTB0_NTC0_NTD0_NTM0_NEPBS0_NLCA1_NLCB1_ONLL1_PGR2_PLR1_PKA1_SIA3_SS1_SU0_SUM0_SUS128_SPO0_SRVW0_SSO0_SVW2_SK3_SKXCCM8_TLDS1_ULSGRO0_USL1_UIOFGRO0_USFGRO0_VSn1_VWA2_VWB1_WSGRA0_WSGRB0_WS64_WG32_8_1_WGM1_WGMXCC1_WGMXCCGn1
    SolutionIndex: 54
    SolutionNameMin: Cijk_Ailk_Bljk_I8BH_UserArgs_MT32x32x128_MI16x16x1_SN_LDSB0_AFC0_AFEM1_AFEM1_ASEM1_CLR1_CADS0_DTVA0_DTVB0_EPS0_FDSI0_GRPM1_GRVWA4_GRVWB4_GSU0_GSUAMB_GSUC0_GSUWGMRR0_GLS0_ISA942_IU1_K1_LBSPPA512_LBSPPB128_LBSPPM0_LPA16_LPB32_LPM0_LRVW16_LWPMn1_MIAV0_MIWT1_1_MO40_NTn1_NTA0_NTB0_NTC0_NTD0_NTM0_NEPBS0_NLCA1_NLCB1_ONLL1_PGR2_PLR1_PKA1_SIA3_SS1_SU0_SUM0_SUS128_SPO0_SRVW0_SSO0_SVW1_SK3_SKXCCM8_TLDS1_ULSGRO0_USL1_UIOFGRO0_USFGRO0_VSn1_VWA1_VWB1_WSGRA0_WSGRB0_WS64_WG32_8_1_WGM1_WGMXCC1_WGMXCCGn1
    SolutionIndex: 55
    SolutionNameMin: Cijk_Ailk_Bljk_I8BH_UserArgs_MT32x32x128_MI16x16x1_SN_LDSB0_AFC0_AFEM1_AFEM1_ASEM1_CLR1_CADS0_DTVA0_DTVB0_EPS0_FDSI0_GRPM1_GRVWA4_GRVWB8_GSU0_GSUAMB_GSUC0_GSUWGMRR0_GLS0_ISA942_IU1_K1_LBSPPA512_LBSPPB128_LBSPPM0_LPA16_LPB32_LPM0_LRVW16_LWPMn1_MIAV0_MIWT1_1_MO40_NTn1_NTA0_NTB0_NTC0_NTD0_NTM0_NEPBS0_NLCA1_NLCB1_ONLL1_PGR2_PLR1_PKA1_SIA3_SS1_SU0_SUM0_SUS128_SPO0_SRVW0_SSO0_SVW1_SK3_SKXCCM8_TLDS1_ULSGRO0_USL1_UIOFGRO0_USFGRO0_VSn1_VWA1_VWB1_WSGRA0_WSGRB0_WS64_WG32_8_1_WGM1_WGMXCC1_WGMXCCGn1
    SolutionIndex: 56
    SolutionNameMin: Cijk_Ailk_Bljk_I8BH_UserArgs_MT32x32x128_MI16x16x1_SN_LDSB0_AFC0_AFEM1_AFEM1_ASEM1_CLR1_CADS0_DTVA0_DTVB0_EPS0_FDSI0_GRPM1_GRVWA8_GRVWB8_GSU0_GSUAMB_GSUC0_GSUWGMRR0_GLS0_ISA942_IU1_K1_LBSPPA512_LBSPPB128_LBSPPM0_LPA16_LPB32_LPM0_LRVW16_LWPMn1_MIAV0_MIWT1_1_MO40_NTn1_NTA0_NTB0_NTC0_NTD0_NTM0_NEPBS0_NLCA1_NLCB1_ONLL1_PGR2_PLR1_PKA1_SIA3_SS1_SU0_SUM0_SUS128_SPO0_SRVW0_SSO0_SVW1_SK3_SKXCCM8_TLDS1_ULSGRO0_USL1_UIOFGRO0_USFGRO0_VSn1_VWA1_VWB1_WSGRA0_WSGRB0_WS64_WG32_8_1_WGM1_WGMXCC1_WGMXCCGn1
    SolutionIndex: 57
    SolutionNameMin: Cijk_Ailk_Bljk_I8BH_UserArgs_MT32x32x128_MI16x16x1_SN_LDSB0_AFC0_AFEM1_AFEM1_ASEM1_CLR1_CADS0_DTVA0_DTVB0_EPS0_FDSI0_GRPM1_GRVWA8_GRVWB8_GSU0_GSUAMB_GSUC0_GSUWGMRR0_GLS0_ISA942_IU1_K1_LBSPPA512_LBSPPB128_LBSPPM0_LPA16_LPB32_LPM0_LRVW16_LWPMn1_MIAV0_MIWT1_1_MO40_NTn1_NTA0_NTB0_NTC0_NTD0_NTM0_NEPBS0_NLCA1_NLCB1_ONLL1_PGR2_PLR1_PKA1_SIA3_SS1_SU0_SUM0_SUS128_SPO0_SRVW0_SSO0_SVW1_SK3_SKXCCM8_TLDS1_ULSGRO0_USL1_UIOFGRO0_USFGRO0_VSn1_VWA1_VWB1_WSGRA0_WSGRB0_WS64_WG32_8_1_WGM8_WGMXCC1_WGMXCCGn1
    SolutionIndex: 58
    SolutionNameMin: Cijk_Ailk_Bljk_I8BH_UserArgs_MT64x128x256_MI16x16x1_SN_LDSB1_AFC0_AFEM1_AFEM1_ASEM1_CLR1_CADS0_DTVA0_DTVB0_EPS0_FDSI0_GRPM1_GRVWA4_GRVWB4_GSU0_GSUAMB_GSUC0_GSUWGMRR0_GLS0_ISA942_IU1_K1_LBSPPA1024_LBSPPB512_LBSPPM0_LPA32_LPB32_LPM0_LRVW16_LWPMn1_MIAV0_MIWT2_4_MO40_NTn1_NTA0_NTB0_NTC0_NTD0_NTM0_NEPBS0_NLCA1_NLCB1_ONLL1_PGR2_PLR2_PKA1_SIA3_SS1_SU0_SUM0_SUS256_SPO0_SRVW0_SSO0_SVW2_SK3_SKXCCM8_TLDS1_ULSGRO0_USL1_UIOFGRO0_USFGRO0_VSn1_VWA2_VWB2_WSGRA0_WSGRB0_WS64_WG32_8_1_WGM1_WGMXCC1_WGMXCCGn1
    SolutionIndex: 59
    SolutionNameMin: Cijk_Ailk_Bljk_I8BH_UserArgs_MT64x128x256_MI16x16x1_SN_LDSB1_AFC0_AFEM1_AFEM1_ASEM1_CLR1_CADS0_DTVA0_DTVB0_EPS0_FDSI0_GRPM1_GRVWA4_GRVWB4_GSU0_GSUAMB_GSUC0_GSUWGMRR0_GLS0_ISA942_IU1_K1_LBSPPA1024_LBSPPB1024_LBSPPM0_LPA32_LPB32_LPM0_LRVW16_LWPMn1_MIAV0_MIWT2_4_MO40_NTn1_NTA0_NTB0_NTC0_NTD0_NTM0_NEPBS0_NLCA1_NLCB1_ONLL1_PGR2_PLR2_PKA1_SIA3_SS1_SU0_SUM0_SUS256_SPO0_SRVW0_SSO0_SVW2_SK3_SKXCCM8_TLDS1_ULSGRO0_USL1_UIOFGRO0_USFGRO0_VSn1_VWA2_VWB4_WSGRA0_WSGRB0_WS64_WG32_8_1_WGM1_WGMXCC1_WGMXCCGn1
    SolutionIndex: 60
    SolutionNameMin: Cijk_Ailk_Bljk_I8BH_UserArgs_MT64x64x256_MI16x16x1_SN_LDSB1_AFC0_AFEM1_AFEM1_ASEM1_CLR1_CADS0_DTVA0_DTVB0_EPS0_FDSI0_GRPM1_GRVWA4_GRVWB4_GSU0_GSUAMB_GSUC0_GSUWGMRR0_GLS0_ISA942_IU1_K1_LBSPPA1024_LBSPPB256_LBSPPM0_LPA32_LPB32_LPM0_LRVW16_LWPMn1_MIAV0_MIWT2_2_MO40_NTn1_NTA0_NTB0_NTC0_NTD0_NTM0_NEPBS0_NLCA1_NLCB1_ONLL1_PGR2_PLR2_PKA1_SIA3_SS1_SU0_SUM0_SUS256_SPO0_SRVW0_SSO0_SVW2_SK3_SKXCCM8_TLDS1_ULSGRO0_USL1_UIOFGRO0_USFGRO0_VSn1_VWA2_VWB1_WSGRA0_WSGRB0_WS64_WG32_8_1_WGM1_WGMXCC1_WGMXCCGn1
    SolutionIndex: 61
    SolutionNameMin: Cijk_Ailk_Bljk_I8BH_UserArgs_MT64x64x256_MI16x16x1_SN_LDSB1_AFC0_AFEM1_AFEM1_ASEM1_CLR1_CADS0_DTVA0_DTVB0_EPS0_FDSI0_GRPM1_GRVWA4_GRVWB4_GSU0_GSUAMB_GSUC0_GSUWGMRR0_GLS0_ISA942_IU1_K1_LBSPPA1024_LBSPPB256_LBSPPM0_LPA32_LPB32_LPM0_LRVW16_LWPMn1_MIAV0_MIWT2_2_MO40_NTn1_NTA0_NTB0_NTC0_NTD0_NTM0_NEPBS0_NLCA1_NLCB1_ONLL1_PGR2_PLR2_PKA1_SIA3_SS1_SU0_SUM0_SUS256_SPO0_SRVW0_SSO0_SVW2_SK3_SKXCCM8_TLDS1_ULSGRO0_USL1_UIOFGRO0_USFGRO0_VSn1_VWA2_VWB1_WSGRA0_WSGRB0_WS64_WG32_8_1_WGM4_WGMXCC1_WGMXCCGn1
    SolutionIndex: 62
    SolutionNameMin: Cijk_Ailk_Bljk_I8BH_UserArgs_MT32x32x256_MI16x16x1_SN_LDSB1_AFC0_AFEM1_AFEM1_ASEM1_CLR1_CADS0_DTVA0_DTVB0_EPS0_FDSI0_GRPM1_GRVWA4_GRVWB8_GSU0_GSUAMB_GSUC0_GSUWGMRR0_GLS0_ISA942_IU1_K1_LBSPPA512_LBSPPB256_LBSPPM0_LPA16_LPB32_LPM0_LRVW16_LWPMn1_MIAV0_MIWT1_1_MO40_NTn1_NTA0_NTB0_NTC0_NTD0_NTM0_NEPBS0_NLCA1_NLCB1_ONLL1_PGR2_PLR2_PKA1_SIA3_SS1_SU0_SUM0_SUS256_SPO0_SRVW0_SSO0_SVW1_SK3_SKXCCM8_TLDS1_ULSGRO0_USL1_UIOFGRO0_USFGRO0_VSn1_VWA1_VWB1_WSGRA0_WSGRB0_WS64_WG32_8_1_WGM1_WGMXCC1_WGMXCCGn1
    SolutionIndex: 63
    SolutionNameMin: Cijk_Ailk_Bljk_I8BH_UserArgs_MT32x32x32_MI16x16x1_SN_LDSB0_AFC0_AFEM1_AFEM1_ASEM1_CLR0_CADS0_DTVA0_DTVB0_EPS0_FDSI0_GRPM1_GRVWA1_GRVWB1_GSU0_GSUAMB_GSUC0_GSUWGMRR0_GLS0_ISA942_IU1_K1_LBSPPA256_LBSPPB128_LBSPPM0_LPA16_LPB8_LPM0_LRVW8_LWPMn1_MIAV0_MIWT1_1_MO40_NTn1_NTA0_NTB0_NTC0_NTD0_NTM0_NEPBS0_NLCA1_NLCB1_ONLL1_PGR2_PLR0_PKA1_SIA3_SS1_SU32_SUM0_SUS256_SPO0_SRVW0_SSO0_SVW1_SK3_SKXCCM8_TLDS1_ULSGRO0_USL1_UIOFGRO0_USFGROn1_VSn1_VWA1_VWB1_WSGRA0_WSGRB0_WS64_WG32_8_1_WGM1_WGMXCC1_WGMXCCGn1
- - - [128, 128, 1, 128, 128, 128, 128, 128]
    - [30, 0.64]
  - - [128, 128, 1, 256, 128, 128, 128, 256]
    - [55, 1.15]
  - - [128, 128, 1, 512, 128, 128, 128, 512]
    - [55, 1.94]
  - - [128, 128, 1, 1024, 128, 128, 128, 1024]
    - [56, 2.95]
  - - [128, 128, 1, 2048, 128, 128, 128, 2048]
    - [56, 4.03]
  - - [128, 128, 1, 4096, 128, 128, 128, 4096]
    - [62, 5.0]
  - - [128, 128, 1, 8192, 128, 128, 128, 8192]
    - [62, 5.7]
  - - [128, 256, 1, 128, 128, 128, 128, 128]
    - [31, 1.27]
  - - [128, 256, 1, 256, 128, 128, 128, 256]
    - [54, 2.26]
  - - [128, 256, 1, 512, 128, 128, 128, 512]
    - [54, 3.84]
  - - [128, 256, 1, 1024, 128, 128, 128, 1024]
    - [56, 5.86]
  - - [128, 256, 1, 2048, 128, 128, 128, 2048]
    - [56, 8.06]
  - - [128, 256, 1, 4096, 128, 128, 128, 4096]
    - [62, 10.03]
  - - [128, 256, 1, 8192, 128, 128, 128, 8192]
    - [62, 11.39]
  - - [128, 512, 1, 128, 128, 128, 128, 128]
    - [31, 2.53]
  - - [128, 512, 1, 256, 128, 128, 128, 256]
    - [54, 4.62]
  - - [128, 512, 1, 512, 128, 128, 128, 512]
    - [56, 7.62]
  - - [128, 512, 1, 1024, 128, 128, 128, 1024]
    - [56, 11.58]
  - - [128, 512, 1, 2048, 128, 128, 128, 2048]
    - [56, 16.05]
  - - [128, 512, 1, 4096, 128, 128, 128, 4096]
    - [62, 19.82]
  - - [128, 512, 1, 8192, 128, 128, 128, 8192]
    - [62, 22.56]
  - - [128, 1024, 1, 128, 128, 128, 128, 128]
    - [52, 4.76]
  - - [128, 1024, 1, 256, 128, 128, 128, 256]
    - [53, 8.36]
  - - [128, 1024, 1, 512, 128, 128, 128, 512]
    - [50, 13.79]
  - - [128, 1024, 1, 1024, 128, 128, 128, 1024]
    - [50, 21.07]
  - - [128, 1024, 1, 2048, 128, 128, 128, 2048]
    - [49, 28.47]
  - - [128, 1024, 1, 4096, 128, 128, 128, 4096]
    - [49, 34.5]
  - - [128, 1024, 1, 8192, 128, 128, 128, 8192]
    - [49, 38.56]
  - - [128, 2048, 1, 128, 128, 128, 128, 128]
    - [26, 8.58]
  - - [128, 2048, 1, 256, 128, 128, 128, 256]
    - [26, 14.9]
  - - [128, 2048, 1, 512, 128, 128, 128, 512]
    - [47, 24.01]
  - - [128, 2048, 1, 1024, 128, 128, 128, 1024]
    - [60, 35.18]
  - - [128, 2048, 1, 2048, 128, 128, 128, 2048]
    - [60, 47.46]
  - - [128, 2048, 1, 4096, 128, 128, 128, 4096]
    - [60, 57.47]
  - - [128, 2048, 1, 8192, 128, 128, 128, 8192]
    - [60, 61.86]
  - - [128, 4096, 1, 128, 128, 128, 128, 128]
    - [25, 14.63]
  - - [128, 4096, 1, 256, 128, 128, 128, 256]
    - [25, 24.74]
  - - [128, 4096, 1, 512, 128, 128, 128, 512]
    - [21, 39.12]
  - - [128, 4096, 1, 1024, 128, 128, 128, 1024]
    - [21, 55.1]
  - - [128, 4096, 1, 2048, 128, 128, 128, 2048]
    - [58, 70.15]
  - - [128, 4096, 1, 4096, 128, 128, 128, 4096]
    - [59, 79.93]
  - - [128, 4096, 1, 8192, 128, 128, 128, 8192]
    - [58, 90.98]
  - - [128, 8192, 1, 128, 128, 128, 128, 128]
    - [17, 23.12]
  - - [128, 8192, 1, 256, 128, 128, 128, 256]
    - [17, 38.8]
  - - [128, 8192, 1, 512, 128, 128, 128, 512]
    - [17, 59.11]
  - - [128, 8192, 1, 1024, 128, 128, 128, 1024]
    - [40, 82.59]
  - - [128, 8192, 1, 2048, 128, 128, 128, 2048]
    - [40, 101.2]
  - - [128, 8192, 1, 4096, 128, 128, 128, 4096]
    - [40, 116.09]
  - - [128, 8192, 1, 8192, 128, 128, 128, 8192]
    - [41, 124.89]
  - - [256, 128, 1, 128, 256, 256, 256, 128]
    - [55, 1.29]
  - - [256, 128, 1, 256, 256, 256, 256, 256]
    - [56, 2.32]
  - - [256, 128, 1, 512, 256, 256, 256, 512]
    - [56, 3.91]
  - - [256, 128, 1, 1024, 256, 256, 256, 1024]
    - [56, 5.97]
  - - [256, 128, 1, 2048, 256, 256, 256, 2048]
    - [56, 8.09]
  - - [256, 128, 1, 4096, 256, 256, 256, 4096]
    - [62, 9.95]
  - - [256, 128, 1, 8192, 256, 256, 256, 8192]
    - [62, 11.35]
  - - [256, 256, 1, 128, 256, 256, 256, 128]
    - [32, 2.55]
  - - [256, 256, 1, 256, 256, 256, 256, 256]
    - [56, 4.57]
  - - [256, 256, 1, 512, 256, 256, 256, 512]
    - [55, 7.71]
  - - [256, 256, 1, 1024, 256, 256, 256, 1024]
    - [56, 11.75]
  - - [256, 256, 1, 2048, 256, 256, 256, 2048]
    - [56, 16.06]
  - - [256, 256, 1, 4096, 256, 256, 256, 4096]
    - [56, 19.66]
  - - [256, 256, 1, 8192, 256, 256, 256, 8192]
    - [62, 22.39]
  - - [256, 512, 1, 128, 256, 256, 256, 128]
    - [52, 4.74]
  - - [256, 512, 1, 256, 256, 256, 256, 256]
    - [53, 8.32]
  - - [256, 512, 1, 512, 256, 256, 256, 512]
    - [50, 13.9]
  - - [256, 512, 1, 1024, 256, 256, 256, 1024]
    - [49, 21.14]
  - - [256, 512, 1, 2048, 256, 256, 256, 2048]
    - [49, 28.52]
  - - [256, 512, 1, 4096, 256, 256, 256, 4096]
    - [49, 34.52]
  - - [256, 512, 1, 8192, 256, 256, 256, 8192]
    - [49, 38.41]
  - - [256, 1024, 1, 128, 256, 256, 256, 128]
    - [28, 8.58]
  - - [256, 1024, 1, 256, 256, 256, 256, 256]
    - [28, 14.93]
  - - [256, 1024, 1, 512, 256, 256, 256, 512]
    - [47, 24.07]
  - - [256, 1024, 1, 1024, 256, 256, 256, 1024]
    - [47, 35.07]
  - - [256, 1024, 1, 2048, 256, 256, 256, 2048]
    - [60, 46.91]
  - - [256, 1024, 1, 4096, 256, 256, 256, 4096]
    - [60, 57.14]
  - - [256, 1024, 1, 8192, 256, 256, 256, 8192]
    - [60, 60.81]
  - - [256, 2048, 1, 128, 256, 256, 256, 128]
    - [25, 14.63]
  - - [256, 2048, 1, 256, 256, 256, 256, 256]
    - [25, 24.84]
  - - [256, 2048, 1, 512, 256, 256, 256, 512]
    - [21, 39.11]
  - - [256, 2048, 1, 1024, 256, 256, 256, 1024]
    - [21, 54.91]
  - - [256, 2048, 1, 2048, 256, 256, 256, 2048]
    - [59, 70.16]
  - - [256, 2048, 1, 4096, 256, 256, 256, 4096]
    - [59, 84.26]
  - - [256, 2048, 1, 8192, 256, 256, 256, 8192]
    - [58, 83.53]
  - - [256, 4096, 1, 128, 256, 256, 256, 128]
    - [17, 23.1]
  - - [256, 4096, 1, 256, 256, 256, 256, 256]
    - [17, 38.99]
  - - [256, 4096, 1, 512, 256, 256, 256, 512]
    - [17, 59.26]
  - - [256, 4096, 1, 1024, 256, 256, 256, 1024]
    - [40, 82.54]
  - - [256, 4096, 1, 2048, 256, 256, 256, 2048]
    - [41, 103.16]
  - - [256, 4096, 1, 4096, 256, 256, 256, 4096]
    - [40, 116.54]
  - - [256, 4096, 1, 8192, 256, 256, 256, 8192]
    - [40, 126.31]
  - - [256, 8192, 1, 128, 256, 256, 256, 128]
    - [4, 32.35]
  - - [256, 8192, 1, 256, 256, 256, 256, 256]
    - [11, 54.57]
  - - [256, 8192, 1, 512, 256, 256, 256, 512]
    - [11, 83.96]
  - - [256, 8192, 1, 1024, 256, 256, 256, 1024]
    - [13, 115.0]
  - - [256, 8192, 1, 2048, 256, 256, 256, 2048]
    - [33, 137.07]
  - - [256, 8192, 1, 4096, 256, 256, 256, 4096]
    - [35, 157.47]
  - - [256, 8192, 1, 8192, 256, 256, 256, 8192]
    - [35, 173.11]
  - - [512, 128, 1, 128, 512, 512, 512, 128]
    - [55, 2.54]
  - - [512, 128, 1, 256, 512, 512, 512, 256]
    - [55, 4.55]
  - - [512, 128, 1, 512, 512, 512, 512, 512]
    - [55, 7.7]
  - - [512, 128, 1, 1024, 512, 512, 512, 1024]
    - [56, 11.74]
  - - [512, 128, 1, 2048, 512, 512, 512, 2048]
    - [56, 16.08]
  - - [512, 128, 1, 4096, 512, 512, 512, 4096]
    - [56, 19.54]
  - - [512, 128, 1, 8192, 512, 512, 512, 8192]
    - [57, 21.91]
  - - [512, 256, 1, 128, 512, 512, 512, 128]
    - [29, 4.75]
  - - [512, 256, 1, 256, 512, 512, 512, 256]
    - [53, 8.36]
  - - [512, 256, 1, 512, 512, 512, 512, 512]
    - [53, 13.77]
  - - [512, 256, 1, 1024, 512, 512, 512, 1024]
    - [49, 20.7]
  - - [512, 256, 1, 2048, 512, 512, 512, 2048]
    - [49, 27.79]
  - - [512, 256, 1, 4096, 512, 512, 512, 4096]
    - [49, 33.44]
  - - [512, 256, 1, 8192, 512, 512, 512, 8192]
    - [51, 35.48]
  - - [512, 512, 1, 128, 512, 512, 512, 128]
    - [26, 8.58]
  - - [512, 512, 1, 256, 512, 512, 512, 256]
    - [26, 14.98]
  - - [512, 512, 1, 512, 512, 512, 512, 512]
    - [47, 23.88]
  - - [512, 512, 1, 1024, 512, 512, 512, 1024]
    - [47, 34.85]
  - - [512, 512, 1, 2048, 512, 512, 512, 2048]
    - [47, 45.3]
  - - [512, 512, 1, 4096, 512, 512, 512, 4096]
    - [60, 54.35]
  - - [512, 512, 1, 8192, 512, 512, 512, 8192]
    - [48, 50.81]
  - - [512, 1024, 1, 128, 512, 512, 512, 128]
    - [25, 14.57]
  - - [512, 1024, 1, 256, 512, 512, 512, 256]
    - [25, 24.74]
  - - [512, 1024, 1, 512, 512, 512, 512, 512]
    - [21, 39.18]
  - - [512, 1024, 1, 1024, 512, 512, 512, 1024]
    - [21, 55.18]
  - - [512, 1024, 1, 2048, 512, 512, 512, 2048]
    - [23, 69.0]
  - - [512, 1024, 1, 4096, 512, 512, 512, 4096]
    - [59, 82.36]
  - - [512, 1024, 1, 8192, 512, 512, 512, 8192]
    - [24, 79.24]
  - - [512, 2048, 1, 128, 512, 512, 512, 128]
    - [18, 22.98]
  - - [512, 2048, 1, 256, 512, 512, 512, 256]
    - [17, 38.82]
  - - [512, 2048, 1, 512, 512, 512, 512, 512]
    - [17, 59.01]
  - - [512, 2048, 1, 1024, 512, 512, 512, 1024]
    - [41, 82.54]
  - - [512, 2048, 1, 2048, 512, 512, 512, 2048]
    - [40, 103.37]
  - - [512, 2048, 1, 4096, 512, 512, 512, 4096]
    - [40, 113.44]
  - - [512, 2048, 1, 8192, 512, 512, 512, 8192]
    - [43, 120.78]
  - - [512, 4096, 1, 128, 512, 512, 512, 128]
    - [5, 32.47]
  - - [512, 4096, 1, 256, 512, 512, 512, 256]
    - [11, 54.62]
  - - [512, 4096, 1, 512, 512, 512, 512, 512]
    - [11, 83.91]
  - - [512, 4096, 1, 1024, 512, 512, 512, 1024]
    - [11, 115.26]
  - - [512, 4096, 1, 2048, 512, 512, 512, 2048]
    - [34, 142.52]
  - - [512, 4096, 1, 4096, 512, 512, 512, 4096]
    - [15, 149.36]
  - - [512, 4096, 1, 8192, 512, 512, 512, 8192]
    - [33, 162.88]
  - - [512, 8192, 1, 128, 512, 512, 512, 128]
    - [0, 41.58]
  - - [512, 8192, 1, 256, 512, 512, 512, 256]
    - [10, 68.31]
  - - [512, 8192, 1, 512, 512, 512, 512, 512]
    - [6, 102.44]
  - - [512, 8192, 1, 1024, 512, 512, 512, 1024]
    - [6, 136.66]
  - - [512, 8192, 1, 2048, 512, 512, 512, 2048]
    - [6, 165.11]
  - - [512, 8192, 1, 4096, 512, 512, 512, 4096]
    - [9, 184.62]
  - - [512, 8192, 1, 8192, 512, 512, 512, 8192]
    - [8, 196.49]
  - - [1024, 128, 1, 128, 1024, 1024, 1024, 128]
    - [52, 4.76]
  - - [1024, 128, 1, 256, 1024, 1024, 1024, 256]
    - [53, 8.33]
  - - [1024, 128, 1, 512, 1024, 1024, 1024, 512]
    - [50, 13.71]
  - - [1024, 128, 1, 1024, 1024, 1024, 1024, 1024]
    - [49, 20.63]
  - - [1024, 128, 1, 2048, 1024, 1024, 1024, 2048]
    - [49, 27.76]
  - - [1024, 128, 1, 4096, 1024, 1024, 1024, 4096]
    - [51, 33.0]
  - - [1024, 128, 1, 8192, 1024, 1024, 1024, 8192]
    - [53, 33.86]
  - - [1024, 256, 1, 128, 1024, 1024, 1024, 128]
    - [46, 8.56]
  - - [1024, 256, 1, 256, 1024, 1024, 1024, 256]
    - [27, 14.84]
  - - [1024, 256, 1, 512, 1024, 1024, 1024, 512]
    - [47, 24.01]
  - - [1024, 256, 1, 1024, 1024, 1024, 1024, 1024]
    - [47, 34.88]
  - - [1024, 256, 1, 2048, 1024, 1024, 1024, 2048]
    - [47, 45.12]
  - - [1024, 256, 1, 4096, 1024, 1024, 1024, 4096]
    - [61, 54.13]
  - - [1024, 256, 1, 8192, 1024, 1024, 1024, 8192]
    - [26, 50.54]
  - - [1024, 512, 1, 128, 1024, 1024, 1024, 128]
    - [25, 14.54]
  - - [1024, 512, 1, 256, 1024, 1024, 1024, 256]
    - [25, 24.81]
  - - [1024, 512, 1, 512, 1024, 1024, 1024, 512]
    - [21, 39.06]
  - - [1024, 512, 1, 1024, 1024, 1024, 1024, 1024]
    - [21, 54.97]
  - - [1024, 512, 1, 2048, 1024, 1024, 1024, 2048]
    - [21, 69.06]
  - - [1024, 512, 1, 4096, 1024, 1024, 1024, 4096]
    - [19, 74.46]
  - - [1024, 512, 1, 8192, 1024, 1024, 1024, 8192]
    - [20, 81.41]
  - - [1024, 1024, 1, 128, 1024, 1024, 1024, 128]
    - [17, 23.05]
  - - [1024, 1024, 1, 256, 1024, 1024, 1024, 256]
    - [17, 38.89]
  - - [1024, 1024, 1, 512, 1024, 1024, 1024, 512]
    - [17, 59.12]
  - - [1024, 1024, 1, 1024, 1024, 1024, 1024, 1024]
    - [40, 82.66]
  - - [1024, 1024, 1, 2048, 1024, 1024, 1024, 2048]
    - [40, 103.48]
  - - [1024, 1024, 1, 4096, 1024, 1024, 1024, 4096]
    - [44, 112.38]
  - - [1024, 1024, 1, 8192, 1024, 1024, 1024, 8192]
    - [43, 121.37]
  - - [1024, 2048, 1, 128, 1024, 1024, 1024, 128]
    - [4, 32.47]
  - - [1024, 2048, 1, 256, 1024, 1024, 1024, 256]
    - [11, 54.4]
  - - [1024, 2048, 1, 512, 1024, 1024, 1024, 512]
    - [11, 84.12]
  - - [1024, 2048, 1, 1024, 1024, 1024, 1024, 1024]
    - [13, 115.18]
  - - [1024, 2048, 1, 2048, 1024, 1024, 1024, 2048]
    - [35, 142.56]
  - - [1024, 2048, 1, 4096, 1024, 1024, 1024, 4096]
    - [35, 149.97]
  - - [1024, 2048, 1, 8192, 1024, 1024, 1024, 8192]
    - [34, 164.01]
  - - [1024, 4096, 1, 128, 1024, 1024, 1024, 128]
    - [0, 41.74]
  - - [1024, 4096, 1, 256, 1024, 1024, 1024, 256]
    - [10, 68.31]
  - - [1024, 4096, 1, 512, 1024, 1024, 1024, 512]
    - [10, 102.54]
  - - [1024, 4096, 1, 1024, 1024, 1024, 1024, 1024]
    - [6, 137.46]
  - - [1024, 4096, 1, 2048, 1024, 1024, 1024, 2048]
    - [7, 164.77]
  - - [1024, 4096, 1, 4096, 1024, 1024, 1024, 4096]
    - [8, 184.5]
  - - [1024, 4096, 1, 8192, 1024, 1024, 1024, 8192]
    - [9, 196.26]
  - - [1024, 8192, 1, 128, 1024, 1024, 1024, 128]
    - [0, 44.68]
  - - [1024, 8192, 1, 256, 1024, 1024, 1024, 256]
    - [7, 71.91]
  - - [1024, 8192, 1, 512, 1024, 1024, 1024, 512]
    - [7, 106.58]
  - - [1024, 8192, 1, 1024, 1024, 1024, 1024, 1024]
    - [7, 141.41]
  - - [1024, 8192, 1, 2048, 1024, 1024, 1024, 2048]
    - [7, 168.27]
  - - [1024, 8192, 1, 4096, 1024, 1024, 1024, 4096]
    - [9, 186.76]
  - - [1024, 8192, 1, 8192, 1024, 1024, 1024, 8192]
    - [9, 197.65]
  - - [2048, 128, 1, 128, 2048, 2048, 2048, 128]
    - [27, 8.54]
  - - [2048, 128, 1, 256, 2048, 2048, 2048, 256]
    - [26, 14.84]
  - - [2048, 128, 1, 512, 2048, 2048, 2048, 512]
    - [47, 23.89]
  - - [2048, 128, 1, 1024, 2048, 2048, 2048, 1024]
    - [47, 34.9]
  - - [2048, 128, 1, 2048, 2048, 2048, 2048, 2048]
    - [26, 39.55]
  - - [2048, 128, 1, 4096, 2048, 2048, 2048, 4096]
    - [26, 45.49]
  - - [2048, 128, 1, 8192, 2048, 2048, 2048, 8192]
    - [26, 49.37]
  - - [2048, 256, 1, 128, 2048, 2048, 2048, 128]
    - [25, 14.6]
  - - [2048, 256, 1, 256, 2048, 2048, 2048, 256]
    - [25, 24.81]
  - - [2048, 256, 1, 512, 2048, 2048, 2048, 512]
    - [21, 39.02]
  - - [2048, 256, 1, 1024, 2048, 2048, 2048, 1024]
    - [21, 55.05]
  - - [2048, 256, 1, 2048, 2048, 2048, 2048, 2048]
    - [23, 66.29]
  - - [2048, 256, 1, 4096, 2048, 2048, 2048, 4096]
    - [19, 76.11]
  - - [2048, 256, 1, 8192, 2048, 2048, 2048, 8192]
    - [22, 83.94]
  - - [2048, 512, 1, 128, 2048, 2048, 2048, 128]
    - [18, 22.9]
  - - [2048, 512, 1, 256, 2048, 2048, 2048, 256]
    - [17, 38.87]
  - - [2048, 512, 1, 512, 2048, 2048, 2048, 512]
    - [18, 58.97]
  - - [2048, 512, 1, 1024, 2048, 2048, 2048, 1024]
    - [41, 82.71]
  - - [2048, 512, 1, 2048, 2048, 2048, 2048, 2048]
    - [40, 97.41]
  - - [2048, 512, 1, 4096, 2048, 2048, 2048, 4096]
    - [42, 111.41]
  - - [2048, 512, 1, 8192, 2048, 2048, 2048, 8192]
    - [43, 120.67]
  - - [2048, 1024, 1, 128, 2048, 2048, 2048, 128]
    - [5, 32.38]
  - - [2048, 1024, 1, 256, 2048, 2048, 2048, 256]
    - [11, 54.27]
  - - [2048, 1024, 1, 512, 2048, 2048, 2048, 512]
    - [11, 84.2]
  - - [2048, 1024, 1, 1024, 2048, 2048, 2048, 1024]
    - [11, 112.3]
  - - [2048, 1024, 1, 2048, 2048, 2048, 2048, 2048]
    - [39, 133.87]
  - - [2048, 1024, 1, 4096, 2048, 2048, 2048, 4096]
    - [37, 154.98]
  - - [2048, 1024, 1, 8192, 2048, 2048, 2048, 8192]
    - [35, 166.66]
  - - [2048, 2048, 1, 128, 2048, 2048, 2048, 128]
    - [0, 41.68]
  - - [2048, 2048, 1, 256, 2048, 2048, 2048, 256]
    - [10, 68.19]
  - - [2048, 2048, 1, 512, 2048, 2048, 2048, 512]
    - [6, 102.57]
  - - [2048, 2048, 1, 1024, 2048, 2048, 2048, 1024]
    - [6, 136.01]
  - - [2048, 2048, 1, 2048, 2048, 2048, 2048, 2048]
    - [7, 164.4]
  - - [2048, 2048, 1, 4096, 2048, 2048, 2048, 4096]
    - [8, 184.18]
  - - [2048, 2048, 1, 8192, 2048, 2048, 2048, 8192]
    - [9, 196.34]
  - - [2048, 4096, 1, 128, 2048, 2048, 2048, 128]
    - [0, 44.33]
  - - [2048, 4096, 1, 256, 2048, 2048, 2048, 256]
    - [10, 71.67]
  - - [2048, 4096, 1, 512, 2048, 2048, 2048, 512]
    - [7, 106.45]
  - - [2048, 4096, 1, 1024, 2048, 2048, 2048, 1024]
    - [7, 140.32]
  - - [2048, 4096, 1, 2048, 2048, 2048, 2048, 2048]
    - [7, 168.07]
  - - [2048, 4096, 1, 4096, 2048, 2048, 2048, 4096]
    - [9, 186.59]
  - - [2048, 4096, 1, 8192, 2048, 2048, 2048, 8192]
    - [9, 197.48]
  - - [2048, 8192, 1, 128, 2048, 2048, 2048, 128]
    - [1, 46.48]
  - - [2048, 8192, 1, 256, 2048, 2048, 2048, 256]
    - [7, 74.69]
  - - [2048, 8192, 1, 512, 2048, 2048, 2048, 512]
    - [7, 109.92]
  - - [2048, 8192, 1, 1024, 2048, 2048, 2048, 1024]
    - [7, 143.17]
  - - [2048, 8192, 1, 2048, 2048, 2048, 2048, 2048]
    - [2, 171.04]
  - - [2048, 8192, 1, 4096, 2048, 2048, 2048, 4096]
    - [9, 219.79]
  - - [2048, 8192, 1, 8192, 2048, 2048, 2048, 8192]
    - [8, 238.42]
  - - [4096, 128, 1, 128, 4096, 4096, 4096, 128]
    - [25, 14.62]
  - - [4096, 128, 1, 256, 4096, 4096, 4096, 256]
    - [25, 24.78]
  - - [4096, 128, 1, 512, 4096, 4096, 4096, 512]
    - [21, 38.78]
  - - [4096, 128, 1, 1024, 4096, 4096, 4096, 1024]
    - [45, 52.58]
  - - [4096, 128, 1, 2048, 4096, 4096, 4096, 2048]
    - [20, 66.33]
  - - [4096, 128, 1, 4096, 4096, 4096, 4096, 4096]
    - [20, 75.95]
  - - [4096, 128, 1, 8192, 4096, 4096, 4096, 8192]
    - [21, 83.02]
  - - [4096, 256, 1, 128, 4096, 4096, 4096, 128]
    - [17, 22.91]
  - - [4096, 256, 1, 256, 4096, 4096, 4096, 256]
    - [17, 38.23]
  - - [4096, 256, 1, 512, 4096, 4096, 4096, 512]
    - [18, 58.64]
  - - [4096, 256, 1, 1024, 4096, 4096, 4096, 1024]
    - [41, 82.15]
  - - [4096, 256, 1, 2048, 4096, 4096, 4096, 2048]
    - [41, 96.93]
  - - [4096, 256, 1, 4096, 4096, 4096, 4096, 4096]
    - [41, 110.93]
  - - [4096, 256, 1, 8192, 4096, 4096, 4096, 8192]
    - [40, 119.59]
  - - [4096, 512, 1, 128, 4096, 4096, 4096, 128]
    - [3, 32.45]
  - - [4096, 512, 1, 256, 4096, 4096, 4096, 256]
    - [5, 53.93]
  - - [4096, 512, 1, 512, 4096, 4096, 4096, 512]
    - [11, 83.75]
  - - [4096, 512, 1, 1024, 4096, 4096, 4096, 1024]
    - [11, 111.47]
  - - [4096, 512, 1, 2048, 4096, 4096, 4096, 2048]
    - [36, 133.1]
  - - [4096, 512, 1, 4096, 4096, 4096, 4096, 4096]
    - [36, 154.39]
  - - [4096, 512, 1, 8192, 4096, 4096, 4096, 8192]
    - [38, 168.16]
  - - [4096, 1024, 1, 128, 4096, 4096, 4096, 128]
    - [0, 41.83]
  - - [4096, 1024, 1, 256, 4096, 4096, 4096, 256]
    - [10, 68.26]
  - - [4096, 1024, 1, 512, 4096, 4096, 4096, 512]
    - [6, 102.15]
  - - [4096, 1024, 1, 1024, 4096, 4096, 4096, 1024]
    - [6, 135.94]
  - - [4096, 1024, 1, 2048, 4096, 4096, 4096, 2048]
    - [7, 164.41]
  - - [4096, 1024, 1, 4096, 4096, 4096, 4096, 4096]
    - [9, 184.06]
  - - [4096, 1024, 1, 8192, 4096, 4096, 4096, 8192]
    - [8, 196.21]
  - - [4096, 2048, 1, 128, 4096, 4096, 4096, 128]
    - [0, 44.26]
  - - [4096, 2048, 1, 256, 4096, 4096, 4096, 256]
    - [7, 71.82]
  - - [4096, 2048, 1, 512, 4096, 4096, 4096, 512]
    - [7, 106.53]
  - - [4096, 2048, 1, 1024, 4096, 4096, 4096, 1024]
    - [7, 140.38]
  - - [4096, 2048, 1, 2048, 4096, 4096, 4096, 2048]
    - [7, 168.16]
  - - [4096, 2048, 1, 4096, 4096, 4096, 4096, 4096]
    - [6, 186.44]
  - - [4096, 2048, 1, 8192, 4096, 4096, 4096, 8192]
    - [9, 197.43]
  - - [4096, 4096, 1, 128, 4096, 4096, 4096, 128]
    - [1, 46.59]
  - - [4096, 4096, 1, 256, 4096, 4096, 4096, 256]
    - [7, 74.63]
  - - [4096, 4096, 1, 512, 4096, 4096, 4096, 512]
    - [7, 109.71]
  - - [4096, 4096, 1, 1024, 4096, 4096, 4096, 1024]
    - [7, 143.18]
  - - [4096, 4096, 1, 2048, 4096, 4096, 4096, 2048]
    - [2, 171.02]
  - - [4096, 4096, 1, 4096, 4096, 4096, 4096, 4096]
    - [6, 219.85]
  - - [4096, 4096, 1, 8192, 4096, 4096, 4096, 8192]
    - [9, 238.71]
  - - [4096, 8192, 1, 128, 4096, 4096, 4096, 128]
    - [1, 47.89]
  - - [4096, 8192, 1, 256, 4096, 4096, 4096, 256]
    - [7, 76.34]
  - - [4096, 8192, 1, 512, 4096, 4096, 4096, 512]
    - [7, 111.58]
  - - [4096, 8192, 1, 1024, 4096, 4096, 4096, 1024]
    - [7, 144.64]
  - - [4096, 8192, 1, 2048, 4096, 4096, 4096, 2048]
    - [6, 189.99]
  - - [4096, 8192, 1, 4096, 4096, 4096, 4096, 4096]
    - [9, 213.13]
  - - [4096, 8192, 1, 8192, 4096, 4096, 4096, 8192]
    - [8, 232.26]
  - - [8192, 128, 1, 128, 8192, 8192, 8192, 128]
    - [17, 22.86]
  - - [8192, 128, 1, 256, 8192, 8192, 8192, 256]
    - [17, 38.81]
  - - [8192, 128, 1, 512, 8192, 8192, 8192, 512]
    - [17, 59.22]
  - - [8192, 128, 1, 1024, 8192, 8192, 8192, 1024]
    - [16, 78.88]
  - - [8192, 128, 1, 2048, 8192, 8192, 8192, 2048]
    - [40, 97.27]
  - - [8192, 128, 1, 4096, 8192, 8192, 8192, 4096]
    - [41, 110.85]
  - - [8192, 128, 1, 8192, 8192, 8192, 8192, 8192]
    - [40, 116.73]
  - - [8192, 256, 1, 128, 8192, 8192, 8192, 128]
    - [5, 32.33]
  - - [8192, 256, 1, 256, 8192, 8192, 8192, 256]
    - [12, 54.2]
  - - [8192, 256, 1, 512, 8192, 8192, 8192, 512]
    - [12, 82.56]
  - - [8192, 256, 1, 1024, 8192, 8192, 8192, 1024]
    - [14, 109.24]
  - - [8192, 256, 1, 2048, 8192, 8192, 8192, 2048]
    - [34, 134.29]
  - - [8192, 256, 1, 4096, 8192, 8192, 8192, 4096]
    - [33, 154.35]
  - - [8192, 256, 1, 8192, 8192, 8192, 8192, 8192]
    - [34, 166.35]
  - - [8192, 512, 1, 128, 8192, 8192, 8192, 128]
    - [0, 41.71]
  - - [8192, 512, 1, 256, 8192, 8192, 8192, 256]
    - [10, 68.28]
  - - [8192, 512, 1, 512, 8192, 8192, 8192, 512]
    - [10, 102.63]
  - - [8192, 512, 1, 1024, 8192, 8192, 8192, 1024]
    - [7, 135.99]
  - - [8192, 512, 1, 2048, 8192, 8192, 8192, 2048]
    - [7, 164.71]
  - - [8192, 512, 1, 4096, 8192, 8192, 8192, 4096]
    - [6, 184.43]
  - - [8192, 512, 1, 8192, 8192, 8192, 8192, 8192]
    - [9, 196.05]
  - - [8192, 1024, 1, 128, 8192, 8192, 8192, 128]
    - [0, 44.4]
  - - [8192, 1024, 1, 256, 8192, 8192, 8192, 256]
    - [10, 71.99]
  - - [8192, 1024, 1, 512, 8192, 8192, 8192, 512]
    - [7, 105.56]
  - - [8192, 1024, 1, 1024, 8192, 8192, 8192, 1024]
    - [7, 140.8]
  - - [8192, 1024, 1, 2048, 8192, 8192, 8192, 2048]
    - [7, 168.41]
  - - [8192, 1024, 1, 4096, 8192, 8192, 8192, 4096]
    - [8, 186.75]
  - - [8192, 1024, 1, 8192, 8192, 8192, 8192, 8192]
    - [8, 197.32]
  - - [8192, 2048, 1, 128, 8192, 8192, 8192, 128]
    - [1, 46.14]
  - - [8192, 2048, 1, 256, 8192, 8192, 8192, 256]
    - [7, 74.49]
  - - [8192, 2048, 1, 512, 8192, 8192, 8192, 512]
    - [7, 109.34]
  - - [8192, 2048, 1, 1024, 8192, 8192, 8192, 1024]
    - [7, 143.43]
  - - [8192, 2048, 1, 2048, 8192, 8192, 8192, 2048]
    - [2, 171.02]
  - - [8192, 2048, 1, 4096, 8192, 8192, 8192, 4096]
    - [8, 220.01]
  - - [8192, 2048, 1, 8192, 8192, 8192, 8192, 8192]
    - [9, 238.66]
  - - [8192, 4096, 1, 128, 8192, 8192, 8192, 128]
    - [1, 47.74]
  - - [8192, 4096, 1, 256, 8192, 8192, 8192, 256]
    - [7, 76.25]
  - - [8192, 4096, 1, 512, 8192, 8192, 8192, 512]
    - [7, 111.42]
  - - [8192, 4096, 1, 1024, 8192, 8192, 8192, 1024]
    - [7, 144.75]
  - - [8192, 4096, 1, 2048, 8192, 8192, 8192, 2048]
    - [6, 190.16]
  - - [8192, 4096, 1, 4096, 8192, 8192, 8192, 4096]
    - [6, 212.98]
  - - [8192, 4096, 1, 8192, 8192, 8192, 8192, 8192]
    - [9, 232.21]
  - - [8192, 8192, 1, 128, 8192, 8192, 8192, 128]
    - [4, 48.41]
  - - [8192, 8192, 1, 256, 8192, 8192, 8192, 256]
    - [0, 88.52]
  - - [8192, 8192, 1, 512, 8192, 8192, 8192, 512]
    - [6, 131.33]
  - - [8192, 8192, 1, 1024, 8192, 8192, 8192, 1024]
    - [6, 173.5]
  - - [8192, 8192, 1, 2048, 8192, 8192, 8192, 2048]
    - [6, 206.87]
  - - [8192, 8192, 1, 4096, 8192, 8192, 8192, 4096]
    - [8, 229.65]
  - - [8192, 8192, 1, 8192, 8192, 8192, 8192, 8192]
    - [8, 245.19]
  - - [1, 1, 1, 32, 1, 1, 1, 32]
    - [63, 0.0]
- null
- null
- ExperimentalStreamK
- GridBased
