projects/hipblaslt/library/src/amd_detail/rocblaslt/src/Tensile/Logic/asm_full/aquavanjaram/gfx942_80cu/StreamK/aquavanjaram942_Cijk_Ailk_Bjlk_I8BH_UserArgs.yaml
- {MinimumRequiredVersion: 4.33.0}
- aquavanjaram942
- {Architecture: gfx942, CUCount: 80}
- [Device 0049, Device 0050]
    SolutionIndex: 0
    SolutionNameMin: Cijk_Ailk_Bjlk_I8BH_UserArgs_MT256x256x32_MI16x16x1_SN_LDSB0_AFC0_AFEM1_AFEM1_ASEM1_CLR0_CADS0_DTVA0_DTVB0_EPS0_FDSI0_GRPM1_GRVWA4_GRVWB4_GSU0_GSUAMB_GSUC0_GSUWGMRR0_GLS0_ISA942_IU1_K1_LBSPPA2048_LBSPPB2048_LBSPPM0_LPA64_LPB64_LPM0_LRVW8_LWPMn1_MIAV0_MIWT8_8_MO40_NTn1_NTA0_NTB0_NTC0_NTD0_NTM0_NEPBS0_NLCA1_NLCB1_ONLL1_PGR2_PLR0_PKA1_SIA3_SS1_SU0_SUM0_SUS32_SPO0_SRVW0_SSO0_SVW4_SK3_SKXCCM8_TLDS0_ULSGRO0_USL1_UIOFGRO0_USFGRO0_VSn1_VWA4_VWB4_WSGRA0_WSGRB0_WS64_WG32_8_1_WGM1_WGMXCC1_WGMXCCGn1
    SolutionIndex: 1
    SolutionNameMin: Cijk_Ailk_Bjlk_I8BH_UserArgs_MT256x256x32_MI16x16x1_SN_LDSB0_AFC0_AFEM1_AFEM1_ASEM1_CLR0_CADS0_DTVA0_DTVB0_EPS0_FDSI0_GRPM1_GRVWA4_GRVWB8_GSU0_GSUAMB_GSUC0_GSUWGMRR0_GLS0_ISA942_IU1_K1_LBSPPA2048_LBSPPB2048_LBSPPM0_LPA64_LPB64_LPM0_LRVW8_LWPMn1_MIAV0_MIWT8_8_MO40_NTn1_NTA0_NTB0_NTC0_NTD0_NTM0_NEPBS0_NLCA1_NLCB1_ONLL1_PGR2_PLR0_PKA1_SIA3_SS1_SU0_SUM0_SUS32_SPO0_SRVW0_SSO0_SVW4_SK3_SKXCCM8_TLDS0_ULSGRO0_USL1_UIOFGRO0_USFGRO0_VSn1_VWA4_VWB4_WSGRA0_WSGRB0_WS64_WG32_8_1_WGM1_WGMXCC1_WGMXCCGn1
    SolutionIndex: 2
    SolutionNameMin: Cijk_Ailk_Bjlk_I8BH_UserArgs_MT128x128x32_MI16x16x1_SN_LDSB0_AFC0_AFEM1_AFEM1_ASEM1_CLR0_CADS0_DTVA0_DTVB0_EPS0_FDSI0_GRPM1_GRVWA4_GRVWB8_GSU0_GSUAMB_GSUC0_GSUWGMRR0_GLS0_ISA942_IU1_K1_LBSPPA1024_LBSPPB1024_LBSPPM0_LPA64_LPB64_LPM0_LRVW8_LWPMn1_MIAV0_MIWT4_4_MO40_NTn1_NTA0_NTB0_NTC0_NTD0_NTM0_NEPBS0_NLCA1_NLCB1_ONLL1_PGR2_PLR0_PKA1_SIA3_SS1_SU0_SUM0_SUS32_SPO0_SRVW0_SSO0_SVW4_SK3_SKXCCM8_TLDS0_ULSGRO0_USL1_UIOFGRO0_USFGRO0_VSn1_VWA4_VWB4_WSGRA0_WSGRB0_WS64_WG32_8_1_WGM1_WGMXCC1_WGMXCCGn1
    SolutionIndex: 3
    SolutionNameMin: Cijk_Ailk_Bjlk_I8BH_UserArgs_MT128x64x32_MI16x16x1_SN_LDSB0_AFC0_AFEM1_AFEM1_ASEM1_CLR0_CADS0_DTVA0_DTVB0_EPS0_FDSI0_GRPM1_GRVWA8_GRVWB8_GSU0_GSUAMB_GSUC0_GSUWGMRR0_GLS0_ISA942_IU1_K1_LBSPPA1024_LBSPPB512_LBSPPM0_LPA64_LPB32_LPM0_LRVW8_LWPMn1_MIAV0_MIWT4_2_MO40_NTn1_NTA0_NTB0_NTC0_NTD0_NTM0_NEPBS0_NLCA1_NLCB1_ONLL1_PGR2_PLR0_PKA1_SIA3_SS1_SU0_SUM0_SUS32_SPO0_SRVW0_SSO0_SVW4_SK3_SKXCCM8_TLDS0_ULSGRO0_USL1_UIOFGRO0_USFGRO0_VSn1_VWA4_VWB2_WSGRA0_WSGRB0_WS64_WG32_8_1_WGM1_WGMXCC1_WGMXCCGn1
    SolutionIndex: 4
    SolutionNameMin: Cijk_Ailk_Bjlk_I8BH_UserArgs_MT32x32x32_MI16x16x1_SN_LDSB0_AFC0_AFEM1_AFEM1_ASEM1_CLR0_CADS0_DTVA0_DTVB0_EPS0_FDSI0_GRPM1_GRVWA4_GRVWB4_GSU0_GSUAMB_GSUC0_GSUWGMRR0_GLS0_ISA942_IU1_K1_LBSPPA256_LBSPPB256_LBSPPM0_LPA16_LPB16_LPM0_LRVW8_LWPMn1_MIAV0_MIWT1_1_MO40_NTn1_NTA0_NTB0_NTC0_NTD0_NTM0_NEPBS0_NLCA1_NLCB1_ONLL1_PGR2_PLR0_PKA1_SIA3_SS1_SU0_SUM0_SUS32_SPO0_SRVW0_SSO0_SVW1_SK3_SKXCCM8_TLDS0_ULSGRO0_USL1_UIOFGRO0_USFGRO0_VSn1_VWA1_VWB1_WSGRA0_WSGRB0_WS64_WG32_8_1_WGM1_WGMXCC1_WGMXCCGn1
    SolutionIndex: 5
    SolutionNameMin: Cijk_Ailk_Bjlk_I8BH_UserArgs_MT256x256x64_MI16x16x1_SN_LDSB1_AFC0_AFEM1_AFEM1_ASEM1_CLR1_CADS0_DTVA0_DTVB0_EPS0_FDSI0_GRPM1_GRVWA4_GRVWB4_GSU0_GSUAMB_GSUC0_GSUWGMRR0_GLS0_ISA942_IU1_K1_LBSPPA2048_LBSPPB2048_LBSPPM0_LPA0_LPB64_LPM0_LRVW8_LWPMn1_MIAV0_MIWT8_8_MO40_NTn1_NTA0_NTB0_NTC0_NTD0_NTM0_NEPBS0_NLCA1_NLCB1_ONLL1_PGR2_PLR1_PKA1_SIA3_SS1_SU0_SUM0_SUS64_SPO0_SRVW0_SSO0_SVW8_SK3_SKXCCM8_TLDS0_ULSGRO0_USL1_UIOFGRO0_USFGRO0_VSn1_VWA8_VWB4_WSGRA0_WSGRB0_WS64_WG32_8_1_WGM1_WGMXCC1_WGMXCCGn1
    SolutionIndex: 6
    SolutionNameMin: Cijk_Ailk_Bjlk_I8BH_UserArgs_MT256x256x64_MI16x16x1_SN_LDSB1_AFC0_AFEM1_AFEM1_ASEM1_CLR1_CADS0_DTVA0_DTVB0_EPS0_FDSI0_GRPM1_GRVWA4_GRVWB4_GSU0_GSUAMB_GSUC0_GSUWGMRR0_GLS0_ISA942_IU1_K1_LBSPPA2048_LBSPPB2048_LBSPPM0_LPA64_LPB0_LPM0_LRVW8_LWPMn1_MIAV0_MIWT8_8_MO40_NTn1_NTA0_NTB0_NTC0_NTD0_NTM0_NEPBS0_NLCA1_NLCB1_ONLL1_PGR2_PLR1_PKA1_SIA3_SS1_SU0_SUM0_SUS64_SPO0_SRVW0_SSO0_SVW4_SK3_SKXCCM8_TLDS0_ULSGRO0_USL1_UIOFGRO0_USFGRO0_VSn1_VWA4_VWB8_WSGRA0_WSGRB0_WS64_WG32_8_1_WGM1_WGMXCC1_WGMXCCGn1
    SolutionIndex: 7
    SolutionNameMin: Cijk_Ailk_Bjlk_I8BH_UserArgs_MT256x256x64_MI16x16x1_SN_LDSB1_AFC0_AFEM1_AFEM1_ASEM1_CLR1_CADS0_DTVA0_DTVB0_EPS0_FDSI0_GRPM1_GRVWA8_GRVWB4_GSU0_GSUAMB_GSUC0_GSUWGMRR0_GLS0_ISA942_IU1_K1_LBSPPA2048_LBSPPB2048_LBSPPM0_LPA0_LPB64_LPM0_LRVW8_LWPMn1_MIAV0_MIWT8_8_MO40_NTn1_NTA0_NTB0_NTC0_NTD0_NTM0_NEPBS0_NLCA1_NLCB1_ONLL1_PGR2_PLR1_PKA1_SIA3_SS1_SU0_SUM0_SUS64_SPO0_SRVW0_SSO0_SVW8_SK3_SKXCCM8_TLDS0_ULSGRO0_USL1_UIOFGRO0_USFGRO0_VSn1_VWA8_VWB4_WSGRA0_WSGRB0_WS64_WG32_8_1_WGM1_WGMXCC1_WGMXCCGn1
    SolutionIndex: 8
    SolutionNameMin: Cijk_Ailk_Bjlk_I8BH_UserArgs_MT256x256x64_MI16x16x1_SN_LDSB1_AFC0_AFEM1_AFEM1_ASEM1_CLR1_CADS0_DTVA0_DTVB0_EPS0_FDSI0_GRPM1_GRVWA4_GRVWB4_GSU0_GSUAMB_GSUC0_GSUWGMRR0_GLS0_ISA942_IU1_K1_LBSPPA2048_LBSPPB2048_LBSPPM0_LPA64_LPB0_LPM0_LRVW8_LWPMn1_MIAV0_MIWT8_8_MO40_NTn1_NTA0_NTB0_NTC0_NTD0_NTM0_NEPBS0_NLCA1_NLCB1_ONLL1_PGR2_PLR1_PKA1_SIA3_SS1_SU0_SUM0_SUS64_SPO0_SRVW0_SSO0_SVW4_SK3_SKXCCM8_TLDS0_ULSGRO0_USL1_UIOFGRO0_USFGRO0_VSn1_VWA4_VWB8_WSGRA0_WSGRB0_WS64_WG32_8_1_WGM8_WGMXCC1_WGMXCCGn1
    SolutionIndex: 9
    SolutionNameMin: Cijk_Ailk_Bjlk_I8BH_UserArgs_MT256x128x64_MI16x16x1_SN_LDSB1_AFC0_AFEM1_AFEM1_ASEM1_CLR1_CADS0_DTVA0_DTVB0_EPS0_FDSI0_GRPM1_GRVWA4_GRVWB8_GSU0_GSUAMB_GSUC0_GSUWGMRR0_GLS0_ISA942_IU1_K1_LBSPPA2048_LBSPPB1024_LBSPPM0_LPA0_LPB64_LPM0_LRVW8_LWPMn1_MIAV0_MIWT8_4_MO40_NTn1_NTA0_NTB0_NTC0_NTD0_NTM0_NEPBS0_NLCA1_NLCB1_ONLL1_PGR2_PLR1_PKA1_SIA3_SS1_SU0_SUM0_SUS64_SPO0_SRVW0_SSO0_SVW8_SK3_SKXCCM8_TLDS0_ULSGRO0_USL1_UIOFGRO0_USFGRO0_VSn1_VWA8_VWB4_WSGRA0_WSGRB0_WS64_WG32_8_1_WGM1_WGMXCC1_WGMXCCGn1
    SolutionIndex: 10
    SolutionNameMin: Cijk_Ailk_Bjlk_I8BH_UserArgs_MT256x128x64_MI16x16x1_SN_LDSB1_AFC0_AFEM1_AFEM1_ASEM1_CLR1_CADS0_DTVA0_DTVB0_EPS0_FDSI0_GRPM1_GRVWA8_GRVWB8_GSU0_GSUAMB_GSUC0_GSUWGMRR0_GLS0_ISA942_IU1_K1_LBSPPA2048_LBSPPB1024_LBSPPM0_LPA0_LPB64_LPM0_LRVW8_LWPMn1_MIAV0_MIWT8_4_MO40_NTn1_NTA0_NTB0_NTC0_NTD0_NTM0_NEPBS0_NLCA1_NLCB1_ONLL1_PGR2_PLR1_PKA1_SIA3_SS1_SU0_SUM0_SUS64_SPO0_SRVW0_SSO0_SVW8_SK3_SKXCCM8_TLDS0_ULSGRO0_USL1_UIOFGRO0_USFGRO0_VSn1_VWA8_VWB4_WSGRA0_WSGRB0_WS64_WG32_8_1_WGM1_WGMXCC1_WGMXCCGn1
    SolutionIndex: 11
    SolutionNameMin: Cijk_Ailk_Bjlk_I8BH_UserArgs_MT128x128x64_MI16x16x1_SN_LDSB1_AFC0_AFEM1_AFEM1_ASEM1_CLR1_CADS0_DTVA0_DTVB0_EPS0_FDSI0_GRPM1_GRVWA4_GRVWB4_GSU0_GSUAMB_GSUC0_GSUWGMRR0_GLS0_ISA942_IU1_K1_LBSPPA1024_LBSPPB1024_LBSPPM0_LPA64_LPB32_LPM0_LRVW8_LWPMn1_MIAV0_MIWT4_4_MO40_NTn1_NTA0_NTB0_NTC0_NTD0_NTM0_NEPBS0_NLCA1_NLCB1_ONLL1_PGR2_PLR1_PKA1_SIA3_SS1_SU0_SUM0_SUS64_SPO0_SRVW0_SSO0_SVW4_SK3_SKXCCM8_TLDS0_ULSGRO0_USL1_UIOFGRO0_USFGRO0_VSn1_VWA4_VWB2_WSGRA0_WSGRB0_WS64_WG32_8_1_WGM1_WGMXCC1_WGMXCCGn1
    SolutionIndex: 12
    SolutionNameMin: Cijk_Ailk_Bjlk_I8BH_UserArgs_MT128x128x64_MI16x16x1_SN_LDSB1_AFC0_AFEM1_AFEM1_ASEM1_CLR1_CADS0_DTVA0_DTVB0_EPS0_FDSI0_GRPM1_GRVWA4_GRVWB8_GSU0_GSUAMB_GSUC0_GSUWGMRR0_GLS0_ISA942_IU1_K1_LBSPPA1024_LBSPPB1024_LBSPPM0_LPA64_LPB32_LPM0_LRVW8_LWPMn1_MIAV0_MIWT4_4_MO40_NTn1_NTA0_NTB0_NTC0_NTD0_NTM0_NEPBS0_NLCA1_NLCB1_ONLL1_PGR2_PLR1_PKA1_SIA3_SS1_SU0_SUM0_SUS64_SPO0_SRVW0_SSO0_SVW4_SK3_SKXCCM8_TLDS0_ULSGRO0_USL1_UIOFGRO0_USFGRO0_VSn1_VWA4_VWB2_WSGRA0_WSGRB0_WS64_WG32_8_1_WGM1_WGMXCC1_WGMXCCGn1
    SolutionIndex: 13
    SolutionNameMin: Cijk_Ailk_Bjlk_I8BH_UserArgs_MT128x128x64_MI16x16x1_SN_LDSB1_AFC0_AFEM1_AFEM1_ASEM1_CLR1_CADS0_DTVA0_DTVB0_EPS0_FDSI0_GRPM1_GRVWA4_GRVWB8_GSU0_GSUAMB_GSUC0_GSUWGMRR0_GLS0_ISA942_IU1_K1_LBSPPA1024_LBSPPB1024_LBSPPM0_LPA64_LPB64_LPM0_LRVW8_LWPMn1_MIAV0_MIWT4_4_MO40_NTn1_NTA0_NTB0_NTC0_NTD0_NTM0_NEPBS0_NLCA1_NLCB1_ONLL1_PGR2_PLR1_PKA1_SIA3_SS1_SU0_SUM0_SUS64_SPO0_SRVW0_SSO0_SVW4_SK3_SKXCCM8_TLDS0_ULSGRO0_USL1_UIOFGRO0_USFGRO0_VSn1_VWA4_VWB4_WSGRA0_WSGRB0_WS64_WG32_8_1_WGM1_WGMXCC1_WGMXCCGn1
    SolutionIndex: 14
    SolutionNameMin: Cijk_Ailk_Bjlk_I8BH_UserArgs_MT64x128x64_MI16x16x1_SN_LDSB0_AFC0_AFEM1_AFEM1_ASEM1_CLR1_CADS0_DTVA0_DTVB0_EPS0_FDSI0_GRPM1_GRVWA4_GRVWB8_GSU0_GSUAMB_GSUC0_GSUWGMRR0_GLS0_ISA942_IU1_K1_LBSPPA512_LBSPPB1024_LBSPPM0_LPA32_LPB64_LPM0_LRVW8_LWPMn1_MIAV0_MIWT2_4_MO40_NTn1_NTA0_NTB0_NTC0_NTD0_NTM0_NEPBS0_NLCA1_NLCB1_ONLL1_PGR2_PLR1_PKA1_SIA3_SS1_SU0_SUM0_SUS64_SPO0_SRVW0_SSO0_SVW2_SK3_SKXCCM8_TLDS0_ULSGRO0_USL1_UIOFGRO0_USFGRO0_VSn1_VWA2_VWB4_WSGRA0_WSGRB0_WS64_WG32_8_1_WGM1_WGMXCC1_WGMXCCGn1
    SolutionIndex: 15
    SolutionNameMin: Cijk_Ailk_Bjlk_I8BH_UserArgs_MT64x128x64_MI16x16x1_SN_LDSB0_AFC0_AFEM1_AFEM1_ASEM1_CLR1_CADS0_DTVA0_DTVB0_EPS0_FDSI0_GRPM1_GRVWA4_GRVWB8_GSU0_GSUAMB_GSUC0_GSUWGMRR0_GLS0_ISA942_IU1_K1_LBSPPA512_LBSPPB1024_LBSPPM0_LPA32_LPB64_LPM0_LRVW8_LWPMn1_MIAV0_MIWT2_4_MO40_NTn1_NTA0_NTB0_NTC0_NTD0_NTM0_NEPBS0_NLCA1_NLCB1_ONLL1_PGR2_PLR1_PKA1_SIA3_SS1_SU0_SUM0_SUS64_SPO0_SRVW0_SSO0_SVW2_SK3_SKXCCM8_TLDS0_ULSGRO0_USL1_UIOFGRO0_USFGRO0_VSn1_VWA2_VWB4_WSGRA0_WSGRB0_WS64_WG32_8_1_WGM8_WGMXCC1_WGMXCCGn1
    SolutionIndex: 16
    SolutionNameMin: Cijk_Ailk_Bjlk_I8BH_UserArgs_MT128x64x64_MI16x16x1_SN_LDSB0_AFC0_AFEM1_AFEM1_ASEM1_CLR1_CADS0_DTVA0_DTVB0_EPS0_FDSI0_GRPM1_GRVWA4_GRVWB4_GSU0_GSUAMB_GSUC0_GSUWGMRR0_GLS0_ISA942_IU1_K1_LBSPPA1024_LBSPPB512_LBSPPM0_LPA64_LPB32_LPM0_LRVW8_LWPMn1_MIAV0_MIWT4_2_MO40_NTn1_NTA0_NTB0_NTC0_NTD0_NTM0_NEPBS0_NLCA1_NLCB1_ONLL1_PGR2_PLR1_PKA1_SIA3_SS1_SU0_SUM0_SUS64_SPO0_SRVW0_SSO0_SVW4_SK3_SKXCCM8_TLDS0_ULSGRO0_USL1_UIOFGRO0_USFGRO0_VSn1_VWA4_VWB2_WSGRA0_WSGRB0_WS64_WG32_8_1_WGM1_WGMXCC1_WGMXCCGn1
    SolutionIndex: 17
    SolutionNameMin: Cijk_Ailk_Bjlk_I8BH_UserArgs_MT128x64x64_MI16x16x1_SN_LDSB0_AFC0_AFEM1_AFEM1_ASEM1_CLR1_CADS0_DTVA0_DTVB0_EPS0_FDSI0_GRPM1_GRVWA4_GRVWB8_GSU0_GSUAMB_GSUC0_GSUWGMRR0_GLS0_ISA942_IU1_K1_LBSPPA1024_LBSPPB512_LBSPPM0_LPA64_LPB32_LPM0_LRVW8_LWPMn1_MIAV0_MIWT4_2_MO40_NTn1_NTA0_NTB0_NTC0_NTD0_NTM0_NEPBS0_NLCA1_NLCB1_ONLL1_PGR2_PLR1_PKA1_SIA3_SS1_SU0_SUM0_SUS64_SPO0_SRVW0_SSO0_SVW4_SK3_SKXCCM8_TLDS0_ULSGRO0_USL1_UIOFGRO0_USFGRO0_VSn1_VWA4_VWB2_WSGRA0_WSGRB0_WS64_WG32_8_1_WGM1_WGMXCC1_WGMXCCGn1
    SolutionIndex: 18
    SolutionNameMin: Cijk_Ailk_Bjlk_I8BH_UserArgs_MT64x64x64_MI16x16x1_SN_LDSB0_AFC0_AFEM1_AFEM1_ASEM1_CLR1_CADS0_DTVA0_DTVB0_EPS0_FDSI0_GRPM1_GRVWA4_GRVWB4_GSU0_GSUAMB_GSUC0_GSUWGMRR0_GLS0_ISA942_IU1_K1_LBSPPA512_LBSPPB512_LBSPPM0_LPA32_LPB32_LPM0_LRVW8_LWPMn1_MIAV0_MIWT2_2_MO40_NTn1_NTA0_NTB0_NTC0_NTD0_NTM0_NEPBS0_NLCA1_NLCB1_ONLL1_PGR2_PLR1_PKA1_SIA3_SS1_SU0_SUM0_SUS64_SPO0_SRVW0_SSO0_SVW2_SK3_SKXCCM8_TLDS0_ULSGRO0_USL1_UIOFGRO0_USFGRO0_VSn1_VWA2_VWB2_WSGRA0_WSGRB0_WS64_WG32_8_1_WGM1_WGMXCC1_WGMXCCGn1
    SolutionIndex: 19
    SolutionNameMin: Cijk_Ailk_Bjlk_I8BH_UserArgs_MT64x64x64_MI16x16x1_SN_LDSB0_AFC0_AFEM1_AFEM1_ASEM1_CLR1_CADS0_DTVA0_DTVB0_EPS0_FDSI0_GRPM1_GRVWA8_GRVWB4_GSU0_GSUAMB_GSUC0_GSUWGMRR0_GLS0_ISA942_IU1_K1_LBSPPA512_LBSPPB512_LBSPPM0_LPA32_LPB32_LPM0_LRVW8_LWPMn1_MIAV0_MIWT2_2_MO40_NTn1_NTA0_NTB0_NTC0_NTD0_NTM0_NEPBS0_NLCA1_NLCB1_ONLL1_PGR2_PLR1_PKA1_SIA3_SS1_SU0_SUM0_SUS64_SPO0_SRVW0_SSO0_SVW2_SK3_SKXCCM8_TLDS0_ULSGRO0_USL1_UIOFGRO0_USFGRO0_VSn1_VWA2_VWB2_WSGRA0_WSGRB0_WS64_WG32_8_1_WGM1_WGMXCC1_WGMXCCGn1
    SolutionIndex: 20
    SolutionNameMin: Cijk_Ailk_Bjlk_I8BH_UserArgs_MT64x64x64_MI16x16x1_SN_LDSB0_AFC0_AFEM1_AFEM1_ASEM1_CLR1_CADS0_DTVA0_DTVB0_EPS0_FDSI0_GRPM1_GRVWA4_GRVWB8_GSU0_GSUAMB_GSUC0_GSUWGMRR0_GLS0_ISA942_IU1_K1_LBSPPA512_LBSPPB512_LBSPPM0_LPA32_LPB32_LPM0_LRVW8_LWPMn1_MIAV0_MIWT2_2_MO40_NTn1_NTA0_NTB0_NTC0_NTD0_NTM0_NEPBS0_NLCA1_NLCB1_ONLL1_PGR2_PLR1_PKA1_SIA3_SS1_SU0_SUM0_SUS64_SPO0_SRVW0_SSO0_SVW2_SK3_SKXCCM8_TLDS0_ULSGRO0_USL1_UIOFGRO0_USFGRO0_VSn1_VWA2_VWB2_WSGRA0_WSGRB0_WS64_WG32_8_1_WGM1_WGMXCC1_WGMXCCGn1
    SolutionIndex: 21
    SolutionNameMin: Cijk_Ailk_Bjlk_I8BH_UserArgs_MT64x64x64_MI16x16x1_SN_LDSB0_AFC0_AFEM1_AFEM1_ASEM1_CLR1_CADS0_DTVA0_DTVB0_EPS0_FDSI0_GRPM1_GRVWA8_GRVWB8_GSU0_GSUAMB_GSUC0_GSUWGMRR0_GLS0_ISA942_IU1_K1_LBSPPA512_LBSPPB512_LBSPPM0_LPA32_LPB32_LPM0_LRVW8_LWPMn1_MIAV0_MIWT2_2_MO40_NTn1_NTA0_NTB0_NTC0_NTD0_NTM0_NEPBS0_NLCA1_NLCB1_ONLL1_PGR2_PLR1_PKA1_SIA3_SS1_SU0_SUM0_SUS64_SPO0_SRVW0_SSO0_SVW2_SK3_SKXCCM8_TLDS0_ULSGRO0_USL1_UIOFGRO0_USFGRO0_VSn1_VWA2_VWB2_WSGRA0_WSGRB0_WS64_WG32_8_1_WGM1_WGMXCC1_WGMXCCGn1
    SolutionIndex: 22
    SolutionNameMin: Cijk_Ailk_Bjlk_I8BH_UserArgs_MT64x64x64_MI16x16x1_SN_LDSB0_AFC0_AFEM1_AFEM1_ASEM1_CLR1_CADS0_DTVA0_DTVB0_EPS0_FDSI0_GRPM1_GRVWA8_GRVWB8_GSU0_GSUAMB_GSUC0_GSUWGMRR0_GLS0_ISA942_IU1_K1_LBSPPA512_LBSPPB512_LBSPPM0_LPA32_LPB32_LPM0_LRVW8_LWPMn1_MIAV0_MIWT2_2_MO40_NTn1_NTA0_NTB0_NTC0_NTD0_NTM0_NEPBS0_NLCA1_NLCB1_ONLL1_PGR2_PLR1_PKA1_SIA3_SS1_SU0_SUM0_SUS64_SPO0_SRVW0_SSO0_SVW2_SK3_SKXCCM8_TLDS0_ULSGRO0_USL1_UIOFGRO0_USFGRO0_VSn1_VWA2_VWB2_WSGRA0_WSGRB0_WS64_WG32_8_1_WGM8_WGMXCC1_WGMXCCGn1
    SolutionIndex: 23
    SolutionNameMin: Cijk_Ailk_Bjlk_I8BH_UserArgs_MT64x32x64_MI16x16x1_SN_LDSB0_AFC0_AFEM1_AFEM1_ASEM1_CLR1_CADS0_DTVA0_DTVB0_EPS0_FDSI0_GRPM1_GRVWA4_GRVWB2_GSU0_GSUAMB_GSUC0_GSUWGMRR0_GLS0_ISA942_IU1_K1_LBSPPA512_LBSPPB256_LBSPPM0_LPA32_LPB16_LPM0_LRVW8_LWPMn1_MIAV0_MIWT2_1_MO40_NTn1_NTA0_NTB0_NTC0_NTD0_NTM0_NEPBS0_NLCA1_NLCB1_ONLL1_PGR2_PLR1_PKA1_SIA3_SS1_SU0_SUM0_SUS64_SPO0_SRVW0_SSO0_SVW2_SK3_SKXCCM8_TLDS0_ULSGRO0_USL1_UIOFGRO0_USFGRO0_VSn1_VWA2_VWB1_WSGRA0_WSGRB0_WS64_WG32_8_1_WGM1_WGMXCC1_WGMXCCGn1
    SolutionIndex: 24
    SolutionNameMin: Cijk_Ailk_Bjlk_I8BH_UserArgs_MT64x32x64_MI16x16x1_SN_LDSB0_AFC0_AFEM1_AFEM1_ASEM1_CLR1_CADS0_DTVA0_DTVB0_EPS0_FDSI0_GRPM1_GRVWA4_GRVWB4_GSU0_GSUAMB_GSUC0_GSUWGMRR0_GLS0_ISA942_IU1_K1_LBSPPA512_LBSPPB256_LBSPPM0_LPA32_LPB16_LPM0_LRVW8_LWPMn1_MIAV0_MIWT2_1_MO40_NTn1_NTA0_NTB0_NTC0_NTD0_NTM0_NEPBS0_NLCA1_NLCB1_ONLL1_PGR2_PLR1_PKA1_SIA3_SS1_SU0_SUM0_SUS64_SPO0_SRVW0_SSO0_SVW2_SK3_SKXCCM8_TLDS0_ULSGRO0_USL1_UIOFGRO0_USFGRO0_VSn1_VWA2_VWB1_WSGRA0_WSGRB0_WS64_WG32_8_1_WGM1_WGMXCC1_WGMXCCGn1
    SolutionIndex: 25
    SolutionNameMin: Cijk_Ailk_Bjlk_I8BH_UserArgs_MT64x32x64_MI16x16x1_SN_LDSB0_AFC0_AFEM1_AFEM1_ASEM1_CLR1_CADS0_DTVA0_DTVB0_EPS0_FDSI0_GRPM1_GRVWA4_GRVWB8_GSU0_GSUAMB_GSUC0_GSUWGMRR0_GLS0_ISA942_IU1_K1_LBSPPA512_LBSPPB256_LBSPPM0_LPA32_LPB16_LPM0_LRVW8_LWPMn1_MIAV0_MIWT2_1_MO40_NTn1_NTA0_NTB0_NTC0_NTD0_NTM0_NEPBS0_NLCA1_NLCB1_ONLL1_PGR2_PLR1_PKA1_SIA3_SS1_SU0_SUM0_SUS64_SPO0_SRVW0_SSO0_SVW2_SK3_SKXCCM8_TLDS0_ULSGRO0_USL1_UIOFGRO0_USFGRO0_VSn1_VWA2_VWB1_WSGRA0_WSGRB0_WS64_WG32_8_1_WGM1_WGMXCC1_WGMXCCGn1
    SolutionIndex: 26
    SolutionNameMin: Cijk_Ailk_Bjlk_I8BH_UserArgs_MT32x32x64_MI16x16x1_SN_LDSB0_AFC0_AFEM1_AFEM1_ASEM1_CLR1_CADS0_DTVA0_DTVB0_EPS0_FDSI0_GRPM1_GRVWA4_GRVWB4_GSU0_GSUAMB_GSUC0_GSUWGMRR0_GLS0_ISA942_IU1_K1_LBSPPA256_LBSPPB256_LBSPPM0_LPA16_LPB16_LPM0_LRVW8_LWPMn1_MIAV0_MIWT1_1_MO40_NTn1_NTA0_NTB0_NTC0_NTD0_NTM0_NEPBS0_NLCA1_NLCB1_ONLL1_PGR2_PLR1_PKA1_SIA3_SS1_SU0_SUM0_SUS64_SPO0_SRVW0_SSO0_SVW1_SK3_SKXCCM8_TLDS0_ULSGRO0_USL1_UIOFGRO0_USFGRO0_VSn1_VWA1_VWB1_WSGRA0_WSGRB0_WS64_WG32_8_1_WGM1_WGMXCC1_WGMXCCGn1
    SolutionIndex: 27
    SolutionNameMin: Cijk_Ailk_Bjlk_I8BH_UserArgs_MT128x128x128_MI16x16x1_SN_LDSB1_AFC0_AFEM1_AFEM1_ASEM1_CLR1_CADS0_DTVA0_DTVB0_EPS0_FDSI0_GRPM1_GRVWA4_GRVWB4_GSU0_GSUAMB_GSUC0_GSUWGMRR0_GLS0_ISA942_IU1_K1_LBSPPA1024_LBSPPB1024_LBSPPM0_LPA64_LPB64_LPM0_LRVW8_LWPMn1_MIAV0_MIWT4_4_MO40_NTn1_NTA0_NTB0_NTC0_NTD0_NTM0_NEPBS0_NLCA1_NLCB1_ONLL1_PGR2_PLR2_PKA1_SIA3_SS1_SU0_SUM0_SUS128_SPO0_SRVW0_SSO0_SVW4_SK3_SKXCCM8_TLDS0_ULSGRO0_USL1_UIOFGRO0_USFGRO0_VSn1_VWA4_VWB4_WSGRA0_WSGRB0_WS64_WG32_8_1_WGM1_WGMXCC1_WGMXCCGn1
    SolutionIndex: 28
    SolutionNameMin: Cijk_Ailk_Bjlk_I8BH_UserArgs_MT128x64x128_MI16x16x1_SN_LDSB1_AFC0_AFEM1_AFEM1_ASEM1_CLR1_CADS0_DTVA0_DTVB0_EPS0_FDSI0_GRPM1_GRVWA4_GRVWB4_GSU0_GSUAMB_GSUC0_GSUWGMRR0_GLS0_ISA942_IU1_K1_LBSPPA1024_LBSPPB512_LBSPPM0_LPA64_LPB32_LPM0_LRVW8_LWPMn1_MIAV0_MIWT4_2_MO40_NTn1_NTA0_NTB0_NTC0_NTD0_NTM0_NEPBS0_NLCA1_NLCB1_ONLL1_PGR2_PLR1_PKA1_SIA3_SS1_SU0_SUM0_SUS128_SPO0_SRVW0_SSO0_SVW4_SK3_SKXCCM8_TLDS0_ULSGRO0_USL1_UIOFGRO0_USFGRO0_VSn1_VWA4_VWB2_WSGRA0_WSGRB0_WS64_WG32_8_1_WGM1_WGMXCC1_WGMXCCGn1
    SolutionIndex: 29
    SolutionNameMin: Cijk_Ailk_Bjlk_I8BH_UserArgs_MT128x64x128_MI16x16x1_SN_LDSB1_AFC0_AFEM1_AFEM1_ASEM1_CLR1_CADS0_DTVA0_DTVB0_EPS0_FDSI0_GRPM1_GRVWA4_GRVWB8_GSU0_GSUAMB_GSUC0_GSUWGMRR0_GLS0_ISA942_IU1_K1_LBSPPA1024_LBSPPB512_LBSPPM0_LPA64_LPB32_LPM0_LRVW8_LWPMn1_MIAV0_MIWT4_2_MO40_NTn1_NTA0_NTB0_NTC0_NTD0_NTM0_NEPBS0_NLCA1_NLCB1_ONLL1_PGR2_PLR2_PKA1_SIA3_SS1_SU0_SUM0_SUS128_SPO0_SRVW0_SSO0_SVW4_SK3_SKXCCM8_TLDS0_ULSGRO0_USL1_UIOFGRO0_USFGRO0_VSn1_VWA4_VWB2_WSGRA0_WSGRB0_WS64_WG32_8_1_WGM1_WGMXCC1_WGMXCCGn1
    SolutionIndex: 30
    SolutionNameMin: Cijk_Ailk_Bjlk_I8BH_UserArgs_MT64x64x128_MI16x16x1_SN_LDSB1_AFC0_AFEM1_AFEM1_ASEM1_CLR1_CADS0_DTVA0_DTVB0_EPS0_FDSI0_GRPM1_GRVWA4_GRVWB8_GSU0_GSUAMB_GSUC0_GSUWGMRR0_GLS0_ISA942_IU1_K1_LBSPPA512_LBSPPB512_LBSPPM0_LPA32_LPB32_LPM0_LRVW8_LWPMn1_MIAV0_MIWT2_2_MO40_NTn1_NTA0_NTB0_NTC0_NTD0_NTM0_NEPBS0_NLCA1_NLCB1_ONLL1_PGR2_PLR1_PKA1_SIA3_SS1_SU0_SUM0_SUS128_SPO0_SRVW0_SSO0_SVW2_SK3_SKXCCM8_TLDS0_ULSGRO0_USL1_UIOFGRO0_USFGRO0_VSn1_VWA2_VWB2_WSGRA0_WSGRB0_WS64_WG32_8_1_WGM1_WGMXCC1_WGMXCCGn1
    SolutionIndex: 31
    SolutionNameMin: Cijk_Ailk_Bjlk_I8BH_UserArgs_MT64x64x128_MI16x16x1_SN_LDSB1_AFC0_AFEM1_AFEM1_ASEM1_CLR1_CADS0_DTVA0_DTVB0_EPS0_FDSI0_GRPM1_GRVWA4_GRVWB8_GSU0_GSUAMB_GSUC0_GSUWGMRR0_GLS0_ISA942_IU1_K1_LBSPPA512_LBSPPB512_LBSPPM0_LPA32_LPB32_LPM0_LRVW8_LWPMn1_MIAV0_MIWT2_2_MO40_NTn1_NTA0_NTB0_NTC0_NTD0_NTM0_NEPBS0_NLCA1_NLCB1_ONLL1_PGR2_PLR2_PKA1_SIA3_SS1_SU0_SUM0_SUS128_SPO0_SRVW0_SSO0_SVW2_SK3_SKXCCM8_TLDS0_ULSGRO0_USL1_UIOFGRO0_USFGRO0_VSn1_VWA2_VWB2_WSGRA0_WSGRB0_WS64_WG32_8_1_WGM1_WGMXCC1_WGMXCCGn1
    SolutionIndex: 32
    SolutionNameMin: Cijk_Ailk_Bjlk_I8BH_UserArgs_MT64x64x128_MI16x16x1_SN_LDSB1_AFC0_AFEM1_AFEM1_ASEM1_CLR1_CADS0_DTVA0_DTVB0_EPS0_FDSI0_GRPM1_GRVWA4_GRVWB8_GSU0_GSUAMB_GSUC0_GSUWGMRR0_GLS0_ISA942_IU1_K1_LBSPPA512_LBSPPB512_LBSPPM0_LPA32_LPB32_LPM0_LRVW8_LWPMn1_MIAV0_MIWT2_2_MO40_NTn1_NTA0_NTB0_NTC0_NTD0_NTM0_NEPBS0_NLCA1_NLCB1_ONLL1_PGR2_PLR1_PKA1_SIA3_SS1_SU0_SUM0_SUS128_SPO0_SRVW0_SSO0_SVW2_SK3_SKXCCM8_TLDS0_ULSGRO0_USL1_UIOFGRO0_USFGRO0_VSn1_VWA2_VWB2_WSGRA0_WSGRB0_WS64_WG32_8_1_WGM4_WGMXCC1_WGMXCCGn1
    SolutionIndex: 33
    SolutionNameMin: Cijk_Ailk_Bjlk_I8BH_UserArgs_MT32x64x128_MI16x16x1_SN_LDSB0_AFC0_AFEM1_AFEM1_ASEM1_CLR1_CADS0_DTVA0_DTVB0_EPS0_FDSI0_GRPM1_GRVWA4_GRVWB8_GSU0_GSUAMB_GSUC0_GSUWGMRR0_GLS0_ISA942_IU1_K1_LBSPPA256_LBSPPB512_LBSPPM0_LPA16_LPB32_LPM0_LRVW8_LWPMn1_MIAV0_MIWT1_2_MO40_NTn1_NTA0_NTB0_NTC0_NTD0_NTM0_NEPBS0_NLCA1_NLCB1_ONLL1_PGR2_PLR2_PKA1_SIA3_SS1_SU0_SUM0_SUS128_SPO0_SRVW0_SSO0_SVW1_SK3_SKXCCM8_TLDS0_ULSGRO0_USL1_UIOFGRO0_USFGRO0_VSn1_VWA1_VWB2_WSGRA0_WSGRB0_WS64_WG32_8_1_WGM1_WGMXCC1_WGMXCCGn1
    SolutionIndex: 34
    SolutionNameMin: Cijk_Ailk_Bjlk_I8BH_UserArgs_MT64x32x128_MI16x16x1_SN_LDSB0_AFC0_AFEM1_AFEM1_ASEM1_CLR1_CADS0_DTVA0_DTVB0_EPS0_FDSI0_GRPM1_GRVWA4_GRVWB4_GSU0_GSUAMB_GSUC0_GSUWGMRR0_GLS0_ISA942_IU1_K1_LBSPPA512_LBSPPB256_LBSPPM0_LPA32_LPB16_LPM0_LRVW8_LWPMn1_MIAV0_MIWT2_1_MO40_NTn1_NTA0_NTB0_NTC0_NTD0_NTM0_NEPBS0_NLCA1_NLCB1_ONLL1_PGR2_PLR1_PKA1_SIA3_SS1_SU0_SUM0_SUS128_SPO0_SRVW0_SSO0_SVW2_SK3_SKXCCM8_TLDS0_ULSGRO0_USL1_UIOFGRO0_USFGRO0_VSn1_VWA2_VWB1_WSGRA0_WSGRB0_WS64_WG32_8_1_WGM1_WGMXCC1_WGMXCCGn1
    SolutionIndex: 35
    SolutionNameMin: Cijk_Ailk_Bjlk_I8BH_UserArgs_MT64x32x128_MI16x16x1_SN_LDSB0_AFC0_AFEM1_AFEM1_ASEM1_CLR1_CADS0_DTVA0_DTVB0_EPS0_FDSI0_GRPM1_GRVWA8_GRVWB4_GSU0_GSUAMB_GSUC0_GSUWGMRR0_GLS0_ISA942_IU1_K1_LBSPPA512_LBSPPB256_LBSPPM0_LPA32_LPB16_LPM0_LRVW8_LWPMn1_MIAV0_MIWT2_1_MO40_NTn1_NTA0_NTB0_NTC0_NTD0_NTM0_NEPBS0_NLCA1_NLCB1_ONLL1_PGR2_PLR1_PKA1_SIA3_SS1_SU0_SUM0_SUS128_SPO0_SRVW0_SSO0_SVW2_SK3_SKXCCM8_TLDS0_ULSGRO0_USL1_UIOFGRO0_USFGRO0_VSn1_VWA2_VWB1_WSGRA0_WSGRB0_WS64_WG32_8_1_WGM1_WGMXCC1_WGMXCCGn1
    SolutionIndex: 36
    SolutionNameMin: Cijk_Ailk_Bjlk_I8BH_UserArgs_MT64x32x128_MI16x16x1_SN_LDSB0_AFC0_AFEM1_AFEM1_ASEM1_CLR1_CADS0_DTVA0_DTVB0_EPS0_FDSI0_GRPM1_GRVWA4_GRVWB8_GSU0_GSUAMB_GSUC0_GSUWGMRR0_GLS0_ISA942_IU1_K1_LBSPPA512_LBSPPB256_LBSPPM0_LPA32_LPB16_LPM0_LRVW8_LWPMn1_MIAV0_MIWT2_1_MO40_NTn1_NTA0_NTB0_NTC0_NTD0_NTM0_NEPBS0_NLCA1_NLCB1_ONLL1_PGR2_PLR1_PKA1_SIA3_SS1_SU0_SUM0_SUS128_SPO0_SRVW0_SSO0_SVW2_SK3_SKXCCM8_TLDS0_ULSGRO0_USL1_UIOFGRO0_USFGRO0_VSn1_VWA2_VWB1_WSGRA0_WSGRB0_WS64_WG32_8_1_WGM1_WGMXCC1_WGMXCCGn1
    SolutionIndex: 37
    SolutionNameMin: Cijk_Ailk_Bjlk_I8BH_UserArgs_MT64x32x128_MI16x16x1_SN_LDSB0_AFC0_AFEM1_AFEM1_ASEM1_CLR1_CADS0_DTVA0_DTVB0_EPS0_FDSI0_GRPM1_GRVWA8_GRVWB8_GSU0_GSUAMB_GSUC0_GSUWGMRR0_GLS0_ISA942_IU1_K1_LBSPPA512_LBSPPB256_LBSPPM0_LPA32_LPB16_LPM0_LRVW8_LWPMn1_MIAV0_MIWT2_1_MO40_NTn1_NTA0_NTB0_NTC0_NTD0_NTM0_NEPBS0_NLCA1_NLCB1_ONLL1_PGR2_PLR1_PKA1_SIA3_SS1_SU0_SUM0_SUS128_SPO0_SRVW0_SSO0_SVW2_SK3_SKXCCM8_TLDS0_ULSGRO0_USL1_UIOFGRO0_USFGRO0_VSn1_VWA2_VWB1_WSGRA0_WSGRB0_WS64_WG32_8_1_WGM1_WGMXCC1_WGMXCCGn1
    SolutionIndex: 38
    SolutionNameMin: Cijk_Ailk_Bjlk_I8BH_UserArgs_MT64x32x128_MI16x16x1_SN_LDSB0_AFC0_AFEM1_AFEM1_ASEM1_CLR1_CADS0_DTVA0_DTVB0_EPS0_FDSI0_GRPM1_GRVWA4_GRVWB8_GSU0_GSUAMB_GSUC0_GSUWGMRR0_GLS0_ISA942_IU1_K1_LBSPPA512_LBSPPB256_LBSPPM0_LPA32_LPB16_LPM0_LRVW8_LWPMn1_MIAV0_MIWT2_1_MO40_NTn1_NTA0_NTB0_NTC0_NTD0_NTM0_NEPBS0_NLCA1_NLCB1_ONLL1_PGR2_PLR2_PKA1_SIA3_SS1_SU0_SUM0_SUS128_SPO0_SRVW0_SSO0_SVW2_SK3_SKXCCM8_TLDS0_ULSGRO0_USL1_UIOFGRO0_USFGRO0_VSn1_VWA2_VWB1_WSGRA0_WSGRB0_WS64_WG32_8_1_WGM1_WGMXCC1_WGMXCCGn1
    SolutionIndex: 39
    SolutionNameMin: Cijk_Ailk_Bjlk_I8BH_UserArgs_MT64x32x128_MI16x16x1_SN_LDSB0_AFC0_AFEM1_AFEM1_ASEM1_CLR1_CADS0_DTVA0_DTVB0_EPS0_FDSI0_GRPM1_GRVWA8_GRVWB8_GSU0_GSUAMB_GSUC0_GSUWGMRR0_GLS0_ISA942_IU1_K1_LBSPPA512_LBSPPB256_LBSPPM0_LPA32_LPB16_LPM0_LRVW8_LWPMn1_MIAV0_MIWT2_1_MO40_NTn1_NTA0_NTB0_NTC0_NTD0_NTM0_NEPBS0_NLCA1_NLCB1_ONLL1_PGR2_PLR1_PKA1_SIA3_SS1_SU0_SUM0_SUS128_SPO0_SRVW0_SSO0_SVW2_SK3_SKXCCM8_TLDS0_ULSGRO0_USL1_UIOFGRO0_USFGRO0_VSn1_VWA2_VWB1_WSGRA0_WSGRB0_WS64_WG32_8_1_WGM4_WGMXCC1_WGMXCCGn1
    SolutionIndex: 40
    SolutionNameMin: Cijk_Ailk_Bjlk_I8BH_UserArgs_MT64x32x128_MI16x16x1_SN_LDSB0_AFC0_AFEM1_AFEM1_ASEM1_CLR1_CADS0_DTVA0_DTVB0_EPS0_FDSI0_GRPM1_GRVWA4_GRVWB8_GSU0_GSUAMB_GSUC0_GSUWGMRR0_GLS0_ISA942_IU1_K1_LBSPPA512_LBSPPB256_LBSPPM0_LPA32_LPB16_LPM0_LRVW8_LWPMn1_MIAV0_MIWT2_1_MO40_NTn1_NTA0_NTB0_NTC0_NTD0_NTM0_NEPBS0_NLCA1_NLCB1_ONLL1_PGR2_PLR2_PKA1_SIA3_SS1_SU0_SUM0_SUS128_SPO0_SRVW0_SSO0_SVW2_SK3_SKXCCM8_TLDS0_ULSGRO0_USL1_UIOFGRO0_USFGRO0_VSn1_VWA2_VWB1_WSGRA0_WSGRB0_WS64_WG32_8_1_WGM4_WGMXCC1_WGMXCCGn1
    SolutionIndex: 41
    SolutionNameMin: Cijk_Ailk_Bjlk_I8BH_UserArgs_MT32x32x128_MI16x16x1_SN_LDSB0_AFC0_AFEM1_AFEM1_ASEM1_CLR1_CADS0_DTVA0_DTVB0_EPS0_FDSI0_GRPM1_GRVWA8_GRVWB4_GSU0_GSUAMB_GSUC0_GSUWGMRR0_GLS0_ISA942_IU1_K1_LBSPPA256_LBSPPB256_LBSPPM0_LPA16_LPB16_LPM0_LRVW8_LWPMn1_MIAV0_MIWT1_1_MO40_NTn1_NTA0_NTB0_NTC0_NTD0_NTM0_NEPBS0_NLCA1_NLCB1_ONLL1_PGR2_PLR1_PKA1_SIA3_SS1_SU0_SUM0_SUS128_SPO0_SRVW0_SSO0_SVW1_SK3_SKXCCM8_TLDS0_ULSGRO0_USL1_UIOFGRO0_USFGRO0_VSn1_VWA1_VWB1_WSGRA0_WSGRB0_WS64_WG32_8_1_WGM1_WGMXCC1_WGMXCCGn1
    SolutionIndex: 42
    SolutionNameMin: Cijk_Ailk_Bjlk_I8BH_UserArgs_MT32x32x128_MI16x16x1_SN_LDSB0_AFC0_AFEM1_AFEM1_ASEM1_CLR1_CADS0_DTVA0_DTVB0_EPS0_FDSI0_GRPM1_GRVWA8_GRVWB8_GSU0_GSUAMB_GSUC0_GSUWGMRR0_GLS0_ISA942_IU1_K1_LBSPPA256_LBSPPB256_LBSPPM0_LPA16_LPB16_LPM0_LRVW8_LWPMn1_MIAV0_MIWT1_1_MO40_NTn1_NTA0_NTB0_NTC0_NTD0_NTM0_NEPBS0_NLCA1_NLCB1_ONLL1_PGR2_PLR1_PKA1_SIA3_SS1_SU0_SUM0_SUS128_SPO0_SRVW0_SSO0_SVW1_SK3_SKXCCM8_TLDS0_ULSGRO0_USL1_UIOFGRO0_USFGRO0_VSn1_VWA1_VWB1_WSGRA0_WSGRB0_WS64_WG32_8_1_WGM1_WGMXCC1_WGMXCCGn1
    SolutionIndex: 43
    SolutionNameMin: Cijk_Ailk_Bjlk_I8BH_UserArgs_MT32x32x128_MI16x16x1_SN_LDSB0_AFC0_AFEM1_AFEM1_ASEM1_CLR1_CADS0_DTVA0_DTVB0_EPS0_FDSI0_GRPM1_GRVWA4_GRVWB8_GSU0_GSUAMB_GSUC0_GSUWGMRR0_GLS0_ISA942_IU1_K1_LBSPPA256_LBSPPB256_LBSPPM0_LPA16_LPB16_LPM0_LRVW8_LWPMn1_MIAV0_MIWT1_1_MO40_NTn1_NTA0_NTB0_NTC0_NTD0_NTM0_NEPBS0_NLCA1_NLCB1_ONLL1_PGR2_PLR2_PKA1_SIA3_SS1_SU0_SUM0_SUS128_SPO0_SRVW0_SSO0_SVW1_SK3_SKXCCM8_TLDS0_ULSGRO0_USL1_UIOFGRO0_USFGRO0_VSn1_VWA1_VWB1_WSGRA0_WSGRB0_WS64_WG32_8_1_WGM1_WGMXCC1_WGMXCCGn1
    SolutionIndex: 44
    SolutionNameMin: Cijk_Ailk_Bjlk_I8BH_UserArgs_MT32x32x128_MI16x16x1_SN_LDSB0_AFC0_AFEM1_AFEM1_ASEM1_CLR1_CADS0_DTVA0_DTVB0_EPS0_FDSI0_GRPM1_GRVWA8_GRVWB8_GSU0_GSUAMB_GSUC0_GSUWGMRR0_GLS0_ISA942_IU1_K1_LBSPPA256_LBSPPB256_LBSPPM0_LPA16_LPB16_LPM0_LRVW8_LWPMn1_MIAV0_MIWT1_1_MO40_NTn1_NTA0_NTB0_NTC0_NTD0_NTM0_NEPBS0_NLCA1_NLCB1_ONLL1_PGR2_PLR2_PKA1_SIA3_SS1_SU0_SUM0_SUS128_SPO0_SRVW0_SSO0_SVW1_SK3_SKXCCM8_TLDS0_ULSGRO0_USL1_UIOFGRO0_USFGRO0_VSn1_VWA1_VWB1_WSGRA0_WSGRB0_WS64_WG32_8_1_WGM1_WGMXCC1_WGMXCCGn1
    SolutionIndex: 45
    SolutionNameMin: Cijk_Ailk_Bjlk_I8BH_UserArgs_MT32x32x128_MI16x16x1_SN_LDSB0_AFC0_AFEM1_AFEM1_ASEM1_CLR1_CADS0_DTVA0_DTVB0_EPS0_FDSI0_GRPM1_GRVWA8_GRVWB8_GSU0_GSUAMB_GSUC0_GSUWGMRR0_GLS0_ISA942_IU1_K1_LBSPPA256_LBSPPB256_LBSPPM0_LPA16_LPB16_LPM0_LRVW8_LWPMn1_MIAV0_MIWT1_1_MO40_NTn1_NTA0_NTB0_NTC0_NTD0_NTM0_NEPBS0_NLCA1_NLCB1_ONLL1_PGR2_PLR2_PKA1_SIA3_SS1_SU0_SUM0_SUS128_SPO0_SRVW0_SSO0_SVW1_SK3_SKXCCM8_TLDS0_ULSGRO0_USL1_UIOFGRO0_USFGRO0_VSn1_VWA1_VWB1_WSGRA0_WSGRB0_WS64_WG32_8_1_WGM8_WGMXCC1_WGMXCCGn1
    SolutionIndex: 46
    SolutionNameMin: Cijk_Ailk_Bjlk_I8BH_UserArgs_MT128x64x256_MI16x16x1_SN_LDSB1_AFC0_AFEM1_AFEM1_ASEM1_CLR1_CADS0_DTVA0_DTVB0_EPS0_FDSI0_GRPM1_GRVWA4_GRVWB4_GSU0_GSUAMB_GSUC0_GSUWGMRR0_GLS0_ISA942_IU1_K1_LBSPPA1024_LBSPPB512_LBSPPM0_LPA64_LPB32_LPM0_LRVW8_LWPMn1_MIAV0_MIWT4_2_MO40_NTn1_NTA0_NTB0_NTC0_NTD0_NTM0_NEPBS0_NLCA1_NLCB1_ONLL1_PGR2_PLR2_PKA1_SIA3_SS1_SU0_SUM0_SUS256_SPO0_SRVW0_SSO0_SVW4_SK3_SKXCCM8_TLDS0_ULSGRO0_USL1_UIOFGRO0_USFGRO0_VSn1_VWA4_VWB2_WSGRA0_WSGRB0_WS64_WG32_8_1_WGM1_WGMXCC1_WGMXCCGn1
    SolutionIndex: 47
    SolutionNameMin: Cijk_Ailk_Bjlk_I8BH_UserArgs_MT64x64x256_MI16x16x1_SN_LDSB1_AFC0_AFEM1_AFEM1_ASEM1_CLR1_CADS0_DTVA0_DTVB0_EPS0_FDSI0_GRPM1_GRVWA4_GRVWB8_GSU0_GSUAMB_GSUC0_GSUWGMRR0_GLS0_ISA942_IU1_K1_LBSPPA512_LBSPPB512_LBSPPM0_LPA32_LPB32_LPM0_LRVW8_LWPMn1_MIAV0_MIWT2_2_MO40_NTn1_NTA0_NTB0_NTC0_NTD0_NTM0_NEPBS0_NLCA1_NLCB1_ONLL1_PGR2_PLR2_PKA1_SIA3_SS1_SU0_SUM0_SUS256_SPO0_SRVW0_SSO0_SVW2_SK3_SKXCCM8_TLDS0_ULSGRO0_USL1_UIOFGRO0_USFGRO0_VSn1_VWA2_VWB2_WSGRA0_WSGRB0_WS64_WG32_8_1_WGM1_WGMXCC1_WGMXCCGn1
    SolutionIndex: 48
    SolutionNameMin: Cijk_Ailk_Bjlk_I8BH_UserArgs_MT64x32x256_MI16x16x1_SN_LDSB1_AFC0_AFEM1_AFEM1_ASEM1_CLR1_CADS0_DTVA0_DTVB0_EPS0_FDSI0_GRPM1_GRVWA4_GRVWB8_GSU0_GSUAMB_GSUC0_GSUWGMRR0_GLS0_ISA942_IU1_K1_LBSPPA512_LBSPPB256_LBSPPM0_LPA32_LPB16_LPM0_LRVW8_LWPMn1_MIAV0_MIWT2_1_MO40_NTn1_NTA0_NTB0_NTC0_NTD0_NTM0_NEPBS0_NLCA1_NLCB1_ONLL1_PGR2_PLR2_PKA1_SIA3_SS1_SU0_SUM0_SUS256_SPO0_SRVW0_SSO0_SVW2_SK3_SKXCCM8_TLDS0_ULSGRO0_USL1_UIOFGRO0_USFGRO0_VSn1_VWA2_VWB1_WSGRA0_WSGRB0_WS64_WG32_8_1_WGM1_WGMXCC1_WGMXCCGn1
    SolutionIndex: 49
    SolutionNameMin: Cijk_Ailk_Bjlk_I8BH_UserArgs_MT32x32x32_MI16x16x1_SN_LDSB0_AFC0_AFEM1_AFEM1_ASEM1_CLR0_CADS0_DTVA0_DTVB0_EPS0_FDSI0_GRPM1_GRVWA1_GRVWB1_GSU0_GSUAMB_GSUC0_GSUWGMRR0_GLS0_ISA942_IU1_K1_LBSPPA256_LBSPPB256_LBSPPM0_LPA16_LPB16_LPM0_LRVW8_LWPMn1_MIAV0_MIWT1_1_MO40_NTn1_NTA0_NTB0_NTC0_NTD0_NTM0_NEPBS0_NLCA1_NLCB1_ONLL1_PGR2_PLR0_PKA1_SIA3_SS1_SU32_SUM0_SUS256_SPO0_SRVW0_SSO0_SVW1_SK3_SKXCCM0_TLDS0_ULSGRO0_USL1_UIOFGRO0_USFGROn1_VSn1_VWA1_VWB1_WSGRA0_WSGRB0_WS64_WG32_8_1_WGM1_WGMXCC1_WGMXCCGn1
- - - [128, 128, 1, 128, 128, 128, 128, 128]
    - [26, 0.6]
  - - [128, 128, 1, 256, 128, 128, 128, 128]
    - [26, 1.03]
  - - [128, 128, 1, 512, 128, 128, 128, 128]
    - [42, 1.65]
  - - [128, 128, 1, 1024, 128, 128, 128, 128]
    - [42, 2.38]
  - - [128, 128, 1, 2048, 128, 128, 128, 128]
    - [42, 3.07]
  - - [128, 128, 1, 4096, 128, 128, 128, 128]
    - [42, 3.58]
  - - [128, 128, 1, 8192, 128, 128, 128, 128]
    - [4, 3.93]
  - - [128, 256, 1, 128, 128, 128, 128, 256]
    - [26, 1.18]
  - - [128, 256, 1, 256, 128, 128, 128, 256]
    - [26, 2.02]
  - - [128, 256, 1, 512, 128, 128, 128, 256]
    - [42, 3.26]
  - - [128, 256, 1, 1024, 128, 128, 128, 256]
    - [42, 4.74]
  - - [128, 256, 1, 2048, 128, 128, 128, 256]
    - [42, 6.12]
  - - [128, 256, 1, 4096, 128, 128, 128, 256]
    - [42, 7.12]
  - - [128, 256, 1, 8192, 128, 128, 128, 256]
    - [4, 7.94]
  - - [128, 512, 1, 128, 128, 128, 128, 512]
    - [26, 2.33]
  - - [128, 512, 1, 256, 128, 128, 128, 512]
    - [26, 4.01]
  - - [128, 512, 1, 512, 128, 128, 128, 512]
    - [43, 6.38]
  - - [128, 512, 1, 1024, 128, 128, 128, 512]
    - [44, 9.32]
  - - [128, 512, 1, 2048, 128, 128, 128, 512]
    - [44, 12.07]
  - - [128, 512, 1, 4096, 128, 128, 128, 512]
    - [44, 14.11]
  - - [128, 512, 1, 8192, 128, 128, 128, 512]
    - [44, 15.49]
  - - [128, 1024, 1, 128, 128, 128, 128, 1024]
    - [23, 4.37]
  - - [128, 1024, 1, 256, 128, 128, 128, 1024]
    - [24, 7.39]
  - - [128, 1024, 1, 512, 128, 128, 128, 1024]
    - [34, 11.61]
  - - [128, 1024, 1, 1024, 128, 128, 128, 1024]
    - [38, 16.46]
  - - [128, 1024, 1, 2048, 128, 128, 128, 1024]
    - [38, 20.89]
  - - [128, 1024, 1, 4096, 128, 128, 128, 1024]
    - [33, 24.07]
  - - [128, 1024, 1, 8192, 128, 128, 128, 1024]
    - [48, 26.0]
  - - [128, 2048, 1, 128, 128, 128, 128, 2048]
    - [18, 7.93]
  - - [128, 2048, 1, 256, 128, 128, 128, 2048]
    - [18, 13.2]
  - - [128, 2048, 1, 512, 128, 128, 128, 2048]
    - [31, 20.61]
  - - [128, 2048, 1, 1024, 128, 128, 128, 2048]
    - [30, 28.84]
  - - [128, 2048, 1, 2048, 128, 128, 128, 2048]
    - [30, 35.53]
  - - [128, 2048, 1, 4096, 128, 128, 128, 2048]
    - [30, 40.93]
  - - [128, 2048, 1, 8192, 128, 128, 128, 2048]
    - [30, 44.31]
  - - [128, 4096, 1, 128, 128, 128, 128, 4096]
    - [17, 13.6]
  - - [128, 4096, 1, 256, 128, 128, 128, 4096]
    - [17, 22.65]
  - - [128, 4096, 1, 512, 128, 128, 128, 4096]
    - [29, 34.29]
  - - [128, 4096, 1, 1024, 128, 128, 128, 4096]
    - [29, 45.9]
  - - [128, 4096, 1, 2048, 128, 128, 128, 4096]
    - [29, 56.91]
  - - [128, 4096, 1, 4096, 128, 128, 128, 4096]
    - [29, 64.91]
  - - [128, 4096, 1, 8192, 128, 128, 128, 4096]
    - [29, 69.71]
  - - [128, 8192, 1, 128, 128, 128, 128, 8192]
    - [12, 21.3]
  - - [128, 8192, 1, 256, 128, 128, 128, 8192]
    - [13, 35.19]
  - - [128, 8192, 1, 512, 128, 128, 128, 8192]
    - [13, 52.28]
  - - [128, 8192, 1, 1024, 128, 128, 128, 8192]
    - [13, 68.8]
  - - [128, 8192, 1, 2048, 128, 128, 128, 8192]
    - [13, 82.25]
  - - [128, 8192, 1, 4096, 128, 128, 128, 8192]
    - [13, 91.4]
  - - [128, 8192, 1, 8192, 128, 128, 128, 8192]
    - [13, 95.17]
  - - [256, 128, 1, 128, 256, 256, 256, 128]
    - [26, 1.18]
  - - [256, 128, 1, 256, 256, 256, 256, 128]
    - [41, 2.02]
  - - [256, 128, 1, 512, 256, 256, 256, 128]
    - [44, 3.27]
  - - [256, 128, 1, 1024, 256, 256, 256, 128]
    - [42, 4.74]
  - - [256, 128, 1, 2048, 256, 256, 256, 128]
    - [44, 6.11]
  - - [256, 128, 1, 4096, 256, 256, 256, 128]
    - [42, 7.14]
  - - [256, 128, 1, 8192, 256, 256, 256, 128]
    - [4, 7.93]
  - - [256, 256, 1, 128, 256, 256, 256, 256]
    - [26, 2.33]
  - - [256, 256, 1, 256, 256, 256, 256, 256]
    - [42, 4.01]
  - - [256, 256, 1, 512, 256, 256, 256, 256]
    - [44, 6.47]
  - - [256, 256, 1, 1024, 256, 256, 256, 256]
    - [44, 9.41]
  - - [256, 256, 1, 2048, 256, 256, 256, 256]
    - [42, 12.16]
  - - [256, 256, 1, 4096, 256, 256, 256, 256]
    - [42, 14.18]
  - - [256, 256, 1, 8192, 256, 256, 256, 256]
    - [42, 15.44]
  - - [256, 512, 1, 128, 256, 256, 256, 512]
    - [35, 4.33]
  - - [256, 512, 1, 256, 256, 256, 256, 512]
    - [24, 7.39]
  - - [256, 512, 1, 512, 256, 256, 256, 512]
    - [34, 11.6]
  - - [256, 512, 1, 1024, 256, 256, 256, 512]
    - [33, 16.47]
  - - [256, 512, 1, 2048, 256, 256, 256, 512]
    - [33, 20.9]
  - - [256, 512, 1, 4096, 256, 256, 256, 512]
    - [37, 23.99]
  - - [256, 512, 1, 8192, 256, 256, 256, 512]
    - [48, 26.01]
  - - [256, 1024, 1, 128, 256, 256, 256, 1024]
    - [18, 7.91]
  - - [256, 1024, 1, 256, 256, 256, 256, 1024]
    - [18, 13.28]
  - - [256, 1024, 1, 512, 256, 256, 256, 1024]
    - [31, 20.63]
  - - [256, 1024, 1, 1024, 256, 256, 256, 1024]
    - [30, 28.85]
  - - [256, 1024, 1, 2048, 256, 256, 256, 1024]
    - [30, 36.25]
  - - [256, 1024, 1, 4096, 256, 256, 256, 1024]
    - [47, 41.89]
  - - [256, 1024, 1, 8192, 256, 256, 256, 1024]
    - [30, 44.32]
  - - [256, 2048, 1, 128, 256, 256, 256, 2048]
    - [17, 13.61]
  - - [256, 2048, 1, 256, 256, 256, 256, 2048]
    - [17, 22.7]
  - - [256, 2048, 1, 512, 256, 256, 256, 2048]
    - [29, 34.35]
  - - [256, 2048, 1, 1024, 256, 256, 256, 2048]
    - [29, 47.25]
  - - [256, 2048, 1, 2048, 256, 256, 256, 2048]
    - [29, 57.22]
  - - [256, 2048, 1, 4096, 256, 256, 256, 2048]
    - [29, 65.06]
  - - [256, 2048, 1, 8192, 256, 256, 256, 2048]
    - [29, 69.84]
  - - [256, 4096, 1, 128, 256, 256, 256, 4096]
    - [12, 21.22]
  - - [256, 4096, 1, 256, 256, 256, 256, 4096]
    - [13, 35.07]
  - - [256, 4096, 1, 512, 256, 256, 256, 4096]
    - [13, 52.19]
  - - [256, 4096, 1, 1024, 256, 256, 256, 4096]
    - [13, 68.94]
  - - [256, 4096, 1, 2048, 256, 256, 256, 4096]
    - [27, 82.89]
  - - [256, 4096, 1, 4096, 256, 256, 256, 4096]
    - [27, 92.79]
  - - [256, 4096, 1, 8192, 256, 256, 256, 4096]
    - [27, 98.79]
  - - [256, 8192, 1, 128, 256, 256, 256, 8192]
    - [9, 30.71]
  - - [256, 8192, 1, 256, 256, 256, 256, 8192]
    - [9, 50.96]
  - - [256, 8192, 1, 512, 256, 256, 256, 8192]
    - [9, 75.05]
  - - [256, 8192, 1, 1024, 256, 256, 256, 8192]
    - [10, 98.83]
  - - [256, 8192, 1, 2048, 256, 256, 256, 8192]
    - [10, 118.58]
  - - [256, 8192, 1, 4096, 256, 256, 256, 8192]
    - [10, 131.49]
  - - [256, 8192, 1, 8192, 256, 256, 256, 8192]
    - [10, 138.99]
  - - [512, 128, 1, 128, 512, 512, 512, 128]
    - [26, 2.32]
  - - [512, 128, 1, 256, 512, 512, 512, 128]
    - [26, 3.99]
  - - [512, 128, 1, 512, 512, 512, 512, 128]
    - [44, 6.43]
  - - [512, 128, 1, 1024, 512, 512, 512, 128]
    - [44, 9.35]
  - - [512, 128, 1, 2048, 512, 512, 512, 128]
    - [44, 12.02]
  - - [512, 128, 1, 4096, 512, 512, 512, 128]
    - [44, 14.13]
  - - [512, 128, 1, 8192, 512, 512, 512, 128]
    - [45, 15.39]
  - - [512, 256, 1, 128, 512, 512, 512, 256]
    - [25, 4.35]
  - - [512, 256, 1, 256, 512, 512, 512, 256]
    - [24, 7.43]
  - - [512, 256, 1, 512, 512, 512, 512, 256]
    - [37, 11.65]
  - - [512, 256, 1, 1024, 512, 512, 512, 256]
    - [38, 16.51]
  - - [512, 256, 1, 2048, 512, 512, 512, 256]
    - [38, 20.86]
  - - [512, 256, 1, 4096, 512, 512, 512, 256]
    - [38, 24.06]
  - - [512, 256, 1, 8192, 512, 512, 512, 256]
    - [39, 25.76]
  - - [512, 512, 1, 128, 512, 512, 512, 512]
    - [19, 7.86]
  - - [512, 512, 1, 256, 512, 512, 512, 512]
    - [18, 13.26]
  - - [512, 512, 1, 512, 512, 512, 512, 512]
    - [31, 20.57]
  - - [512, 512, 1, 1024, 512, 512, 512, 512]
    - [31, 28.85]
  - - [512, 512, 1, 2048, 512, 512, 512, 512]
    - [30, 36.11]
  - - [512, 512, 1, 4096, 512, 512, 512, 512]
    - [30, 41.26]
  - - [512, 512, 1, 8192, 512, 512, 512, 512]
    - [21, 40.96]
  - - [512, 1024, 1, 128, 512, 512, 512, 1024]
    - [28, 13.51]
  - - [512, 1024, 1, 256, 512, 512, 512, 1024]
    - [17, 22.68]
  - - [512, 1024, 1, 512, 512, 512, 512, 1024]
    - [29, 34.34]
  - - [512, 1024, 1, 1024, 512, 512, 512, 1024]
    - [29, 47.08]
  - - [512, 1024, 1, 2048, 512, 512, 512, 1024]
    - [46, 58.06]
  - - [512, 1024, 1, 4096, 512, 512, 512, 1024]
    - [29, 63.65]
  - - [512, 1024, 1, 8192, 512, 512, 512, 1024]
    - [15, 66.67]
  - - [512, 2048, 1, 128, 512, 512, 512, 2048]
    - [13, 21.21]
  - - [512, 2048, 1, 256, 512, 512, 512, 2048]
    - [13, 35.14]
  - - [512, 2048, 1, 512, 512, 512, 512, 2048]
    - [13, 52.37]
  - - [512, 2048, 1, 1024, 512, 512, 512, 2048]
    - [13, 69.45]
  - - [512, 2048, 1, 2048, 512, 512, 512, 2048]
    - [13, 82.62]
  - - [512, 2048, 1, 4096, 512, 512, 512, 2048]
    - [13, 91.35]
  - - [512, 2048, 1, 8192, 512, 512, 512, 2048]
    - [13, 96.66]
  - - [512, 4096, 1, 128, 512, 512, 512, 4096]
    - [9, 30.9]
  - - [512, 4096, 1, 256, 512, 512, 512, 4096]
    - [9, 50.92]
  - - [512, 4096, 1, 512, 512, 512, 512, 4096]
    - [9, 74.71]
  - - [512, 4096, 1, 1024, 512, 512, 512, 4096]
    - [10, 98.91]
  - - [512, 4096, 1, 2048, 512, 512, 512, 4096]
    - [10, 118.66]
  - - [512, 4096, 1, 4096, 512, 512, 512, 4096]
    - [10, 131.54]
  - - [512, 4096, 1, 8192, 512, 512, 512, 4096]
    - [10, 139.13]
  - - [512, 8192, 1, 128, 512, 512, 512, 8192]
    - [1, 39.02]
  - - [512, 8192, 1, 256, 512, 512, 512, 8192]
    - [6, 63.64]
  - - [512, 8192, 1, 512, 512, 512, 512, 8192]
    - [6, 93.96]
  - - [512, 8192, 1, 1024, 512, 512, 512, 8192]
    - [5, 123.2]
  - - [512, 8192, 1, 2048, 512, 512, 512, 8192]
    - [6, 146.12]
  - - [512, 8192, 1, 4096, 512, 512, 512, 8192]
    - [6, 161.2]
  - - [512, 8192, 1, 8192, 512, 512, 512, 8192]
    - [8, 169.84]
  - - [1024, 128, 1, 128, 1024, 1024, 1024, 128]
    - [24, 4.31]
  - - [1024, 128, 1, 256, 1024, 1024, 1024, 128]
    - [25, 7.27]
  - - [1024, 128, 1, 512, 1024, 1024, 1024, 128]
    - [36, 11.72]
  - - [1024, 128, 1, 1024, 1024, 1024, 1024, 128]
    - [36, 16.37]
  - - [1024, 128, 1, 2048, 1024, 1024, 1024, 128]
    - [37, 20.73]
  - - [1024, 128, 1, 4096, 1024, 1024, 1024, 128]
    - [40, 23.75]
  - - [1024, 128, 1, 8192, 1024, 1024, 1024, 128]
    - [37, 25.68]
  - - [1024, 256, 1, 128, 1024, 1024, 1024, 256]
    - [18, 7.8]
  - - [1024, 256, 1, 256, 1024, 1024, 1024, 256]
    - [18, 12.94]
  - - [1024, 256, 1, 512, 1024, 1024, 1024, 256]
    - [31, 20.41]
  - - [1024, 256, 1, 1024, 1024, 1024, 1024, 256]
    - [30, 28.72]
  - - [1024, 256, 1, 2048, 1024, 1024, 1024, 256]
    - [30, 36.19]
  - - [1024, 256, 1, 4096, 1024, 1024, 1024, 256]
    - [32, 41.0]
  - - [1024, 256, 1, 8192, 1024, 1024, 1024, 256]
    - [22, 40.44]
  - - [1024, 512, 1, 128, 1024, 1024, 1024, 512]
    - [16, 13.46]
  - - [1024, 512, 1, 256, 1024, 1024, 1024, 512]
    - [17, 22.54]
  - - [1024, 512, 1, 512, 1024, 1024, 1024, 512]
    - [29, 34.1]
  - - [1024, 512, 1, 1024, 1024, 1024, 1024, 512]
    - [29, 46.99]
  - - [1024, 512, 1, 2048, 1024, 1024, 1024, 512]
    - [46, 57.98]
  - - [1024, 512, 1, 4096, 1024, 1024, 1024, 512]
    - [14, 62.67]
  - - [1024, 512, 1, 8192, 1024, 1024, 1024, 512]
    - [14, 66.81]
  - - [1024, 1024, 1, 128, 1024, 1024, 1024, 1024]
    - [11, 21.25]
  - - [1024, 1024, 1, 256, 1024, 1024, 1024, 1024]
    - [13, 35.01]
  - - [1024, 1024, 1, 512, 1024, 1024, 1024, 1024]
    - [13, 52.3]
  - - [1024, 1024, 1, 1024, 1024, 1024, 1024, 1024]
    - [13, 69.19]
  - - [1024, 1024, 1, 2048, 1024, 1024, 1024, 1024]
    - [27, 83.05]
  - - [1024, 1024, 1, 4096, 1024, 1024, 1024, 1024]
    - [13, 91.22]
  - - [1024, 1024, 1, 8192, 1024, 1024, 1024, 1024]
    - [13, 96.53]
  - - [1024, 2048, 1, 128, 1024, 1024, 1024, 2048]
    - [9, 30.75]
  - - [1024, 2048, 1, 256, 1024, 1024, 1024, 2048]
    - [9, 50.18]
  - - [1024, 2048, 1, 512, 1024, 1024, 1024, 2048]
    - [9, 74.82]
  - - [1024, 2048, 1, 1024, 1024, 1024, 1024, 2048]
    - [10, 98.51]
  - - [1024, 2048, 1, 2048, 1024, 1024, 1024, 2048]
    - [10, 118.2]
  - - [1024, 2048, 1, 4096, 1024, 1024, 1024, 2048]
    - [10, 131.3]
  - - [1024, 2048, 1, 8192, 1024, 1024, 1024, 2048]
    - [10, 139.16]
  - - [1024, 4096, 1, 128, 1024, 1024, 1024, 4096]
    - [1, 39.13]
  - - [1024, 4096, 1, 256, 1024, 1024, 1024, 4096]
    - [6, 63.84]
  - - [1024, 4096, 1, 512, 1024, 1024, 1024, 4096]
    - [6, 94.1]
  - - [1024, 4096, 1, 1024, 1024, 1024, 1024, 4096]
    - [6, 123.02]
  - - [1024, 4096, 1, 2048, 1024, 1024, 1024, 4096]
    - [6, 146.17]
  - - [1024, 4096, 1, 4096, 1024, 1024, 1024, 4096]
    - [6, 161.3]
  - - [1024, 4096, 1, 8192, 1024, 1024, 1024, 4096]
    - [6, 169.86]
  - - [1024, 8192, 1, 128, 1024, 1024, 1024, 8192]
    - [1, 41.68]
  - - [1024, 8192, 1, 256, 1024, 1024, 1024, 8192]
    - [5, 67.49]
  - - [1024, 8192, 1, 512, 1024, 1024, 1024, 8192]
    - [5, 98.19]
  - - [1024, 8192, 1, 1024, 1024, 1024, 1024, 8192]
    - [5, 127.01]
  - - [1024, 8192, 1, 2048, 1024, 1024, 1024, 8192]
    - [6, 148.92]
  - - [1024, 8192, 1, 4096, 1024, 1024, 1024, 8192]
    - [6, 162.78]
  - - [1024, 8192, 1, 8192, 1024, 1024, 1024, 8192]
    - [6, 170.66]
  - - [2048, 128, 1, 128, 2048, 2048, 2048, 128]
    - [18, 7.88]
  - - [2048, 128, 1, 256, 2048, 2048, 2048, 128]
    - [18, 13.21]
  - - [2048, 128, 1, 512, 2048, 2048, 2048, 128]
    - [30, 20.24]
  - - [2048, 128, 1, 1024, 2048, 2048, 2048, 128]
    - [30, 28.71]
  - - [2048, 128, 1, 2048, 2048, 2048, 2048, 128]
    - [20, 32.92]
  - - [2048, 128, 1, 4096, 2048, 2048, 2048, 128]
    - [20, 37.26]
  - - [2048, 128, 1, 8192, 2048, 2048, 2048, 128]
    - [3, 40.15]
  - - [2048, 256, 1, 128, 2048, 2048, 2048, 256]
    - [17, 13.4]
  - - [2048, 256, 1, 256, 2048, 2048, 2048, 256]
    - [17, 22.48]
  - - [2048, 256, 1, 512, 2048, 2048, 2048, 256]
    - [29, 34.19]
  - - [2048, 256, 1, 1024, 2048, 2048, 2048, 256]
    - [29, 47.07]
  - - [2048, 256, 1, 2048, 2048, 2048, 2048, 256]
    - [14, 55.54]
  - - [2048, 256, 1, 4096, 2048, 2048, 2048, 256]
    - [14, 62.63]
  - - [2048, 256, 1, 8192, 2048, 2048, 2048, 256]
    - [14, 66.96]
  - - [2048, 512, 1, 128, 2048, 2048, 2048, 512]
    - [2, 21.23]
  - - [2048, 512, 1, 256, 2048, 2048, 2048, 512]
    - [12, 35.15]
  - - [2048, 512, 1, 512, 2048, 2048, 2048, 512]
    - [13, 52.35]
  - - [2048, 512, 1, 1024, 2048, 2048, 2048, 512]
    - [13, 69.35]
  - - [2048, 512, 1, 2048, 2048, 2048, 2048, 512]
    - [13, 82.3]
  - - [2048, 512, 1, 4096, 2048, 2048, 2048, 512]
    - [13, 91.37]
  - - [2048, 512, 1, 8192, 2048, 2048, 2048, 512]
    - [13, 96.51]
  - - [2048, 1024, 1, 128, 2048, 2048, 2048, 1024]
    - [9, 30.83]
  - - [2048, 1024, 1, 256, 2048, 2048, 2048, 1024]
    - [9, 50.75]
  - - [2048, 1024, 1, 512, 2048, 2048, 2048, 1024]
    - [9, 75.12]
  - - [2048, 1024, 1, 1024, 2048, 2048, 2048, 1024]
    - [10, 98.86]
  - - [2048, 1024, 1, 2048, 2048, 2048, 2048, 1024]
    - [10, 118.5]
  - - [2048, 1024, 1, 4096, 2048, 2048, 2048, 1024]
    - [10, 131.68]
  - - [2048, 1024, 1, 8192, 2048, 2048, 2048, 1024]
    - [10, 139.16]
  - - [2048, 2048, 1, 128, 2048, 2048, 2048, 2048]
    - [1, 39.13]
  - - [2048, 2048, 1, 256, 2048, 2048, 2048, 2048]
    - [6, 63.97]
  - - [2048, 2048, 1, 512, 2048, 2048, 2048, 2048]
    - [6, 94.17]
  - - [2048, 2048, 1, 1024, 2048, 2048, 2048, 2048]
    - [6, 123.17]
  - - [2048, 2048, 1, 2048, 2048, 2048, 2048, 2048]
    - [5, 145.71]
  - - [2048, 2048, 1, 4096, 2048, 2048, 2048, 2048]
    - [6, 161.04]
  - - [2048, 2048, 1, 8192, 2048, 2048, 2048, 2048]
    - [6, 169.65]
  - - [2048, 4096, 1, 128, 2048, 2048, 2048, 4096]
    - [5, 41.52]
  - - [2048, 4096, 1, 256, 2048, 2048, 2048, 4096]
    - [5, 67.47]
  - - [2048, 4096, 1, 512, 2048, 2048, 2048, 4096]
    - [5, 98.37]
  - - [2048, 4096, 1, 1024, 2048, 2048, 2048, 4096]
    - [5, 126.65]
  - - [2048, 4096, 1, 2048, 2048, 2048, 2048, 4096]
    - [6, 148.43]
  - - [2048, 4096, 1, 4096, 2048, 2048, 2048, 4096]
    - [6, 162.67]
  - - [2048, 4096, 1, 8192, 2048, 2048, 2048, 4096]
    - [6, 170.79]
  - - [2048, 8192, 1, 128, 2048, 2048, 2048, 8192]
    - [5, 43.5]
  - - [2048, 8192, 1, 256, 2048, 2048, 2048, 8192]
    - [5, 70.08]
  - - [2048, 8192, 1, 512, 2048, 2048, 2048, 8192]
    - [5, 100.95]
  - - [2048, 8192, 1, 1024, 2048, 2048, 2048, 8192]
    - [5, 129.0]
  - - [2048, 8192, 1, 2048, 2048, 2048, 2048, 8192]
    - [5, 149.96]
  - - [2048, 8192, 1, 4096, 2048, 2048, 2048, 8192]
    - [6, 193.41]
  - - [2048, 8192, 1, 8192, 2048, 2048, 2048, 8192]
    - [6, 207.06]
  - - [4096, 128, 1, 128, 4096, 4096, 4096, 128]
    - [17, 13.51]
  - - [4096, 128, 1, 256, 4096, 4096, 4096, 128]
    - [17, 22.31]
  - - [4096, 128, 1, 512, 4096, 4096, 4096, 128]
    - [29, 33.79]
  - - [4096, 128, 1, 1024, 4096, 4096, 4096, 128]
    - [29, 47.06]
  - - [4096, 128, 1, 2048, 4096, 4096, 4096, 128]
    - [14, 55.23]
  - - [4096, 128, 1, 4096, 4096, 4096, 4096, 128]
    - [14, 62.44]
  - - [4096, 128, 1, 8192, 4096, 4096, 4096, 128]
    - [14, 66.73]
  - - [4096, 256, 1, 128, 4096, 4096, 4096, 256]
    - [13, 21.11]
  - - [4096, 256, 1, 256, 4096, 4096, 4096, 256]
    - [12, 34.95]
  - - [4096, 256, 1, 512, 4096, 4096, 4096, 256]
    - [13, 52.22]
  - - [4096, 256, 1, 1024, 4096, 4096, 4096, 256]
    - [13, 69.19]
  - - [4096, 256, 1, 2048, 4096, 4096, 4096, 256]
    - [13, 81.94]
  - - [4096, 256, 1, 4096, 4096, 4096, 4096, 256]
    - [13, 91.21]
  - - [4096, 256, 1, 8192, 4096, 4096, 4096, 256]
    - [13, 96.56]
  - - [4096, 512, 1, 128, 4096, 4096, 4096, 512]
    - [9, 30.67]
  - - [4096, 512, 1, 256, 4096, 4096, 4096, 512]
    - [9, 50.85]
  - - [4096, 512, 1, 512, 4096, 4096, 4096, 512]
    - [9, 74.81]
  - - [4096, 512, 1, 1024, 4096, 4096, 4096, 512]
    - [10, 98.62]
  - - [4096, 512, 1, 2048, 4096, 4096, 4096, 512]
    - [10, 118.53]
  - - [4096, 512, 1, 4096, 4096, 4096, 4096, 512]
    - [10, 131.42]
  - - [4096, 512, 1, 8192, 4096, 4096, 4096, 512]
    - [10, 139.2]
  - - [4096, 1024, 1, 128, 4096, 4096, 4096, 1024]
    - [0, 39.17]
  - - [4096, 1024, 1, 256, 4096, 4096, 4096, 1024]
    - [6, 63.78]
  - - [4096, 1024, 1, 512, 4096, 4096, 4096, 1024]
    - [6, 93.93]
  - - [4096, 1024, 1, 1024, 4096, 4096, 4096, 1024]
    - [6, 123.23]
  - - [4096, 1024, 1, 2048, 4096, 4096, 4096, 1024]
    - [6, 145.77]
  - - [4096, 1024, 1, 4096, 4096, 4096, 4096, 1024]
    - [6, 161.06]
  - - [4096, 1024, 1, 8192, 4096, 4096, 4096, 1024]
    - [6, 169.86]
  - - [4096, 2048, 1, 128, 4096, 4096, 4096, 2048]
    - [1, 41.73]
  - - [4096, 2048, 1, 256, 4096, 4096, 4096, 2048]
    - [5, 67.6]
  - - [4096, 2048, 1, 512, 4096, 4096, 4096, 2048]
    - [5, 98.33]
  - - [4096, 2048, 1, 1024, 4096, 4096, 4096, 2048]
    - [5, 127.06]
  - - [4096, 2048, 1, 2048, 4096, 4096, 4096, 2048]
    - [6, 148.49]
  - - [4096, 2048, 1, 4096, 4096, 4096, 4096, 2048]
    - [6, 162.79]
  - - [4096, 2048, 1, 8192, 4096, 4096, 4096, 2048]
    - [6, 170.6]
  - - [4096, 4096, 1, 128, 4096, 4096, 4096, 4096]
    - [5, 43.59]
  - - [4096, 4096, 1, 256, 4096, 4096, 4096, 4096]
    - [5, 70.15]
  - - [4096, 4096, 1, 512, 4096, 4096, 4096, 4096]
    - [5, 101.05]
  - - [4096, 4096, 1, 1024, 4096, 4096, 4096, 4096]
    - [5, 129.02]
  - - [4096, 4096, 1, 2048, 4096, 4096, 4096, 4096]
    - [6, 149.95]
  - - [4096, 4096, 1, 4096, 4096, 4096, 4096, 4096]
    - [6, 193.34]
  - - [4096, 4096, 1, 8192, 4096, 4096, 4096, 4096]
    - [6, 207.08]
  - - [4096, 8192, 1, 128, 4096, 4096, 4096, 8192]
    - [5, 44.66]
  - - [4096, 8192, 1, 256, 4096, 4096, 4096, 8192]
    - [5, 71.5]
  - - [4096, 8192, 1, 512, 4096, 4096, 4096, 8192]
    - [5, 102.38]
  - - [4096, 8192, 1, 1024, 4096, 4096, 4096, 8192]
    - [5, 130.11]
  - - [4096, 8192, 1, 2048, 4096, 4096, 4096, 8192]
    - [6, 168.7]
  - - [4096, 8192, 1, 4096, 4096, 4096, 4096, 8192]
    - [6, 186.12]
  - - [4096, 8192, 1, 8192, 4096, 4096, 4096, 8192]
    - [6, 200.75]
  - - [8192, 128, 1, 128, 8192, 8192, 8192, 128]
    - [2, 21.16]
  - - [8192, 128, 1, 256, 8192, 8192, 8192, 128]
    - [12, 34.89]
  - - [8192, 128, 1, 512, 8192, 8192, 8192, 128]
    - [13, 52.1]
  - - [8192, 128, 1, 1024, 8192, 8192, 8192, 128]
    - [13, 68.45]
  - - [8192, 128, 1, 2048, 8192, 8192, 8192, 128]
    - [13, 82.12]
  - - [8192, 128, 1, 4096, 8192, 8192, 8192, 128]
    - [13, 91.19]
  - - [8192, 128, 1, 8192, 8192, 8192, 8192, 128]
    - [13, 95.27]
  - - [8192, 256, 1, 128, 8192, 8192, 8192, 256]
    - [9, 30.71]
  - - [8192, 256, 1, 256, 8192, 8192, 8192, 256]
    - [9, 50.9]
  - - [8192, 256, 1, 512, 8192, 8192, 8192, 256]
    - [9, 75.14]
  - - [8192, 256, 1, 1024, 8192, 8192, 8192, 256]
    - [10, 98.85]
  - - [8192, 256, 1, 2048, 8192, 8192, 8192, 256]
    - [10, 118.71]
  - - [8192, 256, 1, 4096, 8192, 8192, 8192, 256]
    - [10, 131.56]
  - - [8192, 256, 1, 8192, 8192, 8192, 8192, 256]
    - [10, 137.43]
  - - [8192, 512, 1, 128, 8192, 8192, 8192, 512]
    - [1, 39.25]
  - - [8192, 512, 1, 256, 8192, 8192, 8192, 512]
    - [6, 64.03]
  - - [8192, 512, 1, 512, 8192, 8192, 8192, 512]
    - [6, 94.29]
  - - [8192, 512, 1, 1024, 8192, 8192, 8192, 512]
    - [6, 123.44]
  - - [8192, 512, 1, 2048, 8192, 8192, 8192, 512]
    - [5, 145.95]
  - - [8192, 512, 1, 4096, 8192, 8192, 8192, 512]
    - [6, 161.17]
  - - [8192, 512, 1, 8192, 8192, 8192, 8192, 512]
    - [6, 169.59]
  - - [8192, 1024, 1, 128, 8192, 8192, 8192, 1024]
    - [1, 41.72]
  - - [8192, 1024, 1, 256, 8192, 8192, 8192, 1024]
    - [5, 67.57]
  - - [8192, 1024, 1, 512, 8192, 8192, 8192, 1024]
    - [5, 97.72]
  - - [8192, 1024, 1, 1024, 8192, 8192, 8192, 1024]
    - [5, 127.09]
  - - [8192, 1024, 1, 2048, 8192, 8192, 8192, 1024]
    - [5, 148.67]
  - - [8192, 1024, 1, 4096, 8192, 8192, 8192, 1024]
    - [6, 162.78]
  - - [8192, 1024, 1, 8192, 8192, 8192, 8192, 1024]
    - [6, 170.52]
  - - [8192, 2048, 1, 128, 8192, 8192, 8192, 2048]
    - [5, 43.45]
  - - [8192, 2048, 1, 256, 8192, 8192, 8192, 2048]
    - [5, 69.68]
  - - [8192, 2048, 1, 512, 8192, 8192, 8192, 2048]
    - [5, 100.37]
  - - [8192, 2048, 1, 1024, 8192, 8192, 8192, 2048]
    - [5, 129.2]
  - - [8192, 2048, 1, 2048, 8192, 8192, 8192, 2048]
    - [5, 150.13]
  - - [8192, 2048, 1, 4096, 8192, 8192, 8192, 2048]
    - [6, 193.28]
  - - [8192, 2048, 1, 8192, 8192, 8192, 8192, 2048]
    - [6, 206.26]
  - - [8192, 4096, 1, 128, 8192, 8192, 8192, 4096]
    - [5, 44.55]
  - - [8192, 4096, 1, 256, 8192, 8192, 8192, 4096]
    - [5, 71.37]
  - - [8192, 4096, 1, 512, 8192, 8192, 8192, 4096]
    - [5, 101.89]
  - - [8192, 4096, 1, 1024, 8192, 8192, 8192, 4096]
    - [5, 130.15]
  - - [8192, 4096, 1, 2048, 8192, 8192, 8192, 4096]
    - [6, 168.63]
  - - [8192, 4096, 1, 4096, 8192, 8192, 8192, 4096]
    - [6, 186.04]
  - - [8192, 4096, 1, 8192, 8192, 8192, 8192, 4096]
    - [6, 200.79]
  - - [8192, 8192, 1, 128, 8192, 8192, 8192, 8192]
    - [5, 44.99]
  - - [8192, 8192, 1, 256, 8192, 8192, 8192, 8192]
    - [1, 80.47]
  - - [8192, 8192, 1, 512, 8192, 8192, 8192, 8192]
    - [0, 110.85]
  - - [8192, 8192, 1, 1024, 8192, 8192, 8192, 8192]
    - [7, 147.98]
  - - [8192, 8192, 1, 2048, 8192, 8192, 8192, 8192]
    - [5, 178.9]
  - - [8192, 8192, 1, 4096, 8192, 8192, 8192, 8192]
    - [6, 199.62]
  - - [8192, 8192, 1, 8192, 8192, 8192, 8192, 8192]
    - [6, 211.77]
  - - [1, 1, 1, 32, 1, 1, 1, 1]
    - [49, 0.0]
- null
- null
- ExperimentalStreamK
- GridBased
