projects/hipblaslt/library/src/amd_detail/rocblaslt/src/Tensile/Logic/asm_full/aquavanjaram/gfx942_80cu/StreamK/aquavanjaram942_Cijk_Alik_Bjlk_I8BH_UserArgs.yaml
- {MinimumRequiredVersion: 4.33.0}
- aquavanjaram942
- {Architecture: gfx942, CUCount: 80}
- [Device 0049, Device 0050]
    SolutionIndex: 0
    SolutionNameMin: Cijk_Alik_Bjlk_I8BH_UserArgs_MT256x256x32_MI16x16x1_SN_LDSB0_AFC0_AFEM1_AFEM1_ASEM1_CLR0_CADS0_DTVA0_DTVB0_EPS0_FDSI0_GRPM1_GRVWA4_GRVWB2_GSU0_GSUAMB_GSUC0_GSUWGMRR0_GLS0_ISA942_IU1_K1_LBSPPA256_LBSPPB2048_LBSPPM0_LPA8_LPB32_LPM0_LRVW8_LWPMn1_MIAV0_MIWT8_8_MO40_NTn1_NTA0_NTB0_NTC0_NTD0_NTM0_NEPBS0_NLCA1_NLCB1_ONLL1_PGR2_PLR0_PKA1_SIA3_SS1_SU0_SUM0_SUS32_SPO0_SRVW0_SSO0_SVW8_SK3_SKXCCM8_TLDS1_ULSGRO0_USL1_UIOFGRO0_USFGRO0_VSn1_VWA8_VWB2_WSGRA0_WSGRB0_WS64_WG32_8_1_WGM1_WGMXCC1_WGMXCCGn1
    SolutionIndex: 1
    SolutionNameMin: Cijk_Alik_Bjlk_I8BH_UserArgs_MT256x256x32_MI16x16x1_SN_LDSB0_AFC0_AFEM1_AFEM1_ASEM1_CLR0_CADS0_DTVA0_DTVB0_EPS0_FDSI0_GRPM1_GRVWA4_GRVWB2_GSU0_GSUAMB_GSUC0_GSUWGMRR0_GLS0_ISA942_IU1_K1_LBSPPA128_LBSPPB2048_LBSPPM0_LPA8_LPB0_LPM0_LRVW8_LWPMn1_MIAV0_MIWT8_8_MO40_NTn1_NTA0_NTB0_NTC0_NTD0_NTM0_NEPBS0_NLCA1_NLCB1_ONLL1_PGR2_PLR0_PKA1_SIA3_SS1_SU0_SUM0_SUS32_SPO0_SRVW0_SSO0_SVW4_SK3_SKXCCM8_TLDS1_ULSGRO0_USL1_UIOFGRO0_USFGRO0_VSn1_VWA4_VWB8_WSGRA0_WSGRB0_WS64_WG32_8_1_WGM1_WGMXCC1_WGMXCCGn1
    SolutionIndex: 2
    SolutionNameMin: Cijk_Alik_Bjlk_I8BH_UserArgs_MT256x256x32_MI16x16x1_SN_LDSB0_AFC0_AFEM1_AFEM1_ASEM1_CLR0_CADS0_DTVA0_DTVB0_EPS0_FDSI0_GRPM1_GRVWA4_GRVWB8_GSU0_GSUAMB_GSUC0_GSUWGMRR0_GLS0_ISA942_IU1_K1_LBSPPA256_LBSPPB2048_LBSPPM0_LPA8_LPB0_LPM0_LRVW8_LWPMn1_MIAV0_MIWT8_8_MO40_NTn1_NTA0_NTB0_NTC0_NTD0_NTM0_NEPBS0_NLCA1_NLCB1_ONLL1_PGR2_PLR0_PKA1_SIA3_SS1_SU0_SUM0_SUS32_SPO0_SRVW0_SSO0_SVW8_SK3_SKXCCM8_TLDS1_ULSGRO0_USL1_UIOFGRO0_USFGRO0_VSn1_VWA8_VWB8_WSGRA0_WSGRB0_WS64_WG32_8_1_WGM1_WGMXCC1_WGMXCCGn1
    SolutionIndex: 3
    SolutionNameMin: Cijk_Alik_Bjlk_I8BH_UserArgs_MT256x256x32_MI16x16x1_SN_LDSB0_AFC0_AFEM1_AFEM1_ASEM1_CLR0_CADS0_DTVA0_DTVB0_EPS0_FDSI0_GRPM1_GRVWA4_GRVWB2_GSU0_GSUAMB_GSUC0_GSUWGMRR0_GLS0_ISA942_IU1_K1_LBSPPA256_LBSPPB2048_LBSPPM0_LPA8_LPB0_LPM0_LRVW8_LWPMn1_MIAV0_MIWT8_8_MO40_NTn1_NTA0_NTB0_NTC0_NTD0_NTM0_NEPBS0_NLCA1_NLCB1_ONLL1_PGR2_PLR0_PKA1_SIA3_SS1_SU0_SUM0_SUS32_SPO0_SRVW0_SSO0_SVW8_SK3_SKXCCM8_TLDS1_ULSGRO0_USL1_UIOFGRO0_USFGRO0_VSn1_VWA8_VWB8_WSGRA0_WSGRB0_WS64_WG32_8_1_WGM4_WGMXCC1_WGMXCCGn1
    SolutionIndex: 4
    SolutionNameMin: Cijk_Alik_Bjlk_I8BH_UserArgs_MT256x128x32_MI16x16x1_SN_LDSB0_AFC0_AFEM1_AFEM1_ASEM1_CLR0_CADS0_DTVA0_DTVB0_EPS0_FDSI0_GRPM1_GRVWA4_GRVWB4_GSU0_GSUAMB_GSUC0_GSUWGMRR0_GLS0_ISA942_IU1_K1_LBSPPA256_LBSPPB1024_LBSPPM0_LPA8_LPB64_LPM0_LRVW8_LWPMn1_MIAV0_MIWT8_4_MO40_NTn1_NTA0_NTB0_NTC0_NTD0_NTM0_NEPBS0_NLCA1_NLCB1_ONLL1_PGR2_PLR0_PKA1_SIA3_SS1_SU0_SUM0_SUS32_SPO0_SRVW0_SSO0_SVW8_SK3_SKXCCM8_TLDS1_ULSGRO0_USL1_UIOFGRO0_USFGRO0_VSn1_VWA8_VWB4_WSGRA0_WSGRB0_WS64_WG32_8_1_WGM1_WGMXCC1_WGMXCCGn1
    SolutionIndex: 5
    SolutionNameMin: Cijk_Alik_Bjlk_I8BH_UserArgs_MT256x128x32_MI16x16x1_SN_LDSB0_AFC0_AFEM1_AFEM1_ASEM1_CLR0_CADS0_DTVA0_DTVB0_EPS0_FDSI0_GRPM1_GRVWA8_GRVWB8_GSU0_GSUAMB_GSUC0_GSUWGMRR0_GLS0_ISA942_IU1_K1_LBSPPA256_LBSPPB1024_LBSPPM0_LPA8_LPB64_LPM0_LRVW8_LWPMn1_MIAV0_MIWT8_4_MO40_NTn1_NTA0_NTB0_NTC0_NTD0_NTM0_NEPBS0_NLCA1_NLCB1_ONLL1_PGR2_PLR0_PKA1_SIA3_SS1_SU0_SUM0_SUS32_SPO0_SRVW0_SSO0_SVW8_SK3_SKXCCM8_TLDS1_ULSGRO0_USL1_UIOFGRO0_USFGRO0_VSn1_VWA8_VWB4_WSGRA0_WSGRB0_WS64_WG32_8_1_WGM1_WGMXCC1_WGMXCCGn1
    SolutionIndex: 6
    SolutionNameMin: Cijk_Alik_Bjlk_I8BH_UserArgs_MT128x128x32_MI16x16x1_SN_LDSB0_AFC0_AFEM1_AFEM1_ASEM1_CLR0_CADS0_DTVA0_DTVB0_EPS0_FDSI0_GRPM1_GRVWA8_GRVWB8_GSU0_GSUAMB_GSUC0_GSUWGMRR0_GLS0_ISA942_IU1_K1_LBSPPA128_LBSPPB1024_LBSPPM0_LPA8_LPB64_LPM0_LRVW8_LWPMn1_MIAV0_MIWT4_4_MO40_NTn1_NTA0_NTB0_NTC0_NTD0_NTM0_NEPBS0_NLCA1_NLCB1_ONLL1_PGR2_PLR0_PKA1_SIA3_SS1_SU0_SUM0_SUS32_SPO0_SRVW0_SSO0_SVW4_SK3_SKXCCM8_TLDS1_ULSGRO0_USL1_UIOFGRO0_USFGRO0_VSn1_VWA4_VWB4_WSGRA0_WSGRB0_WS64_WG32_8_1_WGM1_WGMXCC1_WGMXCCGn1
    SolutionIndex: 7
    SolutionNameMin: Cijk_Alik_Bjlk_I8BH_UserArgs_MT128x32x32_MI16x16x1_SN_LDSB0_AFC0_AFEM1_AFEM1_ASEM1_CLR0_CADS0_DTVA0_DTVB0_EPS0_FDSI0_GRPM1_GRVWA8_GRVWB4_GSU0_GSUAMB_GSUC0_GSUWGMRR0_GLS0_ISA942_IU1_K1_LBSPPA128_LBSPPB256_LBSPPM0_LPA8_LPB16_LPM0_LRVW8_LWPMn1_MIAV0_MIWT4_1_MO40_NTn1_NTA0_NTB0_NTC0_NTD0_NTM0_NEPBS0_NLCA1_NLCB1_ONLL1_PGR2_PLR0_PKA1_SIA3_SS1_SU0_SUM0_SUS32_SPO0_SRVW0_SSO0_SVW4_SK3_SKXCCM8_TLDS1_ULSGRO0_USL1_UIOFGRO0_USFGRO0_VSn1_VWA4_VWB1_WSGRA0_WSGRB0_WS64_WG32_8_1_WGM1_WGMXCC1_WGMXCCGn1
    SolutionIndex: 8
    SolutionNameMin: Cijk_Alik_Bjlk_I8BH_UserArgs_MT256x256x64_MI16x16x1_SN_LDSB1_AFC0_AFEM1_AFEM1_ASEM1_CLR1_CADS0_DTVA0_DTVB0_EPS0_FDSI0_GRPM1_GRVWA4_GRVWB4_GSU0_GSUAMB_GSUC0_GSUWGMRR0_GLS0_ISA942_IU1_K1_LBSPPA256_LBSPPB2048_LBSPPM0_LPA8_LPB64_LPM0_LRVW8_LWPMn1_MIAV0_MIWT8_8_MO40_NTn1_NTA0_NTB0_NTC0_NTD0_NTM0_NEPBS0_NLCA1_NLCB1_ONLL1_PGR2_PLR1_PKA1_SIA3_SS1_SU0_SUM0_SUS64_SPO0_SRVW0_SSO0_SVW4_SK3_SKXCCM8_TLDS1_ULSGRO0_USL1_UIOFGRO0_USFGRO0_VSn1_VWA4_VWB4_WSGRA0_WSGRB0_WS64_WG32_8_1_WGM1_WGMXCC1_WGMXCCGn1
    SolutionIndex: 9
    SolutionNameMin: Cijk_Alik_Bjlk_I8BH_UserArgs_MT256x256x64_MI16x16x1_SN_LDSB1_AFC0_AFEM1_AFEM1_ASEM1_CLR1_CADS0_DTVA0_DTVB0_EPS0_FDSI0_GRPM1_GRVWA4_GRVWB4_GSU0_GSUAMB_GSUC0_GSUWGMRR0_GLS0_ISA942_IU1_K1_LBSPPA256_LBSPPB2048_LBSPPM0_LPA8_LPB0_LPM0_LRVW8_LWPMn1_MIAV0_MIWT8_8_MO40_NTn1_NTA0_NTB0_NTC0_NTD0_NTM0_NEPBS0_NLCA1_NLCB1_ONLL1_PGR2_PLR1_PKA1_SIA3_SS1_SU0_SUM0_SUS64_SPO0_SRVW0_SSO0_SVW4_SK3_SKXCCM8_TLDS1_ULSGRO0_USL1_UIOFGRO0_USFGRO0_VSn1_VWA4_VWB8_WSGRA0_WSGRB0_WS64_WG32_8_1_WGM1_WGMXCC1_WGMXCCGn1
    SolutionIndex: 10
    SolutionNameMin: Cijk_Alik_Bjlk_I8BH_UserArgs_MT256x256x64_MI16x16x1_SN_LDSB1_AFC0_AFEM1_AFEM1_ASEM1_CLR1_CADS0_DTVA0_DTVB0_EPS0_FDSI0_GRPM1_GRVWA4_GRVWB4_GSU0_GSUAMB_GSUC0_GSUWGMRR0_GLS0_ISA942_IU1_K1_LBSPPA512_LBSPPB2048_LBSPPM0_LPA8_LPB0_LPM0_LRVW8_LWPMn1_MIAV0_MIWT8_8_MO40_NTn1_NTA0_NTB0_NTC0_NTD0_NTM0_NEPBS0_NLCA1_NLCB1_ONLL1_PGR2_PLR1_PKA1_SIA3_SS1_SU0_SUM0_SUS64_SPO0_SRVW0_SSO0_SVW8_SK3_SKXCCM8_TLDS1_ULSGRO0_USL1_UIOFGRO0_USFGRO0_VSn1_VWA8_VWB8_WSGRA0_WSGRB0_WS64_WG32_8_1_WGM1_WGMXCC1_WGMXCCGn1
    SolutionIndex: 11
    SolutionNameMin: Cijk_Alik_Bjlk_I8BH_UserArgs_MT256x256x64_MI16x16x1_SN_LDSB1_AFC0_AFEM1_AFEM1_ASEM1_CLR1_CADS0_DTVA0_DTVB0_EPS0_FDSI0_GRPM1_GRVWA2_GRVWB8_GSU0_GSUAMB_GSUC0_GSUWGMRR0_GLS0_ISA942_IU1_K1_LBSPPA128_LBSPPB2048_LBSPPM0_LPA8_LPB0_LPM0_LRVW8_LWPMn1_MIAV0_MIWT8_8_MO40_NTn1_NTA0_NTB0_NTC0_NTD0_NTM0_NEPBS0_NLCA1_NLCB1_ONLL1_PGR2_PLR1_PKA1_SIA3_SS1_SU0_SUM0_SUS64_SPO0_SRVW0_SSO0_SVW1_SK3_SKXCCM8_TLDS1_ULSGRO0_USL1_UIOFGRO0_USFGRO0_VSn1_VWA1_VWB8_WSGRA0_WSGRB0_WS64_WG32_8_1_WGM1_WGMXCC1_WGMXCCGn1
    SolutionIndex: 12
    SolutionNameMin: Cijk_Alik_Bjlk_I8BH_UserArgs_MT256x256x64_MI16x16x1_SN_LDSB1_AFC0_AFEM1_AFEM1_ASEM1_CLR1_CADS0_DTVA0_DTVB0_EPS0_FDSI0_GRPM1_GRVWA2_GRVWB8_GSU0_GSUAMB_GSUC0_GSUWGMRR0_GLS0_ISA942_IU1_K1_LBSPPA512_LBSPPB2048_LBSPPM0_LPA8_LPB0_LPM0_LRVW8_LWPMn1_MIAV0_MIWT8_8_MO40_NTn1_NTA0_NTB0_NTC0_NTD0_NTM0_NEPBS0_NLCA1_NLCB1_ONLL1_PGR2_PLR1_PKA1_SIA3_SS1_SU0_SUM0_SUS64_SPO0_SRVW0_SSO0_SVW8_SK3_SKXCCM8_TLDS1_ULSGRO0_USL1_UIOFGRO0_USFGRO0_VSn1_VWA8_VWB8_WSGRA0_WSGRB0_WS64_WG32_8_1_WGM1_WGMXCC1_WGMXCCGn1
    SolutionIndex: 13
    SolutionNameMin: Cijk_Alik_Bjlk_I8BH_UserArgs_MT256x256x64_MI16x16x1_SN_LDSB1_AFC0_AFEM1_AFEM1_ASEM1_CLR1_CADS0_DTVA0_DTVB0_EPS0_FDSI0_GRPM1_GRVWA4_GRVWB8_GSU0_GSUAMB_GSUC0_GSUWGMRR0_GLS0_ISA942_IU1_K1_LBSPPA512_LBSPPB2048_LBSPPM0_LPA8_LPB0_LPM0_LRVW8_LWPMn1_MIAV0_MIWT8_8_MO40_NTn1_NTA0_NTB0_NTC0_NTD0_NTM0_NEPBS0_NLCA1_NLCB1_ONLL1_PGR2_PLR1_PKA1_SIA3_SS1_SU0_SUM0_SUS64_SPO0_SRVW0_SSO0_SVW8_SK3_SKXCCM8_TLDS1_ULSGRO0_USL1_UIOFGRO0_USFGRO0_VSn1_VWA8_VWB8_WSGRA0_WSGRB0_WS64_WG32_8_1_WGM1_WGMXCC1_WGMXCCGn1
    SolutionIndex: 14
    SolutionNameMin: Cijk_Alik_Bjlk_I8BH_UserArgs_MT256x256x64_MI16x16x1_SN_LDSB1_AFC0_AFEM1_AFEM1_ASEM1_CLR1_CADS0_DTVA0_DTVB0_EPS0_FDSI0_GRPM1_GRVWA4_GRVWB4_GSU0_GSUAMB_GSUC0_GSUWGMRR0_GLS0_ISA942_IU1_K1_LBSPPA256_LBSPPB2048_LBSPPM0_LPA8_LPB0_LPM0_LRVW8_LWPMn1_MIAV0_MIWT8_8_MO40_NTn1_NTA0_NTB0_NTC0_NTD0_NTM0_NEPBS0_NLCA1_NLCB1_ONLL1_PGR2_PLR1_PKA1_SIA3_SS1_SU0_SUM0_SUS64_SPO0_SRVW0_SSO0_SVW4_SK3_SKXCCM8_TLDS1_ULSGRO0_USL1_UIOFGRO0_USFGRO0_VSn1_VWA4_VWB8_WSGRA0_WSGRB0_WS64_WG32_8_1_WGM4_WGMXCC1_WGMXCCGn1
    SolutionIndex: 15
    SolutionNameMin: Cijk_Alik_Bjlk_I8BH_UserArgs_MT256x256x64_MI16x16x1_SN_LDSB1_AFC0_AFEM1_AFEM1_ASEM1_CLR1_CADS0_DTVA0_DTVB0_EPS0_FDSI0_GRPM1_GRVWA4_GRVWB4_GSU0_GSUAMB_GSUC0_GSUWGMRR0_GLS0_ISA942_IU1_K1_LBSPPA512_LBSPPB2048_LBSPPM0_LPA8_LPB0_LPM0_LRVW8_LWPMn1_MIAV0_MIWT8_8_MO40_NTn1_NTA0_NTB0_NTC0_NTD0_NTM0_NEPBS0_NLCA1_NLCB1_ONLL1_PGR2_PLR1_PKA1_SIA3_SS1_SU0_SUM0_SUS64_SPO0_SRVW0_SSO0_SVW8_SK3_SKXCCM8_TLDS1_ULSGRO0_USL1_UIOFGRO0_USFGRO0_VSn1_VWA8_VWB8_WSGRA0_WSGRB0_WS64_WG32_8_1_WGM4_WGMXCC1_WGMXCCGn1
    SolutionIndex: 16
    SolutionNameMin: Cijk_Alik_Bjlk_I8BH_UserArgs_MT256x256x64_MI16x16x1_SN_LDSB1_AFC0_AFEM1_AFEM1_ASEM1_CLR1_CADS0_DTVA0_DTVB0_EPS0_FDSI0_GRPM1_GRVWA4_GRVWB4_GSU0_GSUAMB_GSUC0_GSUWGMRR0_GLS0_ISA942_IU1_K1_LBSPPA256_LBSPPB2048_LBSPPM0_LPA8_LPB64_LPM0_LRVW8_LWPMn1_MIAV0_MIWT8_8_MO40_NTn1_NTA0_NTB0_NTC0_NTD0_NTM0_NEPBS0_NLCA1_NLCB1_ONLL1_PGR2_PLR1_PKA1_SIA3_SS1_SU0_SUM0_SUS64_SPO0_SRVW0_SSO0_SVW4_SK3_SKXCCM8_TLDS1_ULSGRO0_USL1_UIOFGRO0_USFGRO0_VSn1_VWA4_VWB4_WSGRA0_WSGRB0_WS64_WG32_8_1_WGM8_WGMXCC1_WGMXCCGn1
    SolutionIndex: 17
    SolutionNameMin: Cijk_Alik_Bjlk_I8BH_UserArgs_MT256x256x64_MI16x16x1_SN_LDSB1_AFC0_AFEM1_AFEM1_ASEM1_CLR1_CADS0_DTVA0_DTVB0_EPS0_FDSI0_GRPM1_GRVWA4_GRVWB4_GSU0_GSUAMB_GSUC0_GSUWGMRR0_GLS0_ISA942_IU1_K1_LBSPPA256_LBSPPB2048_LBSPPM0_LPA8_LPB0_LPM0_LRVW8_LWPMn1_MIAV0_MIWT8_8_MO40_NTn1_NTA0_NTB0_NTC0_NTD0_NTM0_NEPBS0_NLCA1_NLCB1_ONLL1_PGR2_PLR1_PKA1_SIA3_SS1_SU0_SUM0_SUS64_SPO0_SRVW0_SSO0_SVW4_SK3_SKXCCM8_TLDS1_ULSGRO0_USL1_UIOFGRO0_USFGRO0_VSn1_VWA4_VWB8_WSGRA0_WSGRB0_WS64_WG32_8_1_WGM8_WGMXCC1_WGMXCCGn1
    SolutionIndex: 18
    SolutionNameMin: Cijk_Alik_Bjlk_I8BH_UserArgs_MT256x256x64_MI16x16x1_SN_LDSB1_AFC0_AFEM1_AFEM1_ASEM1_CLR1_CADS0_DTVA0_DTVB0_EPS0_FDSI0_GRPM1_GRVWA4_GRVWB4_GSU0_GSUAMB_GSUC0_GSUWGMRR0_GLS0_ISA942_IU1_K1_LBSPPA512_LBSPPB2048_LBSPPM0_LPA8_LPB0_LPM0_LRVW8_LWPMn1_MIAV0_MIWT8_8_MO40_NTn1_NTA0_NTB0_NTC0_NTD0_NTM0_NEPBS0_NLCA1_NLCB1_ONLL1_PGR2_PLR1_PKA1_SIA3_SS1_SU0_SUM0_SUS64_SPO0_SRVW0_SSO0_SVW8_SK3_SKXCCM8_TLDS1_ULSGRO0_USL1_UIOFGRO0_USFGRO0_VSn1_VWA8_VWB8_WSGRA0_WSGRB0_WS64_WG32_8_1_WGM8_WGMXCC1_WGMXCCGn1
    SolutionIndex: 19
    SolutionNameMin: Cijk_Alik_Bjlk_I8BH_UserArgs_MT256x256x64_MI16x16x1_SN_LDSB1_AFC0_AFEM1_AFEM1_ASEM1_CLR1_CADS0_DTVA0_DTVB0_EPS0_FDSI0_GRPM1_GRVWA2_GRVWB8_GSU0_GSUAMB_GSUC0_GSUWGMRR0_GLS0_ISA942_IU1_K1_LBSPPA128_LBSPPB2048_LBSPPM0_LPA8_LPB64_LPM0_LRVW8_LWPMn1_MIAV0_MIWT8_8_MO40_NTn1_NTA0_NTB0_NTC0_NTD0_NTM0_NEPBS0_NLCA1_NLCB1_ONLL1_PGR2_PLR1_PKA1_SIA3_SS1_SU0_SUM0_SUS64_SPO0_SRVW0_SSO0_SVW2_SK3_SKXCCM8_TLDS1_ULSGRO0_USL1_UIOFGRO0_USFGRO0_VSn1_VWA2_VWB4_WSGRA0_WSGRB0_WS64_WG32_8_1_WGM8_WGMXCC1_WGMXCCGn1
    SolutionIndex: 20
    SolutionNameMin: Cijk_Alik_Bjlk_I8BH_UserArgs_MT256x128x64_MI16x16x1_SN_LDSB1_AFC0_AFEM1_AFEM1_ASEM1_CLR1_CADS0_DTVA0_DTVB0_EPS0_FDSI0_GRPM1_GRVWA4_GRVWB4_GSU0_GSUAMB_GSUC0_GSUWGMRR0_GLS0_ISA942_IU1_K1_LBSPPA512_LBSPPB1024_LBSPPM0_LPA8_LPB64_LPM0_LRVW8_LWPMn1_MIAV0_MIWT8_4_MO40_NTn1_NTA0_NTB0_NTC0_NTD0_NTM0_NEPBS0_NLCA1_NLCB1_ONLL1_PGR2_PLR1_PKA1_SIA3_SS1_SU0_SUM0_SUS64_SPO0_SRVW0_SSO0_SVW8_SK3_SKXCCM8_TLDS1_ULSGRO0_USL1_UIOFGRO0_USFGRO0_VSn1_VWA8_VWB4_WSGRA0_WSGRB0_WS64_WG32_8_1_WGM1_WGMXCC1_WGMXCCGn1
    SolutionIndex: 21
    SolutionNameMin: Cijk_Alik_Bjlk_I8BH_UserArgs_MT256x128x64_MI16x16x1_SN_LDSB1_AFC0_AFEM1_AFEM1_ASEM1_CLR1_CADS0_DTVA0_DTVB0_EPS0_FDSI0_GRPM1_GRVWA4_GRVWB8_GSU0_GSUAMB_GSUC0_GSUWGMRR0_GLS0_ISA942_IU1_K1_LBSPPA512_LBSPPB1024_LBSPPM0_LPA8_LPB64_LPM0_LRVW8_LWPMn1_MIAV0_MIWT8_4_MO40_NTn1_NTA0_NTB0_NTC0_NTD0_NTM0_NEPBS0_NLCA1_NLCB1_ONLL1_PGR2_PLR1_PKA1_SIA3_SS1_SU0_SUM0_SUS64_SPO0_SRVW0_SSO0_SVW8_SK3_SKXCCM8_TLDS1_ULSGRO0_USL1_UIOFGRO0_USFGRO0_VSn1_VWA8_VWB4_WSGRA0_WSGRB0_WS64_WG32_8_1_WGM1_WGMXCC1_WGMXCCGn1
    SolutionIndex: 22
    SolutionNameMin: Cijk_Alik_Bjlk_I8BH_UserArgs_MT256x128x64_MI16x16x1_SN_LDSB1_AFC0_AFEM1_AFEM1_ASEM1_CLR1_CADS0_DTVA0_DTVB0_EPS0_FDSI0_GRPM1_GRVWA8_GRVWB8_GSU0_GSUAMB_GSUC0_GSUWGMRR0_GLS0_ISA942_IU1_K1_LBSPPA512_LBSPPB1024_LBSPPM0_LPA8_LPB64_LPM0_LRVW8_LWPMn1_MIAV0_MIWT8_4_MO40_NTn1_NTA0_NTB0_NTC0_NTD0_NTM0_NEPBS0_NLCA1_NLCB1_ONLL1_PGR2_PLR1_PKA1_SIA3_SS1_SU0_SUM0_SUS64_SPO0_SRVW0_SSO0_SVW8_SK3_SKXCCM8_TLDS1_ULSGRO0_USL1_UIOFGRO0_USFGRO0_VSn1_VWA8_VWB4_WSGRA0_WSGRB0_WS64_WG32_8_1_WGM1_WGMXCC1_WGMXCCGn1
    SolutionIndex: 23
    SolutionNameMin: Cijk_Alik_Bjlk_I8BH_UserArgs_MT128x128x64_MI16x16x1_SN_LDSB1_AFC0_AFEM1_AFEM1_ASEM1_CLR1_CADS0_DTVA0_DTVB0_EPS0_FDSI0_GRPM1_GRVWA4_GRVWB4_GSU0_GSUAMB_GSUC0_GSUWGMRR0_GLS0_ISA942_IU1_K1_LBSPPA256_LBSPPB1024_LBSPPM0_LPA8_LPB64_LPM0_LRVW8_LWPMn1_MIAV0_MIWT4_4_MO40_NTn1_NTA0_NTB0_NTC0_NTD0_NTM0_NEPBS0_NLCA1_NLCB1_ONLL1_PGR2_PLR1_PKA1_SIA3_SS1_SU0_SUM0_SUS64_SPO0_SRVW0_SSO0_SVW4_SK3_SKXCCM8_TLDS1_ULSGRO0_USL1_UIOFGRO0_USFGRO0_VSn1_VWA4_VWB4_WSGRA0_WSGRB0_WS64_WG32_8_1_WGM1_WGMXCC1_WGMXCCGn1
    SolutionIndex: 24
    SolutionNameMin: Cijk_Alik_Bjlk_I8BH_UserArgs_MT128x128x64_MI16x16x1_SN_LDSB1_AFC0_AFEM1_AFEM1_ASEM1_CLR1_CADS0_DTVA0_DTVB0_EPS0_FDSI0_GRPM1_GRVWA4_GRVWB8_GSU0_GSUAMB_GSUC0_GSUWGMRR0_GLS0_ISA942_IU1_K1_LBSPPA256_LBSPPB1024_LBSPPM0_LPA8_LPB64_LPM0_LRVW8_LWPMn1_MIAV0_MIWT4_4_MO40_NTn1_NTA0_NTB0_NTC0_NTD0_NTM0_NEPBS0_NLCA1_NLCB1_ONLL1_PGR2_PLR1_PKA1_SIA3_SS1_SU0_SUM0_SUS64_SPO0_SRVW0_SSO0_SVW4_SK3_SKXCCM8_TLDS1_ULSGRO0_USL1_UIOFGRO0_USFGRO0_VSn1_VWA4_VWB4_WSGRA0_WSGRB0_WS64_WG32_8_1_WGM1_WGMXCC1_WGMXCCGn1
    SolutionIndex: 25
    SolutionNameMin: Cijk_Alik_Bjlk_I8BH_UserArgs_MT128x64x64_MI16x16x1_SN_LDSB0_AFC0_AFEM1_AFEM1_ASEM1_CLR1_CADS0_DTVA0_DTVB0_EPS0_FDSI0_GRPM1_GRVWA4_GRVWB4_GSU0_GSUAMB_GSUC0_GSUWGMRR0_GLS0_ISA942_IU1_K1_LBSPPA256_LBSPPB512_LBSPPM0_LPA8_LPB32_LPM0_LRVW8_LWPMn1_MIAV0_MIWT4_2_MO40_NTn1_NTA0_NTB0_NTC0_NTD0_NTM0_NEPBS0_NLCA1_NLCB1_ONLL1_PGR2_PLR1_PKA1_SIA3_SS1_SU0_SUM0_SUS64_SPO0_SRVW0_SSO0_SVW4_SK3_SKXCCM8_TLDS1_ULSGRO0_USL1_UIOFGRO0_USFGRO0_VSn1_VWA4_VWB2_WSGRA0_WSGRB0_WS64_WG32_8_1_WGM1_WGMXCC1_WGMXCCGn1
    SolutionIndex: 26
    SolutionNameMin: Cijk_Alik_Bjlk_I8BH_UserArgs_MT128x64x64_MI16x16x1_SN_LDSB0_AFC0_AFEM1_AFEM1_ASEM1_CLR1_CADS0_DTVA0_DTVB0_EPS0_FDSI0_GRPM1_GRVWA8_GRVWB4_GSU0_GSUAMB_GSUC0_GSUWGMRR0_GLS0_ISA942_IU1_K1_LBSPPA256_LBSPPB512_LBSPPM0_LPA8_LPB32_LPM0_LRVW8_LWPMn1_MIAV0_MIWT4_2_MO40_NTn1_NTA0_NTB0_NTC0_NTD0_NTM0_NEPBS0_NLCA1_NLCB1_ONLL1_PGR2_PLR1_PKA1_SIA3_SS1_SU0_SUM0_SUS64_SPO0_SRVW0_SSO0_SVW4_SK3_SKXCCM8_TLDS1_ULSGRO0_USL1_UIOFGRO0_USFGRO0_VSn1_VWA4_VWB2_WSGRA0_WSGRB0_WS64_WG32_8_1_WGM1_WGMXCC1_WGMXCCGn1
    SolutionIndex: 27
    SolutionNameMin: Cijk_Alik_Bjlk_I8BH_UserArgs_MT128x64x64_MI16x16x1_SN_LDSB0_AFC0_AFEM1_AFEM1_ASEM1_CLR1_CADS0_DTVA0_DTVB0_EPS0_FDSI0_GRPM1_GRVWA4_GRVWB8_GSU0_GSUAMB_GSUC0_GSUWGMRR0_GLS0_ISA942_IU1_K1_LBSPPA256_LBSPPB512_LBSPPM0_LPA8_LPB32_LPM0_LRVW8_LWPMn1_MIAV0_MIWT4_2_MO40_NTn1_NTA0_NTB0_NTC0_NTD0_NTM0_NEPBS0_NLCA1_NLCB1_ONLL1_PGR2_PLR1_PKA1_SIA3_SS1_SU0_SUM0_SUS64_SPO0_SRVW0_SSO0_SVW4_SK3_SKXCCM8_TLDS1_ULSGRO0_USL1_UIOFGRO0_USFGRO0_VSn1_VWA4_VWB2_WSGRA0_WSGRB0_WS64_WG32_8_1_WGM1_WGMXCC1_WGMXCCGn1
    SolutionIndex: 28
    SolutionNameMin: Cijk_Alik_Bjlk_I8BH_UserArgs_MT128x64x64_MI16x16x1_SN_LDSB0_AFC0_AFEM1_AFEM1_ASEM1_CLR1_CADS0_DTVA0_DTVB0_EPS0_FDSI0_GRPM1_GRVWA8_GRVWB8_GSU0_GSUAMB_GSUC0_GSUWGMRR0_GLS0_ISA942_IU1_K1_LBSPPA256_LBSPPB512_LBSPPM0_LPA8_LPB32_LPM0_LRVW8_LWPMn1_MIAV0_MIWT4_2_MO40_NTn1_NTA0_NTB0_NTC0_NTD0_NTM0_NEPBS0_NLCA1_NLCB1_ONLL1_PGR2_PLR1_PKA1_SIA3_SS1_SU0_SUM0_SUS64_SPO0_SRVW0_SSO0_SVW4_SK3_SKXCCM8_TLDS1_ULSGRO0_USL1_UIOFGRO0_USFGRO0_VSn1_VWA4_VWB2_WSGRA0_WSGRB0_WS64_WG32_8_1_WGM1_WGMXCC1_WGMXCCGn1
    SolutionIndex: 29
    SolutionNameMin: Cijk_Alik_Bjlk_I8BH_UserArgs_MT64x64x64_MI16x16x1_SN_LDSB0_AFC0_AFEM1_AFEM1_ASEM1_CLR1_CADS0_DTVA0_DTVB0_EPS0_FDSI0_GRPM1_GRVWA4_GRVWB4_GSU0_GSUAMB_GSUC0_GSUWGMRR0_GLS0_ISA942_IU1_K1_LBSPPA128_LBSPPB512_LBSPPM0_LPA8_LPB32_LPM0_LRVW8_LWPMn1_MIAV0_MIWT2_2_MO40_NTn1_NTA0_NTB0_NTC0_NTD0_NTM0_NEPBS0_NLCA1_NLCB1_ONLL1_PGR2_PLR1_PKA1_SIA3_SS1_SU0_SUM0_SUS64_SPO0_SRVW0_SSO0_SVW2_SK3_SKXCCM8_TLDS1_ULSGRO0_USL1_UIOFGRO0_USFGRO0_VSn1_VWA2_VWB2_WSGRA0_WSGRB0_WS64_WG32_8_1_WGM1_WGMXCC1_WGMXCCGn1
    SolutionIndex: 30
    SolutionNameMin: Cijk_Alik_Bjlk_I8BH_UserArgs_MT64x64x64_MI16x16x1_SN_LDSB0_AFC0_AFEM1_AFEM1_ASEM1_CLR1_CADS0_DTVA0_DTVB0_EPS0_FDSI0_GRPM1_GRVWA8_GRVWB4_GSU0_GSUAMB_GSUC0_GSUWGMRR0_GLS0_ISA942_IU1_K1_LBSPPA128_LBSPPB512_LBSPPM0_LPA8_LPB32_LPM0_LRVW8_LWPMn1_MIAV0_MIWT2_2_MO40_NTn1_NTA0_NTB0_NTC0_NTD0_NTM0_NEPBS0_NLCA1_NLCB1_ONLL1_PGR2_PLR1_PKA1_SIA3_SS1_SU0_SUM0_SUS64_SPO0_SRVW0_SSO0_SVW2_SK3_SKXCCM8_TLDS1_ULSGRO0_USL1_UIOFGRO0_USFGRO0_VSn1_VWA2_VWB2_WSGRA0_WSGRB0_WS64_WG32_8_1_WGM1_WGMXCC1_WGMXCCGn1
    SolutionIndex: 31
    SolutionNameMin: Cijk_Alik_Bjlk_I8BH_UserArgs_MT64x64x64_MI16x16x1_SN_LDSB0_AFC0_AFEM1_AFEM1_ASEM1_CLR1_CADS0_DTVA0_DTVB0_EPS0_FDSI0_GRPM1_GRVWA8_GRVWB8_GSU0_GSUAMB_GSUC0_GSUWGMRR0_GLS0_ISA942_IU1_K1_LBSPPA128_LBSPPB512_LBSPPM0_LPA8_LPB32_LPM0_LRVW8_LWPMn1_MIAV0_MIWT2_2_MO40_NTn1_NTA0_NTB0_NTC0_NTD0_NTM0_NEPBS0_NLCA1_NLCB1_ONLL1_PGR2_PLR1_PKA1_SIA3_SS1_SU0_SUM0_SUS64_SPO0_SRVW0_SSO0_SVW2_SK3_SKXCCM8_TLDS1_ULSGRO0_USL1_UIOFGRO0_USFGRO0_VSn1_VWA2_VWB2_WSGRA0_WSGRB0_WS64_WG32_8_1_WGM1_WGMXCC1_WGMXCCGn1
    SolutionIndex: 32
    SolutionNameMin: Cijk_Alik_Bjlk_I8BH_UserArgs_MT64x32x64_MI16x16x1_SN_LDSB0_AFC0_AFEM1_AFEM1_ASEM1_CLR1_CADS0_DTVA0_DTVB0_EPS0_FDSI0_GRPM1_GRVWA8_GRVWB4_GSU0_GSUAMB_GSUC0_GSUWGMRR0_GLS0_ISA942_IU1_K1_LBSPPA128_LBSPPB256_LBSPPM0_LPA8_LPB16_LPM0_LRVW8_LWPMn1_MIAV0_MIWT2_1_MO40_NTn1_NTA0_NTB0_NTC0_NTD0_NTM0_NEPBS0_NLCA1_NLCB1_ONLL1_PGR2_PLR1_PKA1_SIA3_SS1_SU0_SUM0_SUS64_SPO0_SRVW0_SSO0_SVW2_SK3_SKXCCM8_TLDS1_ULSGRO0_USL1_UIOFGRO0_USFGRO0_VSn1_VWA2_VWB1_WSGRA0_WSGRB0_WS64_WG32_8_1_WGM1_WGMXCC1_WGMXCCGn1
    SolutionIndex: 33
    SolutionNameMin: Cijk_Alik_Bjlk_I8BH_UserArgs_MT64x32x64_MI16x16x1_SN_LDSB0_AFC0_AFEM1_AFEM1_ASEM1_CLR1_CADS0_DTVA0_DTVB0_EPS0_FDSI0_GRPM1_GRVWA8_GRVWB8_GSU0_GSUAMB_GSUC0_GSUWGMRR0_GLS0_ISA942_IU1_K1_LBSPPA128_LBSPPB256_LBSPPM0_LPA8_LPB16_LPM0_LRVW8_LWPMn1_MIAV0_MIWT2_1_MO40_NTn1_NTA0_NTB0_NTC0_NTD0_NTM0_NEPBS0_NLCA1_NLCB1_ONLL1_PGR2_PLR1_PKA1_SIA3_SS1_SU0_SUM0_SUS64_SPO0_SRVW0_SSO0_SVW2_SK3_SKXCCM8_TLDS1_ULSGRO0_USL1_UIOFGRO0_USFGRO0_VSn1_VWA2_VWB1_WSGRA0_WSGRB0_WS64_WG32_8_1_WGM1_WGMXCC1_WGMXCCGn1
    SolutionIndex: 34
    SolutionNameMin: Cijk_Alik_Bjlk_I8BH_UserArgs_MT64x32x64_MI16x16x1_SN_LDSB0_AFC0_AFEM1_AFEM1_ASEM1_CLR0_CADS0_DTVA0_DTVB0_EPS0_FDSI0_GRPM1_GRVWA8_GRVWB4_GSU0_GSUAMB_GSUC0_GSUWGMRR0_GLS0_ISA942_IU1_K1_LBSPPA128_LBSPPB256_LBSPPM0_LPA8_LPB16_LPM0_LRVW8_LWPMn1_MIAV0_MIWT2_1_MO40_NTn1_NTA0_NTB0_NTC0_NTD0_NTM0_NEPBS0_NLCA1_NLCB1_ONLL1_PGR2_PLR0_PKA1_SIA3_SS1_SU0_SUM0_SUS64_SPO0_SRVW0_SSO0_SVW2_SK3_SKXCCM8_TLDS1_ULSGRO0_USL1_UIOFGRO0_USFGRO0_VSn1_VWA2_VWB1_WSGRA0_WSGRB0_WS64_WG32_8_1_WGM1_WGMXCC1_WGMXCCGn1
    SolutionIndex: 35
    SolutionNameMin: Cijk_Alik_Bjlk_I8BH_UserArgs_MT32x32x64_MI16x16x1_SN_LDSB0_AFC0_AFEM1_AFEM1_ASEM1_CLR1_CADS0_DTVA0_DTVB0_EPS0_FDSI0_GRPM1_GRVWA4_GRVWB4_GSU0_GSUAMB_GSUC0_GSUWGMRR0_GLS0_ISA942_IU1_K1_LBSPPA128_LBSPPB256_LBSPPM0_LPA8_LPB16_LPM0_LRVW8_LWPMn1_MIAV0_MIWT1_1_MO40_NTn1_NTA0_NTB0_NTC0_NTD0_NTM0_NEPBS0_NLCA1_NLCB1_ONLL1_PGR2_PLR1_PKA1_SIA3_SS1_SU0_SUM0_SUS64_SPO0_SRVW0_SSO0_SVW1_SK3_SKXCCM8_TLDS1_ULSGRO0_USL1_UIOFGRO0_USFGRO0_VSn1_VWA1_VWB1_WSGRA0_WSGRB0_WS64_WG32_8_1_WGM1_WGMXCC1_WGMXCCGn1
    SolutionIndex: 36
    SolutionNameMin: Cijk_Alik_Bjlk_I8BH_UserArgs_MT32x32x64_MI16x16x1_SN_LDSB0_AFC0_AFEM1_AFEM1_ASEM1_CLR1_CADS0_DTVA0_DTVB0_EPS0_FDSI0_GRPM1_GRVWA8_GRVWB4_GSU0_GSUAMB_GSUC0_GSUWGMRR0_GLS0_ISA942_IU1_K1_LBSPPA128_LBSPPB256_LBSPPM0_LPA8_LPB16_LPM0_LRVW8_LWPMn1_MIAV0_MIWT1_1_MO40_NTn1_NTA0_NTB0_NTC0_NTD0_NTM0_NEPBS0_NLCA1_NLCB1_ONLL1_PGR2_PLR1_PKA1_SIA3_SS1_SU0_SUM0_SUS64_SPO0_SRVW0_SSO0_SVW1_SK3_SKXCCM8_TLDS1_ULSGRO0_USL1_UIOFGRO0_USFGRO0_VSn1_VWA1_VWB1_WSGRA0_WSGRB0_WS64_WG32_8_1_WGM1_WGMXCC1_WGMXCCGn1
    SolutionIndex: 37
    SolutionNameMin: Cijk_Alik_Bjlk_I8BH_UserArgs_MT32x32x64_MI16x16x1_SN_LDSB0_AFC0_AFEM1_AFEM1_ASEM1_CLR1_CADS0_DTVA0_DTVB0_EPS0_FDSI0_GRPM1_GRVWA8_GRVWB8_GSU0_GSUAMB_GSUC0_GSUWGMRR0_GLS0_ISA942_IU1_K1_LBSPPA128_LBSPPB256_LBSPPM0_LPA8_LPB16_LPM0_LRVW8_LWPMn1_MIAV0_MIWT1_1_MO40_NTn1_NTA0_NTB0_NTC0_NTD0_NTM0_NEPBS0_NLCA1_NLCB1_ONLL1_PGR2_PLR1_PKA1_SIA3_SS1_SU0_SUM0_SUS64_SPO0_SRVW0_SSO0_SVW1_SK3_SKXCCM8_TLDS1_ULSGRO0_USL1_UIOFGRO0_USFGRO0_VSn1_VWA1_VWB1_WSGRA0_WSGRB0_WS64_WG32_8_1_WGM1_WGMXCC1_WGMXCCGn1
    SolutionIndex: 38
    SolutionNameMin: Cijk_Alik_Bjlk_I8BH_UserArgs_MT256x128x128_MI16x16x1_SN_LDSB1_AFC0_AFEM1_AFEM1_ASEM1_CLR1_CADS0_DTVA0_DTVB0_EPS0_FDSI0_GRPM1_GRVWA4_GRVWB8_GSU0_GSUAMB_GSUC0_GSUWGMRR0_GLS0_ISA942_IU1_K1_LBSPPA512_LBSPPB2048_LBSPPM0_LPA32_LPB64_LPM0_LRVW16_LWPMn1_MIAV0_MIWT8_4_MO40_NTn1_NTA0_NTB0_NTC0_NTD0_NTM0_NEPBS0_NLCA1_NLCB1_ONLL1_PGR2_PLR1_PKA1_SIA3_SS1_SU0_SUM0_SUS128_SPO0_SRVW0_SSO0_SVW4_SK3_SKXCCM8_TLDS1_ULSGRO0_USL1_UIOFGRO0_USFGRO0_VSn1_VWA4_VWB4_WSGRA0_WSGRB0_WS64_WG32_8_1_WGM1_WGMXCC1_WGMXCCGn1
    SolutionIndex: 39
    SolutionNameMin: Cijk_Alik_Bjlk_I8BH_UserArgs_MT256x128x128_MI16x16x1_SN_LDSB1_AFC0_AFEM1_AFEM1_ASEM1_CLR1_CADS0_DTVA0_DTVB0_EPS0_FDSI0_GRPM1_GRVWA4_GRVWB8_GSU0_GSUAMB_GSUC0_GSUWGMRR0_GLS0_ISA942_IU1_K1_LBSPPA1024_LBSPPB2048_LBSPPM0_LPA32_LPB64_LPM0_LRVW16_LWPMn1_MIAV0_MIWT8_4_MO40_NTn1_NTA0_NTB0_NTC0_NTD0_NTM0_NEPBS0_NLCA1_NLCB1_ONLL1_PGR2_PLR1_PKA1_SIA3_SS1_SU0_SUM0_SUS128_SPO0_SRVW0_SSO0_SVW8_SK3_SKXCCM8_TLDS1_ULSGRO0_USL1_UIOFGRO0_USFGRO0_VSn1_VWA8_VWB4_WSGRA0_WSGRB0_WS64_WG32_8_1_WGM1_WGMXCC1_WGMXCCGn1
    SolutionIndex: 40
    SolutionNameMin: Cijk_Alik_Bjlk_I8BH_UserArgs_MT256x128x128_MI16x16x1_SN_LDSB1_AFC0_AFEM1_AFEM1_ASEM1_CLR1_CADS0_DTVA0_DTVB0_EPS0_FDSI0_GRPM1_GRVWA4_GRVWB8_GSU0_GSUAMB_GSUC0_GSUWGMRR0_GLS0_ISA942_IU1_K1_LBSPPA512_LBSPPB2048_LBSPPM0_LPA32_LPB64_LPM0_LRVW16_LWPMn1_MIAV0_MIWT8_4_MO40_NTn1_NTA0_NTB0_NTC0_NTD0_NTM0_NEPBS0_NLCA1_NLCB1_ONLL1_PGR2_PLR1_PKA1_SIA3_SS1_SU0_SUM0_SUS128_SPO0_SRVW0_SSO0_SVW4_SK3_SKXCCM8_TLDS1_ULSGRO0_USL1_UIOFGRO0_USFGRO0_VSn1_VWA4_VWB4_WSGRA0_WSGRB0_WS64_WG32_8_1_WGM4_WGMXCC1_WGMXCCGn1
    SolutionIndex: 41
    SolutionNameMin: Cijk_Alik_Bjlk_I8BH_UserArgs_MT256x128x128_MI16x16x1_SN_LDSB1_AFC0_AFEM1_AFEM1_ASEM1_CLR1_CADS0_DTVA0_DTVB0_EPS0_FDSI0_GRPM1_GRVWA4_GRVWB8_GSU0_GSUAMB_GSUC0_GSUWGMRR0_GLS0_ISA942_IU1_K1_LBSPPA1024_LBSPPB2048_LBSPPM0_LPA32_LPB64_LPM0_LRVW16_LWPMn1_MIAV0_MIWT8_4_MO40_NTn1_NTA0_NTB0_NTC0_NTD0_NTM0_NEPBS0_NLCA1_NLCB1_ONLL1_PGR2_PLR1_PKA1_SIA3_SS1_SU0_SUM0_SUS128_SPO0_SRVW0_SSO0_SVW8_SK3_SKXCCM8_TLDS1_ULSGRO0_USL1_UIOFGRO0_USFGRO0_VSn1_VWA8_VWB4_WSGRA0_WSGRB0_WS64_WG32_8_1_WGM4_WGMXCC1_WGMXCCGn1
    SolutionIndex: 42
    SolutionNameMin: Cijk_Alik_Bjlk_I8BH_UserArgs_MT256x128x128_MI16x16x1_SN_LDSB1_AFC0_AFEM1_AFEM1_ASEM1_CLR1_CADS0_DTVA0_DTVB0_EPS0_FDSI0_GRPM1_GRVWA4_GRVWB8_GSU0_GSUAMB_GSUC0_GSUWGMRR0_GLS0_ISA942_IU1_K1_LBSPPA512_LBSPPB2048_LBSPPM0_LPA32_LPB64_LPM0_LRVW16_LWPMn1_MIAV0_MIWT8_4_MO40_NTn1_NTA0_NTB0_NTC0_NTD0_NTM0_NEPBS0_NLCA1_NLCB1_ONLL1_PGR2_PLR1_PKA1_SIA3_SS1_SU0_SUM0_SUS128_SPO0_SRVW0_SSO0_SVW4_SK3_SKXCCM8_TLDS1_ULSGRO0_USL1_UIOFGRO0_USFGRO0_VSn1_VWA4_VWB4_WSGRA0_WSGRB0_WS64_WG32_8_1_WGM8_WGMXCC1_WGMXCCGn1
    SolutionIndex: 43
    SolutionNameMin: Cijk_Alik_Bjlk_I8BH_UserArgs_MT128x128x128_MI16x16x1_SN_LDSB1_AFC0_AFEM1_AFEM1_ASEM1_CLR1_CADS0_DTVA0_DTVB0_EPS0_FDSI0_GRPM1_GRVWA4_GRVWB4_GSU0_GSUAMB_GSUC0_GSUWGMRR0_GLS0_ISA942_IU1_K1_LBSPPA512_LBSPPB2048_LBSPPM0_LPA32_LPB64_LPM0_LRVW16_LWPMn1_MIAV0_MIWT4_4_MO40_NTn1_NTA0_NTB0_NTC0_NTD0_NTM0_NEPBS0_NLCA1_NLCB1_ONLL1_PGR2_PLR1_PKA1_SIA3_SS1_SU0_SUM0_SUS128_SPO0_SRVW0_SSO0_SVW4_SK3_SKXCCM8_TLDS1_ULSGRO0_USL1_UIOFGRO0_USFGRO0_VSn1_VWA4_VWB4_WSGRA0_WSGRB0_WS64_WG32_8_1_WGM1_WGMXCC1_WGMXCCGn1
    SolutionIndex: 44
    SolutionNameMin: Cijk_Alik_Bjlk_I8BH_UserArgs_MT128x128x128_MI16x16x1_SN_LDSB1_AFC0_AFEM1_AFEM1_ASEM1_CLR1_CADS0_DTVA0_DTVB0_EPS0_FDSI0_GRPM1_GRVWA4_GRVWB4_GSU0_GSUAMB_GSUC0_GSUWGMRR0_GLS0_ISA942_IU1_K1_LBSPPA512_LBSPPB2048_LBSPPM0_LPA32_LPB64_LPM0_LRVW16_LWPMn1_MIAV0_MIWT4_4_MO40_NTn1_NTA0_NTB0_NTC0_NTD0_NTM0_NEPBS0_NLCA1_NLCB1_ONLL1_PGR2_PLR1_PKA1_SIA3_SS1_SU0_SUM0_SUS128_SPO0_SRVW0_SSO0_SVW4_SK3_SKXCCM8_TLDS1_ULSGRO0_USL1_UIOFGRO0_USFGRO0_VSn1_VWA4_VWB4_WSGRA0_WSGRB0_WS64_WG32_8_1_WGM4_WGMXCC1_WGMXCCGn1
    SolutionIndex: 45
    SolutionNameMin: Cijk_Alik_Bjlk_I8BH_UserArgs_MT128x128x128_MI16x16x1_SN_LDSB1_AFC0_AFEM1_AFEM1_ASEM1_CLR1_CADS0_DTVA0_DTVB0_EPS0_FDSI0_GRPM1_GRVWA4_GRVWB4_GSU0_GSUAMB_GSUC0_GSUWGMRR0_GLS0_ISA942_IU1_K1_LBSPPA512_LBSPPB2048_LBSPPM0_LPA32_LPB64_LPM0_LRVW16_LWPMn1_MIAV0_MIWT4_4_MO40_NTn1_NTA0_NTB0_NTC0_NTD0_NTM0_NEPBS0_NLCA1_NLCB1_ONLL1_PGR2_PLR1_PKA1_SIA3_SS1_SU0_SUM0_SUS128_SPO0_SRVW0_SSO0_SVW4_SK3_SKXCCM8_TLDS1_ULSGRO0_USL1_UIOFGRO0_USFGRO0_VSn1_VWA4_VWB4_WSGRA0_WSGRB0_WS64_WG32_8_1_WGM8_WGMXCC1_WGMXCCGn1
    SolutionIndex: 46
    SolutionNameMin: Cijk_Alik_Bjlk_I8BH_UserArgs_MT128x64x128_MI16x16x1_SN_LDSB1_AFC0_AFEM1_AFEM1_ASEM1_CLR1_CADS0_DTVA0_DTVB0_EPS0_FDSI0_GRPM1_GRVWA4_GRVWB8_GSU0_GSUAMB_GSUC0_GSUWGMRR0_GLS0_ISA942_IU1_K1_LBSPPA512_LBSPPB1024_LBSPPM0_LPA32_LPB32_LPM0_LRVW16_LWPMn1_MIAV0_MIWT4_2_MO40_NTn1_NTA0_NTB0_NTC0_NTD0_NTM0_NEPBS0_NLCA1_NLCB1_ONLL1_PGR2_PLR1_PKA1_SIA3_SS1_SU0_SUM0_SUS128_SPO0_SRVW0_SSO0_SVW4_SK3_SKXCCM8_TLDS1_ULSGRO0_USL1_UIOFGRO0_USFGRO0_VSn1_VWA4_VWB2_WSGRA0_WSGRB0_WS64_WG32_8_1_WGM1_WGMXCC1_WGMXCCGn1
    SolutionIndex: 47
    SolutionNameMin: Cijk_Alik_Bjlk_I8BH_UserArgs_MT64x64x128_MI16x16x1_SN_LDSB1_AFC0_AFEM1_AFEM1_ASEM1_CLR1_CADS0_DTVA0_DTVB0_EPS0_FDSI0_GRPM1_GRVWA4_GRVWB4_GSU0_GSUAMB_GSUC0_GSUWGMRR0_GLS0_ISA942_IU1_K1_LBSPPA256_LBSPPB1024_LBSPPM0_LPA32_LPB32_LPM0_LRVW16_LWPMn1_MIAV0_MIWT2_2_MO40_NTn1_NTA0_NTB0_NTC0_NTD0_NTM0_NEPBS0_NLCA1_NLCB1_ONLL1_PGR2_PLR1_PKA1_SIA3_SS1_SU0_SUM0_SUS128_SPO0_SRVW0_SSO0_SVW2_SK3_SKXCCM8_TLDS1_ULSGRO0_USL1_UIOFGRO0_USFGRO0_VSn1_VWA2_VWB2_WSGRA0_WSGRB0_WS64_WG32_8_1_WGM1_WGMXCC1_WGMXCCGn1
    SolutionIndex: 48
    SolutionNameMin: Cijk_Alik_Bjlk_I8BH_UserArgs_MT64x64x128_MI16x16x1_SN_LDSB1_AFC0_AFEM1_AFEM1_ASEM1_CLR1_CADS0_DTVA0_DTVB0_EPS0_FDSI0_GRPM1_GRVWA4_GRVWB8_GSU0_GSUAMB_GSUC0_GSUWGMRR0_GLS0_ISA942_IU1_K1_LBSPPA256_LBSPPB1024_LBSPPM0_LPA32_LPB32_LPM0_LRVW16_LWPMn1_MIAV0_MIWT2_2_MO40_NTn1_NTA0_NTB0_NTC0_NTD0_NTM0_NEPBS0_NLCA1_NLCB1_ONLL1_PGR2_PLR1_PKA1_SIA3_SS1_SU0_SUM0_SUS128_SPO0_SRVW0_SSO0_SVW2_SK3_SKXCCM8_TLDS1_ULSGRO0_USL1_UIOFGRO0_USFGRO0_VSn1_VWA2_VWB2_WSGRA0_WSGRB0_WS64_WG32_8_1_WGM1_WGMXCC1_WGMXCCGn1
    SolutionIndex: 49
    SolutionNameMin: Cijk_Alik_Bjlk_I8BH_UserArgs_MT64x32x128_MI16x16x1_SN_LDSB0_AFC0_AFEM1_AFEM1_ASEM1_CLR1_CADS0_DTVA0_DTVB0_EPS0_FDSI0_GRPM1_GRVWA4_GRVWB4_GSU0_GSUAMB_GSUC0_GSUWGMRR0_GLS0_ISA942_IU1_K1_LBSPPA128_LBSPPB512_LBSPPM0_LPA32_LPB16_LPM0_LRVW16_LWPMn1_MIAV0_MIWT2_1_MO40_NTn1_NTA0_NTB0_NTC0_NTD0_NTM0_NEPBS0_NLCA1_NLCB1_ONLL1_PGR2_PLR1_PKA1_SIA3_SS1_SU0_SUM0_SUS128_SPO0_SRVW0_SSO0_SVW1_SK3_SKXCCM8_TLDS1_ULSGRO0_USL1_UIOFGRO0_USFGRO0_VSn1_VWA1_VWB1_WSGRA0_WSGRB0_WS64_WG32_8_1_WGM1_WGMXCC1_WGMXCCGn1
    SolutionIndex: 50
    SolutionNameMin: Cijk_Alik_Bjlk_I8BH_UserArgs_MT64x32x128_MI16x16x1_SN_LDSB0_AFC0_AFEM1_AFEM1_ASEM1_CLR1_CADS0_DTVA0_DTVB0_EPS0_FDSI0_GRPM1_GRVWA4_GRVWB4_GSU0_GSUAMB_GSUC0_GSUWGMRR0_GLS0_ISA942_IU1_K1_LBSPPA256_LBSPPB512_LBSPPM0_LPA32_LPB16_LPM0_LRVW16_LWPMn1_MIAV0_MIWT2_1_MO40_NTn1_NTA0_NTB0_NTC0_NTD0_NTM0_NEPBS0_NLCA1_NLCB1_ONLL1_PGR2_PLR1_PKA1_SIA3_SS1_SU0_SUM0_SUS128_SPO0_SRVW0_SSO0_SVW2_SK3_SKXCCM8_TLDS1_ULSGRO0_USL1_UIOFGRO0_USFGRO0_VSn1_VWA2_VWB1_WSGRA0_WSGRB0_WS64_WG32_8_1_WGM1_WGMXCC1_WGMXCCGn1
    SolutionIndex: 51
    SolutionNameMin: Cijk_Alik_Bjlk_I8BH_UserArgs_MT64x32x128_MI16x16x1_SN_LDSB0_AFC0_AFEM1_AFEM1_ASEM1_CLR1_CADS0_DTVA0_DTVB0_EPS0_FDSI0_GRPM1_GRVWA8_GRVWB4_GSU0_GSUAMB_GSUC0_GSUWGMRR0_GLS0_ISA942_IU1_K1_LBSPPA256_LBSPPB512_LBSPPM0_LPA32_LPB16_LPM0_LRVW16_LWPMn1_MIAV0_MIWT2_1_MO40_NTn1_NTA0_NTB0_NTC0_NTD0_NTM0_NEPBS0_NLCA1_NLCB1_ONLL1_PGR2_PLR1_PKA1_SIA3_SS1_SU0_SUM0_SUS128_SPO0_SRVW0_SSO0_SVW2_SK3_SKXCCM8_TLDS1_ULSGRO0_USL1_UIOFGRO0_USFGRO0_VSn1_VWA2_VWB1_WSGRA0_WSGRB0_WS64_WG32_8_1_WGM1_WGMXCC1_WGMXCCGn1
    SolutionIndex: 52
    SolutionNameMin: Cijk_Alik_Bjlk_I8BH_UserArgs_MT64x32x128_MI16x16x1_SN_LDSB0_AFC0_AFEM1_AFEM1_ASEM1_CLR1_CADS0_DTVA0_DTVB0_EPS0_FDSI0_GRPM1_GRVWA4_GRVWB8_GSU0_GSUAMB_GSUC0_GSUWGMRR0_GLS0_ISA942_IU1_K1_LBSPPA256_LBSPPB512_LBSPPM0_LPA32_LPB16_LPM0_LRVW16_LWPMn1_MIAV0_MIWT2_1_MO40_NTn1_NTA0_NTB0_NTC0_NTD0_NTM0_NEPBS0_NLCA1_NLCB1_ONLL1_PGR2_PLR1_PKA1_SIA3_SS1_SU0_SUM0_SUS128_SPO0_SRVW0_SSO0_SVW2_SK3_SKXCCM8_TLDS1_ULSGRO0_USL1_UIOFGRO0_USFGRO0_VSn1_VWA2_VWB1_WSGRA0_WSGRB0_WS64_WG32_8_1_WGM1_WGMXCC1_WGMXCCGn1
    SolutionIndex: 53
    SolutionNameMin: Cijk_Alik_Bjlk_I8BH_UserArgs_MT32x32x128_MI16x16x1_SN_LDSB0_AFC0_AFEM1_AFEM1_ASEM1_CLR1_CADS0_DTVA0_DTVB0_EPS0_FDSI0_GRPM1_GRVWA4_GRVWB2_GSU0_GSUAMB_GSUC0_GSUWGMRR0_GLS0_ISA942_IU1_K1_LBSPPA128_LBSPPB512_LBSPPM0_LPA32_LPB16_LPM0_LRVW16_LWPMn1_MIAV0_MIWT1_1_MO40_NTn1_NTA0_NTB0_NTC0_NTD0_NTM0_NEPBS0_NLCA1_NLCB1_ONLL1_PGR2_PLR1_PKA1_SIA3_SS1_SU0_SUM0_SUS128_SPO0_SRVW0_SSO0_SVW1_SK3_SKXCCM8_TLDS1_ULSGRO0_USL1_UIOFGRO0_USFGRO0_VSn1_VWA1_VWB1_WSGRA0_WSGRB0_WS64_WG32_8_1_WGM1_WGMXCC1_WGMXCCGn1
    SolutionIndex: 54
    SolutionNameMin: Cijk_Alik_Bjlk_I8BH_UserArgs_MT32x32x128_MI16x16x1_SN_LDSB0_AFC0_AFEM1_AFEM1_ASEM1_CLR1_CADS0_DTVA0_DTVB0_EPS0_FDSI0_GRPM1_GRVWA4_GRVWB4_GSU0_GSUAMB_GSUC0_GSUWGMRR0_GLS0_ISA942_IU1_K1_LBSPPA128_LBSPPB512_LBSPPM0_LPA32_LPB16_LPM0_LRVW16_LWPMn1_MIAV0_MIWT1_1_MO40_NTn1_NTA0_NTB0_NTC0_NTD0_NTM0_NEPBS0_NLCA1_NLCB1_ONLL1_PGR2_PLR1_PKA1_SIA3_SS1_SU0_SUM0_SUS128_SPO0_SRVW0_SSO0_SVW1_SK3_SKXCCM8_TLDS1_ULSGRO0_USL1_UIOFGRO0_USFGRO0_VSn1_VWA1_VWB1_WSGRA0_WSGRB0_WS64_WG32_8_1_WGM1_WGMXCC1_WGMXCCGn1
    SolutionIndex: 55
    SolutionNameMin: Cijk_Alik_Bjlk_I8BH_UserArgs_MT32x32x128_MI16x16x1_SN_LDSB0_AFC0_AFEM1_AFEM1_ASEM1_CLR1_CADS0_DTVA0_DTVB0_EPS0_FDSI0_GRPM1_GRVWA8_GRVWB4_GSU0_GSUAMB_GSUC0_GSUWGMRR0_GLS0_ISA942_IU1_K1_LBSPPA128_LBSPPB512_LBSPPM0_LPA32_LPB16_LPM0_LRVW16_LWPMn1_MIAV0_MIWT1_1_MO40_NTn1_NTA0_NTB0_NTC0_NTD0_NTM0_NEPBS0_NLCA1_NLCB1_ONLL1_PGR2_PLR1_PKA1_SIA3_SS1_SU0_SUM0_SUS128_SPO0_SRVW0_SSO0_SVW1_SK3_SKXCCM8_TLDS1_ULSGRO0_USL1_UIOFGRO0_USFGRO0_VSn1_VWA1_VWB1_WSGRA0_WSGRB0_WS64_WG32_8_1_WGM1_WGMXCC1_WGMXCCGn1
    SolutionIndex: 56
    SolutionNameMin: Cijk_Alik_Bjlk_I8BH_UserArgs_MT32x32x128_MI16x16x1_SN_LDSB0_AFC0_AFEM1_AFEM1_ASEM1_CLR1_CADS0_DTVA0_DTVB0_EPS0_FDSI0_GRPM1_GRVWA4_GRVWB8_GSU0_GSUAMB_GSUC0_GSUWGMRR0_GLS0_ISA942_IU1_K1_LBSPPA128_LBSPPB512_LBSPPM0_LPA32_LPB16_LPM0_LRVW16_LWPMn1_MIAV0_MIWT1_1_MO40_NTn1_NTA0_NTB0_NTC0_NTD0_NTM0_NEPBS0_NLCA1_NLCB1_ONLL1_PGR2_PLR1_PKA1_SIA3_SS1_SU0_SUM0_SUS128_SPO0_SRVW0_SSO0_SVW1_SK3_SKXCCM8_TLDS1_ULSGRO0_USL1_UIOFGRO0_USFGRO0_VSn1_VWA1_VWB1_WSGRA0_WSGRB0_WS64_WG32_8_1_WGM1_WGMXCC1_WGMXCCGn1
    SolutionIndex: 57
    SolutionNameMin: Cijk_Alik_Bjlk_I8BH_UserArgs_MT32x32x128_MI16x16x1_SN_LDSB0_AFC0_AFEM1_AFEM1_ASEM1_CLR1_CADS0_DTVA0_DTVB0_EPS0_FDSI0_GRPM1_GRVWA8_GRVWB8_GSU0_GSUAMB_GSUC0_GSUWGMRR0_GLS0_ISA942_IU1_K1_LBSPPA128_LBSPPB512_LBSPPM0_LPA32_LPB16_LPM0_LRVW16_LWPMn1_MIAV0_MIWT1_1_MO40_NTn1_NTA0_NTB0_NTC0_NTD0_NTM0_NEPBS0_NLCA1_NLCB1_ONLL1_PGR2_PLR1_PKA1_SIA3_SS1_SU0_SUM0_SUS128_SPO0_SRVW0_SSO0_SVW1_SK3_SKXCCM8_TLDS1_ULSGRO0_USL1_UIOFGRO0_USFGRO0_VSn1_VWA1_VWB1_WSGRA0_WSGRB0_WS64_WG32_8_1_WGM1_WGMXCC1_WGMXCCGn1
    SolutionIndex: 58
    SolutionNameMin: Cijk_Alik_Bjlk_I8BH_UserArgs_MT128x64x256_MI16x16x1_SN_LDSB1_AFC0_AFEM1_AFEM1_ASEM1_CLR1_CADS0_DTVA0_DTVB0_EPS0_FDSI0_GRPM1_GRVWA4_GRVWB4_GSU0_GSUAMB_GSUC0_GSUWGMRR0_GLS0_ISA942_IU1_K1_LBSPPA512_LBSPPB1024_LBSPPM0_LPA32_LPB32_LPM0_LRVW16_LWPMn1_MIAV0_MIWT4_2_MO40_NTn1_NTA0_NTB0_NTC0_NTD0_NTM0_NEPBS0_NLCA1_NLCB1_ONLL1_PGR2_PLR2_PKA1_SIA3_SS1_SU0_SUM0_SUS256_SPO0_SRVW0_SSO0_SVW2_SK3_SKXCCM8_TLDS1_ULSGRO0_USL1_UIOFGRO0_USFGRO0_VSn1_VWA2_VWB2_WSGRA0_WSGRB0_WS64_WG32_8_1_WGM1_WGMXCC1_WGMXCCGn1
    SolutionIndex: 59
    SolutionNameMin: Cijk_Alik_Bjlk_I8BH_UserArgs_MT128x64x256_MI16x16x1_SN_LDSB1_AFC0_AFEM1_AFEM1_ASEM1_CLR1_CADS0_DTVA0_DTVB0_EPS0_FDSI0_GRPM1_GRVWA4_GRVWB4_GSU0_GSUAMB_GSUC0_GSUWGMRR0_GLS0_ISA942_IU1_K1_LBSPPA1024_LBSPPB1024_LBSPPM0_LPA32_LPB32_LPM0_LRVW16_LWPMn1_MIAV0_MIWT4_2_MO40_NTn1_NTA0_NTB0_NTC0_NTD0_NTM0_NEPBS0_NLCA1_NLCB1_ONLL1_PGR2_PLR2_PKA1_SIA3_SS1_SU0_SUM0_SUS256_SPO0_SRVW0_SSO0_SVW4_SK3_SKXCCM8_TLDS1_ULSGRO0_USL1_UIOFGRO0_USFGRO0_VSn1_VWA4_VWB2_WSGRA0_WSGRB0_WS64_WG32_8_1_WGM1_WGMXCC1_WGMXCCGn1
    SolutionIndex: 60
    SolutionNameMin: Cijk_Alik_Bjlk_I8BH_UserArgs_MT128x64x256_MI16x16x1_SN_LDSB1_AFC0_AFEM1_AFEM1_ASEM1_CLR1_CADS0_DTVA0_DTVB0_EPS0_FDSI0_GRPM1_GRVWA4_GRVWB8_GSU0_GSUAMB_GSUC0_GSUWGMRR0_GLS0_ISA942_IU1_K1_LBSPPA1024_LBSPPB1024_LBSPPM0_LPA32_LPB32_LPM0_LRVW16_LWPMn1_MIAV0_MIWT4_2_MO40_NTn1_NTA0_NTB0_NTC0_NTD0_NTM0_NEPBS0_NLCA1_NLCB1_ONLL1_PGR2_PLR2_PKA1_SIA3_SS1_SU0_SUM0_SUS256_SPO0_SRVW0_SSO0_SVW4_SK3_SKXCCM8_TLDS1_ULSGRO0_USL1_UIOFGRO0_USFGRO0_VSn1_VWA4_VWB2_WSGRA0_WSGRB0_WS64_WG32_8_1_WGM1_WGMXCC1_WGMXCCGn1
    SolutionIndex: 61
    SolutionNameMin: Cijk_Alik_Bjlk_I8BH_UserArgs_MT128x64x256_MI16x16x1_SN_LDSB1_AFC0_AFEM1_AFEM1_ASEM1_CLR1_CADS0_DTVA0_DTVB0_EPS0_FDSI0_GRPM1_GRVWA4_GRVWB4_GSU0_GSUAMB_GSUC0_GSUWGMRR0_GLS0_ISA942_IU1_K1_LBSPPA1024_LBSPPB1024_LBSPPM0_LPA32_LPB32_LPM0_LRVW16_LWPMn1_MIAV0_MIWT4_2_MO40_NTn1_NTA0_NTB0_NTC0_NTD0_NTM0_NEPBS0_NLCA1_NLCB1_ONLL1_PGR2_PLR2_PKA1_SIA3_SS1_SU0_SUM0_SUS256_SPO0_SRVW0_SSO0_SVW4_SK3_SKXCCM8_TLDS1_ULSGRO0_USL1_UIOFGRO0_USFGRO0_VSn1_VWA4_VWB2_WSGRA0_WSGRB0_WS64_WG32_8_1_WGM4_WGMXCC1_WGMXCCGn1
    SolutionIndex: 62
    SolutionNameMin: Cijk_Alik_Bjlk_I8BH_UserArgs_MT128x64x256_MI16x16x1_SN_LDSB1_AFC0_AFEM1_AFEM1_ASEM1_CLR1_CADS0_DTVA0_DTVB0_EPS0_FDSI0_GRPM1_GRVWA4_GRVWB8_GSU0_GSUAMB_GSUC0_GSUWGMRR0_GLS0_ISA942_IU1_K1_LBSPPA1024_LBSPPB1024_LBSPPM0_LPA32_LPB32_LPM0_LRVW16_LWPMn1_MIAV0_MIWT4_2_MO40_NTn1_NTA0_NTB0_NTC0_NTD0_NTM0_NEPBS0_NLCA1_NLCB1_ONLL1_PGR2_PLR2_PKA1_SIA3_SS1_SU0_SUM0_SUS256_SPO0_SRVW0_SSO0_SVW4_SK3_SKXCCM8_TLDS1_ULSGRO0_USL1_UIOFGRO0_USFGRO0_VSn1_VWA4_VWB2_WSGRA0_WSGRB0_WS64_WG32_8_1_WGM4_WGMXCC1_WGMXCCGn1
    SolutionIndex: 63
    SolutionNameMin: Cijk_Alik_Bjlk_I8BH_UserArgs_MT128x64x256_MI16x16x1_SN_LDSB1_AFC0_AFEM1_AFEM1_ASEM1_CLR1_CADS0_DTVA0_DTVB0_EPS0_FDSI0_GRPM1_GRVWA4_GRVWB4_GSU0_GSUAMB_GSUC0_GSUWGMRR0_GLS0_ISA942_IU1_K1_LBSPPA1024_LBSPPB1024_LBSPPM0_LPA32_LPB32_LPM0_LRVW16_LWPMn1_MIAV0_MIWT4_2_MO40_NTn1_NTA0_NTB0_NTC0_NTD0_NTM0_NEPBS0_NLCA1_NLCB1_ONLL1_PGR2_PLR2_PKA1_SIA3_SS1_SU0_SUM0_SUS256_SPO0_SRVW0_SSO0_SVW4_SK3_SKXCCM8_TLDS1_ULSGRO0_USL1_UIOFGRO0_USFGRO0_VSn1_VWA4_VWB2_WSGRA0_WSGRB0_WS64_WG32_8_1_WGM8_WGMXCC1_WGMXCCGn1
    SolutionIndex: 64
    SolutionNameMin: Cijk_Alik_Bjlk_I8BH_UserArgs_MT128x32x256_MI16x16x1_SN_LDSB1_AFC0_AFEM1_AFEM1_ASEM1_CLR1_CADS0_DTVA0_DTVB0_EPS0_FDSI0_GRPM1_GRVWA4_GRVWB8_GSU0_GSUAMB_GSUC0_GSUWGMRR0_GLS0_ISA942_IU1_K1_LBSPPA512_LBSPPB512_LBSPPM0_LPA32_LPB16_LPM0_LRVW16_LWPMn1_MIAV0_MIWT4_1_MO40_NTn1_NTA0_NTB0_NTC0_NTD0_NTM0_NEPBS0_NLCA1_NLCB1_ONLL1_PGR2_PLR2_PKA1_SIA3_SS1_SU0_SUM0_SUS256_SPO0_SRVW0_SSO0_SVW2_SK3_SKXCCM8_TLDS1_ULSGRO0_USL1_UIOFGRO0_USFGRO0_VSn1_VWA2_VWB1_WSGRA0_WSGRB0_WS64_WG32_8_1_WGM1_WGMXCC1_WGMXCCGn1
    SolutionIndex: 65
    SolutionNameMin: Cijk_Alik_Bjlk_I8BH_UserArgs_MT128x32x256_MI16x16x1_SN_LDSB1_AFC0_AFEM1_AFEM1_ASEM1_CLR1_CADS0_DTVA0_DTVB0_EPS0_FDSI0_GRPM1_GRVWA4_GRVWB8_GSU0_GSUAMB_GSUC0_GSUWGMRR0_GLS0_ISA942_IU1_K1_LBSPPA1024_LBSPPB512_LBSPPM0_LPA32_LPB16_LPM0_LRVW16_LWPMn1_MIAV0_MIWT4_1_MO40_NTn1_NTA0_NTB0_NTC0_NTD0_NTM0_NEPBS0_NLCA1_NLCB1_ONLL1_PGR2_PLR2_PKA1_SIA3_SS1_SU0_SUM0_SUS256_SPO0_SRVW0_SSO0_SVW4_SK3_SKXCCM8_TLDS1_ULSGRO0_USL1_UIOFGRO0_USFGRO0_VSn1_VWA4_VWB1_WSGRA0_WSGRB0_WS64_WG32_8_1_WGM4_WGMXCC1_WGMXCCGn1
    SolutionIndex: 66
    SolutionNameMin: Cijk_Alik_Bjlk_I8BH_UserArgs_MT64x64x256_MI16x16x1_SN_LDSB1_AFC0_AFEM1_AFEM1_ASEM1_CLR1_CADS0_DTVA0_DTVB0_EPS0_FDSI0_GRPM1_GRVWA4_GRVWB4_GSU0_GSUAMB_GSUC0_GSUWGMRR0_GLS0_ISA942_IU1_K1_LBSPPA512_LBSPPB1024_LBSPPM0_LPA32_LPB32_LPM0_LRVW16_LWPMn1_MIAV0_MIWT2_2_MO40_NTn1_NTA0_NTB0_NTC0_NTD0_NTM0_NEPBS0_NLCA1_NLCB1_ONLL1_PGR2_PLR2_PKA1_SIA3_SS1_SU0_SUM0_SUS256_SPO0_SRVW0_SSO0_SVW2_SK3_SKXCCM8_TLDS1_ULSGRO0_USL1_UIOFGRO0_USFGRO0_VSn1_VWA2_VWB2_WSGRA0_WSGRB0_WS64_WG32_8_1_WGM1_WGMXCC1_WGMXCCGn1
    SolutionIndex: 67
    SolutionNameMin: Cijk_Alik_Bjlk_I8BH_UserArgs_MT64x64x256_MI16x16x1_SN_LDSB1_AFC0_AFEM1_AFEM1_ASEM1_CLR1_CADS0_DTVA0_DTVB0_EPS0_FDSI0_GRPM1_GRVWA4_GRVWB4_GSU0_GSUAMB_GSUC0_GSUWGMRR0_GLS0_ISA942_IU1_K1_LBSPPA512_LBSPPB1024_LBSPPM0_LPA32_LPB32_LPM0_LRVW16_LWPMn1_MIAV0_MIWT2_2_MO40_NTn1_NTA0_NTB0_NTC0_NTD0_NTM0_NEPBS0_NLCA1_NLCB1_ONLL1_PGR2_PLR2_PKA1_SIA3_SS1_SU0_SUM0_SUS256_SPO0_SRVW0_SSO0_SVW2_SK3_SKXCCM8_TLDS1_ULSGRO0_USL1_UIOFGRO0_USFGRO0_VSn1_VWA2_VWB2_WSGRA0_WSGRB0_WS64_WG32_8_1_WGM4_WGMXCC1_WGMXCCGn1
    SolutionIndex: 68
    SolutionNameMin: Cijk_Alik_Bjlk_I8BH_UserArgs_MT64x32x256_MI16x16x1_SN_LDSB1_AFC0_AFEM1_AFEM1_ASEM1_CLR1_CADS0_DTVA0_DTVB0_EPS0_FDSI0_GRPM1_GRVWA4_GRVWB8_GSU0_GSUAMB_GSUC0_GSUWGMRR0_GLS0_ISA942_IU1_K1_LBSPPA256_LBSPPB512_LBSPPM0_LPA32_LPB16_LPM0_LRVW16_LWPMn1_MIAV0_MIWT2_1_MO40_NTn1_NTA0_NTB0_NTC0_NTD0_NTM0_NEPBS0_NLCA1_NLCB1_ONLL1_PGR2_PLR1_PKA1_SIA3_SS1_SU0_SUM0_SUS256_SPO0_SRVW0_SSO0_SVW1_SK3_SKXCCM8_TLDS1_ULSGRO0_USL1_UIOFGRO0_USFGRO0_VSn1_VWA1_VWB1_WSGRA0_WSGRB0_WS64_WG32_8_1_WGM1_WGMXCC1_WGMXCCGn1
    SolutionIndex: 69
    SolutionNameMin: Cijk_Alik_Bjlk_I8BH_UserArgs_MT64x32x256_MI16x16x1_SN_LDSB1_AFC0_AFEM1_AFEM1_ASEM1_CLR1_CADS0_DTVA0_DTVB0_EPS0_FDSI0_GRPM1_GRVWA4_GRVWB8_GSU0_GSUAMB_GSUC0_GSUWGMRR0_GLS0_ISA942_IU1_K1_LBSPPA256_LBSPPB512_LBSPPM0_LPA32_LPB16_LPM0_LRVW16_LWPMn1_MIAV0_MIWT2_1_MO40_NTn1_NTA0_NTB0_NTC0_NTD0_NTM0_NEPBS0_NLCA1_NLCB1_ONLL1_PGR2_PLR2_PKA1_SIA3_SS1_SU0_SUM0_SUS256_SPO0_SRVW0_SSO0_SVW1_SK3_SKXCCM8_TLDS1_ULSGRO0_USL1_UIOFGRO0_USFGRO0_VSn1_VWA1_VWB1_WSGRA0_WSGRB0_WS64_WG32_8_1_WGM1_WGMXCC1_WGMXCCGn1
    SolutionIndex: 70
    SolutionNameMin: Cijk_Alik_Bjlk_I8BH_UserArgs_MT64x32x256_MI16x16x1_SN_LDSB1_AFC0_AFEM1_AFEM1_ASEM1_CLR1_CADS0_DTVA0_DTVB0_EPS0_FDSI0_GRPM1_GRVWA4_GRVWB8_GSU0_GSUAMB_GSUC0_GSUWGMRR0_GLS0_ISA942_IU1_K1_LBSPPA512_LBSPPB512_LBSPPM0_LPA32_LPB16_LPM0_LRVW16_LWPMn1_MIAV0_MIWT2_1_MO40_NTn1_NTA0_NTB0_NTC0_NTD0_NTM0_NEPBS0_NLCA1_NLCB1_ONLL1_PGR2_PLR2_PKA1_SIA3_SS1_SU0_SUM0_SUS256_SPO0_SRVW0_SSO0_SVW2_SK3_SKXCCM8_TLDS1_ULSGRO0_USL1_UIOFGRO0_USFGRO0_VSn1_VWA2_VWB1_WSGRA0_WSGRB0_WS64_WG32_8_1_WGM1_WGMXCC1_WGMXCCGn1
    SolutionIndex: 71
    SolutionNameMin: Cijk_Alik_Bjlk_I8BH_UserArgs_MT64x32x256_MI16x16x1_SN_LDSB1_AFC0_AFEM1_AFEM1_ASEM1_CLR1_CADS0_DTVA0_DTVB0_EPS0_FDSI0_GRPM1_GRVWA4_GRVWB8_GSU0_GSUAMB_GSUC0_GSUWGMRR0_GLS0_ISA942_IU1_K1_LBSPPA512_LBSPPB512_LBSPPM0_LPA32_LPB16_LPM0_LRVW16_LWPMn1_MIAV0_MIWT2_1_MO40_NTn1_NTA0_NTB0_NTC0_NTD0_NTM0_NEPBS0_NLCA1_NLCB1_ONLL1_PGR2_PLR2_PKA1_SIA3_SS1_SU0_SUM0_SUS256_SPO0_SRVW0_SSO0_SVW2_SK3_SKXCCM8_TLDS1_ULSGRO0_USL1_UIOFGRO0_USFGRO0_VSn1_VWA2_VWB1_WSGRA0_WSGRB0_WS64_WG32_8_1_WGM4_WGMXCC1_WGMXCCGn1
    SolutionIndex: 72
    SolutionNameMin: Cijk_Alik_Bjlk_I8BH_UserArgs_MT64x32x256_MI16x16x1_SN_LDSB1_AFC0_AFEM1_AFEM1_ASEM1_CLR1_CADS0_DTVA0_DTVB0_EPS0_FDSI0_GRPM1_GRVWA4_GRVWB8_GSU0_GSUAMB_GSUC0_GSUWGMRR0_GLS0_ISA942_IU1_K1_LBSPPA256_LBSPPB512_LBSPPM0_LPA32_LPB16_LPM0_LRVW16_LWPMn1_MIAV0_MIWT2_1_MO40_NTn1_NTA0_NTB0_NTC0_NTD0_NTM0_NEPBS0_NLCA1_NLCB1_ONLL1_PGR2_PLR2_PKA1_SIA3_SS1_SU0_SUM0_SUS256_SPO0_SRVW0_SSO0_SVW1_SK3_SKXCCM8_TLDS1_ULSGRO0_USL1_UIOFGRO0_USFGRO0_VSn1_VWA1_VWB1_WSGRA0_WSGRB0_WS64_WG32_8_1_WGM8_WGMXCC1_WGMXCCGn1
    SolutionIndex: 73
    SolutionNameMin: Cijk_Alik_Bjlk_I8BH_UserArgs_MT32x32x256_MI16x16x1_SN_LDSB1_AFC0_AFEM1_AFEM1_ASEM1_CLR1_CADS0_DTVA0_DTVB0_EPS0_FDSI0_GRPM1_GRVWA4_GRVWB8_GSU0_GSUAMB_GSUC0_GSUWGMRR0_GLS0_ISA942_IU1_K1_LBSPPA256_LBSPPB512_LBSPPM0_LPA32_LPB16_LPM0_LRVW16_LWPMn1_MIAV0_MIWT1_1_MO40_NTn1_NTA0_NTB0_NTC0_NTD0_NTM0_NEPBS0_NLCA1_NLCB1_ONLL1_PGR2_PLR1_PKA1_SIA3_SS1_SU0_SUM0_SUS256_SPO0_SRVW0_SSO0_SVW1_SK3_SKXCCM8_TLDS1_ULSGRO0_USL1_UIOFGRO0_USFGRO0_VSn1_VWA1_VWB1_WSGRA0_WSGRB0_WS64_WG32_8_1_WGM1_WGMXCC1_WGMXCCGn1
    SolutionIndex: 74
    SolutionNameMin: Cijk_Alik_Bjlk_I8BH_UserArgs_MT32x32x256_MI16x16x1_SN_LDSB1_AFC0_AFEM1_AFEM1_ASEM1_CLR1_CADS0_DTVA0_DTVB0_EPS0_FDSI0_GRPM1_GRVWA4_GRVWB8_GSU0_GSUAMB_GSUC0_GSUWGMRR0_GLS0_ISA942_IU1_K1_LBSPPA256_LBSPPB512_LBSPPM0_LPA32_LPB16_LPM0_LRVW16_LWPMn1_MIAV0_MIWT1_1_MO40_NTn1_NTA0_NTB0_NTC0_NTD0_NTM0_NEPBS0_NLCA1_NLCB1_ONLL1_PGR2_PLR2_PKA1_SIA3_SS1_SU0_SUM0_SUS256_SPO0_SRVW0_SSO0_SVW1_SK3_SKXCCM8_TLDS1_ULSGRO0_USL1_UIOFGRO0_USFGRO0_VSn1_VWA1_VWB1_WSGRA0_WSGRB0_WS64_WG32_8_1_WGM1_WGMXCC1_WGMXCCGn1
    SolutionIndex: 75
    SolutionNameMin: Cijk_Alik_Bjlk_I8BH_UserArgs_MT32x32x32_MI16x16x1_SN_LDSB0_AFC0_AFEM1_AFEM1_ASEM1_CLR0_CADS0_DTVA0_DTVB0_EPS0_FDSI0_GRPM1_GRVWA1_GRVWB1_GSU0_GSUAMB_GSUC0_GSUWGMRR0_GLS0_ISA942_IU1_K1_LBSPPA128_LBSPPB256_LBSPPM0_LPA8_LPB16_LPM0_LRVW8_LWPMn1_MIAV0_MIWT1_1_MO40_NTn1_NTA0_NTB0_NTC0_NTD0_NTM0_NEPBS0_NLCA1_NLCB1_ONLL1_PGR2_PLR0_PKA1_SIA3_SS1_SU32_SUM0_SUS256_SPO0_SRVW0_SSO0_SVW1_SK3_SKXCCM8_TLDS1_ULSGRO0_USL1_UIOFGRO0_USFGROn1_VSn1_VWA1_VWB1_WSGRA0_WSGRB0_WS64_WG32_8_1_WGM1_WGMXCC1_WGMXCCGn1
- - - [128, 128, 1, 128, 128, 128, 128, 128]
    - [36, 0.65]
  - - [128, 128, 1, 256, 128, 128, 256, 128]
    - [54, 1.15]
  - - [128, 128, 1, 512, 128, 128, 512, 128]
    - [57, 1.92]
  - - [128, 128, 1, 1024, 128, 128, 1024, 128]
    - [57, 2.91]
  - - [128, 128, 1, 2048, 128, 128, 2048, 128]
    - [57, 3.9]
  - - [128, 128, 1, 4096, 128, 128, 4096, 128]
    - [74, 4.8]
  - - [128, 128, 1, 8192, 128, 128, 8192, 128]
    - [74, 5.42]
  - - [128, 256, 1, 128, 128, 128, 128, 256]
    - [36, 1.27]
  - - [128, 256, 1, 256, 128, 128, 256, 256]
    - [54, 2.28]
  - - [128, 256, 1, 512, 128, 128, 512, 256]
    - [57, 3.81]
  - - [128, 256, 1, 1024, 128, 128, 1024, 256]
    - [57, 5.78]
  - - [128, 256, 1, 2048, 128, 128, 2048, 256]
    - [57, 7.81]
  - - [128, 256, 1, 4096, 128, 128, 4096, 256]
    - [74, 9.59]
  - - [128, 256, 1, 8192, 128, 128, 8192, 256]
    - [74, 10.83]
  - - [128, 512, 1, 128, 128, 128, 128, 512]
    - [36, 2.53]
  - - [128, 512, 1, 256, 128, 128, 256, 512]
    - [55, 4.54]
  - - [128, 512, 1, 512, 128, 128, 512, 512]
    - [56, 7.6]
  - - [128, 512, 1, 1024, 128, 128, 1024, 512]
    - [57, 11.4]
  - - [128, 512, 1, 2048, 128, 128, 2048, 512]
    - [57, 15.46]
  - - [128, 512, 1, 4096, 128, 128, 4096, 512]
    - [73, 18.89]
  - - [128, 512, 1, 8192, 128, 128, 8192, 512]
    - [74, 21.5]
  - - [128, 1024, 1, 128, 128, 128, 128, 1024]
    - [51, 4.71]
  - - [128, 1024, 1, 256, 128, 128, 256, 1024]
    - [32, 8.31]
  - - [128, 1024, 1, 512, 128, 128, 512, 1024]
    - [50, 13.3]
  - - [128, 1024, 1, 1024, 128, 128, 1024, 1024]
    - [49, 20.35]
  - - [128, 1024, 1, 2048, 128, 128, 2048, 1024]
    - [70, 28.14]
  - - [128, 1024, 1, 4096, 128, 128, 4096, 1024]
    - [70, 35.02]
  - - [128, 1024, 1, 8192, 128, 128, 8192, 1024]
    - [68, 35.61]
  - - [128, 2048, 1, 128, 128, 128, 128, 2048]
    - [30, 8.53]
  - - [128, 2048, 1, 256, 128, 128, 256, 2048]
    - [31, 14.78]
  - - [128, 2048, 1, 512, 128, 128, 512, 2048]
    - [47, 23.77]
  - - [128, 2048, 1, 1024, 128, 128, 1024, 2048]
    - [48, 35.08]
  - - [128, 2048, 1, 2048, 128, 128, 2048, 2048]
    - [48, 45.17]
  - - [128, 2048, 1, 4096, 128, 128, 4096, 2048]
    - [48, 53.55]
  - - [128, 2048, 1, 8192, 128, 128, 8192, 2048]
    - [48, 59.45]
  - - [128, 4096, 1, 128, 128, 128, 128, 4096]
    - [25, 14.52]
  - - [128, 4096, 1, 256, 128, 128, 256, 4096]
    - [25, 24.94]
  - - [128, 4096, 1, 512, 128, 128, 512, 4096]
    - [25, 39.25]
  - - [128, 4096, 1, 1024, 128, 128, 1024, 4096]
    - [27, 53.14]
  - - [128, 4096, 1, 2048, 128, 128, 2048, 4096]
    - [46, 67.61]
  - - [128, 4096, 1, 4096, 128, 128, 4096, 4096]
    - [46, 78.5]
  - - [128, 4096, 1, 8192, 128, 128, 8192, 4096]
    - [59, 87.85]
  - - [128, 8192, 1, 128, 128, 128, 128, 8192]
    - [6, 22.86]
  - - [128, 8192, 1, 256, 128, 128, 256, 8192]
    - [24, 38.31]
  - - [128, 8192, 1, 512, 128, 128, 512, 8192]
    - [24, 58.26]
  - - [128, 8192, 1, 1024, 128, 128, 1024, 8192]
    - [43, 78.46]
  - - [128, 8192, 1, 2048, 128, 128, 2048, 8192]
    - [43, 99.88]
  - - [128, 8192, 1, 4096, 128, 128, 4096, 8192]
    - [43, 115.55]
  - - [128, 8192, 1, 8192, 128, 128, 8192, 8192]
    - [43, 124.18]
  - - [256, 128, 1, 128, 256, 256, 128, 128]
    - [53, 1.26]
  - - [256, 128, 1, 256, 256, 256, 256, 128]
    - [55, 2.26]
  - - [256, 128, 1, 512, 256, 256, 512, 128]
    - [56, 3.81]
  - - [256, 128, 1, 1024, 256, 256, 1024, 128]
    - [57, 5.79]
  - - [256, 128, 1, 2048, 256, 256, 2048, 128]
    - [57, 7.81]
  - - [256, 128, 1, 4096, 256, 256, 4096, 128]
    - [74, 9.56]
  - - [256, 128, 1, 8192, 256, 256, 8192, 128]
    - [74, 10.81]
  - - [256, 256, 1, 128, 256, 256, 128, 256]
    - [35, 2.54]
  - - [256, 256, 1, 256, 256, 256, 256, 256]
    - [37, 4.61]
  - - [256, 256, 1, 512, 256, 256, 512, 256]
    - [57, 7.58]
  - - [256, 256, 1, 1024, 256, 256, 1024, 256]
    - [57, 11.49]
  - - [256, 256, 1, 2048, 256, 256, 2048, 256]
    - [57, 15.56]
  - - [256, 256, 1, 4096, 256, 256, 4096, 256]
    - [74, 19.06]
  - - [256, 256, 1, 8192, 256, 256, 8192, 256]
    - [74, 21.48]
  - - [256, 512, 1, 128, 256, 256, 128, 512]
    - [50, 4.68]
  - - [256, 512, 1, 256, 256, 256, 256, 512]
    - [32, 8.14]
  - - [256, 512, 1, 512, 256, 256, 512, 512]
    - [50, 13.43]
  - - [256, 512, 1, 1024, 256, 256, 1024, 512]
    - [70, 20.23]
  - - [256, 512, 1, 2048, 256, 256, 2048, 512]
    - [70, 28.15]
  - - [256, 512, 1, 4096, 256, 256, 4096, 512]
    - [70, 35.06]
  - - [256, 512, 1, 8192, 256, 256, 8192, 512]
    - [71, 39.49]
  - - [256, 1024, 1, 128, 256, 256, 128, 1024]
    - [30, 8.48]
  - - [256, 1024, 1, 256, 256, 256, 256, 1024]
    - [31, 14.79]
  - - [256, 1024, 1, 512, 256, 256, 512, 1024]
    - [47, 23.77]
  - - [256, 1024, 1, 1024, 256, 256, 1024, 1024]
    - [48, 35.08]
  - - [256, 1024, 1, 2048, 256, 256, 2048, 1024]
    - [66, 46.86]
  - - [256, 1024, 1, 4096, 256, 256, 4096, 1024]
    - [66, 56.94]
  - - [256, 1024, 1, 8192, 256, 256, 8192, 1024]
    - [64, 59.49]
  - - [256, 2048, 1, 128, 256, 256, 128, 2048]
    - [25, 14.49]
  - - [256, 2048, 1, 256, 256, 256, 256, 2048]
    - [25, 24.92]
  - - [256, 2048, 1, 512, 256, 256, 512, 2048]
    - [25, 39.24]
  - - [256, 2048, 1, 1024, 256, 256, 1024, 2048]
    - [27, 54.94]
  - - [256, 2048, 1, 2048, 256, 256, 2048, 2048]
    - [46, 67.54]
  - - [256, 2048, 1, 4096, 256, 256, 4096, 2048]
    - [46, 78.61]
  - - [256, 2048, 1, 8192, 256, 256, 8192, 2048]
    - [59, 87.96]
  - - [256, 4096, 1, 128, 256, 256, 128, 4096]
    - [6, 22.81]
  - - [256, 4096, 1, 256, 256, 256, 256, 4096]
    - [24, 38.59]
  - - [256, 4096, 1, 512, 256, 256, 512, 4096]
    - [24, 58.41]
  - - [256, 4096, 1, 1024, 256, 256, 1024, 4096]
    - [43, 79.5]
  - - [256, 4096, 1, 2048, 256, 256, 2048, 4096]
    - [43, 101.23]
  - - [256, 4096, 1, 4096, 256, 256, 4096, 4096]
    - [43, 116.96]
  - - [256, 4096, 1, 8192, 256, 256, 8192, 4096]
    - [43, 126.69]
  - - [256, 8192, 1, 128, 256, 256, 128, 8192]
    - [4, 32.95]
  - - [256, 8192, 1, 256, 256, 256, 256, 8192]
    - [21, 54.74]
  - - [256, 8192, 1, 512, 256, 256, 512, 8192]
    - [22, 83.58]
  - - [256, 8192, 1, 1024, 256, 256, 1024, 8192]
    - [38, 107.19]
  - - [256, 8192, 1, 2048, 256, 256, 2048, 8192]
    - [38, 138.01]
  - - [256, 8192, 1, 4096, 256, 256, 4096, 8192]
    - [38, 159.55]
  - - [256, 8192, 1, 8192, 256, 256, 8192, 8192]
    - [38, 173.4]
  - - [512, 128, 1, 128, 512, 512, 128, 128]
    - [36, 2.51]
  - - [512, 128, 1, 256, 512, 512, 256, 128]
    - [36, 4.46]
  - - [512, 128, 1, 512, 512, 512, 512, 128]
    - [57, 7.49]
  - - [512, 128, 1, 1024, 512, 512, 1024, 128]
    - [57, 11.4]
  - - [512, 128, 1, 2048, 512, 512, 2048, 128]
    - [57, 15.43]
  - - [512, 128, 1, 4096, 512, 512, 4096, 128]
    - [74, 19.0]
  - - [512, 128, 1, 8192, 512, 512, 8192, 128]
    - [74, 21.5]
  - - [512, 256, 1, 128, 512, 512, 128, 256]
    - [51, 4.71]
  - - [512, 256, 1, 256, 512, 512, 256, 256]
    - [33, 8.11]
  - - [512, 256, 1, 512, 512, 512, 512, 256]
    - [52, 13.57]
  - - [512, 256, 1, 1024, 512, 512, 1024, 256]
    - [70, 20.48]
  - - [512, 256, 1, 2048, 512, 512, 2048, 256]
    - [70, 28.27]
  - - [512, 256, 1, 4096, 512, 512, 4096, 256]
    - [70, 35.12]
  - - [512, 256, 1, 8192, 512, 512, 8192, 256]
    - [72, 39.56]
  - - [512, 512, 1, 128, 512, 512, 128, 512]
    - [30, 8.49]
  - - [512, 512, 1, 256, 512, 512, 256, 512]
    - [31, 14.81]
  - - [512, 512, 1, 512, 512, 512, 512, 512]
    - [48, 23.91]
  - - [512, 512, 1, 1024, 512, 512, 1024, 512]
    - [48, 35.07]
  - - [512, 512, 1, 2048, 512, 512, 2048, 512]
    - [66, 46.68]
  - - [512, 512, 1, 4096, 512, 512, 4096, 512]
    - [66, 57.07]
  - - [512, 512, 1, 8192, 512, 512, 8192, 512]
    - [65, 59.63]
  - - [512, 1024, 1, 128, 512, 512, 128, 1024]
    - [25, 14.48]
  - - [512, 1024, 1, 256, 512, 512, 256, 1024]
    - [28, 24.94]
  - - [512, 1024, 1, 512, 512, 512, 512, 1024]
    - [25, 39.15]
  - - [512, 1024, 1, 1024, 512, 512, 1024, 1024]
    - [46, 55.04]
  - - [512, 1024, 1, 2048, 512, 512, 2048, 1024]
    - [59, 70.92]
  - - [512, 1024, 1, 4096, 512, 512, 4096, 1024]
    - [59, 79.64]
  - - [512, 1024, 1, 8192, 512, 512, 8192, 1024]
    - [61, 86.28]
  - - [512, 2048, 1, 128, 512, 512, 128, 2048]
    - [6, 22.38]
  - - [512, 2048, 1, 256, 512, 512, 256, 2048]
    - [24, 37.85]
  - - [512, 2048, 1, 512, 512, 512, 512, 2048]
    - [24, 58.2]
  - - [512, 2048, 1, 1024, 512, 512, 1024, 2048]
    - [43, 81.47]
  - - [512, 2048, 1, 2048, 512, 512, 2048, 2048]
    - [43, 100.63]
  - - [512, 2048, 1, 4096, 512, 512, 4096, 2048]
    - [43, 116.36]
  - - [512, 2048, 1, 8192, 512, 512, 8192, 2048]
    - [44, 125.62]
  - - [512, 4096, 1, 128, 512, 512, 128, 4096]
    - [4, 33.38]
  - - [512, 4096, 1, 256, 512, 512, 256, 4096]
    - [21, 54.89]
  - - [512, 4096, 1, 512, 512, 512, 512, 4096]
    - [22, 84.37]
  - - [512, 4096, 1, 1024, 512, 512, 1024, 4096]
    - [21, 111.31]
  - - [512, 4096, 1, 2048, 512, 512, 2048, 4096]
    - [38, 140.76]
  - - [512, 4096, 1, 4096, 512, 512, 4096, 4096]
    - [39, 162.26]
  - - [512, 4096, 1, 8192, 512, 512, 8192, 4096]
    - [42, 174.75]
  - - [512, 8192, 1, 128, 512, 512, 128, 8192]
    - [1, 40.72]
  - - [512, 8192, 1, 256, 512, 512, 256, 8192]
    - [8, 67.22]
  - - [512, 8192, 1, 512, 512, 512, 512, 8192]
    - [8, 100.56]
  - - [512, 8192, 1, 1024, 512, 512, 1024, 8192]
    - [10, 134.26]
  - - [512, 8192, 1, 2048, 512, 512, 2048, 8192]
    - [10, 163.52]
  - - [512, 8192, 1, 4096, 512, 512, 4096, 8192]
    - [10, 182.69]
  - - [512, 8192, 1, 8192, 512, 512, 8192, 8192]
    - [10, 195.13]
  - - [1024, 128, 1, 128, 1024, 1024, 128, 128]
    - [34, 4.69]
  - - [1024, 128, 1, 256, 1024, 1024, 256, 128]
    - [32, 8.11]
  - - [1024, 128, 1, 512, 1024, 1024, 512, 128]
    - [50, 13.46]
  - - [1024, 128, 1, 1024, 1024, 1024, 1024, 128]
    - [52, 20.27]
  - - [1024, 128, 1, 2048, 1024, 1024, 2048, 128]
    - [70, 28.14]
  - - [1024, 128, 1, 4096, 1024, 1024, 4096, 128]
    - [69, 34.95]
  - - [1024, 128, 1, 8192, 1024, 1024, 8192, 128]
    - [69, 39.63]
  - - [1024, 256, 1, 128, 1024, 1024, 128, 256]
    - [30, 8.47]
  - - [1024, 256, 1, 256, 1024, 1024, 256, 256]
    - [29, 14.45]
  - - [1024, 256, 1, 512, 1024, 1024, 512, 256]
    - [48, 23.74]
  - - [1024, 256, 1, 1024, 1024, 1024, 1024, 256]
    - [48, 35.1]
  - - [1024, 256, 1, 2048, 1024, 1024, 2048, 256]
    - [66, 47.47]
  - - [1024, 256, 1, 4096, 1024, 1024, 4096, 256]
    - [66, 57.88]
  - - [1024, 256, 1, 8192, 1024, 1024, 8192, 256]
    - [67, 63.36]
  - - [1024, 512, 1, 128, 1024, 1024, 128, 512]
    - [26, 14.59]
  - - [1024, 512, 1, 256, 1024, 1024, 256, 512]
    - [25, 25.15]
  - - [1024, 512, 1, 512, 1024, 1024, 512, 512]
    - [25, 39.39]
  - - [1024, 512, 1, 1024, 1024, 1024, 1024, 512]
    - [27, 55.03]
  - - [1024, 512, 1, 2048, 1024, 1024, 2048, 512]
    - [60, 70.81]
  - - [1024, 512, 1, 4096, 1024, 1024, 4096, 512]
    - [63, 84.72]
  - - [1024, 512, 1, 8192, 1024, 1024, 8192, 512]
    - [61, 85.51]
  - - [1024, 1024, 1, 128, 1024, 1024, 128, 1024]
    - [24, 22.6]
  - - [1024, 1024, 1, 256, 1024, 1024, 256, 1024]
    - [24, 38.15]
  - - [1024, 1024, 1, 512, 1024, 1024, 512, 1024]
    - [24, 58.16]
  - - [1024, 1024, 1, 1024, 1024, 1024, 1024, 1024]
    - [43, 81.53]
  - - [1024, 1024, 1, 2048, 1024, 1024, 2048, 1024]
    - [43, 102.36]
  - - [1024, 1024, 1, 4096, 1024, 1024, 4096, 1024]
    - [45, 111.96]
  - - [1024, 1024, 1, 8192, 1024, 1024, 8192, 1024]
    - [44, 122.61]
  - - [1024, 2048, 1, 128, 1024, 1024, 128, 2048]
    - [4, 32.92]
  - - [1024, 2048, 1, 256, 1024, 1024, 256, 2048]
    - [5, 54.88]
  - - [1024, 2048, 1, 512, 1024, 1024, 512, 2048]
    - [22, 84.28]
  - - [1024, 2048, 1, 1024, 1024, 1024, 1024, 2048]
    - [21, 115.6]
  - - [1024, 2048, 1, 2048, 1024, 1024, 2048, 2048]
    - [38, 140.65]
  - - [1024, 2048, 1, 4096, 1024, 1024, 4096, 2048]
    - [40, 158.88]
  - - [1024, 2048, 1, 8192, 1024, 1024, 8192, 2048]
    - [40, 170.67]
  - - [1024, 4096, 1, 128, 1024, 1024, 128, 4096]
    - [1, 40.72]
  - - [1024, 4096, 1, 256, 1024, 1024, 256, 4096]
    - [8, 67.34]
  - - [1024, 4096, 1, 512, 1024, 1024, 512, 4096]
    - [8, 99.07]
  - - [1024, 4096, 1, 1024, 1024, 1024, 1024, 4096]
    - [10, 134.53]
  - - [1024, 4096, 1, 2048, 1024, 1024, 2048, 4096]
    - [10, 164.4]
  - - [1024, 4096, 1, 4096, 1024, 1024, 4096, 4096]
    - [15, 181.54]
  - - [1024, 4096, 1, 8192, 1024, 1024, 8192, 4096]
    - [15, 195.17]
  - - [1024, 8192, 1, 128, 1024, 1024, 128, 8192]
    - [2, 43.45]
  - - [1024, 8192, 1, 256, 1024, 1024, 256, 8192]
    - [8, 71.43]
  - - [1024, 8192, 1, 512, 1024, 1024, 512, 8192]
    - [10, 104.51]
  - - [1024, 8192, 1, 1024, 1024, 1024, 1024, 8192]
    - [10, 139.43]
  - - [1024, 8192, 1, 2048, 1024, 1024, 2048, 8192]
    - [10, 167.85]
  - - [1024, 8192, 1, 4096, 1024, 1024, 4096, 8192]
    - [15, 183.81]
  - - [1024, 8192, 1, 8192, 1024, 1024, 8192, 8192]
    - [38, 205.04]
  - - [2048, 128, 1, 128, 2048, 2048, 128, 128]
    - [7, 8.56]
  - - [2048, 128, 1, 256, 2048, 2048, 256, 128]
    - [31, 14.89]
  - - [2048, 128, 1, 512, 2048, 2048, 512, 128]
    - [47, 23.86]
  - - [2048, 128, 1, 1024, 2048, 2048, 1024, 128]
    - [48, 35.23]
  - - [2048, 128, 1, 2048, 2048, 2048, 2048, 128]
    - [66, 47.87]
  - - [2048, 128, 1, 4096, 2048, 2048, 4096, 128]
    - [66, 58.32]
  - - [2048, 128, 1, 8192, 2048, 2048, 8192, 128]
    - [66, 64.38]
  - - [2048, 256, 1, 128, 2048, 2048, 128, 256]
    - [26, 14.63]
  - - [2048, 256, 1, 256, 2048, 2048, 256, 256]
    - [25, 25.21]
  - - [2048, 256, 1, 512, 2048, 2048, 512, 256]
    - [25, 39.35]
  - - [2048, 256, 1, 1024, 2048, 2048, 1024, 256]
    - [27, 55.03]
  - - [2048, 256, 1, 2048, 2048, 2048, 2048, 256]
    - [59, 72.12]
  - - [2048, 256, 1, 4096, 2048, 2048, 4096, 256]
    - [63, 86.08]
  - - [2048, 256, 1, 8192, 2048, 2048, 8192, 256]
    - [62, 89.97]
  - - [2048, 512, 1, 128, 2048, 2048, 128, 512]
    - [24, 22.79]
  - - [2048, 512, 1, 256, 2048, 2048, 256, 512]
    - [24, 38.61]
  - - [2048, 512, 1, 512, 2048, 2048, 512, 512]
    - [24, 58.6]
  - - [2048, 512, 1, 1024, 2048, 2048, 1024, 512]
    - [43, 81.7]
  - - [2048, 512, 1, 2048, 2048, 2048, 2048, 512]
    - [43, 102.47]
  - - [2048, 512, 1, 4096, 2048, 2048, 4096, 512]
    - [44, 116.22]
  - - [2048, 512, 1, 8192, 2048, 2048, 8192, 512]
    - [44, 121.9]
  - - [2048, 1024, 1, 128, 2048, 2048, 128, 1024]
    - [4, 33.35]
  - - [2048, 1024, 1, 256, 2048, 2048, 256, 1024]
    - [21, 55.16]
  - - [2048, 1024, 1, 512, 2048, 2048, 512, 1024]
    - [22, 84.71]
  - - [2048, 1024, 1, 1024, 2048, 2048, 1024, 1024]
    - [21, 116.78]
  - - [2048, 1024, 1, 2048, 2048, 2048, 2048, 1024]
    - [42, 139.08]
  - - [2048, 1024, 1, 4096, 2048, 2048, 4096, 1024]
    - [42, 153.51]
  - - [2048, 1024, 1, 8192, 2048, 2048, 8192, 1024]
    - [42, 170.54]
  - - [2048, 2048, 1, 128, 2048, 2048, 128, 2048]
    - [1, 40.6]
  - - [2048, 2048, 1, 256, 2048, 2048, 256, 2048]
    - [8, 67.63]
  - - [2048, 2048, 1, 512, 2048, 2048, 512, 2048]
    - [8, 101.47]
  - - [2048, 2048, 1, 1024, 2048, 2048, 1024, 2048]
    - [10, 135.02]
  - - [2048, 2048, 1, 2048, 2048, 2048, 2048, 2048]
    - [13, 160.53]
  - - [2048, 2048, 1, 4096, 2048, 2048, 4096, 2048]
    - [13, 179.75]
  - - [2048, 2048, 1, 8192, 2048, 2048, 8192, 2048]
    - [10, 194.14]
  - - [2048, 4096, 1, 128, 2048, 2048, 128, 4096]
    - [2, 43.54]
  - - [2048, 4096, 1, 256, 2048, 2048, 256, 4096]
    - [10, 71.05]
  - - [2048, 4096, 1, 512, 2048, 2048, 512, 4096]
    - [8, 105.66]
  - - [2048, 4096, 1, 1024, 2048, 2048, 1024, 4096]
    - [10, 139.9]
  - - [2048, 4096, 1, 2048, 2048, 2048, 2048, 4096]
    - [18, 164.41]
  - - [2048, 4096, 1, 4096, 2048, 2048, 4096, 4096]
    - [18, 182.26]
  - - [2048, 4096, 1, 8192, 2048, 2048, 8192, 4096]
    - [38, 205.4]
  - - [2048, 8192, 1, 128, 2048, 2048, 128, 8192]
    - [2, 45.41]
  - - [2048, 8192, 1, 256, 2048, 2048, 256, 8192]
    - [10, 73.91]
  - - [2048, 8192, 1, 512, 2048, 2048, 512, 8192]
    - [10, 108.74]
  - - [2048, 8192, 1, 1024, 2048, 2048, 1024, 8192]
    - [10, 142.49]
  - - [2048, 8192, 1, 2048, 2048, 2048, 2048, 8192]
    - [18, 166.62]
  - - [2048, 8192, 1, 4096, 2048, 2048, 4096, 8192]
    - [9, 213.74]
  - - [2048, 8192, 1, 8192, 2048, 2048, 8192, 8192]
    - [17, 235.54]
  - - [4096, 128, 1, 128, 4096, 4096, 128, 128]
    - [25, 14.72]
  - - [4096, 128, 1, 256, 4096, 4096, 256, 128]
    - [25, 25.31]
  - - [4096, 128, 1, 512, 4096, 4096, 512, 128]
    - [25, 39.42]
  - - [4096, 128, 1, 1024, 4096, 4096, 1024, 128]
    - [27, 55.22]
  - - [4096, 128, 1, 2048, 4096, 4096, 2048, 128]
    - [59, 72.61]
  - - [4096, 128, 1, 4096, 4096, 4096, 4096, 128]
    - [59, 80.86]
  - - [4096, 128, 1, 8192, 4096, 4096, 8192, 128]
    - [58, 92.95]
  - - [4096, 256, 1, 128, 4096, 4096, 128, 256]
    - [6, 22.86]
  - - [4096, 256, 1, 256, 4096, 4096, 256, 256]
    - [24, 38.36]
  - - [4096, 256, 1, 512, 4096, 4096, 512, 256]
    - [24, 58.35]
  - - [4096, 256, 1, 1024, 4096, 4096, 1024, 256]
    - [43, 81.76]
  - - [4096, 256, 1, 2048, 4096, 4096, 2048, 256]
    - [43, 102.4]
  - - [4096, 256, 1, 4096, 4096, 4096, 4096, 256]
    - [43, 109.95]
  - - [4096, 256, 1, 8192, 4096, 4096, 8192, 256]
    - [43, 121.27]
  - - [4096, 512, 1, 128, 4096, 4096, 128, 512]
    - [4, 32.97]
  - - [4096, 512, 1, 256, 4096, 4096, 256, 512]
    - [21, 55.09]
  - - [4096, 512, 1, 512, 4096, 4096, 512, 512]
    - [22, 84.68]
  - - [4096, 512, 1, 1024, 4096, 4096, 1024, 512]
    - [21, 116.28]
  - - [4096, 512, 1, 2048, 4096, 4096, 2048, 512]
    - [42, 138.91]
  - - [4096, 512, 1, 4096, 4096, 4096, 4096, 512]
    - [41, 152.03]
  - - [4096, 512, 1, 8192, 4096, 4096, 8192, 512]
    - [40, 169.58]
  - - [4096, 1024, 1, 128, 4096, 4096, 128, 1024]
    - [1, 40.7]
  - - [4096, 1024, 1, 256, 4096, 4096, 256, 1024]
    - [8, 67.55]
  - - [4096, 1024, 1, 512, 4096, 4096, 512, 1024]
    - [8, 101.15]
  - - [4096, 1024, 1, 1024, 4096, 4096, 1024, 1024]
    - [8, 135.33]
  - - [4096, 1024, 1, 2048, 4096, 4096, 2048, 1024]
    - [15, 161.99]
  - - [4096, 1024, 1, 4096, 4096, 4096, 4096, 1024]
    - [18, 179.34]
  - - [4096, 1024, 1, 8192, 4096, 4096, 8192, 1024]
    - [15, 194.23]
  - - [4096, 2048, 1, 128, 4096, 4096, 128, 2048]
    - [2, 43.39]
  - - [4096, 2048, 1, 256, 4096, 4096, 256, 2048]
    - [8, 71.2]
  - - [4096, 2048, 1, 512, 4096, 4096, 512, 2048]
    - [10, 105.73]
  - - [4096, 2048, 1, 1024, 4096, 4096, 1024, 2048]
    - [16, 138.75]
  - - [4096, 2048, 1, 2048, 4096, 4096, 2048, 2048]
    - [15, 165.57]
  - - [4096, 2048, 1, 4096, 4096, 4096, 4096, 2048]
    - [15, 182.61]
  - - [4096, 2048, 1, 8192, 4096, 4096, 8192, 2048]
    - [42, 205.38]
  - - [4096, 4096, 1, 128, 4096, 4096, 128, 4096]
    - [2, 45.68]
  - - [4096, 4096, 1, 256, 4096, 4096, 256, 4096]
    - [10, 74.04]
  - - [4096, 4096, 1, 512, 4096, 4096, 512, 4096]
    - [10, 108.91]
  - - [4096, 4096, 1, 1024, 4096, 4096, 1024, 4096]
    - [10, 141.23]
  - - [4096, 4096, 1, 2048, 4096, 4096, 2048, 4096]
    - [15, 167.7]
  - - [4096, 4096, 1, 4096, 4096, 4096, 4096, 4096]
    - [17, 213.35]
  - - [4096, 4096, 1, 8192, 4096, 4096, 8192, 4096]
    - [17, 235.5]
  - - [4096, 8192, 1, 128, 4096, 4096, 128, 8192]
    - [2, 46.76]
  - - [4096, 8192, 1, 256, 4096, 4096, 256, 8192]
    - [10, 75.62]
  - - [4096, 8192, 1, 512, 4096, 4096, 512, 8192]
    - [10, 110.51]
  - - [4096, 8192, 1, 1024, 4096, 4096, 1024, 8192]
    - [18, 142.65]
  - - [4096, 8192, 1, 2048, 4096, 4096, 2048, 8192]
    - [14, 184.98]
  - - [4096, 8192, 1, 4096, 4096, 4096, 4096, 8192]
    - [14, 207.42]
  - - [4096, 8192, 1, 8192, 4096, 4096, 8192, 8192]
    - [17, 229.31]
  - - [8192, 128, 1, 128, 8192, 8192, 128, 128]
    - [24, 22.6]
  - - [8192, 128, 1, 256, 8192, 8192, 256, 128]
    - [24, 38.06]
  - - [8192, 128, 1, 512, 8192, 8192, 512, 128]
    - [24, 58.18]
  - - [8192, 128, 1, 1024, 8192, 8192, 1024, 128]
    - [43, 81.74]
  - - [8192, 128, 1, 2048, 8192, 8192, 2048, 128]
    - [43, 94.26]
  - - [8192, 128, 1, 4096, 8192, 8192, 4096, 128]
    - [43, 107.5]
  - - [8192, 128, 1, 8192, 8192, 8192, 8192, 128]
    - [43, 118.66]
  - - [8192, 256, 1, 128, 8192, 8192, 128, 256]
    - [5, 32.75]
  - - [8192, 256, 1, 256, 8192, 8192, 256, 256]
    - [20, 54.99]
  - - [8192, 256, 1, 512, 8192, 8192, 512, 256]
    - [22, 84.23]
  - - [8192, 256, 1, 1024, 8192, 8192, 1024, 256]
    - [21, 116.04]
  - - [8192, 256, 1, 2048, 8192, 8192, 2048, 256]
    - [38, 133.22]
  - - [8192, 256, 1, 4096, 8192, 8192, 4096, 256]
    - [38, 150.74]
  - - [8192, 256, 1, 8192, 8192, 8192, 8192, 256]
    - [38, 168.92]
  - - [8192, 512, 1, 128, 8192, 8192, 128, 512]
    - [1, 40.63]
  - - [8192, 512, 1, 256, 8192, 8192, 256, 512]
    - [8, 67.31]
  - - [8192, 512, 1, 512, 8192, 8192, 512, 512]
    - [8, 100.79]
  - - [8192, 512, 1, 1024, 8192, 8192, 1024, 512]
    - [8, 134.51]
  - - [8192, 512, 1, 2048, 8192, 8192, 2048, 512]
    - [13, 160.68]
  - - [8192, 512, 1, 4096, 8192, 8192, 4096, 512]
    - [13, 179.31]
  - - [8192, 512, 1, 8192, 8192, 8192, 8192, 512]
    - [10, 194.29]
  - - [8192, 1024, 1, 128, 8192, 8192, 128, 1024]
    - [2, 43.53]
  - - [8192, 1024, 1, 256, 8192, 8192, 256, 1024]
    - [8, 71.07]
  - - [8192, 1024, 1, 512, 8192, 8192, 512, 1024]
    - [10, 105.44]
  - - [8192, 1024, 1, 1024, 8192, 8192, 1024, 1024]
    - [10, 138.99]
  - - [8192, 1024, 1, 2048, 8192, 8192, 2048, 1024]
    - [10, 164.47]
  - - [8192, 1024, 1, 4096, 8192, 8192, 4096, 1024]
    - [18, 181.84]
  - - [8192, 1024, 1, 8192, 8192, 8192, 8192, 1024]
    - [42, 205.4]
  - - [8192, 2048, 1, 128, 8192, 8192, 128, 2048]
    - [2, 45.55]
  - - [8192, 2048, 1, 256, 8192, 8192, 256, 2048]
    - [10, 74.11]
  - - [8192, 2048, 1, 512, 8192, 8192, 512, 2048]
    - [10, 108.4]
  - - [8192, 2048, 1, 1024, 8192, 8192, 1024, 2048]
    - [18, 141.74]
  - - [8192, 2048, 1, 2048, 8192, 8192, 2048, 2048]
    - [18, 166.85]
  - - [8192, 2048, 1, 4096, 8192, 8192, 4096, 2048]
    - [17, 213.17]
  - - [8192, 2048, 1, 8192, 8192, 8192, 8192, 2048]
    - [17, 235.41]
  - - [8192, 4096, 1, 128, 8192, 8192, 128, 4096]
    - [2, 46.77]
  - - [8192, 4096, 1, 256, 8192, 8192, 256, 4096]
    - [10, 75.62]
  - - [8192, 4096, 1, 512, 8192, 8192, 512, 4096]
    - [10, 110.47]
  - - [8192, 4096, 1, 1024, 8192, 8192, 1024, 4096]
    - [10, 142.15]
  - - [8192, 4096, 1, 2048, 8192, 8192, 2048, 4096]
    - [17, 184.82]
  - - [8192, 4096, 1, 4096, 8192, 8192, 4096, 4096]
    - [17, 207.21]
  - - [8192, 4096, 1, 8192, 8192, 8192, 8192, 4096]
    - [11, 196.95]
  - - [8192, 8192, 1, 128, 8192, 8192, 128, 8192]
    - [0, 28.83]
  - - [8192, 8192, 1, 256, 8192, 8192, 256, 8192]
    - [23, 60.73]
  - - [8192, 8192, 1, 512, 8192, 8192, 512, 8192]
    - [18, 109.94]
  - - [8192, 8192, 1, 1024, 8192, 8192, 1024, 8192]
    - [12, 125.93]
  - - [8192, 8192, 1, 2048, 8192, 8192, 2048, 8192]
    - [3, 153.27]
  - - [8192, 8192, 1, 4096, 8192, 8192, 4096, 8192]
    - [19, 160.94]
  - - [8192, 8192, 1, 8192, 8192, 8192, 8192, 8192]
    - [15, 242.87]
  - - [1, 1, 1, 32, 1, 1, 32, 1]
    - [75, 0.0]
- null
- null
- ExperimentalStreamK
- GridBased
