projects/hipblaslt/library/src/amd_detail/rocblaslt/src/Tensile/Logic/asm_full/aldebaran/110CU/GridBased/aldebaran_Cijk_Ailk_Bjlk_BSS_BH_Bias_HA_S_UserArgs.yaml
- {MinimumRequiredVersion: 5.0.0}
- aldebaran
- gfx90a
- [Device 0050, Device 0051, Device 0052, Device 0054, Device 0062, Device 7400, Device
    SolutionIndex: 0
    SolutionNameMin: Cijk_Ailk_Bjlk_BSS_BH_Bias_HA_S_UserArgs_MT256x32x32_MI32x32x2_SN_LDSB0_AFC1_AG0_AFEM1_AFEM1_ASEM1_CLR1_CADS0_DTLA0_DTLB0_DTVA0_DTVB0_EPS0_FDSI0_GRPM1_GRVWA8_GRVWB4_GSU1_GSUAMB_GSUC0_GSUWGMRR0_GLS0_ISA90a_IU1_K1_LDSTI0_LBSPPA0_LBSPPB0_LBSPPM0_LPA0_LPB0_LPM0_LRVW2_LWPMn1_MIAV0_MIWT1_1_MO40_NTn1_NTA0_NTB0_NTC0_NTD0_NTM0_NEPBS0_NLCA1_NLCB1_ONLL1_PGR2_PLR1_PKA1_SIA3_SS0_SU32_SUM1_SUS2048_SPO0_SRVW0_SSO0_SVW4_SK0_SKFTR0_SKXCCM0_TLDS0_ULSGRO0_USL1_UIOFGRO0_USFGROn1_VSn1_VWA1_VWB1_WSGRA0_WSGRB0_WS64_WG256_1_1_WGM8_WGMXCC1_WGMXCCGn1
    SolutionIndex: 1
    SolutionNameMin: Cijk_Ailk_Bjlk_BSS_BH_Bias_HA_S_UserArgs_MT256x16x32_MI16x16x4_SN_LDSB0_AFC1_AG0_AFEM1_AFEM1_ASEM1_CLR1_CADS0_DTLA0_DTLB0_DTVA0_DTVB0_EPS0_FDSI0_GRPM1_GRVWA8_GRVWB2_GSU1_GSUAMB_GSUC0_GSUWGMRR0_GLS0_ISA90a_IU1_K1_LDSTI0_LBSPPA0_LBSPPB0_LBSPPM0_LPA0_LPB0_LPM0_LRVW2_LWPMn1_MIAV0_MIWT1_1_MO40_NTn1_NTA0_NTB0_NTC0_NTD0_NTM0_NEPBS0_NLCA1_NLCB1_ONLL1_PGR2_PLR1_PKA1_SIA3_SS0_SU32_SUM1_SUS2048_SPO0_SRVW0_SSO0_SVW4_SK0_SKFTR0_SKXCCM0_TLDS0_ULSGRO0_USL1_UIOFGRO0_USFGROn1_VSn1_VWA1_VWB1_WSGRA0_WSGRB0_WS64_WG256_1_1_WGM8_WGMXCC1_WGMXCCGn1
    SolutionIndex: 2
    SolutionNameMin: Cijk_Ailk_Bjlk_BSS_BH_Bias_HA_S_UserArgs_MT64x16x128_MI16x16x1_SN_LDSB0_AFC1_AG0_AFEM1_AFEM1_ASEM1_CLR1_CADS0_DTLA0_DTLB0_DTVA0_DTVB0_EPS0_FDSI0_GRPM1_GRVWA8_GRVWB8_GSU1_GSUAMB_GSUC0_GSUWGMRR0_GLS0_ISA90a_IU1_K1_LDSTI0_LBSPPA256_LBSPPB64_LBSPPM0_LPA16_LPB48_LPM0_LRVW2_LWPMn1_MIAV0_MIWT1_1_MO40_NTn1_NTA0_NTB0_NTC0_NTD0_NTM0_NEPBS0_NLCA1_NLCB1_ONLL1_PGR2_PLR1_PKA1_SIA3_SS0_SU32_SUM1_SUS2048_SPO0_SRVW0_SSO0_SVW4_SK0_SKFTR0_SKXCCM0_TLDS0_ULSGRO0_USL1_UIOFGRO0_USFGROn1_VSn1_VWA1_VWB1_WSGRA0_WSGRB0_WS64_WG64_4_1_WGM8_WGMXCC1_WGMXCCGn1
    SolutionIndex: 3
    SolutionNameMin: Cijk_Ailk_Bjlk_BSS_BH_Bias_HA_S_UserArgs_MT256x16x32_MI16x16x4_SN_LDSB0_AFC1_AG0_AFEM1_AFEM1_ASEM1_CLR1_CADS0_DTLA0_DTLB0_DTVA0_DTVB0_EPS0_FDSI0_GRPM1_GRVWA1_GRVWB1_GSU1_GSUAMB_GSUC0_GSUWGMRR0_GLS0_ISA90a_IU1_K1_LDSTI0_LBSPPA0_LBSPPB0_LBSPPM0_LPA0_LPB0_LPM0_LRVW2_LWPMn1_MIAV0_MIWT1_1_MO40_NTn1_NTA0_NTB0_NTC0_NTD0_NTM0_NEPBS0_NLCA1_NLCB1_ONLL1_PGR2_PLR1_PKA1_SIA3_SS0_SU32_SUM1_SUS2048_SPO0_SRVW0_SSO0_SVW4_SK0_SKFTR0_SKXCCM0_TLDS0_ULSGRO0_USL1_UIOFGRO0_USFGROn1_VSn1_VWA1_VWB1_WSGRA0_WSGRB0_WS64_WG256_1_1_WGM8_WGMXCC1_WGMXCCGn1
    SolutionIndex: 4
    SolutionNameMin: Cijk_Ailk_Bjlk_BSS_BH_Bias_HA_S_UserArgs_MT128x32x64_MI32x32x1_SN_LDSB0_AFC1_AG0_AFEM1_AFEM1_ASEM1_CLR1_CADS0_DTLA0_DTLB0_DTVA0_DTVB0_EPS0_FDSI0_GRPM1_GRVWA1_GRVWB1_GSU1_GSUAMB_GSUC0_GSUWGMRR0_GLS0_ISA90a_IU1_K1_LDSTI0_LBSPPA0_LBSPPB0_LBSPPM0_LPA0_LPB0_LPM0_LRVW2_LWPMn1_MIAV0_MIWT1_1_MO40_NTn1_NTA0_NTB0_NTC0_NTD0_NTM0_NEPBS0_NLCA1_NLCB1_ONLL1_PGR2_PLR1_PKA1_SIA3_SS0_SU32_SUM1_SUS2048_SPO0_SRVW0_SSO0_SVW4_SK0_SKFTR0_SKXCCM0_TLDS0_ULSGRO0_USL1_UIOFGRO0_USFGROn1_VSn1_VWA1_VWB1_WSGRA0_WSGRB0_WS64_WG128_2_1_WGM8_WGMXCC1_WGMXCCGn1
    SolutionIndex: 5
    SolutionNameMin: Cijk_Ailk_Bjlk_BSS_BH_Bias_HA_S_UserArgs_MT256x32x32_MI32x32x2_SN_LDSB0_AFC1_AG0_AFEM1_AFEM1_ASEM1_CLR1_CADS0_DTLA0_DTLB0_DTVA0_DTVB0_EPS0_FDSI0_GRPM1_GRVWA1_GRVWB1_GSU1_GSUAMB_GSUC0_GSUWGMRR0_GLS0_ISA90a_IU1_K1_LDSTI0_LBSPPA0_LBSPPB0_LBSPPM0_LPA0_LPB0_LPM0_LRVW2_LWPMn1_MIAV0_MIWT1_1_MO40_NTn1_NTA0_NTB0_NTC0_NTD0_NTM0_NEPBS0_NLCA1_NLCB1_ONLL1_PGR2_PLR1_PKA1_SIA3_SS0_SU32_SUM1_SUS2048_SPO0_SRVW0_SSO0_SVW4_SK0_SKFTR0_SKXCCM0_TLDS0_ULSGRO0_USL1_UIOFGRO0_USFGROn1_VSn1_VWA1_VWB1_WSGRA0_WSGRB0_WS64_WG256_1_1_WGM8_WGMXCC1_WGMXCCGn1
    SolutionIndex: 6
    SolutionNameMin: Cijk_Ailk_Bjlk_BSS_BH_Bias_HA_S_UserArgs_MT64x16x128_MI16x16x1_SN_LDSB0_AFC1_AG0_AFEM1_AFEM1_ASEM1_CLR1_CADS0_DTLA0_DTLB0_DTVA0_DTVB0_EPS0_FDSI0_GRPM1_GRVWA1_GRVWB2_GSU1_GSUAMB_GSUC0_GSUWGMRR0_GLS0_ISA90a_IU1_K1_LDSTI0_LBSPPA256_LBSPPB64_LBSPPM0_LPA16_LPB48_LPM0_LRVW2_LWPMn1_MIAV0_MIWT1_1_MO40_NTn1_NTA0_NTB0_NTC0_NTD0_NTM0_NEPBS0_NLCA1_NLCB1_ONLL1_PGR2_PLR1_PKA1_SIA3_SS0_SU32_SUM1_SUS2048_SPO0_SRVW0_SSO0_SVW4_SK0_SKFTR0_SKXCCM0_TLDS0_ULSGRO0_USL1_UIOFGRO0_USFGROn1_VSn1_VWA1_VWB1_WSGRA0_WSGRB0_WS64_WG64_4_1_WGM8_WGMXCC1_WGMXCCGn1
    SolutionIndex: 7
    SolutionNameMin: Cijk_Ailk_Bjlk_BSS_BH_Bias_HA_S_UserArgs_MT64x16x128_MI16x16x1_SN_LDSB0_AFC1_AG0_AFEM1_AFEM1_ASEM1_CLR1_CADS0_DTLA0_DTLB0_DTVA0_DTVB0_EPS0_FDSI0_GRPM1_GRVWA1_GRVWB1_GSU1_GSUAMB_GSUC0_GSUWGMRR0_GLS0_ISA90a_IU1_K1_LDSTI0_LBSPPA256_LBSPPB64_LBSPPM0_LPA16_LPB48_LPM0_LRVW2_LWPMn1_MIAV0_MIWT1_1_MO40_NTn1_NTA0_NTB0_NTC0_NTD0_NTM0_NEPBS0_NLCA1_NLCB1_ONLL1_PGR2_PLR1_PKA1_SIA3_SS0_SU32_SUM1_SUS2048_SPO0_SRVW0_SSO0_SVW4_SK0_SKFTR0_SKXCCM0_TLDS0_ULSGRO0_USL1_UIOFGRO0_USFGROn1_VSn1_VWA1_VWB1_WSGRA0_WSGRB0_WS64_WG64_4_1_WGM8_WGMXCC1_WGMXCCGn1
    SolutionIndex: 8
    SolutionNameMin: Cijk_Ailk_Bjlk_BSS_BH_Bias_HA_S_UserArgs_MT64x16x128_MI16x16x1_SN_LDSB0_AFC1_AG0_AFEM1_AFEM1_ASEM1_CLR1_CADS0_DTLA0_DTLB0_DTVA0_DTVB0_EPS0_FDSI0_GRPM1_GRVWA1_GRVWB8_GSU1_GSUAMB_GSUC0_GSUWGMRR0_GLS0_ISA90a_IU1_K1_LDSTI0_LBSPPA256_LBSPPB64_LBSPPM0_LPA16_LPB48_LPM0_LRVW2_LWPMn1_MIAV0_MIWT1_1_MO40_NTn1_NTA0_NTB0_NTC0_NTD0_NTM0_NEPBS0_NLCA1_NLCB1_ONLL1_PGR2_PLR1_PKA1_SIA3_SS0_SU32_SUM1_SUS2048_SPO0_SRVW0_SSO0_SVW4_SK0_SKFTR0_SKXCCM0_TLDS0_ULSGRO0_USL1_UIOFGRO0_USFGROn1_VSn1_VWA1_VWB1_WSGRA0_WSGRB0_WS64_WG64_4_1_WGM8_WGMXCC1_WGMXCCGn1
    SolutionIndex: 9
    SolutionNameMin: Cijk_Ailk_Bjlk_BSS_BH_Bias_HA_S_UserArgs_MT64x16x128_MI16x16x1_SN_LDSB0_AFC1_AG0_AFEM1_AFEM1_ASEM1_CLR1_CADS0_DTLA0_DTLB0_DTVA0_DTVB0_EPS0_FDSI0_GRPM1_GRVWA8_GRVWB1_GSU1_GSUAMB_GSUC0_GSUWGMRR0_GLS0_ISA90a_IU1_K1_LDSTI0_LBSPPA256_LBSPPB64_LBSPPM0_LPA16_LPB48_LPM0_LRVW2_LWPMn1_MIAV0_MIWT1_1_MO40_NTn1_NTA0_NTB0_NTC0_NTD0_NTM0_NEPBS0_NLCA1_NLCB1_ONLL1_PGR2_PLR1_PKA1_SIA3_SS0_SU32_SUM1_SUS2048_SPO0_SRVW0_SSO0_SVW4_SK0_SKFTR0_SKXCCM0_TLDS0_ULSGRO0_USL1_UIOFGRO0_USFGROn1_VSn1_VWA1_VWB1_WSGRA0_WSGRB0_WS64_WG64_4_1_WGM8_WGMXCC1_WGMXCCGn1
    SolutionIndex: 10
    SolutionNameMin: Cijk_Ailk_Bjlk_BSS_BH_Bias_HA_S_UserArgs_MT128x32x64_MI32x32x1_SN_LDSB0_AFC1_AG0_AFEM1_AFEM1_ASEM1_CLR1_CADS0_DTLA0_DTLB0_DTVA0_DTVB0_EPS0_FDSI0_GRPM1_GRVWA8_GRVWB1_GSU1_GSUAMB_GSUC0_GSUWGMRR0_GLS0_ISA90a_IU1_K1_LDSTI0_LBSPPA0_LBSPPB0_LBSPPM0_LPA0_LPB0_LPM0_LRVW2_LWPMn1_MIAV0_MIWT1_1_MO40_NTn1_NTA0_NTB0_NTC0_NTD0_NTM0_NEPBS0_NLCA1_NLCB1_ONLL1_PGR2_PLR1_PKA1_SIA3_SS0_SU32_SUM1_SUS2048_SPO0_SRVW0_SSO0_SVW4_SK0_SKFTR0_SKXCCM0_TLDS0_ULSGRO0_USL1_UIOFGRO0_USFGROn1_VSn1_VWA1_VWB1_WSGRA0_WSGRB0_WS64_WG128_2_1_WGM8_WGMXCC1_WGMXCCGn1
    SolutionIndex: 11
    SolutionNameMin: Cijk_Ailk_Bjlk_BSS_BH_Bias_HA_S_UserArgs_MT64x16x128_MI16x16x1_SN_LDSB0_AFC1_AG0_AFEM1_AFEM1_ASEM1_CLR1_CADS0_DTLA0_DTLB0_DTVA0_DTVB0_EPS0_FDSI0_GRPM1_GRVWA4_GRVWB1_GSU1_GSUAMB_GSUC0_GSUWGMRR0_GLS0_ISA90a_IU1_K1_LDSTI0_LBSPPA256_LBSPPB64_LBSPPM0_LPA16_LPB48_LPM0_LRVW2_LWPMn1_MIAV0_MIWT1_1_MO40_NTn1_NTA0_NTB0_NTC0_NTD0_NTM0_NEPBS0_NLCA1_NLCB1_ONLL1_PGR2_PLR1_PKA1_SIA3_SS0_SU32_SUM1_SUS2048_SPO0_SRVW0_SSO0_SVW4_SK0_SKFTR0_SKXCCM0_TLDS0_ULSGRO0_USL1_UIOFGRO0_USFGROn1_VSn1_VWA1_VWB1_WSGRA0_WSGRB0_WS64_WG64_4_1_WGM8_WGMXCC1_WGMXCCGn1
    SolutionIndex: 12
    SolutionNameMin: Cijk_Ailk_Bjlk_BSS_BH_Bias_HA_S_UserArgs_MT64x16x128_MI16x16x1_SN_LDSB0_AFC1_AG0_AFEM1_AFEM1_ASEM1_CLR1_CADS0_DTLA0_DTLB0_DTVA0_DTVB0_EPS0_FDSI0_GRPM1_GRVWA2_GRVWB1_GSU1_GSUAMB_GSUC0_GSUWGMRR0_GLS0_ISA90a_IU1_K1_LDSTI0_LBSPPA256_LBSPPB64_LBSPPM0_LPA16_LPB48_LPM0_LRVW2_LWPMn1_MIAV0_MIWT1_1_MO40_NTn1_NTA0_NTB0_NTC0_NTD0_NTM0_NEPBS0_NLCA1_NLCB1_ONLL1_PGR2_PLR1_PKA1_SIA3_SS0_SU32_SUM1_SUS2048_SPO0_SRVW0_SSO0_SVW4_SK0_SKFTR0_SKXCCM0_TLDS0_ULSGRO0_USL1_UIOFGRO0_USFGROn1_VSn1_VWA1_VWB1_WSGRA0_WSGRB0_WS64_WG64_4_1_WGM8_WGMXCC1_WGMXCCGn1
    SolutionIndex: 13
    SolutionNameMin: Cijk_Ailk_Bjlk_BSS_BH_Bias_HA_S_UserArgs_MT64x16x128_MI16x16x1_SN_LDSB0_AFC1_AG0_AFEM1_AFEM1_ASEM1_CLR1_CADS0_DTLA0_DTLB0_DTVA0_DTVB0_EPS0_FDSI0_GRPM1_GRVWA2_GRVWB4_GSU1_GSUAMB_GSUC0_GSUWGMRR0_GLS0_ISA90a_IU1_K1_LDSTI0_LBSPPA256_LBSPPB64_LBSPPM0_LPA16_LPB48_LPM0_LRVW2_LWPMn1_MIAV0_MIWT1_1_MO40_NTn1_NTA0_NTB0_NTC0_NTD0_NTM0_NEPBS0_NLCA1_NLCB1_ONLL1_PGR2_PLR1_PKA1_SIA3_SS0_SU32_SUM1_SUS2048_SPO0_SRVW0_SSO0_SVW4_SK0_SKFTR0_SKXCCM0_TLDS0_ULSGRO0_USL1_UIOFGRO0_USFGROn1_VSn1_VWA1_VWB1_WSGRA0_WSGRB0_WS64_WG64_4_1_WGM8_WGMXCC1_WGMXCCGn1
- - - [32, 32, 1, 1]
    - [2, 0.0]
  - - [32, 32, 1, 32]
    - [2, 0.0]
  - - [32, 32, 1, 64]
    - [2, 0.0]
  - - [32, 64, 1, 1]
    - [2, 0.0]
  - - [32, 64, 1, 32]
    - [2, 0.0]
  - - [32, 64, 1, 64]
    - [2, 0.01]
  - - [64, 32, 1, 1]
    - [0, 0.0]
  - - [64, 32, 1, 32]
    - [1, 0.0]
  - - [64, 32, 1, 64]
    - [13, 0.01]
  - - [64, 64, 1, 1]
    - [2, 0.0]
  - - [64, 64, 1, 32]
    - [2, 0.01]
  - - [64, 64, 1, 64]
    - [2, 0.01]
  - - [32, 32, 32, 1]
    - [2, 0.0]
  - - [32, 32, 32, 32]
    - [2, 0.05]
  - - [32, 32, 32, 64]
    - [2, 0.09]
  - - [32, 64, 32, 1]
    - [1, 0.0]
  - - [32, 64, 32, 32]
    - [1, 0.11]
  - - [32, 64, 32, 64]
    - [1, 0.21]
  - - [64, 32, 32, 1]
    - [2, 0.0]
  - - [64, 32, 32, 32]
    - [1, 0.1]
  - - [64, 32, 32, 64]
    - [1, 0.18]
  - - [64, 64, 32, 1]
    - [2, 0.01]
  - - [64, 64, 32, 32]
    - [7, 0.21]
  - - [64, 64, 32, 64]
    - [7, 0.4]
  - - [1, 1, 1, 1]
    - [3, 0.0]
  - - [1, 1, 1, 32]
    - [3, 0.0]
  - - [1, 1, 1, 64]
    - [4, 0.0]
  - - [1, 32, 1, 1]
    - [5, 0.0]
  - - [1, 32, 1, 32]
    - [6, 0.0]
  - - [1, 32, 1, 64]
    - [6, 0.0]
  - - [1, 64, 1, 1]
    - [6, 0.0]
  - - [1, 64, 1, 32]
    - [7, 0.0]
  - - [1, 64, 1, 64]
    - [8, 0.0]
  - - [32, 1, 1, 1]
    - [7, 0.0]
  - - [32, 1, 1, 32]
    - [4, 0.0]
  - - [32, 1, 1, 64]
    - [9, 0.0]
  - - [64, 1, 1, 1]
    - [10, 0.0]
  - - [64, 1, 1, 32]
    - [11, 0.0]
  - - [64, 1, 1, 64]
    - [12, 0.0]
  - - [1, 1, 32, 1]
    - [7, 0.0]
  - - [1, 1, 32, 32]
    - [7, 0.0]
  - - [1, 1, 32, 64]
    - [7, 0.0]
  - - [1, 32, 32, 1]
    - [5, 0.0]
  - - [1, 32, 32, 32]
    - [7, 0.0]
  - - [1, 32, 32, 64]
    - [6, 0.0]
  - - [1, 64, 32, 1]
    - [7, 0.0]
  - - [1, 64, 32, 32]
    - [8, 0.0]
  - - [1, 64, 32, 64]
    - [7, 0.01]
  - - [32, 1, 32, 1]
    - [9, 0.0]
  - - [32, 1, 32, 32]
    - [9, 0.0]
  - - [32, 1, 32, 64]
    - [9, 0.0]
  - - [64, 1, 32, 1]
    - [11, 0.0]
  - - [64, 1, 32, 32]
    - [11, 0.0]
  - - [64, 1, 32, 64]
    - [11, 0.01]
- null
- null
- DeviceEfficiency
- GridBased
