projects/hipblaslt/library/src/amd_detail/rocblaslt/src/Tensile/Logic/asm_full/aldebaran/110CU/GridBased/aldebaran_Cijk_Ailk_Bjlk_BSS_BH_UserArgs.yaml
- {MinimumRequiredVersion: 5.0.0}
- aldebaran
- gfx90a
- fallback
    SolutionIndex: 0
    SolutionNameMin: Cijk_Ailk_Bjlk_BSS_BH_UserArgs_MT256x16x16_MI16x16x4_SN_LDSB0_AFC0_AFEM1_AFEM1_ASEM1_CLR1_CADS0_DTLA0_DTLB0_DTVA0_DTVB0_EPS0_FDSI0_GRPM1_GRVWA8_GRVWB1_GSU1_GSUAMB_GSUC0_GSUWGMRR0_GLS0_ISA90a_IU1_K1_LBSPPA0_LBSPPB0_LBSPPM0_LPA0_LPB0_LPM0_LRVW2_LWPMn1_MIAV0_MIWT1_1_MO40_NTn1_NTA0_NTB0_NTC0_NTD0_NTM0_NEPBS0_NLCA1_NLCB1_ONLL1_PGR2_PLR1_PKA1_SIA3_SS0_SU32_SUM0_SUS256_SPO0_SRVW0_SSO0_SVW4_SK0_SKXCCM0_TLDS0_ULSGRO0_USL1_UIOFGRO0_USFGROn1_VSn1_VWA1_VWB1_WSGRA0_WSGRB0_WS64_WG256_1_1_WGM8_WGMXCC1_WGMXCCGn1
    SolutionIndex: 1
    SolutionNameMin: Cijk_Ailk_Bjlk_BSS_BH_UserArgs_MT128x32x16_MI32x32x1_SN_LDSB0_AFC0_AFEM1_AFEM1_ASEM1_CLR1_CADS0_DTLA0_DTLB0_DTVA0_DTVB0_EPS0_FDSI0_GRPM1_GRVWA8_GRVWB2_GSU1_GSUAMB_GSUC0_GSUWGMRR0_GLS0_ISA90a_IU1_K1_LBSPPA0_LBSPPB0_LBSPPM0_LPA0_LPB0_LPM0_LRVW2_LWPMn1_MIAV0_MIWT1_1_MO40_NTn1_NTA0_NTB0_NTC0_NTD0_NTM0_NEPBS0_NLCA1_NLCB1_ONLL1_PGR2_PLR1_PKA1_SIA3_SS0_SU32_SUM0_SUS256_SPO0_SRVW0_SSO0_SVW4_SK0_SKXCCM0_TLDS0_ULSGRO0_USL1_UIOFGRO0_USFGROn1_VSn1_VWA1_VWB1_WSGRA0_WSGRB0_WS64_WG128_2_1_WGM8_WGMXCC1_WGMXCCGn1
    SolutionIndex: 2
    SolutionNameMin: Cijk_Ailk_Bjlk_BSS_BH_UserArgs_MT64x16x16_MI16x16x1_SN_LDSB0_AFC0_AFEM1_AFEM1_ASEM1_CLR1_CADS0_DTLA0_DTLB0_DTVA0_DTVB0_EPS0_FDSI0_GRPM1_GRVWA4_GRVWB1_GSU1_GSUAMB_GSUC0_GSUWGMRR0_GLS0_ISA90a_IU1_K1_LBSPPA256_LBSPPB64_LBSPPM0_LPA16_LPB48_LPM0_LRVW2_LWPMn1_MIAV0_MIWT1_1_MO40_NTn1_NTA0_NTB0_NTC0_NTD0_NTM0_NEPBS0_NLCA1_NLCB1_ONLL1_PGR2_PLR1_PKA1_SIA3_SS0_SU32_SUM0_SUS256_SPO0_SRVW0_SSO0_SVW4_SK0_SKXCCM0_TLDS0_ULSGRO0_USL1_UIOFGRO0_USFGROn1_VSn1_VWA1_VWB1_WSGRA0_WSGRB0_WS64_WG64_4_1_WGM8_WGMXCC1_WGMXCCGn1
    SolutionIndex: 3
    SolutionNameMin: Cijk_Ailk_Bjlk_BSS_BH_UserArgs_MT256x16x16_MI16x16x4_SN_LDSB0_AFC0_AFEM1_AFEM1_ASEM1_CLR1_CADS0_DTLA0_DTLB0_DTVA0_DTVB0_EPS0_FDSI0_GRPM1_GRVWA8_GRVWB1_GSU1_GSUAMB_GSUC0_GSUWGMRR0_GLS0_ISA90a_IU1_K1_LBSPPA0_LBSPPB0_LBSPPM0_LPA0_LPB0_LPM0_LRVW2_LWPMn1_MIAV0_MIWT1_1_MO40_NTn1_NTA0_NTB0_NTC0_NTD0_NTM0_NEPBS0_NLCA1_NLCB1_ONLL1_PGR2_PLR1_PKA1_SIA3_SS1_SU32_SUM0_SUS256_SPO0_SRVW0_SSO0_SVW1_SK0_SKXCCM0_TLDS0_ULSGRO0_USL1_UIOFGRO0_USFGROn1_VSn1_VWA1_VWB1_WSGRA0_WSGRB0_WS64_WG256_1_1_WGM8_WGMXCC1_WGMXCCGn1
    SolutionIndex: 4
    SolutionNameMin: Cijk_Ailk_Bjlk_BSS_BH_UserArgs_MT128x32x16_MI32x32x1_SN_LDSB0_AFC0_AFEM1_AFEM1_ASEM1_CLR1_CADS0_DTLA0_DTLB0_DTVA0_DTVB0_EPS0_FDSI0_GRPM1_GRVWA8_GRVWB2_GSU1_GSUAMB_GSUC0_GSUWGMRR0_GLS0_ISA90a_IU1_K1_LBSPPA0_LBSPPB0_LBSPPM0_LPA0_LPB0_LPM0_LRVW2_LWPMn1_MIAV0_MIWT1_1_MO40_NTn1_NTA0_NTB0_NTC0_NTD0_NTM0_NEPBS0_NLCA1_NLCB1_ONLL1_PGR2_PLR1_PKA1_SIA3_SS1_SU32_SUM0_SUS256_SPO0_SRVW0_SSO0_SVW1_SK0_SKXCCM0_TLDS0_ULSGRO0_USL1_UIOFGRO0_USFGROn1_VSn1_VWA1_VWB1_WSGRA0_WSGRB0_WS64_WG128_2_1_WGM8_WGMXCC1_WGMXCCGn1
    SolutionIndex: 5
    SolutionNameMin: Cijk_Ailk_Bjlk_BSS_BH_UserArgs_MT64x16x16_MI16x16x1_SN_LDSB0_AFC0_AFEM1_AFEM1_ASEM1_CLR1_CADS0_DTLA0_DTLB0_DTVA0_DTVB0_EPS0_FDSI0_GRPM1_GRVWA4_GRVWB1_GSU1_GSUAMB_GSUC0_GSUWGMRR0_GLS0_ISA90a_IU1_K1_LBSPPA256_LBSPPB64_LBSPPM0_LPA16_LPB48_LPM0_LRVW2_LWPMn1_MIAV0_MIWT1_1_MO40_NTn1_NTA0_NTB0_NTC0_NTD0_NTM0_NEPBS0_NLCA1_NLCB1_ONLL1_PGR2_PLR1_PKA1_SIA3_SS1_SU32_SUM0_SUS256_SPO0_SRVW0_SSO0_SVW1_SK0_SKXCCM0_TLDS0_ULSGRO0_USL1_UIOFGRO0_USFGROn1_VSn1_VWA1_VWB1_WSGRA0_WSGRB0_WS64_WG64_4_1_WGM8_WGMXCC1_WGMXCCGn1
    SolutionIndex: 6
    SolutionNameMin: Cijk_Ailk_Bjlk_BSS_BH_UserArgs_MT64x16x16_MI16x16x1_SN_LDSB0_AFC0_AFEM1_AFEM1_ASEM1_CLR1_CADS0_DTLA0_DTLB0_DTVA0_DTVB0_EPS0_FDSI0_GRPM1_GRVWA4_GRVWB1_GSU2_GSUAMB_GSUC0_GSUWGMRR0_GLS0_ISA90a_IU1_K1_LBSPPA256_LBSPPB64_LBSPPM0_LPA16_LPB48_LPM0_LRVW2_LWPMn1_MIAV0_MIWT1_1_MO40_NTn1_NTA0_NTB0_NTC0_NTD0_NTM0_NEPBS0_NLCA1_NLCB1_ONLL1_PGR2_PLR1_PKA1_SIA3_SS1_SU32_SUM0_SUS256_SPO0_SRVW0_SSO0_SVW1_SK0_SKXCCM0_TLDS0_ULSGRO0_USL1_UIOFGRO0_USFGROn1_VSn1_VWA1_VWB1_WSGRA0_WSGRB0_WS64_WG64_4_1_WGM8_WGMXCC1_WGMXCCGn1
- - - [32, 1, 1, 1, 32, 32, 32, 1]
    - [2, 0.0]
  - - [32, 1, 1, 32, 32, 32, 32, 1]
    - [0, 0.0]
  - - [32, 1, 1, 64, 32, 32, 32, 1]
    - [2, 0.0]
  - - [32, 32, 1, 1, 32, 32, 32, 32]
    - [5, 0.0]
  - - [32, 32, 1, 32, 32, 32, 32, 32]
    - [5, 0.0]
  - - [32, 32, 1, 64, 32, 32, 32, 32]
    - [5, 0.0]
  - - [32, 64, 1, 1, 32, 32, 32, 64]
    - [2, 0.0]
  - - [32, 64, 1, 32, 32, 32, 32, 64]
    - [4, 0.0]
  - - [32, 64, 1, 64, 32, 32, 32, 64]
    - [1, 0.01]
  - - [64, 1, 1, 1, 64, 64, 64, 1]
    - [3, 0.0]
  - - [64, 1, 1, 32, 64, 64, 64, 1]
    - [2, 0.0]
  - - [64, 1, 1, 64, 64, 64, 64, 1]
    - [2, 0.0]
  - - [64, 32, 1, 1, 64, 64, 64, 32]
    - [5, 0.0]
  - - [64, 32, 1, 32, 64, 64, 64, 32]
    - [5, 0.01]
  - - [64, 32, 1, 64, 64, 64, 64, 32]
    - [4, 0.01]
  - - [64, 64, 1, 1, 64, 64, 64, 64]
    - [5, 0.0]
  - - [64, 64, 1, 32, 64, 64, 64, 64]
    - [5, 0.01]
  - - [64, 64, 1, 64, 64, 64, 64, 64]
    - [2, 0.02]
  - - [32, 1, 32, 1, 32, 32, 32, 1]
    - [5, 0.0]
  - - [32, 1, 32, 32, 32, 32, 32, 1]
    - [5, 0.0]
  - - [32, 1, 32, 64, 32, 32, 32, 1]
    - [2, 0.0]
  - - [32, 32, 32, 1, 32, 32, 32, 32]
    - [2, 0.0]
  - - [32, 32, 32, 32, 32, 32, 32, 32]
    - [5, 0.05]
  - - [32, 32, 32, 64, 32, 32, 32, 32]
    - [6, 0.14]
  - - [32, 64, 32, 1, 32, 32, 32, 64]
    - [5, 0.01]
  - - [32, 64, 32, 32, 32, 32, 32, 64]
    - [5, 0.16]
  - - [32, 64, 32, 64, 32, 32, 32, 64]
    - [5, 0.31]
  - - [64, 1, 32, 1, 64, 64, 64, 1]
    - [5, 0.0]
  - - [64, 1, 32, 32, 64, 64, 64, 1]
    - [5, 0.0]
  - - [64, 1, 32, 64, 64, 64, 64, 1]
    - [2, 0.01]
  - - [64, 32, 32, 1, 64, 64, 64, 32]
    - [5, 0.0]
  - - [64, 32, 32, 32, 64, 64, 64, 32]
    - [5, 0.1]
  - - [64, 32, 32, 64, 64, 64, 64, 32]
    - [6, 0.27]
  - - [64, 64, 32, 1, 64, 64, 64, 64]
    - [5, 0.01]
  - - [64, 64, 32, 32, 64, 64, 64, 64]
    - [5, 0.31]
  - - [64, 64, 32, 64, 64, 64, 64, 64]
    - [5, 0.62]
- null
- null
- DeviceEfficiency
- GridBased
