projects/hipblaslt/library/src/amd_detail/rocblaslt/src/Tensile/Logic/asm_full/gfx1150/Equality/gfx1150_Cijk_Alik_Bljk_HHS_BH_HAS_SAV_UserArgs.yaml
- {MinimumRequiredVersion: 5.0.0}
- gfx1150
- gfx1150
- [Device 150e]
    SolutionIndex: 0
    SolutionNameMin: Cijk_Alik_Bljk_HHS_BH_HA_S_SAV_UserArgs_MT128x80x64_MI16x16x1_SN_LDSB0_AFC1_AG0_AFEM1_AFEM1_ASEM1_CLR0_CADS0_DTLA0_DTLB0_DTVA0_DTVB0_EPS0_ELFLR0_EMLLn1_FDSI0_GRPM1_GRVWA8_GRVWB8_GSU1_GSUAMB_GSUC0_GSUWGMRR0_GLS0_ISA1150_IU1_K1_LDSTI0_LBSPPA128_LBSPPB128_LBSPPM0_LPA8_LPB8_LPM0_LRVW16_LWPMn1_MIAV1_MIWT2_5_MO40_NTn1_NTA0_NTB0_NTC0_NTD0_NTM0_NEPBS0_NLCA1_NLCB1_ONLL1_PGR2_PLR1_PKA0_SIA3_SS1_SU32_SUM0_SUS256_SPO0_SRVW0_SSO0_SVW1_SK0_SKFTR0_SKXCCM0_SGRO0_TIN0_TLDS1_ULSGRO0_USL1_UIOFGRO0_USFGROn1_VSn1_VWA1_VWB1_WSGRA0_WSGRB0_WS32_WG64_2_1_WGM8_WGMXCC1_WGMXCCGn1
    SolutionIndex: 1
    SolutionNameMin: Cijk_Alik_Bljk_HHS_BH_HA_S_SAV_UserArgs_MT128x80x64_MI16x16x1_SN_LDSB0_AFC1_AG0_AFEM1_AFEM1_ASEM1_CLR0_CADS0_DTLA0_DTLB0_DTVA0_DTVB0_EPS0_ELFLR0_EMLLn1_FDSI0_GRPM1_GRVWA8_GRVWB8_GSU1_GSUAMB_GSUC0_GSUWGMRR0_GLS0_ISA1150_IU1_K1_LDSTI0_LBSPPA128_LBSPPB128_LBSPPM0_LPA16_LPB8_LPM0_LRVW16_LWPMn1_MIAV1_MIWT2_5_MO40_NTn1_NTA0_NTB0_NTC0_NTD0_NTM0_NEPBS0_NLCA1_NLCB1_ONLL1_PGR2_PLR1_PKA0_SIA3_SS1_SU32_SUM0_SUS256_SPO0_SRVW0_SSO0_SVW1_SK0_SKFTR0_SKXCCM0_SGRO0_TIN0_TLDS1_ULSGRO0_USL1_UIOFGRO0_USFGROn1_VSn1_VWA1_VWB1_WSGRA0_WSGRB0_WS32_WG64_2_1_WGM8_WGMXCC1_WGMXCCGn1
    SolutionIndex: 2
    SolutionNameMin: Cijk_Alik_Bljk_HHS_BH_HA_S_SAV_UserArgs_MT128x96x64_MI16x16x1_SN_LDSB0_AFC1_AG0_AFEM1_AFEM1_ASEM1_CLR0_CADS0_DTLA0_DTLB0_DTVA0_DTVB0_EPS0_ELFLR0_EMLLn1_FDSI0_GRPM1_GRVWA8_GRVWB8_GSU1_GSUAMB_GSUC0_GSUWGMRR0_GLS0_ISA1150_IU1_K1_LDSTI0_LBSPPA128_LBSPPB128_LBSPPM0_LPA8_LPB8_LPM0_LRVW16_LWPMn1_MIAV1_MIWT2_6_MO40_NTn1_NTA0_NTB0_NTC0_NTD0_NTM0_NEPBS0_NLCA1_NLCB1_ONLL1_PGR2_PLR0_PKA0_SIA1_SS1_SU32_SUM0_SUS256_SPO0_SRVW0_SSO0_SVW1_SK0_SKFTR0_SKXCCM0_SGRO0_TIN0_TLDS1_ULSGRO0_USL1_UIOFGRO0_USFGROn1_VSn1_VWA1_VWB1_WSGRA0_WSGRB0_WS32_WG64_2_1_WGM8_WGMXCC1_WGMXCCGn1
    SolutionIndex: 3
    SolutionNameMin: Cijk_Alik_Bljk_HHS_BH_HA_S_SAV_UserArgs_MT128x96x64_MI16x16x1_SN_LDSB0_AFC1_AG0_AFEM1_AFEM1_ASEM1_CLR0_CADS0_DTLA0_DTLB0_DTVA0_DTVB0_EPS0_ELFLR0_EMLLn1_FDSI0_GRPM1_GRVWA8_GRVWB8_GSU1_GSUAMB_GSUC0_GSUWGMRR0_GLS0_ISA1150_IU1_K1_LDSTI0_LBSPPA128_LBSPPB128_LBSPPM0_LPA8_LPB8_LPM0_LRVW16_LWPMn1_MIAV1_MIWT2_6_MO40_NTn1_NTA0_NTB0_NTC0_NTD0_NTM0_NEPBS0_NLCA1_NLCB1_ONLL1_PGR2_PLR0_PKA0_SIA3_SS1_SU32_SUM0_SUS256_SPO0_SRVW0_SSO0_SVW1_SK0_SKFTR0_SKXCCM0_SGRO0_TIN0_TLDS1_ULSGRO0_USL1_UIOFGRO0_USFGROn1_VSn1_VWA1_VWB1_WSGRA0_WSGRB0_WS32_WG64_2_1_WGM8_WGMXCC1_WGMXCCGn1
    SolutionIndex: 4
    SolutionNameMin: Cijk_Alik_Bljk_HHS_BH_HA_S_SAV_UserArgs_MT96x128x64_MI16x16x1_SN_LDSB0_AFC1_AG0_AFEM1_AFEM1_ASEM1_CLR0_CADS0_DTLA0_DTLB0_DTVA0_DTVB0_EPS0_ELFLR0_EMLLn1_FDSI0_GRPM1_GRVWA8_GRVWB8_GSU1_GSUAMB_GSUC0_GSUWGMRR0_GLS0_ISA1150_IU1_K1_LDSTI0_LBSPPA128_LBSPPB128_LBSPPM0_LPA8_LPB8_LPM0_LRVW16_LWPMn1_MIAV1_MIWT3_4_MO40_NTn1_NTA0_NTB0_NTC0_NTD0_NTM0_NEPBS0_NLCA1_NLCB1_ONLL1_PGR2_PLR0_PKA0_SIA3_SS1_SU32_SUM0_SUS256_SPO0_SRVW0_SSO0_SVW1_SK0_SKFTR0_SKXCCM0_SGRO0_TIN0_TLDS1_ULSGRO0_USL1_UIOFGRO0_USFGROn1_VSn1_VWA1_VWB1_WSGRA0_WSGRB0_WS32_WG32_4_1_WGM8_WGMXCC1_WGMXCCGn1
    SolutionIndex: 5
    SolutionNameMin: Cijk_Alik_Bljk_HHS_BH_HA_S_SAV_UserArgs_MT128x80x64_MI16x16x1_SN_LDSB1_AFC1_AG0_AFEM1_AFEM1_ASEM1_CLR0_CADS0_DTLA0_DTLB0_DTVA0_DTVB0_EPS0_ELFLR0_EMLLn1_FDSI0_GRPM1_GRVWA8_GRVWB8_GSU1_GSUAMB_GSUC0_GSUWGMRR0_GLS0_ISA1150_IU1_K1_LDSTI0_LBSPPA128_LBSPPB128_LBSPPM0_LPA8_LPB8_LPM0_LRVW16_LWPMn1_MIAV1_MIWT2_5_MO40_NTn1_NTA0_NTB0_NTC0_NTD0_NTM0_NEPBS0_NLCA1_NLCB1_ONLL1_PGR2_PLR1_PKA0_SIA3_SS1_SU32_SUM0_SUS256_SPO0_SRVW0_SSO0_SVW1_SK0_SKFTR0_SKXCCM0_SGRO0_TIN0_TLDS1_ULSGRO0_USL1_UIOFGRO0_USFGROn1_VSn1_VWA1_VWB1_WSGRA0_WSGRB0_WS32_WG64_2_1_WGM8_WGMXCC1_WGMXCCGn1
    SolutionIndex: 6
    SolutionNameMin: Cijk_Alik_Bljk_HHS_BH_HA_S_SAV_UserArgs_MT128x80x64_MI16x16x1_SN_LDSB1_AFC1_AG0_AFEM1_AFEM1_ASEM1_CLR0_CADS0_DTLA0_DTLB0_DTVA0_DTVB0_EPS0_ELFLR0_EMLLn1_FDSI0_GRPM1_GRVWA8_GRVWB8_GSU1_GSUAMB_GSUC0_GSUWGMRR0_GLS0_ISA1150_IU1_K1_LDSTI0_LBSPPA128_LBSPPB128_LBSPPM0_LPA16_LPB8_LPM0_LRVW16_LWPMn1_MIAV1_MIWT2_5_MO40_NTn1_NTA0_NTB0_NTC0_NTD0_NTM0_NEPBS0_NLCA1_NLCB1_ONLL1_PGR2_PLR1_PKA0_SIA3_SS1_SU32_SUM0_SUS256_SPO0_SRVW0_SSO0_SVW1_SK0_SKFTR0_SKXCCM0_SGRO0_TIN0_TLDS1_ULSGRO0_USL1_UIOFGRO0_USFGROn1_VSn1_VWA1_VWB1_WSGRA0_WSGRB0_WS32_WG64_2_1_WGM8_WGMXCC1_WGMXCCGn1
    SolutionIndex: 7
    SolutionNameMin: Cijk_Alik_Bljk_HHS_BH_HA_S_SAV_UserArgs_MT96x96x64_MI16x16x1_SN_LDSB1_AFC1_AG0_AFEM1_AFEM1_ASEM1_CLR0_CADS0_DTLA0_DTLB0_DTVA0_DTVB0_EPS0_ELFLR0_EMLLn1_FDSI0_GRPM1_GRVWA8_GRVWB8_GSU1_GSUAMB_GSUC0_GSUWGMRR0_GLS0_ISA1150_IU1_K1_LDSTI0_LBSPPA128_LBSPPB128_LBSPPM0_LPA8_LPB8_LPM0_LRVW16_LWPMn1_MIAV1_MIWT3_3_MO40_NTn1_NTA0_NTB0_NTC0_NTD0_NTM0_NEPBS0_NLCA1_NLCB1_ONLL1_PGR2_PLR1_PKA0_SIA3_SS1_SU32_SUM0_SUS256_SPO0_SRVW0_SSO0_SVW1_SK0_SKFTR0_SKXCCM0_SGRO0_TIN0_TLDS1_ULSGRO0_USL1_UIOFGRO0_USFGROn1_VSn1_VWA1_VWB1_WSGRA0_WSGRB0_WS32_WG32_4_1_WGM8_WGMXCC1_WGMXCCGn1
    SolutionIndex: 8
    SolutionNameMin: Cijk_Alik_Bljk_HHS_BH_HA_S_SAV_UserArgs_MT64x64x128_MI16x16x1_SN_LDSB1_AFC1_AG0_AFEM1_AFEM1_ASEM1_CLR0_CADS0_DTLA0_DTLB0_DTVA0_DTVB0_EPS0_ELFLR0_EMLLn1_FDSI0_GRPM1_GRVWA8_GRVWB8_GSU1_GSUAMB_GSUC0_GSUWGMRR0_GLS0_ISA1150_IU1_K1_LDSTI0_LBSPPA256_LBSPPB256_LBSPPM0_LPA8_LPB8_LPM0_LRVW16_LWPMn1_MIAV1_MIWT2_2_MO40_NTn1_NTA0_NTB0_NTC0_NTD0_NTM0_NEPBS0_NLCA1_NLCB1_ONLL1_PGR2_PLR1_PKA0_SIA3_SS1_SU32_SUM0_SUS256_SPO0_SRVW0_SSO0_SVW1_SK0_SKFTR0_SKXCCM0_SGRO0_TIN0_TLDS1_ULSGRO0_USL1_UIOFGRO0_USFGROn1_VSn1_VWA1_VWB1_WSGRA0_WSGRB0_WS32_WG32_4_1_WGM8_WGMXCC1_WGMXCCGn1
- - - [19456, 1322, 1, 2560, 19456, 19456, 2560, 2560]
    - [2, 3.77]
  - - [19456, 512, 1, 2560, 19456, 19456, 2560, 2560]
    - [4, 4.04]
  - - [2560, 1322, 1, 9728, 2560, 2560, 9728, 9728]
    - [3, 4.41]
  - - [2560, 512, 1, 9728, 2560, 2560, 9728, 9728]
    - [4, 4.6]
  - - [3584, 1541, 1, 18944, 3584, 3584, 18944, 18944]
    - [0, 4.49]
  - - [3584, 1606, 1, 18944, 3584, 3584, 18944, 18944]
    - [1, 4.27]
  - - [3584, 4096, 1, 18944, 3584, 3584, 18944, 18944]
    - [1, 4.33]
  - - [37888, 1541, 1, 3584, 37888, 37888, 3584, 3584]
    - [1, 3.89]
  - - [37888, 1606, 1, 3584, 37888, 37888, 3584, 3584]
    - [3, 3.92]
  - - [37888, 4096, 1, 3584, 37888, 37888, 3584, 3584]
    - [3, 4.08]
  - - [4608, 1541, 1, 3584, 4608, 4608, 3584, 3584]
    - [6, 4.09]
  - - [4608, 4096, 1, 3584, 4608, 4608, 3584, 3584]
    - [5, 4.19]
  - - [6144, 1322, 1, 2560, 6144, 6144, 2560, 2560]
    - [7, 4.0]
  - - [6840, 4032, 1, 1280, 6840, 6840, 1280, 1280]
    - [8, 4.03]
- null
- null
- DeviceEfficiency
- Equality
