projects/hipblaslt/library/src/amd_detail/rocblaslt/src/Tensile/Logic/asm_full/gfx950/gfx950_id75a8/Equality/gfx950_Cijk_Alik_Bljk_F8BS_BH_BiasSB_HAS_SAB_SAV_UserArgs.yaml
- {MinimumRequiredVersion: 5.0.0}
- gfx950
- gfx950
- [Device 75a8]
    SolutionIndex: 0
    SolutionNameMin: Cijk_Alik_Bljk_F8BS_BH_BiasSB_HAS_SAB_SAV_UserArgs_MT160x192x128_MI16x16x1_SN_LDSB0_AFC1_AG1_AFEM1_AFEM1_ASEM1_CLR0_CADS0_DTLA0_DTLB0_DTVA0_DTVB0_DTVMXSA0_DTVMXSB0_DTVSM0_DPLB0_EPS0_ELFLR0_EMLLn1_FDSI0_GRPM1_GRVWA16_GRVWB16_GSU0_GSUAMB_GSUC0_GSUWGMRR0_GLS0_ISA950_IU1_K1_LDSTI0_LBSPPA256_LBSPPB128_LBSPPM0_LPA32_LPB32_LPM0_LRVWn1_LWPMn1_MIAV0_MIWT10_3_MO40_MGRIPM1_NTn1_NTA4_NTB0_NTC4_NTD0_NTM0_NEPBS0_NLCA1_NLCB1_ONLL0_PGR2_PLR0_PKA1_SGROB0_SIA3_SS1_SU0_SUM0_SUS0_SPO0_SRVW0_SSO1_SVW2_SK3_SKFTR0_SKXCCM4_SGRO0_TDMI0_TIN1_TLDS2_TLDSMn1_ULSGRO1_USL1_UIOFGRO0_UPLRP0_USFGRO1_VSn1_VWA2_VWB1_WSGRA0_WSGRB2_WS64_WG16_16_1_WGM0_WGMXCC2_WGMXCCGn1
    SolutionIndex: 1
    SolutionNameMin: Cijk_Alik_Bljk_F8BS_BH_BiasSB_HAS_SAB_SAV_UserArgs_MT160x192x128_MI16x16x1_SN_LDSB0_AFC1_AG1_AFEM1_AFEM1_ASEM1_CLR0_CADS0_DTLA0_DTLB0_DTVA0_DTVB0_DTVMXSA0_DTVMXSB0_DTVSM0_DPLB0_EPS0_ELFLR0_EMLL0_FDSI0_GRPM1_GRVWA16_GRVWB16_GSU0_GSUAMB_GSUC0_GSUWGMRR0_GLS0_ISA950_IU1_K1_LDSTI0_LBSPPA256_LBSPPB128_LBSPPM0_LPA32_LPB32_LPM0_LRVWn1_LWPMn1_MIAV0_MIWT10_3_MO40_MGRIPM1_NTn1_NTA4_NTB0_NTC0_NTD4_NTM0_NEPBS0_NLCA1_NLCB1_ONLL0_PGR2_PLR0_PKA1_SGROB0_SIA3_SS1_SU0_SUM0_SUS0_SPO0_SRVW0_SSO0_SVW2_SK3_SKFTR0_SKXCCM8_SGRO0_TDMI0_TIN1_TLDS2_TLDSMn1_ULSGRO1_USL1_UIOFGRO0_UPLRP0_USFGRO0_VSn1_VWA2_VWB1_WSGRA0_WSGRB2_WS64_WG16_16_1_WGMn8_WGMXCC1_WGMXCCGn1
    SolutionIndex: 2
    SolutionNameMin: Cijk_Alik_Bljk_F8BS_BH_BiasSB_HAS_SAB_SAV_UserArgs_MT128x96x256_MI16x16x1_SN_LDSB1_AFC1_AG1_AFEM1_AFEM1_ASEM1_CLR0_CADS0_DTLA0_DTLB0_DTVA0_DTVB0_DTVMXSA0_DTVMXSB0_DTVSM0_DPLB0_EPS0_ELFLR0_EMLLn1_FDSI0_GRPM1_GRVWA16_GRVWB16_GSU0_GSUAMB_GSUC0_GSUWGMRR0_GLS0_ISA950_IU1_K1_LDSTI0_LBSPPA1024_LBSPPB256_LBSPPM0_LPA32_LPB32_LPM0_LRVWn1_LWPMn1_MIAV0_MIWT4_3_MO40_MGRIPM1_NTn1_NTA0_NTB0_NTC0_NTD0_NTM0_NEPBS10_NLCA1_NLCB1_ONLL0_PGR2_PLR1_PKA1_SGROB0_SIA3_SS1_SU0_SUM0_SUS0_SPO1_SRVW0_SSO0_SVW4_SK3_SKFTR0_SKXCCM4_SGRO0_TDMI0_TIN1_TLDS2_TLDSMn1_ULSGRO1_USL1_UIOFGRO0_UPLRP0_USFGRO0_VSn1_VWA4_VWB1_WSGRA0_WSGRB2_WS64_WG32_8_1_WGM4_WGMXCC1_WGMXCCGn1
    SolutionIndex: 3
    SolutionNameMin: Cijk_Alik_Bljk_F8BS_BH_BiasSB_HAS_SAB_SAV_UserArgs_MT160x128x256_MI32x32x1_SN_LDSB0_AFC1_AG0_AFEM1_AFEM1_ASEM1_CLR0_CADS0_DTLA0_DTLB0_DTVA0_DTVB0_DTVMXSA0_DTVMXSB0_DTVSM0_DPLB0_EPS0_ELFLR0_EMLL0_FDSI0_GRPM1_GRVWA16_GRVWB16_GSU0_GSUAMB_GSUC0_GSUWGMRR0_GLS0_ISA950_IU1_K1_LDSTI0_LBSPPA256_LBSPPB256_LBSPPM0_LPA16_LPB16_LPM0_LRVWn1_LWPMn1_MIAV0_MIWT5_1_MO40_MGRIPM1_NTn1_NTA4_NTB0_NTC0_NTD4_NTM0_NEPBS0_NLCA1_NLCB1_ONLL0_PGR2_PLR1_PKA1_SGROB0_SIA3_SS1_SU0_SUM0_SUS0_SPO1_SRVW0_SSO1_SVW1_SK3_SKFTR0_SKXCCM4_SGRO0_TDMI0_TIN1_TLDS2_TLDSMn1_ULSGRO1_USL1_UIOFGRO0_UPLRP0_USFGRO0_VSn1_VWA1_VWB1_WSGRA0_WSGRB2_WS64_WG32_8_1_WGM4_WGMXCC2_WGMXCCGn1
    SolutionIndex: 4
    SolutionNameMin: Cijk_Alik_Bljk_F8BS_BH_BiasSB_HAS_SAB_SAV_UserArgs_MT160x128x256_MI32x32x1_SN_LDSB0_AFC1_AG1_AFEM1_AFEM1_ASEM1_CLR0_CADS0_DTLA0_DTLB0_DTVA0_DTVB0_DTVMXSA0_DTVMXSB0_DTVSM0_DPLB0_EPS0_ELFLR0_EMLLn1_FDSI0_GRPM1_GRVWA16_GRVWB16_GSU0_GSUAMB_GSUC0_GSUWGMRR0_GLS0_ISA950_IU1_K1_LDSTI0_LBSPPA256_LBSPPB256_LBSPPM0_LPA16_LPB16_LPM0_LRVWn1_LWPMn1_MIAV0_MIWT5_1_MO40_MGRIPM1_NTn1_NTA4_NTB0_NTC0_NTD4_NTM0_NEPBS0_NLCA1_NLCB1_ONLL0_PGR2_PLR1_PKA1_SGROB0_SIA3_SS1_SU0_SUM0_SUS0_SPO0_SRVW0_SSO0_SVW1_SK3_SKFTR0_SKXCCM8_SGRO0_TDMI0_TIN1_TLDS1_TLDSMn1_ULSGRO1_USL1_UIOFGRO0_UPLRP0_USFGRO0_VSn1_VWA1_VWB1_WSGRA0_WSGRB0_WS64_WG32_8_1_WGMn2_WGMXCC1_WGMXCCGn1
    SolutionIndex: 5
    SolutionNameMin: Cijk_Alik_Bljk_F8BS_BH_BiasSB_HAS_SAB_SAV_UserArgs_MT160x128x256_MI16x16x1_SN_LDSB0_AFC1_AG0_AFEM1_AFEM1_ASEM1_CLR0_CADS0_DTLA0_DTLB0_DTVA0_DTVB0_DTVMXSA0_DTVMXSB0_DTVSM0_DPLB0_EPS0_ELFLR0_EMLLn1_FDSI0_GRPM1_GRVWA16_GRVWB16_GSU0_GSUAMB_GSUC0_GSUWGMRR0_GLS0_ISA950_IU1_K1_LDSTI0_LBSPPA256_LBSPPB1024_LBSPPM0_LPA32_LPB32_LPM0_LRVWn1_LWPMn1_MIAV0_MIWT5_4_MO40_MGRIPM1_NTn1_NTA4_NTB0_NTC4_NTD0_NTM0_NEPBS12_NLCA1_NLCB1_ONLL0_PGR2_PLR1_PKA1_SGROB0_SIA3_SS0_SU0_SUM0_SUS0_SPO1_SRVW0_SSO0_SVW4_SK3_SKFTR0_SKXCCM4_SGRO0_TDMI0_TIN1_TLDS2_TLDSMn1_ULSGRO1_USL1_UIOFGRO0_UPLRP0_USFGRO0_VSn1_VWA1_VWB4_WSGRA0_WSGRB2_WS64_WG32_8_1_WGM8_WGMXCC1_WGMXCCGn1
    SolutionIndex: 6
    SolutionNameMin: Cijk_Alik_Bljk_F8BS_BH_BiasSB_HAS_SAB_SAV_UserArgs_MT160x128x256_MI16x16x1_SN_LDSB0_AFC1_AG0_AFEM1_AFEM1_ASEM1_CLR1_CADS0_DTLA0_DTLB0_DTVA0_DTVB0_DTVMXSA0_DTVMXSB0_DTVSM0_DPLB0_EPS0_ELFLR0_EMLL0_FDSI0_GRPM1_GRVWA16_GRVWB16_GSU0_GSUAMB_GSUC0_GSUWGMRR0_GLS0_ISA950_IU1_K1_LDSTI0_LBSPPA256_LBSPPB1024_LBSPPM0_LPA32_LPB32_LPM0_LRVWn1_LWPMn1_MIAV0_MIWT5_4_MO40_MGRIPM1_NTn1_NTA4_NTB0_NTC0_NTD0_NTM0_NEPBS14_NLCA1_NLCB1_ONLL0_PGR2_PLR1_PKA1_SGROB0_SIA3_SS0_SU0_SUM0_SUS0_SPO1_SRVW0_SSO1_SVW4_SK3_SKFTR0_SKXCCM8_SGRO0_TDMI0_TIN1_TLDS1_TLDSMn1_ULSGRO1_USL1_UIOFGRO0_UPLRP0_USFGRO0_VSn1_VWA1_VWB4_WSGRA0_WSGRB2_WS64_WG32_8_1_WGMn1_WGMXCC1_WGMXCCGn1
    SolutionIndex: 7
    SolutionNameMin: Cijk_Alik_Bljk_F8BS_BH_BiasSB_HAS_SAB_SAV_UserArgs_MT128x160x256_MI32x32x1_SN_LDSB0_AFC1_AG0_AFEM1_AFEM1_ASEM1_CLR0_CADS0_DTLA0_DTLB0_DTVA0_DTVB0_DTVMXSA0_DTVMXSB0_DTVSM0_DPLB0_EPS0_ELFLR0_EMLL0_FDSI0_GRPM1_GRVWA16_GRVWB16_GSU0_GSUAMB_GSUC0_GSUWGMRR0_GLS0_ISA950_IU1_K1_LDSTI0_LBSPPA256_LBSPPB256_LBSPPM0_LPA16_LPB16_LPM0_LRVWn1_LWPMn1_MIAV0_MIWT1_5_MO40_MGRIPM1_NTn1_NTA4_NTB0_NTC0_NTD4_NTM0_NEPBS0_NLCA1_NLCB1_ONLL0_PGR2_PLR1_PKA1_SGROB0_SIA3_SS1_SU0_SUM0_SUS0_SPO1_SRVW0_SSO0_SVW1_SK3_SKFTR0_SKXCCM8_SGRO0_TDMI0_TIN1_TLDS1_TLDSMn1_ULSGRO1_USL1_UIOFGRO0_UPLRP0_USFGRO0_VSn1_VWA1_VWB1_WSGRA2_WSGRB0_WS64_WG128_2_1_WGM6_WGMXCC1_WGMXCCGn1
    SolutionIndex: 8
    SolutionNameMin: Cijk_Alik_Bljk_F8BS_BH_BiasSB_HAS_SAB_SAV_UserArgs_MT96x224x128_MI16x16x1_SN_LDSB0_AFC1_AG1_AFEM1_AFEM1_ASEM1_CLR0_CADS0_DTLA1_DTLB1_DTVA0_DTVB0_DTVMXSA0_DTVMXSB0_DTVSM0_DPLB1_EPS0_ELFLR0_EMLL0_FDSI0_GRPM1_GRVWA16_GRVWB16_GSU0_GSUAMB_GSUC0_GSUWGMRR0_GLS0_ISA950_IU1_K1_LDSTI0_LBSPPA1024_LBSPPB1024_LBSPPM0_LPA32_LPB32_LPM0_LRVWn1_LWPMn1_MIAV0_MIWT3_7_MO40_MGRIPM1_NTn1_NTA4_NTB0_NTC0_NTD0_NTM0_NEPBS14_NLCA1_NLCB1_ONLL0_PGR2_PLR0_PKA1_SGROB0_SIA3_SS0_SU0_SUM0_SUS0_SPO0_SRVW0_SSO0_SVW4_SK3_SKFTR0_SKXCCM4_SGRO0_TDMI0_TIN1_TLDS1_TLDSMn1_ULSGRO1_USL1_UIOFGRO0_UPLRP0_USFGRO0_VSn1_VWA1_VWB1_WSGRA0_WSGRB0_WS64_WG32_8_1_WGMn8_WGMXCC1_WGMXCCGn1
    SolutionIndex: 9
    SolutionNameMin: Cijk_Alik_Bljk_F8BS_BH_BiasSB_HAS_SAB_SAV_UserArgs_MT96x256x128_MI16x16x1_SN_LDSB0_AFC1_AG1_AFEM1_AFEM1_ASEM1_CLR1_CADS0_DTLA0_DTLB0_DTVA0_DTVB0_DTVMXSA0_DTVMXSB0_DTVSM0_DPLB0_EPS0_ELFLR0_EMLL0_FDSI0_GRPM1_GRVWA16_GRVWB16_GSU0_GSUAMB_GSUC0_GSUWGMRR0_GLS0_ISA950_IU1_K1_LDSTI0_LBSPPA256_LBSPPB512_LBSPPM0_LPA32_LPB32_LPM0_LRVWn1_LWPMn1_MIAV0_MIWT6_4_MO40_MGRIPM1_NTn1_NTA4_NTB0_NTC0_NTD0_NTM0_NEPBS16_NLCA1_NLCB1_ONLL0_PGR2_PLR1_PKA1_SGROB0_SIA3_SS0_SU16_SUM0_SUS512_SPO0_SRVW0_SSO0_SVW8_SK3_SKFTR0_SKXCCM0_SGRO0_TDMI0_TIN0_TLDS1_TLDSMn1_ULSGRO1_USL1_UIOFGRO0_UPLRP0_USFGRO0_VSn1_VWA2_VWB4_WSGRA0_WSGRB2_WS64_WG16_16_1_WGMn2_WGMXCC8_WGMXCCGn1
    SolutionIndex: 10
    SolutionNameMin: Cijk_Alik_Bljk_F8BS_BH_BiasSB_HAS_SAB_SAV_UserArgs_MT160x96x256_MI16x16x1_SN_LDSB0_AFC1_AG1_AFEM1_AFEM1_ASEM1_CLR1_CADS0_DTLA0_DTLB0_DTVA0_DTVB0_DTVMXSA0_DTVMXSB0_DTVSM0_DPLB0_EPS0_ELFLR0_EMLLn1_FDSI0_GRPM1_GRVWA16_GRVWB16_GSU0_GSUAMB_GSUC0_GSUWGMRR0_GLS0_ISA950_IU1_K1_LDSTI0_LBSPPA256_LBSPPB256_LBSPPM0_LPA32_LPB32_LPM0_LRVWn1_LWPMn1_MIAV0_MIWT5_3_MO40_MGRIPM1_NTn1_NTA4_NTB0_NTC0_NTD0_NTM0_NEPBS8_NLCA1_NLCB1_ONLL0_PGR2_PLR1_PKA1_SGROB0_SIA3_SS0_SU0_SUM0_SUS0_SPO1_SRVW0_SSO0_SVW4_SK3_SKFTR0_SKXCCM0_SGRO0_TDMI0_TIN1_TLDS2_TLDSMn1_ULSGRO1_USL1_UIOFGRO0_UPLRP0_USFGRO0_VSn1_VWA1_VWB1_WSGRA0_WSGRB2_WS64_WG32_8_1_WGM6_WGMXCC8_WGMXCCGn1
    SolutionIndex: 11
    SolutionNameMin: Cijk_Alik_Bljk_F8BS_BH_BiasSB_HAS_SAB_SAV_UserArgs_MT128x128x256_MI32x32x1_SN_LDSB0_AFC1_AG1_AFEM1_AFEM1_ASEM1_CLR0_CADS0_DTLA0_DTLB0_DTVA0_DTVB0_DTVMXSA0_DTVMXSB0_DTVSM0_DPLB0_EPS0_ELFLR0_EMLL0_FDSI0_GRPM1_GRVWA16_GRVWB16_GSU0_GSUAMB_GSUC0_GSUWGMRR0_GLS0_ISA950_IU1_K1_LDSTI0_LBSPPA1024_LBSPPB256_LBSPPM0_LPA16_LPB16_LPM0_LRVWn1_LWPMn1_MIAV0_MIWT4_1_MO40_MGRIPM1_NTn1_NTA4_NTB0_NTC0_NTD4_NTM0_NEPBS12_NLCA1_NLCB1_ONLL0_PGR2_PLR1_PKA1_SGROB0_SIA3_SS1_SU0_SUM0_SUS0_SPO0_SRVW0_SSO0_SVW4_SK3_SKFTR0_SKXCCM4_SGRO0_TDMI0_TIN1_TLDS1_TLDSMn1_ULSGRO1_USL1_UIOFGRO0_UPLRP0_USFGRO0_VSn1_VWA4_VWB1_WSGRA0_WSGRB0_WS64_WG32_8_1_WGMn1_WGMXCC4_WGMXCCGn1
    SolutionIndex: 12
    SolutionNameMin: Cijk_Alik_Bljk_F8BS_BH_BiasSB_HAS_SAB_SAV_UserArgs_MT128x128x256_MI32x32x1_SN_LDSB0_AFC1_AG0_AFEM1_AFEM1_ASEM1_CLR0_CADS0_DTLA0_DTLB0_DTVA0_DTVB0_DTVMXSA0_DTVMXSB0_DTVSM0_DPLB0_EPS0_ELFLR0_EMLLn1_FDSI0_GRPM1_GRVWA16_GRVWB16_GSU0_GSUAMB_GSUC0_GSUWGMRR0_GLS0_ISA950_IU1_K1_LDSTI0_LBSPPA1024_LBSPPB256_LBSPPM0_LPA16_LPB16_LPM0_LRVWn1_LWPMn1_MIAV0_MIWT4_1_MO40_MGRIPM1_NTn1_NTA4_NTB0_NTC0_NTD4_NTM0_NEPBS8_NLCA1_NLCB1_ONLL0_PGR2_PLR1_PKA1_SGROB0_SIA3_SS1_SU0_SUM0_SUS0_SPO0_SRVW0_SSO1_SVW4_SK3_SKFTR0_SKXCCM0_SGRO0_TDMI0_TIN1_TLDS2_TLDSMn1_ULSGRO1_USL1_UIOFGRO0_UPLRP0_USFGRO0_VSn1_VWA4_VWB1_WSGRA2_WSGRB2_WS64_WG32_8_1_WGM16_WGMXCC8_WGMXCCGn1
    SolutionIndex: 13
    SolutionNameMin: Cijk_Alik_Bljk_F8BS_BH_BiasSB_HAS_SAB_SAV_UserArgs_MT80x192x256_MI16x16x1_SN_LDSB0_AFC1_AG1_AFEM1_AFEM1_ASEM1_CLR0_CADS0_DTLA0_DTLB0_DTVA0_DTVB0_DTVMXSA0_DTVMXSB0_DTVSM0_DPLB0_EPS0_ELFLR0_EMLLn1_FDSI0_GRPM1_GRVWA16_GRVWB16_GSU0_GSUAMB_GSUC0_GSUWGMRR0_GLS0_ISA950_IU1_K1_LDSTI0_LBSPPA256_LBSPPB256_LBSPPM0_LPA32_LPB32_LPM0_LRVWn1_LWPMn1_MIAV0_MIWT5_3_MO40_MGRIPM1_NTn1_NTA4_NTB0_NTC0_NTD0_NTM0_NEPBS12_NLCA1_NLCB1_ONLL0_PGR2_PLR1_PKA1_SGROB0_SIA3_SS0_SU0_SUM0_SUS0_SPO1_SRVW0_SSO0_SVW4_SK3_SKFTR0_SKXCCM0_SGRO0_TDMI0_TIN1_TLDS1_TLDSMn1_ULSGRO1_USL1_UIOFGRO0_UPLRP0_USFGRO0_VSn1_VWA1_VWB1_WSGRA0_WSGRB2_WS64_WG16_16_1_WGMn6_WGMXCC16_WGMXCCGn1
    SolutionIndex: 14
    SolutionNameMin: Cijk_Alik_Bljk_F8BS_BH_BiasSB_HAS_SAB_SAV_UserArgs_MT128x128x256_MI32x32x1_SN_LDSB0_AFC1_AG0_AFEM1_AFEM1_ASEM1_CLR0_CADS0_DTLA0_DTLB0_DTVA0_DTVB0_DTVMXSA0_DTVMXSB0_DTVSM0_DPLB0_EPS0_ELFLR0_EMLLn1_FDSI0_GRPM1_GRVWA16_GRVWB16_GSU0_GSUAMB_GSUC0_GSUWGMRR0_GLS0_ISA950_IU1_K1_LDSTI0_LBSPPA1024_LBSPPB256_LBSPPM0_LPA16_LPB16_LPM0_LRVWn1_LWPMn1_MIAV0_MIWT4_1_MO40_MGRIPM1_NTn1_NTA4_NTB0_NTC0_NTD4_NTM0_NEPBS12_NLCA1_NLCB1_ONLL0_PGR2_PLR1_PKA1_SGROB0_SIA3_SS1_SU0_SUM0_SUS0_SPO1_SRVW0_SSO0_SVW4_SK3_SKFTR0_SKXCCM8_SGRO0_TDMI0_TIN1_TLDS1_TLDSMn1_ULSGRO1_USL1_UIOFGRO0_UPLRP0_USFGRO0_VSn1_VWA4_VWB1_WSGRA0_WSGRB2_WS64_WG32_8_1_WGM2_WGMXCC1_WGMXCCGn1
    SolutionIndex: 15
    SolutionNameMin: Cijk_Alik_Bljk_F8BS_BH_BiasSB_HAS_SAB_SAV_UserArgs_MT80x192x256_MI16x16x1_SN_LDSB0_AFC1_AG1_AFEM1_AFEM1_ASEM1_CLR1_CADS0_DTLA0_DTLB0_DTVA0_DTVB0_DTVMXSA0_DTVMXSB0_DTVSM0_DPLB0_EPS0_ELFLR0_EMLLn1_FDSI0_GRPM1_GRVWA16_GRVWB16_GSU0_GSUAMB_GSUC0_GSUWGMRR0_GLS0_ISA950_IU1_K1_LDSTI0_LBSPPA256_LBSPPB256_LBSPPM0_LPA32_LPB32_LPM0_LRVWn1_LWPMn1_MIAV0_MIWT5_3_MO40_MGRIPM1_NTn1_NTA4_NTB0_NTC0_NTD0_NTM0_NEPBS8_NLCA1_NLCB1_ONLL0_PGR2_PLR1_PKA1_SGROB0_SIA3_SS0_SU0_SUM0_SUS0_SPO0_SRVW0_SSO0_SVW4_SK3_SKFTR0_SKXCCM8_SGRO0_TDMI0_TIN1_TLDS1_TLDSMn1_ULSGRO1_USL1_UIOFGRO0_UPLRP0_USFGRO0_VSn1_VWA1_VWB1_WSGRA0_WSGRB2_WS64_WG16_16_1_WGM16_WGMXCC1_WGMXCCGn1
    SolutionIndex: 16
    SolutionNameMin: Cijk_Alik_Bljk_F8BS_BH_BiasSB_HAS_SAB_SAV_UserArgs_MT96x160x256_MI16x16x1_SN_LDSB0_AFC1_AG1_AFEM1_AFEM1_ASEM1_CLR1_CADS0_DTLA0_DTLB0_DTVA0_DTVB0_DTVMXSA0_DTVMXSB0_DTVSM0_DPLB0_EPS0_ELFLR0_EMLL0_FDSI0_GRPM1_GRVWA16_GRVWB16_GSU0_GSUAMB_GSUC0_GSUWGMRR0_GLS0_ISA950_IU1_K1_LDSTI0_LBSPPA256_LBSPPB256_LBSPPM0_LPA32_LPB32_LPM0_LRVWn1_LWPMn1_MIAV0_MIWT3_5_MO40_MGRIPM1_NTn1_NTA4_NTB0_NTC0_NTD0_NTM0_NEPBS10_NLCA1_NLCB1_ONLL0_PGR2_PLR1_PKA1_SGROB0_SIA3_SS0_SU0_SUM0_SUS0_SPO0_SRVW0_SSO0_SVW4_SK3_SKFTR0_SKXCCM8_SGRO0_TDMI0_TIN1_TLDS2_TLDSMn1_ULSGRO1_USL1_UIOFGRO0_UPLRP0_USFGRO0_VSn1_VWA1_VWB1_WSGRA0_WSGRB2_WS64_WG32_8_1_WGMn4_WGMXCC1_WGMXCCGn1
    SolutionIndex: 17
    SolutionNameMin: Cijk_Alik_Bljk_F8BS_BH_BiasSB_HAS_SAB_SAV_UserArgs_MT128x224x128_MI16x16x1_SN_LDSB0_AFC1_AG0_AFEM1_AFEM1_ASEM1_CLR0_CADS0_DTLA1_DTLB1_DTVA0_DTVB0_DTVMXSA0_DTVMXSB0_DTVSM0_DPLB1_EPS0_ELFLR0_EMLL0_FDSI0_GRPM1_GRVWA16_GRVWB16_GSU0_GSUAMB_GSUC0_GSUWGMRR0_GLS0_ISA950_IU1_K1_LDSTI0_LBSPPA1024_LBSPPB1024_LBSPPM0_LPA32_LPB32_LPM0_LRVWn1_LWPMn1_MIAV0_MIWT4_7_MO40_MGRIPM1_NTn1_NTA4_NTB0_NTC4_NTD4_NTM0_NEPBS12_NLCA1_NLCB1_ONLL0_PGR2_PLR1_PKA1_SGROB0_SIA3_SS1_SU0_SUM0_SUS0_SPO0_SRVW0_SSO4_SVW4_SK3_SKFTR0_SKXCCM0_SGRO0_TDMI0_TIN1_TLDS1_TLDSMn1_ULSGRO1_USL1_UIOFGRO0_UPLRP0_USFGRO0_VSn1_VWA4_VWB1_WSGRA0_WSGRB0_WS64_WG32_8_1_WGM24_WGMXCC8_WGMXCCGn1
    SolutionIndex: 18
    SolutionNameMin: Cijk_Alik_Bljk_F8BS_BH_BiasSB_HAS_SAB_SAV_UserArgs_MT128x224x128_MI16x16x1_SN_LDSB0_AFC1_AG1_AFEM1_AFEM1_ASEM1_CLR0_CADS0_DTLA1_DTLB1_DTVA0_DTVB0_DTVMXSA0_DTVMXSB0_DTVSM0_DPLB1_EPS0_ELFLR0_EMLL0_FDSI0_GRPM1_GRVWA16_GRVWB16_GSU0_GSUAMB_GSUC0_GSUWGMRR0_GLS0_ISA950_IU1_K1_LDSTI0_LBSPPA1024_LBSPPB1024_LBSPPM0_LPA32_LPB32_LPM0_LRVWn1_LWPMn1_MIAV0_MIWT4_7_MO40_MGRIPM1_NTn1_NTA4_NTB0_NTC0_NTD4_NTM0_NEPBS14_NLCA1_NLCB1_ONLL0_PGR2_PLR1_PKA1_SGROB0_SIA3_SS1_SU0_SUM0_SUS0_SPO0_SRVW0_SSO1_SVW4_SK3_SKFTR0_SKXCCM4_SGRO0_TDMI0_TIN1_TLDS1_TLDSMn1_ULSGRO1_USL1_UIOFGRO0_UPLRP0_USFGRO0_VSn1_VWA4_VWB1_WSGRA0_WSGRB0_WS64_WG32_8_1_WGM6_WGMXCC1_WGMXCCGn1
    SolutionIndex: 19
    SolutionNameMin: Cijk_Alik_Bljk_F8BS_BH_BiasSB_HAS_SAB_SAV_UserArgs_MT128x112x256_MI16x16x1_SN_LDSB0_AFC1_AG0_AFEM1_AFEM1_ASEM1_CLR0_CADS0_DTLA0_DTLB0_DTVA0_DTVB0_DTVMXSA0_DTVMXSB0_DTVSM0_DPLB0_EPS0_ELFLR0_EMLL0_FDSI0_GRPM1_GRVWA16_GRVWB16_GSU0_GSUAMB_GSUC0_GSUWGMRR0_GLS0_ISA950_IU1_K1_LDSTI0_LBSPPA512_LBSPPB256_LBSPPM0_LPA32_LPB32_LPM0_LRVWn1_LWPMn1_MIAV0_MIWT2_7_MO40_MGRIPM1_NTn1_NTA4_NTB0_NTC0_NTD0_NTM0_NEPBS10_NLCA1_NLCB1_ONLL0_PGR2_PLR1_PKA1_SGROB0_SIA3_SS0_SU0_SUM0_SUS0_SPO0_SRVW0_SSO0_SVW8_SK3_SKFTR0_SKXCCM8_SGRO0_TDMI0_TIN1_TLDS1_TLDSMn1_ULSGRO1_USL1_UIOFGRO0_UPLRP0_USFGRO0_VSn1_VWA2_VWB1_WSGRA0_WSGRB2_WS64_WG64_4_1_WGM16_WGMXCC1_WGMXCCGn1
    SolutionIndex: 20
    SolutionNameMin: Cijk_Alik_Bljk_F8BS_BH_BiasSB_HAS_SAB_SAV_UserArgs_MT128x112x256_MI16x16x1_SN_LDSB0_AFC1_AG1_AFEM1_AFEM1_ASEM1_CLR0_CADS0_DTLA0_DTLB0_DTVA0_DTVB0_DTVMXSA0_DTVMXSB0_DTVSM0_DPLB0_EPS0_ELFLR0_EMLL0_FDSI0_GRPM1_GRVWA16_GRVWB16_GSU0_GSUAMB_GSUC0_GSUWGMRR0_GLS0_ISA950_IU1_K1_LDSTI0_LBSPPA512_LBSPPB256_LBSPPM0_LPA32_LPB32_LPM0_LRVWn1_LWPMn1_MIAV0_MIWT2_7_MO40_MGRIPM1_NTn1_NTA4_NTB0_NTC0_NTD0_NTM0_NEPBS14_NLCA1_NLCB1_ONLL0_PGR2_PLR1_PKA1_SGROB0_SIA3_SS0_SU0_SUM0_SUS0_SPO1_SRVW0_SSO1_SVW8_SK3_SKFTR0_SKXCCM4_SGRO0_TDMI0_TIN1_TLDS1_TLDSMn1_ULSGRO1_USL1_UIOFGRO0_UPLRP0_USFGRO0_VSn1_VWA2_VWB1_WSGRA0_WSGRB2_WS64_WG64_4_1_WGM8_WGMXCC1_WGMXCCGn1
    SolutionIndex: 21
    SolutionNameMin: Cijk_Alik_Bljk_F8BS_BH_BiasSB_HAS_SAB_SAV_UserArgs_MT160x160x128_MI16x16x1_SN_LDSB0_AFC1_AG0_AFEM1_AFEM1_ASEM1_CLR0_CADS0_DTLA1_DTLB1_DTVA0_DTVB0_DTVMXSA0_DTVMXSB0_DTVSM0_DPLB1_EPS0_ELFLR0_EMLLn1_FDSI0_GRPM1_GRVWA16_GRVWB16_GSU0_GSUAMB_GSUC0_GSUWGMRR0_GLS0_ISA950_IU1_K1_LDSTI0_LBSPPA1024_LBSPPB1024_LBSPPM0_LPA32_LPB32_LPM0_LRVWn1_LWPMn1_MIAV0_MIWT5_5_MO40_MGRIPM1_NTn1_NTA4_NTB0_NTC0_NTD4_NTM0_NEPBS0_NLCA1_NLCB1_ONLL0_PGR2_PLR1_PKA1_SGROB0_SIA3_SS1_SU0_SUM0_SUS0_SPO1_SRVW0_SSO1_SVW1_SK3_SKFTR0_SKXCCM8_SGRO0_TDMI0_TIN1_TLDS1_TLDSMn1_ULSGRO1_USL1_UIOFGRO0_UPLRP0_USFGRO0_VSn1_VWA1_VWB1_WSGRA0_WSGRB0_WS64_WG32_8_1_WGM4_WGMXCC1_WGMXCCGn1
    SolutionIndex: 22
    SolutionNameMin: Cijk_Alik_Bljk_F8BS_BH_BiasSB_HAS_SAB_SAV_UserArgs_MT224x320x128_MI16x16x1_SN_LDSB0_AFC1_AG1_AFEM1_AFEM1_ASEM1_CLR0_CADS0_DTLA0_DTLB0_DTVA0_DTVB0_DTVMXSA0_DTVMXSB0_DTVSM0_DPLB0_EPS0_ELFLR0_EMLLn1_FDSI0_GRPM1_GRVWA16_GRVWB16_GSU0_GSUAMB_GSUC0_GSUWGMRR0_GLS0_ISA950_IU1_K1_LDSTI0_LBSPPA128_LBSPPB256_LBSPPM0_LPA32_LPB32_LPM0_LRVWn1_LWPMn1_MIAV0_MIWT7_10_MO40_MGRIPM1_NTn1_NTA4_NTB0_NTC0_NTD4_NTM0_NEPBS0_NLCA1_NLCB1_ONLL0_PGR2_PLR0_PKA1_SGROB0_SIA3_SS1_SU16_SUM0_SUS128_SPO0_SRVW0_SSO1_SVW1_SK3_SKFTR0_SKXCCM0_SGRO0_TDMI0_TIN0_TLDS1_TLDSMn1_ULSGRO1_USL1_UIOFGRO0_UPLRP0_USFGRO0_VSn1_VWA1_VWB2_WSGRA0_WSGRB0_WS64_WG32_8_1_WGMn24_WGMXCC4_WGMXCCGn1
    SolutionIndex: 23
    SolutionNameMin: Cijk_Alik_Bljk_F8BS_BH_BiasSB_HAS_SAB_SAV_UserArgs_MT160x128x256_MI16x16x1_SN_LDSB0_AFC1_AG1_AFEM1_AFEM1_ASEM1_CLR1_CADS0_DTLA0_DTLB0_DTVA0_DTVB0_DTVMXSA0_DTVMXSB0_DTVSM0_DPLB0_EPS0_ELFLR0_EMLL0_FDSI0_GRPM1_GRVWA16_GRVWB16_GSU0_GSUAMB_GSUC0_GSUWGMRR0_GLS0_ISA950_IU1_K1_LDSTI0_LBSPPA256_LBSPPB1024_LBSPPM0_LPA32_LPB32_LPM0_LRVWn1_LWPMn1_MIAV0_MIWT5_4_MO40_MGRIPM1_NTn1_NTA4_NTB0_NTC0_NTD0_NTM0_NEPBS10_NLCA1_NLCB1_ONLL0_PGR2_PLR1_PKA1_SGROB0_SIA3_SS0_SU0_SUM0_SUS0_SPO0_SRVW0_SSO1_SVW4_SK3_SKFTR0_SKXCCM8_SGRO0_TDMI0_TIN1_TLDS1_TLDSMn1_ULSGRO1_USL1_UIOFGRO0_UPLRP0_USFGRO0_VSn1_VWA1_VWB4_WSGRA0_WSGRB0_WS64_WG32_8_1_WGMn1_WGMXCC1_WGMXCCGn1
    SolutionIndex: 24
    SolutionNameMin: Cijk_Alik_Bljk_F8BS_BH_BiasSB_HAS_SAB_SAV_UserArgs_MT80x192x256_MI16x16x1_SN_LDSB0_AFC1_AG1_AFEM1_AFEM1_ASEM1_CLR1_CADS0_DTLA0_DTLB0_DTVA0_DTVB0_DTVMXSA0_DTVMXSB0_DTVSM0_DPLB0_EPS0_ELFLR0_EMLL0_FDSI0_GRPM1_GRVWA16_GRVWB16_GSU0_GSUAMB_GSUC0_GSUWGMRR0_GLS0_ISA950_IU1_K1_LDSTI0_LBSPPA256_LBSPPB256_LBSPPM0_LPA32_LPB32_LPM0_LRVWn1_LWPMn1_MIAV0_MIWT5_3_MO40_MGRIPM1_NTn1_NTA4_NTB0_NTC0_NTD0_NTM0_NEPBS12_NLCA1_NLCB1_ONLL0_PGR2_PLR1_PKA1_SGROB0_SIA3_SS0_SU0_SUM0_SUS0_SPO0_SRVW0_SSO0_SVW4_SK3_SKFTR0_SKXCCM8_SGRO0_TDMI0_TIN1_TLDS2_TLDSMn1_ULSGRO1_USL1_UIOFGRO0_UPLRP0_USFGRO0_VSn1_VWA1_VWB1_WSGRA0_WSGRB2_WS64_WG16_16_1_WGM6_WGMXCC2_WGMXCCGn1
    SolutionIndex: 25
    SolutionNameMin: Cijk_Alik_Bljk_F8BS_BH_BiasSB_HAS_SAB_SAV_UserArgs_MT128x160x256_MI16x16x1_SN_LDSB0_AFC1_AG1_AFEM1_AFEM1_ASEM1_CLR1_CADS0_DTLA0_DTLB0_DTVA0_DTVB0_DTVMXSA0_DTVMXSB0_DTVSM0_DPLB0_EPS0_ELFLR0_EMLLn1_FDSI0_GRPM1_GRVWA16_GRVWB16_GSU0_GSUAMB_GSUC0_GSUWGMRR0_GLS0_ISA950_IU1_K1_LDSTI0_LBSPPA1024_LBSPPB256_LBSPPM0_LPA32_LPB32_LPM0_LRVWn1_LWPMn1_MIAV0_MIWT4_5_MO40_MGRIPM1_NTn1_NTA4_NTB0_NTC0_NTD4_NTM0_NEPBS10_NLCA1_NLCB1_ONLL0_PGR2_PLR1_PKA1_SGROB0_SIA3_SS1_SU0_SUM0_SUS0_SPO1_SRVW0_SSO1_SVW4_SK3_SKFTR0_SKXCCM8_SGRO0_TDMI0_TIN1_TLDS1_TLDSMn1_ULSGRO1_USL1_UIOFGRO0_UPLRP0_USFGRO0_VSn1_VWA4_VWB1_WSGRA0_WSGRB2_WS64_WG32_8_1_WGMn8_WGMXCC1_WGMXCCGn1
    SolutionIndex: 26
    SolutionNameMin: Cijk_Alik_Bljk_F8BS_BH_BiasSB_HAS_SAB_SAV_UserArgs_MT96x160x256_MI16x16x1_SN_LDSB0_AFC1_AG1_AFEM1_AFEM1_ASEM1_CLR1_CADS0_DTLA0_DTLB0_DTVA0_DTVB0_DTVMXSA0_DTVMXSB0_DTVSM0_DPLB0_EPS0_ELFLR0_EMLLn1_FDSI0_GRPM1_GRVWA16_GRVWB16_GSU0_GSUAMB_GSUC0_GSUWGMRR0_GLS0_ISA950_IU1_K1_LDSTI0_LBSPPA256_LBSPPB256_LBSPPM0_LPA32_LPB32_LPM0_LRVWn1_LWPMn1_MIAV0_MIWT3_5_MO40_MGRIPM1_NTn1_NTA4_NTB0_NTC0_NTD0_NTM0_NEPBS4_NLCA1_NLCB1_ONLL0_PGR2_PLR1_PKA1_SGROB0_SIA3_SS0_SU0_SUM0_SUS0_SPO0_SRVW0_SSO0_SVW4_SK3_SKFTR0_SKXCCM4_SGRO0_TDMI0_TIN1_TLDS2_TLDSMn1_ULSGRO1_USL1_UIOFGRO0_UPLRP0_USFGRO0_VSn1_VWA1_VWB1_WSGRA0_WSGRB2_WS64_WG32_8_1_WGM6_WGMXCC2_WGMXCCGn1
    SolutionIndex: 27
    SolutionNameMin: Cijk_Alik_Bljk_F8BS_BH_BiasSB_HAS_SAB_SAV_UserArgs_MT128x192x128_MI16x16x1_SN_LDSB0_AFC1_AG0_AFEM1_AFEM1_ASEM1_CLR0_CADS0_DTLA1_DTLB1_DTVA0_DTVB0_DTVMXSA0_DTVMXSB0_DTVSM0_DPLB1_EPS0_ELFLR0_EMLLn1_FDSI0_GRPM1_GRVWA16_GRVWB16_GSU0_GSUAMB_GSUC0_GSUWGMRR0_GLS0_ISA950_IU1_K1_LDSTI0_LBSPPA1024_LBSPPB1024_LBSPPM0_LPA32_LPB32_LPM0_LRVWn1_LWPMn1_MIAV0_MIWT8_3_MO40_MGRIPM1_NTn1_NTA4_NTB0_NTC0_NTD4_NTM0_NEPBS14_NLCA1_NLCB1_ONLL0_PGR2_PLR0_PKA1_SGROB0_SIA3_SS1_SU0_SUM0_SUS0_SPO1_SRVW0_SSO0_SVW8_SK3_SKFTR0_SKXCCM4_SGRO0_TDMI0_TIN1_TLDS2_TLDSMn1_ULSGRO1_USL1_UIOFGRO0_UPLRP0_USFGRO0_VSn1_VWA8_VWB1_WSGRA0_WSGRB0_WS64_WG16_16_1_WGM24_WGMXCC2_WGMXCCGn1
    SolutionIndex: 28
    SolutionNameMin: Cijk_Alik_Bljk_F8BS_BH_BiasSB_HAS_SAB_SAV_UserArgs_MT128x160x256_MI16x16x1_SN_LDSB0_AFC1_AG1_AFEM1_AFEM1_ASEM1_CLR1_CADS0_DTLA0_DTLB0_DTVA0_DTVB0_DTVMXSA0_DTVMXSB0_DTVSM0_DPLB0_EPS0_ELFLR0_EMLL0_FDSI0_GRPM1_GRVWA16_GRVWB16_GSU0_GSUAMB_GSUC0_GSUWGMRR0_GLS0_ISA950_IU1_K1_LDSTI0_LBSPPA1024_LBSPPB256_LBSPPM0_LPA32_LPB32_LPM0_LRVWn1_LWPMn1_MIAV0_MIWT4_5_MO40_MGRIPM1_NTn1_NTA4_NTB0_NTC0_NTD4_NTM0_NEPBS0_NLCA1_NLCB1_ONLL0_PGR2_PLR1_PKA1_SGROB0_SIA3_SS1_SU0_SUM0_SUS0_SPO1_SRVW0_SSO0_SVW4_SK3_SKFTR0_SKXCCM8_SGRO0_TDMI0_TIN1_TLDS2_TLDSMn1_ULSGRO1_USL1_UIOFGRO0_UPLRP0_USFGRO0_VSn1_VWA4_VWB1_WSGRA0_WSGRB2_WS64_WG32_8_1_WGM32_WGMXCC2_WGMXCCGn1
    SolutionIndex: 29
    SolutionNameMin: Cijk_Alik_Bljk_F8BS_BH_BiasSB_HAS_SAB_SAV_UserArgs_MT128x352x128_MI16x16x1_SN_LDSB0_AFC1_AG0_AFEM1_AFEM1_ASEM1_CLR0_CADS0_DTLA0_DTLB0_DTVA0_DTVB0_DTVMXSA0_DTVMXSB0_DTVSM0_DPLB0_EPS0_ELFLR0_EMLL0_FDSI0_GRPM1_GRVWA16_GRVWB16_GSU0_GSUAMB_GSUC0_GSUWGMRR0_GLS0_ISA950_IU1_K1_LDSTI0_LBSPPA512_LBSPPB128_LBSPPM0_LPA32_LPB32_LPM0_LRVWn1_LWPMn1_MIAV0_MIWT4_11_MO40_MGRIPM1_NTn1_NTA4_NTB0_NTC4_NTD0_NTM0_NEPBS0_NLCA1_NLCB1_ONLL0_PGR2_PLR0_PKA1_SGROB0_SIA3_SS1_SU8_SUM0_SUS128_SPO0_SRVW0_SSO0_SVW4_SK3_SKFTR0_SKXCCM0_SGRO0_TDMI0_TIN0_TLDS1_TLDSMn1_ULSGRO1_USL1_UIOFGRO0_UPLRP0_USFGRO0_VSn1_VWA4_VWB1_WSGRA0_WSGRB0_WS64_WG32_8_1_WGMn32_WGMXCC16_WGMXCCGn1
    SolutionIndex: 30
    SolutionNameMin: Cijk_Alik_Bljk_F8BS_BH_BiasSB_HAS_SAB_SAV_UserArgs_MT128x160x256_MI16x16x1_SN_LDSB0_AFC1_AG0_AFEM1_AFEM1_ASEM1_CLR0_CADS0_DTLA0_DTLB0_DTVA0_DTVB0_DTVMXSA0_DTVMXSB0_DTVSM0_DPLB0_EPS0_ELFLR0_EMLL0_FDSI0_GRPM1_GRVWA16_GRVWB16_GSU0_GSUAMB_GSUC0_GSUWGMRR0_GLS0_ISA950_IU1_K1_LDSTI0_LBSPPA1024_LBSPPB256_LBSPPM0_LPA32_LPB32_LPM0_LRVWn1_LWPMn1_MIAV0_MIWT4_5_MO40_MGRIPM1_NTn1_NTA4_NTB0_NTC0_NTD4_NTM0_NEPBS14_NLCA1_NLCB1_ONLL0_PGR2_PLR1_PKA1_SGROB0_SIA3_SS1_SU0_SUM0_SUS0_SPO1_SRVW0_SSO0_SVW4_SK3_SKFTR0_SKXCCM8_SGRO0_TDMI0_TIN1_TLDS1_TLDSMn1_ULSGRO1_USL1_UIOFGRO0_UPLRP0_USFGRO0_VSn1_VWA4_VWB1_WSGRA0_WSGRB2_WS64_WG32_8_1_WGM2_WGMXCC1_WGMXCCGn1
    SolutionIndex: 31
    SolutionNameMin: Cijk_Alik_Bljk_F8BS_BH_BiasSB_HAS_SAB_SAV_UserArgs_MT80x128x256_MI16x16x1_SN_LDSB1_AFC1_AG0_AFEM1_AFEM1_ASEM1_CLR0_CADS0_DTLA0_DTLB0_DTVA0_DTVB0_DTVMXSA0_DTVMXSB0_DTVSM0_DPLB0_EPS0_ELFLR0_EMLL0_FDSI0_GRPM1_GRVWA16_GRVWB16_GSU0_GSUAMB_GSUC0_GSUWGMRR0_GLS0_ISA950_IU1_K1_LDSTI0_LBSPPA256_LBSPPB512_LBSPPM0_LPA32_LPB32_LPM0_LRVWn1_LWPMn1_MIAV0_MIWT5_2_MO40_MGRIPM1_NTn1_NTA4_NTB0_NTC0_NTD0_NTM0_NEPBS10_NLCA1_NLCB1_ONLL0_PGR2_PLR1_PKA1_SGROB0_SIA3_SS0_SU0_SUM0_SUS0_SPO0_SRVW0_SSO0_SVW4_SK3_SKFTR0_SKXCCM4_SGRO0_TDMI0_TIN1_TLDS2_TLDSMn1_ULSGRO1_USL1_UIOFGRO0_UPLRP0_USFGRO0_VSn1_VWA1_VWB2_WSGRA0_WSGRB2_WS64_WG16_16_1_WGM16_WGMXCC4_WGMXCCGn1
    SolutionIndex: 32
    SolutionNameMin: Cijk_Alik_Bljk_F8BS_BH_BiasSB_HAS_SAB_SAV_UserArgs_MT80x128x256_MI16x16x1_SN_LDSB1_AFC1_AG0_AFEM1_AFEM1_ASEM1_CLR0_CADS0_DTLA0_DTLB0_DTVA0_DTVB0_DTVMXSA0_DTVMXSB0_DTVSM0_DPLB0_EPS0_ELFLR0_EMLLn1_FDSI0_GRPM1_GRVWA16_GRVWB16_GSU0_GSUAMB_GSUC0_GSUWGMRR0_GLS0_ISA950_IU1_K1_LDSTI0_LBSPPA256_LBSPPB512_LBSPPM0_LPA32_LPB32_LPM0_LRVWn1_LWPMn1_MIAV1_MIWT5_2_MO40_MGRIPM1_NTn1_NTA4_NTB0_NTC0_NTD0_NTM0_NEPBS12_NLCA1_NLCB1_ONLL0_PGR2_PLR1_PKA1_SGROB0_SIA3_SS0_SU0_SUM0_SUS0_SPO0_SRVW0_SSO0_SVW4_SK3_SKFTR0_SKXCCM4_SGRO0_TDMI0_TIN1_TLDS2_TLDSMn1_ULSGRO1_USL1_UIOFGRO0_UPLRP0_USFGRO0_VSn1_VWA1_VWB2_WSGRA0_WSGRB2_WS64_WG16_16_1_WGM0_WGMXCC2_WGMXCCGn1
    SolutionIndex: 33
    SolutionNameMin: Cijk_Alik_Bljk_F8BS_BH_BiasSB_HAS_SAB_SAV_UserArgs_MT80x128x256_MI16x16x1_SN_LDSB1_AFC1_AG1_AFEM1_AFEM1_ASEM1_CLR1_CADS0_DTLA0_DTLB0_DTVA0_DTVB0_DTVMXSA0_DTVMXSB0_DTVSM0_DPLB0_EPS0_ELFLR0_EMLL0_FDSI0_GRPM1_GRVWA16_GRVWB16_GSU0_GSUAMB_GSUC0_GSUWGMRR0_GLS0_ISA950_IU1_K1_LDSTI0_LBSPPA256_LBSPPB512_LBSPPM0_LPA32_LPB32_LPM0_LRVWn1_LWPMn1_MIAV0_MIWT5_2_MO40_MGRIPM1_NTn1_NTA4_NTB0_NTC0_NTD0_NTM0_NEPBS0_NLCA1_NLCB1_ONLL0_PGR2_PLR1_PKA1_SGROB0_SIA3_SS0_SU0_SUM0_SUS0_SPO0_SRVW0_SSO0_SVW4_SK3_SKFTR0_SKXCCM4_SGRO0_TDMI0_TIN1_TLDS2_TLDSMn1_ULSGRO1_USL1_UIOFGRO0_UPLRP0_USFGRO0_VSn1_VWA1_VWB2_WSGRA0_WSGRB2_WS64_WG16_16_1_WGM6_WGMXCC1_WGMXCCGn1
    SolutionIndex: 34
    SolutionNameMin: Cijk_Alik_Bljk_F8BS_BH_BiasSB_HAS_SAB_SAV_UserArgs_MT96x160x256_MI16x16x1_SN_LDSB0_AFC1_AG1_AFEM1_AFEM1_ASEM1_CLR1_CADS0_DTLA0_DTLB0_DTVA0_DTVB0_DTVMXSA0_DTVMXSB0_DTVSM0_DPLB0_EPS0_ELFLR0_EMLL0_FDSI0_GRPM1_GRVWA16_GRVWB16_GSU0_GSUAMB_GSUC0_GSUWGMRR0_GLS0_ISA950_IU1_K1_LDSTI0_LBSPPA256_LBSPPB256_LBSPPM0_LPA32_LPB32_LPM0_LRVWn1_LWPMn1_MIAV0_MIWT3_5_MO40_MGRIPM1_NTn1_NTA4_NTB0_NTC0_NTD0_NTM0_NEPBS16_NLCA1_NLCB1_ONLL0_PGR2_PLR1_PKA1_SGROB0_SIA3_SS0_SU0_SUM0_SUS0_SPO0_SRVW0_SSO0_SVW4_SK3_SKFTR0_SKXCCM4_SGRO0_TDMI0_TIN1_TLDS1_TLDSMn1_ULSGRO1_USL1_UIOFGRO0_UPLRP0_USFGRO0_VSn1_VWA1_VWB1_WSGRA0_WSGRB2_WS64_WG32_8_1_WGM24_WGMXCC16_WGMXCCGn1
    SolutionIndex: 35
    SolutionNameMin: Cijk_Alik_Bljk_F8BS_BH_BiasSB_HAS_SAB_SAV_UserArgs_MT128x128x256_MI32x32x1_SN_LDSB0_AFC1_AG1_AFEM1_AFEM1_ASEM1_CLR0_CADS0_DTLA0_DTLB0_DTVA0_DTVB0_DTVMXSA0_DTVMXSB0_DTVSM0_DPLB0_EPS0_ELFLR0_EMLL0_FDSI0_GRPM1_GRVWA16_GRVWB16_GSU0_GSUAMB_GSUC0_GSUWGMRR0_GLS0_ISA950_IU1_K1_LDSTI0_LBSPPA1024_LBSPPB256_LBSPPM0_LPA16_LPB16_LPM0_LRVWn1_LWPMn1_MIAV0_MIWT4_1_MO40_MGRIPM1_NTn1_NTA4_NTB0_NTC4_NTD0_NTM0_NEPBS0_NLCA1_NLCB1_ONLL0_PGR2_PLR1_PKA1_SGROB0_SIA3_SS1_SU0_SUM0_SUS0_SPO1_SRVW0_SSO0_SVW4_SK3_SKFTR0_SKXCCM8_SGRO0_TDMI0_TIN1_TLDS1_TLDSMn1_ULSGRO1_USL1_UIOFGRO0_UPLRP0_USFGRO0_VSn1_VWA4_VWB1_WSGRA0_WSGRB2_WS64_WG32_8_1_WGM0_WGMXCC1_WGMXCCGn1
    SolutionIndex: 36
    SolutionNameMin: Cijk_Alik_Bljk_F8BS_BH_BiasSB_HAS_SAB_SAV_UserArgs_MT128x80x256_MI16x16x1_SN_LDSB0_AFC1_AG0_AFEM1_AFEM1_ASEM1_CLR1_CADS0_DTLA0_DTLB0_DTVA0_DTVB0_DTVMXSA0_DTVMXSB0_DTVSM0_DPLB0_EPS0_ELFLR0_EMLL0_FDSI0_GRPM1_GRVWA16_GRVWB16_GSU0_GSUAMB_GSUC0_GSUWGMRR0_GLS0_ISA950_IU1_K1_LDSTI0_LBSPPA512_LBSPPB256_LBSPPM0_LPA32_LPB32_LPM0_LRVWn1_LWPMn1_MIAV1_MIWT2_5_MO40_MGRIPM1_NTn1_NTA4_NTB0_NTC0_NTD0_NTM0_NEPBS0_NLCA1_NLCB1_ONLL0_PGR2_PLR1_PKA1_SGROB0_SIA3_SS0_SU0_SUM0_SUS0_SPO0_SRVW0_SSO0_SVW8_SK3_SKFTR0_SKXCCM4_SGRO0_TDMI0_TIN1_TLDS1_TLDSMn1_ULSGRO1_USL1_UIOFGRO0_UPLRP0_USFGRO0_VSn1_VWA2_VWB1_WSGRA0_WSGRB2_WS64_WG64_4_1_WGMn1_WGMXCC1_WGMXCCGn1
    SolutionIndex: 37
    SolutionNameMin: Cijk_Alik_Bljk_F8BS_BH_BiasSB_HAS_SAB_SAV_UserArgs_MT80x128x256_MI16x16x1_SN_LDSB1_AFC1_AG0_AFEM1_AFEM1_ASEM1_CLR1_CADS0_DTLA0_DTLB0_DTVA0_DTVB0_DTVMXSA0_DTVMXSB0_DTVSM0_DPLB0_EPS0_ELFLR0_EMLL0_FDSI0_GRPM1_GRVWA16_GRVWB16_GSU0_GSUAMB_GSUC0_GSUWGMRR0_GLS0_ISA950_IU1_K1_LDSTI0_LBSPPA256_LBSPPB512_LBSPPM0_LPA32_LPB32_LPM0_LRVWn1_LWPMn1_MIAV1_MIWT5_2_MO40_MGRIPM1_NTn1_NTA4_NTB0_NTC0_NTD0_NTM0_NEPBS16_NLCA1_NLCB1_ONLL0_PGR2_PLR1_PKA1_SGROB0_SIA3_SS0_SU0_SUM0_SUS0_SPO0_SRVW0_SSO0_SVW4_SK3_SKFTR0_SKXCCM0_SGRO0_TDMI0_TIN1_TLDS1_TLDSMn1_ULSGRO1_USL1_UIOFGRO0_UPLRP0_USFGRO0_VSn1_VWA1_VWB2_WSGRA0_WSGRB2_WS64_WG16_16_1_WGMn32_WGMXCC8_WGMXCCGn1
    SolutionIndex: 38
    SolutionNameMin: Cijk_Alik_Bljk_F8BS_BH_BiasSB_HAS_SAB_SAV_UserArgs_MT80x128x256_MI16x16x1_SN_LDSB1_AFC1_AG0_AFEM1_AFEM1_ASEM1_CLR0_CADS0_DTLA0_DTLB0_DTVA0_DTVB0_DTVMXSA0_DTVMXSB0_DTVSM0_DPLB0_EPS0_ELFLR0_EMLLn1_FDSI0_GRPM1_GRVWA16_GRVWB16_GSU0_GSUAMB_GSUC0_GSUWGMRR0_GLS0_ISA950_IU1_K1_LDSTI0_LBSPPA256_LBSPPB512_LBSPPM0_LPA32_LPB32_LPM0_LRVWn1_LWPMn1_MIAV0_MIWT5_2_MO40_MGRIPM1_NTn1_NTA4_NTB0_NTC0_NTD0_NTM0_NEPBS12_NLCA1_NLCB1_ONLL0_PGR2_PLR1_PKA1_SGROB0_SIA3_SS0_SU0_SUM0_SUS0_SPO0_SRVW0_SSO1_SVW4_SK3_SKFTR0_SKXCCM4_SGRO0_TDMI0_TIN1_TLDS2_TLDSMn1_ULSGRO1_USL1_UIOFGRO0_UPLRP0_USFGRO0_VSn1_VWA1_VWB2_WSGRA2_WSGRB0_WS64_WG16_16_1_WGM24_WGMXCC4_WGMXCCGn1
    SolutionIndex: 39
    SolutionNameMin: Cijk_Alik_Bljk_F8BS_BH_BiasSB_HAS_SAB_SAV_UserArgs_MT224x288x128_MI16x16x1_SN_LDSB0_AFC1_AG0_AFEM1_AFEM1_ASEM1_CLR0_CADS0_DTLA0_DTLB0_DTVA0_DTVB0_DTVMXSA0_DTVMXSB0_DTVSM0_DPLB0_EPS0_ELFLR0_EMLLn1_FDSI0_GRPM1_GRVWA16_GRVWB16_GSU0_GSUAMB_GSUC0_GSUWGMRR0_GLS0_ISA950_IU1_K1_LDSTI0_LBSPPA128_LBSPPB128_LBSPPM0_LPA32_LPB32_LPM0_LRVWn1_LWPMn1_MIAV0_MIWT7_9_MO40_MGRIPM1_NTn1_NTA4_NTB0_NTC0_NTD4_NTM0_NEPBS0_NLCA1_NLCB1_ONLL0_PGR2_PLR0_PKA1_SGROB0_SIA3_SS1_SU16_SUM0_SUS256_SPO1_SRVW0_SSO0_SVW1_SK3_SKFTR0_SKXCCM4_SGRO0_TDMI0_TIN0_TLDS2_TLDSMn1_ULSGRO1_USL1_UIOFGRO0_UPLRP0_USFGRO0_VSn1_VWA1_VWB1_WSGRA0_WSGRB0_WS64_WG32_8_1_WGM48_WGMXCC4_WGMXCCGn1
    SolutionIndex: 40
    SolutionNameMin: Cijk_Alik_Bljk_F8BS_BH_BiasSB_HAS_SAB_SAV_UserArgs_MT128x112x256_MI16x16x1_SN_LDSB0_AFC1_AG0_AFEM1_AFEM1_ASEM1_CLR1_CADS0_DTLA0_DTLB0_DTVA0_DTVB0_DTVMXSA0_DTVMXSB0_DTVSM0_DPLB0_EPS0_ELFLR0_EMLL0_FDSI0_GRPM1_GRVWA16_GRVWB16_GSU0_GSUAMB_GSUC0_GSUWGMRR0_GLS0_ISA950_IU1_K1_LDSTI0_LBSPPA512_LBSPPB256_LBSPPM0_LPA32_LPB32_LPM0_LRVWn1_LWPMn1_MIAV0_MIWT2_7_MO40_MGRIPM1_NTn1_NTA4_NTB0_NTC0_NTD4_NTM0_NEPBS0_NLCA1_NLCB1_ONLL0_PGR2_PLR1_PKA1_SGROB0_SIA3_SS1_SU0_SUM0_SUS0_SPO0_SRVW0_SSO1_SVW2_SK3_SKFTR0_SKXCCM8_SGRO0_TDMI0_TIN1_TLDS2_TLDSMn1_ULSGRO1_USL1_UIOFGRO0_UPLRP0_USFGRO0_VSn1_VWA2_VWB1_WSGRA0_WSGRB2_WS64_WG64_4_1_WGM2_WGMXCC1_WGMXCCGn1
    SolutionIndex: 41
    SolutionNameMin: Cijk_Alik_Bljk_F8BS_BH_BiasSB_HAS_SAB_SAV_UserArgs_MT96x96x256_MI16x16x1_SN_LDSB0_AFC1_AG1_AFEM1_AFEM1_ASEM1_CLR0_CADS0_DTLA0_DTLB0_DTVA0_DTVB0_DTVMXSA0_DTVMXSB0_DTVSM0_DPLB0_EPS0_ELFLR0_EMLL0_FDSI0_GRPM1_GRVWA16_GRVWB16_GSU0_GSUAMB_GSUC0_GSUWGMRR0_GLS0_ISA950_IU1_K1_LDSTI0_LBSPPA256_LBSPPB256_LBSPPM0_LPA32_LPB32_LPM0_LRVWn1_LWPMn1_MIAV1_MIWT3_3_MO40_MGRIPM1_NTn1_NTA4_NTB0_NTC0_NTD0_NTM0_NEPBS0_NLCA1_NLCB1_ONLL0_PGR2_PLR1_PKA1_SGROB0_SIA3_SS0_SU0_SUM0_SUS0_SPO0_SRVW0_SSO0_SVW4_SK3_SKFTR0_SKXCCM4_SGRO0_TDMI0_TIN1_TLDS1_TLDSMn1_ULSGRO1_USL1_UIOFGRO0_UPLRP0_USFGRO0_VSn1_VWA1_VWB1_WSGRA0_WSGRB0_WS64_WG32_8_1_WGM16_WGMXCC1_WGMXCCGn1
    SolutionIndex: 42
    SolutionNameMin: Cijk_Alik_Bljk_F8BS_BH_BiasSB_HAS_SAB_SAV_UserArgs_MT80x64x512_MI16x16x1_SN_LDSB0_AFC1_AG0_AFEM1_AFEM1_ASEM1_CLR1_CADS0_DTLA1_DTLB1_DTVA0_DTVB0_DTVMXSA0_DTVMXSB0_DTVSM0_DPLB0_EPS0_ELFLR0_EMLLn1_FDSI0_GRPM1_GRVWA16_GRVWB16_GSU0_GSUAMB_GSUC0_GSUWGMRR0_GLS0_ISA950_IU1_K1_LDSTI0_LBSPPA1024_LBSPPB1024_LBSPPM0_LPA32_LPB32_LPM0_LRVWn1_LWPMn1_MIAV0_MIWT5_1_MO40_MGRIPM1_NTn1_NTA4_NTB0_NTC0_NTD0_NTM0_NEPBS0_NLCA1_NLCB1_ONLL0_PGR2_PLR1_PKA1_SGROB0_SIA3_SS0_SU0_SUM0_SUS0_SPO0_SRVW0_SSO0_SVW4_SK3_SKFTR0_SKXCCM4_SGRO0_TDMI0_TIN1_TLDS1_TLDSMn1_ULSGRO0_USL1_UIOFGRO0_UPLRP0_USFGRO0_VSn1_VWA1_VWB1_WSGRA0_WSGRB0_WS64_WG16_16_1_WGM48_WGMXCC1_WGMXCCGn1
    SolutionIndex: 43
    SolutionNameMin: Cijk_Alik_Bljk_F8BS_BH_BiasSB_HAS_SAB_SAV_UserArgs_MT80x64x512_MI16x16x1_SN_LDSB0_AFC1_AG0_AFEM1_AFEM1_ASEM1_CLR0_CADS0_DTLA0_DTLB0_DTVA0_DTVB0_DTVMXSA0_DTVMXSB0_DTVSM0_DPLB0_EPS0_ELFLR0_EMLLn1_FDSI0_GRPM1_GRVWA16_GRVWB16_GSU0_GSUAMB_GSUC0_GSUWGMRR0_GLS0_ISA950_IU1_K1_LDSTI0_LBSPPA512_LBSPPB512_LBSPPM0_LPA32_LPB32_LPM0_LRVWn1_LWPMn1_MIAV0_MIWT5_1_MO40_MGRIPM1_NTn1_NTA4_NTB0_NTC0_NTD0_NTM0_NEPBS10_NLCA1_NLCB1_ONLL0_PGR2_PLR1_PKA1_SGROB0_SIA3_SS0_SU0_SUM0_SUS0_SPO1_SRVW0_SSO0_SVW4_SK3_SKFTR0_SKXCCM4_SGRO0_TDMI0_TIN1_TLDS1_TLDSMn1_ULSGRO0_USL1_UIOFGRO0_UPLRP0_USFGRO0_VSn1_VWA1_VWB1_WSGRA2_WSGRB2_WS64_WG16_16_1_WGMn8_WGMXCC1_WGMXCCGn1
    SolutionIndex: 44
    SolutionNameMin: Cijk_Alik_Bljk_F8BS_BH_BiasSB_HAS_SAB_SAV_UserArgs_MT64x160x256_MI16x16x1_SN_LDSB0_AFC1_AG1_AFEM1_AFEM1_ASEM1_CLR0_CADS0_DTLA0_DTLB0_DTVA0_DTVB0_DTVMXSA0_DTVMXSB0_DTVSM0_DPLB0_EPS0_ELFLR0_EMLLn1_FDSI0_GRPM1_GRVWA16_GRVWB16_GSU0_GSUAMB_GSUC0_GSUWGMRR0_GLS0_ISA950_IU1_K1_LDSTI0_LBSPPA512_LBSPPB256_LBSPPM0_LPA32_LPB32_LPM0_LRVWn1_LWPMn1_MIAV0_MIWT2_5_MO40_MGRIPM1_NTn1_NTA4_NTB0_NTC0_NTD0_NTM0_NEPBS10_NLCA1_NLCB1_ONLL0_PGR2_PLR1_PKA1_SGROB0_SIA3_SS0_SU0_SUM0_SUS0_SPO0_SRVW0_SSO0_SVW8_SK3_SKFTR0_SKXCCM0_SGRO0_TDMI0_TIN1_TLDS2_TLDSMn1_ULSGRO1_USL1_UIOFGRO0_UPLRP0_USFGRO0_VSn1_VWA2_VWB1_WSGRA0_WSGRB2_WS64_WG32_8_1_WGMn2_WGMXCC16_WGMXCCGn1
    SolutionIndex: 45
    SolutionNameMin: Cijk_Alik_Bljk_F8BS_BH_BiasSB_HAS_SAB_SAV_UserArgs_MT80x64x512_MI16x16x1_SN_LDSB0_AFC1_AG1_AFEM1_AFEM1_ASEM1_CLR0_CADS0_DTLA0_DTLB0_DTVA0_DTVB0_DTVMXSA0_DTVMXSB0_DTVSM0_DPLB0_EPS0_ELFLR0_EMLLn1_FDSI0_GRPM1_GRVWA16_GRVWB16_GSU0_GSUAMB_GSUC0_GSUWGMRR0_GLS0_ISA950_IU1_K1_LDSTI0_LBSPPA512_LBSPPB512_LBSPPM0_LPA32_LPB32_LPM0_LRVWn1_LWPMn1_MIAV0_MIWT5_1_MO40_MGRIPM1_NTn1_NTA4_NTB0_NTC0_NTD0_NTM0_NEPBS12_NLCA1_NLCB1_ONLL0_PGR2_PLR1_PKA1_SGROB0_SIA3_SS0_SU0_SUM0_SUS0_SPO1_SRVW0_SSO0_SVW4_SK3_SKFTR0_SKXCCM8_SGRO0_TDMI0_TIN1_TLDS2_TLDSMn1_ULSGRO0_USL1_UIOFGRO0_UPLRP0_USFGRO0_VSn1_VWA1_VWB1_WSGRA2_WSGRB2_WS64_WG16_16_1_WGM6_WGMXCC1_WGMXCCGn1
    SolutionIndex: 46
    SolutionNameMin: Cijk_Alik_Bljk_F8BS_BH_BiasSB_HAS_SAB_SAV_UserArgs_MT160x320x128_MI16x16x1_SN_LDSB0_AFC1_AG1_AFEM1_AFEM1_ASEM1_CLR0_CADS0_DTLA0_DTLB0_DTVA0_DTVB0_DTVMXSA0_DTVMXSB0_DTVSM0_DPLB0_EPS0_ELFLR0_EMLL0_FDSI0_GRPM1_GRVWA16_GRVWB16_GSU0_GSUAMB_GSUC0_GSUWGMRR0_GLS0_ISA950_IU1_K1_LDSTI0_LBSPPA256_LBSPPB128_LBSPPM0_LPA32_LPB32_LPM0_LRVWn1_LWPMn1_MIAV0_MIWT10_5_MO40_MGRIPM1_NTn1_NTA4_NTB0_NTC0_NTD4_NTM0_NEPBS0_NLCA1_NLCB1_ONLL0_PGR2_PLR0_PKA1_SGROB0_SIA3_SS1_SU0_SUM0_SUS0_SPO0_SRVW0_SSO0_SVW2_SK3_SKFTR0_SKXCCM8_SGRO0_TDMI0_TIN1_TLDS1_TLDSMn1_ULSGRO1_USL1_UIOFGRO0_UPLRP0_USFGRO0_VSn1_VWA2_VWB1_WSGRA2_WSGRB2_WS64_WG16_16_1_WGMn4_WGMXCC1_WGMXCCGn1
    SolutionIndex: 47
    SolutionNameMin: Cijk_Alik_Bljk_F8BS_BH_BiasSB_HAS_SAB_SAV_UserArgs_MT128x96x256_MI16x16x1_SN_LDSB0_AFC1_AG1_AFEM1_AFEM1_ASEM1_CLR1_CADS0_DTLA0_DTLB0_DTVA0_DTVB0_DTVMXSA0_DTVMXSB0_DTVSM0_DPLB0_EPS0_ELFLR0_EMLLn1_FDSI0_GRPM1_GRVWA16_GRVWB16_GSU0_GSUAMB_GSUC0_GSUWGMRR0_GLS0_ISA950_IU1_K1_LDSTI0_LBSPPA1024_LBSPPB256_LBSPPM0_LPA32_LPB32_LPM0_LRVWn1_LWPMn1_MIAV0_MIWT4_3_MO40_MGRIPM1_NTn1_NTA4_NTB0_NTC0_NTD0_NTM0_NEPBS12_NLCA1_NLCB1_ONLL0_PGR2_PLR1_PKA1_SGROB0_SIA3_SS1_SU0_SUM0_SUS0_SPO0_SRVW0_SSO0_SVW4_SK3_SKFTR0_SKXCCM8_SGRO0_TDMI0_TIN1_TLDS1_TLDSMn1_ULSGRO1_USL1_UIOFGRO0_UPLRP0_USFGRO0_VSn1_VWA4_VWB1_WSGRA0_WSGRB2_WS64_WG32_8_1_WGM4_WGMXCC1_WGMXCCGn1
    SolutionIndex: 48
    SolutionNameMin: Cijk_Alik_Bljk_F8BS_BH_BiasSB_HAS_SAB_SAV_UserArgs_MT128x16x512_MI16x16x1_SN_LDSB0_AFC1_AG0_AFEM1_AFEM1_ASEM1_CLR0_CADS0_DTLA0_DTLB0_DTVA0_DTVB0_DTVMXSA0_DTVMXSB0_DTVSM0_DPLB0_EPS0_ELFLR0_EMLLn1_FDSI0_GRPM1_GRVWA16_GRVWB16_GSU0_GSUAMB_GSUC0_GSUWGMRR0_GLS0_ISA950_IU1_K1_LDSTI0_LBSPPA1024_LBSPPB512_LBSPPM0_LPA32_LPB32_LPM0_LRVWn1_LWPMn1_MIAV0_MIWT2_1_MO40_MGRIPM1_NTn1_NTA4_NTB0_NTC0_NTD0_NTM0_NEPBS16_NLCA1_NLCB1_ONLL0_PGR2_PLR1_PKA1_SGROB0_SIA3_SS1_SU0_SUM0_SUS0_SPO0_SRVW0_SSO0_SVW2_SK3_SKFTR0_SKXCCM4_SGRO0_TDMI0_TIN1_TLDS1_TLDSMn1_ULSGRO0_USL1_UIOFGRO0_UPLRP0_USFGRO0_VSn1_VWA2_VWB1_WSGRA0_WSGRB0_WS64_WG64_4_1_WGM24_WGMXCC1_WGMXCCGn1
    SolutionIndex: 49
    SolutionNameMin: Cijk_Alik_Bljk_F8BS_BH_BiasSB_HAS_SAB_SAV_UserArgs_MT64x64x512_MI16x16x1_SN_LDSB0_AFC1_AG1_AFEM1_AFEM1_ASEM1_CLR0_CADS0_DTLA0_DTLB0_DTVA0_DTVB0_DTVMXSA0_DTVMXSB0_DTVSM0_DPLB0_EPS0_ELFLR0_EMLLn1_FDSI0_GRPM1_GRVWA16_GRVWB16_GSU0_GSUAMB_GSUC0_GSUWGMRR0_GLS0_ISA950_IU1_K1_LDSTI0_LBSPPA1024_LBSPPB1024_LBSPPM0_LPA32_LPB32_LPM0_LRVWn1_LWPMn1_MIAV1_MIWT2_2_MO40_MGRIPM1_NTn1_NTA4_NTB0_NTC0_NTD0_NTM0_NEPBS12_NLCA1_NLCB1_ONLL0_PGR2_PLR1_PKA1_SGROB0_SIA3_SS0_SU0_SUM0_SUS0_SPO0_SRVW0_SSO0_SVW8_SK3_SKFTR0_SKXCCM4_SGRO0_TDMI0_TIN1_TLDS1_TLDSMn1_ULSGRO0_USL1_UIOFGRO0_UPLRP0_USFGRO1_VSn1_VWA2_VWB2_WSGRA0_WSGRB2_WS64_WG32_8_1_WGMn6_WGMXCC1_WGMXCCGn1
    SolutionIndex: 50
    SolutionNameMin: Cijk_Alik_Bljk_F8BS_BH_BiasSB_HAS_SAB_SAV_UserArgs_MT64x128x256_MI16x16x1_SN_LDSB0_AFC1_AG0_AFEM1_AFEM1_ASEM1_CLR1_CADS0_DTLA1_DTLB1_DTVA0_DTVB0_DTVMXSA0_DTVMXSB0_DTVSM0_DPLB0_EPS0_ELFLR0_EMLLn1_FDSI0_GRPM1_GRVWA16_GRVWB16_GSU0_GSUAMB_GSUC0_GSUWGMRR0_GLS0_ISA950_IU1_K1_LDSTI0_LBSPPA1024_LBSPPB1024_LBSPPM0_LPA32_LPB32_LPM0_LRVWn1_LWPMn1_MIAV0_MIWT4_2_MO40_MGRIPM1_NTn1_NTA4_NTB0_NTC0_NTD0_NTM0_NEPBS12_NLCA1_NLCB1_ONLL0_PGR3_PLR1_PKA1_SGROB1_SIA3_SS1_SU0_SUM0_SUS0_SPO0_SRVW0_SSO0_SVW4_SK3_SKFTR0_SKXCCM0_SGRO0_TDMI0_TIN1_TLDS1_TLDSMn1_ULSGRO1_USL1_UIOFGRO0_UPLRP0_USFGRO0_VSn1_VWA4_VWB2_WSGRA0_WSGRB0_WS64_WG16_16_1_WGMn48_WGMXCC16_WGMXCCGn1
    SolutionIndex: 51
    SolutionNameMin: Cijk_Alik_Bljk_F8BS_BH_BiasSB_HAS_SAB_SAV_UserArgs_MT64x96x256_MI16x16x1_SN_LDSB0_AFC1_AG0_AFEM1_AFEM1_ASEM1_CLR0_CADS0_DTLA0_DTLB0_DTVA0_DTVB0_DTVMXSA0_DTVMXSB0_DTVSM0_DPLB0_EPS0_ELFLR0_EMLL0_FDSI0_GRPM1_GRVWA4_GRVWB16_GSU0_GSUAMB_GSUC0_GSUWGMRR0_GLS0_ISA950_IU1_K1_LDSTI0_LBSPPA512_LBSPPB256_LBSPPM0_LPA32_LPB32_LPM0_LRVWn1_LWPMn1_MIAV1_MIWT2_3_MO40_MGRIPM1_NTn1_NTA4_NTB0_NTC0_NTD0_NTM0_NEPBS8_NLCA1_NLCB1_ONLL0_PGR2_PLR1_PKA1_SGROB0_SIA3_SS0_SU0_SUM0_SUS0_SPO0_SRVW0_SSO0_SVW8_SK3_SKFTR0_SKXCCM0_SGRO0_TDMI0_TIN1_TLDS2_TLDSMn1_ULSGRO0_USL1_UIOFGRO0_UPLRP0_USFGRO0_VSn1_VWA2_VWB1_WSGRA0_WSGRB2_WS64_WG32_8_1_WGMn6_WGMXCC4_WGMXCCGn1
    SolutionIndex: 52
    SolutionNameMin: Cijk_Alik_Bljk_F8BS_BH_BiasSB_HAS_SAB_SAV_UserArgs_MT64x96x256_MI16x16x1_SN_LDSB0_AFC1_AG1_AFEM1_AFEM1_ASEM1_CLR0_CADS0_DTLA1_DTLB1_DTVA0_DTVB0_DTVMXSA0_DTVMXSB0_DTVSM0_DPLB1_EPS0_ELFLR0_EMLLn1_FDSI0_GRPM1_GRVWA16_GRVWB16_GSU0_GSUAMB_GSUC0_GSUWGMRR0_GLS0_ISA950_IU1_K1_LDSTI0_LBSPPA1024_LBSPPB1024_LBSPPM0_LPA32_LPB32_LPM0_LRVWn1_LWPMn1_MIAV0_MIWT2_3_MO40_MGRIPM1_NTn1_NTA4_NTB0_NTC0_NTD0_NTM0_NEPBS8_NLCA1_NLCB1_ONLL0_PGR2_PLR1_PKA1_SGROB1_SIA3_SS0_SU0_SUM0_SUS0_SPO1_SRVW0_SSO0_SVW8_SK3_SKFTR0_SKXCCM4_SGRO0_TDMI0_TIN1_TLDS1_TLDSMn1_ULSGRO0_USL1_UIOFGRO0_UPLRP0_USFGRO0_VSn1_VWA2_VWB1_WSGRA0_WSGRB0_WS64_WG32_8_1_WGMn1_WGMXCC1_WGMXCCGn1
    SolutionIndex: 53
    SolutionNameMin: Cijk_Alik_Bljk_F8BS_BH_BiasSB_HAS_SAB_SAV_UserArgs_MT64x80x256_MI16x16x1_SN_LDSB1_AFC1_AG1_AFEM1_AFEM1_ASEM1_CLR0_CADS0_DTLA0_DTLB0_DTVA0_DTVB0_DTVMXSA0_DTVMXSB0_DTVSM0_DPLB0_EPS0_ELFLR0_EMLLn1_FDSI0_GRPM1_GRVWA4_GRVWB16_GSU0_GSUAMB_GSUC0_GSUWGMRR0_GLS0_ISA950_IU1_K1_LDSTI0_LBSPPA256_LBSPPB256_LBSPPM0_LPA32_LPB32_LPM0_LRVWn1_LWPMn1_MIAV0_MIWT1_5_MO40_MGRIPM1_NTn1_NTA4_NTB0_NTC0_NTD0_NTM0_NEPBS16_NLCA1_NLCB1_ONLL0_PGR2_PLR1_PKA1_SGROB0_SIA3_SS0_SU0_SUM0_SUS0_SPO0_SRVW0_SSO0_SVW4_SK3_SKFTR0_SKXCCM4_SGRO0_TDMI0_TIN1_TLDS1_TLDSMn1_ULSGRO0_USL1_UIOFGRO0_UPLRP0_USFGRO0_VSn1_VWA1_VWB1_WSGRA0_WSGRB0_WS64_WG64_4_1_WGMn4_WGMXCC1_WGMXCCGn1
    SolutionIndex: 54
    SolutionNameMin: Cijk_Alik_Bljk_F8BS_BH_BiasSB_HAS_SAB_SAV_UserArgs_MT64x64x512_MI16x16x1_SN_LDSB0_AFC1_AG0_AFEM1_AFEM1_ASEM1_CLR0_CADS0_DTLA1_DTLB1_DTVA0_DTVB0_DTVMXSA0_DTVMXSB0_DTVSM0_DPLB0_EPS0_ELFLR0_EMLL0_FDSI0_GRPM1_GRVWA16_GRVWB16_GSU0_GSUAMB_GSUC0_GSUWGMRR0_GLS0_ISA950_IU1_K1_LDSTI0_LBSPPA2048_LBSPPB1024_LBSPPM0_LPA32_LPB32_LPM0_LRVWn1_LWPMn1_MIAV1_MIWT4_2_MO40_MGRIPM1_NTn1_NTA4_NTB0_NTC0_NTD0_NTM0_NEPBS10_NLCA1_NLCB1_ONLL0_PGR2_PLR1_PKA1_SGROB0_SIA3_SS1_SU8_SUM0_SUS512_SPO0_SRVW0_SSO0_SVW4_SK3_SKFTR0_SKXCCM0_SGRO0_TDMI0_TIN0_TLDS1_TLDSMn1_ULSGRO0_USL1_UIOFGRO0_UPLRP0_USFGRO0_VSn1_VWA4_VWB2_WSGRA0_WSGRB0_WS64_WG16_8_2_WGM0_WGMXCC4_WGMXCCGn1
    SolutionIndex: 55
    SolutionNameMin: Cijk_Alik_Bljk_F8BS_BH_BiasSB_HAS_SAB_SAV_UserArgs_MT224x288x128_MI16x16x1_SN_LDSB0_AFC1_AG0_AFEM1_AFEM1_ASEM1_CLR0_CADS0_DTLA0_DTLB0_DTVA0_DTVB0_DTVMXSA0_DTVMXSB0_DTVSM0_DPLB0_EPS0_ELFLR0_EMLLn1_FDSI0_GRPM1_GRVWA16_GRVWB16_GSU0_GSUAMB_GSUC0_GSUWGMRR0_GLS0_ISA950_IU1_K1_LDSTI0_LBSPPA128_LBSPPB128_LBSPPM0_LPA32_LPB32_LPM0_LRVWn1_LWPMn1_MIAV0_MIWT7_9_MO40_MGRIPM1_NTn1_NTA4_NTB0_NTC0_NTD4_NTM0_NEPBS0_NLCA1_NLCB1_ONLL0_PGR2_PLR0_PKA1_SGROB0_SIA3_SS1_SU0_SUM0_SUS0_SPO1_SRVW0_SSO1_SVW1_SK3_SKFTR0_SKXCCM4_SGRO0_TDMI0_TIN1_TLDS1_TLDSMn1_ULSGRO1_USL1_UIOFGRO0_UPLRP0_USFGRO0_VSn1_VWA1_VWB1_WSGRA0_WSGRB0_WS64_WG32_8_1_WGM2_WGMXCC1_WGMXCCGn1
    SolutionIndex: 56
    SolutionNameMin: Cijk_Alik_Bljk_F8BS_BH_BiasSB_HAS_SAB_SAV_UserArgs_MT64x48x512_MI16x16x1_SN_LDSB0_AFC1_AG1_AFEM1_AFEM1_ASEM1_CLR1_CADS0_DTLA1_DTLB1_DTVA0_DTVB0_DTVMXSA0_DTVMXSB0_DTVSM0_DPLB0_EPS0_ELFLR0_EMLL0_FDSI0_GRPM1_GRVWA16_GRVWB16_GSU0_GSUAMB_GSUC0_GSUWGMRR0_GLS0_ISA950_IU1_K1_LDSTI0_LBSPPA1024_LBSPPB1024_LBSPPM0_LPA32_LPB32_LPM0_LRVWn1_LWPMn1_MIAV1_MIWT1_3_MO40_MGRIPM1_NTn1_NTA4_NTB0_NTC0_NTD0_NTM0_NEPBS8_NLCA1_NLCB1_ONLL0_PGR2_PLR1_PKA1_SGROB0_SIA3_SS0_SU0_SUM0_SUS0_SPO0_SRVW0_SSO0_SVW4_SK3_SKFTR0_SKXCCM4_SGRO0_TDMI0_TIN1_TLDS1_TLDSMn1_ULSGRO0_USL1_UIOFGRO0_UPLRP0_USFGRO0_VSn1_VWA1_VWB1_WSGRA0_WSGRB0_WS64_WG64_4_1_WGM4_WGMXCC1_WGMXCCGn1
    SolutionIndex: 57
    SolutionNameMin: Cijk_Alik_Bljk_F8BS_BH_BiasSB_HAS_SAB_SAV_UserArgs_MT64x64x512_MI16x16x1_SN_LDSB0_AFC1_AG0_AFEM1_AFEM1_ASEM1_CLR0_CADS0_DTLA0_DTLB0_DTVA0_DTVB0_DTVMXSA0_DTVMXSB0_DTVSM0_DPLB0_EPS0_ELFLR0_EMLLn1_FDSI0_GRPM1_GRVWA16_GRVWB16_GSU0_GSUAMB_GSUC0_GSUWGMRR0_GLS0_ISA950_IU1_K1_LDSTI0_LBSPPA1024_LBSPPB1024_LBSPPM0_LPA32_LPB32_LPM0_LRVWn1_LWPMn1_MIAV1_MIWT2_2_MO40_MGRIPM1_NTn1_NTA4_NTB0_NTC0_NTD0_NTM0_NEPBS16_NLCA1_NLCB1_ONLL0_PGR2_PLR1_PKA1_SGROB0_SIA3_SS0_SU0_SUM0_SUS0_SPO0_SRVW0_SSO0_SVW8_SK3_SKFTR0_SKXCCM8_SGRO0_TDMI0_TIN1_TLDS1_TLDSMn1_ULSGRO0_USL1_UIOFGRO0_UPLRP0_USFGRO1_VSn1_VWA2_VWB2_WSGRA2_WSGRB2_WS64_WG32_8_1_WGMn16_WGMXCC1_WGMXCCGn1
    SolutionIndex: 58
    SolutionNameMin: Cijk_Alik_Bljk_F8BS_BH_BiasSB_HAS_SAB_SAV_UserArgs_MT64x32x512_MI16x16x1_SN_LDSB0_AFC1_AG0_AFEM1_AFEM1_ASEM1_CLR0_CADS0_DTLA0_DTLB0_DTVA0_DTVB0_DTVMXSA0_DTVMXSB0_DTVSM0_DPLB0_EPS0_ELFLR0_EMLL0_FDSI0_GRPM1_GRVWA16_GRVWB16_GSU0_GSUAMB_GSUC0_GSUWGMRR0_GLS0_ISA950_IU1_K1_LDSTI0_LBSPPA512_LBSPPB1024_LBSPPM0_LPA32_LPB32_LPM0_LRVWn1_LWPMn1_MIAV0_MIWT1_2_MO40_MGRIPM1_NTn1_NTA4_NTB0_NTC0_NTD0_NTM0_NEPBS16_NLCA1_NLCB1_ONLL0_PGR2_PLR1_PKA1_SGROB0_SIA3_SS0_SU0_SUM0_SUS0_SPO0_SRVW0_SSO0_SVW4_SK3_SKFTR0_SKXCCM8_SGRO0_TDMI0_TIN1_TLDS1_TLDSMn1_ULSGRO0_USL1_UIOFGRO0_UPLRP0_USFGRO1_VSn1_VWA1_VWB2_WSGRA2_WSGRB2_WS64_WG64_4_1_WGMn24_WGMXCC1_WGMXCCGn1
    SolutionIndex: 59
    SolutionNameMin: Cijk_Alik_Bljk_F8BS_BH_BiasSB_HAS_SAB_SAV_UserArgs_MT32x16x256_MI16x16x1_SN_LDSB0_AFC1_AG0_AFEM1_AFEM1_ASEM1_CLR1_CADS0_DTLA1_DTLB1_DTVA0_DTVB0_DTVMXSA0_DTVMXSB0_DTVSM0_DPLB1_EPS0_ELFLR0_EMLL0_FDSI0_GRPM1_GRVWA16_GRVWB16_GSU0_GSUAMB_GSUC0_GSUWGMRR0_GLS0_ISA950_IU1_K1_LDSTI0_LBSPPA1024_LBSPPB1024_LBSPPM0_LPA32_LPB32_LPM0_LRVWn1_LWPMn1_MIAV0_MIWT1_1_MO40_MGRIPM1_NTn1_NTA4_NTB0_NTC0_NTD0_NTM0_NEPBS14_NLCA1_NLCB1_ONLL0_PGR4_PLR1_PKA1_SGROB0_SIA3_SS0_SU0_SUM0_SUS0_SPO0_SRVW0_SSO0_SVW4_SK3_SKFTR0_SKXCCM4_SGRO0_TDMI0_TIN1_TLDS1_TLDSMn1_ULSGRO0_USL1_UIOFGRO0_UPLRP0_USFGRO0_VSn1_VWA1_VWB1_WSGRA0_WSGRB0_WS64_WG32_4_1_WGM48_WGMXCC1_WGMXCCGn1
    SolutionIndex: 60
    SolutionNameMin: Cijk_Alik_Bljk_F8BS_BH_BiasSB_HAS_SAB_SAV_UserArgs_MT64x32x512_MI16x16x1_SN_LDSB0_AFC1_AG0_AFEM1_AFEM1_ASEM1_CLR0_CADS0_DTLA0_DTLB0_DTVA0_DTVB0_DTVMXSA0_DTVMXSB0_DTVSM0_DPLB0_EPS0_ELFLR0_EMLLn1_FDSI0_GRPM1_GRVWA16_GRVWB16_GSU0_GSUAMB_GSUC0_GSUWGMRR0_GLS0_ISA950_IU1_K1_LDSTI0_LBSPPA1024_LBSPPB512_LBSPPM0_LPA32_LPB32_LPM0_LRVWn1_LWPMn1_MIAV0_MIWT2_1_MO40_MGRIPM1_NTn1_NTA4_NTB0_NTC0_NTD0_NTM0_NEPBS8_NLCA1_NLCB1_ONLL0_PGR2_PLR1_PKA1_SGROB0_SIA3_SS0_SU0_SUM0_SUS0_SPO0_SRVW0_SSO0_SVW8_SK3_SKFTR0_SKXCCM8_SGRO0_TDMI0_TIN1_TLDS1_TLDSMn1_ULSGRO0_USL1_UIOFGRO0_UPLRP0_USFGRO1_VSn1_VWA2_VWB1_WSGRA2_WSGRB2_WS64_WG32_8_1_WGMn32_WGMXCC1_WGMXCCGn1
    SolutionIndex: 61
    SolutionNameMin: Cijk_Alik_Bljk_F8BS_BH_BiasSB_HAS_SAB_SAV_UserArgs_MT256x256x128_MI16x16x1_CMS_SN_LDSB0_AFC1_AG0_AFEM1_AFEM1_ASEM1_CLR1_CADS0_DTLA1_DTLB1_DTVA0_DTVB0_DTVMXSA0_DTVMXSB0_DTVSM0_DPLB0_EPS0_ELFLR0_EMLL0_FDSI0_GRPM1_GRVWA16_GRVWB16_GSU0_GSUAMB_GSUC0_GSUWGMRR0_GLS0_ISA950_IU1_K1_LDSTI0_LBSPPA1024_LBSPPB1024_LBSPPM0_LPA32_LPB32_LPM0_LRVW16_LWPMn1_MIAV0_MIWT8_8_MO40_MGRIPM1_NTn1_NTA0_NTB0_NTC0_NTD0_NTM0_NEPBS10_NLCA1_NLCB1_ONLL0_PGR2_PLR0_PKA1_SGROB0_SIA3_SS1_SU16_SUM0_SUS512_SPO0_SRVW0_SSO1_SVW8_SK3_SKFTR0_SKXCCM8_SGRO0_TDMI0_TIN0_TLDS1_TLDSMn1_ULSGRO0_USL1_UIOFGRO0_UPLRP0_USFGRO0_VSn1_VWA8_VWB8_WSGRA0_WSGRB0_WS64_WG32_8_1_WGM32_WGMXCC32_WGMXCCGn1
    SolutionIndex: 62
    SolutionNameMin: Cijk_Alik_Bljk_F8BS_BH_BiasSB_HAS_SAB_SAV_UserArgs_MT256x256x128_MI16x16x1_CMS_SN_LDSB0_AFC1_AG1_AFEM1_AFEM1_ASEM1_CLR1_CADS0_DTLA1_DTLB1_DTVA0_DTVB0_DTVMXSA0_DTVMXSB0_DTVSM0_DPLB0_EPS0_ELFLR0_EMLL0_FDSI0_GRPM1_GRVWA16_GRVWB16_GSU0_GSUAMB_GSUC0_GSUWGMRR0_GLS0_ISA950_IU1_K1_LDSTI1_LBSPPA1024_LBSPPB1024_LBSPPM0_LPA32_LPB32_LPM0_LRVW16_LWPMn1_MIAV0_MIWT8_8_MO40_MGRIPM1_NTn1_NTA4_NTB0_NTC0_NTD4_NTM0_NEPBS14_NLCA1_NLCB1_ONLL0_PGR2_PLR0_PKA1_SGROB1_SIA3_SS1_SU8_SUM0_SUS256_SPO0_SRVW0_SSO0_SVW8_SK3_SKFTR0_SKXCCM8_SGRO0_TDMI0_TIN0_TLDS1_TLDSMn1_ULSGRO0_USL1_UIOFGRO0_UPLRP0_USFGRO0_VSn1_VWA8_VWB8_WSGRA0_WSGRB0_WS64_WG32_8_1_WGMn24_WGMXCC1_WGMXCCGn1
    SolutionIndex: 63
    SolutionNameMin: Cijk_Alik_Bljk_F8BS_BH_BiasSB_HAS_SAB_SAV_UserArgs_MT256x256x128_MI16x16x1_CMS_SN_LDSB0_AFC1_AG0_AFEM1_AFEM1_ASEM1_CLR1_CADS0_DTLA1_DTLB1_DTVA0_DTVB0_DTVMXSA0_DTVMXSB0_DTVSM0_DPLB0_EPS0_ELFLR0_EMLL0_FDSI0_GRPM1_GRVWA16_GRVWB16_GSU0_GSUAMB_GSUC0_GSUWGMRR0_GLS0_ISA950_IU1_K1_LDSTI0_LBSPPA1024_LBSPPB1024_LBSPPM0_LPA32_LPB32_LPM0_LRVW16_LWPMn1_MIAV0_MIWT8_8_MO40_MGRIPM1_NTn1_NTA4_NTB0_NTC0_NTD4_NTM0_NEPBS10_NLCA1_NLCB1_ONLL0_PGR2_PLR0_PKA1_SGROB1_SIA3_SS1_SU8_SUM0_SUS128_SPO1_SRVW0_SSO1_SVW8_SK3_SKFTR0_SKXCCM4_SGRO0_TDMI0_TIN0_TLDS1_TLDSMn1_ULSGRO0_USL1_UIOFGRO0_UPLRP0_USFGRO0_VSn1_VWA8_VWB8_WSGRA0_WSGRB0_WS64_WG32_8_1_WGM8_WGMXCC1_WGMXCCGn1
    SolutionIndex: 64
    SolutionNameMin: Cijk_Alik_Bljk_F8BS_BH_BiasSB_HAS_SAB_SAV_UserArgs_MT256x256x128_MI32x32x1_SN_LDSB0_AFC1_AG1_AFEM1_AFEM1_ASEM1_CLR1_CADS0_DTLA1_DTLB1_DTVA0_DTVB0_DTVMXSA0_DTVMXSB0_DTVSM0_DPLB0_EPS0_ELFLR0_EMLLn1_FDSI0_GRPM1_GRVWA16_GRVWB16_GSU0_GSUAMB_GSUC0_GSUWGMRR0_GLS0_ISA950_IU1_K1_LDSTI0_LBSPPA1024_LBSPPB1024_LBSPPM0_LPA32_LPB32_LPM0_LRVWn1_LWPMn1_MIAV0_MIWT4_4_MO40_MGRIPM1_NTn1_NTA0_NTB0_NTC0_NTD0_NTM0_NEPBS12_NLCA1_NLCB1_ONLL0_PGR2_PLR1_PKA1_SGROB1_SIA3_SS1_SU0_SUM0_SUS128_SPO1_SRVW0_SSO0_SVW4_SK3_SKFTR0_SKXCCM0_SGRO0_TDMI0_TIN0_TLDS2_TLDSMn1_ULSGRO0_USL1_UIOFGRO0_UPLRP0_USFGRO0_VSn1_VWA4_VWB4_WSGRA0_WSGRB0_WS64_WG64_4_1_WGMn48_WGMXCC16_WGMXCCGn1
    SolutionIndex: 65
    SolutionNameMin: Cijk_Alik_Bljk_F8BS_BH_BiasSB_HAS_SAB_SAV_UserArgs_MT256x224x128_MI16x16x1_SN_LDSB0_AFC1_AG1_AFEM1_AFEM1_ASEM1_CLR1_CADS0_DTLA0_DTLB0_DTVA0_DTVB0_DTVMXSA0_DTVMXSB0_DTVSM0_DPLB0_EPS0_ELFLR0_EMLLn1_FDSI0_GRPM1_GRVWA16_GRVWB16_GSU0_GSUAMB_GSUC0_GSUWGMRR0_GLS0_ISA950_IU1_K1_LDSTI0_LBSPPA512_LBSPPB256_LBSPPM0_LPA32_LPB32_LPM0_LRVWn1_LWPMn1_MIAV0_MIWT4_14_MO40_MGRIPM1_NTn1_NTA0_NTB0_NTC0_NTD0_NTM0_NEPBS12_NLCA1_NLCB1_ONLL0_PGR2_PLR1_PKA1_SGROB0_SIA3_SS1_SU0_SUM0_SUS128_SPO1_SRVW0_SSO0_SVW4_SK3_SKFTR0_SKXCCM8_SGRO0_TDMI0_TIN0_TLDS1_TLDSMn1_ULSGRO1_USL1_UIOFGRO0_UPLRP0_USFGRO1_VSn1_VWA4_VWB2_WSGRA2_WSGRB2_WS64_WG64_4_1_WGMn8_WGMXCC8_WGMXCCGn1
    SolutionIndex: 66
    SolutionNameMin: Cijk_Alik_Bljk_F8BS_BH_BiasSB_HAS_SAB_SAV_UserArgs_MT256x256x128_MI32x32x1_SN_LDSB0_AFC1_AG1_AFEM1_AFEM1_ASEM1_CLR1_CADS0_DTLA1_DTLB1_DTVA0_DTVB0_DTVMXSA0_DTVMXSB0_DTVSM0_DPLB0_EPS0_ELFLR0_EMLLn1_FDSI0_GRPM1_GRVWA16_GRVWB16_GSU0_GSUAMB_GSUC0_GSUWGMRR0_GLS0_ISA950_IU1_K1_LDSTI0_LBSPPA1024_LBSPPB1024_LBSPPM0_LPA32_LPB32_LPM0_LRVWn1_LWPMn1_MIAV0_MIWT4_4_MO40_MGRIPM1_NTn1_NTA4_NTB0_NTC4_NTD4_NTM0_NEPBS14_NLCA1_NLCB1_ONLL0_PGR2_PLR1_PKA1_SGROB1_SIA3_SS1_SU8_SUM0_SUS512_SPO1_SRVW0_SSO0_SVW4_SK3_SKFTR0_SKXCCM8_SGRO0_TDMI0_TIN0_TLDS1_TLDSMn1_ULSGRO1_USL1_UIOFGRO0_UPLRP0_USFGRO0_VSn1_VWA4_VWB4_WSGRA0_WSGRB0_WS64_WG64_4_1_WGMn48_WGMXCC4_WGMXCCGn1
    SolutionIndex: 67
    SolutionNameMin: Cijk_Alik_Bljk_F8BS_BH_BiasSB_HAS_SAB_SAV_UserArgs_MT256x256x128_MI16x16x1_CMS_SN_LDSB0_AFC1_AG0_AFEM1_AFEM1_ASEM1_CLR1_CADS0_DTLA1_DTLB1_DTVA0_DTVB0_DTVMXSA0_DTVMXSB0_DTVSM0_DPLB0_EPS0_ELFLR0_EMLL0_FDSI0_GRPM1_GRVWA16_GRVWB16_GSU0_GSUAMB_GSUC0_GSUWGMRR0_GLS0_ISA950_IU1_K1_LDSTI0_LBSPPA1024_LBSPPB1024_LBSPPM0_LPA32_LPB32_LPM0_LRVW16_LWPMn1_MIAV0_MIWT8_8_MO40_MGRIPM1_NTn1_NTA0_NTB0_NTC4_NTD0_NTM0_NEPBS8_NLCA1_NLCB1_ONLL0_PGR2_PLR0_PKA1_SGROB0_SIA3_SS1_SU8_SUM0_SUS128_SPO0_SRVW0_SSO0_SVW8_SK3_SKFTR0_SKXCCM4_SGRO0_TDMI0_TIN0_TLDS1_TLDSMn1_ULSGRO0_USL1_UIOFGRO0_UPLRP0_USFGRO0_VSn1_VWA8_VWB8_WSGRA0_WSGRB0_WS64_WG32_8_1_WGMn6_WGMXCC1_WGMXCCGn1
    SolutionIndex: 68
    SolutionNameMin: Cijk_Alik_Bljk_F8BS_BH_BiasSB_HAS_SAB_SAV_UserArgs_MT128x384x128_MI16x16x1_SN_LDSB0_AFC1_AG0_AFEM1_AFEM1_ASEM1_CLR1_CADS0_DTLA1_DTLB1_DTVA0_DTVB0_DTVMXSA0_DTVMXSB0_DTVSM0_DPLB0_EPS0_ELFLR0_EMLL0_FDSI0_GRPM1_GRVWA16_GRVWB16_GSU0_GSUAMB_GSUC0_GSUWGMRR0_GLS0_ISA950_IU1_K1_LDSTI0_LBSPPA1024_LBSPPB1024_LBSPPM0_LPA32_LPB32_LPM0_LRVWn1_LWPMn1_MIAV0_MIWT4_12_MO40_MGRIPM1_NTn1_NTA4_NTB0_NTC0_NTD4_NTM0_NEPBS12_NLCA1_NLCB1_ONLL0_PGR2_PLR1_PKA1_SGROB1_SIA3_SS1_SU0_SUM0_SUS128_SPO1_SRVW0_SSO0_SVW4_SK3_SKFTR0_SKXCCM4_SGRO0_TDMI0_TIN0_TLDS1_TLDSMn1_ULSGRO1_USL1_UIOFGRO0_UPLRP0_USFGRO0_VSn1_VWA4_VWB4_WSGRA0_WSGRB0_WS64_WG32_8_1_WGM16_WGMXCC16_WGMXCCGn1
    SolutionIndex: 69
    SolutionNameMin: Cijk_Alik_Bljk_F8BS_BH_BiasSB_HAS_SAB_SAV_UserArgs_MT128x352x128_MI16x16x1_SN_LDSB0_AFC1_AG0_AFEM1_AFEM1_ASEM1_CLR0_CADS0_DTLA0_DTLB0_DTVA0_DTVB0_DTVMXSA0_DTVMXSB0_DTVSM0_DPLB0_EPS0_ELFLR0_EMLLn1_FDSI0_GRPM1_GRVWA16_GRVWB16_GSU0_GSUAMB_GSUC0_GSUWGMRR0_GLS0_ISA950_IU1_K1_LDSTI0_LBSPPA512_LBSPPB128_LBSPPM0_LPA32_LPB32_LPM0_LRVWn1_LWPMn1_MIAV0_MIWT4_11_MO40_MGRIPM1_NTn1_NTA4_NTB0_NTC0_NTD0_NTM0_NEPBS12_NLCA1_NLCB1_ONLL0_PGR2_PLR0_PKA1_SGROB0_SIA3_SS1_SU0_SUM0_SUS0_SPO1_SRVW0_SSO0_SVW4_SK3_SKFTR0_SKXCCM4_SGRO0_TDMI0_TIN1_TLDS1_TLDSMn1_ULSGRO1_USL1_UIOFGRO0_UPLRP0_USFGRO0_VSn1_VWA4_VWB1_WSGRA2_WSGRB2_WS64_WG32_8_1_WGM4_WGMXCC16_WGMXCCGn1
    SolutionIndex: 70
    SolutionNameMin: Cijk_Alik_Bljk_F8BS_BH_BiasSB_HAS_SAB_SAV_UserArgs_MT256x256x128_MI16x16x1_CMS_SN_LDSB0_AFC1_AG0_AFEM1_AFEM1_ASEM1_CLR1_CADS0_DTLA1_DTLB1_DTVA0_DTVB0_DTVMXSA0_DTVMXSB0_DTVSM0_DPLB0_EPS0_ELFLR0_EMLL0_FDSI0_GRPM1_GRVWA16_GRVWB16_GSU0_GSUAMB_GSUC0_GSUWGMRR0_GLS0_ISA950_IU1_K1_LDSTI0_LBSPPA1024_LBSPPB1024_LBSPPM0_LPA32_LPB32_LPM0_LRVW16_LWPMn1_MIAV0_MIWT8_8_MO40_MGRIPM1_NTn1_NTA0_NTB0_NTC4_NTD0_NTM0_NEPBS10_NLCA1_NLCB1_ONLL0_PGR2_PLR0_PKA1_SGROB0_SIA3_SS1_SU16_SUM0_SUS512_SPO0_SRVW0_SSO1_SVW8_SK3_SKFTR0_SKXCCM4_SGRO0_TDMI0_TIN0_TLDS1_TLDSMn1_ULSGRO0_USL1_UIOFGRO0_UPLRP0_USFGRO0_VSn1_VWA8_VWB8_WSGRA0_WSGRB0_WS64_WG32_8_1_WGMn6_WGMXCC1_WGMXCCGn1
    SolutionIndex: 71
    SolutionNameMin: Cijk_Alik_Bljk_F8BS_BH_BiasSB_HAS_SAB_SAV_UserArgs_MT128x288x128_MI16x16x1_SN_LDSB0_AFC1_AG1_AFEM1_AFEM1_ASEM1_CLR0_CADS0_DTLA0_DTLB0_DTVA0_DTVB0_DTVMXSA0_DTVMXSB0_DTVSM0_DPLB0_EPS0_ELFLR0_EMLL0_FDSI0_GRPM1_GRVWA16_GRVWB16_GSU0_GSUAMB_GSUC0_GSUWGMRR0_GLS0_ISA950_IU1_K1_LDSTI0_LBSPPA512_LBSPPB128_LBSPPM0_LPA32_LPB32_LPM0_LRVWn1_LWPMn1_MIAV0_MIWT4_9_MO40_MGRIPM1_NTn1_NTA4_NTB0_NTC0_NTD0_NTM0_NEPBS12_NLCA1_NLCB1_ONLL0_PGR2_PLR0_PKA1_SGROB0_SIA3_SS1_SU0_SUM0_SUS128_SPO0_SRVW0_SSO0_SVW4_SK3_SKFTR0_SKXCCM4_SGRO0_TDMI0_TIN0_TLDS1_TLDSMn1_ULSGRO1_USL1_UIOFGRO0_UPLRP0_USFGRO0_VSn1_VWA4_VWB1_WSGRA2_WSGRB0_WS64_WG32_8_1_WGMn8_WGMXCC2_WGMXCCGn1
    SolutionIndex: 72
    SolutionNameMin: Cijk_Alik_Bljk_F8BS_BH_BiasSB_HAS_SAB_SAV_UserArgs_MT256x256x128_MI16x16x1_CMS_SN_LDSB0_AFC1_AG1_AFEM1_AFEM1_ASEM1_CLR1_CADS0_DTLA1_DTLB1_DTVA0_DTVB0_DTVMXSA0_DTVMXSB0_DTVSM0_DPLB0_EPS0_ELFLR0_EMLL0_FDSI0_GRPM1_GRVWA16_GRVWB16_GSU0_GSUAMB_GSUC0_GSUWGMRR0_GLS0_ISA950_IU1_K1_LDSTI1_LBSPPA1024_LBSPPB1024_LBSPPM0_LPA32_LPB32_LPM0_LRVW16_LWPMn1_MIAV0_MIWT8_8_MO40_MGRIPM1_NTn1_NTA0_NTB0_NTC4_NTD0_NTM0_NEPBS10_NLCA1_NLCB1_ONLL0_PGR2_PLR0_PKA1_SGROB0_SIA3_SS1_SU8_SUM0_SUS128_SPO0_SRVW0_SSO0_SVW8_SK3_SKFTR0_SKXCCM8_SGRO0_TDMI0_TIN0_TLDS1_TLDSMn1_ULSGRO0_USL1_UIOFGRO0_UPLRP0_USFGRO0_VSn1_VWA8_VWB8_WSGRA0_WSGRB0_WS64_WG32_8_1_WGMn6_WGMXCC1_WGMXCCGn1
    SolutionIndex: 73
    SolutionNameMin: Cijk_Alik_Bljk_F8BS_BH_BiasSB_HAS_SAB_SAV_UserArgs_MT192x256x128_MI16x16x1_SN_LDSB0_AFC1_AG1_AFEM1_AFEM1_ASEM1_CLR1_CADS0_DTLA0_DTLB0_DTVA0_DTVB0_DTVMXSA0_DTVMXSB0_DTVSM0_DPLB0_EPS0_ELFLR0_EMLLn1_FDSI0_GRPM1_GRVWA16_GRVWB16_GSU0_GSUAMB_GSUC0_GSUWGMRR0_GLS0_ISA950_IU1_K1_LDSTI0_LBSPPA256_LBSPPB1024_LBSPPM0_LPA32_LPB32_LPM0_LRVWn1_LWPMn1_MIAV0_MIWT6_8_MO40_MGRIPM1_NTn1_NTA0_NTB0_NTC0_NTD0_NTM0_NEPBS10_NLCA1_NLCB1_ONLL0_PGR2_PLR1_PKA1_SGROB0_SIA3_SS0_SU8_SUM0_SUS128_SPO1_SRVW0_SSO4_SVW8_SK3_SKFTR0_SKXCCM0_SGRO0_TDMI0_TIN0_TLDS1_TLDSMn1_ULSGRO1_USL1_UIOFGRO0_UPLRP0_USFGRO0_VSn1_VWA2_VWB8_WSGRA2_WSGRB2_WS64_WG32_8_1_WGM24_WGMXCC4_WGMXCCGn1
    SolutionIndex: 74
    SolutionNameMin: Cijk_Alik_Bljk_F8BS_BH_BiasSB_HAS_SAB_SAV_UserArgs_MT160x224x128_MI16x16x1_SN_LDSB0_AFC1_AG0_AFEM1_AFEM1_ASEM1_CLR0_CADS0_DTLA0_DTLB0_DTVA0_DTVB0_DTVMXSA0_DTVMXSB0_DTVSM0_DPLB0_EPS0_ELFLR0_EMLLn1_FDSI0_GRPM1_GRVWA16_GRVWB16_GSU0_GSUAMB_GSUC0_GSUWGMRR0_GLS0_ISA950_IU1_K1_LDSTI0_LBSPPA128_LBSPPB128_LBSPPM0_LPA32_LPB32_LPM0_LRVWn1_LWPMn1_MIAV0_MIWT5_7_MO40_MGRIPM1_NTn1_NTA4_NTB0_NTC4_NTD0_NTM0_NEPBS0_NLCA1_NLCB1_ONLL0_PGR2_PLR0_PKA1_SGROB0_SIA3_SS0_SU16_SUM0_SUS256_SPO1_SRVW0_SSO1_SVW4_SK3_SKFTR0_SKXCCM8_SGRO0_TDMI0_TIN0_TLDS1_TLDSMn1_ULSGRO1_USL1_UIOFGRO0_UPLRP0_USFGRO0_VSn1_VWA1_VWB1_WSGRA0_WSGRB0_WS64_WG32_8_1_WGMn2_WGMXCC1_WGMXCCGn1
    SolutionIndex: 75
    SolutionNameMin: Cijk_Alik_Bljk_F8BS_BH_BiasSB_HAS_SAB_SAV_UserArgs_MT64x64x512_MI16x16x1_SN_LDSB0_AFC1_AG1_AFEM1_AFEM1_ASEM1_CLR1_CADS0_DTLA1_DTLB1_DTVA0_DTVB0_DTVMXSA0_DTVMXSB0_DTVSM0_DPLB0_EPS0_ELFLR0_EMLLn1_FDSI0_GRPM1_GRVWA16_GRVWB16_GSU0_GSUAMB_GSUC0_GSUWGMRR0_GLS0_ISA950_IU1_K1_LDSTI0_LBSPPA1024_LBSPPB2048_LBSPPM0_LPA32_LPB32_LPM0_LRVWn1_LWPMn1_MIAV1_MIWT2_4_MO40_MGRIPM1_NTn1_NTA4_NTB0_NTC0_NTD0_NTM0_NEPBS8_NLCA1_NLCB1_ONLL0_PGR2_PLR1_PKA1_SGROB0_SIA3_SS1_SU16_SUM0_SUS512_SPO1_SRVW0_SSO0_SVW2_SK3_SKFTR0_SKXCCM4_SGRO0_TDMI0_TIN0_TLDS1_TLDSMn1_ULSGRO1_USL1_UIOFGRO0_UPLRP0_USFGRO0_VSn1_VWA2_VWB4_WSGRA0_WSGRB0_WS64_WG32_4_2_WGMn1_WGMXCC1_WGMXCCGn1
    SolutionIndex: 76
    SolutionNameMin: Cijk_Alik_Bljk_F8BS_BH_BiasSB_HAS_SAB_SAV_UserArgs_MT160x224x128_MI16x16x1_SN_LDSB0_AFC1_AG0_AFEM1_AFEM1_ASEM1_CLR0_CADS0_DTLA1_DTLB1_DTVA0_DTVB0_DTVMXSA0_DTVMXSB0_DTVSM0_DPLB1_EPS0_ELFLR0_EMLLn1_FDSI0_GRPM1_GRVWA16_GRVWB16_GSU0_GSUAMB_GSUC0_GSUWGMRR0_GLS0_ISA950_IU1_K1_LDSTI0_LBSPPA1024_LBSPPB1024_LBSPPM0_LPA32_LPB32_LPM0_LRVWn1_LWPMn1_MIAV0_MIWT5_7_MO40_MGRIPM1_NTn1_NTA4_NTB0_NTC0_NTD4_NTM0_NEPBS0_NLCA1_NLCB1_ONLL0_PGR2_PLR0_PKA1_SGROB0_SIA3_SS1_SU0_SUM0_SUS0_SPO1_SRVW0_SSO4_SVW1_SK3_SKFTR0_SKXCCM4_SGRO0_TDMI0_TIN1_TLDS1_TLDSMn1_ULSGRO1_USL1_UIOFGRO0_UPLRP0_USFGRO0_VSn1_VWA1_VWB1_WSGRA0_WSGRB0_WS64_WG32_8_1_WGM4_WGMXCC4_WGMXCCGn1
- - - [10240, 384, 1, 8192]
    - [0, 0.0]
  - - [10240, 336, 1, 8192]
    - [1, 0.0]
  - - [10240, 272, 1, 8192]
    - [2, 0.0]
  - - [10240, 256, 1, 8192]
    - [3, 0.0]
  - - [10240, 248, 1, 8192]
    - [4, 0.0]
  - - [10240, 240, 1, 8192]
    - [5, 0.0]
  - - [10240, 216, 1, 8192]
    - [6, 0.0]
  - - [8192, 304, 1, 8192]
    - [7, 0.0]
  - - [10240, 208, 1, 8192]
    - [8, 0.0]
  - - [10240, 200, 1, 8192]
    - [9, 0.0]
  - - [10240, 184, 1, 8192]
    - [10, 0.0]
  - - [8192, 240, 1, 8192]
    - [11, 0.0]
  - - [8192, 232, 1, 8192]
    - [12, 0.0]
  - - [10240, 192, 1, 8192]
    - [13, 0.0]
  - - [8192, 248, 1, 8192]
    - [14, 0.0]
  - - [10240, 168, 1, 8192]
    - [15, 0.0]
  - - [10240, 152, 1, 8192]
    - [16, 0.0]
  - - [8192, 448, 1, 8192]
    - [17, 0.0]
  - - [8192, 400, 1, 8192]
    - [18, 0.0]
  - - [8192, 200, 1, 8192]
    - [19, 0.0]
  - - [8192, 208, 1, 8192]
    - [20, 0.0]
  - - [10240, 320, 1, 8192]
    - [21, 0.0]
  - - [57344, 320, 1, 8192]
    - [22, 0.0]
  - - [10240, 224, 1, 8192]
    - [23, 0.0]
  - - [10240, 176, 1, 8192]
    - [24, 0.0]
  - - [8192, 272, 1, 8192]
    - [25, 0.0]
  - - [10240, 160, 1, 8192]
    - [26, 0.0]
  - - [8192, 384, 1, 8192]
    - [27, 0.0]
  - - [8192, 288, 1, 8192]
    - [28, 0.0]
  - - [57344, 352, 1, 8192]
    - [29, 0.0]
  - - [8192, 320, 1, 8192]
    - [30, 0.0]
  - - [10240, 72, 1, 8192]
    - [31, 0.0]
  - - [10240, 88, 1, 8192]
    - [32, 0.0]
  - - [10240, 104, 1, 8192]
    - [33, 0.0]
  - - [10240, 144, 1, 8192]
    - [34, 0.0]
  - - [8192, 256, 1, 8192]
    - [35, 0.0]
  - - [10240, 80, 1, 8192]
    - [36, 0.0]
  - - [10240, 112, 1, 8192]
    - [37, 0.0]
  - - [10240, 120, 1, 8192]
    - [38, 0.0]
  - - [57344, 272, 1, 8192]
    - [39, 0.0]
  - - [8192, 224, 1, 8192]
    - [40, 0.0]
  - - [10240, 96, 1, 8192]
    - [41, 0.0]
  - - [10240, 64, 1, 8192]
    - [42, 0.0]
  - - [10240, 56, 1, 8192]
    - [43, 0.0]
  - - [8192, 144, 1, 8192]
    - [44, 0.0]
  - - [10240, 40, 1, 8192]
    - [45, 0.0]
  - - [57344, 304, 1, 8192]
    - [46, 0.0]
  - - [8192, 168, 1, 8192]
    - [47, 0.0]
  - - [10240, 16, 1, 8192]
    - [48, 0.0]
  - - [8192, 64, 1, 8192]
    - [49, 0.0]
  - - [8192, 104, 1, 8192]
    - [50, 0.0]
  - - [8192, 72, 1, 8192]
    - [51, 0.0]
  - - [8192, 88, 1, 8192]
    - [52, 0.0]
  - - [8192, 80, 1, 8192]
    - [53, 0.0]
  - - [8192, 56, 1, 8192]
    - [54, 0.0]
  - - [57344, 288, 1, 8192]
    - [55, 0.0]
  - - [8192, 48, 1, 8192]
    - [56, 0.0]
  - - [8192, 40, 1, 8192]
    - [57, 0.0]
  - - [8192, 32, 1, 8192]
    - [58, 0.0]
  - - [8192, 8, 1, 8192]
    - [59, 0.0]
  - - [8192, 24, 1, 8192]
    - [60, 0.0]
  - - [10240, 2048, 1, 8192]
    - [61, 0.0]
  - - [57344, 248, 1, 8192]
    - [62, 0.0]
  - - [57344, 256, 1, 8192]
    - [63, 0.0]
  - - [8192, 496, 1, 28672]
    - [64, 0.0]
  - - [8192, 400, 1, 28672]
    - [65, 0.0]
  - - [8192, 480, 1, 28672]
    - [66, 0.0]
  - - [57344, 400, 1, 8192]
    - [67, 0.0]
  - - [8192, 384, 1, 28672]
    - [68, 0.0]
  - - [8192, 304, 1, 28672]
    - [69, 0.0]
  - - [57344, 496, 1, 8192]
    - [70, 0.0]
  - - [8192, 272, 1, 28672]
    - [71, 0.0]
  - - [57344, 480, 1, 8192]
    - [72, 0.0]
  - - [10240, 480, 1, 8192]
    - [73, 0.0]
  - - [10240, 448, 1, 8192]
    - [74, 0.0]
  - - [8192, 56, 1, 28672]
    - [75, 0.0]
  - - [10240, 416, 1, 8192]
    - [76, 0.0]
- null
- null
- DeviceEfficiency
- Equality
