projects/hipblaslt/library/src/amd_detail/rocblaslt/src/Tensile/Logic/asm_full/gfx950/gfx950_id75a8/Equality/gfx950_Cijk_Alik_Bljk_BBS_BH_BiasSB_HAS_SAV_UserArgs.yaml
- {MinimumRequiredVersion: 5.0.0}
- gfx950
- gfx950
- [Device 75a8]
    SolutionIndex: 0
    SolutionNameMin: Cijk_Alik_Bljk_BBS_BH_BiasSB_HAS_SAV_UserArgs_MT256x224x64_MI16x16x1_CMS_SN_LDSB0_AFC1_AG0_AFEM1_AFEM1_ASEM1_CLR1_CADS0_DTLA1_DTLB1_DTVA0_DTVB0_DTVMXSA0_DTVMXSB0_DTVSM0_DPLB0_EPS0_ELFLR0_EMLLn1_FDSI0_GRPM1_GRVWA8_GRVWB8_GSU0_GSUAMB_GSUC0_GSUWGMRR0_GLS0_ISA950_IU1_K1_LDSTI0_LBSPPA1024_LBSPPB1024_LBSPPM0_LPA16_LPB32_LPM0_LRVW8_LWPMn1_MIAV0_MIWT8_7_MO40_MGRIPM1_NTn1_NTA4_NTB0_NTC0_NTD4_NTM0_NEPBS12_NLCA1_NLCB1_ONLL1_PGR2_PLR1_PKA1_SGROB0_SIA3_SS1_SU0_SUM0_SUS128_SPO1_SRVW0_SSO0_SVW8_SK3_SKFTR0_SKXCCM4_SGRO0_TDMI0_TIN0_TLDS1_TLDSMn1_ULSGRO0_USL1_UIOFGRO0_UPLRP0_USFGRO0_VSn1_VWA8_VWB1_WSGRA0_WSGRB0_WS64_WG32_8_1_WGMn1_WGMXCC2_WGMXCCGn1
    SolutionIndex: 1
    SolutionNameMin: Cijk_Alik_Bljk_BBS_BH_BiasSB_HAS_SAV_UserArgs_MT128x32x128_MI16x16x1_SN_LDSB0_AFC1_AG1_AFEM1_AFEM1_ASEM1_CLR1_CADS0_DTLA1_DTLB1_DTVA0_DTVB0_DTVMXSA0_DTVMXSB0_DTVSM0_DPLB1_EPS0_ELFLR0_EMLLn1_FDSI0_GRPM1_GRVWA8_GRVWB8_GSU0_GSUAMB_GSUC0_GSUWGMRR0_GLS0_ISA950_IU1_K1_LDSTI0_LBSPPA1024_LBSPPB1024_LBSPPM0_LPA16_LPB32_LPM0_LRVWn1_LWPMn1_MIAV1_MIWT4_2_MO40_MGRIPM1_NTn1_NTA4_NTB0_NTC0_NTD0_NTM0_NEPBS12_NLCA1_NLCB1_ONLL1_PGR2_PLR1_PKA1_SGROB1_SIA3_SS1_SU0_SUM0_SUS256_SPO0_SRVW0_SSO0_SVW4_SK3_SKFTR0_SKXCCM0_SGRO0_TDMI0_TIN0_TLDS1_TLDSMn1_ULSGRO0_USL1_UIOFGRO0_UPLRP0_USFGRO0_VSn1_VWA4_VWB2_WSGRA0_WSGRB0_WS64_WG32_4_2_WGMn1_WGMXCC1_WGMXCCGn1
    SolutionIndex: 2
    SolutionNameMin: Cijk_Alik_Bljk_BBS_BH_BiasSB_HAS_SAV_UserArgs_MT128x32x64_MI16x16x1_SN_LDSB0_AFC1_AG0_AFEM1_AFEM1_ASEM1_CLR0_CADS0_DTLA1_DTLB1_DTVA0_DTVB0_DTVMXSA0_DTVMXSB0_DTVSM0_DPLB1_EPS0_ELFLR0_EMLL0_FDSI0_GRPM1_GRVWA8_GRVWB2_GSU0_GSUAMB_GSUC0_GSUWGMRR0_GLS0_ISA950_IU1_K1_LDSTI0_LBSPPA1024_LBSPPB256_LBSPPM0_LPA32_LPB16_LPM0_LRVWn1_LWPMn1_MIAV1_MIWT4_2_MO40_MGRIPM1_NTn1_NTA4_NTB0_NTC0_NTD0_NTM0_NEPBS0_NLCA1_NLCB1_ONLL1_PGR2_PLR1_PKA1_SGROB1_SIA3_SS1_SU8_SUM0_SUS512_SPO0_SRVW0_SSO0_SVW4_SK3_SKFTR0_SKXCCM0_SGRO0_TDMI0_TIN0_TLDS1_TLDSMn1_ULSGRO0_USL1_UIOFGRO0_UPLRP0_USFGRO0_VSn1_VWA4_VWB2_WSGRA0_WSGRB0_WS64_WG32_4_2_WGM16_WGMXCC32_WGMXCCGn1
    SolutionIndex: 3
    SolutionNameMin: Cijk_Alik_Bljk_BBS_BH_BiasSB_HAS_SAV_UserArgs_MT128x224x64_MI16x16x1_CMS_SN_LDSB0_AFC1_AG1_AFEM1_AFEM1_ASEM1_CLR0_CADS0_DTLA1_DTLB1_DTVA0_DTVB0_DTVMXSA0_DTVMXSB0_DTVSM0_DPLB0_EPS0_ELFLR0_EMLL0_FDSI0_GRPM1_GRVWA8_GRVWB8_GSU0_GSUAMB_GSUC0_GSUWGMRR0_GLS0_ISA950_IU1_K1_LDSTI0_LBSPPA1024_LBSPPB1024_LBSPPM0_LPA32_LPB32_LPM0_LRVW8_LWPMn1_MIAV0_MIWT4_7_MO40_MGRIPM1_NTn1_NTA4_NTB0_NTC0_NTD4_NTM0_NEPBS12_NLCA1_NLCB1_ONLL1_PGR2_PLR1_PKA1_SGROB0_SIA3_SS1_SU8_SUM0_SUS128_SPO1_SRVW0_SSO1_SVW4_SK3_SKFTR0_SKXCCM0_SGRO0_TDMI0_TIN0_TLDS1_TLDSMn1_ULSGRO0_USL1_UIOFGRO0_UPLRP0_USFGRO0_VSn1_VWA4_VWB1_WSGRA0_WSGRB0_WS64_WG32_8_1_WGM32_WGMXCC8_WGMXCCGn1
    SolutionIndex: 4
    SolutionNameMin: Cijk_Alik_Bljk_BBS_BH_BiasSB_HAS_SAV_UserArgs_MT128x192x64_MI16x16x1_CMS_SN_LDSB0_AFC1_AG1_AFEM1_AFEM1_ASEM1_CLR1_CADS0_DTLA1_DTLB1_DTVA0_DTVB0_DTVMXSA0_DTVMXSB0_DTVSM0_DPLB0_EPS0_ELFLR0_EMLL0_FDSI0_GRPM1_GRVWA8_GRVWB8_GSU0_GSUAMB_GSUC0_GSUWGMRR0_GLS0_ISA950_IU1_K1_LDSTI0_LBSPPA1024_LBSPPB1024_LBSPPM0_LPA32_LPB32_LPM0_LRVW8_LWPMn1_MIAV0_MIWT4_6_MO40_MGRIPM1_NTn1_NTA4_NTB0_NTC0_NTD4_NTM0_NEPBS0_NLCA1_NLCB1_ONLL1_PGR2_PLR1_PKA1_SGROB1_SIA3_SS1_SU8_SUM0_SUS128_SPO0_SRVW0_SSO0_SVW4_SK3_SKFTR0_SKXCCM0_SGRO0_TDMI0_TIN0_TLDS1_TLDSMn1_ULSGRO0_USL1_UIOFGRO0_UPLRP0_USFGRO0_VSn1_VWA4_VWB2_WSGRA0_WSGRB0_WS64_WG32_8_1_WGMn48_WGMXCC1_WGMXCCGn1
    SolutionIndex: 5
    SolutionNameMin: Cijk_Alik_Bljk_BBS_BH_BiasSB_HAS_SAV_UserArgs_MT128x192x64_MI16x16x1_CMS_SN_LDSB0_AFC1_AG0_AFEM1_AFEM1_ASEM1_CLR1_CADS0_DTLA1_DTLB1_DTVA0_DTVB0_DTVMXSA0_DTVMXSB0_DTVSM0_DPLB0_EPS0_ELFLR0_EMLLn1_FDSI0_GRPM1_GRVWA8_GRVWB8_GSU0_GSUAMB_GSUC0_GSUWGMRR0_GLS0_ISA950_IU1_K1_LDSTI0_LBSPPA1024_LBSPPB1024_LBSPPM0_LPA32_LPB32_LPM0_LRVW8_LWPMn1_MIAV1_MIWT4_6_MO40_MGRIPM1_NTn1_NTA4_NTB0_NTC0_NTD4_NTM0_NEPBS12_NLCA1_NLCB1_ONLL1_PGR2_PLR1_PKA1_SGROB0_SIA3_SS1_SU0_SUM0_SUS128_SPO0_SRVW0_SSO0_SVW4_SK3_SKFTR0_SKXCCM8_SGRO0_TDMI0_TIN0_TLDS1_TLDSMn1_ULSGRO0_USL1_UIOFGRO0_UPLRP0_USFGRO0_VSn1_VWA4_VWB2_WSGRA0_WSGRB0_WS64_WG32_8_1_WGM48_WGMXCC4_WGMXCCGn1
    SolutionIndex: 6
    SolutionNameMin: Cijk_Alik_Bljk_BBS_BH_BiasSB_HAS_SAV_UserArgs_MT128x192x64_MI16x16x1_CMS_SN_LDSB0_AFC1_AG1_AFEM1_AFEM1_ASEM1_CLR0_CADS0_DTLA1_DTLB1_DTVA0_DTVB0_DTVMXSA0_DTVMXSB0_DTVSM0_DPLB0_EPS0_ELFLR0_EMLL0_FDSI0_GRPM1_GRVWA8_GRVWB8_GSU0_GSUAMB_GSUC0_GSUWGMRR0_GLS0_ISA950_IU1_K1_LDSTI0_LBSPPA1024_LBSPPB1024_LBSPPM0_LPA32_LPB32_LPM0_LRVW8_LWPMn1_MIAV0_MIWT4_6_MO40_MGRIPM1_NTn1_NTA4_NTB0_NTC0_NTD4_NTM0_NEPBS0_NLCA1_NLCB1_ONLL1_PGR2_PLR1_PKA1_SGROB1_SIA3_SS1_SU16_SUM0_SUS128_SPO1_SRVW0_SSO1_SVW4_SK3_SKFTR0_SKXCCM4_SGRO0_TDMI0_TIN0_TLDS1_TLDSMn1_ULSGRO0_USL1_UIOFGRO0_UPLRP0_USFGRO0_VSn1_VWA4_VWB2_WSGRA0_WSGRB0_WS64_WG32_8_1_WGMn4_WGMXCC1_WGMXCCGn1
    SolutionIndex: 7
    SolutionNameMin: Cijk_Alik_Bljk_BBS_BH_BiasSB_HAS_SAV_UserArgs_MT128x192x64_MI16x16x1_CMS_SN_LDSB0_AFC1_AG0_AFEM1_AFEM1_ASEM1_CLR1_CADS0_DTLA1_DTLB1_DTVA0_DTVB0_DTVMXSA0_DTVMXSB0_DTVSM0_DPLB0_EPS0_ELFLR0_EMLLn1_FDSI0_GRPM1_GRVWA8_GRVWB8_GSU0_GSUAMB_GSUC0_GSUWGMRR0_GLS0_ISA950_IU1_K1_LDSTI0_LBSPPA1024_LBSPPB1024_LBSPPM0_LPA32_LPB32_LPM0_LRVW8_LWPMn1_MIAV0_MIWT4_6_MO40_MGRIPM1_NTn1_NTA4_NTB0_NTC0_NTD4_NTM0_NEPBS0_NLCA1_NLCB1_ONLL1_PGR2_PLR1_PKA1_SGROB1_SIA3_SS1_SU16_SUM0_SUS128_SPO1_SRVW0_SSO4_SVW4_SK3_SKFTR0_SKXCCM8_SGRO0_TDMI0_TIN0_TLDS1_TLDSMn1_ULSGRO0_USL1_UIOFGRO0_UPLRP0_USFGRO0_VSn1_VWA4_VWB2_WSGRA0_WSGRB0_WS64_WG32_8_1_WGMn2_WGMXCC1_WGMXCCGn1
    SolutionIndex: 8
    SolutionNameMin: Cijk_Alik_Bljk_BBS_BH_BiasSB_HAS_SAV_UserArgs_MT256x192x64_MI16x16x1_CMS_SN_LDSB0_AFC1_AG0_AFEM1_AFEM1_ASEM1_CLR0_CADS0_DTLA1_DTLB1_DTVA0_DTVB0_DTVMXSA0_DTVMXSB0_DTVSM0_DPLB0_EPS0_ELFLR0_EMLLn1_FDSI0_GRPM1_GRVWA8_GRVWB8_GSU0_GSUAMB_GSUC0_GSUWGMRR0_GLS0_ISA950_IU1_K1_LDSTI0_LBSPPA1024_LBSPPB1024_LBSPPM0_LPA16_LPB32_LPM0_LRVW8_LWPMn1_MIAV0_MIWT8_6_MO40_MGRIPM1_NTn1_NTA4_NTB0_NTC0_NTD4_NTM0_NEPBS8_NLCA1_NLCB1_ONLL1_PGR2_PLR1_PKA1_SGROB1_SIA3_SS1_SU0_SUM0_SUS128_SPO0_SRVW0_SSO1_SVW8_SK3_SKFTR0_SKXCCM4_SGRO0_TDMI0_TIN0_TLDS1_TLDSMn1_ULSGRO0_USL1_UIOFGRO0_UPLRP0_USFGRO0_VSn1_VWA8_VWB2_WSGRA0_WSGRB0_WS64_WG32_8_1_WGM32_WGMXCC1_WGMXCCGn1
    SolutionIndex: 9
    SolutionNameMin: Cijk_Alik_Bljk_BBS_BH_BiasSB_HAS_SAV_UserArgs_MT128x192x64_MI16x16x1_CMS_SN_LDSB0_AFC1_AG1_AFEM1_AFEM1_ASEM1_CLR1_CADS0_DTLA1_DTLB1_DTVA0_DTVB0_DTVMXSA0_DTVMXSB0_DTVSM0_DPLB0_EPS0_ELFLR0_EMLL0_FDSI0_GRPM1_GRVWA8_GRVWB8_GSU0_GSUAMB_GSUC0_GSUWGMRR0_GLS0_ISA950_IU1_K1_LDSTI0_LBSPPA1024_LBSPPB1024_LBSPPM0_LPA32_LPB32_LPM0_LRVW8_LWPMn1_MIAV0_MIWT4_6_MO40_MGRIPM1_NTn1_NTA4_NTB0_NTC4_NTD4_NTM0_NEPBS0_NLCA1_NLCB1_ONLL1_PGR2_PLR1_PKA1_SGROB1_SIA3_SS1_SU8_SUM0_SUS128_SPO1_SRVW0_SSO1_SVW4_SK3_SKFTR0_SKXCCM0_SGRO0_TDMI0_TIN0_TLDS1_TLDSMn1_ULSGRO0_USL1_UIOFGRO0_UPLRP0_USFGRO0_VSn1_VWA4_VWB2_WSGRA0_WSGRB0_WS64_WG32_8_1_WGM0_WGMXCC4_WGMXCCGn1
    SolutionIndex: 10
    SolutionNameMin: Cijk_Alik_Bljk_BBS_BH_BiasSB_HAS_SAV_UserArgs_MT128x128x128_MI16x16x1_SN_LDSB0_AFC1_AG0_AFEM1_AFEM1_ASEM1_CLR1_CADS0_DTLA1_DTLB1_DTVA0_DTVB0_DTVMXSA0_DTVMXSB0_DTVSM0_DPLB0_EPS0_ELFLR0_EMLLn1_FDSI0_GRPM1_GRVWA8_GRVWB8_GSU0_GSUAMB_GSUC0_GSUWGMRR0_GLS0_ISA950_IU1_K1_LDSTI0_LBSPPA1024_LBSPPB1024_LBSPPM0_LPA16_LPB16_LPM0_LRVWn1_LWPMn1_MIAV0_MIWT4_4_MO40_MGRIPM1_NTn1_NTA4_NTB0_NTC0_NTD4_NTM0_NEPBS8_NLCA1_NLCB1_ONLL1_PGR2_PLR1_PKA1_SGROB1_SIA3_SS1_SU0_SUM0_SUS256_SPO1_SRVW0_SSO4_SVW4_SK3_SKFTR0_SKXCCM0_SGRO0_TDMI0_TIN0_TLDS2_TLDSMn1_ULSGRO1_USL1_UIOFGRO0_UPLRP0_USFGRO0_VSn1_VWA4_VWB4_WSGRA0_WSGRB0_WS64_WG32_8_1_WGM2_WGMXCC8_WGMXCCGn1
    SolutionIndex: 11
    SolutionNameMin: Cijk_Alik_Bljk_BBS_BH_BiasSB_HAS_SAV_UserArgs_MT128x128x128_MI16x16x1_SN_LDSB0_AFC1_AG0_AFEM1_AFEM1_ASEM1_CLR1_CADS0_DTLA1_DTLB1_DTVA0_DTVB0_DTVMXSA0_DTVMXSB0_DTVSM0_DPLB0_EPS0_ELFLR0_EMLLn1_FDSI0_GRPM1_GRVWA8_GRVWB8_GSU0_GSUAMB_GSUC0_GSUWGMRR0_GLS0_ISA950_IU1_K1_LDSTI0_LBSPPA1024_LBSPPB1024_LBSPPM0_LPA16_LPB16_LPM0_LRVWn1_LWPMn1_MIAV0_MIWT4_4_MO40_MGRIPM1_NTn1_NTA4_NTB0_NTC0_NTD4_NTM0_NEPBS10_NLCA1_NLCB1_ONLL1_PGR2_PLR1_PKA1_SGROB1_SIA3_SS1_SU0_SUM0_SUS0_SPO0_SRVW0_SSO1_SVW4_SK3_SKFTR0_SKXCCM0_SGRO0_TDMI0_TIN1_TLDS1_TLDSMn1_ULSGRO1_USL1_UIOFGRO0_UPLRP0_USFGRO0_VSn1_VWA4_VWB4_WSGRA0_WSGRB0_WS64_WG32_8_1_WGM32_WGMXCC4_WGMXCCGn1
    SolutionIndex: 12
    SolutionNameMin: Cijk_Alik_Bljk_BBS_BH_BiasSB_HAS_SAV_UserArgs_MT128x128x128_MI16x16x1_SN_LDSB0_AFC1_AG0_AFEM1_AFEM1_ASEM1_CLR1_CADS0_DTLA1_DTLB1_DTVA0_DTVB0_DTVMXSA0_DTVMXSB0_DTVSM0_DPLB0_EPS0_ELFLR0_EMLLn1_FDSI0_GRPM1_GRVWA8_GRVWB8_GSU0_GSUAMB_GSUC0_GSUWGMRR0_GLS0_ISA950_IU1_K1_LDSTI0_LBSPPA1024_LBSPPB1024_LBSPPM0_LPA16_LPB16_LPM0_LRVWn1_LWPMn1_MIAV0_MIWT4_4_MO40_MGRIPM1_NTn1_NTA4_NTB0_NTC0_NTD4_NTM0_NEPBS0_NLCA1_NLCB1_ONLL1_PGR2_PLR1_PKA1_SGROB1_SIA3_SS1_SU0_SUM0_SUS256_SPO1_SRVW0_SSO1_SVW4_SK3_SKFTR0_SKXCCM8_SGRO0_TDMI0_TIN0_TLDS1_TLDSMn1_ULSGRO1_USL1_UIOFGRO0_UPLRP0_USFGRO0_VSn1_VWA4_VWB4_WSGRA0_WSGRB0_WS64_WG32_8_1_WGM16_WGMXCC1_WGMXCCGn1
    SolutionIndex: 13
    SolutionNameMin: Cijk_Alik_Bljk_BBS_BH_BiasSB_HAS_SAV_UserArgs_MT128x128x128_MI16x16x1_SN_LDSB0_AFC1_AG1_AFEM1_AFEM1_ASEM1_CLR0_CADS0_DTLA0_DTLB0_DTVA0_DTVB0_DTVMXSA0_DTVMXSB0_DTVSM0_DPLB0_EPS0_ELFLR0_EMLLn1_FDSI0_GRPM1_GRVWA8_GRVWB8_GSU0_GSUAMB_GSUC0_GSUWGMRR0_GLS0_ISA950_IU1_K1_LDSTI0_LBSPPA512_LBSPPB2048_LBSPPM0_LPA16_LPB16_LPM0_LRVWn1_LWPMn1_MIAV1_MIWT2_8_MO40_MGRIPM1_NTn1_NTA4_NTB0_NTC0_NTD4_NTM0_NEPBS14_NLCA1_NLCB1_ONLL1_PGR2_PLR1_PKA1_SGROB0_SIA3_SS0_SU0_SUM0_SUS0_SPO0_SRVW0_SSO0_SVW8_SK3_SKFTR0_SKXCCM8_SGRO0_TDMI0_TIN1_TLDS2_TLDSMn1_ULSGRO1_USL1_UIOFGRO0_UPLRP0_USFGRO0_VSn1_VWA2_VWB8_WSGRA0_WSGRB0_WS64_WG64_4_1_WGM16_WGMXCC1_WGMXCCGn1
    SolutionIndex: 14
    SolutionNameMin: Cijk_Alik_Bljk_BBS_BH_BiasSB_HAS_SAV_UserArgs_MT128x224x64_MI16x16x1_CMS_SN_LDSB0_AFC1_AG0_AFEM1_AFEM1_ASEM1_CLR0_CADS0_DTLA1_DTLB1_DTVA0_DTVB0_DTVMXSA0_DTVMXSB0_DTVSM0_DPLB0_EPS0_ELFLR0_EMLLn1_FDSI0_GRPM1_GRVWA8_GRVWB8_GSU0_GSUAMB_GSUC0_GSUWGMRR0_GLS0_ISA950_IU1_K1_LDSTI0_LBSPPA1024_LBSPPB1024_LBSPPM0_LPA32_LPB32_LPM0_LRVW8_LWPMn1_MIAV0_MIWT4_7_MO40_MGRIPM1_NTn1_NTA4_NTB0_NTC0_NTD0_NTM0_NEPBS14_NLCA1_NLCB1_ONLL1_PGR2_PLR1_PKA1_SGROB0_SIA3_SS1_SU16_SUM0_SUS256_SPO0_SRVW0_SSO0_SVW4_SK3_SKFTR0_SKXCCM8_SGRO0_TDMI0_TIN0_TLDS1_TLDSMn1_ULSGRO0_USL1_UIOFGRO0_UPLRP0_USFGRO0_VSn1_VWA4_VWB1_WSGRA0_WSGRB0_WS64_WG32_8_1_WGM2_WGMXCC1_WGMXCCGn1
    SolutionIndex: 15
    SolutionNameMin: Cijk_Alik_Bljk_BBS_BH_BiasSB_HAS_SAV_UserArgs_MT128x224x64_MI16x16x1_CMS_SN_LDSB0_AFC1_AG1_AFEM1_AFEM1_ASEM1_CLR0_CADS0_DTLA1_DTLB1_DTVA0_DTVB0_DTVMXSA0_DTVMXSB0_DTVSM0_DPLB0_EPS0_ELFLR0_EMLLn1_FDSI0_GRPM1_GRVWA8_GRVWB8_GSU0_GSUAMB_GSUC0_GSUWGMRR0_GLS0_ISA950_IU1_K1_LDSTI0_LBSPPA1024_LBSPPB1024_LBSPPM0_LPA32_LPB32_LPM0_LRVW8_LWPMn1_MIAV0_MIWT4_7_MO40_MGRIPM1_NTn1_NTA4_NTB0_NTC0_NTD0_NTM0_NEPBS14_NLCA1_NLCB1_ONLL1_PGR2_PLR1_PKA1_SGROB0_SIA3_SS1_SU16_SUM0_SUS256_SPO0_SRVW0_SSO0_SVW4_SK3_SKFTR0_SKXCCM4_SGRO0_TDMI0_TIN0_TLDS1_TLDSMn1_ULSGRO0_USL1_UIOFGRO0_UPLRP0_USFGRO0_VSn1_VWA4_VWB1_WSGRA0_WSGRB0_WS64_WG32_8_1_WGM6_WGMXCC16_WGMXCCGn1
    SolutionIndex: 16
    SolutionNameMin: Cijk_Alik_Bljk_BBS_BH_BiasSB_HAS_SAV_UserArgs_MT128x224x64_MI16x16x1_CMS_SN_LDSB0_AFC1_AG0_AFEM1_AFEM1_ASEM1_CLR0_CADS0_DTLA1_DTLB1_DTVA0_DTVB0_DTVMXSA0_DTVMXSB0_DTVSM0_DPLB0_EPS0_ELFLR0_EMLLn1_FDSI0_GRPM1_GRVWA8_GRVWB8_GSU0_GSUAMB_GSUC0_GSUWGMRR0_GLS0_ISA950_IU1_K1_LDSTI0_LBSPPA1024_LBSPPB1024_LBSPPM0_LPA32_LPB32_LPM0_LRVW8_LWPMn1_MIAV0_MIWT4_7_MO40_MGRIPM1_NTn1_NTA4_NTB0_NTC0_NTD0_NTM0_NEPBS16_NLCA1_NLCB1_ONLL1_PGR2_PLR1_PKA1_SGROB1_SIA3_SS1_SU16_SUM0_SUS256_SPO1_SRVW0_SSO0_SVW4_SK3_SKFTR0_SKXCCM8_SGRO0_TDMI0_TIN0_TLDS1_TLDSMn1_ULSGRO0_USL1_UIOFGRO0_UPLRP0_USFGRO0_VSn1_VWA4_VWB1_WSGRA0_WSGRB0_WS64_WG32_8_1_WGM32_WGMXCC8_WGMXCCGn1
    SolutionIndex: 17
    SolutionNameMin: Cijk_Alik_Bljk_BBS_BH_BiasSB_HAS_SAV_UserArgs_MT128x224x64_MI16x16x1_CMS_SN_LDSB0_AFC1_AG1_AFEM1_AFEM1_ASEM1_CLR1_CADS0_DTLA1_DTLB1_DTVA0_DTVB0_DTVMXSA0_DTVMXSB0_DTVSM0_DPLB0_EPS0_ELFLR0_EMLL0_FDSI0_GRPM1_GRVWA8_GRVWB8_GSU0_GSUAMB_GSUC0_GSUWGMRR0_GLS0_ISA950_IU1_K1_LDSTI0_LBSPPA1024_LBSPPB1024_LBSPPM0_LPA32_LPB32_LPM0_LRVW8_LWPMn1_MIAV0_MIWT4_7_MO40_MGRIPM1_NTn1_NTA4_NTB0_NTC0_NTD0_NTM0_NEPBS14_NLCA1_NLCB1_ONLL1_PGR2_PLR1_PKA1_SGROB1_SIA3_SS1_SU8_SUM0_SUS128_SPO0_SRVW0_SSO0_SVW4_SK3_SKFTR0_SKXCCM8_SGRO0_TDMI0_TIN0_TLDS1_TLDSMn1_ULSGRO0_USL1_UIOFGRO0_UPLRP0_USFGRO0_VSn1_VWA4_VWB1_WSGRA0_WSGRB0_WS64_WG32_8_1_WGM48_WGMXCC8_WGMXCCGn1
    SolutionIndex: 18
    SolutionNameMin: Cijk_Alik_Bljk_BBS_BH_BiasSB_HAS_SAV_UserArgs_MT192x320x64_MI16x16x1_CMS_SN_LDSB0_AFC1_AG0_AFEM1_AFEM1_ASEM1_CLR0_CADS0_DTLA1_DTLB1_DTVA0_DTVB0_DTVMXSA0_DTVMXSB0_DTVSM0_DPLB0_EPS0_ELFLR0_EMLL0_FDSI0_GRPM1_GRVWA8_GRVWB8_GSU0_GSUAMB_GSUC0_GSUWGMRR0_GLS0_ISA950_IU1_K1_LDSTI0_LBSPPA1024_LBSPPB1024_LBSPPM0_LPA32_LPB32_LPM0_LRVW8_LWPMn1_MIAV0_MIWT6_10_MO40_MGRIPM1_NTn1_NTA4_NTB0_NTC0_NTD4_NTM0_NEPBS12_NLCA1_NLCB1_ONLL1_PGR2_PLR1_PKA1_SGROB1_SIA3_SS0_SU8_SUM0_SUS128_SPO0_SRVW0_SSO0_SVW8_SK3_SKFTR0_SKXCCM0_SGRO0_TDMI0_TIN0_TLDS1_TLDSMn1_ULSGRO0_USL1_UIOFGRO0_UPLRP0_USFGRO0_VSn1_VWA2_VWB2_WSGRA0_WSGRB0_WS64_WG32_8_1_WGM2_WGMXCC16_WGMXCCGn1
    SolutionIndex: 19
    SolutionNameMin: Cijk_Alik_Bljk_BBS_BH_BiasSB_HAS_SAV_UserArgs_MT128x192x64_MI16x16x1_CMS_SN_LDSB0_AFC1_AG1_AFEM1_AFEM1_ASEM1_CLR0_CADS0_DTLA1_DTLB1_DTVA0_DTVB0_DTVMXSA0_DTVMXSB0_DTVSM0_DPLB0_EPS0_ELFLR0_EMLL0_FDSI0_GRPM1_GRVWA8_GRVWB8_GSU0_GSUAMB_GSUC0_GSUWGMRR0_GLS0_ISA950_IU1_K1_LDSTI0_LBSPPA1024_LBSPPB1024_LBSPPM0_LPA32_LPB32_LPM0_LRVW8_LWPMn1_MIAV0_MIWT4_6_MO40_MGRIPM1_NTn1_NTA4_NTB0_NTC4_NTD4_NTM0_NEPBS16_NLCA1_NLCB1_ONLL1_PGR2_PLR1_PKA1_SGROB1_SIA3_SS1_SU16_SUM0_SUS128_SPO1_SRVW0_SSO0_SVW4_SK3_SKFTR0_SKXCCM4_SGRO0_TDMI0_TIN0_TLDS1_TLDSMn1_ULSGRO0_USL1_UIOFGRO0_UPLRP0_USFGRO0_VSn1_VWA4_VWB2_WSGRA0_WSGRB0_WS64_WG32_8_1_WGM16_WGMXCC1_WGMXCCGn1
    SolutionIndex: 20
    SolutionNameMin: Cijk_Alik_Bljk_BBS_BH_BiasSB_HAS_SAV_UserArgs_MT128x192x64_MI16x16x1_CMS_SN_LDSB0_AFC1_AG0_AFEM1_AFEM1_ASEM1_CLR1_CADS0_DTLA1_DTLB1_DTVA0_DTVB0_DTVMXSA0_DTVMXSB0_DTVSM0_DPLB0_EPS0_ELFLR0_EMLLn1_FDSI0_GRPM1_GRVWA8_GRVWB8_GSU0_GSUAMB_GSUC0_GSUWGMRR0_GLS0_ISA950_IU1_K1_LDSTI0_LBSPPA1024_LBSPPB1024_LBSPPM0_LPA32_LPB32_LPM0_LRVW8_LWPMn1_MIAV1_MIWT4_6_MO40_MGRIPM1_NTn1_NTA4_NTB0_NTC0_NTD0_NTM0_NEPBS12_NLCA1_NLCB1_ONLL1_PGR2_PLR1_PKA1_SGROB0_SIA3_SS1_SU0_SUM0_SUS128_SPO0_SRVW0_SSO0_SVW4_SK3_SKFTR0_SKXCCM8_SGRO0_TDMI0_TIN0_TLDS1_TLDSMn1_ULSGRO0_USL1_UIOFGRO0_UPLRP0_USFGRO0_VSn1_VWA4_VWB2_WSGRA0_WSGRB0_WS64_WG32_8_1_WGM8_WGMXCC8_WGMXCCGn1
    SolutionIndex: 21
    SolutionNameMin: Cijk_Alik_Bljk_BBS_BH_BiasSB_HAS_SAV_UserArgs_MT192x320x64_MI16x16x1_CMS_SN_LDSB0_AFC1_AG1_AFEM1_AFEM1_ASEM1_CLR1_CADS0_DTLA1_DTLB1_DTVA0_DTVB0_DTVMXSA0_DTVMXSB0_DTVSM0_DPLB0_EPS0_ELFLR0_EMLLn1_FDSI0_GRPM1_GRVWA8_GRVWB8_GSU0_GSUAMB_GSUC0_GSUWGMRR0_GLS0_ISA950_IU1_K1_LDSTI0_LBSPPA1024_LBSPPB1024_LBSPPM0_LPA32_LPB32_LPM0_LRVW8_LWPMn1_MIAV0_MIWT6_10_MO40_MGRIPM1_NTn1_NTA4_NTB0_NTC0_NTD4_NTM0_NEPBS10_NLCA1_NLCB1_ONLL1_PGR2_PLR1_PKA1_SGROB1_SIA3_SS0_SU0_SUM0_SUS128_SPO1_SRVW0_SSO1_SVW8_SK3_SKFTR0_SKXCCM0_SGRO0_TDMI0_TIN0_TLDS1_TLDSMn1_ULSGRO0_USL1_UIOFGRO0_UPLRP0_USFGRO0_VSn1_VWA2_VWB2_WSGRA0_WSGRB0_WS64_WG32_8_1_WGM2_WGMXCC1_WGMXCCGn1
    SolutionIndex: 22
    SolutionNameMin: Cijk_Alik_Bljk_BBS_BH_BiasSB_HAS_SAV_UserArgs_MT192x128x64_MI16x16x1_CMS_SN_LDSB0_AFC1_AG0_AFEM1_AFEM1_ASEM1_CLR0_CADS0_DTLA1_DTLB1_DTVA0_DTVB0_DTVMXSA0_DTVMXSB0_DTVSM0_DPLB0_EPS0_ELFLR0_EMLLn1_FDSI0_GRPM1_GRVWA8_GRVWB8_GSU0_GSUAMB_GSUC0_GSUWGMRR0_GLS0_ISA950_IU1_K1_LDSTI0_LBSPPA1024_LBSPPB1024_LBSPPM0_LPA32_LPB32_LPM0_LRVW8_LWPMn1_MIAV0_MIWT6_4_MO40_MGRIPM1_NTn1_NTA0_NTB0_NTC0_NTD0_NTM0_NEPBS8_NLCA1_NLCB1_ONLL1_PGR2_PLR1_PKA1_SGROB0_SIA3_SS0_SU8_SUM0_SUS128_SPO0_SRVW0_SSO0_SVW8_SK3_SKFTR0_SKXCCM0_SGRO0_TDMI0_TIN0_TLDS1_TLDSMn1_ULSGRO0_USL1_UIOFGRO0_UPLRP0_USFGRO0_VSn1_VWA2_VWB4_WSGRA0_WSGRB0_WS64_WG32_8_1_WGM8_WGMXCC4_WGMXCCGn1
    SolutionIndex: 23
    SolutionNameMin: Cijk_Alik_Bljk_BBS_BH_BiasSB_HAS_SAV_UserArgs_MT128x192x64_MI16x16x1_CMS_SN_LDSB0_AFC1_AG0_AFEM1_AFEM1_ASEM1_CLR1_CADS0_DTLA1_DTLB1_DTVA0_DTVB0_DTVMXSA0_DTVMXSB0_DTVSM0_DPLB0_EPS0_ELFLR0_EMLLn1_FDSI0_GRPM1_GRVWA8_GRVWB8_GSU0_GSUAMB_GSUC0_GSUWGMRR0_GLS0_ISA950_IU1_K1_LDSTI0_LBSPPA1024_LBSPPB1024_LBSPPM0_LPA32_LPB32_LPM0_LRVW8_LWPMn1_MIAV0_MIWT4_6_MO40_MGRIPM1_NTn1_NTA4_NTB0_NTC0_NTD0_NTM0_NEPBS14_NLCA1_NLCB1_ONLL1_PGR2_PLR1_PKA1_SGROB0_SIA3_SS1_SU0_SUM0_SUS128_SPO1_SRVW0_SSO0_SVW4_SK3_SKFTR0_SKXCCM8_SGRO0_TDMI0_TIN0_TLDS1_TLDSMn1_ULSGRO0_USL1_UIOFGRO0_UPLRP0_USFGRO0_VSn1_VWA4_VWB2_WSGRA0_WSGRB0_WS64_WG32_8_1_WGM16_WGMXCC1_WGMXCCGn1
    SolutionIndex: 24
    SolutionNameMin: Cijk_Alik_Bljk_BBS_BH_BiasSB_HAS_SAV_UserArgs_MT128x192x64_MI16x16x1_CMS_SN_LDSB0_AFC1_AG1_AFEM1_AFEM1_ASEM1_CLR1_CADS0_DTLA1_DTLB1_DTVA0_DTVB0_DTVMXSA0_DTVMXSB0_DTVSM0_DPLB0_EPS0_ELFLR0_EMLLn1_FDSI0_GRPM1_GRVWA8_GRVWB8_GSU0_GSUAMB_GSUC0_GSUWGMRR0_GLS0_ISA950_IU1_K1_LDSTI0_LBSPPA1024_LBSPPB1024_LBSPPM0_LPA32_LPB32_LPM0_LRVW8_LWPMn1_MIAV0_MIWT4_6_MO40_MGRIPM1_NTn1_NTA4_NTB0_NTC0_NTD0_NTM0_NEPBS12_NLCA1_NLCB1_ONLL1_PGR2_PLR1_PKA1_SGROB0_SIA3_SS1_SU8_SUM0_SUS128_SPO1_SRVW0_SSO0_SVW4_SK3_SKFTR0_SKXCCM8_SGRO0_TDMI0_TIN0_TLDS1_TLDSMn1_ULSGRO0_USL1_UIOFGRO0_UPLRP0_USFGRO0_VSn1_VWA4_VWB2_WSGRA0_WSGRB0_WS64_WG32_8_1_WGMn24_WGMXCC1_WGMXCCGn1
    SolutionIndex: 25
    SolutionNameMin: Cijk_Alik_Bljk_BBS_BH_BiasSB_HAS_SAV_UserArgs_MT128x192x64_MI16x16x1_CMS_SN_LDSB0_AFC1_AG0_AFEM1_AFEM1_ASEM1_CLR1_CADS0_DTLA1_DTLB1_DTVA0_DTVB0_DTVMXSA0_DTVMXSB0_DTVSM0_DPLB0_EPS0_ELFLR0_EMLLn1_FDSI0_GRPM1_GRVWA8_GRVWB8_GSU0_GSUAMB_GSUC0_GSUWGMRR0_GLS0_ISA950_IU1_K1_LDSTI0_LBSPPA1024_LBSPPB1024_LBSPPM0_LPA32_LPB32_LPM0_LRVW8_LWPMn1_MIAV0_MIWT4_6_MO40_MGRIPM1_NTn1_NTA4_NTB0_NTC0_NTD0_NTM0_NEPBS12_NLCA1_NLCB1_ONLL1_PGR2_PLR1_PKA1_SGROB1_SIA3_SS1_SU16_SUM0_SUS128_SPO0_SRVW0_SSO0_SVW4_SK3_SKFTR0_SKXCCM4_SGRO0_TDMI0_TIN0_TLDS1_TLDSMn1_ULSGRO0_USL1_UIOFGRO0_UPLRP0_USFGRO0_VSn1_VWA4_VWB2_WSGRA0_WSGRB0_WS64_WG32_8_1_WGM6_WGMXCC16_WGMXCCGn1
    SolutionIndex: 26
    SolutionNameMin: Cijk_Alik_Bljk_BBS_BH_BiasSB_HAS_SAV_UserArgs_MT128x128x64_MI16x16x1_SN_LDSB0_AFC1_AG0_AFEM1_AFEM1_ASEM1_CLR1_CADS0_DTLA1_DTLB1_DTVA0_DTVB0_DTVMXSA0_DTVMXSB0_DTVSM0_DPLB1_EPS0_ELFLR0_EMLLn1_FDSI0_GRPM1_GRVWA8_GRVWB8_GSU0_GSUAMB_GSUC0_GSUWGMRR0_GLS0_ISA950_IU1_K1_LDSTI0_LBSPPA1024_LBSPPB1024_LBSPPM0_LPA16_LPB32_LPM0_LRVWn1_LWPMn1_MIAV0_MIWT8_2_MO40_MGRIPM1_NTn1_NTA4_NTB0_NTC0_NTD4_NTM0_NEPBS14_NLCA1_NLCB1_ONLL1_PGR3_PLR1_PKA1_SGROB1_SIA3_SS1_SU0_SUM0_SUS0_SPO0_SRVW0_SSO0_SVW8_SK3_SKFTR0_SKXCCM4_SGRO0_TDMI0_TIN1_TLDS1_TLDSMn1_ULSGRO1_USL1_UIOFGRO0_UPLRP0_USFGRO0_VSn1_VWA8_VWB2_WSGRA0_WSGRB0_WS64_WG16_16_1_WGM6_WGMXCC1_WGMXCCGn1
    SolutionIndex: 27
    SolutionNameMin: Cijk_Alik_Bljk_BBS_BH_BiasSB_HAS_SAV_UserArgs_MT128x128x64_MI16x16x1_SN_LDSB0_AFC1_AG0_AFEM1_AFEM1_ASEM1_CLR0_CADS0_DTLA1_DTLB1_DTVA0_DTVB0_DTVMXSA0_DTVMXSB0_DTVSM0_DPLB1_EPS0_ELFLR0_EMLL0_FDSI0_GRPM1_GRVWA8_GRVWB8_GSU0_GSUAMB_GSUC0_GSUWGMRR0_GLS0_ISA950_IU1_K1_LDSTI0_LBSPPA1024_LBSPPB1024_LBSPPM0_LPA32_LPB32_LPM0_LRVWn1_LWPMn1_MIAV0_MIWT4_4_MO40_MGRIPM1_NTn1_NTA4_NTB0_NTC0_NTD4_NTM0_NEPBS10_NLCA1_NLCB1_ONLL1_PGR3_PLR1_PKA1_SGROB1_SIA3_SS1_SU0_SUM0_SUS0_SPO1_SRVW0_SSO0_SVW4_SK3_SKFTR0_SKXCCM4_SGRO0_TDMI0_TIN1_TLDS2_TLDSMn1_ULSGRO1_USL1_UIOFGRO0_UPLRP0_USFGRO0_VSn1_VWA4_VWB4_WSGRA0_WSGRB0_WS64_WG32_8_1_WGM32_WGMXCC1_WGMXCCGn1
    SolutionIndex: 28
    SolutionNameMin: Cijk_Alik_Bljk_BBS_BH_BiasSB_HAS_SAV_UserArgs_MT128x128x64_MI16x16x1_SN_LDSB0_AFC1_AG1_AFEM1_AFEM1_ASEM1_CLR0_CADS0_DTLA1_DTLB1_DTVA0_DTVB0_DTVMXSA0_DTVMXSB0_DTVSM0_DPLB1_EPS0_ELFLR0_EMLL0_FDSI0_GRPM1_GRVWA8_GRVWB8_GSU0_GSUAMB_GSUC0_GSUWGMRR0_GLS0_ISA950_IU1_K1_LDSTI0_LBSPPA1024_LBSPPB1024_LBSPPM0_LPA16_LPB32_LPM0_LRVWn1_LWPMn1_MIAV1_MIWT8_2_MO40_MGRIPM1_NTn1_NTA4_NTB0_NTC0_NTD4_NTM0_NEPBS14_NLCA1_NLCB1_ONLL1_PGR3_PLR1_PKA1_SGROB1_SIA3_SS1_SU0_SUM0_SUS0_SPO0_SRVW0_SSO0_SVW8_SK3_SKFTR0_SKXCCM4_SGRO0_TDMI0_TIN1_TLDS1_TLDSMn1_ULSGRO1_USL1_UIOFGRO0_UPLRP0_USFGRO0_VSn1_VWA8_VWB2_WSGRA0_WSGRB0_WS64_WG16_16_1_WGM8_WGMXCC1_WGMXCCGn1
    SolutionIndex: 29
    SolutionNameMin: Cijk_Alik_Bljk_BBS_BH_BiasSB_HAS_SAV_UserArgs_MT192x128x64_MI16x16x1_CMS_SN_LDSB0_AFC1_AG1_AFEM1_AFEM1_ASEM1_CLR0_CADS0_DTLA1_DTLB1_DTVA0_DTVB0_DTVMXSA0_DTVMXSB0_DTVSM0_DPLB0_EPS0_ELFLR0_EMLLn1_FDSI0_GRPM1_GRVWA8_GRVWB8_GSU0_GSUAMB_GSUC0_GSUWGMRR0_GLS0_ISA950_IU1_K1_LDSTI0_LBSPPA1024_LBSPPB1024_LBSPPM0_LPA32_LPB32_LPM0_LRVW8_LWPMn1_MIAV0_MIWT6_4_MO40_MGRIPM1_NTn1_NTA4_NTB0_NTC0_NTD4_NTM0_NEPBS0_NLCA1_NLCB1_ONLL1_PGR2_PLR1_PKA1_SGROB1_SIA3_SS1_SU0_SUM0_SUS128_SPO0_SRVW0_SSO0_SVW2_SK3_SKFTR0_SKXCCM0_SGRO0_TDMI0_TIN0_TLDS1_TLDSMn1_ULSGRO0_USL1_UIOFGRO0_UPLRP0_USFGRO0_VSn1_VWA2_VWB4_WSGRA0_WSGRB0_WS64_WG32_8_1_WGMn48_WGMXCC2_WGMXCCGn1
    SolutionIndex: 30
    SolutionNameMin: Cijk_Alik_Bljk_BBS_BH_BiasSB_HAS_SAV_UserArgs_MT128x128x64_MI16x16x1_SN_LDSB0_AFC1_AG1_AFEM1_AFEM1_ASEM1_CLR1_CADS0_DTLA1_DTLB1_DTVA0_DTVB0_DTVMXSA0_DTVMXSB0_DTVSM0_DPLB1_EPS0_ELFLR0_EMLLn1_FDSI0_GRPM1_GRVWA8_GRVWB8_GSU0_GSUAMB_GSUC0_GSUWGMRR0_GLS0_ISA950_IU1_K1_LDSTI0_LBSPPA1024_LBSPPB1024_LBSPPM0_LPA16_LPB32_LPM0_LRVWn1_LWPMn1_MIAV0_MIWT8_2_MO40_MGRIPM1_NTn1_NTA4_NTB0_NTC0_NTD4_NTM0_NEPBS12_NLCA1_NLCB1_ONLL1_PGR3_PLR1_PKA1_SGROB1_SIA3_SS1_SU0_SUM0_SUS0_SPO1_SRVW0_SSO0_SVW8_SK3_SKFTR0_SKXCCM4_SGRO0_TDMI0_TIN1_TLDS2_TLDSMn1_ULSGRO1_USL1_UIOFGRO0_UPLRP0_USFGRO0_VSn1_VWA8_VWB2_WSGRA0_WSGRB0_WS64_WG16_16_1_WGM6_WGMXCC1_WGMXCCGn1
    SolutionIndex: 31
    SolutionNameMin: Cijk_Alik_Bljk_BBS_BH_BiasSB_HAS_SAV_UserArgs_MT128x96x64_MI16x16x1_SN_LDSB0_AFC1_AG1_AFEM1_AFEM1_ASEM1_CLR0_CADS0_DTLA1_DTLB1_DTVA0_DTVB0_DTVMXSA0_DTVMXSB0_DTVSM0_DPLB1_EPS0_ELFLR0_EMLL0_FDSI0_GRPM1_GRVWA2_GRVWB2_GSU0_GSUAMB_GSUC0_GSUWGMRR0_GLS0_ISA950_IU1_K1_LDSTI0_LBSPPA256_LBSPPB256_LBSPPM0_LPA16_LPB16_LPM0_LRVWn1_LWPMn1_MIAV1_MIWT2_6_MO40_MGRIPM1_NTn1_NTA0_NTB0_NTC0_NTD4_NTM0_NEPBS16_NLCA1_NLCB1_ONLL1_PGR3_PLR1_PKA1_SGROB1_SIA3_SS1_SU0_SUM0_SUS0_SPO0_SRVW0_SSO0_SVW2_SK3_SKFTR0_SKXCCM0_SGRO0_TDMI0_TIN1_TLDS1_TLDSMn1_ULSGRO0_USL1_UIOFGRO0_UPLRP0_USFGRO0_VSn1_VWA2_VWB2_WSGRA0_WSGRB0_WS64_WG64_4_1_WGM24_WGMXCC8_WGMXCCGn1
    SolutionIndex: 32
    SolutionNameMin: Cijk_Alik_Bljk_BBS_BH_BiasSB_HAS_SAV_UserArgs_MT256x192x64_MI16x16x1_CMS_SN_LDSB0_AFC1_AG0_AFEM1_AFEM1_ASEM1_CLR0_CADS0_DTLA1_DTLB1_DTVA0_DTVB0_DTVMXSA0_DTVMXSB0_DTVSM0_DPLB0_EPS0_ELFLR0_EMLLn1_FDSI0_GRPM1_GRVWA8_GRVWB8_GSU0_GSUAMB_GSUC0_GSUWGMRR0_GLS0_ISA950_IU1_K1_LDSTI0_LBSPPA1024_LBSPPB1024_LBSPPM0_LPA16_LPB32_LPM0_LRVW8_LWPMn1_MIAV0_MIWT8_6_MO40_MGRIPM1_NTn1_NTA4_NTB0_NTC0_NTD4_NTM0_NEPBS0_NLCA1_NLCB1_ONLL1_PGR2_PLR1_PKA1_SGROB1_SIA3_SS1_SU8_SUM0_SUS256_SPO1_SRVW0_SSO1_SVW8_SK3_SKFTR0_SKXCCM0_SGRO0_TDMI0_TIN0_TLDS1_TLDSMn1_ULSGRO0_USL1_UIOFGRO0_UPLRP0_USFGRO0_VSn1_VWA8_VWB2_WSGRA0_WSGRB0_WS64_WG32_8_1_WGM6_WGMXCC4_WGMXCCGn1
    SolutionIndex: 33
    SolutionNameMin: Cijk_Alik_Bljk_BBS_BH_BiasSB_HAS_SAV_UserArgs_MT128x160x64_MI16x16x1_SN_LDSB0_AFC1_AG0_AFEM1_AFEM1_ASEM1_CLR1_CADS0_DTLA1_DTLB1_DTVA0_DTVB0_DTVMXSA0_DTVMXSB0_DTVSM0_DPLB0_EPS0_ELFLR0_EMLLn1_FDSI0_GRPM1_GRVWA8_GRVWB8_GSU0_GSUAMB_GSUC0_GSUWGMRR0_GLS0_ISA950_IU1_K1_LDSTI0_LBSPPA1024_LBSPPB1024_LBSPPM0_LPA32_LPB32_LPM0_LRVWn1_LWPMn1_MIAV0_MIWT4_5_MO40_MGRIPM1_NTn1_NTA4_NTB0_NTC0_NTD0_NTM0_NEPBS16_NLCA1_NLCB1_ONLL1_PGR4_PLR1_PKA1_SGROB0_SIA3_SS1_SU8_SUM0_SUS128_SPO1_SRVW0_SSO0_SVW4_SK3_SKFTR0_SKXCCM4_SGRO0_TDMI0_TIN0_TLDS2_TLDSMn1_ULSGRO0_USL1_UIOFGRO0_UPLRP0_USFGRO0_VSn1_VWA4_VWB1_WSGRA0_WSGRB0_WS64_WG32_8_1_WGMn2_WGMXCC8_WGMXCCGn1
    SolutionIndex: 34
    SolutionNameMin: Cijk_Alik_Bljk_BBS_BH_BiasSB_HAS_SAV_UserArgs_MT128x160x64_MI16x16x1_SN_LDSB0_AFC1_AG1_AFEM1_AFEM1_ASEM1_CLR0_CADS0_DTLA1_DTLB1_DTVA0_DTVB0_DTVMXSA0_DTVMXSB0_DTVSM0_DPLB0_EPS0_ELFLR0_EMLL0_FDSI0_GRPM1_GRVWA8_GRVWB8_GSU0_GSUAMB_GSUC0_GSUWGMRR0_GLS0_ISA950_IU1_K1_LDSTI0_LBSPPA1024_LBSPPB1024_LBSPPM0_LPA32_LPB32_LPM0_LRVWn1_LWPMn1_MIAV1_MIWT4_5_MO40_MGRIPM1_NTn1_NTA4_NTB0_NTC0_NTD0_NTM0_NEPBS12_NLCA1_NLCB1_ONLL1_PGR4_PLR1_PKA1_SGROB1_SIA3_SS1_SU0_SUM0_SUS0_SPO0_SRVW0_SSO0_SVW4_SK3_SKFTR0_SKXCCM8_SGRO0_TDMI0_TIN1_TLDS2_TLDSMn1_ULSGRO1_USL1_UIOFGRO0_UPLRP0_USFGRO0_VSn1_VWA4_VWB1_WSGRA0_WSGRB0_WS64_WG32_8_1_WGM6_WGMXCC8_WGMXCCGn1
    SolutionIndex: 35
    SolutionNameMin: Cijk_Alik_Bljk_BBS_BH_BiasSB_HAS_SAV_UserArgs_MT128x160x64_MI16x16x1_SN_LDSB0_AFC1_AG1_AFEM1_AFEM1_ASEM1_CLR0_CADS0_DTLA1_DTLB1_DTVA0_DTVB0_DTVMXSA0_DTVMXSB0_DTVSM0_DPLB1_EPS0_ELFLR0_EMLLn1_FDSI0_GRPM1_GRVWA8_GRVWB8_GSU0_GSUAMB_GSUC0_GSUWGMRR0_GLS0_ISA950_IU1_K1_LDSTI0_LBSPPA1024_LBSPPB1024_LBSPPM0_LPA32_LPB32_LPM0_LRVWn1_LWPMn1_MIAV0_MIWT4_5_MO40_MGRIPM1_NTn1_NTA4_NTB0_NTC0_NTD0_NTM0_NEPBS0_NLCA1_NLCB1_ONLL1_PGR2_PLR1_PKA1_SGROB0_SIA3_SS1_SU0_SUM0_SUS0_SPO0_SRVW0_SSO0_SVW4_SK3_SKFTR0_SKXCCM8_SGRO0_TDMI0_TIN1_TLDS1_TLDSMn1_ULSGRO1_USL1_UIOFGRO0_UPLRP0_USFGRO0_VSn1_VWA4_VWB1_WSGRA0_WSGRB0_WS64_WG32_8_1_WGM8_WGMXCC8_WGMXCCGn1
    SolutionIndex: 36
    SolutionNameMin: Cijk_Alik_Bljk_BBS_BH_BiasSB_HAS_SAV_UserArgs_MT128x112x128_MI16x16x1_SN_LDSB0_AFC1_AG1_AFEM1_AFEM1_ASEM1_CLR0_CADS0_DTLA0_DTLB0_DTVA0_DTVB0_DTVMXSA0_DTVMXSB0_DTVSM0_DPLB0_EPS0_ELFLR0_EMLLn1_FDSI0_GRPM1_GRVWA8_GRVWB8_GSU0_GSUAMB_GSUC0_GSUWGMRR0_GLS0_ISA950_IU1_K1_LDSTI0_LBSPPA512_LBSPPB256_LBSPPM0_LPA16_LPB16_LPM0_LRVWn1_LWPMn1_MIAV0_MIWT2_7_MO40_MGRIPM1_NTn1_NTA4_NTB0_NTC0_NTD4_NTM0_NEPBS0_NLCA1_NLCB1_ONLL1_PGR2_PLR1_PKA1_SGROB0_SIA3_SS1_SU0_SUM0_SUS0_SPO0_SRVW0_SSO0_SVW2_SK3_SKFTR0_SKXCCM4_SGRO0_TDMI0_TIN1_TLDS2_TLDSMn1_ULSGRO1_USL1_UIOFGRO0_UPLRP0_USFGRO0_VSn1_VWA2_VWB1_WSGRA0_WSGRB2_WS64_WG64_4_1_WGM0_WGMXCC1_WGMXCCGn1
    SolutionIndex: 37
    SolutionNameMin: Cijk_Alik_Bljk_BBS_BH_BiasSB_HAS_SAV_UserArgs_MT64x128x128_MI16x16x1_SN_LDSB0_AFC1_AG1_AFEM1_AFEM1_ASEM1_CLR1_CADS0_DTLA1_DTLB1_DTVA0_DTVB0_DTVMXSA0_DTVMXSB0_DTVSM0_DPLB1_EPS0_ELFLR0_EMLLn1_FDSI0_GRPM1_GRVWA8_GRVWB8_GSU0_GSUAMB_GSUC0_GSUWGMRR0_GLS0_ISA950_IU1_K1_LDSTI0_LBSPPA1024_LBSPPB1024_LBSPPM0_LPA32_LPB16_LPM0_LRVWn1_LWPMn1_MIAV1_MIWT2_4_MO40_MGRIPM1_NTn1_NTA4_NTB0_NTC0_NTD4_NTM0_NEPBS8_NLCA1_NLCB1_ONLL1_PGR2_PLR1_PKA1_SGROB1_SIA3_SS0_SU0_SUM0_SUS0_SPO0_SRVW0_SSO0_SVW8_SK3_SKFTR0_SKXCCM0_SGRO0_TDMI0_TIN1_TLDS2_TLDSMn1_ULSGRO0_USL1_UIOFGRO0_UPLRP0_USFGRO0_VSn1_VWA2_VWB4_WSGRA0_WSGRB0_WS64_WG32_8_1_WGM6_WGMXCC8_WGMXCCGn1
    SolutionIndex: 38
    SolutionNameMin: Cijk_Alik_Bljk_BBS_BH_BiasSB_HAS_SAV_UserArgs_MT256x192x64_MI16x16x1_CMS_SN_LDSB0_AFC1_AG0_AFEM1_AFEM1_ASEM1_CLR0_CADS0_DTLA1_DTLB1_DTVA0_DTVB0_DTVMXSA0_DTVMXSB0_DTVSM0_DPLB0_EPS0_ELFLR0_EMLLn1_FDSI0_GRPM1_GRVWA8_GRVWB8_GSU0_GSUAMB_GSUC0_GSUWGMRR0_GLS0_ISA950_IU1_K1_LDSTI0_LBSPPA1024_LBSPPB1024_LBSPPM0_LPA16_LPB32_LPM0_LRVW8_LWPMn1_MIAV0_MIWT8_6_MO40_MGRIPM1_NTn1_NTA4_NTB0_NTC0_NTD4_NTM0_NEPBS16_NLCA1_NLCB1_ONLL1_PGR2_PLR1_PKA1_SGROB1_SIA3_SS1_SU0_SUM0_SUS128_SPO1_SRVW0_SSO0_SVW8_SK3_SKFTR0_SKXCCM0_SGRO0_TDMI0_TIN0_TLDS1_TLDSMn1_ULSGRO0_USL1_UIOFGRO0_UPLRP0_USFGRO0_VSn1_VWA8_VWB2_WSGRA0_WSGRB0_WS64_WG32_8_1_WGMn8_WGMXCC1_WGMXCCGn1
    SolutionIndex: 39
    SolutionNameMin: Cijk_Alik_Bljk_BBS_BH_BiasSB_HAS_SAV_UserArgs_MT128x96x64_MI16x16x1_SN_LDSB0_AFC1_AG0_AFEM1_AFEM1_ASEM1_CLR0_CADS0_DTLA1_DTLB1_DTVA0_DTVB0_DTVMXSA0_DTVMXSB0_DTVSM0_DPLB1_EPS0_ELFLR0_EMLL0_FDSI0_GRPM1_GRVWA8_GRVWB8_GSU0_GSUAMB_GSUC0_GSUWGMRR0_GLS0_ISA950_IU1_K1_LDSTI0_LBSPPA1024_LBSPPB1024_LBSPPM0_LPA32_LPB32_LPM0_LRVWn1_LWPMn1_MIAV0_MIWT4_3_MO40_MGRIPM1_NTn1_NTA4_NTB0_NTC0_NTD0_NTM0_NEPBS0_NLCA1_NLCB1_ONLL1_PGR3_PLR1_PKA1_SGROB1_SIA3_SS1_SU0_SUM0_SUS0_SPO1_SRVW0_SSO0_SVW4_SK3_SKFTR0_SKXCCM8_SGRO0_TDMI0_TIN1_TLDS1_TLDSMn1_ULSGRO0_USL1_UIOFGRO0_UPLRP0_USFGRO0_VSn1_VWA4_VWB1_WSGRA0_WSGRB0_WS64_WG32_8_1_WGM2_WGMXCC1_WGMXCCGn1
    SolutionIndex: 40
    SolutionNameMin: Cijk_Alik_Bljk_BBS_BH_BiasSB_HAS_SAV_UserArgs_MT64x128x128_MI16x16x1_SN_LDSB0_AFC1_AG0_AFEM1_AFEM1_ASEM1_CLR1_CADS0_DTLA1_DTLB1_DTVA0_DTVB0_DTVMXSA0_DTVMXSB0_DTVSM0_DPLB1_EPS0_ELFLR0_EMLLn1_FDSI0_GRPM1_GRVWA8_GRVWB8_GSU0_GSUAMB_GSUC0_GSUWGMRR0_GLS0_ISA950_IU1_K1_LDSTI0_LBSPPA1024_LBSPPB1024_LBSPPM0_LPA32_LPB16_LPM0_LRVWn1_LWPMn1_MIAV0_MIWT2_4_MO40_MGRIPM1_NTn1_NTA4_NTB0_NTC0_NTD0_NTM0_NEPBS10_NLCA1_NLCB1_ONLL1_PGR2_PLR1_PKA1_SGROB1_SIA3_SS0_SU0_SUM0_SUS0_SPO1_SRVW0_SSO0_SVW8_SK3_SKFTR0_SKXCCM4_SGRO0_TDMI0_TIN1_TLDS1_TLDSMn1_ULSGRO0_USL1_UIOFGRO0_UPLRP0_USFGRO0_VSn1_VWA2_VWB4_WSGRA0_WSGRB0_WS64_WG32_8_1_WGM0_WGMXCC8_WGMXCCGn1
    SolutionIndex: 41
    SolutionNameMin: Cijk_Alik_Bljk_BBS_BH_BiasSB_HAS_SAV_UserArgs_MT128x96x64_MI16x16x1_SN_LDSB0_AFC1_AG0_AFEM1_AFEM1_ASEM1_CLR1_CADS0_DTLA1_DTLB1_DTVA0_DTVB0_DTVMXSA0_DTVMXSB0_DTVSM0_DPLB1_EPS0_ELFLR0_EMLL0_FDSI0_GRPM1_GRVWA8_GRVWB8_GSU0_GSUAMB_GSUC0_GSUWGMRR0_GLS0_ISA950_IU1_K1_LDSTI0_LBSPPA1024_LBSPPB1024_LBSPPM0_LPA32_LPB32_LPM0_LRVWn1_LWPMn1_MIAV1_MIWT4_3_MO40_MGRIPM1_NTn1_NTA4_NTB0_NTC0_NTD0_NTM0_NEPBS12_NLCA1_NLCB1_ONLL1_PGR3_PLR1_PKA1_SGROB1_SIA3_SS1_SU0_SUM0_SUS0_SPO0_SRVW0_SSO0_SVW4_SK3_SKFTR0_SKXCCM8_SGRO0_TDMI0_TIN1_TLDS1_TLDSMn1_ULSGRO0_USL1_UIOFGRO0_UPLRP0_USFGRO0_VSn1_VWA4_VWB1_WSGRA0_WSGRB0_WS64_WG32_8_1_WGM8_WGMXCC1_WGMXCCGn1
    SolutionIndex: 42
    SolutionNameMin: Cijk_Alik_Bljk_BBS_BH_BiasSB_HAS_SAV_UserArgs_MT64x128x128_MI16x16x1_SN_LDSB0_AFC1_AG0_AFEM1_AFEM1_ASEM1_CLR1_CADS0_DTLA1_DTLB1_DTVA0_DTVB0_DTVMXSA0_DTVMXSB0_DTVSM0_DPLB0_EPS0_ELFLR0_EMLLn1_FDSI0_GRPM1_GRVWA8_GRVWB8_GSU0_GSUAMB_GSUC0_GSUWGMRR0_GLS0_ISA950_IU1_K1_LDSTI0_LBSPPA1024_LBSPPB1024_LBSPPM0_LPA32_LPB16_LPM0_LRVWn1_LWPMn1_MIAV0_MIWT2_4_MO40_MGRIPM1_NTn1_NTA4_NTB0_NTC0_NTD4_NTM0_NEPBS8_NLCA1_NLCB1_ONLL1_PGR3_PLR1_PKA1_SGROB1_SIA3_SS0_SU0_SUM0_SUS0_SPO0_SRVW0_SSO0_SVW8_SK3_SKFTR0_SKXCCM0_SGRO0_TDMI0_TIN1_TLDS2_TLDSMn1_ULSGRO1_USL1_UIOFGRO0_UPLRP0_USFGRO0_VSn1_VWA2_VWB4_WSGRA0_WSGRB0_WS64_WG32_8_1_WGM4_WGMXCC8_WGMXCCGn1
    SolutionIndex: 43
    SolutionNameMin: Cijk_Alik_Bljk_BBS_BH_BiasSB_HAS_SAV_UserArgs_MT64x128x128_MI16x16x1_SN_LDSB0_AFC1_AG0_AFEM1_AFEM1_ASEM1_CLR0_CADS0_DTLA1_DTLB1_DTVA0_DTVB0_DTVMXSA0_DTVMXSB0_DTVSM0_DPLB1_EPS0_ELFLR0_EMLLn1_FDSI0_GRPM1_GRVWA8_GRVWB8_GSU0_GSUAMB_GSUC0_GSUWGMRR0_GLS0_ISA950_IU1_K1_LDSTI0_LBSPPA1024_LBSPPB1024_LBSPPM0_LPA32_LPB16_LPM0_LRVWn1_LWPMn1_MIAV0_MIWT2_4_MO40_MGRIPM1_NTn1_NTA4_NTB0_NTC0_NTD4_NTM0_NEPBS4_NLCA1_NLCB1_ONLL1_PGR2_PLR1_PKA1_SGROB1_SIA3_SS0_SU0_SUM0_SUS0_SPO0_SRVW0_SSO0_SVW8_SK3_SKFTR0_SKXCCM0_SGRO0_TDMI0_TIN1_TLDS2_TLDSMn1_ULSGRO0_USL1_UIOFGRO0_UPLRP0_USFGRO0_VSn1_VWA2_VWB4_WSGRA0_WSGRB0_WS64_WG32_8_1_WGM48_WGMXCC8_WGMXCCGn1
    SolutionIndex: 44
    SolutionNameMin: Cijk_Alik_Bljk_BBS_BH_BiasSB_HAS_SAV_UserArgs_MT32x32x128_MI16x16x1_SN_LDSB0_AFC1_AG0_AFEM1_AFEM1_ASEM1_CLR1_CADS0_DTLA1_DTLB1_DTVA0_DTVB0_DTVMXSA0_DTVMXSB0_DTVSM0_DPLB1_EPS0_ELFLR0_EMLLn1_FDSI0_GRPM1_GRVWA2_GRVWB8_GSU0_GSUAMB_GSUC0_GSUWGMRR0_GLS0_ISA950_IU1_K1_LDSTI0_LBSPPA256_LBSPPB1024_LBSPPM0_LPA16_LPB32_LPM0_LRVWn1_LWPMn1_MIAV0_MIWT1_1_MO40_MGRIPM1_NTn1_NTA4_NTB0_NTC0_NTD0_NTM0_NEPBS10_NLCA1_NLCB1_ONLL1_PGR3_PLR1_PKA1_SGROB0_SIA3_SS0_SU0_SUM0_SUS0_SPO0_SRVW0_SSO0_SVW4_SK3_SKFTR0_SKXCCM4_SGRO0_TDMI0_TIN1_TLDS1_TLDSMn1_ULSGRO0_USL1_UIOFGRO0_UPLRP0_USFGRO0_VSn1_VWA1_VWB1_WSGRA0_WSGRB0_WS64_WG32_8_1_WGMn6_WGMXCC1_WGMXCCGn1
    SolutionIndex: 45
    SolutionNameMin: Cijk_Alik_Bljk_BBS_BH_BiasSB_HAS_SAV_UserArgs_MT128x96x128_MI16x16x1_SN_LDSB0_AFC1_AG1_AFEM1_AFEM1_ASEM1_CLR1_CADS0_DTLA0_DTLB0_DTVA0_DTVB0_DTVMXSA0_DTVMXSB0_DTVSM0_DPLB0_EPS0_ELFLR0_EMLLn1_FDSI0_GRPM1_GRVWA8_GRVWB8_GSU0_GSUAMB_GSUC0_GSUWGMRR0_GLS0_ISA950_IU1_K1_LDSTI0_LBSPPA1024_LBSPPB256_LBSPPM0_LPA16_LPB16_LPM0_LRVWn1_LWPMn1_MIAV0_MIWT4_3_MO40_MGRIPM1_NTn1_NTA4_NTB0_NTC0_NTD4_NTM0_NEPBS12_NLCA1_NLCB1_ONLL1_PGR2_PLR1_PKA1_SGROB0_SIA3_SS1_SU0_SUM0_SUS0_SPO0_SRVW0_SSO0_SVW4_SK3_SKFTR0_SKXCCM4_SGRO0_TDMI0_TIN1_TLDS2_TLDSMn1_ULSGRO1_USL1_UIOFGRO0_UPLRP0_USFGRO0_VSn1_VWA4_VWB1_WSGRA2_WSGRB2_WS64_WG32_8_1_WGM4_WGMXCC1_WGMXCCGn1
    SolutionIndex: 46
    SolutionNameMin: Cijk_Alik_Bljk_BBS_BH_BiasSB_HAS_SAV_UserArgs_MT128x96x128_MI16x16x1_SN_LDSB0_AFC1_AG0_AFEM1_AFEM1_ASEM1_CLR1_CADS0_DTLA0_DTLB0_DTVA0_DTVB0_DTVMXSA0_DTVMXSB0_DTVSM0_DPLB0_EPS0_ELFLR0_EMLLn1_FDSI0_GRPM1_GRVWA8_GRVWB8_GSU0_GSUAMB_GSUC0_GSUWGMRR0_GLS0_ISA950_IU1_K1_LDSTI0_LBSPPA1024_LBSPPB256_LBSPPM0_LPA16_LPB16_LPM0_LRVWn1_LWPMn1_MIAV0_MIWT4_3_MO40_MGRIPM1_NTn1_NTA4_NTB0_NTC0_NTD4_NTM0_NEPBS14_NLCA1_NLCB1_ONLL1_PGR2_PLR1_PKA1_SGROB0_SIA3_SS1_SU0_SUM0_SUS0_SPO1_SRVW0_SSO0_SVW4_SK3_SKFTR0_SKXCCM4_SGRO0_TDMI0_TIN1_TLDS2_TLDSMn1_ULSGRO1_USL1_UIOFGRO0_UPLRP0_USFGRO0_VSn1_VWA4_VWB1_WSGRA0_WSGRB0_WS64_WG32_8_1_WGM32_WGMXCC1_WGMXCCGn1
    SolutionIndex: 47
    SolutionNameMin: Cijk_Alik_Bljk_BBS_BH_BiasSB_HAS_SAV_UserArgs_MT64x16x128_MI16x16x1_SN_LDSB0_AFC1_AG0_AFEM1_AFEM1_ASEM1_CLR0_CADS0_DTLA1_DTLB1_DTVA0_DTVB0_DTVMXSA0_DTVMXSB0_DTVSM0_DPLB1_EPS0_ELFLR0_EMLLn1_FDSI0_GRPM1_GRVWA8_GRVWB8_GSU0_GSUAMB_GSUC0_GSUWGMRR0_GLS0_ISA950_IU1_K1_LDSTI0_LBSPPA1024_LBSPPB1024_LBSPPM0_LPA32_LPB32_LPM0_LRVWn1_LWPMn1_MIAV1_MIWT1_1_MO40_MGRIPM1_NTn1_NTA4_NTB0_NTC0_NTD4_NTM0_NEPBS10_NLCA1_NLCB1_ONLL1_PGR4_PLR1_PKA1_SGROB0_SIA3_SS0_SU0_SUM0_SUS0_SPO1_SRVW0_SSO0_SVW4_SK3_SKFTR0_SKXCCM4_SGRO0_TDMI0_TIN1_TLDS2_TLDSMn1_ULSGRO1_USL1_UIOFGRO0_UPLRP0_USFGRO0_VSn1_VWA1_VWB1_WSGRA0_WSGRB0_WS64_WG64_4_1_WGM32_WGMXCC1_WGMXCCGn1
    SolutionIndex: 48
    SolutionNameMin: Cijk_Alik_Bljk_BBS_BH_BiasSB_HAS_SAV_UserArgs_MT128x64x128_MI16x16x1_SN_LDSB0_AFC1_AG1_AFEM1_AFEM1_ASEM1_CLR1_CADS0_DTLA1_DTLB1_DTVA0_DTVB0_DTVMXSA0_DTVMXSB0_DTVSM0_DPLB1_EPS0_ELFLR0_EMLLn1_FDSI0_GRPM1_GRVWA8_GRVWB8_GSU0_GSUAMB_GSUC0_GSUWGMRR0_GLS0_ISA950_IU1_K1_LDSTI0_LBSPPA1024_LBSPPB1024_LBSPPM0_LPA32_LPB16_LPM0_LRVWn1_LWPMn1_MIAV0_MIWT2_4_MO40_MGRIPM1_NTn1_NTA0_NTB0_NTC0_NTD4_NTM0_NEPBS16_NLCA1_NLCB1_ONLL1_PGR2_PLR1_PKA1_SGROB0_SIA3_SS0_SU0_SUM0_SUS0_SPO1_SRVW0_SSO0_SVW8_SK3_SKFTR0_SKXCCM4_SGRO0_TDMI0_TIN1_TLDS1_TLDSMn1_ULSGRO0_USL1_UIOFGRO0_UPLRP0_USFGRO0_VSn1_VWA2_VWB4_WSGRA0_WSGRB0_WS64_WG64_4_1_WGM48_WGMXCC2_WGMXCCGn1
    SolutionIndex: 49
    SolutionNameMin: Cijk_Alik_Bljk_BBS_BH_BiasSB_HAS_SAV_UserArgs_MT96x96x128_MI16x16x1_SN_LDSB0_AFC1_AG1_AFEM1_AFEM1_ASEM1_CLR1_CADS0_DTLA0_DTLB0_DTVA0_DTVB0_DTVMXSA0_DTVMXSB0_DTVSM0_DPLB0_EPS0_ELFLR0_EMLLn1_FDSI0_GRPM1_GRVWA8_GRVWB8_GSU0_GSUAMB_GSUC0_GSUWGMRR0_GLS0_ISA950_IU1_K1_LDSTI0_LBSPPA256_LBSPPB256_LBSPPM0_LPA16_LPB16_LPM0_LRVWn1_LWPMn1_MIAV0_MIWT3_3_MO40_MGRIPM1_NTn1_NTA4_NTB0_NTC0_NTD0_NTM0_NEPBS14_NLCA1_NLCB1_ONLL1_PGR2_PLR1_PKA1_SGROB0_SIA3_SS0_SU0_SUM0_SUS0_SPO0_SRVW0_SSO0_SVW4_SK3_SKFTR0_SKXCCM4_SGRO0_TDMI0_TIN1_TLDS1_TLDSMn1_ULSGRO1_USL1_UIOFGRO0_UPLRP0_USFGRO0_VSn1_VWA1_VWB1_WSGRA0_WSGRB2_WS64_WG32_8_1_WGM8_WGMXCC1_WGMXCCGn1
    SolutionIndex: 50
    SolutionNameMin: Cijk_Alik_Bljk_BBS_BH_BiasSB_HAS_SAV_UserArgs_MT64x32x256_MI16x16x1_SN_LDSB0_AFC1_AG1_AFEM1_AFEM1_ASEM1_CLR1_CADS0_DTLA1_DTLB1_DTVA0_DTVB0_DTVMXSA0_DTVMXSB0_DTVSM0_DPLB1_EPS0_ELFLR0_EMLLn1_FDSI0_GRPM1_GRVWA8_GRVWB8_GSU0_GSUAMB_GSUC0_GSUWGMRR0_GLS0_ISA950_IU1_K1_LDSTI0_LBSPPA1024_LBSPPB1024_LBSPPM0_LPA16_LPB32_LPM0_LRVWn1_LWPMn1_MIAV0_MIWT2_1_MO40_MGRIPM1_NTn1_NTA4_NTB0_NTC0_NTD4_NTM0_NEPBS12_NLCA1_NLCB1_ONLL1_PGR2_PLR1_PKA1_SGROB0_SIA3_SS0_SU0_SUM0_SUS0_SPO0_SRVW0_SSO0_SVW8_SK3_SKFTR0_SKXCCM8_SGRO0_TDMI0_TIN1_TLDS2_TLDSMn1_ULSGRO0_USL1_UIOFGRO0_UPLRP0_USFGRO0_VSn1_VWA2_VWB1_WSGRA0_WSGRB0_WS64_WG32_8_1_WGM24_WGMXCC1_WGMXCCGn1
    SolutionIndex: 51
    SolutionNameMin: Cijk_Alik_Bljk_BBS_BH_BiasSB_HAS_SAV_UserArgs_MT64x32x256_MI16x16x1_SN_LDSB0_AFC1_AG0_AFEM1_AFEM1_ASEM1_CLR1_CADS0_DTLA1_DTLB1_DTVA0_DTVB0_DTVMXSA0_DTVMXSB0_DTVSM0_DPLB0_EPS0_ELFLR0_EMLLn1_FDSI0_GRPM1_GRVWA8_GRVWB8_GSU0_GSUAMB_GSUC0_GSUWGMRR0_GLS0_ISA950_IU1_K1_LDSTI0_LBSPPA1024_LBSPPB1024_LBSPPM0_LPA32_LPB16_LPM0_LRVWn1_LWPMn1_MIAV0_MIWT1_2_MO40_MGRIPM1_NTn1_NTA4_NTB0_NTC0_NTD0_NTM0_NEPBS0_NLCA1_NLCB1_ONLL1_PGR3_PLR1_PKA1_SGROB1_SIA3_SS0_SU0_SUM0_SUS0_SPO1_SRVW0_SSO0_SVW4_SK3_SKFTR0_SKXCCM4_SGRO0_TDMI0_TIN1_TLDS1_TLDSMn1_ULSGRO0_USL1_UIOFGRO0_UPLRP0_USFGRO0_VSn1_VWA1_VWB2_WSGRA0_WSGRB0_WS64_WG64_4_1_WGMn16_WGMXCC32_WGMXCCGn1
    SolutionIndex: 52
    SolutionNameMin: Cijk_Alik_Bljk_BBS_BH_BiasSB_HAS_SAV_UserArgs_MT256x224x64_MI16x16x1_CMS_SN_LDSB0_AFC1_AG1_AFEM1_AFEM1_ASEM1_CLR1_CADS0_DTLA1_DTLB1_DTVA0_DTVB0_DTVMXSA0_DTVMXSB0_DTVSM0_DPLB0_EPS0_ELFLR0_EMLL0_FDSI0_GRPM1_GRVWA8_GRVWB8_GSU0_GSUAMB_GSUC0_GSUWGMRR0_GLS0_ISA950_IU1_K1_LDSTI1_LBSPPA1024_LBSPPB1024_LBSPPM0_LPA16_LPB32_LPM0_LRVW8_LWPMn1_MIAV0_MIWT8_7_MO40_MGRIPM1_NTn1_NTA4_NTB0_NTC0_NTD4_NTM0_NEPBS12_NLCA1_NLCB1_ONLL1_PGR2_PLR1_PKA1_SGROB1_SIA3_SS1_SU16_SUM0_SUS128_SPO0_SRVW0_SSO0_SVW8_SK3_SKFTR0_SKXCCM4_SGRO0_TDMI0_TIN0_TLDS1_TLDSMn1_ULSGRO0_USL1_UIOFGRO0_UPLRP0_USFGRO0_VSn1_VWA8_VWB1_WSGRA0_WSGRB0_WS64_WG32_8_1_WGM48_WGMXCC2_WGMXCCGn1
    SolutionIndex: 53
    SolutionNameMin: Cijk_Alik_Bljk_BBS_BH_BiasSB_HAS_SAV_UserArgs_MT96x128x128_MI16x16x1_SN_LDSB0_AFC1_AG0_AFEM1_AFEM1_ASEM1_CLR1_CADS0_DTLA0_DTLB0_DTVA0_DTVB0_DTVMXSA0_DTVMXSB0_DTVSM0_DPLB0_EPS0_ELFLR0_EMLLn1_FDSI0_GRPM1_GRVWA8_GRVWB8_GSU0_GSUAMB_GSUC0_GSUWGMRR0_GLS0_ISA950_IU1_K1_LDSTI0_LBSPPA512_LBSPPB512_LBSPPM0_LPA16_LPB16_LPM0_LRVWn1_LWPMn1_MIAV0_MIWT6_2_MO40_MGRIPM1_NTn1_NTA4_NTB0_NTC0_NTD4_NTM0_NEPBS0_NLCA1_NLCB1_ONLL1_PGR2_PLR1_PKA1_SGROB0_SIA3_SS0_SU0_SUM0_SUS0_SPO0_SRVW0_SSO0_SVW8_SK3_SKFTR0_SKXCCM4_SGRO0_TDMI0_TIN1_TLDS1_TLDSMn1_ULSGRO1_USL1_UIOFGRO0_UPLRP0_USFGRO0_VSn1_VWA2_VWB2_WSGRA0_WSGRB2_WS64_WG16_16_1_WGM4_WGMXCC1_WGMXCCGn1
    SolutionIndex: 54
    SolutionNameMin: Cijk_Alik_Bljk_BBS_BH_BiasSB_HAS_SAV_UserArgs_MT128x80x128_MI16x16x1_SN_LDSB0_AFC1_AG0_AFEM1_AFEM1_ASEM1_CLR1_CADS0_DTLA0_DTLB0_DTVA0_DTVB0_DTVMXSA0_DTVMXSB0_DTVSM0_DPLB0_EPS0_ELFLR0_EMLLn1_FDSI0_GRPM1_GRVWA8_GRVWB8_GSU0_GSUAMB_GSUC0_GSUWGMRR0_GLS0_ISA950_IU1_K1_LDSTI0_LBSPPA512_LBSPPB256_LBSPPM0_LPA16_LPB16_LPM0_LRVWn1_LWPMn1_MIAV0_MIWT2_5_MO40_MGRIPM1_NTn1_NTA4_NTB0_NTC0_NTD4_NTM0_NEPBS12_NLCA1_NLCB1_ONLL1_PGR2_PLR1_PKA1_SGROB0_SIA3_SS0_SU0_SUM0_SUS0_SPO0_SRVW0_SSO0_SVW8_SK3_SKFTR0_SKXCCM0_SGRO0_TDMI0_TIN1_TLDS1_TLDSMn1_ULSGRO1_USL1_UIOFGRO0_UPLRP0_USFGRO0_VSn1_VWA2_VWB1_WSGRA0_WSGRB0_WS64_WG64_4_1_WGMn6_WGMXCC2_WGMXCCGn1
    SolutionIndex: 55
    SolutionNameMin: Cijk_Alik_Bljk_BBS_BH_BiasSB_HAS_SAV_UserArgs_MT128x80x128_MI16x16x1_SN_LDSB0_AFC1_AG0_AFEM1_AFEM1_ASEM1_CLR0_CADS0_DTLA0_DTLB0_DTVA0_DTVB0_DTVMXSA0_DTVMXSB0_DTVSM0_DPLB0_EPS0_ELFLR0_EMLLn1_FDSI0_GRPM1_GRVWA8_GRVWB8_GSU0_GSUAMB_GSUC0_GSUWGMRR0_GLS0_ISA950_IU1_K1_LDSTI0_LBSPPA512_LBSPPB256_LBSPPM0_LPA16_LPB16_LPM0_LRVWn1_LWPMn1_MIAV0_MIWT2_5_MO40_MGRIPM1_NTn1_NTA4_NTB0_NTC0_NTD4_NTM0_NEPBS10_NLCA1_NLCB1_ONLL1_PGR2_PLR1_PKA1_SGROB0_SIA3_SS0_SU0_SUM0_SUS256_SPO1_SRVW0_SSO1_SVW8_SK3_SKFTR0_SKXCCM4_SGRO0_TDMI0_TIN0_TLDS2_TLDSMn1_ULSGRO1_USL1_UIOFGRO0_UPLRP0_USFGRO0_VSn1_VWA2_VWB1_WSGRA0_WSGRB0_WS64_WG64_4_1_WGM8_WGMXCC1_WGMXCCGn1
    SolutionIndex: 56
    SolutionNameMin: Cijk_Alik_Bljk_BBS_BH_BiasSB_HAS_SAV_UserArgs_MT384x64x64_MI16x16x1_SN_LDSB0_AFC1_AG1_AFEM1_AFEM1_ASEM1_CLR0_CADS0_DTLA0_DTLB0_DTVA0_DTVB0_DTVMXSA0_DTVMXSB0_DTVSM0_DPLB0_EPS0_ELFLR0_EMLLn1_FDSI0_GRPM1_GRVWA4_GRVWB8_GSU0_GSUAMB_GSUC0_GSUWGMRR0_GLS0_ISA950_IU1_K1_LDSTI0_LBSPPA512_LBSPPB256_LBSPPM0_LPA16_LPB16_LPM0_LRVWn1_LWPMn1_MIAV0_MIWT12_2_MO40_MGRIPM1_NTn1_NTA4_NTB0_NTC0_NTD0_NTM0_NEPBS14_NLCA1_NLCB1_ONLL1_PGR2_PLR1_PKA1_SGROB0_SIA3_SS1_SU0_SUM0_SUS0_SPO0_SRVW0_SSO0_SVW4_SK3_SKFTR0_SKXCCM0_SGRO0_TDMI0_TIN1_TLDS2_TLDSMn1_ULSGRO0_USL1_UIOFGRO0_UPLRP0_USFGRO0_VSn1_VWA4_VWB2_WSGRA2_WSGRB0_WS64_WG32_8_1_WGM48_WGMXCC1_WGMXCCGn1
    SolutionIndex: 57
    SolutionNameMin: Cijk_Alik_Bljk_BBS_BH_BiasSB_HAS_SAV_UserArgs_MT192x160x64_MI16x16x1_SN_LDSB0_AFC1_AG0_AFEM1_AFEM1_ASEM1_CLR1_CADS0_DTLA1_DTLB1_DTVA0_DTVB0_DTVMXSA0_DTVMXSB0_DTVSM0_DPLB1_EPS0_ELFLR0_EMLLn1_FDSI0_GRPM1_GRVWA2_GRVWB8_GSU0_GSUAMB_GSUC0_GSUWGMRR0_GLS0_ISA950_IU1_K1_LDSTI0_LBSPPA256_LBSPPB1024_LBSPPM0_LPA16_LPB32_LPM0_LRVWn1_LWPMn1_MIAV1_MIWT6_5_MO40_MGRIPM1_NTn1_NTA4_NTB0_NTC4_NTD0_NTM0_NEPBS4_NLCA1_NLCB1_ONLL1_PGR2_PLR1_PKA1_SGROB0_SIA3_SS1_SU0_SUM0_SUS0_SPO1_SRVW0_SSO0_SVW2_SK3_SKFTR0_SKXCCM8_SGRO0_TDMI0_TIN1_TLDS1_TLDSMn1_ULSGRO0_USL1_UIOFGRO0_UPLRP0_USFGRO0_VSn1_VWA2_VWB1_WSGRA0_WSGRB0_WS64_WG32_8_1_WGM6_WGMXCC1_WGMXCCGn1
    SolutionIndex: 58
    SolutionNameMin: Cijk_Alik_Bljk_BBS_BH_BiasSB_HAS_SAV_UserArgs_MT192x160x64_MI16x16x1_SN_LDSB0_AFC1_AG1_AFEM1_AFEM1_ASEM1_CLR1_CADS0_DTLA1_DTLB1_DTVA0_DTVB0_DTVMXSA0_DTVMXSB0_DTVSM0_DPLB1_EPS0_ELFLR0_EMLLn1_FDSI0_GRPM1_GRVWA8_GRVWB2_GSU0_GSUAMB_GSUC0_GSUWGMRR0_GLS0_ISA950_IU1_K1_LDSTI0_LBSPPA1024_LBSPPB256_LBSPPM0_LPA32_LPB16_LPM0_LRVWn1_LWPMn1_MIAV0_MIWT3_10_MO40_MGRIPM1_NTn1_NTA4_NTB0_NTC4_NTD0_NTM0_NEPBS4_NLCA1_NLCB1_ONLL1_PGR2_PLR1_PKA1_SGROB1_SIA3_SS1_SU0_SUM0_SUS0_SPO0_SRVW0_SSO0_SVW1_SK3_SKFTR0_SKXCCM8_SGRO0_TDMI0_TIN1_TLDS2_TLDSMn1_ULSGRO0_USL1_UIOFGRO0_UPLRP0_USFGRO0_VSn1_VWA1_VWB2_WSGRA0_WSGRB0_WS64_WG64_4_1_WGMn8_WGMXCC1_WGMXCCGn1
    SolutionIndex: 59
    SolutionNameMin: Cijk_Alik_Bljk_BBS_BH_BiasSB_HAS_SAV_UserArgs_MT128x64x128_MI16x16x1_SN_LDSB0_AFC1_AG0_AFEM1_AFEM1_ASEM1_CLR0_CADS0_DTLA1_DTLB1_DTVA0_DTVB0_DTVMXSA0_DTVMXSB0_DTVSM0_DPLB1_EPS0_ELFLR0_EMLLn1_FDSI0_GRPM1_GRVWA8_GRVWB8_GSU0_GSUAMB_GSUC0_GSUWGMRR0_GLS0_ISA950_IU1_K1_LDSTI0_LBSPPA1024_LBSPPB1024_LBSPPM0_LPA16_LPB32_LPM0_LRVWn1_LWPMn1_MIAV1_MIWT4_2_MO40_MGRIPM1_NTn1_NTA0_NTB0_NTC0_NTD4_NTM0_NEPBS12_NLCA1_NLCB1_ONLL1_PGR2_PLR1_PKA1_SGROB0_SIA3_SS1_SU0_SUM0_SUS0_SPO0_SRVW0_SSO0_SVW4_SK3_SKFTR0_SKXCCM4_SGRO0_TDMI0_TIN1_TLDS1_TLDSMn1_ULSGRO1_USL1_UIOFGRO0_UPLRP0_USFGRO0_VSn1_VWA4_VWB2_WSGRA0_WSGRB0_WS64_WG32_8_1_WGM0_WGMXCC1_WGMXCCGn1
    SolutionIndex: 60
    SolutionNameMin: Cijk_Alik_Bljk_BBS_BH_BiasSB_HAS_SAV_UserArgs_MT96x96x128_MI16x16x1_SN_LDSB0_AFC1_AG0_AFEM1_AFEM1_ASEM1_CLR1_CADS0_DTLA0_DTLB0_DTVA0_DTVB0_DTVMXSA0_DTVMXSB0_DTVSM0_DPLB0_EPS0_ELFLR0_EMLLn1_FDSI0_GRPM1_GRVWA8_GRVWB8_GSU0_GSUAMB_GSUC0_GSUWGMRR0_GLS0_ISA950_IU1_K1_LDSTI0_LBSPPA256_LBSPPB256_LBSPPM0_LPA16_LPB16_LPM0_LRVWn1_LWPMn1_MIAV1_MIWT3_3_MO40_MGRIPM1_NTn1_NTA4_NTB0_NTC0_NTD0_NTM0_NEPBS12_NLCA1_NLCB1_ONLL1_PGR2_PLR1_PKA1_SGROB0_SIA3_SS0_SU0_SUM0_SUS0_SPO0_SRVW0_SSO0_SVW4_SK3_SKFTR0_SKXCCM4_SGRO0_TDMI0_TIN1_TLDS2_TLDSMn1_ULSGRO1_USL1_UIOFGRO0_UPLRP0_USFGRO0_VSn1_VWA1_VWB1_WSGRA0_WSGRB0_WS64_WG32_8_1_WGM4_WGMXCC1_WGMXCCGn1
    SolutionIndex: 61
    SolutionNameMin: Cijk_Alik_Bljk_BBS_BH_BiasSB_HAS_SAV_UserArgs_MT96x96x128_MI16x16x1_SN_LDSB0_AFC1_AG1_AFEM1_AFEM1_ASEM1_CLR1_CADS0_DTLA0_DTLB0_DTVA0_DTVB0_DTVMXSA0_DTVMXSB0_DTVSM0_DPLB0_EPS0_ELFLR0_EMLLn1_FDSI0_GRPM1_GRVWA8_GRVWB8_GSU0_GSUAMB_GSUC0_GSUWGMRR0_GLS0_ISA950_IU1_K1_LDSTI0_LBSPPA256_LBSPPB256_LBSPPM0_LPA16_LPB16_LPM0_LRVWn1_LWPMn1_MIAV1_MIWT3_3_MO40_MGRIPM1_NTn1_NTA4_NTB0_NTC0_NTD4_NTM0_NEPBS0_NLCA1_NLCB1_ONLL1_PGR2_PLR1_PKA1_SGROB0_SIA3_SS1_SU0_SUM0_SUS0_SPO1_SRVW0_SSO0_SVW1_SK3_SKFTR0_SKXCCM0_SGRO0_TDMI0_TIN1_TLDS2_TLDSMn1_ULSGRO1_USL1_UIOFGRO0_UPLRP0_USFGRO0_VSn1_VWA1_VWB1_WSGRA0_WSGRB0_WS64_WG32_8_1_WGM4_WGMXCC4_WGMXCCGn1
    SolutionIndex: 62
    SolutionNameMin: Cijk_Alik_Bljk_BBS_BH_BiasSB_HAS_SAV_UserArgs_MT128x64x128_MI16x16x1_SN_LDSB0_AFC1_AG0_AFEM1_AFEM1_ASEM1_CLR0_CADS0_DTLA1_DTLB1_DTVA0_DTVB0_DTVMXSA0_DTVMXSB0_DTVSM0_DPLB0_EPS0_ELFLR0_EMLLn1_FDSI0_GRPM1_GRVWA8_GRVWB8_GSU0_GSUAMB_GSUC0_GSUWGMRR0_GLS0_ISA950_IU1_K1_LDSTI0_LBSPPA1024_LBSPPB1024_LBSPPM0_LPA32_LPB16_LPM0_LRVWn1_LWPMn1_MIAV0_MIWT2_4_MO40_MGRIPM1_NTn1_NTA4_NTB0_NTC0_NTD4_NTM0_NEPBS16_NLCA1_NLCB1_ONLL1_PGR3_PLR1_PKA1_SGROB0_SIA3_SS0_SU0_SUM0_SUS0_SPO0_SRVW0_SSO0_SVW8_SK3_SKFTR0_SKXCCM4_SGRO0_TDMI0_TIN1_TLDS2_TLDSMn1_ULSGRO1_USL1_UIOFGRO0_UPLRP0_USFGRO0_VSn1_VWA2_VWB4_WSGRA0_WSGRB0_WS64_WG64_4_1_WGM0_WGMXCC1_WGMXCCGn1
    SolutionIndex: 63
    SolutionNameMin: Cijk_Alik_Bljk_BBS_BH_BiasSB_HAS_SAV_UserArgs_MT96x64x128_MI16x16x1_SN_LDSB0_AFC1_AG0_AFEM1_AFEM1_ASEM1_CLR1_CADS0_DTLA1_DTLB1_DTVA0_DTVB0_DTVMXSA0_DTVMXSB0_DTVSM0_DPLB1_EPS0_ELFLR0_EMLLn1_FDSI0_GRPM1_GRVWA8_GRVWB8_GSU0_GSUAMB_GSUC0_GSUWGMRR0_GLS0_ISA950_IU1_K1_LDSTI0_LBSPPA1024_LBSPPB1024_LBSPPM0_LPA32_LPB32_LPM0_LRVWn1_LWPMn1_MIAV1_MIWT6_1_MO40_MGRIPM1_NTn1_NTA4_NTB0_NTC0_NTD0_NTM0_NEPBS8_NLCA1_NLCB1_ONLL1_PGR2_PLR1_PKA1_SGROB1_SIA3_SS0_SU0_SUM0_SUS0_SPO0_SRVW0_SSO0_SVW8_SK3_SKFTR0_SKXCCM0_SGRO0_TDMI0_TIN1_TLDS1_TLDSMn1_ULSGRO0_USL1_UIOFGRO0_UPLRP0_USFGRO0_VSn1_VWA2_VWB1_WSGRA0_WSGRB0_WS64_WG16_16_1_WGMn8_WGMXCC1_WGMXCCGn1
    SolutionIndex: 64
    SolutionNameMin: Cijk_Alik_Bljk_BBS_BH_BiasSB_HAS_SAV_UserArgs_MT48x64x256_MI16x16x1_SN_LDSB0_AFC1_AG0_AFEM1_AFEM1_ASEM1_CLR0_CADS0_DTLA0_DTLB0_DTVA0_DTVB0_DTVMXSA0_DTVMXSB0_DTVSM0_DPLB0_EPS0_ELFLR0_EMLLn1_FDSI0_GRPM1_GRVWA8_GRVWB8_GSU0_GSUAMB_GSUC0_GSUWGMRR0_GLS0_ISA950_IU1_K1_LDSTI0_LBSPPA512_LBSPPB512_LBSPPM0_LPA16_LPB16_LPM0_LRVWn1_LWPMn1_MIAV0_MIWT3_1_MO40_MGRIPM1_NTn1_NTA4_NTB0_NTC0_NTD0_NTM0_NEPBS4_NLCA1_NLCB1_ONLL1_PGR2_PLR1_PKA1_SGROB0_SIA3_SS0_SU0_SUM0_SUS0_SPO1_SRVW0_SSO0_SVW4_SK3_SKFTR0_SKXCCM4_SGRO0_TDMI0_TIN1_TLDS1_TLDSMn1_ULSGRO0_USL1_UIOFGRO0_UPLRP0_USFGRO1_VSn1_VWA1_VWB1_WSGRA2_WSGRB2_WS64_WG16_16_1_WGM24_WGMXCC1_WGMXCCGn1
    SolutionIndex: 65
    SolutionNameMin: Cijk_Alik_Bljk_BBS_BH_BiasSB_HAS_SAV_UserArgs_MT96x96x128_MI16x16x1_SN_LDSB0_AFC1_AG0_AFEM1_AFEM1_ASEM1_CLR0_CADS0_DTLA0_DTLB0_DTVA0_DTVB0_DTVMXSA0_DTVMXSB0_DTVSM0_DPLB0_EPS0_ELFLR0_EMLL0_FDSI0_GRPM1_GRVWA8_GRVWB8_GSU0_GSUAMB_GSUC0_GSUWGMRR0_GLS0_ISA950_IU1_K1_LDSTI0_LBSPPA256_LBSPPB256_LBSPPM0_LPA16_LPB16_LPM0_LRVWn1_LWPMn1_MIAV0_MIWT3_3_MO40_MGRIPM1_NTn1_NTA4_NTB0_NTC0_NTD0_NTM0_NEPBS10_NLCA1_NLCB1_ONLL1_PGR2_PLR1_PKA1_SGROB0_SIA3_SS0_SU0_SUM0_SUS0_SPO1_SRVW0_SSO0_SVW4_SK3_SKFTR0_SKXCCM8_SGRO0_TDMI0_TIN1_TLDS1_TLDSMn1_ULSGRO0_USL1_UIOFGRO0_UPLRP0_USFGRO0_VSn1_VWA1_VWB1_WSGRA0_WSGRB0_WS64_WG32_8_1_WGM0_WGMXCC1_WGMXCCGn1
    SolutionIndex: 66
    SolutionNameMin: Cijk_Alik_Bljk_BBS_BH_BiasSB_HAS_SAV_UserArgs_MT192x96x64_MI16x16x1_SN_LDSB0_AFC1_AG0_AFEM1_AFEM1_ASEM1_CLR1_CADS0_DTLA1_DTLB1_DTVA0_DTVB0_DTVMXSA0_DTVMXSB0_DTVSM0_DPLB1_EPS0_ELFLR0_EMLLn1_FDSI0_GRPM1_GRVWA8_GRVWB2_GSU0_GSUAMB_GSUC0_GSUWGMRR0_GLS0_ISA950_IU1_K1_LDSTI0_LBSPPA1024_LBSPPB256_LBSPPM0_LPA32_LPB16_LPM0_LRVWn1_LWPMn1_MIAV0_MIWT3_6_MO40_MGRIPM1_NTn1_NTA4_NTB0_NTC4_NTD0_NTM0_NEPBS4_NLCA1_NLCB1_ONLL1_PGR2_PLR1_PKA1_SGROB1_SIA3_SS1_SU16_SUM0_SUS512_SPO1_SRVW0_SSO0_SVW1_SK3_SKFTR0_SKXCCM4_SGRO0_TDMI0_TIN0_TLDS1_TLDSMn1_ULSGRO0_USL1_UIOFGRO0_UPLRP0_USFGRO0_VSn1_VWA1_VWB2_WSGRA0_WSGRB0_WS64_WG64_4_1_WGMn32_WGMXCC32_WGMXCCGn1
    SolutionIndex: 67
    SolutionNameMin: Cijk_Alik_Bljk_BBS_BH_BiasSB_HAS_SAV_UserArgs_MT256x192x64_MI16x16x1_CMS_SN_LDSB0_AFC1_AG0_AFEM1_AFEM1_ASEM1_CLR0_CADS0_DTLA1_DTLB1_DTVA0_DTVB0_DTVMXSA0_DTVMXSB0_DTVSM0_DPLB0_EPS0_ELFLR0_EMLLn1_FDSI0_GRPM1_GRVWA8_GRVWB8_GSU0_GSUAMB_GSUC0_GSUWGMRR0_GLS0_ISA950_IU1_K1_LDSTI0_LBSPPA1024_LBSPPB1024_LBSPPM0_LPA16_LPB32_LPM0_LRVW8_LWPMn1_MIAV0_MIWT8_6_MO40_MGRIPM1_NTn1_NTA4_NTB0_NTC0_NTD4_NTM0_NEPBS8_NLCA1_NLCB1_ONLL1_PGR2_PLR1_PKA1_SGROB1_SIA3_SS1_SU16_SUM0_SUS512_SPO1_SRVW0_SSO0_SVW8_SK3_SKFTR0_SKXCCM0_SGRO0_TDMI0_TIN0_TLDS1_TLDSMn1_ULSGRO0_USL1_UIOFGRO0_UPLRP0_USFGRO0_VSn1_VWA8_VWB2_WSGRA0_WSGRB0_WS64_WG32_8_1_WGMn8_WGMXCC1_WGMXCCGn1
    SolutionIndex: 68
    SolutionNameMin: Cijk_Alik_Bljk_BBS_BH_BiasSB_HAS_SAV_UserArgs_MT192x128x64_MI16x16x1_CMS_SN_LDSB0_AFC1_AG0_AFEM1_AFEM1_ASEM1_CLR0_CADS0_DTLA1_DTLB1_DTVA0_DTVB0_DTVMXSA0_DTVMXSB0_DTVSM0_DPLB0_EPS0_ELFLR0_EMLLn1_FDSI0_GRPM1_GRVWA8_GRVWB8_GSU0_GSUAMB_GSUC0_GSUWGMRR0_GLS0_ISA950_IU1_K1_LDSTI0_LBSPPA1024_LBSPPB1024_LBSPPM0_LPA32_LPB32_LPM0_LRVW8_LWPMn1_MIAV1_MIWT6_4_MO40_MGRIPM1_NTn1_NTA4_NTB0_NTC4_NTD0_NTM0_NEPBS2_NLCA1_NLCB1_ONLL1_PGR2_PLR1_PKA1_SGROB1_SIA3_SS1_SU16_SUM0_SUS256_SPO0_SRVW0_SSO0_SVW2_SK3_SKFTR0_SKXCCM4_SGRO0_TDMI0_TIN0_TLDS1_TLDSMn1_ULSGRO0_USL1_UIOFGRO0_UPLRP0_USFGRO0_VSn1_VWA2_VWB4_WSGRA0_WSGRB0_WS64_WG32_8_1_WGM32_WGMXCC1_WGMXCCGn1
    SolutionIndex: 69
    SolutionNameMin: Cijk_Alik_Bljk_BBS_BH_BiasSB_HAS_SAV_UserArgs_MT192x128x64_MI16x16x1_SN_LDSB0_AFC1_AG1_AFEM1_AFEM1_ASEM1_CLR1_CADS0_DTLA1_DTLB1_DTVA0_DTVB0_DTVMXSA0_DTVMXSB0_DTVSM0_DPLB1_EPS0_ELFLR0_EMLLn1_FDSI0_GRPM1_GRVWA8_GRVWB8_GSU0_GSUAMB_GSUC0_GSUWGMRR0_GLS0_ISA950_IU1_K1_LDSTI0_LBSPPA1024_LBSPPB1024_LBSPPM0_LPA32_LPB32_LPM0_LRVWn1_LWPMn1_MIAV1_MIWT12_2_MO40_MGRIPM1_NTn1_NTA4_NTB0_NTC0_NTD0_NTM0_NEPBS2_NLCA1_NLCB1_ONLL1_PGR2_PLR1_PKA1_SGROB0_SIA3_SS1_SU0_SUM0_SUS0_SPO0_SRVW0_SSO0_SVW4_SK3_SKFTR0_SKXCCM0_SGRO0_TDMI0_TIN1_TLDS1_TLDSMn1_ULSGRO0_USL1_UIOFGRO0_UPLRP0_USFGRO0_VSn1_VWA4_VWB2_WSGRA0_WSGRB0_WS64_WG16_16_1_WGMn48_WGMXCC1_WGMXCCGn1
    SolutionIndex: 70
    SolutionNameMin: Cijk_Alik_Bljk_BBS_BH_BiasSB_HAS_SAV_UserArgs_MT48x128x128_MI16x16x1_SN_LDSB0_AFC1_AG1_AFEM1_AFEM1_ASEM1_CLR0_CADS0_DTLA1_DTLB1_DTVA0_DTVB0_DTVMXSA0_DTVMXSB0_DTVSM0_DPLB1_EPS0_ELFLR0_EMLLn1_FDSI0_GRPM1_GRVWA2_GRVWB8_GSU0_GSUAMB_GSUC0_GSUWGMRR0_GLS0_ISA950_IU1_K1_LDSTI0_LBSPPA256_LBSPPB1024_LBSPPM0_LPA16_LPB32_LPM0_LRVWn1_LWPMn1_MIAV0_MIWT3_2_MO40_MGRIPM1_NTn1_NTA4_NTB0_NTC0_NTD0_NTM0_NEPBS16_NLCA1_NLCB1_ONLL1_PGR2_PLR1_PKA1_SGROB1_SIA3_SS0_SU0_SUM0_SUS0_SPO0_SRVW0_SSO1_SVW4_SK3_SKFTR0_SKXCCM8_SGRO0_TDMI0_TIN1_TLDS1_TLDSMn1_ULSGRO1_USL1_UIOFGRO0_UPLRP0_USFGRO0_VSn1_VWA1_VWB2_WSGRA0_WSGRB0_WS64_WG16_16_1_WGMn48_WGMXCC1_WGMXCCGn1
    SolutionIndex: 71
    SolutionNameMin: Cijk_Alik_Bljk_BBS_BH_BiasSB_HAS_SAV_UserArgs_MT192x128x64_MI16x16x1_SN_LDSB0_AFC1_AG0_AFEM1_AFEM1_ASEM1_CLR1_CADS0_DTLA1_DTLB1_DTVA0_DTVB0_DTVMXSA0_DTVMXSB0_DTVSM0_DPLB1_EPS0_ELFLR0_EMLLn1_FDSI0_GRPM1_GRVWA8_GRVWB8_GSU0_GSUAMB_GSUC0_GSUWGMRR0_GLS0_ISA950_IU1_K1_LDSTI0_LBSPPA1024_LBSPPB1024_LBSPPM0_LPA32_LPB32_LPM0_LRVWn1_LWPMn1_MIAV0_MIWT12_2_MO40_MGRIPM1_NTn1_NTA4_NTB0_NTC4_NTD0_NTM0_NEPBS2_NLCA1_NLCB1_ONLL1_PGR2_PLR1_PKA1_SGROB0_SIA3_SS1_SU0_SUM0_SUS0_SPO0_SRVW0_SSO0_SVW4_SK3_SKFTR0_SKXCCM8_SGRO0_TDMI0_TIN1_TLDS1_TLDSMn1_ULSGRO0_USL1_UIOFGRO0_UPLRP0_USFGRO0_VSn1_VWA4_VWB2_WSGRA0_WSGRB0_WS64_WG16_16_1_WGM8_WGMXCC1_WGMXCCGn1
    SolutionIndex: 72
    SolutionNameMin: Cijk_Alik_Bljk_BBS_BH_BiasSB_HAS_SAV_UserArgs_MT192x128x64_MI16x16x1_SN_LDSB0_AFC1_AG0_AFEM1_AFEM1_ASEM1_CLR0_CADS0_DTLA1_DTLB1_DTVA0_DTVB0_DTVMXSA0_DTVMXSB0_DTVSM0_DPLB1_EPS0_ELFLR0_EMLLn1_FDSI0_GRPM1_GRVWA8_GRVWB8_GSU0_GSUAMB_GSUC0_GSUWGMRR0_GLS0_ISA950_IU1_K1_LDSTI0_LBSPPA1024_LBSPPB1024_LBSPPM0_LPA32_LPB32_LPM0_LRVWn1_LWPMn1_MIAV0_MIWT12_2_MO40_MGRIPM1_NTn1_NTA4_NTB0_NTC4_NTD4_NTM0_NEPBS2_NLCA1_NLCB1_ONLL1_PGR2_PLR1_PKA1_SGROB0_SIA3_SS1_SU0_SUM0_SUS0_SPO0_SRVW0_SSO0_SVW4_SK3_SKFTR0_SKXCCM4_SGRO0_TDMI0_TIN1_TLDS1_TLDSMn1_ULSGRO0_USL1_UIOFGRO0_UPLRP0_USFGRO0_VSn1_VWA4_VWB2_WSGRA0_WSGRB0_WS64_WG16_16_1_WGM48_WGMXCC1_WGMXCCGn1
    SolutionIndex: 73
    SolutionNameMin: Cijk_Alik_Bljk_BBS_BH_BiasSB_HAS_SAV_UserArgs_MT64x64x128_MI16x16x1_SN_LDSB0_AFC1_AG0_AFEM1_AFEM1_ASEM1_CLR0_CADS0_DTLA1_DTLB1_DTVA0_DTVB0_DTVMXSA0_DTVMXSB0_DTVSM0_DPLB1_EPS0_ELFLR0_EMLL0_FDSI0_GRPM1_GRVWA8_GRVWB8_GSU0_GSUAMB_GSUC0_GSUWGMRR0_GLS0_ISA950_IU1_K1_LDSTI0_LBSPPA1024_LBSPPB1024_LBSPPM0_LPA32_LPB32_LPM0_LRVWn1_LWPMn1_MIAV0_MIWT2_2_MO40_MGRIPM1_NTn1_NTA4_NTB0_NTC0_NTD0_NTM0_NEPBS12_NLCA1_NLCB1_ONLL1_PGR3_PLR1_PKA1_SGROB1_SIA3_SS0_SU0_SUM0_SUS0_SPO1_SRVW0_SSO0_SVW8_SK3_SKFTR0_SKXCCM0_SGRO0_TDMI0_TIN1_TLDS1_TLDSMn1_ULSGRO1_USL1_UIOFGRO0_UPLRP0_USFGRO0_VSn1_VWA2_VWB2_WSGRA0_WSGRB0_WS64_WG32_8_1_WGMn4_WGMXCC1_WGMXCCGn1
    SolutionIndex: 74
    SolutionNameMin: Cijk_Alik_Bljk_BBS_BH_BiasSB_HAS_SAV_UserArgs_MT48x64x256_MI16x16x1_SN_LDSB0_AFC1_AG1_AFEM1_AFEM1_ASEM1_CLR0_CADS0_DTLA0_DTLB0_DTVA0_DTVB0_DTVMXSA0_DTVMXSB0_DTVSM0_DPLB0_EPS0_ELFLR0_EMLLn1_FDSI0_GRPM1_GRVWA8_GRVWB8_GSU0_GSUAMB_GSUC0_GSUWGMRR0_GLS0_ISA950_IU1_K1_LDSTI0_LBSPPA512_LBSPPB512_LBSPPM0_LPA16_LPB16_LPM0_LRVWn1_LWPMn1_MIAV1_MIWT3_1_MO40_MGRIPM1_NTn1_NTA4_NTB0_NTC0_NTD0_NTM0_NEPBS0_NLCA1_NLCB1_ONLL1_PGR2_PLR1_PKA1_SGROB0_SIA3_SS0_SU0_SUM0_SUS0_SPO1_SRVW0_SSO0_SVW4_SK3_SKFTR0_SKXCCM4_SGRO0_TDMI0_TIN1_TLDS1_TLDSMn1_ULSGRO0_USL1_UIOFGRO0_UPLRP0_USFGRO0_VSn1_VWA1_VWB1_WSGRA2_WSGRB2_WS64_WG16_16_1_WGMn16_WGMXCC1_WGMXCCGn1
    SolutionIndex: 75
    SolutionNameMin: Cijk_Alik_Bljk_BBS_BH_BiasSB_HAS_SAV_UserArgs_MT64x16x256_MI16x16x1_SN_LDSB0_AFC1_AG0_AFEM1_AFEM1_ASEM1_CLR0_CADS0_DTLA1_DTLB1_DTVA0_DTVB0_DTVMXSA0_DTVMXSB0_DTVSM0_DPLB0_EPS0_ELFLR0_EMLLn1_FDSI0_GRPM1_GRVWA8_GRVWB8_GSU0_GSUAMB_GSUC0_GSUWGMRR0_GLS0_ISA950_IU1_K1_LDSTI0_LBSPPA1024_LBSPPB1024_LBSPPM0_LPA32_LPB32_LPM0_LRVWn1_LWPMn1_MIAV0_MIWT1_1_MO40_MGRIPM1_NTn1_NTA4_NTB0_NTC0_NTD0_NTM0_NEPBS4_NLCA1_NLCB1_ONLL1_PGR3_PLR1_PKA1_SGROB0_SIA3_SS0_SU0_SUM0_SUS0_SPO0_SRVW0_SSO0_SVW4_SK3_SKFTR0_SKXCCM8_SGRO0_TDMI0_TIN1_TLDS1_TLDSMn1_ULSGRO0_USL1_UIOFGRO0_UPLRP0_USFGRO0_VSn1_VWA1_VWB1_WSGRA0_WSGRB0_WS64_WG64_4_1_WGM8_WGMXCC1_WGMXCCGn1
    SolutionIndex: 76
    SolutionNameMin: Cijk_Alik_Bljk_BBS_BH_BiasSB_HAS_SAV_UserArgs_MT64x16x256_MI16x16x1_SN_LDSB0_AFC1_AG0_AFEM1_AFEM1_ASEM1_CLR1_CADS0_DTLA1_DTLB1_DTVA0_DTVB0_DTVMXSA0_DTVMXSB0_DTVSM0_DPLB0_EPS0_ELFLR0_EMLLn1_FDSI0_GRPM1_GRVWA8_GRVWB8_GSU0_GSUAMB_GSUC0_GSUWGMRR0_GLS0_ISA950_IU1_K1_LDSTI0_LBSPPA1024_LBSPPB1024_LBSPPM0_LPA32_LPB32_LPM0_LRVWn1_LWPMn1_MIAV0_MIWT1_1_MO40_MGRIPM1_NTn1_NTA4_NTB0_NTC0_NTD4_NTM0_NEPBS16_NLCA1_NLCB1_ONLL1_PGR3_PLR1_PKA1_SGROB0_SIA3_SS0_SU0_SUM0_SUS0_SPO0_SRVW0_SSO0_SVW4_SK3_SKFTR0_SKXCCM8_SGRO0_TDMI0_TIN1_TLDS1_TLDSMn1_ULSGRO0_USL1_UIOFGRO0_UPLRP0_USFGRO0_VSn1_VWA1_VWB1_WSGRA0_WSGRB0_WS64_WG64_4_1_WGMn8_WGMXCC1_WGMXCCGn1
    SolutionIndex: 77
    SolutionNameMin: Cijk_Alik_Bljk_BBS_BH_BiasSB_HAS_SAV_UserArgs_MT224x256x64_MI16x16x1_CMS_SN_LDSB0_AFC1_AG0_AFEM1_AFEM1_ASEM1_CLR0_CADS0_DTLA1_DTLB1_DTVA0_DTVB0_DTVMXSA0_DTVMXSB0_DTVSM0_DPLB0_EPS0_ELFLR0_EMLLn1_FDSI0_GRPM1_GRVWA8_GRVWB8_GSU0_GSUAMB_GSUC0_GSUWGMRR0_GLS0_ISA950_IU1_K1_LDSTI1_LBSPPA1024_LBSPPB1024_LBSPPM0_LPA32_LPB16_LPM0_LRVW8_LWPMn1_MIAV0_MIWT7_8_MO40_MGRIPM1_NTn1_NTA4_NTB0_NTC0_NTD0_NTM0_NEPBS0_NLCA1_NLCB1_ONLL1_PGR2_PLR1_PKA1_SGROB1_SIA3_SS1_SU8_SUM0_SUS128_SPO1_SRVW0_SSO1_SVW1_SK3_SKFTR0_SKXCCM0_SGRO0_TDMI0_TIN0_TLDS1_TLDSMn1_ULSGRO0_USL1_UIOFGRO0_UPLRP0_USFGRO0_VSn1_VWA1_VWB8_WSGRA0_WSGRB0_WS64_WG32_8_1_WGMn32_WGMXCC2_WGMXCCGn1
    SolutionIndex: 78
    SolutionNameMin: Cijk_Alik_Bljk_BBS_BH_BiasSB_HAS_SAV_UserArgs_MT192x320x64_MI16x16x1_CMS_SN_LDSB0_AFC1_AG0_AFEM1_AFEM1_ASEM1_CLR0_CADS0_DTLA1_DTLB1_DTVA0_DTVB0_DTVMXSA0_DTVMXSB0_DTVSM0_DPLB0_EPS0_ELFLR0_EMLLn1_FDSI0_GRPM1_GRVWA8_GRVWB8_GSU0_GSUAMB_GSUC0_GSUWGMRR0_GLS0_ISA950_IU1_K1_LDSTI0_LBSPPA1024_LBSPPB1024_LBSPPM0_LPA32_LPB32_LPM0_LRVW8_LWPMn1_MIAV0_MIWT6_10_MO40_MGRIPM1_NTn1_NTA4_NTB0_NTC0_NTD4_NTM0_NEPBS16_NLCA1_NLCB1_ONLL1_PGR2_PLR1_PKA1_SGROB0_SIA3_SS0_SU0_SUM0_SUS128_SPO1_SRVW0_SSO0_SVW8_SK3_SKFTR0_SKXCCM0_SGRO0_TDMI0_TIN0_TLDS1_TLDSMn1_ULSGRO0_USL1_UIOFGRO0_UPLRP0_USFGRO0_VSn1_VWA2_VWB2_WSGRA0_WSGRB0_WS64_WG32_8_1_WGM32_WGMXCC16_WGMXCCGn1
    SolutionIndex: 79
    SolutionNameMin: Cijk_Alik_Bljk_BBS_BH_BiasSB_HAS_SAV_UserArgs_MT192x256x64_MI16x16x1_CMS_SN_LDSB0_AFC1_AG1_AFEM1_AFEM1_ASEM1_CLR0_CADS0_DTLA1_DTLB1_DTVA0_DTVB0_DTVMXSA0_DTVMXSB0_DTVSM0_DPLB0_EPS0_ELFLR0_EMLL0_FDSI0_GRPM1_GRVWA8_GRVWB8_GSU0_GSUAMB_GSUC0_GSUWGMRR0_GLS0_ISA950_IU1_K1_LDSTI0_LBSPPA1024_LBSPPB1024_LBSPPM0_LPA32_LPB16_LPM0_LRVW8_LWPMn1_MIAV0_MIWT6_8_MO40_MGRIPM1_NTn1_NTA4_NTB0_NTC0_NTD4_NTM0_NEPBS8_NLCA1_NLCB1_ONLL1_PGR2_PLR1_PKA1_SGROB0_SIA3_SS0_SU0_SUM0_SUS128_SPO1_SRVW0_SSO0_SVW8_SK3_SKFTR0_SKXCCM0_SGRO0_TDMI0_TIN0_TLDS1_TLDSMn1_ULSGRO0_USL1_UIOFGRO0_UPLRP0_USFGRO0_VSn1_VWA2_VWB8_WSGRA0_WSGRB0_WS64_WG32_8_1_WGMn1_WGMXCC4_WGMXCCGn1
    SolutionIndex: 80
    SolutionNameMin: Cijk_Alik_Bljk_BBS_BH_BiasSB_HAS_SAV_UserArgs_MT192x256x64_MI16x16x1_CMS_SN_LDSB0_AFC1_AG0_AFEM1_AFEM1_ASEM1_CLR0_CADS0_DTLA1_DTLB1_DTVA0_DTVB0_DTVMXSA0_DTVMXSB0_DTVSM0_DPLB0_EPS0_ELFLR0_EMLLn1_FDSI0_GRPM1_GRVWA8_GRVWB8_GSU0_GSUAMB_GSUC0_GSUWGMRR0_GLS0_ISA950_IU1_K1_LDSTI0_LBSPPA1024_LBSPPB1024_LBSPPM0_LPA32_LPB16_LPM0_LRVW8_LWPMn1_MIAV0_MIWT6_8_MO40_MGRIPM1_NTn1_NTA4_NTB0_NTC0_NTD4_NTM0_NEPBS0_NLCA1_NLCB1_ONLL1_PGR2_PLR1_PKA1_SGROB0_SIA3_SS0_SU8_SUM0_SUS128_SPO1_SRVW0_SSO0_SVW8_SK3_SKFTR0_SKXCCM0_SGRO0_TDMI0_TIN0_TLDS1_TLDSMn1_ULSGRO0_USL1_UIOFGRO0_UPLRP0_USFGRO0_VSn1_VWA2_VWB8_WSGRA0_WSGRB0_WS64_WG32_8_1_WGMn24_WGMXCC1_WGMXCCGn1
    SolutionIndex: 81
    SolutionNameMin: Cijk_Alik_Bljk_BBS_BH_BiasSB_HAS_SAV_UserArgs_MT256x256x64_MI16x16x1_CMS_SN_LDSB0_AFC1_AG0_AFEM1_AFEM1_ASEM1_CLR0_CADS0_DTLA1_DTLB1_DTVA0_DTVB0_DTVMXSA0_DTVMXSB0_DTVSM0_DPLB0_EPS0_ELFLR0_EMLLn1_FDSI0_GRPM1_GRVWA8_GRVWB8_GSU0_GSUAMB_GSUC0_GSUWGMRR0_GLS0_ISA950_IU1_K1_LDSTI0_LBSPPA1024_LBSPPB1024_LBSPPM0_LPA16_LPB16_LPM0_LRVW8_LWPMn1_MIAV0_MIWT8_8_MO40_MGRIPM1_NTn1_NTA4_NTB0_NTC0_NTD0_NTM0_NEPBS16_NLCA1_NLCB1_ONLL1_PGR2_PLR1_PKA1_SGROB1_SIA3_SS0_SU8_SUM0_SUS128_SPO0_SRVW0_SSO0_SVW4_SK3_SKFTR0_SKXCCM0_SGRO0_TDMI0_TIN0_TLDS1_TLDSMn1_ULSGRO0_USL1_UIOFGRO0_UPLRP0_USFGRO0_VSn1_VWA8_VWB8_WSGRA0_WSGRB0_WS64_WG32_8_1_WGMn4_WGMXCC2_WGMXCCGn1
    SolutionIndex: 82
    SolutionNameMin: Cijk_Alik_Bljk_BBS_BH_BiasSB_HAS_SAV_UserArgs_MT384x128x64_MI16x16x1_SN_LDSB0_AFC1_AG1_AFEM1_AFEM1_ASEM1_CLR0_CADS0_DTLA1_DTLB1_DTVA0_DTVB0_DTVMXSA0_DTVMXSB0_DTVSM0_DPLB0_EPS0_ELFLR0_EMLL0_FDSI0_GRPM1_GRVWA8_GRVWB8_GSU0_GSUAMB_GSUC0_GSUWGMRR0_GLS0_ISA950_IU1_K1_LDSTI0_LBSPPA1024_LBSPPB1024_LBSPPM0_LPA32_LPB32_LPM0_LRVWn1_LWPMn1_MIAV0_MIWT12_4_MO40_MGRIPM1_NTn1_NTA4_NTB0_NTC0_NTD4_NTM0_NEPBS16_NLCA1_NLCB1_ONLL1_PGR2_PLR1_PKA1_SGROB1_SIA3_SS1_SU0_SUM0_SUS0_SPO0_SRVW0_SSO0_SVW4_SK3_SKFTR0_SKXCCM8_SGRO0_TDMI0_TIN1_TLDS2_TLDSMn1_ULSGRO0_USL1_UIOFGRO0_UPLRP0_USFGRO0_VSn1_VWA4_VWB4_WSGRA0_WSGRB0_WS64_WG32_8_1_WGM0_WGMXCC1_WGMXCCGn1
    SolutionIndex: 83
    SolutionNameMin: Cijk_Alik_Bljk_BBS_BH_BiasSB_HAS_SAV_UserArgs_MT192x256x64_MI16x16x1_CMS_SN_LDSB0_AFC1_AG1_AFEM1_AFEM1_ASEM1_CLR0_CADS0_DTLA1_DTLB1_DTVA0_DTVB0_DTVMXSA0_DTVMXSB0_DTVSM0_DPLB0_EPS0_ELFLR0_EMLL0_FDSI0_GRPM1_GRVWA8_GRVWB8_GSU0_GSUAMB_GSUC0_GSUWGMRR0_GLS0_ISA950_IU1_K1_LDSTI0_LBSPPA1024_LBSPPB1024_LBSPPM0_LPA32_LPB16_LPM0_LRVW8_LWPMn1_MIAV0_MIWT6_8_MO40_MGRIPM1_NTn1_NTA4_NTB0_NTC0_NTD4_NTM0_NEPBS14_NLCA1_NLCB1_ONLL1_PGR2_PLR1_PKA1_SGROB1_SIA3_SS0_SU16_SUM0_SUS256_SPO1_SRVW0_SSO0_SVW8_SK3_SKFTR0_SKXCCM0_SGRO0_TDMI0_TIN0_TLDS1_TLDSMn1_ULSGRO0_USL1_UIOFGRO0_UPLRP0_USFGRO0_VSn1_VWA2_VWB8_WSGRA0_WSGRB0_WS64_WG32_8_1_WGMn16_WGMXCC1_WGMXCCGn1
    SolutionIndex: 84
    SolutionNameMin: Cijk_Alik_Bljk_BBS_BH_BiasSB_HAS_SAV_UserArgs_MT352x192x64_MI16x16x1_CMS_SN_LDSB0_AFC1_AG1_AFEM1_AFEM1_ASEM1_CLR0_CADS0_DTLA1_DTLB1_DTVA0_DTVB0_DTVMXSA0_DTVMXSB0_DTVSM0_DPLB0_EPS0_ELFLR0_EMLLn1_FDSI0_GRPM1_GRVWA8_GRVWB8_GSU0_GSUAMB_GSUC0_GSUWGMRR0_GLS0_ISA950_IU1_K1_LDSTI0_LBSPPA1024_LBSPPB1024_LBSPPM0_LPA32_LPB32_LPM0_LRVW8_LWPMn1_MIAV0_MIWT11_6_MO40_MGRIPM1_NTn1_NTA4_NTB0_NTC0_NTD0_NTM0_NEPBS4_NLCA1_NLCB1_ONLL1_PGR2_PLR1_PKA1_SGROB0_SIA3_SS0_SU8_SUM0_SUS128_SPO1_SRVW0_SSO0_SVW4_SK3_SKFTR0_SKXCCM0_SGRO0_TDMI0_TIN0_TLDS1_TLDSMn1_ULSGRO0_USL1_UIOFGRO0_UPLRP0_USFGRO0_VSn1_VWA1_VWB2_WSGRA0_WSGRB0_WS64_WG32_8_1_WGM6_WGMXCC32_WGMXCCGn1
    SolutionIndex: 85
    SolutionNameMin: Cijk_Alik_Bljk_BBS_BH_BiasSB_HAS_SAV_UserArgs_MT352x192x64_MI16x16x1_CMS_SN_LDSB0_AFC1_AG0_AFEM1_AFEM1_ASEM1_CLR1_CADS0_DTLA1_DTLB1_DTVA0_DTVB0_DTVMXSA0_DTVMXSB0_DTVSM0_DPLB0_EPS0_ELFLR0_EMLL0_FDSI0_GRPM1_GRVWA8_GRVWB8_GSU0_GSUAMB_GSUC0_GSUWGMRR0_GLS0_ISA950_IU1_K1_LDSTI1_LBSPPA1024_LBSPPB1024_LBSPPM0_LPA32_LPB32_LPM0_LRVW8_LWPMn1_MIAV0_MIWT11_6_MO40_MGRIPM1_NTn1_NTA4_NTB0_NTC0_NTD4_NTM0_NEPBS0_NLCA1_NLCB1_ONLL1_PGR2_PLR1_PKA1_SGROB0_SIA3_SS1_SU0_SUM0_SUS128_SPO1_SRVW0_SSO1_SVW1_SK3_SKFTR0_SKXCCM0_SGRO0_TDMI0_TIN0_TLDS1_TLDSMn1_ULSGRO0_USL1_UIOFGRO0_UPLRP0_USFGRO0_VSn1_VWA1_VWB2_WSGRA0_WSGRB0_WS64_WG32_8_1_WGMn8_WGMXCC1_WGMXCCGn1
    SolutionIndex: 86
    SolutionNameMin: Cijk_Alik_Bljk_BBS_BH_BiasSB_HAS_SAV_UserArgs_MT352x192x64_MI16x16x1_CMS_SN_LDSB0_AFC1_AG1_AFEM1_AFEM1_ASEM1_CLR0_CADS0_DTLA1_DTLB1_DTVA0_DTVB0_DTVMXSA0_DTVMXSB0_DTVSM0_DPLB0_EPS0_ELFLR0_EMLL0_FDSI0_GRPM1_GRVWA8_GRVWB8_GSU0_GSUAMB_GSUC0_GSUWGMRR0_GLS0_ISA950_IU1_K1_LDSTI0_LBSPPA1024_LBSPPB1024_LBSPPM0_LPA32_LPB32_LPM0_LRVW8_LWPMn1_MIAV0_MIWT11_6_MO40_MGRIPM1_NTn1_NTA4_NTB0_NTC0_NTD0_NTM0_NEPBS4_NLCA1_NLCB1_ONLL1_PGR2_PLR1_PKA1_SGROB0_SIA3_SS0_SU16_SUM0_SUS128_SPO0_SRVW0_SSO0_SVW4_SK3_SKFTR0_SKXCCM0_SGRO0_TDMI0_TIN0_TLDS1_TLDSMn1_ULSGRO0_USL1_UIOFGRO0_UPLRP0_USFGRO0_VSn1_VWA1_VWB2_WSGRA0_WSGRB0_WS64_WG32_8_1_WGM48_WGMXCC1_WGMXCCGn1
    SolutionIndex: 87
    SolutionNameMin: Cijk_Alik_Bljk_BBS_BH_BiasSB_HAS_SAV_UserArgs_MT352x192x64_MI16x16x1_CMS_SN_LDSB0_AFC1_AG1_AFEM1_AFEM1_ASEM1_CLR0_CADS0_DTLA1_DTLB1_DTVA0_DTVB0_DTVMXSA0_DTVMXSB0_DTVSM0_DPLB0_EPS0_ELFLR0_EMLL0_FDSI0_GRPM1_GRVWA8_GRVWB8_GSU0_GSUAMB_GSUC0_GSUWGMRR0_GLS0_ISA950_IU1_K1_LDSTI0_LBSPPA1024_LBSPPB1024_LBSPPM0_LPA32_LPB32_LPM0_LRVW8_LWPMn1_MIAV0_MIWT11_6_MO40_MGRIPM1_NTn1_NTA4_NTB0_NTC0_NTD0_NTM0_NEPBS14_NLCA1_NLCB1_ONLL1_PGR2_PLR1_PKA1_SGROB0_SIA3_SS0_SU0_SUM0_SUS128_SPO0_SRVW0_SSO0_SVW4_SK3_SKFTR0_SKXCCM4_SGRO0_TDMI0_TIN0_TLDS1_TLDSMn1_ULSGRO0_USL1_UIOFGRO0_UPLRP0_USFGRO0_VSn1_VWA1_VWB2_WSGRA0_WSGRB0_WS64_WG32_8_1_WGMn8_WGMXCC16_WGMXCCGn1
    SolutionIndex: 88
    SolutionNameMin: Cijk_Alik_Bljk_BBS_BH_BiasSB_HAS_SAV_UserArgs_MT192x256x64_MI16x16x1_CMS_SN_LDSB0_AFC1_AG1_AFEM1_AFEM1_ASEM1_CLR0_CADS0_DTLA1_DTLB1_DTVA0_DTVB0_DTVMXSA0_DTVMXSB0_DTVSM0_DPLB0_EPS0_ELFLR0_EMLLn1_FDSI0_GRPM1_GRVWA8_GRVWB8_GSU0_GSUAMB_GSUC0_GSUWGMRR0_GLS0_ISA950_IU1_K1_LDSTI0_LBSPPA1024_LBSPPB1024_LBSPPM0_LPA32_LPB16_LPM0_LRVW8_LWPMn1_MIAV0_MIWT6_8_MO40_MGRIPM1_NTn1_NTA4_NTB0_NTC0_NTD4_NTM0_NEPBS14_NLCA1_NLCB1_ONLL1_PGR2_PLR1_PKA1_SGROB1_SIA3_SS0_SU0_SUM0_SUS128_SPO1_SRVW0_SSO1_SVW8_SK3_SKFTR0_SKXCCM0_SGRO0_TDMI0_TIN0_TLDS1_TLDSMn1_ULSGRO0_USL1_UIOFGRO0_UPLRP0_USFGRO0_VSn1_VWA2_VWB8_WSGRA0_WSGRB0_WS64_WG32_8_1_WGM8_WGMXCC1_WGMXCCGn1
    SolutionIndex: 89
    SolutionNameMin: Cijk_Alik_Bljk_BBS_BH_BiasSB_HAS_SAV_UserArgs_MT352x192x64_MI16x16x1_CMS_SN_LDSB0_AFC1_AG0_AFEM1_AFEM1_ASEM1_CLR1_CADS0_DTLA1_DTLB1_DTVA0_DTVB0_DTVMXSA0_DTVMXSB0_DTVSM0_DPLB0_EPS0_ELFLR0_EMLL0_FDSI0_GRPM1_GRVWA8_GRVWB8_GSU0_GSUAMB_GSUC0_GSUWGMRR0_GLS0_ISA950_IU1_K1_LDSTI0_LBSPPA1024_LBSPPB1024_LBSPPM0_LPA32_LPB32_LPM0_LRVW8_LWPMn1_MIAV0_MIWT11_6_MO40_MGRIPM1_NTn1_NTA4_NTB4_NTC4_NTD0_NTM0_NEPBS8_NLCA1_NLCB1_ONLL1_PGR2_PLR1_PKA1_SGROB0_SIA3_SS1_SU8_SUM0_SUS512_SPO0_SRVW0_SSO0_SVW1_SK3_SKFTR0_SKXCCM4_SGRO0_TDMI0_TIN0_TLDS1_TLDSMn1_ULSGRO0_USL1_UIOFGRO0_UPLRP0_USFGRO0_VSn1_VWA1_VWB2_WSGRA0_WSGRB0_WS64_WG32_8_1_WGM8_WGMXCC32_WGMXCCGn1
    SolutionIndex: 90
    SolutionNameMin: Cijk_Alik_Bljk_BBS_BH_BiasSB_HAS_SAV_UserArgs_MT128x352x64_MI16x16x1_SN_LDSB0_AFC1_AG0_AFEM1_AFEM1_ASEM1_CLR1_CADS0_DTLA1_DTLB1_DTVA0_DTVB0_DTVMXSA0_DTVMXSB0_DTVSM0_DPLB0_EPS0_ELFLR0_EMLL0_FDSI0_GRPM1_GRVWA8_GRVWB8_GSU0_GSUAMB_GSUC0_GSUWGMRR0_GLS0_ISA950_IU1_K1_LDSTI0_LBSPPA1024_LBSPPB1024_LBSPPM0_LPA32_LPB32_LPM0_LRVWn1_LWPMn1_MIAV0_MIWT4_11_MO40_MGRIPM1_NTn1_NTA4_NTB0_NTC4_NTD0_NTM0_NEPBS16_NLCA1_NLCB1_ONLL1_PGR2_PLR1_PKA1_SGROB1_SIA3_SS1_SU16_SUM0_SUS128_SPO0_SRVW0_SSO0_SVW4_SK3_SKFTR0_SKXCCM0_SGRO0_TDMI0_TIN0_TLDS1_TLDSMn1_ULSGRO1_USL1_UIOFGRO0_UPLRP0_USFGRO0_VSn1_VWA4_VWB1_WSGRA0_WSGRB0_WS64_WG32_8_1_WGMn32_WGMXCC32_WGMXCCGn1
    SolutionIndex: 91
    SolutionNameMin: Cijk_Alik_Bljk_BBS_BH_BiasSB_HAS_SAV_UserArgs_MT352x192x64_MI16x16x1_CMS_SN_LDSB0_AFC1_AG0_AFEM1_AFEM1_ASEM1_CLR1_CADS0_DTLA1_DTLB1_DTVA0_DTVB0_DTVMXSA0_DTVMXSB0_DTVSM0_DPLB0_EPS0_ELFLR0_EMLL0_FDSI0_GRPM1_GRVWA8_GRVWB8_GSU0_GSUAMB_GSUC0_GSUWGMRR0_GLS0_ISA950_IU1_K1_LDSTI0_LBSPPA1024_LBSPPB1024_LBSPPM0_LPA32_LPB32_LPM0_LRVW8_LWPMn1_MIAV0_MIWT11_6_MO40_MGRIPM1_NTn1_NTA4_NTB4_NTC0_NTD0_NTM0_NEPBS2_NLCA1_NLCB1_ONLL1_PGR2_PLR1_PKA1_SGROB1_SIA3_SS1_SU16_SUM0_SUS512_SPO0_SRVW0_SSO0_SVW1_SK3_SKFTR0_SKXCCM0_SGRO0_TDMI0_TIN0_TLDS1_TLDSMn1_ULSGRO0_USL1_UIOFGRO0_UPLRP0_USFGRO0_VSn1_VWA1_VWB2_WSGRA0_WSGRB0_WS64_WG32_8_1_WGMn6_WGMXCC1_WGMXCCGn1
    SolutionIndex: 92
    SolutionNameMin: Cijk_Alik_Bljk_BBS_BH_BiasSB_HAS_SAV_UserArgs_MT352x192x64_MI16x16x1_CMS_SN_LDSB0_AFC1_AG0_AFEM1_AFEM1_ASEM1_CLR0_CADS0_DTLA1_DTLB1_DTVA0_DTVB0_DTVMXSA0_DTVMXSB0_DTVSM0_DPLB0_EPS0_ELFLR0_EMLLn1_FDSI0_GRPM1_GRVWA8_GRVWB8_GSU0_GSUAMB_GSUC0_GSUWGMRR0_GLS0_ISA950_IU1_K1_LDSTI1_LBSPPA1024_LBSPPB1024_LBSPPM0_LPA32_LPB32_LPM0_LRVW8_LWPMn1_MIAV0_MIWT11_6_MO40_MGRIPM1_NTn1_NTA4_NTB4_NTC4_NTD0_NTM0_NEPBS4_NLCA1_NLCB1_ONLL1_PGR2_PLR1_PKA1_SGROB0_SIA3_SS1_SU0_SUM0_SUS128_SPO1_SRVW0_SSO0_SVW1_SK3_SKFTR0_SKXCCM0_SGRO0_TDMI0_TIN0_TLDS1_TLDSMn1_ULSGRO0_USL1_UIOFGRO0_UPLRP0_USFGRO0_VSn1_VWA1_VWB2_WSGRA0_WSGRB0_WS64_WG32_8_1_WGM0_WGMXCC1_WGMXCCGn1
    SolutionIndex: 93
    SolutionNameMin: Cijk_Alik_Bljk_BBS_BH_BiasSB_HAS_SAV_UserArgs_MT384x128x64_MI16x16x1_SN_LDSB1_AFC1_AG1_AFEM1_AFEM1_ASEM1_CLR0_CADS0_DTLA0_DTLB0_DTVA0_DTVB0_DTVMXSA0_DTVMXSB0_DTVSM0_DPLB0_EPS0_ELFLR0_EMLLn1_FDSI0_GRPM1_GRVWA8_GRVWB8_GSU0_GSUAMB_GSUC0_GSUWGMRR0_GLS0_ISA950_IU1_K1_LDSTI0_LBSPPA512_LBSPPB512_LBSPPM0_LPA16_LPB16_LPM0_LRVWn1_LWPMn1_MIAV0_MIWT12_4_MO40_MGRIPM1_NTn1_NTA4_NTB0_NTC0_NTD0_NTM0_NEPBS12_NLCA1_NLCB1_ONLL1_PGR2_PLR1_PKA1_SGROB0_SIA3_SS1_SU0_SUM0_SUS0_SPO1_SRVW0_SSO0_SVW4_SK3_SKFTR0_SKXCCM0_SGRO0_TDMI0_TIN1_TLDS1_TLDSMn1_ULSGRO1_USL1_UIOFGRO0_UPLRP0_USFGRO1_VSn1_VWA4_VWB4_WSGRA2_WSGRB2_WS64_WG32_8_1_WGMn2_WGMXCC2_WGMXCCGn1
    SolutionIndex: 94
    SolutionNameMin: Cijk_Alik_Bljk_BBS_BH_BiasSB_HAS_SAV_UserArgs_MT256x160x64_MI16x16x1_CMS_SN_LDSB0_AFC1_AG1_AFEM1_AFEM1_ASEM1_CLR1_CADS0_DTLA1_DTLB1_DTVA0_DTVB0_DTVMXSA0_DTVMXSB0_DTVSM0_DPLB0_EPS0_ELFLR0_EMLL0_FDSI0_GRPM1_GRVWA8_GRVWB8_GSU0_GSUAMB_GSUC0_GSUWGMRR0_GLS0_ISA950_IU1_K1_LDSTI0_LBSPPA1024_LBSPPB1024_LBSPPM0_LPA16_LPB32_LPM0_LRVW8_LWPMn1_MIAV0_MIWT8_5_MO40_MGRIPM1_NTn1_NTA4_NTB0_NTC4_NTD0_NTM0_NEPBS8_NLCA1_NLCB1_ONLL1_PGR2_PLR1_PKA1_SGROB0_SIA3_SS1_SU8_SUM0_SUS512_SPO1_SRVW0_SSO0_SVW8_SK3_SKFTR0_SKXCCM0_SGRO0_TDMI0_TIN0_TLDS1_TLDSMn1_ULSGRO0_USL1_UIOFGRO0_UPLRP0_USFGRO0_VSn1_VWA8_VWB1_WSGRA0_WSGRB0_WS64_WG32_8_1_WGM4_WGMXCC2_WGMXCCGn1
    SolutionIndex: 95
    SolutionNameMin: Cijk_Alik_Bljk_BBS_BH_BiasSB_HAS_SAV_UserArgs_MT256x160x64_MI16x16x1_CMS_SN_LDSB0_AFC1_AG0_AFEM1_AFEM1_ASEM1_CLR0_CADS0_DTLA1_DTLB1_DTVA0_DTVB0_DTVMXSA0_DTVMXSB0_DTVSM0_DPLB0_EPS0_ELFLR0_EMLL0_FDSI0_GRPM1_GRVWA8_GRVWB8_GSU0_GSUAMB_GSUC0_GSUWGMRR0_GLS0_ISA950_IU1_K1_LDSTI0_LBSPPA1024_LBSPPB1024_LBSPPM0_LPA16_LPB32_LPM0_LRVW8_LWPMn1_MIAV0_MIWT8_5_MO40_MGRIPM1_NTn1_NTA4_NTB0_NTC4_NTD0_NTM0_NEPBS16_NLCA1_NLCB1_ONLL1_PGR2_PLR1_PKA1_SGROB1_SIA3_SS1_SU0_SUM0_SUS128_SPO0_SRVW0_SSO0_SVW8_SK3_SKFTR0_SKXCCM0_SGRO0_TDMI0_TIN0_TLDS1_TLDSMn1_ULSGRO0_USL1_UIOFGRO0_UPLRP0_USFGRO0_VSn1_VWA8_VWB1_WSGRA0_WSGRB0_WS64_WG32_8_1_WGM6_WGMXCC2_WGMXCCGn1
    SolutionIndex: 96
    SolutionNameMin: Cijk_Alik_Bljk_BBS_BH_BiasSB_HAS_SAV_UserArgs_MT256x224x64_MI16x16x1_CMS_SN_LDSB0_AFC1_AG0_AFEM1_AFEM1_ASEM1_CLR1_CADS0_DTLA1_DTLB1_DTVA0_DTVB0_DTVMXSA0_DTVMXSB0_DTVSM0_DPLB0_EPS0_ELFLR0_EMLLn1_FDSI0_GRPM1_GRVWA8_GRVWB8_GSU0_GSUAMB_GSUC0_GSUWGMRR0_GLS0_ISA950_IU1_K1_LDSTI1_LBSPPA1024_LBSPPB1024_LBSPPM0_LPA16_LPB32_LPM0_LRVW8_LWPMn1_MIAV0_MIWT8_7_MO40_MGRIPM1_NTn1_NTA4_NTB0_NTC0_NTD0_NTM0_NEPBS14_NLCA1_NLCB1_ONLL1_PGR2_PLR1_PKA1_SGROB1_SIA3_SS1_SU8_SUM0_SUS256_SPO1_SRVW0_SSO0_SVW8_SK3_SKFTR0_SKXCCM4_SGRO0_TDMI0_TIN0_TLDS1_TLDSMn1_ULSGRO0_USL1_UIOFGRO0_UPLRP0_USFGRO0_VSn1_VWA8_VWB1_WSGRA0_WSGRB0_WS64_WG32_8_1_WGMn48_WGMXCC1_WGMXCCGn1
    SolutionIndex: 97
    SolutionNameMin: Cijk_Alik_Bljk_BBS_BH_BiasSB_HAS_SAV_UserArgs_MT256x192x64_MI16x16x1_CMS_SN_LDSB0_AFC1_AG1_AFEM1_AFEM1_ASEM1_CLR0_CADS0_DTLA1_DTLB1_DTVA0_DTVB0_DTVMXSA0_DTVMXSB0_DTVSM0_DPLB0_EPS0_ELFLR0_EMLLn1_FDSI0_GRPM1_GRVWA8_GRVWB8_GSU0_GSUAMB_GSUC0_GSUWGMRR0_GLS0_ISA950_IU1_K1_LDSTI0_LBSPPA1024_LBSPPB1024_LBSPPM0_LPA16_LPB32_LPM0_LRVW8_LWPMn1_MIAV0_MIWT8_6_MO40_MGRIPM1_NTn1_NTA0_NTB0_NTC4_NTD0_NTM0_NEPBS8_NLCA1_NLCB1_ONLL1_PGR2_PLR1_PKA1_SGROB0_SIA3_SS1_SU8_SUM0_SUS128_SPO1_SRVW0_SSO0_SVW8_SK3_SKFTR0_SKXCCM0_SGRO0_TDMI0_TIN0_TLDS1_TLDSMn1_ULSGRO0_USL1_UIOFGRO0_UPLRP0_USFGRO0_VSn1_VWA8_VWB2_WSGRA0_WSGRB0_WS64_WG32_8_1_WGM6_WGMXCC4_WGMXCCGn1
    SolutionIndex: 98
    SolutionNameMin: Cijk_Alik_Bljk_BBS_BH_BiasSB_HAS_SAV_UserArgs_MT256x224x64_MI16x16x1_CMS_SN_LDSB0_AFC1_AG1_AFEM1_AFEM1_ASEM1_CLR1_CADS0_DTLA1_DTLB1_DTVA0_DTVB0_DTVMXSA0_DTVMXSB0_DTVSM0_DPLB0_EPS0_ELFLR0_EMLLn1_FDSI0_GRPM1_GRVWA8_GRVWB8_GSU0_GSUAMB_GSUC0_GSUWGMRR0_GLS0_ISA950_IU1_K1_LDSTI1_LBSPPA1024_LBSPPB1024_LBSPPM0_LPA16_LPB32_LPM0_LRVW8_LWPMn1_MIAV0_MIWT8_7_MO40_MGRIPM1_NTn1_NTA4_NTB0_NTC0_NTD0_NTM0_NEPBS8_NLCA1_NLCB1_ONLL1_PGR2_PLR1_PKA1_SGROB1_SIA3_SS1_SU0_SUM0_SUS128_SPO0_SRVW0_SSO0_SVW8_SK3_SKFTR0_SKXCCM0_SGRO0_TDMI0_TIN0_TLDS1_TLDSMn1_ULSGRO0_USL1_UIOFGRO0_UPLRP0_USFGRO0_VSn1_VWA8_VWB1_WSGRA0_WSGRB0_WS64_WG32_8_1_WGMn1_WGMXCC1_WGMXCCGn1
    SolutionIndex: 99
    SolutionNameMin: Cijk_Alik_Bljk_BBS_BH_BiasSB_HAS_SAV_UserArgs_MT256x224x64_MI16x16x1_CMS_SN_LDSB0_AFC1_AG1_AFEM1_AFEM1_ASEM1_CLR1_CADS0_DTLA1_DTLB1_DTVA0_DTVB0_DTVMXSA0_DTVMXSB0_DTVSM0_DPLB0_EPS0_ELFLR0_EMLL0_FDSI0_GRPM1_GRVWA8_GRVWB8_GSU0_GSUAMB_GSUC0_GSUWGMRR0_GLS0_ISA950_IU1_K1_LDSTI0_LBSPPA1024_LBSPPB1024_LBSPPM0_LPA16_LPB32_LPM0_LRVW8_LWPMn1_MIAV0_MIWT8_7_MO40_MGRIPM1_NTn1_NTA4_NTB0_NTC0_NTD0_NTM0_NEPBS8_NLCA1_NLCB1_ONLL1_PGR2_PLR1_PKA1_SGROB0_SIA3_SS1_SU16_SUM0_SUS512_SPO1_SRVW0_SSO0_SVW8_SK3_SKFTR0_SKXCCM4_SGRO0_TDMI0_TIN0_TLDS1_TLDSMn1_ULSGRO0_USL1_UIOFGRO0_UPLRP0_USFGRO0_VSn1_VWA8_VWB1_WSGRA0_WSGRB0_WS64_WG32_8_1_WGM16_WGMXCC32_WGMXCCGn1
    SolutionIndex: 100
    SolutionNameMin: Cijk_Alik_Bljk_BBS_BH_BiasSB_HAS_SAV_UserArgs_MT256x224x64_MI16x16x1_CMS_SN_LDSB0_AFC1_AG0_AFEM1_AFEM1_ASEM1_CLR1_CADS0_DTLA1_DTLB1_DTVA0_DTVB0_DTVMXSA0_DTVMXSB0_DTVSM0_DPLB0_EPS0_ELFLR0_EMLL0_FDSI0_GRPM1_GRVWA8_GRVWB8_GSU0_GSUAMB_GSUC0_GSUWGMRR0_GLS0_ISA950_IU1_K1_LDSTI0_LBSPPA1024_LBSPPB1024_LBSPPM0_LPA16_LPB32_LPM0_LRVW8_LWPMn1_MIAV0_MIWT8_7_MO40_MGRIPM1_NTn1_NTA4_NTB0_NTC0_NTD0_NTM0_NEPBS12_NLCA1_NLCB1_ONLL1_PGR2_PLR1_PKA1_SGROB0_SIA3_SS1_SU16_SUM0_SUS128_SPO1_SRVW0_SSO0_SVW8_SK3_SKFTR0_SKXCCM0_SGRO0_TDMI0_TIN0_TLDS1_TLDSMn1_ULSGRO0_USL1_UIOFGRO0_UPLRP0_USFGRO0_VSn1_VWA8_VWB1_WSGRA0_WSGRB0_WS64_WG32_8_1_WGMn6_WGMXCC1_WGMXCCGn1
    SolutionIndex: 101
    SolutionNameMin: Cijk_Alik_Bljk_BBS_BH_BiasSB_HAS_SAV_UserArgs_MT256x256x64_MI16x16x1_CMS_SN_LDSB0_AFC1_AG0_AFEM1_AFEM1_ASEM1_CLR0_CADS0_DTLA1_DTLB1_DTVA0_DTVB0_DTVMXSA0_DTVMXSB0_DTVSM0_DPLB0_EPS0_ELFLR0_EMLLn1_FDSI0_GRPM1_GRVWA8_GRVWB8_GSU0_GSUAMB_GSUC0_GSUWGMRR0_GLS0_ISA950_IU1_K1_LDSTI0_LBSPPA1024_LBSPPB1024_LBSPPM0_LPA16_LPB16_LPM0_LRVW8_LWPMn1_MIAV0_MIWT8_8_MO40_MGRIPM1_NTn1_NTA0_NTB0_NTC0_NTD0_NTM0_NEPBS16_NLCA1_NLCB1_ONLL1_PGR2_PLR1_PKA1_SGROB1_SIA3_SS0_SU16_SUM0_SUS512_SPO1_SRVW0_SSO0_SVW4_SK3_SKFTR0_SKXCCM4_SGRO0_TDMI0_TIN0_TLDS1_TLDSMn1_ULSGRO0_USL1_UIOFGRO0_UPLRP0_USFGRO0_VSn1_VWA8_VWB8_WSGRA0_WSGRB0_WS64_WG32_8_1_WGMn1_WGMXCC4_WGMXCCGn1
    SolutionIndex: 102
    SolutionNameMin: Cijk_Alik_Bljk_BBS_BH_BiasSB_HAS_SAV_UserArgs_MT384x160x64_MI16x16x1_SN_LDSB0_AFC1_AG1_AFEM1_AFEM1_ASEM1_CLR1_CADS0_DTLA1_DTLB1_DTVA0_DTVB0_DTVMXSA0_DTVMXSB0_DTVSM0_DPLB0_EPS0_ELFLR0_EMLL0_FDSI0_GRPM1_GRVWA8_GRVWB8_GSU0_GSUAMB_GSUC0_GSUWGMRR0_GLS0_ISA950_IU1_K1_LDSTI0_LBSPPA1024_LBSPPB1024_LBSPPM0_LPA32_LPB32_LPM0_LRVWn1_LWPMn1_MIAV0_MIWT12_5_MO40_MGRIPM1_NTn1_NTA4_NTB0_NTC0_NTD4_NTM0_NEPBS14_NLCA1_NLCB1_ONLL1_PGR2_PLR1_PKA1_SGROB1_SIA3_SS1_SU0_SUM0_SUS0_SPO0_SRVW0_SSO0_SVW4_SK3_SKFTR0_SKXCCM0_SGRO0_TDMI0_TIN1_TLDS2_TLDSMn1_ULSGRO1_USL1_UIOFGRO0_UPLRP0_USFGRO0_VSn1_VWA4_VWB1_WSGRA0_WSGRB0_WS64_WG32_8_1_WGM0_WGMXCC4_WGMXCCGn1
    SolutionIndex: 103
    SolutionNameMin: Cijk_Alik_Bljk_BBS_BH_BiasSB_HAS_SAV_UserArgs_MT352x192x64_MI16x16x1_CMS_SN_LDSB0_AFC1_AG1_AFEM1_AFEM1_ASEM1_CLR1_CADS0_DTLA1_DTLB1_DTVA0_DTVB0_DTVMXSA0_DTVMXSB0_DTVSM0_DPLB0_EPS0_ELFLR0_EMLLn1_FDSI0_GRPM1_GRVWA8_GRVWB8_GSU0_GSUAMB_GSUC0_GSUWGMRR0_GLS0_ISA950_IU1_K1_LDSTI0_LBSPPA1024_LBSPPB1024_LBSPPM0_LPA32_LPB32_LPM0_LRVW8_LWPMn1_MIAV0_MIWT11_6_MO40_MGRIPM1_NTn1_NTA4_NTB0_NTC0_NTD0_NTM0_NEPBS8_NLCA1_NLCB1_ONLL1_PGR2_PLR1_PKA1_SGROB1_SIA3_SS0_SU16_SUM0_SUS512_SPO1_SRVW0_SSO0_SVW4_SK3_SKFTR0_SKXCCM4_SGRO0_TDMI0_TIN0_TLDS1_TLDSMn1_ULSGRO0_USL1_UIOFGRO0_UPLRP0_USFGRO0_VSn1_VWA1_VWB2_WSGRA0_WSGRB0_WS64_WG32_8_1_WGMn1_WGMXCC16_WGMXCCGn1
    SolutionIndex: 104
    SolutionNameMin: Cijk_Alik_Bljk_BBS_BH_BiasSB_HAS_SAV_UserArgs_MT352x192x64_MI16x16x1_CMS_SN_LDSB0_AFC1_AG1_AFEM1_AFEM1_ASEM1_CLR0_CADS0_DTLA1_DTLB1_DTVA0_DTVB0_DTVMXSA0_DTVMXSB0_DTVSM0_DPLB0_EPS0_ELFLR0_EMLLn1_FDSI0_GRPM1_GRVWA8_GRVWB8_GSU0_GSUAMB_GSUC0_GSUWGMRR0_GLS0_ISA950_IU1_K1_LDSTI0_LBSPPA1024_LBSPPB1024_LBSPPM0_LPA32_LPB32_LPM0_LRVW8_LWPMn1_MIAV0_MIWT11_6_MO40_MGRIPM1_NTn1_NTA4_NTB0_NTC0_NTD0_NTM0_NEPBS4_NLCA1_NLCB1_ONLL1_PGR2_PLR1_PKA1_SGROB0_SIA3_SS0_SU8_SUM0_SUS512_SPO0_SRVW0_SSO0_SVW4_SK3_SKFTR0_SKXCCM0_SGRO0_TDMI0_TIN0_TLDS1_TLDSMn1_ULSGRO0_USL1_UIOFGRO0_UPLRP0_USFGRO0_VSn1_VWA1_VWB2_WSGRA0_WSGRB0_WS64_WG32_8_1_WGM6_WGMXCC4_WGMXCCGn1
    SolutionIndex: 105
    SolutionNameMin: Cijk_Alik_Bljk_BBS_BH_BiasSB_HAS_SAV_UserArgs_MT384x160x64_MI16x16x1_SN_LDSB0_AFC1_AG0_AFEM1_AFEM1_ASEM1_CLR1_CADS0_DTLA0_DTLB0_DTVA0_DTVB0_DTVMXSA0_DTVMXSB0_DTVSM0_DPLB0_EPS0_ELFLR0_EMLLn1_FDSI0_GRPM1_GRVWA8_GRVWB8_GSU0_GSUAMB_GSUC0_GSUWGMRR0_GLS0_ISA950_IU1_K1_LDSTI0_LBSPPA512_LBSPPB128_LBSPPM0_LPA16_LPB16_LPM0_LRVWn1_LWPMn1_MIAV0_MIWT12_5_MO40_MGRIPM1_NTn1_NTA4_NTB0_NTC0_NTD4_NTM0_NEPBS12_NLCA1_NLCB1_ONLL1_PGR2_PLR1_PKA1_SGROB0_SIA3_SS1_SU0_SUM0_SUS0_SPO0_SRVW0_SSO0_SVW4_SK3_SKFTR0_SKXCCM8_SGRO0_TDMI0_TIN1_TLDS1_TLDSMn1_ULSGRO1_USL1_UIOFGRO0_UPLRP0_USFGRO0_VSn1_VWA4_VWB1_WSGRA2_WSGRB0_WS64_WG32_8_1_WGMn16_WGMXCC4_WGMXCCGn1
    SolutionIndex: 106
    SolutionNameMin: Cijk_Alik_Bljk_BBS_BH_BiasSB_HAS_SAV_UserArgs_MT256x224x64_MI16x16x1_CMS_SN_LDSB0_AFC1_AG0_AFEM1_AFEM1_ASEM1_CLR1_CADS0_DTLA1_DTLB1_DTVA0_DTVB0_DTVMXSA0_DTVMXSB0_DTVSM0_DPLB0_EPS0_ELFLR0_EMLLn1_FDSI0_GRPM1_GRVWA8_GRVWB8_GSU0_GSUAMB_GSUC0_GSUWGMRR0_GLS0_ISA950_IU1_K1_LDSTI1_LBSPPA1024_LBSPPB1024_LBSPPM0_LPA16_LPB32_LPM0_LRVW8_LWPMn1_MIAV0_MIWT8_7_MO40_MGRIPM1_NTn1_NTA4_NTB0_NTC0_NTD0_NTM0_NEPBS0_NLCA1_NLCB1_ONLL1_PGR2_PLR1_PKA1_SGROB0_SIA3_SS0_SU8_SUM0_SUS512_SPO1_SRVW0_SSO0_SVW4_SK3_SKFTR0_SKXCCM0_SGRO0_TDMI0_TIN0_TLDS1_TLDSMn1_ULSGRO0_USL1_UIOFGRO0_UPLRP0_USFGRO0_VSn1_VWA8_VWB1_WSGRA0_WSGRB0_WS64_WG32_8_1_WGMn4_WGMXCC2_WGMXCCGn1
    SolutionIndex: 107
    SolutionNameMin: Cijk_Alik_Bljk_BBS_BH_BiasSB_HAS_SAV_UserArgs_MT256x224x64_MI16x16x1_CMS_SN_LDSB0_AFC1_AG0_AFEM1_AFEM1_ASEM1_CLR0_CADS0_DTLA1_DTLB1_DTVA0_DTVB0_DTVMXSA0_DTVMXSB0_DTVSM0_DPLB0_EPS0_ELFLR0_EMLLn1_FDSI0_GRPM1_GRVWA8_GRVWB8_GSU0_GSUAMB_GSUC0_GSUWGMRR0_GLS0_ISA950_IU1_K1_LDSTI1_LBSPPA1024_LBSPPB1024_LBSPPM0_LPA16_LPB32_LPM0_LRVW8_LWPMn1_MIAV0_MIWT8_7_MO40_MGRIPM1_NTn1_NTA4_NTB0_NTC4_NTD0_NTM0_NEPBS12_NLCA1_NLCB1_ONLL1_PGR2_PLR1_PKA1_SGROB0_SIA3_SS1_SU8_SUM0_SUS128_SPO0_SRVW0_SSO0_SVW8_SK3_SKFTR0_SKXCCM4_SGRO0_TDMI0_TIN0_TLDS1_TLDSMn1_ULSGRO0_USL1_UIOFGRO0_UPLRP0_USFGRO0_VSn1_VWA8_VWB1_WSGRA0_WSGRB0_WS64_WG32_8_1_WGMn1_WGMXCC2_WGMXCCGn1
    SolutionIndex: 108
    SolutionNameMin: Cijk_Alik_Bljk_BBS_BH_BiasSB_HAS_SAV_UserArgs_MT224x256x64_MI16x16x1_CMS_SN_LDSB0_AFC1_AG0_AFEM1_AFEM1_ASEM1_CLR1_CADS0_DTLA1_DTLB1_DTVA0_DTVB0_DTVMXSA0_DTVMXSB0_DTVSM0_DPLB0_EPS0_ELFLR0_EMLLn1_FDSI0_GRPM1_GRVWA8_GRVWB8_GSU0_GSUAMB_GSUC0_GSUWGMRR0_GLS0_ISA950_IU1_K1_LDSTI0_LBSPPA1024_LBSPPB1024_LBSPPM0_LPA32_LPB16_LPM0_LRVW8_LWPMn1_MIAV0_MIWT7_8_MO40_MGRIPM1_NTn1_NTA4_NTB0_NTC0_NTD4_NTM0_NEPBS0_NLCA1_NLCB1_ONLL1_PGR2_PLR1_PKA1_SGROB0_SIA3_SS1_SU16_SUM0_SUS128_SPO0_SRVW0_SSO1_SVW1_SK3_SKFTR0_SKXCCM0_SGRO0_TDMI0_TIN0_TLDS1_TLDSMn1_ULSGRO0_USL1_UIOFGRO0_UPLRP0_USFGRO0_VSn1_VWA1_VWB8_WSGRA0_WSGRB0_WS64_WG32_8_1_WGM8_WGMXCC4_WGMXCCGn1
    SolutionIndex: 109
    SolutionNameMin: Cijk_Alik_Bljk_BBS_BH_BiasSB_HAS_SAV_UserArgs_MT192x320x64_MI16x16x1_CMS_SN_LDSB0_AFC1_AG1_AFEM1_AFEM1_ASEM1_CLR0_CADS0_DTLA1_DTLB1_DTVA0_DTVB0_DTVMXSA0_DTVMXSB0_DTVSM0_DPLB0_EPS0_ELFLR0_EMLL0_FDSI0_GRPM1_GRVWA8_GRVWB8_GSU0_GSUAMB_GSUC0_GSUWGMRR0_GLS0_ISA950_IU1_K1_LDSTI0_LBSPPA1024_LBSPPB1024_LBSPPM0_LPA32_LPB32_LPM0_LRVW8_LWPMn1_MIAV0_MIWT6_10_MO40_MGRIPM1_NTn1_NTA4_NTB0_NTC0_NTD0_NTM0_NEPBS12_NLCA1_NLCB1_ONLL1_PGR2_PLR1_PKA1_SGROB1_SIA3_SS1_SU0_SUM0_SUS128_SPO0_SRVW0_SSO0_SVW2_SK3_SKFTR0_SKXCCM0_SGRO0_TDMI0_TIN0_TLDS1_TLDSMn1_ULSGRO0_USL1_UIOFGRO0_UPLRP0_USFGRO0_VSn1_VWA2_VWB2_WSGRA0_WSGRB0_WS64_WG32_8_1_WGM2_WGMXCC4_WGMXCCGn1
    SolutionIndex: 110
    SolutionNameMin: Cijk_Alik_Bljk_BBS_BH_BiasSB_HAS_SAV_UserArgs_MT224x320x64_MI16x16x1_CMS_SN_LDSB0_AFC1_AG0_AFEM1_AFEM1_ASEM1_CLR0_CADS0_DTLA1_DTLB1_DTVA0_DTVB0_DTVMXSA0_DTVMXSB0_DTVSM0_DPLB0_EPS0_ELFLR0_EMLL0_FDSI0_GRPM1_GRVWA8_GRVWB8_GSU0_GSUAMB_GSUC0_GSUWGMRR0_GLS0_ISA950_IU1_K1_LDSTI1_LBSPPA1024_LBSPPB1024_LBSPPM0_LPA32_LPB32_LPM0_LRVW8_LWPMn1_MIAV0_MIWT7_10_MO40_MGRIPM1_NTn1_NTA4_NTB0_NTC0_NTD0_NTM0_NEPBS4_NLCA1_NLCB1_ONLL1_PGR2_PLR1_PKA1_SGROB0_SIA3_SS1_SU16_SUM0_SUS256_SPO1_SRVW0_SSO0_SVW1_SK3_SKFTR0_SKXCCM4_SGRO0_TDMI0_TIN0_TLDS1_TLDSMn1_ULSGRO0_USL1_UIOFGRO0_UPLRP0_USFGRO0_VSn1_VWA1_VWB2_WSGRA0_WSGRB0_WS64_WG32_8_1_WGM6_WGMXCC1_WGMXCCGn1
    SolutionIndex: 111
    SolutionNameMin: Cijk_Alik_Bljk_BBS_BH_BiasSB_HAS_SAV_UserArgs_MT192x128x64_MI16x16x1_CMS_SN_LDSB0_AFC1_AG0_AFEM1_AFEM1_ASEM1_CLR1_CADS0_DTLA1_DTLB1_DTVA0_DTVB0_DTVMXSA0_DTVMXSB0_DTVSM0_DPLB0_EPS0_ELFLR0_EMLLn1_FDSI0_GRPM1_GRVWA8_GRVWB8_GSU0_GSUAMB_GSUC0_GSUWGMRR0_GLS0_ISA950_IU1_K1_LDSTI0_LBSPPA1024_LBSPPB1024_LBSPPM0_LPA32_LPB32_LPM0_LRVW8_LWPMn1_MIAV0_MIWT6_4_MO40_MGRIPM1_NTn1_NTA4_NTB0_NTC0_NTD4_NTM0_NEPBS16_NLCA1_NLCB1_ONLL1_PGR2_PLR1_PKA1_SGROB0_SIA3_SS0_SU16_SUM0_SUS512_SPO0_SRVW0_SSO1_SVW8_SK3_SKFTR0_SKXCCM0_SGRO0_TDMI0_TIN0_TLDS1_TLDSMn1_ULSGRO0_USL1_UIOFGRO0_UPLRP0_USFGRO0_VSn1_VWA2_VWB4_WSGRA0_WSGRB0_WS64_WG32_8_1_WGM6_WGMXCC1_WGMXCCGn1
    SolutionIndex: 112
    SolutionNameMin: Cijk_Alik_Bljk_BBS_BH_BiasSB_HAS_SAV_UserArgs_MT384x128x64_MI16x16x1_SN_LDSB0_AFC1_AG0_AFEM1_AFEM1_ASEM1_CLR1_CADS0_DTLA1_DTLB1_DTVA0_DTVB0_DTVMXSA0_DTVMXSB0_DTVSM0_DPLB0_EPS0_ELFLR0_EMLLn1_FDSI0_GRPM1_GRVWA8_GRVWB8_GSU0_GSUAMB_GSUC0_GSUWGMRR0_GLS0_ISA950_IU1_K1_LDSTI0_LBSPPA1024_LBSPPB1024_LBSPPM0_LPA32_LPB16_LPM0_LRVWn1_LWPMn1_MIAV0_MIWT6_8_MO40_MGRIPM1_NTn1_NTA4_NTB0_NTC0_NTD0_NTM0_NEPBS14_NLCA1_NLCB1_ONLL1_PGR2_PLR1_PKA1_SGROB1_SIA3_SS0_SU0_SUM0_SUS0_SPO1_SRVW0_SSO0_SVW8_SK3_SKFTR0_SKXCCM0_SGRO0_TDMI0_TIN1_TLDS1_TLDSMn1_ULSGRO0_USL1_UIOFGRO0_UPLRP0_USFGRO0_VSn1_VWA2_VWB8_WSGRA0_WSGRB0_WS64_WG64_4_1_WGM32_WGMXCC32_WGMXCCGn1
    SolutionIndex: 113
    SolutionNameMin: Cijk_Alik_Bljk_BBS_BH_BiasSB_HAS_SAV_UserArgs_MT384x112x64_MI16x16x1_SN_LDSB0_AFC1_AG0_AFEM1_AFEM1_ASEM1_CLR0_CADS0_DTLA0_DTLB0_DTVA0_DTVB0_DTVMXSA0_DTVMXSB0_DTVSM0_DPLB0_EPS0_ELFLR0_EMLLn1_FDSI0_GRPM1_GRVWA8_GRVWB4_GSU0_GSUAMB_GSUC0_GSUWGMRR0_GLS0_ISA950_IU1_K1_LDSTI0_LBSPPA256_LBSPPB128_LBSPPM0_LPA16_LPB16_LPM0_LRVWn1_LWPMn1_MIAV0_MIWT6_7_MO40_MGRIPM1_NTn1_NTA4_NTB0_NTC0_NTD0_NTM0_NEPBS14_NLCA1_NLCB1_ONLL1_PGR2_PLR1_PKA1_SGROB0_SIA3_SS0_SU16_SUM0_SUS512_SPO0_SRVW0_SSO1_SVW8_SK3_SKFTR0_SKXCCM4_SGRO0_TDMI0_TIN0_TLDS1_TLDSMn1_ULSGRO0_USL1_UIOFGRO0_UPLRP0_USFGRO0_VSn1_VWA2_VWB1_WSGRA2_WSGRB0_WS64_WG64_4_1_WGM4_WGMXCC1_WGMXCCGn1
    SolutionIndex: 114
    SolutionNameMin: Cijk_Alik_Bljk_BBS_BH_BiasSB_HAS_SAV_UserArgs_MT384x128x64_MI16x16x1_SN_LDSB0_AFC1_AG0_AFEM1_AFEM1_ASEM1_CLR1_CADS0_DTLA0_DTLB0_DTVA0_DTVB0_DTVMXSA0_DTVMXSB0_DTVSM0_DPLB0_EPS0_ELFLR0_EMLLn1_FDSI0_GRPM1_GRVWA8_GRVWB8_GSU0_GSUAMB_GSUC0_GSUWGMRR0_GLS0_ISA950_IU1_K1_LDSTI0_LBSPPA512_LBSPPB512_LBSPPM0_LPA16_LPB16_LPM0_LRVWn1_LWPMn1_MIAV0_MIWT12_4_MO40_MGRIPM1_NTn1_NTA4_NTB0_NTC0_NTD4_NTM0_NEPBS12_NLCA1_NLCB1_ONLL1_PGR2_PLR1_PKA1_SGROB0_SIA3_SS1_SU0_SUM0_SUS0_SPO1_SRVW0_SSO0_SVW4_SK3_SKFTR0_SKXCCM0_SGRO0_TDMI0_TIN1_TLDS1_TLDSMn1_ULSGRO0_USL1_UIOFGRO0_UPLRP0_USFGRO1_VSn1_VWA4_VWB4_WSGRA2_WSGRB2_WS64_WG32_8_1_WGMn48_WGMXCC1_WGMXCCGn1
    SolutionIndex: 115
    SolutionNameMin: Cijk_Alik_Bljk_BBS_BH_BiasSB_HAS_SAV_UserArgs_MT384x96x64_MI16x16x1_SN_LDSB0_AFC1_AG1_AFEM1_AFEM1_ASEM1_CLR1_CADS0_DTLA0_DTLB0_DTVA0_DTVB0_DTVMXSA0_DTVMXSB0_DTVSM0_DPLB0_EPS0_ELFLR0_EMLLn1_FDSI0_GRPM1_GRVWA8_GRVWB8_GSU0_GSUAMB_GSUC0_GSUWGMRR0_GLS0_ISA950_IU1_K1_LDSTI0_LBSPPA256_LBSPPB256_LBSPPM0_LPA16_LPB16_LPM0_LRVWn1_LWPMn1_MIAV0_MIWT6_6_MO40_MGRIPM1_NTn1_NTA4_NTB0_NTC0_NTD0_NTM0_NEPBS8_NLCA1_NLCB1_ONLL1_PGR2_PLR1_PKA1_SGROB0_SIA3_SS0_SU0_SUM0_SUS0_SPO0_SRVW0_SSO0_SVW8_SK3_SKFTR0_SKXCCM4_SGRO0_TDMI0_TIN1_TLDS1_TLDSMn1_ULSGRO0_USL1_UIOFGRO0_UPLRP0_USFGRO1_VSn1_VWA2_VWB2_WSGRA2_WSGRB0_WS64_WG64_4_1_WGMn8_WGMXCC1_WGMXCCGn1
    SolutionIndex: 116
    SolutionNameMin: Cijk_Alik_Bljk_BBS_BH_BiasSB_HAS_SAV_UserArgs_MT192x128x64_MI16x16x1_CMS_SN_LDSB0_AFC1_AG1_AFEM1_AFEM1_ASEM1_CLR1_CADS0_DTLA1_DTLB1_DTVA0_DTVB0_DTVMXSA0_DTVMXSB0_DTVSM0_DPLB0_EPS0_ELFLR0_EMLL0_FDSI0_GRPM1_GRVWA8_GRVWB8_GSU0_GSUAMB_GSUC0_GSUWGMRR0_GLS0_ISA950_IU1_K1_LDSTI0_LBSPPA1024_LBSPPB1024_LBSPPM0_LPA32_LPB32_LPM0_LRVW8_LWPMn1_MIAV0_MIWT6_4_MO40_MGRIPM1_NTn1_NTA4_NTB0_NTC0_NTD4_NTM0_NEPBS12_NLCA1_NLCB1_ONLL1_PGR2_PLR1_PKA1_SGROB1_SIA3_SS0_SU16_SUM0_SUS512_SPO0_SRVW0_SSO0_SVW8_SK3_SKFTR0_SKXCCM0_SGRO0_TDMI0_TIN0_TLDS1_TLDSMn1_ULSGRO0_USL1_UIOFGRO0_UPLRP0_USFGRO0_VSn1_VWA2_VWB4_WSGRA0_WSGRB0_WS64_WG32_8_1_WGMn1_WGMXCC1_WGMXCCGn1
    SolutionIndex: 117
    SolutionNameMin: Cijk_Alik_Bljk_BBS_BH_BiasSB_HAS_SAV_UserArgs_MT256x256x64_MI16x16x1_CMS_SN_LDSB0_AFC1_AG0_AFEM1_AFEM1_ASEM1_CLR0_CADS0_DTLA1_DTLB1_DTVA0_DTVB0_DTVMXSA0_DTVMXSB0_DTVSM0_DPLB0_EPS0_ELFLR0_EMLLn1_FDSI0_GRPM1_GRVWA8_GRVWB8_GSU0_GSUAMB_GSUC0_GSUWGMRR0_GLS0_ISA950_IU1_K1_LDSTI0_LBSPPA1024_LBSPPB1024_LBSPPM0_LPA16_LPB16_LPM0_LRVW8_LWPMn1_MIAV0_MIWT8_8_MO40_MGRIPM1_NTn1_NTA4_NTB0_NTC0_NTD4_NTM0_NEPBS10_NLCA1_NLCB1_ONLL1_PGR2_PLR1_PKA1_SGROB1_SIA3_SS1_SU8_SUM0_SUS128_SPO1_SRVW0_SSO0_SVW8_SK3_SKFTR0_SKXCCM0_SGRO0_TDMI0_TIN0_TLDS1_TLDSMn1_ULSGRO0_USL1_UIOFGRO0_UPLRP0_USFGRO0_VSn1_VWA8_VWB8_WSGRA0_WSGRB0_WS64_WG32_8_1_WGM32_WGMXCC32_WGMXCCGn1
    SolutionIndex: 118
    SolutionNameMin: Cijk_Alik_Bljk_BBS_BH_BiasSB_HAS_SAV_UserArgs_MT384x48x64_MI16x16x1_SN_LDSB0_AFC1_AG1_AFEM1_AFEM1_ASEM1_CLR0_CADS0_DTLA0_DTLB0_DTVA0_DTVB0_DTVMXSA0_DTVMXSB0_DTVSM0_DPLB0_EPS0_ELFLR0_EMLLn1_FDSI0_GRPM1_GRVWA4_GRVWB4_GSU0_GSUAMB_GSUC0_GSUWGMRR0_GLS0_ISA950_IU1_K1_LDSTI0_LBSPPA256_LBSPPB128_LBSPPM0_LPA16_LPB16_LPM0_LRVWn1_LWPMn1_MIAV0_MIWT6_3_MO40_MGRIPM1_NTn1_NTA4_NTB0_NTC0_NTD0_NTM0_NEPBS8_NLCA1_NLCB1_ONLL1_PGR2_PLR1_PKA1_SGROB0_SIA3_SS0_SU16_SUM0_SUS128_SPO0_SRVW0_SSO0_SVW8_SK3_SKFTR0_SKXCCM8_SGRO0_TDMI0_TIN0_TLDS1_TLDSMn1_ULSGRO0_USL1_UIOFGRO0_UPLRP0_USFGRO0_VSn1_VWA2_VWB1_WSGRA2_WSGRB0_WS64_WG64_4_1_WGM48_WGMXCC1_WGMXCCGn1
    SolutionIndex: 119
    SolutionNameMin: Cijk_Alik_Bljk_BBS_BH_BiasSB_HAS_SAV_UserArgs_MT384x64x64_MI16x16x1_SN_LDSB0_AFC1_AG1_AFEM1_AFEM1_ASEM1_CLR0_CADS0_DTLA0_DTLB0_DTVA0_DTVB0_DTVMXSA0_DTVMXSB0_DTVSM0_DPLB0_EPS0_ELFLR0_EMLLn1_FDSI0_GRPM1_GRVWA4_GRVWB8_GSU0_GSUAMB_GSUC0_GSUWGMRR0_GLS0_ISA950_IU1_K1_LDSTI0_LBSPPA256_LBSPPB512_LBSPPM0_LPA16_LPB16_LPM0_LRVWn1_LWPMn1_MIAV0_MIWT6_4_MO40_MGRIPM1_NTn1_NTA4_NTB0_NTC0_NTD0_NTM0_NEPBS10_NLCA1_NLCB1_ONLL1_PGR2_PLR1_PKA1_SGROB0_SIA3_SS0_SU8_SUM0_SUS256_SPO1_SRVW0_SSO1_SVW8_SK3_SKFTR0_SKXCCM4_SGRO0_TDMI0_TIN0_TLDS1_TLDSMn1_ULSGRO0_USL1_UIOFGRO0_UPLRP0_USFGRO0_VSn1_VWA2_VWB4_WSGRA2_WSGRB0_WS64_WG64_4_1_WGM4_WGMXCC1_WGMXCCGn1
    SolutionIndex: 120
    SolutionNameMin: Cijk_Alik_Bljk_BBS_BH_BiasSB_HAS_SAV_UserArgs_MT384x64x64_MI32x32x1_SN_LDSB0_AFC1_AG0_AFEM1_AFEM1_ASEM1_CLR0_CADS0_DTLA0_DTLB0_DTVA0_DTVB0_DTVMXSA0_DTVMXSB0_DTVSM0_DPLB0_EPS0_ELFLR0_EMLL0_FDSI0_GRPM1_GRVWA8_GRVWB8_GSU0_GSUAMB_GSUC0_GSUWGMRR0_GLS0_ISA950_IU1_K1_LDSTI0_LBSPPA256_LBSPPB128_LBSPPM0_LPA8_LPB8_LPM0_LRVWn1_LWPMn1_MIAV0_MIWT6_1_MO40_MGRIPM1_NTn1_NTA4_NTB0_NTC0_NTD0_NTM0_NEPBS14_NLCA1_NLCB1_ONLL1_PGR2_PLR1_PKA1_SGROB0_SIA3_SS0_SU8_SUM0_SUS256_SPO0_SRVW0_SSO1_SVW8_SK3_SKFTR0_SKXCCM0_SGRO0_TDMI0_TIN0_TLDS1_TLDSMn1_ULSGRO0_USL1_UIOFGRO0_UPLRP0_USFGRO1_VSn1_VWA2_VWB1_WSGRA2_WSGRB2_WS64_WG64_4_1_WGMn8_WGMXCC1_WGMXCCGn1
    SolutionIndex: 121
    SolutionNameMin: Cijk_Alik_Bljk_BBS_BH_BiasSB_HAS_SAV_UserArgs_MT384x32x64_MI16x16x1_SN_LDSB0_AFC1_AG0_AFEM1_AFEM1_ASEM1_CLR1_CADS0_DTLA0_DTLB0_DTVA0_DTVB0_DTVMXSA0_DTVMXSB0_DTVSM0_DPLB0_EPS0_ELFLR0_EMLLn1_FDSI0_GRPM1_GRVWA4_GRVWB4_GSU0_GSUAMB_GSUC0_GSUWGMRR0_GLS0_ISA950_IU1_K1_LDSTI0_LBSPPA256_LBSPPB256_LBSPPM0_LPA16_LPB16_LPM0_LRVWn1_LWPMn1_MIAV0_MIWT6_2_MO40_MGRIPM1_NTn1_NTA4_NTB0_NTC0_NTD0_NTM0_NEPBS0_NLCA1_NLCB1_ONLL1_PGR2_PLR1_PKA1_SGROB0_SIA3_SS0_SU0_SUM0_SUS0_SPO1_SRVW0_SSO0_SVW8_SK3_SKFTR0_SKXCCM8_SGRO0_TDMI0_TIN1_TLDS1_TLDSMn1_ULSGRO0_USL1_UIOFGRO0_UPLRP0_USFGRO0_VSn1_VWA2_VWB2_WSGRA2_WSGRB2_WS64_WG64_4_1_WGMn4_WGMXCC2_WGMXCCGn1
    SolutionIndex: 122
    SolutionNameMin: Cijk_Alik_Bljk_BBS_BH_BiasSB_HAS_SAV_UserArgs_MT384x16x64_MI16x16x1_SN_LDSB0_AFC1_AG0_AFEM1_AFEM1_ASEM1_CLR1_CADS0_DTLA0_DTLB0_DTVA0_DTVB0_DTVMXSA0_DTVMXSB0_DTVSM0_DPLB0_EPS0_ELFLR0_EMLLn1_FDSI0_GRPM1_GRVWA4_GRVWB4_GSU0_GSUAMB_GSUC0_GSUWGMRR0_GLS0_ISA950_IU1_K1_LDSTI0_LBSPPA256_LBSPPB128_LBSPPM0_LPA16_LPB16_LPM0_LRVWn1_LWPMn1_MIAV1_MIWT6_1_MO40_MGRIPM1_NTn1_NTA4_NTB4_NTC0_NTD0_NTM0_NEPBS0_NLCA1_NLCB1_ONLL1_PGR2_PLR1_PKA1_SGROB0_SIA3_SS0_SU0_SUM0_SUS0_SPO1_SRVW0_SSO0_SVW8_SK3_SKFTR0_SKXCCM0_SGRO0_TDMI0_TIN1_TLDS1_TLDSMn1_ULSGRO1_USL1_UIOFGRO0_UPLRP0_USFGRO0_VSn1_VWA2_VWB1_WSGRA2_WSGRB2_WS64_WG64_4_1_WGMn48_WGMXCC16_WGMXCCGn1
    SolutionIndex: 123
    SolutionNameMin: Cijk_Alik_Bljk_BBS_BH_BiasSB_HAS_SAV_UserArgs_MT384x32x64_MI16x16x1_SN_LDSB0_AFC1_AG1_AFEM1_AFEM1_ASEM1_CLR1_CADS0_DTLA0_DTLB0_DTVA0_DTVB0_DTVMXSA0_DTVMXSB0_DTVSM0_DPLB0_EPS0_ELFLR0_EMLLn1_FDSI0_GRPM1_GRVWA4_GRVWB4_GSU0_GSUAMB_GSUC0_GSUWGMRR0_GLS0_ISA950_IU1_K1_LDSTI0_LBSPPA256_LBSPPB256_LBSPPM0_LPA16_LPB16_LPM0_LRVWn1_LWPMn1_MIAV0_MIWT6_2_MO40_MGRIPM1_NTn1_NTA4_NTB0_NTC0_NTD4_NTM0_NEPBS12_NLCA1_NLCB1_ONLL1_PGR2_PLR1_PKA1_SGROB0_SIA3_SS0_SU0_SUM0_SUS0_SPO0_SRVW0_SSO0_SVW8_SK3_SKFTR0_SKXCCM0_SGRO0_TDMI0_TIN1_TLDS1_TLDSMn1_ULSGRO0_USL1_UIOFGRO0_UPLRP0_USFGRO0_VSn1_VWA2_VWB2_WSGRA2_WSGRB0_WS64_WG64_4_1_WGMn32_WGMXCC4_WGMXCCGn1
    SolutionIndex: 124
    SolutionNameMin: Cijk_Alik_Bljk_BBS_BH_BiasSB_HAS_SAV_UserArgs_MT224x288x64_MI16x16x1_SN_LDSB0_AFC1_AG0_AFEM1_AFEM1_ASEM1_CLR0_CADS0_DTLA1_DTLB1_DTVA0_DTVB0_DTVMXSA0_DTVMXSB0_DTVSM0_DPLB0_EPS0_ELFLR0_EMLL0_FDSI0_GRPM1_GRVWA8_GRVWB8_GSU0_GSUAMB_GSUC0_GSUWGMRR0_GLS0_ISA950_IU1_K1_LDSTI0_LBSPPA1024_LBSPPB1024_LBSPPM0_LPA32_LPB32_LPM0_LRVWn1_LWPMn1_MIAV0_MIWT7_9_MO40_MGRIPM1_NTn1_NTA4_NTB0_NTC4_NTD0_NTM0_NEPBS4_NLCA1_NLCB1_ONLL1_PGR2_PLR1_PKA1_SGROB1_SIA3_SS1_SU0_SUM0_SUS0_SPO0_SRVW0_SSO0_SVW1_SK3_SKFTR0_SKXCCM8_SGRO0_TDMI0_TIN1_TLDS1_TLDSMn1_ULSGRO1_USL1_UIOFGRO0_UPLRP0_USFGRO0_VSn1_VWA1_VWB1_WSGRA0_WSGRB0_WS64_WG32_8_1_WGM4_WGMXCC2_WGMXCCGn1
    SolutionIndex: 125
    SolutionNameMin: Cijk_Alik_Bljk_BBS_BH_BiasSB_HAS_SAV_UserArgs_MT224x288x64_MI16x16x1_SN_LDSB0_AFC1_AG1_AFEM1_AFEM1_ASEM1_CLR1_CADS0_DTLA1_DTLB1_DTVA0_DTVB0_DTVMXSA0_DTVMXSB0_DTVSM0_DPLB0_EPS0_ELFLR0_EMLL0_FDSI0_GRPM1_GRVWA8_GRVWB8_GSU0_GSUAMB_GSUC0_GSUWGMRR0_GLS0_ISA950_IU1_K1_LDSTI0_LBSPPA1024_LBSPPB1024_LBSPPM0_LPA32_LPB32_LPM0_LRVWn1_LWPMn1_MIAV0_MIWT7_9_MO40_MGRIPM1_NTn1_NTA4_NTB0_NTC4_NTD0_NTM0_NEPBS4_NLCA1_NLCB1_ONLL1_PGR2_PLR1_PKA1_SGROB1_SIA3_SS1_SU0_SUM0_SUS0_SPO0_SRVW0_SSO0_SVW1_SK3_SKFTR0_SKXCCM4_SGRO0_TDMI0_TIN1_TLDS1_TLDSMn1_ULSGRO1_USL1_UIOFGRO0_UPLRP0_USFGRO0_VSn1_VWA1_VWB1_WSGRA0_WSGRB0_WS64_WG32_8_1_WGMn1_WGMXCC4_WGMXCCGn1
    SolutionIndex: 126
    SolutionNameMin: Cijk_Alik_Bljk_BBS_BH_BiasSB_HAS_SAV_UserArgs_MT128x256x64_MI16x16x1_SN_LDSB0_AFC1_AG1_AFEM1_AFEM1_ASEM1_CLR1_CADS0_DTLA1_DTLB1_DTVA0_DTVB0_DTVMXSA0_DTVMXSB0_DTVSM0_DPLB1_EPS0_ELFLR0_EMLLn1_FDSI0_GRPM1_GRVWA8_GRVWB8_GSU0_GSUAMB_GSUC0_GSUWGMRR0_GLS0_ISA950_IU1_K1_LDSTI0_LBSPPA1024_LBSPPB1024_LBSPPM0_LPA16_LPB32_LPM0_LRVWn1_LWPMn1_MIAV0_MIWT8_4_MO40_MGRIPM1_NTn1_NTA4_NTB0_NTC4_NTD4_NTM0_NEPBS8_NLCA1_NLCB1_ONLL1_PGR2_PLR1_PKA1_SGROB1_SIA3_SS1_SU0_SUM0_SUS0_SPO1_SRVW0_SSO0_SVW8_SK3_SKFTR0_SKXCCM8_SGRO0_TDMI0_TIN1_TLDS1_TLDSMn1_ULSGRO1_USL1_UIOFGRO0_UPLRP0_USFGRO0_VSn1_VWA8_VWB4_WSGRA0_WSGRB0_WS64_WG16_16_1_WGMn2_WGMXCC1_WGMXCCGn1
    SolutionIndex: 127
    SolutionNameMin: Cijk_Alik_Bljk_BBS_BH_BiasSB_HAS_SAV_UserArgs_MT256x160x64_MI16x16x1_CMS_SN_LDSB0_AFC1_AG1_AFEM1_AFEM1_ASEM1_CLR0_CADS0_DTLA1_DTLB1_DTVA0_DTVB0_DTVMXSA0_DTVMXSB0_DTVSM0_DPLB0_EPS0_ELFLR0_EMLL0_FDSI0_GRPM1_GRVWA8_GRVWB8_GSU0_GSUAMB_GSUC0_GSUWGMRR0_GLS0_ISA950_IU1_K1_LDSTI0_LBSPPA1024_LBSPPB1024_LBSPPM0_LPA16_LPB32_LPM0_LRVW8_LWPMn1_MIAV0_MIWT8_5_MO40_MGRIPM1_NTn1_NTA4_NTB0_NTC0_NTD4_NTM0_NEPBS8_NLCA1_NLCB1_ONLL1_PGR2_PLR1_PKA1_SGROB0_SIA3_SS1_SU8_SUM0_SUS128_SPO1_SRVW0_SSO1_SVW8_SK3_SKFTR0_SKXCCM8_SGRO0_TDMI0_TIN0_TLDS1_TLDSMn1_ULSGRO0_USL1_UIOFGRO0_UPLRP0_USFGRO0_VSn1_VWA8_VWB1_WSGRA0_WSGRB0_WS64_WG32_8_1_WGMn2_WGMXCC4_WGMXCCGn1
    SolutionIndex: 128
    SolutionNameMin: Cijk_Alik_Bljk_BBS_BH_BiasSB_HAS_SAV_UserArgs_MT256x160x64_MI16x16x1_CMS_SN_LDSB0_AFC1_AG0_AFEM1_AFEM1_ASEM1_CLR1_CADS0_DTLA1_DTLB1_DTVA0_DTVB0_DTVMXSA0_DTVMXSB0_DTVSM0_DPLB0_EPS0_ELFLR0_EMLLn1_FDSI0_GRPM1_GRVWA8_GRVWB8_GSU0_GSUAMB_GSUC0_GSUWGMRR0_GLS0_ISA950_IU1_K1_LDSTI0_LBSPPA1024_LBSPPB1024_LBSPPM0_LPA16_LPB32_LPM0_LRVW8_LWPMn1_MIAV0_MIWT8_5_MO40_MGRIPM1_NTn1_NTA4_NTB0_NTC0_NTD4_NTM0_NEPBS12_NLCA1_NLCB1_ONLL1_PGR2_PLR1_PKA1_SGROB1_SIA3_SS1_SU16_SUM0_SUS128_SPO1_SRVW0_SSO0_SVW8_SK3_SKFTR0_SKXCCM0_SGRO0_TDMI0_TIN0_TLDS1_TLDSMn1_ULSGRO0_USL1_UIOFGRO0_UPLRP0_USFGRO0_VSn1_VWA8_VWB1_WSGRA0_WSGRB0_WS64_WG32_8_1_WGM0_WGMXCC8_WGMXCCGn1
    SolutionIndex: 129
    SolutionNameMin: Cijk_Alik_Bljk_BBS_BH_BiasSB_HAS_SAV_UserArgs_MT256x160x64_MI16x16x1_CMS_SN_LDSB0_AFC1_AG1_AFEM1_AFEM1_ASEM1_CLR1_CADS0_DTLA1_DTLB1_DTVA0_DTVB0_DTVMXSA0_DTVMXSB0_DTVSM0_DPLB0_EPS0_ELFLR0_EMLLn1_FDSI0_GRPM1_GRVWA8_GRVWB8_GSU0_GSUAMB_GSUC0_GSUWGMRR0_GLS0_ISA950_IU1_K1_LDSTI0_LBSPPA1024_LBSPPB1024_LBSPPM0_LPA16_LPB32_LPM0_LRVW8_LWPMn1_MIAV0_MIWT8_5_MO40_MGRIPM1_NTn1_NTA4_NTB0_NTC0_NTD4_NTM0_NEPBS16_NLCA1_NLCB1_ONLL1_PGR2_PLR1_PKA1_SGROB0_SIA3_SS1_SU16_SUM0_SUS128_SPO1_SRVW0_SSO0_SVW8_SK3_SKFTR0_SKXCCM4_SGRO0_TDMI0_TIN0_TLDS1_TLDSMn1_ULSGRO0_USL1_UIOFGRO0_UPLRP0_USFGRO0_VSn1_VWA8_VWB1_WSGRA0_WSGRB0_WS64_WG32_8_1_WGM8_WGMXCC1_WGMXCCGn1
    SolutionIndex: 130
    SolutionNameMin: Cijk_Alik_Bljk_BBS_BH_BiasSB_HAS_SAV_UserArgs_MT256x256x64_MI16x16x1_CMS_SN_LDSB0_AFC1_AG0_AFEM1_AFEM1_ASEM1_CLR1_CADS0_DTLA1_DTLB1_DTVA0_DTVB0_DTVMXSA0_DTVMXSB0_DTVSM0_DPLB0_EPS0_ELFLR0_EMLL0_FDSI0_GRPM1_GRVWA8_GRVWB8_GSU0_GSUAMB_GSUC0_GSUWGMRR0_GLS0_ISA950_IU1_K1_LDSTI1_LBSPPA1024_LBSPPB1024_LBSPPM0_LPA16_LPB16_LPM0_LRVW8_LWPMn1_MIAV0_MIWT8_8_MO40_MGRIPM1_NTn1_NTA4_NTB0_NTC4_NTD0_NTM0_NEPBS2_NLCA1_NLCB1_ONLL1_PGR2_PLR1_PKA1_SGROB1_SIA3_SS1_SU16_SUM0_SUS256_SPO1_SRVW0_SSO4_SVW8_SK3_SKFTR0_SKXCCM0_SGRO0_TDMI0_TIN0_TLDS1_TLDSMn1_ULSGRO0_USL1_UIOFGRO0_UPLRP0_USFGRO0_VSn1_VWA8_VWB8_WSGRA0_WSGRB0_WS64_WG32_8_1_WGMn16_WGMXCC1_WGMXCCGn1
    SolutionIndex: 131
    SolutionNameMin: Cijk_Alik_Bljk_BBS_BH_BiasSB_HAS_SAV_UserArgs_MT256x256x64_MI16x16x1_CMS_SN_LDSB0_AFC1_AG1_AFEM1_AFEM1_ASEM1_CLR1_CADS0_DTLA1_DTLB1_DTVA0_DTVB0_DTVMXSA0_DTVMXSB0_DTVSM0_DPLB0_EPS0_ELFLR0_EMLLn1_FDSI0_GRPM1_GRVWA8_GRVWB8_GSU0_GSUAMB_GSUC0_GSUWGMRR0_GLS0_ISA950_IU1_K1_LDSTI1_LBSPPA1024_LBSPPB1024_LBSPPM0_LPA16_LPB16_LPM0_LRVW8_LWPMn1_MIAV0_MIWT8_8_MO40_MGRIPM1_NTn1_NTA4_NTB0_NTC4_NTD0_NTM0_NEPBS2_NLCA1_NLCB1_ONLL1_PGR2_PLR1_PKA1_SGROB0_SIA3_SS1_SU0_SUM0_SUS128_SPO1_SRVW0_SSO1_SVW8_SK3_SKFTR0_SKXCCM0_SGRO0_TDMI0_TIN0_TLDS1_TLDSMn1_ULSGRO0_USL1_UIOFGRO0_UPLRP0_USFGRO0_VSn1_VWA8_VWB8_WSGRA0_WSGRB0_WS64_WG32_8_1_WGM16_WGMXCC1_WGMXCCGn1
    SolutionIndex: 132
    SolutionNameMin: Cijk_Alik_Bljk_BBS_BH_BiasSB_HAS_SAV_UserArgs_MT224x256x64_MI16x16x1_CMS_SN_LDSB0_AFC1_AG1_AFEM1_AFEM1_ASEM1_CLR1_CADS0_DTLA1_DTLB1_DTVA0_DTVB0_DTVMXSA0_DTVMXSB0_DTVSM0_DPLB0_EPS0_ELFLR0_EMLLn1_FDSI0_GRPM1_GRVWA8_GRVWB8_GSU0_GSUAMB_GSUC0_GSUWGMRR0_GLS0_ISA950_IU1_K1_LDSTI1_LBSPPA1024_LBSPPB1024_LBSPPM0_LPA32_LPB16_LPM0_LRVW8_LWPMn1_MIAV0_MIWT7_8_MO40_MGRIPM1_NTn1_NTA4_NTB0_NTC0_NTD0_NTM0_NEPBS4_NLCA1_NLCB1_ONLL1_PGR2_PLR1_PKA1_SGROB1_SIA3_SS1_SU16_SUM0_SUS256_SPO0_SRVW0_SSO0_SVW1_SK3_SKFTR0_SKXCCM0_SGRO0_TDMI0_TIN0_TLDS1_TLDSMn1_ULSGRO0_USL1_UIOFGRO0_UPLRP0_USFGRO0_VSn1_VWA1_VWB8_WSGRA0_WSGRB0_WS64_WG32_8_1_WGM32_WGMXCC32_WGMXCCGn1
    SolutionIndex: 133
    SolutionNameMin: Cijk_Alik_Bljk_BBS_BH_BiasSB_HAS_SAV_UserArgs_MT256x224x64_MI16x16x1_CMS_SN_LDSB0_AFC1_AG1_AFEM1_AFEM1_ASEM1_CLR1_CADS0_DTLA1_DTLB1_DTVA0_DTVB0_DTVMXSA0_DTVMXSB0_DTVSM0_DPLB0_EPS0_ELFLR0_EMLLn1_FDSI0_GRPM1_GRVWA8_GRVWB8_GSU0_GSUAMB_GSUC0_GSUWGMRR0_GLS0_ISA950_IU1_K1_LDSTI1_LBSPPA1024_LBSPPB1024_LBSPPM0_LPA16_LPB32_LPM0_LRVW8_LWPMn1_MIAV0_MIWT8_7_MO40_MGRIPM1_NTn1_NTA4_NTB0_NTC0_NTD0_NTM0_NEPBS4_NLCA1_NLCB1_ONLL1_PGR2_PLR1_PKA1_SGROB0_SIA3_SS1_SU0_SUM0_SUS128_SPO0_SRVW0_SSO1_SVW8_SK3_SKFTR0_SKXCCM0_SGRO0_TDMI0_TIN0_TLDS1_TLDSMn1_ULSGRO0_USL1_UIOFGRO0_UPLRP0_USFGRO0_VSn1_VWA8_VWB1_WSGRA0_WSGRB0_WS64_WG32_8_1_WGM8_WGMXCC32_WGMXCCGn1
    SolutionIndex: 134
    SolutionNameMin: Cijk_Alik_Bljk_BBS_BH_BiasSB_HAS_SAV_UserArgs_MT256x224x64_MI16x16x1_CMS_SN_LDSB0_AFC1_AG1_AFEM1_AFEM1_ASEM1_CLR1_CADS0_DTLA1_DTLB1_DTVA0_DTVB0_DTVMXSA0_DTVMXSB0_DTVSM0_DPLB0_EPS0_ELFLR0_EMLL0_FDSI0_GRPM1_GRVWA8_GRVWB8_GSU0_GSUAMB_GSUC0_GSUWGMRR0_GLS0_ISA950_IU1_K1_LDSTI1_LBSPPA1024_LBSPPB1024_LBSPPM0_LPA16_LPB32_LPM0_LRVW8_LWPMn1_MIAV0_MIWT8_7_MO40_MGRIPM1_NTn1_NTA4_NTB0_NTC4_NTD0_NTM0_NEPBS4_NLCA1_NLCB1_ONLL1_PGR2_PLR1_PKA1_SGROB0_SIA3_SS1_SU16_SUM0_SUS256_SPO0_SRVW0_SSO1_SVW8_SK3_SKFTR0_SKXCCM0_SGRO0_TDMI0_TIN0_TLDS1_TLDSMn1_ULSGRO0_USL1_UIOFGRO0_UPLRP0_USFGRO0_VSn1_VWA8_VWB1_WSGRA0_WSGRB0_WS64_WG32_8_1_WGM32_WGMXCC1_WGMXCCGn1
    SolutionIndex: 135
    SolutionNameMin: Cijk_Alik_Bljk_BBS_BH_BiasSB_HAS_SAV_UserArgs_MT256x192x64_MI16x16x1_CMS_SN_LDSB0_AFC1_AG1_AFEM1_AFEM1_ASEM1_CLR1_CADS0_DTLA1_DTLB1_DTVA0_DTVB0_DTVMXSA0_DTVMXSB0_DTVSM0_DPLB0_EPS0_ELFLR0_EMLL0_FDSI0_GRPM1_GRVWA8_GRVWB8_GSU0_GSUAMB_GSUC0_GSUWGMRR0_GLS0_ISA950_IU1_K1_LDSTI0_LBSPPA1024_LBSPPB1024_LBSPPM0_LPA16_LPB32_LPM0_LRVW8_LWPMn1_MIAV0_MIWT8_6_MO40_MGRIPM1_NTn1_NTA4_NTB0_NTC0_NTD0_NTM0_NEPBS10_NLCA1_NLCB1_ONLL1_PGR2_PLR1_PKA1_SGROB1_SIA3_SS1_SU8_SUM0_SUS128_SPO0_SRVW0_SSO0_SVW8_SK3_SKFTR0_SKXCCM0_SGRO0_TDMI0_TIN0_TLDS1_TLDSMn1_ULSGRO0_USL1_UIOFGRO0_UPLRP0_USFGRO0_VSn1_VWA8_VWB2_WSGRA0_WSGRB0_WS64_WG32_8_1_WGM48_WGMXCC1_WGMXCCGn1
    SolutionIndex: 136
    SolutionNameMin: Cijk_Alik_Bljk_BBS_BH_BiasSB_HAS_SAV_UserArgs_MT256x192x64_MI16x16x1_CMS_SN_LDSB0_AFC1_AG1_AFEM1_AFEM1_ASEM1_CLR0_CADS0_DTLA1_DTLB1_DTVA0_DTVB0_DTVMXSA0_DTVMXSB0_DTVSM0_DPLB0_EPS0_ELFLR0_EMLLn1_FDSI0_GRPM1_GRVWA8_GRVWB8_GSU0_GSUAMB_GSUC0_GSUWGMRR0_GLS0_ISA950_IU1_K1_LDSTI0_LBSPPA1024_LBSPPB1024_LBSPPM0_LPA16_LPB32_LPM0_LRVW8_LWPMn1_MIAV0_MIWT8_6_MO40_MGRIPM1_NTn1_NTA4_NTB0_NTC0_NTD0_NTM0_NEPBS4_NLCA1_NLCB1_ONLL1_PGR2_PLR1_PKA1_SGROB0_SIA3_SS1_SU8_SUM0_SUS512_SPO0_SRVW0_SSO1_SVW8_SK3_SKFTR0_SKXCCM0_SGRO0_TDMI0_TIN0_TLDS1_TLDSMn1_ULSGRO0_USL1_UIOFGRO0_UPLRP0_USFGRO0_VSn1_VWA8_VWB2_WSGRA0_WSGRB0_WS64_WG32_8_1_WGM16_WGMXCC1_WGMXCCGn1
    SolutionIndex: 137
    SolutionNameMin: Cijk_Alik_Bljk_BBS_BH_BiasSB_HAS_SAV_UserArgs_MT224x128x64_MI16x16x1_CMS_SN_LDSB0_AFC1_AG0_AFEM1_AFEM1_ASEM1_CLR1_CADS0_DTLA1_DTLB1_DTVA0_DTVB0_DTVMXSA0_DTVMXSB0_DTVSM0_DPLB0_EPS0_ELFLR0_EMLLn1_FDSI0_GRPM1_GRVWA8_GRVWB8_GSU0_GSUAMB_GSUC0_GSUWGMRR0_GLS0_ISA950_IU1_K1_LDSTI0_LBSPPA1024_LBSPPB1024_LBSPPM0_LPA32_LPB32_LPM0_LRVW8_LWPMn1_MIAV1_MIWT7_4_MO40_MGRIPM1_NTn1_NTA4_NTB0_NTC0_NTD0_NTM0_NEPBS4_NLCA1_NLCB1_ONLL1_PGR2_PLR1_PKA1_SGROB0_SIA3_SS1_SU16_SUM0_SUS512_SPO0_SRVW0_SSO0_SVW1_SK3_SKFTR0_SKXCCM8_SGRO0_TDMI0_TIN0_TLDS1_TLDSMn1_ULSGRO0_USL1_UIOFGRO0_UPLRP0_USFGRO0_VSn1_VWA1_VWB4_WSGRA0_WSGRB0_WS64_WG32_8_1_WGM48_WGMXCC1_WGMXCCGn1
    SolutionIndex: 138
    SolutionNameMin: Cijk_Alik_Bljk_BBS_BH_BiasSB_HAS_SAV_UserArgs_MT256x128x64_MI16x16x1_SN_LDSB0_AFC1_AG0_AFEM1_AFEM1_ASEM1_CLR1_CADS0_DTLA1_DTLB1_DTVA0_DTVB0_DTVMXSA0_DTVMXSB0_DTVSM0_DPLB1_EPS0_ELFLR0_EMLLn1_FDSI0_GRPM1_GRVWA8_GRVWB8_GSU0_GSUAMB_GSUC0_GSUWGMRR0_GLS0_ISA950_IU1_K1_LDSTI0_LBSPPA1024_LBSPPB1024_LBSPPM0_LPA32_LPB16_LPM0_LRVWn1_LWPMn1_MIAV0_MIWT4_8_MO40_MGRIPM1_NTn1_NTA4_NTB0_NTC0_NTD0_NTM0_NEPBS4_NLCA1_NLCB1_ONLL1_PGR2_PLR1_PKA1_SGROB0_SIA3_SS1_SU0_SUM0_SUS0_SPO1_SRVW0_SSO0_SVW4_SK3_SKFTR0_SKXCCM0_SGRO0_TDMI0_TIN1_TLDS1_TLDSMn1_ULSGRO0_USL1_UIOFGRO0_UPLRP0_USFGRO0_VSn1_VWA4_VWB8_WSGRA0_WSGRB0_WS64_WG64_4_1_WGM48_WGMXCC1_WGMXCCGn1
    SolutionIndex: 139
    SolutionNameMin: Cijk_Alik_Bljk_BBS_BH_BiasSB_HAS_SAV_UserArgs_MT224x160x64_MI16x16x1_SN_LDSB0_AFC1_AG1_AFEM1_AFEM1_ASEM1_CLR1_CADS0_DTLA1_DTLB1_DTVA0_DTVB0_DTVMXSA0_DTVMXSB0_DTVSM0_DPLB1_EPS0_ELFLR0_EMLL0_FDSI0_GRPM1_GRVWA8_GRVWB8_GSU0_GSUAMB_GSUC0_GSUWGMRR0_GLS0_ISA950_IU1_K1_LDSTI0_LBSPPA1024_LBSPPB1024_LBSPPM0_LPA32_LPB32_LPM0_LRVWn1_LWPMn1_MIAV0_MIWT7_5_MO40_MGRIPM1_NTn1_NTA4_NTB0_NTC4_NTD0_NTM0_NEPBS4_NLCA1_NLCB1_ONLL1_PGR2_PLR1_PKA1_SGROB1_SIA3_SS1_SU0_SUM0_SUS0_SPO0_SRVW0_SSO0_SVW1_SK3_SKFTR0_SKXCCM4_SGRO0_TDMI0_TIN1_TLDS2_TLDSMn1_ULSGRO0_USL1_UIOFGRO0_UPLRP0_USFGRO0_VSn1_VWA1_VWB1_WSGRA0_WSGRB0_WS64_WG32_8_1_WGMn1_WGMXCC1_WGMXCCGn1
    SolutionIndex: 140
    SolutionNameMin: Cijk_Alik_Bljk_BBS_BH_BiasSB_HAS_SAV_UserArgs_MT256x224x64_MI16x16x1_CMS_SN_LDSB0_AFC1_AG0_AFEM1_AFEM1_ASEM1_CLR0_CADS0_DTLA1_DTLB1_DTVA0_DTVB0_DTVMXSA0_DTVMXSB0_DTVSM0_DPLB0_EPS0_ELFLR0_EMLLn1_FDSI0_GRPM1_GRVWA8_GRVWB8_GSU0_GSUAMB_GSUC0_GSUWGMRR0_GLS0_ISA950_IU1_K1_LDSTI0_LBSPPA1024_LBSPPB1024_LBSPPM0_LPA16_LPB32_LPM0_LRVW8_LWPMn1_MIAV0_MIWT8_7_MO40_MGRIPM1_NTn1_NTA4_NTB0_NTC0_NTD4_NTM0_NEPBS14_NLCA1_NLCB1_ONLL1_PGR2_PLR1_PKA1_SGROB0_SIA3_SS1_SU0_SUM0_SUS128_SPO1_SRVW0_SSO0_SVW8_SK3_SKFTR0_SKXCCM0_SGRO0_TDMI0_TIN0_TLDS1_TLDSMn1_ULSGRO0_USL1_UIOFGRO0_UPLRP0_USFGRO0_VSn1_VWA8_VWB1_WSGRA0_WSGRB0_WS64_WG32_8_1_WGMn8_WGMXCC1_WGMXCCGn1
    SolutionIndex: 141
    SolutionNameMin: Cijk_Alik_Bljk_BBS_BH_BiasSB_HAS_SAV_UserArgs_MT128x96x64_MI16x16x1_SN_LDSB0_AFC1_AG1_AFEM1_AFEM1_ASEM1_CLR1_CADS0_DTLA1_DTLB1_DTVA0_DTVB0_DTVMXSA0_DTVMXSB0_DTVSM0_DPLB1_EPS0_ELFLR0_EMLL0_FDSI0_GRPM1_GRVWA8_GRVWB8_GSU0_GSUAMB_GSUC0_GSUWGMRR0_GLS0_ISA950_IU1_K1_LDSTI0_LBSPPA1024_LBSPPB1024_LBSPPM0_LPA32_LPB32_LPM0_LRVWn1_LWPMn1_MIAV0_MIWT4_3_MO40_MGRIPM1_NTn1_NTA4_NTB0_NTC4_NTD0_NTM0_NEPBS12_NLCA1_NLCB1_ONLL1_PGR3_PLR1_PKA1_SGROB0_SIA3_SS1_SU0_SUM0_SUS0_SPO0_SRVW0_SSO0_SVW4_SK3_SKFTR0_SKXCCM0_SGRO0_TDMI0_TIN1_TLDS1_TLDSMn1_ULSGRO1_USL1_UIOFGRO0_UPLRP0_USFGRO0_VSn1_VWA4_VWB1_WSGRA0_WSGRB0_WS64_WG32_8_1_WGM32_WGMXCC32_WGMXCCGn1
    SolutionIndex: 142
    SolutionNameMin: Cijk_Alik_Bljk_BBS_BH_BiasSB_HAS_SAV_UserArgs_MT128x96x64_MI16x16x1_SN_LDSB0_AFC1_AG1_AFEM1_AFEM1_ASEM1_CLR1_CADS0_DTLA1_DTLB1_DTVA0_DTVB0_DTVMXSA0_DTVMXSB0_DTVSM0_DPLB1_EPS0_ELFLR0_EMLLn1_FDSI0_GRPM1_GRVWA8_GRVWB8_GSU0_GSUAMB_GSUC0_GSUWGMRR0_GLS0_ISA950_IU1_K1_LDSTI0_LBSPPA1024_LBSPPB1024_LBSPPM0_LPA32_LPB32_LPM0_LRVWn1_LWPMn1_MIAV0_MIWT4_3_MO40_MGRIPM1_NTn1_NTA4_NTB0_NTC0_NTD0_NTM0_NEPBS12_NLCA1_NLCB1_ONLL1_PGR4_PLR1_PKA1_SGROB0_SIA3_SS1_SU0_SUM0_SUS0_SPO1_SRVW0_SSO0_SVW4_SK3_SKFTR0_SKXCCM0_SGRO0_TDMI0_TIN1_TLDS2_TLDSMn1_ULSGRO1_USL1_UIOFGRO0_UPLRP0_USFGRO0_VSn1_VWA4_VWB1_WSGRA0_WSGRB0_WS64_WG32_8_1_WGM6_WGMXCC32_WGMXCCGn1
    SolutionIndex: 143
    SolutionNameMin: Cijk_Alik_Bljk_BBS_BH_BiasSB_HAS_SAV_UserArgs_MT128x64x64_MI16x16x1_SN_LDSB0_AFC1_AG0_AFEM1_AFEM1_ASEM1_CLR0_CADS0_DTLA1_DTLB1_DTVA0_DTVB0_DTVMXSA0_DTVMXSB0_DTVSM0_DPLB1_EPS0_ELFLR0_EMLLn1_FDSI0_GRPM1_GRVWA8_GRVWB8_GSU0_GSUAMB_GSUC0_GSUWGMRR0_GLS0_ISA950_IU1_K1_LDSTI0_LBSPPA1024_LBSPPB1024_LBSPPM0_LPA32_LPB32_LPM0_LRVWn1_LWPMn1_MIAV1_MIWT4_4_MO40_MGRIPM1_NTn1_NTA4_NTB0_NTC0_NTD0_NTM0_NEPBS0_NLCA1_NLCB1_ONLL1_PGR3_PLR1_PKA1_SGROB0_SIA3_SS1_SU0_SUM0_SUS128_SPO0_SRVW0_SSO0_SVW4_SK3_SKFTR0_SKXCCM0_SGRO0_TDMI0_TIN0_TLDS1_TLDSMn1_ULSGRO0_USL1_UIOFGRO0_UPLRP0_USFGRO0_VSn1_VWA4_VWB4_WSGRA0_WSGRB0_WS64_WG32_4_2_WGM0_WGMXCC32_WGMXCCGn1
    SolutionIndex: 144
    SolutionNameMin: Cijk_Alik_Bljk_BBS_BH_BiasSB_HAS_SAV_UserArgs_MT128x64x64_MI16x16x1_SN_LDSB0_AFC1_AG1_AFEM1_AFEM1_ASEM1_CLR1_CADS0_DTLA1_DTLB1_DTVA0_DTVB0_DTVMXSA0_DTVMXSB0_DTVSM0_DPLB1_EPS0_ELFLR0_EMLLn1_FDSI0_GRPM1_GRVWA8_GRVWB8_GSU0_GSUAMB_GSUC0_GSUWGMRR0_GLS0_ISA950_IU1_K1_LDSTI0_LBSPPA1024_LBSPPB1024_LBSPPM0_LPA32_LPB32_LPM0_LRVWn1_LWPMn1_MIAV1_MIWT4_2_MO40_MGRIPM1_NTn1_NTA4_NTB0_NTC0_NTD0_NTM0_NEPBS8_NLCA1_NLCB1_ONLL1_PGR4_PLR1_PKA1_SGROB1_SIA3_SS1_SU0_SUM0_SUS0_SPO0_SRVW0_SSO0_SVW4_SK3_SKFTR0_SKXCCM0_SGRO0_TDMI0_TIN1_TLDS1_TLDSMn1_ULSGRO1_USL1_UIOFGRO0_UPLRP0_USFGRO0_VSn1_VWA4_VWB2_WSGRA0_WSGRB0_WS64_WG32_8_1_WGM24_WGMXCC8_WGMXCCGn1
    SolutionIndex: 145
    SolutionNameMin: Cijk_Alik_Bljk_BBS_BH_BiasSB_HAS_SAV_UserArgs_MT128x192x64_MI16x16x1_CMS_SN_LDSB0_AFC1_AG0_AFEM1_AFEM1_ASEM1_CLR0_CADS0_DTLA1_DTLB1_DTVA0_DTVB0_DTVMXSA0_DTVMXSB0_DTVSM0_DPLB0_EPS0_ELFLR0_EMLL0_FDSI0_GRPM1_GRVWA8_GRVWB8_GSU0_GSUAMB_GSUC0_GSUWGMRR0_GLS0_ISA950_IU1_K1_LDSTI0_LBSPPA1024_LBSPPB1024_LBSPPM0_LPA32_LPB32_LPM0_LRVW8_LWPMn1_MIAV0_MIWT4_6_MO40_MGRIPM1_NTn1_NTA4_NTB0_NTC4_NTD4_NTM0_NEPBS12_NLCA1_NLCB1_ONLL1_PGR2_PLR1_PKA1_SGROB0_SIA3_SS1_SU8_SUM0_SUS128_SPO0_SRVW0_SSO1_SVW4_SK3_SKFTR0_SKXCCM8_SGRO0_TDMI0_TIN0_TLDS1_TLDSMn1_ULSGRO0_USL1_UIOFGRO0_UPLRP0_USFGRO0_VSn1_VWA4_VWB2_WSGRA0_WSGRB0_WS64_WG32_8_1_WGM48_WGMXCC1_WGMXCCGn1
    SolutionIndex: 146
    SolutionNameMin: Cijk_Alik_Bljk_BBS_BH_BiasSB_HAS_SAV_UserArgs_MT128x224x64_MI16x16x1_CMS_SN_LDSB0_AFC1_AG1_AFEM1_AFEM1_ASEM1_CLR0_CADS0_DTLA1_DTLB1_DTVA0_DTVB0_DTVMXSA0_DTVMXSB0_DTVSM0_DPLB0_EPS0_ELFLR0_EMLL0_FDSI0_GRPM1_GRVWA8_GRVWB8_GSU0_GSUAMB_GSUC0_GSUWGMRR0_GLS0_ISA950_IU1_K1_LDSTI0_LBSPPA1024_LBSPPB1024_LBSPPM0_LPA32_LPB32_LPM0_LRVW8_LWPMn1_MIAV0_MIWT4_7_MO40_MGRIPM1_NTn1_NTA4_NTB0_NTC4_NTD4_NTM0_NEPBS10_NLCA1_NLCB1_ONLL1_PGR2_PLR1_PKA1_SGROB1_SIA3_SS1_SU16_SUM0_SUS128_SPO1_SRVW0_SSO0_SVW4_SK3_SKFTR0_SKXCCM8_SGRO0_TDMI0_TIN0_TLDS1_TLDSMn1_ULSGRO0_USL1_UIOFGRO0_UPLRP0_USFGRO0_VSn1_VWA4_VWB1_WSGRA0_WSGRB0_WS64_WG32_8_1_WGM8_WGMXCC1_WGMXCCGn1
    SolutionIndex: 147
    SolutionNameMin: Cijk_Alik_Bljk_BBS_BH_BiasSB_HAS_SAV_UserArgs_MT128x224x64_MI16x16x1_CMS_SN_LDSB0_AFC1_AG0_AFEM1_AFEM1_ASEM1_CLR0_CADS0_DTLA1_DTLB1_DTVA0_DTVB0_DTVMXSA0_DTVMXSB0_DTVSM0_DPLB0_EPS0_ELFLR0_EMLLn1_FDSI0_GRPM1_GRVWA8_GRVWB8_GSU0_GSUAMB_GSUC0_GSUWGMRR0_GLS0_ISA950_IU1_K1_LDSTI0_LBSPPA1024_LBSPPB1024_LBSPPM0_LPA32_LPB32_LPM0_LRVW8_LWPMn1_MIAV0_MIWT4_7_MO40_MGRIPM1_NTn1_NTA4_NTB0_NTC4_NTD4_NTM0_NEPBS14_NLCA1_NLCB1_ONLL1_PGR2_PLR1_PKA1_SGROB0_SIA3_SS1_SU8_SUM0_SUS512_SPO1_SRVW0_SSO0_SVW4_SK3_SKFTR0_SKXCCM0_SGRO0_TDMI0_TIN0_TLDS1_TLDSMn1_ULSGRO0_USL1_UIOFGRO0_UPLRP0_USFGRO0_VSn1_VWA4_VWB1_WSGRA0_WSGRB0_WS64_WG32_8_1_WGM8_WGMXCC8_WGMXCCGn1
    SolutionIndex: 148
    SolutionNameMin: Cijk_Alik_Bljk_BBS_BH_BiasSB_HAS_SAV_UserArgs_MT128x64x128_MI16x16x1_SN_LDSB0_AFC1_AG0_AFEM1_AFEM1_ASEM1_CLR0_CADS0_DTLA1_DTLB1_DTVA0_DTVB0_DTVMXSA0_DTVMXSB0_DTVSM0_DPLB1_EPS0_ELFLR0_EMLLn1_FDSI0_GRPM1_GRVWA8_GRVWB8_GSU0_GSUAMB_GSUC0_GSUWGMRR0_GLS0_ISA950_IU1_K1_LDSTI0_LBSPPA1024_LBSPPB1024_LBSPPM0_LPA16_LPB32_LPM0_LRVWn1_LWPMn1_MIAV1_MIWT4_2_MO40_MGRIPM1_NTn1_NTA4_NTB0_NTC0_NTD4_NTM0_NEPBS0_NLCA1_NLCB1_ONLL1_PGR2_PLR1_PKA1_SGROB0_SIA3_SS1_SU0_SUM0_SUS0_SPO0_SRVW0_SSO0_SVW4_SK3_SKFTR0_SKXCCM4_SGRO0_TDMI0_TIN1_TLDS1_TLDSMn1_ULSGRO1_USL1_UIOFGRO0_UPLRP0_USFGRO0_VSn1_VWA4_VWB2_WSGRA0_WSGRB0_WS64_WG32_8_1_WGM6_WGMXCC1_WGMXCCGn1
    SolutionIndex: 149
    SolutionNameMin: Cijk_Alik_Bljk_BBS_BH_BiasSB_HAS_SAV_UserArgs_MT160x128x128_MI16x16x1_SN_LDSB0_AFC1_AG1_AFEM1_AFEM1_ASEM1_CLR0_CADS0_DTLA0_DTLB0_DTVA0_DTVB0_DTVMXSA0_DTVMXSB0_DTVSM0_DPLB0_EPS0_ELFLR0_EMLLn1_FDSI0_GRPM1_GRVWA8_GRVWB8_GSU0_GSUAMB_GSUC0_GSUWGMRR0_GLS0_ISA950_IU1_K1_LDSTI0_LBSPPA512_LBSPPB512_LBSPPM0_LPA16_LPB16_LPM0_LRVWn1_LWPMn1_MIAV0_MIWT10_2_MO40_MGRIPM1_NTn1_NTA0_NTB0_NTC4_NTD0_NTM0_NEPBS8_NLCA1_NLCB1_ONLL1_PGR2_PLR1_PKA1_SGROB0_SIA3_SS0_SU0_SUM0_SUS0_SPO1_SRVW0_SSO4_SVW8_SK3_SKFTR0_SKXCCM4_SGRO0_TDMI0_TIN1_TLDS1_TLDSMn1_ULSGRO1_USL1_UIOFGRO0_UPLRP0_USFGRO0_VSn1_VWA2_VWB2_WSGRA0_WSGRB2_WS64_WG16_16_1_WGM16_WGMXCC1_WGMXCCGn1
    SolutionIndex: 150
    SolutionNameMin: Cijk_Alik_Bljk_BBS_BH_BiasSB_HAS_SAV_UserArgs_MT160x128x128_MI16x16x1_SN_LDSB0_AFC1_AG1_AFEM1_AFEM1_ASEM1_CLR0_CADS0_DTLA0_DTLB0_DTVA0_DTVB0_DTVMXSA0_DTVMXSB0_DTVSM0_DPLB0_EPS0_ELFLR0_EMLLn1_FDSI0_GRPM1_GRVWA8_GRVWB8_GSU0_GSUAMB_GSUC0_GSUWGMRR0_GLS0_ISA950_IU1_K1_LDSTI0_LBSPPA512_LBSPPB512_LBSPPM0_LPA16_LPB16_LPM0_LRVWn1_LWPMn1_MIAV0_MIWT10_2_MO40_MGRIPM1_NTn1_NTA0_NTB0_NTC4_NTD0_NTM0_NEPBS12_NLCA1_NLCB1_ONLL1_PGR2_PLR1_PKA1_SGROB0_SIA3_SS0_SU0_SUM0_SUS0_SPO0_SRVW0_SSO1_SVW8_SK3_SKFTR0_SKXCCM4_SGRO0_TDMI0_TIN1_TLDS1_TLDSMn1_ULSGRO0_USL1_UIOFGRO0_UPLRP0_USFGRO0_VSn1_VWA2_VWB2_WSGRA0_WSGRB2_WS64_WG16_16_1_WGM16_WGMXCC1_WGMXCCGn1
    SolutionIndex: 151
    SolutionNameMin: Cijk_Alik_Bljk_BBS_BH_BiasSB_HAS_SAV_UserArgs_MT128x64x64_MI16x16x1_SN_LDSB0_AFC1_AG1_AFEM1_AFEM1_ASEM1_CLR1_CADS0_DTLA1_DTLB1_DTVA0_DTVB0_DTVMXSA0_DTVMXSB0_DTVSM0_DPLB1_EPS0_ELFLR0_EMLLn1_FDSI0_GRPM1_GRVWA8_GRVWB8_GSU0_GSUAMB_GSUC0_GSUWGMRR0_GLS0_ISA950_IU1_K1_LDSTI0_LBSPPA1024_LBSPPB1024_LBSPPM0_LPA16_LPB32_LPM0_LRVWn1_LWPMn1_MIAV0_MIWT8_1_MO40_MGRIPM1_NTn1_NTA4_NTB0_NTC0_NTD4_NTM0_NEPBS12_NLCA1_NLCB1_ONLL1_PGR4_PLR1_PKA1_SGROB1_SIA3_SS1_SU0_SUM0_SUS0_SPO1_SRVW0_SSO1_SVW8_SK3_SKFTR0_SKXCCM4_SGRO0_TDMI0_TIN1_TLDS2_TLDSMn1_ULSGRO1_USL1_UIOFGRO0_UPLRP0_USFGRO0_VSn1_VWA8_VWB1_WSGRA0_WSGRB0_WS64_WG16_16_1_WGM16_WGMXCC1_WGMXCCGn1
    SolutionIndex: 152
    SolutionNameMin: Cijk_Alik_Bljk_BBS_BH_BiasSB_HAS_SAV_UserArgs_MT128x192x64_MI16x16x1_CMS_SN_LDSB0_AFC1_AG1_AFEM1_AFEM1_ASEM1_CLR0_CADS0_DTLA1_DTLB1_DTVA0_DTVB0_DTVMXSA0_DTVMXSB0_DTVSM0_DPLB0_EPS0_ELFLR0_EMLL0_FDSI0_GRPM1_GRVWA8_GRVWB8_GSU0_GSUAMB_GSUC0_GSUWGMRR0_GLS0_ISA950_IU1_K1_LDSTI0_LBSPPA1024_LBSPPB1024_LBSPPM0_LPA32_LPB32_LPM0_LRVW8_LWPMn1_MIAV0_MIWT4_6_MO40_MGRIPM1_NTn1_NTA0_NTB0_NTC0_NTD4_NTM0_NEPBS14_NLCA1_NLCB1_ONLL1_PGR2_PLR1_PKA1_SGROB0_SIA3_SS1_SU16_SUM0_SUS128_SPO1_SRVW0_SSO1_SVW4_SK3_SKFTR0_SKXCCM8_SGRO0_TDMI0_TIN0_TLDS1_TLDSMn1_ULSGRO0_USL1_UIOFGRO0_UPLRP0_USFGRO0_VSn1_VWA4_VWB2_WSGRA0_WSGRB0_WS64_WG32_8_1_WGM48_WGMXCC1_WGMXCCGn1
    SolutionIndex: 153
    SolutionNameMin: Cijk_Alik_Bljk_BBS_BH_BiasSB_HAS_SAV_UserArgs_MT128x160x64_MI16x16x1_SN_LDSB0_AFC1_AG0_AFEM1_AFEM1_ASEM1_CLR0_CADS0_DTLA1_DTLB1_DTVA0_DTVB0_DTVMXSA0_DTVMXSB0_DTVSM0_DPLB1_EPS0_ELFLR0_EMLLn1_FDSI0_GRPM1_GRVWA8_GRVWB8_GSU0_GSUAMB_GSUC0_GSUWGMRR0_GLS0_ISA950_IU1_K1_LDSTI0_LBSPPA1024_LBSPPB1024_LBSPPM0_LPA32_LPB32_LPM0_LRVWn1_LWPMn1_MIAV1_MIWT4_5_MO40_MGRIPM1_NTn1_NTA4_NTB0_NTC4_NTD0_NTM0_NEPBS12_NLCA1_NLCB1_ONLL1_PGR2_PLR1_PKA1_SGROB0_SIA3_SS1_SU0_SUM0_SUS0_SPO0_SRVW0_SSO0_SVW4_SK3_SKFTR0_SKXCCM0_SGRO0_TDMI0_TIN1_TLDS2_TLDSMn1_ULSGRO0_USL1_UIOFGRO0_UPLRP0_USFGRO0_VSn1_VWA4_VWB1_WSGRA0_WSGRB0_WS64_WG32_8_1_WGM4_WGMXCC32_WGMXCCGn1
    SolutionIndex: 154
    SolutionNameMin: Cijk_Alik_Bljk_BBS_BH_BiasSB_HAS_SAV_UserArgs_MT128x160x128_MI16x16x1_SN_LDSB0_AFC1_AG1_AFEM1_AFEM1_ASEM1_CLR0_CADS0_DTLA0_DTLB0_DTVA0_DTVB0_DTVMXSA0_DTVMXSB0_DTVSM0_DPLB0_EPS0_ELFLR0_EMLLn1_FDSI0_GRPM1_GRVWA8_GRVWB8_GSU0_GSUAMB_GSUC0_GSUWGMRR0_GLS0_ISA950_IU1_K1_LDSTI0_LBSPPA512_LBSPPB512_LBSPPM0_LPA16_LPB16_LPM0_LRVWn1_LWPMn1_MIAV0_MIWT2_10_MO40_MGRIPM1_NTn1_NTA0_NTB0_NTC0_NTD0_NTM0_NEPBS8_NLCA1_NLCB1_ONLL1_PGR2_PLR1_PKA1_SGROB0_SIA3_SS0_SU0_SUM0_SUS0_SPO0_SRVW0_SSO4_SVW8_SK3_SKFTR0_SKXCCM4_SGRO0_TDMI0_TIN1_TLDS2_TLDSMn1_ULSGRO1_USL1_UIOFGRO0_UPLRP0_USFGRO0_VSn1_VWA2_VWB2_WSGRA2_WSGRB2_WS64_WG64_4_1_WGM16_WGMXCC1_WGMXCCGn1
    SolutionIndex: 155
    SolutionNameMin: Cijk_Alik_Bljk_BBS_BH_BiasSB_HAS_SAV_UserArgs_MT96x192x128_MI16x16x1_SN_LDSB0_AFC1_AG1_AFEM1_AFEM1_ASEM1_CLR0_CADS0_DTLA0_DTLB0_DTVA0_DTVB0_DTVMXSA0_DTVMXSB0_DTVSM0_DPLB0_EPS0_ELFLR0_EMLLn1_FDSI0_GRPM1_GRVWA8_GRVWB8_GSU0_GSUAMB_GSUC0_GSUWGMRR0_GLS0_ISA950_IU1_K1_LDSTI0_LBSPPA512_LBSPPB256_LBSPPM0_LPA16_LPB16_LPM0_LRVWn1_LWPMn1_MIAV1_MIWT6_3_MO40_MGRIPM1_NTn1_NTA0_NTB0_NTC0_NTD0_NTM0_NEPBS10_NLCA1_NLCB1_ONLL1_PGR2_PLR1_PKA1_SGROB0_SIA3_SS0_SU0_SUM0_SUS0_SPO1_SRVW0_SSO0_SVW8_SK3_SKFTR0_SKXCCM8_SGRO0_TDMI0_TIN1_TLDS1_TLDSMn1_ULSGRO1_USL1_UIOFGRO0_UPLRP0_USFGRO0_VSn1_VWA2_VWB1_WSGRA0_WSGRB0_WS64_WG16_16_1_WGM16_WGMXCC1_WGMXCCGn1
    SolutionIndex: 156
    SolutionNameMin: Cijk_Alik_Bljk_BBS_BH_BiasSB_HAS_SAV_UserArgs_MT256x160x64_MI16x16x1_CMS_SN_LDSB0_AFC1_AG0_AFEM1_AFEM1_ASEM1_CLR1_CADS0_DTLA1_DTLB1_DTVA0_DTVB0_DTVMXSA0_DTVMXSB0_DTVSM0_DPLB0_EPS0_ELFLR0_EMLLn1_FDSI0_GRPM1_GRVWA8_GRVWB8_GSU0_GSUAMB_GSUC0_GSUWGMRR0_GLS0_ISA950_IU1_K1_LDSTI0_LBSPPA1024_LBSPPB1024_LBSPPM0_LPA16_LPB32_LPM0_LRVW8_LWPMn1_MIAV0_MIWT8_5_MO40_MGRIPM1_NTn1_NTA4_NTB0_NTC4_NTD4_NTM0_NEPBS0_NLCA1_NLCB1_ONLL1_PGR2_PLR1_PKA1_SGROB0_SIA3_SS1_SU8_SUM0_SUS256_SPO1_SRVW0_SSO0_SVW8_SK3_SKFTR0_SKXCCM0_SGRO0_TDMI0_TIN0_TLDS1_TLDSMn1_ULSGRO0_USL1_UIOFGRO0_UPLRP0_USFGRO0_VSn1_VWA8_VWB1_WSGRA0_WSGRB0_WS64_WG32_8_1_WGMn48_WGMXCC1_WGMXCCGn1
    SolutionIndex: 157
    SolutionNameMin: Cijk_Alik_Bljk_BBS_BH_BiasSB_HAS_SAV_UserArgs_MT128x160x128_MI16x16x1_SN_LDSB0_AFC1_AG1_AFEM1_AFEM1_ASEM1_CLR1_CADS0_DTLA0_DTLB0_DTVA0_DTVB0_DTVMXSA0_DTVMXSB0_DTVSM0_DPLB0_EPS0_ELFLR0_EMLLn1_FDSI0_GRPM1_GRVWA8_GRVWB8_GSU0_GSUAMB_GSUC0_GSUWGMRR0_GLS0_ISA950_IU1_K1_LDSTI0_LBSPPA1024_LBSPPB256_LBSPPM0_LPA16_LPB16_LPM0_LRVWn1_LWPMn1_MIAV0_MIWT4_5_MO40_MGRIPM1_NTn1_NTA0_NTB0_NTC4_NTD0_NTM0_NEPBS10_NLCA1_NLCB1_ONLL1_PGR2_PLR1_PKA1_SGROB0_SIA3_SS1_SU0_SUM0_SUS0_SPO0_SRVW0_SSO1_SVW4_SK3_SKFTR0_SKXCCM4_SGRO0_TDMI0_TIN1_TLDS1_TLDSMn1_ULSGRO0_USL1_UIOFGRO0_UPLRP0_USFGRO0_VSn1_VWA4_VWB1_WSGRA2_WSGRB2_WS64_WG32_8_1_WGM32_WGMXCC1_WGMXCCGn1
    SolutionIndex: 158
    SolutionNameMin: Cijk_Alik_Bljk_BBS_BH_BiasSB_HAS_SAV_UserArgs_MT80x64x128_MI16x16x1_SN_LDSB0_AFC1_AG0_AFEM1_AFEM1_ASEM1_CLR0_CADS0_DTLA0_DTLB0_DTVA0_DTVB0_DTVMXSA0_DTVMXSB0_DTVSM0_DPLB0_EPS0_ELFLR0_EMLLn1_FDSI0_GRPM1_GRVWA8_GRVWB8_GSU0_GSUAMB_GSUC0_GSUWGMRR0_GLS0_ISA950_IU1_K1_LDSTI0_LBSPPA256_LBSPPB256_LBSPPM0_LPA16_LPB16_LPM0_LRVWn1_LWPMn1_MIAV1_MIWT5_1_MO40_MGRIPM1_NTn1_NTA4_NTB0_NTC0_NTD0_NTM0_NEPBS16_NLCA1_NLCB1_ONLL1_PGR2_PLR1_PKA1_SGROB0_SIA3_SS0_SU0_SUM0_SUS0_SPO0_SRVW0_SSO0_SVW4_SK3_SKFTR0_SKXCCM4_SGRO0_TDMI0_TIN1_TLDS1_TLDSMn1_ULSGRO1_USL1_UIOFGRO0_UPLRP0_USFGRO1_VSn1_VWA1_VWB1_WSGRA0_WSGRB2_WS64_WG16_16_1_WGM8_WGMXCC1_WGMXCCGn1
    SolutionIndex: 159
    SolutionNameMin: Cijk_Alik_Bljk_BBS_BH_BiasSB_HAS_SAV_UserArgs_MT80x64x128_MI16x16x1_SN_LDSB0_AFC1_AG0_AFEM1_AFEM1_ASEM1_CLR1_CADS0_DTLA0_DTLB0_DTVA0_DTVB0_DTVMXSA0_DTVMXSB0_DTVSM0_DPLB0_EPS0_ELFLR0_EMLLn1_FDSI0_GRPM1_GRVWA8_GRVWB8_GSU0_GSUAMB_GSUC0_GSUWGMRR0_GLS0_ISA950_IU1_K1_LDSTI0_LBSPPA256_LBSPPB256_LBSPPM0_LPA16_LPB16_LPM0_LRVWn1_LWPMn1_MIAV0_MIWT5_1_MO40_MGRIPM1_NTn1_NTA4_NTB0_NTC0_NTD0_NTM0_NEPBS16_NLCA1_NLCB1_ONLL1_PGR2_PLR1_PKA1_SGROB0_SIA3_SS0_SU0_SUM0_SUS0_SPO1_SRVW0_SSO0_SVW4_SK3_SKFTR0_SKXCCM4_SGRO0_TDMI0_TIN1_TLDS2_TLDSMn1_ULSGRO1_USL1_UIOFGRO0_UPLRP0_USFGRO1_VSn1_VWA1_VWB1_WSGRA0_WSGRB0_WS64_WG16_16_1_WGM8_WGMXCC1_WGMXCCGn1
    SolutionIndex: 160
    SolutionNameMin: Cijk_Alik_Bljk_BBS_BH_BiasSB_HAS_SAV_UserArgs_MT80x64x128_MI16x16x1_SN_LDSB0_AFC1_AG1_AFEM1_AFEM1_ASEM1_CLR1_CADS0_DTLA0_DTLB0_DTVA0_DTVB0_DTVMXSA0_DTVMXSB0_DTVSM0_DPLB0_EPS0_ELFLR0_EMLLn1_FDSI0_GRPM1_GRVWA8_GRVWB8_GSU0_GSUAMB_GSUC0_GSUWGMRR0_GLS0_ISA950_IU1_K1_LDSTI0_LBSPPA256_LBSPPB256_LBSPPM0_LPA16_LPB16_LPM0_LRVWn1_LWPMn1_MIAV1_MIWT5_1_MO40_MGRIPM1_NTn1_NTA4_NTB0_NTC0_NTD0_NTM0_NEPBS0_NLCA1_NLCB1_ONLL1_PGR2_PLR1_PKA1_SGROB0_SIA3_SS0_SU0_SUM0_SUS0_SPO0_SRVW0_SSO0_SVW4_SK3_SKFTR0_SKXCCM4_SGRO0_TDMI0_TIN1_TLDS1_TLDSMn1_ULSGRO1_USL1_UIOFGRO0_UPLRP0_USFGRO1_VSn1_VWA1_VWB1_WSGRA0_WSGRB2_WS64_WG16_16_1_WGM16_WGMXCC1_WGMXCCGn1
    SolutionIndex: 161
    SolutionNameMin: Cijk_Alik_Bljk_BBS_BH_BiasSB_HAS_SAV_UserArgs_MT96x192x128_MI16x16x1_SN_LDSB0_AFC1_AG0_AFEM1_AFEM1_ASEM1_CLR0_CADS0_DTLA0_DTLB0_DTVA0_DTVB0_DTVMXSA0_DTVMXSB0_DTVSM0_DPLB0_EPS0_ELFLR0_EMLLn1_FDSI0_GRPM1_GRVWA8_GRVWB8_GSU0_GSUAMB_GSUC0_GSUWGMRR0_GLS0_ISA950_IU1_K1_LDSTI0_LBSPPA512_LBSPPB256_LBSPPM0_LPA16_LPB16_LPM0_LRVWn1_LWPMn1_MIAV0_MIWT6_3_MO40_MGRIPM1_NTn1_NTA0_NTB0_NTC0_NTD0_NTM0_NEPBS8_NLCA1_NLCB1_ONLL1_PGR2_PLR1_PKA1_SGROB0_SIA3_SS0_SU0_SUM0_SUS0_SPO0_SRVW0_SSO0_SVW8_SK3_SKFTR0_SKXCCM0_SGRO0_TDMI0_TIN1_TLDS1_TLDSMn1_ULSGRO1_USL1_UIOFGRO0_UPLRP0_USFGRO0_VSn1_VWA2_VWB1_WSGRA0_WSGRB2_WS64_WG16_16_1_WGMn1_WGMXCC8_WGMXCCGn1
    SolutionIndex: 162
    SolutionNameMin: Cijk_Alik_Bljk_BBS_BH_BiasSB_HAS_SAV_UserArgs_MT128x128x128_MI16x16x1_SN_LDSB0_AFC1_AG1_AFEM1_AFEM1_ASEM1_CLR0_CADS0_DTLA0_DTLB0_DTVA0_DTVB0_DTVMXSA0_DTVMXSB0_DTVSM0_DPLB0_EPS0_ELFLR0_EMLLn1_FDSI0_GRPM1_GRVWA8_GRVWB8_GSU0_GSUAMB_GSUC0_GSUWGMRR0_GLS0_ISA950_IU1_K1_LDSTI0_LBSPPA512_LBSPPB2048_LBSPPM0_LPA16_LPB16_LPM0_LRVWn1_LWPMn1_MIAV0_MIWT2_8_MO40_MGRIPM1_NTn1_NTA0_NTB0_NTC0_NTD4_NTM0_NEPBS16_NLCA1_NLCB1_ONLL1_PGR2_PLR1_PKA1_SGROB0_SIA3_SS0_SU0_SUM0_SUS0_SPO0_SRVW0_SSO0_SVW8_SK3_SKFTR0_SKXCCM4_SGRO0_TDMI0_TIN1_TLDS2_TLDSMn1_ULSGRO1_USL1_UIOFGRO0_UPLRP0_USFGRO0_VSn1_VWA2_VWB8_WSGRA0_WSGRB0_WS64_WG64_4_1_WGM16_WGMXCC2_WGMXCCGn1
    SolutionIndex: 163
    SolutionNameMin: Cijk_Alik_Bljk_BBS_BH_BiasSB_HAS_SAV_UserArgs_MT80x64x128_MI16x16x1_SN_LDSB0_AFC1_AG0_AFEM1_AFEM1_ASEM1_CLR0_CADS0_DTLA0_DTLB0_DTVA0_DTVB0_DTVMXSA0_DTVMXSB0_DTVSM0_DPLB0_EPS0_ELFLR0_EMLLn1_FDSI0_GRPM1_GRVWA8_GRVWB8_GSU0_GSUAMB_GSUC0_GSUWGMRR0_GLS0_ISA950_IU1_K1_LDSTI0_LBSPPA256_LBSPPB256_LBSPPM0_LPA16_LPB16_LPM0_LRVWn1_LWPMn1_MIAV1_MIWT5_1_MO40_MGRIPM1_NTn1_NTA4_NTB0_NTC0_NTD0_NTM0_NEPBS14_NLCA1_NLCB1_ONLL1_PGR2_PLR1_PKA1_SGROB0_SIA3_SS0_SU0_SUM0_SUS0_SPO0_SRVW0_SSO0_SVW4_SK3_SKFTR0_SKXCCM4_SGRO0_TDMI0_TIN1_TLDS1_TLDSMn1_ULSGRO0_USL1_UIOFGRO0_UPLRP0_USFGRO1_VSn1_VWA1_VWB1_WSGRA0_WSGRB2_WS64_WG16_16_1_WGM48_WGMXCC1_WGMXCCGn1
    SolutionIndex: 164
    SolutionNameMin: Cijk_Alik_Bljk_BBS_BH_BiasSB_HAS_SAV_UserArgs_MT96x192x64_MI16x16x1_SN_LDSB0_AFC1_AG0_AFEM1_AFEM1_ASEM1_CLR1_CADS0_DTLA1_DTLB1_DTVA0_DTVB0_DTVMXSA0_DTVMXSB0_DTVSM0_DPLB1_EPS0_ELFLR0_EMLLn1_FDSI0_GRPM1_GRVWA2_GRVWB8_GSU0_GSUAMB_GSUC0_GSUWGMRR0_GLS0_ISA950_IU1_K1_LDSTI0_LBSPPA256_LBSPPB1024_LBSPPM0_LPA16_LPB32_LPM0_LRVWn1_LWPMn1_MIAV0_MIWT6_3_MO40_MGRIPM1_NTn1_NTA4_NTB0_NTC0_NTD4_NTM0_NEPBS4_NLCA1_NLCB1_ONLL1_PGR3_PLR1_PKA1_SGROB1_SIA3_SS1_SU0_SUM0_SUS0_SPO0_SRVW0_SSO0_SVW2_SK3_SKFTR0_SKXCCM0_SGRO0_TDMI0_TIN1_TLDS1_TLDSMn1_ULSGRO1_USL1_UIOFGRO0_UPLRP0_USFGRO0_VSn1_VWA2_VWB1_WSGRA0_WSGRB0_WS64_WG16_16_1_WGMn1_WGMXCC2_WGMXCCGn1
    SolutionIndex: 165
    SolutionNameMin: Cijk_Alik_Bljk_BBS_BH_BiasSB_HAS_SAV_UserArgs_MT128x192x64_MI16x16x1_CMS_SN_LDSB0_AFC1_AG0_AFEM1_AFEM1_ASEM1_CLR0_CADS0_DTLA1_DTLB1_DTVA0_DTVB0_DTVMXSA0_DTVMXSB0_DTVSM0_DPLB0_EPS0_ELFLR0_EMLLn1_FDSI0_GRPM1_GRVWA8_GRVWB8_GSU0_GSUAMB_GSUC0_GSUWGMRR0_GLS0_ISA950_IU1_K1_LDSTI0_LBSPPA1024_LBSPPB1024_LBSPPM0_LPA32_LPB32_LPM0_LRVW8_LWPMn1_MIAV0_MIWT4_6_MO40_MGRIPM1_NTn1_NTA4_NTB0_NTC4_NTD4_NTM0_NEPBS14_NLCA1_NLCB1_ONLL1_PGR2_PLR1_PKA1_SGROB1_SIA3_SS1_SU8_SUM0_SUS128_SPO0_SRVW0_SSO0_SVW4_SK3_SKFTR0_SKXCCM4_SGRO0_TDMI0_TIN0_TLDS1_TLDSMn1_ULSGRO0_USL1_UIOFGRO0_UPLRP0_USFGRO0_VSn1_VWA4_VWB2_WSGRA0_WSGRB0_WS64_WG32_8_1_WGM8_WGMXCC1_WGMXCCGn1
    SolutionIndex: 166
    SolutionNameMin: Cijk_Alik_Bljk_BBS_BH_BiasSB_HAS_SAV_UserArgs_MT96x192x128_MI16x16x1_SN_LDSB0_AFC1_AG1_AFEM1_AFEM1_ASEM1_CLR0_CADS0_DTLA0_DTLB0_DTVA0_DTVB0_DTVMXSA0_DTVMXSB0_DTVSM0_DPLB0_EPS0_ELFLR0_EMLLn1_FDSI0_GRPM1_GRVWA8_GRVWB8_GSU0_GSUAMB_GSUC0_GSUWGMRR0_GLS0_ISA950_IU1_K1_LDSTI0_LBSPPA512_LBSPPB256_LBSPPM0_LPA16_LPB16_LPM0_LRVWn1_LWPMn1_MIAV0_MIWT6_3_MO40_MGRIPM1_NTn1_NTA0_NTB0_NTC0_NTD0_NTM0_NEPBS14_NLCA1_NLCB1_ONLL1_PGR2_PLR1_PKA1_SGROB0_SIA3_SS0_SU0_SUM0_SUS0_SPO0_SRVW0_SSO1_SVW8_SK3_SKFTR0_SKXCCM0_SGRO0_TDMI0_TIN1_TLDS2_TLDSMn1_ULSGRO1_USL1_UIOFGRO0_UPLRP0_USFGRO0_VSn1_VWA2_VWB1_WSGRA0_WSGRB0_WS64_WG16_16_1_WGM6_WGMXCC8_WGMXCCGn1
    SolutionIndex: 167
    SolutionNameMin: Cijk_Alik_Bljk_BBS_BH_BiasSB_HAS_SAV_UserArgs_MT192x128x64_MI16x16x1_CMS_SN_LDSB0_AFC1_AG0_AFEM1_AFEM1_ASEM1_CLR0_CADS0_DTLA1_DTLB1_DTVA0_DTVB0_DTVMXSA0_DTVMXSB0_DTVSM0_DPLB0_EPS0_ELFLR0_EMLL0_FDSI0_GRPM1_GRVWA8_GRVWB8_GSU0_GSUAMB_GSUC0_GSUWGMRR0_GLS0_ISA950_IU1_K1_LDSTI0_LBSPPA1024_LBSPPB1024_LBSPPM0_LPA32_LPB32_LPM0_LRVW8_LWPMn1_MIAV0_MIWT6_4_MO40_MGRIPM1_NTn1_NTA4_NTB4_NTC4_NTD0_NTM0_NEPBS2_NLCA1_NLCB1_ONLL1_PGR2_PLR1_PKA1_SGROB0_SIA3_SS1_SU8_SUM0_SUS128_SPO0_SRVW0_SSO0_SVW2_SK3_SKFTR0_SKXCCM0_SGRO0_TDMI0_TIN0_TLDS1_TLDSMn1_ULSGRO0_USL1_UIOFGRO0_UPLRP0_USFGRO0_VSn1_VWA2_VWB4_WSGRA0_WSGRB0_WS64_WG32_8_1_WGM16_WGMXCC1_WGMXCCGn1
    SolutionIndex: 168
    SolutionNameMin: Cijk_Alik_Bljk_BBS_BH_BiasSB_HAS_SAV_UserArgs_MT128x160x128_MI16x16x1_SN_LDSB0_AFC1_AG1_AFEM1_AFEM1_ASEM1_CLR0_CADS0_DTLA0_DTLB0_DTVA0_DTVB0_DTVMXSA0_DTVMXSB0_DTVSM0_DPLB0_EPS0_ELFLR0_EMLLn1_FDSI0_GRPM1_GRVWA8_GRVWB8_GSU0_GSUAMB_GSUC0_GSUWGMRR0_GLS0_ISA950_IU1_K1_LDSTI0_LBSPPA1024_LBSPPB256_LBSPPM0_LPA16_LPB16_LPM0_LRVWn1_LWPMn1_MIAV0_MIWT4_5_MO40_MGRIPM1_NTn1_NTA0_NTB0_NTC0_NTD4_NTM0_NEPBS16_NLCA1_NLCB1_ONLL1_PGR2_PLR1_PKA1_SGROB0_SIA3_SS1_SU0_SUM0_SUS0_SPO0_SRVW0_SSO1_SVW4_SK3_SKFTR0_SKXCCM4_SGRO0_TDMI0_TIN1_TLDS2_TLDSMn1_ULSGRO1_USL1_UIOFGRO0_UPLRP0_USFGRO0_VSn1_VWA4_VWB1_WSGRA2_WSGRB0_WS64_WG32_8_1_WGM24_WGMXCC2_WGMXCCGn1
    SolutionIndex: 169
    SolutionNameMin: Cijk_Alik_Bljk_BBS_BH_BiasSB_HAS_SAV_UserArgs_MT128x160x128_MI16x16x1_SN_LDSB0_AFC1_AG1_AFEM1_AFEM1_ASEM1_CLR0_CADS0_DTLA0_DTLB0_DTVA0_DTVB0_DTVMXSA0_DTVMXSB0_DTVSM0_DPLB0_EPS0_ELFLR0_EMLLn1_FDSI0_GRPM1_GRVWA8_GRVWB8_GSU0_GSUAMB_GSUC0_GSUWGMRR0_GLS0_ISA950_IU1_K1_LDSTI0_LBSPPA1024_LBSPPB256_LBSPPM0_LPA16_LPB16_LPM0_LRVWn1_LWPMn1_MIAV0_MIWT4_5_MO40_MGRIPM1_NTn1_NTA0_NTB0_NTC0_NTD4_NTM0_NEPBS0_NLCA1_NLCB1_ONLL1_PGR2_PLR1_PKA1_SGROB0_SIA3_SS1_SU8_SUM0_SUS256_SPO0_SRVW0_SSO0_SVW4_SK3_SKFTR0_SKXCCM4_SGRO0_TDMI0_TIN0_TLDS1_TLDSMn1_ULSGRO0_USL1_UIOFGRO0_UPLRP0_USFGRO0_VSn1_VWA4_VWB1_WSGRA2_WSGRB0_WS64_WG32_8_1_WGM6_WGMXCC1_WGMXCCGn1
    SolutionIndex: 170
    SolutionNameMin: Cijk_Alik_Bljk_BBS_BH_BiasSB_HAS_SAV_UserArgs_MT96x192x64_MI16x16x1_SN_LDSB0_AFC1_AG0_AFEM1_AFEM1_ASEM1_CLR0_CADS0_DTLA1_DTLB1_DTVA0_DTVB0_DTVMXSA0_DTVMXSB0_DTVSM0_DPLB1_EPS0_ELFLR0_EMLLn1_FDSI0_GRPM1_GRVWA2_GRVWB8_GSU0_GSUAMB_GSUC0_GSUWGMRR0_GLS0_ISA950_IU1_K1_LDSTI0_LBSPPA256_LBSPPB1024_LBSPPM0_LPA16_LPB32_LPM0_LRVWn1_LWPMn1_MIAV1_MIWT6_3_MO40_MGRIPM1_NTn1_NTA4_NTB0_NTC0_NTD4_NTM0_NEPBS2_NLCA1_NLCB1_ONLL1_PGR3_PLR1_PKA1_SGROB1_SIA3_SS1_SU0_SUM0_SUS0_SPO1_SRVW0_SSO0_SVW2_SK3_SKFTR0_SKXCCM0_SGRO0_TDMI0_TIN1_TLDS1_TLDSMn1_ULSGRO1_USL1_UIOFGRO0_UPLRP0_USFGRO0_VSn1_VWA2_VWB1_WSGRA0_WSGRB0_WS64_WG16_16_1_WGMn8_WGMXCC2_WGMXCCGn1
    SolutionIndex: 171
    SolutionNameMin: Cijk_Alik_Bljk_BBS_BH_BiasSB_HAS_SAV_UserArgs_MT128x128x128_MI16x16x1_SN_LDSB0_AFC1_AG1_AFEM1_AFEM1_ASEM1_CLR0_CADS0_DTLA0_DTLB0_DTVA0_DTVB0_DTVMXSA0_DTVMXSB0_DTVSM0_DPLB0_EPS0_ELFLR0_EMLLn1_FDSI0_GRPM1_GRVWA8_GRVWB8_GSU0_GSUAMB_GSUC0_GSUWGMRR0_GLS0_ISA950_IU1_K1_LDSTI0_LBSPPA1024_LBSPPB1024_LBSPPM0_LPA16_LPB16_LPM0_LRVWn1_LWPMn1_MIAV0_MIWT4_4_MO40_MGRIPM1_NTn1_NTA0_NTB0_NTC0_NTD4_NTM0_NEPBS16_NLCA1_NLCB1_ONLL1_PGR2_PLR1_PKA1_SGROB0_SIA3_SS1_SU0_SUM0_SUS0_SPO0_SRVW0_SSO1_SVW4_SK3_SKFTR0_SKXCCM4_SGRO0_TDMI0_TIN1_TLDS1_TLDSMn1_ULSGRO1_USL1_UIOFGRO0_UPLRP0_USFGRO0_VSn1_VWA4_VWB4_WSGRA2_WSGRB2_WS64_WG32_8_1_WGM24_WGMXCC1_WGMXCCGn1
    SolutionIndex: 172
    SolutionNameMin: Cijk_Alik_Bljk_BBS_BH_BiasSB_HAS_SAV_UserArgs_MT128x96x64_MI16x16x1_SN_LDSB0_AFC1_AG0_AFEM1_AFEM1_ASEM1_CLR1_CADS0_DTLA1_DTLB1_DTVA0_DTVB0_DTVMXSA0_DTVMXSB0_DTVSM0_DPLB1_EPS0_ELFLR0_EMLLn1_FDSI0_GRPM1_GRVWA8_GRVWB8_GSU0_GSUAMB_GSUC0_GSUWGMRR0_GLS0_ISA950_IU1_K1_LDSTI0_LBSPPA1024_LBSPPB1024_LBSPPM0_LPA32_LPB32_LPM0_LRVWn1_LWPMn1_MIAV1_MIWT4_3_MO40_MGRIPM1_NTn1_NTA4_NTB0_NTC0_NTD0_NTM0_NEPBS12_NLCA1_NLCB1_ONLL1_PGR2_PLR1_PKA1_SGROB1_SIA3_SS1_SU0_SUM0_SUS0_SPO0_SRVW0_SSO0_SVW4_SK3_SKFTR0_SKXCCM8_SGRO0_TDMI0_TIN1_TLDS1_TLDSMn1_ULSGRO0_USL1_UIOFGRO0_UPLRP0_USFGRO0_VSn1_VWA4_VWB1_WSGRA0_WSGRB0_WS64_WG32_8_1_WGM24_WGMXCC1_WGMXCCGn1
    SolutionIndex: 173
    SolutionNameMin: Cijk_Alik_Bljk_BBS_BH_BiasSB_HAS_SAV_UserArgs_MT80x64x128_MI16x16x1_SN_LDSB0_AFC1_AG1_AFEM1_AFEM1_ASEM1_CLR1_CADS0_DTLA1_DTLB1_DTVA0_DTVB0_DTVMXSA0_DTVMXSB0_DTVSM0_DPLB1_EPS0_ELFLR0_EMLLn1_FDSI0_GRPM1_GRVWA2_GRVWB8_GSU0_GSUAMB_GSUC0_GSUWGMRR0_GLS0_ISA950_IU1_K1_LDSTI0_LBSPPA256_LBSPPB1024_LBSPPM0_LPA16_LPB32_LPM0_LRVWn1_LWPMn1_MIAV0_MIWT5_1_MO40_MGRIPM1_NTn1_NTA4_NTB0_NTC0_NTD0_NTM0_NEPBS0_NLCA1_NLCB1_ONLL1_PGR2_PLR1_PKA1_SGROB0_SIA3_SS0_SU0_SUM0_SUS0_SPO0_SRVW0_SSO0_SVW4_SK3_SKFTR0_SKXCCM4_SGRO0_TDMI0_TIN1_TLDS2_TLDSMn1_ULSGRO0_USL1_UIOFGRO0_UPLRP0_USFGRO0_VSn1_VWA1_VWB1_WSGRA0_WSGRB0_WS64_WG16_16_1_WGM2_WGMXCC1_WGMXCCGn1
    SolutionIndex: 174
    SolutionNameMin: Cijk_Alik_Bljk_BBS_BH_BiasSB_HAS_SAV_UserArgs_MT80x64x64_MI16x16x1_SN_LDSB0_AFC1_AG0_AFEM1_AFEM1_ASEM1_CLR0_CADS0_DTLA1_DTLB1_DTVA0_DTVB0_DTVMXSA0_DTVMXSB0_DTVSM0_DPLB1_EPS0_ELFLR0_EMLL0_FDSI0_GRPM1_GRVWA2_GRVWB8_GSU0_GSUAMB_GSUC0_GSUWGMRR0_GLS0_ISA950_IU1_K1_LDSTI0_LBSPPA256_LBSPPB1024_LBSPPM0_LPA32_LPB32_LPM0_LRVWn1_LWPMn1_MIAV0_MIWT5_1_MO40_MGRIPM1_NTn1_NTA4_NTB0_NTC0_NTD0_NTM0_NEPBS0_NLCA1_NLCB1_ONLL1_PGR4_PLR1_PKA1_SGROB1_SIA3_SS0_SU0_SUM0_SUS128_SPO0_SRVW0_SSO1_SVW4_SK3_SKFTR0_SKXCCM4_SGRO0_TDMI0_TIN0_TLDS1_TLDSMn1_ULSGRO0_USL1_UIOFGRO0_UPLRP0_USFGRO0_VSn1_VWA1_VWB1_WSGRA0_WSGRB0_WS64_WG16_16_1_WGM6_WGMXCC1_WGMXCCGn1
    SolutionIndex: 175
    SolutionNameMin: Cijk_Alik_Bljk_BBS_BH_BiasSB_HAS_SAV_UserArgs_MT128x192x64_MI16x16x1_CMS_SN_LDSB0_AFC1_AG0_AFEM1_AFEM1_ASEM1_CLR0_CADS0_DTLA1_DTLB1_DTVA0_DTVB0_DTVMXSA0_DTVMXSB0_DTVSM0_DPLB0_EPS0_ELFLR0_EMLLn1_FDSI0_GRPM1_GRVWA8_GRVWB8_GSU0_GSUAMB_GSUC0_GSUWGMRR0_GLS0_ISA950_IU1_K1_LDSTI0_LBSPPA1024_LBSPPB1024_LBSPPM0_LPA32_LPB32_LPM0_LRVW8_LWPMn1_MIAV0_MIWT4_6_MO40_MGRIPM1_NTn1_NTA4_NTB0_NTC4_NTD4_NTM0_NEPBS0_NLCA1_NLCB1_ONLL1_PGR2_PLR1_PKA1_SGROB1_SIA3_SS1_SU8_SUM0_SUS512_SPO0_SRVW0_SSO0_SVW4_SK3_SKFTR0_SKXCCM4_SGRO0_TDMI0_TIN0_TLDS1_TLDSMn1_ULSGRO0_USL1_UIOFGRO0_UPLRP0_USFGRO0_VSn1_VWA4_VWB2_WSGRA0_WSGRB0_WS64_WG32_8_1_WGM6_WGMXCC1_WGMXCCGn1
    SolutionIndex: 176
    SolutionNameMin: Cijk_Alik_Bljk_BBS_BH_BiasSB_HAS_SAV_UserArgs_MT48x64x256_MI16x16x1_SN_LDSB0_AFC1_AG0_AFEM1_AFEM1_ASEM1_CLR0_CADS0_DTLA0_DTLB0_DTVA0_DTVB0_DTVMXSA0_DTVMXSB0_DTVSM0_DPLB0_EPS0_ELFLR0_EMLLn1_FDSI0_GRPM1_GRVWA8_GRVWB8_GSU0_GSUAMB_GSUC0_GSUWGMRR0_GLS0_ISA950_IU1_K1_LDSTI0_LBSPPA512_LBSPPB512_LBSPPM0_LPA16_LPB16_LPM0_LRVWn1_LWPMn1_MIAV0_MIWT3_1_MO40_MGRIPM1_NTn1_NTA4_NTB0_NTC0_NTD0_NTM0_NEPBS12_NLCA1_NLCB1_ONLL1_PGR2_PLR1_PKA1_SGROB0_SIA3_SS0_SU0_SUM0_SUS0_SPO0_SRVW0_SSO0_SVW4_SK3_SKFTR0_SKXCCM0_SGRO0_TDMI0_TIN1_TLDS2_TLDSMn1_ULSGRO0_USL1_UIOFGRO0_UPLRP0_USFGRO1_VSn1_VWA1_VWB1_WSGRA0_WSGRB0_WS64_WG16_16_1_WGM24_WGMXCC4_WGMXCCGn1
    SolutionIndex: 177
    SolutionNameMin: Cijk_Alik_Bljk_BBS_BH_BiasSB_HAS_SAV_UserArgs_MT128x64x128_MI16x16x1_SN_LDSB0_AFC1_AG1_AFEM1_AFEM1_ASEM1_CLR0_CADS0_DTLA1_DTLB1_DTVA0_DTVB0_DTVMXSA0_DTVMXSB0_DTVSM0_DPLB1_EPS0_ELFLR0_EMLLn1_FDSI0_GRPM1_GRVWA8_GRVWB8_GSU0_GSUAMB_GSUC0_GSUWGMRR0_GLS0_ISA950_IU1_K1_LDSTI0_LBSPPA1024_LBSPPB1024_LBSPPM0_LPA16_LPB32_LPM0_LRVWn1_LWPMn1_MIAV1_MIWT4_2_MO40_MGRIPM1_NTn1_NTA0_NTB0_NTC0_NTD4_NTM0_NEPBS16_NLCA1_NLCB1_ONLL1_PGR2_PLR1_PKA1_SGROB0_SIA3_SS1_SU0_SUM0_SUS0_SPO0_SRVW0_SSO0_SVW4_SK3_SKFTR0_SKXCCM4_SGRO0_TDMI0_TIN1_TLDS1_TLDSMn1_ULSGRO1_USL1_UIOFGRO0_UPLRP0_USFGRO0_VSn1_VWA4_VWB2_WSGRA0_WSGRB0_WS64_WG32_8_1_WGM48_WGMXCC1_WGMXCCGn1
    SolutionIndex: 178
    SolutionNameMin: Cijk_Alik_Bljk_BBS_BH_BiasSB_HAS_SAV_UserArgs_MT128x192x64_MI16x16x1_CMS_SN_LDSB0_AFC1_AG1_AFEM1_AFEM1_ASEM1_CLR1_CADS0_DTLA1_DTLB1_DTVA0_DTVB0_DTVMXSA0_DTVMXSB0_DTVSM0_DPLB0_EPS0_ELFLR0_EMLL0_FDSI0_GRPM1_GRVWA8_GRVWB8_GSU0_GSUAMB_GSUC0_GSUWGMRR0_GLS0_ISA950_IU1_K1_LDSTI0_LBSPPA1024_LBSPPB1024_LBSPPM0_LPA32_LPB32_LPM0_LRVW8_LWPMn1_MIAV0_MIWT4_6_MO40_MGRIPM1_NTn1_NTA4_NTB0_NTC4_NTD4_NTM0_NEPBS0_NLCA1_NLCB1_ONLL1_PGR2_PLR1_PKA1_SGROB1_SIA3_SS1_SU0_SUM0_SUS128_SPO0_SRVW0_SSO0_SVW4_SK3_SKFTR0_SKXCCM8_SGRO0_TDMI0_TIN0_TLDS1_TLDSMn1_ULSGRO0_USL1_UIOFGRO0_UPLRP0_USFGRO0_VSn1_VWA4_VWB2_WSGRA0_WSGRB0_WS64_WG32_8_1_WGM32_WGMXCC1_WGMXCCGn1
    SolutionIndex: 179
    SolutionNameMin: Cijk_Alik_Bljk_BBS_BH_BiasSB_HAS_SAV_UserArgs_MT48x64x256_MI16x16x1_SN_LDSB0_AFC1_AG0_AFEM1_AFEM1_ASEM1_CLR1_CADS0_DTLA0_DTLB0_DTVA0_DTVB0_DTVMXSA0_DTVMXSB0_DTVSM0_DPLB0_EPS0_ELFLR0_EMLLn1_FDSI0_GRPM1_GRVWA8_GRVWB8_GSU0_GSUAMB_GSUC0_GSUWGMRR0_GLS0_ISA950_IU1_K1_LDSTI0_LBSPPA512_LBSPPB512_LBSPPM0_LPA16_LPB16_LPM0_LRVWn1_LWPMn1_MIAV1_MIWT3_1_MO40_MGRIPM1_NTn1_NTA4_NTB0_NTC0_NTD0_NTM0_NEPBS0_NLCA1_NLCB1_ONLL1_PGR2_PLR1_PKA1_SGROB0_SIA3_SS0_SU0_SUM0_SUS0_SPO0_SRVW0_SSO0_SVW4_SK3_SKFTR0_SKXCCM4_SGRO0_TDMI0_TIN1_TLDS1_TLDSMn1_ULSGRO0_USL1_UIOFGRO0_UPLRP0_USFGRO1_VSn1_VWA1_VWB1_WSGRA0_WSGRB0_WS64_WG16_16_1_WGM24_WGMXCC1_WGMXCCGn1
    SolutionIndex: 180
    SolutionNameMin: Cijk_Alik_Bljk_BBS_BH_BiasSB_HAS_SAV_UserArgs_MT128x96x64_MI16x16x1_SN_LDSB0_AFC1_AG0_AFEM1_AFEM1_ASEM1_CLR1_CADS0_DTLA1_DTLB1_DTVA0_DTVB0_DTVMXSA0_DTVMXSB0_DTVSM0_DPLB1_EPS0_ELFLR0_EMLLn1_FDSI0_GRPM1_GRVWA8_GRVWB8_GSU0_GSUAMB_GSUC0_GSUWGMRR0_GLS0_ISA950_IU1_K1_LDSTI0_LBSPPA1024_LBSPPB1024_LBSPPM0_LPA32_LPB32_LPM0_LRVWn1_LWPMn1_MIAV0_MIWT4_3_MO40_MGRIPM1_NTn1_NTA4_NTB0_NTC0_NTD0_NTM0_NEPBS16_NLCA1_NLCB1_ONLL1_PGR3_PLR1_PKA1_SGROB0_SIA3_SS1_SU0_SUM0_SUS0_SPO1_SRVW0_SSO0_SVW4_SK3_SKFTR0_SKXCCM0_SGRO0_TDMI0_TIN1_TLDS2_TLDSMn1_ULSGRO0_USL1_UIOFGRO0_UPLRP0_USFGRO0_VSn1_VWA4_VWB1_WSGRA0_WSGRB0_WS64_WG32_8_1_WGM4_WGMXCC32_WGMXCCGn1
    SolutionIndex: 181
    SolutionNameMin: Cijk_Alik_Bljk_BBS_BH_BiasSB_HAS_SAV_UserArgs_MT96x160x64_MI16x16x1_SN_LDSB0_AFC1_AG1_AFEM1_AFEM1_ASEM1_CLR0_CADS0_DTLA1_DTLB1_DTVA0_DTVB0_DTVMXSA0_DTVMXSB0_DTVSM0_DPLB1_EPS0_ELFLR0_EMLLn1_FDSI0_GRPM1_GRVWA8_GRVWB8_GSU0_GSUAMB_GSUC0_GSUWGMRR0_GLS0_ISA950_IU1_K1_LDSTI0_LBSPPA1024_LBSPPB1024_LBSPPM0_LPA32_LPB32_LPM0_LRVWn1_LWPMn1_MIAV1_MIWT3_5_MO40_MGRIPM1_NTn1_NTA4_NTB0_NTC0_NTD0_NTM0_NEPBS2_NLCA1_NLCB1_ONLL1_PGR3_PLR1_PKA1_SGROB0_SIA3_SS1_SU0_SUM0_SUS0_SPO1_SRVW0_SSO0_SVW1_SK3_SKFTR0_SKXCCM0_SGRO0_TDMI0_TIN1_TLDS2_TLDSMn1_ULSGRO0_USL1_UIOFGRO0_UPLRP0_USFGRO0_VSn1_VWA1_VWB1_WSGRA0_WSGRB0_WS64_WG32_8_1_WGM6_WGMXCC2_WGMXCCGn1
    SolutionIndex: 182
    SolutionNameMin: Cijk_Alik_Bljk_BBS_BH_BiasSB_HAS_SAV_UserArgs_MT48x64x128_MI16x16x1_SN_LDSB0_AFC1_AG0_AFEM1_AFEM1_ASEM1_CLR0_CADS0_DTLA1_DTLB1_DTVA0_DTVB0_DTVMXSA0_DTVMXSB0_DTVSM0_DPLB1_EPS0_ELFLR0_EMLLn1_FDSI0_GRPM1_GRVWA2_GRVWB8_GSU0_GSUAMB_GSUC0_GSUWGMRR0_GLS0_ISA950_IU1_K1_LDSTI0_LBSPPA256_LBSPPB1024_LBSPPM0_LPA16_LPB32_LPM0_LRVWn1_LWPMn1_MIAV0_MIWT3_1_MO40_MGRIPM1_NTn1_NTA4_NTB0_NTC0_NTD0_NTM0_NEPBS14_NLCA1_NLCB1_ONLL1_PGR3_PLR1_PKA1_SGROB1_SIA3_SS0_SU0_SUM0_SUS0_SPO1_SRVW0_SSO0_SVW4_SK3_SKFTR0_SKXCCM4_SGRO0_TDMI0_TIN1_TLDS2_TLDSMn1_ULSGRO0_USL1_UIOFGRO0_UPLRP0_USFGRO0_VSn1_VWA1_VWB1_WSGRA0_WSGRB0_WS64_WG16_16_1_WGM24_WGMXCC1_WGMXCCGn1
    SolutionIndex: 183
    SolutionNameMin: Cijk_Alik_Bljk_BBS_BH_BiasSB_HAS_SAV_UserArgs_MT64x48x256_MI16x16x1_SN_LDSB0_AFC1_AG1_AFEM1_AFEM1_ASEM1_CLR1_CADS0_DTLA0_DTLB0_DTVA0_DTVB0_DTVMXSA0_DTVMXSB0_DTVSM0_DPLB0_EPS0_ELFLR0_EMLLn1_FDSI0_GRPM1_GRVWA8_GRVWB8_GSU0_GSUAMB_GSUC0_GSUWGMRR0_GLS0_ISA950_IU1_K1_LDSTI0_LBSPPA512_LBSPPB512_LBSPPM0_LPA16_LPB16_LPM0_LRVWn1_LWPMn1_MIAV0_MIWT1_3_MO40_MGRIPM1_NTn1_NTA4_NTB0_NTC0_NTD0_NTM0_NEPBS4_NLCA1_NLCB1_ONLL1_PGR2_PLR1_PKA1_SGROB0_SIA3_SS0_SU0_SUM0_SUS0_SPO0_SRVW0_SSO0_SVW4_SK3_SKFTR0_SKXCCM8_SGRO0_TDMI0_TIN1_TLDS2_TLDSMn1_ULSGRO1_USL1_UIOFGRO0_UPLRP0_USFGRO1_VSn1_VWA1_VWB1_WSGRA0_WSGRB0_WS64_WG64_4_1_WGM4_WGMXCC1_WGMXCCGn1
    SolutionIndex: 184
    SolutionNameMin: Cijk_Alik_Bljk_BBS_BH_BiasSB_HAS_SAV_UserArgs_MT64x32x64_MI16x16x1_SN_LDSB0_AFC1_AG0_AFEM1_AFEM1_ASEM1_CLR1_CADS0_DTLA1_DTLB1_DTVA0_DTVB0_DTVMXSA0_DTVMXSB0_DTVSM0_DPLB1_EPS0_ELFLR0_EMLL0_FDSI0_GRPM1_GRVWA2_GRVWB8_GSU0_GSUAMB_GSUC0_GSUWGMRR0_GLS0_ISA950_IU1_K1_LDSTI0_LBSPPA256_LBSPPB1024_LBSPPM0_LPA16_LPB32_LPM0_LRVWn1_LWPMn1_MIAV0_MIWT2_1_MO40_MGRIPM1_NTn1_NTA4_NTB0_NTC0_NTD0_NTM0_NEPBS14_NLCA1_NLCB1_ONLL1_PGR4_PLR1_PKA1_SGROB0_SIA3_SS0_SU0_SUM0_SUS0_SPO1_SRVW0_SSO0_SVW8_SK3_SKFTR0_SKXCCM4_SGRO0_TDMI0_TIN1_TLDS2_TLDSMn1_ULSGRO0_USL1_UIOFGRO0_UPLRP0_USFGRO0_VSn1_VWA2_VWB1_WSGRA0_WSGRB0_WS64_WG32_8_1_WGM16_WGMXCC1_WGMXCCGn1
    SolutionIndex: 185
    SolutionNameMin: Cijk_Alik_Bljk_BBS_BH_BiasSB_HAS_SAV_UserArgs_MT64x32x64_MI16x16x1_SN_LDSB0_AFC1_AG0_AFEM1_AFEM1_ASEM1_CLR0_CADS0_DTLA1_DTLB1_DTVA0_DTVB0_DTVMXSA0_DTVMXSB0_DTVSM0_DPLB1_EPS0_ELFLR0_EMLL0_FDSI0_GRPM1_GRVWA8_GRVWB8_GSU0_GSUAMB_GSUC0_GSUWGMRR0_GLS0_ISA950_IU1_K1_LDSTI0_LBSPPA1024_LBSPPB1024_LBSPPM0_LPA32_LPB32_LPM0_LRVWn1_LWPMn1_MIAV0_MIWT2_1_MO40_MGRIPM1_NTn1_NTA4_NTB0_NTC0_NTD0_NTM0_NEPBS14_NLCA1_NLCB1_ONLL1_PGR4_PLR1_PKA1_SGROB0_SIA3_SS1_SU0_SUM0_SUS0_SPO1_SRVW0_SSO0_SVW2_SK3_SKFTR0_SKXCCM4_SGRO0_TDMI0_TIN1_TLDS1_TLDSMn1_ULSGRO1_USL1_UIOFGRO0_UPLRP0_USFGRO0_VSn1_VWA2_VWB1_WSGRA0_WSGRB0_WS64_WG32_8_1_WGM8_WGMXCC1_WGMXCCGn1
    SolutionIndex: 186
    SolutionNameMin: Cijk_Alik_Bljk_BBS_BH_BiasSB_HAS_SAV_UserArgs_MT96x96x128_MI16x16x1_SN_LDSB0_AFC1_AG0_AFEM1_AFEM1_ASEM1_CLR1_CADS0_DTLA0_DTLB0_DTVA0_DTVB0_DTVMXSA0_DTVMXSB0_DTVSM0_DPLB0_EPS0_ELFLR0_EMLLn1_FDSI0_GRPM1_GRVWA8_GRVWB8_GSU0_GSUAMB_GSUC0_GSUWGMRR0_GLS0_ISA950_IU1_K1_LDSTI0_LBSPPA256_LBSPPB256_LBSPPM0_LPA16_LPB16_LPM0_LRVWn1_LWPMn1_MIAV1_MIWT3_3_MO40_MGRIPM1_NTn1_NTA0_NTB0_NTC0_NTD4_NTM0_NEPBS0_NLCA1_NLCB1_ONLL1_PGR2_PLR1_PKA1_SGROB0_SIA3_SS1_SU0_SUM0_SUS0_SPO0_SRVW0_SSO0_SVW1_SK3_SKFTR0_SKXCCM8_SGRO0_TDMI0_TIN1_TLDS1_TLDSMn1_ULSGRO1_USL1_UIOFGRO0_UPLRP0_USFGRO0_VSn1_VWA1_VWB1_WSGRA0_WSGRB0_WS64_WG32_8_1_WGM6_WGMXCC1_WGMXCCGn1
    SolutionIndex: 187
    SolutionNameMin: Cijk_Alik_Bljk_BBS_BH_BiasSB_HAS_SAV_UserArgs_MT128x128x128_MI16x16x1_SN_LDSB0_AFC1_AG1_AFEM1_AFEM1_ASEM1_CLR0_CADS0_DTLA0_DTLB0_DTVA0_DTVB0_DTVMXSA0_DTVMXSB0_DTVSM0_DPLB0_EPS0_ELFLR0_EMLLn1_FDSI0_GRPM1_GRVWA8_GRVWB8_GSU0_GSUAMB_GSUC0_GSUWGMRR0_GLS0_ISA950_IU1_K1_LDSTI0_LBSPPA1024_LBSPPB1024_LBSPPM0_LPA16_LPB16_LPM0_LRVWn1_LWPMn1_MIAV0_MIWT4_4_MO40_MGRIPM1_NTn1_NTA0_NTB0_NTC0_NTD4_NTM0_NEPBS0_NLCA1_NLCB1_ONLL1_PGR2_PLR1_PKA1_SGROB0_SIA3_SS1_SU0_SUM0_SUS0_SPO1_SRVW0_SSO0_SVW4_SK3_SKFTR0_SKXCCM4_SGRO0_TDMI0_TIN1_TLDS1_TLDSMn1_ULSGRO1_USL1_UIOFGRO0_UPLRP0_USFGRO0_VSn1_VWA4_VWB4_WSGRA2_WSGRB0_WS64_WG32_8_1_WGM16_WGMXCC1_WGMXCCGn1
    SolutionIndex: 188
    SolutionNameMin: Cijk_Alik_Bljk_BBS_BH_BiasSB_HAS_SAV_UserArgs_MT64x16x128_MI16x16x1_SN_LDSB0_AFC1_AG0_AFEM1_AFEM1_ASEM1_CLR0_CADS0_DTLA1_DTLB1_DTVA0_DTVB0_DTVMXSA0_DTVMXSB0_DTVSM0_DPLB1_EPS0_ELFLR0_EMLLn1_FDSI0_GRPM1_GRVWA8_GRVWB8_GSU0_GSUAMB_GSUC0_GSUWGMRR0_GLS0_ISA950_IU1_K1_LDSTI0_LBSPPA1024_LBSPPB1024_LBSPPM0_LPA32_LPB32_LPM0_LRVWn1_LWPMn1_MIAV0_MIWT1_1_MO40_MGRIPM1_NTn1_NTA4_NTB0_NTC0_NTD0_NTM0_NEPBS14_NLCA1_NLCB1_ONLL1_PGR4_PLR1_PKA1_SGROB0_SIA3_SS0_SU0_SUM0_SUS0_SPO0_SRVW0_SSO0_SVW4_SK3_SKFTR0_SKXCCM4_SGRO0_TDMI0_TIN1_TLDS1_TLDSMn1_ULSGRO0_USL1_UIOFGRO0_UPLRP0_USFGRO0_VSn1_VWA1_VWB1_WSGRA0_WSGRB0_WS64_WG64_4_1_WGM32_WGMXCC1_WGMXCCGn1
    SolutionIndex: 189
    SolutionNameMin: Cijk_Alik_Bljk_BBS_BH_BiasSB_HAS_SAV_UserArgs_MT64x16x128_MI16x16x1_SN_LDSB0_AFC1_AG0_AFEM1_AFEM1_ASEM1_CLR1_CADS0_DTLA1_DTLB1_DTVA0_DTVB0_DTVMXSA0_DTVMXSB0_DTVSM0_DPLB1_EPS0_ELFLR0_EMLL0_FDSI0_GRPM1_GRVWA8_GRVWB8_GSU0_GSUAMB_GSUC0_GSUWGMRR0_GLS0_ISA950_IU1_K1_LDSTI0_LBSPPA1024_LBSPPB1024_LBSPPM0_LPA32_LPB32_LPM0_LRVWn1_LWPMn1_MIAV0_MIWT1_1_MO40_MGRIPM1_NTn1_NTA4_NTB0_NTC0_NTD0_NTM0_NEPBS8_NLCA1_NLCB1_ONLL1_PGR4_PLR1_PKA1_SGROB0_SIA3_SS0_SU0_SUM0_SUS0_SPO0_SRVW0_SSO0_SVW4_SK3_SKFTR0_SKXCCM4_SGRO0_TDMI0_TIN1_TLDS1_TLDSMn1_ULSGRO0_USL1_UIOFGRO0_UPLRP0_USFGRO0_VSn1_VWA1_VWB1_WSGRA0_WSGRB0_WS64_WG64_4_1_WGM16_WGMXCC1_WGMXCCGn1
    SolutionIndex: 190
    SolutionNameMin: Cijk_Alik_Bljk_BBS_BH_BiasSB_HAS_SAV_UserArgs_MT96x128x64_MI16x16x1_SN_LDSB0_AFC1_AG1_AFEM1_AFEM1_ASEM1_CLR1_CADS0_DTLA1_DTLB1_DTVA0_DTVB0_DTVMXSA0_DTVMXSB0_DTVSM0_DPLB1_EPS0_ELFLR0_EMLLn1_FDSI0_GRPM1_GRVWA8_GRVWB8_GSU0_GSUAMB_GSUC0_GSUWGMRR0_GLS0_ISA950_IU1_K1_LDSTI0_LBSPPA1024_LBSPPB1024_LBSPPM0_LPA32_LPB32_LPM0_LRVWn1_LWPMn1_MIAV0_MIWT3_4_MO40_MGRIPM1_NTn1_NTA4_NTB0_NTC0_NTD4_NTM0_NEPBS4_NLCA1_NLCB1_ONLL1_PGR3_PLR1_PKA1_SGROB0_SIA3_SS1_SU0_SUM0_SUS0_SPO0_SRVW0_SSO0_SVW1_SK3_SKFTR0_SKXCCM0_SGRO0_TDMI0_TIN1_TLDS1_TLDSMn1_ULSGRO1_USL1_UIOFGRO0_UPLRP0_USFGRO0_VSn1_VWA1_VWB4_WSGRA0_WSGRB0_WS64_WG32_8_1_WGMn48_WGMXCC1_WGMXCCGn1
    SolutionIndex: 191
    SolutionNameMin: Cijk_Alik_Bljk_BBS_BH_BiasSB_HAS_SAV_UserArgs_MT96x128x64_MI16x16x1_SN_LDSB0_AFC1_AG1_AFEM1_AFEM1_ASEM1_CLR1_CADS0_DTLA1_DTLB1_DTVA0_DTVB0_DTVMXSA0_DTVMXSB0_DTVSM0_DPLB1_EPS0_ELFLR0_EMLLn1_FDSI0_GRPM1_GRVWA8_GRVWB8_GSU0_GSUAMB_GSUC0_GSUWGMRR0_GLS0_ISA950_IU1_K1_LDSTI0_LBSPPA1024_LBSPPB1024_LBSPPM0_LPA32_LPB32_LPM0_LRVWn1_LWPMn1_MIAV1_MIWT3_4_MO40_MGRIPM1_NTn1_NTA4_NTB0_NTC0_NTD4_NTM0_NEPBS4_NLCA1_NLCB1_ONLL1_PGR3_PLR1_PKA1_SGROB1_SIA3_SS1_SU0_SUM0_SUS0_SPO0_SRVW0_SSO0_SVW1_SK3_SKFTR0_SKXCCM0_SGRO0_TDMI0_TIN1_TLDS2_TLDSMn1_ULSGRO1_USL1_UIOFGRO0_UPLRP0_USFGRO0_VSn1_VWA1_VWB4_WSGRA0_WSGRB0_WS64_WG32_8_1_WGMn48_WGMXCC1_WGMXCCGn1
    SolutionIndex: 192
    SolutionNameMin: Cijk_Alik_Bljk_BBS_BH_BiasSB_HAS_SAV_UserArgs_MT96x128x64_MI16x16x1_SN_LDSB0_AFC1_AG1_AFEM1_AFEM1_ASEM1_CLR0_CADS0_DTLA1_DTLB1_DTVA0_DTVB0_DTVMXSA0_DTVMXSB0_DTVSM0_DPLB1_EPS0_ELFLR0_EMLLn1_FDSI0_GRPM1_GRVWA8_GRVWB8_GSU0_GSUAMB_GSUC0_GSUWGMRR0_GLS0_ISA950_IU1_K1_LDSTI0_LBSPPA1024_LBSPPB1024_LBSPPM0_LPA32_LPB32_LPM0_LRVWn1_LWPMn1_MIAV1_MIWT3_4_MO40_MGRIPM1_NTn1_NTA4_NTB0_NTC0_NTD4_NTM0_NEPBS2_NLCA1_NLCB1_ONLL1_PGR3_PLR1_PKA1_SGROB1_SIA3_SS1_SU0_SUM0_SUS0_SPO0_SRVW0_SSO0_SVW1_SK3_SKFTR0_SKXCCM0_SGRO0_TDMI0_TIN1_TLDS2_TLDSMn1_ULSGRO1_USL1_UIOFGRO0_UPLRP0_USFGRO0_VSn1_VWA1_VWB4_WSGRA0_WSGRB0_WS64_WG32_8_1_WGMn1_WGMXCC1_WGMXCCGn1
    SolutionIndex: 193
    SolutionNameMin: Cijk_Alik_Bljk_BBS_BH_BiasSB_HAS_SAV_UserArgs_MT96x96x64_MI16x16x1_SN_LDSB0_AFC1_AG1_AFEM1_AFEM1_ASEM1_CLR1_CADS0_DTLA1_DTLB1_DTVA0_DTVB0_DTVMXSA0_DTVMXSB0_DTVSM0_DPLB1_EPS0_ELFLR0_EMLLn1_FDSI0_GRPM1_GRVWA8_GRVWB8_GSU0_GSUAMB_GSUC0_GSUWGMRR0_GLS0_ISA950_IU1_K1_LDSTI0_LBSPPA1024_LBSPPB1024_LBSPPM0_LPA32_LPB32_LPM0_LRVWn1_LWPMn1_MIAV1_MIWT3_3_MO40_MGRIPM1_NTn1_NTA4_NTB0_NTC0_NTD0_NTM0_NEPBS4_NLCA1_NLCB1_ONLL1_PGR3_PLR1_PKA1_SGROB1_SIA3_SS1_SU0_SUM0_SUS0_SPO0_SRVW0_SSO0_SVW1_SK3_SKFTR0_SKXCCM0_SGRO0_TDMI0_TIN1_TLDS2_TLDSMn1_ULSGRO1_USL1_UIOFGRO0_UPLRP0_USFGRO0_VSn1_VWA1_VWB1_WSGRA0_WSGRB0_WS64_WG32_8_1_WGM24_WGMXCC32_WGMXCCGn1
    SolutionIndex: 194
    SolutionNameMin: Cijk_Alik_Bljk_BBS_BH_BiasSB_HAS_SAV_UserArgs_MT96x96x64_MI16x16x1_SN_LDSB0_AFC1_AG0_AFEM1_AFEM1_ASEM1_CLR1_CADS0_DTLA1_DTLB1_DTVA0_DTVB0_DTVMXSA0_DTVMXSB0_DTVSM0_DPLB1_EPS0_ELFLR0_EMLLn1_FDSI0_GRPM1_GRVWA8_GRVWB8_GSU0_GSUAMB_GSUC0_GSUWGMRR0_GLS0_ISA950_IU1_K1_LDSTI0_LBSPPA1024_LBSPPB1024_LBSPPM0_LPA32_LPB32_LPM0_LRVWn1_LWPMn1_MIAV1_MIWT3_3_MO40_MGRIPM1_NTn1_NTA4_NTB0_NTC0_NTD4_NTM0_NEPBS4_NLCA1_NLCB1_ONLL1_PGR3_PLR1_PKA1_SGROB1_SIA3_SS1_SU0_SUM0_SUS0_SPO0_SRVW0_SSO0_SVW1_SK3_SKFTR0_SKXCCM0_SGRO0_TDMI0_TIN1_TLDS1_TLDSMn1_ULSGRO1_USL1_UIOFGRO0_UPLRP0_USFGRO0_VSn1_VWA1_VWB1_WSGRA0_WSGRB0_WS64_WG32_8_1_WGM8_WGMXCC1_WGMXCCGn1
    SolutionIndex: 195
    SolutionNameMin: Cijk_Alik_Bljk_BBS_BH_BiasSB_HAS_SAV_UserArgs_MT96x96x128_MI16x16x1_SN_LDSB0_AFC1_AG1_AFEM1_AFEM1_ASEM1_CLR1_CADS0_DTLA0_DTLB0_DTVA0_DTVB0_DTVMXSA0_DTVMXSB0_DTVSM0_DPLB0_EPS0_ELFLR0_EMLLn1_FDSI0_GRPM1_GRVWA8_GRVWB8_GSU0_GSUAMB_GSUC0_GSUWGMRR0_GLS0_ISA950_IU1_K1_LDSTI0_LBSPPA256_LBSPPB256_LBSPPM0_LPA16_LPB16_LPM0_LRVWn1_LWPMn1_MIAV1_MIWT3_3_MO40_MGRIPM1_NTn1_NTA0_NTB0_NTC0_NTD4_NTM0_NEPBS0_NLCA1_NLCB1_ONLL1_PGR2_PLR1_PKA1_SGROB0_SIA3_SS1_SU0_SUM0_SUS0_SPO0_SRVW0_SSO0_SVW1_SK3_SKFTR0_SKXCCM8_SGRO0_TDMI0_TIN1_TLDS2_TLDSMn1_ULSGRO1_USL1_UIOFGRO0_UPLRP0_USFGRO0_VSn1_VWA1_VWB1_WSGRA0_WSGRB0_WS64_WG32_8_1_WGM4_WGMXCC1_WGMXCCGn1
    SolutionIndex: 196
    SolutionNameMin: Cijk_Alik_Bljk_BBS_BH_BiasSB_HAS_SAV_UserArgs_MT96x96x64_MI16x16x1_SN_LDSB0_AFC1_AG1_AFEM1_AFEM1_ASEM1_CLR0_CADS0_DTLA1_DTLB1_DTVA0_DTVB0_DTVMXSA0_DTVMXSB0_DTVSM0_DPLB1_EPS0_ELFLR0_EMLLn1_FDSI0_GRPM1_GRVWA8_GRVWB8_GSU0_GSUAMB_GSUC0_GSUWGMRR0_GLS0_ISA950_IU1_K1_LDSTI0_LBSPPA1024_LBSPPB1024_LBSPPM0_LPA32_LPB32_LPM0_LRVWn1_LWPMn1_MIAV0_MIWT3_3_MO40_MGRIPM1_NTn1_NTA4_NTB0_NTC0_NTD0_NTM0_NEPBS2_NLCA1_NLCB1_ONLL1_PGR3_PLR1_PKA1_SGROB1_SIA3_SS1_SU0_SUM0_SUS0_SPO1_SRVW0_SSO0_SVW1_SK3_SKFTR0_SKXCCM4_SGRO0_TDMI0_TIN1_TLDS1_TLDSMn1_ULSGRO1_USL1_UIOFGRO0_UPLRP0_USFGRO0_VSn1_VWA1_VWB1_WSGRA0_WSGRB0_WS64_WG32_8_1_WGMn6_WGMXCC1_WGMXCCGn1
    SolutionIndex: 197
    SolutionNameMin: Cijk_Alik_Bljk_BBS_BH_BiasSB_HAS_SAV_UserArgs_MT32x48x256_MI16x16x1_SN_LDSB0_AFC1_AG0_AFEM1_AFEM1_ASEM1_CLR1_CADS0_DTLA1_DTLB1_DTVA0_DTVB0_DTVMXSA0_DTVMXSB0_DTVSM0_DPLB0_EPS0_ELFLR0_EMLL0_FDSI0_GRPM1_GRVWA8_GRVWB8_GSU0_GSUAMB_GSUC0_GSUWGMRR0_GLS0_ISA950_IU1_K1_LDSTI0_LBSPPA1024_LBSPPB1024_LBSPPM0_LPA16_LPB32_LPM0_LRVWn1_LWPMn1_MIAV0_MIWT2_3_MO40_MGRIPM1_NTn1_NTA4_NTB0_NTC0_NTD0_NTM0_NEPBS4_NLCA1_NLCB1_ONLL1_PGR3_PLR1_PKA1_SGROB0_SIA3_SS1_SU8_SUM0_SUS512_SPO1_SRVW0_SSO0_SVW2_SK3_SKFTR0_SKXCCM8_SGRO0_TDMI0_TIN0_TLDS1_TLDSMn1_ULSGRO1_USL1_UIOFGRO0_UPLRP0_USFGRO0_VSn1_VWA2_VWB1_WSGRA0_WSGRB0_WS64_WG16_4_4_WGM24_WGMXCC32_WGMXCCGn1
    SolutionIndex: 198
    SolutionNameMin: Cijk_Alik_Bljk_BBS_BH_BiasSB_HAS_SAV_UserArgs_MT96x96x64_MI16x16x1_SN_LDSB0_AFC1_AG0_AFEM1_AFEM1_ASEM1_CLR0_CADS0_DTLA1_DTLB1_DTVA0_DTVB0_DTVMXSA0_DTVMXSB0_DTVSM0_DPLB1_EPS0_ELFLR0_EMLLn1_FDSI0_GRPM1_GRVWA8_GRVWB8_GSU0_GSUAMB_GSUC0_GSUWGMRR0_GLS0_ISA950_IU1_K1_LDSTI0_LBSPPA1024_LBSPPB1024_LBSPPM0_LPA32_LPB32_LPM0_LRVWn1_LWPMn1_MIAV1_MIWT3_3_MO40_MGRIPM1_NTn1_NTA4_NTB0_NTC4_NTD4_NTM0_NEPBS4_NLCA1_NLCB1_ONLL1_PGR3_PLR1_PKA1_SGROB1_SIA3_SS1_SU0_SUM0_SUS0_SPO0_SRVW0_SSO0_SVW1_SK3_SKFTR0_SKXCCM0_SGRO0_TDMI0_TIN1_TLDS1_TLDSMn1_ULSGRO1_USL1_UIOFGRO0_UPLRP0_USFGRO0_VSn1_VWA1_VWB1_WSGRA0_WSGRB0_WS64_WG32_8_1_WGM0_WGMXCC1_WGMXCCGn1
    SolutionIndex: 199
    SolutionNameMin: Cijk_Alik_Bljk_BBS_BH_BiasSB_HAS_SAV_UserArgs_MT16x32x256_MI16x16x1_SN_LDSB0_AFC1_AG1_AFEM1_AFEM1_ASEM1_CLR0_CADS0_DTLA1_DTLB1_DTVA0_DTVB0_DTVMXSA0_DTVMXSB0_DTVSM0_DPLB1_EPS0_ELFLR0_EMLLn1_FDSI0_GRPM1_GRVWA8_GRVWB8_GSU0_GSUAMB_GSUC0_GSUWGMRR0_GLS0_ISA950_IU1_K1_LDSTI0_LBSPPA1024_LBSPPB1024_LBSPPM0_LPA32_LPB32_LPM0_LRVWn1_LWPMn1_MIAV0_MIWT1_1_MO40_MGRIPM1_NTn1_NTA0_NTB0_NTC4_NTD0_NTM0_NEPBS12_NLCA1_NLCB1_ONLL1_PGR4_PLR1_PKA1_SGROB1_SIA3_SS0_SU0_SUM0_SUS0_SPO0_SRVW0_SSO0_SVW4_SK3_SKFTR0_SKXCCM0_SGRO0_TDMI0_TIN1_TLDS1_TLDSMn1_ULSGRO1_USL1_UIOFGRO0_UPLRP0_USFGRO0_VSn1_VWA1_VWB1_WSGRA0_WSGRB0_WS64_WG16_8_1_WGM48_WGMXCC2_WGMXCCGn1
    SolutionIndex: 200
    SolutionNameMin: Cijk_Alik_Bljk_BBS_BH_BiasSB_HAS_SAV_UserArgs_MT32x64x256_MI16x16x1_SN_LDSB0_AFC1_AG0_AFEM1_AFEM1_ASEM1_CLR1_CADS0_DTLA1_DTLB1_DTVA0_DTVB0_DTVMXSA0_DTVMXSB0_DTVSM0_DPLB0_EPS0_ELFLR0_EMLLn1_FDSI0_GRPM1_GRVWA8_GRVWB8_GSU0_GSUAMB_GSUC0_GSUWGMRR0_GLS0_ISA950_IU1_K1_LDSTI0_LBSPPA1024_LBSPPB1024_LBSPPM0_LPA16_LPB16_LPM0_LRVWn1_LWPMn1_MIAV0_MIWT2_2_MO40_MGRIPM1_NTn1_NTA4_NTB0_NTC0_NTD0_NTM0_NEPBS8_NLCA1_NLCB1_ONLL1_PGR3_PLR1_PKA1_SGROB0_SIA3_SS1_SU0_SUM0_SUS512_SPO0_SRVW0_SSO0_SVW2_SK3_SKFTR0_SKXCCM4_SGRO0_TDMI0_TIN0_TLDS1_TLDSMn1_ULSGRO1_USL1_UIOFGRO0_UPLRP0_USFGRO0_VSn1_VWA2_VWB2_WSGRA0_WSGRB0_WS64_WG16_8_2_WGM24_WGMXCC1_WGMXCCGn1
    SolutionIndex: 201
    SolutionNameMin: Cijk_Alik_Bljk_BBS_BH_BiasSB_HAS_SAV_UserArgs_MT32x16x256_MI16x16x1_SN_LDSB0_AFC1_AG1_AFEM1_AFEM1_ASEM1_CLR1_CADS0_DTLA1_DTLB1_DTVA0_DTVB0_DTVMXSA0_DTVMXSB0_DTVSM0_DPLB1_EPS0_ELFLR0_EMLLn1_FDSI0_GRPM1_GRVWA8_GRVWB8_GSU0_GSUAMB_GSUC0_GSUWGMRR0_GLS0_ISA950_IU1_K1_LDSTI0_LBSPPA1024_LBSPPB1024_LBSPPM0_LPA32_LPB32_LPM0_LRVWn1_LWPMn1_MIAV0_MIWT1_1_MO40_MGRIPM1_NTn1_NTA0_NTB0_NTC0_NTD0_NTM0_NEPBS10_NLCA1_NLCB1_ONLL1_PGR4_PLR1_PKA1_SGROB0_SIA3_SS0_SU0_SUM0_SUS0_SPO1_SRVW0_SSO0_SVW4_SK3_SKFTR0_SKXCCM0_SGRO0_TDMI0_TIN1_TLDS1_TLDSMn1_ULSGRO0_USL1_UIOFGRO0_UPLRP0_USFGRO0_VSn1_VWA1_VWB1_WSGRA0_WSGRB0_WS64_WG32_4_1_WGM16_WGMXCC1_WGMXCCGn1
    SolutionIndex: 202
    SolutionNameMin: Cijk_Alik_Bljk_BBS_BH_BiasSB_HAS_SAV_UserArgs_MT32x16x256_MI16x16x1_SN_LDSB0_AFC1_AG0_AFEM1_AFEM1_ASEM1_CLR0_CADS0_DTLA1_DTLB1_DTVA0_DTVB0_DTVMXSA0_DTVMXSB0_DTVSM0_DPLB1_EPS0_ELFLR0_EMLLn1_FDSI0_GRPM1_GRVWA8_GRVWB8_GSU0_GSUAMB_GSUC0_GSUWGMRR0_GLS0_ISA950_IU1_K1_LDSTI0_LBSPPA1024_LBSPPB1024_LBSPPM0_LPA32_LPB32_LPM0_LRVWn1_LWPMn1_MIAV0_MIWT1_1_MO40_MGRIPM1_NTn1_NTA0_NTB0_NTC4_NTD4_NTM0_NEPBS8_NLCA1_NLCB1_ONLL1_PGR3_PLR1_PKA1_SGROB1_SIA3_SS0_SU0_SUM0_SUS0_SPO1_SRVW0_SSO0_SVW4_SK3_SKFTR0_SKXCCM0_SGRO0_TDMI0_TIN1_TLDS2_TLDSMn1_ULSGRO1_USL1_UIOFGRO0_UPLRP0_USFGRO0_VSn1_VWA1_VWB1_WSGRA0_WSGRB0_WS64_WG32_4_1_WGM48_WGMXCC2_WGMXCCGn1
    SolutionIndex: 203
    SolutionNameMin: Cijk_Alik_Bljk_BBS_BH_BiasSB_HAS_SAV_UserArgs_MT32x16x256_MI16x16x1_SN_LDSB0_AFC1_AG1_AFEM1_AFEM1_ASEM1_CLR1_CADS0_DTLA1_DTLB1_DTVA0_DTVB0_DTVMXSA0_DTVMXSB0_DTVSM0_DPLB1_EPS0_ELFLR0_EMLL0_FDSI0_GRPM1_GRVWA8_GRVWB8_GSU0_GSUAMB_GSUC0_GSUWGMRR0_GLS0_ISA950_IU1_K1_LDSTI0_LBSPPA1024_LBSPPB1024_LBSPPM0_LPA32_LPB32_LPM0_LRVWn1_LWPMn1_MIAV0_MIWT1_1_MO40_MGRIPM1_NTn1_NTA0_NTB4_NTC0_NTD4_NTM0_NEPBS2_NLCA1_NLCB1_ONLL1_PGR4_PLR1_PKA1_SGROB1_SIA3_SS0_SU0_SUM0_SUS0_SPO0_SRVW0_SSO0_SVW4_SK3_SKFTR0_SKXCCM0_SGRO0_TDMI0_TIN1_TLDS1_TLDSMn1_ULSGRO1_USL1_UIOFGRO0_UPLRP0_USFGRO0_VSn1_VWA1_VWB1_WSGRA0_WSGRB0_WS64_WG32_4_1_WGM48_WGMXCC1_WGMXCCGn1
    SolutionIndex: 204
    SolutionNameMin: Cijk_Alik_Bljk_BBS_BH_BiasSB_HAS_SAV_UserArgs_MT16x32x256_MI16x16x1_SN_LDSB0_AFC1_AG0_AFEM1_AFEM1_ASEM1_CLR0_CADS0_DTLA1_DTLB1_DTVA0_DTVB0_DTVMXSA0_DTVMXSB0_DTVSM0_DPLB1_EPS0_ELFLR0_EMLLn1_FDSI0_GRPM1_GRVWA8_GRVWB8_GSU0_GSUAMB_GSUC0_GSUWGMRR0_GLS0_ISA950_IU1_K1_LDSTI0_LBSPPA1024_LBSPPB1024_LBSPPM0_LPA32_LPB32_LPM0_LRVWn1_LWPMn1_MIAV0_MIWT1_1_MO40_MGRIPM1_NTn1_NTA0_NTB0_NTC0_NTD0_NTM0_NEPBS14_NLCA1_NLCB1_ONLL1_PGR4_PLR1_PKA1_SGROB0_SIA3_SS0_SU0_SUM0_SUS0_SPO0_SRVW0_SSO0_SVW4_SK3_SKFTR0_SKXCCM0_SGRO0_TDMI0_TIN1_TLDS2_TLDSMn1_ULSGRO1_USL1_UIOFGRO0_UPLRP0_USFGRO0_VSn1_VWA1_VWB1_WSGRA0_WSGRB0_WS64_WG16_8_1_WGMn1_WGMXCC4_WGMXCCGn1
    SolutionIndex: 205
    SolutionNameMin: Cijk_Alik_Bljk_BBS_BH_BiasSB_HAS_SAV_UserArgs_MT32x64x256_MI16x16x1_SN_LDSB0_AFC1_AG1_AFEM1_AFEM1_ASEM1_CLR1_CADS0_DTLA1_DTLB1_DTVA0_DTVB0_DTVMXSA0_DTVMXSB0_DTVSM0_DPLB1_EPS0_ELFLR0_EMLLn1_FDSI0_GRPM1_GRVWA8_GRVWB8_GSU0_GSUAMB_GSUC0_GSUWGMRR0_GLS0_ISA950_IU1_K1_LDSTI0_LBSPPA1024_LBSPPB1024_LBSPPM0_LPA16_LPB32_LPM0_LRVWn1_LWPMn1_MIAV0_MIWT2_1_MO40_MGRIPM1_NTn1_NTA4_NTB0_NTC0_NTD0_NTM0_NEPBS16_NLCA1_NLCB1_ONLL1_PGR2_PLR1_PKA1_SGROB0_SIA3_SS0_SU0_SUM0_SUS0_SPO0_SRVW0_SSO0_SVW8_SK3_SKFTR0_SKXCCM8_SGRO0_TDMI0_TIN1_TLDS2_TLDSMn1_ULSGRO1_USL1_UIOFGRO0_UPLRP0_USFGRO0_VSn1_VWA2_VWB1_WSGRA0_WSGRB0_WS64_WG16_16_1_WGMn6_WGMXCC32_WGMXCCGn1
    SolutionIndex: 206
    SolutionNameMin: Cijk_Alik_Bljk_BBS_BH_BiasSB_HAS_SAV_UserArgs_MT16x16x256_MI16x16x1_SN_LDSB0_AFC1_AG0_AFEM1_AFEM1_ASEM1_CLR0_CADS0_DTLA0_DTLB0_DTVA0_DTVB0_DTVMXSA0_DTVMXSB0_DTVSM0_DPLB0_EPS0_ELFLR0_EMLLn1_FDSI0_GRPM1_GRVWA8_GRVWB8_GSU0_GSUAMB_GSUC0_GSUWGMRR0_GLS0_ISA950_IU1_K1_LDSTI0_LBSPPA512_LBSPPB512_LBSPPM0_LPA16_LPB16_LPM0_LRVWn1_LWPMn1_MIAV1_MIWT1_1_MO40_MGRIPM1_NTn1_NTA0_NTB0_NTC0_NTD0_NTM0_NEPBS0_NLCA1_NLCB1_ONLL1_PGR2_PLR1_PKA1_SGROB0_SIA3_SS1_SU16_SUM0_SUS512_SPO1_SRVW0_SSO0_SVW1_SK3_SKFTR0_SKXCCM0_SGRO0_TDMI0_TIN0_TLDS1_TLDSMn1_ULSGRO1_USL1_UIOFGRO0_UPLRP0_USFGRO1_VSn1_VWA1_VWB1_WSGRA0_WSGRB0_WS64_WG16_4_2_WGM16_WGMXCC2_WGMXCCGn1
    SolutionIndex: 207
    SolutionNameMin: Cijk_Alik_Bljk_BBS_BH_BiasSB_HAS_SAV_UserArgs_MT32x16x512_MI16x16x1_SN_LDSB0_AFC1_AG0_AFEM1_AFEM1_ASEM1_CLR0_CADS0_DTLA1_DTLB1_DTVA0_DTVB0_DTVMXSA0_DTVMXSB0_DTVSM0_DPLB1_EPS0_ELFLR0_EMLLn1_FDSI0_GRPM1_GRVWA8_GRVWB8_GSU0_GSUAMB_GSUC0_GSUWGMRR0_GLS0_ISA950_IU1_K1_LDSTI0_LBSPPA1024_LBSPPB1024_LBSPPM0_LPA16_LPB16_LPM0_LRVWn1_LWPMn1_MIAV1_MIWT1_1_MO40_MGRIPM1_NTn1_NTA0_NTB0_NTC0_NTD0_NTM0_NEPBS4_NLCA1_NLCB1_ONLL1_PGR2_PLR1_PKA1_SGROB1_SIA3_SS0_SU0_SUM0_SUS0_SPO1_SRVW0_SSO0_SVW4_SK3_SKFTR0_SKXCCM4_SGRO0_TDMI0_TIN1_TLDS1_TLDSMn1_ULSGRO1_USL1_UIOFGRO0_UPLRP0_USFGRO0_VSn1_VWA1_VWB1_WSGRA0_WSGRB0_WS64_WG32_4_1_WGMn4_WGMXCC2_WGMXCCGn1
    SolutionIndex: 208
    SolutionNameMin: Cijk_Alik_Bljk_BBS_BH_BiasSB_HAS_SAV_UserArgs_MT32x16x256_MI16x16x1_SN_LDSB0_AFC1_AG0_AFEM1_AFEM1_ASEM1_CLR0_CADS0_DTLA1_DTLB1_DTVA0_DTVB0_DTVMXSA0_DTVMXSB0_DTVSM0_DPLB1_EPS0_ELFLR0_EMLLn1_FDSI0_GRPM1_GRVWA8_GRVWB8_GSU0_GSUAMB_GSUC0_GSUWGMRR0_GLS0_ISA950_IU1_K1_LDSTI0_LBSPPA1024_LBSPPB1024_LBSPPM0_LPA32_LPB32_LPM0_LRVWn1_LWPMn1_MIAV1_MIWT1_1_MO40_MGRIPM1_NTn1_NTA0_NTB0_NTC0_NTD4_NTM0_NEPBS0_NLCA1_NLCB1_ONLL1_PGR3_PLR1_PKA1_SGROB0_SIA3_SS0_SU0_SUM0_SUS0_SPO0_SRVW0_SSO0_SVW4_SK3_SKFTR0_SKXCCM0_SGRO0_TDMI0_TIN1_TLDS2_TLDSMn1_ULSGRO0_USL1_UIOFGRO0_UPLRP0_USFGRO0_VSn1_VWA1_VWB1_WSGRA0_WSGRB0_WS64_WG32_4_1_WGM48_WGMXCC2_WGMXCCGn1
    SolutionIndex: 209
    SolutionNameMin: Cijk_Alik_Bljk_BBS_BH_BiasSB_HAS_SAV_UserArgs_MT32x32x256_MI16x16x1_SN_LDSB0_AFC1_AG0_AFEM1_AFEM1_ASEM1_CLR0_CADS0_DTLA1_DTLB1_DTVA0_DTVB0_DTVMXSA0_DTVMXSB0_DTVSM0_DPLB1_EPS0_ELFLR0_EMLLn1_FDSI0_GRPM1_GRVWA8_GRVWB8_GSU0_GSUAMB_GSUC0_GSUWGMRR0_GLS0_ISA950_IU1_K1_LDSTI0_LBSPPA1024_LBSPPB1024_LBSPPM0_LPA32_LPB32_LPM0_LRVWn1_LWPMn1_MIAV0_MIWT1_1_MO40_MGRIPM1_NTn1_NTA4_NTB0_NTC0_NTD0_NTM0_NEPBS0_NLCA1_NLCB1_ONLL1_PGR3_PLR1_PKA1_SGROB0_SIA3_SS0_SU0_SUM0_SUS0_SPO0_SRVW0_SSO0_SVW4_SK3_SKFTR0_SKXCCM4_SGRO0_TDMI0_TIN1_TLDS2_TLDSMn1_ULSGRO0_USL1_UIOFGRO0_UPLRP0_USFGRO0_VSn1_VWA1_VWB1_WSGRA0_WSGRB0_WS64_WG32_8_1_WGM8_WGMXCC1_WGMXCCGn1
    SolutionIndex: 210
    SolutionNameMin: Cijk_Alik_Bljk_BBS_BH_BiasSB_HAS_SAV_UserArgs_MT32x32x256_MI16x16x1_SN_LDSB0_AFC1_AG0_AFEM1_AFEM1_ASEM1_CLR1_CADS0_DTLA1_DTLB1_DTVA0_DTVB0_DTVMXSA0_DTVMXSB0_DTVSM0_DPLB1_EPS0_ELFLR0_EMLLn1_FDSI0_GRPM1_GRVWA8_GRVWB8_GSU0_GSUAMB_GSUC0_GSUWGMRR0_GLS0_ISA950_IU1_K1_LDSTI0_LBSPPA1024_LBSPPB1024_LBSPPM0_LPA32_LPB32_LPM0_LRVWn1_LWPMn1_MIAV1_MIWT1_1_MO40_MGRIPM1_NTn1_NTA4_NTB0_NTC0_NTD0_NTM0_NEPBS12_NLCA1_NLCB1_ONLL1_PGR2_PLR1_PKA1_SGROB1_SIA3_SS1_SU0_SUM0_SUS0_SPO1_SRVW0_SSO0_SVW1_SK3_SKFTR0_SKXCCM4_SGRO0_TDMI0_TIN1_TLDS1_TLDSMn1_ULSGRO0_USL1_UIOFGRO0_UPLRP0_USFGRO0_VSn1_VWA1_VWB1_WSGRA0_WSGRB0_WS64_WG32_8_1_WGMn48_WGMXCC1_WGMXCCGn1
    SolutionIndex: 211
    SolutionNameMin: Cijk_Alik_Bljk_BBS_BH_BiasSB_HAS_SAV_UserArgs_MT32x16x64_MI16x16x1_SN_LDSB0_AFC1_AG1_AFEM1_AFEM1_ASEM1_CLR1_CADS0_DTLA1_DTLB1_DTVA0_DTVB0_DTVMXSA0_DTVMXSB0_DTVSM0_DPLB1_EPS0_ELFLR0_EMLL0_FDSI0_GRPM1_GRVWA8_GRVWB8_GSU0_GSUAMB_GSUC0_GSUWGMRR0_GLS0_ISA950_IU1_K1_LDSTI0_LBSPPA1024_LBSPPB1024_LBSPPM0_LPA32_LPB32_LPM0_LRVWn1_LWPMn1_MIAV1_MIWT1_1_MO40_MGRIPM1_NTn1_NTA4_NTB4_NTC0_NTD0_NTM0_NEPBS4_NLCA1_NLCB1_ONLL1_PGR4_PLR1_PKA1_SGROB0_SIA3_SS0_SU0_SUM0_SUS0_SPO0_SRVW0_SSO0_SVW4_SK3_SKFTR0_SKXCCM0_SGRO0_TDMI0_TIN1_TLDS1_TLDSMn1_ULSGRO1_USL1_UIOFGRO0_UPLRP0_USFGRO0_VSn1_VWA1_VWB1_WSGRA0_WSGRB0_WS64_WG32_4_1_WGMn2_WGMXCC1_WGMXCCGn1
    SolutionIndex: 212
    SolutionNameMin: Cijk_Alik_Bljk_BBS_BH_BiasSB_HAS_SAV_UserArgs_MT192x128x64_MI16x16x1_CMS_SN_LDSB0_AFC1_AG1_AFEM1_AFEM1_ASEM1_CLR0_CADS0_DTLA1_DTLB1_DTVA0_DTVB0_DTVMXSA0_DTVMXSB0_DTVSM0_DPLB0_EPS0_ELFLR0_EMLLn1_FDSI0_GRPM1_GRVWA8_GRVWB8_GSU0_GSUAMB_GSUC0_GSUWGMRR0_GLS0_ISA950_IU1_K1_LDSTI0_LBSPPA1024_LBSPPB1024_LBSPPM0_LPA32_LPB32_LPM0_LRVW8_LWPMn1_MIAV0_MIWT6_4_MO40_MGRIPM1_NTn1_NTA0_NTB0_NTC0_NTD0_NTM0_NEPBS10_NLCA1_NLCB1_ONLL1_PGR2_PLR1_PKA1_SGROB0_SIA3_SS0_SU16_SUM0_SUS128_SPO1_SRVW0_SSO0_SVW8_SK3_SKFTR0_SKXCCM8_SGRO0_TDMI0_TIN0_TLDS1_TLDSMn1_ULSGRO0_USL1_UIOFGRO0_UPLRP0_USFGRO0_VSn1_VWA2_VWB4_WSGRA0_WSGRB0_WS64_WG32_8_1_WGM32_WGMXCC1_WGMXCCGn1
    SolutionIndex: 213
    SolutionNameMin: Cijk_Alik_Bljk_BBS_BH_BiasSB_HAS_SAV_UserArgs_MT32x16x256_MI16x16x1_SN_LDSB0_AFC1_AG1_AFEM1_AFEM1_ASEM1_CLR1_CADS0_DTLA1_DTLB1_DTVA0_DTVB0_DTVMXSA0_DTVMXSB0_DTVSM0_DPLB1_EPS0_ELFLR0_EMLLn1_FDSI0_GRPM1_GRVWA8_GRVWB8_GSU0_GSUAMB_GSUC0_GSUWGMRR0_GLS0_ISA950_IU1_K1_LDSTI0_LBSPPA1024_LBSPPB1024_LBSPPM0_LPA32_LPB32_LPM0_LRVWn1_LWPMn1_MIAV0_MIWT1_1_MO40_MGRIPM1_NTn1_NTA0_NTB0_NTC4_NTD0_NTM0_NEPBS4_NLCA1_NLCB1_ONLL1_PGR3_PLR1_PKA1_SGROB1_SIA3_SS0_SU0_SUM0_SUS0_SPO1_SRVW0_SSO0_SVW4_SK3_SKFTR0_SKXCCM0_SGRO0_TDMI0_TIN1_TLDS1_TLDSMn1_ULSGRO1_USL1_UIOFGRO0_UPLRP0_USFGRO0_VSn1_VWA1_VWB1_WSGRA0_WSGRB0_WS64_WG32_4_1_WGM48_WGMXCC2_WGMXCCGn1
    SolutionIndex: 214
    SolutionNameMin: Cijk_Alik_Bljk_BBS_BH_BiasSB_HAS_SAV_UserArgs_MT32x16x64_MI16x16x1_SN_LDSB0_AFC1_AG1_AFEM1_AFEM1_ASEM1_CLR0_CADS0_DTLA1_DTLB1_DTVA0_DTVB0_DTVMXSA0_DTVMXSB0_DTVSM0_DPLB1_EPS0_ELFLR0_EMLL0_FDSI0_GRPM1_GRVWA8_GRVWB8_GSU0_GSUAMB_GSUC0_GSUWGMRR0_GLS0_ISA950_IU1_K1_LDSTI0_LBSPPA1024_LBSPPB1024_LBSPPM0_LPA32_LPB32_LPM0_LRVWn1_LWPMn1_MIAV1_MIWT1_1_MO40_MGRIPM1_NTn1_NTA0_NTB0_NTC0_NTD0_NTM0_NEPBS14_NLCA1_NLCB1_ONLL1_PGR4_PLR1_PKA1_SGROB0_SIA3_SS0_SU0_SUM0_SUS0_SPO0_SRVW0_SSO0_SVW4_SK3_SKFTR0_SKXCCM4_SGRO0_TDMI0_TIN1_TLDS2_TLDSMn1_ULSGRO0_USL1_UIOFGRO0_UPLRP0_USFGRO0_VSn1_VWA1_VWB1_WSGRA0_WSGRB0_WS64_WG32_4_1_WGM24_WGMXCC2_WGMXCCGn1
    SolutionIndex: 215
    SolutionNameMin: Cijk_Alik_Bljk_BBS_BH_BiasSB_HAS_SAV_UserArgs_MT32x16x256_MI16x16x1_SN_LDSB0_AFC1_AG1_AFEM1_AFEM1_ASEM1_CLR1_CADS0_DTLA1_DTLB1_DTVA0_DTVB0_DTVMXSA0_DTVMXSB0_DTVSM0_DPLB1_EPS0_ELFLR0_EMLLn1_FDSI0_GRPM1_GRVWA8_GRVWB8_GSU0_GSUAMB_GSUC0_GSUWGMRR0_GLS0_ISA950_IU1_K1_LDSTI0_LBSPPA1024_LBSPPB1024_LBSPPM0_LPA32_LPB32_LPM0_LRVWn1_LWPMn1_MIAV0_MIWT1_1_MO40_MGRIPM1_NTn1_NTA0_NTB0_NTC0_NTD0_NTM0_NEPBS12_NLCA1_NLCB1_ONLL1_PGR4_PLR1_PKA1_SGROB1_SIA3_SS0_SU0_SUM0_SUS0_SPO1_SRVW0_SSO0_SVW4_SK3_SKFTR0_SKXCCM0_SGRO0_TDMI0_TIN1_TLDS2_TLDSMn1_ULSGRO1_USL1_UIOFGRO0_UPLRP0_USFGRO0_VSn1_VWA1_VWB1_WSGRA0_WSGRB0_WS64_WG32_4_1_WGMn2_WGMXCC1_WGMXCCGn1
    SolutionIndex: 216
    SolutionNameMin: Cijk_Alik_Bljk_BBS_BH_BiasSB_HAS_SAV_UserArgs_MT32x16x256_MI16x16x1_SN_LDSB0_AFC1_AG1_AFEM1_AFEM1_ASEM1_CLR1_CADS0_DTLA1_DTLB1_DTVA0_DTVB0_DTVMXSA0_DTVMXSB0_DTVSM0_DPLB1_EPS0_ELFLR0_EMLL0_FDSI0_GRPM1_GRVWA8_GRVWB8_GSU0_GSUAMB_GSUC0_GSUWGMRR0_GLS0_ISA950_IU1_K1_LDSTI0_LBSPPA1024_LBSPPB1024_LBSPPM0_LPA32_LPB32_LPM0_LRVWn1_LWPMn1_MIAV1_MIWT1_1_MO40_MGRIPM1_NTn1_NTA0_NTB0_NTC4_NTD4_NTM0_NEPBS10_NLCA1_NLCB1_ONLL1_PGR3_PLR1_PKA1_SGROB0_SIA3_SS0_SU0_SUM0_SUS0_SPO0_SRVW0_SSO0_SVW4_SK3_SKFTR0_SKXCCM0_SGRO0_TDMI0_TIN1_TLDS2_TLDSMn1_ULSGRO1_USL1_UIOFGRO0_UPLRP0_USFGRO0_VSn1_VWA1_VWB1_WSGRA0_WSGRB0_WS64_WG32_4_1_WGM48_WGMXCC2_WGMXCCGn1
    SolutionIndex: 217
    SolutionNameMin: Cijk_Alik_Bljk_BBS_BH_BiasSB_HAS_SAV_UserArgs_MT16x32x256_MI16x16x1_SN_LDSB0_AFC1_AG0_AFEM1_AFEM1_ASEM1_CLR0_CADS0_DTLA1_DTLB1_DTVA0_DTVB0_DTVMXSA0_DTVMXSB0_DTVSM0_DPLB1_EPS0_ELFLR0_EMLLn1_FDSI0_GRPM1_GRVWA8_GRVWB8_GSU0_GSUAMB_GSUC0_GSUWGMRR0_GLS0_ISA950_IU1_K1_LDSTI0_LBSPPA1024_LBSPPB1024_LBSPPM0_LPA32_LPB32_LPM0_LRVWn1_LWPMn1_MIAV1_MIWT1_1_MO40_MGRIPM1_NTn1_NTA0_NTB0_NTC0_NTD0_NTM0_NEPBS0_NLCA1_NLCB1_ONLL1_PGR4_PLR1_PKA1_SGROB1_SIA3_SS0_SU0_SUM0_SUS0_SPO0_SRVW0_SSO0_SVW4_SK3_SKFTR0_SKXCCM4_SGRO0_TDMI0_TIN1_TLDS2_TLDSMn1_ULSGRO1_USL1_UIOFGRO0_UPLRP0_USFGRO0_VSn1_VWA1_VWB1_WSGRA0_WSGRB0_WS64_WG16_8_1_WGM16_WGMXCC8_WGMXCCGn1
    SolutionIndex: 218
    SolutionNameMin: Cijk_Alik_Bljk_BBS_BH_BiasSB_HAS_SAV_UserArgs_MT16x32x256_MI16x16x1_SN_LDSB0_AFC1_AG1_AFEM1_AFEM1_ASEM1_CLR0_CADS0_DTLA1_DTLB1_DTVA0_DTVB0_DTVMXSA0_DTVMXSB0_DTVSM0_DPLB1_EPS0_ELFLR0_EMLLn1_FDSI0_GRPM1_GRVWA8_GRVWB8_GSU0_GSUAMB_GSUC0_GSUWGMRR0_GLS0_ISA950_IU1_K1_LDSTI0_LBSPPA1024_LBSPPB1024_LBSPPM0_LPA32_LPB32_LPM0_LRVWn1_LWPMn1_MIAV0_MIWT1_1_MO40_MGRIPM1_NTn1_NTA0_NTB0_NTC0_NTD0_NTM0_NEPBS16_NLCA1_NLCB1_ONLL1_PGR4_PLR1_PKA1_SGROB0_SIA3_SS0_SU0_SUM0_SUS0_SPO1_SRVW0_SSO0_SVW4_SK3_SKFTR0_SKXCCM0_SGRO0_TDMI0_TIN1_TLDS1_TLDSMn1_ULSGRO1_USL1_UIOFGRO0_UPLRP0_USFGRO0_VSn1_VWA1_VWB1_WSGRA0_WSGRB0_WS64_WG16_8_1_WGM48_WGMXCC2_WGMXCCGn1
    SolutionIndex: 219
    SolutionNameMin: Cijk_Alik_Bljk_BBS_BH_BiasSB_HAS_SAV_UserArgs_MT16x32x256_MI16x16x1_SN_LDSB0_AFC1_AG0_AFEM1_AFEM1_ASEM1_CLR0_CADS0_DTLA1_DTLB1_DTVA0_DTVB0_DTVMXSA0_DTVMXSB0_DTVSM0_DPLB1_EPS0_ELFLR0_EMLLn1_FDSI0_GRPM1_GRVWA8_GRVWB8_GSU0_GSUAMB_GSUC0_GSUWGMRR0_GLS0_ISA950_IU1_K1_LDSTI0_LBSPPA1024_LBSPPB1024_LBSPPM0_LPA32_LPB32_LPM0_LRVWn1_LWPMn1_MIAV1_MIWT1_1_MO40_MGRIPM1_NTn1_NTA0_NTB0_NTC0_NTD0_NTM0_NEPBS12_NLCA1_NLCB1_ONLL1_PGR4_PLR1_PKA1_SGROB1_SIA3_SS0_SU0_SUM0_SUS0_SPO0_SRVW0_SSO0_SVW4_SK3_SKFTR0_SKXCCM4_SGRO0_TDMI0_TIN1_TLDS2_TLDSMn1_ULSGRO1_USL1_UIOFGRO0_UPLRP0_USFGRO0_VSn1_VWA1_VWB1_WSGRA0_WSGRB0_WS64_WG16_8_1_WGM48_WGMXCC8_WGMXCCGn1
    SolutionIndex: 220
    SolutionNameMin: Cijk_Alik_Bljk_BBS_BH_BiasSB_HAS_SAV_UserArgs_MT32x16x256_MI16x16x1_SN_LDSB0_AFC1_AG0_AFEM1_AFEM1_ASEM1_CLR0_CADS0_DTLA1_DTLB1_DTVA0_DTVB0_DTVMXSA0_DTVMXSB0_DTVSM0_DPLB1_EPS0_ELFLR0_EMLL0_FDSI0_GRPM1_GRVWA8_GRVWB8_GSU0_GSUAMB_GSUC0_GSUWGMRR0_GLS0_ISA950_IU1_K1_LDSTI0_LBSPPA1024_LBSPPB1024_LBSPPM0_LPA16_LPB32_LPM0_LRVWn1_LWPMn1_MIAV1_MIWT2_1_MO40_MGRIPM1_NTn1_NTA4_NTB0_NTC0_NTD0_NTM0_NEPBS16_NLCA1_NLCB1_ONLL1_PGR3_PLR1_PKA1_SGROB0_SIA3_SS1_SU0_SUM0_SUS512_SPO0_SRVW0_SSO0_SVW2_SK3_SKFTR0_SKXCCM4_SGRO0_TDMI0_TIN0_TLDS2_TLDSMn1_ULSGRO0_USL1_UIOFGRO0_UPLRP0_USFGRO0_VSn1_VWA2_VWB1_WSGRA0_WSGRB0_WS64_WG16_4_4_WGM16_WGMXCC1_WGMXCCGn1
    SolutionIndex: 221
    SolutionNameMin: Cijk_Alik_Bljk_BBS_BH_BiasSB_HAS_SAV_UserArgs_MT16x32x256_MI16x16x1_SN_LDSB0_AFC1_AG1_AFEM1_AFEM1_ASEM1_CLR1_CADS0_DTLA1_DTLB1_DTVA0_DTVB0_DTVMXSA0_DTVMXSB0_DTVSM0_DPLB1_EPS0_ELFLR0_EMLL0_FDSI0_GRPM1_GRVWA8_GRVWB8_GSU0_GSUAMB_GSUC0_GSUWGMRR0_GLS0_ISA950_IU1_K1_LDSTI0_LBSPPA1024_LBSPPB1024_LBSPPM0_LPA32_LPB32_LPM0_LRVWn1_LWPMn1_MIAV0_MIWT1_1_MO40_MGRIPM1_NTn1_NTA0_NTB0_NTC0_NTD0_NTM0_NEPBS12_NLCA1_NLCB1_ONLL1_PGR4_PLR1_PKA1_SGROB0_SIA3_SS0_SU0_SUM0_SUS0_SPO1_SRVW0_SSO0_SVW4_SK3_SKFTR0_SKXCCM8_SGRO0_TDMI0_TIN1_TLDS2_TLDSMn1_ULSGRO1_USL1_UIOFGRO0_UPLRP0_USFGRO0_VSn1_VWA1_VWB1_WSGRA0_WSGRB0_WS64_WG16_8_1_WGM32_WGMXCC4_WGMXCCGn1
    SolutionIndex: 222
    SolutionNameMin: Cijk_Alik_Bljk_BBS_BH_BiasSB_HAS_SAV_UserArgs_MT128x128x64_MI16x16x1_SN_LDSB0_AFC1_AG1_AFEM1_AFEM1_ASEM1_CLR0_CADS0_DTLA1_DTLB1_DTVA0_DTVB0_DTVMXSA0_DTVMXSB0_DTVSM0_DPLB1_EPS0_ELFLR0_EMLLn1_FDSI0_GRPM1_GRVWA8_GRVWB8_GSU0_GSUAMB_GSUC0_GSUWGMRR0_GLS0_ISA950_IU1_K1_LDSTI0_LBSPPA1024_LBSPPB1024_LBSPPM0_LPA16_LPB32_LPM0_LRVWn1_LWPMn1_MIAV0_MIWT8_2_MO40_MGRIPM1_NTn1_NTA4_NTB0_NTC4_NTD4_NTM0_NEPBS12_NLCA1_NLCB1_ONLL1_PGR3_PLR1_PKA1_SGROB1_SIA3_SS1_SU0_SUM0_SUS0_SPO1_SRVW0_SSO0_SVW8_SK3_SKFTR0_SKXCCM4_SGRO0_TDMI0_TIN1_TLDS1_TLDSMn1_ULSGRO1_USL1_UIOFGRO0_UPLRP0_USFGRO0_VSn1_VWA8_VWB2_WSGRA0_WSGRB0_WS64_WG16_16_1_WGM8_WGMXCC1_WGMXCCGn1
    SolutionIndex: 223
    SolutionNameMin: Cijk_Alik_Bljk_BBS_BH_BiasSB_HAS_SAV_UserArgs_MT16x32x256_MI16x16x1_SN_LDSB0_AFC1_AG1_AFEM1_AFEM1_ASEM1_CLR0_CADS0_DTLA1_DTLB1_DTVA0_DTVB0_DTVMXSA0_DTVMXSB0_DTVSM0_DPLB1_EPS0_ELFLR0_EMLLn1_FDSI0_GRPM1_GRVWA8_GRVWB8_GSU0_GSUAMB_GSUC0_GSUWGMRR0_GLS0_ISA950_IU1_K1_LDSTI0_LBSPPA1024_LBSPPB1024_LBSPPM0_LPA32_LPB32_LPM0_LRVWn1_LWPMn1_MIAV0_MIWT1_1_MO40_MGRIPM1_NTn1_NTA0_NTB0_NTC0_NTD0_NTM0_NEPBS8_NLCA1_NLCB1_ONLL1_PGR4_PLR1_PKA1_SGROB0_SIA3_SS0_SU0_SUM0_SUS0_SPO1_SRVW0_SSO0_SVW4_SK3_SKFTR0_SKXCCM0_SGRO0_TDMI0_TIN1_TLDS1_TLDSMn1_ULSGRO1_USL1_UIOFGRO0_UPLRP0_USFGRO0_VSn1_VWA1_VWB1_WSGRA0_WSGRB0_WS64_WG16_8_1_WGM4_WGMXCC1_WGMXCCGn1
    SolutionIndex: 224
    SolutionNameMin: Cijk_Alik_Bljk_BBS_BH_BiasSB_HAS_SAV_UserArgs_MT32x16x512_MI16x16x1_SN_LDSB0_AFC1_AG0_AFEM1_AFEM1_ASEM1_CLR1_CADS0_DTLA1_DTLB1_DTVA0_DTVB0_DTVMXSA0_DTVMXSB0_DTVSM0_DPLB1_EPS0_ELFLR0_EMLLn1_FDSI0_GRPM1_GRVWA8_GRVWB8_GSU0_GSUAMB_GSUC0_GSUWGMRR0_GLS0_ISA950_IU1_K1_LDSTI0_LBSPPA1024_LBSPPB1024_LBSPPM0_LPA16_LPB16_LPM0_LRVWn1_LWPMn1_MIAV0_MIWT1_1_MO40_MGRIPM1_NTn1_NTA4_NTB0_NTC0_NTD0_NTM0_NEPBS4_NLCA1_NLCB1_ONLL1_PGR2_PLR1_PKA1_SGROB1_SIA3_SS0_SU0_SUM0_SUS0_SPO0_SRVW0_SSO0_SVW4_SK3_SKFTR0_SKXCCM8_SGRO0_TDMI0_TIN1_TLDS2_TLDSMn1_ULSGRO0_USL1_UIOFGRO0_UPLRP0_USFGRO0_VSn1_VWA1_VWB1_WSGRA0_WSGRB0_WS64_WG32_4_1_WGM2_WGMXCC1_WGMXCCGn1
    SolutionIndex: 225
    SolutionNameMin: Cijk_Alik_Bljk_BBS_BH_BiasSB_HAS_SAV_UserArgs_MT16x16x256_MI16x16x1_SN_LDSB1_AFC1_AG0_AFEM1_AFEM1_ASEM1_CLR1_CADS0_DTLA0_DTLB0_DTVA0_DTVB0_DTVMXSA0_DTVMXSB0_DTVSM0_DPLB0_EPS0_ELFLR0_EMLLn1_FDSI0_GRPM1_GRVWA8_GRVWB8_GSU0_GSUAMB_GSUC0_GSUWGMRR0_GLS0_ISA950_IU1_K1_LDSTI0_LBSPPA512_LBSPPB512_LBSPPM0_LPA16_LPB16_LPM0_LRVWn1_LWPMn1_MIAV1_MIWT1_1_MO40_MGRIPM1_NTn1_NTA0_NTB0_NTC0_NTD0_NTM0_NEPBS10_NLCA1_NLCB1_ONLL1_PGR2_PLR1_PKA1_SGROB0_SIA3_SS1_SU16_SUM0_SUS512_SPO0_SRVW0_SSO1_SVW1_SK3_SKFTR0_SKXCCM8_SGRO0_TDMI0_TIN0_TLDS1_TLDSMn1_ULSGRO1_USL1_UIOFGRO0_UPLRP0_USFGRO1_VSn1_VWA1_VWB1_WSGRA0_WSGRB0_WS64_WG16_4_2_WGMn32_WGMXCC32_WGMXCCGn1
    SolutionIndex: 226
    SolutionNameMin: Cijk_Alik_Bljk_BBS_BH_BiasSB_HAS_SAV_UserArgs_MT32x16x256_MI16x16x1_SN_LDSB0_AFC1_AG1_AFEM1_AFEM1_ASEM1_CLR1_CADS0_DTLA1_DTLB1_DTVA0_DTVB0_DTVMXSA0_DTVMXSB0_DTVSM0_DPLB1_EPS0_ELFLR0_EMLLn1_FDSI0_GRPM1_GRVWA8_GRVWB8_GSU0_GSUAMB_GSUC0_GSUWGMRR0_GLS0_ISA950_IU1_K1_LDSTI0_LBSPPA1024_LBSPPB1024_LBSPPM0_LPA32_LPB32_LPM0_LRVWn1_LWPMn1_MIAV0_MIWT1_1_MO40_MGRIPM1_NTn1_NTA0_NTB0_NTC0_NTD0_NTM0_NEPBS12_NLCA1_NLCB1_ONLL1_PGR3_PLR1_PKA1_SGROB1_SIA3_SS0_SU0_SUM0_SUS0_SPO1_SRVW0_SSO0_SVW4_SK3_SKFTR0_SKXCCM0_SGRO0_TDMI0_TIN1_TLDS2_TLDSMn1_ULSGRO1_USL1_UIOFGRO0_UPLRP0_USFGRO0_VSn1_VWA1_VWB1_WSGRA0_WSGRB0_WS64_WG32_4_1_WGM2_WGMXCC2_WGMXCCGn1
    SolutionIndex: 227
    SolutionNameMin: Cijk_Alik_Bljk_BBS_BH_BiasSB_HAS_SAV_UserArgs_MT32x16x256_MI16x16x1_SN_LDSB0_AFC1_AG0_AFEM1_AFEM1_ASEM1_CLR1_CADS0_DTLA1_DTLB1_DTVA0_DTVB0_DTVMXSA0_DTVMXSB0_DTVSM0_DPLB1_EPS0_ELFLR0_EMLLn1_FDSI0_GRPM1_GRVWA8_GRVWB8_GSU0_GSUAMB_GSUC0_GSUWGMRR0_GLS0_ISA950_IU1_K1_LDSTI0_LBSPPA1024_LBSPPB1024_LBSPPM0_LPA32_LPB32_LPM0_LRVWn1_LWPMn1_MIAV0_MIWT1_1_MO40_MGRIPM1_NTn1_NTA0_NTB0_NTC4_NTD0_NTM0_NEPBS16_NLCA1_NLCB1_ONLL1_PGR3_PLR1_PKA1_SGROB1_SIA3_SS0_SU0_SUM0_SUS0_SPO0_SRVW0_SSO0_SVW4_SK3_SKFTR0_SKXCCM0_SGRO0_TDMI0_TIN1_TLDS1_TLDSMn1_ULSGRO0_USL1_UIOFGRO0_UPLRP0_USFGRO0_VSn1_VWA1_VWB1_WSGRA0_WSGRB0_WS64_WG32_4_1_WGM32_WGMXCC2_WGMXCCGn1
    SolutionIndex: 228
    SolutionNameMin: Cijk_Alik_Bljk_BBS_BH_BiasSB_HAS_SAV_UserArgs_MT16x16x512_MI16x16x1_SN_LDSB0_AFC1_AG1_AFEM1_AFEM1_ASEM1_CLR1_CADS0_DTLA0_DTLB0_DTVA0_DTVB0_DTVMXSA0_DTVMXSB0_DTVSM0_DPLB0_EPS0_ELFLR0_EMLLn1_FDSI0_GRPM1_GRVWA8_GRVWB8_GSU0_GSUAMB_GSUC0_GSUWGMRR0_GLS0_ISA950_IU1_K1_LDSTI0_LBSPPA1024_LBSPPB1024_LBSPPM0_LPA16_LPB16_LPM0_LRVWn1_LWPMn1_MIAV0_MIWT1_1_MO40_MGRIPM1_NTn1_NTA0_NTB0_NTC0_NTD0_NTM0_NEPBS2_NLCA1_NLCB1_ONLL1_PGR2_PLR1_PKA1_SGROB0_SIA3_SS0_SU8_SUM0_SUS1024_SPO0_SRVW0_SSO0_SVW1_SK3_SKFTR0_SKXCCM0_SGRO0_TDMI0_TIN0_TLDS2_TLDSMn1_ULSGRO1_USL1_UIOFGRO0_UPLRP0_USFGRO1_VSn1_VWA1_VWB1_WSGRA0_WSGRB2_WS64_WG16_4_4_WGM32_WGMXCC2_WGMXCCGn1
    SolutionIndex: 229
    SolutionNameMin: Cijk_Alik_Bljk_BBS_BH_BiasSB_HAS_SAV_UserArgs_MT16x16x256_MI16x16x1_SN_LDSB0_AFC1_AG0_AFEM1_AFEM1_ASEM1_CLR1_CADS0_DTLA1_DTLB1_DTVA0_DTVB0_DTVMXSA0_DTVMXSB0_DTVSM0_DPLB1_EPS0_ELFLR0_EMLLn1_FDSI0_GRPM1_GRVWA8_GRVWB8_GSU0_GSUAMB_GSUC0_GSUWGMRR0_GLS0_ISA950_IU1_K1_LDSTI0_LBSPPA1024_LBSPPB1024_LBSPPM0_LPA32_LPB32_LPM0_LRVWn1_LWPMn1_MIAV0_MIWT1_1_MO40_MGRIPM1_NTn1_NTA0_NTB4_NTC0_NTD0_NTM0_NEPBS14_NLCA1_NLCB1_ONLL1_PGR4_PLR1_PKA1_SGROB0_SIA3_SS0_SU0_SUM0_SUS0_SPO1_SRVW0_SSO1_SVW4_SK3_SKFTR0_SKXCCM0_SGRO0_TDMI0_TIN1_TLDS2_TLDSMn1_ULSGRO1_USL1_UIOFGRO0_UPLRP0_USFGRO0_VSn1_VWA1_VWB1_WSGRA0_WSGRB0_WS64_WG16_4_1_WGMn4_WGMXCC1_WGMXCCGn1
    SolutionIndex: 230
    SolutionNameMin: Cijk_Alik_Bljk_BBS_BH_BiasSB_HAS_SAV_UserArgs_MT32x16x256_MI16x16x1_SN_LDSB0_AFC1_AG1_AFEM1_AFEM1_ASEM1_CLR1_CADS0_DTLA1_DTLB1_DTVA0_DTVB0_DTVMXSA0_DTVMXSB0_DTVSM0_DPLB1_EPS0_ELFLR0_EMLL0_FDSI0_GRPM1_GRVWA8_GRVWB8_GSU0_GSUAMB_GSUC0_GSUWGMRR0_GLS0_ISA950_IU1_K1_LDSTI0_LBSPPA1024_LBSPPB1024_LBSPPM0_LPA32_LPB32_LPM0_LRVWn1_LWPMn1_MIAV1_MIWT1_1_MO40_MGRIPM1_NTn1_NTA0_NTB0_NTC0_NTD0_NTM0_NEPBS2_NLCA1_NLCB1_ONLL1_PGR3_PLR1_PKA1_SGROB1_SIA3_SS0_SU0_SUM0_SUS0_SPO1_SRVW0_SSO1_SVW4_SK3_SKFTR0_SKXCCM0_SGRO0_TDMI0_TIN1_TLDS1_TLDSMn1_ULSGRO0_USL1_UIOFGRO0_UPLRP0_USFGRO0_VSn1_VWA1_VWB1_WSGRA0_WSGRB0_WS64_WG32_4_1_WGM32_WGMXCC8_WGMXCCGn1
    SolutionIndex: 231
    SolutionNameMin: Cijk_Alik_Bljk_BBS_BH_BiasSB_HAS_SAV_UserArgs_MT16x16x512_MI16x16x1_SN_LDSB1_AFC1_AG0_AFEM1_AFEM1_ASEM1_CLR1_CADS0_DTLA0_DTLB0_DTVA0_DTVB0_DTVMXSA0_DTVMXSB0_DTVSM0_DPLB0_EPS0_ELFLR0_EMLL0_FDSI0_GRPM1_GRVWA8_GRVWB8_GSU0_GSUAMB_GSUC0_GSUWGMRR0_GLS0_ISA950_IU1_K1_LDSTI0_LBSPPA1024_LBSPPB1024_LBSPPM0_LPA16_LPB16_LPM0_LRVWn1_LWPMn1_MIAV1_MIWT1_1_MO40_MGRIPM1_NTn1_NTA0_NTB0_NTC0_NTD0_NTM0_NEPBS10_NLCA1_NLCB1_ONLL1_PGR2_PLR1_PKA1_SGROB0_SIA3_SS0_SU8_SUM0_SUS1024_SPO1_SRVW0_SSO0_SVW1_SK3_SKFTR0_SKXCCM0_SGRO0_TDMI0_TIN0_TLDS2_TLDSMn1_ULSGRO1_USL1_UIOFGRO0_UPLRP0_USFGRO1_VSn1_VWA1_VWB1_WSGRA0_WSGRB0_WS64_WG16_4_4_WGM48_WGMXCC4_WGMXCCGn1
    SolutionIndex: 232
    SolutionNameMin: Cijk_Alik_Bljk_BBS_BH_BiasSB_HAS_SAV_UserArgs_MT32x16x256_MI16x16x1_SN_LDSB0_AFC1_AG1_AFEM1_AFEM1_ASEM1_CLR0_CADS0_DTLA1_DTLB1_DTVA0_DTVB0_DTVMXSA0_DTVMXSB0_DTVSM0_DPLB1_EPS0_ELFLR0_EMLL0_FDSI0_GRPM1_GRVWA8_GRVWB8_GSU0_GSUAMB_GSUC0_GSUWGMRR0_GLS0_ISA950_IU1_K1_LDSTI0_LBSPPA1024_LBSPPB1024_LBSPPM0_LPA32_LPB32_LPM0_LRVWn1_LWPMn1_MIAV1_MIWT1_1_MO40_MGRIPM1_NTn1_NTA0_NTB0_NTC0_NTD0_NTM0_NEPBS0_NLCA1_NLCB1_ONLL1_PGR4_PLR1_PKA1_SGROB1_SIA3_SS1_SU0_SUM0_SUS0_SPO1_SRVW0_SSO0_SVW1_SK3_SKFTR0_SKXCCM8_SGRO0_TDMI0_TIN1_TLDS2_TLDSMn1_ULSGRO1_USL1_UIOFGRO0_UPLRP0_USFGRO0_VSn1_VWA1_VWB1_WSGRA0_WSGRB0_WS64_WG32_4_1_WGMn1_WGMXCC1_WGMXCCGn1
    SolutionIndex: 233
    SolutionNameMin: Cijk_Alik_Bljk_BBS_BH_BiasSB_HAS_SAV_UserArgs_MT128x64x128_MI16x16x1_SN_LDSB0_AFC1_AG1_AFEM1_AFEM1_ASEM1_CLR1_CADS0_DTLA1_DTLB1_DTVA0_DTVB0_DTVMXSA0_DTVMXSB0_DTVSM0_DPLB1_EPS0_ELFLR0_EMLLn1_FDSI0_GRPM1_GRVWA8_GRVWB8_GSU0_GSUAMB_GSUC0_GSUWGMRR0_GLS0_ISA950_IU1_K1_LDSTI0_LBSPPA1024_LBSPPB1024_LBSPPM0_LPA32_LPB16_LPM0_LRVWn1_LWPMn1_MIAV1_MIWT2_4_MO40_MGRIPM1_NTn1_NTA0_NTB0_NTC0_NTD0_NTM0_NEPBS14_NLCA1_NLCB1_ONLL1_PGR2_PLR1_PKA1_SGROB1_SIA3_SS0_SU0_SUM0_SUS0_SPO0_SRVW0_SSO0_SVW8_SK3_SKFTR0_SKXCCM4_SGRO0_TDMI0_TIN1_TLDS2_TLDSMn1_ULSGRO0_USL1_UIOFGRO0_UPLRP0_USFGRO0_VSn1_VWA2_VWB4_WSGRA0_WSGRB0_WS64_WG64_4_1_WGM24_WGMXCC1_WGMXCCGn1
    SolutionIndex: 234
    SolutionNameMin: Cijk_Alik_Bljk_BBS_BH_BiasSB_HAS_SAV_UserArgs_MT16x16x512_MI16x16x1_SN_LDSB0_AFC1_AG0_AFEM1_AFEM1_ASEM1_CLR1_CADS0_DTLA0_DTLB0_DTVA0_DTVB0_DTVMXSA0_DTVMXSB0_DTVSM0_DPLB0_EPS0_ELFLR0_EMLL0_FDSI0_GRPM1_GRVWA8_GRVWB8_GSU0_GSUAMB_GSUC0_GSUWGMRR0_GLS0_ISA950_IU1_K1_LDSTI0_LBSPPA1024_LBSPPB1024_LBSPPM0_LPA16_LPB16_LPM0_LRVWn1_LWPMn1_MIAV1_MIWT1_1_MO40_MGRIPM1_NTn1_NTA0_NTB0_NTC0_NTD0_NTM0_NEPBS0_NLCA1_NLCB1_ONLL1_PGR2_PLR1_PKA1_SGROB0_SIA3_SS1_SU8_SUM0_SUS1024_SPO0_SRVW0_SSO0_SVW1_SK3_SKFTR0_SKXCCM4_SGRO0_TDMI0_TIN0_TLDS2_TLDSMn1_ULSGRO0_USL1_UIOFGRO0_UPLRP0_USFGRO1_VSn1_VWA1_VWB1_WSGRA0_WSGRB2_WS64_WG16_4_4_WGM24_WGMXCC1_WGMXCCGn1
    SolutionIndex: 235
    SolutionNameMin: Cijk_Alik_Bljk_BBS_BH_BiasSB_HAS_SAV_UserArgs_MT32x16x256_MI16x16x1_SN_LDSB0_AFC1_AG0_AFEM1_AFEM1_ASEM1_CLR0_CADS0_DTLA1_DTLB1_DTVA0_DTVB0_DTVMXSA0_DTVMXSB0_DTVSM0_DPLB1_EPS0_ELFLR0_EMLLn1_FDSI0_GRPM1_GRVWA8_GRVWB8_GSU0_GSUAMB_GSUC0_GSUWGMRR0_GLS0_ISA950_IU1_K1_LDSTI0_LBSPPA1024_LBSPPB1024_LBSPPM0_LPA32_LPB32_LPM0_LRVWn1_LWPMn1_MIAV0_MIWT1_1_MO40_MGRIPM1_NTn1_NTA0_NTB4_NTC0_NTD4_NTM0_NEPBS4_NLCA1_NLCB1_ONLL1_PGR4_PLR1_PKA1_SGROB0_SIA3_SS0_SU0_SUM0_SUS0_SPO0_SRVW0_SSO0_SVW4_SK3_SKFTR0_SKXCCM0_SGRO0_TDMI0_TIN1_TLDS1_TLDSMn1_ULSGRO1_USL1_UIOFGRO0_UPLRP0_USFGRO0_VSn1_VWA1_VWB1_WSGRA0_WSGRB0_WS64_WG32_4_1_WGM32_WGMXCC1_WGMXCCGn1
    SolutionIndex: 236
    SolutionNameMin: Cijk_Alik_Bljk_BBS_BH_BiasSB_HAS_SAV_UserArgs_MT16x16x256_MI16x16x1_SN_LDSB0_AFC1_AG1_AFEM1_AFEM1_ASEM1_CLR1_CADS0_DTLA1_DTLB1_DTVA0_DTVB0_DTVMXSA0_DTVMXSB0_DTVSM0_DPLB1_EPS0_ELFLR0_EMLLn1_FDSI0_GRPM1_GRVWA8_GRVWB8_GSU0_GSUAMB_GSUC0_GSUWGMRR0_GLS0_ISA950_IU1_K1_LDSTI0_LBSPPA1024_LBSPPB1024_LBSPPM0_LPA32_LPB32_LPM0_LRVWn1_LWPMn1_MIAV1_MIWT1_1_MO40_MGRIPM1_NTn1_NTA0_NTB4_NTC0_NTD4_NTM0_NEPBS0_NLCA1_NLCB1_ONLL1_PGR4_PLR1_PKA1_SGROB0_SIA3_SS0_SU0_SUM0_SUS0_SPO0_SRVW0_SSO0_SVW4_SK3_SKFTR0_SKXCCM0_SGRO0_TDMI0_TIN1_TLDS1_TLDSMn1_ULSGRO1_USL1_UIOFGRO0_UPLRP0_USFGRO0_VSn1_VWA1_VWB1_WSGRA0_WSGRB0_WS64_WG16_4_1_WGMn8_WGMXCC1_WGMXCCGn1
    SolutionIndex: 237
    SolutionNameMin: Cijk_Alik_Bljk_BBS_BH_BiasSB_HAS_SAV_UserArgs_MT32x16x256_MI16x16x1_SN_LDSB0_AFC1_AG0_AFEM1_AFEM1_ASEM1_CLR1_CADS0_DTLA1_DTLB1_DTVA0_DTVB0_DTVMXSA0_DTVMXSB0_DTVSM0_DPLB1_EPS0_ELFLR0_EMLLn1_FDSI0_GRPM1_GRVWA8_GRVWB8_GSU0_GSUAMB_GSUC0_GSUWGMRR0_GLS0_ISA950_IU1_K1_LDSTI0_LBSPPA1024_LBSPPB1024_LBSPPM0_LPA32_LPB32_LPM0_LRVWn1_LWPMn1_MIAV1_MIWT1_1_MO40_MGRIPM1_NTn1_NTA0_NTB0_NTC0_NTD4_NTM0_NEPBS12_NLCA1_NLCB1_ONLL1_PGR4_PLR1_PKA1_SGROB1_SIA3_SS1_SU0_SUM0_SUS0_SPO0_SRVW0_SSO1_SVW1_SK3_SKFTR0_SKXCCM0_SGRO0_TDMI0_TIN1_TLDS1_TLDSMn1_ULSGRO0_USL1_UIOFGRO0_UPLRP0_USFGRO0_VSn1_VWA1_VWB1_WSGRA0_WSGRB0_WS64_WG32_4_1_WGMn16_WGMXCC1_WGMXCCGn1
    SolutionIndex: 238
    SolutionNameMin: Cijk_Alik_Bljk_BBS_BH_BiasSB_HAS_SAV_UserArgs_MT16x16x512_MI16x16x1_SN_LDSB0_AFC1_AG1_AFEM1_AFEM1_ASEM1_CLR0_CADS0_DTLA0_DTLB0_DTVA0_DTVB0_DTVMXSA0_DTVMXSB0_DTVSM0_DPLB0_EPS0_ELFLR0_EMLL0_FDSI0_GRPM1_GRVWA8_GRVWB8_GSU0_GSUAMB_GSUC0_GSUWGMRR0_GLS0_ISA950_IU1_K1_LDSTI0_LBSPPA1024_LBSPPB1024_LBSPPM0_LPA16_LPB16_LPM0_LRVWn1_LWPMn1_MIAV0_MIWT1_1_MO40_MGRIPM1_NTn1_NTA0_NTB0_NTC0_NTD0_NTM0_NEPBS14_NLCA1_NLCB1_ONLL1_PGR2_PLR1_PKA1_SGROB0_SIA3_SS0_SU8_SUM0_SUS1024_SPO1_SRVW0_SSO0_SVW1_SK3_SKFTR0_SKXCCM4_SGRO0_TDMI0_TIN0_TLDS2_TLDSMn1_ULSGRO1_USL1_UIOFGRO0_UPLRP0_USFGRO1_VSn1_VWA1_VWB1_WSGRA2_WSGRB0_WS64_WG16_4_4_WGM32_WGMXCC1_WGMXCCGn1
    SolutionIndex: 239
    SolutionNameMin: Cijk_Alik_Bljk_BBS_BH_BiasSB_HAS_SAV_UserArgs_MT32x16x256_MI16x16x1_SN_LDSB0_AFC1_AG1_AFEM1_AFEM1_ASEM1_CLR0_CADS0_DTLA1_DTLB1_DTVA0_DTVB0_DTVMXSA0_DTVMXSB0_DTVSM0_DPLB1_EPS0_ELFLR0_EMLLn1_FDSI0_GRPM1_GRVWA8_GRVWB8_GSU0_GSUAMB_GSUC0_GSUWGMRR0_GLS0_ISA950_IU1_K1_LDSTI0_LBSPPA1024_LBSPPB1024_LBSPPM0_LPA32_LPB32_LPM0_LRVWn1_LWPMn1_MIAV1_MIWT1_1_MO40_MGRIPM1_NTn1_NTA0_NTB0_NTC0_NTD0_NTM0_NEPBS12_NLCA1_NLCB1_ONLL1_PGR3_PLR1_PKA1_SGROB0_SIA3_SS0_SU0_SUM0_SUS0_SPO0_SRVW0_SSO0_SVW4_SK3_SKFTR0_SKXCCM0_SGRO0_TDMI0_TIN1_TLDS2_TLDSMn1_ULSGRO1_USL1_UIOFGRO0_UPLRP0_USFGRO0_VSn1_VWA1_VWB1_WSGRA0_WSGRB0_WS64_WG32_4_1_WGMn2_WGMXCC32_WGMXCCGn1
    SolutionIndex: 240
    SolutionNameMin: Cijk_Alik_Bljk_BBS_BH_BiasSB_HAS_SAV_UserArgs_MT16x16x256_MI16x16x1_SN_LDSB0_AFC1_AG0_AFEM1_AFEM1_ASEM1_CLR0_CADS0_DTLA1_DTLB1_DTVA0_DTVB0_DTVMXSA0_DTVMXSB0_DTVSM0_DPLB1_EPS0_ELFLR0_EMLLn1_FDSI0_GRPM1_GRVWA8_GRVWB8_GSU0_GSUAMB_GSUC0_GSUWGMRR0_GLS0_ISA950_IU1_K1_LDSTI0_LBSPPA1024_LBSPPB1024_LBSPPM0_LPA32_LPB32_LPM0_LRVWn1_LWPMn1_MIAV1_MIWT1_1_MO40_MGRIPM1_NTn1_NTA4_NTB0_NTC0_NTD4_NTM0_NEPBS4_NLCA1_NLCB1_ONLL1_PGR4_PLR1_PKA1_SGROB0_SIA3_SS0_SU0_SUM0_SUS0_SPO1_SRVW0_SSO0_SVW4_SK3_SKFTR0_SKXCCM0_SGRO0_TDMI0_TIN1_TLDS1_TLDSMn1_ULSGRO0_USL1_UIOFGRO0_UPLRP0_USFGRO0_VSn1_VWA1_VWB1_WSGRA0_WSGRB0_WS64_WG16_4_1_WGMn1_WGMXCC16_WGMXCCGn1
    SolutionIndex: 241
    SolutionNameMin: Cijk_Alik_Bljk_BBS_BH_BiasSB_HAS_SAV_UserArgs_MT16x16x256_MI16x16x1_SN_LDSB0_AFC1_AG0_AFEM1_AFEM1_ASEM1_CLR0_CADS0_DTLA1_DTLB1_DTVA0_DTVB0_DTVMXSA0_DTVMXSB0_DTVSM0_DPLB1_EPS0_ELFLR0_EMLLn1_FDSI0_GRPM1_GRVWA8_GRVWB8_GSU0_GSUAMB_GSUC0_GSUWGMRR0_GLS0_ISA950_IU1_K1_LDSTI0_LBSPPA1024_LBSPPB1024_LBSPPM0_LPA32_LPB32_LPM0_LRVWn1_LWPMn1_MIAV0_MIWT1_1_MO40_MGRIPM1_NTn1_NTA0_NTB0_NTC4_NTD4_NTM0_NEPBS16_NLCA1_NLCB1_ONLL1_PGR4_PLR1_PKA1_SGROB1_SIA3_SS0_SU0_SUM0_SUS0_SPO0_SRVW0_SSO0_SVW4_SK3_SKFTR0_SKXCCM0_SGRO0_TDMI0_TIN1_TLDS1_TLDSMn1_ULSGRO0_USL1_UIOFGRO0_UPLRP0_USFGRO0_VSn1_VWA1_VWB1_WSGRA0_WSGRB0_WS64_WG16_4_1_WGM24_WGMXCC1_WGMXCCGn1
    SolutionIndex: 242
    SolutionNameMin: Cijk_Alik_Bljk_BBS_BH_BiasSB_HAS_SAV_UserArgs_MT16x64x32_MI16x16x1_SN_LDSB0_AFC1_AG0_AFEM1_AFEM1_ASEM1_CLR0_CADS0_DTLA1_DTLB1_DTVA0_DTVB0_DTVMXSA0_DTVMXSB0_DTVSM0_DPLB1_EPS0_ELFLR0_EMLLn1_FDSI0_GRPM1_GRVWA2_GRVWB2_GSU0_GSUAMB_GSUC0_GSUWGMRR0_GLS0_ISA950_IU1_K1_LDSTI0_LBSPPA256_LBSPPB256_LBSPPM0_LPA32_LPB32_LPM0_LRVWn1_LWPMn1_MIAV1_MIWT1_1_MO40_MGRIPM1_NTn1_NTA4_NTB4_NTC4_NTD0_NTM0_NEPBS14_NLCA1_NLCB1_ONLL1_PGR4_PLR1_PKA1_SGROB0_SIA3_SS0_SU0_SUM0_SUS0_SPO0_SRVW0_SSO4_SVW4_SK3_SKFTR0_SKXCCM0_SGRO0_TDMI0_TIN1_TLDS2_TLDSMn1_ULSGRO0_USL1_UIOFGRO0_UPLRP0_USFGRO0_VSn1_VWA1_VWB1_WSGRA0_WSGRB0_WS64_WG16_16_1_WGMn32_WGMXCC1_WGMXCCGn1
    SolutionIndex: 243
    SolutionNameMin: Cijk_Alik_Bljk_BBS_BH_BiasSB_HAS_SAV_UserArgs_MT16x16x256_MI16x16x1_SN_LDSB0_AFC1_AG0_AFEM1_AFEM1_ASEM1_CLR1_CADS0_DTLA1_DTLB1_DTVA0_DTVB0_DTVMXSA0_DTVMXSB0_DTVSM0_DPLB1_EPS0_ELFLR0_EMLLn1_FDSI0_GRPM1_GRVWA8_GRVWB8_GSU0_GSUAMB_GSUC0_GSUWGMRR0_GLS0_ISA950_IU1_K1_LDSTI0_LBSPPA1024_LBSPPB1024_LBSPPM0_LPA32_LPB32_LPM0_LRVWn1_LWPMn1_MIAV0_MIWT1_1_MO40_MGRIPM1_NTn1_NTA0_NTB0_NTC0_NTD0_NTM0_NEPBS12_NLCA1_NLCB1_ONLL1_PGR4_PLR1_PKA1_SGROB1_SIA3_SS0_SU0_SUM0_SUS0_SPO1_SRVW0_SSO1_SVW4_SK3_SKFTR0_SKXCCM4_SGRO0_TDMI0_TIN1_TLDS2_TLDSMn1_ULSGRO0_USL1_UIOFGRO0_UPLRP0_USFGRO0_VSn1_VWA1_VWB1_WSGRA0_WSGRB0_WS64_WG16_4_1_WGM0_WGMXCC1_WGMXCCGn1
    SolutionIndex: 244
    SolutionNameMin: Cijk_Alik_Bljk_BBS_BH_BiasSB_HAS_SAV_UserArgs_MT96x64x128_MI16x16x1_SN_LDSB0_AFC1_AG1_AFEM1_AFEM1_ASEM1_CLR1_CADS0_DTLA1_DTLB1_DTVA0_DTVB0_DTVMXSA0_DTVMXSB0_DTVSM0_DPLB1_EPS0_ELFLR0_EMLLn1_FDSI0_GRPM1_GRVWA8_GRVWB8_GSU0_GSUAMB_GSUC0_GSUWGMRR0_GLS0_ISA950_IU1_K1_LDSTI0_LBSPPA1024_LBSPPB1024_LBSPPM0_LPA32_LPB32_LPM0_LRVWn1_LWPMn1_MIAV0_MIWT3_2_MO40_MGRIPM1_NTn1_NTA0_NTB0_NTC0_NTD0_NTM0_NEPBS10_NLCA1_NLCB1_ONLL1_PGR2_PLR1_PKA1_SGROB0_SIA3_SS0_SU8_SUM0_SUS512_SPO1_SRVW0_SSO1_SVW4_SK3_SKFTR0_SKXCCM4_SGRO0_TDMI0_TIN0_TLDS1_TLDSMn1_ULSGRO1_USL1_UIOFGRO0_UPLRP0_USFGRO0_VSn1_VWA1_VWB2_WSGRA0_WSGRB0_WS64_WG32_8_1_WGM16_WGMXCC2_WGMXCCGn1
    SolutionIndex: 245
    SolutionNameMin: Cijk_Alik_Bljk_BBS_BH_BiasSB_HAS_SAV_UserArgs_MT16x64x32_MI16x16x1_SN_LDSB0_AFC1_AG1_AFEM1_AFEM1_ASEM1_CLR0_CADS0_DTLA1_DTLB1_DTVA0_DTVB0_DTVMXSA0_DTVMXSB0_DTVSM0_DPLB1_EPS0_ELFLR0_EMLL0_FDSI0_GRPM1_GRVWA2_GRVWB8_GSU0_GSUAMB_GSUC0_GSUWGMRR0_GLS0_ISA950_IU1_K1_LDSTI0_LBSPPA256_LBSPPB1024_LBSPPM0_LPA32_LPB32_LPM0_LRVWn1_LWPMn1_MIAV1_MIWT1_1_MO40_MGRIPM1_NTn1_NTA4_NTB4_NTC4_NTD0_NTM0_NEPBS16_NLCA1_NLCB1_ONLL1_PGR4_PLR1_PKA1_SGROB0_SIA3_SS1_SU0_SUM0_SUS0_SPO1_SRVW0_SSO0_SVW1_SK3_SKFTR0_SKXCCM0_SGRO0_TDMI0_TIN1_TLDS2_TLDSMn1_ULSGRO0_USL1_UIOFGRO0_UPLRP0_USFGRO0_VSn1_VWA1_VWB1_WSGRA0_WSGRB0_WS64_WG16_16_1_WGM32_WGMXCC1_WGMXCCGn1
    SolutionIndex: 246
    SolutionNameMin: Cijk_Alik_Bljk_BBS_BH_BiasSB_HAS_SAV_UserArgs_MT32x16x256_MI16x16x1_SN_LDSB0_AFC1_AG1_AFEM1_AFEM1_ASEM1_CLR1_CADS0_DTLA1_DTLB1_DTVA0_DTVB0_DTVMXSA0_DTVMXSB0_DTVSM0_DPLB1_EPS0_ELFLR0_EMLLn1_FDSI0_GRPM1_GRVWA8_GRVWB8_GSU0_GSUAMB_GSUC0_GSUWGMRR0_GLS0_ISA950_IU1_K1_LDSTI0_LBSPPA1024_LBSPPB1024_LBSPPM0_LPA32_LPB32_LPM0_LRVWn1_LWPMn1_MIAV0_MIWT1_1_MO40_MGRIPM1_NTn1_NTA0_NTB0_NTC0_NTD0_NTM0_NEPBS4_NLCA1_NLCB1_ONLL1_PGR3_PLR1_PKA1_SGROB0_SIA3_SS0_SU0_SUM0_SUS0_SPO1_SRVW0_SSO0_SVW4_SK3_SKFTR0_SKXCCM0_SGRO0_TDMI0_TIN1_TLDS1_TLDSMn1_ULSGRO0_USL1_UIOFGRO0_UPLRP0_USFGRO0_VSn1_VWA1_VWB1_WSGRA0_WSGRB0_WS64_WG32_4_1_WGM2_WGMXCC16_WGMXCCGn1
    SolutionIndex: 247
    SolutionNameMin: Cijk_Alik_Bljk_BBS_BH_BiasSB_HAS_SAV_UserArgs_MT16x16x512_MI16x16x1_SN_LDSB0_AFC1_AG1_AFEM1_AFEM1_ASEM1_CLR0_CADS0_DTLA0_DTLB0_DTVA0_DTVB0_DTVMXSA0_DTVMXSB0_DTVSM0_DPLB0_EPS0_ELFLR0_EMLL0_FDSI0_GRPM1_GRVWA8_GRVWB8_GSU0_GSUAMB_GSUC0_GSUWGMRR0_GLS0_ISA950_IU1_K1_LDSTI0_LBSPPA1024_LBSPPB1024_LBSPPM0_LPA16_LPB16_LPM0_LRVWn1_LWPMn1_MIAV0_MIWT1_1_MO40_MGRIPM1_NTn1_NTA0_NTB0_NTC0_NTD0_NTM0_NEPBS8_NLCA1_NLCB1_ONLL1_PGR2_PLR1_PKA1_SGROB0_SIA3_SS0_SU0_SUM0_SUS1024_SPO1_SRVW0_SSO0_SVW1_SK3_SKFTR0_SKXCCM0_SGRO0_TDMI0_TIN0_TLDS1_TLDSMn1_ULSGRO1_USL1_UIOFGRO0_UPLRP0_USFGRO1_VSn1_VWA1_VWB1_WSGRA0_WSGRB0_WS64_WG16_4_4_WGM24_WGMXCC2_WGMXCCGn1
    SolutionIndex: 248
    SolutionNameMin: Cijk_Alik_Bljk_BBS_BH_BiasSB_HAS_SAV_UserArgs_MT16x16x512_MI16x16x1_SN_LDSB0_AFC1_AG1_AFEM1_AFEM1_ASEM1_CLR1_CADS0_DTLA0_DTLB0_DTVA0_DTVB0_DTVMXSA0_DTVMXSB0_DTVSM0_DPLB0_EPS0_ELFLR0_EMLLn1_FDSI0_GRPM1_GRVWA8_GRVWB8_GSU0_GSUAMB_GSUC0_GSUWGMRR0_GLS0_ISA950_IU1_K1_LDSTI0_LBSPPA1024_LBSPPB1024_LBSPPM0_LPA16_LPB16_LPM0_LRVWn1_LWPMn1_MIAV0_MIWT1_1_MO40_MGRIPM1_NTn1_NTA4_NTB0_NTC0_NTD0_NTM0_NEPBS12_NLCA1_NLCB1_ONLL1_PGR2_PLR1_PKA1_SGROB0_SIA3_SS1_SU8_SUM0_SUS1024_SPO0_SRVW0_SSO0_SVW1_SK3_SKFTR0_SKXCCM4_SGRO0_TDMI0_TIN0_TLDS1_TLDSMn1_ULSGRO1_USL1_UIOFGRO0_UPLRP0_USFGRO0_VSn1_VWA1_VWB1_WSGRA0_WSGRB0_WS64_WG16_4_4_WGM0_WGMXCC32_WGMXCCGn1
    SolutionIndex: 249
    SolutionNameMin: Cijk_Alik_Bljk_BBS_BH_BiasSB_HAS_SAV_UserArgs_MT16x16x512_MI16x16x1_SN_LDSB0_AFC1_AG0_AFEM1_AFEM1_ASEM1_CLR0_CADS0_DTLA0_DTLB0_DTVA0_DTVB0_DTVMXSA0_DTVMXSB0_DTVSM0_DPLB0_EPS0_ELFLR0_EMLLn1_FDSI0_GRPM1_GRVWA8_GRVWB8_GSU0_GSUAMB_GSUC0_GSUWGMRR0_GLS0_ISA950_IU1_K1_LDSTI0_LBSPPA1024_LBSPPB1024_LBSPPM0_LPA16_LPB16_LPM0_LRVWn1_LWPMn1_MIAV0_MIWT1_1_MO40_MGRIPM1_NTn1_NTA4_NTB0_NTC0_NTD0_NTM0_NEPBS10_NLCA1_NLCB1_ONLL1_PGR2_PLR1_PKA1_SGROB0_SIA3_SS0_SU8_SUM0_SUS1024_SPO1_SRVW0_SSO0_SVW1_SK3_SKFTR0_SKXCCM4_SGRO0_TDMI0_TIN0_TLDS1_TLDSMn1_ULSGRO1_USL1_UIOFGRO0_UPLRP0_USFGRO0_VSn1_VWA1_VWB1_WSGRA0_WSGRB0_WS64_WG16_4_4_WGM24_WGMXCC16_WGMXCCGn1
    SolutionIndex: 250
    SolutionNameMin: Cijk_Alik_Bljk_BBS_BH_BiasSB_HAS_SAV_UserArgs_MT32x32x256_MI16x16x1_SN_LDSB0_AFC1_AG0_AFEM1_AFEM1_ASEM1_CLR0_CADS0_DTLA1_DTLB1_DTVA0_DTVB0_DTVMXSA0_DTVMXSB0_DTVSM0_DPLB1_EPS0_ELFLR0_EMLLn1_FDSI0_GRPM1_GRVWA8_GRVWB8_GSU0_GSUAMB_GSUC0_GSUWGMRR0_GLS0_ISA950_IU1_K1_LDSTI0_LBSPPA1024_LBSPPB1024_LBSPPM0_LPA32_LPB32_LPM0_LRVWn1_LWPMn1_MIAV1_MIWT1_1_MO40_MGRIPM1_NTn1_NTA0_NTB0_NTC0_NTD0_NTM0_NEPBS8_NLCA1_NLCB1_ONLL1_PGR3_PLR1_PKA1_SGROB0_SIA3_SS1_SU0_SUM0_SUS0_SPO1_SRVW0_SSO0_SVW1_SK3_SKFTR0_SKXCCM0_SGRO0_TDMI0_TIN1_TLDS1_TLDSMn1_ULSGRO1_USL1_UIOFGRO0_UPLRP0_USFGRO0_VSn1_VWA1_VWB1_WSGRA0_WSGRB0_WS64_WG32_8_1_WGMn8_WGMXCC1_WGMXCCGn1
    SolutionIndex: 251
    SolutionNameMin: Cijk_Alik_Bljk_BBS_BH_BiasSB_HAS_SAV_UserArgs_MT32x32x128_MI16x16x1_SN_LDSB0_AFC1_AG0_AFEM1_AFEM1_ASEM1_CLR1_CADS0_DTLA1_DTLB1_DTVA0_DTVB0_DTVMXSA0_DTVMXSB0_DTVSM0_DPLB1_EPS0_ELFLR0_EMLL0_FDSI0_GRPM1_GRVWA2_GRVWB8_GSU0_GSUAMB_GSUC0_GSUWGMRR0_GLS0_ISA950_IU1_K1_LDSTI0_LBSPPA256_LBSPPB1024_LBSPPM0_LPA16_LPB32_LPM0_LRVWn1_LWPMn1_MIAV0_MIWT1_1_MO40_MGRIPM1_NTn1_NTA0_NTB0_NTC0_NTD0_NTM0_NEPBS4_NLCA1_NLCB1_ONLL1_PGR4_PLR1_PKA1_SGROB0_SIA3_SS0_SU0_SUM0_SUS0_SPO1_SRVW0_SSO0_SVW4_SK3_SKFTR0_SKXCCM8_SGRO0_TDMI0_TIN1_TLDS1_TLDSMn1_ULSGRO0_USL1_UIOFGRO0_UPLRP0_USFGRO0_VSn1_VWA1_VWB1_WSGRA0_WSGRB0_WS64_WG32_8_1_WGM32_WGMXCC1_WGMXCCGn1
    SolutionIndex: 252
    SolutionNameMin: Cijk_Alik_Bljk_BBS_BH_BiasSB_HAS_SAV_UserArgs_MT32x32x256_MI16x16x1_SN_LDSB0_AFC1_AG1_AFEM1_AFEM1_ASEM1_CLR1_CADS0_DTLA1_DTLB1_DTVA0_DTVB0_DTVMXSA0_DTVMXSB0_DTVSM0_DPLB1_EPS0_ELFLR0_EMLLn1_FDSI0_GRPM1_GRVWA8_GRVWB8_GSU0_GSUAMB_GSUC0_GSUWGMRR0_GLS0_ISA950_IU1_K1_LDSTI0_LBSPPA1024_LBSPPB1024_LBSPPM0_LPA32_LPB32_LPM0_LRVWn1_LWPMn1_MIAV0_MIWT1_1_MO40_MGRIPM1_NTn1_NTA0_NTB0_NTC0_NTD0_NTM0_NEPBS0_NLCA1_NLCB1_ONLL1_PGR3_PLR1_PKA1_SGROB1_SIA3_SS0_SU0_SUM0_SUS0_SPO1_SRVW0_SSO0_SVW4_SK3_SKFTR0_SKXCCM0_SGRO0_TDMI0_TIN1_TLDS2_TLDSMn1_ULSGRO1_USL1_UIOFGRO0_UPLRP0_USFGRO0_VSn1_VWA1_VWB1_WSGRA0_WSGRB0_WS64_WG32_8_1_WGM8_WGMXCC32_WGMXCCGn1
    SolutionIndex: 253
    SolutionNameMin: Cijk_Alik_Bljk_BBS_BH_BiasSB_HAS_SAV_UserArgs_MT32x32x256_MI16x16x1_SN_LDSB0_AFC1_AG0_AFEM1_AFEM1_ASEM1_CLR0_CADS0_DTLA1_DTLB1_DTVA0_DTVB0_DTVMXSA0_DTVMXSB0_DTVSM0_DPLB1_EPS0_ELFLR0_EMLLn1_FDSI0_GRPM1_GRVWA8_GRVWB8_GSU0_GSUAMB_GSUC0_GSUWGMRR0_GLS0_ISA950_IU1_K1_LDSTI0_LBSPPA1024_LBSPPB1024_LBSPPM0_LPA32_LPB32_LPM0_LRVWn1_LWPMn1_MIAV0_MIWT1_1_MO40_MGRIPM1_NTn1_NTA0_NTB0_NTC0_NTD0_NTM0_NEPBS4_NLCA1_NLCB1_ONLL1_PGR3_PLR1_PKA1_SGROB0_SIA3_SS0_SU0_SUM0_SUS0_SPO1_SRVW0_SSO0_SVW4_SK3_SKFTR0_SKXCCM0_SGRO0_TDMI0_TIN1_TLDS1_TLDSMn1_ULSGRO1_USL1_UIOFGRO0_UPLRP0_USFGRO0_VSn1_VWA1_VWB1_WSGRA0_WSGRB0_WS64_WG32_8_1_WGM0_WGMXCC1_WGMXCCGn1
    SolutionIndex: 254
    SolutionNameMin: Cijk_Alik_Bljk_BBS_BH_BiasSB_HAS_SAV_UserArgs_MT32x32x256_MI16x16x1_SN_LDSB0_AFC1_AG0_AFEM1_AFEM1_ASEM1_CLR1_CADS0_DTLA1_DTLB1_DTVA0_DTVB0_DTVMXSA0_DTVMXSB0_DTVSM0_DPLB1_EPS0_ELFLR0_EMLLn1_FDSI0_GRPM1_GRVWA8_GRVWB8_GSU0_GSUAMB_GSUC0_GSUWGMRR0_GLS0_ISA950_IU1_K1_LDSTI0_LBSPPA1024_LBSPPB1024_LBSPPM0_LPA32_LPB32_LPM0_LRVWn1_LWPMn1_MIAV1_MIWT1_1_MO40_MGRIPM1_NTn1_NTA0_NTB0_NTC0_NTD0_NTM0_NEPBS16_NLCA1_NLCB1_ONLL1_PGR3_PLR1_PKA1_SGROB0_SIA3_SS1_SU0_SUM0_SUS0_SPO1_SRVW0_SSO0_SVW1_SK3_SKFTR0_SKXCCM0_SGRO0_TDMI0_TIN1_TLDS1_TLDSMn1_ULSGRO1_USL1_UIOFGRO0_UPLRP0_USFGRO0_VSn1_VWA1_VWB1_WSGRA0_WSGRB0_WS64_WG32_8_1_WGMn16_WGMXCC1_WGMXCCGn1
    SolutionIndex: 255
    SolutionNameMin: Cijk_Alik_Bljk_BBS_BH_BiasSB_HAS_SAV_UserArgs_MT128x128x64_MI16x16x1_SN_LDSB0_AFC1_AG1_AFEM1_AFEM1_ASEM1_CLR1_CADS0_DTLA1_DTLB1_DTVA0_DTVB0_DTVMXSA0_DTVMXSB0_DTVSM0_DPLB1_EPS0_ELFLR0_EMLLn1_FDSI0_GRPM1_GRVWA8_GRVWB8_GSU0_GSUAMB_GSUC0_GSUWGMRR0_GLS0_ISA950_IU1_K1_LDSTI0_LBSPPA1024_LBSPPB1024_LBSPPM0_LPA32_LPB32_LPM0_LRVWn1_LWPMn1_MIAV0_MIWT4_4_MO40_MGRIPM1_NTn1_NTA4_NTB0_NTC4_NTD4_NTM0_NEPBS10_NLCA1_NLCB1_ONLL1_PGR3_PLR1_PKA1_SGROB0_SIA3_SS1_SU0_SUM0_SUS0_SPO0_SRVW0_SSO0_SVW4_SK3_SKFTR0_SKXCCM4_SGRO0_TDMI0_TIN1_TLDS1_TLDSMn1_ULSGRO1_USL1_UIOFGRO0_UPLRP0_USFGRO0_VSn1_VWA4_VWB4_WSGRA0_WSGRB0_WS64_WG32_8_1_WGM48_WGMXCC1_WGMXCCGn1
    SolutionIndex: 256
    SolutionNameMin: Cijk_Alik_Bljk_BBS_BH_BiasSB_HAS_SAV_UserArgs_MT32x32x256_MI16x16x1_SN_LDSB0_AFC1_AG1_AFEM1_AFEM1_ASEM1_CLR1_CADS0_DTLA1_DTLB1_DTVA0_DTVB0_DTVMXSA0_DTVMXSB0_DTVSM0_DPLB1_EPS0_ELFLR0_EMLLn1_FDSI0_GRPM1_GRVWA8_GRVWB8_GSU0_GSUAMB_GSUC0_GSUWGMRR0_GLS0_ISA950_IU1_K1_LDSTI0_LBSPPA1024_LBSPPB1024_LBSPPM0_LPA32_LPB32_LPM0_LRVWn1_LWPMn1_MIAV0_MIWT1_1_MO40_MGRIPM1_NTn1_NTA0_NTB0_NTC0_NTD4_NTM0_NEPBS12_NLCA1_NLCB1_ONLL1_PGR3_PLR1_PKA1_SGROB1_SIA3_SS1_SU0_SUM0_SUS0_SPO0_SRVW0_SSO0_SVW1_SK3_SKFTR0_SKXCCM0_SGRO0_TDMI0_TIN1_TLDS1_TLDSMn1_ULSGRO1_USL1_UIOFGRO0_UPLRP0_USFGRO0_VSn1_VWA1_VWB1_WSGRA0_WSGRB0_WS64_WG32_8_1_WGMn4_WGMXCC1_WGMXCCGn1
    SolutionIndex: 257
    SolutionNameMin: Cijk_Alik_Bljk_BBS_BH_BiasSB_HAS_SAV_UserArgs_MT32x32x256_MI16x16x1_SN_LDSB0_AFC1_AG0_AFEM1_AFEM1_ASEM1_CLR1_CADS0_DTLA1_DTLB1_DTVA0_DTVB0_DTVMXSA0_DTVMXSB0_DTVSM0_DPLB1_EPS0_ELFLR0_EMLLn1_FDSI0_GRPM1_GRVWA8_GRVWB8_GSU0_GSUAMB_GSUC0_GSUWGMRR0_GLS0_ISA950_IU1_K1_LDSTI0_LBSPPA1024_LBSPPB1024_LBSPPM0_LPA32_LPB32_LPM0_LRVWn1_LWPMn1_MIAV1_MIWT1_1_MO40_MGRIPM1_NTn1_NTA0_NTB4_NTC0_NTD0_NTM0_NEPBS10_NLCA1_NLCB1_ONLL1_PGR3_PLR1_PKA1_SGROB0_SIA3_SS1_SU0_SUM0_SUS0_SPO0_SRVW0_SSO0_SVW1_SK3_SKFTR0_SKXCCM0_SGRO0_TDMI0_TIN1_TLDS1_TLDSMn1_ULSGRO1_USL1_UIOFGRO0_UPLRP0_USFGRO0_VSn1_VWA1_VWB1_WSGRA0_WSGRB0_WS64_WG32_8_1_WGMn4_WGMXCC1_WGMXCCGn1
    SolutionIndex: 258
    SolutionNameMin: Cijk_Alik_Bljk_BBS_BH_BiasSB_HAS_SAV_UserArgs_MT32x32x256_MI16x16x1_SN_LDSB0_AFC1_AG0_AFEM1_AFEM1_ASEM1_CLR0_CADS0_DTLA1_DTLB1_DTVA0_DTVB0_DTVMXSA0_DTVMXSB0_DTVSM0_DPLB1_EPS0_ELFLR0_EMLLn1_FDSI0_GRPM1_GRVWA8_GRVWB8_GSU0_GSUAMB_GSUC0_GSUWGMRR0_GLS0_ISA950_IU1_K1_LDSTI0_LBSPPA1024_LBSPPB1024_LBSPPM0_LPA32_LPB32_LPM0_LRVWn1_LWPMn1_MIAV1_MIWT1_1_MO40_MGRIPM1_NTn1_NTA0_NTB0_NTC0_NTD0_NTM0_NEPBS4_NLCA1_NLCB1_ONLL1_PGR3_PLR1_PKA1_SGROB0_SIA3_SS0_SU0_SUM0_SUS0_SPO1_SRVW0_SSO0_SVW4_SK3_SKFTR0_SKXCCM0_SGRO0_TDMI0_TIN1_TLDS1_TLDSMn1_ULSGRO1_USL1_UIOFGRO0_UPLRP0_USFGRO0_VSn1_VWA1_VWB1_WSGRA0_WSGRB0_WS64_WG32_8_1_WGM16_WGMXCC1_WGMXCCGn1
    SolutionIndex: 259
    SolutionNameMin: Cijk_Alik_Bljk_BBS_BH_BiasSB_HAS_SAV_UserArgs_MT16x16x512_MI16x16x1_SN_LDSB0_AFC1_AG1_AFEM1_AFEM1_ASEM1_CLR1_CADS0_DTLA0_DTLB0_DTVA0_DTVB0_DTVMXSA0_DTVMXSB0_DTVSM0_DPLB0_EPS0_ELFLR0_EMLLn1_FDSI0_GRPM1_GRVWA8_GRVWB8_GSU0_GSUAMB_GSUC0_GSUWGMRR0_GLS0_ISA950_IU1_K1_LDSTI0_LBSPPA1024_LBSPPB1024_LBSPPM0_LPA16_LPB16_LPM0_LRVWn1_LWPMn1_MIAV1_MIWT1_1_MO40_MGRIPM1_NTn1_NTA4_NTB0_NTC0_NTD4_NTM0_NEPBS4_NLCA1_NLCB1_ONLL1_PGR2_PLR1_PKA1_SGROB0_SIA3_SS1_SU16_SUM0_SUS1024_SPO1_SRVW0_SSO0_SVW1_SK3_SKFTR0_SKXCCM4_SGRO0_TDMI0_TIN0_TLDS1_TLDSMn1_ULSGRO1_USL1_UIOFGRO0_UPLRP0_USFGRO1_VSn1_VWA1_VWB1_WSGRA0_WSGRB0_WS64_WG16_4_4_WGM24_WGMXCC1_WGMXCCGn1
    SolutionIndex: 260
    SolutionNameMin: Cijk_Alik_Bljk_BBS_BH_BiasSB_HAS_SAV_UserArgs_MT32x32x256_MI16x16x1_SN_LDSB0_AFC1_AG0_AFEM1_AFEM1_ASEM1_CLR0_CADS0_DTLA1_DTLB1_DTVA0_DTVB0_DTVMXSA0_DTVMXSB0_DTVSM0_DPLB1_EPS0_ELFLR0_EMLLn1_FDSI0_GRPM1_GRVWA8_GRVWB8_GSU0_GSUAMB_GSUC0_GSUWGMRR0_GLS0_ISA950_IU1_K1_LDSTI0_LBSPPA1024_LBSPPB1024_LBSPPM0_LPA32_LPB32_LPM0_LRVWn1_LWPMn1_MIAV1_MIWT1_1_MO40_MGRIPM1_NTn1_NTA0_NTB4_NTC0_NTD0_NTM0_NEPBS0_NLCA1_NLCB1_ONLL1_PGR3_PLR1_PKA1_SGROB0_SIA3_SS0_SU0_SUM0_SUS0_SPO0_SRVW0_SSO0_SVW4_SK3_SKFTR0_SKXCCM0_SGRO0_TDMI0_TIN1_TLDS2_TLDSMn1_ULSGRO1_USL1_UIOFGRO0_UPLRP0_USFGRO0_VSn1_VWA1_VWB1_WSGRA0_WSGRB0_WS64_WG32_8_1_WGM8_WGMXCC1_WGMXCCGn1
    SolutionIndex: 261
    SolutionNameMin: Cijk_Alik_Bljk_BBS_BH_BiasSB_HAS_SAV_UserArgs_MT32x32x256_MI16x16x1_SN_LDSB0_AFC1_AG1_AFEM1_AFEM1_ASEM1_CLR0_CADS0_DTLA1_DTLB1_DTVA0_DTVB0_DTVMXSA0_DTVMXSB0_DTVSM0_DPLB1_EPS0_ELFLR0_EMLLn1_FDSI0_GRPM1_GRVWA8_GRVWB8_GSU0_GSUAMB_GSUC0_GSUWGMRR0_GLS0_ISA950_IU1_K1_LDSTI0_LBSPPA1024_LBSPPB1024_LBSPPM0_LPA32_LPB32_LPM0_LRVWn1_LWPMn1_MIAV1_MIWT1_1_MO40_MGRIPM1_NTn1_NTA0_NTB0_NTC0_NTD0_NTM0_NEPBS14_NLCA1_NLCB1_ONLL1_PGR3_PLR1_PKA1_SGROB1_SIA3_SS0_SU0_SUM0_SUS0_SPO1_SRVW0_SSO0_SVW4_SK3_SKFTR0_SKXCCM0_SGRO0_TDMI0_TIN1_TLDS1_TLDSMn1_ULSGRO1_USL1_UIOFGRO0_UPLRP0_USFGRO0_VSn1_VWA1_VWB1_WSGRA0_WSGRB0_WS64_WG32_8_1_WGMn4_WGMXCC1_WGMXCCGn1
    SolutionIndex: 262
    SolutionNameMin: Cijk_Alik_Bljk_BBS_BH_BiasSB_HAS_SAV_UserArgs_MT16x16x512_MI16x16x1_SN_LDSB0_AFC1_AG0_AFEM1_AFEM1_ASEM1_CLR1_CADS0_DTLA0_DTLB0_DTVA0_DTVB0_DTVMXSA0_DTVMXSB0_DTVSM0_DPLB0_EPS0_ELFLR0_EMLLn1_FDSI0_GRPM1_GRVWA8_GRVWB8_GSU0_GSUAMB_GSUC0_GSUWGMRR0_GLS0_ISA950_IU1_K1_LDSTI0_LBSPPA1024_LBSPPB1024_LBSPPM0_LPA16_LPB16_LPM0_LRVWn1_LWPMn1_MIAV0_MIWT1_1_MO40_MGRIPM1_NTn1_NTA4_NTB0_NTC0_NTD0_NTM0_NEPBS2_NLCA1_NLCB1_ONLL1_PGR2_PLR1_PKA1_SGROB0_SIA3_SS1_SU16_SUM0_SUS1024_SPO0_SRVW0_SSO0_SVW1_SK3_SKFTR0_SKXCCM4_SGRO0_TDMI0_TIN0_TLDS2_TLDSMn1_ULSGRO1_USL1_UIOFGRO0_UPLRP0_USFGRO0_VSn1_VWA1_VWB1_WSGRA0_WSGRB0_WS64_WG16_4_4_WGM0_WGMXCC32_WGMXCCGn1
    SolutionIndex: 263
    SolutionNameMin: Cijk_Alik_Bljk_BBS_BH_BiasSB_HAS_SAV_UserArgs_MT16x16x256_MI16x16x1_SN_LDSB0_AFC1_AG0_AFEM1_AFEM1_ASEM1_CLR0_CADS0_DTLA1_DTLB1_DTVA0_DTVB0_DTVMXSA0_DTVMXSB0_DTVSM0_DPLB1_EPS0_ELFLR0_EMLLn1_FDSI0_GRPM1_GRVWA8_GRVWB8_GSU0_GSUAMB_GSUC0_GSUWGMRR0_GLS0_ISA950_IU1_K1_LDSTI0_LBSPPA1024_LBSPPB1024_LBSPPM0_LPA32_LPB32_LPM0_LRVWn1_LWPMn1_MIAV0_MIWT1_1_MO40_MGRIPM1_NTn1_NTA4_NTB0_NTC0_NTD0_NTM0_NEPBS2_NLCA1_NLCB1_ONLL1_PGR4_PLR1_PKA1_SGROB1_SIA3_SS0_SU0_SUM0_SUS0_SPO0_SRVW0_SSO1_SVW4_SK3_SKFTR0_SKXCCM4_SGRO0_TDMI0_TIN1_TLDS1_TLDSMn1_ULSGRO1_USL1_UIOFGRO0_UPLRP0_USFGRO0_VSn1_VWA1_VWB1_WSGRA0_WSGRB0_WS64_WG16_4_1_WGM4_WGMXCC1_WGMXCCGn1
    SolutionIndex: 264
    SolutionNameMin: Cijk_Alik_Bljk_BBS_BH_BiasSB_HAS_SAV_UserArgs_MT16x16x512_MI16x16x1_SN_LDSB0_AFC1_AG1_AFEM1_AFEM1_ASEM1_CLR1_CADS0_DTLA0_DTLB0_DTVA0_DTVB0_DTVMXSA0_DTVMXSB0_DTVSM0_DPLB0_EPS0_ELFLR0_EMLLn1_FDSI0_GRPM1_GRVWA8_GRVWB8_GSU0_GSUAMB_GSUC0_GSUWGMRR0_GLS0_ISA950_IU1_K1_LDSTI0_LBSPPA1024_LBSPPB1024_LBSPPM0_LPA16_LPB16_LPM0_LRVWn1_LWPMn1_MIAV1_MIWT1_1_MO40_MGRIPM1_NTn1_NTA4_NTB0_NTC0_NTD0_NTM0_NEPBS10_NLCA1_NLCB1_ONLL1_PGR2_PLR1_PKA1_SGROB0_SIA3_SS1_SU0_SUM0_SUS1024_SPO0_SRVW0_SSO1_SVW1_SK3_SKFTR0_SKXCCM4_SGRO0_TDMI0_TIN0_TLDS2_TLDSMn1_ULSGRO1_USL1_UIOFGRO0_UPLRP0_USFGRO0_VSn1_VWA1_VWB1_WSGRA0_WSGRB2_WS64_WG16_4_4_WGM32_WGMXCC32_WGMXCCGn1
    SolutionIndex: 265
    SolutionNameMin: Cijk_Alik_Bljk_BBS_BH_BiasSB_HAS_SAV_UserArgs_MT16x16x512_MI16x16x1_SN_LDSB0_AFC1_AG1_AFEM1_AFEM1_ASEM1_CLR1_CADS0_DTLA0_DTLB0_DTVA0_DTVB0_DTVMXSA0_DTVMXSB0_DTVSM0_DPLB0_EPS0_ELFLR0_EMLL0_FDSI0_GRPM1_GRVWA8_GRVWB8_GSU0_GSUAMB_GSUC0_GSUWGMRR0_GLS0_ISA950_IU1_K1_LDSTI0_LBSPPA1024_LBSPPB1024_LBSPPM0_LPA16_LPB16_LPM0_LRVWn1_LWPMn1_MIAV0_MIWT1_1_MO40_MGRIPM1_NTn1_NTA4_NTB0_NTC0_NTD0_NTM0_NEPBS0_NLCA1_NLCB1_ONLL1_PGR2_PLR1_PKA1_SGROB0_SIA3_SS1_SU8_SUM0_SUS1024_SPO0_SRVW0_SSO0_SVW1_SK3_SKFTR0_SKXCCM4_SGRO0_TDMI0_TIN0_TLDS1_TLDSMn1_ULSGRO1_USL1_UIOFGRO0_UPLRP0_USFGRO0_VSn1_VWA1_VWB1_WSGRA0_WSGRB0_WS64_WG16_4_4_WGM48_WGMXCC1_WGMXCCGn1
    SolutionIndex: 266
    SolutionNameMin: Cijk_Alik_Bljk_BBS_BH_BiasSB_HAS_SAV_UserArgs_MT128x128x64_MI16x16x1_SN_LDSB0_AFC1_AG1_AFEM1_AFEM1_ASEM1_CLR1_CADS0_DTLA1_DTLB1_DTVA0_DTVB0_DTVMXSA0_DTVMXSB0_DTVSM0_DPLB1_EPS0_ELFLR0_EMLLn1_FDSI0_GRPM1_GRVWA8_GRVWB8_GSU0_GSUAMB_GSUC0_GSUWGMRR0_GLS0_ISA950_IU1_K1_LDSTI0_LBSPPA1024_LBSPPB1024_LBSPPM0_LPA16_LPB32_LPM0_LRVWn1_LWPMn1_MIAV0_MIWT8_2_MO40_MGRIPM1_NTn1_NTA4_NTB0_NTC4_NTD4_NTM0_NEPBS12_NLCA1_NLCB1_ONLL1_PGR3_PLR1_PKA1_SGROB1_SIA3_SS1_SU0_SUM0_SUS0_SPO0_SRVW0_SSO0_SVW8_SK3_SKFTR0_SKXCCM4_SGRO0_TDMI0_TIN1_TLDS1_TLDSMn1_ULSGRO1_USL1_UIOFGRO0_UPLRP0_USFGRO0_VSn1_VWA8_VWB2_WSGRA0_WSGRB0_WS64_WG16_16_1_WGM8_WGMXCC1_WGMXCCGn1
    SolutionIndex: 267
    SolutionNameMin: Cijk_Alik_Bljk_BBS_BH_BiasSB_HAS_SAV_UserArgs_MT16x16x512_MI16x16x1_SN_LDSB0_AFC1_AG1_AFEM1_AFEM1_ASEM1_CLR1_CADS0_DTLA0_DTLB0_DTVA0_DTVB0_DTVMXSA0_DTVMXSB0_DTVSM0_DPLB0_EPS0_ELFLR0_EMLLn1_FDSI0_GRPM1_GRVWA8_GRVWB8_GSU0_GSUAMB_GSUC0_GSUWGMRR0_GLS0_ISA950_IU1_K1_LDSTI0_LBSPPA1024_LBSPPB1024_LBSPPM0_LPA16_LPB16_LPM0_LRVWn1_LWPMn1_MIAV0_MIWT1_1_MO40_MGRIPM1_NTn1_NTA4_NTB0_NTC0_NTD0_NTM0_NEPBS10_NLCA1_NLCB1_ONLL1_PGR2_PLR1_PKA1_SGROB0_SIA3_SS1_SU0_SUM0_SUS1024_SPO1_SRVW0_SSO0_SVW1_SK3_SKFTR0_SKXCCM4_SGRO0_TDMI0_TIN0_TLDS1_TLDSMn1_ULSGRO1_USL1_UIOFGRO0_UPLRP0_USFGRO1_VSn1_VWA1_VWB1_WSGRA0_WSGRB0_WS64_WG16_4_4_WGM4_WGMXCC1_WGMXCCGn1
    SolutionIndex: 268
    SolutionNameMin: Cijk_Alik_Bljk_BBS_BH_BiasSB_HAS_SAV_UserArgs_MT16x16x512_MI16x16x1_SN_LDSB0_AFC1_AG0_AFEM1_AFEM1_ASEM1_CLR0_CADS0_DTLA0_DTLB0_DTVA0_DTVB0_DTVMXSA0_DTVMXSB0_DTVSM0_DPLB0_EPS0_ELFLR0_EMLL0_FDSI0_GRPM1_GRVWA8_GRVWB8_GSU0_GSUAMB_GSUC0_GSUWGMRR0_GLS0_ISA950_IU1_K1_LDSTI0_LBSPPA1024_LBSPPB1024_LBSPPM0_LPA16_LPB16_LPM0_LRVWn1_LWPMn1_MIAV0_MIWT1_1_MO40_MGRIPM1_NTn1_NTA4_NTB0_NTC0_NTD0_NTM0_NEPBS10_NLCA1_NLCB1_ONLL1_PGR2_PLR1_PKA1_SGROB0_SIA3_SS1_SU8_SUM0_SUS1024_SPO1_SRVW0_SSO0_SVW1_SK3_SKFTR0_SKXCCM4_SGRO0_TDMI0_TIN0_TLDS2_TLDSMn1_ULSGRO1_USL1_UIOFGRO0_UPLRP0_USFGRO1_VSn1_VWA1_VWB1_WSGRA0_WSGRB0_WS64_WG16_4_4_WGM6_WGMXCC1_WGMXCCGn1
    SolutionIndex: 269
    SolutionNameMin: Cijk_Alik_Bljk_BBS_BH_BiasSB_HAS_SAV_UserArgs_MT32x32x256_MI16x16x1_SN_LDSB0_AFC1_AG1_AFEM1_AFEM1_ASEM1_CLR0_CADS0_DTLA1_DTLB1_DTVA0_DTVB0_DTVMXSA0_DTVMXSB0_DTVSM0_DPLB1_EPS0_ELFLR0_EMLLn1_FDSI0_GRPM1_GRVWA8_GRVWB8_GSU0_GSUAMB_GSUC0_GSUWGMRR0_GLS0_ISA950_IU1_K1_LDSTI0_LBSPPA1024_LBSPPB1024_LBSPPM0_LPA32_LPB32_LPM0_LRVWn1_LWPMn1_MIAV0_MIWT1_1_MO40_MGRIPM1_NTn1_NTA0_NTB0_NTC0_NTD0_NTM0_NEPBS8_NLCA1_NLCB1_ONLL1_PGR3_PLR1_PKA1_SGROB1_SIA3_SS0_SU0_SUM0_SUS0_SPO1_SRVW0_SSO0_SVW4_SK3_SKFTR0_SKXCCM0_SGRO0_TDMI0_TIN1_TLDS1_TLDSMn1_ULSGRO1_USL1_UIOFGRO0_UPLRP0_USFGRO0_VSn1_VWA1_VWB1_WSGRA0_WSGRB0_WS64_WG32_8_1_WGMn48_WGMXCC1_WGMXCCGn1
    SolutionIndex: 270
    SolutionNameMin: Cijk_Alik_Bljk_BBS_BH_BiasSB_HAS_SAV_UserArgs_MT32x32x256_MI16x16x1_SN_LDSB0_AFC1_AG1_AFEM1_AFEM1_ASEM1_CLR1_CADS0_DTLA1_DTLB1_DTVA0_DTVB0_DTVMXSA0_DTVMXSB0_DTVSM0_DPLB1_EPS0_ELFLR0_EMLLn1_FDSI0_GRPM1_GRVWA8_GRVWB8_GSU0_GSUAMB_GSUC0_GSUWGMRR0_GLS0_ISA950_IU1_K1_LDSTI0_LBSPPA1024_LBSPPB1024_LBSPPM0_LPA32_LPB32_LPM0_LRVWn1_LWPMn1_MIAV1_MIWT1_1_MO40_MGRIPM1_NTn1_NTA0_NTB0_NTC0_NTD4_NTM0_NEPBS16_NLCA1_NLCB1_ONLL1_PGR3_PLR1_PKA1_SGROB1_SIA3_SS1_SU0_SUM0_SUS0_SPO1_SRVW0_SSO0_SVW1_SK3_SKFTR0_SKXCCM0_SGRO0_TDMI0_TIN1_TLDS2_TLDSMn1_ULSGRO1_USL1_UIOFGRO0_UPLRP0_USFGRO0_VSn1_VWA1_VWB1_WSGRA0_WSGRB0_WS64_WG32_8_1_WGMn32_WGMXCC1_WGMXCCGn1
    SolutionIndex: 271
    SolutionNameMin: Cijk_Alik_Bljk_BBS_BH_BiasSB_HAS_SAV_UserArgs_MT32x32x256_MI16x16x1_SN_LDSB0_AFC1_AG1_AFEM1_AFEM1_ASEM1_CLR1_CADS0_DTLA1_DTLB1_DTVA0_DTVB0_DTVMXSA0_DTVMXSB0_DTVSM0_DPLB1_EPS0_ELFLR0_EMLLn1_FDSI0_GRPM1_GRVWA8_GRVWB8_GSU0_GSUAMB_GSUC0_GSUWGMRR0_GLS0_ISA950_IU1_K1_LDSTI0_LBSPPA1024_LBSPPB1024_LBSPPM0_LPA32_LPB32_LPM0_LRVWn1_LWPMn1_MIAV1_MIWT1_1_MO40_MGRIPM1_NTn1_NTA0_NTB0_NTC0_NTD4_NTM0_NEPBS4_NLCA1_NLCB1_ONLL1_PGR3_PLR1_PKA1_SGROB0_SIA3_SS1_SU0_SUM0_SUS0_SPO1_SRVW0_SSO0_SVW1_SK3_SKFTR0_SKXCCM0_SGRO0_TDMI0_TIN1_TLDS2_TLDSMn1_ULSGRO1_USL1_UIOFGRO0_UPLRP0_USFGRO0_VSn1_VWA1_VWB1_WSGRA0_WSGRB0_WS64_WG32_8_1_WGMn48_WGMXCC1_WGMXCCGn1
    SolutionIndex: 272
    SolutionNameMin: Cijk_Alik_Bljk_BBS_BH_BiasSB_HAS_SAV_UserArgs_MT32x32x256_MI16x16x1_SN_LDSB0_AFC1_AG1_AFEM1_AFEM1_ASEM1_CLR0_CADS0_DTLA1_DTLB1_DTVA0_DTVB0_DTVMXSA0_DTVMXSB0_DTVSM0_DPLB1_EPS0_ELFLR0_EMLLn1_FDSI0_GRPM1_GRVWA8_GRVWB8_GSU0_GSUAMB_GSUC0_GSUWGMRR0_GLS0_ISA950_IU1_K1_LDSTI0_LBSPPA1024_LBSPPB1024_LBSPPM0_LPA32_LPB32_LPM0_LRVWn1_LWPMn1_MIAV0_MIWT1_1_MO40_MGRIPM1_NTn1_NTA0_NTB4_NTC4_NTD4_NTM0_NEPBS10_NLCA1_NLCB1_ONLL1_PGR3_PLR1_PKA1_SGROB1_SIA3_SS1_SU0_SUM0_SUS0_SPO0_SRVW0_SSO0_SVW1_SK3_SKFTR0_SKXCCM0_SGRO0_TDMI0_TIN1_TLDS2_TLDSMn1_ULSGRO1_USL1_UIOFGRO0_UPLRP0_USFGRO0_VSn1_VWA1_VWB1_WSGRA0_WSGRB0_WS64_WG32_8_1_WGM48_WGMXCC1_WGMXCCGn1
    SolutionIndex: 273
    SolutionNameMin: Cijk_Alik_Bljk_BBS_BH_BiasSB_HAS_SAV_UserArgs_MT32x32x256_MI16x16x1_SN_LDSB0_AFC1_AG0_AFEM1_AFEM1_ASEM1_CLR0_CADS0_DTLA1_DTLB1_DTVA0_DTVB0_DTVMXSA0_DTVMXSB0_DTVSM0_DPLB1_EPS0_ELFLR0_EMLLn1_FDSI0_GRPM1_GRVWA8_GRVWB8_GSU0_GSUAMB_GSUC0_GSUWGMRR0_GLS0_ISA950_IU1_K1_LDSTI0_LBSPPA1024_LBSPPB1024_LBSPPM0_LPA32_LPB32_LPM0_LRVWn1_LWPMn1_MIAV1_MIWT1_1_MO40_MGRIPM1_NTn1_NTA0_NTB0_NTC0_NTD0_NTM0_NEPBS10_NLCA1_NLCB1_ONLL1_PGR3_PLR1_PKA1_SGROB1_SIA3_SS0_SU0_SUM0_SUS0_SPO0_SRVW0_SSO0_SVW4_SK3_SKFTR0_SKXCCM0_SGRO0_TDMI0_TIN1_TLDS1_TLDSMn1_ULSGRO1_USL1_UIOFGRO0_UPLRP0_USFGRO0_VSn1_VWA1_VWB1_WSGRA0_WSGRB0_WS64_WG32_8_1_WGMn4_WGMXCC1_WGMXCCGn1
    SolutionIndex: 274
    SolutionNameMin: Cijk_Alik_Bljk_BBS_BH_BiasSB_HAS_SAV_UserArgs_MT32x32x256_MI16x16x1_SN_LDSB0_AFC1_AG0_AFEM1_AFEM1_ASEM1_CLR0_CADS0_DTLA1_DTLB1_DTVA0_DTVB0_DTVMXSA0_DTVMXSB0_DTVSM0_DPLB1_EPS0_ELFLR0_EMLLn1_FDSI0_GRPM1_GRVWA8_GRVWB8_GSU0_GSUAMB_GSUC0_GSUWGMRR0_GLS0_ISA950_IU1_K1_LDSTI0_LBSPPA1024_LBSPPB1024_LBSPPM0_LPA32_LPB32_LPM0_LRVWn1_LWPMn1_MIAV0_MIWT1_1_MO40_MGRIPM1_NTn1_NTA0_NTB0_NTC0_NTD0_NTM0_NEPBS14_NLCA1_NLCB1_ONLL1_PGR3_PLR1_PKA1_SGROB1_SIA3_SS0_SU0_SUM0_SUS0_SPO1_SRVW0_SSO0_SVW4_SK3_SKFTR0_SKXCCM0_SGRO0_TDMI0_TIN1_TLDS1_TLDSMn1_ULSGRO1_USL1_UIOFGRO0_UPLRP0_USFGRO0_VSn1_VWA1_VWB1_WSGRA0_WSGRB0_WS64_WG32_8_1_WGMn32_WGMXCC1_WGMXCCGn1
    SolutionIndex: 275
    SolutionNameMin: Cijk_Alik_Bljk_BBS_BH_BiasSB_HAS_SAV_UserArgs_MT32x32x256_MI16x16x1_SN_LDSB0_AFC1_AG1_AFEM1_AFEM1_ASEM1_CLR1_CADS0_DTLA1_DTLB1_DTVA0_DTVB0_DTVMXSA0_DTVMXSB0_DTVSM0_DPLB1_EPS0_ELFLR0_EMLLn1_FDSI0_GRPM1_GRVWA8_GRVWB8_GSU0_GSUAMB_GSUC0_GSUWGMRR0_GLS0_ISA950_IU1_K1_LDSTI0_LBSPPA1024_LBSPPB1024_LBSPPM0_LPA32_LPB32_LPM0_LRVWn1_LWPMn1_MIAV1_MIWT1_1_MO40_MGRIPM1_NTn1_NTA0_NTB4_NTC4_NTD4_NTM0_NEPBS14_NLCA1_NLCB1_ONLL1_PGR3_PLR1_PKA1_SGROB0_SIA3_SS1_SU0_SUM0_SUS0_SPO0_SRVW0_SSO0_SVW1_SK3_SKFTR0_SKXCCM0_SGRO0_TDMI0_TIN1_TLDS2_TLDSMn1_ULSGRO1_USL1_UIOFGRO0_UPLRP0_USFGRO0_VSn1_VWA1_VWB1_WSGRA0_WSGRB0_WS64_WG32_8_1_WGM48_WGMXCC1_WGMXCCGn1
    SolutionIndex: 276
    SolutionNameMin: Cijk_Alik_Bljk_BBS_BH_BiasSB_HAS_SAV_UserArgs_MT32x32x256_MI16x16x1_SN_LDSB0_AFC1_AG1_AFEM1_AFEM1_ASEM1_CLR1_CADS0_DTLA1_DTLB1_DTVA0_DTVB0_DTVMXSA0_DTVMXSB0_DTVSM0_DPLB1_EPS0_ELFLR0_EMLLn1_FDSI0_GRPM1_GRVWA8_GRVWB8_GSU0_GSUAMB_GSUC0_GSUWGMRR0_GLS0_ISA950_IU1_K1_LDSTI0_LBSPPA1024_LBSPPB1024_LBSPPM0_LPA32_LPB32_LPM0_LRVWn1_LWPMn1_MIAV1_MIWT1_1_MO40_MGRIPM1_NTn1_NTA0_NTB0_NTC0_NTD0_NTM0_NEPBS16_NLCA1_NLCB1_ONLL1_PGR3_PLR1_PKA1_SGROB1_SIA3_SS0_SU0_SUM0_SUS0_SPO0_SRVW0_SSO0_SVW4_SK3_SKFTR0_SKXCCM0_SGRO0_TDMI0_TIN1_TLDS1_TLDSMn1_ULSGRO1_USL1_UIOFGRO0_UPLRP0_USFGRO0_VSn1_VWA1_VWB1_WSGRA0_WSGRB0_WS64_WG32_8_1_WGM24_WGMXCC1_WGMXCCGn1
    SolutionIndex: 277
    SolutionNameMin: Cijk_Alik_Bljk_BBS_BH_BiasSB_HAS_SAV_UserArgs_MT192x128x64_MI16x16x1_CMS_SN_LDSB0_AFC1_AG1_AFEM1_AFEM1_ASEM1_CLR1_CADS0_DTLA1_DTLB1_DTVA0_DTVB0_DTVMXSA0_DTVMXSB0_DTVSM0_DPLB0_EPS0_ELFLR0_EMLL0_FDSI0_GRPM1_GRVWA8_GRVWB8_GSU0_GSUAMB_GSUC0_GSUWGMRR0_GLS0_ISA950_IU1_K1_LDSTI0_LBSPPA1024_LBSPPB1024_LBSPPM0_LPA32_LPB32_LPM0_LRVW8_LWPMn1_MIAV0_MIWT6_4_MO40_MGRIPM1_NTn1_NTA4_NTB4_NTC4_NTD0_NTM0_NEPBS4_NLCA1_NLCB1_ONLL1_PGR2_PLR1_PKA1_SGROB1_SIA3_SS1_SU8_SUM0_SUS128_SPO0_SRVW0_SSO0_SVW2_SK3_SKFTR0_SKXCCM0_SGRO0_TDMI0_TIN0_TLDS1_TLDSMn1_ULSGRO0_USL1_UIOFGRO0_UPLRP0_USFGRO0_VSn1_VWA2_VWB4_WSGRA0_WSGRB0_WS64_WG32_8_1_WGM8_WGMXCC1_WGMXCCGn1
    SolutionIndex: 278
    SolutionNameMin: Cijk_Alik_Bljk_BBS_BH_BiasSB_HAS_SAV_UserArgs_MT32x32x128_MI16x16x1_SN_LDSB0_AFC1_AG1_AFEM1_AFEM1_ASEM1_CLR1_CADS0_DTLA1_DTLB1_DTVA0_DTVB0_DTVMXSA0_DTVMXSB0_DTVSM0_DPLB1_EPS0_ELFLR0_EMLLn1_FDSI0_GRPM1_GRVWA2_GRVWB8_GSU0_GSUAMB_GSUC0_GSUWGMRR0_GLS0_ISA950_IU1_K1_LDSTI0_LBSPPA256_LBSPPB1024_LBSPPM0_LPA16_LPB32_LPM0_LRVWn1_LWPMn1_MIAV1_MIWT1_1_MO40_MGRIPM1_NTn1_NTA0_NTB0_NTC0_NTD0_NTM0_NEPBS16_NLCA1_NLCB1_ONLL1_PGR4_PLR1_PKA1_SGROB0_SIA3_SS0_SU0_SUM0_SUS0_SPO0_SRVW0_SSO0_SVW4_SK3_SKFTR0_SKXCCM0_SGRO0_TDMI0_TIN1_TLDS2_TLDSMn1_ULSGRO0_USL1_UIOFGRO0_UPLRP0_USFGRO0_VSn1_VWA1_VWB1_WSGRA0_WSGRB0_WS64_WG32_8_1_WGMn32_WGMXCC1_WGMXCCGn1
    SolutionIndex: 279
    SolutionNameMin: Cijk_Alik_Bljk_BBS_BH_BiasSB_HAS_SAV_UserArgs_MT32x32x256_MI16x16x1_SN_LDSB0_AFC1_AG0_AFEM1_AFEM1_ASEM1_CLR0_CADS0_DTLA1_DTLB1_DTVA0_DTVB0_DTVMXSA0_DTVMXSB0_DTVSM0_DPLB1_EPS0_ELFLR0_EMLLn1_FDSI0_GRPM1_GRVWA8_GRVWB8_GSU0_GSUAMB_GSUC0_GSUWGMRR0_GLS0_ISA950_IU1_K1_LDSTI0_LBSPPA1024_LBSPPB1024_LBSPPM0_LPA32_LPB32_LPM0_LRVWn1_LWPMn1_MIAV0_MIWT1_1_MO40_MGRIPM1_NTn1_NTA0_NTB4_NTC0_NTD0_NTM0_NEPBS16_NLCA1_NLCB1_ONLL1_PGR3_PLR1_PKA1_SGROB1_SIA3_SS1_SU0_SUM0_SUS0_SPO0_SRVW0_SSO0_SVW1_SK3_SKFTR0_SKXCCM0_SGRO0_TDMI0_TIN1_TLDS2_TLDSMn1_ULSGRO1_USL1_UIOFGRO0_UPLRP0_USFGRO0_VSn1_VWA1_VWB1_WSGRA0_WSGRB0_WS64_WG32_8_1_WGMn6_WGMXCC1_WGMXCCGn1
    SolutionIndex: 280
    SolutionNameMin: Cijk_Alik_Bljk_BBS_BH_BiasSB_HAS_SAV_UserArgs_MT32x32x256_MI16x16x1_SN_LDSB0_AFC1_AG0_AFEM1_AFEM1_ASEM1_CLR1_CADS0_DTLA1_DTLB1_DTVA0_DTVB0_DTVMXSA0_DTVMXSB0_DTVSM0_DPLB1_EPS0_ELFLR0_EMLLn1_FDSI0_GRPM1_GRVWA8_GRVWB8_GSU0_GSUAMB_GSUC0_GSUWGMRR0_GLS0_ISA950_IU1_K1_LDSTI0_LBSPPA1024_LBSPPB1024_LBSPPM0_LPA32_LPB32_LPM0_LRVWn1_LWPMn1_MIAV1_MIWT1_1_MO40_MGRIPM1_NTn1_NTA0_NTB0_NTC0_NTD0_NTM0_NEPBS10_NLCA1_NLCB1_ONLL1_PGR3_PLR1_PKA1_SGROB1_SIA3_SS0_SU0_SUM0_SUS0_SPO1_SRVW0_SSO0_SVW4_SK3_SKFTR0_SKXCCM0_SGRO0_TDMI0_TIN1_TLDS2_TLDSMn1_ULSGRO1_USL1_UIOFGRO0_UPLRP0_USFGRO0_VSn1_VWA1_VWB1_WSGRA0_WSGRB0_WS64_WG32_8_1_WGMn8_WGMXCC1_WGMXCCGn1
    SolutionIndex: 281
    SolutionNameMin: Cijk_Alik_Bljk_BBS_BH_BiasSB_HAS_SAV_UserArgs_MT32x32x256_MI16x16x1_SN_LDSB0_AFC1_AG0_AFEM1_AFEM1_ASEM1_CLR1_CADS0_DTLA1_DTLB1_DTVA0_DTVB0_DTVMXSA0_DTVMXSB0_DTVSM0_DPLB1_EPS0_ELFLR0_EMLLn1_FDSI0_GRPM1_GRVWA8_GRVWB8_GSU0_GSUAMB_GSUC0_GSUWGMRR0_GLS0_ISA950_IU1_K1_LDSTI0_LBSPPA1024_LBSPPB1024_LBSPPM0_LPA32_LPB32_LPM0_LRVWn1_LWPMn1_MIAV1_MIWT1_1_MO40_MGRIPM1_NTn1_NTA0_NTB0_NTC0_NTD0_NTM0_NEPBS12_NLCA1_NLCB1_ONLL1_PGR3_PLR1_PKA1_SGROB1_SIA3_SS0_SU0_SUM0_SUS0_SPO0_SRVW0_SSO0_SVW4_SK3_SKFTR0_SKXCCM0_SGRO0_TDMI0_TIN1_TLDS2_TLDSMn1_ULSGRO1_USL1_UIOFGRO0_UPLRP0_USFGRO0_VSn1_VWA1_VWB1_WSGRA0_WSGRB0_WS64_WG32_8_1_WGMn6_WGMXCC1_WGMXCCGn1
    SolutionIndex: 282
    SolutionNameMin: Cijk_Alik_Bljk_BBS_BH_BiasSB_HAS_SAV_UserArgs_MT32x32x256_MI16x16x1_SN_LDSB0_AFC1_AG1_AFEM1_AFEM1_ASEM1_CLR0_CADS0_DTLA1_DTLB1_DTVA0_DTVB0_DTVMXSA0_DTVMXSB0_DTVSM0_DPLB1_EPS0_ELFLR0_EMLLn1_FDSI0_GRPM1_GRVWA8_GRVWB8_GSU0_GSUAMB_GSUC0_GSUWGMRR0_GLS0_ISA950_IU1_K1_LDSTI0_LBSPPA1024_LBSPPB1024_LBSPPM0_LPA32_LPB32_LPM0_LRVWn1_LWPMn1_MIAV0_MIWT1_1_MO40_MGRIPM1_NTn1_NTA0_NTB0_NTC0_NTD4_NTM0_NEPBS8_NLCA1_NLCB1_ONLL1_PGR3_PLR1_PKA1_SGROB0_SIA3_SS1_SU0_SUM0_SUS0_SPO1_SRVW0_SSO0_SVW1_SK3_SKFTR0_SKXCCM4_SGRO0_TDMI0_TIN1_TLDS1_TLDSMn1_ULSGRO1_USL1_UIOFGRO0_UPLRP0_USFGRO0_VSn1_VWA1_VWB1_WSGRA0_WSGRB0_WS64_WG32_8_1_WGM32_WGMXCC8_WGMXCCGn1
    SolutionIndex: 283
    SolutionNameMin: Cijk_Alik_Bljk_BBS_BH_BiasSB_HAS_SAV_UserArgs_MT32x32x128_MI16x16x1_SN_LDSB0_AFC1_AG0_AFEM1_AFEM1_ASEM1_CLR1_CADS0_DTLA1_DTLB1_DTVA0_DTVB0_DTVMXSA0_DTVMXSB0_DTVSM0_DPLB1_EPS0_ELFLR0_EMLLn1_FDSI0_GRPM1_GRVWA2_GRVWB8_GSU0_GSUAMB_GSUC0_GSUWGMRR0_GLS0_ISA950_IU1_K1_LDSTI0_LBSPPA256_LBSPPB1024_LBSPPM0_LPA16_LPB32_LPM0_LRVWn1_LWPMn1_MIAV0_MIWT1_1_MO40_MGRIPM1_NTn1_NTA0_NTB0_NTC0_NTD0_NTM0_NEPBS8_NLCA1_NLCB1_ONLL1_PGR4_PLR1_PKA1_SGROB0_SIA3_SS0_SU0_SUM0_SUS0_SPO1_SRVW0_SSO0_SVW4_SK3_SKFTR0_SKXCCM0_SGRO0_TDMI0_TIN1_TLDS2_TLDSMn1_ULSGRO0_USL1_UIOFGRO0_UPLRP0_USFGRO0_VSn1_VWA1_VWB1_WSGRA0_WSGRB0_WS64_WG32_8_1_WGMn32_WGMXCC1_WGMXCCGn1
    SolutionIndex: 284
    SolutionNameMin: Cijk_Alik_Bljk_BBS_BH_BiasSB_HAS_SAV_UserArgs_MT32x32x256_MI16x16x1_SN_LDSB0_AFC1_AG1_AFEM1_AFEM1_ASEM1_CLR1_CADS0_DTLA1_DTLB1_DTVA0_DTVB0_DTVMXSA0_DTVMXSB0_DTVSM0_DPLB1_EPS0_ELFLR0_EMLLn1_FDSI0_GRPM1_GRVWA8_GRVWB8_GSU0_GSUAMB_GSUC0_GSUWGMRR0_GLS0_ISA950_IU1_K1_LDSTI0_LBSPPA1024_LBSPPB1024_LBSPPM0_LPA32_LPB32_LPM0_LRVWn1_LWPMn1_MIAV0_MIWT1_1_MO40_MGRIPM1_NTn1_NTA0_NTB0_NTC0_NTD0_NTM0_NEPBS0_NLCA1_NLCB1_ONLL1_PGR3_PLR1_PKA1_SGROB1_SIA3_SS0_SU0_SUM0_SUS0_SPO1_SRVW0_SSO0_SVW4_SK3_SKFTR0_SKXCCM0_SGRO0_TDMI0_TIN1_TLDS2_TLDSMn1_ULSGRO1_USL1_UIOFGRO0_UPLRP0_USFGRO0_VSn1_VWA1_VWB1_WSGRA0_WSGRB0_WS64_WG32_8_1_WGMn6_WGMXCC1_WGMXCCGn1
    SolutionIndex: 285
    SolutionNameMin: Cijk_Alik_Bljk_BBS_BH_BiasSB_HAS_SAV_UserArgs_MT32x32x256_MI16x16x1_SN_LDSB0_AFC1_AG1_AFEM1_AFEM1_ASEM1_CLR1_CADS0_DTLA1_DTLB1_DTVA0_DTVB0_DTVMXSA0_DTVMXSB0_DTVSM0_DPLB1_EPS0_ELFLR0_EMLLn1_FDSI0_GRPM1_GRVWA8_GRVWB8_GSU0_GSUAMB_GSUC0_GSUWGMRR0_GLS0_ISA950_IU1_K1_LDSTI0_LBSPPA1024_LBSPPB1024_LBSPPM0_LPA32_LPB32_LPM0_LRVWn1_LWPMn1_MIAV0_MIWT1_1_MO40_MGRIPM1_NTn1_NTA0_NTB4_NTC4_NTD4_NTM0_NEPBS0_NLCA1_NLCB1_ONLL1_PGR3_PLR1_PKA1_SGROB1_SIA3_SS1_SU0_SUM0_SUS0_SPO0_SRVW0_SSO0_SVW1_SK3_SKFTR0_SKXCCM0_SGRO0_TDMI0_TIN1_TLDS1_TLDSMn1_ULSGRO1_USL1_UIOFGRO0_UPLRP0_USFGRO0_VSn1_VWA1_VWB1_WSGRA0_WSGRB0_WS64_WG32_8_1_WGMn32_WGMXCC1_WGMXCCGn1
    SolutionIndex: 286
    SolutionNameMin: Cijk_Alik_Bljk_BBS_BH_BiasSB_HAS_SAV_UserArgs_MT32x32x256_MI16x16x1_SN_LDSB0_AFC1_AG0_AFEM1_AFEM1_ASEM1_CLR1_CADS0_DTLA1_DTLB1_DTVA0_DTVB0_DTVMXSA0_DTVMXSB0_DTVSM0_DPLB1_EPS0_ELFLR0_EMLLn1_FDSI0_GRPM1_GRVWA8_GRVWB8_GSU0_GSUAMB_GSUC0_GSUWGMRR0_GLS0_ISA950_IU1_K1_LDSTI0_LBSPPA1024_LBSPPB1024_LBSPPM0_LPA32_LPB32_LPM0_LRVWn1_LWPMn1_MIAV1_MIWT1_1_MO40_MGRIPM1_NTn1_NTA0_NTB0_NTC0_NTD0_NTM0_NEPBS12_NLCA1_NLCB1_ONLL1_PGR3_PLR1_PKA1_SGROB0_SIA3_SS0_SU0_SUM0_SUS0_SPO0_SRVW0_SSO0_SVW4_SK3_SKFTR0_SKXCCM8_SGRO0_TDMI0_TIN1_TLDS1_TLDSMn1_ULSGRO1_USL1_UIOFGRO0_UPLRP0_USFGRO0_VSn1_VWA1_VWB1_WSGRA0_WSGRB0_WS64_WG32_8_1_WGMn1_WGMXCC1_WGMXCCGn1
    SolutionIndex: 287
    SolutionNameMin: Cijk_Alik_Bljk_BBS_BH_BiasSB_HAS_SAV_UserArgs_MT32x32x256_MI16x16x1_SN_LDSB0_AFC1_AG1_AFEM1_AFEM1_ASEM1_CLR0_CADS0_DTLA1_DTLB1_DTVA0_DTVB0_DTVMXSA0_DTVMXSB0_DTVSM0_DPLB1_EPS0_ELFLR0_EMLLn1_FDSI0_GRPM1_GRVWA8_GRVWB8_GSU0_GSUAMB_GSUC0_GSUWGMRR0_GLS0_ISA950_IU1_K1_LDSTI0_LBSPPA1024_LBSPPB1024_LBSPPM0_LPA32_LPB32_LPM0_LRVWn1_LWPMn1_MIAV1_MIWT1_1_MO40_MGRIPM1_NTn1_NTA0_NTB4_NTC0_NTD4_NTM0_NEPBS10_NLCA1_NLCB1_ONLL1_PGR3_PLR1_PKA1_SGROB0_SIA3_SS1_SU0_SUM0_SUS0_SPO1_SRVW0_SSO0_SVW1_SK3_SKFTR0_SKXCCM0_SGRO0_TDMI0_TIN1_TLDS1_TLDSMn1_ULSGRO1_USL1_UIOFGRO0_UPLRP0_USFGRO0_VSn1_VWA1_VWB1_WSGRA0_WSGRB0_WS64_WG32_8_1_WGMn8_WGMXCC1_WGMXCCGn1
    SolutionIndex: 288
    SolutionNameMin: Cijk_Alik_Bljk_BBS_BH_BiasSB_HAS_SAV_UserArgs_MT96x64x128_MI16x16x1_SN_LDSB0_AFC1_AG0_AFEM1_AFEM1_ASEM1_CLR1_CADS0_DTLA1_DTLB1_DTVA0_DTVB0_DTVMXSA0_DTVMXSB0_DTVSM0_DPLB1_EPS0_ELFLR0_EMLLn1_FDSI0_GRPM1_GRVWA8_GRVWB8_GSU0_GSUAMB_GSUC0_GSUWGMRR0_GLS0_ISA950_IU1_K1_LDSTI0_LBSPPA1024_LBSPPB1024_LBSPPM0_LPA32_LPB32_LPM0_LRVWn1_LWPMn1_MIAV0_MIWT6_1_MO40_MGRIPM1_NTn1_NTA0_NTB0_NTC0_NTD4_NTM0_NEPBS14_NLCA1_NLCB1_ONLL1_PGR2_PLR1_PKA1_SGROB0_SIA3_SS0_SU0_SUM0_SUS0_SPO1_SRVW0_SSO0_SVW8_SK3_SKFTR0_SKXCCM4_SGRO0_TDMI0_TIN1_TLDS1_TLDSMn1_ULSGRO1_USL1_UIOFGRO0_UPLRP0_USFGRO0_VSn1_VWA2_VWB1_WSGRA0_WSGRB0_WS64_WG16_16_1_WGM48_WGMXCC1_WGMXCCGn1
    SolutionIndex: 289
    SolutionNameMin: Cijk_Alik_Bljk_BBS_BH_BiasSB_HAS_SAV_UserArgs_MT32x32x256_MI16x16x1_SN_LDSB0_AFC1_AG1_AFEM1_AFEM1_ASEM1_CLR1_CADS0_DTLA1_DTLB1_DTVA0_DTVB0_DTVMXSA0_DTVMXSB0_DTVSM0_DPLB1_EPS0_ELFLR0_EMLLn1_FDSI0_GRPM1_GRVWA8_GRVWB8_GSU0_GSUAMB_GSUC0_GSUWGMRR0_GLS0_ISA950_IU1_K1_LDSTI0_LBSPPA1024_LBSPPB1024_LBSPPM0_LPA32_LPB32_LPM0_LRVWn1_LWPMn1_MIAV0_MIWT1_1_MO40_MGRIPM1_NTn1_NTA0_NTB0_NTC0_NTD0_NTM0_NEPBS16_NLCA1_NLCB1_ONLL1_PGR3_PLR1_PKA1_SGROB0_SIA3_SS0_SU0_SUM0_SUS0_SPO1_SRVW0_SSO0_SVW4_SK3_SKFTR0_SKXCCM0_SGRO0_TDMI0_TIN1_TLDS2_TLDSMn1_ULSGRO1_USL1_UIOFGRO0_UPLRP0_USFGRO0_VSn1_VWA1_VWB1_WSGRA0_WSGRB0_WS64_WG32_8_1_WGMn8_WGMXCC1_WGMXCCGn1
    SolutionIndex: 290
    SolutionNameMin: Cijk_Alik_Bljk_BBS_BH_BiasSB_HAS_SAV_UserArgs_MT32x32x256_MI16x16x1_SN_LDSB0_AFC1_AG1_AFEM1_AFEM1_ASEM1_CLR0_CADS0_DTLA1_DTLB1_DTVA0_DTVB0_DTVMXSA0_DTVMXSB0_DTVSM0_DPLB1_EPS0_ELFLR0_EMLLn1_FDSI0_GRPM1_GRVWA8_GRVWB8_GSU0_GSUAMB_GSUC0_GSUWGMRR0_GLS0_ISA950_IU1_K1_LDSTI0_LBSPPA1024_LBSPPB1024_LBSPPM0_LPA32_LPB32_LPM0_LRVWn1_LWPMn1_MIAV1_MIWT1_1_MO40_MGRIPM1_NTn1_NTA0_NTB4_NTC0_NTD4_NTM0_NEPBS10_NLCA1_NLCB1_ONLL1_PGR3_PLR1_PKA1_SGROB0_SIA3_SS1_SU0_SUM0_SUS0_SPO0_SRVW0_SSO0_SVW1_SK3_SKFTR0_SKXCCM0_SGRO0_TDMI0_TIN1_TLDS2_TLDSMn1_ULSGRO1_USL1_UIOFGRO0_UPLRP0_USFGRO0_VSn1_VWA1_VWB1_WSGRA0_WSGRB0_WS64_WG32_8_1_WGMn4_WGMXCC1_WGMXCCGn1
    SolutionIndex: 291
    SolutionNameMin: Cijk_Alik_Bljk_BBS_BH_BiasSB_HAS_SAV_UserArgs_MT32x32x256_MI16x16x1_SN_LDSB0_AFC1_AG1_AFEM1_AFEM1_ASEM1_CLR1_CADS0_DTLA1_DTLB1_DTVA0_DTVB0_DTVMXSA0_DTVMXSB0_DTVSM0_DPLB1_EPS0_ELFLR0_EMLLn1_FDSI0_GRPM1_GRVWA8_GRVWB8_GSU0_GSUAMB_GSUC0_GSUWGMRR0_GLS0_ISA950_IU1_K1_LDSTI0_LBSPPA1024_LBSPPB1024_LBSPPM0_LPA32_LPB32_LPM0_LRVWn1_LWPMn1_MIAV0_MIWT1_1_MO40_MGRIPM1_NTn1_NTA0_NTB0_NTC0_NTD0_NTM0_NEPBS4_NLCA1_NLCB1_ONLL1_PGR3_PLR1_PKA1_SGROB1_SIA3_SS0_SU0_SUM0_SUS0_SPO1_SRVW0_SSO0_SVW4_SK3_SKFTR0_SKXCCM0_SGRO0_TDMI0_TIN1_TLDS2_TLDSMn1_ULSGRO1_USL1_UIOFGRO0_UPLRP0_USFGRO0_VSn1_VWA1_VWB1_WSGRA0_WSGRB0_WS64_WG32_8_1_WGMn4_WGMXCC1_WGMXCCGn1
    SolutionIndex: 292
    SolutionNameMin: Cijk_Alik_Bljk_BBS_BH_BiasSB_HAS_SAV_UserArgs_MT32x32x256_MI16x16x1_SN_LDSB0_AFC1_AG0_AFEM1_AFEM1_ASEM1_CLR0_CADS0_DTLA1_DTLB1_DTVA0_DTVB0_DTVMXSA0_DTVMXSB0_DTVSM0_DPLB1_EPS0_ELFLR0_EMLLn1_FDSI0_GRPM1_GRVWA8_GRVWB8_GSU0_GSUAMB_GSUC0_GSUWGMRR0_GLS0_ISA950_IU1_K1_LDSTI0_LBSPPA1024_LBSPPB1024_LBSPPM0_LPA32_LPB32_LPM0_LRVWn1_LWPMn1_MIAV0_MIWT1_1_MO40_MGRIPM1_NTn1_NTA0_NTB0_NTC0_NTD0_NTM0_NEPBS16_NLCA1_NLCB1_ONLL1_PGR3_PLR1_PKA1_SGROB1_SIA3_SS0_SU0_SUM0_SUS0_SPO0_SRVW0_SSO0_SVW4_SK3_SKFTR0_SKXCCM0_SGRO0_TDMI0_TIN1_TLDS1_TLDSMn1_ULSGRO1_USL1_UIOFGRO0_UPLRP0_USFGRO0_VSn1_VWA1_VWB1_WSGRA0_WSGRB0_WS64_WG32_8_1_WGMn32_WGMXCC1_WGMXCCGn1
    SolutionIndex: 293
    SolutionNameMin: Cijk_Alik_Bljk_BBS_BH_BiasSB_HAS_SAV_UserArgs_MT128x128x64_MI16x16x1_SN_LDSB0_AFC1_AG1_AFEM1_AFEM1_ASEM1_CLR1_CADS0_DTLA1_DTLB1_DTVA0_DTVB0_DTVMXSA0_DTVMXSB0_DTVSM0_DPLB1_EPS0_ELFLR0_EMLLn1_FDSI0_GRPM1_GRVWA8_GRVWB8_GSU0_GSUAMB_GSUC0_GSUWGMRR0_GLS0_ISA950_IU1_K1_LDSTI0_LBSPPA1024_LBSPPB1024_LBSPPM0_LPA32_LPB32_LPM0_LRVWn1_LWPMn1_MIAV1_MIWT4_4_MO40_MGRIPM1_NTn1_NTA4_NTB0_NTC4_NTD4_NTM0_NEPBS12_NLCA1_NLCB1_ONLL1_PGR3_PLR1_PKA1_SGROB0_SIA3_SS1_SU0_SUM0_SUS0_SPO0_SRVW0_SSO0_SVW4_SK3_SKFTR0_SKXCCM8_SGRO0_TDMI0_TIN1_TLDS2_TLDSMn1_ULSGRO1_USL1_UIOFGRO0_UPLRP0_USFGRO0_VSn1_VWA4_VWB4_WSGRA0_WSGRB0_WS64_WG32_8_1_WGM24_WGMXCC1_WGMXCCGn1
    SolutionIndex: 294
    SolutionNameMin: Cijk_Alik_Bljk_BBS_BH_BiasSB_HAS_SAV_UserArgs_MT96x128x128_MI16x16x1_SN_LDSB0_AFC1_AG1_AFEM1_AFEM1_ASEM1_CLR1_CADS0_DTLA0_DTLB0_DTVA0_DTVB0_DTVMXSA0_DTVMXSB0_DTVSM0_DPLB0_EPS0_ELFLR0_EMLLn1_FDSI0_GRPM1_GRVWA8_GRVWB8_GSU0_GSUAMB_GSUC0_GSUWGMRR0_GLS0_ISA950_IU1_K1_LDSTI0_LBSPPA512_LBSPPB512_LBSPPM0_LPA16_LPB16_LPM0_LRVWn1_LWPMn1_MIAV0_MIWT6_2_MO40_MGRIPM1_NTn1_NTA4_NTB0_NTC4_NTD0_NTM0_NEPBS0_NLCA1_NLCB1_ONLL1_PGR2_PLR1_PKA1_SGROB0_SIA3_SS1_SU0_SUM0_SUS0_SPO0_SRVW0_SSO0_SVW2_SK3_SKFTR0_SKXCCM8_SGRO0_TDMI0_TIN1_TLDS1_TLDSMn1_ULSGRO1_USL1_UIOFGRO0_UPLRP0_USFGRO0_VSn1_VWA2_VWB2_WSGRA0_WSGRB2_WS64_WG16_16_1_WGM24_WGMXCC1_WGMXCCGn1
    SolutionIndex: 295
    SolutionNameMin: Cijk_Alik_Bljk_BBS_BH_BiasSB_HAS_SAV_UserArgs_MT96x128x128_MI16x16x1_SN_LDSB0_AFC1_AG1_AFEM1_AFEM1_ASEM1_CLR1_CADS0_DTLA0_DTLB0_DTVA0_DTVB0_DTVMXSA0_DTVMXSB0_DTVSM0_DPLB0_EPS0_ELFLR0_EMLLn1_FDSI0_GRPM1_GRVWA8_GRVWB8_GSU0_GSUAMB_GSUC0_GSUWGMRR0_GLS0_ISA950_IU1_K1_LDSTI0_LBSPPA256_LBSPPB1024_LBSPPM0_LPA16_LPB16_LPM0_LRVWn1_LWPMn1_MIAV1_MIWT3_4_MO40_MGRIPM1_NTn1_NTA4_NTB0_NTC4_NTD0_NTM0_NEPBS14_NLCA1_NLCB1_ONLL1_PGR2_PLR1_PKA1_SGROB0_SIA3_SS0_SU0_SUM0_SUS0_SPO1_SRVW0_SSO1_SVW4_SK3_SKFTR0_SKXCCM0_SGRO0_TDMI0_TIN1_TLDS1_TLDSMn1_ULSGRO1_USL1_UIOFGRO0_UPLRP0_USFGRO0_VSn1_VWA1_VWB4_WSGRA0_WSGRB0_WS64_WG32_8_1_WGMn24_WGMXCC1_WGMXCCGn1
    SolutionIndex: 296
    SolutionNameMin: Cijk_Alik_Bljk_BBS_BH_BiasSB_HAS_SAV_UserArgs_MT96x64x128_MI16x16x1_SN_LDSB0_AFC1_AG0_AFEM1_AFEM1_ASEM1_CLR1_CADS0_DTLA1_DTLB1_DTVA0_DTVB0_DTVMXSA0_DTVMXSB0_DTVSM0_DPLB1_EPS0_ELFLR0_EMLLn1_FDSI0_GRPM1_GRVWA8_GRVWB8_GSU0_GSUAMB_GSUC0_GSUWGMRR0_GLS0_ISA950_IU1_K1_LDSTI0_LBSPPA1024_LBSPPB1024_LBSPPM0_LPA32_LPB32_LPM0_LRVWn1_LWPMn1_MIAV0_MIWT3_2_MO40_MGRIPM1_NTn1_NTA0_NTB0_NTC0_NTD0_NTM0_NEPBS14_NLCA1_NLCB1_ONLL1_PGR2_PLR1_PKA1_SGROB0_SIA3_SS0_SU0_SUM0_SUS0_SPO0_SRVW0_SSO1_SVW4_SK3_SKFTR0_SKXCCM4_SGRO0_TDMI0_TIN1_TLDS1_TLDSMn1_ULSGRO1_USL1_UIOFGRO0_UPLRP0_USFGRO0_VSn1_VWA1_VWB2_WSGRA0_WSGRB0_WS64_WG32_8_1_WGM32_WGMXCC1_WGMXCCGn1
    SolutionIndex: 297
    SolutionNameMin: Cijk_Alik_Bljk_BBS_BH_BiasSB_HAS_SAV_UserArgs_MT96x128x128_MI16x16x1_SN_LDSB0_AFC1_AG1_AFEM1_AFEM1_ASEM1_CLR1_CADS0_DTLA0_DTLB0_DTVA0_DTVB0_DTVMXSA0_DTVMXSB0_DTVSM0_DPLB0_EPS0_ELFLR0_EMLLn1_FDSI0_GRPM1_GRVWA8_GRVWB8_GSU0_GSUAMB_GSUC0_GSUWGMRR0_GLS0_ISA950_IU1_K1_LDSTI0_LBSPPA512_LBSPPB512_LBSPPM0_LPA16_LPB16_LPM0_LRVWn1_LWPMn1_MIAV0_MIWT6_2_MO40_MGRIPM1_NTn1_NTA0_NTB0_NTC0_NTD0_NTM0_NEPBS16_NLCA1_NLCB1_ONLL1_PGR2_PLR1_PKA1_SGROB0_SIA3_SS0_SU0_SUM0_SUS0_SPO0_SRVW0_SSO0_SVW8_SK3_SKFTR0_SKXCCM4_SGRO0_TDMI0_TIN1_TLDS1_TLDSMn1_ULSGRO1_USL1_UIOFGRO0_UPLRP0_USFGRO0_VSn1_VWA2_VWB2_WSGRA0_WSGRB0_WS64_WG16_16_1_WGM48_WGMXCC1_WGMXCCGn1
    SolutionIndex: 298
    SolutionNameMin: Cijk_Alik_Bljk_BBS_BH_BiasSB_HAS_SAV_UserArgs_MT64x32x256_MI16x16x1_SN_LDSB0_AFC1_AG1_AFEM1_AFEM1_ASEM1_CLR0_CADS0_DTLA1_DTLB1_DTVA0_DTVB0_DTVMXSA0_DTVMXSB0_DTVSM0_DPLB1_EPS0_ELFLR0_EMLLn1_FDSI0_GRPM1_GRVWA8_GRVWB8_GSU0_GSUAMB_GSUC0_GSUWGMRR0_GLS0_ISA950_IU1_K1_LDSTI0_LBSPPA1024_LBSPPB1024_LBSPPM0_LPA16_LPB32_LPM0_LRVWn1_LWPMn1_MIAV0_MIWT2_1_MO40_MGRIPM1_NTn1_NTA0_NTB4_NTC0_NTD4_NTM0_NEPBS16_NLCA1_NLCB1_ONLL1_PGR2_PLR1_PKA1_SGROB1_SIA3_SS1_SU0_SUM0_SUS0_SPO1_SRVW0_SSO0_SVW2_SK3_SKFTR0_SKXCCM0_SGRO0_TDMI0_TIN1_TLDS2_TLDSMn1_ULSGRO1_USL1_UIOFGRO0_UPLRP0_USFGRO0_VSn1_VWA2_VWB1_WSGRA0_WSGRB0_WS64_WG32_8_1_WGM0_WGMXCC1_WGMXCCGn1
    SolutionIndex: 299
    SolutionNameMin: Cijk_Alik_Bljk_BBS_BH_BiasSB_HAS_SAV_UserArgs_MT128x128x64_MI16x16x1_SN_LDSB0_AFC1_AG0_AFEM1_AFEM1_ASEM1_CLR0_CADS0_DTLA1_DTLB1_DTVA0_DTVB0_DTVMXSA0_DTVMXSB0_DTVSM0_DPLB1_EPS0_ELFLR0_EMLL0_FDSI0_GRPM1_GRVWA8_GRVWB8_GSU0_GSUAMB_GSUC0_GSUWGMRR0_GLS0_ISA950_IU1_K1_LDSTI0_LBSPPA1024_LBSPPB1024_LBSPPM0_LPA32_LPB32_LPM0_LRVWn1_LWPMn1_MIAV0_MIWT4_4_MO40_MGRIPM1_NTn1_NTA4_NTB0_NTC4_NTD4_NTM0_NEPBS10_NLCA1_NLCB1_ONLL1_PGR3_PLR1_PKA1_SGROB1_SIA3_SS1_SU0_SUM0_SUS0_SPO1_SRVW0_SSO0_SVW4_SK3_SKFTR0_SKXCCM4_SGRO0_TDMI0_TIN1_TLDS1_TLDSMn1_ULSGRO1_USL1_UIOFGRO0_UPLRP0_USFGRO0_VSn1_VWA4_VWB4_WSGRA0_WSGRB0_WS64_WG32_8_1_WGM0_WGMXCC1_WGMXCCGn1
    SolutionIndex: 300
    SolutionNameMin: Cijk_Alik_Bljk_BBS_BH_BiasSB_HAS_SAV_UserArgs_MT80x128x128_MI16x16x1_SN_LDSB0_AFC1_AG1_AFEM1_AFEM1_ASEM1_CLR0_CADS0_DTLA0_DTLB0_DTVA0_DTVB0_DTVMXSA0_DTVMXSB0_DTVSM0_DPLB0_EPS0_ELFLR0_EMLLn1_FDSI0_GRPM1_GRVWA8_GRVWB8_GSU0_GSUAMB_GSUC0_GSUWGMRR0_GLS0_ISA950_IU1_K1_LDSTI0_LBSPPA256_LBSPPB512_LBSPPM0_LPA16_LPB16_LPM0_LRVWn1_LWPMn1_MIAV0_MIWT5_2_MO40_MGRIPM1_NTn1_NTA4_NTB0_NTC4_NTD0_NTM0_NEPBS10_NLCA1_NLCB1_ONLL1_PGR2_PLR1_PKA1_SGROB0_SIA3_SS0_SU0_SUM0_SUS0_SPO0_SRVW0_SSO0_SVW4_SK3_SKFTR0_SKXCCM8_SGRO0_TDMI0_TIN1_TLDS2_TLDSMn1_ULSGRO1_USL1_UIOFGRO0_UPLRP0_USFGRO0_VSn1_VWA1_VWB2_WSGRA0_WSGRB2_WS64_WG16_16_1_WGM32_WGMXCC1_WGMXCCGn1
    SolutionIndex: 301
    SolutionNameMin: Cijk_Alik_Bljk_BBS_BH_BiasSB_HAS_SAV_UserArgs_MT256x192x64_MI16x16x1_CMS_SN_LDSB0_AFC1_AG1_AFEM1_AFEM1_ASEM1_CLR0_CADS0_DTLA1_DTLB1_DTVA0_DTVB0_DTVMXSA0_DTVMXSB0_DTVSM0_DPLB0_EPS0_ELFLR0_EMLL0_FDSI0_GRPM1_GRVWA8_GRVWB8_GSU0_GSUAMB_GSUC0_GSUWGMRR0_GLS0_ISA950_IU1_K1_LDSTI0_LBSPPA1024_LBSPPB1024_LBSPPM0_LPA16_LPB32_LPM0_LRVW8_LWPMn1_MIAV0_MIWT8_6_MO40_MGRIPM1_NTn1_NTA4_NTB0_NTC4_NTD4_NTM0_NEPBS16_NLCA1_NLCB1_ONLL1_PGR2_PLR1_PKA1_SGROB0_SIA3_SS1_SU0_SUM0_SUS128_SPO1_SRVW0_SSO1_SVW8_SK3_SKFTR0_SKXCCM4_SGRO0_TDMI0_TIN0_TLDS1_TLDSMn1_ULSGRO0_USL1_UIOFGRO0_UPLRP0_USFGRO0_VSn1_VWA8_VWB2_WSGRA0_WSGRB0_WS64_WG32_8_1_WGM16_WGMXCC1_WGMXCCGn1
    SolutionIndex: 302
    SolutionNameMin: Cijk_Alik_Bljk_BBS_BH_BiasSB_HAS_SAV_UserArgs_MT128x112x128_MI16x16x1_SN_LDSB0_AFC1_AG1_AFEM1_AFEM1_ASEM1_CLR0_CADS0_DTLA0_DTLB0_DTVA0_DTVB0_DTVMXSA0_DTVMXSB0_DTVSM0_DPLB0_EPS0_ELFLR0_EMLLn1_FDSI0_GRPM1_GRVWA8_GRVWB8_GSU0_GSUAMB_GSUC0_GSUWGMRR0_GLS0_ISA950_IU1_K1_LDSTI0_LBSPPA512_LBSPPB256_LBSPPM0_LPA16_LPB16_LPM0_LRVWn1_LWPMn1_MIAV0_MIWT2_7_MO40_MGRIPM1_NTn1_NTA4_NTB0_NTC4_NTD0_NTM0_NEPBS14_NLCA1_NLCB1_ONLL1_PGR2_PLR1_PKA1_SGROB0_SIA3_SS0_SU0_SUM0_SUS0_SPO0_SRVW0_SSO0_SVW8_SK3_SKFTR0_SKXCCM0_SGRO0_TDMI0_TIN1_TLDS2_TLDSMn1_ULSGRO1_USL1_UIOFGRO0_UPLRP0_USFGRO1_VSn1_VWA2_VWB1_WSGRA2_WSGRB2_WS64_WG64_4_1_WGM0_WGMXCC4_WGMXCCGn1
    SolutionIndex: 303
    SolutionNameMin: Cijk_Alik_Bljk_BBS_BH_BiasSB_HAS_SAV_UserArgs_MT128x96x128_MI16x16x1_SN_LDSB0_AFC1_AG1_AFEM1_AFEM1_ASEM1_CLR0_CADS0_DTLA0_DTLB0_DTVA0_DTVB0_DTVMXSA0_DTVMXSB0_DTVSM0_DPLB0_EPS0_ELFLR0_EMLLn1_FDSI0_GRPM1_GRVWA8_GRVWB8_GSU0_GSUAMB_GSUC0_GSUWGMRR0_GLS0_ISA950_IU1_K1_LDSTI0_LBSPPA1024_LBSPPB256_LBSPPM0_LPA16_LPB16_LPM0_LRVWn1_LWPMn1_MIAV1_MIWT4_3_MO40_MGRIPM1_NTn1_NTA4_NTB0_NTC0_NTD4_NTM0_NEPBS16_NLCA1_NLCB1_ONLL1_PGR2_PLR1_PKA1_SGROB0_SIA3_SS1_SU0_SUM0_SUS0_SPO0_SRVW0_SSO0_SVW4_SK3_SKFTR0_SKXCCM4_SGRO0_TDMI0_TIN1_TLDS1_TLDSMn1_ULSGRO1_USL1_UIOFGRO0_UPLRP0_USFGRO1_VSn1_VWA4_VWB1_WSGRA2_WSGRB0_WS64_WG32_8_1_WGM6_WGMXCC1_WGMXCCGn1
    SolutionIndex: 304
    SolutionNameMin: Cijk_Alik_Bljk_BBS_BH_BiasSB_HAS_SAV_UserArgs_MT256x192x64_MI16x16x1_CMS_SN_LDSB0_AFC1_AG1_AFEM1_AFEM1_ASEM1_CLR0_CADS0_DTLA1_DTLB1_DTVA0_DTVB0_DTVMXSA0_DTVMXSB0_DTVSM0_DPLB0_EPS0_ELFLR0_EMLLn1_FDSI0_GRPM1_GRVWA8_GRVWB8_GSU0_GSUAMB_GSUC0_GSUWGMRR0_GLS0_ISA950_IU1_K1_LDSTI0_LBSPPA1024_LBSPPB1024_LBSPPM0_LPA16_LPB32_LPM0_LRVW8_LWPMn1_MIAV0_MIWT8_6_MO40_MGRIPM1_NTn1_NTA4_NTB0_NTC4_NTD4_NTM0_NEPBS14_NLCA1_NLCB1_ONLL1_PGR2_PLR1_PKA1_SGROB1_SIA3_SS1_SU8_SUM0_SUS128_SPO0_SRVW0_SSO1_SVW8_SK3_SKFTR0_SKXCCM4_SGRO0_TDMI0_TIN0_TLDS1_TLDSMn1_ULSGRO0_USL1_UIOFGRO0_UPLRP0_USFGRO0_VSn1_VWA8_VWB2_WSGRA0_WSGRB0_WS64_WG32_8_1_WGM48_WGMXCC1_WGMXCCGn1
    SolutionIndex: 305
    SolutionNameMin: Cijk_Alik_Bljk_BBS_BH_BiasSB_HAS_SAV_UserArgs_MT256x192x64_MI16x16x1_CMS_SN_LDSB0_AFC1_AG1_AFEM1_AFEM1_ASEM1_CLR1_CADS0_DTLA1_DTLB1_DTVA0_DTVB0_DTVMXSA0_DTVMXSB0_DTVSM0_DPLB0_EPS0_ELFLR0_EMLL0_FDSI0_GRPM1_GRVWA8_GRVWB8_GSU0_GSUAMB_GSUC0_GSUWGMRR0_GLS0_ISA950_IU1_K1_LDSTI0_LBSPPA1024_LBSPPB1024_LBSPPM0_LPA16_LPB32_LPM0_LRVW8_LWPMn1_MIAV0_MIWT8_6_MO40_MGRIPM1_NTn1_NTA4_NTB0_NTC4_NTD0_NTM0_NEPBS14_NLCA1_NLCB1_ONLL1_PGR2_PLR1_PKA1_SGROB1_SIA3_SS1_SU0_SUM0_SUS128_SPO0_SRVW0_SSO0_SVW8_SK3_SKFTR0_SKXCCM0_SGRO0_TDMI0_TIN0_TLDS1_TLDSMn1_ULSGRO0_USL1_UIOFGRO0_UPLRP0_USFGRO0_VSn1_VWA8_VWB2_WSGRA0_WSGRB0_WS64_WG32_8_1_WGM24_WGMXCC4_WGMXCCGn1
    SolutionIndex: 306
    SolutionNameMin: Cijk_Alik_Bljk_BBS_BH_BiasSB_HAS_SAV_UserArgs_MT128x96x128_MI16x16x1_SN_LDSB0_AFC1_AG1_AFEM1_AFEM1_ASEM1_CLR0_CADS0_DTLA0_DTLB0_DTVA0_DTVB0_DTVMXSA0_DTVMXSB0_DTVSM0_DPLB0_EPS0_ELFLR0_EMLLn1_FDSI0_GRPM1_GRVWA8_GRVWB8_GSU0_GSUAMB_GSUC0_GSUWGMRR0_GLS0_ISA950_IU1_K1_LDSTI0_LBSPPA1024_LBSPPB256_LBSPPM0_LPA16_LPB16_LPM0_LRVWn1_LWPMn1_MIAV0_MIWT4_3_MO40_MGRIPM1_NTn1_NTA4_NTB0_NTC0_NTD4_NTM0_NEPBS0_NLCA1_NLCB1_ONLL1_PGR2_PLR1_PKA1_SGROB0_SIA3_SS1_SU0_SUM0_SUS0_SPO1_SRVW0_SSO0_SVW4_SK3_SKFTR0_SKXCCM4_SGRO0_TDMI0_TIN1_TLDS1_TLDSMn1_ULSGRO1_USL1_UIOFGRO0_UPLRP0_USFGRO0_VSn1_VWA4_VWB1_WSGRA0_WSGRB2_WS64_WG32_8_1_WGM24_WGMXCC1_WGMXCCGn1
    SolutionIndex: 307
    SolutionNameMin: Cijk_Alik_Bljk_BBS_BH_BiasSB_HAS_SAV_UserArgs_MT128x96x128_MI16x16x1_SN_LDSB0_AFC1_AG1_AFEM1_AFEM1_ASEM1_CLR0_CADS0_DTLA0_DTLB0_DTVA0_DTVB0_DTVMXSA0_DTVMXSB0_DTVSM0_DPLB0_EPS0_ELFLR0_EMLLn1_FDSI0_GRPM1_GRVWA8_GRVWB8_GSU0_GSUAMB_GSUC0_GSUWGMRR0_GLS0_ISA950_IU1_K1_LDSTI0_LBSPPA512_LBSPPB512_LBSPPM0_LPA16_LPB16_LPM0_LRVWn1_LWPMn1_MIAV0_MIWT2_6_MO40_MGRIPM1_NTn1_NTA4_NTB0_NTC0_NTD4_NTM0_NEPBS0_NLCA1_NLCB1_ONLL1_PGR2_PLR1_PKA1_SGROB0_SIA3_SS0_SU0_SUM0_SUS0_SPO0_SRVW0_SSO0_SVW8_SK3_SKFTR0_SKXCCM4_SGRO0_TDMI0_TIN1_TLDS2_TLDSMn1_ULSGRO1_USL1_UIOFGRO0_UPLRP0_USFGRO1_VSn1_VWA2_VWB2_WSGRA0_WSGRB0_WS64_WG64_4_1_WGM48_WGMXCC1_WGMXCCGn1
    SolutionIndex: 308
    SolutionNameMin: Cijk_Alik_Bljk_BBS_BH_BiasSB_HAS_SAV_UserArgs_MT128x192x64_MI16x16x1_CMS_SN_LDSB0_AFC1_AG0_AFEM1_AFEM1_ASEM1_CLR1_CADS0_DTLA1_DTLB1_DTVA0_DTVB0_DTVMXSA0_DTVMXSB0_DTVSM0_DPLB0_EPS0_ELFLR0_EMLL0_FDSI0_GRPM1_GRVWA8_GRVWB8_GSU0_GSUAMB_GSUC0_GSUWGMRR0_GLS0_ISA950_IU1_K1_LDSTI0_LBSPPA1024_LBSPPB1024_LBSPPM0_LPA32_LPB32_LPM0_LRVW8_LWPMn1_MIAV1_MIWT4_6_MO40_MGRIPM1_NTn1_NTA4_NTB0_NTC4_NTD4_NTM0_NEPBS10_NLCA1_NLCB1_ONLL1_PGR2_PLR1_PKA1_SGROB0_SIA3_SS1_SU0_SUM0_SUS128_SPO0_SRVW0_SSO0_SVW4_SK3_SKFTR0_SKXCCM8_SGRO0_TDMI0_TIN0_TLDS1_TLDSMn1_ULSGRO0_USL1_UIOFGRO0_UPLRP0_USFGRO0_VSn1_VWA4_VWB2_WSGRA0_WSGRB0_WS64_WG32_8_1_WGM4_WGMXCC1_WGMXCCGn1
    SolutionIndex: 309
    SolutionNameMin: Cijk_Alik_Bljk_BBS_BH_BiasSB_HAS_SAV_UserArgs_MT256x160x64_MI16x16x1_CMS_SN_LDSB0_AFC1_AG1_AFEM1_AFEM1_ASEM1_CLR0_CADS0_DTLA1_DTLB1_DTVA0_DTVB0_DTVMXSA0_DTVMXSB0_DTVSM0_DPLB0_EPS0_ELFLR0_EMLL0_FDSI0_GRPM1_GRVWA8_GRVWB8_GSU0_GSUAMB_GSUC0_GSUWGMRR0_GLS0_ISA950_IU1_K1_LDSTI0_LBSPPA1024_LBSPPB1024_LBSPPM0_LPA16_LPB32_LPM0_LRVW8_LWPMn1_MIAV0_MIWT8_5_MO40_MGRIPM1_NTn1_NTA4_NTB0_NTC4_NTD4_NTM0_NEPBS8_NLCA1_NLCB1_ONLL1_PGR2_PLR1_PKA1_SGROB1_SIA3_SS1_SU16_SUM0_SUS128_SPO0_SRVW0_SSO0_SVW8_SK3_SKFTR0_SKXCCM0_SGRO0_TDMI0_TIN0_TLDS1_TLDSMn1_ULSGRO0_USL1_UIOFGRO0_UPLRP0_USFGRO0_VSn1_VWA8_VWB1_WSGRA0_WSGRB0_WS64_WG32_8_1_WGM48_WGMXCC4_WGMXCCGn1
    SolutionIndex: 310
    SolutionNameMin: Cijk_Alik_Bljk_BBS_BH_BiasSB_HAS_SAV_UserArgs_MT256x160x64_MI16x16x1_CMS_SN_LDSB0_AFC1_AG1_AFEM1_AFEM1_ASEM1_CLR0_CADS0_DTLA1_DTLB1_DTVA0_DTVB0_DTVMXSA0_DTVMXSB0_DTVSM0_DPLB0_EPS0_ELFLR0_EMLL0_FDSI0_GRPM1_GRVWA8_GRVWB8_GSU0_GSUAMB_GSUC0_GSUWGMRR0_GLS0_ISA950_IU1_K1_LDSTI0_LBSPPA1024_LBSPPB1024_LBSPPM0_LPA16_LPB32_LPM0_LRVW8_LWPMn1_MIAV0_MIWT8_5_MO40_MGRIPM1_NTn1_NTA4_NTB0_NTC4_NTD4_NTM0_NEPBS10_NLCA1_NLCB1_ONLL1_PGR2_PLR1_PKA1_SGROB1_SIA3_SS1_SU8_SUM0_SUS512_SPO0_SRVW0_SSO0_SVW8_SK3_SKFTR0_SKXCCM0_SGRO0_TDMI0_TIN0_TLDS1_TLDSMn1_ULSGRO0_USL1_UIOFGRO0_UPLRP0_USFGRO0_VSn1_VWA8_VWB1_WSGRA0_WSGRB0_WS64_WG32_8_1_WGM16_WGMXCC4_WGMXCCGn1
    SolutionIndex: 311
    SolutionNameMin: Cijk_Alik_Bljk_BBS_BH_BiasSB_HAS_SAV_UserArgs_MT256x160x64_MI16x16x1_CMS_SN_LDSB0_AFC1_AG1_AFEM1_AFEM1_ASEM1_CLR0_CADS0_DTLA1_DTLB1_DTVA0_DTVB0_DTVMXSA0_DTVMXSB0_DTVSM0_DPLB0_EPS0_ELFLR0_EMLLn1_FDSI0_GRPM1_GRVWA8_GRVWB8_GSU0_GSUAMB_GSUC0_GSUWGMRR0_GLS0_ISA950_IU1_K1_LDSTI0_LBSPPA1024_LBSPPB1024_LBSPPM0_LPA16_LPB32_LPM0_LRVW8_LWPMn1_MIAV0_MIWT8_5_MO40_MGRIPM1_NTn1_NTA4_NTB0_NTC4_NTD4_NTM0_NEPBS16_NLCA1_NLCB1_ONLL1_PGR2_PLR1_PKA1_SGROB1_SIA3_SS1_SU16_SUM0_SUS512_SPO1_SRVW0_SSO1_SVW8_SK3_SKFTR0_SKXCCM4_SGRO0_TDMI0_TIN0_TLDS1_TLDSMn1_ULSGRO0_USL1_UIOFGRO0_UPLRP0_USFGRO0_VSn1_VWA8_VWB1_WSGRA0_WSGRB0_WS64_WG32_8_1_WGM32_WGMXCC1_WGMXCCGn1
    SolutionIndex: 312
    SolutionNameMin: Cijk_Alik_Bljk_BBS_BH_BiasSB_HAS_SAV_UserArgs_MT256x160x64_MI16x16x1_CMS_SN_LDSB0_AFC1_AG1_AFEM1_AFEM1_ASEM1_CLR0_CADS0_DTLA1_DTLB1_DTVA0_DTVB0_DTVMXSA0_DTVMXSB0_DTVSM0_DPLB0_EPS0_ELFLR0_EMLL0_FDSI0_GRPM1_GRVWA8_GRVWB8_GSU0_GSUAMB_GSUC0_GSUWGMRR0_GLS0_ISA950_IU1_K1_LDSTI0_LBSPPA1024_LBSPPB1024_LBSPPM0_LPA16_LPB32_LPM0_LRVW8_LWPMn1_MIAV0_MIWT8_5_MO40_MGRIPM1_NTn1_NTA4_NTB0_NTC4_NTD4_NTM0_NEPBS16_NLCA1_NLCB1_ONLL1_PGR2_PLR1_PKA1_SGROB1_SIA3_SS1_SU0_SUM0_SUS128_SPO1_SRVW0_SSO1_SVW8_SK3_SKFTR0_SKXCCM4_SGRO0_TDMI0_TIN0_TLDS1_TLDSMn1_ULSGRO0_USL1_UIOFGRO0_UPLRP0_USFGRO0_VSn1_VWA8_VWB1_WSGRA0_WSGRB0_WS64_WG32_8_1_WGM16_WGMXCC1_WGMXCCGn1
    SolutionIndex: 313
    SolutionNameMin: Cijk_Alik_Bljk_BBS_BH_BiasSB_HAS_SAV_UserArgs_MT128x80x128_MI16x16x1_SN_LDSB0_AFC1_AG1_AFEM1_AFEM1_ASEM1_CLR0_CADS0_DTLA0_DTLB0_DTVA0_DTVB0_DTVMXSA0_DTVMXSB0_DTVSM0_DPLB0_EPS0_ELFLR0_EMLLn1_FDSI0_GRPM1_GRVWA8_GRVWB8_GSU0_GSUAMB_GSUC0_GSUWGMRR0_GLS0_ISA950_IU1_K1_LDSTI0_LBSPPA512_LBSPPB256_LBSPPM0_LPA16_LPB16_LPM0_LRVWn1_LWPMn1_MIAV0_MIWT2_5_MO40_MGRIPM1_NTn1_NTA4_NTB0_NTC0_NTD4_NTM0_NEPBS16_NLCA1_NLCB1_ONLL1_PGR2_PLR1_PKA1_SGROB0_SIA3_SS0_SU0_SUM0_SUS0_SPO0_SRVW0_SSO0_SVW8_SK3_SKFTR0_SKXCCM4_SGRO0_TDMI0_TIN1_TLDS2_TLDSMn1_ULSGRO1_USL1_UIOFGRO0_UPLRP0_USFGRO0_VSn1_VWA2_VWB1_WSGRA0_WSGRB2_WS64_WG64_4_1_WGM16_WGMXCC1_WGMXCCGn1
    SolutionIndex: 314
    SolutionNameMin: Cijk_Alik_Bljk_BBS_BH_BiasSB_HAS_SAV_UserArgs_MT128x192x64_MI16x16x1_CMS_SN_LDSB0_AFC1_AG0_AFEM1_AFEM1_ASEM1_CLR0_CADS0_DTLA1_DTLB1_DTVA0_DTVB0_DTVMXSA0_DTVMXSB0_DTVSM0_DPLB0_EPS0_ELFLR0_EMLLn1_FDSI0_GRPM1_GRVWA8_GRVWB8_GSU0_GSUAMB_GSUC0_GSUWGMRR0_GLS0_ISA950_IU1_K1_LDSTI0_LBSPPA1024_LBSPPB1024_LBSPPM0_LPA32_LPB32_LPM0_LRVW8_LWPMn1_MIAV0_MIWT4_6_MO40_MGRIPM1_NTn1_NTA4_NTB0_NTC4_NTD4_NTM0_NEPBS10_NLCA1_NLCB1_ONLL1_PGR2_PLR1_PKA1_SGROB0_SIA3_SS1_SU16_SUM0_SUS128_SPO0_SRVW0_SSO0_SVW4_SK3_SKFTR0_SKXCCM8_SGRO0_TDMI0_TIN0_TLDS1_TLDSMn1_ULSGRO0_USL1_UIOFGRO0_UPLRP0_USFGRO0_VSn1_VWA4_VWB2_WSGRA0_WSGRB0_WS64_WG32_8_1_WGM8_WGMXCC1_WGMXCCGn1
    SolutionIndex: 315
    SolutionNameMin: Cijk_Alik_Bljk_BBS_BH_BiasSB_HAS_SAV_UserArgs_MT256x160x64_MI16x16x1_CMS_SN_LDSB0_AFC1_AG1_AFEM1_AFEM1_ASEM1_CLR0_CADS0_DTLA1_DTLB1_DTVA0_DTVB0_DTVMXSA0_DTVMXSB0_DTVSM0_DPLB0_EPS0_ELFLR0_EMLLn1_FDSI0_GRPM1_GRVWA8_GRVWB8_GSU0_GSUAMB_GSUC0_GSUWGMRR0_GLS0_ISA950_IU1_K1_LDSTI0_LBSPPA1024_LBSPPB1024_LBSPPM0_LPA16_LPB32_LPM0_LRVW8_LWPMn1_MIAV0_MIWT8_5_MO40_MGRIPM1_NTn1_NTA4_NTB0_NTC4_NTD4_NTM0_NEPBS12_NLCA1_NLCB1_ONLL1_PGR2_PLR1_PKA1_SGROB1_SIA3_SS1_SU0_SUM0_SUS128_SPO0_SRVW0_SSO0_SVW8_SK3_SKFTR0_SKXCCM4_SGRO0_TDMI0_TIN0_TLDS1_TLDSMn1_ULSGRO0_USL1_UIOFGRO0_UPLRP0_USFGRO0_VSn1_VWA8_VWB1_WSGRA0_WSGRB0_WS64_WG32_8_1_WGM48_WGMXCC1_WGMXCCGn1
    SolutionIndex: 316
    SolutionNameMin: Cijk_Alik_Bljk_BBS_BH_BiasSB_HAS_SAV_UserArgs_MT256x192x64_MI16x16x1_CMS_SN_LDSB0_AFC1_AG1_AFEM1_AFEM1_ASEM1_CLR0_CADS0_DTLA1_DTLB1_DTVA0_DTVB0_DTVMXSA0_DTVMXSB0_DTVSM0_DPLB0_EPS0_ELFLR0_EMLLn1_FDSI0_GRPM1_GRVWA8_GRVWB8_GSU0_GSUAMB_GSUC0_GSUWGMRR0_GLS0_ISA950_IU1_K1_LDSTI0_LBSPPA1024_LBSPPB1024_LBSPPM0_LPA16_LPB32_LPM0_LRVW8_LWPMn1_MIAV0_MIWT8_6_MO40_MGRIPM1_NTn1_NTA4_NTB0_NTC0_NTD4_NTM0_NEPBS0_NLCA1_NLCB1_ONLL1_PGR2_PLR1_PKA1_SGROB0_SIA3_SS1_SU16_SUM0_SUS128_SPO1_SRVW0_SSO1_SVW8_SK3_SKFTR0_SKXCCM0_SGRO0_TDMI0_TIN0_TLDS1_TLDSMn1_ULSGRO0_USL1_UIOFGRO0_UPLRP0_USFGRO0_VSn1_VWA8_VWB2_WSGRA0_WSGRB0_WS64_WG32_8_1_WGM16_WGMXCC4_WGMXCCGn1
    SolutionIndex: 317
    SolutionNameMin: Cijk_Alik_Bljk_BBS_BH_BiasSB_HAS_SAV_UserArgs_MT192x128x64_MI16x16x1_CMS_SN_LDSB0_AFC1_AG1_AFEM1_AFEM1_ASEM1_CLR0_CADS0_DTLA1_DTLB1_DTVA0_DTVB0_DTVMXSA0_DTVMXSB0_DTVSM0_DPLB0_EPS0_ELFLR0_EMLLn1_FDSI0_GRPM1_GRVWA8_GRVWB8_GSU0_GSUAMB_GSUC0_GSUWGMRR0_GLS0_ISA950_IU1_K1_LDSTI0_LBSPPA1024_LBSPPB1024_LBSPPM0_LPA32_LPB32_LPM0_LRVW8_LWPMn1_MIAV0_MIWT6_4_MO40_MGRIPM1_NTn1_NTA0_NTB0_NTC0_NTD0_NTM0_NEPBS8_NLCA1_NLCB1_ONLL1_PGR2_PLR1_PKA1_SGROB0_SIA3_SS0_SU8_SUM0_SUS128_SPO0_SRVW0_SSO1_SVW8_SK3_SKFTR0_SKXCCM8_SGRO0_TDMI0_TIN0_TLDS1_TLDSMn1_ULSGRO0_USL1_UIOFGRO0_UPLRP0_USFGRO0_VSn1_VWA2_VWB4_WSGRA0_WSGRB0_WS64_WG32_8_1_WGM2_WGMXCC1_WGMXCCGn1
    SolutionIndex: 318
    SolutionNameMin: Cijk_Alik_Bljk_BBS_BH_BiasSB_HAS_SAV_UserArgs_MT256x160x64_MI16x16x1_CMS_SN_LDSB0_AFC1_AG0_AFEM1_AFEM1_ASEM1_CLR0_CADS0_DTLA1_DTLB1_DTVA0_DTVB0_DTVMXSA0_DTVMXSB0_DTVSM0_DPLB0_EPS0_ELFLR0_EMLLn1_FDSI0_GRPM1_GRVWA8_GRVWB8_GSU0_GSUAMB_GSUC0_GSUWGMRR0_GLS0_ISA950_IU1_K1_LDSTI0_LBSPPA1024_LBSPPB1024_LBSPPM0_LPA16_LPB32_LPM0_LRVW8_LWPMn1_MIAV0_MIWT8_5_MO40_MGRIPM1_NTn1_NTA4_NTB0_NTC4_NTD4_NTM0_NEPBS0_NLCA1_NLCB1_ONLL1_PGR2_PLR1_PKA1_SGROB0_SIA3_SS1_SU8_SUM0_SUS512_SPO1_SRVW0_SSO1_SVW8_SK3_SKFTR0_SKXCCM4_SGRO0_TDMI0_TIN0_TLDS1_TLDSMn1_ULSGRO0_USL1_UIOFGRO0_UPLRP0_USFGRO0_VSn1_VWA8_VWB1_WSGRA0_WSGRB0_WS64_WG32_8_1_WGM6_WGMXCC1_WGMXCCGn1
    SolutionIndex: 319
    SolutionNameMin: Cijk_Alik_Bljk_BBS_BH_BiasSB_HAS_SAV_UserArgs_MT256x160x64_MI16x16x1_CMS_SN_LDSB0_AFC1_AG1_AFEM1_AFEM1_ASEM1_CLR0_CADS0_DTLA1_DTLB1_DTVA0_DTVB0_DTVMXSA0_DTVMXSB0_DTVSM0_DPLB0_EPS0_ELFLR0_EMLLn1_FDSI0_GRPM1_GRVWA8_GRVWB8_GSU0_GSUAMB_GSUC0_GSUWGMRR0_GLS0_ISA950_IU1_K1_LDSTI0_LBSPPA1024_LBSPPB1024_LBSPPM0_LPA16_LPB32_LPM0_LRVW8_LWPMn1_MIAV0_MIWT8_5_MO40_MGRIPM1_NTn1_NTA4_NTB0_NTC4_NTD4_NTM0_NEPBS10_NLCA1_NLCB1_ONLL1_PGR2_PLR1_PKA1_SGROB1_SIA3_SS1_SU16_SUM0_SUS128_SPO0_SRVW0_SSO1_SVW8_SK3_SKFTR0_SKXCCM4_SGRO0_TDMI0_TIN0_TLDS1_TLDSMn1_ULSGRO0_USL1_UIOFGRO0_UPLRP0_USFGRO0_VSn1_VWA8_VWB1_WSGRA0_WSGRB0_WS64_WG32_8_1_WGM24_WGMXCC1_WGMXCCGn1
    SolutionIndex: 320
    SolutionNameMin: Cijk_Alik_Bljk_BBS_BH_BiasSB_HAS_SAV_UserArgs_MT256x160x64_MI16x16x1_CMS_SN_LDSB0_AFC1_AG1_AFEM1_AFEM1_ASEM1_CLR0_CADS0_DTLA1_DTLB1_DTVA0_DTVB0_DTVMXSA0_DTVMXSB0_DTVSM0_DPLB0_EPS0_ELFLR0_EMLLn1_FDSI0_GRPM1_GRVWA8_GRVWB8_GSU0_GSUAMB_GSUC0_GSUWGMRR0_GLS0_ISA950_IU1_K1_LDSTI0_LBSPPA1024_LBSPPB1024_LBSPPM0_LPA16_LPB32_LPM0_LRVW8_LWPMn1_MIAV0_MIWT8_5_MO40_MGRIPM1_NTn1_NTA4_NTB0_NTC4_NTD4_NTM0_NEPBS14_NLCA1_NLCB1_ONLL1_PGR2_PLR1_PKA1_SGROB0_SIA3_SS1_SU16_SUM0_SUS128_SPO0_SRVW0_SSO1_SVW8_SK3_SKFTR0_SKXCCM4_SGRO0_TDMI0_TIN0_TLDS1_TLDSMn1_ULSGRO0_USL1_UIOFGRO0_UPLRP0_USFGRO0_VSn1_VWA8_VWB1_WSGRA0_WSGRB0_WS64_WG32_8_1_WGM16_WGMXCC1_WGMXCCGn1
    SolutionIndex: 321
    SolutionNameMin: Cijk_Alik_Bljk_BBS_BH_BiasSB_HAS_SAV_UserArgs_MT256x160x64_MI16x16x1_CMS_SN_LDSB0_AFC1_AG0_AFEM1_AFEM1_ASEM1_CLR1_CADS0_DTLA1_DTLB1_DTVA0_DTVB0_DTVMXSA0_DTVMXSB0_DTVSM0_DPLB0_EPS0_ELFLR0_EMLLn1_FDSI0_GRPM1_GRVWA8_GRVWB8_GSU0_GSUAMB_GSUC0_GSUWGMRR0_GLS0_ISA950_IU1_K1_LDSTI0_LBSPPA1024_LBSPPB1024_LBSPPM0_LPA16_LPB32_LPM0_LRVW8_LWPMn1_MIAV0_MIWT8_5_MO40_MGRIPM1_NTn1_NTA4_NTB0_NTC4_NTD4_NTM0_NEPBS12_NLCA1_NLCB1_ONLL1_PGR2_PLR1_PKA1_SGROB1_SIA3_SS1_SU0_SUM0_SUS128_SPO0_SRVW0_SSO0_SVW8_SK3_SKFTR0_SKXCCM0_SGRO0_TDMI0_TIN0_TLDS1_TLDSMn1_ULSGRO0_USL1_UIOFGRO0_UPLRP0_USFGRO0_VSn1_VWA8_VWB1_WSGRA0_WSGRB0_WS64_WG32_8_1_WGM16_WGMXCC4_WGMXCCGn1
    SolutionIndex: 322
    SolutionNameMin: Cijk_Alik_Bljk_BBS_BH_BiasSB_HAS_SAV_UserArgs_MT256x160x64_MI16x16x1_CMS_SN_LDSB0_AFC1_AG0_AFEM1_AFEM1_ASEM1_CLR1_CADS0_DTLA1_DTLB1_DTVA0_DTVB0_DTVMXSA0_DTVMXSB0_DTVSM0_DPLB0_EPS0_ELFLR0_EMLLn1_FDSI0_GRPM1_GRVWA8_GRVWB8_GSU0_GSUAMB_GSUC0_GSUWGMRR0_GLS0_ISA950_IU1_K1_LDSTI0_LBSPPA1024_LBSPPB1024_LBSPPM0_LPA16_LPB32_LPM0_LRVW8_LWPMn1_MIAV0_MIWT8_5_MO40_MGRIPM1_NTn1_NTA4_NTB0_NTC4_NTD4_NTM0_NEPBS16_NLCA1_NLCB1_ONLL1_PGR2_PLR1_PKA1_SGROB0_SIA3_SS1_SU8_SUM0_SUS128_SPO1_SRVW0_SSO0_SVW8_SK3_SKFTR0_SKXCCM0_SGRO0_TDMI0_TIN0_TLDS1_TLDSMn1_ULSGRO0_USL1_UIOFGRO0_UPLRP0_USFGRO0_VSn1_VWA8_VWB1_WSGRA0_WSGRB0_WS64_WG32_8_1_WGM32_WGMXCC4_WGMXCCGn1
    SolutionIndex: 323
    SolutionNameMin: Cijk_Alik_Bljk_BBS_BH_BiasSB_HAS_SAV_UserArgs_MT160x128x128_MI16x16x1_SN_LDSB0_AFC1_AG1_AFEM1_AFEM1_ASEM1_CLR0_CADS0_DTLA0_DTLB0_DTVA0_DTVB0_DTVMXSA0_DTVMXSB0_DTVSM0_DPLB0_EPS0_ELFLR0_EMLLn1_FDSI0_GRPM1_GRVWA8_GRVWB8_GSU0_GSUAMB_GSUC0_GSUWGMRR0_GLS0_ISA950_IU1_K1_LDSTI0_LBSPPA512_LBSPPB512_LBSPPM0_LPA16_LPB16_LPM0_LRVWn1_LWPMn1_MIAV0_MIWT10_2_MO40_MGRIPM1_NTn1_NTA0_NTB0_NTC0_NTD0_NTM0_NEPBS16_NLCA1_NLCB1_ONLL1_PGR2_PLR1_PKA1_SGROB0_SIA3_SS0_SU0_SUM0_SUS0_SPO1_SRVW0_SSO4_SVW8_SK3_SKFTR0_SKXCCM4_SGRO0_TDMI0_TIN1_TLDS1_TLDSMn1_ULSGRO0_USL1_UIOFGRO0_UPLRP0_USFGRO0_VSn1_VWA2_VWB2_WSGRA0_WSGRB2_WS64_WG16_16_1_WGM8_WGMXCC1_WGMXCCGn1
    SolutionIndex: 324
    SolutionNameMin: Cijk_Alik_Bljk_BBS_BH_BiasSB_HAS_SAV_UserArgs_MT256x160x64_MI16x16x1_CMS_SN_LDSB0_AFC1_AG0_AFEM1_AFEM1_ASEM1_CLR0_CADS0_DTLA1_DTLB1_DTVA0_DTVB0_DTVMXSA0_DTVMXSB0_DTVSM0_DPLB0_EPS0_ELFLR0_EMLLn1_FDSI0_GRPM1_GRVWA8_GRVWB8_GSU0_GSUAMB_GSUC0_GSUWGMRR0_GLS0_ISA950_IU1_K1_LDSTI0_LBSPPA1024_LBSPPB1024_LBSPPM0_LPA16_LPB32_LPM0_LRVW8_LWPMn1_MIAV0_MIWT8_5_MO40_MGRIPM1_NTn1_NTA4_NTB0_NTC4_NTD4_NTM0_NEPBS14_NLCA1_NLCB1_ONLL1_PGR2_PLR1_PKA1_SGROB1_SIA3_SS1_SU16_SUM0_SUS512_SPO1_SRVW0_SSO1_SVW8_SK3_SKFTR0_SKXCCM4_SGRO0_TDMI0_TIN0_TLDS1_TLDSMn1_ULSGRO0_USL1_UIOFGRO0_UPLRP0_USFGRO0_VSn1_VWA8_VWB1_WSGRA0_WSGRB0_WS64_WG32_8_1_WGM24_WGMXCC1_WGMXCCGn1
    SolutionIndex: 325
    SolutionNameMin: Cijk_Alik_Bljk_BBS_BH_BiasSB_HAS_SAV_UserArgs_MT128x192x64_MI16x16x1_CMS_SN_LDSB0_AFC1_AG1_AFEM1_AFEM1_ASEM1_CLR0_CADS0_DTLA1_DTLB1_DTVA0_DTVB0_DTVMXSA0_DTVMXSB0_DTVSM0_DPLB0_EPS0_ELFLR0_EMLL0_FDSI0_GRPM1_GRVWA8_GRVWB8_GSU0_GSUAMB_GSUC0_GSUWGMRR0_GLS0_ISA950_IU1_K1_LDSTI0_LBSPPA1024_LBSPPB1024_LBSPPM0_LPA32_LPB32_LPM0_LRVW8_LWPMn1_MIAV0_MIWT4_6_MO40_MGRIPM1_NTn1_NTA4_NTB0_NTC4_NTD4_NTM0_NEPBS10_NLCA1_NLCB1_ONLL1_PGR2_PLR1_PKA1_SGROB1_SIA3_SS1_SU0_SUM0_SUS128_SPO1_SRVW0_SSO0_SVW4_SK3_SKFTR0_SKXCCM4_SGRO0_TDMI0_TIN0_TLDS1_TLDSMn1_ULSGRO0_USL1_UIOFGRO0_UPLRP0_USFGRO0_VSn1_VWA4_VWB2_WSGRA0_WSGRB0_WS64_WG32_8_1_WGM16_WGMXCC1_WGMXCCGn1
    SolutionIndex: 326
    SolutionNameMin: Cijk_Alik_Bljk_BBS_BH_BiasSB_HAS_SAV_UserArgs_MT192x128x64_MI16x16x1_CMS_SN_LDSB0_AFC1_AG0_AFEM1_AFEM1_ASEM1_CLR1_CADS0_DTLA1_DTLB1_DTVA0_DTVB0_DTVMXSA0_DTVMXSB0_DTVSM0_DPLB0_EPS0_ELFLR0_EMLLn1_FDSI0_GRPM1_GRVWA8_GRVWB8_GSU0_GSUAMB_GSUC0_GSUWGMRR0_GLS0_ISA950_IU1_K1_LDSTI0_LBSPPA1024_LBSPPB1024_LBSPPM0_LPA32_LPB32_LPM0_LRVW8_LWPMn1_MIAV0_MIWT6_4_MO40_MGRIPM1_NTn1_NTA0_NTB0_NTC0_NTD0_NTM0_NEPBS10_NLCA1_NLCB1_ONLL1_PGR2_PLR1_PKA1_SGROB1_SIA3_SS0_SU0_SUM0_SUS128_SPO1_SRVW0_SSO0_SVW8_SK3_SKFTR0_SKXCCM4_SGRO0_TDMI0_TIN0_TLDS1_TLDSMn1_ULSGRO0_USL1_UIOFGRO0_UPLRP0_USFGRO0_VSn1_VWA2_VWB4_WSGRA0_WSGRB0_WS64_WG32_8_1_WGM6_WGMXCC1_WGMXCCGn1
    SolutionIndex: 327
    SolutionNameMin: Cijk_Alik_Bljk_BBS_BH_BiasSB_HAS_SAV_UserArgs_MT96x192x64_MI16x16x1_SN_LDSB0_AFC1_AG1_AFEM1_AFEM1_ASEM1_CLR0_CADS0_DTLA1_DTLB1_DTVA0_DTVB0_DTVMXSA0_DTVMXSB0_DTVSM0_DPLB1_EPS0_ELFLR0_EMLLn1_FDSI0_GRPM1_GRVWA2_GRVWB8_GSU0_GSUAMB_GSUC0_GSUWGMRR0_GLS0_ISA950_IU1_K1_LDSTI0_LBSPPA256_LBSPPB1024_LBSPPM0_LPA16_LPB32_LPM0_LRVWn1_LWPMn1_MIAV1_MIWT6_3_MO40_MGRIPM1_NTn1_NTA4_NTB0_NTC4_NTD4_NTM0_NEPBS2_NLCA1_NLCB1_ONLL1_PGR3_PLR1_PKA1_SGROB1_SIA3_SS1_SU0_SUM0_SUS0_SPO0_SRVW0_SSO0_SVW2_SK3_SKFTR0_SKXCCM0_SGRO0_TDMI0_TIN1_TLDS2_TLDSMn1_ULSGRO1_USL1_UIOFGRO0_UPLRP0_USFGRO0_VSn1_VWA2_VWB1_WSGRA0_WSGRB0_WS64_WG16_16_1_WGMn32_WGMXCC2_WGMXCCGn1
    SolutionIndex: 328
    SolutionNameMin: Cijk_Alik_Bljk_BBS_BH_BiasSB_HAS_SAV_UserArgs_MT80x128x128_MI16x16x1_SN_LDSB0_AFC1_AG0_AFEM1_AFEM1_ASEM1_CLR0_CADS0_DTLA0_DTLB0_DTVA0_DTVB0_DTVMXSA0_DTVMXSB0_DTVSM0_DPLB0_EPS0_ELFLR0_EMLLn1_FDSI0_GRPM1_GRVWA8_GRVWB8_GSU0_GSUAMB_GSUC0_GSUWGMRR0_GLS0_ISA950_IU1_K1_LDSTI0_LBSPPA256_LBSPPB512_LBSPPM0_LPA16_LPB16_LPM0_LRVWn1_LWPMn1_MIAV0_MIWT5_2_MO40_MGRIPM1_NTn1_NTA4_NTB0_NTC0_NTD4_NTM0_NEPBS0_NLCA1_NLCB1_ONLL1_PGR2_PLR1_PKA1_SGROB0_SIA3_SS1_SU0_SUM0_SUS0_SPO0_SRVW0_SSO0_SVW1_SK3_SKFTR0_SKXCCM4_SGRO0_TDMI0_TIN1_TLDS1_TLDSMn1_ULSGRO1_USL1_UIOFGRO0_UPLRP0_USFGRO0_VSn1_VWA1_VWB2_WSGRA0_WSGRB0_WS64_WG16_16_1_WGM4_WGMXCC1_WGMXCCGn1
    SolutionIndex: 329
    SolutionNameMin: Cijk_Alik_Bljk_BBS_BH_BiasSB_HAS_SAV_UserArgs_MT192x128x64_MI16x16x1_CMS_SN_LDSB0_AFC1_AG0_AFEM1_AFEM1_ASEM1_CLR0_CADS0_DTLA1_DTLB1_DTVA0_DTVB0_DTVMXSA0_DTVMXSB0_DTVSM0_DPLB0_EPS0_ELFLR0_EMLLn1_FDSI0_GRPM1_GRVWA8_GRVWB8_GSU0_GSUAMB_GSUC0_GSUWGMRR0_GLS0_ISA950_IU1_K1_LDSTI0_LBSPPA1024_LBSPPB1024_LBSPPM0_LPA32_LPB32_LPM0_LRVW8_LWPMn1_MIAV0_MIWT6_4_MO40_MGRIPM1_NTn1_NTA0_NTB0_NTC0_NTD0_NTM0_NEPBS8_NLCA1_NLCB1_ONLL1_PGR2_PLR1_PKA1_SGROB1_SIA3_SS0_SU8_SUM0_SUS128_SPO1_SRVW0_SSO0_SVW8_SK3_SKFTR0_SKXCCM4_SGRO0_TDMI0_TIN0_TLDS1_TLDSMn1_ULSGRO0_USL1_UIOFGRO0_UPLRP0_USFGRO0_VSn1_VWA2_VWB4_WSGRA0_WSGRB0_WS64_WG32_8_1_WGM6_WGMXCC1_WGMXCCGn1
    SolutionIndex: 330
    SolutionNameMin: Cijk_Alik_Bljk_BBS_BH_BiasSB_HAS_SAV_UserArgs_MT96x128x128_MI16x16x1_SN_LDSB0_AFC1_AG0_AFEM1_AFEM1_ASEM1_CLR1_CADS0_DTLA0_DTLB0_DTVA0_DTVB0_DTVMXSA0_DTVMXSB0_DTVSM0_DPLB0_EPS0_ELFLR0_EMLLn1_FDSI0_GRPM1_GRVWA8_GRVWB8_GSU0_GSUAMB_GSUC0_GSUWGMRR0_GLS0_ISA950_IU1_K1_LDSTI0_LBSPPA512_LBSPPB512_LBSPPM0_LPA16_LPB16_LPM0_LRVWn1_LWPMn1_MIAV0_MIWT6_2_MO40_MGRIPM1_NTn1_NTA4_NTB0_NTC4_NTD0_NTM0_NEPBS0_NLCA1_NLCB1_ONLL1_PGR2_PLR1_PKA1_SGROB0_SIA3_SS1_SU0_SUM0_SUS0_SPO1_SRVW0_SSO0_SVW2_SK3_SKFTR0_SKXCCM0_SGRO0_TDMI0_TIN1_TLDS1_TLDSMn1_ULSGRO1_USL1_UIOFGRO0_UPLRP0_USFGRO0_VSn1_VWA2_VWB2_WSGRA0_WSGRB0_WS64_WG16_16_1_WGMn1_WGMXCC8_WGMXCCGn1
    SolutionIndex: 331
    SolutionNameMin: Cijk_Alik_Bljk_BBS_BH_BiasSB_HAS_SAV_UserArgs_MT192x128x64_MI16x16x1_CMS_SN_LDSB0_AFC1_AG1_AFEM1_AFEM1_ASEM1_CLR0_CADS0_DTLA1_DTLB1_DTVA0_DTVB0_DTVMXSA0_DTVMXSB0_DTVSM0_DPLB0_EPS0_ELFLR0_EMLL0_FDSI0_GRPM1_GRVWA8_GRVWB8_GSU0_GSUAMB_GSUC0_GSUWGMRR0_GLS0_ISA950_IU1_K1_LDSTI0_LBSPPA1024_LBSPPB1024_LBSPPM0_LPA32_LPB32_LPM0_LRVW8_LWPMn1_MIAV0_MIWT6_4_MO40_MGRIPM1_NTn1_NTA0_NTB0_NTC0_NTD0_NTM0_NEPBS10_NLCA1_NLCB1_ONLL1_PGR2_PLR1_PKA1_SGROB0_SIA3_SS0_SU16_SUM0_SUS256_SPO0_SRVW0_SSO0_SVW8_SK3_SKFTR0_SKXCCM4_SGRO0_TDMI0_TIN0_TLDS1_TLDSMn1_ULSGRO0_USL1_UIOFGRO0_UPLRP0_USFGRO0_VSn1_VWA2_VWB4_WSGRA0_WSGRB0_WS64_WG32_8_1_WGM4_WGMXCC1_WGMXCCGn1
    SolutionIndex: 332
    SolutionNameMin: Cijk_Alik_Bljk_BBS_BH_BiasSB_HAS_SAV_UserArgs_MT128x96x128_MI16x16x1_SN_LDSB0_AFC1_AG1_AFEM1_AFEM1_ASEM1_CLR0_CADS0_DTLA0_DTLB0_DTVA0_DTVB0_DTVMXSA0_DTVMXSB0_DTVSM0_DPLB0_EPS0_ELFLR0_EMLLn1_FDSI0_GRPM1_GRVWA8_GRVWB8_GSU0_GSUAMB_GSUC0_GSUWGMRR0_GLS0_ISA950_IU1_K1_LDSTI0_LBSPPA1024_LBSPPB256_LBSPPM0_LPA16_LPB16_LPM0_LRVWn1_LWPMn1_MIAV0_MIWT4_3_MO40_MGRIPM1_NTn1_NTA4_NTB0_NTC0_NTD4_NTM0_NEPBS0_NLCA1_NLCB1_ONLL1_PGR2_PLR1_PKA1_SGROB0_SIA3_SS1_SU0_SUM0_SUS0_SPO0_SRVW0_SSO0_SVW4_SK3_SKFTR0_SKXCCM4_SGRO0_TDMI0_TIN1_TLDS2_TLDSMn1_ULSGRO1_USL1_UIOFGRO0_UPLRP0_USFGRO1_VSn1_VWA4_VWB1_WSGRA0_WSGRB2_WS64_WG32_8_1_WGM8_WGMXCC1_WGMXCCGn1
    SolutionIndex: 333
    SolutionNameMin: Cijk_Alik_Bljk_BBS_BH_BiasSB_HAS_SAV_UserArgs_MT96x160x64_MI16x16x1_SN_LDSB0_AFC1_AG0_AFEM1_AFEM1_ASEM1_CLR0_CADS0_DTLA1_DTLB1_DTVA0_DTVB0_DTVMXSA0_DTVMXSB0_DTVSM0_DPLB1_EPS0_ELFLR0_EMLLn1_FDSI0_GRPM1_GRVWA8_GRVWB8_GSU0_GSUAMB_GSUC0_GSUWGMRR0_GLS0_ISA950_IU1_K1_LDSTI0_LBSPPA1024_LBSPPB1024_LBSPPM0_LPA32_LPB32_LPM0_LRVWn1_LWPMn1_MIAV0_MIWT3_5_MO40_MGRIPM1_NTn1_NTA4_NTB0_NTC4_NTD4_NTM0_NEPBS4_NLCA1_NLCB1_ONLL1_PGR3_PLR1_PKA1_SGROB1_SIA3_SS1_SU0_SUM0_SUS0_SPO0_SRVW0_SSO0_SVW1_SK3_SKFTR0_SKXCCM0_SGRO0_TDMI0_TIN1_TLDS1_TLDSMn1_ULSGRO1_USL1_UIOFGRO0_UPLRP0_USFGRO0_VSn1_VWA1_VWB1_WSGRA0_WSGRB0_WS64_WG32_8_1_WGM48_WGMXCC2_WGMXCCGn1
    SolutionIndex: 334
    SolutionNameMin: Cijk_Alik_Bljk_BBS_BH_BiasSB_HAS_SAV_UserArgs_MT128x96x64_MI16x16x1_SN_LDSB0_AFC1_AG1_AFEM1_AFEM1_ASEM1_CLR0_CADS0_DTLA1_DTLB1_DTVA0_DTVB0_DTVMXSA0_DTVMXSB0_DTVSM0_DPLB1_EPS0_ELFLR0_EMLLn1_FDSI0_GRPM1_GRVWA8_GRVWB8_GSU0_GSUAMB_GSUC0_GSUWGMRR0_GLS0_ISA950_IU1_K1_LDSTI0_LBSPPA1024_LBSPPB1024_LBSPPM0_LPA32_LPB32_LPM0_LRVWn1_LWPMn1_MIAV0_MIWT4_3_MO40_MGRIPM1_NTn1_NTA4_NTB0_NTC0_NTD4_NTM0_NEPBS0_NLCA1_NLCB1_ONLL1_PGR3_PLR1_PKA1_SGROB1_SIA3_SS1_SU0_SUM0_SUS0_SPO0_SRVW0_SSO0_SVW4_SK3_SKFTR0_SKXCCM4_SGRO0_TDMI0_TIN1_TLDS1_TLDSMn1_ULSGRO1_USL1_UIOFGRO0_UPLRP0_USFGRO0_VSn1_VWA4_VWB1_WSGRA0_WSGRB0_WS64_WG32_8_1_WGM0_WGMXCC1_WGMXCCGn1
    SolutionIndex: 335
    SolutionNameMin: Cijk_Alik_Bljk_BBS_BH_BiasSB_HAS_SAV_UserArgs_MT128x160x64_MI16x16x1_SN_LDSB0_AFC1_AG1_AFEM1_AFEM1_ASEM1_CLR0_CADS0_DTLA1_DTLB1_DTVA0_DTVB0_DTVMXSA0_DTVMXSB0_DTVSM0_DPLB1_EPS0_ELFLR0_EMLLn1_FDSI0_GRPM1_GRVWA8_GRVWB8_GSU0_GSUAMB_GSUC0_GSUWGMRR0_GLS0_ISA950_IU1_K1_LDSTI0_LBSPPA1024_LBSPPB1024_LBSPPM0_LPA32_LPB32_LPM0_LRVWn1_LWPMn1_MIAV0_MIWT4_5_MO40_MGRIPM1_NTn1_NTA4_NTB0_NTC4_NTD4_NTM0_NEPBS14_NLCA1_NLCB1_ONLL1_PGR3_PLR1_PKA1_SGROB1_SIA3_SS1_SU0_SUM0_SUS0_SPO0_SRVW0_SSO0_SVW4_SK3_SKFTR0_SKXCCM4_SGRO0_TDMI0_TIN1_TLDS2_TLDSMn1_ULSGRO1_USL1_UIOFGRO0_UPLRP0_USFGRO0_VSn1_VWA4_VWB1_WSGRA0_WSGRB0_WS64_WG32_8_1_WGM0_WGMXCC1_WGMXCCGn1
    SolutionIndex: 336
    SolutionNameMin: Cijk_Alik_Bljk_BBS_BH_BiasSB_HAS_SAV_UserArgs_MT192x128x64_MI16x16x1_CMS_SN_LDSB0_AFC1_AG1_AFEM1_AFEM1_ASEM1_CLR1_CADS0_DTLA1_DTLB1_DTVA0_DTVB0_DTVMXSA0_DTVMXSB0_DTVSM0_DPLB0_EPS0_ELFLR0_EMLL0_FDSI0_GRPM1_GRVWA8_GRVWB8_GSU0_GSUAMB_GSUC0_GSUWGMRR0_GLS0_ISA950_IU1_K1_LDSTI0_LBSPPA1024_LBSPPB1024_LBSPPM0_LPA32_LPB32_LPM0_LRVW8_LWPMn1_MIAV0_MIWT6_4_MO40_MGRIPM1_NTn1_NTA0_NTB0_NTC0_NTD0_NTM0_NEPBS8_NLCA1_NLCB1_ONLL1_PGR2_PLR1_PKA1_SGROB0_SIA3_SS0_SU8_SUM0_SUS128_SPO0_SRVW0_SSO1_SVW8_SK3_SKFTR0_SKXCCM4_SGRO0_TDMI0_TIN0_TLDS1_TLDSMn1_ULSGRO0_USL1_UIOFGRO0_UPLRP0_USFGRO0_VSn1_VWA2_VWB4_WSGRA0_WSGRB0_WS64_WG32_8_1_WGM6_WGMXCC1_WGMXCCGn1
    SolutionIndex: 337
    SolutionNameMin: Cijk_Alik_Bljk_BBS_BH_BiasSB_HAS_SAV_UserArgs_MT128x64x128_MI16x16x1_SN_LDSB0_AFC1_AG0_AFEM1_AFEM1_ASEM1_CLR1_CADS0_DTLA1_DTLB1_DTVA0_DTVB0_DTVMXSA0_DTVMXSB0_DTVSM0_DPLB1_EPS0_ELFLR0_EMLLn1_FDSI0_GRPM1_GRVWA8_GRVWB8_GSU0_GSUAMB_GSUC0_GSUWGMRR0_GLS0_ISA950_IU1_K1_LDSTI0_LBSPPA1024_LBSPPB1024_LBSPPM0_LPA16_LPB32_LPM0_LRVWn1_LWPMn1_MIAV0_MIWT8_1_MO40_MGRIPM1_NTn1_NTA4_NTB0_NTC0_NTD4_NTM0_NEPBS12_NLCA1_NLCB1_ONLL1_PGR2_PLR1_PKA1_SGROB1_SIA3_SS1_SU0_SUM0_SUS0_SPO0_SRVW0_SSO1_SVW8_SK3_SKFTR0_SKXCCM4_SGRO0_TDMI0_TIN1_TLDS2_TLDSMn1_ULSGRO1_USL1_UIOFGRO0_UPLRP0_USFGRO0_VSn1_VWA8_VWB1_WSGRA0_WSGRB0_WS64_WG16_16_1_WGM48_WGMXCC1_WGMXCCGn1
    SolutionIndex: 338
    SolutionNameMin: Cijk_Alik_Bljk_BBS_BH_BiasSB_HAS_SAV_UserArgs_MT128x80x128_MI16x16x1_SN_LDSB0_AFC1_AG1_AFEM1_AFEM1_ASEM1_CLR0_CADS0_DTLA0_DTLB0_DTVA0_DTVB0_DTVMXSA0_DTVMXSB0_DTVSM0_DPLB0_EPS0_ELFLR0_EMLLn1_FDSI0_GRPM1_GRVWA8_GRVWB8_GSU0_GSUAMB_GSUC0_GSUWGMRR0_GLS0_ISA950_IU1_K1_LDSTI0_LBSPPA512_LBSPPB256_LBSPPM0_LPA16_LPB16_LPM0_LRVWn1_LWPMn1_MIAV1_MIWT2_5_MO40_MGRIPM1_NTn1_NTA4_NTB0_NTC0_NTD4_NTM0_NEPBS0_NLCA1_NLCB1_ONLL1_PGR2_PLR1_PKA1_SGROB0_SIA3_SS1_SU0_SUM0_SUS0_SPO0_SRVW0_SSO0_SVW2_SK3_SKFTR0_SKXCCM4_SGRO0_TDMI0_TIN1_TLDS1_TLDSMn1_ULSGRO1_USL1_UIOFGRO0_UPLRP0_USFGRO1_VSn1_VWA2_VWB1_WSGRA0_WSGRB0_WS64_WG64_4_1_WGM0_WGMXCC1_WGMXCCGn1
    SolutionIndex: 339
    SolutionNameMin: Cijk_Alik_Bljk_BBS_BH_BiasSB_HAS_SAV_UserArgs_MT256x160x64_MI16x16x1_CMS_SN_LDSB0_AFC1_AG0_AFEM1_AFEM1_ASEM1_CLR0_CADS0_DTLA1_DTLB1_DTVA0_DTVB0_DTVMXSA0_DTVMXSB0_DTVSM0_DPLB0_EPS0_ELFLR0_EMLLn1_FDSI0_GRPM1_GRVWA8_GRVWB8_GSU0_GSUAMB_GSUC0_GSUWGMRR0_GLS0_ISA950_IU1_K1_LDSTI0_LBSPPA1024_LBSPPB1024_LBSPPM0_LPA16_LPB32_LPM0_LRVW8_LWPMn1_MIAV0_MIWT8_5_MO40_MGRIPM1_NTn1_NTA4_NTB0_NTC4_NTD4_NTM0_NEPBS16_NLCA1_NLCB1_ONLL1_PGR2_PLR1_PKA1_SGROB1_SIA3_SS1_SU16_SUM0_SUS128_SPO0_SRVW0_SSO0_SVW8_SK3_SKFTR0_SKXCCM4_SGRO0_TDMI0_TIN0_TLDS1_TLDSMn1_ULSGRO0_USL1_UIOFGRO0_UPLRP0_USFGRO0_VSn1_VWA8_VWB1_WSGRA0_WSGRB0_WS64_WG32_8_1_WGM24_WGMXCC1_WGMXCCGn1
    SolutionIndex: 340
    SolutionNameMin: Cijk_Alik_Bljk_BBS_BH_BiasSB_HAS_SAV_UserArgs_MT128x80x128_MI16x16x1_SN_LDSB0_AFC1_AG0_AFEM1_AFEM1_ASEM1_CLR0_CADS0_DTLA0_DTLB0_DTVA0_DTVB0_DTVMXSA0_DTVMXSB0_DTVSM0_DPLB0_EPS0_ELFLR0_EMLLn1_FDSI0_GRPM1_GRVWA8_GRVWB8_GSU0_GSUAMB_GSUC0_GSUWGMRR0_GLS0_ISA950_IU1_K1_LDSTI0_LBSPPA512_LBSPPB256_LBSPPM0_LPA16_LPB16_LPM0_LRVWn1_LWPMn1_MIAV0_MIWT2_5_MO40_MGRIPM1_NTn1_NTA4_NTB0_NTC0_NTD4_NTM0_NEPBS10_NLCA1_NLCB1_ONLL1_PGR2_PLR1_PKA1_SGROB0_SIA3_SS0_SU0_SUM0_SUS0_SPO0_SRVW0_SSO0_SVW8_SK3_SKFTR0_SKXCCM4_SGRO0_TDMI0_TIN1_TLDS1_TLDSMn1_ULSGRO1_USL1_UIOFGRO0_UPLRP0_USFGRO0_VSn1_VWA2_VWB1_WSGRA0_WSGRB2_WS64_WG64_4_1_WGM32_WGMXCC1_WGMXCCGn1
    SolutionIndex: 341
    SolutionNameMin: Cijk_Alik_Bljk_BBS_BH_BiasSB_HAS_SAV_UserArgs_MT192x128x64_MI16x16x1_CMS_SN_LDSB0_AFC1_AG1_AFEM1_AFEM1_ASEM1_CLR0_CADS0_DTLA1_DTLB1_DTVA0_DTVB0_DTVMXSA0_DTVMXSB0_DTVSM0_DPLB0_EPS0_ELFLR0_EMLLn1_FDSI0_GRPM1_GRVWA8_GRVWB8_GSU0_GSUAMB_GSUC0_GSUWGMRR0_GLS0_ISA950_IU1_K1_LDSTI0_LBSPPA1024_LBSPPB1024_LBSPPM0_LPA32_LPB32_LPM0_LRVW8_LWPMn1_MIAV0_MIWT6_4_MO40_MGRIPM1_NTn1_NTA0_NTB0_NTC0_NTD0_NTM0_NEPBS16_NLCA1_NLCB1_ONLL1_PGR2_PLR1_PKA1_SGROB1_SIA3_SS0_SU8_SUM0_SUS128_SPO0_SRVW0_SSO1_SVW8_SK3_SKFTR0_SKXCCM4_SGRO0_TDMI0_TIN0_TLDS1_TLDSMn1_ULSGRO0_USL1_UIOFGRO0_UPLRP0_USFGRO0_VSn1_VWA2_VWB4_WSGRA0_WSGRB0_WS64_WG32_8_1_WGM4_WGMXCC1_WGMXCCGn1
    SolutionIndex: 342
    SolutionNameMin: Cijk_Alik_Bljk_BBS_BH_BiasSB_HAS_SAV_UserArgs_MT256x160x64_MI16x16x1_CMS_SN_LDSB0_AFC1_AG1_AFEM1_AFEM1_ASEM1_CLR0_CADS0_DTLA1_DTLB1_DTVA0_DTVB0_DTVMXSA0_DTVMXSB0_DTVSM0_DPLB0_EPS0_ELFLR0_EMLL0_FDSI0_GRPM1_GRVWA8_GRVWB8_GSU0_GSUAMB_GSUC0_GSUWGMRR0_GLS0_ISA950_IU1_K1_LDSTI0_LBSPPA1024_LBSPPB1024_LBSPPM0_LPA16_LPB32_LPM0_LRVW8_LWPMn1_MIAV0_MIWT8_5_MO40_MGRIPM1_NTn1_NTA4_NTB0_NTC4_NTD4_NTM0_NEPBS10_NLCA1_NLCB1_ONLL1_PGR2_PLR1_PKA1_SGROB0_SIA3_SS1_SU16_SUM0_SUS128_SPO1_SRVW0_SSO1_SVW8_SK3_SKFTR0_SKXCCM0_SGRO0_TDMI0_TIN0_TLDS1_TLDSMn1_ULSGRO0_USL1_UIOFGRO0_UPLRP0_USFGRO0_VSn1_VWA8_VWB1_WSGRA0_WSGRB0_WS64_WG32_8_1_WGM8_WGMXCC4_WGMXCCGn1
    SolutionIndex: 343
    SolutionNameMin: Cijk_Alik_Bljk_BBS_BH_BiasSB_HAS_SAV_UserArgs_MT256x128x64_MI16x16x1_SN_LDSB0_AFC1_AG1_AFEM1_AFEM1_ASEM1_CLR0_CADS0_DTLA1_DTLB1_DTVA0_DTVB0_DTVMXSA0_DTVMXSB0_DTVSM0_DPLB1_EPS0_ELFLR0_EMLLn1_FDSI0_GRPM1_GRVWA8_GRVWB8_GSU0_GSUAMB_GSUC0_GSUWGMRR0_GLS0_ISA950_IU1_K1_LDSTI0_LBSPPA1024_LBSPPB1024_LBSPPM0_LPA16_LPB32_LPM0_LRVWn1_LWPMn1_MIAV0_MIWT16_2_MO40_MGRIPM1_NTn1_NTA4_NTB0_NTC4_NTD4_NTM0_NEPBS16_NLCA1_NLCB1_ONLL1_PGR2_PLR1_PKA1_SGROB1_SIA3_SS1_SU0_SUM0_SUS0_SPO0_SRVW0_SSO1_SVW8_SK3_SKFTR0_SKXCCM4_SGRO0_TDMI0_TIN1_TLDS1_TLDSMn1_ULSGRO1_USL1_UIOFGRO0_UPLRP0_USFGRO0_VSn1_VWA8_VWB2_WSGRA0_WSGRB0_WS64_WG16_16_1_WGM24_WGMXCC1_WGMXCCGn1
    SolutionIndex: 344
    SolutionNameMin: Cijk_Alik_Bljk_BBS_BH_BiasSB_HAS_SAV_UserArgs_MT128x160x64_MI16x16x1_SN_LDSB0_AFC1_AG1_AFEM1_AFEM1_ASEM1_CLR0_CADS0_DTLA1_DTLB1_DTVA0_DTVB0_DTVMXSA0_DTVMXSB0_DTVSM0_DPLB1_EPS0_ELFLR0_EMLLn1_FDSI0_GRPM1_GRVWA8_GRVWB8_GSU0_GSUAMB_GSUC0_GSUWGMRR0_GLS0_ISA950_IU1_K1_LDSTI0_LBSPPA1024_LBSPPB1024_LBSPPM0_LPA32_LPB32_LPM0_LRVWn1_LWPMn1_MIAV0_MIWT4_5_MO40_MGRIPM1_NTn1_NTA4_NTB0_NTC4_NTD4_NTM0_NEPBS10_NLCA1_NLCB1_ONLL1_PGR3_PLR1_PKA1_SGROB1_SIA3_SS1_SU0_SUM0_SUS0_SPO0_SRVW0_SSO0_SVW4_SK3_SKFTR0_SKXCCM4_SGRO0_TDMI0_TIN1_TLDS2_TLDSMn1_ULSGRO1_USL1_UIOFGRO0_UPLRP0_USFGRO0_VSn1_VWA4_VWB1_WSGRA0_WSGRB0_WS64_WG32_8_1_WGM32_WGMXCC1_WGMXCCGn1
    SolutionIndex: 345
    SolutionNameMin: Cijk_Alik_Bljk_BBS_BH_BiasSB_HAS_SAV_UserArgs_MT192x128x64_MI16x16x1_CMS_SN_LDSB0_AFC1_AG0_AFEM1_AFEM1_ASEM1_CLR0_CADS0_DTLA1_DTLB1_DTVA0_DTVB0_DTVMXSA0_DTVMXSB0_DTVSM0_DPLB0_EPS0_ELFLR0_EMLLn1_FDSI0_GRPM1_GRVWA8_GRVWB8_GSU0_GSUAMB_GSUC0_GSUWGMRR0_GLS0_ISA950_IU1_K1_LDSTI0_LBSPPA1024_LBSPPB1024_LBSPPM0_LPA32_LPB32_LPM0_LRVW8_LWPMn1_MIAV0_MIWT6_4_MO40_MGRIPM1_NTn1_NTA0_NTB0_NTC0_NTD0_NTM0_NEPBS16_NLCA1_NLCB1_ONLL1_PGR2_PLR1_PKA1_SGROB0_SIA3_SS0_SU16_SUM0_SUS256_SPO0_SRVW0_SSO1_SVW8_SK3_SKFTR0_SKXCCM0_SGRO0_TDMI0_TIN0_TLDS1_TLDSMn1_ULSGRO0_USL1_UIOFGRO0_UPLRP0_USFGRO0_VSn1_VWA2_VWB4_WSGRA0_WSGRB0_WS64_WG32_8_1_WGM4_WGMXCC4_WGMXCCGn1
    SolutionIndex: 346
    SolutionNameMin: Cijk_Alik_Bljk_BBS_BH_BiasSB_HAS_SAV_UserArgs_MT128x256x64_MI16x16x1_SN_LDSB0_AFC1_AG1_AFEM1_AFEM1_ASEM1_CLR0_CADS0_DTLA1_DTLB1_DTVA0_DTVB0_DTVMXSA0_DTVMXSB0_DTVSM0_DPLB1_EPS0_ELFLR0_EMLLn1_FDSI0_GRPM1_GRVWA8_GRVWB8_GSU0_GSUAMB_GSUC0_GSUWGMRR0_GLS0_ISA950_IU1_K1_LDSTI0_LBSPPA1024_LBSPPB1024_LBSPPM0_LPA16_LPB32_LPM0_LRVWn1_LWPMn1_MIAV0_MIWT8_4_MO40_MGRIPM1_NTn1_NTA4_NTB0_NTC4_NTD4_NTM0_NEPBS0_NLCA1_NLCB1_ONLL1_PGR2_PLR1_PKA1_SGROB1_SIA3_SS1_SU0_SUM0_SUS0_SPO0_SRVW0_SSO0_SVW8_SK3_SKFTR0_SKXCCM0_SGRO0_TDMI0_TIN1_TLDS1_TLDSMn1_ULSGRO1_USL1_UIOFGRO0_UPLRP0_USFGRO0_VSn1_VWA8_VWB4_WSGRA0_WSGRB0_WS64_WG16_16_1_WGM0_WGMXCC4_WGMXCCGn1
    SolutionIndex: 347
    SolutionNameMin: Cijk_Alik_Bljk_BBS_BH_BiasSB_HAS_SAV_UserArgs_MT128x224x64_MI16x16x1_CMS_SN_LDSB0_AFC1_AG0_AFEM1_AFEM1_ASEM1_CLR0_CADS0_DTLA1_DTLB1_DTVA0_DTVB0_DTVMXSA0_DTVMXSB0_DTVSM0_DPLB0_EPS0_ELFLR0_EMLL0_FDSI0_GRPM1_GRVWA8_GRVWB8_GSU0_GSUAMB_GSUC0_GSUWGMRR0_GLS0_ISA950_IU1_K1_LDSTI0_LBSPPA1024_LBSPPB1024_LBSPPM0_LPA32_LPB32_LPM0_LRVW8_LWPMn1_MIAV0_MIWT4_7_MO40_MGRIPM1_NTn1_NTA4_NTB0_NTC4_NTD4_NTM0_NEPBS0_NLCA1_NLCB1_ONLL1_PGR2_PLR1_PKA1_SGROB1_SIA3_SS1_SU8_SUM0_SUS128_SPO1_SRVW0_SSO1_SVW4_SK3_SKFTR0_SKXCCM8_SGRO0_TDMI0_TIN0_TLDS1_TLDSMn1_ULSGRO0_USL1_UIOFGRO0_UPLRP0_USFGRO0_VSn1_VWA4_VWB1_WSGRA0_WSGRB0_WS64_WG32_8_1_WGM16_WGMXCC1_WGMXCCGn1
    SolutionIndex: 348
    SolutionNameMin: Cijk_Alik_Bljk_BBS_BH_BiasSB_HAS_SAV_UserArgs_MT128x256x64_MI16x16x1_SN_LDSB0_AFC1_AG1_AFEM1_AFEM1_ASEM1_CLR1_CADS0_DTLA1_DTLB1_DTVA0_DTVB0_DTVMXSA0_DTVMXSB0_DTVSM0_DPLB1_EPS0_ELFLR0_EMLLn1_FDSI0_GRPM1_GRVWA8_GRVWB8_GSU0_GSUAMB_GSUC0_GSUWGMRR0_GLS0_ISA950_IU1_K1_LDSTI0_LBSPPA1024_LBSPPB1024_LBSPPM0_LPA16_LPB32_LPM0_LRVWn1_LWPMn1_MIAV0_MIWT8_4_MO40_MGRIPM1_NTn1_NTA4_NTB0_NTC4_NTD4_NTM0_NEPBS14_NLCA1_NLCB1_ONLL1_PGR2_PLR1_PKA1_SGROB1_SIA3_SS1_SU0_SUM0_SUS0_SPO0_SRVW0_SSO0_SVW8_SK3_SKFTR0_SKXCCM0_SGRO0_TDMI0_TIN1_TLDS1_TLDSMn1_ULSGRO1_USL1_UIOFGRO0_UPLRP0_USFGRO0_VSn1_VWA8_VWB4_WSGRA0_WSGRB0_WS64_WG16_16_1_WGM48_WGMXCC4_WGMXCCGn1
    SolutionIndex: 349
    SolutionNameMin: Cijk_Alik_Bljk_BBS_BH_BiasSB_HAS_SAV_UserArgs_MT128x224x64_MI16x16x1_CMS_SN_LDSB0_AFC1_AG0_AFEM1_AFEM1_ASEM1_CLR0_CADS0_DTLA1_DTLB1_DTVA0_DTVB0_DTVMXSA0_DTVMXSB0_DTVSM0_DPLB0_EPS0_ELFLR0_EMLLn1_FDSI0_GRPM1_GRVWA8_GRVWB8_GSU0_GSUAMB_GSUC0_GSUWGMRR0_GLS0_ISA950_IU1_K1_LDSTI0_LBSPPA1024_LBSPPB1024_LBSPPM0_LPA32_LPB32_LPM0_LRVW8_LWPMn1_MIAV0_MIWT4_7_MO40_MGRIPM1_NTn1_NTA4_NTB0_NTC4_NTD4_NTM0_NEPBS12_NLCA1_NLCB1_ONLL1_PGR2_PLR1_PKA1_SGROB0_SIA3_SS1_SU8_SUM0_SUS128_SPO1_SRVW0_SSO0_SVW4_SK3_SKFTR0_SKXCCM4_SGRO0_TDMI0_TIN0_TLDS1_TLDSMn1_ULSGRO0_USL1_UIOFGRO0_UPLRP0_USFGRO0_VSn1_VWA4_VWB1_WSGRA0_WSGRB0_WS64_WG32_8_1_WGM6_WGMXCC1_WGMXCCGn1
    SolutionIndex: 350
    SolutionNameMin: Cijk_Alik_Bljk_BBS_BH_BiasSB_HAS_SAV_UserArgs_MT160x128x128_MI16x16x1_SN_LDSB0_AFC1_AG0_AFEM1_AFEM1_ASEM1_CLR0_CADS0_DTLA0_DTLB0_DTVA0_DTVB0_DTVMXSA0_DTVMXSB0_DTVSM0_DPLB0_EPS0_ELFLR0_EMLLn1_FDSI0_GRPM1_GRVWA8_GRVWB8_GSU0_GSUAMB_GSUC0_GSUWGMRR0_GLS0_ISA950_IU1_K1_LDSTI0_LBSPPA512_LBSPPB512_LBSPPM0_LPA16_LPB16_LPM0_LRVWn1_LWPMn1_MIAV0_MIWT10_2_MO40_MGRIPM1_NTn1_NTA0_NTB0_NTC0_NTD0_NTM0_NEPBS12_NLCA1_NLCB1_ONLL1_PGR2_PLR1_PKA1_SGROB0_SIA3_SS0_SU0_SUM0_SUS0_SPO0_SRVW0_SSO0_SVW8_SK3_SKFTR0_SKXCCM0_SGRO0_TDMI0_TIN1_TLDS1_TLDSMn1_ULSGRO0_USL1_UIOFGRO0_UPLRP0_USFGRO0_VSn1_VWA2_VWB2_WSGRA0_WSGRB0_WS64_WG16_16_1_WGM0_WGMXCC8_WGMXCCGn1
    SolutionIndex: 351
    SolutionNameMin: Cijk_Alik_Bljk_BBS_BH_BiasSB_HAS_SAV_UserArgs_MT128x160x128_MI16x16x1_SN_LDSB0_AFC1_AG1_AFEM1_AFEM1_ASEM1_CLR1_CADS0_DTLA0_DTLB0_DTVA0_DTVB0_DTVMXSA0_DTVMXSB0_DTVSM0_DPLB0_EPS0_ELFLR0_EMLLn1_FDSI0_GRPM1_GRVWA8_GRVWB8_GSU0_GSUAMB_GSUC0_GSUWGMRR0_GLS0_ISA950_IU1_K1_LDSTI0_LBSPPA1024_LBSPPB256_LBSPPM0_LPA16_LPB16_LPM0_LRVWn1_LWPMn1_MIAV0_MIWT4_5_MO40_MGRIPM1_NTn1_NTA0_NTB0_NTC0_NTD4_NTM0_NEPBS0_NLCA1_NLCB1_ONLL1_PGR2_PLR1_PKA1_SGROB0_SIA3_SS1_SU0_SUM0_SUS0_SPO1_SRVW0_SSO0_SVW4_SK3_SKFTR0_SKXCCM4_SGRO0_TDMI0_TIN1_TLDS1_TLDSMn1_ULSGRO1_USL1_UIOFGRO0_UPLRP0_USFGRO0_VSn1_VWA4_VWB1_WSGRA0_WSGRB0_WS64_WG32_8_1_WGM24_WGMXCC1_WGMXCCGn1
    SolutionIndex: 352
    SolutionNameMin: Cijk_Alik_Bljk_BBS_BH_BiasSB_HAS_SAV_UserArgs_MT128x224x64_MI16x16x1_CMS_SN_LDSB0_AFC1_AG1_AFEM1_AFEM1_ASEM1_CLR1_CADS0_DTLA1_DTLB1_DTVA0_DTVB0_DTVMXSA0_DTVMXSB0_DTVSM0_DPLB0_EPS0_ELFLR0_EMLL0_FDSI0_GRPM1_GRVWA8_GRVWB8_GSU0_GSUAMB_GSUC0_GSUWGMRR0_GLS0_ISA950_IU1_K1_LDSTI0_LBSPPA1024_LBSPPB1024_LBSPPM0_LPA32_LPB32_LPM0_LRVW8_LWPMn1_MIAV0_MIWT4_7_MO40_MGRIPM1_NTn1_NTA4_NTB0_NTC4_NTD4_NTM0_NEPBS10_NLCA1_NLCB1_ONLL1_PGR2_PLR1_PKA1_SGROB0_SIA3_SS1_SU0_SUM0_SUS128_SPO0_SRVW0_SSO0_SVW4_SK3_SKFTR0_SKXCCM4_SGRO0_TDMI0_TIN0_TLDS1_TLDSMn1_ULSGRO0_USL1_UIOFGRO0_UPLRP0_USFGRO0_VSn1_VWA4_VWB1_WSGRA0_WSGRB0_WS64_WG32_8_1_WGM24_WGMXCC1_WGMXCCGn1
    SolutionIndex: 353
    SolutionNameMin: Cijk_Alik_Bljk_BBS_BH_BiasSB_HAS_SAV_UserArgs_MT128x64x128_MI16x16x1_SN_LDSB0_AFC1_AG0_AFEM1_AFEM1_ASEM1_CLR1_CADS0_DTLA1_DTLB1_DTVA0_DTVB0_DTVMXSA0_DTVMXSB0_DTVSM0_DPLB1_EPS0_ELFLR0_EMLL0_FDSI0_GRPM1_GRVWA8_GRVWB8_GSU0_GSUAMB_GSUC0_GSUWGMRR0_GLS0_ISA950_IU1_K1_LDSTI0_LBSPPA1024_LBSPPB1024_LBSPPM0_LPA32_LPB16_LPM0_LRVWn1_LWPMn1_MIAV0_MIWT2_4_MO40_MGRIPM1_NTn1_NTA4_NTB0_NTC0_NTD4_NTM0_NEPBS4_NLCA1_NLCB1_ONLL1_PGR2_PLR1_PKA1_SGROB1_SIA3_SS0_SU0_SUM0_SUS0_SPO0_SRVW0_SSO0_SVW8_SK3_SKFTR0_SKXCCM4_SGRO0_TDMI0_TIN1_TLDS1_TLDSMn1_ULSGRO0_USL1_UIOFGRO0_UPLRP0_USFGRO0_VSn1_VWA2_VWB4_WSGRA0_WSGRB0_WS64_WG64_4_1_WGM48_WGMXCC1_WGMXCCGn1
- - - [43008, 400, 1, 5376]
    - [0, 0.0]
  - - [5376, 32, 1, 21504]
    - [1, 0.0]
  - - [5376, 24, 1, 21504]
    - [2, 0.0]
  - - [8192, 400, 1, 5376]
    - [3, 0.0]
  - - [8192, 336, 1, 5376]
    - [4, 0.0]
  - - [8192, 368, 1, 5376]
    - [5, 0.0]
  - - [8192, 352, 1, 5376]
    - [6, 0.0]
  - - [8192, 384, 1, 5376]
    - [7, 0.0]
  - - [43008, 368, 1, 5376]
    - [8, 0.0]
  - - [5376, 512, 1, 4096]
    - [9, 0.0]
  - - [8192, 248, 1, 5376]
    - [10, 0.0]
  - - [8192, 256, 1, 5376]
    - [11, 0.0]
  - - [8192, 240, 1, 5376]
    - [12, 0.0]
  - - [8192, 232, 1, 5376]
    - [13, 0.0]
  - - [8192, 224, 1, 5376]
    - [14, 0.0]
  - - [8192, 208, 1, 5376]
    - [15, 0.0]
  - - [8192, 216, 1, 5376]
    - [16, 0.0]
  - - [8192, 200, 1, 5376]
    - [17, 0.0]
  - - [43008, 304, 1, 5376]
    - [18, 0.0]
  - - [5376, 496, 1, 4096]
    - [19, 0.0]
  - - [8192, 192, 1, 5376]
    - [20, 0.0]
  - - [43008, 320, 1, 5376]
    - [21, 0.0]
  - - [5376, 400, 1, 4096]
    - [22, 0.0]
  - - [8192, 168, 1, 5376]
    - [23, 0.0]
  - - [8192, 184, 1, 5376]
    - [24, 0.0]
  - - [8192, 176, 1, 5376]
    - [25, 0.0]
  - - [5376, 368, 1, 4096]
    - [26, 0.0]
  - - [5376, 384, 1, 4096]
    - [27, 0.0]
  - - [5376, 336, 1, 4096]
    - [28, 0.0]
  - - [5376, 256, 1, 4096]
    - [29, 0.0]
  - - [5376, 352, 1, 4096]
    - [30, 0.0]
  - - [5376, 248, 1, 4096]
    - [31, 0.0]
  - - [43008, 336, 1, 5376]
    - [32, 0.0]
  - - [8192, 152, 1, 5376]
    - [33, 0.0]
  - - [8192, 160, 1, 5376]
    - [34, 0.0]
  - - [8192, 136, 1, 5376]
    - [35, 0.0]
  - - [5376, 304, 1, 4096]
    - [36, 0.0]
  - - [8192, 128, 1, 5376]
    - [37, 0.0]
  - - [43008, 352, 1, 5376]
    - [38, 0.0]
  - - [8192, 88, 1, 5376]
    - [39, 0.0]
  - - [8192, 120, 1, 5376]
    - [40, 0.0]
  - - [8192, 96, 1, 5376]
    - [41, 0.0]
  - - [8192, 112, 1, 5376]
    - [42, 0.0]
  - - [8192, 104, 1, 5376]
    - [43, 0.0]
  - - [8192, 24, 1, 5376]
    - [44, 0.0]
  - - [5376, 272, 1, 4096]
    - [45, 0.0]
  - - [5376, 288, 1, 4096]
    - [46, 0.0]
  - - [8192, 8, 1, 5376]
    - [47, 0.0]
  - - [5376, 136, 1, 4096]
    - [48, 0.0]
  - - [5376, 144, 1, 4096]
    - [49, 0.0]
  - - [5376, 24, 1, 4096]
    - [50, 0.0]
  - - [5376, 32, 1, 4096]
    - [51, 0.0]
  - - [43008, 432, 1, 5376]
    - [52, 0.0]
  - - [5376, 216, 1, 4096]
    - [53, 0.0]
  - - [5376, 240, 1, 4096]
    - [54, 0.0]
  - - [5376, 232, 1, 4096]
    - [55, 0.0]
  - - [43008, 56, 1, 5376]
    - [56, 0.0]
  - - [5376, 152, 1, 4096]
    - [57, 0.0]
  - - [5376, 160, 1, 4096]
    - [58, 0.0]
  - - [5376, 168, 1, 4096]
    - [59, 0.0]
  - - [5376, 184, 1, 4096]
    - [60, 0.0]
  - - [5376, 192, 1, 4096]
    - [61, 0.0]
  - - [5376, 176, 1, 4096]
    - [62, 0.0]
  - - [5376, 48, 1, 4096]
    - [63, 0.0]
  - - [5376, 40, 1, 4096]
    - [64, 0.0]
  - - [5376, 88, 1, 4096]
    - [65, 0.0]
  - - [5376, 96, 1, 4096]
    - [66, 0.0]
  - - [43008, 384, 1, 5376]
    - [67, 0.0]
  - - [5376, 120, 1, 4096]
    - [68, 0.0]
  - - [5376, 112, 1, 4096]
    - [69, 0.0]
  - - [5376, 128, 1, 4096]
    - [70, 0.0]
  - - [5376, 104, 1, 4096]
    - [71, 0.0]
  - - [5376, 72, 1, 4096]
    - [72, 0.0]
  - - [5376, 56, 1, 4096]
    - [73, 0.0]
  - - [5376, 64, 1, 4096]
    - [74, 0.0]
  - - [5376, 16, 1, 4096]
    - [75, 0.0]
  - - [5376, 8, 1, 4096]
    - [76, 0.0]
  - - [5376, 2048, 1, 21504]
    - [77, 0.0]
  - - [43008, 288, 1, 5376]
    - [78, 0.0]
  - - [43008, 232, 1, 5376]
    - [79, 0.0]
  - - [43008, 240, 1, 5376]
    - [80, 0.0]
  - - [5376, 512, 1, 21504]
    - [81, 0.0]
  - - [43008, 104, 1, 5376]
    - [82, 0.0]
  - - [43008, 248, 1, 5376]
    - [83, 0.0]
  - - [43008, 184, 1, 5376]
    - [84, 0.0]
  - - [43008, 192, 1, 5376]
    - [85, 0.0]
  - - [43008, 176, 1, 5376]
    - [86, 0.0]
  - - [43008, 168, 1, 5376]
    - [87, 0.0]
  - - [43008, 256, 1, 5376]
    - [88, 0.0]
  - - [5376, 368, 1, 21504]
    - [89, 0.0]
  - - [5376, 352, 1, 21504]
    - [90, 0.0]
  - - [5376, 384, 1, 21504]
    - [91, 0.0]
  - - [5376, 336, 1, 21504]
    - [92, 0.0]
  - - [43008, 128, 1, 5376]
    - [93, 0.0]
  - - [5376, 480, 1, 21504]
    - [94, 0.0]
  - - [5376, 464, 1, 21504]
    - [95, 0.0]
  - - [43008, 224, 1, 5376]
    - [96, 0.0]
  - - [5376, 2048, 1, 4096]
    - [97, 0.0]
  - - [43008, 216, 1, 5376]
    - [98, 0.0]
  - - [43008, 200, 1, 5376]
    - [99, 0.0]
  - - [43008, 208, 1, 5376]
    - [100, 0.0]
  - - [5376, 496, 1, 21504]
    - [101, 0.0]
  - - [43008, 152, 1, 5376]
    - [102, 0.0]
  - - [43008, 144, 1, 5376]
    - [103, 0.0]
  - - [43008, 160, 1, 5376]
    - [104, 0.0]
  - - [43008, 136, 1, 5376]
    - [105, 0.0]
  - - [5376, 416, 1, 21504]
    - [106, 0.0]
  - - [5376, 400, 1, 21504]
    - [107, 0.0]
  - - [43008, 512, 1, 5376]
    - [108, 0.0]
  - - [5376, 304, 1, 21504]
    - [109, 0.0]
  - - [5376, 320, 1, 21504]
    - [110, 0.0]
  - - [43008, 80, 1, 5376]
    - [111, 0.0]
  - - [43008, 72, 1, 5376]
    - [112, 0.0]
  - - [43008, 112, 1, 5376]
    - [113, 0.0]
  - - [43008, 120, 1, 5376]
    - [114, 0.0]
  - - [43008, 88, 1, 5376]
    - [115, 0.0]
  - - [43008, 96, 1, 5376]
    - [116, 0.0]
  - - [43008, 496, 1, 5376]
    - [117, 0.0]
  - - [43008, 48, 1, 5376]
    - [118, 0.0]
  - - [43008, 40, 1, 5376]
    - [119, 0.0]
  - - [43008, 64, 1, 5376]
    - [120, 0.0]
  - - [43008, 32, 1, 5376]
    - [121, 0.0]
  - - [43008, 8, 1, 5376]
    - [122, 0.0]
  - - [43008, 24, 1, 5376]
    - [123, 0.0]
  - - [5376, 288, 1, 21504]
    - [124, 0.0]
  - - [5376, 272, 1, 21504]
    - [125, 0.0]
  - - [8192, 512, 1, 5376]
    - [126, 0.0]
  - - [8192, 496, 1, 5376]
    - [127, 0.0]
  - - [8192, 480, 1, 5376]
    - [128, 0.0]
  - - [8192, 464, 1, 5376]
    - [129, 0.0]
  - - [5376, 232, 1, 21504]
    - [130, 0.0]
  - - [5376, 240, 1, 21504]
    - [131, 0.0]
  - - [5376, 256, 1, 21504]
    - [132, 0.0]
  - - [5376, 200, 1, 21504]
    - [133, 0.0]
  - - [5376, 208, 1, 21504]
    - [134, 0.0]
  - - [5376, 192, 1, 21504]
    - [135, 0.0]
  - - [5376, 184, 1, 21504]
    - [136, 0.0]
  - - [5376, 112, 1, 21504]
    - [137, 0.0]
  - - [5376, 104, 1, 21504]
    - [138, 0.0]
  - - [5376, 152, 1, 21504]
    - [139, 0.0]
  - - [43008, 416, 1, 5376]
    - [140, 0.0]
  - - [5376, 96, 1, 21504]
    - [141, 0.0]
  - - [5376, 88, 1, 21504]
    - [142, 0.0]
  - - [5376, 56, 1, 21504]
    - [143, 0.0]
  - - [5376, 64, 1, 21504]
    - [144, 0.0]
  - - [5120, 416, 1, 2880]
    - [145, 0.0]
  - - [5120, 608, 1, 2880]
    - [146, 0.0]
  - - [5120, 592, 1, 2880]
    - [147, 0.0]
  - - [5120, 152, 1, 2880]
    - [148, 0.0]
  - - [2880, 832, 1, 4096]
    - [149, 0.0]
  - - [2880, 800, 1, 4096]
    - [150, 0.0]
  - - [5120, 144, 1, 2880]
    - [151, 0.0]
  - - [2880, 864, 1, 4096]
    - [152, 0.0]
  - - [5120, 160, 1, 2880]
    - [153, 0.0]
  - - [2880, 752, 1, 4096]
    - [154, 0.0]
  - - [2880, 704, 1, 4096]
    - [155, 0.0]
  - - [5120, 784, 1, 2880]
    - [156, 0.0]
  - - [2880, 720, 1, 4096]
    - [157, 0.0]
  - - [5120, 112, 1, 2880]
    - [158, 0.0]
  - - [5120, 128, 1, 2880]
    - [159, 0.0]
  - - [5120, 120, 1, 2880]
    - [160, 0.0]
  - - [2880, 736, 1, 4096]
    - [161, 0.0]
  - - [2880, 624, 1, 4096]
    - [162, 0.0]
  - - [5120, 104, 1, 2880]
    - [163, 0.0]
  - - [2880, 152, 1, 4096]
    - [164, 0.0]
  - - [5120, 544, 1, 2880]
    - [165, 0.0]
  - - [2880, 656, 1, 4096]
    - [166, 0.0]
  - - [2880, 248, 1, 4096]
    - [167, 0.0]
  - - [2880, 688, 1, 4096]
    - [168, 0.0]
  - - [2880, 672, 1, 4096]
    - [169, 0.0]
  - - [2880, 176, 1, 4096]
    - [170, 0.0]
  - - [2880, 528, 1, 4096]
    - [171, 0.0]
  - - [5120, 96, 1, 2880]
    - [172, 0.0]
  - - [5120, 88, 1, 2880]
    - [173, 0.0]
  - - [5120, 72, 1, 2880]
    - [174, 0.0]
  - - [5120, 560, 1, 2880]
    - [175, 0.0]
  - - [5120, 64, 1, 2880]
    - [176, 0.0]
  - - [2880, 288, 1, 4096]
    - [177, 0.0]
  - - [5120, 576, 1, 2880]
    - [178, 0.0]
  - - [5120, 56, 1, 2880]
    - [179, 0.0]
  - - [5120, 80, 1, 2880]
    - [180, 0.0]
  - - [2880, 160, 1, 4096]
    - [181, 0.0]
  - - [5120, 40, 1, 2880]
    - [182, 0.0]
  - - [5120, 48, 1, 2880]
    - [183, 0.0]
  - - [5120, 24, 1, 2880]
    - [184, 0.0]
  - - [5120, 32, 1, 2880]
    - [185, 0.0]
  - - [2880, 320, 1, 4096]
    - [186, 0.0]
  - - [2880, 640, 1, 4096]
    - [187, 0.0]
  - - [5120, 16, 1, 2880]
    - [188, 0.0]
  - - [5120, 8, 1, 2880]
    - [189, 0.0]
  - - [2880, 112, 1, 4096]
    - [190, 0.0]
  - - [2880, 104, 1, 4096]
    - [191, 0.0]
  - - [2880, 128, 1, 4096]
    - [192, 0.0]
  - - [2880, 72, 1, 4096]
    - [193, 0.0]
  - - [2880, 88, 1, 4096]
    - [194, 0.0]
  - - [2880, 304, 1, 4096]
    - [195, 0.0]
  - - [2880, 96, 1, 4096]
    - [196, 0.0]
  - - [2880, 40, 1, 4096]
    - [197, 0.0]
  - - [2880, 80, 1, 4096]
    - [198, 0.0]
  - - [128, 432, 1, 2880]
    - [199, 0.0]
  - - [2880, 56, 1, 4096]
    - [200, 0.0]
  - - [128, 480, 1, 2880]
    - [201, 0.0]
  - - [128, 288, 1, 2880]
    - [202, 0.0]
  - - [128, 512, 1, 2880]
    - [203, 0.0]
  - - [128, 272, 1, 2880]
    - [204, 0.0]
  - - [2880, 64, 1, 4096]
    - [205, 0.0]
  - - [128, 304, 1, 2880]
    - [206, 0.0]
  - - [128, 336, 1, 2880]
    - [207, 0.0]
  - - [128, 320, 1, 2880]
    - [208, 0.0]
  - - [2880, 24, 1, 4096]
    - [209, 0.0]
  - - [2880, 32, 1, 4096]
    - [210, 0.0]
  - - [128, 144, 1, 2880]
    - [211, 0.0]
  - - [2880, 912, 1, 4096]
    - [212, 0.0]
  - - [128, 152, 1, 2880]
    - [213, 0.0]
  - - [128, 160, 1, 2880]
    - [214, 0.0]
  - - [128, 136, 1, 2880]
    - [215, 0.0]
  - - [128, 352, 1, 2880]
    - [216, 0.0]
  - - [128, 416, 1, 2880]
    - [217, 0.0]
  - - [128, 448, 1, 2880]
    - [218, 0.0]
  - - [128, 464, 1, 2880]
    - [219, 0.0]
  - - [2880, 16, 1, 4096]
    - [220, 0.0]
  - - [128, 400, 1, 2880]
    - [221, 0.0]
  - - [5120, 336, 1, 2880]
    - [222, 0.0]
  - - [128, 496, 1, 2880]
    - [223, 0.0]
  - - [2880, 8, 1, 4096]
    - [224, 0.0]
  - - [128, 384, 1, 2880]
    - [225, 0.0]
  - - [128, 368, 1, 2880]
    - [226, 0.0]
  - - [128, 224, 1, 2880]
    - [227, 0.0]
  - - [128, 216, 1, 2880]
    - [228, 0.0]
  - - [128, 248, 1, 2880]
    - [229, 0.0]
  - - [128, 192, 1, 2880]
    - [230, 0.0]
  - - [128, 176, 1, 2880]
    - [231, 0.0]
  - - [128, 200, 1, 2880]
    - [232, 0.0]
  - - [2880, 272, 1, 4096]
    - [233, 0.0]
  - - [128, 208, 1, 2880]
    - [234, 0.0]
  - - [128, 184, 1, 2880]
    - [235, 0.0]
  - - [128, 256, 1, 2880]
    - [236, 0.0]
  - - [128, 232, 1, 2880]
    - [237, 0.0]
  - - [128, 168, 1, 2880]
    - [238, 0.0]
  - - [128, 240, 1, 2880]
    - [239, 0.0]
  - - [128, 64, 1, 2880]
    - [240, 0.0]
  - - [128, 128, 1, 2880]
    - [241, 0.0]
  - - [128, 112, 1, 2880]
    - [242, 0.0]
  - - [128, 120, 1, 2880]
    - [243, 0.0]
  - - [2880, 232, 1, 4096]
    - [244, 0.0]
  - - [128, 104, 1, 2880]
    - [245, 0.0]
  - - [128, 88, 1, 2880]
    - [246, 0.0]
  - - [128, 96, 1, 2880]
    - [247, 0.0]
  - - [128, 16, 1, 2880]
    - [248, 0.0]
  - - [128, 8, 1, 2880]
    - [249, 0.0]
  - - [128, 672, 1, 2880]
    - [250, 0.0]
  - - [128, 608, 1, 2880]
    - [251, 0.0]
  - - [128, 544, 1, 2880]
    - [252, 0.0]
  - - [128, 656, 1, 2880]
    - [253, 0.0]
  - - [128, 560, 1, 2880]
    - [254, 0.0]
  - - [5120, 368, 1, 2880]
    - [255, 0.0]
  - - [128, 592, 1, 2880]
    - [256, 0.0]
  - - [128, 624, 1, 2880]
    - [257, 0.0]
  - - [128, 576, 1, 2880]
    - [258, 0.0]
  - - [128, 80, 1, 2880]
    - [259, 0.0]
  - - [128, 640, 1, 2880]
    - [260, 0.0]
  - - [128, 528, 1, 2880]
    - [261, 0.0]
  - - [128, 24, 1, 2880]
    - [262, 0.0]
  - - [128, 56, 1, 2880]
    - [263, 0.0]
  - - [128, 32, 1, 2880]
    - [264, 0.0]
  - - [128, 48, 1, 2880]
    - [265, 0.0]
  - - [5120, 352, 1, 2880]
    - [266, 0.0]
  - - [128, 40, 1, 2880]
    - [267, 0.0]
  - - [128, 72, 1, 2880]
    - [268, 0.0]
  - - [128, 928, 1, 2880]
    - [269, 0.0]
  - - [128, 944, 1, 2880]
    - [270, 0.0]
  - - [128, 912, 1, 2880]
    - [271, 0.0]
  - - [128, 880, 1, 2880]
    - [272, 0.0]
  - - [128, 864, 1, 2880]
    - [273, 0.0]
  - - [128, 704, 1, 2880]
    - [274, 0.0]
  - - [128, 768, 1, 2880]
    - [275, 0.0]
  - - [128, 784, 1, 2880]
    - [276, 0.0]
  - - [2880, 256, 1, 4096]
    - [277, 0.0]
  - - [128, 816, 1, 2880]
    - [278, 0.0]
  - - [128, 752, 1, 2880]
    - [279, 0.0]
  - - [128, 832, 1, 2880]
    - [280, 0.0]
  - - [128, 848, 1, 2880]
    - [281, 0.0]
  - - [128, 800, 1, 2880]
    - [282, 0.0]
  - - [128, 720, 1, 2880]
    - [283, 0.0]
  - - [128, 976, 1, 2880]
    - [284, 0.0]
  - - [128, 1024, 1, 2880]
    - [285, 0.0]
  - - [128, 736, 1, 2880]
    - [286, 0.0]
  - - [128, 896, 1, 2880]
    - [287, 0.0]
  - - [2880, 240, 1, 4096]
    - [288, 0.0]
  - - [128, 992, 1, 2880]
    - [289, 0.0]
  - - [128, 1008, 1, 2880]
    - [290, 0.0]
  - - [128, 960, 1, 2880]
    - [291, 0.0]
  - - [128, 688, 1, 2880]
    - [292, 0.0]
  - - [5120, 384, 1, 2880]
    - [293, 0.0]
  - - [2880, 216, 1, 4096]
    - [294, 0.0]
  - - [2880, 200, 1, 4096]
    - [295, 0.0]
  - - [2880, 208, 1, 4096]
    - [296, 0.0]
  - - [2880, 464, 1, 4096]
    - [297, 0.0]
  - - [128, 2048, 1, 2880]
    - [298, 0.0]
  - - [5120, 304, 1, 2880]
    - [299, 0.0]
  - - [5120, 224, 1, 2880]
    - [300, 0.0]
  - - [5120, 1024, 1, 2880]
    - [301, 0.0]
  - - [5120, 320, 1, 2880]
    - [302, 0.0]
  - - [5120, 288, 1, 2880]
    - [303, 0.0]
  - - [5120, 992, 1, 2880]
    - [304, 0.0]
  - - [5120, 1008, 1, 2880]
    - [305, 0.0]
  - - [5120, 216, 1, 2880]
    - [306, 0.0]
  - - [5120, 272, 1, 2880]
    - [307, 0.0]
  - - [5120, 512, 1, 2880]
    - [308, 0.0]
  - - [5120, 912, 1, 2880]
    - [309, 0.0]
  - - [5120, 864, 1, 2880]
    - [310, 0.0]
  - - [5120, 832, 1, 2880]
    - [311, 0.0]
  - - [5120, 896, 1, 2880]
    - [312, 0.0]
  - - [5120, 200, 1, 2880]
    - [313, 0.0]
  - - [5120, 480, 1, 2880]
    - [314, 0.0]
  - - [5120, 944, 1, 2880]
    - [315, 0.0]
  - - [5120, 976, 1, 2880]
    - [316, 0.0]
  - - [2880, 976, 1, 4096]
    - [317, 0.0]
  - - [5120, 928, 1, 2880]
    - [318, 0.0]
  - - [5120, 960, 1, 2880]
    - [319, 0.0]
  - - [5120, 880, 1, 2880]
    - [320, 0.0]
  - - [5120, 848, 1, 2880]
    - [321, 0.0]
  - - [5120, 816, 1, 2880]
    - [322, 0.0]
  - - [2880, 896, 1, 4096]
    - [323, 0.0]
  - - [5120, 800, 1, 2880]
    - [324, 0.0]
  - - [5120, 496, 1, 2880]
    - [325, 0.0]
  - - [2880, 944, 1, 4096]
    - [326, 0.0]
  - - [2880, 144, 1, 4096]
    - [327, 0.0]
  - - [5120, 256, 1, 2880]
    - [328, 0.0]
  - - [2880, 960, 1, 4096]
    - [329, 0.0]
  - - [2880, 224, 1, 4096]
    - [330, 0.0]
  - - [2880, 1008, 1, 4096]
    - [331, 0.0]
  - - [5120, 248, 1, 2880]
    - [332, 0.0]
  - - [2880, 136, 1, 4096]
    - [333, 0.0]
  - - [5120, 232, 1, 2880]
    - [334, 0.0]
  - - [5120, 400, 1, 2880]
    - [335, 0.0]
  - - [2880, 928, 1, 4096]
    - [336, 0.0]
  - - [5120, 168, 1, 2880]
    - [337, 0.0]
  - - [5120, 240, 1, 2880]
    - [338, 0.0]
  - - [5120, 752, 1, 2880]
    - [339, 0.0]
  - - [5120, 208, 1, 2880]
    - [340, 0.0]
  - - [2880, 992, 1, 4096]
    - [341, 0.0]
  - - [5120, 704, 1, 2880]
    - [342, 0.0]
  - - [5120, 736, 1, 2880]
    - [343, 0.0]
  - - [5120, 464, 1, 2880]
    - [344, 0.0]
  - - [2880, 1024, 1, 4096]
    - [345, 0.0]
  - - [5120, 720, 1, 2880]
    - [346, 0.0]
  - - [5120, 672, 1, 2880]
    - [347, 0.0]
  - - [5120, 688, 1, 2880]
    - [348, 0.0]
  - - [5120, 640, 1, 2880]
    - [349, 0.0]
  - - [2880, 880, 1, 4096]
    - [350, 0.0]
  - - [2880, 784, 1, 4096]
    - [351, 0.0]
  - - [5120, 656, 1, 2880]
    - [352, 0.0]
  - - [5120, 176, 1, 2880]
    - [353, 0.0]
