projects/hipblaslt/library/src/amd_detail/rocblaslt/src/Tensile/Logic/asm_full/aquavanjaram/gfx942_20cu/StreamK/aquavanjaram942_Cijk_Ailk_Bjlk_I8_BH_UserArgs.yaml
- {MinimumRequiredVersion: 5.0.0}
- aquavanjaram942
- {Architecture: gfx942, CUCount: 20}
- [Device 0049, Device 0050]
    SolutionIndex: 0
    SolutionNameMin: Cijk_Ailk_Bjlk_I8_BH_UserArgs_MT256x256x32_MI16x16x1_SN_LDSB0_AFC0_AFEM1_AFEM1_ASEM1_CLR0_CADS0_DTVA0_DTVB0_EPS0_FDSI0_GRPM1_GRVWA4_GRVWB4_GSU0_GSUAMB_GSUC0_GSUWGMRR0_GLS0_ISA942_IU1_K1_LBSPPA2048_LBSPPB2048_LBSPPM0_LPA64_LPB64_LPM0_LRVW8_LWPMn1_MIAV0_MIWT8_8_MO40_NTn1_NTA0_NTB0_NTC0_NTD0_NTM0_NEPBS0_NLCA1_NLCB1_ONLL1_PGR2_PLR0_PKA1_SIA3_SS1_SU0_SUM0_SUS32_SPO0_SRVW0_SSO0_SVW4_SK3_SKXCCM8_TLDS0_ULSGRO0_USL1_UIOFGRO0_USFGRO0_VSn1_VWA4_VWB4_WSGRA0_WSGRB0_WS64_WG32_8_1_WGM1_WGMXCC1_WGMXCCGn1
    SolutionIndex: 1
    SolutionNameMin: Cijk_Ailk_Bjlk_I8_BH_UserArgs_MT256x256x32_MI16x16x1_SN_LDSB0_AFC0_AFEM1_AFEM1_ASEM1_CLR0_CADS0_DTVA0_DTVB0_EPS0_FDSI0_GRPM1_GRVWA4_GRVWB8_GSU0_GSUAMB_GSUC0_GSUWGMRR0_GLS0_ISA942_IU1_K1_LBSPPA2048_LBSPPB2048_LBSPPM0_LPA64_LPB64_LPM0_LRVW8_LWPMn1_MIAV0_MIWT8_8_MO40_NTn1_NTA0_NTB0_NTC0_NTD0_NTM0_NEPBS0_NLCA1_NLCB1_ONLL1_PGR2_PLR0_PKA1_SIA3_SS1_SU0_SUM0_SUS32_SPO0_SRVW0_SSO0_SVW4_SK3_SKXCCM8_TLDS0_ULSGRO0_USL1_UIOFGRO0_USFGRO0_VSn1_VWA4_VWB4_WSGRA0_WSGRB0_WS64_WG32_8_1_WGM1_WGMXCC1_WGMXCCGn1
    SolutionIndex: 2
    SolutionNameMin: Cijk_Ailk_Bjlk_I8_BH_UserArgs_MT128x256x32_MI16x16x1_SN_LDSB0_AFC0_AFEM1_AFEM1_ASEM1_CLR0_CADS0_DTVA0_DTVB0_EPS0_FDSI0_GRPM1_GRVWA4_GRVWB4_GSU0_GSUAMB_GSUC0_GSUWGMRR0_GLS0_ISA942_IU1_K1_LBSPPA1024_LBSPPB2048_LBSPPM0_LPA64_LPB64_LPM0_LRVW8_LWPMn1_MIAV0_MIWT4_8_MO40_NTn1_NTA0_NTB0_NTC0_NTD0_NTM0_NEPBS0_NLCA1_NLCB1_ONLL1_PGR2_PLR0_PKA1_SIA3_SS1_SU0_SUM0_SUS32_SPO0_SRVW0_SSO0_SVW4_SK3_SKXCCM8_TLDS0_ULSGRO0_USL1_UIOFGRO0_USFGRO0_VSn1_VWA4_VWB4_WSGRA0_WSGRB0_WS64_WG32_8_1_WGM1_WGMXCC1_WGMXCCGn1
    SolutionIndex: 3
    SolutionNameMin: Cijk_Ailk_Bjlk_I8_BH_UserArgs_MT256x128x32_MI16x16x1_SN_LDSB0_AFC0_AFEM1_AFEM1_ASEM1_CLR0_CADS0_DTVA0_DTVB0_EPS0_FDSI0_GRPM1_GRVWA4_GRVWB4_GSU0_GSUAMB_GSUC0_GSUWGMRR0_GLS0_ISA942_IU1_K1_LBSPPA2048_LBSPPB1024_LBSPPM0_LPA64_LPB64_LPM0_LRVW8_LWPMn1_MIAV0_MIWT8_4_MO40_NTn1_NTA0_NTB0_NTC0_NTD0_NTM0_NEPBS0_NLCA1_NLCB1_ONLL1_PGR2_PLR0_PKA1_SIA3_SS1_SU0_SUM0_SUS32_SPO0_SRVW0_SSO0_SVW4_SK3_SKXCCM8_TLDS0_ULSGRO0_USL1_UIOFGRO0_USFGRO0_VSn1_VWA4_VWB4_WSGRA0_WSGRB0_WS64_WG32_8_1_WGM1_WGMXCC1_WGMXCCGn1
    SolutionIndex: 4
    SolutionNameMin: Cijk_Ailk_Bjlk_I8_BH_UserArgs_MT128x128x32_MI16x16x1_SN_LDSB0_AFC0_AFEM1_AFEM1_ASEM1_CLR0_CADS0_DTVA0_DTVB0_EPS0_FDSI0_GRPM1_GRVWA4_GRVWB4_GSU0_GSUAMB_GSUC0_GSUWGMRR0_GLS0_ISA942_IU1_K1_LBSPPA1024_LBSPPB1024_LBSPPM0_LPA64_LPB64_LPM0_LRVW8_LWPMn1_MIAV0_MIWT4_4_MO40_NTn1_NTA0_NTB0_NTC0_NTD0_NTM0_NEPBS0_NLCA1_NLCB1_ONLL1_PGR2_PLR0_PKA1_SIA3_SS1_SU0_SUM0_SUS32_SPO0_SRVW0_SSO0_SVW4_SK3_SKXCCM8_TLDS0_ULSGRO0_USL1_UIOFGRO0_USFGRO0_VSn1_VWA4_VWB4_WSGRA0_WSGRB0_WS64_WG32_8_1_WGM1_WGMXCC1_WGMXCCGn1
    SolutionIndex: 5
    SolutionNameMin: Cijk_Ailk_Bjlk_I8_BH_UserArgs_MT128x128x32_MI16x16x1_SN_LDSB0_AFC0_AFEM1_AFEM1_ASEM1_CLR0_CADS0_DTVA0_DTVB0_EPS0_FDSI0_GRPM1_GRVWA4_GRVWB8_GSU0_GSUAMB_GSUC0_GSUWGMRR0_GLS0_ISA942_IU1_K1_LBSPPA1024_LBSPPB1024_LBSPPM0_LPA64_LPB64_LPM0_LRVW8_LWPMn1_MIAV0_MIWT4_4_MO40_NTn1_NTA0_NTB0_NTC0_NTD0_NTM0_NEPBS0_NLCA1_NLCB1_ONLL1_PGR2_PLR0_PKA1_SIA3_SS1_SU0_SUM0_SUS32_SPO0_SRVW0_SSO0_SVW4_SK3_SKXCCM8_TLDS0_ULSGRO0_USL1_UIOFGRO0_USFGRO0_VSn1_VWA4_VWB4_WSGRA0_WSGRB0_WS64_WG32_8_1_WGM1_WGMXCC1_WGMXCCGn1
    SolutionIndex: 6
    SolutionNameMin: Cijk_Ailk_Bjlk_I8_BH_UserArgs_MT256x256x64_MI16x16x1_SN_LDSB1_AFC0_AFEM1_AFEM1_ASEM1_CLR1_CADS0_DTVA0_DTVB0_EPS0_FDSI0_GRPM1_GRVWA4_GRVWB4_GSU0_GSUAMB_GSUC0_GSUWGMRR0_GLS0_ISA942_IU1_K1_LBSPPA2048_LBSPPB2048_LBSPPM0_LPA0_LPB64_LPM0_LRVW8_LWPMn1_MIAV0_MIWT8_8_MO40_NTn1_NTA0_NTB0_NTC0_NTD0_NTM0_NEPBS0_NLCA1_NLCB1_ONLL1_PGR2_PLR1_PKA1_SIA3_SS1_SU0_SUM0_SUS64_SPO0_SRVW0_SSO0_SVW8_SK3_SKXCCM8_TLDS0_ULSGRO0_USL1_UIOFGRO0_USFGRO0_VSn1_VWA8_VWB4_WSGRA0_WSGRB0_WS64_WG32_8_1_WGM1_WGMXCC1_WGMXCCGn1
    SolutionIndex: 7
    SolutionNameMin: Cijk_Ailk_Bjlk_I8_BH_UserArgs_MT256x256x64_MI16x16x1_SN_LDSB1_AFC0_AFEM1_AFEM1_ASEM1_CLR1_CADS0_DTVA0_DTVB0_EPS0_FDSI0_GRPM1_GRVWA4_GRVWB4_GSU0_GSUAMB_GSUC0_GSUWGMRR0_GLS0_ISA942_IU1_K1_LBSPPA2048_LBSPPB2048_LBSPPM0_LPA64_LPB0_LPM0_LRVW8_LWPMn1_MIAV0_MIWT8_8_MO40_NTn1_NTA0_NTB0_NTC0_NTD0_NTM0_NEPBS0_NLCA1_NLCB1_ONLL1_PGR2_PLR1_PKA1_SIA3_SS1_SU0_SUM0_SUS64_SPO0_SRVW0_SSO0_SVW4_SK3_SKXCCM8_TLDS0_ULSGRO0_USL1_UIOFGRO0_USFGRO0_VSn1_VWA4_VWB8_WSGRA0_WSGRB0_WS64_WG32_8_1_WGM1_WGMXCC1_WGMXCCGn1
    SolutionIndex: 8
    SolutionNameMin: Cijk_Ailk_Bjlk_I8_BH_UserArgs_MT256x256x64_MI16x16x1_SN_LDSB1_AFC0_AFEM1_AFEM1_ASEM1_CLR1_CADS0_DTVA0_DTVB0_EPS0_FDSI0_GRPM1_GRVWA4_GRVWB4_GSU0_GSUAMB_GSUC0_GSUWGMRR0_GLS0_ISA942_IU1_K1_LBSPPA2048_LBSPPB2048_LBSPPM0_LPA64_LPB0_LPM0_LRVW8_LWPMn1_MIAV0_MIWT8_8_MO40_NTn1_NTA0_NTB0_NTC0_NTD0_NTM0_NEPBS0_NLCA1_NLCB1_ONLL1_PGR2_PLR1_PKA1_SIA3_SS1_SU0_SUM0_SUS64_SPO0_SRVW0_SSO0_SVW4_SK3_SKXCCM8_TLDS0_ULSGRO0_USL1_UIOFGRO0_USFGRO0_VSn1_VWA4_VWB8_WSGRA0_WSGRB0_WS64_WG32_8_1_WGM4_WGMXCC1_WGMXCCGn1
    SolutionIndex: 9
    SolutionNameMin: Cijk_Ailk_Bjlk_I8_BH_UserArgs_MT256x256x64_MI16x16x1_SN_LDSB1_AFC0_AFEM1_AFEM1_ASEM1_CLR1_CADS0_DTVA0_DTVB0_EPS0_FDSI0_GRPM1_GRVWA4_GRVWB4_GSU0_GSUAMB_GSUC0_GSUWGMRR0_GLS0_ISA942_IU1_K1_LBSPPA2048_LBSPPB2048_LBSPPM0_LPA64_LPB0_LPM0_LRVW8_LWPMn1_MIAV0_MIWT8_8_MO40_NTn1_NTA0_NTB0_NTC0_NTD0_NTM0_NEPBS0_NLCA1_NLCB1_ONLL1_PGR2_PLR1_PKA1_SIA3_SS1_SU0_SUM0_SUS64_SPO0_SRVW0_SSO0_SVW4_SK3_SKXCCM8_TLDS0_ULSGRO0_USL1_UIOFGRO0_USFGRO0_VSn1_VWA4_VWB8_WSGRA0_WSGRB0_WS64_WG32_8_1_WGM8_WGMXCC1_WGMXCCGn1
    SolutionIndex: 10
    SolutionNameMin: Cijk_Ailk_Bjlk_I8_BH_UserArgs_MT128x256x64_MI16x16x1_SN_LDSB1_AFC0_AFEM1_AFEM1_ASEM1_CLR1_CADS0_DTVA0_DTVB0_EPS0_FDSI0_GRPM1_GRVWA4_GRVWB8_GSU0_GSUAMB_GSUC0_GSUWGMRR0_GLS0_ISA942_IU1_K1_LBSPPA1024_LBSPPB2048_LBSPPM0_LPA64_LPB0_LPM0_LRVW8_LWPMn1_MIAV0_MIWT4_8_MO40_NTn1_NTA0_NTB0_NTC0_NTD0_NTM0_NEPBS0_NLCA1_NLCB1_ONLL1_PGR2_PLR1_PKA1_SIA3_SS1_SU0_SUM0_SUS64_SPO0_SRVW0_SSO0_SVW4_SK3_SKXCCM8_TLDS0_ULSGRO0_USL1_UIOFGRO0_USFGRO0_VSn1_VWA4_VWB8_WSGRA0_WSGRB0_WS64_WG32_8_1_WGM1_WGMXCC1_WGMXCCGn1
    SolutionIndex: 11
    SolutionNameMin: Cijk_Ailk_Bjlk_I8_BH_UserArgs_MT256x128x64_MI16x16x1_SN_LDSB1_AFC0_AFEM1_AFEM1_ASEM1_CLR1_CADS0_DTVA0_DTVB0_EPS0_FDSI0_GRPM1_GRVWA4_GRVWB4_GSU0_GSUAMB_GSUC0_GSUWGMRR0_GLS0_ISA942_IU1_K1_LBSPPA2048_LBSPPB1024_LBSPPM0_LPA0_LPB64_LPM0_LRVW8_LWPMn1_MIAV0_MIWT8_4_MO40_NTn1_NTA0_NTB0_NTC0_NTD0_NTM0_NEPBS0_NLCA1_NLCB1_ONLL1_PGR2_PLR1_PKA1_SIA3_SS1_SU0_SUM0_SUS64_SPO0_SRVW0_SSO0_SVW8_SK3_SKXCCM8_TLDS0_ULSGRO0_USL1_UIOFGRO0_USFGRO0_VSn1_VWA8_VWB4_WSGRA0_WSGRB0_WS64_WG32_8_1_WGM1_WGMXCC1_WGMXCCGn1
    SolutionIndex: 12
    SolutionNameMin: Cijk_Ailk_Bjlk_I8_BH_UserArgs_MT256x128x64_MI16x16x1_SN_LDSB1_AFC0_AFEM1_AFEM1_ASEM1_CLR1_CADS0_DTVA0_DTVB0_EPS0_FDSI0_GRPM1_GRVWA4_GRVWB8_GSU0_GSUAMB_GSUC0_GSUWGMRR0_GLS0_ISA942_IU1_K1_LBSPPA2048_LBSPPB1024_LBSPPM0_LPA0_LPB64_LPM0_LRVW8_LWPMn1_MIAV0_MIWT8_4_MO40_NTn1_NTA0_NTB0_NTC0_NTD0_NTM0_NEPBS0_NLCA1_NLCB1_ONLL1_PGR2_PLR1_PKA1_SIA3_SS1_SU0_SUM0_SUS64_SPO0_SRVW0_SSO0_SVW8_SK3_SKXCCM8_TLDS0_ULSGRO0_USL1_UIOFGRO0_USFGRO0_VSn1_VWA8_VWB4_WSGRA0_WSGRB0_WS64_WG32_8_1_WGM1_WGMXCC1_WGMXCCGn1
    SolutionIndex: 13
    SolutionNameMin: Cijk_Ailk_Bjlk_I8_BH_UserArgs_MT256x128x64_MI16x16x1_SN_LDSB1_AFC0_AFEM1_AFEM1_ASEM1_CLR1_CADS0_DTVA0_DTVB0_EPS0_FDSI0_GRPM1_GRVWA8_GRVWB8_GSU0_GSUAMB_GSUC0_GSUWGMRR0_GLS0_ISA942_IU1_K1_LBSPPA2048_LBSPPB1024_LBSPPM0_LPA0_LPB64_LPM0_LRVW8_LWPMn1_MIAV0_MIWT8_4_MO40_NTn1_NTA0_NTB0_NTC0_NTD0_NTM0_NEPBS0_NLCA1_NLCB1_ONLL1_PGR2_PLR1_PKA1_SIA3_SS1_SU0_SUM0_SUS64_SPO0_SRVW0_SSO0_SVW8_SK3_SKXCCM8_TLDS0_ULSGRO0_USL1_UIOFGRO0_USFGRO0_VSn1_VWA8_VWB4_WSGRA0_WSGRB0_WS64_WG32_8_1_WGM1_WGMXCC1_WGMXCCGn1
    SolutionIndex: 14
    SolutionNameMin: Cijk_Ailk_Bjlk_I8_BH_UserArgs_MT128x128x64_MI16x16x1_SN_LDSB1_AFC0_AFEM1_AFEM1_ASEM1_CLR1_CADS0_DTVA0_DTVB0_EPS0_FDSI0_GRPM1_GRVWA4_GRVWB8_GSU0_GSUAMB_GSUC0_GSUWGMRR0_GLS0_ISA942_IU1_K1_LBSPPA1024_LBSPPB1024_LBSPPM0_LPA64_LPB32_LPM0_LRVW8_LWPMn1_MIAV0_MIWT4_4_MO40_NTn1_NTA0_NTB0_NTC0_NTD0_NTM0_NEPBS0_NLCA1_NLCB1_ONLL1_PGR2_PLR1_PKA1_SIA3_SS1_SU0_SUM0_SUS64_SPO0_SRVW0_SSO0_SVW4_SK3_SKXCCM8_TLDS0_ULSGRO0_USL1_UIOFGRO0_USFGRO0_VSn1_VWA4_VWB2_WSGRA0_WSGRB0_WS64_WG32_8_1_WGM1_WGMXCC1_WGMXCCGn1
    SolutionIndex: 15
    SolutionNameMin: Cijk_Ailk_Bjlk_I8_BH_UserArgs_MT128x128x64_MI16x16x1_SN_LDSB1_AFC0_AFEM1_AFEM1_ASEM1_CLR1_CADS0_DTVA0_DTVB0_EPS0_FDSI0_GRPM1_GRVWA4_GRVWB8_GSU0_GSUAMB_GSUC0_GSUWGMRR0_GLS0_ISA942_IU1_K1_LBSPPA1024_LBSPPB1024_LBSPPM0_LPA64_LPB64_LPM0_LRVW8_LWPMn1_MIAV0_MIWT4_4_MO40_NTn1_NTA0_NTB0_NTC0_NTD0_NTM0_NEPBS0_NLCA1_NLCB1_ONLL1_PGR2_PLR1_PKA1_SIA3_SS1_SU0_SUM0_SUS64_SPO0_SRVW0_SSO0_SVW4_SK3_SKXCCM8_TLDS0_ULSGRO0_USL1_UIOFGRO0_USFGRO0_VSn1_VWA4_VWB4_WSGRA0_WSGRB0_WS64_WG32_8_1_WGM1_WGMXCC1_WGMXCCGn1
    SolutionIndex: 16
    SolutionNameMin: Cijk_Ailk_Bjlk_I8_BH_UserArgs_MT64x128x64_MI16x16x1_SN_LDSB0_AFC0_AFEM1_AFEM1_ASEM1_CLR1_CADS0_DTVA0_DTVB0_EPS0_FDSI0_GRPM1_GRVWA4_GRVWB8_GSU0_GSUAMB_GSUC0_GSUWGMRR0_GLS0_ISA942_IU1_K1_LBSPPA512_LBSPPB1024_LBSPPM0_LPA32_LPB64_LPM0_LRVW8_LWPMn1_MIAV0_MIWT2_4_MO40_NTn1_NTA0_NTB0_NTC0_NTD0_NTM0_NEPBS0_NLCA1_NLCB1_ONLL1_PGR2_PLR1_PKA1_SIA3_SS1_SU0_SUM0_SUS64_SPO0_SRVW0_SSO0_SVW2_SK3_SKXCCM8_TLDS0_ULSGRO0_USL1_UIOFGRO0_USFGRO0_VSn1_VWA2_VWB4_WSGRA0_WSGRB0_WS64_WG32_8_1_WGM1_WGMXCC1_WGMXCCGn1
    SolutionIndex: 17
    SolutionNameMin: Cijk_Ailk_Bjlk_I8_BH_UserArgs_MT128x64x64_MI16x16x1_SN_LDSB0_AFC0_AFEM1_AFEM1_ASEM1_CLR1_CADS0_DTVA0_DTVB0_EPS0_FDSI0_GRPM1_GRVWA4_GRVWB4_GSU0_GSUAMB_GSUC0_GSUWGMRR0_GLS0_ISA942_IU1_K1_LBSPPA1024_LBSPPB512_LBSPPM0_LPA64_LPB32_LPM0_LRVW8_LWPMn1_MIAV0_MIWT4_2_MO40_NTn1_NTA0_NTB0_NTC0_NTD0_NTM0_NEPBS0_NLCA1_NLCB1_ONLL1_PGR2_PLR1_PKA1_SIA3_SS1_SU0_SUM0_SUS64_SPO0_SRVW0_SSO0_SVW4_SK3_SKXCCM8_TLDS0_ULSGRO0_USL1_UIOFGRO0_USFGRO0_VSn1_VWA4_VWB2_WSGRA0_WSGRB0_WS64_WG32_8_1_WGM1_WGMXCC1_WGMXCCGn1
    SolutionIndex: 18
    SolutionNameMin: Cijk_Ailk_Bjlk_I8_BH_UserArgs_MT128x64x64_MI16x16x1_SN_LDSB0_AFC0_AFEM1_AFEM1_ASEM1_CLR1_CADS0_DTVA0_DTVB0_EPS0_FDSI0_GRPM1_GRVWA4_GRVWB8_GSU0_GSUAMB_GSUC0_GSUWGMRR0_GLS0_ISA942_IU1_K1_LBSPPA1024_LBSPPB512_LBSPPM0_LPA64_LPB32_LPM0_LRVW8_LWPMn1_MIAV0_MIWT4_2_MO40_NTn1_NTA0_NTB0_NTC0_NTD0_NTM0_NEPBS0_NLCA1_NLCB1_ONLL1_PGR2_PLR1_PKA1_SIA3_SS1_SU0_SUM0_SUS64_SPO0_SRVW0_SSO0_SVW4_SK3_SKXCCM8_TLDS0_ULSGRO0_USL1_UIOFGRO0_USFGRO0_VSn1_VWA4_VWB2_WSGRA0_WSGRB0_WS64_WG32_8_1_WGM1_WGMXCC1_WGMXCCGn1
    SolutionIndex: 19
    SolutionNameMin: Cijk_Ailk_Bjlk_I8_BH_UserArgs_MT128x32x64_MI16x16x1_SN_LDSB0_AFC0_AFEM1_AFEM1_ASEM1_CLR1_CADS0_DTVA0_DTVB0_EPS0_FDSI0_GRPM1_GRVWA4_GRVWB4_GSU0_GSUAMB_GSUC0_GSUWGMRR0_GLS0_ISA942_IU1_K1_LBSPPA1024_LBSPPB256_LBSPPM0_LPA64_LPB16_LPM0_LRVW8_LWPMn1_MIAV0_MIWT4_1_MO40_NTn1_NTA0_NTB0_NTC0_NTD0_NTM0_NEPBS0_NLCA1_NLCB1_ONLL1_PGR2_PLR1_PKA1_SIA3_SS1_SU0_SUM0_SUS64_SPO0_SRVW0_SSO0_SVW4_SK3_SKXCCM8_TLDS0_ULSGRO0_USL1_UIOFGRO0_USFGRO0_VSn1_VWA4_VWB1_WSGRA0_WSGRB0_WS64_WG32_8_1_WGM1_WGMXCC1_WGMXCCGn1
    SolutionIndex: 20
    SolutionNameMin: Cijk_Ailk_Bjlk_I8_BH_UserArgs_MT64x64x64_MI16x16x1_SN_LDSB0_AFC0_AFEM1_AFEM1_ASEM1_CLR1_CADS0_DTVA0_DTVB0_EPS0_FDSI0_GRPM1_GRVWA4_GRVWB4_GSU0_GSUAMB_GSUC0_GSUWGMRR0_GLS0_ISA942_IU1_K1_LBSPPA512_LBSPPB512_LBSPPM0_LPA32_LPB32_LPM0_LRVW8_LWPMn1_MIAV0_MIWT2_2_MO40_NTn1_NTA0_NTB0_NTC0_NTD0_NTM0_NEPBS0_NLCA1_NLCB1_ONLL1_PGR2_PLR1_PKA1_SIA3_SS1_SU0_SUM0_SUS64_SPO0_SRVW0_SSO0_SVW2_SK3_SKXCCM8_TLDS0_ULSGRO0_USL1_UIOFGRO0_USFGRO0_VSn1_VWA2_VWB2_WSGRA0_WSGRB0_WS64_WG32_8_1_WGM1_WGMXCC1_WGMXCCGn1
    SolutionIndex: 21
    SolutionNameMin: Cijk_Ailk_Bjlk_I8_BH_UserArgs_MT64x32x64_MI16x16x1_SN_LDSB0_AFC0_AFEM1_AFEM1_ASEM1_CLR1_CADS0_DTVA0_DTVB0_EPS0_FDSI0_GRPM1_GRVWA4_GRVWB2_GSU0_GSUAMB_GSUC0_GSUWGMRR0_GLS0_ISA942_IU1_K1_LBSPPA512_LBSPPB256_LBSPPM0_LPA32_LPB16_LPM0_LRVW8_LWPMn1_MIAV0_MIWT2_1_MO40_NTn1_NTA0_NTB0_NTC0_NTD0_NTM0_NEPBS0_NLCA1_NLCB1_ONLL1_PGR2_PLR1_PKA1_SIA3_SS1_SU0_SUM0_SUS64_SPO0_SRVW0_SSO0_SVW2_SK3_SKXCCM8_TLDS0_ULSGRO0_USL1_UIOFGRO0_USFGRO0_VSn1_VWA2_VWB1_WSGRA0_WSGRB0_WS64_WG32_8_1_WGM1_WGMXCC1_WGMXCCGn1
    SolutionIndex: 22
    SolutionNameMin: Cijk_Ailk_Bjlk_I8_BH_UserArgs_MT64x32x64_MI16x16x1_SN_LDSB0_AFC0_AFEM1_AFEM1_ASEM1_CLR1_CADS0_DTVA0_DTVB0_EPS0_FDSI0_GRPM1_GRVWA4_GRVWB4_GSU0_GSUAMB_GSUC0_GSUWGMRR0_GLS0_ISA942_IU1_K1_LBSPPA512_LBSPPB256_LBSPPM0_LPA32_LPB16_LPM0_LRVW8_LWPMn1_MIAV0_MIWT2_1_MO40_NTn1_NTA0_NTB0_NTC0_NTD0_NTM0_NEPBS0_NLCA1_NLCB1_ONLL1_PGR2_PLR1_PKA1_SIA3_SS1_SU0_SUM0_SUS64_SPO0_SRVW0_SSO0_SVW2_SK3_SKXCCM8_TLDS0_ULSGRO0_USL1_UIOFGRO0_USFGRO0_VSn1_VWA2_VWB1_WSGRA0_WSGRB0_WS64_WG32_8_1_WGM1_WGMXCC1_WGMXCCGn1
    SolutionIndex: 23
    SolutionNameMin: Cijk_Ailk_Bjlk_I8_BH_UserArgs_MT64x32x64_MI16x16x1_SN_LDSB0_AFC0_AFEM1_AFEM1_ASEM1_CLR1_CADS0_DTVA0_DTVB0_EPS0_FDSI0_GRPM1_GRVWA4_GRVWB8_GSU0_GSUAMB_GSUC0_GSUWGMRR0_GLS0_ISA942_IU1_K1_LBSPPA512_LBSPPB256_LBSPPM0_LPA32_LPB16_LPM0_LRVW8_LWPMn1_MIAV0_MIWT2_1_MO40_NTn1_NTA0_NTB0_NTC0_NTD0_NTM0_NEPBS0_NLCA1_NLCB1_ONLL1_PGR2_PLR1_PKA1_SIA3_SS1_SU0_SUM0_SUS64_SPO0_SRVW0_SSO0_SVW2_SK3_SKXCCM8_TLDS0_ULSGRO0_USL1_UIOFGRO0_USFGRO0_VSn1_VWA2_VWB1_WSGRA0_WSGRB0_WS64_WG32_8_1_WGM1_WGMXCC1_WGMXCCGn1
    SolutionIndex: 24
    SolutionNameMin: Cijk_Ailk_Bjlk_I8_BH_UserArgs_MT32x32x64_MI16x16x1_SN_LDSB0_AFC0_AFEM1_AFEM1_ASEM1_CLR1_CADS0_DTVA0_DTVB0_EPS0_FDSI0_GRPM1_GRVWA4_GRVWB4_GSU0_GSUAMB_GSUC0_GSUWGMRR0_GLS0_ISA942_IU1_K1_LBSPPA256_LBSPPB256_LBSPPM0_LPA16_LPB16_LPM0_LRVW8_LWPMn1_MIAV0_MIWT1_1_MO40_NTn1_NTA0_NTB0_NTC0_NTD0_NTM0_NEPBS0_NLCA1_NLCB1_ONLL1_PGR2_PLR1_PKA1_SIA3_SS1_SU0_SUM0_SUS64_SPO0_SRVW0_SSO0_SVW1_SK3_SKXCCM8_TLDS0_ULSGRO0_USL1_UIOFGRO0_USFGRO0_VSn1_VWA1_VWB1_WSGRA0_WSGRB0_WS64_WG32_8_1_WGM1_WGMXCC1_WGMXCCGn1
    SolutionIndex: 25
    SolutionNameMin: Cijk_Ailk_Bjlk_I8_BH_UserArgs_MT128x128x128_MI16x16x1_SN_LDSB1_AFC0_AFEM1_AFEM1_ASEM1_CLR1_CADS0_DTVA0_DTVB0_EPS0_FDSI0_GRPM1_GRVWA4_GRVWB4_GSU0_GSUAMB_GSUC0_GSUWGMRR0_GLS0_ISA942_IU1_K1_LBSPPA1024_LBSPPB1024_LBSPPM0_LPA64_LPB64_LPM0_LRVW8_LWPMn1_MIAV0_MIWT4_4_MO40_NTn1_NTA0_NTB0_NTC0_NTD0_NTM0_NEPBS0_NLCA1_NLCB1_ONLL1_PGR2_PLR2_PKA1_SIA3_SS1_SU0_SUM0_SUS128_SPO0_SRVW0_SSO0_SVW4_SK3_SKXCCM8_TLDS0_ULSGRO0_USL1_UIOFGRO0_USFGRO0_VSn1_VWA4_VWB4_WSGRA0_WSGRB0_WS64_WG32_8_1_WGM1_WGMXCC1_WGMXCCGn1
    SolutionIndex: 26
    SolutionNameMin: Cijk_Ailk_Bjlk_I8_BH_UserArgs_MT128x64x128_MI16x16x1_SN_LDSB1_AFC0_AFEM1_AFEM1_ASEM1_CLR1_CADS0_DTVA0_DTVB0_EPS0_FDSI0_GRPM1_GRVWA4_GRVWB8_GSU0_GSUAMB_GSUC0_GSUWGMRR0_GLS0_ISA942_IU1_K1_LBSPPA1024_LBSPPB512_LBSPPM0_LPA64_LPB32_LPM0_LRVW8_LWPMn1_MIAV0_MIWT4_2_MO40_NTn1_NTA0_NTB0_NTC0_NTD0_NTM0_NEPBS0_NLCA1_NLCB1_ONLL1_PGR2_PLR1_PKA1_SIA3_SS1_SU0_SUM0_SUS128_SPO0_SRVW0_SSO0_SVW4_SK3_SKXCCM8_TLDS0_ULSGRO0_USL1_UIOFGRO0_USFGRO0_VSn1_VWA4_VWB2_WSGRA0_WSGRB0_WS64_WG32_8_1_WGM1_WGMXCC1_WGMXCCGn1
    SolutionIndex: 27
    SolutionNameMin: Cijk_Ailk_Bjlk_I8_BH_UserArgs_MT128x64x128_MI16x16x1_SN_LDSB1_AFC0_AFEM1_AFEM1_ASEM1_CLR1_CADS0_DTVA0_DTVB0_EPS0_FDSI0_GRPM1_GRVWA4_GRVWB8_GSU0_GSUAMB_GSUC0_GSUWGMRR0_GLS0_ISA942_IU1_K1_LBSPPA1024_LBSPPB512_LBSPPM0_LPA64_LPB32_LPM0_LRVW8_LWPMn1_MIAV0_MIWT4_2_MO40_NTn1_NTA0_NTB0_NTC0_NTD0_NTM0_NEPBS0_NLCA1_NLCB1_ONLL1_PGR2_PLR2_PKA1_SIA3_SS1_SU0_SUM0_SUS128_SPO0_SRVW0_SSO0_SVW4_SK3_SKXCCM8_TLDS0_ULSGRO0_USL1_UIOFGRO0_USFGRO0_VSn1_VWA4_VWB2_WSGRA0_WSGRB0_WS64_WG32_8_1_WGM1_WGMXCC1_WGMXCCGn1
    SolutionIndex: 28
    SolutionNameMin: Cijk_Ailk_Bjlk_I8_BH_UserArgs_MT64x64x128_MI16x16x1_SN_LDSB1_AFC0_AFEM1_AFEM1_ASEM1_CLR1_CADS0_DTVA0_DTVB0_EPS0_FDSI0_GRPM1_GRVWA4_GRVWB4_GSU0_GSUAMB_GSUC0_GSUWGMRR0_GLS0_ISA942_IU1_K1_LBSPPA512_LBSPPB512_LBSPPM0_LPA32_LPB32_LPM0_LRVW8_LWPMn1_MIAV0_MIWT2_2_MO40_NTn1_NTA0_NTB0_NTC0_NTD0_NTM0_NEPBS0_NLCA1_NLCB1_ONLL1_PGR2_PLR1_PKA1_SIA3_SS1_SU0_SUM0_SUS128_SPO0_SRVW0_SSO0_SVW2_SK3_SKXCCM8_TLDS0_ULSGRO0_USL1_UIOFGRO0_USFGRO0_VSn1_VWA2_VWB2_WSGRA0_WSGRB0_WS64_WG32_8_1_WGM1_WGMXCC1_WGMXCCGn1
    SolutionIndex: 29
    SolutionNameMin: Cijk_Ailk_Bjlk_I8_BH_UserArgs_MT64x64x128_MI16x16x1_SN_LDSB1_AFC0_AFEM1_AFEM1_ASEM1_CLR1_CADS0_DTVA0_DTVB0_EPS0_FDSI0_GRPM1_GRVWA4_GRVWB8_GSU0_GSUAMB_GSUC0_GSUWGMRR0_GLS0_ISA942_IU1_K1_LBSPPA512_LBSPPB512_LBSPPM0_LPA32_LPB32_LPM0_LRVW8_LWPMn1_MIAV0_MIWT2_2_MO40_NTn1_NTA0_NTB0_NTC0_NTD0_NTM0_NEPBS0_NLCA1_NLCB1_ONLL1_PGR2_PLR1_PKA1_SIA3_SS1_SU0_SUM0_SUS128_SPO0_SRVW0_SSO0_SVW2_SK3_SKXCCM8_TLDS0_ULSGRO0_USL1_UIOFGRO0_USFGRO0_VSn1_VWA2_VWB2_WSGRA0_WSGRB0_WS64_WG32_8_1_WGM1_WGMXCC1_WGMXCCGn1
    SolutionIndex: 30
    SolutionNameMin: Cijk_Ailk_Bjlk_I8_BH_UserArgs_MT64x64x128_MI16x16x1_SN_LDSB1_AFC0_AFEM1_AFEM1_ASEM1_CLR1_CADS0_DTVA0_DTVB0_EPS0_FDSI0_GRPM1_GRVWA4_GRVWB8_GSU0_GSUAMB_GSUC0_GSUWGMRR0_GLS0_ISA942_IU1_K1_LBSPPA512_LBSPPB512_LBSPPM0_LPA32_LPB32_LPM0_LRVW8_LWPMn1_MIAV0_MIWT2_2_MO40_NTn1_NTA0_NTB0_NTC0_NTD0_NTM0_NEPBS0_NLCA1_NLCB1_ONLL1_PGR2_PLR2_PKA1_SIA3_SS1_SU0_SUM0_SUS128_SPO0_SRVW0_SSO0_SVW2_SK3_SKXCCM8_TLDS0_ULSGRO0_USL1_UIOFGRO0_USFGRO0_VSn1_VWA2_VWB2_WSGRA0_WSGRB0_WS64_WG32_8_1_WGM1_WGMXCC1_WGMXCCGn1
    SolutionIndex: 31
    SolutionNameMin: Cijk_Ailk_Bjlk_I8_BH_UserArgs_MT64x32x128_MI16x16x1_SN_LDSB0_AFC0_AFEM1_AFEM1_ASEM1_CLR1_CADS0_DTVA0_DTVB0_EPS0_FDSI0_GRPM1_GRVWA4_GRVWB8_GSU0_GSUAMB_GSUC0_GSUWGMRR0_GLS0_ISA942_IU1_K1_LBSPPA512_LBSPPB256_LBSPPM0_LPA32_LPB16_LPM0_LRVW8_LWPMn1_MIAV0_MIWT2_1_MO40_NTn1_NTA0_NTB0_NTC0_NTD0_NTM0_NEPBS0_NLCA1_NLCB1_ONLL1_PGR2_PLR1_PKA1_SIA3_SS1_SU0_SUM0_SUS128_SPO0_SRVW0_SSO0_SVW2_SK3_SKXCCM8_TLDS0_ULSGRO0_USL1_UIOFGRO0_USFGRO0_VSn1_VWA2_VWB1_WSGRA0_WSGRB0_WS64_WG32_8_1_WGM1_WGMXCC1_WGMXCCGn1
    SolutionIndex: 32
    SolutionNameMin: Cijk_Ailk_Bjlk_I8_BH_UserArgs_MT64x32x128_MI16x16x1_SN_LDSB0_AFC0_AFEM1_AFEM1_ASEM1_CLR1_CADS0_DTVA0_DTVB0_EPS0_FDSI0_GRPM1_GRVWA4_GRVWB8_GSU0_GSUAMB_GSUC0_GSUWGMRR0_GLS0_ISA942_IU1_K1_LBSPPA512_LBSPPB256_LBSPPM0_LPA32_LPB16_LPM0_LRVW8_LWPMn1_MIAV0_MIWT2_1_MO40_NTn1_NTA0_NTB0_NTC0_NTD0_NTM0_NEPBS0_NLCA1_NLCB1_ONLL1_PGR2_PLR2_PKA1_SIA3_SS1_SU0_SUM0_SUS128_SPO0_SRVW0_SSO0_SVW2_SK3_SKXCCM8_TLDS0_ULSGRO0_USL1_UIOFGRO0_USFGRO0_VSn1_VWA2_VWB1_WSGRA0_WSGRB0_WS64_WG32_8_1_WGM1_WGMXCC1_WGMXCCGn1
    SolutionIndex: 33
    SolutionNameMin: Cijk_Ailk_Bjlk_I8_BH_UserArgs_MT32x32x128_MI16x16x1_SN_LDSB0_AFC0_AFEM1_AFEM1_ASEM1_CLR1_CADS0_DTVA0_DTVB0_EPS0_FDSI0_GRPM1_GRVWA8_GRVWB8_GSU0_GSUAMB_GSUC0_GSUWGMRR0_GLS0_ISA942_IU1_K1_LBSPPA256_LBSPPB256_LBSPPM0_LPA16_LPB16_LPM0_LRVW8_LWPMn1_MIAV0_MIWT1_1_MO40_NTn1_NTA0_NTB0_NTC0_NTD0_NTM0_NEPBS0_NLCA1_NLCB1_ONLL1_PGR2_PLR2_PKA1_SIA3_SS1_SU0_SUM0_SUS128_SPO0_SRVW0_SSO0_SVW1_SK3_SKXCCM8_TLDS0_ULSGRO0_USL1_UIOFGRO0_USFGRO0_VSn1_VWA1_VWB1_WSGRA0_WSGRB0_WS64_WG32_8_1_WGM1_WGMXCC1_WGMXCCGn1
    SolutionIndex: 34
    SolutionNameMin: Cijk_Ailk_Bjlk_I8_BH_UserArgs_MT128x64x256_MI16x16x1_SN_LDSB1_AFC0_AFEM1_AFEM1_ASEM1_CLR1_CADS0_DTVA0_DTVB0_EPS0_FDSI0_GRPM1_GRVWA4_GRVWB4_GSU0_GSUAMB_GSUC0_GSUWGMRR0_GLS0_ISA942_IU1_K1_LBSPPA1024_LBSPPB512_LBSPPM0_LPA64_LPB32_LPM0_LRVW8_LWPMn1_MIAV0_MIWT4_2_MO40_NTn1_NTA0_NTB0_NTC0_NTD0_NTM0_NEPBS0_NLCA1_NLCB1_ONLL1_PGR2_PLR2_PKA1_SIA3_SS1_SU0_SUM0_SUS256_SPO0_SRVW0_SSO0_SVW4_SK3_SKXCCM8_TLDS0_ULSGRO0_USL1_UIOFGRO0_USFGRO0_VSn1_VWA4_VWB2_WSGRA0_WSGRB0_WS64_WG32_8_1_WGM1_WGMXCC1_WGMXCCGn1
    SolutionIndex: 35
    SolutionNameMin: Cijk_Ailk_Bjlk_I8_BH_UserArgs_MT64x64x256_MI16x16x1_SN_LDSB1_AFC0_AFEM1_AFEM1_ASEM1_CLR1_CADS0_DTVA0_DTVB0_EPS0_FDSI0_GRPM1_GRVWA4_GRVWB8_GSU0_GSUAMB_GSUC0_GSUWGMRR0_GLS0_ISA942_IU1_K1_LBSPPA512_LBSPPB512_LBSPPM0_LPA32_LPB32_LPM0_LRVW8_LWPMn1_MIAV0_MIWT2_2_MO40_NTn1_NTA0_NTB0_NTC0_NTD0_NTM0_NEPBS0_NLCA1_NLCB1_ONLL1_PGR2_PLR2_PKA1_SIA3_SS1_SU0_SUM0_SUS256_SPO0_SRVW0_SSO0_SVW2_SK3_SKXCCM8_TLDS0_ULSGRO0_USL1_UIOFGRO0_USFGRO0_VSn1_VWA2_VWB2_WSGRA0_WSGRB0_WS64_WG32_8_1_WGM1_WGMXCC1_WGMXCCGn1
    SolutionIndex: 36
    SolutionNameMin: Cijk_Ailk_Bjlk_I8_BH_UserArgs_MT64x32x256_MI16x16x1_SN_LDSB1_AFC0_AFEM1_AFEM1_ASEM1_CLR1_CADS0_DTVA0_DTVB0_EPS0_FDSI0_GRPM1_GRVWA4_GRVWB8_GSU0_GSUAMB_GSUC0_GSUWGMRR0_GLS0_ISA942_IU1_K1_LBSPPA512_LBSPPB256_LBSPPM0_LPA32_LPB16_LPM0_LRVW8_LWPMn1_MIAV0_MIWT2_1_MO40_NTn1_NTA0_NTB0_NTC0_NTD0_NTM0_NEPBS0_NLCA1_NLCB1_ONLL1_PGR2_PLR2_PKA1_SIA3_SS1_SU0_SUM0_SUS256_SPO0_SRVW0_SSO0_SVW2_SK3_SKXCCM8_TLDS0_ULSGRO0_USL1_UIOFGRO0_USFGRO0_VSn1_VWA2_VWB1_WSGRA0_WSGRB0_WS64_WG32_8_1_WGM1_WGMXCC1_WGMXCCGn1
    SolutionIndex: 37
    SolutionNameMin: Cijk_Ailk_Bjlk_I8_BH_UserArgs_MT32x32x32_MI16x16x1_SN_LDSB0_AFC0_AFEM1_AFEM1_ASEM1_CLR0_CADS0_DTVA0_DTVB0_EPS0_FDSI0_GRPM1_GRVWA1_GRVWB1_GSU0_GSUAMB_GSUC0_GSUWGMRR0_GLS0_ISA942_IU1_K1_LBSPPA256_LBSPPB256_LBSPPM0_LPA16_LPB16_LPM0_LRVW8_LWPMn1_MIAV0_MIWT1_1_MO40_NTn1_NTA0_NTB0_NTC0_NTD0_NTM0_NEPBS0_NLCA1_NLCB1_ONLL1_PGR2_PLR0_PKA1_SIA3_SS1_SU32_SUM0_SUS256_SPO0_SRVW0_SSO0_SVW1_SK3_SKXCCM0_TLDS0_ULSGRO0_USL1_UIOFGRO0_USFGROn1_VSn1_VWA1_VWB1_WSGRA0_WSGRB0_WS64_WG32_8_1_WGM4_WGMXCC1_WGMXCCGn1
- - - [128, 128, 1, 128, 128, 128, 128, 128]
    - [24, 0.68]
  - - [128, 128, 1, 256, 128, 128, 128, 128]
    - [24, 1.12]
  - - [128, 128, 1, 512, 128, 128, 128, 128]
    - [33, 1.72]
  - - [128, 128, 1, 1024, 128, 128, 128, 128]
    - [33, 2.48]
  - - [128, 128, 1, 2048, 128, 128, 128, 128]
    - [33, 3.12]
  - - [128, 128, 1, 4096, 128, 128, 128, 128]
    - [33, 3.56]
  - - [128, 128, 1, 8192, 128, 128, 128, 128]
    - [33, 3.86]
  - - [128, 256, 1, 128, 128, 128, 128, 256]
    - [23, 1.24]
  - - [128, 256, 1, 256, 128, 128, 128, 256]
    - [22, 2.07]
  - - [128, 256, 1, 512, 128, 128, 128, 256]
    - [31, 3.16]
  - - [128, 256, 1, 1024, 128, 128, 128, 256]
    - [32, 4.32]
  - - [128, 256, 1, 2048, 128, 128, 128, 256]
    - [32, 5.35]
  - - [128, 256, 1, 4096, 128, 128, 128, 256]
    - [32, 6.06]
  - - [128, 256, 1, 8192, 128, 128, 128, 256]
    - [36, 6.49]
  - - [128, 512, 1, 128, 128, 128, 128, 512]
    - [28, 2.22]
  - - [128, 512, 1, 256, 128, 128, 128, 512]
    - [20, 3.7]
  - - [128, 512, 1, 512, 128, 128, 128, 512]
    - [30, 5.56]
  - - [128, 512, 1, 1024, 128, 128, 128, 512]
    - [30, 7.49]
  - - [128, 512, 1, 2048, 128, 128, 128, 512]
    - [29, 9.23]
  - - [128, 512, 1, 4096, 128, 128, 128, 512]
    - [35, 10.5]
  - - [128, 512, 1, 8192, 128, 128, 128, 512]
    - [29, 11.03]
  - - [128, 1024, 1, 128, 128, 128, 128, 1024]
    - [27, 3.77]
  - - [128, 1024, 1, 256, 128, 128, 128, 1024]
    - [18, 6.23]
  - - [128, 1024, 1, 512, 128, 128, 128, 1024]
    - [26, 9.04]
  - - [128, 1024, 1, 1024, 128, 128, 128, 1024]
    - [27, 12.16]
  - - [128, 1024, 1, 2048, 128, 128, 128, 1024]
    - [34, 14.82]
  - - [128, 1024, 1, 4096, 128, 128, 128, 1024]
    - [34, 16.41]
  - - [128, 1024, 1, 8192, 128, 128, 128, 1024]
    - [34, 17.59]
  - - [128, 2048, 1, 128, 128, 128, 128, 2048]
    - [15, 5.81]
  - - [128, 2048, 1, 256, 128, 128, 128, 2048]
    - [14, 9.38]
  - - [128, 2048, 1, 512, 128, 128, 128, 2048]
    - [15, 13.65]
  - - [128, 2048, 1, 1024, 128, 128, 128, 2048]
    - [15, 17.67]
  - - [128, 2048, 1, 2048, 128, 128, 128, 2048]
    - [25, 20.87]
  - - [128, 2048, 1, 4096, 128, 128, 128, 2048]
    - [25, 23.18]
  - - [128, 2048, 1, 8192, 128, 128, 128, 2048]
    - [25, 24.47]
  - - [128, 4096, 1, 128, 128, 128, 128, 4096]
    - [2, 8.04]
  - - [128, 4096, 1, 256, 128, 128, 128, 4096]
    - [10, 13.01]
  - - [128, 4096, 1, 512, 128, 128, 128, 4096]
    - [10, 19.12]
  - - [128, 4096, 1, 1024, 128, 128, 128, 4096]
    - [10, 24.76]
  - - [128, 4096, 1, 2048, 128, 128, 128, 4096]
    - [10, 29.16]
  - - [128, 4096, 1, 4096, 128, 128, 128, 4096]
    - [10, 32.0]
  - - [128, 4096, 1, 8192, 128, 128, 128, 4096]
    - [10, 33.65]
  - - [128, 8192, 1, 128, 128, 128, 128, 8192]
    - [10, 8.57]
  - - [128, 8192, 1, 256, 128, 128, 128, 8192]
    - [10, 13.75]
  - - [128, 8192, 1, 512, 128, 128, 128, 8192]
    - [10, 19.81]
  - - [128, 8192, 1, 1024, 128, 128, 128, 8192]
    - [10, 25.45]
  - - [128, 8192, 1, 2048, 128, 128, 128, 8192]
    - [10, 29.6]
  - - [128, 8192, 1, 4096, 128, 128, 128, 8192]
    - [10, 32.29]
  - - [128, 8192, 1, 8192, 128, 128, 128, 8192]
    - [10, 33.81]
  - - [256, 128, 1, 128, 256, 256, 256, 128]
    - [21, 1.26]
  - - [256, 128, 1, 256, 256, 256, 256, 128]
    - [23, 2.06]
  - - [256, 128, 1, 512, 256, 256, 256, 128]
    - [31, 3.14]
  - - [256, 128, 1, 1024, 256, 256, 256, 128]
    - [32, 4.34]
  - - [256, 128, 1, 2048, 256, 256, 256, 128]
    - [32, 5.33]
  - - [256, 128, 1, 4096, 256, 256, 256, 128]
    - [32, 6.06]
  - - [256, 128, 1, 8192, 256, 256, 256, 128]
    - [36, 6.49]
  - - [256, 256, 1, 128, 256, 256, 256, 256]
    - [20, 2.24]
  - - [256, 256, 1, 256, 256, 256, 256, 256]
    - [20, 3.71]
  - - [256, 256, 1, 512, 256, 256, 256, 256]
    - [29, 5.5]
  - - [256, 256, 1, 1024, 256, 256, 256, 256]
    - [29, 7.52]
  - - [256, 256, 1, 2048, 256, 256, 256, 256]
    - [35, 9.26]
  - - [256, 256, 1, 4096, 256, 256, 256, 256]
    - [35, 10.58]
  - - [256, 256, 1, 8192, 256, 256, 256, 256]
    - [35, 11.4]
  - - [256, 512, 1, 128, 256, 256, 256, 512]
    - [18, 3.77]
  - - [256, 512, 1, 256, 256, 256, 256, 512]
    - [18, 6.17]
  - - [256, 512, 1, 512, 256, 256, 256, 512]
    - [16, 9.06]
  - - [256, 512, 1, 1024, 256, 256, 256, 512]
    - [16, 11.99]
  - - [256, 512, 1, 2048, 256, 256, 256, 512]
    - [34, 14.76]
  - - [256, 512, 1, 4096, 256, 256, 256, 512]
    - [34, 16.86]
  - - [256, 512, 1, 8192, 256, 256, 256, 512]
    - [34, 17.68]
  - - [256, 1024, 1, 128, 256, 256, 256, 1024]
    - [5, 5.74]
  - - [256, 1024, 1, 256, 256, 256, 256, 1024]
    - [15, 9.38]
  - - [256, 1024, 1, 512, 256, 256, 256, 1024]
    - [14, 13.62]
  - - [256, 1024, 1, 1024, 256, 256, 256, 1024]
    - [15, 17.67]
  - - [256, 1024, 1, 2048, 256, 256, 256, 1024]
    - [25, 20.95]
  - - [256, 1024, 1, 4096, 256, 256, 256, 1024]
    - [25, 23.08]
  - - [256, 1024, 1, 8192, 256, 256, 256, 1024]
    - [25, 24.47]
  - - [256, 2048, 1, 128, 256, 256, 256, 2048]
    - [11, 8.21]
  - - [256, 2048, 1, 256, 256, 256, 256, 2048]
    - [12, 13.44]
  - - [256, 2048, 1, 512, 256, 256, 256, 2048]
    - [12, 19.41]
  - - [256, 2048, 1, 1024, 256, 256, 256, 2048]
    - [13, 25.15]
  - - [256, 2048, 1, 2048, 256, 256, 256, 2048]
    - [13, 29.64]
  - - [256, 2048, 1, 4096, 256, 256, 256, 2048]
    - [13, 32.55]
  - - [256, 2048, 1, 8192, 256, 256, 256, 2048]
    - [13, 34.36]
  - - [256, 4096, 1, 128, 256, 256, 256, 4096]
    - [7, 10.42]
  - - [256, 4096, 1, 256, 256, 256, 256, 4096]
    - [7, 16.74]
  - - [256, 4096, 1, 512, 256, 256, 256, 4096]
    - [7, 24.24]
  - - [256, 4096, 1, 1024, 256, 256, 256, 4096]
    - [7, 31.12]
  - - [256, 4096, 1, 2048, 256, 256, 256, 4096]
    - [7, 36.6]
  - - [256, 4096, 1, 4096, 256, 256, 256, 4096]
    - [9, 39.92]
  - - [256, 4096, 1, 8192, 256, 256, 256, 4096]
    - [7, 41.92]
  - - [256, 8192, 1, 128, 256, 256, 256, 8192]
    - [7, 10.83]
  - - [256, 8192, 1, 256, 256, 256, 256, 8192]
    - [7, 17.33]
  - - [256, 8192, 1, 512, 256, 256, 256, 8192]
    - [7, 24.96]
  - - [256, 8192, 1, 1024, 256, 256, 256, 8192]
    - [7, 31.83]
  - - [256, 8192, 1, 2048, 256, 256, 256, 8192]
    - [7, 36.96]
  - - [256, 8192, 1, 4096, 256, 256, 256, 8192]
    - [7, 40.21]
  - - [256, 8192, 1, 8192, 256, 256, 256, 8192]
    - [7, 42.07]
  - - [512, 128, 1, 128, 512, 512, 512, 128]
    - [19, 2.22]
  - - [512, 128, 1, 256, 512, 512, 512, 128]
    - [20, 3.63]
  - - [512, 128, 1, 512, 512, 512, 512, 128]
    - [30, 5.49]
  - - [512, 128, 1, 1024, 512, 512, 512, 128]
    - [29, 7.54]
  - - [512, 128, 1, 2048, 512, 512, 512, 128]
    - [29, 9.22]
  - - [512, 128, 1, 4096, 512, 512, 512, 128]
    - [29, 10.36]
  - - [512, 128, 1, 8192, 512, 512, 512, 128]
    - [29, 10.6]
  - - [512, 256, 1, 128, 512, 512, 512, 256]
    - [17, 3.79]
  - - [512, 256, 1, 256, 512, 512, 512, 256]
    - [18, 6.16]
  - - [512, 256, 1, 512, 512, 512, 512, 256]
    - [26, 9.07]
  - - [512, 256, 1, 1024, 512, 512, 512, 256]
    - [27, 12.18]
  - - [512, 256, 1, 2048, 512, 512, 512, 256]
    - [34, 14.79]
  - - [512, 256, 1, 4096, 512, 512, 512, 256]
    - [34, 16.86]
  - - [512, 256, 1, 8192, 512, 512, 512, 256]
    - [27, 17.31]
  - - [512, 512, 1, 128, 512, 512, 512, 512]
    - [14, 5.79]
  - - [512, 512, 1, 256, 512, 512, 512, 512]
    - [14, 9.33]
  - - [512, 512, 1, 512, 512, 512, 512, 512]
    - [15, 13.68]
  - - [512, 512, 1, 1024, 512, 512, 512, 512]
    - [15, 17.71]
  - - [512, 512, 1, 2048, 512, 512, 512, 512]
    - [25, 20.94]
  - - [512, 512, 1, 4096, 512, 512, 512, 512]
    - [25, 22.92]
  - - [512, 512, 1, 8192, 512, 512, 512, 512]
    - [25, 24.18]
  - - [512, 1024, 1, 128, 512, 512, 512, 1024]
    - [12, 8.26]
  - - [512, 1024, 1, 256, 512, 512, 512, 1024]
    - [12, 13.45]
  - - [512, 1024, 1, 512, 512, 512, 512, 1024]
    - [12, 19.43]
  - - [512, 1024, 1, 1024, 512, 512, 512, 1024]
    - [13, 25.12]
  - - [512, 1024, 1, 2048, 512, 512, 512, 1024]
    - [13, 29.65]
  - - [512, 1024, 1, 4096, 512, 512, 512, 1024]
    - [13, 32.57]
  - - [512, 1024, 1, 8192, 512, 512, 512, 1024]
    - [13, 34.32]
  - - [512, 2048, 1, 128, 512, 512, 512, 2048]
    - [7, 10.39]
  - - [512, 2048, 1, 256, 512, 512, 512, 2048]
    - [7, 16.78]
  - - [512, 2048, 1, 512, 512, 512, 512, 2048]
    - [7, 24.32]
  - - [512, 2048, 1, 1024, 512, 512, 512, 2048]
    - [7, 31.33]
  - - [512, 2048, 1, 2048, 512, 512, 512, 2048]
    - [7, 36.61]
  - - [512, 2048, 1, 4096, 512, 512, 512, 2048]
    - [7, 40.03]
  - - [512, 2048, 1, 8192, 512, 512, 512, 2048]
    - [9, 41.92]
  - - [512, 4096, 1, 128, 512, 512, 512, 4096]
    - [7, 10.85]
  - - [512, 4096, 1, 256, 512, 512, 512, 4096]
    - [7, 17.38]
  - - [512, 4096, 1, 512, 512, 512, 512, 4096]
    - [7, 24.86]
  - - [512, 4096, 1, 1024, 512, 512, 512, 4096]
    - [7, 31.84]
  - - [512, 4096, 1, 2048, 512, 512, 512, 4096]
    - [7, 36.96]
  - - [512, 4096, 1, 4096, 512, 512, 512, 4096]
    - [7, 40.24]
  - - [512, 4096, 1, 8192, 512, 512, 512, 4096]
    - [7, 42.09]
  - - [512, 8192, 1, 128, 512, 512, 512, 8192]
    - [7, 11.09]
  - - [512, 8192, 1, 256, 512, 512, 512, 8192]
    - [7, 17.7]
  - - [512, 8192, 1, 512, 512, 512, 512, 8192]
    - [7, 25.23]
  - - [512, 8192, 1, 1024, 512, 512, 512, 8192]
    - [7, 32.11]
  - - [512, 8192, 1, 2048, 512, 512, 512, 8192]
    - [7, 37.19]
  - - [512, 8192, 1, 4096, 512, 512, 512, 8192]
    - [8, 47.72]
  - - [512, 8192, 1, 8192, 512, 512, 512, 8192]
    - [7, 50.97]
  - - [1024, 128, 1, 128, 1024, 1024, 1024, 128]
    - [18, 3.81]
  - - [1024, 128, 1, 256, 1024, 1024, 1024, 128]
    - [18, 6.16]
  - - [1024, 128, 1, 512, 1024, 1024, 1024, 128]
    - [27, 9.09]
  - - [1024, 128, 1, 1024, 1024, 1024, 1024, 128]
    - [27, 12.23]
  - - [1024, 128, 1, 2048, 1024, 1024, 1024, 128]
    - [34, 14.83]
  - - [1024, 128, 1, 4096, 1024, 1024, 1024, 128]
    - [27, 16.26]
  - - [1024, 128, 1, 8192, 1024, 1024, 1024, 128]
    - [27, 17.25]
  - - [1024, 256, 1, 128, 1024, 1024, 1024, 256]
    - [4, 5.79]
  - - [1024, 256, 1, 256, 1024, 1024, 1024, 256]
    - [15, 9.37]
  - - [1024, 256, 1, 512, 1024, 1024, 1024, 256]
    - [15, 13.71]
  - - [1024, 256, 1, 1024, 1024, 1024, 1024, 256]
    - [15, 17.73]
  - - [1024, 256, 1, 2048, 1024, 1024, 1024, 256]
    - [25, 20.97]
  - - [1024, 256, 1, 4096, 1024, 1024, 1024, 256]
    - [25, 22.73]
  - - [1024, 256, 1, 8192, 1024, 1024, 1024, 256]
    - [25, 23.95]
  - - [1024, 512, 1, 128, 1024, 1024, 1024, 512]
    - [12, 8.33]
  - - [1024, 512, 1, 256, 1024, 1024, 1024, 512]
    - [12, 13.38]
  - - [1024, 512, 1, 512, 1024, 1024, 1024, 512]
    - [12, 19.43]
  - - [1024, 512, 1, 1024, 1024, 1024, 1024, 512]
    - [13, 25.08]
  - - [1024, 512, 1, 2048, 1024, 1024, 1024, 512]
    - [13, 29.63]
  - - [1024, 512, 1, 4096, 1024, 1024, 1024, 512]
    - [13, 32.6]
  - - [1024, 512, 1, 8192, 1024, 1024, 1024, 512]
    - [13, 34.31]
  - - [1024, 1024, 1, 128, 1024, 1024, 1024, 1024]
    - [7, 10.42]
  - - [1024, 1024, 1, 256, 1024, 1024, 1024, 1024]
    - [6, 16.72]
  - - [1024, 1024, 1, 512, 1024, 1024, 1024, 1024]
    - [7, 24.36]
  - - [1024, 1024, 1, 1024, 1024, 1024, 1024, 1024]
    - [7, 31.29]
  - - [1024, 1024, 1, 2048, 1024, 1024, 1024, 1024]
    - [7, 36.62]
  - - [1024, 1024, 1, 4096, 1024, 1024, 1024, 1024]
    - [7, 39.98]
  - - [1024, 1024, 1, 8192, 1024, 1024, 1024, 1024]
    - [7, 41.92]
  - - [1024, 2048, 1, 128, 1024, 1024, 1024, 2048]
    - [7, 10.82]
  - - [1024, 2048, 1, 256, 1024, 1024, 1024, 2048]
    - [7, 17.42]
  - - [1024, 2048, 1, 512, 1024, 1024, 1024, 2048]
    - [7, 24.77]
  - - [1024, 2048, 1, 1024, 1024, 1024, 1024, 2048]
    - [7, 31.83]
  - - [1024, 2048, 1, 2048, 1024, 1024, 1024, 2048]
    - [7, 36.94]
  - - [1024, 2048, 1, 4096, 1024, 1024, 1024, 2048]
    - [7, 40.18]
  - - [1024, 2048, 1, 8192, 1024, 1024, 1024, 2048]
    - [7, 42.09]
  - - [1024, 4096, 1, 128, 1024, 1024, 1024, 4096]
    - [7, 11.09]
  - - [1024, 4096, 1, 256, 1024, 1024, 1024, 4096]
    - [7, 17.72]
  - - [1024, 4096, 1, 512, 1024, 1024, 1024, 4096]
    - [7, 25.27]
  - - [1024, 4096, 1, 1024, 1024, 1024, 1024, 4096]
    - [7, 32.15]
  - - [1024, 4096, 1, 2048, 1024, 1024, 1024, 4096]
    - [7, 37.17]
  - - [1024, 4096, 1, 4096, 1024, 1024, 1024, 4096]
    - [7, 47.74]
  - - [1024, 4096, 1, 8192, 1024, 1024, 1024, 4096]
    - [7, 51.06]
  - - [1024, 8192, 1, 128, 1024, 1024, 1024, 8192]
    - [7, 11.25]
  - - [1024, 8192, 1, 256, 1024, 1024, 1024, 8192]
    - [7, 17.92]
  - - [1024, 8192, 1, 512, 1024, 1024, 1024, 8192]
    - [7, 25.48]
  - - [1024, 8192, 1, 1024, 1024, 1024, 1024, 8192]
    - [7, 32.3]
  - - [1024, 8192, 1, 2048, 1024, 1024, 1024, 8192]
    - [7, 40.64]
  - - [1024, 8192, 1, 4096, 1024, 1024, 1024, 8192]
    - [7, 46.96]
  - - [1024, 8192, 1, 8192, 1024, 1024, 1024, 8192]
    - [7, 49.35]
  - - [2048, 128, 1, 128, 2048, 2048, 2048, 128]
    - [5, 5.79]
  - - [2048, 128, 1, 256, 2048, 2048, 2048, 128]
    - [14, 9.32]
  - - [2048, 128, 1, 512, 2048, 2048, 2048, 128]
    - [15, 13.63]
  - - [2048, 128, 1, 1024, 2048, 2048, 2048, 128]
    - [15, 17.72]
  - - [2048, 128, 1, 2048, 2048, 2048, 2048, 128]
    - [15, 20.74]
  - - [2048, 128, 1, 4096, 2048, 2048, 2048, 128]
    - [15, 22.71]
  - - [2048, 128, 1, 8192, 2048, 2048, 2048, 128]
    - [15, 23.87]
  - - [2048, 256, 1, 128, 2048, 2048, 2048, 256]
    - [12, 8.27]
  - - [2048, 256, 1, 256, 2048, 2048, 2048, 256]
    - [12, 13.46]
  - - [2048, 256, 1, 512, 2048, 2048, 2048, 256]
    - [12, 19.5]
  - - [2048, 256, 1, 1024, 2048, 2048, 2048, 256]
    - [13, 25.09]
  - - [2048, 256, 1, 2048, 2048, 2048, 2048, 256]
    - [13, 29.58]
  - - [2048, 256, 1, 4096, 2048, 2048, 2048, 256]
    - [13, 32.54]
  - - [2048, 256, 1, 8192, 2048, 2048, 2048, 256]
    - [13, 34.25]
  - - [2048, 512, 1, 128, 2048, 2048, 2048, 512]
    - [7, 10.39]
  - - [2048, 512, 1, 256, 2048, 2048, 2048, 512]
    - [7, 16.76]
  - - [2048, 512, 1, 512, 2048, 2048, 2048, 512]
    - [7, 24.34]
  - - [2048, 512, 1, 1024, 2048, 2048, 2048, 512]
    - [7, 31.28]
  - - [2048, 512, 1, 2048, 2048, 2048, 2048, 512]
    - [7, 36.62]
  - - [2048, 512, 1, 4096, 2048, 2048, 2048, 512]
    - [7, 39.95]
  - - [2048, 512, 1, 8192, 2048, 2048, 2048, 512]
    - [7, 41.9]
  - - [2048, 1024, 1, 128, 2048, 2048, 2048, 1024]
    - [7, 10.84]
  - - [2048, 1024, 1, 256, 2048, 2048, 2048, 1024]
    - [7, 17.29]
  - - [2048, 1024, 1, 512, 2048, 2048, 2048, 1024]
    - [7, 24.86]
  - - [2048, 1024, 1, 1024, 2048, 2048, 2048, 1024]
    - [7, 31.84]
  - - [2048, 1024, 1, 2048, 2048, 2048, 2048, 1024]
    - [7, 36.97]
  - - [2048, 1024, 1, 4096, 2048, 2048, 2048, 1024]
    - [7, 40.18]
  - - [2048, 1024, 1, 8192, 2048, 2048, 2048, 1024]
    - [7, 42.08]
  - - [2048, 2048, 1, 128, 2048, 2048, 2048, 2048]
    - [7, 11.09]
  - - [2048, 2048, 1, 256, 2048, 2048, 2048, 2048]
    - [7, 17.71]
  - - [2048, 2048, 1, 512, 2048, 2048, 2048, 2048]
    - [7, 25.25]
  - - [2048, 2048, 1, 1024, 2048, 2048, 2048, 2048]
    - [7, 32.17]
  - - [2048, 2048, 1, 2048, 2048, 2048, 2048, 2048]
    - [7, 37.16]
  - - [2048, 2048, 1, 4096, 2048, 2048, 2048, 2048]
    - [7, 47.78]
  - - [2048, 2048, 1, 8192, 2048, 2048, 2048, 2048]
    - [7, 51.08]
  - - [2048, 4096, 1, 128, 2048, 2048, 2048, 4096]
    - [7, 11.24]
  - - [2048, 4096, 1, 256, 2048, 2048, 2048, 4096]
    - [7, 17.91]
  - - [2048, 4096, 1, 512, 2048, 2048, 2048, 4096]
    - [7, 25.47]
  - - [2048, 4096, 1, 1024, 2048, 2048, 2048, 4096]
    - [7, 32.31]
  - - [2048, 4096, 1, 2048, 2048, 2048, 2048, 4096]
    - [7, 40.64]
  - - [2048, 4096, 1, 4096, 2048, 2048, 2048, 4096]
    - [7, 46.95]
  - - [2048, 4096, 1, 8192, 2048, 2048, 2048, 4096]
    - [7, 49.34]
  - - [2048, 8192, 1, 128, 2048, 2048, 2048, 8192]
    - [7, 11.32]
  - - [2048, 8192, 1, 256, 2048, 2048, 2048, 8192]
    - [7, 18.02]
  - - [2048, 8192, 1, 512, 2048, 2048, 2048, 8192]
    - [0, 27.77]
  - - [2048, 8192, 1, 1024, 2048, 2048, 2048, 8192]
    - [7, 39.16]
  - - [2048, 8192, 1, 2048, 2048, 2048, 2048, 8192]
    - [7, 45.74]
  - - [2048, 8192, 1, 4096, 2048, 2048, 2048, 8192]
    - [7, 49.72]
  - - [2048, 8192, 1, 8192, 2048, 2048, 2048, 8192]
    - [7, 52.12]
  - - [4096, 128, 1, 128, 4096, 4096, 4096, 128]
    - [12, 8.29]
  - - [4096, 128, 1, 256, 4096, 4096, 4096, 128]
    - [12, 13.49]
  - - [4096, 128, 1, 512, 4096, 4096, 4096, 128]
    - [12, 19.41]
  - - [4096, 128, 1, 1024, 4096, 4096, 4096, 128]
    - [13, 25.07]
  - - [4096, 128, 1, 2048, 4096, 4096, 4096, 128]
    - [13, 29.51]
  - - [4096, 128, 1, 4096, 4096, 4096, 4096, 128]
    - [13, 32.58]
  - - [4096, 128, 1, 8192, 4096, 4096, 4096, 128]
    - [13, 34.27]
  - - [4096, 256, 1, 128, 4096, 4096, 4096, 256]
    - [7, 10.39]
  - - [4096, 256, 1, 256, 4096, 4096, 4096, 256]
    - [7, 16.82]
  - - [4096, 256, 1, 512, 4096, 4096, 4096, 256]
    - [7, 24.28]
  - - [4096, 256, 1, 1024, 4096, 4096, 4096, 256]
    - [7, 31.28]
  - - [4096, 256, 1, 2048, 4096, 4096, 4096, 256]
    - [7, 36.58]
  - - [4096, 256, 1, 4096, 4096, 4096, 4096, 256]
    - [7, 39.91]
  - - [4096, 256, 1, 8192, 4096, 4096, 4096, 256]
    - [7, 41.89]
  - - [4096, 512, 1, 128, 4096, 4096, 4096, 512]
    - [7, 10.81]
  - - [4096, 512, 1, 256, 4096, 4096, 4096, 512]
    - [7, 17.31]
  - - [4096, 512, 1, 512, 4096, 4096, 4096, 512]
    - [7, 24.86]
  - - [4096, 512, 1, 1024, 4096, 4096, 4096, 512]
    - [7, 31.78]
  - - [4096, 512, 1, 2048, 4096, 4096, 4096, 512]
    - [7, 36.92]
  - - [4096, 512, 1, 4096, 4096, 4096, 4096, 512]
    - [7, 40.16]
  - - [4096, 512, 1, 8192, 4096, 4096, 4096, 512]
    - [7, 42.08]
  - - [4096, 1024, 1, 128, 4096, 4096, 4096, 1024]
    - [7, 11.08]
  - - [4096, 1024, 1, 256, 4096, 4096, 4096, 1024]
    - [7, 17.63]
  - - [4096, 1024, 1, 512, 4096, 4096, 4096, 1024]
    - [7, 25.28]
  - - [4096, 1024, 1, 1024, 4096, 4096, 4096, 1024]
    - [7, 32.13]
  - - [4096, 1024, 1, 2048, 4096, 4096, 4096, 1024]
    - [7, 37.17]
  - - [4096, 1024, 1, 4096, 4096, 4096, 4096, 1024]
    - [7, 47.75]
  - - [4096, 1024, 1, 8192, 4096, 4096, 4096, 1024]
    - [7, 51.09]
  - - [4096, 2048, 1, 128, 4096, 4096, 4096, 2048]
    - [7, 11.23]
  - - [4096, 2048, 1, 256, 4096, 4096, 4096, 2048]
    - [7, 17.86]
  - - [4096, 2048, 1, 512, 4096, 4096, 4096, 2048]
    - [7, 25.46]
  - - [4096, 2048, 1, 1024, 4096, 4096, 4096, 2048]
    - [7, 32.32]
  - - [4096, 2048, 1, 2048, 4096, 4096, 4096, 2048]
    - [7, 40.62]
  - - [4096, 2048, 1, 4096, 4096, 4096, 4096, 2048]
    - [7, 47.0]
  - - [4096, 2048, 1, 8192, 4096, 4096, 4096, 2048]
    - [7, 49.29]
  - - [4096, 4096, 1, 128, 4096, 4096, 4096, 4096]
    - [7, 11.32]
  - - [4096, 4096, 1, 256, 4096, 4096, 4096, 4096]
    - [7, 18.0]
  - - [4096, 4096, 1, 512, 4096, 4096, 4096, 4096]
    - [0, 27.69]
  - - [4096, 4096, 1, 1024, 4096, 4096, 4096, 4096]
    - [7, 39.17]
  - - [4096, 4096, 1, 2048, 4096, 4096, 4096, 4096]
    - [7, 45.69]
  - - [4096, 4096, 1, 4096, 4096, 4096, 4096, 4096]
    - [7, 49.68]
  - - [4096, 4096, 1, 8192, 4096, 4096, 4096, 4096]
    - [8, 52.1]
  - - [4096, 8192, 1, 128, 4096, 4096, 4096, 8192]
    - [3, 11.41]
  - - [4096, 8192, 1, 256, 4096, 4096, 4096, 8192]
    - [1, 19.54]
  - - [4096, 8192, 1, 512, 4096, 4096, 4096, 8192]
    - [7, 29.41]
  - - [4096, 8192, 1, 1024, 4096, 4096, 4096, 8192]
    - [7, 37.66]
  - - [4096, 8192, 1, 2048, 4096, 4096, 4096, 8192]
    - [7, 43.7]
  - - [4096, 8192, 1, 4096, 4096, 4096, 4096, 8192]
    - [9, 49.9]
  - - [4096, 8192, 1, 8192, 4096, 4096, 4096, 8192]
    - [7, 52.19]
  - - [8192, 128, 1, 128, 8192, 8192, 8192, 128]
    - [12, 8.87]
  - - [8192, 128, 1, 256, 8192, 8192, 8192, 128]
    - [12, 14.18]
  - - [8192, 128, 1, 512, 8192, 8192, 8192, 128]
    - [12, 20.16]
  - - [8192, 128, 1, 1024, 8192, 8192, 8192, 128]
    - [13, 25.75]
  - - [8192, 128, 1, 2048, 8192, 8192, 8192, 128]
    - [13, 30.13]
  - - [8192, 128, 1, 4096, 8192, 8192, 8192, 128]
    - [13, 32.8]
  - - [8192, 128, 1, 8192, 8192, 8192, 8192, 128]
    - [13, 34.01]
  - - [8192, 256, 1, 128, 8192, 8192, 8192, 256]
    - [7, 10.79]
  - - [8192, 256, 1, 256, 8192, 8192, 8192, 256]
    - [7, 17.29]
  - - [8192, 256, 1, 512, 8192, 8192, 8192, 256]
    - [7, 24.88]
  - - [8192, 256, 1, 1024, 8192, 8192, 8192, 256]
    - [7, 31.8]
  - - [8192, 256, 1, 2048, 8192, 8192, 8192, 256]
    - [7, 36.95]
  - - [8192, 256, 1, 4096, 8192, 8192, 8192, 256]
    - [7, 40.2]
  - - [8192, 256, 1, 8192, 8192, 8192, 8192, 256]
    - [7, 41.93]
  - - [8192, 512, 1, 128, 8192, 8192, 8192, 512]
    - [7, 11.07]
  - - [8192, 512, 1, 256, 8192, 8192, 8192, 512]
    - [7, 17.61]
  - - [8192, 512, 1, 512, 8192, 8192, 8192, 512]
    - [7, 25.26]
  - - [8192, 512, 1, 1024, 8192, 8192, 8192, 512]
    - [7, 32.09]
  - - [8192, 512, 1, 2048, 8192, 8192, 8192, 512]
    - [7, 37.14]
  - - [8192, 512, 1, 4096, 8192, 8192, 8192, 512]
    - [7, 47.77]
  - - [8192, 512, 1, 8192, 8192, 8192, 8192, 512]
    - [9, 50.84]
  - - [8192, 1024, 1, 128, 8192, 8192, 8192, 1024]
    - [7, 11.22]
  - - [8192, 1024, 1, 256, 8192, 8192, 8192, 1024]
    - [7, 17.82]
  - - [8192, 1024, 1, 512, 8192, 8192, 8192, 1024]
    - [7, 25.44]
  - - [8192, 1024, 1, 1024, 8192, 8192, 8192, 1024]
    - [7, 32.27]
  - - [8192, 1024, 1, 2048, 8192, 8192, 8192, 1024]
    - [7, 40.61]
  - - [8192, 1024, 1, 4096, 8192, 8192, 8192, 1024]
    - [7, 46.96]
  - - [8192, 1024, 1, 8192, 8192, 8192, 8192, 1024]
    - [7, 49.29]
  - - [8192, 2048, 1, 128, 8192, 8192, 8192, 2048]
    - [7, 11.32]
  - - [8192, 2048, 1, 256, 8192, 8192, 8192, 2048]
    - [7, 17.96]
  - - [8192, 2048, 1, 512, 8192, 8192, 8192, 2048]
    - [0, 27.74]
  - - [8192, 2048, 1, 1024, 8192, 8192, 8192, 2048]
    - [7, 39.26]
  - - [8192, 2048, 1, 2048, 8192, 8192, 8192, 2048]
    - [7, 45.75]
  - - [8192, 2048, 1, 4096, 8192, 8192, 8192, 2048]
    - [8, 49.65]
  - - [8192, 2048, 1, 8192, 8192, 8192, 8192, 2048]
    - [7, 52.1]
  - - [8192, 4096, 1, 128, 8192, 8192, 8192, 4096]
    - [3, 11.41]
  - - [8192, 4096, 1, 256, 8192, 8192, 8192, 4096]
    - [1, 19.52]
  - - [8192, 4096, 1, 512, 8192, 8192, 8192, 4096]
    - [7, 29.44]
  - - [8192, 4096, 1, 1024, 8192, 8192, 8192, 4096]
    - [7, 37.75]
  - - [8192, 4096, 1, 2048, 8192, 8192, 8192, 4096]
    - [7, 43.68]
  - - [8192, 4096, 1, 4096, 8192, 8192, 8192, 4096]
    - [7, 49.88]
  - - [8192, 4096, 1, 8192, 8192, 8192, 8192, 4096]
    - [7, 52.27]
  - - [8192, 8192, 1, 128, 8192, 8192, 8192, 8192]
    - [1, 13.45]
  - - [8192, 8192, 1, 256, 8192, 8192, 8192, 8192]
    - [7, 21.71]
  - - [8192, 8192, 1, 512, 8192, 8192, 8192, 8192]
    - [7, 31.23]
  - - [8192, 8192, 1, 1024, 8192, 8192, 8192, 8192]
    - [7, 39.76]
  - - [8192, 8192, 1, 2048, 8192, 8192, 8192, 8192]
    - [7, 46.03]
  - - [8192, 8192, 1, 4096, 8192, 8192, 8192, 8192]
    - [7, 49.98]
  - - [8192, 8192, 1, 8192, 8192, 8192, 8192, 8192]
    - [9, 52.32]
  - - [1, 1, 1, 32, 1, 1, 1, 1]
    - [37, 0.0]
- null
- null
- ExperimentalStreamK
- GridBased
