projects/hipblaslt/library/src/amd_detail/rocblaslt/src/Tensile/Logic/asm_full/aquavanjaram/gfx942_20cu/StreamK/aquavanjaram942_Cijk_Ailk_Bljk_I8_BH_UserArgs.yaml
- {MinimumRequiredVersion: 5.0.0}
- aquavanjaram942
- {Architecture: gfx942, CUCount: 20}
- [Device 0049, Device 0050]
    SolutionIndex: 0
    SolutionNameMin: Cijk_Ailk_Bljk_I8_BH_UserArgs_MT256x256x32_MI16x16x1_SN_LDSB0_AFC0_AFEM1_AFEM1_ASEM1_CLR0_CADS0_DTVA0_DTVB0_EPS0_FDSI0_GRPM1_GRVWA4_GRVWB8_GSU0_GSUAMB_GSUC0_GSUWGMRR0_GLS0_ISA942_IU1_K1_LBSPPA2048_LBSPPB128_LBSPPM0_LPA64_LPB8_LPM0_LRVW8_LWPMn1_MIAV0_MIWT8_8_MO40_NTn1_NTA0_NTB0_NTC0_NTD0_NTM0_NEPBS0_NLCA1_NLCB1_ONLL1_PGR2_PLR0_PKA1_SIA3_SS1_SU0_SUM0_SUS32_SPO0_SRVW0_SSO0_SVW4_SK3_SKXCCM8_TLDS1_ULSGRO0_USL1_UIOFGRO0_USFGRO0_VSn1_VWA4_VWB1_WSGRA0_WSGRB0_WS64_WG32_8_1_WGM1_WGMXCC1_WGMXCCGn1
    SolutionIndex: 1
    SolutionNameMin: Cijk_Ailk_Bljk_I8_BH_UserArgs_MT256x256x32_MI16x16x1_SN_LDSB0_AFC0_AFEM1_AFEM1_ASEM1_CLR0_CADS0_DTVA0_DTVB0_EPS0_FDSI0_GRPM1_GRVWA4_GRVWB8_GSU0_GSUAMB_GSUC0_GSUWGMRR0_GLS0_ISA942_IU1_K1_LBSPPA2048_LBSPPB128_LBSPPM0_LPA0_LPB8_LPM0_LRVW8_LWPMn1_MIAV0_MIWT8_8_MO40_NTn1_NTA0_NTB0_NTC0_NTD0_NTM0_NEPBS0_NLCA1_NLCB1_ONLL1_PGR2_PLR0_PKA1_SIA3_SS1_SU0_SUM0_SUS32_SPO0_SRVW0_SSO0_SVW8_SK3_SKXCCM8_TLDS1_ULSGRO0_USL1_UIOFGRO0_USFGRO0_VSn1_VWA8_VWB1_WSGRA0_WSGRB0_WS64_WG32_8_1_WGM1_WGMXCC1_WGMXCCGn1
    SolutionIndex: 2
    SolutionNameMin: Cijk_Ailk_Bljk_I8_BH_UserArgs_MT256x256x32_MI16x16x1_SN_LDSB0_AFC0_AFEM1_AFEM1_ASEM1_CLR0_CADS0_DTVA0_DTVB0_EPS0_FDSI0_GRPM1_GRVWA4_GRVWB8_GSU0_GSUAMB_GSUC0_GSUWGMRR0_GLS0_ISA942_IU1_K1_LBSPPA2048_LBSPPB128_LBSPPM0_LPA64_LPB8_LPM0_LRVW8_LWPMn1_MIAV0_MIWT8_8_MO40_NTn1_NTA0_NTB0_NTC0_NTD0_NTM0_NEPBS0_NLCA1_NLCB1_ONLL1_PGR2_PLR0_PKA1_SIA3_SS1_SU0_SUM0_SUS32_SPO0_SRVW0_SSO0_SVW4_SK3_SKXCCM8_TLDS1_ULSGRO0_USL1_UIOFGRO0_USFGRO0_VSn1_VWA4_VWB4_WSGRA0_WSGRB0_WS64_WG32_8_1_WGM1_WGMXCC1_WGMXCCGn1
    SolutionIndex: 3
    SolutionNameMin: Cijk_Ailk_Bljk_I8_BH_UserArgs_MT128x256x32_MI16x16x1_SN_LDSB0_AFC0_AFEM1_AFEM1_ASEM1_CLR0_CADS0_DTVA0_DTVB0_EPS0_FDSI0_GRPM1_GRVWA4_GRVWB8_GSU0_GSUAMB_GSUC0_GSUWGMRR0_GLS0_ISA942_IU1_K1_LBSPPA1024_LBSPPB128_LBSPPM0_LPA64_LPB8_LPM0_LRVW8_LWPMn1_MIAV0_MIWT4_8_MO40_NTn1_NTA0_NTB0_NTC0_NTD0_NTM0_NEPBS0_NLCA1_NLCB1_ONLL1_PGR2_PLR0_PKA1_SIA3_SS1_SU0_SUM0_SUS32_SPO0_SRVW0_SSO0_SVW4_SK3_SKXCCM8_TLDS1_ULSGRO0_USL1_UIOFGRO0_USFGRO0_VSn1_VWA4_VWB1_WSGRA0_WSGRB0_WS64_WG32_8_1_WGM1_WGMXCC1_WGMXCCGn1
    SolutionIndex: 4
    SolutionNameMin: Cijk_Ailk_Bljk_I8_BH_UserArgs_MT128x256x32_MI16x16x1_SN_LDSB0_AFC0_AFEM1_AFEM1_ASEM1_CLR0_CADS0_DTVA0_DTVB0_EPS0_FDSI0_GRPM1_GRVWA4_GRVWB8_GSU0_GSUAMB_GSUC0_GSUWGMRR0_GLS0_ISA942_IU1_K1_LBSPPA1024_LBSPPB128_LBSPPM0_LPA64_LPB8_LPM0_LRVW8_LWPMn1_MIAV0_MIWT4_8_MO40_NTn1_NTA0_NTB0_NTC0_NTD0_NTM0_NEPBS0_NLCA1_NLCB1_ONLL1_PGR2_PLR0_PKA1_SIA3_SS1_SU0_SUM0_SUS32_SPO0_SRVW0_SSO0_SVW4_SK3_SKXCCM8_TLDS1_ULSGRO0_USL1_UIOFGRO0_USFGRO0_VSn1_VWA4_VWB2_WSGRA0_WSGRB0_WS64_WG32_8_1_WGM1_WGMXCC1_WGMXCCGn1
    SolutionIndex: 5
    SolutionNameMin: Cijk_Ailk_Bljk_I8_BH_UserArgs_MT128x256x32_MI16x16x1_SN_LDSB0_AFC0_AFEM1_AFEM1_ASEM1_CLR0_CADS0_DTVA0_DTVB0_EPS0_FDSI0_GRPM1_GRVWA4_GRVWB8_GSU0_GSUAMB_GSUC0_GSUWGMRR0_GLS0_ISA942_IU1_K1_LBSPPA1024_LBSPPB256_LBSPPM0_LPA64_LPB8_LPM0_LRVW8_LWPMn1_MIAV0_MIWT4_8_MO40_NTn1_NTA0_NTB0_NTC0_NTD0_NTM0_NEPBS0_NLCA1_NLCB1_ONLL1_PGR2_PLR0_PKA1_SIA3_SS1_SU0_SUM0_SUS32_SPO0_SRVW0_SSO0_SVW4_SK3_SKXCCM8_TLDS1_ULSGRO0_USL1_UIOFGRO0_USFGRO0_VSn1_VWA4_VWB8_WSGRA0_WSGRB0_WS64_WG32_8_1_WGM1_WGMXCC1_WGMXCCGn1
    SolutionIndex: 6
    SolutionNameMin: Cijk_Ailk_Bljk_I8_BH_UserArgs_MT256x128x32_MI16x16x1_SN_LDSB0_AFC0_AFEM1_AFEM1_ASEM1_CLR0_CADS0_DTVA0_DTVB0_EPS0_FDSI0_GRPM1_GRVWA4_GRVWB4_GSU0_GSUAMB_GSUC0_GSUWGMRR0_GLS0_ISA942_IU1_K1_LBSPPA2048_LBSPPB128_LBSPPM0_LPA0_LPB8_LPM0_LRVW8_LWPMn1_MIAV0_MIWT8_4_MO40_NTn1_NTA0_NTB0_NTC0_NTD0_NTM0_NEPBS0_NLCA1_NLCB1_ONLL1_PGR2_PLR0_PKA1_SIA3_SS1_SU0_SUM0_SUS32_SPO0_SRVW0_SSO0_SVW8_SK3_SKXCCM8_TLDS1_ULSGRO0_USL1_UIOFGRO0_USFGRO0_VSn1_VWA8_VWB1_WSGRA0_WSGRB0_WS64_WG32_8_1_WGM1_WGMXCC1_WGMXCCGn1
    SolutionIndex: 7
    SolutionNameMin: Cijk_Ailk_Bljk_I8_BH_UserArgs_MT256x128x32_MI16x16x1_SN_LDSB0_AFC0_AFEM1_AFEM1_ASEM1_CLR0_CADS0_DTVA0_DTVB0_EPS0_FDSI0_GRPM1_GRVWA4_GRVWB8_GSU0_GSUAMB_GSUC0_GSUWGMRR0_GLS0_ISA942_IU1_K1_LBSPPA2048_LBSPPB128_LBSPPM0_LPA0_LPB8_LPM0_LRVW8_LWPMn1_MIAV0_MIWT8_4_MO40_NTn1_NTA0_NTB0_NTC0_NTD0_NTM0_NEPBS0_NLCA1_NLCB1_ONLL1_PGR2_PLR0_PKA1_SIA3_SS1_SU0_SUM0_SUS32_SPO0_SRVW0_SSO0_SVW8_SK3_SKXCCM8_TLDS1_ULSGRO0_USL1_UIOFGRO0_USFGRO0_VSn1_VWA8_VWB1_WSGRA0_WSGRB0_WS64_WG32_8_1_WGM1_WGMXCC1_WGMXCCGn1
    SolutionIndex: 8
    SolutionNameMin: Cijk_Ailk_Bljk_I8_BH_UserArgs_MT128x128x32_MI16x16x1_SN_LDSB0_AFC0_AFEM1_AFEM1_ASEM1_CLR0_CADS0_DTVA0_DTVB0_EPS0_FDSI0_GRPM1_GRVWA8_GRVWB8_GSU0_GSUAMB_GSUC0_GSUWGMRR0_GLS0_ISA942_IU1_K1_LBSPPA1024_LBSPPB128_LBSPPM0_LPA64_LPB8_LPM0_LRVW8_LWPMn1_MIAV0_MIWT4_4_MO40_NTn1_NTA0_NTB0_NTC0_NTD0_NTM0_NEPBS0_NLCA1_NLCB1_ONLL1_PGR2_PLR0_PKA1_SIA3_SS1_SU0_SUM0_SUS32_SPO0_SRVW0_SSO0_SVW4_SK3_SKXCCM8_TLDS1_ULSGRO0_USL1_UIOFGRO0_USFGRO0_VSn1_VWA4_VWB2_WSGRA0_WSGRB0_WS64_WG32_8_1_WGM1_WGMXCC1_WGMXCCGn1
    SolutionIndex: 9
    SolutionNameMin: Cijk_Ailk_Bljk_I8_BH_UserArgs_MT32x32x32_MI16x16x1_SN_LDSB0_AFC0_AFEM1_AFEM1_ASEM1_CLR0_CADS0_DTVA0_DTVB0_EPS0_FDSI0_GRPM1_GRVWA4_GRVWB4_GSU0_GSUAMB_GSUC0_GSUWGMRR0_GLS0_ISA942_IU1_K1_LBSPPA256_LBSPPB128_LBSPPM0_LPA16_LPB8_LPM0_LRVW8_LWPMn1_MIAV0_MIWT1_1_MO40_NTn1_NTA0_NTB0_NTC0_NTD0_NTM0_NEPBS0_NLCA1_NLCB1_ONLL1_PGR2_PLR0_PKA1_SIA3_SS1_SU0_SUM0_SUS32_SPO0_SRVW0_SSO0_SVW1_SK3_SKXCCM8_TLDS1_ULSGRO0_USL1_UIOFGRO0_USFGRO0_VSn1_VWA1_VWB1_WSGRA0_WSGRB0_WS64_WG32_8_1_WGM1_WGMXCC1_WGMXCCGn1
    SolutionIndex: 10
    SolutionNameMin: Cijk_Ailk_Bljk_I8_BH_UserArgs_MT256x256x64_MI16x16x1_SN_LDSB1_AFC0_AFEM1_AFEM1_ASEM1_CLR1_CADS0_DTVA0_DTVB0_EPS0_FDSI0_GRPM1_GRVWA4_GRVWB4_GSU0_GSUAMB_GSUC0_GSUWGMRR0_GLS0_ISA942_IU1_K1_LBSPPA2048_LBSPPB128_LBSPPM0_LPA64_LPB8_LPM0_LRVW8_LWPMn1_MIAV0_MIWT8_8_MO40_NTn1_NTA0_NTB0_NTC0_NTD0_NTM0_NEPBS0_NLCA1_NLCB1_ONLL1_PGR2_PLR1_PKA1_SIA3_SS1_SU0_SUM0_SUS64_SPO0_SRVW0_SSO0_SVW4_SK3_SKXCCM8_TLDS1_ULSGRO0_USL1_UIOFGRO0_USFGRO0_VSn1_VWA4_VWB1_WSGRA0_WSGRB0_WS64_WG32_8_1_WGM1_WGMXCC1_WGMXCCGn1
    SolutionIndex: 11
    SolutionNameMin: Cijk_Ailk_Bljk_I8_BH_UserArgs_MT256x256x64_MI16x16x1_SN_LDSB1_AFC0_AFEM1_AFEM1_ASEM1_CLR1_CADS0_DTVA0_DTVB0_EPS0_FDSI0_GRPM1_GRVWA4_GRVWB4_GSU0_GSUAMB_GSUC0_GSUWGMRR0_GLS0_ISA942_IU1_K1_LBSPPA2048_LBSPPB128_LBSPPM0_LPA0_LPB8_LPM0_LRVW8_LWPMn1_MIAV0_MIWT8_8_MO40_NTn1_NTA0_NTB0_NTC0_NTD0_NTM0_NEPBS0_NLCA1_NLCB1_ONLL1_PGR2_PLR1_PKA1_SIA3_SS1_SU0_SUM0_SUS64_SPO0_SRVW0_SSO0_SVW8_SK3_SKXCCM8_TLDS1_ULSGRO0_USL1_UIOFGRO0_USFGRO0_VSn1_VWA8_VWB1_WSGRA0_WSGRB0_WS64_WG32_8_1_WGM1_WGMXCC1_WGMXCCGn1
    SolutionIndex: 12
    SolutionNameMin: Cijk_Ailk_Bljk_I8_BH_UserArgs_MT256x256x64_MI16x16x1_SN_LDSB1_AFC0_AFEM1_AFEM1_ASEM1_CLR1_CADS0_DTVA0_DTVB0_EPS0_FDSI0_GRPM1_GRVWA4_GRVWB4_GSU0_GSUAMB_GSUC0_GSUWGMRR0_GLS0_ISA942_IU1_K1_LBSPPA2048_LBSPPB128_LBSPPM0_LPA64_LPB8_LPM0_LRVW8_LWPMn1_MIAV0_MIWT8_8_MO40_NTn1_NTA0_NTB0_NTC0_NTD0_NTM0_NEPBS0_NLCA1_NLCB1_ONLL1_PGR2_PLR1_PKA1_SIA3_SS1_SU0_SUM0_SUS64_SPO0_SRVW0_SSO0_SVW4_SK3_SKXCCM8_TLDS1_ULSGRO0_USL1_UIOFGRO0_USFGRO0_VSn1_VWA4_VWB2_WSGRA0_WSGRB0_WS64_WG32_8_1_WGM1_WGMXCC1_WGMXCCGn1
    SolutionIndex: 13
    SolutionNameMin: Cijk_Ailk_Bljk_I8_BH_UserArgs_MT256x256x64_MI16x16x1_SN_LDSB1_AFC0_AFEM1_AFEM1_ASEM1_CLR1_CADS0_DTVA0_DTVB0_EPS0_FDSI0_GRPM1_GRVWA4_GRVWB4_GSU0_GSUAMB_GSUC0_GSUWGMRR0_GLS0_ISA942_IU1_K1_LBSPPA2048_LBSPPB256_LBSPPM0_LPA64_LPB8_LPM0_LRVW8_LWPMn1_MIAV0_MIWT8_8_MO40_NTn1_NTA0_NTB0_NTC0_NTD0_NTM0_NEPBS0_NLCA1_NLCB1_ONLL1_PGR2_PLR1_PKA1_SIA3_SS1_SU0_SUM0_SUS64_SPO0_SRVW0_SSO0_SVW4_SK3_SKXCCM8_TLDS1_ULSGRO0_USL1_UIOFGRO0_USFGRO0_VSn1_VWA4_VWB4_WSGRA0_WSGRB0_WS64_WG32_8_1_WGM1_WGMXCC1_WGMXCCGn1
    SolutionIndex: 14
    SolutionNameMin: Cijk_Ailk_Bljk_I8_BH_UserArgs_MT256x256x64_MI16x16x1_SN_LDSB1_AFC0_AFEM1_AFEM1_ASEM1_CLR1_CADS0_DTVA0_DTVB0_EPS0_FDSI0_GRPM1_GRVWA4_GRVWB4_GSU0_GSUAMB_GSUC0_GSUWGMRR0_GLS0_ISA942_IU1_K1_LBSPPA2048_LBSPPB512_LBSPPM0_LPA64_LPB8_LPM0_LRVW8_LWPMn1_MIAV0_MIWT8_8_MO40_NTn1_NTA0_NTB0_NTC0_NTD0_NTM0_NEPBS0_NLCA1_NLCB1_ONLL1_PGR2_PLR1_PKA1_SIA3_SS1_SU0_SUM0_SUS64_SPO0_SRVW0_SSO0_SVW4_SK3_SKXCCM8_TLDS1_ULSGRO0_USL1_UIOFGRO0_USFGRO0_VSn1_VWA4_VWB8_WSGRA0_WSGRB0_WS64_WG32_8_1_WGM1_WGMXCC1_WGMXCCGn1
    SolutionIndex: 15
    SolutionNameMin: Cijk_Ailk_Bljk_I8_BH_UserArgs_MT256x256x64_MI16x16x1_SN_LDSB1_AFC0_AFEM1_AFEM1_ASEM1_CLR1_CADS0_DTVA0_DTVB0_EPS0_FDSI0_GRPM1_GRVWA4_GRVWB8_GSU0_GSUAMB_GSUC0_GSUWGMRR0_GLS0_ISA942_IU1_K1_LBSPPA2048_LBSPPB128_LBSPPM0_LPA64_LPB8_LPM0_LRVW8_LWPMn1_MIAV0_MIWT8_8_MO40_NTn1_NTA0_NTB0_NTC0_NTD0_NTM0_NEPBS0_NLCA1_NLCB1_ONLL1_PGR2_PLR1_PKA1_SIA3_SS1_SU0_SUM0_SUS64_SPO0_SRVW0_SSO0_SVW4_SK3_SKXCCM8_TLDS1_ULSGRO0_USL1_UIOFGRO0_USFGRO0_VSn1_VWA4_VWB1_WSGRA0_WSGRB0_WS64_WG32_8_1_WGM1_WGMXCC1_WGMXCCGn1
    SolutionIndex: 16
    SolutionNameMin: Cijk_Ailk_Bljk_I8_BH_UserArgs_MT256x256x64_MI16x16x1_SN_LDSB1_AFC0_AFEM1_AFEM1_ASEM1_CLR1_CADS0_DTVA0_DTVB0_EPS0_FDSI0_GRPM1_GRVWA4_GRVWB4_GSU0_GSUAMB_GSUC0_GSUWGMRR0_GLS0_ISA942_IU1_K1_LBSPPA2048_LBSPPB128_LBSPPM0_LPA64_LPB8_LPM0_LRVW8_LWPMn1_MIAV0_MIWT8_8_MO40_NTn1_NTA0_NTB0_NTC0_NTD0_NTM0_NEPBS0_NLCA1_NLCB1_ONLL1_PGR2_PLR1_PKA1_SIA3_SS1_SU0_SUM0_SUS64_SPO0_SRVW0_SSO0_SVW4_SK3_SKXCCM8_TLDS1_ULSGRO0_USL1_UIOFGRO0_USFGRO0_VSn1_VWA4_VWB2_WSGRA0_WSGRB0_WS64_WG32_8_1_WGM4_WGMXCC1_WGMXCCGn1
    SolutionIndex: 17
    SolutionNameMin: Cijk_Ailk_Bljk_I8_BH_UserArgs_MT256x256x64_MI16x16x1_SN_LDSB1_AFC0_AFEM1_AFEM1_ASEM1_CLR1_CADS0_DTVA0_DTVB0_EPS0_FDSI0_GRPM1_GRVWA4_GRVWB4_GSU0_GSUAMB_GSUC0_GSUWGMRR0_GLS0_ISA942_IU1_K1_LBSPPA2048_LBSPPB256_LBSPPM0_LPA64_LPB8_LPM0_LRVW8_LWPMn1_MIAV0_MIWT8_8_MO40_NTn1_NTA0_NTB0_NTC0_NTD0_NTM0_NEPBS0_NLCA1_NLCB1_ONLL1_PGR2_PLR1_PKA1_SIA3_SS1_SU0_SUM0_SUS64_SPO0_SRVW0_SSO0_SVW4_SK3_SKXCCM8_TLDS1_ULSGRO0_USL1_UIOFGRO0_USFGRO0_VSn1_VWA4_VWB4_WSGRA0_WSGRB0_WS64_WG32_8_1_WGM4_WGMXCC1_WGMXCCGn1
    SolutionIndex: 18
    SolutionNameMin: Cijk_Ailk_Bljk_I8_BH_UserArgs_MT256x256x64_MI16x16x1_SN_LDSB1_AFC0_AFEM1_AFEM1_ASEM1_CLR1_CADS0_DTVA0_DTVB0_EPS0_FDSI0_GRPM1_GRVWA4_GRVWB4_GSU0_GSUAMB_GSUC0_GSUWGMRR0_GLS0_ISA942_IU1_K1_LBSPPA2048_LBSPPB512_LBSPPM0_LPA64_LPB8_LPM0_LRVW8_LWPMn1_MIAV0_MIWT8_8_MO40_NTn1_NTA0_NTB0_NTC0_NTD0_NTM0_NEPBS0_NLCA1_NLCB1_ONLL1_PGR2_PLR1_PKA1_SIA3_SS1_SU0_SUM0_SUS64_SPO0_SRVW0_SSO0_SVW4_SK3_SKXCCM8_TLDS1_ULSGRO0_USL1_UIOFGRO0_USFGRO0_VSn1_VWA4_VWB8_WSGRA0_WSGRB0_WS64_WG32_8_1_WGM4_WGMXCC1_WGMXCCGn1
    SolutionIndex: 19
    SolutionNameMin: Cijk_Ailk_Bljk_I8_BH_UserArgs_MT256x256x64_MI16x16x1_SN_LDSB1_AFC0_AFEM1_AFEM1_ASEM1_CLR1_CADS0_DTVA0_DTVB0_EPS0_FDSI0_GRPM1_GRVWA4_GRVWB4_GSU0_GSUAMB_GSUC0_GSUWGMRR0_GLS0_ISA942_IU1_K1_LBSPPA2048_LBSPPB128_LBSPPM0_LPA64_LPB8_LPM0_LRVW8_LWPMn1_MIAV0_MIWT8_8_MO40_NTn1_NTA0_NTB0_NTC0_NTD0_NTM0_NEPBS0_NLCA1_NLCB1_ONLL1_PGR2_PLR1_PKA1_SIA3_SS1_SU0_SUM0_SUS64_SPO0_SRVW0_SSO0_SVW4_SK3_SKXCCM8_TLDS1_ULSGRO0_USL1_UIOFGRO0_USFGRO0_VSn1_VWA4_VWB2_WSGRA0_WSGRB0_WS64_WG32_8_1_WGM8_WGMXCC1_WGMXCCGn1
    SolutionIndex: 20
    SolutionNameMin: Cijk_Ailk_Bljk_I8_BH_UserArgs_MT256x256x64_MI16x16x1_SN_LDSB1_AFC0_AFEM1_AFEM1_ASEM1_CLR1_CADS0_DTVA0_DTVB0_EPS0_FDSI0_GRPM1_GRVWA4_GRVWB4_GSU0_GSUAMB_GSUC0_GSUWGMRR0_GLS0_ISA942_IU1_K1_LBSPPA2048_LBSPPB512_LBSPPM0_LPA64_LPB8_LPM0_LRVW8_LWPMn1_MIAV0_MIWT8_8_MO40_NTn1_NTA0_NTB0_NTC0_NTD0_NTM0_NEPBS0_NLCA1_NLCB1_ONLL1_PGR2_PLR1_PKA1_SIA3_SS1_SU0_SUM0_SUS64_SPO0_SRVW0_SSO0_SVW4_SK3_SKXCCM8_TLDS1_ULSGRO0_USL1_UIOFGRO0_USFGRO0_VSn1_VWA4_VWB8_WSGRA0_WSGRB0_WS64_WG32_8_1_WGM8_WGMXCC1_WGMXCCGn1
    SolutionIndex: 21
    SolutionNameMin: Cijk_Ailk_Bljk_I8_BH_UserArgs_MT128x256x64_MI16x16x1_SN_LDSB1_AFC0_AFEM1_AFEM1_ASEM1_CLR1_CADS0_DTVA0_DTVB0_EPS0_FDSI0_GRPM1_GRVWA4_GRVWB4_GSU0_GSUAMB_GSUC0_GSUWGMRR0_GLS0_ISA942_IU1_K1_LBSPPA1024_LBSPPB128_LBSPPM0_LPA64_LPB8_LPM0_LRVW8_LWPMn1_MIAV0_MIWT4_8_MO40_NTn1_NTA0_NTB0_NTC0_NTD0_NTM0_NEPBS0_NLCA1_NLCB1_ONLL1_PGR2_PLR1_PKA1_SIA3_SS1_SU0_SUM0_SUS64_SPO0_SRVW0_SSO0_SVW4_SK3_SKXCCM8_TLDS1_ULSGRO0_USL1_UIOFGRO0_USFGRO0_VSn1_VWA4_VWB1_WSGRA0_WSGRB0_WS64_WG32_8_1_WGM1_WGMXCC1_WGMXCCGn1
    SolutionIndex: 22
    SolutionNameMin: Cijk_Ailk_Bljk_I8_BH_UserArgs_MT128x256x64_MI16x16x1_SN_LDSB1_AFC0_AFEM1_AFEM1_ASEM1_CLR1_CADS0_DTVA0_DTVB0_EPS0_FDSI0_GRPM1_GRVWA4_GRVWB4_GSU0_GSUAMB_GSUC0_GSUWGMRR0_GLS0_ISA942_IU1_K1_LBSPPA1024_LBSPPB128_LBSPPM0_LPA64_LPB8_LPM0_LRVW8_LWPMn1_MIAV0_MIWT4_8_MO40_NTn1_NTA0_NTB0_NTC0_NTD0_NTM0_NEPBS0_NLCA1_NLCB1_ONLL1_PGR2_PLR1_PKA1_SIA3_SS1_SU0_SUM0_SUS64_SPO0_SRVW0_SSO0_SVW4_SK3_SKXCCM8_TLDS1_ULSGRO0_USL1_UIOFGRO0_USFGRO0_VSn1_VWA4_VWB2_WSGRA0_WSGRB0_WS64_WG32_8_1_WGM1_WGMXCC1_WGMXCCGn1
    SolutionIndex: 23
    SolutionNameMin: Cijk_Ailk_Bljk_I8_BH_UserArgs_MT128x256x64_MI16x16x1_SN_LDSB1_AFC0_AFEM1_AFEM1_ASEM1_CLR1_CADS0_DTVA0_DTVB0_EPS0_FDSI0_GRPM1_GRVWA4_GRVWB4_GSU0_GSUAMB_GSUC0_GSUWGMRR0_GLS0_ISA942_IU1_K1_LBSPPA1024_LBSPPB256_LBSPPM0_LPA64_LPB8_LPM0_LRVW8_LWPMn1_MIAV0_MIWT4_8_MO40_NTn1_NTA0_NTB0_NTC0_NTD0_NTM0_NEPBS0_NLCA1_NLCB1_ONLL1_PGR2_PLR1_PKA1_SIA3_SS1_SU0_SUM0_SUS64_SPO0_SRVW0_SSO0_SVW4_SK3_SKXCCM8_TLDS1_ULSGRO0_USL1_UIOFGRO0_USFGRO0_VSn1_VWA4_VWB4_WSGRA0_WSGRB0_WS64_WG32_8_1_WGM1_WGMXCC1_WGMXCCGn1
    SolutionIndex: 24
    SolutionNameMin: Cijk_Ailk_Bljk_I8_BH_UserArgs_MT128x256x64_MI16x16x1_SN_LDSB1_AFC0_AFEM1_AFEM1_ASEM1_CLR1_CADS0_DTVA0_DTVB0_EPS0_FDSI0_GRPM1_GRVWA4_GRVWB4_GSU0_GSUAMB_GSUC0_GSUWGMRR0_GLS0_ISA942_IU1_K1_LBSPPA1024_LBSPPB512_LBSPPM0_LPA64_LPB8_LPM0_LRVW8_LWPMn1_MIAV0_MIWT4_8_MO40_NTn1_NTA0_NTB0_NTC0_NTD0_NTM0_NEPBS0_NLCA1_NLCB1_ONLL1_PGR2_PLR1_PKA1_SIA3_SS1_SU0_SUM0_SUS64_SPO0_SRVW0_SSO0_SVW4_SK3_SKXCCM8_TLDS1_ULSGRO0_USL1_UIOFGRO0_USFGRO0_VSn1_VWA4_VWB8_WSGRA0_WSGRB0_WS64_WG32_8_1_WGM1_WGMXCC1_WGMXCCGn1
    SolutionIndex: 25
    SolutionNameMin: Cijk_Ailk_Bljk_I8_BH_UserArgs_MT128x256x64_MI16x16x1_SN_LDSB1_AFC0_AFEM1_AFEM1_ASEM1_CLR1_CADS0_DTVA0_DTVB0_EPS0_FDSI0_GRPM1_GRVWA4_GRVWB8_GSU0_GSUAMB_GSUC0_GSUWGMRR0_GLS0_ISA942_IU1_K1_LBSPPA1024_LBSPPB128_LBSPPM0_LPA64_LPB8_LPM0_LRVW8_LWPMn1_MIAV0_MIWT4_8_MO40_NTn1_NTA0_NTB0_NTC0_NTD0_NTM0_NEPBS0_NLCA1_NLCB1_ONLL1_PGR2_PLR1_PKA1_SIA3_SS1_SU0_SUM0_SUS64_SPO0_SRVW0_SSO0_SVW4_SK3_SKXCCM8_TLDS1_ULSGRO0_USL1_UIOFGRO0_USFGRO0_VSn1_VWA4_VWB1_WSGRA0_WSGRB0_WS64_WG32_8_1_WGM1_WGMXCC1_WGMXCCGn1
    SolutionIndex: 26
    SolutionNameMin: Cijk_Ailk_Bljk_I8_BH_UserArgs_MT128x256x64_MI16x16x1_SN_LDSB1_AFC0_AFEM1_AFEM1_ASEM1_CLR1_CADS0_DTVA0_DTVB0_EPS0_FDSI0_GRPM1_GRVWA4_GRVWB8_GSU0_GSUAMB_GSUC0_GSUWGMRR0_GLS0_ISA942_IU1_K1_LBSPPA1024_LBSPPB128_LBSPPM0_LPA64_LPB8_LPM0_LRVW8_LWPMn1_MIAV0_MIWT4_8_MO40_NTn1_NTA0_NTB0_NTC0_NTD0_NTM0_NEPBS0_NLCA1_NLCB1_ONLL1_PGR2_PLR1_PKA1_SIA3_SS1_SU0_SUM0_SUS64_SPO0_SRVW0_SSO0_SVW4_SK3_SKXCCM8_TLDS1_ULSGRO0_USL1_UIOFGRO0_USFGRO0_VSn1_VWA4_VWB2_WSGRA0_WSGRB0_WS64_WG32_8_1_WGM1_WGMXCC1_WGMXCCGn1
    SolutionIndex: 27
    SolutionNameMin: Cijk_Ailk_Bljk_I8_BH_UserArgs_MT128x256x64_MI16x16x1_SN_LDSB1_AFC0_AFEM1_AFEM1_ASEM1_CLR1_CADS0_DTVA0_DTVB0_EPS0_FDSI0_GRPM1_GRVWA4_GRVWB8_GSU0_GSUAMB_GSUC0_GSUWGMRR0_GLS0_ISA942_IU1_K1_LBSPPA1024_LBSPPB256_LBSPPM0_LPA64_LPB8_LPM0_LRVW8_LWPMn1_MIAV0_MIWT4_8_MO40_NTn1_NTA0_NTB0_NTC0_NTD0_NTM0_NEPBS0_NLCA1_NLCB1_ONLL1_PGR2_PLR1_PKA1_SIA3_SS1_SU0_SUM0_SUS64_SPO0_SRVW0_SSO0_SVW4_SK3_SKXCCM8_TLDS1_ULSGRO0_USL1_UIOFGRO0_USFGRO0_VSn1_VWA4_VWB4_WSGRA0_WSGRB0_WS64_WG32_8_1_WGM1_WGMXCC1_WGMXCCGn1
    SolutionIndex: 28
    SolutionNameMin: Cijk_Ailk_Bljk_I8_BH_UserArgs_MT128x256x64_MI16x16x1_SN_LDSB1_AFC0_AFEM1_AFEM1_ASEM1_CLR1_CADS0_DTVA0_DTVB0_EPS0_FDSI0_GRPM1_GRVWA4_GRVWB8_GSU0_GSUAMB_GSUC0_GSUWGMRR0_GLS0_ISA942_IU1_K1_LBSPPA1024_LBSPPB512_LBSPPM0_LPA64_LPB8_LPM0_LRVW8_LWPMn1_MIAV0_MIWT4_8_MO40_NTn1_NTA0_NTB0_NTC0_NTD0_NTM0_NEPBS0_NLCA1_NLCB1_ONLL1_PGR2_PLR1_PKA1_SIA3_SS1_SU0_SUM0_SUS64_SPO0_SRVW0_SSO0_SVW4_SK3_SKXCCM8_TLDS1_ULSGRO0_USL1_UIOFGRO0_USFGRO0_VSn1_VWA4_VWB8_WSGRA0_WSGRB0_WS64_WG32_8_1_WGM1_WGMXCC1_WGMXCCGn1
    SolutionIndex: 29
    SolutionNameMin: Cijk_Ailk_Bljk_I8_BH_UserArgs_MT128x256x64_MI16x16x1_SN_LDSB1_AFC0_AFEM1_AFEM1_ASEM1_CLR1_CADS0_DTVA0_DTVB0_EPS0_FDSI0_GRPM1_GRVWA4_GRVWB8_GSU0_GSUAMB_GSUC0_GSUWGMRR0_GLS0_ISA942_IU1_K1_LBSPPA1024_LBSPPB256_LBSPPM0_LPA64_LPB8_LPM0_LRVW8_LWPMn1_MIAV0_MIWT4_8_MO40_NTn1_NTA0_NTB0_NTC0_NTD0_NTM0_NEPBS0_NLCA1_NLCB1_ONLL1_PGR2_PLR1_PKA1_SIA3_SS1_SU0_SUM0_SUS64_SPO0_SRVW0_SSO0_SVW4_SK3_SKXCCM8_TLDS1_ULSGRO0_USL1_UIOFGRO0_USFGRO0_VSn1_VWA4_VWB4_WSGRA0_WSGRB0_WS64_WG32_8_1_WGM4_WGMXCC1_WGMXCCGn1
    SolutionIndex: 30
    SolutionNameMin: Cijk_Ailk_Bljk_I8_BH_UserArgs_MT128x256x64_MI16x16x1_SN_LDSB1_AFC0_AFEM1_AFEM1_ASEM1_CLR1_CADS0_DTVA0_DTVB0_EPS0_FDSI0_GRPM1_GRVWA4_GRVWB8_GSU0_GSUAMB_GSUC0_GSUWGMRR0_GLS0_ISA942_IU1_K1_LBSPPA1024_LBSPPB512_LBSPPM0_LPA64_LPB8_LPM0_LRVW8_LWPMn1_MIAV0_MIWT4_8_MO40_NTn1_NTA0_NTB0_NTC0_NTD0_NTM0_NEPBS0_NLCA1_NLCB1_ONLL1_PGR2_PLR1_PKA1_SIA3_SS1_SU0_SUM0_SUS64_SPO0_SRVW0_SSO0_SVW4_SK3_SKXCCM8_TLDS1_ULSGRO0_USL1_UIOFGRO0_USFGRO0_VSn1_VWA4_VWB8_WSGRA0_WSGRB0_WS64_WG32_8_1_WGM4_WGMXCC1_WGMXCCGn1
    SolutionIndex: 31
    SolutionNameMin: Cijk_Ailk_Bljk_I8_BH_UserArgs_MT128x256x64_MI16x16x1_SN_LDSB1_AFC0_AFEM1_AFEM1_ASEM1_CLR1_CADS0_DTVA0_DTVB0_EPS0_FDSI0_GRPM1_GRVWA4_GRVWB8_GSU0_GSUAMB_GSUC0_GSUWGMRR0_GLS0_ISA942_IU1_K1_LBSPPA1024_LBSPPB128_LBSPPM0_LPA64_LPB8_LPM0_LRVW8_LWPMn1_MIAV0_MIWT4_8_MO40_NTn1_NTA0_NTB0_NTC0_NTD0_NTM0_NEPBS0_NLCA1_NLCB1_ONLL1_PGR2_PLR1_PKA1_SIA3_SS1_SU0_SUM0_SUS64_SPO0_SRVW0_SSO0_SVW4_SK3_SKXCCM8_TLDS1_ULSGRO0_USL1_UIOFGRO0_USFGRO0_VSn1_VWA4_VWB2_WSGRA0_WSGRB0_WS64_WG32_8_1_WGM8_WGMXCC1_WGMXCCGn1
    SolutionIndex: 32
    SolutionNameMin: Cijk_Ailk_Bljk_I8_BH_UserArgs_MT128x256x64_MI16x16x1_SN_LDSB1_AFC0_AFEM1_AFEM1_ASEM1_CLR1_CADS0_DTVA0_DTVB0_EPS0_FDSI0_GRPM1_GRVWA4_GRVWB8_GSU0_GSUAMB_GSUC0_GSUWGMRR0_GLS0_ISA942_IU1_K1_LBSPPA1024_LBSPPB512_LBSPPM0_LPA64_LPB8_LPM0_LRVW8_LWPMn1_MIAV0_MIWT4_8_MO40_NTn1_NTA0_NTB0_NTC0_NTD0_NTM0_NEPBS0_NLCA1_NLCB1_ONLL1_PGR2_PLR1_PKA1_SIA3_SS1_SU0_SUM0_SUS64_SPO0_SRVW0_SSO0_SVW4_SK3_SKXCCM8_TLDS1_ULSGRO0_USL1_UIOFGRO0_USFGRO0_VSn1_VWA4_VWB8_WSGRA0_WSGRB0_WS64_WG32_8_1_WGM8_WGMXCC1_WGMXCCGn1
    SolutionIndex: 33
    SolutionNameMin: Cijk_Ailk_Bljk_I8_BH_UserArgs_MT256x128x64_MI16x16x1_SN_LDSB1_AFC0_AFEM1_AFEM1_ASEM1_CLR1_CADS0_DTVA0_DTVB0_EPS0_FDSI0_GRPM1_GRVWA4_GRVWB4_GSU0_GSUAMB_GSUC0_GSUWGMRR0_GLS0_ISA942_IU1_K1_LBSPPA2048_LBSPPB128_LBSPPM0_LPA0_LPB8_LPM0_LRVW8_LWPMn1_MIAV0_MIWT8_4_MO40_NTn1_NTA0_NTB0_NTC0_NTD0_NTM0_NEPBS0_NLCA1_NLCB1_ONLL1_PGR2_PLR1_PKA1_SIA3_SS1_SU0_SUM0_SUS64_SPO0_SRVW0_SSO0_SVW8_SK3_SKXCCM8_TLDS1_ULSGRO0_USL1_UIOFGRO0_USFGRO0_VSn1_VWA8_VWB1_WSGRA0_WSGRB0_WS64_WG32_8_1_WGM1_WGMXCC1_WGMXCCGn1
    SolutionIndex: 34
    SolutionNameMin: Cijk_Ailk_Bljk_I8_BH_UserArgs_MT256x128x64_MI16x16x1_SN_LDSB1_AFC0_AFEM1_AFEM1_ASEM1_CLR1_CADS0_DTVA0_DTVB0_EPS0_FDSI0_GRPM1_GRVWA4_GRVWB8_GSU0_GSUAMB_GSUC0_GSUWGMRR0_GLS0_ISA942_IU1_K1_LBSPPA2048_LBSPPB128_LBSPPM0_LPA0_LPB8_LPM0_LRVW8_LWPMn1_MIAV0_MIWT8_4_MO40_NTn1_NTA0_NTB0_NTC0_NTD0_NTM0_NEPBS0_NLCA1_NLCB1_ONLL1_PGR2_PLR1_PKA1_SIA3_SS1_SU0_SUM0_SUS64_SPO0_SRVW0_SSO0_SVW8_SK3_SKXCCM8_TLDS1_ULSGRO0_USL1_UIOFGRO0_USFGRO0_VSn1_VWA8_VWB2_WSGRA0_WSGRB0_WS64_WG32_8_1_WGM1_WGMXCC1_WGMXCCGn1
    SolutionIndex: 35
    SolutionNameMin: Cijk_Ailk_Bljk_I8_BH_UserArgs_MT256x128x64_MI16x16x1_SN_LDSB1_AFC0_AFEM1_AFEM1_ASEM1_CLR1_CADS0_DTVA0_DTVB0_EPS0_FDSI0_GRPM1_GRVWA4_GRVWB8_GSU0_GSUAMB_GSUC0_GSUWGMRR0_GLS0_ISA942_IU1_K1_LBSPPA2048_LBSPPB256_LBSPPM0_LPA0_LPB8_LPM0_LRVW8_LWPMn1_MIAV0_MIWT8_4_MO40_NTn1_NTA0_NTB0_NTC0_NTD0_NTM0_NEPBS0_NLCA1_NLCB1_ONLL1_PGR2_PLR1_PKA1_SIA3_SS1_SU0_SUM0_SUS64_SPO0_SRVW0_SSO0_SVW8_SK3_SKXCCM8_TLDS1_ULSGRO0_USL1_UIOFGRO0_USFGRO0_VSn1_VWA8_VWB4_WSGRA0_WSGRB0_WS64_WG32_8_1_WGM1_WGMXCC1_WGMXCCGn1
    SolutionIndex: 36
    SolutionNameMin: Cijk_Ailk_Bljk_I8_BH_UserArgs_MT256x128x64_MI16x16x1_SN_LDSB1_AFC0_AFEM1_AFEM1_ASEM1_CLR1_CADS0_DTVA0_DTVB0_EPS0_FDSI0_GRPM1_GRVWA8_GRVWB8_GSU0_GSUAMB_GSUC0_GSUWGMRR0_GLS0_ISA942_IU1_K1_LBSPPA2048_LBSPPB128_LBSPPM0_LPA0_LPB8_LPM0_LRVW8_LWPMn1_MIAV0_MIWT8_4_MO40_NTn1_NTA0_NTB0_NTC0_NTD0_NTM0_NEPBS0_NLCA1_NLCB1_ONLL1_PGR2_PLR1_PKA1_SIA3_SS1_SU0_SUM0_SUS64_SPO0_SRVW0_SSO0_SVW8_SK3_SKXCCM8_TLDS1_ULSGRO0_USL1_UIOFGRO0_USFGRO0_VSn1_VWA8_VWB1_WSGRA0_WSGRB0_WS64_WG32_8_1_WGM1_WGMXCC1_WGMXCCGn1
    SolutionIndex: 37
    SolutionNameMin: Cijk_Ailk_Bljk_I8_BH_UserArgs_MT256x128x64_MI16x16x1_SN_LDSB1_AFC0_AFEM1_AFEM1_ASEM1_CLR1_CADS0_DTVA0_DTVB0_EPS0_FDSI0_GRPM1_GRVWA8_GRVWB8_GSU0_GSUAMB_GSUC0_GSUWGMRR0_GLS0_ISA942_IU1_K1_LBSPPA2048_LBSPPB128_LBSPPM0_LPA0_LPB8_LPM0_LRVW8_LWPMn1_MIAV0_MIWT8_4_MO40_NTn1_NTA0_NTB0_NTC0_NTD0_NTM0_NEPBS0_NLCA1_NLCB1_ONLL1_PGR2_PLR1_PKA1_SIA3_SS1_SU0_SUM0_SUS64_SPO0_SRVW0_SSO0_SVW8_SK3_SKXCCM8_TLDS1_ULSGRO0_USL1_UIOFGRO0_USFGRO0_VSn1_VWA8_VWB2_WSGRA0_WSGRB0_WS64_WG32_8_1_WGM1_WGMXCC1_WGMXCCGn1
    SolutionIndex: 38
    SolutionNameMin: Cijk_Ailk_Bljk_I8_BH_UserArgs_MT128x128x64_MI16x16x1_SN_LDSB1_AFC0_AFEM1_AFEM1_ASEM1_CLR1_CADS0_DTVA0_DTVB0_EPS0_FDSI0_GRPM1_GRVWA4_GRVWB8_GSU0_GSUAMB_GSUC0_GSUWGMRR0_GLS0_ISA942_IU1_K1_LBSPPA1024_LBSPPB128_LBSPPM0_LPA64_LPB8_LPM0_LRVW8_LWPMn1_MIAV0_MIWT4_4_MO40_NTn1_NTA0_NTB0_NTC0_NTD0_NTM0_NEPBS0_NLCA1_NLCB1_ONLL1_PGR2_PLR1_PKA1_SIA3_SS1_SU0_SUM0_SUS64_SPO0_SRVW0_SSO0_SVW4_SK3_SKXCCM8_TLDS1_ULSGRO0_USL1_UIOFGRO0_USFGRO0_VSn1_VWA4_VWB1_WSGRA0_WSGRB0_WS64_WG32_8_1_WGM1_WGMXCC1_WGMXCCGn1
    SolutionIndex: 39
    SolutionNameMin: Cijk_Ailk_Bljk_I8_BH_UserArgs_MT128x128x64_MI16x16x1_SN_LDSB1_AFC0_AFEM1_AFEM1_ASEM1_CLR1_CADS0_DTVA0_DTVB0_EPS0_FDSI0_GRPM1_GRVWA4_GRVWB8_GSU0_GSUAMB_GSUC0_GSUWGMRR0_GLS0_ISA942_IU1_K1_LBSPPA1024_LBSPPB128_LBSPPM0_LPA64_LPB8_LPM0_LRVW8_LWPMn1_MIAV0_MIWT4_4_MO40_NTn1_NTA0_NTB0_NTC0_NTD0_NTM0_NEPBS0_NLCA1_NLCB1_ONLL1_PGR2_PLR1_PKA1_SIA3_SS1_SU0_SUM0_SUS64_SPO0_SRVW0_SSO0_SVW4_SK3_SKXCCM8_TLDS1_ULSGRO0_USL1_UIOFGRO0_USFGRO0_VSn1_VWA4_VWB2_WSGRA0_WSGRB0_WS64_WG32_8_1_WGM1_WGMXCC1_WGMXCCGn1
    SolutionIndex: 40
    SolutionNameMin: Cijk_Ailk_Bljk_I8_BH_UserArgs_MT128x128x64_MI16x16x1_SN_LDSB1_AFC0_AFEM1_AFEM1_ASEM1_CLR1_CADS0_DTVA0_DTVB0_EPS0_FDSI0_GRPM1_GRVWA4_GRVWB8_GSU0_GSUAMB_GSUC0_GSUWGMRR0_GLS0_ISA942_IU1_K1_LBSPPA1024_LBSPPB256_LBSPPM0_LPA64_LPB8_LPM0_LRVW8_LWPMn1_MIAV0_MIWT4_4_MO40_NTn1_NTA0_NTB0_NTC0_NTD0_NTM0_NEPBS0_NLCA1_NLCB1_ONLL1_PGR2_PLR1_PKA1_SIA3_SS1_SU0_SUM0_SUS64_SPO0_SRVW0_SSO0_SVW4_SK3_SKXCCM8_TLDS1_ULSGRO0_USL1_UIOFGRO0_USFGRO0_VSn1_VWA4_VWB4_WSGRA0_WSGRB0_WS64_WG32_8_1_WGM1_WGMXCC1_WGMXCCGn1
    SolutionIndex: 41
    SolutionNameMin: Cijk_Ailk_Bljk_I8_BH_UserArgs_MT64x128x64_MI16x16x1_SN_LDSB0_AFC0_AFEM1_AFEM1_ASEM1_CLR1_CADS0_DTVA0_DTVB0_EPS0_FDSI0_GRPM1_GRVWA4_GRVWB8_GSU0_GSUAMB_GSUC0_GSUWGMRR0_GLS0_ISA942_IU1_K1_LBSPPA512_LBSPPB128_LBSPPM0_LPA32_LPB8_LPM0_LRVW8_LWPMn1_MIAV0_MIWT2_4_MO40_NTn1_NTA0_NTB0_NTC0_NTD0_NTM0_NEPBS0_NLCA1_NLCB1_ONLL1_PGR2_PLR1_PKA1_SIA3_SS1_SU0_SUM0_SUS64_SPO0_SRVW0_SSO0_SVW2_SK3_SKXCCM8_TLDS1_ULSGRO0_USL1_UIOFGRO0_USFGRO0_VSn1_VWA2_VWB1_WSGRA0_WSGRB0_WS64_WG32_8_1_WGM1_WGMXCC1_WGMXCCGn1
    SolutionIndex: 42
    SolutionNameMin: Cijk_Ailk_Bljk_I8_BH_UserArgs_MT64x128x64_MI16x16x1_SN_LDSB0_AFC0_AFEM1_AFEM1_ASEM1_CLR1_CADS0_DTVA0_DTVB0_EPS0_FDSI0_GRPM1_GRVWA4_GRVWB8_GSU0_GSUAMB_GSUC0_GSUWGMRR0_GLS0_ISA942_IU1_K1_LBSPPA512_LBSPPB128_LBSPPM0_LPA32_LPB8_LPM0_LRVW8_LWPMn1_MIAV0_MIWT2_4_MO40_NTn1_NTA0_NTB0_NTC0_NTD0_NTM0_NEPBS0_NLCA1_NLCB1_ONLL1_PGR2_PLR1_PKA1_SIA3_SS1_SU0_SUM0_SUS64_SPO0_SRVW0_SSO0_SVW2_SK3_SKXCCM8_TLDS1_ULSGRO0_USL1_UIOFGRO0_USFGRO0_VSn1_VWA2_VWB2_WSGRA0_WSGRB0_WS64_WG32_8_1_WGM1_WGMXCC1_WGMXCCGn1
    SolutionIndex: 43
    SolutionNameMin: Cijk_Ailk_Bljk_I8_BH_UserArgs_MT64x128x64_MI16x16x1_SN_LDSB0_AFC0_AFEM1_AFEM1_ASEM1_CLR1_CADS0_DTVA0_DTVB0_EPS0_FDSI0_GRPM1_GRVWA4_GRVWB8_GSU0_GSUAMB_GSUC0_GSUWGMRR0_GLS0_ISA942_IU1_K1_LBSPPA512_LBSPPB256_LBSPPM0_LPA32_LPB8_LPM0_LRVW8_LWPMn1_MIAV0_MIWT2_4_MO40_NTn1_NTA0_NTB0_NTC0_NTD0_NTM0_NEPBS0_NLCA1_NLCB1_ONLL1_PGR2_PLR1_PKA1_SIA3_SS1_SU0_SUM0_SUS64_SPO0_SRVW0_SSO0_SVW2_SK3_SKXCCM8_TLDS1_ULSGRO0_USL1_UIOFGRO0_USFGRO0_VSn1_VWA2_VWB4_WSGRA0_WSGRB0_WS64_WG32_8_1_WGM1_WGMXCC1_WGMXCCGn1
    SolutionIndex: 44
    SolutionNameMin: Cijk_Ailk_Bljk_I8_BH_UserArgs_MT128x64x64_MI16x16x1_SN_LDSB0_AFC0_AFEM1_AFEM1_ASEM1_CLR1_CADS0_DTVA0_DTVB0_EPS0_FDSI0_GRPM1_GRVWA4_GRVWB8_GSU0_GSUAMB_GSUC0_GSUWGMRR0_GLS0_ISA942_IU1_K1_LBSPPA1024_LBSPPB128_LBSPPM0_LPA64_LPB8_LPM0_LRVW8_LWPMn1_MIAV0_MIWT4_2_MO40_NTn1_NTA0_NTB0_NTC0_NTD0_NTM0_NEPBS0_NLCA1_NLCB1_ONLL1_PGR2_PLR1_PKA1_SIA3_SS1_SU0_SUM0_SUS64_SPO0_SRVW0_SSO0_SVW4_SK3_SKXCCM8_TLDS1_ULSGRO0_USL1_UIOFGRO0_USFGRO0_VSn1_VWA4_VWB2_WSGRA0_WSGRB0_WS64_WG32_8_1_WGM1_WGMXCC1_WGMXCCGn1
    SolutionIndex: 45
    SolutionNameMin: Cijk_Ailk_Bljk_I8_BH_UserArgs_MT64x64x64_MI16x16x1_SN_LDSB0_AFC0_AFEM1_AFEM1_ASEM1_CLR1_CADS0_DTVA0_DTVB0_EPS0_FDSI0_GRPM1_GRVWA4_GRVWB8_GSU0_GSUAMB_GSUC0_GSUWGMRR0_GLS0_ISA942_IU1_K1_LBSPPA512_LBSPPB128_LBSPPM0_LPA32_LPB8_LPM0_LRVW8_LWPMn1_MIAV0_MIWT2_2_MO40_NTn1_NTA0_NTB0_NTC0_NTD0_NTM0_NEPBS0_NLCA1_NLCB1_ONLL1_PGR2_PLR1_PKA1_SIA3_SS1_SU0_SUM0_SUS64_SPO0_SRVW0_SSO0_SVW2_SK3_SKXCCM8_TLDS1_ULSGRO0_USL1_UIOFGRO0_USFGRO0_VSn1_VWA2_VWB1_WSGRA0_WSGRB0_WS64_WG32_8_1_WGM1_WGMXCC1_WGMXCCGn1
    SolutionIndex: 46
    SolutionNameMin: Cijk_Ailk_Bljk_I8_BH_UserArgs_MT64x64x64_MI16x16x1_SN_LDSB0_AFC0_AFEM1_AFEM1_ASEM1_CLR1_CADS0_DTVA0_DTVB0_EPS0_FDSI0_GRPM1_GRVWA4_GRVWB8_GSU0_GSUAMB_GSUC0_GSUWGMRR0_GLS0_ISA942_IU1_K1_LBSPPA512_LBSPPB128_LBSPPM0_LPA32_LPB8_LPM0_LRVW8_LWPMn1_MIAV0_MIWT2_2_MO40_NTn1_NTA0_NTB0_NTC0_NTD0_NTM0_NEPBS0_NLCA1_NLCB1_ONLL1_PGR2_PLR1_PKA1_SIA3_SS1_SU0_SUM0_SUS64_SPO0_SRVW0_SSO0_SVW2_SK3_SKXCCM8_TLDS1_ULSGRO0_USL1_UIOFGRO0_USFGRO0_VSn1_VWA2_VWB2_WSGRA0_WSGRB0_WS64_WG32_8_1_WGM1_WGMXCC1_WGMXCCGn1
    SolutionIndex: 47
    SolutionNameMin: Cijk_Ailk_Bljk_I8_BH_UserArgs_MT64x64x64_MI16x16x1_SN_LDSB0_AFC0_AFEM1_AFEM1_ASEM1_CLR1_CADS0_DTVA0_DTVB0_EPS0_FDSI0_GRPM1_GRVWA8_GRVWB8_GSU0_GSUAMB_GSUC0_GSUWGMRR0_GLS0_ISA942_IU1_K1_LBSPPA512_LBSPPB128_LBSPPM0_LPA32_LPB8_LPM0_LRVW8_LWPMn1_MIAV0_MIWT2_2_MO40_NTn1_NTA0_NTB0_NTC0_NTD0_NTM0_NEPBS0_NLCA1_NLCB1_ONLL1_PGR2_PLR1_PKA1_SIA3_SS1_SU0_SUM0_SUS64_SPO0_SRVW0_SSO0_SVW2_SK3_SKXCCM8_TLDS1_ULSGRO0_USL1_UIOFGRO0_USFGRO0_VSn1_VWA2_VWB1_WSGRA0_WSGRB0_WS64_WG32_8_1_WGM1_WGMXCC1_WGMXCCGn1
    SolutionIndex: 48
    SolutionNameMin: Cijk_Ailk_Bljk_I8_BH_UserArgs_MT64x32x64_MI16x16x1_SN_LDSB0_AFC0_AFEM1_AFEM1_ASEM1_CLR1_CADS0_DTVA0_DTVB0_EPS0_FDSI0_GRPM1_GRVWA2_GRVWB2_GSU0_GSUAMB_GSUC0_GSUWGMRR0_GLS0_ISA942_IU1_K1_LBSPPA512_LBSPPB128_LBSPPM0_LPA32_LPB8_LPM0_LRVW8_LWPMn1_MIAV0_MIWT2_1_MO40_NTn1_NTA0_NTB0_NTC0_NTD0_NTM0_NEPBS0_NLCA1_NLCB1_ONLL1_PGR2_PLR1_PKA1_SIA3_SS1_SU0_SUM0_SUS64_SPO0_SRVW0_SSO0_SVW2_SK3_SKXCCM8_TLDS1_ULSGRO0_USL1_UIOFGRO0_USFGRO0_VSn1_VWA2_VWB1_WSGRA0_WSGRB0_WS64_WG32_8_1_WGM1_WGMXCC1_WGMXCCGn1
    SolutionIndex: 49
    SolutionNameMin: Cijk_Ailk_Bljk_I8_BH_UserArgs_MT64x32x64_MI16x16x1_SN_LDSB0_AFC0_AFEM1_AFEM1_ASEM1_CLR1_CADS0_DTVA0_DTVB0_EPS0_FDSI0_GRPM1_GRVWA4_GRVWB8_GSU0_GSUAMB_GSUC0_GSUWGMRR0_GLS0_ISA942_IU1_K1_LBSPPA512_LBSPPB128_LBSPPM0_LPA32_LPB8_LPM0_LRVW8_LWPMn1_MIAV0_MIWT2_1_MO40_NTn1_NTA0_NTB0_NTC0_NTD0_NTM0_NEPBS0_NLCA1_NLCB1_ONLL1_PGR2_PLR1_PKA1_SIA3_SS1_SU0_SUM0_SUS64_SPO0_SRVW0_SSO0_SVW2_SK3_SKXCCM8_TLDS1_ULSGRO0_USL1_UIOFGRO0_USFGRO0_VSn1_VWA2_VWB1_WSGRA0_WSGRB0_WS64_WG32_8_1_WGM1_WGMXCC1_WGMXCCGn1
    SolutionIndex: 50
    SolutionNameMin: Cijk_Ailk_Bljk_I8_BH_UserArgs_MT128x128x128_MI16x16x1_SN_LDSB1_AFC0_AFEM1_AFEM1_ASEM1_CLR1_CADS0_DTVA0_DTVB0_EPS0_FDSI0_GRPM1_GRVWA4_GRVWB4_GSU0_GSUAMB_GSUC0_GSUWGMRR0_GLS0_ISA942_IU1_K1_LBSPPA2048_LBSPPB256_LBSPPM0_LPA64_LPB32_LPM0_LRVW16_LWPMn1_MIAV0_MIWT4_4_MO40_NTn1_NTA0_NTB0_NTC0_NTD0_NTM0_NEPBS0_NLCA1_NLCB1_ONLL1_PGR2_PLR1_PKA1_SIA3_SS1_SU0_SUM0_SUS128_SPO0_SRVW0_SSO0_SVW4_SK3_SKXCCM8_TLDS1_ULSGRO0_USL1_UIOFGRO0_USFGRO0_VSn1_VWA4_VWB2_WSGRA0_WSGRB0_WS64_WG32_8_1_WGM1_WGMXCC1_WGMXCCGn1
    SolutionIndex: 51
    SolutionNameMin: Cijk_Ailk_Bljk_I8_BH_UserArgs_MT128x128x128_MI16x16x1_SN_LDSB1_AFC0_AFEM1_AFEM1_ASEM1_CLR1_CADS0_DTVA0_DTVB0_EPS0_FDSI0_GRPM1_GRVWA4_GRVWB4_GSU0_GSUAMB_GSUC0_GSUWGMRR0_GLS0_ISA942_IU1_K1_LBSPPA2048_LBSPPB512_LBSPPM0_LPA64_LPB32_LPM0_LRVW16_LWPMn1_MIAV0_MIWT4_4_MO40_NTn1_NTA0_NTB0_NTC0_NTD0_NTM0_NEPBS0_NLCA1_NLCB1_ONLL1_PGR2_PLR1_PKA1_SIA3_SS1_SU0_SUM0_SUS128_SPO0_SRVW0_SSO0_SVW4_SK3_SKXCCM8_TLDS1_ULSGRO0_USL1_UIOFGRO0_USFGRO0_VSn1_VWA4_VWB4_WSGRA0_WSGRB0_WS64_WG32_8_1_WGM1_WGMXCC1_WGMXCCGn1
    SolutionIndex: 52
    SolutionNameMin: Cijk_Ailk_Bljk_I8_BH_UserArgs_MT64x64x128_MI16x16x1_SN_LDSB1_AFC0_AFEM1_AFEM1_ASEM1_CLR1_CADS0_DTVA0_DTVB0_EPS0_FDSI0_GRPM1_GRVWA4_GRVWB8_GSU0_GSUAMB_GSUC0_GSUWGMRR0_GLS0_ISA942_IU1_K1_LBSPPA1024_LBSPPB128_LBSPPM0_LPA32_LPB32_LPM0_LRVW16_LWPMn1_MIAV0_MIWT2_2_MO40_NTn1_NTA0_NTB0_NTC0_NTD0_NTM0_NEPBS0_NLCA1_NLCB1_ONLL1_PGR2_PLR1_PKA1_SIA3_SS1_SU0_SUM0_SUS128_SPO0_SRVW0_SSO0_SVW2_SK3_SKXCCM8_TLDS1_ULSGRO0_USL1_UIOFGRO0_USFGRO0_VSn1_VWA2_VWB1_WSGRA0_WSGRB0_WS64_WG32_8_1_WGM1_WGMXCC1_WGMXCCGn1
    SolutionIndex: 53
    SolutionNameMin: Cijk_Ailk_Bljk_I8_BH_UserArgs_MT64x64x128_MI16x16x1_SN_LDSB1_AFC0_AFEM1_AFEM1_ASEM1_CLR1_CADS0_DTVA0_DTVB0_EPS0_FDSI0_GRPM1_GRVWA4_GRVWB8_GSU0_GSUAMB_GSUC0_GSUWGMRR0_GLS0_ISA942_IU1_K1_LBSPPA1024_LBSPPB256_LBSPPM0_LPA32_LPB32_LPM0_LRVW16_LWPMn1_MIAV0_MIWT2_2_MO40_NTn1_NTA0_NTB0_NTC0_NTD0_NTM0_NEPBS0_NLCA1_NLCB1_ONLL1_PGR2_PLR1_PKA1_SIA3_SS1_SU0_SUM0_SUS128_SPO0_SRVW0_SSO0_SVW2_SK3_SKXCCM8_TLDS1_ULSGRO0_USL1_UIOFGRO0_USFGRO0_VSn1_VWA2_VWB2_WSGRA0_WSGRB0_WS64_WG32_8_1_WGM1_WGMXCC1_WGMXCCGn1
    SolutionIndex: 54
    SolutionNameMin: Cijk_Ailk_Bljk_I8_BH_UserArgs_MT32x64x128_MI16x16x1_SN_LDSB0_AFC0_AFEM1_AFEM1_ASEM1_CLR1_CADS0_DTVA0_DTVB0_EPS0_FDSI0_GRPM1_GRVWA4_GRVWB8_GSU0_GSUAMB_GSUC0_GSUWGMRR0_GLS0_ISA942_IU1_K1_LBSPPA512_LBSPPB128_LBSPPM0_LPA16_LPB32_LPM0_LRVW16_LWPMn1_MIAV0_MIWT1_2_MO40_NTn1_NTA0_NTB0_NTC0_NTD0_NTM0_NEPBS0_NLCA1_NLCB1_ONLL1_PGR2_PLR1_PKA1_SIA3_SS1_SU0_SUM0_SUS128_SPO0_SRVW0_SSO0_SVW1_SK3_SKXCCM8_TLDS1_ULSGRO0_USL1_UIOFGRO0_USFGRO0_VSn1_VWA1_VWB1_WSGRA0_WSGRB0_WS64_WG32_8_1_WGM1_WGMXCC1_WGMXCCGn1
    SolutionIndex: 55
    SolutionNameMin: Cijk_Ailk_Bljk_I8_BH_UserArgs_MT32x64x128_MI16x16x1_SN_LDSB0_AFC0_AFEM1_AFEM1_ASEM1_CLR1_CADS0_DTVA0_DTVB0_EPS0_FDSI0_GRPM1_GRVWA4_GRVWB8_GSU0_GSUAMB_GSUC0_GSUWGMRR0_GLS0_ISA942_IU1_K1_LBSPPA512_LBSPPB256_LBSPPM0_LPA16_LPB32_LPM0_LRVW16_LWPMn1_MIAV0_MIWT1_2_MO40_NTn1_NTA0_NTB0_NTC0_NTD0_NTM0_NEPBS0_NLCA1_NLCB1_ONLL1_PGR2_PLR1_PKA1_SIA3_SS1_SU0_SUM0_SUS128_SPO0_SRVW0_SSO0_SVW1_SK3_SKXCCM8_TLDS1_ULSGRO0_USL1_UIOFGRO0_USFGRO0_VSn1_VWA1_VWB2_WSGRA0_WSGRB0_WS64_WG32_8_1_WGM1_WGMXCC1_WGMXCCGn1
    SolutionIndex: 56
    SolutionNameMin: Cijk_Ailk_Bljk_I8_BH_UserArgs_MT32x64x128_MI16x16x1_SN_LDSB0_AFC0_AFEM1_AFEM1_ASEM1_CLR1_CADS0_DTVA0_DTVB0_EPS0_FDSI0_GRPM1_GRVWA8_GRVWB8_GSU0_GSUAMB_GSUC0_GSUWGMRR0_GLS0_ISA942_IU1_K1_LBSPPA512_LBSPPB256_LBSPPM0_LPA16_LPB32_LPM0_LRVW16_LWPMn1_MIAV0_MIWT1_2_MO40_NTn1_NTA0_NTB0_NTC0_NTD0_NTM0_NEPBS0_NLCA1_NLCB1_ONLL1_PGR2_PLR1_PKA1_SIA3_SS1_SU0_SUM0_SUS128_SPO0_SRVW0_SSO0_SVW1_SK3_SKXCCM8_TLDS1_ULSGRO0_USL1_UIOFGRO0_USFGRO0_VSn1_VWA1_VWB2_WSGRA0_WSGRB0_WS64_WG32_8_1_WGM1_WGMXCC1_WGMXCCGn1
    SolutionIndex: 57
    SolutionNameMin: Cijk_Ailk_Bljk_I8_BH_UserArgs_MT64x32x128_MI16x16x1_SN_LDSB0_AFC0_AFEM1_AFEM1_ASEM1_CLR1_CADS0_DTVA0_DTVB0_EPS0_FDSI0_GRPM1_GRVWA8_GRVWB4_GSU0_GSUAMB_GSUC0_GSUWGMRR0_GLS0_ISA942_IU1_K1_LBSPPA1024_LBSPPB128_LBSPPM0_LPA32_LPB32_LPM0_LRVW16_LWPMn1_MIAV0_MIWT2_1_MO40_NTn1_NTA0_NTB0_NTC0_NTD0_NTM0_NEPBS0_NLCA1_NLCB1_ONLL1_PGR2_PLR1_PKA1_SIA3_SS1_SU0_SUM0_SUS128_SPO0_SRVW0_SSO0_SVW2_SK3_SKXCCM8_TLDS1_ULSGRO0_USL1_UIOFGRO0_USFGRO0_VSn1_VWA2_VWB1_WSGRA0_WSGRB0_WS64_WG32_8_1_WGM1_WGMXCC1_WGMXCCGn1
    SolutionIndex: 58
    SolutionNameMin: Cijk_Ailk_Bljk_I8_BH_UserArgs_MT64x32x128_MI16x16x1_SN_LDSB0_AFC0_AFEM1_AFEM1_ASEM1_CLR1_CADS0_DTVA0_DTVB0_EPS0_FDSI0_GRPM1_GRVWA8_GRVWB8_GSU0_GSUAMB_GSUC0_GSUWGMRR0_GLS0_ISA942_IU1_K1_LBSPPA1024_LBSPPB128_LBSPPM0_LPA32_LPB32_LPM0_LRVW16_LWPMn1_MIAV0_MIWT2_1_MO40_NTn1_NTA0_NTB0_NTC0_NTD0_NTM0_NEPBS0_NLCA1_NLCB1_ONLL1_PGR2_PLR2_PKA1_SIA3_SS1_SU0_SUM0_SUS128_SPO0_SRVW0_SSO0_SVW2_SK3_SKXCCM8_TLDS1_ULSGRO0_USL1_UIOFGRO0_USFGRO0_VSn1_VWA2_VWB1_WSGRA0_WSGRB0_WS64_WG32_8_1_WGM1_WGMXCC1_WGMXCCGn1
    SolutionIndex: 59
    SolutionNameMin: Cijk_Ailk_Bljk_I8_BH_UserArgs_MT32x32x128_MI16x16x1_SN_LDSB0_AFC0_AFEM1_AFEM1_ASEM1_CLR1_CADS0_DTVA0_DTVB0_EPS0_FDSI0_GRPM1_GRVWA8_GRVWB8_GSU0_GSUAMB_GSUC0_GSUWGMRR0_GLS0_ISA942_IU1_K1_LBSPPA512_LBSPPB128_LBSPPM0_LPA16_LPB32_LPM0_LRVW16_LWPMn1_MIAV0_MIWT1_1_MO40_NTn1_NTA0_NTB0_NTC0_NTD0_NTM0_NEPBS0_NLCA1_NLCB1_ONLL1_PGR2_PLR1_PKA1_SIA3_SS1_SU0_SUM0_SUS128_SPO0_SRVW0_SSO0_SVW1_SK3_SKXCCM8_TLDS1_ULSGRO0_USL1_UIOFGRO0_USFGRO0_VSn1_VWA1_VWB1_WSGRA0_WSGRB0_WS64_WG32_8_1_WGM1_WGMXCC1_WGMXCCGn1
    SolutionIndex: 60
    SolutionNameMin: Cijk_Ailk_Bljk_I8_BH_UserArgs_MT64x128x256_MI16x16x1_SN_LDSB1_AFC0_AFEM1_AFEM1_ASEM1_CLR1_CADS0_DTVA0_DTVB0_EPS0_FDSI0_GRPM1_GRVWA4_GRVWB4_GSU0_GSUAMB_GSUC0_GSUWGMRR0_GLS0_ISA942_IU1_K1_LBSPPA1024_LBSPPB512_LBSPPM0_LPA32_LPB32_LPM0_LRVW16_LWPMn1_MIAV0_MIWT2_4_MO40_NTn1_NTA0_NTB0_NTC0_NTD0_NTM0_NEPBS0_NLCA1_NLCB1_ONLL1_PGR2_PLR2_PKA1_SIA3_SS1_SU0_SUM0_SUS256_SPO0_SRVW0_SSO0_SVW2_SK3_SKXCCM8_TLDS1_ULSGRO0_USL1_UIOFGRO0_USFGRO0_VSn1_VWA2_VWB2_WSGRA0_WSGRB0_WS64_WG32_8_1_WGM1_WGMXCC1_WGMXCCGn1
    SolutionIndex: 61
    SolutionNameMin: Cijk_Ailk_Bljk_I8_BH_UserArgs_MT64x128x256_MI16x16x1_SN_LDSB1_AFC0_AFEM1_AFEM1_ASEM1_CLR1_CADS0_DTVA0_DTVB0_EPS0_FDSI0_GRPM1_GRVWA4_GRVWB4_GSU0_GSUAMB_GSUC0_GSUWGMRR0_GLS0_ISA942_IU1_K1_LBSPPA1024_LBSPPB1024_LBSPPM0_LPA32_LPB32_LPM0_LRVW16_LWPMn1_MIAV0_MIWT2_4_MO40_NTn1_NTA0_NTB0_NTC0_NTD0_NTM0_NEPBS0_NLCA1_NLCB1_ONLL1_PGR2_PLR2_PKA1_SIA3_SS1_SU0_SUM0_SUS256_SPO0_SRVW0_SSO0_SVW2_SK3_SKXCCM8_TLDS1_ULSGRO0_USL1_UIOFGRO0_USFGRO0_VSn1_VWA2_VWB4_WSGRA0_WSGRB0_WS64_WG32_8_1_WGM1_WGMXCC1_WGMXCCGn1
    SolutionIndex: 62
    SolutionNameMin: Cijk_Ailk_Bljk_I8_BH_UserArgs_MT64x64x256_MI16x16x1_SN_LDSB1_AFC0_AFEM1_AFEM1_ASEM1_CLR1_CADS0_DTVA0_DTVB0_EPS0_FDSI0_GRPM1_GRVWA4_GRVWB4_GSU0_GSUAMB_GSUC0_GSUWGMRR0_GLS0_ISA942_IU1_K1_LBSPPA1024_LBSPPB256_LBSPPM0_LPA32_LPB32_LPM0_LRVW16_LWPMn1_MIAV0_MIWT2_2_MO40_NTn1_NTA0_NTB0_NTC0_NTD0_NTM0_NEPBS0_NLCA1_NLCB1_ONLL1_PGR2_PLR2_PKA1_SIA3_SS1_SU0_SUM0_SUS256_SPO0_SRVW0_SSO0_SVW2_SK3_SKXCCM8_TLDS1_ULSGRO0_USL1_UIOFGRO0_USFGRO0_VSn1_VWA2_VWB1_WSGRA0_WSGRB0_WS64_WG32_8_1_WGM1_WGMXCC1_WGMXCCGn1
    SolutionIndex: 63
    SolutionNameMin: Cijk_Ailk_Bljk_I8_BH_UserArgs_MT32x32x256_MI16x16x1_SN_LDSB1_AFC0_AFEM1_AFEM1_ASEM1_CLR1_CADS0_DTVA0_DTVB0_EPS0_FDSI0_GRPM1_GRVWA4_GRVWB8_GSU0_GSUAMB_GSUC0_GSUWGMRR0_GLS0_ISA942_IU1_K1_LBSPPA512_LBSPPB256_LBSPPM0_LPA16_LPB32_LPM0_LRVW16_LWPMn1_MIAV0_MIWT1_1_MO40_NTn1_NTA0_NTB0_NTC0_NTD0_NTM0_NEPBS0_NLCA1_NLCB1_ONLL1_PGR2_PLR2_PKA1_SIA3_SS1_SU0_SUM0_SUS256_SPO0_SRVW0_SSO0_SVW1_SK3_SKXCCM8_TLDS1_ULSGRO0_USL1_UIOFGRO0_USFGRO0_VSn1_VWA1_VWB1_WSGRA0_WSGRB0_WS64_WG32_8_1_WGM1_WGMXCC1_WGMXCCGn1
    SolutionIndex: 64
    SolutionNameMin: Cijk_Ailk_Bljk_I8_BH_UserArgs_MT32x32x32_MI16x16x1_SN_LDSB0_AFC0_AFEM1_AFEM1_ASEM1_CLR0_CADS0_DTVA0_DTVB0_EPS0_FDSI0_GRPM1_GRVWA1_GRVWB1_GSU0_GSUAMB_GSUC0_GSUWGMRR0_GLS0_ISA942_IU1_K1_LBSPPA256_LBSPPB128_LBSPPM0_LPA16_LPB8_LPM0_LRVW8_LWPMn1_MIAV0_MIWT1_1_MO40_NTn1_NTA0_NTB0_NTC0_NTD0_NTM0_NEPBS0_NLCA1_NLCB1_ONLL1_PGR2_PLR0_PKA1_SIA3_SS1_SU32_SUM0_SUS256_SPO0_SRVW0_SSO0_SVW1_SK3_SKXCCM0_TLDS1_ULSGRO0_USL1_UIOFGRO0_USFGROn1_VSn1_VWA1_VWB1_WSGRA0_WSGRB0_WS64_WG32_8_1_WGM8_WGMXCC1_WGMXCCGn1
- - - [128, 128, 1, 128, 128, 128, 128, 128]
    - [48, 0.6]
  - - [128, 128, 1, 256, 128, 128, 128, 256]
    - [9, 1.21]
  - - [128, 128, 1, 512, 128, 128, 128, 512]
    - [59, 2.11]
  - - [128, 128, 1, 1024, 128, 128, 128, 1024]
    - [59, 3.18]
  - - [128, 128, 1, 2048, 128, 128, 128, 2048]
    - [59, 4.24]
  - - [128, 128, 1, 4096, 128, 128, 128, 4096]
    - [63, 5.1]
  - - [128, 128, 1, 8192, 128, 128, 128, 8192]
    - [63, 5.73]
  - - [128, 256, 1, 128, 128, 128, 128, 128]
    - [58, 1.19]
  - - [128, 256, 1, 256, 128, 128, 128, 256]
    - [56, 2.31]
  - - [128, 256, 1, 512, 128, 128, 128, 512]
    - [55, 3.87]
  - - [128, 256, 1, 1024, 128, 128, 128, 1024]
    - [55, 5.72]
  - - [128, 256, 1, 2048, 128, 128, 128, 2048]
    - [55, 7.5]
  - - [128, 256, 1, 4096, 128, 128, 128, 4096]
    - [54, 8.86]
  - - [128, 256, 1, 8192, 128, 128, 128, 8192]
    - [55, 9.75]
  - - [128, 512, 1, 128, 128, 128, 128, 128]
    - [46, 2.52]
  - - [128, 512, 1, 256, 128, 128, 128, 256]
    - [45, 4.2]
  - - [128, 512, 1, 512, 128, 128, 128, 512]
    - [53, 6.6]
  - - [128, 512, 1, 1024, 128, 128, 128, 1024]
    - [53, 9.33]
  - - [128, 512, 1, 2048, 128, 128, 128, 2048]
    - [62, 12.33]
  - - [128, 512, 1, 4096, 128, 128, 128, 4096]
    - [62, 14.62]
  - - [128, 512, 1, 8192, 128, 128, 128, 8192]
    - [62, 16.14]
  - - [128, 1024, 1, 128, 128, 128, 128, 128]
    - [44, 4.23]
  - - [128, 1024, 1, 256, 128, 128, 128, 256]
    - [41, 6.9]
  - - [128, 1024, 1, 512, 128, 128, 128, 512]
    - [43, 10.63]
  - - [128, 1024, 1, 1024, 128, 128, 128, 1024]
    - [41, 14.4]
  - - [128, 1024, 1, 2048, 128, 128, 128, 2048]
    - [60, 18.12]
  - - [128, 1024, 1, 4096, 128, 128, 128, 4096]
    - [60, 21.35]
  - - [128, 1024, 1, 8192, 128, 128, 128, 8192]
    - [60, 23.84]
  - - [128, 2048, 1, 128, 128, 128, 128, 128]
    - [39, 6.45]
  - - [128, 2048, 1, 256, 128, 128, 128, 256]
    - [39, 10.65]
  - - [128, 2048, 1, 512, 128, 128, 128, 512]
    - [38, 15.87]
  - - [128, 2048, 1, 1024, 128, 128, 128, 1024]
    - [51, 21.45]
  - - [128, 2048, 1, 2048, 128, 128, 128, 2048]
    - [50, 26.3]
  - - [128, 2048, 1, 4096, 128, 128, 128, 4096]
    - [50, 29.74]
  - - [128, 2048, 1, 8192, 128, 128, 128, 8192]
    - [50, 31.87]
  - - [128, 4096, 1, 128, 128, 128, 128, 128]
    - [5, 8.72]
  - - [128, 4096, 1, 256, 128, 128, 128, 256]
    - [26, 14.5]
  - - [128, 4096, 1, 512, 128, 128, 128, 512]
    - [25, 21.92]
  - - [128, 4096, 1, 1024, 128, 128, 128, 1024]
    - [25, 28.96]
  - - [128, 4096, 1, 2048, 128, 128, 128, 2048]
    - [26, 35.03]
  - - [128, 4096, 1, 4096, 128, 128, 128, 4096]
    - [24, 39.02]
  - - [128, 4096, 1, 8192, 128, 128, 128, 8192]
    - [22, 41.5]
  - - [128, 8192, 1, 128, 128, 128, 128, 128]
    - [4, 9.48]
  - - [128, 8192, 1, 256, 128, 128, 128, 256]
    - [26, 15.41]
  - - [128, 8192, 1, 512, 128, 128, 128, 512]
    - [25, 22.57]
  - - [128, 8192, 1, 1024, 128, 128, 128, 1024]
    - [22, 30.03]
  - - [128, 8192, 1, 2048, 128, 128, 128, 2048]
    - [22, 35.89]
  - - [128, 8192, 1, 4096, 128, 128, 128, 4096]
    - [21, 39.7]
  - - [128, 8192, 1, 8192, 128, 128, 128, 8192]
    - [24, 40.1]
  - - [256, 128, 1, 128, 256, 256, 256, 128]
    - [57, 1.38]
  - - [256, 128, 1, 256, 256, 256, 256, 256]
    - [49, 2.31]
  - - [256, 128, 1, 512, 256, 256, 256, 512]
    - [54, 3.91]
  - - [256, 128, 1, 1024, 256, 256, 256, 1024]
    - [55, 5.78]
  - - [256, 128, 1, 2048, 256, 256, 256, 2048]
    - [54, 7.51]
  - - [256, 128, 1, 4096, 256, 256, 256, 4096]
    - [54, 8.8]
  - - [256, 128, 1, 8192, 256, 256, 256, 8192]
    - [54, 9.76]
  - - [256, 256, 1, 128, 256, 256, 256, 128]
    - [47, 2.47]
  - - [256, 256, 1, 256, 256, 256, 256, 256]
    - [53, 4.15]
  - - [256, 256, 1, 512, 256, 256, 256, 512]
    - [53, 6.63]
  - - [256, 256, 1, 1024, 256, 256, 256, 1024]
    - [52, 9.24]
  - - [256, 256, 1, 2048, 256, 256, 256, 2048]
    - [62, 12.21]
  - - [256, 256, 1, 4096, 256, 256, 256, 4096]
    - [62, 14.6]
  - - [256, 256, 1, 8192, 256, 256, 256, 8192]
    - [62, 15.97]
  - - [256, 512, 1, 128, 256, 256, 256, 128]
    - [44, 4.12]
  - - [256, 512, 1, 256, 256, 256, 256, 256]
    - [41, 6.87]
  - - [256, 512, 1, 512, 256, 256, 256, 512]
    - [41, 10.57]
  - - [256, 512, 1, 1024, 256, 256, 256, 1024]
    - [41, 14.33]
  - - [256, 512, 1, 2048, 256, 256, 256, 2048]
    - [61, 18.09]
  - - [256, 512, 1, 4096, 256, 256, 256, 4096]
    - [61, 21.4]
  - - [256, 512, 1, 8192, 256, 256, 256, 8192]
    - [60, 23.18]
  - - [256, 1024, 1, 128, 256, 256, 256, 128]
    - [8, 6.41]
  - - [256, 1024, 1, 256, 256, 256, 256, 256]
    - [39, 10.63]
  - - [256, 1024, 1, 512, 256, 256, 256, 512]
    - [39, 15.66]
  - - [256, 1024, 1, 1024, 256, 256, 256, 1024]
    - [50, 21.35]
  - - [256, 1024, 1, 2048, 256, 256, 256, 2048]
    - [50, 26.36]
  - - [256, 1024, 1, 4096, 256, 256, 256, 4096]
    - [50, 29.82]
  - - [256, 1024, 1, 8192, 256, 256, 256, 8192]
    - [50, 31.86]
  - - [256, 2048, 1, 128, 256, 256, 256, 128]
    - [5, 8.9]
  - - [256, 2048, 1, 256, 256, 256, 256, 256]
    - [25, 14.61]
  - - [256, 2048, 1, 512, 256, 256, 256, 512]
    - [25, 22.11]
  - - [256, 2048, 1, 1024, 256, 256, 256, 1024]
    - [25, 29.78]
  - - [256, 2048, 1, 2048, 256, 256, 256, 2048]
    - [26, 35.26]
  - - [256, 2048, 1, 4096, 256, 256, 256, 4096]
    - [28, 39.19]
  - - [256, 2048, 1, 8192, 256, 256, 256, 8192]
    - [26, 41.73]
  - - [256, 4096, 1, 128, 256, 256, 256, 128]
    - [0, 11.14]
  - - [256, 4096, 1, 256, 256, 256, 256, 256]
    - [15, 18.02]
  - - [256, 4096, 1, 512, 256, 256, 256, 512]
    - [10, 26.68]
  - - [256, 4096, 1, 1024, 256, 256, 256, 1024]
    - [10, 35.08]
  - - [256, 4096, 1, 2048, 256, 256, 256, 2048]
    - [14, 41.67]
  - - [256, 4096, 1, 4096, 256, 256, 256, 4096]
    - [12, 46.16]
  - - [256, 4096, 1, 8192, 256, 256, 256, 8192]
    - [14, 48.92]
  - - [256, 8192, 1, 128, 256, 256, 256, 128]
    - [0, 11.68]
  - - [256, 8192, 1, 256, 256, 256, 256, 256]
    - [15, 18.69]
  - - [256, 8192, 1, 512, 256, 256, 256, 512]
    - [10, 27.31]
  - - [256, 8192, 1, 1024, 256, 256, 256, 1024]
    - [10, 35.73]
  - - [256, 8192, 1, 2048, 256, 256, 256, 2048]
    - [10, 42.2]
  - - [256, 8192, 1, 4096, 256, 256, 256, 4096]
    - [24, 47.01]
  - - [256, 8192, 1, 8192, 256, 256, 256, 8192]
    - [22, 48.95]
  - - [512, 128, 1, 128, 512, 512, 512, 128]
    - [46, 2.48]
  - - [512, 128, 1, 256, 512, 512, 512, 256]
    - [47, 4.2]
  - - [512, 128, 1, 512, 512, 512, 512, 512]
    - [52, 6.51]
  - - [512, 128, 1, 1024, 512, 512, 512, 1024]
    - [52, 9.2]
  - - [512, 128, 1, 2048, 512, 512, 512, 2048]
    - [62, 11.81]
  - - [512, 128, 1, 4096, 512, 512, 512, 4096]
    - [62, 13.92]
  - - [512, 128, 1, 8192, 512, 512, 512, 8192]
    - [53, 13.92]
  - - [512, 256, 1, 128, 512, 512, 512, 128]
    - [44, 4.16]
  - - [512, 256, 1, 256, 512, 512, 512, 256]
    - [44, 6.88]
  - - [512, 256, 1, 512, 512, 512, 512, 512]
    - [42, 10.59]
  - - [512, 256, 1, 1024, 512, 512, 512, 1024]
    - [42, 14.46]
  - - [512, 256, 1, 2048, 512, 512, 512, 2048]
    - [42, 17.76]
  - - [512, 256, 1, 4096, 512, 512, 512, 4096]
    - [60, 20.9]
  - - [512, 256, 1, 8192, 512, 512, 512, 8192]
    - [41, 21.3]
  - - [512, 512, 1, 128, 512, 512, 512, 128]
    - [40, 6.36]
  - - [512, 512, 1, 256, 512, 512, 512, 256]
    - [40, 10.6]
  - - [512, 512, 1, 512, 512, 512, 512, 512]
    - [40, 15.66]
  - - [512, 512, 1, 1024, 512, 512, 512, 1024]
    - [51, 21.42]
  - - [512, 512, 1, 2048, 512, 512, 512, 2048]
    - [51, 26.37]
  - - [512, 512, 1, 4096, 512, 512, 512, 4096]
    - [50, 29.73]
  - - [512, 512, 1, 8192, 512, 512, 512, 8192]
    - [50, 31.88]
  - - [512, 1024, 1, 128, 512, 512, 512, 128]
    - [5, 8.91]
  - - [512, 1024, 1, 256, 512, 512, 512, 256]
    - [25, 14.57]
  - - [512, 1024, 1, 512, 512, 512, 512, 512]
    - [28, 22.15]
  - - [512, 1024, 1, 1024, 512, 512, 512, 1024]
    - [26, 29.69]
  - - [512, 1024, 1, 2048, 512, 512, 512, 2048]
    - [26, 35.89]
  - - [512, 1024, 1, 4096, 512, 512, 512, 4096]
    - [31, 39.43]
  - - [512, 1024, 1, 8192, 512, 512, 512, 8192]
    - [32, 42.08]
  - - [512, 2048, 1, 128, 512, 512, 512, 128]
    - [0, 11.19]
  - - [512, 2048, 1, 256, 512, 512, 512, 256]
    - [15, 18.04]
  - - [512, 2048, 1, 512, 512, 512, 512, 512]
    - [10, 26.62]
  - - [512, 2048, 1, 1024, 512, 512, 512, 1024]
    - [12, 34.82]
  - - [512, 2048, 1, 2048, 512, 512, 512, 2048]
    - [10, 41.73]
  - - [512, 2048, 1, 4096, 512, 512, 512, 4096]
    - [10, 46.19]
  - - [512, 2048, 1, 8192, 512, 512, 512, 8192]
    - [18, 48.91]
  - - [512, 4096, 1, 128, 512, 512, 512, 128]
    - [0, 11.63]
  - - [512, 4096, 1, 256, 512, 512, 512, 256]
    - [15, 18.61]
  - - [512, 4096, 1, 512, 512, 512, 512, 512]
    - [11, 27.22]
  - - [512, 4096, 1, 1024, 512, 512, 512, 1024]
    - [10, 35.62]
  - - [512, 4096, 1, 2048, 512, 512, 512, 2048]
    - [10, 42.17]
  - - [512, 4096, 1, 4096, 512, 512, 512, 4096]
    - [23, 47.06]
  - - [512, 4096, 1, 8192, 512, 512, 512, 8192]
    - [28, 51.2]
  - - [512, 8192, 1, 128, 512, 512, 512, 128]
    - [0, 11.95]
  - - [512, 8192, 1, 256, 512, 512, 512, 256]
    - [10, 19.0]
  - - [512, 8192, 1, 512, 512, 512, 512, 512]
    - [11, 27.63]
  - - [512, 8192, 1, 1024, 512, 512, 512, 1024]
    - [10, 36.06]
  - - [512, 8192, 1, 2048, 512, 512, 512, 2048]
    - [2, 42.71]
  - - [512, 8192, 1, 4096, 512, 512, 512, 4096]
    - [10, 54.83]
  - - [512, 8192, 1, 8192, 512, 512, 512, 8192]
    - [19, 58.87]
  - - [1024, 128, 1, 128, 1024, 1024, 1024, 128]
    - [44, 4.2]
  - - [1024, 128, 1, 256, 1024, 1024, 1024, 256]
    - [44, 6.9]
  - - [1024, 128, 1, 512, 1024, 1024, 1024, 512]
    - [42, 10.54]
  - - [1024, 128, 1, 1024, 1024, 1024, 1024, 1024]
    - [43, 14.49]
  - - [1024, 128, 1, 2048, 1024, 1024, 1024, 2048]
    - [41, 17.72]
  - - [1024, 128, 1, 4096, 1024, 1024, 1024, 4096]
    - [42, 19.73]
  - - [1024, 128, 1, 8192, 1024, 1024, 1024, 8192]
    - [41, 21.34]
  - - [1024, 256, 1, 128, 1024, 1024, 1024, 128]
    - [39, 6.36]
  - - [1024, 256, 1, 256, 1024, 1024, 1024, 256]
    - [40, 10.56]
  - - [1024, 256, 1, 512, 1024, 1024, 1024, 512]
    - [39, 15.65]
  - - [1024, 256, 1, 1024, 1024, 1024, 1024, 1024]
    - [51, 21.39]
  - - [1024, 256, 1, 2048, 1024, 1024, 1024, 2048]
    - [50, 26.38]
  - - [1024, 256, 1, 4096, 1024, 1024, 1024, 4096]
    - [50, 29.72]
  - - [1024, 256, 1, 8192, 1024, 1024, 1024, 8192]
    - [51, 31.8]
  - - [1024, 512, 1, 128, 1024, 1024, 1024, 128]
    - [5, 8.78]
  - - [1024, 512, 1, 256, 1024, 1024, 1024, 256]
    - [25, 14.5]
  - - [1024, 512, 1, 512, 1024, 1024, 1024, 512]
    - [25, 22.0]
  - - [1024, 512, 1, 1024, 1024, 1024, 1024, 1024]
    - [28, 29.68]
  - - [1024, 512, 1, 2048, 1024, 1024, 1024, 2048]
    - [26, 35.92]
  - - [1024, 512, 1, 4096, 1024, 1024, 1024, 4096]
    - [30, 39.07]
  - - [1024, 512, 1, 8192, 1024, 1024, 1024, 8192]
    - [27, 41.93]
  - - [1024, 1024, 1, 128, 1024, 1024, 1024, 128]
    - [0, 11.11]
  - - [1024, 1024, 1, 256, 1024, 1024, 1024, 256]
    - [15, 17.96]
  - - [1024, 1024, 1, 512, 1024, 1024, 1024, 512]
    - [10, 26.65]
  - - [1024, 1024, 1, 1024, 1024, 1024, 1024, 1024]
    - [10, 35.09]
  - - [1024, 1024, 1, 2048, 1024, 1024, 1024, 2048]
    - [12, 41.66]
  - - [1024, 1024, 1, 4096, 1024, 1024, 1024, 4096]
    - [10, 46.26]
  - - [1024, 1024, 1, 8192, 1024, 1024, 1024, 8192]
    - [14, 48.97]
  - - [1024, 2048, 1, 128, 1024, 1024, 1024, 128]
    - [0, 11.63]
  - - [1024, 2048, 1, 256, 1024, 1024, 1024, 256]
    - [15, 18.69]
  - - [1024, 2048, 1, 512, 1024, 1024, 1024, 512]
    - [11, 27.25]
  - - [1024, 2048, 1, 1024, 1024, 1024, 1024, 1024]
    - [10, 35.63]
  - - [1024, 2048, 1, 2048, 1024, 1024, 1024, 2048]
    - [10, 42.24]
  - - [1024, 2048, 1, 4096, 1024, 1024, 1024, 4096]
    - [28, 47.07]
  - - [1024, 2048, 1, 8192, 1024, 1024, 1024, 8192]
    - [26, 51.27]
  - - [1024, 4096, 1, 128, 1024, 1024, 1024, 128]
    - [0, 11.93]
  - - [1024, 4096, 1, 256, 1024, 1024, 1024, 256]
    - [15, 19.04]
  - - [1024, 4096, 1, 512, 1024, 1024, 1024, 512]
    - [10, 27.64]
  - - [1024, 4096, 1, 1024, 1024, 1024, 1024, 1024]
    - [10, 36.05]
  - - [1024, 4096, 1, 2048, 1024, 1024, 1024, 2048]
    - [2, 42.76]
  - - [1024, 4096, 1, 4096, 1024, 1024, 1024, 4096]
    - [12, 54.93]
  - - [1024, 4096, 1, 8192, 1024, 1024, 1024, 8192]
    - [12, 59.46]
  - - [1024, 8192, 1, 128, 1024, 1024, 1024, 128]
    - [0, 12.1]
  - - [1024, 8192, 1, 256, 1024, 1024, 1024, 256]
    - [15, 19.23]
  - - [1024, 8192, 1, 512, 1024, 1024, 1024, 512]
    - [11, 27.91]
  - - [1024, 8192, 1, 1024, 1024, 1024, 1024, 1024]
    - [26, 37.75]
  - - [1024, 8192, 1, 2048, 1024, 1024, 1024, 2048]
    - [10, 46.27]
  - - [1024, 8192, 1, 4096, 1024, 1024, 1024, 4096]
    - [13, 54.25]
  - - [1024, 8192, 1, 8192, 1024, 1024, 1024, 8192]
    - [16, 57.34]
  - - [2048, 128, 1, 128, 2048, 2048, 2048, 128]
    - [39, 6.43]
  - - [2048, 128, 1, 256, 2048, 2048, 2048, 256]
    - [39, 10.58]
  - - [2048, 128, 1, 512, 2048, 2048, 2048, 512]
    - [39, 15.79]
  - - [2048, 128, 1, 1024, 2048, 2048, 2048, 1024]
    - [51, 21.42]
  - - [2048, 128, 1, 2048, 2048, 2048, 2048, 2048]
    - [50, 26.21]
  - - [2048, 128, 1, 4096, 2048, 2048, 2048, 4096]
    - [51, 29.72]
  - - [2048, 128, 1, 8192, 2048, 2048, 2048, 8192]
    - [51, 31.82]
  - - [2048, 256, 1, 128, 2048, 2048, 2048, 128]
    - [3, 8.83]
  - - [2048, 256, 1, 256, 2048, 2048, 2048, 256]
    - [25, 14.55]
  - - [2048, 256, 1, 512, 2048, 2048, 2048, 512]
    - [26, 22.06]
  - - [2048, 256, 1, 1024, 2048, 2048, 2048, 1024]
    - [25, 29.62]
  - - [2048, 256, 1, 2048, 2048, 2048, 2048, 2048]
    - [26, 35.04]
  - - [2048, 256, 1, 4096, 2048, 2048, 2048, 4096]
    - [28, 39.24]
  - - [2048, 256, 1, 8192, 2048, 2048, 2048, 8192]
    - [27, 41.98]
  - - [2048, 512, 1, 128, 2048, 2048, 2048, 128]
    - [0, 11.09]
  - - [2048, 512, 1, 256, 2048, 2048, 2048, 256]
    - [15, 18.06]
  - - [2048, 512, 1, 512, 2048, 2048, 2048, 512]
    - [15, 26.64]
  - - [2048, 512, 1, 1024, 2048, 2048, 2048, 1024]
    - [10, 34.96]
  - - [2048, 512, 1, 2048, 2048, 2048, 2048, 2048]
    - [10, 41.68]
  - - [2048, 512, 1, 4096, 2048, 2048, 2048, 4096]
    - [10, 46.2]
  - - [2048, 512, 1, 8192, 2048, 2048, 2048, 8192]
    - [14, 48.97]
  - - [2048, 1024, 1, 128, 2048, 2048, 2048, 128]
    - [0, 11.63]
  - - [2048, 1024, 1, 256, 2048, 2048, 2048, 256]
    - [15, 18.61]
  - - [2048, 1024, 1, 512, 2048, 2048, 2048, 512]
    - [10, 27.29]
  - - [2048, 1024, 1, 1024, 2048, 2048, 2048, 1024]
    - [10, 35.61]
  - - [2048, 1024, 1, 2048, 2048, 2048, 2048, 2048]
    - [10, 42.13]
  - - [2048, 1024, 1, 4096, 2048, 2048, 2048, 4096]
    - [26, 47.08]
  - - [2048, 1024, 1, 8192, 2048, 2048, 2048, 8192]
    - [29, 51.02]
  - - [2048, 2048, 1, 128, 2048, 2048, 2048, 128]
    - [0, 11.92]
  - - [2048, 2048, 1, 256, 2048, 2048, 2048, 256]
    - [15, 19.0]
  - - [2048, 2048, 1, 512, 2048, 2048, 2048, 512]
    - [15, 27.74]
  - - [2048, 2048, 1, 1024, 2048, 2048, 2048, 1024]
    - [10, 36.05]
  - - [2048, 2048, 1, 2048, 2048, 2048, 2048, 2048]
    - [2, 42.75]
  - - [2048, 2048, 1, 4096, 2048, 2048, 2048, 4096]
    - [12, 54.89]
  - - [2048, 2048, 1, 8192, 2048, 2048, 2048, 8192]
    - [12, 59.41]
  - - [2048, 4096, 1, 128, 2048, 2048, 2048, 128]
    - [0, 12.11]
  - - [2048, 4096, 1, 256, 2048, 2048, 2048, 256]
    - [15, 19.19]
  - - [2048, 4096, 1, 512, 2048, 2048, 2048, 512]
    - [10, 27.93]
  - - [2048, 4096, 1, 1024, 2048, 2048, 2048, 1024]
    - [25, 37.73]
  - - [2048, 4096, 1, 2048, 2048, 2048, 2048, 2048]
    - [11, 46.26]
  - - [2048, 4096, 1, 4096, 2048, 2048, 2048, 4096]
    - [12, 54.34]
  - - [2048, 4096, 1, 8192, 2048, 2048, 2048, 8192]
    - [20, 57.54]
  - - [2048, 8192, 1, 128, 2048, 2048, 2048, 128]
    - [0, 12.19]
  - - [2048, 8192, 1, 256, 2048, 2048, 2048, 256]
    - [15, 19.36]
  - - [2048, 8192, 1, 512, 2048, 2048, 2048, 512]
    - [0, 31.54]
  - - [2048, 8192, 1, 1024, 2048, 2048, 2048, 1024]
    - [10, 43.87]
  - - [2048, 8192, 1, 2048, 2048, 2048, 2048, 2048]
    - [10, 52.21]
  - - [2048, 8192, 1, 4096, 2048, 2048, 2048, 4096]
    - [12, 57.48]
  - - [2048, 8192, 1, 8192, 2048, 2048, 2048, 8192]
    - [16, 60.8]
  - - [4096, 128, 1, 128, 4096, 4096, 4096, 128]
    - [7, 8.84]
  - - [4096, 128, 1, 256, 4096, 4096, 4096, 256]
    - [34, 14.34]
  - - [4096, 128, 1, 512, 4096, 4096, 4096, 512]
    - [34, 21.3]
  - - [4096, 128, 1, 1024, 4096, 4096, 4096, 1024]
    - [37, 28.01]
  - - [4096, 128, 1, 2048, 4096, 4096, 4096, 2048]
    - [36, 33.6]
  - - [4096, 128, 1, 4096, 4096, 4096, 4096, 4096]
    - [36, 37.37]
  - - [4096, 128, 1, 8192, 4096, 4096, 4096, 8192]
    - [36, 39.51]
  - - [4096, 256, 1, 128, 4096, 4096, 4096, 128]
    - [0, 11.17]
  - - [4096, 256, 1, 256, 4096, 4096, 4096, 256]
    - [15, 18.01]
  - - [4096, 256, 1, 512, 4096, 4096, 4096, 512]
    - [15, 26.37]
  - - [4096, 256, 1, 1024, 4096, 4096, 4096, 1024]
    - [10, 34.91]
  - - [4096, 256, 1, 2048, 4096, 4096, 4096, 2048]
    - [10, 41.69]
  - - [4096, 256, 1, 4096, 4096, 4096, 4096, 4096]
    - [12, 46.16]
  - - [4096, 256, 1, 8192, 4096, 4096, 4096, 8192]
    - [12, 48.85]
  - - [4096, 512, 1, 128, 4096, 4096, 4096, 128]
    - [0, 11.62]
  - - [4096, 512, 1, 256, 4096, 4096, 4096, 256]
    - [11, 18.57]
  - - [4096, 512, 1, 512, 4096, 4096, 4096, 512]
    - [10, 27.13]
  - - [4096, 512, 1, 1024, 4096, 4096, 4096, 1024]
    - [10, 35.54]
  - - [4096, 512, 1, 2048, 4096, 4096, 4096, 2048]
    - [12, 42.16]
  - - [4096, 512, 1, 4096, 4096, 4096, 4096, 4096]
    - [27, 47.12]
  - - [4096, 512, 1, 8192, 4096, 4096, 4096, 8192]
    - [30, 51.12]
  - - [4096, 1024, 1, 128, 4096, 4096, 4096, 128]
    - [0, 11.93]
  - - [4096, 1024, 1, 256, 4096, 4096, 4096, 256]
    - [11, 18.95]
  - - [4096, 1024, 1, 512, 4096, 4096, 4096, 512]
    - [10, 27.56]
  - - [4096, 1024, 1, 1024, 4096, 4096, 4096, 1024]
    - [10, 35.97]
  - - [4096, 1024, 1, 2048, 4096, 4096, 4096, 2048]
    - [2, 42.75]
  - - [4096, 1024, 1, 4096, 4096, 4096, 4096, 4096]
    - [10, 54.83]
  - - [4096, 1024, 1, 8192, 4096, 4096, 4096, 8192]
    - [12, 59.36]
  - - [4096, 2048, 1, 128, 4096, 4096, 4096, 128]
    - [0, 12.1]
  - - [4096, 2048, 1, 256, 4096, 4096, 4096, 256]
    - [15, 19.19]
  - - [4096, 2048, 1, 512, 4096, 4096, 4096, 512]
    - [10, 27.83]
  - - [4096, 2048, 1, 1024, 4096, 4096, 4096, 1024]
    - [25, 37.39]
  - - [4096, 2048, 1, 2048, 4096, 4096, 4096, 2048]
    - [10, 46.28]
  - - [4096, 2048, 1, 4096, 4096, 4096, 4096, 4096]
    - [12, 54.33]
  - - [4096, 2048, 1, 8192, 4096, 4096, 4096, 8192]
    - [13, 57.55]
  - - [4096, 4096, 1, 128, 4096, 4096, 4096, 128]
    - [0, 12.19]
  - - [4096, 4096, 1, 256, 4096, 4096, 4096, 256]
    - [15, 19.32]
  - - [4096, 4096, 1, 512, 4096, 4096, 4096, 512]
    - [0, 31.41]
  - - [4096, 4096, 1, 1024, 4096, 4096, 4096, 1024]
    - [10, 43.73]
  - - [4096, 4096, 1, 2048, 4096, 4096, 4096, 2048]
    - [10, 52.25]
  - - [4096, 4096, 1, 4096, 4096, 4096, 4096, 4096]
    - [17, 57.46]
  - - [4096, 4096, 1, 8192, 4096, 4096, 4096, 8192]
    - [17, 60.79]
  - - [4096, 8192, 1, 128, 4096, 4096, 4096, 128]
    - [3, 12.36]
  - - [4096, 8192, 1, 256, 4096, 4096, 4096, 256]
    - [0, 21.64]
  - - [4096, 8192, 1, 512, 4096, 4096, 4096, 512]
    - [10, 32.11]
  - - [4096, 8192, 1, 1024, 4096, 4096, 4096, 1024]
    - [10, 42.17]
  - - [4096, 8192, 1, 2048, 4096, 4096, 4096, 2048]
    - [10, 49.86]
  - - [4096, 8192, 1, 4096, 4096, 4096, 4096, 4096]
    - [19, 57.82]
  - - [4096, 8192, 1, 8192, 4096, 4096, 4096, 8192]
    - [18, 61.07]
  - - [8192, 128, 1, 128, 8192, 8192, 8192, 128]
    - [6, 9.45]
  - - [8192, 128, 1, 256, 8192, 8192, 8192, 256]
    - [33, 15.31]
  - - [8192, 128, 1, 512, 8192, 8192, 8192, 512]
    - [35, 22.26]
  - - [8192, 128, 1, 1024, 8192, 8192, 8192, 1024]
    - [35, 28.93]
  - - [8192, 128, 1, 2048, 8192, 8192, 8192, 2048]
    - [37, 34.18]
  - - [8192, 128, 1, 4096, 8192, 8192, 8192, 4096]
    - [36, 37.7]
  - - [8192, 128, 1, 8192, 8192, 8192, 8192, 8192]
    - [36, 39.22]
  - - [8192, 256, 1, 128, 8192, 8192, 8192, 128]
    - [0, 11.66]
  - - [8192, 256, 1, 256, 8192, 8192, 8192, 256]
    - [15, 18.63]
  - - [8192, 256, 1, 512, 8192, 8192, 8192, 512]
    - [15, 27.25]
  - - [8192, 256, 1, 1024, 8192, 8192, 8192, 1024]
    - [10, 35.64]
  - - [8192, 256, 1, 2048, 8192, 8192, 8192, 2048]
    - [10, 42.22]
  - - [8192, 256, 1, 4096, 8192, 8192, 8192, 4096]
    - [22, 47.07]
  - - [8192, 256, 1, 8192, 8192, 8192, 8192, 8192]
    - [12, 48.9]
  - - [8192, 512, 1, 128, 8192, 8192, 8192, 128]
    - [0, 11.94]
  - - [8192, 512, 1, 256, 8192, 8192, 8192, 256]
    - [15, 18.98]
  - - [8192, 512, 1, 512, 8192, 8192, 8192, 512]
    - [15, 27.6]
  - - [8192, 512, 1, 1024, 8192, 8192, 8192, 1024]
    - [10, 35.97]
  - - [8192, 512, 1, 2048, 8192, 8192, 8192, 2048]
    - [2, 42.71]
  - - [8192, 512, 1, 4096, 8192, 8192, 8192, 4096]
    - [12, 54.91]
  - - [8192, 512, 1, 8192, 8192, 8192, 8192, 8192]
    - [17, 58.98]
  - - [8192, 1024, 1, 128, 8192, 8192, 8192, 128]
    - [0, 12.11]
  - - [8192, 1024, 1, 256, 8192, 8192, 8192, 256]
    - [15, 19.21]
  - - [8192, 1024, 1, 512, 8192, 8192, 8192, 512]
    - [15, 27.83]
  - - [8192, 1024, 1, 1024, 8192, 8192, 8192, 1024]
    - [25, 37.48]
  - - [8192, 1024, 1, 2048, 8192, 8192, 8192, 2048]
    - [10, 46.24]
  - - [8192, 1024, 1, 4096, 8192, 8192, 8192, 4096]
    - [12, 54.34]
  - - [8192, 1024, 1, 8192, 8192, 8192, 8192, 8192]
    - [20, 57.48]
  - - [8192, 2048, 1, 128, 8192, 8192, 8192, 128]
    - [0, 12.18]
  - - [8192, 2048, 1, 256, 8192, 8192, 8192, 256]
    - [15, 19.33]
  - - [8192, 2048, 1, 512, 8192, 8192, 8192, 512]
    - [0, 31.53]
  - - [8192, 2048, 1, 1024, 8192, 8192, 8192, 1024]
    - [10, 43.61]
  - - [8192, 2048, 1, 2048, 8192, 8192, 8192, 2048]
    - [10, 52.19]
  - - [8192, 2048, 1, 4096, 8192, 8192, 8192, 4096]
    - [14, 57.55]
  - - [8192, 2048, 1, 8192, 8192, 8192, 8192, 8192]
    - [20, 60.73]
  - - [8192, 4096, 1, 128, 8192, 8192, 8192, 128]
    - [3, 12.44]
  - - [8192, 4096, 1, 256, 8192, 8192, 8192, 256]
    - [0, 21.63]
  - - [8192, 4096, 1, 512, 8192, 8192, 8192, 512]
    - [10, 32.12]
  - - [8192, 4096, 1, 1024, 8192, 8192, 8192, 1024]
    - [10, 42.23]
  - - [8192, 4096, 1, 2048, 8192, 8192, 8192, 2048]
    - [10, 49.92]
  - - [8192, 4096, 1, 4096, 8192, 8192, 8192, 4096]
    - [10, 57.78]
  - - [8192, 4096, 1, 8192, 8192, 8192, 8192, 8192]
    - [18, 60.87]
  - - [8192, 8192, 1, 128, 8192, 8192, 8192, 128]
    - [1, 14.54]
  - - [8192, 8192, 1, 256, 8192, 8192, 8192, 256]
    - [11, 23.4]
  - - [8192, 8192, 1, 512, 8192, 8192, 8192, 512]
    - [11, 34.12]
  - - [8192, 8192, 1, 1024, 8192, 8192, 8192, 1024]
    - [11, 44.49]
  - - [8192, 8192, 1, 2048, 8192, 8192, 8192, 2048]
    - [11, 52.59]
  - - [8192, 8192, 1, 4096, 8192, 8192, 8192, 4096]
    - [16, 57.92]
  - - [8192, 8192, 1, 8192, 8192, 8192, 8192, 8192]
    - [19, 61.05]
  - - [1, 1, 1, 32, 1, 1, 1, 32]
    - [64, 0.0]
- null
- null
- ExperimentalStreamK
- GridBased
