projects/hipblaslt/library/src/amd_detail/rocblaslt/src/Tensile/Logic/asm_full/aquavanjaram/gfx942_20cu/StreamK/aquavanjaram942_Cijk_Alik_Bjlk_I8_BH_UserArgs.yaml
- {MinimumRequiredVersion: 5.0.0}
- aquavanjaram942
- {Architecture: gfx942, CUCount: 20}
- [Device 0049, Device 0050]
    SolutionIndex: 0
    SolutionNameMin: Cijk_Alik_Bjlk_I8_BH_UserArgs_MT256x256x32_MI16x16x1_SN_LDSB0_AFC0_AFEM1_AFEM1_ASEM1_CLR0_CADS0_DTVA0_DTVB0_EPS0_FDSI0_GRPM1_GRVWA4_GRVWB2_GSU0_GSUAMB_GSUC0_GSUWGMRR0_GLS0_ISA942_IU1_K1_LBSPPA128_LBSPPB2048_LBSPPM0_LPA8_LPB0_LPM0_LRVW8_LWPMn1_MIAV0_MIWT8_8_MO40_NTn1_NTA0_NTB0_NTC0_NTD0_NTM0_NEPBS0_NLCA1_NLCB1_ONLL1_PGR2_PLR0_PKA1_SIA3_SS1_SU0_SUM0_SUS32_SPO0_SRVW0_SSO0_SVW4_SK3_SKXCCM8_TLDS1_ULSGRO0_USL1_UIOFGRO0_USFGRO0_VSn1_VWA4_VWB8_WSGRA0_WSGRB0_WS64_WG32_8_1_WGM1_WGMXCC1_WGMXCCGn1
    SolutionIndex: 1
    SolutionNameMin: Cijk_Alik_Bjlk_I8_BH_UserArgs_MT256x256x32_MI16x16x1_SN_LDSB0_AFC0_AFEM1_AFEM1_ASEM1_CLR0_CADS0_DTVA0_DTVB0_EPS0_FDSI0_GRPM1_GRVWA4_GRVWB8_GSU0_GSUAMB_GSUC0_GSUWGMRR0_GLS0_ISA942_IU1_K1_LBSPPA256_LBSPPB2048_LBSPPM0_LPA8_LPB0_LPM0_LRVW8_LWPMn1_MIAV0_MIWT8_8_MO40_NTn1_NTA0_NTB0_NTC0_NTD0_NTM0_NEPBS0_NLCA1_NLCB1_ONLL1_PGR2_PLR0_PKA1_SIA3_SS1_SU0_SUM0_SUS32_SPO0_SRVW0_SSO0_SVW8_SK3_SKXCCM8_TLDS1_ULSGRO0_USL1_UIOFGRO0_USFGRO0_VSn1_VWA8_VWB8_WSGRA0_WSGRB0_WS64_WG32_8_1_WGM1_WGMXCC1_WGMXCCGn1
    SolutionIndex: 2
    SolutionNameMin: Cijk_Alik_Bjlk_I8_BH_UserArgs_MT256x256x32_MI16x16x1_SN_LDSB0_AFC0_AFEM1_AFEM1_ASEM1_CLR0_CADS0_DTVA0_DTVB0_EPS0_FDSI0_GRPM1_GRVWA8_GRVWB8_GSU0_GSUAMB_GSUC0_GSUWGMRR0_GLS0_ISA942_IU1_K1_LBSPPA128_LBSPPB2048_LBSPPM0_LPA8_LPB0_LPM0_LRVW8_LWPMn1_MIAV0_MIWT8_8_MO40_NTn1_NTA0_NTB0_NTC0_NTD0_NTM0_NEPBS0_NLCA1_NLCB1_ONLL1_PGR2_PLR0_PKA1_SIA3_SS1_SU0_SUM0_SUS32_SPO0_SRVW0_SSO0_SVW4_SK3_SKXCCM8_TLDS1_ULSGRO0_USL1_UIOFGRO0_USFGRO0_VSn1_VWA4_VWB8_WSGRA0_WSGRB0_WS64_WG32_8_1_WGM1_WGMXCC1_WGMXCCGn1
    SolutionIndex: 3
    SolutionNameMin: Cijk_Alik_Bjlk_I8_BH_UserArgs_MT256x256x32_MI16x16x1_SN_LDSB0_AFC0_AFEM1_AFEM1_ASEM1_CLR0_CADS0_DTVA0_DTVB0_EPS0_FDSI0_GRPM1_GRVWA8_GRVWB8_GSU0_GSUAMB_GSUC0_GSUWGMRR0_GLS0_ISA942_IU1_K1_LBSPPA256_LBSPPB2048_LBSPPM0_LPA8_LPB0_LPM0_LRVW8_LWPMn1_MIAV0_MIWT8_8_MO40_NTn1_NTA0_NTB0_NTC0_NTD0_NTM0_NEPBS0_NLCA1_NLCB1_ONLL1_PGR2_PLR0_PKA1_SIA3_SS1_SU0_SUM0_SUS32_SPO0_SRVW0_SSO0_SVW8_SK3_SKXCCM8_TLDS1_ULSGRO0_USL1_UIOFGRO0_USFGRO0_VSn1_VWA8_VWB8_WSGRA0_WSGRB0_WS64_WG32_8_1_WGM1_WGMXCC1_WGMXCCGn1
    SolutionIndex: 4
    SolutionNameMin: Cijk_Alik_Bjlk_I8_BH_UserArgs_MT128x256x32_MI16x16x1_SN_LDSB0_AFC0_AFEM1_AFEM1_ASEM1_CLR0_CADS0_DTVA0_DTVB0_EPS0_FDSI0_GRPM1_GRVWA4_GRVWB8_GSU0_GSUAMB_GSUC0_GSUWGMRR0_GLS0_ISA942_IU1_K1_LBSPPA128_LBSPPB2048_LBSPPM0_LPA8_LPB0_LPM0_LRVW8_LWPMn1_MIAV0_MIWT4_8_MO40_NTn1_NTA0_NTB0_NTC0_NTD0_NTM0_NEPBS0_NLCA1_NLCB1_ONLL1_PGR2_PLR0_PKA1_SIA3_SS1_SU0_SUM0_SUS32_SPO0_SRVW0_SSO0_SVW4_SK3_SKXCCM8_TLDS1_ULSGRO0_USL1_UIOFGRO0_USFGRO0_VSn1_VWA4_VWB8_WSGRA0_WSGRB0_WS64_WG32_8_1_WGM1_WGMXCC1_WGMXCCGn1
    SolutionIndex: 5
    SolutionNameMin: Cijk_Alik_Bjlk_I8_BH_UserArgs_MT256x128x32_MI16x16x1_SN_LDSB0_AFC0_AFEM1_AFEM1_ASEM1_CLR0_CADS0_DTVA0_DTVB0_EPS0_FDSI0_GRPM1_GRVWA4_GRVWB4_GSU0_GSUAMB_GSUC0_GSUWGMRR0_GLS0_ISA942_IU1_K1_LBSPPA256_LBSPPB1024_LBSPPM0_LPA8_LPB64_LPM0_LRVW8_LWPMn1_MIAV0_MIWT8_4_MO40_NTn1_NTA0_NTB0_NTC0_NTD0_NTM0_NEPBS0_NLCA1_NLCB1_ONLL1_PGR2_PLR0_PKA1_SIA3_SS1_SU0_SUM0_SUS32_SPO0_SRVW0_SSO0_SVW8_SK3_SKXCCM8_TLDS1_ULSGRO0_USL1_UIOFGRO0_USFGRO0_VSn1_VWA8_VWB4_WSGRA0_WSGRB0_WS64_WG32_8_1_WGM1_WGMXCC1_WGMXCCGn1
    SolutionIndex: 6
    SolutionNameMin: Cijk_Alik_Bjlk_I8_BH_UserArgs_MT256x128x32_MI16x16x1_SN_LDSB0_AFC0_AFEM1_AFEM1_ASEM1_CLR0_CADS0_DTVA0_DTVB0_EPS0_FDSI0_GRPM1_GRVWA8_GRVWB8_GSU0_GSUAMB_GSUC0_GSUWGMRR0_GLS0_ISA942_IU1_K1_LBSPPA256_LBSPPB1024_LBSPPM0_LPA8_LPB64_LPM0_LRVW8_LWPMn1_MIAV0_MIWT8_4_MO40_NTn1_NTA0_NTB0_NTC0_NTD0_NTM0_NEPBS0_NLCA1_NLCB1_ONLL1_PGR2_PLR0_PKA1_SIA3_SS1_SU0_SUM0_SUS32_SPO0_SRVW0_SSO0_SVW8_SK3_SKXCCM8_TLDS1_ULSGRO0_USL1_UIOFGRO0_USFGRO0_VSn1_VWA8_VWB4_WSGRA0_WSGRB0_WS64_WG32_8_1_WGM1_WGMXCC1_WGMXCCGn1
    SolutionIndex: 7
    SolutionNameMin: Cijk_Alik_Bjlk_I8_BH_UserArgs_MT128x128x32_MI16x16x1_SN_LDSB0_AFC0_AFEM1_AFEM1_ASEM1_CLR0_CADS0_DTVA0_DTVB0_EPS0_FDSI0_GRPM1_GRVWA8_GRVWB8_GSU0_GSUAMB_GSUC0_GSUWGMRR0_GLS0_ISA942_IU1_K1_LBSPPA128_LBSPPB1024_LBSPPM0_LPA8_LPB64_LPM0_LRVW8_LWPMn1_MIAV0_MIWT4_4_MO40_NTn1_NTA0_NTB0_NTC0_NTD0_NTM0_NEPBS0_NLCA1_NLCB1_ONLL1_PGR2_PLR0_PKA1_SIA3_SS1_SU0_SUM0_SUS32_SPO0_SRVW0_SSO0_SVW4_SK3_SKXCCM8_TLDS1_ULSGRO0_USL1_UIOFGRO0_USFGRO0_VSn1_VWA4_VWB4_WSGRA0_WSGRB0_WS64_WG32_8_1_WGM1_WGMXCC1_WGMXCCGn1
    SolutionIndex: 8
    SolutionNameMin: Cijk_Alik_Bjlk_I8_BH_UserArgs_MT128x64x32_MI16x16x1_SN_LDSB0_AFC0_AFEM1_AFEM1_ASEM1_CLR0_CADS0_DTVA0_DTVB0_EPS0_FDSI0_GRPM1_GRVWA8_GRVWB4_GSU0_GSUAMB_GSUC0_GSUWGMRR0_GLS0_ISA942_IU1_K1_LBSPPA128_LBSPPB512_LBSPPM0_LPA8_LPB32_LPM0_LRVW8_LWPMn1_MIAV0_MIWT4_2_MO40_NTn1_NTA0_NTB0_NTC0_NTD0_NTM0_NEPBS0_NLCA1_NLCB1_ONLL1_PGR2_PLR0_PKA1_SIA3_SS1_SU0_SUM0_SUS32_SPO0_SRVW0_SSO0_SVW4_SK3_SKXCCM8_TLDS1_ULSGRO0_USL1_UIOFGRO0_USFGRO0_VSn1_VWA4_VWB2_WSGRA0_WSGRB0_WS64_WG32_8_1_WGM1_WGMXCC1_WGMXCCGn1
    SolutionIndex: 9
    SolutionNameMin: Cijk_Alik_Bjlk_I8_BH_UserArgs_MT256x256x64_MI16x16x1_SN_LDSB1_AFC0_AFEM1_AFEM1_ASEM1_CLR1_CADS0_DTVA0_DTVB0_EPS0_FDSI0_GRPM1_GRVWA4_GRVWB4_GSU0_GSUAMB_GSUC0_GSUWGMRR0_GLS0_ISA942_IU1_K1_LBSPPA256_LBSPPB2048_LBSPPM0_LPA8_LPB32_LPM0_LRVW8_LWPMn1_MIAV0_MIWT8_8_MO40_NTn1_NTA0_NTB0_NTC0_NTD0_NTM0_NEPBS0_NLCA1_NLCB1_ONLL1_PGR2_PLR1_PKA1_SIA3_SS1_SU0_SUM0_SUS64_SPO0_SRVW0_SSO0_SVW4_SK3_SKXCCM8_TLDS1_ULSGRO0_USL1_UIOFGRO0_USFGRO0_VSn1_VWA4_VWB2_WSGRA0_WSGRB0_WS64_WG32_8_1_WGM1_WGMXCC1_WGMXCCGn1
    SolutionIndex: 10
    SolutionNameMin: Cijk_Alik_Bjlk_I8_BH_UserArgs_MT256x256x64_MI16x16x1_SN_LDSB1_AFC0_AFEM1_AFEM1_ASEM1_CLR1_CADS0_DTVA0_DTVB0_EPS0_FDSI0_GRPM1_GRVWA4_GRVWB4_GSU0_GSUAMB_GSUC0_GSUWGMRR0_GLS0_ISA942_IU1_K1_LBSPPA256_LBSPPB2048_LBSPPM0_LPA8_LPB64_LPM0_LRVW8_LWPMn1_MIAV0_MIWT8_8_MO40_NTn1_NTA0_NTB0_NTC0_NTD0_NTM0_NEPBS0_NLCA1_NLCB1_ONLL1_PGR2_PLR1_PKA1_SIA3_SS1_SU0_SUM0_SUS64_SPO0_SRVW0_SSO0_SVW4_SK3_SKXCCM8_TLDS1_ULSGRO0_USL1_UIOFGRO0_USFGRO0_VSn1_VWA4_VWB4_WSGRA0_WSGRB0_WS64_WG32_8_1_WGM1_WGMXCC1_WGMXCCGn1
    SolutionIndex: 11
    SolutionNameMin: Cijk_Alik_Bjlk_I8_BH_UserArgs_MT256x256x64_MI16x16x1_SN_LDSB1_AFC0_AFEM1_AFEM1_ASEM1_CLR1_CADS0_DTVA0_DTVB0_EPS0_FDSI0_GRPM1_GRVWA4_GRVWB4_GSU0_GSUAMB_GSUC0_GSUWGMRR0_GLS0_ISA942_IU1_K1_LBSPPA256_LBSPPB2048_LBSPPM0_LPA8_LPB0_LPM0_LRVW8_LWPMn1_MIAV0_MIWT8_8_MO40_NTn1_NTA0_NTB0_NTC0_NTD0_NTM0_NEPBS0_NLCA1_NLCB1_ONLL1_PGR2_PLR1_PKA1_SIA3_SS1_SU0_SUM0_SUS64_SPO0_SRVW0_SSO0_SVW4_SK3_SKXCCM8_TLDS1_ULSGRO0_USL1_UIOFGRO0_USFGRO0_VSn1_VWA4_VWB8_WSGRA0_WSGRB0_WS64_WG32_8_1_WGM1_WGMXCC1_WGMXCCGn1
    SolutionIndex: 12
    SolutionNameMin: Cijk_Alik_Bjlk_I8_BH_UserArgs_MT256x256x64_MI16x16x1_SN_LDSB1_AFC0_AFEM1_AFEM1_ASEM1_CLR1_CADS0_DTVA0_DTVB0_EPS0_FDSI0_GRPM1_GRVWA8_GRVWB4_GSU0_GSUAMB_GSUC0_GSUWGMRR0_GLS0_ISA942_IU1_K1_LBSPPA256_LBSPPB2048_LBSPPM0_LPA8_LPB64_LPM0_LRVW8_LWPMn1_MIAV0_MIWT8_8_MO40_NTn1_NTA0_NTB0_NTC0_NTD0_NTM0_NEPBS0_NLCA1_NLCB1_ONLL1_PGR2_PLR1_PKA1_SIA3_SS1_SU0_SUM0_SUS64_SPO0_SRVW0_SSO0_SVW4_SK3_SKXCCM8_TLDS1_ULSGRO0_USL1_UIOFGRO0_USFGRO0_VSn1_VWA4_VWB4_WSGRA0_WSGRB0_WS64_WG32_8_1_WGM1_WGMXCC1_WGMXCCGn1
    SolutionIndex: 13
    SolutionNameMin: Cijk_Alik_Bjlk_I8_BH_UserArgs_MT256x256x64_MI16x16x1_SN_LDSB1_AFC0_AFEM1_AFEM1_ASEM1_CLR1_CADS0_DTVA0_DTVB0_EPS0_FDSI0_GRPM1_GRVWA4_GRVWB4_GSU0_GSUAMB_GSUC0_GSUWGMRR0_GLS0_ISA942_IU1_K1_LBSPPA256_LBSPPB2048_LBSPPM0_LPA8_LPB64_LPM0_LRVW8_LWPMn1_MIAV0_MIWT8_8_MO40_NTn1_NTA0_NTB0_NTC0_NTD0_NTM0_NEPBS0_NLCA1_NLCB1_ONLL1_PGR2_PLR1_PKA1_SIA3_SS1_SU0_SUM0_SUS64_SPO0_SRVW0_SSO0_SVW4_SK3_SKXCCM8_TLDS1_ULSGRO0_USL1_UIOFGRO0_USFGRO0_VSn1_VWA4_VWB4_WSGRA0_WSGRB0_WS64_WG32_8_1_WGM4_WGMXCC1_WGMXCCGn1
    SolutionIndex: 14
    SolutionNameMin: Cijk_Alik_Bjlk_I8_BH_UserArgs_MT256x256x64_MI16x16x1_SN_LDSB1_AFC0_AFEM1_AFEM1_ASEM1_CLR1_CADS0_DTVA0_DTVB0_EPS0_FDSI0_GRPM1_GRVWA4_GRVWB4_GSU0_GSUAMB_GSUC0_GSUWGMRR0_GLS0_ISA942_IU1_K1_LBSPPA256_LBSPPB2048_LBSPPM0_LPA8_LPB64_LPM0_LRVW8_LWPMn1_MIAV0_MIWT8_8_MO40_NTn1_NTA0_NTB0_NTC0_NTD0_NTM0_NEPBS0_NLCA1_NLCB1_ONLL1_PGR2_PLR1_PKA1_SIA3_SS1_SU0_SUM0_SUS64_SPO0_SRVW0_SSO0_SVW4_SK3_SKXCCM8_TLDS1_ULSGRO0_USL1_UIOFGRO0_USFGRO0_VSn1_VWA4_VWB4_WSGRA0_WSGRB0_WS64_WG32_8_1_WGM8_WGMXCC1_WGMXCCGn1
    SolutionIndex: 15
    SolutionNameMin: Cijk_Alik_Bjlk_I8_BH_UserArgs_MT256x256x64_MI16x16x1_SN_LDSB1_AFC0_AFEM1_AFEM1_ASEM1_CLR1_CADS0_DTVA0_DTVB0_EPS0_FDSI0_GRPM1_GRVWA4_GRVWB4_GSU0_GSUAMB_GSUC0_GSUWGMRR0_GLS0_ISA942_IU1_K1_LBSPPA512_LBSPPB2048_LBSPPM0_LPA8_LPB0_LPM0_LRVW8_LWPMn1_MIAV0_MIWT8_8_MO40_NTn1_NTA0_NTB0_NTC0_NTD0_NTM0_NEPBS0_NLCA1_NLCB1_ONLL1_PGR2_PLR1_PKA1_SIA3_SS1_SU0_SUM0_SUS64_SPO0_SRVW0_SSO0_SVW8_SK3_SKXCCM8_TLDS1_ULSGRO0_USL1_UIOFGRO0_USFGRO0_VSn1_VWA8_VWB8_WSGRA0_WSGRB0_WS64_WG32_8_1_WGM8_WGMXCC1_WGMXCCGn1
    SolutionIndex: 16
    SolutionNameMin: Cijk_Alik_Bjlk_I8_BH_UserArgs_MT128x256x64_MI16x16x1_SN_LDSB1_AFC0_AFEM1_AFEM1_ASEM1_CLR1_CADS0_DTVA0_DTVB0_EPS0_FDSI0_GRPM1_GRVWA4_GRVWB4_GSU0_GSUAMB_GSUC0_GSUWGMRR0_GLS0_ISA942_IU1_K1_LBSPPA256_LBSPPB2048_LBSPPM0_LPA8_LPB64_LPM0_LRVW8_LWPMn1_MIAV0_MIWT4_8_MO40_NTn1_NTA0_NTB0_NTC0_NTD0_NTM0_NEPBS0_NLCA1_NLCB1_ONLL1_PGR2_PLR1_PKA1_SIA3_SS1_SU0_SUM0_SUS64_SPO0_SRVW0_SSO0_SVW4_SK3_SKXCCM8_TLDS1_ULSGRO0_USL1_UIOFGRO0_USFGRO0_VSn1_VWA4_VWB4_WSGRA0_WSGRB0_WS64_WG32_8_1_WGM1_WGMXCC1_WGMXCCGn1
    SolutionIndex: 17
    SolutionNameMin: Cijk_Alik_Bjlk_I8_BH_UserArgs_MT128x256x64_MI16x16x1_SN_LDSB1_AFC0_AFEM1_AFEM1_ASEM1_CLR1_CADS0_DTVA0_DTVB0_EPS0_FDSI0_GRPM1_GRVWA4_GRVWB8_GSU0_GSUAMB_GSUC0_GSUWGMRR0_GLS0_ISA942_IU1_K1_LBSPPA256_LBSPPB2048_LBSPPM0_LPA8_LPB64_LPM0_LRVW8_LWPMn1_MIAV0_MIWT4_8_MO40_NTn1_NTA0_NTB0_NTC0_NTD0_NTM0_NEPBS0_NLCA1_NLCB1_ONLL1_PGR2_PLR1_PKA1_SIA3_SS1_SU0_SUM0_SUS64_SPO0_SRVW0_SSO0_SVW4_SK3_SKXCCM8_TLDS1_ULSGRO0_USL1_UIOFGRO0_USFGRO0_VSn1_VWA4_VWB4_WSGRA0_WSGRB0_WS64_WG32_8_1_WGM1_WGMXCC1_WGMXCCGn1
    SolutionIndex: 18
    SolutionNameMin: Cijk_Alik_Bjlk_I8_BH_UserArgs_MT128x256x64_MI16x16x1_SN_LDSB1_AFC0_AFEM1_AFEM1_ASEM1_CLR1_CADS0_DTVA0_DTVB0_EPS0_FDSI0_GRPM1_GRVWA4_GRVWB8_GSU0_GSUAMB_GSUC0_GSUWGMRR0_GLS0_ISA942_IU1_K1_LBSPPA256_LBSPPB2048_LBSPPM0_LPA8_LPB0_LPM0_LRVW8_LWPMn1_MIAV0_MIWT4_8_MO40_NTn1_NTA0_NTB0_NTC0_NTD0_NTM0_NEPBS0_NLCA1_NLCB1_ONLL1_PGR2_PLR1_PKA1_SIA3_SS1_SU0_SUM0_SUS64_SPO0_SRVW0_SSO0_SVW4_SK3_SKXCCM8_TLDS1_ULSGRO0_USL1_UIOFGRO0_USFGRO0_VSn1_VWA4_VWB8_WSGRA0_WSGRB0_WS64_WG32_8_1_WGM1_WGMXCC1_WGMXCCGn1
    SolutionIndex: 19
    SolutionNameMin: Cijk_Alik_Bjlk_I8_BH_UserArgs_MT128x256x64_MI16x16x1_SN_LDSB1_AFC0_AFEM1_AFEM1_ASEM1_CLR1_CADS0_DTVA0_DTVB0_EPS0_FDSI0_GRPM1_GRVWA8_GRVWB8_GSU0_GSUAMB_GSUC0_GSUWGMRR0_GLS0_ISA942_IU1_K1_LBSPPA256_LBSPPB2048_LBSPPM0_LPA8_LPB0_LPM0_LRVW8_LWPMn1_MIAV0_MIWT4_8_MO40_NTn1_NTA0_NTB0_NTC0_NTD0_NTM0_NEPBS0_NLCA1_NLCB1_ONLL1_PGR2_PLR1_PKA1_SIA3_SS1_SU0_SUM0_SUS64_SPO0_SRVW0_SSO0_SVW4_SK3_SKXCCM8_TLDS1_ULSGRO0_USL1_UIOFGRO0_USFGRO0_VSn1_VWA4_VWB8_WSGRA0_WSGRB0_WS64_WG32_8_1_WGM1_WGMXCC1_WGMXCCGn1
    SolutionIndex: 20
    SolutionNameMin: Cijk_Alik_Bjlk_I8_BH_UserArgs_MT256x128x64_MI16x16x1_SN_LDSB1_AFC0_AFEM1_AFEM1_ASEM1_CLR1_CADS0_DTVA0_DTVB0_EPS0_FDSI0_GRPM1_GRVWA4_GRVWB4_GSU0_GSUAMB_GSUC0_GSUWGMRR0_GLS0_ISA942_IU1_K1_LBSPPA512_LBSPPB1024_LBSPPM0_LPA8_LPB64_LPM0_LRVW8_LWPMn1_MIAV0_MIWT8_4_MO40_NTn1_NTA0_NTB0_NTC0_NTD0_NTM0_NEPBS0_NLCA1_NLCB1_ONLL1_PGR2_PLR1_PKA1_SIA3_SS1_SU0_SUM0_SUS64_SPO0_SRVW0_SSO0_SVW8_SK3_SKXCCM8_TLDS1_ULSGRO0_USL1_UIOFGRO0_USFGRO0_VSn1_VWA8_VWB4_WSGRA0_WSGRB0_WS64_WG32_8_1_WGM1_WGMXCC1_WGMXCCGn1
    SolutionIndex: 21
    SolutionNameMin: Cijk_Alik_Bjlk_I8_BH_UserArgs_MT256x128x64_MI16x16x1_SN_LDSB1_AFC0_AFEM1_AFEM1_ASEM1_CLR1_CADS0_DTVA0_DTVB0_EPS0_FDSI0_GRPM1_GRVWA4_GRVWB8_GSU0_GSUAMB_GSUC0_GSUWGMRR0_GLS0_ISA942_IU1_K1_LBSPPA256_LBSPPB1024_LBSPPM0_LPA8_LPB64_LPM0_LRVW8_LWPMn1_MIAV0_MIWT8_4_MO40_NTn1_NTA0_NTB0_NTC0_NTD0_NTM0_NEPBS0_NLCA1_NLCB1_ONLL1_PGR2_PLR1_PKA1_SIA3_SS1_SU0_SUM0_SUS64_SPO0_SRVW0_SSO0_SVW4_SK3_SKXCCM8_TLDS1_ULSGRO0_USL1_UIOFGRO0_USFGRO0_VSn1_VWA4_VWB4_WSGRA0_WSGRB0_WS64_WG32_8_1_WGM1_WGMXCC1_WGMXCCGn1
    SolutionIndex: 22
    SolutionNameMin: Cijk_Alik_Bjlk_I8_BH_UserArgs_MT256x128x64_MI16x16x1_SN_LDSB1_AFC0_AFEM1_AFEM1_ASEM1_CLR1_CADS0_DTVA0_DTVB0_EPS0_FDSI0_GRPM1_GRVWA4_GRVWB8_GSU0_GSUAMB_GSUC0_GSUWGMRR0_GLS0_ISA942_IU1_K1_LBSPPA512_LBSPPB1024_LBSPPM0_LPA8_LPB64_LPM0_LRVW8_LWPMn1_MIAV0_MIWT8_4_MO40_NTn1_NTA0_NTB0_NTC0_NTD0_NTM0_NEPBS0_NLCA1_NLCB1_ONLL1_PGR2_PLR1_PKA1_SIA3_SS1_SU0_SUM0_SUS64_SPO0_SRVW0_SSO0_SVW8_SK3_SKXCCM8_TLDS1_ULSGRO0_USL1_UIOFGRO0_USFGRO0_VSn1_VWA8_VWB4_WSGRA0_WSGRB0_WS64_WG32_8_1_WGM1_WGMXCC1_WGMXCCGn1
    SolutionIndex: 23
    SolutionNameMin: Cijk_Alik_Bjlk_I8_BH_UserArgs_MT256x128x64_MI16x16x1_SN_LDSB1_AFC0_AFEM1_AFEM1_ASEM1_CLR1_CADS0_DTVA0_DTVB0_EPS0_FDSI0_GRPM1_GRVWA8_GRVWB8_GSU0_GSUAMB_GSUC0_GSUWGMRR0_GLS0_ISA942_IU1_K1_LBSPPA512_LBSPPB1024_LBSPPM0_LPA8_LPB64_LPM0_LRVW8_LWPMn1_MIAV0_MIWT8_4_MO40_NTn1_NTA0_NTB0_NTC0_NTD0_NTM0_NEPBS0_NLCA1_NLCB1_ONLL1_PGR2_PLR1_PKA1_SIA3_SS1_SU0_SUM0_SUS64_SPO0_SRVW0_SSO0_SVW8_SK3_SKXCCM8_TLDS1_ULSGRO0_USL1_UIOFGRO0_USFGRO0_VSn1_VWA8_VWB4_WSGRA0_WSGRB0_WS64_WG32_8_1_WGM1_WGMXCC1_WGMXCCGn1
    SolutionIndex: 24
    SolutionNameMin: Cijk_Alik_Bjlk_I8_BH_UserArgs_MT256x128x64_MI16x16x1_SN_LDSB1_AFC0_AFEM1_AFEM1_ASEM1_CLR1_CADS0_DTVA0_DTVB0_EPS0_FDSI0_GRPM1_GRVWA4_GRVWB8_GSU0_GSUAMB_GSUC0_GSUWGMRR0_GLS0_ISA942_IU1_K1_LBSPPA256_LBSPPB1024_LBSPPM0_LPA8_LPB64_LPM0_LRVW8_LWPMn1_MIAV0_MIWT8_4_MO40_NTn1_NTA0_NTB0_NTC0_NTD0_NTM0_NEPBS0_NLCA1_NLCB1_ONLL1_PGR2_PLR1_PKA1_SIA3_SS1_SU0_SUM0_SUS64_SPO0_SRVW0_SSO0_SVW4_SK3_SKXCCM8_TLDS1_ULSGRO0_USL1_UIOFGRO0_USFGRO0_VSn1_VWA4_VWB4_WSGRA0_WSGRB0_WS64_WG32_8_1_WGM4_WGMXCC1_WGMXCCGn1
    SolutionIndex: 25
    SolutionNameMin: Cijk_Alik_Bjlk_I8_BH_UserArgs_MT256x128x64_MI16x16x1_SN_LDSB1_AFC0_AFEM1_AFEM1_ASEM1_CLR1_CADS0_DTVA0_DTVB0_EPS0_FDSI0_GRPM1_GRVWA4_GRVWB8_GSU0_GSUAMB_GSUC0_GSUWGMRR0_GLS0_ISA942_IU1_K1_LBSPPA512_LBSPPB1024_LBSPPM0_LPA8_LPB64_LPM0_LRVW8_LWPMn1_MIAV0_MIWT8_4_MO40_NTn1_NTA0_NTB0_NTC0_NTD0_NTM0_NEPBS0_NLCA1_NLCB1_ONLL1_PGR2_PLR1_PKA1_SIA3_SS1_SU0_SUM0_SUS64_SPO0_SRVW0_SSO0_SVW8_SK3_SKXCCM8_TLDS1_ULSGRO0_USL1_UIOFGRO0_USFGRO0_VSn1_VWA8_VWB4_WSGRA0_WSGRB0_WS64_WG32_8_1_WGM4_WGMXCC1_WGMXCCGn1
    SolutionIndex: 26
    SolutionNameMin: Cijk_Alik_Bjlk_I8_BH_UserArgs_MT256x128x64_MI16x16x1_SN_LDSB1_AFC0_AFEM1_AFEM1_ASEM1_CLR1_CADS0_DTVA0_DTVB0_EPS0_FDSI0_GRPM1_GRVWA4_GRVWB8_GSU0_GSUAMB_GSUC0_GSUWGMRR0_GLS0_ISA942_IU1_K1_LBSPPA256_LBSPPB1024_LBSPPM0_LPA8_LPB64_LPM0_LRVW8_LWPMn1_MIAV0_MIWT8_4_MO40_NTn1_NTA0_NTB0_NTC0_NTD0_NTM0_NEPBS0_NLCA1_NLCB1_ONLL1_PGR2_PLR1_PKA1_SIA3_SS1_SU0_SUM0_SUS64_SPO0_SRVW0_SSO0_SVW4_SK3_SKXCCM8_TLDS1_ULSGRO0_USL1_UIOFGRO0_USFGRO0_VSn1_VWA4_VWB4_WSGRA0_WSGRB0_WS64_WG32_8_1_WGM8_WGMXCC1_WGMXCCGn1
    SolutionIndex: 27
    SolutionNameMin: Cijk_Alik_Bjlk_I8_BH_UserArgs_MT128x128x64_MI16x16x1_SN_LDSB1_AFC0_AFEM1_AFEM1_ASEM1_CLR1_CADS0_DTVA0_DTVB0_EPS0_FDSI0_GRPM1_GRVWA4_GRVWB4_GSU0_GSUAMB_GSUC0_GSUWGMRR0_GLS0_ISA942_IU1_K1_LBSPPA256_LBSPPB1024_LBSPPM0_LPA8_LPB64_LPM0_LRVW8_LWPMn1_MIAV0_MIWT4_4_MO40_NTn1_NTA0_NTB0_NTC0_NTD0_NTM0_NEPBS0_NLCA1_NLCB1_ONLL1_PGR2_PLR1_PKA1_SIA3_SS1_SU0_SUM0_SUS64_SPO0_SRVW0_SSO0_SVW4_SK3_SKXCCM8_TLDS1_ULSGRO0_USL1_UIOFGRO0_USFGRO0_VSn1_VWA4_VWB4_WSGRA0_WSGRB0_WS64_WG32_8_1_WGM1_WGMXCC1_WGMXCCGn1
    SolutionIndex: 28
    SolutionNameMin: Cijk_Alik_Bjlk_I8_BH_UserArgs_MT128x128x64_MI16x16x1_SN_LDSB1_AFC0_AFEM1_AFEM1_ASEM1_CLR1_CADS0_DTVA0_DTVB0_EPS0_FDSI0_GRPM1_GRVWA4_GRVWB8_GSU0_GSUAMB_GSUC0_GSUWGMRR0_GLS0_ISA942_IU1_K1_LBSPPA256_LBSPPB1024_LBSPPM0_LPA8_LPB64_LPM0_LRVW8_LWPMn1_MIAV0_MIWT4_4_MO40_NTn1_NTA0_NTB0_NTC0_NTD0_NTM0_NEPBS0_NLCA1_NLCB1_ONLL1_PGR2_PLR1_PKA1_SIA3_SS1_SU0_SUM0_SUS64_SPO0_SRVW0_SSO0_SVW4_SK3_SKXCCM8_TLDS1_ULSGRO0_USL1_UIOFGRO0_USFGRO0_VSn1_VWA4_VWB4_WSGRA0_WSGRB0_WS64_WG32_8_1_WGM1_WGMXCC1_WGMXCCGn1
    SolutionIndex: 29
    SolutionNameMin: Cijk_Alik_Bjlk_I8_BH_UserArgs_MT128x64x64_MI16x16x1_SN_LDSB0_AFC0_AFEM1_AFEM1_ASEM1_CLR1_CADS0_DTVA0_DTVB0_EPS0_FDSI0_GRPM1_GRVWA4_GRVWB4_GSU0_GSUAMB_GSUC0_GSUWGMRR0_GLS0_ISA942_IU1_K1_LBSPPA256_LBSPPB512_LBSPPM0_LPA8_LPB32_LPM0_LRVW8_LWPMn1_MIAV0_MIWT4_2_MO40_NTn1_NTA0_NTB0_NTC0_NTD0_NTM0_NEPBS0_NLCA1_NLCB1_ONLL1_PGR2_PLR1_PKA1_SIA3_SS1_SU0_SUM0_SUS64_SPO0_SRVW0_SSO0_SVW4_SK3_SKXCCM8_TLDS1_ULSGRO0_USL1_UIOFGRO0_USFGRO0_VSn1_VWA4_VWB2_WSGRA0_WSGRB0_WS64_WG32_8_1_WGM1_WGMXCC1_WGMXCCGn1
    SolutionIndex: 30
    SolutionNameMin: Cijk_Alik_Bjlk_I8_BH_UserArgs_MT128x64x64_MI16x16x1_SN_LDSB0_AFC0_AFEM1_AFEM1_ASEM1_CLR1_CADS0_DTVA0_DTVB0_EPS0_FDSI0_GRPM1_GRVWA8_GRVWB4_GSU0_GSUAMB_GSUC0_GSUWGMRR0_GLS0_ISA942_IU1_K1_LBSPPA256_LBSPPB512_LBSPPM0_LPA8_LPB32_LPM0_LRVW8_LWPMn1_MIAV0_MIWT4_2_MO40_NTn1_NTA0_NTB0_NTC0_NTD0_NTM0_NEPBS0_NLCA1_NLCB1_ONLL1_PGR2_PLR1_PKA1_SIA3_SS1_SU0_SUM0_SUS64_SPO0_SRVW0_SSO0_SVW4_SK3_SKXCCM8_TLDS1_ULSGRO0_USL1_UIOFGRO0_USFGRO0_VSn1_VWA4_VWB2_WSGRA0_WSGRB0_WS64_WG32_8_1_WGM1_WGMXCC1_WGMXCCGn1
    SolutionIndex: 31
    SolutionNameMin: Cijk_Alik_Bjlk_I8_BH_UserArgs_MT128x64x64_MI16x16x1_SN_LDSB0_AFC0_AFEM1_AFEM1_ASEM1_CLR1_CADS0_DTVA0_DTVB0_EPS0_FDSI0_GRPM1_GRVWA4_GRVWB8_GSU0_GSUAMB_GSUC0_GSUWGMRR0_GLS0_ISA942_IU1_K1_LBSPPA256_LBSPPB512_LBSPPM0_LPA8_LPB32_LPM0_LRVW8_LWPMn1_MIAV0_MIWT4_2_MO40_NTn1_NTA0_NTB0_NTC0_NTD0_NTM0_NEPBS0_NLCA1_NLCB1_ONLL1_PGR2_PLR1_PKA1_SIA3_SS1_SU0_SUM0_SUS64_SPO0_SRVW0_SSO0_SVW4_SK3_SKXCCM8_TLDS1_ULSGRO0_USL1_UIOFGRO0_USFGRO0_VSn1_VWA4_VWB2_WSGRA0_WSGRB0_WS64_WG32_8_1_WGM1_WGMXCC1_WGMXCCGn1
    SolutionIndex: 32
    SolutionNameMin: Cijk_Alik_Bjlk_I8_BH_UserArgs_MT128x64x64_MI16x16x1_SN_LDSB0_AFC0_AFEM1_AFEM1_ASEM1_CLR1_CADS0_DTVA0_DTVB0_EPS0_FDSI0_GRPM1_GRVWA8_GRVWB8_GSU0_GSUAMB_GSUC0_GSUWGMRR0_GLS0_ISA942_IU1_K1_LBSPPA256_LBSPPB512_LBSPPM0_LPA8_LPB32_LPM0_LRVW8_LWPMn1_MIAV0_MIWT4_2_MO40_NTn1_NTA0_NTB0_NTC0_NTD0_NTM0_NEPBS0_NLCA1_NLCB1_ONLL1_PGR2_PLR1_PKA1_SIA3_SS1_SU0_SUM0_SUS64_SPO0_SRVW0_SSO0_SVW4_SK3_SKXCCM8_TLDS1_ULSGRO0_USL1_UIOFGRO0_USFGRO0_VSn1_VWA4_VWB2_WSGRA0_WSGRB0_WS64_WG32_8_1_WGM1_WGMXCC1_WGMXCCGn1
    SolutionIndex: 33
    SolutionNameMin: Cijk_Alik_Bjlk_I8_BH_UserArgs_MT128x32x64_MI16x16x1_SN_LDSB0_AFC0_AFEM1_AFEM1_ASEM1_CLR0_CADS0_DTVA0_DTVB0_EPS0_FDSI0_GRPM1_GRVWA4_GRVWB4_GSU0_GSUAMB_GSUC0_GSUWGMRR0_GLS0_ISA942_IU1_K1_LBSPPA256_LBSPPB256_LBSPPM0_LPA8_LPB16_LPM0_LRVW8_LWPMn1_MIAV0_MIWT4_1_MO40_NTn1_NTA0_NTB0_NTC0_NTD0_NTM0_NEPBS0_NLCA1_NLCB1_ONLL1_PGR2_PLR0_PKA1_SIA3_SS1_SU0_SUM0_SUS64_SPO0_SRVW0_SSO0_SVW4_SK3_SKXCCM8_TLDS1_ULSGRO0_USL1_UIOFGRO0_USFGRO0_VSn1_VWA4_VWB1_WSGRA0_WSGRB0_WS64_WG32_8_1_WGM1_WGMXCC1_WGMXCCGn1
    SolutionIndex: 34
    SolutionNameMin: Cijk_Alik_Bjlk_I8_BH_UserArgs_MT128x32x64_MI16x16x1_SN_LDSB0_AFC0_AFEM1_AFEM1_ASEM1_CLR0_CADS0_DTVA0_DTVB0_EPS0_FDSI0_GRPM1_GRVWA8_GRVWB4_GSU0_GSUAMB_GSUC0_GSUWGMRR0_GLS0_ISA942_IU1_K1_LBSPPA256_LBSPPB256_LBSPPM0_LPA8_LPB16_LPM0_LRVW8_LWPMn1_MIAV0_MIWT4_1_MO40_NTn1_NTA0_NTB0_NTC0_NTD0_NTM0_NEPBS0_NLCA1_NLCB1_ONLL1_PGR2_PLR0_PKA1_SIA3_SS1_SU0_SUM0_SUS64_SPO0_SRVW0_SSO0_SVW4_SK3_SKXCCM8_TLDS1_ULSGRO0_USL1_UIOFGRO0_USFGRO0_VSn1_VWA4_VWB1_WSGRA0_WSGRB0_WS64_WG32_8_1_WGM1_WGMXCC1_WGMXCCGn1
    SolutionIndex: 35
    SolutionNameMin: Cijk_Alik_Bjlk_I8_BH_UserArgs_MT64x64x64_MI16x16x1_SN_LDSB0_AFC0_AFEM1_AFEM1_ASEM1_CLR1_CADS0_DTVA0_DTVB0_EPS0_FDSI0_GRPM1_GRVWA4_GRVWB4_GSU0_GSUAMB_GSUC0_GSUWGMRR0_GLS0_ISA942_IU1_K1_LBSPPA128_LBSPPB512_LBSPPM0_LPA8_LPB32_LPM0_LRVW8_LWPMn1_MIAV0_MIWT2_2_MO40_NTn1_NTA0_NTB0_NTC0_NTD0_NTM0_NEPBS0_NLCA1_NLCB1_ONLL1_PGR2_PLR1_PKA1_SIA3_SS1_SU0_SUM0_SUS64_SPO0_SRVW0_SSO0_SVW2_SK3_SKXCCM8_TLDS1_ULSGRO0_USL1_UIOFGRO0_USFGRO0_VSn1_VWA2_VWB2_WSGRA0_WSGRB0_WS64_WG32_8_1_WGM1_WGMXCC1_WGMXCCGn1
    SolutionIndex: 36
    SolutionNameMin: Cijk_Alik_Bjlk_I8_BH_UserArgs_MT64x64x64_MI16x16x1_SN_LDSB0_AFC0_AFEM1_AFEM1_ASEM1_CLR1_CADS0_DTVA0_DTVB0_EPS0_FDSI0_GRPM1_GRVWA8_GRVWB8_GSU0_GSUAMB_GSUC0_GSUWGMRR0_GLS0_ISA942_IU1_K1_LBSPPA128_LBSPPB512_LBSPPM0_LPA8_LPB32_LPM0_LRVW8_LWPMn1_MIAV0_MIWT2_2_MO40_NTn1_NTA0_NTB0_NTC0_NTD0_NTM0_NEPBS0_NLCA1_NLCB1_ONLL1_PGR2_PLR1_PKA1_SIA3_SS1_SU0_SUM0_SUS64_SPO0_SRVW0_SSO0_SVW2_SK3_SKXCCM8_TLDS1_ULSGRO0_USL1_UIOFGRO0_USFGRO0_VSn1_VWA2_VWB2_WSGRA0_WSGRB0_WS64_WG32_8_1_WGM1_WGMXCC1_WGMXCCGn1
    SolutionIndex: 37
    SolutionNameMin: Cijk_Alik_Bjlk_I8_BH_UserArgs_MT64x32x64_MI16x16x1_SN_LDSB0_AFC0_AFEM1_AFEM1_ASEM1_CLR1_CADS0_DTVA0_DTVB0_EPS0_FDSI0_GRPM1_GRVWA8_GRVWB4_GSU0_GSUAMB_GSUC0_GSUWGMRR0_GLS0_ISA942_IU1_K1_LBSPPA128_LBSPPB256_LBSPPM0_LPA8_LPB16_LPM0_LRVW8_LWPMn1_MIAV0_MIWT2_1_MO40_NTn1_NTA0_NTB0_NTC0_NTD0_NTM0_NEPBS0_NLCA1_NLCB1_ONLL1_PGR2_PLR1_PKA1_SIA3_SS1_SU0_SUM0_SUS64_SPO0_SRVW0_SSO0_SVW2_SK3_SKXCCM8_TLDS1_ULSGRO0_USL1_UIOFGRO0_USFGRO0_VSn1_VWA2_VWB1_WSGRA0_WSGRB0_WS64_WG32_8_1_WGM1_WGMXCC1_WGMXCCGn1
    SolutionIndex: 38
    SolutionNameMin: Cijk_Alik_Bjlk_I8_BH_UserArgs_MT64x32x64_MI16x16x1_SN_LDSB0_AFC0_AFEM1_AFEM1_ASEM1_CLR1_CADS0_DTVA0_DTVB0_EPS0_FDSI0_GRPM1_GRVWA8_GRVWB8_GSU0_GSUAMB_GSUC0_GSUWGMRR0_GLS0_ISA942_IU1_K1_LBSPPA128_LBSPPB256_LBSPPM0_LPA8_LPB16_LPM0_LRVW8_LWPMn1_MIAV0_MIWT2_1_MO40_NTn1_NTA0_NTB0_NTC0_NTD0_NTM0_NEPBS0_NLCA1_NLCB1_ONLL1_PGR2_PLR1_PKA1_SIA3_SS1_SU0_SUM0_SUS64_SPO0_SRVW0_SSO0_SVW1_SK3_SKXCCM8_TLDS1_ULSGRO0_USL1_UIOFGRO0_USFGRO0_VSn1_VWA1_VWB1_WSGRA0_WSGRB0_WS64_WG32_8_1_WGM1_WGMXCC1_WGMXCCGn1
    SolutionIndex: 39
    SolutionNameMin: Cijk_Alik_Bjlk_I8_BH_UserArgs_MT32x32x64_MI16x16x1_SN_LDSB0_AFC0_AFEM1_AFEM1_ASEM1_CLR1_CADS0_DTVA0_DTVB0_EPS0_FDSI0_GRPM1_GRVWA4_GRVWB4_GSU0_GSUAMB_GSUC0_GSUWGMRR0_GLS0_ISA942_IU1_K1_LBSPPA128_LBSPPB256_LBSPPM0_LPA8_LPB16_LPM0_LRVW8_LWPMn1_MIAV0_MIWT1_1_MO40_NTn1_NTA0_NTB0_NTC0_NTD0_NTM0_NEPBS0_NLCA1_NLCB1_ONLL1_PGR2_PLR1_PKA1_SIA3_SS1_SU0_SUM0_SUS64_SPO0_SRVW0_SSO0_SVW1_SK3_SKXCCM8_TLDS1_ULSGRO0_USL1_UIOFGRO0_USFGRO0_VSn1_VWA1_VWB1_WSGRA0_WSGRB0_WS64_WG32_8_1_WGM1_WGMXCC1_WGMXCCGn1
    SolutionIndex: 40
    SolutionNameMin: Cijk_Alik_Bjlk_I8_BH_UserArgs_MT32x32x64_MI16x16x1_SN_LDSB0_AFC0_AFEM1_AFEM1_ASEM1_CLR0_CADS0_DTVA0_DTVB0_EPS0_FDSI0_GRPM1_GRVWA8_GRVWB4_GSU0_GSUAMB_GSUC0_GSUWGMRR0_GLS0_ISA942_IU1_K1_LBSPPA128_LBSPPB256_LBSPPM0_LPA8_LPB16_LPM0_LRVW8_LWPMn1_MIAV0_MIWT1_1_MO40_NTn1_NTA0_NTB0_NTC0_NTD0_NTM0_NEPBS0_NLCA1_NLCB1_ONLL1_PGR2_PLR0_PKA1_SIA3_SS1_SU0_SUM0_SUS64_SPO0_SRVW0_SSO0_SVW1_SK3_SKXCCM8_TLDS1_ULSGRO0_USL1_UIOFGRO0_USFGRO0_VSn1_VWA1_VWB1_WSGRA0_WSGRB0_WS64_WG32_8_1_WGM1_WGMXCC1_WGMXCCGn1
    SolutionIndex: 41
    SolutionNameMin: Cijk_Alik_Bjlk_I8_BH_UserArgs_MT256x128x128_MI16x16x1_SN_LDSB1_AFC0_AFEM1_AFEM1_ASEM1_CLR1_CADS0_DTVA0_DTVB0_EPS0_FDSI0_GRPM1_GRVWA4_GRVWB4_GSU0_GSUAMB_GSUC0_GSUWGMRR0_GLS0_ISA942_IU1_K1_LBSPPA512_LBSPPB2048_LBSPPM0_LPA32_LPB64_LPM0_LRVW16_LWPMn1_MIAV0_MIWT8_4_MO40_NTn1_NTA0_NTB0_NTC0_NTD0_NTM0_NEPBS0_NLCA1_NLCB1_ONLL1_PGR2_PLR1_PKA1_SIA3_SS1_SU0_SUM0_SUS128_SPO0_SRVW0_SSO0_SVW4_SK3_SKXCCM8_TLDS1_ULSGRO0_USL1_UIOFGRO0_USFGRO0_VSn1_VWA4_VWB4_WSGRA0_WSGRB0_WS64_WG32_8_1_WGM1_WGMXCC1_WGMXCCGn1
    SolutionIndex: 42
    SolutionNameMin: Cijk_Alik_Bjlk_I8_BH_UserArgs_MT256x128x128_MI16x16x1_SN_LDSB1_AFC0_AFEM1_AFEM1_ASEM1_CLR1_CADS0_DTVA0_DTVB0_EPS0_FDSI0_GRPM1_GRVWA4_GRVWB4_GSU0_GSUAMB_GSUC0_GSUWGMRR0_GLS0_ISA942_IU1_K1_LBSPPA1024_LBSPPB2048_LBSPPM0_LPA32_LPB64_LPM0_LRVW16_LWPMn1_MIAV0_MIWT8_4_MO40_NTn1_NTA0_NTB0_NTC0_NTD0_NTM0_NEPBS0_NLCA1_NLCB1_ONLL1_PGR2_PLR1_PKA1_SIA3_SS1_SU0_SUM0_SUS128_SPO0_SRVW0_SSO0_SVW8_SK3_SKXCCM8_TLDS1_ULSGRO0_USL1_UIOFGRO0_USFGRO0_VSn1_VWA8_VWB4_WSGRA0_WSGRB0_WS64_WG32_8_1_WGM1_WGMXCC1_WGMXCCGn1
    SolutionIndex: 43
    SolutionNameMin: Cijk_Alik_Bjlk_I8_BH_UserArgs_MT128x128x128_MI16x16x1_SN_LDSB1_AFC0_AFEM1_AFEM1_ASEM1_CLR1_CADS0_DTVA0_DTVB0_EPS0_FDSI0_GRPM1_GRVWA4_GRVWB4_GSU0_GSUAMB_GSUC0_GSUWGMRR0_GLS0_ISA942_IU1_K1_LBSPPA512_LBSPPB2048_LBSPPM0_LPA32_LPB64_LPM0_LRVW16_LWPMn1_MIAV0_MIWT4_4_MO40_NTn1_NTA0_NTB0_NTC0_NTD0_NTM0_NEPBS0_NLCA1_NLCB1_ONLL1_PGR2_PLR1_PKA1_SIA3_SS1_SU0_SUM0_SUS128_SPO0_SRVW0_SSO0_SVW4_SK3_SKXCCM8_TLDS1_ULSGRO0_USL1_UIOFGRO0_USFGRO0_VSn1_VWA4_VWB4_WSGRA0_WSGRB0_WS64_WG32_8_1_WGM1_WGMXCC1_WGMXCCGn1
    SolutionIndex: 44
    SolutionNameMin: Cijk_Alik_Bjlk_I8_BH_UserArgs_MT128x128x128_MI16x16x1_SN_LDSB1_AFC0_AFEM1_AFEM1_ASEM1_CLR1_CADS0_DTVA0_DTVB0_EPS0_FDSI0_GRPM1_GRVWA4_GRVWB8_GSU0_GSUAMB_GSUC0_GSUWGMRR0_GLS0_ISA942_IU1_K1_LBSPPA512_LBSPPB2048_LBSPPM0_LPA32_LPB64_LPM0_LRVW16_LWPMn1_MIAV0_MIWT4_4_MO40_NTn1_NTA0_NTB0_NTC0_NTD0_NTM0_NEPBS0_NLCA1_NLCB1_ONLL1_PGR2_PLR1_PKA1_SIA3_SS1_SU0_SUM0_SUS128_SPO0_SRVW0_SSO0_SVW4_SK3_SKXCCM8_TLDS1_ULSGRO0_USL1_UIOFGRO0_USFGRO0_VSn1_VWA4_VWB4_WSGRA0_WSGRB0_WS64_WG32_8_1_WGM1_WGMXCC1_WGMXCCGn1
    SolutionIndex: 45
    SolutionNameMin: Cijk_Alik_Bjlk_I8_BH_UserArgs_MT128x64x128_MI16x16x1_SN_LDSB1_AFC0_AFEM1_AFEM1_ASEM1_CLR1_CADS0_DTVA0_DTVB0_EPS0_FDSI0_GRPM1_GRVWA4_GRVWB8_GSU0_GSUAMB_GSUC0_GSUWGMRR0_GLS0_ISA942_IU1_K1_LBSPPA512_LBSPPB1024_LBSPPM0_LPA32_LPB32_LPM0_LRVW16_LWPMn1_MIAV0_MIWT4_2_MO40_NTn1_NTA0_NTB0_NTC0_NTD0_NTM0_NEPBS0_NLCA1_NLCB1_ONLL1_PGR2_PLR1_PKA1_SIA3_SS1_SU0_SUM0_SUS128_SPO0_SRVW0_SSO0_SVW4_SK3_SKXCCM8_TLDS1_ULSGRO0_USL1_UIOFGRO0_USFGRO0_VSn1_VWA4_VWB2_WSGRA0_WSGRB0_WS64_WG32_8_1_WGM1_WGMXCC1_WGMXCCGn1
    SolutionIndex: 46
    SolutionNameMin: Cijk_Alik_Bjlk_I8_BH_UserArgs_MT64x64x128_MI16x16x1_SN_LDSB1_AFC0_AFEM1_AFEM1_ASEM1_CLR1_CADS0_DTVA0_DTVB0_EPS0_FDSI0_GRPM1_GRVWA4_GRVWB4_GSU0_GSUAMB_GSUC0_GSUWGMRR0_GLS0_ISA942_IU1_K1_LBSPPA256_LBSPPB1024_LBSPPM0_LPA32_LPB32_LPM0_LRVW16_LWPMn1_MIAV0_MIWT2_2_MO40_NTn1_NTA0_NTB0_NTC0_NTD0_NTM0_NEPBS0_NLCA1_NLCB1_ONLL1_PGR2_PLR1_PKA1_SIA3_SS1_SU0_SUM0_SUS128_SPO0_SRVW0_SSO0_SVW2_SK3_SKXCCM8_TLDS1_ULSGRO0_USL1_UIOFGRO0_USFGRO0_VSn1_VWA2_VWB2_WSGRA0_WSGRB0_WS64_WG32_8_1_WGM1_WGMXCC1_WGMXCCGn1
    SolutionIndex: 47
    SolutionNameMin: Cijk_Alik_Bjlk_I8_BH_UserArgs_MT64x64x128_MI16x16x1_SN_LDSB1_AFC0_AFEM1_AFEM1_ASEM1_CLR1_CADS0_DTVA0_DTVB0_EPS0_FDSI0_GRPM1_GRVWA4_GRVWB8_GSU0_GSUAMB_GSUC0_GSUWGMRR0_GLS0_ISA942_IU1_K1_LBSPPA256_LBSPPB1024_LBSPPM0_LPA32_LPB32_LPM0_LRVW16_LWPMn1_MIAV0_MIWT2_2_MO40_NTn1_NTA0_NTB0_NTC0_NTD0_NTM0_NEPBS0_NLCA1_NLCB1_ONLL1_PGR2_PLR1_PKA1_SIA3_SS1_SU0_SUM0_SUS128_SPO0_SRVW0_SSO0_SVW2_SK3_SKXCCM8_TLDS1_ULSGRO0_USL1_UIOFGRO0_USFGRO0_VSn1_VWA2_VWB2_WSGRA0_WSGRB0_WS64_WG32_8_1_WGM1_WGMXCC1_WGMXCCGn1
    SolutionIndex: 48
    SolutionNameMin: Cijk_Alik_Bjlk_I8_BH_UserArgs_MT32x64x128_MI16x16x1_SN_LDSB0_AFC0_AFEM1_AFEM1_ASEM1_CLR1_CADS0_DTVA0_DTVB0_EPS0_FDSI0_GRPM1_GRVWA4_GRVWB4_GSU0_GSUAMB_GSUC0_GSUWGMRR0_GLS0_ISA942_IU1_K1_LBSPPA128_LBSPPB1024_LBSPPM0_LPA32_LPB32_LPM0_LRVW16_LWPMn1_MIAV0_MIWT1_2_MO40_NTn1_NTA0_NTB0_NTC0_NTD0_NTM0_NEPBS0_NLCA1_NLCB1_ONLL1_PGR2_PLR1_PKA1_SIA3_SS1_SU0_SUM0_SUS128_SPO0_SRVW0_SSO0_SVW1_SK3_SKXCCM8_TLDS1_ULSGRO0_USL1_UIOFGRO0_USFGRO0_VSn1_VWA1_VWB2_WSGRA0_WSGRB0_WS64_WG32_8_1_WGM1_WGMXCC1_WGMXCCGn1
    SolutionIndex: 49
    SolutionNameMin: Cijk_Alik_Bjlk_I8_BH_UserArgs_MT64x32x128_MI16x16x1_SN_LDSB0_AFC0_AFEM1_AFEM1_ASEM1_CLR1_CADS0_DTVA0_DTVB0_EPS0_FDSI0_GRPM1_GRVWA4_GRVWB8_GSU0_GSUAMB_GSUC0_GSUWGMRR0_GLS0_ISA942_IU1_K1_LBSPPA256_LBSPPB512_LBSPPM0_LPA32_LPB16_LPM0_LRVW16_LWPMn1_MIAV0_MIWT2_1_MO40_NTn1_NTA0_NTB0_NTC0_NTD0_NTM0_NEPBS0_NLCA1_NLCB1_ONLL1_PGR2_PLR1_PKA1_SIA3_SS1_SU0_SUM0_SUS128_SPO0_SRVW0_SSO0_SVW2_SK3_SKXCCM8_TLDS1_ULSGRO0_USL1_UIOFGRO0_USFGRO0_VSn1_VWA2_VWB1_WSGRA0_WSGRB0_WS64_WG32_8_1_WGM1_WGMXCC1_WGMXCCGn1
    SolutionIndex: 50
    SolutionNameMin: Cijk_Alik_Bjlk_I8_BH_UserArgs_MT64x32x128_MI16x16x1_SN_LDSB0_AFC0_AFEM1_AFEM1_ASEM1_CLR1_CADS0_DTVA0_DTVB0_EPS0_FDSI0_GRPM1_GRVWA8_GRVWB8_GSU0_GSUAMB_GSUC0_GSUWGMRR0_GLS0_ISA942_IU1_K1_LBSPPA128_LBSPPB512_LBSPPM0_LPA32_LPB16_LPM0_LRVW16_LWPMn1_MIAV0_MIWT2_1_MO40_NTn1_NTA0_NTB0_NTC0_NTD0_NTM0_NEPBS0_NLCA1_NLCB1_ONLL1_PGR2_PLR1_PKA1_SIA3_SS1_SU0_SUM0_SUS128_SPO0_SRVW0_SSO0_SVW1_SK3_SKXCCM8_TLDS1_ULSGRO0_USL1_UIOFGRO0_USFGRO0_VSn1_VWA1_VWB1_WSGRA0_WSGRB0_WS64_WG32_8_1_WGM1_WGMXCC1_WGMXCCGn1
    SolutionIndex: 51
    SolutionNameMin: Cijk_Alik_Bjlk_I8_BH_UserArgs_MT32x32x128_MI16x16x1_SN_LDSB0_AFC0_AFEM1_AFEM1_ASEM1_CLR1_CADS0_DTVA0_DTVB0_EPS0_FDSI0_GRPM1_GRVWA4_GRVWB8_GSU0_GSUAMB_GSUC0_GSUWGMRR0_GLS0_ISA942_IU1_K1_LBSPPA128_LBSPPB512_LBSPPM0_LPA32_LPB16_LPM0_LRVW16_LWPMn1_MIAV0_MIWT1_1_MO40_NTn1_NTA0_NTB0_NTC0_NTD0_NTM0_NEPBS0_NLCA1_NLCB1_ONLL1_PGR2_PLR1_PKA1_SIA3_SS1_SU0_SUM0_SUS128_SPO0_SRVW0_SSO0_SVW1_SK3_SKXCCM8_TLDS1_ULSGRO0_USL1_UIOFGRO0_USFGRO0_VSn1_VWA1_VWB1_WSGRA0_WSGRB0_WS64_WG32_8_1_WGM1_WGMXCC1_WGMXCCGn1
    SolutionIndex: 52
    SolutionNameMin: Cijk_Alik_Bjlk_I8_BH_UserArgs_MT32x32x128_MI16x16x1_SN_LDSB0_AFC0_AFEM1_AFEM1_ASEM1_CLR1_CADS0_DTVA0_DTVB0_EPS0_FDSI0_GRPM1_GRVWA8_GRVWB8_GSU0_GSUAMB_GSUC0_GSUWGMRR0_GLS0_ISA942_IU1_K1_LBSPPA128_LBSPPB512_LBSPPM0_LPA32_LPB16_LPM0_LRVW16_LWPMn1_MIAV0_MIWT1_1_MO40_NTn1_NTA0_NTB0_NTC0_NTD0_NTM0_NEPBS0_NLCA1_NLCB1_ONLL1_PGR2_PLR1_PKA1_SIA3_SS1_SU0_SUM0_SUS128_SPO0_SRVW0_SSO0_SVW1_SK3_SKXCCM8_TLDS1_ULSGRO0_USL1_UIOFGRO0_USFGRO0_VSn1_VWA1_VWB1_WSGRA0_WSGRB0_WS64_WG32_8_1_WGM1_WGMXCC1_WGMXCCGn1
    SolutionIndex: 53
    SolutionNameMin: Cijk_Alik_Bjlk_I8_BH_UserArgs_MT128x64x256_MI16x16x1_SN_LDSB1_AFC0_AFEM1_AFEM1_ASEM1_CLR1_CADS0_DTVA0_DTVB0_EPS0_FDSI0_GRPM1_GRVWA4_GRVWB4_GSU0_GSUAMB_GSUC0_GSUWGMRR0_GLS0_ISA942_IU1_K1_LBSPPA512_LBSPPB1024_LBSPPM0_LPA32_LPB32_LPM0_LRVW16_LWPMn1_MIAV0_MIWT4_2_MO40_NTn1_NTA0_NTB0_NTC0_NTD0_NTM0_NEPBS0_NLCA1_NLCB1_ONLL1_PGR2_PLR2_PKA1_SIA3_SS1_SU0_SUM0_SUS256_SPO0_SRVW0_SSO0_SVW2_SK3_SKXCCM8_TLDS1_ULSGRO0_USL1_UIOFGRO0_USFGRO0_VSn1_VWA2_VWB2_WSGRA0_WSGRB0_WS64_WG32_8_1_WGM1_WGMXCC1_WGMXCCGn1
    SolutionIndex: 54
    SolutionNameMin: Cijk_Alik_Bjlk_I8_BH_UserArgs_MT128x64x256_MI16x16x1_SN_LDSB1_AFC0_AFEM1_AFEM1_ASEM1_CLR1_CADS0_DTVA0_DTVB0_EPS0_FDSI0_GRPM1_GRVWA4_GRVWB4_GSU0_GSUAMB_GSUC0_GSUWGMRR0_GLS0_ISA942_IU1_K1_LBSPPA1024_LBSPPB1024_LBSPPM0_LPA32_LPB32_LPM0_LRVW16_LWPMn1_MIAV0_MIWT4_2_MO40_NTn1_NTA0_NTB0_NTC0_NTD0_NTM0_NEPBS0_NLCA1_NLCB1_ONLL1_PGR2_PLR2_PKA1_SIA3_SS1_SU0_SUM0_SUS256_SPO0_SRVW0_SSO0_SVW4_SK3_SKXCCM8_TLDS1_ULSGRO0_USL1_UIOFGRO0_USFGRO0_VSn1_VWA4_VWB2_WSGRA0_WSGRB0_WS64_WG32_8_1_WGM1_WGMXCC1_WGMXCCGn1
    SolutionIndex: 55
    SolutionNameMin: Cijk_Alik_Bjlk_I8_BH_UserArgs_MT64x64x256_MI16x16x1_SN_LDSB1_AFC0_AFEM1_AFEM1_ASEM1_CLR1_CADS0_DTVA0_DTVB0_EPS0_FDSI0_GRPM1_GRVWA4_GRVWB4_GSU0_GSUAMB_GSUC0_GSUWGMRR0_GLS0_ISA942_IU1_K1_LBSPPA512_LBSPPB1024_LBSPPM0_LPA32_LPB32_LPM0_LRVW16_LWPMn1_MIAV0_MIWT2_2_MO40_NTn1_NTA0_NTB0_NTC0_NTD0_NTM0_NEPBS0_NLCA1_NLCB1_ONLL1_PGR2_PLR2_PKA1_SIA3_SS1_SU0_SUM0_SUS256_SPO0_SRVW0_SSO0_SVW2_SK3_SKXCCM8_TLDS1_ULSGRO0_USL1_UIOFGRO0_USFGRO0_VSn1_VWA2_VWB2_WSGRA0_WSGRB0_WS64_WG32_8_1_WGM1_WGMXCC1_WGMXCCGn1
    SolutionIndex: 56
    SolutionNameMin: Cijk_Alik_Bjlk_I8_BH_UserArgs_MT64x32x256_MI16x16x1_SN_LDSB1_AFC0_AFEM1_AFEM1_ASEM1_CLR1_CADS0_DTVA0_DTVB0_EPS0_FDSI0_GRPM1_GRVWA4_GRVWB8_GSU0_GSUAMB_GSUC0_GSUWGMRR0_GLS0_ISA942_IU1_K1_LBSPPA256_LBSPPB512_LBSPPM0_LPA32_LPB16_LPM0_LRVW16_LWPMn1_MIAV0_MIWT2_1_MO40_NTn1_NTA0_NTB0_NTC0_NTD0_NTM0_NEPBS0_NLCA1_NLCB1_ONLL1_PGR2_PLR2_PKA1_SIA3_SS1_SU0_SUM0_SUS256_SPO0_SRVW0_SSO0_SVW1_SK3_SKXCCM8_TLDS1_ULSGRO0_USL1_UIOFGRO0_USFGRO0_VSn1_VWA1_VWB1_WSGRA0_WSGRB0_WS64_WG32_8_1_WGM1_WGMXCC1_WGMXCCGn1
    SolutionIndex: 57
    SolutionNameMin: Cijk_Alik_Bjlk_I8_BH_UserArgs_MT64x32x256_MI16x16x1_SN_LDSB1_AFC0_AFEM1_AFEM1_ASEM1_CLR1_CADS0_DTVA0_DTVB0_EPS0_FDSI0_GRPM1_GRVWA4_GRVWB8_GSU0_GSUAMB_GSUC0_GSUWGMRR0_GLS0_ISA942_IU1_K1_LBSPPA512_LBSPPB512_LBSPPM0_LPA32_LPB16_LPM0_LRVW16_LWPMn1_MIAV0_MIWT2_1_MO40_NTn1_NTA0_NTB0_NTC0_NTD0_NTM0_NEPBS0_NLCA1_NLCB1_ONLL1_PGR2_PLR2_PKA1_SIA3_SS1_SU0_SUM0_SUS256_SPO0_SRVW0_SSO0_SVW2_SK3_SKXCCM8_TLDS1_ULSGRO0_USL1_UIOFGRO0_USFGRO0_VSn1_VWA2_VWB1_WSGRA0_WSGRB0_WS64_WG32_8_1_WGM1_WGMXCC1_WGMXCCGn1
    SolutionIndex: 58
    SolutionNameMin: Cijk_Alik_Bjlk_I8_BH_UserArgs_MT32x32x256_MI16x16x1_SN_LDSB1_AFC0_AFEM1_AFEM1_ASEM1_CLR1_CADS0_DTVA0_DTVB0_EPS0_FDSI0_GRPM1_GRVWA4_GRVWB8_GSU0_GSUAMB_GSUC0_GSUWGMRR0_GLS0_ISA942_IU1_K1_LBSPPA256_LBSPPB512_LBSPPM0_LPA32_LPB16_LPM0_LRVW16_LWPMn1_MIAV0_MIWT1_1_MO40_NTn1_NTA0_NTB0_NTC0_NTD0_NTM0_NEPBS0_NLCA1_NLCB1_ONLL1_PGR2_PLR2_PKA1_SIA3_SS1_SU0_SUM0_SUS256_SPO0_SRVW0_SSO0_SVW1_SK3_SKXCCM8_TLDS1_ULSGRO0_USL1_UIOFGRO0_USFGRO0_VSn1_VWA1_VWB1_WSGRA0_WSGRB0_WS64_WG32_8_1_WGM1_WGMXCC1_WGMXCCGn1
    SolutionIndex: 59
    SolutionNameMin: Cijk_Alik_Bjlk_I8_BH_UserArgs_MT32x32x32_MI16x16x1_SN_LDSB0_AFC0_AFEM1_AFEM1_ASEM1_CLR0_CADS0_DTVA0_DTVB0_EPS0_FDSI0_GRPM1_GRVWA1_GRVWB1_GSU0_GSUAMB_GSUC0_GSUWGMRR0_GLS0_ISA942_IU1_K1_LBSPPA128_LBSPPB256_LBSPPM0_LPA8_LPB16_LPM0_LRVW8_LWPMn1_MIAV0_MIWT1_1_MO40_NTn1_NTA0_NTB0_NTC0_NTD0_NTM0_NEPBS0_NLCA1_NLCB1_ONLL1_PGR2_PLR0_PKA1_SIA3_SS1_SU32_SUM0_SUS256_SPO0_SRVW0_SSO0_SVW1_SK3_SKXCCM0_TLDS1_ULSGRO0_USL1_UIOFGRO0_USFGROn1_VSn1_VWA1_VWB1_WSGRA0_WSGRB0_WS64_WG32_8_1_WGM8_WGMXCC1_WGMXCCGn1
- - - [128, 128, 1, 128, 128, 128, 128, 128]
    - [40, 0.73]
  - - [128, 128, 1, 256, 128, 128, 256, 128]
    - [39, 1.31]
  - - [128, 128, 1, 512, 128, 128, 512, 128]
    - [51, 2.08]
  - - [128, 128, 1, 1024, 128, 128, 1024, 128]
    - [52, 3.08]
  - - [128, 128, 1, 2048, 128, 128, 2048, 128]
    - [52, 4.1]
  - - [128, 128, 1, 4096, 128, 128, 4096, 128]
    - [58, 4.9]
  - - [128, 128, 1, 8192, 128, 128, 8192, 128]
    - [58, 5.44]
  - - [128, 256, 1, 128, 128, 128, 128, 256]
    - [37, 1.39]
  - - [128, 256, 1, 256, 128, 128, 256, 256]
    - [37, 2.36]
  - - [128, 256, 1, 512, 128, 128, 512, 256]
    - [49, 3.82]
  - - [128, 256, 1, 1024, 128, 128, 1024, 256]
    - [49, 5.52]
  - - [128, 256, 1, 2048, 128, 128, 2048, 256]
    - [56, 7.44]
  - - [128, 256, 1, 4096, 128, 128, 4096, 256]
    - [56, 9.03]
  - - [128, 256, 1, 8192, 128, 128, 8192, 256]
    - [56, 10.08]
  - - [128, 512, 1, 128, 128, 128, 128, 512]
    - [35, 2.51]
  - - [128, 512, 1, 256, 128, 128, 256, 512]
    - [46, 4.18]
  - - [128, 512, 1, 512, 128, 128, 512, 512]
    - [46, 6.58]
  - - [128, 512, 1, 1024, 128, 128, 1024, 512]
    - [47, 9.35]
  - - [128, 512, 1, 2048, 128, 128, 2048, 512]
    - [55, 12.08]
  - - [128, 512, 1, 4096, 128, 128, 4096, 512]
    - [55, 14.57]
  - - [128, 512, 1, 8192, 128, 128, 8192, 512]
    - [55, 15.34]
  - - [128, 1024, 1, 128, 128, 128, 128, 1024]
    - [8, 4.21]
  - - [128, 1024, 1, 256, 128, 128, 256, 1024]
    - [29, 7.13]
  - - [128, 1024, 1, 512, 128, 128, 512, 1024]
    - [29, 10.73]
  - - [128, 1024, 1, 1024, 128, 128, 1024, 1024]
    - [29, 14.59]
  - - [128, 1024, 1, 2048, 128, 128, 2048, 1024]
    - [54, 18.31]
  - - [128, 1024, 1, 4096, 128, 128, 4096, 1024]
    - [54, 20.34]
  - - [128, 1024, 1, 8192, 128, 128, 8192, 1024]
    - [54, 22.89]
  - - [128, 2048, 1, 128, 128, 128, 128, 2048]
    - [7, 6.41]
  - - [128, 2048, 1, 256, 128, 128, 256, 2048]
    - [27, 10.53]
  - - [128, 2048, 1, 512, 128, 128, 512, 2048]
    - [44, 15.49]
  - - [128, 2048, 1, 1024, 128, 128, 1024, 2048]
    - [43, 21.02]
  - - [128, 2048, 1, 2048, 128, 128, 2048, 2048]
    - [43, 26.03]
  - - [128, 2048, 1, 4096, 128, 128, 4096, 2048]
    - [43, 29.53]
  - - [128, 2048, 1, 8192, 128, 128, 8192, 2048]
    - [43, 31.65]
  - - [128, 4096, 1, 128, 128, 128, 128, 4096]
    - [16, 8.48]
  - - [128, 4096, 1, 256, 128, 128, 256, 4096]
    - [17, 13.93]
  - - [128, 4096, 1, 512, 128, 128, 512, 4096]
    - [19, 20.83]
  - - [128, 4096, 1, 1024, 128, 128, 1024, 4096]
    - [19, 27.89]
  - - [128, 4096, 1, 2048, 128, 128, 2048, 4096]
    - [19, 33.17]
  - - [128, 4096, 1, 4096, 128, 128, 4096, 4096]
    - [19, 36.76]
  - - [128, 4096, 1, 8192, 128, 128, 8192, 4096]
    - [19, 39.64]
  - - [128, 8192, 1, 128, 128, 128, 128, 8192]
    - [4, 9.1]
  - - [128, 8192, 1, 256, 128, 128, 256, 8192]
    - [19, 14.63]
  - - [128, 8192, 1, 512, 128, 128, 512, 8192]
    - [19, 21.82]
  - - [128, 8192, 1, 1024, 128, 128, 1024, 8192]
    - [19, 28.7]
  - - [128, 8192, 1, 2048, 128, 128, 2048, 8192]
    - [19, 33.83]
  - - [128, 8192, 1, 4096, 128, 128, 4096, 8192]
    - [18, 37.23]
  - - [128, 8192, 1, 8192, 128, 128, 8192, 8192]
    - [18, 39.26]
  - - [256, 128, 1, 128, 256, 256, 128, 128]
    - [38, 1.4]
  - - [256, 128, 1, 256, 256, 256, 256, 128]
    - [48, 2.36]
  - - [256, 128, 1, 512, 256, 256, 512, 128]
    - [49, 3.76]
  - - [256, 128, 1, 1024, 256, 256, 1024, 128]
    - [50, 5.48]
  - - [256, 128, 1, 2048, 256, 256, 2048, 128]
    - [57, 7.37]
  - - [256, 128, 1, 4096, 256, 256, 4096, 128]
    - [57, 8.99]
  - - [256, 128, 1, 8192, 256, 256, 8192, 128]
    - [56, 10.06]
  - - [256, 256, 1, 128, 256, 256, 128, 256]
    - [33, 2.46]
  - - [256, 256, 1, 256, 256, 256, 256, 256]
    - [36, 4.25]
  - - [256, 256, 1, 512, 256, 256, 512, 256]
    - [46, 6.63]
  - - [256, 256, 1, 1024, 256, 256, 1024, 256]
    - [47, 9.45]
  - - [256, 256, 1, 2048, 256, 256, 2048, 256]
    - [55, 12.39]
  - - [256, 256, 1, 4096, 256, 256, 4096, 256]
    - [55, 14.72]
  - - [256, 256, 1, 8192, 256, 256, 8192, 256]
    - [55, 16.33]
  - - [256, 512, 1, 128, 256, 256, 128, 512]
    - [32, 4.21]
  - - [256, 512, 1, 256, 256, 256, 256, 512]
    - [29, 7.16]
  - - [256, 512, 1, 512, 256, 256, 512, 512]
    - [32, 10.78]
  - - [256, 512, 1, 1024, 256, 256, 1024, 512]
    - [31, 14.65]
  - - [256, 512, 1, 2048, 256, 256, 2048, 512]
    - [54, 18.32]
  - - [256, 512, 1, 4096, 256, 256, 4096, 512]
    - [54, 21.66]
  - - [256, 512, 1, 8192, 256, 256, 8192, 512]
    - [54, 23.03]
  - - [256, 1024, 1, 128, 256, 256, 128, 1024]
    - [7, 6.35]
  - - [256, 1024, 1, 256, 256, 256, 256, 1024]
    - [28, 10.37]
  - - [256, 1024, 1, 512, 256, 256, 512, 1024]
    - [28, 15.63]
  - - [256, 1024, 1, 1024, 256, 256, 1024, 1024]
    - [43, 21.38]
  - - [256, 1024, 1, 2048, 256, 256, 2048, 1024]
    - [43, 26.1]
  - - [256, 1024, 1, 4096, 256, 256, 4096, 1024]
    - [43, 29.54]
  - - [256, 1024, 1, 8192, 256, 256, 8192, 1024]
    - [43, 31.65]
  - - [256, 2048, 1, 128, 256, 256, 128, 2048]
    - [5, 9.06]
  - - [256, 2048, 1, 256, 256, 256, 256, 2048]
    - [20, 14.87]
  - - [256, 2048, 1, 512, 256, 256, 512, 2048]
    - [23, 22.25]
  - - [256, 2048, 1, 1024, 256, 256, 1024, 2048]
    - [22, 29.96]
  - - [256, 2048, 1, 2048, 256, 256, 2048, 2048]
    - [22, 35.05]
  - - [256, 2048, 1, 4096, 256, 256, 4096, 2048]
    - [22, 38.8]
  - - [256, 2048, 1, 8192, 256, 256, 8192, 2048]
    - [22, 41.78]
  - - [256, 4096, 1, 128, 256, 256, 128, 4096]
    - [0, 10.93]
  - - [256, 4096, 1, 256, 256, 256, 256, 4096]
    - [10, 17.82]
  - - [256, 4096, 1, 512, 256, 256, 512, 4096]
    - [10, 26.31]
  - - [256, 4096, 1, 1024, 256, 256, 1024, 4096]
    - [10, 34.83]
  - - [256, 4096, 1, 2048, 256, 256, 2048, 4096]
    - [10, 41.55]
  - - [256, 4096, 1, 4096, 256, 256, 4096, 4096]
    - [10, 46.13]
  - - [256, 4096, 1, 8192, 256, 256, 8192, 4096]
    - [10, 48.88]
  - - [256, 8192, 1, 128, 256, 256, 128, 8192]
    - [0, 11.35]
  - - [256, 8192, 1, 256, 256, 256, 256, 8192]
    - [10, 18.41]
  - - [256, 8192, 1, 512, 256, 256, 512, 8192]
    - [10, 26.81]
  - - [256, 8192, 1, 1024, 256, 256, 1024, 8192]
    - [10, 35.45]
  - - [256, 8192, 1, 2048, 256, 256, 2048, 8192]
    - [10, 42.11]
  - - [256, 8192, 1, 4096, 256, 256, 4096, 8192]
    - [21, 46.55]
  - - [256, 8192, 1, 8192, 256, 256, 8192, 8192]
    - [21, 50.54]
  - - [512, 128, 1, 128, 512, 512, 128, 128]
    - [34, 2.49]
  - - [512, 128, 1, 256, 512, 512, 256, 128]
    - [36, 4.22]
  - - [512, 128, 1, 512, 512, 512, 512, 128]
    - [46, 6.55]
  - - [512, 128, 1, 1024, 512, 512, 1024, 128]
    - [55, 9.36]
  - - [512, 128, 1, 2048, 512, 512, 2048, 128]
    - [55, 12.5]
  - - [512, 128, 1, 4096, 512, 512, 4096, 128]
    - [55, 14.9]
  - - [512, 128, 1, 8192, 512, 512, 8192, 128]
    - [55, 16.46]
  - - [512, 256, 1, 128, 512, 512, 128, 256]
    - [30, 4.2]
  - - [512, 256, 1, 256, 512, 512, 256, 256]
    - [29, 7.07]
  - - [512, 256, 1, 512, 512, 512, 512, 256]
    - [29, 10.82]
  - - [512, 256, 1, 1024, 512, 512, 1024, 256]
    - [29, 14.44]
  - - [512, 256, 1, 2048, 512, 512, 2048, 256]
    - [54, 18.63]
  - - [512, 256, 1, 4096, 512, 512, 4096, 256]
    - [54, 22.07]
  - - [512, 256, 1, 8192, 512, 512, 8192, 256]
    - [54, 24.06]
  - - [512, 512, 1, 128, 512, 512, 128, 512]
    - [28, 6.32]
  - - [512, 512, 1, 256, 512, 512, 256, 512]
    - [28, 10.45]
  - - [512, 512, 1, 512, 512, 512, 512, 512]
    - [28, 15.6]
  - - [512, 512, 1, 1024, 512, 512, 1024, 512]
    - [43, 21.29]
  - - [512, 512, 1, 2048, 512, 512, 2048, 512]
    - [43, 26.16]
  - - [512, 512, 1, 4096, 512, 512, 4096, 512]
    - [43, 29.58]
  - - [512, 512, 1, 8192, 512, 512, 8192, 512]
    - [43, 31.69]
  - - [512, 1024, 1, 128, 512, 512, 128, 1024]
    - [5, 9.03]
  - - [512, 1024, 1, 256, 512, 512, 256, 1024]
    - [22, 14.78]
  - - [512, 1024, 1, 512, 512, 512, 512, 1024]
    - [23, 22.28]
  - - [512, 1024, 1, 1024, 512, 512, 1024, 1024]
    - [22, 29.99]
  - - [512, 1024, 1, 2048, 512, 512, 2048, 1024]
    - [22, 36.34]
  - - [512, 1024, 1, 4096, 512, 512, 4096, 1024]
    - [25, 39.05]
  - - [512, 1024, 1, 8192, 512, 512, 8192, 1024]
    - [22, 41.76]
  - - [512, 2048, 1, 128, 512, 512, 128, 2048]
    - [0, 10.91]
  - - [512, 2048, 1, 256, 512, 512, 256, 2048]
    - [10, 17.84]
  - - [512, 2048, 1, 512, 512, 512, 512, 2048]
    - [12, 26.28]
  - - [512, 2048, 1, 1024, 512, 512, 1024, 2048]
    - [10, 34.81]
  - - [512, 2048, 1, 2048, 512, 512, 2048, 2048]
    - [10, 41.66]
  - - [512, 2048, 1, 4096, 512, 512, 4096, 2048]
    - [10, 46.22]
  - - [512, 2048, 1, 8192, 512, 512, 8192, 2048]
    - [10, 48.87]
  - - [512, 4096, 1, 128, 512, 512, 128, 4096]
    - [0, 11.32]
  - - [512, 4096, 1, 256, 512, 512, 256, 4096]
    - [10, 18.42]
  - - [512, 4096, 1, 512, 512, 512, 512, 4096]
    - [10, 26.85]
  - - [512, 4096, 1, 1024, 512, 512, 1024, 4096]
    - [10, 35.47]
  - - [512, 4096, 1, 2048, 512, 512, 2048, 4096]
    - [10, 42.19]
  - - [512, 4096, 1, 4096, 512, 512, 4096, 4096]
    - [21, 46.81]
  - - [512, 4096, 1, 8192, 512, 512, 8192, 4096]
    - [22, 51.04]
  - - [512, 8192, 1, 128, 512, 512, 128, 8192]
    - [1, 11.6]
  - - [512, 8192, 1, 256, 512, 512, 256, 8192]
    - [10, 18.92]
  - - [512, 8192, 1, 512, 512, 512, 512, 8192]
    - [10, 27.47]
  - - [512, 8192, 1, 1024, 512, 512, 1024, 8192]
    - [10, 35.89]
  - - [512, 8192, 1, 2048, 512, 512, 2048, 8192]
    - [10, 42.4]
  - - [512, 8192, 1, 4096, 512, 512, 4096, 8192]
    - [10, 54.78]
  - - [512, 8192, 1, 8192, 512, 512, 8192, 8192]
    - [10, 59.01]
  - - [1024, 128, 1, 128, 1024, 1024, 128, 128]
    - [30, 4.07]
  - - [1024, 128, 1, 256, 1024, 1024, 256, 128]
    - [29, 7.06]
  - - [1024, 128, 1, 512, 1024, 1024, 512, 128]
    - [29, 10.78]
  - - [1024, 128, 1, 1024, 1024, 1024, 1024, 128]
    - [45, 14.53]
  - - [1024, 128, 1, 2048, 1024, 1024, 2048, 128]
    - [54, 18.78]
  - - [1024, 128, 1, 4096, 1024, 1024, 4096, 128]
    - [53, 21.9]
  - - [1024, 128, 1, 8192, 1024, 1024, 8192, 128]
    - [54, 24.44]
  - - [1024, 256, 1, 128, 1024, 1024, 128, 256]
    - [7, 6.39]
  - - [1024, 256, 1, 256, 1024, 1024, 256, 256]
    - [27, 10.32]
  - - [1024, 256, 1, 512, 1024, 1024, 512, 256]
    - [28, 15.53]
  - - [1024, 256, 1, 1024, 1024, 1024, 1024, 256]
    - [43, 21.34]
  - - [1024, 256, 1, 2048, 1024, 1024, 2048, 256]
    - [43, 26.24]
  - - [1024, 256, 1, 4096, 1024, 1024, 4096, 256]
    - [43, 29.59]
  - - [1024, 256, 1, 8192, 1024, 1024, 8192, 256]
    - [43, 31.7]
  - - [1024, 512, 1, 128, 1024, 1024, 128, 512]
    - [6, 9.11]
  - - [1024, 512, 1, 256, 1024, 1024, 256, 512]
    - [20, 14.95]
  - - [1024, 512, 1, 512, 1024, 1024, 512, 512]
    - [23, 22.3]
  - - [1024, 512, 1, 1024, 1024, 1024, 1024, 512]
    - [22, 29.95]
  - - [1024, 512, 1, 2048, 1024, 1024, 2048, 512]
    - [22, 36.43]
  - - [1024, 512, 1, 4096, 1024, 1024, 4096, 512]
    - [22, 39.08]
  - - [1024, 512, 1, 8192, 1024, 1024, 8192, 512]
    - [22, 41.87]
  - - [1024, 1024, 1, 128, 1024, 1024, 128, 1024]
    - [0, 10.72]
  - - [1024, 1024, 1, 256, 1024, 1024, 256, 1024]
    - [10, 17.81]
  - - [1024, 1024, 1, 512, 1024, 1024, 512, 1024]
    - [10, 26.33]
  - - [1024, 1024, 1, 1024, 1024, 1024, 1024, 1024]
    - [10, 34.8]
  - - [1024, 1024, 1, 2048, 1024, 1024, 2048, 1024]
    - [10, 41.45]
  - - [1024, 1024, 1, 4096, 1024, 1024, 4096, 1024]
    - [10, 46.15]
  - - [1024, 1024, 1, 8192, 1024, 1024, 8192, 1024]
    - [10, 48.91]
  - - [1024, 2048, 1, 128, 1024, 1024, 128, 2048]
    - [10, 11.34]
  - - [1024, 2048, 1, 256, 1024, 1024, 256, 2048]
    - [10, 18.42]
  - - [1024, 2048, 1, 512, 1024, 1024, 512, 2048]
    - [10, 27.09]
  - - [1024, 2048, 1, 1024, 1024, 1024, 1024, 2048]
    - [10, 35.41]
  - - [1024, 2048, 1, 2048, 1024, 1024, 2048, 2048]
    - [10, 42.22]
  - - [1024, 2048, 1, 4096, 1024, 1024, 4096, 2048]
    - [21, 46.68]
  - - [1024, 2048, 1, 8192, 1024, 1024, 8192, 2048]
    - [21, 50.73]
  - - [1024, 4096, 1, 128, 1024, 1024, 128, 4096]
    - [0, 11.63]
  - - [1024, 4096, 1, 256, 1024, 1024, 256, 4096]
    - [10, 18.87]
  - - [1024, 4096, 1, 512, 1024, 1024, 512, 4096]
    - [10, 27.5]
  - - [1024, 4096, 1, 1024, 1024, 1024, 1024, 4096]
    - [10, 35.86]
  - - [1024, 4096, 1, 2048, 1024, 1024, 2048, 4096]
    - [10, 42.49]
  - - [1024, 4096, 1, 4096, 1024, 1024, 4096, 4096]
    - [10, 54.75]
  - - [1024, 4096, 1, 8192, 1024, 1024, 8192, 4096]
    - [10, 59.25]
  - - [1024, 8192, 1, 128, 1024, 1024, 128, 8192]
    - [0, 11.77]
  - - [1024, 8192, 1, 256, 1024, 1024, 256, 8192]
    - [10, 19.13]
  - - [1024, 8192, 1, 512, 1024, 1024, 512, 8192]
    - [10, 27.77]
  - - [1024, 8192, 1, 1024, 1024, 1024, 1024, 8192]
    - [21, 38.08]
  - - [1024, 8192, 1, 2048, 1024, 1024, 2048, 8192]
    - [10, 46.16]
  - - [1024, 8192, 1, 4096, 1024, 1024, 4096, 8192]
    - [10, 54.15]
  - - [1024, 8192, 1, 8192, 1024, 1024, 8192, 8192]
    - [10, 57.33]
  - - [2048, 128, 1, 128, 2048, 2048, 128, 128]
    - [7, 6.41]
  - - [2048, 128, 1, 256, 2048, 2048, 256, 128]
    - [28, 10.55]
  - - [2048, 128, 1, 512, 2048, 2048, 512, 128]
    - [27, 15.51]
  - - [2048, 128, 1, 1024, 2048, 2048, 1024, 128]
    - [43, 21.23]
  - - [2048, 128, 1, 2048, 2048, 2048, 2048, 128]
    - [43, 26.07]
  - - [2048, 128, 1, 4096, 2048, 2048, 4096, 128]
    - [43, 29.45]
  - - [2048, 128, 1, 8192, 2048, 2048, 8192, 128]
    - [43, 31.62]
  - - [2048, 256, 1, 128, 2048, 2048, 128, 256]
    - [5, 9.14]
  - - [2048, 256, 1, 256, 2048, 2048, 256, 256]
    - [22, 14.81]
  - - [2048, 256, 1, 512, 2048, 2048, 512, 256]
    - [23, 22.16]
  - - [2048, 256, 1, 1024, 2048, 2048, 1024, 256]
    - [22, 30.02]
  - - [2048, 256, 1, 2048, 2048, 2048, 2048, 256]
    - [22, 34.88]
  - - [2048, 256, 1, 4096, 2048, 2048, 4096, 256]
    - [22, 38.73]
  - - [2048, 256, 1, 8192, 2048, 2048, 8192, 256]
    - [22, 41.25]
  - - [2048, 512, 1, 128, 2048, 2048, 128, 512]
    - [10, 10.86]
  - - [2048, 512, 1, 256, 2048, 2048, 256, 512]
    - [10, 17.83]
  - - [2048, 512, 1, 512, 2048, 2048, 512, 512]
    - [10, 26.34]
  - - [2048, 512, 1, 1024, 2048, 2048, 1024, 512]
    - [10, 34.81]
  - - [2048, 512, 1, 2048, 2048, 2048, 2048, 512]
    - [10, 41.56]
  - - [2048, 512, 1, 4096, 2048, 2048, 4096, 512]
    - [10, 46.04]
  - - [2048, 512, 1, 8192, 2048, 2048, 8192, 512]
    - [10, 48.8]
  - - [2048, 1024, 1, 128, 2048, 2048, 128, 1024]
    - [0, 11.34]
  - - [2048, 1024, 1, 256, 2048, 2048, 256, 1024]
    - [10, 18.51]
  - - [2048, 1024, 1, 512, 2048, 2048, 512, 1024]
    - [10, 27.1]
  - - [2048, 1024, 1, 1024, 2048, 2048, 1024, 1024]
    - [10, 35.52]
  - - [2048, 1024, 1, 2048, 2048, 2048, 2048, 1024]
    - [10, 42.1]
  - - [2048, 1024, 1, 4096, 2048, 2048, 4096, 1024]
    - [21, 46.46]
  - - [2048, 1024, 1, 8192, 2048, 2048, 8192, 1024]
    - [26, 50.38]
  - - [2048, 2048, 1, 128, 2048, 2048, 128, 2048]
    - [0, 11.63]
  - - [2048, 2048, 1, 256, 2048, 2048, 256, 2048]
    - [10, 18.91]
  - - [2048, 2048, 1, 512, 2048, 2048, 512, 2048]
    - [10, 27.5]
  - - [2048, 2048, 1, 1024, 2048, 2048, 1024, 2048]
    - [10, 35.82]
  - - [2048, 2048, 1, 2048, 2048, 2048, 2048, 2048]
    - [10, 42.35]
  - - [2048, 2048, 1, 4096, 2048, 2048, 4096, 2048]
    - [10, 54.67]
  - - [2048, 2048, 1, 8192, 2048, 2048, 8192, 2048]
    - [10, 59.11]
  - - [2048, 4096, 1, 128, 2048, 2048, 128, 4096]
    - [10, 11.76]
  - - [2048, 4096, 1, 256, 2048, 2048, 256, 4096]
    - [10, 19.12]
  - - [2048, 4096, 1, 512, 2048, 2048, 512, 4096]
    - [10, 27.73]
  - - [2048, 4096, 1, 1024, 2048, 2048, 1024, 4096]
    - [22, 37.6]
  - - [2048, 4096, 1, 2048, 2048, 2048, 2048, 4096]
    - [10, 46.13]
  - - [2048, 4096, 1, 4096, 2048, 2048, 4096, 4096]
    - [10, 54.06]
  - - [2048, 4096, 1, 8192, 2048, 2048, 8192, 4096]
    - [10, 57.41]
  - - [2048, 8192, 1, 128, 2048, 2048, 128, 8192]
    - [0, 11.86]
  - - [2048, 8192, 1, 256, 2048, 2048, 256, 8192]
    - [10, 19.25]
  - - [2048, 8192, 1, 512, 2048, 2048, 512, 8192]
    - [2, 30.52]
  - - [2048, 8192, 1, 1024, 2048, 2048, 1024, 8192]
    - [10, 43.51]
  - - [2048, 8192, 1, 2048, 2048, 2048, 2048, 8192]
    - [10, 51.9]
  - - [2048, 8192, 1, 4096, 2048, 2048, 4096, 8192]
    - [10, 57.31]
  - - [2048, 8192, 1, 8192, 2048, 2048, 8192, 8192]
    - [10, 60.67]
  - - [4096, 128, 1, 128, 4096, 4096, 128, 128]
    - [5, 9.06]
  - - [4096, 128, 1, 256, 4096, 4096, 256, 128]
    - [20, 14.8]
  - - [4096, 128, 1, 512, 4096, 4096, 512, 128]
    - [23, 22.26]
  - - [4096, 128, 1, 1024, 4096, 4096, 1024, 128]
    - [22, 28.82]
  - - [4096, 128, 1, 2048, 4096, 4096, 2048, 128]
    - [22, 34.49]
  - - [4096, 128, 1, 4096, 4096, 4096, 4096, 128]
    - [41, 38.02]
  - - [4096, 128, 1, 8192, 4096, 4096, 8192, 128]
    - [41, 40.59]
  - - [4096, 256, 1, 128, 4096, 4096, 128, 256]
    - [9, 10.89]
  - - [4096, 256, 1, 256, 4096, 4096, 256, 256]
    - [10, 17.85]
  - - [4096, 256, 1, 512, 4096, 4096, 512, 256]
    - [10, 26.15]
  - - [4096, 256, 1, 1024, 4096, 4096, 1024, 256]
    - [10, 34.7]
  - - [4096, 256, 1, 2048, 4096, 4096, 2048, 256]
    - [10, 41.39]
  - - [4096, 256, 1, 4096, 4096, 4096, 4096, 256]
    - [10, 45.99]
  - - [4096, 256, 1, 8192, 4096, 4096, 8192, 256]
    - [10, 48.79]
  - - [4096, 512, 1, 128, 4096, 4096, 128, 512]
    - [0, 11.33]
  - - [4096, 512, 1, 256, 4096, 4096, 256, 512]
    - [10, 18.39]
  - - [4096, 512, 1, 512, 4096, 4096, 512, 512]
    - [10, 27.01]
  - - [4096, 512, 1, 1024, 4096, 4096, 1024, 512]
    - [10, 35.38]
  - - [4096, 512, 1, 2048, 4096, 4096, 2048, 512]
    - [10, 41.99]
  - - [4096, 512, 1, 4096, 4096, 4096, 4096, 512]
    - [14, 46.38]
  - - [4096, 512, 1, 8192, 4096, 4096, 8192, 512]
    - [24, 50.01]
  - - [4096, 1024, 1, 128, 4096, 4096, 128, 1024]
    - [0, 11.61]
  - - [4096, 1024, 1, 256, 4096, 4096, 256, 1024]
    - [10, 18.92]
  - - [4096, 1024, 1, 512, 4096, 4096, 512, 1024]
    - [10, 27.39]
  - - [4096, 1024, 1, 1024, 4096, 4096, 1024, 1024]
    - [10, 35.76]
  - - [4096, 1024, 1, 2048, 4096, 4096, 2048, 1024]
    - [10, 42.29]
  - - [4096, 1024, 1, 4096, 4096, 4096, 4096, 1024]
    - [10, 54.58]
  - - [4096, 1024, 1, 8192, 4096, 4096, 8192, 1024]
    - [14, 59.12]
  - - [4096, 2048, 1, 128, 4096, 4096, 128, 2048]
    - [0, 11.75]
  - - [4096, 2048, 1, 256, 4096, 4096, 256, 2048]
    - [10, 19.13]
  - - [4096, 2048, 1, 512, 4096, 4096, 512, 2048]
    - [10, 27.61]
  - - [4096, 2048, 1, 1024, 4096, 4096, 1024, 2048]
    - [26, 37.05]
  - - [4096, 2048, 1, 2048, 4096, 4096, 2048, 2048]
    - [10, 46.13]
  - - [4096, 2048, 1, 4096, 4096, 4096, 4096, 2048]
    - [10, 54.07]
  - - [4096, 2048, 1, 8192, 4096, 4096, 8192, 2048]
    - [10, 57.35]
  - - [4096, 4096, 1, 128, 4096, 4096, 128, 4096]
    - [0, 11.84]
  - - [4096, 4096, 1, 256, 4096, 4096, 256, 4096]
    - [10, 19.23]
  - - [4096, 4096, 1, 512, 4096, 4096, 512, 4096]
    - [2, 30.37]
  - - [4096, 4096, 1, 1024, 4096, 4096, 1024, 4096]
    - [10, 43.44]
  - - [4096, 4096, 1, 2048, 4096, 4096, 2048, 4096]
    - [10, 51.8]
  - - [4096, 4096, 1, 4096, 4096, 4096, 4096, 4096]
    - [13, 57.36]
  - - [4096, 4096, 1, 8192, 4096, 4096, 8192, 4096]
    - [10, 60.61]
  - - [4096, 8192, 1, 128, 4096, 4096, 128, 8192]
    - [5, 12.77]
  - - [4096, 8192, 1, 256, 4096, 4096, 256, 8192]
    - [3, 20.99]
  - - [4096, 8192, 1, 512, 4096, 4096, 512, 8192]
    - [10, 31.78]
  - - [4096, 8192, 1, 1024, 4096, 4096, 1024, 8192]
    - [10, 41.85]
  - - [4096, 8192, 1, 2048, 4096, 4096, 2048, 8192]
    - [13, 49.66]
  - - [4096, 8192, 1, 4096, 4096, 4096, 4096, 8192]
    - [13, 57.65]
  - - [4096, 8192, 1, 8192, 4096, 4096, 8192, 8192]
    - [10, 60.82]
  - - [8192, 128, 1, 128, 8192, 8192, 128, 128]
    - [5, 9.73]
  - - [8192, 128, 1, 256, 8192, 8192, 256, 128]
    - [20, 15.77]
  - - [8192, 128, 1, 512, 8192, 8192, 512, 128]
    - [22, 22.47]
  - - [8192, 128, 1, 1024, 8192, 8192, 1024, 128]
    - [22, 29.75]
  - - [8192, 128, 1, 2048, 8192, 8192, 2048, 128]
    - [22, 35.27]
  - - [8192, 128, 1, 4096, 8192, 8192, 4096, 128]
    - [42, 38.42]
  - - [8192, 128, 1, 8192, 8192, 8192, 8192, 128]
    - [41, 39.68]
  - - [8192, 256, 1, 128, 8192, 8192, 128, 256]
    - [1, 11.31]
  - - [8192, 256, 1, 256, 8192, 8192, 256, 256]
    - [10, 18.39]
  - - [8192, 256, 1, 512, 8192, 8192, 512, 256]
    - [10, 26.87]
  - - [8192, 256, 1, 1024, 8192, 8192, 1024, 256]
    - [10, 35.31]
  - - [8192, 256, 1, 2048, 8192, 8192, 2048, 256]
    - [10, 41.97]
  - - [8192, 256, 1, 4096, 8192, 8192, 4096, 256]
    - [10, 46.33]
  - - [8192, 256, 1, 8192, 8192, 8192, 8192, 256]
    - [41, 47.95]
  - - [8192, 512, 1, 128, 8192, 8192, 128, 512]
    - [1, 11.59]
  - - [8192, 512, 1, 256, 8192, 8192, 256, 512]
    - [10, 18.77]
  - - [8192, 512, 1, 512, 8192, 8192, 512, 512]
    - [10, 27.25]
  - - [8192, 512, 1, 1024, 8192, 8192, 1024, 512]
    - [10, 35.76]
  - - [8192, 512, 1, 2048, 8192, 8192, 2048, 512]
    - [10, 42.27]
  - - [8192, 512, 1, 4096, 8192, 8192, 4096, 512]
    - [10, 54.58]
  - - [8192, 512, 1, 8192, 8192, 8192, 8192, 512]
    - [11, 56.38]
  - - [8192, 1024, 1, 128, 8192, 8192, 128, 1024]
    - [1, 11.75]
  - - [8192, 1024, 1, 256, 8192, 8192, 256, 1024]
    - [10, 18.97]
  - - [8192, 1024, 1, 512, 8192, 8192, 512, 1024]
    - [10, 27.52]
  - - [8192, 1024, 1, 1024, 8192, 8192, 1024, 1024]
    - [26, 37.01]
  - - [8192, 1024, 1, 2048, 8192, 8192, 2048, 1024]
    - [14, 45.97]
  - - [8192, 1024, 1, 4096, 8192, 8192, 4096, 1024]
    - [13, 54.0]
  - - [8192, 1024, 1, 8192, 8192, 8192, 8192, 1024]
    - [15, 54.65]
  - - [8192, 2048, 1, 128, 8192, 8192, 128, 2048]
    - [1, 11.82]
  - - [8192, 2048, 1, 256, 8192, 8192, 256, 2048]
    - [10, 19.14]
  - - [8192, 2048, 1, 512, 8192, 8192, 512, 2048]
    - [2, 30.42]
  - - [8192, 2048, 1, 1024, 8192, 8192, 1024, 2048]
    - [10, 43.39]
  - - [8192, 2048, 1, 2048, 8192, 8192, 2048, 2048]
    - [10, 51.77]
  - - [8192, 2048, 1, 4096, 8192, 8192, 4096, 2048]
    - [10, 57.15]
  - - [8192, 2048, 1, 8192, 8192, 8192, 8192, 2048]
    - [15, 58.34]
  - - [8192, 4096, 1, 128, 8192, 8192, 128, 4096]
    - [6, 12.75]
  - - [8192, 4096, 1, 256, 8192, 8192, 256, 4096]
    - [3, 20.94]
  - - [8192, 4096, 1, 512, 8192, 8192, 512, 4096]
    - [10, 31.77]
  - - [8192, 4096, 1, 1024, 8192, 8192, 1024, 4096]
    - [10, 41.87]
  - - [8192, 4096, 1, 2048, 8192, 8192, 2048, 4096]
    - [13, 49.56]
  - - [8192, 4096, 1, 4096, 8192, 8192, 4096, 4096]
    - [10, 57.49]
  - - [8192, 4096, 1, 8192, 8192, 8192, 8192, 4096]
    - [15, 58.74]
  - - [8192, 8192, 1, 128, 8192, 8192, 128, 8192]
    - [1, 14.21]
  - - [8192, 8192, 1, 256, 8192, 8192, 256, 8192]
    - [10, 23.12]
  - - [8192, 8192, 1, 512, 8192, 8192, 512, 8192]
    - [10, 33.63]
  - - [8192, 8192, 1, 1024, 8192, 8192, 1024, 8192]
    - [10, 44.11]
  - - [8192, 8192, 1, 2048, 8192, 8192, 2048, 8192]
    - [13, 52.27]
  - - [8192, 8192, 1, 4096, 8192, 8192, 4096, 8192]
    - [10, 57.64]
  - - [8192, 8192, 1, 8192, 8192, 8192, 8192, 8192]
    - [15, 58.89]
  - - [1, 1, 1, 32, 1, 1, 32, 1]
    - [59, 0.0]
- null
- null
- ExperimentalStreamK
- GridBased
