projects/hipblaslt/library/src/amd_detail/rocblaslt/src/Tensile/Logic/asm_full/navi31/GridBased/navi31_Cijk_Alik_Bljk_BBS_BH_Bias_HAS_SAV_UserArgs.yaml
- {MinimumRequiredVersion: 5.0.0}
- navi31
- gfx1100
- [Device 73f0]
    SolutionIndex: 2
    SolutionNameMin: Cijk_Alik_Bljk_BBS_BH_Bias_HA_S_SAV_UserArgs_MT96x128x64_MI16x16x1_SN_LDSB0_AFC1_AG0_AFEM1_AFEM1_ASEM1_CLR0_CADS0_DTLA0_DTLB0_DTVA0_DTVB0_EPS0_FDSI0_GRPM1_GRVWA8_GRVWB8_GSU1_GSUAMB_GSUC0_GSUWGMRR0_GLS0_ISA1100_IU1_K1_LDSTI0_LBSPPA128_LBSPPB128_LBSPPM0_LPA8_LPB8_LPM0_LRVW16_LWPMn1_MIAV1_MIWT6_2_MO40_NTn1_NTA0_NTB0_NTC0_NTD0_NTM0_NEPBS0_NLCA1_NLCB1_ONLL1_PGR2_PLR0_PKA0_SIA1_SS1_SU32_SUM1_SUS256_SPO0_SRVW0_SSO0_SVW1_SK0_SKFTR0_SKXCCM0_TLDS1_ULSGRO0_USL1_UIOFGRO0_USFGROn1_VSn1_VWA1_VWB1_WSGRA0_WSGRB0_WS32_WG16_8_1_WGM8_WGMXCC1_WGMXCCGn1
    SolutionIndex: 3
    SolutionNameMin: Cijk_Alik_Bljk_BBS_BH_Bias_HA_S_SAV_UserArgs_MT96x128x64_MI16x16x1_SN_LDSB0_AFC1_AG0_AFEM1_AFEM1_ASEM1_CLR0_CADS0_DTLA0_DTLB0_DTVA0_DTVB0_EPS0_FDSI0_GRPM1_GRVWA8_GRVWB8_GSU1_GSUAMB_GSUC0_GSUWGMRR0_GLS0_ISA1100_IU1_K1_LDSTI0_LBSPPA128_LBSPPB128_LBSPPM0_LPA8_LPB8_LPM0_LRVW16_LWPMn1_MIAV1_MIWT6_2_MO40_NTn1_NTA0_NTB0_NTC0_NTD0_NTM0_NEPBS0_NLCA1_NLCB1_ONLL1_PGR0_PLR0_PKA0_SIA3_SS1_SU32_SUM1_SUS256_SPO0_SRVW0_SSO0_SVW1_SK0_SKFTR0_SKXCCM0_TLDS1_ULSGRO0_USL1_UIOFGRO0_USFGROn1_VSn1_VWA1_VWB1_WSGRA0_WSGRB0_WS32_WG16_8_1_WGM8_WGMXCC1_WGMXCCGn1
    SolutionIndex: 5
    SolutionNameMin: Cijk_Alik_Bljk_BBS_BH_Bias_HA_S_SAV_UserArgs_MT96x128x64_MI16x16x1_SN_LDSB0_AFC1_AG0_AFEM1_AFEM1_ASEM1_CLR0_CADS0_DTLA0_DTLB0_DTVA0_DTVB0_EPS0_FDSI0_GRPM1_GRVWA8_GRVWB8_GSU1_GSUAMB_GSUC0_GSUWGMRR0_GLS0_ISA1100_IU1_K1_LDSTI0_LBSPPA128_LBSPPB128_LBSPPM0_LPA8_LPB8_LPM0_LRVW16_LWPMn1_MIAV1_MIWT3_4_MO40_NTn1_NTA0_NTB0_NTC0_NTD0_NTM0_NEPBS0_NLCA1_NLCB1_ONLL1_PGR0_PLR0_PKA0_SIA3_SS1_SU32_SUM1_SUS256_SPO0_SRVW0_SSO0_SVW1_SK0_SKFTR0_SKXCCM0_TLDS1_ULSGRO0_USL1_UIOFGRO0_USFGROn1_VSn1_VWA1_VWB1_WSGRA0_WSGRB0_WS32_WG32_4_1_WGM8_WGMXCC1_WGMXCCGn1
    SolutionIndex: 8
    SolutionNameMin: Cijk_Alik_Bljk_BBS_BH_Bias_HA_S_SAV_UserArgs_MT128x96x64_MI16x16x1_SN_LDSB0_AFC1_AG0_AFEM1_AFEM1_ASEM1_CLR0_CADS0_DTLA0_DTLB0_DTVA0_DTVB0_EPS0_FDSI0_GRPM1_GRVWA8_GRVWB8_GSU1_GSUAMB_GSUC0_GSUWGMRR0_GLS0_ISA1100_IU1_K1_LDSTI0_LBSPPA128_LBSPPB128_LBSPPM0_LPA8_LPB8_LPM0_LRVW16_LWPMn1_MIAV1_MIWT4_3_MO40_NTn1_NTA0_NTB0_NTC0_NTD0_NTM0_NEPBS0_NLCA1_NLCB1_ONLL1_PGR0_PLR0_PKA0_SIA3_SS1_SU32_SUM1_SUS256_SPO0_SRVW0_SSO0_SVW1_SK0_SKFTR0_SKXCCM0_TLDS1_ULSGRO0_USL1_UIOFGRO0_USFGROn1_VSn1_VWA1_VWB1_WSGRA0_WSGRB0_WS32_WG32_4_1_WGM8_WGMXCC1_WGMXCCGn1
    SolutionIndex: 9
    SolutionNameMin: Cijk_Alik_Bljk_BBS_BH_Bias_HA_S_SAV_UserArgs_MT80x128x64_MI16x16x1_SN_LDSB1_AFC1_AG0_AFEM1_AFEM1_ASEM1_CLR0_CADS0_DTLA0_DTLB0_DTVA0_DTVB0_EPS0_FDSI0_GRPM1_GRVWA8_GRVWB8_GSU1_GSUAMB_GSUC0_GSUWGMRR0_GLS0_ISA1100_IU1_K1_LDSTI0_LBSPPA128_LBSPPB128_LBSPPM0_LPA8_LPB8_LPM0_LRVW16_LWPMn1_MIAV1_MIWT5_2_MO40_NTn1_NTA0_NTB0_NTC0_NTD0_NTM0_NEPBS0_NLCA1_NLCB1_ONLL1_PGR2_PLR1_PKA0_SIA3_SS1_SU32_SUM1_SUS256_SPO0_SRVW0_SSO0_SVW1_SK0_SKFTR0_SKXCCM0_TLDS1_ULSGRO0_USL1_UIOFGRO0_USFGROn1_VSn1_VWA1_VWB1_WSGRA0_WSGRB0_WS32_WG16_8_1_WGM8_WGMXCC1_WGMXCCGn1
    SolutionIndex: 10
    SolutionNameMin: Cijk_Alik_Bljk_BBS_BH_Bias_HA_S_SAV_UserArgs_MT64x48x64_MI16x16x1_SN_LDSB0_AFC1_AG0_AFEM1_AFEM1_ASEM1_CLR0_CADS0_DTLA0_DTLB0_DTVA0_DTVB0_EPS0_FDSI0_GRPM1_GRVWA8_GRVWB8_GSU1_GSUAMB_GSUC0_GSUWGMRR0_GLS0_ISA1100_IU1_K1_LDSTI0_LBSPPA128_LBSPPB128_LBSPPM0_LPA8_LPB8_LPM0_LRVW16_LWPMn1_MIAV1_MIWT1_3_MO40_NTn1_NTA0_NTB0_NTC0_NTD0_NTM0_NEPBS0_NLCA1_NLCB1_ONLL1_PGR2_PLR1_PKA0_SIA1_SS1_SU32_SUM1_SUS256_SPO0_SRVW0_SSO0_SVW1_SK0_SKFTR0_SKXCCM0_TLDS1_ULSGRO0_USL1_UIOFGRO0_USFGROn1_VSn1_VWA1_VWB1_WSGRA0_WSGRB0_WS32_WG64_2_1_WGM8_WGMXCC1_WGMXCCGn1
    SolutionIndex: 11
    SolutionNameMin: Cijk_Alik_Bljk_BBS_BH_Bias_HA_S_SAV_UserArgs_MT64x64x64_MI16x16x1_SN_LDSB0_AFC1_AG0_AFEM1_AFEM1_ASEM1_CLR0_CADS0_DTLA0_DTLB0_DTVA0_DTVB0_EPS0_FDSI0_GRPM1_GRVWA8_GRVWB8_GSU1_GSUAMB_GSUC0_GSUWGMRR0_GLS0_ISA1100_IU1_K1_LDSTI0_LBSPPA128_LBSPPB128_LBSPPM0_LPA8_LPB8_LPM0_LRVW16_LWPMn1_MIAV1_MIWT2_2_MO40_NTn1_NTA0_NTB0_NTC0_NTD0_NTM0_NEPBS0_NLCA1_NLCB1_ONLL1_PGR2_PLR1_PKA0_SIA1_SS1_SU32_SUM1_SUS256_SPO0_SRVW0_SSO0_SVW1_SK0_SKFTR0_SKXCCM0_TLDS1_ULSGRO0_USL1_UIOFGRO0_USFGROn1_VSn1_VWA1_VWB1_WSGRA0_WSGRB0_WS32_WG32_4_1_WGM8_WGMXCC1_WGMXCCGn1
    SolutionIndex: 12
    SolutionNameMin: Cijk_Alik_Bljk_BBS_BH_Bias_HA_S_SAV_UserArgs_MT128x64x64_MI16x16x1_SN_LDSB0_AFC1_AG0_AFEM1_AFEM1_ASEM1_CLR0_CADS0_DTLA0_DTLB0_DTVA0_DTVB0_EPS0_FDSI0_GRPM1_GRVWA8_GRVWB8_GSU1_GSUAMB_GSUC0_GSUWGMRR0_GLS0_ISA1100_IU1_K1_LDSTI0_LBSPPA128_LBSPPB128_LBSPPM0_LPA8_LPB8_LPM0_LRVW16_LWPMn1_MIAV1_MIWT4_2_MO40_NTn1_NTA0_NTB0_NTC0_NTD0_NTM0_NEPBS0_NLCA1_NLCB1_ONLL1_PGR2_PLR1_PKA0_SIA1_SS1_SU32_SUM1_SUS256_SPO0_SRVW0_SSO0_SVW1_SK0_SKFTR0_SKXCCM0_TLDS1_ULSGRO0_USL1_UIOFGRO0_USFGROn1_VSn1_VWA1_VWB1_WSGRA0_WSGRB0_WS32_WG32_4_1_WGM8_WGMXCC1_WGMXCCGn1
    SolutionIndex: 13
    SolutionNameMin: Cijk_Alik_Bljk_BBS_BH_Bias_HA_S_SAV_UserArgs_MT64x128x32_MI16x16x1_SN_LDSB0_AFC1_AG0_AFEM1_AFEM1_ASEM1_CLR0_CADS0_DTLA0_DTLB0_DTVA0_DTVB0_EPS0_FDSI0_GRPM1_GRVWA8_GRVWB8_GSU1_GSUAMB_GSUC0_GSUWGMRR0_GLS0_ISA1100_IU1_K1_LDSTI0_LBSPPA128_LBSPPB128_LBSPPM0_LPA8_LPB8_LPM0_LRVW16_LWPMn1_MIAV1_MIWT4_2_MO40_NTn1_NTA0_NTB0_NTC0_NTD0_NTM0_NEPBS0_NLCA1_NLCB1_ONLL1_PGR2_PLR1_PKA0_SIA1_SS1_SU32_SUM1_SUS256_SPO0_SRVW0_SSO0_SVW1_SK0_SKFTR0_SKXCCM0_TLDS1_ULSGRO0_USL1_UIOFGRO0_USFGROn1_VSn1_VWA1_VWB1_WSGRA0_WSGRB0_WS32_WG16_8_1_WGM8_WGMXCC1_WGMXCCGn1
    SolutionIndex: 14
    SolutionNameMin: Cijk_Alik_Bljk_BBS_BH_Bias_HA_S_SAV_UserArgs_MT128x128x32_MI16x16x1_SN_LDSB0_AFC1_AG0_AFEM1_AFEM1_ASEM1_CLR0_CADS0_DTLA0_DTLB0_DTVA0_DTVB0_EPS0_FDSI0_GRPM1_GRVWA8_GRVWB8_GSU1_GSUAMB_GSUC0_GSUWGMRR0_GLS0_ISA1100_IU1_K1_LDSTI0_LBSPPA128_LBSPPB128_LBSPPM0_LPA8_LPB8_LPM0_LRVW16_LWPMn1_MIAV1_MIWT4_4_MO40_NTn1_NTA0_NTB0_NTC0_NTD0_NTM0_NEPBS0_NLCA1_NLCB1_ONLL1_PGR0_PLR0_PKA0_SIA3_SS1_SU32_SUM1_SUS256_SPO0_SRVW0_SSO0_SVW1_SK0_SKFTR0_SKXCCM0_TLDS1_ULSGRO0_USL1_UIOFGRO0_USFGROn1_VSn1_VWA1_VWB1_WSGRA0_WSGRB0_WS32_WG32_4_1_WGM8_WGMXCC1_WGMXCCGn1
    SolutionIndex: 15
    SolutionNameMin: Cijk_Alik_Bljk_BBS_BH_Bias_HA_S_SAV_UserArgs_MT32x64x64_MI16x16x1_SN_LDSB0_AFC1_AG0_AFEM1_AFEM1_ASEM1_CLR0_CADS0_DTLA0_DTLB0_DTVA0_DTVB0_EPS0_FDSI0_GRPM1_GRVWA8_GRVWB8_GSU1_GSUAMB_GSUC0_GSUWGMRR0_GLS0_ISA1100_IU1_K1_LDSTI0_LBSPPA128_LBSPPB128_LBSPPM0_LPA8_LPB8_LPM0_LRVW16_LWPMn1_MIAV1_MIWT2_1_MO40_NTn1_NTA0_NTB0_NTC0_NTD0_NTM0_NEPBS0_NLCA1_NLCB1_ONLL1_PGR1_PLR1_PKA0_SIA1_SS1_SU32_SUM1_SUS256_SPO0_SRVW0_SSO0_SVW1_SK0_SKFTR0_SKXCCM0_TLDS1_ULSGRO0_USL1_UIOFGRO0_USFGROn1_VSn1_VWA1_VWB1_WSGRA0_WSGRB0_WS32_WG16_8_1_WGM8_WGMXCC1_WGMXCCGn1
    SolutionIndex: 16
    SolutionNameMin: Cijk_Alik_Bljk_BBS_BH_Bias_HA_S_SAV_UserArgs_MT16x64x64_MI16x16x1_SN_LDSB0_AFC1_AG0_AFEM1_AFEM1_ASEM1_CLR0_CADS0_DTLA0_DTLB0_DTVA0_DTVB0_EPS0_FDSI0_GRPM1_GRVWA8_GRVWB8_GSU1_GSUAMB_GSUC0_GSUWGMRR0_GLS0_ISA1100_IU1_K1_LDSTI0_LBSPPA128_LBSPPB128_LBSPPM0_LPA8_LPB8_LPM0_LRVW16_LWPMn1_MIAV1_MIWT1_1_MO40_NTn1_NTA0_NTB0_NTC0_NTD0_NTM0_NEPBS0_NLCA1_NLCB1_ONLL1_PGR2_PLR1_PKA0_SIA1_SS1_SU32_SUM1_SUS256_SPO0_SRVW0_SSO0_SVW1_SK0_SKFTR0_SKXCCM0_TLDS1_ULSGRO0_USL1_UIOFGRO0_USFGROn1_VSn1_VWA1_VWB1_WSGRA0_WSGRB0_WS32_WG16_8_1_WGM8_WGMXCC1_WGMXCCGn1
    SolutionIndex: 17
    SolutionNameMin: Cijk_Alik_Bljk_BBS_BH_Bias_HA_S_SAV_UserArgs_MT16x16x32_MI16x16x1_SN_LDSB0_AFC1_AG0_AFEM1_AFEM1_ASEM1_CLR0_CADS0_DTLA0_DTLB0_DTVA0_DTVB0_EPS0_FDSI0_GRPM1_GRVWA8_GRVWB8_GSU1_GSUAMB_GSUC0_GSUWGMRR0_GLS0_ISA1100_IU1_K1_LDSTI0_LBSPPA128_LBSPPB128_LBSPPM0_LPA8_LPB8_LPM0_LRVW16_LWPMn1_MIAV1_MIWT1_1_MO40_NTn1_NTA0_NTB0_NTC0_NTD0_NTM0_NEPBS0_NLCA1_NLCB1_ONLL1_PGR2_PLR1_PKA0_SIA3_SS1_SU32_SUM1_SUS256_SPO0_SRVW0_SSO0_SVW1_SK0_SKFTR0_SKXCCM0_TLDS1_ULSGRO0_USL1_UIOFGRO0_USFGROn1_VSn1_VWA1_VWB1_WSGRA0_WSGRB0_WS32_WG16_2_1_WGM8_WGMXCC1_WGMXCCGn1
    SolutionIndex: 18
    SolutionNameMin: Cijk_Alik_Bljk_BBS_BH_Bias_HA_S_SAV_UserArgs_MT32x64x128_MI16x16x1_SN_LDSB0_AFC1_AG0_AFEM1_AFEM1_ASEM1_CLR0_CADS0_DTLA0_DTLB0_DTVA0_DTVB0_EPS0_FDSI0_GRPM1_GRVWA8_GRVWB8_GSU1_GSUAMB_GSUC0_GSUWGMRR0_GLS0_ISA1100_IU1_K1_LDSTI0_LBSPPA256_LBSPPB256_LBSPPM0_LPA8_LPB8_LPM0_LRVW16_LWPMn1_MIAV1_MIWT2_1_MO40_NTn1_NTA0_NTB0_NTC0_NTD0_NTM0_NEPBS0_NLCA1_NLCB1_ONLL1_PGR1_PLR1_PKA0_SIA1_SS1_SU32_SUM1_SUS256_SPO0_SRVW0_SSO0_SVW1_SK0_SKFTR0_SKXCCM0_TLDS1_ULSGRO0_USL1_UIOFGRO0_USFGROn1_VSn1_VWA1_VWB1_WSGRA0_WSGRB0_WS32_WG16_8_1_WGM8_WGMXCC1_WGMXCCGn1
    SolutionIndex: 19
    SolutionNameMin: Cijk_Alik_Bljk_BBS_BH_Bias_HA_S_SAV_UserArgs_MT64x32x128_MI16x16x1_SN_LDSB0_AFC1_AG0_AFEM1_AFEM1_ASEM1_CLR0_CADS0_DTLA0_DTLB0_DTVA0_DTVB0_EPS0_FDSI0_GRPM1_GRVWA8_GRVWB8_GSU1_GSUAMB_GSUC0_GSUWGMRR0_GLS0_ISA1100_IU1_K1_LDSTI0_LBSPPA256_LBSPPB256_LBSPPM0_LPA8_LPB8_LPM0_LRVW16_LWPMn1_MIAV1_MIWT2_1_MO40_NTn1_NTA0_NTB0_NTC0_NTD0_NTM0_NEPBS0_NLCA1_NLCB1_ONLL1_PGR2_PLR1_PKA0_SIA1_SS1_SU32_SUM1_SUS256_SPO0_SRVW0_SSO0_SVW1_SK0_SKFTR0_SKXCCM0_TLDS1_ULSGRO0_USL1_UIOFGRO0_USFGROn1_VSn1_VWA1_VWB1_WSGRA0_WSGRB0_WS32_WG32_4_1_WGM8_WGMXCC1_WGMXCCGn1
    SolutionIndex: 20
    SolutionNameMin: Cijk_Alik_Bljk_BBS_BH_Bias_HA_S_SAV_UserArgs_MT32x64x128_MI16x16x1_SN_LDSB0_AFC1_AG0_AFEM1_AFEM1_ASEM1_CLR0_CADS0_DTLA0_DTLB0_DTVA0_DTVB0_EPS0_FDSI0_GRPM1_GRVWA8_GRVWB8_GSU1_GSUAMB_GSUC0_GSUWGMRR0_GLS0_ISA1100_IU1_K1_LDSTI0_LBSPPA256_LBSPPB256_LBSPPM0_LPA8_LPB8_LPM0_LRVW16_LWPMn1_MIAV1_MIWT2_1_MO40_NTn1_NTA0_NTB0_NTC0_NTD0_NTM0_NEPBS0_NLCA1_NLCB1_ONLL1_PGR2_PLR1_PKA0_SIA1_SS1_SU32_SUM1_SUS256_SPO0_SRVW0_SSO0_SVW1_SK0_SKFTR0_SKXCCM0_TLDS1_ULSGRO0_USL1_UIOFGRO0_USFGROn1_VSn1_VWA1_VWB1_WSGRA0_WSGRB0_WS32_WG16_8_1_WGM8_WGMXCC1_WGMXCCGn1
    SolutionIndex: 21
    SolutionNameMin: Cijk_Alik_Bljk_BBS_BH_Bias_HA_S_SAV_UserArgs_MT64x32x32_MI16x16x1_SN_LDSB0_AFC1_AG0_AFEM1_AFEM1_ASEM1_CLR0_CADS0_DTLA0_DTLB0_DTVA0_DTVB0_EPS0_FDSI0_GRPM1_GRVWA8_GRVWB8_GSU1_GSUAMB_GSUC0_GSUWGMRR0_GLS0_ISA1100_IU1_K1_LDSTI0_LBSPPA128_LBSPPB128_LBSPPM0_LPA8_LPB8_LPM0_LRVW16_LWPMn1_MIAV1_MIWT2_1_MO40_NTn1_NTA0_NTB0_NTC0_NTD0_NTM0_NEPBS0_NLCA1_NLCB1_ONLL1_PGR2_PLR1_PKA0_SIA1_SS1_SU32_SUM1_SUS256_SPO0_SRVW0_SSO0_SVW1_SK0_SKFTR0_SKXCCM0_TLDS1_ULSGRO0_USL1_UIOFGRO0_USFGROn1_VSn1_VWA1_VWB1_WSGRA0_WSGRB0_WS32_WG32_4_1_WGM8_WGMXCC1_WGMXCCGn1
    SolutionIndex: 22
    SolutionNameMin: Cijk_Alik_Bljk_BBS_BH_Bias_HA_S_SAV_UserArgs_MT64x32x64_MI16x16x1_SN_LDSB0_AFC1_AG0_AFEM1_AFEM1_ASEM1_CLR0_CADS0_DTLA0_DTLB0_DTVA0_DTVB0_EPS0_FDSI0_GRPM1_GRVWA8_GRVWB8_GSU1_GSUAMB_GSUC0_GSUWGMRR0_GLS0_ISA1100_IU1_K1_LDSTI0_LBSPPA128_LBSPPB128_LBSPPM0_LPA8_LPB8_LPM0_LRVW16_LWPMn1_MIAV1_MIWT2_1_MO40_NTn1_NTA0_NTB0_NTC0_NTD0_NTM0_NEPBS0_NLCA1_NLCB1_ONLL1_PGR1_PLR1_PKA0_SIA1_SS1_SU32_SUM1_SUS256_SPO0_SRVW0_SSO0_SVW1_SK0_SKFTR0_SKXCCM0_TLDS1_ULSGRO0_USL1_UIOFGRO0_USFGROn1_VSn1_VWA1_VWB1_WSGRA0_WSGRB0_WS32_WG32_4_1_WGM8_WGMXCC1_WGMXCCGn1
    SolutionIndex: 23
    SolutionNameMin: Cijk_Alik_Bljk_BBS_BH_Bias_HA_S_SAV_UserArgs_MT64x64x128_MI16x16x1_SN_LDSB1_AFC1_AG0_AFEM1_AFEM1_ASEM1_CLR0_CADS0_DTLA0_DTLB0_DTVA0_DTVB0_EPS0_FDSI0_GRPM1_GRVWA8_GRVWB8_GSU1_GSUAMB_GSUC0_GSUWGMRR0_GLS0_ISA1100_IU1_K1_LDSTI0_LBSPPA256_LBSPPB256_LBSPPM0_LPA8_LPB8_LPM0_LRVW16_LWPMn1_MIAV1_MIWT2_2_MO40_NTn1_NTA0_NTB0_NTC0_NTD0_NTM0_NEPBS0_NLCA1_NLCB1_ONLL1_PGR2_PLR1_PKA0_SIA3_SS1_SU32_SUM1_SUS256_SPO0_SRVW0_SSO0_SVW1_SK0_SKFTR0_SKXCCM0_TLDS1_ULSGRO0_USL1_UIOFGRO0_USFGROn1_VSn1_VWA1_VWB1_WSGRA0_WSGRB0_WS32_WG32_4_1_WGM8_WGMXCC1_WGMXCCGn1
    SolutionIndex: 24
    SolutionNameMin: Cijk_Alik_Bljk_BBS_BH_Bias_HA_S_SAV_UserArgs_MT64x64x32_MI16x16x1_SN_LDSB0_AFC1_AG0_AFEM1_AFEM1_ASEM1_CLR0_CADS0_DTLA0_DTLB0_DTVA0_DTVB0_EPS0_FDSI0_GRPM1_GRVWA8_GRVWB8_GSU1_GSUAMB_GSUC0_GSUWGMRR0_GLS0_ISA1100_IU1_K1_LDSTI0_LBSPPA128_LBSPPB128_LBSPPM0_LPA8_LPB8_LPM0_LRVW16_LWPMn1_MIAV1_MIWT2_2_MO40_NTn1_NTA0_NTB0_NTC0_NTD0_NTM0_NEPBS0_NLCA1_NLCB1_ONLL1_PGR2_PLR1_PKA0_SIA1_SS1_SU32_SUM1_SUS256_SPO0_SRVW0_SSO0_SVW1_SK0_SKFTR0_SKXCCM0_TLDS1_ULSGRO0_USL1_UIOFGRO0_USFGROn1_VSn1_VWA1_VWB1_WSGRA0_WSGRB0_WS32_WG32_4_1_WGM8_WGMXCC1_WGMXCCGn1
    SolutionIndex: 25
    SolutionNameMin: Cijk_Alik_Bljk_BBS_BH_Bias_HA_S_SAV_UserArgs_MT128x32x32_MI16x16x1_SN_LDSB0_AFC1_AG0_AFEM1_AFEM1_ASEM1_CLR0_CADS0_DTLA0_DTLB0_DTVA0_DTVB0_EPS0_FDSI0_GRPM1_GRVWA8_GRVWB8_GSU1_GSUAMB_GSUC0_GSUWGMRR0_GLS0_ISA1100_IU1_K1_LDSTI0_LBSPPA128_LBSPPB128_LBSPPM0_LPA8_LPB8_LPM0_LRVW16_LWPMn1_MIAV1_MIWT2_2_MO40_NTn1_NTA0_NTB0_NTC0_NTD0_NTM0_NEPBS0_NLCA1_NLCB1_ONLL1_PGR1_PLR1_PKA0_SIA3_SS1_SU32_SUM1_SUS256_SPO0_SRVW0_SSO0_SVW1_SK0_SKFTR0_SKXCCM0_TLDS1_ULSGRO0_USL1_UIOFGRO0_USFGROn1_VSn1_VWA1_VWB1_WSGRA0_WSGRB0_WS32_WG64_2_1_WGM8_WGMXCC1_WGMXCCGn1
    SolutionIndex: 26
    SolutionNameMin: Cijk_Alik_Bljk_BBS_BH_Bias_HA_S_SAV_UserArgs_MT64x64x64_MI16x16x1_SN_LDSB1_AFC1_AG0_AFEM1_AFEM1_ASEM1_CLR0_CADS0_DTLA0_DTLB0_DTVA0_DTVB0_EPS0_FDSI0_GRPM1_GRVWA8_GRVWB8_GSU1_GSUAMB_GSUC0_GSUWGMRR0_GLS0_ISA1100_IU1_K1_LDSTI0_LBSPPA128_LBSPPB128_LBSPPM0_LPA8_LPB8_LPM0_LRVW16_LWPMn1_MIAV1_MIWT2_2_MO40_NTn1_NTA0_NTB0_NTC0_NTD0_NTM0_NEPBS0_NLCA1_NLCB1_ONLL1_PGR1_PLR1_PKA0_SIA3_SS1_SU32_SUM1_SUS256_SPO0_SRVW0_SSO0_SVW1_SK0_SKFTR0_SKXCCM0_TLDS1_ULSGRO0_USL1_UIOFGRO0_USFGROn1_VSn1_VWA1_VWB1_WSGRA0_WSGRB0_WS32_WG32_4_1_WGM8_WGMXCC1_WGMXCCGn1
    SolutionIndex: 27
    SolutionNameMin: Cijk_Alik_Bljk_BBS_BH_Bias_HA_S_SAV_UserArgs_MT64x64x32_MI16x16x1_SN_LDSB0_AFC1_AG0_AFEM1_AFEM1_ASEM1_CLR0_CADS0_DTLA0_DTLB0_DTVA0_DTVB0_EPS0_FDSI0_GRPM1_GRVWA8_GRVWB8_GSU1_GSUAMB_GSUC0_GSUWGMRR0_GLS0_ISA1100_IU1_K1_LDSTI0_LBSPPA128_LBSPPB128_LBSPPM0_LPA8_LPB8_LPM0_LRVW16_LWPMn1_MIAV1_MIWT2_2_MO40_NTn1_NTA0_NTB0_NTC0_NTD0_NTM0_NEPBS0_NLCA1_NLCB1_ONLL1_PGR2_PLR0_PKA0_SIA3_SS1_SU32_SUM1_SUS256_SPO0_SRVW0_SSO0_SVW1_SK0_SKFTR0_SKXCCM0_TLDS1_ULSGRO0_USL1_UIOFGRO0_USFGROn1_VSn1_VWA1_VWB1_WSGRA0_WSGRB0_WS32_WG32_4_1_WGM8_WGMXCC1_WGMXCCGn1
    SolutionIndex: 28
    SolutionNameMin: Cijk_Alik_Bljk_BBS_BH_Bias_HA_S_SAV_UserArgs_MT128x64x32_MI16x16x1_SN_LDSB0_AFC1_AG0_AFEM1_AFEM1_ASEM1_CLR0_CADS0_DTLA0_DTLB0_DTVA0_DTVB0_EPS0_FDSI0_GRPM1_GRVWA8_GRVWB8_GSU1_GSUAMB_GSUC0_GSUWGMRR0_GLS0_ISA1100_IU1_K1_LDSTI0_LBSPPA128_LBSPPB128_LBSPPM0_LPA8_LPB8_LPM0_LRVW16_LWPMn1_MIAV1_MIWT4_2_MO40_NTn1_NTA0_NTB0_NTC0_NTD0_NTM0_NEPBS0_NLCA1_NLCB1_ONLL1_PGR2_PLR0_PKA0_SIA1_SS1_SU32_SUM1_SUS256_SPO0_SRVW0_SSO0_SVW1_SK0_SKFTR0_SKXCCM0_TLDS1_ULSGRO0_USL1_UIOFGRO0_USFGROn1_VSn1_VWA1_VWB1_WSGRA0_WSGRB0_WS32_WG32_4_1_WGM8_WGMXCC1_WGMXCCGn1
    SolutionIndex: 31
    SolutionNameMin: Cijk_Alik_Bljk_BBS_BH_Bias_HA_S_SAV_UserArgs_MT64x128x32_MI16x16x1_SN_LDSB0_AFC1_AG0_AFEM1_AFEM1_ASEM1_CLR0_CADS0_DTLA0_DTLB0_DTVA0_DTVB0_EPS0_FDSI0_GRPM1_GRVWA8_GRVWB8_GSU1_GSUAMB_GSUC0_GSUWGMRR0_GLS0_ISA1100_IU1_K1_LDSTI0_LBSPPA128_LBSPPB128_LBSPPM0_LPA8_LPB8_LPM0_LRVW16_LWPMn1_MIAV1_MIWT2_4_MO40_NTn1_NTA0_NTB0_NTC0_NTD0_NTM0_NEPBS0_NLCA1_NLCB1_ONLL1_PGR2_PLR1_PKA0_SIA1_SS1_SU32_SUM1_SUS256_SPO0_SRVW0_SSO0_SVW1_SK0_SKFTR0_SKXCCM0_TLDS1_ULSGRO0_USL1_UIOFGRO0_USFGROn1_VSn1_VWA1_VWB1_WSGRA0_WSGRB0_WS32_WG32_4_1_WGM8_WGMXCC1_WGMXCCGn1
    SolutionIndex: 32
    SolutionNameMin: Cijk_Alik_Bljk_BBS_BH_Bias_HA_S_SAV_UserArgs_MT128x64x32_MI16x16x1_SN_LDSB0_AFC1_AG0_AFEM1_AFEM1_ASEM1_CLR0_CADS0_DTLA0_DTLB0_DTVA0_DTVB0_EPS0_FDSI0_GRPM1_GRVWA8_GRVWB8_GSU1_GSUAMB_GSUC0_GSUWGMRR0_GLS0_ISA1100_IU1_K1_LDSTI0_LBSPPA128_LBSPPB128_LBSPPM0_LPA8_LPB8_LPM0_LRVW16_LWPMn1_MIAV1_MIWT2_4_MO40_NTn1_NTA0_NTB0_NTC0_NTD0_NTM0_NEPBS0_NLCA1_NLCB1_ONLL1_PGR2_PLR1_PKA0_SIA3_SS1_SU32_SUM1_SUS256_SPO0_SRVW0_SSO0_SVW1_SK0_SKFTR0_SKXCCM0_TLDS1_ULSGRO0_USL1_UIOFGRO0_USFGROn1_VSn1_VWA1_VWB1_WSGRA0_WSGRB0_WS32_WG64_2_1_WGM8_WGMXCC1_WGMXCCGn1
    SolutionIndex: 33
    SolutionNameMin: Cijk_Alik_Bljk_BBS_BH_Bias_HA_S_SAV_UserArgs_MT128x64x32_MI16x16x1_SN_LDSB0_AFC1_AG0_AFEM1_AFEM1_ASEM1_CLR0_CADS0_DTLA0_DTLB0_DTVA0_DTVB0_EPS0_FDSI0_GRPM1_GRVWA8_GRVWB8_GSU1_GSUAMB_GSUC0_GSUWGMRR0_GLS0_ISA1100_IU1_K1_LDSTI0_LBSPPA128_LBSPPB128_LBSPPM0_LPA8_LPB8_LPM0_LRVW16_LWPMn1_MIAV1_MIWT4_2_MO40_NTn1_NTA0_NTB0_NTC0_NTD0_NTM0_NEPBS0_NLCA1_NLCB1_ONLL1_PGR2_PLR1_PKA0_SIA3_SS1_SU32_SUM1_SUS256_SPO0_SRVW0_SSO0_SVW1_SK0_SKFTR0_SKXCCM0_TLDS1_ULSGRO0_USL1_UIOFGRO0_USFGROn1_VSn1_VWA1_VWB1_WSGRA0_WSGRB0_WS32_WG32_4_1_WGM8_WGMXCC1_WGMXCCGn1
    SolutionIndex: 34
    SolutionNameMin: Cijk_Alik_Bljk_BBS_BH_Bias_HA_S_SAV_UserArgs_MT128x64x64_MI16x16x1_SN_LDSB1_AFC1_AG0_AFEM1_AFEM1_ASEM1_CLR0_CADS0_DTLA0_DTLB0_DTVA0_DTVB0_EPS0_FDSI0_GRPM1_GRVWA8_GRVWB8_GSU1_GSUAMB_GSUC0_GSUWGMRR0_GLS0_ISA1100_IU1_K1_LDSTI0_LBSPPA128_LBSPPB128_LBSPPM0_LPA8_LPB8_LPM0_LRVW16_LWPMn1_MIAV1_MIWT2_4_MO40_NTn1_NTA0_NTB0_NTC0_NTD0_NTM0_NEPBS0_NLCA1_NLCB1_ONLL1_PGR2_PLR1_PKA0_SIA3_SS1_SU32_SUM1_SUS256_SPO0_SRVW0_SSO0_SVW1_SK0_SKFTR0_SKXCCM0_TLDS1_ULSGRO0_USL1_UIOFGRO0_USFGROn1_VSn1_VWA1_VWB1_WSGRA0_WSGRB0_WS32_WG64_2_1_WGM8_WGMXCC1_WGMXCCGn1
    SolutionIndex: 35
    SolutionNameMin: Cijk_Alik_Bljk_BBS_BH_Bias_HA_S_SAV_UserArgs_MT64x128x32_MI16x16x1_SN_LDSB0_AFC1_AG0_AFEM1_AFEM1_ASEM1_CLR0_CADS0_DTLA0_DTLB0_DTVA0_DTVB0_EPS0_FDSI0_GRPM1_GRVWA8_GRVWB8_GSU1_GSUAMB_GSUC0_GSUWGMRR0_GLS0_ISA1100_IU1_K1_LDSTI0_LBSPPA128_LBSPPB128_LBSPPM0_LPA8_LPB8_LPM0_LRVW16_LWPMn1_MIAV1_MIWT2_4_MO40_NTn1_NTA0_NTB0_NTC0_NTD0_NTM0_NEPBS0_NLCA1_NLCB1_ONLL1_PGR1_PLR0_PKA0_SIA3_SS1_SU32_SUM1_SUS256_SPO0_SRVW0_SSO0_SVW1_SK0_SKFTR0_SKXCCM0_TLDS1_ULSGRO0_USL1_UIOFGRO0_USFGROn1_VSn1_VWA1_VWB1_WSGRA0_WSGRB0_WS32_WG32_4_1_WGM8_WGMXCC1_WGMXCCGn1
    SolutionIndex: 36
    SolutionNameMin: Cijk_Alik_Bljk_BBS_BH_Bias_HA_S_SAV_UserArgs_MT64x128x32_MI16x16x1_SN_LDSB0_AFC1_AG0_AFEM1_AFEM1_ASEM1_CLR0_CADS0_DTLA0_DTLB0_DTVA0_DTVB0_EPS0_FDSI0_GRPM1_GRVWA8_GRVWB8_GSU1_GSUAMB_GSUC0_GSUWGMRR0_GLS0_ISA1100_IU1_K1_LDSTI0_LBSPPA128_LBSPPB128_LBSPPM0_LPA8_LPB8_LPM0_LRVW16_LWPMn1_MIAV1_MIWT4_2_MO40_NTn1_NTA0_NTB0_NTC0_NTD0_NTM0_NEPBS0_NLCA1_NLCB1_ONLL1_PGR2_PLR1_PKA0_SIA3_SS1_SU32_SUM1_SUS256_SPO0_SRVW0_SSO0_SVW1_SK0_SKFTR0_SKXCCM0_TLDS1_ULSGRO0_USL1_UIOFGRO0_USFGROn1_VSn1_VWA1_VWB1_WSGRA0_WSGRB0_WS32_WG16_8_1_WGM8_WGMXCC1_WGMXCCGn1
    SolutionIndex: 37
    SolutionNameMin: Cijk_Alik_Bljk_BBS_BH_Bias_HA_S_SAV_UserArgs_MT128x128x32_MI16x16x1_SN_LDSB0_AFC1_AG0_AFEM1_AFEM1_ASEM1_CLR0_CADS0_DTLA0_DTLB0_DTVA0_DTVB0_EPS0_FDSI0_GRPM1_GRVWA8_GRVWB8_GSU1_GSUAMB_GSUC0_GSUWGMRR0_GLS0_ISA1100_IU1_K1_LDSTI0_LBSPPA128_LBSPPB128_LBSPPM0_LPA8_LPB8_LPM0_LRVW16_LWPMn1_MIAV1_MIWT2_8_MO40_NTn1_NTA0_NTB0_NTC0_NTD0_NTM0_NEPBS0_NLCA1_NLCB1_ONLL1_PGR0_PLR0_PKA0_SIA3_SS1_SU32_SUM1_SUS256_SPO0_SRVW0_SSO0_SVW1_SK0_SKFTR0_SKXCCM0_TLDS1_ULSGRO0_USL1_UIOFGRO0_USFGROn1_VSn1_VWA1_VWB1_WSGRA0_WSGRB0_WS32_WG64_2_1_WGM8_WGMXCC1_WGMXCCGn1
    SolutionIndex: 38
    SolutionNameMin: Cijk_Alik_Bljk_BBS_BH_Bias_HA_S_SAV_UserArgs_MT128x128x32_MI16x16x1_SN_LDSB0_AFC1_AG0_AFEM1_AFEM1_ASEM1_CLR0_CADS0_DTLA0_DTLB0_DTVA0_DTVB0_EPS0_FDSI0_GRPM1_GRVWA8_GRVWB8_GSU1_GSUAMB_GSUC0_GSUWGMRR0_GLS0_ISA1100_IU1_K1_LDSTI0_LBSPPA128_LBSPPB128_LBSPPM0_LPA8_LPB8_LPM0_LRVW16_LWPMn1_MIAV1_MIWT4_4_MO40_NTn1_NTA0_NTB0_NTC0_NTD0_NTM0_NEPBS0_NLCA1_NLCB1_ONLL1_PGR0_PLR0_PKA0_SIA1_SS1_SU32_SUM1_SUS256_SPO0_SRVW0_SSO0_SVW1_SK0_SKFTR0_SKXCCM0_TLDS1_ULSGRO0_USL1_UIOFGRO0_USFGROn1_VSn1_VWA1_VWB1_WSGRA0_WSGRB0_WS32_WG32_4_1_WGM8_WGMXCC1_WGMXCCGn1
    SolutionIndex: 39
    SolutionNameMin: Cijk_Alik_Bljk_BBS_BH_Bias_HA_S_SAV_UserArgs_MT64x32x32_MI16x16x1_SN_LDSB0_AFC1_AG0_AFEM1_AFEM1_ASEM1_CLR0_CADS0_DTLA0_DTLB0_DTVA0_DTVB0_EPS0_FDSI0_GRPM1_GRVWA8_GRVWB8_GSU1_GSUAMB_GSUC0_GSUWGMRR0_GLS0_ISA1100_IU1_K1_LDSTI0_LBSPPA128_LBSPPB128_LBSPPM0_LPA8_LPB8_LPM0_LRVW16_LWPMn1_MIAV1_MIWT2_1_MO40_NTn1_NTA0_NTB0_NTC0_NTD0_NTM0_NEPBS0_NLCA1_NLCB1_ONLL1_PGR1_PLR1_PKA0_SIA1_SS1_SU32_SUM1_SUS256_SPO0_SRVW0_SSO0_SVW1_SK0_SKFTR0_SKXCCM0_TLDS1_ULSGRO0_USL1_UIOFGRO0_USFGROn1_VSn1_VWA1_VWB1_WSGRA0_WSGRB0_WS32_WG32_4_1_WGM8_WGMXCC1_WGMXCCGn1
    SolutionIndex: 40
    SolutionNameMin: Cijk_Alik_Bljk_BBS_BH_Bias_HA_S_SAV_UserArgs_MT64x32x64_MI16x16x1_SN_LDSB0_AFC1_AG0_AFEM1_AFEM1_ASEM1_CLR0_CADS0_DTLA0_DTLB0_DTVA0_DTVB0_EPS0_FDSI0_GRPM1_GRVWA8_GRVWB8_GSU1_GSUAMB_GSUC0_GSUWGMRR0_GLS0_ISA1100_IU1_K1_LDSTI0_LBSPPA128_LBSPPB128_LBSPPM0_LPA8_LPB8_LPM0_LRVW16_LWPMn1_MIAV1_MIWT2_1_MO40_NTn1_NTA0_NTB0_NTC0_NTD0_NTM0_NEPBS0_NLCA1_NLCB1_ONLL1_PGR2_PLR1_PKA0_SIA1_SS1_SU32_SUM1_SUS256_SPO0_SRVW0_SSO0_SVW1_SK0_SKFTR0_SKXCCM0_TLDS1_ULSGRO0_USL1_UIOFGRO0_USFGROn1_VSn1_VWA1_VWB1_WSGRA0_WSGRB0_WS32_WG32_4_1_WGM8_WGMXCC1_WGMXCCGn1
    SolutionIndex: 41
    SolutionNameMin: Cijk_Alik_Bljk_BBS_BH_Bias_HA_S_SAV_UserArgs_MT64x64x32_MI16x16x1_SN_LDSB0_AFC1_AG0_AFEM1_AFEM1_ASEM1_CLR0_CADS0_DTLA0_DTLB0_DTVA0_DTVB0_EPS0_FDSI0_GRPM1_GRVWA8_GRVWB8_GSU1_GSUAMB_GSUC0_GSUWGMRR0_GLS0_ISA1100_IU1_K1_LDSTI0_LBSPPA128_LBSPPB128_LBSPPM0_LPA8_LPB8_LPM0_LRVW16_LWPMn1_MIAV1_MIWT2_2_MO40_NTn1_NTA0_NTB0_NTC0_NTD0_NTM0_NEPBS0_NLCA1_NLCB1_ONLL1_PGR2_PLR1_PKA0_SIA3_SS1_SU32_SUM1_SUS256_SPO0_SRVW0_SSO0_SVW1_SK0_SKFTR0_SKXCCM0_TLDS1_ULSGRO0_USL1_UIOFGRO0_USFGROn1_VSn1_VWA1_VWB1_WSGRA0_WSGRB0_WS32_WG32_4_1_WGM8_WGMXCC1_WGMXCCGn1
    SolutionIndex: 42
    SolutionNameMin: Cijk_Alik_Bljk_BBS_BH_Bias_HA_S_SAV_UserArgs_MT64x64x32_MI16x16x1_SN_LDSB0_AFC1_AG0_AFEM1_AFEM1_ASEM1_CLR0_CADS0_DTLA0_DTLB0_DTVA0_DTVB0_EPS0_FDSI0_GRPM1_GRVWA8_GRVWB8_GSU1_GSUAMB_GSUC0_GSUWGMRR0_GLS0_ISA1100_IU1_K1_LDSTI0_LBSPPA128_LBSPPB128_LBSPPM0_LPA8_LPB8_LPM0_LRVW16_LWPMn1_MIAV1_MIWT2_2_MO40_NTn1_NTA0_NTB0_NTC0_NTD0_NTM0_NEPBS0_NLCA1_NLCB1_ONLL1_PGR2_PLR0_PKA0_SIA1_SS1_SU32_SUM1_SUS256_SPO0_SRVW0_SSO0_SVW1_SK0_SKFTR0_SKXCCM0_TLDS1_ULSGRO0_USL1_UIOFGRO0_USFGROn1_VSn1_VWA1_VWB1_WSGRA0_WSGRB0_WS32_WG32_4_1_WGM8_WGMXCC1_WGMXCCGn1
    SolutionIndex: 43
    SolutionNameMin: Cijk_Alik_Bljk_BBS_BH_Bias_HA_S_SAV_UserArgs_MT64x64x64_MI16x16x1_SN_LDSB1_AFC1_AG0_AFEM1_AFEM1_ASEM1_CLR0_CADS0_DTLA0_DTLB0_DTVA0_DTVB0_EPS0_FDSI0_GRPM1_GRVWA8_GRVWB8_GSU1_GSUAMB_GSUC0_GSUWGMRR0_GLS0_ISA1100_IU1_K1_LDSTI0_LBSPPA128_LBSPPB128_LBSPPM0_LPA8_LPB8_LPM0_LRVW16_LWPMn1_MIAV1_MIWT2_2_MO40_NTn1_NTA0_NTB0_NTC0_NTD0_NTM0_NEPBS0_NLCA1_NLCB1_ONLL1_PGR2_PLR1_PKA0_SIA3_SS1_SU32_SUM1_SUS256_SPO0_SRVW0_SSO0_SVW1_SK0_SKFTR0_SKXCCM0_TLDS1_ULSGRO0_USL1_UIOFGRO0_USFGROn1_VSn1_VWA1_VWB1_WSGRA0_WSGRB0_WS32_WG32_4_1_WGM8_WGMXCC1_WGMXCCGn1
    SolutionIndex: 44
    SolutionNameMin: Cijk_Alik_Bljk_BBS_BH_Bias_HA_S_SAV_UserArgs_MT64x32x32_MI16x16x1_SN_LDSB1_AFC1_AG0_AFEM1_AFEM1_ASEM1_CLR0_CADS0_DTLA0_DTLB0_DTVA0_DTVB0_EPS0_FDSI0_GRPM1_GRVWA8_GRVWB8_GSU1_GSUAMB_GSUC0_GSUWGMRR0_GLS0_ISA1100_IU1_K1_LDSTI0_LBSPPA128_LBSPPB128_LBSPPM0_LPA8_LPB8_LPM0_LRVW16_LWPMn1_MIAV1_MIWT2_1_MO40_NTn1_NTA0_NTB0_NTC0_NTD0_NTM0_NEPBS0_NLCA1_NLCB1_ONLL1_PGR2_PLR1_PKA0_SIA3_SS1_SU32_SUM1_SUS256_SPO0_SRVW0_SSO0_SVW1_SK0_SKFTR0_SKXCCM0_TLDS1_ULSGRO0_USL1_UIOFGRO0_USFGROn1_VSn1_VWA1_VWB1_WSGRA0_WSGRB0_WS32_WG32_4_1_WGM8_WGMXCC1_WGMXCCGn1
    SolutionIndex: 45
    SolutionNameMin: Cijk_Alik_Bljk_BBS_BH_Bias_HA_S_SAV_UserArgs_MT32x128x64_MI16x16x1_SN_LDSB0_AFC1_AG0_AFEM1_AFEM1_ASEM1_CLR0_CADS0_DTLA0_DTLB0_DTVA0_DTVB0_EPS0_FDSI0_GRPM1_GRVWA8_GRVWB8_GSU1_GSUAMB_GSUC0_GSUWGMRR0_GLS0_ISA1100_IU1_K1_LDSTI0_LBSPPA128_LBSPPB128_LBSPPM0_LPA8_LPB8_LPM0_LRVW16_LWPMn1_MIAV1_MIWT2_2_MO40_NTn1_NTA0_NTB0_NTC0_NTD0_NTM0_NEPBS0_NLCA1_NLCB1_ONLL1_PGR2_PLR1_PKA0_SIA1_SS1_SU32_SUM1_SUS256_SPO0_SRVW0_SSO0_SVW1_SK0_SKFTR0_SKXCCM0_TLDS1_ULSGRO0_USL1_UIOFGRO0_USFGROn1_VSn1_VWA1_VWB1_WSGRA0_WSGRB0_WS32_WG16_8_1_WGM8_WGMXCC1_WGMXCCGn1
    SolutionIndex: 46
    SolutionNameMin: Cijk_Alik_Bljk_BBS_BH_Bias_HA_S_SAV_UserArgs_MT32x128x32_MI16x16x1_SN_LDSB0_AFC1_AG0_AFEM1_AFEM1_ASEM1_CLR0_CADS0_DTLA0_DTLB0_DTVA0_DTVB0_EPS0_FDSI0_GRPM1_GRVWA8_GRVWB8_GSU1_GSUAMB_GSUC0_GSUWGMRR0_GLS0_ISA1100_IU1_K1_LDSTI0_LBSPPA128_LBSPPB128_LBSPPM0_LPA8_LPB8_LPM0_LRVW16_LWPMn1_MIAV1_MIWT2_2_MO40_NTn1_NTA0_NTB0_NTC0_NTD0_NTM0_NEPBS0_NLCA1_NLCB1_ONLL1_PGR2_PLR1_PKA0_SIA3_SS1_SU32_SUM1_SUS256_SPO0_SRVW0_SSO0_SVW1_SK0_SKFTR0_SKXCCM0_TLDS1_ULSGRO0_USL1_UIOFGRO0_USFGROn1_VSn1_VWA1_VWB1_WSGRA0_WSGRB0_WS32_WG16_8_1_WGM8_WGMXCC1_WGMXCCGn1
    SolutionIndex: 47
    SolutionNameMin: Cijk_Alik_Bljk_BBS_BH_Bias_HA_S_SAV_UserArgs_MT64x64x32_MI16x16x1_SN_LDSB0_AFC1_AG0_AFEM1_AFEM1_ASEM1_CLR0_CADS0_DTLA0_DTLB0_DTVA0_DTVB0_EPS0_FDSI0_GRPM1_GRVWA8_GRVWB8_GSU1_GSUAMB_GSUC0_GSUWGMRR0_GLS0_ISA1100_IU1_K1_LDSTI0_LBSPPA128_LBSPPB128_LBSPPM0_LPA8_LPB8_LPM0_LRVW16_LWPMn1_MIAV1_MIWT2_2_MO40_NTn1_NTA0_NTB0_NTC0_NTD0_NTM0_NEPBS0_NLCA1_NLCB1_ONLL1_PGR1_PLR1_PKA0_SIA3_SS1_SU32_SUM1_SUS256_SPO0_SRVW0_SSO0_SVW1_SK0_SKFTR0_SKXCCM0_TLDS1_ULSGRO0_USL1_UIOFGRO0_USFGROn1_VSn1_VWA1_VWB1_WSGRA0_WSGRB0_WS32_WG32_4_1_WGM8_WGMXCC1_WGMXCCGn1
    SolutionIndex: 49
    SolutionNameMin: Cijk_Alik_Bljk_BBS_BH_Bias_HA_S_SAV_UserArgs_MT128x64x32_MI16x16x1_SN_LDSB1_AFC1_AG0_AFEM1_AFEM1_ASEM1_CLR0_CADS0_DTLA0_DTLB0_DTVA0_DTVB0_EPS0_FDSI0_GRPM1_GRVWA8_GRVWB8_GSU1_GSUAMB_GSUC0_GSUWGMRR0_GLS0_ISA1100_IU1_K1_LDSTI0_LBSPPA128_LBSPPB128_LBSPPM0_LPA8_LPB8_LPM0_LRVW16_LWPMn1_MIAV1_MIWT4_2_MO40_NTn1_NTA0_NTB0_NTC0_NTD0_NTM0_NEPBS0_NLCA1_NLCB1_ONLL1_PGR2_PLR1_PKA0_SIA3_SS1_SU32_SUM1_SUS256_SPO0_SRVW0_SSO0_SVW1_SK0_SKFTR0_SKXCCM0_TLDS1_ULSGRO0_USL1_UIOFGRO0_USFGROn1_VSn1_VWA1_VWB1_WSGRA0_WSGRB0_WS32_WG32_4_1_WGM8_WGMXCC1_WGMXCCGn1
    SolutionIndex: 50
    SolutionNameMin: Cijk_Alik_Bljk_BBS_BH_Bias_HA_S_SAV_UserArgs_MT64x128x32_MI16x16x1_SN_LDSB0_AFC1_AG0_AFEM1_AFEM1_ASEM1_CLR0_CADS0_DTLA0_DTLB0_DTVA0_DTVB0_EPS0_FDSI0_GRPM1_GRVWA8_GRVWB8_GSU1_GSUAMB_GSUC0_GSUWGMRR0_GLS0_ISA1100_IU1_K1_LDSTI0_LBSPPA128_LBSPPB128_LBSPPM0_LPA8_LPB8_LPM0_LRVW16_LWPMn1_MIAV1_MIWT2_4_MO40_NTn1_NTA0_NTB0_NTC0_NTD0_NTM0_NEPBS0_NLCA1_NLCB1_ONLL1_PGR2_PLR1_PKA0_SIA3_SS1_SU32_SUM1_SUS256_SPO0_SRVW0_SSO0_SVW1_SK0_SKFTR0_SKXCCM0_TLDS1_ULSGRO0_USL1_UIOFGRO0_USFGROn1_VSn1_VWA1_VWB1_WSGRA0_WSGRB0_WS32_WG32_4_1_WGM8_WGMXCC1_WGMXCCGn1
    SolutionIndex: 51
    SolutionNameMin: Cijk_Alik_Bljk_BBS_BH_Bias_HA_S_SAV_UserArgs_MT64x128x64_MI16x16x1_SN_LDSB1_AFC1_AG0_AFEM1_AFEM1_ASEM1_CLR0_CADS0_DTLA0_DTLB0_DTVA0_DTVB0_EPS0_FDSI0_GRPM1_GRVWA8_GRVWB8_GSU1_GSUAMB_GSUC0_GSUWGMRR0_GLS0_ISA1100_IU1_K1_LDSTI0_LBSPPA128_LBSPPB128_LBSPPM0_LPA8_LPB8_LPM0_LRVW16_LWPMn1_MIAV1_MIWT4_2_MO40_NTn1_NTA0_NTB0_NTC0_NTD0_NTM0_NEPBS0_NLCA1_NLCB1_ONLL1_PGR1_PLR1_PKA0_SIA3_SS1_SU32_SUM1_SUS256_SPO0_SRVW0_SSO0_SVW1_SK0_SKFTR0_SKXCCM0_TLDS1_ULSGRO0_USL1_UIOFGRO0_USFGROn1_VSn1_VWA1_VWB1_WSGRA0_WSGRB0_WS32_WG16_8_1_WGM8_WGMXCC1_WGMXCCGn1
    SolutionIndex: 53
    SolutionNameMin: Cijk_Alik_Bljk_BBS_BH_Bias_HA_S_SAV_UserArgs_MT128x128x32_MI16x16x1_SN_LDSB0_AFC1_AG0_AFEM1_AFEM1_ASEM1_CLR0_CADS0_DTLA0_DTLB0_DTVA0_DTVB0_EPS0_FDSI0_GRPM1_GRVWA8_GRVWB8_GSU1_GSUAMB_GSUC0_GSUWGMRR0_GLS0_ISA1100_IU1_K1_LDSTI0_LBSPPA128_LBSPPB128_LBSPPM0_LPA8_LPB8_LPM0_LRVW16_LWPMn1_MIAV1_MIWT2_8_MO40_NTn1_NTA0_NTB0_NTC0_NTD0_NTM0_NEPBS0_NLCA1_NLCB1_ONLL1_PGR0_PLR0_PKA0_SIA1_SS1_SU32_SUM1_SUS256_SPO0_SRVW0_SSO0_SVW1_SK0_SKFTR0_SKXCCM0_TLDS1_ULSGRO0_USL1_UIOFGRO0_USFGROn1_VSn1_VWA1_VWB1_WSGRA0_WSGRB0_WS32_WG64_2_1_WGM8_WGMXCC1_WGMXCCGn1
    SolutionIndex: 54
    SolutionNameMin: Cijk_Alik_Bljk_BBS_BH_Bias_HA_S_SAV_UserArgs_MT32x128x64_MI16x16x1_SN_LDSB1_AFC1_AG0_AFEM1_AFEM1_ASEM1_CLR0_CADS0_DTLA0_DTLB0_DTVA0_DTVB0_EPS0_FDSI0_GRPM1_GRVWA8_GRVWB8_GSU1_GSUAMB_GSUC0_GSUWGMRR0_GLS0_ISA1100_IU1_K1_LDSTI0_LBSPPA128_LBSPPB128_LBSPPM0_LPA8_LPB8_LPM0_LRVW16_LWPMn1_MIAV1_MIWT2_2_MO40_NTn1_NTA0_NTB0_NTC0_NTD0_NTM0_NEPBS0_NLCA1_NLCB1_ONLL1_PGR2_PLR1_PKA0_SIA3_SS1_SU32_SUM1_SUS256_SPO0_SRVW0_SSO0_SVW1_SK0_SKFTR0_SKXCCM0_TLDS1_ULSGRO0_USL1_UIOFGRO0_USFGROn1_VSn1_VWA1_VWB1_WSGRA0_WSGRB0_WS32_WG16_8_1_WGM8_WGMXCC1_WGMXCCGn1
    SolutionIndex: 55
    SolutionNameMin: Cijk_Alik_Bljk_BBS_BH_Bias_HA_S_SAV_UserArgs_MT128x64x32_MI16x16x1_SN_LDSB0_AFC1_AG0_AFEM1_AFEM1_ASEM1_CLR0_CADS0_DTLA0_DTLB0_DTVA0_DTVB0_EPS0_FDSI0_GRPM1_GRVWA8_GRVWB8_GSU1_GSUAMB_GSUC0_GSUWGMRR0_GLS0_ISA1100_IU1_K1_LDSTI0_LBSPPA128_LBSPPB128_LBSPPM0_LPA8_LPB8_LPM0_LRVW16_LWPMn1_MIAV1_MIWT2_4_MO40_NTn1_NTA0_NTB0_NTC0_NTD0_NTM0_NEPBS0_NLCA1_NLCB1_ONLL1_PGR2_PLR0_PKA0_SIA1_SS1_SU32_SUM1_SUS256_SPO0_SRVW0_SSO0_SVW1_SK0_SKFTR0_SKXCCM0_TLDS1_ULSGRO0_USL1_UIOFGRO0_USFGROn1_VSn1_VWA1_VWB1_WSGRA0_WSGRB0_WS32_WG64_2_1_WGM8_WGMXCC1_WGMXCCGn1
    SolutionIndex: 56
    SolutionNameMin: Cijk_Alik_Bljk_BBS_BH_Bias_HA_S_SAV_UserArgs_MT64x128x64_MI16x16x1_SN_LDSB0_AFC1_AG0_AFEM1_AFEM1_ASEM1_CLR0_CADS0_DTLA0_DTLB0_DTVA0_DTVB0_EPS0_FDSI0_GRPM1_GRVWA8_GRVWB8_GSU1_GSUAMB_GSUC0_GSUWGMRR0_GLS0_ISA1100_IU1_K1_LDSTI0_LBSPPA128_LBSPPB128_LBSPPM0_LPA8_LPB8_LPM0_LRVW16_LWPMn1_MIAV1_MIWT4_2_MO40_NTn1_NTA0_NTB0_NTC0_NTD0_NTM0_NEPBS0_NLCA1_NLCB1_ONLL1_PGR0_PLR1_PKA0_SIA3_SS1_SU32_SUM1_SUS256_SPO0_SRVW0_SSO0_SVW1_SK0_SKFTR0_SKXCCM0_TLDS1_ULSGRO0_USL1_UIOFGRO0_USFGROn1_VSn1_VWA1_VWB1_WSGRA0_WSGRB0_WS32_WG16_8_1_WGM8_WGMXCC1_WGMXCCGn1
    SolutionIndex: 57
    SolutionNameMin: Cijk_Alik_Bljk_BBS_BH_Bias_HA_S_SAV_UserArgs_MT64x128x64_MI16x16x1_SN_LDSB1_AFC1_AG0_AFEM1_AFEM1_ASEM1_CLR0_CADS0_DTLA0_DTLB0_DTVA0_DTVB0_EPS0_FDSI0_GRPM1_GRVWA8_GRVWB8_GSU1_GSUAMB_GSUC0_GSUWGMRR0_GLS0_ISA1100_IU1_K1_LDSTI0_LBSPPA128_LBSPPB128_LBSPPM0_LPA8_LPB8_LPM0_LRVW16_LWPMn1_MIAV1_MIWT2_4_MO40_NTn1_NTA0_NTB0_NTC0_NTD0_NTM0_NEPBS0_NLCA1_NLCB1_ONLL1_PGR2_PLR1_PKA0_SIA3_SS1_SU32_SUM1_SUS256_SPO0_SRVW0_SSO0_SVW1_SK0_SKFTR0_SKXCCM0_TLDS1_ULSGRO0_USL1_UIOFGRO0_USFGROn1_VSn1_VWA1_VWB1_WSGRA0_WSGRB0_WS32_WG32_4_1_WGM8_WGMXCC1_WGMXCCGn1
    SolutionIndex: 58
    SolutionNameMin: Cijk_Alik_Bljk_BBS_BH_Bias_HA_S_SAV_UserArgs_MT128x64x64_MI16x16x1_SN_LDSB1_AFC1_AG0_AFEM1_AFEM1_ASEM1_CLR0_CADS0_DTLA0_DTLB0_DTVA0_DTVB0_EPS0_FDSI0_GRPM1_GRVWA8_GRVWB8_GSU1_GSUAMB_GSUC0_GSUWGMRR0_GLS0_ISA1100_IU1_K1_LDSTI0_LBSPPA128_LBSPPB128_LBSPPM0_LPA8_LPB8_LPM0_LRVW16_LWPMn1_MIAV1_MIWT2_4_MO40_NTn1_NTA0_NTB0_NTC0_NTD0_NTM0_NEPBS0_NLCA1_NLCB1_ONLL1_PGR1_PLR1_PKA0_SIA3_SS1_SU32_SUM1_SUS256_SPO0_SRVW0_SSO0_SVW1_SK0_SKFTR0_SKXCCM0_TLDS1_ULSGRO0_USL1_UIOFGRO0_USFGROn1_VSn1_VWA1_VWB1_WSGRA0_WSGRB0_WS32_WG64_2_1_WGM8_WGMXCC1_WGMXCCGn1
    SolutionIndex: 59
    SolutionNameMin: Cijk_Alik_Bljk_BBS_BH_Bias_HA_S_SAV_UserArgs_MT128x64x64_MI16x16x1_SN_LDSB1_AFC1_AG0_AFEM1_AFEM1_ASEM1_CLR0_CADS0_DTLA0_DTLB0_DTVA0_DTVB0_EPS0_FDSI0_GRPM1_GRVWA8_GRVWB8_GSU1_GSUAMB_GSUC0_GSUWGMRR0_GLS0_ISA1100_IU1_K1_LDSTI0_LBSPPA128_LBSPPB128_LBSPPM0_LPA8_LPB8_LPM0_LRVW16_LWPMn1_MIAV1_MIWT4_2_MO40_NTn1_NTA0_NTB0_NTC0_NTD0_NTM0_NEPBS0_NLCA1_NLCB1_ONLL1_PGR1_PLR1_PKA0_SIA3_SS1_SU32_SUM1_SUS256_SPO0_SRVW0_SSO0_SVW1_SK0_SKFTR0_SKXCCM0_TLDS1_ULSGRO0_USL1_UIOFGRO0_USFGROn1_VSn1_VWA1_VWB1_WSGRA0_WSGRB0_WS32_WG32_4_1_WGM8_WGMXCC1_WGMXCCGn1
    SolutionIndex: 61
    SolutionNameMin: Cijk_Alik_Bljk_BBS_BH_Bias_HA_S_SAV_UserArgs_MT64x128x32_MI16x16x1_SN_LDSB0_AFC1_AG0_AFEM1_AFEM1_ASEM1_CLR0_CADS0_DTLA0_DTLB0_DTVA0_DTVB0_EPS0_FDSI0_GRPM1_GRVWA8_GRVWB8_GSU1_GSUAMB_GSUC0_GSUWGMRR0_GLS0_ISA1100_IU1_K1_LDSTI0_LBSPPA128_LBSPPB128_LBSPPM0_LPA8_LPB8_LPM0_LRVW16_LWPMn1_MIAV1_MIWT4_2_MO40_NTn1_NTA0_NTB0_NTC0_NTD0_NTM0_NEPBS0_NLCA1_NLCB1_ONLL1_PGR0_PLR0_PKA0_SIA3_SS1_SU32_SUM1_SUS256_SPO0_SRVW0_SSO0_SVW1_SK0_SKFTR0_SKXCCM0_TLDS1_ULSGRO0_USL1_UIOFGRO0_USFGROn1_VSn1_VWA1_VWB1_WSGRA0_WSGRB0_WS32_WG16_8_1_WGM8_WGMXCC1_WGMXCCGn1
    SolutionIndex: 62
    SolutionNameMin: Cijk_Alik_Bljk_BBS_BH_Bias_HA_S_SAV_UserArgs_MT32x32x128_MI16x16x1_SN_LDSB0_AFC1_AG0_AFEM1_AFEM1_ASEM1_CLR0_CADS0_DTLA0_DTLB0_DTVA0_DTVB0_EPS0_FDSI0_GRPM1_GRVWA8_GRVWB8_GSU1_GSUAMB_GSUC0_GSUWGMRR0_GLS0_ISA1100_IU1_K1_LDSTI0_LBSPPA256_LBSPPB256_LBSPPM0_LPA8_LPB8_LPM0_LRVW16_LWPMn1_MIAV1_MIWT1_1_MO40_NTn1_NTA0_NTB0_NTC0_NTD0_NTM0_NEPBS0_NLCA1_NLCB1_ONLL1_PGR2_PLR1_PKA0_SIA1_SS1_SU32_SUM1_SUS256_SPO0_SRVW0_SSO0_SVW1_SK0_SKFTR0_SKXCCM0_TLDS1_ULSGRO0_USL1_UIOFGRO0_USFGROn1_VSn1_VWA1_VWB1_WSGRA0_WSGRB0_WS32_WG32_4_1_WGM8_WGMXCC1_WGMXCCGn1
    SolutionIndex: 63
    SolutionNameMin: Cijk_Alik_Bljk_BBS_BH_Bias_HA_S_SAV_UserArgs_MT16x16x64_MI16x16x1_SN_LDSB0_AFC1_AG0_AFEM1_AFEM1_ASEM1_CLR0_CADS0_DTLA0_DTLB0_DTVA0_DTVB0_EPS0_FDSI0_GRPM1_GRVWA8_GRVWB8_GSU1_GSUAMB_GSUC0_GSUWGMRR0_GLS0_ISA1100_IU1_K1_LDSTI0_LBSPPA128_LBSPPB128_LBSPPM0_LPA8_LPB8_LPM0_LRVW16_LWPMn1_MIAV1_MIWT1_1_MO40_NTn1_NTA0_NTB0_NTC0_NTD0_NTM0_NEPBS0_NLCA1_NLCB1_ONLL1_PGR2_PLR1_PKA0_SIA3_SS1_SU32_SUM1_SUS256_SPO0_SRVW0_SSO0_SVW1_SK0_SKFTR0_SKXCCM0_TLDS1_ULSGRO0_USL1_UIOFGRO0_USFGROn1_VSn1_VWA1_VWB1_WSGRA0_WSGRB0_WS32_WG16_2_1_WGM8_WGMXCC1_WGMXCCGn1
    SolutionIndex: 64
    SolutionNameMin: Cijk_Alik_Bljk_BBS_BH_Bias_HA_S_SAV_UserArgs_MT32x32x64_MI16x16x1_SN_LDSB0_AFC1_AG0_AFEM1_AFEM1_ASEM1_CLR0_CADS0_DTLA0_DTLB0_DTVA0_DTVB0_EPS0_FDSI0_GRPM1_GRVWA8_GRVWB8_GSU1_GSUAMB_GSUC0_GSUWGMRR0_GLS0_ISA1100_IU1_K1_LDSTI0_LBSPPA128_LBSPPB128_LBSPPM0_LPA8_LPB8_LPM0_LRVW16_LWPMn1_MIAV1_MIWT1_1_MO40_NTn1_NTA0_NTB0_NTC0_NTD0_NTM0_NEPBS0_NLCA1_NLCB1_ONLL1_PGR2_PLR1_PKA0_SIA1_SS1_SU32_SUM1_SUS256_SPO0_SRVW0_SSO0_SVW1_SK0_SKFTR0_SKXCCM0_TLDS1_ULSGRO0_USL1_UIOFGRO0_USFGROn1_VSn1_VWA1_VWB1_WSGRA0_WSGRB0_WS32_WG32_4_1_WGM8_WGMXCC1_WGMXCCGn1
    SolutionIndex: 65
    SolutionNameMin: Cijk_Alik_Bljk_BBS_BH_Bias_HA_S_SAV_UserArgs_MT32x32x64_MI16x16x1_SN_LDSB0_AFC1_AG0_AFEM1_AFEM1_ASEM1_CLR0_CADS0_DTLA0_DTLB0_DTVA0_DTVB0_EPS0_FDSI0_GRPM1_GRVWA8_GRVWB8_GSU1_GSUAMB_GSUC0_GSUWGMRR0_GLS0_ISA1100_IU1_K1_LDSTI0_LBSPPA128_LBSPPB128_LBSPPM0_LPA8_LPB8_LPM0_LRVW16_LWPMn1_MIAV1_MIWT1_1_MO40_NTn1_NTA0_NTB0_NTC0_NTD0_NTM0_NEPBS0_NLCA1_NLCB1_ONLL1_PGR2_PLR1_PKA0_SIA3_SS1_SU32_SUM1_SUS256_SPO0_SRVW0_SSO0_SVW1_SK0_SKFTR0_SKXCCM0_TLDS1_ULSGRO0_USL1_UIOFGRO0_USFGROn1_VSn1_VWA1_VWB1_WSGRA0_WSGRB0_WS32_WG32_4_1_WGM8_WGMXCC1_WGMXCCGn1
    SolutionIndex: 66
    SolutionNameMin: Cijk_Alik_Bljk_BBS_BH_Bias_HA_S_SAV_UserArgs_MT64x48x128_MI16x16x1_SN_LDSB0_AFC1_AG0_AFEM1_AFEM1_ASEM1_CLR0_CADS0_DTLA0_DTLB0_DTVA0_DTVB0_EPS0_FDSI0_GRPM1_GRVWA8_GRVWB8_GSU1_GSUAMB_GSUC0_GSUWGMRR0_GLS0_ISA1100_IU1_K1_LDSTI0_LBSPPA256_LBSPPB256_LBSPPM0_LPA8_LPB8_LPM0_LRVW16_LWPMn1_MIAV1_MIWT1_3_MO40_NTn1_NTA0_NTB0_NTC0_NTD0_NTM0_NEPBS0_NLCA1_NLCB1_ONLL1_PGR2_PLR1_PKA0_SIA1_SS1_SU32_SUM1_SUS256_SPO0_SRVW0_SSO0_SVW1_SK0_SKFTR0_SKXCCM0_TLDS1_ULSGRO0_USL1_UIOFGRO0_USFGROn1_VSn1_VWA1_VWB1_WSGRA0_WSGRB0_WS32_WG64_2_1_WGM8_WGMXCC1_WGMXCCGn1
    SolutionIndex: 67
    SolutionNameMin: Cijk_Alik_Bljk_BBS_BH_Bias_HA_S_SAV_UserArgs_MT64x48x128_MI16x16x1_SN_LDSB0_AFC1_AG0_AFEM1_AFEM1_ASEM1_CLR0_CADS0_DTLA0_DTLB0_DTVA0_DTVB0_EPS0_FDSI0_GRPM1_GRVWA8_GRVWB8_GSU1_GSUAMB_GSUC0_GSUWGMRR0_GLS0_ISA1100_IU1_K1_LDSTI0_LBSPPA256_LBSPPB256_LBSPPM0_LPA8_LPB8_LPM0_LRVW16_LWPMn1_MIAV1_MIWT1_3_MO40_NTn1_NTA0_NTB0_NTC0_NTD0_NTM0_NEPBS0_NLCA1_NLCB1_ONLL1_PGR1_PLR1_PKA0_SIA1_SS1_SU32_SUM1_SUS256_SPO0_SRVW0_SSO0_SVW1_SK0_SKFTR0_SKXCCM0_TLDS1_ULSGRO0_USL1_UIOFGRO0_USFGROn1_VSn1_VWA1_VWB1_WSGRA0_WSGRB0_WS32_WG64_2_1_WGM8_WGMXCC1_WGMXCCGn1
    SolutionIndex: 68
    SolutionNameMin: Cijk_Alik_Bljk_BBS_BH_Bias_HA_S_SAV_UserArgs_MT64x96x64_MI16x16x1_SN_LDSB0_AFC1_AG0_AFEM1_AFEM1_ASEM1_CLR0_CADS0_DTLA0_DTLB0_DTVA0_DTVB0_EPS0_FDSI0_GRPM1_GRVWA8_GRVWB8_GSU1_GSUAMB_GSUC0_GSUWGMRR0_GLS0_ISA1100_IU1_K1_LDSTI0_LBSPPA128_LBSPPB128_LBSPPM0_LPA8_LPB8_LPM0_LRVW16_LWPMn1_MIAV1_MIWT2_3_MO40_NTn1_NTA0_NTB0_NTC0_NTD0_NTM0_NEPBS0_NLCA1_NLCB1_ONLL1_PGR2_PLR1_PKA0_SIA1_SS1_SU32_SUM1_SUS256_SPO0_SRVW0_SSO0_SVW1_SK0_SKFTR0_SKXCCM0_TLDS1_ULSGRO0_USL1_UIOFGRO0_USFGROn1_VSn1_VWA1_VWB1_WSGRA0_WSGRB0_WS32_WG32_4_1_WGM8_WGMXCC1_WGMXCCGn1
    SolutionIndex: 69
    SolutionNameMin: Cijk_Alik_Bljk_BBS_BH_Bias_HA_S_SAV_UserArgs_MT64x96x32_MI16x16x1_SN_LDSB0_AFC1_AG0_AFEM1_AFEM1_ASEM1_CLR0_CADS0_DTLA0_DTLB0_DTVA0_DTVB0_EPS0_FDSI0_GRPM1_GRVWA8_GRVWB8_GSU1_GSUAMB_GSUC0_GSUWGMRR0_GLS0_ISA1100_IU1_K1_LDSTI0_LBSPPA128_LBSPPB128_LBSPPM0_LPA8_LPB8_LPM0_LRVW16_LWPMn1_MIAV1_MIWT2_3_MO40_NTn1_NTA0_NTB0_NTC0_NTD0_NTM0_NEPBS0_NLCA1_NLCB1_ONLL1_PGR2_PLR1_PKA0_SIA1_SS1_SU32_SUM1_SUS256_SPO0_SRVW0_SSO0_SVW1_SK0_SKFTR0_SKXCCM0_TLDS1_ULSGRO0_USL1_UIOFGRO0_USFGROn1_VSn1_VWA1_VWB1_WSGRA0_WSGRB0_WS32_WG32_4_1_WGM8_WGMXCC1_WGMXCCGn1
    SolutionIndex: 70
    SolutionNameMin: Cijk_Alik_Bljk_BBS_BH_Bias_HA_S_SAV_UserArgs_MT64x96x32_MI16x16x1_SN_LDSB0_AFC1_AG0_AFEM1_AFEM1_ASEM1_CLR0_CADS0_DTLA0_DTLB0_DTVA0_DTVB0_EPS0_FDSI0_GRPM1_GRVWA8_GRVWB8_GSU1_GSUAMB_GSUC0_GSUWGMRR0_GLS0_ISA1100_IU1_K1_LDSTI0_LBSPPA128_LBSPPB128_LBSPPM0_LPA8_LPB8_LPM0_LRVW16_LWPMn1_MIAV1_MIWT2_3_MO40_NTn1_NTA0_NTB0_NTC0_NTD0_NTM0_NEPBS0_NLCA1_NLCB1_ONLL1_PGR2_PLR0_PKA0_SIA1_SS1_SU32_SUM1_SUS256_SPO0_SRVW0_SSO0_SVW1_SK0_SKFTR0_SKXCCM0_TLDS1_ULSGRO0_USL1_UIOFGRO0_USFGROn1_VSn1_VWA1_VWB1_WSGRA0_WSGRB0_WS32_WG32_4_1_WGM8_WGMXCC1_WGMXCCGn1
    SolutionIndex: 71
    SolutionNameMin: Cijk_Alik_Bljk_BBS_BH_Bias_HA_S_SAV_UserArgs_MT64x64x128_MI16x16x1_SN_LDSB0_AFC1_AG0_AFEM1_AFEM1_ASEM1_CLR0_CADS0_DTLA0_DTLB0_DTVA0_DTVB0_EPS0_FDSI0_GRPM1_GRVWA8_GRVWB8_GSU1_GSUAMB_GSUC0_GSUWGMRR0_GLS0_ISA1100_IU1_K1_LDSTI0_LBSPPA256_LBSPPB256_LBSPPM0_LPA8_LPB8_LPM0_LRVW16_LWPMn1_MIAV1_MIWT2_2_MO40_NTn1_NTA0_NTB0_NTC0_NTD0_NTM0_NEPBS0_NLCA1_NLCB1_ONLL1_PGR0_PLR1_PKA0_SIA3_SS1_SU32_SUM1_SUS256_SPO0_SRVW0_SSO0_SVW1_SK0_SKFTR0_SKXCCM0_TLDS1_ULSGRO0_USL1_UIOFGRO0_USFGROn1_VSn1_VWA1_VWB1_WSGRA0_WSGRB0_WS32_WG32_4_1_WGM8_WGMXCC1_WGMXCCGn1
    SolutionIndex: 72
    SolutionNameMin: Cijk_Alik_Bljk_BBS_BH_Bias_HA_S_SAV_UserArgs_MT64x48x128_MI16x16x1_SN_LDSB0_AFC1_AG0_AFEM1_AFEM1_ASEM1_CLR0_CADS0_DTLA0_DTLB0_DTVA0_DTVB0_EPS0_FDSI0_GRPM1_GRVWA8_GRVWB8_GSU1_GSUAMB_GSUC0_GSUWGMRR0_GLS0_ISA1100_IU1_K1_LDSTI0_LBSPPA256_LBSPPB256_LBSPPM0_LPA8_LPB8_LPM0_LRVW16_LWPMn1_MIAV1_MIWT1_3_MO40_NTn1_NTA0_NTB0_NTC0_NTD0_NTM0_NEPBS0_NLCA1_NLCB1_ONLL1_PGR2_PLR1_PKA0_SIA3_SS1_SU32_SUM1_SUS256_SPO0_SRVW0_SSO0_SVW1_SK0_SKFTR0_SKXCCM0_TLDS1_ULSGRO0_USL1_UIOFGRO0_USFGROn1_VSn1_VWA1_VWB1_WSGRA0_WSGRB0_WS32_WG64_2_1_WGM8_WGMXCC1_WGMXCCGn1
    SolutionIndex: 73
    SolutionNameMin: Cijk_Alik_Bljk_BBS_BH_Bias_HA_S_SAV_UserArgs_MT32x128x32_MI16x16x1_SN_LDSB0_AFC1_AG0_AFEM1_AFEM1_ASEM1_CLR0_CADS0_DTLA0_DTLB0_DTVA0_DTVB0_EPS0_FDSI0_GRPM1_GRVWA8_GRVWB8_GSU1_GSUAMB_GSUC0_GSUWGMRR0_GLS0_ISA1100_IU1_K1_LDSTI0_LBSPPA128_LBSPPB128_LBSPPM0_LPA8_LPB8_LPM0_LRVW16_LWPMn1_MIAV1_MIWT2_2_MO40_NTn1_NTA0_NTB0_NTC0_NTD0_NTM0_NEPBS0_NLCA1_NLCB1_ONLL1_PGR2_PLR1_PKA0_SIA1_SS1_SU32_SUM1_SUS256_SPO0_SRVW0_SSO0_SVW1_SK0_SKFTR0_SKXCCM0_TLDS1_ULSGRO0_USL1_UIOFGRO0_USFGROn1_VSn1_VWA1_VWB1_WSGRA0_WSGRB0_WS32_WG16_8_1_WGM8_WGMXCC1_WGMXCCGn1
    SolutionIndex: 74
    SolutionNameMin: Cijk_Alik_Bljk_BBS_BH_Bias_HA_S_SAV_UserArgs_MT64x128x64_MI16x16x1_SN_LDSB0_AFC1_AG0_AFEM1_AFEM1_ASEM1_CLR0_CADS0_DTLA0_DTLB0_DTVA0_DTVB0_EPS0_FDSI0_GRPM1_GRVWA8_GRVWB8_GSU1_GSUAMB_GSUC0_GSUWGMRR0_GLS0_ISA1100_IU1_K1_LDSTI0_LBSPPA128_LBSPPB128_LBSPPM0_LPA8_LPB8_LPM0_LRVW16_LWPMn1_MIAV1_MIWT4_2_MO40_NTn1_NTA0_NTB0_NTC0_NTD0_NTM0_NEPBS0_NLCA1_NLCB1_ONLL1_PGR0_PLR0_PKA0_SIA3_SS1_SU32_SUM1_SUS256_SPO0_SRVW0_SSO0_SVW1_SK0_SKFTR0_SKXCCM0_TLDS1_ULSGRO0_USL1_UIOFGRO0_USFGROn1_VSn1_VWA1_VWB1_WSGRA0_WSGRB0_WS32_WG16_8_1_WGM8_WGMXCC1_WGMXCCGn1
    SolutionIndex: 75
    SolutionNameMin: Cijk_Alik_Bljk_BBS_BH_Bias_HA_S_SAV_UserArgs_MT128x64x32_MI16x16x1_SN_LDSB0_AFC1_AG0_AFEM1_AFEM1_ASEM1_CLR0_CADS0_DTLA0_DTLB0_DTVA0_DTVB0_EPS0_FDSI0_GRPM1_GRVWA8_GRVWB8_GSU1_GSUAMB_GSUC0_GSUWGMRR0_GLS0_ISA1100_IU1_K1_LDSTI0_LBSPPA128_LBSPPB128_LBSPPM0_LPA8_LPB8_LPM0_LRVW16_LWPMn1_MIAV1_MIWT4_2_MO40_NTn1_NTA0_NTB0_NTC0_NTD0_NTM0_NEPBS0_NLCA1_NLCB1_ONLL1_PGR1_PLR1_PKA0_SIA3_SS1_SU32_SUM1_SUS256_SPO0_SRVW0_SSO0_SVW1_SK0_SKFTR0_SKXCCM0_TLDS1_ULSGRO0_USL1_UIOFGRO0_USFGROn1_VSn1_VWA1_VWB1_WSGRA0_WSGRB0_WS32_WG32_4_1_WGM8_WGMXCC1_WGMXCCGn1
    SolutionIndex: 76
    SolutionNameMin: Cijk_Alik_Bljk_BBS_BH_Bias_HA_S_SAV_UserArgs_MT128x64x64_MI16x16x1_SN_LDSB1_AFC1_AG0_AFEM1_AFEM1_ASEM1_CLR0_CADS0_DTLA0_DTLB0_DTVA0_DTVB0_EPS0_FDSI0_GRPM1_GRVWA8_GRVWB8_GSU1_GSUAMB_GSUC0_GSUWGMRR0_GLS0_ISA1100_IU1_K1_LDSTI0_LBSPPA128_LBSPPB128_LBSPPM0_LPA8_LPB8_LPM0_LRVW16_LWPMn1_MIAV1_MIWT4_2_MO40_NTn1_NTA0_NTB0_NTC0_NTD0_NTM0_NEPBS0_NLCA1_NLCB1_ONLL1_PGR2_PLR1_PKA0_SIA3_SS1_SU32_SUM1_SUS256_SPO0_SRVW0_SSO0_SVW1_SK0_SKFTR0_SKXCCM0_TLDS1_ULSGRO0_USL1_UIOFGRO0_USFGROn1_VSn1_VWA1_VWB1_WSGRA0_WSGRB0_WS32_WG32_4_1_WGM8_WGMXCC1_WGMXCCGn1
    SolutionIndex: 77
    SolutionNameMin: Cijk_Alik_Bljk_BBS_BH_Bias_HA_S_SAV_UserArgs_MT128x64x32_MI16x16x1_SN_LDSB0_AFC1_AG0_AFEM1_AFEM1_ASEM1_CLR0_CADS0_DTLA0_DTLB0_DTVA0_DTVB0_EPS0_FDSI0_GRPM1_GRVWA8_GRVWB8_GSU1_GSUAMB_GSUC0_GSUWGMRR0_GLS0_ISA1100_IU1_K1_LDSTI0_LBSPPA128_LBSPPB128_LBSPPM0_LPA8_LPB8_LPM0_LRVW16_LWPMn1_MIAV1_MIWT2_4_MO40_NTn1_NTA0_NTB0_NTC0_NTD0_NTM0_NEPBS0_NLCA1_NLCB1_ONLL1_PGR1_PLR0_PKA0_SIA3_SS1_SU32_SUM1_SUS256_SPO0_SRVW0_SSO0_SVW1_SK0_SKFTR0_SKXCCM0_TLDS1_ULSGRO0_USL1_UIOFGRO0_USFGROn1_VSn1_VWA1_VWB1_WSGRA0_WSGRB0_WS32_WG64_2_1_WGM8_WGMXCC1_WGMXCCGn1
    SolutionIndex: 78
    SolutionNameMin: Cijk_Alik_Bljk_BBS_BH_Bias_HA_S_SAV_UserArgs_MT128x96x32_MI16x16x1_SN_LDSB0_AFC1_AG0_AFEM1_AFEM1_ASEM1_CLR0_CADS0_DTLA0_DTLB0_DTVA0_DTVB0_EPS0_FDSI0_GRPM1_GRVWA8_GRVWB8_GSU1_GSUAMB_GSUC0_GSUWGMRR0_GLS0_ISA1100_IU1_K1_LDSTI0_LBSPPA128_LBSPPB128_LBSPPM0_LPA8_LPB8_LPM0_LRVW16_LWPMn1_MIAV1_MIWT4_3_MO40_NTn1_NTA0_NTB0_NTC0_NTD0_NTM0_NEPBS0_NLCA1_NLCB1_ONLL1_PGR2_PLR0_PKA0_SIA1_SS1_SU32_SUM1_SUS256_SPO0_SRVW0_SSO0_SVW1_SK0_SKFTR0_SKXCCM0_TLDS1_ULSGRO0_USL1_UIOFGRO0_USFGROn1_VSn1_VWA1_VWB1_WSGRA0_WSGRB0_WS32_WG32_4_1_WGM8_WGMXCC1_WGMXCCGn1
    SolutionIndex: 79
    SolutionNameMin: Cijk_Alik_Bljk_BBS_BH_Bias_HA_S_SAV_UserArgs_MT16x16x128_MI16x16x1_SN_LDSB0_AFC1_AG0_AFEM1_AFEM1_ASEM1_CLR0_CADS0_DTLA0_DTLB0_DTVA0_DTVB0_EPS0_FDSI0_GRPM1_GRVWA8_GRVWB8_GSU1_GSUAMB_GSUC0_GSUWGMRR0_GLS0_ISA1100_IU1_K1_LDSTI0_LBSPPA256_LBSPPB256_LBSPPM0_LPA8_LPB8_LPM0_LRVW16_LWPMn1_MIAV1_MIWT1_1_MO40_NTn1_NTA0_NTB0_NTC0_NTD0_NTM0_NEPBS0_NLCA1_NLCB1_ONLL1_PGR1_PLR1_PKA0_SIA1_SS1_SU32_SUM1_SUS256_SPO0_SRVW0_SSO0_SVW1_SK0_SKFTR0_SKXCCM0_TLDS1_ULSGRO0_USL1_UIOFGRO0_USFGROn1_VSn1_VWA1_VWB1_WSGRA0_WSGRB0_WS32_WG16_2_1_WGM8_WGMXCC1_WGMXCCGn1
    SolutionIndex: 80
    SolutionNameMin: Cijk_Alik_Bljk_BBS_BH_Bias_HA_S_SAV_UserArgs_MT64x64x32_MI16x16x1_SN_LDSB0_AFC1_AG0_AFEM1_AFEM1_ASEM1_CLR0_CADS0_DTLA0_DTLB0_DTVA0_DTVB0_EPS0_FDSI0_GRPM1_GRVWA8_GRVWB8_GSU1_GSUAMB_GSUC0_GSUWGMRR0_GLS0_ISA1100_IU1_K1_LDSTI0_LBSPPA128_LBSPPB128_LBSPPM0_LPA8_LPB8_LPM0_LRVW16_LWPMn1_MIAV1_MIWT2_2_MO40_NTn1_NTA0_NTB0_NTC0_NTD0_NTM0_NEPBS0_NLCA1_NLCB1_ONLL1_PGR1_PLR1_PKA0_SIA1_SS1_SU32_SUM1_SUS256_SPO0_SRVW0_SSO0_SVW1_SK0_SKFTR0_SKXCCM0_TLDS1_ULSGRO0_USL1_UIOFGRO0_USFGROn1_VSn1_VWA1_VWB1_WSGRA0_WSGRB0_WS32_WG32_4_1_WGM8_WGMXCC1_WGMXCCGn1
    SolutionIndex: 81
    SolutionNameMin: Cijk_Alik_Bljk_BBS_BH_Bias_HA_S_SAV_UserArgs_MT64x128x32_MI16x16x1_SN_LDSB0_AFC1_AG0_AFEM1_AFEM1_ASEM1_CLR0_CADS0_DTLA0_DTLB0_DTVA0_DTVB0_EPS0_FDSI0_GRPM1_GRVWA8_GRVWB8_GSU1_GSUAMB_GSUC0_GSUWGMRR0_GLS0_ISA1100_IU1_K1_LDSTI0_LBSPPA128_LBSPPB128_LBSPPM0_LPA8_LPB8_LPM0_LRVW16_LWPMn1_MIAV1_MIWT2_4_MO40_NTn1_NTA0_NTB0_NTC0_NTD0_NTM0_NEPBS0_NLCA1_NLCB1_ONLL1_PGR0_PLR0_PKA0_SIA3_SS1_SU32_SUM1_SUS256_SPO0_SRVW0_SSO0_SVW1_SK0_SKFTR0_SKXCCM0_TLDS1_ULSGRO0_USL1_UIOFGRO0_USFGROn1_VSn1_VWA1_VWB1_WSGRA0_WSGRB0_WS32_WG32_4_1_WGM8_WGMXCC1_WGMXCCGn1
    SolutionIndex: 82
    SolutionNameMin: Cijk_Alik_Bljk_BBS_BH_Bias_HA_S_SAV_UserArgs_MT128x64x32_MI16x16x1_SN_LDSB0_AFC1_AG0_AFEM1_AFEM1_ASEM1_CLR0_CADS0_DTLA0_DTLB0_DTVA0_DTVB0_EPS0_FDSI0_GRPM1_GRVWA8_GRVWB8_GSU1_GSUAMB_GSUC0_GSUWGMRR0_GLS0_ISA1100_IU1_K1_LDSTI0_LBSPPA128_LBSPPB128_LBSPPM0_LPA8_LPB8_LPM0_LRVW16_LWPMn1_MIAV1_MIWT2_4_MO40_NTn1_NTA0_NTB0_NTC0_NTD0_NTM0_NEPBS0_NLCA1_NLCB1_ONLL1_PGR0_PLR0_PKA0_SIA3_SS1_SU32_SUM1_SUS256_SPO0_SRVW0_SSO0_SVW1_SK0_SKFTR0_SKXCCM0_TLDS1_ULSGRO0_USL1_UIOFGRO0_USFGROn1_VSn1_VWA1_VWB1_WSGRA0_WSGRB0_WS32_WG64_2_1_WGM8_WGMXCC1_WGMXCCGn1
    SolutionIndex: 83
    SolutionNameMin: Cijk_Alik_Bljk_BBS_BH_Bias_HA_S_SAV_UserArgs_MT128x96x32_MI16x16x1_SN_LDSB0_AFC1_AG0_AFEM1_AFEM1_ASEM1_CLR0_CADS0_DTLA0_DTLB0_DTVA0_DTVB0_EPS0_FDSI0_GRPM1_GRVWA8_GRVWB8_GSU1_GSUAMB_GSUC0_GSUWGMRR0_GLS0_ISA1100_IU1_K1_LDSTI0_LBSPPA128_LBSPPB128_LBSPPM0_LPA8_LPB8_LPM0_LRVW16_LWPMn1_MIAV1_MIWT4_3_MO40_NTn1_NTA0_NTB0_NTC0_NTD0_NTM0_NEPBS0_NLCA1_NLCB1_ONLL1_PGR2_PLR1_PKA0_SIA3_SS1_SU32_SUM1_SUS256_SPO0_SRVW0_SSO0_SVW1_SK0_SKFTR0_SKXCCM0_TLDS1_ULSGRO0_USL1_UIOFGRO0_USFGROn1_VSn1_VWA1_VWB1_WSGRA0_WSGRB0_WS32_WG32_4_1_WGM8_WGMXCC1_WGMXCCGn1
    SolutionIndex: 85
    SolutionNameMin: Cijk_Alik_Bljk_BBS_BH_Bias_HA_S_SAV_UserArgs_MT32x16x32_MI16x16x1_SN_LDSB0_AFC1_AG0_AFEM1_AFEM1_ASEM1_CLR0_CADS0_DTLA0_DTLB0_DTVA0_DTVB0_EPS0_FDSI0_GRPM1_GRVWA8_GRVWB8_GSU1_GSUAMB_GSUC0_GSUWGMRR0_GLS0_ISA1100_IU1_K1_LDSTI0_LBSPPA128_LBSPPB128_LBSPPM0_LPA8_LPB8_LPM0_LRVW16_LWPMn1_MIAV1_MIWT1_1_MO40_NTn1_NTA0_NTB0_NTC0_NTD0_NTM0_NEPBS0_NLCA1_NLCB1_ONLL1_PGR2_PLR1_PKA0_SIA3_SS1_SU32_SUM1_SUS256_SPO0_SRVW0_SSO0_SVW1_SK0_SKFTR0_SKXCCM0_TLDS1_ULSGRO0_USL1_UIOFGRO0_USFGROn1_VSn1_VWA1_VWB1_WSGRA0_WSGRB0_WS32_WG32_2_1_WGM8_WGMXCC1_WGMXCCGn1
    SolutionIndex: 86
    SolutionNameMin: Cijk_Alik_Bljk_BBS_BH_Bias_HA_S_SAV_UserArgs_MT64x16x128_MI16x16x1_SN_LDSB0_AFC1_AG0_AFEM1_AFEM1_ASEM1_CLR0_CADS0_DTLA0_DTLB0_DTVA0_DTVB0_EPS0_FDSI0_GRPM1_GRVWA8_GRVWB8_GSU1_GSUAMB_GSUC0_GSUWGMRR0_GLS0_ISA1100_IU1_K1_LDSTI0_LBSPPA256_LBSPPB256_LBSPPM0_LPA8_LPB8_LPM0_LRVW16_LWPMn1_MIAV1_MIWT1_1_MO40_NTn1_NTA0_NTB0_NTC0_NTD0_NTM0_NEPBS0_NLCA1_NLCB1_ONLL1_PGR2_PLR1_PKA0_SIA1_SS1_SU32_SUM1_SUS256_SPO0_SRVW0_SSO0_SVW1_SK0_SKFTR0_SKXCCM0_TLDS1_ULSGRO0_USL1_UIOFGRO0_USFGROn1_VSn1_VWA1_VWB1_WSGRA0_WSGRB0_WS32_WG64_2_1_WGM8_WGMXCC1_WGMXCCGn1
    SolutionIndex: 87
    SolutionNameMin: Cijk_Alik_Bljk_BBS_BH_Bias_HA_S_SAV_UserArgs_MT64x64x64_MI16x16x1_SN_LDSB0_AFC1_AG0_AFEM1_AFEM1_ASEM1_CLR0_CADS0_DTLA0_DTLB0_DTVA0_DTVB0_EPS0_FDSI0_GRPM1_GRVWA8_GRVWB8_GSU1_GSUAMB_GSUC0_GSUWGMRR0_GLS0_ISA1100_IU1_K1_LDSTI0_LBSPPA128_LBSPPB128_LBSPPM0_LPA8_LPB8_LPM0_LRVW16_LWPMn1_MIAV1_MIWT2_2_MO40_NTn1_NTA0_NTB0_NTC0_NTD0_NTM0_NEPBS0_NLCA1_NLCB1_ONLL1_PGR2_PLR0_PKA0_SIA1_SS1_SU32_SUM1_SUS256_SPO0_SRVW0_SSO0_SVW1_SK0_SKFTR0_SKXCCM0_TLDS1_ULSGRO0_USL1_UIOFGRO0_USFGROn1_VSn1_VWA1_VWB1_WSGRA0_WSGRB0_WS32_WG32_4_1_WGM8_WGMXCC1_WGMXCCGn1
    SolutionIndex: 88
    SolutionNameMin: Cijk_Alik_Bljk_BBS_BH_Bias_HA_S_SAV_UserArgs_MT128x64x32_MI16x16x1_SN_LDSB0_AFC1_AG0_AFEM1_AFEM1_ASEM1_CLR0_CADS0_DTLA0_DTLB0_DTVA0_DTVB0_EPS0_FDSI0_GRPM1_GRVWA8_GRVWB8_GSU1_GSUAMB_GSUC0_GSUWGMRR0_GLS0_ISA1100_IU1_K1_LDSTI0_LBSPPA128_LBSPPB128_LBSPPM0_LPA8_LPB8_LPM0_LRVW16_LWPMn1_MIAV1_MIWT4_2_MO40_NTn1_NTA0_NTB0_NTC0_NTD0_NTM0_NEPBS0_NLCA1_NLCB1_ONLL1_PGR2_PLR1_PKA0_SIA1_SS1_SU32_SUM1_SUS256_SPO0_SRVW0_SSO0_SVW1_SK0_SKFTR0_SKXCCM0_TLDS1_ULSGRO0_USL1_UIOFGRO0_USFGROn1_VSn1_VWA1_VWB1_WSGRA0_WSGRB0_WS32_WG32_4_1_WGM8_WGMXCC1_WGMXCCGn1
    SolutionIndex: 89
    SolutionNameMin: Cijk_Alik_Bljk_BBS_BH_Bias_HA_S_SAV_UserArgs_MT128x64x32_MI16x16x1_SN_LDSB0_AFC1_AG0_AFEM1_AFEM1_ASEM1_CLR0_CADS0_DTLA0_DTLB0_DTVA0_DTVB0_EPS0_FDSI0_GRPM1_GRVWA8_GRVWB8_GSU1_GSUAMB_GSUC0_GSUWGMRR0_GLS0_ISA1100_IU1_K1_LDSTI0_LBSPPA128_LBSPPB128_LBSPPM0_LPA8_LPB8_LPM0_LRVW16_LWPMn1_MIAV1_MIWT2_4_MO40_NTn1_NTA0_NTB0_NTC0_NTD0_NTM0_NEPBS0_NLCA1_NLCB1_ONLL1_PGR2_PLR1_PKA0_SIA1_SS1_SU32_SUM1_SUS256_SPO0_SRVW0_SSO0_SVW1_SK0_SKFTR0_SKXCCM0_TLDS1_ULSGRO0_USL1_UIOFGRO0_USFGROn1_VSn1_VWA1_VWB1_WSGRA0_WSGRB0_WS32_WG64_2_1_WGM8_WGMXCC1_WGMXCCGn1
    SolutionIndex: 90
    SolutionNameMin: Cijk_Alik_Bljk_BBS_BH_Bias_HA_S_SAV_UserArgs_MT128x64x64_MI16x16x1_SN_LDSB0_AFC1_AG0_AFEM1_AFEM1_ASEM1_CLR0_CADS0_DTLA0_DTLB0_DTVA0_DTVB0_EPS0_FDSI0_GRPM1_GRVWA8_GRVWB8_GSU1_GSUAMB_GSUC0_GSUWGMRR0_GLS0_ISA1100_IU1_K1_LDSTI0_LBSPPA128_LBSPPB128_LBSPPM0_LPA8_LPB8_LPM0_LRVW16_LWPMn1_MIAV1_MIWT4_2_MO40_NTn1_NTA0_NTB0_NTC0_NTD0_NTM0_NEPBS0_NLCA1_NLCB1_ONLL1_PGR0_PLR1_PKA0_SIA3_SS1_SU32_SUM1_SUS256_SPO0_SRVW0_SSO0_SVW1_SK0_SKFTR0_SKXCCM0_TLDS1_ULSGRO0_USL1_UIOFGRO0_USFGROn1_VSn1_VWA1_VWB1_WSGRA0_WSGRB0_WS32_WG32_4_1_WGM8_WGMXCC1_WGMXCCGn1
    SolutionIndex: 92
    SolutionNameMin: Cijk_Alik_Bljk_BBS_BH_Bias_HA_S_SAV_UserArgs_MT16x16x32_MI16x16x1_SN_LDSB0_AFC1_AG0_AFEM1_AFEM1_ASEM1_CLR0_CADS0_DTLA0_DTLB0_DTVA0_DTVB0_EPS0_FDSI0_GRPM1_GRVWA8_GRVWB8_GSU1_GSUAMB_GSUC0_GSUWGMRR0_GLS0_ISA1100_IU1_K1_LDSTI0_LBSPPA128_LBSPPB128_LBSPPM0_LPA8_LPB8_LPM0_LRVW16_LWPMn1_MIAV1_MIWT1_1_MO40_NTn1_NTA0_NTB0_NTC0_NTD0_NTM0_NEPBS0_NLCA1_NLCB1_ONLL1_PGR2_PLR1_PKA0_SIA1_SS1_SU32_SUM1_SUS256_SPO0_SRVW0_SSO0_SVW1_SK0_SKFTR0_SKXCCM0_TLDS1_ULSGRO0_USL1_UIOFGRO0_USFGROn1_VSn1_VWA1_VWB1_WSGRA0_WSGRB0_WS32_WG16_2_1_WGM8_WGMXCC1_WGMXCCGn1
    SolutionIndex: 93
    SolutionNameMin: Cijk_Alik_Bljk_BBS_BH_Bias_HA_S_SAV_UserArgs_MT16x16x128_MI16x16x1_SN_LDSB0_AFC1_AG0_AFEM1_AFEM1_ASEM1_CLR0_CADS0_DTLA0_DTLB0_DTVA0_DTVB0_EPS0_FDSI0_GRPM1_GRVWA8_GRVWB8_GSU1_GSUAMB_GSUC0_GSUWGMRR0_GLS0_ISA1100_IU1_K1_LDSTI0_LBSPPA256_LBSPPB256_LBSPPM0_LPA8_LPB8_LPM0_LRVW16_LWPMn1_MIAV1_MIWT1_1_MO40_NTn1_NTA0_NTB0_NTC0_NTD0_NTM0_NEPBS0_NLCA1_NLCB1_ONLL1_PGR2_PLR1_PKA0_SIA3_SS1_SU32_SUM1_SUS256_SPO0_SRVW0_SSO0_SVW1_SK0_SKFTR0_SKXCCM0_TLDS1_ULSGRO0_USL1_UIOFGRO0_USFGROn1_VSn1_VWA1_VWB1_WSGRA0_WSGRB0_WS32_WG16_2_1_WGM8_WGMXCC1_WGMXCCGn1
    SolutionIndex: 94
    SolutionNameMin: Cijk_Alik_Bljk_BBS_BH_Bias_HA_S_SAV_UserArgs_MT64x32x128_MI16x16x1_SN_LDSB0_AFC1_AG0_AFEM1_AFEM1_ASEM1_CLR0_CADS0_DTLA0_DTLB0_DTVA0_DTVB0_EPS0_FDSI0_GRPM1_GRVWA8_GRVWB8_GSU1_GSUAMB_GSUC0_GSUWGMRR0_GLS0_ISA1100_IU1_K1_LDSTI0_LBSPPA256_LBSPPB256_LBSPPM0_LPA8_LPB8_LPM0_LRVW16_LWPMn1_MIAV1_MIWT2_1_MO40_NTn1_NTA0_NTB0_NTC0_NTD0_NTM0_NEPBS0_NLCA1_NLCB1_ONLL1_PGR1_PLR1_PKA0_SIA1_SS1_SU32_SUM1_SUS256_SPO0_SRVW0_SSO0_SVW1_SK0_SKFTR0_SKXCCM0_TLDS1_ULSGRO0_USL1_UIOFGRO0_USFGROn1_VSn1_VWA1_VWB1_WSGRA0_WSGRB0_WS32_WG32_4_1_WGM8_WGMXCC1_WGMXCCGn1
    SolutionIndex: 95
    SolutionNameMin: Cijk_Alik_Bljk_BBS_BH_Bias_HA_S_SAV_UserArgs_MT128x64x64_MI16x16x1_SN_LDSB0_AFC1_AG0_AFEM1_AFEM1_ASEM1_CLR0_CADS0_DTLA0_DTLB0_DTVA0_DTVB0_EPS0_FDSI0_GRPM1_GRVWA8_GRVWB8_GSU1_GSUAMB_GSUC0_GSUWGMRR0_GLS0_ISA1100_IU1_K1_LDSTI0_LBSPPA128_LBSPPB128_LBSPPM0_LPA8_LPB8_LPM0_LRVW16_LWPMn1_MIAV1_MIWT2_4_MO40_NTn1_NTA0_NTB0_NTC0_NTD0_NTM0_NEPBS0_NLCA1_NLCB1_ONLL1_PGR0_PLR1_PKA0_SIA3_SS1_SU32_SUM1_SUS256_SPO0_SRVW0_SSO0_SVW1_SK0_SKFTR0_SKXCCM0_TLDS1_ULSGRO0_USL1_UIOFGRO0_USFGROn1_VSn1_VWA1_VWB1_WSGRA0_WSGRB0_WS32_WG64_2_1_WGM8_WGMXCC1_WGMXCCGn1
    SolutionIndex: 97
    SolutionNameMin: Cijk_Alik_Bljk_BBS_BH_Bias_HA_S_SAV_UserArgs_MT16x16x32_MI16x16x1_SN_LDSB0_AFC1_AG0_AFEM1_AFEM1_ASEM1_CLR0_CADS0_DTLA0_DTLB0_DTVA0_DTVB0_EPS0_FDSI0_GRPM1_GRVWA8_GRVWB8_GSU1_GSUAMB_GSUC0_GSUWGMRR0_GLS0_ISA1100_IU1_K1_LDSTI0_LBSPPA128_LBSPPB128_LBSPPM0_LPA8_LPB8_LPM0_LRVW16_LWPMn1_MIAV1_MIWT1_1_MO40_NTn1_NTA0_NTB0_NTC0_NTD0_NTM0_NEPBS0_NLCA1_NLCB1_ONLL1_PGR1_PLR0_PKA0_SIA3_SS1_SU32_SUM1_SUS256_SPO0_SRVW0_SSO0_SVW1_SK0_SKFTR0_SKXCCM0_TLDS1_ULSGRO0_USL1_UIOFGRO0_USFGROn1_VSn1_VWA1_VWB1_WSGRA0_WSGRB0_WS32_WG16_2_1_WGM8_WGMXCC1_WGMXCCGn1
    SolutionIndex: 98
    SolutionNameMin: Cijk_Alik_Bljk_BBS_BH_Bias_HA_S_SAV_UserArgs_MT16x16x128_MI16x16x1_SN_LDSB0_AFC1_AG0_AFEM1_AFEM1_ASEM1_CLR0_CADS0_DTLA0_DTLB0_DTVA0_DTVB0_EPS0_FDSI0_GRPM1_GRVWA8_GRVWB8_GSU1_GSUAMB_GSUC0_GSUWGMRR0_GLS0_ISA1100_IU1_K1_LDSTI0_LBSPPA256_LBSPPB256_LBSPPM0_LPA8_LPB8_LPM0_LRVW16_LWPMn1_MIAV1_MIWT1_1_MO40_NTn1_NTA0_NTB0_NTC0_NTD0_NTM0_NEPBS0_NLCA1_NLCB1_ONLL1_PGR0_PLR1_PKA0_SIA1_SS1_SU32_SUM1_SUS256_SPO0_SRVW0_SSO0_SVW1_SK0_SKFTR0_SKXCCM0_TLDS1_ULSGRO0_USL1_UIOFGRO0_USFGROn1_VSn1_VWA1_VWB1_WSGRA0_WSGRB0_WS32_WG16_2_1_WGM8_WGMXCC1_WGMXCCGn1
    SolutionIndex: 99
    SolutionNameMin: Cijk_Alik_Bljk_BBS_BH_Bias_HA_S_SAV_UserArgs_MT16x16x128_MI16x16x1_SN_LDSB0_AFC1_AG0_AFEM1_AFEM1_ASEM1_CLR0_CADS0_DTLA0_DTLB0_DTVA0_DTVB0_EPS0_FDSI0_GRPM1_GRVWA8_GRVWB8_GSU1_GSUAMB_GSUC0_GSUWGMRR0_GLS0_ISA1100_IU1_K1_LDSTI0_LBSPPA256_LBSPPB256_LBSPPM0_LPA8_LPB8_LPM0_LRVW16_LWPMn1_MIAV1_MIWT1_1_MO40_NTn1_NTA0_NTB0_NTC0_NTD0_NTM0_NEPBS0_NLCA1_NLCB1_ONLL1_PGR0_PLR1_PKA0_SIA3_SS1_SU32_SUM1_SUS256_SPO0_SRVW0_SSO0_SVW1_SK0_SKFTR0_SKXCCM0_TLDS1_ULSGRO0_USL1_UIOFGRO0_USFGROn1_VSn1_VWA1_VWB1_WSGRA0_WSGRB0_WS32_WG16_2_1_WGM8_WGMXCC1_WGMXCCGn1
    SolutionIndex: 100
    SolutionNameMin: Cijk_Alik_Bljk_BBS_BH_Bias_HA_S_SAV_UserArgs_MT32x16x128_MI16x16x1_SN_LDSB0_AFC1_AG0_AFEM1_AFEM1_ASEM1_CLR0_CADS0_DTLA0_DTLB0_DTVA0_DTVB0_EPS0_FDSI0_GRPM1_GRVWA8_GRVWB8_GSU1_GSUAMB_GSUC0_GSUWGMRR0_GLS0_ISA1100_IU1_K1_LDSTI0_LBSPPA256_LBSPPB256_LBSPPM0_LPA8_LPB8_LPM0_LRVW16_LWPMn1_MIAV1_MIWT1_1_MO40_NTn1_NTA0_NTB0_NTC0_NTD0_NTM0_NEPBS0_NLCA1_NLCB1_ONLL1_PGR2_PLR1_PKA0_SIA3_SS1_SU32_SUM1_SUS256_SPO0_SRVW0_SSO0_SVW1_SK0_SKFTR0_SKXCCM0_TLDS1_ULSGRO0_USL1_UIOFGRO0_USFGROn1_VSn1_VWA1_VWB1_WSGRA0_WSGRB0_WS32_WG32_2_1_WGM8_WGMXCC1_WGMXCCGn1
    SolutionIndex: 101
    SolutionNameMin: Cijk_Alik_Bljk_BBS_BH_Bias_HA_S_SAV_UserArgs_MT32x16x128_MI16x16x1_SN_LDSB0_AFC1_AG0_AFEM1_AFEM1_ASEM1_CLR0_CADS0_DTLA0_DTLB0_DTVA0_DTVB0_EPS0_FDSI0_GRPM1_GRVWA8_GRVWB8_GSU1_GSUAMB_GSUC0_GSUWGMRR0_GLS0_ISA1100_IU1_K1_LDSTI0_LBSPPA256_LBSPPB256_LBSPPM0_LPA8_LPB8_LPM0_LRVW16_LWPMn1_MIAV1_MIWT1_1_MO40_NTn1_NTA0_NTB0_NTC0_NTD0_NTM0_NEPBS0_NLCA1_NLCB1_ONLL1_PGR1_PLR1_PKA0_SIA1_SS1_SU32_SUM1_SUS256_SPO0_SRVW0_SSO0_SVW1_SK0_SKFTR0_SKXCCM0_TLDS1_ULSGRO0_USL1_UIOFGRO0_USFGROn1_VSn1_VWA1_VWB1_WSGRA0_WSGRB0_WS32_WG32_2_1_WGM8_WGMXCC1_WGMXCCGn1
    SolutionIndex: 102
    SolutionNameMin: Cijk_Alik_Bljk_BBS_BH_Bias_HA_S_SAV_UserArgs_MT16x16x32_MI16x16x1_SN_LDSB0_AFC1_AG0_AFEM1_AFEM1_ASEM1_CLR0_CADS0_DTLA0_DTLB0_DTVA0_DTVB0_EPS0_FDSI0_GRPM1_GRVWA8_GRVWB8_GSU1_GSUAMB_GSUC0_GSUWGMRR0_GLS0_ISA1100_IU1_K1_LDSTI0_LBSPPA128_LBSPPB128_LBSPPM0_LPA8_LPB8_LPM0_LRVW16_LWPMn1_MIAV1_MIWT1_1_MO40_NTn1_NTA0_NTB0_NTC0_NTD0_NTM0_NEPBS0_NLCA1_NLCB1_ONLL1_PGR1_PLR1_PKA0_SIA1_SS1_SU32_SUM1_SUS256_SPO0_SRVW0_SSO0_SVW1_SK0_SKFTR0_SKXCCM0_TLDS1_ULSGRO0_USL1_UIOFGRO0_USFGROn1_VSn1_VWA1_VWB1_WSGRA0_WSGRB0_WS32_WG16_2_1_WGM8_WGMXCC1_WGMXCCGn1
    SolutionIndex: 103
    SolutionNameMin: Cijk_Alik_Bljk_BBS_BH_Bias_HA_S_SAV_UserArgs_MT32x32x32_MI16x16x1_SN_LDSB0_AFC1_AG0_AFEM1_AFEM1_ASEM1_CLR0_CADS0_DTLA0_DTLB0_DTVA0_DTVB0_EPS0_FDSI0_GRPM1_GRVWA8_GRVWB8_GSU1_GSUAMB_GSUC0_GSUWGMRR0_GLS0_ISA1100_IU1_K1_LDSTI0_LBSPPA128_LBSPPB128_LBSPPM0_LPA8_LPB8_LPM0_LRVW16_LWPMn1_MIAV1_MIWT1_1_MO40_NTn1_NTA0_NTB0_NTC0_NTD0_NTM0_NEPBS0_NLCA1_NLCB1_ONLL1_PGR2_PLR1_PKA0_SIA1_SS1_SU32_SUM1_SUS256_SPO0_SRVW0_SSO0_SVW1_SK0_SKFTR0_SKXCCM0_TLDS1_ULSGRO0_USL1_UIOFGRO0_USFGROn1_VSn1_VWA1_VWB1_WSGRA0_WSGRB0_WS32_WG32_4_1_WGM8_WGMXCC1_WGMXCCGn1
    SolutionIndex: 104
    SolutionNameMin: Cijk_Alik_Bljk_BBS_BH_Bias_HA_S_SAV_UserArgs_MT32x16x16_MI16x16x1_SN_LDSB0_AFC1_AG0_AFEM1_AFEM1_ASEM1_CLR0_CADS0_DTLA0_DTLB0_DTVA0_DTVB0_EPS0_FDSI0_GRPM1_GRVWA8_GRVWB4_GSU1_GSUAMB_GSUC0_GSUWGMRR0_GLS0_ISA1100_IU1_K1_LDSTI0_LBSPPA128_LBSPPB128_LBSPPM0_LPA8_LPB8_LPM0_LRVW16_LWPMn1_MIAV1_MIWT1_1_MO40_NTn1_NTA0_NTB0_NTC0_NTD0_NTM0_NEPBS0_NLCA1_NLCB1_ONLL1_PGR2_PLR0_PKA0_SIA3_SS1_SU32_SUM1_SUS256_SPO0_SRVW0_SSO0_SVW1_SK0_SKFTR0_SKXCCM0_TLDS1_ULSGRO0_USL1_UIOFGRO0_USFGROn1_VSn1_VWA1_VWB1_WSGRA0_WSGRB0_WS32_WG32_2_1_WGM8_WGMXCC1_WGMXCCGn1
    SolutionIndex: 105
    SolutionNameMin: Cijk_Alik_Bljk_BBS_BH_Bias_HA_S_SAV_UserArgs_MT16x16x128_MI16x16x1_SN_LDSB0_AFC1_AG0_AFEM1_AFEM1_ASEM1_CLR0_CADS0_DTLA0_DTLB0_DTVA0_DTVB0_EPS0_FDSI0_GRPM1_GRVWA8_GRVWB8_GSU1_GSUAMB_GSUC0_GSUWGMRR0_GLS0_ISA1100_IU1_K1_LDSTI0_LBSPPA256_LBSPPB256_LBSPPM0_LPA8_LPB8_LPM0_LRVW16_LWPMn1_MIAV1_MIWT1_1_MO40_NTn1_NTA0_NTB0_NTC0_NTD0_NTM0_NEPBS0_NLCA1_NLCB1_ONLL1_PGR1_PLR1_PKA0_SIA3_SS1_SU32_SUM1_SUS256_SPO0_SRVW0_SSO0_SVW1_SK0_SKFTR0_SKXCCM0_TLDS1_ULSGRO0_USL1_UIOFGRO0_USFGROn1_VSn1_VWA1_VWB1_WSGRA0_WSGRB0_WS32_WG16_2_1_WGM8_WGMXCC1_WGMXCCGn1
    SolutionIndex: 106
    SolutionNameMin: Cijk_Alik_Bljk_BBS_BH_Bias_HA_S_SAV_UserArgs_MT16x16x64_MI16x16x1_SN_LDSB0_AFC1_AG0_AFEM1_AFEM1_ASEM1_CLR0_CADS0_DTLA0_DTLB0_DTVA0_DTVB0_EPS0_FDSI0_GRPM1_GRVWA8_GRVWB8_GSU1_GSUAMB_GSUC0_GSUWGMRR0_GLS0_ISA1100_IU1_K1_LDSTI0_LBSPPA128_LBSPPB128_LBSPPM0_LPA8_LPB8_LPM0_LRVW16_LWPMn1_MIAV1_MIWT1_1_MO40_NTn1_NTA0_NTB0_NTC0_NTD0_NTM0_NEPBS0_NLCA1_NLCB1_ONLL1_PGR2_PLR1_PKA0_SIA1_SS1_SU32_SUM1_SUS256_SPO0_SRVW0_SSO0_SVW1_SK0_SKFTR0_SKXCCM0_TLDS1_ULSGRO0_USL1_UIOFGRO0_USFGROn1_VSn1_VWA1_VWB1_WSGRA0_WSGRB0_WS32_WG16_2_1_WGM8_WGMXCC1_WGMXCCGn1
    SolutionIndex: 107
    SolutionNameMin: Cijk_Alik_Bljk_BBS_BH_Bias_HA_S_SAV_UserArgs_MT32x16x64_MI16x16x1_SN_LDSB0_AFC1_AG0_AFEM1_AFEM1_ASEM1_CLR0_CADS0_DTLA0_DTLB0_DTVA0_DTVB0_EPS0_FDSI0_GRPM1_GRVWA8_GRVWB8_GSU1_GSUAMB_GSUC0_GSUWGMRR0_GLS0_ISA1100_IU1_K1_LDSTI0_LBSPPA128_LBSPPB128_LBSPPM0_LPA8_LPB8_LPM0_LRVW16_LWPMn1_MIAV1_MIWT1_1_MO40_NTn1_NTA0_NTB0_NTC0_NTD0_NTM0_NEPBS0_NLCA1_NLCB1_ONLL1_PGR2_PLR1_PKA0_SIA3_SS1_SU32_SUM1_SUS256_SPO0_SRVW0_SSO0_SVW1_SK0_SKFTR0_SKXCCM0_TLDS1_ULSGRO0_USL1_UIOFGRO0_USFGROn1_VSn1_VWA1_VWB1_WSGRA0_WSGRB0_WS32_WG32_2_1_WGM8_WGMXCC1_WGMXCCGn1
    SolutionIndex: 108
    SolutionNameMin: Cijk_Alik_Bljk_BBS_BH_Bias_HA_S_SAV_UserArgs_MT32x32x128_MI16x16x1_SN_LDSB0_AFC1_AG0_AFEM1_AFEM1_ASEM1_CLR0_CADS0_DTLA0_DTLB0_DTVA0_DTVB0_EPS0_FDSI0_GRPM1_GRVWA8_GRVWB8_GSU1_GSUAMB_GSUC0_GSUWGMRR0_GLS0_ISA1100_IU1_K1_LDSTI0_LBSPPA256_LBSPPB256_LBSPPM0_LPA8_LPB8_LPM0_LRVW16_LWPMn1_MIAV1_MIWT1_1_MO40_NTn1_NTA0_NTB0_NTC0_NTD0_NTM0_NEPBS0_NLCA1_NLCB1_ONLL1_PGR1_PLR1_PKA0_SIA3_SS1_SU32_SUM1_SUS256_SPO0_SRVW0_SSO0_SVW1_SK0_SKFTR0_SKXCCM0_TLDS1_ULSGRO0_USL1_UIOFGRO0_USFGROn1_VSn1_VWA1_VWB1_WSGRA0_WSGRB0_WS32_WG32_4_1_WGM8_WGMXCC1_WGMXCCGn1
    SolutionIndex: 109
    SolutionNameMin: Cijk_Alik_Bljk_BBS_BH_Bias_HA_S_SAV_UserArgs_MT32x32x128_MI16x16x1_SN_LDSB0_AFC1_AG0_AFEM1_AFEM1_ASEM1_CLR0_CADS0_DTLA0_DTLB0_DTVA0_DTVB0_EPS0_FDSI0_GRPM1_GRVWA8_GRVWB8_GSU1_GSUAMB_GSUC0_GSUWGMRR0_GLS0_ISA1100_IU1_K1_LDSTI0_LBSPPA256_LBSPPB256_LBSPPM0_LPA8_LPB8_LPM0_LRVW16_LWPMn1_MIAV1_MIWT1_1_MO40_NTn1_NTA0_NTB0_NTC0_NTD0_NTM0_NEPBS0_NLCA1_NLCB1_ONLL1_PGR2_PLR1_PKA0_SIA3_SS1_SU32_SUM1_SUS256_SPO0_SRVW0_SSO0_SVW1_SK0_SKFTR0_SKXCCM0_TLDS1_ULSGRO0_USL1_UIOFGRO0_USFGROn1_VSn1_VWA1_VWB1_WSGRA0_WSGRB0_WS32_WG32_4_1_WGM8_WGMXCC1_WGMXCCGn1
    SolutionIndex: 110
    SolutionNameMin: Cijk_Alik_Bljk_BBS_BH_Bias_HA_S_SAV_UserArgs_MT32x16x128_MI16x16x1_SN_LDSB0_AFC1_AG0_AFEM1_AFEM1_ASEM1_CLR0_CADS0_DTLA0_DTLB0_DTVA0_DTVB0_EPS0_FDSI0_GRPM1_GRVWA8_GRVWB8_GSU1_GSUAMB_GSUC0_GSUWGMRR0_GLS0_ISA1100_IU1_K1_LDSTI0_LBSPPA256_LBSPPB256_LBSPPM0_LPA8_LPB8_LPM0_LRVW16_LWPMn1_MIAV1_MIWT1_1_MO40_NTn1_NTA0_NTB0_NTC0_NTD0_NTM0_NEPBS0_NLCA1_NLCB1_ONLL1_PGR1_PLR1_PKA0_SIA3_SS1_SU32_SUM1_SUS256_SPO0_SRVW0_SSO0_SVW1_SK0_SKFTR0_SKXCCM0_TLDS1_ULSGRO0_USL1_UIOFGRO0_USFGROn1_VSn1_VWA1_VWB1_WSGRA0_WSGRB0_WS32_WG32_2_1_WGM8_WGMXCC1_WGMXCCGn1
    SolutionIndex: 111
    SolutionNameMin: Cijk_Alik_Bljk_BBS_BH_Bias_HA_S_SAV_UserArgs_MT16x16x32_MI16x16x1_SN_LDSB1_AFC1_AG0_AFEM1_AFEM1_ASEM1_CLR0_CADS0_DTLA0_DTLB0_DTVA0_DTVB0_EPS0_FDSI0_GRPM1_GRVWA8_GRVWB8_GSU1_GSUAMB_GSUC0_GSUWGMRR0_GLS0_ISA1100_IU1_K1_LDSTI0_LBSPPA128_LBSPPB128_LBSPPM0_LPA8_LPB8_LPM0_LRVW16_LWPMn1_MIAV1_MIWT1_1_MO40_NTn1_NTA0_NTB0_NTC0_NTD0_NTM0_NEPBS0_NLCA1_NLCB1_ONLL1_PGR1_PLR1_PKA0_SIA3_SS1_SU32_SUM1_SUS256_SPO0_SRVW0_SSO0_SVW1_SK0_SKFTR0_SKXCCM0_TLDS1_ULSGRO0_USL1_UIOFGRO0_USFGROn1_VSn1_VWA1_VWB1_WSGRA0_WSGRB0_WS32_WG16_2_1_WGM8_WGMXCC1_WGMXCCGn1
    SolutionIndex: 112
    SolutionNameMin: Cijk_Alik_Bljk_BBS_BH_Bias_HA_S_SAV_UserArgs_MT32x16x64_MI16x16x1_SN_LDSB0_AFC1_AG0_AFEM1_AFEM1_ASEM1_CLR0_CADS0_DTLA0_DTLB0_DTVA0_DTVB0_EPS0_FDSI0_GRPM1_GRVWA8_GRVWB8_GSU1_GSUAMB_GSUC0_GSUWGMRR0_GLS0_ISA1100_IU1_K1_LDSTI0_LBSPPA128_LBSPPB128_LBSPPM0_LPA8_LPB8_LPM0_LRVW16_LWPMn1_MIAV1_MIWT1_1_MO40_NTn1_NTA0_NTB0_NTC0_NTD0_NTM0_NEPBS0_NLCA1_NLCB1_ONLL1_PGR2_PLR1_PKA0_SIA1_SS1_SU32_SUM1_SUS256_SPO0_SRVW0_SSO0_SVW1_SK0_SKFTR0_SKXCCM0_TLDS1_ULSGRO0_USL1_UIOFGRO0_USFGROn1_VSn1_VWA1_VWB1_WSGRA0_WSGRB0_WS32_WG32_2_1_WGM8_WGMXCC1_WGMXCCGn1
    SolutionIndex: 113
    SolutionNameMin: Cijk_Alik_Bljk_BBS_BH_Bias_HA_S_SAV_UserArgs_MT32x32x128_MI16x16x1_SN_LDSB0_AFC1_AG0_AFEM1_AFEM1_ASEM1_CLR0_CADS0_DTLA0_DTLB0_DTVA0_DTVB0_EPS0_FDSI0_GRPM1_GRVWA8_GRVWB8_GSU1_GSUAMB_GSUC0_GSUWGMRR0_GLS0_ISA1100_IU1_K1_LDSTI0_LBSPPA256_LBSPPB256_LBSPPM0_LPA8_LPB8_LPM0_LRVW16_LWPMn1_MIAV1_MIWT1_1_MO40_NTn1_NTA0_NTB0_NTC0_NTD0_NTM0_NEPBS0_NLCA1_NLCB1_ONLL1_PGR1_PLR1_PKA0_SIA1_SS1_SU32_SUM1_SUS256_SPO0_SRVW0_SSO0_SVW1_SK0_SKFTR0_SKXCCM0_TLDS1_ULSGRO0_USL1_UIOFGRO0_USFGROn1_VSn1_VWA1_VWB1_WSGRA0_WSGRB0_WS32_WG32_4_1_WGM8_WGMXCC1_WGMXCCGn1
    SolutionIndex: 114
    SolutionNameMin: Cijk_Alik_Bljk_BBS_BH_Bias_HA_S_SAV_UserArgs_MT64x16x64_MI16x16x1_SN_LDSB0_AFC1_AG0_AFEM1_AFEM1_ASEM1_CLR0_CADS0_DTLA0_DTLB0_DTVA0_DTVB0_EPS0_FDSI0_GRPM1_GRVWA8_GRVWB8_GSU1_GSUAMB_GSUC0_GSUWGMRR0_GLS0_ISA1100_IU1_K1_LDSTI0_LBSPPA128_LBSPPB128_LBSPPM0_LPA8_LPB8_LPM0_LRVW16_LWPMn1_MIAV1_MIWT1_1_MO40_NTn1_NTA0_NTB0_NTC0_NTD0_NTM0_NEPBS0_NLCA1_NLCB1_ONLL1_PGR2_PLR1_PKA0_SIA3_SS1_SU32_SUM1_SUS256_SPO0_SRVW0_SSO0_SVW1_SK0_SKFTR0_SKXCCM0_TLDS1_ULSGRO0_USL1_UIOFGRO0_USFGROn1_VSn1_VWA1_VWB1_WSGRA0_WSGRB0_WS32_WG64_2_1_WGM8_WGMXCC1_WGMXCCGn1
    SolutionIndex: 115
    SolutionNameMin: Cijk_Alik_Bljk_BBS_BH_Bias_HA_S_SAV_UserArgs_MT16x16x32_MI16x16x1_SN_LDSB1_AFC1_AG0_AFEM1_AFEM1_ASEM1_CLR0_CADS0_DTLA0_DTLB0_DTVA0_DTVB0_EPS0_FDSI0_GRPM1_GRVWA8_GRVWB8_GSU1_GSUAMB_GSUC0_GSUWGMRR0_GLS0_ISA1100_IU1_K1_LDSTI0_LBSPPA128_LBSPPB128_LBSPPM0_LPA8_LPB8_LPM0_LRVW16_LWPMn1_MIAV1_MIWT1_1_MO40_NTn1_NTA0_NTB0_NTC0_NTD0_NTM0_NEPBS0_NLCA1_NLCB1_ONLL1_PGR2_PLR1_PKA0_SIA3_SS1_SU32_SUM1_SUS256_SPO0_SRVW0_SSO0_SVW1_SK0_SKFTR0_SKXCCM0_TLDS1_ULSGRO0_USL1_UIOFGRO0_USFGROn1_VSn1_VWA1_VWB1_WSGRA0_WSGRB0_WS32_WG16_2_1_WGM8_WGMXCC1_WGMXCCGn1
    SolutionIndex: 116
    SolutionNameMin: Cijk_Alik_Bljk_BBS_BH_Bias_HA_S_SAV_UserArgs_MT128x32x32_MI16x16x1_SN_LDSB0_AFC1_AG0_AFEM1_AFEM1_ASEM1_CLR0_CADS0_DTLA0_DTLB0_DTVA0_DTVB0_EPS0_FDSI0_GRPM1_GRVWA8_GRVWB8_GSU1_GSUAMB_GSUC0_GSUWGMRR0_GLS0_ISA1100_IU1_K1_LDSTI0_LBSPPA128_LBSPPB128_LBSPPM0_LPA8_LPB8_LPM0_LRVW16_LWPMn1_MIAV1_MIWT2_2_MO40_NTn1_NTA0_NTB0_NTC0_NTD0_NTM0_NEPBS0_NLCA1_NLCB1_ONLL1_PGR2_PLR1_PKA0_SIA3_SS1_SU32_SUM1_SUS256_SPO0_SRVW0_SSO0_SVW1_SK0_SKFTR0_SKXCCM0_TLDS1_ULSGRO0_USL1_UIOFGRO0_USFGROn1_VSn1_VWA1_VWB1_WSGRA0_WSGRB0_WS32_WG64_2_1_WGM8_WGMXCC1_WGMXCCGn1
    SolutionIndex: 117
    SolutionNameMin: Cijk_Alik_Bljk_BBS_BH_Bias_HA_S_SAV_UserArgs_MT32x64x64_MI16x16x1_SN_LDSB0_AFC1_AG0_AFEM1_AFEM1_ASEM1_CLR0_CADS0_DTLA0_DTLB0_DTVA0_DTVB0_EPS0_FDSI0_GRPM1_GRVWA8_GRVWB8_GSU1_GSUAMB_GSUC0_GSUWGMRR0_GLS0_ISA1100_IU1_K1_LDSTI0_LBSPPA128_LBSPPB128_LBSPPM0_LPA8_LPB8_LPM0_LRVW16_LWPMn1_MIAV1_MIWT2_1_MO40_NTn1_NTA0_NTB0_NTC0_NTD0_NTM0_NEPBS0_NLCA1_NLCB1_ONLL1_PGR2_PLR1_PKA0_SIA1_SS1_SU32_SUM1_SUS256_SPO0_SRVW0_SSO0_SVW1_SK0_SKFTR0_SKXCCM0_TLDS1_ULSGRO0_USL1_UIOFGRO0_USFGROn1_VSn1_VWA1_VWB1_WSGRA0_WSGRB0_WS32_WG16_8_1_WGM8_WGMXCC1_WGMXCCGn1
    SolutionIndex: 118
    SolutionNameMin: Cijk_Alik_Bljk_BBS_BH_Bias_HA_S_SAV_UserArgs_MT32x16x128_MI16x16x1_SN_LDSB0_AFC1_AG0_AFEM1_AFEM1_ASEM1_CLR0_CADS0_DTLA0_DTLB0_DTVA0_DTVB0_EPS0_FDSI0_GRPM1_GRVWA8_GRVWB8_GSU1_GSUAMB_GSUC0_GSUWGMRR0_GLS0_ISA1100_IU1_K1_LDSTI0_LBSPPA256_LBSPPB256_LBSPPM0_LPA8_LPB8_LPM0_LRVW16_LWPMn1_MIAV1_MIWT1_1_MO40_NTn1_NTA0_NTB0_NTC0_NTD0_NTM0_NEPBS0_NLCA1_NLCB1_ONLL1_PGR2_PLR1_PKA0_SIA1_SS1_SU32_SUM1_SUS256_SPO0_SRVW0_SSO0_SVW1_SK0_SKFTR0_SKXCCM0_TLDS1_ULSGRO0_USL1_UIOFGRO0_USFGROn1_VSn1_VWA1_VWB1_WSGRA0_WSGRB0_WS32_WG32_2_1_WGM8_WGMXCC1_WGMXCCGn1
- - - [64, 64, 1, 64]
    - [17, 22.7951]
  - - [256, 256, 1, 256]
    - [86, 1398.1]
  - - [320, 64, 1, 64]
    - [15, 104.858]
  - - [576, 64, 1, 64]
    - [10, 188.744]
  - - [832, 64, 1, 64]
    - [20, 283.989]
  - - [1088, 64, 1, 64]
    - [22, 356.516]
  - - [1344, 64, 1, 64]
    - [24, 393.216]
  - - [1600, 64, 1, 64]
    - [111, 485.452]
  - - [1856, 64, 1, 64]
    - [97, 661.059]
  - - [2112, 64, 1, 64]
    - [18, 640.796]
  - - [2368, 64, 1, 64]
    - [65, 692.809]
  - - [2624, 64, 1, 64]
    - [21, 895.659]
  - - [2880, 64, 1, 64]
    - [15, 943.718]
  - - [3136, 64, 1, 64]
    - [26, 988.081]
  - - [3392, 64, 1, 64]
    - [8, 868.352]
  - - [3648, 64, 1, 64]
    - [73, 1067.3]
  - - [3904, 64, 1, 64]
    - [68, 1102.81]
  - - [64, 320, 1, 64]
    - [21, 109.227]
  - - [320, 320, 1, 64]
    - [15, 546.133]
  - - [576, 320, 1, 64]
    - [19, 943.718]
  - - [832, 320, 1, 64]
    - [40, 1175.13]
  - - [1088, 320, 1, 64]
    - [44, 1650.54]
  - - [1344, 320, 1, 64]
    - [12, 1487.84]
  - - [1600, 320, 1, 64]
    - [80, 2427.26]
  - - [1856, 320, 1, 64]
    - [27, 2923.91]
  - - [2112, 320, 1, 64]
    - [41, 3327.21]
  - - [2368, 320, 1, 64]
    - [50, 3031.04]
  - - [2624, 320, 1, 64]
    - [9, 2828.4]
  - - [2880, 320, 1, 64]
    - [51, 3686.4]
  - - [3136, 320, 1, 64]
    - [41, 4014.08]
  - - [3392, 320, 1, 64]
    - [41, 4086.36]
  - - [3648, 320, 1, 64]
    - [42, 4150.61]
  - - [3904, 320, 1, 64]
    - [111, 3997.7]
  - - [64, 576, 1, 64]
    - [27, 188.744]
  - - [320, 576, 1, 64]
    - [27, 907.422]
  - - [576, 576, 1, 64]
    - [21, 1633.36]
  - - [832, 576, 1, 64]
    - [22, 2190.77]
  - - [1088, 576, 1, 64]
    - [25, 2673.87]
  - - [1344, 576, 1, 64]
    - [24, 3196.47]
  - - [1600, 576, 1, 64]
    - [26, 4213.03]
  - - [1856, 576, 1, 64]
    - [69, 4561.31]
  - - [2112, 576, 1, 64]
    - [25, 5023.02]
  - - [2368, 576, 1, 64]
    - [10, 5134.94]
  - - [2624, 576, 1, 64]
    - [44, 5373.95]
  - - [2880, 576, 1, 64]
    - [5, 5587.81]
  - - [3136, 576, 1, 64]
    - [24, 6606.03]
  - - [64, 832, 1, 64]
    - [97, 262.144]
  - - [320, 832, 1, 64]
    - [20, 1135.96]
  - - [576, 832, 1, 64]
    - [115, 2044.72]
  - - [832, 832, 1, 64]
    - [10, 2953.49]
  - - [1088, 832, 1, 64]
    - [23, 3620.86]
  - - [1344, 832, 1, 64]
    - [61, 3670.02]
  - - [1600, 832, 1, 64]
    - [46, 4733.16]
  - - [1856, 832, 1, 64]
    - [27, 6176.77]
  - - [2112, 832, 1, 64]
    - [26, 6615.28]
  - - [64, 1088, 1, 64]
    - [16, 371.371]
  - - [320, 1088, 1, 64]
    - [88, 1485.48]
  - - [576, 1088, 1, 64]
    - [15, 2766.07]
  - - [832, 1088, 1, 64]
    - [117, 3407.87]
  - - [1088, 1088, 1, 64]
    - [46, 4456.45]
  - - [1344, 1088, 1, 64]
    - [32, 5347.74]
  - - [1600, 1088, 1, 64]
    - [13, 5570.56]
  - - [64, 1344, 1, 64]
    - [43, 407.78]
  - - [320, 1344, 1, 64]
    - [13, 1619.12]
  - - [576, 1344, 1, 64]
    - [80, 3303.01]
  - - [832, 1344, 1, 64]
    - [25, 4337.29]
  - - [1088, 1344, 1, 64]
    - [2, 4068.93]
  - - [1344, 1344, 1, 64]
    - [70, 5138.02]
  - - [64, 1600, 1, 64]
    - [21, 524.288]
  - - [320, 1600, 1, 64]
    - [39, 2621.44]
  - - [576, 1600, 1, 64]
    - [26, 3932.16]
  - - [832, 1600, 1, 64]
    - [10, 5011.58]
  - - [1088, 1600, 1, 64]
    - [112, 4456.45]
  - - [64, 1856, 1, 64]
    - [112, 608.174]
  - - [320, 1856, 1, 64]
    - [24, 2715.06]
  - - [576, 1856, 1, 64]
    - [23, 4146.64]
  - - [832, 1856, 1, 64]
    - [27, 5813.43]
  - - [64, 2112, 1, 64]
    - [21, 640.796]
  - - [320, 2112, 1, 64]
    - [22, 2621.44]
  - - [576, 2112, 1, 64]
    - [80, 4579.81]
  - - [832, 2112, 1, 64]
    - [74, 5918.94]
  - - [64, 2368, 1, 64]
    - [80, 718.469]
  - - [320, 2368, 1, 64]
    - [81, 2939.19]
  - - [576, 2368, 1, 64]
    - [81, 3062.95]
  - - [64, 2624, 1, 64]
    - [65, 895.659]
  - - [320, 2624, 1, 64]
    - [39, 4133.81]
  - - [576, 2624, 1, 64]
    - [31, 5862.49]
  - - [64, 2880, 1, 64]
    - [15, 983.04]
  - - [320, 2880, 1, 64]
    - [13, 4067.75]
  - - [576, 2880, 1, 64]
    - [9, 6245.2]
  - - [64, 3136, 1, 64]
    - [11, 1027.6]
  - - [320, 3136, 1, 64]
    - [26, 4429.33]
  - - [576, 3136, 1, 64]
    - [26, 6800.32]
  - - [64, 3392, 1, 64]
    - [15, 1111.49]
  - - [320, 3392, 1, 64]
    - [33, 4341.76]
  - - [64, 3648, 1, 64]
    - [117, 1195.38]
  - - [320, 3648, 1, 64]
    - [69, 4820.07]
  - - [64, 3904, 1, 64]
    - [10, 1279.26]
  - - [320, 3904, 1, 64]
    - [55, 5158.32]
  - - [64, 64, 1, 256]
    - [113, 83.8861]
  - - [320, 64, 1, 256]
    - [108, 436.907]
  - - [576, 64, 1, 256]
    - [85, 754.975]
  - - [832, 64, 1, 256]
    - [19, 1090.52]
  - - [1088, 64, 1, 256]
    - [63, 1426.06]
  - - [1344, 64, 1, 256]
    - [108, 1761.61]
  - - [1600, 64, 1, 256]
    - [87, 2097.15]
  - - [1856, 64, 1, 256]
    - [44, 2432.7]
  - - [2112, 64, 1, 256]
    - [112, 2661.77]
  - - [2368, 64, 1, 256]
    - [20, 3103.78]
  - - [2624, 64, 1, 256]
    - [16, 3307.05]
  - - [2880, 64, 1, 256]
    - [64, 3495.25]
  - - [3136, 64, 1, 256]
    - [64, 3952.32]
  - - [3392, 64, 1, 256]
    - [11, 4274.96]
  - - [3648, 64, 1, 256]
    - [11, 4427.32]
  - - [3904, 64, 1, 256]
    - [11, 4738.01]
  - - [64, 320, 1, 256]
    - [92, 419.43]
  - - [320, 320, 1, 256]
    - [106, 2097.15]
  - - [576, 320, 1, 256]
    - [103, 3774.87]
  - - [832, 320, 1, 256]
    - [11, 5242.88]
  - - [1088, 320, 1, 256]
    - [10, 6602.15]
  - - [1344, 320, 1, 256]
    - [43, 7864.32]
  - - [64, 576, 1, 256]
    - [86, 754.975]
  - - [320, 576, 1, 256]
    - [117, 3495.25]
  - - [576, 576, 1, 256]
    - [10, 6291.46]
  - - [832, 576, 1, 256]
    - [10, 8460.92]
  - - [64, 832, 1, 256]
    - [99, 1090.52]
  - - [320, 832, 1, 256]
    - [10, 5242.88]
  - - [576, 832, 1, 256]
    - [10, 8460.92]
  - - [64, 1088, 1, 256]
    - [64, 1371.21]
  - - [320, 1088, 1, 256]
    - [10, 6602.15]
  - - [64, 1344, 1, 256]
    - [62, 1761.61]
  - - [320, 1344, 1, 256]
    - [10, 7864.32]
  - - [64, 1600, 1, 256]
    - [99, 2097.15]
  - - [64, 1856, 1, 256]
    - [21, 2432.7]
  - - [64, 2112, 1, 256]
    - [10, 2661.77]
  - - [64, 2368, 1, 256]
    - [18, 2984.41]
  - - [64, 2624, 1, 256]
    - [19, 3307.05]
  - - [64, 2880, 1, 256]
    - [10, 3629.69]
  - - [64, 3136, 1, 256]
    - [11, 3805.94]
  - - [64, 3392, 1, 256]
    - [11, 4274.96]
  - - [64, 3648, 1, 256]
    - [11, 4427.32]
  - - [64, 3904, 1, 256]
    - [87, 4920.24]
  - - [64, 64, 1, 512]
    - [93, 167.772]
  - - [320, 64, 1, 512]
    - [93, 838.861]
  - - [576, 64, 1, 512]
    - [112, 1451.87]
  - - [832, 64, 1, 512]
    - [100, 2097.15]
  - - [1088, 64, 1, 512]
    - [65, 2742.43]
  - - [1344, 64, 1, 512]
    - [103, 3262.24]
  - - [1600, 64, 1, 512]
    - [106, 3883.61]
  - - [1856, 64, 1, 512]
    - [40, 4504.99]
  - - [2112, 64, 1, 512]
    - [65, 5126.37]
  - - [2368, 64, 1, 512]
    - [11, 5351.35]
  - - [2624, 64, 1, 512]
    - [64, 6141.66]
  - - [2880, 64, 1, 512]
    - [40, 6508.4]
  - - [3136, 64, 1, 512]
    - [111, 7086.93]
  - - [3392, 64, 1, 512]
    - [64, 7665.45]
  - - [3648, 64, 1, 512]
    - [115, 7969.18]
  - - [64, 320, 1, 512]
    - [93, 838.861]
  - - [320, 320, 1, 512]
    - [16, 3883.61]
  - - [576, 320, 1, 512]
    - [10, 6740.85]
  - - [64, 576, 1, 512]
    - [101, 1451.87]
  - - [320, 576, 1, 512]
    - [10, 7259.37]
  - - [64, 832, 1, 512]
    - [109, 2181.04]
  - - [64, 1088, 1, 512]
    - [113, 2852.13]
  - - [64, 1344, 1, 512]
    - [10, 3262.24]
  - - [64, 1600, 1, 512]
    - [67, 3883.61]
  - - [64, 1856, 1, 512]
    - [64, 4678.26]
  - - [64, 2112, 1, 512]
    - [10, 4943.29]
  - - [64, 2368, 1, 512]
    - [10, 5747.75]
  - - [64, 2624, 1, 512]
    - [10, 6369.13]
  - - [64, 2880, 1, 512]
    - [10, 6740.85]
  - - [64, 3136, 1, 512]
    - [10, 7340.03]
  - - [64, 3392, 1, 512]
    - [10, 7939.22]
  - - [64, 3648, 1, 512]
    - [10, 8243.98]
  - - [64, 64, 1, 1024]
    - [62, 310.689]
  - - [320, 64, 1, 1024]
    - [86, 1553.45]
  - - [576, 64, 1, 1024]
    - [118, 2796.2]
  - - [832, 64, 1, 1024]
    - [79, 3760.41]
  - - [1088, 64, 1, 1024]
    - [86, 5093.08]
  - - [1344, 64, 1, 1024]
    - [62, 5872.03]
  - - [1600, 64, 1, 1024]
    - [10, 6355.01]
  - - [1856, 64, 1, 1024]
    - [93, 7602.18]
  - - [64, 320, 1, 1024]
    - [63, 1553.45]
  - - [320, 320, 1, 1024]
    - [19, 7231.56]
  - - [64, 576, 1, 1024]
    - [100, 2903.75]
  - - [64, 832, 1, 1024]
    - [107, 4038.96]
  - - [64, 1088, 1, 1024]
    - [62, 5281.72]
  - - [64, 1344, 1, 1024]
    - [112, 6775.41]
  - - [64, 1600, 1, 1024]
    - [10, 7231.56]
  - - [64, 1856, 1, 1024]
    - [11, 8688.2]
  - - [64, 64, 1, 2048]
    - [62, 599.186]
  - - [320, 64, 1, 2048]
    - [109, 3106.89]
  - - [576, 64, 1, 2048]
    - [19, 5033.16]
  - - [832, 64, 1, 2048]
    - [93, 7035.61]
  - - [64, 320, 1, 2048]
    - [109, 2995.93]
  - - [64, 576, 1, 2048]
    - [19, 5033.16]
  - - [64, 832, 1, 2048]
    - [101, 7520.82]
  - - [64, 64, 1, 4096]
    - [109, 1016.8]
  - - [320, 64, 1, 4096]
    - [62, 4934.48]
  - - [64, 320, 1, 4096]
    - [62, 5084.0]
  - - [192, 64, 1, 64]
    - [79, 65.536]
  - - [448, 64, 1, 64]
    - [15, 146.801]
  - - [704, 64, 1, 64]
    - [92, 240.299]
  - - [960, 64, 1, 64]
    - [112, 327.68]
  - - [1216, 64, 1, 64]
    - [15, 398.459]
  - - [1472, 64, 1, 64]
    - [112, 482.345]
  - - [1728, 64, 1, 64]
    - [115, 566.231]
  - - [1984, 64, 1, 64]
    - [94, 625.113]
  - - [64, 192, 1, 64]
    - [97, 65.536]
  - - [192, 192, 1, 64]
    - [63, 196.608]
  - - [320, 192, 1, 64]
    - [10, 314.573]
  - - [448, 192, 1, 64]
    - [101, 458.752]
  - - [576, 192, 1, 64]
    - [92, 589.824]
  - - [704, 192, 1, 64]
    - [85, 665.442]
  - - [832, 192, 1, 64]
    - [64, 786.432]
  - - [960, 192, 1, 64]
    - [114, 1025.78]
  - - [1088, 192, 1, 64]
    - [97, 1069.55]
  - - [1216, 192, 1, 64]
    - [117, 1299.32]
  - - [1344, 192, 1, 64]
    - [10, 1270.39]
  - - [1472, 192, 1, 64]
    - [10, 1391.38]
  - - [1600, 192, 1, 64]
    - [10, 1638.4]
  - - [1728, 192, 1, 64]
    - [117, 1769.47]
  - - [1856, 192, 1, 64]
    - [15, 1754.35]
  - - [1984, 192, 1, 64]
    - [10, 1950.35]
  - - [192, 320, 1, 64]
    - [64, 314.573]
  - - [448, 320, 1, 64]
    - [15, 734.003]
  - - [704, 320, 1, 64]
    - [15, 1153.43]
  - - [960, 320, 1, 64]
    - [10, 1512.37]
  - - [1216, 320, 1, 64]
    - [80, 1992.29]
  - - [1472, 320, 1, 64]
    - [80, 2318.97]
  - - [1728, 320, 1, 64]
    - [80, 2621.44]
  - - [1984, 320, 1, 64]
    - [73, 3009.8]
  - - [64, 448, 1, 64]
    - [15, 152.917]
  - - [192, 448, 1, 64]
    - [16, 458.752]
  - - [320, 448, 1, 64]
    - [15, 764.587]
  - - [448, 448, 1, 64]
    - [10, 1027.6]
  - - [576, 448, 1, 64]
    - [103, 1321.21]
  - - [704, 448, 1, 64]
    - [117, 1614.81]
  - - [832, 448, 1, 64]
    - [15, 1835.01]
  - - [960, 448, 1, 64]
    - [41, 2038.9]
  - - [1088, 448, 1, 64]
    - [10, 2310.75]
  - - [1216, 448, 1, 64]
    - [41, 2582.6]
  - - [1344, 448, 1, 64]
    - [42, 2752.51]
  - - [1472, 448, 1, 64]
    - [11, 2910.7]
  - - [1600, 448, 1, 64]
    - [41, 3398.16]
  - - [1728, 448, 1, 64]
    - [75, 3538.94]
  - - [1856, 448, 1, 64]
    - [41, 3670.02]
  - - [1984, 448, 1, 64]
    - [80, 4063.23]
  - - [192, 576, 1, 64]
    - [11, 566.231]
  - - [448, 576, 1, 64]
    - [15, 1376.26]
  - - [704, 576, 1, 64]
    - [10, 1996.33]
  - - [960, 576, 1, 64]
    - [10, 2527.82]
  - - [1216, 576, 1, 64]
    - [41, 3448.2]
  - - [1472, 576, 1, 64]
    - [70, 3875.99]
  - - [1728, 576, 1, 64]
    - [69, 4393.17]
  - - [1984, 576, 1, 64]
    - [69, 5044.01]
  - - [64, 704, 1, 64]
    - [15, 240.299]
  - - [192, 704, 1, 64]
    - [65, 665.442]
  - - [320, 704, 1, 64]
    - [10, 1109.07]
  - - [448, 704, 1, 64]
    - [21, 1614.81]
  - - [576, 704, 1, 64]
    - [116, 1996.33]
  - - [704, 704, 1, 64]
    - [10, 2349.59]
  - - [832, 704, 1, 64]
    - [80, 2883.58]
  - - [960, 704, 1, 64]
    - [11, 3089.55]
  - - [1088, 704, 1, 64]
    - [41, 3501.49]
  - - [1216, 704, 1, 64]
    - [80, 3778.49]
  - - [1344, 704, 1, 64]
    - [13, 4037.02]
  - - [1472, 704, 1, 64]
    - [43, 4278.87]
  - - [1600, 704, 1, 64]
    - [10, 4650.94]
  - - [1728, 704, 1, 64]
    - [75, 4866.05]
  - - [1856, 704, 1, 64]
    - [90, 5395.09]
  - - [1984, 704, 1, 64]
    - [75, 5417.64]
  - - [192, 832, 1, 64]
    - [15, 817.889]
  - - [448, 832, 1, 64]
    - [116, 1908.41]
  - - [704, 832, 1, 64]
    - [80, 2776.78]
  - - [960, 832, 1, 64]
    - [24, 3525.38]
  - - [1216, 832, 1, 64]
    - [10, 4177.39]
  - - [1472, 832, 1, 64]
    - [77, 5056.84]
  - - [1728, 832, 1, 64]
    - [89, 5750.78]
  - - [1984, 832, 1, 64]
    - [8, 6036.8]
  - - [64, 960, 1, 64]
    - [103, 314.573]
  - - [192, 960, 1, 64]
    - [44, 943.718]
  - - [320, 960, 1, 64]
    - [11, 1456.36]
  - - [448, 960, 1, 64]
    - [111, 2038.9]
  - - [576, 960, 1, 64]
    - [39, 2621.44]
  - - [704, 960, 1, 64]
    - [47, 2983.02]
  - - [832, 960, 1, 64]
    - [69, 3525.38]
  - - [960, 960, 1, 64]
    - [70, 4067.75]
  - - [1088, 960, 1, 64]
    - [32, 4312.69]
  - - [1216, 960, 1, 64]
    - [90, 4820.07]
  - - [1344, 960, 1, 64]
    - [32, 5160.96]
  - - [1472, 960, 1, 64]
    - [55, 5481.19]
  - - [1600, 960, 1, 64]
    - [41, 5782.59]
  - - [1728, 960, 1, 64]
    - [8, 6066.76]
  - - [1856, 960, 1, 64]
    - [54, 6516.15]
  - - [1984, 960, 1, 64]
    - [82, 6772.05]
  - - [192, 1088, 1, 64]
    - [104, 1069.55]
  - - [448, 1088, 1, 64]
    - [80, 2399.63]
  - - [704, 1088, 1, 64]
    - [54, 3631.18]
  - - [960, 1088, 1, 64]
    - [70, 4312.69]
  - - [1216, 1088, 1, 64]
    - [35, 5292.03]
  - - [1472, 1088, 1, 64]
    - [43, 6212.02]
  - - [1728, 1088, 1, 64]
    - [82, 6875.66]
  - - [64, 1216, 1, 64]
    - [106, 415.061]
  - - [192, 1216, 1, 64]
    - [73, 1149.4]
  - - [320, 1216, 1, 64]
    - [103, 1915.67]
  - - [448, 1216, 1, 64]
    - [71, 2490.37]
  - - [576, 1216, 1, 64]
    - [73, 3320.49]
  - - [704, 1216, 1, 64]
    - [82, 3913.44]
  - - [832, 1216, 1, 64]
    - [80, 4316.64]
  - - [960, 1216, 1, 64]
    - [76, 4669.44]
  - - [1088, 1216, 1, 64]
    - [95, 5462.74]
  - - [1216, 1216, 1, 64]
    - [41, 5914.62]
  - - [1344, 1216, 1, 64]
    - [3, 5976.88]
  - - [1472, 1216, 1, 64]
    - [9, 6546.11]
  - - [1600, 1216, 1, 64]
    - [49, 6730.72]
  - - [192, 1344, 1, 64]
    - [22, 1436.09]
  - - [448, 1344, 1, 64]
    - [15, 2752.51]
  - - [704, 1344, 1, 64]
    - [58, 3906.79]
  - - [960, 1344, 1, 64]
    - [75, 5327.44]
  - - [1216, 1344, 1, 64]
    - [41, 5976.88]
  - - [64, 1472, 1, 64]
    - [62, 482.345]
  - - [192, 1472, 1, 64]
    - [103, 1391.38]
  - - [320, 1472, 1, 64]
    - [10, 2153.33]
  - - [448, 1472, 1, 64]
    - [73, 3246.55]
  - - [576, 1472, 1, 64]
    - [80, 3742.33]
  - - [704, 1472, 1, 64]
    - [58, 4421.5]
  - - [832, 1472, 1, 64]
    - [9, 5056.84]
  - - [960, 1472, 1, 64]
    - [56, 5834.82]
  - - [1088, 1472, 1, 64]
    - [47, 5857.05]
  - - [1216, 1472, 1, 64]
    - [54, 6546.11]
  - - [192, 1600, 1, 64]
    - [39, 1572.86]
  - - [448, 1600, 1, 64]
    - [73, 3163.81]
  - - [704, 1600, 1, 64]
    - [74, 4650.94]
  - - [960, 1600, 1, 64]
    - [41, 5957.82]
  - - [1216, 1600, 1, 64]
    - [61, 6730.72]
  - - [64, 1728, 1, 64]
    - [63, 589.824]
  - - [192, 1728, 1, 64]
    - [103, 1633.36]
  - - [320, 1728, 1, 64]
    - [89, 2359.3]
  - - [448, 1728, 1, 64]
    - [80, 3416.91]
  - - [576, 1728, 1, 64]
    - [70, 4109.74]
  - - [704, 1728, 1, 64]
    - [58, 4866.05]
  - - [832, 1728, 1, 64]
    - [75, 5576.52]
  - - [960, 1728, 1, 64]
    - [74, 5898.24]
  - - [1088, 1728, 1, 64]
    - [61, 6684.67]
  - - [192, 1856, 1, 64]
    - [47, 1754.35]
  - - [448, 1856, 1, 64]
    - [69, 3547.68]
  - - [704, 1856, 1, 64]
    - [51, 5068.12]
  - - [960, 1856, 1, 64]
    - [54, 6516.15]
  - - [64, 1984, 1, 64]
    - [103, 677.205]
  - - [192, 1984, 1, 64]
    - [87, 1875.34]
  - - [320, 1984, 1, 64]
    - [116, 2802.23]
  - - [448, 1984, 1, 64]
    - [82, 3923.12]
  - - [576, 1984, 1, 64]
    - [90, 4718.59]
  - - [704, 1984, 1, 64]
    - [90, 5417.64]
  - - [832, 1984, 1, 64]
    - [61, 6036.8]
  - - [960, 1984, 1, 64]
    - [69, 6772.05]
  - - [192, 64, 1, 256]
    - [79, 251.658]
  - - [448, 64, 1, 256]
    - [103, 564.618]
  - - [704, 64, 1, 256]
    - [108, 887.257]
  - - [960, 64, 1, 256]
    - [114, 1258.29]
  - - [1216, 64, 1, 256]
    - [100, 1532.53]
  - - [1472, 64, 1, 256]
    - [99, 1855.17]
  - - [1728, 64, 1, 256]
    - [112, 2177.81]
  - - [1984, 64, 1, 256]
    - [114, 2500.45]
  - - [64, 192, 1, 256]
    - [100, 241.979]
  - - [192, 192, 1, 256]
    - [10, 699.051]
  - - [320, 192, 1, 256]
    - [97, 1209.9]
  - - [448, 192, 1, 256]
    - [86, 1631.12]
  - - [576, 192, 1, 256]
    - [111, 2177.81]
  - - [704, 192, 1, 256]
    - [94, 2661.77]
  - - [832, 192, 1, 256]
    - [117, 3029.22]
  - - [960, 192, 1, 256]
    - [103, 3629.69]
  - - [1088, 192, 1, 256]
    - [117, 4113.64]
  - - [1216, 192, 1, 256]
    - [103, 4427.32]
  - - [1344, 192, 1, 256]
    - [116, 4893.35]
  - - [1472, 192, 1, 256]
    - [87, 5359.39]
  - - [1600, 192, 1, 256]
    - [71, 5617.37]
  - - [1728, 192, 1, 256]
    - [87, 6291.46]
  - - [1856, 192, 1, 256]
    - [71, 6516.15]
  - - [1984, 192, 1, 256]
    - [42, 6965.54]
  - - [192, 320, 1, 256]
    - [85, 1258.29]
  - - [448, 320, 1, 256]
    - [92, 2936.01]
  - - [704, 320, 1, 256]
    - [11, 4271.98]
  - - [960, 320, 1, 256]
    - [87, 5825.42]
  - - [1216, 320, 1, 256]
    - [71, 7662.67]
  - - [1472, 320, 1, 256]
    - [39, 8932.31]
  - - [64, 448, 1, 256]
    - [86, 611.669]
  - - [192, 448, 1, 256]
    - [107, 1761.61]
  - - [320, 448, 1, 256]
    - [103, 2936.01]
  - - [448, 448, 1, 256]
    - [66, 3805.94]
  - - [576, 448, 1, 256]
    - [117, 5081.56]
  - - [704, 448, 1, 256]
    - [11, 5980.77]
  - - [832, 448, 1, 256]
    - [87, 7068.18]
  - - [960, 448, 1, 256]
    - [41, 7593.14]
  - - [1088, 448, 1, 256]
    - [43, 8912.9]
  - - [192, 576, 1, 256]
    - [16, 2177.81]
  - - [448, 576, 1, 256]
    - [73, 4893.35]
  - - [704, 576, 1, 256]
    - [42, 7159.24]
  - - [64, 704, 1, 256]
    - [110, 922.747]
  - - [192, 704, 1, 256]
    - [94, 2661.77]
  - - [320, 704, 1, 256]
    - [85, 4436.28]
  - - [448, 704, 1, 256]
    - [73, 5980.77]
  - - [576, 704, 1, 256]
    - [80, 7414.93]
  - - [192, 832, 1, 256]
    - [46, 3145.73]
  - - [448, 832, 1, 256]
    - [11, 6815.74]
  - - [64, 960, 1, 256]
    - [106, 1310.72]
  - - [192, 960, 1, 256]
    - [87, 3495.25]
  - - [320, 960, 1, 256]
    - [80, 5617.37]
  - - [448, 960, 1, 256]
    - [103, 7864.32]
  - - [192, 1088, 1, 256]
    - [41, 3961.29]
  - - [448, 1088, 1, 256]
    - [71, 8318.7]
  - - [64, 1216, 1, 256]
    - [103, 1593.84]
  - - [192, 1216, 1, 256]
    - [11, 4427.32]
  - - [320, 1216, 1, 256]
    - [80, 7378.87]
  - - [192, 1344, 1, 256]
    - [10, 5081.56]
  - - [64, 1472, 1, 256]
    - [85, 2009.77]
  - - [192, 1472, 1, 256]
    - [54, 5359.39]
  - - [320, 1472, 1, 256]
    - [68, 8316.29]
  - - [192, 1600, 1, 256]
    - [87, 6049.48]
  - - [64, 1728, 1, 256]
    - [63, 2264.92]
  - - [192, 1728, 1, 256]
    - [117, 6291.46]
  - - [192, 1856, 1, 256]
    - [10, 6291.46]
  - - [64, 1984, 1, 256]
    - [65, 2600.47]
  - - [192, 1984, 1, 256]
    - [11, 7223.52]
  - - [192, 64, 1, 512]
    - [109, 483.958]
  - - [448, 64, 1, 512]
    - [85, 1129.24]
  - - [704, 64, 1, 512]
    - [100, 1774.51]
  - - [960, 64, 1, 512]
    - [112, 2419.79]
  - - [1216, 64, 1, 512]
    - [101, 3065.07]
  - - [1472, 64, 1, 512]
    - [108, 3710.35]
  - - [1728, 64, 1, 512]
    - [99, 4194.3]
  - - [1984, 64, 1, 512]
    - [64, 4643.69]
  - - [64, 192, 1, 512]
    - [62, 483.958]
  - - [192, 192, 1, 512]
    - [79, 1509.95]
  - - [320, 192, 1, 512]
    - [65, 2419.79]
  - - [448, 192, 1, 512]
    - [62, 3387.71]
  - - [576, 192, 1, 512]
    - [85, 4194.3]
  - - [704, 192, 1, 512]
    - [65, 5323.54]
  - - [832, 192, 1, 512]
    - [94, 6058.44]
  - - [960, 192, 1, 512]
    - [94, 6990.51]
  - - [1088, 192, 1, 512]
    - [64, 7639.63]
  - - [1216, 192, 1, 512]
    - [65, 8243.98]
  - - [192, 320, 1, 512]
    - [93, 2419.79]
  - - [448, 320, 1, 512]
    - [103, 5646.18]
  - - [704, 320, 1, 512]
    - [103, 8238.81]
  - - [64, 448, 1, 512]
    - [62, 1129.24]
  - - [192, 448, 1, 512]
    - [110, 3523.22]
  - - [320, 448, 1, 512]
    - [85, 5646.18]
  - - [448, 448, 1, 512]
    - [40, 7340.03]
  - - [192, 576, 1, 512]
    - [67, 4194.3]
  - - [64, 704, 1, 512]
    - [93, 1774.51]
  - - [192, 704, 1, 512]
    - [64, 5126.37]
  - - [320, 704, 1, 512]
    - [67, 8543.95]
  - - [192, 832, 1, 512]
    - [64, 5842.07]
  - - [64, 960, 1, 512]
    - [62, 2330.17]
  - - [192, 960, 1, 512]
    - [39, 6740.85]
  - - [192, 1088, 1, 512]
    - [64, 7922.57]
  - - [64, 1216, 1, 512]
    - [62, 3187.67]
  - - [192, 1216, 1, 512]
    - [72, 7969.18]
  - - [64, 1472, 1, 512]
    - [113, 3858.76]
  - - [64, 1728, 1, 512]
    - [65, 4194.3]
  - - [64, 1984, 1, 512]
    - [64, 4815.68]
  - - [192, 64, 1, 1024]
    - [100, 967.916]
  - - [448, 64, 1, 1024]
    - [109, 2258.47]
  - - [704, 64, 1, 1024]
    - [62, 3295.52]
  - - [960, 64, 1, 1024]
    - [79, 4338.94]
  - - [1216, 64, 1, 1024]
    - [100, 5692.27]
  - - [1472, 64, 1, 1024]
    - [107, 6431.27]
  - - [1728, 64, 1, 1024]
    - [94, 7077.89]
  - - [64, 192, 1, 1024]
    - [109, 967.916]
  - - [192, 192, 1, 1024]
    - [109, 2903.75]
  - - [320, 192, 1, 1024]
    - [62, 4338.94]
  - - [448, 192, 1, 1024]
    - [62, 6291.46]
  - - [576, 192, 1, 1024]
    - [10, 7549.75]
  - - [192, 320, 1, 1024]
    - [105, 4660.34]
  - - [64, 448, 1, 1024]
    - [62, 2174.82]
  - - [192, 448, 1, 1024]
    - [62, 6524.47]
  - - [192, 576, 1, 1024]
    - [117, 7810.08]
  - - [64, 704, 1, 1024]
    - [86, 3417.58]
  - - [64, 960, 1, 1024]
    - [86, 4660.34]
  - - [64, 1216, 1, 1024]
    - [16, 5903.09]
  - - [64, 1472, 1, 1024]
    - [86, 6890.64]
  - - [64, 1728, 1, 1024]
    - [63, 8089.01]
  - - [192, 64, 1, 2048]
    - [100, 1735.57]
  - - [448, 64, 1, 2048]
    - [100, 4049.67]
  - - [704, 64, 1, 2048]
    - [20, 6151.65]
  - - [64, 192, 1, 2048]
    - [100, 1735.57]
  - - [192, 192, 1, 2048]
    - [62, 5033.16]
  - - [64, 448, 1, 2048]
    - [62, 4049.67]
  - - [64, 704, 1, 2048]
    - [62, 6151.65]
  - - [192, 64, 1, 4096]
    - [86, 3050.4]
  - - [448, 64, 1, 4096]
    - [86, 7117.61]
  - - [64, 192, 1, 4096]
    - [62, 3050.4]
  - - [64, 448, 1, 4096]
    - [109, 7576.81]
  - - [128, 64, 1, 64]
    - [112, 43.6907]
  - - [256, 64, 1, 64]
    - [109, 87.3813]
  - - [384, 64, 1, 64]
    - [65, 125.829]
  - - [512, 64, 1, 64]
    - [107, 174.763]
  - - [640, 64, 1, 64]
    - [107, 218.453]
  - - [768, 64, 1, 64]
    - [105, 241.979]
  - - [896, 64, 1, 64]
    - [116, 293.601]
  - - [1024, 64, 1, 64]
    - [110, 335.544]
  - - [64, 128, 1, 64]
    - [113, 43.6907]
  - - [128, 128, 1, 64]
    - [103, 83.8861]
  - - [192, 128, 1, 64]
    - [102, 125.829]
  - - [256, 128, 1, 64]
    - [111, 167.772]
  - - [320, 128, 1, 64]
    - [106, 209.715]
  - - [384, 128, 1, 64]
    - [102, 241.979]
  - - [448, 128, 1, 64]
    - [106, 271.853]
  - - [512, 128, 1, 64]
    - [114, 322.639]
  - - [576, 128, 1, 64]
    - [110, 377.487]
  - - [640, 128, 1, 64]
    - [85, 403.298]
  - - [704, 128, 1, 64]
    - [39, 443.628]
  - - [768, 128, 1, 64]
    - [54, 483.958]
  - - [832, 128, 1, 64]
    - [102, 545.26]
  - - [896, 128, 1, 64]
    - [10, 524.288]
  - - [960, 128, 1, 64]
    - [80, 604.948]
  - - [1024, 128, 1, 64]
    - [15, 645.278]
  - - [128, 192, 1, 64]
    - [115, 120.99]
  - - [256, 192, 1, 64]
    - [107, 262.144]
  - - [384, 192, 1, 64]
    - [111, 377.487]
  - - [512, 192, 1, 64]
    - [106, 524.288]
  - - [640, 192, 1, 64]
    - [115, 629.146]
  - - [768, 192, 1, 64]
    - [97, 754.975]
  - - [896, 192, 1, 64]
    - [107, 880.804]
  - - [1024, 192, 1, 64]
    - [117, 1006.63]
  - - [64, 256, 1, 64]
    - [79, 80.6597]
  - - [128, 256, 1, 64]
    - [15, 167.772]
  - - [192, 256, 1, 64]
    - [102, 262.144]
  - - [256, 256, 1, 64]
    - [92, 322.639]
  - - [320, 256, 1, 64]
    - [117, 436.907]
  - - [384, 256, 1, 64]
    - [92, 483.958]
  - - [448, 256, 1, 64]
    - [115, 587.203]
  - - [512, 256, 1, 64]
    - [97, 671.089]
  - - [576, 256, 1, 64]
    - [65, 754.975]
  - - [640, 256, 1, 64]
    - [111, 873.813]
  - - [704, 256, 1, 64]
    - [114, 961.195]
  - - [768, 256, 1, 64]
    - [71, 1006.63]
  - - [832, 256, 1, 64]
    - [117, 1090.52]
  - - [896, 256, 1, 64]
    - [10, 1174.41]
  - - [960, 256, 1, 64]
    - [43, 1209.9]
  - - [1024, 256, 1, 64]
    - [15, 1342.18]
  - - [128, 320, 1, 64]
    - [92, 218.453]
  - - [256, 320, 1, 64]
    - [107, 436.907]
  - - [384, 320, 1, 64]
    - [97, 629.146]
  - - [512, 320, 1, 64]
    - [115, 838.861]
  - - [640, 320, 1, 64]
    - [10, 1008.25]
  - - [768, 320, 1, 64]
    - [103, 1209.9]
  - - [896, 320, 1, 64]
    - [21, 1411.54]
  - - [1024, 320, 1, 64]
    - [44, 1677.72]
  - - [64, 384, 1, 64]
    - [16, 131.072]
  - - [128, 384, 1, 64]
    - [11, 241.979]
  - - [192, 384, 1, 64]
    - [15, 362.969]
  - - [256, 384, 1, 64]
    - [107, 524.288]
  - - [320, 384, 1, 64]
    - [111, 629.146]
  - - [384, 384, 1, 64]
    - [102, 754.975]
  - - [448, 384, 1, 64]
    - [92, 880.804]
  - - [512, 384, 1, 64]
    - [51, 932.068]
  - - [576, 384, 1, 64]
    - [10, 1088.91]
  - - [640, 384, 1, 64]
    - [10, 1209.9]
  - - [704, 384, 1, 64]
    - [10, 1384.12]
  - - [768, 384, 1, 64]
    - [15, 1509.95]
  - - [832, 384, 1, 64]
    - [103, 1635.78]
  - - [896, 384, 1, 64]
    - [44, 1631.12]
  - - [960, 384, 1, 64]
    - [11, 1814.84]
  - - [1024, 384, 1, 64]
    - [43, 2013.27]
  - - [128, 448, 1, 64]
    - [10, 293.601]
  - - [256, 448, 1, 64]
    - [15, 587.203]
  - - [384, 448, 1, 64]
    - [10, 846.927]
  - - [512, 448, 1, 64]
    - [11, 1129.24]
  - - [640, 448, 1, 64]
    - [10, 1468.01]
  - - [768, 448, 1, 64]
    - [10, 1693.85]
  - - [896, 448, 1, 64]
    - [43, 1902.97]
  - - [1024, 448, 1, 64]
    - [10, 2258.47]
  - - [64, 512, 1, 64]
    - [100, 174.763]
  - - [128, 512, 1, 64]
    - [15, 335.544]
  - - [192, 512, 1, 64]
    - [15, 503.316]
  - - [256, 512, 1, 64]
    - [85, 645.278]
  - - [320, 512, 1, 64]
    - [114, 873.813]
  - - [384, 512, 1, 64]
    - [10, 967.916]
  - - [448, 512, 1, 64]
    - [64, 1223.34]
  - - [512, 512, 1, 64]
    - [10, 1290.56]
  - - [576, 512, 1, 64]
    - [11, 1451.87]
  - - [640, 512, 1, 64]
    - [11, 1677.72]
  - - [704, 512, 1, 64]
    - [10, 1774.51]
  - - [768, 512, 1, 64]
    - [10, 2013.27]
  - - [832, 512, 1, 64]
    - [10, 2097.15]
  - - [896, 512, 1, 64]
    - [41, 2258.47]
  - - [960, 512, 1, 64]
    - [10, 2419.79]
  - - [1024, 512, 1, 64]
    - [47, 2581.11]
  - - [128, 576, 1, 64]
    - [107, 377.487]
  - - [256, 576, 1, 64]
    - [10, 754.975]
  - - [384, 576, 1, 64]
    - [10, 1132.46]
  - - [512, 576, 1, 64]
    - [10, 1509.95]
  - - [640, 576, 1, 64]
    - [116, 1887.44]
  - - [768, 576, 1, 64]
    - [10, 2264.92]
  - - [896, 576, 1, 64]
    - [44, 2540.78]
  - - [1024, 576, 1, 64]
    - [10, 2796.2]
  - - [64, 640, 1, 64]
    - [10, 201.649]
  - - [128, 640, 1, 64]
    - [103, 419.43]
  - - [192, 640, 1, 64]
    - [15, 629.146]
  - - [256, 640, 1, 64]
    - [11, 838.861]
  - - [320, 640, 1, 64]
    - [92, 1092.27]
  - - [384, 640, 1, 64]
    - [104, 1258.29]
  - - [448, 640, 1, 64]
    - [15, 1529.17]
  - - [512, 640, 1, 64]
    - [15, 1677.72]
  - - [576, 640, 1, 64]
    - [10, 1887.44]
  - - [640, 640, 1, 64]
    - [43, 1872.46]
  - - [704, 640, 1, 64]
    - [13, 2218.14]
  - - [768, 640, 1, 64]
    - [41, 2419.79]
  - - [832, 640, 1, 64]
    - [10, 2524.35]
  - - [896, 640, 1, 64]
    - [13, 2621.44]
  - - [960, 640, 1, 64]
    - [41, 2912.71]
  - - [1024, 640, 1, 64]
    - [41, 3106.89]
  - - [128, 704, 1, 64]
    - [64, 480.597]
  - - [256, 704, 1, 64]
    - [15, 922.747]
  - - [384, 704, 1, 64]
    - [15, 1441.79]
  - - [512, 704, 1, 64]
    - [43, 1845.49]
  - - [640, 704, 1, 64]
    - [43, 2306.87]
  - - [768, 704, 1, 64]
    - [10, 2661.77]
  - - [896, 704, 1, 64]
    - [12, 2990.38]
  - - [1024, 704, 1, 64]
    - [49, 3181.89]
  - - [64, 768, 1, 64]
    - [10, 262.144]
  - - [128, 768, 1, 64]
    - [11, 483.958]
  - - [192, 768, 1, 64]
    - [15, 754.975]
  - - [256, 768, 1, 64]
    - [87, 1006.63]
  - - [320, 768, 1, 64]
    - [10, 1310.72]
  - - [384, 768, 1, 64]
    - [10, 1451.87]
  - - [448, 768, 1, 64]
    - [10, 1693.85]
  - - [512, 768, 1, 64]
    - [117, 2013.27]
  - - [576, 768, 1, 64]
    - [71, 2097.15]
  - - [640, 768, 1, 64]
    - [13, 2246.95]
  - - [704, 768, 1, 64]
    - [10, 2563.19]
  - - [768, 768, 1, 64]
    - [10, 2796.2]
  - - [832, 768, 1, 64]
    - [13, 3029.22]
  - - [896, 768, 1, 64]
    - [47, 3262.24]
  - - [960, 768, 1, 64]
    - [41, 3495.25]
  - - [1024, 768, 1, 64]
    - [13, 3471.15]
  - - [128, 832, 1, 64]
    - [10, 524.288]
  - - [256, 832, 1, 64]
    - [15, 1048.58]
  - - [384, 832, 1, 64]
    - [11, 1514.61]
  - - [512, 832, 1, 64]
    - [43, 2097.15]
  - - [640, 832, 1, 64]
    - [43, 2621.44]
  - - [768, 832, 1, 64]
    - [54, 3029.22]
  - - [896, 832, 1, 64]
    - [55, 3534.09]
  - - [1024, 832, 1, 64]
    - [75, 3760.41]
  - - [64, 896, 1, 64]
    - [15, 305.835]
  - - [128, 896, 1, 64]
    - [117, 587.203]
  - - [192, 896, 1, 64]
    - [99, 880.804]
  - - [256, 896, 1, 64]
    - [11, 1129.24]
  - - [320, 896, 1, 64]
    - [117, 1468.01]
  - - [384, 896, 1, 64]
    - [24, 1761.61]
  - - [448, 896, 1, 64]
    - [21, 1902.97]
  - - [512, 896, 1, 64]
    - [10, 2258.47]
  - - [576, 896, 1, 64]
    - [80, 2540.78]
  - - [640, 896, 1, 64]
    - [43, 2718.53]
  - - [704, 896, 1, 64]
    - [56, 2883.58]
  - - [768, 896, 1, 64]
    - [13, 3262.24]
  - - [832, 896, 1, 64]
    - [13, 3407.87]
  - - [896, 896, 1, 64]
    - [31, 3670.02]
  - - [960, 896, 1, 64]
    - [24, 3796.57]
  - - [1024, 896, 1, 64]
    - [36, 4049.67]
  - - [128, 960, 1, 64]
    - [10, 604.948]
  - - [256, 960, 1, 64]
    - [11, 1310.72]
  - - [384, 960, 1, 64]
    - [104, 1887.44]
  - - [512, 960, 1, 64]
    - [68, 2330.17]
  - - [640, 960, 1, 64]
    - [80, 2912.71]
  - - [768, 960, 1, 64]
    - [77, 3370.42]
  - - [896, 960, 1, 64]
    - [69, 3932.16]
  - - [1024, 960, 1, 64]
    - [27, 4338.94]
  - - [64, 1024, 1, 64]
    - [114, 349.525]
  - - [128, 1024, 1, 64]
    - [11, 671.089]
  - - [192, 1024, 1, 64]
    - [107, 967.916]
  - - [256, 1024, 1, 64]
    - [39, 1290.56]
  - - [320, 1024, 1, 64]
    - [103, 1613.19]
  - - [384, 1024, 1, 64]
    - [117, 1935.83]
  - - [448, 1024, 1, 64]
    - [43, 2174.82]
  - - [512, 1024, 1, 64]
    - [47, 2485.51]
  - - [576, 1024, 1, 64]
    - [80, 2796.2]
  - - [640, 1024, 1, 64]
    - [47, 3106.89]
  - - [704, 1024, 1, 64]
    - [13, 3295.52]
  - - [768, 1024, 1, 64]
    - [116, 3595.12]
  - - [832, 1024, 1, 64]
    - [54, 4038.96]
  - - [896, 1024, 1, 64]
    - [54, 4049.67]
  - - [960, 1024, 1, 64]
    - [9, 4493.9]
  - - [1024, 1024, 1, 64]
    - [13, 4473.92]
  - - [128, 64, 1, 256]
    - [66, 167.772]
  - - [256, 64, 1, 256]
    - [108, 335.544]
  - - [384, 64, 1, 256]
    - [114, 524.288]
  - - [512, 64, 1, 256]
    - [79, 645.278]
  - - [640, 64, 1, 256]
    - [107, 838.861]
  - - [768, 64, 1, 256]
    - [11, 1006.63]
  - - [896, 64, 1, 256]
    - [101, 1223.34]
  - - [1024, 64, 1, 256]
    - [100, 1342.18]
  - - [64, 128, 1, 256]
    - [105, 167.772]
  - - [128, 128, 1, 256]
    - [62, 322.639]
  - - [192, 128, 1, 256]
    - [85, 503.316]
  - - [256, 128, 1, 256]
    - [85, 645.278]
  - - [320, 128, 1, 256]
    - [79, 838.861]
  - - [384, 128, 1, 256]
    - [105, 1048.58]
  - - [448, 128, 1, 256]
    - [108, 1174.41]
  - - [512, 128, 1, 256]
    - [92, 1342.18]
  - - [576, 128, 1, 256]
    - [92, 1509.95]
  - - [640, 128, 1, 256]
    - [99, 1677.72]
  - - [704, 128, 1, 256]
    - [99, 1922.39]
  - - [768, 128, 1, 256]
    - [15, 2013.27]
  - - [832, 128, 1, 256]
    - [17, 2181.04]
  - - [896, 128, 1, 256]
    - [16, 2348.81]
  - - [960, 128, 1, 256]
    - [11, 2516.58]
  - - [1024, 128, 1, 256]
    - [103, 2684.35]
  - - [128, 192, 1, 256]
    - [62, 547.083]
  - - [256, 192, 1, 256]
    - [17, 1006.63]
  - - [384, 192, 1, 256]
    - [65, 1451.87]
  - - [512, 192, 1, 256]
    - [86, 2013.27]
  - - [640, 192, 1, 256]
    - [65, 2516.58]
  - - [768, 192, 1, 256]
    - [10, 2903.75]
  - - [896, 192, 1, 256]
    - [19, 3387.71]
  - - [1024, 192, 1, 256]
    - [40, 3871.67]
  - - [64, 256, 1, 256]
    - [63, 322.639]
  - - [128, 256, 1, 256]
    - [19, 671.089]
  - - [192, 256, 1, 256]
    - [79, 1048.58]
  - - [320, 256, 1, 256]
    - [85, 1677.72]
  - - [384, 256, 1, 256]
    - [109, 2097.15]
  - - [448, 256, 1, 256]
    - [10, 2258.47]
  - - [512, 256, 1, 256]
    - [103, 2684.35]
  - - [576, 256, 1, 256]
    - [11, 2903.75]
  - - [640, 256, 1, 256]
    - [114, 3355.44]
  - - [704, 256, 1, 256]
    - [11, 3417.58]
  - - [768, 256, 1, 256]
    - [40, 4026.53]
  - - [832, 256, 1, 256]
    - [10, 4038.96]
  - - [896, 256, 1, 256]
    - [103, 4697.62]
  - - [960, 256, 1, 256]
    - [10, 4839.58]
  - - [1024, 256, 1, 256]
    - [10, 4971.03]
  - - [128, 320, 1, 256]
    - [86, 873.813]
  - - [256, 320, 1, 256]
    - [103, 1677.72]
  - - [384, 320, 1, 256]
    - [112, 2330.17]
  - - [512, 320, 1, 256]
    - [16, 3355.44]
  - - [640, 320, 1, 256]
    - [65, 4032.98]
  - - [768, 320, 1, 256]
    - [40, 4839.58]
  - - [896, 320, 1, 256]
    - [10, 5437.06]
  - - [1024, 320, 1, 256]
    - [10, 6452.78]
  - - [64, 384, 1, 256]
    - [10, 503.316]
  - - [128, 384, 1, 256]
    - [118, 1006.63]
  - - [192, 384, 1, 256]
    - [10, 1451.87]
  - - [256, 384, 1, 256]
    - [114, 2013.27]
  - - [320, 384, 1, 256]
    - [10, 2516.58]
  - - [384, 384, 1, 256]
    - [114, 2903.75]
  - - [448, 384, 1, 256]
    - [45, 3387.71]
  - - [512, 384, 1, 256]
    - [115, 3871.67]
  - - [576, 384, 1, 256]
    - [10, 4529.85]
  - - [640, 384, 1, 256]
    - [15, 5033.16]
  - - [704, 384, 1, 256]
    - [10, 5126.37]
  - - [768, 384, 1, 256]
    - [10, 5592.41]
  - - [832, 384, 1, 256]
    - [10, 6058.44]
  - - [896, 384, 1, 256]
    - [11, 6524.47]
  - - [960, 384, 1, 256]
    - [11, 7549.75]
  - - [1024, 384, 1, 256]
    - [10, 7456.54]
  - - [128, 448, 1, 256]
    - [109, 1174.41]
  - - [256, 448, 1, 256]
    - [114, 2348.81]
  - - [384, 448, 1, 256]
    - [64, 3387.71]
  - - [512, 448, 1, 256]
    - [44, 4516.94]
  - - [640, 448, 1, 256]
    - [10, 5646.18]
  - - [768, 448, 1, 256]
    - [11, 6524.47]
  - - [896, 448, 1, 256]
    - [10, 7611.89]
  - - [1024, 448, 1, 256]
    - [10, 8099.35]
  - - [64, 512, 1, 256]
    - [101, 699.051]
  - - [128, 512, 1, 256]
    - [112, 1342.18]
  - - [192, 512, 1, 256]
    - [104, 1935.83]
  - - [256, 512, 1, 256]
    - [94, 2796.2]
  - - [320, 512, 1, 256]
    - [64, 3355.44]
  - - [384, 512, 1, 256]
    - [92, 3871.67]
  - - [448, 512, 1, 256]
    - [112, 4516.94]
  - - [512, 512, 1, 256]
    - [87, 5162.22]
  - - [576, 512, 1, 256]
    - [11, 5592.41]
  - - [640, 512, 1, 256]
    - [104, 6213.78]
  - - [704, 512, 1, 256]
    - [11, 7098.05]
  - - [768, 512, 1, 256]
    - [10, 7190.24]
  - - [832, 512, 1, 256]
    - [69, 7520.82]
  - - [896, 512, 1, 256]
    - [13, 8099.35]
  - - [128, 576, 1, 256]
    - [108, 1572.86]
  - - [256, 576, 1, 256]
    - [94, 3019.9]
  - - [384, 576, 1, 256]
    - [40, 4355.62]
  - - [512, 576, 1, 256]
    - [87, 5592.41]
  - - [640, 576, 1, 256]
    - [10, 6740.85]
  - - [768, 576, 1, 256]
    - [10, 8388.61]
  - - [64, 640, 1, 256]
    - [79, 838.861]
  - - [128, 640, 1, 256]
    - [114, 1677.72]
  - - [192, 640, 1, 256]
    - [64, 2330.17]
  - - [256, 640, 1, 256]
    - [97, 3226.39]
  - - [320, 640, 1, 256]
    - [102, 4032.98]
  - - [384, 640, 1, 256]
    - [104, 4839.58]
  - - [448, 640, 1, 256]
    - [54, 5646.18]
  - - [512, 640, 1, 256]
    - [10, 6710.89]
  - - [576, 640, 1, 256]
    - [11, 6508.4]
  - - [640, 640, 1, 256]
    - [10, 7231.56]
  - - [704, 640, 1, 256]
    - [73, 7954.71]
  - - [128, 704, 1, 256]
    - [112, 1845.49]
  - - [256, 704, 1, 256]
    - [103, 3549.03]
  - - [384, 704, 1, 256]
    - [23, 5126.37]
  - - [512, 704, 1, 256]
    - [73, 6835.16]
  - - [640, 704, 1, 256]
    - [10, 8543.95]
  - - [64, 768, 1, 256]
    - [66, 1006.63]
  - - [128, 768, 1, 256]
    - [106, 1935.83]
  - - [192, 768, 1, 256]
    - [94, 3019.9]
  - - [256, 768, 1, 256]
    - [64, 3871.67]
  - - [320, 768, 1, 256]
    - [10, 4660.34]
  - - [384, 768, 1, 256]
    - [21, 5592.41]
  - - [448, 768, 1, 256]
    - [68, 6291.46]
  - - [512, 768, 1, 256]
    - [10, 7190.24]
  - - [576, 768, 1, 256]
    - [61, 7810.08]
  - - [128, 832, 1, 256]
    - [99, 2271.91]
  - - [256, 832, 1, 256]
    - [10, 4194.3]
  - - [384, 832, 1, 256]
    - [11, 6543.11]
  - - [512, 832, 1, 256]
    - [70, 7789.42]
  - - [64, 896, 1, 256]
    - [94, 1223.34]
  - - [128, 896, 1, 256]
    - [19, 2258.47]
  - - [192, 896, 1, 256]
    - [114, 3670.02]
  - - [256, 896, 1, 256]
    - [10, 4516.94]
  - - [320, 896, 1, 256]
    - [40, 5872.03]
  - - [384, 896, 1, 256]
    - [21, 6524.47]
  - - [448, 896, 1, 256]
    - [10, 7086.93]
  - - [512, 896, 1, 256]
    - [80, 8699.3]
  - - [128, 960, 1, 256]
    - [10, 2419.79]
  - - [256, 960, 1, 256]
    - [10, 4660.34]
  - - [384, 960, 1, 256]
    - [11, 6508.4]
  - - [64, 1024, 1, 256]
    - [99, 1342.18]
  - - [128, 1024, 1, 256]
    - [115, 2684.35]
  - - [192, 1024, 1, 256]
    - [65, 3871.67]
  - - [256, 1024, 1, 256]
    - [43, 5162.22]
  - - [320, 1024, 1, 256]
    - [73, 6213.78]
  - - [384, 1024, 1, 256]
    - [117, 7190.24]
  - - [448, 1024, 1, 256]
    - [41, 8388.61]
  - - [128, 64, 1, 512]
    - [100, 322.639]
  - - [256, 64, 1, 512]
    - [100, 645.278]
  - - [384, 64, 1, 512]
    - [113, 1006.63]
  - - [512, 64, 1, 512]
    - [79, 1242.76]
  - - [640, 64, 1, 512]
    - [62, 1613.19]
  - - [768, 64, 1, 512]
    - [105, 1935.83]
  - - [896, 64, 1, 512]
    - [118, 2348.81]
  - - [1024, 64, 1, 512]
    - [100, 2581.11]
  - - [64, 128, 1, 512]
    - [101, 335.544]
  - - [128, 128, 1, 512]
    - [99, 645.278]
  - - [192, 128, 1, 512]
    - [101, 967.916]
  - - [256, 128, 1, 512]
    - [110, 1342.18]
  - - [320, 128, 1, 512]
    - [79, 1677.72]
  - - [384, 128, 1, 512]
    - [65, 1935.83]
  - - [448, 128, 1, 512]
    - [62, 2348.81]
  - - [512, 128, 1, 512]
    - [110, 2684.35]
  - - [576, 128, 1, 512]
    - [86, 3019.9]
  - - [640, 128, 1, 512]
    - [86, 3226.39]
  - - [704, 128, 1, 512]
    - [86, 3417.58]
  - - [768, 128, 1, 512]
    - [62, 3871.67]
  - - [832, 128, 1, 512]
    - [102, 4038.96]
  - - [896, 128, 1, 512]
    - [40, 4194.3]
  - - [960, 128, 1, 512]
    - [94, 4839.58]
  - - [1024, 128, 1, 512]
    - [10, 5162.22]
  - - [128, 192, 1, 512]
    - [16, 967.916]
  - - [256, 192, 1, 512]
    - [105, 2013.27]
  - - [384, 192, 1, 512]
    - [101, 3019.9]
  - - [512, 192, 1, 512]
    - [100, 3871.67]
  - - [640, 192, 1, 512]
    - [15, 4839.58]
  - - [768, 192, 1, 512]
    - [115, 5807.5]
  - - [896, 192, 1, 512]
    - [16, 6775.41]
  - - [1024, 192, 1, 512]
    - [10, 7190.24]
  - - [64, 256, 1, 512]
    - [40, 645.278]
  - - [128, 256, 1, 512]
    - [86, 1290.56]
  - - [192, 256, 1, 512]
    - [99, 1935.83]
  - - [256, 256, 1, 512]
    - [99, 2581.11]
  - - [320, 256, 1, 512]
    - [16, 3226.39]
  - - [384, 256, 1, 512]
    - [110, 3871.67]
  - - [448, 256, 1, 512]
    - [18, 4349.65]
  - - [512, 256, 1, 512]
    - [43, 4971.03]
  - - [576, 256, 1, 512]
    - [11, 5592.41]
  - - [640, 256, 1, 512]
    - [10, 5991.86]
  - - [704, 256, 1, 512]
    - [10, 6835.16]
  - - [768, 256, 1, 512]
    - [94, 7456.54]
  - - [832, 256, 1, 512]
    - [10, 7520.82]
  - - [896, 256, 1, 512]
    - [10, 8388.61]
  - - [128, 320, 1, 512]
    - [62, 1677.72]
  - - [256, 320, 1, 512]
    - [20, 3226.39]
  - - [384, 320, 1, 512]
    - [40, 4839.58]
  - - [512, 320, 1, 512]
    - [65, 6213.78]
  - - [640, 320, 1, 512]
    - [15, 7767.23]
  - - [64, 384, 1, 512]
    - [98, 1006.63]
  - - [128, 384, 1, 512]
    - [101, 1935.83]
  - - [192, 384, 1, 512]
    - [62, 2903.75]
  - - [256, 384, 1, 512]
    - [107, 3728.27]
  - - [320, 384, 1, 512]
    - [98, 4660.34]
  - - [384, 384, 1, 512]
    - [117, 5592.41]
  - - [448, 384, 1, 512]
    - [11, 6775.41]
  - - [512, 384, 1, 512]
    - [11, 7456.54]
  - - [576, 384, 1, 512]
    - [10, 8711.25]
  - - [128, 448, 1, 512]
    - [109, 2348.81]
  - - [256, 448, 1, 512]
    - [40, 4697.62]
  - - [384, 448, 1, 512]
    - [27, 6291.46]
  - - [512, 448, 1, 512]
    - [10, 8388.61]
  - - [64, 512, 1, 512]
    - [103, 1342.18]
  - - [128, 512, 1, 512]
    - [109, 2684.35]
  - - [192, 512, 1, 512]
    - [18, 3728.27]
  - - [256, 512, 1, 512]
    - [15, 4971.03]
  - - [320, 512, 1, 512]
    - [102, 6213.78]
  - - [384, 512, 1, 512]
    - [11, 7190.24]
  - - [448, 512, 1, 512]
    - [11, 8388.61]
  - - [128, 576, 1, 512]
    - [62, 3019.9]
  - - [256, 576, 1, 512]
    - [117, 5592.41]
  - - [384, 576, 1, 512]
    - [10, 8089.01]
  - - [64, 640, 1, 512]
    - [86, 1677.72]
  - - [128, 640, 1, 512]
    - [86, 3355.44]
  - - [192, 640, 1, 512]
    - [114, 5033.16]
  - - [256, 640, 1, 512]
    - [64, 6213.78]
  - - [320, 640, 1, 512]
    - [11, 7489.83]
  - - [128, 704, 1, 512]
    - [109, 3690.99]
  - - [256, 704, 1, 512]
    - [17, 6835.16]
  - - [64, 768, 1, 512]
    - [62, 1935.83]
  - - [128, 768, 1, 512]
    - [64, 3728.27]
  - - [192, 768, 1, 512]
    - [112, 5592.41]
  - - [256, 768, 1, 512]
    - [66, 7456.54]
  - - [128, 832, 1, 512]
    - [106, 4362.08]
  - - [256, 832, 1, 512]
    - [10, 8077.92]
  - - [64, 896, 1, 512]
    - [62, 2348.81]
  - - [128, 896, 1, 512]
    - [112, 4516.94]
  - - [192, 896, 1, 512]
    - [94, 6775.41]
  - - [256, 896, 1, 512]
    - [40, 8388.61]
  - - [128, 960, 1, 512]
    - [10, 4493.9]
  - - [64, 1024, 1, 512]
    - [101, 2684.35]
  - - [128, 1024, 1, 512]
    - [65, 4971.03]
  - - [192, 1024, 1, 512]
    - [94, 7190.24]
  - - [128, 64, 1, 1024]
    - [62, 599.186]
  - - [256, 64, 1, 1024]
    - [86, 1242.76]
  - - [384, 64, 1, 1024]
    - [62, 1864.14]
  - - [512, 64, 1, 1024]
    - [86, 2581.11]
  - - [640, 64, 1, 1024]
    - [86, 2995.93]
  - - [768, 64, 1, 1024]
    - [118, 3595.12]
  - - [896, 64, 1, 1024]
    - [106, 4049.67]
  - - [1024, 64, 1, 1024]
    - [118, 4793.49]
  - - [64, 128, 1, 1024]
    - [62, 621.378]
  - - [128, 128, 1, 1024]
    - [62, 1242.76]
  - - [192, 128, 1, 1024]
    - [86, 1864.14]
  - - [256, 128, 1, 1024]
    - [86, 2581.11]
  - - [320, 128, 1, 1024]
    - [79, 3106.89]
  - - [384, 128, 1, 1024]
    - [93, 3728.27]
  - - [448, 128, 1, 1024]
    - [118, 4516.94]
  - - [512, 128, 1, 1024]
    - [98, 4793.49]
  - - [576, 128, 1, 1024]
    - [10, 5392.68]
  - - [640, 128, 1, 1024]
    - [101, 5991.86]
  - - [704, 128, 1, 1024]
    - [100, 6591.05]
  - - [768, 128, 1, 1024]
    - [92, 7190.24]
  - - [832, 128, 1, 1024]
    - [92, 7270.13]
  - - [896, 128, 1, 1024]
    - [115, 8099.35]
  - - [128, 192, 1, 1024]
    - [20, 1797.56]
  - - [256, 192, 1, 1024]
    - [79, 3728.27]
  - - [384, 192, 1, 1024]
    - [99, 5392.68]
  - - [512, 192, 1, 1024]
    - [11, 7456.54]
  - - [64, 256, 1, 1024]
    - [105, 1290.56]
  - - [128, 256, 1, 1024]
    - [86, 2581.11]
  - - [192, 256, 1, 1024]
    - [114, 3728.27]
  - - [256, 256, 1, 1024]
    - [100, 4793.49]
  - - [320, 256, 1, 1024]
    - [16, 5991.86]
  - - [384, 256, 1, 1024]
    - [64, 7190.24]
  - - [448, 256, 1, 1024]
    - [98, 8099.35]
  - - [128, 320, 1, 1024]
    - [100, 3355.44]
  - - [256, 320, 1, 1024]
    - [62, 6213.78]
  - - [64, 384, 1, 1024]
    - [93, 1864.14]
  - - [128, 384, 1, 1024]
    - [62, 3471.15]
  - - [192, 384, 1, 1024]
    - [100, 6039.8]
  - - [256, 384, 1, 1024]
    - [40, 7190.24]
  - - [128, 448, 1, 1024]
    - [79, 4516.94]
  - - [256, 448, 1, 1024]
    - [45, 7829.37]
  - - [64, 512, 1, 1024]
    - [110, 2684.35]
  - - [128, 512, 1, 1024]
    - [86, 4971.03]
  - - [192, 512, 1, 1024]
    - [16, 7456.54]
  - - [128, 576, 1, 1024]
    - [110, 5592.41]
  - - [64, 640, 1, 1024]
    - [100, 3226.39]
  - - [128, 640, 1, 1024]
    - [86, 6213.78]
  - - [128, 704, 1, 1024]
    - [40, 7098.05]
  - - [64, 768, 1, 1024]
    - [79, 3728.27]
  - - [128, 768, 1, 1024]
    - [64, 7190.24]
  - - [128, 832, 1, 1024]
    - [106, 7520.82]
  - - [64, 896, 1, 1024]
    - [93, 4349.65]
  - - [128, 896, 1, 1024]
    - [64, 8099.35]
  - - [64, 1024, 1, 1024]
    - [118, 4971.03]
  - - [128, 64, 1, 2048]
    - [100, 1242.76]
  - - [256, 64, 1, 2048]
    - [118, 2314.1]
  - - [384, 64, 1, 2048]
    - [62, 3355.44]
  - - [512, 64, 1, 2048]
    - [118, 4628.2]
  - - [640, 64, 1, 2048]
    - [100, 5592.41]
  - - [768, 64, 1, 2048]
    - [19, 6494.41]
  - - [896, 64, 1, 2048]
    - [118, 7576.81]
  - - [64, 128, 1, 2048]
    - [62, 1157.05]
  - - [128, 128, 1, 2048]
    - [86, 2314.1]
  - - [192, 128, 1, 2048]
    - [118, 3471.15]
  - - [256, 128, 1, 2048]
    - [86, 4628.2]
  - - [320, 128, 1, 2048]
    - [118, 5785.25]
  - - [384, 128, 1, 2048]
    - [86, 6710.89]
  - - [448, 128, 1, 2048]
    - [93, 7829.37]
  - - [128, 192, 1, 2048]
    - [86, 3471.15]
  - - [256, 192, 1, 2048]
    - [79, 6710.89]
  - - [64, 256, 1, 2048]
    - [62, 2314.1]
  - - [128, 256, 1, 2048]
    - [62, 4473.92]
  - - [192, 256, 1, 2048]
    - [62, 6710.89]
  - - [128, 320, 1, 2048]
    - [86, 5991.86]
  - - [64, 384, 1, 2048]
    - [20, 3355.44]
  - - [128, 384, 1, 2048]
    - [86, 7190.24]
  - - [128, 448, 1, 2048]
    - [20, 7829.37]
  - - [64, 512, 1, 2048]
    - [86, 4793.49]
  - - [64, 640, 1, 2048]
    - [19, 5785.25]
  - - [64, 768, 1, 2048]
    - [62, 6942.3]
  - - [64, 896, 1, 2048]
    - [93, 7829.37]
  - - [128, 64, 1, 4096]
    - [62, 2033.6]
  - - [256, 64, 1, 4096]
    - [62, 4194.3]
  - - [384, 64, 1, 4096]
    - [100, 6100.81]
  - - [64, 128, 1, 4096]
    - [93, 2033.6]
  - - [128, 128, 1, 4096]
    - [62, 4067.2]
  - - [192, 128, 1, 4096]
    - [100, 6100.81]
  - - [128, 192, 1, 4096]
    - [86, 6291.46]
  - - [64, 256, 1, 4096]
    - [86, 4067.2]
  - - [64, 384, 1, 4096]
    - [100, 6100.81]
  - - [1, 1, 1, 1]
    - [65, 8.33333e-05]
  - - [2, 2, 1, 2]
    - [85, 0.00064]
  - - [4, 2, 1, 2]
    - [115, 0.00123077]
  - - [6, 2, 1, 2]
    - [15, 0.00184615]
  - - [8, 2, 1, 2]
    - [44, 0.00246154]
  - - [10, 2, 1, 2]
    - [16, 0.00307692]
  - - [12, 2, 1, 2]
    - [10, 0.00355556]
  - - [14, 2, 1, 2]
    - [102, 0.00430769]
  - - [16, 2, 1, 2]
    - [117, 0.00492308]
  - - [2, 4, 1, 2]
    - [16, 0.00118519]
  - - [4, 4, 1, 2]
    - [63, 0.00246154]
  - - [6, 4, 1, 2]
    - [15, 0.00369231]
  - - [8, 4, 1, 2]
    - [104, 0.00512]
  - - [10, 4, 1, 2]
    - [85, 0.00615385]
  - - [12, 4, 1, 2]
    - [97, 0.00768]
  - - [14, 4, 1, 2]
    - [106, 0.0082963]
  - - [16, 4, 1, 2]
    - [65, 0.00948148]
  - - [2, 6, 1, 2]
    - [15, 0.00177778]
  - - [4, 6, 1, 2]
    - [15, 0.00369231]
  - - [6, 6, 1, 2]
    - [10, 0.00533333]
  - - [8, 6, 1, 2]
    - [92, 0.00738462]
  - - [10, 6, 1, 2]
    - [64, 0.0096]
  - - [12, 6, 1, 2]
    - [15, 0.0110769]
  - - [14, 6, 1, 2]
    - [101, 0.0124444]
  - - [16, 6, 1, 2]
    - [10, 0.0147692]
  - - [2, 8, 1, 2]
    - [10, 0.00237037]
  - - [4, 8, 1, 2]
    - [118, 0.00492308]
  - - [6, 8, 1, 2]
    - [64, 0.00711111]
  - - [8, 8, 1, 2]
    - [15, 0.01024]
  - - [10, 8, 1, 2]
    - [15, 0.0123077]
  - - [12, 8, 1, 2]
    - [115, 0.01536]
  - - [14, 8, 1, 2]
    - [65, 0.0172308]
  - - [16, 8, 1, 2]
    - [19, 0.018963]
  - - [2, 10, 1, 2]
    - [118, 0.00307692]
  - - [4, 10, 1, 2]
    - [15, 0.00615385]
  - - [6, 10, 1, 2]
    - [109, 0.0096]
  - - [8, 10, 1, 2]
    - [113, 0.0128]
  - - [10, 10, 1, 2]
    - [109, 0.016]
  - - [12, 10, 1, 2]
    - [92, 0.0192]
  - - [14, 10, 1, 2]
    - [11, 0.0215385]
  - - [16, 10, 1, 2]
    - [65, 0.0278261]
  - - [2, 12, 1, 2]
    - [114, 0.004]
  - - [4, 12, 1, 2]
    - [17, 0.00738462]
  - - [6, 12, 1, 2]
    - [11, 0.0110769]
  - - [8, 12, 1, 2]
    - [115, 0.016]
  - - [10, 12, 1, 2]
    - [62, 0.0192]
  - - [12, 12, 1, 2]
    - [99, 0.024]
  - - [14, 12, 1, 2]
    - [110, 0.0258462]
  - - [16, 12, 1, 2]
    - [93, 0.0295385]
  - - [2, 14, 1, 2]
    - [98, 0.00430769]
  - - [4, 14, 1, 2]
    - [108, 0.00896]
  - - [6, 14, 1, 2]
    - [99, 0.014]
  - - [8, 14, 1, 2]
    - [93, 0.01792]
  - - [10, 14, 1, 2]
    - [40, 0.0215385]
  - - [12, 14, 1, 2]
    - [102, 0.028]
  - - [14, 14, 1, 2]
    - [110, 0.03136]
  - - [16, 14, 1, 2]
    - [97, 0.03584]
  - - [2, 16, 1, 2]
    - [103, 0.00512]
  - - [4, 16, 1, 2]
    - [108, 0.01024]
  - - [6, 16, 1, 2]
    - [106, 0.0147692]
  - - [8, 16, 1, 2]
    - [85, 0.02048]
  - - [10, 16, 1, 2]
    - [97, 0.0256]
  - - [12, 16, 1, 2]
    - [97, 0.032]
  - - [14, 16, 1, 2]
    - [93, 0.03584]
  - - [16, 16, 1, 2]
    - [106, 0.0426667]
  - - [2, 2, 1, 4]
    - [107, 0.00128]
  - - [4, 2, 1, 4]
    - [99, 0.00256]
  - - [6, 2, 1, 4]
    - [85, 0.00384]
  - - [8, 2, 1, 4]
    - [99, 0.00512]
  - - [10, 2, 1, 4]
    - [108, 0.0064]
  - - [12, 2, 1, 4]
    - [62, 0.00768]
  - - [14, 2, 1, 4]
    - [92, 0.00933333]
  - - [16, 2, 1, 4]
    - [97, 0.0106667]
  - - [2, 4, 1, 4]
    - [102, 0.00256]
  - - [4, 4, 1, 4]
    - [92, 0.00533333]
  - - [6, 4, 1, 4]
    - [63, 0.00768]
  - - [8, 4, 1, 4]
    - [85, 0.0106667]
  - - [10, 4, 1, 4]
    - [97, 0.0128]
  - - [12, 4, 1, 4]
    - [85, 0.016]
  - - [14, 4, 1, 4]
    - [115, 0.0186667]
  - - [16, 4, 1, 4]
    - [92, 0.0213333]
  - - [2, 6, 1, 4]
    - [109, 0.00384]
  - - [4, 6, 1, 4]
    - [79, 0.008]
  - - [6, 6, 1, 4]
    - [92, 0.01152]
  - - [8, 6, 1, 4]
    - [103, 0.016]
  - - [10, 6, 1, 4]
    - [93, 0.0192]
  - - [12, 6, 1, 4]
    - [15, 0.02304]
  - - [14, 6, 1, 4]
    - [101, 0.028]
  - - [16, 6, 1, 4]
    - [63, 0.0295385]
  - - [2, 8, 1, 4]
    - [16, 0.00512]
  - - [4, 8, 1, 4]
    - [44, 0.01024]
  - - [6, 8, 1, 4]
    - [20, 0.016]
  - - [8, 8, 1, 4]
    - [19, 0.02048]
  - - [10, 8, 1, 4]
    - [114, 0.0278261]
  - - [12, 8, 1, 4]
    - [93, 0.03072]
  - - [14, 8, 1, 4]
    - [62, 0.0373333]
  - - [16, 8, 1, 4]
    - [114, 0.0426667]
  - - [2, 10, 1, 4]
    - [93, 0.0064]
  - - [4, 10, 1, 4]
    - [104, 0.0128]
  - - [6, 10, 1, 4]
    - [92, 0.0192]
  - - [8, 10, 1, 4]
    - [112, 0.0266667]
  - - [10, 10, 1, 4]
    - [63, 0.032]
  - - [12, 10, 1, 4]
    - [94, 0.04]
  - - [14, 10, 1, 4]
    - [63, 0.0448]
  - - [16, 10, 1, 4]
    - [44, 0.0533333]
  - - [2, 12, 1, 4]
    - [15, 0.00768]
  - - [4, 12, 1, 4]
    - [86, 0.01536]
  - - [6, 12, 1, 4]
    - [10, 0.02304]
  - - [8, 12, 1, 4]
    - [115, 0.032]
  - - [10, 12, 1, 4]
    - [112, 0.04]
  - - [12, 12, 1, 4]
    - [39, 0.04608]
  - - [14, 12, 1, 4]
    - [98, 0.0584348]
  - - [16, 12, 1, 4]
    - [17, 0.064]
  - - [2, 14, 1, 4]
    - [15, 0.00933333]
  - - [4, 14, 1, 4]
    - [112, 0.0186667]
  - - [6, 14, 1, 4]
    - [15, 0.028]
  - - [8, 14, 1, 4]
    - [114, 0.0373333]
  - - [10, 14, 1, 4]
    - [11, 0.0448]
  - - [12, 14, 1, 4]
    - [118, 0.05376]
  - - [14, 14, 1, 4]
    - [86, 0.06272]
  - - [16, 14, 1, 4]
    - [104, 0.0746667]
  - - [2, 16, 1, 4]
    - [113, 0.0106667]
  - - [4, 16, 1, 4]
    - [15, 0.02048]
  - - [6, 16, 1, 4]
    - [15, 0.03072]
  - - [8, 16, 1, 4]
    - [94, 0.04096]
  - - [10, 16, 1, 4]
    - [16, 0.0533333]
  - - [12, 16, 1, 4]
    - [85, 0.064]
  - - [14, 16, 1, 4]
    - [93, 0.0746667]
  - - [16, 16, 1, 4]
    - [10, 0.0787692]
  - - [2, 2, 1, 6]
    - [93, 0.002]
  - - [4, 2, 1, 6]
    - [62, 0.004]
  - - [6, 2, 1, 6]
    - [112, 0.006]
  - - [8, 2, 1, 6]
    - [103, 0.00768]
  - - [10, 2, 1, 6]
    - [10, 0.0096]
  - - [12, 2, 1, 6]
    - [11, 0.01152]
  - - [14, 2, 1, 6]
    - [44, 0.014]
  - - [16, 2, 1, 6]
    - [39, 0.01536]
  - - [2, 4, 1, 6]
    - [15, 0.00384]
  - - [4, 4, 1, 6]
    - [64, 0.00768]
  - - [6, 4, 1, 6]
    - [39, 0.01152]
  - - [8, 4, 1, 6]
    - [97, 0.01536]
  - - [10, 4, 1, 6]
    - [10, 0.0184615]
  - - [12, 4, 1, 6]
    - [15, 0.024]
  - - [14, 4, 1, 6]
    - [113, 0.028]
  - - [16, 4, 1, 6]
    - [10, 0.03072]
  - - [2, 6, 1, 6]
    - [15, 0.006]
  - - [4, 6, 1, 6]
    - [15, 0.012]
  - - [6, 6, 1, 6]
    - [62, 0.01728]
  - - [8, 6, 1, 6]
    - [103, 0.02304]
  - - [10, 6, 1, 6]
    - [16, 0.0288]
  - - [12, 6, 1, 6]
    - [106, 0.03456]
  - - [14, 6, 1, 6]
    - [97, 0.042]
  - - [16, 6, 1, 6]
    - [102, 0.04608]
  - - [2, 8, 1, 6]
    - [10, 0.00738462]
  - - [4, 8, 1, 6]
    - [16, 0.016]
  - - [6, 8, 1, 6]
    - [15, 0.024]
  - - [8, 8, 1, 6]
    - [92, 0.032]
  - - [10, 8, 1, 6]
    - [103, 0.0384]
  - - [12, 8, 1, 6]
    - [85, 0.048]
  - - [14, 8, 1, 6]
    - [15, 0.05376]
  - - [16, 8, 1, 6]
    - [111, 0.064]
  - - [2, 10, 1, 6]
    - [16, 0.0104348]
  - - [4, 10, 1, 6]
    - [64, 0.02]
  - - [6, 10, 1, 6]
    - [10, 0.0288]
  - - [8, 10, 1, 6]
    - [105, 0.04]
  - - [10, 10, 1, 6]
    - [115, 0.05]
  - - [12, 10, 1, 6]
    - [15, 0.06]
  - - [14, 10, 1, 6]
    - [65, 0.07]
  - - [16, 10, 1, 6]
    - [11, 0.0768]
  - - [2, 12, 1, 6]
    - [79, 0.012]
  - - [4, 12, 1, 6]
    - [16, 0.024]
  - - [6, 12, 1, 6]
    - [100, 0.03456]
  - - [8, 12, 1, 6]
    - [94, 0.048]
  - - [10, 12, 1, 6]
    - [10, 0.0553846]
  - - [12, 12, 1, 6]
    - [63, 0.0664615]
  - - [14, 12, 1, 6]
    - [93, 0.084]
  - - [16, 12, 1, 6]
    - [103, 0.096]
  - - [2, 14, 1, 6]
    - [108, 0.014]
  - - [4, 14, 1, 6]
    - [15, 0.02688]
  - - [6, 14, 1, 6]
    - [15, 0.04032]
  - - [8, 14, 1, 6]
    - [100, 0.056]
  - - [10, 14, 1, 6]
    - [10, 0.0672]
  - - [12, 14, 1, 6]
    - [15, 0.08064]
  - - [14, 14, 1, 6]
    - [39, 0.09408]
  - - [16, 14, 1, 6]
    - [115, 0.10752]
  - - [2, 16, 1, 6]
    - [114, 0.016]
  - - [4, 16, 1, 6]
    - [15, 0.032]
  - - [6, 16, 1, 6]
    - [104, 0.048]
  - - [8, 16, 1, 6]
    - [86, 0.06144]
  - - [10, 16, 1, 6]
    - [63, 0.0768]
  - - [12, 16, 1, 6]
    - [10, 0.09216]
  - - [14, 16, 1, 6]
    - [98, 0.112]
  - - [16, 16, 1, 6]
    - [16, 0.128]
  - - [2, 2, 1, 8]
    - [10, 0.00246154]
  - - [4, 2, 1, 8]
    - [112, 0.00512]
  - - [6, 2, 1, 8]
    - [65, 0.008]
  - - [8, 2, 1, 8]
    - [112, 0.0106667]
  - - [10, 2, 1, 8]
    - [102, 0.0128]
  - - [12, 2, 1, 8]
    - [15, 0.0147692]
  - - [14, 2, 1, 8]
    - [108, 0.01792]
  - - [16, 2, 1, 8]
    - [43, 0.02048]
  - - [2, 4, 1, 8]
    - [79, 0.00556522]
  - - [4, 4, 1, 8]
    - [79, 0.0106667]
  - - [6, 4, 1, 8]
    - [24, 0.01536]
  - - [8, 4, 1, 8]
    - [98, 0.0213333]
  - - [10, 4, 1, 8]
    - [97, 0.0266667]
  - - [12, 4, 1, 8]
    - [97, 0.032]
  - - [14, 4, 1, 8]
    - [15, 0.03584]
  - - [16, 4, 1, 8]
    - [10, 0.04096]
  - - [2, 6, 1, 8]
    - [15, 0.008]
  - - [4, 6, 1, 8]
    - [15, 0.01536]
  - - [6, 6, 1, 8]
    - [79, 0.024]
  - - [8, 6, 1, 8]
    - [15, 0.03072]
  - - [10, 6, 1, 8]
    - [10, 0.0384]
  - - [12, 6, 1, 8]
    - [15, 0.04608]
  - - [14, 6, 1, 8]
    - [10, 0.05376]
  - - [16, 6, 1, 8]
    - [105, 0.06144]
  - - [2, 8, 1, 8]
    - [114, 0.0106667]
  - - [4, 8, 1, 8]
    - [104, 0.0213333]
  - - [6, 8, 1, 8]
    - [107, 0.032]
  - - [8, 8, 1, 8]
    - [15, 0.04096]
  - - [10, 8, 1, 8]
    - [118, 0.0512]
  - - [12, 8, 1, 8]
    - [92, 0.064]
  - - [14, 8, 1, 8]
    - [85, 0.0746667]
  - - [16, 8, 1, 8]
    - [10, 0.0787692]
  - - [2, 10, 1, 8]
    - [15, 0.0133333]
  - - [4, 10, 1, 8]
    - [109, 0.0266667]
  - - [6, 10, 1, 8]
    - [93, 0.04]
  - - [8, 10, 1, 8]
    - [109, 0.0512]
  - - [10, 10, 1, 8]
    - [15, 0.064]
  - - [12, 10, 1, 8]
    - [17, 0.08]
  - - [14, 10, 1, 8]
    - [10, 0.0861538]
  - - [16, 10, 1, 8]
    - [106, 0.106667]
  - - [2, 12, 1, 8]
    - [105, 0.0166957]
  - - [4, 12, 1, 8]
    - [93, 0.03072]
  - - [6, 12, 1, 8]
    - [15, 0.048]
  - - [8, 12, 1, 8]
    - [85, 0.06144]
  - - [10, 12, 1, 8]
    - [15, 0.0768]
  - - [12, 12, 1, 8]
    - [92, 0.096]
  - - [14, 12, 1, 8]
    - [15, 0.10752]
  - - [16, 12, 1, 8]
    - [85, 0.12288]
  - - [2, 14, 1, 8]
    - [15, 0.01792]
  - - [4, 14, 1, 8]
    - [15, 0.03584]
  - - [6, 14, 1, 8]
    - [103, 0.05376]
  - - [8, 14, 1, 8]
    - [112, 0.077913]
  - - [10, 14, 1, 8]
    - [62, 0.0896]
  - - [12, 14, 1, 8]
    - [15, 0.103385]
  - - [14, 14, 1, 8]
    - [79, 0.130667]
  - - [16, 14, 1, 8]
    - [92, 0.14336]
  - - [2, 16, 1, 8]
    - [15, 0.02048]
  - - [4, 16, 1, 8]
    - [15, 0.04096]
  - - [6, 16, 1, 8]
    - [104, 0.064]
  - - [8, 16, 1, 8]
    - [10, 0.08192]
  - - [10, 16, 1, 8]
    - [10, 0.1024]
  - - [12, 16, 1, 8]
    - [11, 0.118154]
  - - [14, 16, 1, 8]
    - [85, 0.149333]
  - - [16, 16, 1, 8]
    - [17, 0.170667]
  - - [2, 2, 1, 10]
    - [102, 0.0032]
  - - [4, 2, 1, 10]
    - [10, 0.0064]
  - - [6, 2, 1, 10]
    - [105, 0.01]
  - - [8, 2, 1, 10]
    - [15, 0.0128]
  - - [10, 2, 1, 10]
    - [92, 0.0166667]
  - - [12, 2, 1, 10]
    - [15, 0.0192]
  - - [14, 2, 1, 10]
    - [15, 0.0224]
  - - [16, 2, 1, 10]
    - [92, 0.0266667]
  - - [2, 4, 1, 10]
    - [107, 0.00666667]
  - - [4, 4, 1, 10]
    - [40, 0.0133333]
  - - [6, 4, 1, 10]
    - [109, 0.02]
  - - [8, 4, 1, 10]
    - [79, 0.0256]
  - - [10, 4, 1, 10]
    - [114, 0.0333333]
  - - [12, 4, 1, 10]
    - [15, 0.0384]
  - - [14, 4, 1, 10]
    - [79, 0.0466667]
  - - [16, 4, 1, 10]
    - [115, 0.0533333]
  - - [2, 6, 1, 10]
    - [103, 0.0096]
  - - [4, 6, 1, 10]
    - [98, 0.02]
  - - [6, 6, 1, 10]
    - [15, 0.03]
  - - [8, 6, 1, 10]
    - [92, 0.04]
  - - [10, 6, 1, 10]
    - [16, 0.05]
  - - [12, 6, 1, 10]
    - [10, 0.0576]
  - - [14, 6, 1, 10]
    - [10, 0.0672]
  - - [16, 6, 1, 10]
    - [16, 0.0768]
  - - [2, 8, 1, 10]
    - [39, 0.0128]
  - - [4, 8, 1, 10]
    - [10, 0.0256]
  - - [6, 8, 1, 10]
    - [15, 0.0384]
  - - [8, 8, 1, 10]
    - [99, 0.0533333]
  - - [10, 8, 1, 10]
    - [112, 0.0666667]
  - - [12, 8, 1, 10]
    - [85, 0.08]
  - - [14, 8, 1, 10]
    - [108, 0.0933333]
  - - [16, 8, 1, 10]
    - [100, 0.106667]
  - - [2, 10, 1, 10]
    - [93, 0.016]
  - - [4, 10, 1, 10]
    - [16, 0.032]
  - - [6, 10, 1, 10]
    - [15, 0.05]
  - - [8, 10, 1, 10]
    - [17, 0.064]
  - - [10, 10, 1, 10]
    - [15, 0.0769231]
  - - [12, 10, 1, 10]
    - [10, 0.096]
  - - [14, 10, 1, 10]
    - [92, 0.116667]
  - - [16, 10, 1, 10]
    - [93, 0.133333]
  - - [2, 12, 1, 10]
    - [10, 0.0184615]
  - - [4, 12, 1, 10]
    - [108, 0.0384]
  - - [6, 12, 1, 10]
    - [15, 0.0576]
  - - [8, 12, 1, 10]
    - [10, 0.0768]
  - - [10, 12, 1, 10]
    - [85, 0.096]
  - - [12, 12, 1, 10]
    - [15, 0.1152]
  - - [14, 12, 1, 10]
    - [97, 0.14]
  - - [16, 12, 1, 10]
    - [10, 0.1536]
  - - [2, 14, 1, 10]
    - [15, 0.0224]
  - - [4, 14, 1, 10]
    - [11, 0.0448]
  - - [6, 14, 1, 10]
    - [15, 0.0672]
  - - [8, 14, 1, 10]
    - [10, 0.0896]
  - - [10, 14, 1, 10]
    - [11, 0.112]
  - - [12, 14, 1, 10]
    - [118, 0.14]
  - - [14, 14, 1, 10]
    - [15, 0.1568]
  - - [16, 14, 1, 10]
    - [15, 0.1792]
  - - [2, 16, 1, 10]
    - [44, 0.0256]
  - - [4, 16, 1, 10]
    - [17, 0.0492308]
  - - [6, 16, 1, 10]
    - [15, 0.0738462]
  - - [8, 16, 1, 10]
    - [15, 0.1024]
  - - [10, 16, 1, 10]
    - [11, 0.128]
  - - [12, 16, 1, 10]
    - [40, 0.1536]
  - - [14, 16, 1, 10]
    - [102, 0.1792]
  - - [16, 16, 1, 10]
    - [10, 0.2048]
  - - [2, 2, 1, 12]
    - [85, 0.00384]
  - - [4, 2, 1, 12]
    - [15, 0.008]
  - - [6, 2, 1, 12]
    - [15, 0.012]
  - - [8, 2, 1, 12]
    - [15, 0.0147692]
  - - [10, 2, 1, 12]
    - [65, 0.0192]
  - - [12, 2, 1, 12]
    - [11, 0.02304]
  - - [14, 2, 1, 12]
    - [99, 0.02688]
  - - [16, 2, 1, 12]
    - [10, 0.03072]
  - - [2, 4, 1, 12]
    - [15, 0.00768]
  - - [4, 4, 1, 12]
    - [10, 0.01536]
  - - [6, 4, 1, 12]
    - [101, 0.02304]
  - - [8, 4, 1, 12]
    - [43, 0.03072]
  - - [10, 4, 1, 12]
    - [15, 0.0384]
  - - [12, 4, 1, 12]
    - [102, 0.048]
  - - [14, 4, 1, 12]
    - [108, 0.05376]
  - - [16, 4, 1, 12]
    - [115, 0.06144]
  - - [2, 6, 1, 12]
    - [15, 0.01152]
  - - [4, 6, 1, 12]
    - [111, 0.024]
  - - [6, 6, 1, 12]
    - [107, 0.03456]
  - - [8, 6, 1, 12]
    - [115, 0.048]
  - - [10, 6, 1, 12]
    - [62, 0.06]
  - - [12, 6, 1, 12]
    - [115, 0.06912]
  - - [14, 6, 1, 12]
    - [10, 0.08064]
  - - [16, 6, 1, 12]
    - [10, 0.09216]
  - - [2, 8, 1, 12]
    - [99, 0.016]
  - - [4, 8, 1, 12]
    - [15, 0.03072]
  - - [6, 8, 1, 12]
    - [10, 0.04608]
  - - [8, 8, 1, 12]
    - [114, 0.064]
  - - [10, 8, 1, 12]
    - [97, 0.0768]
  - - [12, 8, 1, 12]
    - [108, 0.096]
  - - [14, 8, 1, 12]
    - [39, 0.112]
  - - [16, 8, 1, 12]
    - [11, 0.118154]
  - - [2, 10, 1, 12]
    - [10, 0.0184615]
  - - [4, 10, 1, 12]
    - [63, 0.0384]
  - - [6, 10, 1, 12]
    - [10, 0.0553846]
  - - [8, 10, 1, 12]
    - [15, 0.0768]
  - - [10, 10, 1, 12]
    - [15, 0.096]
  - - [12, 10, 1, 12]
    - [114, 0.12]
  - - [14, 10, 1, 12]
    - [10, 0.1344]
  - - [16, 10, 1, 12]
    - [94, 0.1536]
  - - [2, 12, 1, 12]
    - [10, 0.02304]
  - - [4, 12, 1, 12]
    - [15, 0.04608]
  - - [6, 12, 1, 12]
    - [10, 0.06912]
  - - [8, 12, 1, 12]
    - [97, 0.09216]
  - - [10, 12, 1, 12]
    - [15, 0.1152]
  - - [12, 12, 1, 12]
    - [10, 0.13824]
  - - [14, 12, 1, 12]
    - [10, 0.16128]
  - - [16, 12, 1, 12]
    - [15, 0.18432]
  - - [2, 14, 1, 12]
    - [44, 0.02688]
  - - [4, 14, 1, 12]
    - [63, 0.056]
  - - [6, 14, 1, 12]
    - [16, 0.084]
  - - [8, 14, 1, 12]
    - [10, 0.10752]
  - - [10, 14, 1, 12]
    - [15, 0.1344]
  - - [12, 14, 1, 12]
    - [10, 0.155077]
  - - [14, 14, 1, 12]
    - [10, 0.180923]
  - - [16, 14, 1, 12]
    - [10, 0.206769]
  - - [2, 16, 1, 12]
    - [10, 0.0295385]
  - - [4, 16, 1, 12]
    - [10, 0.0590769]
  - - [6, 16, 1, 12]
    - [22, 0.09216]
  - - [8, 16, 1, 12]
    - [15, 0.128]
  - - [10, 16, 1, 12]
    - [10, 0.1536]
  - - [12, 16, 1, 12]
    - [15, 0.18432]
  - - [14, 16, 1, 12]
    - [79, 0.224]
  - - [16, 16, 1, 12]
    - [10, 0.24576]
  - - [2, 2, 1, 14]
    - [98, 0.00448]
  - - [4, 2, 1, 14]
    - [15, 0.00933333]
  - - [6, 2, 1, 14]
    - [109, 0.01344]
  - - [8, 2, 1, 14]
    - [15, 0.01792]
  - - [10, 2, 1, 14]
    - [62, 0.0224]
  - - [12, 2, 1, 14]
    - [79, 0.02688]
  - - [14, 2, 1, 14]
    - [70, 0.03136]
  - - [16, 2, 1, 14]
    - [99, 0.03584]
  - - [2, 4, 1, 14]
    - [15, 0.00933333]
  - - [4, 4, 1, 14]
    - [15, 0.01792]
  - - [6, 4, 1, 14]
    - [15, 0.02688]
  - - [8, 4, 1, 14]
    - [10, 0.03584]
  - - [10, 4, 1, 14]
    - [22, 0.0430769]
  - - [12, 4, 1, 14]
    - [98, 0.05376]
  - - [14, 4, 1, 14]
    - [107, 0.06272]
  - - [16, 4, 1, 14]
    - [10, 0.07168]
  - - [2, 6, 1, 14]
    - [100, 0.01344]
  - - [4, 6, 1, 14]
    - [15, 0.02688]
  - - [6, 6, 1, 14]
    - [16, 0.042]
  - - [8, 6, 1, 14]
    - [10, 0.0516923]
  - - [10, 6, 1, 14]
    - [106, 0.0672]
  - - [12, 6, 1, 14]
    - [102, 0.084]
  - - [14, 6, 1, 14]
    - [15, 0.09408]
  - - [16, 6, 1, 14]
    - [62, 0.10752]
  - - [2, 8, 1, 14]
    - [102, 0.01792]
  - - [4, 8, 1, 14]
    - [117, 0.03584]
  - - [6, 8, 1, 14]
    - [99, 0.05376]
  - - [8, 8, 1, 14]
    - [15, 0.07168]
  - - [10, 8, 1, 14]
    - [15, 0.0896]
  - - [12, 8, 1, 14]
    - [15, 0.103385]
  - - [14, 8, 1, 14]
    - [10, 0.12544]
  - - [16, 8, 1, 14]
    - [104, 0.14336]
  - - [2, 10, 1, 14]
    - [10, 0.0215385]
  - - [4, 10, 1, 14]
    - [99, 0.0466667]
  - - [6, 10, 1, 14]
    - [10, 0.0672]
  - - [8, 10, 1, 14]
    - [92, 0.0933333]
  - - [10, 10, 1, 14]
    - [15, 0.116667]
  - - [12, 10, 1, 14]
    - [103, 0.14]
  - - [14, 10, 1, 14]
    - [98, 0.163333]
  - - [16, 10, 1, 14]
    - [15, 0.1792]
  - - [2, 12, 1, 14]
    - [10, 0.0258462]
  - - [4, 12, 1, 14]
    - [107, 0.056]
  - - [6, 12, 1, 14]
    - [10, 0.0775385]
  - - [8, 12, 1, 14]
    - [15, 0.10752]
  - - [10, 12, 1, 14]
    - [63, 0.1344]
  - - [12, 12, 1, 14]
    - [10, 0.16128]
  - - [14, 12, 1, 14]
    - [10, 0.18816]
  - - [16, 12, 1, 14]
    - [15, 0.21504]
  - - [2, 14, 1, 14]
    - [113, 0.0326667]
  - - [4, 14, 1, 14]
    - [62, 0.0653333]
  - - [6, 14, 1, 14]
    - [16, 0.098]
  - - [8, 14, 1, 14]
    - [16, 0.12544]
  - - [10, 14, 1, 14]
    - [65, 0.1568]
  - - [12, 14, 1, 14]
    - [16, 0.18816]
  - - [14, 14, 1, 14]
    - [114, 0.21952]
  - - [16, 14, 1, 14]
    - [63, 0.25088]
  - - [2, 16, 1, 14]
    - [15, 0.03584]
  - - [4, 16, 1, 14]
    - [15, 0.07168]
  - - [6, 16, 1, 14]
    - [102, 0.112]
  - - [8, 16, 1, 14]
    - [92, 0.149333]
  - - [10, 16, 1, 14]
    - [10, 0.1792]
  - - [12, 16, 1, 14]
    - [10, 0.21504]
  - - [14, 16, 1, 14]
    - [10, 0.241231]
  - - [16, 16, 1, 14]
    - [15, 0.275692]
  - - [2, 2, 1, 16]
    - [98, 0.00492308]
  - - [4, 2, 1, 16]
    - [103, 0.0106667]
  - - [6, 2, 1, 16]
    - [40, 0.01536]
  - - [8, 2, 1, 16]
    - [62, 0.0213333]
  - - [10, 2, 1, 16]
    - [15, 0.0256]
  - - [12, 2, 1, 16]
    - [99, 0.032]
  - - [14, 2, 1, 16]
    - [15, 0.03584]
  - - [16, 2, 1, 16]
    - [111, 0.04096]
  - - [2, 4, 1, 16]
    - [15, 0.01024]
  - - [4, 4, 1, 16]
    - [10, 0.0196923]
  - - [6, 4, 1, 16]
    - [10, 0.03072]
  - - [8, 4, 1, 16]
    - [85, 0.0426667]
  - - [10, 4, 1, 16]
    - [10, 0.0512]
  - - [12, 4, 1, 16]
    - [104, 0.06144]
  - - [14, 4, 1, 16]
    - [15, 0.0689231]
  - - [16, 4, 1, 16]
    - [16, 0.08192]
  - - [2, 6, 1, 16]
    - [15, 0.016]
  - - [4, 6, 1, 16]
    - [102, 0.0295385]
  - - [6, 6, 1, 16]
    - [15, 0.04608]
  - - [8, 6, 1, 16]
    - [15, 0.06144]
  - - [10, 6, 1, 16]
    - [118, 0.0768]
  - - [12, 6, 1, 16]
    - [10, 0.0886154]
  - - [14, 6, 1, 16]
    - [103, 0.10752]
  - - [16, 6, 1, 16]
    - [15, 0.12288]
  - - [2, 8, 1, 16]
    - [15, 0.02048]
  - - [4, 8, 1, 16]
    - [11, 0.0393846]
  - - [6, 8, 1, 16]
    - [15, 0.06144]
  - - [8, 8, 1, 16]
    - [15, 0.08192]
  - - [10, 8, 1, 16]
    - [99, 0.1024]
  - - [12, 8, 1, 16]
    - [93, 0.12288]
  - - [14, 8, 1, 16]
    - [10, 0.137846]
  - - [16, 8, 1, 16]
    - [15, 0.16384]
  - - [2, 10, 1, 16]
    - [10, 0.0256]
  - - [4, 10, 1, 16]
    - [16, 0.0533333]
  - - [6, 10, 1, 16]
    - [10, 0.0768]
  - - [8, 10, 1, 16]
    - [10, 0.1024]
  - - [10, 10, 1, 16]
    - [17, 0.133333]
  - - [12, 10, 1, 16]
    - [62, 0.1536]
  - - [14, 10, 1, 16]
    - [15, 0.186667]
  - - [16, 10, 1, 16]
    - [10, 0.2048]
  - - [2, 12, 1, 16]
    - [10, 0.03072]
  - - [4, 12, 1, 16]
    - [10, 0.06144]
  - - [6, 12, 1, 16]
    - [10, 0.09216]
  - - [8, 12, 1, 16]
    - [97, 0.128]
  - - [10, 12, 1, 16]
    - [16, 0.16]
  - - [12, 12, 1, 16]
    - [15, 0.192]
  - - [14, 12, 1, 16]
    - [15, 0.21504]
  - - [16, 12, 1, 16]
    - [10, 0.236308]
  - - [2, 14, 1, 16]
    - [40, 0.0344615]
  - - [4, 14, 1, 16]
    - [17, 0.0689231]
  - - [6, 14, 1, 16]
    - [15, 0.10752]
  - - [8, 14, 1, 16]
    - [15, 0.14336]
  - - [10, 14, 1, 16]
    - [10, 0.1792]
  - - [12, 14, 1, 16]
    - [98, 0.21504]
  - - [14, 14, 1, 16]
    - [10, 0.241231]
  - - [16, 14, 1, 16]
    - [15, 0.298667]
  - - [2, 16, 1, 16]
    - [107, 0.04096]
  - - [4, 16, 1, 16]
    - [92, 0.0853333]
  - - [6, 16, 1, 16]
    - [10, 0.12288]
  - - [8, 16, 1, 16]
    - [10, 0.157538]
  - - [10, 16, 1, 16]
    - [15, 0.2048]
  - - [12, 16, 1, 16]
    - [15, 0.256]
  - - [14, 16, 1, 16]
    - [15, 0.28672]
  - - [16, 16, 1, 16]
    - [98, 0.341333]
  - - [2, 2, 1, 1024]
    - [62, 0.315077]
  - - [4, 2, 1, 1024]
    - [62, 0.630154]
  - - [6, 2, 1, 1024]
    - [101, 0.945231]
  - - [8, 2, 1, 1024]
    - [114, 1.26031]
  - - [10, 2, 1, 1024]
    - [63, 1.51704]
  - - [12, 2, 1, 1024]
    - [62, 1.82044]
  - - [14, 2, 1, 1024]
    - [100, 2.12385]
  - - [16, 2, 1, 1024]
    - [93, 2.42726]
  - - [2, 4, 1, 1024]
    - [101, 0.606815]
  - - [4, 4, 1, 1024]
    - [93, 1.21363]
  - - [6, 4, 1, 1024]
    - [62, 1.82044]
  - - [8, 4, 1, 1024]
    - [62, 2.42726]
  - - [10, 4, 1, 1024]
    - [86, 3.03407]
  - - [12, 4, 1, 1024]
    - [100, 3.64089]
  - - [14, 4, 1, 1024]
    - [109, 4.2477]
  - - [16, 4, 1, 1024]
    - [100, 4.85452]
  - - [2, 6, 1, 1024]
    - [93, 0.945231]
  - - [4, 6, 1, 1024]
    - [86, 1.82044]
  - - [6, 6, 1, 1024]
    - [109, 2.83569]
  - - [8, 6, 1, 1024]
    - [62, 3.64089]
  - - [10, 6, 1, 1024]
    - [86, 4.72615]
  - - [12, 6, 1, 1024]
    - [62, 5.26629]
  - - [14, 6, 1, 1024]
    - [62, 6.37156]
  - - [16, 6, 1, 1024]
    - [109, 7.56185]
  - - [2, 8, 1, 1024]
    - [62, 1.21363]
  - - [4, 8, 1, 1024]
    - [100, 2.42726]
  - - [6, 8, 1, 1024]
    - [118, 3.93216]
  - - [8, 8, 1, 1024]
    - [86, 5.04123]
  - - [10, 8, 1, 1024]
    - [86, 6.06815]
  - - [12, 8, 1, 1024]
    - [93, 7.56185]
  - - [14, 8, 1, 1024]
    - [79, 8.49541]
  - - [16, 8, 1, 1024]
    - [93, 9.70904]
  - - [2, 10, 1, 1024]
    - [62, 1.51704]
  - - [4, 10, 1, 1024]
    - [65, 3.03407]
  - - [6, 10, 1, 1024]
    - [105, 4.55111]
  - - [8, 10, 1, 1024]
    - [101, 6.06815]
  - - [10, 10, 1, 1024]
    - [62, 7.87692]
  - - [12, 10, 1, 1024]
    - [40, 9.10222]
  - - [14, 10, 1, 1024]
    - [93, 10.6193]
  - - [16, 10, 1, 1024]
    - [62, 12.6031]
  - - [2, 12, 1, 1024]
    - [109, 1.89046]
  - - [4, 12, 1, 1024]
    - [93, 3.51086]
  - - [6, 12, 1, 1024]
    - [62, 5.89824]
  - - [8, 12, 1, 1024]
    - [86, 7.28178]
  - - [10, 12, 1, 1024]
    - [62, 9.10222]
  - - [12, 12, 1, 1024]
    - [118, 11.3428]
  - - [14, 12, 1, 1024]
    - [107, 13.2332]
  - - [16, 12, 1, 1024]
    - [19, 14.5636]
  - - [2, 14, 1, 1024]
    - [86, 2.12385]
  - - [4, 14, 1, 1024]
    - [93, 4.2477]
  - - [6, 14, 1, 1024]
    - [62, 6.61662]
  - - [8, 14, 1, 1024]
    - [100, 8.49541]
  - - [10, 14, 1, 1024]
    - [93, 11.0277]
  - - [12, 14, 1, 1024]
    - [62, 12.7431]
  - - [14, 14, 1, 1024]
    - [62, 14.867]
  - - [16, 14, 1, 1024]
    - [93, 17.6443]
  - - [2, 16, 1, 1024]
    - [100, 2.52062]
  - - [4, 16, 1, 1024]
    - [86, 5.04123]
  - - [6, 16, 1, 1024]
    - [86, 7.28178]
  - - [8, 16, 1, 1024]
    - [62, 9.70904]
  - - [10, 16, 1, 1024]
    - [16, 12.1363]
  - - [12, 16, 1, 1024]
    - [109, 15.1237]
  - - [14, 16, 1, 1024]
    - [40, 16.9908]
  - - [16, 16, 1, 1024]
    - [93, 20.1649]
  - - [2, 2, 1, 2048]
    - [118, 0.564966]
  - - [4, 2, 1, 2048]
    - [62, 1.12993]
  - - [6, 2, 1, 2048]
    - [86, 1.6949]
  - - [8, 2, 1, 2048]
    - [93, 2.25986]
  - - [10, 2, 1, 2048]
    - [79, 2.82483]
  - - [12, 2, 1, 2048]
    - [20, 3.38979]
  - - [14, 2, 1, 2048]
    - [20, 3.95476]
  - - [16, 2, 1, 2048]
    - [19, 4.36907]
  - - [2, 4, 1, 2048]
    - [62, 1.12993]
  - - [4, 4, 1, 2048]
    - [62, 2.25986]
  - - [6, 4, 1, 2048]
    - [62, 3.38979]
  - - [8, 4, 1, 2048]
    - [109, 4.68114]
  - - [10, 4, 1, 2048]
    - [100, 5.64966]
  - - [12, 4, 1, 2048]
    - [86, 7.02171]
  - - [14, 4, 1, 2048]
    - [118, 8.192]
  - - [16, 4, 1, 2048]
    - [62, 9.03945]
  - - [2, 6, 1, 2048]
    - [108, 1.6949]
  - - [4, 6, 1, 2048]
    - [100, 3.38979]
  - - [6, 6, 1, 2048]
    - [19, 5.08469]
  - - [8, 6, 1, 2048]
    - [62, 7.02171]
  - - [10, 6, 1, 2048]
    - [86, 8.47448]
  - - [12, 6, 1, 2048]
    - [62, 10.5326]
  - - [14, 6, 1, 2048]
    - [118, 12.288]
  - - [16, 6, 1, 2048]
    - [105, 13.5592]
  - - [2, 8, 1, 2048]
    - [118, 2.25986]
  - - [4, 8, 1, 2048]
    - [62, 4.51972]
  - - [6, 8, 1, 2048]
    - [62, 6.77959]
  - - [8, 8, 1, 2048]
    - [86, 9.03945]
  - - [10, 8, 1, 2048]
    - [62, 11.2993]
  - - [12, 8, 1, 2048]
    - [62, 13.5592]
  - - [14, 8, 1, 2048]
    - [109, 15.819]
  - - [16, 8, 1, 2048]
    - [109, 18.0789]
  - - [2, 10, 1, 2048]
    - [19, 2.82483]
  - - [4, 10, 1, 2048]
    - [100, 5.64966]
  - - [6, 10, 1, 2048]
    - [93, 8.77714]
  - - [8, 10, 1, 2048]
    - [62, 11.2993]
  - - [10, 10, 1, 2048]
    - [86, 14.1241]
  - - [12, 10, 1, 2048]
    - [62, 17.5543]
  - - [14, 10, 1, 2048]
    - [19, 19.1147]
  - - [16, 10, 1, 2048]
    - [86, 23.4057]
  - - [2, 12, 1, 2048]
    - [86, 3.38979]
  - - [4, 12, 1, 2048]
    - [86, 6.77959]
  - - [6, 12, 1, 2048]
    - [62, 10.1694]
  - - [8, 12, 1, 2048]
    - [86, 13.5592]
  - - [10, 12, 1, 2048]
    - [62, 16.949]
  - - [12, 12, 1, 2048]
    - [19, 19.6608]
  - - [14, 12, 1, 2048]
    - [93, 23.7286]
  - - [16, 12, 1, 2048]
    - [109, 28.0869]
  - - [2, 14, 1, 2048]
    - [16, 3.95476]
  - - [4, 14, 1, 2048]
    - [62, 7.90952]
  - - [6, 14, 1, 2048]
    - [62, 11.8643]
  - - [8, 14, 1, 2048]
    - [93, 16.9908]
  - - [10, 14, 1, 2048]
    - [109, 20.48]
  - - [12, 14, 1, 2048]
    - [100, 23.7286]
  - - [14, 14, 1, 2048]
    - [100, 28.672]
  - - [16, 14, 1, 2048]
    - [118, 31.6381]
  - - [2, 16, 1, 2048]
    - [93, 4.51972]
  - - [4, 16, 1, 2048]
    - [86, 9.36229]
  - - [6, 16, 1, 2048]
    - [62, 13.5592]
  - - [8, 16, 1, 2048]
    - [109, 18.0789]
  - - [10, 16, 1, 2048]
    - [62, 22.5986]
  - - [12, 16, 1, 2048]
    - [62, 27.1183]
  - - [14, 16, 1, 2048]
    - [62, 31.6381]
  - - [16, 16, 1, 2048]
    - [62, 36.1578]
  - - [2, 2, 1, 4096]
    - [109, 1.024]
  - - [4, 2, 1, 4096]
    - [86, 1.98594]
  - - [6, 2, 1, 4096]
    - [100, 3.072]
  - - [8, 2, 1, 4096]
    - [109, 4.096]
  - - [10, 2, 1, 4096]
    - [62, 4.96485]
  - - [12, 2, 1, 4096]
    - [109, 6.144]
  - - [14, 2, 1, 4096]
    - [100, 6.95079]
  - - [16, 2, 1, 4096]
    - [118, 7.94376]
  - - [2, 4, 1, 4096]
    - [100, 1.98594]
  - - [4, 4, 1, 4096]
    - [109, 4.096]
  - - [6, 4, 1, 4096]
    - [109, 6.144]
  - - [8, 4, 1, 4096]
    - [62, 7.94376]
  - - [10, 4, 1, 4096]
    - [62, 9.63765]
  - - [12, 4, 1, 4096]
    - [62, 11.9156]
  - - [14, 4, 1, 4096]
    - [62, 13.9016]
  - - [16, 4, 1, 4096]
    - [62, 15.8875]
  - - [2, 6, 1, 4096]
    - [86, 2.97891]
  - - [4, 6, 1, 4096]
    - [86, 5.78259]
  - - [6, 6, 1, 4096]
    - [86, 8.93673]
  - - [8, 6, 1, 4096]
    - [62, 11.9156]
  - - [10, 6, 1, 4096]
    - [62, 14.8945]
  - - [12, 6, 1, 4096]
    - [62, 17.8735]
  - - [14, 6, 1, 4096]
    - [118, 21.504]
  - - [16, 6, 1, 4096]
    - [62, 23.8313]
  - - [2, 8, 1, 4096]
    - [86, 3.97188]
  - - [4, 8, 1, 4096]
    - [62, 7.94376]
  - - [6, 8, 1, 4096]
    - [62, 11.9156]
  - - [8, 8, 1, 4096]
    - [86, 15.8875]
  - - [10, 8, 1, 4096]
    - [118, 20.48]
  - - [12, 8, 1, 4096]
    - [118, 23.8313]
  - - [14, 8, 1, 4096]
    - [86, 28.672]
  - - [16, 8, 1, 4096]
    - [118, 31.775]
  - - [2, 10, 1, 4096]
    - [86, 4.96485]
  - - [4, 10, 1, 4096]
    - [118, 10.24]
  - - [6, 10, 1, 4096]
    - [62, 14.8945]
  - - [8, 10, 1, 4096]
    - [86, 18.7246]
  - - [10, 10, 1, 4096]
    - [62, 24.8242]
  - - [12, 10, 1, 4096]
    - [62, 29.7891]
  - - [14, 10, 1, 4096]
    - [62, 35.84]
  - - [16, 10, 1, 4096]
    - [62, 39.7188]
  - - [2, 12, 1, 4096]
    - [62, 5.95782]
  - - [4, 12, 1, 4096]
    - [100, 12.288]
  - - [6, 12, 1, 4096]
    - [62, 17.8735]
  - - [8, 12, 1, 4096]
    - [62, 24.576]
  - - [10, 12, 1, 4096]
    - [62, 29.7891]
  - - [12, 12, 1, 4096]
    - [62, 36.864]
  - - [14, 12, 1, 4096]
    - [62, 41.7047]
  - - [16, 12, 1, 4096]
    - [100, 49.152]
  - - [2, 14, 1, 4096]
    - [62, 6.95079]
  - - [4, 14, 1, 4096]
    - [62, 13.9016]
  - - [6, 14, 1, 4096]
    - [62, 20.8524]
  - - [8, 14, 1, 4096]
    - [86, 27.8032]
  - - [10, 14, 1, 4096]
    - [62, 34.7539]
  - - [12, 14, 1, 4096]
    - [86, 41.7047]
  - - [14, 14, 1, 4096]
    - [109, 48.6555]
  - - [16, 14, 1, 4096]
    - [118, 55.6063]
  - - [2, 16, 1, 4096]
    - [93, 7.94376]
  - - [4, 16, 1, 4096]
    - [62, 15.8875]
  - - [6, 16, 1, 4096]
    - [86, 23.8313]
  - - [8, 16, 1, 4096]
    - [86, 32.768]
  - - [10, 16, 1, 4096]
    - [62, 39.7188]
  - - [12, 16, 1, 4096]
    - [100, 49.152]
  - - [14, 16, 1, 4096]
    - [86, 55.6063]
  - - [16, 16, 1, 4096]
    - [100, 65.536]
  - - [64, 4096, 1, 64]
    - [47, 1398.1]
  - - [320, 4096, 1, 64]
    - [9, 5412.01]
  - - [64, 4096, 1, 256]
    - [72, 5162.22]
  - - [4096, 64, 1, 64]
    - [10, 1290.56]
  - - [4096, 320, 1, 64]
    - [77, 5412.01]
  - - [4096, 64, 1, 256]
    - [117, 4971.03]
  - - [64, 64, 1, 8192]
    - [86, 1677.72]
  - - [64, 128, 1, 8192]
    - [62, 3441.48]
  - - [64, 8192, 1, 64]
    - [39, 2581.11]
  - - [64, 8192, 1, 128]
    - [10, 4971.03]
  - - [128, 64, 1, 8192]
    - [86, 3273.6]
  - - [128, 8192, 1, 64]
    - [13, 4628.2]
  - - [8192, 64, 1, 64]
    - [71, 2485.51]
  - - [8192, 64, 1, 128]
    - [71, 4971.03]
  - - [8192, 128, 1, 64]
    - [32, 4473.92]
  - - [64, 1, 1, 64]
    - [115, 0.341333]
  - - [64, 16, 1, 64]
    - [15, 5.24288]
  - - [64, 32, 1, 64]
    - [10, 10.4858]
  - - [1, 1, 1, 64]
    - [10, 0.00512]
  - - [16, 1, 1, 64]
    - [40, 0.0890435]
  - - [32, 1, 1, 64]
    - [16, 0.16384]
  - - [64, 1, 1, 1]
    - [15, 0.00556522]
  - - [64, 1, 1, 16]
    - [97, 0.08192]
  - - [64, 1, 1, 32]
    - [10, 0.16384]
  - - [1, 16, 1, 64]
    - [97, 0.08192]
  - - [16, 16, 1, 64]
    - [10, 1.31072]
  - - [32, 16, 1, 64]
    - [102, 2.73067]
  - - [64, 16, 1, 1]
    - [114, 0.0853333]
  - - [64, 16, 1, 16]
    - [99, 1.36533]
  - - [64, 16, 1, 32]
    - [10, 2.62144]
  - - [1, 32, 1, 64]
    - [63, 0.170667]
  - - [16, 32, 1, 64]
    - [94, 2.62144]
  - - [32, 32, 1, 64]
    - [10, 5.24288]
  - - [64, 32, 1, 1]
    - [15, 0.16384]
  - - [64, 32, 1, 16]
    - [101, 2.62144]
  - - [64, 32, 1, 32]
    - [103, 5.24288]
  - - [1, 1, 1, 1]
    - [115, 8.0e-05]
  - - [1, 1, 1, 16]
    - [10, 0.00128]
  - - [1, 1, 1, 32]
    - [17, 0.00266667]
  - - [16, 1, 1, 1]
    - [104, 0.00128]
  - - [16, 1, 1, 16]
    - [98, 0.02048]
  - - [16, 1, 1, 32]
    - [102, 0.0426667]
  - - [32, 1, 1, 1]
    - [15, 0.00256]
  - - [32, 1, 1, 16]
    - [113, 0.0426667]
  - - [32, 1, 1, 32]
    - [15, 0.0853333]
  - - [1, 16, 1, 1]
    - [15, 0.00128]
  - - [1, 16, 1, 16]
    - [10, 0.02048]
  - - [1, 16, 1, 32]
    - [103, 0.04096]
  - - [16, 16, 1, 1]
    - [100, 0.02048]
  - - [16, 16, 1, 16]
    - [15, 0.32768]
  - - [16, 16, 1, 32]
    - [10, 0.65536]
  - - [32, 16, 1, 1]
    - [92, 0.0426667]
  - - [32, 16, 1, 16]
    - [17, 0.65536]
  - - [32, 16, 1, 32]
    - [10, 1.31072]
  - - [1, 32, 1, 1]
    - [11, 0.00256]
  - - [1, 32, 1, 16]
    - [15, 0.04096]
  - - [1, 32, 1, 32]
    - [85, 0.0853333]
  - - [16, 32, 1, 1]
    - [97, 0.0426667]
  - - [16, 32, 1, 16]
    - [39, 0.65536]
  - - [16, 32, 1, 32]
    - [15, 1.26031]
  - - [32, 32, 1, 1]
    - [106, 0.0853333]
  - - [32, 32, 1, 16]
    - [17, 1.31072]
  - - [32, 32, 1, 32]
    - [100, 2.62144]
  - - [1, 64, 1, 64]
    - [15, 0.32768]
  - - [16, 64, 1, 64]
    - [15, 5.24288]
  - - [32, 64, 1, 64]
    - [15, 10.4858]
  - - [1, 64, 1, 1]
    - [103, 0.00533333]
  - - [1, 64, 1, 16]
    - [43, 0.08192]
  - - [1, 64, 1, 32]
    - [103, 0.170667]
  - - [16, 64, 1, 1]
    - [10, 0.0787692]
  - - [16, 64, 1, 16]
    - [10, 1.26031]
  - - [16, 64, 1, 32]
    - [114, 2.62144]
  - - [32, 64, 1, 1]
    - [15, 0.170667]
  - - [32, 64, 1, 16]
    - [79, 2.73067]
  - - [32, 64, 1, 32]
    - [93, 5.24288]
  - - [64, 64, 1, 1]
    - [44, 0.341333]
  - - [64, 64, 1, 16]
    - [15, 5.46133]
  - - [64, 64, 1, 32]
    - [112, 10.9227]
  - - [256, 1, 1, 256]
    - [109, 5.24288]
  - - [256, 16, 1, 256]
    - [79, 83.8861]
  - - [256, 32, 1, 256]
    - [62, 167.772]
  - - [1, 1, 1, 256]
    - [100, 0.02048]
  - - [16, 1, 1, 256]
    - [86, 0.315077]
  - - [32, 1, 1, 256]
    - [16, 0.65536]
  - - [256, 1, 1, 1]
    - [15, 0.02048]
  - - [256, 1, 1, 16]
    - [97, 0.32768]
  - - [256, 1, 1, 32]
    - [62, 0.65536]
  - - [1, 16, 1, 256]
    - [63, 0.315077]
  - - [16, 16, 1, 256]
    - [98, 5.24288]
  - - [32, 16, 1, 256]
    - [10, 10.4858]
  - - [256, 16, 1, 1]
    - [10, 0.32768]
  - - [256, 16, 1, 16]
    - [92, 5.46133]
  - - [256, 16, 1, 32]
    - [10, 10.0825]
  - - [1, 32, 1, 256]
    - [93, 0.630154]
  - - [16, 32, 1, 256]
    - [101, 10.4858]
  - - [32, 32, 1, 256]
    - [105, 20.9715]
  - - [256, 32, 1, 1]
    - [39, 0.65536]
  - - [256, 32, 1, 16]
    - [15, 10.9227]
  - - [256, 32, 1, 32]
    - [64, 20.9715]
  - - [1, 256, 1, 256]
    - [112, 5.24288]
  - - [16, 256, 1, 256]
    - [106, 80.6597]
  - - [32, 256, 1, 256]
    - [106, 167.772]
  - - [1, 256, 1, 1]
    - [106, 0.02048]
  - - [1, 256, 1, 16]
    - [15, 0.32768]
  - - [1, 256, 1, 32]
    - [10, 0.630154]
  - - [16, 256, 1, 1]
    - [92, 0.32768]
  - - [16, 256, 1, 16]
    - [10, 5.24288]
  - - [16, 256, 1, 32]
    - [104, 10.9227]
  - - [32, 256, 1, 1]
    - [17, 0.682667]
  - - [32, 256, 1, 16]
    - [15, 10.4858]
  - - [32, 256, 1, 32]
    - [10, 20.9715]
  - - [256, 256, 1, 1]
    - [16, 5.46133]
  - - [256, 256, 1, 16]
    - [10, 83.8861]
  - - [256, 256, 1, 32]
    - [15, 167.772]
  - - [512, 1, 1, 512]
    - [98, 20.9715]
  - - [512, 16, 1, 512]
    - [118, 335.544]
  - - [512, 32, 1, 512]
    - [108, 645.278]
  - - [1, 1, 1, 512]
    - [93, 0.04096]
  - - [16, 1, 1, 512]
    - [113, 0.65536]
  - - [32, 1, 1, 512]
    - [86, 1.26031]
  - - [512, 1, 1, 1]
    - [106, 0.04096]
  - - [512, 1, 1, 16]
    - [10, 0.65536]
  - - [512, 1, 1, 32]
    - [79, 1.31072]
  - - [1, 16, 1, 512]
    - [113, 0.65536]
  - - [16, 16, 1, 512]
    - [118, 10.0825]
  - - [32, 16, 1, 512]
    - [79, 20.1649]
  - - [512, 16, 1, 1]
    - [65, 0.682667]
  - - [512, 16, 1, 16]
    - [39, 10.4858]
  - - [512, 16, 1, 32]
    - [10, 20.9715]
  - - [1, 32, 1, 512]
    - [79, 1.31072]
  - - [16, 32, 1, 512]
    - [115, 19.4181]
  - - [32, 32, 1, 512]
    - [108, 40.3298]
  - - [512, 32, 1, 1]
    - [10, 1.31072]
  - - [512, 32, 1, 16]
    - [17, 21.8453]
  - - [512, 32, 1, 32]
    - [112, 45.5903]
  - - [1, 512, 1, 512]
    - [101, 21.8453]
  - - [16, 512, 1, 512]
    - [101, 335.544]
  - - [32, 512, 1, 512]
    - [10, 621.378]
  - - [1, 512, 1, 1]
    - [10, 0.0393846]
  - - [1, 512, 1, 16]
    - [10, 0.65536]
  - - [1, 512, 1, 32]
    - [10, 1.31072]
  - - [16, 512, 1, 1]
    - [10, 0.65536]
  - - [16, 512, 1, 16]
    - [15, 10.4858]
  - - [16, 512, 1, 32]
    - [10, 20.9715]
  - - [32, 512, 1, 1]
    - [102, 1.31072]
  - - [32, 512, 1, 16]
    - [15, 21.8453]
  - - [32, 512, 1, 32]
    - [111, 43.6907]
  - - [512, 512, 1, 1]
    - [10, 20.1649]
  - - [512, 512, 1, 16]
    - [15, 349.525]
  - - [512, 512, 1, 32]
    - [15, 671.089]
  - - [1024, 1, 1, 1024]
    - [93, 72.3156]
  - - [1024, 16, 1, 1024]
    - [19, 1157.05]
  - - [1024, 32, 1, 1024]
    - [10, 2314.1]
  - - [1, 1, 1, 1024]
    - [62, 0.0758519]
  - - [16, 1, 1, 1024]
    - [62, 1.21363]
  - - [32, 1, 1, 1024]
    - [62, 2.34057]
  - - [1024, 1, 1, 1]
    - [15, 0.08192]
  - - [1024, 1, 1, 16]
    - [15, 1.31072]
  - - [1024, 1, 1, 32]
    - [97, 2.62144]
  - - [1, 16, 1, 1024]
    - [86, 1.21363]
  - - [16, 16, 1, 1024]
    - [86, 19.4181]
  - - [32, 16, 1, 1024]
    - [93, 38.8361]
  - - [1024, 16, 1, 1]
    - [104, 1.31072]
  - - [1024, 16, 1, 16]
    - [63, 21.8453]
  - - [1024, 16, 1, 32]
    - [11, 40.3298]
  - - [1, 32, 1, 1024]
    - [100, 2.52062]
  - - [16, 32, 1, 1024]
    - [118, 38.8361]
  - - [32, 32, 1, 1024]
    - [79, 80.6597]
  - - [1024, 32, 1, 1]
    - [92, 2.73067]
  - - [1024, 32, 1, 16]
    - [15, 43.6907]
  - - [1024, 32, 1, 32]
    - [15, 80.6597]
  - - [1, 1024, 1, 1024]
    - [62, 77.6723]
  - - [16, 1024, 1, 1024]
    - [93, 1290.56]
  - - [32, 1024, 1, 1024]
    - [93, 2581.11]
  - - [1, 1024, 1, 1]
    - [97, 0.0853333]
  - - [1, 1024, 1, 16]
    - [15, 1.31072]
  - - [1, 1024, 1, 32]
    - [15, 2.73067]
  - - [16, 1024, 1, 1]
    - [10, 1.31072]
  - - [16, 1024, 1, 16]
    - [10, 20.1649]
  - - [16, 1024, 1, 32]
    - [92, 40.3298]
  - - [32, 1024, 1, 1]
    - [94, 2.62144]
  - - [32, 1024, 1, 16]
    - [107, 43.6907]
  - - [32, 1024, 1, 32]
    - [10, 83.8861]
  - - [1024, 1024, 1, 1]
    - [13, 74.8983]
  - - [1024, 1024, 1, 16]
    - [13, 1157.05]
  - - [1024, 1024, 1, 32]
    - [13, 2314.1]
  - - [2048, 1, 1, 2048]
    - [100, 279.62]
  - - [2048, 16, 1, 2048]
    - [100, 4473.92]
  - - [1, 1, 1, 2048]
    - [62, 0.141241]
  - - [16, 1, 1, 2048]
    - [62, 2.25986]
  - - [32, 1, 1, 2048]
    - [118, 4.68114]
  - - [2048, 1, 1, 1]
    - [97, 0.170667]
  - - [2048, 1, 1, 16]
    - [11, 2.62144]
  - - [2048, 1, 1, 32]
    - [10, 5.24288]
  - - [1, 16, 1, 2048]
    - [86, 2.25986]
  - - [16, 16, 1, 2048]
    - [86, 36.1578]
  - - [32, 16, 1, 2048]
    - [118, 74.8983]
  - - [2048, 16, 1, 1]
    - [97, 2.84939]
  - - [2048, 16, 1, 16]
    - [11, 41.943]
  - - [2048, 16, 1, 32]
    - [102, 83.8861]
  - - [1, 32, 1, 2048]
    - [62, 4.51972]
  - - [16, 32, 1, 2048]
    - [86, 72.3156]
  - - [32, 32, 1, 2048]
    - [62, 139.81]
  - - [2048, 32, 1, 1]
    - [15, 5.46133]
  - - [2048, 32, 1, 16]
    - [10, 83.8861]
  - - [2048, 32, 1, 32]
    - [102, 167.772]
  - - [1, 2048, 1, 2048]
    - [63, 299.593]
  - - [16, 2048, 1, 2048]
    - [106, 4971.03]
  - - [1, 2048, 1, 1]
    - [10, 0.16384]
  - - [1, 2048, 1, 16]
    - [105, 2.62144]
  - - [1, 2048, 1, 32]
    - [21, 5.24288]
  - - [16, 2048, 1, 1]
    - [10, 2.52062]
  - - [16, 2048, 1, 16]
    - [92, 43.6907]
  - - [16, 2048, 1, 32]
    - [10, 80.6597]
  - - [32, 2048, 1, 1]
    - [10, 5.24288]
  - - [32, 2048, 1, 16]
    - [62, 83.8861]
  - - [32, 2048, 1, 32]
    - [10, 167.772]
  - - [2048, 2048, 1, 1]
    - [3, 226.719]
  - - [2048, 2048, 1, 16]
    - [61, 3728.27]
  - - [3072, 1, 1, 3072]
    - [105, 539.268]
  - - [1, 1, 1, 3072]
    - [100, 0.2048]
  - - [16, 1, 1, 3072]
    - [93, 3.072]
  - - [32, 1, 1, 3072]
    - [62, 6.34219]
  - - [3072, 1, 1, 1]
    - [99, 0.256]
  - - [3072, 1, 1, 16]
    - [16, 3.93216]
  - - [3072, 1, 1, 32]
    - [17, 7.28178]
  - - [1, 16, 1, 3072]
    - [93, 3.1711]
  - - [16, 16, 1, 3072]
    - [86, 50.7375]
  - - [32, 16, 1, 3072]
    - [86, 101.475]
  - - [3072, 16, 1, 1]
    - [62, 3.93216]
  - - [3072, 16, 1, 16]
    - [101, 65.536]
  - - [3072, 16, 1, 32]
    - [17, 131.072]
  - - [1, 32, 1, 3072]
    - [93, 6.34219]
  - - [16, 32, 1, 3072]
    - [62, 101.475]
  - - [32, 32, 1, 3072]
    - [62, 202.95]
  - - [3072, 32, 1, 1]
    - [10, 7.56185]
  - - [3072, 32, 1, 16]
    - [107, 125.829]
  - - [3072, 32, 1, 32]
    - [102, 251.658]
  - - [1, 3072, 1, 3072]
    - [79, 629.146]
  - - [1, 3072, 1, 1]
    - [15, 0.26713]
  - - [1, 3072, 1, 16]
    - [100, 3.93216]
  - - [1, 3072, 1, 32]
    - [10, 7.56185]
  - - [16, 3072, 1, 1]
    - [15, 3.93216]
  - - [16, 3072, 1, 16]
    - [10, 62.9146]
  - - [16, 3072, 1, 32]
    - [10, 120.99]
  - - [32, 3072, 1, 1]
    - [85, 7.86432]
  - - [32, 3072, 1, 16]
    - [100, 125.829]
  - - [32, 3072, 1, 32]
    - [73, 251.658]
  - - [3072, 3072, 1, 1]
    - [37, 385.191]
  - - [4096, 1, 1, 4096]
    - [112, 860.37]
  - - [1, 1, 1, 4096]
    - [62, 0.248242]
  - - [16, 1, 1, 4096]
    - [86, 4.096]
  - - [32, 1, 1, 4096]
    - [62, 8.192]
  - - [4096, 1, 1, 1]
    - [10, 0.32768]
  - - [4096, 1, 1, 16]
    - [40, 5.46133]
  - - [4096, 1, 1, 32]
    - [10, 10.0825]
  - - [1, 16, 1, 4096]
    - [62, 3.97188]
  - - [16, 16, 1, 4096]
    - [86, 63.5501]
  - - [32, 16, 1, 4096]
    - [100, 127.1]
  - - [4096, 16, 1, 1]
    - [102, 5.46133]
  - - [4096, 16, 1, 16]
    - [10, 83.8861]
  - - [4096, 16, 1, 32]
    - [10, 161.319]
  - - [1, 32, 1, 4096]
    - [62, 7.71012]
  - - [16, 32, 1, 4096]
    - [86, 127.1]
  - - [32, 32, 1, 4096]
    - [62, 254.2]
  - - [4096, 32, 1, 1]
    - [21, 10.9227]
  - - [4096, 32, 1, 16]
    - [97, 167.772]
  - - [4096, 32, 1, 32]
    - [15, 335.544]
  - - [1, 4096, 1, 4096]
    - [63, 932.068]
  - - [1, 4096, 1, 1]
    - [72, 0.341333]
  - - [1, 4096, 1, 16]
    - [112, 5.69878]
  - - [1, 4096, 1, 32]
    - [11, 10.4858]
  - - [16, 4096, 1, 1]
    - [10, 5.24288]
  - - [16, 4096, 1, 16]
    - [15, 83.8861]
  - - [16, 4096, 1, 32]
    - [15, 167.772]
  - - [32, 4096, 1, 1]
    - [115, 10.4858]
  - - [32, 4096, 1, 16]
    - [10, 155.345]
  - - [32, 4096, 1, 32]
    - [15, 335.544]
  - - [4096, 4096, 1, 1]
    - [14, 493.448]
  - - [320, 1, 1, 64]
    - [10, 1.6384]
  - - [320, 16, 1, 64]
    - [104, 28.4939]
  - - [320, 32, 1, 64]
    - [85, 52.4288]
  - - [320, 1, 1, 1]
    - [10, 0.0256]
  - - [320, 1, 1, 16]
    - [10, 0.4096]
  - - [320, 1, 1, 32]
    - [10, 0.8192]
  - - [320, 16, 1, 1]
    - [93, 0.426667]
  - - [320, 16, 1, 16]
    - [15, 6.82667]
  - - [320, 16, 1, 32]
    - [97, 13.6533]
  - - [320, 32, 1, 1]
    - [93, 0.853333]
  - - [320, 32, 1, 16]
    - [16, 13.1072]
  - - [320, 32, 1, 32]
    - [63, 27.3067]
  - - [320, 64, 1, 1]
    - [40, 1.70667]
  - - [320, 64, 1, 16]
    - [113, 26.2144]
  - - [320, 64, 1, 32]
    - [115, 52.4288]
  - - [576, 1, 1, 64]
    - [15, 2.94912]
  - - [576, 16, 1, 64]
    - [112, 47.1859]
  - - [576, 32, 1, 64]
    - [11, 94.3718]
  - - [576, 1, 1, 1]
    - [15, 0.04608]
  - - [576, 1, 1, 16]
    - [102, 0.73728]
  - - [576, 1, 1, 32]
    - [41, 1.47456]
  - - [576, 16, 1, 1]
    - [16, 0.768]
  - - [576, 16, 1, 16]
    - [10, 11.7965]
  - - [576, 16, 1, 32]
    - [10, 23.593]
  - - [576, 32, 1, 1]
    - [15, 1.47456]
  - - [576, 32, 1, 16]
    - [22, 23.593]
  - - [576, 32, 1, 32]
    - [94, 47.1859]
  - - [576, 64, 1, 1]
    - [54, 2.94912]
  - - [576, 64, 1, 16]
    - [94, 45.3711]
  - - [576, 64, 1, 32]
    - [11, 94.3718]
  - - [832, 1, 1, 64]
    - [10, 4.25984]
  - - [832, 16, 1, 64]
    - [112, 68.1574]
  - - [832, 32, 1, 64]
    - [15, 136.315]
  - - [832, 1, 1, 1]
    - [101, 0.0693333]
  - - [832, 1, 1, 16]
    - [16, 1.15757]
  - - [832, 1, 1, 32]
    - [98, 2.21867]
  - - [832, 16, 1, 1]
    - [10, 1.06496]
  - - [832, 16, 1, 16]
    - [10, 16.384]
  - - [832, 16, 1, 32]
    - [10, 32.768]
  - - [832, 32, 1, 1]
    - [109, 2.12992]
  - - [832, 32, 1, 16]
    - [17, 37.0421]
  - - [832, 32, 1, 32]
    - [104, 68.1574]
  - - [832, 64, 1, 1]
    - [15, 4.25984]
  - - [832, 64, 1, 16]
    - [15, 70.9973]
  - - [832, 64, 1, 32]
    - [10, 136.315]
  - - [1088, 1, 1, 64]
    - [15, 5.57056]
  - - [1088, 16, 1, 64]
    - [10, 89.129]
  - - [1088, 32, 1, 64]
    - [16, 185.685]
  - - [1088, 1, 1, 1]
    - [10, 0.08704]
  - - [1088, 1, 1, 16]
    - [114, 1.45067]
  - - [1088, 1, 1, 32]
    - [115, 2.78528]
  - - [1088, 16, 1, 1]
    - [102, 1.39264]
  - - [1088, 16, 1, 16]
    - [86, 22.2822]
  - - [1088, 16, 1, 32]
    - [15, 46.4213]
  - - [1088, 32, 1, 1]
    - [15, 2.90133]
  - - [1088, 32, 1, 16]
    - [64, 46.4213]
  - - [1088, 32, 1, 32]
    - [17, 96.8793]
  - - [1088, 64, 1, 1]
    - [107, 5.57056]
  - - [1088, 64, 1, 16]
    - [111, 92.8427]
  - - [1088, 64, 1, 32]
    - [11, 178.258]
  - - [1344, 1, 1, 64]
    - [92, 7.168]
  - - [1344, 16, 1, 64]
    - [10, 105.866]
  - - [1344, 32, 1, 64]
    - [15, 220.201]
  - - [1344, 1, 1, 1]
    - [16, 0.112]
  - - [1344, 1, 1, 16]
    - [113, 1.86991]
  - - [1344, 1, 1, 32]
    - [15, 3.30831]
  - - [1344, 16, 1, 1]
    - [15, 1.792]
  - - [1344, 16, 1, 16]
    - [16, 28.672]
  - - [1344, 16, 1, 32]
    - [102, 57.344]
  - - [1344, 32, 1, 1]
    - [15, 3.44064]
  - - [1344, 32, 1, 16]
    - [113, 57.344]
  - - [1344, 32, 1, 32]
    - [97, 110.1]
  - - [1344, 64, 1, 1]
    - [15, 7.168]
  - - [1344, 64, 1, 16]
    - [15, 114.688]
  - - [1344, 64, 1, 32]
    - [107, 229.376]
  - - [1600, 1, 1, 64]
    - [15, 8.53333]
  - - [1600, 16, 1, 64]
    - [106, 136.533]
  - - [1600, 32, 1, 64]
    - [11, 262.144]
  - - [1600, 1, 1, 1]
    - [10, 0.128]
  - - [1600, 1, 1, 16]
    - [108, 2.048]
  - - [1600, 1, 1, 32]
    - [10, 4.096]
  - - [1600, 16, 1, 1]
    - [102, 2.13333]
  - - [1600, 16, 1, 16]
    - [86, 34.1333]
  - - [1600, 16, 1, 32]
    - [85, 65.536]
  - - [1600, 32, 1, 1]
    - [85, 4.096]
  - - [1600, 32, 1, 16]
    - [10, 63.0154]
  - - [1600, 32, 1, 32]
    - [92, 131.072]
  - - [1600, 64, 1, 1]
    - [10, 8.192]
  - - [1600, 64, 1, 16]
    - [11, 126.031]
  - - [1600, 64, 1, 32]
    - [15, 262.144]
  - - [1856, 1, 1, 64]
    - [97, 9.50272]
  - - [1856, 16, 1, 64]
    - [11, 146.196]
  - - [1856, 32, 1, 64]
    - [10, 292.391]
  - - [1856, 1, 1, 1]
    - [15, 0.14848]
  - - [1856, 1, 1, 16]
    - [15, 2.47467]
  - - [1856, 1, 1, 32]
    - [10, 4.75136]
  - - [1856, 16, 1, 1]
    - [11, 2.47467]
  - - [1856, 16, 1, 16]
    - [11, 36.5489]
  - - [1856, 16, 1, 32]
    - [94, 79.1893]
  - - [1856, 32, 1, 1]
    - [15, 4.56862]
  - - [1856, 32, 1, 16]
    - [10, 76.0218]
  - - [1856, 32, 1, 32]
    - [10, 152.044]
  - - [1856, 64, 1, 1]
    - [10, 9.13723]
  - - [1856, 64, 1, 16]
    - [11, 152.044]
  - - [1856, 64, 1, 32]
    - [99, 316.757]
  - - [2112, 1, 1, 64]
    - [62, 10.8134]
  - - [2112, 16, 1, 64]
    - [65, 180.224]
  - - [2112, 32, 1, 64]
    - [65, 346.03]
  - - [2112, 1, 1, 1]
    - [39, 0.16896]
  - - [2112, 1, 1, 16]
    - [65, 2.70336]
  - - [2112, 1, 1, 32]
    - [97, 5.632]
  - - [2112, 16, 1, 1]
    - [97, 2.70336]
  - - [2112, 16, 1, 16]
    - [15, 43.2538]
  - - [2112, 16, 1, 32]
    - [10, 86.5075]
  - - [2112, 32, 1, 1]
    - [15, 5.40672]
  - - [2112, 32, 1, 16]
    - [114, 86.5075]
  - - [2112, 32, 1, 32]
    - [104, 173.015]
  - - [2112, 64, 1, 1]
    - [15, 10.8134]
  - - [2112, 64, 1, 16]
    - [11, 166.361]
  - - [2112, 64, 1, 32]
    - [99, 360.448]
  - - [2368, 1, 1, 64]
    - [10, 11.6578]
  - - [2368, 16, 1, 64]
    - [40, 193.987]
  - - [2368, 32, 1, 64]
    - [15, 373.051]
  - - [2368, 1, 1, 1]
    - [10, 0.18944]
  - - [2368, 1, 1, 16]
    - [99, 3.03104]
  - - [2368, 1, 1, 32]
    - [110, 6.06208]
  - - [2368, 16, 1, 1]
    - [10, 3.03104]
  - - [2368, 16, 1, 16]
    - [97, 50.5173]
  - - [2368, 16, 1, 32]
    - [85, 96.9933]
  - - [2368, 32, 1, 1]
    - [11, 6.06208]
  - - [2368, 32, 1, 16]
    - [86, 96.9933]
  - - [2368, 32, 1, 32]
    - [92, 193.987]
  - - [2368, 64, 1, 1]
    - [10, 11.6578]
  - - [2368, 64, 1, 16]
    - [114, 193.987]
  - - [2368, 64, 1, 32]
    - [15, 387.973]
  - - [2624, 1, 1, 64]
    - [10, 13.4349]
  - - [2624, 16, 1, 64]
    - [63, 206.69]
  - - [2624, 32, 1, 64]
    - [64, 413.381]
  - - [2624, 1, 1, 1]
    - [86, 0.201846]
  - - [2624, 1, 1, 16]
    - [11, 3.35872]
  - - [2624, 1, 1, 32]
    - [41, 6.45908]
  - - [2624, 16, 1, 1]
    - [85, 3.35872]
  - - [2624, 16, 1, 16]
    - [108, 53.7395]
  - - [2624, 16, 1, 32]
    - [86, 111.957]
  - - [2624, 32, 1, 1]
    - [15, 6.71744]
  - - [2624, 32, 1, 16]
    - [92, 107.479]
  - - [2624, 32, 1, 32]
    - [108, 223.915]
  - - [2624, 64, 1, 1]
    - [11, 12.9182]
  - - [2624, 64, 1, 16]
    - [15, 223.915]
  - - [2624, 64, 1, 32]
    - [15, 429.916]
  - - [2880, 1, 1, 64]
    - [16, 14.7456]
  - - [2880, 16, 1, 64]
    - [111, 245.76]
  - - [2880, 32, 1, 64]
    - [114, 491.52]
  - - [2880, 1, 1, 1]
    - [39, 0.2304]
  - - [2880, 1, 1, 16]
    - [103, 3.6864]
  - - [2880, 1, 1, 32]
    - [105, 7.3728]
  - - [2880, 16, 1, 1]
    - [10, 3.54462]
  - - [2880, 16, 1, 16]
    - [10, 58.9824]
  - - [2880, 16, 1, 32]
    - [15, 117.965]
  - - [2880, 32, 1, 1]
    - [62, 7.3728]
  - - [2880, 32, 1, 16]
    - [10, 113.428]
  - - [2880, 32, 1, 32]
    - [110, 235.93]
  - - [2880, 64, 1, 1]
    - [15, 14.7456]
  - - [2880, 64, 1, 16]
    - [10, 235.93]
  - - [2880, 64, 1, 32]
    - [11, 471.859]
  - - [3136, 1, 1, 64]
    - [10, 16.0563]
  - - [3136, 16, 1, 64]
    - [15, 256.901]
  - - [3136, 32, 1, 64]
    - [15, 513.802]
  - - [3136, 1, 1, 1]
    - [85, 0.25088]
  - - [3136, 1, 1, 16]
    - [10, 4.01408]
  - - [3136, 1, 1, 32]
    - [101, 8.02816]
  - - [3136, 16, 1, 1]
    - [10, 4.01408]
  - - [3136, 16, 1, 16]
    - [39, 64.2253]
  - - [3136, 16, 1, 32]
    - [103, 128.451]
  - - [3136, 32, 1, 1]
    - [17, 8.02816]
  - - [3136, 32, 1, 16]
    - [106, 128.451]
  - - [3136, 32, 1, 32]
    - [10, 247.02]
  - - [3136, 64, 1, 1]
    - [10, 16.0563]
  - - [3136, 64, 1, 16]
    - [15, 256.901]
  - - [3136, 64, 1, 32]
    - [24, 513.802]
  - - [3392, 1, 1, 64]
    - [11, 16.6991]
  - - [3392, 16, 1, 64]
    - [63, 267.185]
  - - [3392, 32, 1, 64]
    - [15, 578.901]
  - - [3392, 1, 1, 1]
    - [15, 0.27136]
  - - [3392, 1, 1, 16]
    - [10, 4.17477]
  - - [3392, 1, 1, 32]
    - [97, 8.68352]
  - - [3392, 16, 1, 1]
    - [10, 4.17477]
  - - [3392, 16, 1, 16]
    - [11, 69.4682]
  - - [3392, 16, 1, 32]
    - [115, 133.593]
  - - [3392, 32, 1, 1]
    - [63, 8.34954]
  - - [3392, 32, 1, 16]
    - [10, 133.593]
  - - [3392, 32, 1, 32]
    - [15, 267.185]
  - - [3392, 64, 1, 1]
    - [117, 16.6991]
  - - [3392, 64, 1, 16]
    - [17, 277.873]
  - - [3392, 64, 1, 32]
    - [15, 534.37]
  - - [3648, 1, 1, 64]
    - [111, 19.456]
  - - [3648, 16, 1, 64]
    - [11, 298.844]
  - - [3648, 32, 1, 64]
    - [15, 574.7]
  - - [3648, 1, 1, 1]
    - [40, 0.29184]
  - - [3648, 1, 1, 16]
    - [22, 4.66944]
  - - [3648, 1, 1, 32]
    - [67, 9.33888]
  - - [3648, 16, 1, 1]
    - [85, 4.66944]
  - - [3648, 16, 1, 16]
    - [10, 71.8375]
  - - [3648, 16, 1, 32]
    - [101, 149.422]
  - - [3648, 32, 1, 1]
    - [99, 9.33888]
  - - [3648, 32, 1, 16]
    - [10, 143.675]
  - - [3648, 32, 1, 32]
    - [97, 311.296]
  - - [3648, 64, 1, 1]
    - [10, 18.6778]
  - - [3648, 64, 1, 16]
    - [41, 287.35]
  - - [3648, 64, 1, 32]
    - [111, 597.688]
  - - [3904, 1, 1, 64]
    - [98, 19.9885]
  - - [3904, 16, 1, 64]
    - [15, 319.816]
  - - [3904, 32, 1, 64]
    - [72, 639.631]
  - - [3904, 1, 1, 1]
    - [10, 0.300308]
  - - [3904, 1, 1, 16]
    - [15, 4.99712]
  - - [3904, 1, 1, 32]
    - [10, 9.99424]
  - - [3904, 16, 1, 1]
    - [10, 4.99712]
  - - [3904, 16, 1, 16]
    - [15, 79.9539]
  - - [3904, 16, 1, 32]
    - [10, 153.758]
  - - [3904, 32, 1, 1]
    - [99, 9.99424]
  - - [3904, 32, 1, 16]
    - [15, 159.908]
  - - [3904, 32, 1, 32]
    - [102, 333.141]
  - - [3904, 64, 1, 1]
    - [10, 19.2197]
  - - [3904, 64, 1, 16]
    - [15, 333.141]
  - - [3904, 64, 1, 32]
    - [11, 639.631]
  - - [1, 320, 1, 64]
    - [10, 1.6384]
  - - [16, 320, 1, 64]
    - [15, 26.2144]
  - - [32, 320, 1, 64]
    - [10, 52.4288]
  - - [1, 320, 1, 1]
    - [11, 0.0256]
  - - [1, 320, 1, 16]
    - [10, 0.4096]
  - - [1, 320, 1, 32]
    - [92, 0.8192]
  - - [16, 320, 1, 1]
    - [64, 0.4096]
  - - [16, 320, 1, 16]
    - [93, 6.5536]
  - - [16, 320, 1, 32]
    - [16, 13.6533]
  - - [32, 320, 1, 1]
    - [20, 0.8192]
  - - [32, 320, 1, 16]
    - [102, 13.1072]
  - - [32, 320, 1, 32]
    - [10, 26.2144]
  - - [64, 320, 1, 1]
    - [10, 1.6384]
  - - [64, 320, 1, 16]
    - [10, 26.2144]
  - - [64, 320, 1, 32]
    - [15, 54.6133]
  - - [320, 320, 1, 1]
    - [15, 8.53333]
  - - [320, 320, 1, 16]
    - [65, 131.072]
  - - [320, 320, 1, 32]
    - [11, 252.062]
  - - [576, 320, 1, 1]
    - [11, 14.1785]
  - - [576, 320, 1, 16]
    - [15, 256.445]
  - - [576, 320, 1, 32]
    - [10, 453.711]
  - - [832, 320, 1, 1]
    - [10, 21.2992]
  - - [832, 320, 1, 16]
    - [15, 340.787]
  - - [832, 320, 1, 32]
    - [39, 681.574]
  - - [1088, 320, 1, 1]
    - [10, 27.8528]
  - - [1088, 320, 1, 16]
    - [15, 428.505]
  - - [1088, 320, 1, 32]
    - [21, 891.29]
  - - [1344, 320, 1, 1]
    - [10, 33.0831]
  - - [1344, 320, 1, 16]
    - [39, 550.502]
  - - [1344, 320, 1, 32]
    - [41, 1019.45]
  - - [1600, 320, 1, 1]
    - [10, 37.9259]
  - - [1600, 320, 1, 16]
    - [10, 630.154]
  - - [1600, 320, 1, 32]
    - [26, 1260.31]
  - - [1856, 320, 1, 1]
    - [26, 43.9941]
  - - [1856, 320, 1, 16]
    - [26, 678.766]
  - - [1856, 320, 1, 32]
    - [27, 1407.81]
  - - [2112, 320, 1, 1]
    - [41, 46.6097]
  - - [2112, 320, 1, 16]
    - [80, 745.754]
  - - [2112, 320, 1, 32]
    - [80, 1544.78]
  - - [2368, 320, 1, 1]
    - [42, 54.1257]
  - - [2368, 320, 1, 16]
    - [47, 866.011]
  - - [2368, 320, 1, 32]
    - [24, 1732.02]
  - - [2624, 320, 1, 1]
    - [80, 57.909]
  - - [2624, 320, 1, 16]
    - [27, 926.543]
  - - [2624, 320, 1, 32]
    - [42, 1853.09]
  - - [2880, 320, 1, 1]
    - [43, 61.44]
  - - [2880, 320, 1, 16]
    - [13, 1016.94]
  - - [2880, 320, 1, 32]
    - [13, 1966.08]
  - - [3136, 320, 1, 1]
    - [9, 64.7432]
  - - [3136, 320, 1, 16]
    - [49, 1107.33]
  - - [3136, 320, 1, 32]
    - [13, 2140.84]
  - - [3392, 320, 1, 1]
    - [42, 70.0284]
  - - [3392, 320, 1, 16]
    - [116, 1157.8]
  - - [3392, 320, 1, 32]
    - [59, 2315.61]
  - - [3648, 320, 1, 1]
    - [95, 77.824]
  - - [3648, 320, 1, 16]
    - [9, 1167.36]
  - - [3648, 320, 1, 32]
    - [82, 2410.03]
  - - [3904, 320, 1, 1]
    - [77, 80.5987]
  - - [3904, 320, 1, 16]
    - [13, 1289.58]
  - - [3904, 320, 1, 32]
    - [50, 2579.16]
  - - [1, 576, 1, 64]
    - [10, 2.94912]
  - - [16, 576, 1, 64]
    - [10, 43.6907]
  - - [32, 576, 1, 64]
    - [15, 94.3718]
  - - [1, 576, 1, 1]
    - [65, 0.04608]
  - - [1, 576, 1, 16]
    - [85, 0.73728]
  - - [1, 576, 1, 32]
    - [97, 1.47456]
  - - [16, 576, 1, 1]
    - [62, 0.768]
  - - [16, 576, 1, 16]
    - [98, 12.288]
  - - [16, 576, 1, 32]
    - [44, 23.593]
  - - [32, 576, 1, 1]
    - [98, 1.536]
  - - [32, 576, 1, 16]
    - [92, 23.593]
  - - [32, 576, 1, 32]
    - [97, 49.152]
  - - [64, 576, 1, 1]
    - [63, 2.94912]
  - - [64, 576, 1, 16]
    - [44, 47.1859]
  - - [64, 576, 1, 32]
    - [85, 98.304]
  - - [320, 576, 1, 1]
    - [107, 14.7456]
  - - [320, 576, 1, 16]
    - [40, 245.76]
  - - [320, 576, 1, 32]
    - [10, 471.859]
  - - [576, 576, 1, 1]
    - [103, 24.576]
  - - [576, 576, 1, 16]
    - [42, 424.673]
  - - [576, 576, 1, 32]
    - [117, 849.347]
  - - [832, 576, 1, 1]
    - [10, 36.864]
  - - [832, 576, 1, 16]
    - [10, 589.824]
  - - [832, 576, 1, 32]
    - [10, 1179.65]
  - - [1088, 576, 1, 1]
    - [80, 48.2068]
  - - [1088, 576, 1, 16]
    - [80, 742.741]
  - - [1088, 576, 1, 32]
    - [80, 1485.48]
  - - [1344, 576, 1, 1]
    - [27, 57.344]
  - - [1344, 576, 1, 16]
    - [11, 825.754]
  - - [1344, 576, 1, 32]
    - [80, 1835.01]
  - - [1600, 576, 1, 1]
    - [5, 61.44]
  - - [1600, 576, 1, 16]
    - [43, 1016.94]
  - - [1600, 576, 1, 32]
    - [13, 2106.51]
  - - [1856, 576, 1, 1]
    - [26, 71.2704]
  - - [1856, 576, 1, 16]
    - [69, 1179.65]
  - - [1856, 576, 1, 32]
    - [69, 2280.65]
  - - [2112, 576, 1, 1]
    - [51, 81.1008]
  - - [2112, 576, 1, 16]
    - [13, 1255.75]
  - - [2112, 576, 1, 32]
    - [13, 2511.51]
  - - [2368, 576, 1, 1]
    - [13, 87.9979]
  - - [2368, 576, 1, 16]
    - [28, 1363.97]
  - - [2368, 576, 1, 32]
    - [75, 2815.93]
  - - [2624, 576, 1, 1]
    - [49, 91.6015]
  - - [2624, 576, 1, 16]
    - [95, 1511.42]
  - - [2624, 576, 1, 32]
    - [28, 2931.25]
  - - [2880, 576, 1, 1]
    - [78, 100.538]
  - - [2880, 576, 1, 16]
    - [3, 1561.3]
  - - [2880, 576, 1, 32]
    - [47, 3122.6]
  - - [3136, 576, 1, 1]
    - [43, 100.352]
  - - [3136, 576, 1, 16]
    - [26, 1605.63]
  - - [3136, 576, 1, 32]
    - [27, 3400.16]
  - - [3392, 576, 1, 1]
    - [3, 108.544]
  - - [3392, 576, 1, 16]
    - [8, 1786.32]
  - - [3392, 576, 1, 32]
    - [47, 3572.65]
  - - [3648, 576, 1, 1]
    - [8, 116.736]
  - - [3648, 576, 1, 16]
    - [3, 1867.78]
  - - [3648, 576, 1, 32]
    - [3, 3634.59]
  - - [3904, 576, 1, 1]
    - [8, 121.552]
  - - [3904, 576, 1, 16]
    - [8, 1944.83]
  - - [3904, 576, 1, 32]
    - [83, 3997.7]
  - - [1, 832, 1, 64]
    - [62, 4.25984]
  - - [16, 832, 1, 64]
    - [85, 68.1574]
  - - [32, 832, 1, 64]
    - [85, 126.217]
  - - [1, 832, 1, 1]
    - [111, 0.0693333]
  - - [1, 832, 1, 16]
    - [97, 1.024]
  - - [1, 832, 1, 32]
    - [103, 2.048]
  - - [16, 832, 1, 1]
    - [113, 1.024]
  - - [16, 832, 1, 16]
    - [63, 17.0394]
  - - [16, 832, 1, 32]
    - [93, 32.768]
  - - [32, 832, 1, 1]
    - [15, 2.048]
  - - [32, 832, 1, 16]
    - [97, 32.768]
  - - [32, 832, 1, 32]
    - [10, 65.536]
  - - [64, 832, 1, 1]
    - [105, 4.25984]
  - - [64, 832, 1, 16]
    - [118, 65.536]
  - - [64, 832, 1, 32]
    - [17, 126.217]
  - - [320, 832, 1, 1]
    - [111, 22.1867]
  - - [320, 832, 1, 16]
    - [115, 315.544]
  - - [320, 832, 1, 32]
    - [87, 681.574]
  - - [576, 832, 1, 1]
    - [116, 35.4987]
  - - [576, 832, 1, 16]
    - [80, 528.808]
  - - [576, 832, 1, 32]
    - [21, 1135.96]
  - - [832, 832, 1, 1]
    - [69, 49.4446]
  - - [832, 832, 1, 16]
    - [32, 738.372]
  - - [832, 832, 1, 32]
    - [80, 1640.83]
  - - [1088, 832, 1, 1]
    - [32, 60.3477]
  - - [1088, 832, 1, 16]
    - [33, 998.859]
  - - [1088, 832, 1, 32]
    - [47, 1997.72]
  - - [1344, 832, 1, 1]
    - [35, 77.1178]
  - - [1344, 832, 1, 16]
    - [32, 1154.28]
  - - [1344, 832, 1, 32]
    - [70, 2308.56]
  - - [1600, 832, 1, 1]
    - [49, 88.7467]
  - - [1600, 832, 1, 16]
    - [9, 1331.2]
  - - [1600, 832, 1, 32]
    - [9, 2662.4]
  - - [1856, 832, 1, 1]
    - [9, 93.5874]
  - - [1856, 832, 1, 16]
    - [9, 1453.36]
  - - [1856, 832, 1, 32]
    - [49, 2994.8]
  - - [2112, 832, 1, 1]
    - [26, 103.364]
  - - [2112, 832, 1, 16]
    - [42, 1703.94]
  - - [2112, 832, 1, 32]
    - [9, 3307.64]
  - - [2368, 832, 1, 1]
    - [83, 109.454]
  - - [2368, 832, 1, 16]
    - [43, 1751.27]
  - - [2368, 832, 1, 32]
    - [3, 3407.87]
  - - [2624, 832, 1, 1]
    - [8, 121.287]
  - - [2624, 832, 1, 16]
    - [8, 1888.15]
  - - [2624, 832, 1, 32]
    - [8, 3776.29]
  - - [2880, 832, 1, 1]
    - [13, 126.114]
  - - [2880, 832, 1, 16]
    - [81, 2129.92]
  - - [2880, 832, 1, 32]
    - [49, 4510.42]
  - - [3136, 832, 1, 1]
    - [13, 153.48]
  - - [3136, 832, 1, 16]
    - [82, 2455.67]
  - - [3136, 832, 1, 32]
    - [82, 5060.17]
  - - [3392, 832, 1, 1]
    - [13, 161.265]
  - - [3392, 832, 1, 16]
    - [13, 2656.14]
  - - [3392, 832, 1, 32]
    - [49, 5312.27]
  - - [3648, 832, 1, 1]
    - [43, 183.948]
  - - [3648, 832, 1, 16]
    - [9, 2774.98]
  - - [3648, 832, 1, 32]
    - [82, 5713.2]
  - - [3904, 832, 1, 1]
    - [82, 191.066]
  - - [3904, 832, 1, 16]
    - [81, 2969.72]
  - - [3904, 832, 1, 32]
    - [14, 5774.45]
  - - [1, 1088, 1, 64]
    - [21, 5.80267]
  - - [16, 1088, 1, 64]
    - [105, 96.8793]
  - - [32, 1088, 1, 64]
    - [15, 178.258]
  - - [1, 1088, 1, 1]
    - [114, 0.0836923]
  - - [1, 1088, 1, 16]
    - [115, 1.39264]
  - - [1, 1088, 1, 32]
    - [63, 2.57896]
  - - [16, 1088, 1, 1]
    - [10, 1.28948]
  - - [16, 1088, 1, 16]
    - [10, 21.4252]
  - - [16, 1088, 1, 32]
    - [16, 42.8505]
  - - [32, 1088, 1, 1]
    - [85, 2.78528]
  - - [32, 1088, 1, 16]
    - [15, 44.5645]
  - - [32, 1088, 1, 32]
    - [15, 85.7009]
  - - [64, 1088, 1, 1]
    - [39, 5.15793]
  - - [64, 1088, 1, 16]
    - [11, 85.7009]
  - - [64, 1088, 1, 32]
    - [15, 171.402]
  - - [320, 1088, 1, 1]
    - [11, 24.8686]
  - - [320, 1088, 1, 16]
    - [21, 412.634]
  - - [320, 1088, 1, 32]
    - [87, 825.268]
  - - [576, 1088, 1, 1]
    - [80, 43.2199]
  - - [576, 1088, 1, 16]
    - [26, 691.518]
  - - [576, 1088, 1, 32]
    - [116, 1383.04]
  - - [832, 1088, 1, 1]
    - [88, 58.401]
  - - [832, 1088, 1, 16]
    - [95, 998.859]
  - - [832, 1088, 1, 32]
    - [80, 1997.72]
  - - [1088, 1088, 1, 1]
    - [75, 76.3706]
  - - [1088, 1088, 1, 16]
    - [57, 1183.74]
  - - [1088, 1088, 1, 32]
    - [55, 2443.86]
  - - [1344, 1088, 1, 1]
    - [81, 94.3401]
  - - [1344, 1088, 1, 16]
    - [49, 1462.27]
  - - [1344, 1088, 1, 32]
    - [75, 2924.54]
  - - [1600, 1088, 1, 1]
    - [70, 102.4]
  - - [1600, 1088, 1, 16]
    - [61, 1547.38]
  - - [1600, 1088, 1, 32]
    - [41, 3376.1]
  - - [1856, 1088, 1, 1]
    - [3, 112.185]
  - - [1856, 1088, 1, 16]
    - [43, 1846.24]
  - - [1856, 1088, 1, 32]
    - [3, 3589.92]
  - - [2112, 1088, 1, 1]
    - [26, 120.94]
  - - [2112, 1088, 1, 16]
    - [32, 1885.42]
  - - [2112, 1088, 1, 32]
    - [24, 3974.67]
  - - [2368, 1088, 1, 1]
    - [82, 161.024]
  - - [2368, 1088, 1, 16]
    - [81, 2576.38]
  - - [2368, 1088, 1, 32]
    - [28, 4996.62]
  - - [2624, 1088, 1, 1]
    - [13, 167.936]
  - - [2624, 1088, 1, 16]
    - [43, 2768.4]
  - - [2624, 1088, 1, 32]
    - [61, 5536.8]
  - - [2880, 1088, 1, 1]
    - [9, 179.054]
  - - [2880, 1088, 1, 16]
    - [81, 2949.12]
  - - [2880, 1088, 1, 32]
    - [9, 5729.72]
  - - [3136, 1088, 1, 1]
    - [82, 194.97]
  - - [3136, 1088, 1, 16]
    - [82, 3119.51]
  - - [3136, 1088, 1, 32]
    - [82, 6422.53]
  - - [3392, 1088, 1, 1]
    - [82, 210.885]
  - - [3392, 1088, 1, 16]
    - [81, 3374.17]
  - - [3392, 1088, 1, 32]
    - [5, 6383.56]
  - - [3648, 1088, 1, 1]
    - [82, 214.542]
  - - [3648, 1088, 1, 16]
    - [61, 3342.34]
  - - [3904, 1088, 1, 1]
    - [8, 223.555]
  - - [3904, 1088, 1, 16]
    - [5, 3576.89]
  - - [1, 1344, 1, 64]
    - [106, 7.168]
  - - [16, 1344, 1, 64]
    - [15, 114.688]
  - - [32, 1344, 1, 64]
    - [102, 220.201]
  - - [1, 1344, 1, 1]
    - [111, 0.10752]
  - - [1, 1344, 1, 16]
    - [112, 1.65415]
  - - [1, 1344, 1, 32]
    - [10, 3.30831]
  - - [16, 1344, 1, 1]
    - [85, 1.65415]
  - - [16, 1344, 1, 16]
    - [109, 27.5251]
  - - [16, 1344, 1, 32]
    - [79, 52.9329]
  - - [32, 1344, 1, 1]
    - [15, 3.30831]
  - - [32, 1344, 1, 16]
    - [46, 50.9724]
  - - [32, 1344, 1, 32]
    - [17, 110.1]
  - - [64, 1344, 1, 1]
    - [63, 6.88128]
  - - [64, 1344, 1, 16]
    - [10, 105.866]
  - - [64, 1344, 1, 32]
    - [15, 220.201]
  - - [320, 1344, 1, 1]
    - [10, 29.6607]
  - - [320, 1344, 1, 16]
    - [10, 509.724]
  - - [320, 1344, 1, 32]
    - [10, 983.04]
  - - [576, 1344, 1, 1]
    - [27, 49.9448]
  - - [576, 1344, 1, 16]
    - [41, 825.754]
  - - [576, 1344, 1, 32]
    - [116, 1708.46]
  - - [832, 1344, 1, 1]
    - [43, 72.1425]
  - - [832, 1344, 1, 16]
    - [74, 1154.28]
  - - [832, 1344, 1, 32]
    - [70, 2385.51]
  - - [1088, 1344, 1, 1]
    - [50, 94.3401]
  - - [1088, 1344, 1, 16]
    - [31, 1417.96]
  - - [1088, 1344, 1, 32]
    - [35, 2835.92]
  - - [1344, 1344, 1, 1]
    - [54, 103.219]
  - - [1344, 1344, 1, 16]
    - [8, 1700.08]
  - - [1344, 1344, 1, 32]
    - [49, 3503.2]
  - - [1600, 1344, 1, 1]
    - [26, 119.467]
  - - [1600, 1344, 1, 16]
    - [3, 1911.47]
  - - [1600, 1344, 1, 32]
    - [24, 3719.61]
  - - [1856, 1344, 1, 1]
    - [26, 134.836]
  - - [1856, 1344, 1, 16]
    - [61, 2157.37]
  - - [1856, 1344, 1, 32]
    - [13, 4314.75]
  - - [2112, 1344, 1, 1]
    - [13, 162.202]
  - - [2112, 1344, 1, 16]
    - [82, 2752.51]
  - - [2112, 1344, 1, 32]
    - [31, 5343.11]
  - - [2368, 1344, 1, 1]
    - [81, 187.211]
  - - [2368, 1344, 1, 16]
    - [9, 2995.38]
  - - [2368, 1344, 1, 32]
    - [9, 5819.6]
  - - [2624, 1344, 1, 1]
    - [9, 201.523]
  - - [2624, 1344, 1, 16]
    - [61, 3134.81]
  - - [2624, 1344, 1, 32]
    - [49, 6269.61]
  - - [2880, 1344, 1, 1]
    - [81, 209.228]
  - - [2880, 1344, 1, 16]
    - [3, 3347.65]
  - - [2880, 1344, 1, 32]
    - [83, 6695.3]
  - - [3136, 1344, 1, 1]
    - [8, 227.826]
  - - [3136, 1344, 1, 16]
    - [82, 3746.47]
  - - [3392, 1344, 1, 1]
    - [8, 239.939]
  - - [3392, 1344, 1, 16]
    - [8, 3740.59]
  - - [3648, 1344, 1, 1]
    - [33, 245.146]
  - - [3648, 1344, 1, 16]
    - [82, 3922.33]
  - - [3904, 1344, 1, 1]
    - [61, 255.95]
  - - [3904, 1344, 1, 16]
    - [61, 4095.2]
  - - [1, 1600, 1, 64]
    - [103, 8.53333]
  - - [16, 1600, 1, 64]
    - [10, 131.072]
  - - [32, 1600, 1, 64]
    - [15, 262.144]
  - - [1, 1600, 1, 1]
    - [65, 0.128]
  - - [1, 1600, 1, 16]
    - [107, 2.13333]
  - - [1, 1600, 1, 32]
    - [103, 4.096]
  - - [16, 1600, 1, 1]
    - [99, 1.96923]
  - - [16, 1600, 1, 16]
    - [16, 29.2571]
  - - [16, 1600, 1, 32]
    - [17, 60.6815]
  - - [32, 1600, 1, 1]
    - [10, 3.79259]
  - - [32, 1600, 1, 16]
    - [102, 60.6815]
  - - [32, 1600, 1, 32]
    - [104, 131.072]
  - - [64, 1600, 1, 1]
    - [63, 7.87692]
  - - [64, 1600, 1, 16]
    - [112, 126.031]
  - - [64, 1600, 1, 32]
    - [112, 262.144]
  - - [320, 1600, 1, 1]
    - [116, 36.5714]
  - - [320, 1600, 1, 16]
    - [116, 606.815]
  - - [320, 1600, 1, 32]
    - [104, 1170.29]
  - - [576, 1600, 1, 1]
    - [88, 61.44]
  - - [576, 1600, 1, 16]
    - [88, 951.329]
  - - [576, 1600, 1, 32]
    - [80, 2106.51]
  - - [832, 1600, 1, 1]
    - [75, 83.2]
  - - [832, 1600, 1, 16]
    - [76, 1290.86]
  - - [832, 1600, 1, 32]
    - [59, 2748.28]
  - - [1088, 1600, 1, 1]
    - [42, 105.503]
  - - [1088, 1600, 1, 16]
    - [9, 1591.59]
  - - [1088, 1600, 1, 32]
    - [3, 3183.18]
  - - [1344, 1600, 1, 1]
    - [3, 116.238]
  - - [1344, 1600, 1, 16]
    - [3, 1859.81]
  - - [1344, 1600, 1, 32]
    - [41, 3719.61]
  - - [1600, 1600, 1, 1]
    - [13, 150.588]
  - - [1600, 1600, 1, 16]
    - [35, 2409.41]
  - - [1600, 1600, 1, 32]
    - [13, 4964.85]
  - - [1856, 1600, 1, 1]
    - [31, 174.682]
  - - [1856, 1600, 1, 16]
    - [13, 2794.92]
  - - [1856, 1600, 1, 32]
    - [61, 5589.84]
  - - [2112, 1600, 1, 1]
    - [82, 193.097]
  - - [2112, 1600, 1, 16]
    - [9, 3003.73]
  - - [2112, 1600, 1, 32]
    - [82, 6179.11]
  - - [2368, 1600, 1, 1]
    - [3, 204.8]
  - - [2368, 1600, 1, 16]
    - [61, 3276.8]
  - - [2368, 1600, 1, 32]
    - [49, 6735.64]
  - - [2624, 1600, 1, 1]
    - [8, 226.941]
  - - [2624, 1600, 1, 16]
    - [3, 3631.05]
  - - [2880, 1600, 1, 1]
    - [33, 236.308]
  - - [2880, 1600, 1, 16]
    - [81, 3780.92]
  - - [3136, 1600, 1, 1]
    - [81, 244.761]
  - - [3136, 1600, 1, 16]
    - [61, 4014.08]
  - - [3392, 1600, 1, 1]
    - [61, 258.438]
  - - [3392, 1600, 1, 16]
    - [82, 4135.01]
  - - [3648, 1600, 1, 1]
    - [61, 271.479]
  - - [3648, 1600, 1, 16]
    - [5, 4343.67]
  - - [3904, 1600, 1, 1]
    - [61, 283.927]
  - - [3904, 1600, 1, 16]
    - [38, 4441.88]
  - - [1, 1856, 1, 64]
    - [16, 9.50272]
  - - [16, 1856, 1, 64]
    - [17, 158.379]
  - - [32, 1856, 1, 64]
    - [17, 304.087]
  - - [1, 1856, 1, 1]
    - [87, 0.14848]
  - - [1, 1856, 1, 16]
    - [62, 2.47467]
  - - [1, 1856, 1, 32]
    - [15, 4.75136]
  - - [16, 1856, 1, 1]
    - [92, 2.47467]
  - - [16, 1856, 1, 16]
    - [99, 38.0109]
  - - [16, 1856, 1, 32]
    - [104, 76.0218]
  - - [32, 1856, 1, 1]
    - [117, 4.56862]
  - - [32, 1856, 1, 16]
    - [112, 73.0978]
  - - [32, 1856, 1, 32]
    - [108, 152.044]
  - - [64, 1856, 1, 1]
    - [111, 9.50272]
  - - [64, 1856, 1, 16]
    - [98, 152.044]
  - - [64, 1856, 1, 32]
    - [15, 292.391]
  - - [320, 1856, 1, 1]
    - [43, 43.9941]
  - - [320, 1856, 1, 16]
    - [116, 730.978]
  - - [320, 1856, 1, 32]
    - [116, 1357.53]
  - - [576, 1856, 1, 1]
    - [26, 73.728]
  - - [576, 1856, 1, 16]
    - [69, 1103.54]
  - - [576, 1856, 1, 32]
    - [69, 2207.08]
  - - [832, 1856, 1, 1]
    - [49, 90.8348]
  - - [832, 1856, 1, 16]
    - [41, 1453.36]
  - - [832, 1856, 1, 32]
    - [47, 2994.8]
  - - [1088, 1856, 1, 1]
    - [43, 112.185]
  - - [1088, 1856, 1, 16]
    - [5, 1794.96]
  - - [1088, 1856, 1, 32]
    - [61, 3692.49]
  - - [1344, 1856, 1, 1]
    - [13, 134.836]
  - - [1344, 1856, 1, 16]
    - [13, 2347.73]
  - - [1344, 1856, 1, 32]
    - [61, 4837.75]
  - - [1600, 1856, 1, 1]
    - [13, 174.682]
  - - [1600, 1856, 1, 16]
    - [13, 2794.92]
  - - [1600, 1856, 1, 32]
    - [82, 5759.22]
  - - [1856, 1856, 1, 1]
    - [3, 196.842]
  - - [1856, 1856, 1, 16]
    - [8, 3061.99]
  - - [1856, 1856, 1, 32]
    - [81, 6123.98]
  - - [2112, 1856, 1, 1]
    - [3, 211.885]
  - - [2112, 1856, 1, 16]
    - [82, 3390.16]
  - - [2368, 1856, 1, 1]
    - [3, 231.316]
  - - [2368, 1856, 1, 16]
    - [3, 3701.06]
  - - [2624, 1856, 1, 1]
    - [81, 243.507]
  - - [2624, 1856, 1, 16]
    - [82, 3896.12]
  - - [2880, 1856, 1, 1]
    - [5, 254.537]
  - - [2880, 1856, 1, 16]
    - [5, 4072.59]
  - - [3136, 1856, 1, 1]
    - [3, 264.564]
  - - [3136, 1856, 1, 16]
    - [14, 4331.47]
  - - [3392, 1856, 1, 1]
    - [3, 279.802]
  - - [3392, 1856, 1, 16]
    - [81, 4578.58]
  - - [3648, 1856, 1, 1]
    - [49, 294.378]
  - - [3648, 1856, 1, 16]
    - [82, 4924.14]
  - - [3904, 1856, 1, 1]
    - [38, 308.333]
  - - [3904, 1856, 1, 16]
    - [14, 4933.33]
  - - [1, 2112, 1, 64]
    - [65, 10.3975]
  - - [16, 2112, 1, 64]
    - [16, 173.015]
  - - [32, 2112, 1, 64]
    - [11, 332.721]
  - - [1, 2112, 1, 1]
    - [63, 0.16896]
  - - [1, 2112, 1, 16]
    - [106, 2.70336]
  - - [1, 2112, 1, 32]
    - [63, 5.40672]
  - - [16, 2112, 1, 1]
    - [92, 2.70336]
  - - [16, 2112, 1, 16]
    - [118, 43.2538]
  - - [16, 2112, 1, 32]
    - [106, 83.1803]
  - - [32, 2112, 1, 1]
    - [85, 5.40672]
  - - [32, 2112, 1, 16]
    - [85, 83.1803]
  - - [32, 2112, 1, 32]
    - [62, 160.199]
  - - [64, 2112, 1, 1]
    - [21, 10.0124]
  - - [64, 2112, 1, 16]
    - [15, 166.361]
  - - [64, 2112, 1, 32]
    - [102, 332.721]
  - - [320, 2112, 1, 1]
    - [27, 43.6026]
  - - [320, 2112, 1, 16]
    - [24, 675.84]
  - - [320, 2112, 1, 32]
    - [89, 1441.79]
  - - [576, 2112, 1, 1]
    - [76, 78.4846]
  - - [576, 2112, 1, 16]
    - [74, 1216.51]
  - - [576, 2112, 1, 32]
    - [61, 2433.02]
  - - [832, 2112, 1, 1]
    - [81, 106.496]
  - - [832, 2112, 1, 16]
    - [49, 1653.82]
  - - [832, 2112, 1, 32]
    - [47, 3213.14]
  - - [1088, 2112, 1, 1]
    - [69, 120.94]
  - - [1088, 2112, 1, 16]
    - [70, 1935.04]
  - - [1088, 2112, 1, 32]
    - [61, 4456.45]
  - - [1344, 2112, 1, 1]
    - [9, 166.972]
  - - [1344, 2112, 1, 16]
    - [13, 2595.23]
  - - [1344, 2112, 1, 32]
    - [13, 5190.45]
  - - [1600, 2112, 1, 1]
    - [82, 193.097]
  - - [1600, 2112, 1, 16]
    - [9, 3089.55]
  - - [1600, 2112, 1, 32]
    - [61, 6007.47]
  - - [1856, 2112, 1, 1]
    - [8, 206.309]
  - - [1856, 2112, 1, 16]
    - [3, 3300.94]
  - - [2112, 2112, 1, 1]
    - [3, 234.765]
  - - [2112, 2112, 1, 16]
    - [81, 3756.25]
  - - [2368, 2112, 1, 1]
    - [81, 243.962]
  - - [2368, 2112, 1, 16]
    - [82, 3903.39]
  - - [2624, 2112, 1, 1]
    - [5, 263.899]
  - - [2624, 2112, 1, 16]
    - [61, 4222.39]
  - - [2880, 2112, 1, 1]
    - [61, 282.91]
  - - [2880, 2112, 1, 16]
    - [3, 4423.68]
  - - [3136, 2112, 1, 1]
    - [3, 294.366]
  - - [3136, 2112, 1, 16]
    - [82, 4709.85]
  - - [3392, 2112, 1, 1]
    - [61, 318.396]
  - - [3392, 2112, 1, 16]
    - [81, 4877.55]
  - - [3648, 2112, 1, 1]
    - [61, 321.024]
  - - [3648, 2112, 1, 16]
    - [38, 5031.56]
  - - [3904, 2112, 1, 1]
    - [14, 329.81]
  - - [1, 2368, 1, 64]
    - [63, 12.6293]
  - - [16, 2368, 1, 64]
    - [115, 202.069]
  - - [32, 2368, 1, 64]
    - [63, 387.973]
  - - [1, 2368, 1, 1]
    - [20, 0.18944]
  - - [1, 2368, 1, 16]
    - [15, 3.03104]
  - - [1, 2368, 1, 32]
    - [97, 6.06208]
  - - [16, 2368, 1, 1]
    - [10, 3.03104]
  - - [16, 2368, 1, 16]
    - [17, 48.4966]
  - - [16, 2368, 1, 32]
    - [15, 101.035]
  - - [32, 2368, 1, 1]
    - [97, 5.82892]
  - - [32, 2368, 1, 16]
    - [103, 93.2628]
  - - [32, 2368, 1, 32]
    - [10, 173.202]
  - - [64, 2368, 1, 1]
    - [111, 12.1242]
  - - [64, 2368, 1, 16]
    - [97, 186.526]
  - - [64, 2368, 1, 32]
    - [104, 387.973]
  - - [320, 2368, 1, 1]
    - [54, 50.5173]
  - - [320, 2368, 1, 16]
    - [73, 866.011]
  - - [320, 2368, 1, 32]
    - [47, 1732.02]
  - - [576, 2368, 1, 1]
    - [13, 85.248]
  - - [576, 2368, 1, 16]
    - [13, 1363.97]
  - - [576, 2368, 1, 32]
    - [9, 2727.94]
  - - [832, 2368, 1, 1]
    - [3, 119.405]
  - - [832, 2368, 1, 16]
    - [81, 1801.3]
  - - [832, 2368, 1, 32]
    - [81, 3602.61]
  - - [1088, 2368, 1, 1]
    - [13, 151.552]
  - - [1088, 2368, 1, 16]
    - [13, 2424.83]
  - - [1088, 2368, 1, 32]
    - [82, 4996.62]
  - - [1344, 2368, 1, 1]
    - [9, 176.811]
  - - [1344, 2368, 1, 16]
    - [49, 2995.38]
  - - [1344, 2368, 1, 32]
    - [9, 5819.6]
  - - [1600, 2368, 1, 1]
    - [81, 210.489]
  - - [1600, 2368, 1, 16]
    - [8, 3276.8]
  - - [1600, 2368, 1, 32]
    - [81, 6735.64]
  - - [1856, 2368, 1, 1]
    - [8, 231.316]
  - - [1856, 2368, 1, 16]
    - [82, 3701.06]
  - - [2112, 2368, 1, 1]
    - [3, 243.962]
  - - [2112, 2368, 1, 16]
    - [3, 4000.97]
  - - [2368, 2368, 1, 1]
    - [61, 273.533]
  - - [2368, 2368, 1, 16]
    - [61, 4272.32]
  - - [2624, 2368, 1, 1]
    - [61, 282.438]
  - - [2624, 2368, 1, 16]
    - [3, 4418.58]
  - - [2880, 2368, 1, 1]
    - [61, 309.993]
  - - [2880, 2368, 1, 16]
    - [3, 4744.24]
  - - [3136, 2368, 1, 1]
    - [81, 316.002]
  - - [3136, 2368, 1, 16]
    - [3, 4849.66]
  - - [3392, 2368, 1, 1]
    - [61, 327.847]
  - - [3648, 2368, 1, 1]
    - [61, 332.249]
  - - [3904, 2368, 1, 1]
    - [14, 355.564]
  - - [1, 2624, 1, 64]
    - [103, 13.4349]
  - - [16, 2624, 1, 64]
    - [112, 223.915]
  - - [32, 2624, 1, 64]
    - [15, 447.829]
  - - [1, 2624, 1, 1]
    - [15, 0.20992]
  - - [1, 2624, 1, 16]
    - [15, 3.35872]
  - - [1, 2624, 1, 32]
    - [41, 6.71744]
  - - [16, 2624, 1, 1]
    - [92, 3.35872]
  - - [16, 2624, 1, 16]
    - [104, 53.7395]
  - - [16, 2624, 1, 32]
    - [103, 111.957]
  - - [32, 2624, 1, 1]
    - [106, 6.45908]
  - - [32, 2624, 1, 16]
    - [99, 107.479]
  - - [32, 2624, 1, 32]
    - [115, 214.958]
  - - [64, 2624, 1, 1]
    - [104, 13.4349]
  - - [64, 2624, 1, 16]
    - [103, 206.69]
  - - [64, 2624, 1, 32]
    - [10, 413.381]
  - - [320, 2624, 1, 1]
    - [54, 54.1729]
  - - [320, 2624, 1, 16]
    - [80, 926.543]
  - - [320, 2624, 1, 32]
    - [41, 1919.27]
  - - [576, 2624, 1, 1]
    - [61, 91.6015]
  - - [576, 2624, 1, 16]
    - [56, 1465.62]
  - - [576, 2624, 1, 32]
    - [50, 2931.25]
  - - [832, 2624, 1, 1]
    - [5, 124.752]
  - - [832, 2624, 1, 16]
    - [3, 1888.15]
  - - [832, 2624, 1, 32]
    - [81, 3992.08]
  - - [1088, 2624, 1, 1]
    - [13, 163.138]
  - - [1088, 2624, 1, 16]
    - [81, 2610.21]
  - - [1088, 2624, 1, 32]
    - [13, 5220.41]
  - - [1344, 2624, 1, 1]
    - [14, 195.925]
  - - [1344, 2624, 1, 16]
    - [14, 3224.37]
  - - [1344, 2624, 1, 32]
    - [61, 6448.74]
  - - [1600, 2624, 1, 1]
    - [81, 220.968]
  - - [1600, 2624, 1, 16]
    - [81, 3631.05]
  - - [1856, 2624, 1, 1]
    - [8, 237.568]
  - - [1856, 2624, 1, 16]
    - [26, 3801.09]
  - - [2112, 2624, 1, 1]
    - [61, 263.899]
  - - [2112, 2624, 1, 16]
    - [61, 4124.2]
  - - [2368, 2624, 1, 1]
    - [5, 282.438]
  - - [2368, 2624, 1, 16]
    - [61, 4519.01]
  - - [2624, 2624, 1, 1]
    - [81, 306.017]
  - - [2624, 2624, 1, 16]
    - [14, 4687.92]
  - - [2880, 2624, 1, 1]
    - [61, 314.88]
  - - [2880, 2624, 1, 16]
    - [82, 5145.27]
  - - [3136, 2624, 1, 1]
    - [61, 329.155]
  - - [3392, 2624, 1, 1]
    - [82, 342.331]
  - - [3648, 2624, 1, 1]
    - [61, 354.532]
  - - [3904, 2624, 1, 1]
    - [14, 365.861]
  - - [1, 2880, 1, 64]
    - [64, 15.36]
  - - [16, 2880, 1, 64]
    - [115, 235.93]
  - - [32, 2880, 1, 64]
    - [39, 471.859]
  - - [1, 2880, 1, 1]
    - [16, 0.2304]
  - - [1, 2880, 1, 16]
    - [15, 3.84]
  - - [1, 2880, 1, 32]
    - [10, 7.3728]
  - - [16, 2880, 1, 1]
    - [92, 3.54462]
  - - [16, 2880, 1, 16]
    - [85, 58.9824]
  - - [16, 2880, 1, 32]
    - [79, 113.428]
  - - [32, 2880, 1, 1]
    - [67, 7.08923]
  - - [32, 2880, 1, 16]
    - [102, 113.428]
  - - [32, 2880, 1, 32]
    - [99, 226.855]
  - - [64, 2880, 1, 1]
    - [107, 14.7456]
  - - [64, 2880, 1, 16]
    - [103, 226.855]
  - - [64, 2880, 1, 32]
    - [15, 453.711]
  - - [320, 2880, 1, 1]
    - [80, 59.4581]
  - - [320, 2880, 1, 16]
    - [47, 983.04]
  - - [320, 2880, 1, 32]
    - [80, 2106.51]
  - - [576, 2880, 1, 1]
    - [80, 97.5812]
  - - [576, 2880, 1, 16]
    - [61, 1608.61]
  - - [576, 2880, 1, 32]
    - [9, 3317.76]
  - - [832, 2880, 1, 1]
    - [41, 122.88]
  - - [832, 2880, 1, 16]
    - [13, 1966.08]
  - - [832, 2880, 1, 32]
    - [13, 4647.1]
  - - [1088, 2880, 1, 1]
    - [61, 179.054]
  - - [1088, 2880, 1, 16]
    - [26, 2785.28]
  - - [1088, 2880, 1, 32]
    - [14, 5570.56]
  - - [1344, 2880, 1, 1]
    - [3, 209.228]
  - - [1344, 2880, 1, 16]
    - [61, 3259.55]
  - - [1344, 2880, 1, 32]
    - [3, 6695.3]
  - - [1600, 2880, 1, 1]
    - [13, 236.308]
  - - [1600, 2880, 1, 16]
    - [13, 3686.4]
  - - [1856, 2880, 1, 1]
    - [61, 260.745]
  - - [1856, 2880, 1, 16]
    - [61, 4171.93]
  - - [2112, 2880, 1, 1]
    - [61, 282.91]
  - - [2112, 2880, 1, 16]
    - [5, 4526.56]
  - - [2368, 2880, 1, 1]
    - [61, 296.515]
  - - [2368, 2880, 1, 16]
    - [14, 4849.66]
  - - [2624, 2880, 1, 1]
    - [61, 314.88]
  - - [2624, 2880, 1, 16]
    - [8, 4935.26]
  - - [2880, 2880, 1, 1]
    - [81, 338.547]
  - - [3136, 2880, 1, 1]
    - [81, 340.818]
  - - [3392, 2880, 1, 1]
    - [14, 355.235]
  - - [3648, 2880, 1, 1]
    - [14, 375.223]
  - - [3904, 2880, 1, 1]
    - [82, 381.136]
  - - [1, 3136, 1, 64]
    - [106, 16.7253]
  - - [16, 3136, 1, 64]
    - [107, 267.605]
  - - [32, 3136, 1, 64]
    - [15, 513.802]
  - - [1, 3136, 1, 1]
    - [16, 0.25088]
  - - [1, 3136, 1, 16]
    - [111, 4.01408]
  - - [1, 3136, 1, 32]
    - [63, 8.02816]
  - - [16, 3136, 1, 1]
    - [92, 4.18133]
  - - [16, 3136, 1, 16]
    - [10, 64.2253]
  - - [16, 3136, 1, 32]
    - [92, 128.451]
  - - [32, 3136, 1, 1]
    - [85, 8.02816]
  - - [32, 3136, 1, 16]
    - [10, 128.451]
  - - [32, 3136, 1, 32]
    - [97, 256.901]
  - - [64, 3136, 1, 1]
    - [44, 15.4388]
  - - [64, 3136, 1, 16]
    - [10, 247.02]
  - - [64, 3136, 1, 32]
    - [102, 513.802]
  - - [320, 3136, 1, 1]
    - [70, 69.2083]
  - - [320, 3136, 1, 16]
    - [81, 1070.42]
  - - [320, 3136, 1, 32]
    - [81, 2293.76]
  - - [576, 3136, 1, 1]
    - [8, 103.219]
  - - [576, 3136, 1, 16]
    - [81, 1751.6]
  - - [576, 3136, 1, 32]
    - [41, 3303.01]
  - - [832, 3136, 1, 1]
    - [13, 153.48]
  - - [832, 3136, 1, 16]
    - [13, 2530.09]
  - - [832, 3136, 1, 32]
    - [81, 5060.17]
  - - [1088, 3136, 1, 1]
    - [9, 194.97]
  - - [1088, 3136, 1, 16]
    - [61, 3119.51]
  - - [1088, 3136, 1, 32]
    - [61, 6422.53]
  - - [1344, 3136, 1, 1]
    - [3, 221.831]
  - - [1344, 3136, 1, 16]
    - [5, 3549.29]
  - - [1600, 3136, 1, 1]
    - [9, 244.761]
  - - [1600, 3136, 1, 16]
    - [81, 3916.18]
  - - [1856, 3136, 1, 1]
    - [82, 277.163]
  - - [1856, 3136, 1, 16]
    - [3, 4233.03]
  - - [2112, 3136, 1, 1]
    - [3, 301.056]
  - - [2112, 3136, 1, 16]
    - [3, 4607.47]
  - - [2368, 3136, 1, 1]
    - [61, 316.002]
  - - [2368, 3136, 1, 16]
    - [81, 4950.7]
  - - [2624, 3136, 1, 1]
    - [81, 329.155]
  - - [2880, 3136, 1, 1]
    - [14, 347.372]
  - - [3136, 3136, 1, 1]
    - [61, 357.618]
  - - [3392, 3136, 1, 1]
    - [14, 373.239]
  - - [3648, 3136, 1, 1]
    - [3, 381.338]
  - - [3904, 3136, 1, 1]
    - [14, 394.934]
  - - [1, 3392, 1, 64]
    - [85, 18.0907]
  - - [16, 3392, 1, 64]
    - [106, 289.451]
  - - [32, 3392, 1, 64]
    - [10, 555.745]
  - - [1, 3392, 1, 1]
    - [72, 0.27136]
  - - [1, 3392, 1, 16]
    - [15, 4.34176]
  - - [1, 3392, 1, 32]
    - [111, 8.68352]
  - - [16, 3392, 1, 1]
    - [10, 4.34176]
  - - [16, 3392, 1, 16]
    - [11, 66.7963]
  - - [16, 3392, 1, 32]
    - [10, 138.936]
  - - [32, 3392, 1, 1]
    - [15, 8.34954]
  - - [32, 3392, 1, 16]
    - [102, 138.936]
  - - [32, 3392, 1, 32]
    - [111, 289.451]
  - - [64, 3392, 1, 1]
    - [10, 17.367]
  - - [64, 3392, 1, 16]
    - [11, 267.185]
  - - [64, 3392, 1, 32]
    - [24, 534.37]
  - - [320, 3392, 1, 1]
    - [43, 74.8579]
  - - [320, 3392, 1, 16]
    - [13, 1120.45]
  - - [320, 3392, 1, 32]
    - [26, 2170.88]
  - - [576, 3392, 1, 1]
    - [8, 108.544]
  - - [576, 3392, 1, 16]
    - [78, 1736.7]
  - - [576, 3392, 1, 32]
    - [83, 3473.41]
  - - [832, 3392, 1, 1]
    - [50, 171.039]
  - - [832, 3392, 1, 16]
    - [81, 2736.62]
  - - [832, 3392, 1, 32]
    - [13, 5312.27]
  - - [1088, 3392, 1, 1]
    - [61, 194.237]
  - - [1088, 3392, 1, 16]
    - [9, 3280.44]
  - - [1088, 3392, 1, 32]
    - [81, 6560.88]
  - - [1344, 3392, 1, 1]
    - [3, 239.939]
  - - [1344, 3392, 1, 16]
    - [5, 3942.79]
  - - [1600, 3392, 1, 1]
    - [61, 264.741]
  - - [1600, 3392, 1, 16]
    - [81, 4038.85]
  - - [1856, 3392, 1, 1]
    - [5, 286.161]
  - - [1856, 3392, 1, 16]
    - [3, 4476.84]
  - - [2112, 3392, 1, 1]
    - [81, 311.474]
  - - [2112, 3392, 1, 16]
    - [61, 4877.55]
  - - [2368, 3392, 1, 1]
    - [81, 327.847]
  - - [2624, 3392, 1, 1]
    - [61, 342.331]
  - - [2880, 3392, 1, 1]
    - [61, 355.235]
  - - [3136, 3392, 1, 1]
    - [14, 373.239]
  - - [3392, 3392, 1, 1]
    - [61, 390.023]
  - - [3648, 3392, 1, 1]
    - [14, 399.162]
  - - [3904, 3392, 1, 1]
    - [61, 413.824]
  - - [1, 3648, 1, 64]
    - [111, 19.456]
  - - [16, 3648, 1, 64]
    - [63, 298.844]
  - - [32, 3648, 1, 64]
    - [71, 574.7]
  - - [1, 3648, 1, 1]
    - [79, 0.280615]
  - - [1, 3648, 1, 16]
    - [15, 4.66944]
  - - [1, 3648, 1, 32]
    - [115, 9.33888]
  - - [16, 3648, 1, 1]
    - [15, 4.66944]
  - - [16, 3648, 1, 16]
    - [98, 74.711]
  - - [16, 3648, 1, 32]
    - [117, 149.422]
  - - [32, 3648, 1, 1]
    - [15, 9.33888]
  - - [32, 3648, 1, 16]
    - [18, 149.422]
  - - [32, 3648, 1, 32]
    - [99, 311.296]
  - - [64, 3648, 1, 1]
    - [11, 17.9594]
  - - [64, 3648, 1, 16]
    - [10, 311.296]
  - - [64, 3648, 1, 32]
    - [10, 574.7]
  - - [320, 3648, 1, 1]
    - [69, 75.3135]
  - - [320, 3648, 1, 16]
    - [69, 1245.18]
  - - [320, 3648, 1, 32]
    - [31, 2490.37]
  - - [576, 3648, 1, 1]
    - [81, 116.736]
  - - [576, 3648, 1, 16]
    - [81, 1867.78]
  - - [576, 3648, 1, 32]
    - [69, 3842.28]
  - - [832, 3648, 1, 1]
    - [9, 178.537]
  - - [832, 3648, 1, 16]
    - [13, 2856.6]
  - - [832, 3648, 1, 32]
    - [13, 5713.2]
  - - [1088, 3648, 1, 1]
    - [61, 208.896]
  - - [1088, 3648, 1, 16]
    - [61, 3432.67]
  - - [1344, 3648, 1, 1]
    - [61, 239.166]
  - - [1344, 3648, 1, 16]
    - [3, 3826.66]
  - - [1600, 3648, 1, 1]
    - [61, 277.943]
  - - [1600, 3648, 1, 16]
    - [81, 4343.67]
  - - [1856, 3648, 1, 1]
    - [61, 294.378]
  - - [1856, 3648, 1, 16]
    - [81, 4814.71]
  - - [2112, 3648, 1, 1]
    - [3, 314.472]
  - - [2112, 3648, 1, 16]
    - [61, 5136.38]
  - - [2368, 3648, 1, 1]
    - [81, 345.539]
  - - [2624, 3648, 1, 1]
    - [61, 375.386]
  - - [2880, 3648, 1, 1]
    - [53, 362.284]
  - - [3136, 3648, 1, 1]
    - [8, 381.338]
  - - [3392, 3648, 1, 1]
    - [61, 399.162]
  - - [3648, 3648, 1, 1]
    - [14, 415.872]
  - - [3904, 3648, 1, 1]
    - [14, 431.569]
  - - [1, 3904, 1, 64]
    - [92, 20.8213]
  - - [16, 3904, 1, 64]
    - [15, 319.816]
  - - [32, 3904, 1, 64]
    - [103, 639.631]
  - - [1, 3904, 1, 1]
    - [15, 0.31232]
  - - [1, 3904, 1, 16]
    - [92, 4.99712]
  - - [1, 3904, 1, 32]
    - [92, 9.99424]
  - - [16, 3904, 1, 1]
    - [15, 4.99712]
  - - [16, 3904, 1, 16]
    - [17, 76.8788]
  - - [16, 3904, 1, 32]
    - [15, 159.908]
  - - [32, 3904, 1, 1]
    - [15, 10.4107]
  - - [32, 3904, 1, 16]
    - [16, 159.908]
  - - [32, 3904, 1, 32]
    - [10, 319.816]
  - - [64, 3904, 1, 1]
    - [111, 19.9885]
  - - [64, 3904, 1, 16]
    - [42, 319.816]
  - - [64, 3904, 1, 32]
    - [66, 615.03]
  - - [320, 3904, 1, 1]
    - [13, 78.08]
  - - [320, 3904, 1, 16]
    - [57, 1332.57]
  - - [320, 3904, 1, 32]
    - [13, 2498.56]
  - - [576, 3904, 1, 1]
    - [3, 121.552]
  - - [576, 3904, 1, 16]
    - [3, 2180.56]
  - - [576, 3904, 1, 32]
    - [61, 4111.92]
  - - [832, 3904, 1, 1]
    - [61, 185.607]
  - - [832, 3904, 1, 16]
    - [61, 2969.72]
  - - [832, 3904, 1, 32]
    - [82, 5939.43]
  - - [1088, 3904, 1, 1]
    - [61, 223.555]
  - - [1088, 3904, 1, 16]
    - [61, 3576.89]
  - - [1344, 3904, 1, 1]
    - [61, 249.856]
  - - [1344, 3904, 1, 16]
    - [61, 4095.2]
  - - [1600, 3904, 1, 1]
    - [14, 283.927]
  - - [1600, 3904, 1, 16]
    - [81, 4441.88]
  - - [1856, 3904, 1, 1]
    - [13, 308.333]
  - - [1856, 3904, 1, 16]
    - [61, 4933.33]
  - - [2112, 3904, 1, 1]
    - [3, 323.343]
  - - [2368, 3904, 1, 1]
    - [14, 348.856]
  - - [2624, 3904, 1, 1]
    - [14, 359.442]
  - - [2880, 3904, 1, 1]
    - [14, 374.784]
  - - [3136, 3904, 1, 1]
    - [14, 394.934]
  - - [3392, 3904, 1, 1]
    - [14, 413.824]
  - - [3648, 3904, 1, 1]
    - [14, 425.128]
  - - [3904, 3904, 1, 1]
    - [14, 454.962]
  - - [64, 1, 1, 256]
    - [16, 1.31072]
  - - [64, 16, 1, 256]
    - [16, 20.1649]
  - - [64, 32, 1, 256]
    - [85, 41.943]
  - - [1, 64, 1, 256]
    - [92, 1.26031]
  - - [16, 64, 1, 256]
    - [109, 20.1649]
  - - [32, 64, 1, 256]
    - [112, 40.3298]
  - - [320, 1, 1, 256]
    - [110, 6.5536]
  - - [320, 16, 1, 256]
    - [92, 104.858]
  - - [320, 32, 1, 256]
    - [16, 201.649]
  - - [576, 1, 1, 256]
    - [118, 11.7965]
  - - [576, 16, 1, 256]
    - [10, 188.744]
  - - [576, 32, 1, 256]
    - [40, 377.487]
  - - [832, 1, 1, 256]
    - [110, 17.0394]
  - - [832, 16, 1, 256]
    - [10, 262.144]
  - - [832, 32, 1, 256]
    - [115, 545.26]
  - - [1088, 1, 1, 256]
    - [100, 21.4252]
  - - [1088, 16, 1, 256]
    - [10, 342.804]
  - - [1088, 32, 1, 256]
    - [112, 713.032]
  - - [1344, 1, 1, 256]
    - [79, 27.5251]
  - - [1344, 16, 1, 256]
    - [79, 423.463]
  - - [1344, 32, 1, 256]
    - [62, 846.927]
  - - [1600, 1, 1, 256]
    - [62, 34.1333]
  - - [1600, 16, 1, 256]
    - [92, 524.288]
  - - [1600, 32, 1, 256]
    - [15, 1048.58]
  - - [1856, 1, 1, 256]
    - [112, 38.0109]
  - - [1856, 16, 1, 256]
    - [17, 608.174]
  - - [1856, 32, 1, 256]
    - [110, 1216.35]
  - - [2112, 1, 1, 256]
    - [104, 41.5902]
  - - [2112, 16, 1, 256]
    - [85, 665.442]
  - - [2112, 32, 1, 256]
    - [107, 1330.88]
  - - [2368, 1, 1, 256]
    - [16, 48.4966]
  - - [2368, 16, 1, 256]
    - [105, 746.102]
  - - [2368, 32, 1, 256]
    - [103, 1551.89]
  - - [2624, 1, 1, 256]
    - [79, 51.6726]
  - - [2624, 16, 1, 256]
    - [10, 826.762]
  - - [2624, 32, 1, 256]
    - [62, 1719.66]
  - - [2880, 1, 1, 256]
    - [107, 56.7138]
  - - [2880, 16, 1, 256]
    - [107, 943.718]
  - - [2880, 32, 1, 256]
    - [97, 1814.84]
  - - [3136, 1, 1, 256]
    - [86, 64.2253]
  - - [3136, 16, 1, 256]
    - [114, 988.081]
  - - [3136, 32, 1, 256]
    - [15, 1976.16]
  - - [3392, 1, 1, 256]
    - [104, 69.4682]
  - - [3392, 16, 1, 256]
    - [99, 1068.74]
  - - [3392, 32, 1, 256]
    - [92, 2058.32]
  - - [3648, 1, 1, 256]
    - [112, 71.8375]
  - - [3648, 16, 1, 256]
    - [39, 1106.83]
  - - [3648, 32, 1, 256]
    - [107, 2298.8]
  - - [3904, 1, 1, 256]
    - [40, 76.8788]
  - - [3904, 16, 1, 256]
    - [63, 1230.06]
  - - [3904, 32, 1, 256]
    - [103, 2460.12]
  - - [1, 320, 1, 256]
    - [98, 6.5536]
  - - [16, 320, 1, 256]
    - [99, 104.858]
  - - [32, 320, 1, 256]
    - [62, 209.715]
  - - [1, 576, 1, 256]
    - [109, 11.7965]
  - - [16, 576, 1, 256]
    - [16, 181.484]
  - - [32, 576, 1, 256]
    - [112, 362.969]
  - - [1, 832, 1, 256]
    - [63, 17.7493]
  - - [16, 832, 1, 256]
    - [118, 272.63]
  - - [32, 832, 1, 256]
    - [118, 567.979]
  - - [1, 1088, 1, 256]
    - [10, 21.4252]
  - - [16, 1088, 1, 256]
    - [85, 356.516]
  - - [32, 1088, 1, 256]
    - [62, 713.032]
  - - [1, 1344, 1, 256]
    - [100, 26.4665]
  - - [16, 1344, 1, 256]
    - [63, 440.402]
  - - [32, 1344, 1, 256]
    - [86, 880.804]
  - - [1, 1600, 1, 256]
    - [92, 32.768]
  - - [16, 1600, 1, 256]
    - [98, 524.288]
  - - [32, 1600, 1, 256]
    - [63, 1092.27]
  - - [1, 1856, 1, 256]
    - [62, 36.5489]
  - - [16, 1856, 1, 256]
    - [92, 584.783]
  - - [32, 1856, 1, 256]
    - [10, 1216.35]
  - - [1, 2112, 1, 256]
    - [109, 43.2538]
  - - [16, 2112, 1, 256]
    - [112, 720.896]
  - - [32, 2112, 1, 256]
    - [104, 1384.12]
  - - [1, 2368, 1, 256]
    - [93, 48.4966]
  - - [16, 2368, 1, 256]
    - [109, 775.946]
  - - [32, 2368, 1, 256]
    - [107, 1551.89]
  - - [1, 2624, 1, 256]
    - [79, 53.7395]
  - - [16, 2624, 1, 256]
    - [110, 895.659]
  - - [32, 2624, 1, 256]
    - [11, 1653.52]
  - - [1, 2880, 1, 256]
    - [115, 61.44]
  - - [16, 2880, 1, 256]
    - [79, 907.422]
  - - [32, 2880, 1, 256]
    - [16, 1814.84]
  - - [1, 3136, 1, 256]
    - [98, 64.2253]
  - - [16, 3136, 1, 256]
    - [98, 1027.6]
  - - [32, 3136, 1, 256]
    - [98, 1976.16]
  - - [1, 3392, 1, 256]
    - [93, 69.4682]
  - - [16, 3392, 1, 256]
    - [98, 1068.74]
  - - [32, 3392, 1, 256]
    - [40, 2137.48]
  - - [1, 3648, 1, 256]
    - [10, 69.1769]
  - - [16, 3648, 1, 256]
    - [40, 1149.4]
  - - [32, 3648, 1, 256]
    - [107, 2298.8]
  - - [1, 3904, 1, 256]
    - [15, 79.9539]
  - - [16, 3904, 1, 256]
    - [115, 1279.26]
  - - [32, 3904, 1, 256]
    - [107, 2558.53]
  - - [64, 1, 1, 512]
    - [109, 2.62144]
  - - [64, 16, 1, 512]
    - [93, 41.943]
  - - [64, 32, 1, 512]
    - [101, 83.8861]
  - - [1, 64, 1, 512]
    - [18, 2.52062]
  - - [16, 64, 1, 512]
    - [109, 41.943]
  - - [32, 64, 1, 512]
    - [86, 80.6597]
  - - [320, 1, 1, 512]
    - [79, 13.1072]
  - - [320, 16, 1, 512]
    - [93, 201.649]
  - - [320, 32, 1, 512]
    - [86, 403.298]
  - - [576, 1, 1, 512]
    - [99, 22.6855]
  - - [576, 16, 1, 512]
    - [115, 362.969]
  - - [576, 32, 1, 512]
    - [108, 725.937]
  - - [832, 1, 1, 512]
    - [79, 32.768]
  - - [832, 16, 1, 512]
    - [86, 524.288]
  - - [832, 32, 1, 512]
    - [16, 1009.74]
  - - [1088, 1, 1, 512]
    - [20, 44.5645]
  - - [1088, 16, 1, 512]
    - [100, 685.607]
  - - [1088, 32, 1, 512]
    - [86, 1371.21]
  - - [1344, 1, 1, 512]
    - [86, 52.9329]
  - - [1344, 16, 1, 512]
    - [107, 846.927]
  - - [1344, 32, 1, 512]
    - [86, 1693.85]
  - - [1600, 1, 1, 512]
    - [64, 60.6815]
  - - [1600, 16, 1, 512]
    - [65, 970.904]
  - - [1600, 32, 1, 512]
    - [79, 2016.49]
  - - [1856, 1, 1, 512]
    - [93, 70.3905]
  - - [1856, 16, 1, 512]
    - [20, 1126.25]
  - - [1856, 32, 1, 512]
    - [79, 2252.5]
  - - [2112, 1, 1, 512]
    - [62, 77.2389]
  - - [2112, 16, 1, 512]
    - [10, 1235.82]
  - - [2112, 32, 1, 512]
    - [107, 2563.19]
  - - [2368, 1, 1, 512]
    - [86, 89.8086]
  - - [2368, 16, 1, 512]
    - [118, 1436.94]
  - - [2368, 32, 1, 512]
    - [108, 2873.87]
  - - [2624, 1, 1, 512]
    - [86, 99.5176]
  - - [2624, 16, 1, 512]
    - [62, 1535.41]
  - - [2624, 32, 1, 512]
    - [86, 3070.83]
  - - [2880, 1, 1, 512]
    - [79, 101.694]
  - - [2880, 16, 1, 512]
    - [109, 1685.21]
  - - [2880, 32, 1, 512]
    - [19, 3254.2]
  - - [3136, 1, 1, 512]
    - [105, 114.688]
  - - [3136, 16, 1, 512]
    - [79, 1771.73]
  - - [3136, 32, 1, 512]
    - [106, 3543.46]
  - - [3392, 1, 1, 512]
    - [10, 119.773]
  - - [3392, 16, 1, 512]
    - [17, 1852.48]
  - - [3392, 32, 1, 512]
    - [98, 3832.73]
  - - [3648, 1, 1, 512]
    - [86, 133.413]
  - - [3648, 16, 1, 512]
    - [63, 2060.99]
  - - [3648, 32, 1, 512]
    - [19, 4121.99]
  - - [3904, 1, 1, 512]
    - [100, 148.063]
  - - [3904, 16, 1, 512]
    - [94, 2205.63]
  - - [3904, 32, 1, 512]
    - [11, 4264.21]
  - - [1, 320, 1, 512]
    - [101, 13.1072]
  - - [16, 320, 1, 512]
    - [79, 201.649]
  - - [32, 320, 1, 512]
    - [79, 403.298]
  - - [1, 576, 1, 512]
    - [79, 23.593]
  - - [16, 576, 1, 512]
    - [101, 362.969]
  - - [32, 576, 1, 512]
    - [101, 754.975]
  - - [1, 832, 1, 512]
    - [93, 34.0787]
  - - [16, 832, 1, 512]
    - [19, 524.288]
  - - [32, 832, 1, 512]
    - [79, 1048.58]
  - - [1, 1088, 1, 512]
    - [79, 42.8505]
  - - [16, 1088, 1, 512]
    - [93, 713.032]
  - - [32, 1088, 1, 512]
    - [93, 1426.06]
  - - [1, 1344, 1, 512]
    - [98, 52.9329]
  - - [16, 1344, 1, 512]
    - [100, 846.927]
  - - [32, 1344, 1, 512]
    - [62, 1631.12]
  - - [1, 1600, 1, 512]
    - [93, 63.0154]
  - - [16, 1600, 1, 512]
    - [109, 1048.58]
  - - [32, 1600, 1, 512]
    - [93, 2016.49]
  - - [1, 1856, 1, 512]
    - [79, 76.0218]
  - - [16, 1856, 1, 512]
    - [79, 1169.57]
  - - [32, 1856, 1, 512]
    - [112, 2432.7]
  - - [1, 2112, 1, 512]
    - [92, 83.1803]
  - - [16, 2112, 1, 512]
    - [15, 1281.59]
  - - [32, 2112, 1, 512]
    - [62, 2563.19]
  - - [1, 2368, 1, 512]
    - [93, 93.2628]
  - - [16, 2368, 1, 512]
    - [10, 1385.62]
  - - [32, 2368, 1, 512]
    - [103, 2984.41]
  - - [1, 2624, 1, 512]
    - [112, 107.479]
  - - [16, 2624, 1, 512]
    - [16, 1653.52]
  - - [32, 2624, 1, 512]
    - [64, 3439.33]
  - - [1, 2880, 1, 512]
    - [113, 122.88]
  - - [16, 2880, 1, 512]
    - [93, 1747.63]
  - - [32, 2880, 1, 512]
    - [62, 3629.69]
  - - [1, 3136, 1, 512]
    - [63, 123.51]
  - - [16, 3136, 1, 512]
    - [105, 1976.16]
  - - [32, 3136, 1, 512]
    - [112, 3805.94]
  - - [1, 3392, 1, 512]
    - [79, 128.645]
  - - [16, 3392, 1, 512]
    - [11, 1984.8]
  - - [32, 3392, 1, 512]
    - [117, 3969.61]
  - - [1, 3648, 1, 512]
    - [93, 138.354]
  - - [16, 3648, 1, 512]
    - [106, 2213.66]
  - - [32, 3648, 1, 512]
    - [98, 4427.32]
  - - [1, 3904, 1, 512]
    - [99, 153.758]
  - - [16, 3904, 1, 512]
    - [99, 2460.12]
  - - [32, 3904, 1, 512]
    - [64, 4738.01]
  - - [64, 1, 1, 1024]
    - [62, 4.68114]
  - - [64, 16, 1, 1024]
    - [100, 77.6723]
  - - [64, 32, 1, 1024]
    - [62, 155.345]
  - - [1, 64, 1, 1024]
    - [93, 4.85452]
  - - [16, 64, 1, 1024]
    - [86, 80.6597]
  - - [32, 64, 1, 1024]
    - [118, 161.319]
  - - [320, 1, 1, 1024]
    - [79, 23.4057]
  - - [320, 16, 1, 1024]
    - [93, 388.361]
  - - [320, 32, 1, 1024]
    - [100, 776.723]
  - - [576, 1, 1, 1024]
    - [62, 45.3711]
  - - [576, 16, 1, 1024]
    - [86, 699.051]
  - - [576, 32, 1, 1024]
    - [118, 1398.1]
  - - [832, 1, 1, 1024]
    - [62, 58.7564]
  - - [832, 16, 1, 1024]
    - [20, 973.678]
  - - [832, 32, 1, 1024]
    - [106, 1947.36]
  - - [1088, 1, 1, 1024]
    - [93, 79.5794]
  - - [1088, 16, 1, 1024]
    - [93, 1229.36]
  - - [1088, 32, 1, 1024]
    - [62, 2458.73]
  - - [1344, 1, 1, 1024]
    - [20, 94.9142]
  - - [1344, 16, 1, 1024]
    - [63, 1420.65]
  - - [1344, 32, 1, 1024]
    - [93, 2936.01]
  - - [1600, 1, 1, 1024]
    - [19, 105.703]
  - - [1600, 16, 1, 1024]
    - [40, 1691.25]
  - - [1600, 32, 1, 1024]
    - [40, 3382.5]
  - - [1856, 1, 1, 1024]
    - [19, 122.616]
  - - [1856, 16, 1, 1024]
    - [79, 1961.85]
  - - [1856, 32, 1, 1024]
    - [64, 4054.49]
  - - [2112, 1, 1, 1024]
    - [79, 139.528]
  - - [2112, 16, 1, 1024]
    - [63, 2097.15]
  - - [2112, 32, 1, 1024]
    - [118, 4464.9]
  - - [2368, 1, 1, 1024]
    - [62, 146.96]
  - - [2368, 16, 1, 1024]
    - [62, 2351.35]
  - - [2368, 32, 1, 1024]
    - [109, 5006.1]
  - - [2624, 1, 1, 1024]
    - [109, 162.847]
  - - [2624, 16, 1, 1024]
    - [62, 2686.98]
  - - [2624, 32, 1, 1024]
    - [86, 5373.95]
  - - [2880, 1, 1, 1024]
    - [93, 173.478]
  - - [2880, 16, 1, 1024]
    - [93, 2696.34]
  - - [2880, 32, 1, 1024]
    - [109, 5551.28]
  - - [3136, 1, 1, 1024]
    - [93, 183.501]
  - - [3136, 16, 1, 1024]
    - [110, 2936.01]
  - - [3136, 32, 1, 1024]
    - [93, 5708.91]
  - - [3392, 1, 1, 1024]
    - [93, 187.752]
  - - [3392, 16, 1, 1024]
    - [23, 3004.03]
  - - [3392, 32, 1, 1024]
    - [93, 6351.37]
  - - [3648, 1, 1, 1024]
    - [86, 201.922]
  - - [3648, 16, 1, 1024]
    - [86, 3230.75]
  - - [3648, 32, 1, 1024]
    - [99, 7244.71]
  - - [3904, 1, 1, 1024]
    - [118, 257.916]
  - - [3904, 16, 1, 1024]
    - [118, 3997.7]
  - - [1, 320, 1, 1024]
    - [100, 25.2062]
  - - [16, 320, 1, 1024]
    - [100, 388.361]
  - - [32, 320, 1, 1024]
    - [93, 748.983]
  - - [1, 576, 1, 1024]
    - [118, 45.3711]
  - - [16, 576, 1, 1024]
    - [79, 699.051]
  - - [32, 576, 1, 1024]
    - [86, 1398.1]
  - - [1, 832, 1, 1024]
    - [62, 60.8549]
  - - [16, 832, 1, 1024]
    - [101, 1009.74]
  - - [32, 832, 1, 1024]
    - [62, 2019.48]
  - - [1, 1088, 1, 1024]
    - [79, 82.5268]
  - - [16, 1088, 1, 1024]
    - [62, 1320.43]
  - - [32, 1088, 1, 1024]
    - [62, 2640.86]
  - - [1, 1344, 1, 1024]
    - [62, 94.9142]
  - - [16, 1344, 1, 1024]
    - [79, 1572.86]
  - - [32, 1344, 1, 1024]
    - [62, 3262.24]
  - - [1, 1600, 1, 1024]
    - [93, 117.029]
  - - [16, 1600, 1, 1024]
    - [79, 1941.81]
  - - [32, 1600, 1, 1024]
    - [93, 3883.61]
  - - [1, 1856, 1, 1024]
    - [101, 140.781]
  - - [16, 1856, 1, 1024]
    - [105, 2252.5]
  - - [32, 1856, 1, 1024]
    - [18, 4504.99]
  - - [1, 2112, 1, 1024]
    - [109, 154.478]
  - - [16, 2112, 1, 1024]
    - [62, 2563.19]
  - - [32, 2112, 1, 1024]
    - [99, 5126.37]
  - - [1, 2368, 1, 1024]
    - [63, 173.202]
  - - [16, 2368, 1, 1024]
    - [79, 2873.87]
  - - [32, 2368, 1, 1024]
    - [99, 5542.47]
  - - [1, 2624, 1, 1024]
    - [100, 191.927]
  - - [16, 2624, 1, 1024]
    - [79, 3070.83]
  - - [32, 2624, 1, 1024]
    - [62, 6141.66]
  - - [1, 2880, 1, 1024]
    - [79, 210.651]
  - - [16, 2880, 1, 1024]
    - [93, 3370.42]
  - - [32, 2880, 1, 1024]
    - [62, 6508.4]
  - - [1, 3136, 1, 1024]
    - [93, 229.376]
  - - [16, 3136, 1, 1024]
    - [105, 3543.46]
  - - [32, 3136, 1, 1024]
    - [99, 7086.93]
  - - [1, 3392, 1, 1024]
    - [79, 239.545]
  - - [16, 3392, 1, 1024]
    - [18, 3969.61]
  - - [32, 3392, 1, 1024]
    - [117, 7939.22]
  - - [1, 3648, 1, 1024]
    - [105, 287.35]
  - - [16, 3648, 1, 1024]
    - [105, 4597.6]
  - - [32, 3648, 1, 1024]
    - [16, 8538.4]
  - - [1, 3904, 1, 1024]
    - [106, 307.515]
  - - [16, 3904, 1, 1024]
    - [16, 4920.24]
  - - [64, 1, 1, 2048]
    - [109, 9.03945]
  - - [64, 16, 1, 2048]
    - [93, 144.631]
  - - [64, 32, 1, 2048]
    - [109, 299.593]
  - - [1, 64, 1, 2048]
    - [62, 8.73813]
  - - [16, 64, 1, 2048]
    - [100, 144.631]
  - - [32, 64, 1, 2048]
    - [86, 289.262]
  - - [320, 1, 1, 2048]
    - [62, 45.1972]
  - - [320, 16, 1, 2048]
    - [118, 776.723]
  - - [320, 32, 1, 2048]
    - [86, 1446.31]
  - - [576, 1, 1, 2048]
    - [93, 78.6432]
  - - [576, 16, 1, 2048]
    - [109, 1258.29]
  - - [576, 32, 1, 2048]
    - [62, 2435.4]
  - - [832, 1, 1, 2048]
    - [86, 117.513]
  - - [832, 16, 1, 2048]
    - [93, 1817.53]
  - - [832, 32, 1, 2048]
    - [20, 3407.87]
  - - [1088, 1, 1, 2048]
    - [100, 143.756]
  - - [1088, 16, 1, 2048]
    - [93, 2300.1]
  - - [1088, 32, 1, 2048]
    - [93, 4600.2]
  - - [1344, 1, 1, 2048]
    - [93, 172.032]
  - - [1344, 16, 1, 2048]
    - [101, 2669.1]
  - - [1344, 32, 1, 2048]
    - [62, 5338.21]
  - - [1600, 1, 1, 2048]
    - [93, 192.753]
  - - [1600, 16, 1, 2048]
    - [86, 3177.5]
  - - [1600, 32, 1, 2048]
    - [93, 6355.01]
  - - [1856, 1, 1, 2048]
    - [109, 245.231]
  - - [1856, 16, 1, 2048]
    - [110, 3923.7]
  - - [1856, 32, 1, 2048]
    - [101, 7847.41]
  - - [2112, 1, 1, 2048]
    - [101, 288.358]
  - - [2112, 16, 1, 2048]
    - [110, 4613.73]
  - - [2368, 1, 1, 2048]
    - [118, 334.46]
  - - [2368, 16, 1, 2048]
    - [100, 5172.97]
  - - [2624, 1, 1, 2048]
    - [93, 358.263]
  - - [2624, 16, 1, 2048]
    - [118, 5929.88]
  - - [2880, 1, 1, 2048]
    - [93, 393.216]
  - - [2880, 16, 1, 2048]
    - [63, 6291.46]
  - - [3136, 1, 1, 2048]
    - [93, 428.169]
  - - [3136, 16, 1, 2048]
    - [118, 6629.71]
  - - [3392, 1, 1, 2048]
    - [93, 434.176]
  - - [3392, 16, 1, 2048]
    - [93, 6946.82]
  - - [3648, 1, 1, 2048]
    - [93, 466.944]
  - - [3648, 16, 1, 2048]
    - [63, 7244.71]
  - - [3904, 1, 1, 2048]
    - [101, 499.712]
  - - [1, 320, 1, 2048]
    - [109, 45.1972]
  - - [16, 320, 1, 2048]
    - [79, 723.156]
  - - [32, 320, 1, 2048]
    - [86, 1446.31]
  - - [1, 576, 1, 2048]
    - [79, 81.355]
  - - [16, 576, 1, 2048]
    - [62, 1217.7]
  - - [32, 576, 1, 2048]
    - [100, 2603.36]
  - - [1, 832, 1, 2048]
    - [109, 117.513]
  - - [16, 832, 1, 2048]
    - [79, 1880.21]
  - - [32, 832, 1, 2048]
    - [118, 3760.41]
  - - [1, 1088, 1, 2048]
    - [109, 159.159]
  - - [16, 1088, 1, 2048]
    - [118, 2458.73]
  - - [32, 1088, 1, 2048]
    - [62, 4917.46]
  - - [1, 1344, 1, 2048]
    - [79, 189.828]
  - - [16, 1344, 1, 2048]
    - [118, 3037.25]
  - - [32, 1344, 1, 2048]
    - [62, 5872.03]
  - - [1, 1600, 1, 2048]
    - [63, 218.453]
  - - [16, 1600, 1, 2048]
    - [20, 3615.78]
  - - [32, 1600, 1, 2048]
    - [100, 6990.51]
  - - [1, 1856, 1, 2048]
    - [105, 271.506]
  - - [16, 1856, 1, 2048]
    - [105, 4344.1]
  - - [32, 1856, 1, 2048]
    - [100, 9009.99]
  - - [1, 2112, 1, 2048]
    - [79, 308.955]
  - - [16, 2112, 1, 2048]
    - [79, 4943.29]
  - - [1, 2368, 1, 2048]
    - [93, 359.234]
  - - [16, 2368, 1, 2048]
    - [105, 5747.75]
  - - [1, 2624, 1, 2048]
    - [93, 370.617]
  - - [16, 2624, 1, 2048]
    - [79, 6614.09]
  - - [1, 2880, 1, 2048]
    - [79, 421.303]
  - - [16, 2880, 1, 2048]
    - [63, 6740.85]
  - - [1, 3136, 1, 2048]
    - [63, 458.752]
  - - [16, 3136, 1, 2048]
    - [105, 7340.03]
  - - [1, 3392, 1, 2048]
    - [105, 514.579]
  - - [16, 3392, 1, 2048]
    - [105, 7939.22]
  - - [1, 3648, 1, 2048]
    - [79, 515.249]
  - - [16, 3648, 1, 2048]
    - [79, 8243.98]
  - - [1, 3904, 1, 2048]
    - [63, 533.026]
  - - [64, 1, 1, 4096]
    - [62, 15.8875]
  - - [64, 16, 1, 4096]
    - [62, 254.2]
  - - [64, 32, 1, 4096]
    - [62, 508.4]
  - - [1, 64, 1, 4096]
    - [118, 16.384]
  - - [16, 64, 1, 4096]
    - [62, 262.144]
  - - [32, 64, 1, 4096]
    - [62, 524.288]
  - - [320, 1, 1, 4096]
    - [109, 81.92]
  - - [320, 16, 1, 4096]
    - [62, 1233.62]
  - - [320, 32, 1, 4096]
    - [109, 2621.44]
  - - [576, 1, 1, 4096]
    - [62, 138.782]
  - - [576, 16, 1, 4096]
    - [118, 2220.51]
  - - [576, 32, 1, 4096]
    - [93, 4575.6]
  - - [832, 1, 1, 4096]
    - [118, 206.538]
  - - [832, 16, 1, 4096]
    - [62, 3207.41]
  - - [832, 32, 1, 4096]
    - [100, 6231.54]
  - - [1088, 1, 1, 4096]
    - [100, 270.088]
  - - [1088, 16, 1, 4096]
    - [100, 4456.45]
  - - [1344, 1, 1, 4096]
    - [118, 355.163]
  - - [1344, 16, 1, 4096]
    - [118, 5682.61]
  - - [1600, 1, 1, 4096]
    - [118, 422.813]
  - - [1600, 16, 1, 4096]
    - [118, 6355.01]
  - - [1856, 1, 1, 4096]
    - [118, 475.136]
  - - [1856, 16, 1, 4096]
    - [86, 7371.81]
  - - [2112, 1, 1, 4096]
    - [86, 540.672]
  - - [2368, 1, 1, 4096]
    - [86, 570.549]
  - - [2624, 1, 1, 4096]
    - [86, 632.23]
  - - [2880, 1, 1, 4096]
    - [118, 674.085]
  - - [3136, 1, 1, 4096]
    - [93, 694.327]
  - - [3392, 1, 1, 4096]
    - [118, 751.007]
  - - [3648, 1, 1, 4096]
    - [63, 766.267]
  - - [3904, 1, 1, 4096]
    - [118, 841.62]
  - - [1, 320, 1, 4096]
    - [86, 79.4376]
  - - [16, 320, 1, 4096]
    - [109, 1310.72]
  - - [32, 320, 1, 4096]
    - [93, 2542.0]
  - - [1, 576, 1, 4096]
    - [118, 147.456]
  - - [16, 576, 1, 4096]
    - [109, 2287.8]
  - - [32, 576, 1, 4096]
    - [109, 4575.6]
  - - [1, 832, 1, 4096]
    - [62, 200.463]
  - - [16, 832, 1, 4096]
    - [100, 3304.6]
  - - [32, 832, 1, 4096]
    - [100, 6609.21]
  - - [1, 1088, 1, 4096]
    - [62, 278.528]
  - - [16, 1088, 1, 4096]
    - [62, 4456.45]
  - - [1, 1344, 1, 4096]
    - [79, 355.163]
  - - [16, 1344, 1, 4096]
    - [118, 5682.61]
  - - [1, 1600, 1, 4096]
    - [79, 409.6]
  - - [16, 1600, 1, 4096]
    - [79, 6553.6]
  - - [1, 1856, 1, 4096]
    - [93, 475.136]
  - - [16, 1856, 1, 4096]
    - [105, 7602.18]
  - - [1, 2112, 1, 4096]
    - [63, 524.288]
  - - [1, 2368, 1, 4096]
    - [79, 606.208]
  - - [1, 2624, 1, 4096]
    - [79, 671.744]
  - - [1, 2880, 1, 4096]
    - [79, 737.28]
  - - [1, 3136, 1, 4096]
    - [63, 734.003]
  - - [1, 3392, 1, 4096]
    - [63, 793.922]
  - - [1, 3648, 1, 4096]
    - [106, 878.953]
  - - [1, 3904, 1, 4096]
    - [63, 940.634]
  - - [192, 1, 1, 64]
    - [15, 1.024]
  - - [192, 16, 1, 64]
    - [104, 16.384]
  - - [192, 32, 1, 64]
    - [62, 32.768]
  - - [192, 1, 1, 1]
    - [98, 0.01536]
  - - [192, 1, 1, 16]
    - [15, 0.236308]
  - - [192, 1, 1, 32]
    - [92, 0.49152]
  - - [192, 16, 1, 1]
    - [15, 0.236308]
  - - [192, 16, 1, 16]
    - [15, 3.78092]
  - - [192, 16, 1, 32]
    - [92, 7.56185]
  - - [192, 32, 1, 1]
    - [79, 0.472615]
  - - [192, 32, 1, 16]
    - [108, 7.86432]
  - - [192, 32, 1, 32]
    - [15, 15.1237]
  - - [192, 64, 1, 1]
    - [11, 0.910222]
  - - [192, 64, 1, 16]
    - [109, 15.1237]
  - - [192, 64, 1, 32]
    - [92, 30.2474]
  - - [448, 1, 1, 64]
    - [10, 2.048]
  - - [448, 16, 1, 64]
    - [10, 32.768]
  - - [448, 32, 1, 64]
    - [103, 73.4003]
  - - [448, 1, 1, 1]
    - [10, 0.0331852]
  - - [448, 1, 1, 16]
    - [15, 0.551385]
  - - [448, 1, 1, 32]
    - [85, 1.10277]
  - - [448, 16, 1, 1]
    - [10, 0.530963]
  - - [448, 16, 1, 16]
    - [62, 8.82215]
  - - [448, 16, 1, 32]
    - [115, 17.6443]
  - - [448, 32, 1, 1]
    - [92, 1.10277]
  - - [448, 32, 1, 16]
    - [115, 18.3501]
  - - [448, 32, 1, 32]
    - [15, 33.9816]
  - - [448, 64, 1, 1]
    - [86, 2.20554]
  - - [448, 64, 1, 16]
    - [63, 35.2886]
  - - [448, 64, 1, 32]
    - [44, 70.5772]
  - - [704, 1, 1, 64]
    - [10, 3.33748]
  - - [704, 16, 1, 64]
    - [15, 55.4535]
  - - [704, 32, 1, 64]
    - [103, 110.907]
  - - [704, 1, 1, 1]
    - [79, 0.0541538]
  - - [704, 1, 1, 16]
    - [10, 0.866462]
  - - [704, 1, 1, 32]
    - [62, 1.73292]
  - - [704, 16, 1, 1]
    - [107, 0.866462]
  - - [704, 16, 1, 16]
    - [108, 14.4179]
  - - [704, 16, 1, 32]
    - [98, 28.8358]
  - - [704, 32, 1, 1]
    - [42, 1.80224]
  - - [704, 32, 1, 16]
    - [104, 27.7268]
  - - [704, 32, 1, 32]
    - [85, 55.4535]
  - - [704, 64, 1, 1]
    - [11, 3.46585]
  - - [704, 64, 1, 16]
    - [16, 57.6717]
  - - [704, 64, 1, 32]
    - [79, 106.799]
  - - [960, 1, 1, 64]
    - [115, 4.72615]
  - - [960, 16, 1, 64]
    - [100, 75.6185]
  - - [960, 32, 1, 64]
    - [115, 157.286]
  - - [960, 1, 1, 1]
    - [15, 0.0738462]
  - - [960, 1, 1, 16]
    - [79, 1.18154]
  - - [960, 1, 1, 32]
    - [106, 2.36308]
  - - [960, 16, 1, 1]
    - [79, 1.2288]
  - - [960, 16, 1, 16]
    - [93, 19.6608]
  - - [960, 16, 1, 32]
    - [99, 39.3216]
  - - [960, 32, 1, 1]
    - [114, 2.4576]
  - - [960, 32, 1, 16]
    - [10, 35.1086]
  - - [960, 32, 1, 32]
    - [102, 78.6432]
  - - [960, 64, 1, 1]
    - [10, 4.55111]
  - - [960, 64, 1, 16]
    - [102, 75.6185]
  - - [960, 64, 1, 32]
    - [103, 163.84]
  - - [1216, 1, 1, 64]
    - [92, 6.48533]
  - - [1216, 16, 1, 64]
    - [92, 95.7834]
  - - [1216, 32, 1, 64]
    - [99, 191.567]
  - - [1216, 1, 1, 1]
    - [65, 0.0935385]
  - - [1216, 1, 1, 16]
    - [114, 1.62133]
  - - [1216, 1, 1, 32]
    - [15, 3.24267]
  - - [1216, 16, 1, 1]
    - [101, 1.55648]
  - - [1216, 16, 1, 16]
    - [107, 24.9037]
  - - [1216, 16, 1, 32]
    - [108, 47.8917]
  - - [1216, 32, 1, 1]
    - [15, 3.11296]
  - - [1216, 32, 1, 16]
    - [86, 47.8917]
  - - [1216, 32, 1, 32]
    - [39, 95.7834]
  - - [1216, 64, 1, 1]
    - [97, 6.48533]
  - - [1216, 64, 1, 16]
    - [103, 99.6147]
  - - [1216, 64, 1, 32]
    - [85, 191.567]
  - - [1472, 1, 1, 64]
    - [103, 7.24677]
  - - [1472, 16, 1, 64]
    - [93, 115.948]
  - - [1472, 32, 1, 64]
    - [79, 241.172]
  - - [1472, 1, 1, 1]
    - [63, 0.113231]
  - - [1472, 1, 1, 16]
    - [97, 1.88416]
  - - [1472, 1, 1, 32]
    - [85, 3.62338]
  - - [1472, 16, 1, 1]
    - [10, 1.81169]
  - - [1472, 16, 1, 16]
    - [101, 30.1466]
  - - [1472, 16, 1, 32]
    - [64, 60.2931]
  - - [1472, 32, 1, 1]
    - [47, 3.62338]
  - - [1472, 32, 1, 16]
    - [15, 60.2931]
  - - [1472, 32, 1, 32]
    - [63, 120.586]
  - - [1472, 64, 1, 1]
    - [15, 7.53664]
  - - [1472, 64, 1, 16]
    - [15, 120.586]
  - - [1472, 64, 1, 32]
    - [10, 231.897]
  - - [1728, 1, 1, 64]
    - [10, 8.84736]
  - - [1728, 16, 1, 64]
    - [10, 131.072]
  - - [1728, 32, 1, 64]
    - [73, 283.116]
  - - [1728, 1, 1, 1]
    - [63, 0.13824]
  - - [1728, 1, 1, 16]
    - [11, 2.12677]
  - - [1728, 1, 1, 32]
    - [79, 4.42368]
  - - [1728, 16, 1, 1]
    - [118, 2.21184]
  - - [1728, 16, 1, 16]
    - [15, 35.3894]
  - - [1728, 16, 1, 32]
    - [15, 70.7789]
  - - [1728, 32, 1, 1]
    - [114, 4.42368]
  - - [1728, 32, 1, 16]
    - [10, 68.0566]
  - - [1728, 32, 1, 32]
    - [15, 141.558]
  - - [1728, 64, 1, 1]
    - [15, 8.84736]
  - - [1728, 64, 1, 16]
    - [11, 141.558]
  - - [1728, 64, 1, 32]
    - [15, 283.116]
  - - [1984, 1, 1, 64]
    - [11, 9.76738]
  - - [1984, 16, 1, 64]
    - [63, 156.278]
  - - [1984, 32, 1, 64]
    - [86, 325.059]
  - - [1984, 1, 1, 1]
    - [10, 0.15872]
  - - [1984, 1, 1, 16]
    - [10, 2.44185]
  - - [1984, 1, 1, 32]
    - [115, 5.07904]
  - - [1984, 16, 1, 1]
    - [99, 2.64533]
  - - [1984, 16, 1, 16]
    - [11, 40.6323]
  - - [1984, 16, 1, 32]
    - [10, 78.1391]
  - - [1984, 32, 1, 1]
    - [15, 5.29067]
  - - [1984, 32, 1, 16]
    - [44, 78.1391]
  - - [1984, 32, 1, 32]
    - [15, 162.529]
  - - [1984, 64, 1, 1]
    - [102, 10.5813]
  - - [1984, 64, 1, 16]
    - [11, 162.529]
  - - [1984, 64, 1, 32]
    - [10, 325.059]
  - - [1, 192, 1, 64]
    - [15, 0.98304]
  - - [16, 192, 1, 64]
    - [112, 15.7286]
  - - [32, 192, 1, 64]
    - [10, 30.2474]
  - - [1, 192, 1, 1]
    - [98, 0.01536]
  - - [1, 192, 1, 16]
    - [15, 0.24576]
  - - [1, 192, 1, 32]
    - [92, 0.512]
  - - [16, 192, 1, 1]
    - [112, 0.256]
  - - [16, 192, 1, 16]
    - [103, 4.096]
  - - [16, 192, 1, 32]
    - [16, 8.192]
  - - [32, 192, 1, 1]
    - [15, 0.49152]
  - - [32, 192, 1, 16]
    - [15, 8.192]
  - - [32, 192, 1, 32]
    - [92, 16.384]
  - - [64, 192, 1, 1]
    - [10, 0.98304]
  - - [64, 192, 1, 16]
    - [15, 15.7286]
  - - [64, 192, 1, 32]
    - [11, 31.4573]
  - - [192, 192, 1, 1]
    - [15, 3.072]
  - - [192, 192, 1, 16]
    - [10, 45.3711]
  - - [192, 192, 1, 32]
    - [92, 102.578]
  - - [320, 192, 1, 1]
    - [10, 5.12]
  - - [320, 192, 1, 16]
    - [92, 81.92]
  - - [320, 192, 1, 32]
    - [10, 157.286]
  - - [448, 192, 1, 1]
    - [10, 6.88128]
  - - [448, 192, 1, 16]
    - [15, 110.1]
  - - [448, 192, 1, 32]
    - [22, 220.201]
  - - [576, 192, 1, 1]
    - [111, 9.216]
  - - [576, 192, 1, 16]
    - [10, 141.558]
  - - [576, 192, 1, 32]
    - [44, 283.116]
  - - [704, 192, 1, 1]
    - [10, 10.3975]
  - - [704, 192, 1, 16]
    - [112, 173.015]
  - - [704, 192, 1, 32]
    - [10, 332.721]
  - - [832, 192, 1, 1]
    - [11, 12.288]
  - - [832, 192, 1, 16]
    - [64, 212.992]
  - - [832, 192, 1, 32]
    - [19, 425.984]
  - - [960, 192, 1, 1]
    - [11, 14.7456]
  - - [960, 192, 1, 16]
    - [10, 226.855]
  - - [960, 192, 1, 32]
    - [10, 453.711]
  - - [1088, 192, 1, 1]
    - [10, 16.0689]
  - - [1088, 192, 1, 16]
    - [15, 267.387]
  - - [1088, 192, 1, 32]
    - [103, 534.774]
  - - [1216, 192, 1, 1]
    - [10, 18.6778]
  - - [1216, 192, 1, 16]
    - [66, 298.844]
  - - [1216, 192, 1, 32]
    - [10, 574.7]
  - - [1344, 192, 1, 1]
    - [15, 20.6438]
  - - [1344, 192, 1, 16]
    - [15, 330.301]
  - - [1344, 192, 1, 32]
    - [15, 660.603]
  - - [1472, 192, 1, 1]
    - [10, 20.9351]
  - - [1472, 192, 1, 16]
    - [10, 361.759]
  - - [1472, 192, 1, 32]
    - [15, 723.517]
  - - [1600, 192, 1, 1]
    - [47, 23.6308]
  - - [1600, 192, 1, 16]
    - [10, 393.216]
  - - [1600, 192, 1, 32]
    - [10, 756.185]
  - - [1728, 192, 1, 1]
    - [10, 25.5212]
  - - [1728, 192, 1, 16]
    - [10, 408.34]
  - - [1728, 192, 1, 32]
    - [11, 884.736]
  - - [1856, 192, 1, 1]
    - [21, 28.5082]
  - - [1856, 192, 1, 16]
    - [104, 438.587]
  - - [1856, 192, 1, 32]
    - [15, 912.261]
  - - [1984, 192, 1, 1]
    - [10, 30.4742]
  - - [1984, 192, 1, 16]
    - [11, 487.588]
  - - [1984, 192, 1, 32]
    - [117, 975.176]
  - - [192, 320, 1, 1]
    - [80, 4.9152]
  - - [192, 320, 1, 16]
    - [97, 81.92]
  - - [192, 320, 1, 32]
    - [15, 157.286]
  - - [448, 320, 1, 1]
    - [10, 11.0277]
  - - [448, 320, 1, 16]
    - [85, 176.443]
  - - [448, 320, 1, 32]
    - [15, 367.002]
  - - [704, 320, 1, 1]
    - [11, 18.0224]
  - - [704, 320, 1, 16]
    - [10, 277.268]
  - - [704, 320, 1, 32]
    - [115, 600.747]
  - - [960, 320, 1, 1]
    - [10, 24.576]
  - - [960, 320, 1, 16]
    - [15, 393.216]
  - - [960, 320, 1, 32]
    - [115, 756.185]
  - - [1216, 320, 1, 1]
    - [10, 29.9323]
  - - [1216, 320, 1, 16]
    - [15, 498.074]
  - - [1216, 320, 1, 32]
    - [117, 996.147]
  - - [1472, 320, 1, 1]
    - [10, 34.8919]
  - - [1472, 320, 1, 16]
    - [103, 579.742]
  - - [1472, 320, 1, 32]
    - [10, 1116.54]
  - - [1728, 320, 1, 1]
    - [10, 40.96]
  - - [1728, 320, 1, 16]
    - [10, 655.36]
  - - [1728, 320, 1, 32]
    - [44, 1310.72]
  - - [1984, 320, 1, 1]
    - [41, 47.0281]
  - - [1984, 320, 1, 16]
    - [47, 725.577]
  - - [1984, 320, 1, 32]
    - [80, 1504.9]
  - - [1, 448, 1, 64]
    - [15, 2.38933]
  - - [16, 448, 1, 64]
    - [10, 38.2293]
  - - [32, 448, 1, 64]
    - [10, 73.4003]
  - - [1, 448, 1, 1]
    - [15, 0.03584]
  - - [1, 448, 1, 16]
    - [15, 0.597333]
  - - [1, 448, 1, 32]
    - [16, 1.19467]
  - - [16, 448, 1, 1]
    - [10, 0.551385]
  - - [16, 448, 1, 16]
    - [10, 9.17504]
  - - [16, 448, 1, 32]
    - [10, 17.6443]
  - - [32, 448, 1, 1]
    - [15, 1.19467]
  - - [32, 448, 1, 16]
    - [15, 18.3501]
  - - [32, 448, 1, 32]
    - [15, 36.7002]
  - - [64, 448, 1, 1]
    - [17, 2.38933]
  - - [64, 448, 1, 16]
    - [11, 36.7002]
  - - [64, 448, 1, 32]
    - [105, 76.4587]
  - - [192, 448, 1, 1]
    - [22, 6.88128]
  - - [192, 448, 1, 16]
    - [86, 110.1]
  - - [192, 448, 1, 32]
    - [92, 229.376]
  - - [320, 448, 1, 1]
    - [104, 11.4688]
  - - [320, 448, 1, 16]
    - [11, 176.443]
  - - [320, 448, 1, 32]
    - [10, 352.886]
  - - [448, 448, 1, 1]
    - [11, 16.0563]
  - - [448, 448, 1, 16]
    - [10, 247.02]
  - - [448, 448, 1, 32]
    - [10, 494.041]
  - - [576, 448, 1, 1]
    - [15, 21.504]
  - - [576, 448, 1, 16]
    - [10, 317.598]
  - - [576, 448, 1, 32]
    - [22, 635.195]
  - - [704, 448, 1, 1]
    - [10, 26.2827]
  - - [704, 448, 1, 16]
    - [26, 403.702]
  - - [704, 448, 1, 32]
    - [116, 807.404]
  - - [832, 448, 1, 1]
    - [116, 29.8189]
  - - [832, 448, 1, 16]
    - [10, 458.752]
  - - [832, 448, 1, 32]
    - [15, 954.204]
  - - [960, 448, 1, 1]
    - [80, 33.0831]
  - - [960, 448, 1, 16]
    - [39, 509.724]
  - - [960, 448, 1, 32]
    - [10, 1019.45]
  - - [1088, 448, 1, 1]
    - [10, 36.1055]
  - - [1088, 448, 1, 16]
    - [10, 577.688]
  - - [1088, 448, 1, 32]
    - [116, 1199.81]
  - - [1216, 448, 1, 1]
    - [23, 41.9052]
  - - [1216, 448, 1, 16]
    - [41, 697.303]
  - - [1216, 448, 1, 32]
    - [10, 1291.3]
  - - [1344, 448, 1, 1]
    - [24, 43.008]
  - - [1344, 448, 1, 16]
    - [12, 664.399]
  - - [1344, 448, 1, 32]
    - [41, 1427.23]
  - - [1472, 448, 1, 1]
    - [41, 47.104]
  - - [1472, 448, 1, 16]
    - [31, 753.664]
  - - [1472, 448, 1, 32]
    - [80, 1507.33]
  - - [1600, 448, 1, 1]
    - [116, 51.2]
  - - [1600, 448, 1, 16]
    - [43, 882.215]
  - - [1600, 448, 1, 32]
    - [24, 1699.08]
  - - [1728, 448, 1, 1]
    - [26, 55.296]
  - - [1728, 448, 1, 16]
    - [42, 884.736]
  - - [1728, 448, 1, 32]
    - [11, 1708.46]
  - - [1856, 448, 1, 1]
    - [41, 59.392]
  - - [1856, 448, 1, 16]
    - [24, 917.504]
  - - [1856, 448, 1, 32]
    - [39, 1835.01]
  - - [1984, 448, 1, 1]
    - [34, 61.2988]
  - - [1984, 448, 1, 16]
    - [13, 948.087]
  - - [1984, 448, 1, 32]
    - [13, 1961.56]
  - - [192, 576, 1, 1]
    - [10, 8.84736]
  - - [192, 576, 1, 16]
    - [11, 141.558]
  - - [192, 576, 1, 32]
    - [11, 283.116]
  - - [448, 576, 1, 1]
    - [44, 19.1147]
  - - [448, 576, 1, 16]
    - [111, 305.835]
  - - [448, 576, 1, 32]
    - [116, 635.195]
  - - [704, 576, 1, 1]
    - [44, 31.1926]
  - - [704, 576, 1, 16]
    - [10, 463.433]
  - - [704, 576, 1, 32]
    - [85, 961.195]
  - - [960, 576, 1, 1]
    - [42, 40.96]
  - - [960, 576, 1, 16]
    - [13, 631.954]
  - - [960, 576, 1, 32]
    - [47, 1361.13]
  - - [1216, 576, 1, 1]
    - [47, 51.8827]
  - - [1216, 576, 1, 16]
    - [43, 800.475]
  - - [1216, 576, 1, 32]
    - [42, 1600.95]
  - - [1472, 576, 1, 1]
    - [26, 58.4739]
  - - [1472, 576, 1, 16]
    - [24, 935.583]
  - - [1472, 576, 1, 32]
    - [27, 1937.99]
  - - [1728, 576, 1, 1]
    - [10, 66.3552]
  - - [1728, 576, 1, 16]
    - [13, 1098.29]
  - - [1728, 576, 1, 32]
    - [61, 2123.37]
  - - [1984, 576, 1, 1]
    - [69, 78.8127]
  - - [1984, 576, 1, 16]
    - [9, 1179.65]
  - - [1984, 576, 1, 32]
    - [69, 2522.01]
  - - [1, 704, 1, 64]
    - [104, 3.60448]
  - - [16, 704, 1, 64]
    - [39, 57.6717]
  - - [32, 704, 1, 64]
    - [11, 115.343]
  - - [1, 704, 1, 1]
    - [92, 0.0586667]
  - - [1, 704, 1, 16]
    - [79, 0.866462]
  - - [1, 704, 1, 32]
    - [62, 1.73292]
  - - [16, 704, 1, 1]
    - [98, 0.938667]
  - - [16, 704, 1, 16]
    - [16, 14.4179]
  - - [16, 704, 1, 32]
    - [108, 27.7268]
  - - [32, 704, 1, 1]
    - [92, 1.87733]
  - - [32, 704, 1, 16]
    - [18, 27.7268]
  - - [32, 704, 1, 32]
    - [16, 57.6717]
  - - [64, 704, 1, 1]
    - [15, 3.60448]
  - - [64, 704, 1, 16]
    - [86, 55.4535]
  - - [64, 704, 1, 32]
    - [64, 115.343]
  - - [192, 704, 1, 1]
    - [104, 10.8134]
  - - [192, 704, 1, 16]
    - [11, 173.015]
  - - [192, 704, 1, 32]
    - [80, 332.721]
  - - [320, 704, 1, 1]
    - [23, 18.0224]
  - - [320, 704, 1, 16]
    - [117, 288.358]
  - - [320, 704, 1, 32]
    - [26, 576.717]
  - - [448, 704, 1, 1]
    - [23, 23.3624]
  - - [448, 704, 1, 16]
    - [80, 388.175]
  - - [448, 704, 1, 32]
    - [42, 776.35]
  - - [576, 704, 1, 1]
    - [21, 30.0373]
  - - [576, 704, 1, 16]
    - [42, 480.597]
  - - [576, 704, 1, 32]
    - [10, 1038.09]
  - - [704, 704, 1, 1]
    - [41, 36.7123]
  - - [704, 704, 1, 16]
    - [103, 587.397]
  - - [704, 704, 1, 32]
    - [71, 1219.98]
  - - [832, 704, 1, 1]
    - [36, 43.3873]
  - - [832, 704, 1, 16]
    - [23, 669.403]
  - - [832, 704, 1, 32]
    - [21, 1388.39]
  - - [960, 704, 1, 1]
    - [12, 46.6097]
  - - [960, 704, 1, 16]
    - [54, 772.389]
  - - [960, 704, 1, 32]
    - [24, 1601.99]
  - - [1088, 704, 1, 1]
    - [47, 54.7109]
  - - [1088, 704, 1, 16]
    - [9, 845.188]
  - - [1088, 704, 1, 32]
    - [80, 1750.75]
  - - [1216, 704, 1, 1]
    - [10, 57.0709]
  - - [1216, 704, 1, 16]
    - [13, 944.622]
  - - [1216, 704, 1, 32]
    - [13, 1889.24]
  - - [1344, 704, 1, 1]
    - [47, 67.584]
  - - [1344, 704, 1, 16]
    - [35, 1009.25]
  - - [1344, 704, 1, 32]
    - [26, 2018.51]
  - - [1472, 704, 1, 1]
    - [13, 69.0859]
  - - [1472, 704, 1, 16]
    - [13, 1105.37]
  - - [1472, 704, 1, 32]
    - [61, 2210.75]
  - - [1600, 704, 1, 1]
    - [10, 72.671]
  - - [1600, 704, 1, 16]
    - [13, 1162.74]
  - - [1600, 704, 1, 32]
    - [89, 2402.99]
  - - [1728, 704, 1, 1]
    - [13, 78.4846]
  - - [1728, 704, 1, 16]
    - [26, 1297.61]
  - - [1728, 704, 1, 32]
    - [55, 2511.51]
  - - [1856, 704, 1, 1]
    - [8, 81.664]
  - - [1856, 704, 1, 16]
    - [13, 1348.77]
  - - [1856, 704, 1, 32]
    - [82, 2613.25]
  - - [1984, 704, 1, 1]
    - [9, 84.6507]
  - - [1984, 704, 1, 16]
    - [49, 1396.74]
  - - [1984, 704, 1, 32]
    - [88, 2883.58]
  - - [192, 832, 1, 1]
    - [107, 13.312]
  - - [192, 832, 1, 16]
    - [16, 204.472]
  - - [192, 832, 1, 32]
    - [111, 425.984]
  - - [448, 832, 1, 1]
    - [117, 31.0613]
  - - [448, 832, 1, 16]
    - [39, 458.752]
  - - [448, 832, 1, 32]
    - [15, 917.504]
  - - [704, 832, 1, 1]
    - [31, 41.8377]
  - - [704, 832, 1, 16]
    - [43, 669.403]
  - - [704, 832, 1, 32]
    - [13, 1388.39]
  - - [960, 832, 1, 1]
    - [24, 55.0841]
  - - [960, 832, 1, 16]
    - [42, 881.346]
  - - [960, 832, 1, 32]
    - [27, 1825.65]
  - - [1216, 832, 1, 1]
    - [13, 67.4475]
  - - [1216, 832, 1, 16]
    - [13, 1079.16]
  - - [1216, 832, 1, 32]
    - [69, 2158.32]
  - - [1472, 832, 1, 1]
    - [9, 74.2245]
  - - [1472, 832, 1, 16]
    - [13, 1264.21]
  - - [1472, 832, 1, 32]
    - [13, 2528.42]
  - - [1728, 832, 1, 1]
    - [13, 89.856]
  - - [1728, 832, 1, 16]
    - [61, 1484.07]
  - - [1728, 832, 1, 32]
    - [32, 2875.39]
  - - [1984, 832, 1, 1]
    - [9, 97.0993]
  - - [1984, 832, 1, 16]
    - [82, 1600.67]
  - - [1984, 832, 1, 32]
    - [49, 3201.33]
  - - [1, 960, 1, 64]
    - [10, 4.9152]
  - - [16, 960, 1, 64]
    - [97, 78.6432]
  - - [32, 960, 1, 64]
    - [87, 157.286]
  - - [1, 960, 1, 1]
    - [15, 0.0738462]
  - - [1, 960, 1, 16]
    - [85, 1.2288]
  - - [1, 960, 1, 32]
    - [79, 2.36308]
  - - [16, 960, 1, 1]
    - [101, 1.18154]
  - - [16, 960, 1, 16]
    - [97, 18.9046]
  - - [16, 960, 1, 32]
    - [99, 40.96]
  - - [32, 960, 1, 1]
    - [85, 2.36308]
  - - [32, 960, 1, 16]
    - [92, 39.3216]
  - - [32, 960, 1, 32]
    - [102, 75.6185]
  - - [64, 960, 1, 1]
    - [100, 4.72615]
  - - [64, 960, 1, 16]
    - [104, 75.6185]
  - - [64, 960, 1, 32]
    - [15, 157.286]
  - - [192, 960, 1, 1]
    - [10, 14.1785]
  - - [192, 960, 1, 16]
    - [10, 218.453]
  - - [192, 960, 1, 32]
    - [10, 491.52]
  - - [320, 960, 1, 1]
    - [87, 22.7556]
  - - [320, 960, 1, 16]
    - [11, 364.089]
  - - [320, 960, 1, 32]
    - [44, 786.432]
  - - [448, 960, 1, 1]
    - [80, 33.0831]
  - - [448, 960, 1, 16]
    - [10, 509.724]
  - - [448, 960, 1, 32]
    - [24, 983.04]
  - - [576, 960, 1, 1]
    - [10, 38.1352]
  - - [576, 960, 1, 16]
    - [41, 631.954]
  - - [576, 960, 1, 32]
    - [47, 1263.91]
  - - [704, 960, 1, 1]
    - [80, 50.0622]
  - - [704, 960, 1, 16]
    - [80, 772.389]
  - - [704, 960, 1, 32]
    - [80, 1601.99]
  - - [832, 960, 1, 1]
    - [42, 55.0841]
  - - [832, 960, 1, 16]
    - [13, 881.346]
  - - [832, 960, 1, 32]
    - [80, 1762.69]
  - - [960, 960, 1, 1]
    - [77, 63.5586]
  - - [960, 960, 1, 16]
    - [26, 1016.94]
  - - [960, 960, 1, 32]
    - [70, 2106.51]
  - - [1088, 960, 1, 1]
    - [35, 69.632]
  - - [1088, 960, 1, 16]
    - [31, 1152.53]
  - - [1088, 960, 1, 32]
    - [70, 2387.38]
  - - [1216, 960, 1, 1]
    - [69, 75.3135]
  - - [1216, 960, 1, 16]
    - [70, 1245.18]
  - - [1216, 960, 1, 32]
    - [70, 2410.03]
  - - [1344, 960, 1, 1]
    - [26, 80.64]
  - - [1344, 960, 1, 16]
    - [59, 1331.86]
  - - [1344, 960, 1, 32]
    - [13, 2580.48]
  - - [1472, 960, 1, 1]
    - [49, 85.6436]
  - - [1472, 960, 1, 16]
    - [77, 1413.12]
  - - [1472, 960, 1, 32]
    - [61, 2826.24]
  - - [1600, 960, 1, 1]
    - [3, 93.0909]
  - - [1600, 960, 1, 16]
    - [9, 1445.65]
  - - [1600, 960, 1, 32]
    - [42, 2978.91]
  - - [1728, 960, 1, 1]
    - [80, 100.538]
  - - [1728, 960, 1, 16]
    - [3, 1561.3]
  - - [1728, 960, 1, 32]
    - [8, 2949.12]
  - - [1856, 960, 1, 1]
    - [9, 101.815]
  - - [1856, 960, 1, 16]
    - [8, 1629.04]
  - - [1856, 960, 1, 32]
    - [70, 3258.08]
  - - [1984, 960, 1, 1]
    - [49, 108.837]
  - - [1984, 960, 1, 16]
    - [82, 1741.39]
  - - [1984, 960, 1, 32]
    - [82, 3482.77]
  - - [192, 1088, 1, 1]
    - [111, 16.7117]
  - - [192, 1088, 1, 16]
    - [17, 257.103]
  - - [192, 1088, 1, 32]
    - [111, 534.774]
  - - [448, 1088, 1, 1]
    - [21, 36.1055]
  - - [448, 1088, 1, 16]
    - [116, 557.056]
  - - [448, 1088, 1, 32]
    - [116, 1114.11]
  - - [704, 1088, 1, 1]
    - [80, 52.8243]
  - - [704, 1088, 1, 16]
    - [117, 845.188]
  - - [704, 1088, 1, 32]
    - [80, 1690.38]
  - - [960, 1088, 1, 1]
    - [75, 69.632]
  - - [960, 1088, 1, 16]
    - [82, 1078.17]
  - - [960, 1088, 1, 32]
    - [43, 2228.22]
  - - [1216, 1088, 1, 1]
    - [33, 80.1823]
  - - [1216, 1088, 1, 16]
    - [95, 1365.69]
  - - [1216, 1088, 1, 32]
    - [32, 2731.37]
  - - [1472, 1088, 1, 1]
    - [49, 100.096]
  - - [1472, 1088, 1, 16]
    - [83, 1553.0]
  - - [1472, 1088, 1, 32]
    - [49, 3014.66]
  - - [1728, 1088, 1, 1]
    - [43, 104.448]
  - - [1728, 1088, 1, 16]
    - [82, 1718.92]
  - - [1728, 1088, 1, 32]
    - [49, 3437.83]
  - - [1984, 1088, 1, 1]
    - [3, 119.922]
  - - [1984, 1088, 1, 16]
    - [61, 1918.75]
  - - [1984, 1088, 1, 32]
    - [3, 3635.52]
  - - [1, 1216, 1, 64]
    - [109, 6.7673]
  - - [16, 1216, 1, 64]
    - [115, 99.6147]
  - - [32, 1216, 1, 64]
    - [109, 199.229]
  - - [1, 1216, 1, 1]
    - [10, 0.0935385]
  - - [1, 1216, 1, 16]
    - [113, 1.55648]
  - - [1, 1216, 1, 32]
    - [15, 2.99323]
  - - [16, 1216, 1, 1]
    - [92, 1.62133]
  - - [16, 1216, 1, 16]
    - [109, 23.9458]
  - - [16, 1216, 1, 32]
    - [10, 44.4709]
  - - [32, 1216, 1, 1]
    - [108, 2.99323]
  - - [32, 1216, 1, 16]
    - [16, 47.8917]
  - - [32, 1216, 1, 32]
    - [10, 92.2359]
  - - [64, 1216, 1, 1]
    - [11, 5.76474]
  - - [64, 1216, 1, 16]
    - [11, 88.9417]
  - - [64, 1216, 1, 32]
    - [111, 207.531]
  - - [192, 1216, 1, 1]
    - [11, 17.2942]
  - - [192, 1216, 1, 16]
    - [15, 276.708]
  - - [192, 1216, 1, 32]
    - [115, 574.7]
  - - [320, 1216, 1, 1]
    - [22, 28.8237]
  - - [320, 1216, 1, 16]
    - [73, 444.709]
  - - [320, 1216, 1, 32]
    - [117, 922.359]
  - - [448, 1216, 1, 1]
    - [10, 37.5702]
  - - [448, 1216, 1, 16]
    - [116, 622.592]
  - - [448, 1216, 1, 32]
    - [80, 1291.3]
  - - [576, 1216, 1, 1]
    - [73, 50.0297]
  - - [576, 1216, 1, 16]
    - [88, 772.873]
  - - [576, 1216, 1, 32]
    - [41, 1600.95]
  - - [704, 1216, 1, 1]
    - [69, 61.1474]
  - - [704, 1216, 1, 16]
    - [26, 883.679]
  - - [704, 1216, 1, 32]
    - [47, 1826.27]
  - - [832, 1216, 1, 1]
    - [43, 67.4475]
  - - [832, 1216, 1, 16]
    - [69, 1116.37]
  - - [832, 1216, 1, 32]
    - [89, 2232.74]
  - - [960, 1216, 1, 1]
    - [43, 77.824]
  - - [960, 1216, 1, 16]
    - [13, 1205.02]
  - - [960, 1216, 1, 32]
    - [33, 2410.03]
  - - [1088, 1216, 1, 1]
    - [57, 82.688]
  - - [1088, 1216, 1, 16]
    - [47, 1365.69]
  - - [1088, 1216, 1, 32]
    - [36, 2731.37]
  - - [1216, 1216, 1, 1]
    - [56, 89.6155]
  - - [1216, 1216, 1, 16]
    - [57, 1478.66]
  - - [1216, 1216, 1, 32]
    - [75, 2957.31]
  - - [1344, 1216, 1, 1]
    - [9, 99.0487]
  - - [1344, 1216, 1, 16]
    - [26, 1538.17]
  - - [1344, 1216, 1, 32]
    - [47, 3169.56]
  - - [1472, 1216, 1, 1]
    - [9, 108.482]
  - - [1472, 1216, 1, 16]
    - [9, 1684.66]
  - - [1472, 1216, 1, 32]
    - [42, 3369.32]
  - - [1600, 1216, 1, 1]
    - [3, 111.177]
  - - [1600, 1216, 1, 16]
    - [8, 1778.83]
  - - [1600, 1216, 1, 32]
    - [47, 3662.31]
  - - [1728, 1216, 1, 1]
    - [61, 120.071]
  - - [1728, 1216, 1, 16]
    - [78, 1867.78]
  - - [1728, 1216, 1, 32]
    - [8, 3634.59]
  - - [1856, 1216, 1, 1]
    - [32, 121.994]
  - - [1856, 1216, 1, 16]
    - [70, 1951.91]
  - - [1856, 1216, 1, 32]
    - [47, 4126.9]
  - - [1984, 1216, 1, 1]
    - [26, 123.72]
  - - [1984, 1216, 1, 16]
    - [24, 2086.52]
  - - [1984, 1216, 1, 32]
    - [41, 4173.05]
  - - [192, 1344, 1, 1]
    - [10, 19.8498]
  - - [192, 1344, 1, 16]
    - [72, 305.835]
  - - [192, 1344, 1, 32]
    - [10, 635.195]
  - - [448, 1344, 1, 1]
    - [116, 44.6009]
  - - [448, 1344, 1, 16]
    - [43, 688.128]
  - - [448, 1344, 1, 32]
    - [104, 1328.8]
  - - [704, 1344, 1, 1]
    - [80, 65.2535]
  - - [704, 1344, 1, 16]
    - [88, 976.698]
  - - [704, 1344, 1, 32]
    - [75, 1953.4]
  - - [960, 1344, 1, 1]
    - [55, 83.2413]
  - - [960, 1344, 1, 16]
    - [74, 1331.86]
  - - [960, 1344, 1, 32]
    - [77, 2663.72]
  - - [1216, 1344, 1, 1]
    - [69, 96.1355]
  - - [1216, 1344, 1, 16]
    - [81, 1538.17]
  - - [1216, 1344, 1, 32]
    - [26, 2988.44]
  - - [1472, 1344, 1, 1]
    - [81, 109.909]
  - - [1472, 1344, 1, 16]
    - [50, 1758.55]
  - - [1472, 1344, 1, 32]
    - [24, 3422.04]
  - - [1728, 1344, 1, 1]
    - [47, 122.233]
  - - [1728, 1344, 1, 16]
    - [43, 1955.73]
  - - [1728, 1344, 1, 32]
    - [70, 3911.46]
  - - [1984, 1344, 1, 1]
    - [13, 152.371]
  - - [1984, 1344, 1, 16]
    - [61, 2585.69]
  - - [1984, 1344, 1, 32]
    - [82, 5171.39]
  - - [1, 1472, 1, 64]
    - [15, 7.53664]
  - - [16, 1472, 1, 64]
    - [106, 125.611]
  - - [32, 1472, 1, 64]
    - [107, 241.172]
  - - [1, 1472, 1, 1]
    - [92, 0.11776]
  - - [1, 1472, 1, 16]
    - [64, 1.74459]
  - - [1, 1472, 1, 32]
    - [15, 3.62338]
  - - [16, 1472, 1, 1]
    - [92, 1.81169]
  - - [16, 1472, 1, 16]
    - [10, 27.9135]
  - - [16, 1472, 1, 32]
    - [62, 57.9742]
  - - [32, 1472, 1, 1]
    - [109, 3.62338]
  - - [32, 1472, 1, 16]
    - [62, 60.2931]
  - - [32, 1472, 1, 32]
    - [97, 115.948]
  - - [64, 1472, 1, 1]
    - [10, 6.97837]
  - - [64, 1472, 1, 16]
    - [11, 111.654]
  - - [64, 1472, 1, 32]
    - [19, 223.308]
  - - [192, 1472, 1, 1]
    - [11, 20.1874]
  - - [192, 1472, 1, 16]
    - [21, 334.962]
  - - [192, 1472, 1, 32]
    - [41, 669.924]
  - - [320, 1472, 1, 1]
    - [10, 32.4855]
  - - [320, 1472, 1, 16]
    - [10, 519.768]
  - - [320, 1472, 1, 32]
    - [10, 1039.54]
  - - [448, 1472, 1, 1]
    - [116, 47.104]
  - - [448, 1472, 1, 16]
    - [43, 727.676]
  - - [448, 1472, 1, 32]
    - [41, 1455.35]
  - - [576, 1472, 1, 1]
    - [95, 54.7014]
  - - [576, 1472, 1, 16]
    - [81, 935.583]
  - - [576, 1472, 1, 32]
    - [80, 1871.17]
  - - [704, 1472, 1, 1]
    - [69, 71.4681]
  - - [704, 1472, 1, 16]
    - [70, 1105.37]
  - - [704, 1472, 1, 32]
    - [70, 2210.75]
  - - [832, 1472, 1, 1]
    - [77, 81.6469]
  - - [832, 1472, 1, 16]
    - [74, 1224.7]
  - - [832, 1472, 1, 32]
    - [61, 2528.42]
  - - [960, 1472, 1, 1]
    - [55, 94.208]
  - - [960, 1472, 1, 16]
    - [58, 1413.12]
  - - [960, 1472, 1, 32]
    - [77, 2826.24]
  - - [1088, 1472, 1, 1]
    - [42, 91.5163]
  - - [1088, 1472, 1, 16]
    - [80, 1553.0]
  - - [1088, 1472, 1, 32]
    - [27, 2928.52]
  - - [1216, 1472, 1, 1]
    - [41, 105.291]
  - - [1216, 1472, 1, 16]
    - [5, 1636.53]
  - - [1216, 1472, 1, 32]
    - [49, 3369.32]
  - - [1344, 1472, 1, 1]
    - [82, 109.909]
  - - [1344, 1472, 1, 16]
    - [61, 1808.79]
  - - [1344, 1472, 1, 32]
    - [31, 3422.04]
  - - [1472, 1472, 1, 1]
    - [81, 120.377]
  - - [1472, 1472, 1, 16]
    - [3, 1926.03]
  - - [1472, 1472, 1, 32]
    - [5, 3747.95]
  - - [1600, 1472, 1, 1]
    - [9, 127.308]
  - - [1600, 1472, 1, 16]
    - [55, 2036.93]
  - - [1600, 1472, 1, 32]
    - [77, 4187.02]
  - - [1728, 1472, 1, 1]
    - [13, 149.624]
  - - [1728, 1472, 1, 16]
    - [61, 2393.99]
  - - [1728, 1472, 1, 32]
    - [13, 4787.98]
  - - [1856, 1472, 1, 1]
    - [82, 165.578]
  - - [1856, 1472, 1, 16]
    - [51, 2649.24]
  - - [1856, 1472, 1, 32]
    - [28, 4995.72]
  - - [1984, 1472, 1, 1]
    - [13, 171.791]
  - - [1984, 1472, 1, 16]
    - [13, 2748.66]
  - - [1984, 1472, 1, 32]
    - [50, 5497.31]
  - - [192, 1600, 1, 1]
    - [11, 24.576]
  - - [192, 1600, 1, 16]
    - [15, 378.092]
  - - [192, 1600, 1, 32]
    - [10, 728.178]
  - - [448, 1600, 1, 1]
    - [80, 49.4345]
  - - [448, 1600, 1, 16]
    - [88, 764.587]
  - - [448, 1600, 1, 32]
    - [42, 1581.9]
  - - [704, 1600, 1, 1]
    - [76, 70.4]
  - - [704, 1600, 1, 16]
    - [82, 1126.4]
  - - [704, 1600, 1, 32]
    - [69, 2325.47]
  - - [960, 1600, 1, 1]
    - [81, 93.0909]
  - - [960, 1600, 1, 16]
    - [80, 1489.45]
  - - [960, 1600, 1, 32]
    - [61, 2891.29]
  - - [1216, 1600, 1, 1]
    - [47, 108.089]
  - - [1216, 1600, 1, 16]
    - [82, 1778.83]
  - - [1216, 1600, 1, 32]
    - [61, 3458.84]
  - - [1472, 1600, 1, 1]
    - [24, 130.844]
  - - [1472, 1600, 1, 16]
    - [13, 2036.93]
  - - [1472, 1600, 1, 32]
    - [61, 4187.02]
  - - [1728, 1600, 1, 1]
    - [14, 162.635]
  - - [1728, 1600, 1, 16]
    - [13, 2602.16]
  - - [1728, 1600, 1, 32]
    - [13, 5055.63]
  - - [1984, 1600, 1, 1]
    - [9, 176.356]
  - - [1984, 1600, 1, 16]
    - [14, 2821.69]
  - - [1984, 1600, 1, 32]
    - [82, 5975.34]
  - - [1, 1728, 1, 64]
    - [15, 8.50708]
  - - [16, 1728, 1, 64]
    - [47, 141.558]
  - - [32, 1728, 1, 64]
    - [97, 272.226]
  - - [1, 1728, 1, 1]
    - [107, 0.132923]
  - - [1, 1728, 1, 16]
    - [17, 2.048]
  - - [1, 1728, 1, 32]
    - [16, 4.096]
  - - [16, 1728, 1, 1]
    - [115, 2.12677]
  - - [16, 1728, 1, 16]
    - [15, 34.0283]
  - - [16, 1728, 1, 32]
    - [17, 68.0566]
  - - [32, 1728, 1, 1]
    - [10, 3.94971]
  - - [32, 1728, 1, 16]
    - [10, 68.0566]
  - - [32, 1728, 1, 32]
    - [92, 136.113]
  - - [64, 1728, 1, 1]
    - [112, 8.192]
  - - [64, 1728, 1, 16]
    - [103, 131.072]
  - - [64, 1728, 1, 32]
    - [92, 272.226]
  - - [192, 1728, 1, 1]
    - [10, 24.576]
  - - [192, 1728, 1, 16]
    - [15, 393.216]
  - - [192, 1728, 1, 32]
    - [10, 786.432]
  - - [320, 1728, 1, 1]
    - [10, 42.5354]
  - - [320, 1728, 1, 16]
    - [13, 610.163]
  - - [320, 1728, 1, 32]
    - [116, 1263.91]
  - - [448, 1728, 1, 1]
    - [47, 53.3892]
  - - [448, 1728, 1, 16]
    - [69, 799.116]
  - - [448, 1728, 1, 32]
    - [70, 1708.46]
  - - [576, 1728, 1, 1]
    - [69, 66.3552]
  - - [576, 1728, 1, 16]
    - [70, 1061.68]
  - - [576, 1728, 1, 32]
    - [69, 2196.59]
  - - [704, 1728, 1, 1]
    - [76, 78.4846]
  - - [704, 1728, 1, 16]
    - [81, 1216.51]
  - - [704, 1728, 1, 32]
    - [70, 2359.3]
  - - [832, 1728, 1, 1]
    - [77, 87.1331]
  - - [832, 1728, 1, 16]
    - [75, 1484.07]
  - - [832, 1728, 1, 32]
    - [49, 2706.25]
  - - [960, 1728, 1, 1]
    - [47, 100.538]
  - - [960, 1728, 1, 16]
    - [42, 1516.69]
  - - [960, 1728, 1, 32]
    - [42, 3033.38]
  - - [1088, 1728, 1, 1]
    - [47, 107.432]
  - - [1088, 1728, 1, 16]
    - [42, 1718.92]
  - - [1088, 1728, 1, 32]
    - [81, 3342.34]
  - - [1216, 1728, 1, 1]
    - [43, 116.736]
  - - [1216, 1728, 1, 16]
    - [61, 1817.3]
  - - [1216, 1728, 1, 32]
    - [61, 3634.59]
  - - [1344, 1728, 1, 1]
    - [26, 122.233]
  - - [1344, 1728, 1, 16]
    - [70, 1955.73]
  - - [1344, 1728, 1, 32]
    - [69, 4128.77]
  - - [1472, 1728, 1, 1]
    - [81, 158.976]
  - - [1472, 1728, 1, 16]
    - [61, 2466.54]
  - - [1472, 1728, 1, 32]
    - [14, 4787.98]
  - - [1600, 1728, 1, 1]
    - [13, 162.635]
  - - [1600, 1728, 1, 16]
    - [13, 2681.02]
  - - [1600, 1728, 1, 32]
    - [13, 5362.04]
  - - [1728, 1728, 1, 1]
    - [38, 180.969]
  - - [1728, 1728, 1, 16]
    - [81, 2810.34]
  - - [1728, 1728, 1, 32]
    - [82, 5620.68]
  - - [1856, 1728, 1, 1]
    - [13, 188.657]
  - - [1856, 1728, 1, 16]
    - [9, 2932.27]
  - - [1856, 1728, 1, 32]
    - [61, 5701.63]
  - - [1984, 1728, 1, 1]
    - [8, 190.464]
  - - [1984, 1728, 1, 16]
    - [13, 3047.42]
  - - [1984, 1728, 1, 32]
    - [82, 6094.85]
  - - [192, 1856, 1, 1]
    - [10, 27.4117]
  - - [192, 1856, 1, 16]
    - [47, 456.131]
  - - [192, 1856, 1, 32]
    - [15, 877.174]
  - - [448, 1856, 1, 1]
    - [80, 59.392]
  - - [448, 1856, 1, 16]
    - [47, 886.921]
  - - [448, 1856, 1, 32]
    - [70, 1835.01]
  - - [704, 1856, 1, 1]
    - [51, 81.664]
  - - [704, 1856, 1, 16]
    - [74, 1306.62]
  - - [704, 1856, 1, 32]
    - [82, 2697.55]
  - - [960, 1856, 1, 1]
    - [81, 107.985]
  - - [960, 1856, 1, 16]
    - [82, 1676.95]
  - - [960, 1856, 1, 32]
    - [82, 3353.9]
  - - [1216, 1856, 1, 1]
    - [81, 121.994]
  - - [1216, 1856, 1, 16]
    - [81, 1900.54]
  - - [1216, 1856, 1, 32]
    - [61, 3903.82]
  - - [1472, 1856, 1, 1]
    - [9, 165.578]
  - - [1472, 1856, 1, 16]
    - [9, 2497.86]
  - - [1472, 1856, 1, 32]
    - [81, 5142.65]
  - - [1728, 1856, 1, 1]
    - [9, 183.267]
  - - [1728, 1856, 1, 16]
    - [61, 2932.27]
  - - [1728, 1856, 1, 32]
    - [49, 5864.54]
  - - [1984, 1856, 1, 1]
    - [81, 204.572]
  - - [1984, 1856, 1, 16]
    - [81, 3273.16]
  - - [1984, 1856, 1, 32]
    - [49, 6733.36]
  - - [1, 1984, 1, 64]
    - [103, 11.0414]
  - - [16, 1984, 1, 64]
    - [102, 169.301]
  - - [32, 1984, 1, 64]
    - [92, 325.059]
  - - [1, 1984, 1, 1]
    - [107, 0.152615]
  - - [1, 1984, 1, 16]
    - [94, 2.35141]
  - - [1, 1984, 1, 32]
    - [92, 4.88369]
  - - [16, 1984, 1, 1]
    - [62, 2.44185]
  - - [16, 1984, 1, 16]
    - [11, 37.6225]
  - - [16, 1984, 1, 32]
    - [106, 78.1391]
  - - [32, 1984, 1, 1]
    - [80, 4.88369]
  - - [32, 1984, 1, 16]
    - [111, 78.1391]
  - - [32, 1984, 1, 32]
    - [85, 156.278]
  - - [64, 1984, 1, 1]
    - [15, 9.40563]
  - - [64, 1984, 1, 16]
    - [15, 156.278]
  - - [64, 1984, 1, 32]
    - [17, 312.556]
  - - [192, 1984, 1, 1]
    - [10, 26.2709]
  - - [192, 1984, 1, 16]
    - [11, 435.346]
  - - [192, 1984, 1, 32]
    - [104, 902.94]
  - - [320, 1984, 1, 1]
    - [39, 43.7848]
  - - [320, 1984, 1, 16]
    - [21, 655.36]
  - - [320, 1984, 1, 32]
    - [26, 1401.11]
  - - [448, 1984, 1, 1]
    - [77, 57.344]
  - - [448, 1984, 1, 16]
    - [27, 917.504]
  - - [448, 1984, 1, 32]
    - [78, 1835.01]
  - - [576, 1984, 1, 1]
    - [70, 78.8127]
  - - [576, 1984, 1, 16]
    - [88, 1179.65]
  - - [576, 1984, 1, 32]
    - [74, 2359.3]
  - - [704, 1984, 1, 1]
    - [57, 84.6507]
  - - [704, 1984, 1, 16]
    - [55, 1396.74]
  - - [704, 1984, 1, 32]
    - [74, 2793.47]
  - - [832, 1984, 1, 1]
    - [47, 94.325]
  - - [832, 1984, 1, 16]
    - [43, 1467.28]
  - - [832, 1984, 1, 32]
    - [49, 3107.18]
  - - [960, 1984, 1, 1]
    - [70, 108.837]
  - - [960, 1984, 1, 16]
    - [81, 1741.39]
  - - [960, 1984, 1, 32]
    - [41, 3482.77]
  - - [1088, 1984, 1, 1]
    - [3, 116.681]
  - - [1088, 1984, 1, 16]
    - [43, 1918.75]
  - - [1088, 1984, 1, 32]
    - [31, 3837.5]
  - - [1216, 1984, 1, 1]
    - [43, 126.976]
  - - [1216, 1984, 1, 16]
    - [27, 2086.52]
  - - [1216, 1984, 1, 32]
    - [61, 4678.87]
  - - [1344, 1984, 1, 1]
    - [50, 161.606]
  - - [1344, 1984, 1, 16]
    - [24, 2585.69]
  - - [1344, 1984, 1, 32]
    - [13, 5019.29]
  - - [1472, 1984, 1, 1]
    - [56, 171.791]
  - - [1472, 1984, 1, 16]
    - [26, 2670.12]
  - - [1472, 1984, 1, 32]
    - [31, 5497.31]
  - - [1600, 1984, 1, 1]
    - [8, 181.394]
  - - [1600, 1984, 1, 16]
    - [9, 2902.31]
  - - [1600, 1984, 1, 32]
    - [49, 5643.38]
  - - [1728, 1984, 1, 1]
    - [81, 195.906]
  - - [1728, 1984, 1, 16]
    - [8, 2965.06]
  - - [1728, 1984, 1, 32]
    - [14, 5930.12]
  - - [1856, 1984, 1, 1]
    - [83, 204.572]
  - - [1856, 1984, 1, 16]
    - [35, 3184.7]
  - - [1856, 1984, 1, 32]
    - [14, 6369.39]
  - - [1984, 1984, 1, 1]
    - [3, 212.771]
  - - [1984, 1984, 1, 16]
    - [3, 3314.74]
  - - [192, 1, 1, 256]
    - [10, 3.78092]
  - - [192, 16, 1, 256]
    - [101, 62.9146]
  - - [192, 32, 1, 256]
    - [79, 125.829]
  - - [448, 1, 1, 256]
    - [108, 9.17504]
  - - [448, 16, 1, 256]
    - [99, 146.801]
  - - [448, 32, 1, 256]
    - [99, 305.835]
  - - [704, 1, 1, 256]
    - [98, 13.8634]
  - - [704, 16, 1, 256]
    - [101, 213.599]
  - - [704, 32, 1, 256]
    - [104, 427.198]
  - - [960, 1, 1, 256]
    - [92, 17.5543]
  - - [960, 16, 1, 256]
    - [100, 291.271]
  - - [960, 32, 1, 256]
    - [114, 582.542]
  - - [1216, 1, 1, 256]
    - [110, 24.9037]
  - - [1216, 16, 1, 256]
    - [99, 368.943]
  - - [1216, 32, 1, 256]
    - [93, 737.887]
  - - [1472, 1, 1, 256]
    - [10, 28.9871]
  - - [1472, 16, 1, 256]
    - [102, 446.616]
  - - [1472, 32, 1, 256]
    - [100, 893.231]
  - - [1728, 1, 1, 256]
    - [107, 32.768]
  - - [1728, 16, 1, 256]
    - [102, 544.453]
  - - [1728, 32, 1, 256]
    - [109, 1088.91]
  - - [1984, 1, 1, 256]
    - [106, 39.0695]
  - - [1984, 16, 1, 256]
    - [15, 601.96]
  - - [1984, 32, 1, 256]
    - [114, 1160.92]
  - - [1, 192, 1, 256]
    - [99, 3.51086]
  - - [16, 192, 1, 256]
    - [105, 60.4948]
  - - [32, 192, 1, 256]
    - [118, 125.829]
  - - [1, 448, 1, 256]
    - [110, 9.17504]
  - - [16, 448, 1, 256]
    - [86, 141.154]
  - - [32, 448, 1, 256]
    - [99, 271.853]
  - - [1, 704, 1, 256]
    - [63, 13.3499]
  - - [16, 704, 1, 256]
    - [98, 213.599]
  - - [32, 704, 1, 256]
    - [110, 480.597]
  - - [1, 960, 1, 256]
    - [106, 19.6608]
  - - [16, 960, 1, 256]
    - [65, 302.474]
  - - [32, 960, 1, 256]
    - [105, 604.948]
  - - [1, 1216, 1, 256]
    - [118, 24.9037]
  - - [16, 1216, 1, 256]
    - [105, 398.459]
  - - [32, 1216, 1, 256]
    - [100, 796.918]
  - - [1, 1472, 1, 256]
    - [118, 30.1466]
  - - [16, 1472, 1, 256]
    - [79, 463.793]
  - - [32, 1472, 1, 256]
    - [113, 893.231]
  - - [1, 1728, 1, 256]
    - [109, 34.0283]
  - - [16, 1728, 1, 256]
    - [108, 566.231]
  - - [32, 1728, 1, 256]
    - [109, 1132.46]
  - - [1, 1984, 1, 256]
    - [98, 40.6323]
  - - [16, 1984, 1, 256]
    - [10, 625.113]
  - - [32, 1984, 1, 256]
    - [99, 1354.41]
  - - [192, 1, 1, 512]
    - [100, 7.56185]
  - - [192, 16, 1, 512]
    - [98, 125.829]
  - - [192, 32, 1, 512]
    - [86, 241.979]
  - - [448, 1, 1, 512]
    - [100, 17.6443]
  - - [448, 16, 1, 512]
    - [79, 282.309]
  - - [448, 32, 1, 512]
    - [79, 564.618]
  - - [704, 1, 1, 512]
    - [109, 27.7268]
  - - [704, 16, 1, 512]
    - [79, 443.628]
  - - [704, 32, 1, 512]
    - [62, 854.395]
  - - [960, 1, 1, 512]
    - [86, 36.4089]
  - - [960, 16, 1, 512]
    - [79, 582.542]
  - - [960, 32, 1, 512]
    - [100, 1209.9]
  - - [1216, 1, 1, 512]
    - [86, 46.1179]
  - - [1216, 16, 1, 512]
    - [85, 766.267]
  - - [1216, 32, 1, 512]
    - [107, 1532.53]
  - - [1472, 1, 1, 512]
    - [65, 55.827]
  - - [1472, 16, 1, 512]
    - [98, 893.231]
  - - [1472, 32, 1, 512]
    - [20, 1786.46]
  - - [1728, 1, 1, 512]
    - [62, 65.536]
  - - [1728, 16, 1, 512]
    - [118, 1048.58]
  - - [1728, 32, 1, 512]
    - [112, 2177.81]
  - - [1984, 1, 1, 512]
    - [62, 75.245]
  - - [1984, 16, 1, 512]
    - [40, 1203.92]
  - - [1984, 32, 1, 512]
    - [100, 2500.45]
  - - [1, 192, 1, 512]
    - [113, 7.86432]
  - - [16, 192, 1, 512]
    - [86, 116.508]
  - - [32, 192, 1, 512]
    - [93, 251.658]
  - - [1, 448, 1, 512]
    - [79, 17.6443]
  - - [16, 448, 1, 512]
    - [62, 282.309]
  - - [32, 448, 1, 512]
    - [93, 611.669]
  - - [1, 704, 1, 512]
    - [79, 28.8358]
  - - [16, 704, 1, 512]
    - [79, 461.373]
  - - [32, 704, 1, 512]
    - [93, 854.395]
  - - [1, 960, 1, 512]
    - [100, 37.8092]
  - - [16, 960, 1, 512]
    - [79, 604.948]
  - - [32, 960, 1, 512]
    - [93, 1209.9]
  - - [1, 1216, 1, 512]
    - [110, 49.8074]
  - - [16, 1216, 1, 512]
    - [79, 766.267]
  - - [32, 1216, 1, 512]
    - [110, 1532.53]
  - - [1, 1472, 1, 512]
    - [86, 57.9742]
  - - [16, 1472, 1, 512]
    - [118, 927.586]
  - - [32, 1472, 1, 512]
    - [99, 1929.38]
  - - [1, 1728, 1, 512]
    - [85, 68.0566]
  - - [16, 1728, 1, 512]
    - [109, 1132.46]
  - - [32, 1728, 1, 512]
    - [107, 2264.92]
  - - [1, 1984, 1, 512]
    - [109, 81.2646]
  - - [16, 1984, 1, 512]
    - [113, 1300.23]
  - - [32, 1984, 1, 512]
    - [10, 2407.84]
  - - [192, 1, 1, 1024]
    - [62, 14.5636]
  - - [192, 16, 1, 1024]
    - [93, 233.017]
  - - [192, 32, 1, 1024]
    - [62, 483.958]
  - - [448, 1, 1, 1024]
    - [101, 33.9816]
  - - [448, 16, 1, 1024]
    - [109, 543.706]
  - - [448, 32, 1, 1024]
    - [93, 1087.41]
  - - [704, 1, 1, 1024]
    - [62, 51.4926]
  - - [704, 16, 1, 1024]
    - [62, 823.881]
  - - [704, 32, 1, 1024]
    - [86, 1647.76]
  - - [960, 1, 1, 1024]
    - [62, 65.536]
  - - [960, 16, 1, 1024]
    - [108, 1123.47]
  - - [960, 32, 1, 1024]
    - [109, 2246.95]
  - - [1216, 1, 1, 1024]
    - [93, 85.8748]
  - - [1216, 16, 1, 1024]
    - [110, 1374.0]
  - - [1216, 32, 1, 1024]
    - [19, 2656.39]
  - - [1472, 1, 1, 1024]
    - [62, 97.247]
  - - [1472, 16, 1, 1024]
    - [10, 1555.95]
  - - [1472, 32, 1, 1024]
    - [100, 3215.63]
  - - [1728, 1, 1, 1024]
    - [106, 117.965]
  - - [1728, 16, 1, 1024]
    - [86, 1826.55]
  - - [1728, 32, 1, 1024]
    - [101, 3653.1]
  - - [1984, 1, 1, 1024]
    - [93, 131.072]
  - - [1984, 16, 1, 1024]
    - [100, 2097.15]
  - - [1984, 32, 1, 1024]
    - [86, 4334.11]
  - - [1, 192, 1, 1024]
    - [93, 14.5636]
  - - [16, 192, 1, 1024]
    - [62, 233.017]
  - - [32, 192, 1, 1024]
    - [118, 466.034]
  - - [1, 448, 1, 1024]
    - [101, 35.2886]
  - - [16, 448, 1, 1024]
    - [105, 543.706]
  - - [32, 448, 1, 1024]
    - [109, 1129.24]
  - - [1, 704, 1, 1024]
    - [100, 55.4535]
  - - [16, 704, 1, 1024]
    - [86, 887.257]
  - - [32, 704, 1, 1024]
    - [86, 1774.51]
  - - [1, 960, 1, 1024]
    - [79, 72.8178]
  - - [16, 960, 1, 1024]
    - [62, 1165.08]
  - - [32, 960, 1, 1024]
    - [79, 2330.17]
  - - [1, 1216, 1, 1024]
    - [100, 95.7834]
  - - [16, 1216, 1, 1024]
    - [62, 1475.77]
  - - [32, 1216, 1, 1024]
    - [62, 2951.55]
  - - [1, 1472, 1, 1024]
    - [62, 107.666]
  - - [16, 1472, 1, 1024]
    - [93, 1786.46]
  - - [32, 1472, 1, 1024]
    - [62, 3572.93]
  - - [1, 1728, 1, 1024]
    - [109, 126.391]
  - - [16, 1728, 1, 1024]
    - [93, 2177.81]
  - - [32, 1728, 1, 1024]
    - [62, 4044.51]
  - - [1, 1984, 1, 1024]
    - [79, 150.49]
  - - [16, 1984, 1, 1024]
    - [16, 2321.85]
  - - [32, 1984, 1, 1024]
    - [100, 4643.69]
  - - [192, 1, 1, 2048]
    - [62, 26.2144]
  - - [192, 16, 1, 2048]
    - [100, 433.894]
  - - [192, 32, 1, 2048]
    - [62, 838.861]
  - - [448, 1, 1, 2048]
    - [62, 63.2761]
  - - [448, 16, 1, 2048]
    - [62, 978.671]
  - - [448, 32, 1, 2048]
    - [100, 2024.84]
  - - [704, 1, 1, 2048]
    - [62, 96.1195]
  - - [704, 16, 1, 2048]
    - [118, 1590.94]
  - - [704, 32, 1, 2048]
    - [62, 2976.6]
  - - [960, 1, 1, 2048]
    - [100, 131.072]
  - - [960, 16, 1, 2048]
    - [62, 1966.08]
  - - [960, 32, 1, 2048]
    - [109, 4059.0]
  - - [1216, 1, 1, 2048]
    - [93, 160.669]
  - - [1216, 16, 1, 2048]
    - [118, 2570.7]
  - - [1216, 32, 1, 2048]
    - [100, 4829.8]
  - - [1472, 1, 1, 2048]
    - [93, 182.706]
  - - [1472, 16, 1, 2048]
    - [62, 2923.3]
  - - [1472, 32, 1, 2048]
    - [100, 5846.61]
  - - [1728, 1, 1, 2048]
    - [62, 208.173]
  - - [1728, 16, 1, 2048]
    - [101, 3431.7]
  - - [1728, 32, 1, 2048]
    - [65, 7306.21]
  - - [1984, 1, 1, 2048]
    - [110, 270.882]
  - - [1984, 16, 1, 2048]
    - [105, 4194.3]
  - - [1, 192, 1, 2048]
    - [62, 27.1183]
  - - [16, 192, 1, 2048]
    - [62, 433.894]
  - - [32, 192, 1, 2048]
    - [20, 867.787]
  - - [1, 448, 1, 2048]
    - [93, 65.536]
  - - [16, 448, 1, 2048]
    - [100, 1012.42]
  - - [32, 448, 1, 2048]
    - [62, 2097.15]
  - - [1, 704, 1, 2048]
    - [62, 99.4339]
  - - [16, 704, 1, 2048]
    - [62, 1590.94]
  - - [32, 704, 1, 2048]
    - [86, 3181.89]
  - - [1, 960, 1, 2048]
    - [62, 135.592]
  - - [16, 960, 1, 2048]
    - [118, 2246.95]
  - - [32, 960, 1, 2048]
    - [100, 4493.9]
  - - [1, 1216, 1, 2048]
    - [118, 171.75]
  - - [16, 1216, 1, 2048]
    - [62, 2747.99]
  - - [32, 1216, 1, 2048]
    - [100, 5692.27]
  - - [1, 1472, 1, 2048]
    - [109, 215.333]
  - - [16, 1472, 1, 2048]
    - [109, 3326.52]
  - - [32, 1472, 1, 2048]
    - [100, 6653.03]
  - - [1, 1728, 1, 2048]
    - [79, 244.065]
  - - [16, 1728, 1, 2048]
    - [64, 3905.04]
  - - [32, 1728, 1, 2048]
    - [20, 7810.08]
  - - [1, 1984, 1, 2048]
    - [93, 290.231]
  - - [16, 1984, 1, 2048]
    - [93, 4643.69]
  - - [192, 1, 1, 4096]
    - [86, 47.6625]
  - - [192, 16, 1, 4096]
    - [100, 762.601]
  - - [192, 32, 1, 4096]
    - [62, 1480.34]
  - - [448, 1, 1, 4096]
    - [62, 107.942]
  - - [448, 16, 1, 4096]
    - [86, 1727.07]
  - - [448, 32, 1, 4096]
    - [62, 3558.8]
  - - [704, 1, 1, 4096]
    - [86, 164.776]
  - - [704, 16, 1, 4096]
    - [62, 2636.42]
  - - [704, 32, 1, 4096]
    - [62, 5272.84]
  - - [960, 1, 1, 4096]
    - [109, 245.76]
  - - [960, 16, 1, 4096]
    - [100, 3700.86]
  - - [1216, 1, 1, 4096]
    - [100, 311.296]
  - - [1216, 16, 1, 4096]
    - [100, 4980.74]
  - - [1472, 1, 1, 4096]
    - [86, 354.665]
  - - [1472, 16, 1, 4096]
    - [100, 6029.31]
  - - [1728, 1, 1, 4096]
    - [86, 442.368]
  - - [1728, 16, 1, 4096]
    - [86, 6863.41]
  - - [1984, 1, 1, 4096]
    - [86, 492.513]
  - - [1, 192, 1, 4096]
    - [118, 49.152]
  - - [16, 192, 1, 4096]
    - [62, 762.601]
  - - [32, 192, 1, 4096]
    - [62, 1525.2]
  - - [1, 448, 1, 4096]
    - [62, 114.688]
  - - [16, 448, 1, 4096]
    - [86, 1779.4]
  - - [32, 448, 1, 4096]
    - [100, 3670.02]
  - - [1, 704, 1, 4096]
    - [62, 174.763]
  - - [16, 704, 1, 4096]
    - [100, 2796.2]
  - - [32, 704, 1, 4096]
    - [86, 5592.41]
  - - [1, 960, 1, 4096]
    - [109, 253.688]
  - - [16, 960, 1, 4096]
    - [109, 3932.16]
  - - [1, 1216, 1, 4096]
    - [118, 321.338]
  - - [16, 1216, 1, 4096]
    - [79, 5141.4]
  - - [1, 1472, 1, 4096]
    - [106, 388.988]
  - - [16, 1472, 1, 4096]
    - [105, 6223.81]
  - - [1, 1728, 1, 4096]
    - [105, 442.368]
  - - [16, 1728, 1, 4096]
    - [63, 7077.89]
  - - [1, 1984, 1, 4096]
    - [105, 507.904]
  - - [128, 1, 1, 64]
    - [65, 0.682667]
  - - [128, 16, 1, 64]
    - [92, 10.4858]
  - - [128, 32, 1, 64]
    - [10, 19.4181]
  - - [128, 1, 1, 1]
    - [10, 0.00948148]
  - - [128, 1, 1, 16]
    - [65, 0.16384]
  - - [128, 1, 1, 32]
    - [10, 0.303407]
  - - [128, 16, 1, 1]
    - [10, 0.151704]
  - - [128, 16, 1, 16]
    - [10, 2.34057]
  - - [128, 16, 1, 32]
    - [10, 4.85452]
  - - [128, 32, 1, 1]
    - [107, 0.315077]
  - - [128, 32, 1, 16]
    - [10, 4.68114]
  - - [128, 32, 1, 32]
    - [10, 9.70904]
  - - [128, 64, 1, 1]
    - [92, 0.630154]
  - - [128, 64, 1, 16]
    - [15, 9.70904]
  - - [128, 64, 1, 32]
    - [97, 20.1649]
  - - [256, 1, 1, 64]
    - [62, 1.26031]
  - - [256, 16, 1, 64]
    - [10, 19.4181]
  - - [256, 32, 1, 64]
    - [15, 40.3298]
  - - [256, 64, 1, 1]
    - [85, 1.26031]
  - - [256, 64, 1, 16]
    - [15, 20.9715]
  - - [256, 64, 1, 32]
    - [10, 38.8361]
  - - [384, 1, 1, 64]
    - [11, 1.82044]
  - - [384, 16, 1, 64]
    - [16, 30.2474]
  - - [384, 32, 1, 64]
    - [10, 58.2542]
  - - [384, 1, 1, 1]
    - [15, 0.0295385]
  - - [384, 1, 1, 16]
    - [104, 0.472615]
  - - [384, 1, 1, 32]
    - [16, 0.945231]
