projects/hipblaslt/library/src/amd_detail/rocblaslt/src/Tensile/Logic/asm_full/navi31/GridBased/navi31_Cijk_Alik_Bljk_HHS_BH_Bias_HAS_SAV_UserArgs.yaml
- {MinimumRequiredVersion: 5.0.0}
- navi31
- gfx1100
- [Device 73f0]
    SolutionIndex: 4
    SolutionNameMin: Cijk_Alik_Bljk_HHS_BH_Bias_HA_S_SAV_UserArgs_MT96x128x64_MI16x16x1_SN_LDSB0_AFC1_AG0_AFEM1_AFEM1_ASEM1_CLR0_CADS0_DTLA0_DTLB0_DTVA0_DTVB0_EPS0_FDSI0_GRPM1_GRVWA8_GRVWB8_GSU1_GSUAMB_GSUC0_GSUWGMRR0_GLS0_ISA1100_IU1_K1_LDSTI0_LBSPPA128_LBSPPB128_LBSPPM0_LPA8_LPB8_LPM0_LRVW16_LWPMn1_MIAV1_MIWT6_2_MO40_NTn1_NTA0_NTB0_NTC0_NTD0_NTM0_NEPBS0_NLCA1_NLCB1_ONLL1_PGR0_PLR0_PKA0_SIA3_SS1_SU32_SUM1_SUS256_SPO0_SRVW0_SSO0_SVW1_SK0_SKFTR0_SKXCCM0_TLDS1_ULSGRO0_USL1_UIOFGRO0_USFGROn1_VSn1_VWA1_VWB1_WSGRA0_WSGRB0_WS32_WG16_8_1_WGM8_WGMXCC1_WGMXCCGn1
    SolutionIndex: 6
    SolutionNameMin: Cijk_Alik_Bljk_HHS_BH_Bias_HA_S_SAV_UserArgs_MT96x128x64_MI16x16x1_SN_LDSB0_AFC1_AG0_AFEM1_AFEM1_ASEM1_CLR0_CADS0_DTLA0_DTLB0_DTVA0_DTVB0_EPS0_FDSI0_GRPM1_GRVWA8_GRVWB8_GSU1_GSUAMB_GSUC0_GSUWGMRR0_GLS0_ISA1100_IU1_K1_LDSTI0_LBSPPA128_LBSPPB128_LBSPPM0_LPA8_LPB8_LPM0_LRVW16_LWPMn1_MIAV1_MIWT3_4_MO40_NTn1_NTA0_NTB0_NTC0_NTD0_NTM0_NEPBS0_NLCA1_NLCB1_ONLL1_PGR0_PLR0_PKA0_SIA3_SS1_SU32_SUM1_SUS256_SPO0_SRVW0_SSO0_SVW1_SK0_SKFTR0_SKXCCM0_TLDS1_ULSGRO0_USL1_UIOFGRO0_USFGROn1_VSn1_VWA1_VWB1_WSGRA0_WSGRB0_WS32_WG32_4_1_WGM8_WGMXCC1_WGMXCCGn1
    SolutionIndex: 7
    SolutionNameMin: Cijk_Alik_Bljk_HHS_BH_Bias_HA_S_SAV_UserArgs_MT96x96x64_MI16x16x1_SN_LDSB0_AFC1_AG0_AFEM1_AFEM1_ASEM1_CLR0_CADS0_DTLA0_DTLB0_DTVA0_DTVB0_EPS0_FDSI0_GRPM1_GRVWA8_GRVWB8_GSU1_GSUAMB_GSUC0_GSUWGMRR0_GLS0_ISA1100_IU1_K1_LDSTI0_LBSPPA128_LBSPPB128_LBSPPM0_LPA8_LPB8_LPM0_LRVW16_LWPMn1_MIAV1_MIWT3_3_MO40_NTn1_NTA0_NTB0_NTC0_NTD0_NTM0_NEPBS0_NLCA1_NLCB1_ONLL1_PGR1_PLR1_PKA0_SIA3_SS1_SU32_SUM1_SUS256_SPO0_SRVW0_SSO0_SVW1_SK0_SKFTR0_SKXCCM0_TLDS1_ULSGRO0_USL1_UIOFGRO0_USFGROn1_VSn1_VWA1_VWB1_WSGRA0_WSGRB0_WS32_WG32_4_1_WGM8_WGMXCC1_WGMXCCGn1
    SolutionIndex: 8
    SolutionNameMin: Cijk_Alik_Bljk_HHS_BH_Bias_HA_S_SAV_UserArgs_MT96x96x64_MI16x16x1_SN_LDSB0_AFC1_AG0_AFEM1_AFEM1_ASEM1_CLR0_CADS0_DTLA0_DTLB0_DTVA0_DTVB0_EPS0_FDSI0_GRPM1_GRVWA8_GRVWB8_GSU1_GSUAMB_GSUC0_GSUWGMRR0_GLS0_ISA1100_IU1_K1_LDSTI0_LBSPPA128_LBSPPB128_LBSPPM0_LPA8_LPB8_LPM0_LRVW16_LWPMn1_MIAV1_MIWT3_3_MO40_NTn1_NTA0_NTB0_NTC0_NTD0_NTM0_NEPBS0_NLCA1_NLCB1_ONLL1_PGR2_PLR1_PKA0_SIA3_SS1_SU32_SUM1_SUS256_SPO0_SRVW0_SSO0_SVW1_SK0_SKFTR0_SKXCCM0_TLDS1_ULSGRO0_USL1_UIOFGRO0_USFGROn1_VSn1_VWA1_VWB1_WSGRA0_WSGRB0_WS32_WG32_4_1_WGM8_WGMXCC1_WGMXCCGn1
    SolutionIndex: 13
    SolutionNameMin: Cijk_Alik_Bljk_HHS_BH_Bias_HA_S_SAV_UserArgs_MT128x96x64_MI16x16x1_SN_LDSB0_AFC1_AG0_AFEM1_AFEM1_ASEM1_CLR0_CADS0_DTLA0_DTLB0_DTVA0_DTVB0_EPS0_FDSI0_GRPM1_GRVWA8_GRVWB8_GSU1_GSUAMB_GSUC0_GSUWGMRR0_GLS0_ISA1100_IU1_K1_LDSTI0_LBSPPA128_LBSPPB128_LBSPPM0_LPA8_LPB8_LPM0_LRVW16_LWPMn1_MIAV1_MIWT4_3_MO40_NTn1_NTA0_NTB0_NTC0_NTD0_NTM0_NEPBS0_NLCA1_NLCB1_ONLL1_PGR0_PLR0_PKA0_SIA3_SS1_SU32_SUM1_SUS256_SPO0_SRVW0_SSO0_SVW1_SK0_SKFTR0_SKXCCM0_TLDS1_ULSGRO0_USL1_UIOFGRO0_USFGROn1_VSn1_VWA1_VWB1_WSGRA0_WSGRB0_WS32_WG32_4_1_WGM8_WGMXCC1_WGMXCCGn1
    SolutionIndex: 14
    SolutionNameMin: Cijk_Alik_Bljk_HHS_BH_Bias_HA_S_SAV_UserArgs_MT80x128x64_MI16x16x1_SN_LDSB1_AFC1_AG0_AFEM1_AFEM1_ASEM1_CLR0_CADS0_DTLA0_DTLB0_DTVA0_DTVB0_EPS0_FDSI0_GRPM1_GRVWA8_GRVWB8_GSU1_GSUAMB_GSUC0_GSUWGMRR0_GLS0_ISA1100_IU1_K1_LDSTI0_LBSPPA128_LBSPPB128_LBSPPM0_LPA8_LPB8_LPM0_LRVW16_LWPMn1_MIAV1_MIWT5_2_MO40_NTn1_NTA0_NTB0_NTC0_NTD0_NTM0_NEPBS0_NLCA1_NLCB1_ONLL1_PGR2_PLR1_PKA0_SIA3_SS1_SU32_SUM1_SUS256_SPO0_SRVW0_SSO0_SVW1_SK0_SKFTR0_SKXCCM0_TLDS1_ULSGRO0_USL1_UIOFGRO0_USFGROn1_VSn1_VWA1_VWB1_WSGRA0_WSGRB0_WS32_WG16_8_1_WGM8_WGMXCC1_WGMXCCGn1
    SolutionIndex: 15
    SolutionNameMin: Cijk_Alik_Bljk_HHS_BH_Bias_HA_S_SAV_UserArgs_MT64x48x128_MI16x16x1_SN_LDSB0_AFC1_AG0_AFEM1_AFEM1_ASEM1_CLR0_CADS0_DTLA0_DTLB0_DTVA0_DTVB0_EPS0_FDSI0_GRPM1_GRVWA8_GRVWB8_GSU1_GSUAMB_GSUC0_GSUWGMRR0_GLS0_ISA1100_IU1_K1_LDSTI0_LBSPPA256_LBSPPB256_LBSPPM0_LPA8_LPB8_LPM0_LRVW16_LWPMn1_MIAV1_MIWT1_3_MO40_NTn1_NTA0_NTB0_NTC0_NTD0_NTM0_NEPBS0_NLCA1_NLCB1_ONLL1_PGR2_PLR1_PKA0_SIA3_SS1_SU32_SUM1_SUS256_SPO0_SRVW0_SSO0_SVW1_SK0_SKFTR0_SKXCCM0_TLDS1_ULSGRO0_USL1_UIOFGRO0_USFGROn1_VSn1_VWA1_VWB1_WSGRA0_WSGRB0_WS32_WG64_2_1_WGM8_WGMXCC1_WGMXCCGn1
    SolutionIndex: 16
    SolutionNameMin: Cijk_Alik_Bljk_HHS_BH_Bias_HA_S_SAV_UserArgs_MT64x64x32_MI16x16x1_SN_LDSB0_AFC1_AG0_AFEM1_AFEM1_ASEM1_CLR0_CADS0_DTLA0_DTLB0_DTVA0_DTVB0_EPS0_FDSI0_GRPM1_GRVWA8_GRVWB8_GSU1_GSUAMB_GSUC0_GSUWGMRR0_GLS0_ISA1100_IU1_K1_LDSTI0_LBSPPA128_LBSPPB128_LBSPPM0_LPA8_LPB8_LPM0_LRVW16_LWPMn1_MIAV1_MIWT2_2_MO40_NTn1_NTA0_NTB0_NTC0_NTD0_NTM0_NEPBS0_NLCA1_NLCB1_ONLL1_PGR2_PLR0_PKA0_SIA1_SS1_SU32_SUM1_SUS256_SPO0_SRVW0_SSO0_SVW1_SK0_SKFTR0_SKXCCM0_TLDS1_ULSGRO0_USL1_UIOFGRO0_USFGROn1_VSn1_VWA1_VWB1_WSGRA0_WSGRB0_WS32_WG32_4_1_WGM8_WGMXCC1_WGMXCCGn1
    SolutionIndex: 17
    SolutionNameMin: Cijk_Alik_Bljk_HHS_BH_Bias_HA_S_SAV_UserArgs_MT64x64x64_MI16x16x1_SN_LDSB0_AFC1_AG0_AFEM1_AFEM1_ASEM1_CLR0_CADS0_DTLA0_DTLB0_DTVA0_DTVB0_EPS0_FDSI0_GRPM1_GRVWA8_GRVWB8_GSU1_GSUAMB_GSUC0_GSUWGMRR0_GLS0_ISA1100_IU1_K1_LDSTI0_LBSPPA128_LBSPPB128_LBSPPM0_LPA8_LPB8_LPM0_LRVW16_LWPMn1_MIAV1_MIWT2_2_MO40_NTn1_NTA0_NTB0_NTC0_NTD0_NTM0_NEPBS0_NLCA1_NLCB1_ONLL1_PGR2_PLR1_PKA0_SIA1_SS1_SU32_SUM1_SUS256_SPO0_SRVW0_SSO0_SVW1_SK0_SKFTR0_SKXCCM0_TLDS1_ULSGRO0_USL1_UIOFGRO0_USFGROn1_VSn1_VWA1_VWB1_WSGRA0_WSGRB0_WS32_WG32_4_1_WGM8_WGMXCC1_WGMXCCGn1
    SolutionIndex: 18
    SolutionNameMin: Cijk_Alik_Bljk_HHS_BH_Bias_HA_S_SAV_UserArgs_MT128x64x32_MI16x16x1_SN_LDSB0_AFC1_AG0_AFEM1_AFEM1_ASEM1_CLR0_CADS0_DTLA0_DTLB0_DTVA0_DTVB0_EPS0_FDSI0_GRPM1_GRVWA8_GRVWB8_GSU1_GSUAMB_GSUC0_GSUWGMRR0_GLS0_ISA1100_IU1_K1_LDSTI0_LBSPPA128_LBSPPB128_LBSPPM0_LPA8_LPB8_LPM0_LRVW16_LWPMn1_MIAV1_MIWT4_2_MO40_NTn1_NTA0_NTB0_NTC0_NTD0_NTM0_NEPBS0_NLCA1_NLCB1_ONLL1_PGR2_PLR0_PKA0_SIA1_SS1_SU32_SUM1_SUS256_SPO0_SRVW0_SSO0_SVW1_SK0_SKFTR0_SKXCCM0_TLDS1_ULSGRO0_USL1_UIOFGRO0_USFGROn1_VSn1_VWA1_VWB1_WSGRA0_WSGRB0_WS32_WG32_4_1_WGM8_WGMXCC1_WGMXCCGn1
    SolutionIndex: 19
    SolutionNameMin: Cijk_Alik_Bljk_HHS_BH_Bias_HA_S_SAV_UserArgs_MT64x128x32_MI16x16x1_SN_LDSB0_AFC1_AG0_AFEM1_AFEM1_ASEM1_CLR0_CADS0_DTLA0_DTLB0_DTVA0_DTVB0_EPS0_FDSI0_GRPM1_GRVWA8_GRVWB8_GSU1_GSUAMB_GSUC0_GSUWGMRR0_GLS0_ISA1100_IU1_K1_LDSTI0_LBSPPA128_LBSPPB128_LBSPPM0_LPA8_LPB8_LPM0_LRVW16_LWPMn1_MIAV1_MIWT2_4_MO40_NTn1_NTA0_NTB0_NTC0_NTD0_NTM0_NEPBS0_NLCA1_NLCB1_ONLL1_PGR2_PLR1_PKA0_SIA1_SS1_SU32_SUM1_SUS256_SPO0_SRVW0_SSO0_SVW1_SK0_SKFTR0_SKXCCM0_TLDS1_ULSGRO0_USL1_UIOFGRO0_USFGROn1_VSn1_VWA1_VWB1_WSGRA0_WSGRB0_WS32_WG32_4_1_WGM8_WGMXCC1_WGMXCCGn1
    SolutionIndex: 20
    SolutionNameMin: Cijk_Alik_Bljk_HHS_BH_Bias_HA_S_SAV_UserArgs_MT128x128x32_MI16x16x1_SN_LDSB0_AFC1_AG0_AFEM1_AFEM1_ASEM1_CLR0_CADS0_DTLA0_DTLB0_DTVA0_DTVB0_EPS0_FDSI0_GRPM1_GRVWA8_GRVWB8_GSU1_GSUAMB_GSUC0_GSUWGMRR0_GLS0_ISA1100_IU1_K1_LDSTI0_LBSPPA128_LBSPPB128_LBSPPM0_LPA8_LPB8_LPM0_LRVW16_LWPMn1_MIAV1_MIWT4_4_MO40_NTn1_NTA0_NTB0_NTC0_NTD0_NTM0_NEPBS0_NLCA1_NLCB1_ONLL1_PGR0_PLR0_PKA0_SIA3_SS1_SU32_SUM1_SUS256_SPO0_SRVW0_SSO0_SVW1_SK0_SKFTR0_SKXCCM0_TLDS1_ULSGRO0_USL1_UIOFGRO0_USFGROn1_VSn1_VWA1_VWB1_WSGRA0_WSGRB0_WS32_WG32_4_1_WGM8_WGMXCC1_WGMXCCGn1
    SolutionIndex: 21
    SolutionNameMin: Cijk_Alik_Bljk_HHS_BH_Bias_HA_S_SAV_UserArgs_MT32x64x32_MI16x16x1_SN_LDSB0_AFC1_AG0_AFEM1_AFEM1_ASEM1_CLR0_CADS0_DTLA0_DTLB0_DTVA0_DTVB0_EPS0_FDSI0_GRPM1_GRVWA8_GRVWB8_GSU1_GSUAMB_GSUC0_GSUWGMRR0_GLS0_ISA1100_IU1_K1_LDSTI0_LBSPPA128_LBSPPB128_LBSPPM0_LPA8_LPB8_LPM0_LRVW16_LWPMn1_MIAV1_MIWT1_2_MO40_NTn1_NTA0_NTB0_NTC0_NTD0_NTM0_NEPBS0_NLCA1_NLCB1_ONLL1_PGR2_PLR1_PKA0_SIA1_SS1_SU32_SUM1_SUS256_SPO0_SRVW0_SSO0_SVW1_SK0_SKFTR0_SKXCCM0_TLDS1_ULSGRO0_USL1_UIOFGRO0_USFGROn1_VSn1_VWA1_VWB1_WSGRA0_WSGRB0_WS32_WG32_4_1_WGM8_WGMXCC1_WGMXCCGn1
    SolutionIndex: 22
    SolutionNameMin: Cijk_Alik_Bljk_HHS_BH_Bias_HA_S_SAV_UserArgs_MT32x16x64_MI16x16x1_SN_LDSB0_AFC1_AG0_AFEM1_AFEM1_ASEM1_CLR0_CADS0_DTLA0_DTLB0_DTVA0_DTVB0_EPS0_FDSI0_GRPM1_GRVWA8_GRVWB8_GSU1_GSUAMB_GSUC0_GSUWGMRR0_GLS0_ISA1100_IU1_K1_LDSTI0_LBSPPA128_LBSPPB128_LBSPPM0_LPA8_LPB8_LPM0_LRVW16_LWPMn1_MIAV1_MIWT1_1_MO40_NTn1_NTA0_NTB0_NTC0_NTD0_NTM0_NEPBS0_NLCA1_NLCB1_ONLL1_PGR2_PLR1_PKA0_SIA3_SS1_SU32_SUM1_SUS256_SPO0_SRVW0_SSO0_SVW1_SK0_SKFTR0_SKXCCM0_TLDS1_ULSGRO0_USL1_UIOFGRO0_USFGROn1_VSn1_VWA1_VWB1_WSGRA0_WSGRB0_WS32_WG32_2_1_WGM8_WGMXCC1_WGMXCCGn1
    SolutionIndex: 23
    SolutionNameMin: Cijk_Alik_Bljk_HHS_BH_Bias_HA_S_SAV_UserArgs_MT32x64x128_MI16x16x1_SN_LDSB0_AFC1_AG0_AFEM1_AFEM1_ASEM1_CLR0_CADS0_DTLA0_DTLB0_DTVA0_DTVB0_EPS0_FDSI0_GRPM1_GRVWA8_GRVWB8_GSU1_GSUAMB_GSUC0_GSUWGMRR0_GLS0_ISA1100_IU1_K1_LDSTI0_LBSPPA256_LBSPPB256_LBSPPM0_LPA8_LPB8_LPM0_LRVW16_LWPMn1_MIAV1_MIWT2_1_MO40_NTn1_NTA0_NTB0_NTC0_NTD0_NTM0_NEPBS0_NLCA1_NLCB1_ONLL1_PGR2_PLR1_PKA0_SIA1_SS1_SU32_SUM1_SUS256_SPO0_SRVW0_SSO0_SVW1_SK0_SKFTR0_SKXCCM0_TLDS1_ULSGRO0_USL1_UIOFGRO0_USFGROn1_VSn1_VWA1_VWB1_WSGRA0_WSGRB0_WS32_WG16_8_1_WGM8_WGMXCC1_WGMXCCGn1
    SolutionIndex: 24
    SolutionNameMin: Cijk_Alik_Bljk_HHS_BH_Bias_HA_S_SAV_UserArgs_MT32x64x128_MI16x16x1_SN_LDSB0_AFC1_AG0_AFEM1_AFEM1_ASEM1_CLR0_CADS0_DTLA0_DTLB0_DTVA0_DTVB0_EPS0_FDSI0_GRPM1_GRVWA8_GRVWB8_GSU1_GSUAMB_GSUC0_GSUWGMRR0_GLS0_ISA1100_IU1_K1_LDSTI0_LBSPPA256_LBSPPB256_LBSPPM0_LPA8_LPB8_LPM0_LRVW16_LWPMn1_MIAV1_MIWT2_1_MO40_NTn1_NTA0_NTB0_NTC0_NTD0_NTM0_NEPBS0_NLCA1_NLCB1_ONLL1_PGR1_PLR1_PKA0_SIA1_SS1_SU32_SUM1_SUS256_SPO0_SRVW0_SSO0_SVW1_SK0_SKFTR0_SKXCCM0_TLDS1_ULSGRO0_USL1_UIOFGRO0_USFGROn1_VSn1_VWA1_VWB1_WSGRA0_WSGRB0_WS32_WG16_8_1_WGM8_WGMXCC1_WGMXCCGn1
    SolutionIndex: 25
    SolutionNameMin: Cijk_Alik_Bljk_HHS_BH_Bias_HA_S_SAV_UserArgs_MT64x64x64_MI16x16x1_SN_LDSB0_AFC1_AG0_AFEM1_AFEM1_ASEM1_CLR0_CADS0_DTLA0_DTLB0_DTVA0_DTVB0_EPS0_FDSI0_GRPM1_GRVWA8_GRVWB8_GSU1_GSUAMB_GSUC0_GSUWGMRR0_GLS0_ISA1100_IU1_K1_LDSTI0_LBSPPA128_LBSPPB128_LBSPPM0_LPA8_LPB8_LPM0_LRVW16_LWPMn1_MIAV1_MIWT4_1_MO40_NTn1_NTA0_NTB0_NTC0_NTD0_NTM0_NEPBS0_NLCA1_NLCB1_ONLL1_PGR2_PLR1_PKA0_SIA1_SS1_SU32_SUM1_SUS256_SPO0_SRVW0_SSO0_SVW1_SK0_SKFTR0_SKXCCM0_TLDS1_ULSGRO0_USL1_UIOFGRO0_USFGROn1_VSn1_VWA1_VWB1_WSGRA0_WSGRB0_WS32_WG16_8_1_WGM8_WGMXCC1_WGMXCCGn1
    SolutionIndex: 26
    SolutionNameMin: Cijk_Alik_Bljk_HHS_BH_Bias_HA_S_SAV_UserArgs_MT96x32x32_MI16x16x1_SN_LDSB0_AFC1_AG0_AFEM1_AFEM1_ASEM1_CLR0_CADS0_DTLA0_DTLB0_DTVA0_DTVB0_EPS0_FDSI0_GRPM1_GRVWA8_GRVWB8_GSU1_GSUAMB_GSUC0_GSUWGMRR0_GLS0_ISA1100_IU1_K1_LDSTI0_LBSPPA128_LBSPPB128_LBSPPM0_LPA8_LPB8_LPM0_LRVW16_LWPMn1_MIAV1_MIWT3_1_MO40_NTn1_NTA0_NTB0_NTC0_NTD0_NTM0_NEPBS0_NLCA1_NLCB1_ONLL1_PGR2_PLR1_PKA0_SIA1_SS1_SU32_SUM1_SUS256_SPO0_SRVW0_SSO0_SVW1_SK0_SKFTR0_SKXCCM0_TLDS1_ULSGRO0_USL1_UIOFGRO0_USFGROn1_VSn1_VWA1_VWB1_WSGRA0_WSGRB0_WS32_WG32_4_1_WGM8_WGMXCC1_WGMXCCGn1
    SolutionIndex: 27
    SolutionNameMin: Cijk_Alik_Bljk_HHS_BH_Bias_HA_S_SAV_UserArgs_MT64x32x64_MI16x16x1_SN_LDSB0_AFC1_AG0_AFEM1_AFEM1_ASEM1_CLR0_CADS0_DTLA0_DTLB0_DTVA0_DTVB0_EPS0_FDSI0_GRPM1_GRVWA8_GRVWB8_GSU1_GSUAMB_GSUC0_GSUWGMRR0_GLS0_ISA1100_IU1_K1_LDSTI0_LBSPPA128_LBSPPB128_LBSPPM0_LPA8_LPB8_LPM0_LRVW16_LWPMn1_MIAV1_MIWT2_1_MO40_NTn1_NTA0_NTB0_NTC0_NTD0_NTM0_NEPBS0_NLCA1_NLCB1_ONLL1_PGR2_PLR1_PKA0_SIA1_SS1_SU32_SUM1_SUS256_SPO0_SRVW0_SSO0_SVW1_SK0_SKFTR0_SKXCCM0_TLDS1_ULSGRO0_USL1_UIOFGRO0_USFGROn1_VSn1_VWA1_VWB1_WSGRA0_WSGRB0_WS32_WG32_4_1_WGM8_WGMXCC1_WGMXCCGn1
    SolutionIndex: 28
    SolutionNameMin: Cijk_Alik_Bljk_HHS_BH_Bias_HA_S_SAV_UserArgs_MT64x64x32_MI16x16x1_SN_LDSB0_AFC1_AG0_AFEM1_AFEM1_ASEM1_CLR0_CADS0_DTLA0_DTLB0_DTVA0_DTVB0_EPS0_FDSI0_GRPM1_GRVWA8_GRVWB8_GSU1_GSUAMB_GSUC0_GSUWGMRR0_GLS0_ISA1100_IU1_K1_LDSTI0_LBSPPA128_LBSPPB128_LBSPPM0_LPA8_LPB8_LPM0_LRVW16_LWPMn1_MIAV1_MIWT2_2_MO40_NTn1_NTA0_NTB0_NTC0_NTD0_NTM0_NEPBS0_NLCA1_NLCB1_ONLL1_PGR2_PLR1_PKA0_SIA1_SS1_SU32_SUM1_SUS256_SPO0_SRVW0_SSO0_SVW1_SK0_SKFTR0_SKXCCM0_TLDS1_ULSGRO0_USL1_UIOFGRO0_USFGROn1_VSn1_VWA1_VWB1_WSGRA0_WSGRB0_WS32_WG32_4_1_WGM8_WGMXCC1_WGMXCCGn1
    SolutionIndex: 29
    SolutionNameMin: Cijk_Alik_Bljk_HHS_BH_Bias_HA_S_SAV_UserArgs_MT64x64x64_MI16x16x1_SN_LDSB0_AFC1_AG0_AFEM1_AFEM1_ASEM1_CLR0_CADS0_DTLA0_DTLB0_DTVA0_DTVB0_EPS0_FDSI0_GRPM1_GRVWA8_GRVWB8_GSU1_GSUAMB_GSUC0_GSUWGMRR0_GLS0_ISA1100_IU1_K1_LDSTI0_LBSPPA128_LBSPPB128_LBSPPM0_LPA8_LPB8_LPM0_LRVW16_LWPMn1_MIAV1_MIWT2_2_MO40_NTn1_NTA0_NTB0_NTC0_NTD0_NTM0_NEPBS0_NLCA1_NLCB1_ONLL1_PGR2_PLR1_PKA0_SIA3_SS1_SU32_SUM1_SUS256_SPO0_SRVW0_SSO0_SVW1_SK0_SKFTR0_SKXCCM0_TLDS1_ULSGRO0_USL1_UIOFGRO0_USFGROn1_VSn1_VWA1_VWB1_WSGRA0_WSGRB0_WS32_WG32_4_1_WGM8_WGMXCC1_WGMXCCGn1
    SolutionIndex: 30
    SolutionNameMin: Cijk_Alik_Bljk_HHS_BH_Bias_HA_S_SAV_UserArgs_MT64x64x32_MI16x16x1_SN_LDSB0_AFC1_AG0_AFEM1_AFEM1_ASEM1_CLR0_CADS0_DTLA0_DTLB0_DTVA0_DTVB0_EPS0_FDSI0_GRPM1_GRVWA8_GRVWB8_GSU1_GSUAMB_GSUC0_GSUWGMRR0_GLS0_ISA1100_IU1_K1_LDSTI0_LBSPPA128_LBSPPB128_LBSPPM0_LPA8_LPB8_LPM0_LRVW16_LWPMn1_MIAV1_MIWT1_4_MO40_NTn1_NTA0_NTB0_NTC0_NTD0_NTM0_NEPBS0_NLCA1_NLCB1_ONLL1_PGR1_PLR0_PKA0_SIA3_SS1_SU32_SUM1_SUS256_SPO0_SRVW0_SSO0_SVW1_SK0_SKFTR0_SKXCCM0_TLDS1_ULSGRO0_USL1_UIOFGRO0_USFGROn1_VSn1_VWA1_VWB1_WSGRA0_WSGRB0_WS32_WG64_2_1_WGM8_WGMXCC1_WGMXCCGn1
    SolutionIndex: 31
    SolutionNameMin: Cijk_Alik_Bljk_HHS_BH_Bias_HA_S_SAV_UserArgs_MT32x128x32_MI16x16x1_SN_LDSB0_AFC1_AG0_AFEM1_AFEM1_ASEM1_CLR0_CADS0_DTLA0_DTLB0_DTVA0_DTVB0_EPS0_FDSI0_GRPM1_GRVWA8_GRVWB8_GSU1_GSUAMB_GSUC0_GSUWGMRR0_GLS0_ISA1100_IU1_K1_LDSTI0_LBSPPA128_LBSPPB128_LBSPPM0_LPA8_LPB8_LPM0_LRVW16_LWPMn1_MIAV1_MIWT2_2_MO40_NTn1_NTA0_NTB0_NTC0_NTD0_NTM0_NEPBS0_NLCA1_NLCB1_ONLL1_PGR2_PLR1_PKA0_SIA3_SS1_SU32_SUM1_SUS256_SPO0_SRVW0_SSO0_SVW1_SK0_SKFTR0_SKXCCM0_TLDS1_ULSGRO0_USL1_UIOFGRO0_USFGROn1_VSn1_VWA1_VWB1_WSGRA0_WSGRB0_WS32_WG16_8_1_WGM8_WGMXCC1_WGMXCCGn1
    SolutionIndex: 32
    SolutionNameMin: Cijk_Alik_Bljk_HHS_BH_Bias_HA_S_SAV_UserArgs_MT64x128x32_MI16x16x1_SN_LDSB0_AFC1_AG0_AFEM1_AFEM1_ASEM1_CLR0_CADS0_DTLA0_DTLB0_DTVA0_DTVB0_EPS0_FDSI0_GRPM1_GRVWA8_GRVWB8_GSU1_GSUAMB_GSUC0_GSUWGMRR0_GLS0_ISA1100_IU1_K1_LDSTI0_LBSPPA128_LBSPPB128_LBSPPM0_LPA8_LPB8_LPM0_LRVW16_LWPMn1_MIAV1_MIWT4_2_MO40_NTn1_NTA0_NTB0_NTC0_NTD0_NTM0_NEPBS0_NLCA1_NLCB1_ONLL1_PGR2_PLR1_PKA0_SIA1_SS1_SU32_SUM1_SUS256_SPO0_SRVW0_SSO0_SVW1_SK0_SKFTR0_SKXCCM0_TLDS1_ULSGRO0_USL1_UIOFGRO0_USFGROn1_VSn1_VWA1_VWB1_WSGRA0_WSGRB0_WS32_WG16_8_1_WGM8_WGMXCC1_WGMXCCGn1
    SolutionIndex: 33
    SolutionNameMin: Cijk_Alik_Bljk_HHS_BH_Bias_HA_S_SAV_UserArgs_MT128x64x32_MI16x16x1_SN_LDSB0_AFC1_AG0_AFEM1_AFEM1_ASEM1_CLR0_CADS0_DTLA0_DTLB0_DTVA0_DTVB0_EPS0_FDSI0_GRPM1_GRVWA8_GRVWB8_GSU1_GSUAMB_GSUC0_GSUWGMRR0_GLS0_ISA1100_IU1_K1_LDSTI0_LBSPPA128_LBSPPB128_LBSPPM0_LPA8_LPB8_LPM0_LRVW16_LWPMn1_MIAV1_MIWT4_2_MO40_NTn1_NTA0_NTB0_NTC0_NTD0_NTM0_NEPBS0_NLCA1_NLCB1_ONLL1_PGR2_PLR0_PKA0_SIA3_SS1_SU32_SUM1_SUS256_SPO0_SRVW0_SSO0_SVW1_SK0_SKFTR0_SKXCCM0_TLDS1_ULSGRO0_USL1_UIOFGRO0_USFGROn1_VSn1_VWA1_VWB1_WSGRA0_WSGRB0_WS32_WG32_4_1_WGM8_WGMXCC1_WGMXCCGn1
    SolutionIndex: 34
    SolutionNameMin: Cijk_Alik_Bljk_HHS_BH_Bias_HA_S_SAV_UserArgs_MT64x128x32_MI16x16x1_SN_LDSB0_AFC1_AG0_AFEM1_AFEM1_ASEM1_CLR0_CADS0_DTLA0_DTLB0_DTVA0_DTVB0_EPS0_FDSI0_GRPM1_GRVWA8_GRVWB8_GSU1_GSUAMB_GSUC0_GSUWGMRR0_GLS0_ISA1100_IU1_K1_LDSTI0_LBSPPA128_LBSPPB128_LBSPPM0_LPA8_LPB8_LPM0_LRVW16_LWPMn1_MIAV1_MIWT2_4_MO40_NTn1_NTA0_NTB0_NTC0_NTD0_NTM0_NEPBS0_NLCA1_NLCB1_ONLL1_PGR1_PLR1_PKA0_SIA3_SS1_SU32_SUM1_SUS256_SPO0_SRVW0_SSO0_SVW1_SK0_SKFTR0_SKXCCM0_TLDS1_ULSGRO0_USL1_UIOFGRO0_USFGROn1_VSn1_VWA1_VWB1_WSGRA0_WSGRB0_WS32_WG32_4_1_WGM8_WGMXCC1_WGMXCCGn1
    SolutionIndex: 35
    SolutionNameMin: Cijk_Alik_Bljk_HHS_BH_Bias_HA_S_SAV_UserArgs_MT64x128x32_MI16x16x1_SN_LDSB0_AFC1_AG0_AFEM1_AFEM1_ASEM1_CLR0_CADS0_DTLA0_DTLB0_DTVA0_DTVB0_EPS0_FDSI0_GRPM1_GRVWA8_GRVWB8_GSU1_GSUAMB_GSUC0_GSUWGMRR0_GLS0_ISA1100_IU1_K1_LDSTI0_LBSPPA128_LBSPPB128_LBSPPM0_LPA8_LPB8_LPM0_LRVW16_LWPMn1_MIAV1_MIWT4_2_MO40_NTn1_NTA0_NTB0_NTC0_NTD0_NTM0_NEPBS0_NLCA1_NLCB1_ONLL1_PGR2_PLR1_PKA0_SIA3_SS1_SU32_SUM1_SUS256_SPO0_SRVW0_SSO0_SVW1_SK0_SKFTR0_SKXCCM0_TLDS1_ULSGRO0_USL1_UIOFGRO0_USFGROn1_VSn1_VWA1_VWB1_WSGRA0_WSGRB0_WS32_WG16_8_1_WGM8_WGMXCC1_WGMXCCGn1
    SolutionIndex: 36
    SolutionNameMin: Cijk_Alik_Bljk_HHS_BH_Bias_HA_S_SAV_UserArgs_MT64x128x32_MI16x16x1_SN_LDSB0_AFC1_AG0_AFEM1_AFEM1_ASEM1_CLR0_CADS0_DTLA0_DTLB0_DTVA0_DTVB0_EPS0_FDSI0_GRPM1_GRVWA8_GRVWB8_GSU1_GSUAMB_GSUC0_GSUWGMRR0_GLS0_ISA1100_IU1_K1_LDSTI0_LBSPPA128_LBSPPB128_LBSPPM0_LPA8_LPB8_LPM0_LRVW16_LWPMn1_MIAV1_MIWT2_4_MO40_NTn1_NTA0_NTB0_NTC0_NTD0_NTM0_NEPBS0_NLCA1_NLCB1_ONLL1_PGR1_PLR0_PKA0_SIA3_SS1_SU32_SUM1_SUS256_SPO0_SRVW0_SSO0_SVW1_SK0_SKFTR0_SKXCCM0_TLDS1_ULSGRO0_USL1_UIOFGRO0_USFGROn1_VSn1_VWA1_VWB1_WSGRA0_WSGRB0_WS32_WG32_4_1_WGM8_WGMXCC1_WGMXCCGn1
    SolutionIndex: 37
    SolutionNameMin: Cijk_Alik_Bljk_HHS_BH_Bias_HA_S_SAV_UserArgs_MT128x128x32_MI16x16x1_SN_LDSB0_AFC1_AG0_AFEM1_AFEM1_ASEM1_CLR0_CADS0_DTLA0_DTLB0_DTVA0_DTVB0_EPS0_FDSI0_GRPM1_GRVWA8_GRVWB8_GSU1_GSUAMB_GSUC0_GSUWGMRR0_GLS0_ISA1100_IU1_K1_LDSTI0_LBSPPA128_LBSPPB128_LBSPPM0_LPA8_LPB8_LPM0_LRVW16_LWPMn1_MIAV1_MIWT2_8_MO40_NTn1_NTA0_NTB0_NTC0_NTD0_NTM0_NEPBS0_NLCA1_NLCB1_ONLL1_PGR0_PLR0_PKA0_SIA3_SS1_SU32_SUM1_SUS256_SPO0_SRVW0_SSO0_SVW1_SK0_SKFTR0_SKXCCM0_TLDS1_ULSGRO0_USL1_UIOFGRO0_USFGROn1_VSn1_VWA1_VWB1_WSGRA0_WSGRB0_WS32_WG64_2_1_WGM8_WGMXCC1_WGMXCCGn1
    SolutionIndex: 38
    SolutionNameMin: Cijk_Alik_Bljk_HHS_BH_Bias_HA_S_SAV_UserArgs_MT128x64x32_MI16x16x1_SN_LDSB0_AFC1_AG0_AFEM1_AFEM1_ASEM1_CLR0_CADS0_DTLA0_DTLB0_DTVA0_DTVB0_EPS0_FDSI0_GRPM1_GRVWA8_GRVWB8_GSU1_GSUAMB_GSUC0_GSUWGMRR0_GLS0_ISA1100_IU1_K1_LDSTI0_LBSPPA128_LBSPPB128_LBSPPM0_LPA8_LPB8_LPM0_LRVW16_LWPMn1_MIAV1_MIWT4_2_MO40_NTn1_NTA0_NTB0_NTC0_NTD0_NTM0_NEPBS0_NLCA1_NLCB1_ONLL1_PGR0_PLR0_PKA0_SIA3_SS1_SU32_SUM1_SUS256_SPO0_SRVW0_SSO0_SVW1_SK0_SKFTR0_SKXCCM0_TLDS1_ULSGRO0_USL1_UIOFGRO0_USFGROn1_VSn1_VWA1_VWB1_WSGRA0_WSGRB0_WS32_WG32_4_1_WGM8_WGMXCC1_WGMXCCGn1
    SolutionIndex: 39
    SolutionNameMin: Cijk_Alik_Bljk_HHS_BH_Bias_HA_S_SAV_UserArgs_MT64x256x32_MI16x16x1_SN_LDSB0_AFC1_AG0_AFEM1_AFEM1_ASEM1_CLR0_CADS0_DTLA0_DTLB0_DTVA0_DTVB0_EPS0_FDSI0_GRPM1_GRVWA8_GRVWB8_GSU1_GSUAMB_GSUC0_GSUWGMRR0_GLS0_ISA1100_IU1_K1_LDSTI0_LBSPPA128_LBSPPB128_LBSPPM0_LPA8_LPB8_LPM0_LRVW16_LWPMn1_MIAV1_MIWT2_8_MO40_NTn1_NTA0_NTB0_NTC0_NTD0_NTM0_NEPBS0_NLCA1_NLCB1_ONLL1_PGR0_PLR0_PKA0_SIA3_SS1_SU32_SUM1_SUS256_SPO0_SRVW0_SSO0_SVW1_SK0_SKFTR0_SKXCCM0_TLDS1_ULSGRO0_USL1_UIOFGRO0_USFGROn1_VSn1_VWA1_VWB1_WSGRA0_WSGRB0_WS32_WG32_4_1_WGM8_WGMXCC1_WGMXCCGn1
    SolutionIndex: 41
    SolutionNameMin: Cijk_Alik_Bljk_HHS_BH_Bias_HA_S_SAV_UserArgs_MT64x128x32_MI16x16x1_SN_LDSB0_AFC1_AG0_AFEM1_AFEM1_ASEM1_CLR0_CADS0_DTLA0_DTLB0_DTVA0_DTVB0_EPS0_FDSI0_GRPM1_GRVWA8_GRVWB8_GSU1_GSUAMB_GSUC0_GSUWGMRR0_GLS0_ISA1100_IU1_K1_LDSTI0_LBSPPA128_LBSPPB128_LBSPPM0_LPA8_LPB8_LPM0_LRVW16_LWPMn1_MIAV1_MIWT4_2_MO40_NTn1_NTA0_NTB0_NTC0_NTD0_NTM0_NEPBS0_NLCA1_NLCB1_ONLL1_PGR0_PLR0_PKA0_SIA3_SS1_SU32_SUM1_SUS256_SPO0_SRVW0_SSO0_SVW1_SK0_SKFTR0_SKXCCM0_TLDS1_ULSGRO0_USL1_UIOFGRO0_USFGROn1_VSn1_VWA1_VWB1_WSGRA0_WSGRB0_WS32_WG16_8_1_WGM8_WGMXCC1_WGMXCCGn1
    SolutionIndex: 42
    SolutionNameMin: Cijk_Alik_Bljk_HHS_BH_Bias_HA_S_SAV_UserArgs_MT64x128x32_MI16x16x1_SN_LDSB0_AFC1_AG0_AFEM1_AFEM1_ASEM1_CLR0_CADS0_DTLA0_DTLB0_DTVA0_DTVB0_EPS0_FDSI0_GRPM1_GRVWA8_GRVWB8_GSU1_GSUAMB_GSUC0_GSUWGMRR0_GLS0_ISA1100_IU1_K1_LDSTI0_LBSPPA128_LBSPPB128_LBSPPM0_LPA8_LPB8_LPM0_LRVW16_LWPMn1_MIAV1_MIWT2_4_MO40_NTn1_NTA0_NTB0_NTC0_NTD0_NTM0_NEPBS0_NLCA1_NLCB1_ONLL1_PGR0_PLR0_PKA0_SIA3_SS1_SU32_SUM1_SUS256_SPO0_SRVW0_SSO0_SVW1_SK0_SKFTR0_SKXCCM0_TLDS1_ULSGRO0_USL1_UIOFGRO0_USFGROn1_VSn1_VWA1_VWB1_WSGRA0_WSGRB0_WS32_WG32_4_1_WGM8_WGMXCC1_WGMXCCGn1
    SolutionIndex: 43
    SolutionNameMin: Cijk_Alik_Bljk_HHS_BH_Bias_HA_S_SAV_UserArgs_MT192x64x32_MI16x16x1_SN_LDSB0_AFC1_AG0_AFEM1_AFEM1_ASEM1_CLR0_CADS0_DTLA0_DTLB0_DTVA0_DTVB0_EPS0_FDSI0_GRPM1_GRVWA8_GRVWB8_GSU1_GSUAMB_GSUC0_GSUWGMRR0_GLS0_ISA1100_IU1_K1_LDSTI0_LBSPPA128_LBSPPB128_LBSPPM0_LPA8_LPB8_LPM0_LRVW16_LWPMn1_MIAV1_MIWT3_4_MO40_NTn1_NTA0_NTB0_NTC0_NTD0_NTM0_NEPBS0_NLCA1_NLCB1_ONLL1_PGR0_PLR0_PKA0_SIA3_SS1_SU32_SUM1_SUS256_SPO0_SRVW0_SSO0_SVW1_SK0_SKFTR0_SKXCCM0_TLDS1_ULSGRO0_USL1_UIOFGRO0_USFGROn1_VSn1_VWA1_VWB1_WSGRA0_WSGRB0_WS32_WG64_2_1_WGM8_WGMXCC1_WGMXCCGn1
    SolutionIndex: 44
    SolutionNameMin: Cijk_Alik_Bljk_HHS_BH_Bias_HA_S_SAV_UserArgs_MT96x128x32_MI16x16x1_SN_LDSB0_AFC1_AG0_AFEM1_AFEM1_ASEM1_CLR0_CADS0_DTLA0_DTLB0_DTVA0_DTVB0_EPS0_FDSI0_GRPM1_GRVWA8_GRVWB8_GSU1_GSUAMB_GSUC0_GSUWGMRR0_GLS0_ISA1100_IU1_K1_LDSTI0_LBSPPA128_LBSPPB128_LBSPPM0_LPA8_LPB8_LPM0_LRVW16_LWPMn1_MIAV1_MIWT3_4_MO40_NTn1_NTA0_NTB0_NTC0_NTD0_NTM0_NEPBS0_NLCA1_NLCB1_ONLL1_PGR0_PLR0_PKA0_SIA3_SS1_SU32_SUM1_SUS256_SPO0_SRVW0_SSO0_SVW1_SK0_SKFTR0_SKXCCM0_TLDS1_ULSGRO0_USL1_UIOFGRO0_USFGROn1_VSn1_VWA1_VWB1_WSGRA0_WSGRB0_WS32_WG32_4_1_WGM8_WGMXCC1_WGMXCCGn1
    SolutionIndex: 46
    SolutionNameMin: Cijk_Alik_Bljk_HHS_BH_Bias_HA_S_SAV_UserArgs_MT48x64x64_MI16x16x1_SN_LDSB0_AFC1_AG0_AFEM1_AFEM1_ASEM1_CLR0_CADS0_DTLA0_DTLB0_DTVA0_DTVB0_EPS0_FDSI0_GRPM1_GRVWA8_GRVWB8_GSU1_GSUAMB_GSUC0_GSUWGMRR0_GLS0_ISA1100_IU1_K1_LDSTI0_LBSPPA128_LBSPPB128_LBSPPM0_LPA8_LPB8_LPM0_LRVW16_LWPMn1_MIAV1_MIWT3_1_MO40_NTn1_NTA0_NTB0_NTC0_NTD0_NTM0_NEPBS0_NLCA1_NLCB1_ONLL1_PGR2_PLR1_PKA0_SIA1_SS1_SU32_SUM1_SUS256_SPO0_SRVW0_SSO0_SVW1_SK0_SKFTR0_SKXCCM0_TLDS1_ULSGRO0_USL1_UIOFGRO0_USFGROn1_VSn1_VWA1_VWB1_WSGRA0_WSGRB0_WS32_WG16_8_1_WGM8_WGMXCC1_WGMXCCGn1
    SolutionIndex: 47
    SolutionNameMin: Cijk_Alik_Bljk_HHS_BH_Bias_HA_S_SAV_UserArgs_MT64x64x128_MI16x16x1_SN_LDSB1_AFC1_AG0_AFEM1_AFEM1_ASEM1_CLR0_CADS0_DTLA0_DTLB0_DTVA0_DTVB0_EPS0_FDSI0_GRPM1_GRVWA8_GRVWB8_GSU1_GSUAMB_GSUC0_GSUWGMRR0_GLS0_ISA1100_IU1_K1_LDSTI0_LBSPPA256_LBSPPB256_LBSPPM0_LPA8_LPB8_LPM0_LRVW16_LWPMn1_MIAV1_MIWT2_2_MO40_NTn1_NTA0_NTB0_NTC0_NTD0_NTM0_NEPBS0_NLCA1_NLCB1_ONLL1_PGR2_PLR1_PKA0_SIA3_SS1_SU32_SUM1_SUS256_SPO0_SRVW0_SSO0_SVW1_SK0_SKFTR0_SKXCCM0_TLDS1_ULSGRO0_USL1_UIOFGRO0_USFGROn1_VSn1_VWA1_VWB1_WSGRA0_WSGRB0_WS32_WG32_4_1_WGM8_WGMXCC1_WGMXCCGn1
    SolutionIndex: 48
    SolutionNameMin: Cijk_Alik_Bljk_HHS_BH_Bias_HA_S_SAV_UserArgs_MT64x64x64_MI16x16x1_SN_LDSB0_AFC1_AG0_AFEM1_AFEM1_ASEM1_CLR0_CADS0_DTLA0_DTLB0_DTVA0_DTVB0_EPS0_FDSI0_GRPM1_GRVWA8_GRVWB8_GSU1_GSUAMB_GSUC0_GSUWGMRR0_GLS0_ISA1100_IU1_K1_LDSTI0_LBSPPA128_LBSPPB128_LBSPPM0_LPA8_LPB8_LPM0_LRVW16_LWPMn1_MIAV1_MIWT2_2_MO40_NTn1_NTA0_NTB0_NTC0_NTD0_NTM0_NEPBS0_NLCA1_NLCB1_ONLL1_PGR2_PLR0_PKA0_SIA1_SS1_SU32_SUM1_SUS256_SPO0_SRVW0_SSO0_SVW1_SK0_SKFTR0_SKXCCM0_TLDS1_ULSGRO0_USL1_UIOFGRO0_USFGROn1_VSn1_VWA1_VWB1_WSGRA0_WSGRB0_WS32_WG32_4_1_WGM8_WGMXCC1_WGMXCCGn1
    SolutionIndex: 49
    SolutionNameMin: Cijk_Alik_Bljk_HHS_BH_Bias_HA_S_SAV_UserArgs_MT64x64x32_MI16x16x1_SN_LDSB0_AFC1_AG0_AFEM1_AFEM1_ASEM1_CLR0_CADS0_DTLA0_DTLB0_DTVA0_DTVB0_EPS0_FDSI0_GRPM1_GRVWA8_GRVWB8_GSU1_GSUAMB_GSUC0_GSUWGMRR0_GLS0_ISA1100_IU1_K1_LDSTI0_LBSPPA128_LBSPPB128_LBSPPM0_LPA8_LPB8_LPM0_LRVW16_LWPMn1_MIAV1_MIWT2_2_MO40_NTn1_NTA0_NTB0_NTC0_NTD0_NTM0_NEPBS0_NLCA1_NLCB1_ONLL1_PGR2_PLR1_PKA0_SIA3_SS1_SU32_SUM1_SUS256_SPO0_SRVW0_SSO0_SVW1_SK0_SKFTR0_SKXCCM0_TLDS1_ULSGRO0_USL1_UIOFGRO0_USFGROn1_VSn1_VWA1_VWB1_WSGRA0_WSGRB0_WS32_WG32_4_1_WGM8_WGMXCC1_WGMXCCGn1
    SolutionIndex: 50
    SolutionNameMin: Cijk_Alik_Bljk_HHS_BH_Bias_HA_S_SAV_UserArgs_MT64x128x32_MI16x16x1_SN_LDSB0_AFC1_AG0_AFEM1_AFEM1_ASEM1_CLR0_CADS0_DTLA0_DTLB0_DTVA0_DTVB0_EPS0_FDSI0_GRPM1_GRVWA8_GRVWB8_GSU1_GSUAMB_GSUC0_GSUWGMRR0_GLS0_ISA1100_IU1_K1_LDSTI0_LBSPPA128_LBSPPB128_LBSPPM0_LPA8_LPB8_LPM0_LRVW16_LWPMn1_MIAV1_MIWT4_2_MO40_NTn1_NTA0_NTB0_NTC0_NTD0_NTM0_NEPBS0_NLCA1_NLCB1_ONLL1_PGR2_PLR0_PKA0_SIA1_SS1_SU32_SUM1_SUS256_SPO0_SRVW0_SSO0_SVW1_SK0_SKFTR0_SKXCCM0_TLDS1_ULSGRO0_USL1_UIOFGRO0_USFGROn1_VSn1_VWA1_VWB1_WSGRA0_WSGRB0_WS32_WG16_8_1_WGM8_WGMXCC1_WGMXCCGn1
    SolutionIndex: 51
    SolutionNameMin: Cijk_Alik_Bljk_HHS_BH_Bias_HA_S_SAV_UserArgs_MT128x64x32_MI16x16x1_SN_LDSB0_AFC1_AG0_AFEM1_AFEM1_ASEM1_CLR0_CADS0_DTLA0_DTLB0_DTVA0_DTVB0_EPS0_FDSI0_GRPM1_GRVWA8_GRVWB8_GSU1_GSUAMB_GSUC0_GSUWGMRR0_GLS0_ISA1100_IU1_K1_LDSTI0_LBSPPA128_LBSPPB128_LBSPPM0_LPA8_LPB8_LPM0_LRVW16_LWPMn1_MIAV1_MIWT4_2_MO40_NTn1_NTA0_NTB0_NTC0_NTD0_NTM0_NEPBS0_NLCA1_NLCB1_ONLL1_PGR2_PLR1_PKA0_SIA1_SS1_SU32_SUM1_SUS256_SPO0_SRVW0_SSO0_SVW1_SK0_SKFTR0_SKXCCM0_TLDS1_ULSGRO0_USL1_UIOFGRO0_USFGROn1_VSn1_VWA1_VWB1_WSGRA0_WSGRB0_WS32_WG32_4_1_WGM8_WGMXCC1_WGMXCCGn1
    SolutionIndex: 52
    SolutionNameMin: Cijk_Alik_Bljk_HHS_BH_Bias_HA_S_SAV_UserArgs_MT64x128x64_MI16x16x1_SN_LDSB0_AFC1_AG0_AFEM1_AFEM1_ASEM1_CLR0_CADS0_DTLA0_DTLB0_DTVA0_DTVB0_EPS0_FDSI0_GRPM1_GRVWA8_GRVWB8_GSU1_GSUAMB_GSUC0_GSUWGMRR0_GLS0_ISA1100_IU1_K1_LDSTI0_LBSPPA128_LBSPPB128_LBSPPM0_LPA8_LPB8_LPM0_LRVW16_LWPMn1_MIAV1_MIWT2_4_MO40_NTn1_NTA0_NTB0_NTC0_NTD0_NTM0_NEPBS0_NLCA1_NLCB1_ONLL1_PGR1_PLR1_PKA0_SIA3_SS1_SU32_SUM1_SUS256_SPO0_SRVW0_SSO0_SVW1_SK0_SKFTR0_SKXCCM0_TLDS1_ULSGRO0_USL1_UIOFGRO0_USFGROn1_VSn1_VWA1_VWB1_WSGRA0_WSGRB0_WS32_WG32_4_1_WGM8_WGMXCC1_WGMXCCGn1
    SolutionIndex: 54
    SolutionNameMin: Cijk_Alik_Bljk_HHS_BH_Bias_HA_S_SAV_UserArgs_MT128x64x32_MI16x16x1_SN_LDSB0_AFC1_AG0_AFEM1_AFEM1_ASEM1_CLR0_CADS0_DTLA0_DTLB0_DTVA0_DTVB0_EPS0_FDSI0_GRPM1_GRVWA8_GRVWB8_GSU1_GSUAMB_GSUC0_GSUWGMRR0_GLS0_ISA1100_IU1_K1_LDSTI0_LBSPPA128_LBSPPB128_LBSPPM0_LPA8_LPB8_LPM0_LRVW16_LWPMn1_MIAV1_MIWT2_4_MO40_NTn1_NTA0_NTB0_NTC0_NTD0_NTM0_NEPBS0_NLCA1_NLCB1_ONLL1_PGR2_PLR1_PKA0_SIA1_SS1_SU32_SUM1_SUS256_SPO0_SRVW0_SSO0_SVW1_SK0_SKFTR0_SKXCCM0_TLDS1_ULSGRO0_USL1_UIOFGRO0_USFGROn1_VSn1_VWA1_VWB1_WSGRA0_WSGRB0_WS32_WG64_2_1_WGM8_WGMXCC1_WGMXCCGn1
    SolutionIndex: 55
    SolutionNameMin: Cijk_Alik_Bljk_HHS_BH_Bias_HA_S_SAV_UserArgs_MT64x128x64_MI16x16x1_SN_LDSB1_AFC1_AG0_AFEM1_AFEM1_ASEM1_CLR0_CADS0_DTLA0_DTLB0_DTVA0_DTVB0_EPS0_FDSI0_GRPM1_GRVWA8_GRVWB8_GSU1_GSUAMB_GSUC0_GSUWGMRR0_GLS0_ISA1100_IU1_K1_LDSTI0_LBSPPA128_LBSPPB128_LBSPPM0_LPA8_LPB8_LPM0_LRVW16_LWPMn1_MIAV1_MIWT2_4_MO40_NTn1_NTA0_NTB0_NTC0_NTD0_NTM0_NEPBS0_NLCA1_NLCB1_ONLL1_PGR1_PLR1_PKA0_SIA3_SS1_SU32_SUM1_SUS256_SPO0_SRVW0_SSO0_SVW1_SK0_SKFTR0_SKXCCM0_TLDS1_ULSGRO0_USL1_UIOFGRO0_USFGROn1_VSn1_VWA1_VWB1_WSGRA0_WSGRB0_WS32_WG32_4_1_WGM8_WGMXCC1_WGMXCCGn1
    SolutionIndex: 56
    SolutionNameMin: Cijk_Alik_Bljk_HHS_BH_Bias_HA_S_SAV_UserArgs_MT64x128x64_MI16x16x1_SN_LDSB1_AFC1_AG0_AFEM1_AFEM1_ASEM1_CLR0_CADS0_DTLA0_DTLB0_DTVA0_DTVB0_EPS0_FDSI0_GRPM1_GRVWA8_GRVWB8_GSU1_GSUAMB_GSUC0_GSUWGMRR0_GLS0_ISA1100_IU1_K1_LDSTI0_LBSPPA128_LBSPPB128_LBSPPM0_LPA8_LPB8_LPM0_LRVW16_LWPMn1_MIAV1_MIWT4_2_MO40_NTn1_NTA0_NTB0_NTC0_NTD0_NTM0_NEPBS0_NLCA1_NLCB1_ONLL1_PGR1_PLR1_PKA0_SIA3_SS1_SU32_SUM1_SUS256_SPO0_SRVW0_SSO0_SVW1_SK0_SKFTR0_SKXCCM0_TLDS1_ULSGRO0_USL1_UIOFGRO0_USFGROn1_VSn1_VWA1_VWB1_WSGRA0_WSGRB0_WS32_WG16_8_1_WGM8_WGMXCC1_WGMXCCGn1
    SolutionIndex: 57
    SolutionNameMin: Cijk_Alik_Bljk_HHS_BH_Bias_HA_S_SAV_UserArgs_MT64x128x64_MI16x16x1_SN_LDSB1_AFC1_AG0_AFEM1_AFEM1_ASEM1_CLR0_CADS0_DTLA0_DTLB0_DTVA0_DTVB0_EPS0_FDSI0_GRPM1_GRVWA8_GRVWB8_GSU1_GSUAMB_GSUC0_GSUWGMRR0_GLS0_ISA1100_IU1_K1_LDSTI0_LBSPPA128_LBSPPB128_LBSPPM0_LPA8_LPB8_LPM0_LRVW16_LWPMn1_MIAV1_MIWT4_2_MO40_NTn1_NTA0_NTB0_NTC0_NTD0_NTM0_NEPBS0_NLCA1_NLCB1_ONLL1_PGR2_PLR1_PKA0_SIA3_SS1_SU32_SUM1_SUS256_SPO0_SRVW0_SSO0_SVW1_SK0_SKFTR0_SKXCCM0_TLDS1_ULSGRO0_USL1_UIOFGRO0_USFGROn1_VSn1_VWA1_VWB1_WSGRA0_WSGRB0_WS32_WG16_8_1_WGM8_WGMXCC1_WGMXCCGn1
    SolutionIndex: 58
    SolutionNameMin: Cijk_Alik_Bljk_HHS_BH_Bias_HA_S_SAV_UserArgs_MT64x128x32_MI16x16x1_SN_LDSB0_AFC1_AG0_AFEM1_AFEM1_ASEM1_CLR0_CADS0_DTLA0_DTLB0_DTVA0_DTVB0_EPS0_FDSI0_GRPM1_GRVWA8_GRVWB8_GSU1_GSUAMB_GSUC0_GSUWGMRR0_GLS0_ISA1100_IU1_K1_LDSTI0_LBSPPA128_LBSPPB128_LBSPPM0_LPA8_LPB8_LPM0_LRVW16_LWPMn1_MIAV1_MIWT4_2_MO40_NTn1_NTA0_NTB0_NTC0_NTD0_NTM0_NEPBS0_NLCA1_NLCB1_ONLL1_PGR1_PLR0_PKA0_SIA3_SS1_SU32_SUM1_SUS256_SPO0_SRVW0_SSO0_SVW1_SK0_SKFTR0_SKXCCM0_TLDS1_ULSGRO0_USL1_UIOFGRO0_USFGROn1_VSn1_VWA1_VWB1_WSGRA0_WSGRB0_WS32_WG16_8_1_WGM8_WGMXCC1_WGMXCCGn1
    SolutionIndex: 59
    SolutionNameMin: Cijk_Alik_Bljk_HHS_BH_Bias_HA_S_SAV_UserArgs_MT64x128x32_MI16x16x1_SN_LDSB0_AFC1_AG0_AFEM1_AFEM1_ASEM1_CLR0_CADS0_DTLA0_DTLB0_DTVA0_DTVB0_EPS0_FDSI0_GRPM1_GRVWA8_GRVWB8_GSU1_GSUAMB_GSUC0_GSUWGMRR0_GLS0_ISA1100_IU1_K1_LDSTI0_LBSPPA128_LBSPPB128_LBSPPM0_LPA8_LPB8_LPM0_LRVW16_LWPMn1_MIAV1_MIWT4_2_MO40_NTn1_NTA0_NTB0_NTC0_NTD0_NTM0_NEPBS0_NLCA1_NLCB1_ONLL1_PGR0_PLR0_PKA0_SIA1_SS1_SU32_SUM1_SUS256_SPO0_SRVW0_SSO0_SVW1_SK0_SKFTR0_SKXCCM0_TLDS1_ULSGRO0_USL1_UIOFGRO0_USFGROn1_VSn1_VWA1_VWB1_WSGRA0_WSGRB0_WS32_WG16_8_1_WGM8_WGMXCC1_WGMXCCGn1
    SolutionIndex: 60
    SolutionNameMin: Cijk_Alik_Bljk_HHS_BH_Bias_HA_S_SAV_UserArgs_MT128x128x32_MI16x16x1_SN_LDSB0_AFC1_AG0_AFEM1_AFEM1_ASEM1_CLR0_CADS0_DTLA0_DTLB0_DTVA0_DTVB0_EPS0_FDSI0_GRPM1_GRVWA8_GRVWB8_GSU1_GSUAMB_GSUC0_GSUWGMRR0_GLS0_ISA1100_IU1_K1_LDSTI0_LBSPPA128_LBSPPB128_LBSPPM0_LPA8_LPB8_LPM0_LRVW16_LWPMn1_MIAV1_MIWT8_2_MO40_NTn1_NTA0_NTB0_NTC0_NTD0_NTM0_NEPBS0_NLCA1_NLCB1_ONLL1_PGR0_PLR0_PKA0_SIA3_SS1_SU32_SUM1_SUS256_SPO0_SRVW0_SSO0_SVW1_SK0_SKFTR0_SKXCCM0_TLDS1_ULSGRO0_USL1_UIOFGRO0_USFGROn1_VSn1_VWA1_VWB1_WSGRA0_WSGRB0_WS32_WG16_8_1_WGM8_WGMXCC1_WGMXCCGn1
    SolutionIndex: 61
    SolutionNameMin: Cijk_Alik_Bljk_HHS_BH_Bias_HA_S_SAV_UserArgs_MT96x128x32_MI16x16x1_SN_LDSB0_AFC1_AG0_AFEM1_AFEM1_ASEM1_CLR0_CADS0_DTLA0_DTLB0_DTVA0_DTVB0_EPS0_FDSI0_GRPM1_GRVWA8_GRVWB8_GSU1_GSUAMB_GSUC0_GSUWGMRR0_GLS0_ISA1100_IU1_K1_LDSTI0_LBSPPA128_LBSPPB128_LBSPPM0_LPA8_LPB8_LPM0_LRVW16_LWPMn1_MIAV1_MIWT3_4_MO40_NTn1_NTA0_NTB0_NTC0_NTD0_NTM0_NEPBS0_NLCA1_NLCB1_ONLL1_PGR0_PLR0_PKA0_SIA1_SS1_SU32_SUM1_SUS256_SPO0_SRVW0_SSO0_SVW1_SK0_SKFTR0_SKXCCM0_TLDS1_ULSGRO0_USL1_UIOFGRO0_USFGROn1_VSn1_VWA1_VWB1_WSGRA0_WSGRB0_WS32_WG32_4_1_WGM8_WGMXCC1_WGMXCCGn1
    SolutionIndex: 62
    SolutionNameMin: Cijk_Alik_Bljk_HHS_BH_Bias_HA_S_SAV_UserArgs_MT32x64x64_MI16x16x1_SN_LDSB0_AFC1_AG0_AFEM1_AFEM1_ASEM1_CLR0_CADS0_DTLA0_DTLB0_DTVA0_DTVB0_EPS0_FDSI0_GRPM1_GRVWA8_GRVWB8_GSU1_GSUAMB_GSUC0_GSUWGMRR0_GLS0_ISA1100_IU1_K1_LDSTI0_LBSPPA128_LBSPPB128_LBSPPM0_LPA8_LPB8_LPM0_LRVW16_LWPMn1_MIAV1_MIWT1_2_MO40_NTn1_NTA0_NTB0_NTC0_NTD0_NTM0_NEPBS0_NLCA1_NLCB1_ONLL1_PGR1_PLR1_PKA0_SIA1_SS1_SU32_SUM1_SUS256_SPO0_SRVW0_SSO0_SVW1_SK0_SKFTR0_SKXCCM0_TLDS1_ULSGRO0_USL1_UIOFGRO0_USFGROn1_VSn1_VWA1_VWB1_WSGRA0_WSGRB0_WS32_WG32_4_1_WGM8_WGMXCC1_WGMXCCGn1
    SolutionIndex: 63
    SolutionNameMin: Cijk_Alik_Bljk_HHS_BH_Bias_HA_S_SAV_UserArgs_MT128x32x64_MI16x16x1_SN_LDSB0_AFC1_AG0_AFEM1_AFEM1_ASEM1_CLR0_CADS0_DTLA0_DTLB0_DTVA0_DTVB0_EPS0_FDSI0_GRPM1_GRVWA8_GRVWB8_GSU1_GSUAMB_GSUC0_GSUWGMRR0_GLS0_ISA1100_IU1_K1_LDSTI0_LBSPPA128_LBSPPB128_LBSPPM0_LPA8_LPB8_LPM0_LRVW16_LWPMn1_MIAV1_MIWT4_1_MO40_NTn1_NTA0_NTB0_NTC0_NTD0_NTM0_NEPBS0_NLCA1_NLCB1_ONLL1_PGR0_PLR1_PKA0_SIA3_SS1_SU32_SUM1_SUS256_SPO0_SRVW0_SSO0_SVW1_SK0_SKFTR0_SKXCCM0_TLDS1_ULSGRO0_USL1_UIOFGRO0_USFGROn1_VSn1_VWA1_VWB1_WSGRA0_WSGRB0_WS32_WG32_4_1_WGM8_WGMXCC1_WGMXCCGn1
    SolutionIndex: 64
    SolutionNameMin: Cijk_Alik_Bljk_HHS_BH_Bias_HA_S_SAV_UserArgs_MT32x128x32_MI16x16x1_SN_LDSB0_AFC1_AG0_AFEM1_AFEM1_ASEM1_CLR0_CADS0_DTLA0_DTLB0_DTVA0_DTVB0_EPS0_FDSI0_GRPM1_GRVWA8_GRVWB8_GSU1_GSUAMB_GSUC0_GSUWGMRR0_GLS0_ISA1100_IU1_K1_LDSTI0_LBSPPA128_LBSPPB128_LBSPPM0_LPA8_LPB8_LPM0_LRVW16_LWPMn1_MIAV1_MIWT2_2_MO40_NTn1_NTA0_NTB0_NTC0_NTD0_NTM0_NEPBS0_NLCA1_NLCB1_ONLL1_PGR2_PLR1_PKA0_SIA1_SS1_SU32_SUM1_SUS256_SPO0_SRVW0_SSO0_SVW1_SK0_SKFTR0_SKXCCM0_TLDS1_ULSGRO0_USL1_UIOFGRO0_USFGROn1_VSn1_VWA1_VWB1_WSGRA0_WSGRB0_WS32_WG16_8_1_WGM8_WGMXCC1_WGMXCCGn1
    SolutionIndex: 65
    SolutionNameMin: Cijk_Alik_Bljk_HHS_BH_Bias_HA_S_SAV_UserArgs_MT64x128x64_MI16x16x1_SN_LDSB0_AFC1_AG0_AFEM1_AFEM1_ASEM1_CLR0_CADS0_DTLA0_DTLB0_DTVA0_DTVB0_EPS0_FDSI0_GRPM1_GRVWA8_GRVWB8_GSU1_GSUAMB_GSUC0_GSUWGMRR0_GLS0_ISA1100_IU1_K1_LDSTI0_LBSPPA128_LBSPPB128_LBSPPM0_LPA8_LPB8_LPM0_LRVW16_LWPMn1_MIAV1_MIWT2_4_MO40_NTn1_NTA0_NTB0_NTC0_NTD0_NTM0_NEPBS0_NLCA1_NLCB1_ONLL1_PGR0_PLR1_PKA0_SIA3_SS1_SU32_SUM1_SUS256_SPO0_SRVW0_SSO0_SVW1_SK0_SKFTR0_SKXCCM0_TLDS1_ULSGRO0_USL1_UIOFGRO0_USFGROn1_VSn1_VWA1_VWB1_WSGRA0_WSGRB0_WS32_WG32_4_1_WGM8_WGMXCC1_WGMXCCGn1
    SolutionIndex: 66
    SolutionNameMin: Cijk_Alik_Bljk_HHS_BH_Bias_HA_S_SAV_UserArgs_MT128x64x32_MI16x16x1_SN_LDSB0_AFC1_AG0_AFEM1_AFEM1_ASEM1_CLR0_CADS0_DTLA0_DTLB0_DTVA0_DTVB0_EPS0_FDSI0_GRPM1_GRVWA8_GRVWB8_GSU1_GSUAMB_GSUC0_GSUWGMRR0_GLS0_ISA1100_IU1_K1_LDSTI0_LBSPPA128_LBSPPB128_LBSPPM0_LPA8_LPB8_LPM0_LRVW16_LWPMn1_MIAV1_MIWT2_4_MO40_NTn1_NTA0_NTB0_NTC0_NTD0_NTM0_NEPBS0_NLCA1_NLCB1_ONLL1_PGR1_PLR1_PKA0_SIA3_SS1_SU32_SUM1_SUS256_SPO0_SRVW0_SSO0_SVW1_SK0_SKFTR0_SKXCCM0_TLDS1_ULSGRO0_USL1_UIOFGRO0_USFGROn1_VSn1_VWA1_VWB1_WSGRA0_WSGRB0_WS32_WG64_2_1_WGM8_WGMXCC1_WGMXCCGn1
    SolutionIndex: 67
    SolutionNameMin: Cijk_Alik_Bljk_HHS_BH_Bias_HA_S_SAV_UserArgs_MT128x64x32_MI16x16x1_SN_LDSB0_AFC1_AG0_AFEM1_AFEM1_ASEM1_CLR0_CADS0_DTLA0_DTLB0_DTVA0_DTVB0_EPS0_FDSI0_GRPM1_GRVWA8_GRVWB8_GSU1_GSUAMB_GSUC0_GSUWGMRR0_GLS0_ISA1100_IU1_K1_LDSTI0_LBSPPA128_LBSPPB128_LBSPPM0_LPA8_LPB8_LPM0_LRVW16_LWPMn1_MIAV1_MIWT2_4_MO40_NTn1_NTA0_NTB0_NTC0_NTD0_NTM0_NEPBS0_NLCA1_NLCB1_ONLL1_PGR2_PLR1_PKA0_SIA3_SS1_SU32_SUM1_SUS256_SPO0_SRVW0_SSO0_SVW1_SK0_SKFTR0_SKXCCM0_TLDS1_ULSGRO0_USL1_UIOFGRO0_USFGROn1_VSn1_VWA1_VWB1_WSGRA0_WSGRB0_WS32_WG64_2_1_WGM8_WGMXCC1_WGMXCCGn1
    SolutionIndex: 68
    SolutionNameMin: Cijk_Alik_Bljk_HHS_BH_Bias_HA_S_SAV_UserArgs_MT64x128x32_MI16x16x1_SN_LDSB0_AFC1_AG0_AFEM1_AFEM1_ASEM1_CLR0_CADS0_DTLA0_DTLB0_DTVA0_DTVB0_EPS0_FDSI0_GRPM1_GRVWA8_GRVWB8_GSU1_GSUAMB_GSUC0_GSUWGMRR0_GLS0_ISA1100_IU1_K1_LDSTI0_LBSPPA128_LBSPPB128_LBSPPM0_LPA8_LPB8_LPM0_LRVW16_LWPMn1_MIAV1_MIWT2_4_MO40_NTn1_NTA0_NTB0_NTC0_NTD0_NTM0_NEPBS0_NLCA1_NLCB1_ONLL1_PGR2_PLR1_PKA0_SIA3_SS1_SU32_SUM1_SUS256_SPO0_SRVW0_SSO0_SVW1_SK0_SKFTR0_SKXCCM0_TLDS1_ULSGRO0_USL1_UIOFGRO0_USFGROn1_VSn1_VWA1_VWB1_WSGRA0_WSGRB0_WS32_WG32_4_1_WGM8_WGMXCC1_WGMXCCGn1
    SolutionIndex: 69
    SolutionNameMin: Cijk_Alik_Bljk_HHS_BH_Bias_HA_S_SAV_UserArgs_MT64x128x32_MI16x16x1_SN_LDSB0_AFC1_AG0_AFEM1_AFEM1_ASEM1_CLR0_CADS0_DTLA0_DTLB0_DTVA0_DTVB0_EPS0_FDSI0_GRPM1_GRVWA8_GRVWB8_GSU1_GSUAMB_GSUC0_GSUWGMRR0_GLS0_ISA1100_IU1_K1_LDSTI0_LBSPPA128_LBSPPB128_LBSPPM0_LPA8_LPB8_LPM0_LRVW16_LWPMn1_MIAV1_MIWT2_4_MO40_NTn1_NTA0_NTB0_NTC0_NTD0_NTM0_NEPBS0_NLCA1_NLCB1_ONLL1_PGR0_PLR0_PKA0_SIA1_SS1_SU32_SUM1_SUS256_SPO0_SRVW0_SSO0_SVW1_SK0_SKFTR0_SKXCCM0_TLDS1_ULSGRO0_USL1_UIOFGRO0_USFGROn1_VSn1_VWA1_VWB1_WSGRA0_WSGRB0_WS32_WG32_4_1_WGM8_WGMXCC1_WGMXCCGn1
    SolutionIndex: 70
    SolutionNameMin: Cijk_Alik_Bljk_HHS_BH_Bias_HA_S_SAV_UserArgs_MT128x128x32_MI16x16x1_SN_LDSB0_AFC1_AG0_AFEM1_AFEM1_ASEM1_CLR0_CADS0_DTLA0_DTLB0_DTVA0_DTVB0_EPS0_FDSI0_GRPM1_GRVWA8_GRVWB8_GSU1_GSUAMB_GSUC0_GSUWGMRR0_GLS0_ISA1100_IU1_K1_LDSTI0_LBSPPA128_LBSPPB128_LBSPPM0_LPA8_LPB8_LPM0_LRVW16_LWPMn1_MIAV1_MIWT4_4_MO40_NTn1_NTA0_NTB0_NTC0_NTD0_NTM0_NEPBS0_NLCA1_NLCB1_ONLL1_PGR0_PLR0_PKA0_SIA1_SS1_SU32_SUM1_SUS256_SPO0_SRVW0_SSO0_SVW1_SK0_SKFTR0_SKXCCM0_TLDS1_ULSGRO0_USL1_UIOFGRO0_USFGROn1_VSn1_VWA1_VWB1_WSGRA0_WSGRB0_WS32_WG32_4_1_WGM8_WGMXCC1_WGMXCCGn1
    SolutionIndex: 71
    SolutionNameMin: Cijk_Alik_Bljk_HHS_BH_Bias_HA_S_SAV_UserArgs_MT32x32x128_MI16x16x1_SN_LDSB0_AFC1_AG0_AFEM1_AFEM1_ASEM1_CLR0_CADS0_DTLA0_DTLB0_DTVA0_DTVB0_EPS0_FDSI0_GRPM1_GRVWA8_GRVWB8_GSU1_GSUAMB_GSUC0_GSUWGMRR0_GLS0_ISA1100_IU1_K1_LDSTI0_LBSPPA256_LBSPPB256_LBSPPM0_LPA8_LPB8_LPM0_LRVW16_LWPMn1_MIAV1_MIWT1_1_MO40_NTn1_NTA0_NTB0_NTC0_NTD0_NTM0_NEPBS0_NLCA1_NLCB1_ONLL1_PGR2_PLR1_PKA0_SIA1_SS1_SU32_SUM1_SUS256_SPO0_SRVW0_SSO0_SVW1_SK0_SKFTR0_SKXCCM0_TLDS1_ULSGRO0_USL1_UIOFGRO0_USFGROn1_VSn1_VWA1_VWB1_WSGRA0_WSGRB0_WS32_WG32_4_1_WGM8_WGMXCC1_WGMXCCGn1
    SolutionIndex: 72
    SolutionNameMin: Cijk_Alik_Bljk_HHS_BH_Bias_HA_S_SAV_UserArgs_MT32x64x128_MI16x16x1_SN_LDSB0_AFC1_AG0_AFEM1_AFEM1_ASEM1_CLR0_CADS0_DTLA0_DTLB0_DTVA0_DTVB0_EPS0_FDSI0_GRPM1_GRVWA8_GRVWB8_GSU1_GSUAMB_GSUC0_GSUWGMRR0_GLS0_ISA1100_IU1_K1_LDSTI0_LBSPPA256_LBSPPB256_LBSPPM0_LPA8_LPB8_LPM0_LRVW16_LWPMn1_MIAV1_MIWT1_2_MO40_NTn1_NTA0_NTB0_NTC0_NTD0_NTM0_NEPBS0_NLCA1_NLCB1_ONLL1_PGR2_PLR1_PKA0_SIA1_SS1_SU32_SUM1_SUS256_SPO0_SRVW0_SSO0_SVW1_SK0_SKFTR0_SKXCCM0_TLDS1_ULSGRO0_USL1_UIOFGRO0_USFGROn1_VSn1_VWA1_VWB1_WSGRA0_WSGRB0_WS32_WG32_4_1_WGM8_WGMXCC1_WGMXCCGn1
    SolutionIndex: 73
    SolutionNameMin: Cijk_Alik_Bljk_HHS_BH_Bias_HA_S_SAV_UserArgs_MT32x32x64_MI16x16x1_SN_LDSB0_AFC1_AG0_AFEM1_AFEM1_ASEM1_CLR0_CADS0_DTLA0_DTLB0_DTVA0_DTVB0_EPS0_FDSI0_GRPM1_GRVWA8_GRVWB8_GSU1_GSUAMB_GSUC0_GSUWGMRR0_GLS0_ISA1100_IU1_K1_LDSTI0_LBSPPA128_LBSPPB128_LBSPPM0_LPA8_LPB8_LPM0_LRVW16_LWPMn1_MIAV1_MIWT1_1_MO40_NTn1_NTA0_NTB0_NTC0_NTD0_NTM0_NEPBS0_NLCA1_NLCB1_ONLL1_PGR2_PLR1_PKA0_SIA3_SS1_SU32_SUM1_SUS256_SPO0_SRVW0_SSO0_SVW1_SK0_SKFTR0_SKXCCM0_TLDS1_ULSGRO0_USL1_UIOFGRO0_USFGROn1_VSn1_VWA1_VWB1_WSGRA0_WSGRB0_WS32_WG32_4_1_WGM8_WGMXCC1_WGMXCCGn1
    SolutionIndex: 74
    SolutionNameMin: Cijk_Alik_Bljk_HHS_BH_Bias_HA_S_SAV_UserArgs_MT64x48x128_MI16x16x1_SN_LDSB0_AFC1_AG0_AFEM1_AFEM1_ASEM1_CLR0_CADS0_DTLA0_DTLB0_DTVA0_DTVB0_EPS0_FDSI0_GRPM1_GRVWA8_GRVWB8_GSU1_GSUAMB_GSUC0_GSUWGMRR0_GLS0_ISA1100_IU1_K1_LDSTI0_LBSPPA256_LBSPPB256_LBSPPM0_LPA8_LPB8_LPM0_LRVW16_LWPMn1_MIAV1_MIWT1_3_MO40_NTn1_NTA0_NTB0_NTC0_NTD0_NTM0_NEPBS0_NLCA1_NLCB1_ONLL1_PGR1_PLR1_PKA0_SIA1_SS1_SU32_SUM1_SUS256_SPO0_SRVW0_SSO0_SVW1_SK0_SKFTR0_SKXCCM0_TLDS1_ULSGRO0_USL1_UIOFGRO0_USFGROn1_VSn1_VWA1_VWB1_WSGRA0_WSGRB0_WS32_WG64_2_1_WGM8_WGMXCC1_WGMXCCGn1
    SolutionIndex: 75
    SolutionNameMin: Cijk_Alik_Bljk_HHS_BH_Bias_HA_S_SAV_UserArgs_MT64x48x128_MI16x16x1_SN_LDSB0_AFC1_AG0_AFEM1_AFEM1_ASEM1_CLR0_CADS0_DTLA0_DTLB0_DTVA0_DTVB0_EPS0_FDSI0_GRPM1_GRVWA8_GRVWB8_GSU1_GSUAMB_GSUC0_GSUWGMRR0_GLS0_ISA1100_IU1_K1_LDSTI0_LBSPPA256_LBSPPB256_LBSPPM0_LPA8_LPB8_LPM0_LRVW16_LWPMn1_MIAV1_MIWT1_3_MO40_NTn1_NTA0_NTB0_NTC0_NTD0_NTM0_NEPBS0_NLCA1_NLCB1_ONLL1_PGR2_PLR1_PKA0_SIA1_SS1_SU32_SUM1_SUS256_SPO0_SRVW0_SSO0_SVW1_SK0_SKFTR0_SKXCCM0_TLDS1_ULSGRO0_USL1_UIOFGRO0_USFGROn1_VSn1_VWA1_VWB1_WSGRA0_WSGRB0_WS32_WG64_2_1_WGM8_WGMXCC1_WGMXCCGn1
    SolutionIndex: 76
    SolutionNameMin: Cijk_Alik_Bljk_HHS_BH_Bias_HA_S_SAV_UserArgs_MT64x32x64_MI16x16x1_SN_LDSB0_AFC1_AG0_AFEM1_AFEM1_ASEM1_CLR0_CADS0_DTLA0_DTLB0_DTVA0_DTVB0_EPS0_FDSI0_GRPM1_GRVWA8_GRVWB8_GSU1_GSUAMB_GSUC0_GSUWGMRR0_GLS0_ISA1100_IU1_K1_LDSTI0_LBSPPA128_LBSPPB128_LBSPPM0_LPA8_LPB8_LPM0_LRVW16_LWPMn1_MIAV1_MIWT1_2_MO40_NTn1_NTA0_NTB0_NTC0_NTD0_NTM0_NEPBS0_NLCA1_NLCB1_ONLL1_PGR2_PLR1_PKA0_SIA1_SS1_SU32_SUM1_SUS256_SPO0_SRVW0_SSO0_SVW1_SK0_SKFTR0_SKXCCM0_TLDS1_ULSGRO0_USL1_UIOFGRO0_USFGROn1_VSn1_VWA1_VWB1_WSGRA0_WSGRB0_WS32_WG64_2_1_WGM8_WGMXCC1_WGMXCCGn1
    SolutionIndex: 77
    SolutionNameMin: Cijk_Alik_Bljk_HHS_BH_Bias_HA_S_SAV_UserArgs_MT64x96x64_MI16x16x1_SN_LDSB0_AFC1_AG0_AFEM1_AFEM1_ASEM1_CLR0_CADS0_DTLA0_DTLB0_DTVA0_DTVB0_EPS0_FDSI0_GRPM1_GRVWA8_GRVWB8_GSU1_GSUAMB_GSUC0_GSUWGMRR0_GLS0_ISA1100_IU1_K1_LDSTI0_LBSPPA128_LBSPPB128_LBSPPM0_LPA8_LPB8_LPM0_LRVW16_LWPMn1_MIAV1_MIWT2_3_MO40_NTn1_NTA0_NTB0_NTC0_NTD0_NTM0_NEPBS0_NLCA1_NLCB1_ONLL1_PGR2_PLR1_PKA0_SIA1_SS1_SU32_SUM1_SUS256_SPO0_SRVW0_SSO0_SVW1_SK0_SKFTR0_SKXCCM0_TLDS1_ULSGRO0_USL1_UIOFGRO0_USFGROn1_VSn1_VWA1_VWB1_WSGRA0_WSGRB0_WS32_WG32_4_1_WGM8_WGMXCC1_WGMXCCGn1
    SolutionIndex: 78
    SolutionNameMin: Cijk_Alik_Bljk_HHS_BH_Bias_HA_S_SAV_UserArgs_MT64x96x32_MI16x16x1_SN_LDSB0_AFC1_AG0_AFEM1_AFEM1_ASEM1_CLR0_CADS0_DTLA0_DTLB0_DTVA0_DTVB0_EPS0_FDSI0_GRPM1_GRVWA8_GRVWB8_GSU1_GSUAMB_GSUC0_GSUWGMRR0_GLS0_ISA1100_IU1_K1_LDSTI0_LBSPPA128_LBSPPB128_LBSPPM0_LPA8_LPB8_LPM0_LRVW16_LWPMn1_MIAV1_MIWT2_3_MO40_NTn1_NTA0_NTB0_NTC0_NTD0_NTM0_NEPBS0_NLCA1_NLCB1_ONLL1_PGR2_PLR0_PKA0_SIA1_SS1_SU32_SUM1_SUS256_SPO0_SRVW0_SSO0_SVW1_SK0_SKFTR0_SKXCCM0_TLDS1_ULSGRO0_USL1_UIOFGRO0_USFGROn1_VSn1_VWA1_VWB1_WSGRA0_WSGRB0_WS32_WG32_4_1_WGM8_WGMXCC1_WGMXCCGn1
    SolutionIndex: 79
    SolutionNameMin: Cijk_Alik_Bljk_HHS_BH_Bias_HA_S_SAV_UserArgs_MT64x96x32_MI16x16x1_SN_LDSB0_AFC1_AG0_AFEM1_AFEM1_ASEM1_CLR0_CADS0_DTLA0_DTLB0_DTVA0_DTVB0_EPS0_FDSI0_GRPM1_GRVWA8_GRVWB8_GSU1_GSUAMB_GSUC0_GSUWGMRR0_GLS0_ISA1100_IU1_K1_LDSTI0_LBSPPA128_LBSPPB128_LBSPPM0_LPA8_LPB8_LPM0_LRVW16_LWPMn1_MIAV1_MIWT2_3_MO40_NTn1_NTA0_NTB0_NTC0_NTD0_NTM0_NEPBS0_NLCA1_NLCB1_ONLL1_PGR2_PLR1_PKA0_SIA1_SS1_SU32_SUM1_SUS256_SPO0_SRVW0_SSO0_SVW1_SK0_SKFTR0_SKXCCM0_TLDS1_ULSGRO0_USL1_UIOFGRO0_USFGROn1_VSn1_VWA1_VWB1_WSGRA0_WSGRB0_WS32_WG32_4_1_WGM8_WGMXCC1_WGMXCCGn1
    SolutionIndex: 81
    SolutionNameMin: Cijk_Alik_Bljk_HHS_BH_Bias_HA_S_SAV_UserArgs_MT64x32x128_MI16x16x1_SN_LDSB0_AFC1_AG0_AFEM1_AFEM1_ASEM1_CLR0_CADS0_DTLA0_DTLB0_DTVA0_DTVB0_EPS0_FDSI0_GRPM1_GRVWA8_GRVWB8_GSU1_GSUAMB_GSUC0_GSUWGMRR0_GLS0_ISA1100_IU1_K1_LDSTI0_LBSPPA256_LBSPPB256_LBSPPM0_LPA8_LPB8_LPM0_LRVW16_LWPMn1_MIAV1_MIWT1_2_MO40_NTn1_NTA0_NTB0_NTC0_NTD0_NTM0_NEPBS0_NLCA1_NLCB1_ONLL1_PGR2_PLR1_PKA0_SIA1_SS1_SU32_SUM1_SUS256_SPO0_SRVW0_SSO0_SVW1_SK0_SKFTR0_SKXCCM0_TLDS1_ULSGRO0_USL1_UIOFGRO0_USFGROn1_VSn1_VWA1_VWB1_WSGRA0_WSGRB0_WS32_WG64_2_1_WGM8_WGMXCC1_WGMXCCGn1
    SolutionIndex: 83
    SolutionNameMin: Cijk_Alik_Bljk_HHS_BH_Bias_HA_S_SAV_UserArgs_MT128x32x32_MI16x16x1_SN_LDSB0_AFC1_AG0_AFEM1_AFEM1_ASEM1_CLR0_CADS0_DTLA0_DTLB0_DTVA0_DTVB0_EPS0_FDSI0_GRPM1_GRVWA8_GRVWB8_GSU1_GSUAMB_GSUC0_GSUWGMRR0_GLS0_ISA1100_IU1_K1_LDSTI0_LBSPPA128_LBSPPB128_LBSPPM0_LPA8_LPB8_LPM0_LRVW16_LWPMn1_MIAV1_MIWT2_2_MO40_NTn1_NTA0_NTB0_NTC0_NTD0_NTM0_NEPBS0_NLCA1_NLCB1_ONLL1_PGR2_PLR0_PKA0_SIA1_SS1_SU32_SUM1_SUS256_SPO0_SRVW0_SSO0_SVW1_SK0_SKFTR0_SKXCCM0_TLDS1_ULSGRO0_USL1_UIOFGRO0_USFGROn1_VSn1_VWA1_VWB1_WSGRA0_WSGRB0_WS32_WG64_2_1_WGM8_WGMXCC1_WGMXCCGn1
    SolutionIndex: 84
    SolutionNameMin: Cijk_Alik_Bljk_HHS_BH_Bias_HA_S_SAV_UserArgs_MT128x32x32_MI16x16x1_SN_LDSB0_AFC1_AG0_AFEM1_AFEM1_ASEM1_CLR0_CADS0_DTLA0_DTLB0_DTVA0_DTVB0_EPS0_FDSI0_GRPM1_GRVWA8_GRVWB8_GSU1_GSUAMB_GSUC0_GSUWGMRR0_GLS0_ISA1100_IU1_K1_LDSTI0_LBSPPA128_LBSPPB128_LBSPPM0_LPA8_LPB8_LPM0_LRVW16_LWPMn1_MIAV1_MIWT2_2_MO40_NTn1_NTA0_NTB0_NTC0_NTD0_NTM0_NEPBS0_NLCA1_NLCB1_ONLL1_PGR1_PLR1_PKA0_SIA1_SS1_SU32_SUM1_SUS256_SPO0_SRVW0_SSO0_SVW1_SK0_SKFTR0_SKXCCM0_TLDS1_ULSGRO0_USL1_UIOFGRO0_USFGROn1_VSn1_VWA1_VWB1_WSGRA0_WSGRB0_WS32_WG64_2_1_WGM8_WGMXCC1_WGMXCCGn1
    SolutionIndex: 85
    SolutionNameMin: Cijk_Alik_Bljk_HHS_BH_Bias_HA_S_SAV_UserArgs_MT128x48x32_MI16x16x1_SN_LDSB0_AFC1_AG0_AFEM1_AFEM1_ASEM1_CLR0_CADS0_DTLA0_DTLB0_DTVA0_DTVB0_EPS0_FDSI0_GRPM1_GRVWA8_GRVWB4_GSU1_GSUAMB_GSUC0_GSUWGMRR0_GLS0_ISA1100_IU1_K1_LDSTI0_LBSPPA128_LBSPPB128_LBSPPM0_LPA8_LPB8_LPM0_LRVW16_LWPMn1_MIAV1_MIWT2_3_MO40_NTn1_NTA0_NTB0_NTC0_NTD0_NTM0_NEPBS0_NLCA1_NLCB1_ONLL1_PGR2_PLR1_PKA0_SIA1_SS1_SU32_SUM1_SUS256_SPO0_SRVW0_SSO0_SVW1_SK0_SKFTR0_SKXCCM0_TLDS1_ULSGRO0_USL1_UIOFGRO0_USFGROn1_VSn1_VWA1_VWB1_WSGRA0_WSGRB0_WS32_WG64_2_1_WGM8_WGMXCC1_WGMXCCGn1
    SolutionIndex: 86
    SolutionNameMin: Cijk_Alik_Bljk_HHS_BH_Bias_HA_S_SAV_UserArgs_MT128x64x32_MI16x16x1_SN_LDSB0_AFC1_AG0_AFEM1_AFEM1_ASEM1_CLR0_CADS0_DTLA0_DTLB0_DTVA0_DTVB0_EPS0_FDSI0_GRPM1_GRVWA8_GRVWB8_GSU1_GSUAMB_GSUC0_GSUWGMRR0_GLS0_ISA1100_IU1_K1_LDSTI0_LBSPPA128_LBSPPB128_LBSPPM0_LPA8_LPB8_LPM0_LRVW16_LWPMn1_MIAV1_MIWT2_4_MO40_NTn1_NTA0_NTB0_NTC0_NTD0_NTM0_NEPBS0_NLCA1_NLCB1_ONLL1_PGR1_PLR0_PKA0_SIA3_SS1_SU32_SUM1_SUS256_SPO0_SRVW0_SSO0_SVW1_SK0_SKFTR0_SKXCCM0_TLDS1_ULSGRO0_USL1_UIOFGRO0_USFGROn1_VSn1_VWA1_VWB1_WSGRA0_WSGRB0_WS32_WG64_2_1_WGM8_WGMXCC1_WGMXCCGn1
    SolutionIndex: 87
    SolutionNameMin: Cijk_Alik_Bljk_HHS_BH_Bias_HA_S_SAV_UserArgs_MT128x96x32_MI16x16x1_SN_LDSB0_AFC1_AG0_AFEM1_AFEM1_ASEM1_CLR0_CADS0_DTLA0_DTLB0_DTVA0_DTVB0_EPS0_FDSI0_GRPM1_GRVWA8_GRVWB8_GSU1_GSUAMB_GSUC0_GSUWGMRR0_GLS0_ISA1100_IU1_K1_LDSTI0_LBSPPA128_LBSPPB128_LBSPPM0_LPA8_LPB8_LPM0_LRVW16_LWPMn1_MIAV1_MIWT4_3_MO40_NTn1_NTA0_NTB0_NTC0_NTD0_NTM0_NEPBS0_NLCA1_NLCB1_ONLL1_PGR2_PLR0_PKA0_SIA1_SS1_SU32_SUM1_SUS256_SPO0_SRVW0_SSO0_SVW1_SK0_SKFTR0_SKXCCM0_TLDS1_ULSGRO0_USL1_UIOFGRO0_USFGROn1_VSn1_VWA1_VWB1_WSGRA0_WSGRB0_WS32_WG32_4_1_WGM8_WGMXCC1_WGMXCCGn1
    SolutionIndex: 88
    SolutionNameMin: Cijk_Alik_Bljk_HHS_BH_Bias_HA_S_SAV_UserArgs_MT16x16x128_MI16x16x1_SN_LDSB0_AFC1_AG0_AFEM1_AFEM1_ASEM1_CLR0_CADS0_DTLA0_DTLB0_DTVA0_DTVB0_EPS0_FDSI0_GRPM1_GRVWA8_GRVWB8_GSU1_GSUAMB_GSUC0_GSUWGMRR0_GLS0_ISA1100_IU1_K1_LDSTI0_LBSPPA256_LBSPPB256_LBSPPM0_LPA8_LPB8_LPM0_LRVW16_LWPMn1_MIAV1_MIWT1_1_MO40_NTn1_NTA0_NTB0_NTC0_NTD0_NTM0_NEPBS0_NLCA1_NLCB1_ONLL1_PGR1_PLR1_PKA0_SIA3_SS1_SU32_SUM1_SUS256_SPO0_SRVW0_SSO0_SVW1_SK0_SKFTR0_SKXCCM0_TLDS1_ULSGRO0_USL1_UIOFGRO0_USFGROn1_VSn1_VWA1_VWB1_WSGRA0_WSGRB0_WS32_WG16_2_1_WGM8_WGMXCC1_WGMXCCGn1
    SolutionIndex: 89
    SolutionNameMin: Cijk_Alik_Bljk_HHS_BH_Bias_HA_S_SAV_UserArgs_MT64x64x32_MI16x16x1_SN_LDSB0_AFC1_AG0_AFEM1_AFEM1_ASEM1_CLR0_CADS0_DTLA0_DTLB0_DTVA0_DTVB0_EPS0_FDSI0_GRPM1_GRVWA8_GRVWB8_GSU1_GSUAMB_GSUC0_GSUWGMRR0_GLS0_ISA1100_IU1_K1_LDSTI0_LBSPPA128_LBSPPB128_LBSPPM0_LPA8_LPB8_LPM0_LRVW16_LWPMn1_MIAV1_MIWT1_4_MO40_NTn1_NTA0_NTB0_NTC0_NTD0_NTM0_NEPBS0_NLCA1_NLCB1_ONLL1_PGR2_PLR1_PKA0_SIA1_SS1_SU32_SUM1_SUS256_SPO0_SRVW0_SSO0_SVW1_SK0_SKFTR0_SKXCCM0_TLDS1_ULSGRO0_USL1_UIOFGRO0_USFGROn1_VSn1_VWA1_VWB1_WSGRA0_WSGRB0_WS32_WG64_2_1_WGM8_WGMXCC1_WGMXCCGn1
    SolutionIndex: 90
    SolutionNameMin: Cijk_Alik_Bljk_HHS_BH_Bias_HA_S_SAV_UserArgs_MT128x32x32_MI16x16x1_SN_LDSB0_AFC1_AG0_AFEM1_AFEM1_ASEM1_CLR0_CADS0_DTLA0_DTLB0_DTVA0_DTVB0_EPS0_FDSI0_GRPM1_GRVWA8_GRVWB8_GSU1_GSUAMB_GSUC0_GSUWGMRR0_GLS0_ISA1100_IU1_K1_LDSTI0_LBSPPA128_LBSPPB128_LBSPPM0_LPA8_LPB8_LPM0_LRVW16_LWPMn1_MIAV1_MIWT2_2_MO40_NTn1_NTA0_NTB0_NTC0_NTD0_NTM0_NEPBS0_NLCA1_NLCB1_ONLL1_PGR2_PLR1_PKA0_SIA1_SS1_SU32_SUM1_SUS256_SPO0_SRVW0_SSO0_SVW1_SK0_SKFTR0_SKXCCM0_TLDS1_ULSGRO0_USL1_UIOFGRO0_USFGROn1_VSn1_VWA1_VWB1_WSGRA0_WSGRB0_WS32_WG64_2_1_WGM8_WGMXCC1_WGMXCCGn1
    SolutionIndex: 91
    SolutionNameMin: Cijk_Alik_Bljk_HHS_BH_Bias_HA_S_SAV_UserArgs_MT64x64x32_MI16x16x1_SN_LDSB0_AFC1_AG0_AFEM1_AFEM1_ASEM1_CLR0_CADS0_DTLA0_DTLB0_DTVA0_DTVB0_EPS0_FDSI0_GRPM1_GRVWA8_GRVWB8_GSU1_GSUAMB_GSUC0_GSUWGMRR0_GLS0_ISA1100_IU1_K1_LDSTI0_LBSPPA128_LBSPPB128_LBSPPM0_LPA8_LPB8_LPM0_LRVW16_LWPMn1_MIAV1_MIWT2_2_MO40_NTn1_NTA0_NTB0_NTC0_NTD0_NTM0_NEPBS0_NLCA1_NLCB1_ONLL1_PGR2_PLR0_PKA0_SIA3_SS1_SU32_SUM1_SUS256_SPO0_SRVW0_SSO0_SVW1_SK0_SKFTR0_SKXCCM0_TLDS1_ULSGRO0_USL1_UIOFGRO0_USFGROn1_VSn1_VWA1_VWB1_WSGRA0_WSGRB0_WS32_WG32_4_1_WGM8_WGMXCC1_WGMXCCGn1
    SolutionIndex: 92
    SolutionNameMin: Cijk_Alik_Bljk_HHS_BH_Bias_HA_S_SAV_UserArgs_MT128x64x64_MI16x16x1_SN_LDSB0_AFC1_AG0_AFEM1_AFEM1_ASEM1_CLR0_CADS0_DTLA0_DTLB0_DTVA0_DTVB0_EPS0_FDSI0_GRPM1_GRVWA8_GRVWB8_GSU1_GSUAMB_GSUC0_GSUWGMRR0_GLS0_ISA1100_IU1_K1_LDSTI0_LBSPPA128_LBSPPB128_LBSPPM0_LPA8_LPB8_LPM0_LRVW16_LWPMn1_MIAV1_MIWT4_2_MO40_NTn1_NTA0_NTB0_NTC0_NTD0_NTM0_NEPBS0_NLCA1_NLCB1_ONLL1_PGR0_PLR0_PKA0_SIA3_SS1_SU32_SUM1_SUS256_SPO0_SRVW0_SSO0_SVW1_SK0_SKFTR0_SKXCCM0_TLDS1_ULSGRO0_USL1_UIOFGRO0_USFGROn1_VSn1_VWA1_VWB1_WSGRA0_WSGRB0_WS32_WG32_4_1_WGM8_WGMXCC1_WGMXCCGn1
    SolutionIndex: 93
    SolutionNameMin: Cijk_Alik_Bljk_HHS_BH_Bias_HA_S_SAV_UserArgs_MT128x64x32_MI16x16x1_SN_LDSB0_AFC1_AG0_AFEM1_AFEM1_ASEM1_CLR0_CADS0_DTLA0_DTLB0_DTVA0_DTVB0_EPS0_FDSI0_GRPM1_GRVWA8_GRVWB8_GSU1_GSUAMB_GSUC0_GSUWGMRR0_GLS0_ISA1100_IU1_K1_LDSTI0_LBSPPA128_LBSPPB128_LBSPPM0_LPA8_LPB8_LPM0_LRVW16_LWPMn1_MIAV1_MIWT4_2_MO40_NTn1_NTA0_NTB0_NTC0_NTD0_NTM0_NEPBS0_NLCA1_NLCB1_ONLL1_PGR2_PLR1_PKA0_SIA3_SS1_SU32_SUM1_SUS256_SPO0_SRVW0_SSO0_SVW1_SK0_SKFTR0_SKXCCM0_TLDS1_ULSGRO0_USL1_UIOFGRO0_USFGROn1_VSn1_VWA1_VWB1_WSGRA0_WSGRB0_WS32_WG32_4_1_WGM8_WGMXCC1_WGMXCCGn1
    SolutionIndex: 94
    SolutionNameMin: Cijk_Alik_Bljk_HHS_BH_Bias_HA_S_SAV_UserArgs_MT128x64x64_MI16x16x1_SN_LDSB1_AFC1_AG0_AFEM1_AFEM1_ASEM1_CLR0_CADS0_DTLA0_DTLB0_DTVA0_DTVB0_EPS0_FDSI0_GRPM1_GRVWA8_GRVWB8_GSU1_GSUAMB_GSUC0_GSUWGMRR0_GLS0_ISA1100_IU1_K1_LDSTI0_LBSPPA128_LBSPPB128_LBSPPM0_LPA8_LPB8_LPM0_LRVW16_LWPMn1_MIAV1_MIWT2_4_MO40_NTn1_NTA0_NTB0_NTC0_NTD0_NTM0_NEPBS0_NLCA1_NLCB1_ONLL1_PGR2_PLR1_PKA0_SIA3_SS1_SU32_SUM1_SUS256_SPO0_SRVW0_SSO0_SVW1_SK0_SKFTR0_SKXCCM0_TLDS1_ULSGRO0_USL1_UIOFGRO0_USFGROn1_VSn1_VWA1_VWB1_WSGRA0_WSGRB0_WS32_WG64_2_1_WGM8_WGMXCC1_WGMXCCGn1
    SolutionIndex: 95
    SolutionNameMin: Cijk_Alik_Bljk_HHS_BH_Bias_HA_S_SAV_UserArgs_MT128x48x32_MI16x16x1_SN_LDSB0_AFC1_AG0_AFEM1_AFEM1_ASEM1_CLR0_CADS0_DTLA0_DTLB0_DTVA0_DTVB0_EPS0_FDSI0_GRPM1_GRVWA8_GRVWB4_GSU1_GSUAMB_GSUC0_GSUWGMRR0_GLS0_ISA1100_IU1_K1_LDSTI0_LBSPPA128_LBSPPB128_LBSPPM0_LPA8_LPB8_LPM0_LRVW16_LWPMn1_MIAV1_MIWT2_3_MO40_NTn1_NTA0_NTB0_NTC0_NTD0_NTM0_NEPBS0_NLCA1_NLCB1_ONLL1_PGR1_PLR0_PKA0_SIA3_SS1_SU32_SUM1_SUS256_SPO0_SRVW0_SSO0_SVW1_SK0_SKFTR0_SKXCCM0_TLDS1_ULSGRO0_USL1_UIOFGRO0_USFGROn1_VSn1_VWA1_VWB1_WSGRA0_WSGRB0_WS32_WG64_2_1_WGM8_WGMXCC1_WGMXCCGn1
    SolutionIndex: 96
    SolutionNameMin: Cijk_Alik_Bljk_HHS_BH_Bias_HA_S_SAV_UserArgs_MT64x128x32_MI16x16x1_SN_LDSB0_AFC1_AG0_AFEM1_AFEM1_ASEM1_CLR0_CADS0_DTLA0_DTLB0_DTVA0_DTVB0_EPS0_FDSI0_GRPM1_GRVWA8_GRVWB8_GSU1_GSUAMB_GSUC0_GSUWGMRR0_GLS0_ISA1100_IU1_K1_LDSTI0_LBSPPA128_LBSPPB128_LBSPPM0_LPA8_LPB8_LPM0_LRVW16_LWPMn1_MIAV1_MIWT1_8_MO40_NTn1_NTA0_NTB0_NTC0_NTD0_NTM0_NEPBS0_NLCA1_NLCB1_ONLL1_PGR0_PLR0_PKA0_SIA3_SS1_SU32_SUM1_SUS256_SPO0_SRVW0_SSO0_SVW1_SK0_SKFTR0_SKXCCM0_TLDS1_ULSGRO0_USL1_UIOFGRO0_USFGROn1_VSn1_VWA1_VWB1_WSGRA0_WSGRB0_WS32_WG64_2_1_WGM8_WGMXCC1_WGMXCCGn1
    SolutionIndex: 97
    SolutionNameMin: Cijk_Alik_Bljk_HHS_BH_Bias_HA_S_SAV_UserArgs_MT128x64x32_MI16x16x1_SN_LDSB0_AFC1_AG0_AFEM1_AFEM1_ASEM1_CLR0_CADS0_DTLA0_DTLB0_DTVA0_DTVB0_EPS0_FDSI0_GRPM1_GRVWA8_GRVWB8_GSU1_GSUAMB_GSUC0_GSUWGMRR0_GLS0_ISA1100_IU1_K1_LDSTI0_LBSPPA128_LBSPPB128_LBSPPM0_LPA8_LPB8_LPM0_LRVW16_LWPMn1_MIAV1_MIWT2_4_MO40_NTn1_NTA0_NTB0_NTC0_NTD0_NTM0_NEPBS0_NLCA1_NLCB1_ONLL1_PGR0_PLR0_PKA0_SIA3_SS1_SU32_SUM1_SUS256_SPO0_SRVW0_SSO0_SVW1_SK0_SKFTR0_SKXCCM0_TLDS1_ULSGRO0_USL1_UIOFGRO0_USFGROn1_VSn1_VWA1_VWB1_WSGRA0_WSGRB0_WS32_WG64_2_1_WGM8_WGMXCC1_WGMXCCGn1
    SolutionIndex: 98
    SolutionNameMin: Cijk_Alik_Bljk_HHS_BH_Bias_HA_S_SAV_UserArgs_MT128x96x32_MI16x16x1_SN_LDSB1_AFC1_AG0_AFEM1_AFEM1_ASEM1_CLR0_CADS0_DTLA0_DTLB0_DTVA0_DTVB0_EPS0_FDSI0_GRPM1_GRVWA8_GRVWB8_GSU1_GSUAMB_GSUC0_GSUWGMRR0_GLS0_ISA1100_IU1_K1_LDSTI0_LBSPPA128_LBSPPB128_LBSPPM0_LPA8_LPB8_LPM0_LRVW16_LWPMn1_MIAV1_MIWT4_3_MO40_NTn1_NTA0_NTB0_NTC0_NTD0_NTM0_NEPBS0_NLCA1_NLCB1_ONLL1_PGR1_PLR1_PKA0_SIA3_SS1_SU32_SUM1_SUS256_SPO0_SRVW0_SSO0_SVW1_SK0_SKFTR0_SKXCCM0_TLDS1_ULSGRO0_USL1_UIOFGRO0_USFGROn1_VSn1_VWA1_VWB1_WSGRA0_WSGRB0_WS32_WG32_4_1_WGM8_WGMXCC1_WGMXCCGn1
    SolutionIndex: 99
    SolutionNameMin: Cijk_Alik_Bljk_HHS_BH_Bias_HA_S_SAV_UserArgs_MT128x96x32_MI16x16x1_SN_LDSB1_AFC1_AG0_AFEM1_AFEM1_ASEM1_CLR0_CADS0_DTLA0_DTLB0_DTVA0_DTVB0_EPS0_FDSI0_GRPM1_GRVWA8_GRVWB8_GSU1_GSUAMB_GSUC0_GSUWGMRR0_GLS0_ISA1100_IU1_K1_LDSTI0_LBSPPA128_LBSPPB128_LBSPPM0_LPA8_LPB8_LPM0_LRVW16_LWPMn1_MIAV1_MIWT4_3_MO40_NTn1_NTA0_NTB0_NTC0_NTD0_NTM0_NEPBS0_NLCA1_NLCB1_ONLL1_PGR2_PLR1_PKA0_SIA3_SS1_SU32_SUM1_SUS256_SPO0_SRVW0_SSO0_SVW1_SK0_SKFTR0_SKXCCM0_TLDS1_ULSGRO0_USL1_UIOFGRO0_USFGROn1_VSn1_VWA1_VWB1_WSGRA0_WSGRB0_WS32_WG32_4_1_WGM8_WGMXCC1_WGMXCCGn1
    SolutionIndex: 100
    SolutionNameMin: Cijk_Alik_Bljk_HHS_BH_Bias_HA_S_SAV_UserArgs_MT128x96x32_MI16x16x1_SN_LDSB0_AFC1_AG0_AFEM1_AFEM1_ASEM1_CLR0_CADS0_DTLA0_DTLB0_DTVA0_DTVB0_EPS0_FDSI0_GRPM1_GRVWA8_GRVWB8_GSU1_GSUAMB_GSUC0_GSUWGMRR0_GLS0_ISA1100_IU1_K1_LDSTI0_LBSPPA128_LBSPPB128_LBSPPM0_LPA8_LPB8_LPM0_LRVW16_LWPMn1_MIAV1_MIWT2_6_MO40_NTn1_NTA0_NTB0_NTC0_NTD0_NTM0_NEPBS0_NLCA1_NLCB1_ONLL1_PGR0_PLR0_PKA0_SIA3_SS1_SU32_SUM1_SUS256_SPO0_SRVW0_SSO0_SVW1_SK0_SKFTR0_SKXCCM0_TLDS1_ULSGRO0_USL1_UIOFGRO0_USFGROn1_VSn1_VWA1_VWB1_WSGRA0_WSGRB0_WS32_WG64_2_1_WGM8_WGMXCC1_WGMXCCGn1
    SolutionIndex: 101
    SolutionNameMin: Cijk_Alik_Bljk_HHS_BH_Bias_HA_S_SAV_UserArgs_MT128x96x32_MI16x16x1_SN_LDSB0_AFC1_AG0_AFEM1_AFEM1_ASEM1_CLR0_CADS0_DTLA0_DTLB0_DTVA0_DTVB0_EPS0_FDSI0_GRPM1_GRVWA8_GRVWB8_GSU1_GSUAMB_GSUC0_GSUWGMRR0_GLS0_ISA1100_IU1_K1_LDSTI0_LBSPPA128_LBSPPB128_LBSPPM0_LPA8_LPB8_LPM0_LRVW16_LWPMn1_MIAV1_MIWT4_3_MO40_NTn1_NTA0_NTB0_NTC0_NTD0_NTM0_NEPBS0_NLCA1_NLCB1_ONLL1_PGR1_PLR1_PKA0_SIA3_SS1_SU32_SUM1_SUS256_SPO0_SRVW0_SSO0_SVW1_SK0_SKFTR0_SKXCCM0_TLDS1_ULSGRO0_USL1_UIOFGRO0_USFGROn1_VSn1_VWA1_VWB1_WSGRA0_WSGRB0_WS32_WG32_4_1_WGM8_WGMXCC1_WGMXCCGn1
    SolutionIndex: 103
    SolutionNameMin: Cijk_Alik_Bljk_HHS_BH_Bias_HA_S_SAV_UserArgs_MT64x32x128_MI16x16x1_SN_LDSB0_AFC1_AG0_AFEM1_AFEM1_ASEM1_CLR0_CADS0_DTLA0_DTLB0_DTVA0_DTVB0_EPS0_FDSI0_GRPM1_GRVWA8_GRVWB8_GSU1_GSUAMB_GSUC0_GSUWGMRR0_GLS0_ISA1100_IU1_K1_LDSTI0_LBSPPA256_LBSPPB256_LBSPPM0_LPA8_LPB8_LPM0_LRVW16_LWPMn1_MIAV1_MIWT2_1_MO40_NTn1_NTA0_NTB0_NTC0_NTD0_NTM0_NEPBS0_NLCA1_NLCB1_ONLL1_PGR2_PLR1_PKA0_SIA1_SS1_SU32_SUM1_SUS256_SPO0_SRVW0_SSO0_SVW1_SK0_SKFTR0_SKXCCM0_TLDS1_ULSGRO0_USL1_UIOFGRO0_USFGROn1_VSn1_VWA1_VWB1_WSGRA0_WSGRB0_WS32_WG32_4_1_WGM8_WGMXCC1_WGMXCCGn1
    SolutionIndex: 104
    SolutionNameMin: Cijk_Alik_Bljk_HHS_BH_Bias_HA_S_SAV_UserArgs_MT128x64x64_MI16x16x1_SN_LDSB1_AFC1_AG0_AFEM1_AFEM1_ASEM1_CLR0_CADS0_DTLA0_DTLB0_DTVA0_DTVB0_EPS0_FDSI0_GRPM1_GRVWA8_GRVWB8_GSU1_GSUAMB_GSUC0_GSUWGMRR0_GLS0_ISA1100_IU1_K1_LDSTI0_LBSPPA128_LBSPPB128_LBSPPM0_LPA8_LPB8_LPM0_LRVW16_LWPMn1_MIAV1_MIWT2_4_MO40_NTn1_NTA0_NTB0_NTC0_NTD0_NTM0_NEPBS0_NLCA1_NLCB1_ONLL1_PGR1_PLR1_PKA0_SIA3_SS1_SU32_SUM1_SUS256_SPO0_SRVW0_SSO0_SVW1_SK0_SKFTR0_SKXCCM0_TLDS1_ULSGRO0_USL1_UIOFGRO0_USFGROn1_VSn1_VWA1_VWB1_WSGRA0_WSGRB0_WS32_WG64_2_1_WGM8_WGMXCC1_WGMXCCGn1
    SolutionIndex: 105
    SolutionNameMin: Cijk_Alik_Bljk_HHS_BH_Bias_HA_S_SAV_UserArgs_MT128x64x64_MI16x16x1_SN_LDSB1_AFC1_AG0_AFEM1_AFEM1_ASEM1_CLR0_CADS0_DTLA0_DTLB0_DTVA0_DTVB0_EPS0_FDSI0_GRPM1_GRVWA8_GRVWB8_GSU1_GSUAMB_GSUC0_GSUWGMRR0_GLS0_ISA1100_IU1_K1_LDSTI0_LBSPPA128_LBSPPB128_LBSPPM0_LPA8_LPB8_LPM0_LRVW16_LWPMn1_MIAV1_MIWT4_2_MO40_NTn1_NTA0_NTB0_NTC0_NTD0_NTM0_NEPBS0_NLCA1_NLCB1_ONLL1_PGR1_PLR1_PKA0_SIA3_SS1_SU32_SUM1_SUS256_SPO0_SRVW0_SSO0_SVW1_SK0_SKFTR0_SKXCCM0_TLDS1_ULSGRO0_USL1_UIOFGRO0_USFGROn1_VSn1_VWA1_VWB1_WSGRA0_WSGRB0_WS32_WG32_4_1_WGM8_WGMXCC1_WGMXCCGn1
    SolutionIndex: 107
    SolutionNameMin: Cijk_Alik_Bljk_HHS_BH_Bias_HA_S_SAV_UserArgs_MT128x64x64_MI16x16x1_SN_LDSB0_AFC1_AG0_AFEM1_AFEM1_ASEM1_CLR0_CADS0_DTLA0_DTLB0_DTVA0_DTVB0_EPS0_FDSI0_GRPM1_GRVWA8_GRVWB8_GSU1_GSUAMB_GSUC0_GSUWGMRR0_GLS0_ISA1100_IU1_K1_LDSTI0_LBSPPA128_LBSPPB128_LBSPPM0_LPA8_LPB8_LPM0_LRVW16_LWPMn1_MIAV1_MIWT2_4_MO40_NTn1_NTA0_NTB0_NTC0_NTD0_NTM0_NEPBS0_NLCA1_NLCB1_ONLL1_PGR0_PLR1_PKA0_SIA3_SS1_SU32_SUM1_SUS256_SPO0_SRVW0_SSO0_SVW1_SK0_SKFTR0_SKXCCM0_TLDS1_ULSGRO0_USL1_UIOFGRO0_USFGROn1_VSn1_VWA1_VWB1_WSGRA0_WSGRB0_WS32_WG64_2_1_WGM8_WGMXCC1_WGMXCCGn1
    SolutionIndex: 109
    SolutionNameMin: Cijk_Alik_Bljk_HHS_BH_Bias_HA_S_SAV_UserArgs_MT16x64x64_MI16x16x1_SN_LDSB0_AFC1_AG0_AFEM1_AFEM1_ASEM1_CLR0_CADS0_DTLA0_DTLB0_DTVA0_DTVB0_EPS0_FDSI0_GRPM1_GRVWA8_GRVWB8_GSU1_GSUAMB_GSUC0_GSUWGMRR0_GLS0_ISA1100_IU1_K1_LDSTI0_LBSPPA128_LBSPPB128_LBSPPM0_LPA8_LPB8_LPM0_LRVW16_LWPMn1_MIAV1_MIWT1_1_MO40_NTn1_NTA0_NTB0_NTC0_NTD0_NTM0_NEPBS0_NLCA1_NLCB1_ONLL1_PGR1_PLR1_PKA0_SIA1_SS1_SU32_SUM1_SUS256_SPO0_SRVW0_SSO0_SVW1_SK0_SKFTR0_SKXCCM0_TLDS1_ULSGRO0_USL1_UIOFGRO0_USFGROn1_VSn1_VWA1_VWB1_WSGRA0_WSGRB0_WS32_WG16_8_1_WGM8_WGMXCC1_WGMXCCGn1
    SolutionIndex: 110
    SolutionNameMin: Cijk_Alik_Bljk_HHS_BH_Bias_HA_S_SAV_UserArgs_MT16x16x128_MI16x16x1_SN_LDSB0_AFC1_AG0_AFEM1_AFEM1_ASEM1_CLR0_CADS0_DTLA0_DTLB0_DTVA0_DTVB0_EPS0_FDSI0_GRPM1_GRVWA8_GRVWB8_GSU1_GSUAMB_GSUC0_GSUWGMRR0_GLS0_ISA1100_IU1_K1_LDSTI0_LBSPPA256_LBSPPB256_LBSPPM0_LPA8_LPB8_LPM0_LRVW16_LWPMn1_MIAV1_MIWT1_1_MO40_NTn1_NTA0_NTB0_NTC0_NTD0_NTM0_NEPBS0_NLCA1_NLCB1_ONLL1_PGR0_PLR1_PKA0_SIA1_SS1_SU32_SUM1_SUS256_SPO0_SRVW0_SSO0_SVW1_SK0_SKFTR0_SKXCCM0_TLDS1_ULSGRO0_USL1_UIOFGRO0_USFGROn1_VSn1_VWA1_VWB1_WSGRA0_WSGRB0_WS32_WG16_2_1_WGM8_WGMXCC1_WGMXCCGn1
    SolutionIndex: 111
    SolutionNameMin: Cijk_Alik_Bljk_HHS_BH_Bias_HA_S_SAV_UserArgs_MT16x16x128_MI16x16x1_SN_LDSB0_AFC1_AG0_AFEM1_AFEM1_ASEM1_CLR0_CADS0_DTLA0_DTLB0_DTVA0_DTVB0_EPS0_FDSI0_GRPM1_GRVWA8_GRVWB8_GSU1_GSUAMB_GSUC0_GSUWGMRR0_GLS0_ISA1100_IU1_K1_LDSTI0_LBSPPA256_LBSPPB256_LBSPPM0_LPA8_LPB8_LPM0_LRVW16_LWPMn1_MIAV1_MIWT1_1_MO40_NTn1_NTA0_NTB0_NTC0_NTD0_NTM0_NEPBS0_NLCA1_NLCB1_ONLL1_PGR0_PLR1_PKA0_SIA3_SS1_SU32_SUM1_SUS256_SPO0_SRVW0_SSO0_SVW1_SK0_SKFTR0_SKXCCM0_TLDS1_ULSGRO0_USL1_UIOFGRO0_USFGROn1_VSn1_VWA1_VWB1_WSGRA0_WSGRB0_WS32_WG16_2_1_WGM8_WGMXCC1_WGMXCCGn1
    SolutionIndex: 112
    SolutionNameMin: Cijk_Alik_Bljk_HHS_BH_Bias_HA_S_SAV_UserArgs_MT32x16x128_MI16x16x1_SN_LDSB0_AFC1_AG0_AFEM1_AFEM1_ASEM1_CLR0_CADS0_DTLA0_DTLB0_DTVA0_DTVB0_EPS0_FDSI0_GRPM1_GRVWA8_GRVWB8_GSU1_GSUAMB_GSUC0_GSUWGMRR0_GLS0_ISA1100_IU1_K1_LDSTI0_LBSPPA256_LBSPPB256_LBSPPM0_LPA8_LPB8_LPM0_LRVW16_LWPMn1_MIAV1_MIWT1_1_MO40_NTn1_NTA0_NTB0_NTC0_NTD0_NTM0_NEPBS0_NLCA1_NLCB1_ONLL1_PGR2_PLR1_PKA0_SIA3_SS1_SU32_SUM1_SUS256_SPO0_SRVW0_SSO0_SVW1_SK0_SKFTR0_SKXCCM0_TLDS1_ULSGRO0_USL1_UIOFGRO0_USFGROn1_VSn1_VWA1_VWB1_WSGRA0_WSGRB0_WS32_WG32_2_1_WGM8_WGMXCC1_WGMXCCGn1
    SolutionIndex: 113
    SolutionNameMin: Cijk_Alik_Bljk_HHS_BH_Bias_HA_S_SAV_UserArgs_MT16x16x32_MI16x16x1_SN_LDSB0_AFC1_AG0_AFEM1_AFEM1_ASEM1_CLR0_CADS0_DTLA0_DTLB0_DTVA0_DTVB0_EPS0_FDSI0_GRPM1_GRVWA8_GRVWB8_GSU1_GSUAMB_GSUC0_GSUWGMRR0_GLS0_ISA1100_IU1_K1_LDSTI0_LBSPPA128_LBSPPB128_LBSPPM0_LPA8_LPB8_LPM0_LRVW16_LWPMn1_MIAV1_MIWT1_1_MO40_NTn1_NTA0_NTB0_NTC0_NTD0_NTM0_NEPBS0_NLCA1_NLCB1_ONLL1_PGR2_PLR1_PKA0_SIA3_SS1_SU32_SUM1_SUS256_SPO0_SRVW0_SSO0_SVW1_SK0_SKFTR0_SKXCCM0_TLDS1_ULSGRO0_USL1_UIOFGRO0_USFGROn1_VSn1_VWA1_VWB1_WSGRA0_WSGRB0_WS32_WG16_2_1_WGM8_WGMXCC1_WGMXCCGn1
    SolutionIndex: 114
    SolutionNameMin: Cijk_Alik_Bljk_HHS_BH_Bias_HA_S_SAV_UserArgs_MT16x64x64_MI16x16x1_SN_LDSB0_AFC1_AG0_AFEM1_AFEM1_ASEM1_CLR0_CADS0_DTLA0_DTLB0_DTVA0_DTVB0_EPS0_FDSI0_GRPM1_GRVWA8_GRVWB8_GSU1_GSUAMB_GSUC0_GSUWGMRR0_GLS0_ISA1100_IU1_K1_LDSTI0_LBSPPA128_LBSPPB128_LBSPPM0_LPA8_LPB8_LPM0_LRVW16_LWPMn1_MIAV1_MIWT1_1_MO40_NTn1_NTA0_NTB0_NTC0_NTD0_NTM0_NEPBS0_NLCA1_NLCB1_ONLL1_PGR2_PLR1_PKA0_SIA1_SS1_SU32_SUM1_SUS256_SPO0_SRVW0_SSO0_SVW1_SK0_SKFTR0_SKXCCM0_TLDS1_ULSGRO0_USL1_UIOFGRO0_USFGROn1_VSn1_VWA1_VWB1_WSGRA0_WSGRB0_WS32_WG16_8_1_WGM8_WGMXCC1_WGMXCCGn1
    SolutionIndex: 115
    SolutionNameMin: Cijk_Alik_Bljk_HHS_BH_Bias_HA_S_SAV_UserArgs_MT16x16x32_MI16x16x1_SN_LDSB0_AFC1_AG0_AFEM1_AFEM1_ASEM1_CLR0_CADS0_DTLA0_DTLB0_DTVA0_DTVB0_EPS0_FDSI0_GRPM1_GRVWA8_GRVWB8_GSU1_GSUAMB_GSUC0_GSUWGMRR0_GLS0_ISA1100_IU1_K1_LDSTI0_LBSPPA128_LBSPPB128_LBSPPM0_LPA8_LPB8_LPM0_LRVW16_LWPMn1_MIAV1_MIWT1_1_MO40_NTn1_NTA0_NTB0_NTC0_NTD0_NTM0_NEPBS0_NLCA1_NLCB1_ONLL1_PGR2_PLR1_PKA0_SIA1_SS1_SU32_SUM1_SUS256_SPO0_SRVW0_SSO0_SVW1_SK0_SKFTR0_SKXCCM0_TLDS1_ULSGRO0_USL1_UIOFGRO0_USFGROn1_VSn1_VWA1_VWB1_WSGRA0_WSGRB0_WS32_WG16_2_1_WGM8_WGMXCC1_WGMXCCGn1
    SolutionIndex: 116
    SolutionNameMin: Cijk_Alik_Bljk_HHS_BH_Bias_HA_S_SAV_UserArgs_MT16x16x128_MI16x16x1_SN_LDSB0_AFC1_AG0_AFEM1_AFEM1_ASEM1_CLR0_CADS0_DTLA0_DTLB0_DTVA0_DTVB0_EPS0_FDSI0_GRPM1_GRVWA8_GRVWB8_GSU1_GSUAMB_GSUC0_GSUWGMRR0_GLS0_ISA1100_IU1_K1_LDSTI0_LBSPPA256_LBSPPB256_LBSPPM0_LPA8_LPB8_LPM0_LRVW16_LWPMn1_MIAV1_MIWT1_1_MO40_NTn1_NTA0_NTB0_NTC0_NTD0_NTM0_NEPBS0_NLCA1_NLCB1_ONLL1_PGR2_PLR1_PKA0_SIA3_SS1_SU32_SUM1_SUS256_SPO0_SRVW0_SSO0_SVW1_SK0_SKFTR0_SKXCCM0_TLDS1_ULSGRO0_USL1_UIOFGRO0_USFGROn1_VSn1_VWA1_VWB1_WSGRA0_WSGRB0_WS32_WG16_2_1_WGM8_WGMXCC1_WGMXCCGn1
    SolutionIndex: 117
    SolutionNameMin: Cijk_Alik_Bljk_HHS_BH_Bias_HA_S_SAV_UserArgs_MT16x16x64_MI16x16x1_SN_LDSB0_AFC1_AG0_AFEM1_AFEM1_ASEM1_CLR0_CADS0_DTLA0_DTLB0_DTVA0_DTVB0_EPS0_FDSI0_GRPM1_GRVWA8_GRVWB8_GSU1_GSUAMB_GSUC0_GSUWGMRR0_GLS0_ISA1100_IU1_K1_LDSTI0_LBSPPA128_LBSPPB128_LBSPPM0_LPA8_LPB8_LPM0_LRVW16_LWPMn1_MIAV1_MIWT1_1_MO40_NTn1_NTA0_NTB0_NTC0_NTD0_NTM0_NEPBS0_NLCA1_NLCB1_ONLL1_PGR2_PLR1_PKA0_SIA3_SS1_SU32_SUM1_SUS256_SPO0_SRVW0_SSO0_SVW1_SK0_SKFTR0_SKXCCM0_TLDS1_ULSGRO0_USL1_UIOFGRO0_USFGROn1_VSn1_VWA1_VWB1_WSGRA0_WSGRB0_WS32_WG16_2_1_WGM8_WGMXCC1_WGMXCCGn1
    SolutionIndex: 118
    SolutionNameMin: Cijk_Alik_Bljk_HHS_BH_Bias_HA_S_SAV_UserArgs_MT16x16x128_MI16x16x1_SN_LDSB0_AFC1_AG0_AFEM1_AFEM1_ASEM1_CLR0_CADS0_DTLA0_DTLB0_DTVA0_DTVB0_EPS0_FDSI0_GRPM1_GRVWA8_GRVWB8_GSU1_GSUAMB_GSUC0_GSUWGMRR0_GLS0_ISA1100_IU1_K1_LDSTI0_LBSPPA256_LBSPPB256_LBSPPM0_LPA8_LPB8_LPM0_LRVW16_LWPMn1_MIAV1_MIWT1_1_MO40_NTn1_NTA0_NTB0_NTC0_NTD0_NTM0_NEPBS0_NLCA1_NLCB1_ONLL1_PGR2_PLR1_PKA0_SIA1_SS1_SU32_SUM1_SUS256_SPO0_SRVW0_SSO0_SVW1_SK0_SKFTR0_SKXCCM0_TLDS1_ULSGRO0_USL1_UIOFGRO0_USFGROn1_VSn1_VWA1_VWB1_WSGRA0_WSGRB0_WS32_WG16_2_1_WGM8_WGMXCC1_WGMXCCGn1
    SolutionIndex: 119
    SolutionNameMin: Cijk_Alik_Bljk_HHS_BH_Bias_HA_S_SAV_UserArgs_MT16x16x128_MI16x16x1_SN_LDSB0_AFC1_AG0_AFEM1_AFEM1_ASEM1_CLR0_CADS0_DTLA0_DTLB0_DTVA0_DTVB0_EPS0_FDSI0_GRPM1_GRVWA8_GRVWB8_GSU1_GSUAMB_GSUC0_GSUWGMRR0_GLS0_ISA1100_IU1_K1_LDSTI0_LBSPPA256_LBSPPB256_LBSPPM0_LPA8_LPB8_LPM0_LRVW16_LWPMn1_MIAV1_MIWT1_1_MO40_NTn1_NTA0_NTB0_NTC0_NTD0_NTM0_NEPBS0_NLCA1_NLCB1_ONLL1_PGR1_PLR1_PKA0_SIA1_SS1_SU32_SUM1_SUS256_SPO0_SRVW0_SSO0_SVW1_SK0_SKFTR0_SKXCCM0_TLDS1_ULSGRO0_USL1_UIOFGRO0_USFGROn1_VSn1_VWA1_VWB1_WSGRA0_WSGRB0_WS32_WG16_2_1_WGM8_WGMXCC1_WGMXCCGn1
    SolutionIndex: 120
    SolutionNameMin: Cijk_Alik_Bljk_HHS_BH_Bias_HA_S_SAV_UserArgs_MT32x16x128_MI16x16x1_SN_LDSB0_AFC1_AG0_AFEM1_AFEM1_ASEM1_CLR0_CADS0_DTLA0_DTLB0_DTVA0_DTVB0_EPS0_FDSI0_GRPM1_GRVWA8_GRVWB8_GSU1_GSUAMB_GSUC0_GSUWGMRR0_GLS0_ISA1100_IU1_K1_LDSTI0_LBSPPA256_LBSPPB256_LBSPPM0_LPA8_LPB8_LPM0_LRVW16_LWPMn1_MIAV1_MIWT1_1_MO40_NTn1_NTA0_NTB0_NTC0_NTD0_NTM0_NEPBS0_NLCA1_NLCB1_ONLL1_PGR1_PLR1_PKA0_SIA1_SS1_SU32_SUM1_SUS256_SPO0_SRVW0_SSO0_SVW1_SK0_SKFTR0_SKXCCM0_TLDS1_ULSGRO0_USL1_UIOFGRO0_USFGROn1_VSn1_VWA1_VWB1_WSGRA0_WSGRB0_WS32_WG32_2_1_WGM8_WGMXCC1_WGMXCCGn1
    SolutionIndex: 121
    SolutionNameMin: Cijk_Alik_Bljk_HHS_BH_Bias_HA_S_SAV_UserArgs_MT16x16x64_MI16x16x1_SN_LDSB0_AFC1_AG0_AFEM1_AFEM1_ASEM1_CLR0_CADS0_DTLA0_DTLB0_DTVA0_DTVB0_EPS0_FDSI0_GRPM1_GRVWA8_GRVWB8_GSU1_GSUAMB_GSUC0_GSUWGMRR0_GLS0_ISA1100_IU1_K1_LDSTI0_LBSPPA128_LBSPPB128_LBSPPM0_LPA8_LPB8_LPM0_LRVW16_LWPMn1_MIAV1_MIWT1_1_MO40_NTn1_NTA0_NTB0_NTC0_NTD0_NTM0_NEPBS0_NLCA1_NLCB1_ONLL1_PGR1_PLR1_PKA0_SIA3_SS1_SU32_SUM1_SUS256_SPO0_SRVW0_SSO0_SVW1_SK0_SKFTR0_SKXCCM0_TLDS1_ULSGRO0_USL1_UIOFGRO0_USFGROn1_VSn1_VWA1_VWB1_WSGRA0_WSGRB0_WS32_WG16_2_1_WGM8_WGMXCC1_WGMXCCGn1
    SolutionIndex: 122
    SolutionNameMin: Cijk_Alik_Bljk_HHS_BH_Bias_HA_S_SAV_UserArgs_MT16x16x64_MI16x16x1_SN_LDSB0_AFC1_AG0_AFEM1_AFEM1_ASEM1_CLR0_CADS0_DTLA0_DTLB0_DTVA0_DTVB0_EPS0_FDSI0_GRPM1_GRVWA8_GRVWB8_GSU1_GSUAMB_GSUC0_GSUWGMRR0_GLS0_ISA1100_IU1_K1_LDSTI0_LBSPPA128_LBSPPB128_LBSPPM0_LPA8_LPB8_LPM0_LRVW16_LWPMn1_MIAV1_MIWT1_1_MO40_NTn1_NTA0_NTB0_NTC0_NTD0_NTM0_NEPBS0_NLCA1_NLCB1_ONLL1_PGR2_PLR1_PKA0_SIA1_SS1_SU32_SUM1_SUS256_SPO0_SRVW0_SSO0_SVW1_SK0_SKFTR0_SKXCCM0_TLDS1_ULSGRO0_USL1_UIOFGRO0_USFGROn1_VSn1_VWA1_VWB1_WSGRA0_WSGRB0_WS32_WG16_2_1_WGM8_WGMXCC1_WGMXCCGn1
    SolutionIndex: 123
    SolutionNameMin: Cijk_Alik_Bljk_HHS_BH_Bias_HA_S_SAV_UserArgs_MT32x16x128_MI16x16x1_SN_LDSB0_AFC1_AG0_AFEM1_AFEM1_ASEM1_CLR0_CADS0_DTLA0_DTLB0_DTVA0_DTVB0_EPS0_FDSI0_GRPM1_GRVWA8_GRVWB8_GSU1_GSUAMB_GSUC0_GSUWGMRR0_GLS0_ISA1100_IU1_K1_LDSTI0_LBSPPA256_LBSPPB256_LBSPPM0_LPA8_LPB8_LPM0_LRVW16_LWPMn1_MIAV1_MIWT1_1_MO40_NTn1_NTA0_NTB0_NTC0_NTD0_NTM0_NEPBS0_NLCA1_NLCB1_ONLL1_PGR2_PLR1_PKA0_SIA1_SS1_SU32_SUM1_SUS256_SPO0_SRVW0_SSO0_SVW1_SK0_SKFTR0_SKXCCM0_TLDS1_ULSGRO0_USL1_UIOFGRO0_USFGROn1_VSn1_VWA1_VWB1_WSGRA0_WSGRB0_WS32_WG32_2_1_WGM8_WGMXCC1_WGMXCCGn1
    SolutionIndex: 124
    SolutionNameMin: Cijk_Alik_Bljk_HHS_BH_Bias_HA_S_SAV_UserArgs_MT32x32x128_MI16x16x1_SN_LDSB0_AFC1_AG0_AFEM1_AFEM1_ASEM1_CLR0_CADS0_DTLA0_DTLB0_DTVA0_DTVB0_EPS0_FDSI0_GRPM1_GRVWA8_GRVWB8_GSU1_GSUAMB_GSUC0_GSUWGMRR0_GLS0_ISA1100_IU1_K1_LDSTI0_LBSPPA256_LBSPPB256_LBSPPM0_LPA8_LPB8_LPM0_LRVW16_LWPMn1_MIAV1_MIWT1_1_MO40_NTn1_NTA0_NTB0_NTC0_NTD0_NTM0_NEPBS0_NLCA1_NLCB1_ONLL1_PGR1_PLR1_PKA0_SIA3_SS1_SU32_SUM1_SUS256_SPO0_SRVW0_SSO0_SVW1_SK0_SKFTR0_SKXCCM0_TLDS1_ULSGRO0_USL1_UIOFGRO0_USFGROn1_VSn1_VWA1_VWB1_WSGRA0_WSGRB0_WS32_WG32_4_1_WGM8_WGMXCC1_WGMXCCGn1
    SolutionIndex: 125
    SolutionNameMin: Cijk_Alik_Bljk_HHS_BH_Bias_HA_S_SAV_UserArgs_MT32x32x128_MI16x16x1_SN_LDSB0_AFC1_AG0_AFEM1_AFEM1_ASEM1_CLR0_CADS0_DTLA0_DTLB0_DTVA0_DTVB0_EPS0_FDSI0_GRPM1_GRVWA8_GRVWB8_GSU1_GSUAMB_GSUC0_GSUWGMRR0_GLS0_ISA1100_IU1_K1_LDSTI0_LBSPPA256_LBSPPB256_LBSPPM0_LPA8_LPB8_LPM0_LRVW16_LWPMn1_MIAV1_MIWT1_1_MO40_NTn1_NTA0_NTB0_NTC0_NTD0_NTM0_NEPBS0_NLCA1_NLCB1_ONLL1_PGR1_PLR1_PKA0_SIA1_SS1_SU32_SUM1_SUS256_SPO0_SRVW0_SSO0_SVW1_SK0_SKFTR0_SKXCCM0_TLDS1_ULSGRO0_USL1_UIOFGRO0_USFGROn1_VSn1_VWA1_VWB1_WSGRA0_WSGRB0_WS32_WG32_4_1_WGM8_WGMXCC1_WGMXCCGn1
    SolutionIndex: 126
    SolutionNameMin: Cijk_Alik_Bljk_HHS_BH_Bias_HA_S_SAV_UserArgs_MT32x16x64_MI16x16x1_SN_LDSB0_AFC1_AG0_AFEM1_AFEM1_ASEM1_CLR0_CADS0_DTLA0_DTLB0_DTVA0_DTVB0_EPS0_FDSI0_GRPM1_GRVWA8_GRVWB8_GSU1_GSUAMB_GSUC0_GSUWGMRR0_GLS0_ISA1100_IU1_K1_LDSTI0_LBSPPA128_LBSPPB128_LBSPPM0_LPA8_LPB8_LPM0_LRVW16_LWPMn1_MIAV1_MIWT1_1_MO40_NTn1_NTA0_NTB0_NTC0_NTD0_NTM0_NEPBS0_NLCA1_NLCB1_ONLL1_PGR2_PLR1_PKA0_SIA1_SS1_SU32_SUM1_SUS256_SPO0_SRVW0_SSO0_SVW1_SK0_SKFTR0_SKXCCM0_TLDS1_ULSGRO0_USL1_UIOFGRO0_USFGROn1_VSn1_VWA1_VWB1_WSGRA0_WSGRB0_WS32_WG32_2_1_WGM8_WGMXCC1_WGMXCCGn1
    SolutionIndex: 127
    SolutionNameMin: Cijk_Alik_Bljk_HHS_BH_Bias_HA_S_SAV_UserArgs_MT32x32x64_MI16x16x1_SN_LDSB0_AFC1_AG0_AFEM1_AFEM1_ASEM1_CLR0_CADS0_DTLA0_DTLB0_DTVA0_DTVB0_EPS0_FDSI0_GRPM1_GRVWA8_GRVWB8_GSU1_GSUAMB_GSUC0_GSUWGMRR0_GLS0_ISA1100_IU1_K1_LDSTI0_LBSPPA128_LBSPPB128_LBSPPM0_LPA8_LPB8_LPM0_LRVW16_LWPMn1_MIAV1_MIWT1_1_MO40_NTn1_NTA0_NTB0_NTC0_NTD0_NTM0_NEPBS0_NLCA1_NLCB1_ONLL1_PGR2_PLR1_PKA0_SIA1_SS1_SU32_SUM1_SUS256_SPO0_SRVW0_SSO0_SVW1_SK0_SKFTR0_SKXCCM0_TLDS1_ULSGRO0_USL1_UIOFGRO0_USFGROn1_VSn1_VWA1_VWB1_WSGRA0_WSGRB0_WS32_WG32_4_1_WGM8_WGMXCC1_WGMXCCGn1
    SolutionIndex: 128
    SolutionNameMin: Cijk_Alik_Bljk_HHS_BH_Bias_HA_S_SAV_UserArgs_MT16x16x64_MI16x16x1_SN_LDSB0_AFC1_AG0_AFEM1_AFEM1_ASEM1_CLR0_CADS0_DTLA0_DTLB0_DTVA0_DTVB0_EPS0_FDSI0_GRPM1_GRVWA8_GRVWB8_GSU1_GSUAMB_GSUC0_GSUWGMRR0_GLS0_ISA1100_IU1_K1_LDSTI0_LBSPPA128_LBSPPB128_LBSPPM0_LPA8_LPB8_LPM0_LRVW16_LWPMn1_MIAV1_MIWT1_1_MO40_NTn1_NTA0_NTB0_NTC0_NTD0_NTM0_NEPBS0_NLCA1_NLCB1_ONLL1_PGR1_PLR1_PKA0_SIA1_SS1_SU32_SUM1_SUS256_SPO0_SRVW0_SSO0_SVW1_SK0_SKFTR0_SKXCCM0_TLDS1_ULSGRO0_USL1_UIOFGRO0_USFGROn1_VSn1_VWA1_VWB1_WSGRA0_WSGRB0_WS32_WG16_2_1_WGM8_WGMXCC1_WGMXCCGn1
    SolutionIndex: 129
    SolutionNameMin: Cijk_Alik_Bljk_HHS_BH_Bias_HA_S_SAV_UserArgs_MT64x16x64_MI16x16x1_SN_LDSB0_AFC1_AG0_AFEM1_AFEM1_ASEM1_CLR0_CADS0_DTLA0_DTLB0_DTVA0_DTVB0_EPS0_FDSI0_GRPM1_GRVWA8_GRVWB8_GSU1_GSUAMB_GSUC0_GSUWGMRR0_GLS0_ISA1100_IU1_K1_LDSTI0_LBSPPA128_LBSPPB128_LBSPPM0_LPA8_LPB8_LPM0_LRVW16_LWPMn1_MIAV1_MIWT1_1_MO40_NTn1_NTA0_NTB0_NTC0_NTD0_NTM0_NEPBS0_NLCA1_NLCB1_ONLL1_PGR2_PLR1_PKA0_SIA3_SS1_SU32_SUM1_SUS256_SPO0_SRVW0_SSO0_SVW1_SK0_SKFTR0_SKXCCM0_TLDS1_ULSGRO0_USL1_UIOFGRO0_USFGROn1_VSn1_VWA1_VWB1_WSGRA0_WSGRB0_WS32_WG64_2_1_WGM8_WGMXCC1_WGMXCCGn1
    SolutionIndex: 130
    SolutionNameMin: Cijk_Alik_Bljk_HHS_BH_Bias_HA_S_SAV_UserArgs_MT64x16x64_MI16x16x1_SN_LDSB0_AFC1_AG0_AFEM1_AFEM1_ASEM1_CLR0_CADS0_DTLA0_DTLB0_DTVA0_DTVB0_EPS0_FDSI0_GRPM1_GRVWA8_GRVWB8_GSU1_GSUAMB_GSUC0_GSUWGMRR0_GLS0_ISA1100_IU1_K1_LDSTI0_LBSPPA128_LBSPPB128_LBSPPM0_LPA8_LPB8_LPM0_LRVW16_LWPMn1_MIAV1_MIWT1_1_MO40_NTn1_NTA0_NTB0_NTC0_NTD0_NTM0_NEPBS0_NLCA1_NLCB1_ONLL1_PGR2_PLR1_PKA0_SIA1_SS1_SU32_SUM1_SUS256_SPO0_SRVW0_SSO0_SVW1_SK0_SKFTR0_SKXCCM0_TLDS1_ULSGRO0_USL1_UIOFGRO0_USFGROn1_VSn1_VWA1_VWB1_WSGRA0_WSGRB0_WS32_WG64_2_1_WGM8_WGMXCC1_WGMXCCGn1
    SolutionIndex: 131
    SolutionNameMin: Cijk_Alik_Bljk_HHS_BH_Bias_HA_S_SAV_UserArgs_MT48x64x128_MI16x16x1_SN_LDSB0_AFC1_AG0_AFEM1_AFEM1_ASEM1_CLR0_CADS0_DTLA0_DTLB0_DTVA0_DTVB0_EPS0_FDSI0_GRPM1_GRVWA8_GRVWB8_GSU1_GSUAMB_GSUC0_GSUWGMRR0_GLS0_ISA1100_IU1_K1_LDSTI0_LBSPPA256_LBSPPB256_LBSPPM0_LPA8_LPB8_LPM0_LRVW16_LWPMn1_MIAV1_MIWT3_1_MO40_NTn1_NTA0_NTB0_NTC0_NTD0_NTM0_NEPBS0_NLCA1_NLCB1_ONLL1_PGR1_PLR1_PKA0_SIA1_SS1_SU32_SUM1_SUS256_SPO0_SRVW0_SSO0_SVW1_SK0_SKFTR0_SKXCCM0_TLDS1_ULSGRO0_USL1_UIOFGRO0_USFGROn1_VSn1_VWA1_VWB1_WSGRA0_WSGRB0_WS32_WG16_8_1_WGM8_WGMXCC1_WGMXCCGn1
    SolutionIndex: 132
    SolutionNameMin: Cijk_Alik_Bljk_HHS_BH_Bias_HA_S_SAV_UserArgs_MT64x32x32_MI16x16x1_SN_LDSB0_AFC1_AG0_AFEM1_AFEM1_ASEM1_CLR0_CADS0_DTLA0_DTLB0_DTVA0_DTVB0_EPS0_FDSI0_GRPM1_GRVWA8_GRVWB8_GSU1_GSUAMB_GSUC0_GSUWGMRR0_GLS0_ISA1100_IU1_K1_LDSTI0_LBSPPA128_LBSPPB128_LBSPPM0_LPA8_LPB8_LPM0_LRVW16_LWPMn1_MIAV1_MIWT2_1_MO40_NTn1_NTA0_NTB0_NTC0_NTD0_NTM0_NEPBS0_NLCA1_NLCB1_ONLL1_PGR2_PLR1_PKA0_SIA1_SS1_SU32_SUM1_SUS256_SPO0_SRVW0_SSO0_SVW1_SK0_SKFTR0_SKXCCM0_TLDS1_ULSGRO0_USL1_UIOFGRO0_USFGROn1_VSn1_VWA1_VWB1_WSGRA0_WSGRB0_WS32_WG32_4_1_WGM8_WGMXCC1_WGMXCCGn1
    SolutionIndex: 133
    SolutionNameMin: Cijk_Alik_Bljk_HHS_BH_Bias_HA_S_SAV_UserArgs_MT32x16x64_MI16x16x1_SN_LDSB0_AFC1_AG0_AFEM1_AFEM1_ASEM1_CLR0_CADS0_DTLA0_DTLB0_DTVA0_DTVB0_EPS0_FDSI0_GRPM1_GRVWA8_GRVWB8_GSU1_GSUAMB_GSUC0_GSUWGMRR0_GLS0_ISA1100_IU1_K1_LDSTI0_LBSPPA128_LBSPPB128_LBSPPM0_LPA8_LPB8_LPM0_LRVW16_LWPMn1_MIAV1_MIWT1_1_MO40_NTn1_NTA0_NTB0_NTC0_NTD0_NTM0_NEPBS0_NLCA1_NLCB1_ONLL1_PGR1_PLR1_PKA0_SIA1_SS1_SU32_SUM1_SUS256_SPO0_SRVW0_SSO0_SVW1_SK0_SKFTR0_SKXCCM0_TLDS1_ULSGRO0_USL1_UIOFGRO0_USFGROn1_VSn1_VWA1_VWB1_WSGRA0_WSGRB0_WS32_WG32_2_1_WGM8_WGMXCC1_WGMXCCGn1
    SolutionIndex: 134
    SolutionNameMin: Cijk_Alik_Bljk_HHS_BH_Bias_HA_S_SAV_UserArgs_MT64x32x128_MI16x16x1_SN_LDSB0_AFC1_AG0_AFEM1_AFEM1_ASEM1_CLR0_CADS0_DTLA0_DTLB0_DTVA0_DTVB0_EPS0_FDSI0_GRPM1_GRVWA8_GRVWB8_GSU1_GSUAMB_GSUC0_GSUWGMRR0_GLS0_ISA1100_IU1_K1_LDSTI0_LBSPPA256_LBSPPB256_LBSPPM0_LPA8_LPB8_LPM0_LRVW16_LWPMn1_MIAV1_MIWT1_2_MO40_NTn1_NTA0_NTB0_NTC0_NTD0_NTM0_NEPBS0_NLCA1_NLCB1_ONLL1_PGR1_PLR1_PKA0_SIA1_SS1_SU32_SUM1_SUS256_SPO0_SRVW0_SSO0_SVW1_SK0_SKFTR0_SKXCCM0_TLDS1_ULSGRO0_USL1_UIOFGRO0_USFGROn1_VSn1_VWA1_VWB1_WSGRA0_WSGRB0_WS32_WG64_2_1_WGM8_WGMXCC1_WGMXCCGn1
    SolutionIndex: 135
    SolutionNameMin: Cijk_Alik_Bljk_HHS_BH_Bias_HA_S_SAV_UserArgs_MT32x64x64_MI16x16x1_SN_LDSB0_AFC1_AG0_AFEM1_AFEM1_ASEM1_CLR0_CADS0_DTLA0_DTLB0_DTVA0_DTVB0_EPS0_FDSI0_GRPM1_GRVWA8_GRVWB8_GSU1_GSUAMB_GSUC0_GSUWGMRR0_GLS0_ISA1100_IU1_K1_LDSTI0_LBSPPA128_LBSPPB128_LBSPPM0_LPA8_LPB8_LPM0_LRVW16_LWPMn1_MIAV1_MIWT1_2_MO40_NTn1_NTA0_NTB0_NTC0_NTD0_NTM0_NEPBS0_NLCA1_NLCB1_ONLL1_PGR2_PLR1_PKA0_SIA1_SS1_SU32_SUM1_SUS256_SPO0_SRVW0_SSO0_SVW1_SK0_SKFTR0_SKXCCM0_TLDS1_ULSGRO0_USL1_UIOFGRO0_USFGROn1_VSn1_VWA1_VWB1_WSGRA0_WSGRB0_WS32_WG32_4_1_WGM8_WGMXCC1_WGMXCCGn1
    SolutionIndex: 136
    SolutionNameMin: Cijk_Alik_Bljk_HHS_BH_Bias_HA_S_SAV_UserArgs_MT32x64x128_MI16x16x1_SN_LDSB0_AFC1_AG0_AFEM1_AFEM1_ASEM1_CLR0_CADS0_DTLA0_DTLB0_DTVA0_DTVB0_EPS0_FDSI0_GRPM1_GRVWA8_GRVWB8_GSU1_GSUAMB_GSUC0_GSUWGMRR0_GLS0_ISA1100_IU1_K1_LDSTI0_LBSPPA256_LBSPPB256_LBSPPM0_LPA8_LPB8_LPM0_LRVW16_LWPMn1_MIAV1_MIWT1_2_MO40_NTn1_NTA0_NTB0_NTC0_NTD0_NTM0_NEPBS0_NLCA1_NLCB1_ONLL1_PGR1_PLR1_PKA0_SIA1_SS1_SU32_SUM1_SUS256_SPO0_SRVW0_SSO0_SVW1_SK0_SKFTR0_SKXCCM0_TLDS1_ULSGRO0_USL1_UIOFGRO0_USFGROn1_VSn1_VWA1_VWB1_WSGRA0_WSGRB0_WS32_WG32_4_1_WGM8_WGMXCC1_WGMXCCGn1
    SolutionIndex: 137
    SolutionNameMin: Cijk_Alik_Bljk_HHS_BH_Bias_HA_S_SAV_UserArgs_MT64x64x64_MI16x16x1_SN_LDSB0_AFC1_AG0_AFEM1_AFEM1_ASEM1_CLR0_CADS0_DTLA0_DTLB0_DTVA0_DTVB0_EPS0_FDSI0_GRPM1_GRVWA8_GRVWB8_GSU1_GSUAMB_GSUC0_GSUWGMRR0_GLS0_ISA1100_IU1_K1_LDSTI0_LBSPPA128_LBSPPB128_LBSPPM0_LPA8_LPB8_LPM0_LRVW16_LWPMn1_MIAV1_MIWT2_2_MO40_NTn1_NTA0_NTB0_NTC0_NTD0_NTM0_NEPBS0_NLCA1_NLCB1_ONLL1_PGR0_PLR1_PKA0_SIA3_SS1_SU32_SUM1_SUS256_SPO0_SRVW0_SSO0_SVW1_SK0_SKFTR0_SKXCCM0_TLDS1_ULSGRO0_USL1_UIOFGRO0_USFGROn1_VSn1_VWA1_VWB1_WSGRA0_WSGRB0_WS32_WG32_4_1_WGM8_WGMXCC1_WGMXCCGn1
    SolutionIndex: 138
    SolutionNameMin: Cijk_Alik_Bljk_HHS_BH_Bias_HA_S_SAV_UserArgs_MT64x64x32_MI16x16x1_SN_LDSB0_AFC1_AG0_AFEM1_AFEM1_ASEM1_CLR0_CADS0_DTLA0_DTLB0_DTVA0_DTVB0_EPS0_FDSI0_GRPM1_GRVWA8_GRVWB8_GSU1_GSUAMB_GSUC0_GSUWGMRR0_GLS0_ISA1100_IU1_K1_LDSTI0_LBSPPA128_LBSPPB128_LBSPPM0_LPA8_LPB8_LPM0_LRVW16_LWPMn1_MIAV1_MIWT2_2_MO40_NTn1_NTA0_NTB0_NTC0_NTD0_NTM0_NEPBS0_NLCA1_NLCB1_ONLL1_PGR1_PLR1_PKA0_SIA3_SS1_SU32_SUM1_SUS256_SPO0_SRVW0_SSO0_SVW1_SK0_SKFTR0_SKXCCM0_TLDS1_ULSGRO0_USL1_UIOFGRO0_USFGROn1_VSn1_VWA1_VWB1_WSGRA0_WSGRB0_WS32_WG32_4_1_WGM8_WGMXCC1_WGMXCCGn1
    SolutionIndex: 139
    SolutionNameMin: Cijk_Alik_Bljk_HHS_BH_Bias_HA_S_SAV_UserArgs_MT16x64x64_MI16x16x1_SN_LDSB0_AFC1_AG0_AFEM1_AFEM1_ASEM1_CLR0_CADS0_DTLA0_DTLB0_DTVA0_DTVB0_EPS0_FDSI0_GRPM1_GRVWA8_GRVWB8_GSU1_GSUAMB_GSUC0_GSUWGMRR0_GLS0_ISA1100_IU1_K1_LDSTI0_LBSPPA128_LBSPPB128_LBSPPM0_LPA8_LPB8_LPM0_LRVW16_LWPMn1_MIAV1_MIWT1_1_MO40_NTn1_NTA0_NTB0_NTC0_NTD0_NTM0_NEPBS0_NLCA1_NLCB1_ONLL1_PGR2_PLR1_PKA0_SIA3_SS1_SU32_SUM1_SUS256_SPO0_SRVW0_SSO0_SVW1_SK0_SKFTR0_SKXCCM0_TLDS1_ULSGRO0_USL1_UIOFGRO0_USFGROn1_VSn1_VWA1_VWB1_WSGRA0_WSGRB0_WS32_WG16_8_1_WGM8_WGMXCC1_WGMXCCGn1
    SolutionIndex: 140
    SolutionNameMin: Cijk_Alik_Bljk_HHS_BH_Bias_HA_S_SAV_UserArgs_MT64x32x64_MI16x16x1_SN_LDSB0_AFC1_AG0_AFEM1_AFEM1_ASEM1_CLR0_CADS0_DTLA0_DTLB0_DTVA0_DTVB0_EPS0_FDSI0_GRPM1_GRVWA8_GRVWB8_GSU1_GSUAMB_GSUC0_GSUWGMRR0_GLS0_ISA1100_IU1_K1_LDSTI0_LBSPPA128_LBSPPB128_LBSPPM0_LPA8_LPB8_LPM0_LRVW16_LWPMn1_MIAV1_MIWT1_2_MO40_NTn1_NTA0_NTB0_NTC0_NTD0_NTM0_NEPBS0_NLCA1_NLCB1_ONLL1_PGR1_PLR1_PKA0_SIA1_SS1_SU32_SUM1_SUS256_SPO0_SRVW0_SSO0_SVW1_SK0_SKFTR0_SKXCCM0_TLDS1_ULSGRO0_USL1_UIOFGRO0_USFGROn1_VSn1_VWA1_VWB1_WSGRA0_WSGRB0_WS32_WG64_2_1_WGM8_WGMXCC1_WGMXCCGn1
- - - [64, 64, 1, 64]
    - [128, 22.7951]
  - - [256, 256, 1, 256]
    - [24, 1342.18]
  - - [320, 64, 1, 64]
    - [21, 109.227]
  - - [576, 64, 1, 64]
    - [139, 188.744]
  - - [832, 64, 1, 64]
    - [126, 283.989]
  - - [1088, 64, 1, 64]
    - [120, 371.371]
  - - [1344, 64, 1, 64]
    - [103, 440.402]
  - - [1600, 64, 1, 64]
    - [114, 569.878]
  - - [1856, 64, 1, 64]
    - [73, 608.174]
  - - [2112, 64, 1, 64]
    - [109, 720.896]
  - - [2368, 64, 1, 64]
    - [21, 746.102]
  - - [2624, 64, 1, 64]
    - [46, 859.832]
  - - [2880, 64, 1, 64]
    - [72, 943.718]
  - - [3136, 64, 1, 64]
    - [91, 1027.6]
  - - [3392, 64, 1, 64]
    - [89, 1111.49]
  - - [3648, 64, 1, 64]
    - [73, 1106.83]
  - - [3904, 64, 1, 64]
    - [84, 1279.26]
  - - [64, 320, 1, 64]
    - [73, 109.227]
  - - [320, 320, 1, 64]
    - [22, 524.288]
  - - [576, 320, 1, 64]
    - [115, 943.718]
  - - [832, 320, 1, 64]
    - [89, 1363.15]
  - - [1088, 320, 1, 64]
    - [140, 1856.85]
  - - [1344, 320, 1, 64]
    - [137, 2038.9]
  - - [1600, 320, 1, 64]
    - [91, 2520.62]
  - - [1856, 320, 1, 64]
    - [137, 2815.62]
  - - [2112, 320, 1, 64]
    - [137, 3327.21]
  - - [2368, 320, 1, 64]
    - [49, 3592.34]
  - - [2624, 320, 1, 64]
    - [49, 3980.71]
  - - [2880, 320, 1, 64]
    - [63, 4213.03]
  - - [3136, 320, 1, 64]
    - [67, 4429.33]
  - - [3392, 320, 1, 64]
    - [54, 4341.76]
  - - [3648, 320, 1, 64]
    - [63, 4980.74]
  - - [3904, 320, 1, 64]
    - [94, 5330.26]
  - - [64, 576, 1, 64]
    - [88, 188.744]
  - - [320, 576, 1, 64]
    - [15, 907.422]
  - - [576, 576, 1, 64]
    - [62, 1633.36]
  - - [832, 576, 1, 64]
    - [83, 2359.3]
  - - [1088, 576, 1, 64]
    - [84, 2970.97]
  - - [1344, 576, 1, 64]
    - [85, 3416.91]
  - - [1600, 576, 1, 64]
    - [56, 4067.75]
  - - [1856, 576, 1, 64]
    - [13, 4414.17]
  - - [2112, 576, 1, 64]
    - [69, 5023.02]
  - - [2368, 576, 1, 64]
    - [42, 5455.87]
  - - [2624, 576, 1, 64]
    - [38, 6240.72]
  - - [2880, 576, 1, 64]
    - [42, 6434.44]
  - - [3136, 576, 1, 64]
    - [38, 6800.32]
  - - [64, 832, 1, 64]
    - [129, 283.989]
  - - [320, 832, 1, 64]
    - [48, 1363.15]
  - - [576, 832, 1, 64]
    - [64, 2453.67]
  - - [832, 832, 1, 64]
    - [16, 3164.45]
  - - [1088, 832, 1, 64]
    - [138, 3995.44]
  - - [1344, 832, 1, 64]
    - [38, 4771.02]
  - - [1600, 832, 1, 64]
    - [54, 5496.57]
  - - [1856, 832, 1, 64]
    - [28, 5989.59]
  - - [2112, 832, 1, 64]
    - [59, 6615.28]
  - - [64, 1088, 1, 64]
    - [109, 356.516]
  - - [320, 1088, 1, 64]
    - [132, 1782.58]
  - - [576, 1088, 1, 64]
    - [63, 2970.97]
  - - [832, 1088, 1, 64]
    - [78, 3995.44]
  - - [1088, 1088, 1, 64]
    - [105, 4887.72]
  - - [1344, 1088, 1, 64]
    - [89, 5849.09]
  - - [1600, 1088, 1, 64]
    - [14, 6553.6]
  - - [64, 1344, 1, 64]
    - [114, 440.402]
  - - [320, 1344, 1, 64]
    - [132, 2117.32]
  - - [576, 1344, 1, 64]
    - [137, 3538.94]
  - - [832, 1344, 1, 64]
    - [65, 4771.02]
  - - [1088, 1344, 1, 64]
    - [86, 5849.09]
  - - [1344, 1344, 1, 64]
    - [42, 6800.32]
  - - [64, 1600, 1, 64]
    - [109, 569.878]
  - - [320, 1600, 1, 64]
    - [21, 2520.62]
  - - [576, 1600, 1, 64]
    - [91, 4067.75]
  - - [832, 1600, 1, 64]
    - [14, 5496.57]
  - - [1088, 1600, 1, 64]
    - [69, 6752.19]
  - - [64, 1856, 1, 64]
    - [132, 608.174]
  - - [320, 1856, 1, 64]
    - [63, 2815.62]
  - - [576, 1856, 1, 64]
    - [78, 4718.59]
  - - [832, 1856, 1, 64]
    - [63, 6176.77]
  - - [64, 2112, 1, 64]
    - [21, 692.06]
  - - [320, 2112, 1, 64]
    - [91, 3203.98]
  - - [576, 2112, 1, 64]
    - [104, 5023.02]
  - - [832, 2112, 1, 64]
    - [13, 6426.27]
  - - [64, 2368, 1, 64]
    - [22, 808.277]
  - - [320, 2368, 1, 64]
    - [16, 3592.34]
  - - [576, 2368, 1, 64]
    - [137, 5819.6]
  - - [64, 2624, 1, 64]
    - [109, 895.659]
  - - [320, 2624, 1, 64]
    - [138, 3838.54]
  - - [576, 2624, 1, 64]
    - [57, 6045.7]
  - - [64, 2880, 1, 64]
    - [62, 943.718]
  - - [320, 2880, 1, 64]
    - [91, 4213.03]
  - - [576, 2880, 1, 64]
    - [30, 6245.2]
  - - [64, 3136, 1, 64]
    - [115, 1027.6]
  - - [320, 3136, 1, 64]
    - [35, 4429.33]
  - - [576, 3136, 1, 64]
    - [69, 6606.03]
  - - [64, 3392, 1, 64]
    - [127, 1111.49]
  - - [320, 3392, 1, 64]
    - [4, 4481.82]
  - - [64, 3648, 1, 64]
    - [62, 1149.4]
  - - [320, 3648, 1, 64]
    - [78, 4980.74]
  - - [64, 3904, 1, 64]
    - [62, 1230.06]
  - - [320, 3904, 1, 64]
    - [68, 4997.12]
  - - [64, 64, 1, 256]
    - [71, 83.8861]
  - - [320, 64, 1, 256]
    - [111, 419.43]
  - - [576, 64, 1, 256]
    - [75, 754.975]
  - - [832, 64, 1, 256]
    - [76, 1090.52]
  - - [1088, 64, 1, 256]
    - [112, 1426.06]
  - - [1344, 64, 1, 256]
    - [129, 1761.61]
  - - [1600, 64, 1, 256]
    - [121, 2097.15]
  - - [1856, 64, 1, 256]
    - [110, 2339.13]
  - - [2112, 64, 1, 256]
    - [139, 3008.96]
  - - [2368, 64, 1, 256]
    - [81, 3103.78]
  - - [2624, 64, 1, 256]
    - [62, 3307.05]
  - - [2880, 64, 1, 256]
    - [81, 3629.69]
  - - [3136, 64, 1, 256]
    - [127, 3952.32]
  - - [3392, 64, 1, 256]
    - [17, 4274.96]
  - - [3648, 64, 1, 256]
    - [73, 4427.32]
  - - [3904, 64, 1, 256]
    - [63, 4920.24]
  - - [64, 320, 1, 256]
    - [71, 419.43]
  - - [320, 320, 1, 256]
    - [81, 2097.15]
  - - [576, 320, 1, 256]
    - [130, 3774.87]
  - - [832, 320, 1, 256]
    - [132, 5242.88]
  - - [1088, 320, 1, 256]
    - [49, 6602.15]
  - - [1344, 320, 1, 256]
    - [16, 8155.59]
  - - [64, 576, 1, 256]
    - [111, 786.432]
  - - [320, 576, 1, 256]
    - [115, 3774.87]
  - - [576, 576, 1, 256]
    - [25, 6533.44]
  - - [832, 576, 1, 256]
    - [77, 9087.66]
  - - [64, 832, 1, 256]
    - [109, 1090.52]
  - - [320, 832, 1, 256]
    - [135, 5048.7]
  - - [576, 832, 1, 256]
    - [83, 8763.1]
  - - [64, 1088, 1, 256]
    - [117, 1320.43]
  - - [320, 1088, 1, 256]
    - [64, 6602.15]
  - - [64, 1344, 1, 256]
    - [110, 1761.61]
  - - [320, 1344, 1, 256]
    - [138, 8155.59]
  - - [64, 1600, 1, 256]
    - [62, 2097.15]
  - - [64, 1856, 1, 256]
    - [133, 2534.06]
  - - [64, 2112, 1, 256]
    - [47, 2661.77]
  - - [64, 2368, 1, 256]
    - [115, 3103.78]
  - - [64, 2624, 1, 256]
    - [15, 3439.33]
  - - [64, 2880, 1, 256]
    - [90, 3774.87]
  - - [64, 3136, 1, 256]
    - [113, 3805.94]
  - - [64, 3392, 1, 256]
    - [27, 3969.61]
  - - [64, 3648, 1, 256]
    - [16, 4427.32]
  - - [64, 3904, 1, 256]
    - [76, 4738.01]
  - - [64, 64, 1, 512]
    - [118, 167.772]
  - - [320, 64, 1, 512]
    - [118, 873.813]
  - - [576, 64, 1, 512]
    - [114, 1509.95]
  - - [832, 64, 1, 512]
    - [115, 2097.15]
  - - [1088, 64, 1, 512]
    - [125, 2742.43]
  - - [1344, 64, 1, 512]
    - [117, 3523.22]
  - - [1600, 64, 1, 512]
    - [114, 3883.61]
  - - [1856, 64, 1, 512]
    - [114, 4504.99]
  - - [2112, 64, 1, 512]
    - [76, 4772.83]
  - - [2368, 64, 1, 512]
    - [126, 5542.47]
  - - [2624, 64, 1, 512]
    - [103, 6141.66]
  - - [2880, 64, 1, 512]
    - [103, 6740.85]
  - - [3136, 64, 1, 512]
    - [115, 7086.93]
  - - [3392, 64, 1, 512]
    - [16, 7170.91]
  - - [3648, 64, 1, 512]
    - [47, 7969.18]
  - - [64, 320, 1, 512]
    - [88, 806.597]
  - - [320, 320, 1, 512]
    - [21, 3883.61]
  - - [576, 320, 1, 512]
    - [73, 7259.37]
  - - [64, 576, 1, 512]
    - [128, 1451.87]
  - - [320, 576, 1, 512]
    - [129, 7259.37]
  - - [64, 832, 1, 512]
    - [119, 2097.15]
  - - [64, 1088, 1, 512]
    - [71, 2852.13]
  - - [64, 1344, 1, 512]
    - [125, 3523.22]
  - - [64, 1600, 1, 512]
    - [128, 4032.98]
  - - [64, 1856, 1, 512]
    - [114, 4678.26]
  - - [64, 2112, 1, 512]
    - [139, 5536.48]
  - - [64, 2368, 1, 512]
    - [103, 5747.75]
  - - [64, 2624, 1, 512]
    - [23, 6614.09]
  - - [64, 2880, 1, 512]
    - [136, 6990.51]
  - - [64, 3136, 1, 512]
    - [132, 7611.89]
  - - [64, 3392, 1, 512]
    - [62, 7939.22]
  - - [64, 3648, 1, 512]
    - [73, 8538.4]
  - - [64, 64, 1, 1024]
    - [116, 310.689]
  - - [320, 64, 1, 1024]
    - [112, 1553.45]
  - - [576, 64, 1, 1024]
    - [116, 2796.2]
  - - [832, 64, 1, 1024]
    - [112, 4038.96]
  - - [1088, 64, 1, 1024]
    - [112, 4917.46]
  - - [1344, 64, 1, 1024]
    - [23, 5872.03]
  - - [1600, 64, 1, 1024]
    - [22, 6553.6]
  - - [1856, 64, 1, 1024]
    - [27, 7371.81]
  - - [64, 320, 1, 1024]
    - [71, 1553.45]
  - - [320, 320, 1, 1024]
    - [15, 7231.56]
  - - [64, 576, 1, 1024]
    - [22, 2796.2]
  - - [64, 832, 1, 1024]
    - [88, 4194.3]
  - - [64, 1088, 1, 1024]
    - [72, 5281.72]
  - - [64, 1344, 1, 1024]
    - [120, 6291.46]
  - - [64, 1600, 1, 1024]
    - [128, 7231.56]
  - - [64, 1856, 1, 1024]
    - [72, 8388.61]
  - - [64, 64, 1, 2048]
    - [71, 578.525]
  - - [320, 64, 1, 2048]
    - [123, 2995.93]
  - - [576, 64, 1, 2048]
    - [112, 4870.8]
  - - [832, 64, 1, 2048]
    - [116, 7035.61]
  - - [64, 320, 1, 2048]
    - [71, 2892.62]
  - - [64, 576, 1, 2048]
    - [112, 5206.72]
  - - [64, 832, 1, 2048]
    - [23, 7270.13]
  - - [64, 64, 1, 4096]
    - [71, 1016.8]
  - - [320, 64, 1, 4096]
    - [112, 5084.0]
  - - [64, 320, 1, 4096]
    - [112, 5084.0]
  - - [192, 64, 1, 64]
    - [110, 65.536]
  - - [448, 64, 1, 64]
    - [114, 152.917]
  - - [704, 64, 1, 64]
    - [117, 240.299]
  - - [960, 64, 1, 64]
    - [113, 314.573]
  - - [1216, 64, 1, 64]
    - [90, 398.459]
  - - [1472, 64, 1, 64]
    - [135, 524.288]
  - - [1728, 64, 1, 64]
    - [132, 566.231]
  - - [1984, 64, 1, 64]
    - [91, 650.117]
  - - [64, 192, 1, 64]
    - [121, 62.9146]
  - - [192, 192, 1, 64]
    - [109, 196.608]
  - - [320, 192, 1, 64]
    - [109, 314.573]
  - - [448, 192, 1, 64]
    - [109, 440.402]
  - - [576, 192, 1, 64]
    - [122, 544.453]
  - - [704, 192, 1, 64]
    - [109, 692.06]
  - - [832, 192, 1, 64]
    - [139, 817.889]
  - - [960, 192, 1, 64]
    - [109, 943.718]
  - - [1088, 192, 1, 64]
    - [91, 1069.55]
  - - [1216, 192, 1, 64]
    - [89, 1149.4]
  - - [1344, 192, 1, 64]
    - [114, 1321.21]
  - - [1472, 192, 1, 64]
    - [90, 1447.03]
  - - [1600, 192, 1, 64]
    - [76, 1572.86]
  - - [1728, 192, 1, 64]
    - [89, 1698.69]
  - - [1856, 192, 1, 64]
    - [90, 1824.52]
  - - [1984, 192, 1, 64]
    - [138, 1875.34]
  - - [192, 320, 1, 64]
    - [121, 327.68]
  - - [448, 320, 1, 64]
    - [113, 705.772]
  - - [704, 320, 1, 64]
    - [113, 1109.07]
  - - [960, 320, 1, 64]
    - [132, 1512.37]
  - - [1216, 320, 1, 64]
    - [76, 1992.29]
  - - [1472, 320, 1, 64]
    - [138, 2411.72]
  - - [1728, 320, 1, 64]
    - [89, 2722.26]
  - - [1984, 320, 1, 64]
    - [16, 2902.31]
  - - [64, 448, 1, 64]
    - [128, 152.917]
  - - [192, 448, 1, 64]
    - [110, 478.698]
  - - [320, 448, 1, 64]
    - [89, 734.003]
  - - [448, 448, 1, 64]
    - [127, 1027.6]
  - - [576, 448, 1, 64]
    - [89, 1321.21]
  - - [704, 448, 1, 64]
    - [62, 1682.09]
  - - [832, 448, 1, 64]
    - [62, 1908.41]
  - - [960, 448, 1, 64]
    - [26, 2038.9]
  - - [1088, 448, 1, 64]
    - [89, 2399.63]
  - - [1216, 448, 1, 64]
    - [31, 2681.93]
  - - [1344, 448, 1, 64]
    - [83, 2854.46]
  - - [1472, 448, 1, 64]
    - [91, 3126.31]
  - - [1600, 448, 1, 64]
    - [91, 3528.86]
  - - [1728, 448, 1, 64]
    - [137, 3670.02]
  - - [1856, 448, 1, 64]
    - [78, 3941.87]
  - - [1984, 448, 1, 64]
    - [28, 3923.12]
  - - [192, 576, 1, 64]
    - [122, 589.824]
  - - [448, 576, 1, 64]
    - [135, 1376.26]
  - - [704, 576, 1, 64]
    - [132, 1996.33]
  - - [960, 576, 1, 64]
    - [83, 2722.26]
  - - [1216, 576, 1, 64]
    - [49, 3201.9]
  - - [1472, 576, 1, 64]
    - [78, 3742.33]
  - - [1728, 576, 1, 64]
    - [137, 4550.07]
  - - [1984, 576, 1, 64]
    - [79, 4875.88]
  - - [64, 704, 1, 64]
    - [15, 230.687]
  - - [192, 704, 1, 64]
    - [129, 692.06]
  - - [320, 704, 1, 64]
    - [69, 1109.07]
  - - [448, 704, 1, 64]
    - [89, 1614.81]
  - - [576, 704, 1, 64]
    - [89, 1922.39]
  - - [704, 704, 1, 64]
    - [21, 2439.96]
  - - [832, 704, 1, 64]
    - [132, 2776.78]
  - - [960, 704, 1, 64]
    - [138, 3327.21]
  - - [1088, 704, 1, 64]
    - [49, 3501.49]
  - - [1216, 704, 1, 64]
    - [138, 3778.49]
  - - [1344, 704, 1, 64]
    - [16, 4325.38]
  - - [1472, 704, 1, 64]
    - [78, 4421.5]
  - - [1600, 704, 1, 64]
    - [33, 4805.97]
  - - [1728, 704, 1, 64]
    - [54, 4866.05]
  - - [1856, 704, 1, 64]
    - [137, 5574.93]
  - - [1984, 704, 1, 64]
    - [65, 5586.94]
  - - [192, 832, 1, 64]
    - [111, 817.889]
  - - [448, 832, 1, 64]
    - [140, 1908.41]
  - - [704, 832, 1, 64]
    - [83, 2883.58]
  - - [960, 832, 1, 64]
    - [95, 3651.29]
  - - [1216, 832, 1, 64]
    - [95, 4316.64]
  - - [1472, 832, 1, 64]
    - [65, 5056.84]
  - - [1728, 832, 1, 64]
    - [43, 5576.52]
  - - [1984, 832, 1, 64]
    - [13, 6214.35]
  - - [64, 960, 1, 64]
    - [128, 327.68]
  - - [192, 960, 1, 64]
    - [81, 943.718]
  - - [320, 960, 1, 64]
    - [132, 1512.37]
  - - [448, 960, 1, 64]
    - [84, 2117.32]
  - - [576, 960, 1, 64]
    - [83, 2722.26]
  - - [704, 960, 1, 64]
    - [78, 3203.98]
  - - [832, 960, 1, 64]
    - [79, 3651.29]
  - - [960, 960, 1, 64]
    - [63, 4067.75]
  - - [1088, 960, 1, 64]
    - [58, 4312.69]
  - - [1216, 960, 1, 64]
    - [79, 4980.74]
  - - [1344, 960, 1, 64]
    - [104, 5327.44]
  - - [1472, 960, 1, 64]
    - [55, 5652.48]
  - - [1600, 960, 1, 64]
    - [38, 5957.82]
  - - [1728, 960, 1, 64]
    - [38, 6434.44]
  - - [1856, 960, 1, 64]
    - [4, 6516.15]
  - - [1984, 960, 1, 64]
    - [38, 6965.54]
  - - [192, 1088, 1, 64]
    - [46, 1069.55]
  - - [448, 1088, 1, 64]
    - [28, 2310.75]
  - - [704, 1088, 1, 64]
    - [89, 3501.49]
  - - [960, 1088, 1, 64]
    - [93, 4456.45]
  - - [1216, 1088, 1, 64]
    - [41, 5462.74]
  - - [1472, 1088, 1, 64]
    - [42, 6406.14]
  - - [1728, 1088, 1, 64]
    - [63, 6875.66]
  - - [64, 1216, 1, 64]
    - [62, 383.134]
  - - [192, 1216, 1, 64]
    - [131, 1149.4]
  - - [320, 1216, 1, 64]
    - [135, 2075.31]
  - - [448, 1216, 1, 64]
    - [137, 2789.21]
  - - [576, 1216, 1, 64]
    - [89, 3320.49]
  - - [704, 1216, 1, 64]
    - [91, 3913.44]
  - - [832, 1216, 1, 64]
    - [56, 4465.49]
  - - [960, 1216, 1, 64]
    - [86, 4980.74]
  - - [1088, 1216, 1, 64]
    - [66, 5462.74]
  - - [1216, 1216, 1, 64]
    - [65, 6105.42]
  - - [1344, 1216, 1, 64]
    - [59, 6152.67]
  - - [1472, 1216, 1, 64]
    - [30, 6738.64]
  - - [1600, 1216, 1, 64]
    - [38, 7546.57]
  - - [192, 1344, 1, 64]
    - [46, 1321.21]
  - - [448, 1344, 1, 64]
    - [91, 2854.46]
  - - [704, 1344, 1, 64]
    - [91, 4176.23]
  - - [960, 1344, 1, 64]
    - [56, 5160.96]
  - - [1216, 1344, 1, 64]
    - [41, 6339.12]
  - - [64, 1472, 1, 64]
    - [132, 482.345]
  - - [192, 1472, 1, 64]
    - [132, 1391.38]
  - - [320, 1472, 1, 64]
    - [132, 2233.08]
  - - [448, 1472, 1, 64]
    - [105, 3014.66]
  - - [576, 1472, 1, 64]
    - [49, 3742.33]
  - - [704, 1472, 1, 64]
    - [92, 4421.5]
  - - [832, 1472, 1, 64]
    - [93, 4898.82]
  - - [960, 1472, 1, 64]
    - [54, 5481.19]
  - - [1088, 1472, 1, 64]
    - [59, 6029.31]
  - - [1216, 1472, 1, 64]
    - [59, 6546.11]
  - - [192, 1600, 1, 64]
    - [135, 1638.4]
  - - [448, 1600, 1, 64]
    - [91, 3528.86]
  - - [704, 1600, 1, 64]
    - [78, 4805.97]
  - - [960, 1600, 1, 64]
    - [96, 5782.59]
  - - [1216, 1600, 1, 64]
    - [49, 7115.34]
  - - [64, 1728, 1, 64]
    - [135, 566.231]
  - - [192, 1728, 1, 64]
    - [140, 1698.69]
  - - [320, 1728, 1, 64]
    - [137, 2621.44]
  - - [448, 1728, 1, 64]
    - [132, 3416.91]
  - - [576, 1728, 1, 64]
    - [92, 4109.74]
  - - [704, 1728, 1, 64]
    - [86, 4718.59]
  - - [832, 1728, 1, 64]
    - [86, 5576.52]
  - - [960, 1728, 1, 64]
    - [96, 6245.2]
  - - [1088, 1728, 1, 64]
    - [69, 6684.67]
  - - [192, 1856, 1, 64]
    - [76, 1754.35]
  - - [448, 1856, 1, 64]
    - [89, 3670.02]
  - - [704, 1856, 1, 64]
    - [137, 5395.09]
  - - [960, 1856, 1, 64]
    - [59, 6335.15]
  - - [64, 1984, 1, 64]
    - [126, 650.117]
  - - [192, 1984, 1, 64]
    - [76, 1805.88]
  - - [320, 1984, 1, 64]
    - [138, 3125.56]
  - - [448, 1984, 1, 64]
    - [137, 4063.23]
  - - [576, 1984, 1, 64]
    - [137, 5044.01]
  - - [704, 1984, 1, 64]
    - [89, 5586.94]
  - - [832, 1984, 1, 64]
    - [89, 6402.67]
  - - [960, 1984, 1, 64]
    - [69, 6965.54]
  - - [192, 64, 1, 256]
    - [131, 262.144]
  - - [448, 64, 1, 256]
    - [71, 564.618]
  - - [704, 64, 1, 256]
    - [139, 887.257]
  - - [960, 64, 1, 256]
    - [88, 1165.08]
  - - [1216, 64, 1, 256]
    - [22, 1475.77]
  - - [1472, 64, 1, 256]
    - [132, 1855.17]
  - - [1728, 64, 1, 256]
    - [110, 2177.81]
  - - [1984, 64, 1, 256]
    - [132, 2500.45]
  - - [64, 192, 1, 256]
    - [15, 233.017]
  - - [192, 192, 1, 256]
    - [71, 725.937]
  - - [320, 192, 1, 256]
    - [110, 1209.9]
  - - [448, 192, 1, 256]
    - [120, 1631.12]
  - - [576, 192, 1, 256]
    - [74, 2097.15]
  - - [704, 192, 1, 256]
    - [23, 2563.19]
  - - [832, 192, 1, 256]
    - [111, 3029.22]
  - - [960, 192, 1, 256]
    - [27, 3932.16]
  - - [1088, 192, 1, 256]
    - [135, 4113.64]
  - - [1216, 192, 1, 256]
    - [135, 4427.32]
  - - [1344, 192, 1, 256]
    - [135, 5081.56]
  - - [1472, 192, 1, 256]
    - [131, 5359.39]
  - - [1600, 192, 1, 256]
    - [89, 5617.37]
  - - [1728, 192, 1, 256]
    - [135, 6066.76]
  - - [1856, 192, 1, 256]
    - [91, 6757.49]
  - - [1984, 192, 1, 256]
    - [140, 7223.52]
  - - [192, 320, 1, 256]
    - [126, 1367.71]
  - - [448, 320, 1, 256]
    - [133, 2936.01]
  - - [704, 320, 1, 256]
    - [75, 4271.98]
  - - [960, 320, 1, 256]
    - [83, 5617.37]
  - - [1216, 320, 1, 256]
    - [89, 7115.34]
  - - [1472, 320, 1, 256]
    - [137, 8932.31]
  - - [64, 448, 1, 256]
    - [116, 587.203]
  - - [192, 448, 1, 256]
    - [127, 1761.61]
  - - [320, 448, 1, 256]
    - [135, 2936.01]
  - - [448, 448, 1, 256]
    - [131, 3805.94]
  - - [576, 448, 1, 256]
    - [140, 5081.56]
  - - [704, 448, 1, 256]
    - [138, 5980.77]
  - - [832, 448, 1, 256]
    - [91, 6815.74]
  - - [960, 448, 1, 256]
    - [84, 7593.14]
  - - [1088, 448, 1, 256]
    - [63, 8605.55]
  - - [192, 576, 1, 256]
    - [114, 2177.81]
  - - [448, 576, 1, 256]
    - [76, 4893.35]
  - - [704, 576, 1, 256]
    - [89, 6920.6]
  - - [64, 704, 1, 256]
    - [139, 922.747]
  - - [192, 704, 1, 256]
    - [134, 2661.77]
  - - [320, 704, 1, 256]
    - [132, 4436.28]
  - - [448, 704, 1, 256]
    - [140, 5980.77]
  - - [576, 704, 1, 256]
    - [84, 7689.56]
  - - [192, 832, 1, 256]
    - [109, 3029.22]
  - - [448, 832, 1, 256]
    - [114, 6815.74]
  - - [64, 960, 1, 256]
    - [116, 1258.29]
  - - [192, 960, 1, 256]
    - [24, 3370.42]
  - - [320, 960, 1, 256]
    - [132, 5825.42]
  - - [448, 960, 1, 256]
    - [138, 7593.14]
  - - [192, 1088, 1, 256]
    - [131, 3961.29]
  - - [448, 1088, 1, 256]
    - [132, 8912.9]
  - - [64, 1216, 1, 256]
    - [114, 1423.07]
  - - [192, 1216, 1, 256]
    - [127, 4597.6]
  - - [320, 1216, 1, 256]
    - [138, 7378.87]
  - - [192, 1344, 1, 256]
    - [135, 5081.56]
  - - [64, 1472, 1, 256]
    - [76, 1855.17]
  - - [192, 1472, 1, 256]
    - [76, 5359.39]
  - - [320, 1472, 1, 256]
    - [132, 9275.86]
  - - [192, 1600, 1, 256]
    - [48, 5825.42]
  - - [64, 1728, 1, 256]
    - [115, 2177.81]
  - - [192, 1728, 1, 256]
    - [132, 6291.46]
  - - [192, 1856, 1, 256]
    - [132, 6757.49]
  - - [64, 1984, 1, 256]
    - [127, 2500.45]
  - - [192, 1984, 1, 256]
    - [114, 6965.54]
  - - [192, 64, 1, 512]
    - [123, 483.958]
  - - [448, 64, 1, 512]
    - [139, 1087.41]
  - - [704, 64, 1, 512]
    - [123, 1774.51]
  - - [960, 64, 1, 512]
    - [112, 2516.58]
  - - [1216, 64, 1, 512]
    - [127, 3065.07]
  - - [1472, 64, 1, 512]
    - [117, 3710.35]
  - - [1728, 64, 1, 512]
    - [103, 4044.51]
  - - [1984, 64, 1, 512]
    - [115, 4815.68]
  - - [64, 192, 1, 512]
    - [116, 503.316]
  - - [192, 192, 1, 512]
    - [122, 1451.87]
  - - [320, 192, 1, 512]
    - [129, 2516.58]
  - - [448, 192, 1, 512]
    - [111, 3523.22]
  - - [576, 192, 1, 512]
    - [111, 4194.3]
  - - [704, 192, 1, 512]
    - [115, 5536.48]
  - - [832, 192, 1, 512]
    - [114, 5842.07]
  - - [960, 192, 1, 512]
    - [136, 6990.51]
  - - [1088, 192, 1, 512]
    - [62, 7376.19]
  - - [1216, 192, 1, 512]
    - [15, 8538.4]
  - - [192, 320, 1, 512]
    - [103, 2419.79]
  - - [448, 320, 1, 512]
    - [114, 5437.06]
  - - [704, 320, 1, 512]
    - [62, 8238.81]
  - - [64, 448, 1, 512]
    - [88, 1174.41]
  - - [192, 448, 1, 512]
    - [129, 3523.22]
  - - [320, 448, 1, 512]
    - [113, 5646.18]
  - - [448, 448, 1, 512]
    - [64, 6850.7]
  - - [192, 576, 1, 512]
    - [111, 4194.3]
  - - [64, 704, 1, 512]
    - [118, 1774.51]
  - - [192, 704, 1, 512]
    - [126, 5126.37]
  - - [320, 704, 1, 512]
    - [89, 8238.81]
  - - [192, 832, 1, 512]
    - [103, 6058.44]
  - - [64, 960, 1, 512]
    - [112, 2330.17]
  - - [192, 960, 1, 512]
    - [76, 7259.37]
  - - [192, 1088, 1, 512]
    - [140, 7639.63]
  - - [64, 1216, 1, 512]
    - [103, 3065.07]
  - - [192, 1216, 1, 512]
    - [131, 8538.4]
  - - [64, 1472, 1, 512]
    - [112, 3710.35]
  - - [64, 1728, 1, 512]
    - [73, 4194.3]
  - - [64, 1984, 1, 512]
    - [130, 5000.9]
  - - [192, 64, 1, 1024]
    - [118, 967.916]
  - - [448, 64, 1, 1024]
    - [123, 2258.47]
  - - [704, 64, 1, 1024]
    - [122, 3549.03]
  - - [960, 64, 1, 1024]
    - [116, 4493.9]
  - - [1216, 64, 1, 1024]
    - [71, 5692.27]
  - - [1472, 64, 1, 1024]
    - [71, 6223.81]
  - - [1728, 64, 1, 1024]
    - [111, 7306.21]
  - - [64, 192, 1, 1024]
    - [118, 932.068]
  - - [192, 192, 1, 1024]
    - [114, 2903.75]
  - - [320, 192, 1, 1024]
    - [75, 4660.34]
  - - [448, 192, 1, 1024]
    - [125, 6291.46]
  - - [576, 192, 1, 1024]
    - [128, 7549.75]
  - - [192, 320, 1, 1024]
    - [116, 4493.9]
  - - [64, 448, 1, 1024]
    - [119, 2348.81]
  - - [192, 448, 1, 1024]
    - [71, 6291.46]
  - - [192, 576, 1, 1024]
    - [128, 7549.75]
  - - [64, 704, 1, 1024]
    - [118, 3417.58]
  - - [64, 960, 1, 1024]
    - [88, 4839.58]
  - - [64, 1216, 1, 1024]
    - [122, 5903.09]
  - - [64, 1472, 1, 1024]
    - [81, 7145.85]
  - - [64, 1728, 1, 1024]
    - [114, 8089.01]
  - - [192, 64, 1, 2048]
    - [112, 1677.72]
  - - [448, 64, 1, 2048]
    - [71, 3914.68]
  - - [704, 64, 1, 2048]
    - [112, 6151.65]
  - - [64, 192, 1, 2048]
    - [71, 1735.57]
  - - [192, 192, 1, 2048]
    - [71, 5033.16]
  - - [64, 448, 1, 2048]
    - [123, 4049.67]
  - - [64, 704, 1, 2048]
    - [71, 6363.77]
  - - [192, 64, 1, 4096]
    - [112, 3050.4]
  - - [448, 64, 1, 4096]
    - [116, 6908.27]
  - - [64, 192, 1, 4096]
    - [71, 3145.73]
  - - [64, 448, 1, 4096]
    - [71, 7117.61]
  - - [128, 64, 1, 64]
    - [114, 43.6907]
  - - [256, 64, 1, 64]
    - [132, 83.8861]
  - - [384, 64, 1, 64]
    - [139, 131.072]
  - - [512, 64, 1, 64]
    - [109, 167.772]
  - - [640, 64, 1, 64]
    - [109, 201.649]
  - - [768, 64, 1, 64]
    - [71, 241.979]
  - - [896, 64, 1, 64]
    - [46, 271.853]
  - - [1024, 64, 1, 64]
    - [115, 335.544]
  - - [64, 128, 1, 64]
    - [109, 40.3298]
  - - [128, 128, 1, 64]
    - [114, 83.8861]
  - - [192, 128, 1, 64]
    - [71, 116.508]
  - - [256, 128, 1, 64]
    - [28, 149.797]
  - - [320, 128, 1, 64]
    - [115, 201.649]
  - - [384, 128, 1, 64]
    - [114, 251.658]
  - - [448, 128, 1, 64]
    - [115, 282.309]
  - - [512, 128, 1, 64]
    - [113, 349.525]
  - - [576, 128, 1, 64]
    - [109, 362.969]
  - - [640, 128, 1, 64]
    - [73, 388.361]
  - - [704, 128, 1, 64]
    - [30, 427.198]
  - - [768, 128, 1, 64]
    - [22, 483.958]
  - - [832, 128, 1, 64]
    - [22, 524.288]
  - - [896, 128, 1, 64]
    - [15, 524.288]
  - - [960, 128, 1, 64]
    - [139, 582.542]
  - - [1024, 128, 1, 64]
    - [139, 621.378]
  - - [128, 192, 1, 64]
    - [117, 125.829]
  - - [256, 192, 1, 64]
    - [23, 241.979]
  - - [384, 192, 1, 64]
    - [111, 377.487]
  - - [512, 192, 1, 64]
    - [128, 466.034]
  - - [640, 192, 1, 64]
    - [73, 561.737]
  - - [768, 192, 1, 64]
    - [78, 699.051]
  - - [896, 192, 1, 64]
    - [140, 880.804]
  - - [1024, 192, 1, 64]
    - [113, 967.916]
  - - [64, 256, 1, 64]
    - [114, 77.6723]
  - - [128, 256, 1, 64]
    - [73, 161.319]
  - - [192, 256, 1, 64]
    - [27, 241.979]
  - - [256, 256, 1, 64]
    - [127, 335.544]
  - - [320, 256, 1, 64]
    - [62, 403.298]
  - - [384, 256, 1, 64]
    - [46, 483.958]
  - - [448, 256, 1, 64]
    - [114, 564.618]
  - - [512, 256, 1, 64]
    - [115, 645.278]
  - - [576, 256, 1, 64]
    - [114, 725.937]
  - - [640, 256, 1, 64]
    - [114, 776.723]
  - - [704, 256, 1, 64]
    - [140, 922.747]
  - - [768, 256, 1, 64]
    - [114, 932.068]
  - - [832, 256, 1, 64]
    - [113, 1135.96]
  - - [896, 256, 1, 64]
    - [127, 1087.41]
  - - [960, 256, 1, 64]
    - [140, 1258.29]
  - - [1024, 256, 1, 64]
    - [140, 1242.76]
  - - [128, 320, 1, 64]
    - [121, 218.453]
  - - [256, 320, 1, 64]
    - [115, 419.43]
  - - [384, 320, 1, 64]
    - [115, 629.146]
  - - [512, 320, 1, 64]
    - [84, 776.723]
  - - [640, 320, 1, 64]
    - [117, 970.904]
  - - [768, 320, 1, 64]
    - [89, 1209.9]
  - - [896, 320, 1, 64]
    - [140, 1529.17]
  - - [1024, 320, 1, 64]
    - [78, 1613.19]
  - - [64, 384, 1, 64]
    - [76, 125.829]
  - - [128, 384, 1, 64]
    - [127, 262.144]
  - - [192, 384, 1, 64]
    - [127, 377.487]
  - - [256, 384, 1, 64]
    - [117, 503.316]
  - - [320, 384, 1, 64]
    - [139, 655.36]
  - - [384, 384, 1, 64]
    - [129, 754.975]
  - - [448, 384, 1, 64]
    - [132, 846.927]
  - - [512, 384, 1, 64]
    - [133, 1006.63]
  - - [576, 384, 1, 64]
    - [84, 1088.91]
  - - [640, 384, 1, 64]
    - [140, 1258.29]
  - - [704, 384, 1, 64]
    - [62, 1384.12]
  - - [768, 384, 1, 64]
    - [91, 1509.95]
  - - [832, 384, 1, 64]
    - [78, 1635.78]
  - - [896, 384, 1, 64]
    - [93, 1693.85]
  - - [960, 384, 1, 64]
    - [95, 1747.63]
  - - [1024, 384, 1, 64]
    - [132, 2013.27]
  - - [128, 448, 1, 64]
    - [132, 305.835]
  - - [256, 448, 1, 64]
    - [127, 638.264]
  - - [384, 448, 1, 64]
    - [126, 880.804]
  - - [512, 448, 1, 64]
    - [127, 1129.24]
  - - [640, 448, 1, 64]
    - [137, 1411.54]
  - - [768, 448, 1, 64]
    - [84, 1693.85]
  - - [896, 448, 1, 64]
    - [66, 1976.16]
  - - [1024, 448, 1, 64]
    - [31, 2097.15]
  - - [64, 512, 1, 64]
    - [103, 167.772]
  - - [128, 512, 1, 64]
    - [109, 349.525]
  - - [192, 512, 1, 64]
    - [113, 503.316]
  - - [256, 512, 1, 64]
    - [63, 671.089]
  - - [320, 512, 1, 64]
    - [73, 838.861]
  - - [384, 512, 1, 64]
    - [130, 1006.63]
  - - [448, 512, 1, 64]
    - [26, 1129.24]
  - - [512, 512, 1, 64]
    - [62, 1342.18]
  - - [576, 512, 1, 64]
    - [138, 1451.87]
  - - [640, 512, 1, 64]
    - [21, 1613.19]
  - - [704, 512, 1, 64]
    - [64, 1774.51]
  - - [768, 512, 1, 64]
    - [62, 2013.27]
  - - [832, 512, 1, 64]
    - [63, 2097.15]
  - - [896, 512, 1, 64]
    - [63, 2258.47]
  - - [960, 512, 1, 64]
    - [64, 2419.79]
  - - [1024, 512, 1, 64]
    - [64, 2796.2]
  - - [128, 576, 1, 64]
    - [114, 410.312]
  - - [256, 576, 1, 64]
    - [62, 754.975]
  - - [384, 576, 1, 64]
    - [75, 1088.91]
  - - [512, 576, 1, 64]
    - [132, 1509.95]
  - - [640, 576, 1, 64]
    - [132, 1887.44]
  - - [768, 576, 1, 64]
    - [83, 2264.92]
  - - [896, 576, 1, 64]
    - [54, 2642.41]
  - - [1024, 576, 1, 64]
    - [63, 2796.2]
  - - [64, 640, 1, 64]
    - [21, 218.453]
  - - [128, 640, 1, 64]
    - [123, 455.903]
  - - [192, 640, 1, 64]
    - [76, 629.146]
  - - [256, 640, 1, 64]
    - [127, 806.597]
  - - [320, 640, 1, 64]
    - [73, 1008.25]
  - - [384, 640, 1, 64]
    - [127, 1258.29]
  - - [448, 640, 1, 64]
    - [62, 1468.01]
  - - [512, 640, 1, 64]
    - [48, 1677.72]
  - - [576, 640, 1, 64]
    - [25, 1887.44]
  - - [640, 640, 1, 64]
    - [90, 2097.15]
  - - [704, 640, 1, 64]
    - [89, 2218.14]
  - - [768, 640, 1, 64]
    - [30, 2330.17]
  - - [832, 640, 1, 64]
    - [28, 2524.35]
  - - [896, 640, 1, 64]
    - [50, 2718.53]
  - - [960, 640, 1, 64]
    - [89, 2912.71]
  - - [1024, 640, 1, 64]
    - [64, 3226.39]
  - - [128, 704, 1, 64]
    - [113, 480.597]
  - - [256, 704, 1, 64]
    - [76, 922.747]
  - - [384, 704, 1, 64]
    - [15, 1330.88]
  - - [512, 704, 1, 64]
    - [132, 1845.49]
  - - [640, 704, 1, 64]
    - [132, 2218.14]
  - - [768, 704, 1, 64]
    - [46, 2563.19]
  - - [896, 704, 1, 64]
    - [49, 2883.58]
  - - [1024, 704, 1, 64]
    - [91, 3295.52]
  - - [64, 768, 1, 64]
    - [117, 262.144]
  - - [128, 768, 1, 64]
    - [133, 547.083]
  - - [192, 768, 1, 64]
    - [115, 754.975]
  - - [256, 768, 1, 64]
    - [115, 1048.58]
  - - [320, 768, 1, 64]
    - [127, 1258.29]
  - - [384, 768, 1, 64]
    - [76, 1509.95]
  - - [448, 768, 1, 64]
    - [91, 1761.61]
  - - [512, 768, 1, 64]
    - [27, 1864.14]
  - - [576, 768, 1, 64]
    - [132, 2177.81]
  - - [640, 768, 1, 64]
    - [68, 2330.17]
  - - [704, 768, 1, 64]
    - [137, 2563.19]
  - - [768, 768, 1, 64]
    - [138, 2796.2]
  - - [832, 768, 1, 64]
    - [90, 3029.22]
  - - [896, 768, 1, 64]
    - [64, 3387.71]
  - - [960, 768, 1, 64]
    - [8, 3370.42]
  - - [1024, 768, 1, 64]
    - [89, 3728.27]
  - - [128, 832, 1, 64]
    - [83, 567.979]
  - - [256, 832, 1, 64]
    - [113, 1090.52]
  - - [384, 832, 1, 64]
    - [63, 1572.86]
  - - [512, 832, 1, 64]
    - [90, 2181.04]
  - - [640, 832, 1, 64]
    - [91, 2524.35]
  - - [768, 832, 1, 64]
    - [63, 3029.22]
  - - [896, 832, 1, 64]
    - [79, 3534.09]
  - - [1024, 832, 1, 64]
    - [67, 3894.71]
  - - [64, 896, 1, 64]
    - [117, 305.835]
  - - [128, 896, 1, 64]
    - [114, 611.669]
  - - [192, 896, 1, 64]
    - [109, 880.804]
  - - [256, 896, 1, 64]
    - [73, 1129.24]
  - - [320, 896, 1, 64]
    - [135, 1468.01]
  - - [384, 896, 1, 64]
    - [90, 1693.85]
  - - [448, 896, 1, 64]
    - [83, 1976.16]
  - - [512, 896, 1, 64]
    - [42, 2258.47]
  - - [576, 896, 1, 64]
    - [52, 2446.68]
  - - [640, 896, 1, 64]
    - [84, 2823.09]
  - - [704, 896, 1, 64]
    - [35, 2990.38]
  - - [768, 896, 1, 64]
    - [66, 3145.73]
  - - [832, 896, 1, 64]
    - [79, 3670.02]
  - - [896, 896, 1, 64]
    - [54, 3670.02]
  - - [960, 896, 1, 64]
    - [58, 3796.57]
  - - [1024, 896, 1, 64]
    - [54, 4194.3]
  - - [128, 960, 1, 64]
    - [29, 629.146]
  - - [256, 960, 1, 64]
    - [89, 1209.9]
  - - [384, 960, 1, 64]
    - [135, 1887.44]
  - - [512, 960, 1, 64]
    - [90, 2330.17]
  - - [640, 960, 1, 64]
    - [78, 2912.71]
  - - [768, 960, 1, 64]
    - [79, 3495.25]
  - - [896, 960, 1, 64]
    - [79, 3932.16]
  - - [1024, 960, 1, 64]
    - [66, 4493.9]
  - - [64, 1024, 1, 64]
    - [81, 335.544]
  - - [128, 1024, 1, 64]
    - [126, 671.089]
  - - [192, 1024, 1, 64]
    - [135, 1006.63]
  - - [256, 1024, 1, 64]
    - [140, 1342.18]
  - - [320, 1024, 1, 64]
    - [132, 1677.72]
  - - [384, 1024, 1, 64]
    - [104, 2013.27]
  - - [448, 1024, 1, 64]
    - [90, 2174.82]
  - - [512, 1024, 1, 64]
    - [89, 2684.35]
  - - [576, 1024, 1, 64]
    - [132, 2796.2]
  - - [640, 1024, 1, 64]
    - [36, 2995.93]
  - - [704, 1024, 1, 64]
    - [91, 3295.52]
  - - [768, 1024, 1, 64]
    - [51, 3471.15]
  - - [832, 1024, 1, 64]
    - [63, 3760.41]
  - - [896, 1024, 1, 64]
    - [58, 4194.3]
  - - [960, 1024, 1, 64]
    - [56, 4338.94]
  - - [1024, 1024, 1, 64]
    - [66, 4628.2]
  - - [128, 64, 1, 256]
    - [110, 167.772]
  - - [256, 64, 1, 256]
    - [136, 349.525]
  - - [384, 64, 1, 256]
    - [121, 503.316]
  - - [512, 64, 1, 256]
    - [119, 645.278]
  - - [640, 64, 1, 256]
    - [124, 873.813]
  - - [768, 64, 1, 256]
    - [111, 967.916]
  - - [896, 64, 1, 256]
    - [76, 1174.41]
  - - [1024, 64, 1, 256]
    - [112, 1290.56]
  - - [64, 128, 1, 256]
    - [121, 174.763]
  - - [128, 128, 1, 256]
    - [114, 335.544]
  - - [192, 128, 1, 256]
    - [112, 524.288]
  - - [256, 128, 1, 256]
    - [124, 699.051]
  - - [320, 128, 1, 256]
    - [118, 873.813]
  - - [384, 128, 1, 256]
    - [112, 1006.63]
  - - [448, 128, 1, 256]
    - [126, 1174.41]
  - - [512, 128, 1, 256]
    - [122, 1398.1]
  - - [576, 128, 1, 256]
    - [123, 1509.95]
  - - [640, 128, 1, 256]
    - [110, 1823.61]
  - - [704, 128, 1, 256]
    - [110, 1845.49]
  - - [768, 128, 1, 256]
    - [109, 1935.83]
  - - [832, 128, 1, 256]
    - [113, 2181.04]
  - - [896, 128, 1, 256]
    - [103, 2348.81]
  - - [960, 128, 1, 256]
    - [114, 2621.44]
  - - [1024, 128, 1, 256]
    - [110, 2917.78]
  - - [128, 192, 1, 256]
    - [130, 503.316]
  - - [256, 192, 1, 256]
    - [88, 1006.63]
  - - [384, 192, 1, 256]
    - [114, 1572.86]
  - - [512, 192, 1, 256]
    - [73, 2013.27]
  - - [640, 192, 1, 256]
    - [81, 2516.58]
  - - [768, 192, 1, 256]
    - [114, 3019.9]
  - - [896, 192, 1, 256]
    - [62, 3387.71]
  - - [1024, 192, 1, 256]
    - [81, 3871.67]
  - - [64, 256, 1, 256]
    - [71, 349.525]
  - - [128, 256, 1, 256]
    - [88, 671.089]
  - - [192, 256, 1, 256]
    - [111, 1048.58]
  - - [320, 256, 1, 256]
    - [71, 1677.72]
  - - [384, 256, 1, 256]
    - [15, 1935.83]
  - - [448, 256, 1, 256]
    - [113, 2348.81]
  - - [512, 256, 1, 256]
    - [76, 2796.2]
  - - [576, 256, 1, 256]
    - [131, 3019.9]
  - - [640, 256, 1, 256]
    - [109, 3226.39]
  - - [704, 256, 1, 256]
    - [135, 3690.99]
  - - [768, 256, 1, 256]
    - [139, 4026.53]
  - - [832, 256, 1, 256]
    - [73, 4362.08]
  - - [896, 256, 1, 256]
    - [62, 4516.94]
  - - [960, 256, 1, 256]
    - [62, 4839.58]
  - - [1024, 256, 1, 256]
    - [47, 4971.03]
  - - [128, 320, 1, 256]
    - [62, 838.861]
  - - [256, 320, 1, 256]
    - [117, 1747.63]
  - - [384, 320, 1, 256]
    - [109, 2516.58]
  - - [512, 320, 1, 256]
    - [75, 3226.39]
  - - [640, 320, 1, 256]
    - [135, 4032.98]
  - - [768, 320, 1, 256]
    - [62, 4839.58]
  - - [896, 320, 1, 256]
    - [84, 5872.03]
  - - [1024, 320, 1, 256]
    - [84, 6452.78]
  - - [64, 384, 1, 256]
    - [128, 503.316]
  - - [128, 384, 1, 256]
    - [128, 1006.63]
  - - [192, 384, 1, 256]
    - [22, 1398.1]
  - - [256, 384, 1, 256]
    - [110, 2097.15]
  - - [320, 384, 1, 256]
    - [22, 2516.58]
  - - [384, 384, 1, 256]
    - [135, 3019.9]
  - - [448, 384, 1, 256]
    - [72, 3523.22]
  - - [512, 384, 1, 256]
    - [103, 4026.53]
  - - [576, 384, 1, 256]
    - [46, 4355.62]
  - - [640, 384, 1, 256]
    - [132, 4660.34]
  - - [704, 384, 1, 256]
    - [15, 5323.54]
  - - [768, 384, 1, 256]
    - [83, 5592.41]
  - - [832, 384, 1, 256]
    - [76, 6058.44]
  - - [896, 384, 1, 256]
    - [64, 6291.46]
  - - [960, 384, 1, 256]
    - [79, 6990.51]
  - - [1024, 384, 1, 256]
    - [17, 7190.24]
  - - [128, 448, 1, 256]
    - [76, 1174.41]
  - - [256, 448, 1, 256]
    - [62, 2348.81]
  - - [384, 448, 1, 256]
    - [114, 3523.22]
  - - [512, 448, 1, 256]
    - [27, 4349.65]
  - - [640, 448, 1, 256]
    - [83, 5646.18]
  - - [768, 448, 1, 256]
    - [49, 6775.41]
  - - [896, 448, 1, 256]
    - [77, 7340.03]
  - - [1024, 448, 1, 256]
    - [90, 8388.61]
  - - [64, 512, 1, 256]
    - [81, 671.089]
  - - [128, 512, 1, 256]
    - [71, 1342.18]
  - - [192, 512, 1, 256]
    - [103, 2013.27]
  - - [256, 512, 1, 256]
    - [127, 2684.35]
  - - [320, 512, 1, 256]
    - [113, 3495.25]
  - - [384, 512, 1, 256]
    - [136, 3728.27]
  - - [448, 512, 1, 256]
    - [76, 4516.94]
  - - [512, 512, 1, 256]
    - [90, 4971.03]
  - - [576, 512, 1, 256]
    - [90, 5807.5]
  - - [640, 512, 1, 256]
    - [90, 6213.78]
  - - [704, 512, 1, 256]
    - [28, 7098.05]
  - - [768, 512, 1, 256]
    - [91, 7190.24]
  - - [832, 512, 1, 256]
    - [28, 7035.61]
  - - [896, 512, 1, 256]
    - [137, 8388.61]
  - - [128, 576, 1, 256]
    - [125, 1572.86]
  - - [256, 576, 1, 256]
    - [113, 3019.9]
  - - [384, 576, 1, 256]
    - [132, 4529.85]
  - - [512, 576, 1, 256]
    - [135, 5592.41]
  - - [640, 576, 1, 256]
    - [135, 7259.37]
  - - [768, 576, 1, 256]
    - [79, 7810.08]
  - - [64, 640, 1, 256]
    - [110, 838.861]
  - - [128, 640, 1, 256]
    - [110, 1677.72]
  - - [192, 640, 1, 256]
    - [114, 2516.58]
  - - [256, 640, 1, 256]
    - [127, 3355.44]
  - - [320, 640, 1, 256]
    - [132, 4032.98]
  - - [384, 640, 1, 256]
    - [75, 4660.34]
  - - [448, 640, 1, 256]
    - [135, 6116.69]
  - - [512, 640, 1, 256]
    - [89, 6452.78]
  - - [576, 640, 1, 256]
    - [132, 6990.51]
  - - [640, 640, 1, 256]
    - [84, 7767.23]
  - - [704, 640, 1, 256]
    - [137, 8543.95]
  - - [128, 704, 1, 256]
    - [134, 1922.39]
  - - [256, 704, 1, 256]
    - [114, 3844.78]
  - - [384, 704, 1, 256]
    - [75, 5323.54]
  - - [512, 704, 1, 256]
    - [132, 7098.05]
  - - [640, 704, 1, 256]
    - [68, 7954.71]
  - - [64, 768, 1, 256]
    - [112, 1006.63]
  - - [128, 768, 1, 256]
    - [126, 2013.27]
  - - [192, 768, 1, 256]
    - [135, 3145.73]
  - - [256, 768, 1, 256]
    - [103, 3871.67]
  - - [320, 768, 1, 256]
    - [15, 4493.9]
  - - [384, 768, 1, 256]
    - [140, 5592.41]
  - - [448, 768, 1, 256]
    - [16, 6074.51]
  - - [512, 768, 1, 256]
    - [76, 7456.54]
  - - [576, 768, 1, 256]
    - [68, 8089.01]
  - - [128, 832, 1, 256]
    - [133, 2271.91]
  - - [256, 832, 1, 256]
    - [140, 4194.3]
  - - [384, 832, 1, 256]
    - [140, 6291.46]
  - - [512, 832, 1, 256]
    - [83, 7789.42]
  - - [64, 896, 1, 256]
    - [109, 1174.41]
  - - [128, 896, 1, 256]
    - [114, 2348.81]
  - - [192, 896, 1, 256]
    - [76, 3523.22]
  - - [256, 896, 1, 256]
    - [135, 4516.94]
  - - [320, 896, 1, 256]
    - [90, 5437.06]
  - - [384, 896, 1, 256]
    - [140, 6524.47]
  - - [448, 896, 1, 256]
    - [84, 7086.93]
  - - [512, 896, 1, 256]
    - [89, 8699.3]
  - - [128, 960, 1, 256]
    - [113, 2419.79]
  - - [256, 960, 1, 256]
    - [15, 4660.34]
  - - [384, 960, 1, 256]
    - [131, 6990.51]
  - - [64, 1024, 1, 256]
    - [103, 1342.18]
  - - [128, 1024, 1, 256]
    - [126, 2684.35]
  - - [192, 1024, 1, 256]
    - [130, 3595.12]
  - - [256, 1024, 1, 256]
    - [140, 4971.03]
  - - [320, 1024, 1, 256]
    - [140, 6213.78]
  - - [384, 1024, 1, 256]
    - [132, 7456.54]
  - - [448, 1024, 1, 256]
    - [132, 8699.3]
  - - [128, 64, 1, 512]
    - [118, 335.544]
  - - [256, 64, 1, 512]
    - [120, 645.278]
  - - [384, 64, 1, 512]
    - [123, 967.916]
  - - [512, 64, 1, 512]
    - [71, 1242.76]
  - - [640, 64, 1, 512]
    - [119, 1677.72]
  - - [768, 64, 1, 512]
    - [116, 2013.27]
  - - [896, 64, 1, 512]
    - [110, 2258.47]
  - - [1024, 64, 1, 512]
    - [122, 2485.51]
  - - [64, 128, 1, 512]
    - [110, 322.639]
  - - [128, 128, 1, 512]
    - [88, 599.186]
  - - [192, 128, 1, 512]
    - [115, 967.916]
  - - [256, 128, 1, 512]
    - [120, 1242.76]
  - - [320, 128, 1, 512]
    - [111, 1677.72]
  - - [384, 128, 1, 512]
    - [125, 2013.27]
  - - [448, 128, 1, 512]
    - [110, 2348.81]
  - - [512, 128, 1, 512]
    - [112, 2684.35]
  - - [576, 128, 1, 512]
    - [114, 2903.75]
  - - [640, 128, 1, 512]
    - [110, 3226.39]
  - - [704, 128, 1, 512]
    - [115, 3690.99]
  - - [768, 128, 1, 512]
    - [110, 3871.67]
  - - [832, 128, 1, 512]
    - [76, 4038.96]
  - - [896, 128, 1, 512]
    - [103, 4349.65]
  - - [960, 128, 1, 512]
    - [81, 4660.34]
  - - [1024, 128, 1, 512]
    - [109, 4971.03]
  - - [128, 192, 1, 512]
    - [119, 932.068]
  - - [256, 192, 1, 512]
    - [110, 2013.27]
  - - [384, 192, 1, 512]
    - [71, 2903.75]
  - - [512, 192, 1, 512]
    - [128, 3871.67]
  - - [640, 192, 1, 512]
    - [62, 4660.34]
  - - [768, 192, 1, 512]
    - [110, 5807.5]
  - - [896, 192, 1, 512]
    - [103, 6291.46]
  - - [1024, 192, 1, 512]
    - [114, 7456.54]
  - - [64, 256, 1, 512]
    - [110, 621.378]
  - - [128, 256, 1, 512]
    - [125, 1342.18]
  - - [192, 256, 1, 512]
    - [103, 1935.83]
  - - [256, 256, 1, 512]
    - [121, 2684.35]
  - - [320, 256, 1, 512]
    - [130, 3355.44]
  - - [384, 256, 1, 512]
    - [112, 3871.67]
  - - [448, 256, 1, 512]
    - [73, 4349.65]
  - - [512, 256, 1, 512]
    - [76, 4971.03]
  - - [576, 256, 1, 512]
    - [72, 5592.41]
  - - [640, 256, 1, 512]
    - [132, 6452.78]
  - - [704, 256, 1, 512]
    - [72, 6835.16]
  - - [768, 256, 1, 512]
    - [62, 7190.24]
  - - [832, 256, 1, 512]
    - [140, 8077.92]
  - - [896, 256, 1, 512]
    - [46, 8388.61]
  - - [128, 320, 1, 512]
    - [116, 1677.72]
  - - [256, 320, 1, 512]
    - [73, 3355.44]
  - - [384, 320, 1, 512]
    - [131, 5033.16]
  - - [512, 320, 1, 512]
    - [74, 6452.78]
  - - [640, 320, 1, 512]
    - [48, 7231.56]
  - - [64, 384, 1, 512]
    - [71, 967.916]
  - - [128, 384, 1, 512]
    - [76, 1935.83]
  - - [192, 384, 1, 512]
    - [120, 2796.2]
  - - [256, 384, 1, 512]
    - [21, 3595.12]
  - - [320, 384, 1, 512]
    - [110, 4660.34]
  - - [384, 384, 1, 512]
    - [133, 5807.5]
  - - [448, 384, 1, 512]
    - [72, 6524.47]
  - - [512, 384, 1, 512]
    - [48, 7190.24]
  - - [576, 384, 1, 512]
    - [76, 8089.01]
  - - [128, 448, 1, 512]
    - [112, 2348.81]
  - - [256, 448, 1, 512]
    - [81, 4516.94]
  - - [384, 448, 1, 512]
    - [72, 7046.43]
  - - [512, 448, 1, 512]
    - [131, 8699.3]
  - - [64, 512, 1, 512]
    - [118, 1342.18]
  - - [128, 512, 1, 512]
    - [127, 2581.11]
  - - [192, 512, 1, 512]
    - [110, 4026.53]
  - - [256, 512, 1, 512]
    - [114, 5162.22]
  - - [320, 512, 1, 512]
    - [24, 6452.78]
  - - [384, 512, 1, 512]
    - [136, 7456.54]
  - - [448, 512, 1, 512]
    - [132, 8699.3]
  - - [128, 576, 1, 512]
    - [117, 3019.9]
  - - [256, 576, 1, 512]
    - [81, 5592.41]
  - - [384, 576, 1, 512]
    - [62, 7549.75]
  - - [64, 640, 1, 512]
    - [88, 1677.72]
  - - [128, 640, 1, 512]
    - [124, 3355.44]
  - - [192, 640, 1, 512]
    - [114, 5033.16]
  - - [256, 640, 1, 512]
    - [72, 6710.89]
  - - [320, 640, 1, 512]
    - [62, 7767.23]
  - - [128, 704, 1, 512]
    - [120, 3690.99]
  - - [256, 704, 1, 512]
    - [73, 6835.16]
  - - [64, 768, 1, 512]
    - [118, 2013.27]
  - - [128, 768, 1, 512]
    - [127, 3871.67]
  - - [192, 768, 1, 512]
    - [75, 5807.5]
  - - [256, 768, 1, 512]
    - [73, 7456.54]
  - - [128, 832, 1, 512]
    - [134, 4194.3]
  - - [256, 832, 1, 512]
    - [64, 7789.42]
  - - [64, 896, 1, 512]
    - [118, 2348.81]
  - - [128, 896, 1, 512]
    - [130, 4349.65]
  - - [192, 896, 1, 512]
    - [81, 6524.47]
  - - [256, 896, 1, 512]
    - [62, 8388.61]
  - - [128, 960, 1, 512]
    - [113, 4839.58]
  - - [64, 1024, 1, 512]
    - [112, 2485.51]
  - - [128, 1024, 1, 512]
    - [110, 5162.22]
  - - [192, 1024, 1, 512]
    - [72, 7190.24]
  - - [128, 64, 1, 1024]
    - [118, 621.378]
  - - [256, 64, 1, 1024]
    - [118, 1342.18]
  - - [384, 64, 1, 1024]
    - [116, 1864.14]
  - - [512, 64, 1, 1024]
    - [120, 2581.11]
  - - [640, 64, 1, 1024]
    - [88, 2995.93]
  - - [768, 64, 1, 1024]
    - [112, 3728.27]
  - - [896, 64, 1, 1024]
    - [103, 4194.3]
  - - [1024, 64, 1, 1024]
    - [103, 4628.2]
  - - [64, 128, 1, 1024]
    - [116, 645.278]
  - - [128, 128, 1, 1024]
    - [112, 1290.56]
  - - [192, 128, 1, 1024]
    - [116, 1935.83]
  - - [256, 128, 1, 1024]
    - [71, 2581.11]
  - - [320, 128, 1, 1024]
    - [71, 3355.44]
  - - [384, 128, 1, 1024]
    - [118, 3728.27]
  - - [448, 128, 1, 1024]
    - [110, 4516.94]
  - - [512, 128, 1, 1024]
    - [73, 4971.03]
  - - [576, 128, 1, 1024]
    - [103, 5592.41]
  - - [640, 128, 1, 1024]
    - [22, 6213.78]
  - - [704, 128, 1, 1024]
    - [71, 6591.05]
  - - [768, 128, 1, 1024]
    - [128, 6942.3]
  - - [832, 128, 1, 1024]
    - [46, 7270.13]
  - - [896, 128, 1, 1024]
    - [75, 7576.81]
  - - [128, 192, 1, 1024]
    - [123, 1864.14]
  - - [256, 192, 1, 1024]
    - [116, 3728.27]
  - - [384, 192, 1, 1024]
    - [75, 5206.72]
  - - [512, 192, 1, 1024]
    - [76, 6710.89]
  - - [64, 256, 1, 1024]
    - [88, 1242.76]
  - - [128, 256, 1, 1024]
    - [116, 2684.35]
  - - [192, 256, 1, 1024]
    - [116, 3728.27]
  - - [256, 256, 1, 1024]
    - [71, 4971.03]
  - - [320, 256, 1, 1024]
    - [122, 6213.78]
  - - [384, 256, 1, 1024]
    - [123, 7190.24]
  - - [448, 256, 1, 1024]
    - [81, 8099.35]
  - - [128, 320, 1, 1024]
    - [76, 2892.62]
  - - [256, 320, 1, 1024]
    - [81, 6213.78]
  - - [64, 384, 1, 1024]
    - [117, 1935.83]
  - - [128, 384, 1, 1024]
    - [119, 3728.27]
  - - [192, 384, 1, 1024]
    - [124, 5592.41]
  - - [256, 384, 1, 1024]
    - [72, 6942.3]
  - - [128, 448, 1, 1024]
    - [76, 4349.65]
  - - [256, 448, 1, 1024]
    - [62, 7829.37]
  - - [64, 512, 1, 1024]
    - [71, 2485.51]
  - - [128, 512, 1, 1024]
    - [122, 4971.03]
  - - [192, 512, 1, 1024]
    - [134, 7456.54]
  - - [128, 576, 1, 1024]
    - [120, 5592.41]
  - - [64, 640, 1, 1024]
    - [71, 3106.89]
  - - [128, 640, 1, 1024]
    - [81, 5991.86]
  - - [128, 704, 1, 1024]
    - [136, 6835.16]
  - - [64, 768, 1, 1024]
    - [116, 3728.27]
  - - [128, 768, 1, 1024]
    - [71, 7190.24]
  - - [128, 832, 1, 1024]
    - [62, 7270.13]
  - - [64, 896, 1, 1024]
    - [103, 4349.65]
  - - [128, 896, 1, 1024]
    - [73, 8099.35]
  - - [64, 1024, 1, 1024]
    - [117, 4971.03]
  - - [128, 64, 1, 2048]
    - [112, 1198.37]
  - - [256, 64, 1, 2048]
    - [123, 2485.51]
  - - [384, 64, 1, 2048]
    - [112, 3471.15]
  - - [512, 64, 1, 2048]
    - [112, 4628.2]
  - - [640, 64, 1, 2048]
    - [112, 5592.41]
  - - [768, 64, 1, 2048]
    - [112, 6291.46]
  - - [896, 64, 1, 2048]
    - [72, 7576.81]
  - - [64, 128, 1, 2048]
    - [123, 1157.05]
  - - [128, 128, 1, 2048]
    - [123, 2314.1]
  - - [192, 128, 1, 2048]
    - [71, 3471.15]
  - - [256, 128, 1, 2048]
    - [71, 4793.49]
  - - [320, 128, 1, 2048]
    - [112, 5991.86]
  - - [384, 128, 1, 2048]
    - [119, 6942.3]
  - - [448, 128, 1, 2048]
    - [81, 7576.81]
  - - [128, 192, 1, 2048]
    - [123, 3471.15]
  - - [256, 192, 1, 2048]
    - [118, 6710.89]
  - - [64, 256, 1, 2048]
    - [116, 2396.75]
  - - [128, 256, 1, 2048]
    - [71, 4628.2]
  - - [192, 256, 1, 2048]
    - [123, 6942.3]
  - - [128, 320, 1, 2048]
    - [116, 5785.25]
  - - [64, 384, 1, 2048]
    - [112, 3595.12]
  - - [128, 384, 1, 2048]
    - [71, 6710.89]
  - - [128, 448, 1, 2048]
    - [23, 7829.37]
  - - [64, 512, 1, 2048]
    - [118, 4793.49]
  - - [64, 640, 1, 2048]
    - [112, 5785.25]
  - - [64, 768, 1, 2048]
    - [112, 6942.3]
  - - [64, 896, 1, 2048]
    - [116, 7829.37]
  - - [128, 64, 1, 4096]
    - [118, 2097.15]
  - - [256, 64, 1, 4096]
    - [123, 4194.3]
  - - [384, 64, 1, 4096]
    - [112, 5921.37]
  - - [64, 128, 1, 4096]
    - [71, 2097.15]
  - - [128, 128, 1, 4096]
    - [71, 4067.2]
  - - [192, 128, 1, 4096]
    - [71, 6291.46]
  - - [128, 192, 1, 4096]
    - [71, 5921.37]
  - - [64, 256, 1, 4096]
    - [71, 4067.2]
  - - [64, 384, 1, 4096]
    - [71, 5921.37]
  - - [1, 1, 1, 1]
    - [109, 8.0e-05]
  - - [2, 2, 1, 2]
    - [116, 0.000615385]
  - - [4, 2, 1, 2]
    - [15, 0.00123077]
  - - [6, 2, 1, 2]
    - [121, 0.00192]
  - - [8, 2, 1, 2]
    - [117, 0.00256]
  - - [10, 2, 1, 2]
    - [62, 0.0032]
  - - [12, 2, 1, 2]
    - [71, 0.00355556]
  - - [14, 2, 1, 2]
    - [88, 0.00430769]
  - - [16, 2, 1, 2]
    - [113, 0.00492308]
  - - [2, 4, 1, 2]
    - [117, 0.00128]
  - - [4, 4, 1, 2]
    - [122, 0.00256]
  - - [6, 4, 1, 2]
    - [130, 0.00384]
  - - [8, 4, 1, 2]
    - [15, 0.00492308]
  - - [10, 4, 1, 2]
    - [134, 0.00615385]
  - - [12, 4, 1, 2]
    - [113, 0.00738462]
  - - [14, 4, 1, 2]
    - [113, 0.00861538]
  - - [16, 4, 1, 2]
    - [73, 0.00984615]
  - - [2, 6, 1, 2]
    - [110, 0.00192]
  - - [4, 6, 1, 2]
    - [122, 0.00384]
  - - [6, 6, 1, 2]
    - [71, 0.00576]
  - - [8, 6, 1, 2]
    - [22, 0.00738462]
  - - [10, 6, 1, 2]
    - [111, 0.00923077]
  - - [12, 6, 1, 2]
    - [122, 0.0110769]
  - - [14, 6, 1, 2]
    - [129, 0.01344]
  - - [16, 6, 1, 2]
    - [115, 0.0147692]
  - - [2, 8, 1, 2]
    - [76, 0.00246154]
  - - [4, 8, 1, 2]
    - [110, 0.00492308]
  - - [6, 8, 1, 2]
    - [125, 0.00738462]
  - - [8, 8, 1, 2]
    - [109, 0.00948148]
  - - [10, 8, 1, 2]
    - [71, 0.0128]
  - - [12, 8, 1, 2]
    - [119, 0.0147692]
  - - [14, 8, 1, 2]
    - [63, 0.0172308]
  - - [16, 8, 1, 2]
    - [130, 0.0196923]
  - - [2, 10, 1, 2]
    - [125, 0.00307692]
  - - [4, 10, 1, 2]
    - [22, 0.00592593]
  - - [6, 10, 1, 2]
    - [73, 0.00923077]
  - - [8, 10, 1, 2]
    - [71, 0.0118519]
  - - [10, 10, 1, 2]
    - [113, 0.0166667]
  - - [12, 10, 1, 2]
    - [115, 0.0184615]
  - - [14, 10, 1, 2]
    - [109, 0.0224]
  - - [16, 10, 1, 2]
    - [113, 0.0246154]
  - - [2, 12, 1, 2]
    - [113, 0.00369231]
  - - [4, 12, 1, 2]
    - [111, 0.00711111]
  - - [6, 12, 1, 2]
    - [22, 0.0106667]
  - - [8, 12, 1, 2]
    - [113, 0.0147692]
  - - [10, 12, 1, 2]
    - [122, 0.0184615]
  - - [12, 12, 1, 2]
    - [114, 0.02304]
  - - [14, 12, 1, 2]
    - [131, 0.0258462]
  - - [16, 12, 1, 2]
    - [15, 0.0284444]
  - - [2, 14, 1, 2]
    - [71, 0.00430769]
  - - [4, 14, 1, 2]
    - [115, 0.00861538]
  - - [6, 14, 1, 2]
    - [116, 0.01344]
  - - [8, 14, 1, 2]
    - [71, 0.0172308]
  - - [10, 14, 1, 2]
    - [15, 0.0207407]
  - - [12, 14, 1, 2]
    - [91, 0.0258462]
  - - [14, 14, 1, 2]
    - [109, 0.0301538]
  - - [16, 14, 1, 2]
    - [46, 0.0344615]
  - - [2, 16, 1, 2]
    - [46, 0.00492308]
  - - [4, 16, 1, 2]
    - [88, 0.01024]
  - - [6, 16, 1, 2]
    - [27, 0.0147692]
  - - [8, 16, 1, 2]
    - [128, 0.0196923]
  - - [10, 16, 1, 2]
    - [15, 0.0228571]
  - - [12, 16, 1, 2]
    - [122, 0.03072]
  - - [14, 16, 1, 2]
    - [21, 0.032]
  - - [16, 16, 1, 2]
    - [114, 0.0379259]
  - - [2, 2, 1, 4]
    - [124, 0.00123077]
  - - [4, 2, 1, 4]
    - [125, 0.00256]
  - - [6, 2, 1, 4]
    - [113, 0.00355556]
  - - [8, 2, 1, 4]
    - [72, 0.00492308]
  - - [10, 2, 1, 4]
    - [22, 0.00615385]
  - - [12, 2, 1, 4]
    - [121, 0.00738462]
  - - [14, 2, 1, 4]
    - [117, 0.00896]
  - - [16, 2, 1, 4]
    - [118, 0.00984615]
  - - [2, 4, 1, 4]
    - [109, 0.00246154]
  - - [4, 4, 1, 4]
    - [71, 0.00492308]
  - - [6, 4, 1, 4]
    - [109, 0.00711111]
  - - [8, 4, 1, 4]
    - [15, 0.00914286]
  - - [10, 4, 1, 4]
    - [122, 0.0118519]
  - - [12, 4, 1, 4]
    - [121, 0.0147692]
  - - [14, 4, 1, 4]
    - [140, 0.0172308]
  - - [16, 4, 1, 4]
    - [71, 0.0196923]
  - - [2, 6, 1, 4]
    - [126, 0.00369231]
  - - [4, 6, 1, 4]
    - [136, 0.00768]
  - - [6, 6, 1, 4]
    - [119, 0.012]
  - - [8, 6, 1, 4]
    - [88, 0.0147692]
  - - [10, 6, 1, 4]
    - [110, 0.0192]
  - - [12, 6, 1, 4]
    - [139, 0.02304]
  - - [14, 6, 1, 4]
    - [125, 0.02688]
  - - [16, 6, 1, 4]
    - [122, 0.03072]
  - - [2, 8, 1, 4]
    - [123, 0.00512]
  - - [4, 8, 1, 4]
    - [113, 0.0106667]
  - - [6, 8, 1, 4]
    - [46, 0.0147692]
  - - [8, 8, 1, 4]
    - [131, 0.0196923]
  - - [10, 8, 1, 4]
    - [110, 0.0256]
  - - [12, 8, 1, 4]
    - [133, 0.0295385]
  - - [14, 8, 1, 4]
    - [110, 0.03584]
  - - [16, 8, 1, 4]
    - [113, 0.04096]
  - - [2, 10, 1, 4]
    - [115, 0.0064]
  - - [4, 10, 1, 4]
    - [116, 0.0128]
  - - [6, 10, 1, 4]
    - [133, 0.02]
  - - [8, 10, 1, 4]
    - [130, 0.0266667]
  - - [10, 10, 1, 4]
    - [88, 0.032]
  - - [12, 10, 1, 4]
    - [138, 0.04]
  - - [14, 10, 1, 4]
    - [109, 0.0466667]
  - - [16, 10, 1, 4]
    - [132, 0.0512]
  - - [2, 12, 1, 4]
    - [109, 0.008]
  - - [4, 12, 1, 4]
    - [114, 0.01536]
  - - [6, 12, 1, 4]
    - [130, 0.0221538]
  - - [8, 12, 1, 4]
    - [116, 0.03072]
  - - [10, 12, 1, 4]
    - [103, 0.04]
  - - [12, 12, 1, 4]
    - [130, 0.048]
  - - [14, 12, 1, 4]
    - [118, 0.056]
  - - [16, 12, 1, 4]
    - [114, 0.064]
  - - [2, 14, 1, 4]
    - [119, 0.00896]
  - - [4, 14, 1, 4]
    - [109, 0.01792]
  - - [6, 14, 1, 4]
    - [110, 0.02688]
  - - [8, 14, 1, 4]
    - [113, 0.0373333]
  - - [10, 14, 1, 4]
    - [73, 0.0466667]
  - - [12, 14, 1, 4]
    - [115, 0.056]
  - - [14, 14, 1, 4]
    - [127, 0.0653333]
  - - [16, 14, 1, 4]
    - [83, 0.07168]
  - - [2, 16, 1, 4]
    - [83, 0.01024]
  - - [4, 16, 1, 4]
    - [110, 0.02048]
  - - [6, 16, 1, 4]
    - [110, 0.03072]
  - - [8, 16, 1, 4]
    - [116, 0.04096]
  - - [10, 16, 1, 4]
    - [114, 0.0512]
  - - [12, 16, 1, 4]
    - [113, 0.06144]
  - - [14, 16, 1, 4]
    - [115, 0.0746667]
  - - [16, 16, 1, 4]
    - [128, 0.0853333]
  - - [2, 2, 1, 6]
    - [88, 0.00192]
  - - [4, 2, 1, 6]
    - [109, 0.004]
  - - [6, 2, 1, 6]
    - [114, 0.006]
  - - [8, 2, 1, 6]
    - [103, 0.00738462]
  - - [10, 2, 1, 6]
    - [71, 0.0096]
  - - [12, 2, 1, 6]
    - [114, 0.0125217]
  - - [14, 2, 1, 6]
    - [111, 0.01344]
  - - [16, 2, 1, 6]
    - [116, 0.016]
  - - [2, 4, 1, 6]
    - [132, 0.004]
  - - [4, 4, 1, 6]
    - [112, 0.008]
  - - [6, 4, 1, 6]
    - [26, 0.01152]
  - - [8, 4, 1, 6]
    - [113, 0.0166957]
  - - [10, 4, 1, 6]
    - [88, 0.02]
  - - [12, 4, 1, 6]
    - [109, 0.024]
  - - [14, 4, 1, 6]
    - [122, 0.0292174]
  - - [16, 4, 1, 6]
    - [71, 0.032]
  - - [2, 6, 1, 6]
    - [120, 0.00626087]
  - - [4, 6, 1, 6]
    - [117, 0.012]
  - - [6, 6, 1, 6]
    - [111, 0.018]
  - - [8, 6, 1, 6]
    - [122, 0.0250435]
  - - [10, 6, 1, 6]
    - [88, 0.03]
  - - [12, 6, 1, 6]
    - [88, 0.03456]
  - - [14, 6, 1, 6]
    - [117, 0.0438261]
  - - [16, 6, 1, 6]
    - [109, 0.048]
  - - [2, 8, 1, 6]
    - [103, 0.00738462]
  - - [4, 8, 1, 6]
    - [112, 0.0147692]
  - - [6, 8, 1, 6]
    - [113, 0.024]
  - - [8, 8, 1, 6]
    - [121, 0.032]
  - - [10, 8, 1, 6]
    - [110, 0.04]
  - - [12, 8, 1, 6]
    - [113, 0.04608]
  - - [14, 8, 1, 6]
    - [121, 0.056]
  - - [16, 8, 1, 6]
    - [118, 0.064]
  - - [2, 10, 1, 6]
    - [129, 0.01]
  - - [4, 10, 1, 6]
    - [109, 0.0192]
  - - [6, 10, 1, 6]
    - [128, 0.0288]
  - - [8, 10, 1, 6]
    - [125, 0.0417391]
  - - [10, 10, 1, 6]
    - [125, 0.05]
  - - [12, 10, 1, 6]
    - [111, 0.06]
  - - [14, 10, 1, 6]
    - [114, 0.0672]
  - - [16, 10, 1, 6]
    - [74, 0.0768]
  - - [2, 12, 1, 6]
    - [109, 0.01152]
  - - [4, 12, 1, 6]
    - [133, 0.024]
  - - [6, 12, 1, 6]
    - [81, 0.03456]
  - - [8, 12, 1, 6]
    - [113, 0.048]
  - - [10, 12, 1, 6]
    - [109, 0.0576]
  - - [12, 12, 1, 6]
    - [113, 0.06912]
  - - [14, 12, 1, 6]
    - [113, 0.084]
  - - [16, 12, 1, 6]
    - [49, 0.09216]
  - - [2, 14, 1, 6]
    - [71, 0.01344]
  - - [4, 14, 1, 6]
    - [113, 0.028]
  - - [6, 14, 1, 6]
    - [117, 0.0438261]
  - - [8, 14, 1, 6]
    - [117, 0.056]
  - - [10, 14, 1, 6]
    - [124, 0.07]
  - - [12, 14, 1, 6]
    - [128, 0.08064]
  - - [14, 14, 1, 6]
    - [88, 0.098]
  - - [16, 14, 1, 6]
    - [128, 0.112]
  - - [2, 16, 1, 6]
    - [73, 0.01536]
  - - [4, 16, 1, 6]
    - [115, 0.032]
  - - [6, 16, 1, 6]
    - [115, 0.048]
  - - [8, 16, 1, 6]
    - [129, 0.06144]
  - - [10, 16, 1, 6]
    - [128, 0.08]
  - - [12, 16, 1, 6]
    - [121, 0.096]
  - - [14, 16, 1, 6]
    - [113, 0.112]
  - - [16, 16, 1, 6]
    - [71, 0.128]
  - - [2, 2, 1, 8]
    - [71, 0.00266667]
  - - [4, 2, 1, 8]
    - [114, 0.00556522]
  - - [6, 2, 1, 8]
    - [130, 0.008]
  - - [8, 2, 1, 8]
    - [125, 0.0111304]
  - - [10, 2, 1, 8]
    - [90, 0.0128]
  - - [12, 2, 1, 8]
    - [111, 0.016]
  - - [14, 2, 1, 8]
    - [73, 0.0186667]
  - - [16, 2, 1, 8]
    - [128, 0.02048]
  - - [2, 4, 1, 8]
    - [118, 0.00533333]
  - - [4, 4, 1, 8]
    - [109, 0.0106667]
  - - [6, 4, 1, 8]
    - [121, 0.016]
  - - [8, 4, 1, 8]
    - [117, 0.02048]
  - - [10, 4, 1, 8]
    - [128, 0.0256]
  - - [12, 4, 1, 8]
    - [46, 0.032]
  - - [14, 4, 1, 8]
    - [15, 0.03584]
  - - [16, 4, 1, 8]
    - [113, 0.0426667]
  - - [2, 6, 1, 8]
    - [71, 0.00768]
  - - [4, 6, 1, 8]
    - [125, 0.016]
  - - [6, 6, 1, 8]
    - [110, 0.024]
  - - [8, 6, 1, 8]
    - [62, 0.032]
  - - [10, 6, 1, 8]
    - [123, 0.04]
  - - [12, 6, 1, 8]
    - [133, 0.048]
  - - [14, 6, 1, 8]
    - [71, 0.056]
  - - [16, 6, 1, 8]
    - [128, 0.06144]
  - - [2, 8, 1, 8]
    - [114, 0.0106667]
  - - [4, 8, 1, 8]
    - [128, 0.0213333]
  - - [6, 8, 1, 8]
    - [115, 0.032]
  - - [8, 8, 1, 8]
    - [126, 0.04096]
  - - [10, 8, 1, 8]
    - [46, 0.0512]
  - - [12, 8, 1, 8]
    - [15, 0.064]
  - - [14, 8, 1, 8]
    - [139, 0.077913]
  - - [16, 8, 1, 8]
    - [139, 0.0853333]
  - - [2, 10, 1, 8]
    - [116, 0.0128]
  - - [4, 10, 1, 8]
    - [133, 0.0278261]
  - - [6, 10, 1, 8]
    - [120, 0.04]
  - - [8, 10, 1, 8]
    - [15, 0.0492308]
  - - [10, 10, 1, 8]
    - [133, 0.0695652]
  - - [12, 10, 1, 8]
    - [128, 0.08]
  - - [14, 10, 1, 8]
    - [116, 0.0933333]
  - - [16, 10, 1, 8]
    - [16, 0.0984615]
  - - [2, 12, 1, 8]
    - [119, 0.016]
  - - [4, 12, 1, 8]
    - [113, 0.032]
  - - [6, 12, 1, 8]
    - [122, 0.050087]
  - - [8, 12, 1, 8]
    - [110, 0.064]
  - - [10, 12, 1, 8]
    - [119, 0.0834783]
  - - [12, 12, 1, 8]
    - [125, 0.096]
  - - [14, 12, 1, 8]
    - [88, 0.112]
  - - [16, 12, 1, 8]
    - [73, 0.133565]
  - - [2, 14, 1, 8]
    - [15, 0.01792]
  - - [4, 14, 1, 8]
    - [109, 0.0373333]
  - - [6, 14, 1, 8]
    - [121, 0.056]
  - - [8, 14, 1, 8]
    - [71, 0.077913]
  - - [10, 14, 1, 8]
    - [110, 0.0896]
  - - [12, 14, 1, 8]
    - [74, 0.10752]
  - - [14, 14, 1, 8]
    - [126, 0.130667]
  - - [16, 14, 1, 8]
    - [129, 0.149333]
  - - [2, 16, 1, 8]
    - [71, 0.0213333]
  - - [4, 16, 1, 8]
    - [109, 0.0393846]
  - - [6, 16, 1, 8]
    - [29, 0.06144]
  - - [8, 16, 1, 8]
    - [15, 0.0853333]
  - - [10, 16, 1, 8]
    - [110, 0.106667]
  - - [12, 16, 1, 8]
    - [15, 0.12288]
  - - [14, 16, 1, 8]
    - [15, 0.137846]
  - - [16, 16, 1, 8]
    - [115, 0.170667]
  - - [2, 2, 1, 10]
    - [139, 0.00333333]
  - - [4, 2, 1, 10]
    - [128, 0.0064]
  - - [6, 2, 1, 10]
    - [115, 0.01]
  - - [8, 2, 1, 10]
    - [71, 0.0133333]
  - - [10, 2, 1, 10]
    - [130, 0.0166667]
  - - [12, 2, 1, 10]
    - [71, 0.02]
  - - [14, 2, 1, 10]
    - [120, 0.0233333]
  - - [16, 2, 1, 10]
    - [81, 0.0266667]
  - - [2, 4, 1, 10]
    - [15, 0.0064]
  - - [4, 4, 1, 10]
    - [113, 0.0133333]
  - - [6, 4, 1, 10]
    - [128, 0.0192]
  - - [8, 4, 1, 10]
    - [117, 0.0278261]
  - - [10, 4, 1, 10]
    - [128, 0.032]
  - - [12, 4, 1, 10]
    - [117, 0.04]
  - - [14, 4, 1, 10]
    - [128, 0.0466667]
  - - [16, 4, 1, 10]
    - [15, 0.0512]
  - - [2, 6, 1, 10]
    - [15, 0.0096]
  - - [4, 6, 1, 10]
    - [88, 0.0192]
  - - [6, 6, 1, 10]
    - [117, 0.03]
  - - [8, 6, 1, 10]
    - [48, 0.0384]
  - - [10, 6, 1, 10]
    - [116, 0.05]
  - - [12, 6, 1, 10]
    - [109, 0.0626087]
  - - [14, 6, 1, 10]
    - [130, 0.07]
  - - [16, 6, 1, 10]
    - [112, 0.08]
  - - [2, 8, 1, 10]
    - [15, 0.0128]
  - - [4, 8, 1, 10]
    - [121, 0.0278261]
  - - [6, 8, 1, 10]
    - [122, 0.0384]
  - - [8, 8, 1, 10]
    - [16, 0.0512]
  - - [10, 8, 1, 10]
    - [113, 0.0666667]
  - - [12, 8, 1, 10]
    - [21, 0.0768]
  - - [14, 8, 1, 10]
    - [116, 0.0933333]
  - - [16, 8, 1, 10]
    - [109, 0.1024]
  - - [2, 10, 1, 10]
    - [88, 0.0166667]
  - - [4, 10, 1, 10]
    - [129, 0.0333333]
  - - [6, 10, 1, 10]
    - [71, 0.05]
  - - [8, 10, 1, 10]
    - [73, 0.064]
  - - [10, 10, 1, 10]
    - [114, 0.0833333]
  - - [12, 10, 1, 10]
    - [113, 0.1]
  - - [14, 10, 1, 10]
    - [88, 0.116667]
  - - [16, 10, 1, 10]
    - [112, 0.133333]
  - - [2, 12, 1, 10]
    - [110, 0.0192]
  - - [4, 12, 1, 10]
    - [62, 0.04]
  - - [6, 12, 1, 10]
    - [114, 0.0576]
  - - [8, 12, 1, 10]
    - [115, 0.08]
  - - [10, 12, 1, 10]
    - [15, 0.096]
  - - [12, 12, 1, 10]
    - [113, 0.1152]
  - - [14, 12, 1, 10]
    - [88, 0.1344]
  - - [16, 12, 1, 10]
    - [130, 0.1536]
  - - [2, 14, 1, 10]
    - [128, 0.0233333]
  - - [4, 14, 1, 10]
    - [115, 0.0448]
  - - [6, 14, 1, 10]
    - [129, 0.07]
  - - [8, 14, 1, 10]
    - [126, 0.0933333]
  - - [10, 14, 1, 10]
    - [109, 0.112]
  - - [12, 14, 1, 10]
    - [109, 0.14]
  - - [14, 14, 1, 10]
    - [110, 0.163333]
  - - [16, 14, 1, 10]
    - [114, 0.1792]
  - - [2, 16, 1, 10]
    - [139, 0.0266667]
  - - [4, 16, 1, 10]
    - [125, 0.0533333]
  - - [6, 16, 1, 10]
    - [125, 0.08]
  - - [8, 16, 1, 10]
    - [139, 0.106667]
  - - [10, 16, 1, 10]
    - [118, 0.133333]
  - - [12, 16, 1, 10]
    - [27, 0.147692]
  - - [14, 16, 1, 10]
    - [123, 0.186667]
  - - [16, 16, 1, 10]
    - [110, 0.2048]
  - - [2, 2, 1, 12]
    - [76, 0.004]
  - - [4, 2, 1, 12]
    - [136, 0.008]
  - - [6, 2, 1, 12]
    - [22, 0.01152]
  - - [8, 2, 1, 12]
    - [115, 0.0166957]
  - - [10, 2, 1, 12]
    - [109, 0.02]
  - - [12, 2, 1, 12]
    - [90, 0.024]
  - - [14, 2, 1, 12]
    - [133, 0.028]
  - - [16, 2, 1, 12]
    - [115, 0.032]
  - - [2, 4, 1, 12]
    - [72, 0.00768]
  - - [4, 4, 1, 12]
    - [71, 0.016]
  - - [6, 4, 1, 12]
    - [109, 0.0250435]
  - - [8, 4, 1, 12]
    - [115, 0.032]
  - - [10, 4, 1, 12]
    - [88, 0.04]
  - - [12, 4, 1, 12]
    - [121, 0.04608]
  - - [14, 4, 1, 12]
    - [109, 0.056]
  - - [16, 4, 1, 12]
    - [118, 0.064]
  - - [2, 6, 1, 12]
    - [122, 0.012]
  - - [4, 6, 1, 12]
    - [121, 0.024]
  - - [6, 6, 1, 12]
    - [129, 0.0375652]
  - - [8, 6, 1, 12]
    - [127, 0.048]
  - - [10, 6, 1, 12]
    - [119, 0.06]
  - - [12, 6, 1, 12]
    - [88, 0.072]
  - - [14, 6, 1, 12]
    - [76, 0.084]
  - - [16, 6, 1, 12]
    - [117, 0.096]
  - - [2, 8, 1, 12]
    - [88, 0.016]
  - - [4, 8, 1, 12]
    - [15, 0.03072]
  - - [6, 8, 1, 12]
    - [128, 0.048]
  - - [8, 8, 1, 12]
    - [24, 0.06144]
  - - [10, 8, 1, 12]
    - [113, 0.0768]
  - - [12, 8, 1, 12]
    - [88, 0.0886154]
  - - [14, 8, 1, 12]
    - [109, 0.112]
  - - [16, 8, 1, 12]
    - [91, 0.128]
  - - [2, 10, 1, 12]
    - [21, 0.02]
  - - [4, 10, 1, 12]
    - [22, 0.04]
  - - [6, 10, 1, 12]
    - [21, 0.0576]
  - - [8, 10, 1, 12]
    - [71, 0.08]
  - - [10, 10, 1, 12]
    - [113, 0.104348]
  - - [12, 10, 1, 12]
    - [124, 0.1152]
  - - [14, 10, 1, 12]
    - [15, 0.1344]
  - - [16, 10, 1, 12]
    - [22, 0.1536]
  - - [2, 12, 1, 12]
    - [113, 0.024]
  - - [4, 12, 1, 12]
    - [119, 0.048]
  - - [6, 12, 1, 12]
    - [114, 0.06912]
  - - [8, 12, 1, 12]
    - [128, 0.09216]
  - - [10, 12, 1, 12]
    - [62, 0.1152]
  - - [12, 12, 1, 12]
    - [117, 0.144]
  - - [14, 12, 1, 12]
    - [128, 0.16128]
  - - [16, 12, 1, 12]
    - [113, 0.192]
  - - [2, 14, 1, 12]
    - [118, 0.0258462]
  - - [4, 14, 1, 12]
    - [115, 0.056]
  - - [6, 14, 1, 12]
    - [48, 0.08064]
  - - [8, 14, 1, 12]
    - [71, 0.10752]
  - - [10, 14, 1, 12]
    - [110, 0.1344]
  - - [12, 14, 1, 12]
    - [46, 0.16128]
  - - [14, 14, 1, 12]
    - [109, 0.204522]
  - - [16, 14, 1, 12]
    - [117, 0.21504]
  - - [2, 16, 1, 12]
    - [88, 0.032]
  - - [4, 16, 1, 12]
    - [110, 0.064]
  - - [6, 16, 1, 12]
    - [62, 0.096]
  - - [8, 16, 1, 12]
    - [62, 0.12288]
  - - [10, 16, 1, 12]
    - [17, 0.1536]
  - - [12, 16, 1, 12]
    - [15, 0.177231]
  - - [14, 16, 1, 12]
    - [21, 0.224]
  - - [16, 16, 1, 12]
    - [15, 0.24576]
  - - [2, 2, 1, 14]
    - [15, 0.00448]
  - - [4, 2, 1, 14]
    - [114, 0.00896]
  - - [6, 2, 1, 14]
    - [62, 0.01344]
  - - [8, 2, 1, 14]
    - [109, 0.0186667]
  - - [10, 2, 1, 14]
    - [128, 0.0224]
  - - [12, 2, 1, 14]
    - [136, 0.028]
  - - [14, 2, 1, 14]
    - [128, 0.0326667]
  - - [16, 2, 1, 14]
    - [15, 0.03584]
  - - [2, 4, 1, 14]
    - [113, 0.00933333]
  - - [4, 4, 1, 14]
    - [109, 0.01792]
  - - [6, 4, 1, 14]
    - [26, 0.028]
  - - [8, 4, 1, 14]
    - [15, 0.0344615]
  - - [10, 4, 1, 14]
    - [121, 0.0486957]
  - - [12, 4, 1, 14]
    - [81, 0.0516923]
  - - [14, 4, 1, 14]
    - [122, 0.0681739]
  - - [16, 4, 1, 14]
    - [15, 0.07168]
  - - [2, 6, 1, 14]
    - [111, 0.0146087]
  - - [4, 6, 1, 14]
    - [130, 0.028]
  - - [6, 6, 1, 14]
    - [139, 0.0438261]
  - - [8, 6, 1, 14]
    - [122, 0.056]
  - - [10, 6, 1, 14]
    - [71, 0.07]
  - - [12, 6, 1, 14]
    - [72, 0.08064]
  - - [14, 6, 1, 14]
    - [111, 0.098]
  - - [16, 6, 1, 14]
    - [121, 0.112]
  - - [2, 8, 1, 14]
    - [117, 0.0186667]
  - - [4, 8, 1, 14]
    - [71, 0.0373333]
  - - [6, 8, 1, 14]
    - [117, 0.056]
  - - [8, 8, 1, 14]
    - [136, 0.0746667]
  - - [10, 8, 1, 14]
    - [118, 0.0933333]
  - - [12, 8, 1, 14]
    - [122, 0.112]
  - - [14, 8, 1, 14]
    - [72, 0.130667]
  - - [16, 8, 1, 14]
    - [124, 0.149333]
  - - [2, 10, 1, 14]
    - [113, 0.0233333]
  - - [4, 10, 1, 14]
    - [111, 0.0466667]
  - - [6, 10, 1, 14]
    - [121, 0.07]
  - - [8, 10, 1, 14]
    - [109, 0.0933333]
  - - [10, 10, 1, 14]
    - [15, 0.107692]
  - - [12, 10, 1, 14]
    - [123, 0.14]
  - - [14, 10, 1, 14]
    - [127, 0.163333]
  - - [16, 10, 1, 14]
    - [15, 0.1792]
  - - [2, 12, 1, 14]
    - [15, 0.02688]
  - - [4, 12, 1, 14]
    - [88, 0.056]
  - - [6, 12, 1, 14]
    - [88, 0.084]
  - - [8, 12, 1, 14]
    - [48, 0.112]
  - - [10, 12, 1, 14]
    - [115, 0.14]
  - - [12, 12, 1, 14]
    - [15, 0.16128]
  - - [14, 12, 1, 14]
    - [115, 0.196]
  - - [16, 12, 1, 14]
    - [136, 0.21504]
  - - [2, 14, 1, 14]
    - [46, 0.03136]
  - - [4, 14, 1, 14]
    - [122, 0.0653333]
  - - [6, 14, 1, 14]
    - [114, 0.09408]
  - - [8, 14, 1, 14]
    - [119, 0.136348]
  - - [10, 14, 1, 14]
    - [109, 0.163333]
  - - [12, 14, 1, 14]
    - [62, 0.18816]
  - - [14, 14, 1, 14]
    - [114, 0.228667]
  - - [16, 14, 1, 14]
    - [125, 0.261333]
  - - [2, 16, 1, 14]
    - [130, 0.0373333]
  - - [4, 16, 1, 14]
    - [113, 0.0746667]
  - - [6, 16, 1, 14]
    - [116, 0.112]
  - - [8, 16, 1, 14]
    - [111, 0.14336]
  - - [10, 16, 1, 14]
    - [129, 0.1792]
  - - [12, 16, 1, 14]
    - [109, 0.233739]
  - - [14, 16, 1, 14]
    - [115, 0.25088]
  - - [16, 16, 1, 14]
    - [15, 0.28672]
  - - [2, 2, 1, 16]
    - [27, 0.00533333]
  - - [4, 2, 1, 16]
    - [122, 0.0111304]
  - - [6, 2, 1, 16]
    - [139, 0.016]
  - - [8, 2, 1, 16]
    - [117, 0.02048]
  - - [10, 2, 1, 16]
    - [122, 0.0266667]
  - - [12, 2, 1, 16]
    - [46, 0.03072]
  - - [14, 2, 1, 16]
    - [125, 0.0373333]
  - - [16, 2, 1, 16]
    - [109, 0.0426667]
  - - [2, 4, 1, 16]
    - [15, 0.01024]
  - - [4, 4, 1, 16]
    - [62, 0.0222609]
  - - [6, 4, 1, 16]
    - [116, 0.032]
  - - [8, 4, 1, 16]
    - [122, 0.0426667]
  - - [10, 4, 1, 16]
    - [75, 0.0512]
  - - [12, 4, 1, 16]
    - [22, 0.064]
  - - [14, 4, 1, 16]
    - [114, 0.0746667]
  - - [16, 4, 1, 16]
    - [121, 0.0853333]
  - - [2, 6, 1, 16]
    - [88, 0.016]
  - - [4, 6, 1, 16]
    - [126, 0.0333913]
  - - [6, 6, 1, 16]
    - [135, 0.048]
  - - [8, 6, 1, 16]
    - [112, 0.064]
  - - [10, 6, 1, 16]
    - [115, 0.08]
  - - [12, 6, 1, 16]
    - [22, 0.096]
  - - [14, 6, 1, 16]
    - [116, 0.112]
  - - [16, 6, 1, 16]
    - [113, 0.128]
  - - [2, 8, 1, 16]
    - [122, 0.0222609]
  - - [4, 8, 1, 16]
    - [22, 0.0426667]
  - - [6, 8, 1, 16]
    - [15, 0.06144]
  - - [8, 8, 1, 16]
    - [23, 0.0853333]
  - - [10, 8, 1, 16]
    - [129, 0.106667]
  - - [12, 8, 1, 16]
    - [81, 0.12288]
  - - [14, 8, 1, 16]
    - [113, 0.14336]
  - - [16, 8, 1, 16]
    - [15, 0.16384]
  - - [2, 10, 1, 16]
    - [73, 0.0256]
  - - [4, 10, 1, 16]
    - [46, 0.0533333]
  - - [6, 10, 1, 16]
    - [88, 0.0768]
  - - [8, 10, 1, 16]
    - [22, 0.111304]
  - - [10, 10, 1, 16]
    - [15, 0.128]
  - - [12, 10, 1, 16]
    - [109, 0.16]
  - - [14, 10, 1, 16]
    - [129, 0.186667]
  - - [16, 10, 1, 16]
    - [111, 0.213333]
  - - [2, 12, 1, 16]
    - [46, 0.03072]
  - - [4, 12, 1, 16]
    - [122, 0.064]
  - - [6, 12, 1, 16]
    - [139, 0.096]
  - - [8, 12, 1, 16]
    - [110, 0.128]
  - - [10, 12, 1, 16]
    - [72, 0.1536]
  - - [12, 12, 1, 16]
    - [109, 0.192]
  - - [14, 12, 1, 16]
    - [24, 0.206769]
  - - [16, 12, 1, 16]
    - [71, 0.256]
  - - [2, 14, 1, 16]
    - [72, 0.0373333]
  - - [4, 14, 1, 16]
    - [111, 0.0746667]
  - - [6, 14, 1, 16]
    - [118, 0.112]
  - - [8, 14, 1, 16]
    - [73, 0.149333]
  - - [10, 14, 1, 16]
    - [126, 0.1792]
  - - [12, 14, 1, 16]
    - [114, 0.224]
  - - [14, 14, 1, 16]
    - [122, 0.261333]
  - - [16, 14, 1, 16]
    - [129, 0.28672]
  - - [2, 16, 1, 16]
    - [111, 0.04096]
  - - [4, 16, 1, 16]
    - [114, 0.0853333]
  - - [6, 16, 1, 16]
    - [121, 0.133565]
  - - [8, 16, 1, 16]
    - [118, 0.170667]
  - - [10, 16, 1, 16]
    - [123, 0.213333]
  - - [12, 16, 1, 16]
    - [128, 0.236308]
  - - [14, 16, 1, 16]
    - [71, 0.298667]
  - - [16, 16, 1, 16]
    - [117, 0.315077]
  - - [2, 2, 1, 1024]
    - [88, 0.303407]
  - - [4, 2, 1, 1024]
    - [103, 0.606815]
  - - [6, 2, 1, 1024]
    - [116, 0.910222]
  - - [8, 2, 1, 1024]
    - [123, 1.21363]
  - - [10, 2, 1, 1024]
    - [71, 1.51704]
  - - [12, 2, 1, 1024]
    - [112, 1.82044]
  - - [14, 2, 1, 1024]
    - [72, 2.12385]
  - - [16, 2, 1, 1024]
    - [130, 2.52062]
  - - [2, 4, 1, 1024]
    - [112, 0.606815]
  - - [4, 4, 1, 1024]
    - [103, 1.21363]
  - - [6, 4, 1, 1024]
    - [71, 1.82044]
  - - [8, 4, 1, 1024]
    - [112, 2.25986]
  - - [10, 4, 1, 1024]
    - [122, 3.15077]
  - - [12, 4, 1, 1024]
    - [23, 3.64089]
  - - [14, 4, 1, 1024]
    - [123, 4.41108]
  - - [16, 4, 1, 1024]
    - [112, 4.85452]
  - - [2, 6, 1, 1024]
    - [120, 0.910222]
  - - [4, 6, 1, 1024]
    - [71, 1.75543]
  - - [6, 6, 1, 1024]
    - [119, 2.83569]
  - - [8, 6, 1, 1024]
    - [123, 3.78092]
  - - [10, 6, 1, 1024]
    - [116, 4.55111]
  - - [12, 6, 1, 1024]
    - [123, 5.67138]
  - - [14, 6, 1, 1024]
    - [72, 6.144]
  - - [16, 6, 1, 1024]
    - [112, 7.28178]
  - - [2, 8, 1, 1024]
    - [81, 1.21363]
  - - [4, 8, 1, 1024]
    - [118, 2.52062]
  - - [6, 8, 1, 1024]
    - [114, 3.64089]
  - - [8, 8, 1, 1024]
    - [103, 4.85452]
  - - [10, 8, 1, 1024]
    - [129, 6.06815]
  - - [12, 8, 1, 1024]
    - [116, 7.28178]
  - - [14, 8, 1, 1024]
    - [72, 8.49541]
  - - [16, 8, 1, 1024]
    - [123, 10.0825]
  - - [2, 10, 1, 1024]
    - [112, 1.51704]
  - - [4, 10, 1, 1024]
    - [72, 3.03407]
  - - [6, 10, 1, 1024]
    - [112, 4.55111]
  - - [8, 10, 1, 1024]
    - [116, 6.06815]
  - - [10, 10, 1, 1024]
    - [71, 7.58519]
  - - [12, 10, 1, 1024]
    - [71, 9.10222]
  - - [14, 10, 1, 1024]
    - [112, 10.6193]
  - - [16, 10, 1, 1024]
    - [119, 12.1363]
  - - [2, 12, 1, 1024]
    - [88, 1.89046]
  - - [4, 12, 1, 1024]
    - [88, 3.64089]
  - - [6, 12, 1, 1024]
    - [81, 5.46133]
  - - [8, 12, 1, 1024]
    - [71, 7.28178]
  - - [10, 12, 1, 1024]
    - [23, 9.10222]
  - - [12, 12, 1, 1024]
    - [123, 10.9227]
  - - [14, 12, 1, 1024]
    - [71, 12.7431]
  - - [16, 12, 1, 1024]
    - [76, 14.5636]
  - - [2, 14, 1, 1024]
    - [129, 2.20554]
  - - [4, 14, 1, 1024]
    - [118, 4.41108]
  - - [6, 14, 1, 1024]
    - [88, 6.37156]
  - - [8, 14, 1, 1024]
    - [112, 8.49541]
  - - [10, 14, 1, 1024]
    - [116, 10.6193]
  - - [12, 14, 1, 1024]
    - [71, 12.7431]
  - - [14, 14, 1, 1024]
    - [88, 14.867]
  - - [16, 14, 1, 1024]
    - [116, 17.6443]
  - - [2, 16, 1, 1024]
    - [124, 2.52062]
  - - [4, 16, 1, 1024]
    - [120, 5.04123]
  - - [6, 16, 1, 1024]
    - [71, 7.56185]
  - - [8, 16, 1, 1024]
    - [81, 9.70904]
  - - [10, 16, 1, 1024]
    - [71, 12.1363]
  - - [12, 16, 1, 1024]
    - [122, 14.5636]
  - - [14, 16, 1, 1024]
    - [118, 16.9908]
  - - [16, 16, 1, 1024]
    - [22, 18.7246]
  - - [2, 2, 1, 2048]
    - [71, 0.564966]
  - - [4, 2, 1, 2048]
    - [116, 1.12993]
  - - [6, 2, 1, 2048]
    - [118, 1.6949]
  - - [8, 2, 1, 2048]
    - [112, 2.25986]
  - - [10, 2, 1, 2048]
    - [88, 2.82483]
  - - [12, 2, 1, 2048]
    - [116, 3.38979]
  - - [14, 2, 1, 2048]
    - [118, 4.096]
  - - [16, 2, 1, 2048]
    - [112, 4.51972]
  - - [2, 4, 1, 2048]
    - [118, 1.12993]
  - - [4, 4, 1, 2048]
    - [71, 2.25986]
  - - [6, 4, 1, 2048]
    - [112, 3.2768]
  - - [8, 4, 1, 2048]
    - [71, 4.68114]
  - - [10, 4, 1, 2048]
    - [116, 5.64966]
  - - [12, 4, 1, 2048]
    - [71, 6.5536]
  - - [14, 4, 1, 2048]
    - [71, 7.90952]
  - - [16, 4, 1, 2048]
    - [118, 9.36229]
  - - [2, 6, 1, 2048]
    - [112, 1.75543]
  - - [4, 6, 1, 2048]
    - [71, 3.2768]
  - - [6, 6, 1, 2048]
    - [71, 5.08469]
  - - [8, 6, 1, 2048]
    - [123, 6.77959]
  - - [10, 6, 1, 2048]
    - [112, 9.10222]
  - - [12, 6, 1, 2048]
    - [118, 10.5326]
  - - [14, 6, 1, 2048]
    - [112, 12.288]
  - - [16, 6, 1, 2048]
    - [103, 13.5592]
  - - [2, 8, 1, 2048]
    - [116, 2.42726]
  - - [4, 8, 1, 2048]
    - [118, 4.51972]
  - - [6, 8, 1, 2048]
    - [116, 7.02171]
  - - [8, 8, 1, 2048]
    - [23, 8.73813]
  - - [10, 8, 1, 2048]
    - [123, 11.2993]
  - - [12, 8, 1, 2048]
    - [88, 13.5592]
  - - [14, 8, 1, 2048]
    - [71, 15.2917]
  - - [16, 8, 1, 2048]
    - [116, 18.0789]
  - - [2, 10, 1, 2048]
    - [116, 2.92571]
  - - [4, 10, 1, 2048]
    - [71, 5.64966]
  - - [6, 10, 1, 2048]
    - [118, 8.77714]
  - - [8, 10, 1, 2048]
    - [116, 11.2993]
  - - [10, 10, 1, 2048]
    - [71, 14.1241]
  - - [12, 10, 1, 2048]
    - [118, 16.949]
  - - [14, 10, 1, 2048]
    - [123, 20.48]
  - - [16, 10, 1, 2048]
    - [71, 22.5986]
  - - [2, 12, 1, 2048]
    - [118, 3.38979]
  - - [4, 12, 1, 2048]
    - [71, 6.77959]
  - - [6, 12, 1, 2048]
    - [123, 10.1694]
  - - [8, 12, 1, 2048]
    - [124, 14.0434]
  - - [10, 12, 1, 2048]
    - [123, 17.5543]
  - - [12, 12, 1, 2048]
    - [118, 20.3388]
  - - [14, 12, 1, 2048]
    - [118, 23.7286]
  - - [16, 12, 1, 2048]
    - [123, 27.1183]
  - - [2, 14, 1, 2048]
    - [118, 3.95476]
  - - [4, 14, 1, 2048]
    - [116, 8.192]
  - - [6, 14, 1, 2048]
    - [112, 11.4688]
  - - [8, 14, 1, 2048]
    - [23, 15.819]
  - - [10, 14, 1, 2048]
    - [118, 19.7738]
  - - [12, 14, 1, 2048]
    - [123, 24.576]
  - - [14, 14, 1, 2048]
    - [112, 27.6833]
  - - [16, 14, 1, 2048]
    - [88, 30.5835]
  - - [2, 16, 1, 2048]
    - [123, 4.68114]
  - - [4, 16, 1, 2048]
    - [118, 9.03945]
  - - [6, 16, 1, 2048]
    - [71, 13.5592]
  - - [8, 16, 1, 2048]
    - [81, 18.0789]
  - - [10, 16, 1, 2048]
    - [112, 22.5986]
  - - [12, 16, 1, 2048]
    - [71, 29.1271]
  - - [14, 16, 1, 2048]
    - [112, 31.6381]
  - - [16, 16, 1, 2048]
    - [116, 36.1578]
  - - [2, 2, 1, 4096]
    - [116, 1.024]
  - - [4, 2, 1, 4096]
    - [123, 1.98594]
  - - [6, 2, 1, 4096]
    - [112, 2.89129]
  - - [8, 2, 1, 4096]
    - [71, 4.096]
  - - [10, 2, 1, 4096]
    - [71, 4.96485]
  - - [12, 2, 1, 4096]
    - [71, 5.95782]
  - - [14, 2, 1, 4096]
    - [112, 6.95079]
  - - [16, 2, 1, 4096]
    - [71, 7.94376]
  - - [2, 4, 1, 4096]
    - [123, 1.98594]
  - - [4, 4, 1, 4096]
    - [123, 4.096]
  - - [6, 4, 1, 4096]
    - [71, 6.144]
  - - [8, 4, 1, 4096]
    - [71, 7.71012]
  - - [10, 4, 1, 4096]
    - [123, 10.24]
  - - [12, 4, 1, 4096]
    - [123, 11.9156]
  - - [14, 4, 1, 4096]
    - [71, 13.9016]
  - - [16, 4, 1, 4096]
    - [71, 15.8875]
  - - [2, 6, 1, 4096]
    - [71, 3.072]
  - - [4, 6, 1, 4096]
    - [71, 6.144]
  - - [6, 6, 1, 4096]
    - [71, 9.51329]
  - - [8, 6, 1, 4096]
    - [112, 11.9156]
  - - [10, 6, 1, 4096]
    - [71, 14.8945]
  - - [12, 6, 1, 4096]
    - [71, 18.432]
  - - [14, 6, 1, 4096]
    - [112, 20.8524]
  - - [16, 6, 1, 4096]
    - [71, 23.8313]
  - - [2, 8, 1, 4096]
    - [123, 4.096]
  - - [4, 8, 1, 4096]
    - [71, 8.192]
  - - [6, 8, 1, 4096]
    - [71, 11.5652]
  - - [8, 8, 1, 4096]
    - [71, 15.8875]
  - - [10, 8, 1, 4096]
    - [112, 19.8594]
  - - [12, 8, 1, 4096]
    - [71, 23.8313]
  - - [14, 8, 1, 4096]
    - [71, 27.8032]
  - - [16, 8, 1, 4096]
    - [71, 31.775]
  - - [2, 10, 1, 4096]
    - [71, 4.96485]
  - - [4, 10, 1, 4096]
    - [116, 9.9297]
  - - [6, 10, 1, 4096]
    - [112, 14.8945]
  - - [8, 10, 1, 4096]
    - [112, 20.48]
  - - [10, 10, 1, 4096]
    - [71, 24.8242]
  - - [12, 10, 1, 4096]
    - [123, 29.7891]
  - - [14, 10, 1, 4096]
    - [112, 34.7539]
  - - [16, 10, 1, 4096]
    - [123, 39.7188]
  - - [2, 12, 1, 4096]
    - [71, 5.95782]
  - - [4, 12, 1, 4096]
    - [123, 11.9156]
  - - [6, 12, 1, 4096]
    - [112, 17.8735]
  - - [8, 12, 1, 4096]
    - [71, 23.8313]
  - - [10, 12, 1, 4096]
    - [123, 30.72]
  - - [12, 12, 1, 4096]
    - [112, 34.6955]
  - - [14, 12, 1, 4096]
    - [112, 41.7047]
  - - [16, 12, 1, 4096]
    - [112, 44.939]
  - - [2, 14, 1, 4096]
    - [71, 6.95079]
  - - [4, 14, 1, 4096]
    - [123, 14.336]
  - - [6, 14, 1, 4096]
    - [71, 20.8524]
  - - [8, 14, 1, 4096]
    - [123, 27.8032]
  - - [10, 14, 1, 4096]
    - [123, 34.7539]
  - - [12, 14, 1, 4096]
    - [112, 41.7047]
  - - [14, 14, 1, 4096]
    - [112, 47.2245]
  - - [16, 14, 1, 4096]
    - [71, 55.6063]
  - - [2, 16, 1, 4096]
    - [71, 7.94376]
  - - [4, 16, 1, 4096]
    - [71, 15.8875]
  - - [6, 16, 1, 4096]
    - [71, 24.576]
  - - [8, 16, 1, 4096]
    - [112, 31.775]
  - - [10, 16, 1, 4096]
    - [123, 40.96]
  - - [12, 16, 1, 4096]
    - [71, 47.6625]
  - - [14, 16, 1, 4096]
    - [112, 55.6063]
  - - [16, 16, 1, 4096]
    - [118, 65.536]
  - - [64, 4096, 1, 64]
    - [76, 1342.18]
  - - [320, 4096, 1, 64]
    - [42, 5592.41]
  - - [64, 4096, 1, 256]
    - [46, 5162.22]
  - - [4096, 64, 1, 64]
    - [25, 1290.56]
  - - [4096, 320, 1, 64]
    - [51, 5592.41]
  - - [4096, 64, 1, 256]
    - [132, 5162.22]
  - - [64, 64, 1, 8192]
    - [71, 1766.02]
  - - [64, 128, 1, 8192]
    - [71, 3355.44]
  - - [64, 8192, 1, 64]
    - [89, 2485.51]
  - - [64, 8192, 1, 128]
    - [89, 5162.22]
  - - [128, 64, 1, 8192]
    - [123, 3355.44]
  - - [128, 8192, 1, 64]
    - [67, 4971.03]
  - - [8192, 64, 1, 64]
    - [84, 2581.11]
  - - [8192, 64, 1, 128]
    - [63, 4793.49]
  - - [8192, 128, 1, 64]
    - [104, 4628.2]
  - - [64, 1, 1, 64]
    - [22, 0.32768]
  - - [64, 16, 1, 64]
    - [133, 5.69878]
  - - [64, 32, 1, 64]
    - [128, 10.9227]
  - - [1, 1, 1, 64]
    - [24, 0.00492308]
  - - [16, 1, 1, 64]
    - [126, 0.0853333]
  - - [32, 1, 1, 64]
    - [113, 0.170667]
  - - [64, 1, 1, 1]
    - [71, 0.00533333]
  - - [64, 1, 1, 16]
    - [22, 0.0853333]
  - - [64, 1, 1, 32]
    - [127, 0.170667]
  - - [1, 16, 1, 64]
    - [109, 0.0853333]
  - - [16, 16, 1, 64]
    - [109, 1.31072]
  - - [32, 16, 1, 64]
    - [112, 2.62144]
  - - [64, 16, 1, 1]
    - [71, 0.0853333]
  - - [64, 16, 1, 16]
    - [120, 1.36533]
  - - [64, 16, 1, 32]
    - [115, 2.62144]
  - - [1, 32, 1, 64]
    - [114, 0.16384]
  - - [16, 32, 1, 64]
    - [129, 2.73067]
  - - [32, 32, 1, 64]
    - [122, 5.46133]
  - - [64, 32, 1, 1]
    - [133, 0.170667]
  - - [64, 32, 1, 16]
    - [116, 2.73067]
  - - [64, 32, 1, 32]
    - [109, 5.46133]
  - - [1, 1, 1, 1]
    - [119, 8.33333e-05]
  - - [1, 1, 1, 16]
    - [133, 0.0013913]
  - - [1, 1, 1, 32]
    - [133, 0.00266667]
  - - [16, 1, 1, 1]
    - [62, 0.00128]
  - - [16, 1, 1, 16]
    - [115, 0.0213333]
  - - [16, 1, 1, 32]
    - [114, 0.0426667]
  - - [32, 1, 1, 1]
    - [72, 0.00256]
  - - [32, 1, 1, 16]
    - [46, 0.04096]
  - - [32, 1, 1, 32]
    - [115, 0.0853333]
  - - [1, 16, 1, 1]
    - [114, 0.00128]
  - - [1, 16, 1, 16]
    - [30, 0.0196923]
  - - [1, 16, 1, 32]
    - [122, 0.0426667]
  - - [16, 16, 1, 1]
    - [113, 0.0213333]
  - - [16, 16, 1, 16]
    - [73, 0.341333]
  - - [16, 16, 1, 32]
    - [122, 0.65536]
  - - [32, 16, 1, 1]
    - [109, 0.0426667]
  - - [32, 16, 1, 16]
    - [88, 0.65536]
  - - [32, 16, 1, 32]
    - [117, 1.36533]
  - - [1, 32, 1, 1]
    - [125, 0.00256]
  - - [1, 32, 1, 16]
    - [71, 0.0393846]
  - - [1, 32, 1, 32]
    - [117, 0.0853333]
  - - [16, 32, 1, 1]
    - [120, 0.0426667]
  - - [16, 32, 1, 16]
    - [72, 0.630154]
  - - [16, 32, 1, 32]
    - [117, 1.36533]
  - - [32, 32, 1, 1]
    - [112, 0.08192]
  - - [32, 32, 1, 16]
    - [15, 1.26031]
  - - [32, 32, 1, 32]
    - [121, 2.84939]
  - - [1, 64, 1, 64]
    - [109, 0.356174]
  - - [16, 64, 1, 64]
    - [113, 5.46133]
  - - [32, 64, 1, 64]
    - [122, 10.9227]
  - - [1, 64, 1, 1]
    - [15, 0.00512]
  - - [1, 64, 1, 16]
    - [109, 0.0853333]
  - - [1, 64, 1, 32]
    - [128, 0.170667]
  - - [16, 64, 1, 1]
    - [109, 0.0787692]
  - - [16, 64, 1, 16]
    - [128, 1.31072]
  - - [16, 64, 1, 32]
    - [73, 2.73067]
  - - [32, 64, 1, 1]
    - [114, 0.170667]
  - - [32, 64, 1, 16]
    - [128, 2.62144]
  - - [32, 64, 1, 32]
    - [121, 5.46133]
  - - [64, 64, 1, 1]
    - [123, 0.32768]
  - - [64, 64, 1, 16]
    - [16, 5.46133]
  - - [64, 64, 1, 32]
    - [122, 10.9227]
  - - [256, 1, 1, 256]
    - [128, 5.04123]
  - - [256, 16, 1, 256]
    - [115, 87.3813]
  - - [256, 32, 1, 256]
    - [110, 167.772]
  - - [1, 1, 1, 256]
    - [128, 0.02048]
  - - [16, 1, 1, 256]
    - [124, 0.32768]
  - - [32, 1, 1, 256]
    - [136, 0.65536]
  - - [256, 1, 1, 1]
    - [111, 0.0213333]
  - - [256, 1, 1, 16]
    - [22, 0.315077]
  - - [256, 1, 1, 32]
    - [125, 0.712348]
  - - [1, 16, 1, 256]
    - [116, 0.32768]
  - - [16, 16, 1, 256]
    - [122, 5.46133]
  - - [32, 16, 1, 256]
    - [81, 10.9227]
  - - [256, 16, 1, 1]
    - [119, 0.341333]
  - - [256, 16, 1, 16]
    - [115, 5.46133]
  - - [256, 16, 1, 32]
    - [15, 10.4858]
  - - [1, 32, 1, 256]
    - [73, 0.630154]
  - - [16, 32, 1, 256]
    - [111, 10.9227]
  - - [32, 32, 1, 256]
    - [88, 21.8453]
  - - [256, 32, 1, 1]
    - [110, 0.682667]
  - - [256, 32, 1, 16]
    - [103, 10.4858]
  - - [256, 32, 1, 32]
    - [62, 21.8453]
  - - [1, 256, 1, 256]
    - [120, 5.24288]
  - - [16, 256, 1, 256]
    - [71, 87.3813]
  - - [32, 256, 1, 256]
    - [114, 174.763]
  - - [1, 256, 1, 1]
    - [128, 0.0213333]
  - - [1, 256, 1, 16]
    - [111, 0.315077]
  - - [1, 256, 1, 32]
    - [113, 0.682667]
  - - [16, 256, 1, 1]
    - [125, 0.341333]
  - - [16, 256, 1, 16]
    - [111, 5.04123]
  - - [16, 256, 1, 32]
    - [115, 10.9227]
  - - [32, 256, 1, 1]
    - [15, 0.65536]
  - - [32, 256, 1, 16]
    - [128, 10.4858]
  - - [32, 256, 1, 32]
    - [115, 21.8453]
  - - [256, 256, 1, 1]
    - [120, 5.46133]
  - - [256, 256, 1, 16]
    - [24, 91.1805]
  - - [256, 256, 1, 32]
    - [81, 167.772]
  - - [512, 1, 1, 512]
    - [71, 20.9715]
  - - [512, 16, 1, 512]
    - [22, 322.639]
  - - [512, 32, 1, 512]
    - [103, 645.278]
  - - [1, 1, 1, 512]
    - [116, 0.04096]
  - - [16, 1, 1, 512]
    - [116, 0.65536]
  - - [32, 1, 1, 512]
    - [73, 1.26031]
  - - [512, 1, 1, 1]
    - [111, 0.0426667]
  - - [512, 1, 1, 16]
    - [124, 0.712348]
  - - [512, 1, 1, 32]
    - [130, 1.36533]
  - - [1, 16, 1, 512]
    - [112, 0.65536]
  - - [16, 16, 1, 512]
    - [71, 10.4858]
  - - [32, 16, 1, 512]
    - [136, 20.9715]
  - - [512, 16, 1, 1]
    - [71, 0.682667]
  - - [512, 16, 1, 16]
    - [135, 10.9227]
  - - [512, 16, 1, 32]
    - [113, 20.9715]
  - - [1, 32, 1, 512]
    - [88, 1.31072]
  - - [16, 32, 1, 512]
    - [116, 20.9715]
  - - [32, 32, 1, 512]
    - [22, 41.943]
  - - [512, 32, 1, 1]
    - [120, 1.36533]
  - - [512, 32, 1, 16]
    - [46, 20.9715]
  - - [512, 32, 1, 32]
    - [115, 43.6907]
  - - [1, 512, 1, 512]
    - [120, 20.9715]
  - - [16, 512, 1, 512]
    - [124, 349.525]
  - - [32, 512, 1, 512]
    - [71, 671.089]
  - - [1, 512, 1, 1]
    - [64, 0.04096]
  - - [1, 512, 1, 16]
    - [15, 0.65536]
  - - [1, 512, 1, 32]
    - [121, 1.36533]
  - - [16, 512, 1, 1]
    - [71, 0.65536]
  - - [16, 512, 1, 16]
    - [110, 10.4858]
  - - [16, 512, 1, 32]
    - [115, 21.8453]
  - - [32, 512, 1, 1]
    - [15, 1.31072]
  - - [32, 512, 1, 16]
    - [116, 21.8453]
  - - [32, 512, 1, 32]
    - [113, 43.6907]
  - - [512, 512, 1, 1]
    - [135, 20.9715]
  - - [512, 512, 1, 16]
    - [137, 335.544]
  - - [512, 512, 1, 32]
    - [84, 671.089]
  - - [1024, 1, 1, 1024]
    - [118, 72.3156]
  - - [1024, 16, 1, 1024]
    - [112, 1198.37]
  - - [1024, 32, 1, 1024]
    - [103, 2314.1]
  - - [1, 1, 1, 1024]
    - [88, 0.0787692]
  - - [16, 1, 1, 1024]
    - [23, 1.21363]
  - - [32, 1, 1, 1024]
    - [118, 2.42726]
  - - [1024, 1, 1, 1]
    - [113, 0.08192]
  - - [1024, 1, 1, 16]
    - [15, 1.26031]
  - - [1024, 1, 1, 32]
    - [136, 2.73067]
  - - [1, 16, 1, 1024]
    - [116, 1.26031]
  - - [16, 16, 1, 1024]
    - [116, 20.1649]
  - - [32, 16, 1, 1024]
    - [81, 37.4491]
  - - [1024, 16, 1, 1]
    - [114, 1.4247]
  - - [1024, 16, 1, 16]
    - [123, 20.9715]
  - - [1024, 16, 1, 32]
    - [15, 41.943]
  - - [1, 32, 1, 1024]
    - [124, 2.52062]
  - - [16, 32, 1, 1024]
    - [71, 38.8361]
  - - [32, 32, 1, 1024]
    - [118, 77.6723]
  - - [1024, 32, 1, 1]
    - [116, 2.73067]
  - - [1024, 32, 1, 16]
    - [113, 41.943]
  - - [1024, 32, 1, 32]
    - [120, 87.3813]
  - - [1, 1024, 1, 1024]
    - [120, 80.6597]
  - - [16, 1024, 1, 1024]
    - [103, 1242.76]
  - - [32, 1024, 1, 1024]
    - [123, 2581.11]
  - - [1, 1024, 1, 1]
    - [116, 0.0853333]
  - - [1, 1024, 1, 16]
    - [121, 1.31072]
  - - [1, 1024, 1, 32]
    - [109, 2.73067]
  - - [16, 1024, 1, 1]
    - [109, 1.36533]
  - - [16, 1024, 1, 16]
    - [71, 20.9715]
  - - [16, 1024, 1, 32]
    - [121, 45.5903]
  - - [32, 1024, 1, 1]
    - [122, 2.73067]
  - - [32, 1024, 1, 16]
    - [22, 40.3298]
  - - [32, 1024, 1, 32]
    - [121, 83.8861]
  - - [1024, 1024, 1, 1]
    - [137, 72.3156]
  - - [1024, 1024, 1, 16]
    - [32, 1157.05]
  - - [1024, 1024, 1, 32]
    - [36, 2314.1]
  - - [2048, 1, 1, 2048]
    - [118, 299.593]
  - - [2048, 16, 1, 2048]
    - [119, 4793.49]
  - - [1, 1, 1, 2048]
    - [112, 0.146286]
  - - [16, 1, 1, 2048]
    - [71, 2.25986]
  - - [32, 1, 1, 2048]
    - [116, 4.51972]
  - - [2048, 1, 1, 1]
    - [130, 0.170667]
  - - [2048, 1, 1, 16]
    - [133, 2.84939]
  - - [2048, 1, 1, 32]
    - [126, 5.69878]
  - - [1, 16, 1, 2048]
    - [123, 2.25986]
  - - [16, 16, 1, 2048]
    - [23, 34.9525]
  - - [32, 16, 1, 2048]
    - [112, 72.3156]
  - - [2048, 16, 1, 1]
    - [113, 2.73067]
  - - [2048, 16, 1, 16]
    - [125, 43.6907]
  - - [2048, 16, 1, 32]
    - [110, 87.3813]
  - - [1, 32, 1, 2048]
    - [112, 4.36907]
  - - [16, 32, 1, 2048]
    - [116, 74.8983]
  - - [32, 32, 1, 2048]
    - [116, 144.631]
  - - [2048, 32, 1, 1]
    - [103, 5.46133]
  - - [2048, 32, 1, 16]
    - [15, 83.8861]
  - - [2048, 32, 1, 32]
    - [15, 167.772]
  - - [1, 2048, 1, 2048]
    - [114, 310.689]
  - - [16, 2048, 1, 2048]
    - [114, 4971.03]
  - - [1, 2048, 1, 1]
    - [109, 0.16384]
  - - [1, 2048, 1, 16]
    - [103, 2.73067]
  - - [1, 2048, 1, 32]
    - [130, 5.46133]
  - - [16, 2048, 1, 1]
    - [15, 2.52062]
  - - [16, 2048, 1, 16]
    - [116, 43.6907]
  - - [16, 2048, 1, 32]
    - [130, 83.8861]
  - - [32, 2048, 1, 1]
    - [117, 5.46133]
  - - [32, 2048, 1, 16]
    - [111, 87.3813]
  - - [32, 2048, 1, 32]
    - [109, 174.763]
  - - [2048, 2048, 1, 1]
    - [59, 262.144]
  - - [2048, 2048, 1, 16]
    - [42, 4194.3]
  - - [3072, 1, 1, 3072]
    - [112, 555.128]
  - - [1, 1, 1, 3072]
    - [71, 0.2048]
  - - [16, 1, 1, 3072]
    - [71, 3.1711]
  - - [32, 1, 1, 3072]
    - [71, 6.34219]
  - - [3072, 1, 1, 1]
    - [22, 0.256]
  - - [3072, 1, 1, 16]
    - [110, 4.096]
  - - [3072, 1, 1, 32]
    - [119, 8.192]
  - - [1, 16, 1, 3072]
    - [112, 3.1711]
  - - [16, 16, 1, 3072]
    - [112, 49.152]
  - - [32, 16, 1, 3072]
    - [118, 101.475]
  - - [3072, 16, 1, 1]
    - [74, 4.096]
  - - [3072, 16, 1, 16]
    - [88, 65.536]
  - - [3072, 16, 1, 32]
    - [127, 131.072]
  - - [1, 32, 1, 3072]
    - [116, 6.34219]
  - - [16, 32, 1, 3072]
    - [112, 104.858]
  - - [32, 32, 1, 3072]
    - [112, 196.608]
  - - [3072, 32, 1, 1]
    - [15, 8.192]
  - - [3072, 32, 1, 16]
    - [113, 131.072]
  - - [3072, 32, 1, 32]
    - [124, 262.144]
  - - [1, 3072, 1, 3072]
    - [119, 650.84]
  - - [1, 3072, 1, 1]
    - [122, 0.256]
  - - [1, 3072, 1, 16]
    - [72, 3.93216]
  - - [1, 3072, 1, 32]
    - [15, 7.56185]
  - - [16, 3072, 1, 1]
    - [22, 3.93216]
  - - [16, 3072, 1, 16]
    - [128, 65.536]
  - - [16, 3072, 1, 32]
    - [22, 125.829]
  - - [32, 3072, 1, 1]
    - [126, 7.86432]
  - - [32, 3072, 1, 16]
    - [111, 120.99]
  - - [32, 3072, 1, 32]
    - [46, 241.979]
  - - [3072, 3072, 1, 1]
    - [59, 419.43]
  - - [4096, 1, 1, 4096]
    - [22, 860.37]
  - - [1, 1, 1, 4096]
    - [71, 0.256]
  - - [16, 1, 1, 4096]
    - [112, 3.85506]
  - - [32, 1, 1, 4096]
    - [123, 8.192]
  - - [4096, 1, 1, 1]
    - [15, 0.341333]
  - - [4096, 1, 1, 16]
    - [130, 5.24288]
  - - [4096, 1, 1, 32]
    - [110, 10.9227]
  - - [1, 16, 1, 4096]
    - [71, 3.97188]
  - - [16, 16, 1, 4096]
    - [123, 65.536]
  - - [32, 16, 1, 4096]
    - [123, 135.3]
  - - [4096, 16, 1, 1]
    - [111, 5.46133]
  - - [4096, 16, 1, 16]
    - [111, 80.6597]
  - - [4096, 16, 1, 32]
    - [15, 167.772]
  - - [1, 32, 1, 4096]
    - [71, 7.94376]
  - - [16, 32, 1, 4096]
    - [123, 127.1]
  - - [32, 32, 1, 4096]
    - [116, 254.2]
  - - [4096, 32, 1, 1]
    - [110, 10.4858]
  - - [4096, 32, 1, 16]
    - [22, 174.763]
  - - [4096, 32, 1, 32]
    - [22, 335.544]
  - - [1, 4096, 1, 4096]
    - [117, 932.068]
  - - [1, 4096, 1, 1]
    - [15, 0.32768]
  - - [1, 4096, 1, 16]
    - [27, 5.24288]
  - - [1, 4096, 1, 32]
    - [73, 10.4858]
  - - [16, 4096, 1, 1]
    - [128, 5.46133]
  - - [16, 4096, 1, 16]
    - [135, 91.1805]
  - - [16, 4096, 1, 32]
    - [16, 167.772]
  - - [32, 4096, 1, 1]
    - [113, 10.4858]
  - - [32, 4096, 1, 16]
    - [113, 174.763]
  - - [32, 4096, 1, 32]
    - [133, 335.544]
  - - [4096, 4096, 1, 1]
    - [41, 532.61]
  - - [320, 1, 1, 64]
    - [24, 1.6384]
  - - [320, 16, 1, 64]
    - [119, 27.3067]
  - - [320, 32, 1, 64]
    - [113, 54.6133]
  - - [320, 1, 1, 1]
    - [126, 0.0278261]
  - - [320, 1, 1, 16]
    - [115, 0.426667]
  - - [320, 1, 1, 32]
    - [113, 0.853333]
  - - [320, 16, 1, 1]
    - [109, 0.426667]
  - - [320, 16, 1, 16]
    - [72, 6.82667]
  - - [320, 16, 1, 32]
    - [111, 13.6533]
  - - [320, 32, 1, 1]
    - [126, 0.8192]
  - - [320, 32, 1, 16]
    - [103, 12.6031]
  - - [320, 32, 1, 32]
    - [139, 27.3067]
  - - [320, 64, 1, 1]
    - [111, 1.78087]
  - - [320, 64, 1, 16]
    - [115, 27.3067]
  - - [320, 64, 1, 32]
    - [62, 54.6133]
  - - [576, 1, 1, 64]
    - [118, 3.072]
  - - [576, 16, 1, 64]
    - [113, 49.152]
  - - [576, 32, 1, 64]
    - [113, 98.304]
  - - [576, 1, 1, 1]
    - [139, 0.048]
  - - [576, 1, 1, 16]
    - [72, 0.768]
  - - [576, 1, 1, 32]
    - [114, 1.47456]
  - - [576, 16, 1, 1]
    - [118, 0.73728]
  - - [576, 16, 1, 16]
    - [15, 11.7965]
  - - [576, 16, 1, 32]
    - [112, 24.576]
  - - [576, 32, 1, 1]
    - [123, 1.60278]
  - - [576, 32, 1, 16]
    - [132, 24.576]
  - - [576, 32, 1, 32]
    - [22, 49.152]
  - - [576, 64, 1, 1]
    - [62, 3.072]
  - - [576, 64, 1, 16]
    - [15, 49.152]
  - - [576, 64, 1, 32]
    - [129, 102.578]
  - - [832, 1, 1, 64]
    - [121, 4.43733]
  - - [832, 16, 1, 64]
    - [22, 70.9973]
  - - [832, 32, 1, 64]
    - [114, 141.995]
  - - [832, 1, 1, 1]
    - [21, 0.0693333]
  - - [832, 1, 1, 16]
    - [113, 1.15757]
  - - [832, 1, 1, 32]
    - [73, 2.21867]
  - - [832, 16, 1, 1]
    - [126, 1.10933]
  - - [832, 16, 1, 16]
    - [88, 17.7493]
  - - [832, 16, 1, 32]
    - [109, 35.4987]
  - - [832, 32, 1, 1]
    - [73, 2.31513]
  - - [832, 32, 1, 16]
    - [15, 35.4987]
  - - [832, 32, 1, 32]
    - [15, 68.1574]
  - - [832, 64, 1, 1]
    - [62, 4.43733]
  - - [832, 64, 1, 16]
    - [126, 70.9973]
  - - [832, 64, 1, 32]
    - [123, 136.315]
  - - [1088, 1, 1, 64]
    - [117, 5.80267]
  - - [1088, 16, 1, 64]
    - [125, 92.8427]
  - - [1088, 32, 1, 64]
    - [15, 178.258]
  - - [1088, 1, 1, 1]
    - [109, 0.0946087]
  - - [1088, 1, 1, 16]
    - [139, 1.39264]
  - - [1088, 1, 1, 32]
    - [88, 2.78528]
  - - [1088, 16, 1, 1]
    - [15, 1.33908]
  - - [1088, 16, 1, 16]
    - [73, 21.4252]
  - - [1088, 16, 1, 32]
    - [21, 44.5645]
  - - [1088, 32, 1, 1]
    - [103, 2.90133]
  - - [1088, 32, 1, 16]
    - [15, 44.5645]
  - - [1088, 32, 1, 32]
    - [15, 89.129]
  - - [1088, 64, 1, 1]
    - [71, 5.80267]
  - - [1088, 64, 1, 16]
    - [15, 89.129]
  - - [1088, 64, 1, 32]
    - [133, 185.685]
  - - [1344, 1, 1, 64]
    - [71, 6.88128]
  - - [1344, 16, 1, 64]
    - [46, 114.688]
  - - [1344, 32, 1, 64]
    - [114, 229.376]
  - - [1344, 1, 1, 1]
    - [21, 0.112]
  - - [1344, 1, 1, 16]
    - [125, 1.792]
  - - [1344, 1, 1, 32]
    - [128, 3.44064]
  - - [1344, 16, 1, 1]
    - [114, 1.792]
  - - [1344, 16, 1, 16]
    - [110, 28.672]
  - - [1344, 16, 1, 32]
    - [72, 55.0502]
  - - [1344, 32, 1, 1]
    - [71, 3.584]
  - - [1344, 32, 1, 16]
    - [132, 55.0502]
  - - [1344, 32, 1, 32]
    - [114, 110.1]
  - - [1344, 64, 1, 1]
    - [129, 7.47965]
  - - [1344, 64, 1, 16]
    - [121, 114.688]
  - - [1344, 64, 1, 32]
    - [15, 220.201]
  - - [1600, 1, 1, 64]
    - [130, 8.53333]
  - - [1600, 16, 1, 64]
    - [22, 136.533]
  - - [1600, 32, 1, 64]
    - [16, 262.144]
  - - [1600, 1, 1, 1]
    - [103, 0.128]
  - - [1600, 1, 1, 16]
    - [109, 2.048]
  - - [1600, 1, 1, 32]
    - [112, 4.096]
  - - [1600, 16, 1, 1]
    - [125, 2.048]
  - - [1600, 16, 1, 16]
    - [125, 34.1333]
  - - [1600, 16, 1, 32]
    - [21, 68.2667]
  - - [1600, 32, 1, 1]
    - [133, 4.45217]
  - - [1600, 32, 1, 16]
    - [15, 65.536]
  - - [1600, 32, 1, 32]
    - [114, 131.072]
  - - [1600, 64, 1, 1]
    - [73, 8.192]
  - - [1600, 64, 1, 16]
    - [30, 131.072]
  - - [1600, 64, 1, 32]
    - [115, 273.067]
  - - [1856, 1, 1, 64]
    - [73, 9.89867]
  - - [1856, 16, 1, 64]
    - [113, 158.379]
  - - [1856, 32, 1, 64]
    - [127, 330.529]
  - - [1856, 1, 1, 1]
    - [15, 0.154667]
  - - [1856, 1, 1, 16]
    - [124, 2.37568]
  - - [1856, 1, 1, 32]
    - [110, 4.94933]
  - - [1856, 16, 1, 1]
    - [128, 2.58226]
  - - [1856, 16, 1, 16]
    - [22, 38.0109]
  - - [1856, 16, 1, 32]
    - [121, 76.0218]
  - - [1856, 32, 1, 1]
    - [110, 4.75136]
  - - [1856, 32, 1, 16]
    - [120, 79.1893]
  - - [1856, 32, 1, 32]
    - [15, 158.379]
  - - [1856, 64, 1, 1]
    - [73, 9.50272]
  - - [1856, 64, 1, 16]
    - [62, 158.379]
  - - [1856, 64, 1, 32]
    - [22, 304.087]
  - - [2112, 1, 1, 64]
    - [22, 10.8134]
  - - [2112, 16, 1, 64]
    - [71, 180.224]
  - - [2112, 32, 1, 64]
    - [133, 346.03]
  - - [2112, 1, 1, 1]
    - [103, 0.176]
  - - [2112, 1, 1, 16]
    - [22, 2.70336]
  - - [2112, 1, 1, 32]
    - [88, 5.632]
  - - [2112, 16, 1, 1]
    - [109, 2.816]
  - - [2112, 16, 1, 16]
    - [121, 45.056]
  - - [2112, 16, 1, 32]
    - [28, 90.112]
  - - [2112, 32, 1, 1]
    - [123, 5.632]
  - - [2112, 32, 1, 16]
    - [48, 86.5075]
  - - [2112, 32, 1, 32]
    - [103, 166.361]
  - - [2112, 64, 1, 1]
    - [15, 10.8134]
  - - [2112, 64, 1, 16]
    - [15, 166.361]
  - - [2112, 64, 1, 32]
    - [46, 360.448]
  - - [2368, 1, 1, 64]
    - [113, 12.6293]
  - - [2368, 16, 1, 64]
    - [109, 193.987]
  - - [2368, 32, 1, 64]
    - [126, 404.139]
  - - [2368, 1, 1, 1]
    - [15, 0.197333]
  - - [2368, 1, 1, 16]
    - [115, 3.15733]
  - - [2368, 1, 1, 32]
    - [15, 6.06208]
  - - [2368, 16, 1, 1]
    - [128, 3.03104]
  - - [2368, 16, 1, 16]
    - [110, 48.4966]
  - - [2368, 16, 1, 32]
    - [109, 96.9933]
  - - [2368, 32, 1, 1]
    - [113, 6.06208]
  - - [2368, 32, 1, 16]
    - [111, 101.035]
  - - [2368, 32, 1, 32]
    - [132, 202.069]
  - - [2368, 64, 1, 1]
    - [111, 12.1242]
  - - [2368, 64, 1, 16]
    - [126, 202.069]
  - - [2368, 64, 1, 32]
    - [111, 404.139]
  - - [2624, 1, 1, 64]
    - [22, 13.4349]
  - - [2624, 16, 1, 64]
    - [127, 214.958]
  - - [2624, 32, 1, 64]
    - [129, 467.3]
  - - [2624, 1, 1, 1]
    - [117, 0.201846]
  - - [2624, 1, 1, 16]
    - [81, 3.35872]
  - - [2624, 1, 1, 32]
    - [123, 6.71744]
  - - [2624, 16, 1, 1]
    - [113, 3.49867]
  - - [2624, 16, 1, 16]
    - [113, 53.7395]
  - - [2624, 16, 1, 32]
    - [15, 107.479]
  - - [2624, 32, 1, 1]
    - [22, 6.71744]
  - - [2624, 32, 1, 16]
    - [15, 111.957]
  - - [2624, 32, 1, 32]
    - [111, 223.915]
  - - [2624, 64, 1, 1]
    - [22, 13.9947]
  - - [2624, 64, 1, 16]
    - [133, 223.915]
  - - [2624, 64, 1, 32]
    - [23, 447.829]
  - - [2880, 1, 1, 64]
    - [113, 14.7456]
  - - [2880, 16, 1, 64]
    - [117, 245.76]
  - - [2880, 32, 1, 64]
    - [110, 471.859]
  - - [2880, 1, 1, 1]
    - [123, 0.250435]
  - - [2880, 1, 1, 16]
    - [132, 3.54462]
  - - [2880, 1, 1, 32]
    - [21, 7.68]
  - - [2880, 16, 1, 1]
    - [113, 3.84]
  - - [2880, 16, 1, 16]
    - [115, 61.44]
  - - [2880, 16, 1, 32]
    - [22, 117.965]
  - - [2880, 32, 1, 1]
    - [134, 7.68]
  - - [2880, 32, 1, 16]
    - [112, 122.88]
  - - [2880, 32, 1, 32]
    - [49, 235.93]
  - - [2880, 64, 1, 1]
    - [129, 14.7456]
  - - [2880, 64, 1, 16]
    - [135, 245.76]
  - - [2880, 64, 1, 32]
    - [15, 471.859]
  - - [3136, 1, 1, 64]
    - [117, 16.7253]
  - - [3136, 16, 1, 64]
    - [133, 256.901]
  - - [3136, 32, 1, 64]
    - [117, 535.211]
  - - [3136, 1, 1, 1]
    - [115, 0.241231]
  - - [3136, 1, 1, 16]
    - [16, 4.01408]
  - - [3136, 1, 1, 32]
    - [90, 8.02816]
  - - [3136, 16, 1, 1]
    - [112, 4.18133]
  - - [3136, 16, 1, 16]
    - [21, 64.2253]
  - - [3136, 16, 1, 32]
    - [133, 139.62]
  - - [3136, 32, 1, 1]
    - [21, 8.02816]
  - - [3136, 32, 1, 16]
    - [73, 133.803]
  - - [3136, 32, 1, 32]
    - [110, 256.901]
  - - [3136, 64, 1, 1]
    - [91, 16.0563]
  - - [3136, 64, 1, 16]
    - [48, 256.901]
  - - [3136, 64, 1, 32]
    - [115, 535.211]
  - - [3392, 1, 1, 64]
    - [113, 18.0907]
  - - [3392, 16, 1, 64]
    - [115, 289.451]
  - - [3392, 32, 1, 64]
    - [115, 555.745]
  - - [3392, 1, 1, 1]
    - [46, 0.282667]
  - - [3392, 1, 1, 16]
    - [22, 4.34176]
  - - [3392, 1, 1, 32]
    - [21, 9.04533]
  - - [3392, 16, 1, 1]
    - [117, 4.34176]
  - - [3392, 16, 1, 16]
    - [127, 75.5089]
  - - [3392, 16, 1, 32]
    - [120, 144.725]
  - - [3392, 32, 1, 1]
    - [110, 9.04533]
  - - [3392, 32, 1, 16]
    - [117, 144.725]
  - - [3392, 32, 1, 32]
    - [133, 289.451]
  - - [3392, 64, 1, 1]
    - [46, 17.367]
  - - [3392, 64, 1, 16]
    - [84, 277.873]
  - - [3392, 64, 1, 32]
    - [115, 555.745]
  - - [3648, 1, 1, 64]
    - [22, 18.6778]
  - - [3648, 16, 1, 64]
    - [110, 311.296]
  - - [3648, 32, 1, 64]
    - [76, 597.688]
  - - [3648, 1, 1, 1]
    - [112, 0.29184]
  - - [3648, 1, 1, 16]
    - [15, 4.66944]
  - - [3648, 1, 1, 32]
    - [111, 9.33888]
  - - [3648, 16, 1, 1]
    - [73, 4.864]
  - - [3648, 16, 1, 16]
    - [113, 74.711]
  - - [3648, 16, 1, 32]
    - [73, 155.648]
  - - [3648, 32, 1, 1]
    - [113, 9.33888]
  - - [3648, 32, 1, 16]
    - [76, 155.648]
  - - [3648, 32, 1, 32]
    - [15, 287.35]
  - - [3648, 64, 1, 1]
    - [73, 17.9594]
  - - [3648, 64, 1, 16]
    - [21, 287.35]
  - - [3648, 64, 1, 32]
    - [46, 597.688]
  - - [3904, 1, 1, 64]
    - [113, 19.9885]
  - - [3904, 16, 1, 64]
    - [133, 333.141]
  - - [3904, 32, 1, 64]
    - [22, 666.283]
  - - [3904, 1, 1, 1]
    - [128, 0.31232]
  - - [3904, 1, 1, 16]
    - [112, 4.99712]
  - - [3904, 1, 1, 32]
    - [15, 9.99424]
  - - [3904, 16, 1, 1]
    - [103, 5.20533]
  - - [3904, 16, 1, 16]
    - [15, 79.9539]
  - - [3904, 16, 1, 32]
    - [81, 159.908]
  - - [3904, 32, 1, 1]
    - [113, 10.4107]
  - - [3904, 32, 1, 16]
    - [113, 166.571]
  - - [3904, 32, 1, 32]
    - [130, 333.141]
  - - [3904, 64, 1, 1]
    - [90, 19.2197]
  - - [3904, 64, 1, 16]
    - [131, 319.816]
  - - [3904, 64, 1, 32]
    - [132, 639.631]
  - - [1, 320, 1, 64]
    - [73, 1.70667]
  - - [16, 320, 1, 64]
    - [64, 26.2144]
  - - [32, 320, 1, 64]
    - [109, 54.6133]
  - - [1, 320, 1, 1]
    - [15, 0.0256]
  - - [1, 320, 1, 16]
    - [71, 0.426667]
  - - [1, 320, 1, 32]
    - [124, 0.8192]
  - - [16, 320, 1, 1]
    - [114, 0.426667]
  - - [16, 320, 1, 16]
    - [111, 6.82667]
  - - [16, 320, 1, 32]
    - [121, 13.6533]
  - - [32, 320, 1, 1]
    - [62, 0.853333]
  - - [32, 320, 1, 16]
    - [62, 13.1072]
  - - [32, 320, 1, 32]
    - [122, 27.3067]
  - - [64, 320, 1, 1]
    - [113, 1.70667]
  - - [64, 320, 1, 16]
    - [114, 27.3067]
  - - [64, 320, 1, 32]
    - [71, 52.4288]
  - - [320, 320, 1, 1]
    - [130, 8.53333]
  - - [320, 320, 1, 16]
    - [139, 136.533]
  - - [320, 320, 1, 32]
    - [110, 262.144]
  - - [576, 320, 1, 1]
    - [130, 15.36]
  - - [576, 320, 1, 16]
    - [72, 235.93]
  - - [576, 320, 1, 32]
    - [46, 491.52]
  - - [832, 320, 1, 1]
    - [135, 20.48]
  - - [832, 320, 1, 16]
    - [15, 327.68]
  - - [832, 320, 1, 32]
    - [31, 681.574]
  - - [1088, 320, 1, 1]
    - [135, 29.0133]
  - - [1088, 320, 1, 16]
    - [89, 428.505]
  - - [1088, 320, 1, 32]
    - [26, 857.009]
  - - [1344, 320, 1, 1]
    - [7, 31.8578]
  - - [1344, 320, 1, 16]
    - [62, 509.724]
  - - [1344, 320, 1, 32]
    - [132, 1019.45]
  - - [1600, 320, 1, 1]
    - [137, 39.3846]
  - - [1600, 320, 1, 16]
    - [89, 655.36]
  - - [1600, 320, 1, 32]
    - [89, 1310.72]
  - - [1856, 320, 1, 1]
    - [63, 45.6862]
  - - [1856, 320, 1, 16]
    - [137, 703.905]
  - - [1856, 320, 1, 32]
    - [83, 1461.96]
  - - [2112, 320, 1, 1]
    - [91, 50.0622]
  - - [2112, 320, 1, 16]
    - [85, 800.996]
  - - [2112, 320, 1, 32]
    - [89, 1601.99]
  - - [2368, 320, 1, 1]
    - [83, 56.1304]
  - - [2368, 320, 1, 16]
    - [63, 898.086]
  - - [2368, 320, 1, 32]
    - [49, 1732.02]
  - - [2624, 320, 1, 1]
    - [16, 59.9771]
  - - [2624, 320, 1, 16]
    - [49, 959.634]
  - - [2624, 320, 1, 32]
    - [78, 1919.27]
  - - [2880, 320, 1, 1]
    - [54, 63.5586]
  - - [2880, 320, 1, 16]
    - [30, 1016.94]
  - - [2880, 320, 1, 32]
    - [67, 2033.88]
  - - [3136, 320, 1, 1]
    - [85, 69.2083]
  - - [3136, 320, 1, 16]
    - [85, 1070.42]
  - - [3136, 320, 1, 32]
    - [58, 2140.84]
  - - [3392, 320, 1, 1]
    - [41, 72.3627]
  - - [3392, 320, 1, 16]
    - [95, 1197.73]
  - - [3392, 320, 1, 32]
    - [33, 2395.45]
  - - [3648, 320, 1, 1]
    - [86, 77.824]
  - - [3648, 320, 1, 16]
    - [67, 1288.12]
  - - [3648, 320, 1, 32]
    - [42, 2576.24]
  - - [3904, 320, 1, 1]
    - [50, 80.5987]
  - - [3904, 320, 1, 16]
    - [14, 1289.58]
  - - [3904, 320, 1, 32]
    - [41, 2665.13]
  - - [1, 576, 1, 64]
    - [123, 2.94912]
  - - [16, 576, 1, 64]
    - [114, 47.1859]
  - - [32, 576, 1, 64]
    - [135, 102.578]
  - - [1, 576, 1, 1]
    - [16, 0.04608]
  - - [1, 576, 1, 16]
    - [115, 0.768]
  - - [1, 576, 1, 32]
    - [114, 1.47456]
  - - [16, 576, 1, 1]
    - [128, 0.73728]
  - - [16, 576, 1, 16]
    - [130, 12.8223]
  - - [16, 576, 1, 32]
    - [115, 24.576]
  - - [32, 576, 1, 1]
    - [113, 1.47456]
  - - [32, 576, 1, 16]
    - [103, 23.593]
  - - [32, 576, 1, 32]
    - [90, 47.1859]
  - - [64, 576, 1, 1]
    - [63, 2.94912]
  - - [64, 576, 1, 16]
    - [73, 47.1859]
  - - [64, 576, 1, 32]
    - [125, 98.304]
  - - [320, 576, 1, 1]
    - [136, 15.36]
  - - [320, 576, 1, 16]
    - [91, 226.855]
  - - [320, 576, 1, 32]
    - [130, 471.859]
  - - [576, 576, 1, 1]
    - [47, 24.576]
  - - [576, 576, 1, 16]
    - [132, 424.673]
  - - [576, 576, 1, 32]
    - [17, 816.679]
  - - [832, 576, 1, 1]
    - [137, 36.864]
  - - [832, 576, 1, 16]
    - [132, 589.824]
  - - [832, 576, 1, 32]
    - [138, 1226.83]
  - - [1088, 576, 1, 1]
    - [16, 46.4213]
  - - [1088, 576, 1, 16]
    - [32, 716.215]
  - - [1088, 576, 1, 32]
    - [16, 1542.62]
  - - [1344, 576, 1, 1]
    - [89, 57.344]
  - - [1344, 576, 1, 16]
    - [7, 917.504]
  - - [1344, 576, 1, 32]
    - [78, 1835.01]
  - - [1600, 576, 1, 1]
    - [14, 63.5586]
  - - [1600, 576, 1, 16]
    - [89, 1053.26]
  - - [1600, 576, 1, 32]
    - [78, 2184.53]
  - - [1856, 576, 1, 1]
    - [16, 71.2704]
  - - [1856, 576, 1, 16]
    - [79, 1140.33]
  - - [1856, 576, 1, 32]
    - [85, 2280.65]
  - - [2112, 576, 1, 1]
    - [13, 78.4846]
  - - [2112, 576, 1, 16]
    - [86, 1297.61]
  - - [2112, 576, 1, 32]
    - [34, 2684.72]
  - - [2368, 576, 1, 1]
    - [14, 85.248]
  - - [2368, 576, 1, 16]
    - [96, 1407.97]
  - - [2368, 576, 1, 32]
    - [67, 2815.93]
  - - [2624, 576, 1, 1]
    - [6, 91.6015]
  - - [2624, 576, 1, 16]
    - [38, 1511.42]
  - - [2624, 576, 1, 32]
    - [18, 2931.25]
  - - [2880, 576, 1, 1]
    - [14, 103.68]
  - - [2880, 576, 1, 16]
    - [43, 1658.88]
  - - [2880, 576, 1, 32]
    - [43, 3424.78]
  - - [3136, 576, 1, 1]
    - [6, 106.255]
  - - [3136, 576, 1, 16]
    - [43, 1806.34]
  - - [3136, 576, 1, 32]
    - [13, 3400.16]
  - - [3392, 576, 1, 1]
    - [4, 111.645]
  - - [3392, 576, 1, 16]
    - [101, 1838.86]
  - - [3392, 576, 1, 32]
    - [69, 3677.73]
  - - [3648, 576, 1, 1]
    - [13, 120.071]
  - - [3648, 576, 1, 16]
    - [41, 1921.14]
  - - [3648, 576, 1, 32]
    - [59, 4075.15]
  - - [3904, 576, 1, 1]
    - [13, 128.497]
  - - [3904, 576, 1, 16]
    - [41, 2180.56]
  - - [3904, 576, 1, 32]
    - [13, 4232.85]
  - - [1, 832, 1, 64]
    - [26, 4.25984]
  - - [16, 832, 1, 64]
    - [120, 70.9973]
  - - [32, 832, 1, 64]
    - [115, 136.315]
  - - [1, 832, 1, 1]
    - [120, 0.06656]
  - - [1, 832, 1, 16]
    - [109, 1.06496]
  - - [1, 832, 1, 32]
    - [127, 2.048]
  - - [16, 832, 1, 1]
    - [116, 1.10933]
  - - [16, 832, 1, 16]
    - [113, 16.384]
  - - [16, 832, 1, 32]
    - [140, 32.768]
  - - [32, 832, 1, 1]
    - [127, 2.21867]
  - - [32, 832, 1, 16]
    - [115, 34.0787]
  - - [32, 832, 1, 32]
    - [117, 68.1574]
  - - [64, 832, 1, 1]
    - [110, 4.096]
  - - [64, 832, 1, 16]
    - [121, 68.1574]
  - - [64, 832, 1, 32]
    - [122, 141.995]
  - - [320, 832, 1, 1]
    - [138, 20.48]
  - - [320, 832, 1, 16]
    - [132, 340.787]
  - - [320, 832, 1, 32]
    - [135, 681.574]
  - - [576, 832, 1, 1]
    - [132, 36.864]
  - - [576, 832, 1, 16]
    - [83, 589.824]
  - - [576, 832, 1, 32]
    - [91, 1226.83]
  - - [832, 832, 1, 1]
    - [84, 51.2759]
  - - [832, 832, 1, 16]
    - [137, 820.414]
  - - [832, 832, 1, 32]
    - [64, 1640.83]
  - - [1088, 832, 1, 1]
    - [78, 62.4287]
  - - [1088, 832, 1, 16]
    - [49, 998.859]
  - - [1088, 832, 1, 32]
    - [34, 1997.72]
  - - [1344, 832, 1, 1]
    - [41, 77.1178]
  - - [1344, 832, 1, 16]
    - [41, 1233.88]
  - - [1344, 832, 1, 32]
    - [36, 2385.51]
  - - [1600, 832, 1, 1]
    - [38, 88.7467]
  - - [1600, 832, 1, 16]
    - [92, 1419.95]
  - - [1600, 832, 1, 32]
    - [97, 2662.4]
  - - [1856, 832, 1, 1]
    - [42, 102.946]
  - - [1856, 832, 1, 16]
    - [13, 1544.19]
  - - [1856, 832, 1, 32]
    - [42, 2994.8]
  - - [2112, 832, 1, 1]
    - [14, 109.824]
  - - [2112, 832, 1, 16]
    - [14, 1703.94]
  - - [2112, 832, 1, 32]
    - [16, 3514.37]
  - - [2368, 832, 1, 1]
    - [96, 115.893]
  - - [2368, 832, 1, 16]
    - [13, 1854.28]
  - - [2368, 832, 1, 32]
    - [38, 3708.57]
  - - [2624, 832, 1, 1]
    - [41, 128.422]
  - - [2624, 832, 1, 16]
    - [101, 2054.75]
  - - [2624, 832, 1, 32]
    - [59, 3992.08]
  - - [2880, 832, 1, 1]
    - [42, 133.12]
  - - [2880, 832, 1, 16]
    - [41, 2323.55]
  - - [2880, 832, 1, 32]
    - [43, 5111.81]
  - - [3136, 832, 1, 1]
    - [38, 173.943]
  - - [3136, 832, 1, 16]
    - [44, 2693.32]
  - - [3136, 832, 1, 32]
    - [69, 5386.64]
  - - [3392, 832, 1, 1]
    - [44, 182.074]
  - - [3392, 832, 1, 16]
    - [60, 3010.29]
  - - [3392, 832, 1, 32]
    - [41, 5826.36]
  - - [3648, 832, 1, 1]
    - [41, 189.696]
  - - [3648, 832, 1, 16]
    - [96, 3035.14]
  - - [3648, 832, 1, 32]
    - [44, 6070.27]
  - - [3904, 832, 1, 1]
    - [41, 203.008]
  - - [3904, 832, 1, 16]
    - [42, 3352.91]
  - - [3904, 832, 1, 32]
    - [97, 6705.81]
  - - [1, 1088, 1, 64]
    - [125, 5.80267]
  - - [16, 1088, 1, 64]
    - [113, 89.129]
  - - [32, 1088, 1, 64]
    - [46, 178.258]
  - - [1, 1088, 1, 1]
    - [119, 0.0906667]
  - - [1, 1088, 1, 16]
    - [84, 1.39264]
  - - [1, 1088, 1, 32]
    - [114, 2.78528]
  - - [16, 1088, 1, 1]
    - [113, 1.45067]
  - - [16, 1088, 1, 16]
    - [88, 21.4252]
  - - [16, 1088, 1, 32]
    - [71, 44.5645]
  - - [32, 1088, 1, 1]
    - [140, 2.67815]
  - - [32, 1088, 1, 16]
    - [139, 46.4213]
  - - [32, 1088, 1, 32]
    - [117, 89.129]
  - - [64, 1088, 1, 1]
    - [109, 5.57056]
  - - [64, 1088, 1, 16]
    - [124, 89.129]
  - - [64, 1088, 1, 32]
    - [125, 171.402]
  - - [320, 1088, 1, 1]
    - [135, 25.7896]
  - - [320, 1088, 1, 16]
    - [135, 428.505]
  - - [320, 1088, 1, 32]
    - [132, 857.009]
  - - [576, 1088, 1, 1]
    - [137, 46.4213]
  - - [576, 1088, 1, 16]
    - [84, 691.518]
  - - [576, 1088, 1, 32]
    - [63, 1485.48]
  - - [832, 1088, 1, 1]
    - [79, 64.6583]
  - - [832, 1088, 1, 16]
    - [89, 998.859]
  - - [832, 1088, 1, 32]
    - [93, 2069.07]
  - - [1088, 1088, 1, 1]
    - [91, 76.3706]
  - - [1088, 1088, 1, 16]
    - [93, 1306.2]
  - - [1088, 1088, 1, 32]
    - [66, 2612.4]
  - - [1344, 1088, 1, 1]
    - [55, 91.392]
  - - [1344, 1088, 1, 16]
    - [18, 1462.27]
  - - [1344, 1088, 1, 32]
    - [68, 3018.88]
  - - [1600, 1088, 1, 1]
    - [97, 108.8]
  - - [1600, 1088, 1, 16]
    - [13, 1688.05]
  - - [1600, 1088, 1, 32]
    - [59, 3481.6]
  - - [1856, 1088, 1, 1]
    - [97, 118.784]
  - - [1856, 1088, 1, 16]
    - [97, 1846.24]
  - - [1856, 1088, 1, 32]
    - [38, 3801.09]
  - - [2112, 1088, 1, 1]
    - [43, 135.168]
  - - [2112, 1088, 1, 16]
    - [43, 2042.54]
  - - [2112, 1088, 1, 32]
    - [43, 4456.45]
  - - [2368, 1088, 1, 1]
    - [41, 166.218]
  - - [2368, 1088, 1, 16]
    - [43, 2576.38]
  - - [2368, 1088, 1, 32]
    - [41, 5318.99]
  - - [2624, 1088, 1, 1]
    - [96, 178.432]
  - - [2624, 1088, 1, 16]
    - [38, 2947.01]
  - - [2624, 1088, 1, 32]
    - [38, 5709.82]
  - - [2880, 1088, 1, 1]
    - [14, 189.905]
  - - [2880, 1088, 1, 16]
    - [44, 3234.52]
  - - [2880, 1088, 1, 32]
    - [42, 6076.97]
  - - [3136, 1088, 1, 1]
    - [38, 206.786]
  - - [3136, 1088, 1, 16]
    - [97, 3308.58]
  - - [3136, 1088, 1, 32]
    - [38, 6617.15]
  - - [3392, 1088, 1, 1]
    - [38, 223.666]
  - - [3392, 1088, 1, 16]
    - [42, 3473.41]
  - - [3392, 1088, 1, 32]
    - [38, 7157.33]
  - - [3648, 1088, 1, 1]
    - [43, 248.064]
  - - [3648, 1088, 1, 16]
    - [61, 3848.75]
  - - [3904, 1088, 1, 1]
    - [42, 249.856]
  - - [3904, 1088, 1, 16]
    - [38, 3883.48]
  - - [1, 1344, 1, 64]
    - [22, 6.88128]
  - - [16, 1344, 1, 64]
    - [115, 119.674]
  - - [32, 1344, 1, 64]
    - [109, 229.376]
  - - [1, 1344, 1, 1]
    - [73, 0.112]
  - - [1, 1344, 1, 16]
    - [71, 1.72032]
  - - [1, 1344, 1, 32]
    - [114, 3.44064]
  - - [16, 1344, 1, 1]
    - [112, 1.72032]
  - - [16, 1344, 1, 16]
    - [139, 28.672]
  - - [16, 1344, 1, 32]
    - [125, 55.0502]
  - - [32, 1344, 1, 1]
    - [121, 3.584]
  - - [32, 1344, 1, 16]
    - [121, 52.9329]
  - - [32, 1344, 1, 32]
    - [71, 105.866]
  - - [64, 1344, 1, 1]
    - [23, 6.61662]
  - - [64, 1344, 1, 16]
    - [110, 110.1]
  - - [64, 1344, 1, 32]
    - [126, 220.201]
  - - [320, 1344, 1, 1]
    - [115, 31.8578]
  - - [320, 1344, 1, 16]
    - [90, 509.724]
  - - [320, 1344, 1, 32]
    - [132, 1101.0]
  - - [576, 1344, 1, 1]
    - [78, 57.344]
  - - [576, 1344, 1, 16]
    - [91, 917.504]
  - - [576, 1344, 1, 32]
    - [138, 1835.01]
  - - [832, 1344, 1, 1]
    - [79, 79.872]
  - - [832, 1344, 1, 16]
    - [56, 1233.88]
  - - [832, 1344, 1, 32]
    - [50, 2467.77]
  - - [1088, 1344, 1, 1]
    - [34, 94.3401]
  - - [1088, 1344, 1, 16]
    - [50, 1559.76]
  - - [1088, 1344, 1, 32]
    - [83, 3018.88]
  - - [1344, 1344, 1, 1]
    - [38, 106.255]
  - - [1344, 1344, 1, 16]
    - [97, 1751.6]
  - - [1344, 1344, 1, 32]
    - [38, 3503.2]
  - - [1600, 1344, 1, 1]
    - [38, 126.494]
  - - [1600, 1344, 1, 16]
    - [42, 2085.24]
  - - [1600, 1344, 1, 32]
    - [13, 4047.81]
  - - [1856, 1344, 1, 1]
    - [42, 160.933]
  - - [1856, 1344, 1, 16]
    - [96, 2574.93]
  - - [1856, 1344, 1, 32]
    - [41, 5149.86]
  - - [2112, 1344, 1, 1]
    - [43, 183.131]
  - - [2112, 1344, 1, 16]
    - [43, 2930.09]
  - - [2112, 1344, 1, 32]
    - [59, 5860.19]
  - - [2368, 1344, 1, 1]
    - [59, 205.329]
  - - [2368, 1344, 1, 16]
    - [43, 3182.59]
  - - [2368, 1344, 1, 32]
    - [42, 6365.18]
  - - [2624, 1344, 1, 1]
    - [59, 207.45]
  - - [2624, 1344, 1, 16]
    - [42, 3419.79]
  - - [2624, 1344, 1, 32]
    - [69, 6839.58]
  - - [2880, 1344, 1, 1]
    - [43, 234.589]
  - - [2880, 1344, 1, 16]
    - [4, 3643.03]
  - - [2880, 1344, 1, 32]
    - [43, 7286.06]
  - - [3136, 1344, 1, 1]
    - [44, 240.845]
  - - [3136, 1344, 1, 16]
    - [41, 3853.52]
  - - [3392, 1344, 1, 1]
    - [97, 268.168]
  - - [3392, 1344, 1, 16]
    - [38, 4052.31]
  - - [3648, 1344, 1, 1]
    - [43, 272.384]
  - - [3648, 1344, 1, 16]
    - [43, 4482.66]
  - - [3904, 1344, 1, 1]
    - [42, 291.499]
  - - [3904, 1344, 1, 16]
    - [42, 4537.93]
  - - [1, 1600, 1, 64]
    - [122, 8.192]
  - - [16, 1600, 1, 64]
    - [113, 136.533]
  - - [32, 1600, 1, 64]
    - [113, 284.939]
  - - [1, 1600, 1, 1]
    - [73, 0.133333]
  - - [1, 1600, 1, 16]
    - [89, 2.048]
  - - [1, 1600, 1, 32]
    - [117, 4.45217]
  - - [16, 1600, 1, 1]
    - [126, 2.13333]
  - - [16, 1600, 1, 16]
    - [113, 34.1333]
  - - [16, 1600, 1, 32]
    - [113, 71.2348]
  - - [32, 1600, 1, 1]
    - [109, 4.26667]
  - - [32, 1600, 1, 16]
    - [103, 63.0154]
  - - [32, 1600, 1, 32]
    - [112, 131.072]
  - - [64, 1600, 1, 1]
    - [113, 8.53333]
  - - [64, 1600, 1, 16]
    - [76, 131.072]
  - - [64, 1600, 1, 32]
    - [129, 273.067]
  - - [320, 1600, 1, 1]
    - [91, 37.9259]
  - - [320, 1600, 1, 16]
    - [132, 630.154]
  - - [320, 1600, 1, 32]
    - [138, 1260.31]
  - - [576, 1600, 1, 1]
    - [78, 65.8286]
  - - [576, 1600, 1, 16]
    - [30, 1053.26]
  - - [576, 1600, 1, 32]
    - [85, 2033.88]
  - - [832, 1600, 1, 1]
    - [65, 85.8839]
  - - [832, 1600, 1, 16]
    - [32, 1374.14]
  - - [832, 1600, 1, 32]
    - [14, 2748.28]
  - - [1088, 1600, 1, 1]
    - [4, 102.4]
  - - [1088, 1600, 1, 16]
    - [100, 1591.59]
  - - [1088, 1600, 1, 32]
    - [59, 3376.1]
  - - [1344, 1600, 1, 1]
    - [38, 122.88]
  - - [1344, 1600, 1, 16]
    - [59, 2023.91]
  - - [1344, 1600, 1, 32]
    - [61, 3932.16]
  - - [1600, 1600, 1, 1]
    - [20, 165.161]
  - - [1600, 1600, 1, 16]
    - [42, 2730.67]
  - - [1600, 1600, 1, 32]
    - [38, 5285.16]
  - - [1856, 1600, 1, 1]
    - [38, 191.587]
  - - [1856, 1600, 1, 16]
    - [41, 2969.6]
  - - [1856, 1600, 1, 32]
    - [38, 6130.79]
  - - [2112, 1600, 1, 1]
    - [42, 225.28]
  - - [2112, 1600, 1, 16]
    - [38, 3488.21]
  - - [2112, 1600, 1, 32]
    - [41, 6758.4]
  - - [2368, 1600, 1, 1]
    - [41, 222.871]
  - - [2368, 1600, 1, 16]
    - [6, 3464.05]
  - - [2368, 1600, 1, 32]
    - [42, 7347.98]
  - - [2624, 1600, 1, 1]
    - [97, 246.965]
  - - [2624, 1600, 1, 16]
    - [41, 3838.54]
  - - [2880, 1600, 1, 1]
    - [38, 263.314]
  - - [2880, 1600, 1, 16]
    - [38, 4096.0]
  - - [3136, 1600, 1, 1]
    - [38, 286.72]
  - - [3136, 1600, 1, 16]
    - [42, 4339.55]
  - - [3392, 1600, 1, 1]
    - [38, 285.642]
  - - [3392, 1600, 1, 16]
    - [38, 4693.79]
  - - [3648, 1600, 1, 1]
    - [43, 315.503]
  - - [3648, 1600, 1, 16]
    - [43, 4915.2]
  - - [3904, 1600, 1, 1]
    - [38, 312.32]
  - - [3904, 1600, 1, 16]
    - [38, 4997.12]
  - - [1, 1856, 1, 64]
    - [113, 9.50272]
  - - [16, 1856, 1, 64]
    - [120, 152.044]
  - - [32, 1856, 1, 64]
    - [72, 292.391]
  - - [1, 1856, 1, 1]
    - [111, 0.154667]
  - - [1, 1856, 1, 16]
    - [88, 2.28431]
  - - [1, 1856, 1, 32]
    - [71, 4.75136]
  - - [16, 1856, 1, 1]
    - [115, 2.47467]
  - - [16, 1856, 1, 16]
    - [109, 39.5947]
  - - [16, 1856, 1, 32]
    - [117, 79.1893]
  - - [32, 1856, 1, 1]
    - [122, 4.75136]
  - - [32, 1856, 1, 16]
    - [127, 82.6323]
  - - [32, 1856, 1, 32]
    - [111, 146.196]
  - - [64, 1856, 1, 1]
    - [139, 9.50272]
  - - [64, 1856, 1, 16]
    - [15, 140.781]
  - - [64, 1856, 1, 32]
    - [115, 316.757]
  - - [320, 1856, 1, 1]
    - [137, 45.6862]
  - - [320, 1856, 1, 16]
    - [84, 703.905]
  - - [320, 1856, 1, 32]
    - [79, 1407.81]
  - - [576, 1856, 1, 1]
    - [137, 73.728]
  - - [576, 1856, 1, 16]
    - [16, 1140.33]
  - - [576, 1856, 1, 32]
    - [42, 2138.11]
  - - [832, 1856, 1, 1]
    - [41, 96.512]
  - - [832, 1856, 1, 16]
    - [13, 1544.19]
  - - [832, 1856, 1, 32]
    - [59, 3188.01]
  - - [1088, 1856, 1, 1]
    - [38, 122.384]
  - - [1088, 1856, 1, 16]
    - [59, 1900.54]
  - - [1088, 1856, 1, 32]
    - [4, 3692.49]
  - - [1344, 1856, 1, 1]
    - [97, 160.933]
  - - [1344, 1856, 1, 16]
    - [59, 2574.93]
  - - [1344, 1856, 1, 32]
    - [43, 5149.86]
  - - [1600, 1856, 1, 1]
    - [96, 191.587]
  - - [1600, 1856, 1, 16]
    - [41, 2969.6]
  - - [1600, 1856, 1, 32]
    - [42, 6130.79]
  - - [1856, 1856, 1, 1]
    - [38, 202.632]
  - - [1856, 1856, 1, 16]
    - [43, 3444.74]
  - - [1856, 1856, 1, 32]
    - [70, 6484.21]
  - - [2112, 1856, 1, 1]
    - [6, 223.993]
  - - [2112, 1856, 1, 16]
    - [43, 3689.29]
  - - [2368, 1856, 1, 1]
    - [44, 266.364]
  - - [2368, 1856, 1, 16]
    - [61, 4136.48]
  - - [2624, 1856, 1, 1]
    - [97, 270.564]
  - - [2624, 1856, 1, 16]
    - [96, 4329.02]
  - - [2880, 1856, 1, 1]
    - [38, 288.934]
  - - [2880, 1856, 1, 16]
    - [61, 4622.94]
  - - [3136, 1856, 1, 1]
    - [38, 306.338]
  - - [3136, 1856, 1, 16]
    - [41, 4901.4]
  - - [3392, 1856, 1, 1]
    - [44, 331.345]
  - - [3392, 1856, 1, 16]
    - [41, 5036.44]
  - - [3648, 1856, 1, 1]
    - [43, 338.534]
  - - [3648, 1856, 1, 16]
    - [41, 5416.55]
  - - [3904, 1856, 1, 1]
    - [43, 353.455]
  - - [3904, 1856, 1, 16]
    - [41, 5655.28]
  - - [1, 2112, 1, 64]
    - [62, 10.8134]
  - - [16, 2112, 1, 64]
    - [127, 173.015]
  - - [32, 2112, 1, 64]
    - [128, 360.448]
  - - [1, 2112, 1, 1]
    - [15, 0.162462]
  - - [1, 2112, 1, 16]
    - [118, 2.93843]
  - - [1, 2112, 1, 32]
    - [113, 5.40672]
  - - [16, 2112, 1, 1]
    - [121, 2.59938]
  - - [16, 2112, 1, 16]
    - [112, 45.056]
  - - [16, 2112, 1, 32]
    - [26, 80.0996]
  - - [32, 2112, 1, 1]
    - [117, 5.40672]
  - - [32, 2112, 1, 16]
    - [133, 86.5075]
  - - [32, 2112, 1, 32]
    - [62, 166.361]
  - - [64, 2112, 1, 1]
    - [137, 11.264]
  - - [64, 2112, 1, 16]
    - [139, 173.015]
  - - [64, 2112, 1, 32]
    - [95, 332.721]
  - - [320, 2112, 1, 1]
    - [137, 50.0622]
  - - [320, 2112, 1, 16]
    - [138, 800.996]
  - - [320, 2112, 1, 32]
    - [89, 1663.61]
  - - [576, 2112, 1, 1]
    - [91, 78.4846]
  - - [576, 2112, 1, 16]
    - [58, 1342.36]
  - - [576, 2112, 1, 32]
    - [51, 2595.23]
  - - [832, 2112, 1, 1]
    - [59, 103.364]
  - - [832, 2112, 1, 16]
    - [38, 1703.94]
  - - [832, 2112, 1, 32]
    - [30, 3407.87]
  - - [1088, 2112, 1, 1]
    - [38, 131.306]
  - - [1088, 2112, 1, 16]
    - [42, 2042.54]
  - - [1088, 2112, 1, 32]
    - [41, 4325.38]
  - - [1344, 2112, 1, 1]
    - [43, 183.131]
  - - [1344, 2112, 1, 16]
    - [43, 2930.09]
  - - [1344, 2112, 1, 32]
    - [43, 5860.19]
  - - [1600, 2112, 1, 1]
    - [41, 218.013]
  - - [1600, 2112, 1, 16]
    - [61, 3379.2]
  - - [1600, 2112, 1, 32]
    - [97, 6360.85]
  - - [1856, 2112, 1, 1]
    - [59, 223.993]
  - - [1856, 2112, 1, 16]
    - [42, 3801.09]
  - - [2112, 2112, 1, 1]
    - [96, 254.888]
  - - [2112, 2112, 1, 16]
    - [38, 4078.21]
  - - [2368, 2112, 1, 1]
    - [38, 285.784]
  - - [2368, 2112, 1, 16]
    - [38, 4325.38]
  - - [2624, 2112, 1, 1]
    - [41, 291.678]
  - - [2624, 2112, 1, 16]
    - [59, 4792.98]
  - - [2880, 2112, 1, 1]
    - [59, 337.92]
  - - [2880, 2112, 1, 16]
    - [41, 5260.59]
  - - [3136, 2112, 1, 1]
    - [42, 339.653]
  - - [3136, 2112, 1, 16]
    - [59, 5046.27]
  - - [3392, 2112, 1, 1]
    - [41, 349.459]
  - - [3392, 2112, 1, 16]
    - [38, 5458.21]
  - - [3648, 2112, 1, 1]
    - [38, 366.885]
  - - [3648, 2112, 1, 16]
    - [43, 5870.15]
  - - [3904, 2112, 1, 1]
    - [38, 374.784]
  - - [1, 2368, 1, 64]
    - [73, 12.1242]
  - - [16, 2368, 1, 64]
    - [113, 202.069]
  - - [32, 2368, 1, 64]
    - [113, 387.973]
  - - [1, 2368, 1, 1]
    - [121, 0.197333]
  - - [1, 2368, 1, 16]
    - [116, 3.15733]
  - - [1, 2368, 1, 32]
    - [111, 6.31467]
  - - [16, 2368, 1, 1]
    - [112, 3.15733]
  - - [16, 2368, 1, 16]
    - [115, 50.5173]
  - - [16, 2368, 1, 32]
    - [127, 101.035]
  - - [32, 2368, 1, 1]
    - [109, 6.06208]
  - - [32, 2368, 1, 16]
    - [115, 96.9933]
  - - [32, 2368, 1, 32]
    - [114, 193.987]
  - - [64, 2368, 1, 1]
    - [109, 12.1242]
  - - [64, 2368, 1, 16]
    - [76, 186.526]
  - - [64, 2368, 1, 32]
    - [139, 404.139]
  - - [320, 2368, 1, 1]
    - [89, 56.1304]
  - - [320, 2368, 1, 16]
    - [138, 898.086]
  - - [320, 2368, 1, 32]
    - [137, 1796.17]
  - - [576, 2368, 1, 1]
    - [66, 90.9312]
  - - [576, 2368, 1, 16]
    - [55, 1407.97]
  - - [576, 2368, 1, 32]
    - [32, 2815.93]
  - - [832, 2368, 1, 1]
    - [96, 119.405]
  - - [832, 2368, 1, 16]
    - [44, 1854.28]
  - - [832, 2368, 1, 32]
    - [101, 3708.57]
  - - [1088, 2368, 1, 1]
    - [41, 166.218]
  - - [1088, 2368, 1, 16]
    - [41, 2576.38]
  - - [1088, 2368, 1, 32]
    - [42, 5152.77]
  - - [1344, 2368, 1, 1]
    - [43, 192.884]
  - - [1344, 2368, 1, 16]
    - [43, 3182.59]
  - - [1344, 2368, 1, 32]
    - [41, 6172.3]
  - - [1600, 2368, 1, 1]
    - [43, 222.871]
  - - [1600, 2368, 1, 16]
    - [42, 3673.99]
  - - [1600, 2368, 1, 32]
    - [4, 6928.09]
  - - [1856, 2368, 1, 1]
    - [41, 251.143]
  - - [1856, 2368, 1, 16]
    - [59, 4018.29]
  - - [2112, 2368, 1, 1]
    - [38, 270.336]
  - - [2112, 2368, 1, 16]
    - [42, 4445.53]
  - - [2368, 2368, 1, 1]
    - [59, 311.524]
  - - [2368, 2368, 1, 16]
    - [41, 4849.66]
  - - [2624, 2368, 1, 1]
    - [41, 318.648]
  - - [2624, 2368, 1, 16]
    - [41, 5373.95]
  - - [2880, 2368, 1, 1]
    - [43, 349.735]
  - - [2880, 2368, 1, 16]
    - [43, 5322.8]
  - - [3136, 2368, 1, 1]
    - [38, 353.621]
  - - [3136, 2368, 1, 16]
    - [69, 5657.94]
  - - [3392, 2368, 1, 1]
    - [41, 373.593]
  - - [3648, 2368, 1, 1]
    - [42, 392.657]
  - - [3904, 2368, 1, 1]
    - [59, 401.942]
  - - [1, 2624, 1, 64]
    - [115, 14.6031]
  - - [16, 2624, 1, 64]
    - [113, 223.915]
  - - [32, 2624, 1, 64]
    - [139, 429.916]
  - - [1, 2624, 1, 1]
    - [116, 0.20992]
  - - [1, 2624, 1, 16]
    - [62, 3.35872]
  - - [1, 2624, 1, 32]
    - [21, 6.71744]
  - - [16, 2624, 1, 1]
    - [119, 3.49867]
  - - [16, 2624, 1, 16]
    - [119, 53.7395]
  - - [16, 2624, 1, 32]
    - [111, 111.957]
  - - [32, 2624, 1, 1]
    - [121, 6.71744]
  - - [32, 2624, 1, 16]
    - [113, 107.479]
  - - [32, 2624, 1, 32]
    - [133, 233.65]
  - - [64, 2624, 1, 1]
    - [113, 13.9947]
  - - [64, 2624, 1, 16]
    - [115, 206.69]
  - - [64, 2624, 1, 32]
    - [110, 429.916]
  - - [320, 2624, 1, 1]
    - [78, 62.1985]
  - - [320, 2624, 1, 16]
    - [93, 959.634]
  - - [320, 2624, 1, 32]
    - [91, 1919.27]
  - - [576, 2624, 1, 1]
    - [68, 94.464]
  - - [576, 2624, 1, 16]
    - [14, 1511.42]
  - - [576, 2624, 1, 32]
    - [32, 3022.85]
  - - [832, 2624, 1, 1]
    - [42, 132.313]
  - - [832, 2624, 1, 16]
    - [6, 1996.04]
  - - [832, 2624, 1, 32]
    - [97, 3992.08]
  - - [1088, 2624, 1, 1]
    - [42, 178.432]
  - - [1088, 2624, 1, 16]
    - [38, 2947.01]
  - - [1088, 2624, 1, 32]
    - [41, 5894.01]
  - - [1344, 2624, 1, 1]
    - [43, 213.737]
  - - [1344, 2624, 1, 16]
    - [43, 3640.42]
  - - [1344, 2624, 1, 32]
    - [43, 6839.58]
  - - [1600, 2624, 1, 1]
    - [4, 239.909]
  - - [1600, 2624, 1, 16]
    - [44, 3838.54]
  - - [1856, 2624, 1, 1]
    - [41, 278.294]
  - - [1856, 2624, 1, 16]
    - [42, 4329.02]
  - - [2112, 2624, 1, 1]
    - [43, 299.562]
  - - [2112, 2624, 1, 16]
    - [42, 4792.98]
  - - [2368, 2624, 1, 1]
    - [44, 310.682]
  - - [2368, 2624, 1, 16]
    - [41, 5098.36]
  - - [2624, 2624, 1, 1]
    - [43, 353.096]
  - - [2624, 2624, 1, 16]
    - [42, 5373.95]
  - - [2880, 2624, 1, 1]
    - [43, 368.64]
  - - [2880, 2624, 1, 16]
    - [43, 6200.71]
  - - [3136, 2624, 1, 1]
    - [38, 374.039]
  - - [3392, 2624, 1, 1]
    - [41, 404.573]
  - - [3648, 2624, 1, 1]
    - [42, 416.189]
  - - [3904, 2624, 1, 1]
    - [41, 418.126]
  - - [1, 2880, 1, 64]
    - [126, 15.36]
  - - [16, 2880, 1, 64]
    - [109, 235.93]
  - - [32, 2880, 1, 64]
    - [71, 471.859]
  - - [1, 2880, 1, 1]
    - [103, 0.2304]
  - - [1, 2880, 1, 16]
    - [115, 3.84]
  - - [1, 2880, 1, 32]
    - [113, 7.68]
  - - [16, 2880, 1, 1]
    - [110, 3.6864]
  - - [16, 2880, 1, 16]
    - [111, 61.44]
  - - [16, 2880, 1, 32]
    - [117, 122.88]
  - - [32, 2880, 1, 1]
    - [64, 7.68]
  - - [32, 2880, 1, 16]
    - [117, 122.88]
  - - [32, 2880, 1, 32]
    - [139, 245.76]
  - - [64, 2880, 1, 1]
    - [91, 14.7456]
  - - [64, 2880, 1, 16]
    - [109, 235.93]
  - - [64, 2880, 1, 32]
    - [109, 471.859]
  - - [320, 2880, 1, 1]
    - [89, 63.5586]
  - - [320, 2880, 1, 16]
    - [79, 1016.94]
  - - [320, 2880, 1, 32]
    - [49, 2106.51]
  - - [576, 2880, 1, 1]
    - [137, 100.538]
  - - [576, 2880, 1, 16]
    - [41, 1561.3]
  - - [576, 2880, 1, 32]
    - [14, 3217.22]
  - - [832, 2880, 1, 1]
    - [96, 133.12]
  - - [832, 2880, 1, 16]
    - [41, 2190.77]
  - - [832, 2880, 1, 32]
    - [97, 4946.91]
  - - [1088, 2880, 1, 1]
    - [59, 195.84]
  - - [1088, 2880, 1, 16]
    - [43, 3038.49]
  - - [1088, 2880, 1, 32]
    - [42, 6266.88]
  - - [1344, 2880, 1, 1]
    - [43, 227.689]
  - - [1344, 2880, 1, 16]
    - [43, 3538.94]
  - - [1344, 2880, 1, 32]
    - [41, 7077.89]
  - - [1600, 2880, 1, 1]
    - [42, 256.0]
  - - [1600, 2880, 1, 16]
    - [41, 4096.0]
  - - [1856, 2880, 1, 1]
    - [42, 288.934]
  - - [1856, 2880, 1, 16]
    - [59, 4622.94]
  - - [2112, 2880, 1, 1]
    - [41, 320.135]
  - - [2112, 2880, 1, 16]
    - [59, 5260.59]
  - - [2368, 2880, 1, 1]
    - [38, 332.675]
  - - [2368, 2880, 1, 16]
    - [43, 5455.87]
  - - [2624, 2880, 1, 1]
    - [41, 359.863]
  - - [2624, 2880, 1, 16]
    - [38, 5757.81]
  - - [2880, 2880, 1, 1]
    - [38, 377.018]
  - - [3136, 2880, 1, 1]
    - [41, 384.327]
  - - [3392, 2880, 1, 1]
    - [41, 407.04]
  - - [3648, 2880, 1, 1]
    - [38, 428.826]
  - - [3904, 2880, 1, 1]
    - [41, 440.922]
  - - [1, 3136, 1, 64]
    - [128, 16.7253]
  - - [16, 3136, 1, 64]
    - [22, 256.901]
  - - [32, 3136, 1, 64]
    - [121, 535.211]
  - - [1, 3136, 1, 1]
    - [22, 0.241231]
  - - [1, 3136, 1, 16]
    - [109, 4.01408]
  - - [1, 3136, 1, 32]
    - [139, 8.36267]
  - - [16, 3136, 1, 1]
    - [113, 4.18133]
  - - [16, 3136, 1, 16]
    - [113, 64.2253]
  - - [16, 3136, 1, 32]
    - [114, 133.803]
  - - [32, 3136, 1, 1]
    - [111, 8.02816]
  - - [32, 3136, 1, 16]
    - [62, 128.451]
  - - [32, 3136, 1, 32]
    - [117, 267.605]
  - - [64, 3136, 1, 1]
    - [127, 15.4388]
  - - [64, 3136, 1, 16]
    - [140, 256.901]
  - - [64, 3136, 1, 32]
    - [138, 535.211]
  - - [320, 3136, 1, 1]
    - [58, 69.2083]
  - - [320, 3136, 1, 16]
    - [36, 1070.42]
  - - [320, 3136, 1, 32]
    - [36, 2140.84]
  - - [576, 3136, 1, 1]
    - [13, 109.475]
  - - [576, 3136, 1, 16]
    - [42, 1751.6]
  - - [576, 3136, 1, 32]
    - [42, 3729.21]
  - - [832, 3136, 1, 1]
    - [59, 168.332]
  - - [832, 3136, 1, 16]
    - [42, 2693.32]
  - - [832, 3136, 1, 32]
    - [42, 5386.64]
  - - [1088, 3136, 1, 1]
    - [41, 206.786]
  - - [1088, 3136, 1, 16]
    - [59, 3411.97]
  - - [1088, 3136, 1, 32]
    - [59, 6823.94]
  - - [1344, 3136, 1, 1]
    - [41, 240.845]
  - - [1344, 3136, 1, 16]
    - [42, 3853.52]
  - - [1600, 3136, 1, 1]
    - [41, 271.222]
  - - [1600, 3136, 1, 16]
    - [38, 4339.55]
  - - [1856, 3136, 1, 1]
    - [41, 306.338]
  - - [1856, 3136, 1, 16]
    - [38, 4901.4]
  - - [2112, 3136, 1, 1]
    - [41, 331.162]
  - - [2112, 3136, 1, 16]
    - [43, 5434.45]
  - - [2368, 3136, 1, 1]
    - [42, 362.246]
  - - [2368, 3136, 1, 16]
    - [43, 5526.36]
  - - [2624, 3136, 1, 1]
    - [38, 374.039]
  - - [2880, 3136, 1, 1]
    - [43, 392.682]
  - - [3136, 3136, 1, 1]
    - [69, 418.489]
  - - [3392, 3136, 1, 1]
    - [41, 434.176]
  - - [3648, 3136, 1, 1]
    - [43, 457.605]
  - - [3904, 3136, 1, 1]
    - [41, 453.442]
  - - [1, 3392, 1, 64]
    - [122, 18.0907]
  - - [16, 3392, 1, 64]
    - [121, 289.451]
  - - [32, 3392, 1, 64]
    - [109, 578.901]
  - - [1, 3392, 1, 1]
    - [72, 0.27136]
  - - [1, 3392, 1, 16]
    - [115, 4.52267]
  - - [1, 3392, 1, 32]
    - [109, 9.04533]
  - - [16, 3392, 1, 1]
    - [121, 4.34176]
  - - [16, 3392, 1, 16]
    - [114, 72.3627]
  - - [16, 3392, 1, 32]
    - [114, 138.936]
  - - [32, 3392, 1, 1]
    - [62, 8.68352]
  - - [32, 3392, 1, 16]
    - [127, 144.725]
  - - [32, 3392, 1, 32]
    - [132, 277.873]
  - - [64, 3392, 1, 1]
    - [73, 17.367]
  - - [64, 3392, 1, 16]
    - [76, 277.873]
  - - [64, 3392, 1, 32]
    - [127, 555.745]
  - - [320, 3392, 1, 1]
    - [14, 72.3627]
  - - [320, 3392, 1, 16]
    - [55, 1197.73]
  - - [320, 3392, 1, 32]
    - [137, 2240.91]
  - - [576, 3392, 1, 1]
    - [42, 114.929]
  - - [576, 3392, 1, 16]
    - [44, 1838.86]
  - - [576, 3392, 1, 32]
    - [59, 3789.17]
  - - [832, 3392, 1, 1]
    - [60, 182.074]
  - - [832, 3392, 1, 16]
    - [96, 2913.18]
  - - [832, 3392, 1, 32]
    - [42, 5826.36]
  - - [1088, 3392, 1, 1]
    - [41, 223.666]
  - - [1088, 3392, 1, 16]
    - [59, 3578.66]
  - - [1088, 3392, 1, 32]
    - [96, 6946.82]
  - - [1344, 3392, 1, 1]
    - [61, 268.168]
  - - [1344, 3392, 1, 16]
    - [44, 4290.68]
  - - [1600, 3392, 1, 1]
    - [42, 293.362]
  - - [1600, 3392, 1, 16]
    - [38, 4693.79]
  - - [1856, 3392, 1, 1]
    - [42, 322.849]
  - - [1856, 3392, 1, 16]
    - [41, 5165.58]
  - - [2112, 3392, 1, 1]
    - [41, 358.195]
  - - [2112, 3392, 1, 16]
    - [43, 5591.34]
  - - [2368, 3392, 1, 1]
    - [42, 382.488]
  - - [2624, 3392, 1, 1]
    - [41, 386.983]
  - - [2880, 3392, 1, 1]
    - [43, 415.7]
  - - [3136, 3392, 1, 1]
    - [41, 434.176]
  - - [3392, 3392, 1, 1]
    - [42, 451.203]
  - - [3648, 3392, 1, 1]
    - [43, 475.924]
  - - [3904, 3392, 1, 1]
    - [69, 472.942]
  - - [1, 3648, 1, 64]
    - [113, 19.456]
  - - [16, 3648, 1, 64]
    - [121, 298.844]
  - - [32, 3648, 1, 64]
    - [72, 597.688]
  - - [1, 3648, 1, 1]
    - [128, 0.304]
  - - [1, 3648, 1, 16]
    - [114, 4.48985]
  - - [1, 3648, 1, 32]
    - [121, 9.728]
  - - [16, 3648, 1, 1]
    - [109, 4.66944]
  - - [16, 3648, 1, 16]
    - [114, 77.824]
  - - [16, 3648, 1, 32]
    - [111, 155.648]
  - - [32, 3648, 1, 1]
    - [72, 9.728]
  - - [32, 3648, 1, 16]
    - [73, 143.675]
  - - [32, 3648, 1, 32]
    - [113, 298.844]
  - - [64, 3648, 1, 1]
    - [137, 18.6778]
  - - [64, 3648, 1, 16]
    - [21, 298.844]
  - - [64, 3648, 1, 32]
    - [62, 597.688]
  - - [320, 3648, 1, 1]
    - [79, 80.5076]
  - - [320, 3648, 1, 16]
    - [21, 1288.12]
  - - [320, 3648, 1, 32]
    - [14, 2410.03]
  - - [576, 3648, 1, 1]
    - [13, 120.071]
  - - [576, 3648, 1, 16]
    - [4, 1921.14]
  - - [576, 3648, 1, 32]
    - [43, 3842.28]
  - - [832, 3648, 1, 1]
    - [41, 189.696]
  - - [832, 3648, 1, 16]
    - [42, 3035.14]
  - - [832, 3648, 1, 32]
    - [43, 6070.27]
  - - [1088, 3648, 1, 1]
    - [41, 233.472]
  - - [1088, 3648, 1, 16]
    - [38, 3735.55]
  - - [1344, 3648, 1, 1]
    - [69, 272.384]
  - - [1344, 3648, 1, 16]
    - [43, 4358.14]
  - - [1600, 3648, 1, 1]
    - [41, 307.2]
  - - [1600, 3648, 1, 16]
    - [41, 4915.2]
  - - [1856, 3648, 1, 1]
    - [43, 338.534]
  - - [1856, 3648, 1, 16]
    - [41, 5284.44]
  - - [2112, 3648, 1, 1]
    - [43, 375.833]
  - - [2112, 3648, 1, 16]
    - [43, 6013.33]
  - - [2368, 3648, 1, 1]
    - [41, 383.932]
  - - [2624, 3648, 1, 1]
    - [41, 407.334]
  - - [2880, 3648, 1, 1]
    - [41, 428.826]
  - - [3136, 3648, 1, 1]
    - [38, 448.632]
  - - [3392, 3648, 1, 1]
    - [41, 466.944]
  - - [3648, 3648, 1, 1]
    - [41, 483.924]
  - - [3904, 3648, 1, 1]
    - [41, 499.712]
  - - [1, 3904, 1, 64]
    - [62, 21.7266]
  - - [16, 3904, 1, 64]
    - [114, 319.816]
  - - [32, 3904, 1, 64]
    - [113, 615.03]
  - - [1, 3904, 1, 1]
    - [122, 0.31232]
  - - [1, 3904, 1, 16]
    - [110, 4.99712]
  - - [1, 3904, 1, 32]
    - [113, 9.99424]
  - - [16, 3904, 1, 1]
    - [115, 5.20533]
  - - [16, 3904, 1, 16]
    - [113, 79.9539]
  - - [16, 3904, 1, 32]
    - [117, 166.571]
  - - [32, 3904, 1, 1]
    - [72, 9.99424]
  - - [32, 3904, 1, 16]
    - [73, 159.908]
  - - [32, 3904, 1, 32]
    - [72, 319.816]
  - - [64, 3904, 1, 1]
    - [76, 19.9885]
  - - [64, 3904, 1, 16]
    - [75, 296.126]
  - - [64, 3904, 1, 32]
    - [64, 639.631]
  - - [320, 3904, 1, 1]
    - [19, 80.5987]
  - - [320, 3904, 1, 16]
    - [65, 1332.57]
  - - [320, 3904, 1, 32]
    - [96, 2579.16]
  - - [576, 3904, 1, 1]
    - [43, 128.497]
  - - [576, 3904, 1, 16]
    - [59, 2055.96]
  - - [576, 3904, 1, 32]
    - [43, 4642.49]
  - - [832, 3904, 1, 1]
    - [41, 209.557]
  - - [832, 3904, 1, 16]
    - [59, 3149.7]
  - - [832, 3904, 1, 32]
    - [41, 6299.4]
  - - [1088, 3904, 1, 1]
    - [41, 242.717]
  - - [1088, 3904, 1, 16]
    - [42, 3997.7]
  - - [1344, 3904, 1, 1]
    - [96, 291.499]
  - - [1344, 3904, 1, 16]
    - [41, 4418.51]
  - - [1600, 3904, 1, 1]
    - [41, 320.328]
  - - [1600, 3904, 1, 16]
    - [41, 5125.25]
  - - [1856, 3904, 1, 1]
    - [69, 345.039]
  - - [1856, 3904, 1, 16]
    - [41, 5655.28]
  - - [2112, 3904, 1, 1]
    - [43, 402.207]
  - - [2368, 3904, 1, 1]
    - [42, 401.942]
  - - [2624, 3904, 1, 1]
    - [41, 435.919]
  - - [2880, 3904, 1, 1]
    - [43, 449.741]
  - - [3136, 3904, 1, 1]
    - [41, 461.998]
  - - [3392, 3904, 1, 1]
    - [38, 472.942]
  - - [3648, 3904, 1, 1]
    - [41, 491.096]
  - - [3904, 3904, 1, 1]
    - [42, 499.712]
  - - [64, 1, 1, 256]
    - [15, 1.31072]
  - - [64, 16, 1, 256]
    - [62, 20.9715]
  - - [64, 32, 1, 256]
    - [88, 43.6907]
  - - [1, 64, 1, 256]
    - [118, 1.36533]
  - - [16, 64, 1, 256]
    - [111, 20.9715]
  - - [32, 64, 1, 256]
    - [110, 43.6907]
  - - [320, 1, 1, 256]
    - [129, 6.82667]
  - - [320, 16, 1, 256]
    - [118, 109.227]
  - - [320, 32, 1, 256]
    - [71, 209.715]
  - - [576, 1, 1, 256]
    - [71, 11.3428]
  - - [576, 16, 1, 256]
    - [115, 188.744]
  - - [576, 32, 1, 256]
    - [62, 377.487]
  - - [832, 1, 1, 256]
    - [115, 17.0394]
  - - [832, 16, 1, 256]
    - [116, 272.63]
  - - [832, 32, 1, 256]
    - [71, 524.288]
  - - [1088, 1, 1, 256]
    - [130, 22.2822]
  - - [1088, 16, 1, 256]
    - [46, 371.371]
  - - [1088, 32, 1, 256]
    - [110, 713.032]
  - - [1344, 1, 1, 256]
    - [110, 28.672]
  - - [1344, 16, 1, 256]
    - [88, 423.463]
  - - [1344, 32, 1, 256]
    - [71, 880.804]
  - - [1600, 1, 1, 256]
    - [71, 32.768]
  - - [1600, 16, 1, 256]
    - [73, 504.123]
  - - [1600, 32, 1, 256]
    - [111, 1092.27]
  - - [1856, 1, 1, 256]
    - [114, 38.0109]
  - - [1856, 16, 1, 256]
    - [113, 608.174]
  - - [1856, 32, 1, 256]
    - [114, 1267.03]
  - - [2112, 1, 1, 256]
    - [73, 43.2538]
  - - [2112, 16, 1, 256]
    - [115, 692.06]
  - - [2112, 32, 1, 256]
    - [117, 1330.88]
  - - [2368, 1, 1, 256]
    - [71, 46.6314]
  - - [2368, 16, 1, 256]
    - [120, 808.277]
  - - [2368, 32, 1, 256]
    - [109, 1551.89]
  - - [2624, 1, 1, 256]
    - [126, 53.7395]
  - - [2624, 16, 1, 256]
    - [115, 826.762]
  - - [2624, 32, 1, 256]
    - [62, 1592.28]
  - - [2880, 1, 1, 256]
    - [128, 56.7138]
  - - [2880, 16, 1, 256]
    - [129, 943.718]
  - - [2880, 32, 1, 256]
    - [71, 1887.44]
  - - [3136, 1, 1, 256]
    - [88, 61.7551]
  - - [3136, 16, 1, 256]
    - [118, 1027.6]
  - - [3136, 32, 1, 256]
    - [117, 2055.21]
  - - [3392, 1, 1, 256]
    - [122, 69.4682]
  - - [3392, 16, 1, 256]
    - [88, 1111.49]
  - - [3392, 32, 1, 256]
    - [110, 2137.48]
  - - [3648, 1, 1, 256]
    - [122, 71.8375]
  - - [3648, 16, 1, 256]
    - [116, 1149.4]
  - - [3648, 32, 1, 256]
    - [127, 2390.75]
  - - [3904, 1, 1, 256]
    - [133, 79.9539]
  - - [3904, 16, 1, 256]
    - [112, 1279.26]
  - - [3904, 32, 1, 256]
    - [76, 2558.53]
  - - [1, 320, 1, 256]
    - [71, 6.82667]
  - - [16, 320, 1, 256]
    - [114, 100.825]
  - - [32, 320, 1, 256]
    - [109, 209.715]
  - - [1, 576, 1, 256]
    - [111, 12.288]
  - - [16, 576, 1, 256]
    - [116, 188.744]
  - - [32, 576, 1, 256]
    - [110, 377.487]
  - - [1, 832, 1, 256]
    - [135, 17.7493]
  - - [16, 832, 1, 256]
    - [88, 272.63]
  - - [32, 832, 1, 256]
    - [118, 524.288]
  - - [1, 1088, 1, 256]
    - [114, 23.2107]
  - - [16, 1088, 1, 256]
    - [76, 356.516]
  - - [32, 1088, 1, 256]
    - [109, 742.741]
  - - [1, 1344, 1, 256]
    - [73, 27.5251]
  - - [16, 1344, 1, 256]
    - [111, 423.463]
  - - [32, 1344, 1, 256]
    - [88, 880.804]
  - - [1, 1600, 1, 256]
    - [110, 34.1333]
  - - [16, 1600, 1, 256]
    - [88, 546.133]
  - - [32, 1600, 1, 256]
    - [88, 1048.58]
  - - [1, 1856, 1, 256]
    - [88, 38.0109]
  - - [16, 1856, 1, 256]
    - [24, 608.174]
  - - [32, 1856, 1, 256]
    - [62, 1169.57]
  - - [1, 2112, 1, 256]
    - [15, 41.5902]
  - - [16, 2112, 1, 256]
    - [114, 692.06]
  - - [32, 2112, 1, 256]
    - [111, 1384.12]
  - - [1, 2368, 1, 256]
    - [125, 50.5173]
  - - [16, 2368, 1, 256]
    - [22, 775.946]
  - - [32, 2368, 1, 256]
    - [73, 1492.2]
  - - [1, 2624, 1, 256]
    - [103, 53.7395]
  - - [16, 2624, 1, 256]
    - [122, 895.659]
  - - [32, 2624, 1, 256]
    - [120, 1791.32]
  - - [1, 2880, 1, 256]
    - [116, 58.9824]
  - - [16, 2880, 1, 256]
    - [124, 983.04]
  - - [32, 2880, 1, 256]
    - [76, 1887.44]
  - - [1, 3136, 1, 256]
    - [111, 64.2253]
  - - [16, 3136, 1, 256]
    - [62, 988.081]
  - - [32, 3136, 1, 256]
    - [128, 1976.16]
  - - [1, 3392, 1, 256]
    - [118, 69.4682]
  - - [16, 3392, 1, 256]
    - [73, 1068.74]
  - - [32, 3392, 1, 256]
    - [133, 2315.61]
  - - [1, 3648, 1, 256]
    - [117, 71.8375]
  - - [16, 3648, 1, 256]
    - [118, 1195.38]
  - - [32, 3648, 1, 256]
    - [73, 2213.66]
  - - [1, 3904, 1, 256]
    - [110, 79.9539]
  - - [16, 3904, 1, 256]
    - [133, 1279.26]
  - - [32, 3904, 1, 256]
    - [110, 2460.12]
  - - [64, 1, 1, 512]
    - [71, 2.52062]
  - - [64, 16, 1, 512]
    - [118, 41.943]
  - - [64, 32, 1, 512]
    - [88, 83.8861]
  - - [1, 64, 1, 512]
    - [110, 2.62144]
  - - [16, 64, 1, 512]
    - [118, 41.943]
  - - [32, 64, 1, 512]
    - [71, 83.8861]
  - - [320, 1, 1, 512]
    - [123, 13.1072]
  - - [320, 16, 1, 512]
    - [116, 201.649]
  - - [320, 32, 1, 512]
    - [128, 403.298]
  - - [576, 1, 1, 512]
    - [114, 22.6855]
  - - [576, 16, 1, 512]
    - [71, 349.525]
  - - [576, 32, 1, 512]
    - [110, 725.937]
  - - [832, 1, 1, 512]
    - [71, 34.0787]
  - - [832, 16, 1, 512]
    - [76, 524.288]
  - - [832, 32, 1, 512]
    - [119, 1090.52]
  - - [1088, 1, 1, 512]
    - [128, 42.8505]
  - - [1088, 16, 1, 512]
    - [123, 713.032]
  - - [1088, 32, 1, 512]
    - [88, 1320.43]
  - - [1344, 1, 1, 512]
    - [88, 50.9724]
  - - [1344, 16, 1, 512]
    - [128, 846.927]
  - - [1344, 32, 1, 512]
    - [81, 1693.85]
  - - [1600, 1, 1, 512]
    - [71, 60.6815]
  - - [1600, 16, 1, 512]
    - [117, 970.904]
  - - [1600, 32, 1, 512]
    - [119, 2097.15]
  - - [1856, 1, 1, 512]
    - [126, 73.0978]
  - - [1856, 16, 1, 512]
    - [117, 1169.57]
  - - [1856, 32, 1, 512]
    - [71, 2252.5]
  - - [2112, 1, 1, 512]
    - [139, 83.1803]
  - - [2112, 16, 1, 512]
    - [117, 1281.59]
  - - [2112, 32, 1, 512]
    - [124, 2661.77]
  - - [2368, 1, 1, 512]
    - [110, 89.8086]
  - - [2368, 16, 1, 512]
    - [22, 1385.62]
  - - [2368, 32, 1, 512]
    - [71, 2771.24]
  - - [2624, 1, 1, 512]
    - [118, 99.5176]
  - - [2624, 16, 1, 512]
    - [22, 1592.28]
  - - [2624, 32, 1, 512]
    - [124, 3184.56]
  - - [2880, 1, 1, 512]
    - [114, 105.326]
  - - [2880, 16, 1, 512]
    - [81, 1685.21]
  - - [2880, 32, 1, 512]
    - [112, 3254.2]
  - - [3136, 1, 1, 512]
    - [110, 110.733]
  - - [3136, 16, 1, 512]
    - [122, 1902.97]
  - - [3136, 32, 1, 512]
    - [103, 3543.46]
  - - [3392, 1, 1, 512]
    - [126, 124.05]
  - - [3392, 16, 1, 512]
    - [111, 1916.36]
  - - [3392, 32, 1, 512]
    - [73, 3832.73]
  - - [3648, 1, 1, 512]
    - [110, 128.812]
  - - [3648, 16, 1, 512]
    - [116, 2060.99]
  - - [3648, 32, 1, 512]
    - [15, 3984.59]
  - - [3904, 1, 1, 512]
    - [88, 137.852]
  - - [3904, 16, 1, 512]
    - [112, 2205.63]
  - - [3904, 32, 1, 512]
    - [81, 4264.21]
  - - [1, 320, 1, 512]
    - [129, 13.6533]
  - - [16, 320, 1, 512]
    - [119, 201.649]
  - - [32, 320, 1, 512]
    - [112, 419.43]
  - - [1, 576, 1, 512]
    - [118, 23.593]
  - - [16, 576, 1, 512]
    - [116, 362.969]
  - - [32, 576, 1, 512]
    - [88, 725.937]
  - - [1, 832, 1, 512]
    - [119, 34.0787]
  - - [16, 832, 1, 512]
    - [88, 524.288]
  - - [32, 832, 1, 512]
    - [119, 1048.58]
  - - [1, 1088, 1, 512]
    - [103, 44.5645]
  - - [16, 1088, 1, 512]
    - [88, 713.032]
  - - [32, 1088, 1, 512]
    - [112, 1426.06]
  - - [1, 1344, 1, 512]
    - [88, 55.0502]
  - - [16, 1344, 1, 512]
    - [112, 846.927]
  - - [32, 1344, 1, 512]
    - [71, 1693.85]
  - - [1, 1600, 1, 512]
    - [133, 65.536]
  - - [16, 1600, 1, 512]
    - [112, 1008.25]
  - - [32, 1600, 1, 512]
    - [122, 2097.15]
  - - [1, 1856, 1, 512]
    - [62, 73.0978]
  - - [16, 1856, 1, 512]
    - [111, 1216.35]
  - - [32, 1856, 1, 512]
    - [111, 2432.7]
  - - [1, 2112, 1, 512]
    - [71, 86.5075]
  - - [16, 2112, 1, 512]
    - [112, 1384.12]
  - - [32, 2112, 1, 512]
    - [114, 2768.24]
  - - [1, 2368, 1, 512]
    - [118, 96.9933]
  - - [16, 2368, 1, 512]
    - [116, 1492.2]
  - - [32, 2368, 1, 512]
    - [22, 2984.41]
  - - [1, 2624, 1, 512]
    - [72, 103.345]
  - - [16, 2624, 1, 512]
    - [72, 1653.52]
  - - [32, 2624, 1, 512]
    - [112, 3307.05]
  - - [1, 2880, 1, 512]
    - [109, 113.428]
  - - [16, 2880, 1, 512]
    - [22, 1747.63]
  - - [32, 2880, 1, 512]
    - [112, 3774.87]
  - - [1, 3136, 1, 512]
    - [110, 123.51]
  - - [16, 3136, 1, 512]
    - [73, 1902.97]
  - - [32, 3136, 1, 512]
    - [117, 3952.32]
  - - [1, 3392, 1, 512]
    - [128, 133.593]
  - - [16, 3392, 1, 512]
    - [117, 2222.98]
  - - [32, 3392, 1, 512]
    - [128, 4116.63]
  - - [1, 3648, 1, 512]
    - [88, 143.675]
  - - [16, 3648, 1, 512]
    - [109, 2298.8]
  - - [32, 3648, 1, 512]
    - [126, 4427.32]
  - - [1, 3904, 1, 512]
    - [73, 153.758]
  - - [16, 3904, 1, 512]
    - [128, 2369.01]
  - - [32, 3904, 1, 512]
    - [133, 4920.24]
  - - [64, 1, 1, 1024]
    - [73, 4.85452]
  - - [64, 16, 1, 1024]
    - [116, 77.6723]
  - - [64, 32, 1, 1024]
    - [112, 155.345]
  - - [1, 64, 1, 1024]
    - [119, 5.04123]
  - - [16, 64, 1, 1024]
    - [116, 77.6723]
  - - [32, 64, 1, 1024]
    - [119, 149.797]
  - - [320, 1, 1, 1024]
    - [71, 24.2726]
  - - [320, 16, 1, 1024]
    - [112, 388.361]
  - - [320, 32, 1, 1024]
    - [119, 776.723]
  - - [576, 1, 1, 1024]
    - [112, 42.1303]
  - - [576, 16, 1, 1024]
    - [88, 699.051]
  - - [576, 32, 1, 1024]
    - [117, 1398.1]
  - - [832, 1, 1, 1024]
    - [116, 60.8549]
  - - [832, 16, 1, 1024]
    - [71, 940.103]
  - - [832, 32, 1, 1024]
    - [71, 2019.48]
  - - [1088, 1, 1, 1024]
    - [117, 76.8353]
  - - [1088, 16, 1, 1024]
    - [117, 1273.27]
  - - [1088, 32, 1, 1024]
    - [119, 2546.54]
  - - [1344, 1, 1, 1024]
    - [111, 91.7504]
  - - [1344, 16, 1, 1024]
    - [125, 1518.63]
  - - [1344, 32, 1, 1024]
    - [118, 2936.01]
  - - [1600, 1, 1, 1024]
    - [118, 109.227]
  - - [1600, 16, 1, 1024]
    - [27, 1691.25]
  - - [1600, 32, 1, 1024]
    - [110, 3495.25]
  - - [1856, 1, 1, 1024]
    - [125, 126.703]
  - - [1856, 16, 1, 1024]
    - [71, 1961.85]
  - - [1856, 32, 1, 1024]
    - [112, 3801.09]
  - - [2112, 1, 1, 1024]
    - [71, 139.528]
  - - [2112, 16, 1, 1024]
    - [72, 2232.45]
  - - [2112, 32, 1, 1024]
    - [112, 4325.38]
  - - [2368, 1, 1, 1024]
    - [71, 146.96]
  - - [2368, 16, 1, 1024]
    - [24, 2424.83]
  - - [2368, 32, 1, 1024]
    - [120, 4702.7]
  - - [2624, 1, 1, 1024]
    - [118, 167.936]
  - - [2624, 16, 1, 1024]
    - [88, 2528.92]
  - - [2624, 32, 1, 1024]
    - [120, 5211.1]
  - - [2880, 1, 1, 1024]
    - [118, 173.478]
  - - [2880, 16, 1, 1024]
    - [118, 2775.64]
  - - [2880, 32, 1, 1024]
    - [71, 5242.88]
  - - [3136, 1, 1, 1024]
    - [116, 183.501]
  - - [3136, 16, 1, 1024]
    - [116, 3022.37]
  - - [3136, 32, 1, 1024]
    - [116, 5708.91]
  - - [3392, 1, 1, 1024]
    - [112, 198.48]
  - - [3392, 16, 1, 1024]
    - [103, 3087.47]
  - - [3392, 32, 1, 1024]
    - [119, 6351.37]
  - - [3648, 1, 1, 1024]
    - [112, 201.922]
  - - [3648, 16, 1, 1024]
    - [120, 3320.49]
  - - [3648, 32, 1, 1024]
    - [118, 7471.1]
  - - [3904, 1, 1, 1024]
    - [129, 242.285]
  - - [3904, 16, 1, 1024]
    - [112, 4126.65]
  - - [1, 320, 1, 1024]
    - [118, 25.2062]
  - - [16, 320, 1, 1024]
    - [88, 388.361]
  - - [32, 320, 1, 1024]
    - [116, 776.723]
  - - [1, 576, 1, 1024]
    - [116, 42.1303]
  - - [16, 576, 1, 1024]
    - [88, 699.051]
  - - [32, 576, 1, 1024]
    - [116, 1398.1]
  - - [1, 832, 1, 1024]
    - [71, 63.1087]
  - - [16, 832, 1, 1024]
    - [119, 1048.58]
  - - [32, 832, 1, 1024]
    - [112, 2019.48]
  - - [1, 1088, 1, 1024]
    - [88, 85.7009]
  - - [16, 1088, 1, 1024]
    - [71, 1320.43]
  - - [32, 1088, 1, 1024]
    - [71, 2640.86]
  - - [1, 1344, 1, 1024]
    - [118, 101.945]
  - - [16, 1344, 1, 1024]
    - [117, 1631.12]
  - - [32, 1344, 1, 1024]
    - [116, 3387.71]
  - - [1, 1600, 1, 1024]
    - [114, 121.363]
  - - [16, 1600, 1, 1024]
    - [112, 1941.81]
  - - [32, 1600, 1, 1024]
    - [123, 4032.98]
  - - [1, 1856, 1, 1024]
    - [116, 140.781]
  - - [16, 1856, 1, 1024]
    - [118, 2252.5]
  - - [32, 1856, 1, 1024]
    - [118, 4504.99]
  - - [1, 2112, 1, 1024]
    - [71, 154.478]
  - - [16, 2112, 1, 1024]
    - [88, 2661.77]
  - - [32, 2112, 1, 1024]
    - [46, 4772.83]
  - - [1, 2368, 1, 1024]
    - [71, 173.202]
  - - [16, 2368, 1, 1024]
    - [123, 2771.24]
  - - [32, 2368, 1, 1024]
    - [123, 5747.75]
  - - [1, 2624, 1, 1024]
    - [126, 199.035]
  - - [16, 2624, 1, 1024]
    - [116, 3070.83]
  - - [32, 2624, 1, 1024]
    - [122, 6369.13]
  - - [1, 2880, 1, 1024]
    - [72, 210.651]
  - - [16, 2880, 1, 1024]
    - [88, 3254.2]
  - - [32, 2880, 1, 1024]
    - [123, 6990.51]
  - - [1, 3136, 1, 1024]
    - [118, 221.466]
  - - [16, 3136, 1, 1024]
    - [88, 3543.46]
  - - [32, 3136, 1, 1024]
    - [135, 6850.7]
  - - [1, 3392, 1, 1024]
    - [117, 277.873]
  - - [16, 3392, 1, 1024]
    - [117, 4274.96]
  - - [32, 3392, 1, 1024]
    - [133, 8233.26]
  - - [1, 3648, 1, 1024]
    - [110, 276.708]
  - - [16, 3648, 1, 1024]
    - [119, 4781.51]
  - - [32, 3648, 1, 1024]
    - [135, 8538.4]
  - - [1, 3904, 1, 1024]
    - [128, 307.515]
  - - [16, 3904, 1, 1024]
    - [113, 4920.24]
  - - [64, 1, 1, 2048]
    - [71, 9.03945]
  - - [64, 16, 1, 2048]
    - [71, 144.631]
  - - [64, 32, 1, 2048]
    - [71, 289.262]
  - - [1, 64, 1, 2048]
    - [123, 9.03945]
  - - [16, 64, 1, 2048]
    - [119, 155.345]
  - - [32, 64, 1, 2048]
    - [71, 289.262]
  - - [320, 1, 1, 2048]
    - [112, 45.1972]
  - - [320, 16, 1, 2048]
    - [71, 723.156]
  - - [320, 32, 1, 2048]
    - [71, 1497.97]
  - - [576, 1, 1, 2048]
    - [71, 81.355]
  - - [576, 16, 1, 2048]
    - [116, 1258.29]
  - - [576, 32, 1, 2048]
    - [118, 2603.36]
  - - [832, 1, 1, 2048]
    - [112, 113.596]
  - - [832, 16, 1, 2048]
    - [123, 1758.9]
  - - [832, 32, 1, 2048]
    - [123, 3635.06]
  - - [1088, 1, 1, 2048]
    - [23, 143.756]
  - - [1088, 16, 1, 2048]
    - [71, 2228.22]
  - - [1088, 32, 1, 2048]
    - [118, 4600.2]
  - - [1344, 1, 1, 2048]
    - [112, 166.819]
  - - [1344, 16, 1, 2048]
    - [72, 2590.6]
  - - [1344, 32, 1, 2048]
    - [116, 5505.02]
  - - [1600, 1, 1, 2048]
    - [116, 198.594]
  - - [1600, 16, 1, 2048]
    - [103, 2995.93]
  - - [1600, 32, 1, 2048]
    - [116, 6168.09]
  - - [1856, 1, 1, 2048]
    - [118, 245.231]
  - - [1856, 16, 1, 2048]
    - [123, 3923.7]
  - - [1856, 32, 1, 2048]
    - [118, 7602.18]
  - - [2112, 1, 1, 2048]
    - [116, 308.955]
  - - [2112, 16, 1, 2048]
    - [112, 4613.73]
  - - [2368, 1, 1, 2048]
    - [116, 334.46]
  - - [2368, 16, 1, 2048]
    - [116, 5542.47]
  - - [2624, 1, 1, 2048]
    - [116, 370.617]
  - - [2624, 16, 1, 2048]
    - [116, 5929.88]
  - - [2880, 1, 1, 2048]
    - [116, 406.775]
  - - [2880, 16, 1, 2048]
    - [116, 6291.46]
  - - [3136, 1, 1, 2048]
    - [116, 414.357]
  - - [3136, 16, 1, 2048]
    - [112, 6850.7]
  - - [3392, 1, 1, 2048]
    - [112, 448.182]
  - - [3392, 16, 1, 2048]
    - [112, 6946.82]
  - - [3648, 1, 1, 2048]
    - [120, 482.007]
  - - [3648, 16, 1, 2048]
    - [118, 7471.1]
  - - [3904, 1, 1, 2048]
    - [112, 484.569]
  - - [1, 320, 1, 2048]
    - [118, 45.1972]
  - - [16, 320, 1, 2048]
    - [116, 776.723]
  - - [32, 320, 1, 2048]
    - [71, 1497.97]
  - - [1, 576, 1, 2048]
    - [118, 81.355]
  - - [16, 576, 1, 2048]
    - [88, 1258.29]
  - - [32, 576, 1, 2048]
    - [116, 2516.58]
  - - [1, 832, 1, 2048]
    - [112, 117.513]
  - - [16, 832, 1, 2048]
    - [71, 1947.36]
  - - [32, 832, 1, 2048]
    - [123, 3894.71]
  - - [1, 1088, 1, 2048]
    - [71, 153.671]
  - - [16, 1088, 1, 2048]
    - [71, 2376.77]
  - - [32, 1088, 1, 2048]
    - [112, 4917.46]
  - - [1, 1344, 1, 2048]
    - [71, 183.501]
  - - [16, 1344, 1, 2048]
    - [88, 3037.25]
  - - [32, 1344, 1, 2048]
    - [123, 6074.51]
  - - [1, 1600, 1, 2048]
    - [116, 218.453]
  - - [16, 1600, 1, 2048]
    - [116, 3615.78]
  - - [32, 1600, 1, 2048]
    - [118, 7231.56]
  - - [1, 1856, 1, 2048]
    - [114, 281.562]
  - - [16, 1856, 1, 2048]
    - [119, 4504.99]
  - - [32, 1856, 1, 2048]
    - [116, 8688.2]
  - - [1, 2112, 1, 2048]
    - [119, 320.398]
  - - [16, 2112, 1, 2048]
    - [88, 4943.29]
  - - [1, 2368, 1, 2048]
    - [116, 359.234]
  - - [16, 2368, 1, 2048]
    - [118, 5747.75]
  - - [1, 2624, 1, 2048]
    - [88, 383.854]
  - - [16, 2624, 1, 2048]
    - [116, 6369.13]
  - - [1, 2880, 1, 2048]
    - [88, 436.907]
  - - [16, 2880, 1, 2048]
    - [114, 6740.85]
  - - [1, 3136, 1, 2048]
    - [119, 458.752]
  - - [16, 3136, 1, 2048]
    - [116, 7611.89]
  - - [1, 3392, 1, 2048]
    - [116, 496.201]
  - - [16, 3392, 1, 2048]
    - [116, 7939.22]
  - - [1, 3648, 1, 2048]
    - [116, 515.249]
  - - [16, 3648, 1, 2048]
    - [88, 8243.98]
  - - [1, 3904, 1, 2048]
    - [122, 551.406]
  - - [64, 1, 1, 4096]
    - [112, 15.8875]
  - - [64, 16, 1, 4096]
    - [123, 262.144]
  - - [64, 32, 1, 4096]
    - [112, 524.288]
  - - [1, 64, 1, 4096]
    - [71, 15.8875]
  - - [16, 64, 1, 4096]
    - [123, 254.2]
  - - [32, 64, 1, 4096]
    - [116, 524.288]
  - - [320, 1, 1, 4096]
    - [112, 79.4376]
  - - [320, 16, 1, 4096]
    - [112, 1198.37]
  - - [320, 32, 1, 4096]
    - [71, 2542.0]
  - - [576, 1, 1, 4096]
    - [71, 142.988]
  - - [576, 16, 1, 4096]
    - [112, 2157.07]
  - - [576, 32, 1, 4096]
    - [112, 4314.14]
  - - [832, 1, 1, 4096]
    - [116, 200.463]
  - - [832, 16, 1, 4096]
    - [71, 3207.41]
  - - [832, 32, 1, 4096]
    - [71, 6058.44]
  - - [1088, 1, 1, 4096]
    - [112, 278.528]
  - - [1088, 16, 1, 4096]
    - [118, 4321.4]
  - - [1344, 1, 1, 4096]
    - [118, 355.163]
  - - [1344, 16, 1, 4096]
    - [123, 5505.02]
  - - [1600, 1, 1, 4096]
    - [118, 397.188]
  - - [1600, 16, 1, 4096]
    - [116, 6355.01]
  - - [1856, 1, 1, 4096]
    - [112, 475.136]
  - - [1856, 16, 1, 4096]
    - [118, 7371.81]
  - - [2112, 1, 1, 4096]
    - [118, 540.672]
  - - [2368, 1, 1, 4096]
    - [112, 570.549]
  - - [2624, 1, 1, 4096]
    - [112, 632.23]
  - - [2880, 1, 1, 4096]
    - [116, 693.911]
  - - [3136, 1, 1, 4096]
    - [118, 694.327]
  - - [3392, 1, 1, 4096]
    - [118, 793.922]
  - - [3648, 1, 1, 4096]
    - [116, 786.432]
  - - [3904, 1, 1, 4096]
    - [120, 841.62]
  - - [1, 320, 1, 4096]
    - [112, 77.1012]
  - - [16, 320, 1, 4096]
    - [118, 1271.0]
  - - [32, 320, 1, 4096]
    - [123, 2706.0]
  - - [1, 576, 1, 4096]
    - [71, 142.988]
  - - [16, 576, 1, 4096]
    - [118, 2287.8]
  - - [32, 576, 1, 4096]
    - [71, 4575.6]
  - - [1, 832, 1, 4096]
    - [71, 206.538]
  - - [16, 832, 1, 4096]
    - [123, 3304.6]
  - - [32, 832, 1, 4096]
    - [119, 7035.61]
  - - [1, 1088, 1, 4096]
    - [119, 297.097]
  - - [16, 1088, 1, 4096]
    - [119, 4600.2]
  - - [1, 1344, 1, 4096]
    - [119, 355.163]
  - - [16, 1344, 1, 4096]
    - [119, 5872.03]
  - - [1, 1600, 1, 4096]
    - [119, 422.813]
  - - [16, 1600, 1, 4096]
    - [116, 6553.6]
  - - [1, 1856, 1, 4096]
    - [114, 460.738]
  - - [16, 1856, 1, 4096]
    - [116, 7602.18]
  - - [1, 2112, 1, 4096]
    - [119, 558.113]
  - - [1, 2368, 1, 4096]
    - [119, 606.208]
  - - [1, 2624, 1, 4096]
    - [88, 671.744]
  - - [1, 2880, 1, 4096]
    - [88, 737.28]
  - - [1, 3136, 1, 4096]
    - [88, 802.816]
  - - [1, 3392, 1, 4096]
    - [116, 817.272]
  - - [1, 3648, 1, 4096]
    - [117, 878.953]
  - - [1, 3904, 1, 4096]
    - [122, 940.634]
  - - [192, 1, 1, 64]
    - [109, 0.98304]
  - - [192, 16, 1, 64]
    - [112, 15.7286]
  - - [192, 32, 1, 64]
    - [110, 31.4573]
  - - [192, 1, 1, 1]
    - [110, 0.016]
  - - [192, 1, 1, 16]
    - [62, 0.236308]
  - - [192, 1, 1, 32]
    - [113, 0.472615]
  - - [192, 16, 1, 1]
    - [76, 0.236308]
  - - [192, 16, 1, 16]
    - [15, 3.64089]
  - - [192, 16, 1, 32]
    - [129, 7.28178]
  - - [192, 32, 1, 1]
    - [71, 0.455111]
  - - [192, 32, 1, 16]
    - [71, 7.56185]
  - - [192, 32, 1, 32]
    - [128, 14.5636]
  - - [192, 64, 1, 1]
    - [113, 0.98304]
  - - [192, 64, 1, 16]
    - [123, 15.7286]
  - - [192, 64, 1, 32]
    - [91, 30.2474]
  - - [448, 1, 1, 64]
    - [117, 2.29376]
  - - [448, 16, 1, 64]
    - [22, 35.2886]
  - - [448, 32, 1, 64]
    - [115, 73.4003]
  - - [448, 1, 1, 1]
    - [109, 0.03584]
  - - [448, 1, 1, 16]
    - [110, 0.530963]
  - - [448, 1, 1, 32]
    - [15, 1.10277]
  - - [448, 16, 1, 1]
    - [115, 0.530963]
  - - [448, 16, 1, 16]
    - [21, 8.192]
  - - [448, 16, 1, 32]
    - [114, 18.3501]
  - - [448, 32, 1, 1]
    - [8, 1.06193]
  - - [448, 32, 1, 16]
    - [21, 16.9908]
  - - [448, 32, 1, 32]
    - [113, 36.7002]
  - - [448, 64, 1, 1]
    - [121, 2.29376]
  - - [448, 64, 1, 16]
    - [120, 35.2886]
  - - [448, 64, 1, 32]
    - [73, 70.5772]
  - - [704, 1, 1, 64]
    - [121, 3.46585]
  - - [704, 16, 1, 64]
    - [114, 53.3997]
  - - [704, 32, 1, 64]
    - [73, 110.907]
  - - [704, 1, 1, 1]
    - [122, 0.05632]
  - - [704, 1, 1, 16]
    - [110, 0.866462]
  - - [704, 1, 1, 32]
    - [21, 1.60914]
  - - [704, 16, 1, 1]
    - [15, 0.83437]
  - - [704, 16, 1, 16]
    - [71, 14.4179]
  - - [704, 16, 1, 32]
    - [126, 28.8358]
  - - [704, 32, 1, 1]
    - [129, 1.80224]
  - - [704, 32, 1, 16]
    - [21, 26.6999]
  - - [704, 32, 1, 32]
    - [125, 53.3997]
  - - [704, 64, 1, 1]
    - [122, 3.60448]
  - - [704, 64, 1, 16]
    - [122, 57.6717]
  - - [704, 64, 1, 32]
    - [139, 115.343]
  - - [960, 1, 1, 64]
    - [109, 4.72615]
  - - [960, 16, 1, 64]
    - [127, 78.6432]
  - - [960, 32, 1, 64]
    - [22, 151.237]
  - - [960, 1, 1, 1]
    - [15, 0.0711111]
  - - [960, 1, 1, 16]
    - [22, 1.2288]
  - - [960, 1, 1, 32]
    - [121, 2.4576]
  - - [960, 16, 1, 1]
    - [15, 1.18154]
  - - [960, 16, 1, 16]
    - [62, 18.9046]
  - - [960, 16, 1, 32]
    - [130, 39.3216]
  - - [960, 32, 1, 1]
    - [119, 2.4576]
  - - [960, 32, 1, 16]
    - [109, 39.3216]
  - - [960, 32, 1, 32]
    - [48, 78.6432]
  - - [960, 64, 1, 1]
    - [103, 4.9152]
  - - [960, 64, 1, 16]
    - [115, 78.6432]
  - - [960, 64, 1, 32]
    - [129, 157.286]
  - - [1216, 1, 1, 64]
    - [71, 5.98646]
  - - [1216, 16, 1, 64]
    - [113, 92.2359]
  - - [1216, 32, 1, 64]
    - [122, 199.229]
  - - [1216, 1, 1, 1]
    - [88, 0.0935385]
  - - [1216, 1, 1, 16]
    - [81, 1.49662]
  - - [1216, 1, 1, 32]
    - [113, 2.99323]
  - - [1216, 16, 1, 1]
    - [115, 1.55648]
  - - [1216, 16, 1, 16]
    - [109, 23.059]
  - - [1216, 16, 1, 32]
    - [22, 47.8917]
  - - [1216, 32, 1, 1]
    - [128, 2.99323]
  - - [1216, 32, 1, 16]
    - [119, 49.8074]
  - - [1216, 32, 1, 32]
    - [111, 95.7834]
  - - [1216, 64, 1, 1]
    - [73, 5.98646]
  - - [1216, 64, 1, 16]
    - [46, 92.2359]
  - - [1216, 64, 1, 32]
    - [121, 191.567]
  - - [1472, 1, 1, 64]
    - [76, 7.24677]
  - - [1472, 16, 1, 64]
    - [22, 115.948]
  - - [1472, 32, 1, 64]
    - [117, 231.897]
  - - [1472, 1, 1, 1]
    - [73, 0.11776]
  - - [1472, 1, 1, 16]
    - [128, 1.74459]
  - - [1472, 1, 1, 32]
    - [115, 3.62338]
  - - [1472, 16, 1, 1]
    - [113, 1.88416]
  - - [1472, 16, 1, 16]
    - [64, 28.9871]
  - - [1472, 16, 1, 32]
    - [124, 57.9742]
  - - [1472, 32, 1, 1]
    - [73, 3.62338]
  - - [1472, 32, 1, 16]
    - [22, 55.827]
  - - [1472, 32, 1, 32]
    - [72, 115.948]
  - - [1472, 64, 1, 1]
    - [103, 7.24677]
  - - [1472, 64, 1, 16]
    - [110, 120.586]
  - - [1472, 64, 1, 32]
    - [127, 251.221]
  - - [1728, 1, 1, 64]
    - [129, 9.216]
  - - [1728, 16, 1, 64]
    - [110, 141.558]
  - - [1728, 32, 1, 64]
    - [130, 294.912]
  - - [1728, 1, 1, 1]
    - [115, 0.144]
  - - [1728, 1, 1, 16]
    - [122, 2.304]
  - - [1728, 1, 1, 32]
    - [127, 4.608]
  - - [1728, 16, 1, 1]
    - [113, 2.21184]
  - - [1728, 16, 1, 16]
    - [22, 34.0283]
  - - [1728, 16, 1, 32]
    - [115, 76.9336]
  - - [1728, 32, 1, 1]
    - [109, 4.42368]
  - - [1728, 32, 1, 16]
    - [127, 73.728]
  - - [1728, 32, 1, 32]
    - [115, 141.558]
  - - [1728, 64, 1, 1]
    - [115, 8.84736]
  - - [1728, 64, 1, 16]
    - [21, 136.113]
  - - [1728, 64, 1, 32]
    - [121, 272.226]
  - - [1984, 1, 1, 64]
    - [113, 10.1581]
  - - [1984, 16, 1, 64]
    - [116, 162.529]
  - - [1984, 32, 1, 64]
    - [109, 325.059]
  - - [1984, 1, 1, 1]
    - [116, 0.165333]
  - - [1984, 1, 1, 16]
    - [113, 2.64533]
  - - [1984, 1, 1, 32]
    - [109, 5.07904]
  - - [1984, 16, 1, 1]
    - [109, 2.53952]
  - - [1984, 16, 1, 16]
    - [124, 42.3253]
  - - [1984, 16, 1, 32]
    - [109, 81.2646]
  - - [1984, 32, 1, 1]
    - [111, 5.07904]
  - - [1984, 32, 1, 16]
    - [129, 78.1391]
  - - [1984, 32, 1, 32]
    - [113, 162.529]
  - - [1984, 64, 1, 1]
    - [113, 9.76738]
  - - [1984, 64, 1, 16]
    - [109, 162.529]
  - - [1984, 64, 1, 32]
    - [129, 325.059]
  - - [1, 192, 1, 64]
    - [115, 0.98304]
  - - [16, 192, 1, 64]
    - [128, 15.7286]
  - - [32, 192, 1, 64]
    - [110, 32.768]
  - - [1, 192, 1, 1]
    - [109, 0.016]
  - - [1, 192, 1, 16]
    - [120, 0.256]
  - - [1, 192, 1, 32]
    - [127, 0.512]
  - - [16, 192, 1, 1]
    - [126, 0.256]
  - - [16, 192, 1, 16]
    - [72, 3.93216]
  - - [16, 192, 1, 32]
    - [111, 8.192]
  - - [32, 192, 1, 1]
    - [116, 0.534261]
  - - [32, 192, 1, 16]
    - [115, 8.192]
  - - [32, 192, 1, 32]
    - [119, 15.7286]
  - - [64, 192, 1, 1]
    - [123, 0.98304]
  - - [64, 192, 1, 16]
    - [139, 16.384]
  - - [64, 192, 1, 32]
    - [72, 31.4573]
  - - [192, 192, 1, 1]
    - [73, 3.20557]
  - - [192, 192, 1, 16]
    - [114, 49.152]
  - - [192, 192, 1, 32]
    - [113, 94.3718]
  - - [320, 192, 1, 1]
    - [117, 5.12]
  - - [320, 192, 1, 16]
    - [72, 78.6432]
  - - [320, 192, 1, 32]
    - [110, 157.286]
  - - [448, 192, 1, 1]
    - [114, 6.88128]
  - - [448, 192, 1, 16]
    - [109, 105.866]
  - - [448, 192, 1, 32]
    - [109, 220.201]
  - - [576, 192, 1, 1]
    - [111, 9.216]
  - - [576, 192, 1, 16]
    - [74, 141.558]
  - - [576, 192, 1, 32]
    - [129, 294.912]
  - - [704, 192, 1, 1]
    - [129, 11.264]
  - - [704, 192, 1, 16]
    - [129, 166.361]
  - - [704, 192, 1, 32]
    - [113, 346.03]
  - - [832, 192, 1, 1]
    - [109, 12.7795]
  - - [832, 192, 1, 16]
    - [110, 204.472]
  - - [832, 192, 1, 32]
    - [111, 408.945]
  - - [960, 192, 1, 1]
    - [132, 14.7456]
  - - [960, 192, 1, 16]
    - [140, 245.76]
  - - [960, 192, 1, 32]
    - [72, 471.859]
  - - [1088, 192, 1, 1]
    - [115, 16.7117]
  - - [1088, 192, 1, 16]
    - [73, 267.387]
  - - [1088, 192, 1, 32]
    - [76, 534.774]
  - - [1216, 192, 1, 1]
    - [46, 18.6778]
  - - [1216, 192, 1, 16]
    - [135, 298.844]
  - - [1216, 192, 1, 32]
    - [15, 597.688]
  - - [1344, 192, 1, 1]
    - [91, 20.6438]
  - - [1344, 192, 1, 16]
    - [46, 330.301]
  - - [1344, 192, 1, 32]
    - [135, 635.195]
  - - [1472, 192, 1, 1]
    - [140, 21.7403]
  - - [1472, 192, 1, 16]
    - [15, 361.759]
  - - [1472, 192, 1, 32]
    - [46, 669.924]
  - - [1600, 192, 1, 1]
    - [27, 22.7556]
  - - [1600, 192, 1, 16]
    - [132, 378.092]
  - - [1600, 192, 1, 32]
    - [21, 786.432]
  - - [1728, 192, 1, 1]
    - [137, 26.5421]
  - - [1728, 192, 1, 16]
    - [140, 424.673]
  - - [1728, 192, 1, 32]
    - [132, 884.736]
  - - [1856, 192, 1, 1]
    - [132, 28.5082]
  - - [1856, 192, 1, 16]
    - [25, 422.343]
  - - [1856, 192, 1, 32]
    - [132, 877.174]
  - - [1984, 192, 1, 1]
    - [47, 30.4742]
  - - [1984, 192, 1, 16]
    - [21, 507.904]
  - - [1984, 192, 1, 32]
    - [30, 975.176]
  - - [192, 320, 1, 1]
    - [62, 4.9152]
  - - [192, 320, 1, 16]
    - [16, 81.92]
  - - [192, 320, 1, 32]
    - [64, 157.286]
  - - [448, 320, 1, 1]
    - [130, 11.4688]
  - - [448, 320, 1, 16]
    - [16, 183.501]
  - - [448, 320, 1, 32]
    - [26, 352.886]
  - - [704, 320, 1, 1]
    - [15, 18.7733]
  - - [704, 320, 1, 16]
    - [15, 288.358]
  - - [704, 320, 1, 32]
    - [135, 576.717]
  - - [960, 320, 1, 1]
    - [49, 23.6308]
  - - [960, 320, 1, 16]
    - [21, 378.092]
  - - [960, 320, 1, 32]
    - [90, 786.432]
  - - [1216, 320, 1, 1]
    - [137, 31.1296]
  - - [1216, 320, 1, 16]
    - [132, 498.074]
  - - [1216, 320, 1, 32]
    - [28, 957.834]
  - - [1472, 320, 1, 1]
    - [91, 37.6832]
  - - [1472, 320, 1, 16]
    - [132, 579.742]
  - - [1472, 320, 1, 32]
    - [21, 1116.54]
  - - [1728, 320, 1, 1]
    - [49, 42.5354]
  - - [1728, 320, 1, 16]
    - [132, 707.789]
  - - [1728, 320, 1, 32]
    - [84, 1361.13]
  - - [1984, 320, 1, 1]
    - [132, 48.8369]
  - - [1984, 320, 1, 16]
    - [63, 752.45]
  - - [1984, 320, 1, 32]
    - [84, 1504.9]
  - - [1, 448, 1, 64]
    - [135, 2.29376]
  - - [16, 448, 1, 64]
    - [121, 39.8915]
  - - [32, 448, 1, 64]
    - [115, 76.4587]
  - - [1, 448, 1, 1]
    - [129, 0.0373333]
  - - [1, 448, 1, 16]
    - [116, 0.551385]
  - - [1, 448, 1, 32]
    - [110, 1.14688]
  - - [16, 448, 1, 1]
    - [71, 0.551385]
  - - [16, 448, 1, 16]
    - [129, 9.55733]
  - - [16, 448, 1, 32]
    - [117, 19.1147]
  - - [32, 448, 1, 1]
    - [133, 1.19467]
  - - [32, 448, 1, 16]
    - [72, 18.3501]
  - - [32, 448, 1, 32]
    - [88, 38.2293]
  - - [64, 448, 1, 1]
    - [119, 2.49322]
  - - [64, 448, 1, 16]
    - [128, 38.2293]
  - - [64, 448, 1, 32]
    - [121, 73.4003]
  - - [192, 448, 1, 1]
    - [109, 6.88128]
  - - [192, 448, 1, 16]
    - [126, 114.688]
  - - [192, 448, 1, 32]
    - [121, 229.376]
  - - [320, 448, 1, 1]
    - [15, 11.4688]
  - - [320, 448, 1, 16]
    - [73, 183.501]
  - - [320, 448, 1, 32]
    - [81, 367.002]
  - - [448, 448, 1, 1]
    - [16, 16.0563]
  - - [448, 448, 1, 16]
    - [113, 256.901]
  - - [448, 448, 1, 32]
    - [115, 513.802]
  - - [576, 448, 1, 1]
    - [15, 20.6438]
  - - [576, 448, 1, 16]
    - [76, 330.301]
  - - [576, 448, 1, 32]
    - [15, 635.195]
  - - [704, 448, 1, 1]
    - [91, 26.2827]
  - - [704, 448, 1, 16]
    - [62, 403.702]
  - - [704, 448, 1, 32]
    - [28, 776.35]
  - - [832, 448, 1, 1]
    - [30, 28.672]
  - - [832, 448, 1, 16]
    - [27, 458.752]
  - - [832, 448, 1, 32]
    - [135, 993.963]
  - - [960, 448, 1, 1]
    - [31, 33.0831]
  - - [960, 448, 1, 16]
    - [137, 550.502]
  - - [960, 448, 1, 32]
    - [16, 1019.45]
  - - [1088, 448, 1, 1]
    - [16, 37.4942]
  - - [1088, 448, 1, 16]
    - [137, 599.906]
  - - [1088, 448, 1, 32]
    - [26, 1247.81]
  - - [1216, 448, 1, 1]
    - [137, 41.9052]
  - - [1216, 448, 1, 16]
    - [30, 670.484]
  - - [1216, 448, 1, 32]
    - [26, 1340.97]
  - - [1344, 448, 1, 1]
    - [49, 44.6009]
  - - [1344, 448, 1, 16]
    - [63, 713.614]
  - - [1344, 448, 1, 32]
    - [30, 1427.23]
  - - [1472, 448, 1, 1]
    - [49, 50.7274]
  - - [1472, 448, 1, 16]
    - [95, 781.577]
  - - [1472, 448, 1, 32]
    - [84, 1623.28]
  - - [1600, 448, 1, 1]
    - [138, 53.0963]
  - - [1600, 448, 1, 16]
    - [28, 849.541]
  - - [1600, 448, 1, 32]
    - [49, 1699.08]
  - - [1728, 448, 1, 1]
    - [63, 55.296]
  - - [1728, 448, 1, 16]
    - [28, 884.736]
  - - [1728, 448, 1, 32]
    - [105, 1835.01]
  - - [1856, 448, 1, 1]
    - [95, 61.5917]
  - - [1856, 448, 1, 16]
    - [95, 950.272]
  - - [1856, 448, 1, 32]
    - [95, 1970.93]
  - - [1984, 448, 1, 1]
    - [85, 61.2988]
  - - [1984, 448, 1, 16]
    - [33, 1015.81]
  - - [1984, 448, 1, 32]
    - [78, 1961.56]
  - - [192, 576, 1, 1]
    - [62, 8.84736]
  - - [192, 576, 1, 16]
    - [122, 147.456]
  - - [192, 576, 1, 32]
    - [122, 283.116]
  - - [448, 576, 1, 1]
    - [135, 20.6438]
  - - [448, 576, 1, 16]
    - [89, 317.598]
  - - [448, 576, 1, 32]
    - [91, 635.195]
  - - [704, 576, 1, 1]
    - [77, 30.0373]
  - - [704, 576, 1, 16]
    - [79, 480.597]
  - - [704, 576, 1, 32]
    - [95, 998.164]
  - - [960, 576, 1, 1]
    - [89, 44.2368]
  - - [960, 576, 1, 16]
    - [85, 631.954]
  - - [960, 576, 1, 32]
    - [30, 1310.72]
  - - [1216, 576, 1, 1]
    - [138, 51.8827]
  - - [1216, 576, 1, 16]
    - [137, 800.475]
  - - [1216, 576, 1, 32]
    - [138, 1724.1]
  - - [1472, 576, 1, 1]
    - [78, 62.8053]
  - - [1472, 576, 1, 16]
    - [89, 1004.89]
  - - [1472, 576, 1, 32]
    - [89, 1937.99]
  - - [1728, 576, 1, 1]
    - [34, 66.3552]
  - - [1728, 576, 1, 16]
    - [56, 1098.29]
  - - [1728, 576, 1, 32]
    - [50, 2196.59]
  - - [1984, 576, 1, 1]
    - [137, 78.8127]
  - - [1984, 576, 1, 16]
    - [51, 1218.97]
  - - [1984, 576, 1, 32]
    - [78, 2437.94]
  - - [1, 704, 1, 64]
    - [71, 3.75467]
  - - [16, 704, 1, 64]
    - [139, 60.0747]
  - - [32, 704, 1, 64]
    - [117, 115.343]
  - - [1, 704, 1, 1]
    - [139, 0.0541538]
  - - [1, 704, 1, 16]
    - [138, 0.90112]
  - - [1, 704, 1, 32]
    - [139, 1.80224]
  - - [16, 704, 1, 1]
    - [110, 0.90112]
  - - [16, 704, 1, 16]
    - [130, 13.8634]
  - - [16, 704, 1, 32]
    - [118, 28.8358]
  - - [32, 704, 1, 1]
    - [71, 1.73292]
  - - [32, 704, 1, 16]
    - [139, 28.8358]
  - - [32, 704, 1, 32]
    - [117, 55.4535]
  - - [64, 704, 1, 1]
    - [139, 3.46585]
  - - [64, 704, 1, 16]
    - [127, 55.4535]
  - - [64, 704, 1, 32]
    - [129, 115.343]
  - - [192, 704, 1, 1]
    - [126, 10.8134]
  - - [192, 704, 1, 16]
    - [48, 173.015]
  - - [192, 704, 1, 32]
    - [110, 332.721]
  - - [320, 704, 1, 1]
    - [137, 18.0224]
  - - [320, 704, 1, 16]
    - [132, 277.268]
  - - [320, 704, 1, 32]
    - [15, 533.997]
  - - [448, 704, 1, 1]
    - [138, 25.2314]
  - - [448, 704, 1, 16]
    - [135, 403.702]
  - - [448, 704, 1, 32]
    - [135, 747.596]
  - - [576, 704, 1, 1]
    - [84, 31.1926]
  - - [576, 704, 1, 16]
    - [138, 499.082]
  - - [576, 704, 1, 32]
    - [83, 1038.09]
  - - [704, 704, 1, 1]
    - [95, 38.1243]
  - - [704, 704, 1, 16]
    - [95, 634.388]
  - - [704, 704, 1, 32]
    - [138, 1219.98]
  - - [832, 704, 1, 1]
    - [83, 45.056]
  - - [832, 704, 1, 16]
    - [89, 694.196]
  - - [832, 704, 1, 32]
    - [132, 1441.79]
  - - [960, 704, 1, 1]
    - [83, 48.2743]
  - - [960, 704, 1, 16]
    - [78, 772.389]
  - - [960, 704, 1, 32]
    - [89, 1663.61]
  - - [1088, 704, 1, 1]
    - [63, 54.7109]
  - - [1088, 704, 1, 16]
    - [137, 907.795]
  - - [1088, 704, 1, 32]
    - [138, 1815.59]
  - - [1216, 704, 1, 1]
    - [16, 61.1474]
  - - [1216, 704, 1, 16]
    - [28, 944.622]
  - - [1216, 704, 1, 32]
    - [91, 2029.19]
  - - [1344, 704, 1, 1]
    - [89, 67.584]
  - - [1344, 704, 1, 16]
    - [104, 1081.34]
  - - [1344, 704, 1, 32]
    - [78, 2088.11]
  - - [1472, 704, 1, 1]
    - [65, 71.4681]
  - - [1472, 704, 1, 16]
    - [54, 1143.49]
  - - [1472, 704, 1, 32]
    - [51, 2286.98]
  - - [1600, 704, 1, 1]
    - [67, 77.6828]
  - - [1600, 704, 1, 16]
    - [69, 1242.92]
  - - [1600, 704, 1, 32]
    - [93, 2402.99]
  - - [1728, 704, 1, 1]
    - [104, 81.1008]
  - - [1728, 704, 1, 16]
    - [54, 1255.75]
  - - [1728, 704, 1, 32]
    - [18, 2511.51]
  - - [1856, 704, 1, 1]
    - [94, 87.1083]
  - - [1856, 704, 1, 16]
    - [41, 1348.77]
  - - [1856, 704, 1, 32]
    - [32, 2697.55]
  - - [1984, 704, 1, 1]
    - [33, 90.112]
  - - [1984, 704, 1, 16]
    - [86, 1489.85]
  - - [1984, 704, 1, 32]
    - [28, 2883.58]
  - - [192, 832, 1, 1]
    - [131, 13.312]
  - - [192, 832, 1, 16]
    - [109, 196.608]
  - - [192, 832, 1, 32]
    - [22, 393.216]
  - - [448, 832, 1, 1]
    - [48, 28.672]
  - - [448, 832, 1, 16]
    - [137, 477.102]
  - - [448, 832, 1, 32]
    - [132, 993.963]
  - - [704, 832, 1, 1]
    - [132, 43.3873]
  - - [704, 832, 1, 16]
    - [132, 624.777]
  - - [704, 832, 1, 32]
    - [135, 1441.79]
  - - [960, 832, 1, 1]
    - [137, 59.1644]
  - - [960, 832, 1, 16]
    - [96, 881.346]
  - - [960, 832, 1, 32]
    - [137, 1825.65]
  - - [1216, 832, 1, 1]
    - [79, 67.4475]
  - - [1216, 832, 1, 16]
    - [56, 1116.37]
  - - [1216, 832, 1, 32]
    - [58, 2232.74]
  - - [1472, 832, 1, 1]
    - [137, 81.6469]
  - - [1472, 832, 1, 16]
    - [56, 1306.35]
  - - [1472, 832, 1, 32]
    - [97, 2612.7]
  - - [1728, 832, 1, 1]
    - [87, 92.7546]
  - - [1728, 832, 1, 16]
    - [65, 1484.07]
  - - [1728, 832, 1, 32]
    - [93, 2968.15]
  - - [1984, 832, 1, 1]
    - [137, 97.0993]
  - - [1984, 832, 1, 16]
    - [97, 1600.67]
  - - [1984, 832, 1, 32]
    - [96, 3301.38]
  - - [1, 960, 1, 64]
    - [120, 4.9152]
  - - [16, 960, 1, 64]
    - [139, 78.6432]
  - - [32, 960, 1, 64]
    - [113, 145.636]
  - - [1, 960, 1, 1]
    - [115, 0.0768]
  - - [1, 960, 1, 16]
    - [81, 1.18154]
  - - [1, 960, 1, 32]
    - [111, 2.4576]
  - - [16, 960, 1, 1]
    - [109, 1.18154]
  - - [16, 960, 1, 16]
    - [122, 19.6608]
  - - [16, 960, 1, 32]
    - [114, 37.8092]
  - - [32, 960, 1, 1]
    - [121, 2.36308]
  - - [32, 960, 1, 16]
    - [115, 39.3216]
  - - [32, 960, 1, 32]
    - [62, 78.6432]
  - - [64, 960, 1, 1]
    - [23, 4.9152]
  - - [64, 960, 1, 16]
    - [129, 78.6432]
  - - [64, 960, 1, 32]
    - [115, 151.237]
  - - [192, 960, 1, 1]
    - [109, 13.6533]
  - - [192, 960, 1, 16]
    - [73, 226.855]
  - - [192, 960, 1, 32]
    - [89, 436.907]
  - - [320, 960, 1, 1]
    - [132, 23.6308]
  - - [320, 960, 1, 16]
    - [76, 351.086]
  - - [320, 960, 1, 32]
    - [83, 728.178]
  - - [448, 960, 1, 1]
    - [47, 30.72]
  - - [448, 960, 1, 16]
    - [137, 509.724]
  - - [448, 960, 1, 32]
    - [137, 1019.45]
  - - [576, 960, 1, 1]
    - [138, 40.96]
  - - [576, 960, 1, 16]
    - [132, 680.566]
  - - [576, 960, 1, 32]
    - [138, 1361.13]
  - - [704, 960, 1, 1]
    - [137, 48.2743]
  - - [704, 960, 1, 16]
    - [132, 772.389]
  - - [704, 960, 1, 32]
    - [138, 1601.99]
  - - [832, 960, 1, 1]
    - [138, 59.1644]
  - - [832, 960, 1, 16]
    - [78, 881.346]
  - - [832, 960, 1, 32]
    - [78, 2044.72]
  - - [960, 960, 1, 1]
    - [89, 63.5586]
  - - [960, 960, 1, 16]
    - [78, 1016.94]
  - - [960, 960, 1, 32]
    - [89, 2106.51]
  - - [1088, 960, 1, 1]
    - [78, 69.632]
  - - [1088, 960, 1, 16]
    - [78, 1152.53]
  - - [1088, 960, 1, 32]
    - [66, 2156.35]
  - - [1216, 960, 1, 1]
    - [67, 77.824]
  - - [1216, 960, 1, 16]
    - [78, 1245.18]
  - - [1216, 960, 1, 32]
    - [78, 2410.03]
  - - [1344, 960, 1, 1]
    - [137, 86.016]
  - - [1344, 960, 1, 16]
    - [86, 1331.86]
  - - [1344, 960, 1, 32]
    - [66, 2663.72]
  - - [1472, 960, 1, 1]
    - [66, 91.169]
  - - [1472, 960, 1, 16]
    - [137, 1413.12]
  - - [1472, 960, 1, 32]
    - [89, 2826.24]
  - - [1600, 960, 1, 1]
    - [97, 99.0968]
  - - [1600, 960, 1, 16]
    - [87, 1489.45]
  - - [1600, 960, 1, 32]
    - [59, 2978.91]
  - - [1728, 960, 1, 1]
    - [101, 97.5812]
  - - [1728, 960, 1, 16]
    - [97, 1658.88]
  - - [1728, 960, 1, 32]
    - [99, 3317.76]
  - - [1856, 960, 1, 1]
    - [98, 104.809]
  - - [1856, 960, 1, 16]
    - [87, 1727.77]
  - - [1856, 960, 1, 32]
    - [97, 3455.53]
  - - [1984, 960, 1, 1]
    - [97, 112.038]
  - - [1984, 960, 1, 16]
    - [137, 1846.92]
  - - [1984, 960, 1, 32]
    - [43, 3585.2]
  - - [192, 1088, 1, 1]
    - [127, 16.7117]
  - - [192, 1088, 1, 16]
    - [73, 238.738]
  - - [192, 1088, 1, 32]
    - [140, 477.477]
  - - [448, 1088, 1, 1]
    - [26, 33.6154]
  - - [448, 1088, 1, 16]
    - [132, 537.847]
  - - [448, 1088, 1, 32]
    - [132, 1155.38]
  - - [704, 1088, 1, 1]
    - [132, 54.7109]
  - - [704, 1088, 1, 16]
    - [137, 907.795]
  - - [704, 1088, 1, 32]
    - [137, 1750.75]
  - - [960, 1088, 1, 1]
    - [137, 69.632]
  - - [960, 1088, 1, 16]
    - [132, 1114.11]
  - - [960, 1088, 1, 32]
    - [95, 2228.22]
  - - [1216, 1088, 1, 1]
    - [94, 85.3554]
  - - [1216, 1088, 1, 16]
    - [97, 1365.69]
  - - [1216, 1088, 1, 32]
    - [107, 2646.02]
  - - [1472, 1088, 1, 1]
    - [99, 97.0628]
  - - [1472, 1088, 1, 16]
    - [97, 1507.33]
  - - [1472, 1088, 1, 32]
    - [97, 3203.07]
  - - [1728, 1088, 1, 1]
    - [69, 110.592]
  - - [1728, 1088, 1, 16]
    - [87, 1718.92]
  - - [1728, 1088, 1, 32]
    - [97, 3437.83]
  - - [1984, 1088, 1, 1]
    - [137, 119.922]
  - - [1984, 1088, 1, 16]
    - [96, 1973.57]
  - - [1984, 1088, 1, 32]
    - [59, 4317.18]
  - - [1, 1216, 1, 64]
    - [109, 6.22592]
  - - [16, 1216, 1, 64]
    - [126, 95.7834]
  - - [32, 1216, 1, 64]
    - [113, 191.567]
  - - [1, 1216, 1, 1]
    - [71, 0.09728]
  - - [1, 1216, 1, 16]
    - [128, 1.49662]
  - - [1, 1216, 1, 32]
    - [47, 2.88237]
  - - [16, 1216, 1, 1]
    - [115, 1.55648]
  - - [16, 1216, 1, 16]
    - [116, 23.9458]
  - - [16, 1216, 1, 32]
    - [114, 47.8917]
  - - [32, 1216, 1, 1]
    - [128, 2.88237]
  - - [32, 1216, 1, 16]
    - [117, 49.8074]
  - - [32, 1216, 1, 32]
    - [115, 99.6147]
  - - [64, 1216, 1, 1]
    - [121, 6.22592]
  - - [64, 1216, 1, 16]
    - [110, 95.7834]
  - - [64, 1216, 1, 32]
    - [125, 191.567]
  - - [192, 1216, 1, 1]
    - [127, 17.9594]
  - - [192, 1216, 1, 16]
    - [17, 276.708]
  - - [192, 1216, 1, 32]
    - [89, 553.415]
  - - [320, 1216, 1, 1]
    - [27, 27.7943]
  - - [320, 1216, 1, 16]
    - [64, 444.709]
  - - [320, 1216, 1, 32]
    - [21, 889.417]
  - - [448, 1216, 1, 1]
    - [16, 36.3179]
  - - [448, 1216, 1, 16]
    - [14, 581.086]
  - - [448, 1216, 1, 32]
    - [138, 1291.3]
  - - [576, 1216, 1, 1]
    - [49, 46.6944]
  - - [576, 1216, 1, 16]
    - [132, 800.475]
  - - [576, 1216, 1, 32]
    - [132, 1494.22]
  - - [704, 1216, 1, 1]
    - [137, 59.0389]
  - - [704, 1216, 1, 16]
    - [137, 944.622]
  - - [704, 1216, 1, 32]
    - [137, 1956.72]
  - - [832, 1216, 1, 1]
    - [137, 69.7732]
  - - [832, 1216, 1, 16]
    - [137, 1116.37]
  - - [832, 1216, 1, 32]
    - [86, 2232.74]
  - - [960, 1216, 1, 1]
    - [137, 75.3135]
  - - [960, 1216, 1, 16]
    - [137, 1245.18]
  - - [960, 1216, 1, 32]
    - [66, 2576.24]
  - - [1088, 1216, 1, 1]
    - [93, 85.3554]
  - - [1088, 1216, 1, 16]
    - [137, 1365.69]
  - - [1088, 1216, 1, 32]
    - [66, 2731.37]
  - - [1216, 1216, 1, 1]
    - [67, 95.3972]
  - - [1216, 1216, 1, 16]
    - [104, 1526.35]
  - - [1216, 1216, 1, 32]
    - [86, 2957.31]
  - - [1344, 1216, 1, 1]
    - [137, 99.0487]
  - - [1344, 1216, 1, 16]
    - [61, 1584.78]
  - - [1344, 1216, 1, 32]
    - [97, 3169.56]
  - - [1472, 1216, 1, 1]
    - [69, 108.482]
  - - [1472, 1216, 1, 16]
    - [69, 1684.66]
  - - [1472, 1216, 1, 32]
    - [59, 3369.32]
  - - [1600, 1216, 1, 1]
    - [69, 111.177]
  - - [1600, 1216, 1, 16]
    - [69, 1831.15]
  - - [1600, 1216, 1, 32]
    - [78, 3557.67]
  - - [1728, 1216, 1, 1]
    - [69, 116.736]
  - - [1728, 1216, 1, 16]
    - [43, 1977.65]
  - - [1728, 1216, 1, 32]
    - [87, 3735.55]
  - - [1856, 1216, 1, 1]
    - [41, 121.994]
  - - [1856, 1216, 1, 16]
    - [38, 2063.45]
  - - [1856, 1216, 1, 32]
    - [59, 4377.01]
  - - [1984, 1216, 1, 1]
    - [61, 146.215]
  - - [1984, 1216, 1, 16]
    - [43, 2270.63]
  - - [1984, 1216, 1, 32]
    - [41, 4541.26]
  - - [192, 1344, 1, 1]
    - [135, 20.6438]
  - - [192, 1344, 1, 16]
    - [16, 305.835]
  - - [192, 1344, 1, 32]
    - [15, 611.669]
  - - [448, 1344, 1, 1]
    - [63, 43.008]
  - - [448, 1344, 1, 16]
    - [89, 688.128]
  - - [448, 1344, 1, 32]
    - [21, 1284.51]
  - - [704, 1344, 1, 1]
    - [138, 65.2535]
  - - [704, 1344, 1, 16]
    - [137, 1044.06]
  - - [704, 1344, 1, 32]
    - [138, 2088.11]
  - - [960, 1344, 1, 1]
    - [132, 83.2413]
  - - [960, 1344, 1, 16]
    - [137, 1331.86]
  - - [960, 1344, 1, 32]
    - [132, 2580.48]
  - - [1216, 1344, 1, 1]
    - [137, 99.0487]
  - - [1216, 1344, 1, 16]
    - [69, 1538.17]
  - - [1216, 1344, 1, 32]
    - [96, 3076.34]
  - - [1472, 1344, 1, 1]
    - [79, 113.05]
  - - [1472, 1344, 1, 16]
    - [96, 1808.79]
  - - [1472, 1344, 1, 32]
    - [96, 3723.99]
  - - [1728, 1344, 1, 1]
    - [41, 125.537]
  - - [1728, 1344, 1, 16]
    - [96, 2064.38]
  - - [1728, 1344, 1, 32]
    - [41, 4504.11]
  - - [1984, 1344, 1, 1]
    - [38, 172.032]
  - - [1984, 1344, 1, 16]
    - [14, 2666.5]
  - - [1984, 1344, 1, 32]
    - [60, 5505.02]
  - - [1, 1472, 1, 64]
    - [128, 7.53664]
  - - [16, 1472, 1, 64]
    - [124, 115.948]
  - - [32, 1472, 1, 64]
    - [125, 241.172]
  - - [1, 1472, 1, 1]
    - [109, 0.11776]
  - - [1, 1472, 1, 16]
    - [15, 1.81169]
  - - [1, 1472, 1, 32]
    - [139, 3.76832]
  - - [16, 1472, 1, 1]
    - [111, 1.68229]
  - - [16, 1472, 1, 16]
    - [116, 28.9871]
  - - [16, 1472, 1, 32]
    - [23, 55.827]
  - - [32, 1472, 1, 1]
    - [113, 3.62338]
  - - [32, 1472, 1, 16]
    - [129, 57.9742]
  - - [32, 1472, 1, 32]
    - [115, 115.948]
  - - [64, 1472, 1, 1]
    - [21, 7.24677]
  - - [64, 1472, 1, 16]
    - [103, 111.654]
  - - [64, 1472, 1, 32]
    - [22, 223.308]
  - - [192, 1472, 1, 1]
    - [46, 20.9351]
  - - [192, 1472, 1, 16]
    - [135, 347.845]
  - - [192, 1472, 1, 32]
    - [90, 669.924]
  - - [320, 1472, 1, 1]
    - [26, 31.4027]
  - - [320, 1472, 1, 16]
    - [21, 519.768]
  - - [320, 1472, 1, 32]
    - [31, 1076.66]
  - - [448, 1472, 1, 1]
    - [137, 45.4797]
  - - [448, 1472, 1, 16]
    - [7, 680.729]
  - - [448, 1472, 1, 32]
    - [49, 1455.35]
  - - [576, 1472, 1, 1]
    - [137, 58.4739]
  - - [576, 1472, 1, 16]
    - [138, 935.583]
  - - [576, 1472, 1, 32]
    - [137, 1871.17]
  - - [704, 1472, 1, 1]
    - [137, 71.4681]
  - - [704, 1472, 1, 16]
    - [137, 1105.37]
  - - [704, 1472, 1, 32]
    - [137, 2210.75]
  - - [832, 1472, 1, 1]
    - [137, 79.0132]
  - - [832, 1472, 1, 16]
    - [137, 1264.21]
  - - [832, 1472, 1, 32]
    - [93, 2612.7]
  - - [960, 1472, 1, 1]
    - [97, 88.32]
  - - [960, 1472, 1, 16]
    - [89, 1413.12]
  - - [960, 1472, 1, 32]
    - [86, 2917.41]
  - - [1088, 1472, 1, 1]
    - [99, 97.0628]
  - - [1088, 1472, 1, 16]
    - [96, 1553.0]
  - - [1088, 1472, 1, 32]
    - [87, 3106.01]
  - - [1216, 1472, 1, 1]
    - [89, 105.291]
  - - [1216, 1472, 1, 16]
    - [69, 1636.53]
  - - [1216, 1472, 1, 32]
    - [97, 3369.32]
  - - [1344, 1472, 1, 1]
    - [69, 113.05]
  - - [1344, 1472, 1, 16]
    - [69, 1808.79]
  - - [1344, 1472, 1, 32]
    - [96, 3617.59]
  - - [1472, 1472, 1, 1]
    - [96, 127.458]
  - - [1472, 1472, 1, 16]
    - [59, 1926.03]
  - - [1472, 1472, 1, 32]
    - [97, 4333.57]
  - - [1600, 1472, 1, 1]
    - [43, 142.739]
  - - [1600, 1472, 1, 16]
    - [41, 2036.93]
  - - [1600, 1472, 1, 32]
    - [96, 4433.32]
  - - [1728, 1472, 1, 1]
    - [43, 169.574]
  - - [1728, 1472, 1, 16]
    - [42, 2625.67]
  - - [1728, 1472, 1, 32]
    - [41, 5251.34]
  - - [1856, 1472, 1, 1]
    - [69, 176.26]
  - - [1856, 1472, 1, 16]
    - [38, 2820.16]
  - - [1856, 1472, 1, 32]
    - [61, 5464.06]
  - - [1984, 1472, 1, 1]
    - [41, 188.416]
  - - [1984, 1472, 1, 16]
    - [97, 2920.45]
  - - [1984, 1472, 1, 32]
    - [42, 6029.31]
  - - [192, 1600, 1, 1]
    - [46, 24.576]
  - - [192, 1600, 1, 16]
    - [89, 378.092]
  - - [192, 1600, 1, 32]
    - [129, 728.178]
  - - [448, 1600, 1, 1]
    - [89, 49.4345]
  - - [448, 1600, 1, 16]
    - [132, 790.952]
  - - [448, 1600, 1, 32]
    - [89, 1581.9]
  - - [704, 1600, 1, 1]
    - [137, 75.0933]
  - - [704, 1600, 1, 16]
    - [137, 1201.49]
  - - [704, 1600, 1, 32]
    - [132, 2402.99]
  - - [960, 1600, 1, 1]
    - [98, 93.0909]
  - - [960, 1600, 1, 16]
    - [138, 1489.45]
  - - [960, 1600, 1, 32]
    - [138, 2978.91]
  - - [1216, 1600, 1, 1]
    - [99, 117.915]
  - - [1216, 1600, 1, 16]
    - [91, 1778.83]
  - - [1216, 1600, 1, 32]
    - [89, 3662.31]
  - - [1472, 1600, 1, 1]
    - [96, 130.844]
  - - [1472, 1600, 1, 16]
    - [59, 2036.93]
  - - [1472, 1600, 1, 32]
    - [36, 4306.65]
  - - [1728, 1600, 1, 1]
    - [61, 184.32]
  - - [1728, 1600, 1, 16]
    - [100, 2949.12]
  - - [1728, 1600, 1, 32]
    - [42, 5529.6]
  - - [1984, 1600, 1, 1]
    - [38, 192.388]
  - - [1984, 1600, 1, 16]
    - [38, 3078.21]
  - - [1984, 1600, 1, 32]
    - [59, 6553.6]
  - - [1, 1728, 1, 64]
    - [109, 8.50708]
  - - [16, 1728, 1, 64]
    - [139, 141.558]
  - - [32, 1728, 1, 64]
    - [76, 252.782]
  - - [1, 1728, 1, 1]
    - [111, 0.13824]
  - - [1, 1728, 1, 16]
    - [22, 2.12677]
  - - [1, 1728, 1, 32]
    - [132, 4.096]
  - - [16, 1728, 1, 1]
    - [119, 2.12677]
  - - [16, 1728, 1, 16]
    - [128, 36.864]
  - - [16, 1728, 1, 32]
    - [122, 68.0566]
  - - [32, 1728, 1, 1]
    - [139, 4.42368]
  - - [32, 1728, 1, 16]
    - [21, 68.0566]
  - - [32, 1728, 1, 32]
    - [126, 136.113]
  - - [64, 1728, 1, 1]
    - [62, 8.50708]
  - - [64, 1728, 1, 16]
    - [121, 136.113]
  - - [64, 1728, 1, 32]
    - [133, 272.226]
  - - [192, 1728, 1, 1]
    - [49, 24.576]
  - - [192, 1728, 1, 16]
    - [47, 379.173]
  - - [192, 1728, 1, 32]
    - [48, 758.345]
  - - [320, 1728, 1, 1]
    - [132, 38.1352]
  - - [320, 1728, 1, 16]
    - [132, 610.163]
  - - [320, 1728, 1, 32]
    - [21, 1179.65]
  - - [448, 1728, 1, 1]
    - [138, 53.3892]
  - - [448, 1728, 1, 16]
    - [49, 854.228]
  - - [448, 1728, 1, 32]
    - [132, 1708.46]
  - - [576, 1728, 1, 1]
    - [137, 64.2147]
  - - [576, 1728, 1, 16]
    - [59, 1027.44]
  - - [576, 1728, 1, 32]
    - [137, 2196.59]
  - - [704, 1728, 1, 1]
    - [137, 76.032]
  - - [704, 1728, 1, 16]
    - [132, 1216.51]
  - - [704, 1728, 1, 32]
    - [132, 2433.02]
  - - [832, 1728, 1, 1]
    - [36, 87.1331]
  - - [832, 1728, 1, 16]
    - [96, 1394.13]
  - - [832, 1728, 1, 32]
    - [86, 2788.26]
  - - [960, 1728, 1, 1]
    - [96, 100.538]
  - - [960, 1728, 1, 16]
    - [101, 1658.88]
  - - [960, 1728, 1, 32]
    - [98, 3217.22]
  - - [1088, 1728, 1, 1]
    - [96, 107.432]
  - - [1088, 1728, 1, 16]
    - [96, 1718.92]
  - - [1088, 1728, 1, 32]
    - [97, 3538.94]
  - - [1216, 1728, 1, 1]
    - [98, 120.071]
  - - [1216, 1728, 1, 16]
    - [69, 1921.14]
  - - [1216, 1728, 1, 32]
    - [101, 3955.29]
  - - [1344, 1728, 1, 1]
    - [43, 136.614]
  - - [1344, 1728, 1, 16]
    - [97, 2123.37]
  - - [1344, 1728, 1, 32]
    - [43, 4504.11]
  - - [1472, 1728, 1, 1]
    - [59, 164.104]
  - - [1472, 1728, 1, 16]
    - [44, 2713.19]
  - - [1472, 1728, 1, 32]
    - [96, 5251.34]
  - - [1600, 1728, 1, 1]
    - [39, 172.8]
  - - [1600, 1728, 1, 16]
    - [69, 2853.99]
  - - [1600, 1728, 1, 32]
    - [41, 5707.97]
  - - [1728, 1728, 1, 1]
    - [38, 180.969]
  - - [1728, 1728, 1, 16]
    - [38, 2985.98]
  - - [1728, 1728, 1, 32]
    - [42, 6164.61]
  - - [1856, 1728, 1, 1]
    - [43, 200.448]
  - - [1856, 1728, 1, 16]
    - [42, 3109.98]
  - - [1856, 1728, 1, 32]
    - [43, 6414.34]
  - - [1984, 1728, 1, 1]
    - [97, 207.779]
  - - [1984, 1728, 1, 16]
    - [38, 3538.94]
  - - [1984, 1728, 1, 32]
    - [97, 6856.7]
  - - [192, 1856, 1, 1]
    - [132, 28.5082]
  - - [192, 1856, 1, 16]
    - [135, 438.587]
  - - [192, 1856, 1, 32]
    - [132, 844.686]
  - - [448, 1856, 1, 1]
    - [89, 55.4325]
  - - [448, 1856, 1, 16]
    - [132, 917.504]
  - - [448, 1856, 1, 32]
    - [132, 1835.01]
  - - [704, 1856, 1, 1]
    - [137, 84.2983]
  - - [704, 1856, 1, 16]
    - [137, 1348.77]
  - - [704, 1856, 1, 32]
    - [92, 2613.25]
  - - [960, 1856, 1, 1]
    - [97, 107.985]
  - - [960, 1856, 1, 16]
    - [97, 1676.95]
  - - [960, 1856, 1, 32]
    - [96, 3455.53]
  - - [1216, 1856, 1, 1]
    - [96, 121.994]
  - - [1216, 1856, 1, 16]
    - [97, 2006.13]
  - - [1216, 1856, 1, 32]
    - [42, 4513.79]
  - - [1472, 1856, 1, 1]
    - [43, 182.135]
  - - [1472, 1856, 1, 16]
    - [44, 2820.16]
  - - [1472, 1856, 1, 32]
    - [96, 5640.32]
  - - [1728, 1856, 1, 1]
    - [43, 206.914]
  - - [1728, 1856, 1, 16]
    - [43, 3207.17]
  - - [1728, 1856, 1, 32]
    - [41, 6414.34]
  - - [1984, 1856, 1, 1]
    - [38, 216.606]
  - - [1984, 1856, 1, 16]
    - [37, 3465.7]
  - - [1984, 1856, 1, 32]
    - [96, 6931.4]
  - - [1, 1984, 1, 64]
    - [128, 10.1581]
  - - [16, 1984, 1, 64]
    - [76, 162.529]
  - - [32, 1984, 1, 64]
    - [133, 312.556]
  - - [1, 1984, 1, 1]
    - [46, 0.146963]
  - - [1, 1984, 1, 16]
    - [133, 2.53952]
  - - [1, 1984, 1, 32]
    - [113, 4.88369]
  - - [16, 1984, 1, 1]
    - [128, 2.44185]
  - - [16, 1984, 1, 16]
    - [73, 39.0695]
  - - [16, 1984, 1, 32]
    - [122, 78.1391]
  - - [32, 1984, 1, 1]
    - [72, 5.07904]
  - - [32, 1984, 1, 16]
    - [109, 78.1391]
  - - [32, 1984, 1, 32]
    - [71, 162.529]
  - - [64, 1984, 1, 1]
    - [15, 9.40563]
  - - [64, 1984, 1, 16]
    - [62, 150.49]
  - - [64, 1984, 1, 32]
    - [113, 325.059]
  - - [192, 1984, 1, 1]
    - [49, 27.2091]
  - - [192, 1984, 1, 16]
    - [79, 435.346]
  - - [192, 1984, 1, 32]
    - [91, 902.94]
  - - [320, 1984, 1, 1]
    - [89, 43.7848]
  - - [320, 1984, 1, 16]
    - [132, 677.205]
  - - [320, 1984, 1, 32]
    - [16, 1401.11]
  - - [448, 1984, 1, 1]
    - [49, 57.344]
  - - [448, 1984, 1, 16]
    - [137, 948.087]
  - - [448, 1984, 1, 32]
    - [138, 1961.56]
  - - [576, 1984, 1, 1]
    - [137, 76.1856]
  - - [576, 1984, 1, 16]
    - [137, 1218.97]
  - - [576, 1984, 1, 32]
    - [138, 2359.3]
  - - [704, 1984, 1, 1]
    - [94, 87.296]
  - - [704, 1984, 1, 16]
    - [137, 1396.74]
  - - [704, 1984, 1, 32]
    - [92, 2883.58]
  - - [832, 1984, 1, 1]
    - [97, 100.042]
  - - [832, 1984, 1, 16]
    - [92, 1553.59]
  - - [832, 1984, 1, 32]
    - [90, 3201.33]
  - - [960, 1984, 1, 1]
    - [96, 108.837]
  - - [960, 1984, 1, 16]
    - [96, 1741.39]
  - - [960, 1984, 1, 32]
    - [59, 3585.2]
  - - [1088, 1984, 1, 1]
    - [137, 119.922]
  - - [1088, 1984, 1, 16]
    - [97, 1973.57]
  - - [1088, 1984, 1, 32]
    - [41, 3837.5]
  - - [1216, 1984, 1, 1]
    - [38, 146.215]
  - - [1216, 1984, 1, 16]
    - [38, 2205.75]
  - - [1216, 1984, 1, 32]
    - [42, 4825.09]
  - - [1344, 1984, 1, 1]
    - [100, 172.032]
  - - [1344, 1984, 1, 16]
    - [59, 2844.26]
  - - [1344, 1984, 1, 32]
    - [96, 5505.02]
  - - [1472, 1984, 1, 1]
    - [41, 188.416]
