projects/hipblaslt/library/src/amd_detail/rocblaslt/src/Tensile/Logic/asm_full/gfx1201/Equality/gfx1201_Cijk_Alik_Bljk_HSS_BH_HAS_UserArgs.yaml
- {MinimumRequiredVersion: 4.33.0}
- gfx1201
- gfx1201
- [Device 73f0]
    SolutionIndex: 0
    SolutionNameMin: Cijk_Alik_Bljk_HSS_BH_HAS_UserArgs_MT128x128x32_MI16x16x1_SN_LDSB1_EPS0_GRVWA2_GRVWB8_GSU1_GSUC0_GSUWGMRR0_K1_LBSPPA256_LBSPPB256_MIWT4_4_PGR2_SU32_SUM0_SUS256_SVW4_TLDS1_VWA4_VWB4_WG32_4_1_WGM8_WGMXCC1_WGMXCCGn1
    SolutionIndex: 1
    SolutionNameMin: Cijk_Alik_Bljk_HSS_BH_HAS_UserArgs_MT128x128x32_MI16x16x1_SN_LDSB1_EPS0_GRVWA8_GRVWB8_GSU1_GSUC0_GSUWGMRR0_K1_LBSPPA256_LBSPPB128_MIWT4_4_PGR2_SU32_SUM0_SUS256_SVW4_TLDS2_VWA4_VWB2_WG32_4_1_WGM8_WGMXCC1_WGMXCCGn1
    SolutionIndex: 2
    SolutionNameMin: Cijk_Alik_Bljk_HSS_BH_HAS_UserArgs_MT32x32x32_MI16x16x1_SN_LDSB0_EPS0_GRVWA2_GRVWB1_GSU1_GSUC0_GSUWGMRR0_K1_LBSPPA128_LBSPPB128_MIWT1_1_PGR1_SU32_SUM0_SUS256_SVW1_TLDS2_VWA1_VWB1_WG32_4_1_WGM8_WGMXCC1_WGMXCCGn1
    SolutionIndex: 3
    SolutionNameMin: Cijk_Alik_Bljk_HSS_BH_HAS_UserArgs_MT32x32x32_MI16x16x1_SN_LDSB0_EPS0_GRVWA8_GRVWB4_GSU1_GSUC0_GSUWGMRR0_K1_LBSPPA128_LBSPPB128_MIWT1_1_PGR1_SU32_SUM0_SUS256_SVW1_TLDS2_VWA1_VWB1_WG32_4_1_WGM8_WGMXCC1_WGMXCCGn1
    SolutionIndex: 4
    SolutionNameMin: Cijk_Alik_Bljk_HSS_BH_HAS_UserArgs_MT32x32x32_MI16x16x1_SN_LDSB0_EPS0_GRVWA4_GRVWB8_GSU1_GSUC0_GSUWGMRR0_K1_LBSPPA128_LBSPPB128_MIWT1_1_PGR1_SU32_SUM0_SUS256_SVW1_TLDS1_VWA1_VWB1_WG32_4_1_WGM8_WGMXCC1_WGMXCCGn1
    SolutionIndex: 5
    SolutionNameMin: Cijk_Alik_Bljk_HSS_BH_HAS_UserArgs_MT32x32x32_MI16x16x1_SN_LDSB0_EPS0_GRVWA8_GRVWB8_GSU1_GSUC0_GSUWGMRR0_K1_LBSPPA128_LBSPPB128_MIWT1_1_PGR1_SU32_SUM0_SUS256_SVW1_TLDS1_VWA1_VWB1_WG32_4_1_WGM8_WGMXCC1_WGMXCCGn1
    SolutionIndex: 6
    SolutionNameMin: Cijk_Alik_Bljk_HSS_BH_HAS_UserArgs_MT32x32x32_MI16x16x1_SN_LDSB0_EPS0_GRVWA4_GRVWB8_GSU1_GSUC0_GSUWGMRR0_K1_LBSPPA128_LBSPPB128_MIWT1_1_PGR2_SU32_SUM0_SUS256_SVW1_TLDS1_VWA1_VWB1_WG32_4_1_WGM8_WGMXCC1_WGMXCCGn1
    SolutionIndex: 7
    SolutionNameMin: Cijk_Alik_Bljk_HSS_BH_HAS_UserArgs_MT32x32x64_MI16x16x1_SN_LDSB0_EPS0_GRVWA4_GRVWB4_GSU1_GSUC0_GSUWGMRR0_K1_LBSPPA128_LBSPPB128_MIWT1_1_PGR1_SU32_SUM0_SUS256_SVW1_TLDS2_VWA1_VWB1_WG32_4_1_WGM8_WGMXCC1_WGMXCCGn1
    SolutionIndex: 8
    SolutionNameMin: Cijk_Alik_Bljk_HSS_BH_HAS_UserArgs_MT32x32x64_MI16x16x1_SN_LDSB0_EPS0_GRVWA4_GRVWB4_GSU1_GSUC0_GSUWGMRR0_K1_LBSPPA128_LBSPPB128_MIWT1_1_PGR2_SU32_SUM0_SUS256_SVW1_TLDS2_VWA1_VWB1_WG32_4_1_WGM8_WGMXCC1_WGMXCCGn1
    SolutionIndex: 9
    SolutionNameMin: Cijk_Alik_Bljk_HSS_BH_HAS_UserArgs_MT32x32x64_MI16x16x1_SN_LDSB0_EPS0_GRVWA2_GRVWB8_GSU1_GSUC0_GSUWGMRR0_K1_LBSPPA128_LBSPPB128_MIWT1_1_PGR2_SU32_SUM0_SUS256_SVW1_TLDS1_VWA1_VWB1_WG32_4_1_WGM8_WGMXCC1_WGMXCCGn1
    SolutionIndex: 10
    SolutionNameMin: Cijk_Alik_Bljk_HSS_BH_HAS_UserArgs_MT32x32x64_MI16x16x1_SN_LDSB0_EPS0_GRVWA4_GRVWB8_GSU1_GSUC0_GSUWGMRR0_K1_LBSPPA128_LBSPPB128_MIWT1_1_PGR2_SU32_SUM0_SUS256_SVW1_TLDS1_VWA1_VWB1_WG32_4_1_WGM8_WGMXCC1_WGMXCCGn1
    SolutionIndex: 11
    SolutionNameMin: Cijk_Alik_Bljk_HSS_BH_HAS_UserArgs_MT32x32x64_MI16x16x1_SN_LDSB0_EPS1_GRVWA8_GRVWB8_GSU1_GSUC0_GSUWGMRR0_K1_LBSPPA128_LBSPPB128_MIWT1_1_PGR1_SU32_SUM0_SUS256_SVW1_TLDS2_VWA1_VWB1_WG32_4_1_WGM8_WGMXCC1_WGMXCCGn1
    SolutionIndex: 12
    SolutionNameMin: Cijk_Alik_Bljk_HSS_BH_HAS_UserArgs_MT64x64x64_MI16x16x1_SN_LDSB1_GRVWA8_GRVWB8_GSU1_GSUC0_GSUWGMRR0_K1_LBSPPA128_LBSPPB128_MIWT2_2_SS0_SU32_SUM0_SUS256_SVW8_TLDS1_WG32_4_1_WGM8_WGMXCC1_WGMXCCGn1
    SolutionIndex: 13
    SolutionNameMin: Cijk_Alik_Bljk_HSS_BH_HAS_UserArgs_MT128x64x64_MI16x16x1_SN_LDSB1_GRVWA8_GRVWB8_GSU1_GSUC0_GSUWGMRR0_K1_LBSPPA128_LBSPPB128_MIWT2_4_SS0_SU32_SUM0_SUS256_SVW8_TLDS1_WG64_2_1_WGM8_WGMXCC1_WGMXCCGn1
    SolutionIndex: 14
    SolutionNameMin: Cijk_Alik_Bljk_HSS_BH_HAS_UserArgs_MT64x128x64_MI16x16x1_SN_LDSB1_GRVWA8_GRVWB8_GSU1_GSUC0_GSUWGMRR0_K1_LBSPPA128_LBSPPB128_MIWT4_2_SS0_SU32_SUM0_SUS256_SVW8_TLDS1_WG16_8_1_WGM8_WGMXCC1_WGMXCCGn1
    SolutionIndex: 15
    SolutionNameMin: Cijk_Alik_Bljk_HSS_BH_HAS_UserArgs_MT64x128x64_MI16x16x1_SN_LDSB1_GRVWA8_GRVWB8_GSU1_GSUC0_GSUWGMRR0_K1_LBSPPA128_LBSPPB128_MIWT4_2_SS1_SU32_SUM0_SUS256_SVW1_TLDS1_WG16_8_1_WGM8_WGMXCC1_WGMXCCGn1
    SolutionIndex: 16
    SolutionNameMin: Cijk_Alik_Bljk_HSS_BH_HAS_UserArgs_MT128x128x32_MI16x16x1_SN_LDSB1_GRVWA8_GRVWB8_GSU1_GSUC0_GSUWGMRR0_K1_LBSPPA128_LBSPPB128_MIWT4_4_SS0_SU32_SUM0_SUS256_SVW8_TLDS1_WG32_4_1_WGM8_WGMXCC1_WGMXCCGn1
    SolutionIndex: 17
    SolutionNameMin: Cijk_Alik_Bljk_HSS_BH_HAS_UserArgs_MT64x256x32_MI16x16x1_SN_LDSB1_GRVWA8_GRVWB8_GSU1_GSUC0_GSUWGMRR0_K1_LBSPPA128_LBSPPB128_MIWT4_4_SS1_SU32_SUM0_SUS256_SVW1_TLDS1_WG16_8_1_WGM8_WGMXCC1_WGMXCCGn1
    SolutionIndex: 18
    SolutionNameMin: Cijk_Alik_Bljk_HSS_BH_HAS_UserArgs_MT192x48x64_MI16x16x1_SN_LDSB1_GRVWA8_GRVWB8_GSU1_GSUC0_GSUWGMRR0_K1_LBSPPA128_LBSPPB128_MIWT3_3_SS0_SU32_SUM0_SUS256_SVW8_TLDS1_WG64_2_1_WGM8_WGMXCC1_WGMXCCGn1
    SolutionIndex: 19
    SolutionNameMin: Cijk_Alik_Bljk_HSS_BH_HAS_UserArgs_MT80x128x64_MI16x16x1_SN_LDSB1_GRVWA8_GRVWB8_GSU1_GSUC0_GSUWGMRR0_K1_LBSPPA128_LBSPPB128_MIWT5_2_SS0_SU32_SUM0_SUS256_SVW8_TLDS1_WG16_8_1_WGM8_WGMXCC1_WGMXCCGn1
    SolutionIndex: 20
    SolutionNameMin: Cijk_Alik_Bljk_HSS_BH_HAS_UserArgs_MT64x128x64_MI16x16x1_SN_LDSB1_GRVWA8_GRVWB8_GSU1_GSUC0_GSUWGMRR0_K1_LBSPPA128_LBSPPB128_MIWT2_4_SS0_SU32_SUM0_SUS256_SVW8_TLDS1_WG32_4_1_WGM8_WGMXCC1_WGMXCCGn1
    SolutionIndex: 21
    SolutionNameMin: Cijk_Alik_Bljk_HSS_BH_HAS_UserArgs_MT96x128x32_MI16x16x1_SN_LDSB1_GRVWA8_GRVWB8_GSU1_GSUC0_GSUWGMRR0_K1_LBSPPA128_LBSPPB128_MIWT3_4_SS0_SU32_SUM0_SUS256_SVW8_TLDS1_WG32_4_1_WGM8_WGMXCC1_WGMXCCGn1
    SolutionIndex: 22
    SolutionNameMin: Cijk_Alik_Bljk_HSS_BH_HAS_UserArgs_MT128x128x32_MI16x16x1_SN_LDSB1_GRVWA8_GRVWB8_GSU1_GSUC0_GSUWGMRR0_K1_LBSPPA128_LBSPPB128_MIWT4_4_SS1_SU32_SUM0_SUS256_SVW1_TLDS1_WG32_4_1_WGM8_WGMXCC1_WGMXCCGn1
    SolutionIndex: 23
    SolutionNameMin: Cijk_Alik_Bljk_HSS_BH_HAS_UserArgs_MT48x192x64_MI16x16x1_SN_LDSB1_GRVWA8_GRVWB8_GSU1_GSUC0_GSUWGMRR0_K1_LBSPPA128_LBSPPB128_MIWT3_3_SS0_SU32_SUM0_SUS256_SVW8_TLDS1_WG16_8_1_WGM8_WGMXCC1_WGMXCCGn1
    SolutionIndex: 24
    SolutionNameMin: Cijk_Alik_Bljk_HSS_BH_HAS_UserArgs_MT64x224x32_MI16x16x1_SN_LDSB1_GRVWA8_GRVWB8_GSU1_GSUC0_GSUWGMRR0_K1_LBSPPA128_LBSPPB128_MIWT2_7_SS1_SU32_SUM0_SUS256_SVW1_TLDS1_WG32_4_1_WGM8_WGMXCC1_WGMXCCGn1
    SolutionIndex: 25
    SolutionNameMin: Cijk_Alik_Bljk_HSS_BH_HAS_UserArgs_MT64x64x64_MI16x16x1_SN_LDSB1_GRVWA8_GRVWB8_GSU1_GSUC0_GSUWGMRR0_K1_LBSPPA128_LBSPPB128_MIWT2_2_SS1_SU32_SUM0_SUS256_SVW1_TLDS1_WG32_4_1_WGM8_WGMXCC1_WGMXCCGn1
    SolutionIndex: 26
    SolutionNameMin: Cijk_Alik_Bljk_HSS_BH_HAS_UserArgs_MT96x160x32_MI16x16x1_SN_LDSB1_GRVWA8_GRVWB8_GSU1_GSUC0_GSUWGMRR0_K1_LBSPPA128_LBSPPB128_MIWT3_5_SS1_SU32_SUM0_SUS256_SVW1_TLDS1_WG32_4_1_WGM8_WGMXCC1_WGMXCCGn1
    SolutionIndex: 27
    SolutionNameMin: Cijk_Alik_Bljk_HSS_BH_HAS_UserArgs_MT96x160x32_MI16x16x1_SN_LDSB1_GRVWA8_GRVWB8_GSU1_GSUC0_GSUWGMRR0_K1_LBSPPA128_LBSPPB128_MIWT3_5_SS0_SU32_SUM0_SUS256_SVW8_TLDS1_WG32_4_1_WGM8_WGMXCC1_WGMXCCGn1
    SolutionIndex: 28
    SolutionNameMin: Cijk_Alik_Bljk_HSS_BH_HAS_UserArgs_MT256x64x32_MI16x16x1_SN_LDSB1_GRVWA8_GRVWB8_GSU1_GSUC0_GSUWGMRR0_K1_LBSPPA128_LBSPPB128_MIWT4_4_SS1_SU32_SUM0_SUS256_SVW1_TLDS1_WG64_2_1_WGM8_WGMXCC1_WGMXCCGn1
- - - [1024, 217, 1, 4096]
    - [12, 21.88]
  - - [1024, 512, 1, 4096]
    - [13, 37.01]
  - - [4096, 217, 1, 4096]
    - [14, 32.49]
  - - [4096, 512, 1, 4096]
    - [15, 42.78]
  - - [4096, 217, 1, 14336]
    - [16, 35.28]
  - - [4096, 512, 1, 14336]
    - [17, 44.48]
  - - [14336, 217, 1, 4096]
    - [18, 32.71]
  - - [14336, 512, 1, 4096]
    - [19, 40.43]
  - - [1024, 217, 1, 3072]
    - [12, 20.72]
  - - [1024, 512, 1, 3072]
    - [20, 35.17]
  - - [3072, 217, 1, 3072]
    - [21, 36.12]
  - - [3072, 512, 1, 3072]
    - [22, 50.23]
  - - [3072, 217, 1, 8192]
    - [14, 29.45]
  - - [3072, 512, 1, 8192]
    - [23, 35.79]
  - - [8192, 217, 1, 3072]
    - [24, 43.17]
  - - [8192, 512, 1, 3072]
    - [22, 46.32]
  - - [512, 414, 1, 3584]
    - [25, 20.62]
  - - [512, 512, 1, 3584]
    - [25, 25.48]
  - - [3584, 414, 1, 3584]
    - [26, 41.0]
  - - [3584, 512, 1, 3584]
    - [16, 49.28]
  - - [3584, 414, 1, 18944]
    - [27, 39.97]
  - - [3584, 512, 1, 18944]
    - [16, 47.83]
  - - [18944, 414, 1, 3584]
    - [27, 40.22]
  - - [18944, 512, 1, 3584]
    - [16, 46.09]
  - - [16384, 16384, 1, 512]
    - [28, 42.2]
- null
- null
- DeviceEfficiency
- Equality
