projects/hipblaslt/library/src/amd_detail/rocblaslt/src/Tensile/Logic/asm_full/gfx1201/Equality/gfx1201_Cijk_Alik_Bljk_HSS_BH_HAS_UserArgs.yaml
- {MinimumRequiredVersion: 5.0.0}
- gfx1201
- gfx1201
- [Device 73f0]
    SolutionIndex: 0
    SolutionNameMin: Cijk_Alik_Bljk_HSS_BH_HAS_UserArgs_MT64x64x64_MI16x16x1_SN_LDSB1_GRVWA8_GRVWB8_GSU1_GSUC0_GSUWGMRR0_K1_LBSPPA128_LBSPPB128_MIWT2_2_SS0_SU32_SUM1_SUS256_SVW8_TLDS1_WG32_4_1_WGM8_WGMXCC1_WGMXCCGn1
    SolutionIndex: 1
    SolutionNameMin: Cijk_Alik_Bljk_HSS_BH_HAS_UserArgs_MT256x64x32_MI16x16x1_SN_LDSB1_GRVWA8_GRVWB8_GSU1_GSUC0_GSUWGMRR0_K1_LBSPPA128_LBSPPB128_MIWT4_4_SS1_SU32_SUM1_SUS256_SVW1_TLDS1_WG64_2_1_WGM8_WGMXCC1_WGMXCCGn1
    SolutionIndex: 2
    SolutionNameMin: Cijk_Alik_Bljk_HSS_BH_HAS_UserArgs_MT64x256x32_MI16x16x1_SN_LDSB0_AFC1_AFEM1_AFEM1_ASEM1_CLR0_CADS0_DTVA0_DTVB1_EPS0_FDSI0_GRPM1_GRVWA8_GRVWB8_GSU1_GSUAMB_GSUC0_GSUWGMRR0_GLS0_ISA1201_IU1_K1_LBSPPA256_LBSPPB0_LBSPPM0_LPA16_LPB0_LPM0_LRVW8_LWPMn1_MIAV1_MIWT4_4_MO40_NTn1_NTA0_NTB0_NTC0_NTD0_NTM0_NEPBS0_NLCA1_NLCB2_ONLL1_PGR2_PLR1_PKA0_SIA3_SS0_SU32_SUM1_SUS256_SPO0_SRVW0_SSO0_SVW8_SK0_SKXCCM0_TLDS2_ULSGRO0_USL1_UIOFGRO0_USFGROn1_VSn1_VWA4_VWB4_WSGRA0_WSGRB0_WS32_WG16_8_1_WGM8_WGMXCC1_WGMXCCGn1
    SolutionIndex: 3
    SolutionNameMin: Cijk_Alik_Bljk_HSS_BH_HAS_UserArgs_MT64x256x32_MI16x16x1_SN_LDSB0_AFC1_AFEM1_AFEM1_ASEM1_CLR1_CADS0_DTVA0_DTVB1_EPS0_FDSI0_GRPM1_GRVWA4_GRVWB8_GSU1_GSUAMB_GSUC0_GSUWGMRR0_GLS0_ISA1201_IU1_K1_LBSPPA256_LBSPPB0_LBSPPM0_LPA16_LPB0_LPM0_LRVW8_LWPMn1_MIAV1_MIWT4_4_MO40_NTn1_NTA0_NTB0_NTC0_NTD0_NTM0_NEPBS0_NLCA1_NLCB2_ONLL1_PGR2_PLR1_PKA0_SIA3_SS0_SU32_SUM1_SUS256_SPO0_SRVW0_SSO0_SVW8_SK0_SKXCCM0_TLDS1_ULSGRO0_USL1_UIOFGRO0_USFGROn1_VSn1_VWA4_VWB4_WSGRA0_WSGRB0_WS32_WG16_8_1_WGM8_WGMXCC1_WGMXCCGn1
    SolutionIndex: 4
    SolutionNameMin: Cijk_Alik_Bljk_HSS_BH_HAS_UserArgs_MT128x128x32_MI16x16x1_SN_LDSB1_AFC1_AFEM1_AFEM1_ASEM1_CLR1_CADS0_DTVA0_DTVB0_EPS0_FDSI0_GRPM1_GRVWA8_GRVWB4_GSU1_GSUAMB_GSUC0_GSUWGMRR0_GLS0_ISA1201_IU1_K1_LBSPPA256_LBSPPB256_LBSPPM0_LPA16_LPB16_LPM0_LRVW8_LWPMn1_MIAV1_MIWT4_4_MO40_NTn1_NTA0_NTB0_NTC0_NTD0_NTM0_NEPBS0_NLCA1_NLCB1_ONLL1_PGR2_PLR1_PKA0_SIA3_SS1_SU32_SUM1_SUS256_SPO0_SRVW0_SSO0_SVW4_SK0_SKXCCM0_TLDS1_ULSGRO0_USL1_UIOFGRO0_USFGROn1_VSn1_VWA4_VWB4_WSGRA0_WSGRB0_WS32_WG32_4_1_WGM8_WGMXCC1_WGMXCCGn1
    SolutionIndex: 5
    SolutionNameMin: Cijk_Alik_Bljk_HSS_BH_HAS_UserArgs_MT128x128x32_MI16x16x1_SN_LDSB1_AFC1_AFEM1_AFEM1_ASEM1_CLR1_CADS0_DTVA0_DTVB1_EPS0_FDSI0_GRPM1_GRVWA8_GRVWB8_GSU1_GSUAMB_GSUC0_GSUWGMRR0_GLS0_ISA1201_IU1_K1_LBSPPA256_LBSPPB0_LBSPPM0_LPA16_LPB0_LPM0_LRVW8_LWPMn1_MIAV1_MIWT4_4_MO40_NTn1_NTA0_NTB0_NTC0_NTD0_NTM0_NEPBS0_NLCA1_NLCB2_ONLL1_PGR1_PLR1_PKA0_SIA3_SS1_SU32_SUM1_SUS256_SPO0_SRVW0_SSO0_SVW4_SK0_SKXCCM0_TLDS2_ULSGRO0_USL1_UIOFGRO0_USFGROn1_VSn1_VWA4_VWB4_WSGRA0_WSGRB0_WS32_WG32_4_1_WGM8_WGMXCC1_WGMXCCGn1
    SolutionIndex: 6
    SolutionNameMin: Cijk_Alik_Bljk_HSS_BH_HAS_UserArgs_MT64x256x32_MI16x16x1_SN_LDSB0_AFC1_AFEM1_AFEM1_ASEM1_CLR1_CADS0_DTVA0_DTVB1_EPS1_FDSI0_GRPM1_GRVWA8_GRVWB8_GSU1_GSUAMB_GSUC0_GSUWGMRR0_GLS0_ISA1201_IU1_K1_LBSPPA256_LBSPPB0_LBSPPM0_LPA16_LPB0_LPM0_LRVW8_LWPMn1_MIAV1_MIWT4_4_MO40_NTn1_NTA0_NTB0_NTC0_NTD0_NTM0_NEPBS0_NLCA1_NLCB2_ONLL1_PGR1_PLR1_PKA0_SIA3_SS1_SU32_SUM1_SUS256_SPO0_SRVW0_SSO0_SVW4_SK0_SKXCCM0_TLDS1_ULSGRO0_USL1_UIOFGRO0_USFGROn1_VSn1_VWA4_VWB4_WSGRA0_WSGRB0_WS32_WG16_8_1_WGM8_WGMXCC1_WGMXCCGn1
    SolutionIndex: 7
    SolutionNameMin: Cijk_Alik_Bljk_HSS_BH_HAS_UserArgs_MT64x256x32_MI16x16x1_SN_LDSB1_AFC1_AFEM1_AFEM1_ASEM1_CLR1_CADS0_DTVA0_DTVB1_EPS0_FDSI0_GRPM1_GRVWA4_GRVWB8_GSU1_GSUAMB_GSUC0_GSUWGMRR0_GLS0_ISA1201_IU1_K1_LBSPPA256_LBSPPB0_LBSPPM0_LPA16_LPB0_LPM0_LRVW8_LWPMn1_MIAV1_MIWT4_4_MO40_NTn1_NTA0_NTB0_NTC0_NTD0_NTM0_NEPBS0_NLCA1_NLCB2_ONLL1_PGR2_PLR1_PKA0_SIA3_SS1_SU32_SUM1_SUS256_SPO0_SRVW0_SSO0_SVW4_SK0_SKXCCM0_TLDS1_ULSGRO0_USL1_UIOFGRO0_USFGROn1_VSn1_VWA4_VWB4_WSGRA0_WSGRB0_WS32_WG16_8_1_WGM8_WGMXCC1_WGMXCCGn1
    SolutionIndex: 8
    SolutionNameMin: Cijk_Alik_Bljk_HSS_BH_HAS_UserArgs_MT128x128x32_MI16x16x1_SN_LDSB0_AFC1_AFEM1_AFEM1_ASEM1_CLR0_CADS0_DTVA0_DTVB1_EPS1_FDSI0_GRPM1_GRVWA8_GRVWB8_GSU1_GSUAMB_GSUC0_GSUWGMRR0_GLS0_ISA1201_IU1_K1_LBSPPA256_LBSPPB0_LBSPPM0_LPA16_LPB0_LPM0_LRVW8_LWPMn1_MIAV1_MIWT4_4_MO40_NTn1_NTA0_NTB0_NTC0_NTD0_NTM0_NEPBS0_NLCA1_NLCB2_ONLL1_PGR1_PLR1_PKA0_SIA3_SS1_SU32_SUM1_SUS256_SPO0_SRVW0_SSO0_SVW4_SK0_SKXCCM0_TLDS1_ULSGRO0_USL1_UIOFGRO0_USFGROn1_VSn1_VWA4_VWB4_WSGRA0_WSGRB0_WS32_WG32_4_1_WGM8_WGMXCC1_WGMXCCGn1
    SolutionIndex: 9
    SolutionNameMin: Cijk_Alik_Bljk_HSS_BH_HAS_UserArgs_MT128x128x32_MI16x16x1_SN_LDSB1_AFC1_AFEM1_AFEM1_ASEM1_CLR0_CADS0_DTVA0_DTVB1_EPS0_FDSI0_GRPM1_GRVWA4_GRVWB8_GSU1_GSUAMB_GSUC0_GSUWGMRR0_GLS0_ISA1201_IU1_K1_LBSPPA256_LBSPPB0_LBSPPM0_LPA16_LPB0_LPM0_LRVW8_LWPMn1_MIAV1_MIWT4_4_MO40_NTn1_NTA0_NTB0_NTC0_NTD0_NTM0_NEPBS0_NLCA1_NLCB2_ONLL1_PGR1_PLR1_PKA0_SIA3_SS1_SU32_SUM1_SUS256_SPO0_SRVW0_SSO0_SVW4_SK0_SKXCCM0_TLDS1_ULSGRO0_USL1_UIOFGRO0_USFGROn1_VSn1_VWA4_VWB4_WSGRA0_WSGRB0_WS32_WG32_4_1_WGM8_WGMXCC1_WGMXCCGn1
    SolutionIndex: 10
    SolutionNameMin: Cijk_Alik_Bljk_HSS_BH_HAS_UserArgs_MT128x128x32_MI16x16x1_SN_LDSB0_AFC1_AFEM1_AFEM1_ASEM1_CLR1_CADS0_DTVA0_DTVB1_EPS0_FDSI0_GRPM1_GRVWA4_GRVWB8_GSU1_GSUAMB_GSUC0_GSUWGMRR0_GLS0_ISA1201_IU1_K1_LBSPPA256_LBSPPB0_LBSPPM0_LPA16_LPB0_LPM0_LRVW8_LWPMn1_MIAV1_MIWT4_4_MO40_NTn1_NTA0_NTB0_NTC0_NTD0_NTM0_NEPBS0_NLCA1_NLCB2_ONLL1_PGR2_PLR1_PKA0_SIA3_SS1_SU32_SUM1_SUS256_SPO0_SRVW0_SSO0_SVW4_SK0_SKXCCM0_TLDS1_ULSGRO0_USL1_UIOFGRO0_USFGROn1_VSn1_VWA4_VWB4_WSGRA0_WSGRB0_WS32_WG32_4_1_WGM8_WGMXCC1_WGMXCCGn1
    SolutionIndex: 11
    SolutionNameMin: Cijk_Alik_Bljk_HSS_BH_HAS_UserArgs_MT128x128x32_MI16x16x1_SN_LDSB0_AFC1_AFEM1_AFEM1_ASEM1_CLR0_CADS0_DTVA0_DTVB1_EPS0_FDSI0_GRPM1_GRVWA4_GRVWB8_GSU1_GSUAMB_GSUC0_GSUWGMRR0_GLS0_ISA1201_IU1_K1_LBSPPA256_LBSPPB0_LBSPPM0_LPA16_LPB0_LPM0_LRVW8_LWPMn1_MIAV1_MIWT4_4_MO40_NTn1_NTA0_NTB0_NTC0_NTD0_NTM0_NEPBS0_NLCA1_NLCB2_ONLL1_PGR2_PLR1_PKA0_SIA3_SS1_SU32_SUM1_SUS256_SPO0_SRVW0_SSO0_SVW4_SK0_SKXCCM0_TLDS1_ULSGRO0_USL1_UIOFGRO0_USFGROn1_VSn1_VWA4_VWB4_WSGRA0_WSGRB0_WS32_WG32_4_1_WGM8_WGMXCC1_WGMXCCGn1
    SolutionIndex: 12
    SolutionNameMin: Cijk_Alik_Bljk_HSS_BH_HAS_UserArgs_MT64x256x32_MI16x16x1_SN_LDSB0_AFC1_AFEM1_AFEM1_ASEM1_CLR0_CADS0_DTVA0_DTVB1_EPS0_FDSI0_GRPM1_GRVWA4_GRVWB8_GSU1_GSUAMB_GSUC0_GSUWGMRR0_GLS0_ISA1201_IU1_K1_LBSPPA256_LBSPPB0_LBSPPM0_LPA16_LPB0_LPM0_LRVW8_LWPMn1_MIAV1_MIWT4_4_MO40_NTn1_NTA0_NTB0_NTC0_NTD0_NTM0_NEPBS0_NLCA1_NLCB2_ONLL1_PGR2_PLR1_PKA0_SIA3_SS1_SU32_SUM1_SUS256_SPO0_SRVW0_SSO0_SVW4_SK0_SKXCCM0_TLDS2_ULSGRO0_USL1_UIOFGRO0_USFGROn1_VSn1_VWA4_VWB4_WSGRA0_WSGRB0_WS32_WG16_8_1_WGM8_WGMXCC1_WGMXCCGn1
    SolutionIndex: 13
    SolutionNameMin: Cijk_Alik_Bljk_HSS_BH_HAS_UserArgs_MT64x256x32_MI16x16x1_SN_LDSB1_AFC1_AFEM1_AFEM1_ASEM1_CLR1_CADS0_DTVA0_DTVB1_EPS1_FDSI0_GRPM1_GRVWA8_GRVWB8_GSU1_GSUAMB_GSUC0_GSUWGMRR0_GLS0_ISA1201_IU1_K1_LBSPPA256_LBSPPB0_LBSPPM0_LPA16_LPB0_LPM0_LRVW8_LWPMn1_MIAV1_MIWT4_4_MO40_NTn1_NTA0_NTB0_NTC0_NTD0_NTM0_NEPBS0_NLCA1_NLCB2_ONLL1_PGR1_PLR1_PKA0_SIA3_SS1_SU32_SUM1_SUS256_SPO0_SRVW0_SSO0_SVW4_SK0_SKXCCM0_TLDS2_ULSGRO0_USL1_UIOFGRO0_USFGROn1_VSn1_VWA4_VWB4_WSGRA0_WSGRB0_WS32_WG16_8_1_WGM8_WGMXCC1_WGMXCCGn1
    SolutionIndex: 14
    SolutionNameMin: Cijk_Alik_Bljk_HSS_BH_HAS_UserArgs_MT128x128x32_MI16x16x1_SN_LDSB0_AFC1_AFEM1_AFEM1_ASEM1_CLR0_CADS0_DTVA0_DTVB1_EPS1_FDSI0_GRPM1_GRVWA8_GRVWB8_GSU1_GSUAMB_GSUC0_GSUWGMRR0_GLS0_ISA1201_IU1_K1_LBSPPA256_LBSPPB0_LBSPPM0_LPA16_LPB0_LPM0_LRVW8_LWPMn1_MIAV1_MIWT4_4_MO40_NTn1_NTA0_NTB0_NTC0_NTD0_NTM0_NEPBS0_NLCA1_NLCB2_ONLL1_PGR1_PLR1_PKA0_SIA3_SS1_SU32_SUM1_SUS256_SPO0_SRVW0_SSO0_SVW4_SK0_SKXCCM0_TLDS2_ULSGRO0_USL1_UIOFGRO0_USFGROn1_VSn1_VWA4_VWB4_WSGRA0_WSGRB0_WS32_WG32_4_1_WGM8_WGMXCC1_WGMXCCGn1
    SolutionIndex: 15
    SolutionNameMin: Cijk_Alik_Bljk_HSS_BH_HAS_UserArgs_MT128x128x32_MI16x16x1_SN_LDSB1_AFC1_AFEM1_AFEM1_ASEM1_CLR1_CADS0_DTVA0_DTVB1_EPS0_FDSI0_GRPM1_GRVWA8_GRVWB8_GSU1_GSUAMB_GSUC0_GSUWGMRR0_GLS0_ISA1201_IU1_K1_LBSPPA256_LBSPPB0_LBSPPM0_LPA16_LPB0_LPM0_LRVW8_LWPMn1_MIAV1_MIWT4_4_MO40_NTn1_NTA0_NTB0_NTC0_NTD0_NTM0_NEPBS0_NLCA1_NLCB2_ONLL1_PGR2_PLR1_PKA0_SIA3_SS1_SU32_SUM1_SUS256_SPO0_SRVW0_SSO0_SVW4_SK0_SKXCCM0_TLDS2_ULSGRO0_USL1_UIOFGRO0_USFGROn1_VSn1_VWA4_VWB4_WSGRA0_WSGRB0_WS32_WG32_4_1_WGM8_WGMXCC1_WGMXCCGn1
    SolutionIndex: 16
    SolutionNameMin: Cijk_Alik_Bljk_HSS_BH_HAS_UserArgs_MT256x64x32_MI16x16x1_SN_LDSB0_AFC1_AFEM1_AFEM1_ASEM1_CLR1_CADS0_DTVA0_DTVB0_EPS0_FDSI0_GRPM1_GRVWA8_GRVWB4_GSU1_GSUAMB_GSUC0_GSUWGMRR0_GLS0_ISA1201_IU1_K1_LBSPPA256_LBSPPB256_LBSPPM0_LPA16_LPB16_LPM0_LRVW8_LWPMn1_MIAV1_MIWT4_4_MO40_NTn1_NTA0_NTB0_NTC0_NTD0_NTM0_NEPBS0_NLCA1_NLCB1_ONLL1_PGR2_PLR1_PKA0_SIA3_SS1_SU32_SUM1_SUS256_SPO0_SRVW0_SSO0_SVW4_SK0_SKXCCM0_TLDS2_ULSGRO0_USL1_UIOFGRO0_USFGROn1_VSn1_VWA4_VWB4_WSGRA0_WSGRB0_WS32_WG64_2_1_WGM8_WGMXCC1_WGMXCCGn1
    SolutionIndex: 17
    SolutionNameMin: Cijk_Alik_Bljk_HSS_BH_HAS_UserArgs_MT128x128x32_MI16x16x1_SN_LDSB0_AFC1_AFEM1_AFEM1_ASEM1_CLR0_CADS0_DTVA0_DTVB1_EPS1_FDSI0_GRPM1_GRVWA4_GRVWB8_GSU1_GSUAMB_GSUC0_GSUWGMRR0_GLS0_ISA1201_IU1_K1_LBSPPA256_LBSPPB0_LBSPPM0_LPA16_LPB0_LPM0_LRVW8_LWPMn1_MIAV1_MIWT4_4_MO40_NTn1_NTA0_NTB0_NTC0_NTD0_NTM0_NEPBS0_NLCA1_NLCB2_ONLL1_PGR1_PLR1_PKA0_SIA3_SS1_SU32_SUM1_SUS256_SPO0_SRVW0_SSO0_SVW4_SK0_SKXCCM0_TLDS2_ULSGRO0_USL1_UIOFGRO0_USFGROn1_VSn1_VWA4_VWB4_WSGRA0_WSGRB0_WS32_WG32_4_1_WGM8_WGMXCC1_WGMXCCGn1
    SolutionIndex: 18
    SolutionNameMin: Cijk_Alik_Bljk_HSS_BH_HAS_UserArgs_MT128x128x32_MI16x16x1_SN_LDSB0_AFC1_AFEM1_AFEM1_ASEM1_CLR0_CADS0_DTVA0_DTVB0_EPS1_FDSI0_GRPM1_GRVWA8_GRVWB4_GSU1_GSUAMB_GSUC0_GSUWGMRR0_GLS0_ISA1201_IU1_K1_LBSPPA256_LBSPPB256_LBSPPM0_LPA16_LPB16_LPM0_LRVW8_LWPMn1_MIAV1_MIWT4_4_MO40_NTn1_NTA0_NTB0_NTC0_NTD0_NTM0_NEPBS0_NLCA1_NLCB1_ONLL1_PGR1_PLR1_PKA0_SIA3_SS1_SU32_SUM1_SUS256_SPO0_SRVW0_SSO0_SVW4_SK0_SKXCCM0_TLDS2_ULSGRO0_USL1_UIOFGRO0_USFGROn1_VSn1_VWA4_VWB4_WSGRA0_WSGRB0_WS32_WG32_4_1_WGM8_WGMXCC1_WGMXCCGn1
    SolutionIndex: 19
    SolutionNameMin: Cijk_Alik_Bljk_HSS_BH_HAS_UserArgs_MT128x128x32_MI16x16x1_SN_LDSB1_AFC1_AFEM1_AFEM1_ASEM1_CLR0_CADS0_DTVA0_DTVB0_EPS0_FDSI0_GRPM1_GRVWA4_GRVWB4_GSU1_GSUAMB_GSUC0_GSUWGMRR0_GLS0_ISA1201_IU1_K1_LBSPPA256_LBSPPB256_LBSPPM0_LPA16_LPB16_LPM0_LRVW8_LWPMn1_MIAV1_MIWT4_4_MO40_NTn1_NTA0_NTB0_NTC0_NTD0_NTM0_NEPBS0_NLCA1_NLCB1_ONLL1_PGR2_PLR1_PKA0_SIA3_SS1_SU32_SUM1_SUS256_SPO0_SRVW0_SSO0_SVW4_SK0_SKXCCM0_TLDS2_ULSGRO0_USL1_UIOFGRO0_USFGROn1_VSn1_VWA4_VWB4_WSGRA0_WSGRB0_WS32_WG32_4_1_WGM8_WGMXCC1_WGMXCCGn1
    SolutionIndex: 20
    SolutionNameMin: Cijk_Alik_Bljk_HSS_BH_HAS_UserArgs_MT128x128x32_MI16x16x1_SN_LDSB0_AFC1_AFEM1_AFEM1_ASEM1_CLR1_CADS0_DTVA0_DTVB0_EPS0_FDSI0_GRPM1_GRVWA8_GRVWB8_GSU1_GSUAMB_GSUC0_GSUWGMRR0_GLS0_ISA1201_IU1_K1_LBSPPA256_LBSPPB256_LBSPPM0_LPA16_LPB16_LPM0_LRVW8_LWPMn1_MIAV1_MIWT4_4_MO40_NTn1_NTA0_NTB0_NTC0_NTD0_NTM0_NEPBS0_NLCA1_NLCB1_ONLL1_PGR2_PLR1_PKA0_SIA3_SS1_SU32_SUM1_SUS256_SPO0_SRVW0_SSO0_SVW4_SK0_SKXCCM0_TLDS2_ULSGRO0_USL1_UIOFGRO0_USFGROn1_VSn1_VWA4_VWB4_WSGRA0_WSGRB0_WS32_WG32_4_1_WGM8_WGMXCC1_WGMXCCGn1
    SolutionIndex: 21
    SolutionNameMin: Cijk_Alik_Bljk_HSS_BH_HAS_UserArgs_MT128x128x32_MI16x16x1_SN_LDSB0_AFC1_AFEM1_AFEM1_ASEM1_CLR0_CADS0_DTVA0_DTVB0_EPS0_FDSI0_GRPM1_GRVWA8_GRVWB8_GSU1_GSUAMB_GSUC0_GSUWGMRR0_GLS0_ISA1201_IU1_K1_LBSPPA256_LBSPPB256_LBSPPM0_LPA16_LPB16_LPM0_LRVW8_LWPMn1_MIAV1_MIWT4_4_MO40_NTn1_NTA0_NTB0_NTC0_NTD0_NTM0_NEPBS0_NLCA1_NLCB1_ONLL1_PGR2_PLR1_PKA0_SIA3_SS1_SU32_SUM1_SUS256_SPO0_SRVW0_SSO0_SVW4_SK0_SKXCCM0_TLDS1_ULSGRO0_USL1_UIOFGRO0_USFGROn1_VSn1_VWA4_VWB4_WSGRA0_WSGRB0_WS32_WG32_4_1_WGM8_WGMXCC1_WGMXCCGn1
    SolutionIndex: 22
    SolutionNameMin: Cijk_Alik_Bljk_HSS_BH_HAS_UserArgs_MT128x128x32_MI16x16x1_SN_LDSB0_AFC1_AFEM1_AFEM1_ASEM1_CLR1_CADS0_DTVA0_DTVB0_EPS1_FDSI0_GRPM1_GRVWA8_GRVWB4_GSU1_GSUAMB_GSUC0_GSUWGMRR0_GLS0_ISA1201_IU1_K1_LBSPPA256_LBSPPB256_LBSPPM0_LPA16_LPB16_LPM0_LRVW8_LWPMn1_MIAV1_MIWT4_4_MO40_NTn1_NTA0_NTB0_NTC0_NTD0_NTM0_NEPBS0_NLCA1_NLCB1_ONLL1_PGR1_PLR0_PKA0_SIA3_SS1_SU32_SUM1_SUS256_SPO0_SRVW0_SSO0_SVW4_SK0_SKXCCM0_TLDS1_ULSGRO0_USL1_UIOFGRO0_USFGROn1_VSn1_VWA4_VWB4_WSGRA0_WSGRB0_WS32_WG32_4_1_WGM8_WGMXCC1_WGMXCCGn1
    SolutionIndex: 23
    SolutionNameMin: Cijk_Alik_Bljk_HSS_BH_HAS_UserArgs_MT128x128x32_MI16x16x1_SN_LDSB0_AFC1_AFEM1_AFEM1_ASEM1_CLR0_CADS0_DTVA0_DTVB0_EPS0_FDSI0_GRPM1_GRVWA8_GRVWB8_GSU1_GSUAMB_GSUC0_GSUWGMRR0_GLS0_ISA1201_IU1_K1_LBSPPA256_LBSPPB256_LBSPPM0_LPA16_LPB16_LPM0_LRVW8_LWPMn1_MIAV1_MIWT4_4_MO40_NTn1_NTA0_NTB0_NTC0_NTD0_NTM0_NEPBS0_NLCA1_NLCB1_ONLL1_PGR2_PLR1_PKA0_SIA3_SS1_SU32_SUM1_SUS256_SPO0_SRVW0_SSO0_SVW4_SK0_SKXCCM0_TLDS2_ULSGRO0_USL1_UIOFGRO0_USFGROn1_VSn1_VWA4_VWB4_WSGRA0_WSGRB0_WS32_WG32_4_1_WGM8_WGMXCC1_WGMXCCGn1
    SolutionIndex: 24
    SolutionNameMin: Cijk_Alik_Bljk_HSS_BH_HAS_UserArgs_MT64x256x32_MI16x16x1_SN_LDSB0_AFC1_AFEM1_AFEM1_ASEM1_CLR1_CADS0_DTVA0_DTVB0_EPS0_FDSI0_GRPM1_GRVWA4_GRVWB8_GSU1_GSUAMB_GSUC0_GSUWGMRR0_GLS0_ISA1201_IU1_K1_LBSPPA256_LBSPPB256_LBSPPM0_LPA16_LPB16_LPM0_LRVW8_LWPMn1_MIAV1_MIWT4_4_MO40_NTn1_NTA0_NTB0_NTC0_NTD0_NTM0_NEPBS0_NLCA1_NLCB1_ONLL1_PGR2_PLR1_PKA0_SIA3_SS0_SU32_SUM1_SUS256_SPO0_SRVW0_SSO0_SVW8_SK0_SKXCCM0_TLDS2_ULSGRO0_USL1_UIOFGRO0_USFGROn1_VSn1_VWA4_VWB4_WSGRA0_WSGRB0_WS32_WG16_8_1_WGM8_WGMXCC1_WGMXCCGn1
    SolutionIndex: 25
    SolutionNameMin: Cijk_Alik_Bljk_HSS_BH_HAS_UserArgs_MT64x256x32_MI16x16x1_SN_LDSB1_AFC1_AFEM1_AFEM1_ASEM1_CLR1_CADS0_DTVA0_DTVB0_EPS0_FDSI0_GRPM1_GRVWA8_GRVWB4_GSU1_GSUAMB_GSUC0_GSUWGMRR0_GLS0_ISA1201_IU1_K1_LBSPPA256_LBSPPB256_LBSPPM0_LPA16_LPB16_LPM0_LRVW8_LWPMn1_MIAV1_MIWT4_4_MO40_NTn1_NTA0_NTB0_NTC0_NTD0_NTM0_NEPBS0_NLCA1_NLCB1_ONLL1_PGR2_PLR1_PKA0_SIA3_SS1_SU32_SUM1_SUS256_SPO0_SRVW0_SSO0_SVW4_SK0_SKXCCM0_TLDS2_ULSGRO0_USL1_UIOFGRO0_USFGROn1_VSn1_VWA4_VWB4_WSGRA0_WSGRB0_WS32_WG16_8_1_WGM8_WGMXCC1_WGMXCCGn1
    SolutionIndex: 26
    SolutionNameMin: Cijk_Alik_Bljk_HSS_BH_HAS_UserArgs_MT128x128x32_MI16x16x1_SN_LDSB0_AFC1_AFEM1_AFEM1_ASEM1_CLR0_CADS0_DTVA0_DTVB0_EPS0_FDSI0_GRPM1_GRVWA8_GRVWB8_GSU1_GSUAMB_GSUC0_GSUWGMRR0_GLS0_ISA1201_IU1_K1_LBSPPA256_LBSPPB256_LBSPPM0_LPA16_LPB16_LPM0_LRVW8_LWPMn1_MIAV1_MIWT4_4_MO40_NTn1_NTA0_NTB0_NTC0_NTD0_NTM0_NEPBS0_NLCA1_NLCB1_ONLL1_PGR2_PLR0_PKA0_SIA3_SS1_SU32_SUM1_SUS256_SPO0_SRVW0_SSO0_SVW4_SK0_SKXCCM0_TLDS1_ULSGRO0_USL1_UIOFGRO0_USFGROn1_VSn1_VWA4_VWB4_WSGRA0_WSGRB0_WS32_WG32_4_1_WGM8_WGMXCC1_WGMXCCGn1
    SolutionIndex: 27
    SolutionNameMin: Cijk_Alik_Bljk_HSS_BH_HAS_UserArgs_MT128x128x32_MI16x16x1_SN_LDSB0_AFC1_AFEM1_AFEM1_ASEM1_CLR1_CADS0_DTVA0_DTVB0_EPS0_FDSI0_GRPM1_GRVWA8_GRVWB8_GSU1_GSUAMB_GSUC0_GSUWGMRR0_GLS0_ISA1201_IU1_K1_LBSPPA256_LBSPPB256_LBSPPM0_LPA16_LPB16_LPM0_LRVW8_LWPMn1_MIAV1_MIWT4_4_MO40_NTn1_NTA0_NTB0_NTC0_NTD0_NTM0_NEPBS0_NLCA1_NLCB1_ONLL1_PGR2_PLR0_PKA0_SIA3_SS0_SU32_SUM1_SUS256_SPO0_SRVW0_SSO0_SVW8_SK0_SKXCCM0_TLDS2_ULSGRO0_USL1_UIOFGRO0_USFGROn1_VSn1_VWA4_VWB4_WSGRA0_WSGRB0_WS32_WG32_4_1_WGM8_WGMXCC1_WGMXCCGn1
    SolutionIndex: 28
    SolutionNameMin: Cijk_Alik_Bljk_HSS_BH_HAS_UserArgs_MT128x128x32_MI16x16x1_SN_LDSB0_AFC1_AFEM1_AFEM1_ASEM1_CLR1_CADS0_DTVA0_DTVB0_EPS0_FDSI0_GRPM1_GRVWA8_GRVWB8_GSU1_GSUAMB_GSUC0_GSUWGMRR0_GLS0_ISA1201_IU1_K1_LBSPPA256_LBSPPB256_LBSPPM0_LPA16_LPB16_LPM0_LRVW8_LWPMn1_MIAV1_MIWT4_4_MO40_NTn1_NTA0_NTB0_NTC0_NTD0_NTM0_NEPBS0_NLCA1_NLCB1_ONLL1_PGR2_PLR1_PKA0_SIA3_SS1_SU32_SUM1_SUS256_SPO0_SRVW0_SSO0_SVW4_SK0_SKXCCM0_TLDS1_ULSGRO0_USL1_UIOFGRO0_USFGROn1_VSn1_VWA4_VWB4_WSGRA0_WSGRB0_WS32_WG32_4_1_WGM8_WGMXCC1_WGMXCCGn1
    SolutionIndex: 29
    SolutionNameMin: Cijk_Alik_Bljk_HSS_BH_HAS_UserArgs_MT128x128x32_MI16x16x1_SN_LDSB0_AFC1_AFEM1_AFEM1_ASEM1_CLR1_CADS0_DTVA0_DTVB1_EPS0_FDSI0_GRPM1_GRVWA4_GRVWB8_GSU1_GSUAMB_GSUC0_GSUWGMRR0_GLS0_ISA1201_IU1_K1_LBSPPA256_LBSPPB0_LBSPPM0_LPA16_LPB0_LPM0_LRVW8_LWPMn1_MIAV1_MIWT4_4_MO40_NTn1_NTA0_NTB0_NTC0_NTD0_NTM0_NEPBS0_NLCA1_NLCB2_ONLL1_PGR2_PLR1_PKA0_SIA3_SS1_SU32_SUM1_SUS256_SPO0_SRVW0_SSO0_SVW4_SK0_SKXCCM0_TLDS2_ULSGRO0_USL1_UIOFGRO0_USFGROn1_VSn1_VWA4_VWB4_WSGRA0_WSGRB0_WS32_WG32_4_1_WGM8_WGMXCC1_WGMXCCGn1
    SolutionIndex: 30
    SolutionNameMin: Cijk_Alik_Bljk_HSS_BH_HAS_UserArgs_MT128x128x32_MI16x16x1_SN_LDSB0_AFC1_AFEM1_AFEM1_ASEM1_CLR0_CADS0_DTVA0_DTVB1_EPS0_FDSI0_GRPM1_GRVWA4_GRVWB8_GSU1_GSUAMB_GSUC0_GSUWGMRR0_GLS0_ISA1201_IU1_K1_LBSPPA256_LBSPPB0_LBSPPM0_LPA16_LPB0_LPM0_LRVW8_LWPMn1_MIAV1_MIWT4_4_MO40_NTn1_NTA0_NTB0_NTC0_NTD0_NTM0_NEPBS0_NLCA1_NLCB2_ONLL1_PGR2_PLR1_PKA0_SIA3_SS1_SU32_SUM1_SUS256_SPO0_SRVW0_SSO0_SVW4_SK0_SKXCCM0_TLDS2_ULSGRO0_USL1_UIOFGRO0_USFGROn1_VSn1_VWA4_VWB4_WSGRA0_WSGRB0_WS32_WG32_4_1_WGM8_WGMXCC1_WGMXCCGn1
    SolutionIndex: 31
    SolutionNameMin: Cijk_Alik_Bljk_HSS_BH_HAS_UserArgs_MT128x128x32_MI16x16x1_SN_LDSB1_AFC1_AFEM1_AFEM1_ASEM1_CLR1_CADS0_DTVA0_DTVB1_EPS0_FDSI0_GRPM1_GRVWA8_GRVWB8_GSU1_GSUAMB_GSUC0_GSUWGMRR0_GLS0_ISA1201_IU1_K1_LBSPPA256_LBSPPB0_LBSPPM0_LPA16_LPB0_LPM0_LRVW8_LWPMn1_MIAV1_MIWT4_4_MO40_NTn1_NTA0_NTB0_NTC0_NTD0_NTM0_NEPBS0_NLCA1_NLCB2_ONLL1_PGR1_PLR1_PKA0_SIA3_SS1_SU32_SUM1_SUS256_SPO0_SRVW0_SSO0_SVW4_SK0_SKXCCM0_TLDS1_ULSGRO0_USL1_UIOFGRO0_USFGROn1_VSn1_VWA4_VWB4_WSGRA0_WSGRB0_WS32_WG32_4_1_WGM8_WGMXCC1_WGMXCCGn1
    SolutionIndex: 32
    SolutionNameMin: Cijk_Alik_Bljk_HSS_BH_HAS_UserArgs_MT128x128x32_MI16x16x1_SN_LDSB0_AFC1_AFEM1_AFEM1_ASEM1_CLR0_CADS0_DTVA0_DTVB1_EPS0_FDSI0_GRPM1_GRVWA8_GRVWB8_GSU1_GSUAMB_GSUC0_GSUWGMRR0_GLS0_ISA1201_IU1_K1_LBSPPA256_LBSPPB0_LBSPPM0_LPA16_LPB0_LPM0_LRVW8_LWPMn1_MIAV1_MIWT4_4_MO40_NTn1_NTA0_NTB0_NTC0_NTD0_NTM0_NEPBS0_NLCA1_NLCB2_ONLL1_PGR1_PLR1_PKA0_SIA3_SS1_SU32_SUM1_SUS256_SPO0_SRVW0_SSO0_SVW4_SK0_SKXCCM0_TLDS2_ULSGRO0_USL1_UIOFGRO0_USFGROn1_VSn1_VWA4_VWB4_WSGRA0_WSGRB0_WS32_WG32_4_1_WGM8_WGMXCC1_WGMXCCGn1
    SolutionIndex: 33
    SolutionNameMin: Cijk_Alik_Bljk_HSS_BH_HAS_UserArgs_MT64x256x32_MI16x16x1_SN_LDSB1_AFC1_AFEM1_AFEM1_ASEM1_CLR0_CADS0_DTVA0_DTVB1_EPS1_FDSI0_GRPM1_GRVWA8_GRVWB8_GSU1_GSUAMB_GSUC0_GSUWGMRR0_GLS0_ISA1201_IU1_K1_LBSPPA256_LBSPPB0_LBSPPM0_LPA16_LPB0_LPM0_LRVW8_LWPMn1_MIAV1_MIWT4_4_MO40_NTn1_NTA0_NTB0_NTC0_NTD0_NTM0_NEPBS0_NLCA1_NLCB2_ONLL1_PGR1_PLR1_PKA0_SIA3_SS1_SU32_SUM1_SUS256_SPO0_SRVW0_SSO0_SVW4_SK0_SKXCCM0_TLDS1_ULSGRO0_USL1_UIOFGRO0_USFGROn1_VSn1_VWA4_VWB4_WSGRA0_WSGRB0_WS32_WG16_8_1_WGM8_WGMXCC1_WGMXCCGn1
    SolutionIndex: 34
    SolutionNameMin: Cijk_Alik_Bljk_HSS_BH_HAS_UserArgs_MT64x256x32_MI16x16x1_SN_LDSB1_AFC1_AFEM1_AFEM1_ASEM1_CLR1_CADS0_DTVA0_DTVB1_EPS0_FDSI0_GRPM1_GRVWA8_GRVWB8_GSU1_GSUAMB_GSUC0_GSUWGMRR0_GLS0_ISA1201_IU1_K1_LBSPPA256_LBSPPB0_LBSPPM0_LPA16_LPB0_LPM0_LRVW8_LWPMn1_MIAV1_MIWT4_4_MO40_NTn1_NTA0_NTB0_NTC0_NTD0_NTM0_NEPBS0_NLCA1_NLCB2_ONLL1_PGR2_PLR1_PKA0_SIA3_SS1_SU32_SUM1_SUS256_SPO0_SRVW0_SSO0_SVW4_SK0_SKXCCM0_TLDS2_ULSGRO0_USL1_UIOFGRO0_USFGROn1_VSn1_VWA4_VWB4_WSGRA0_WSGRB0_WS32_WG16_8_1_WGM8_WGMXCC1_WGMXCCGn1
    SolutionIndex: 35
    SolutionNameMin: Cijk_Alik_Bljk_HSS_BH_HAS_UserArgs_MT128x128x32_MI16x16x1_SN_LDSB0_AFC1_AFEM1_AFEM1_ASEM1_CLR0_CADS0_DTVA0_DTVB1_EPS0_FDSI0_GRPM1_GRVWA8_GRVWB8_GSU1_GSUAMB_GSUC0_GSUWGMRR0_GLS0_ISA1201_IU1_K1_LBSPPA256_LBSPPB0_LBSPPM0_LPA16_LPB0_LPM0_LRVW8_LWPMn1_MIAV1_MIWT4_4_MO40_NTn1_NTA0_NTB0_NTC0_NTD0_NTM0_NEPBS0_NLCA1_NLCB2_ONLL1_PGR2_PLR1_PKA0_SIA3_SS1_SU32_SUM1_SUS256_SPO0_SRVW0_SSO0_SVW4_SK0_SKXCCM0_TLDS2_ULSGRO0_USL1_UIOFGRO0_USFGROn1_VSn1_VWA4_VWB4_WSGRA0_WSGRB0_WS32_WG32_4_1_WGM8_WGMXCC1_WGMXCCGn1
    SolutionIndex: 36
    SolutionNameMin: Cijk_Alik_Bljk_HSS_BH_HAS_UserArgs_MT64x256x32_MI16x16x1_SN_LDSB0_AFC1_AFEM1_AFEM1_ASEM1_CLR1_CADS0_DTVA0_DTVB1_EPS0_FDSI0_GRPM1_GRVWA4_GRVWB8_GSU1_GSUAMB_GSUC0_GSUWGMRR0_GLS0_ISA1201_IU1_K1_LBSPPA256_LBSPPB0_LBSPPM0_LPA16_LPB0_LPM0_LRVW8_LWPMn1_MIAV1_MIWT4_4_MO40_NTn1_NTA0_NTB0_NTC0_NTD0_NTM0_NEPBS0_NLCA1_NLCB2_ONLL1_PGR2_PLR1_PKA0_SIA3_SS1_SU32_SUM1_SUS256_SPO0_SRVW0_SSO0_SVW4_SK0_SKXCCM0_TLDS1_ULSGRO0_USL1_UIOFGRO0_USFGROn1_VSn1_VWA4_VWB4_WSGRA0_WSGRB0_WS32_WG16_8_1_WGM8_WGMXCC1_WGMXCCGn1
    SolutionIndex: 37
    SolutionNameMin: Cijk_Alik_Bljk_HSS_BH_HAS_UserArgs_MT128x128x32_MI16x16x1_SN_LDSB1_AFC1_AFEM1_AFEM1_ASEM1_CLR0_CADS0_DTVA0_DTVB1_EPS0_FDSI0_GRPM1_GRVWA8_GRVWB8_GSU1_GSUAMB_GSUC0_GSUWGMRR0_GLS0_ISA1201_IU1_K1_LBSPPA256_LBSPPB0_LBSPPM0_LPA16_LPB0_LPM0_LRVW8_LWPMn1_MIAV1_MIWT4_4_MO40_NTn1_NTA0_NTB0_NTC0_NTD0_NTM0_NEPBS0_NLCA1_NLCB2_ONLL1_PGR2_PLR1_PKA0_SIA3_SS1_SU32_SUM1_SUS256_SPO0_SRVW0_SSO0_SVW4_SK0_SKXCCM0_TLDS2_ULSGRO0_USL1_UIOFGRO0_USFGROn1_VSn1_VWA4_VWB4_WSGRA0_WSGRB0_WS32_WG32_4_1_WGM8_WGMXCC1_WGMXCCGn1
    SolutionIndex: 38
    SolutionNameMin: Cijk_Alik_Bljk_HSS_BH_HAS_UserArgs_MT128x128x32_MI16x16x1_SN_LDSB0_AFC1_AFEM1_AFEM1_ASEM1_CLR1_CADS0_DTVA0_DTVB1_EPS0_FDSI0_GRPM1_GRVWA8_GRVWB8_GSU1_GSUAMB_GSUC0_GSUWGMRR0_GLS0_ISA1201_IU1_K1_LBSPPA256_LBSPPB0_LBSPPM0_LPA16_LPB0_LPM0_LRVW8_LWPMn1_MIAV1_MIWT4_4_MO40_NTn1_NTA0_NTB0_NTC0_NTD0_NTM0_NEPBS0_NLCA1_NLCB2_ONLL1_PGR2_PLR1_PKA0_SIA3_SS1_SU32_SUM1_SUS256_SPO0_SRVW0_SSO0_SVW4_SK0_SKXCCM0_TLDS1_ULSGRO0_USL1_UIOFGRO0_USFGROn1_VSn1_VWA4_VWB4_WSGRA0_WSGRB0_WS32_WG32_4_1_WGM8_WGMXCC1_WGMXCCGn1
    SolutionIndex: 39
    SolutionNameMin: Cijk_Alik_Bljk_HSS_BH_HAS_UserArgs_MT64x256x32_MI16x16x1_SN_LDSB0_AFC1_AFEM1_AFEM1_ASEM1_CLR0_CADS0_DTVA0_DTVB0_EPS0_FDSI0_GRPM1_GRVWA8_GRVWB8_GSU1_GSUAMB_GSUC0_GSUWGMRR0_GLS0_ISA1201_IU1_K1_LBSPPA256_LBSPPB256_LBSPPM0_LPA16_LPB16_LPM0_LRVW8_LWPMn1_MIAV1_MIWT4_4_MO40_NTn1_NTA0_NTB0_NTC0_NTD0_NTM0_NEPBS0_NLCA1_NLCB1_ONLL1_PGR2_PLR1_PKA0_SIA3_SS1_SU32_SUM1_SUS256_SPO0_SRVW0_SSO0_SVW4_SK0_SKXCCM0_TLDS2_ULSGRO0_USL1_UIOFGRO0_USFGROn1_VSn1_VWA4_VWB4_WSGRA0_WSGRB0_WS32_WG16_8_1_WGM8_WGMXCC1_WGMXCCGn1
    SolutionIndex: 40
    SolutionNameMin: Cijk_Alik_Bljk_HSS_BH_HAS_UserArgs_MT128x128x32_MI16x16x1_SN_LDSB1_AFC1_AFEM1_AFEM1_ASEM1_CLR1_CADS0_DTVA0_DTVB1_EPS1_FDSI0_GRPM1_GRVWA8_GRVWB8_GSU1_GSUAMB_GSUC0_GSUWGMRR0_GLS0_ISA1201_IU1_K1_LBSPPA256_LBSPPB0_LBSPPM0_LPA16_LPB0_LPM0_LRVW8_LWPMn1_MIAV1_MIWT4_4_MO40_NTn1_NTA0_NTB0_NTC0_NTD0_NTM0_NEPBS0_NLCA1_NLCB2_ONLL1_PGR1_PLR1_PKA0_SIA3_SS1_SU32_SUM1_SUS256_SPO0_SRVW0_SSO0_SVW4_SK0_SKXCCM0_TLDS1_ULSGRO0_USL1_UIOFGRO0_USFGROn1_VSn1_VWA4_VWB4_WSGRA0_WSGRB0_WS32_WG32_4_1_WGM8_WGMXCC1_WGMXCCGn1
    SolutionIndex: 41
    SolutionNameMin: Cijk_Alik_Bljk_HSS_BH_HAS_UserArgs_MT128x128x32_MI16x16x1_SN_LDSB0_AFC1_AFEM1_AFEM1_ASEM1_CLR0_CADS0_DTVA0_DTVB1_EPS0_FDSI0_GRPM1_GRVWA8_GRVWB8_GSU1_GSUAMB_GSUC0_GSUWGMRR0_GLS0_ISA1201_IU1_K1_LBSPPA256_LBSPPB0_LBSPPM0_LPA16_LPB0_LPM0_LRVW8_LWPMn1_MIAV1_MIWT4_4_MO40_NTn1_NTA0_NTB0_NTC0_NTD0_NTM0_NEPBS0_NLCA1_NLCB2_ONLL1_PGR2_PLR1_PKA0_SIA3_SS1_SU32_SUM1_SUS256_SPO0_SRVW0_SSO0_SVW4_SK0_SKXCCM0_TLDS1_ULSGRO0_USL1_UIOFGRO0_USFGROn1_VSn1_VWA4_VWB4_WSGRA0_WSGRB0_WS32_WG32_4_1_WGM8_WGMXCC1_WGMXCCGn1
    SolutionIndex: 42
    SolutionNameMin: Cijk_Alik_Bljk_HSS_BH_HAS_UserArgs_MT128x128x32_MI16x16x1_SN_LDSB1_AFC1_AFEM1_AFEM1_ASEM1_CLR0_CADS0_DTVA0_DTVB1_EPS0_FDSI0_GRPM1_GRVWA4_GRVWB8_GSU1_GSUAMB_GSUC0_GSUWGMRR0_GLS0_ISA1201_IU1_K1_LBSPPA256_LBSPPB0_LBSPPM0_LPA16_LPB0_LPM0_LRVW8_LWPMn1_MIAV1_MIWT4_4_MO40_NTn1_NTA0_NTB0_NTC0_NTD0_NTM0_NEPBS0_NLCA1_NLCB2_ONLL1_PGR2_PLR1_PKA0_SIA3_SS1_SU32_SUM1_SUS256_SPO0_SRVW0_SSO0_SVW4_SK0_SKXCCM0_TLDS1_ULSGRO0_USL1_UIOFGRO0_USFGROn1_VSn1_VWA4_VWB4_WSGRA0_WSGRB0_WS32_WG32_4_1_WGM8_WGMXCC1_WGMXCCGn1
    SolutionIndex: 43
    SolutionNameMin: Cijk_Alik_Bljk_HSS_BH_HAS_UserArgs_MT128x128x32_MI16x16x1_SN_LDSB0_AFC1_AFEM1_AFEM1_ASEM1_CLR0_CADS0_DTVA0_DTVB1_EPS1_FDSI0_GRPM1_GRVWA4_GRVWB8_GSU1_GSUAMB_GSUC0_GSUWGMRR0_GLS0_ISA1201_IU1_K1_LBSPPA256_LBSPPB0_LBSPPM0_LPA16_LPB0_LPM0_LRVW8_LWPMn1_MIAV1_MIWT4_4_MO40_NTn1_NTA0_NTB0_NTC0_NTD0_NTM0_NEPBS0_NLCA1_NLCB2_ONLL1_PGR1_PLR1_PKA0_SIA3_SS1_SU32_SUM1_SUS256_SPO0_SRVW0_SSO0_SVW4_SK0_SKXCCM0_TLDS1_ULSGRO0_USL1_UIOFGRO0_USFGROn1_VSn1_VWA4_VWB4_WSGRA0_WSGRB0_WS32_WG32_4_1_WGM8_WGMXCC1_WGMXCCGn1
    SolutionIndex: 44
    SolutionNameMin: Cijk_Alik_Bljk_HSS_BH_HAS_UserArgs_MT128x128x32_MI16x16x1_SN_LDSB1_AFC1_AFEM1_AFEM1_ASEM1_CLR0_CADS0_DTVA0_DTVB1_EPS1_FDSI0_GRPM1_GRVWA8_GRVWB8_GSU1_GSUAMB_GSUC0_GSUWGMRR0_GLS0_ISA1201_IU1_K1_LBSPPA256_LBSPPB0_LBSPPM0_LPA16_LPB0_LPM0_LRVW8_LWPMn1_MIAV1_MIWT4_4_MO40_NTn1_NTA0_NTB0_NTC0_NTD0_NTM0_NEPBS0_NLCA1_NLCB2_ONLL1_PGR1_PLR1_PKA0_SIA3_SS1_SU32_SUM1_SUS256_SPO0_SRVW0_SSO0_SVW4_SK0_SKXCCM0_TLDS1_ULSGRO0_USL1_UIOFGRO0_USFGROn1_VSn1_VWA4_VWB4_WSGRA0_WSGRB0_WS32_WG32_4_1_WGM8_WGMXCC1_WGMXCCGn1
    SolutionIndex: 45
    SolutionNameMin: Cijk_Alik_Bljk_HSS_BH_HAS_UserArgs_MT64x256x32_MI16x16x1_SN_LDSB0_AFC1_AFEM1_AFEM1_ASEM1_CLR1_CADS0_DTVA0_DTVB1_EPS0_FDSI0_GRPM1_GRVWA4_GRVWB8_GSU1_GSUAMB_GSUC0_GSUWGMRR0_GLS0_ISA1201_IU1_K1_LBSPPA256_LBSPPB0_LBSPPM0_LPA16_LPB0_LPM0_LRVW8_LWPMn1_MIAV1_MIWT4_4_MO40_NTn1_NTA0_NTB0_NTC0_NTD0_NTM0_NEPBS0_NLCA1_NLCB2_ONLL1_PGR1_PLR1_PKA0_SIA3_SS1_SU32_SUM1_SUS256_SPO0_SRVW0_SSO0_SVW4_SK0_SKXCCM0_TLDS1_ULSGRO0_USL1_UIOFGRO0_USFGROn1_VSn1_VWA4_VWB4_WSGRA0_WSGRB0_WS32_WG16_8_1_WGM8_WGMXCC1_WGMXCCGn1
    SolutionIndex: 46
    SolutionNameMin: Cijk_Alik_Bljk_HSS_BH_HAS_UserArgs_MT64x256x32_MI16x16x1_SN_LDSB1_AFC1_AFEM1_AFEM1_ASEM1_CLR1_CADS0_DTVA0_DTVB1_EPS0_FDSI0_GRPM1_GRVWA8_GRVWB8_GSU1_GSUAMB_GSUC0_GSUWGMRR0_GLS0_ISA1201_IU1_K1_LBSPPA256_LBSPPB0_LBSPPM0_LPA16_LPB0_LPM0_LRVW8_LWPMn1_MIAV1_MIWT4_4_MO40_NTn1_NTA0_NTB0_NTC0_NTD0_NTM0_NEPBS0_NLCA1_NLCB2_ONLL1_PGR1_PLR1_PKA0_SIA3_SS1_SU32_SUM1_SUS256_SPO0_SRVW0_SSO0_SVW4_SK0_SKXCCM0_TLDS1_ULSGRO0_USL1_UIOFGRO0_USFGROn1_VSn1_VWA4_VWB4_WSGRA0_WSGRB0_WS32_WG16_8_1_WGM8_WGMXCC1_WGMXCCGn1
    SolutionIndex: 47
    SolutionNameMin: Cijk_Alik_Bljk_HSS_BH_HAS_UserArgs_MT128x128x32_MI16x16x1_SN_LDSB1_AFC1_AFEM1_AFEM1_ASEM1_CLR0_CADS0_DTVA0_DTVB1_EPS0_FDSI0_GRPM1_GRVWA4_GRVWB8_GSU1_GSUAMB_GSUC0_GSUWGMRR0_GLS0_ISA1201_IU1_K1_LBSPPA256_LBSPPB0_LBSPPM0_LPA16_LPB0_LPM0_LRVW8_LWPMn1_MIAV1_MIWT4_4_MO40_NTn1_NTA0_NTB0_NTC0_NTD0_NTM0_NEPBS0_NLCA1_NLCB2_ONLL1_PGR2_PLR1_PKA0_SIA3_SS1_SU32_SUM1_SUS256_SPO0_SRVW0_SSO0_SVW4_SK0_SKXCCM0_TLDS2_ULSGRO0_USL1_UIOFGRO0_USFGROn1_VSn1_VWA4_VWB4_WSGRA0_WSGRB0_WS32_WG32_4_1_WGM8_WGMXCC1_WGMXCCGn1
    SolutionIndex: 48
    SolutionNameMin: Cijk_Alik_Bljk_HSS_BH_HAS_UserArgs_MT128x128x32_MI16x16x1_SN_LDSB1_AFC1_AFEM1_AFEM1_ASEM1_CLR1_CADS0_DTVA0_DTVB1_EPS0_FDSI0_GRPM1_GRVWA4_GRVWB8_GSU1_GSUAMB_GSUC0_GSUWGMRR0_GLS0_ISA1201_IU1_K1_LBSPPA256_LBSPPB0_LBSPPM0_LPA16_LPB0_LPM0_LRVW8_LWPMn1_MIAV1_MIWT4_4_MO40_NTn1_NTA0_NTB0_NTC0_NTD0_NTM0_NEPBS0_NLCA1_NLCB2_ONLL1_PGR2_PLR1_PKA0_SIA3_SS1_SU32_SUM1_SUS256_SPO0_SRVW0_SSO0_SVW4_SK0_SKXCCM0_TLDS1_ULSGRO0_USL1_UIOFGRO0_USFGROn1_VSn1_VWA4_VWB4_WSGRA0_WSGRB0_WS32_WG32_4_1_WGM8_WGMXCC1_WGMXCCGn1
    SolutionIndex: 49
    SolutionNameMin: Cijk_Alik_Bljk_HSS_BH_HAS_UserArgs_MT128x128x32_MI16x16x1_SN_LDSB1_AFC1_AFEM1_AFEM1_ASEM1_CLR1_CADS0_DTVA0_DTVB0_EPS1_FDSI0_GRPM1_GRVWA4_GRVWB8_GSU1_GSUAMB_GSUC0_GSUWGMRR0_GLS0_ISA1201_IU1_K1_LBSPPA256_LBSPPB256_LBSPPM0_LPA16_LPB16_LPM0_LRVW8_LWPMn1_MIAV1_MIWT4_4_MO40_NTn1_NTA0_NTB0_NTC0_NTD0_NTM0_NEPBS0_NLCA1_NLCB1_ONLL1_PGR1_PLR1_PKA0_SIA3_SS1_SU32_SUM1_SUS256_SPO0_SRVW0_SSO0_SVW4_SK0_SKXCCM0_TLDS2_ULSGRO0_USL1_UIOFGRO0_USFGROn1_VSn1_VWA4_VWB4_WSGRA0_WSGRB0_WS32_WG32_4_1_WGM8_WGMXCC1_WGMXCCGn1
    SolutionIndex: 50
    SolutionNameMin: Cijk_Alik_Bljk_HSS_BH_HAS_UserArgs_MT128x128x32_MI16x16x1_SN_LDSB1_AFC1_AFEM1_AFEM1_ASEM1_CLR0_CADS0_DTVA0_DTVB0_EPS0_FDSI0_GRPM1_GRVWA8_GRVWB4_GSU1_GSUAMB_GSUC0_GSUWGMRR0_GLS0_ISA1201_IU1_K1_LBSPPA256_LBSPPB256_LBSPPM0_LPA16_LPB16_LPM0_LRVW8_LWPMn1_MIAV1_MIWT4_4_MO40_NTn1_NTA0_NTB0_NTC0_NTD0_NTM0_NEPBS0_NLCA1_NLCB1_ONLL1_PGR1_PLR1_PKA0_SIA3_SS1_SU32_SUM1_SUS256_SPO0_SRVW0_SSO0_SVW4_SK0_SKXCCM0_TLDS2_ULSGRO0_USL1_UIOFGRO0_USFGROn1_VSn1_VWA4_VWB4_WSGRA0_WSGRB0_WS32_WG32_4_1_WGM8_WGMXCC1_WGMXCCGn1
    SolutionIndex: 51
    SolutionNameMin: Cijk_Alik_Bljk_HSS_BH_HAS_UserArgs_MT128x128x32_MI16x16x1_SN_LDSB0_AFC1_AFEM1_AFEM1_ASEM1_CLR1_CADS0_DTVA0_DTVB1_EPS1_FDSI0_GRPM1_GRVWA4_GRVWB8_GSU1_GSUAMB_GSUC0_GSUWGMRR0_GLS0_ISA1201_IU1_K1_LBSPPA256_LBSPPB0_LBSPPM0_LPA16_LPB0_LPM0_LRVW8_LWPMn1_MIAV1_MIWT4_4_MO40_NTn1_NTA0_NTB0_NTC0_NTD0_NTM0_NEPBS0_NLCA1_NLCB2_ONLL1_PGR1_PLR1_PKA0_SIA3_SS1_SU32_SUM1_SUS256_SPO0_SRVW0_SSO0_SVW4_SK0_SKXCCM0_TLDS2_ULSGRO0_USL1_UIOFGRO0_USFGROn1_VSn1_VWA4_VWB4_WSGRA0_WSGRB0_WS32_WG32_4_1_WGM8_WGMXCC1_WGMXCCGn1
    SolutionIndex: 52
    SolutionNameMin: Cijk_Alik_Bljk_HSS_BH_HAS_UserArgs_MT128x128x32_MI16x16x1_SN_LDSB0_AFC1_AFEM1_AFEM1_ASEM1_CLR1_CADS0_DTVA0_DTVB1_EPS0_FDSI0_GRPM1_GRVWA4_GRVWB8_GSU1_GSUAMB_GSUC0_GSUWGMRR0_GLS0_ISA1201_IU1_K1_LBSPPA256_LBSPPB0_LBSPPM0_LPA16_LPB0_LPM0_LRVW8_LWPMn1_MIAV1_MIWT4_4_MO40_NTn1_NTA0_NTB0_NTC0_NTD0_NTM0_NEPBS0_NLCA1_NLCB2_ONLL1_PGR1_PLR1_PKA0_SIA3_SS1_SU32_SUM1_SUS256_SPO0_SRVW0_SSO0_SVW4_SK0_SKXCCM0_TLDS2_ULSGRO0_USL1_UIOFGRO0_USFGROn1_VSn1_VWA4_VWB4_WSGRA0_WSGRB0_WS32_WG32_4_1_WGM8_WGMXCC1_WGMXCCGn1
    SolutionIndex: 53
    SolutionNameMin: Cijk_Alik_Bljk_HSS_BH_HAS_UserArgs_MT128x128x32_MI16x16x1_SN_LDSB0_AFC1_AFEM1_AFEM1_ASEM1_CLR1_CADS0_DTVA0_DTVB0_EPS0_FDSI0_GRPM1_GRVWA4_GRVWB4_GSU1_GSUAMB_GSUC0_GSUWGMRR0_GLS0_ISA1201_IU1_K1_LBSPPA256_LBSPPB256_LBSPPM0_LPA16_LPB16_LPM0_LRVW8_LWPMn1_MIAV1_MIWT4_4_MO40_NTn1_NTA0_NTB0_NTC0_NTD0_NTM0_NEPBS0_NLCA1_NLCB1_ONLL1_PGR2_PLR0_PKA0_SIA3_SS1_SU32_SUM1_SUS256_SPO0_SRVW0_SSO0_SVW4_SK0_SKXCCM0_TLDS2_ULSGRO0_USL1_UIOFGRO0_USFGROn1_VSn1_VWA4_VWB4_WSGRA0_WSGRB0_WS32_WG32_4_1_WGM8_WGMXCC1_WGMXCCGn1
    SolutionIndex: 54
    SolutionNameMin: Cijk_Alik_Bljk_HSS_BH_HAS_UserArgs_MT128x128x32_MI16x16x1_SN_LDSB0_AFC1_AFEM1_AFEM1_ASEM1_CLR0_CADS0_DTVA0_DTVB0_EPS1_FDSI0_GRPM1_GRVWA4_GRVWB8_GSU1_GSUAMB_GSUC0_GSUWGMRR0_GLS0_ISA1201_IU1_K1_LBSPPA256_LBSPPB256_LBSPPM0_LPA16_LPB16_LPM0_LRVW8_LWPMn1_MIAV1_MIWT4_4_MO40_NTn1_NTA0_NTB0_NTC0_NTD0_NTM0_NEPBS0_NLCA1_NLCB1_ONLL1_PGR1_PLR1_PKA0_SIA3_SS1_SU32_SUM1_SUS256_SPO0_SRVW0_SSO0_SVW4_SK0_SKXCCM0_TLDS2_ULSGRO0_USL1_UIOFGRO0_USFGROn1_VSn1_VWA4_VWB4_WSGRA0_WSGRB0_WS32_WG32_4_1_WGM8_WGMXCC1_WGMXCCGn1
    SolutionIndex: 55
    SolutionNameMin: Cijk_Alik_Bljk_HSS_BH_HAS_UserArgs_MT128x128x32_MI16x16x1_SN_LDSB0_AFC1_AFEM1_AFEM1_ASEM1_CLR0_CADS0_DTVA0_DTVB0_EPS0_FDSI0_GRPM1_GRVWA4_GRVWB4_GSU1_GSUAMB_GSUC0_GSUWGMRR0_GLS0_ISA1201_IU1_K1_LBSPPA256_LBSPPB256_LBSPPM0_LPA16_LPB16_LPM0_LRVW8_LWPMn1_MIAV1_MIWT4_4_MO40_NTn1_NTA0_NTB0_NTC0_NTD0_NTM0_NEPBS0_NLCA1_NLCB1_ONLL1_PGR1_PLR1_PKA0_SIA3_SS1_SU32_SUM1_SUS256_SPO0_SRVW0_SSO0_SVW4_SK0_SKXCCM0_TLDS2_ULSGRO0_USL1_UIOFGRO0_USFGROn1_VSn1_VWA4_VWB4_WSGRA0_WSGRB0_WS32_WG32_4_1_WGM8_WGMXCC1_WGMXCCGn1
    SolutionIndex: 56
    SolutionNameMin: Cijk_Alik_Bljk_HSS_BH_HAS_UserArgs_MT128x128x32_MI16x16x1_SN_LDSB0_AFC1_AFEM1_AFEM1_ASEM1_CLR1_CADS0_DTVA0_DTVB0_EPS1_FDSI0_GRPM1_GRVWA8_GRVWB4_GSU1_GSUAMB_GSUC0_GSUWGMRR0_GLS0_ISA1201_IU1_K1_LBSPPA256_LBSPPB256_LBSPPM0_LPA16_LPB16_LPM0_LRVW8_LWPMn1_MIAV1_MIWT4_4_MO40_NTn1_NTA0_NTB0_NTC0_NTD0_NTM0_NEPBS0_NLCA1_NLCB1_ONLL1_PGR1_PLR0_PKA0_SIA3_SS1_SU32_SUM1_SUS256_SPO0_SRVW0_SSO0_SVW4_SK0_SKXCCM0_TLDS2_ULSGRO0_USL1_UIOFGRO0_USFGROn1_VSn1_VWA4_VWB4_WSGRA0_WSGRB0_WS32_WG32_4_1_WGM8_WGMXCC1_WGMXCCGn1
    SolutionIndex: 57
    SolutionNameMin: Cijk_Alik_Bljk_HSS_BH_HAS_UserArgs_MT128x128x32_MI16x16x1_SN_LDSB1_AFC1_AFEM1_AFEM1_ASEM1_CLR0_CADS0_DTVA0_DTVB1_EPS0_FDSI0_GRPM1_GRVWA8_GRVWB8_GSU1_GSUAMB_GSUC0_GSUWGMRR0_GLS0_ISA1201_IU1_K1_LBSPPA256_LBSPPB0_LBSPPM0_LPA16_LPB0_LPM0_LRVW8_LWPMn1_MIAV1_MIWT4_4_MO40_NTn1_NTA0_NTB0_NTC0_NTD0_NTM0_NEPBS0_NLCA1_NLCB2_ONLL1_PGR2_PLR1_PKA0_SIA3_SS1_SU32_SUM1_SUS256_SPO0_SRVW0_SSO0_SVW4_SK0_SKXCCM0_TLDS1_ULSGRO0_USL1_UIOFGRO0_USFGROn1_VSn1_VWA4_VWB4_WSGRA0_WSGRB0_WS32_WG32_4_1_WGM8_WGMXCC1_WGMXCCGn1
    SolutionIndex: 58
    SolutionNameMin: Cijk_Alik_Bljk_HSS_BH_HAS_UserArgs_MT128x128x32_MI16x16x1_SN_LDSB0_AFC1_AFEM1_AFEM1_ASEM1_CLR1_CADS0_DTVA0_DTVB1_EPS1_FDSI0_GRPM1_GRVWA8_GRVWB8_GSU1_GSUAMB_GSUC0_GSUWGMRR0_GLS0_ISA1201_IU1_K1_LBSPPA256_LBSPPB0_LBSPPM0_LPA16_LPB0_LPM0_LRVW8_LWPMn1_MIAV1_MIWT4_4_MO40_NTn1_NTA0_NTB0_NTC0_NTD0_NTM0_NEPBS0_NLCA1_NLCB2_ONLL1_PGR1_PLR1_PKA0_SIA3_SS1_SU32_SUM1_SUS256_SPO0_SRVW0_SSO0_SVW4_SK0_SKXCCM0_TLDS1_ULSGRO0_USL1_UIOFGRO0_USFGROn1_VSn1_VWA4_VWB4_WSGRA0_WSGRB0_WS32_WG32_4_1_WGM8_WGMXCC1_WGMXCCGn1
    SolutionIndex: 59
    SolutionNameMin: Cijk_Alik_Bljk_HSS_BH_HAS_UserArgs_MT64x256x32_MI16x16x1_SN_LDSB0_AFC1_AFEM1_AFEM1_ASEM1_CLR1_CADS0_DTVA0_DTVB0_EPS0_FDSI0_GRPM1_GRVWA8_GRVWB8_GSU1_GSUAMB_GSUC0_GSUWGMRR0_GLS0_ISA1201_IU1_K1_LBSPPA256_LBSPPB256_LBSPPM0_LPA16_LPB16_LPM0_LRVW8_LWPMn1_MIAV1_MIWT4_4_MO40_NTn1_NTA0_NTB0_NTC0_NTD0_NTM0_NEPBS0_NLCA1_NLCB1_ONLL1_PGR2_PLR1_PKA0_SIA3_SS1_SU32_SUM1_SUS256_SPO0_SRVW0_SSO0_SVW4_SK0_SKXCCM0_TLDS2_ULSGRO0_USL1_UIOFGRO0_USFGROn1_VSn1_VWA4_VWB4_WSGRA0_WSGRB0_WS32_WG16_8_1_WGM8_WGMXCC1_WGMXCCGn1
    SolutionIndex: 60
    SolutionNameMin: Cijk_Alik_Bljk_HSS_BH_HAS_UserArgs_MT128x128x32_MI16x16x1_SN_LDSB0_AFC1_AFEM1_AFEM1_ASEM1_CLR1_CADS0_DTVA0_DTVB1_EPS1_FDSI0_GRPM1_GRVWA8_GRVWB8_GSU1_GSUAMB_GSUC0_GSUWGMRR0_GLS0_ISA1201_IU1_K1_LBSPPA256_LBSPPB0_LBSPPM0_LPA16_LPB0_LPM0_LRVW8_LWPMn1_MIAV1_MIWT4_4_MO40_NTn1_NTA0_NTB0_NTC0_NTD0_NTM0_NEPBS0_NLCA1_NLCB2_ONLL1_PGR1_PLR1_PKA0_SIA3_SS1_SU32_SUM1_SUS256_SPO0_SRVW0_SSO0_SVW4_SK0_SKXCCM0_TLDS2_ULSGRO0_USL1_UIOFGRO0_USFGROn1_VSn1_VWA4_VWB4_WSGRA0_WSGRB0_WS32_WG32_4_1_WGM8_WGMXCC1_WGMXCCGn1
    SolutionIndex: 61
    SolutionNameMin: Cijk_Alik_Bljk_HSS_BH_HAS_UserArgs_MT64x256x32_MI16x16x1_SN_LDSB1_AFC1_AFEM1_AFEM1_ASEM1_CLR0_CADS0_DTVA0_DTVB1_EPS1_FDSI0_GRPM1_GRVWA8_GRVWB8_GSU1_GSUAMB_GSUC0_GSUWGMRR0_GLS0_ISA1201_IU1_K1_LBSPPA256_LBSPPB0_LBSPPM0_LPA16_LPB0_LPM0_LRVW8_LWPMn1_MIAV1_MIWT4_4_MO40_NTn1_NTA0_NTB0_NTC0_NTD0_NTM0_NEPBS0_NLCA1_NLCB2_ONLL1_PGR1_PLR1_PKA0_SIA3_SS0_SU32_SUM1_SUS256_SPO0_SRVW0_SSO0_SVW8_SK0_SKXCCM0_TLDS1_ULSGRO0_USL1_UIOFGRO0_USFGROn1_VSn1_VWA4_VWB4_WSGRA0_WSGRB0_WS32_WG16_8_1_WGM8_WGMXCC1_WGMXCCGn1
    SolutionIndex: 62
    SolutionNameMin: Cijk_Alik_Bljk_HSS_BH_HAS_UserArgs_MT64x256x32_MI16x16x1_SN_LDSB0_AFC1_AFEM1_AFEM1_ASEM1_CLR0_CADS0_DTVA0_DTVB1_EPS0_FDSI0_GRPM1_GRVWA4_GRVWB8_GSU1_GSUAMB_GSUC0_GSUWGMRR0_GLS0_ISA1201_IU1_K1_LBSPPA256_LBSPPB0_LBSPPM0_LPA16_LPB0_LPM0_LRVW8_LWPMn1_MIAV1_MIWT4_4_MO40_NTn1_NTA0_NTB0_NTC0_NTD0_NTM0_NEPBS0_NLCA1_NLCB2_ONLL1_PGR2_PLR1_PKA0_SIA3_SS0_SU32_SUM1_SUS256_SPO0_SRVW0_SSO0_SVW8_SK0_SKXCCM0_TLDS2_ULSGRO0_USL1_UIOFGRO0_USFGROn1_VSn1_VWA4_VWB4_WSGRA0_WSGRB0_WS32_WG16_8_1_WGM8_WGMXCC1_WGMXCCGn1
    SolutionIndex: 63
    SolutionNameMin: Cijk_Alik_Bljk_HSS_BH_HAS_UserArgs_MT64x256x32_MI16x16x1_SN_LDSB1_AFC1_AFEM1_AFEM1_ASEM1_CLR1_CADS0_DTVA0_DTVB1_EPS1_FDSI0_GRPM1_GRVWA8_GRVWB8_GSU1_GSUAMB_GSUC0_GSUWGMRR0_GLS0_ISA1201_IU1_K1_LBSPPA256_LBSPPB0_LBSPPM0_LPA16_LPB0_LPM0_LRVW8_LWPMn1_MIAV1_MIWT4_4_MO40_NTn1_NTA0_NTB0_NTC0_NTD0_NTM0_NEPBS0_NLCA1_NLCB2_ONLL1_PGR1_PLR1_PKA0_SIA3_SS0_SU32_SUM1_SUS256_SPO0_SRVW0_SSO0_SVW8_SK0_SKXCCM0_TLDS2_ULSGRO0_USL1_UIOFGRO0_USFGROn1_VSn1_VWA4_VWB4_WSGRA0_WSGRB0_WS32_WG16_8_1_WGM8_WGMXCC1_WGMXCCGn1
    SolutionIndex: 64
    SolutionNameMin: Cijk_Alik_Bljk_HSS_BH_HAS_UserArgs_MT64x256x32_MI16x16x1_SN_LDSB0_AFC1_AFEM1_AFEM1_ASEM1_CLR0_CADS0_DTVA0_DTVB1_EPS1_FDSI0_GRPM1_GRVWA8_GRVWB8_GSU1_GSUAMB_GSUC0_GSUWGMRR0_GLS0_ISA1201_IU1_K1_LBSPPA256_LBSPPB0_LBSPPM0_LPA16_LPB0_LPM0_LRVW8_LWPMn1_MIAV1_MIWT4_4_MO40_NTn1_NTA0_NTB0_NTC0_NTD0_NTM0_NEPBS0_NLCA1_NLCB2_ONLL1_PGR1_PLR1_PKA0_SIA3_SS1_SU32_SUM1_SUS256_SPO0_SRVW0_SSO0_SVW4_SK0_SKXCCM0_TLDS1_ULSGRO0_USL1_UIOFGRO0_USFGROn1_VSn1_VWA4_VWB4_WSGRA0_WSGRB0_WS32_WG16_8_1_WGM8_WGMXCC1_WGMXCCGn1
    SolutionIndex: 65
    SolutionNameMin: Cijk_Alik_Bljk_HSS_BH_HAS_UserArgs_MT128x128x32_MI16x16x1_SN_LDSB0_AFC1_AFEM1_AFEM1_ASEM1_CLR1_CADS0_DTVA0_DTVB1_EPS1_FDSI0_GRPM1_GRVWA4_GRVWB8_GSU1_GSUAMB_GSUC0_GSUWGMRR0_GLS0_ISA1201_IU1_K1_LBSPPA256_LBSPPB0_LBSPPM0_LPA16_LPB0_LPM0_LRVW8_LWPMn1_MIAV1_MIWT4_4_MO40_NTn1_NTA0_NTB0_NTC0_NTD0_NTM0_NEPBS0_NLCA1_NLCB2_ONLL1_PGR1_PLR1_PKA0_SIA3_SS1_SU32_SUM1_SUS256_SPO0_SRVW0_SSO0_SVW4_SK0_SKXCCM0_TLDS1_ULSGRO0_USL1_UIOFGRO0_USFGROn1_VSn1_VWA4_VWB4_WSGRA0_WSGRB0_WS32_WG32_4_1_WGM8_WGMXCC1_WGMXCCGn1
    SolutionIndex: 66
    SolutionNameMin: Cijk_Alik_Bljk_HSS_BH_HAS_UserArgs_MT256x64x32_MI16x16x1_SN_LDSB0_AFC1_AFEM1_AFEM1_ASEM1_CLR1_CADS0_DTVA0_DTVB0_EPS0_FDSI0_GRPM1_GRVWA8_GRVWB4_GSU1_GSUAMB_GSUC0_GSUWGMRR0_GLS0_ISA1201_IU1_K1_LBSPPA256_LBSPPB256_LBSPPM0_LPA16_LPB16_LPM0_LRVW8_LWPMn1_MIAV1_MIWT4_4_MO40_NTn1_NTA0_NTB0_NTC0_NTD0_NTM0_NEPBS0_NLCA1_NLCB1_ONLL1_PGR1_PLR1_PKA0_SIA3_SS1_SU32_SUM1_SUS256_SPO0_SRVW0_SSO0_SVW4_SK0_SKXCCM0_TLDS2_ULSGRO0_USL1_UIOFGRO0_USFGROn1_VSn1_VWA4_VWB4_WSGRA0_WSGRB0_WS32_WG64_2_1_WGM8_WGMXCC1_WGMXCCGn1
    SolutionIndex: 67
    SolutionNameMin: Cijk_Alik_Bljk_HSS_BH_HAS_UserArgs_MT256x64x32_MI16x16x1_SN_LDSB1_AFC1_AFEM1_AFEM1_ASEM1_CLR1_CADS0_DTVA1_DTVB0_EPS0_FDSI0_GRPM1_GRVWA8_GRVWB8_GSU1_GSUAMB_GSUC0_GSUWGMRR0_GLS0_ISA1201_IU1_K1_LBSPPA0_LBSPPB256_LBSPPM0_LPA0_LPB16_LPM0_LRVW8_LWPMn1_MIAV1_MIWT4_4_MO40_NTn1_NTA0_NTB0_NTC0_NTD0_NTM0_NEPBS0_NLCA2_NLCB1_ONLL1_PGR2_PLR1_PKA0_SIA3_SS1_SU32_SUM1_SUS256_SPO0_SRVW0_SSO0_SVW4_SK0_SKXCCM0_TLDS2_ULSGRO0_USL1_UIOFGRO0_USFGROn1_VSn1_VWA4_VWB4_WSGRA0_WSGRB0_WS32_WG64_2_1_WGM8_WGMXCC1_WGMXCCGn1
    SolutionIndex: 68
    SolutionNameMin: Cijk_Alik_Bljk_HSS_BH_HAS_UserArgs_MT128x128x32_MI16x16x1_SN_LDSB1_AFC1_AFEM1_AFEM1_ASEM1_CLR0_CADS0_DTVA0_DTVB1_EPS1_FDSI0_GRPM1_GRVWA8_GRVWB8_GSU1_GSUAMB_GSUC0_GSUWGMRR0_GLS0_ISA1201_IU1_K1_LBSPPA256_LBSPPB0_LBSPPM0_LPA16_LPB0_LPM0_LRVW8_LWPMn1_MIAV1_MIWT4_4_MO40_NTn1_NTA0_NTB0_NTC0_NTD0_NTM0_NEPBS0_NLCA1_NLCB2_ONLL1_PGR1_PLR1_PKA0_SIA3_SS1_SU32_SUM1_SUS256_SPO0_SRVW0_SSO0_SVW4_SK0_SKXCCM0_TLDS2_ULSGRO0_USL1_UIOFGRO0_USFGROn1_VSn1_VWA4_VWB4_WSGRA0_WSGRB0_WS32_WG32_4_1_WGM8_WGMXCC1_WGMXCCGn1
    SolutionIndex: 69
    SolutionNameMin: Cijk_Alik_Bljk_HSS_BH_HAS_UserArgs_MT128x128x32_MI16x16x1_SN_LDSB1_AFC1_AFEM1_AFEM1_ASEM1_CLR1_CADS0_DTVA0_DTVB1_EPS1_FDSI0_GRPM1_GRVWA8_GRVWB8_GSU1_GSUAMB_GSUC0_GSUWGMRR0_GLS0_ISA1201_IU1_K1_LBSPPA256_LBSPPB0_LBSPPM0_LPA16_LPB0_LPM0_LRVW8_LWPMn1_MIAV1_MIWT4_4_MO40_NTn1_NTA0_NTB0_NTC0_NTD0_NTM0_NEPBS0_NLCA1_NLCB2_ONLL1_PGR1_PLR1_PKA0_SIA3_SS1_SU32_SUM1_SUS256_SPO0_SRVW0_SSO0_SVW4_SK0_SKXCCM0_TLDS2_ULSGRO0_USL1_UIOFGRO0_USFGROn1_VSn1_VWA4_VWB4_WSGRA0_WSGRB0_WS32_WG32_4_1_WGM8_WGMXCC1_WGMXCCGn1
    SolutionIndex: 70
    SolutionNameMin: Cijk_Alik_Bljk_HSS_BH_HAS_UserArgs_MT128x128x32_MI16x16x1_SN_LDSB1_AFC1_AFEM1_AFEM1_ASEM1_CLR0_CADS0_DTVA0_DTVB1_EPS1_FDSI0_GRPM1_GRVWA4_GRVWB8_GSU1_GSUAMB_GSUC0_GSUWGMRR0_GLS0_ISA1201_IU1_K1_LBSPPA256_LBSPPB0_LBSPPM0_LPA16_LPB0_LPM0_LRVW8_LWPMn1_MIAV1_MIWT4_4_MO40_NTn1_NTA0_NTB0_NTC0_NTD0_NTM0_NEPBS0_NLCA1_NLCB2_ONLL1_PGR1_PLR1_PKA0_SIA3_SS1_SU32_SUM1_SUS256_SPO0_SRVW0_SSO0_SVW4_SK0_SKXCCM0_TLDS1_ULSGRO0_USL1_UIOFGRO0_USFGROn1_VSn1_VWA4_VWB4_WSGRA0_WSGRB0_WS32_WG32_4_1_WGM8_WGMXCC1_WGMXCCGn1
    SolutionIndex: 71
    SolutionNameMin: Cijk_Alik_Bljk_HSS_BH_HAS_UserArgs_MT128x128x32_MI16x16x1_SN_LDSB1_AFC1_AFEM1_AFEM1_ASEM1_CLR0_CADS0_DTVA0_DTVB1_EPS0_FDSI0_GRPM1_GRVWA8_GRVWB8_GSU1_GSUAMB_GSUC0_GSUWGMRR0_GLS0_ISA1201_IU1_K1_LBSPPA256_LBSPPB0_LBSPPM0_LPA16_LPB0_LPM0_LRVW8_LWPMn1_MIAV1_MIWT4_4_MO40_NTn1_NTA0_NTB0_NTC0_NTD0_NTM0_NEPBS0_NLCA1_NLCB2_ONLL1_PGR1_PLR1_PKA0_SIA3_SS1_SU32_SUM1_SUS256_SPO0_SRVW0_SSO0_SVW4_SK0_SKXCCM0_TLDS1_ULSGRO0_USL1_UIOFGRO0_USFGROn1_VSn1_VWA4_VWB4_WSGRA0_WSGRB0_WS32_WG32_4_1_WGM8_WGMXCC1_WGMXCCGn1
    SolutionIndex: 72
    SolutionNameMin: Cijk_Alik_Bljk_HSS_BH_HAS_UserArgs_MT64x256x32_MI16x16x1_SN_LDSB0_AFC1_AFEM1_AFEM1_ASEM1_CLR1_CADS0_DTVA0_DTVB1_EPS1_FDSI0_GRPM1_GRVWA8_GRVWB8_GSU1_GSUAMB_GSUC0_GSUWGMRR0_GLS0_ISA1201_IU1_K1_LBSPPA256_LBSPPB0_LBSPPM0_LPA16_LPB0_LPM0_LRVW8_LWPMn1_MIAV1_MIWT4_4_MO40_NTn1_NTA0_NTB0_NTC0_NTD0_NTM0_NEPBS0_NLCA1_NLCB2_ONLL1_PGR1_PLR1_PKA0_SIA3_SS0_SU32_SUM1_SUS256_SPO0_SRVW0_SSO0_SVW8_SK0_SKXCCM0_TLDS1_ULSGRO0_USL1_UIOFGRO0_USFGROn1_VSn1_VWA4_VWB4_WSGRA0_WSGRB0_WS32_WG16_8_1_WGM8_WGMXCC1_WGMXCCGn1
    SolutionIndex: 73
    SolutionNameMin: Cijk_Alik_Bljk_HSS_BH_HAS_UserArgs_MT64x256x32_MI16x16x1_SN_LDSB0_AFC1_AFEM1_AFEM1_ASEM1_CLR1_CADS0_DTVA0_DTVB1_EPS0_FDSI0_GRPM1_GRVWA8_GRVWB8_GSU1_GSUAMB_GSUC0_GSUWGMRR0_GLS0_ISA1201_IU1_K1_LBSPPA256_LBSPPB0_LBSPPM0_LPA16_LPB0_LPM0_LRVW8_LWPMn1_MIAV1_MIWT4_4_MO40_NTn1_NTA0_NTB0_NTC0_NTD0_NTM0_NEPBS0_NLCA1_NLCB2_ONLL1_PGR1_PLR1_PKA0_SIA3_SS1_SU32_SUM1_SUS256_SPO0_SRVW0_SSO0_SVW4_SK0_SKXCCM0_TLDS2_ULSGRO0_USL1_UIOFGRO0_USFGROn1_VSn1_VWA4_VWB4_WSGRA0_WSGRB0_WS32_WG16_8_1_WGM8_WGMXCC1_WGMXCCGn1
    SolutionIndex: 74
    SolutionNameMin: Cijk_Alik_Bljk_HSS_BH_HAS_UserArgs_MT64x256x32_MI16x16x1_SN_LDSB1_AFC1_AFEM1_AFEM1_ASEM1_CLR1_CADS0_DTVA0_DTVB1_EPS1_FDSI0_GRPM1_GRVWA8_GRVWB8_GSU1_GSUAMB_GSUC0_GSUWGMRR0_GLS0_ISA1201_IU1_K1_LBSPPA256_LBSPPB0_LBSPPM0_LPA16_LPB0_LPM0_LRVW8_LWPMn1_MIAV1_MIWT4_4_MO40_NTn1_NTA0_NTB0_NTC0_NTD0_NTM0_NEPBS0_NLCA1_NLCB2_ONLL1_PGR1_PLR1_PKA0_SIA3_SS1_SU32_SUM1_SUS256_SPO0_SRVW0_SSO0_SVW4_SK0_SKXCCM0_TLDS1_ULSGRO0_USL1_UIOFGRO0_USFGROn1_VSn1_VWA4_VWB4_WSGRA0_WSGRB0_WS32_WG16_8_1_WGM8_WGMXCC1_WGMXCCGn1
    SolutionIndex: 75
    SolutionNameMin: Cijk_Alik_Bljk_HSS_BH_HAS_UserArgs_MT64x256x32_MI16x16x1_SN_LDSB0_AFC1_AFEM1_AFEM1_ASEM1_CLR1_CADS0_DTVA0_DTVB1_EPS0_FDSI0_GRPM1_GRVWA4_GRVWB8_GSU1_GSUAMB_GSUC0_GSUWGMRR0_GLS0_ISA1201_IU1_K1_LBSPPA256_LBSPPB0_LBSPPM0_LPA16_LPB0_LPM0_LRVW8_LWPMn1_MIAV1_MIWT4_4_MO40_NTn1_NTA0_NTB0_NTC0_NTD0_NTM0_NEPBS0_NLCA1_NLCB2_ONLL1_PGR2_PLR1_PKA0_SIA3_SS1_SU32_SUM1_SUS256_SPO0_SRVW0_SSO0_SVW4_SK0_SKXCCM0_TLDS2_ULSGRO0_USL1_UIOFGRO0_USFGROn1_VSn1_VWA4_VWB4_WSGRA0_WSGRB0_WS32_WG16_8_1_WGM8_WGMXCC1_WGMXCCGn1
    SolutionIndex: 76
    SolutionNameMin: Cijk_Alik_Bljk_HSS_BH_HAS_UserArgs_MT256x64x32_MI16x16x1_SN_LDSB0_AFC1_AFEM1_AFEM1_ASEM1_CLR1_CADS0_DTVA1_DTVB0_EPS0_FDSI0_GRPM1_GRVWA8_GRVWB8_GSU1_GSUAMB_GSUC0_GSUWGMRR0_GLS0_ISA1201_IU1_K1_LBSPPA0_LBSPPB256_LBSPPM0_LPA0_LPB16_LPM0_LRVW8_LWPMn1_MIAV1_MIWT4_4_MO40_NTn1_NTA0_NTB0_NTC0_NTD0_NTM0_NEPBS0_NLCA2_NLCB1_ONLL1_PGR2_PLR1_PKA0_SIA3_SS1_SU32_SUM1_SUS256_SPO0_SRVW0_SSO0_SVW4_SK0_SKXCCM0_TLDS2_ULSGRO0_USL1_UIOFGRO0_USFGROn1_VSn1_VWA4_VWB4_WSGRA0_WSGRB0_WS32_WG64_2_1_WGM8_WGMXCC1_WGMXCCGn1
    SolutionIndex: 77
    SolutionNameMin: Cijk_Alik_Bljk_HSS_BH_HAS_UserArgs_MT128x128x32_MI16x16x1_SN_LDSB0_AFC1_AFEM1_AFEM1_ASEM1_CLR1_CADS0_DTVA0_DTVB1_EPS0_FDSI0_GRPM1_GRVWA8_GRVWB8_GSU1_GSUAMB_GSUC0_GSUWGMRR0_GLS0_ISA1201_IU1_K1_LBSPPA256_LBSPPB0_LBSPPM0_LPA16_LPB0_LPM0_LRVW8_LWPMn1_MIAV1_MIWT4_4_MO40_NTn1_NTA0_NTB0_NTC0_NTD0_NTM0_NEPBS0_NLCA1_NLCB2_ONLL1_PGR2_PLR1_PKA0_SIA3_SS1_SU32_SUM1_SUS256_SPO0_SRVW0_SSO0_SVW4_SK0_SKXCCM0_TLDS2_ULSGRO0_USL1_UIOFGRO0_USFGROn1_VSn1_VWA4_VWB4_WSGRA0_WSGRB0_WS32_WG32_4_1_WGM8_WGMXCC1_WGMXCCGn1
    SolutionIndex: 78
    SolutionNameMin: Cijk_Alik_Bljk_HSS_BH_HAS_UserArgs_MT256x64x32_MI16x16x1_SN_LDSB0_AFC1_AFEM1_AFEM1_ASEM1_CLR0_CADS0_DTVA0_DTVB0_EPS0_FDSI0_GRPM1_GRVWA8_GRVWB8_GSU1_GSUAMB_GSUC0_GSUWGMRR0_GLS0_ISA1201_IU1_K1_LBSPPA256_LBSPPB256_LBSPPM0_LPA16_LPB16_LPM0_LRVW8_LWPMn1_MIAV1_MIWT4_4_MO40_NTn1_NTA0_NTB0_NTC0_NTD0_NTM0_NEPBS0_NLCA1_NLCB1_ONLL1_PGR2_PLR1_PKA0_SIA3_SS1_SU32_SUM1_SUS256_SPO0_SRVW0_SSO0_SVW4_SK0_SKXCCM0_TLDS2_ULSGRO0_USL1_UIOFGRO0_USFGROn1_VSn1_VWA4_VWB4_WSGRA0_WSGRB0_WS32_WG64_2_1_WGM8_WGMXCC1_WGMXCCGn1
    SolutionIndex: 79
    SolutionNameMin: Cijk_Alik_Bljk_HSS_BH_HAS_UserArgs_MT256x64x32_MI16x16x1_SN_LDSB0_AFC1_AFEM1_AFEM1_ASEM1_CLR1_CADS0_DTVA0_DTVB0_EPS0_FDSI0_GRPM1_GRVWA8_GRVWB8_GSU1_GSUAMB_GSUC0_GSUWGMRR0_GLS0_ISA1201_IU1_K1_LBSPPA256_LBSPPB256_LBSPPM0_LPA16_LPB16_LPM0_LRVW8_LWPMn1_MIAV1_MIWT4_4_MO40_NTn1_NTA0_NTB0_NTC0_NTD0_NTM0_NEPBS0_NLCA1_NLCB1_ONLL1_PGR2_PLR1_PKA0_SIA3_SS1_SU32_SUM1_SUS256_SPO0_SRVW0_SSO0_SVW4_SK0_SKXCCM0_TLDS1_ULSGRO0_USL1_UIOFGRO0_USFGROn1_VSn1_VWA4_VWB4_WSGRA0_WSGRB0_WS32_WG64_2_1_WGM8_WGMXCC1_WGMXCCGn1
    SolutionIndex: 80
    SolutionNameMin: Cijk_Alik_Bljk_HSS_BH_HAS_UserArgs_MT128x128x32_MI16x16x1_SN_LDSB1_AFC1_AFEM1_AFEM1_ASEM1_CLR1_CADS0_DTVA0_DTVB1_EPS0_FDSI0_GRPM1_GRVWA4_GRVWB8_GSU1_GSUAMB_GSUC0_GSUWGMRR0_GLS0_ISA1201_IU1_K1_LBSPPA256_LBSPPB0_LBSPPM0_LPA16_LPB0_LPM0_LRVW8_LWPMn1_MIAV1_MIWT4_4_MO40_NTn1_NTA0_NTB0_NTC0_NTD0_NTM0_NEPBS0_NLCA1_NLCB2_ONLL1_PGR2_PLR1_PKA0_SIA3_SS1_SU32_SUM1_SUS256_SPO0_SRVW0_SSO0_SVW4_SK0_SKXCCM0_TLDS2_ULSGRO0_USL1_UIOFGRO0_USFGROn1_VSn1_VWA4_VWB4_WSGRA0_WSGRB0_WS32_WG32_4_1_WGM8_WGMXCC1_WGMXCCGn1
    SolutionIndex: 81
    SolutionNameMin: Cijk_Alik_Bljk_HSS_BH_HAS_UserArgs_MT64x256x32_MI16x16x1_SN_LDSB1_AFC1_AFEM1_AFEM1_ASEM1_CLR0_CADS0_DTVA0_DTVB1_EPS0_FDSI0_GRPM1_GRVWA4_GRVWB8_GSU1_GSUAMB_GSUC0_GSUWGMRR0_GLS0_ISA1201_IU1_K1_LBSPPA256_LBSPPB0_LBSPPM0_LPA16_LPB0_LPM0_LRVW8_LWPMn1_MIAV1_MIWT4_4_MO40_NTn1_NTA0_NTB0_NTC0_NTD0_NTM0_NEPBS0_NLCA1_NLCB2_ONLL1_PGR2_PLR1_PKA0_SIA3_SS1_SU32_SUM1_SUS256_SPO0_SRVW0_SSO0_SVW4_SK0_SKXCCM0_TLDS1_ULSGRO0_USL1_UIOFGRO0_USFGROn1_VSn1_VWA4_VWB4_WSGRA0_WSGRB0_WS32_WG16_8_1_WGM8_WGMXCC1_WGMXCCGn1
    SolutionIndex: 82
    SolutionNameMin: Cijk_Alik_Bljk_HSS_BH_HAS_UserArgs_MT128x128x32_MI16x16x1_SN_LDSB1_AFC1_AFEM1_AFEM1_ASEM1_CLR1_CADS0_DTVA0_DTVB1_EPS0_FDSI0_GRPM1_GRVWA4_GRVWB8_GSU1_GSUAMB_GSUC0_GSUWGMRR0_GLS0_ISA1201_IU1_K1_LBSPPA256_LBSPPB0_LBSPPM0_LPA16_LPB0_LPM0_LRVW8_LWPMn1_MIAV1_MIWT4_4_MO40_NTn1_NTA0_NTB0_NTC0_NTD0_NTM0_NEPBS0_NLCA1_NLCB2_ONLL1_PGR1_PLR1_PKA0_SIA3_SS1_SU32_SUM1_SUS256_SPO0_SRVW0_SSO0_SVW4_SK0_SKXCCM0_TLDS2_ULSGRO0_USL1_UIOFGRO0_USFGROn1_VSn1_VWA4_VWB4_WSGRA0_WSGRB0_WS32_WG32_4_1_WGM8_WGMXCC1_WGMXCCGn1
    SolutionIndex: 83
    SolutionNameMin: Cijk_Alik_Bljk_HSS_BH_HAS_UserArgs_MT64x256x32_MI16x16x1_SN_LDSB1_AFC1_AFEM1_AFEM1_ASEM1_CLR1_CADS0_DTVA0_DTVB0_EPS0_FDSI0_GRPM1_GRVWA4_GRVWB8_GSU1_GSUAMB_GSUC0_GSUWGMRR0_GLS0_ISA1201_IU1_K1_LBSPPA256_LBSPPB256_LBSPPM0_LPA16_LPB16_LPM0_LRVW8_LWPMn1_MIAV1_MIWT4_4_MO40_NTn1_NTA0_NTB0_NTC0_NTD0_NTM0_NEPBS0_NLCA1_NLCB1_ONLL1_PGR2_PLR1_PKA0_SIA3_SS1_SU32_SUM1_SUS256_SPO0_SRVW0_SSO0_SVW4_SK0_SKXCCM0_TLDS2_ULSGRO0_USL1_UIOFGRO0_USFGROn1_VSn1_VWA4_VWB4_WSGRA0_WSGRB0_WS32_WG16_8_1_WGM8_WGMXCC1_WGMXCCGn1
    SolutionIndex: 84
    SolutionNameMin: Cijk_Alik_Bljk_HSS_BH_HAS_UserArgs_MT128x128x32_MI16x16x1_SN_LDSB0_AFC1_AFEM1_AFEM1_ASEM1_CLR1_CADS0_DTVA0_DTVB1_EPS0_FDSI0_GRPM1_GRVWA8_GRVWB8_GSU1_GSUAMB_GSUC0_GSUWGMRR0_GLS0_ISA1201_IU1_K1_LBSPPA256_LBSPPB0_LBSPPM0_LPA16_LPB0_LPM0_LRVW8_LWPMn1_MIAV1_MIWT4_4_MO40_NTn1_NTA0_NTB0_NTC0_NTD0_NTM0_NEPBS0_NLCA1_NLCB2_ONLL1_PGR1_PLR1_PKA0_SIA3_SS1_SU32_SUM1_SUS256_SPO0_SRVW0_SSO0_SVW4_SK0_SKXCCM0_TLDS1_ULSGRO0_USL1_UIOFGRO0_USFGROn1_VSn1_VWA4_VWB4_WSGRA0_WSGRB0_WS32_WG32_4_1_WGM8_WGMXCC1_WGMXCCGn1
    SolutionIndex: 85
    SolutionNameMin: Cijk_Alik_Bljk_HSS_BH_HAS_UserArgs_MT64x256x32_MI16x16x1_SN_LDSB1_AFC1_AFEM1_AFEM1_ASEM1_CLR1_CADS0_DTVA0_DTVB1_EPS0_FDSI0_GRPM1_GRVWA8_GRVWB8_GSU1_GSUAMB_GSUC0_GSUWGMRR0_GLS0_ISA1201_IU1_K1_LBSPPA256_LBSPPB0_LBSPPM0_LPA16_LPB0_LPM0_LRVW8_LWPMn1_MIAV1_MIWT4_4_MO40_NTn1_NTA0_NTB0_NTC0_NTD0_NTM0_NEPBS0_NLCA1_NLCB2_ONLL1_PGR2_PLR1_PKA0_SIA3_SS1_SU32_SUM1_SUS256_SPO0_SRVW0_SSO0_SVW4_SK0_SKXCCM0_TLDS1_ULSGRO0_USL1_UIOFGRO0_USFGROn1_VSn1_VWA4_VWB4_WSGRA0_WSGRB0_WS32_WG16_8_1_WGM8_WGMXCC1_WGMXCCGn1
    SolutionIndex: 86
    SolutionNameMin: Cijk_Alik_Bljk_HSS_BH_HAS_UserArgs_MT128x128x32_MI16x16x1_SN_LDSB0_AFC1_AFEM1_AFEM1_ASEM1_CLR0_CADS0_DTVA0_DTVB1_EPS0_FDSI0_GRPM1_GRVWA4_GRVWB8_GSU1_GSUAMB_GSUC0_GSUWGMRR0_GLS0_ISA1201_IU1_K1_LBSPPA256_LBSPPB0_LBSPPM0_LPA16_LPB0_LPM0_LRVW8_LWPMn1_MIAV1_MIWT4_4_MO40_NTn1_NTA0_NTB0_NTC0_NTD0_NTM0_NEPBS0_NLCA1_NLCB2_ONLL1_PGR1_PLR1_PKA0_SIA3_SS1_SU32_SUM1_SUS256_SPO0_SRVW0_SSO0_SVW4_SK0_SKXCCM0_TLDS1_ULSGRO0_USL1_UIOFGRO0_USFGROn1_VSn1_VWA4_VWB4_WSGRA0_WSGRB0_WS32_WG32_4_1_WGM8_WGMXCC1_WGMXCCGn1
    SolutionIndex: 87
    SolutionNameMin: Cijk_Alik_Bljk_HSS_BH_HAS_UserArgs_MT128x128x32_MI16x16x1_SN_LDSB0_AFC1_AFEM1_AFEM1_ASEM1_CLR1_CADS0_DTVA0_DTVB0_EPS1_FDSI0_GRPM1_GRVWA4_GRVWB8_GSU1_GSUAMB_GSUC0_GSUWGMRR0_GLS0_ISA1201_IU1_K1_LBSPPA256_LBSPPB256_LBSPPM0_LPA16_LPB16_LPM0_LRVW8_LWPMn1_MIAV1_MIWT4_4_MO40_NTn1_NTA0_NTB0_NTC0_NTD0_NTM0_NEPBS0_NLCA1_NLCB1_ONLL1_PGR1_PLR1_PKA0_SIA3_SS1_SU32_SUM1_SUS256_SPO0_SRVW0_SSO0_SVW4_SK0_SKXCCM0_TLDS2_ULSGRO0_USL1_UIOFGRO0_USFGROn1_VSn1_VWA4_VWB4_WSGRA0_WSGRB0_WS32_WG32_4_1_WGM8_WGMXCC1_WGMXCCGn1
    SolutionIndex: 88
    SolutionNameMin: Cijk_Alik_Bljk_HSS_BH_HAS_UserArgs_MT64x256x32_MI16x16x1_SN_LDSB1_AFC1_AFEM1_AFEM1_ASEM1_CLR0_CADS0_DTVA0_DTVB0_EPS0_FDSI0_GRPM1_GRVWA4_GRVWB8_GSU1_GSUAMB_GSUC0_GSUWGMRR0_GLS0_ISA1201_IU1_K1_LBSPPA256_LBSPPB256_LBSPPM0_LPA16_LPB16_LPM0_LRVW8_LWPMn1_MIAV1_MIWT4_4_MO40_NTn1_NTA0_NTB0_NTC0_NTD0_NTM0_NEPBS0_NLCA1_NLCB1_ONLL1_PGR2_PLR1_PKA0_SIA3_SS1_SU32_SUM1_SUS256_SPO0_SRVW0_SSO0_SVW4_SK0_SKXCCM0_TLDS1_ULSGRO0_USL1_UIOFGRO0_USFGROn1_VSn1_VWA4_VWB4_WSGRA0_WSGRB0_WS32_WG16_8_1_WGM8_WGMXCC1_WGMXCCGn1
    SolutionIndex: 89
    SolutionNameMin: Cijk_Alik_Bljk_HSS_BH_HAS_UserArgs_MT256x64x32_MI16x16x1_SN_LDSB0_AFC1_AFEM1_AFEM1_ASEM1_CLR1_CADS0_DTVA0_DTVB0_EPS0_FDSI0_GRPM1_GRVWA8_GRVWB8_GSU1_GSUAMB_GSUC0_GSUWGMRR0_GLS0_ISA1201_IU1_K1_LBSPPA256_LBSPPB256_LBSPPM0_LPA16_LPB16_LPM0_LRVW8_LWPMn1_MIAV1_MIWT4_4_MO40_NTn1_NTA0_NTB0_NTC0_NTD0_NTM0_NEPBS0_NLCA1_NLCB1_ONLL1_PGR2_PLR0_PKA0_SIA3_SS1_SU32_SUM1_SUS256_SPO0_SRVW0_SSO0_SVW4_SK0_SKXCCM0_TLDS1_ULSGRO0_USL1_UIOFGRO0_USFGROn1_VSn1_VWA4_VWB4_WSGRA0_WSGRB0_WS32_WG64_2_1_WGM8_WGMXCC1_WGMXCCGn1
    SolutionIndex: 90
    SolutionNameMin: Cijk_Alik_Bljk_HSS_BH_HAS_UserArgs_MT128x128x32_MI16x16x1_SN_LDSB0_AFC1_AFEM1_AFEM1_ASEM1_CLR0_CADS0_DTVA0_DTVB1_EPS0_FDSI0_GRPM1_GRVWA4_GRVWB8_GSU1_GSUAMB_GSUC0_GSUWGMRR0_GLS0_ISA1201_IU1_K1_LBSPPA256_LBSPPB0_LBSPPM0_LPA16_LPB0_LPM0_LRVW8_LWPMn1_MIAV1_MIWT4_4_MO40_NTn1_NTA0_NTB0_NTC0_NTD0_NTM0_NEPBS0_NLCA1_NLCB2_ONLL1_PGR2_PLR1_PKA0_SIA3_SS0_SU32_SUM1_SUS256_SPO0_SRVW0_SSO0_SVW8_SK0_SKXCCM0_TLDS1_ULSGRO0_USL1_UIOFGRO0_USFGROn1_VSn1_VWA4_VWB4_WSGRA0_WSGRB0_WS32_WG32_4_1_WGM8_WGMXCC1_WGMXCCGn1
    SolutionIndex: 91
    SolutionNameMin: Cijk_Alik_Bljk_HSS_BH_HAS_UserArgs_MT256x64x32_MI16x16x1_SN_LDSB0_AFC1_AFEM1_AFEM1_ASEM1_CLR1_CADS0_DTVA1_DTVB0_EPS0_FDSI0_GRPM1_GRVWA8_GRVWB8_GSU1_GSUAMB_GSUC0_GSUWGMRR0_GLS0_ISA1201_IU1_K1_LBSPPA0_LBSPPB256_LBSPPM0_LPA0_LPB16_LPM0_LRVW8_LWPMn1_MIAV1_MIWT4_4_MO40_NTn1_NTA0_NTB0_NTC0_NTD0_NTM0_NEPBS0_NLCA2_NLCB1_ONLL1_PGR2_PLR1_PKA0_SIA3_SS1_SU32_SUM1_SUS256_SPO0_SRVW0_SSO0_SVW4_SK0_SKXCCM0_TLDS1_ULSGRO0_USL1_UIOFGRO0_USFGROn1_VSn1_VWA4_VWB4_WSGRA0_WSGRB0_WS32_WG64_2_1_WGM8_WGMXCC1_WGMXCCGn1
    SolutionIndex: 92
    SolutionNameMin: Cijk_Alik_Bljk_HSS_BH_HAS_UserArgs_MT64x256x32_MI16x16x1_SN_LDSB0_AFC1_AFEM1_AFEM1_ASEM1_CLR0_CADS0_DTVA0_DTVB1_EPS0_FDSI0_GRPM1_GRVWA8_GRVWB8_GSU1_GSUAMB_GSUC0_GSUWGMRR0_GLS0_ISA1201_IU1_K1_LBSPPA256_LBSPPB0_LBSPPM0_LPA16_LPB0_LPM0_LRVW8_LWPMn1_MIAV1_MIWT4_4_MO40_NTn1_NTA0_NTB0_NTC0_NTD0_NTM0_NEPBS0_NLCA1_NLCB2_ONLL1_PGR2_PLR1_PKA0_SIA3_SS1_SU32_SUM1_SUS256_SPO0_SRVW0_SSO0_SVW4_SK0_SKXCCM0_TLDS1_ULSGRO0_USL1_UIOFGRO0_USFGROn1_VSn1_VWA4_VWB4_WSGRA0_WSGRB0_WS32_WG16_8_1_WGM8_WGMXCC1_WGMXCCGn1
- - - [1024, 217, 1, 4096]
    - [0, 21.88]
  - - [1024, 512, 1, 4096]
    - [16, 41.48]
  - - [4096, 217, 1, 4096]
    - [17, 40.94]
  - - [4096, 512, 1, 4096]
    - [18, 56.97]
  - - [4096, 217, 1, 14336]
    - [19, 37.79]
  - - [4096, 512, 1, 14336]
    - [20, 52.56]
  - - [14336, 217, 1, 4096]
    - [21, 37.43]
  - - [14336, 512, 1, 4096]
    - [22, 55.19]
  - - [1024, 217, 1, 3072]
    - [10, 23.24]
  - - [1024, 512, 1, 3072]
    - [11, 47.68]
  - - [3072, 217, 1, 3072]
    - [12, 41.28]
  - - [3072, 512, 1, 3072]
    - [11, 65.85]
  - - [3072, 217, 1, 8192]
    - [6, 35.17]
  - - [3072, 512, 1, 8192]
    - [13, 38.98]
  - - [8192, 217, 1, 3072]
    - [14, 55.14]
  - - [8192, 512, 1, 3072]
    - [15, 67.3]
  - - [512, 414, 1, 3584]
    - [29, 23.65]
  - - [512, 512, 1, 3584]
    - [29, 28.99]
  - - [3584, 414, 1, 3584]
    - [30, 49.79]
  - - [3584, 512, 1, 3584]
    - [10, 61.27]
  - - [3584, 414, 1, 18944]
    - [11, 50.02]
  - - [3584, 512, 1, 18944]
    - [29, 58.34]
  - - [18944, 414, 1, 3584]
    - [31, 52.57]
  - - [18944, 512, 1, 3584]
    - [32, 61.86]
  - - [16384, 16384, 1, 512]
    - [1, 42.2]
  - - [512, 217, 1, 2048]
    - [2, 8.99]
  - - [512, 512, 1, 2048]
    - [3, 19.53]
  - - [2048, 217, 1, 2048]
    - [4, 28.45]
  - - [2048, 512, 1, 2048]
    - [5, 51.98]
  - - [2048, 217, 1, 8192]
    - [6, 32.38]
  - - [2048, 512, 1, 8192]
    - [7, 42.35]
  - - [8192, 217, 1, 2048]
    - [8, 45.89]
  - - [8192, 512, 1, 2048]
    - [9, 63.76]
  - - [1024, 217, 1, 8192]
    - [23, 20.82]
  - - [1024, 512, 1, 8192]
    - [5, 38.35]
  - - [8192, 217, 1, 8192]
    - [24, 31.11]
  - - [8192, 512, 1, 8192]
    - [20, 42.18]
  - - [8192, 217, 1, 28672]
    - [25, 35.41]
  - - [8192, 512, 1, 28672]
    - [26, 47.58]
  - - [28672, 217, 1, 8192]
    - [27, 35.64]
  - - [28672, 512, 1, 8192]
    - [28, 47.81]
  - - [256, 415, 1, 1536]
    - [13, 9.43]
  - - [256, 512, 1, 1536]
    - [33, 11.75]
  - - [1536, 415, 1, 1536]
    - [34, 33.77]
  - - [1536, 512, 1, 1536]
    - [35, 41.55]
  - - [1536, 415, 1, 8960]
    - [10, 44.44]
  - - [1536, 512, 1, 8960]
    - [36, 54.47]
  - - [8960, 415, 1, 1536]
    - [30, 53.62]
  - - [8960, 512, 1, 1536]
    - [37, 64.49]
  - - [256, 414, 1, 2048]
    - [38, 9.5]
  - - [256, 512, 1, 2048]
    - [39, 10.79]
  - - [2048, 414, 1, 2048]
    - [38, 45.44]
  - - [2048, 414, 1, 11008]
    - [40, 57.78]
  - - [2048, 512, 1, 11008]
    - [11, 69.91]
  - - [11008, 414, 1, 2048]
    - [41, 54.73]
  - - [11008, 512, 1, 2048]
    - [11, 63.58]
  - - [1024, 415, 1, 5120]
    - [29, 44.3]
  - - [1024, 512, 1, 5120]
    - [29, 52.84]
  - - [5120, 415, 1, 5120]
    - [42, 58.25]
  - - [5120, 512, 1, 5120]
    - [37, 67.2]
  - - [5120, 415, 1, 13824]
    - [41, 52.71]
  - - [5120, 512, 1, 13824]
    - [41, 61.71]
  - - [13824, 415, 1, 5120]
    - [43, 51.33]
  - - [13824, 512, 1, 5120]
    - [44, 61.34]
  - - [5120, 415, 1, 27648]
    - [9, 49.36]
  - - [5120, 512, 1, 27648]
    - [31, 58.61]
  - - [27648, 415, 1, 5120]
    - [40, 49.94]
  - - [27648, 512, 1, 5120]
    - [40, 59.71]
  - - [1024, 414, 1, 1024]
    - [45, 28.56]
  - - [1024, 512, 1, 1024]
    - [46, 34.43]
  - - [1024, 414, 1, 2048]
    - [47, 34.46]
  - - [1024, 512, 1, 2048]
    - [42, 41.94]
  - - [1024, 414, 1, 3072]
    - [29, 39.99]
  - - [2048, 414, 1, 1024]
    - [32, 38.54]
  - - [2048, 512, 1, 1024]
    - [32, 46.53]
  - - [3072, 414, 1, 1024]
    - [48, 42.91]
  - - [3072, 512, 1, 1024]
    - [29, 53.2]
  - - [2048, 414, 1, 6144]
    - [40, 52.88]
  - - [2048, 512, 1, 6144]
    - [10, 63.79]
  - - [6144, 414, 1, 2048]
    - [49, 47.85]
  - - [6144, 512, 1, 2048]
    - [50, 57.51]
  - - [1024, 414, 1, 2560]
    - [10, 38.31]
  - - [1024, 512, 1, 2560]
    - [30, 46.2]
  - - [2560, 414, 1, 4096]
    - [51, 44.56]
  - - [2560, 512, 1, 4096]
    - [52, 52.08]
  - - [2560, 414, 1, 9728]
    - [11, 49.71]
  - - [2560, 512, 1, 9728]
    - [30, 60.61]
  - - [4096, 414, 1, 2560]
    - [30, 53.63]
  - - [4096, 512, 1, 2560]
    - [11, 64.54]
  - - [9728, 414, 1, 2560]
    - [47, 54.77]
  - - [9728, 512, 1, 2560]
    - [42, 65.49]
  - - [1024, 414, 1, 4096]
    - [53, 34.92]
  - - [4096, 414, 1, 4096]
    - [54, 48.49]
  - - [4096, 414, 1, 12288]
    - [21, 45.38]
  - - [4096, 512, 1, 12288]
    - [28, 53.2]
  - - [12288, 414, 1, 4096]
    - [55, 45.82]
  - - [12288, 512, 1, 4096]
    - [56, 54.32]
  - - [1024, 414, 1, 5120]
    - [11, 44.42]
  - - [5120, 414, 1, 5120]
    - [47, 57.97]
  - - [5120, 414, 1, 17408]
    - [11, 49.85]
  - - [5120, 512, 1, 17408]
    - [29, 58.4]
  - - [17408, 414, 1, 5120]
    - [57, 50.27]
  - - [17408, 512, 1, 5120]
    - [58, 59.48]
  - - [5120, 414, 1, 8192]
    - [59, 36.26]
  - - [5120, 512, 1, 8192]
    - [21, 36.77]
  - - [5120, 414, 1, 25600]
    - [44, 49.07]
  - - [5120, 512, 1, 25600]
    - [31, 58.23]
  - - [8192, 414, 1, 5120]
    - [42, 54.0]
  - - [8192, 512, 1, 5120]
    - [38, 63.77]
  - - [25600, 414, 1, 5120]
    - [5, 49.7]
  - - [25600, 512, 1, 5120]
    - [8, 59.52]
  - - [128, 414, 1, 2048]
    - [60, 4.63]
  - - [128, 512, 1, 2048]
    - [3, 6.1]
  - - [512, 414, 1, 2048]
    - [48, 16.89]
  - - [768, 1, 1, 2048]
    - [52, 0.07]
  - - [768, 64, 1, 2048]
    - [61, 4.44]
  - - [768, 128, 1, 2048]
    - [17, 8.19]
  - - [768, 192, 1, 2048]
    - [62, 11.83]
  - - [768, 256, 1, 2048]
    - [10, 17.59]
  - - [768, 320, 1, 2048]
    - [30, 20.46]
  - - [768, 384, 1, 2048]
    - [10, 26.66]
  - - [768, 448, 1, 2048]
    - [47, 28.93]
  - - [768, 512, 1, 2048]
    - [42, 32.8]
  - - [2048, 1, 1, 768]
    - [63, 0.13]
  - - [2048, 64, 1, 768]
    - [64, 8.23]
  - - [2048, 128, 1, 768]
    - [65, 16.67]
  - - [2048, 192, 1, 768]
    - [66, 22.21]
  - - [2048, 256, 1, 768]
    - [36, 29.15]
  - - [2048, 320, 1, 768]
    - [67, 27.75]
  - - [2048, 384, 1, 768]
    - [68, 32.6]
  - - [2048, 448, 1, 768]
    - [69, 37.17]
  - - [2048, 512, 1, 768]
    - [44, 42.5]
  - - [4096, 414, 1, 2048]
    - [70, 49.96]
  - - [4096, 512, 1, 2048]
    - [71, 58.43]
  - - [256, 155, 1, 1152]
    - [72, 3.2]
  - - [256, 512, 1, 1152]
    - [73, 10.53]
  - - [1024, 155, 1, 1152]
    - [43, 12.42]
  - - [1024, 512, 1, 1152]
    - [74, 36.25]
  - - [1152, 155, 1, 1024]
    - [75, 12.88]
  - - [1152, 512, 1, 1024]
    - [74, 29.46]
  - - [1152, 155, 1, 6912]
    - [29, 21.8]
  - - [1152, 512, 1, 6912]
    - [34, 41.16]
  - - [6912, 155, 1, 1152]
    - [76, 36.04]
  - - [6912, 512, 1, 1152]
    - [31, 59.3]
  - - [1024, 155, 1, 2560]
    - [36, 16.44]
  - - [2048, 155, 1, 2560]
    - [30, 28.8]
  - - [2048, 512, 1, 2560]
    - [77, 59.69]
  - - [2560, 155, 1, 2048]
    - [78, 26.4]
  - - [2560, 512, 1, 2048]
    - [42, 50.81]
  - - [2560, 155, 1, 10240]
    - [79, 37.8]
  - - [2560, 512, 1, 10240]
    - [80, 57.3]
  - - [10240, 155, 1, 2560]
    - [81, 41.56]
  - - [10240, 512, 1, 2560]
    - [42, 67.41]
  - - [2048, 155, 1, 3840]
    - [30, 33.17]
  - - [2048, 512, 1, 3840]
    - [29, 65.23]
  - - [3840, 155, 1, 4096]
    - [82, 30.08]
  - - [3840, 512, 1, 4096]
    - [54, 55.63]
  - - [3840, 155, 1, 15360]
    - [83, 30.57]
  - - [3840, 512, 1, 15360]
    - [10, 60.14]
  - - [4096, 155, 1, 3840]
    - [38, 40.05]
  - - [4096, 512, 1, 3840]
    - [70, 68.46]
  - - [15360, 155, 1, 3840]
    - [84, 31.27]
  - - [15360, 512, 1, 3840]
    - [14, 64.23]
  - - [2048, 155, 1, 5376]
    - [11, 35.28]
  - - [2048, 512, 1, 5376]
    - [36, 67.32]
  - - [4096, 155, 1, 5376]
    - [85, 41.75]
  - - [4096, 512, 1, 5376]
    - [75, 69.97]
  - - [5376, 155, 1, 4096]
    - [86, 30.89]
  - - [5376, 512, 1, 4096]
    - [87, 54.28]
  - - [5376, 155, 1, 21504]
    - [88, 30.5]
  - - [5376, 512, 1, 21504]
    - [11, 53.56]
  - - [21504, 155, 1, 5376]
    - [89, 31.78]
  - - [21504, 512, 1, 5376]
    - [14, 59.53]
  - - [512, 267, 1, 2880]
    - [90, 13.81]
  - - [512, 512, 1, 2880]
    - [12, 28.39]
  - - [2880, 1, 1, 2880]
    - [29, 0.24]
  - - [2880, 64, 1, 2880]
    - [29, 14.63]
  - - [2880, 128, 1, 2880]
    - [78, 28.29]
  - - [2880, 192, 1, 2880]
    - [81, 34.51]
  - - [2880, 256, 1, 2880]
    - [34, 45.85]
  - - [2880, 320, 1, 2880]
    - [91, 47.93]
  - - [2880, 384, 1, 2880]
    - [12, 47.34]
  - - [2880, 448, 1, 2880]
    - [36, 54.74]
  - - [2880, 512, 1, 2880]
    - [92, 61.81]
  - - [4096, 267, 1, 2880]
    - [11, 46.12]
  - - [4096, 512, 1, 2880]
    - [60, 66.3]
- null
- null
- DeviceEfficiency
- Equality
