projects/hipblaslt/library/src/amd_detail/rocblaslt/src/Tensile/Logic/asm_full/gfx1201/Equality/gfx1201_Cijk_Ailk_Bljk_HHS_BH_HAS_UserArgs.yaml
- {MinimumRequiredVersion: 4.33.0}
- gfx1201
- gfx1201
- [Device 73f0]
    SolutionIndex: 0
    SolutionNameMin: Cijk_Ailk_Bljk_HHS_BH_HAS_UserArgs_MT128x128x32_MI16x16x1_SN_LDSB1_EPS0_GRVWA4_GRVWB8_GSU1_GSUC0_GSUWGMRR0_K1_LBSPPA256_LBSPPB128_MIWT4_4_PGR2_SU32_SUM0_SUS256_SVW4_TLDS2_VWA4_VWB1_WGM8_WGMXCC1_WGMXCCGn1
    SolutionIndex: 1
    SolutionNameMin: Cijk_Ailk_Bljk_HHS_BH_HAS_UserArgs_MT128x128x32_MI16x16x1_SN_LDSB1_EPS1_GRVWA8_GRVWB8_GSU1_GSUC0_GSUWGMRR0_K1_LBSPPA256_LBSPPB256_MIWT4_4_PGR1_SU32_SUM0_SUS256_SVW4_TLDS2_VWA4_VWB4_WGM8_WGMXCC1_WGMXCCGn1
    SolutionIndex: 2
    SolutionNameMin: Cijk_Ailk_Bljk_HHS_BH_HAS_UserArgs_MT32x32x32_MI16x16x1_SN_LDSB0_EPS0_GRVWA4_GRVWB8_GSU1_GSUC0_GSUWGMRR0_K1_LBSPPA512_LBSPPB128_MIWT1_1_PGR1_SU32_SUM0_SUS256_SVW1_TLDS1_VWA1_VWB1_WGM8_WGMXCC1_WGMXCCGn1
    SolutionIndex: 3
    SolutionNameMin: Cijk_Ailk_Bljk_HHS_BH_HAS_UserArgs_MT32x32x32_MI16x16x1_SN_LDSB0_EPS0_GRVWA1_GRVWB1_GSU1_GSUC0_GSUWGMRR0_K1_LBSPPA512_LBSPPB128_MIWT1_1_PGR2_SU32_SUM0_SUS256_SVW1_TLDS1_VWA1_VWB1_WGM8_WGMXCC1_WGMXCCGn1
    SolutionIndex: 4
    SolutionNameMin: Cijk_Ailk_Bljk_HHS_BH_HAS_UserArgs_MT32x32x32_MI16x16x1_SN_LDSB0_EPS0_GRVWA8_GRVWB8_GSU1_GSUC0_GSUWGMRR0_K1_LBSPPA512_LBSPPB128_MIWT1_1_PGR2_SU32_SUM0_SUS256_SVW1_TLDS1_VWA1_VWB1_WGM8_WGMXCC1_WGMXCCGn1
    SolutionIndex: 5
    SolutionNameMin: Cijk_Ailk_Bljk_HHS_BH_HAS_UserArgs_MT32x32x32_MI16x16x1_SN_LDSB0_EPS1_GRVWA4_GRVWB4_GSU1_GSUC0_GSUWGMRR0_K1_LBSPPA128_LBSPPB128_MIWT1_1_PGR1_SU32_SUM0_SUS256_SVW1_TLDS2_VWA1_VWB1_WGM8_WGMXCC1_WGMXCCGn1
    SolutionIndex: 6
    SolutionNameMin: Cijk_Ailk_Bljk_HHS_BH_HAS_UserArgs_MT32x32x64_MI16x16x1_SN_LDSB0_EPS0_GRVWA8_GRVWB4_GSU1_GSUC0_GSUWGMRR0_K1_LBSPPA512_LBSPPB128_MIWT1_1_PGR1_SU32_SUM0_SUS256_SVW1_TLDS1_VWA1_VWB1_WGM8_WGMXCC1_WGMXCCGn1
    SolutionIndex: 7
    SolutionNameMin: Cijk_Ailk_Bljk_HHS_BH_HAS_UserArgs_MT32x32x64_MI16x16x1_SN_LDSB0_EPS0_GRVWA8_GRVWB4_GSU1_GSUC0_GSUWGMRR0_K1_LBSPPA512_LBSPPB128_MIWT1_1_PGR2_SU32_SUM0_SUS256_SVW1_TLDS1_VWA1_VWB1_WGM8_WGMXCC1_WGMXCCGn1
    SolutionIndex: 8
    SolutionNameMin: Cijk_Ailk_Bljk_HHS_BH_HAS_UserArgs_MT32x32x64_MI16x16x1_SN_LDSB0_EPS0_GRVWA8_GRVWB8_GSU1_GSUC0_GSUWGMRR0_K1_LBSPPA512_LBSPPB128_MIWT1_1_PGR2_SU32_SUM0_SUS256_SVW1_TLDS1_VWA1_VWB1_WGM8_WGMXCC1_WGMXCCGn1
    SolutionIndex: 9
    SolutionNameMin: Cijk_Ailk_Bljk_HHS_BH_HAS_UserArgs_MT32x32x64_MI16x16x1_SN_LDSB0_EPS1_GRVWA4_GRVWB8_GSU1_GSUC0_GSUWGMRR0_K1_LBSPPA128_LBSPPB128_MIWT1_1_PGR1_SU32_SUM0_SUS256_SVW1_TLDS2_VWA1_VWB1_WGM8_WGMXCC1_WGMXCCGn1
    SolutionIndex: 10
    SolutionNameMin: Cijk_Ailk_Bljk_HHS_BH_HAS_UserArgs_MT32x32x64_MI16x16x1_SN_LDSB0_EPS1_GRVWA8_GRVWB8_GSU1_GSUC0_GSUWGMRR0_K1_LBSPPA512_LBSPPB128_MIWT1_1_PGR1_SU32_SUM0_SUS256_SVW1_TLDS1_VWA1_VWB1_WGM8_WGMXCC1_WGMXCCGn1
    SolutionIndex: 11
    SolutionNameMin: Cijk_Ailk_Bljk_HHS_BH_HAS_UserArgs_MT128x96x32_MI16x16x1_SN_LDSB0_GRVWA8_GRVWB8_GSU1_GSUC0_GSUWGMRR0_K1_LBSPPA2048_LBSPPB128_MIWT4_3_NLCA1_SS0_SU32_SUM0_SUS256_SVW8_TLDS1_WG32_4_1_WGM8_WGMXCC1_WGMXCCGn1
    SolutionIndex: 12
    SolutionNameMin: Cijk_Ailk_Bljk_HHS_BH_HAS_UserArgs_MT16x16x64_MI16x16x1_SN_LDSB0_GRVWA8_GRVWB8_GSU1_GSUC0_GSUWGMRR0_K1_LBSPPA256_LBSPPB128_MIWT1_1_NLCA1_SS1_SU32_SUM0_SUS256_SVW1_TLDS1_WG16_2_1_WGM8_WGMXCC1_WGMXCCGn1
    SolutionIndex: 13
    SolutionNameMin: Cijk_Ailk_Bljk_HHS_BH_HAS_UserArgs_MT32x16x32_MI16x16x1_SN_LDSB0_GRVWA8_GRVWB8_GSU1_GSUC0_GSUWGMRR0_K1_LBSPPA512_LBSPPB256_MIWT1_1_NLCA1_SS1_SU32_SUM0_SUS256_SVW1_TLDS0_WG32_2_1_WGM8_WGMXCC1_WGMXCCGn1
    SolutionIndex: 14
    SolutionNameMin: Cijk_Ailk_Bljk_HHS_BH_HAS_UserArgs_MT64x16x64_MI16x16x1_SN_LDSB0_GRVWA8_GRVWB8_GSU1_GSUC0_GSUWGMRR0_K1_LBSPPA1024_LBSPPB128_MIWT1_1_NLCA1_SS0_SU32_SUM0_SUS256_SVW8_TLDS1_WG64_2_1_WGM8_WGMXCC1_WGMXCCGn1
    SolutionIndex: 15
    SolutionNameMin: Cijk_Ailk_Bljk_HHS_BH_HAS_UserArgs_MT32x16x64_MI16x16x1_SN_LDSB0_GRVWA8_GRVWB8_GSU1_GSUC0_GSUWGMRR0_K1_LBSPPA512_LBSPPB128_MIWT1_1_NLCA1_SS0_SU32_SUM0_SUS256_SVW8_TLDS1_WG32_2_1_WGM8_WGMXCC1_WGMXCCGn1
    SolutionIndex: 16
    SolutionNameMin: Cijk_Ailk_Bljk_HHS_BH_HAS_UserArgs_MT64x32x64_MI16x16x1_SN_LDSB0_GRVWA8_GRVWB8_GSU1_GSUC0_GSUWGMRR0_K1_LBSPPA1024_LBSPPB128_MIWT1_2_NLCA1_SS0_SU32_SUM0_SUS256_SVW8_TLDS1_WG64_2_1_WGM8_WGMXCC1_WGMXCCGn1
    SolutionIndex: 17
    SolutionNameMin: Cijk_Ailk_Bljk_HHS_BH_HAS_UserArgs_MT64x32x64_MI16x16x1_SN_LDSB0_GRVWA8_GRVWB8_GSU1_GSUC0_GSUWGMRR0_K1_LBSPPA1024_LBSPPB128_MIWT1_2_NLCA1_SS1_SU32_SUM0_SUS256_SVW1_TLDS1_WG64_2_1_WGM8_WGMXCC1_WGMXCCGn1
    SolutionIndex: 18
    SolutionNameMin: Cijk_Ailk_Bljk_HHS_BH_HAS_UserArgs_MT192x16x32_MI16x16x1_SN_LDSB0_GRVWA8_GRVWB4_GSU1_GSUC0_GSUWGMRR0_K1_LBSPPA3072_LBSPPB128_MIWT3_1_NLCA3_SS0_SU32_SUM0_SUS256_SVW8_TLDS1_WG64_2_1_WGM8_WGMXCC1_WGMXCCGn1
    SolutionIndex: 19
    SolutionNameMin: Cijk_Ailk_Bljk_HHS_BH_HAS_UserArgs_MT64x96x32_MI16x16x1_SN_LDSB0_GRVWA8_GRVWB8_GSU1_GSUC0_GSUWGMRR0_K1_LBSPPA1024_LBSPPB128_MIWT2_3_NLCA1_SS0_SU32_SUM0_SUS256_SVW8_TLDS1_WG32_4_1_WGM8_WGMXCC1_WGMXCCGn1
    SolutionIndex: 20
    SolutionNameMin: Cijk_Ailk_Bljk_HHS_BH_HAS_UserArgs_MT64x96x64_MI16x16x1_SN_LDSB1_GRVWA8_GRVWB8_GSU1_GSUC0_GSUWGMRR0_K1_LBSPPA1024_LBSPPB128_MIWT2_3_NLCA1_SS0_SU32_SUM0_SUS256_SVW8_TLDS1_WG32_4_1_WGM8_WGMXCC1_WGMXCCGn1
    SolutionIndex: 21
    SolutionNameMin: Cijk_Ailk_Bljk_HHS_BH_HAS_UserArgs_MT256x48x32_MI16x16x1_SN_LDSB1_GRVWA8_GRVWB4_GSU1_GSUC0_GSUWGMRR0_K1_LBSPPA4096_LBSPPB128_MIWT4_3_NLCA1_SS0_SU32_SUM0_SUS256_SVW8_TLDS1_WG64_2_1_WGM8_WGMXCC1_WGMXCCGn1
    SolutionIndex: 22
    SolutionNameMin: Cijk_Ailk_Bljk_HHS_BH_HAS_UserArgs_MT256x32x32_MI16x16x1_SN_LDSB1_GRVWA8_GRVWB8_GSU1_GSUC0_GSUWGMRR0_K1_LBSPPA4096_LBSPPB128_MIWT4_2_NLCA1_SS0_SU32_SUM0_SUS256_SVW8_TLDS1_WG64_2_1_WGM8_WGMXCC1_WGMXCCGn1
    SolutionIndex: 23
    SolutionNameMin: Cijk_Ailk_Bljk_HHS_BH_HAS_UserArgs_MT96x128x32_MI16x16x1_SN_LDSB1_GRVWA8_GRVWB8_GSU1_GSUC0_GSUWGMRR0_K1_LBSPPA1536_LBSPPB128_MIWT3_4_NLCA3_SS0_SU32_SUM0_SUS256_SVW8_TLDS1_WG32_4_1_WGM8_WGMXCC1_WGMXCCGn1
    SolutionIndex: 24
    SolutionNameMin: Cijk_Ailk_Bljk_HHS_BH_HAS_UserArgs_MT96x128x32_MI16x16x1_SN_LDSB1_GRVWA8_GRVWB8_GSU1_GSUC0_GSUWGMRR0_K1_LBSPPA1536_LBSPPB128_MIWT3_4_NLCA3_SS1_SU32_SUM0_SUS256_SVW1_TLDS1_WG32_4_1_WGM8_WGMXCC1_WGMXCCGn1
    SolutionIndex: 25
    SolutionNameMin: Cijk_Ailk_Bljk_HHS_BH_HAS_UserArgs_MT128x96x32_MI16x16x1_SN_LDSB0_GRVWA8_GRVWB8_GSU1_GSUC0_GSUWGMRR0_K1_LBSPPA2048_LBSPPB128_MIWT2_6_NLCA1_SS0_SU32_SUM0_SUS256_SVW8_TLDS1_WG64_2_1_WGM8_WGMXCC1_WGMXCCGn1
    SolutionIndex: 26
    SolutionNameMin: Cijk_Ailk_Bljk_HHS_BH_HAS_UserArgs_MT128x96x32_MI16x16x1_SN_LDSB0_GRVWA8_GRVWB8_GSU1_GSUC0_GSUWGMRR0_K1_LBSPPA2048_LBSPPB128_MIWT4_3_NLCA1_SS1_SU32_SUM0_SUS256_SVW1_TLDS1_WG32_4_1_WGM8_WGMXCC1_WGMXCCGn1
    SolutionIndex: 27
    SolutionNameMin: Cijk_Ailk_Bljk_HHS_BH_HAS_UserArgs_MT256x32x32_MI16x16x1_SN_LDSB1_GRVWA8_GRVWB8_GSU1_GSUC0_GSUWGMRR0_K1_LBSPPA4096_LBSPPB512_MIWT4_2_NLCA1_SS0_SU32_SUM0_SUS256_SVW8_TLDS0_WG64_2_1_WGM8_WGMXCC1_WGMXCCGn1
    SolutionIndex: 28
    SolutionNameMin: Cijk_Ailk_Bljk_HHS_BH_HAS_UserArgs_MT128x64x32_MI16x16x1_SN_LDSB0_GRVWA8_GRVWB8_GSU1_GSUC0_GSUWGMRR0_K1_LBSPPA2048_LBSPPB128_MIWT2_4_NLCA1_SS1_SU32_SUM0_SUS256_SVW1_TLDS1_WG64_2_1_WGM8_WGMXCC1_WGMXCCGn1
    SolutionIndex: 29
    SolutionNameMin: Cijk_Ailk_Bljk_HHS_BH_HAS_UserArgs_MT96x128x32_MI16x16x1_SN_LDSB1_GRVWA8_GRVWB8_GSU1_GSUC0_GSUWGMRR0_K1_LBSPPA1536_LBSPPB128_MIWT6_2_NLCA3_SS1_SU32_SUM0_SUS256_SVW1_TLDS1_WG16_8_1_WGM8_WGMXCC1_WGMXCCGn1
- - - [512, 16384, 1, 512]
    - [11, 30.69]
  - - [768, 1, 1, 768]
    - [12, 0.01]
  - - [768, 77, 1, 768]
    - [13, 1.07]
  - - [768, 77, 1, 3072]
    - [14, 3.42]
  - - [1280, 1, 1, 1280]
    - [15, 0.04]
  - - [1280, 77, 1, 1280]
    - [16, 2.64]
  - - [1280, 77, 1, 5120]
    - [17, 6.79]
  - - [2304, 77, 1, 768]
    - [18, 2.67]
  - - [3072, 77, 1, 768]
    - [19, 3.71]
  - - [3840, 77, 1, 1280]
    - [20, 6.88]
  - - [4096, 1536, 1, 64]
    - [21, 6.44]
  - - [5120, 77, 1, 1280]
    - [22, 8.21]
  - - [16384, 512, 1, 144]
    - [21, 14.69]
  - - [16384, 512, 1, 4608]
    - [23, 45.72]
  - - [65536, 512, 1, 4608]
    - [23, 44.19]
  - - [262144, 512, 1, 4608]
    - [24, 41.52]
  - - [262144, 256, 1, 512]
    - [25, 22.76]
  - - [262144, 256, 1, 2304]
    - [11, 34.46]
  - - [262144, 256, 1, 4608]
    - [26, 38.64]
  - - [1048576, 3, 1, 1152]
    - [27, 0.62]
  - - [1048576, 128, 1, 256]
    - [21, 15.47]
  - - [1048576, 128, 1, 1152]
    - [28, 22.59]
  - - [1048576, 128, 1, 2304]
    - [28, 24.58]
  - - [1048576, 256, 1, 2304]
    - [29, 38.97]
  - - [512, 16384, 1, 16384]
    - [25, 45.51]
- null
- null
- DeviceEfficiency
- Equality
