projects/hipblaslt/library/src/amd_detail/rocblaslt/src/Tensile/Logic/asm_full/gfx1151/Equality/gfx1151_Cijk_Alik_Bljk_HHS_BH_Bias_HAS_SAV_UserArgs.yaml
- {MinimumRequiredVersion: 4.33.0}
- gfx1151
- gfx1151
- [Device 1536]
    SolutionIndex: 0
    SolutionNameMin: Cijk_Alik_Bljk_HHS_BH_Bias_HAS_SAV_UserArgs_MT192x64x32_MI16x16x1_SN_LDSB0_GRVWA8_GRVWB8_GSU1_GSUC0_GSUWGMRR0_K1_LBSPPA128_LBSPPB128_MIWT3_4_NLCA1_NLCB1_PGR2_SS0_SU32_SUM0_SUS256_TLDS1_WG64_2_1_WGM8_WGMXCC1_WGMXCCGn1
    SolutionIndex: 1
    SolutionNameMin: Cijk_Alik_Bljk_HHS_BH_Bias_HAS_SAV_UserArgs_MT192x48x32_MI16x16x1_SN_LDSB0_GRVWA8_GRVWB1_GSU1_GSUC0_GSUWGMRR0_K1_LBSPPA128_LBSPPB128_MIWT3_3_NLCA1_NLCB1_PGR2_SS0_SU32_SUM0_SUS256_TLDS1_WG64_2_1_WGM8_WGMXCC1_WGMXCCGn1
    SolutionIndex: 2
    SolutionNameMin: Cijk_Alik_Bljk_HHS_BH_Bias_HAS_SAV_UserArgs_MT80x128x32_MI16x16x1_SN_LDSB0_GRVWA1_GRVWB8_GSU1_GSUC0_GSUWGMRR0_K1_LBSPPA128_LBSPPB128_MIWT5_2_NLCA1_NLCB1_PGR2_SS0_SU32_SUM0_SUS256_TLDS1_WG16_8_1_WGM8_WGMXCC1_WGMXCCGn1
    SolutionIndex: 3
    SolutionNameMin: Cijk_Alik_Bljk_HHS_BH_Bias_HAS_SAV_UserArgs_MT128x48x32_MI16x16x1_SN_LDSB0_GRVWA8_GRVWB2_GSU1_GSUC0_GSUWGMRR0_K1_LBSPPA128_LBSPPB128_MIWT2_3_NLCA1_NLCB1_PGR2_SS1_SU32_SUM0_SUS256_TLDS1_WG64_2_1_WGM8_WGMXCC1_WGMXCCGn1
    SolutionIndex: 4
    SolutionNameMin: Cijk_Alik_Bljk_HHS_BH_Bias_HAS_SAV_UserArgs_MT64x192x32_MI16x16x1_SN_LDSB0_GRVWA8_GRVWB2_GSU1_GSUC0_GSUWGMRR0_K1_LBSPPA128_LBSPPB128_MIWT4_3_NLCA1_NLCB1_PGR2_SS1_SU32_SUM0_SUS256_TLDS1_WG16_8_1_WGM8_WGMXCC1_WGMXCCGn1
    SolutionIndex: 5
    SolutionNameMin: Cijk_Alik_Bljk_HHS_BH_Bias_HAS_SAV_UserArgs_MT80x128x32_MI16x16x1_SN_LDSB0_GRVWA2_GRVWB2_GSU1_GSUC0_GSUWGMRR0_K1_LBSPPA128_LBSPPB128_MIWT5_2_NLCA1_NLCB1_PGR2_SS1_SU32_SUM0_SUS256_TLDS1_WG16_8_1_WGM8_WGMXCC1_WGMXCCGn1
    SolutionIndex: 6
    SolutionNameMin: Cijk_Alik_Bljk_HHS_BH_Bias_HAS_SAV_UserArgs_MT96x128x32_MI16x16x1_SN_LDSB0_GRVWA2_GRVWB8_GSU1_GSUC0_GSUWGMRR0_K1_LBSPPA128_LBSPPB128_MIWT3_4_NLCA1_NLCB1_PGR2_SS1_SU32_SUM0_SUS256_TLDS1_WG32_4_1_WGM8_WGMXCC1_WGMXCCGn1
    SolutionIndex: 7
    SolutionNameMin: Cijk_Alik_Bljk_HHS_BH_Bias_HAS_SAV_UserArgs_MT96x128x32_MI16x16x1_SN_LDSB0_GRVWA8_GRVWB8_GSU1_GSUC0_GSUWGMRR0_K1_LBSPPA128_LBSPPB128_MIWT3_4_NLCA1_NLCB1_PGR2_SS1_SU32_SUM0_SUS256_TLDS1_WG32_4_1_WGM8_WGMXCC1_WGMXCCGn1
    SolutionIndex: 8
    SolutionNameMin: Cijk_Alik_Bljk_HHS_BH_Bias_HAS_SAV_UserArgs_MT128x96x32_MI16x16x1_SN_LDSB0_GRVWA8_GRVWB8_GSU1_GSUC0_GSUWGMRR0_K1_LBSPPA128_LBSPPB128_MIWT4_3_NLCA1_NLCB1_PGR2_SS1_SU32_SUM0_SUS256_TLDS1_WG32_4_1_WGM8_WGMXCC1_WGMXCCGn1
    SolutionIndex: 9
    SolutionNameMin: Cijk_Alik_Bljk_HHS_BH_Bias_HAS_SAV_UserArgs_MT128x96x32_MI16x16x1_SN_LDSB0_GRVWA8_GRVWB8_GSU2_GSUC0_GSUWGMRR0_K1_LBSPPA128_LBSPPB128_MIWT4_3_NLCA1_NLCB1_PGR2_SS1_SU32_SUM0_SUS256_TLDS1_WG32_4_1_WGM8_WGMXCC1_WGMXCCGn1
    SolutionIndex: 10
    SolutionNameMin: Cijk_Alik_Bljk_HHS_BH_Bias_HAS_SAV_UserArgs_MT64x192x32_MI16x16x1_SN_LDSB1_GRVWA8_GRVWB8_GSU2_GSUC0_GSUWGMRR0_K1_LBSPPA128_LBSPPB128_MIWT4_3_NLCA1_NLCB1_PGR2_SS1_SU32_SUM0_SUS256_TLDS1_WG16_8_1_WGM8_WGMXCC1_WGMXCCGn1
    SolutionIndex: 11
    SolutionNameMin: Cijk_Alik_Bljk_HHS_BH_Bias_HAS_SAV_UserArgs_MT96x128x32_MI16x16x1_SN_LDSB1_GRVWA8_GRVWB8_GSU2_GSUC0_GSUWGMRR0_K1_LBSPPA128_LBSPPB128_MIWT3_4_NLCA1_NLCB1_PGR2_SS1_SU32_SUM0_SUS256_TLDS1_WG32_4_1_WGM8_WGMXCC1_WGMXCCGn1
    SolutionIndex: 12
    SolutionNameMin: Cijk_Alik_Bljk_HHS_BH_Bias_HAS_SAV_UserArgs_MT96x128x32_MI16x16x1_SN_LDSB1_GRVWA2_GRVWB8_GSU4_GSUC0_GSUWGMRR0_K1_LBSPPA128_LBSPPB128_MIWT3_4_NLCA1_NLCB1_PGR2_SS1_SU32_SUM0_SUS256_TLDS1_WG32_4_1_WGM8_WGMXCC1_WGMXCCGn1
    SolutionIndex: 13
    SolutionNameMin: Cijk_Alik_Bljk_HHS_BH_Bias_HAS_SAV_UserArgs_MT160x64x32_MI16x16x1_SN_LDSB1_GRVWA8_GRVWB8_GSU1_GSUC0_GSUWGMRR0_K1_LBSPPA128_LBSPPB128_MIWT5_2_NLCA1_NLCB1_PGR2_SS1_SU32_SUM0_SUS256_TLDS1_WG32_4_1_WGM8_WGMXCC1_WGMXCCGn1
    SolutionIndex: 14
    SolutionNameMin: Cijk_Alik_Bljk_HHS_BH_Bias_HAS_SAV_UserArgs_MT32x128x64_MI16x16x1_SN_LDSB0_GRVWA8_GRVWB8_GSU1_GSUC0_GSUWGMRR0_K1_LBSPPA128_LBSPPB128_MIWT2_2_NLCA1_NLCB1_PGR2_SS1_SU32_SUM0_SUS256_TLDS1_WG16_8_1_WGM8_WGMXCC1_WGMXCCGn1
    SolutionIndex: 15
    SolutionNameMin: Cijk_Alik_Bljk_HHS_BH_Bias_HAS_SAV_UserArgs_MT64x64x64_MI16x16x1_SN_LDSB0_GRVWA8_GRVWB8_GSU1_GSUC0_GSUWGMRR0_K1_LBSPPA128_LBSPPB128_MIWT2_2_NLCA1_NLCB1_PGR2_SS1_SU32_SUM0_SUS256_TLDS1_WG32_4_1_WGM8_WGMXCC1_WGMXCCGn1
    SolutionIndex: 16
    SolutionNameMin: Cijk_Alik_Bljk_HHS_BH_Bias_HAS_SAV_UserArgs_MT64x64x64_MI16x16x1_SN_LDSB0_GRVWA8_GRVWB8_GSU2_GSUC0_GSUWGMRR0_K1_LBSPPA128_LBSPPB128_MIWT2_2_NLCA1_NLCB1_PGR2_SS1_SU32_SUM0_SUS256_TLDS1_WG32_4_1_WGM8_WGMXCC1_WGMXCCGn1
    SolutionIndex: 17
    SolutionNameMin: Cijk_Alik_Bljk_HHS_BH_Bias_HAS_SAV_UserArgs_MT32x128x64_MI16x16x1_SN_LDSB1_GRVWA8_GRVWB8_GSU1_GSUC0_GSUWGMRR0_K1_LBSPPA128_LBSPPB128_MIWT2_2_NLCA1_NLCB1_PGR2_SS1_SU32_SUM0_SUS256_TLDS1_WG16_8_1_WGM8_WGMXCC1_WGMXCCGn1
    SolutionIndex: 18
    SolutionNameMin: Cijk_Alik_Bljk_HHS_BH_Bias_HAS_SAV_UserArgs_MT32x128x64_MI16x16x1_SN_LDSB1_GRVWA8_GRVWB8_GSU2_GSUC0_GSUWGMRR0_K1_LBSPPA128_LBSPPB128_MIWT2_2_NLCA1_NLCB1_PGR2_SS1_SU32_SUM0_SUS256_TLDS1_WG16_8_1_WGM8_WGMXCC1_WGMXCCGn1
- - - [1024, 216, 1, 4096, 1024, 1024, 4096, 4096]
    - [12, 6.92]
  - - [1024, 512, 1, 4096, 1024, 1024, 4096, 4096]
    - [10, 9.2]
  - - [4096, 216, 1, 4096, 4096, 4096, 4096, 4096]
    - [5, 5.79]
  - - [4096, 512, 1, 4096, 4096, 4096, 4096, 4096]
    - [17, 7.5]
  - - [4096, 216, 1, 14336, 4096, 4096, 14336, 14336]
    - [16, 5.6]
  - - [4096, 512, 1, 14336, 4096, 4096, 14336, 14336]
    - [15, 7.02]
  - - [14336, 216, 1, 4096, 14336, 14336, 4096, 4096]
    - [14, 5.64]
  - - [14336, 512, 1, 4096, 14336, 14336, 4096, 4096]
    - [4, 7.29]
  - - [1024, 217, 1, 3072, 1024, 1024, 3072, 3072]
    - [3, 6.75]
  - - [1024, 512, 1, 3072, 1024, 1024, 3072, 3072]
    - [13, 9.27]
  - - [3072, 217, 1, 3072, 3072, 3072, 3072, 3072]
    - [1, 7.86]
  - - [3072, 512, 1, 3072, 3072, 3072, 3072, 3072]
    - [7, 10.17]
  - - [3072, 217, 1, 8192, 3072, 3072, 8192, 8192]
    - [18, 5.74]
  - - [3072, 512, 1, 8192, 3072, 3072, 8192, 8192]
    - [2, 7.79]
  - - [8192, 217, 1, 3072, 8192, 8192, 3072, 3072]
    - [6, 6.4]
  - - [8192, 512, 1, 3072, 8192, 8192, 3072, 3072]
    - [7, 9.84]
  - - [512, 414, 1, 3584, 512, 512, 3584, 3584]
    - [9, 8.17]
  - - [512, 512, 1, 3584, 512, 512, 3584, 3584]
    - [11, 7.79]
  - - [3584, 414, 1, 3584, 3584, 3584, 3584, 3584]
    - [8, 9.35]
  - - [3584, 512, 1, 3584, 3584, 3584, 3584, 3584]
    - [0, 10.68]
  - - [3584, 414, 1, 18944, 3584, 3584, 18944, 18944]
    - [8, 8.23]
  - - [3584, 512, 1, 18944, 3584, 3584, 18944, 18944]
    - [6, 9.2]
  - - [18944, 414, 1, 3584, 18944, 18944, 3584, 3584]
    - [8, 8.97]
  - - [18944, 512, 1, 3584, 18944, 18944, 3584, 3584]
    - [6, 10.04]
- null
- null
- DeviceEfficiency
- Equality
