projects/hipblaslt/library/src/amd_detail/rocblaslt/src/Tensile/Logic/asm_full/gfx950/GridBased/gfx950_Cijk_Ailk_Bljk_I8II_BH_UserArgs.yaml
- {MinimumRequiredVersion: 4.33.0}
- gfx950
- gfx950
- [Device 75a0]
    SolutionIndex: 0
    SolutionNameMin: Cijk_Ailk_Bljk_I8II_BH_UserArgs_MT256x128x32_MI32x32x1_SN_LDSB0_AFC0_AFEM1_AFEM1_ASEM1_CLR0_CADS0_DTVA0_DTVB0_EPS0_FDSI0_GRPM1_GRVWA4_GRVWB16_GSU0_GSUAMB_GSUC0_GSUWGMRR0_GLS0_ISA950_IU1_K1_LBSPPA0_LBSPPB128_LBSPPM0_LPA0_LPB16_LPM0_LRVW16_LWPMn1_MIAV0_MIWT4_2_MO40_NTn1_NTA0_NTB0_NTC0_NTD0_NTM0_NEPBS0_NLCA1_NLCB1_ONLL1_PGR2_PLR0_PKA1_SIA3_SS1_SU0_SUM0_SUS32_SPO0_SRVW0_SSO0_SVW4_SK3_SKXCCM8_TLDS1_ULSGRO0_USL1_UIOFGRO0_USFGRO0_VSn1_VWA4_VWB2_WSGRA0_WSGRB0_WS64_WG64_4_1_WGM6_WGMXCC1_WGMXCCGn1
    SolutionIndex: 1
    SolutionNameMin: Cijk_Ailk_Bljk_I8II_BH_UserArgs_MT128x256x64_MI16x16x1_SN_LDSB1_AFC0_AFEM1_AFEM1_ASEM1_CLR1_CADS0_DTVA0_DTVB0_EPS0_FDSI0_GRPM1_GRVWA4_GRVWB16_GSU0_GSUAMB_GSUC0_GSUWGMRR0_GLS0_ISA950_IU1_K1_LBSPPA1024_LBSPPB256_LBSPPM0_LPA64_LPB16_LPM0_LRVW8_LWPMn1_MIAV0_MIWT4_8_MO40_NTn1_NTA0_NTB0_NTC0_NTD0_NTM0_NEPBS0_NLCA1_NLCB1_ONLL1_PGR2_PLR1_PKA1_SIA3_SS1_SU0_SUM0_SUS64_SPO0_SRVW0_SSO0_SVW4_SK3_SKXCCM8_TLDS1_ULSGRO0_USL1_UIOFGRO0_USFGRO0_VSn1_VWA4_VWB4_WSGRA0_WSGRB0_WS64_WG32_8_1_WGM6_WGMXCC1_WGMXCCGn1
    SolutionIndex: 2
    SolutionNameMin: Cijk_Ailk_Bljk_I8II_BH_UserArgs_MT128x256x64_MI16x16x1_SN_LDSB1_AFC0_AFEM1_AFEM1_ASEM1_CLR1_CADS0_DTVA0_DTVB0_EPS0_FDSI0_GRPM1_GRVWA4_GRVWB16_GSU0_GSUAMB_GSUC0_GSUWGMRR0_GLS0_ISA950_IU1_K1_LBSPPA1024_LBSPPB512_LBSPPM0_LPA64_LPB16_LPM0_LRVW8_LWPMn1_MIAV0_MIWT4_8_MO40_NTn1_NTA0_NTB0_NTC0_NTD0_NTM0_NEPBS0_NLCA1_NLCB1_ONLL1_PGR2_PLR1_PKA1_SIA3_SS1_SU0_SUM0_SUS64_SPO0_SRVW0_SSO0_SVW4_SK3_SKXCCM8_TLDS1_ULSGRO0_USL1_UIOFGRO0_USFGRO0_VSn1_VWA4_VWB8_WSGRA0_WSGRB0_WS64_WG32_8_1_WGM6_WGMXCC1_WGMXCCGn1
    SolutionIndex: 3
    SolutionNameMin: Cijk_Ailk_Bljk_I8II_BH_UserArgs_MT128x128x64_MI16x16x1_SN_LDSB1_AFC0_AFEM1_AFEM1_ASEM1_CLR1_CADS0_DTVA0_DTVB0_EPS0_FDSI0_GRPM1_GRVWA4_GRVWB16_GSU0_GSUAMB_GSUC0_GSUWGMRR0_GLS0_ISA950_IU1_K1_LBSPPA1024_LBSPPB256_LBSPPM0_LPA64_LPB16_LPM0_LRVW8_LWPMn1_MIAV0_MIWT4_4_MO40_NTn1_NTA0_NTB0_NTC0_NTD0_NTM0_NEPBS0_NLCA1_NLCB1_ONLL1_PGR2_PLR1_PKA1_SIA3_SS1_SU0_SUM0_SUS64_SPO0_SRVW0_SSO0_SVW4_SK3_SKXCCM8_TLDS1_ULSGRO0_USL1_UIOFGRO0_USFGRO0_VSn1_VWA4_VWB4_WSGRA0_WSGRB0_WS64_WG32_8_1_WGM6_WGMXCC1_WGMXCCGn1
    SolutionIndex: 4
    SolutionNameMin: Cijk_Ailk_Bljk_I8II_BH_UserArgs_MT64x64x64_MI16x16x1_SN_LDSB0_AFC0_AFEM1_AFEM1_ASEM1_CLR1_CADS0_DTVA0_DTVB0_EPS0_FDSI0_GRPM1_GRVWA4_GRVWB16_GSU0_GSUAMB_GSUC0_GSUWGMRR0_GLS0_ISA950_IU1_K1_LBSPPA512_LBSPPB128_LBSPPM0_LPA32_LPB16_LPM0_LRVW8_LWPMn1_MIAV0_MIWT2_2_MO40_NTn1_NTA0_NTB0_NTC0_NTD0_NTM0_NEPBS0_NLCA1_NLCB1_ONLL1_PGR2_PLR1_PKA1_SIA3_SS1_SU0_SUM0_SUS64_SPO0_SRVW0_SSO0_SVW2_SK3_SKXCCM8_TLDS1_ULSGRO0_USL1_UIOFGRO0_USFGRO0_VSn1_VWA2_VWB2_WSGRA0_WSGRB0_WS64_WG32_8_1_WGM6_WGMXCC1_WGMXCCGn1
    SolutionIndex: 5
    SolutionNameMin: Cijk_Ailk_Bljk_I8II_BH_UserArgs_MT256x256x64_MI32x32x1_SN_LDSB0_AFC0_AFEM1_AFEM1_ASEM1_CLR1_CADS0_DTVA0_DTVB0_EPS0_FDSI0_GRPM1_GRVWA16_GRVWB8_GSU0_GSUAMB_GSUC0_GSUWGMRR0_GLS0_ISA950_IU1_K1_LBSPPA0_LBSPPB128_LBSPPM0_LPA0_LPB16_LPM0_LRVW16_LWPMn1_MIAV0_MIWT4_4_MO40_NTn1_NTA0_NTB0_NTC0_NTD0_NTM0_NEPBS0_NLCA1_NLCB1_ONLL1_PGR2_PLR1_PKA1_SIA3_SS1_SU0_SUM0_SUS64_SPO0_SRVW0_SSO0_SVW4_SK3_SKXCCM8_TLDS1_ULSGRO0_USL1_UIOFGRO0_USFGRO0_VSn1_VWA4_VWB2_WSGRA0_WSGRB0_WS64_WG64_4_1_WGM6_WGMXCC1_WGMXCCGn1
    SolutionIndex: 6
    SolutionNameMin: Cijk_Ailk_Bljk_I8II_BH_UserArgs_MT256x256x64_MI32x32x1_SN_LDSB0_AFC0_AFEM1_AFEM1_ASEM1_CLR1_CADS0_DTVA0_DTVB0_EPS0_FDSI0_GRPM1_GRVWA16_GRVWB8_GSU0_GSUAMB_GSUC0_GSUWGMRR0_GLS0_ISA950_IU1_K1_LBSPPA0_LBSPPB256_LBSPPM0_LPA0_LPB16_LPM0_LRVW16_LWPMn1_MIAV0_MIWT4_4_MO40_NTn1_NTA0_NTB0_NTC0_NTD0_NTM0_NEPBS0_NLCA1_NLCB1_ONLL1_PGR2_PLR1_PKA1_SIA3_SS1_SU0_SUM0_SUS64_SPO0_SRVW0_SSO0_SVW4_SK3_SKXCCM8_TLDS1_ULSGRO0_USL1_UIOFGRO0_USFGRO0_VSn1_VWA4_VWB4_WSGRA0_WSGRB0_WS64_WG64_4_1_WGM6_WGMXCC1_WGMXCCGn1
    SolutionIndex: 7
    SolutionNameMin: Cijk_Ailk_Bljk_I8II_BH_UserArgs_MT256x256x64_MI32x32x1_SN_LDSB0_AFC0_AFEM1_AFEM1_ASEM1_CLR1_CADS0_DTVA0_DTVB0_EPS0_FDSI0_GRPM1_GRVWA4_GRVWB16_GSU0_GSUAMB_GSUC0_GSUWGMRR0_GLS0_ISA950_IU1_K1_LBSPPA0_LBSPPB128_LBSPPM0_LPA0_LPB16_LPM0_LRVW16_LWPMn1_MIAV0_MIWT4_4_MO40_NTn1_NTA0_NTB0_NTC0_NTD0_NTM0_NEPBS0_NLCA1_NLCB1_ONLL1_PGR2_PLR1_PKA1_SIA3_SS1_SU0_SUM0_SUS64_SPO0_SRVW0_SSO0_SVW4_SK3_SKXCCM8_TLDS1_ULSGRO0_USL1_UIOFGRO0_USFGRO0_VSn1_VWA4_VWB2_WSGRA0_WSGRB0_WS64_WG64_4_1_WGM6_WGMXCC1_WGMXCCGn1
    SolutionIndex: 8
    SolutionNameMin: Cijk_Ailk_Bljk_I8II_BH_UserArgs_MT256x256x64_MI32x32x1_SN_LDSB0_AFC0_AFEM1_AFEM1_ASEM1_CLR1_CADS0_DTVA0_DTVB0_EPS0_FDSI0_GRPM1_GRVWA4_GRVWB16_GSU0_GSUAMB_GSUC0_GSUWGMRR0_GLS0_ISA950_IU1_K1_LBSPPA0_LBSPPB256_LBSPPM0_LPA0_LPB16_LPM0_LRVW16_LWPMn1_MIAV0_MIWT4_4_MO40_NTn1_NTA0_NTB0_NTC0_NTD0_NTM0_NEPBS0_NLCA1_NLCB1_ONLL1_PGR2_PLR1_PKA1_SIA3_SS1_SU0_SUM0_SUS64_SPO0_SRVW0_SSO0_SVW4_SK3_SKXCCM8_TLDS1_ULSGRO0_USL1_UIOFGRO0_USFGRO0_VSn1_VWA4_VWB4_WSGRA0_WSGRB0_WS64_WG64_4_1_WGM6_WGMXCC1_WGMXCCGn1
    SolutionIndex: 9
    SolutionNameMin: Cijk_Ailk_Bljk_I8II_BH_UserArgs_MT256x256x64_MI32x32x1_SN_LDSB0_AFC0_AFEM1_AFEM1_ASEM1_CLR1_CADS0_DTVA0_DTVB0_EPS0_FDSI0_GRPM1_GRVWA8_GRVWB16_GSU0_GSUAMB_GSUC0_GSUWGMRR0_GLS0_ISA950_IU1_K1_LBSPPA0_LBSPPB128_LBSPPM0_LPA0_LPB16_LPM0_LRVW16_LWPMn1_MIAV0_MIWT4_4_MO40_NTn1_NTA0_NTB0_NTC0_NTD0_NTM0_NEPBS0_NLCA1_NLCB1_ONLL1_PGR2_PLR1_PKA1_SIA3_SS1_SU0_SUM0_SUS64_SPO0_SRVW0_SSO0_SVW4_SK3_SKXCCM8_TLDS1_ULSGRO0_USL1_UIOFGRO0_USFGRO0_VSn1_VWA4_VWB2_WSGRA0_WSGRB0_WS64_WG64_4_1_WGM6_WGMXCC1_WGMXCCGn1
    SolutionIndex: 10
    SolutionNameMin: Cijk_Ailk_Bljk_I8II_BH_UserArgs_MT256x256x64_MI32x32x1_SN_LDSB0_AFC0_AFEM1_AFEM1_ASEM1_CLR1_CADS0_DTVA0_DTVB0_EPS0_FDSI0_GRPM1_GRVWA8_GRVWB16_GSU0_GSUAMB_GSUC0_GSUWGMRR0_GLS0_ISA950_IU1_K1_LBSPPA0_LBSPPB256_LBSPPM0_LPA0_LPB16_LPM0_LRVW16_LWPMn1_MIAV0_MIWT4_4_MO40_NTn1_NTA0_NTB0_NTC0_NTD0_NTM0_NEPBS0_NLCA1_NLCB1_ONLL1_PGR2_PLR1_PKA1_SIA3_SS1_SU0_SUM0_SUS64_SPO0_SRVW0_SSO0_SVW4_SK3_SKXCCM8_TLDS1_ULSGRO0_USL1_UIOFGRO0_USFGRO0_VSn1_VWA4_VWB4_WSGRA0_WSGRB0_WS64_WG64_4_1_WGM6_WGMXCC1_WGMXCCGn1
    SolutionIndex: 11
    SolutionNameMin: Cijk_Ailk_Bljk_I8II_BH_UserArgs_MT256x256x64_MI32x32x1_SN_LDSB0_AFC0_AFEM1_AFEM1_ASEM1_CLR1_CADS0_DTVA0_DTVB0_EPS0_FDSI0_GRPM1_GRVWA16_GRVWB16_GSU0_GSUAMB_GSUC0_GSUWGMRR0_GLS0_ISA950_IU1_K1_LBSPPA0_LBSPPB128_LBSPPM0_LPA0_LPB16_LPM0_LRVW16_LWPMn1_MIAV0_MIWT4_4_MO40_NTn1_NTA0_NTB0_NTC0_NTD0_NTM0_NEPBS0_NLCA1_NLCB1_ONLL1_PGR2_PLR1_PKA1_SIA3_SS1_SU0_SUM0_SUS64_SPO0_SRVW0_SSO0_SVW4_SK3_SKXCCM8_TLDS1_ULSGRO0_USL1_UIOFGRO0_USFGRO0_VSn1_VWA4_VWB2_WSGRA0_WSGRB0_WS64_WG64_4_1_WGM6_WGMXCC1_WGMXCCGn1
    SolutionIndex: 12
    SolutionNameMin: Cijk_Ailk_Bljk_I8II_BH_UserArgs_MT256x256x64_MI32x32x1_SN_LDSB0_AFC0_AFEM1_AFEM1_ASEM1_CLR1_CADS0_DTVA0_DTVB0_EPS0_FDSI0_GRPM1_GRVWA16_GRVWB16_GSU0_GSUAMB_GSUC0_GSUWGMRR0_GLS0_ISA950_IU1_K1_LBSPPA0_LBSPPB256_LBSPPM0_LPA0_LPB16_LPM0_LRVW16_LWPMn1_MIAV0_MIWT4_4_MO40_NTn1_NTA0_NTB0_NTC0_NTD0_NTM0_NEPBS0_NLCA1_NLCB1_ONLL1_PGR2_PLR1_PKA1_SIA3_SS1_SU0_SUM0_SUS64_SPO0_SRVW0_SSO0_SVW4_SK3_SKXCCM8_TLDS1_ULSGRO0_USL1_UIOFGRO0_USFGRO0_VSn1_VWA4_VWB4_WSGRA0_WSGRB0_WS64_WG64_4_1_WGM6_WGMXCC1_WGMXCCGn1
    SolutionIndex: 13
    SolutionNameMin: Cijk_Ailk_Bljk_I8II_BH_UserArgs_MT128x256x64_MI32x32x1_SN_LDSB1_AFC0_AFEM1_AFEM1_ASEM1_CLR1_CADS0_DTVA0_DTVB0_EPS0_FDSI0_GRPM1_GRVWA16_GRVWB16_GSU0_GSUAMB_GSUC0_GSUWGMRR0_GLS0_ISA950_IU1_K1_LBSPPA0_LBSPPB256_LBSPPM0_LPA0_LPB16_LPM0_LRVW16_LWPMn1_MIAV0_MIWT2_4_MO40_NTn1_NTA0_NTB0_NTC0_NTD0_NTM0_NEPBS0_NLCA1_NLCB1_ONLL1_PGR2_PLR1_PKA1_SIA3_SS1_SU0_SUM0_SUS64_SPO0_SRVW0_SSO0_SVW2_SK3_SKXCCM8_TLDS1_ULSGRO0_USL1_UIOFGRO0_USFGRO0_VSn1_VWA2_VWB4_WSGRA0_WSGRB0_WS64_WG64_4_1_WGM6_WGMXCC1_WGMXCCGn1
    SolutionIndex: 14
    SolutionNameMin: Cijk_Ailk_Bljk_I8II_BH_UserArgs_MT256x128x64_MI32x32x1_SN_LDSB1_AFC0_AFEM1_AFEM1_ASEM1_CLR1_CADS0_DTVA0_DTVB0_EPS0_FDSI0_GRPM1_GRVWA16_GRVWB8_GSU0_GSUAMB_GSUC0_GSUWGMRR0_GLS0_ISA950_IU1_K1_LBSPPA0_LBSPPB128_LBSPPM0_LPA0_LPB16_LPM0_LRVW16_LWPMn1_MIAV0_MIWT4_2_MO40_NTn1_NTA0_NTB0_NTC0_NTD0_NTM0_NEPBS0_NLCA1_NLCB1_ONLL1_PGR2_PLR1_PKA1_SIA3_SS1_SU0_SUM0_SUS64_SPO0_SRVW0_SSO0_SVW4_SK3_SKXCCM8_TLDS1_ULSGRO0_USL1_UIOFGRO0_USFGRO0_VSn1_VWA4_VWB2_WSGRA0_WSGRB0_WS64_WG64_4_1_WGM6_WGMXCC1_WGMXCCGn1
    SolutionIndex: 15
    SolutionNameMin: Cijk_Ailk_Bljk_I8II_BH_UserArgs_MT256x128x64_MI32x32x1_SN_LDSB1_AFC0_AFEM1_AFEM1_ASEM1_CLR1_CADS0_DTVA0_DTVB0_EPS0_FDSI0_GRPM1_GRVWA4_GRVWB16_GSU0_GSUAMB_GSUC0_GSUWGMRR0_GLS0_ISA950_IU1_K1_LBSPPA0_LBSPPB128_LBSPPM0_LPA0_LPB16_LPM0_LRVW16_LWPMn1_MIAV0_MIWT4_2_MO40_NTn1_NTA0_NTB0_NTC0_NTD0_NTM0_NEPBS0_NLCA1_NLCB1_ONLL1_PGR2_PLR1_PKA1_SIA3_SS1_SU0_SUM0_SUS64_SPO0_SRVW0_SSO0_SVW4_SK3_SKXCCM8_TLDS1_ULSGRO0_USL1_UIOFGRO0_USFGRO0_VSn1_VWA4_VWB2_WSGRA0_WSGRB0_WS64_WG64_4_1_WGM6_WGMXCC1_WGMXCCGn1
    SolutionIndex: 16
    SolutionNameMin: Cijk_Ailk_Bljk_I8II_BH_UserArgs_MT256x128x64_MI32x32x1_SN_LDSB1_AFC0_AFEM1_AFEM1_ASEM1_CLR1_CADS0_DTVA0_DTVB0_EPS0_FDSI0_GRPM1_GRVWA16_GRVWB16_GSU0_GSUAMB_GSUC0_GSUWGMRR0_GLS0_ISA950_IU1_K1_LBSPPA0_LBSPPB128_LBSPPM0_LPA0_LPB16_LPM0_LRVW16_LWPMn1_MIAV0_MIWT4_2_MO40_NTn1_NTA0_NTB0_NTC0_NTD0_NTM0_NEPBS0_NLCA1_NLCB1_ONLL1_PGR2_PLR1_PKA1_SIA3_SS1_SU0_SUM0_SUS64_SPO0_SRVW0_SSO0_SVW4_SK3_SKXCCM8_TLDS1_ULSGRO0_USL1_UIOFGRO0_USFGRO0_VSn1_VWA4_VWB2_WSGRA0_WSGRB0_WS64_WG64_4_1_WGM6_WGMXCC1_WGMXCCGn1
    SolutionIndex: 17
    SolutionNameMin: Cijk_Ailk_Bljk_I8II_BH_UserArgs_MT64x256x128_MI16x16x1_SN_LDSB1_AFC0_AFEM1_AFEM1_ASEM1_CLR1_CADS0_DTVA0_DTVB0_EPS0_FDSI0_GRPM1_GRVWA4_GRVWB16_GSU0_GSUAMB_GSUC0_GSUWGMRR0_GLS0_ISA950_IU1_K1_LBSPPA512_LBSPPB256_LBSPPM0_LPA32_LPB16_LPM0_LRVW8_LWPMn1_MIAV0_MIWT2_8_MO40_NTn1_NTA0_NTB0_NTC0_NTD0_NTM0_NEPBS0_NLCA1_NLCB1_ONLL1_PGR2_PLR1_PKA1_SIA3_SS1_SU0_SUM0_SUS128_SPO0_SRVW0_SSO0_SVW2_SK3_SKXCCM8_TLDS1_ULSGRO0_USL1_UIOFGRO0_USFGRO0_VSn1_VWA2_VWB2_WSGRA0_WSGRB0_WS64_WG32_8_1_WGM6_WGMXCC1_WGMXCCGn1
    SolutionIndex: 18
    SolutionNameMin: Cijk_Ailk_Bljk_I8II_BH_UserArgs_MT128x128x128_MI16x16x1_SN_LDSB1_AFC0_AFEM1_AFEM1_ASEM1_CLR1_CADS0_DTVA0_DTVB0_EPS0_FDSI0_GRPM1_GRVWA4_GRVWB16_GSU0_GSUAMB_GSUC0_GSUWGMRR0_GLS0_ISA950_IU1_K1_LBSPPA2048_LBSPPB256_LBSPPM0_LPA64_LPB32_LPM0_LRVW16_LWPMn1_MIAV0_MIWT4_4_MO40_NTn1_NTA0_NTB0_NTC0_NTD0_NTM0_NEPBS0_NLCA1_NLCB1_ONLL1_PGR2_PLR1_PKA1_SIA3_SS1_SU0_SUM0_SUS128_SPO0_SRVW0_SSO0_SVW4_SK3_SKXCCM8_TLDS1_ULSGRO0_USL1_UIOFGRO0_USFGRO0_VSn1_VWA4_VWB2_WSGRA0_WSGRB0_WS64_WG32_8_1_WGM6_WGMXCC1_WGMXCCGn1
    SolutionIndex: 19
    SolutionNameMin: Cijk_Ailk_Bljk_I8II_BH_UserArgs_MT128x128x128_MI16x16x1_SN_LDSB1_AFC0_AFEM1_AFEM1_ASEM1_CLR1_CADS0_DTVA0_DTVB0_EPS0_FDSI0_GRPM1_GRVWA4_GRVWB16_GSU0_GSUAMB_GSUC0_GSUWGMRR0_GLS0_ISA950_IU1_K1_LBSPPA2048_LBSPPB512_LBSPPM0_LPA64_LPB32_LPM0_LRVW16_LWPMn1_MIAV0_MIWT4_4_MO40_NTn1_NTA0_NTB0_NTC0_NTD0_NTM0_NEPBS0_NLCA1_NLCB1_ONLL1_PGR2_PLR1_PKA1_SIA3_SS1_SU0_SUM0_SUS128_SPO0_SRVW0_SSO0_SVW4_SK3_SKXCCM8_TLDS1_ULSGRO0_USL1_UIOFGRO0_USFGRO0_VSn1_VWA4_VWB4_WSGRA0_WSGRB0_WS64_WG32_8_1_WGM6_WGMXCC1_WGMXCCGn1
    SolutionIndex: 20
    SolutionNameMin: Cijk_Ailk_Bljk_I8II_BH_UserArgs_MT128x128x128_MI16x16x1_SN_LDSB1_AFC0_AFEM1_AFEM1_ASEM1_CLR1_CADS0_DTVA0_DTVB0_EPS0_FDSI0_GRPM1_GRVWA16_GRVWB16_GSU0_GSUAMB_GSUC0_GSUWGMRR0_GLS0_ISA950_IU1_K1_LBSPPA2048_LBSPPB256_LBSPPM0_LPA64_LPB32_LPM0_LRVW16_LWPMn1_MIAV0_MIWT4_4_MO40_NTn1_NTA0_NTB0_NTC0_NTD0_NTM0_NEPBS0_NLCA1_NLCB1_ONLL1_PGR2_PLR1_PKA1_SIA3_SS1_SU0_SUM0_SUS128_SPO0_SRVW0_SSO0_SVW4_SK3_SKXCCM8_TLDS1_ULSGRO0_USL1_UIOFGRO0_USFGRO0_VSn1_VWA4_VWB2_WSGRA0_WSGRB0_WS64_WG32_8_1_WGM6_WGMXCC1_WGMXCCGn1
    SolutionIndex: 21
    SolutionNameMin: Cijk_Ailk_Bljk_I8II_BH_UserArgs_MT128x128x128_MI16x16x1_SN_LDSB1_AFC0_AFEM1_AFEM1_ASEM1_CLR1_CADS0_DTVA0_DTVB0_EPS0_FDSI0_GRPM1_GRVWA16_GRVWB16_GSU0_GSUAMB_GSUC0_GSUWGMRR0_GLS0_ISA950_IU1_K1_LBSPPA2048_LBSPPB512_LBSPPM0_LPA64_LPB32_LPM0_LRVW16_LWPMn1_MIAV0_MIWT4_4_MO40_NTn1_NTA0_NTB0_NTC0_NTD0_NTM0_NEPBS0_NLCA1_NLCB1_ONLL1_PGR2_PLR1_PKA1_SIA3_SS1_SU0_SUM0_SUS128_SPO0_SRVW0_SSO0_SVW4_SK3_SKXCCM8_TLDS1_ULSGRO0_USL1_UIOFGRO0_USFGRO0_VSn1_VWA4_VWB4_WSGRA0_WSGRB0_WS64_WG32_8_1_WGM6_WGMXCC1_WGMXCCGn1
    SolutionIndex: 22
    SolutionNameMin: Cijk_Ailk_Bljk_I8II_BH_UserArgs_MT64x128x128_MI16x16x1_SN_LDSB1_AFC0_AFEM1_AFEM1_ASEM1_CLR1_CADS0_DTVA0_DTVB0_EPS0_FDSI0_GRPM1_GRVWA4_GRVWB16_GSU0_GSUAMB_GSUC0_GSUWGMRR0_GLS0_ISA950_IU1_K1_LBSPPA512_LBSPPB256_LBSPPM0_LPA32_LPB16_LPM0_LRVW8_LWPMn1_MIAV0_MIWT2_4_MO40_NTn1_NTA0_NTB0_NTC0_NTD0_NTM0_NEPBS0_NLCA1_NLCB1_ONLL1_PGR2_PLR1_PKA1_SIA3_SS1_SU0_SUM0_SUS128_SPO0_SRVW0_SSO0_SVW2_SK3_SKXCCM8_TLDS1_ULSGRO0_USL1_UIOFGRO0_USFGRO0_VSn1_VWA2_VWB2_WSGRA0_WSGRB0_WS64_WG32_8_1_WGM6_WGMXCC1_WGMXCCGn1
    SolutionIndex: 23
    SolutionNameMin: Cijk_Ailk_Bljk_I8II_BH_UserArgs_MT64x128x128_MI16x16x1_SN_LDSB1_AFC0_AFEM1_AFEM1_ASEM1_CLR1_CADS0_DTVA0_DTVB0_EPS0_FDSI0_GRPM1_GRVWA4_GRVWB16_GSU0_GSUAMB_GSUC0_GSUWGMRR0_GLS0_ISA950_IU1_K1_LBSPPA512_LBSPPB512_LBSPPM0_LPA32_LPB16_LPM0_LRVW8_LWPMn1_MIAV0_MIWT2_4_MO40_NTn1_NTA0_NTB0_NTC0_NTD0_NTM0_NEPBS0_NLCA1_NLCB1_ONLL1_PGR2_PLR1_PKA1_SIA3_SS1_SU0_SUM0_SUS128_SPO0_SRVW0_SSO0_SVW2_SK3_SKXCCM8_TLDS1_ULSGRO0_USL1_UIOFGRO0_USFGRO0_VSn1_VWA2_VWB4_WSGRA0_WSGRB0_WS64_WG32_8_1_WGM6_WGMXCC1_WGMXCCGn1
    SolutionIndex: 24
    SolutionNameMin: Cijk_Ailk_Bljk_I8II_BH_UserArgs_MT64x128x128_MI16x16x1_SN_LDSB1_AFC0_AFEM1_AFEM1_ASEM1_CLR1_CADS0_DTVA0_DTVB0_EPS0_FDSI0_GRPM1_GRVWA16_GRVWB16_GSU0_GSUAMB_GSUC0_GSUWGMRR0_GLS0_ISA950_IU1_K1_LBSPPA512_LBSPPB256_LBSPPM0_LPA32_LPB16_LPM0_LRVW8_LWPMn1_MIAV0_MIWT2_4_MO40_NTn1_NTA0_NTB0_NTC0_NTD0_NTM0_NEPBS0_NLCA1_NLCB1_ONLL1_PGR2_PLR1_PKA1_SIA3_SS1_SU0_SUM0_SUS128_SPO0_SRVW0_SSO0_SVW2_SK3_SKXCCM8_TLDS1_ULSGRO0_USL1_UIOFGRO0_USFGRO0_VSn1_VWA2_VWB2_WSGRA0_WSGRB0_WS64_WG32_8_1_WGM6_WGMXCC1_WGMXCCGn1
    SolutionIndex: 25
    SolutionNameMin: Cijk_Ailk_Bljk_I8II_BH_UserArgs_MT64x128x128_MI16x16x1_SN_LDSB1_AFC0_AFEM1_AFEM1_ASEM1_CLR1_CADS0_DTVA0_DTVB0_EPS0_FDSI0_GRPM1_GRVWA16_GRVWB16_GSU0_GSUAMB_GSUC0_GSUWGMRR0_GLS0_ISA950_IU1_K1_LBSPPA512_LBSPPB512_LBSPPM0_LPA32_LPB16_LPM0_LRVW8_LWPMn1_MIAV0_MIWT2_4_MO40_NTn1_NTA0_NTB0_NTC0_NTD0_NTM0_NEPBS0_NLCA1_NLCB1_ONLL1_PGR2_PLR1_PKA1_SIA3_SS1_SU0_SUM0_SUS128_SPO0_SRVW0_SSO0_SVW2_SK3_SKXCCM8_TLDS1_ULSGRO0_USL1_UIOFGRO0_USFGRO0_VSn1_VWA2_VWB4_WSGRA0_WSGRB0_WS64_WG32_8_1_WGM6_WGMXCC1_WGMXCCGn1
    SolutionIndex: 26
    SolutionNameMin: Cijk_Ailk_Bljk_I8II_BH_UserArgs_MT64x128x128_MI16x16x1_SN_LDSB1_AFC0_AFEM1_AFEM1_ASEM1_CLR1_CADS0_DTVA0_DTVB0_EPS0_FDSI0_GRPM1_GRVWA4_GRVWB16_GSU0_GSUAMB_GSUC0_GSUWGMRR0_GLS0_ISA950_IU1_K1_LBSPPA512_LBSPPB256_LBSPPM0_LPA32_LPB16_LPM0_LRVW8_LWPMn1_MIAV0_MIWT2_4_MO40_NTn1_NTA0_NTB0_NTC0_NTD0_NTM0_NEPBS0_NLCA1_NLCB1_ONLL1_PGR2_PLR2_PKA1_SIA3_SS1_SU0_SUM0_SUS128_SPO0_SRVW0_SSO0_SVW2_SK3_SKXCCM8_TLDS1_ULSGRO0_USL1_UIOFGRO0_USFGRO0_VSn1_VWA2_VWB2_WSGRA0_WSGRB0_WS64_WG32_8_1_WGM6_WGMXCC1_WGMXCCGn1
    SolutionIndex: 27
    SolutionNameMin: Cijk_Ailk_Bljk_I8II_BH_UserArgs_MT64x128x128_MI16x16x1_SN_LDSB1_AFC0_AFEM1_AFEM1_ASEM1_CLR1_CADS0_DTVA0_DTVB0_EPS0_FDSI0_GRPM1_GRVWA4_GRVWB16_GSU0_GSUAMB_GSUC0_GSUWGMRR0_GLS0_ISA950_IU1_K1_LBSPPA512_LBSPPB512_LBSPPM0_LPA32_LPB16_LPM0_LRVW8_LWPMn1_MIAV0_MIWT2_4_MO40_NTn1_NTA0_NTB0_NTC0_NTD0_NTM0_NEPBS0_NLCA1_NLCB1_ONLL1_PGR2_PLR2_PKA1_SIA3_SS1_SU0_SUM0_SUS128_SPO0_SRVW0_SSO0_SVW2_SK3_SKXCCM8_TLDS1_ULSGRO0_USL1_UIOFGRO0_USFGRO0_VSn1_VWA2_VWB4_WSGRA0_WSGRB0_WS64_WG32_8_1_WGM6_WGMXCC1_WGMXCCGn1
    SolutionIndex: 28
    SolutionNameMin: Cijk_Ailk_Bljk_I8II_BH_UserArgs_MT64x128x128_MI16x16x1_SN_LDSB1_AFC0_AFEM1_AFEM1_ASEM1_CLR1_CADS0_DTVA0_DTVB0_EPS0_FDSI0_GRPM1_GRVWA16_GRVWB16_GSU0_GSUAMB_GSUC0_GSUWGMRR0_GLS0_ISA950_IU1_K1_LBSPPA512_LBSPPB256_LBSPPM0_LPA32_LPB16_LPM0_LRVW8_LWPMn1_MIAV0_MIWT2_4_MO40_NTn1_NTA0_NTB0_NTC0_NTD0_NTM0_NEPBS0_NLCA1_NLCB1_ONLL1_PGR2_PLR2_PKA1_SIA3_SS1_SU0_SUM0_SUS128_SPO0_SRVW0_SSO0_SVW2_SK3_SKXCCM8_TLDS1_ULSGRO0_USL1_UIOFGRO0_USFGRO0_VSn1_VWA2_VWB2_WSGRA0_WSGRB0_WS64_WG32_8_1_WGM6_WGMXCC1_WGMXCCGn1
    SolutionIndex: 29
    SolutionNameMin: Cijk_Ailk_Bljk_I8II_BH_UserArgs_MT64x128x128_MI16x16x1_SN_LDSB1_AFC0_AFEM1_AFEM1_ASEM1_CLR1_CADS0_DTVA0_DTVB0_EPS0_FDSI0_GRPM1_GRVWA16_GRVWB16_GSU0_GSUAMB_GSUC0_GSUWGMRR0_GLS0_ISA950_IU1_K1_LBSPPA512_LBSPPB512_LBSPPM0_LPA32_LPB16_LPM0_LRVW8_LWPMn1_MIAV0_MIWT2_4_MO40_NTn1_NTA0_NTB0_NTC0_NTD0_NTM0_NEPBS0_NLCA1_NLCB1_ONLL1_PGR2_PLR2_PKA1_SIA3_SS1_SU0_SUM0_SUS128_SPO0_SRVW0_SSO0_SVW2_SK3_SKXCCM8_TLDS1_ULSGRO0_USL1_UIOFGRO0_USFGRO0_VSn1_VWA2_VWB4_WSGRA0_WSGRB0_WS64_WG32_8_1_WGM6_WGMXCC1_WGMXCCGn1
    SolutionIndex: 30
    SolutionNameMin: Cijk_Ailk_Bljk_I8II_BH_UserArgs_MT128x64x128_MI16x16x1_SN_LDSB1_AFC0_AFEM1_AFEM1_ASEM1_CLR1_CADS0_DTVA0_DTVB0_EPS0_FDSI0_GRPM1_GRVWA4_GRVWB16_GSU0_GSUAMB_GSUC0_GSUWGMRR0_GLS0_ISA950_IU1_K1_LBSPPA1024_LBSPPB256_LBSPPM0_LPA64_LPB16_LPM0_LRVW8_LWPMn1_MIAV0_MIWT4_2_MO40_NTn1_NTA0_NTB0_NTC0_NTD0_NTM0_NEPBS0_NLCA1_NLCB1_ONLL1_PGR2_PLR1_PKA1_SIA3_SS1_SU0_SUM0_SUS128_SPO0_SRVW0_SSO0_SVW4_SK3_SKXCCM8_TLDS1_ULSGRO0_USL1_UIOFGRO0_USFGRO0_VSn1_VWA4_VWB2_WSGRA0_WSGRB0_WS64_WG32_8_1_WGM6_WGMXCC1_WGMXCCGn1
    SolutionIndex: 31
    SolutionNameMin: Cijk_Ailk_Bljk_I8II_BH_UserArgs_MT128x64x128_MI16x16x1_SN_LDSB1_AFC0_AFEM1_AFEM1_ASEM1_CLR1_CADS0_DTVA0_DTVB0_EPS0_FDSI0_GRPM1_GRVWA4_GRVWB16_GSU0_GSUAMB_GSUC0_GSUWGMRR0_GLS0_ISA950_IU1_K1_LBSPPA2048_LBSPPB256_LBSPPM0_LPA64_LPB32_LPM0_LRVW16_LWPMn1_MIAV0_MIWT4_2_MO40_NTn1_NTA0_NTB0_NTC0_NTD0_NTM0_NEPBS0_NLCA1_NLCB1_ONLL1_PGR2_PLR1_PKA1_SIA3_SS1_SU0_SUM0_SUS128_SPO0_SRVW0_SSO0_SVW4_SK3_SKXCCM8_TLDS1_ULSGRO0_USL1_UIOFGRO0_USFGRO0_VSn1_VWA4_VWB2_WSGRA0_WSGRB0_WS64_WG32_8_1_WGM6_WGMXCC1_WGMXCCGn1
    SolutionIndex: 32
    SolutionNameMin: Cijk_Ailk_Bljk_I8II_BH_UserArgs_MT64x64x128_MI16x16x1_SN_LDSB1_AFC0_AFEM1_AFEM1_ASEM1_CLR1_CADS0_DTVA0_DTVB0_EPS0_FDSI0_GRPM1_GRVWA8_GRVWB4_GSU0_GSUAMB_GSUC0_GSUWGMRR0_GLS0_ISA950_IU1_K1_LBSPPA512_LBSPPB256_LBSPPM0_LPA32_LPB8_LPM0_LRVW8_LWPMn1_MIAV0_MIWT2_2_MO40_NTn1_NTA0_NTB0_NTC0_NTD0_NTM0_NEPBS0_NLCA1_NLCB1_ONLL1_PGR2_PLR1_PKA1_SIA3_SS1_SU0_SUM0_SUS128_SPO0_SRVW0_SSO0_SVW2_SK3_SKXCCM8_TLDS1_ULSGRO0_USL1_UIOFGRO0_USFGRO0_VSn1_VWA2_VWB2_WSGRA0_WSGRB0_WS64_WG32_8_1_WGM6_WGMXCC1_WGMXCCGn1
    SolutionIndex: 33
    SolutionNameMin: Cijk_Ailk_Bljk_I8II_BH_UserArgs_MT64x64x128_MI16x16x1_SN_LDSB1_AFC0_AFEM1_AFEM1_ASEM1_CLR1_CADS0_DTVA0_DTVB0_EPS0_FDSI0_GRPM1_GRVWA16_GRVWB4_GSU0_GSUAMB_GSUC0_GSUWGMRR0_GLS0_ISA950_IU1_K1_LBSPPA512_LBSPPB256_LBSPPM0_LPA32_LPB8_LPM0_LRVW8_LWPMn1_MIAV0_MIWT2_2_MO40_NTn1_NTA0_NTB0_NTC0_NTD0_NTM0_NEPBS0_NLCA1_NLCB1_ONLL1_PGR2_PLR1_PKA1_SIA3_SS1_SU0_SUM0_SUS128_SPO0_SRVW0_SSO0_SVW2_SK3_SKXCCM8_TLDS1_ULSGRO0_USL1_UIOFGRO0_USFGRO0_VSn1_VWA2_VWB2_WSGRA0_WSGRB0_WS64_WG32_8_1_WGM6_WGMXCC1_WGMXCCGn1
    SolutionIndex: 34
    SolutionNameMin: Cijk_Ailk_Bljk_I8II_BH_UserArgs_MT64x64x128_MI16x16x1_SN_LDSB1_AFC0_AFEM1_AFEM1_ASEM1_CLR1_CADS0_DTVA0_DTVB0_EPS0_FDSI0_GRPM1_GRVWA8_GRVWB8_GSU0_GSUAMB_GSUC0_GSUWGMRR0_GLS0_ISA950_IU1_K1_LBSPPA512_LBSPPB256_LBSPPM0_LPA32_LPB8_LPM0_LRVW8_LWPMn1_MIAV0_MIWT2_2_MO40_NTn1_NTA0_NTB0_NTC0_NTD0_NTM0_NEPBS0_NLCA1_NLCB1_ONLL1_PGR2_PLR1_PKA1_SIA3_SS1_SU0_SUM0_SUS128_SPO0_SRVW0_SSO0_SVW2_SK3_SKXCCM8_TLDS1_ULSGRO0_USL1_UIOFGRO0_USFGRO0_VSn1_VWA2_VWB2_WSGRA0_WSGRB0_WS64_WG32_8_1_WGM6_WGMXCC1_WGMXCCGn1
    SolutionIndex: 35
    SolutionNameMin: Cijk_Ailk_Bljk_I8II_BH_UserArgs_MT64x64x128_MI16x16x1_SN_LDSB1_AFC0_AFEM1_AFEM1_ASEM1_CLR1_CADS0_DTVA0_DTVB0_EPS0_FDSI0_GRPM1_GRVWA4_GRVWB16_GSU0_GSUAMB_GSUC0_GSUWGMRR0_GLS0_ISA950_IU1_K1_LBSPPA512_LBSPPB256_LBSPPM0_LPA32_LPB16_LPM0_LRVW8_LWPMn1_MIAV0_MIWT2_2_MO40_NTn1_NTA0_NTB0_NTC0_NTD0_NTM0_NEPBS0_NLCA1_NLCB1_ONLL1_PGR2_PLR1_PKA1_SIA3_SS1_SU0_SUM0_SUS128_SPO0_SRVW0_SSO0_SVW2_SK3_SKXCCM8_TLDS1_ULSGRO0_USL1_UIOFGRO0_USFGRO0_VSn1_VWA2_VWB2_WSGRA0_WSGRB0_WS64_WG32_8_1_WGM6_WGMXCC1_WGMXCCGn1
    SolutionIndex: 36
    SolutionNameMin: Cijk_Ailk_Bljk_I8II_BH_UserArgs_MT64x64x128_MI16x16x1_SN_LDSB1_AFC0_AFEM1_AFEM1_ASEM1_CLR1_CADS0_DTVA0_DTVB0_EPS0_FDSI0_GRPM1_GRVWA8_GRVWB16_GSU0_GSUAMB_GSUC0_GSUWGMRR0_GLS0_ISA950_IU1_K1_LBSPPA512_LBSPPB256_LBSPPM0_LPA32_LPB16_LPM0_LRVW8_LWPMn1_MIAV0_MIWT2_2_MO40_NTn1_NTA0_NTB0_NTC0_NTD0_NTM0_NEPBS0_NLCA1_NLCB1_ONLL1_PGR2_PLR1_PKA1_SIA3_SS1_SU0_SUM0_SUS128_SPO0_SRVW0_SSO0_SVW2_SK3_SKXCCM8_TLDS1_ULSGRO0_USL1_UIOFGRO0_USFGRO0_VSn1_VWA2_VWB2_WSGRA0_WSGRB0_WS64_WG32_8_1_WGM6_WGMXCC1_WGMXCCGn1
    SolutionIndex: 37
    SolutionNameMin: Cijk_Ailk_Bljk_I8II_BH_UserArgs_MT64x64x128_MI16x16x1_SN_LDSB1_AFC0_AFEM1_AFEM1_ASEM1_CLR1_CADS0_DTVA0_DTVB0_EPS0_FDSI0_GRPM1_GRVWA16_GRVWB16_GSU0_GSUAMB_GSUC0_GSUWGMRR0_GLS0_ISA950_IU1_K1_LBSPPA512_LBSPPB256_LBSPPM0_LPA32_LPB16_LPM0_LRVW8_LWPMn1_MIAV0_MIWT2_2_MO40_NTn1_NTA0_NTB0_NTC0_NTD0_NTM0_NEPBS0_NLCA1_NLCB1_ONLL1_PGR2_PLR1_PKA1_SIA3_SS1_SU0_SUM0_SUS128_SPO0_SRVW0_SSO0_SVW2_SK3_SKXCCM8_TLDS1_ULSGRO0_USL1_UIOFGRO0_USFGRO0_VSn1_VWA2_VWB2_WSGRA0_WSGRB0_WS64_WG32_8_1_WGM6_WGMXCC1_WGMXCCGn1
    SolutionIndex: 38
    SolutionNameMin: Cijk_Ailk_Bljk_I8II_BH_UserArgs_MT64x64x128_MI16x16x1_SN_LDSB1_AFC0_AFEM1_AFEM1_ASEM1_CLR1_CADS0_DTVA0_DTVB0_EPS0_FDSI0_GRPM1_GRVWA16_GRVWB4_GSU0_GSUAMB_GSUC0_GSUWGMRR0_GLS0_ISA950_IU1_K1_LBSPPA1024_LBSPPB256_LBSPPM0_LPA32_LPB32_LPM0_LRVW16_LWPMn1_MIAV0_MIWT2_2_MO40_NTn1_NTA0_NTB0_NTC0_NTD0_NTM0_NEPBS0_NLCA1_NLCB1_ONLL1_PGR2_PLR1_PKA1_SIA3_SS1_SU0_SUM0_SUS128_SPO0_SRVW0_SSO0_SVW2_SK3_SKXCCM8_TLDS1_ULSGRO0_USL1_UIOFGRO0_USFGRO0_VSn1_VWA2_VWB2_WSGRA0_WSGRB0_WS64_WG32_8_1_WGM6_WGMXCC1_WGMXCCGn1
    SolutionIndex: 39
    SolutionNameMin: Cijk_Ailk_Bljk_I8II_BH_UserArgs_MT64x64x128_MI16x16x1_SN_LDSB1_AFC0_AFEM1_AFEM1_ASEM1_CLR1_CADS0_DTVA0_DTVB0_EPS0_FDSI0_GRPM1_GRVWA4_GRVWB8_GSU0_GSUAMB_GSUC0_GSUWGMRR0_GLS0_ISA950_IU1_K1_LBSPPA1024_LBSPPB256_LBSPPM0_LPA32_LPB32_LPM0_LRVW16_LWPMn1_MIAV0_MIWT2_2_MO40_NTn1_NTA0_NTB0_NTC0_NTD0_NTM0_NEPBS0_NLCA1_NLCB1_ONLL1_PGR2_PLR1_PKA1_SIA3_SS1_SU0_SUM0_SUS128_SPO0_SRVW0_SSO0_SVW2_SK3_SKXCCM8_TLDS1_ULSGRO0_USL1_UIOFGRO0_USFGRO0_VSn1_VWA2_VWB2_WSGRA0_WSGRB0_WS64_WG32_8_1_WGM6_WGMXCC1_WGMXCCGn1
    SolutionIndex: 40
    SolutionNameMin: Cijk_Ailk_Bljk_I8II_BH_UserArgs_MT64x64x128_MI16x16x1_SN_LDSB1_AFC0_AFEM1_AFEM1_ASEM1_CLR1_CADS0_DTVA0_DTVB0_EPS0_FDSI0_GRPM1_GRVWA4_GRVWB16_GSU0_GSUAMB_GSUC0_GSUWGMRR0_GLS0_ISA950_IU1_K1_LBSPPA1024_LBSPPB256_LBSPPM0_LPA32_LPB32_LPM0_LRVW16_LWPMn1_MIAV0_MIWT2_2_MO40_NTn1_NTA0_NTB0_NTC0_NTD0_NTM0_NEPBS0_NLCA1_NLCB1_ONLL1_PGR2_PLR1_PKA1_SIA3_SS1_SU0_SUM0_SUS128_SPO0_SRVW0_SSO0_SVW2_SK3_SKXCCM8_TLDS1_ULSGRO0_USL1_UIOFGRO0_USFGRO0_VSn1_VWA2_VWB2_WSGRA0_WSGRB0_WS64_WG32_8_1_WGM6_WGMXCC1_WGMXCCGn1
    SolutionIndex: 41
    SolutionNameMin: Cijk_Ailk_Bljk_I8II_BH_UserArgs_MT64x64x128_MI16x16x1_SN_LDSB1_AFC0_AFEM1_AFEM1_ASEM1_CLR1_CADS0_DTVA0_DTVB0_EPS0_FDSI0_GRPM1_GRVWA8_GRVWB16_GSU0_GSUAMB_GSUC0_GSUWGMRR0_GLS0_ISA950_IU1_K1_LBSPPA1024_LBSPPB256_LBSPPM0_LPA32_LPB32_LPM0_LRVW16_LWPMn1_MIAV0_MIWT2_2_MO40_NTn1_NTA0_NTB0_NTC0_NTD0_NTM0_NEPBS0_NLCA1_NLCB1_ONLL1_PGR2_PLR1_PKA1_SIA3_SS1_SU0_SUM0_SUS128_SPO0_SRVW0_SSO0_SVW2_SK3_SKXCCM8_TLDS1_ULSGRO0_USL1_UIOFGRO0_USFGRO0_VSn1_VWA2_VWB2_WSGRA0_WSGRB0_WS64_WG32_8_1_WGM6_WGMXCC1_WGMXCCGn1
    SolutionIndex: 42
    SolutionNameMin: Cijk_Ailk_Bljk_I8II_BH_UserArgs_MT64x64x128_MI16x16x1_SN_LDSB1_AFC0_AFEM1_AFEM1_ASEM1_CLR1_CADS0_DTVA0_DTVB0_EPS0_FDSI0_GRPM1_GRVWA16_GRVWB16_GSU0_GSUAMB_GSUC0_GSUWGMRR0_GLS0_ISA950_IU1_K1_LBSPPA1024_LBSPPB256_LBSPPM0_LPA32_LPB32_LPM0_LRVW16_LWPMn1_MIAV0_MIWT2_2_MO40_NTn1_NTA0_NTB0_NTC0_NTD0_NTM0_NEPBS0_NLCA1_NLCB1_ONLL1_PGR2_PLR1_PKA1_SIA3_SS1_SU0_SUM0_SUS128_SPO0_SRVW0_SSO0_SVW2_SK3_SKXCCM8_TLDS1_ULSGRO0_USL1_UIOFGRO0_USFGRO0_VSn1_VWA2_VWB2_WSGRA0_WSGRB0_WS64_WG32_8_1_WGM6_WGMXCC1_WGMXCCGn1
    SolutionIndex: 43
    SolutionNameMin: Cijk_Ailk_Bljk_I8II_BH_UserArgs_MT64x64x128_MI16x16x1_SN_LDSB1_AFC0_AFEM1_AFEM1_ASEM1_CLR1_CADS0_DTVA0_DTVB0_EPS0_FDSI0_GRPM1_GRVWA8_GRVWB4_GSU0_GSUAMB_GSUC0_GSUWGMRR0_GLS0_ISA950_IU1_K1_LBSPPA512_LBSPPB256_LBSPPM0_LPA32_LPB8_LPM0_LRVW8_LWPMn1_MIAV0_MIWT2_2_MO40_NTn1_NTA0_NTB0_NTC0_NTD0_NTM0_NEPBS0_NLCA1_NLCB1_ONLL1_PGR2_PLR2_PKA1_SIA3_SS1_SU0_SUM0_SUS128_SPO0_SRVW0_SSO0_SVW2_SK3_SKXCCM8_TLDS1_ULSGRO0_USL1_UIOFGRO0_USFGRO0_VSn1_VWA2_VWB2_WSGRA0_WSGRB0_WS64_WG32_8_1_WGM6_WGMXCC1_WGMXCCGn1
    SolutionIndex: 44
    SolutionNameMin: Cijk_Ailk_Bljk_I8II_BH_UserArgs_MT64x64x128_MI16x16x1_SN_LDSB1_AFC0_AFEM1_AFEM1_ASEM1_CLR1_CADS0_DTVA0_DTVB0_EPS0_FDSI0_GRPM1_GRVWA8_GRVWB8_GSU0_GSUAMB_GSUC0_GSUWGMRR0_GLS0_ISA950_IU1_K1_LBSPPA512_LBSPPB256_LBSPPM0_LPA32_LPB8_LPM0_LRVW8_LWPMn1_MIAV0_MIWT2_2_MO40_NTn1_NTA0_NTB0_NTC0_NTD0_NTM0_NEPBS0_NLCA1_NLCB1_ONLL1_PGR2_PLR2_PKA1_SIA3_SS1_SU0_SUM0_SUS128_SPO0_SRVW0_SSO0_SVW2_SK3_SKXCCM8_TLDS1_ULSGRO0_USL1_UIOFGRO0_USFGRO0_VSn1_VWA2_VWB2_WSGRA0_WSGRB0_WS64_WG32_8_1_WGM6_WGMXCC1_WGMXCCGn1
    SolutionIndex: 45
    SolutionNameMin: Cijk_Ailk_Bljk_I8II_BH_UserArgs_MT64x64x128_MI16x16x1_SN_LDSB1_AFC0_AFEM1_AFEM1_ASEM1_CLR1_CADS0_DTVA0_DTVB0_EPS0_FDSI0_GRPM1_GRVWA4_GRVWB16_GSU0_GSUAMB_GSUC0_GSUWGMRR0_GLS0_ISA950_IU1_K1_LBSPPA512_LBSPPB256_LBSPPM0_LPA32_LPB16_LPM0_LRVW8_LWPMn1_MIAV0_MIWT2_2_MO40_NTn1_NTA0_NTB0_NTC0_NTD0_NTM0_NEPBS0_NLCA1_NLCB1_ONLL1_PGR2_PLR2_PKA1_SIA3_SS1_SU0_SUM0_SUS128_SPO0_SRVW0_SSO0_SVW2_SK3_SKXCCM8_TLDS1_ULSGRO0_USL1_UIOFGRO0_USFGRO0_VSn1_VWA2_VWB2_WSGRA0_WSGRB0_WS64_WG32_8_1_WGM6_WGMXCC1_WGMXCCGn1
    SolutionIndex: 46
    SolutionNameMin: Cijk_Ailk_Bljk_I8II_BH_UserArgs_MT64x64x128_MI16x16x1_SN_LDSB1_AFC0_AFEM1_AFEM1_ASEM1_CLR1_CADS0_DTVA0_DTVB0_EPS0_FDSI0_GRPM1_GRVWA8_GRVWB16_GSU0_GSUAMB_GSUC0_GSUWGMRR0_GLS0_ISA950_IU1_K1_LBSPPA512_LBSPPB256_LBSPPM0_LPA32_LPB16_LPM0_LRVW8_LWPMn1_MIAV0_MIWT2_2_MO40_NTn1_NTA0_NTB0_NTC0_NTD0_NTM0_NEPBS0_NLCA1_NLCB1_ONLL1_PGR2_PLR2_PKA1_SIA3_SS1_SU0_SUM0_SUS128_SPO0_SRVW0_SSO0_SVW2_SK3_SKXCCM8_TLDS1_ULSGRO0_USL1_UIOFGRO0_USFGRO0_VSn1_VWA2_VWB2_WSGRA0_WSGRB0_WS64_WG32_8_1_WGM6_WGMXCC1_WGMXCCGn1
    SolutionIndex: 47
    SolutionNameMin: Cijk_Ailk_Bljk_I8II_BH_UserArgs_MT64x64x128_MI16x16x1_SN_LDSB1_AFC0_AFEM1_AFEM1_ASEM1_CLR1_CADS0_DTVA0_DTVB0_EPS0_FDSI0_GRPM1_GRVWA16_GRVWB16_GSU0_GSUAMB_GSUC0_GSUWGMRR0_GLS0_ISA950_IU1_K1_LBSPPA512_LBSPPB256_LBSPPM0_LPA32_LPB16_LPM0_LRVW8_LWPMn1_MIAV0_MIWT2_2_MO40_NTn1_NTA0_NTB0_NTC0_NTD0_NTM0_NEPBS0_NLCA1_NLCB1_ONLL1_PGR2_PLR2_PKA1_SIA3_SS1_SU0_SUM0_SUS128_SPO0_SRVW0_SSO0_SVW2_SK3_SKXCCM8_TLDS1_ULSGRO0_USL1_UIOFGRO0_USFGRO0_VSn1_VWA2_VWB2_WSGRA0_WSGRB0_WS64_WG32_8_1_WGM6_WGMXCC1_WGMXCCGn1
    SolutionIndex: 48
    SolutionNameMin: Cijk_Ailk_Bljk_I8II_BH_UserArgs_MT64x64x128_MI16x16x1_SN_LDSB1_AFC0_AFEM1_AFEM1_ASEM1_CLR1_CADS0_DTVA0_DTVB0_EPS0_FDSI0_GRPM1_GRVWA8_GRVWB8_GSU0_GSUAMB_GSUC0_GSUWGMRR0_GLS0_ISA950_IU1_K1_LBSPPA1024_LBSPPB256_LBSPPM0_LPA32_LPB32_LPM0_LRVW16_LWPMn1_MIAV0_MIWT2_2_MO40_NTn1_NTA0_NTB0_NTC0_NTD0_NTM0_NEPBS0_NLCA1_NLCB1_ONLL1_PGR2_PLR2_PKA1_SIA3_SS1_SU0_SUM0_SUS128_SPO0_SRVW0_SSO0_SVW2_SK3_SKXCCM8_TLDS1_ULSGRO0_USL1_UIOFGRO0_USFGRO0_VSn1_VWA2_VWB2_WSGRA0_WSGRB0_WS64_WG32_8_1_WGM6_WGMXCC1_WGMXCCGn1
    SolutionIndex: 49
    SolutionNameMin: Cijk_Ailk_Bljk_I8II_BH_UserArgs_MT256x256x128_MI32x32x1_SN_LDSB1_AFC0_AFEM1_AFEM1_ASEM1_CLR1_CADS0_DTVA0_DTVB0_EPS0_FDSI0_GRPM1_GRVWA16_GRVWB16_GSU0_GSUAMB_GSUC0_GSUWGMRR0_GLS0_ISA950_IU1_K1_LBSPPA0_LBSPPB256_LBSPPM0_LPA0_LPB16_LPM0_LRVW16_LWPMn1_MIAV0_MIWT4_4_MO40_NTn1_NTA0_NTB0_NTC0_NTD0_NTM0_NEPBS0_NLCA1_NLCB1_ONLL1_PGR2_PLR1_PKA1_SIA3_SS1_SU0_SUM0_SUS128_SPO0_SRVW0_SSO0_SVW4_SK3_SKXCCM8_TLDS1_ULSGRO0_USL1_UIOFGRO0_USFGRO0_VSn1_VWA4_VWB2_WSGRA0_WSGRB0_WS64_WG64_4_1_WGM6_WGMXCC1_WGMXCCGn1
    SolutionIndex: 50
    SolutionNameMin: Cijk_Ailk_Bljk_I8II_BH_UserArgs_MT128x256x128_MI32x32x1_SN_LDSB1_AFC0_AFEM1_AFEM1_ASEM1_CLR1_CADS0_DTVA0_DTVB0_EPS0_FDSI0_GRPM1_GRVWA8_GRVWB16_GSU0_GSUAMB_GSUC0_GSUWGMRR0_GLS0_ISA950_IU1_K1_LBSPPA0_LBSPPB512_LBSPPM0_LPA0_LPB16_LPM0_LRVW16_LWPMn1_MIAV0_MIWT2_4_MO40_NTn1_NTA0_NTB0_NTC0_NTD0_NTM0_NEPBS0_NLCA1_NLCB1_ONLL1_PGR2_PLR1_PKA1_SIA3_SS1_SU0_SUM0_SUS128_SPO0_SRVW0_SSO0_SVW2_SK3_SKXCCM8_TLDS1_ULSGRO0_USL1_UIOFGRO0_USFGRO0_VSn1_VWA2_VWB4_WSGRA0_WSGRB0_WS64_WG64_4_1_WGM6_WGMXCC1_WGMXCCGn1
    SolutionIndex: 51
    SolutionNameMin: Cijk_Ailk_Bljk_I8II_BH_UserArgs_MT128x256x128_MI32x32x1_SN_LDSB1_AFC0_AFEM1_AFEM1_ASEM1_CLR1_CADS0_DTVA0_DTVB0_EPS0_FDSI0_GRPM1_GRVWA16_GRVWB16_GSU0_GSUAMB_GSUC0_GSUWGMRR0_GLS0_ISA950_IU1_K1_LBSPPA0_LBSPPB256_LBSPPM0_LPA0_LPB16_LPM0_LRVW16_LWPMn1_MIAV0_MIWT2_4_MO40_NTn1_NTA0_NTB0_NTC0_NTD0_NTM0_NEPBS0_NLCA1_NLCB1_ONLL1_PGR2_PLR1_PKA1_SIA3_SS1_SU0_SUM0_SUS128_SPO0_SRVW0_SSO0_SVW2_SK3_SKXCCM8_TLDS1_ULSGRO0_USL1_UIOFGRO0_USFGRO0_VSn1_VWA2_VWB2_WSGRA0_WSGRB0_WS64_WG64_4_1_WGM6_WGMXCC1_WGMXCCGn1
    SolutionIndex: 52
    SolutionNameMin: Cijk_Ailk_Bljk_I8II_BH_UserArgs_MT128x256x128_MI32x32x1_SN_LDSB1_AFC0_AFEM1_AFEM1_ASEM1_CLR1_CADS0_DTVA0_DTVB0_EPS0_FDSI0_GRPM1_GRVWA16_GRVWB16_GSU0_GSUAMB_GSUC0_GSUWGMRR0_GLS0_ISA950_IU1_K1_LBSPPA0_LBSPPB512_LBSPPM0_LPA0_LPB16_LPM0_LRVW16_LWPMn1_MIAV0_MIWT2_4_MO40_NTn1_NTA0_NTB0_NTC0_NTD0_NTM0_NEPBS0_NLCA1_NLCB1_ONLL1_PGR2_PLR1_PKA1_SIA3_SS1_SU0_SUM0_SUS128_SPO0_SRVW0_SSO0_SVW2_SK3_SKXCCM8_TLDS1_ULSGRO0_USL1_UIOFGRO0_USFGRO0_VSn1_VWA2_VWB4_WSGRA0_WSGRB0_WS64_WG64_4_1_WGM6_WGMXCC1_WGMXCCGn1
    SolutionIndex: 53
    SolutionNameMin: Cijk_Ailk_Bljk_I8II_BH_UserArgs_MT128x256x128_MI32x32x1_SN_LDSB1_AFC0_AFEM1_AFEM1_ASEM1_CLR1_CADS0_DTVA0_DTVB0_EPS0_FDSI0_GRPM1_GRVWA4_GRVWB16_GSU0_GSUAMB_GSUC0_GSUWGMRR0_GLS0_ISA950_IU1_K1_LBSPPA0_LBSPPB512_LBSPPM0_LPA0_LPB16_LPM0_LRVW16_LWPMn1_MIAV0_MIWT2_4_MO40_NTn1_NTA0_NTB0_NTC0_NTD0_NTM0_NEPBS0_NLCA1_NLCB1_ONLL1_PGR2_PLR2_PKA1_SIA3_SS1_SU0_SUM0_SUS128_SPO0_SRVW0_SSO0_SVW2_SK3_SKXCCM8_TLDS1_ULSGRO0_USL1_UIOFGRO0_USFGRO0_VSn1_VWA2_VWB4_WSGRA0_WSGRB0_WS64_WG64_4_1_WGM6_WGMXCC1_WGMXCCGn1
    SolutionIndex: 54
    SolutionNameMin: Cijk_Ailk_Bljk_I8II_BH_UserArgs_MT128x256x128_MI32x32x1_SN_LDSB1_AFC0_AFEM1_AFEM1_ASEM1_CLR1_CADS0_DTVA0_DTVB0_EPS0_FDSI0_GRPM1_GRVWA16_GRVWB16_GSU0_GSUAMB_GSUC0_GSUWGMRR0_GLS0_ISA950_IU1_K1_LBSPPA0_LBSPPB256_LBSPPM0_LPA0_LPB16_LPM0_LRVW16_LWPMn1_MIAV0_MIWT2_4_MO40_NTn1_NTA0_NTB0_NTC0_NTD0_NTM0_NEPBS0_NLCA1_NLCB1_ONLL1_PGR2_PLR2_PKA1_SIA3_SS1_SU0_SUM0_SUS128_SPO0_SRVW0_SSO0_SVW2_SK3_SKXCCM8_TLDS1_ULSGRO0_USL1_UIOFGRO0_USFGRO0_VSn1_VWA2_VWB2_WSGRA0_WSGRB0_WS64_WG64_4_1_WGM6_WGMXCC1_WGMXCCGn1
    SolutionIndex: 55
    SolutionNameMin: Cijk_Ailk_Bljk_I8II_BH_UserArgs_MT128x256x128_MI32x32x1_SN_LDSB1_AFC0_AFEM1_AFEM1_ASEM1_CLR1_CADS0_DTVA0_DTVB0_EPS0_FDSI0_GRPM1_GRVWA16_GRVWB16_GSU0_GSUAMB_GSUC0_GSUWGMRR0_GLS0_ISA950_IU1_K1_LBSPPA0_LBSPPB512_LBSPPM0_LPA0_LPB16_LPM0_LRVW16_LWPMn1_MIAV0_MIWT2_4_MO40_NTn1_NTA0_NTB0_NTC0_NTD0_NTM0_NEPBS0_NLCA1_NLCB1_ONLL1_PGR2_PLR2_PKA1_SIA3_SS1_SU0_SUM0_SUS128_SPO0_SRVW0_SSO0_SVW2_SK3_SKXCCM8_TLDS1_ULSGRO0_USL1_UIOFGRO0_USFGRO0_VSn1_VWA2_VWB4_WSGRA0_WSGRB0_WS64_WG64_4_1_WGM6_WGMXCC1_WGMXCCGn1
    SolutionIndex: 56
    SolutionNameMin: Cijk_Ailk_Bljk_I8II_BH_UserArgs_MT256x128x128_MI32x32x1_SN_LDSB1_AFC0_AFEM1_AFEM1_ASEM1_CLR1_CADS0_DTVA0_DTVB0_EPS0_FDSI0_GRPM1_GRVWA16_GRVWB16_GSU0_GSUAMB_GSUC0_GSUWGMRR0_GLS0_ISA950_IU1_K1_LBSPPA0_LBSPPB256_LBSPPM0_LPA0_LPB16_LPM0_LRVW16_LWPMn1_MIAV0_MIWT4_2_MO40_NTn1_NTA0_NTB0_NTC0_NTD0_NTM0_NEPBS0_NLCA1_NLCB1_ONLL1_PGR2_PLR1_PKA1_SIA3_SS1_SU0_SUM0_SUS128_SPO0_SRVW0_SSO0_SVW4_SK3_SKXCCM8_TLDS1_ULSGRO0_USL1_UIOFGRO0_USFGRO0_VSn1_VWA4_VWB2_WSGRA0_WSGRB0_WS64_WG64_4_1_WGM6_WGMXCC1_WGMXCCGn1
    SolutionIndex: 57
    SolutionNameMin: Cijk_Ailk_Bljk_I8II_BH_UserArgs_MT128x128x128_MI32x32x1_SN_LDSB1_AFC0_AFEM1_AFEM1_ASEM1_CLR1_CADS0_DTVA0_DTVB0_EPS0_FDSI0_GRPM1_GRVWA4_GRVWB16_GSU0_GSUAMB_GSUC0_GSUWGMRR0_GLS0_ISA950_IU1_K1_LBSPPA0_LBSPPB256_LBSPPM0_LPA0_LPB16_LPM0_LRVW16_LWPMn1_MIAV0_MIWT2_2_MO40_NTn1_NTA0_NTB0_NTC0_NTD0_NTM0_NEPBS0_NLCA1_NLCB1_ONLL1_PGR2_PLR1_PKA1_SIA3_SS1_SU0_SUM0_SUS128_SPO0_SRVW0_SSO0_SVW2_SK3_SKXCCM8_TLDS1_ULSGRO0_USL1_UIOFGRO0_USFGRO0_VSn1_VWA2_VWB2_WSGRA0_WSGRB0_WS64_WG64_4_1_WGM6_WGMXCC1_WGMXCCGn1
    SolutionIndex: 58
    SolutionNameMin: Cijk_Ailk_Bljk_I8II_BH_UserArgs_MT128x128x128_MI32x32x1_SN_LDSB1_AFC0_AFEM1_AFEM1_ASEM1_CLR1_CADS0_DTVA0_DTVB0_EPS0_FDSI0_GRPM1_GRVWA8_GRVWB16_GSU0_GSUAMB_GSUC0_GSUWGMRR0_GLS0_ISA950_IU1_K1_LBSPPA0_LBSPPB256_LBSPPM0_LPA0_LPB16_LPM0_LRVW16_LWPMn1_MIAV0_MIWT2_2_MO40_NTn1_NTA0_NTB0_NTC0_NTD0_NTM0_NEPBS0_NLCA1_NLCB1_ONLL1_PGR2_PLR1_PKA1_SIA3_SS1_SU0_SUM0_SUS128_SPO0_SRVW0_SSO0_SVW2_SK3_SKXCCM8_TLDS1_ULSGRO0_USL1_UIOFGRO0_USFGRO0_VSn1_VWA2_VWB2_WSGRA0_WSGRB0_WS64_WG64_4_1_WGM6_WGMXCC1_WGMXCCGn1
    SolutionIndex: 59
    SolutionNameMin: Cijk_Ailk_Bljk_I8II_BH_UserArgs_MT128x128x128_MI32x32x1_SN_LDSB1_AFC0_AFEM1_AFEM1_ASEM1_CLR1_CADS0_DTVA0_DTVB0_EPS0_FDSI0_GRPM1_GRVWA16_GRVWB16_GSU0_GSUAMB_GSUC0_GSUWGMRR0_GLS0_ISA950_IU1_K1_LBSPPA0_LBSPPB256_LBSPPM0_LPA0_LPB16_LPM0_LRVW16_LWPMn1_MIAV0_MIWT2_2_MO40_NTn1_NTA0_NTB0_NTC0_NTD0_NTM0_NEPBS0_NLCA1_NLCB1_ONLL1_PGR2_PLR1_PKA1_SIA3_SS1_SU0_SUM0_SUS128_SPO0_SRVW0_SSO0_SVW2_SK3_SKXCCM8_TLDS1_ULSGRO0_USL1_UIOFGRO0_USFGRO0_VSn1_VWA2_VWB2_WSGRA0_WSGRB0_WS64_WG64_4_1_WGM6_WGMXCC1_WGMXCCGn1
    SolutionIndex: 60
    SolutionNameMin: Cijk_Ailk_Bljk_I8II_BH_UserArgs_MT128x128x128_MI32x32x1_SN_LDSB1_AFC0_AFEM1_AFEM1_ASEM1_CLR1_CADS0_DTVA0_DTVB0_EPS0_FDSI0_GRPM1_GRVWA16_GRVWB16_GSU0_GSUAMB_GSUC0_GSUWGMRR0_GLS0_ISA950_IU1_K1_LBSPPA0_LBSPPB256_LBSPPM0_LPA0_LPB16_LPM0_LRVW16_LWPMn1_MIAV0_MIWT2_2_MO40_NTn1_NTA0_NTB0_NTC0_NTD0_NTM0_NEPBS0_NLCA1_NLCB1_ONLL1_PGR2_PLR2_PKA1_SIA3_SS1_SU0_SUM0_SUS128_SPO0_SRVW0_SSO0_SVW2_SK3_SKXCCM8_TLDS1_ULSGRO0_USL1_UIOFGRO0_USFGRO0_VSn1_VWA2_VWB2_WSGRA0_WSGRB0_WS64_WG64_4_1_WGM6_WGMXCC1_WGMXCCGn1
    SolutionIndex: 61
    SolutionNameMin: Cijk_Ailk_Bljk_I8II_BH_UserArgs_MT64x64x256_MI16x16x1_SN_LDSB1_AFC0_AFEM1_AFEM1_ASEM1_CLR1_CADS0_DTVA0_DTVB0_EPS0_FDSI0_GRPM1_GRVWA8_GRVWB16_GSU0_GSUAMB_GSUC0_GSUWGMRR0_GLS0_ISA950_IU1_K1_LBSPPA1024_LBSPPB512_LBSPPM0_LPA32_LPB32_LPM0_LRVW16_LWPMn1_MIAV0_MIWT2_2_MO40_NTn1_NTA0_NTB0_NTC0_NTD0_NTM0_NEPBS0_NLCA1_NLCB1_ONLL1_PGR2_PLR1_PKA1_SIA3_SS1_SU0_SUM0_SUS256_SPO0_SRVW0_SSO0_SVW2_SK3_SKXCCM8_TLDS1_ULSGRO0_USL1_UIOFGRO0_USFGRO0_VSn1_VWA2_VWB2_WSGRA0_WSGRB0_WS64_WG32_8_1_WGM6_WGMXCC1_WGMXCCGn1
    SolutionIndex: 62
    SolutionNameMin: Cijk_Ailk_Bljk_I8II_BH_UserArgs_MT64x64x256_MI16x16x1_SN_LDSB1_AFC0_AFEM1_AFEM1_ASEM1_CLR1_CADS0_DTVA0_DTVB0_EPS0_FDSI0_GRPM1_GRVWA16_GRVWB16_GSU0_GSUAMB_GSUC0_GSUWGMRR0_GLS0_ISA950_IU1_K1_LBSPPA512_LBSPPB512_LBSPPM0_LPA32_LPB16_LPM0_LRVW8_LWPMn1_MIAV0_MIWT2_2_MO40_NTn1_NTA0_NTB0_NTC0_NTD0_NTM0_NEPBS0_NLCA1_NLCB1_ONLL1_PGR2_PLR2_PKA1_SIA3_SS1_SU0_SUM0_SUS256_SPO0_SRVW0_SSO0_SVW2_SK3_SKXCCM8_TLDS1_ULSGRO0_USL1_UIOFGRO0_USFGRO0_VSn1_VWA2_VWB2_WSGRA0_WSGRB0_WS64_WG32_8_1_WGM6_WGMXCC1_WGMXCCGn1
    SolutionIndex: 63
    SolutionNameMin: Cijk_Ailk_Bljk_I8II_BH_UserArgs_MT64x64x256_MI16x16x1_SN_LDSB1_AFC0_AFEM1_AFEM1_ASEM1_CLR1_CADS0_DTVA0_DTVB0_EPS0_FDSI0_GRPM1_GRVWA4_GRVWB16_GSU0_GSUAMB_GSUC0_GSUWGMRR0_GLS0_ISA950_IU1_K1_LBSPPA1024_LBSPPB512_LBSPPM0_LPA32_LPB32_LPM0_LRVW16_LWPMn1_MIAV0_MIWT2_2_MO40_NTn1_NTA0_NTB0_NTC0_NTD0_NTM0_NEPBS0_NLCA1_NLCB1_ONLL1_PGR2_PLR2_PKA1_SIA3_SS1_SU0_SUM0_SUS256_SPO0_SRVW0_SSO0_SVW2_SK3_SKXCCM8_TLDS1_ULSGRO0_USL1_UIOFGRO0_USFGRO0_VSn1_VWA2_VWB2_WSGRA0_WSGRB0_WS64_WG32_8_1_WGM6_WGMXCC1_WGMXCCGn1
    SolutionIndex: 64
    SolutionNameMin: Cijk_Ailk_Bljk_I8II_BH_UserArgs_MT64x64x256_MI16x16x1_SN_LDSB1_AFC0_AFEM1_AFEM1_ASEM1_CLR1_CADS0_DTVA0_DTVB0_EPS0_FDSI0_GRPM1_GRVWA8_GRVWB16_GSU0_GSUAMB_GSUC0_GSUWGMRR0_GLS0_ISA950_IU1_K1_LBSPPA1024_LBSPPB512_LBSPPM0_LPA32_LPB32_LPM0_LRVW16_LWPMn1_MIAV0_MIWT2_2_MO40_NTn1_NTA0_NTB0_NTC0_NTD0_NTM0_NEPBS0_NLCA1_NLCB1_ONLL1_PGR2_PLR2_PKA1_SIA3_SS1_SU0_SUM0_SUS256_SPO0_SRVW0_SSO0_SVW2_SK3_SKXCCM8_TLDS1_ULSGRO0_USL1_UIOFGRO0_USFGRO0_VSn1_VWA2_VWB2_WSGRA0_WSGRB0_WS64_WG32_8_1_WGM6_WGMXCC1_WGMXCCGn1
    SolutionIndex: 65
    SolutionNameMin: Cijk_Ailk_Bljk_I8II_BH_UserArgs_MT64x64x256_MI16x16x1_SN_LDSB1_AFC0_AFEM1_AFEM1_ASEM1_CLR1_CADS0_DTVA0_DTVB0_EPS0_FDSI0_GRPM1_GRVWA16_GRVWB16_GSU0_GSUAMB_GSUC0_GSUWGMRR0_GLS0_ISA950_IU1_K1_LBSPPA1024_LBSPPB512_LBSPPM0_LPA32_LPB32_LPM0_LRVW16_LWPMn1_MIAV0_MIWT2_2_MO40_NTn1_NTA0_NTB0_NTC0_NTD0_NTM0_NEPBS0_NLCA1_NLCB1_ONLL1_PGR2_PLR2_PKA1_SIA3_SS1_SU0_SUM0_SUS256_SPO0_SRVW0_SSO0_SVW2_SK3_SKXCCM8_TLDS1_ULSGRO0_USL1_UIOFGRO0_USFGRO0_VSn1_VWA2_VWB2_WSGRA0_WSGRB0_WS64_WG32_8_1_WGM6_WGMXCC1_WGMXCCGn1
- - - [128, 128, 1, 128, 128, 128, 128, 128]
    - [37, 0.35]
  - - [128, 128, 1, 256, 128, 128, 128, 256]
    - [63, 0.66]
  - - [128, 128, 1, 512, 128, 128, 128, 512]
    - [35, 1.14]
  - - [128, 128, 1, 1024, 128, 128, 128, 1024]
    - [65, 1.79]
  - - [128, 128, 1, 2048, 128, 128, 128, 2048]
    - [62, 2.51]
  - - [128, 128, 1, 4096, 128, 128, 128, 4096]
    - [65, 3.17]
  - - [128, 128, 1, 8192, 128, 128, 128, 8192]
    - [65, 3.72]
  - - [128, 256, 1, 128, 128, 128, 128, 128]
    - [38, 0.7]
  - - [128, 256, 1, 256, 128, 128, 128, 256]
    - [65, 1.3]
  - - [128, 256, 1, 512, 128, 128, 128, 512]
    - [35, 2.24]
  - - [128, 256, 1, 1024, 128, 128, 128, 1024]
    - [63, 3.51]
  - - [128, 256, 1, 2048, 128, 128, 128, 2048]
    - [65, 5.0]
  - - [128, 256, 1, 4096, 128, 128, 128, 4096]
    - [65, 6.31]
  - - [128, 256, 1, 8192, 128, 128, 128, 8192]
    - [65, 7.32]
  - - [128, 512, 1, 128, 128, 128, 128, 128]
    - [4, 1.49]
  - - [128, 512, 1, 256, 128, 128, 128, 256]
    - [35, 2.66]
  - - [128, 512, 1, 512, 128, 128, 128, 512]
    - [40, 4.47]
  - - [128, 512, 1, 1024, 128, 128, 128, 1024]
    - [65, 7.02]
  - - [128, 512, 1, 2048, 128, 128, 128, 2048]
    - [65, 10.02]
  - - [128, 512, 1, 4096, 128, 128, 128, 4096]
    - [65, 12.69]
  - - [128, 512, 1, 8192, 128, 128, 128, 8192]
    - [65, 14.66]
  - - [128, 1024, 1, 128, 128, 128, 128, 128]
    - [35, 2.99]
  - - [128, 1024, 1, 256, 128, 128, 128, 256]
    - [40, 5.18]
  - - [128, 1024, 1, 512, 128, 128, 128, 512]
    - [35, 8.92]
  - - [128, 1024, 1, 1024, 128, 128, 128, 1024]
    - [63, 13.87]
  - - [128, 1024, 1, 2048, 128, 128, 128, 2048]
    - [65, 19.95]
  - - [128, 1024, 1, 4096, 128, 128, 128, 4096]
    - [63, 25.05]
  - - [128, 1024, 1, 8192, 128, 128, 128, 8192]
    - [65, 29.44]
  - - [128, 2048, 1, 128, 128, 128, 128, 128]
    - [44, 5.63]
  - - [128, 2048, 1, 256, 128, 128, 128, 256]
    - [45, 10.18]
  - - [128, 2048, 1, 512, 128, 128, 128, 512]
    - [40, 17.26]
  - - [128, 2048, 1, 1024, 128, 128, 128, 1024]
    - [63, 27.22]
  - - [128, 2048, 1, 2048, 128, 128, 128, 2048]
    - [65, 39.21]
  - - [128, 2048, 1, 4096, 128, 128, 128, 4096]
    - [65, 49.89]
  - - [128, 2048, 1, 8192, 128, 128, 128, 8192]
    - [65, 58.68]
  - - [128, 4096, 1, 128, 128, 128, 128, 128]
    - [40, 11.09]
  - - [128, 4096, 1, 256, 128, 128, 128, 256]
    - [35, 19.01]
  - - [128, 4096, 1, 512, 128, 128, 128, 512]
    - [45, 32.9]
  - - [128, 4096, 1, 1024, 128, 128, 128, 1024]
    - [65, 52.58]
  - - [128, 4096, 1, 2048, 128, 128, 128, 2048]
    - [65, 76.69]
  - - [128, 4096, 1, 4096, 128, 128, 128, 4096]
    - [65, 97.45]
  - - [128, 4096, 1, 8192, 128, 128, 128, 8192]
    - [65, 113.23]
  - - [128, 8192, 1, 128, 128, 128, 128, 128]
    - [45, 19.66]
  - - [128, 8192, 1, 256, 128, 128, 128, 256]
    - [40, 35.4]
  - - [128, 8192, 1, 512, 128, 128, 128, 512]
    - [42, 60.46]
  - - [128, 8192, 1, 1024, 128, 128, 128, 1024]
    - [65, 97.57]
  - - [128, 8192, 1, 2048, 128, 128, 128, 2048]
    - [65, 141.95]
  - - [128, 8192, 1, 4096, 128, 128, 128, 4096]
    - [65, 179.28]
  - - [128, 8192, 1, 8192, 128, 128, 128, 8192]
    - [65, 212.26]
  - - [256, 128, 1, 128, 256, 256, 256, 128]
    - [32, 0.72]
  - - [256, 128, 1, 256, 256, 256, 256, 256]
    - [46, 1.28]
  - - [256, 128, 1, 512, 256, 256, 256, 512]
    - [42, 2.25]
  - - [256, 128, 1, 1024, 256, 256, 256, 1024]
    - [62, 3.46]
  - - [256, 128, 1, 2048, 256, 256, 256, 2048]
    - [65, 4.88]
  - - [256, 128, 1, 4096, 256, 256, 256, 4096]
    - [65, 5.97]
  - - [256, 128, 1, 8192, 256, 256, 256, 8192]
    - [65, 6.78]
  - - [256, 256, 1, 128, 256, 256, 256, 128]
    - [45, 1.51]
  - - [256, 256, 1, 256, 256, 256, 256, 256]
    - [45, 2.66]
  - - [256, 256, 1, 512, 256, 256, 256, 512]
    - [35, 4.49]
  - - [256, 256, 1, 1024, 256, 256, 256, 1024]
    - [65, 6.98]
  - - [256, 256, 1, 2048, 256, 256, 256, 2048]
    - [65, 9.68]
  - - [256, 256, 1, 4096, 256, 256, 256, 4096]
    - [65, 12.13]
  - - [256, 256, 1, 8192, 256, 256, 256, 8192]
    - [65, 13.82]
  - - [256, 512, 1, 128, 256, 256, 256, 128]
    - [36, 2.89]
  - - [256, 512, 1, 256, 256, 256, 256, 256]
    - [63, 5.29]
  - - [256, 512, 1, 512, 256, 256, 256, 512]
    - [40, 8.98]
  - - [256, 512, 1, 1024, 256, 256, 256, 1024]
    - [65, 13.9]
  - - [256, 512, 1, 2048, 256, 256, 256, 2048]
    - [65, 19.57]
  - - [256, 512, 1, 4096, 256, 256, 256, 4096]
    - [65, 24.29]
  - - [256, 512, 1, 8192, 256, 256, 256, 8192]
    - [65, 27.86]
  - - [256, 1024, 1, 128, 256, 256, 256, 128]
    - [4, 5.52]
  - - [256, 1024, 1, 256, 256, 256, 256, 256]
    - [40, 10.44]
  - - [256, 1024, 1, 512, 256, 256, 256, 512]
    - [47, 17.3]
  - - [256, 1024, 1, 1024, 256, 256, 256, 1024]
    - [65, 27.41]
  - - [256, 1024, 1, 2048, 256, 256, 256, 2048]
    - [65, 38.35]
  - - [256, 1024, 1, 4096, 256, 256, 256, 4096]
    - [65, 48.47]
  - - [256, 1024, 1, 8192, 256, 256, 256, 8192]
    - [65, 55.59]
  - - [256, 2048, 1, 128, 256, 256, 256, 128]
    - [45, 10.82]
  - - [256, 2048, 1, 256, 256, 256, 256, 256]
    - [40, 19.77]
  - - [256, 2048, 1, 512, 256, 256, 256, 512]
    - [40, 33.16]
  - - [256, 2048, 1, 1024, 256, 256, 256, 1024]
    - [65, 52.97]
  - - [256, 2048, 1, 2048, 256, 256, 256, 2048]
    - [65, 75.73]
  - - [256, 2048, 1, 4096, 256, 256, 256, 4096]
    - [65, 94.84]
  - - [256, 2048, 1, 8192, 256, 256, 256, 8192]
    - [65, 110.51]
  - - [256, 4096, 1, 128, 256, 256, 256, 128]
    - [40, 19.46]
  - - [256, 4096, 1, 256, 256, 256, 256, 256]
    - [35, 35.55]
  - - [256, 4096, 1, 512, 256, 256, 256, 512]
    - [40, 61.19]
  - - [256, 4096, 1, 1024, 256, 256, 256, 1024]
    - [65, 99.3]
  - - [256, 4096, 1, 2048, 256, 256, 256, 2048]
    - [65, 144.5]
  - - [256, 4096, 1, 4096, 256, 256, 256, 4096]
    - [65, 182.49]
  - - [256, 4096, 1, 8192, 256, 256, 256, 8192]
    - [65, 209.66]
  - - [256, 8192, 1, 128, 256, 256, 256, 128]
    - [31, 31.53]
  - - [256, 8192, 1, 256, 256, 256, 256, 256]
    - [23, 57.03]
  - - [256, 8192, 1, 512, 256, 256, 256, 512]
    - [22, 98.73]
  - - [256, 8192, 1, 1024, 256, 256, 256, 1024]
    - [22, 152.26]
  - - [256, 8192, 1, 2048, 256, 256, 256, 2048]
    - [24, 213.93]
  - - [256, 8192, 1, 4096, 256, 256, 256, 4096]
    - [26, 265.73]
  - - [256, 8192, 1, 8192, 256, 256, 256, 8192]
    - [28, 306.7]
  - - [512, 128, 1, 128, 512, 512, 512, 128]
    - [39, 1.41]
  - - [512, 128, 1, 256, 512, 512, 512, 256]
    - [40, 2.65]
  - - [512, 128, 1, 512, 512, 512, 512, 512]
    - [35, 4.47]
  - - [512, 128, 1, 1024, 512, 512, 512, 1024]
    - [65, 6.86]
  - - [512, 128, 1, 2048, 512, 512, 512, 2048]
    - [65, 9.29]
  - - [512, 128, 1, 4096, 512, 512, 512, 4096]
    - [65, 11.25]
  - - [512, 128, 1, 8192, 512, 512, 512, 8192]
    - [65, 12.69]
  - - [512, 256, 1, 128, 512, 512, 512, 128]
    - [37, 2.85]
  - - [512, 256, 1, 256, 512, 512, 512, 256]
    - [35, 5.16]
  - - [512, 256, 1, 512, 512, 512, 512, 512]
    - [40, 8.91]
  - - [512, 256, 1, 1024, 512, 512, 512, 1024]
    - [35, 13.31]
  - - [512, 256, 1, 2048, 512, 512, 512, 2048]
    - [65, 18.64]
  - - [512, 256, 1, 4096, 512, 512, 512, 4096]
    - [65, 22.75]
  - - [512, 256, 1, 8192, 512, 512, 512, 8192]
    - [65, 25.68]
  - - [512, 512, 1, 128, 512, 512, 512, 128]
    - [45, 5.84]
  - - [512, 512, 1, 256, 512, 512, 512, 256]
    - [61, 10.34]
  - - [512, 512, 1, 512, 512, 512, 512, 512]
    - [65, 17.29]
  - - [512, 512, 1, 1024, 512, 512, 512, 1024]
    - [65, 27.19]
  - - [512, 512, 1, 2048, 512, 512, 512, 2048]
    - [65, 37.26]
  - - [512, 512, 1, 4096, 512, 512, 512, 4096]
    - [65, 44.92]
  - - [512, 512, 1, 8192, 512, 512, 512, 8192]
    - [65, 51.44]
  - - [512, 1024, 1, 128, 512, 512, 512, 128]
    - [48, 10.64]
  - - [512, 1024, 1, 256, 512, 512, 512, 256]
    - [61, 19.64]
  - - [512, 1024, 1, 512, 512, 512, 512, 512]
    - [65, 33.64]
  - - [512, 1024, 1, 1024, 512, 512, 512, 1024]
    - [65, 52.73]
  - - [512, 1024, 1, 2048, 512, 512, 512, 2048]
    - [62, 71.66]
  - - [512, 1024, 1, 4096, 512, 512, 512, 4096]
    - [65, 89.07]
  - - [512, 1024, 1, 8192, 512, 512, 512, 8192]
    - [65, 101.86]
  - - [512, 2048, 1, 128, 512, 512, 512, 128]
    - [4, 19.36]
  - - [512, 2048, 1, 256, 512, 512, 512, 256]
    - [64, 35.47]
  - - [512, 2048, 1, 512, 512, 512, 512, 512]
    - [40, 61.21]
  - - [512, 2048, 1, 1024, 512, 512, 512, 1024]
    - [62, 98.56]
  - - [512, 2048, 1, 2048, 512, 512, 512, 2048]
    - [65, 137.55]
  - - [512, 2048, 1, 4096, 512, 512, 512, 4096]
    - [65, 172.1]
  - - [512, 2048, 1, 8192, 512, 512, 512, 8192]
    - [65, 191.21]
  - - [512, 4096, 1, 128, 512, 512, 512, 128]
    - [30, 31.49]
  - - [512, 4096, 1, 256, 512, 512, 512, 256]
    - [22, 57.46]
  - - [512, 4096, 1, 512, 512, 512, 512, 512]
    - [22, 99.3]
  - - [512, 4096, 1, 1024, 512, 512, 512, 1024]
    - [25, 155.71]
  - - [512, 4096, 1, 2048, 512, 512, 512, 2048]
    - [28, 215.88]
  - - [512, 4096, 1, 4096, 512, 512, 512, 4096]
    - [29, 270.12]
  - - [512, 4096, 1, 8192, 512, 512, 512, 8192]
    - [26, 311.34]
  - - [512, 8192, 1, 128, 512, 512, 512, 128]
    - [3, 40.94]
  - - [512, 8192, 1, 256, 512, 512, 512, 256]
    - [19, 73.9]
  - - [512, 8192, 1, 512, 512, 512, 512, 512]
    - [21, 134.53]
  - - [512, 8192, 1, 1024, 512, 512, 512, 1024]
    - [21, 213.44]
  - - [512, 8192, 1, 2048, 512, 512, 512, 2048]
    - [20, 307.15]
  - - [512, 8192, 1, 4096, 512, 512, 512, 4096]
    - [20, 396.08]
  - - [512, 8192, 1, 8192, 512, 512, 512, 8192]
    - [21, 451.87]
  - - [1024, 128, 1, 128, 1024, 1024, 1024, 128]
    - [33, 2.75]
  - - [1024, 128, 1, 256, 1024, 1024, 1024, 256]
    - [45, 5.16]
  - - [1024, 128, 1, 512, 1024, 1024, 1024, 512]
    - [45, 8.75]
  - - [1024, 128, 1, 1024, 1024, 1024, 1024, 1024]
    - [40, 13.35]
  - - [1024, 128, 1, 2048, 1024, 1024, 1024, 2048]
    - [65, 17.82]
  - - [1024, 128, 1, 4096, 1024, 1024, 1024, 4096]
    - [42, 21.56]
  - - [1024, 128, 1, 8192, 1024, 1024, 1024, 8192]
    - [65, 24.23]
  - - [1024, 256, 1, 128, 1024, 1024, 1024, 128]
    - [46, 5.46]
  - - [1024, 256, 1, 256, 1024, 1024, 1024, 256]
    - [35, 10.17]
  - - [1024, 256, 1, 512, 1024, 1024, 1024, 512]
    - [40, 17.33]
  - - [1024, 256, 1, 1024, 1024, 1024, 1024, 1024]
    - [40, 26.37]
  - - [1024, 256, 1, 2048, 1024, 1024, 1024, 2048]
    - [65, 35.51]
  - - [1024, 256, 1, 4096, 1024, 1024, 1024, 4096]
    - [42, 42.9]
  - - [1024, 256, 1, 8192, 1024, 1024, 1024, 8192]
    - [65, 48.75]
  - - [1024, 512, 1, 128, 1024, 1024, 1024, 128]
    - [45, 11.12]
  - - [1024, 512, 1, 256, 1024, 1024, 1024, 256]
    - [35, 19.88]
  - - [1024, 512, 1, 512, 1024, 1024, 1024, 512]
    - [45, 33.55]
  - - [1024, 512, 1, 1024, 1024, 1024, 1024, 1024]
    - [40, 51.46]
  - - [1024, 512, 1, 2048, 1024, 1024, 1024, 2048]
    - [40, 70.48]
  - - [1024, 512, 1, 4096, 1024, 1024, 1024, 4096]
    - [37, 85.65]
  - - [1024, 512, 1, 8192, 1024, 1024, 1024, 8192]
    - [42, 97.45]
  - - [1024, 1024, 1, 128, 1024, 1024, 1024, 128]
    - [35, 20.0]
  - - [1024, 1024, 1, 256, 1024, 1024, 1024, 256]
    - [35, 35.86]
  - - [1024, 1024, 1, 512, 1024, 1024, 1024, 512]
    - [40, 61.77]
  - - [1024, 1024, 1, 1024, 1024, 1024, 1024, 1024]
    - [65, 98.47]
  - - [1024, 1024, 1, 2048, 1024, 1024, 1024, 2048]
    - [65, 133.75]
  - - [1024, 1024, 1, 4096, 1024, 1024, 1024, 4096]
    - [42, 166.16]
  - - [1024, 1024, 1, 8192, 1024, 1024, 1024, 8192]
    - [42, 189.49]
  - - [1024, 2048, 1, 128, 1024, 1024, 1024, 128]
    - [31, 31.4]
  - - [1024, 2048, 1, 256, 1024, 1024, 1024, 256]
    - [27, 57.4]
  - - [1024, 2048, 1, 512, 1024, 1024, 1024, 512]
    - [27, 99.67]
  - - [1024, 2048, 1, 1024, 1024, 1024, 1024, 1024]
    - [23, 156.04]
  - - [1024, 2048, 1, 2048, 1024, 1024, 1024, 2048]
    - [29, 218.16]
  - - [1024, 2048, 1, 4096, 1024, 1024, 1024, 4096]
    - [29, 276.22]
  - - [1024, 2048, 1, 8192, 1024, 1024, 1024, 8192]
    - [29, 312.99]
  - - [1024, 4096, 1, 128, 1024, 1024, 1024, 128]
    - [19, 40.92]
  - - [1024, 4096, 1, 256, 1024, 1024, 1024, 256]
    - [57, 73.13]
  - - [1024, 4096, 1, 512, 1024, 1024, 1024, 512]
    - [21, 129.14]
  - - [1024, 4096, 1, 1024, 1024, 1024, 1024, 1024]
    - [21, 209.98]
  - - [1024, 4096, 1, 2048, 1024, 1024, 1024, 2048]
    - [21, 309.93]
  - - [1024, 4096, 1, 4096, 1024, 1024, 1024, 4096]
    - [21, 390.29]
  - - [1024, 4096, 1, 8192, 1024, 1024, 1024, 8192]
    - [21, 461.8]
  - - [1024, 8192, 1, 128, 1024, 1024, 1024, 128]
    - [15, 54.64]
  - - [1024, 8192, 1, 256, 1024, 1024, 1024, 256]
    - [14, 98.88]
  - - [1024, 8192, 1, 512, 1024, 1024, 1024, 512]
    - [16, 171.76]
  - - [1024, 8192, 1, 1024, 1024, 1024, 1024, 1024]
    - [56, 274.08]
  - - [1024, 8192, 1, 2048, 1024, 1024, 1024, 2048]
    - [56, 409.09]
  - - [1024, 8192, 1, 4096, 1024, 1024, 1024, 4096]
    - [54, 513.83]
  - - [1024, 8192, 1, 8192, 1024, 1024, 1024, 8192]
    - [52, 566.44]
  - - [2048, 128, 1, 128, 2048, 2048, 2048, 128]
    - [47, 5.54]
  - - [2048, 128, 1, 256, 2048, 2048, 2048, 256]
    - [35, 10.27]
  - - [2048, 128, 1, 512, 2048, 2048, 2048, 512]
    - [40, 16.98]
  - - [2048, 128, 1, 1024, 2048, 2048, 2048, 1024]
    - [45, 25.91]
  - - [2048, 128, 1, 2048, 2048, 2048, 2048, 2048]
    - [42, 35.1]
  - - [2048, 128, 1, 4096, 2048, 2048, 2048, 4096]
    - [40, 43.07]
  - - [2048, 128, 1, 8192, 2048, 2048, 2048, 8192]
    - [42, 49.16]
  - - [2048, 256, 1, 128, 2048, 2048, 2048, 128]
    - [40, 11.17]
  - - [2048, 256, 1, 256, 2048, 2048, 2048, 256]
    - [45, 19.35]
  - - [2048, 256, 1, 512, 2048, 2048, 2048, 512]
    - [35, 33.38]
  - - [2048, 256, 1, 1024, 2048, 2048, 2048, 1024]
    - [40, 51.01]
  - - [2048, 256, 1, 2048, 2048, 2048, 2048, 2048]
    - [40, 69.59]
  - - [2048, 256, 1, 4096, 2048, 2048, 2048, 4096]
    - [35, 85.56]
  - - [2048, 256, 1, 8192, 2048, 2048, 2048, 8192]
    - [37, 97.22]
  - - [2048, 512, 1, 128, 2048, 2048, 2048, 128]
    - [39, 19.62]
  - - [2048, 512, 1, 256, 2048, 2048, 2048, 256]
    - [45, 35.28]
  - - [2048, 512, 1, 512, 2048, 2048, 2048, 512]
    - [41, 60.79]
  - - [2048, 512, 1, 1024, 2048, 2048, 2048, 1024]
    - [65, 97.37]
  - - [2048, 512, 1, 2048, 2048, 2048, 2048, 2048]
    - [65, 132.68]
  - - [2048, 512, 1, 4096, 2048, 2048, 2048, 4096]
    - [40, 165.75]
  - - [2048, 512, 1, 8192, 2048, 2048, 2048, 8192]
    - [42, 187.38]
  - - [2048, 1024, 1, 128, 2048, 2048, 2048, 128]
    - [26, 31.62]
  - - [2048, 1024, 1, 256, 2048, 2048, 2048, 256]
    - [23, 57.05]
  - - [2048, 1024, 1, 512, 2048, 2048, 2048, 512]
    - [23, 99.98]
  - - [2048, 1024, 1, 1024, 2048, 2048, 2048, 1024]
    - [26, 156.73]
  - - [2048, 1024, 1, 2048, 2048, 2048, 2048, 2048]
    - [28, 219.56]
  - - [2048, 1024, 1, 4096, 2048, 2048, 2048, 4096]
    - [28, 274.29]
  - - [2048, 1024, 1, 8192, 2048, 2048, 2048, 8192]
    - [28, 313.24]
  - - [2048, 2048, 1, 128, 2048, 2048, 2048, 128]
    - [17, 40.65]
  - - [2048, 2048, 1, 256, 2048, 2048, 2048, 256]
    - [3, 73.36]
  - - [2048, 2048, 1, 512, 2048, 2048, 2048, 512]
    - [21, 128.02]
  - - [2048, 2048, 1, 1024, 2048, 2048, 2048, 1024]
    - [21, 211.62]
  - - [2048, 2048, 1, 2048, 2048, 2048, 2048, 2048]
    - [21, 306.48]
  - - [2048, 2048, 1, 4096, 2048, 2048, 2048, 4096]
    - [21, 392.47]
  - - [2048, 2048, 1, 8192, 2048, 2048, 2048, 8192]
    - [21, 458.91]
  - - [2048, 4096, 1, 128, 2048, 2048, 2048, 128]
    - [2, 52.87]
  - - [2048, 4096, 1, 256, 2048, 2048, 2048, 256]
    - [1, 95.24]
  - - [2048, 4096, 1, 512, 2048, 2048, 2048, 512]
    - [13, 164.65]
  - - [2048, 4096, 1, 1024, 2048, 2048, 2048, 1024]
    - [56, 268.83]
  - - [2048, 4096, 1, 2048, 2048, 2048, 2048, 2048]
    - [53, 399.3]
  - - [2048, 4096, 1, 4096, 2048, 2048, 2048, 4096]
    - [55, 502.81]
  - - [2048, 4096, 1, 8192, 2048, 2048, 2048, 8192]
    - [51, 565.27]
  - - [2048, 8192, 1, 128, 2048, 2048, 2048, 128]
    - [7, 59.01]
  - - [2048, 8192, 1, 256, 2048, 2048, 2048, 256]
    - [9, 111.89]
  - - [2048, 8192, 1, 512, 2048, 2048, 2048, 512]
    - [11, 201.95]
  - - [2048, 8192, 1, 1024, 2048, 2048, 2048, 1024]
    - [5, 337.73]
  - - [2048, 8192, 1, 2048, 2048, 2048, 2048, 2048]
    - [7, 506.28]
  - - [2048, 8192, 1, 4096, 2048, 2048, 2048, 4096]
    - [12, 658.36]
  - - [2048, 8192, 1, 8192, 2048, 2048, 2048, 8192]
    - [49, 741.0]
  - - [4096, 128, 1, 128, 4096, 4096, 4096, 128]
    - [43, 10.74]
  - - [4096, 128, 1, 256, 4096, 4096, 4096, 256]
    - [35, 19.61]
  - - [4096, 128, 1, 512, 4096, 4096, 4096, 512]
    - [40, 32.76]
  - - [4096, 128, 1, 1024, 4096, 4096, 4096, 1024]
    - [35, 50.09]
  - - [4096, 128, 1, 2048, 4096, 4096, 4096, 2048]
    - [35, 69.12]
  - - [4096, 128, 1, 4096, 4096, 4096, 4096, 4096]
    - [40, 85.52]
  - - [4096, 128, 1, 8192, 4096, 4096, 4096, 8192]
    - [42, 93.46]
  - - [4096, 256, 1, 128, 4096, 4096, 4096, 128]
    - [45, 19.82]
  - - [4096, 256, 1, 256, 4096, 4096, 4096, 256]
    - [40, 35.46]
  - - [4096, 256, 1, 512, 4096, 4096, 4096, 512]
    - [35, 60.69]
  - - [4096, 256, 1, 1024, 4096, 4096, 4096, 1024]
    - [65, 95.97]
  - - [4096, 256, 1, 2048, 4096, 4096, 4096, 2048]
    - [65, 132.52]
  - - [4096, 256, 1, 4096, 4096, 4096, 4096, 4096]
    - [40, 164.11]
  - - [4096, 256, 1, 8192, 4096, 4096, 4096, 8192]
    - [35, 181.77]
  - - [4096, 512, 1, 128, 4096, 4096, 4096, 128]
    - [22, 31.52]
  - - [4096, 512, 1, 256, 4096, 4096, 4096, 256]
    - [27, 56.94]
  - - [4096, 512, 1, 512, 4096, 4096, 4096, 512]
    - [22, 99.34]
  - - [4096, 512, 1, 1024, 4096, 4096, 4096, 1024]
    - [28, 156.41]
  - - [4096, 512, 1, 2048, 4096, 4096, 4096, 2048]
    - [26, 216.18]
  - - [4096, 512, 1, 4096, 4096, 4096, 4096, 4096]
    - [29, 269.21]
  - - [4096, 512, 1, 8192, 4096, 4096, 4096, 8192]
    - [28, 307.25]
  - - [4096, 1024, 1, 128, 4096, 4096, 4096, 128]
    - [58, 40.98]
  - - [4096, 1024, 1, 256, 4096, 4096, 4096, 256]
    - [18, 73.91]
  - - [4096, 1024, 1, 512, 4096, 4096, 4096, 512]
    - [20, 130.24]
  - - [4096, 1024, 1, 1024, 4096, 4096, 4096, 1024]
    - [20, 210.1]
  - - [4096, 1024, 1, 2048, 4096, 4096, 4096, 2048]
    - [21, 307.58]
  - - [4096, 1024, 1, 4096, 4096, 4096, 4096, 4096]
    - [21, 390.81]
  - - [4096, 1024, 1, 8192, 4096, 4096, 4096, 8192]
    - [20, 440.73]
  - - [4096, 2048, 1, 128, 4096, 4096, 4096, 128]
    - [50, 52.76]
  - - [4096, 2048, 1, 256, 4096, 4096, 4096, 256]
    - [13, 96.83]
  - - [4096, 2048, 1, 512, 4096, 4096, 4096, 512]
    - [13, 167.37]
  - - [4096, 2048, 1, 1024, 4096, 4096, 4096, 1024]
    - [13, 266.32]
  - - [4096, 2048, 1, 2048, 4096, 4096, 4096, 2048]
    - [52, 403.91]
  - - [4096, 2048, 1, 4096, 4096, 4096, 4096, 4096]
    - [54, 503.65]
  - - [4096, 2048, 1, 8192, 4096, 4096, 4096, 8192]
    - [54, 552.57]
  - - [4096, 4096, 1, 128, 4096, 4096, 4096, 128]
    - [10, 60.14]
  - - [4096, 4096, 1, 256, 4096, 4096, 4096, 256]
    - [8, 113.13]
  - - [4096, 4096, 1, 512, 4096, 4096, 4096, 512]
    - [8, 204.16]
  - - [4096, 4096, 1, 1024, 4096, 4096, 4096, 1024]
    - [8, 343.02]
  - - [4096, 4096, 1, 2048, 4096, 4096, 4096, 2048]
    - [10, 511.88]
  - - [4096, 4096, 1, 4096, 4096, 4096, 4096, 4096]
    - [12, 660.48]
  - - [4096, 4096, 1, 8192, 4096, 4096, 4096, 8192]
    - [12, 749.1]
  - - [4096, 8192, 1, 128, 4096, 4096, 4096, 128]
    - [0, 65.68]
  - - [4096, 8192, 1, 256, 4096, 4096, 4096, 256]
    - [7, 121.89]
  - - [4096, 8192, 1, 512, 4096, 4096, 4096, 512]
    - [7, 219.49]
  - - [4096, 8192, 1, 1024, 4096, 4096, 4096, 1024]
    - [8, 359.35]
  - - [4096, 8192, 1, 2048, 4096, 4096, 4096, 2048]
    - [10, 512.47]
  - - [4096, 8192, 1, 4096, 4096, 4096, 4096, 4096]
    - [49, 662.56]
  - - [4096, 8192, 1, 8192, 4096, 4096, 4096, 8192]
    - [12, 791.05]
  - - [8192, 128, 1, 128, 8192, 8192, 8192, 128]
    - [34, 19.18]
  - - [8192, 128, 1, 256, 8192, 8192, 8192, 256]
    - [40, 35.36]
  - - [8192, 128, 1, 512, 8192, 8192, 8192, 512]
    - [40, 61.33]
  - - [8192, 128, 1, 1024, 8192, 8192, 8192, 1024]
    - [35, 94.96]
  - - [8192, 128, 1, 2048, 8192, 8192, 8192, 2048]
    - [41, 130.26]
  - - [8192, 128, 1, 4096, 8192, 8192, 8192, 4096]
    - [42, 157.66]
  - - [8192, 128, 1, 8192, 8192, 8192, 8192, 8192]
    - [42, 180.22]
  - - [8192, 256, 1, 128, 8192, 8192, 8192, 128]
    - [30, 31.38]
  - - [8192, 256, 1, 256, 8192, 8192, 8192, 256]
    - [26, 57.08]
  - - [8192, 256, 1, 512, 8192, 8192, 8192, 512]
    - [26, 98.66]
  - - [8192, 256, 1, 1024, 8192, 8192, 8192, 1024]
    - [26, 152.71]
  - - [8192, 256, 1, 2048, 8192, 8192, 8192, 2048]
    - [24, 212.13]
  - - [8192, 256, 1, 4096, 8192, 8192, 8192, 4096]
    - [28, 270.13]
  - - [8192, 256, 1, 8192, 8192, 8192, 8192, 8192]
    - [29, 311.95]
  - - [8192, 512, 1, 128, 8192, 8192, 8192, 128]
    - [59, 39.97]
  - - [8192, 512, 1, 256, 8192, 8192, 8192, 256]
    - [59, 72.86]
  - - [8192, 512, 1, 512, 8192, 8192, 8192, 512]
    - [60, 132.59]
  - - [8192, 512, 1, 1024, 8192, 8192, 8192, 1024]
    - [20, 209.8]
  - - [8192, 512, 1, 2048, 8192, 8192, 8192, 2048]
    - [20, 309.5]
  - - [8192, 512, 1, 4096, 8192, 8192, 8192, 4096]
    - [21, 393.38]
  - - [8192, 512, 1, 8192, 8192, 8192, 8192, 8192]
    - [21, 452.71]
  - - [8192, 1024, 1, 128, 8192, 8192, 8192, 128]
    - [15, 53.6]
  - - [8192, 1024, 1, 256, 8192, 8192, 8192, 256]
    - [16, 96.92]
  - - [8192, 1024, 1, 512, 8192, 8192, 8192, 512]
    - [15, 168.32]
  - - [8192, 1024, 1, 1024, 8192, 8192, 8192, 1024]
    - [56, 276.33]
  - - [8192, 1024, 1, 2048, 8192, 8192, 8192, 2048]
    - [54, 396.84]
  - - [8192, 1024, 1, 4096, 8192, 8192, 8192, 4096]
    - [54, 496.66]
  - - [8192, 1024, 1, 8192, 8192, 8192, 8192, 8192]
    - [53, 558.76]
  - - [8192, 2048, 1, 128, 8192, 8192, 8192, 128]
    - [8, 59.37]
  - - [8192, 2048, 1, 256, 8192, 8192, 8192, 256]
    - [6, 112.45]
  - - [8192, 2048, 1, 512, 8192, 8192, 8192, 512]
    - [7, 202.9]
  - - [8192, 2048, 1, 1024, 8192, 8192, 8192, 1024]
    - [9, 341.61]
  - - [8192, 2048, 1, 2048, 8192, 8192, 8192, 2048]
    - [7, 508.2]
  - - [8192, 2048, 1, 4096, 8192, 8192, 8192, 4096]
    - [7, 655.48]
  - - [8192, 2048, 1, 8192, 8192, 8192, 8192, 8192]
    - [7, 737.77]
  - - [8192, 4096, 1, 128, 8192, 8192, 8192, 128]
    - [7, 65.36]
  - - [8192, 4096, 1, 256, 8192, 8192, 8192, 256]
    - [9, 122.71]
  - - [8192, 4096, 1, 512, 8192, 8192, 8192, 512]
    - [7, 223.72]
  - - [8192, 4096, 1, 1024, 8192, 8192, 8192, 1024]
    - [11, 364.95]
  - - [8192, 4096, 1, 2048, 8192, 8192, 8192, 2048]
    - [49, 515.75]
  - - [8192, 4096, 1, 4096, 8192, 8192, 8192, 4096]
    - [11, 658.89]
  - - [8192, 4096, 1, 8192, 8192, 8192, 8192, 8192]
    - [12, 798.91]
  - - [8192, 8192, 1, 128, 8192, 8192, 8192, 128]
    - [7, 71.48]
  - - [8192, 8192, 1, 256, 8192, 8192, 8192, 256]
    - [9, 136.87]
  - - [8192, 8192, 1, 512, 8192, 8192, 8192, 512]
    - [7, 242.03]
  - - [8192, 8192, 1, 1024, 8192, 8192, 8192, 1024]
    - [7, 378.89]
  - - [8192, 8192, 1, 2048, 8192, 8192, 8192, 2048]
    - [11, 543.08]
  - - [8192, 8192, 1, 4096, 8192, 8192, 8192, 4096]
    - [49, 730.33]
  - - [8192, 8192, 1, 8192, 8192, 8192, 8192, 8192]
    - [49, 881.21]
- null
- null
- DeviceEfficiency
- GridBased
