projects/hipblaslt/library/src/amd_detail/rocblaslt/src/Tensile/Logic/asm_full/gfx950/GridBased/gfx950_Cijk_Alik_Bljk_B8B8S_BH_Bias_HAS_SAB_SAV_UserArgs.yaml
- {MinimumRequiredVersion: 4.33.0}
- gfx950
- gfx950
- [Device 75a0]
    SolutionIndex: 0
    SolutionNameMin: Cijk_Alik_Bljk_F8F8S_BH_Bias_HAS_SAB_SAV_UserArgs_MT256x256x128_MI16x16x1_SN_GSU0_GSUC0_GSUWGMRR0_K1_LBSPPA1024_LBSPPB1024_MIWT8_8_SU0_SUM0_SUS0_VWA8_VWB8_WGM8_WGMXCC1_WGMXCCGn1
    SolutionIndex: 1
    SolutionNameMin: Cijk_Alik_Bljk_F8F8S_BH_Bias_HAS_SAB_SAV_UserArgs_MT256x256x128_MI16x16x1_SN_GSU0_GSUC0_GSUWGMRR0_K1_LBSPPA1024_LBSPPB1024_MIWT8_8_SU0_SUM0_SUS0_VWA8_VWB8_WGM8_WGMXCC1_WGMXCCGn1
    SolutionIndex: 2
    SolutionNameMin: Cijk_Alik_Bljk_F8F8S_BH_Bias_HAS_SAB_SAV_UserArgs_MT256x256x128_MI16x16x1_SN_GSU0_GSUC0_GSUWGMRR0_K1_LBSPPA1024_LBSPPB1024_MIWT8_8_SU0_SUM0_SUS0_VWA8_VWB8_WGM8_WGMXCC1_WGMXCCGn1
    SolutionIndex: 3
    SolutionNameMin: Cijk_Alik_Bljk_F8F8S_BH_Bias_HAS_SAB_SAV_UserArgs_MT256x256x128_MI16x16x1_SN_GSU0_GSUC0_GSUWGMRR0_K1_LBSPPA1024_LBSPPB1024_MIWT8_8_SU0_SUM0_SUS0_VWA8_VWB8_WGM8_WGMXCC1_WGMXCCGn1
    SolutionIndex: 4
    SolutionNameMin: Cijk_Alik_Bljk_F8F8S_BH_Bias_HAS_SAB_SAV_UserArgs_MT256x256x128_MI16x16x1_SN_GSU0_GSUC0_GSUWGMRR0_K1_LBSPPA1024_LBSPPB1024_MIWT8_8_SU0_SUM0_SUS0_VWA8_VWB8_WGM8_WGMXCC1_WGMXCCGn1
    SolutionIndex: 5
    SolutionNameMin: Cijk_Alik_Bljk_F8F8S_BH_Bias_HAS_SAB_SAV_UserArgs_MT256x256x128_MI16x16x1_SN_GSU0_GSUC0_GSUWGMRR0_K1_LBSPPA1024_LBSPPB1024_MIWT8_8_SU0_SUM0_SUS0_VWA8_VWB8_WGM8_WGMXCC1_WGMXCCGn1
    SolutionIndex: 6
    SolutionNameMin: Cijk_Alik_Bljk_F8F8S_BH_Bias_HAS_SAB_SAV_UserArgs_MT128x256x128_MI16x16x1_SN_GSU0_GSUC0_GSUWGMRR0_K1_LBSPPA512_LBSPPB1024_MIWT4_8_SU0_SUM0_SUS0_VWA4_VWB8_WGM8_WGMXCC1_WGMXCCGn1
    SolutionIndex: 7
    SolutionNameMin: Cijk_Alik_Bljk_F8F8S_BH_Bias_HAS_SAB_SAV_UserArgs_MT256x128x128_MI16x16x1_SN_GSU0_GSUC0_GSUWGMRR0_K1_LBSPPA1024_LBSPPB512_MIWT8_4_SU0_SUM0_SUS0_VWA8_VWB4_WGM8_WGMXCC1_WGMXCCGn1
    SolutionIndex: 8
    SolutionNameMin: Cijk_Alik_Bljk_F8F8S_BH_Bias_HAS_SAB_SAV_UserArgs_MT256x128x128_MI16x16x1_SN_GSU0_GSUC0_GSUWGMRR0_K1_LBSPPA1024_LBSPPB512_MIWT8_4_SU0_SUM0_SUS0_VWA8_VWB4_WGM8_WGMXCC1_WGMXCCGn1
    SolutionIndex: 9
    SolutionNameMin: Cijk_Alik_Bljk_F8F8S_BH_Bias_HAS_SAB_SAV_UserArgs_MT256x128x128_MI16x16x1_SN_GSU0_GSUC0_GSUWGMRR0_K1_LBSPPA1024_LBSPPB512_MIWT8_4_SU0_SUM0_SUS0_VWA8_VWB4_WGM8_WGMXCC1_WGMXCCGn1
    SolutionIndex: 10
    SolutionNameMin: Cijk_Alik_Bljk_F8F8S_BH_Bias_HAS_SAB_SAV_UserArgs_MT256x64x128_MI16x16x1_SN_GSU0_GSUC0_GSUWGMRR0_K1_LBSPPA1024_LBSPPB256_MIWT8_2_SU0_SUM0_SUS0_VWA8_VWB2_WGM8_WGMXCC1_WGMXCCGn1
    SolutionIndex: 11
    SolutionNameMin: Cijk_Alik_Bljk_F8F8S_BH_Bias_HAS_SAB_SAV_UserArgs_MT256x64x128_MI16x16x1_SN_GSU0_GSUC0_GSUWGMRR0_K1_LBSPPA1024_LBSPPB256_MIWT8_2_SU0_SUM0_SUS0_VWA8_VWB2_WGM8_WGMXCC1_WGMXCCGn1
    SolutionIndex: 12
    SolutionNameMin: Cijk_Alik_Bljk_F8F8S_BH_Bias_HAS_SAB_SAV_UserArgs_MT128x128x128_MI16x16x1_SN_GSU0_GSUC0_GSUWGMRR0_K1_LBSPPA512_LBSPPB512_MIWT4_4_SU0_SUM0_SUS0_VWA4_VWB4_WGM8_WGMXCC1_WGMXCCGn1
    SolutionIndex: 13
    SolutionNameMin: Cijk_Alik_Bljk_F8F8S_BH_Bias_HAS_SAB_SAV_UserArgs_MT128x128x128_MI16x16x1_SN_GSU0_GSUC0_GSUWGMRR0_K1_LBSPPA512_LBSPPB512_MIWT4_4_SU0_SUM0_SUS0_VWA4_VWB4_WGM8_WGMXCC1_WGMXCCGn1
    SolutionIndex: 14
    SolutionNameMin: Cijk_Alik_Bljk_F8F8S_BH_Bias_HAS_SAB_SAV_UserArgs_MT128x128x128_MI16x16x1_SN_GSU0_GSUC0_GSUWGMRR0_K1_LBSPPA512_LBSPPB512_MIWT4_4_SU0_SUM0_SUS0_VWA4_VWB4_WGM8_WGMXCC1_WGMXCCGn1
    SolutionIndex: 15
    SolutionNameMin: Cijk_Alik_Bljk_F8F8S_BH_Bias_HAS_SAB_SAV_UserArgs_MT128x128x128_MI16x16x1_SN_GSU0_GSUC0_GSUWGMRR0_K1_LBSPPA512_LBSPPB512_MIWT4_4_SU0_SUM0_SUS0_VWA4_VWB4_WGM8_WGMXCC1_WGMXCCGn1
    SolutionIndex: 16
    SolutionNameMin: Cijk_Alik_Bljk_F8F8S_BH_Bias_HAS_SAB_SAV_UserArgs_MT128x128x128_MI16x16x1_SN_GSU0_GSUC0_GSUWGMRR0_K1_LBSPPA512_LBSPPB512_MIWT4_4_SU0_SUM0_SUS0_VWA4_VWB4_WGM8_WGMXCC1_WGMXCCGn1
    SolutionIndex: 17
    SolutionNameMin: Cijk_Alik_Bljk_F8F8S_BH_Bias_HAS_SAB_SAV_UserArgs_MT128x128x128_MI16x16x1_SN_GSU0_GSUC0_GSUWGMRR0_K1_LBSPPA512_LBSPPB512_MIWT4_4_SU0_SUM0_SUS0_VWA4_VWB4_WGM8_WGMXCC1_WGMXCCGn1
    SolutionIndex: 18
    SolutionNameMin: Cijk_Alik_Bljk_F8F8S_BH_Bias_HAS_SAB_SAV_UserArgs_MT64x128x128_MI16x16x1_SN_GSU0_GSUC0_GSUWGMRR0_K1_LBSPPA256_LBSPPB512_MIWT2_4_SU0_SUM0_SUS0_VWA2_VWB4_WGM8_WGMXCC1_WGMXCCGn1
    SolutionIndex: 19
    SolutionNameMin: Cijk_Alik_Bljk_F8F8S_BH_Bias_HAS_SAB_SAV_UserArgs_MT64x128x128_MI16x16x1_SN_GSU0_GSUC0_GSUWGMRR0_K1_LBSPPA256_LBSPPB512_MIWT2_4_SU0_SUM0_SUS0_VWA2_VWB4_WGM8_WGMXCC1_WGMXCCGn1
    SolutionIndex: 20
    SolutionNameMin: Cijk_Alik_Bljk_F8F8S_BH_Bias_HAS_SAB_SAV_UserArgs_MT128x64x128_MI16x16x1_SN_GSU0_GSUC0_GSUWGMRR0_K1_LBSPPA512_LBSPPB256_MIWT4_2_SU0_SUM0_SUS0_VWA4_VWB2_WGM8_WGMXCC1_WGMXCCGn1
    SolutionIndex: 21
    SolutionNameMin: Cijk_Alik_Bljk_F8F8S_BH_Bias_HAS_SAB_SAV_UserArgs_MT64x64x128_MI16x16x1_SN_GSU0_GSUC0_GSUWGMRR0_K1_LBSPPA256_LBSPPB256_MIWT2_2_SU0_SUM0_SUS0_VWA2_VWB2_WGM8_WGMXCC1_WGMXCCGn1
    SolutionIndex: 22
    SolutionNameMin: Cijk_Alik_Bljk_F8F8S_BH_Bias_HAS_SAB_SAV_UserArgs_MT64x64x128_MI16x16x1_SN_GSU0_GSUC0_GSUWGMRR0_K1_LBSPPA256_LBSPPB256_MIWT2_2_SU0_SUM0_SUS0_VWA2_VWB2_WGM8_WGMXCC1_WGMXCCGn1
    SolutionIndex: 23
    SolutionNameMin: Cijk_Alik_Bljk_F8F8S_BH_Bias_HAS_SAB_SAV_UserArgs_MT64x64x128_MI16x16x1_SN_GSU0_GSUC0_GSUWGMRR0_K1_LBSPPA256_LBSPPB256_MIWT2_2_SU0_SUM0_SUS0_VWA2_VWB2_WGM8_WGMXCC1_WGMXCCGn1
    SolutionIndex: 24
    SolutionNameMin: Cijk_Alik_Bljk_F8F8S_BH_Bias_HAS_SAB_SAV_UserArgs_MT32x64x128_MI16x16x1_SN_GSU0_GSUC0_GSUWGMRR0_K1_LBSPPA128_LBSPPB256_MIWT1_2_SU0_SUM0_SUS0_VWA1_VWB2_WGM8_WGMXCC1_WGMXCCGn1
    SolutionIndex: 25
    SolutionNameMin: Cijk_Alik_Bljk_F8F8S_BH_Bias_HAS_SAB_SAV_UserArgs_MT64x32x128_MI16x16x1_SN_GSU0_GSUC0_GSUWGMRR0_K1_LBSPPA256_LBSPPB128_MIWT2_1_SU0_SUM0_SUS0_VWA2_VWB1_WGM8_WGMXCC1_WGMXCCGn1
    SolutionIndex: 26
    SolutionNameMin: Cijk_Alik_Bljk_F8F8S_BH_Bias_HAS_SAB_SAV_UserArgs_MT64x32x128_MI16x16x1_SN_GSU0_GSUC0_GSUWGMRR0_K1_LBSPPA256_LBSPPB128_MIWT2_1_SU0_SUM0_SUS0_VWA2_VWB1_WGM8_WGMXCC1_WGMXCCGn1
    SolutionIndex: 27
    SolutionNameMin: Cijk_Alik_Bljk_F8F8S_BH_Bias_HAS_SAB_SAV_UserArgs_MT32x32x128_MI16x16x1_SN_GSU0_GSUC0_GSUWGMRR0_K1_LBSPPA128_LBSPPB128_MIWT1_1_SU0_SUM0_SUS0_VWA1_VWB1_WGM8_WGMXCC1_WGMXCCGn1
    SolutionIndex: 28
    SolutionNameMin: Cijk_Alik_Bljk_F8F8S_BH_Bias_HAS_SAB_SAV_UserArgs_MT32x32x128_MI16x16x1_SN_GSU0_GSUC0_GSUWGMRR0_K1_LBSPPA128_LBSPPB128_MIWT1_1_SU0_SUM0_SUS0_VWA1_VWB1_WGM8_WGMXCC1_WGMXCCGn1
    SolutionIndex: 29
    SolutionNameMin: Cijk_Alik_Bljk_F8F8S_BH_Bias_HAS_SAB_SAV_UserArgs_MT32x32x128_MI16x16x1_SN_GSU0_GSUC0_GSUWGMRR0_K1_LBSPPA128_LBSPPB128_MIWT1_1_SU0_SUM0_SUS0_VWA1_VWB1_WGM8_WGMXCC1_WGMXCCGn1
    SolutionIndex: 30
    SolutionNameMin: Cijk_Alik_Bljk_F8F8S_BH_Bias_HAS_SAB_SAV_UserArgs_MT32x32x128_MI16x16x1_SN_GSU0_GSUC0_GSUWGMRR0_K1_LBSPPA128_LBSPPB128_MIWT1_1_SU0_SUM0_SUS0_VWA1_VWB1_WGM8_WGMXCC1_WGMXCCGn1
    SolutionIndex: 31
    SolutionNameMin: Cijk_Alik_Bljk_F8F8S_BH_Bias_HAS_SAB_SAV_UserArgs_MT32x32x128_MI16x16x1_SN_GSU0_GSUC0_GSUWGMRR0_K1_LBSPPA128_LBSPPB128_MIWT1_1_SU0_SUM0_SUS0_VWA1_VWB1_WGM8_WGMXCC1_WGMXCCGn1
    SolutionIndex: 32
    SolutionNameMin: Cijk_Alik_Bljk_F8F8S_BH_Bias_HAS_SAB_SAV_UserArgs_MT32x32x128_MI16x16x1_SN_GSU0_GSUC0_GSUWGMRR0_K1_LBSPPA128_LBSPPB128_MIWT1_1_SU0_SUM0_SUS0_VWA1_VWB1_WGM8_WGMXCC1_WGMXCCGn1
    SolutionIndex: 33
    SolutionNameMin: Cijk_Alik_Bljk_F8F8S_BH_Bias_HAS_SAB_SAV_UserArgs_MT256x256x128_MI32x32x1_SN_GSU0_GSUC0_GSUWGMRR0_K1_LBSPPA512_LBSPPB512_MIWT4_4_SU0_SUM0_SUS0_VWA4_VWB4_WGM8_WGMXCC1_WGMXCCGn1
    SolutionIndex: 34
    SolutionNameMin: Cijk_Alik_Bljk_F8F8S_BH_Bias_HAS_SAB_SAV_UserArgs_MT256x256x128_MI32x32x1_SN_GSU0_GSUC0_GSUWGMRR0_K1_LBSPPA512_LBSPPB512_MIWT4_4_SU0_SUM0_SUS0_VWA4_VWB4_WGM8_WGMXCC1_WGMXCCGn1
    SolutionIndex: 35
    SolutionNameMin: Cijk_Alik_Bljk_F8F8S_BH_Bias_HAS_SAB_SAV_UserArgs_MT256x128x128_MI32x32x1_SN_GSU0_GSUC0_GSUWGMRR0_K1_LBSPPA512_LBSPPB256_MIWT4_2_SU0_SUM0_SUS0_VWA4_VWB2_WGM8_WGMXCC1_WGMXCCGn1
    SolutionIndex: 36
    SolutionNameMin: Cijk_Alik_Bljk_F8F8S_BH_Bias_HAS_SAB_SAV_UserArgs_MT256x128x128_MI32x32x1_SN_GSU0_GSUC0_GSUWGMRR0_K1_LBSPPA512_LBSPPB256_MIWT4_2_SU0_SUM0_SUS0_VWA4_VWB2_WGM8_WGMXCC1_WGMXCCGn1
    SolutionIndex: 37
    SolutionNameMin: Cijk_Alik_Bljk_F8F8S_BH_Bias_HAS_SAB_SAV_UserArgs_MT256x128x128_MI32x32x1_SN_GSU0_GSUC0_GSUWGMRR0_K1_LBSPPA512_LBSPPB256_MIWT4_2_SU0_SUM0_SUS0_VWA4_VWB2_WGM8_WGMXCC1_WGMXCCGn1
    SolutionIndex: 38
    SolutionNameMin: Cijk_Alik_Bljk_F8F8S_BH_Bias_HAS_SAB_SAV_UserArgs_MT128x128x256_MI16x16x1_SN_GSU0_GSUC0_GSUWGMRR0_K1_LBSPPA1024_LBSPPB1024_MIWT4_4_SU0_SUM0_SUS0_VWA4_VWB4_WGM8_WGMXCC1_WGMXCCGn1
    SolutionIndex: 39
    SolutionNameMin: Cijk_Alik_Bljk_F8F8S_BH_Bias_HAS_SAB_SAV_UserArgs_MT64x128x256_MI16x16x1_SN_GSU0_GSUC0_GSUWGMRR0_K1_LBSPPA512_LBSPPB1024_MIWT2_4_SU0_SUM0_SUS0_VWA2_VWB4_WGM8_WGMXCC1_WGMXCCGn1
    SolutionIndex: 40
    SolutionNameMin: Cijk_Alik_Bljk_F8F8S_BH_Bias_HAS_SAB_SAV_UserArgs_MT64x128x256_MI16x16x1_SN_GSU0_GSUC0_GSUWGMRR0_K1_LBSPPA512_LBSPPB1024_MIWT2_4_SU0_SUM0_SUS0_VWA2_VWB4_WGM8_WGMXCC1_WGMXCCGn1
    SolutionIndex: 41
    SolutionNameMin: Cijk_Alik_Bljk_F8F8S_BH_Bias_HAS_SAB_SAV_UserArgs_MT128x64x256_MI16x16x1_SN_GSU0_GSUC0_GSUWGMRR0_K1_LBSPPA1024_LBSPPB512_MIWT4_2_SU0_SUM0_SUS0_VWA4_VWB2_WGM8_WGMXCC1_WGMXCCGn1
    SolutionIndex: 42
    SolutionNameMin: Cijk_Alik_Bljk_F8F8S_BH_Bias_HAS_SAB_SAV_UserArgs_MT128x64x256_MI16x16x1_SN_GSU0_GSUC0_GSUWGMRR0_K1_LBSPPA1024_LBSPPB512_MIWT4_2_SU0_SUM0_SUS0_VWA4_VWB2_WGM8_WGMXCC1_WGMXCCGn1
    SolutionIndex: 43
    SolutionNameMin: Cijk_Alik_Bljk_F8F8S_BH_Bias_HAS_SAB_SAV_UserArgs_MT128x64x256_MI16x16x1_SN_GSU0_GSUC0_GSUWGMRR0_K1_LBSPPA1024_LBSPPB512_MIWT4_2_SU0_SUM0_SUS0_VWA4_VWB2_WGM8_WGMXCC1_WGMXCCGn1
    SolutionIndex: 44
    SolutionNameMin: Cijk_Alik_Bljk_F8F8S_BH_Bias_HAS_SAB_SAV_UserArgs_MT128x64x256_MI16x16x1_SN_GSU0_GSUC0_GSUWGMRR0_K1_LBSPPA1024_LBSPPB512_MIWT4_2_SU0_SUM0_SUS0_VWA4_VWB2_WGM8_WGMXCC1_WGMXCCGn1
    SolutionIndex: 45
    SolutionNameMin: Cijk_Alik_Bljk_F8F8S_BH_Bias_HAS_SAB_SAV_UserArgs_MT64x64x256_MI16x16x1_SN_GSU0_GSUC0_GSUWGMRR0_K1_LBSPPA512_LBSPPB512_MIWT2_2_SU0_SUM0_SUS0_VWA2_VWB2_WGM8_WGMXCC1_WGMXCCGn1
    SolutionIndex: 46
    SolutionNameMin: Cijk_Alik_Bljk_F8F8S_BH_Bias_HAS_SAB_SAV_UserArgs_MT64x64x256_MI16x16x1_SN_GSU0_GSUC0_GSUWGMRR0_K1_LBSPPA512_LBSPPB512_MIWT2_2_SU0_SUM0_SUS0_VWA2_VWB2_WGM8_WGMXCC1_WGMXCCGn1
    SolutionIndex: 47
    SolutionNameMin: Cijk_Alik_Bljk_F8F8S_BH_Bias_HAS_SAB_SAV_UserArgs_MT64x64x256_MI16x16x1_SN_GSU0_GSUC0_GSUWGMRR0_K1_LBSPPA512_LBSPPB512_MIWT2_2_SU0_SUM0_SUS0_VWA2_VWB2_WGM8_WGMXCC1_WGMXCCGn1
    SolutionIndex: 48
    SolutionNameMin: Cijk_Alik_Bljk_F8F8S_BH_Bias_HAS_SAB_SAV_UserArgs_MT64x64x256_MI16x16x1_SN_GSU0_GSUC0_GSUWGMRR0_K1_LBSPPA512_LBSPPB512_MIWT2_2_SU0_SUM0_SUS0_VWA2_VWB2_WGM8_WGMXCC1_WGMXCCGn1
    SolutionIndex: 49
    SolutionNameMin: Cijk_Alik_Bljk_F8F8S_BH_Bias_HAS_SAB_SAV_UserArgs_MT64x64x256_MI16x16x1_SN_GSU0_GSUC0_GSUWGMRR0_K1_LBSPPA512_LBSPPB512_MIWT2_2_SU0_SUM0_SUS0_VWA2_VWB2_WGM8_WGMXCC1_WGMXCCGn1
    SolutionIndex: 50
    SolutionNameMin: Cijk_Alik_Bljk_F8F8S_BH_Bias_HAS_SAB_SAV_UserArgs_MT64x64x256_MI16x16x1_SN_GSU0_GSUC0_GSUWGMRR0_K1_LBSPPA512_LBSPPB512_MIWT2_2_SU0_SUM0_SUS0_VWA2_VWB2_WGM8_WGMXCC1_WGMXCCGn1
    SolutionIndex: 51
    SolutionNameMin: Cijk_Alik_Bljk_F8F8S_BH_Bias_HAS_SAB_SAV_UserArgs_MT32x64x256_MI16x16x1_SN_GSU0_GSUC0_GSUWGMRR0_K1_LBSPPA256_LBSPPB512_MIWT1_2_SU0_SUM0_SUS0_VWA1_VWB2_WGM8_WGMXCC1_WGMXCCGn1
    SolutionIndex: 52
    SolutionNameMin: Cijk_Alik_Bljk_F8F8S_BH_Bias_HAS_SAB_SAV_UserArgs_MT32x64x256_MI16x16x1_SN_GSU0_GSUC0_GSUWGMRR0_K1_LBSPPA256_LBSPPB512_MIWT1_2_SU0_SUM0_SUS0_VWA1_VWB2_WGM8_WGMXCC1_WGMXCCGn1
    SolutionIndex: 53
    SolutionNameMin: Cijk_Alik_Bljk_F8F8S_BH_Bias_HAS_SAB_SAV_UserArgs_MT64x32x256_MI16x16x1_SN_GSU0_GSUC0_GSUWGMRR0_K1_LBSPPA512_LBSPPB256_MIWT2_1_SU0_SUM0_SUS0_VWA2_VWB1_WGM8_WGMXCC1_WGMXCCGn1
    SolutionIndex: 54
    SolutionNameMin: Cijk_Alik_Bljk_F8F8S_BH_Bias_HAS_SAB_SAV_UserArgs_MT64x32x256_MI16x16x1_SN_GSU0_GSUC0_GSUWGMRR0_K1_LBSPPA512_LBSPPB256_MIWT2_1_SU0_SUM0_SUS0_VWA2_VWB1_WGM8_WGMXCC1_WGMXCCGn1
    SolutionIndex: 55
    SolutionNameMin: Cijk_Alik_Bljk_F8F8S_BH_Bias_HAS_SAB_SAV_UserArgs_MT32x32x256_MI16x16x1_SN_GSU0_GSUC0_GSUWGMRR0_K1_LBSPPA256_LBSPPB256_MIWT1_1_SU0_SUM0_SUS0_VWA1_VWB1_WGM8_WGMXCC1_WGMXCCGn1
    SolutionIndex: 56
    SolutionNameMin: Cijk_Alik_Bljk_F8F8S_BH_Bias_HAS_SAB_SAV_UserArgs_MT32x32x256_MI16x16x1_SN_GSU0_GSUC0_GSUWGMRR0_K1_LBSPPA256_LBSPPB256_MIWT1_1_SU0_SUM0_SUS0_VWA1_VWB1_WGM8_WGMXCC1_WGMXCCGn1
    SolutionIndex: 57
    SolutionNameMin: Cijk_Alik_Bljk_F8F8S_BH_Bias_HAS_SAB_SAV_UserArgs_MT32x32x256_MI16x16x1_SN_GSU0_GSUC0_GSUWGMRR0_K1_LBSPPA256_LBSPPB256_MIWT1_1_SU0_SUM0_SUS0_VWA1_VWB1_WGM8_WGMXCC1_WGMXCCGn1
    SolutionIndex: 58
    SolutionNameMin: Cijk_Alik_Bljk_F8F8S_BH_Bias_HAS_SAB_SAV_UserArgs_MT32x32x256_MI16x16x1_SN_GSU0_GSUC0_GSUWGMRR0_K1_LBSPPA256_LBSPPB256_MIWT1_1_SU0_SUM0_SUS0_VWA1_VWB1_WGM8_WGMXCC1_WGMXCCGn1
    SolutionIndex: 59
    SolutionNameMin: Cijk_Alik_Bljk_F8F8S_BH_Bias_HAS_SAB_SAV_UserArgs_MT64x64x256_MI32x32x1_SN_GSU0_GSUC0_GSUWGMRR0_K1_LBSPPA256_LBSPPB256_MIWT1_1_SU0_SUM0_SUS0_VWA1_VWB1_WGM8_WGMXCC1_WGMXCCGn1
    SolutionIndex: 60
    SolutionNameMin: Cijk_Alik_Bljk_F8F8S_BH_Bias_HAS_SAB_SAV_UserArgs_MT32x32x128_MI16x16x1_SN_GSU0_GSUC0_GSUWGMRR0_K1_LBSPPA128_LBSPPB128_MIWT1_1_SU32_SUM0_SUS256_VWA1_VWB1_WGM8_WGMXCC1_WGMXCCGn1
- - - [128, 128, 1, 128, 128, 128, 128, 128]
    - [29, 0.47]
  - - [128, 128, 1, 256, 128, 128, 256, 256]
    - [58, 0.9]
  - - [128, 128, 1, 512, 128, 128, 512, 512]
    - [58, 1.57]
  - - [128, 128, 1, 1024, 128, 128, 1024, 1024]
    - [58, 2.69]
  - - [128, 128, 1, 2048, 128, 128, 2048, 2048]
    - [58, 4.17]
  - - [128, 128, 1, 4096, 128, 128, 4096, 4096]
    - [56, 5.81]
  - - [128, 128, 1, 8192, 128, 128, 8192, 8192]
    - [55, 7.26]
  - - [128, 256, 1, 128, 128, 128, 128, 128]
    - [32, 0.93]
  - - [128, 256, 1, 256, 128, 128, 256, 256]
    - [58, 1.76]
  - - [128, 256, 1, 512, 128, 128, 512, 512]
    - [58, 3.14]
  - - [128, 256, 1, 1024, 128, 128, 1024, 1024]
    - [58, 5.32]
  - - [128, 256, 1, 2048, 128, 128, 2048, 2048]
    - [58, 8.32]
  - - [128, 256, 1, 4096, 128, 128, 4096, 4096]
    - [55, 11.52]
  - - [128, 256, 1, 8192, 128, 128, 8192, 8192]
    - [56, 14.32]
  - - [128, 512, 1, 128, 128, 128, 128, 128]
    - [28, 1.79]
  - - [128, 512, 1, 256, 128, 128, 256, 256]
    - [58, 3.45]
  - - [128, 512, 1, 512, 128, 128, 512, 512]
    - [58, 6.04]
  - - [128, 512, 1, 1024, 128, 128, 1024, 1024]
    - [58, 10.38]
  - - [128, 512, 1, 2048, 128, 128, 2048, 2048]
    - [58, 16.24]
  - - [128, 512, 1, 4096, 128, 128, 4096, 4096]
    - [56, 22.75]
  - - [128, 512, 1, 8192, 128, 128, 8192, 8192]
    - [56, 28.53]
  - - [128, 1024, 1, 128, 128, 128, 128, 128]
    - [27, 3.54]
  - - [128, 1024, 1, 256, 128, 128, 256, 256]
    - [58, 6.81]
  - - [128, 1024, 1, 512, 128, 128, 512, 512]
    - [58, 11.77]
  - - [128, 1024, 1, 1024, 128, 128, 1024, 1024]
    - [57, 20.43]
  - - [128, 1024, 1, 2048, 128, 128, 2048, 2048]
    - [56, 31.86]
  - - [128, 1024, 1, 4096, 128, 128, 4096, 4096]
    - [56, 44.17]
  - - [128, 1024, 1, 8192, 128, 128, 8192, 8192]
    - [55, 55.29]
  - - [128, 2048, 1, 128, 128, 128, 128, 128]
    - [29, 6.77]
  - - [128, 2048, 1, 256, 128, 128, 256, 256]
    - [58, 13.18]
  - - [128, 2048, 1, 512, 128, 128, 512, 512]
    - [58, 23.62]
  - - [128, 2048, 1, 1024, 128, 128, 1024, 1024]
    - [58, 39.86]
  - - [128, 2048, 1, 2048, 128, 128, 2048, 2048]
    - [56, 60.63]
  - - [128, 2048, 1, 4096, 128, 128, 4096, 4096]
    - [56, 84.12]
  - - [128, 2048, 1, 8192, 128, 128, 8192, 8192]
    - [56, 108.37]
  - - [128, 4096, 1, 128, 128, 128, 128, 128]
    - [26, 13.33]
  - - [128, 4096, 1, 256, 128, 128, 256, 256]
    - [54, 24.85]
  - - [128, 4096, 1, 512, 128, 128, 512, 512]
    - [54, 43.03]
  - - [128, 4096, 1, 1024, 128, 128, 1024, 1024]
    - [53, 72.11]
  - - [128, 4096, 1, 2048, 128, 128, 2048, 2048]
    - [54, 112.61]
  - - [128, 4096, 1, 4096, 128, 128, 4096, 4096]
    - [54, 157.77]
  - - [128, 4096, 1, 8192, 128, 128, 8192, 8192]
    - [54, 181.95]
  - - [128, 8192, 1, 128, 128, 128, 128, 128]
    - [23, 24.81]
  - - [128, 8192, 1, 256, 128, 128, 256, 256]
    - [50, 44.58]
  - - [128, 8192, 1, 512, 128, 128, 512, 512]
    - [50, 76.78]
  - - [128, 8192, 1, 1024, 128, 128, 1024, 1024]
    - [50, 127.89]
  - - [128, 8192, 1, 2048, 128, 128, 2048, 2048]
    - [46, 178.22]
  - - [128, 8192, 1, 4096, 128, 128, 4096, 4096]
    - [49, 231.71]
  - - [128, 8192, 1, 8192, 128, 128, 8192, 8192]
    - [50, 282.01]
  - - [256, 128, 1, 128, 256, 256, 128, 128]
    - [30, 0.91]
  - - [256, 128, 1, 256, 256, 256, 256, 256]
    - [58, 1.74]
  - - [256, 128, 1, 512, 256, 256, 512, 512]
    - [58, 3.06]
  - - [256, 128, 1, 1024, 256, 256, 1024, 1024]
    - [58, 5.28]
  - - [256, 128, 1, 2048, 256, 256, 2048, 2048]
    - [58, 8.2]
  - - [256, 128, 1, 4096, 256, 256, 4096, 4096]
    - [55, 11.38]
  - - [256, 128, 1, 8192, 256, 256, 8192, 8192]
    - [55, 14.26]
  - - [256, 256, 1, 128, 256, 256, 128, 128]
    - [30, 1.81]
  - - [256, 256, 1, 256, 256, 256, 256, 256]
    - [58, 3.48]
  - - [256, 256, 1, 512, 256, 256, 512, 512]
    - [58, 6.07]
  - - [256, 256, 1, 1024, 256, 256, 1024, 1024]
    - [58, 10.35]
  - - [256, 256, 1, 2048, 256, 256, 2048, 2048]
    - [58, 16.18]
  - - [256, 256, 1, 4096, 256, 256, 4096, 4096]
    - [56, 22.46]
  - - [256, 256, 1, 8192, 256, 256, 8192, 8192]
    - [55, 28.45]
  - - [256, 512, 1, 128, 256, 256, 128, 128]
    - [32, 3.56]
  - - [256, 512, 1, 256, 256, 256, 256, 256]
    - [58, 6.84]
  - - [256, 512, 1, 512, 256, 256, 512, 512]
    - [58, 12.24]
  - - [256, 512, 1, 1024, 256, 256, 1024, 1024]
    - [58, 20.75]
  - - [256, 512, 1, 2048, 256, 256, 2048, 2048]
    - [58, 32.25]
  - - [256, 512, 1, 4096, 256, 256, 4096, 4096]
    - [56, 45.26]
  - - [256, 512, 1, 8192, 256, 256, 8192, 8192]
    - [56, 56.37]
  - - [256, 1024, 1, 128, 256, 256, 128, 128]
    - [32, 7.09]
  - - [256, 1024, 1, 256, 256, 256, 256, 256]
    - [58, 13.39]
  - - [256, 1024, 1, 512, 256, 256, 512, 512]
    - [58, 24.08]
  - - [256, 1024, 1, 1024, 256, 256, 1024, 1024]
    - [58, 40.85]
  - - [256, 1024, 1, 2048, 256, 256, 2048, 2048]
    - [58, 63.12]
  - - [256, 1024, 1, 4096, 256, 256, 4096, 4096]
    - [56, 87.72]
  - - [256, 1024, 1, 8192, 256, 256, 8192, 8192]
    - [56, 109.86]
  - - [256, 2048, 1, 128, 256, 256, 128, 128]
    - [26, 13.49]
  - - [256, 2048, 1, 256, 256, 256, 256, 256]
    - [54, 25.11]
  - - [256, 2048, 1, 512, 256, 256, 512, 512]
    - [54, 43.72]
  - - [256, 2048, 1, 1024, 256, 256, 1024, 1024]
    - [54, 74.24]
  - - [256, 2048, 1, 2048, 256, 256, 2048, 2048]
    - [53, 114.44]
  - - [256, 2048, 1, 4096, 256, 256, 4096, 4096]
    - [54, 158.98]
  - - [256, 2048, 1, 8192, 256, 256, 8192, 8192]
    - [54, 202.97]
  - - [256, 4096, 1, 128, 256, 256, 128, 128]
    - [23, 24.98]
  - - [256, 4096, 1, 256, 256, 256, 256, 256]
    - [50, 45.32]
  - - [256, 4096, 1, 512, 256, 256, 512, 512]
    - [50, 78.91]
  - - [256, 4096, 1, 1024, 256, 256, 1024, 1024]
    - [50, 131.34]
  - - [256, 4096, 1, 2048, 256, 256, 2048, 2048]
    - [45, 195.31]
  - - [256, 4096, 1, 4096, 256, 256, 4096, 4096]
    - [48, 273.28]
  - - [256, 4096, 1, 8192, 256, 256, 8192, 8192]
    - [50, 323.87]
  - - [256, 8192, 1, 128, 256, 256, 128, 128]
    - [20, 43.99]
  - - [256, 8192, 1, 256, 256, 256, 256, 256]
    - [20, 78.38]
  - - [256, 8192, 1, 512, 256, 256, 512, 512]
    - [20, 133.5]
  - - [256, 8192, 1, 1024, 256, 256, 1024, 1024]
    - [20, 205.19]
  - - [256, 8192, 1, 2048, 256, 256, 2048, 2048]
    - [20, 282.51]
  - - [256, 8192, 1, 4096, 256, 256, 4096, 4096]
    - [39, 334.88]
  - - [256, 8192, 1, 8192, 256, 256, 8192, 8192]
    - [44, 400.23]
  - - [512, 128, 1, 128, 512, 512, 128, 128]
    - [27, 1.79]
  - - [512, 128, 1, 256, 512, 512, 256, 256]
    - [58, 3.46]
  - - [512, 128, 1, 512, 512, 512, 512, 512]
    - [58, 6.23]
  - - [512, 128, 1, 1024, 512, 512, 1024, 1024]
    - [58, 10.46]
  - - [512, 128, 1, 2048, 512, 512, 2048, 2048]
    - [58, 16.39]
  - - [512, 128, 1, 4096, 512, 512, 4096, 4096]
    - [58, 22.54]
  - - [512, 128, 1, 8192, 512, 512, 8192, 8192]
    - [57, 28.15]
  - - [512, 256, 1, 128, 512, 512, 128, 128]
    - [29, 3.48]
  - - [512, 256, 1, 256, 512, 512, 256, 256]
    - [57, 6.79]
  - - [512, 256, 1, 512, 512, 512, 512, 512]
    - [58, 12.41]
  - - [512, 256, 1, 1024, 512, 512, 1024, 1024]
    - [58, 20.66]
  - - [512, 256, 1, 2048, 512, 512, 2048, 2048]
    - [57, 32.15]
  - - [512, 256, 1, 4096, 512, 512, 4096, 4096]
    - [58, 44.46]
  - - [512, 256, 1, 8192, 512, 512, 8192, 8192]
    - [55, 55.86]
  - - [512, 512, 1, 128, 512, 512, 128, 128]
    - [31, 7.1]
  - - [512, 512, 1, 256, 512, 512, 256, 256]
    - [56, 13.37]
  - - [512, 512, 1, 512, 512, 512, 512, 512]
    - [58, 24.08]
  - - [512, 512, 1, 1024, 512, 512, 1024, 1024]
    - [58, 40.91]
  - - [512, 512, 1, 2048, 512, 512, 2048, 2048]
    - [58, 64.29]
  - - [512, 512, 1, 4096, 512, 512, 4096, 4096]
    - [57, 88.13]
  - - [512, 512, 1, 8192, 512, 512, 8192, 8192]
    - [56, 111.28]
  - - [512, 1024, 1, 128, 512, 512, 128, 128]
    - [25, 13.48]
  - - [512, 1024, 1, 256, 512, 512, 256, 256]
    - [54, 25.28]
  - - [512, 1024, 1, 512, 512, 512, 512, 512]
    - [53, 43.81]
  - - [512, 1024, 1, 1024, 512, 512, 1024, 1024]
    - [54, 75.6]
  - - [512, 1024, 1, 2048, 512, 512, 2048, 2048]
    - [54, 117.21]
  - - [512, 1024, 1, 4096, 512, 512, 4096, 4096]
    - [54, 162.68]
  - - [512, 1024, 1, 8192, 512, 512, 8192, 8192]
    - [54, 205.7]
  - - [512, 2048, 1, 128, 512, 512, 128, 128]
    - [23, 25.12]
  - - [512, 2048, 1, 256, 512, 512, 256, 256]
    - [50, 45.86]
  - - [512, 2048, 1, 512, 512, 512, 512, 512]
    - [59, 78.31]
  - - [512, 2048, 1, 1024, 512, 512, 1024, 1024]
    - [50, 134.81]
  - - [512, 2048, 1, 2048, 512, 512, 2048, 2048]
    - [45, 197.86]
  - - [512, 2048, 1, 4096, 512, 512, 4096, 4096]
    - [50, 267.43]
  - - [512, 2048, 1, 8192, 512, 512, 8192, 8192]
    - [59, 335.42]
  - - [512, 4096, 1, 128, 512, 512, 128, 128]
    - [20, 44.22]
  - - [512, 4096, 1, 256, 512, 512, 256, 256]
    - [20, 78.52]
  - - [512, 4096, 1, 512, 512, 512, 512, 512]
    - [19, 135.58]
  - - [512, 4096, 1, 1024, 512, 512, 1024, 1024]
    - [42, 209.08]
  - - [512, 4096, 1, 2048, 512, 512, 2048, 2048]
    - [39, 289.03]
  - - [512, 4096, 1, 4096, 512, 512, 4096, 4096]
    - [43, 371.5]
  - - [512, 4096, 1, 8192, 512, 512, 8192, 8192]
    - [44, 440.93]
  - - [512, 8192, 1, 128, 512, 512, 128, 128]
    - [17, 72.11]
  - - [512, 8192, 1, 256, 512, 512, 256, 256]
    - [17, 129.48]
  - - [512, 8192, 1, 512, 512, 512, 512, 512]
    - [11, 213.94]
  - - [512, 8192, 1, 1024, 512, 512, 1024, 1024]
    - [11, 321.57]
  - - [512, 8192, 1, 2048, 512, 512, 2048, 2048]
    - [10, 421.26]
  - - [512, 8192, 1, 4096, 512, 512, 4096, 4096]
    - [17, 511.27]
  - - [512, 8192, 1, 8192, 512, 512, 8192, 8192]
    - [16, 611.33]
  - - [1024, 128, 1, 128, 1024, 1024, 128, 128]
    - [30, 3.56]
  - - [1024, 128, 1, 256, 1024, 1024, 256, 256]
    - [58, 6.81]
  - - [1024, 128, 1, 512, 1024, 1024, 512, 512]
    - [58, 12.16]
  - - [1024, 128, 1, 1024, 1024, 1024, 1024, 1024]
    - [58, 20.67]
  - - [1024, 128, 1, 2048, 1024, 1024, 2048, 2048]
    - [58, 32.19]
  - - [1024, 128, 1, 4096, 1024, 1024, 4096, 4096]
    - [55, 43.93]
  - - [1024, 128, 1, 8192, 1024, 1024, 8192, 8192]
    - [55, 55.36]
  - - [1024, 256, 1, 128, 1024, 1024, 128, 128]
    - [29, 7.05]
  - - [1024, 256, 1, 256, 1024, 1024, 256, 256]
    - [58, 13.41]
  - - [1024, 256, 1, 512, 1024, 1024, 512, 512]
    - [58, 23.9]
  - - [1024, 256, 1, 1024, 1024, 1024, 1024, 1024]
    - [58, 40.65]
  - - [1024, 256, 1, 2048, 1024, 1024, 2048, 2048]
    - [58, 62.98]
  - - [1024, 256, 1, 4096, 1024, 1024, 4096, 4096]
    - [58, 87.55]
  - - [1024, 256, 1, 8192, 1024, 1024, 8192, 8192]
    - [58, 109.81]
  - - [1024, 512, 1, 128, 1024, 1024, 128, 128]
    - [26, 13.66]
  - - [1024, 512, 1, 256, 1024, 1024, 256, 256]
    - [54, 25.33]
  - - [1024, 512, 1, 512, 1024, 1024, 512, 512]
    - [54, 44.28]
  - - [1024, 512, 1, 1024, 1024, 1024, 1024, 1024]
    - [54, 76.66]
  - - [1024, 512, 1, 2048, 1024, 1024, 2048, 2048]
    - [54, 118.72]
  - - [1024, 512, 1, 4096, 1024, 1024, 4096, 4096]
    - [54, 164.48]
  - - [1024, 512, 1, 8192, 1024, 1024, 8192, 8192]
    - [54, 207.74]
  - - [1024, 1024, 1, 128, 1024, 1024, 128, 128]
    - [23, 25.36]
  - - [1024, 1024, 1, 256, 1024, 1024, 256, 256]
    - [50, 45.88]
  - - [1024, 1024, 1, 512, 1024, 1024, 512, 512]
    - [50, 80.29]
  - - [1024, 1024, 1, 1024, 1024, 1024, 1024, 1024]
    - [50, 137.1]
  - - [1024, 1024, 1, 2048, 1024, 1024, 2048, 2048]
    - [45, 199.37]
  - - [1024, 1024, 1, 4096, 1024, 1024, 4096, 4096]
    - [50, 271.28]
  - - [1024, 1024, 1, 8192, 1024, 1024, 8192, 8192]
    - [50, 336.6]
  - - [1024, 2048, 1, 128, 1024, 1024, 128, 128]
    - [20, 44.49]
  - - [1024, 2048, 1, 256, 1024, 1024, 256, 256]
    - [44, 79.03]
  - - [1024, 2048, 1, 512, 1024, 1024, 512, 512]
    - [20, 138.19]
  - - [1024, 2048, 1, 1024, 1024, 1024, 1024, 1024]
    - [41, 213.04]
  - - [1024, 2048, 1, 2048, 1024, 1024, 2048, 2048]
    - [39, 288.98]
  - - [1024, 2048, 1, 4096, 1024, 1024, 4096, 4096]
    - [20, 373.56]
  - - [1024, 2048, 1, 8192, 1024, 1024, 8192, 8192]
    - [44, 438.05]
  - - [1024, 4096, 1, 128, 1024, 1024, 128, 128]
    - [17, 72.19]
  - - [1024, 4096, 1, 256, 1024, 1024, 256, 256]
    - [17, 129.23]
  - - [1024, 4096, 1, 512, 1024, 1024, 512, 512]
    - [12, 212.92]
  - - [1024, 4096, 1, 1024, 1024, 1024, 1024, 1024]
    - [11, 324.76]
  - - [1024, 4096, 1, 2048, 1024, 1024, 2048, 2048]
    - [13, 432.21]
  - - [1024, 4096, 1, 4096, 1024, 1024, 4096, 4096]
    - [17, 531.78]
  - - [1024, 4096, 1, 8192, 1024, 1024, 8192, 8192]
    - [38, 618.93]
  - - [1024, 8192, 1, 128, 1024, 1024, 128, 128]
    - [9, 107.07]
  - - [1024, 8192, 1, 256, 1024, 1024, 256, 256]
    - [9, 188.31]
  - - [1024, 8192, 1, 512, 1024, 1024, 512, 512]
    - [8, 301.42]
  - - [1024, 8192, 1, 1024, 1024, 1024, 1024, 1024]
    - [8, 429.18]
  - - [1024, 8192, 1, 2048, 1024, 1024, 2048, 2048]
    - [7, 545.48]
  - - [1024, 8192, 1, 4096, 1024, 1024, 4096, 4096]
    - [37, 670.47]
  - - [1024, 8192, 1, 8192, 1024, 1024, 8192, 8192]
    - [37, 799.48]
  - - [2048, 128, 1, 128, 2048, 2048, 128, 128]
    - [30, 6.95]
  - - [2048, 128, 1, 256, 2048, 2048, 256, 256]
    - [58, 13.44]
  - - [2048, 128, 1, 512, 2048, 2048, 512, 512]
    - [58, 23.6]
  - - [2048, 128, 1, 1024, 2048, 2048, 1024, 1024]
    - [58, 40.09]
  - - [2048, 128, 1, 2048, 2048, 2048, 2048, 2048]
    - [57, 61.74]
  - - [2048, 128, 1, 4096, 2048, 2048, 4096, 4096]
    - [58, 85.15]
  - - [2048, 128, 1, 8192, 2048, 2048, 8192, 8192]
    - [57, 109.71]
  - - [2048, 256, 1, 128, 2048, 2048, 128, 128]
    - [24, 13.62]
  - - [2048, 256, 1, 256, 2048, 2048, 256, 256]
    - [54, 24.87]
  - - [2048, 256, 1, 512, 2048, 2048, 512, 512]
    - [52, 43.73]
  - - [2048, 256, 1, 1024, 2048, 2048, 1024, 1024]
    - [54, 74.2]
  - - [2048, 256, 1, 2048, 2048, 2048, 2048, 2048]
    - [54, 115.23]
  - - [2048, 256, 1, 4096, 2048, 2048, 4096, 4096]
    - [52, 160.02]
  - - [2048, 256, 1, 8192, 2048, 2048, 8192, 8192]
    - [52, 203.19]
  - - [2048, 512, 1, 128, 2048, 2048, 128, 128]
    - [23, 25.18]
  - - [2048, 512, 1, 256, 2048, 2048, 256, 256]
    - [50, 45.5]
  - - [2048, 512, 1, 512, 2048, 2048, 512, 512]
    - [50, 79.61]
  - - [2048, 512, 1, 1024, 2048, 2048, 1024, 1024]
    - [50, 134.55]
  - - [2048, 512, 1, 2048, 2048, 2048, 2048, 2048]
    - [50, 201.69]
  - - [2048, 512, 1, 4096, 2048, 2048, 4096, 4096]
    - [50, 274.95]
  - - [2048, 512, 1, 8192, 2048, 2048, 8192, 8192]
    - [50, 339.24]
  - - [2048, 1024, 1, 128, 2048, 2048, 128, 128]
    - [20, 44.58]
  - - [2048, 1024, 1, 256, 2048, 2048, 256, 256]
    - [44, 79.3]
  - - [2048, 1024, 1, 512, 2048, 2048, 512, 512]
    - [20, 139.39]
  - - [2048, 1024, 1, 1024, 2048, 2048, 1024, 1024]
    - [42, 212.8]
  - - [2048, 1024, 1, 2048, 2048, 2048, 2048, 2048]
    - [43, 292.15]
  - - [2048, 1024, 1, 4096, 2048, 2048, 4096, 4096]
    - [42, 378.36]
  - - [2048, 1024, 1, 8192, 2048, 2048, 8192, 8192]
    - [44, 444.46]
  - - [2048, 2048, 1, 128, 2048, 2048, 128, 128]
    - [17, 73.47]
  - - [2048, 2048, 1, 256, 2048, 2048, 256, 256]
    - [17, 129.58]
  - - [2048, 2048, 1, 512, 2048, 2048, 512, 512]
    - [15, 215.37]
  - - [2048, 2048, 1, 1024, 2048, 2048, 1024, 1024]
    - [11, 323.56]
  - - [2048, 2048, 1, 2048, 2048, 2048, 2048, 2048]
    - [13, 433.1]
  - - [2048, 2048, 1, 4096, 2048, 2048, 4096, 4096]
    - [14, 540.7]
  - - [2048, 2048, 1, 8192, 2048, 2048, 8192, 8192]
    - [17, 631.19]
  - - [2048, 4096, 1, 128, 2048, 2048, 128, 128]
    - [9, 107.13]
  - - [2048, 4096, 1, 256, 2048, 2048, 256, 256]
    - [9, 187.56]
  - - [2048, 4096, 1, 512, 2048, 2048, 512, 512]
    - [8, 303.55]
  - - [2048, 4096, 1, 1024, 2048, 2048, 1024, 1024]
    - [8, 434.93]
  - - [2048, 4096, 1, 2048, 2048, 2048, 2048, 2048]
    - [7, 568.38]
  - - [2048, 4096, 1, 4096, 2048, 2048, 4096, 4096]
    - [9, 693.8]
  - - [2048, 4096, 1, 8192, 2048, 2048, 8192, 8192]
    - [37, 822.56]
  - - [2048, 8192, 1, 128, 2048, 2048, 128, 128]
    - [5, 129.78]
  - - [2048, 8192, 1, 256, 2048, 2048, 256, 256]
    - [5, 227.8]
  - - [2048, 8192, 1, 512, 2048, 2048, 512, 512]
    - [2, 357.82]
  - - [2048, 8192, 1, 1024, 2048, 2048, 1024, 1024]
    - [2, 525.28]
  - - [2048, 8192, 1, 2048, 2048, 2048, 2048, 2048]
    - [4, 719.5]
  - - [2048, 8192, 1, 4096, 2048, 2048, 4096, 4096]
    - [5, 864.56]
  - - [2048, 8192, 1, 8192, 2048, 2048, 8192, 8192]
    - [34, 912.25]
  - - [4096, 128, 1, 128, 4096, 4096, 128, 128]
    - [26, 13.6]
  - - [4096, 128, 1, 256, 4096, 4096, 256, 256]
    - [52, 24.97]
  - - [4096, 128, 1, 512, 4096, 4096, 512, 512]
    - [54, 43.4]
  - - [4096, 128, 1, 1024, 4096, 4096, 1024, 1024]
    - [52, 73.58]
  - - [4096, 128, 1, 2048, 4096, 4096, 2048, 2048]
    - [51, 113.21]
  - - [4096, 128, 1, 4096, 4096, 4096, 4096, 4096]
    - [52, 159.76]
  - - [4096, 128, 1, 8192, 4096, 4096, 8192, 8192]
    - [51, 183.93]
  - - [4096, 256, 1, 128, 4096, 4096, 128, 128]
    - [22, 25.16]
  - - [4096, 256, 1, 256, 4096, 4096, 256, 256]
    - [50, 45.77]
  - - [4096, 256, 1, 512, 4096, 4096, 512, 512]
    - [50, 79.12]
  - - [4096, 256, 1, 1024, 4096, 4096, 1024, 1024]
    - [50, 132.71]
  - - [4096, 256, 1, 2048, 4096, 4096, 2048, 2048]
    - [50, 194.42]
  - - [4096, 256, 1, 4096, 4096, 4096, 4096, 4096]
    - [50, 270.92]
  - - [4096, 256, 1, 8192, 4096, 4096, 8192, 8192]
    - [50, 327.34]
  - - [4096, 512, 1, 128, 4096, 4096, 128, 128]
    - [20, 44.04]
  - - [4096, 512, 1, 256, 4096, 4096, 256, 256]
    - [44, 78.3]
  - - [4096, 512, 1, 512, 4096, 4096, 512, 512]
    - [20, 135.21]
  - - [4096, 512, 1, 1024, 4096, 4096, 1024, 1024]
    - [42, 207.67]
  - - [4096, 512, 1, 2048, 4096, 4096, 2048, 2048]
    - [19, 289.6]
  - - [4096, 512, 1, 4096, 4096, 4096, 4096, 4096]
    - [42, 367.94]
  - - [4096, 512, 1, 8192, 4096, 4096, 8192, 8192]
    - [40, 429.29]
  - - [4096, 1024, 1, 128, 4096, 4096, 128, 128]
    - [17, 71.98]
  - - [4096, 1024, 1, 256, 4096, 4096, 256, 256]
    - [17, 127.97]
  - - [4096, 1024, 1, 512, 4096, 4096, 512, 512]
    - [17, 219.47]
  - - [4096, 1024, 1, 1024, 4096, 4096, 1024, 1024]
    - [11, 327.53]
  - - [4096, 1024, 1, 2048, 4096, 4096, 2048, 2048]
    - [10, 426.32]
  - - [4096, 1024, 1, 4096, 4096, 4096, 4096, 4096]
    - [11, 522.22]
  - - [4096, 1024, 1, 8192, 4096, 4096, 8192, 8192]
    - [16, 613.95]
  - - [4096, 2048, 1, 128, 4096, 4096, 128, 128]
    - [9, 108.5]
  - - [4096, 2048, 1, 256, 4096, 4096, 256, 256]
    - [9, 187.91]
  - - [4096, 2048, 1, 512, 4096, 4096, 512, 512]
    - [8, 300.18]
  - - [4096, 2048, 1, 1024, 4096, 4096, 1024, 1024]
    - [7, 437.09]
  - - [4096, 2048, 1, 2048, 4096, 4096, 2048, 2048]
    - [9, 587.82]
  - - [4096, 2048, 1, 4096, 4096, 4096, 4096, 4096]
    - [35, 664.45]
  - - [4096, 2048, 1, 8192, 4096, 4096, 8192, 8192]
    - [37, 788.58]
  - - [4096, 4096, 1, 128, 4096, 4096, 128, 128]
    - [4, 129.45]
  - - [4096, 4096, 1, 256, 4096, 4096, 256, 256]
    - [5, 227.04]
  - - [4096, 4096, 1, 512, 4096, 4096, 512, 512]
    - [2, 353.37]
  - - [4096, 4096, 1, 1024, 4096, 4096, 1024, 1024]
    - [2, 521.03]
  - - [4096, 4096, 1, 2048, 4096, 4096, 2048, 2048]
    - [4, 682.51]
  - - [4096, 4096, 1, 4096, 4096, 4096, 4096, 4096]
    - [33, 873.45]
  - - [4096, 4096, 1, 8192, 4096, 4096, 8192, 8192]
    - [34, 949.76]
  - - [4096, 8192, 1, 128, 4096, 4096, 128, 128]
    - [1, 148.85]
  - - [4096, 8192, 1, 256, 4096, 4096, 256, 256]
    - [5, 264.37]
  - - [4096, 8192, 1, 512, 4096, 4096, 512, 512]
    - [2, 397.57]
  - - [4096, 8192, 1, 1024, 4096, 4096, 1024, 1024]
    - [4, 570.8]
  - - [4096, 8192, 1, 2048, 4096, 4096, 2048, 2048]
    - [34, 788.98]
  - - [4096, 8192, 1, 4096, 4096, 4096, 4096, 4096]
    - [34, 892.55]
  - - [4096, 8192, 1, 8192, 4096, 4096, 8192, 8192]
    - [34, 927.49]
  - - [8192, 128, 1, 128, 8192, 8192, 128, 128]
    - [21, 25.03]
  - - [8192, 128, 1, 256, 8192, 8192, 256, 256]
    - [50, 45.29]
  - - [8192, 128, 1, 512, 8192, 8192, 512, 512]
    - [50, 76.46]
  - - [8192, 128, 1, 1024, 8192, 8192, 1024, 1024]
    - [50, 130.18]
  - - [8192, 128, 1, 2048, 8192, 8192, 2048, 2048]
    - [47, 179.88]
  - - [8192, 128, 1, 4096, 8192, 8192, 4096, 4096]
    - [50, 235.2]
  - - [8192, 128, 1, 8192, 8192, 8192, 8192, 8192]
    - [50, 280.51]
  - - [8192, 256, 1, 128, 8192, 8192, 128, 128]
    - [19, 44.21]
  - - [8192, 256, 1, 256, 8192, 8192, 256, 256]
    - [18, 77.84]
  - - [8192, 256, 1, 512, 8192, 8192, 512, 512]
    - [19, 133.36]
  - - [8192, 256, 1, 1024, 8192, 8192, 1024, 1024]
    - [20, 202.06]
  - - [8192, 256, 1, 2048, 8192, 8192, 2048, 2048]
    - [19, 284.1]
  - - [8192, 256, 1, 4096, 8192, 8192, 4096, 4096]
    - [42, 340.51]
  - - [8192, 256, 1, 8192, 8192, 8192, 8192, 8192]
    - [44, 410.31]
  - - [8192, 512, 1, 128, 8192, 8192, 128, 128]
    - [17, 71.82]
  - - [8192, 512, 1, 256, 8192, 8192, 256, 256]
    - [17, 128.52]
  - - [8192, 512, 1, 512, 8192, 8192, 512, 512]
    - [15, 214.73]
  - - [8192, 512, 1, 1024, 8192, 8192, 1024, 1024]
    - [10, 315.36]
  - - [8192, 512, 1, 2048, 8192, 8192, 2048, 2048]
    - [14, 429.9]
  - - [8192, 512, 1, 4096, 8192, 8192, 4096, 4096]
    - [17, 512.5]
  - - [8192, 512, 1, 8192, 8192, 8192, 8192, 8192]
    - [17, 605.43]
  - - [8192, 1024, 1, 128, 8192, 8192, 128, 128]
    - [9, 107.96]
  - - [8192, 1024, 1, 256, 8192, 8192, 256, 256]
    - [9, 186.89]
  - - [8192, 1024, 1, 512, 8192, 8192, 512, 512]
    - [8, 297.65]
  - - [8192, 1024, 1, 1024, 8192, 8192, 1024, 1024]
    - [6, 417.98]
  - - [8192, 1024, 1, 2048, 8192, 8192, 2048, 2048]
    - [6, 547.36]
  - - [8192, 1024, 1, 4096, 8192, 8192, 4096, 4096]
    - [9, 668.75]
  - - [8192, 1024, 1, 8192, 8192, 8192, 8192, 8192]
    - [36, 758.54]
  - - [8192, 2048, 1, 128, 8192, 8192, 128, 128]
    - [5, 129.85]
  - - [8192, 2048, 1, 256, 8192, 8192, 256, 256]
    - [5, 226.5]
  - - [8192, 2048, 1, 512, 8192, 8192, 512, 512]
    - [2, 351.37]
  - - [8192, 2048, 1, 1024, 8192, 8192, 1024, 1024]
    - [0, 523.6]
  - - [8192, 2048, 1, 2048, 8192, 8192, 2048, 2048]
    - [4, 706.44]
  - - [8192, 2048, 1, 4096, 8192, 8192, 4096, 4096]
    - [33, 879.75]
  - - [8192, 2048, 1, 8192, 8192, 8192, 8192, 8192]
    - [34, 910.71]
  - - [8192, 4096, 1, 128, 8192, 8192, 128, 128]
    - [34, 150.82]
  - - [8192, 4096, 1, 256, 8192, 8192, 256, 256]
    - [5, 261.87]
  - - [8192, 4096, 1, 512, 8192, 8192, 512, 512]
    - [2, 393.27]
  - - [8192, 4096, 1, 1024, 8192, 8192, 1024, 1024]
    - [4, 588.32]
  - - [8192, 4096, 1, 2048, 8192, 8192, 2048, 2048]
    - [5, 752.11]
  - - [8192, 4096, 1, 4096, 8192, 8192, 4096, 4096]
    - [33, 848.01]
  - - [8192, 4096, 1, 8192, 8192, 8192, 8192, 8192]
    - [34, 927.67]
  - - [8192, 8192, 1, 128, 8192, 8192, 128, 128]
    - [5, 162.71]
  - - [8192, 8192, 1, 256, 8192, 8192, 256, 256]
    - [5, 277.63]
  - - [8192, 8192, 1, 512, 8192, 8192, 512, 512]
    - [3, 410.3]
  - - [8192, 8192, 1, 1024, 8192, 8192, 1024, 1024]
    - [34, 594.08]
  - - [8192, 8192, 1, 2048, 8192, 8192, 2048, 2048]
    - [33, 731.26]
  - - [8192, 8192, 1, 4096, 8192, 8192, 4096, 4096]
    - [34, 825.65]
  - - [8192, 8192, 1, 8192, 8192, 8192, 8192, 8192]
    - [34, 990.27]
  - - [1, 1, 1, 32, 1, 1, 32, 32]
    - [60, 0.0]
- null
- null
- DeviceEfficiency
- GridBased
