projects/hipblaslt/library/src/amd_detail/rocblaslt/src/Tensile/Logic/asm_full/gfx950/GridBased/gfx950_Cijk_Ailk_Bljk_B8SS_BH_Bias_HAS_SAB_SAV_UserArgs.yaml
- {MinimumRequiredVersion: 4.33.0}
- gfx950
- gfx950
- [Device 75a0]
    SolutionIndex: 0
    SolutionNameMin: Cijk_Ailk_Bljk_F8SS_BH_Bias_HAS_SAB_SAV_UserArgs_MT256x256x64_MI32x32x1_SN_GSU0_GSUC0_GSUWGMRR0_K1_LBSPPA0_LBSPPB256_LPA0_MIWT4_4_SU0_SUM0_SUS0_VWA4_VWB4_WGM8_WGMXCC1_WGMXCCGn1
    SolutionIndex: 1
    SolutionNameMin: Cijk_Ailk_Bljk_F8SS_BH_Bias_HAS_SAB_SAV_UserArgs_MT256x256x64_MI32x32x1_SN_GSU0_GSUC0_GSUWGMRR0_K1_LBSPPA0_LBSPPB256_LPA0_MIWT4_4_SU0_SUM0_SUS0_VWA4_VWB4_WGM8_WGMXCC1_WGMXCCGn1
    SolutionIndex: 2
    SolutionNameMin: Cijk_Ailk_Bljk_F8SS_BH_Bias_HAS_SAB_SAV_UserArgs_MT256x256x64_MI32x32x1_SN_GSU0_GSUC0_GSUWGMRR0_K1_LBSPPA0_LBSPPB256_LPA0_MIWT4_4_SU0_SUM0_SUS0_VWA4_VWB4_WGM8_WGMXCC1_WGMXCCGn1
    SolutionIndex: 3
    SolutionNameMin: Cijk_Ailk_Bljk_F8SS_BH_Bias_HAS_SAB_SAV_UserArgs_MT256x256x64_MI32x32x1_SN_GSU0_GSUC0_GSUWGMRR0_K1_LBSPPA0_LBSPPB256_LPA0_MIWT4_4_SU0_SUM0_SUS0_VWA4_VWB4_WGM8_WGMXCC1_WGMXCCGn1
    SolutionIndex: 4
    SolutionNameMin: Cijk_Ailk_Bljk_F8SS_BH_Bias_HAS_SAB_SAV_UserArgs_MT256x256x64_MI32x32x1_SN_GSU0_GSUC0_GSUWGMRR0_K1_LBSPPA0_LBSPPB256_LPA0_MIWT4_4_SU0_SUM0_SUS0_VWA4_VWB4_WGM8_WGMXCC1_WGMXCCGn1
    SolutionIndex: 5
    SolutionNameMin: Cijk_Ailk_Bljk_F8SS_BH_Bias_HAS_SAB_SAV_UserArgs_MT128x256x64_MI32x32x1_SN_GSU0_GSUC0_GSUWGMRR0_K1_LBSPPA0_LBSPPB256_LPA0_MIWT2_4_SU0_SUM0_SUS0_VWA2_VWB4_WGM8_WGMXCC1_WGMXCCGn1
    SolutionIndex: 6
    SolutionNameMin: Cijk_Ailk_Bljk_F8SS_BH_Bias_HAS_SAB_SAV_UserArgs_MT256x128x64_MI32x32x1_SN_GSU0_GSUC0_GSUWGMRR0_K1_LBSPPA0_LBSPPB128_LPA0_MIWT4_2_SU0_SUM0_SUS0_VWA4_VWB2_WGM8_WGMXCC1_WGMXCCGn1
    SolutionIndex: 7
    SolutionNameMin: Cijk_Ailk_Bljk_F8SS_BH_Bias_HAS_SAB_SAV_UserArgs_MT256x128x64_MI32x32x1_SN_GSU0_GSUC0_GSUWGMRR0_K1_LBSPPA0_LBSPPB128_LPA0_MIWT4_2_SU0_SUM0_SUS0_VWA4_VWB2_WGM8_WGMXCC1_WGMXCCGn1
    SolutionIndex: 8
    SolutionNameMin: Cijk_Ailk_Bljk_F8SS_BH_Bias_HAS_SAB_SAV_UserArgs_MT256x128x64_MI32x32x1_SN_GSU0_GSUC0_GSUWGMRR0_K1_LBSPPA0_LBSPPB128_LPA0_MIWT4_2_SU0_SUM0_SUS0_VWA4_VWB2_WGM8_WGMXCC1_WGMXCCGn1
    SolutionIndex: 9
    SolutionNameMin: Cijk_Ailk_Bljk_F8SS_BH_Bias_HAS_SAB_SAV_UserArgs_MT256x128x64_MI32x32x1_SN_GSU0_GSUC0_GSUWGMRR0_K1_LBSPPA0_LBSPPB128_LPA0_MIWT4_2_SU0_SUM0_SUS0_VWA4_VWB2_WGM8_WGMXCC1_WGMXCCGn1
    SolutionIndex: 10
    SolutionNameMin: Cijk_Ailk_Bljk_F8SS_BH_Bias_HAS_SAB_SAV_UserArgs_MT256x128x64_MI32x32x1_SN_GSU0_GSUC0_GSUWGMRR0_K1_LBSPPA0_LBSPPB128_LPA0_MIWT4_2_SU0_SUM0_SUS0_VWA4_VWB2_WGM8_WGMXCC1_WGMXCCGn1
    SolutionIndex: 11
    SolutionNameMin: Cijk_Ailk_Bljk_F8SS_BH_Bias_HAS_SAB_SAV_UserArgs_MT128x128x64_MI32x32x1_SN_GSU0_GSUC0_GSUWGMRR0_K1_LBSPPA0_LBSPPB128_LPA0_MIWT2_2_SU0_SUM0_SUS0_VWA2_VWB2_WGM8_WGMXCC1_WGMXCCGn1
    SolutionIndex: 12
    SolutionNameMin: Cijk_Ailk_Bljk_F8SS_BH_Bias_HAS_SAB_SAV_UserArgs_MT128x256x128_MI16x16x1_SN_GSU0_GSUC0_GSUWGMRR0_K1_LBSPPA2048_LBSPPB1024_LPA64_MIWT4_8_SU0_SUM0_SUS0_VWA4_VWB8_WGM8_WGMXCC1_WGMXCCGn1
    SolutionIndex: 13
    SolutionNameMin: Cijk_Ailk_Bljk_F8SS_BH_Bias_HAS_SAB_SAV_UserArgs_MT128x256x128_MI16x16x1_SN_GSU0_GSUC0_GSUWGMRR0_K1_LBSPPA2048_LBSPPB1024_LPA64_MIWT4_8_SU0_SUM0_SUS0_VWA4_VWB8_WGM8_WGMXCC1_WGMXCCGn1
    SolutionIndex: 14
    SolutionNameMin: Cijk_Ailk_Bljk_F8SS_BH_Bias_HAS_SAB_SAV_UserArgs_MT128x128x128_MI16x16x1_SN_GSU0_GSUC0_GSUWGMRR0_K1_LBSPPA2048_LBSPPB512_LPA64_MIWT4_4_SU0_SUM0_SUS0_VWA4_VWB4_WGM8_WGMXCC1_WGMXCCGn1
    SolutionIndex: 15
    SolutionNameMin: Cijk_Ailk_Bljk_F8SS_BH_Bias_HAS_SAB_SAV_UserArgs_MT128x128x128_MI16x16x1_SN_GSU0_GSUC0_GSUWGMRR0_K1_LBSPPA2048_LBSPPB512_LPA64_MIWT4_4_SU0_SUM0_SUS0_VWA4_VWB4_WGM8_WGMXCC1_WGMXCCGn1
    SolutionIndex: 16
    SolutionNameMin: Cijk_Ailk_Bljk_F8SS_BH_Bias_HAS_SAB_SAV_UserArgs_MT64x128x128_MI16x16x1_SN_GSU0_GSUC0_GSUWGMRR0_K1_LBSPPA1024_LBSPPB512_LPA32_MIWT2_4_SU0_SUM0_SUS0_VWA2_VWB4_WGM8_WGMXCC1_WGMXCCGn1
    SolutionIndex: 17
    SolutionNameMin: Cijk_Ailk_Bljk_F8SS_BH_Bias_HAS_SAB_SAV_UserArgs_MT64x128x128_MI16x16x1_SN_GSU0_GSUC0_GSUWGMRR0_K1_LBSPPA1024_LBSPPB512_LPA32_MIWT2_4_SU0_SUM0_SUS0_VWA2_VWB4_WGM8_WGMXCC1_WGMXCCGn1
    SolutionIndex: 18
    SolutionNameMin: Cijk_Ailk_Bljk_F8SS_BH_Bias_HAS_SAB_SAV_UserArgs_MT64x128x128_MI16x16x1_SN_GSU0_GSUC0_GSUWGMRR0_K1_LBSPPA1024_LBSPPB512_LPA32_MIWT2_4_SU0_SUM0_SUS0_VWA2_VWB4_WGM8_WGMXCC1_WGMXCCGn1
    SolutionIndex: 19
    SolutionNameMin: Cijk_Ailk_Bljk_F8SS_BH_Bias_HAS_SAB_SAV_UserArgs_MT128x64x128_MI16x16x1_SN_GSU0_GSUC0_GSUWGMRR0_K1_LBSPPA2048_LBSPPB256_LPA64_MIWT4_2_SU0_SUM0_SUS0_VWA4_VWB2_WGM8_WGMXCC1_WGMXCCGn1
    SolutionIndex: 20
    SolutionNameMin: Cijk_Ailk_Bljk_F8SS_BH_Bias_HAS_SAB_SAV_UserArgs_MT128x64x128_MI16x16x1_SN_GSU0_GSUC0_GSUWGMRR0_K1_LBSPPA2048_LBSPPB256_LPA64_MIWT4_2_SU0_SUM0_SUS0_VWA4_VWB2_WGM8_WGMXCC1_WGMXCCGn1
    SolutionIndex: 21
    SolutionNameMin: Cijk_Ailk_Bljk_F8SS_BH_Bias_HAS_SAB_SAV_UserArgs_MT64x64x128_MI16x16x1_SN_GSU0_GSUC0_GSUWGMRR0_K1_LBSPPA1024_LBSPPB256_LPA32_MIWT2_2_SU0_SUM0_SUS0_VWA2_VWB2_WGM8_WGMXCC1_WGMXCCGn1
    SolutionIndex: 22
    SolutionNameMin: Cijk_Ailk_Bljk_F8SS_BH_Bias_HAS_SAB_SAV_UserArgs_MT64x64x128_MI16x16x1_SN_GSU0_GSUC0_GSUWGMRR0_K1_LBSPPA1024_LBSPPB256_LPA32_MIWT2_2_SU0_SUM0_SUS0_VWA2_VWB2_WGM8_WGMXCC1_WGMXCCGn1
    SolutionIndex: 23
    SolutionNameMin: Cijk_Ailk_Bljk_F8SS_BH_Bias_HAS_SAB_SAV_UserArgs_MT64x64x128_MI16x16x1_SN_GSU0_GSUC0_GSUWGMRR0_K1_LBSPPA1024_LBSPPB256_LPA32_MIWT2_2_SU0_SUM0_SUS0_VWA2_VWB2_WGM8_WGMXCC1_WGMXCCGn1
    SolutionIndex: 24
    SolutionNameMin: Cijk_Ailk_Bljk_F8SS_BH_Bias_HAS_SAB_SAV_UserArgs_MT64x64x128_MI16x16x1_SN_GSU0_GSUC0_GSUWGMRR0_K1_LBSPPA1024_LBSPPB256_LPA32_MIWT2_2_SU0_SUM0_SUS0_VWA2_VWB2_WGM8_WGMXCC1_WGMXCCGn1
    SolutionIndex: 25
    SolutionNameMin: Cijk_Ailk_Bljk_F8SS_BH_Bias_HAS_SAB_SAV_UserArgs_MT64x64x128_MI16x16x1_SN_GSU0_GSUC0_GSUWGMRR0_K1_LBSPPA1024_LBSPPB256_LPA32_MIWT2_2_SU0_SUM0_SUS0_VWA2_VWB2_WGM8_WGMXCC1_WGMXCCGn1
    SolutionIndex: 26
    SolutionNameMin: Cijk_Ailk_Bljk_F8SS_BH_Bias_HAS_SAB_SAV_UserArgs_MT32x64x128_MI16x16x1_SN_GSU0_GSUC0_GSUWGMRR0_K1_LBSPPA512_LBSPPB256_LPA16_MIWT1_2_SU0_SUM0_SUS0_VWA1_VWB2_WGM8_WGMXCC1_WGMXCCGn1
    SolutionIndex: 27
    SolutionNameMin: Cijk_Ailk_Bljk_F8SS_BH_Bias_HAS_SAB_SAV_UserArgs_MT32x64x128_MI16x16x1_SN_GSU0_GSUC0_GSUWGMRR0_K1_LBSPPA512_LBSPPB256_LPA16_MIWT1_2_SU0_SUM0_SUS0_VWA1_VWB2_WGM8_WGMXCC1_WGMXCCGn1
    SolutionIndex: 28
    SolutionNameMin: Cijk_Ailk_Bljk_F8SS_BH_Bias_HAS_SAB_SAV_UserArgs_MT32x64x128_MI16x16x1_SN_GSU0_GSUC0_GSUWGMRR0_K1_LBSPPA512_LBSPPB256_LPA16_MIWT1_2_SU0_SUM0_SUS0_VWA1_VWB2_WGM8_WGMXCC1_WGMXCCGn1
    SolutionIndex: 29
    SolutionNameMin: Cijk_Ailk_Bljk_F8SS_BH_Bias_HAS_SAB_SAV_UserArgs_MT64x32x128_MI16x16x1_SN_GSU0_GSUC0_GSUWGMRR0_K1_LBSPPA1024_LBSPPB128_LPA32_MIWT2_1_SU0_SUM0_SUS0_VWA2_VWB1_WGM8_WGMXCC1_WGMXCCGn1
    SolutionIndex: 30
    SolutionNameMin: Cijk_Ailk_Bljk_F8SS_BH_Bias_HAS_SAB_SAV_UserArgs_MT32x32x128_MI16x16x1_SN_GSU0_GSUC0_GSUWGMRR0_K1_LBSPPA512_LBSPPB128_LPA16_MIWT1_1_SU0_SUM0_SUS0_VWA1_VWB1_WGM8_WGMXCC1_WGMXCCGn1
    SolutionIndex: 31
    SolutionNameMin: Cijk_Ailk_Bljk_F8SS_BH_Bias_HAS_SAB_SAV_UserArgs_MT32x32x128_MI16x16x1_SN_GSU0_GSUC0_GSUWGMRR0_K1_LBSPPA512_LBSPPB128_LPA16_MIWT1_1_SU0_SUM0_SUS0_VWA1_VWB1_WGM8_WGMXCC1_WGMXCCGn1
    SolutionIndex: 32
    SolutionNameMin: Cijk_Ailk_Bljk_F8SS_BH_Bias_HAS_SAB_SAV_UserArgs_MT32x32x128_MI16x16x1_SN_GSU0_GSUC0_GSUWGMRR0_K1_LBSPPA512_LBSPPB128_LPA16_MIWT1_1_SU0_SUM0_SUS0_VWA1_VWB1_WGM8_WGMXCC1_WGMXCCGn1
    SolutionIndex: 33
    SolutionNameMin: Cijk_Ailk_Bljk_F8SS_BH_Bias_HAS_SAB_SAV_UserArgs_MT32x32x128_MI16x16x1_SN_GSU0_GSUC0_GSUWGMRR0_K1_LBSPPA512_LBSPPB128_LPA16_MIWT1_1_SU0_SUM0_SUS0_VWA1_VWB1_WGM8_WGMXCC1_WGMXCCGn1
    SolutionIndex: 34
    SolutionNameMin: Cijk_Ailk_Bljk_F8SS_BH_Bias_HAS_SAB_SAV_UserArgs_MT256x256x128_MI32x32x1_SN_GSU0_GSUC0_GSUWGMRR0_K1_LBSPPA0_LBSPPB512_LPA0_MIWT4_4_SU0_SUM0_SUS0_VWA4_VWB4_WGM8_WGMXCC1_WGMXCCGn1
    SolutionIndex: 35
    SolutionNameMin: Cijk_Ailk_Bljk_F8SS_BH_Bias_HAS_SAB_SAV_UserArgs_MT256x256x128_MI32x32x1_SN_GSU0_GSUC0_GSUWGMRR0_K1_LBSPPA0_LBSPPB512_LPA0_MIWT4_4_SU0_SUM0_SUS0_VWA4_VWB4_WGM8_WGMXCC1_WGMXCCGn1
    SolutionIndex: 36
    SolutionNameMin: Cijk_Ailk_Bljk_F8SS_BH_Bias_HAS_SAB_SAV_UserArgs_MT128x256x128_MI32x32x1_SN_GSU0_GSUC0_GSUWGMRR0_K1_LBSPPA0_LBSPPB512_LPA0_MIWT2_4_SU0_SUM0_SUS0_VWA2_VWB4_WGM8_WGMXCC1_WGMXCCGn1
    SolutionIndex: 37
    SolutionNameMin: Cijk_Ailk_Bljk_F8SS_BH_Bias_HAS_SAB_SAV_UserArgs_MT128x256x128_MI32x32x1_SN_GSU0_GSUC0_GSUWGMRR0_K1_LBSPPA0_LBSPPB512_LPA0_MIWT2_4_SU0_SUM0_SUS0_VWA2_VWB4_WGM8_WGMXCC1_WGMXCCGn1
    SolutionIndex: 38
    SolutionNameMin: Cijk_Ailk_Bljk_F8SS_BH_Bias_HAS_SAB_SAV_UserArgs_MT256x128x128_MI32x32x1_SN_GSU0_GSUC0_GSUWGMRR0_K1_LBSPPA0_LBSPPB256_LPA0_MIWT4_2_SU0_SUM0_SUS0_VWA4_VWB2_WGM8_WGMXCC1_WGMXCCGn1
    SolutionIndex: 39
    SolutionNameMin: Cijk_Ailk_Bljk_F8SS_BH_Bias_HAS_SAB_SAV_UserArgs_MT128x128x128_MI32x32x1_SN_GSU0_GSUC0_GSUWGMRR0_K1_LBSPPA0_LBSPPB256_LPA0_MIWT2_2_SU0_SUM0_SUS0_VWA2_VWB2_WGM8_WGMXCC1_WGMXCCGn1
    SolutionIndex: 40
    SolutionNameMin: Cijk_Ailk_Bljk_F8SS_BH_Bias_HAS_SAB_SAV_UserArgs_MT128x128x128_MI32x32x1_SN_GSU0_GSUC0_GSUWGMRR0_K1_LBSPPA0_LBSPPB256_LPA0_MIWT2_2_SU0_SUM0_SUS0_VWA2_VWB2_WGM8_WGMXCC1_WGMXCCGn1
    SolutionIndex: 41
    SolutionNameMin: Cijk_Ailk_Bljk_F8SS_BH_Bias_HAS_SAB_SAV_UserArgs_MT128x128x128_MI32x32x1_SN_GSU0_GSUC0_GSUWGMRR0_K1_LBSPPA0_LBSPPB256_LPA0_MIWT2_2_SU0_SUM0_SUS0_VWA2_VWB2_WGM8_WGMXCC1_WGMXCCGn1
    SolutionIndex: 42
    SolutionNameMin: Cijk_Ailk_Bljk_F8SS_BH_Bias_HAS_SAB_SAV_UserArgs_MT128x128x256_MI16x16x1_SN_GSU0_GSUC0_GSUWGMRR0_K1_LBSPPA2048_LBSPPB1024_LPA64_MIWT4_4_SU0_SUM0_SUS0_VWA4_VWB4_WGM8_WGMXCC1_WGMXCCGn1
    SolutionIndex: 43
    SolutionNameMin: Cijk_Ailk_Bljk_F8SS_BH_Bias_HAS_SAB_SAV_UserArgs_MT64x64x256_MI16x16x1_SN_GSU0_GSUC0_GSUWGMRR0_K1_LBSPPA1024_LBSPPB512_LPA32_MIWT2_2_SU0_SUM0_SUS0_VWA2_VWB2_WGM8_WGMXCC1_WGMXCCGn1
    SolutionIndex: 44
    SolutionNameMin: Cijk_Ailk_Bljk_F8SS_BH_Bias_HAS_SAB_SAV_UserArgs_MT64x64x256_MI16x16x1_SN_GSU0_GSUC0_GSUWGMRR0_K1_LBSPPA1024_LBSPPB512_LPA32_MIWT2_2_SU0_SUM0_SUS0_VWA2_VWB2_WGM8_WGMXCC1_WGMXCCGn1
    SolutionIndex: 45
    SolutionNameMin: Cijk_Ailk_Bljk_F8SS_BH_Bias_HAS_SAB_SAV_UserArgs_MT32x64x256_MI16x16x1_SN_GSU0_GSUC0_GSUWGMRR0_K1_LBSPPA512_LBSPPB512_LPA16_MIWT1_2_SU0_SUM0_SUS0_VWA1_VWB2_WGM8_WGMXCC1_WGMXCCGn1
    SolutionIndex: 46
    SolutionNameMin: Cijk_Ailk_Bljk_F8SS_BH_Bias_HAS_SAB_SAV_UserArgs_MT32x64x256_MI16x16x1_SN_GSU0_GSUC0_GSUWGMRR0_K1_LBSPPA512_LBSPPB512_LPA16_MIWT1_2_SU0_SUM0_SUS0_VWA1_VWB2_WGM8_WGMXCC1_WGMXCCGn1
    SolutionIndex: 47
    SolutionNameMin: Cijk_Ailk_Bljk_F8SS_BH_Bias_HAS_SAB_SAV_UserArgs_MT64x32x256_MI16x16x1_SN_GSU0_GSUC0_GSUWGMRR0_K1_LBSPPA1024_LBSPPB256_LPA32_MIWT2_1_SU0_SUM0_SUS0_VWA2_VWB1_WGM8_WGMXCC1_WGMXCCGn1
    SolutionIndex: 48
    SolutionNameMin: Cijk_Ailk_Bljk_F8SS_BH_Bias_HAS_SAB_SAV_UserArgs_MT32x32x256_MI16x16x1_SN_GSU0_GSUC0_GSUWGMRR0_K1_LBSPPA512_LBSPPB256_LPA16_MIWT1_1_SU0_SUM0_SUS0_VWA1_VWB1_WGM8_WGMXCC1_WGMXCCGn1
    SolutionIndex: 49
    SolutionNameMin: Cijk_Ailk_Bljk_F8SS_BH_Bias_HAS_SAB_SAV_UserArgs_MT32x32x256_MI16x16x1_SN_GSU0_GSUC0_GSUWGMRR0_K1_LBSPPA512_LBSPPB256_LPA16_MIWT1_1_SU0_SUM0_SUS0_VWA1_VWB1_WGM8_WGMXCC1_WGMXCCGn1
    SolutionIndex: 50
    SolutionNameMin: Cijk_Ailk_Bljk_F8SS_BH_Bias_HAS_SAB_SAV_UserArgs_MT32x32x256_MI16x16x1_SN_GSU0_GSUC0_GSUWGMRR0_K1_LBSPPA512_LBSPPB256_LPA16_MIWT1_1_SU0_SUM0_SUS0_VWA1_VWB1_WGM8_WGMXCC1_WGMXCCGn1
    SolutionIndex: 51
    SolutionNameMin: Cijk_Ailk_Bljk_F8SS_BH_Bias_HAS_SAB_SAV_UserArgs_MT32x32x128_MI16x16x1_SN_GSU0_GSUC0_GSUWGMRR0_K1_LBSPPA256_LBSPPB128_LPA16_MIWT1_1_SU32_SUM0_SUS256_VWA1_VWB1_WGM8_WGMXCC1_WGMXCCGn1
- - - [128, 128, 1, 128, 128, 128, 128, 128]
    - [32, 0.42]
  - - [128, 128, 1, 256, 128, 128, 128, 256]
    - [49, 0.76]
  - - [128, 128, 1, 512, 128, 128, 128, 512]
    - [32, 1.3]
  - - [128, 128, 1, 1024, 128, 128, 128, 1024]
    - [49, 2.16]
  - - [128, 128, 1, 2048, 128, 128, 128, 2048]
    - [49, 3.19]
  - - [128, 128, 1, 4096, 128, 128, 128, 4096]
    - [49, 4.14]
  - - [128, 128, 1, 8192, 128, 128, 128, 8192]
    - [49, 4.92]
  - - [128, 256, 1, 128, 128, 128, 128, 128]
    - [32, 0.84]
  - - [128, 256, 1, 256, 128, 128, 128, 256]
    - [32, 1.51]
  - - [128, 256, 1, 512, 128, 128, 128, 512]
    - [49, 2.6]
  - - [128, 256, 1, 1024, 128, 128, 128, 1024]
    - [49, 4.29]
  - - [128, 256, 1, 2048, 128, 128, 128, 2048]
    - [49, 6.36]
  - - [128, 256, 1, 4096, 128, 128, 128, 4096]
    - [49, 8.3]
  - - [128, 256, 1, 8192, 128, 128, 128, 8192]
    - [49, 9.92]
  - - [128, 512, 1, 128, 128, 128, 128, 128]
    - [32, 1.64]
  - - [128, 512, 1, 256, 128, 128, 128, 256]
    - [27, 2.94]
  - - [128, 512, 1, 512, 128, 128, 128, 512]
    - [49, 5.07]
  - - [128, 512, 1, 1024, 128, 128, 128, 1024]
    - [49, 8.51]
  - - [128, 512, 1, 2048, 128, 128, 128, 2048]
    - [49, 12.65]
  - - [128, 512, 1, 4096, 128, 128, 128, 4096]
    - [49, 16.64]
  - - [128, 512, 1, 8192, 128, 128, 128, 8192]
    - [49, 19.8]
  - - [128, 1024, 1, 128, 128, 128, 128, 128]
    - [33, 3.2]
  - - [128, 1024, 1, 256, 128, 128, 128, 256]
    - [48, 5.77]
  - - [128, 1024, 1, 512, 128, 128, 128, 512]
    - [49, 10.1]
  - - [128, 1024, 1, 1024, 128, 128, 128, 1024]
    - [49, 16.77]
  - - [128, 1024, 1, 2048, 128, 128, 128, 2048]
    - [49, 25.02]
  - - [128, 1024, 1, 4096, 128, 128, 128, 4096]
    - [49, 32.98]
  - - [128, 1024, 1, 8192, 128, 128, 128, 8192]
    - [50, 39.46]
  - - [128, 2048, 1, 128, 128, 128, 128, 128]
    - [32, 6.24]
  - - [128, 2048, 1, 256, 128, 128, 128, 256]
    - [49, 11.11]
  - - [128, 2048, 1, 512, 128, 128, 128, 512]
    - [49, 19.61]
  - - [128, 2048, 1, 1024, 128, 128, 128, 1024]
    - [49, 32.15]
  - - [128, 2048, 1, 2048, 128, 128, 128, 2048]
    - [49, 48.19]
  - - [128, 2048, 1, 4096, 128, 128, 128, 4096]
    - [50, 64.02]
  - - [128, 2048, 1, 8192, 128, 128, 128, 8192]
    - [50, 77.69]
  - - [128, 4096, 1, 128, 128, 128, 128, 128]
    - [28, 11.53]
  - - [128, 4096, 1, 256, 128, 128, 128, 256]
    - [28, 20.49]
  - - [128, 4096, 1, 512, 128, 128, 128, 512]
    - [29, 34.97]
  - - [128, 4096, 1, 1024, 128, 128, 128, 1024]
    - [45, 57.13]
  - - [128, 4096, 1, 2048, 128, 128, 128, 2048]
    - [46, 85.61]
  - - [128, 4096, 1, 4096, 128, 128, 128, 4096]
    - [45, 112.94]
  - - [128, 4096, 1, 8192, 128, 128, 128, 8192]
    - [47, 129.06]
  - - [128, 8192, 1, 128, 128, 128, 128, 128]
    - [23, 20.01]
  - - [128, 8192, 1, 256, 128, 128, 128, 256]
    - [23, 35.83]
  - - [128, 8192, 1, 512, 128, 128, 128, 512]
    - [23, 61.95]
  - - [128, 8192, 1, 1024, 128, 128, 128, 1024]
    - [23, 98.08]
  - - [128, 8192, 1, 2048, 128, 128, 128, 2048]
    - [43, 142.35]
  - - [128, 8192, 1, 4096, 128, 128, 128, 4096]
    - [44, 181.83]
  - - [128, 8192, 1, 8192, 128, 128, 128, 8192]
    - [44, 212.52]
  - - [256, 128, 1, 128, 256, 256, 256, 128]
    - [32, 0.84]
  - - [256, 128, 1, 256, 256, 256, 256, 256]
    - [49, 1.48]
  - - [256, 128, 1, 512, 256, 256, 256, 512]
    - [49, 2.57]
  - - [256, 128, 1, 1024, 256, 256, 256, 1024]
    - [49, 4.27]
  - - [256, 128, 1, 2048, 256, 256, 256, 2048]
    - [49, 6.37]
  - - [256, 128, 1, 4096, 256, 256, 256, 4096]
    - [49, 8.29]
  - - [256, 128, 1, 8192, 256, 256, 256, 8192]
    - [49, 9.95]
  - - [256, 256, 1, 128, 256, 256, 256, 128]
    - [30, 1.66]
  - - [256, 256, 1, 256, 256, 256, 256, 256]
    - [49, 2.96]
  - - [256, 256, 1, 512, 256, 256, 256, 512]
    - [49, 5.2]
  - - [256, 256, 1, 1024, 256, 256, 256, 1024]
    - [49, 8.6]
  - - [256, 256, 1, 2048, 256, 256, 256, 2048]
    - [49, 12.64]
  - - [256, 256, 1, 4096, 256, 256, 256, 4096]
    - [49, 16.75]
  - - [256, 256, 1, 8192, 256, 256, 256, 8192]
    - [49, 19.83]
  - - [256, 512, 1, 128, 256, 256, 256, 128]
    - [32, 3.28]
  - - [256, 512, 1, 256, 256, 256, 256, 256]
    - [49, 5.86]
  - - [256, 512, 1, 512, 256, 256, 256, 512]
    - [49, 10.29]
  - - [256, 512, 1, 1024, 256, 256, 256, 1024]
    - [49, 17.1]
  - - [256, 512, 1, 2048, 256, 256, 256, 2048]
    - [49, 25.68]
  - - [256, 512, 1, 4096, 256, 256, 256, 4096]
    - [49, 33.72]
  - - [256, 512, 1, 8192, 256, 256, 256, 8192]
    - [50, 39.96]
  - - [256, 1024, 1, 128, 256, 256, 256, 128]
    - [32, 6.22]
  - - [256, 1024, 1, 256, 256, 256, 256, 256]
    - [49, 11.34]
  - - [256, 1024, 1, 512, 256, 256, 256, 512]
    - [49, 19.85]
  - - [256, 1024, 1, 1024, 256, 256, 256, 1024]
    - [49, 32.94]
  - - [256, 1024, 1, 2048, 256, 256, 256, 2048]
    - [49, 49.29]
  - - [256, 1024, 1, 4096, 256, 256, 256, 4096]
    - [49, 65.17]
  - - [256, 1024, 1, 8192, 256, 256, 256, 8192]
    - [50, 77.9]
  - - [256, 2048, 1, 128, 256, 256, 256, 128]
    - [27, 11.51]
  - - [256, 2048, 1, 256, 256, 256, 256, 256]
    - [45, 20.7]
  - - [256, 2048, 1, 512, 256, 256, 256, 512]
    - [45, 35.56]
  - - [256, 2048, 1, 1024, 256, 256, 256, 1024]
    - [45, 59.05]
  - - [256, 2048, 1, 2048, 256, 256, 256, 2048]
    - [45, 86.86]
  - - [256, 2048, 1, 4096, 256, 256, 256, 4096]
    - [46, 114.07]
  - - [256, 2048, 1, 8192, 256, 256, 256, 8192]
    - [46, 136.44]
  - - [256, 4096, 1, 128, 256, 256, 256, 128]
    - [23, 19.95]
  - - [256, 4096, 1, 256, 256, 256, 256, 256]
    - [23, 35.82]
  - - [256, 4096, 1, 512, 256, 256, 256, 512]
    - [23, 62.19]
  - - [256, 4096, 1, 1024, 256, 256, 256, 1024]
    - [44, 98.75]
  - - [256, 4096, 1, 2048, 256, 256, 256, 2048]
    - [44, 145.12]
  - - [256, 4096, 1, 4096, 256, 256, 256, 4096]
    - [44, 185.68]
  - - [256, 4096, 1, 8192, 256, 256, 256, 8192]
    - [44, 205.07]
  - - [256, 8192, 1, 128, 256, 256, 256, 128]
    - [19, 31.65]
  - - [256, 8192, 1, 256, 256, 256, 256, 256]
    - [20, 57.86]
  - - [256, 8192, 1, 512, 256, 256, 256, 512]
    - [16, 100.63]
  - - [256, 8192, 1, 1024, 256, 256, 256, 1024]
    - [16, 156.62]
  - - [256, 8192, 1, 2048, 256, 256, 256, 2048]
    - [16, 220.09]
  - - [256, 8192, 1, 4096, 256, 256, 256, 4096]
    - [16, 278.79]
  - - [256, 8192, 1, 8192, 256, 256, 256, 8192]
    - [16, 314.45]
  - - [512, 128, 1, 128, 512, 512, 512, 128]
    - [33, 1.63]
  - - [512, 128, 1, 256, 512, 512, 512, 256]
    - [49, 2.96]
  - - [512, 128, 1, 512, 512, 512, 512, 512]
    - [49, 5.16]
  - - [512, 128, 1, 1024, 512, 512, 512, 1024]
    - [49, 8.56]
  - - [512, 128, 1, 2048, 512, 512, 512, 2048]
    - [49, 12.64]
  - - [512, 128, 1, 4096, 512, 512, 512, 4096]
    - [49, 16.54]
  - - [512, 128, 1, 8192, 512, 512, 512, 8192]
    - [50, 19.41]
  - - [512, 256, 1, 128, 512, 512, 512, 128]
    - [32, 3.23]
  - - [512, 256, 1, 256, 512, 512, 512, 256]
    - [49, 5.85]
  - - [512, 256, 1, 512, 512, 512, 512, 512]
    - [49, 10.22]
  - - [512, 256, 1, 1024, 512, 512, 512, 1024]
    - [49, 17.04]
  - - [512, 256, 1, 2048, 512, 512, 512, 2048]
    - [49, 25.43]
  - - [512, 256, 1, 4096, 512, 512, 512, 4096]
    - [49, 32.97]
  - - [512, 256, 1, 8192, 512, 512, 512, 8192]
    - [50, 39.16]
  - - [512, 512, 1, 128, 512, 512, 512, 128]
    - [32, 6.3]
  - - [512, 512, 1, 256, 512, 512, 512, 256]
    - [49, 11.32]
  - - [512, 512, 1, 512, 512, 512, 512, 512]
    - [49, 20.04]
  - - [512, 512, 1, 1024, 512, 512, 512, 1024]
    - [49, 33.29]
  - - [512, 512, 1, 2048, 512, 512, 512, 2048]
    - [49, 49.77]
  - - [512, 512, 1, 4096, 512, 512, 512, 4096]
    - [49, 65.02]
  - - [512, 512, 1, 8192, 512, 512, 512, 8192]
    - [50, 76.66]
  - - [512, 1024, 1, 128, 512, 512, 512, 128]
    - [27, 11.4]
  - - [512, 1024, 1, 256, 512, 512, 512, 256]
    - [45, 20.77]
  - - [512, 1024, 1, 512, 512, 512, 512, 512]
    - [45, 35.88]
  - - [512, 1024, 1, 1024, 512, 512, 512, 1024]
    - [46, 58.21]
  - - [512, 1024, 1, 2048, 512, 512, 512, 2048]
    - [46, 85.08]
  - - [512, 1024, 1, 4096, 512, 512, 512, 4096]
    - [47, 108.96]
  - - [512, 1024, 1, 8192, 512, 512, 512, 8192]
    - [47, 130.67]
  - - [512, 2048, 1, 128, 512, 512, 512, 128]
    - [23, 19.94]
  - - [512, 2048, 1, 256, 512, 512, 512, 256]
    - [23, 35.99]
  - - [512, 2048, 1, 512, 512, 512, 512, 512]
    - [23, 62.39]
  - - [512, 2048, 1, 1024, 512, 512, 512, 1024]
    - [44, 99.59]
  - - [512, 2048, 1, 2048, 512, 512, 512, 2048]
    - [25, 138.91]
  - - [512, 2048, 1, 4096, 512, 512, 512, 4096]
    - [25, 176.12]
  - - [512, 2048, 1, 8192, 512, 512, 512, 8192]
    - [21, 191.99]
  - - [512, 4096, 1, 128, 512, 512, 512, 128]
    - [19, 31.82]
  - - [512, 4096, 1, 256, 512, 512, 512, 256]
    - [19, 57.55]
  - - [512, 4096, 1, 512, 512, 512, 512, 512]
    - [16, 101.19]
  - - [512, 4096, 1, 1024, 512, 512, 512, 1024]
    - [16, 161.63]
  - - [512, 4096, 1, 2048, 512, 512, 512, 2048]
    - [16, 226.21]
  - - [512, 4096, 1, 4096, 512, 512, 512, 4096]
    - [16, 282.66]
  - - [512, 4096, 1, 8192, 512, 512, 512, 8192]
    - [16, 318.75]
  - - [512, 8192, 1, 128, 512, 512, 512, 128]
    - [14, 40.98]
  - - [512, 8192, 1, 256, 512, 512, 512, 256]
    - [15, 74.92]
  - - [512, 8192, 1, 512, 512, 512, 512, 512]
    - [15, 136.54]
  - - [512, 8192, 1, 1024, 512, 512, 512, 1024]
    - [15, 217.59]
  - - [512, 8192, 1, 2048, 512, 512, 512, 2048]
    - [15, 321.83]
  - - [512, 8192, 1, 4096, 512, 512, 512, 4096]
    - [15, 406.91]
  - - [512, 8192, 1, 8192, 512, 512, 512, 8192]
    - [42, 425.74]
  - - [1024, 128, 1, 128, 1024, 1024, 1024, 128]
    - [32, 3.18]
  - - [1024, 128, 1, 256, 1024, 1024, 1024, 256]
    - [32, 5.74]
  - - [1024, 128, 1, 512, 1024, 1024, 1024, 512]
    - [48, 9.9]
  - - [1024, 128, 1, 1024, 1024, 1024, 1024, 1024]
    - [49, 16.37]
  - - [1024, 128, 1, 2048, 1024, 1024, 1024, 2048]
    - [49, 23.77]
  - - [1024, 128, 1, 4096, 1024, 1024, 1024, 4096]
    - [50, 31.15]
  - - [1024, 128, 1, 8192, 1024, 1024, 1024, 8192]
    - [50, 35.71]
  - - [1024, 256, 1, 128, 1024, 1024, 1024, 128]
    - [27, 6.08]
  - - [1024, 256, 1, 256, 1024, 1024, 1024, 256]
    - [49, 11.16]
  - - [1024, 256, 1, 512, 1024, 1024, 1024, 512]
    - [49, 19.25]
  - - [1024, 256, 1, 1024, 1024, 1024, 1024, 1024]
    - [49, 31.59]
  - - [1024, 256, 1, 2048, 1024, 1024, 1024, 2048]
    - [50, 46.19]
  - - [1024, 256, 1, 4096, 1024, 1024, 1024, 4096]
    - [50, 60.06]
  - - [1024, 256, 1, 8192, 1024, 1024, 1024, 8192]
    - [50, 70.61]
  - - [1024, 512, 1, 128, 1024, 1024, 1024, 128]
    - [27, 11.44]
  - - [1024, 512, 1, 256, 1024, 1024, 1024, 256]
    - [29, 20.65]
  - - [1024, 512, 1, 512, 1024, 1024, 1024, 512]
    - [29, 35.75]
  - - [1024, 512, 1, 1024, 1024, 1024, 1024, 1024]
    - [47, 57.22]
  - - [1024, 512, 1, 2048, 1024, 1024, 1024, 2048]
    - [47, 82.85]
  - - [1024, 512, 1, 4096, 1024, 1024, 1024, 4096]
    - [47, 106.66]
  - - [1024, 512, 1, 8192, 1024, 1024, 1024, 8192]
    - [47, 124.99]
  - - [1024, 1024, 1, 128, 1024, 1024, 1024, 128]
    - [23, 20.09]
  - - [1024, 1024, 1, 256, 1024, 1024, 1024, 256]
    - [23, 36.32]
  - - [1024, 1024, 1, 512, 1024, 1024, 1024, 512]
    - [23, 63.71]
  - - [1024, 1024, 1, 1024, 1024, 1024, 1024, 1024]
    - [23, 99.83]
  - - [1024, 1024, 1, 2048, 1024, 1024, 1024, 2048]
    - [25, 139.94]
  - - [1024, 1024, 1, 4096, 1024, 1024, 1024, 4096]
    - [25, 176.74]
  - - [1024, 1024, 1, 8192, 1024, 1024, 1024, 8192]
    - [23, 200.68]
  - - [1024, 2048, 1, 128, 1024, 1024, 1024, 128]
    - [19, 31.82]
  - - [1024, 2048, 1, 256, 1024, 1024, 1024, 256]
    - [19, 57.8]
  - - [1024, 2048, 1, 512, 1024, 1024, 1024, 512]
    - [16, 101.21]
  - - [1024, 2048, 1, 1024, 1024, 1024, 1024, 1024]
    - [16, 160.67]
  - - [1024, 2048, 1, 2048, 1024, 1024, 1024, 2048]
    - [16, 230.43]
  - - [1024, 2048, 1, 4096, 1024, 1024, 1024, 4096]
    - [18, 293.91]
  - - [1024, 2048, 1, 8192, 1024, 1024, 1024, 8192]
    - [16, 319.52]
  - - [1024, 4096, 1, 128, 1024, 1024, 1024, 128]
    - [15, 40.78]
  - - [1024, 4096, 1, 256, 1024, 1024, 1024, 256]
    - [14, 74.71]
  - - [1024, 4096, 1, 512, 1024, 1024, 1024, 512]
    - [15, 131.7]
  - - [1024, 4096, 1, 1024, 1024, 1024, 1024, 1024]
    - [14, 211.88]
  - - [1024, 4096, 1, 2048, 1024, 1024, 1024, 2048]
    - [15, 317.61]
  - - [1024, 4096, 1, 4096, 1024, 1024, 1024, 4096]
    - [41, 399.38]
  - - [1024, 4096, 1, 8192, 1024, 1024, 1024, 8192]
    - [14, 427.66]
  - - [1024, 8192, 1, 128, 1024, 1024, 1024, 128]
    - [10, 54.66]
  - - [1024, 8192, 1, 256, 1024, 1024, 1024, 256]
    - [10, 100.21]
  - - [1024, 8192, 1, 512, 1024, 1024, 1024, 512]
    - [10, 171.44]
  - - [1024, 8192, 1, 1024, 1024, 1024, 1024, 1024]
    - [6, 267.67]
  - - [1024, 8192, 1, 2048, 1024, 1024, 1024, 2048]
    - [12, 395.91]
  - - [1024, 8192, 1, 4096, 1024, 1024, 1024, 4096]
    - [38, 478.89]
  - - [1024, 8192, 1, 8192, 1024, 1024, 1024, 8192]
    - [13, 501.09]
  - - [2048, 128, 1, 128, 2048, 2048, 2048, 128]
    - [31, 6.18]
  - - [2048, 128, 1, 256, 2048, 2048, 2048, 256]
    - [49, 11.13]
  - - [2048, 128, 1, 512, 2048, 2048, 2048, 512]
    - [49, 19.03]
  - - [2048, 128, 1, 1024, 2048, 2048, 2048, 1024]
    - [50, 31.42]
  - - [2048, 128, 1, 2048, 2048, 2048, 2048, 2048]
    - [50, 45.11]
  - - [2048, 128, 1, 4096, 2048, 2048, 2048, 4096]
    - [50, 59.12]
  - - [2048, 128, 1, 8192, 2048, 2048, 2048, 8192]
    - [50, 68.05]
  - - [2048, 256, 1, 128, 2048, 2048, 2048, 128]
    - [27, 11.54]
  - - [2048, 256, 1, 256, 2048, 2048, 2048, 256]
    - [45, 20.8]
  - - [2048, 256, 1, 512, 2048, 2048, 2048, 512]
    - [27, 35.51]
  - - [2048, 256, 1, 1024, 2048, 2048, 2048, 1024]
    - [47, 56.14]
  - - [2048, 256, 1, 2048, 2048, 2048, 2048, 2048]
    - [47, 80.87]
  - - [2048, 256, 1, 4096, 2048, 2048, 2048, 4096]
    - [47, 103.72]
  - - [2048, 256, 1, 8192, 2048, 2048, 2048, 8192]
    - [47, 120.62]
  - - [2048, 512, 1, 128, 2048, 2048, 2048, 128]
    - [23, 19.99]
  - - [2048, 512, 1, 256, 2048, 2048, 2048, 256]
    - [23, 35.9]
  - - [2048, 512, 1, 512, 2048, 2048, 2048, 512]
    - [23, 62.1]
  - - [2048, 512, 1, 1024, 2048, 2048, 2048, 1024]
    - [23, 97.93]
  - - [2048, 512, 1, 2048, 2048, 2048, 2048, 2048]
    - [25, 138.37]
  - - [2048, 512, 1, 4096, 2048, 2048, 2048, 4096]
    - [25, 174.08]
  - - [2048, 512, 1, 8192, 2048, 2048, 2048, 8192]
    - [25, 186.02]
  - - [2048, 1024, 1, 128, 2048, 2048, 2048, 128]
    - [19, 31.75]
  - - [2048, 1024, 1, 256, 2048, 2048, 2048, 256]
    - [16, 57.55]
  - - [2048, 1024, 1, 512, 2048, 2048, 2048, 512]
    - [16, 100.46]
  - - [2048, 1024, 1, 1024, 2048, 2048, 2048, 1024]
    - [16, 160.79]
  - - [2048, 1024, 1, 2048, 2048, 2048, 2048, 2048]
    - [18, 229.67]
  - - [2048, 1024, 1, 4096, 2048, 2048, 2048, 4096]
    - [18, 286.74]
  - - [2048, 1024, 1, 8192, 2048, 2048, 2048, 8192]
    - [16, 320.91]
  - - [2048, 2048, 1, 128, 2048, 2048, 2048, 128]
    - [14, 40.84]
  - - [2048, 2048, 1, 256, 2048, 2048, 2048, 256]
    - [15, 74.4]
  - - [2048, 2048, 1, 512, 2048, 2048, 2048, 512]
    - [14, 130.02]
  - - [2048, 2048, 1, 1024, 2048, 2048, 2048, 1024]
    - [15, 216.56]
  - - [2048, 2048, 1, 2048, 2048, 2048, 2048, 2048]
    - [15, 313.79]
  - - [2048, 2048, 1, 4096, 2048, 2048, 2048, 4096]
    - [14, 399.21]
  - - [2048, 2048, 1, 8192, 2048, 2048, 2048, 8192]
    - [15, 442.43]
  - - [2048, 4096, 1, 128, 2048, 2048, 2048, 128]
    - [12, 52.23]
  - - [2048, 4096, 1, 256, 2048, 2048, 2048, 256]
    - [12, 95.53]
  - - [2048, 4096, 1, 512, 2048, 2048, 2048, 512]
    - [12, 164.86]
  - - [2048, 4096, 1, 1024, 2048, 2048, 2048, 1024]
    - [13, 270.24]
  - - [2048, 4096, 1, 2048, 2048, 2048, 2048, 2048]
    - [13, 397.45]
  - - [2048, 4096, 1, 4096, 2048, 2048, 2048, 4096]
    - [12, 468.92]
  - - [2048, 4096, 1, 8192, 2048, 2048, 2048, 8192]
    - [37, 495.84]
  - - [2048, 8192, 1, 128, 2048, 2048, 2048, 128]
    - [4, 59.42]
  - - [2048, 8192, 1, 256, 2048, 2048, 2048, 256]
    - [35, 104.11]
  - - [2048, 8192, 1, 512, 2048, 2048, 2048, 512]
    - [2, 178.95]
  - - [2048, 8192, 1, 1024, 2048, 2048, 2048, 1024]
    - [1, 303.51]
  - - [2048, 8192, 1, 2048, 2048, 2048, 2048, 2048]
    - [3, 465.36]
  - - [2048, 8192, 1, 4096, 2048, 2048, 2048, 4096]
    - [35, 617.91]
  - - [2048, 8192, 1, 8192, 2048, 2048, 2048, 8192]
    - [35, 682.29]
  - - [4096, 128, 1, 128, 4096, 4096, 4096, 128]
    - [26, 11.35]
  - - [4096, 128, 1, 256, 4096, 4096, 4096, 256]
    - [45, 20.38]
  - - [4096, 128, 1, 512, 4096, 4096, 4096, 512]
    - [27, 34.94]
  - - [4096, 128, 1, 1024, 4096, 4096, 4096, 1024]
    - [27, 54.13]
  - - [4096, 128, 1, 2048, 4096, 4096, 4096, 2048]
    - [47, 78.79]
  - - [4096, 128, 1, 4096, 4096, 4096, 4096, 4096]
    - [47, 102.0]
  - - [4096, 128, 1, 8192, 4096, 4096, 4096, 8192]
    - [47, 108.39]
  - - [4096, 256, 1, 128, 4096, 4096, 4096, 128]
    - [23, 19.87]
  - - [4096, 256, 1, 256, 4096, 4096, 4096, 256]
    - [24, 35.67]
  - - [4096, 256, 1, 512, 4096, 4096, 4096, 512]
    - [23, 62.23]
  - - [4096, 256, 1, 1024, 4096, 4096, 4096, 1024]
    - [23, 97.88]
  - - [4096, 256, 1, 2048, 4096, 4096, 4096, 2048]
    - [23, 137.56]
  - - [4096, 256, 1, 4096, 4096, 4096, 4096, 4096]
    - [23, 170.95]
  - - [4096, 256, 1, 8192, 4096, 4096, 4096, 8192]
    - [25, 184.64]
  - - [4096, 512, 1, 128, 4096, 4096, 4096, 128]
    - [16, 31.43]
  - - [4096, 512, 1, 256, 4096, 4096, 4096, 256]
    - [17, 57.0]
  - - [4096, 512, 1, 512, 4096, 4096, 4096, 512]
    - [16, 100.2]
  - - [4096, 512, 1, 1024, 4096, 4096, 4096, 1024]
    - [16, 160.77]
  - - [4096, 512, 1, 2048, 4096, 4096, 4096, 2048]
    - [18, 224.8]
  - - [4096, 512, 1, 4096, 4096, 4096, 4096, 4096]
    - [18, 279.06]
  - - [4096, 512, 1, 8192, 4096, 4096, 4096, 8192]
    - [18, 320.49]
  - - [4096, 1024, 1, 128, 4096, 4096, 4096, 128]
    - [40, 40.34]
  - - [4096, 1024, 1, 256, 4096, 4096, 4096, 256]
    - [14, 73.68]
  - - [4096, 1024, 1, 512, 4096, 4096, 4096, 512]
    - [15, 130.05]
  - - [4096, 1024, 1, 1024, 4096, 4096, 4096, 1024]
    - [15, 214.52]
  - - [4096, 1024, 1, 2048, 4096, 4096, 4096, 2048]
    - [15, 315.85]
  - - [4096, 1024, 1, 4096, 4096, 4096, 4096, 4096]
    - [15, 395.09]
  - - [4096, 1024, 1, 8192, 4096, 4096, 4096, 8192]
    - [15, 423.23]
  - - [4096, 2048, 1, 128, 4096, 4096, 4096, 128]
    - [5, 52.16]
  - - [4096, 2048, 1, 256, 4096, 4096, 4096, 256]
    - [5, 96.81]
  - - [4096, 2048, 1, 512, 4096, 4096, 4096, 512]
    - [8, 162.76]
  - - [4096, 2048, 1, 1024, 4096, 4096, 4096, 1024]
    - [13, 266.76]
  - - [4096, 2048, 1, 2048, 4096, 4096, 4096, 2048]
    - [13, 385.58]
  - - [4096, 2048, 1, 4096, 4096, 4096, 4096, 4096]
    - [36, 465.19]
  - - [4096, 2048, 1, 8192, 4096, 4096, 4096, 8192]
    - [37, 490.53]
  - - [4096, 4096, 1, 128, 4096, 4096, 4096, 128]
    - [4, 59.15]
  - - [4096, 4096, 1, 256, 4096, 4096, 4096, 256]
    - [38, 106.21]
  - - [4096, 4096, 1, 512, 4096, 4096, 4096, 512]
    - [10, 183.53]
  - - [4096, 4096, 1, 1024, 4096, 4096, 4096, 1024]
    - [34, 302.86]
  - - [4096, 4096, 1, 2048, 4096, 4096, 4096, 2048]
    - [35, 481.05]
  - - [4096, 4096, 1, 4096, 4096, 4096, 4096, 4096]
    - [35, 605.8]
  - - [4096, 4096, 1, 8192, 4096, 4096, 4096, 8192]
    - [35, 649.84]
  - - [4096, 8192, 1, 128, 4096, 4096, 4096, 128]
    - [9, 65.88]
  - - [4096, 8192, 1, 256, 4096, 4096, 4096, 256]
    - [35, 117.38]
  - - [4096, 8192, 1, 512, 4096, 4096, 4096, 512]
    - [0, 204.78]
  - - [4096, 8192, 1, 1024, 4096, 4096, 4096, 1024]
    - [0, 330.98]
  - - [4096, 8192, 1, 2048, 4096, 4096, 4096, 2048]
    - [35, 481.25]
  - - [4096, 8192, 1, 4096, 4096, 4096, 4096, 4096]
    - [35, 574.14]
  - - [4096, 8192, 1, 8192, 4096, 4096, 4096, 8192]
    - [35, 683.95]
  - - [8192, 128, 1, 128, 8192, 8192, 8192, 128]
    - [24, 19.8]
  - - [8192, 128, 1, 256, 8192, 8192, 8192, 256]
    - [23, 35.53]
  - - [8192, 128, 1, 512, 8192, 8192, 8192, 512]
    - [23, 61.58]
  - - [8192, 128, 1, 1024, 8192, 8192, 8192, 1024]
    - [23, 96.89]
  - - [8192, 128, 1, 2048, 8192, 8192, 8192, 2048]
    - [22, 133.39]
  - - [8192, 128, 1, 4096, 8192, 8192, 8192, 4096]
    - [22, 161.59]
  - - [8192, 128, 1, 8192, 8192, 8192, 8192, 8192]
    - [25, 184.05]
  - - [8192, 256, 1, 128, 8192, 8192, 8192, 128]
    - [19, 31.49]
  - - [8192, 256, 1, 256, 8192, 8192, 8192, 256]
    - [16, 57.59]
  - - [8192, 256, 1, 512, 8192, 8192, 8192, 512]
    - [16, 100.82]
  - - [8192, 256, 1, 1024, 8192, 8192, 8192, 1024]
    - [20, 155.42]
  - - [8192, 256, 1, 2048, 8192, 8192, 8192, 2048]
    - [16, 218.38]
  - - [8192, 256, 1, 4096, 8192, 8192, 8192, 4096]
    - [16, 280.42]
  - - [8192, 256, 1, 8192, 8192, 8192, 8192, 8192]
    - [16, 318.76]
  - - [8192, 512, 1, 128, 8192, 8192, 8192, 128]
    - [11, 40.23]
  - - [8192, 512, 1, 256, 8192, 8192, 8192, 256]
    - [39, 73.41]
  - - [8192, 512, 1, 512, 8192, 8192, 8192, 512]
    - [41, 132.2]
  - - [8192, 512, 1, 1024, 8192, 8192, 8192, 1024]
    - [15, 208.98]
  - - [8192, 512, 1, 2048, 8192, 8192, 8192, 2048]
    - [15, 311.76]
  - - [8192, 512, 1, 4096, 8192, 8192, 8192, 4096]
    - [15, 404.54]
  - - [8192, 512, 1, 8192, 8192, 8192, 8192, 8192]
    - [15, 419.38]
  - - [8192, 1024, 1, 128, 8192, 8192, 8192, 128]
    - [7, 53.07]
  - - [8192, 1024, 1, 256, 8192, 8192, 8192, 256]
    - [38, 98.12]
  - - [8192, 1024, 1, 512, 8192, 8192, 8192, 512]
    - [6, 165.82]
  - - [8192, 1024, 1, 1024, 8192, 8192, 8192, 1024]
    - [13, 272.8]
  - - [8192, 1024, 1, 2048, 8192, 8192, 8192, 2048]
    - [12, 392.47]
  - - [8192, 1024, 1, 4096, 8192, 8192, 8192, 4096]
    - [13, 464.1]
  - - [8192, 1024, 1, 8192, 8192, 8192, 8192, 8192]
    - [13, 499.97]
  - - [8192, 2048, 1, 128, 8192, 8192, 8192, 128]
    - [9, 60.57]
  - - [8192, 2048, 1, 256, 8192, 8192, 8192, 256]
    - [38, 111.1]
  - - [8192, 2048, 1, 512, 8192, 8192, 8192, 512]
    - [8, 183.48]
  - - [8192, 2048, 1, 1024, 8192, 8192, 8192, 1024]
    - [34, 298.97]
  - - [8192, 2048, 1, 2048, 8192, 8192, 8192, 2048]
    - [3, 450.18]
  - - [8192, 2048, 1, 4096, 8192, 8192, 8192, 4096]
    - [35, 628.11]
  - - [8192, 2048, 1, 8192, 8192, 8192, 8192, 8192]
    - [35, 670.12]
  - - [8192, 4096, 1, 128, 8192, 8192, 8192, 128]
    - [6, 65.73]
  - - [8192, 4096, 1, 256, 8192, 8192, 8192, 256]
    - [10, 117.71]
  - - [8192, 4096, 1, 512, 8192, 8192, 8192, 512]
    - [35, 201.65]
  - - [8192, 4096, 1, 1024, 8192, 8192, 8192, 1024]
    - [35, 332.84]
  - - [8192, 4096, 1, 2048, 8192, 8192, 8192, 2048]
    - [35, 478.24]
  - - [8192, 4096, 1, 4096, 8192, 8192, 8192, 4096]
    - [35, 588.84]
  - - [8192, 4096, 1, 8192, 8192, 8192, 8192, 8192]
    - [35, 687.5]
  - - [8192, 8192, 1, 128, 8192, 8192, 8192, 128]
    - [6, 67.62]
  - - [8192, 8192, 1, 256, 8192, 8192, 8192, 256]
    - [0, 123.06]
  - - [8192, 8192, 1, 512, 8192, 8192, 8192, 512]
    - [4, 210.15]
  - - [8192, 8192, 1, 1024, 8192, 8192, 8192, 1024]
    - [35, 331.64]
  - - [8192, 8192, 1, 2048, 8192, 8192, 8192, 2048]
    - [35, 474.42]
  - - [8192, 8192, 1, 4096, 8192, 8192, 8192, 4096]
    - [35, 614.26]
  - - [8192, 8192, 1, 8192, 8192, 8192, 8192, 8192]
    - [35, 746.98]
  - - [1, 1, 1, 32, 1, 1, 1, 32]
    - [51, 0.0]
- null
- null
- DeviceEfficiency
- GridBased
