projects/hipblaslt/library/src/amd_detail/rocblaslt/src/Tensile/Logic/asm_full/gfx950/GridBased/gfx950_Cijk_Ailk_Bjlk_B8SS_BH_Bias_HAS_SAB_SAV_UserArgs.yaml
- {MinimumRequiredVersion: 4.33.0}
- gfx950
- gfx950
- [Device 75a0]
    SolutionIndex: 0
    SolutionNameMin: Cijk_Ailk_Bjlk_F8SS_BH_Bias_HAS_SAB_SAV_UserArgs_MT256x256x64_MI32x32x1_SN_GSU0_GSUC0_GSUWGMRR0_K1_LBSPPA0_LBSPPB0_LPA0_LPB0_MIWT4_4_SU0_SUM0_SUS64_VWA4_VWB4_WGM8_WGMXCC1_WGMXCCGn1
    SolutionIndex: 1
    SolutionNameMin: Cijk_Ailk_Bjlk_F8SS_BH_Bias_HAS_SAB_SAV_UserArgs_MT256x256x64_MI32x32x1_SN_GSU0_GSUC0_GSUWGMRR0_K1_LBSPPA0_LBSPPB0_LPA0_LPB0_MIWT4_4_SU0_SUM0_SUS64_VWA4_VWB4_WGM8_WGMXCC1_WGMXCCGn1
    SolutionIndex: 2
    SolutionNameMin: Cijk_Ailk_Bjlk_F8SS_BH_Bias_HAS_SAB_SAV_UserArgs_MT256x256x64_MI32x32x1_SN_GSU0_GSUC0_GSUWGMRR0_K1_LBSPPA0_LBSPPB0_LPA0_LPB0_MIWT4_4_SU0_SUM0_SUS64_VWA4_VWB4_WGM8_WGMXCC1_WGMXCCGn1
    SolutionIndex: 3
    SolutionNameMin: Cijk_Ailk_Bjlk_F8SS_BH_Bias_HAS_SAB_SAV_UserArgs_MT256x256x64_MI32x32x1_SN_GSU0_GSUC0_GSUWGMRR0_K1_LBSPPA0_LBSPPB0_LPA0_LPB0_MIWT4_4_SU0_SUM0_SUS64_VWA4_VWB4_WGM8_WGMXCC1_WGMXCCGn1
    SolutionIndex: 4
    SolutionNameMin: Cijk_Ailk_Bjlk_F8SS_BH_Bias_HAS_SAB_SAV_UserArgs_MT256x256x64_MI32x32x1_SN_GSU0_GSUC0_GSUWGMRR0_K1_LBSPPA0_LBSPPB0_LPA0_LPB0_MIWT4_4_SU0_SUM0_SUS64_VWA4_VWB4_WGM8_WGMXCC1_WGMXCCGn1
    SolutionIndex: 5
    SolutionNameMin: Cijk_Ailk_Bjlk_F8SS_BH_Bias_HAS_SAB_SAV_UserArgs_MT256x256x64_MI32x32x1_SN_GSU0_GSUC0_GSUWGMRR0_K1_LBSPPA0_LBSPPB0_LPA0_LPB0_MIWT4_4_SU0_SUM0_SUS64_VWA4_VWB4_WGM8_WGMXCC1_WGMXCCGn1
    SolutionIndex: 6
    SolutionNameMin: Cijk_Ailk_Bjlk_F8SS_BH_Bias_HAS_SAB_SAV_UserArgs_MT256x256x64_MI32x32x1_SN_GSU0_GSUC0_GSUWGMRR0_K1_LBSPPA0_LBSPPB0_LPA0_LPB0_MIWT4_4_SU0_SUM0_SUS64_VWA4_VWB4_WGM8_WGMXCC1_WGMXCCGn1
    SolutionIndex: 7
    SolutionNameMin: Cijk_Ailk_Bjlk_F8SS_BH_Bias_HAS_SAB_SAV_UserArgs_MT256x256x64_MI32x32x1_SN_GSU0_GSUC0_GSUWGMRR0_K1_LBSPPA0_LBSPPB0_LPA0_LPB0_MIWT4_4_SU0_SUM0_SUS64_VWA4_VWB4_WGM8_WGMXCC1_WGMXCCGn1
    SolutionIndex: 8
    SolutionNameMin: Cijk_Ailk_Bjlk_F8SS_BH_Bias_HAS_SAB_SAV_UserArgs_MT256x256x64_MI32x32x1_SN_GSU0_GSUC0_GSUWGMRR0_K1_LBSPPA0_LBSPPB0_LPA0_LPB0_MIWT4_4_SU0_SUM0_SUS64_VWA4_VWB4_WGM8_WGMXCC1_WGMXCCGn1
    SolutionIndex: 9
    SolutionNameMin: Cijk_Ailk_Bjlk_F8SS_BH_Bias_HAS_SAB_SAV_UserArgs_MT256x256x64_MI32x32x1_SN_GSU0_GSUC0_GSUWGMRR0_K1_LBSPPA0_LBSPPB0_LPA0_LPB0_MIWT4_4_SU0_SUM0_SUS64_VWA4_VWB4_WGM8_WGMXCC1_WGMXCCGn1
    SolutionIndex: 10
    SolutionNameMin: Cijk_Ailk_Bjlk_F8SS_BH_Bias_HAS_SAB_SAV_UserArgs_MT256x256x64_MI32x32x1_SN_GSU0_GSUC0_GSUWGMRR0_K1_LBSPPA0_LBSPPB0_LPA0_LPB0_MIWT4_4_SU0_SUM0_SUS64_VWA4_VWB4_WGM8_WGMXCC1_WGMXCCGn1
    SolutionIndex: 11
    SolutionNameMin: Cijk_Ailk_Bjlk_F8SS_BH_Bias_HAS_SAB_SAV_UserArgs_MT128x256x64_MI32x32x1_SN_GSU0_GSUC0_GSUWGMRR0_K1_LBSPPA0_LBSPPB0_LPA0_LPB0_MIWT2_4_SU0_SUM0_SUS64_VWA2_VWB4_WGM8_WGMXCC1_WGMXCCGn1
    SolutionIndex: 12
    SolutionNameMin: Cijk_Ailk_Bjlk_F8SS_BH_Bias_HAS_SAB_SAV_UserArgs_MT128x256x64_MI32x32x1_SN_GSU0_GSUC0_GSUWGMRR0_K1_LBSPPA0_LBSPPB0_LPA0_LPB0_MIWT2_4_SU0_SUM0_SUS64_VWA2_VWB4_WGM8_WGMXCC1_WGMXCCGn1
    SolutionIndex: 13
    SolutionNameMin: Cijk_Ailk_Bjlk_F8SS_BH_Bias_HAS_SAB_SAV_UserArgs_MT128x256x64_MI32x32x1_SN_GSU0_GSUC0_GSUWGMRR0_K1_LBSPPA0_LBSPPB0_LPA0_LPB0_MIWT2_4_SU0_SUM0_SUS64_VWA2_VWB4_WGM8_WGMXCC1_WGMXCCGn1
    SolutionIndex: 14
    SolutionNameMin: Cijk_Ailk_Bjlk_F8SS_BH_Bias_HAS_SAB_SAV_UserArgs_MT256x128x64_MI32x32x1_SN_GSU0_GSUC0_GSUWGMRR0_K1_LBSPPA0_LBSPPB0_LPA0_LPB0_MIWT4_2_SU0_SUM0_SUS64_VWA4_VWB2_WGM8_WGMXCC1_WGMXCCGn1
    SolutionIndex: 15
    SolutionNameMin: Cijk_Ailk_Bjlk_F8SS_BH_Bias_HAS_SAB_SAV_UserArgs_MT256x128x64_MI32x32x1_SN_GSU0_GSUC0_GSUWGMRR0_K1_LBSPPA0_LBSPPB0_LPA0_LPB0_MIWT4_2_SU0_SUM0_SUS64_VWA4_VWB2_WGM8_WGMXCC1_WGMXCCGn1
    SolutionIndex: 16
    SolutionNameMin: Cijk_Ailk_Bjlk_F8SS_BH_Bias_HAS_SAB_SAV_UserArgs_MT256x128x64_MI32x32x1_SN_GSU0_GSUC0_GSUWGMRR0_K1_LBSPPA0_LBSPPB0_LPA0_LPB0_MIWT4_2_SU0_SUM0_SUS64_VWA4_VWB2_WGM8_WGMXCC1_WGMXCCGn1
    SolutionIndex: 17
    SolutionNameMin: Cijk_Ailk_Bjlk_F8SS_BH_Bias_HAS_SAB_SAV_UserArgs_MT256x128x64_MI32x32x1_SN_GSU0_GSUC0_GSUWGMRR0_K1_LBSPPA0_LBSPPB0_LPA0_LPB0_MIWT4_2_SU0_SUM0_SUS64_VWA4_VWB2_WGM8_WGMXCC1_WGMXCCGn1
    SolutionIndex: 18
    SolutionNameMin: Cijk_Ailk_Bjlk_F8SS_BH_Bias_HAS_SAB_SAV_UserArgs_MT256x128x64_MI32x32x1_SN_GSU0_GSUC0_GSUWGMRR0_K1_LBSPPA0_LBSPPB0_LPA0_LPB0_MIWT4_2_SU0_SUM0_SUS64_VWA4_VWB2_WGM8_WGMXCC1_WGMXCCGn1
    SolutionIndex: 19
    SolutionNameMin: Cijk_Ailk_Bjlk_F8SS_BH_Bias_HAS_SAB_SAV_UserArgs_MT256x128x64_MI32x32x1_SN_GSU0_GSUC0_GSUWGMRR0_K1_LBSPPA0_LBSPPB0_LPA0_LPB0_MIWT4_2_SU0_SUM0_SUS64_VWA4_VWB2_WGM8_WGMXCC1_WGMXCCGn1
    SolutionIndex: 20
    SolutionNameMin: Cijk_Ailk_Bjlk_F8SS_BH_Bias_HAS_SAB_SAV_UserArgs_MT256x128x64_MI32x32x1_SN_GSU0_GSUC0_GSUWGMRR0_K1_LBSPPA0_LBSPPB0_LPA0_LPB0_MIWT4_2_SU0_SUM0_SUS64_VWA4_VWB2_WGM8_WGMXCC1_WGMXCCGn1
    SolutionIndex: 21
    SolutionNameMin: Cijk_Ailk_Bjlk_F8SS_BH_Bias_HAS_SAB_SAV_UserArgs_MT256x128x64_MI32x32x1_SN_GSU0_GSUC0_GSUWGMRR0_K1_LBSPPA0_LBSPPB0_LPA0_LPB0_MIWT4_2_SU0_SUM0_SUS64_VWA4_VWB2_WGM8_WGMXCC1_WGMXCCGn1
    SolutionIndex: 22
    SolutionNameMin: Cijk_Ailk_Bjlk_F8SS_BH_Bias_HAS_SAB_SAV_UserArgs_MT256x128x64_MI32x32x1_SN_GSU0_GSUC0_GSUWGMRR0_K1_LBSPPA0_LBSPPB0_LPA0_LPB0_MIWT4_2_SU0_SUM0_SUS64_VWA4_VWB2_WGM8_WGMXCC1_WGMXCCGn1
    SolutionIndex: 23
    SolutionNameMin: Cijk_Ailk_Bjlk_F8SS_BH_Bias_HAS_SAB_SAV_UserArgs_MT128x128x64_MI32x32x1_SN_GSU0_GSUC0_GSUWGMRR0_K1_LBSPPA0_LBSPPB0_LPA0_LPB0_MIWT2_2_SU0_SUM0_SUS64_VWA2_VWB2_WGM8_WGMXCC1_WGMXCCGn1
    SolutionIndex: 24
    SolutionNameMin: Cijk_Ailk_Bjlk_F8SS_BH_Bias_HAS_SAB_SAV_UserArgs_MT128x128x64_MI32x32x1_SN_GSU0_GSUC0_GSUWGMRR0_K1_LBSPPA0_LBSPPB0_LPA0_LPB0_MIWT2_2_SU0_SUM0_SUS64_VWA2_VWB2_WGM8_WGMXCC1_WGMXCCGn1
    SolutionIndex: 25
    SolutionNameMin: Cijk_Ailk_Bjlk_F8SS_BH_Bias_HAS_SAB_SAV_UserArgs_MT128x128x128_MI16x16x1_SN_GSU0_GSUC0_GSUWGMRR0_K1_LBSPPA2048_LBSPPB2048_LPA64_LPB64_MIWT4_4_SU0_SUM0_SUS128_VWA4_VWB4_WGM8_WGMXCC1_WGMXCCGn1
    SolutionIndex: 26
    SolutionNameMin: Cijk_Ailk_Bjlk_F8SS_BH_Bias_HAS_SAB_SAV_UserArgs_MT128x128x128_MI16x16x1_SN_GSU0_GSUC0_GSUWGMRR0_K1_LBSPPA2048_LBSPPB2048_LPA64_LPB64_MIWT4_4_SU0_SUM0_SUS128_VWA4_VWB4_WGM8_WGMXCC1_WGMXCCGn1
    SolutionIndex: 27
    SolutionNameMin: Cijk_Ailk_Bjlk_F8SS_BH_Bias_HAS_SAB_SAV_UserArgs_MT128x128x128_MI16x16x1_SN_GSU0_GSUC0_GSUWGMRR0_K1_LBSPPA2048_LBSPPB2048_LPA64_LPB64_MIWT4_4_SU0_SUM0_SUS128_VWA4_VWB4_WGM8_WGMXCC1_WGMXCCGn1
    SolutionIndex: 28
    SolutionNameMin: Cijk_Ailk_Bjlk_F8SS_BH_Bias_HAS_SAB_SAV_UserArgs_MT64x128x128_MI16x16x1_SN_GSU0_GSUC0_GSUWGMRR0_K1_LBSPPA1024_LBSPPB2048_LPA32_LPB64_MIWT2_4_SU0_SUM0_SUS128_VWA2_VWB4_WGM8_WGMXCC1_WGMXCCGn1
    SolutionIndex: 29
    SolutionNameMin: Cijk_Ailk_Bjlk_F8SS_BH_Bias_HAS_SAB_SAV_UserArgs_MT64x128x128_MI16x16x1_SN_GSU0_GSUC0_GSUWGMRR0_K1_LBSPPA1024_LBSPPB2048_LPA32_LPB64_MIWT2_4_SU0_SUM0_SUS128_VWA2_VWB4_WGM8_WGMXCC1_WGMXCCGn1
    SolutionIndex: 30
    SolutionNameMin: Cijk_Ailk_Bjlk_F8SS_BH_Bias_HAS_SAB_SAV_UserArgs_MT64x128x128_MI16x16x1_SN_GSU0_GSUC0_GSUWGMRR0_K1_LBSPPA1024_LBSPPB2048_LPA32_LPB64_MIWT2_4_SU0_SUM0_SUS128_VWA2_VWB4_WGM8_WGMXCC1_WGMXCCGn1
    SolutionIndex: 31
    SolutionNameMin: Cijk_Ailk_Bjlk_F8SS_BH_Bias_HAS_SAB_SAV_UserArgs_MT128x64x128_MI16x16x1_SN_GSU0_GSUC0_GSUWGMRR0_K1_LBSPPA2048_LBSPPB1024_LPA64_LPB32_MIWT4_2_SU0_SUM0_SUS128_VWA4_VWB2_WGM8_WGMXCC1_WGMXCCGn1
    SolutionIndex: 32
    SolutionNameMin: Cijk_Ailk_Bjlk_F8SS_BH_Bias_HAS_SAB_SAV_UserArgs_MT128x64x128_MI16x16x1_SN_GSU0_GSUC0_GSUWGMRR0_K1_LBSPPA2048_LBSPPB1024_LPA64_LPB32_MIWT4_2_SU0_SUM0_SUS128_VWA4_VWB2_WGM8_WGMXCC1_WGMXCCGn1
    SolutionIndex: 33
    SolutionNameMin: Cijk_Ailk_Bjlk_F8SS_BH_Bias_HAS_SAB_SAV_UserArgs_MT128x64x128_MI16x16x1_SN_GSU0_GSUC0_GSUWGMRR0_K1_LBSPPA2048_LBSPPB1024_LPA64_LPB32_MIWT4_2_SU0_SUM0_SUS128_VWA4_VWB2_WGM8_WGMXCC1_WGMXCCGn1
    SolutionIndex: 34
    SolutionNameMin: Cijk_Ailk_Bjlk_F8SS_BH_Bias_HAS_SAB_SAV_UserArgs_MT128x64x128_MI16x16x1_SN_GSU0_GSUC0_GSUWGMRR0_K1_LBSPPA2048_LBSPPB1024_LPA64_LPB32_MIWT4_2_SU0_SUM0_SUS128_VWA4_VWB2_WGM8_WGMXCC1_WGMXCCGn1
    SolutionIndex: 35
    SolutionNameMin: Cijk_Ailk_Bjlk_F8SS_BH_Bias_HAS_SAB_SAV_UserArgs_MT128x32x128_MI16x16x1_SN_GSU0_GSUC0_GSUWGMRR0_K1_LBSPPA2048_LBSPPB512_LPA64_LPB16_MIWT4_1_SU0_SUM0_SUS128_VWA4_VWB1_WGM8_WGMXCC1_WGMXCCGn1
    SolutionIndex: 36
    SolutionNameMin: Cijk_Ailk_Bjlk_F8SS_BH_Bias_HAS_SAB_SAV_UserArgs_MT128x32x128_MI16x16x1_SN_GSU0_GSUC0_GSUWGMRR0_K1_LBSPPA2048_LBSPPB512_LPA64_LPB16_MIWT4_1_SU0_SUM0_SUS128_VWA4_VWB1_WGM8_WGMXCC1_WGMXCCGn1
    SolutionIndex: 37
    SolutionNameMin: Cijk_Ailk_Bjlk_F8SS_BH_Bias_HAS_SAB_SAV_UserArgs_MT64x64x128_MI16x16x1_SN_GSU0_GSUC0_GSUWGMRR0_K1_LBSPPA512_LBSPPB512_LPA32_LPB32_MIWT2_2_SU0_SUM0_SUS128_VWA2_VWB2_WGM8_WGMXCC1_WGMXCCGn1
    SolutionIndex: 38
    SolutionNameMin: Cijk_Ailk_Bjlk_F8SS_BH_Bias_HAS_SAB_SAV_UserArgs_MT64x64x128_MI16x16x1_SN_GSU0_GSUC0_GSUWGMRR0_K1_LBSPPA512_LBSPPB512_LPA32_LPB32_MIWT2_2_SU0_SUM0_SUS128_VWA2_VWB2_WGM8_WGMXCC1_WGMXCCGn1
    SolutionIndex: 39
    SolutionNameMin: Cijk_Ailk_Bjlk_F8SS_BH_Bias_HAS_SAB_SAV_UserArgs_MT64x64x128_MI16x16x1_SN_GSU0_GSUC0_GSUWGMRR0_K1_LBSPPA512_LBSPPB512_LPA32_LPB32_MIWT2_2_SU0_SUM0_SUS128_VWA2_VWB2_WGM8_WGMXCC1_WGMXCCGn1
    SolutionIndex: 40
    SolutionNameMin: Cijk_Ailk_Bjlk_F8SS_BH_Bias_HAS_SAB_SAV_UserArgs_MT64x64x128_MI16x16x1_SN_GSU0_GSUC0_GSUWGMRR0_K1_LBSPPA512_LBSPPB512_LPA32_LPB32_MIWT2_2_SU0_SUM0_SUS128_VWA2_VWB2_WGM8_WGMXCC1_WGMXCCGn1
    SolutionIndex: 41
    SolutionNameMin: Cijk_Ailk_Bjlk_F8SS_BH_Bias_HAS_SAB_SAV_UserArgs_MT64x64x128_MI16x16x1_SN_GSU0_GSUC0_GSUWGMRR0_K1_LBSPPA512_LBSPPB512_LPA32_LPB32_MIWT2_2_SU0_SUM0_SUS128_VWA2_VWB2_WGM8_WGMXCC1_WGMXCCGn1
    SolutionIndex: 42
    SolutionNameMin: Cijk_Ailk_Bjlk_F8SS_BH_Bias_HAS_SAB_SAV_UserArgs_MT64x64x128_MI16x16x1_SN_GSU0_GSUC0_GSUWGMRR0_K1_LBSPPA512_LBSPPB512_LPA32_LPB32_MIWT2_2_SU0_SUM0_SUS128_VWA2_VWB2_WGM8_WGMXCC1_WGMXCCGn1
    SolutionIndex: 43
    SolutionNameMin: Cijk_Ailk_Bjlk_F8SS_BH_Bias_HAS_SAB_SAV_UserArgs_MT64x64x128_MI16x16x1_SN_GSU0_GSUC0_GSUWGMRR0_K1_LBSPPA1024_LBSPPB1024_LPA32_LPB32_MIWT2_2_SU0_SUM0_SUS128_VWA2_VWB2_WGM8_WGMXCC1_WGMXCCGn1
    SolutionIndex: 44
    SolutionNameMin: Cijk_Ailk_Bjlk_F8SS_BH_Bias_HAS_SAB_SAV_UserArgs_MT64x64x128_MI16x16x1_SN_GSU0_GSUC0_GSUWGMRR0_K1_LBSPPA1024_LBSPPB1024_LPA32_LPB32_MIWT2_2_SU0_SUM0_SUS128_VWA2_VWB2_WGM8_WGMXCC1_WGMXCCGn1
    SolutionIndex: 45
    SolutionNameMin: Cijk_Ailk_Bjlk_F8SS_BH_Bias_HAS_SAB_SAV_UserArgs_MT64x64x128_MI16x16x1_SN_GSU0_GSUC0_GSUWGMRR0_K1_LBSPPA1024_LBSPPB1024_LPA32_LPB32_MIWT2_2_SU0_SUM0_SUS128_VWA2_VWB2_WGM8_WGMXCC1_WGMXCCGn1
    SolutionIndex: 46
    SolutionNameMin: Cijk_Ailk_Bjlk_F8SS_BH_Bias_HAS_SAB_SAV_UserArgs_MT64x64x128_MI16x16x1_SN_GSU0_GSUC0_GSUWGMRR0_K1_LBSPPA1024_LBSPPB1024_LPA32_LPB32_MIWT2_2_SU0_SUM0_SUS128_VWA2_VWB2_WGM8_WGMXCC1_WGMXCCGn1
    SolutionIndex: 47
    SolutionNameMin: Cijk_Ailk_Bjlk_F8SS_BH_Bias_HAS_SAB_SAV_UserArgs_MT32x64x128_MI16x16x1_SN_GSU0_GSUC0_GSUWGMRR0_K1_LBSPPA256_LBSPPB512_LPA16_LPB32_MIWT1_2_SU0_SUM0_SUS128_VWA1_VWB2_WGM8_WGMXCC1_WGMXCCGn1
    SolutionIndex: 48
    SolutionNameMin: Cijk_Ailk_Bjlk_F8SS_BH_Bias_HAS_SAB_SAV_UserArgs_MT32x64x128_MI16x16x1_SN_GSU0_GSUC0_GSUWGMRR0_K1_LBSPPA512_LBSPPB1024_LPA16_LPB32_MIWT1_2_SU0_SUM0_SUS128_VWA1_VWB2_WGM8_WGMXCC1_WGMXCCGn1
    SolutionIndex: 49
    SolutionNameMin: Cijk_Ailk_Bjlk_F8SS_BH_Bias_HAS_SAB_SAV_UserArgs_MT32x64x128_MI16x16x1_SN_GSU0_GSUC0_GSUWGMRR0_K1_LBSPPA512_LBSPPB1024_LPA16_LPB32_MIWT1_2_SU0_SUM0_SUS128_VWA1_VWB2_WGM8_WGMXCC1_WGMXCCGn1
    SolutionIndex: 50
    SolutionNameMin: Cijk_Ailk_Bjlk_F8SS_BH_Bias_HAS_SAB_SAV_UserArgs_MT32x64x128_MI16x16x1_SN_GSU0_GSUC0_GSUWGMRR0_K1_LBSPPA512_LBSPPB1024_LPA16_LPB32_MIWT1_2_SU0_SUM0_SUS128_VWA1_VWB2_WGM8_WGMXCC1_WGMXCCGn1
    SolutionIndex: 51
    SolutionNameMin: Cijk_Ailk_Bjlk_F8SS_BH_Bias_HAS_SAB_SAV_UserArgs_MT32x64x128_MI16x16x1_SN_GSU0_GSUC0_GSUWGMRR0_K1_LBSPPA512_LBSPPB1024_LPA16_LPB32_MIWT1_2_SU0_SUM0_SUS128_VWA1_VWB2_WGM8_WGMXCC1_WGMXCCGn1
    SolutionIndex: 52
    SolutionNameMin: Cijk_Ailk_Bjlk_F8SS_BH_Bias_HAS_SAB_SAV_UserArgs_MT64x32x128_MI16x16x1_SN_GSU0_GSUC0_GSUWGMRR0_K1_LBSPPA512_LBSPPB256_LPA32_LPB16_MIWT2_1_SU0_SUM0_SUS128_VWA2_VWB1_WGM8_WGMXCC1_WGMXCCGn1
    SolutionIndex: 53
    SolutionNameMin: Cijk_Ailk_Bjlk_F8SS_BH_Bias_HAS_SAB_SAV_UserArgs_MT64x32x128_MI16x16x1_SN_GSU0_GSUC0_GSUWGMRR0_K1_LBSPPA512_LBSPPB256_LPA32_LPB16_MIWT2_1_SU0_SUM0_SUS128_VWA2_VWB1_WGM8_WGMXCC1_WGMXCCGn1
    SolutionIndex: 54
    SolutionNameMin: Cijk_Ailk_Bjlk_F8SS_BH_Bias_HAS_SAB_SAV_UserArgs_MT64x32x128_MI16x16x1_SN_GSU0_GSUC0_GSUWGMRR0_K1_LBSPPA1024_LBSPPB512_LPA32_LPB16_MIWT2_1_SU0_SUM0_SUS128_VWA2_VWB1_WGM8_WGMXCC1_WGMXCCGn1
    SolutionIndex: 55
    SolutionNameMin: Cijk_Ailk_Bjlk_F8SS_BH_Bias_HAS_SAB_SAV_UserArgs_MT64x32x128_MI16x16x1_SN_GSU0_GSUC0_GSUWGMRR0_K1_LBSPPA1024_LBSPPB512_LPA32_LPB16_MIWT2_1_SU0_SUM0_SUS128_VWA2_VWB1_WGM8_WGMXCC1_WGMXCCGn1
    SolutionIndex: 56
    SolutionNameMin: Cijk_Ailk_Bjlk_F8SS_BH_Bias_HAS_SAB_SAV_UserArgs_MT32x32x128_MI16x16x1_SN_GSU0_GSUC0_GSUWGMRR0_K1_LBSPPA128_LBSPPB128_LPA16_LPB16_MIWT1_1_SU0_SUM0_SUS128_VWA1_VWB1_WGM8_WGMXCC1_WGMXCCGn1
    SolutionIndex: 57
    SolutionNameMin: Cijk_Ailk_Bjlk_F8SS_BH_Bias_HAS_SAB_SAV_UserArgs_MT32x32x128_MI16x16x1_SN_GSU0_GSUC0_GSUWGMRR0_K1_LBSPPA128_LBSPPB128_LPA16_LPB16_MIWT1_1_SU0_SUM0_SUS128_VWA1_VWB1_WGM8_WGMXCC1_WGMXCCGn1
    SolutionIndex: 58
    SolutionNameMin: Cijk_Ailk_Bjlk_F8SS_BH_Bias_HAS_SAB_SAV_UserArgs_MT32x32x128_MI16x16x1_SN_GSU0_GSUC0_GSUWGMRR0_K1_LBSPPA128_LBSPPB128_LPA16_LPB16_MIWT1_1_SU0_SUM0_SUS128_VWA1_VWB1_WGM8_WGMXCC1_WGMXCCGn1
    SolutionIndex: 59
    SolutionNameMin: Cijk_Ailk_Bjlk_F8SS_BH_Bias_HAS_SAB_SAV_UserArgs_MT32x32x128_MI16x16x1_SN_GSU0_GSUC0_GSUWGMRR0_K1_LBSPPA256_LBSPPB256_LPA16_LPB16_MIWT1_1_SU0_SUM0_SUS128_VWA1_VWB1_WGM8_WGMXCC1_WGMXCCGn1
    SolutionIndex: 60
    SolutionNameMin: Cijk_Ailk_Bjlk_F8SS_BH_Bias_HAS_SAB_SAV_UserArgs_MT32x32x128_MI16x16x1_SN_GSU0_GSUC0_GSUWGMRR0_K1_LBSPPA256_LBSPPB256_LPA16_LPB16_MIWT1_1_SU0_SUM0_SUS128_VWA1_VWB1_WGM8_WGMXCC1_WGMXCCGn1
    SolutionIndex: 61
    SolutionNameMin: Cijk_Ailk_Bjlk_F8SS_BH_Bias_HAS_SAB_SAV_UserArgs_MT32x32x128_MI16x16x1_SN_GSU0_GSUC0_GSUWGMRR0_K1_LBSPPA256_LBSPPB256_LPA16_LPB16_MIWT1_1_SU0_SUM0_SUS128_VWA1_VWB1_WGM8_WGMXCC1_WGMXCCGn1
    SolutionIndex: 62
    SolutionNameMin: Cijk_Ailk_Bjlk_F8SS_BH_Bias_HAS_SAB_SAV_UserArgs_MT32x32x128_MI16x16x1_SN_GSU0_GSUC0_GSUWGMRR0_K1_LBSPPA512_LBSPPB512_LPA16_LPB16_MIWT1_1_SU0_SUM0_SUS128_VWA1_VWB1_WGM8_WGMXCC1_WGMXCCGn1
    SolutionIndex: 63
    SolutionNameMin: Cijk_Ailk_Bjlk_F8SS_BH_Bias_HAS_SAB_SAV_UserArgs_MT32x32x128_MI16x16x1_SN_GSU0_GSUC0_GSUWGMRR0_K1_LBSPPA512_LBSPPB512_LPA16_LPB16_MIWT1_1_SU0_SUM0_SUS128_VWA1_VWB1_WGM8_WGMXCC1_WGMXCCGn1
    SolutionIndex: 64
    SolutionNameMin: Cijk_Ailk_Bjlk_F8SS_BH_Bias_HAS_SAB_SAV_UserArgs_MT32x32x128_MI16x16x1_SN_GSU0_GSUC0_GSUWGMRR0_K1_LBSPPA512_LBSPPB512_LPA16_LPB16_MIWT1_1_SU0_SUM0_SUS128_VWA1_VWB1_WGM8_WGMXCC1_WGMXCCGn1
    SolutionIndex: 65
    SolutionNameMin: Cijk_Ailk_Bjlk_F8SS_BH_Bias_HAS_SAB_SAV_UserArgs_MT32x32x128_MI16x16x1_SN_GSU0_GSUC0_GSUWGMRR0_K1_LBSPPA512_LBSPPB512_LPA16_LPB16_MIWT1_1_SU0_SUM0_SUS128_VWA1_VWB1_WGM8_WGMXCC1_WGMXCCGn1
    SolutionIndex: 66
    SolutionNameMin: Cijk_Ailk_Bjlk_F8SS_BH_Bias_HAS_SAB_SAV_UserArgs_MT256x128x128_MI32x32x1_SN_GSU0_GSUC0_GSUWGMRR0_K1_LBSPPA0_LBSPPB0_LPA0_LPB0_MIWT4_2_SU0_SUM0_SUS128_VWA4_VWB2_WGM8_WGMXCC1_WGMXCCGn1
    SolutionIndex: 67
    SolutionNameMin: Cijk_Ailk_Bjlk_F8SS_BH_Bias_HAS_SAB_SAV_UserArgs_MT256x128x128_MI32x32x1_SN_GSU0_GSUC0_GSUWGMRR0_K1_LBSPPA0_LBSPPB0_LPA0_LPB0_MIWT4_2_SU0_SUM0_SUS128_VWA4_VWB2_WGM8_WGMXCC1_WGMXCCGn1
    SolutionIndex: 68
    SolutionNameMin: Cijk_Ailk_Bjlk_F8SS_BH_Bias_HAS_SAB_SAV_UserArgs_MT256x128x128_MI32x32x1_SN_GSU0_GSUC0_GSUWGMRR0_K1_LBSPPA0_LBSPPB0_LPA0_LPB0_MIWT4_2_SU0_SUM0_SUS128_VWA4_VWB2_WGM8_WGMXCC1_WGMXCCGn1
    SolutionIndex: 69
    SolutionNameMin: Cijk_Ailk_Bjlk_F8SS_BH_Bias_HAS_SAB_SAV_UserArgs_MT256x128x128_MI32x32x1_SN_GSU0_GSUC0_GSUWGMRR0_K1_LBSPPA0_LBSPPB0_LPA0_LPB0_MIWT4_2_SU0_SUM0_SUS128_VWA4_VWB2_WGM8_WGMXCC1_WGMXCCGn1
    SolutionIndex: 70
    SolutionNameMin: Cijk_Ailk_Bjlk_F8SS_BH_Bias_HAS_SAB_SAV_UserArgs_MT256x128x128_MI32x32x1_SN_GSU0_GSUC0_GSUWGMRR0_K1_LBSPPA0_LBSPPB0_LPA0_LPB0_MIWT4_2_SU0_SUM0_SUS128_VWA4_VWB2_WGM8_WGMXCC1_WGMXCCGn1
    SolutionIndex: 71
    SolutionNameMin: Cijk_Ailk_Bjlk_F8SS_BH_Bias_HAS_SAB_SAV_UserArgs_MT64x64x256_MI16x16x1_SN_GSU0_GSUC0_GSUWGMRR0_K1_LBSPPA512_LBSPPB512_LPA32_LPB32_MIWT2_2_SU0_SUM0_SUS256_VWA2_VWB2_WGM8_WGMXCC1_WGMXCCGn1
    SolutionIndex: 72
    SolutionNameMin: Cijk_Ailk_Bjlk_F8SS_BH_Bias_HAS_SAB_SAV_UserArgs_MT32x64x256_MI16x16x1_SN_GSU0_GSUC0_GSUWGMRR0_K1_LBSPPA256_LBSPPB512_LPA16_LPB32_MIWT1_2_SU0_SUM0_SUS256_VWA1_VWB2_WGM8_WGMXCC1_WGMXCCGn1
    SolutionIndex: 73
    SolutionNameMin: Cijk_Ailk_Bjlk_F8SS_BH_Bias_HAS_SAB_SAV_UserArgs_MT32x64x256_MI16x16x1_SN_GSU0_GSUC0_GSUWGMRR0_K1_LBSPPA256_LBSPPB512_LPA16_LPB32_MIWT1_2_SU0_SUM0_SUS256_VWA1_VWB2_WGM8_WGMXCC1_WGMXCCGn1
    SolutionIndex: 74
    SolutionNameMin: Cijk_Ailk_Bjlk_F8SS_BH_Bias_HAS_SAB_SAV_UserArgs_MT32x64x256_MI16x16x1_SN_GSU0_GSUC0_GSUWGMRR0_K1_LBSPPA512_LBSPPB1024_LPA16_LPB32_MIWT1_2_SU0_SUM0_SUS256_VWA1_VWB2_WGM8_WGMXCC1_WGMXCCGn1
    SolutionIndex: 75
    SolutionNameMin: Cijk_Ailk_Bjlk_F8SS_BH_Bias_HAS_SAB_SAV_UserArgs_MT64x32x256_MI16x16x1_SN_GSU0_GSUC0_GSUWGMRR0_K1_LBSPPA512_LBSPPB256_LPA32_LPB16_MIWT2_1_SU0_SUM0_SUS256_VWA2_VWB1_WGM8_WGMXCC1_WGMXCCGn1
    SolutionIndex: 76
    SolutionNameMin: Cijk_Ailk_Bjlk_F8SS_BH_Bias_HAS_SAB_SAV_UserArgs_MT64x32x256_MI16x16x1_SN_GSU0_GSUC0_GSUWGMRR0_K1_LBSPPA512_LBSPPB256_LPA32_LPB16_MIWT2_1_SU0_SUM0_SUS256_VWA2_VWB1_WGM8_WGMXCC1_WGMXCCGn1
    SolutionIndex: 77
    SolutionNameMin: Cijk_Ailk_Bjlk_F8SS_BH_Bias_HAS_SAB_SAV_UserArgs_MT64x32x256_MI16x16x1_SN_GSU0_GSUC0_GSUWGMRR0_K1_LBSPPA1024_LBSPPB512_LPA32_LPB16_MIWT2_1_SU0_SUM0_SUS256_VWA2_VWB1_WGM8_WGMXCC1_WGMXCCGn1
    SolutionIndex: 78
    SolutionNameMin: Cijk_Ailk_Bjlk_F8SS_BH_Bias_HAS_SAB_SAV_UserArgs_MT32x32x256_MI16x16x1_SN_GSU0_GSUC0_GSUWGMRR0_K1_LBSPPA128_LBSPPB128_LPA16_LPB16_MIWT1_1_SU0_SUM0_SUS256_VWA1_VWB1_WGM8_WGMXCC1_WGMXCCGn1
    SolutionIndex: 79
    SolutionNameMin: Cijk_Ailk_Bjlk_F8SS_BH_Bias_HAS_SAB_SAV_UserArgs_MT32x32x256_MI16x16x1_SN_GSU0_GSUC0_GSUWGMRR0_K1_LBSPPA128_LBSPPB128_LPA16_LPB16_MIWT1_1_SU0_SUM0_SUS256_VWA1_VWB1_WGM8_WGMXCC1_WGMXCCGn1
    SolutionIndex: 80
    SolutionNameMin: Cijk_Ailk_Bjlk_F8SS_BH_Bias_HAS_SAB_SAV_UserArgs_MT32x32x256_MI16x16x1_SN_GSU0_GSUC0_GSUWGMRR0_K1_LBSPPA128_LBSPPB128_LPA16_LPB16_MIWT1_1_SU0_SUM0_SUS256_VWA1_VWB1_WGM8_WGMXCC1_WGMXCCGn1
    SolutionIndex: 81
    SolutionNameMin: Cijk_Ailk_Bjlk_F8SS_BH_Bias_HAS_SAB_SAV_UserArgs_MT32x32x256_MI16x16x1_SN_GSU0_GSUC0_GSUWGMRR0_K1_LBSPPA256_LBSPPB256_LPA16_LPB16_MIWT1_1_SU0_SUM0_SUS256_VWA1_VWB1_WGM8_WGMXCC1_WGMXCCGn1
    SolutionIndex: 82
    SolutionNameMin: Cijk_Ailk_Bjlk_F8SS_BH_Bias_HAS_SAB_SAV_UserArgs_MT32x32x256_MI16x16x1_SN_GSU0_GSUC0_GSUWGMRR0_K1_LBSPPA256_LBSPPB256_LPA16_LPB16_MIWT1_1_SU0_SUM0_SUS256_VWA1_VWB1_WGM8_WGMXCC1_WGMXCCGn1
    SolutionIndex: 83
    SolutionNameMin: Cijk_Ailk_Bjlk_F8SS_BH_Bias_HAS_SAB_SAV_UserArgs_MT32x32x256_MI16x16x1_SN_GSU0_GSUC0_GSUWGMRR0_K1_LBSPPA512_LBSPPB512_LPA16_LPB16_MIWT1_1_SU0_SUM0_SUS256_VWA1_VWB1_WGM8_WGMXCC1_WGMXCCGn1
    SolutionIndex: 84
    SolutionNameMin: Cijk_Ailk_Bjlk_F8SS_BH_Bias_HAS_SAB_SAV_UserArgs_MT32x32x256_MI16x16x1_SN_GSU0_GSUC0_GSUWGMRR0_K1_LBSPPA512_LBSPPB512_LPA16_LPB16_MIWT1_1_SU0_SUM0_SUS256_VWA1_VWB1_WGM8_WGMXCC1_WGMXCCGn1
    SolutionIndex: 85
    SolutionNameMin: Cijk_Ailk_Bjlk_F8SS_BH_Bias_HAS_SAB_SAV_UserArgs_MT32x32x256_MI16x16x1_SN_GSU0_GSUC0_GSUWGMRR0_K1_LBSPPA512_LBSPPB512_LPA16_LPB16_MIWT1_1_SU0_SUM0_SUS256_VWA1_VWB1_WGM8_WGMXCC1_WGMXCCGn1
    SolutionIndex: 86
    SolutionNameMin: Cijk_Ailk_Bjlk_F8SS_BH_Bias_HAS_SAB_SAV_UserArgs_MT32x32x128_MI16x16x1_SN_GSU0_GSUC0_GSUWGMRR0_K1_LBSPPA256_LBSPPB256_LPA16_LPB16_MIWT1_1_SU32_SUM0_SUS256_VWA1_VWB1_WGM8_WGMXCC1_WGMXCCGn1
- - - [128, 128, 1, 128, 128, 128, 128, 128]
    - [59, 0.39]
  - - [128, 128, 1, 256, 128, 128, 128, 128]
    - [63, 0.69]
  - - [128, 128, 1, 512, 128, 128, 128, 128]
    - [57, 1.16]
  - - [128, 128, 1, 1024, 128, 128, 128, 128]
    - [65, 1.78]
  - - [128, 128, 1, 2048, 128, 128, 128, 128]
    - [83, 2.46]
  - - [128, 128, 1, 4096, 128, 128, 128, 128]
    - [84, 3.12]
  - - [128, 128, 1, 8192, 128, 128, 128, 128]
    - [82, 3.6]
  - - [128, 256, 1, 128, 128, 128, 128, 256]
    - [63, 0.78]
  - - [128, 256, 1, 256, 128, 128, 128, 256]
    - [63, 1.37]
  - - [128, 256, 1, 512, 128, 128, 128, 256]
    - [59, 2.33]
  - - [128, 256, 1, 1024, 128, 128, 128, 256]
    - [83, 3.57]
  - - [128, 256, 1, 2048, 128, 128, 128, 256]
    - [81, 4.94]
  - - [128, 256, 1, 4096, 128, 128, 128, 256]
    - [82, 6.23]
  - - [128, 256, 1, 8192, 128, 128, 128, 256]
    - [79, 7.19]
  - - [128, 512, 1, 128, 128, 128, 128, 512]
    - [63, 1.52]
  - - [128, 512, 1, 256, 128, 128, 128, 512]
    - [63, 2.7]
  - - [128, 512, 1, 512, 128, 128, 128, 512]
    - [59, 4.56]
  - - [128, 512, 1, 1024, 128, 128, 128, 512]
    - [78, 7.07]
  - - [128, 512, 1, 2048, 128, 128, 128, 512]
    - [79, 9.9]
  - - [128, 512, 1, 4096, 128, 128, 128, 512]
    - [82, 12.51]
  - - [128, 512, 1, 8192, 128, 128, 128, 512]
    - [82, 14.31]
  - - [128, 1024, 1, 128, 128, 128, 128, 1024]
    - [59, 3.0]
  - - [128, 1024, 1, 256, 128, 128, 128, 1024]
    - [57, 5.29]
  - - [128, 1024, 1, 512, 128, 128, 128, 1024]
    - [57, 8.92]
  - - [128, 1024, 1, 1024, 128, 128, 128, 1024]
    - [79, 13.7]
  - - [128, 1024, 1, 2048, 128, 128, 128, 1024]
    - [82, 19.16]
  - - [128, 1024, 1, 4096, 128, 128, 128, 1024]
    - [82, 23.72]
  - - [128, 1024, 1, 8192, 128, 128, 128, 1024]
    - [82, 27.38]
  - - [128, 2048, 1, 128, 128, 128, 128, 2048]
    - [57, 5.71]
  - - [128, 2048, 1, 256, 128, 128, 128, 2048]
    - [57, 10.02]
  - - [128, 2048, 1, 512, 128, 128, 128, 2048]
    - [57, 17.04]
  - - [128, 2048, 1, 1024, 128, 128, 128, 2048]
    - [84, 25.93]
  - - [128, 2048, 1, 2048, 128, 128, 128, 2048]
    - [82, 36.51]
  - - [128, 2048, 1, 4096, 128, 128, 128, 2048]
    - [82, 45.5]
  - - [128, 2048, 1, 8192, 128, 128, 128, 2048]
    - [79, 52.55]
  - - [128, 4096, 1, 128, 128, 128, 128, 4096]
    - [54, 10.53]
  - - [128, 4096, 1, 256, 128, 128, 128, 4096]
    - [49, 18.68]
  - - [128, 4096, 1, 512, 128, 128, 128, 4096]
    - [55, 31.19]
  - - [128, 4096, 1, 1024, 128, 128, 128, 4096]
    - [51, 47.04]
  - - [128, 4096, 1, 2048, 128, 128, 128, 4096]
    - [73, 65.61]
  - - [128, 4096, 1, 4096, 128, 128, 128, 4096]
    - [76, 83.59]
  - - [128, 4096, 1, 8192, 128, 128, 128, 4096]
    - [75, 93.51]
  - - [128, 8192, 1, 128, 128, 128, 128, 8192]
    - [36, 18.37]
  - - [128, 8192, 1, 256, 128, 128, 128, 8192]
    - [39, 32.77]
  - - [128, 8192, 1, 512, 128, 128, 128, 8192]
    - [44, 55.74]
  - - [128, 8192, 1, 1024, 128, 128, 128, 8192]
    - [46, 84.69]
  - - [128, 8192, 1, 2048, 128, 128, 128, 8192]
    - [46, 114.88]
  - - [128, 8192, 1, 4096, 128, 128, 128, 8192]
    - [71, 142.39]
  - - [128, 8192, 1, 8192, 128, 128, 128, 8192]
    - [71, 156.65]
  - - [256, 128, 1, 128, 256, 256, 256, 128]
    - [57, 0.78]
  - - [256, 128, 1, 256, 256, 256, 256, 128]
    - [61, 1.36]
  - - [256, 128, 1, 512, 256, 256, 256, 128]
    - [57, 2.29]
  - - [256, 128, 1, 1024, 256, 256, 256, 128]
    - [79, 3.51]
  - - [256, 128, 1, 2048, 256, 256, 256, 128]
    - [82, 4.98]
  - - [256, 128, 1, 4096, 256, 256, 256, 128]
    - [79, 6.25]
  - - [256, 128, 1, 8192, 256, 256, 256, 128]
    - [79, 7.19]
  - - [256, 256, 1, 128, 256, 256, 256, 256]
    - [56, 1.52]
  - - [256, 256, 1, 256, 256, 256, 256, 256]
    - [56, 2.69]
  - - [256, 256, 1, 512, 256, 256, 256, 256]
    - [56, 4.55]
  - - [256, 256, 1, 1024, 256, 256, 256, 256]
    - [79, 7.09]
  - - [256, 256, 1, 2048, 256, 256, 256, 256]
    - [79, 9.9]
  - - [256, 256, 1, 4096, 256, 256, 256, 256]
    - [84, 12.53]
  - - [256, 256, 1, 8192, 256, 256, 256, 256]
    - [82, 14.31]
  - - [256, 512, 1, 128, 256, 256, 256, 512]
    - [56, 3.05]
  - - [256, 512, 1, 256, 256, 256, 256, 512]
    - [59, 5.32]
  - - [256, 512, 1, 512, 256, 256, 256, 512]
    - [59, 9.02]
  - - [256, 512, 1, 1024, 256, 256, 256, 512]
    - [82, 14.13]
  - - [256, 512, 1, 2048, 256, 256, 256, 512]
    - [84, 19.99]
  - - [256, 512, 1, 4096, 256, 256, 256, 512]
    - [82, 24.77]
  - - [256, 512, 1, 8192, 256, 256, 256, 512]
    - [84, 28.46]
  - - [256, 1024, 1, 128, 256, 256, 256, 1024]
    - [57, 5.8]
  - - [256, 1024, 1, 256, 256, 256, 256, 1024]
    - [63, 10.14]
  - - [256, 1024, 1, 512, 256, 256, 256, 1024]
    - [57, 17.28]
  - - [256, 1024, 1, 1024, 256, 256, 256, 1024]
    - [79, 26.64]
  - - [256, 1024, 1, 2048, 256, 256, 256, 1024]
    - [84, 37.62]
  - - [256, 1024, 1, 4096, 256, 256, 256, 1024]
    - [84, 46.26]
  - - [256, 1024, 1, 8192, 256, 256, 256, 1024]
    - [82, 52.88]
  - - [256, 2048, 1, 128, 256, 256, 256, 2048]
    - [47, 10.74]
  - - [256, 2048, 1, 256, 256, 256, 256, 2048]
    - [50, 18.76]
  - - [256, 2048, 1, 512, 256, 256, 256, 2048]
    - [47, 31.73]
  - - [256, 2048, 1, 1024, 256, 256, 256, 2048]
    - [72, 47.95]
  - - [256, 2048, 1, 2048, 256, 256, 256, 2048]
    - [74, 67.18]
  - - [256, 2048, 1, 4096, 256, 256, 256, 2048]
    - [77, 84.54]
  - - [256, 2048, 1, 8192, 256, 256, 256, 2048]
    - [76, 97.83]
  - - [256, 4096, 1, 128, 256, 256, 256, 4096]
    - [43, 18.46]
  - - [256, 4096, 1, 256, 256, 256, 256, 4096]
    - [37, 32.86]
  - - [256, 4096, 1, 512, 256, 256, 256, 4096]
    - [43, 55.7]
  - - [256, 4096, 1, 1024, 256, 256, 256, 4096]
    - [46, 85.14]
  - - [256, 4096, 1, 2048, 256, 256, 256, 4096]
    - [46, 115.24]
  - - [256, 4096, 1, 4096, 256, 256, 256, 4096]
    - [46, 141.8]
  - - [256, 4096, 1, 8192, 256, 256, 256, 4096]
    - [42, 155.05]
  - - [256, 8192, 1, 128, 256, 256, 256, 8192]
    - [31, 29.56]
  - - [256, 8192, 1, 256, 256, 256, 256, 8192]
    - [32, 53.15]
  - - [256, 8192, 1, 512, 256, 256, 256, 8192]
    - [34, 89.07]
  - - [256, 8192, 1, 1024, 256, 256, 256, 8192]
    - [34, 134.69]
  - - [256, 8192, 1, 2048, 256, 256, 256, 8192]
    - [34, 181.65]
  - - [256, 8192, 1, 4096, 256, 256, 256, 8192]
    - [34, 221.46]
  - - [256, 8192, 1, 8192, 256, 256, 256, 8192]
    - [34, 232.74]
  - - [512, 128, 1, 128, 512, 512, 512, 128]
    - [58, 1.51]
  - - [512, 128, 1, 256, 512, 512, 512, 128]
    - [57, 2.67]
  - - [512, 128, 1, 512, 512, 512, 512, 128]
    - [56, 4.55]
  - - [512, 128, 1, 1024, 512, 512, 512, 128]
    - [82, 7.12]
  - - [512, 128, 1, 2048, 512, 512, 512, 128]
    - [82, 9.89]
  - - [512, 128, 1, 4096, 512, 512, 512, 128]
    - [84, 12.39]
  - - [512, 128, 1, 8192, 512, 512, 512, 128]
    - [80, 14.25]
  - - [512, 256, 1, 128, 512, 512, 512, 256]
    - [56, 3.02]
  - - [512, 256, 1, 256, 512, 512, 512, 256]
    - [64, 5.25]
  - - [512, 256, 1, 512, 512, 512, 512, 256]
    - [64, 9.0]
  - - [512, 256, 1, 1024, 512, 512, 512, 256]
    - [79, 14.1]
  - - [512, 256, 1, 2048, 512, 512, 512, 256]
    - [79, 19.68]
  - - [512, 256, 1, 4096, 512, 512, 512, 256]
    - [79, 24.52]
  - - [512, 256, 1, 8192, 512, 512, 512, 256]
    - [85, 28.16]
  - - [512, 512, 1, 128, 512, 512, 512, 512]
    - [62, 5.85]
  - - [512, 512, 1, 256, 512, 512, 512, 512]
    - [58, 10.23]
  - - [512, 512, 1, 512, 512, 512, 512, 512]
    - [64, 17.39]
  - - [512, 512, 1, 1024, 512, 512, 512, 512]
    - [79, 27.09]
  - - [512, 512, 1, 2048, 512, 512, 512, 512]
    - [82, 38.17]
  - - [512, 512, 1, 4096, 512, 512, 512, 512]
    - [84, 47.61]
  - - [512, 512, 1, 8192, 512, 512, 512, 512]
    - [85, 54.44]
  - - [512, 1024, 1, 128, 512, 512, 512, 1024]
    - [48, 10.7]
  - - [512, 1024, 1, 256, 512, 512, 512, 1024]
    - [54, 19.06]
  - - [512, 1024, 1, 512, 512, 512, 512, 1024]
    - [52, 31.85]
  - - [512, 1024, 1, 1024, 512, 512, 512, 1024]
    - [77, 48.22]
  - - [512, 1024, 1, 2048, 512, 512, 512, 1024]
    - [76, 68.15]
  - - [512, 1024, 1, 4096, 512, 512, 512, 1024]
    - [77, 85.35]
  - - [512, 1024, 1, 8192, 512, 512, 512, 1024]
    - [76, 98.89]
  - - [512, 2048, 1, 128, 512, 512, 512, 2048]
    - [43, 18.55]
  - - [512, 2048, 1, 256, 512, 512, 512, 2048]
    - [44, 32.98]
  - - [512, 2048, 1, 512, 512, 512, 512, 2048]
    - [44, 55.85]
  - - [512, 2048, 1, 1024, 512, 512, 512, 2048]
    - [46, 85.16]
  - - [512, 2048, 1, 2048, 512, 512, 512, 2048]
    - [42, 115.36]
  - - [512, 2048, 1, 4096, 512, 512, 512, 2048]
    - [42, 142.83]
  - - [512, 2048, 1, 8192, 512, 512, 512, 2048]
    - [46, 155.46]
  - - [512, 4096, 1, 128, 512, 512, 512, 4096]
    - [29, 29.77]
  - - [512, 4096, 1, 256, 512, 512, 512, 4096]
    - [33, 52.81]
  - - [512, 4096, 1, 512, 512, 512, 512, 4096]
    - [34, 89.32]
  - - [512, 4096, 1, 1024, 512, 512, 512, 4096]
    - [34, 136.75]
  - - [512, 4096, 1, 2048, 512, 512, 512, 4096]
    - [34, 183.62]
  - - [512, 4096, 1, 4096, 512, 512, 512, 4096]
    - [34, 220.92]
  - - [512, 4096, 1, 8192, 512, 512, 512, 4096]
    - [34, 226.36]
  - - [512, 8192, 1, 128, 512, 512, 512, 8192]
    - [25, 39.07]
  - - [512, 8192, 1, 256, 512, 512, 512, 8192]
    - [27, 70.18]
  - - [512, 8192, 1, 512, 512, 512, 512, 8192]
    - [27, 122.63]
  - - [512, 8192, 1, 1024, 512, 512, 512, 8192]
    - [27, 190.57]
  - - [512, 8192, 1, 2048, 512, 512, 512, 8192]
    - [27, 263.4]
  - - [512, 8192, 1, 4096, 512, 512, 512, 8192]
    - [27, 316.67]
  - - [512, 8192, 1, 8192, 512, 512, 512, 8192]
    - [27, 323.35]
  - - [1024, 128, 1, 128, 1024, 1024, 1024, 128]
    - [64, 2.98]
  - - [1024, 128, 1, 256, 1024, 1024, 1024, 128]
    - [58, 5.26]
  - - [1024, 128, 1, 512, 1024, 1024, 1024, 128]
    - [58, 8.87]
  - - [1024, 128, 1, 1024, 1024, 1024, 1024, 128]
    - [79, 13.6]
  - - [1024, 128, 1, 2048, 1024, 1024, 1024, 128]
    - [84, 18.92]
  - - [1024, 128, 1, 4096, 1024, 1024, 1024, 128]
    - [82, 23.67]
  - - [1024, 128, 1, 8192, 1024, 1024, 1024, 128]
    - [84, 26.97]
  - - [1024, 256, 1, 128, 1024, 1024, 1024, 256]
    - [57, 5.74]
  - - [1024, 256, 1, 256, 1024, 1024, 1024, 256]
    - [58, 10.07]
  - - [1024, 256, 1, 512, 1024, 1024, 1024, 256]
    - [64, 17.13]
  - - [1024, 256, 1, 1024, 1024, 1024, 1024, 256]
    - [84, 26.21]
  - - [1024, 256, 1, 2048, 1024, 1024, 1024, 256]
    - [79, 36.68]
  - - [1024, 256, 1, 4096, 1024, 1024, 1024, 256]
    - [79, 45.68]
  - - [1024, 256, 1, 8192, 1024, 1024, 1024, 256]
    - [79, 51.26]
  - - [1024, 512, 1, 128, 1024, 1024, 1024, 512]
    - [52, 10.76]
  - - [1024, 512, 1, 256, 1024, 1024, 1024, 512]
    - [54, 19.09]
  - - [1024, 512, 1, 512, 1024, 1024, 1024, 512]
    - [54, 32.0]
  - - [1024, 512, 1, 1024, 1024, 1024, 1024, 512]
    - [77, 48.27]
  - - [1024, 512, 1, 2048, 1024, 1024, 1024, 512]
    - [77, 68.39]
  - - [1024, 512, 1, 4096, 1024, 1024, 1024, 512]
    - [77, 85.65]
  - - [1024, 512, 1, 8192, 1024, 1024, 1024, 512]
    - [77, 98.13]
  - - [1024, 1024, 1, 128, 1024, 1024, 1024, 1024]
    - [38, 18.7]
  - - [1024, 1024, 1, 256, 1024, 1024, 1024, 1024]
    - [44, 33.52]
  - - [1024, 1024, 1, 512, 1024, 1024, 1024, 1024]
    - [43, 56.23]
  - - [1024, 1024, 1, 1024, 1024, 1024, 1024, 1024]
    - [37, 85.28]
  - - [1024, 1024, 1, 2048, 1024, 1024, 1024, 1024]
    - [42, 116.26]
  - - [1024, 1024, 1, 4096, 1024, 1024, 1024, 1024]
    - [46, 143.19]
  - - [1024, 1024, 1, 8192, 1024, 1024, 1024, 1024]
    - [41, 155.37]
  - - [1024, 2048, 1, 128, 1024, 1024, 1024, 2048]
    - [31, 29.77]
  - - [1024, 2048, 1, 256, 1024, 1024, 1024, 2048]
    - [32, 53.09]
  - - [1024, 2048, 1, 512, 1024, 1024, 1024, 2048]
    - [34, 88.53]
  - - [1024, 2048, 1, 1024, 1024, 1024, 1024, 2048]
    - [34, 136.29]
  - - [1024, 2048, 1, 2048, 1024, 1024, 1024, 2048]
    - [34, 185.28]
  - - [1024, 2048, 1, 4096, 1024, 1024, 1024, 2048]
    - [34, 224.67]
  - - [1024, 2048, 1, 8192, 1024, 1024, 1024, 2048]
    - [34, 242.7]
  - - [1024, 4096, 1, 128, 1024, 1024, 1024, 4096]
    - [25, 39.22]
  - - [1024, 4096, 1, 256, 1024, 1024, 1024, 4096]
    - [27, 69.91]
  - - [1024, 4096, 1, 512, 1024, 1024, 1024, 4096]
    - [26, 119.17]
  - - [1024, 4096, 1, 1024, 1024, 1024, 1024, 4096]
    - [27, 187.58]
  - - [1024, 4096, 1, 2048, 1024, 1024, 1024, 4096]
    - [27, 260.01]
  - - [1024, 4096, 1, 4096, 1024, 1024, 1024, 4096]
    - [27, 314.65]
  - - [1024, 4096, 1, 8192, 1024, 1024, 1024, 4096]
    - [27, 312.36]
  - - [1024, 8192, 1, 128, 1024, 1024, 1024, 8192]
    - [16, 52.1]
  - - [1024, 8192, 1, 256, 1024, 1024, 1024, 8192]
    - [15, 93.23]
  - - [1024, 8192, 1, 512, 1024, 1024, 1024, 8192]
    - [70, 153.13]
  - - [1024, 8192, 1, 1024, 1024, 1024, 1024, 8192]
    - [67, 241.79]
  - - [1024, 8192, 1, 2048, 1024, 1024, 1024, 8192]
    - [66, 338.68]
  - - [1024, 8192, 1, 4096, 1024, 1024, 1024, 8192]
    - [67, 383.34]
  - - [1024, 8192, 1, 8192, 1024, 1024, 1024, 8192]
    - [69, 394.99]
  - - [2048, 128, 1, 128, 2048, 2048, 2048, 128]
    - [60, 5.7]
  - - [2048, 128, 1, 256, 2048, 2048, 2048, 128]
    - [64, 10.04]
  - - [2048, 128, 1, 512, 2048, 2048, 2048, 128]
    - [64, 17.09]
  - - [2048, 128, 1, 1024, 2048, 2048, 2048, 128]
    - [79, 25.97]
  - - [2048, 128, 1, 2048, 2048, 2048, 2048, 128]
    - [84, 36.53]
  - - [2048, 128, 1, 4096, 2048, 2048, 2048, 128]
    - [84, 45.55]
  - - [2048, 128, 1, 8192, 2048, 2048, 2048, 128]
    - [84, 51.77]
  - - [2048, 256, 1, 128, 2048, 2048, 2048, 256]
    - [48, 10.66]
  - - [2048, 256, 1, 256, 2048, 2048, 2048, 256]
    - [54, 18.92]
  - - [2048, 256, 1, 512, 2048, 2048, 2048, 256]
    - [53, 31.64]
  - - [2048, 256, 1, 1024, 2048, 2048, 2048, 256]
    - [77, 47.81]
  - - [2048, 256, 1, 2048, 2048, 2048, 2048, 256]
    - [77, 66.95]
  - - [2048, 256, 1, 4096, 2048, 2048, 2048, 256]
    - [77, 83.99]
  - - [2048, 256, 1, 8192, 2048, 2048, 2048, 256]
    - [77, 96.12]
  - - [2048, 512, 1, 128, 2048, 2048, 2048, 512]
    - [35, 18.72]
  - - [2048, 512, 1, 256, 2048, 2048, 2048, 512]
    - [39, 33.03]
  - - [2048, 512, 1, 512, 2048, 2048, 2048, 512]
    - [44, 55.65]
  - - [2048, 512, 1, 1024, 2048, 2048, 2048, 512]
    - [40, 85.09]
  - - [2048, 512, 1, 2048, 2048, 2048, 2048, 512]
    - [46, 115.52]
  - - [2048, 512, 1, 4096, 2048, 2048, 2048, 512]
    - [46, 142.5]
  - - [2048, 512, 1, 8192, 2048, 2048, 2048, 512]
    - [46, 154.21]
  - - [2048, 1024, 1, 128, 2048, 2048, 2048, 1024]
    - [33, 29.68]
  - - [2048, 1024, 1, 256, 2048, 2048, 2048, 1024]
    - [34, 53.02]
  - - [2048, 1024, 1, 512, 2048, 2048, 2048, 1024]
    - [34, 88.86]
  - - [2048, 1024, 1, 1024, 2048, 2048, 2048, 1024]
    - [34, 136.31]
  - - [2048, 1024, 1, 2048, 2048, 2048, 2048, 1024]
    - [34, 185.49]
  - - [2048, 1024, 1, 4096, 2048, 2048, 2048, 1024]
    - [34, 221.33]
  - - [2048, 1024, 1, 8192, 2048, 2048, 2048, 1024]
    - [34, 230.15]
  - - [2048, 2048, 1, 128, 2048, 2048, 2048, 2048]
    - [25, 39.29]
  - - [2048, 2048, 1, 256, 2048, 2048, 2048, 2048]
    - [26, 69.61]
  - - [2048, 2048, 1, 512, 2048, 2048, 2048, 2048]
    - [27, 118.09]
  - - [2048, 2048, 1, 1024, 2048, 2048, 2048, 2048]
    - [27, 187.42]
  - - [2048, 2048, 1, 2048, 2048, 2048, 2048, 2048]
    - [27, 258.4]
  - - [2048, 2048, 1, 4096, 2048, 2048, 2048, 2048]
    - [27, 310.54]
  - - [2048, 2048, 1, 8192, 2048, 2048, 2048, 2048]
    - [27, 313.52]
  - - [2048, 4096, 1, 128, 2048, 2048, 2048, 4096]
    - [14, 48.98]
  - - [2048, 4096, 1, 256, 2048, 2048, 2048, 4096]
    - [19, 87.79]
  - - [2048, 4096, 1, 512, 2048, 2048, 2048, 4096]
    - [69, 147.86]
  - - [2048, 4096, 1, 1024, 2048, 2048, 2048, 4096]
    - [67, 234.62]
  - - [2048, 4096, 1, 2048, 2048, 2048, 2048, 4096]
    - [67, 327.03]
  - - [2048, 4096, 1, 4096, 2048, 2048, 2048, 4096]
    - [69, 370.14]
  - - [2048, 4096, 1, 8192, 2048, 2048, 2048, 4096]
    - [66, 391.83]
  - - [2048, 8192, 1, 128, 2048, 2048, 2048, 8192]
    - [5, 57.44]
  - - [2048, 8192, 1, 256, 2048, 2048, 2048, 8192]
    - [2, 99.62]
  - - [2048, 8192, 1, 512, 2048, 2048, 2048, 8192]
    - [9, 180.13]
  - - [2048, 8192, 1, 1024, 2048, 2048, 2048, 8192]
    - [3, 291.76]
  - - [2048, 8192, 1, 2048, 2048, 2048, 2048, 8192]
    - [10, 418.33]
  - - [2048, 8192, 1, 4096, 2048, 2048, 2048, 8192]
    - [3, 495.09]
  - - [2048, 8192, 1, 8192, 2048, 2048, 2048, 8192]
    - [0, 525.34]
  - - [4096, 128, 1, 128, 4096, 4096, 4096, 128]
    - [48, 10.51]
  - - [4096, 128, 1, 256, 4096, 4096, 4096, 128]
    - [47, 18.73]
  - - [4096, 128, 1, 512, 4096, 4096, 4096, 128]
    - [47, 31.17]
  - - [4096, 128, 1, 1024, 4096, 4096, 4096, 128]
    - [51, 46.93]
  - - [4096, 128, 1, 2048, 4096, 4096, 4096, 128]
    - [77, 66.02]
  - - [4096, 128, 1, 4096, 4096, 4096, 4096, 128]
    - [76, 83.38]
  - - [4096, 128, 1, 8192, 4096, 4096, 4096, 128]
    - [76, 92.54]
  - - [4096, 256, 1, 128, 4096, 4096, 4096, 256]
    - [38, 18.42]
  - - [4096, 256, 1, 256, 4096, 4096, 4096, 256]
    - [44, 32.92]
  - - [4096, 256, 1, 512, 4096, 4096, 4096, 256]
    - [39, 55.51]
  - - [4096, 256, 1, 1024, 4096, 4096, 4096, 256]
    - [44, 84.58]
  - - [4096, 256, 1, 2048, 4096, 4096, 4096, 256]
    - [46, 115.21]
  - - [4096, 256, 1, 4096, 4096, 4096, 4096, 256]
    - [42, 141.49]
  - - [4096, 256, 1, 8192, 4096, 4096, 4096, 256]
    - [42, 154.23]
  - - [4096, 512, 1, 128, 4096, 4096, 4096, 512]
    - [28, 29.57]
  - - [4096, 512, 1, 256, 4096, 4096, 4096, 512]
    - [31, 52.41]
  - - [4096, 512, 1, 512, 4096, 4096, 4096, 512]
    - [34, 89.01]
  - - [4096, 512, 1, 1024, 4096, 4096, 4096, 512]
    - [34, 135.84]
  - - [4096, 512, 1, 2048, 4096, 4096, 4096, 512]
    - [34, 183.15]
  - - [4096, 512, 1, 4096, 4096, 4096, 4096, 512]
    - [34, 218.96]
  - - [4096, 512, 1, 8192, 4096, 4096, 4096, 512]
    - [30, 236.13]
  - - [4096, 1024, 1, 128, 4096, 4096, 4096, 1024]
    - [23, 38.85]
  - - [4096, 1024, 1, 256, 4096, 4096, 4096, 1024]
    - [26, 69.23]
  - - [4096, 1024, 1, 512, 4096, 4096, 4096, 1024]
    - [27, 117.68]
  - - [4096, 1024, 1, 1024, 4096, 4096, 4096, 1024]
    - [27, 187.26]
  - - [4096, 1024, 1, 2048, 4096, 4096, 4096, 1024]
    - [27, 256.92]
  - - [4096, 1024, 1, 4096, 4096, 4096, 4096, 1024]
    - [27, 309.2]
  - - [4096, 1024, 1, 8192, 4096, 4096, 4096, 1024]
    - [26, 319.99]
  - - [4096, 2048, 1, 128, 4096, 4096, 4096, 2048]
    - [13, 50.2]
  - - [4096, 2048, 1, 256, 4096, 4096, 4096, 2048]
    - [11, 90.93]
  - - [4096, 2048, 1, 512, 4096, 4096, 4096, 2048]
    - [12, 150.64]
  - - [4096, 2048, 1, 1024, 4096, 4096, 4096, 2048]
    - [70, 232.6]
  - - [4096, 2048, 1, 2048, 4096, 4096, 4096, 2048]
    - [67, 323.84]
  - - [4096, 2048, 1, 4096, 4096, 4096, 4096, 2048]
    - [67, 367.79]
  - - [4096, 2048, 1, 8192, 4096, 4096, 4096, 2048]
    - [69, 385.39]
  - - [4096, 4096, 1, 128, 4096, 4096, 4096, 4096]
    - [5, 57.79]
  - - [4096, 4096, 1, 256, 4096, 4096, 4096, 4096]
    - [16, 99.36]
  - - [4096, 4096, 1, 512, 4096, 4096, 4096, 4096]
    - [7, 177.16]
  - - [4096, 4096, 1, 1024, 4096, 4096, 4096, 4096]
    - [5, 287.67]
  - - [4096, 4096, 1, 2048, 4096, 4096, 4096, 4096]
    - [8, 396.8]
  - - [4096, 4096, 1, 4096, 4096, 4096, 4096, 4096]
    - [10, 486.25]
  - - [4096, 4096, 1, 8192, 4096, 4096, 4096, 4096]
    - [7, 527.96]
  - - [4096, 8192, 1, 128, 4096, 4096, 4096, 8192]
    - [8, 61.78]
  - - [4096, 8192, 1, 256, 4096, 4096, 4096, 8192]
    - [8, 111.59]
  - - [4096, 8192, 1, 512, 4096, 4096, 4096, 8192]
    - [7, 195.02]
  - - [4096, 8192, 1, 1024, 4096, 4096, 4096, 8192]
    - [1, 297.46]
  - - [4096, 8192, 1, 2048, 4096, 4096, 4096, 8192]
    - [10, 385.95]
  - - [4096, 8192, 1, 4096, 4096, 4096, 4096, 8192]
    - [7, 473.84]
  - - [4096, 8192, 1, 8192, 4096, 4096, 4096, 8192]
    - [10, 562.98]
  - - [8192, 128, 1, 128, 8192, 8192, 8192, 128]
    - [43, 18.38]
  - - [8192, 128, 1, 256, 8192, 8192, 8192, 128]
    - [39, 32.73]
  - - [8192, 128, 1, 512, 8192, 8192, 8192, 128]
    - [39, 55.74]
  - - [8192, 128, 1, 1024, 8192, 8192, 8192, 128]
    - [44, 84.75]
  - - [8192, 128, 1, 2048, 8192, 8192, 8192, 128]
    - [39, 114.59]
  - - [8192, 128, 1, 4096, 8192, 8192, 8192, 128]
    - [42, 139.9]
  - - [8192, 128, 1, 8192, 8192, 8192, 8192, 128]
    - [45, 152.68]
  - - [8192, 256, 1, 128, 8192, 8192, 8192, 256]
    - [31, 29.71]
  - - [8192, 256, 1, 256, 8192, 8192, 8192, 256]
    - [32, 52.98]
  - - [8192, 256, 1, 512, 8192, 8192, 8192, 256]
    - [31, 89.01]
  - - [8192, 256, 1, 1024, 8192, 8192, 8192, 256]
    - [34, 134.61]
  - - [8192, 256, 1, 2048, 8192, 8192, 8192, 256]
    - [34, 181.76]
  - - [8192, 256, 1, 4096, 8192, 8192, 8192, 256]
    - [34, 225.53]
  - - [8192, 256, 1, 8192, 8192, 8192, 8192, 256]
    - [30, 235.91]
  - - [8192, 512, 1, 128, 8192, 8192, 8192, 512]
    - [23, 38.57]
  - - [8192, 512, 1, 256, 8192, 8192, 8192, 512]
    - [24, 69.03]
  - - [8192, 512, 1, 512, 8192, 8192, 8192, 512]
    - [27, 119.52]
  - - [8192, 512, 1, 1024, 8192, 8192, 8192, 512]
    - [27, 185.0]
  - - [8192, 512, 1, 2048, 8192, 8192, 8192, 512]
    - [27, 257.48]
  - - [8192, 512, 1, 4096, 8192, 8192, 8192, 512]
    - [27, 314.64]
  - - [8192, 512, 1, 8192, 8192, 8192, 8192, 512]
    - [26, 312.18]
  - - [8192, 1024, 1, 128, 8192, 8192, 8192, 1024]
    - [20, 51.41]
  - - [8192, 1024, 1, 256, 8192, 8192, 8192, 1024]
    - [17, 92.59]
  - - [8192, 1024, 1, 512, 8192, 8192, 8192, 1024]
    - [18, 152.09]
  - - [8192, 1024, 1, 1024, 8192, 8192, 8192, 1024]
    - [66, 231.53]
  - - [8192, 1024, 1, 2048, 8192, 8192, 8192, 1024]
    - [66, 321.25]
  - - [8192, 1024, 1, 4096, 8192, 8192, 8192, 1024]
    - [67, 363.26]
  - - [8192, 1024, 1, 8192, 8192, 8192, 8192, 1024]
    - [68, 380.5]
  - - [8192, 2048, 1, 128, 8192, 8192, 8192, 2048]
    - [22, 58.11]
  - - [8192, 2048, 1, 256, 8192, 8192, 8192, 2048]
    - [15, 103.34]
  - - [8192, 2048, 1, 512, 8192, 8192, 8192, 2048]
    - [6, 175.44]
  - - [8192, 2048, 1, 1024, 8192, 8192, 8192, 2048]
    - [10, 282.79]
  - - [8192, 2048, 1, 2048, 8192, 8192, 8192, 2048]
    - [3, 390.86]
  - - [8192, 2048, 1, 4096, 8192, 8192, 8192, 2048]
    - [7, 468.57]
  - - [8192, 2048, 1, 8192, 8192, 8192, 8192, 2048]
    - [3, 527.08]
  - - [8192, 4096, 1, 128, 8192, 8192, 8192, 4096]
    - [21, 61.07]
  - - [8192, 4096, 1, 256, 8192, 8192, 8192, 4096]
    - [8, 109.73]
  - - [8192, 4096, 1, 512, 8192, 8192, 8192, 4096]
    - [1, 186.1]
  - - [8192, 4096, 1, 1024, 8192, 8192, 8192, 4096]
    - [7, 291.52]
  - - [8192, 4096, 1, 2048, 8192, 8192, 8192, 4096]
    - [10, 384.42]
  - - [8192, 4096, 1, 4096, 8192, 8192, 8192, 4096]
    - [3, 473.84]
  - - [8192, 4096, 1, 8192, 8192, 8192, 8192, 4096]
    - [3, 560.38]
  - - [8192, 8192, 1, 128, 8192, 8192, 8192, 8192]
    - [4, 64.17]
  - - [8192, 8192, 1, 256, 8192, 8192, 8192, 8192]
    - [4, 118.5]
  - - [8192, 8192, 1, 512, 8192, 8192, 8192, 8192]
    - [0, 197.31]
  - - [8192, 8192, 1, 1024, 8192, 8192, 8192, 8192]
    - [4, 286.66]
  - - [8192, 8192, 1, 2048, 8192, 8192, 8192, 8192]
    - [3, 391.13]
  - - [8192, 8192, 1, 4096, 8192, 8192, 8192, 8192]
    - [10, 507.25]
  - - [8192, 8192, 1, 8192, 8192, 8192, 8192, 8192]
    - [3, 608.85]
  - - [1, 1, 1, 32, 1, 1, 1, 1]
    - [86, 0.0]
- null
- null
- DeviceEfficiency
- GridBased
