projects/hipblaslt/library/src/amd_detail/rocblaslt/src/Tensile/Logic/asm_full/gfx950/GridBased/gfx950_Cijk_Alik_Bjlk_B8SS_BH_Bias_HAS_SAB_SAV_UserArgs.yaml
- {MinimumRequiredVersion: 4.33.0}
- gfx950
- gfx950
- [Device 75a0]
    SolutionIndex: 0
    SolutionNameMin: Cijk_Alik_Bjlk_F8SS_BH_Bias_HAS_SAB_SAV_UserArgs_MT256x256x64_MI32x32x1_SN_GSU0_GSUC0_GSUWGMRR0_K1_LBSPPA256_LBSPPB0_LPB0_MIWT4_4_SU0_SUM0_SUS0_VWA4_VWB4_WGM8_WGMXCC1_WGMXCCGn1
    SolutionIndex: 1
    SolutionNameMin: Cijk_Alik_Bjlk_F8SS_BH_Bias_HAS_SAB_SAV_UserArgs_MT256x256x64_MI32x32x1_SN_GSU0_GSUC0_GSUWGMRR0_K1_LBSPPA256_LBSPPB0_LPB0_MIWT4_4_SU0_SUM0_SUS0_VWA4_VWB4_WGM8_WGMXCC1_WGMXCCGn1
    SolutionIndex: 2
    SolutionNameMin: Cijk_Alik_Bjlk_F8SS_BH_Bias_HAS_SAB_SAV_UserArgs_MT256x256x64_MI32x32x1_SN_GSU0_GSUC0_GSUWGMRR0_K1_LBSPPA256_LBSPPB0_LPB0_MIWT4_4_SU0_SUM0_SUS0_VWA4_VWB4_WGM8_WGMXCC1_WGMXCCGn1
    SolutionIndex: 3
    SolutionNameMin: Cijk_Alik_Bjlk_F8SS_BH_Bias_HAS_SAB_SAV_UserArgs_MT256x256x64_MI32x32x1_SN_GSU0_GSUC0_GSUWGMRR0_K1_LBSPPA256_LBSPPB0_LPB0_MIWT4_4_SU0_SUM0_SUS0_VWA4_VWB4_WGM8_WGMXCC1_WGMXCCGn1
    SolutionIndex: 4
    SolutionNameMin: Cijk_Alik_Bjlk_F8SS_BH_Bias_HAS_SAB_SAV_UserArgs_MT256x256x64_MI32x32x1_SN_GSU0_GSUC0_GSUWGMRR0_K1_LBSPPA256_LBSPPB0_LPB0_MIWT4_4_SU0_SUM0_SUS0_VWA4_VWB4_WGM8_WGMXCC1_WGMXCCGn1
    SolutionIndex: 5
    SolutionNameMin: Cijk_Alik_Bjlk_F8SS_BH_Bias_HAS_SAB_SAV_UserArgs_MT256x256x64_MI32x32x1_SN_GSU0_GSUC0_GSUWGMRR0_K1_LBSPPA256_LBSPPB0_LPB0_MIWT4_4_SU0_SUM0_SUS0_VWA4_VWB4_WGM8_WGMXCC1_WGMXCCGn1
    SolutionIndex: 6
    SolutionNameMin: Cijk_Alik_Bjlk_F8SS_BH_Bias_HAS_SAB_SAV_UserArgs_MT128x256x64_MI32x32x1_SN_GSU0_GSUC0_GSUWGMRR0_K1_LBSPPA128_LBSPPB0_LPB0_MIWT2_4_SU0_SUM0_SUS0_VWA2_VWB4_WGM8_WGMXCC1_WGMXCCGn1
    SolutionIndex: 7
    SolutionNameMin: Cijk_Alik_Bjlk_F8SS_BH_Bias_HAS_SAB_SAV_UserArgs_MT256x128x64_MI32x32x1_SN_GSU0_GSUC0_GSUWGMRR0_K1_LBSPPA256_LBSPPB0_LPB0_MIWT4_2_SU0_SUM0_SUS0_VWA4_VWB2_WGM8_WGMXCC1_WGMXCCGn1
    SolutionIndex: 8
    SolutionNameMin: Cijk_Alik_Bjlk_F8SS_BH_Bias_HAS_SAB_SAV_UserArgs_MT256x128x64_MI32x32x1_SN_GSU0_GSUC0_GSUWGMRR0_K1_LBSPPA256_LBSPPB0_LPB0_MIWT4_2_SU0_SUM0_SUS0_VWA4_VWB2_WGM8_WGMXCC1_WGMXCCGn1
    SolutionIndex: 9
    SolutionNameMin: Cijk_Alik_Bjlk_F8SS_BH_Bias_HAS_SAB_SAV_UserArgs_MT256x128x64_MI32x32x1_SN_GSU0_GSUC0_GSUWGMRR0_K1_LBSPPA256_LBSPPB0_LPB0_MIWT4_2_SU0_SUM0_SUS0_VWA4_VWB2_WGM8_WGMXCC1_WGMXCCGn1
    SolutionIndex: 10
    SolutionNameMin: Cijk_Alik_Bjlk_F8SS_BH_Bias_HAS_SAB_SAV_UserArgs_MT256x128x64_MI32x32x1_SN_GSU0_GSUC0_GSUWGMRR0_K1_LBSPPA256_LBSPPB0_LPB0_MIWT4_2_SU0_SUM0_SUS0_VWA4_VWB2_WGM8_WGMXCC1_WGMXCCGn1
    SolutionIndex: 11
    SolutionNameMin: Cijk_Alik_Bjlk_F8SS_BH_Bias_HAS_SAB_SAV_UserArgs_MT256x128x64_MI32x32x1_SN_GSU0_GSUC0_GSUWGMRR0_K1_LBSPPA256_LBSPPB0_LPB0_MIWT4_2_SU0_SUM0_SUS0_VWA4_VWB2_WGM8_WGMXCC1_WGMXCCGn1
    SolutionIndex: 12
    SolutionNameMin: Cijk_Alik_Bjlk_F8SS_BH_Bias_HAS_SAB_SAV_UserArgs_MT256x64x64_MI32x32x1_SN_GSU0_GSUC0_GSUWGMRR0_K1_LBSPPA256_LBSPPB0_LPB0_MIWT4_1_SU0_SUM0_SUS0_VWA4_VWB1_WGM8_WGMXCC1_WGMXCCGn1
    SolutionIndex: 13
    SolutionNameMin: Cijk_Alik_Bjlk_F8SS_BH_Bias_HAS_SAB_SAV_UserArgs_MT256x64x64_MI32x32x1_SN_GSU0_GSUC0_GSUWGMRR0_K1_LBSPPA256_LBSPPB0_LPB0_MIWT4_1_SU0_SUM0_SUS0_VWA4_VWB1_WGM8_WGMXCC1_WGMXCCGn1
    SolutionIndex: 14
    SolutionNameMin: Cijk_Alik_Bjlk_F8SS_BH_Bias_HAS_SAB_SAV_UserArgs_MT128x256x128_MI16x16x1_SN_GSU0_GSUC0_GSUWGMRR0_K1_LBSPPA512_LBSPPB4096_LPB0_MIWT4_8_SU0_SUM0_SUS0_VWA4_VWB8_WGM8_WGMXCC1_WGMXCCGn1
    SolutionIndex: 15
    SolutionNameMin: Cijk_Alik_Bjlk_F8SS_BH_Bias_HAS_SAB_SAV_UserArgs_MT256x128x128_MI16x16x1_SN_GSU0_GSUC0_GSUWGMRR0_K1_LBSPPA1024_LBSPPB2048_LPB64_MIWT8_4_SU0_SUM0_SUS0_VWA8_VWB4_WGM8_WGMXCC1_WGMXCCGn1
    SolutionIndex: 16
    SolutionNameMin: Cijk_Alik_Bjlk_F8SS_BH_Bias_HAS_SAB_SAV_UserArgs_MT128x128x128_MI16x16x1_SN_GSU0_GSUC0_GSUWGMRR0_K1_LBSPPA512_LBSPPB2048_LPB64_MIWT4_4_SU0_SUM0_SUS0_VWA4_VWB4_WGM8_WGMXCC1_WGMXCCGn1
    SolutionIndex: 17
    SolutionNameMin: Cijk_Alik_Bjlk_F8SS_BH_Bias_HAS_SAB_SAV_UserArgs_MT128x128x128_MI16x16x1_SN_GSU0_GSUC0_GSUWGMRR0_K1_LBSPPA512_LBSPPB2048_LPB64_MIWT4_4_SU0_SUM0_SUS0_VWA4_VWB4_WGM8_WGMXCC1_WGMXCCGn1
    SolutionIndex: 18
    SolutionNameMin: Cijk_Alik_Bjlk_F8SS_BH_Bias_HAS_SAB_SAV_UserArgs_MT128x128x128_MI16x16x1_SN_GSU0_GSUC0_GSUWGMRR0_K1_LBSPPA512_LBSPPB2048_LPB64_MIWT4_4_SU0_SUM0_SUS0_VWA4_VWB4_WGM8_WGMXCC1_WGMXCCGn1
    SolutionIndex: 19
    SolutionNameMin: Cijk_Alik_Bjlk_F8SS_BH_Bias_HAS_SAB_SAV_UserArgs_MT128x64x128_MI16x16x1_SN_GSU0_GSUC0_GSUWGMRR0_K1_LBSPPA512_LBSPPB1024_LPB32_MIWT4_2_SU0_SUM0_SUS0_VWA4_VWB2_WGM8_WGMXCC1_WGMXCCGn1
    SolutionIndex: 20
    SolutionNameMin: Cijk_Alik_Bjlk_F8SS_BH_Bias_HAS_SAB_SAV_UserArgs_MT128x64x128_MI16x16x1_SN_GSU0_GSUC0_GSUWGMRR0_K1_LBSPPA512_LBSPPB1024_LPB32_MIWT4_2_SU0_SUM0_SUS0_VWA4_VWB2_WGM8_WGMXCC1_WGMXCCGn1
    SolutionIndex: 21
    SolutionNameMin: Cijk_Alik_Bjlk_F8SS_BH_Bias_HAS_SAB_SAV_UserArgs_MT128x64x128_MI16x16x1_SN_GSU0_GSUC0_GSUWGMRR0_K1_LBSPPA512_LBSPPB1024_LPB32_MIWT4_2_SU0_SUM0_SUS0_VWA4_VWB2_WGM8_WGMXCC1_WGMXCCGn1
    SolutionIndex: 22
    SolutionNameMin: Cijk_Alik_Bjlk_F8SS_BH_Bias_HAS_SAB_SAV_UserArgs_MT128x64x128_MI16x16x1_SN_GSU0_GSUC0_GSUWGMRR0_K1_LBSPPA512_LBSPPB1024_LPB32_MIWT4_2_SU0_SUM0_SUS0_VWA4_VWB2_WGM8_WGMXCC1_WGMXCCGn1
    SolutionIndex: 23
    SolutionNameMin: Cijk_Alik_Bjlk_F8SS_BH_Bias_HAS_SAB_SAV_UserArgs_MT128x32x128_MI16x16x1_SN_GSU0_GSUC0_GSUWGMRR0_K1_LBSPPA512_LBSPPB512_LPB16_MIWT4_1_SU0_SUM0_SUS0_VWA4_VWB1_WGM8_WGMXCC1_WGMXCCGn1
    SolutionIndex: 24
    SolutionNameMin: Cijk_Alik_Bjlk_F8SS_BH_Bias_HAS_SAB_SAV_UserArgs_MT64x64x128_MI16x16x1_SN_GSU0_GSUC0_GSUWGMRR0_K1_LBSPPA256_LBSPPB1024_LPB32_MIWT2_2_SU0_SUM0_SUS0_VWA2_VWB2_WGM8_WGMXCC1_WGMXCCGn1
    SolutionIndex: 25
    SolutionNameMin: Cijk_Alik_Bjlk_F8SS_BH_Bias_HAS_SAB_SAV_UserArgs_MT64x64x128_MI16x16x1_SN_GSU0_GSUC0_GSUWGMRR0_K1_LBSPPA256_LBSPPB1024_LPB32_MIWT2_2_SU0_SUM0_SUS0_VWA2_VWB2_WGM8_WGMXCC1_WGMXCCGn1
    SolutionIndex: 26
    SolutionNameMin: Cijk_Alik_Bjlk_F8SS_BH_Bias_HAS_SAB_SAV_UserArgs_MT32x64x128_MI16x16x1_SN_GSU0_GSUC0_GSUWGMRR0_K1_LBSPPA128_LBSPPB1024_LPB32_MIWT1_2_SU0_SUM0_SUS0_VWA1_VWB2_WGM8_WGMXCC1_WGMXCCGn1
    SolutionIndex: 27
    SolutionNameMin: Cijk_Alik_Bjlk_F8SS_BH_Bias_HAS_SAB_SAV_UserArgs_MT64x32x128_MI16x16x1_SN_GSU0_GSUC0_GSUWGMRR0_K1_LBSPPA256_LBSPPB512_LPB16_MIWT2_1_SU0_SUM0_SUS0_VWA2_VWB1_WGM8_WGMXCC1_WGMXCCGn1
    SolutionIndex: 28
    SolutionNameMin: Cijk_Alik_Bjlk_F8SS_BH_Bias_HAS_SAB_SAV_UserArgs_MT64x32x128_MI16x16x1_SN_GSU0_GSUC0_GSUWGMRR0_K1_LBSPPA256_LBSPPB512_LPB16_MIWT2_1_SU0_SUM0_SUS0_VWA2_VWB1_WGM8_WGMXCC1_WGMXCCGn1
    SolutionIndex: 29
    SolutionNameMin: Cijk_Alik_Bjlk_F8SS_BH_Bias_HAS_SAB_SAV_UserArgs_MT32x32x128_MI16x16x1_SN_GSU0_GSUC0_GSUWGMRR0_K1_LBSPPA128_LBSPPB512_LPB16_MIWT1_1_SU0_SUM0_SUS0_VWA1_VWB1_WGM8_WGMXCC1_WGMXCCGn1
    SolutionIndex: 30
    SolutionNameMin: Cijk_Alik_Bjlk_F8SS_BH_Bias_HAS_SAB_SAV_UserArgs_MT32x32x128_MI16x16x1_SN_GSU0_GSUC0_GSUWGMRR0_K1_LBSPPA128_LBSPPB512_LPB16_MIWT1_1_SU0_SUM0_SUS0_VWA1_VWB1_WGM8_WGMXCC1_WGMXCCGn1
    SolutionIndex: 31
    SolutionNameMin: Cijk_Alik_Bjlk_F8SS_BH_Bias_HAS_SAB_SAV_UserArgs_MT32x32x128_MI16x16x1_SN_GSU0_GSUC0_GSUWGMRR0_K1_LBSPPA128_LBSPPB512_LPB16_MIWT1_1_SU0_SUM0_SUS0_VWA1_VWB1_WGM8_WGMXCC1_WGMXCCGn1
    SolutionIndex: 32
    SolutionNameMin: Cijk_Alik_Bjlk_F8SS_BH_Bias_HAS_SAB_SAV_UserArgs_MT32x32x128_MI16x16x1_SN_GSU0_GSUC0_GSUWGMRR0_K1_LBSPPA128_LBSPPB512_LPB16_MIWT1_1_SU0_SUM0_SUS0_VWA1_VWB1_WGM8_WGMXCC1_WGMXCCGn1
    SolutionIndex: 33
    SolutionNameMin: Cijk_Alik_Bjlk_F8SS_BH_Bias_HAS_SAB_SAV_UserArgs_MT256x256x128_MI32x32x1_SN_GSU0_GSUC0_GSUWGMRR0_K1_LBSPPA512_LBSPPB0_LPB0_MIWT4_4_SU0_SUM0_SUS0_VWA4_VWB4_WGM8_WGMXCC1_WGMXCCGn1
    SolutionIndex: 34
    SolutionNameMin: Cijk_Alik_Bjlk_F8SS_BH_Bias_HAS_SAB_SAV_UserArgs_MT256x128x128_MI32x32x1_SN_GSU0_GSUC0_GSUWGMRR0_K1_LBSPPA512_LBSPPB0_LPB0_MIWT4_2_SU0_SUM0_SUS0_VWA4_VWB2_WGM8_WGMXCC1_WGMXCCGn1
    SolutionIndex: 35
    SolutionNameMin: Cijk_Alik_Bjlk_F8SS_BH_Bias_HAS_SAB_SAV_UserArgs_MT256x128x128_MI32x32x1_SN_GSU0_GSUC0_GSUWGMRR0_K1_LBSPPA512_LBSPPB0_LPB0_MIWT4_2_SU0_SUM0_SUS0_VWA4_VWB2_WGM8_WGMXCC1_WGMXCCGn1
    SolutionIndex: 36
    SolutionNameMin: Cijk_Alik_Bjlk_F8SS_BH_Bias_HAS_SAB_SAV_UserArgs_MT256x128x128_MI32x32x1_SN_GSU0_GSUC0_GSUWGMRR0_K1_LBSPPA512_LBSPPB0_LPB0_MIWT4_2_SU0_SUM0_SUS0_VWA4_VWB2_WGM8_WGMXCC1_WGMXCCGn1
    SolutionIndex: 37
    SolutionNameMin: Cijk_Alik_Bjlk_F8SS_BH_Bias_HAS_SAB_SAV_UserArgs_MT128x128x256_MI16x16x1_SN_GSU0_GSUC0_GSUWGMRR0_K1_LBSPPA1024_LBSPPB2048_LPB64_MIWT4_4_SU0_SUM0_SUS0_VWA4_VWB4_WGM8_WGMXCC1_WGMXCCGn1
    SolutionIndex: 38
    SolutionNameMin: Cijk_Alik_Bjlk_F8SS_BH_Bias_HAS_SAB_SAV_UserArgs_MT128x64x256_MI16x16x1_SN_GSU0_GSUC0_GSUWGMRR0_K1_LBSPPA1024_LBSPPB1024_LPB32_MIWT4_2_SU0_SUM0_SUS0_VWA4_VWB2_WGM8_WGMXCC1_WGMXCCGn1
    SolutionIndex: 39
    SolutionNameMin: Cijk_Alik_Bjlk_F8SS_BH_Bias_HAS_SAB_SAV_UserArgs_MT64x64x256_MI16x16x1_SN_GSU0_GSUC0_GSUWGMRR0_K1_LBSPPA512_LBSPPB1024_LPB32_MIWT2_2_SU0_SUM0_SUS0_VWA2_VWB2_WGM8_WGMXCC1_WGMXCCGn1
    SolutionIndex: 40
    SolutionNameMin: Cijk_Alik_Bjlk_F8SS_BH_Bias_HAS_SAB_SAV_UserArgs_MT32x64x256_MI16x16x1_SN_GSU0_GSUC0_GSUWGMRR0_K1_LBSPPA256_LBSPPB1024_LPB32_MIWT1_2_SU0_SUM0_SUS0_VWA1_VWB2_WGM8_WGMXCC1_WGMXCCGn1
    SolutionIndex: 41
    SolutionNameMin: Cijk_Alik_Bjlk_F8SS_BH_Bias_HAS_SAB_SAV_UserArgs_MT32x64x256_MI16x16x1_SN_GSU0_GSUC0_GSUWGMRR0_K1_LBSPPA256_LBSPPB1024_LPB32_MIWT1_2_SU0_SUM0_SUS0_VWA1_VWB2_WGM8_WGMXCC1_WGMXCCGn1
    SolutionIndex: 42
    SolutionNameMin: Cijk_Alik_Bjlk_F8SS_BH_Bias_HAS_SAB_SAV_UserArgs_MT32x64x256_MI16x16x1_SN_GSU0_GSUC0_GSUWGMRR0_K1_LBSPPA256_LBSPPB1024_LPB32_MIWT1_2_SU0_SUM0_SUS0_VWA1_VWB2_WGM8_WGMXCC1_WGMXCCGn1
    SolutionIndex: 43
    SolutionNameMin: Cijk_Alik_Bjlk_F8SS_BH_Bias_HAS_SAB_SAV_UserArgs_MT64x32x256_MI16x16x1_SN_GSU0_GSUC0_GSUWGMRR0_K1_LBSPPA512_LBSPPB512_LPB16_MIWT2_1_SU0_SUM0_SUS0_VWA2_VWB1_WGM8_WGMXCC1_WGMXCCGn1
    SolutionIndex: 44
    SolutionNameMin: Cijk_Alik_Bjlk_F8SS_BH_Bias_HAS_SAB_SAV_UserArgs_MT64x32x256_MI16x16x1_SN_GSU0_GSUC0_GSUWGMRR0_K1_LBSPPA512_LBSPPB512_LPB16_MIWT2_1_SU0_SUM0_SUS0_VWA2_VWB1_WGM8_WGMXCC1_WGMXCCGn1
    SolutionIndex: 45
    SolutionNameMin: Cijk_Alik_Bjlk_F8SS_BH_Bias_HAS_SAB_SAV_UserArgs_MT32x32x256_MI16x16x1_SN_GSU0_GSUC0_GSUWGMRR0_K1_LBSPPA256_LBSPPB512_LPB16_MIWT1_1_SU0_SUM0_SUS0_VWA1_VWB1_WGM8_WGMXCC1_WGMXCCGn1
    SolutionIndex: 46
    SolutionNameMin: Cijk_Alik_Bjlk_F8SS_BH_Bias_HAS_SAB_SAV_UserArgs_MT32x32x256_MI16x16x1_SN_GSU0_GSUC0_GSUWGMRR0_K1_LBSPPA256_LBSPPB512_LPB16_MIWT1_1_SU0_SUM0_SUS0_VWA1_VWB1_WGM8_WGMXCC1_WGMXCCGn1
    SolutionIndex: 47
    SolutionNameMin: Cijk_Alik_Bjlk_F8SS_BH_Bias_HAS_SAB_SAV_UserArgs_MT32x32x256_MI16x16x1_SN_GSU0_GSUC0_GSUWGMRR0_K1_LBSPPA256_LBSPPB512_LPB16_MIWT1_1_SU0_SUM0_SUS0_VWA1_VWB1_WGM8_WGMXCC1_WGMXCCGn1
    SolutionIndex: 48
    SolutionNameMin: Cijk_Alik_Bjlk_F8SS_BH_Bias_HAS_SAB_SAV_UserArgs_MT32x32x256_MI16x16x1_SN_GSU0_GSUC0_GSUWGMRR0_K1_LBSPPA256_LBSPPB512_LPB16_MIWT1_1_SU0_SUM0_SUS0_VWA1_VWB1_WGM8_WGMXCC1_WGMXCCGn1
    SolutionIndex: 49
    SolutionNameMin: Cijk_Alik_Bjlk_F8SS_BH_Bias_HAS_SAB_SAV_UserArgs_MT32x32x256_MI16x16x1_SN_GSU0_GSUC0_GSUWGMRR0_K1_LBSPPA256_LBSPPB512_LPB16_MIWT1_1_SU0_SUM0_SUS0_VWA1_VWB1_WGM8_WGMXCC1_WGMXCCGn1
    SolutionIndex: 50
    SolutionNameMin: Cijk_Alik_Bjlk_F8SS_BH_Bias_HAS_SAB_SAV_UserArgs_MT32x32x256_MI16x16x1_SN_GSU0_GSUC0_GSUWGMRR0_K1_LBSPPA256_LBSPPB512_LPB16_MIWT1_1_SU0_SUM0_SUS0_VWA1_VWB1_WGM8_WGMXCC1_WGMXCCGn1
    SolutionIndex: 51
    SolutionNameMin: Cijk_Alik_Bjlk_F8SS_BH_Bias_HAS_SAB_SAV_UserArgs_MT32x32x256_MI16x16x1_SN_GSU0_GSUC0_GSUWGMRR0_K1_LBSPPA256_LBSPPB512_LPB16_MIWT1_1_SU0_SUM0_SUS0_VWA1_VWB1_WGM8_WGMXCC1_WGMXCCGn1
    SolutionIndex: 52
    SolutionNameMin: Cijk_Alik_Bjlk_F8SS_BH_Bias_HAS_SAB_SAV_UserArgs_MT32x32x128_MI16x16x1_SN_GSU0_GSUC0_GSUWGMRR0_K1_LBSPPA128_LBSPPB256_LPB16_MIWT1_1_SU32_SUM0_SUS256_VWA1_VWB1_WGM8_WGMXCC1_WGMXCCGn1
- - - [128, 128, 1, 128, 128, 128, 128, 128]
    - [30, 0.41]
  - - [128, 128, 1, 256, 128, 128, 256, 128]
    - [46, 0.74]
  - - [128, 128, 1, 512, 128, 128, 512, 128]
    - [46, 1.29]
  - - [128, 128, 1, 1024, 128, 128, 1024, 128]
    - [48, 2.15]
  - - [128, 128, 1, 2048, 128, 128, 2048, 128]
    - [51, 3.23]
  - - [128, 128, 1, 4096, 128, 128, 4096, 128]
    - [51, 4.21]
  - - [128, 128, 1, 8192, 128, 128, 8192, 128]
    - [51, 5.01]
  - - [128, 256, 1, 128, 128, 128, 128, 256]
    - [31, 0.83]
  - - [128, 256, 1, 256, 128, 128, 256, 256]
    - [46, 1.49]
  - - [128, 256, 1, 512, 128, 128, 512, 256]
    - [46, 2.57]
  - - [128, 256, 1, 1024, 128, 128, 1024, 256]
    - [48, 4.32]
  - - [128, 256, 1, 2048, 128, 128, 2048, 256]
    - [48, 6.44]
  - - [128, 256, 1, 4096, 128, 128, 4096, 256]
    - [51, 8.46]
  - - [128, 256, 1, 8192, 128, 128, 8192, 256]
    - [51, 10.15]
  - - [128, 512, 1, 128, 128, 128, 128, 512]
    - [31, 1.66]
  - - [128, 512, 1, 256, 128, 128, 256, 512]
    - [48, 2.99]
  - - [128, 512, 1, 512, 128, 128, 512, 512]
    - [48, 5.21]
  - - [128, 512, 1, 1024, 128, 128, 1024, 512]
    - [48, 8.68]
  - - [128, 512, 1, 2048, 128, 128, 2048, 512]
    - [48, 12.67]
  - - [128, 512, 1, 4096, 128, 128, 4096, 512]
    - [51, 16.68]
  - - [128, 512, 1, 8192, 128, 128, 8192, 512]
    - [51, 19.77]
  - - [128, 1024, 1, 128, 128, 128, 128, 1024]
    - [31, 3.23]
  - - [128, 1024, 1, 256, 128, 128, 256, 1024]
    - [47, 5.8]
  - - [128, 1024, 1, 512, 128, 128, 512, 1024]
    - [46, 9.89]
  - - [128, 1024, 1, 1024, 128, 128, 1024, 1024]
    - [48, 16.28]
  - - [128, 1024, 1, 2048, 128, 128, 2048, 1024]
    - [48, 24.1]
  - - [128, 1024, 1, 4096, 128, 128, 4096, 1024]
    - [49, 30.97]
  - - [128, 1024, 1, 8192, 128, 128, 8192, 1024]
    - [49, 36.53]
  - - [128, 2048, 1, 128, 128, 128, 128, 2048]
    - [31, 6.1]
  - - [128, 2048, 1, 256, 128, 128, 256, 2048]
    - [48, 11.16]
  - - [128, 2048, 1, 512, 128, 128, 512, 2048]
    - [48, 19.31]
  - - [128, 2048, 1, 1024, 128, 128, 1024, 2048]
    - [46, 31.28]
  - - [128, 2048, 1, 2048, 128, 128, 2048, 2048]
    - [50, 45.32]
  - - [128, 2048, 1, 4096, 128, 128, 4096, 2048]
    - [49, 59.56]
  - - [128, 2048, 1, 8192, 128, 128, 8192, 2048]
    - [50, 69.88]
  - - [128, 4096, 1, 128, 128, 128, 128, 4096]
    - [28, 11.34]
  - - [128, 4096, 1, 256, 128, 128, 256, 4096]
    - [28, 20.38]
  - - [128, 4096, 1, 512, 128, 128, 512, 4096]
    - [28, 34.84]
  - - [128, 4096, 1, 1024, 128, 128, 1024, 4096]
    - [44, 55.48]
  - - [128, 4096, 1, 2048, 128, 128, 2048, 4096]
    - [44, 81.16]
  - - [128, 4096, 1, 4096, 128, 128, 4096, 4096]
    - [44, 103.37]
  - - [128, 4096, 1, 8192, 128, 128, 8192, 4096]
    - [42, 110.22]
  - - [128, 8192, 1, 128, 128, 128, 128, 8192]
    - [23, 19.81]
  - - [128, 8192, 1, 256, 128, 128, 256, 8192]
    - [25, 35.71]
  - - [128, 8192, 1, 512, 128, 128, 512, 8192]
    - [25, 62.27]
  - - [128, 8192, 1, 1024, 128, 128, 1024, 8192]
    - [25, 98.31]
  - - [128, 8192, 1, 2048, 128, 128, 2048, 8192]
    - [25, 135.91]
  - - [128, 8192, 1, 4096, 128, 128, 4096, 8192]
    - [39, 166.19]
  - - [128, 8192, 1, 8192, 128, 128, 8192, 8192]
    - [39, 195.19]
  - - [256, 128, 1, 128, 256, 256, 128, 128]
    - [31, 0.82]
  - - [256, 128, 1, 256, 256, 256, 256, 128]
    - [46, 1.48]
  - - [256, 128, 1, 512, 256, 256, 512, 128]
    - [45, 2.57]
  - - [256, 128, 1, 1024, 256, 256, 1024, 128]
    - [48, 4.3]
  - - [256, 128, 1, 2048, 256, 256, 2048, 128]
    - [51, 6.38]
  - - [256, 128, 1, 4096, 256, 256, 4096, 128]
    - [51, 8.45]
  - - [256, 128, 1, 8192, 256, 256, 8192, 128]
    - [51, 10.11]
  - - [256, 256, 1, 128, 256, 256, 128, 256]
    - [30, 1.64]
  - - [256, 256, 1, 256, 256, 256, 256, 256]
    - [47, 2.94]
  - - [256, 256, 1, 512, 256, 256, 512, 256]
    - [48, 5.16]
  - - [256, 256, 1, 1024, 256, 256, 1024, 256]
    - [48, 8.71]
  - - [256, 256, 1, 2048, 256, 256, 2048, 256]
    - [48, 12.85]
  - - [256, 256, 1, 4096, 256, 256, 4096, 256]
    - [51, 17.09]
  - - [256, 256, 1, 8192, 256, 256, 8192, 256]
    - [51, 20.57]
  - - [256, 512, 1, 128, 256, 256, 128, 512]
    - [31, 3.23]
  - - [256, 512, 1, 256, 256, 256, 256, 512]
    - [45, 5.85]
  - - [256, 512, 1, 512, 256, 256, 512, 512]
    - [48, 10.4]
  - - [256, 512, 1, 1024, 256, 256, 1024, 512]
    - [48, 17.28]
  - - [256, 512, 1, 2048, 256, 256, 2048, 512]
    - [48, 25.56]
  - - [256, 512, 1, 4096, 256, 256, 4096, 512]
    - [51, 33.53]
  - - [256, 512, 1, 8192, 256, 256, 8192, 512]
    - [51, 39.79]
  - - [256, 1024, 1, 128, 256, 256, 128, 1024]
    - [32, 6.15]
  - - [256, 1024, 1, 256, 256, 256, 256, 1024]
    - [48, 11.36]
  - - [256, 1024, 1, 512, 256, 256, 512, 1024]
    - [48, 19.53]
  - - [256, 1024, 1, 1024, 256, 256, 1024, 1024]
    - [46, 32.14]
  - - [256, 1024, 1, 2048, 256, 256, 2048, 1024]
    - [48, 47.01]
  - - [256, 1024, 1, 4096, 256, 256, 4096, 1024]
    - [51, 61.78]
  - - [256, 1024, 1, 8192, 256, 256, 8192, 1024]
    - [51, 71.97]
  - - [256, 2048, 1, 128, 256, 256, 128, 2048]
    - [27, 11.3]
  - - [256, 2048, 1, 256, 256, 256, 256, 2048]
    - [41, 20.51]
  - - [256, 2048, 1, 512, 256, 256, 512, 2048]
    - [28, 35.3]
  - - [256, 2048, 1, 1024, 256, 256, 1024, 2048]
    - [44, 58.05]
  - - [256, 2048, 1, 2048, 256, 256, 2048, 2048]
    - [44, 85.21]
  - - [256, 2048, 1, 4096, 256, 256, 4096, 2048]
    - [44, 108.47]
  - - [256, 2048, 1, 8192, 256, 256, 8192, 2048]
    - [44, 123.98]
  - - [256, 4096, 1, 128, 256, 256, 128, 4096]
    - [23, 19.9]
  - - [256, 4096, 1, 256, 256, 256, 256, 4096]
    - [24, 35.77]
  - - [256, 4096, 1, 512, 256, 256, 512, 4096]
    - [25, 62.55]
  - - [256, 4096, 1, 1024, 256, 256, 1024, 4096]
    - [39, 98.43]
  - - [256, 4096, 1, 2048, 256, 256, 2048, 4096]
    - [39, 140.89]
  - - [256, 4096, 1, 4096, 256, 256, 4096, 4096]
    - [39, 180.46]
  - - [256, 4096, 1, 8192, 256, 256, 8192, 4096]
    - [39, 197.6]
  - - [256, 8192, 1, 128, 256, 256, 128, 8192]
    - [19, 31.45]
  - - [256, 8192, 1, 256, 256, 256, 256, 8192]
    - [20, 57.84]
  - - [256, 8192, 1, 512, 256, 256, 512, 8192]
    - [22, 100.73]
  - - [256, 8192, 1, 1024, 256, 256, 1024, 8192]
    - [22, 157.81]
  - - [256, 8192, 1, 2048, 256, 256, 2048, 8192]
    - [22, 221.19]
  - - [256, 8192, 1, 4096, 256, 256, 4096, 8192]
    - [22, 280.34]
  - - [256, 8192, 1, 8192, 256, 256, 8192, 8192]
    - [22, 319.53]
  - - [512, 128, 1, 128, 512, 512, 128, 128]
    - [31, 1.63]
  - - [512, 128, 1, 256, 512, 512, 256, 128]
    - [46, 3.0]
  - - [512, 128, 1, 512, 512, 512, 512, 128]
    - [46, 5.17]
  - - [512, 128, 1, 1024, 512, 512, 1024, 128]
    - [48, 8.68]
  - - [512, 128, 1, 2048, 512, 512, 2048, 128]
    - [51, 12.88]
  - - [512, 128, 1, 4096, 512, 512, 4096, 128]
    - [51, 17.19]
  - - [512, 128, 1, 8192, 512, 512, 8192, 128]
    - [51, 20.48]
  - - [512, 256, 1, 128, 512, 512, 128, 256]
    - [31, 3.2]
  - - [512, 256, 1, 256, 512, 512, 256, 256]
    - [46, 5.91]
  - - [512, 256, 1, 512, 512, 512, 512, 256]
    - [48, 10.36]
  - - [512, 256, 1, 1024, 512, 512, 1024, 256]
    - [48, 17.21]
  - - [512, 256, 1, 2048, 512, 512, 2048, 256]
    - [48, 25.62]
  - - [512, 256, 1, 4096, 512, 512, 4096, 256]
    - [51, 34.07]
  - - [512, 256, 1, 8192, 512, 512, 8192, 256]
    - [51, 40.98]
  - - [512, 512, 1, 128, 512, 512, 128, 512]
    - [29, 6.26]
  - - [512, 512, 1, 256, 512, 512, 256, 512]
    - [45, 11.47]
  - - [512, 512, 1, 512, 512, 512, 512, 512]
    - [48, 20.1]
  - - [512, 512, 1, 1024, 512, 512, 1024, 512]
    - [48, 33.52]
  - - [512, 512, 1, 2048, 512, 512, 2048, 512]
    - [48, 50.01]
  - - [512, 512, 1, 4096, 512, 512, 4096, 512]
    - [51, 65.63]
  - - [512, 512, 1, 8192, 512, 512, 8192, 512]
    - [51, 78.21]
  - - [512, 1024, 1, 128, 512, 512, 128, 1024]
    - [26, 11.45]
  - - [512, 1024, 1, 256, 512, 512, 256, 1024]
    - [28, 20.67]
  - - [512, 1024, 1, 512, 512, 512, 512, 1024]
    - [28, 35.77]
  - - [512, 1024, 1, 1024, 512, 512, 1024, 1024]
    - [44, 59.27]
  - - [512, 1024, 1, 2048, 512, 512, 2048, 1024]
    - [44, 87.83]
  - - [512, 1024, 1, 4096, 512, 512, 4096, 1024]
    - [44, 111.33]
  - - [512, 1024, 1, 8192, 512, 512, 8192, 1024]
    - [44, 125.12]
  - - [512, 2048, 1, 128, 512, 512, 128, 2048]
    - [23, 19.93]
  - - [512, 2048, 1, 256, 512, 512, 256, 2048]
    - [25, 35.96]
  - - [512, 2048, 1, 512, 512, 512, 512, 2048]
    - [25, 62.13]
  - - [512, 2048, 1, 1024, 512, 512, 1024, 2048]
    - [39, 99.94]
  - - [512, 2048, 1, 2048, 512, 512, 2048, 2048]
    - [39, 144.87]
  - - [512, 2048, 1, 4096, 512, 512, 4096, 2048]
    - [39, 184.45]
  - - [512, 2048, 1, 8192, 512, 512, 8192, 2048]
    - [39, 208.34]
  - - [512, 4096, 1, 128, 512, 512, 128, 4096]
    - [21, 31.63]
  - - [512, 4096, 1, 256, 512, 512, 256, 4096]
    - [20, 58.07]
  - - [512, 4096, 1, 512, 512, 512, 512, 4096]
    - [22, 101.58]
  - - [512, 4096, 1, 1024, 512, 512, 1024, 4096]
    - [22, 162.11]
  - - [512, 4096, 1, 2048, 512, 512, 2048, 4096]
    - [38, 227.86]
  - - [512, 4096, 1, 4096, 512, 512, 4096, 4096]
    - [38, 286.75]
  - - [512, 4096, 1, 8192, 512, 512, 8192, 4096]
    - [38, 333.26]
  - - [512, 8192, 1, 128, 512, 512, 128, 8192]
    - [16, 40.66]
  - - [512, 8192, 1, 256, 512, 512, 256, 8192]
    - [16, 74.31]
  - - [512, 8192, 1, 512, 512, 512, 512, 8192]
    - [16, 134.6]
  - - [512, 8192, 1, 1024, 512, 512, 1024, 8192]
    - [18, 217.93]
  - - [512, 8192, 1, 2048, 512, 512, 2048, 8192]
    - [18, 314.68]
  - - [512, 8192, 1, 4096, 512, 512, 4096, 8192]
    - [18, 402.17]
  - - [512, 8192, 1, 8192, 512, 512, 8192, 8192]
    - [37, 452.1]
  - - [1024, 128, 1, 128, 1024, 1024, 128, 128]
    - [31, 3.24]
  - - [1024, 128, 1, 256, 1024, 1024, 256, 128]
    - [46, 5.88]
  - - [1024, 128, 1, 512, 1024, 1024, 512, 128]
    - [46, 10.22]
  - - [1024, 128, 1, 1024, 1024, 1024, 1024, 128]
    - [48, 17.05]
  - - [1024, 128, 1, 2048, 1024, 1024, 2048, 128]
    - [48, 25.47]
  - - [1024, 128, 1, 4096, 1024, 1024, 4096, 128]
    - [51, 33.81]
  - - [1024, 128, 1, 8192, 1024, 1024, 8192, 128]
    - [51, 40.51]
  - - [1024, 256, 1, 128, 1024, 1024, 128, 256]
    - [31, 6.28]
  - - [1024, 256, 1, 256, 1024, 1024, 256, 256]
    - [45, 11.38]
  - - [1024, 256, 1, 512, 1024, 1024, 512, 256]
    - [48, 19.93]
  - - [1024, 256, 1, 1024, 1024, 1024, 1024, 256]
    - [48, 33.11]
  - - [1024, 256, 1, 2048, 1024, 1024, 2048, 256]
    - [51, 49.14]
  - - [1024, 256, 1, 4096, 1024, 1024, 4096, 256]
    - [51, 65.29]
  - - [1024, 256, 1, 8192, 1024, 1024, 8192, 256]
    - [51, 79.18]
  - - [1024, 512, 1, 128, 1024, 1024, 128, 512]
    - [28, 11.58]
  - - [1024, 512, 1, 256, 1024, 1024, 256, 512]
    - [28, 20.71]
  - - [1024, 512, 1, 512, 1024, 1024, 512, 512]
    - [28, 35.93]
  - - [1024, 512, 1, 1024, 1024, 1024, 1024, 512]
    - [43, 59.56]
  - - [1024, 512, 1, 2048, 1024, 1024, 2048, 512]
    - [44, 88.95]
  - - [1024, 512, 1, 4096, 1024, 1024, 4096, 512]
    - [44, 117.04]
  - - [1024, 512, 1, 8192, 1024, 1024, 8192, 512]
    - [44, 140.31]
  - - [1024, 1024, 1, 128, 1024, 1024, 128, 1024]
    - [25, 20.1]
  - - [1024, 1024, 1, 256, 1024, 1024, 256, 1024]
    - [25, 36.35]
  - - [1024, 1024, 1, 512, 1024, 1024, 512, 1024]
    - [25, 63.08]
  - - [1024, 1024, 1, 1024, 1024, 1024, 1024, 1024]
    - [39, 100.52]
  - - [1024, 1024, 1, 2048, 1024, 1024, 2048, 1024]
    - [39, 146.42]
  - - [1024, 1024, 1, 4096, 1024, 1024, 4096, 1024]
    - [39, 185.84]
  - - [1024, 1024, 1, 8192, 1024, 1024, 8192, 1024]
    - [39, 212.14]
  - - [1024, 2048, 1, 128, 1024, 1024, 128, 2048]
    - [20, 31.9]
  - - [1024, 2048, 1, 256, 1024, 1024, 256, 2048]
    - [20, 58.07]
  - - [1024, 2048, 1, 512, 1024, 1024, 512, 2048]
    - [22, 101.09]
  - - [1024, 2048, 1, 1024, 1024, 1024, 1024, 2048]
    - [22, 162.18]
  - - [1024, 2048, 1, 2048, 1024, 1024, 2048, 2048]
    - [38, 235.81]
  - - [1024, 2048, 1, 4096, 1024, 1024, 4096, 2048]
    - [38, 300.5]
  - - [1024, 2048, 1, 8192, 1024, 1024, 8192, 2048]
    - [38, 344.28]
  - - [1024, 4096, 1, 128, 1024, 1024, 128, 4096]
    - [16, 40.83]
  - - [1024, 4096, 1, 256, 1024, 1024, 256, 4096]
    - [18, 74.54]
  - - [1024, 4096, 1, 512, 1024, 1024, 512, 4096]
    - [18, 132.12]
  - - [1024, 4096, 1, 1024, 1024, 1024, 1024, 4096]
    - [18, 215.12]
  - - [1024, 4096, 1, 2048, 1024, 1024, 2048, 4096]
    - [18, 317.64]
  - - [1024, 4096, 1, 4096, 1024, 1024, 4096, 4096]
    - [18, 415.58]
  - - [1024, 4096, 1, 8192, 1024, 1024, 8192, 4096]
    - [37, 464.3]
  - - [1024, 8192, 1, 128, 1024, 1024, 128, 8192]
    - [8, 55.65]
  - - [1024, 8192, 1, 256, 1024, 1024, 256, 8192]
    - [11, 100.9]
  - - [1024, 8192, 1, 512, 1024, 1024, 512, 8192]
    - [11, 168.61]
  - - [1024, 8192, 1, 1024, 1024, 1024, 1024, 8192]
    - [11, 263.34]
  - - [1024, 8192, 1, 2048, 1024, 1024, 2048, 8192]
    - [35, 394.87]
  - - [1024, 8192, 1, 4096, 1024, 1024, 4096, 8192]
    - [15, 500.09]
  - - [1024, 8192, 1, 8192, 1024, 1024, 8192, 8192]
    - [35, 511.67]
  - - [2048, 128, 1, 128, 2048, 2048, 128, 128]
    - [31, 6.24]
  - - [2048, 128, 1, 256, 2048, 2048, 256, 128]
    - [46, 11.37]
  - - [2048, 128, 1, 512, 2048, 2048, 512, 128]
    - [48, 19.67]
  - - [2048, 128, 1, 1024, 2048, 2048, 1024, 128]
    - [48, 32.51]
  - - [2048, 128, 1, 2048, 2048, 2048, 2048, 128]
    - [48, 48.63]
  - - [2048, 128, 1, 4096, 2048, 2048, 4096, 128]
    - [51, 64.62]
  - - [2048, 128, 1, 8192, 2048, 2048, 8192, 128]
    - [51, 78.59]
  - - [2048, 256, 1, 128, 2048, 2048, 128, 256]
    - [28, 11.6]
  - - [2048, 256, 1, 256, 2048, 2048, 256, 256]
    - [43, 20.75]
  - - [2048, 256, 1, 512, 2048, 2048, 512, 256]
    - [43, 35.86]
  - - [2048, 256, 1, 1024, 2048, 2048, 1024, 256]
    - [43, 59.68]
  - - [2048, 256, 1, 2048, 2048, 2048, 2048, 256]
    - [44, 88.0]
  - - [2048, 256, 1, 4096, 2048, 2048, 4096, 256]
    - [44, 116.99]
  - - [2048, 256, 1, 8192, 2048, 2048, 8192, 256]
    - [44, 138.76]
  - - [2048, 512, 1, 128, 2048, 2048, 128, 512]
    - [25, 20.02]
  - - [2048, 512, 1, 256, 2048, 2048, 256, 512]
    - [23, 36.07]
  - - [2048, 512, 1, 512, 2048, 2048, 512, 512]
    - [23, 62.36]
  - - [2048, 512, 1, 1024, 2048, 2048, 1024, 512]
    - [39, 100.75]
  - - [2048, 512, 1, 2048, 2048, 2048, 2048, 512]
    - [39, 148.07]
  - - [2048, 512, 1, 4096, 2048, 2048, 4096, 512]
    - [39, 191.67]
  - - [2048, 512, 1, 8192, 2048, 2048, 8192, 512]
    - [39, 224.36]
  - - [2048, 1024, 1, 128, 2048, 2048, 128, 1024]
    - [20, 31.86]
  - - [2048, 1024, 1, 256, 2048, 2048, 256, 1024]
    - [20, 57.86]
  - - [2048, 1024, 1, 512, 2048, 2048, 512, 1024]
    - [20, 101.5]
  - - [2048, 1024, 1, 1024, 2048, 2048, 1024, 1024]
    - [22, 161.89]
  - - [2048, 1024, 1, 2048, 2048, 2048, 2048, 1024]
    - [38, 235.46]
  - - [2048, 1024, 1, 4096, 2048, 2048, 4096, 1024]
    - [38, 302.88]
  - - [2048, 1024, 1, 8192, 2048, 2048, 8192, 1024]
    - [38, 344.61]
  - - [2048, 2048, 1, 128, 2048, 2048, 128, 2048]
    - [12, 40.98]
  - - [2048, 2048, 1, 256, 2048, 2048, 256, 2048]
    - [12, 74.46]
  - - [2048, 2048, 1, 512, 2048, 2048, 512, 2048]
    - [18, 131.19]
  - - [2048, 2048, 1, 1024, 2048, 2048, 1024, 2048]
    - [18, 217.55]
  - - [2048, 2048, 1, 2048, 2048, 2048, 2048, 2048]
    - [18, 313.87]
  - - [2048, 2048, 1, 4096, 2048, 2048, 4096, 2048]
    - [17, 400.73]
  - - [2048, 2048, 1, 8192, 2048, 2048, 8192, 2048]
    - [18, 445.3]
  - - [2048, 4096, 1, 128, 2048, 2048, 128, 4096]
    - [11, 52.15]
  - - [2048, 4096, 1, 256, 2048, 2048, 256, 4096]
    - [11, 95.09]
  - - [2048, 4096, 1, 512, 2048, 2048, 512, 4096]
    - [10, 160.84]
  - - [2048, 4096, 1, 1024, 2048, 2048, 1024, 4096]
    - [14, 260.4]
  - - [2048, 4096, 1, 2048, 2048, 2048, 2048, 4096]
    - [15, 383.59]
  - - [2048, 4096, 1, 4096, 2048, 2048, 4096, 4096]
    - [15, 483.91]
  - - [2048, 4096, 1, 8192, 2048, 2048, 8192, 4096]
    - [15, 509.63]
  - - [2048, 8192, 1, 128, 2048, 2048, 128, 8192]
    - [1, 58.71]
  - - [2048, 8192, 1, 256, 2048, 2048, 256, 8192]
    - [8, 103.91]
  - - [2048, 8192, 1, 512, 2048, 2048, 512, 8192]
    - [1, 176.83]
  - - [2048, 8192, 1, 1024, 2048, 2048, 1024, 8192]
    - [0, 299.26]
  - - [2048, 8192, 1, 2048, 2048, 2048, 2048, 8192]
    - [0, 455.05]
  - - [2048, 8192, 1, 4096, 2048, 2048, 4096, 8192]
    - [33, 605.3]
  - - [2048, 8192, 1, 8192, 2048, 2048, 8192, 8192]
    - [33, 673.66]
  - - [4096, 128, 1, 128, 4096, 4096, 128, 128]
    - [26, 11.34]
  - - [4096, 128, 1, 256, 4096, 4096, 256, 128]
    - [40, 20.47]
  - - [4096, 128, 1, 512, 4096, 4096, 512, 128]
    - [43, 34.96]
  - - [4096, 128, 1, 1024, 4096, 4096, 1024, 128]
    - [43, 58.43]
  - - [4096, 128, 1, 2048, 4096, 4096, 2048, 128]
    - [43, 86.62]
  - - [4096, 128, 1, 4096, 4096, 4096, 4096, 128]
    - [44, 115.59]
  - - [4096, 128, 1, 8192, 4096, 4096, 8192, 128]
    - [44, 132.71]
  - - [4096, 256, 1, 128, 4096, 4096, 128, 256]
    - [23, 19.79]
  - - [4096, 256, 1, 256, 4096, 4096, 256, 256]
    - [25, 35.88]
  - - [4096, 256, 1, 512, 4096, 4096, 512, 256]
    - [24, 61.85]
  - - [4096, 256, 1, 1024, 4096, 4096, 1024, 256]
    - [39, 100.76]
  - - [4096, 256, 1, 2048, 4096, 4096, 2048, 256]
    - [39, 148.91]
  - - [4096, 256, 1, 4096, 4096, 4096, 4096, 256]
    - [39, 193.15]
  - - [4096, 256, 1, 8192, 4096, 4096, 8192, 256]
    - [39, 223.09]
  - - [4096, 512, 1, 128, 4096, 4096, 128, 512]
    - [20, 31.82]
  - - [4096, 512, 1, 256, 4096, 4096, 256, 512]
    - [20, 57.22]
  - - [4096, 512, 1, 512, 4096, 4096, 512, 512]
    - [20, 100.19]
  - - [4096, 512, 1, 1024, 4096, 4096, 1024, 512]
    - [22, 160.65]
  - - [4096, 512, 1, 2048, 4096, 4096, 2048, 512]
    - [38, 230.98]
  - - [4096, 512, 1, 4096, 4096, 4096, 4096, 512]
    - [38, 295.25]
  - - [4096, 512, 1, 8192, 4096, 4096, 8192, 512]
    - [38, 347.1]
  - - [4096, 1024, 1, 128, 4096, 4096, 128, 1024]
    - [16, 40.45]
  - - [4096, 1024, 1, 256, 4096, 4096, 256, 1024]
    - [18, 73.31]
  - - [4096, 1024, 1, 512, 4096, 4096, 512, 1024]
    - [18, 130.11]
  - - [4096, 1024, 1, 1024, 4096, 4096, 1024, 1024]
    - [18, 215.62]
  - - [4096, 1024, 1, 2048, 4096, 4096, 2048, 1024]
    - [18, 315.41]
  - - [4096, 1024, 1, 4096, 4096, 4096, 4096, 1024]
    - [18, 408.02]
  - - [4096, 1024, 1, 8192, 4096, 4096, 8192, 1024]
    - [18, 457.5]
  - - [4096, 2048, 1, 128, 4096, 4096, 128, 2048]
    - [6, 52.6]
  - - [4096, 2048, 1, 256, 4096, 4096, 256, 2048]
    - [6, 95.75]
  - - [4096, 2048, 1, 512, 4096, 4096, 512, 2048]
    - [36, 165.02]
  - - [4096, 2048, 1, 1024, 4096, 4096, 1024, 2048]
    - [36, 259.81]
  - - [4096, 2048, 1, 2048, 4096, 4096, 2048, 2048]
    - [15, 383.81]
  - - [4096, 2048, 1, 4096, 4096, 4096, 4096, 2048]
    - [34, 467.14]
  - - [4096, 2048, 1, 8192, 4096, 4096, 8192, 2048]
    - [15, 510.04]
  - - [4096, 4096, 1, 128, 4096, 4096, 128, 4096]
    - [4, 58.91]
  - - [4096, 4096, 1, 256, 4096, 4096, 256, 4096]
    - [11, 108.81]
  - - [4096, 4096, 1, 512, 4096, 4096, 512, 4096]
    - [7, 179.21]
  - - [4096, 4096, 1, 1024, 4096, 4096, 1024, 4096]
    - [2, 300.55]
  - - [4096, 4096, 1, 2048, 4096, 4096, 2048, 4096]
    - [33, 459.85]
  - - [4096, 4096, 1, 4096, 4096, 4096, 4096, 4096]
    - [33, 590.62]
  - - [4096, 4096, 1, 8192, 4096, 4096, 8192, 4096]
    - [33, 656.13]
  - - [4096, 8192, 1, 128, 4096, 4096, 128, 8192]
    - [8, 65.96]
  - - [4096, 8192, 1, 256, 4096, 4096, 256, 8192]
    - [8, 116.55]
  - - [4096, 8192, 1, 512, 4096, 4096, 512, 8192]
    - [5, 203.28]
  - - [4096, 8192, 1, 1024, 4096, 4096, 1024, 8192]
    - [3, 319.72]
  - - [4096, 8192, 1, 2048, 4096, 4096, 2048, 8192]
    - [33, 458.55]
  - - [4096, 8192, 1, 4096, 4096, 4096, 4096, 8192]
    - [33, 574.01]
  - - [4096, 8192, 1, 8192, 4096, 4096, 8192, 8192]
    - [33, 675.1]
  - - [8192, 128, 1, 128, 8192, 8192, 128, 128]
    - [25, 19.98]
  - - [8192, 128, 1, 256, 8192, 8192, 256, 128]
    - [25, 35.72]
  - - [8192, 128, 1, 512, 8192, 8192, 512, 128]
    - [25, 61.29]
  - - [8192, 128, 1, 1024, 8192, 8192, 1024, 128]
    - [39, 99.8]
  - - [8192, 128, 1, 2048, 8192, 8192, 2048, 128]
    - [39, 147.18]
  - - [8192, 128, 1, 4096, 8192, 8192, 4096, 128]
    - [39, 186.59]
  - - [8192, 128, 1, 8192, 8192, 8192, 8192, 128]
    - [39, 218.99]
  - - [8192, 256, 1, 128, 8192, 8192, 128, 256]
    - [20, 32.01]
  - - [8192, 256, 1, 256, 8192, 8192, 256, 256]
    - [20, 57.92]
  - - [8192, 256, 1, 512, 8192, 8192, 512, 256]
    - [22, 101.22]
  - - [8192, 256, 1, 1024, 8192, 8192, 1024, 256]
    - [22, 156.47]
  - - [8192, 256, 1, 2048, 8192, 8192, 2048, 256]
    - [22, 221.22]
  - - [8192, 256, 1, 4096, 8192, 8192, 4096, 256]
    - [22, 277.78]
  - - [8192, 256, 1, 8192, 8192, 8192, 8192, 256]
    - [38, 330.52]
  - - [8192, 512, 1, 128, 8192, 8192, 128, 512]
    - [13, 40.62]
  - - [8192, 512, 1, 256, 8192, 8192, 256, 512]
    - [13, 73.88]
  - - [8192, 512, 1, 512, 8192, 8192, 512, 512]
    - [16, 132.11]
  - - [8192, 512, 1, 1024, 8192, 8192, 1024, 512]
    - [17, 209.59]
  - - [8192, 512, 1, 2048, 8192, 8192, 2048, 512]
    - [18, 316.23]
  - - [8192, 512, 1, 4096, 8192, 8192, 4096, 512]
    - [18, 405.84]
  - - [8192, 512, 1, 8192, 8192, 8192, 8192, 512]
    - [17, 422.14]
  - - [8192, 1024, 1, 128, 8192, 8192, 128, 1024]
    - [36, 53.58]
  - - [8192, 1024, 1, 256, 8192, 8192, 256, 1024]
    - [8, 97.47]
  - - [8192, 1024, 1, 512, 8192, 8192, 512, 1024]
    - [9, 163.05]
  - - [8192, 1024, 1, 1024, 8192, 8192, 1024, 1024]
    - [14, 264.79]
  - - [8192, 1024, 1, 2048, 8192, 8192, 2048, 1024]
    - [15, 384.39]
  - - [8192, 1024, 1, 4096, 8192, 8192, 4096, 1024]
    - [15, 467.68]
  - - [8192, 1024, 1, 8192, 8192, 8192, 8192, 1024]
    - [15, 508.38]
  - - [8192, 2048, 1, 128, 8192, 8192, 128, 2048]
    - [11, 60.89]
  - - [8192, 2048, 1, 256, 8192, 8192, 256, 2048]
    - [11, 111.74]
  - - [8192, 2048, 1, 512, 8192, 8192, 512, 2048]
    - [8, 187.52]
  - - [8192, 2048, 1, 1024, 8192, 8192, 1024, 2048]
    - [3, 298.38]
  - - [8192, 2048, 1, 2048, 8192, 8192, 2048, 2048]
    - [33, 442.87]
  - - [8192, 2048, 1, 4096, 8192, 8192, 4096, 2048]
    - [33, 578.49]
  - - [8192, 2048, 1, 8192, 8192, 8192, 8192, 2048]
    - [33, 636.52]
  - - [8192, 4096, 1, 128, 8192, 8192, 128, 4096]
    - [8, 65.63]
  - - [8192, 4096, 1, 256, 8192, 8192, 256, 4096]
    - [11, 117.36]
  - - [8192, 4096, 1, 512, 8192, 8192, 512, 4096]
    - [2, 196.86]
  - - [8192, 4096, 1, 1024, 8192, 8192, 1024, 4096]
    - [33, 323.3]
  - - [8192, 4096, 1, 2048, 8192, 8192, 2048, 4096]
    - [33, 453.08]
  - - [8192, 4096, 1, 4096, 8192, 8192, 4096, 4096]
    - [33, 580.21]
  - - [8192, 4096, 1, 8192, 8192, 8192, 8192, 4096]
    - [33, 684.3]
  - - [8192, 8192, 1, 128, 8192, 8192, 128, 8192]
    - [8, 67.87]
  - - [8192, 8192, 1, 256, 8192, 8192, 256, 8192]
    - [2, 122.34]
  - - [8192, 8192, 1, 512, 8192, 8192, 512, 8192]
    - [0, 212.05]
  - - [8192, 8192, 1, 1024, 8192, 8192, 1024, 8192]
    - [33, 327.31]
  - - [8192, 8192, 1, 2048, 8192, 8192, 2048, 8192]
    - [33, 453.11]
  - - [8192, 8192, 1, 4096, 8192, 8192, 4096, 8192]
    - [33, 604.86]
  - - [8192, 8192, 1, 8192, 8192, 8192, 8192, 8192]
    - [33, 748.58]
  - - [1, 1, 1, 32, 1, 1, 32, 1]
    - [52, 0.0]
- null
- null
- DeviceEfficiency
- GridBased
