projects/hipblaslt/library/src/amd_detail/rocblaslt/src/Tensile/Logic/asm_full/gfx950/GridBased/gfx950_Cijk_Ailk_Bljk_BSS_BH_Bias_HAS_SAV_UserArgs.yaml
- {MinimumRequiredVersion: 4.33.0}
- gfx950
- gfx950
- [Device 75a0]
    SolutionIndex: 0
    SolutionNameMin: Cijk_Ailk_Bljk_BSS_BH_Bias_HAS_SAV_UserArgs_MT128x256x32_MI16x16x1_SN_LDSB1_CLR0_GSU0_GSUC0_GSUWGMRR0_K1_LBSPPA512_LBSPPB512_LPA0_MIWT4_8_PLR0_SU0_SUM0_SUS0_VWA4_VWB8_WGM1_WGMXCC1_WGMXCCGn1
    SolutionIndex: 1
    SolutionNameMin: Cijk_Ailk_Bljk_BSS_BH_Bias_HAS_SAV_UserArgs_MT128x256x32_MI16x16x1_SN_LDSB1_CLR0_GSU0_GSUC0_GSUWGMRR0_K1_LBSPPA512_LBSPPB512_LPA0_MIWT4_8_PLR0_SU0_SUM0_SUS0_VWA4_VWB8_WGM1_WGMXCC1_WGMXCCGn1
    SolutionIndex: 2
    SolutionNameMin: Cijk_Ailk_Bljk_BSS_BH_Bias_HAS_SAV_UserArgs_MT128x256x32_MI16x16x1_SN_LDSB1_CLR0_GSU0_GSUC0_GSUWGMRR0_K1_LBSPPA1024_LBSPPB512_LPA0_MIWT4_8_PLR0_SU0_SUM0_SUS0_VWA4_VWB8_WGM1_WGMXCC1_WGMXCCGn1
    SolutionIndex: 3
    SolutionNameMin: Cijk_Ailk_Bljk_BSS_BH_Bias_HAS_SAV_UserArgs_MT128x256x32_MI16x16x1_SN_LDSB1_CLR0_GSU0_GSUC0_GSUWGMRR0_K1_LBSPPA1024_LBSPPB512_LPA0_MIWT4_8_PLR0_SU0_SUM0_SUS0_VWA4_VWB8_WGM6_WGMXCC1_WGMXCCGn1
    SolutionIndex: 4
    SolutionNameMin: Cijk_Ailk_Bljk_BSS_BH_Bias_HAS_SAV_UserArgs_MT128x256x32_MI16x16x1_SN_LDSB1_CLR0_GSU0_GSUC0_GSUWGMRR0_K1_LBSPPA1024_LBSPPB512_LPA0_MIWT4_8_PLR0_SU0_SUM0_SUS0_VWA4_VWB8_WGM6_WGMXCC1_WGMXCCGn1
    SolutionIndex: 5
    SolutionNameMin: Cijk_Ailk_Bljk_BSS_BH_Bias_HAS_SAV_UserArgs_MT256x128x32_MI16x16x1_SN_LDSB1_CLR0_GSU0_GSUC0_GSUWGMRR0_K1_LBSPPA2048_LBSPPB256_LPA0_MIWT8_4_PLR0_SU0_SUM0_SUS0_VWA8_VWB4_WGM6_WGMXCC1_WGMXCCGn1
    SolutionIndex: 6
    SolutionNameMin: Cijk_Ailk_Bljk_BSS_BH_Bias_HAS_SAV_UserArgs_MT256x128x32_MI16x16x1_SN_LDSB1_CLR0_GSU0_GSUC0_GSUWGMRR0_K1_LBSPPA2048_LBSPPB256_LPA0_MIWT8_4_PLR0_SU0_SUM0_SUS0_VWA8_VWB4_WGM8_WGMXCC1_WGMXCCGn1
    SolutionIndex: 7
    SolutionNameMin: Cijk_Ailk_Bljk_BSS_BH_Bias_HAS_SAV_UserArgs_MT256x128x32_MI16x16x1_SN_LDSB1_CLR0_GSU0_GSUC0_GSUWGMRR0_K1_LBSPPA2048_LBSPPB256_LPA0_MIWT8_4_PLR0_SU0_SUM0_SUS0_VWA8_VWB4_WGM8_WGMXCC1_WGMXCCGn1
    SolutionIndex: 8
    SolutionNameMin: Cijk_Ailk_Bljk_BSS_BH_Bias_HAS_SAV_UserArgs_MT128x128x32_MI16x16x1_SN_LDSB1_CLR0_GSU0_GSUC0_GSUWGMRR0_K1_LBSPPA1024_LBSPPB256_LPA0_MIWT4_4_PLR0_SU0_SUM0_SUS0_VWA4_VWB4_WGM1_WGMXCC1_WGMXCCGn1
    SolutionIndex: 9
    SolutionNameMin: Cijk_Ailk_Bljk_BSS_BH_Bias_HAS_SAV_UserArgs_MT128x128x32_MI16x16x1_SN_LDSB1_CLR0_GSU0_GSUC0_GSUWGMRR0_K1_LBSPPA2048_LBSPPB256_LPA0_MIWT4_4_PLR0_SU0_SUM0_SUS0_VWA4_VWB4_WGM1_WGMXCC1_WGMXCCGn1
    SolutionIndex: 10
    SolutionNameMin: Cijk_Ailk_Bljk_BSS_BH_Bias_HAS_SAV_UserArgs_MT128x128x32_MI16x16x1_SN_LDSB1_CLR0_GSU0_GSUC0_GSUWGMRR0_K1_LBSPPA2048_LBSPPB256_LPA0_MIWT4_4_PLR0_SU0_SUM0_SUS0_VWA4_VWB4_WGM6_WGMXCC1_WGMXCCGn1
    SolutionIndex: 11
    SolutionNameMin: Cijk_Ailk_Bljk_BSS_BH_Bias_HAS_SAV_UserArgs_MT256x256x32_MI32x32x1_SN_LDSB0_CLR1_GSU0_GSUC0_GSUWGMRR0_K1_LBSPPA0_LBSPPB256_LPA0_MIWT4_4_PLR1_SU0_SUM0_SUS0_VWA4_VWB4_WGM1_WGMXCC1_WGMXCCGn1
    SolutionIndex: 12
    SolutionNameMin: Cijk_Ailk_Bljk_BSS_BH_Bias_HAS_SAV_UserArgs_MT256x256x32_MI32x32x1_SN_LDSB0_CLR1_GSU0_GSUC0_GSUWGMRR0_K1_LBSPPA0_LBSPPB256_LPA0_MIWT4_4_PLR1_SU0_SUM0_SUS0_VWA4_VWB4_WGM1_WGMXCC1_WGMXCCGn1
    SolutionIndex: 13
    SolutionNameMin: Cijk_Ailk_Bljk_BSS_BH_Bias_HAS_SAV_UserArgs_MT256x256x32_MI32x32x1_SN_LDSB0_CLR1_GSU0_GSUC0_GSUWGMRR0_K1_LBSPPA0_LBSPPB256_LPA0_MIWT4_4_PLR1_SU0_SUM0_SUS0_VWA4_VWB4_WGM6_WGMXCC1_WGMXCCGn1
    SolutionIndex: 14
    SolutionNameMin: Cijk_Ailk_Bljk_BSS_BH_Bias_HAS_SAV_UserArgs_MT256x256x32_MI32x32x1_SN_LDSB0_CLR1_GSU0_GSUC0_GSUWGMRR0_K1_LBSPPA0_LBSPPB256_LPA0_MIWT4_4_PLR1_SU0_SUM0_SUS0_VWA4_VWB4_WGM6_WGMXCC1_WGMXCCGn1
    SolutionIndex: 15
    SolutionNameMin: Cijk_Ailk_Bljk_BSS_BH_Bias_HAS_SAV_UserArgs_MT256x256x32_MI32x32x1_SN_LDSB0_CLR1_GSU0_GSUC0_GSUWGMRR0_K1_LBSPPA0_LBSPPB256_LPA0_MIWT4_4_PLR1_SU0_SUM0_SUS0_VWA4_VWB4_WGM6_WGMXCC1_WGMXCCGn1
    SolutionIndex: 16
    SolutionNameMin: Cijk_Ailk_Bljk_BSS_BH_Bias_HAS_SAV_UserArgs_MT256x256x32_MI32x32x1_SN_LDSB0_CLR1_GSU0_GSUC0_GSUWGMRR0_K1_LBSPPA0_LBSPPB256_LPA0_MIWT4_4_PLR1_SU0_SUM0_SUS0_VWA4_VWB4_WGM8_WGMXCC1_WGMXCCGn1
    SolutionIndex: 17
    SolutionNameMin: Cijk_Ailk_Bljk_BSS_BH_Bias_HAS_SAV_UserArgs_MT256x256x32_MI32x32x1_SN_LDSB0_CLR1_GSU0_GSUC0_GSUWGMRR0_K1_LBSPPA0_LBSPPB256_LPA0_MIWT4_4_PLR1_SU0_SUM0_SUS0_VWA4_VWB4_WGM8_WGMXCC1_WGMXCCGn1
    SolutionIndex: 18
    SolutionNameMin: Cijk_Ailk_Bljk_BSS_BH_Bias_HAS_SAV_UserArgs_MT256x256x32_MI32x32x1_SN_LDSB0_CLR1_GSU0_GSUC0_GSUWGMRR0_K1_LBSPPA0_LBSPPB256_LPA0_MIWT4_4_PLR1_SU0_SUM0_SUS0_VWA4_VWB4_WGM8_WGMXCC1_WGMXCCGn1
    SolutionIndex: 19
    SolutionNameMin: Cijk_Ailk_Bljk_BSS_BH_Bias_HAS_SAV_UserArgs_MT256x128x32_MI32x32x1_SN_LDSB1_CLR1_GSU0_GSUC0_GSUWGMRR0_K1_LBSPPA0_LBSPPB128_LPA0_MIWT4_2_PLR1_SU0_SUM0_SUS0_VWA4_VWB2_WGM6_WGMXCC1_WGMXCCGn1
    SolutionIndex: 20
    SolutionNameMin: Cijk_Ailk_Bljk_BSS_BH_Bias_HAS_SAV_UserArgs_MT256x128x32_MI32x32x1_SN_LDSB1_CLR1_GSU0_GSUC0_GSUWGMRR0_K1_LBSPPA0_LBSPPB128_LPA0_MIWT4_2_PLR1_SU0_SUM0_SUS0_VWA4_VWB2_WGM8_WGMXCC1_WGMXCCGn1
    SolutionIndex: 21
    SolutionNameMin: Cijk_Ailk_Bljk_BSS_BH_Bias_HAS_SAV_UserArgs_MT256x128x32_MI32x32x1_SN_LDSB1_CLR1_GSU0_GSUC0_GSUWGMRR0_K1_LBSPPA0_LBSPPB128_LPA0_MIWT4_2_PLR1_SU0_SUM0_SUS0_VWA4_VWB2_WGM8_WGMXCC1_WGMXCCGn1
    SolutionIndex: 22
    SolutionNameMin: Cijk_Ailk_Bljk_BSS_BH_Bias_HAS_SAV_UserArgs_MT256x256x64_MI16x16x1_SN_LDSB1_CLR1_GSU0_GSUC0_GSUWGMRR0_K1_LBSPPA1024_LBSPPB1024_LPA0_MIWT8_8_PLR1_SU0_SUM0_SUS0_VWA8_VWB8_WGM6_WGMXCC1_WGMXCCGn1
    SolutionIndex: 23
    SolutionNameMin: Cijk_Ailk_Bljk_BSS_BH_Bias_HAS_SAV_UserArgs_MT256x256x64_MI16x16x1_SN_LDSB1_CLR1_GSU0_GSUC0_GSUWGMRR0_K1_LBSPPA2048_LBSPPB1024_LPA0_MIWT8_8_PLR1_SU0_SUM0_SUS0_VWA8_VWB8_WGM6_WGMXCC1_WGMXCCGn1
    SolutionIndex: 24
    SolutionNameMin: Cijk_Ailk_Bljk_BSS_BH_Bias_HAS_SAV_UserArgs_MT256x256x64_MI16x16x1_SN_LDSB1_CLR1_GSU0_GSUC0_GSUWGMRR0_K1_LBSPPA4096_LBSPPB1024_LPA0_MIWT8_8_PLR1_SU0_SUM0_SUS0_VWA8_VWB8_WGM6_WGMXCC1_WGMXCCGn1
    SolutionIndex: 25
    SolutionNameMin: Cijk_Ailk_Bljk_BSS_BH_Bias_HAS_SAV_UserArgs_MT256x256x64_MI16x16x1_SN_LDSB1_CLR1_GSU0_GSUC0_GSUWGMRR0_K1_LBSPPA2048_LBSPPB1024_LPA0_MIWT8_8_PLR1_SU0_SUM0_SUS0_VWA8_VWB8_WGM8_WGMXCC1_WGMXCCGn1
    SolutionIndex: 26
    SolutionNameMin: Cijk_Ailk_Bljk_BSS_BH_Bias_HAS_SAV_UserArgs_MT256x256x64_MI16x16x1_SN_LDSB1_CLR1_GSU0_GSUC0_GSUWGMRR0_K1_LBSPPA2048_LBSPPB1024_LPA0_MIWT8_8_PLR1_SU0_SUM0_SUS0_VWA8_VWB8_WGM8_WGMXCC1_WGMXCCGn1
    SolutionIndex: 27
    SolutionNameMin: Cijk_Ailk_Bljk_BSS_BH_Bias_HAS_SAV_UserArgs_MT256x256x64_MI16x16x1_SN_LDSB1_CLR1_GSU0_GSUC0_GSUWGMRR0_K1_LBSPPA4096_LBSPPB1024_LPA0_MIWT8_8_PLR1_SU0_SUM0_SUS0_VWA8_VWB8_WGM8_WGMXCC1_WGMXCCGn1
    SolutionIndex: 28
    SolutionNameMin: Cijk_Ailk_Bljk_BSS_BH_Bias_HAS_SAV_UserArgs_MT128x256x64_MI16x16x1_SN_LDSB1_CLR1_GSU0_GSUC0_GSUWGMRR0_K1_LBSPPA512_LBSPPB1024_LPA0_MIWT4_8_PLR1_SU0_SUM0_SUS0_VWA4_VWB8_WGM1_WGMXCC1_WGMXCCGn1
    SolutionIndex: 29
    SolutionNameMin: Cijk_Ailk_Bljk_BSS_BH_Bias_HAS_SAV_UserArgs_MT128x256x64_MI16x16x1_SN_LDSB1_CLR1_GSU0_GSUC0_GSUWGMRR0_K1_LBSPPA512_LBSPPB1024_LPA0_MIWT4_8_PLR1_SU0_SUM0_SUS0_VWA4_VWB8_WGM1_WGMXCC1_WGMXCCGn1
    SolutionIndex: 30
    SolutionNameMin: Cijk_Ailk_Bljk_BSS_BH_Bias_HAS_SAV_UserArgs_MT128x256x64_MI16x16x1_SN_LDSB1_CLR1_GSU0_GSUC0_GSUWGMRR0_K1_LBSPPA1024_LBSPPB1024_LPA0_MIWT4_8_PLR1_SU0_SUM0_SUS0_VWA4_VWB8_WGM1_WGMXCC1_WGMXCCGn1
    SolutionIndex: 31
    SolutionNameMin: Cijk_Ailk_Bljk_BSS_BH_Bias_HAS_SAV_UserArgs_MT128x256x64_MI16x16x1_SN_LDSB1_CLR1_GSU0_GSUC0_GSUWGMRR0_K1_LBSPPA1024_LBSPPB1024_LPA0_MIWT4_8_PLR1_SU0_SUM0_SUS0_VWA4_VWB8_WGM1_WGMXCC1_WGMXCCGn1
    SolutionIndex: 32
    SolutionNameMin: Cijk_Ailk_Bljk_BSS_BH_Bias_HAS_SAV_UserArgs_MT128x256x64_MI16x16x1_SN_LDSB1_CLR1_GSU0_GSUC0_GSUWGMRR0_K1_LBSPPA2048_LBSPPB1024_LPA0_MIWT4_8_PLR1_SU0_SUM0_SUS0_VWA4_VWB8_WGM1_WGMXCC1_WGMXCCGn1
    SolutionIndex: 33
    SolutionNameMin: Cijk_Ailk_Bljk_BSS_BH_Bias_HAS_SAV_UserArgs_MT128x256x64_MI16x16x1_SN_LDSB1_CLR1_GSU0_GSUC0_GSUWGMRR0_K1_LBSPPA2048_LBSPPB1024_LPA0_MIWT4_8_PLR1_SU0_SUM0_SUS0_VWA4_VWB8_WGM1_WGMXCC1_WGMXCCGn1
    SolutionIndex: 34
    SolutionNameMin: Cijk_Ailk_Bljk_BSS_BH_Bias_HAS_SAV_UserArgs_MT128x256x64_MI16x16x1_SN_LDSB1_CLR1_GSU0_GSUC0_GSUWGMRR0_K1_LBSPPA2048_LBSPPB1024_LPA0_MIWT4_8_PLR1_SU0_SUM0_SUS0_VWA4_VWB8_WGM6_WGMXCC1_WGMXCCGn1
    SolutionIndex: 35
    SolutionNameMin: Cijk_Ailk_Bljk_BSS_BH_Bias_HAS_SAV_UserArgs_MT128x256x64_MI16x16x1_SN_LDSB1_CLR1_GSU0_GSUC0_GSUWGMRR0_K1_LBSPPA2048_LBSPPB1024_LPA0_MIWT4_8_PLR1_SU0_SUM0_SUS0_VWA4_VWB8_WGM6_WGMXCC1_WGMXCCGn1
    SolutionIndex: 36
    SolutionNameMin: Cijk_Ailk_Bljk_BSS_BH_Bias_HAS_SAV_UserArgs_MT128x256x64_MI16x16x1_SN_LDSB1_CLR1_GSU0_GSUC0_GSUWGMRR0_K1_LBSPPA512_LBSPPB1024_LPA0_MIWT4_8_PLR1_SU0_SUM0_SUS0_VWA4_VWB8_WGM8_WGMXCC1_WGMXCCGn1
    SolutionIndex: 37
    SolutionNameMin: Cijk_Ailk_Bljk_BSS_BH_Bias_HAS_SAV_UserArgs_MT128x256x64_MI16x16x1_SN_LDSB1_CLR1_GSU0_GSUC0_GSUWGMRR0_K1_LBSPPA512_LBSPPB1024_LPA0_MIWT4_8_PLR1_SU0_SUM0_SUS0_VWA4_VWB8_WGM8_WGMXCC1_WGMXCCGn1
    SolutionIndex: 38
    SolutionNameMin: Cijk_Ailk_Bljk_BSS_BH_Bias_HAS_SAV_UserArgs_MT128x256x64_MI16x16x1_SN_LDSB1_CLR1_GSU0_GSUC0_GSUWGMRR0_K1_LBSPPA512_LBSPPB1024_LPA0_MIWT4_8_PLR1_SU0_SUM0_SUS0_VWA4_VWB8_WGM8_WGMXCC1_WGMXCCGn1
    SolutionIndex: 39
    SolutionNameMin: Cijk_Ailk_Bljk_BSS_BH_Bias_HAS_SAV_UserArgs_MT128x256x64_MI16x16x1_SN_LDSB1_CLR1_GSU0_GSUC0_GSUWGMRR0_K1_LBSPPA2048_LBSPPB1024_LPA0_MIWT4_8_PLR1_SU0_SUM0_SUS0_VWA4_VWB8_WGM8_WGMXCC1_WGMXCCGn1
    SolutionIndex: 40
    SolutionNameMin: Cijk_Ailk_Bljk_BSS_BH_Bias_HAS_SAV_UserArgs_MT128x256x64_MI16x16x1_SN_LDSB1_CLR1_GSU0_GSUC0_GSUWGMRR0_K1_LBSPPA2048_LBSPPB1024_LPA0_MIWT4_8_PLR1_SU0_SUM0_SUS0_VWA4_VWB8_WGM8_WGMXCC1_WGMXCCGn1
    SolutionIndex: 41
    SolutionNameMin: Cijk_Ailk_Bljk_BSS_BH_Bias_HAS_SAV_UserArgs_MT256x128x64_MI16x16x1_SN_LDSB1_CLR1_GSU0_GSUC0_GSUWGMRR0_K1_LBSPPA4096_LBSPPB512_LPA0_MIWT8_4_PLR1_SU0_SUM0_SUS0_VWA8_VWB4_WGM6_WGMXCC1_WGMXCCGn1
    SolutionIndex: 42
    SolutionNameMin: Cijk_Ailk_Bljk_BSS_BH_Bias_HAS_SAV_UserArgs_MT256x128x64_MI16x16x1_SN_LDSB1_CLR1_GSU0_GSUC0_GSUWGMRR0_K1_LBSPPA4096_LBSPPB512_LPA0_MIWT8_4_PLR1_SU0_SUM0_SUS0_VWA8_VWB4_WGM8_WGMXCC1_WGMXCCGn1
    SolutionIndex: 43
    SolutionNameMin: Cijk_Ailk_Bljk_BSS_BH_Bias_HAS_SAV_UserArgs_MT128x128x64_MI16x16x1_SN_LDSB1_CLR1_GSU0_GSUC0_GSUWGMRR0_K1_LBSPPA2048_LBSPPB512_LPA0_MIWT4_4_PLR1_SU0_SUM0_SUS0_VWA4_VWB4_WGM1_WGMXCC1_WGMXCCGn1
    SolutionIndex: 44
    SolutionNameMin: Cijk_Ailk_Bljk_BSS_BH_Bias_HAS_SAV_UserArgs_MT128x128x64_MI16x16x1_SN_LDSB1_CLR1_GSU0_GSUC0_GSUWGMRR0_K1_LBSPPA2048_LBSPPB512_LPA0_MIWT4_4_PLR1_SU0_SUM0_SUS0_VWA4_VWB4_WGM1_WGMXCC1_WGMXCCGn1
    SolutionIndex: 45
    SolutionNameMin: Cijk_Ailk_Bljk_BSS_BH_Bias_HAS_SAV_UserArgs_MT128x128x64_MI16x16x1_SN_LDSB1_CLR1_GSU0_GSUC0_GSUWGMRR0_K1_LBSPPA2048_LBSPPB512_LPA0_MIWT4_4_PLR1_SU0_SUM0_SUS0_VWA4_VWB4_WGM6_WGMXCC1_WGMXCCGn1
    SolutionIndex: 46
    SolutionNameMin: Cijk_Ailk_Bljk_BSS_BH_Bias_HAS_SAV_UserArgs_MT128x128x64_MI16x16x1_SN_LDSB1_CLR1_GSU0_GSUC0_GSUWGMRR0_K1_LBSPPA2048_LBSPPB512_LPA0_MIWT4_4_PLR1_SU0_SUM0_SUS0_VWA4_VWB4_WGM6_WGMXCC1_WGMXCCGn1
    SolutionIndex: 47
    SolutionNameMin: Cijk_Ailk_Bljk_BSS_BH_Bias_HAS_SAV_UserArgs_MT128x128x64_MI16x16x1_SN_LDSB1_CLR1_GSU0_GSUC0_GSUWGMRR0_K1_LBSPPA512_LBSPPB512_LPA0_MIWT4_4_PLR1_SU0_SUM0_SUS0_VWA4_VWB4_WGM8_WGMXCC1_WGMXCCGn1
    SolutionIndex: 48
    SolutionNameMin: Cijk_Ailk_Bljk_BSS_BH_Bias_HAS_SAV_UserArgs_MT128x128x64_MI16x16x1_SN_LDSB1_CLR1_GSU0_GSUC0_GSUWGMRR0_K1_LBSPPA1024_LBSPPB512_LPA0_MIWT4_4_PLR1_SU0_SUM0_SUS0_VWA4_VWB4_WGM8_WGMXCC1_WGMXCCGn1
    SolutionIndex: 49
    SolutionNameMin: Cijk_Ailk_Bljk_BSS_BH_Bias_HAS_SAV_UserArgs_MT128x128x64_MI16x16x1_SN_LDSB1_CLR1_GSU0_GSUC0_GSUWGMRR0_K1_LBSPPA2048_LBSPPB512_LPA0_MIWT4_4_PLR1_SU0_SUM0_SUS0_VWA4_VWB4_WGM8_WGMXCC1_WGMXCCGn1
    SolutionIndex: 50
    SolutionNameMin: Cijk_Ailk_Bljk_BSS_BH_Bias_HAS_SAV_UserArgs_MT64x128x64_MI16x16x1_SN_LDSB1_CLR1_GSU0_GSUC0_GSUWGMRR0_K1_LBSPPA512_LBSPPB512_LPA32_MIWT2_4_PLR1_SU0_SUM0_SUS0_VWA2_VWB4_WGM1_WGMXCC1_WGMXCCGn1
    SolutionIndex: 51
    SolutionNameMin: Cijk_Ailk_Bljk_BSS_BH_Bias_HAS_SAV_UserArgs_MT64x128x64_MI16x16x1_SN_LDSB1_CLR1_GSU0_GSUC0_GSUWGMRR0_K1_LBSPPA1024_LBSPPB512_LPA32_MIWT2_4_PLR1_SU0_SUM0_SUS0_VWA2_VWB4_WGM1_WGMXCC1_WGMXCCGn1
    SolutionIndex: 52
    SolutionNameMin: Cijk_Ailk_Bljk_BSS_BH_Bias_HAS_SAV_UserArgs_MT64x128x64_MI16x16x1_SN_LDSB1_CLR1_GSU0_GSUC0_GSUWGMRR0_K1_LBSPPA1024_LBSPPB512_LPA32_MIWT2_4_PLR1_SU0_SUM0_SUS0_VWA2_VWB4_WGM6_WGMXCC1_WGMXCCGn1
    SolutionIndex: 53
    SolutionNameMin: Cijk_Ailk_Bljk_BSS_BH_Bias_HAS_SAV_UserArgs_MT64x128x64_MI16x16x1_SN_LDSB1_CLR1_GSU0_GSUC0_GSUWGMRR0_K1_LBSPPA1024_LBSPPB512_LPA32_MIWT2_4_PLR1_SU0_SUM0_SUS0_VWA2_VWB4_WGM6_WGMXCC1_WGMXCCGn1
    SolutionIndex: 54
    SolutionNameMin: Cijk_Ailk_Bljk_BSS_BH_Bias_HAS_SAV_UserArgs_MT64x128x64_MI16x16x1_SN_LDSB1_CLR1_GSU0_GSUC0_GSUWGMRR0_K1_LBSPPA512_LBSPPB512_LPA32_MIWT2_4_PLR1_SU0_SUM0_SUS0_VWA2_VWB4_WGM8_WGMXCC1_WGMXCCGn1
    SolutionIndex: 55
    SolutionNameMin: Cijk_Ailk_Bljk_BSS_BH_Bias_HAS_SAV_UserArgs_MT64x128x64_MI16x16x1_SN_LDSB1_CLR1_GSU0_GSUC0_GSUWGMRR0_K1_LBSPPA512_LBSPPB512_LPA32_MIWT2_4_PLR1_SU0_SUM0_SUS0_VWA2_VWB4_WGM8_WGMXCC1_WGMXCCGn1
    SolutionIndex: 56
    SolutionNameMin: Cijk_Ailk_Bljk_BSS_BH_Bias_HAS_SAV_UserArgs_MT64x128x64_MI16x16x1_SN_LDSB1_CLR1_GSU0_GSUC0_GSUWGMRR0_K1_LBSPPA1024_LBSPPB512_LPA32_MIWT2_4_PLR1_SU0_SUM0_SUS0_VWA2_VWB4_WGM8_WGMXCC1_WGMXCCGn1
    SolutionIndex: 57
    SolutionNameMin: Cijk_Ailk_Bljk_BSS_BH_Bias_HAS_SAV_UserArgs_MT64x128x64_MI16x16x1_SN_LDSB1_CLR1_GSU0_GSUC0_GSUWGMRR0_K1_LBSPPA1024_LBSPPB512_LPA32_MIWT2_4_PLR1_SU0_SUM0_SUS0_VWA2_VWB4_WGM8_WGMXCC1_WGMXCCGn1
    SolutionIndex: 58
    SolutionNameMin: Cijk_Ailk_Bljk_BSS_BH_Bias_HAS_SAV_UserArgs_MT128x64x64_MI16x16x1_SN_LDSB1_CLR1_GSU0_GSUC0_GSUWGMRR0_K1_LBSPPA1024_LBSPPB256_LPA0_MIWT4_2_PLR1_SU0_SUM0_SUS0_VWA4_VWB2_WGM1_WGMXCC1_WGMXCCGn1
    SolutionIndex: 59
    SolutionNameMin: Cijk_Ailk_Bljk_BSS_BH_Bias_HAS_SAV_UserArgs_MT128x64x64_MI16x16x1_SN_LDSB1_CLR1_GSU0_GSUC0_GSUWGMRR0_K1_LBSPPA2048_LBSPPB256_LPA0_MIWT4_2_PLR1_SU0_SUM0_SUS0_VWA4_VWB2_WGM1_WGMXCC1_WGMXCCGn1
    SolutionIndex: 60
    SolutionNameMin: Cijk_Ailk_Bljk_BSS_BH_Bias_HAS_SAV_UserArgs_MT128x64x64_MI16x16x1_SN_LDSB1_CLR1_GSU0_GSUC0_GSUWGMRR0_K1_LBSPPA512_LBSPPB256_LPA0_MIWT4_2_PLR1_SU0_SUM0_SUS0_VWA4_VWB2_WGM6_WGMXCC1_WGMXCCGn1
    SolutionIndex: 61
    SolutionNameMin: Cijk_Ailk_Bljk_BSS_BH_Bias_HAS_SAV_UserArgs_MT128x64x64_MI16x16x1_SN_LDSB1_CLR1_GSU0_GSUC0_GSUWGMRR0_K1_LBSPPA1024_LBSPPB256_LPA0_MIWT4_2_PLR1_SU0_SUM0_SUS0_VWA4_VWB2_WGM6_WGMXCC1_WGMXCCGn1
    SolutionIndex: 62
    SolutionNameMin: Cijk_Ailk_Bljk_BSS_BH_Bias_HAS_SAV_UserArgs_MT128x64x64_MI16x16x1_SN_LDSB1_CLR1_GSU0_GSUC0_GSUWGMRR0_K1_LBSPPA2048_LBSPPB256_LPA0_MIWT4_2_PLR1_SU0_SUM0_SUS0_VWA4_VWB2_WGM6_WGMXCC1_WGMXCCGn1
    SolutionIndex: 63
    SolutionNameMin: Cijk_Ailk_Bljk_BSS_BH_Bias_HAS_SAV_UserArgs_MT128x64x64_MI16x16x1_SN_LDSB1_CLR1_GSU0_GSUC0_GSUWGMRR0_K1_LBSPPA1024_LBSPPB256_LPA0_MIWT4_2_PLR1_SU0_SUM0_SUS0_VWA4_VWB2_WGM8_WGMXCC1_WGMXCCGn1
    SolutionIndex: 64
    SolutionNameMin: Cijk_Ailk_Bljk_BSS_BH_Bias_HAS_SAV_UserArgs_MT128x64x64_MI16x16x1_SN_LDSB1_CLR1_GSU0_GSUC0_GSUWGMRR0_K1_LBSPPA2048_LBSPPB256_LPA0_MIWT4_2_PLR1_SU0_SUM0_SUS0_VWA4_VWB2_WGM8_WGMXCC1_WGMXCCGn1
    SolutionIndex: 65
    SolutionNameMin: Cijk_Ailk_Bljk_BSS_BH_Bias_HAS_SAV_UserArgs_MT256x256x64_MI32x32x1_SN_LDSB1_CLR1_GSU0_GSUC0_GSUWGMRR0_K1_LBSPPA0_LBSPPB512_LPA0_MIWT4_4_PLR1_SU0_SUM0_SUS0_VWA4_VWB4_WGM1_WGMXCC1_WGMXCCGn1
    SolutionIndex: 66
    SolutionNameMin: Cijk_Ailk_Bljk_BSS_BH_Bias_HAS_SAV_UserArgs_MT256x256x64_MI32x32x1_SN_LDSB1_CLR1_GSU0_GSUC0_GSUWGMRR0_K1_LBSPPA0_LBSPPB512_LPA0_MIWT4_4_PLR1_SU0_SUM0_SUS0_VWA4_VWB4_WGM6_WGMXCC1_WGMXCCGn1
    SolutionIndex: 67
    SolutionNameMin: Cijk_Ailk_Bljk_BSS_BH_Bias_HAS_SAV_UserArgs_MT256x256x64_MI32x32x1_SN_LDSB1_CLR1_GSU0_GSUC0_GSUWGMRR0_K1_LBSPPA0_LBSPPB512_LPA0_MIWT4_4_PLR1_SU0_SUM0_SUS0_VWA4_VWB4_WGM6_WGMXCC1_WGMXCCGn1
    SolutionIndex: 68
    SolutionNameMin: Cijk_Ailk_Bljk_BSS_BH_Bias_HAS_SAV_UserArgs_MT256x256x64_MI32x32x1_SN_LDSB1_CLR1_GSU0_GSUC0_GSUWGMRR0_K1_LBSPPA0_LBSPPB512_LPA0_MIWT4_4_PLR1_SU0_SUM0_SUS0_VWA4_VWB4_WGM8_WGMXCC1_WGMXCCGn1
    SolutionIndex: 69
    SolutionNameMin: Cijk_Ailk_Bljk_BSS_BH_Bias_HAS_SAV_UserArgs_MT256x256x64_MI32x32x1_SN_LDSB1_CLR1_GSU0_GSUC0_GSUWGMRR0_K1_LBSPPA0_LBSPPB512_LPA0_MIWT4_4_PLR1_SU0_SUM0_SUS0_VWA4_VWB4_WGM8_WGMXCC1_WGMXCCGn1
    SolutionIndex: 70
    SolutionNameMin: Cijk_Ailk_Bljk_BSS_BH_Bias_HAS_SAV_UserArgs_MT256x128x64_MI32x32x1_SN_LDSB1_CLR1_GSU0_GSUC0_GSUWGMRR0_K1_LBSPPA0_LBSPPB256_LPA0_MIWT4_2_PLR1_SU0_SUM0_SUS0_VWA4_VWB2_WGM6_WGMXCC1_WGMXCCGn1
    SolutionIndex: 71
    SolutionNameMin: Cijk_Ailk_Bljk_BSS_BH_Bias_HAS_SAV_UserArgs_MT256x128x64_MI32x32x1_SN_LDSB1_CLR1_GSU0_GSUC0_GSUWGMRR0_K1_LBSPPA0_LBSPPB256_LPA0_MIWT4_2_PLR1_SU0_SUM0_SUS0_VWA4_VWB2_WGM6_WGMXCC1_WGMXCCGn1
    SolutionIndex: 72
    SolutionNameMin: Cijk_Ailk_Bljk_BSS_BH_Bias_HAS_SAV_UserArgs_MT256x128x64_MI32x32x1_SN_LDSB1_CLR1_GSU0_GSUC0_GSUWGMRR0_K1_LBSPPA0_LBSPPB256_LPA0_MIWT4_2_PLR1_SU0_SUM0_SUS0_VWA4_VWB2_WGM8_WGMXCC1_WGMXCCGn1
    SolutionIndex: 73
    SolutionNameMin: Cijk_Ailk_Bljk_BSS_BH_Bias_HAS_SAV_UserArgs_MT256x128x64_MI32x32x1_SN_LDSB1_CLR1_GSU0_GSUC0_GSUWGMRR0_K1_LBSPPA0_LBSPPB256_LPA0_MIWT4_2_PLR1_SU0_SUM0_SUS0_VWA4_VWB2_WGM8_WGMXCC1_WGMXCCGn1
    SolutionIndex: 74
    SolutionNameMin: Cijk_Ailk_Bljk_BSS_BH_Bias_HAS_SAV_UserArgs_MT128x128x64_MI32x32x1_SN_LDSB1_CLR1_GSU0_GSUC0_GSUWGMRR0_K1_LBSPPA0_LBSPPB256_LPA0_MIWT2_2_PLR1_SU0_SUM0_SUS0_VWA2_VWB2_WGM1_WGMXCC1_WGMXCCGn1
    SolutionIndex: 75
    SolutionNameMin: Cijk_Ailk_Bljk_BSS_BH_Bias_HAS_SAV_UserArgs_MT128x128x64_MI32x32x1_SN_LDSB1_CLR1_GSU0_GSUC0_GSUWGMRR0_K1_LBSPPA0_LBSPPB256_LPA0_MIWT2_2_PLR1_SU0_SUM0_SUS0_VWA2_VWB2_WGM6_WGMXCC1_WGMXCCGn1
    SolutionIndex: 76
    SolutionNameMin: Cijk_Ailk_Bljk_BSS_BH_Bias_HAS_SAV_UserArgs_MT128x128x64_MI32x32x1_SN_LDSB1_CLR1_GSU0_GSUC0_GSUWGMRR0_K1_LBSPPA0_LBSPPB256_LPA0_MIWT2_2_PLR1_SU0_SUM0_SUS0_VWA2_VWB2_WGM8_WGMXCC1_WGMXCCGn1
    SolutionIndex: 77
    SolutionNameMin: Cijk_Ailk_Bljk_BSS_BH_Bias_HAS_SAV_UserArgs_MT128x64x64_MI32x32x1_SN_LDSB1_CLR1_GSU0_GSUC0_GSUWGMRR0_K1_LBSPPA0_LBSPPB128_LPA0_MIWT2_1_PLR1_SU0_SUM0_SUS0_VWA2_VWB1_WGM1_WGMXCC1_WGMXCCGn1
    SolutionIndex: 78
    SolutionNameMin: Cijk_Ailk_Bljk_BSS_BH_Bias_HAS_SAV_UserArgs_MT64x64x64_MI32x32x1_SN_LDSB1_CLR1_GSU0_GSUC0_GSUWGMRR0_K1_LBSPPA0_LBSPPB128_LPA0_MIWT1_1_PLR1_SU0_SUM0_SUS0_VWA1_VWB1_WGM6_WGMXCC1_WGMXCCGn1
    SolutionIndex: 79
    SolutionNameMin: Cijk_Ailk_Bljk_BSS_BH_Bias_HAS_SAV_UserArgs_MT128x128x128_MI16x16x1_SN_LDSB1_CLR1_GSU0_GSUC0_GSUWGMRR0_K1_LBSPPA1024_LBSPPB1024_LPA0_MIWT4_4_PLR1_SU0_SUM0_SUS0_VWA4_VWB4_WGM1_WGMXCC1_WGMXCCGn1
    SolutionIndex: 80
    SolutionNameMin: Cijk_Ailk_Bljk_BSS_BH_Bias_HAS_SAV_UserArgs_MT128x128x128_MI16x16x1_SN_LDSB1_CLR1_GSU0_GSUC0_GSUWGMRR0_K1_LBSPPA2048_LBSPPB1024_LPA0_MIWT4_4_PLR1_SU0_SUM0_SUS0_VWA4_VWB4_WGM1_WGMXCC1_WGMXCCGn1
    SolutionIndex: 81
    SolutionNameMin: Cijk_Ailk_Bljk_BSS_BH_Bias_HAS_SAV_UserArgs_MT128x128x128_MI16x16x1_SN_LDSB1_CLR1_GSU0_GSUC0_GSUWGMRR0_K1_LBSPPA512_LBSPPB1024_LPA0_MIWT4_4_PLR1_SU0_SUM0_SUS0_VWA4_VWB4_WGM6_WGMXCC1_WGMXCCGn1
    SolutionIndex: 82
    SolutionNameMin: Cijk_Ailk_Bljk_BSS_BH_Bias_HAS_SAV_UserArgs_MT128x128x128_MI16x16x1_SN_LDSB1_CLR1_GSU0_GSUC0_GSUWGMRR0_K1_LBSPPA2048_LBSPPB1024_LPA0_MIWT4_4_PLR1_SU0_SUM0_SUS0_VWA4_VWB4_WGM6_WGMXCC1_WGMXCCGn1
    SolutionIndex: 83
    SolutionNameMin: Cijk_Ailk_Bljk_BSS_BH_Bias_HAS_SAV_UserArgs_MT128x128x128_MI16x16x1_SN_LDSB1_CLR1_GSU0_GSUC0_GSUWGMRR0_K1_LBSPPA512_LBSPPB1024_LPA0_MIWT4_4_PLR1_SU0_SUM0_SUS0_VWA4_VWB4_WGM8_WGMXCC1_WGMXCCGn1
    SolutionIndex: 84
    SolutionNameMin: Cijk_Ailk_Bljk_BSS_BH_Bias_HAS_SAV_UserArgs_MT128x128x128_MI16x16x1_SN_LDSB1_CLR1_GSU0_GSUC0_GSUWGMRR0_K1_LBSPPA512_LBSPPB1024_LPA0_MIWT4_4_PLR1_SU0_SUM0_SUS0_VWA4_VWB4_WGM8_WGMXCC1_WGMXCCGn1
    SolutionIndex: 85
    SolutionNameMin: Cijk_Ailk_Bljk_BSS_BH_Bias_HAS_SAV_UserArgs_MT128x128x128_MI16x16x1_SN_LDSB1_CLR1_GSU0_GSUC0_GSUWGMRR0_K1_LBSPPA2048_LBSPPB1024_LPA0_MIWT4_4_PLR1_SU0_SUM0_SUS0_VWA4_VWB4_WGM8_WGMXCC1_WGMXCCGn1
    SolutionIndex: 86
    SolutionNameMin: Cijk_Ailk_Bljk_BSS_BH_Bias_HAS_SAV_UserArgs_MT64x128x128_MI16x16x1_SN_LDSB1_CLR1_GSU0_GSUC0_GSUWGMRR0_K1_LBSPPA1024_LBSPPB1024_LPA32_MIWT2_4_PLR1_SU0_SUM0_SUS0_VWA2_VWB4_WGM1_WGMXCC1_WGMXCCGn1
    SolutionIndex: 87
    SolutionNameMin: Cijk_Ailk_Bljk_BSS_BH_Bias_HAS_SAV_UserArgs_MT128x64x128_MI16x16x1_SN_LDSB1_CLR1_GSU0_GSUC0_GSUWGMRR0_K1_LBSPPA512_LBSPPB512_LPA0_MIWT4_2_PLR1_SU0_SUM0_SUS0_VWA4_VWB2_WGM1_WGMXCC1_WGMXCCGn1
    SolutionIndex: 88
    SolutionNameMin: Cijk_Ailk_Bljk_BSS_BH_Bias_HAS_SAV_UserArgs_MT128x64x128_MI16x16x1_SN_LDSB1_CLR1_GSU0_GSUC0_GSUWGMRR0_K1_LBSPPA2048_LBSPPB512_LPA0_MIWT4_2_PLR1_SU0_SUM0_SUS0_VWA4_VWB2_WGM1_WGMXCC1_WGMXCCGn1
    SolutionIndex: 89
    SolutionNameMin: Cijk_Ailk_Bljk_BSS_BH_Bias_HAS_SAV_UserArgs_MT128x64x128_MI16x16x1_SN_LDSB1_CLR1_GSU0_GSUC0_GSUWGMRR0_K1_LBSPPA2048_LBSPPB512_LPA0_MIWT4_2_PLR1_SU0_SUM0_SUS0_VWA4_VWB2_WGM6_WGMXCC1_WGMXCCGn1
    SolutionIndex: 90
    SolutionNameMin: Cijk_Ailk_Bljk_BSS_BH_Bias_HAS_SAV_UserArgs_MT128x64x128_MI16x16x1_SN_LDSB1_CLR1_GSU0_GSUC0_GSUWGMRR0_K1_LBSPPA512_LBSPPB512_LPA0_MIWT4_2_PLR1_SU0_SUM0_SUS0_VWA4_VWB2_WGM8_WGMXCC1_WGMXCCGn1
    SolutionIndex: 91
    SolutionNameMin: Cijk_Ailk_Bljk_BSS_BH_Bias_HAS_SAV_UserArgs_MT128x64x128_MI16x16x1_SN_LDSB1_CLR1_GSU0_GSUC0_GSUWGMRR0_K1_LBSPPA2048_LBSPPB512_LPA0_MIWT4_2_PLR1_SU0_SUM0_SUS0_VWA4_VWB2_WGM8_WGMXCC1_WGMXCCGn1
    SolutionIndex: 92
    SolutionNameMin: Cijk_Ailk_Bljk_BSS_BH_Bias_HAS_SAV_UserArgs_MT64x64x128_MI16x16x1_SN_LDSB1_CLR1_GSU0_GSUC0_GSUWGMRR0_K1_LBSPPA512_LBSPPB512_LPA32_MIWT2_2_PLR1_SU0_SUM0_SUS0_VWA2_VWB2_WGM1_WGMXCC1_WGMXCCGn1
    SolutionIndex: 93
    SolutionNameMin: Cijk_Ailk_Bljk_BSS_BH_Bias_HAS_SAV_UserArgs_MT64x64x128_MI16x16x1_SN_LDSB1_CLR1_GSU0_GSUC0_GSUWGMRR0_K1_LBSPPA512_LBSPPB512_LPA32_MIWT2_2_PLR1_SU0_SUM0_SUS0_VWA2_VWB2_WGM1_WGMXCC1_WGMXCCGn1
    SolutionIndex: 94
    SolutionNameMin: Cijk_Ailk_Bljk_BSS_BH_Bias_HAS_SAV_UserArgs_MT64x64x128_MI16x16x1_SN_LDSB1_CLR1_GSU0_GSUC0_GSUWGMRR0_K1_LBSPPA1024_LBSPPB512_LPA32_MIWT2_2_PLR1_SU0_SUM0_SUS0_VWA2_VWB2_WGM1_WGMXCC1_WGMXCCGn1
    SolutionIndex: 95
    SolutionNameMin: Cijk_Ailk_Bljk_BSS_BH_Bias_HAS_SAV_UserArgs_MT64x64x128_MI16x16x1_SN_LDSB1_CLR1_GSU0_GSUC0_GSUWGMRR0_K1_LBSPPA256_LBSPPB512_LPA32_MIWT2_2_PLR1_SU0_SUM0_SUS0_VWA2_VWB2_WGM6_WGMXCC1_WGMXCCGn1
    SolutionIndex: 96
    SolutionNameMin: Cijk_Ailk_Bljk_BSS_BH_Bias_HAS_SAV_UserArgs_MT64x64x128_MI16x16x1_SN_LDSB1_CLR1_GSU0_GSUC0_GSUWGMRR0_K1_LBSPPA512_LBSPPB512_LPA32_MIWT2_2_PLR1_SU0_SUM0_SUS0_VWA2_VWB2_WGM6_WGMXCC1_WGMXCCGn1
    SolutionIndex: 97
    SolutionNameMin: Cijk_Ailk_Bljk_BSS_BH_Bias_HAS_SAV_UserArgs_MT64x64x128_MI16x16x1_SN_LDSB1_CLR1_GSU0_GSUC0_GSUWGMRR0_K1_LBSPPA512_LBSPPB512_LPA32_MIWT2_2_PLR1_SU0_SUM0_SUS0_VWA2_VWB2_WGM6_WGMXCC1_WGMXCCGn1
    SolutionIndex: 98
    SolutionNameMin: Cijk_Ailk_Bljk_BSS_BH_Bias_HAS_SAV_UserArgs_MT64x64x128_MI16x16x1_SN_LDSB1_CLR1_GSU0_GSUC0_GSUWGMRR0_K1_LBSPPA512_LBSPPB512_LPA32_MIWT2_2_PLR1_SU0_SUM0_SUS0_VWA2_VWB2_WGM6_WGMXCC1_WGMXCCGn1
    SolutionIndex: 99
    SolutionNameMin: Cijk_Ailk_Bljk_BSS_BH_Bias_HAS_SAV_UserArgs_MT64x64x128_MI16x16x1_SN_LDSB1_CLR1_GSU0_GSUC0_GSUWGMRR0_K1_LBSPPA1024_LBSPPB512_LPA32_MIWT2_2_PLR1_SU0_SUM0_SUS0_VWA2_VWB2_WGM6_WGMXCC1_WGMXCCGn1
    SolutionIndex: 100
    SolutionNameMin: Cijk_Ailk_Bljk_BSS_BH_Bias_HAS_SAV_UserArgs_MT64x64x128_MI16x16x1_SN_LDSB1_CLR1_GSU0_GSUC0_GSUWGMRR0_K1_LBSPPA256_LBSPPB512_LPA32_MIWT2_2_PLR1_SU0_SUM0_SUS0_VWA2_VWB2_WGM8_WGMXCC1_WGMXCCGn1
    SolutionIndex: 101
    SolutionNameMin: Cijk_Ailk_Bljk_BSS_BH_Bias_HAS_SAV_UserArgs_MT64x64x128_MI16x16x1_SN_LDSB1_CLR1_GSU0_GSUC0_GSUWGMRR0_K1_LBSPPA512_LBSPPB512_LPA32_MIWT2_2_PLR1_SU0_SUM0_SUS0_VWA2_VWB2_WGM8_WGMXCC1_WGMXCCGn1
    SolutionIndex: 102
    SolutionNameMin: Cijk_Ailk_Bljk_BSS_BH_Bias_HAS_SAV_UserArgs_MT64x64x128_MI16x16x1_SN_LDSB1_CLR1_GSU0_GSUC0_GSUWGMRR0_K1_LBSPPA1024_LBSPPB512_LPA32_MIWT2_2_PLR1_SU0_SUM0_SUS0_VWA2_VWB2_WGM8_WGMXCC1_WGMXCCGn1
    SolutionIndex: 103
    SolutionNameMin: Cijk_Ailk_Bljk_BSS_BH_Bias_HAS_SAV_UserArgs_MT64x64x128_MI16x16x1_SN_LDSB1_CLR1_GSU0_GSUC0_GSUWGMRR0_K1_LBSPPA1024_LBSPPB512_LPA32_MIWT2_2_PLR1_SU0_SUM0_SUS0_VWA2_VWB2_WGM8_WGMXCC1_WGMXCCGn1
    SolutionIndex: 104
    SolutionNameMin: Cijk_Ailk_Bljk_BSS_BH_Bias_HAS_SAV_UserArgs_MT32x64x128_MI16x16x1_SN_LDSB1_CLR1_GSU0_GSUC0_GSUWGMRR0_K1_LBSPPA256_LBSPPB512_LPA16_MIWT1_2_PLR1_SU0_SUM0_SUS0_VWA1_VWB2_WGM1_WGMXCC1_WGMXCCGn1
    SolutionIndex: 105
    SolutionNameMin: Cijk_Ailk_Bljk_BSS_BH_Bias_HAS_SAV_UserArgs_MT32x64x128_MI16x16x1_SN_LDSB1_CLR1_GSU0_GSUC0_GSUWGMRR0_K1_LBSPPA512_LBSPPB512_LPA16_MIWT1_2_PLR1_SU0_SUM0_SUS0_VWA1_VWB2_WGM1_WGMXCC1_WGMXCCGn1
    SolutionIndex: 106
    SolutionNameMin: Cijk_Ailk_Bljk_BSS_BH_Bias_HAS_SAV_UserArgs_MT32x64x128_MI16x16x1_SN_LDSB1_CLR1_GSU0_GSUC0_GSUWGMRR0_K1_LBSPPA512_LBSPPB512_LPA16_MIWT1_2_PLR1_SU0_SUM0_SUS0_VWA1_VWB2_WGM1_WGMXCC1_WGMXCCGn1
    SolutionIndex: 107
    SolutionNameMin: Cijk_Ailk_Bljk_BSS_BH_Bias_HAS_SAV_UserArgs_MT32x64x128_MI16x16x1_SN_LDSB1_CLR1_GSU0_GSUC0_GSUWGMRR0_K1_LBSPPA512_LBSPPB512_LPA16_MIWT1_2_PLR1_SU0_SUM0_SUS0_VWA1_VWB2_WGM1_WGMXCC1_WGMXCCGn1
    SolutionIndex: 108
    SolutionNameMin: Cijk_Ailk_Bljk_BSS_BH_Bias_HAS_SAV_UserArgs_MT64x32x128_MI16x16x1_SN_LDSB1_CLR1_GSU0_GSUC0_GSUWGMRR0_K1_LBSPPA1024_LBSPPB256_LPA32_MIWT2_1_PLR1_SU0_SUM0_SUS0_VWA2_VWB1_WGM1_WGMXCC1_WGMXCCGn1
    SolutionIndex: 109
    SolutionNameMin: Cijk_Ailk_Bljk_BSS_BH_Bias_HAS_SAV_UserArgs_MT64x32x128_MI16x16x1_SN_LDSB1_CLR1_GSU0_GSUC0_GSUWGMRR0_K1_LBSPPA1024_LBSPPB256_LPA32_MIWT2_1_PLR1_SU0_SUM0_SUS0_VWA2_VWB1_WGM6_WGMXCC1_WGMXCCGn1
    SolutionIndex: 110
    SolutionNameMin: Cijk_Ailk_Bljk_BSS_BH_Bias_HAS_SAV_UserArgs_MT64x32x128_MI16x16x1_SN_LDSB1_CLR1_GSU0_GSUC0_GSUWGMRR0_K1_LBSPPA1024_LBSPPB256_LPA32_MIWT2_1_PLR1_SU0_SUM0_SUS0_VWA2_VWB1_WGM6_WGMXCC1_WGMXCCGn1
    SolutionIndex: 111
    SolutionNameMin: Cijk_Ailk_Bljk_BSS_BH_Bias_HAS_SAV_UserArgs_MT64x32x128_MI16x16x1_SN_LDSB1_CLR1_GSU0_GSUC0_GSUWGMRR0_K1_LBSPPA512_LBSPPB256_LPA32_MIWT2_1_PLR1_SU0_SUM0_SUS0_VWA2_VWB1_WGM8_WGMXCC1_WGMXCCGn1
    SolutionIndex: 112
    SolutionNameMin: Cijk_Ailk_Bljk_BSS_BH_Bias_HAS_SAV_UserArgs_MT64x32x128_MI16x16x1_SN_LDSB1_CLR1_GSU0_GSUC0_GSUWGMRR0_K1_LBSPPA1024_LBSPPB256_LPA32_MIWT2_1_PLR1_SU0_SUM0_SUS0_VWA2_VWB1_WGM8_WGMXCC1_WGMXCCGn1
    SolutionIndex: 113
    SolutionNameMin: Cijk_Ailk_Bljk_BSS_BH_Bias_HAS_SAV_UserArgs_MT32x32x128_MI16x16x1_SN_LDSB1_CLR1_GSU0_GSUC0_GSUWGMRR0_K1_LBSPPA256_LBSPPB256_LPA16_MIWT1_1_PLR1_SU0_SUM0_SUS0_VWA1_VWB1_WGM1_WGMXCC1_WGMXCCGn1
    SolutionIndex: 114
    SolutionNameMin: Cijk_Ailk_Bljk_BSS_BH_Bias_HAS_SAV_UserArgs_MT32x32x128_MI16x16x1_SN_LDSB1_CLR1_GSU0_GSUC0_GSUWGMRR0_K1_LBSPPA256_LBSPPB256_LPA16_MIWT1_1_PLR1_SU0_SUM0_SUS0_VWA1_VWB1_WGM1_WGMXCC1_WGMXCCGn1
    SolutionIndex: 115
    SolutionNameMin: Cijk_Ailk_Bljk_BSS_BH_Bias_HAS_SAV_UserArgs_MT32x32x128_MI16x16x1_SN_LDSB1_CLR1_GSU0_GSUC0_GSUWGMRR0_K1_LBSPPA512_LBSPPB256_LPA16_MIWT1_1_PLR1_SU0_SUM0_SUS0_VWA1_VWB1_WGM1_WGMXCC1_WGMXCCGn1
    SolutionIndex: 116
    SolutionNameMin: Cijk_Ailk_Bljk_BSS_BH_Bias_HAS_SAV_UserArgs_MT32x32x128_MI16x16x1_SN_LDSB1_CLR1_GSU0_GSUC0_GSUWGMRR0_K1_LBSPPA512_LBSPPB256_LPA16_MIWT1_1_PLR1_SU0_SUM0_SUS0_VWA1_VWB1_WGM1_WGMXCC1_WGMXCCGn1
    SolutionIndex: 117
    SolutionNameMin: Cijk_Ailk_Bljk_BSS_BH_Bias_HAS_SAV_UserArgs_MT32x32x128_MI16x16x1_SN_LDSB1_CLR1_GSU0_GSUC0_GSUWGMRR0_K1_LBSPPA512_LBSPPB256_LPA16_MIWT1_1_PLR1_SU0_SUM0_SUS0_VWA1_VWB1_WGM1_WGMXCC1_WGMXCCGn1
    SolutionIndex: 118
    SolutionNameMin: Cijk_Ailk_Bljk_BSS_BH_Bias_HAS_SAV_UserArgs_MT32x32x128_MI16x16x1_SN_LDSB1_CLR1_GSU0_GSUC0_GSUWGMRR0_K1_LBSPPA256_LBSPPB256_LPA16_MIWT1_1_PLR1_SU0_SUM0_SUS0_VWA1_VWB1_WGM6_WGMXCC1_WGMXCCGn1
    SolutionIndex: 119
    SolutionNameMin: Cijk_Ailk_Bljk_BSS_BH_Bias_HAS_SAV_UserArgs_MT32x32x128_MI16x16x1_SN_LDSB1_CLR1_GSU0_GSUC0_GSUWGMRR0_K1_LBSPPA256_LBSPPB256_LPA16_MIWT1_1_PLR1_SU0_SUM0_SUS0_VWA1_VWB1_WGM6_WGMXCC1_WGMXCCGn1
    SolutionIndex: 120
    SolutionNameMin: Cijk_Ailk_Bljk_BSS_BH_Bias_HAS_SAV_UserArgs_MT32x32x128_MI16x16x1_SN_LDSB1_CLR1_GSU0_GSUC0_GSUWGMRR0_K1_LBSPPA512_LBSPPB256_LPA16_MIWT1_1_PLR1_SU0_SUM0_SUS0_VWA1_VWB1_WGM6_WGMXCC1_WGMXCCGn1
    SolutionIndex: 121
    SolutionNameMin: Cijk_Ailk_Bljk_BSS_BH_Bias_HAS_SAV_UserArgs_MT32x32x128_MI16x16x1_SN_LDSB1_CLR1_GSU0_GSUC0_GSUWGMRR0_K1_LBSPPA512_LBSPPB256_LPA16_MIWT1_1_PLR1_SU0_SUM0_SUS0_VWA1_VWB1_WGM8_WGMXCC1_WGMXCCGn1
    SolutionIndex: 122
    SolutionNameMin: Cijk_Ailk_Bljk_BSS_BH_Bias_HAS_SAV_UserArgs_MT128x128x128_MI32x32x1_SN_LDSB1_CLR1_GSU0_GSUC0_GSUWGMRR0_K1_LBSPPA0_LBSPPB512_LPA0_MIWT2_2_PLR1_SU0_SUM0_SUS0_VWA2_VWB2_WGM6_WGMXCC1_WGMXCCGn1
    SolutionIndex: 123
    SolutionNameMin: Cijk_Ailk_Bljk_BSS_BH_Bias_HAS_SAV_UserArgs_MT64x64x128_MI32x32x1_SN_LDSB1_CLR1_GSU0_GSUC0_GSUWGMRR0_K1_LBSPPA0_LBSPPB256_LPA0_MIWT1_1_PLR1_SU0_SUM0_SUS0_VWA1_VWB1_WGM1_WGMXCC1_WGMXCCGn1
    SolutionIndex: 124
    SolutionNameMin: Cijk_Ailk_Bljk_BSS_BH_Bias_HAS_SAV_UserArgs_MT64x64x128_MI32x32x1_SN_LDSB1_CLR1_GSU0_GSUC0_GSUWGMRR0_K1_LBSPPA0_LBSPPB256_LPA0_MIWT1_1_PLR1_SU0_SUM0_SUS0_VWA1_VWB1_WGM8_WGMXCC1_WGMXCCGn1
    SolutionIndex: 125
    SolutionNameMin: Cijk_Ailk_Bljk_BSS_BH_Bias_HAS_SAV_UserArgs_MT64x64x256_MI16x16x1_SN_LDSB1_CLR1_GSU0_GSUC0_GSUWGMRR0_K1_LBSPPA512_LBSPPB1024_LPA32_MIWT2_2_PLR1_SU0_SUM0_SUS0_VWA2_VWB2_WGM1_WGMXCC1_WGMXCCGn1
    SolutionIndex: 126
    SolutionNameMin: Cijk_Ailk_Bljk_BSS_BH_Bias_HAS_SAV_UserArgs_MT64x32x256_MI16x16x1_SN_LDSB1_CLR1_GSU0_GSUC0_GSUWGMRR0_K1_LBSPPA1024_LBSPPB512_LPA32_MIWT2_1_PLR1_SU0_SUM0_SUS0_VWA2_VWB1_WGM1_WGMXCC1_WGMXCCGn1
    SolutionIndex: 127
    SolutionNameMin: Cijk_Ailk_Bljk_BSS_BH_Bias_HAS_SAV_UserArgs_MT64x32x256_MI16x16x1_SN_LDSB1_CLR1_GSU0_GSUC0_GSUWGMRR0_K1_LBSPPA1024_LBSPPB512_LPA32_MIWT2_1_PLR1_SU0_SUM0_SUS0_VWA2_VWB1_WGM6_WGMXCC1_WGMXCCGn1
    SolutionIndex: 128
    SolutionNameMin: Cijk_Ailk_Bljk_BSS_BH_Bias_HAS_SAV_UserArgs_MT64x32x256_MI16x16x1_SN_LDSB1_CLR1_GSU0_GSUC0_GSUWGMRR0_K1_LBSPPA512_LBSPPB512_LPA32_MIWT2_1_PLR1_SU0_SUM0_SUS0_VWA2_VWB1_WGM8_WGMXCC1_WGMXCCGn1
    SolutionIndex: 129
    SolutionNameMin: Cijk_Ailk_Bljk_BSS_BH_Bias_HAS_SAV_UserArgs_MT64x32x256_MI16x16x1_SN_LDSB1_CLR1_GSU0_GSUC0_GSUWGMRR0_K1_LBSPPA1024_LBSPPB512_LPA32_MIWT2_1_PLR1_SU0_SUM0_SUS0_VWA2_VWB1_WGM8_WGMXCC1_WGMXCCGn1
    SolutionIndex: 130
    SolutionNameMin: Cijk_Ailk_Bljk_BSS_BH_Bias_HAS_SAV_UserArgs_MT32x32x256_MI16x16x1_SN_LDSB1_CLR1_GSU0_GSUC0_GSUWGMRR0_K1_LBSPPA256_LBSPPB512_LPA16_MIWT1_1_PLR1_SU0_SUM0_SUS0_VWA1_VWB1_WGM1_WGMXCC1_WGMXCCGn1
    SolutionIndex: 131
    SolutionNameMin: Cijk_Ailk_Bljk_BSS_BH_Bias_HAS_SAV_UserArgs_MT32x32x256_MI16x16x1_SN_LDSB1_CLR1_GSU0_GSUC0_GSUWGMRR0_K1_LBSPPA512_LBSPPB512_LPA16_MIWT1_1_PLR1_SU0_SUM0_SUS0_VWA1_VWB1_WGM1_WGMXCC1_WGMXCCGn1
    SolutionIndex: 132
    SolutionNameMin: Cijk_Ailk_Bljk_BSS_BH_Bias_HAS_SAV_UserArgs_MT32x32x256_MI16x16x1_SN_LDSB1_CLR1_GSU0_GSUC0_GSUWGMRR0_K1_LBSPPA512_LBSPPB512_LPA16_MIWT1_1_PLR1_SU0_SUM0_SUS0_VWA1_VWB1_WGM1_WGMXCC1_WGMXCCGn1
    SolutionIndex: 133
    SolutionNameMin: Cijk_Ailk_Bljk_BSS_BH_Bias_HAS_SAV_UserArgs_MT32x32x256_MI16x16x1_SN_LDSB1_CLR1_GSU0_GSUC0_GSUWGMRR0_K1_LBSPPA256_LBSPPB512_LPA16_MIWT1_1_PLR1_SU0_SUM0_SUS0_VWA1_VWB1_WGM6_WGMXCC1_WGMXCCGn1
    SolutionIndex: 134
    SolutionNameMin: Cijk_Ailk_Bljk_BSS_BH_Bias_HAS_SAV_UserArgs_MT32x32x256_MI16x16x1_SN_LDSB1_CLR1_GSU0_GSUC0_GSUWGMRR0_K1_LBSPPA512_LBSPPB512_LPA16_MIWT1_1_PLR1_SU0_SUM0_SUS0_VWA1_VWB1_WGM6_WGMXCC1_WGMXCCGn1
    SolutionIndex: 135
    SolutionNameMin: Cijk_Ailk_Bljk_BSS_BH_Bias_HAS_SAV_UserArgs_MT32x32x256_MI16x16x1_SN_LDSB1_CLR1_GSU0_GSUC0_GSUWGMRR0_K1_LBSPPA256_LBSPPB512_LPA16_MIWT1_1_PLR1_SU0_SUM0_SUS0_VWA1_VWB1_WGM8_WGMXCC1_WGMXCCGn1
    SolutionIndex: 136
    SolutionNameMin: Cijk_Ailk_Bljk_BSS_BH_Bias_HAS_SAV_UserArgs_MT32x32x256_MI16x16x1_SN_LDSB1_CLR1_GSU0_GSUC0_GSUWGMRR0_K1_LBSPPA512_LBSPPB512_LPA16_MIWT1_1_PLR1_SU0_SUM0_SUS0_VWA1_VWB1_WGM8_WGMXCC1_WGMXCCGn1
    SolutionIndex: 137
    SolutionNameMin: Cijk_Ailk_Bljk_BSS_BH_Bias_HAS_SAV_UserArgs_MT32x32x32_MI16x16x1_SN_LDSB0_CLR0_GSU0_GSUC0_GSUWGMRR0_K1_LBSPPA256_LBSPPB128_LPA16_MIWT1_1_PLR0_SU32_SUM0_SUS256_VWA1_VWB1_WGM1_WGMXCC1_WGMXCCGn1
- - - [128, 128, 1, 128, 128, 128, 128, 128]
    - [113, 0.04]
  - - [128, 128, 1, 256, 128, 128, 128, 256]
    - [113, 0.071]
  - - [128, 128, 1, 512, 128, 128, 128, 512]
    - [113, 0.12]
  - - [128, 128, 1, 1024, 128, 128, 128, 1024]
    - [130, 0.192]
  - - [128, 128, 1, 2048, 128, 128, 128, 2048]
    - [130, 0.274]
  - - [128, 128, 1, 4096, 128, 128, 128, 4096]
    - [130, 0.338]
  - - [128, 128, 1, 8192, 128, 128, 128, 8192]
    - [130, 0.388]
  - - [128, 256, 1, 128, 128, 128, 128, 128]
    - [116, 0.079]
  - - [128, 256, 1, 256, 128, 128, 128, 256]
    - [116, 0.141]
  - - [128, 256, 1, 512, 128, 128, 128, 512]
    - [117, 0.239]
  - - [128, 256, 1, 1024, 128, 128, 128, 1024]
    - [132, 0.385]
  - - [128, 256, 1, 2048, 128, 128, 128, 2048]
    - [136, 0.541]
  - - [128, 256, 1, 4096, 128, 128, 128, 4096]
    - [136, 0.677]
  - - [128, 256, 1, 8192, 128, 128, 128, 8192]
    - [133, 0.782]
  - - [128, 512, 1, 128, 128, 128, 128, 128]
    - [113, 0.158]
  - - [128, 512, 1, 256, 128, 128, 128, 256]
    - [132, 0.277]
  - - [128, 512, 1, 512, 128, 128, 128, 512]
    - [114, 0.466]
  - - [128, 512, 1, 1024, 128, 128, 128, 1024]
    - [132, 0.757]
  - - [128, 512, 1, 2048, 128, 128, 128, 2048]
    - [132, 1.077]
  - - [128, 512, 1, 4096, 128, 128, 128, 4096]
    - [130, 1.346]
  - - [128, 512, 1, 8192, 128, 128, 128, 8192]
    - [136, 1.577]
  - - [128, 1024, 1, 128, 128, 128, 128, 128]
    - [114, 0.31]
  - - [128, 1024, 1, 256, 128, 128, 128, 256]
    - [114, 0.544]
  - - [128, 1024, 1, 512, 128, 128, 128, 512]
    - [132, 0.922]
  - - [128, 1024, 1, 1024, 128, 128, 128, 1024]
    - [130, 1.493]
  - - [128, 1024, 1, 2048, 128, 128, 128, 2048]
    - [136, 2.124]
  - - [128, 1024, 1, 4096, 128, 128, 128, 4096]
    - [136, 2.691]
  - - [128, 1024, 1, 8192, 128, 128, 128, 8192]
    - [136, 3.128]
  - - [128, 2048, 1, 128, 128, 128, 128, 128]
    - [117, 0.596]
  - - [128, 2048, 1, 256, 128, 128, 128, 256]
    - [132, 1.054]
  - - [128, 2048, 1, 512, 128, 128, 128, 512]
    - [130, 1.774]
  - - [128, 2048, 1, 1024, 128, 128, 128, 1024]
    - [130, 2.872]
  - - [128, 2048, 1, 2048, 128, 128, 128, 2048]
    - [132, 4.128]
  - - [128, 2048, 1, 4096, 128, 128, 128, 4096]
    - [132, 5.242]
  - - [128, 2048, 1, 8192, 128, 128, 128, 8192]
    - [132, 5.953]
  - - [128, 4096, 1, 128, 128, 128, 128, 128]
    - [106, 1.079]
  - - [128, 4096, 1, 256, 128, 128, 128, 256]
    - [108, 1.905]
  - - [128, 4096, 1, 512, 128, 128, 128, 512]
    - [108, 3.185]
  - - [128, 4096, 1, 1024, 128, 128, 128, 1024]
    - [127, 4.946]
  - - [128, 4096, 1, 2048, 128, 128, 128, 2048]
    - [126, 6.875]
  - - [128, 4096, 1, 4096, 128, 128, 128, 4096]
    - [128, 8.194]
  - - [128, 4096, 1, 8192, 128, 128, 128, 8192]
    - [129, 9.341]
  - - [128, 8192, 1, 128, 128, 128, 128, 128]
    - [94, 1.828]
  - - [128, 8192, 1, 256, 128, 128, 128, 256]
    - [94, 3.246]
  - - [128, 8192, 1, 512, 128, 128, 128, 512]
    - [103, 5.308]
  - - [128, 8192, 1, 1024, 128, 128, 128, 1024]
    - [92, 7.669]
  - - [128, 8192, 1, 2048, 128, 128, 128, 2048]
    - [125, 9.798]
  - - [128, 8192, 1, 4096, 128, 128, 128, 4096]
    - [103, 12.486]
  - - [128, 8192, 1, 8192, 128, 128, 128, 8192]
    - [103, 13.784]
  - - [256, 128, 1, 128, 256, 256, 256, 128]
    - [116, 0.079]
  - - [256, 128, 1, 256, 256, 256, 256, 256]
    - [116, 0.141]
  - - [256, 128, 1, 512, 256, 256, 256, 512]
    - [117, 0.24]
  - - [256, 128, 1, 1024, 256, 256, 256, 1024]
    - [132, 0.374]
  - - [256, 128, 1, 2048, 256, 256, 256, 2048]
    - [132, 0.503]
  - - [256, 128, 1, 4096, 256, 256, 256, 4096]
    - [132, 0.618]
  - - [256, 128, 1, 8192, 256, 256, 256, 8192]
    - [132, 0.695]
  - - [256, 256, 1, 128, 256, 256, 256, 128]
    - [118, 0.157]
  - - [256, 256, 1, 256, 256, 256, 256, 256]
    - [113, 0.279]
  - - [256, 256, 1, 512, 256, 256, 256, 512]
    - [130, 0.471]
  - - [256, 256, 1, 1024, 256, 256, 256, 1024]
    - [132, 0.726]
  - - [256, 256, 1, 2048, 256, 256, 256, 2048]
    - [135, 0.997]
  - - [256, 256, 1, 4096, 256, 256, 256, 4096]
    - [134, 1.228]
  - - [256, 256, 1, 8192, 256, 256, 256, 8192]
    - [136, 1.387]
  - - [256, 512, 1, 128, 256, 256, 256, 128]
    - [117, 0.306]
  - - [256, 512, 1, 256, 256, 256, 256, 256]
    - [116, 0.547]
  - - [256, 512, 1, 512, 256, 256, 256, 512]
    - [132, 0.927]
  - - [256, 512, 1, 1024, 256, 256, 256, 1024]
    - [136, 1.446]
  - - [256, 512, 1, 2048, 256, 256, 256, 2048]
    - [136, 2.003]
  - - [256, 512, 1, 4096, 256, 256, 256, 4096]
    - [136, 2.46]
  - - [256, 512, 1, 8192, 256, 256, 256, 8192]
    - [136, 2.787]
  - - [256, 1024, 1, 128, 256, 256, 256, 128]
    - [113, 0.606]
  - - [256, 1024, 1, 256, 256, 256, 256, 256]
    - [131, 1.067]
  - - [256, 1024, 1, 512, 256, 256, 256, 512]
    - [117, 1.793]
  - - [256, 1024, 1, 1024, 256, 256, 256, 1024]
    - [130, 2.796]
  - - [256, 1024, 1, 2048, 256, 256, 256, 2048]
    - [132, 3.865]
  - - [256, 1024, 1, 4096, 256, 256, 256, 4096]
    - [136, 4.731]
  - - [256, 1024, 1, 8192, 256, 256, 256, 8192]
    - [136, 5.461]
  - - [256, 2048, 1, 128, 256, 256, 256, 128]
    - [108, 1.085]
  - - [256, 2048, 1, 256, 256, 256, 256, 256]
    - [126, 1.91]
  - - [256, 2048, 1, 512, 256, 256, 256, 512]
    - [108, 3.205]
  - - [256, 2048, 1, 1024, 256, 256, 256, 1024]
    - [126, 4.983]
  - - [256, 2048, 1, 2048, 256, 256, 256, 2048]
    - [126, 6.81]
  - - [256, 2048, 1, 4096, 256, 256, 256, 4096]
    - [126, 8.317]
  - - [256, 2048, 1, 8192, 256, 256, 256, 8192]
    - [112, 8.814]
  - - [256, 4096, 1, 128, 256, 256, 256, 128]
    - [94, 1.849]
  - - [256, 4096, 1, 256, 256, 256, 256, 256]
    - [94, 3.281]
  - - [256, 4096, 1, 512, 256, 256, 256, 512]
    - [99, 5.495]
  - - [256, 4096, 1, 1024, 256, 256, 256, 1024]
    - [101, 8.334]
  - - [256, 4096, 1, 2048, 256, 256, 256, 2048]
    - [93, 11.317]
  - - [256, 4096, 1, 4096, 256, 256, 256, 4096]
    - [93, 13.567]
  - - [256, 4096, 1, 8192, 256, 256, 256, 8192]
    - [94, 14.983]
  - - [256, 8192, 1, 128, 256, 256, 256, 128]
    - [77, 2.919]
  - - [256, 8192, 1, 256, 256, 256, 256, 256]
    - [59, 5.073]
  - - [256, 8192, 1, 512, 256, 256, 256, 512]
    - [51, 7.911]
  - - [256, 8192, 1, 1024, 256, 256, 256, 1024]
    - [50, 11.165]
  - - [256, 8192, 1, 2048, 256, 256, 256, 2048]
    - [59, 14.349]
  - - [256, 8192, 1, 4096, 256, 256, 256, 4096]
    - [88, 17.594]
  - - [256, 8192, 1, 8192, 256, 256, 256, 8192]
    - [89, 17.802]
  - - [512, 128, 1, 128, 512, 512, 512, 128]
    - [114, 0.157]
  - - [512, 128, 1, 256, 512, 512, 512, 256]
    - [113, 0.279]
  - - [512, 128, 1, 512, 512, 512, 512, 512]
    - [117, 0.471]
  - - [512, 128, 1, 1024, 512, 512, 512, 1024]
    - [117, 0.717]
  - - [512, 128, 1, 2048, 512, 512, 512, 2048]
    - [114, 0.974]
  - - [512, 128, 1, 4096, 512, 512, 512, 4096]
    - [117, 1.199]
  - - [512, 128, 1, 8192, 512, 512, 512, 8192]
    - [117, 1.343]
  - - [512, 256, 1, 128, 512, 512, 512, 128]
    - [114, 0.31]
  - - [512, 256, 1, 256, 512, 512, 512, 256]
    - [117, 0.543]
  - - [512, 256, 1, 512, 512, 512, 512, 512]
    - [117, 0.913]
  - - [512, 256, 1, 1024, 512, 512, 512, 1024]
    - [120, 1.403]
  - - [512, 256, 1, 2048, 512, 512, 512, 2048]
    - [120, 1.936]
  - - [512, 256, 1, 4096, 512, 512, 512, 4096]
    - [120, 2.351]
  - - [512, 256, 1, 8192, 512, 512, 512, 8192]
    - [119, 2.69]
  - - [512, 512, 1, 128, 512, 512, 512, 128]
    - [117, 0.603]
  - - [512, 512, 1, 256, 512, 512, 512, 256]
    - [130, 1.055]
  - - [512, 512, 1, 512, 512, 512, 512, 512]
    - [113, 1.781]
  - - [512, 512, 1, 1024, 512, 512, 512, 1024]
    - [121, 2.741]
  - - [512, 512, 1, 2048, 512, 512, 512, 2048]
    - [121, 3.776]
  - - [512, 512, 1, 4096, 512, 512, 512, 4096]
    - [121, 4.626]
  - - [512, 512, 1, 8192, 512, 512, 512, 8192]
    - [121, 5.317]
  - - [512, 1024, 1, 128, 512, 512, 512, 128]
    - [106, 1.08]
  - - [512, 1024, 1, 256, 512, 512, 512, 256]
    - [126, 1.929]
  - - [512, 1024, 1, 512, 512, 512, 512, 512]
    - [108, 3.215]
  - - [512, 1024, 1, 1024, 512, 512, 512, 1024]
    - [108, 4.926]
  - - [512, 1024, 1, 2048, 512, 512, 512, 2048]
    - [108, 6.713]
  - - [512, 1024, 1, 4096, 512, 512, 512, 4096]
    - [112, 8.238]
  - - [512, 1024, 1, 8192, 512, 512, 512, 8192]
    - [110, 8.941]
  - - [512, 2048, 1, 128, 512, 512, 512, 128]
    - [94, 1.84]
  - - [512, 2048, 1, 256, 512, 512, 512, 256]
    - [94, 3.264]
  - - [512, 2048, 1, 512, 512, 512, 512, 512]
    - [94, 5.551]
  - - [512, 2048, 1, 1024, 512, 512, 512, 1024]
    - [93, 8.477]
  - - [512, 2048, 1, 2048, 512, 512, 512, 2048]
    - [93, 11.515]
  - - [512, 2048, 1, 4096, 512, 512, 512, 4096]
    - [94, 13.967]
  - - [512, 2048, 1, 8192, 512, 512, 512, 8192]
    - [94, 15.221]
  - - [512, 4096, 1, 128, 512, 512, 512, 128]
    - [58, 2.918]
  - - [512, 4096, 1, 256, 512, 512, 512, 256]
    - [59, 5.18]
  - - [512, 4096, 1, 512, 512, 512, 512, 512]
    - [50, 8.114]
  - - [512, 4096, 1, 1024, 512, 512, 512, 1024]
    - [87, 11.759]
  - - [512, 4096, 1, 2048, 512, 512, 512, 2048]
    - [59, 14.783]
  - - [512, 4096, 1, 4096, 512, 512, 512, 4096]
    - [91, 17.288]
  - - [512, 4096, 1, 8192, 512, 512, 512, 8192]
    - [86, 17.586]
  - - [512, 8192, 1, 128, 512, 512, 512, 128]
    - [44, 3.714]
  - - [512, 8192, 1, 256, 512, 512, 512, 256]
    - [9, 6.622]
  - - [512, 8192, 1, 512, 512, 512, 512, 512]
    - [8, 9.945]
  - - [512, 8192, 1, 1024, 512, 512, 512, 1024]
    - [83, 14.528]
  - - [512, 8192, 1, 2048, 512, 512, 512, 2048]
    - [47, 20.506]
  - - [512, 8192, 1, 4096, 512, 512, 512, 4096]
    - [48, 24.895]
  - - [512, 8192, 1, 8192, 512, 512, 512, 8192]
    - [44, 24.884]
  - - [1024, 128, 1, 128, 1024, 1024, 1024, 128]
    - [113, 0.309]
  - - [1024, 128, 1, 256, 1024, 1024, 1024, 256]
    - [117, 0.539]
  - - [1024, 128, 1, 512, 1024, 1024, 1024, 512]
    - [113, 0.906]
  - - [1024, 128, 1, 1024, 1024, 1024, 1024, 1024]
    - [116, 1.393]
  - - [1024, 128, 1, 2048, 1024, 1024, 1024, 2048]
    - [113, 1.896]
  - - [1024, 128, 1, 4096, 1024, 1024, 1024, 4096]
    - [117, 2.32]
  - - [1024, 128, 1, 8192, 1024, 1024, 1024, 8192]
    - [121, 2.639]
  - - [1024, 256, 1, 128, 1024, 1024, 1024, 128]
    - [114, 0.592]
  - - [1024, 256, 1, 256, 1024, 1024, 1024, 256]
    - [134, 1.039]
  - - [1024, 256, 1, 512, 1024, 1024, 1024, 512]
    - [120, 1.75]
  - - [1024, 256, 1, 1024, 1024, 1024, 1024, 1024]
    - [118, 2.695]
  - - [1024, 256, 1, 2048, 1024, 1024, 1024, 2048]
    - [120, 3.677]
  - - [1024, 256, 1, 4096, 1024, 1024, 1024, 4096]
    - [119, 4.558]
  - - [1024, 256, 1, 8192, 1024, 1024, 1024, 8192]
    - [120, 5.232]
  - - [1024, 512, 1, 128, 1024, 1024, 1024, 128]
    - [105, 1.079]
  - - [1024, 512, 1, 256, 1024, 1024, 1024, 256]
    - [129, 1.896]
  - - [1024, 512, 1, 512, 1024, 1024, 1024, 512]
    - [112, 3.199]
  - - [1024, 512, 1, 1024, 1024, 1024, 1024, 1024]
    - [112, 4.903]
  - - [1024, 512, 1, 2048, 1024, 1024, 1024, 2048]
    - [112, 6.702]
  - - [1024, 512, 1, 4096, 1024, 1024, 1024, 4096]
    - [112, 8.268]
  - - [1024, 512, 1, 8192, 1024, 1024, 1024, 8192]
    - [111, 9.022]
  - - [1024, 1024, 1, 128, 1024, 1024, 1024, 128]
    - [123, 1.828]
  - - [1024, 1024, 1, 256, 1024, 1024, 1024, 256]
    - [103, 3.233]
  - - [1024, 1024, 1, 512, 1024, 1024, 1024, 512]
    - [103, 5.494]
  - - [1024, 1024, 1, 1024, 1024, 1024, 1024, 1024]
    - [101, 8.417]
  - - [1024, 1024, 1, 2048, 1024, 1024, 1024, 2048]
    - [101, 11.611]
  - - [1024, 1024, 1, 4096, 1024, 1024, 1024, 4096]
    - [101, 14.161]
  - - [1024, 1024, 1, 8192, 1024, 1024, 1024, 8192]
    - [103, 15.353]
  - - [1024, 2048, 1, 128, 1024, 1024, 1024, 128]
    - [58, 2.906]
  - - [1024, 2048, 1, 256, 1024, 1024, 1024, 256]
    - [58, 5.176]
  - - [1024, 2048, 1, 512, 1024, 1024, 1024, 512]
    - [87, 8.175]
  - - [1024, 2048, 1, 1024, 1024, 1024, 1024, 1024]
    - [90, 11.773]
  - - [1024, 2048, 1, 2048, 1024, 1024, 1024, 2048]
    - [53, 15.266]
  - - [1024, 2048, 1, 4096, 1024, 1024, 1024, 4096]
    - [91, 17.454]
  - - [1024, 2048, 1, 8192, 1024, 1024, 1024, 8192]
    - [57, 18.082]
  - - [1024, 4096, 1, 128, 1024, 1024, 1024, 128]
    - [46, 3.683]
  - - [1024, 4096, 1, 256, 1024, 1024, 1024, 256]
    - [80, 6.37]
  - - [1024, 4096, 1, 512, 1024, 1024, 1024, 512]
    - [74, 10.351]
  - - [1024, 4096, 1, 1024, 1024, 1024, 1024, 1024]
    - [79, 15.13]
  - - [1024, 4096, 1, 2048, 1024, 1024, 1024, 2048]
    - [80, 21.225]
  - - [1024, 4096, 1, 4096, 1024, 1024, 1024, 4096]
    - [43, 25.388]
  - - [1024, 4096, 1, 8192, 1024, 1024, 1024, 8192]
    - [85, 24.921]
  - - [1024, 8192, 1, 128, 1024, 1024, 1024, 128]
    - [0, 4.543]
  - - [1024, 8192, 1, 256, 1024, 1024, 1024, 256]
    - [1, 7.74]
  - - [1024, 8192, 1, 512, 1024, 1024, 1024, 512]
    - [7, 12.343]
  - - [1024, 8192, 1, 1024, 1024, 1024, 1024, 1024]
    - [30, 19.5]
  - - [1024, 8192, 1, 2048, 1024, 1024, 1024, 2048]
    - [35, 26.354]
  - - [1024, 8192, 1, 4096, 1024, 1024, 1024, 4096]
    - [71, 31.436]
  - - [1024, 8192, 1, 8192, 1024, 1024, 1024, 8192]
    - [42, 31.374]
  - - [2048, 128, 1, 128, 2048, 2048, 2048, 128]
    - [115, 0.587]
  - - [2048, 128, 1, 256, 2048, 2048, 2048, 256]
    - [132, 1.029]
  - - [2048, 128, 1, 512, 2048, 2048, 2048, 512]
    - [117, 1.74]
  - - [2048, 128, 1, 1024, 2048, 2048, 2048, 1024]
    - [117, 2.643]
  - - [2048, 128, 1, 2048, 2048, 2048, 2048, 2048]
    - [117, 3.608]
  - - [2048, 128, 1, 4096, 2048, 2048, 2048, 4096]
    - [119, 4.5]
  - - [2048, 128, 1, 8192, 2048, 2048, 2048, 8192]
    - [114, 4.682]
  - - [2048, 256, 1, 128, 2048, 2048, 2048, 128]
    - [104, 1.073]
  - - [2048, 256, 1, 256, 2048, 2048, 2048, 256]
    - [107, 1.865]
  - - [2048, 256, 1, 512, 2048, 2048, 2048, 512]
    - [112, 3.16]
  - - [2048, 256, 1, 1024, 2048, 2048, 2048, 1024]
    - [110, 4.834]
  - - [2048, 256, 1, 2048, 2048, 2048, 2048, 2048]
    - [110, 6.633]
  - - [2048, 256, 1, 4096, 2048, 2048, 2048, 4096]
    - [110, 8.169]
  - - [2048, 256, 1, 8192, 2048, 2048, 2048, 8192]
    - [110, 8.649]
  - - [2048, 512, 1, 128, 2048, 2048, 2048, 128]
    - [99, 1.809]
  - - [2048, 512, 1, 256, 2048, 2048, 2048, 256]
    - [99, 3.19]
  - - [2048, 512, 1, 512, 2048, 2048, 2048, 512]
    - [103, 5.477]
  - - [2048, 512, 1, 1024, 2048, 2048, 2048, 1024]
    - [103, 8.305]
  - - [2048, 512, 1, 2048, 2048, 2048, 2048, 2048]
    - [98, 11.494]
  - - [2048, 512, 1, 4096, 2048, 2048, 2048, 4096]
    - [99, 13.921]
  - - [2048, 512, 1, 8192, 2048, 2048, 2048, 8192]
    - [99, 14.914]
  - - [2048, 1024, 1, 128, 2048, 2048, 2048, 128]
    - [59, 2.86]
  - - [2048, 1024, 1, 256, 2048, 2048, 2048, 256]
    - [59, 5.085]
  - - [2048, 1024, 1, 512, 2048, 2048, 2048, 512]
    - [64, 8.123]
  - - [2048, 1024, 1, 1024, 2048, 2048, 2048, 1024]
    - [54, 11.537]
  - - [2048, 1024, 1, 2048, 2048, 2048, 2048, 2048]
    - [53, 15.232]
  - - [2048, 1024, 1, 4096, 2048, 2048, 2048, 4096]
    - [91, 17.165]
  - - [2048, 1024, 1, 8192, 2048, 2048, 2048, 8192]
    - [63, 17.897]
  - - [2048, 2048, 1, 128, 2048, 2048, 2048, 128]
    - [44, 3.685]
  - - [2048, 2048, 1, 256, 2048, 2048, 2048, 256]
    - [82, 6.314]
  - - [2048, 2048, 1, 512, 2048, 2048, 2048, 512]
    - [81, 10.515]
  - - [2048, 2048, 1, 1024, 2048, 2048, 2048, 1024]
    - [81, 15.271]
  - - [2048, 2048, 1, 2048, 2048, 2048, 2048, 2048]
    - [82, 21.555]
  - - [2048, 2048, 1, 4096, 2048, 2048, 2048, 4096]
    - [46, 25.633]
  - - [2048, 2048, 1, 8192, 2048, 2048, 2048, 8192]
    - [46, 25.687]
  - - [2048, 4096, 1, 128, 2048, 2048, 2048, 128]
    - [29, 4.639]
  - - [2048, 4096, 1, 256, 2048, 2048, 2048, 256]
    - [3, 7.785]
  - - [2048, 4096, 1, 512, 2048, 2048, 2048, 512]
    - [37, 12.215]
  - - [2048, 4096, 1, 1024, 2048, 2048, 2048, 1024]
    - [32, 19.353]
  - - [2048, 4096, 1, 2048, 2048, 2048, 2048, 2048]
    - [31, 26.771]
  - - [2048, 4096, 1, 4096, 2048, 2048, 2048, 4096]
    - [70, 31.911]
  - - [2048, 4096, 1, 8192, 2048, 2048, 2048, 8192]
    - [42, 31.605]
  - - [2048, 8192, 1, 128, 2048, 2048, 2048, 128]
    - [2, 5.109]
  - - [2048, 8192, 1, 256, 2048, 2048, 2048, 256]
    - [1, 8.508]
  - - [2048, 8192, 1, 512, 2048, 2048, 2048, 512]
    - [16, 14.396]
  - - [2048, 8192, 1, 1024, 2048, 2048, 2048, 1024]
    - [18, 23.889]
  - - [2048, 8192, 1, 2048, 2048, 2048, 2048, 2048]
    - [68, 32.732]
  - - [2048, 8192, 1, 4096, 2048, 2048, 2048, 4096]
    - [69, 37.136]
  - - [2048, 8192, 1, 8192, 2048, 2048, 2048, 8192]
    - [69, 39.038]
  - - [4096, 128, 1, 128, 4096, 4096, 4096, 128]
    - [106, 1.06]
  - - [4096, 128, 1, 256, 4096, 4096, 4096, 256]
    - [106, 1.845]
  - - [4096, 128, 1, 512, 4096, 4096, 4096, 512]
    - [112, 3.075]
  - - [4096, 128, 1, 1024, 4096, 4096, 4096, 1024]
    - [105, 4.748]
  - - [4096, 128, 1, 2048, 4096, 4096, 4096, 2048]
    - [110, 6.561]
  - - [4096, 128, 1, 4096, 4096, 4096, 4096, 4096]
    - [109, 7.697]
  - - [4096, 128, 1, 8192, 4096, 4096, 4096, 8192]
    - [110, 8.651]
  - - [4096, 256, 1, 128, 4096, 4096, 4096, 128]
    - [103, 1.803]
  - - [4096, 256, 1, 256, 4096, 4096, 4096, 256]
    - [99, 3.199]
  - - [4096, 256, 1, 512, 4096, 4096, 4096, 512]
    - [101, 5.449]
  - - [4096, 256, 1, 1024, 4096, 4096, 4096, 1024]
    - [96, 8.111]
  - - [4096, 256, 1, 2048, 4096, 4096, 4096, 2048]
    - [102, 10.969]
  - - [4096, 256, 1, 4096, 4096, 4096, 4096, 4096]
    - [103, 13.504]
  - - [4096, 256, 1, 8192, 4096, 4096, 4096, 8192]
    - [103, 14.841]
  - - [4096, 512, 1, 128, 4096, 4096, 4096, 128]
    - [91, 2.837]
  - - [4096, 512, 1, 256, 4096, 4096, 4096, 256]
    - [53, 5.085]
  - - [4096, 512, 1, 512, 4096, 4096, 4096, 512]
    - [55, 7.998]
  - - [4096, 512, 1, 1024, 4096, 4096, 4096, 1024]
    - [53, 11.588]
  - - [4096, 512, 1, 2048, 4096, 4096, 4096, 2048]
    - [53, 14.704]
  - - [4096, 512, 1, 4096, 4096, 4096, 4096, 4096]
    - [52, 16.946]
  - - [4096, 512, 1, 8192, 4096, 4096, 4096, 8192]
    - [53, 17.521]
  - - [4096, 1024, 1, 128, 4096, 4096, 4096, 128]
    - [122, 3.643]
  - - [4096, 1024, 1, 256, 4096, 4096, 4096, 256]
    - [82, 6.308]
  - - [4096, 1024, 1, 512, 4096, 4096, 4096, 512]
    - [84, 10.264]
  - - [4096, 1024, 1, 1024, 4096, 4096, 4096, 1024]
    - [84, 14.864]
  - - [4096, 1024, 1, 2048, 4096, 4096, 4096, 2048]
    - [82, 20.799]
  - - [4096, 1024, 1, 4096, 4096, 4096, 4096, 4096]
    - [49, 24.354]
  - - [4096, 1024, 1, 8192, 4096, 4096, 4096, 8192]
    - [49, 25.269]
  - - [4096, 2048, 1, 128, 4096, 4096, 4096, 128]
    - [1, 4.485]
  - - [4096, 2048, 1, 256, 4096, 4096, 4096, 256]
    - [5, 7.614]
  - - [4096, 2048, 1, 512, 4096, 4096, 4096, 512]
    - [6, 12.059]
  - - [4096, 2048, 1, 1024, 4096, 4096, 4096, 1024]
    - [33, 18.685]
  - - [4096, 2048, 1, 2048, 4096, 4096, 4096, 2048]
    - [40, 26.301]
  - - [4096, 2048, 1, 4096, 4096, 4096, 4096, 4096]
    - [70, 31.107]
  - - [4096, 2048, 1, 8192, 4096, 4096, 4096, 8192]
    - [41, 31.46]
  - - [4096, 4096, 1, 128, 4096, 4096, 4096, 128]
    - [10, 5.068]
  - - [4096, 4096, 1, 256, 4096, 4096, 4096, 256]
    - [4, 8.546]
  - - [4096, 4096, 1, 512, 4096, 4096, 4096, 512]
    - [65, 14.755]
  - - [4096, 4096, 1, 1024, 4096, 4096, 4096, 1024]
    - [14, 23.858]
  - - [4096, 4096, 1, 2048, 4096, 4096, 4096, 2048]
    - [13, 33.126]
  - - [4096, 8192, 1, 128, 4096, 4096, 4096, 128]
    - [21, 5.667]
  - - [4096, 8192, 1, 256, 4096, 4096, 4096, 256]
    - [17, 9.967]
  - - [4096, 8192, 1, 512, 4096, 4096, 4096, 512]
    - [12, 16.736]
  - - [4096, 8192, 1, 1024, 4096, 4096, 4096, 1024]
    - [66, 25.44]
  - - [4096, 8192, 1, 2048, 4096, 4096, 4096, 2048]
    - [67, 31.29]
  - - [8192, 128, 1, 128, 8192, 8192, 8192, 128]
    - [78, 1.783]
  - - [8192, 128, 1, 256, 8192, 8192, 8192, 256]
    - [124, 3.13]
  - - [8192, 128, 1, 512, 8192, 8192, 8192, 512]
    - [97, 5.029]
  - - [8192, 128, 1, 1024, 8192, 8192, 8192, 1024]
    - [100, 7.437]
  - - [8192, 128, 1, 2048, 8192, 8192, 8192, 2048]
    - [95, 9.554]
  - - [8192, 128, 1, 4096, 8192, 8192, 8192, 4096]
    - [99, 12.252]
  - - [8192, 128, 1, 8192, 8192, 8192, 8192, 8192]
    - [101, 13.81]
  - - [8192, 256, 1, 128, 8192, 8192, 8192, 128]
    - [63, 2.846]
  - - [8192, 256, 1, 256, 8192, 8192, 8192, 256]
    - [62, 5.042]
  - - [8192, 256, 1, 512, 8192, 8192, 8192, 512]
    - [60, 7.868]
  - - [8192, 256, 1, 1024, 8192, 8192, 8192, 1024]
    - [56, 10.954]
  - - [8192, 256, 1, 2048, 8192, 8192, 8192, 2048]
    - [61, 14.227]
  - - [8192, 256, 1, 4096, 8192, 8192, 8192, 4096]
    - [61, 17.264]
  - - [8192, 256, 1, 8192, 8192, 8192, 8192, 8192]
    - [55, 17.097]
  - - [8192, 512, 1, 128, 8192, 8192, 8192, 128]
    - [76, 3.616]
  - - [8192, 512, 1, 256, 8192, 8192, 8192, 256]
    - [82, 6.488]
  - - [8192, 512, 1, 512, 8192, 8192, 8192, 512]
    - [75, 9.874]
  - - [8192, 512, 1, 1024, 8192, 8192, 8192, 1024]
    - [84, 14.77]
  - - [8192, 512, 1, 2048, 8192, 8192, 8192, 2048]
    - [82, 21.243]
  - - [8192, 512, 1, 4096, 8192, 8192, 8192, 4096]
    - [45, 24.437]
  - - [8192, 512, 1, 8192, 8192, 8192, 8192, 8192]
    - [49, 24.681]
  - - [8192, 1024, 1, 128, 8192, 8192, 8192, 128]
    - [38, 4.547]
  - - [8192, 1024, 1, 256, 8192, 8192, 8192, 256]
    - [36, 7.694]
  - - [8192, 1024, 1, 512, 8192, 8192, 8192, 512]
    - [36, 12.173]
  - - [8192, 1024, 1, 1024, 8192, 8192, 8192, 1024]
    - [39, 19.028]
  - - [8192, 1024, 1, 2048, 8192, 8192, 8192, 2048]
    - [34, 26.396]
  - - [8192, 1024, 1, 4096, 8192, 8192, 8192, 4096]
    - [73, 31.007]
  - - [8192, 1024, 1, 8192, 8192, 8192, 8192, 8192]
    - [42, 31.103]
  - - [8192, 2048, 1, 128, 8192, 8192, 8192, 128]
    - [72, 5.137]
  - - [8192, 2048, 1, 256, 8192, 8192, 8192, 256]
    - [28, 8.52]
  - - [8192, 2048, 1, 512, 8192, 8192, 8192, 512]
    - [22, 14.122]
  - - [8192, 2048, 1, 1024, 8192, 8192, 8192, 1024]
    - [25, 22.769]
  - - [8192, 2048, 1, 2048, 8192, 8192, 8192, 2048]
    - [67, 31.674]
  - - [8192, 2048, 1, 4096, 8192, 8192, 8192, 4096]
    - [67, 36.067]
  - - [8192, 2048, 1, 8192, 8192, 8192, 8192, 8192]
    - [26, 39.236]
  - - [8192, 4096, 1, 128, 8192, 8192, 8192, 128]
    - [20, 5.728]
  - - [8192, 4096, 1, 256, 8192, 8192, 8192, 256]
    - [21, 9.881]
  - - [8192, 4096, 1, 512, 8192, 8192, 8192, 512]
    - [11, 16.177]
  - - [8192, 4096, 1, 1024, 8192, 8192, 8192, 1024]
    - [13, 24.234]
  - - [8192, 4096, 1, 2048, 8192, 8192, 8192, 2048]
    - [67, 31.705]
  - - [8192, 8192, 1, 128, 8192, 8192, 8192, 128]
    - [19, 6.132]
  - - [8192, 8192, 1, 256, 8192, 8192, 8192, 256]
    - [15, 10.745]
  - - [8192, 8192, 1, 512, 8192, 8192, 8192, 512]
    - [13, 17.632]
  - - [8192, 8192, 1, 1024, 8192, 8192, 8192, 1024]
    - [66, 24.613]
  - - [8192, 8192, 1, 2048, 8192, 8192, 8192, 2048]
    - [69, 31.616]
  - - [4096, 4096, 1, 4096, 4096, 4096, 4096, 4096]
    - [67, 36.616]
  - - [4096, 4096, 1, 8192, 4096, 4096, 4096, 8192]
    - [24, 39.333]
  - - [4096, 8192, 1, 4096, 4096, 4096, 4096, 4096]
    - [27, 35.98]
  - - [4096, 8192, 1, 8192, 4096, 4096, 4096, 8192]
    - [24, 41.174]
  - - [8192, 4096, 1, 4096, 8192, 8192, 8192, 4096]
    - [68, 36.181]
  - - [8192, 4096, 1, 8192, 8192, 8192, 8192, 8192]
    - [23, 41.08]
  - - [8192, 8192, 1, 4096, 8192, 8192, 8192, 4096]
    - [27, 38.23]
  - - [8192, 8192, 1, 8192, 8192, 8192, 8192, 8192]
    - [24, 43.08]
  - - [1, 1, 1, 32, 1, 1, 1, 32]
    - [137, 0.0]
- null
- null
- DeviceEfficiency
- GridBased
