projects/hipblaslt/library/src/amd_detail/rocblaslt/src/Tensile/Logic/asm_full/gfx950/GridBased/gfx950_Cijk_Alik_Bljk_B8F8HS_BH_Bias_HAS_SAB_SAV_UserArgs.yaml
- {MinimumRequiredVersion: 4.33.0}
- gfx950
- gfx950
- [Device 75a0]
    SolutionIndex: 0
    SolutionNameMin: Cijk_Alik_Bljk_F8HS_BH_Bias_HAS_SAB_SAV_UserArgs_MT256x256x64_MI32x32x1_SN_GSU0_GSUC0_GSUWGMRR0_K1_LBSPPA256_LBSPPB256_MIWT4_4_SU0_SUM0_SUS0_VWA4_VWB4_WGM8_WGMXCC1_WGMXCCGn1
    SolutionIndex: 1
    SolutionNameMin: Cijk_Alik_Bljk_F8HS_BH_Bias_HAS_SAB_SAV_UserArgs_MT256x128x64_MI32x32x1_SN_GSU0_GSUC0_GSUWGMRR0_K1_LBSPPA256_LBSPPB128_MIWT4_2_SU0_SUM0_SUS0_VWA4_VWB2_WGM8_WGMXCC1_WGMXCCGn1
    SolutionIndex: 2
    SolutionNameMin: Cijk_Alik_Bljk_F8HS_BH_Bias_HAS_SAB_SAV_UserArgs_MT128x64x64_MI32x32x1_SN_GSU0_GSUC0_GSUWGMRR0_K1_LBSPPA128_LBSPPB128_MIWT2_1_SU0_SUM0_SUS0_VWA2_VWB1_WGM8_WGMXCC1_WGMXCCGn1
    SolutionIndex: 3
    SolutionNameMin: Cijk_Alik_Bljk_F8HS_BH_Bias_HAS_SAB_SAV_UserArgs_MT256x256x128_MI16x16x1_SN_GSU0_GSUC0_GSUWGMRR0_K1_LBSPPA1024_LBSPPB1024_MIWT8_8_SU0_SUM0_SUS0_VWA8_VWB8_WGM8_WGMXCC1_WGMXCCGn1
    SolutionIndex: 4
    SolutionNameMin: Cijk_Alik_Bljk_F8HS_BH_Bias_HAS_SAB_SAV_UserArgs_MT256x256x128_MI16x16x1_SN_GSU0_GSUC0_GSUWGMRR0_K1_LBSPPA1024_LBSPPB1024_MIWT8_8_SU0_SUM0_SUS0_VWA8_VWB8_WGM8_WGMXCC1_WGMXCCGn1
    SolutionIndex: 5
    SolutionNameMin: Cijk_Alik_Bljk_F8HS_BH_Bias_HAS_SAB_SAV_UserArgs_MT256x256x128_MI16x16x1_SN_GSU0_GSUC0_GSUWGMRR0_K1_LBSPPA1024_LBSPPB1024_MIWT8_8_SU0_SUM0_SUS0_VWA8_VWB8_WGM8_WGMXCC1_WGMXCCGn1
    SolutionIndex: 6
    SolutionNameMin: Cijk_Alik_Bljk_F8HS_BH_Bias_HAS_SAB_SAV_UserArgs_MT256x256x128_MI16x16x1_SN_GSU0_GSUC0_GSUWGMRR0_K1_LBSPPA1024_LBSPPB1024_MIWT8_8_SU0_SUM0_SUS0_VWA8_VWB8_WGM8_WGMXCC1_WGMXCCGn1
    SolutionIndex: 7
    SolutionNameMin: Cijk_Alik_Bljk_F8HS_BH_Bias_HAS_SAB_SAV_UserArgs_MT256x256x128_MI16x16x1_SN_GSU0_GSUC0_GSUWGMRR0_K1_LBSPPA1024_LBSPPB1024_MIWT8_8_SU0_SUM0_SUS0_VWA8_VWB8_WGM8_WGMXCC1_WGMXCCGn1
    SolutionIndex: 8
    SolutionNameMin: Cijk_Alik_Bljk_F8HS_BH_Bias_HAS_SAB_SAV_UserArgs_MT128x256x128_MI16x16x1_SN_GSU0_GSUC0_GSUWGMRR0_K1_LBSPPA512_LBSPPB1024_MIWT4_8_SU0_SUM0_SUS0_VWA4_VWB8_WGM8_WGMXCC1_WGMXCCGn1
    SolutionIndex: 9
    SolutionNameMin: Cijk_Alik_Bljk_F8HS_BH_Bias_HAS_SAB_SAV_UserArgs_MT128x256x128_MI16x16x1_SN_GSU0_GSUC0_GSUWGMRR0_K1_LBSPPA512_LBSPPB1024_MIWT4_8_SU0_SUM0_SUS0_VWA4_VWB8_WGM8_WGMXCC1_WGMXCCGn1
    SolutionIndex: 10
    SolutionNameMin: Cijk_Alik_Bljk_F8HS_BH_Bias_HAS_SAB_SAV_UserArgs_MT128x256x128_MI16x16x1_SN_GSU0_GSUC0_GSUWGMRR0_K1_LBSPPA512_LBSPPB1024_MIWT4_8_SU0_SUM0_SUS0_VWA4_VWB8_WGM8_WGMXCC1_WGMXCCGn1
    SolutionIndex: 11
    SolutionNameMin: Cijk_Alik_Bljk_F8HS_BH_Bias_HAS_SAB_SAV_UserArgs_MT256x128x128_MI16x16x1_SN_GSU0_GSUC0_GSUWGMRR0_K1_LBSPPA1024_LBSPPB512_MIWT8_4_SU0_SUM0_SUS0_VWA8_VWB4_WGM8_WGMXCC1_WGMXCCGn1
    SolutionIndex: 12
    SolutionNameMin: Cijk_Alik_Bljk_F8HS_BH_Bias_HAS_SAB_SAV_UserArgs_MT256x128x128_MI16x16x1_SN_GSU0_GSUC0_GSUWGMRR0_K1_LBSPPA1024_LBSPPB512_MIWT8_4_SU0_SUM0_SUS0_VWA8_VWB4_WGM8_WGMXCC1_WGMXCCGn1
    SolutionIndex: 13
    SolutionNameMin: Cijk_Alik_Bljk_F8HS_BH_Bias_HAS_SAB_SAV_UserArgs_MT256x128x128_MI16x16x1_SN_GSU0_GSUC0_GSUWGMRR0_K1_LBSPPA1024_LBSPPB512_MIWT8_4_SU0_SUM0_SUS0_VWA8_VWB4_WGM8_WGMXCC1_WGMXCCGn1
    SolutionIndex: 14
    SolutionNameMin: Cijk_Alik_Bljk_F8HS_BH_Bias_HAS_SAB_SAV_UserArgs_MT256x128x128_MI16x16x1_SN_GSU0_GSUC0_GSUWGMRR0_K1_LBSPPA1024_LBSPPB512_MIWT8_4_SU0_SUM0_SUS0_VWA8_VWB4_WGM8_WGMXCC1_WGMXCCGn1
    SolutionIndex: 15
    SolutionNameMin: Cijk_Alik_Bljk_F8HS_BH_Bias_HAS_SAB_SAV_UserArgs_MT256x128x128_MI16x16x1_SN_GSU0_GSUC0_GSUWGMRR0_K1_LBSPPA1024_LBSPPB512_MIWT8_4_SU0_SUM0_SUS0_VWA8_VWB4_WGM8_WGMXCC1_WGMXCCGn1
    SolutionIndex: 16
    SolutionNameMin: Cijk_Alik_Bljk_F8HS_BH_Bias_HAS_SAB_SAV_UserArgs_MT256x64x128_MI16x16x1_SN_GSU0_GSUC0_GSUWGMRR0_K1_LBSPPA1024_LBSPPB256_MIWT8_2_SU0_SUM0_SUS0_VWA8_VWB2_WGM8_WGMXCC1_WGMXCCGn1
    SolutionIndex: 17
    SolutionNameMin: Cijk_Alik_Bljk_F8HS_BH_Bias_HAS_SAB_SAV_UserArgs_MT256x64x128_MI16x16x1_SN_GSU0_GSUC0_GSUWGMRR0_K1_LBSPPA1024_LBSPPB256_MIWT8_2_SU0_SUM0_SUS0_VWA8_VWB2_WGM8_WGMXCC1_WGMXCCGn1
    SolutionIndex: 18
    SolutionNameMin: Cijk_Alik_Bljk_F8HS_BH_Bias_HAS_SAB_SAV_UserArgs_MT128x128x128_MI16x16x1_SN_GSU0_GSUC0_GSUWGMRR0_K1_LBSPPA512_LBSPPB512_MIWT4_4_SU0_SUM0_SUS0_VWA4_VWB4_WGM8_WGMXCC1_WGMXCCGn1
    SolutionIndex: 19
    SolutionNameMin: Cijk_Alik_Bljk_F8HS_BH_Bias_HAS_SAB_SAV_UserArgs_MT128x128x128_MI16x16x1_SN_GSU0_GSUC0_GSUWGMRR0_K1_LBSPPA512_LBSPPB512_MIWT4_4_SU0_SUM0_SUS0_VWA4_VWB4_WGM8_WGMXCC1_WGMXCCGn1
    SolutionIndex: 20
    SolutionNameMin: Cijk_Alik_Bljk_F8HS_BH_Bias_HAS_SAB_SAV_UserArgs_MT128x128x128_MI16x16x1_SN_GSU0_GSUC0_GSUWGMRR0_K1_LBSPPA512_LBSPPB512_MIWT4_4_SU0_SUM0_SUS0_VWA4_VWB4_WGM8_WGMXCC1_WGMXCCGn1
    SolutionIndex: 21
    SolutionNameMin: Cijk_Alik_Bljk_F8HS_BH_Bias_HAS_SAB_SAV_UserArgs_MT128x128x128_MI16x16x1_SN_GSU0_GSUC0_GSUWGMRR0_K1_LBSPPA512_LBSPPB512_MIWT4_4_SU0_SUM0_SUS0_VWA4_VWB4_WGM8_WGMXCC1_WGMXCCGn1
    SolutionIndex: 22
    SolutionNameMin: Cijk_Alik_Bljk_F8HS_BH_Bias_HAS_SAB_SAV_UserArgs_MT128x128x128_MI16x16x1_SN_GSU0_GSUC0_GSUWGMRR0_K1_LBSPPA512_LBSPPB512_MIWT4_4_SU0_SUM0_SUS0_VWA4_VWB4_WGM8_WGMXCC1_WGMXCCGn1
    SolutionIndex: 23
    SolutionNameMin: Cijk_Alik_Bljk_F8HS_BH_Bias_HAS_SAB_SAV_UserArgs_MT128x128x128_MI16x16x1_SN_GSU0_GSUC0_GSUWGMRR0_K1_LBSPPA512_LBSPPB512_MIWT4_4_SU0_SUM0_SUS0_VWA4_VWB4_WGM8_WGMXCC1_WGMXCCGn1
    SolutionIndex: 24
    SolutionNameMin: Cijk_Alik_Bljk_F8HS_BH_Bias_HAS_SAB_SAV_UserArgs_MT64x128x128_MI16x16x1_SN_GSU0_GSUC0_GSUWGMRR0_K1_LBSPPA256_LBSPPB512_MIWT2_4_SU0_SUM0_SUS0_VWA2_VWB4_WGM8_WGMXCC1_WGMXCCGn1
    SolutionIndex: 25
    SolutionNameMin: Cijk_Alik_Bljk_F8HS_BH_Bias_HAS_SAB_SAV_UserArgs_MT64x128x128_MI16x16x1_SN_GSU0_GSUC0_GSUWGMRR0_K1_LBSPPA256_LBSPPB512_MIWT2_4_SU0_SUM0_SUS0_VWA2_VWB4_WGM8_WGMXCC1_WGMXCCGn1
    SolutionIndex: 26
    SolutionNameMin: Cijk_Alik_Bljk_F8HS_BH_Bias_HAS_SAB_SAV_UserArgs_MT128x64x128_MI16x16x1_SN_GSU0_GSUC0_GSUWGMRR0_K1_LBSPPA512_LBSPPB256_MIWT4_2_SU0_SUM0_SUS0_VWA4_VWB2_WGM8_WGMXCC1_WGMXCCGn1
    SolutionIndex: 27
    SolutionNameMin: Cijk_Alik_Bljk_F8HS_BH_Bias_HAS_SAB_SAV_UserArgs_MT128x64x128_MI16x16x1_SN_GSU0_GSUC0_GSUWGMRR0_K1_LBSPPA512_LBSPPB256_MIWT4_2_SU0_SUM0_SUS0_VWA4_VWB2_WGM8_WGMXCC1_WGMXCCGn1
    SolutionIndex: 28
    SolutionNameMin: Cijk_Alik_Bljk_F8HS_BH_Bias_HAS_SAB_SAV_UserArgs_MT128x32x128_MI16x16x1_SN_GSU0_GSUC0_GSUWGMRR0_K1_LBSPPA512_LBSPPB128_MIWT4_1_SU0_SUM0_SUS0_VWA4_VWB1_WGM8_WGMXCC1_WGMXCCGn1
    SolutionIndex: 29
    SolutionNameMin: Cijk_Alik_Bljk_F8HS_BH_Bias_HAS_SAB_SAV_UserArgs_MT64x64x128_MI16x16x1_SN_GSU0_GSUC0_GSUWGMRR0_K1_LBSPPA256_LBSPPB256_MIWT2_2_SU0_SUM0_SUS0_VWA2_VWB2_WGM8_WGMXCC1_WGMXCCGn1
    SolutionIndex: 30
    SolutionNameMin: Cijk_Alik_Bljk_F8HS_BH_Bias_HAS_SAB_SAV_UserArgs_MT64x64x128_MI16x16x1_SN_GSU0_GSUC0_GSUWGMRR0_K1_LBSPPA256_LBSPPB256_MIWT2_2_SU0_SUM0_SUS0_VWA2_VWB2_WGM8_WGMXCC1_WGMXCCGn1
    SolutionIndex: 31
    SolutionNameMin: Cijk_Alik_Bljk_F8HS_BH_Bias_HAS_SAB_SAV_UserArgs_MT64x64x128_MI16x16x1_SN_GSU0_GSUC0_GSUWGMRR0_K1_LBSPPA256_LBSPPB256_MIWT2_2_SU0_SUM0_SUS0_VWA2_VWB2_WGM8_WGMXCC1_WGMXCCGn1
    SolutionIndex: 32
    SolutionNameMin: Cijk_Alik_Bljk_F8HS_BH_Bias_HAS_SAB_SAV_UserArgs_MT64x64x128_MI16x16x1_SN_GSU0_GSUC0_GSUWGMRR0_K1_LBSPPA256_LBSPPB256_MIWT2_2_SU0_SUM0_SUS0_VWA2_VWB2_WGM8_WGMXCC1_WGMXCCGn1
    SolutionIndex: 33
    SolutionNameMin: Cijk_Alik_Bljk_F8HS_BH_Bias_HAS_SAB_SAV_UserArgs_MT64x64x128_MI16x16x1_SN_GSU0_GSUC0_GSUWGMRR0_K1_LBSPPA256_LBSPPB256_MIWT2_2_SU0_SUM0_SUS0_VWA2_VWB2_WGM8_WGMXCC1_WGMXCCGn1
    SolutionIndex: 34
    SolutionNameMin: Cijk_Alik_Bljk_F8HS_BH_Bias_HAS_SAB_SAV_UserArgs_MT32x64x128_MI16x16x1_SN_GSU0_GSUC0_GSUWGMRR0_K1_LBSPPA128_LBSPPB256_MIWT1_2_SU0_SUM0_SUS0_VWA1_VWB2_WGM8_WGMXCC1_WGMXCCGn1
    SolutionIndex: 35
    SolutionNameMin: Cijk_Alik_Bljk_F8HS_BH_Bias_HAS_SAB_SAV_UserArgs_MT64x32x128_MI16x16x1_SN_GSU0_GSUC0_GSUWGMRR0_K1_LBSPPA256_LBSPPB128_MIWT2_1_SU0_SUM0_SUS0_VWA2_VWB1_WGM8_WGMXCC1_WGMXCCGn1
    SolutionIndex: 36
    SolutionNameMin: Cijk_Alik_Bljk_F8HS_BH_Bias_HAS_SAB_SAV_UserArgs_MT32x32x128_MI16x16x1_SN_GSU0_GSUC0_GSUWGMRR0_K1_LBSPPA128_LBSPPB128_MIWT1_1_SU0_SUM0_SUS0_VWA1_VWB1_WGM8_WGMXCC1_WGMXCCGn1
    SolutionIndex: 37
    SolutionNameMin: Cijk_Alik_Bljk_F8HS_BH_Bias_HAS_SAB_SAV_UserArgs_MT32x32x128_MI16x16x1_SN_GSU0_GSUC0_GSUWGMRR0_K1_LBSPPA128_LBSPPB128_MIWT1_1_SU0_SUM0_SUS0_VWA1_VWB1_WGM8_WGMXCC1_WGMXCCGn1
    SolutionIndex: 38
    SolutionNameMin: Cijk_Alik_Bljk_F8HS_BH_Bias_HAS_SAB_SAV_UserArgs_MT32x32x128_MI16x16x1_SN_GSU0_GSUC0_GSUWGMRR0_K1_LBSPPA128_LBSPPB128_MIWT1_1_SU0_SUM0_SUS0_VWA1_VWB1_WGM8_WGMXCC1_WGMXCCGn1
    SolutionIndex: 39
    SolutionNameMin: Cijk_Alik_Bljk_F8HS_BH_Bias_HAS_SAB_SAV_UserArgs_MT32x32x128_MI16x16x1_SN_GSU0_GSUC0_GSUWGMRR0_K1_LBSPPA128_LBSPPB128_MIWT1_1_SU0_SUM0_SUS0_VWA1_VWB1_WGM8_WGMXCC1_WGMXCCGn1
    SolutionIndex: 40
    SolutionNameMin: Cijk_Alik_Bljk_F8HS_BH_Bias_HAS_SAB_SAV_UserArgs_MT32x32x128_MI16x16x1_SN_GSU0_GSUC0_GSUWGMRR0_K1_LBSPPA128_LBSPPB128_MIWT1_1_SU0_SUM0_SUS0_VWA1_VWB1_WGM8_WGMXCC1_WGMXCCGn1
    SolutionIndex: 41
    SolutionNameMin: Cijk_Alik_Bljk_F8HS_BH_Bias_HAS_SAB_SAV_UserArgs_MT256x256x128_MI32x32x1_SN_GSU0_GSUC0_GSUWGMRR0_K1_LBSPPA512_LBSPPB512_MIWT4_4_SU0_SUM0_SUS0_VWA4_VWB4_WGM8_WGMXCC1_WGMXCCGn1
    SolutionIndex: 42
    SolutionNameMin: Cijk_Alik_Bljk_F8HS_BH_Bias_HAS_SAB_SAV_UserArgs_MT256x256x128_MI32x32x1_SN_GSU0_GSUC0_GSUWGMRR0_K1_LBSPPA512_LBSPPB512_MIWT4_4_SU0_SUM0_SUS0_VWA4_VWB4_WGM8_WGMXCC1_WGMXCCGn1
    SolutionIndex: 43
    SolutionNameMin: Cijk_Alik_Bljk_F8HS_BH_Bias_HAS_SAB_SAV_UserArgs_MT256x256x128_MI32x32x1_SN_GSU0_GSUC0_GSUWGMRR0_K1_LBSPPA512_LBSPPB512_MIWT4_4_SU0_SUM0_SUS0_VWA4_VWB4_WGM8_WGMXCC1_WGMXCCGn1
    SolutionIndex: 44
    SolutionNameMin: Cijk_Alik_Bljk_F8HS_BH_Bias_HAS_SAB_SAV_UserArgs_MT256x128x128_MI32x32x1_SN_GSU0_GSUC0_GSUWGMRR0_K1_LBSPPA512_LBSPPB256_MIWT4_2_SU0_SUM0_SUS0_VWA4_VWB2_WGM8_WGMXCC1_WGMXCCGn1
    SolutionIndex: 45
    SolutionNameMin: Cijk_Alik_Bljk_F8HS_BH_Bias_HAS_SAB_SAV_UserArgs_MT128x128x128_MI32x32x1_SN_GSU0_GSUC0_GSUWGMRR0_K1_LBSPPA256_LBSPPB256_MIWT2_2_SU0_SUM0_SUS0_VWA2_VWB2_WGM8_WGMXCC1_WGMXCCGn1
    SolutionIndex: 46
    SolutionNameMin: Cijk_Alik_Bljk_F8HS_BH_Bias_HAS_SAB_SAV_UserArgs_MT64x128x256_MI16x16x1_SN_GSU0_GSUC0_GSUWGMRR0_K1_LBSPPA512_LBSPPB1024_MIWT2_4_SU0_SUM0_SUS0_VWA2_VWB4_WGM8_WGMXCC1_WGMXCCGn1
    SolutionIndex: 47
    SolutionNameMin: Cijk_Alik_Bljk_F8HS_BH_Bias_HAS_SAB_SAV_UserArgs_MT64x128x256_MI16x16x1_SN_GSU0_GSUC0_GSUWGMRR0_K1_LBSPPA512_LBSPPB1024_MIWT2_4_SU0_SUM0_SUS0_VWA2_VWB4_WGM8_WGMXCC1_WGMXCCGn1
    SolutionIndex: 48
    SolutionNameMin: Cijk_Alik_Bljk_F8HS_BH_Bias_HAS_SAB_SAV_UserArgs_MT64x128x256_MI16x16x1_SN_GSU0_GSUC0_GSUWGMRR0_K1_LBSPPA512_LBSPPB1024_MIWT2_4_SU0_SUM0_SUS0_VWA2_VWB4_WGM8_WGMXCC1_WGMXCCGn1
    SolutionIndex: 49
    SolutionNameMin: Cijk_Alik_Bljk_F8HS_BH_Bias_HAS_SAB_SAV_UserArgs_MT64x128x256_MI16x16x1_SN_GSU0_GSUC0_GSUWGMRR0_K1_LBSPPA512_LBSPPB1024_MIWT2_4_SU0_SUM0_SUS0_VWA2_VWB4_WGM8_WGMXCC1_WGMXCCGn1
    SolutionIndex: 50
    SolutionNameMin: Cijk_Alik_Bljk_F8HS_BH_Bias_HAS_SAB_SAV_UserArgs_MT128x64x256_MI16x16x1_SN_GSU0_GSUC0_GSUWGMRR0_K1_LBSPPA1024_LBSPPB512_MIWT4_2_SU0_SUM0_SUS0_VWA4_VWB2_WGM8_WGMXCC1_WGMXCCGn1
    SolutionIndex: 51
    SolutionNameMin: Cijk_Alik_Bljk_F8HS_BH_Bias_HAS_SAB_SAV_UserArgs_MT128x64x256_MI16x16x1_SN_GSU0_GSUC0_GSUWGMRR0_K1_LBSPPA1024_LBSPPB512_MIWT4_2_SU0_SUM0_SUS0_VWA4_VWB2_WGM8_WGMXCC1_WGMXCCGn1
    SolutionIndex: 52
    SolutionNameMin: Cijk_Alik_Bljk_F8HS_BH_Bias_HAS_SAB_SAV_UserArgs_MT128x64x256_MI16x16x1_SN_GSU0_GSUC0_GSUWGMRR0_K1_LBSPPA1024_LBSPPB512_MIWT4_2_SU0_SUM0_SUS0_VWA4_VWB2_WGM8_WGMXCC1_WGMXCCGn1
    SolutionIndex: 53
    SolutionNameMin: Cijk_Alik_Bljk_F8HS_BH_Bias_HAS_SAB_SAV_UserArgs_MT128x64x256_MI16x16x1_SN_GSU0_GSUC0_GSUWGMRR0_K1_LBSPPA1024_LBSPPB512_MIWT4_2_SU0_SUM0_SUS0_VWA4_VWB2_WGM8_WGMXCC1_WGMXCCGn1
    SolutionIndex: 54
    SolutionNameMin: Cijk_Alik_Bljk_F8HS_BH_Bias_HAS_SAB_SAV_UserArgs_MT64x64x256_MI16x16x1_SN_GSU0_GSUC0_GSUWGMRR0_K1_LBSPPA512_LBSPPB512_MIWT2_2_SU0_SUM0_SUS0_VWA2_VWB2_WGM8_WGMXCC1_WGMXCCGn1
    SolutionIndex: 55
    SolutionNameMin: Cijk_Alik_Bljk_F8HS_BH_Bias_HAS_SAB_SAV_UserArgs_MT64x64x256_MI16x16x1_SN_GSU0_GSUC0_GSUWGMRR0_K1_LBSPPA512_LBSPPB512_MIWT2_2_SU0_SUM0_SUS0_VWA2_VWB2_WGM8_WGMXCC1_WGMXCCGn1
    SolutionIndex: 56
    SolutionNameMin: Cijk_Alik_Bljk_F8HS_BH_Bias_HAS_SAB_SAV_UserArgs_MT64x64x256_MI16x16x1_SN_GSU0_GSUC0_GSUWGMRR0_K1_LBSPPA512_LBSPPB512_MIWT2_2_SU0_SUM0_SUS0_VWA2_VWB2_WGM8_WGMXCC1_WGMXCCGn1
    SolutionIndex: 57
    SolutionNameMin: Cijk_Alik_Bljk_F8HS_BH_Bias_HAS_SAB_SAV_UserArgs_MT64x64x256_MI16x16x1_SN_GSU0_GSUC0_GSUWGMRR0_K1_LBSPPA512_LBSPPB512_MIWT2_2_SU0_SUM0_SUS0_VWA2_VWB2_WGM8_WGMXCC1_WGMXCCGn1
    SolutionIndex: 58
    SolutionNameMin: Cijk_Alik_Bljk_F8HS_BH_Bias_HAS_SAB_SAV_UserArgs_MT64x64x256_MI16x16x1_SN_GSU0_GSUC0_GSUWGMRR0_K1_LBSPPA512_LBSPPB512_MIWT2_2_SU0_SUM0_SUS0_VWA2_VWB2_WGM8_WGMXCC1_WGMXCCGn1
    SolutionIndex: 59
    SolutionNameMin: Cijk_Alik_Bljk_F8HS_BH_Bias_HAS_SAB_SAV_UserArgs_MT32x64x256_MI16x16x1_SN_GSU0_GSUC0_GSUWGMRR0_K1_LBSPPA256_LBSPPB512_MIWT1_2_SU0_SUM0_SUS0_VWA1_VWB2_WGM8_WGMXCC1_WGMXCCGn1
    SolutionIndex: 60
    SolutionNameMin: Cijk_Alik_Bljk_F8HS_BH_Bias_HAS_SAB_SAV_UserArgs_MT32x64x256_MI16x16x1_SN_GSU0_GSUC0_GSUWGMRR0_K1_LBSPPA256_LBSPPB512_MIWT1_2_SU0_SUM0_SUS0_VWA1_VWB2_WGM8_WGMXCC1_WGMXCCGn1
    SolutionIndex: 61
    SolutionNameMin: Cijk_Alik_Bljk_F8HS_BH_Bias_HAS_SAB_SAV_UserArgs_MT64x32x256_MI16x16x1_SN_GSU0_GSUC0_GSUWGMRR0_K1_LBSPPA512_LBSPPB256_MIWT2_1_SU0_SUM0_SUS0_VWA2_VWB1_WGM8_WGMXCC1_WGMXCCGn1
    SolutionIndex: 62
    SolutionNameMin: Cijk_Alik_Bljk_F8HS_BH_Bias_HAS_SAB_SAV_UserArgs_MT64x32x256_MI16x16x1_SN_GSU0_GSUC0_GSUWGMRR0_K1_LBSPPA512_LBSPPB256_MIWT2_1_SU0_SUM0_SUS0_VWA2_VWB1_WGM8_WGMXCC1_WGMXCCGn1
    SolutionIndex: 63
    SolutionNameMin: Cijk_Alik_Bljk_F8HS_BH_Bias_HAS_SAB_SAV_UserArgs_MT32x32x256_MI16x16x1_SN_GSU0_GSUC0_GSUWGMRR0_K1_LBSPPA256_LBSPPB256_MIWT1_1_SU0_SUM0_SUS0_VWA1_VWB1_WGM8_WGMXCC1_WGMXCCGn1
    SolutionIndex: 64
    SolutionNameMin: Cijk_Alik_Bljk_F8HS_BH_Bias_HAS_SAB_SAV_UserArgs_MT32x32x256_MI16x16x1_SN_GSU0_GSUC0_GSUWGMRR0_K1_LBSPPA256_LBSPPB256_MIWT1_1_SU0_SUM0_SUS0_VWA1_VWB1_WGM8_WGMXCC1_WGMXCCGn1
    SolutionIndex: 65
    SolutionNameMin: Cijk_Alik_Bljk_F8HS_BH_Bias_HAS_SAB_SAV_UserArgs_MT32x32x256_MI16x16x1_SN_GSU0_GSUC0_GSUWGMRR0_K1_LBSPPA256_LBSPPB256_MIWT1_1_SU0_SUM0_SUS0_VWA1_VWB1_WGM8_WGMXCC1_WGMXCCGn1
    SolutionIndex: 66
    SolutionNameMin: Cijk_Alik_Bljk_F8HS_BH_Bias_HAS_SAB_SAV_UserArgs_MT32x32x256_MI16x16x1_SN_GSU0_GSUC0_GSUWGMRR0_K1_LBSPPA256_LBSPPB256_MIWT1_1_SU0_SUM0_SUS0_VWA1_VWB1_WGM8_WGMXCC1_WGMXCCGn1
    SolutionIndex: 67
    SolutionNameMin: Cijk_Alik_Bljk_F8HS_BH_Bias_HAS_SAB_SAV_UserArgs_MT128x64x256_MI32x32x1_SN_GSU0_GSUC0_GSUWGMRR0_K1_LBSPPA512_LBSPPB256_MIWT2_1_SU0_SUM0_SUS0_VWA2_VWB1_WGM8_WGMXCC1_WGMXCCGn1
    SolutionIndex: 68
    SolutionNameMin: Cijk_Alik_Bljk_F8HS_BH_Bias_HAS_SAB_SAV_UserArgs_MT64x64x256_MI32x32x1_SN_GSU0_GSUC0_GSUWGMRR0_K1_LBSPPA256_LBSPPB256_MIWT1_1_SU0_SUM0_SUS0_VWA1_VWB1_WGM8_WGMXCC1_WGMXCCGn1
    SolutionIndex: 69
    SolutionNameMin: Cijk_Alik_Bljk_F8HS_BH_Bias_HAS_SAB_SAV_UserArgs_MT64x64x256_MI32x32x1_SN_GSU0_GSUC0_GSUWGMRR0_K1_LBSPPA256_LBSPPB256_MIWT1_1_SU0_SUM0_SUS0_VWA1_VWB1_WGM8_WGMXCC1_WGMXCCGn1
    SolutionIndex: 70
    SolutionNameMin: Cijk_Alik_Bljk_F8HS_BH_Bias_HAS_SAB_SAV_UserArgs_MT64x64x256_MI32x32x1_SN_GSU0_GSUC0_GSUWGMRR0_K1_LBSPPA256_LBSPPB256_MIWT1_1_SU0_SUM0_SUS0_VWA1_VWB1_WGM8_WGMXCC1_WGMXCCGn1
    SolutionIndex: 71
    SolutionNameMin: Cijk_Alik_Bljk_F8HS_BH_Bias_HAS_SAB_SAV_UserArgs_MT32x32x128_MI16x16x1_SN_GSU0_GSUC0_GSUWGMRR0_K1_LBSPPA128_LBSPPB128_MIWT1_1_SU32_SUM0_SUS256_VWA1_VWB1_WGM8_WGMXCC1_WGMXCCGn1
- - - [128, 128, 1, 128, 128, 128, 128, 128]
    - [38, 0.45]
  - - [128, 128, 1, 256, 128, 128, 256, 256]
    - [66, 0.88]
  - - [128, 128, 1, 512, 128, 128, 512, 512]
    - [66, 1.55]
  - - [128, 128, 1, 1024, 128, 128, 1024, 1024]
    - [66, 2.65]
  - - [128, 128, 1, 2048, 128, 128, 2048, 2048]
    - [66, 4.12]
  - - [128, 128, 1, 4096, 128, 128, 4096, 4096]
    - [66, 5.76]
  - - [128, 128, 1, 8192, 128, 128, 8192, 8192]
    - [63, 7.17]
  - - [128, 256, 1, 128, 128, 128, 128, 128]
    - [38, 0.91]
  - - [128, 256, 1, 256, 128, 128, 256, 256]
    - [66, 1.74]
  - - [128, 256, 1, 512, 128, 128, 512, 512]
    - [66, 3.12]
  - - [128, 256, 1, 1024, 128, 128, 1024, 1024]
    - [66, 5.28]
  - - [128, 256, 1, 2048, 128, 128, 2048, 2048]
    - [65, 8.21]
  - - [128, 256, 1, 4096, 128, 128, 4096, 4096]
    - [66, 11.47]
  - - [128, 256, 1, 8192, 128, 128, 8192, 8192]
    - [63, 14.25]
  - - [128, 512, 1, 128, 128, 128, 128, 128]
    - [38, 1.76]
  - - [128, 512, 1, 256, 128, 128, 256, 256]
    - [66, 3.47]
  - - [128, 512, 1, 512, 128, 128, 512, 512]
    - [66, 6.09]
  - - [128, 512, 1, 1024, 128, 128, 1024, 1024]
    - [66, 10.43]
  - - [128, 512, 1, 2048, 128, 128, 2048, 2048]
    - [66, 16.27]
  - - [128, 512, 1, 4096, 128, 128, 4096, 4096]
    - [63, 22.42]
  - - [128, 512, 1, 8192, 128, 128, 8192, 8192]
    - [63, 28.15]
  - - [128, 1024, 1, 128, 128, 128, 128, 128]
    - [39, 3.56]
  - - [128, 1024, 1, 256, 128, 128, 256, 256]
    - [66, 6.77]
  - - [128, 1024, 1, 512, 128, 128, 512, 512]
    - [65, 11.82]
  - - [128, 1024, 1, 1024, 128, 128, 1024, 1024]
    - [66, 20.3]
  - - [128, 1024, 1, 2048, 128, 128, 2048, 2048]
    - [66, 31.45]
  - - [128, 1024, 1, 4096, 128, 128, 4096, 4096]
    - [63, 43.76]
  - - [128, 1024, 1, 8192, 128, 128, 8192, 8192]
    - [63, 54.56]
  - - [128, 2048, 1, 128, 128, 128, 128, 128]
    - [39, 6.79]
  - - [128, 2048, 1, 256, 128, 128, 256, 256]
    - [65, 12.97]
  - - [128, 2048, 1, 512, 128, 128, 512, 512]
    - [66, 23.37]
  - - [128, 2048, 1, 1024, 128, 128, 1024, 1024]
    - [66, 39.15]
  - - [128, 2048, 1, 2048, 128, 128, 2048, 2048]
    - [64, 60.0]
  - - [128, 2048, 1, 4096, 128, 128, 4096, 4096]
    - [66, 83.26]
  - - [128, 2048, 1, 8192, 128, 128, 8192, 8192]
    - [63, 108.01]
  - - [128, 4096, 1, 128, 128, 128, 128, 128]
    - [35, 13.32]
  - - [128, 4096, 1, 256, 128, 128, 256, 256]
    - [62, 24.64]
  - - [128, 4096, 1, 512, 128, 128, 512, 512]
    - [62, 42.92]
  - - [128, 4096, 1, 1024, 128, 128, 1024, 1024]
    - [62, 71.72]
  - - [128, 4096, 1, 2048, 128, 128, 2048, 2048]
    - [61, 111.69]
  - - [128, 4096, 1, 4096, 128, 128, 4096, 4096]
    - [62, 157.01]
  - - [128, 4096, 1, 8192, 128, 128, 8192, 8192]
    - [62, 180.76]
  - - [128, 8192, 1, 128, 128, 128, 128, 128]
    - [31, 24.14]
  - - [128, 8192, 1, 256, 128, 128, 256, 256]
    - [58, 44.09]
  - - [128, 8192, 1, 512, 128, 128, 512, 512]
    - [58, 75.14]
  - - [128, 8192, 1, 1024, 128, 128, 1024, 1024]
    - [58, 127.44]
  - - [128, 8192, 1, 2048, 128, 128, 2048, 2048]
    - [68, 177.51]
  - - [128, 8192, 1, 4096, 128, 128, 4096, 4096]
    - [58, 238.17]
  - - [128, 8192, 1, 8192, 128, 128, 8192, 8192]
    - [57, 282.15]
  - - [256, 128, 1, 128, 256, 256, 128, 128]
    - [37, 0.88]
  - - [256, 128, 1, 256, 256, 256, 256, 256]
    - [65, 1.7]
  - - [256, 128, 1, 512, 256, 256, 512, 512]
    - [66, 3.1]
  - - [256, 128, 1, 1024, 256, 256, 1024, 1024]
    - [66, 5.25]
  - - [256, 128, 1, 2048, 256, 256, 2048, 2048]
    - [66, 8.19]
  - - [256, 128, 1, 4096, 256, 256, 4096, 4096]
    - [65, 11.3]
  - - [256, 128, 1, 8192, 256, 256, 8192, 8192]
    - [63, 14.1]
  - - [256, 256, 1, 128, 256, 256, 128, 128]
    - [40, 1.8]
  - - [256, 256, 1, 256, 256, 256, 256, 256]
    - [65, 3.42]
  - - [256, 256, 1, 512, 256, 256, 512, 512]
    - [66, 6.15]
  - - [256, 256, 1, 1024, 256, 256, 1024, 1024]
    - [66, 10.43]
  - - [256, 256, 1, 2048, 256, 256, 2048, 2048]
    - [66, 16.12]
  - - [256, 256, 1, 4096, 256, 256, 4096, 4096]
    - [66, 22.56]
  - - [256, 256, 1, 8192, 256, 256, 8192, 8192]
    - [63, 28.13]
  - - [256, 512, 1, 128, 256, 256, 128, 128]
    - [40, 3.48]
  - - [256, 512, 1, 256, 256, 256, 256, 256]
    - [64, 6.79]
  - - [256, 512, 1, 512, 256, 256, 512, 512]
    - [66, 12.2]
  - - [256, 512, 1, 1024, 256, 256, 1024, 1024]
    - [66, 20.77]
  - - [256, 512, 1, 2048, 256, 256, 2048, 2048]
    - [66, 32.4]
  - - [256, 512, 1, 4096, 256, 256, 4096, 4096]
    - [64, 44.78]
  - - [256, 512, 1, 8192, 256, 256, 8192, 8192]
    - [63, 56.19]
  - - [256, 1024, 1, 128, 256, 256, 128, 128]
    - [36, 6.87]
  - - [256, 1024, 1, 256, 256, 256, 256, 256]
    - [64, 13.18]
  - - [256, 1024, 1, 512, 256, 256, 512, 512]
    - [66, 23.83]
  - - [256, 1024, 1, 1024, 256, 256, 1024, 1024]
    - [66, 40.18]
  - - [256, 1024, 1, 2048, 256, 256, 2048, 2048]
    - [64, 62.09]
  - - [256, 1024, 1, 4096, 256, 256, 4096, 4096]
    - [64, 86.9]
  - - [256, 1024, 1, 8192, 256, 256, 8192, 8192]
    - [64, 109.08]
  - - [256, 2048, 1, 128, 256, 256, 128, 128]
    - [34, 13.19]
  - - [256, 2048, 1, 256, 256, 256, 256, 256]
    - [62, 24.53]
  - - [256, 2048, 1, 512, 256, 256, 512, 512]
    - [62, 43.28]
  - - [256, 2048, 1, 1024, 256, 256, 1024, 1024]
    - [62, 72.87]
  - - [256, 2048, 1, 2048, 256, 256, 2048, 2048]
    - [62, 112.97]
  - - [256, 2048, 1, 4096, 256, 256, 4096, 4096]
    - [62, 158.08]
  - - [256, 2048, 1, 8192, 256, 256, 8192, 8192]
    - [62, 201.9]
  - - [256, 4096, 1, 128, 256, 256, 128, 128]
    - [30, 24.13]
  - - [256, 4096, 1, 256, 256, 256, 256, 256]
    - [58, 43.92]
  - - [256, 4096, 1, 512, 256, 256, 512, 512]
    - [58, 77.33]
  - - [256, 4096, 1, 1024, 256, 256, 1024, 1024]
    - [58, 130.76]
  - - [256, 4096, 1, 2048, 256, 256, 2048, 2048]
    - [69, 192.99]
  - - [256, 4096, 1, 4096, 256, 256, 4096, 4096]
    - [58, 269.61]
  - - [256, 4096, 1, 8192, 256, 256, 8192, 8192]
    - [58, 322.4]
  - - [256, 8192, 1, 128, 256, 256, 128, 128]
    - [25, 41.22]
  - - [256, 8192, 1, 256, 256, 256, 256, 256]
    - [25, 73.93]
  - - [256, 8192, 1, 512, 256, 256, 512, 512]
    - [25, 129.26]
  - - [256, 8192, 1, 1024, 256, 256, 1024, 1024]
    - [26, 197.56]
  - - [256, 8192, 1, 2048, 256, 256, 2048, 2048]
    - [46, 263.74]
  - - [256, 8192, 1, 4096, 256, 256, 4096, 4096]
    - [27, 329.29]
  - - [256, 8192, 1, 8192, 256, 256, 8192, 8192]
    - [49, 408.06]
  - - [512, 128, 1, 128, 512, 512, 128, 128]
    - [38, 1.79]
  - - [512, 128, 1, 256, 512, 512, 256, 256]
    - [66, 3.44]
  - - [512, 128, 1, 512, 512, 512, 512, 512]
    - [66, 6.08]
  - - [512, 128, 1, 1024, 512, 512, 1024, 1024]
    - [65, 10.27]
  - - [512, 128, 1, 2048, 512, 512, 2048, 2048]
    - [65, 16.28]
  - - [512, 128, 1, 4096, 512, 512, 4096, 4096]
    - [66, 22.39]
  - - [512, 128, 1, 8192, 512, 512, 8192, 8192]
    - [63, 27.98]
  - - [512, 256, 1, 128, 512, 512, 128, 128]
    - [38, 3.56]
  - - [512, 256, 1, 256, 512, 512, 256, 256]
    - [66, 6.77]
  - - [512, 256, 1, 512, 512, 512, 512, 512]
    - [66, 11.94]
  - - [512, 256, 1, 1024, 512, 512, 1024, 1024]
    - [66, 20.55]
  - - [512, 256, 1, 2048, 512, 512, 2048, 2048]
    - [66, 31.99]
  - - [512, 256, 1, 4096, 512, 512, 4096, 4096]
    - [63, 44.15]
  - - [512, 256, 1, 8192, 512, 512, 8192, 8192]
    - [63, 55.44]
  - - [512, 512, 1, 128, 512, 512, 128, 128]
    - [38, 7.02]
  - - [512, 512, 1, 256, 512, 512, 256, 256]
    - [66, 13.5]
  - - [512, 512, 1, 512, 512, 512, 512, 512]
    - [66, 23.76]
  - - [512, 512, 1, 1024, 512, 512, 1024, 1024]
    - [66, 41.19]
  - - [512, 512, 1, 2048, 512, 512, 2048, 2048]
    - [66, 63.65]
  - - [512, 512, 1, 4096, 512, 512, 4096, 4096]
    - [66, 88.27]
  - - [512, 512, 1, 8192, 512, 512, 8192, 8192]
    - [64, 110.99]
  - - [512, 1024, 1, 128, 512, 512, 128, 128]
    - [35, 13.39]
  - - [512, 1024, 1, 256, 512, 512, 256, 256]
    - [62, 24.96]
  - - [512, 1024, 1, 512, 512, 512, 512, 512]
    - [62, 43.68]
  - - [512, 1024, 1, 1024, 512, 512, 1024, 1024]
    - [60, 74.27]
  - - [512, 1024, 1, 2048, 512, 512, 2048, 2048]
    - [62, 117.27]
  - - [512, 1024, 1, 4096, 512, 512, 4096, 4096]
    - [62, 161.79]
  - - [512, 1024, 1, 8192, 512, 512, 8192, 8192]
    - [62, 203.31]
  - - [512, 2048, 1, 128, 512, 512, 128, 128]
    - [32, 24.53]
  - - [512, 2048, 1, 256, 512, 512, 256, 256]
    - [58, 44.71]
  - - [512, 2048, 1, 512, 512, 512, 512, 512]
    - [58, 77.62]
  - - [512, 2048, 1, 1024, 512, 512, 1024, 1024]
    - [58, 132.42]
  - - [512, 2048, 1, 2048, 512, 512, 2048, 2048]
    - [56, 193.9]
  - - [512, 2048, 1, 4096, 512, 512, 4096, 4096]
    - [54, 267.37]
  - - [512, 2048, 1, 8192, 512, 512, 8192, 8192]
    - [55, 335.33]
  - - [512, 4096, 1, 128, 512, 512, 128, 128]
    - [2, 41.26]
  - - [512, 4096, 1, 256, 512, 512, 256, 256]
    - [67, 73.78]
  - - [512, 4096, 1, 512, 512, 512, 512, 512]
    - [25, 129.04]
  - - [512, 4096, 1, 1024, 512, 512, 1024, 1024]
    - [27, 201.88]
  - - [512, 4096, 1, 2048, 512, 512, 2048, 2048]
    - [27, 278.36]
  - - [512, 4096, 1, 4096, 512, 512, 4096, 4096]
    - [52, 361.74]
  - - [512, 4096, 1, 8192, 512, 512, 8192, 8192]
    - [53, 427.57]
  - - [512, 8192, 1, 128, 512, 512, 128, 128]
    - [23, 64.24]
  - - [512, 8192, 1, 256, 512, 512, 256, 256]
    - [23, 116.49]
  - - [512, 8192, 1, 512, 512, 512, 512, 512]
    - [17, 195.68]
  - - [512, 8192, 1, 1024, 512, 512, 1024, 1024]
    - [16, 291.44]
  - - [512, 8192, 1, 2048, 512, 512, 2048, 2048]
    - [18, 384.8]
  - - [512, 8192, 1, 4096, 512, 512, 4096, 4096]
    - [18, 490.45]
  - - [512, 8192, 1, 8192, 512, 512, 8192, 8192]
    - [23, 591.51]
  - - [1024, 128, 1, 128, 1024, 1024, 128, 128]
    - [37, 3.4]
  - - [1024, 128, 1, 256, 1024, 1024, 256, 256]
    - [66, 6.71]
  - - [1024, 128, 1, 512, 1024, 1024, 512, 512]
    - [66, 11.92]
  - - [1024, 128, 1, 1024, 1024, 1024, 1024, 1024]
    - [66, 20.56]
  - - [1024, 128, 1, 2048, 1024, 1024, 2048, 2048]
    - [66, 31.61]
  - - [1024, 128, 1, 4096, 1024, 1024, 4096, 4096]
    - [66, 43.82]
  - - [1024, 128, 1, 8192, 1024, 1024, 8192, 8192]
    - [63, 54.63]
  - - [1024, 256, 1, 128, 1024, 1024, 128, 128]
    - [38, 6.94]
  - - [1024, 256, 1, 256, 1024, 1024, 256, 256]
    - [66, 13.31]
  - - [1024, 256, 1, 512, 1024, 1024, 512, 512]
    - [66, 23.46]
  - - [1024, 256, 1, 1024, 1024, 1024, 1024, 1024]
    - [66, 40.02]
  - - [1024, 256, 1, 2048, 1024, 1024, 2048, 2048]
    - [66, 62.09]
  - - [1024, 256, 1, 4096, 1024, 1024, 4096, 4096]
    - [66, 86.78]
  - - [1024, 256, 1, 8192, 1024, 1024, 8192, 8192]
    - [65, 108.59]
  - - [1024, 512, 1, 128, 1024, 1024, 128, 128]
    - [35, 13.57]
  - - [1024, 512, 1, 256, 1024, 1024, 256, 256]
    - [62, 24.95]
  - - [1024, 512, 1, 512, 1024, 1024, 512, 512]
    - [62, 43.19]
  - - [1024, 512, 1, 1024, 1024, 1024, 1024, 1024]
    - [62, 74.59]
  - - [1024, 512, 1, 2048, 1024, 1024, 2048, 2048]
    - [62, 117.77]
  - - [1024, 512, 1, 4096, 1024, 1024, 4096, 4096]
    - [62, 162.46]
  - - [1024, 512, 1, 8192, 1024, 1024, 8192, 8192]
    - [62, 204.97]
  - - [1024, 1024, 1, 128, 1024, 1024, 128, 128]
    - [31, 24.36]
  - - [1024, 1024, 1, 256, 1024, 1024, 256, 256]
    - [58, 44.45]
  - - [1024, 1024, 1, 512, 1024, 1024, 512, 512]
    - [58, 77.61]
  - - [1024, 1024, 1, 1024, 1024, 1024, 1024, 1024]
    - [70, 132.36]
  - - [1024, 1024, 1, 2048, 1024, 1024, 2048, 2048]
    - [69, 195.03]
  - - [1024, 1024, 1, 4096, 1024, 1024, 4096, 4096]
    - [55, 269.08]
  - - [1024, 1024, 1, 8192, 1024, 1024, 8192, 8192]
    - [58, 339.1]
  - - [1024, 2048, 1, 128, 1024, 1024, 128, 128]
    - [25, 41.57]
  - - [1024, 2048, 1, 256, 1024, 1024, 256, 256]
    - [27, 73.92]
  - - [1024, 2048, 1, 512, 1024, 1024, 512, 512]
    - [27, 129.69]
  - - [1024, 2048, 1, 1024, 1024, 1024, 1024, 1024]
    - [27, 202.66]
  - - [1024, 2048, 1, 2048, 1024, 1024, 2048, 2048]
    - [47, 280.44]
  - - [1024, 2048, 1, 4096, 1024, 1024, 4096, 4096]
    - [52, 366.35]
  - - [1024, 2048, 1, 8192, 1024, 1024, 8192, 8192]
    - [53, 422.86]
  - - [1024, 4096, 1, 128, 1024, 1024, 128, 128]
    - [23, 64.4]
  - - [1024, 4096, 1, 256, 1024, 1024, 256, 256]
    - [23, 116.33]
  - - [1024, 4096, 1, 512, 1024, 1024, 512, 512]
    - [17, 196.23]
  - - [1024, 4096, 1, 1024, 1024, 1024, 1024, 1024]
    - [17, 301.87]
  - - [1024, 4096, 1, 2048, 1024, 1024, 2048, 2048]
    - [18, 408.64]
  - - [1024, 4096, 1, 4096, 1024, 1024, 4096, 4096]
    - [19, 501.02]
  - - [1024, 4096, 1, 8192, 1024, 1024, 8192, 8192]
    - [21, 610.66]
  - - [1024, 8192, 1, 128, 1024, 1024, 128, 128]
    - [15, 80.85]
  - - [1024, 8192, 1, 256, 1024, 1024, 256, 256]
    - [15, 145.83]
  - - [1024, 8192, 1, 512, 1024, 1024, 512, 512]
    - [12, 248.24]
  - - [1024, 8192, 1, 1024, 1024, 1024, 1024, 1024]
    - [9, 365.2]
  - - [1024, 8192, 1, 2048, 1024, 1024, 2048, 2048]
    - [11, 510.09]
  - - [1024, 8192, 1, 4096, 1024, 1024, 4096, 4096]
    - [10, 638.42]
  - - [1024, 8192, 1, 8192, 1024, 1024, 8192, 8192]
    - [44, 775.22]
  - - [2048, 128, 1, 128, 2048, 2048, 128, 128]
    - [36, 6.97]
  - - [2048, 128, 1, 256, 2048, 2048, 256, 256]
    - [66, 13.38]
  - - [2048, 128, 1, 512, 2048, 2048, 512, 512]
    - [66, 23.74]
  - - [2048, 128, 1, 1024, 2048, 2048, 1024, 1024]
    - [65, 39.42]
  - - [2048, 128, 1, 2048, 2048, 2048, 2048, 2048]
    - [66, 61.11]
  - - [2048, 128, 1, 4096, 2048, 2048, 4096, 4096]
    - [66, 84.44]
  - - [2048, 128, 1, 8192, 2048, 2048, 8192, 8192]
    - [63, 108.81]
  - - [2048, 256, 1, 128, 2048, 2048, 128, 128]
    - [35, 13.31]
  - - [2048, 256, 1, 256, 2048, 2048, 256, 256]
    - [60, 24.87]
  - - [2048, 256, 1, 512, 2048, 2048, 512, 512]
    - [60, 43.15]
  - - [2048, 256, 1, 1024, 2048, 2048, 1024, 1024]
    - [60, 74.01]
  - - [2048, 256, 1, 2048, 2048, 2048, 2048, 2048]
    - [60, 114.01]
  - - [2048, 256, 1, 4096, 2048, 2048, 4096, 4096]
    - [60, 159.25]
  - - [2048, 256, 1, 8192, 2048, 2048, 8192, 8192]
    - [60, 201.85]
  - - [2048, 512, 1, 128, 2048, 2048, 128, 128]
    - [28, 24.15]
  - - [2048, 512, 1, 256, 2048, 2048, 256, 256]
    - [58, 44.16]
  - - [2048, 512, 1, 512, 2048, 2048, 512, 512]
    - [58, 77.23]
  - - [2048, 512, 1, 1024, 2048, 2048, 1024, 1024]
    - [70, 129.83]
  - - [2048, 512, 1, 2048, 2048, 2048, 2048, 2048]
    - [58, 196.06]
  - - [2048, 512, 1, 4096, 2048, 2048, 4096, 4096]
    - [58, 274.25]
  - - [2048, 512, 1, 8192, 2048, 2048, 8192, 8192]
    - [58, 338.3]
  - - [2048, 1024, 1, 128, 2048, 2048, 128, 128]
    - [27, 41.58]
  - - [2048, 1024, 1, 256, 2048, 2048, 256, 256]
    - [27, 74.72]
  - - [2048, 1024, 1, 512, 2048, 2048, 512, 512]
    - [27, 130.69]
  - - [2048, 1024, 1, 1024, 2048, 2048, 1024, 1024]
    - [27, 207.54]
  - - [2048, 1024, 1, 2048, 2048, 2048, 2048, 2048]
    - [52, 285.96]
  - - [2048, 1024, 1, 4096, 2048, 2048, 4096, 4096]
    - [52, 368.95]
  - - [2048, 1024, 1, 8192, 2048, 2048, 8192, 8192]
    - [48, 433.65]
  - - [2048, 2048, 1, 128, 2048, 2048, 128, 128]
    - [23, 63.99]
  - - [2048, 2048, 1, 256, 2048, 2048, 256, 256]
    - [23, 115.98]
  - - [2048, 2048, 1, 512, 2048, 2048, 512, 512]
    - [22, 197.99]
  - - [2048, 2048, 1, 1024, 2048, 2048, 1024, 1024]
    - [18, 295.59]
  - - [2048, 2048, 1, 2048, 2048, 2048, 2048, 2048]
    - [20, 421.37]
  - - [2048, 2048, 1, 4096, 2048, 2048, 4096, 4096]
    - [20, 514.69]
  - - [2048, 2048, 1, 8192, 2048, 2048, 8192, 8192]
    - [23, 608.62]
  - - [2048, 4096, 1, 128, 2048, 2048, 128, 128]
    - [15, 81.22]
  - - [2048, 4096, 1, 256, 2048, 2048, 256, 256]
    - [15, 144.5]
  - - [2048, 4096, 1, 512, 2048, 2048, 512, 512]
    - [11, 245.34]
  - - [2048, 4096, 1, 1024, 2048, 2048, 1024, 1024]
    - [12, 371.75]
  - - [2048, 4096, 1, 2048, 2048, 2048, 2048, 2048]
    - [13, 518.53]
  - - [2048, 4096, 1, 4096, 2048, 2048, 4096, 4096]
    - [15, 666.74]
  - - [2048, 4096, 1, 8192, 2048, 2048, 8192, 8192]
    - [44, 828.68]
  - - [2048, 8192, 1, 128, 2048, 2048, 128, 128]
    - [7, 96.02]
  - - [2048, 8192, 1, 256, 2048, 2048, 256, 256]
    - [6, 170.45]
  - - [2048, 8192, 1, 512, 2048, 2048, 512, 512]
    - [4, 277.98]
  - - [2048, 8192, 1, 1024, 2048, 2048, 1024, 1024]
    - [4, 448.67]
  - - [2048, 8192, 1, 2048, 2048, 2048, 2048, 2048]
    - [3, 606.33]
  - - [2048, 8192, 1, 4096, 2048, 2048, 4096, 4096]
    - [43, 834.23]
  - - [2048, 8192, 1, 8192, 2048, 2048, 8192, 8192]
    - [43, 909.88]
  - - [4096, 128, 1, 128, 4096, 4096, 128, 128]
    - [34, 13.39]
  - - [4096, 128, 1, 256, 4096, 4096, 256, 256]
    - [62, 24.66]
  - - [4096, 128, 1, 512, 4096, 4096, 512, 512]
    - [60, 42.63]
  - - [4096, 128, 1, 1024, 4096, 4096, 1024, 1024]
    - [60, 71.76]
  - - [4096, 128, 1, 2048, 4096, 4096, 2048, 2048]
    - [60, 112.81]
  - - [4096, 128, 1, 4096, 4096, 4096, 4096, 4096]
    - [60, 158.3]
  - - [4096, 128, 1, 8192, 4096, 4096, 8192, 8192]
    - [59, 183.68]
  - - [4096, 256, 1, 128, 4096, 4096, 128, 128]
    - [29, 24.04]
  - - [4096, 256, 1, 256, 4096, 4096, 256, 256]
    - [58, 44.21]
  - - [4096, 256, 1, 512, 4096, 4096, 512, 512]
    - [58, 76.93]
  - - [4096, 256, 1, 1024, 4096, 4096, 1024, 1024]
    - [58, 130.5]
  - - [4096, 256, 1, 2048, 4096, 4096, 2048, 2048]
    - [57, 191.16]
  - - [4096, 256, 1, 4096, 4096, 4096, 4096, 4096]
    - [58, 267.46]
  - - [4096, 256, 1, 8192, 4096, 4096, 8192, 8192]
    - [58, 318.97]
  - - [4096, 512, 1, 128, 4096, 4096, 128, 128]
    - [2, 41.41]
  - - [4096, 512, 1, 256, 4096, 4096, 256, 256]
    - [67, 73.91]
  - - [4096, 512, 1, 512, 4096, 4096, 512, 512]
    - [25, 130.24]
  - - [4096, 512, 1, 1024, 4096, 4096, 1024, 1024]
    - [27, 200.61]
  - - [4096, 512, 1, 2048, 4096, 4096, 2048, 2048]
    - [52, 281.58]
  - - [4096, 512, 1, 4096, 4096, 4096, 4096, 4096]
    - [51, 346.5]
  - - [4096, 512, 1, 8192, 4096, 4096, 8192, 8192]
    - [53, 421.38]
  - - [4096, 1024, 1, 128, 4096, 4096, 128, 128]
    - [23, 63.46]
  - - [4096, 1024, 1, 256, 4096, 4096, 256, 256]
    - [23, 115.88]
  - - [4096, 1024, 1, 512, 4096, 4096, 512, 512]
    - [20, 195.88]
  - - [4096, 1024, 1, 1024, 4096, 4096, 1024, 1024]
    - [17, 303.57]
  - - [4096, 1024, 1, 2048, 4096, 4096, 2048, 2048]
    - [18, 401.06]
  - - [4096, 1024, 1, 4096, 4096, 4096, 4096, 4096]
    - [23, 508.39]
  - - [4096, 1024, 1, 8192, 4096, 4096, 8192, 8192]
    - [23, 614.85]
  - - [4096, 2048, 1, 128, 4096, 4096, 128, 128]
    - [15, 80.53]
  - - [4096, 2048, 1, 256, 4096, 4096, 256, 256]
    - [15, 142.49]
  - - [4096, 2048, 1, 512, 4096, 4096, 512, 512]
    - [11, 243.83]
  - - [4096, 2048, 1, 1024, 4096, 4096, 1024, 1024]
    - [12, 371.71]
  - - [4096, 2048, 1, 2048, 4096, 4096, 2048, 2048]
    - [12, 499.98]
  - - [4096, 2048, 1, 4096, 4096, 4096, 4096, 4096]
    - [15, 641.42]
  - - [4096, 2048, 1, 8192, 4096, 4096, 8192, 8192]
    - [44, 792.64]
  - - [4096, 4096, 1, 128, 4096, 4096, 128, 128]
    - [7, 98.7]
  - - [4096, 4096, 1, 256, 4096, 4096, 256, 256]
    - [3, 171.87]
  - - [4096, 4096, 1, 512, 4096, 4096, 512, 512]
    - [4, 282.92]
  - - [4096, 4096, 1, 1024, 4096, 4096, 1024, 1024]
    - [5, 441.01]
  - - [4096, 4096, 1, 2048, 4096, 4096, 2048, 2048]
    - [7, 639.97]
  - - [4096, 4096, 1, 4096, 4096, 4096, 4096, 4096]
    - [41, 850.51]
  - - [4096, 4096, 1, 8192, 4096, 4096, 8192, 8192]
    - [43, 929.3]
  - - [4096, 8192, 1, 128, 4096, 4096, 128, 128]
    - [7, 113.43]
  - - [4096, 8192, 1, 256, 4096, 4096, 256, 256]
    - [3, 191.34]
  - - [4096, 8192, 1, 512, 4096, 4096, 512, 512]
    - [4, 315.48]
  - - [4096, 8192, 1, 1024, 4096, 4096, 1024, 1024]
    - [6, 503.17]
  - - [4096, 8192, 1, 2048, 4096, 4096, 2048, 2048]
    - [42, 690.5]
  - - [4096, 8192, 1, 4096, 4096, 4096, 4096, 4096]
    - [43, 820.13]
  - - [4096, 8192, 1, 8192, 4096, 4096, 8192, 8192]
    - [43, 883.51]
  - - [8192, 128, 1, 128, 8192, 8192, 128, 128]
    - [33, 23.85]
  - - [8192, 128, 1, 256, 8192, 8192, 256, 256]
    - [70, 42.71]
  - - [8192, 128, 1, 512, 8192, 8192, 512, 512]
    - [58, 74.75]
  - - [8192, 128, 1, 1024, 8192, 8192, 1024, 1024]
    - [58, 125.54]
  - - [8192, 128, 1, 2048, 8192, 8192, 2048, 2048]
    - [57, 175.73]
  - - [8192, 128, 1, 4096, 8192, 8192, 4096, 4096]
    - [58, 223.76]
  - - [8192, 128, 1, 8192, 8192, 8192, 8192, 8192]
    - [58, 274.34]
  - - [8192, 256, 1, 128, 8192, 8192, 128, 128]
    - [25, 41.19]
  - - [8192, 256, 1, 256, 8192, 8192, 256, 256]
    - [27, 73.76]
  - - [8192, 256, 1, 512, 8192, 8192, 512, 512]
    - [25, 128.49]
  - - [8192, 256, 1, 1024, 8192, 8192, 1024, 1024]
    - [50, 198.06]
  - - [8192, 256, 1, 2048, 8192, 8192, 2048, 2048]
    - [47, 268.03]
  - - [8192, 256, 1, 4096, 8192, 8192, 4096, 4096]
    - [24, 332.63]
  - - [8192, 256, 1, 8192, 8192, 8192, 8192, 8192]
    - [53, 409.88]
  - - [8192, 512, 1, 128, 8192, 8192, 128, 128]
    - [23, 63.86]
  - - [8192, 512, 1, 256, 8192, 8192, 256, 256]
    - [23, 116.19]
  - - [8192, 512, 1, 512, 8192, 8192, 512, 512]
    - [20, 196.11]
  - - [8192, 512, 1, 1024, 8192, 8192, 1024, 1024]
    - [18, 291.22]
  - - [8192, 512, 1, 2048, 8192, 8192, 2048, 2048]
    - [18, 398.31]
  - - [8192, 512, 1, 4096, 8192, 8192, 4096, 4096]
    - [23, 501.56]
  - - [8192, 512, 1, 8192, 8192, 8192, 8192, 8192]
    - [45, 581.45]
  - - [8192, 1024, 1, 128, 8192, 8192, 128, 128]
    - [44, 79.31]
  - - [8192, 1024, 1, 256, 8192, 8192, 256, 256]
    - [15, 141.27]
  - - [8192, 1024, 1, 512, 8192, 8192, 512, 512]
    - [12, 242.79]
  - - [8192, 1024, 1, 1024, 8192, 8192, 1024, 1024]
    - [11, 360.32]
  - - [8192, 1024, 1, 2048, 8192, 8192, 2048, 2048]
    - [8, 495.16]
  - - [8192, 1024, 1, 4096, 8192, 8192, 4096, 4096]
    - [15, 635.61]
  - - [8192, 1024, 1, 8192, 8192, 8192, 8192, 8192]
    - [44, 761.46]
  - - [8192, 2048, 1, 128, 8192, 8192, 128, 128]
    - [0, 99.21]
  - - [8192, 2048, 1, 256, 8192, 8192, 256, 256]
    - [15, 170.17]
  - - [8192, 2048, 1, 512, 8192, 8192, 512, 512]
    - [11, 280.86]
  - - [8192, 2048, 1, 1024, 8192, 8192, 1024, 1024]
    - [6, 435.85]
  - - [8192, 2048, 1, 2048, 8192, 8192, 2048, 2048]
    - [5, 605.18]
  - - [8192, 2048, 1, 4096, 8192, 8192, 4096, 4096]
    - [43, 810.63]
  - - [8192, 2048, 1, 8192, 8192, 8192, 8192, 8192]
    - [43, 898.8]
  - - [8192, 4096, 1, 128, 8192, 8192, 128, 128]
    - [1, 110.58]
  - - [8192, 4096, 1, 256, 8192, 8192, 256, 256]
    - [7, 189.69]
  - - [8192, 4096, 1, 512, 8192, 8192, 512, 512]
    - [4, 312.84]
  - - [8192, 4096, 1, 1024, 8192, 8192, 1024, 1024]
    - [5, 495.11]
  - - [8192, 4096, 1, 2048, 8192, 8192, 2048, 2048]
    - [7, 699.7]
  - - [8192, 4096, 1, 4096, 8192, 8192, 4096, 4096]
    - [43, 812.63]
  - - [8192, 4096, 1, 8192, 8192, 8192, 8192, 8192]
    - [43, 894.71]
  - - [8192, 8192, 1, 128, 8192, 8192, 128, 128]
    - [14, 121.41]
  - - [8192, 8192, 1, 256, 8192, 8192, 256, 256]
    - [3, 212.89]
  - - [8192, 8192, 1, 512, 8192, 8192, 512, 512]
    - [41, 351.02]
  - - [8192, 8192, 1, 1024, 8192, 8192, 1024, 1024]
    - [43, 536.1]
  - - [8192, 8192, 1, 2048, 8192, 8192, 2048, 2048]
    - [43, 685.19]
  - - [8192, 8192, 1, 4096, 8192, 8192, 4096, 4096]
    - [43, 800.34]
  - - [8192, 8192, 1, 8192, 8192, 8192, 8192, 8192]
    - [43, 934.32]
  - - [1, 1, 1, 32, 1, 1, 32, 32]
    - [71, 0.0]
- null
- null
- DeviceEfficiency
- GridBased
