projects/hipblaslt/library/src/amd_detail/rocblaslt/src/Tensile/Logic/asm_full/gfx950/GridBased/gfx950_Cijk_Alik_Bjlk_HHS_BH_Bias_HAS_SAV_UserArgs.yaml
- {MinimumRequiredVersion: 4.33.0}
- gfx950
- gfx950
- [Device 75a0]
    SolutionIndex: 0
    SolutionNameMin: Cijk_Alik_Bjlk_HHS_BH_Bias_AS_SAV_UserArgs_MT256x256x32_MI16x16x1_SN_LDSB0_CLR0_GSU0_GSUC0_GSUWGMRR0_K1_LBSPPA512_LBSPPB1024_LPB0_MIWT8_8_PLR0_SU0_SUM0_SUS0_VWA8_VWB8_WGM1_WGMXCC1_WGMXCCGn1
    SolutionIndex: 1
    SolutionNameMin: Cijk_Alik_Bjlk_HHS_BH_Bias_AS_SAV_UserArgs_MT256x256x32_MI16x16x1_SN_LDSB0_CLR0_GSU0_GSUC0_GSUWGMRR0_K1_LBSPPA512_LBSPPB1024_LPB0_MIWT8_8_PLR0_SU0_SUM0_SUS0_VWA8_VWB8_WGM6_WGMXCC1_WGMXCCGn1
    SolutionIndex: 2
    SolutionNameMin: Cijk_Alik_Bjlk_HHS_BH_Bias_AS_SAV_UserArgs_MT256x256x32_MI16x16x1_SN_LDSB0_CLR0_GSU0_GSUC0_GSUWGMRR0_K1_LBSPPA512_LBSPPB1024_LPB0_MIWT8_8_PLR0_SU0_SUM0_SUS0_VWA8_VWB8_WGM6_WGMXCC1_WGMXCCGn1
    SolutionIndex: 3
    SolutionNameMin: Cijk_Alik_Bjlk_HHS_BH_Bias_AS_SAV_UserArgs_MT256x256x32_MI16x16x1_SN_LDSB0_CLR0_GSU0_GSUC0_GSUWGMRR0_K1_LBSPPA512_LBSPPB2048_LPB0_MIWT8_8_PLR0_SU0_SUM0_SUS0_VWA8_VWB8_WGM6_WGMXCC1_WGMXCCGn1
    SolutionIndex: 4
    SolutionNameMin: Cijk_Alik_Bjlk_HHS_BH_Bias_AS_SAV_UserArgs_MT256x256x32_MI16x16x1_SN_LDSB0_CLR0_GSU0_GSUC0_GSUWGMRR0_K1_LBSPPA512_LBSPPB4096_LPB0_MIWT8_8_PLR0_SU0_SUM0_SUS0_VWA8_VWB8_WGM6_WGMXCC1_WGMXCCGn1
    SolutionIndex: 5
    SolutionNameMin: Cijk_Alik_Bjlk_HHS_BH_Bias_AS_SAV_UserArgs_MT256x256x32_MI16x16x1_SN_LDSB0_CLR0_GSU0_GSUC0_GSUWGMRR0_K1_LBSPPA512_LBSPPB4096_LPB0_MIWT8_8_PLR0_SU0_SUM0_SUS0_VWA8_VWB8_WGM6_WGMXCC1_WGMXCCGn1
    SolutionIndex: 6
    SolutionNameMin: Cijk_Alik_Bjlk_HHS_BH_Bias_AS_SAV_UserArgs_MT256x256x32_MI16x16x1_SN_LDSB0_CLR0_GSU0_GSUC0_GSUWGMRR0_K1_LBSPPA512_LBSPPB1024_LPB0_MIWT8_8_PLR0_SU0_SUM0_SUS0_VWA8_VWB8_WGM8_WGMXCC1_WGMXCCGn1
    SolutionIndex: 7
    SolutionNameMin: Cijk_Alik_Bjlk_HHS_BH_Bias_AS_SAV_UserArgs_MT256x256x32_MI16x16x1_SN_LDSB0_CLR0_GSU0_GSUC0_GSUWGMRR0_K1_LBSPPA512_LBSPPB1024_LPB0_MIWT8_8_PLR0_SU0_SUM0_SUS0_VWA8_VWB8_WGM8_WGMXCC1_WGMXCCGn1
    SolutionIndex: 8
    SolutionNameMin: Cijk_Alik_Bjlk_HHS_BH_Bias_AS_SAV_UserArgs_MT256x256x32_MI16x16x1_SN_LDSB0_CLR0_GSU0_GSUC0_GSUWGMRR0_K1_LBSPPA512_LBSPPB2048_LPB0_MIWT8_8_PLR0_SU0_SUM0_SUS0_VWA8_VWB8_WGM8_WGMXCC1_WGMXCCGn1
    SolutionIndex: 9
    SolutionNameMin: Cijk_Alik_Bjlk_HHS_BH_Bias_AS_SAV_UserArgs_MT256x256x32_MI16x16x1_SN_LDSB0_CLR0_GSU0_GSUC0_GSUWGMRR0_K1_LBSPPA512_LBSPPB2048_LPB0_MIWT8_8_PLR0_SU0_SUM0_SUS0_VWA8_VWB8_WGM8_WGMXCC1_WGMXCCGn1
    SolutionIndex: 10
    SolutionNameMin: Cijk_Alik_Bjlk_HHS_BH_Bias_AS_SAV_UserArgs_MT256x256x32_MI16x16x1_SN_LDSB0_CLR0_GSU0_GSUC0_GSUWGMRR0_K1_LBSPPA512_LBSPPB2048_LPB0_MIWT8_8_PLR0_SU0_SUM0_SUS0_VWA8_VWB8_WGM8_WGMXCC1_WGMXCCGn1
    SolutionIndex: 11
    SolutionNameMin: Cijk_Alik_Bjlk_HHS_BH_Bias_AS_SAV_UserArgs_MT256x256x32_MI16x16x1_SN_LDSB0_CLR0_GSU0_GSUC0_GSUWGMRR0_K1_LBSPPA512_LBSPPB4096_LPB0_MIWT8_8_PLR0_SU0_SUM0_SUS0_VWA8_VWB8_WGM8_WGMXCC1_WGMXCCGn1
    SolutionIndex: 12
    SolutionNameMin: Cijk_Alik_Bjlk_HHS_BH_Bias_AS_SAV_UserArgs_MT256x256x32_MI16x16x1_SN_LDSB0_CLR0_GSU0_GSUC0_GSUWGMRR0_K1_LBSPPA512_LBSPPB4096_LPB0_MIWT8_8_PLR0_SU0_SUM0_SUS0_VWA8_VWB8_WGM8_WGMXCC1_WGMXCCGn1
    SolutionIndex: 13
    SolutionNameMin: Cijk_Alik_Bjlk_HHS_BH_Bias_AS_SAV_UserArgs_MT128x256x32_MI16x16x1_SN_LDSB1_CLR0_GSU0_GSUC0_GSUWGMRR0_K1_LBSPPA256_LBSPPB1024_LPB0_MIWT4_8_PLR0_SU0_SUM0_SUS0_VWA4_VWB8_WGM1_WGMXCC1_WGMXCCGn1
    SolutionIndex: 14
    SolutionNameMin: Cijk_Alik_Bjlk_HHS_BH_Bias_AS_SAV_UserArgs_MT128x256x32_MI16x16x1_SN_LDSB1_CLR0_GSU0_GSUC0_GSUWGMRR0_K1_LBSPPA256_LBSPPB4096_LPB0_MIWT4_8_PLR0_SU0_SUM0_SUS0_VWA4_VWB8_WGM1_WGMXCC1_WGMXCCGn1
    SolutionIndex: 15
    SolutionNameMin: Cijk_Alik_Bjlk_HHS_BH_Bias_AS_SAV_UserArgs_MT128x256x32_MI16x16x1_SN_LDSB1_CLR0_GSU0_GSUC0_GSUWGMRR0_K1_LBSPPA256_LBSPPB1024_LPB0_MIWT4_8_PLR0_SU0_SUM0_SUS0_VWA4_VWB8_WGM6_WGMXCC1_WGMXCCGn1
    SolutionIndex: 16
    SolutionNameMin: Cijk_Alik_Bjlk_HHS_BH_Bias_AS_SAV_UserArgs_MT128x256x32_MI16x16x1_SN_LDSB1_CLR0_GSU0_GSUC0_GSUWGMRR0_K1_LBSPPA256_LBSPPB1024_LPB0_MIWT4_8_PLR0_SU0_SUM0_SUS0_VWA4_VWB8_WGM6_WGMXCC1_WGMXCCGn1
    SolutionIndex: 17
    SolutionNameMin: Cijk_Alik_Bjlk_HHS_BH_Bias_AS_SAV_UserArgs_MT128x256x32_MI16x16x1_SN_LDSB1_CLR0_GSU0_GSUC0_GSUWGMRR0_K1_LBSPPA256_LBSPPB1024_LPB0_MIWT4_8_PLR0_SU0_SUM0_SUS0_VWA4_VWB8_WGM6_WGMXCC1_WGMXCCGn1
    SolutionIndex: 18
    SolutionNameMin: Cijk_Alik_Bjlk_HHS_BH_Bias_AS_SAV_UserArgs_MT128x256x32_MI16x16x1_SN_LDSB1_CLR0_GSU0_GSUC0_GSUWGMRR0_K1_LBSPPA256_LBSPPB2048_LPB0_MIWT4_8_PLR0_SU0_SUM0_SUS0_VWA4_VWB8_WGM6_WGMXCC1_WGMXCCGn1
    SolutionIndex: 19
    SolutionNameMin: Cijk_Alik_Bjlk_HHS_BH_Bias_AS_SAV_UserArgs_MT128x256x32_MI16x16x1_SN_LDSB1_CLR0_GSU0_GSUC0_GSUWGMRR0_K1_LBSPPA256_LBSPPB2048_LPB0_MIWT4_8_PLR0_SU0_SUM0_SUS0_VWA4_VWB8_WGM6_WGMXCC1_WGMXCCGn1
    SolutionIndex: 20
    SolutionNameMin: Cijk_Alik_Bjlk_HHS_BH_Bias_AS_SAV_UserArgs_MT128x256x32_MI16x16x1_SN_LDSB1_CLR0_GSU0_GSUC0_GSUWGMRR0_K1_LBSPPA256_LBSPPB4096_LPB0_MIWT4_8_PLR0_SU0_SUM0_SUS0_VWA4_VWB8_WGM6_WGMXCC1_WGMXCCGn1
    SolutionIndex: 21
    SolutionNameMin: Cijk_Alik_Bjlk_HHS_BH_Bias_AS_SAV_UserArgs_MT128x256x32_MI16x16x1_SN_LDSB1_CLR0_GSU0_GSUC0_GSUWGMRR0_K1_LBSPPA256_LBSPPB4096_LPB0_MIWT4_8_PLR0_SU0_SUM0_SUS0_VWA4_VWB8_WGM6_WGMXCC1_WGMXCCGn1
    SolutionIndex: 22
    SolutionNameMin: Cijk_Alik_Bjlk_HHS_BH_Bias_AS_SAV_UserArgs_MT128x256x32_MI16x16x1_SN_LDSB1_CLR0_GSU0_GSUC0_GSUWGMRR0_K1_LBSPPA256_LBSPPB1024_LPB0_MIWT4_8_PLR0_SU0_SUM0_SUS0_VWA4_VWB8_WGM8_WGMXCC1_WGMXCCGn1
    SolutionIndex: 23
    SolutionNameMin: Cijk_Alik_Bjlk_HHS_BH_Bias_AS_SAV_UserArgs_MT128x256x32_MI16x16x1_SN_LDSB1_CLR0_GSU0_GSUC0_GSUWGMRR0_K1_LBSPPA256_LBSPPB1024_LPB0_MIWT4_8_PLR0_SU0_SUM0_SUS0_VWA4_VWB8_WGM8_WGMXCC1_WGMXCCGn1
    SolutionIndex: 24
    SolutionNameMin: Cijk_Alik_Bjlk_HHS_BH_Bias_AS_SAV_UserArgs_MT128x256x32_MI16x16x1_SN_LDSB1_CLR0_GSU0_GSUC0_GSUWGMRR0_K1_LBSPPA256_LBSPPB2048_LPB0_MIWT4_8_PLR0_SU0_SUM0_SUS0_VWA4_VWB8_WGM8_WGMXCC1_WGMXCCGn1
    SolutionIndex: 25
    SolutionNameMin: Cijk_Alik_Bjlk_HHS_BH_Bias_AS_SAV_UserArgs_MT256x128x32_MI16x16x1_SN_LDSB1_CLR0_GSU0_GSUC0_GSUWGMRR0_K1_LBSPPA512_LBSPPB512_LPB0_MIWT8_4_PLR0_SU0_SUM0_SUS0_VWA8_VWB4_WGM1_WGMXCC1_WGMXCCGn1
    SolutionIndex: 26
    SolutionNameMin: Cijk_Alik_Bjlk_HHS_BH_Bias_AS_SAV_UserArgs_MT256x128x32_MI16x16x1_SN_LDSB1_CLR0_GSU0_GSUC0_GSUWGMRR0_K1_LBSPPA512_LBSPPB512_LPB0_MIWT8_4_PLR0_SU0_SUM0_SUS0_VWA8_VWB4_WGM1_WGMXCC1_WGMXCCGn1
    SolutionIndex: 27
    SolutionNameMin: Cijk_Alik_Bjlk_HHS_BH_Bias_AS_SAV_UserArgs_MT256x128x32_MI16x16x1_SN_LDSB1_CLR0_GSU0_GSUC0_GSUWGMRR0_K1_LBSPPA512_LBSPPB2048_LPB0_MIWT8_4_PLR0_SU0_SUM0_SUS0_VWA8_VWB4_WGM1_WGMXCC1_WGMXCCGn1
    SolutionIndex: 28
    SolutionNameMin: Cijk_Alik_Bjlk_HHS_BH_Bias_AS_SAV_UserArgs_MT256x128x32_MI16x16x1_SN_LDSB1_CLR0_GSU0_GSUC0_GSUWGMRR0_K1_LBSPPA512_LBSPPB512_LPB0_MIWT8_4_PLR0_SU0_SUM0_SUS0_VWA8_VWB4_WGM8_WGMXCC1_WGMXCCGn1
    SolutionIndex: 29
    SolutionNameMin: Cijk_Alik_Bjlk_HHS_BH_Bias_AS_SAV_UserArgs_MT256x128x32_MI16x16x1_SN_LDSB1_CLR0_GSU0_GSUC0_GSUWGMRR0_K1_LBSPPA512_LBSPPB2048_LPB0_MIWT8_4_PLR0_SU0_SUM0_SUS0_VWA8_VWB4_WGM8_WGMXCC1_WGMXCCGn1
    SolutionIndex: 30
    SolutionNameMin: Cijk_Alik_Bjlk_HHS_BH_Bias_AS_SAV_UserArgs_MT64x128x32_MI16x16x1_SN_LDSB0_CLR0_GSU0_GSUC0_GSUWGMRR0_K1_LBSPPA128_LBSPPB1024_LPB0_MIWT2_4_PLR0_SU0_SUM0_SUS0_VWA2_VWB4_WGM1_WGMXCC1_WGMXCCGn1
    SolutionIndex: 31
    SolutionNameMin: Cijk_Alik_Bjlk_HHS_BH_Bias_AS_SAV_UserArgs_MT64x128x32_MI16x16x1_SN_LDSB0_CLR0_GSU0_GSUC0_GSUWGMRR0_K1_LBSPPA128_LBSPPB2048_LPB0_MIWT2_4_PLR0_SU0_SUM0_SUS0_VWA2_VWB4_WGM8_WGMXCC1_WGMXCCGn1
    SolutionIndex: 32
    SolutionNameMin: Cijk_Alik_Bjlk_HHS_BH_Bias_AS_SAV_UserArgs_MT64x64x32_MI16x16x1_SN_LDSB0_CLR0_GSU0_GSUC0_GSUWGMRR0_K1_LBSPPA128_LBSPPB512_LPB32_MIWT2_2_PLR0_SU0_SUM0_SUS0_VWA2_VWB2_WGM1_WGMXCC1_WGMXCCGn1
    SolutionIndex: 33
    SolutionNameMin: Cijk_Alik_Bjlk_HHS_BH_Bias_AS_SAV_UserArgs_MT64x64x32_MI16x16x1_SN_LDSB0_CLR0_GSU0_GSUC0_GSUWGMRR0_K1_LBSPPA128_LBSPPB1024_LPB32_MIWT2_2_PLR0_SU0_SUM0_SUS0_VWA2_VWB2_WGM1_WGMXCC1_WGMXCCGn1
    SolutionIndex: 34
    SolutionNameMin: Cijk_Alik_Bjlk_HHS_BH_Bias_AS_SAV_UserArgs_MT64x64x32_MI16x16x1_SN_LDSB0_CLR0_GSU0_GSUC0_GSUWGMRR0_K1_LBSPPA128_LBSPPB1024_LPB32_MIWT2_2_PLR0_SU0_SUM0_SUS0_VWA2_VWB2_WGM8_WGMXCC1_WGMXCCGn1
    SolutionIndex: 35
    SolutionNameMin: Cijk_Alik_Bjlk_HHS_BH_Bias_AS_SAV_UserArgs_MT32x64x32_MI16x16x1_SN_LDSB0_CLR0_GSU0_GSUC0_GSUWGMRR0_K1_LBSPPA128_LBSPPB256_LPB32_MIWT1_2_PLR0_SU0_SUM0_SUS0_VWA1_VWB2_WGM1_WGMXCC1_WGMXCCGn1
    SolutionIndex: 36
    SolutionNameMin: Cijk_Alik_Bjlk_HHS_BH_Bias_AS_SAV_UserArgs_MT32x32x32_MI16x16x1_SN_LDSB0_CLR0_GSU0_GSUC0_GSUWGMRR0_K1_LBSPPA128_LBSPPB128_LPB16_MIWT1_1_PLR0_SU0_SUM0_SUS0_VWA1_VWB1_WGM1_WGMXCC1_WGMXCCGn1
    SolutionIndex: 37
    SolutionNameMin: Cijk_Alik_Bjlk_HHS_BH_Bias_AS_SAV_UserArgs_MT32x32x32_MI16x16x1_SN_LDSB0_CLR0_GSU0_GSUC0_GSUWGMRR0_K1_LBSPPA128_LBSPPB256_LPB16_MIWT1_1_PLR0_SU0_SUM0_SUS0_VWA1_VWB1_WGM1_WGMXCC1_WGMXCCGn1
    SolutionIndex: 38
    SolutionNameMin: Cijk_Alik_Bjlk_HHS_BH_Bias_AS_SAV_UserArgs_MT32x32x32_MI16x16x1_SN_LDSB0_CLR0_GSU0_GSUC0_GSUWGMRR0_K1_LBSPPA128_LBSPPB512_LPB16_MIWT1_1_PLR0_SU0_SUM0_SUS0_VWA1_VWB1_WGM1_WGMXCC1_WGMXCCGn1
    SolutionIndex: 39
    SolutionNameMin: Cijk_Alik_Bjlk_HHS_BH_Bias_AS_SAV_UserArgs_MT256x256x32_MI32x32x1_SN_LDSB0_CLR1_GSU0_GSUC0_GSUWGMRR0_K1_LBSPPA256_LBSPPB0_LPB0_MIWT4_4_PLR1_SU0_SUM0_SUS0_VWA4_VWB4_WGM8_WGMXCC1_WGMXCCGn1
    SolutionIndex: 40
    SolutionNameMin: Cijk_Alik_Bjlk_HHS_BH_Bias_AS_SAV_UserArgs_MT64x128x32_MI32x32x1_SN_LDSB0_CLR1_GSU0_GSUC0_GSUWGMRR0_K1_LBSPPA128_LBSPPB0_LPB0_MIWT1_2_PLR1_SU0_SUM0_SUS0_VWA1_VWB2_WGM1_WGMXCC1_WGMXCCGn1
    SolutionIndex: 41
    SolutionNameMin: Cijk_Alik_Bjlk_HHS_BH_Bias_AS_SAV_UserArgs_MT64x128x32_MI32x32x1_SN_LDSB0_CLR1_GSU0_GSUC0_GSUWGMRR0_K1_LBSPPA128_LBSPPB0_LPB0_MIWT1_2_PLR1_SU0_SUM0_SUS0_VWA1_VWB2_WGM1_WGMXCC1_WGMXCCGn1
    SolutionIndex: 42
    SolutionNameMin: Cijk_Alik_Bjlk_HHS_BH_Bias_AS_SAV_UserArgs_MT256x256x64_MI16x16x1_SN_LDSB1_CLR1_GSU0_GSUC0_GSUWGMRR0_K1_LBSPPA1024_LBSPPB4096_LPB0_MIWT8_8_PLR1_SU0_SUM0_SUS0_VWA8_VWB8_WGM1_WGMXCC1_WGMXCCGn1
    SolutionIndex: 43
    SolutionNameMin: Cijk_Alik_Bjlk_HHS_BH_Bias_AS_SAV_UserArgs_MT256x256x64_MI16x16x1_SN_LDSB1_CLR1_GSU0_GSUC0_GSUWGMRR0_K1_LBSPPA1024_LBSPPB2048_LPB0_MIWT8_8_PLR1_SU0_SUM0_SUS0_VWA8_VWB8_WGM6_WGMXCC1_WGMXCCGn1
    SolutionIndex: 44
    SolutionNameMin: Cijk_Alik_Bjlk_HHS_BH_Bias_AS_SAV_UserArgs_MT256x256x64_MI16x16x1_SN_LDSB1_CLR1_GSU0_GSUC0_GSUWGMRR0_K1_LBSPPA1024_LBSPPB4096_LPB0_MIWT8_8_PLR1_SU0_SUM0_SUS0_VWA8_VWB8_WGM6_WGMXCC1_WGMXCCGn1
    SolutionIndex: 45
    SolutionNameMin: Cijk_Alik_Bjlk_HHS_BH_Bias_AS_SAV_UserArgs_MT256x256x64_MI16x16x1_SN_LDSB1_CLR1_GSU0_GSUC0_GSUWGMRR0_K1_LBSPPA1024_LBSPPB2048_LPB0_MIWT8_8_PLR1_SU0_SUM0_SUS0_VWA8_VWB8_WGM8_WGMXCC1_WGMXCCGn1
    SolutionIndex: 46
    SolutionNameMin: Cijk_Alik_Bjlk_HHS_BH_Bias_AS_SAV_UserArgs_MT256x256x64_MI16x16x1_SN_LDSB1_CLR1_GSU0_GSUC0_GSUWGMRR0_K1_LBSPPA1024_LBSPPB4096_LPB0_MIWT8_8_PLR1_SU0_SUM0_SUS0_VWA8_VWB8_WGM8_WGMXCC1_WGMXCCGn1
    SolutionIndex: 47
    SolutionNameMin: Cijk_Alik_Bjlk_HHS_BH_Bias_AS_SAV_UserArgs_MT256x256x64_MI16x16x1_SN_LDSB1_CLR1_GSU0_GSUC0_GSUWGMRR0_K1_LBSPPA1024_LBSPPB4096_LPB0_MIWT8_8_PLR1_SU0_SUM0_SUS0_VWA8_VWB8_WGM8_WGMXCC1_WGMXCCGn1
    SolutionIndex: 48
    SolutionNameMin: Cijk_Alik_Bjlk_HHS_BH_Bias_AS_SAV_UserArgs_MT128x256x64_MI16x16x1_SN_LDSB1_CLR1_GSU0_GSUC0_GSUWGMRR0_K1_LBSPPA512_LBSPPB4096_LPB0_MIWT4_8_PLR1_SU0_SUM0_SUS0_VWA4_VWB8_WGM1_WGMXCC1_WGMXCCGn1
    SolutionIndex: 49
    SolutionNameMin: Cijk_Alik_Bjlk_HHS_BH_Bias_AS_SAV_UserArgs_MT128x256x64_MI16x16x1_SN_LDSB1_CLR1_GSU0_GSUC0_GSUWGMRR0_K1_LBSPPA512_LBSPPB2048_LPB0_MIWT4_8_PLR1_SU0_SUM0_SUS0_VWA4_VWB8_WGM6_WGMXCC1_WGMXCCGn1
    SolutionIndex: 50
    SolutionNameMin: Cijk_Alik_Bjlk_HHS_BH_Bias_AS_SAV_UserArgs_MT128x256x64_MI16x16x1_SN_LDSB1_CLR1_GSU0_GSUC0_GSUWGMRR0_K1_LBSPPA512_LBSPPB2048_LPB0_MIWT4_8_PLR1_SU0_SUM0_SUS0_VWA4_VWB8_WGM8_WGMXCC1_WGMXCCGn1
    SolutionIndex: 51
    SolutionNameMin: Cijk_Alik_Bjlk_HHS_BH_Bias_AS_SAV_UserArgs_MT128x256x64_MI16x16x1_SN_LDSB1_CLR1_GSU0_GSUC0_GSUWGMRR0_K1_LBSPPA512_LBSPPB4096_LPB0_MIWT4_8_PLR1_SU0_SUM0_SUS0_VWA4_VWB8_WGM8_WGMXCC1_WGMXCCGn1
    SolutionIndex: 52
    SolutionNameMin: Cijk_Alik_Bjlk_HHS_BH_Bias_AS_SAV_UserArgs_MT256x128x64_MI16x16x1_SN_LDSB1_CLR1_GSU0_GSUC0_GSUWGMRR0_K1_LBSPPA1024_LBSPPB1024_LPB0_MIWT8_4_PLR1_SU0_SUM0_SUS0_VWA8_VWB4_WGM1_WGMXCC1_WGMXCCGn1
    SolutionIndex: 53
    SolutionNameMin: Cijk_Alik_Bjlk_HHS_BH_Bias_AS_SAV_UserArgs_MT128x128x64_MI16x16x1_SN_LDSB1_CLR1_GSU0_GSUC0_GSUWGMRR0_K1_LBSPPA512_LBSPPB512_LPB0_MIWT4_4_PLR1_SU0_SUM0_SUS0_VWA4_VWB4_WGM1_WGMXCC1_WGMXCCGn1
    SolutionIndex: 54
    SolutionNameMin: Cijk_Alik_Bjlk_HHS_BH_Bias_AS_SAV_UserArgs_MT128x128x64_MI16x16x1_SN_LDSB1_CLR1_GSU0_GSUC0_GSUWGMRR0_K1_LBSPPA512_LBSPPB512_LPB0_MIWT4_4_PLR1_SU0_SUM0_SUS0_VWA4_VWB4_WGM6_WGMXCC1_WGMXCCGn1
    SolutionIndex: 55
    SolutionNameMin: Cijk_Alik_Bjlk_HHS_BH_Bias_AS_SAV_UserArgs_MT128x128x64_MI16x16x1_SN_LDSB1_CLR1_GSU0_GSUC0_GSUWGMRR0_K1_LBSPPA512_LBSPPB1024_LPB0_MIWT4_4_PLR1_SU0_SUM0_SUS0_VWA4_VWB4_WGM6_WGMXCC1_WGMXCCGn1
    SolutionIndex: 56
    SolutionNameMin: Cijk_Alik_Bjlk_HHS_BH_Bias_AS_SAV_UserArgs_MT128x128x64_MI16x16x1_SN_LDSB1_CLR1_GSU0_GSUC0_GSUWGMRR0_K1_LBSPPA512_LBSPPB2048_LPB0_MIWT4_4_PLR1_SU0_SUM0_SUS0_VWA4_VWB4_WGM6_WGMXCC1_WGMXCCGn1
    SolutionIndex: 57
    SolutionNameMin: Cijk_Alik_Bjlk_HHS_BH_Bias_AS_SAV_UserArgs_MT128x128x64_MI16x16x1_SN_LDSB1_CLR1_GSU0_GSUC0_GSUWGMRR0_K1_LBSPPA512_LBSPPB512_LPB0_MIWT4_4_PLR1_SU0_SUM0_SUS0_VWA4_VWB4_WGM8_WGMXCC1_WGMXCCGn1
    SolutionIndex: 58
    SolutionNameMin: Cijk_Alik_Bjlk_HHS_BH_Bias_AS_SAV_UserArgs_MT64x128x64_MI16x16x1_SN_LDSB1_CLR1_GSU0_GSUC0_GSUWGMRR0_K1_LBSPPA256_LBSPPB1024_LPB0_MIWT2_4_PLR1_SU0_SUM0_SUS0_VWA2_VWB4_WGM8_WGMXCC1_WGMXCCGn1
    SolutionIndex: 59
    SolutionNameMin: Cijk_Alik_Bjlk_HHS_BH_Bias_AS_SAV_UserArgs_MT128x64x64_MI16x16x1_SN_LDSB1_CLR1_GSU0_GSUC0_GSUWGMRR0_K1_LBSPPA512_LBSPPB512_LPB32_MIWT4_2_PLR1_SU0_SUM0_SUS0_VWA4_VWB2_WGM1_WGMXCC1_WGMXCCGn1
    SolutionIndex: 60
    SolutionNameMin: Cijk_Alik_Bjlk_HHS_BH_Bias_AS_SAV_UserArgs_MT128x64x64_MI16x16x1_SN_LDSB1_CLR1_GSU0_GSUC0_GSUWGMRR0_K1_LBSPPA512_LBSPPB1024_LPB32_MIWT4_2_PLR1_SU0_SUM0_SUS0_VWA4_VWB2_WGM1_WGMXCC1_WGMXCCGn1
    SolutionIndex: 61
    SolutionNameMin: Cijk_Alik_Bjlk_HHS_BH_Bias_AS_SAV_UserArgs_MT128x64x64_MI16x16x1_SN_LDSB1_CLR1_GSU0_GSUC0_GSUWGMRR0_K1_LBSPPA512_LBSPPB512_LPB32_MIWT4_2_PLR1_SU0_SUM0_SUS0_VWA4_VWB2_WGM8_WGMXCC1_WGMXCCGn1
    SolutionIndex: 62
    SolutionNameMin: Cijk_Alik_Bjlk_HHS_BH_Bias_AS_SAV_UserArgs_MT64x64x64_MI16x16x1_SN_LDSB1_CLR1_GSU0_GSUC0_GSUWGMRR0_K1_LBSPPA256_LBSPPB256_LPB32_MIWT2_2_PLR1_SU0_SUM0_SUS0_VWA2_VWB2_WGM1_WGMXCC1_WGMXCCGn1
    SolutionIndex: 63
    SolutionNameMin: Cijk_Alik_Bjlk_HHS_BH_Bias_AS_SAV_UserArgs_MT64x64x64_MI16x16x1_SN_LDSB1_CLR1_GSU0_GSUC0_GSUWGMRR0_K1_LBSPPA256_LBSPPB256_LPB32_MIWT2_2_PLR1_SU0_SUM0_SUS0_VWA2_VWB2_WGM1_WGMXCC1_WGMXCCGn1
    SolutionIndex: 64
    SolutionNameMin: Cijk_Alik_Bjlk_HHS_BH_Bias_AS_SAV_UserArgs_MT64x64x64_MI16x16x1_SN_LDSB1_CLR1_GSU0_GSUC0_GSUWGMRR0_K1_LBSPPA256_LBSPPB512_LPB32_MIWT2_2_PLR1_SU0_SUM0_SUS0_VWA2_VWB2_WGM1_WGMXCC1_WGMXCCGn1
    SolutionIndex: 65
    SolutionNameMin: Cijk_Alik_Bjlk_HHS_BH_Bias_AS_SAV_UserArgs_MT64x64x64_MI16x16x1_SN_LDSB1_CLR1_GSU0_GSUC0_GSUWGMRR0_K1_LBSPPA256_LBSPPB1024_LPB32_MIWT2_2_PLR1_SU0_SUM0_SUS0_VWA2_VWB2_WGM1_WGMXCC1_WGMXCCGn1
    SolutionIndex: 66
    SolutionNameMin: Cijk_Alik_Bjlk_HHS_BH_Bias_AS_SAV_UserArgs_MT64x64x64_MI16x16x1_SN_LDSB1_CLR1_GSU0_GSUC0_GSUWGMRR0_K1_LBSPPA256_LBSPPB1024_LPB32_MIWT2_2_PLR1_SU0_SUM0_SUS0_VWA2_VWB2_WGM1_WGMXCC1_WGMXCCGn1
    SolutionIndex: 67
    SolutionNameMin: Cijk_Alik_Bjlk_HHS_BH_Bias_AS_SAV_UserArgs_MT32x32x64_MI16x16x1_SN_LDSB0_CLR1_GSU0_GSUC0_GSUWGMRR0_K1_LBSPPA128_LBSPPB128_LPB16_MIWT1_1_PLR1_SU0_SUM0_SUS0_VWA1_VWB1_WGM1_WGMXCC1_WGMXCCGn1
    SolutionIndex: 68
    SolutionNameMin: Cijk_Alik_Bjlk_HHS_BH_Bias_AS_SAV_UserArgs_MT32x32x64_MI16x16x1_SN_LDSB0_CLR1_GSU0_GSUC0_GSUWGMRR0_K1_LBSPPA128_LBSPPB256_LPB16_MIWT1_1_PLR1_SU0_SUM0_SUS0_VWA1_VWB1_WGM1_WGMXCC1_WGMXCCGn1
    SolutionIndex: 69
    SolutionNameMin: Cijk_Alik_Bjlk_HHS_BH_Bias_AS_SAV_UserArgs_MT32x32x64_MI16x16x1_SN_LDSB0_CLR1_GSU0_GSUC0_GSUWGMRR0_K1_LBSPPA128_LBSPPB512_LPB16_MIWT1_1_PLR1_SU0_SUM0_SUS0_VWA1_VWB1_WGM1_WGMXCC1_WGMXCCGn1
    SolutionIndex: 70
    SolutionNameMin: Cijk_Alik_Bjlk_HHS_BH_Bias_AS_SAV_UserArgs_MT32x32x64_MI16x16x1_SN_LDSB0_CLR1_GSU0_GSUC0_GSUWGMRR0_K1_LBSPPA128_LBSPPB512_LPB16_MIWT1_1_PLR1_SU0_SUM0_SUS0_VWA1_VWB1_WGM1_WGMXCC1_WGMXCCGn1
    SolutionIndex: 71
    SolutionNameMin: Cijk_Alik_Bjlk_HHS_BH_Bias_AS_SAV_UserArgs_MT256x256x64_MI32x32x1_SN_LDSB1_CLR1_GSU0_GSUC0_GSUWGMRR0_K1_LBSPPA512_LBSPPB0_LPB0_MIWT4_4_PLR1_SU0_SUM0_SUS0_VWA4_VWB4_WGM6_WGMXCC1_WGMXCCGn1
    SolutionIndex: 72
    SolutionNameMin: Cijk_Alik_Bjlk_HHS_BH_Bias_AS_SAV_UserArgs_MT128x256x64_MI32x32x1_SN_LDSB1_CLR1_GSU0_GSUC0_GSUWGMRR0_K1_LBSPPA256_LBSPPB0_LPB0_MIWT2_4_PLR1_SU0_SUM0_SUS0_VWA2_VWB4_WGM1_WGMXCC1_WGMXCCGn1
    SolutionIndex: 73
    SolutionNameMin: Cijk_Alik_Bjlk_HHS_BH_Bias_AS_SAV_UserArgs_MT128x256x64_MI32x32x1_SN_LDSB1_CLR1_GSU0_GSUC0_GSUWGMRR0_K1_LBSPPA256_LBSPPB0_LPB0_MIWT2_4_PLR1_SU0_SUM0_SUS0_VWA2_VWB4_WGM6_WGMXCC1_WGMXCCGn1
    SolutionIndex: 74
    SolutionNameMin: Cijk_Alik_Bjlk_HHS_BH_Bias_AS_SAV_UserArgs_MT128x256x64_MI32x32x1_SN_LDSB1_CLR1_GSU0_GSUC0_GSUWGMRR0_K1_LBSPPA256_LBSPPB0_LPB0_MIWT2_4_PLR1_SU0_SUM0_SUS0_VWA2_VWB4_WGM6_WGMXCC1_WGMXCCGn1
    SolutionIndex: 75
    SolutionNameMin: Cijk_Alik_Bjlk_HHS_BH_Bias_AS_SAV_UserArgs_MT128x256x64_MI32x32x1_SN_LDSB1_CLR1_GSU0_GSUC0_GSUWGMRR0_K1_LBSPPA256_LBSPPB0_LPB0_MIWT2_4_PLR1_SU0_SUM0_SUS0_VWA2_VWB4_WGM8_WGMXCC1_WGMXCCGn1
    SolutionIndex: 76
    SolutionNameMin: Cijk_Alik_Bjlk_HHS_BH_Bias_AS_SAV_UserArgs_MT128x256x64_MI32x32x1_SN_LDSB1_CLR1_GSU0_GSUC0_GSUWGMRR0_K1_LBSPPA256_LBSPPB0_LPB0_MIWT2_4_PLR1_SU0_SUM0_SUS0_VWA2_VWB4_WGM8_WGMXCC1_WGMXCCGn1
    SolutionIndex: 77
    SolutionNameMin: Cijk_Alik_Bjlk_HHS_BH_Bias_AS_SAV_UserArgs_MT128x128x64_MI32x32x1_SN_LDSB1_CLR1_GSU0_GSUC0_GSUWGMRR0_K1_LBSPPA256_LBSPPB0_LPB0_MIWT2_2_PLR1_SU0_SUM0_SUS0_VWA2_VWB2_WGM1_WGMXCC1_WGMXCCGn1
    SolutionIndex: 78
    SolutionNameMin: Cijk_Alik_Bjlk_HHS_BH_Bias_AS_SAV_UserArgs_MT128x128x64_MI32x32x1_SN_LDSB1_CLR1_GSU0_GSUC0_GSUWGMRR0_K1_LBSPPA256_LBSPPB0_LPB0_MIWT2_2_PLR1_SU0_SUM0_SUS0_VWA2_VWB2_WGM1_WGMXCC1_WGMXCCGn1
    SolutionIndex: 79
    SolutionNameMin: Cijk_Alik_Bjlk_HHS_BH_Bias_AS_SAV_UserArgs_MT128x128x64_MI32x32x1_SN_LDSB1_CLR1_GSU0_GSUC0_GSUWGMRR0_K1_LBSPPA256_LBSPPB0_LPB0_MIWT2_2_PLR1_SU0_SUM0_SUS0_VWA2_VWB2_WGM6_WGMXCC1_WGMXCCGn1
    SolutionIndex: 80
    SolutionNameMin: Cijk_Alik_Bjlk_HHS_BH_Bias_AS_SAV_UserArgs_MT128x128x64_MI32x32x1_SN_LDSB1_CLR1_GSU0_GSUC0_GSUWGMRR0_K1_LBSPPA256_LBSPPB0_LPB0_MIWT2_2_PLR1_SU0_SUM0_SUS0_VWA2_VWB2_WGM6_WGMXCC1_WGMXCCGn1
    SolutionIndex: 81
    SolutionNameMin: Cijk_Alik_Bjlk_HHS_BH_Bias_AS_SAV_UserArgs_MT128x128x64_MI32x32x1_SN_LDSB1_CLR1_GSU0_GSUC0_GSUWGMRR0_K1_LBSPPA256_LBSPPB0_LPB0_MIWT2_2_PLR1_SU0_SUM0_SUS0_VWA2_VWB2_WGM8_WGMXCC1_WGMXCCGn1
    SolutionIndex: 82
    SolutionNameMin: Cijk_Alik_Bjlk_HHS_BH_Bias_AS_SAV_UserArgs_MT128x128x64_MI32x32x1_SN_LDSB1_CLR1_GSU0_GSUC0_GSUWGMRR0_K1_LBSPPA256_LBSPPB0_LPB0_MIWT2_2_PLR1_SU0_SUM0_SUS0_VWA2_VWB2_WGM8_WGMXCC1_WGMXCCGn1
    SolutionIndex: 83
    SolutionNameMin: Cijk_Alik_Bjlk_HHS_BH_Bias_AS_SAV_UserArgs_MT128x64x64_MI32x32x1_SN_LDSB1_CLR1_GSU0_GSUC0_GSUWGMRR0_K1_LBSPPA256_LBSPPB0_LPB0_MIWT2_1_PLR1_SU0_SUM0_SUS0_VWA2_VWB1_WGM1_WGMXCC1_WGMXCCGn1
    SolutionIndex: 84
    SolutionNameMin: Cijk_Alik_Bjlk_HHS_BH_Bias_AS_SAV_UserArgs_MT128x64x64_MI32x32x1_SN_LDSB1_CLR1_GSU0_GSUC0_GSUWGMRR0_K1_LBSPPA256_LBSPPB0_LPB0_MIWT2_1_PLR1_SU0_SUM0_SUS0_VWA2_VWB1_WGM1_WGMXCC1_WGMXCCGn1
    SolutionIndex: 85
    SolutionNameMin: Cijk_Alik_Bjlk_HHS_BH_Bias_AS_SAV_UserArgs_MT128x64x64_MI32x32x1_SN_LDSB1_CLR1_GSU0_GSUC0_GSUWGMRR0_K1_LBSPPA256_LBSPPB0_LPB0_MIWT2_1_PLR1_SU0_SUM0_SUS0_VWA2_VWB1_WGM6_WGMXCC1_WGMXCCGn1
    SolutionIndex: 86
    SolutionNameMin: Cijk_Alik_Bjlk_HHS_BH_Bias_AS_SAV_UserArgs_MT128x128x128_MI16x16x1_SN_LDSB1_CLR1_GSU0_GSUC0_GSUWGMRR0_K1_LBSPPA1024_LBSPPB1024_LPB0_MIWT4_4_PLR1_SU0_SUM0_SUS0_VWA4_VWB4_WGM1_WGMXCC1_WGMXCCGn1
    SolutionIndex: 87
    SolutionNameMin: Cijk_Alik_Bjlk_HHS_BH_Bias_AS_SAV_UserArgs_MT128x128x128_MI16x16x1_SN_LDSB1_CLR1_GSU0_GSUC0_GSUWGMRR0_K1_LBSPPA1024_LBSPPB512_LPB0_MIWT4_4_PLR1_SU0_SUM0_SUS0_VWA4_VWB4_WGM6_WGMXCC1_WGMXCCGn1
    SolutionIndex: 88
    SolutionNameMin: Cijk_Alik_Bjlk_HHS_BH_Bias_AS_SAV_UserArgs_MT128x128x128_MI16x16x1_SN_LDSB1_CLR1_GSU0_GSUC0_GSUWGMRR0_K1_LBSPPA1024_LBSPPB1024_LPB0_MIWT4_4_PLR1_SU0_SUM0_SUS0_VWA4_VWB4_WGM6_WGMXCC1_WGMXCCGn1
    SolutionIndex: 89
    SolutionNameMin: Cijk_Alik_Bjlk_HHS_BH_Bias_AS_SAV_UserArgs_MT128x128x128_MI16x16x1_SN_LDSB1_CLR1_GSU0_GSUC0_GSUWGMRR0_K1_LBSPPA1024_LBSPPB2048_LPB0_MIWT4_4_PLR1_SU0_SUM0_SUS0_VWA4_VWB4_WGM6_WGMXCC1_WGMXCCGn1
    SolutionIndex: 90
    SolutionNameMin: Cijk_Alik_Bjlk_HHS_BH_Bias_AS_SAV_UserArgs_MT128x128x128_MI16x16x1_SN_LDSB1_CLR1_GSU0_GSUC0_GSUWGMRR0_K1_LBSPPA1024_LBSPPB2048_LPB0_MIWT4_4_PLR1_SU0_SUM0_SUS0_VWA4_VWB4_WGM6_WGMXCC1_WGMXCCGn1
    SolutionIndex: 91
    SolutionNameMin: Cijk_Alik_Bjlk_HHS_BH_Bias_AS_SAV_UserArgs_MT128x128x128_MI16x16x1_SN_LDSB1_CLR1_GSU0_GSUC0_GSUWGMRR0_K1_LBSPPA1024_LBSPPB1024_LPB0_MIWT4_4_PLR1_SU0_SUM0_SUS0_VWA4_VWB4_WGM8_WGMXCC1_WGMXCCGn1
    SolutionIndex: 92
    SolutionNameMin: Cijk_Alik_Bjlk_HHS_BH_Bias_AS_SAV_UserArgs_MT128x128x128_MI16x16x1_SN_LDSB1_CLR1_GSU0_GSUC0_GSUWGMRR0_K1_LBSPPA1024_LBSPPB2048_LPB0_MIWT4_4_PLR1_SU0_SUM0_SUS0_VWA4_VWB4_WGM8_WGMXCC1_WGMXCCGn1
    SolutionIndex: 93
    SolutionNameMin: Cijk_Alik_Bjlk_HHS_BH_Bias_AS_SAV_UserArgs_MT128x128x128_MI16x16x1_SN_LDSB1_CLR1_GSU0_GSUC0_GSUWGMRR0_K1_LBSPPA1024_LBSPPB2048_LPB0_MIWT4_4_PLR1_SU0_SUM0_SUS0_VWA4_VWB4_WGM8_WGMXCC1_WGMXCCGn1
    SolutionIndex: 94
    SolutionNameMin: Cijk_Alik_Bjlk_HHS_BH_Bias_AS_SAV_UserArgs_MT64x128x128_MI16x16x1_SN_LDSB1_CLR1_GSU0_GSUC0_GSUWGMRR0_K1_LBSPPA512_LBSPPB512_LPB0_MIWT2_4_PLR1_SU0_SUM0_SUS0_VWA2_VWB4_WGM1_WGMXCC1_WGMXCCGn1
    SolutionIndex: 95
    SolutionNameMin: Cijk_Alik_Bjlk_HHS_BH_Bias_AS_SAV_UserArgs_MT64x128x128_MI16x16x1_SN_LDSB1_CLR1_GSU0_GSUC0_GSUWGMRR0_K1_LBSPPA512_LBSPPB512_LPB0_MIWT2_4_PLR1_SU0_SUM0_SUS0_VWA2_VWB4_WGM1_WGMXCC1_WGMXCCGn1
    SolutionIndex: 96
    SolutionNameMin: Cijk_Alik_Bjlk_HHS_BH_Bias_AS_SAV_UserArgs_MT64x128x128_MI16x16x1_SN_LDSB1_CLR1_GSU0_GSUC0_GSUWGMRR0_K1_LBSPPA512_LBSPPB1024_LPB0_MIWT2_4_PLR1_SU0_SUM0_SUS0_VWA2_VWB4_WGM1_WGMXCC1_WGMXCCGn1
    SolutionIndex: 97
    SolutionNameMin: Cijk_Alik_Bjlk_HHS_BH_Bias_AS_SAV_UserArgs_MT64x128x128_MI16x16x1_SN_LDSB1_CLR1_GSU0_GSUC0_GSUWGMRR0_K1_LBSPPA512_LBSPPB2048_LPB0_MIWT2_4_PLR1_SU0_SUM0_SUS0_VWA2_VWB4_WGM1_WGMXCC1_WGMXCCGn1
    SolutionIndex: 98
    SolutionNameMin: Cijk_Alik_Bjlk_HHS_BH_Bias_AS_SAV_UserArgs_MT64x128x128_MI16x16x1_SN_LDSB1_CLR1_GSU0_GSUC0_GSUWGMRR0_K1_LBSPPA512_LBSPPB2048_LPB0_MIWT2_4_PLR1_SU0_SUM0_SUS0_VWA2_VWB4_WGM1_WGMXCC1_WGMXCCGn1
    SolutionIndex: 99
    SolutionNameMin: Cijk_Alik_Bjlk_HHS_BH_Bias_AS_SAV_UserArgs_MT64x128x128_MI16x16x1_SN_LDSB1_CLR1_GSU0_GSUC0_GSUWGMRR0_K1_LBSPPA512_LBSPPB512_LPB0_MIWT2_4_PLR1_SU0_SUM0_SUS0_VWA2_VWB4_WGM6_WGMXCC1_WGMXCCGn1
    SolutionIndex: 100
    SolutionNameMin: Cijk_Alik_Bjlk_HHS_BH_Bias_AS_SAV_UserArgs_MT64x128x128_MI16x16x1_SN_LDSB1_CLR1_GSU0_GSUC0_GSUWGMRR0_K1_LBSPPA512_LBSPPB512_LPB0_MIWT2_4_PLR1_SU0_SUM0_SUS0_VWA2_VWB4_WGM6_WGMXCC1_WGMXCCGn1
    SolutionIndex: 101
    SolutionNameMin: Cijk_Alik_Bjlk_HHS_BH_Bias_AS_SAV_UserArgs_MT64x128x128_MI16x16x1_SN_LDSB1_CLR1_GSU0_GSUC0_GSUWGMRR0_K1_LBSPPA512_LBSPPB512_LPB0_MIWT2_4_PLR1_SU0_SUM0_SUS0_VWA2_VWB4_WGM6_WGMXCC1_WGMXCCGn1
    SolutionIndex: 102
    SolutionNameMin: Cijk_Alik_Bjlk_HHS_BH_Bias_AS_SAV_UserArgs_MT64x128x128_MI16x16x1_SN_LDSB1_CLR1_GSU0_GSUC0_GSUWGMRR0_K1_LBSPPA512_LBSPPB1024_LPB0_MIWT2_4_PLR1_SU0_SUM0_SUS0_VWA2_VWB4_WGM6_WGMXCC1_WGMXCCGn1
    SolutionIndex: 103
    SolutionNameMin: Cijk_Alik_Bjlk_HHS_BH_Bias_AS_SAV_UserArgs_MT64x128x128_MI16x16x1_SN_LDSB1_CLR1_GSU0_GSUC0_GSUWGMRR0_K1_LBSPPA512_LBSPPB1024_LPB0_MIWT2_4_PLR1_SU0_SUM0_SUS0_VWA2_VWB4_WGM6_WGMXCC1_WGMXCCGn1
    SolutionIndex: 104
    SolutionNameMin: Cijk_Alik_Bjlk_HHS_BH_Bias_AS_SAV_UserArgs_MT64x128x128_MI16x16x1_SN_LDSB1_CLR1_GSU0_GSUC0_GSUWGMRR0_K1_LBSPPA512_LBSPPB2048_LPB0_MIWT2_4_PLR1_SU0_SUM0_SUS0_VWA2_VWB4_WGM6_WGMXCC1_WGMXCCGn1
    SolutionIndex: 105
    SolutionNameMin: Cijk_Alik_Bjlk_HHS_BH_Bias_AS_SAV_UserArgs_MT64x128x128_MI16x16x1_SN_LDSB1_CLR1_GSU0_GSUC0_GSUWGMRR0_K1_LBSPPA512_LBSPPB512_LPB0_MIWT2_4_PLR1_SU0_SUM0_SUS0_VWA2_VWB4_WGM8_WGMXCC1_WGMXCCGn1
    SolutionIndex: 106
    SolutionNameMin: Cijk_Alik_Bjlk_HHS_BH_Bias_AS_SAV_UserArgs_MT64x128x128_MI16x16x1_SN_LDSB1_CLR1_GSU0_GSUC0_GSUWGMRR0_K1_LBSPPA512_LBSPPB512_LPB0_MIWT2_4_PLR1_SU0_SUM0_SUS0_VWA2_VWB4_WGM8_WGMXCC1_WGMXCCGn1
    SolutionIndex: 107
    SolutionNameMin: Cijk_Alik_Bjlk_HHS_BH_Bias_AS_SAV_UserArgs_MT64x128x128_MI16x16x1_SN_LDSB1_CLR1_GSU0_GSUC0_GSUWGMRR0_K1_LBSPPA512_LBSPPB1024_LPB0_MIWT2_4_PLR1_SU0_SUM0_SUS0_VWA2_VWB4_WGM8_WGMXCC1_WGMXCCGn1
    SolutionIndex: 108
    SolutionNameMin: Cijk_Alik_Bjlk_HHS_BH_Bias_AS_SAV_UserArgs_MT64x128x128_MI16x16x1_SN_LDSB1_CLR1_GSU0_GSUC0_GSUWGMRR0_K1_LBSPPA512_LBSPPB2048_LPB0_MIWT2_4_PLR1_SU0_SUM0_SUS0_VWA2_VWB4_WGM8_WGMXCC1_WGMXCCGn1
    SolutionIndex: 109
    SolutionNameMin: Cijk_Alik_Bjlk_HHS_BH_Bias_AS_SAV_UserArgs_MT128x64x128_MI16x16x1_SN_LDSB1_CLR1_GSU0_GSUC0_GSUWGMRR0_K1_LBSPPA1024_LBSPPB256_LPB32_MIWT4_2_PLR1_SU0_SUM0_SUS0_VWA4_VWB2_WGM1_WGMXCC1_WGMXCCGn1
    SolutionIndex: 110
    SolutionNameMin: Cijk_Alik_Bjlk_HHS_BH_Bias_AS_SAV_UserArgs_MT128x64x128_MI16x16x1_SN_LDSB1_CLR1_GSU0_GSUC0_GSUWGMRR0_K1_LBSPPA1024_LBSPPB256_LPB32_MIWT4_2_PLR1_SU0_SUM0_SUS0_VWA4_VWB2_WGM6_WGMXCC1_WGMXCCGn1
    SolutionIndex: 111
    SolutionNameMin: Cijk_Alik_Bjlk_HHS_BH_Bias_AS_SAV_UserArgs_MT128x64x128_MI16x16x1_SN_LDSB1_CLR1_GSU0_GSUC0_GSUWGMRR0_K1_LBSPPA1024_LBSPPB256_LPB32_MIWT4_2_PLR1_SU0_SUM0_SUS0_VWA4_VWB2_WGM6_WGMXCC1_WGMXCCGn1
    SolutionIndex: 112
    SolutionNameMin: Cijk_Alik_Bjlk_HHS_BH_Bias_AS_SAV_UserArgs_MT128x64x128_MI16x16x1_SN_LDSB1_CLR1_GSU0_GSUC0_GSUWGMRR0_K1_LBSPPA1024_LBSPPB256_LPB32_MIWT4_2_PLR1_SU0_SUM0_SUS0_VWA4_VWB2_WGM8_WGMXCC1_WGMXCCGn1
    SolutionIndex: 113
    SolutionNameMin: Cijk_Alik_Bjlk_HHS_BH_Bias_AS_SAV_UserArgs_MT64x64x128_MI16x16x1_SN_LDSB1_CLR1_GSU0_GSUC0_GSUWGMRR0_K1_LBSPPA512_LBSPPB1024_LPB32_MIWT2_2_PLR1_SU0_SUM0_SUS0_VWA2_VWB2_WGM1_WGMXCC1_WGMXCCGn1
    SolutionIndex: 114
    SolutionNameMin: Cijk_Alik_Bjlk_HHS_BH_Bias_AS_SAV_UserArgs_MT64x64x128_MI16x16x1_SN_LDSB1_CLR1_GSU0_GSUC0_GSUWGMRR0_K1_LBSPPA512_LBSPPB1024_LPB32_MIWT2_2_PLR1_SU0_SUM0_SUS0_VWA2_VWB2_WGM1_WGMXCC1_WGMXCCGn1
    SolutionIndex: 115
    SolutionNameMin: Cijk_Alik_Bjlk_HHS_BH_Bias_AS_SAV_UserArgs_MT64x64x128_MI16x16x1_SN_LDSB1_CLR1_GSU0_GSUC0_GSUWGMRR0_K1_LBSPPA512_LBSPPB1024_LPB32_MIWT2_2_PLR1_SU0_SUM0_SUS0_VWA2_VWB2_WGM1_WGMXCC1_WGMXCCGn1
    SolutionIndex: 116
    SolutionNameMin: Cijk_Alik_Bjlk_HHS_BH_Bias_AS_SAV_UserArgs_MT64x64x128_MI16x16x1_SN_LDSB1_CLR1_GSU0_GSUC0_GSUWGMRR0_K1_LBSPPA512_LBSPPB1024_LPB32_MIWT2_2_PLR1_SU0_SUM0_SUS0_VWA2_VWB2_WGM1_WGMXCC1_WGMXCCGn1
    SolutionIndex: 117
    SolutionNameMin: Cijk_Alik_Bjlk_HHS_BH_Bias_AS_SAV_UserArgs_MT64x64x128_MI16x16x1_SN_LDSB1_CLR1_GSU0_GSUC0_GSUWGMRR0_K1_LBSPPA512_LBSPPB1024_LPB32_MIWT2_2_PLR1_SU0_SUM0_SUS0_VWA2_VWB2_WGM1_WGMXCC1_WGMXCCGn1
    SolutionIndex: 118
    SolutionNameMin: Cijk_Alik_Bjlk_HHS_BH_Bias_AS_SAV_UserArgs_MT64x64x128_MI16x16x1_SN_LDSB1_CLR1_GSU0_GSUC0_GSUWGMRR0_K1_LBSPPA512_LBSPPB512_LPB32_MIWT2_2_PLR1_SU0_SUM0_SUS0_VWA2_VWB2_WGM6_WGMXCC1_WGMXCCGn1
    SolutionIndex: 119
    SolutionNameMin: Cijk_Alik_Bjlk_HHS_BH_Bias_AS_SAV_UserArgs_MT64x64x128_MI16x16x1_SN_LDSB1_CLR1_GSU0_GSUC0_GSUWGMRR0_K1_LBSPPA512_LBSPPB1024_LPB32_MIWT2_2_PLR1_SU0_SUM0_SUS0_VWA2_VWB2_WGM6_WGMXCC1_WGMXCCGn1
    SolutionIndex: 120
    SolutionNameMin: Cijk_Alik_Bjlk_HHS_BH_Bias_AS_SAV_UserArgs_MT64x64x128_MI16x16x1_SN_LDSB1_CLR1_GSU0_GSUC0_GSUWGMRR0_K1_LBSPPA512_LBSPPB1024_LPB32_MIWT2_2_PLR1_SU0_SUM0_SUS0_VWA2_VWB2_WGM6_WGMXCC1_WGMXCCGn1
    SolutionIndex: 121
    SolutionNameMin: Cijk_Alik_Bjlk_HHS_BH_Bias_AS_SAV_UserArgs_MT64x64x128_MI16x16x1_SN_LDSB1_CLR1_GSU0_GSUC0_GSUWGMRR0_K1_LBSPPA512_LBSPPB256_LPB32_MIWT2_2_PLR1_SU0_SUM0_SUS0_VWA2_VWB2_WGM8_WGMXCC1_WGMXCCGn1
    SolutionIndex: 122
    SolutionNameMin: Cijk_Alik_Bjlk_HHS_BH_Bias_AS_SAV_UserArgs_MT64x64x128_MI16x16x1_SN_LDSB1_CLR1_GSU0_GSUC0_GSUWGMRR0_K1_LBSPPA512_LBSPPB256_LPB32_MIWT2_2_PLR1_SU0_SUM0_SUS0_VWA2_VWB2_WGM8_WGMXCC1_WGMXCCGn1
    SolutionIndex: 123
    SolutionNameMin: Cijk_Alik_Bjlk_HHS_BH_Bias_AS_SAV_UserArgs_MT64x64x128_MI16x16x1_SN_LDSB1_CLR1_GSU0_GSUC0_GSUWGMRR0_K1_LBSPPA512_LBSPPB512_LPB32_MIWT2_2_PLR1_SU0_SUM0_SUS0_VWA2_VWB2_WGM8_WGMXCC1_WGMXCCGn1
    SolutionIndex: 124
    SolutionNameMin: Cijk_Alik_Bjlk_HHS_BH_Bias_AS_SAV_UserArgs_MT64x64x128_MI16x16x1_SN_LDSB1_CLR1_GSU0_GSUC0_GSUWGMRR0_K1_LBSPPA512_LBSPPB512_LPB32_MIWT2_2_PLR1_SU0_SUM0_SUS0_VWA2_VWB2_WGM8_WGMXCC1_WGMXCCGn1
    SolutionIndex: 125
    SolutionNameMin: Cijk_Alik_Bjlk_HHS_BH_Bias_AS_SAV_UserArgs_MT64x64x128_MI16x16x1_SN_LDSB1_CLR1_GSU0_GSUC0_GSUWGMRR0_K1_LBSPPA512_LBSPPB512_LPB32_MIWT2_2_PLR1_SU0_SUM0_SUS0_VWA2_VWB2_WGM8_WGMXCC1_WGMXCCGn1
    SolutionIndex: 126
    SolutionNameMin: Cijk_Alik_Bjlk_HHS_BH_Bias_AS_SAV_UserArgs_MT32x64x128_MI16x16x1_SN_LDSB1_CLR1_GSU0_GSUC0_GSUWGMRR0_K1_LBSPPA256_LBSPPB512_LPB32_MIWT1_2_PLR1_SU0_SUM0_SUS0_VWA1_VWB2_WGM1_WGMXCC1_WGMXCCGn1
    SolutionIndex: 127
    SolutionNameMin: Cijk_Alik_Bjlk_HHS_BH_Bias_AS_SAV_UserArgs_MT32x64x128_MI16x16x1_SN_LDSB1_CLR1_GSU0_GSUC0_GSUWGMRR0_K1_LBSPPA256_LBSPPB512_LPB32_MIWT1_2_PLR1_SU0_SUM0_SUS0_VWA1_VWB2_WGM1_WGMXCC1_WGMXCCGn1
    SolutionIndex: 128
    SolutionNameMin: Cijk_Alik_Bjlk_HHS_BH_Bias_AS_SAV_UserArgs_MT32x64x128_MI16x16x1_SN_LDSB1_CLR1_GSU0_GSUC0_GSUWGMRR0_K1_LBSPPA256_LBSPPB1024_LPB32_MIWT1_2_PLR1_SU0_SUM0_SUS0_VWA1_VWB2_WGM1_WGMXCC1_WGMXCCGn1
    SolutionIndex: 129
    SolutionNameMin: Cijk_Alik_Bjlk_HHS_BH_Bias_AS_SAV_UserArgs_MT32x64x128_MI16x16x1_SN_LDSB1_CLR1_GSU0_GSUC0_GSUWGMRR0_K1_LBSPPA256_LBSPPB1024_LPB32_MIWT1_2_PLR1_SU0_SUM0_SUS0_VWA1_VWB2_WGM1_WGMXCC1_WGMXCCGn1
    SolutionIndex: 130
    SolutionNameMin: Cijk_Alik_Bjlk_HHS_BH_Bias_AS_SAV_UserArgs_MT32x64x128_MI16x16x1_SN_LDSB1_CLR1_GSU0_GSUC0_GSUWGMRR0_K1_LBSPPA256_LBSPPB512_LPB32_MIWT1_2_PLR1_SU0_SUM0_SUS0_VWA1_VWB2_WGM6_WGMXCC1_WGMXCCGn1
    SolutionIndex: 131
    SolutionNameMin: Cijk_Alik_Bjlk_HHS_BH_Bias_AS_SAV_UserArgs_MT32x64x128_MI16x16x1_SN_LDSB1_CLR1_GSU0_GSUC0_GSUWGMRR0_K1_LBSPPA256_LBSPPB1024_LPB32_MIWT1_2_PLR1_SU0_SUM0_SUS0_VWA1_VWB2_WGM6_WGMXCC1_WGMXCCGn1
    SolutionIndex: 132
    SolutionNameMin: Cijk_Alik_Bjlk_HHS_BH_Bias_AS_SAV_UserArgs_MT32x64x128_MI16x16x1_SN_LDSB1_CLR1_GSU0_GSUC0_GSUWGMRR0_K1_LBSPPA256_LBSPPB1024_LPB32_MIWT1_2_PLR1_SU0_SUM0_SUS0_VWA1_VWB2_WGM6_WGMXCC1_WGMXCCGn1
    SolutionIndex: 133
    SolutionNameMin: Cijk_Alik_Bjlk_HHS_BH_Bias_AS_SAV_UserArgs_MT32x64x128_MI16x16x1_SN_LDSB1_CLR1_GSU0_GSUC0_GSUWGMRR0_K1_LBSPPA256_LBSPPB512_LPB32_MIWT1_2_PLR1_SU0_SUM0_SUS0_VWA1_VWB2_WGM8_WGMXCC1_WGMXCCGn1
    SolutionIndex: 134
    SolutionNameMin: Cijk_Alik_Bjlk_HHS_BH_Bias_AS_SAV_UserArgs_MT32x64x128_MI16x16x1_SN_LDSB1_CLR1_GSU0_GSUC0_GSUWGMRR0_K1_LBSPPA256_LBSPPB1024_LPB32_MIWT1_2_PLR1_SU0_SUM0_SUS0_VWA1_VWB2_WGM8_WGMXCC1_WGMXCCGn1
    SolutionIndex: 135
    SolutionNameMin: Cijk_Alik_Bjlk_HHS_BH_Bias_AS_SAV_UserArgs_MT32x64x128_MI16x16x1_SN_LDSB1_CLR1_GSU0_GSUC0_GSUWGMRR0_K1_LBSPPA256_LBSPPB1024_LPB32_MIWT1_2_PLR1_SU0_SUM0_SUS0_VWA1_VWB2_WGM8_WGMXCC1_WGMXCCGn1
    SolutionIndex: 136
    SolutionNameMin: Cijk_Alik_Bjlk_HHS_BH_Bias_AS_SAV_UserArgs_MT64x32x128_MI16x16x1_SN_LDSB1_CLR1_GSU0_GSUC0_GSUWGMRR0_K1_LBSPPA512_LBSPPB256_LPB16_MIWT2_1_PLR1_SU0_SUM0_SUS0_VWA2_VWB1_WGM1_WGMXCC1_WGMXCCGn1
    SolutionIndex: 137
    SolutionNameMin: Cijk_Alik_Bjlk_HHS_BH_Bias_AS_SAV_UserArgs_MT64x32x128_MI16x16x1_SN_LDSB1_CLR1_GSU0_GSUC0_GSUWGMRR0_K1_LBSPPA512_LBSPPB512_LPB16_MIWT2_1_PLR1_SU0_SUM0_SUS0_VWA2_VWB1_WGM1_WGMXCC1_WGMXCCGn1
    SolutionIndex: 138
    SolutionNameMin: Cijk_Alik_Bjlk_HHS_BH_Bias_AS_SAV_UserArgs_MT64x32x128_MI16x16x1_SN_LDSB1_CLR1_GSU0_GSUC0_GSUWGMRR0_K1_LBSPPA512_LBSPPB512_LPB16_MIWT2_1_PLR1_SU0_SUM0_SUS0_VWA2_VWB1_WGM1_WGMXCC1_WGMXCCGn1
    SolutionIndex: 139
    SolutionNameMin: Cijk_Alik_Bjlk_HHS_BH_Bias_AS_SAV_UserArgs_MT64x32x128_MI16x16x1_SN_LDSB1_CLR1_GSU0_GSUC0_GSUWGMRR0_K1_LBSPPA512_LBSPPB512_LPB16_MIWT2_1_PLR1_SU0_SUM0_SUS0_VWA2_VWB1_WGM1_WGMXCC1_WGMXCCGn1
    SolutionIndex: 140
    SolutionNameMin: Cijk_Alik_Bjlk_HHS_BH_Bias_AS_SAV_UserArgs_MT64x32x128_MI16x16x1_SN_LDSB1_CLR1_GSU0_GSUC0_GSUWGMRR0_K1_LBSPPA512_LBSPPB256_LPB16_MIWT2_1_PLR1_SU0_SUM0_SUS0_VWA2_VWB1_WGM8_WGMXCC1_WGMXCCGn1
    SolutionIndex: 141
    SolutionNameMin: Cijk_Alik_Bjlk_HHS_BH_Bias_AS_SAV_UserArgs_MT32x32x128_MI16x16x1_SN_LDSB1_CLR1_GSU0_GSUC0_GSUWGMRR0_K1_LBSPPA256_LBSPPB128_LPB16_MIWT1_1_PLR1_SU0_SUM0_SUS0_VWA1_VWB1_WGM1_WGMXCC1_WGMXCCGn1
    SolutionIndex: 142
    SolutionNameMin: Cijk_Alik_Bjlk_HHS_BH_Bias_AS_SAV_UserArgs_MT32x32x128_MI16x16x1_SN_LDSB1_CLR1_GSU0_GSUC0_GSUWGMRR0_K1_LBSPPA256_LBSPPB256_LPB16_MIWT1_1_PLR1_SU0_SUM0_SUS0_VWA1_VWB1_WGM1_WGMXCC1_WGMXCCGn1
    SolutionIndex: 143
    SolutionNameMin: Cijk_Alik_Bjlk_HHS_BH_Bias_AS_SAV_UserArgs_MT32x32x128_MI16x16x1_SN_LDSB1_CLR1_GSU0_GSUC0_GSUWGMRR0_K1_LBSPPA256_LBSPPB256_LPB16_MIWT1_1_PLR1_SU0_SUM0_SUS0_VWA1_VWB1_WGM1_WGMXCC1_WGMXCCGn1
    SolutionIndex: 144
    SolutionNameMin: Cijk_Alik_Bjlk_HHS_BH_Bias_AS_SAV_UserArgs_MT32x32x128_MI16x16x1_SN_LDSB1_CLR1_GSU0_GSUC0_GSUWGMRR0_K1_LBSPPA256_LBSPPB512_LPB16_MIWT1_1_PLR1_SU0_SUM0_SUS0_VWA1_VWB1_WGM1_WGMXCC1_WGMXCCGn1
    SolutionIndex: 145
    SolutionNameMin: Cijk_Alik_Bjlk_HHS_BH_Bias_AS_SAV_UserArgs_MT32x32x128_MI16x16x1_SN_LDSB1_CLR1_GSU0_GSUC0_GSUWGMRR0_K1_LBSPPA256_LBSPPB512_LPB16_MIWT1_1_PLR1_SU0_SUM0_SUS0_VWA1_VWB1_WGM1_WGMXCC1_WGMXCCGn1
    SolutionIndex: 146
    SolutionNameMin: Cijk_Alik_Bjlk_HHS_BH_Bias_AS_SAV_UserArgs_MT32x32x128_MI16x16x1_SN_LDSB1_CLR1_GSU0_GSUC0_GSUWGMRR0_K1_LBSPPA256_LBSPPB512_LPB16_MIWT1_1_PLR1_SU0_SUM0_SUS0_VWA1_VWB1_WGM1_WGMXCC1_WGMXCCGn1
    SolutionIndex: 147
    SolutionNameMin: Cijk_Alik_Bjlk_HHS_BH_Bias_AS_SAV_UserArgs_MT32x32x128_MI16x16x1_SN_LDSB1_CLR1_GSU0_GSUC0_GSUWGMRR0_K1_LBSPPA256_LBSPPB512_LPB16_MIWT1_1_PLR1_SU0_SUM0_SUS0_VWA1_VWB1_WGM1_WGMXCC1_WGMXCCGn1
    SolutionIndex: 148
    SolutionNameMin: Cijk_Alik_Bjlk_HHS_BH_Bias_AS_SAV_UserArgs_MT32x32x128_MI16x16x1_SN_LDSB1_CLR1_GSU0_GSUC0_GSUWGMRR0_K1_LBSPPA256_LBSPPB256_LPB16_MIWT1_1_PLR1_SU0_SUM0_SUS0_VWA1_VWB1_WGM6_WGMXCC1_WGMXCCGn1
    SolutionIndex: 149
    SolutionNameMin: Cijk_Alik_Bjlk_HHS_BH_Bias_AS_SAV_UserArgs_MT32x32x128_MI16x16x1_SN_LDSB1_CLR1_GSU0_GSUC0_GSUWGMRR0_K1_LBSPPA256_LBSPPB256_LPB16_MIWT1_1_PLR1_SU0_SUM0_SUS0_VWA1_VWB1_WGM6_WGMXCC1_WGMXCCGn1
    SolutionIndex: 150
    SolutionNameMin: Cijk_Alik_Bjlk_HHS_BH_Bias_AS_SAV_UserArgs_MT32x32x128_MI16x16x1_SN_LDSB1_CLR1_GSU0_GSUC0_GSUWGMRR0_K1_LBSPPA256_LBSPPB512_LPB16_MIWT1_1_PLR1_SU0_SUM0_SUS0_VWA1_VWB1_WGM6_WGMXCC1_WGMXCCGn1
    SolutionIndex: 151
    SolutionNameMin: Cijk_Alik_Bjlk_HHS_BH_Bias_AS_SAV_UserArgs_MT32x32x128_MI16x16x1_SN_LDSB1_CLR1_GSU0_GSUC0_GSUWGMRR0_K1_LBSPPA256_LBSPPB512_LPB16_MIWT1_1_PLR1_SU0_SUM0_SUS0_VWA1_VWB1_WGM6_WGMXCC1_WGMXCCGn1
    SolutionIndex: 152
    SolutionNameMin: Cijk_Alik_Bjlk_HHS_BH_Bias_AS_SAV_UserArgs_MT32x32x128_MI16x16x1_SN_LDSB1_CLR1_GSU0_GSUC0_GSUWGMRR0_K1_LBSPPA256_LBSPPB512_LPB16_MIWT1_1_PLR1_SU0_SUM0_SUS0_VWA1_VWB1_WGM6_WGMXCC1_WGMXCCGn1
    SolutionIndex: 153
    SolutionNameMin: Cijk_Alik_Bjlk_HHS_BH_Bias_AS_SAV_UserArgs_MT32x32x128_MI16x16x1_SN_LDSB1_CLR1_GSU0_GSUC0_GSUWGMRR0_K1_LBSPPA256_LBSPPB256_LPB16_MIWT1_1_PLR1_SU0_SUM0_SUS0_VWA1_VWB1_WGM8_WGMXCC1_WGMXCCGn1
    SolutionIndex: 154
    SolutionNameMin: Cijk_Alik_Bjlk_HHS_BH_Bias_AS_SAV_UserArgs_MT32x32x128_MI16x16x1_SN_LDSB1_CLR1_GSU0_GSUC0_GSUWGMRR0_K1_LBSPPA256_LBSPPB256_LPB16_MIWT1_1_PLR1_SU0_SUM0_SUS0_VWA1_VWB1_WGM8_WGMXCC1_WGMXCCGn1
    SolutionIndex: 155
    SolutionNameMin: Cijk_Alik_Bjlk_HHS_BH_Bias_AS_SAV_UserArgs_MT32x32x128_MI16x16x1_SN_LDSB1_CLR1_GSU0_GSUC0_GSUWGMRR0_K1_LBSPPA256_LBSPPB512_LPB16_MIWT1_1_PLR1_SU0_SUM0_SUS0_VWA1_VWB1_WGM8_WGMXCC1_WGMXCCGn1
    SolutionIndex: 156
    SolutionNameMin: Cijk_Alik_Bjlk_HHS_BH_Bias_AS_SAV_UserArgs_MT32x32x128_MI16x16x1_SN_LDSB1_CLR1_GSU0_GSUC0_GSUWGMRR0_K1_LBSPPA256_LBSPPB512_LPB16_MIWT1_1_PLR1_SU0_SUM0_SUS0_VWA1_VWB1_WGM8_WGMXCC1_WGMXCCGn1
    SolutionIndex: 157
    SolutionNameMin: Cijk_Alik_Bjlk_HHS_BH_Bias_AS_SAV_UserArgs_MT128x128x128_MI32x32x1_SN_LDSB1_CLR1_GSU0_GSUC0_GSUWGMRR0_K1_LBSPPA512_LBSPPB0_LPB0_MIWT2_2_PLR1_SU0_SUM0_SUS0_VWA2_VWB2_WGM1_WGMXCC1_WGMXCCGn1
    SolutionIndex: 158
    SolutionNameMin: Cijk_Alik_Bjlk_HHS_BH_Bias_AS_SAV_UserArgs_MT128x128x128_MI32x32x1_SN_LDSB1_CLR1_GSU0_GSUC0_GSUWGMRR0_K1_LBSPPA512_LBSPPB0_LPB0_MIWT2_2_PLR1_SU0_SUM0_SUS0_VWA2_VWB2_WGM1_WGMXCC1_WGMXCCGn1
    SolutionIndex: 159
    SolutionNameMin: Cijk_Alik_Bjlk_HHS_BH_Bias_AS_SAV_UserArgs_MT128x128x128_MI32x32x1_SN_LDSB1_CLR1_GSU0_GSUC0_GSUWGMRR0_K1_LBSPPA512_LBSPPB0_LPB0_MIWT2_2_PLR1_SU0_SUM0_SUS0_VWA2_VWB2_WGM6_WGMXCC1_WGMXCCGn1
    SolutionIndex: 160
    SolutionNameMin: Cijk_Alik_Bjlk_HHS_BH_Bias_AS_SAV_UserArgs_MT128x128x128_MI32x32x1_SN_LDSB1_CLR1_GSU0_GSUC0_GSUWGMRR0_K1_LBSPPA512_LBSPPB0_LPB0_MIWT2_2_PLR1_SU0_SUM0_SUS0_VWA2_VWB2_WGM8_WGMXCC1_WGMXCCGn1
    SolutionIndex: 161
    SolutionNameMin: Cijk_Alik_Bjlk_HHS_BH_Bias_AS_SAV_UserArgs_MT64x64x256_MI16x16x1_SN_LDSB1_CLR1_GSU0_GSUC0_GSUWGMRR0_K1_LBSPPA1024_LBSPPB256_LPB32_MIWT2_2_PLR1_SU0_SUM0_SUS0_VWA2_VWB2_WGM1_WGMXCC1_WGMXCCGn1
    SolutionIndex: 162
    SolutionNameMin: Cijk_Alik_Bjlk_HHS_BH_Bias_AS_SAV_UserArgs_MT64x64x256_MI16x16x1_SN_LDSB1_CLR1_GSU0_GSUC0_GSUWGMRR0_K1_LBSPPA1024_LBSPPB512_LPB32_MIWT2_2_PLR1_SU0_SUM0_SUS0_VWA2_VWB2_WGM1_WGMXCC1_WGMXCCGn1
    SolutionIndex: 163
    SolutionNameMin: Cijk_Alik_Bjlk_HHS_BH_Bias_AS_SAV_UserArgs_MT64x64x256_MI16x16x1_SN_LDSB1_CLR1_GSU0_GSUC0_GSUWGMRR0_K1_LBSPPA1024_LBSPPB256_LPB32_MIWT2_2_PLR1_SU0_SUM0_SUS0_VWA2_VWB2_WGM6_WGMXCC1_WGMXCCGn1
    SolutionIndex: 164
    SolutionNameMin: Cijk_Alik_Bjlk_HHS_BH_Bias_AS_SAV_UserArgs_MT64x64x256_MI16x16x1_SN_LDSB1_CLR1_GSU0_GSUC0_GSUWGMRR0_K1_LBSPPA1024_LBSPPB512_LPB32_MIWT2_2_PLR1_SU0_SUM0_SUS0_VWA2_VWB2_WGM6_WGMXCC1_WGMXCCGn1
    SolutionIndex: 165
    SolutionNameMin: Cijk_Alik_Bjlk_HHS_BH_Bias_AS_SAV_UserArgs_MT64x64x256_MI16x16x1_SN_LDSB1_CLR1_GSU0_GSUC0_GSUWGMRR0_K1_LBSPPA1024_LBSPPB512_LPB32_MIWT2_2_PLR1_SU0_SUM0_SUS0_VWA2_VWB2_WGM6_WGMXCC1_WGMXCCGn1
    SolutionIndex: 166
    SolutionNameMin: Cijk_Alik_Bjlk_HHS_BH_Bias_AS_SAV_UserArgs_MT64x64x256_MI16x16x1_SN_LDSB1_CLR1_GSU0_GSUC0_GSUWGMRR0_K1_LBSPPA1024_LBSPPB512_LPB32_MIWT2_2_PLR1_SU0_SUM0_SUS0_VWA2_VWB2_WGM6_WGMXCC1_WGMXCCGn1
    SolutionIndex: 167
    SolutionNameMin: Cijk_Alik_Bjlk_HHS_BH_Bias_AS_SAV_UserArgs_MT64x64x256_MI16x16x1_SN_LDSB1_CLR1_GSU0_GSUC0_GSUWGMRR0_K1_LBSPPA1024_LBSPPB1024_LPB32_MIWT2_2_PLR1_SU0_SUM0_SUS0_VWA2_VWB2_WGM6_WGMXCC1_WGMXCCGn1
    SolutionIndex: 168
    SolutionNameMin: Cijk_Alik_Bjlk_HHS_BH_Bias_AS_SAV_UserArgs_MT64x64x256_MI16x16x1_SN_LDSB1_CLR1_GSU0_GSUC0_GSUWGMRR0_K1_LBSPPA1024_LBSPPB256_LPB32_MIWT2_2_PLR1_SU0_SUM0_SUS0_VWA2_VWB2_WGM8_WGMXCC1_WGMXCCGn1
    SolutionIndex: 169
    SolutionNameMin: Cijk_Alik_Bjlk_HHS_BH_Bias_AS_SAV_UserArgs_MT64x64x256_MI16x16x1_SN_LDSB1_CLR1_GSU0_GSUC0_GSUWGMRR0_K1_LBSPPA1024_LBSPPB256_LPB32_MIWT2_2_PLR1_SU0_SUM0_SUS0_VWA2_VWB2_WGM8_WGMXCC1_WGMXCCGn1
    SolutionIndex: 170
    SolutionNameMin: Cijk_Alik_Bjlk_HHS_BH_Bias_AS_SAV_UserArgs_MT64x64x256_MI16x16x1_SN_LDSB1_CLR1_GSU0_GSUC0_GSUWGMRR0_K1_LBSPPA1024_LBSPPB512_LPB32_MIWT2_2_PLR1_SU0_SUM0_SUS0_VWA2_VWB2_WGM8_WGMXCC1_WGMXCCGn1
    SolutionIndex: 171
    SolutionNameMin: Cijk_Alik_Bjlk_HHS_BH_Bias_AS_SAV_UserArgs_MT64x64x256_MI16x16x1_SN_LDSB1_CLR1_GSU0_GSUC0_GSUWGMRR0_K1_LBSPPA1024_LBSPPB1024_LPB32_MIWT2_2_PLR1_SU0_SUM0_SUS0_VWA2_VWB2_WGM8_WGMXCC1_WGMXCCGn1
    SolutionIndex: 172
    SolutionNameMin: Cijk_Alik_Bjlk_HHS_BH_Bias_AS_SAV_UserArgs_MT32x64x256_MI16x16x1_SN_LDSB1_CLR1_GSU0_GSUC0_GSUWGMRR0_K1_LBSPPA512_LBSPPB1024_LPB32_MIWT1_2_PLR1_SU0_SUM0_SUS0_VWA1_VWB2_WGM1_WGMXCC1_WGMXCCGn1
    SolutionIndex: 173
    SolutionNameMin: Cijk_Alik_Bjlk_HHS_BH_Bias_AS_SAV_UserArgs_MT32x64x256_MI16x16x1_SN_LDSB1_CLR1_GSU0_GSUC0_GSUWGMRR0_K1_LBSPPA512_LBSPPB1024_LPB32_MIWT1_2_PLR1_SU0_SUM0_SUS0_VWA1_VWB2_WGM1_WGMXCC1_WGMXCCGn1
    SolutionIndex: 174
    SolutionNameMin: Cijk_Alik_Bjlk_HHS_BH_Bias_AS_SAV_UserArgs_MT32x64x256_MI16x16x1_SN_LDSB1_CLR1_GSU0_GSUC0_GSUWGMRR0_K1_LBSPPA512_LBSPPB256_LPB32_MIWT1_2_PLR1_SU0_SUM0_SUS0_VWA1_VWB2_WGM6_WGMXCC1_WGMXCCGn1
    SolutionIndex: 175
    SolutionNameMin: Cijk_Alik_Bjlk_HHS_BH_Bias_AS_SAV_UserArgs_MT32x64x256_MI16x16x1_SN_LDSB1_CLR1_GSU0_GSUC0_GSUWGMRR0_K1_LBSPPA512_LBSPPB512_LPB32_MIWT1_2_PLR1_SU0_SUM0_SUS0_VWA1_VWB2_WGM6_WGMXCC1_WGMXCCGn1
    SolutionIndex: 176
    SolutionNameMin: Cijk_Alik_Bjlk_HHS_BH_Bias_AS_SAV_UserArgs_MT32x64x256_MI16x16x1_SN_LDSB1_CLR1_GSU0_GSUC0_GSUWGMRR0_K1_LBSPPA512_LBSPPB512_LPB32_MIWT1_2_PLR1_SU0_SUM0_SUS0_VWA1_VWB2_WGM6_WGMXCC1_WGMXCCGn1
    SolutionIndex: 177
    SolutionNameMin: Cijk_Alik_Bjlk_HHS_BH_Bias_AS_SAV_UserArgs_MT32x64x256_MI16x16x1_SN_LDSB1_CLR1_GSU0_GSUC0_GSUWGMRR0_K1_LBSPPA512_LBSPPB1024_LPB32_MIWT1_2_PLR1_SU0_SUM0_SUS0_VWA1_VWB2_WGM6_WGMXCC1_WGMXCCGn1
    SolutionIndex: 178
    SolutionNameMin: Cijk_Alik_Bjlk_HHS_BH_Bias_AS_SAV_UserArgs_MT32x64x256_MI16x16x1_SN_LDSB1_CLR1_GSU0_GSUC0_GSUWGMRR0_K1_LBSPPA512_LBSPPB1024_LPB32_MIWT1_2_PLR1_SU0_SUM0_SUS0_VWA1_VWB2_WGM6_WGMXCC1_WGMXCCGn1
    SolutionIndex: 179
    SolutionNameMin: Cijk_Alik_Bjlk_HHS_BH_Bias_AS_SAV_UserArgs_MT32x64x256_MI16x16x1_SN_LDSB1_CLR1_GSU0_GSUC0_GSUWGMRR0_K1_LBSPPA512_LBSPPB256_LPB32_MIWT1_2_PLR1_SU0_SUM0_SUS0_VWA1_VWB2_WGM8_WGMXCC1_WGMXCCGn1
    SolutionIndex: 180
    SolutionNameMin: Cijk_Alik_Bjlk_HHS_BH_Bias_AS_SAV_UserArgs_MT32x64x256_MI16x16x1_SN_LDSB1_CLR1_GSU0_GSUC0_GSUWGMRR0_K1_LBSPPA512_LBSPPB1024_LPB32_MIWT1_2_PLR1_SU0_SUM0_SUS0_VWA1_VWB2_WGM8_WGMXCC1_WGMXCCGn1
    SolutionIndex: 181
    SolutionNameMin: Cijk_Alik_Bjlk_HHS_BH_Bias_AS_SAV_UserArgs_MT32x32x256_MI16x16x1_SN_LDSB1_CLR1_GSU0_GSUC0_GSUWGMRR0_K1_LBSPPA512_LBSPPB256_LPB16_MIWT1_1_PLR1_SU0_SUM0_SUS0_VWA1_VWB1_WGM1_WGMXCC1_WGMXCCGn1
    SolutionIndex: 182
    SolutionNameMin: Cijk_Alik_Bjlk_HHS_BH_Bias_AS_SAV_UserArgs_MT32x32x256_MI16x16x1_SN_LDSB1_CLR1_GSU0_GSUC0_GSUWGMRR0_K1_LBSPPA512_LBSPPB256_LPB16_MIWT1_1_PLR1_SU0_SUM0_SUS0_VWA1_VWB1_WGM1_WGMXCC1_WGMXCCGn1
    SolutionIndex: 183
    SolutionNameMin: Cijk_Alik_Bjlk_HHS_BH_Bias_AS_SAV_UserArgs_MT32x32x256_MI16x16x1_SN_LDSB1_CLR1_GSU0_GSUC0_GSUWGMRR0_K1_LBSPPA512_LBSPPB512_LPB16_MIWT1_1_PLR1_SU0_SUM0_SUS0_VWA1_VWB1_WGM1_WGMXCC1_WGMXCCGn1
    SolutionIndex: 184
    SolutionNameMin: Cijk_Alik_Bjlk_HHS_BH_Bias_AS_SAV_UserArgs_MT32x32x256_MI16x16x1_SN_LDSB1_CLR1_GSU0_GSUC0_GSUWGMRR0_K1_LBSPPA512_LBSPPB512_LPB16_MIWT1_1_PLR1_SU0_SUM0_SUS0_VWA1_VWB1_WGM1_WGMXCC1_WGMXCCGn1
    SolutionIndex: 185
    SolutionNameMin: Cijk_Alik_Bjlk_HHS_BH_Bias_AS_SAV_UserArgs_MT32x32x256_MI16x16x1_SN_LDSB1_CLR1_GSU0_GSUC0_GSUWGMRR0_K1_LBSPPA512_LBSPPB512_LPB16_MIWT1_1_PLR1_SU0_SUM0_SUS0_VWA1_VWB1_WGM1_WGMXCC1_WGMXCCGn1
    SolutionIndex: 186
    SolutionNameMin: Cijk_Alik_Bjlk_HHS_BH_Bias_AS_SAV_UserArgs_MT32x32x256_MI16x16x1_SN_LDSB1_CLR1_GSU0_GSUC0_GSUWGMRR0_K1_LBSPPA512_LBSPPB512_LPB16_MIWT1_1_PLR1_SU0_SUM0_SUS0_VWA1_VWB1_WGM1_WGMXCC1_WGMXCCGn1
    SolutionIndex: 187
    SolutionNameMin: Cijk_Alik_Bjlk_HHS_BH_Bias_AS_SAV_UserArgs_MT32x32x256_MI16x16x1_SN_LDSB1_CLR1_GSU0_GSUC0_GSUWGMRR0_K1_LBSPPA512_LBSPPB512_LPB16_MIWT1_1_PLR1_SU0_SUM0_SUS0_VWA1_VWB1_WGM1_WGMXCC1_WGMXCCGn1
    SolutionIndex: 188
    SolutionNameMin: Cijk_Alik_Bjlk_HHS_BH_Bias_AS_SAV_UserArgs_MT32x32x256_MI16x16x1_SN_LDSB1_CLR1_GSU0_GSUC0_GSUWGMRR0_K1_LBSPPA512_LBSPPB256_LPB16_MIWT1_1_PLR1_SU0_SUM0_SUS0_VWA1_VWB1_WGM6_WGMXCC1_WGMXCCGn1
    SolutionIndex: 189
    SolutionNameMin: Cijk_Alik_Bjlk_HHS_BH_Bias_AS_SAV_UserArgs_MT32x32x256_MI16x16x1_SN_LDSB1_CLR1_GSU0_GSUC0_GSUWGMRR0_K1_LBSPPA512_LBSPPB512_LPB16_MIWT1_1_PLR1_SU0_SUM0_SUS0_VWA1_VWB1_WGM6_WGMXCC1_WGMXCCGn1
    SolutionIndex: 190
    SolutionNameMin: Cijk_Alik_Bjlk_HHS_BH_Bias_AS_SAV_UserArgs_MT32x32x256_MI16x16x1_SN_LDSB1_CLR1_GSU0_GSUC0_GSUWGMRR0_K1_LBSPPA512_LBSPPB256_LPB16_MIWT1_1_PLR1_SU0_SUM0_SUS0_VWA1_VWB1_WGM8_WGMXCC1_WGMXCCGn1
    SolutionIndex: 191
    SolutionNameMin: Cijk_Alik_Bjlk_HHS_BH_Bias_AS_SAV_UserArgs_MT32x32x256_MI16x16x1_SN_LDSB1_CLR1_GSU0_GSUC0_GSUWGMRR0_K1_LBSPPA512_LBSPPB512_LPB16_MIWT1_1_PLR1_SU0_SUM0_SUS0_VWA1_VWB1_WGM8_WGMXCC1_WGMXCCGn1
    SolutionIndex: 192
    SolutionNameMin: Cijk_Alik_Bjlk_HHS_BH_Bias_AS_SAV_UserArgs_MT32x32x256_MI16x16x1_SN_LDSB1_CLR1_GSU0_GSUC0_GSUWGMRR0_K1_LBSPPA512_LBSPPB512_LPB16_MIWT1_1_PLR1_SU0_SUM0_SUS0_VWA1_VWB1_WGM8_WGMXCC1_WGMXCCGn1
    SolutionIndex: 193
    SolutionNameMin: Cijk_Alik_Bjlk_HHS_BH_Bias_AS_SAV_UserArgs_MT32x32x32_MI16x16x1_SN_LDSB0_CLR0_GSU0_GSUC0_GSUWGMRR0_K1_LBSPPA128_LBSPPB256_LPB16_MIWT1_1_PLR0_SU32_SUM0_SUS256_VWA1_VWB1_WGM1_WGMXCC1_WGMXCCGn1
- - - [128, 128, 1, 128, 128, 128, 128, 128]
    - [147, 0.038]
  - - [128, 128, 1, 256, 128, 128, 256, 128]
    - [181, 0.066]
  - - [128, 128, 1, 512, 128, 128, 512, 128]
    - [187, 0.108]
  - - [128, 128, 1, 1024, 128, 128, 1024, 128]
    - [187, 0.172]
  - - [128, 128, 1, 2048, 128, 128, 2048, 128]
    - [190, 0.233]
  - - [128, 128, 1, 4096, 128, 128, 4096, 128]
    - [189, 0.284]
  - - [128, 128, 1, 8192, 128, 128, 8192, 128]
    - [190, 0.326]
  - - [128, 256, 1, 128, 128, 128, 128, 256]
    - [69, 0.071]
  - - [128, 256, 1, 256, 128, 128, 256, 256]
    - [187, 0.12]
  - - [128, 256, 1, 512, 128, 128, 512, 256]
    - [153, 0.194]
  - - [128, 256, 1, 1024, 128, 128, 1024, 256]
    - [182, 0.277]
  - - [128, 256, 1, 2048, 128, 128, 2048, 256]
    - [146, 0.348]
  - - [128, 256, 1, 4096, 128, 128, 4096, 256]
    - [148, 0.401]
  - - [128, 256, 1, 8192, 128, 128, 8192, 256]
    - [37, 0.469]
  - - [128, 512, 1, 128, 128, 128, 128, 512]
    - [69, 0.14]
  - - [128, 512, 1, 256, 128, 128, 256, 512]
    - [181, 0.24]
  - - [128, 512, 1, 512, 128, 128, 512, 512]
    - [181, 0.389]
  - - [128, 512, 1, 1024, 128, 128, 1024, 512]
    - [142, 0.544]
  - - [128, 512, 1, 2048, 128, 128, 2048, 512]
    - [155, 0.686]
  - - [128, 512, 1, 4096, 128, 128, 4096, 512]
    - [150, 0.806]
  - - [128, 512, 1, 8192, 128, 128, 8192, 512]
    - [37, 0.889]
  - - [128, 1024, 1, 128, 128, 128, 128, 1024]
    - [69, 0.272]
  - - [128, 1024, 1, 256, 128, 128, 256, 1024]
    - [184, 0.468]
  - - [128, 1024, 1, 512, 128, 128, 512, 1024]
    - [186, 0.744]
  - - [128, 1024, 1, 1024, 128, 128, 1024, 1024]
    - [148, 1.025]
  - - [128, 1024, 1, 2048, 128, 128, 2048, 1024]
    - [148, 1.296]
  - - [128, 1024, 1, 4096, 128, 128, 4096, 1024]
    - [150, 1.486]
  - - [128, 1024, 1, 8192, 128, 128, 8192, 1024]
    - [36, 1.731]
  - - [128, 2048, 1, 128, 128, 128, 128, 2048]
    - [70, 0.52]
  - - [128, 2048, 1, 256, 128, 128, 256, 2048]
    - [186, 0.899]
  - - [128, 2048, 1, 512, 128, 128, 512, 2048]
    - [187, 1.455]
  - - [128, 2048, 1, 1024, 128, 128, 1024, 2048]
    - [192, 2.06]
  - - [128, 2048, 1, 2048, 128, 128, 2048, 2048]
    - [156, 2.54]
  - - [128, 2048, 1, 4096, 128, 128, 4096, 2048]
    - [154, 2.912]
  - - [128, 2048, 1, 8192, 128, 128, 8192, 2048]
    - [35, 2.883]
  - - [128, 4096, 1, 128, 128, 128, 128, 4096]
    - [127, 0.966]
  - - [128, 4096, 1, 256, 128, 128, 256, 4096]
    - [172, 1.623]
  - - [128, 4096, 1, 512, 128, 128, 512, 4096]
    - [139, 2.518]
  - - [128, 4096, 1, 1024, 128, 128, 1024, 4096]
    - [133, 3.471]
  - - [128, 4096, 1, 2048, 128, 128, 2048, 4096]
    - [180, 4.429]
  - - [128, 4096, 1, 4096, 128, 128, 4096, 4096]
    - [135, 4.353]
  - - [128, 4096, 1, 8192, 128, 128, 8192, 4096]
    - [135, 4.87]
  - - [128, 8192, 1, 128, 128, 128, 128, 8192]
    - [64, 1.781]
  - - [128, 8192, 1, 256, 128, 128, 256, 8192]
    - [66, 2.943]
  - - [128, 8192, 1, 512, 128, 128, 512, 8192]
    - [63, 4.324]
  - - [128, 8192, 1, 1024, 128, 128, 1024, 8192]
    - [62, 5.882]
  - - [128, 8192, 1, 2048, 128, 128, 2048, 8192]
    - [124, 6.873]
  - - [128, 8192, 1, 4096, 128, 128, 4096, 8192]
    - [122, 8.185]
  - - [128, 8192, 1, 8192, 128, 128, 8192, 8192]
    - [125, 8.64]
  - - [256, 128, 1, 128, 256, 256, 128, 128]
    - [67, 0.074]
  - - [256, 128, 1, 256, 256, 256, 256, 128]
    - [187, 0.132]
  - - [256, 128, 1, 512, 256, 256, 512, 128]
    - [182, 0.214]
  - - [256, 128, 1, 1024, 256, 256, 1024, 128]
    - [182, 0.345]
  - - [256, 128, 1, 2048, 256, 256, 2048, 128]
    - [182, 0.474]
  - - [256, 128, 1, 4096, 256, 256, 4096, 128]
    - [187, 0.584]
  - - [256, 128, 1, 8192, 256, 256, 8192, 128]
    - [182, 0.67]
  - - [256, 256, 1, 128, 256, 256, 128, 256]
    - [69, 0.143]
  - - [256, 256, 1, 256, 256, 256, 256, 256]
    - [181, 0.242]
  - - [256, 256, 1, 512, 256, 256, 512, 256]
    - [187, 0.393]
  - - [256, 256, 1, 1024, 256, 256, 1024, 256]
    - [187, 0.571]
  - - [256, 256, 1, 2048, 256, 256, 2048, 256]
    - [182, 0.712]
  - - [256, 256, 1, 4096, 256, 256, 4096, 256]
    - [148, 0.839]
  - - [256, 256, 1, 8192, 256, 256, 8192, 256]
    - [38, 0.973]
  - - [256, 512, 1, 128, 256, 256, 128, 512]
    - [68, 0.279]
  - - [256, 512, 1, 256, 256, 256, 256, 512]
    - [185, 0.484]
  - - [256, 512, 1, 512, 256, 256, 512, 512]
    - [185, 0.779]
  - - [256, 512, 1, 1024, 256, 256, 1024, 512]
    - [150, 1.1]
  - - [256, 512, 1, 2048, 256, 256, 2048, 512]
    - [150, 1.423]
  - - [256, 512, 1, 4096, 256, 256, 4096, 512]
    - [148, 1.67]
  - - [256, 512, 1, 8192, 256, 256, 8192, 512]
    - [36, 1.834]
  - - [256, 1024, 1, 128, 256, 256, 128, 1024]
    - [141, 0.534]
  - - [256, 1024, 1, 256, 256, 256, 256, 1024]
    - [144, 0.928]
  - - [256, 1024, 1, 512, 256, 256, 512, 1024]
    - [186, 1.494]
  - - [256, 1024, 1, 1024, 256, 256, 1024, 1024]
    - [189, 2.14]
  - - [256, 1024, 1, 2048, 256, 256, 2048, 1024]
    - [148, 2.764]
  - - [256, 1024, 1, 4096, 256, 256, 4096, 1024]
    - [145, 3.365]
  - - [256, 1024, 1, 8192, 256, 256, 8192, 1024]
    - [142, 3.744]
  - - [256, 2048, 1, 128, 256, 256, 128, 2048]
    - [128, 0.987]
  - - [256, 2048, 1, 256, 256, 256, 256, 2048]
    - [172, 1.697]
  - - [256, 2048, 1, 512, 256, 256, 512, 2048]
    - [173, 2.641]
  - - [256, 2048, 1, 1024, 256, 256, 1024, 2048]
    - [129, 3.675]
  - - [256, 2048, 1, 2048, 256, 256, 2048, 2048]
    - [131, 4.56]
  - - [256, 2048, 1, 4096, 256, 256, 4096, 2048]
    - [129, 5.194]
  - - [256, 2048, 1, 8192, 256, 256, 8192, 2048]
    - [32, 5.299]
  - - [256, 4096, 1, 128, 256, 256, 128, 4096]
    - [65, 1.811]
  - - [256, 4096, 1, 256, 256, 256, 256, 4096]
    - [117, 3.005]
  - - [256, 4096, 1, 512, 256, 256, 512, 4096]
    - [162, 4.502]
  - - [256, 4096, 1, 1024, 256, 256, 1024, 4096]
    - [161, 6.172]
  - - [256, 4096, 1, 2048, 256, 256, 2048, 4096]
    - [161, 7.799]
  - - [256, 4096, 1, 4096, 256, 256, 4096, 4096]
    - [171, 7.942]
  - - [256, 4096, 1, 8192, 256, 256, 8192, 4096]
    - [30, 8.636]
  - - [256, 8192, 1, 128, 256, 256, 128, 8192]
    - [84, 3.048]
  - - [256, 8192, 1, 256, 256, 256, 256, 8192]
    - [95, 4.679]
  - - [256, 8192, 1, 512, 256, 256, 512, 8192]
    - [109, 6.834]
  - - [256, 8192, 1, 1024, 256, 256, 1024, 8192]
    - [158, 8.927]
  - - [256, 8192, 1, 2048, 256, 256, 2048, 8192]
    - [58, 11.059]
  - - [256, 8192, 1, 4096, 256, 256, 4096, 8192]
    - [107, 13.452]
  - - [256, 8192, 1, 8192, 256, 256, 8192, 8192]
    - [98, 14.814]
  - - [512, 128, 1, 128, 512, 512, 128, 128]
    - [147, 0.149]
  - - [512, 128, 1, 256, 512, 512, 256, 128]
    - [186, 0.261]
  - - [512, 128, 1, 512, 512, 512, 512, 128]
    - [187, 0.436]
  - - [512, 128, 1, 1024, 512, 512, 1024, 128]
    - [182, 0.686]
  - - [512, 128, 1, 2048, 512, 512, 2048, 128]
    - [187, 0.965]
  - - [512, 128, 1, 4096, 512, 512, 4096, 128]
    - [182, 1.181]
  - - [512, 128, 1, 8192, 512, 512, 8192, 128]
    - [187, 1.355]
  - - [512, 256, 1, 128, 512, 512, 128, 256]
    - [68, 0.285]
  - - [512, 256, 1, 256, 512, 512, 256, 256]
    - [142, 0.482]
  - - [512, 256, 1, 512, 512, 512, 512, 256]
    - [188, 0.773]
  - - [512, 256, 1, 1024, 512, 512, 1024, 256]
    - [188, 1.158]
  - - [512, 256, 1, 2048, 512, 512, 2048, 256]
    - [152, 1.45]
  - - [512, 256, 1, 4096, 512, 512, 4096, 256]
    - [149, 1.71]
  - - [512, 256, 1, 8192, 512, 512, 8192, 256]
    - [152, 1.904]
  - - [512, 512, 1, 128, 512, 512, 128, 512]
    - [68, 0.545]
  - - [512, 512, 1, 256, 512, 512, 256, 512]
    - [183, 0.946]
  - - [512, 512, 1, 512, 512, 512, 512, 512]
    - [191, 1.533]
  - - [512, 512, 1, 1024, 512, 512, 1024, 512]
    - [187, 2.267]
  - - [512, 512, 1, 2048, 512, 512, 2048, 512]
    - [153, 2.892]
  - - [512, 512, 1, 4096, 512, 512, 4096, 512]
    - [153, 3.407]
  - - [512, 512, 1, 8192, 512, 512, 8192, 512]
    - [148, 3.742]
  - - [512, 1024, 1, 128, 512, 512, 128, 1024]
    - [136, 1.017]
  - - [512, 1024, 1, 256, 512, 512, 256, 1024]
    - [138, 1.729]
  - - [512, 1024, 1, 512, 512, 512, 512, 1024]
    - [131, 2.78]
  - - [512, 1024, 1, 1024, 512, 512, 1024, 1024]
    - [131, 4.009]
  - - [512, 1024, 1, 2048, 512, 512, 2048, 1024]
    - [130, 5.055]
  - - [512, 1024, 1, 4096, 512, 512, 4096, 1024]
    - [130, 5.737]
  - - [512, 1024, 1, 8192, 512, 512, 8192, 1024]
    - [34, 5.988]
  - - [512, 2048, 1, 128, 512, 512, 128, 2048]
    - [113, 1.86]
  - - [512, 2048, 1, 256, 512, 512, 256, 2048]
    - [114, 3.107]
  - - [512, 2048, 1, 512, 512, 512, 512, 2048]
    - [162, 4.731]
  - - [512, 2048, 1, 1024, 512, 512, 1024, 2048]
    - [161, 6.267]
  - - [512, 2048, 1, 2048, 512, 512, 2048, 2048]
    - [161, 7.656]
  - - [512, 2048, 1, 4096, 512, 512, 4096, 2048]
    - [170, 8.711]
  - - [512, 2048, 1, 8192, 512, 512, 8192, 2048]
    - [31, 9.297]
  - - [512, 4096, 1, 128, 512, 512, 128, 4096]
    - [83, 3.072]
  - - [512, 4096, 1, 256, 512, 512, 256, 4096]
    - [95, 4.823]
  - - [512, 4096, 1, 512, 512, 512, 512, 4096]
    - [112, 7.096]
  - - [512, 4096, 1, 1024, 512, 512, 1024, 4096]
    - [94, 9.594]
  - - [512, 4096, 1, 2048, 512, 512, 2048, 4096]
    - [97, 11.316]
  - - [512, 4096, 1, 4096, 512, 512, 4096, 4096]
    - [96, 13.352]
  - - [512, 4096, 1, 8192, 512, 512, 8192, 4096]
    - [107, 14.536]
  - - [512, 8192, 1, 128, 512, 512, 128, 8192]
    - [160, 4.431]
  - - [512, 8192, 1, 256, 512, 512, 256, 8192]
    - [82, 6.844]
  - - [512, 8192, 1, 512, 512, 512, 512, 8192]
    - [78, 8.952]
  - - [512, 8192, 1, 1024, 512, 512, 1024, 8192]
    - [53, 11.813]
  - - [512, 8192, 1, 2048, 512, 512, 2048, 8192]
    - [92, 15.228]
  - - [512, 8192, 1, 4096, 512, 512, 4096, 8192]
    - [88, 19.763]
  - - [512, 8192, 1, 8192, 512, 512, 8192, 8192]
    - [93, 21.677]
  - - [1024, 128, 1, 128, 1024, 1024, 128, 128]
    - [145, 0.299]
  - - [1024, 128, 1, 256, 1024, 1024, 256, 128]
    - [187, 0.521]
  - - [1024, 128, 1, 512, 1024, 1024, 512, 128]
    - [189, 0.848]
  - - [1024, 128, 1, 1024, 1024, 1024, 1024, 128]
    - [187, 1.36]
  - - [1024, 128, 1, 2048, 1024, 1024, 2048, 128]
    - [187, 1.891]
  - - [1024, 128, 1, 4096, 1024, 1024, 4096, 128]
    - [192, 2.317]
  - - [1024, 128, 1, 8192, 1024, 1024, 8192, 128]
    - [188, 2.682]
  - - [1024, 256, 1, 128, 1024, 1024, 128, 256]
    - [144, 0.549]
  - - [1024, 256, 1, 256, 1024, 1024, 256, 256]
    - [191, 0.945]
  - - [1024, 256, 1, 512, 1024, 1024, 512, 256]
    - [189, 1.546]
  - - [1024, 256, 1, 1024, 1024, 1024, 1024, 256]
    - [188, 2.36]
  - - [1024, 256, 1, 2048, 1024, 1024, 2048, 256]
    - [151, 2.912]
  - - [1024, 256, 1, 4096, 1024, 1024, 4096, 256]
    - [151, 3.422]
  - - [1024, 256, 1, 8192, 1024, 1024, 8192, 256]
    - [148, 3.807]
  - - [1024, 512, 1, 128, 1024, 1024, 128, 512]
    - [137, 1.03]
  - - [1024, 512, 1, 256, 1024, 1024, 256, 512]
    - [178, 1.749]
  - - [1024, 512, 1, 512, 1024, 1024, 512, 512]
    - [130, 2.851]
  - - [1024, 512, 1, 1024, 1024, 1024, 1024, 512]
    - [131, 4.188]
  - - [1024, 512, 1, 2048, 1024, 1024, 2048, 512]
    - [130, 5.293]
  - - [1024, 512, 1, 4096, 1024, 1024, 4096, 512]
    - [132, 6.084]
  - - [1024, 512, 1, 8192, 1024, 1024, 8192, 512]
    - [34, 6.024]
  - - [1024, 1024, 1, 128, 1024, 1024, 128, 1024]
    - [116, 1.876]
  - - [1024, 1024, 1, 256, 1024, 1024, 256, 1024]
    - [115, 3.154]
  - - [1024, 1024, 1, 512, 1024, 1024, 512, 1024]
    - [171, 4.797]
  - - [1024, 1024, 1, 1024, 1024, 1024, 1024, 1024]
    - [169, 6.468]
  - - [1024, 1024, 1, 2048, 1024, 1024, 2048, 1024]
    - [169, 7.898]
  - - [1024, 1024, 1, 4096, 1024, 1024, 4096, 1024]
    - [171, 9.008]
  - - [1024, 1024, 1, 8192, 1024, 1024, 8192, 1024]
    - [40, 9.705]
  - - [1024, 2048, 1, 128, 1024, 1024, 128, 2048]
    - [59, 3.111]
  - - [1024, 2048, 1, 256, 1024, 1024, 256, 2048]
    - [106, 4.882]
  - - [1024, 2048, 1, 512, 1024, 1024, 512, 2048]
    - [109, 7.137]
  - - [1024, 2048, 1, 1024, 1024, 1024, 1024, 2048]
    - [112, 9.427]
  - - [1024, 2048, 1, 2048, 1024, 1024, 2048, 2048]
    - [97, 11.571]
  - - [1024, 2048, 1, 4096, 1024, 1024, 4096, 2048]
    - [104, 13.063]
  - - [1024, 2048, 1, 8192, 1024, 1024, 8192, 2048]
    - [107, 13.912]
  - - [1024, 4096, 1, 128, 1024, 1024, 128, 4096]
    - [52, 4.281]
  - - [1024, 4096, 1, 256, 1024, 1024, 256, 4096]
    - [77, 6.886]
  - - [1024, 4096, 1, 512, 1024, 1024, 512, 4096]
    - [81, 9.537]
  - - [1024, 4096, 1, 1024, 1024, 1024, 1024, 4096]
    - [57, 12.291]
  - - [1024, 4096, 1, 2048, 1024, 1024, 2048, 4096]
    - [86, 15.965]
  - - [1024, 4096, 1, 4096, 1024, 1024, 4096, 4096]
    - [92, 19.749]
  - - [1024, 4096, 1, 8192, 1024, 1024, 8192, 4096]
    - [92, 21.189]
  - - [1024, 8192, 1, 128, 1024, 1024, 128, 8192]
    - [10, 5.403]
  - - [1024, 8192, 1, 256, 1024, 1024, 256, 8192]
    - [27, 8.282]
  - - [1024, 8192, 1, 512, 1024, 1024, 512, 8192]
    - [14, 12.302]
  - - [1024, 8192, 1, 1024, 1024, 1024, 1024, 8192]
    - [48, 16.162]
  - - [1024, 8192, 1, 2048, 1024, 1024, 2048, 8192]
    - [48, 20.513]
  - - [1024, 8192, 1, 4096, 1024, 1024, 4096, 8192]
    - [72, 23.283]
  - - [1024, 8192, 1, 8192, 1024, 1024, 8192, 8192]
    - [75, 25.012]
  - - [2048, 128, 1, 128, 2048, 2048, 128, 128]
    - [143, 0.566]
  - - [2048, 128, 1, 256, 2048, 2048, 256, 128]
    - [192, 0.973]
  - - [2048, 128, 1, 512, 2048, 2048, 512, 128]
    - [189, 1.659]
  - - [2048, 128, 1, 1024, 2048, 2048, 1024, 128]
    - [192, 2.605]
  - - [2048, 128, 1, 2048, 2048, 2048, 2048, 128]
    - [189, 3.65]
  - - [2048, 128, 1, 4096, 2048, 2048, 4096, 128]
    - [189, 4.502]
  - - [2048, 128, 1, 8192, 2048, 2048, 8192, 128]
    - [188, 4.766]
  - - [2048, 256, 1, 128, 2048, 2048, 128, 256]
    - [135, 1.031]
  - - [2048, 256, 1, 256, 2048, 2048, 256, 256]
    - [176, 1.758]
  - - [2048, 256, 1, 512, 2048, 2048, 512, 256]
    - [135, 2.837]
  - - [2048, 256, 1, 1024, 2048, 2048, 1024, 256]
    - [178, 4.055]
  - - [2048, 256, 1, 2048, 2048, 2048, 2048, 256]
    - [134, 5.291]
  - - [2048, 256, 1, 4096, 2048, 2048, 4096, 256]
    - [140, 5.962]
  - - [2048, 256, 1, 8192, 2048, 2048, 8192, 256]
    - [33, 5.993]
  - - [2048, 512, 1, 128, 2048, 2048, 128, 512]
    - [119, 1.853]
  - - [2048, 512, 1, 256, 2048, 2048, 256, 512]
    - [120, 3.157]
  - - [2048, 512, 1, 512, 2048, 2048, 512, 512]
    - [166, 4.834]
  - - [2048, 512, 1, 1024, 2048, 2048, 1024, 512]
    - [120, 6.57]
  - - [2048, 512, 1, 2048, 2048, 2048, 2048, 512]
    - [163, 8.021]
  - - [2048, 512, 1, 4096, 2048, 2048, 4096, 512]
    - [171, 9.032]
  - - [2048, 512, 1, 8192, 2048, 2048, 8192, 512]
    - [41, 9.777]
  - - [2048, 1024, 1, 128, 2048, 2048, 128, 1024]
    - [60, 3.119]
  - - [2048, 1024, 1, 256, 2048, 2048, 256, 1024]
    - [106, 4.863]
  - - [2048, 1024, 1, 512, 2048, 2048, 512, 1024]
    - [112, 7.108]
  - - [2048, 1024, 1, 1024, 2048, 2048, 1024, 1024]
    - [112, 9.361]
  - - [2048, 1024, 1, 2048, 2048, 2048, 2048, 1024]
    - [99, 11.366]
  - - [2048, 1024, 1, 4096, 2048, 2048, 4096, 1024]
    - [107, 13.259]
  - - [2048, 1024, 1, 8192, 2048, 2048, 8192, 1024]
    - [104, 13.968]
  - - [2048, 2048, 1, 128, 2048, 2048, 128, 2048]
    - [157, 4.584]
  - - [2048, 2048, 1, 256, 2048, 2048, 256, 2048]
    - [79, 6.88]
  - - [2048, 2048, 1, 512, 2048, 2048, 512, 2048]
    - [80, 9.532]
  - - [2048, 2048, 1, 1024, 2048, 2048, 1024, 2048]
    - [56, 12.465]
  - - [2048, 2048, 1, 2048, 2048, 2048, 2048, 2048]
    - [91, 16.087]
  - - [2048, 2048, 1, 4096, 2048, 2048, 4096, 2048]
    - [89, 19.493]
  - - [2048, 2048, 1, 8192, 2048, 2048, 8192, 2048]
    - [92, 21.271]
  - - [2048, 4096, 1, 128, 2048, 2048, 128, 4096]
    - [12, 5.419]
  - - [2048, 4096, 1, 256, 2048, 2048, 256, 4096]
    - [13, 8.642]
  - - [2048, 4096, 1, 512, 2048, 2048, 512, 4096]
    - [18, 12.496]
  - - [2048, 4096, 1, 1024, 2048, 2048, 1024, 4096]
    - [21, 16.495]
  - - [2048, 4096, 1, 2048, 2048, 2048, 2048, 4096]
    - [75, 20.604]
  - - [2048, 4096, 1, 4096, 2048, 2048, 4096, 4096]
    - [74, 23.558]
  - - [2048, 4096, 1, 8192, 2048, 2048, 8192, 4096]
    - [73, 24.923]
  - - [2048, 8192, 1, 128, 2048, 2048, 128, 8192]
    - [24, 5.593]
  - - [2048, 8192, 1, 256, 2048, 2048, 256, 8192]
    - [13, 10.018]
  - - [2048, 8192, 1, 512, 2048, 2048, 512, 8192]
    - [6, 14.038]
  - - [2048, 8192, 1, 1024, 2048, 2048, 1024, 8192]
    - [42, 20.719]
  - - [2048, 8192, 1, 2048, 2048, 2048, 2048, 8192]
    - [45, 24.779]
  - - [2048, 8192, 1, 4096, 2048, 2048, 4096, 8192]
    - [47, 28.084]
  - - [2048, 8192, 1, 8192, 2048, 2048, 8192, 8192]
    - [47, 30.14]
  - - [4096, 128, 1, 128, 4096, 4096, 128, 128]
    - [129, 1.05]
  - - [4096, 128, 1, 256, 4096, 4096, 256, 128]
    - [180, 1.793]
  - - [4096, 128, 1, 512, 4096, 4096, 512, 128]
    - [126, 2.904]
  - - [4096, 128, 1, 1024, 4096, 4096, 1024, 128]
    - [179, 4.175]
  - - [4096, 128, 1, 2048, 4096, 4096, 2048, 128]
    - [174, 5.601]
  - - [4096, 128, 1, 4096, 4096, 4096, 4096, 128]
    - [175, 6.625]
  - - [4096, 128, 1, 8192, 4096, 4096, 8192, 128]
    - [177, 7.391]
  - - [4096, 256, 1, 128, 4096, 4096, 128, 256]
    - [123, 1.838]
  - - [4096, 256, 1, 256, 4096, 4096, 256, 256]
    - [118, 3.131]
  - - [4096, 256, 1, 512, 4096, 4096, 512, 256]
    - [167, 4.779]
  - - [4096, 256, 1, 1024, 4096, 4096, 1024, 256]
    - [169, 6.608]
  - - [4096, 256, 1, 2048, 4096, 4096, 2048, 256]
    - [163, 8.367]
  - - [4096, 256, 1, 4096, 4096, 4096, 4096, 256]
    - [167, 8.921]
  - - [4096, 256, 1, 8192, 4096, 4096, 8192, 256]
    - [166, 9.553]
  - - [4096, 512, 1, 128, 4096, 4096, 128, 512]
    - [85, 3.083]
  - - [4096, 512, 1, 256, 4096, 4096, 256, 512]
    - [106, 4.873]
  - - [4096, 512, 1, 512, 4096, 4096, 512, 512]
    - [110, 7.006]
  - - [4096, 512, 1, 1024, 4096, 4096, 1024, 512]
    - [100, 9.366]
  - - [4096, 512, 1, 2048, 4096, 4096, 2048, 512]
    - [101, 11.432]
  - - [4096, 512, 1, 4096, 4096, 4096, 4096, 512]
    - [103, 13.333]
  - - [4096, 512, 1, 8192, 4096, 4096, 8192, 512]
    - [108, 14.393]
  - - [4096, 1024, 1, 128, 4096, 4096, 128, 1024]
    - [160, 4.382]
  - - [4096, 1024, 1, 256, 4096, 4096, 256, 1024]
    - [79, 6.708]
  - - [4096, 1024, 1, 512, 4096, 4096, 512, 1024]
    - [54, 9.622]
  - - [4096, 1024, 1, 1024, 4096, 4096, 1024, 1024]
    - [55, 12.146]
  - - [4096, 1024, 1, 2048, 4096, 4096, 2048, 1024]
    - [92, 15.955]
  - - [4096, 1024, 1, 4096, 4096, 4096, 4096, 1024]
    - [92, 19.328]
  - - [4096, 1024, 1, 8192, 4096, 4096, 8192, 1024]
    - [93, 20.713]
  - - [4096, 2048, 1, 128, 4096, 4096, 128, 2048]
    - [3, 5.324]
  - - [4096, 2048, 1, 256, 4096, 4096, 256, 2048]
    - [16, 8.448]
  - - [4096, 2048, 1, 512, 4096, 4096, 512, 2048]
    - [20, 12.312]
  - - [4096, 2048, 1, 1024, 4096, 4096, 1024, 2048]
    - [50, 16.492]
  - - [4096, 2048, 1, 2048, 4096, 4096, 2048, 2048]
    - [76, 19.568]
  - - [4096, 2048, 1, 4096, 4096, 4096, 4096, 2048]
    - [73, 22.528]
  - - [4096, 2048, 1, 8192, 4096, 4096, 8192, 2048]
    - [39, 23.501]
  - - [4096, 4096, 1, 128, 4096, 4096, 128, 4096]
    - [25, 5.704]
  - - [4096, 4096, 1, 256, 4096, 4096, 256, 4096]
    - [23, 9.73]
  - - [4096, 4096, 1, 512, 4096, 4096, 512, 4096]
    - [7, 14.538]
  - - [4096, 4096, 1, 1024, 4096, 4096, 1024, 4096]
    - [46, 20.119]
  - - [4096, 4096, 1, 2048, 4096, 4096, 2048, 4096]
    - [47, 24.364]
  - - [4096, 8192, 1, 128, 4096, 4096, 128, 8192]
    - [22, 6.811]
  - - [4096, 8192, 1, 256, 4096, 4096, 256, 8192]
    - [0, 11.747]
  - - [4096, 8192, 1, 512, 4096, 4096, 512, 8192]
    - [11, 17.905]
  - - [4096, 8192, 1, 1024, 4096, 4096, 1024, 8192]
    - [43, 23.765]
  - - [4096, 8192, 1, 2048, 4096, 4096, 2048, 8192]
    - [47, 27.802]
  - - [8192, 128, 1, 128, 8192, 8192, 128, 128]
    - [117, 1.849]
  - - [8192, 128, 1, 256, 8192, 8192, 256, 128]
    - [117, 3.063]
  - - [8192, 128, 1, 512, 8192, 8192, 512, 128]
    - [165, 4.576]
  - - [8192, 128, 1, 1024, 8192, 8192, 1024, 128]
    - [121, 6.294]
  - - [8192, 128, 1, 2048, 8192, 8192, 2048, 128]
    - [168, 7.469]
  - - [8192, 128, 1, 4096, 8192, 8192, 4096, 128]
    - [164, 9.33]
  - - [8192, 128, 1, 8192, 8192, 8192, 8192, 128]
    - [167, 10.806]
  - - [8192, 256, 1, 128, 8192, 8192, 128, 256]
    - [61, 3.056]
  - - [8192, 256, 1, 256, 8192, 8192, 256, 256]
    - [111, 4.666]
  - - [8192, 256, 1, 512, 8192, 8192, 512, 256]
    - [110, 6.893]
  - - [8192, 256, 1, 1024, 8192, 8192, 1024, 256]
    - [105, 8.693]
  - - [8192, 256, 1, 2048, 8192, 8192, 2048, 256]
    - [102, 11.088]
  - - [8192, 256, 1, 4096, 8192, 8192, 4096, 256]
    - [103, 13.146]
  - - [8192, 256, 1, 8192, 8192, 8192, 8192, 256]
    - [104, 14.115]
  - - [8192, 512, 1, 128, 8192, 8192, 128, 512]
    - [157, 4.382]
  - - [8192, 512, 1, 256, 8192, 8192, 256, 512]
    - [81, 6.656]
  - - [8192, 512, 1, 512, 8192, 8192, 512, 512]
    - [53, 8.886]
  - - [8192, 512, 1, 1024, 8192, 8192, 1024, 512]
    - [87, 11.756]
  - - [8192, 512, 1, 2048, 8192, 8192, 2048, 512]
    - [90, 15.773]
  - - [8192, 512, 1, 4096, 8192, 8192, 4096, 512]
    - [159, 18.842]
  - - [8192, 512, 1, 8192, 8192, 8192, 8192, 512]
    - [90, 19.587]
  - - [8192, 1024, 1, 128, 8192, 8192, 128, 1024]
    - [28, 5.09]
  - - [8192, 1024, 1, 256, 8192, 8192, 256, 1024]
    - [19, 8.646]
  - - [8192, 1024, 1, 512, 8192, 8192, 512, 1024]
    - [17, 12.203]
  - - [8192, 1024, 1, 1024, 8192, 8192, 1024, 1024]
    - [49, 16.256]
  - - [8192, 1024, 1, 2048, 8192, 8192, 2048, 1024]
    - [51, 19.431]
  - - [8192, 1024, 1, 4096, 8192, 8192, 4096, 1024]
    - [74, 21.559]
  - - [8192, 1024, 1, 8192, 8192, 8192, 8192, 1024]
    - [76, 22.792]
  - - [8192, 2048, 1, 128, 8192, 8192, 128, 2048]
    - [26, 5.764]
  - - [8192, 2048, 1, 256, 8192, 8192, 256, 2048]
    - [15, 9.355]
  - - [8192, 2048, 1, 512, 8192, 8192, 512, 2048]
    - [1, 14.427]
  - - [8192, 2048, 1, 1024, 8192, 8192, 1024, 2048]
    - [2, 19.811]
  - - [8192, 2048, 1, 2048, 8192, 8192, 2048, 2048]
    - [44, 23.816]
  - - [8192, 2048, 1, 4096, 8192, 8192, 4096, 2048]
    - [71, 26.702]
  - - [8192, 2048, 1, 8192, 8192, 8192, 8192, 2048]
    - [47, 29.322]
  - - [8192, 4096, 1, 128, 8192, 8192, 128, 4096]
    - [29, 6.944]
  - - [8192, 4096, 1, 256, 8192, 8192, 256, 4096]
    - [4, 12.06]
  - - [8192, 4096, 1, 512, 8192, 8192, 512, 4096]
    - [8, 17.33]
  - - [8192, 4096, 1, 1024, 8192, 8192, 1024, 4096]
    - [44, 23.765]
  - - [8192, 4096, 1, 2048, 8192, 8192, 2048, 4096]
    - [47, 27.401]
  - - [8192, 8192, 1, 128, 8192, 8192, 128, 8192]
    - [9, 8.101]
  - - [8192, 8192, 1, 256, 8192, 8192, 256, 8192]
    - [5, 13.775]
  - - [8192, 8192, 1, 512, 8192, 8192, 512, 8192]
    - [44, 20.473]
  - - [8192, 8192, 1, 1024, 8192, 8192, 1024, 8192]
    - [44, 26.361]
  - - [8192, 8192, 1, 2048, 8192, 8192, 2048, 8192]
    - [44, 29.169]
  - - [4096, 4096, 1, 4096, 4096, 4096, 4096, 4096]
    - [47, 27.596]
  - - [4096, 4096, 1, 8192, 4096, 4096, 8192, 4096]
    - [44, 30.034]
  - - [4096, 8192, 1, 4096, 4096, 4096, 4096, 8192]
    - [47, 30.781]
  - - [4096, 8192, 1, 8192, 4096, 4096, 8192, 8192]
    - [47, 34.671]
  - - [8192, 4096, 1, 4096, 8192, 8192, 4096, 4096]
    - [47, 30.224]
  - - [8192, 4096, 1, 8192, 8192, 8192, 8192, 4096]
    - [44, 32.571]
  - - [8192, 8192, 1, 4096, 8192, 8192, 4096, 8192]
    - [44, 33.348]
  - - [8192, 8192, 1, 8192, 8192, 8192, 8192, 8192]
    - [47, 35.1]
  - - [1, 1, 1, 32, 1, 1, 32, 1]
    - [193, 0.0]
- null
- null
- DeviceEfficiency
- GridBased
