projects/hipblaslt/library/src/amd_detail/rocblaslt/src/Tensile/Logic/asm_full/gfx950/GridBased/gfx950_Cijk_Alik_Bljk_HHS_BH_Bias_HAS_SAV_UserArgs.yaml
- {MinimumRequiredVersion: 4.33.0}
- gfx950
- gfx950
- [Device 75a0]
    SolutionIndex: 0
    SolutionNameMin: Cijk_Alik_Bljk_HHS_BH_Bias_AS_SAV_UserArgs_MT256x256x32_MI16x16x1_SN_LDSB0_CLR0_GSU0_GSUC0_GSUWGMRR0_K1_LBSPPA512_LBSPPB512_MIWT8_8_PLR0_SU0_SUM0_SUS0_VWA8_VWB8_WGM1_WGMXCC1_WGMXCCGn1
    SolutionIndex: 1
    SolutionNameMin: Cijk_Alik_Bljk_HHS_BH_Bias_AS_SAV_UserArgs_MT256x256x32_MI16x16x1_SN_LDSB0_CLR0_GSU0_GSUC0_GSUWGMRR0_K1_LBSPPA512_LBSPPB512_MIWT8_8_PLR0_SU0_SUM0_SUS0_VWA8_VWB8_WGM1_WGMXCC1_WGMXCCGn1
    SolutionIndex: 2
    SolutionNameMin: Cijk_Alik_Bljk_HHS_BH_Bias_AS_SAV_UserArgs_MT256x256x32_MI16x16x1_SN_LDSB0_CLR0_GSU0_GSUC0_GSUWGMRR0_K1_LBSPPA512_LBSPPB512_MIWT8_8_PLR0_SU0_SUM0_SUS0_VWA8_VWB8_WGM6_WGMXCC1_WGMXCCGn1
    SolutionIndex: 3
    SolutionNameMin: Cijk_Alik_Bljk_HHS_BH_Bias_AS_SAV_UserArgs_MT256x256x32_MI16x16x1_SN_LDSB0_CLR0_GSU0_GSUC0_GSUWGMRR0_K1_LBSPPA512_LBSPPB512_MIWT8_8_PLR0_SU0_SUM0_SUS0_VWA8_VWB8_WGM6_WGMXCC1_WGMXCCGn1
    SolutionIndex: 4
    SolutionNameMin: Cijk_Alik_Bljk_HHS_BH_Bias_AS_SAV_UserArgs_MT256x256x32_MI16x16x1_SN_LDSB0_CLR0_GSU0_GSUC0_GSUWGMRR0_K1_LBSPPA512_LBSPPB512_MIWT8_8_PLR0_SU0_SUM0_SUS0_VWA8_VWB8_WGM6_WGMXCC1_WGMXCCGn1
    SolutionIndex: 5
    SolutionNameMin: Cijk_Alik_Bljk_HHS_BH_Bias_AS_SAV_UserArgs_MT256x128x32_MI16x16x1_SN_LDSB1_CLR0_GSU0_GSUC0_GSUWGMRR0_K1_LBSPPA512_LBSPPB256_MIWT8_4_PLR0_SU0_SUM0_SUS0_VWA8_VWB4_WGM6_WGMXCC1_WGMXCCGn1
    SolutionIndex: 6
    SolutionNameMin: Cijk_Alik_Bljk_HHS_BH_Bias_AS_SAV_UserArgs_MT256x128x32_MI16x16x1_SN_LDSB1_CLR0_GSU0_GSUC0_GSUWGMRR0_K1_LBSPPA512_LBSPPB256_MIWT8_4_PLR0_SU0_SUM0_SUS0_VWA8_VWB4_WGM6_WGMXCC1_WGMXCCGn1
    SolutionIndex: 7
    SolutionNameMin: Cijk_Alik_Bljk_HHS_BH_Bias_AS_SAV_UserArgs_MT256x128x32_MI16x16x1_SN_LDSB1_CLR0_GSU0_GSUC0_GSUWGMRR0_K1_LBSPPA512_LBSPPB256_MIWT8_4_PLR0_SU0_SUM0_SUS0_VWA8_VWB4_WGM6_WGMXCC1_WGMXCCGn1
    SolutionIndex: 8
    SolutionNameMin: Cijk_Alik_Bljk_HHS_BH_Bias_AS_SAV_UserArgs_MT256x128x32_MI16x16x1_SN_LDSB1_CLR0_GSU0_GSUC0_GSUWGMRR0_K1_LBSPPA512_LBSPPB256_MIWT8_4_PLR0_SU0_SUM0_SUS0_VWA8_VWB4_WGM8_WGMXCC1_WGMXCCGn1
    SolutionIndex: 9
    SolutionNameMin: Cijk_Alik_Bljk_HHS_BH_Bias_AS_SAV_UserArgs_MT256x128x32_MI16x16x1_SN_LDSB1_CLR0_GSU0_GSUC0_GSUWGMRR0_K1_LBSPPA512_LBSPPB256_MIWT8_4_PLR0_SU0_SUM0_SUS0_VWA8_VWB4_WGM8_WGMXCC1_WGMXCCGn1
    SolutionIndex: 10
    SolutionNameMin: Cijk_Alik_Bljk_HHS_BH_Bias_AS_SAV_UserArgs_MT256x128x32_MI16x16x1_SN_LDSB1_CLR0_GSU0_GSUC0_GSUWGMRR0_K1_LBSPPA512_LBSPPB256_MIWT8_4_PLR0_SU0_SUM0_SUS0_VWA8_VWB4_WGM8_WGMXCC1_WGMXCCGn1
    SolutionIndex: 11
    SolutionNameMin: Cijk_Alik_Bljk_HHS_BH_Bias_AS_SAV_UserArgs_MT256x256x64_MI16x16x1_SN_LDSB1_CLR1_GSU0_GSUC0_GSUWGMRR0_K1_LBSPPA1024_LBSPPB1024_MIWT8_8_PLR1_SU0_SUM0_SUS0_VWA8_VWB8_WGM1_WGMXCC1_WGMXCCGn1
    SolutionIndex: 12
    SolutionNameMin: Cijk_Alik_Bljk_HHS_BH_Bias_AS_SAV_UserArgs_MT256x256x64_MI16x16x1_SN_LDSB1_CLR1_GSU0_GSUC0_GSUWGMRR0_K1_LBSPPA1024_LBSPPB1024_MIWT8_8_PLR1_SU0_SUM0_SUS0_VWA8_VWB8_WGM1_WGMXCC1_WGMXCCGn1
    SolutionIndex: 13
    SolutionNameMin: Cijk_Alik_Bljk_HHS_BH_Bias_AS_SAV_UserArgs_MT256x256x64_MI16x16x1_SN_LDSB1_CLR1_GSU0_GSUC0_GSUWGMRR0_K1_LBSPPA1024_LBSPPB1024_MIWT8_8_PLR1_SU0_SUM0_SUS0_VWA8_VWB8_WGM1_WGMXCC1_WGMXCCGn1
    SolutionIndex: 14
    SolutionNameMin: Cijk_Alik_Bljk_HHS_BH_Bias_AS_SAV_UserArgs_MT256x256x64_MI16x16x1_SN_LDSB1_CLR1_GSU0_GSUC0_GSUWGMRR0_K1_LBSPPA1024_LBSPPB1024_MIWT8_8_PLR1_SU0_SUM0_SUS0_VWA8_VWB8_WGM1_WGMXCC1_WGMXCCGn1
    SolutionIndex: 15
    SolutionNameMin: Cijk_Alik_Bljk_HHS_BH_Bias_AS_SAV_UserArgs_MT256x256x64_MI16x16x1_SN_LDSB1_CLR1_GSU0_GSUC0_GSUWGMRR0_K1_LBSPPA1024_LBSPPB1024_MIWT8_8_PLR1_SU0_SUM0_SUS0_VWA8_VWB8_WGM6_WGMXCC1_WGMXCCGn1
    SolutionIndex: 16
    SolutionNameMin: Cijk_Alik_Bljk_HHS_BH_Bias_AS_SAV_UserArgs_MT256x256x64_MI16x16x1_SN_LDSB1_CLR1_GSU0_GSUC0_GSUWGMRR0_K1_LBSPPA1024_LBSPPB1024_MIWT8_8_PLR1_SU0_SUM0_SUS0_VWA8_VWB8_WGM6_WGMXCC1_WGMXCCGn1
    SolutionIndex: 17
    SolutionNameMin: Cijk_Alik_Bljk_HHS_BH_Bias_AS_SAV_UserArgs_MT256x256x64_MI16x16x1_SN_LDSB1_CLR1_GSU0_GSUC0_GSUWGMRR0_K1_LBSPPA1024_LBSPPB1024_MIWT8_8_PLR1_SU0_SUM0_SUS0_VWA8_VWB8_WGM6_WGMXCC1_WGMXCCGn1
    SolutionIndex: 18
    SolutionNameMin: Cijk_Alik_Bljk_HHS_BH_Bias_AS_SAV_UserArgs_MT256x256x64_MI16x16x1_SN_LDSB1_CLR1_GSU0_GSUC0_GSUWGMRR0_K1_LBSPPA1024_LBSPPB1024_MIWT8_8_PLR1_SU0_SUM0_SUS0_VWA8_VWB8_WGM8_WGMXCC1_WGMXCCGn1
    SolutionIndex: 19
    SolutionNameMin: Cijk_Alik_Bljk_HHS_BH_Bias_AS_SAV_UserArgs_MT256x256x64_MI16x16x1_SN_LDSB1_CLR1_GSU0_GSUC0_GSUWGMRR0_K1_LBSPPA1024_LBSPPB1024_MIWT8_8_PLR1_SU0_SUM0_SUS0_VWA8_VWB8_WGM8_WGMXCC1_WGMXCCGn1
    SolutionIndex: 20
    SolutionNameMin: Cijk_Alik_Bljk_HHS_BH_Bias_AS_SAV_UserArgs_MT256x256x64_MI16x16x1_SN_LDSB1_CLR1_GSU0_GSUC0_GSUWGMRR0_K1_LBSPPA1024_LBSPPB1024_MIWT8_8_PLR1_SU0_SUM0_SUS0_VWA8_VWB8_WGM8_WGMXCC1_WGMXCCGn1
    SolutionIndex: 21
    SolutionNameMin: Cijk_Alik_Bljk_HHS_BH_Bias_AS_SAV_UserArgs_MT256x256x64_MI16x16x1_SN_LDSB1_CLR1_GSU0_GSUC0_GSUWGMRR0_K1_LBSPPA1024_LBSPPB1024_MIWT8_8_PLR1_SU0_SUM0_SUS0_VWA8_VWB8_WGM8_WGMXCC1_WGMXCCGn1
    SolutionIndex: 22
    SolutionNameMin: Cijk_Alik_Bljk_HHS_BH_Bias_AS_SAV_UserArgs_MT128x256x64_MI16x16x1_SN_LDSB1_CLR1_GSU0_GSUC0_GSUWGMRR0_K1_LBSPPA512_LBSPPB1024_MIWT4_8_PLR1_SU0_SUM0_SUS0_VWA4_VWB8_WGM1_WGMXCC1_WGMXCCGn1
    SolutionIndex: 23
    SolutionNameMin: Cijk_Alik_Bljk_HHS_BH_Bias_AS_SAV_UserArgs_MT128x256x64_MI16x16x1_SN_LDSB1_CLR1_GSU0_GSUC0_GSUWGMRR0_K1_LBSPPA512_LBSPPB1024_MIWT4_8_PLR1_SU0_SUM0_SUS0_VWA4_VWB8_WGM6_WGMXCC1_WGMXCCGn1
    SolutionIndex: 24
    SolutionNameMin: Cijk_Alik_Bljk_HHS_BH_Bias_AS_SAV_UserArgs_MT256x128x64_MI16x16x1_SN_LDSB1_CLR1_GSU0_GSUC0_GSUWGMRR0_K1_LBSPPA1024_LBSPPB512_MIWT8_4_PLR1_SU0_SUM0_SUS0_VWA8_VWB4_WGM1_WGMXCC1_WGMXCCGn1
    SolutionIndex: 25
    SolutionNameMin: Cijk_Alik_Bljk_HHS_BH_Bias_AS_SAV_UserArgs_MT256x128x64_MI16x16x1_SN_LDSB1_CLR1_GSU0_GSUC0_GSUWGMRR0_K1_LBSPPA1024_LBSPPB512_MIWT8_4_PLR1_SU0_SUM0_SUS0_VWA8_VWB4_WGM1_WGMXCC1_WGMXCCGn1
    SolutionIndex: 26
    SolutionNameMin: Cijk_Alik_Bljk_HHS_BH_Bias_AS_SAV_UserArgs_MT256x128x64_MI16x16x1_SN_LDSB1_CLR1_GSU0_GSUC0_GSUWGMRR0_K1_LBSPPA1024_LBSPPB512_MIWT8_4_PLR1_SU0_SUM0_SUS0_VWA8_VWB4_WGM1_WGMXCC1_WGMXCCGn1
    SolutionIndex: 27
    SolutionNameMin: Cijk_Alik_Bljk_HHS_BH_Bias_AS_SAV_UserArgs_MT256x128x64_MI16x16x1_SN_LDSB1_CLR1_GSU0_GSUC0_GSUWGMRR0_K1_LBSPPA1024_LBSPPB512_MIWT8_4_PLR1_SU0_SUM0_SUS0_VWA8_VWB4_WGM1_WGMXCC1_WGMXCCGn1
    SolutionIndex: 28
    SolutionNameMin: Cijk_Alik_Bljk_HHS_BH_Bias_AS_SAV_UserArgs_MT256x128x64_MI16x16x1_SN_LDSB1_CLR1_GSU0_GSUC0_GSUWGMRR0_K1_LBSPPA1024_LBSPPB512_MIWT8_4_PLR1_SU0_SUM0_SUS0_VWA8_VWB4_WGM1_WGMXCC1_WGMXCCGn1
    SolutionIndex: 29
    SolutionNameMin: Cijk_Alik_Bljk_HHS_BH_Bias_AS_SAV_UserArgs_MT256x128x64_MI16x16x1_SN_LDSB1_CLR1_GSU0_GSUC0_GSUWGMRR0_K1_LBSPPA1024_LBSPPB512_MIWT8_4_PLR1_SU0_SUM0_SUS0_VWA8_VWB4_WGM6_WGMXCC1_WGMXCCGn1
    SolutionIndex: 30
    SolutionNameMin: Cijk_Alik_Bljk_HHS_BH_Bias_AS_SAV_UserArgs_MT256x128x64_MI16x16x1_SN_LDSB1_CLR1_GSU0_GSUC0_GSUWGMRR0_K1_LBSPPA1024_LBSPPB512_MIWT8_4_PLR1_SU0_SUM0_SUS0_VWA8_VWB4_WGM6_WGMXCC1_WGMXCCGn1
    SolutionIndex: 31
    SolutionNameMin: Cijk_Alik_Bljk_HHS_BH_Bias_AS_SAV_UserArgs_MT256x128x64_MI16x16x1_SN_LDSB1_CLR1_GSU0_GSUC0_GSUWGMRR0_K1_LBSPPA1024_LBSPPB512_MIWT8_4_PLR1_SU0_SUM0_SUS0_VWA8_VWB4_WGM6_WGMXCC1_WGMXCCGn1
    SolutionIndex: 32
    SolutionNameMin: Cijk_Alik_Bljk_HHS_BH_Bias_AS_SAV_UserArgs_MT256x128x64_MI16x16x1_SN_LDSB1_CLR1_GSU0_GSUC0_GSUWGMRR0_K1_LBSPPA1024_LBSPPB512_MIWT8_4_PLR1_SU0_SUM0_SUS0_VWA8_VWB4_WGM6_WGMXCC1_WGMXCCGn1
    SolutionIndex: 33
    SolutionNameMin: Cijk_Alik_Bljk_HHS_BH_Bias_AS_SAV_UserArgs_MT256x128x64_MI16x16x1_SN_LDSB1_CLR1_GSU0_GSUC0_GSUWGMRR0_K1_LBSPPA1024_LBSPPB512_MIWT8_4_PLR1_SU0_SUM0_SUS0_VWA8_VWB4_WGM6_WGMXCC1_WGMXCCGn1
    SolutionIndex: 34
    SolutionNameMin: Cijk_Alik_Bljk_HHS_BH_Bias_AS_SAV_UserArgs_MT256x128x64_MI16x16x1_SN_LDSB1_CLR1_GSU0_GSUC0_GSUWGMRR0_K1_LBSPPA1024_LBSPPB512_MIWT8_4_PLR1_SU0_SUM0_SUS0_VWA8_VWB4_WGM8_WGMXCC1_WGMXCCGn1
    SolutionIndex: 35
    SolutionNameMin: Cijk_Alik_Bljk_HHS_BH_Bias_AS_SAV_UserArgs_MT256x128x64_MI16x16x1_SN_LDSB1_CLR1_GSU0_GSUC0_GSUWGMRR0_K1_LBSPPA1024_LBSPPB512_MIWT8_4_PLR1_SU0_SUM0_SUS0_VWA8_VWB4_WGM8_WGMXCC1_WGMXCCGn1
    SolutionIndex: 36
    SolutionNameMin: Cijk_Alik_Bljk_HHS_BH_Bias_AS_SAV_UserArgs_MT256x128x64_MI16x16x1_SN_LDSB1_CLR1_GSU0_GSUC0_GSUWGMRR0_K1_LBSPPA1024_LBSPPB512_MIWT8_4_PLR1_SU0_SUM0_SUS0_VWA8_VWB4_WGM8_WGMXCC1_WGMXCCGn1
    SolutionIndex: 37
    SolutionNameMin: Cijk_Alik_Bljk_HHS_BH_Bias_AS_SAV_UserArgs_MT256x128x64_MI16x16x1_SN_LDSB1_CLR1_GSU0_GSUC0_GSUWGMRR0_K1_LBSPPA1024_LBSPPB512_MIWT8_4_PLR1_SU0_SUM0_SUS0_VWA8_VWB4_WGM8_WGMXCC1_WGMXCCGn1
    SolutionIndex: 38
    SolutionNameMin: Cijk_Alik_Bljk_HHS_BH_Bias_AS_SAV_UserArgs_MT128x128x64_MI16x16x1_SN_LDSB1_CLR1_GSU0_GSUC0_GSUWGMRR0_K1_LBSPPA512_LBSPPB512_MIWT4_4_PLR1_SU0_SUM0_SUS0_VWA4_VWB4_WGM1_WGMXCC1_WGMXCCGn1
    SolutionIndex: 39
    SolutionNameMin: Cijk_Alik_Bljk_HHS_BH_Bias_AS_SAV_UserArgs_MT128x128x64_MI16x16x1_SN_LDSB1_CLR1_GSU0_GSUC0_GSUWGMRR0_K1_LBSPPA512_LBSPPB512_MIWT4_4_PLR1_SU0_SUM0_SUS0_VWA4_VWB4_WGM1_WGMXCC1_WGMXCCGn1
    SolutionIndex: 40
    SolutionNameMin: Cijk_Alik_Bljk_HHS_BH_Bias_AS_SAV_UserArgs_MT128x128x64_MI16x16x1_SN_LDSB1_CLR1_GSU0_GSUC0_GSUWGMRR0_K1_LBSPPA512_LBSPPB512_MIWT4_4_PLR1_SU0_SUM0_SUS0_VWA4_VWB4_WGM1_WGMXCC1_WGMXCCGn1
    SolutionIndex: 41
    SolutionNameMin: Cijk_Alik_Bljk_HHS_BH_Bias_AS_SAV_UserArgs_MT128x128x64_MI16x16x1_SN_LDSB1_CLR1_GSU0_GSUC0_GSUWGMRR0_K1_LBSPPA512_LBSPPB512_MIWT4_4_PLR1_SU0_SUM0_SUS0_VWA4_VWB4_WGM1_WGMXCC1_WGMXCCGn1
    SolutionIndex: 42
    SolutionNameMin: Cijk_Alik_Bljk_HHS_BH_Bias_AS_SAV_UserArgs_MT128x128x64_MI16x16x1_SN_LDSB1_CLR1_GSU0_GSUC0_GSUWGMRR0_K1_LBSPPA512_LBSPPB512_MIWT4_4_PLR1_SU0_SUM0_SUS0_VWA4_VWB4_WGM1_WGMXCC1_WGMXCCGn1
    SolutionIndex: 43
    SolutionNameMin: Cijk_Alik_Bljk_HHS_BH_Bias_AS_SAV_UserArgs_MT128x128x64_MI16x16x1_SN_LDSB1_CLR1_GSU0_GSUC0_GSUWGMRR0_K1_LBSPPA512_LBSPPB512_MIWT4_4_PLR1_SU0_SUM0_SUS0_VWA4_VWB4_WGM1_WGMXCC1_WGMXCCGn1
    SolutionIndex: 44
    SolutionNameMin: Cijk_Alik_Bljk_HHS_BH_Bias_AS_SAV_UserArgs_MT128x128x64_MI16x16x1_SN_LDSB1_CLR1_GSU0_GSUC0_GSUWGMRR0_K1_LBSPPA512_LBSPPB512_MIWT4_4_PLR1_SU0_SUM0_SUS0_VWA4_VWB4_WGM6_WGMXCC1_WGMXCCGn1
    SolutionIndex: 45
    SolutionNameMin: Cijk_Alik_Bljk_HHS_BH_Bias_AS_SAV_UserArgs_MT128x128x64_MI16x16x1_SN_LDSB1_CLR1_GSU0_GSUC0_GSUWGMRR0_K1_LBSPPA512_LBSPPB512_MIWT4_4_PLR1_SU0_SUM0_SUS0_VWA4_VWB4_WGM6_WGMXCC1_WGMXCCGn1
    SolutionIndex: 46
    SolutionNameMin: Cijk_Alik_Bljk_HHS_BH_Bias_AS_SAV_UserArgs_MT128x128x64_MI16x16x1_SN_LDSB1_CLR1_GSU0_GSUC0_GSUWGMRR0_K1_LBSPPA512_LBSPPB512_MIWT4_4_PLR1_SU0_SUM0_SUS0_VWA4_VWB4_WGM8_WGMXCC1_WGMXCCGn1
    SolutionIndex: 47
    SolutionNameMin: Cijk_Alik_Bljk_HHS_BH_Bias_AS_SAV_UserArgs_MT128x128x64_MI16x16x1_SN_LDSB1_CLR1_GSU0_GSUC0_GSUWGMRR0_K1_LBSPPA512_LBSPPB512_MIWT4_4_PLR1_SU0_SUM0_SUS0_VWA4_VWB4_WGM8_WGMXCC1_WGMXCCGn1
    SolutionIndex: 48
    SolutionNameMin: Cijk_Alik_Bljk_HHS_BH_Bias_AS_SAV_UserArgs_MT128x128x64_MI16x16x1_SN_LDSB1_CLR1_GSU0_GSUC0_GSUWGMRR0_K1_LBSPPA512_LBSPPB512_MIWT4_4_PLR1_SU0_SUM0_SUS0_VWA4_VWB4_WGM8_WGMXCC1_WGMXCCGn1
    SolutionIndex: 49
    SolutionNameMin: Cijk_Alik_Bljk_HHS_BH_Bias_AS_SAV_UserArgs_MT128x128x64_MI16x16x1_SN_LDSB1_CLR1_GSU0_GSUC0_GSUWGMRR0_K1_LBSPPA512_LBSPPB512_MIWT4_4_PLR1_SU0_SUM0_SUS0_VWA4_VWB4_WGM8_WGMXCC1_WGMXCCGn1
    SolutionIndex: 50
    SolutionNameMin: Cijk_Alik_Bljk_HHS_BH_Bias_AS_SAV_UserArgs_MT128x128x64_MI16x16x1_SN_LDSB1_CLR1_GSU0_GSUC0_GSUWGMRR0_K1_LBSPPA512_LBSPPB512_MIWT4_4_PLR1_SU0_SUM0_SUS0_VWA4_VWB4_WGM8_WGMXCC1_WGMXCCGn1
    SolutionIndex: 51
    SolutionNameMin: Cijk_Alik_Bljk_HHS_BH_Bias_AS_SAV_UserArgs_MT128x128x64_MI16x16x1_SN_LDSB1_CLR1_GSU0_GSUC0_GSUWGMRR0_K1_LBSPPA512_LBSPPB512_MIWT4_4_PLR1_SU0_SUM0_SUS0_VWA4_VWB4_WGM8_WGMXCC1_WGMXCCGn1
    SolutionIndex: 52
    SolutionNameMin: Cijk_Alik_Bljk_HHS_BH_Bias_AS_SAV_UserArgs_MT128x128x64_MI16x16x1_SN_LDSB1_CLR1_GSU0_GSUC0_GSUWGMRR0_K1_LBSPPA512_LBSPPB512_MIWT4_4_PLR1_SU0_SUM0_SUS0_VWA4_VWB4_WGM8_WGMXCC1_WGMXCCGn1
    SolutionIndex: 53
    SolutionNameMin: Cijk_Alik_Bljk_HHS_BH_Bias_AS_SAV_UserArgs_MT64x128x64_MI16x16x1_SN_LDSB1_CLR1_GSU0_GSUC0_GSUWGMRR0_K1_LBSPPA256_LBSPPB512_MIWT2_4_PLR1_SU0_SUM0_SUS0_VWA2_VWB4_WGM1_WGMXCC1_WGMXCCGn1
    SolutionIndex: 54
    SolutionNameMin: Cijk_Alik_Bljk_HHS_BH_Bias_AS_SAV_UserArgs_MT64x128x64_MI16x16x1_SN_LDSB1_CLR1_GSU0_GSUC0_GSUWGMRR0_K1_LBSPPA256_LBSPPB512_MIWT2_4_PLR1_SU0_SUM0_SUS0_VWA2_VWB4_WGM1_WGMXCC1_WGMXCCGn1
    SolutionIndex: 55
    SolutionNameMin: Cijk_Alik_Bljk_HHS_BH_Bias_AS_SAV_UserArgs_MT64x128x64_MI16x16x1_SN_LDSB1_CLR1_GSU0_GSUC0_GSUWGMRR0_K1_LBSPPA256_LBSPPB512_MIWT2_4_PLR1_SU0_SUM0_SUS0_VWA2_VWB4_WGM6_WGMXCC1_WGMXCCGn1
    SolutionIndex: 56
    SolutionNameMin: Cijk_Alik_Bljk_HHS_BH_Bias_AS_SAV_UserArgs_MT64x128x64_MI16x16x1_SN_LDSB1_CLR1_GSU0_GSUC0_GSUWGMRR0_K1_LBSPPA256_LBSPPB512_MIWT2_4_PLR1_SU0_SUM0_SUS0_VWA2_VWB4_WGM6_WGMXCC1_WGMXCCGn1
    SolutionIndex: 57
    SolutionNameMin: Cijk_Alik_Bljk_HHS_BH_Bias_AS_SAV_UserArgs_MT64x128x64_MI16x16x1_SN_LDSB1_CLR1_GSU0_GSUC0_GSUWGMRR0_K1_LBSPPA256_LBSPPB512_MIWT2_4_PLR1_SU0_SUM0_SUS0_VWA2_VWB4_WGM8_WGMXCC1_WGMXCCGn1
    SolutionIndex: 58
    SolutionNameMin: Cijk_Alik_Bljk_HHS_BH_Bias_AS_SAV_UserArgs_MT64x128x64_MI16x16x1_SN_LDSB1_CLR1_GSU0_GSUC0_GSUWGMRR0_K1_LBSPPA256_LBSPPB512_MIWT2_4_PLR1_SU0_SUM0_SUS0_VWA2_VWB4_WGM8_WGMXCC1_WGMXCCGn1
    SolutionIndex: 59
    SolutionNameMin: Cijk_Alik_Bljk_HHS_BH_Bias_AS_SAV_UserArgs_MT128x64x64_MI16x16x1_SN_LDSB1_CLR1_GSU0_GSUC0_GSUWGMRR0_K1_LBSPPA512_LBSPPB256_MIWT4_2_PLR1_SU0_SUM0_SUS0_VWA4_VWB2_WGM1_WGMXCC1_WGMXCCGn1
    SolutionIndex: 60
    SolutionNameMin: Cijk_Alik_Bljk_HHS_BH_Bias_AS_SAV_UserArgs_MT128x64x64_MI16x16x1_SN_LDSB1_CLR1_GSU0_GSUC0_GSUWGMRR0_K1_LBSPPA512_LBSPPB256_MIWT4_2_PLR1_SU0_SUM0_SUS0_VWA4_VWB2_WGM1_WGMXCC1_WGMXCCGn1
    SolutionIndex: 61
    SolutionNameMin: Cijk_Alik_Bljk_HHS_BH_Bias_AS_SAV_UserArgs_MT128x64x64_MI16x16x1_SN_LDSB1_CLR1_GSU0_GSUC0_GSUWGMRR0_K1_LBSPPA512_LBSPPB256_MIWT4_2_PLR1_SU0_SUM0_SUS0_VWA4_VWB2_WGM6_WGMXCC1_WGMXCCGn1
    SolutionIndex: 62
    SolutionNameMin: Cijk_Alik_Bljk_HHS_BH_Bias_AS_SAV_UserArgs_MT128x64x64_MI16x16x1_SN_LDSB1_CLR1_GSU0_GSUC0_GSUWGMRR0_K1_LBSPPA512_LBSPPB256_MIWT4_2_PLR1_SU0_SUM0_SUS0_VWA4_VWB2_WGM6_WGMXCC1_WGMXCCGn1
    SolutionIndex: 63
    SolutionNameMin: Cijk_Alik_Bljk_HHS_BH_Bias_AS_SAV_UserArgs_MT128x64x64_MI16x16x1_SN_LDSB1_CLR1_GSU0_GSUC0_GSUWGMRR0_K1_LBSPPA512_LBSPPB256_MIWT4_2_PLR1_SU0_SUM0_SUS0_VWA4_VWB2_WGM8_WGMXCC1_WGMXCCGn1
    SolutionIndex: 64
    SolutionNameMin: Cijk_Alik_Bljk_HHS_BH_Bias_AS_SAV_UserArgs_MT128x64x64_MI16x16x1_SN_LDSB1_CLR1_GSU0_GSUC0_GSUWGMRR0_K1_LBSPPA512_LBSPPB256_MIWT4_2_PLR1_SU0_SUM0_SUS0_VWA4_VWB2_WGM8_WGMXCC1_WGMXCCGn1
    SolutionIndex: 65
    SolutionNameMin: Cijk_Alik_Bljk_HHS_BH_Bias_AS_SAV_UserArgs_MT128x64x64_MI16x16x1_SN_LDSB1_CLR1_GSU0_GSUC0_GSUWGMRR0_K1_LBSPPA512_LBSPPB256_MIWT4_2_PLR1_SU0_SUM0_SUS0_VWA4_VWB2_WGM8_WGMXCC1_WGMXCCGn1
    SolutionIndex: 66
    SolutionNameMin: Cijk_Alik_Bljk_HHS_BH_Bias_AS_SAV_UserArgs_MT128x128x64_MI32x32x1_SN_LDSB1_CLR1_GSU0_GSUC0_GSUWGMRR0_K1_LBSPPA256_LBSPPB256_MIWT2_2_PLR1_SU0_SUM0_SUS0_VWA2_VWB2_WGM8_WGMXCC1_WGMXCCGn1
    SolutionIndex: 67
    SolutionNameMin: Cijk_Alik_Bljk_HHS_BH_Bias_AS_SAV_UserArgs_MT128x128x128_MI16x16x1_SN_LDSB1_CLR1_GSU0_GSUC0_GSUWGMRR0_K1_LBSPPA1024_LBSPPB1024_MIWT4_4_PLR1_SU0_SUM0_SUS0_VWA4_VWB4_WGM1_WGMXCC1_WGMXCCGn1
    SolutionIndex: 68
    SolutionNameMin: Cijk_Alik_Bljk_HHS_BH_Bias_AS_SAV_UserArgs_MT128x128x128_MI16x16x1_SN_LDSB1_CLR1_GSU0_GSUC0_GSUWGMRR0_K1_LBSPPA1024_LBSPPB1024_MIWT4_4_PLR1_SU0_SUM0_SUS0_VWA4_VWB4_WGM1_WGMXCC1_WGMXCCGn1
    SolutionIndex: 69
    SolutionNameMin: Cijk_Alik_Bljk_HHS_BH_Bias_AS_SAV_UserArgs_MT128x128x128_MI16x16x1_SN_LDSB1_CLR1_GSU0_GSUC0_GSUWGMRR0_K1_LBSPPA1024_LBSPPB1024_MIWT4_4_PLR1_SU0_SUM0_SUS0_VWA4_VWB4_WGM6_WGMXCC1_WGMXCCGn1
    SolutionIndex: 70
    SolutionNameMin: Cijk_Alik_Bljk_HHS_BH_Bias_AS_SAV_UserArgs_MT128x128x128_MI16x16x1_SN_LDSB1_CLR1_GSU0_GSUC0_GSUWGMRR0_K1_LBSPPA1024_LBSPPB1024_MIWT4_4_PLR1_SU0_SUM0_SUS0_VWA4_VWB4_WGM8_WGMXCC1_WGMXCCGn1
    SolutionIndex: 71
    SolutionNameMin: Cijk_Alik_Bljk_HHS_BH_Bias_AS_SAV_UserArgs_MT64x128x128_MI16x16x1_SN_LDSB1_CLR1_GSU0_GSUC0_GSUWGMRR0_K1_LBSPPA512_LBSPPB1024_MIWT2_4_PLR1_SU0_SUM0_SUS0_VWA2_VWB4_WGM1_WGMXCC1_WGMXCCGn1
    SolutionIndex: 72
    SolutionNameMin: Cijk_Alik_Bljk_HHS_BH_Bias_AS_SAV_UserArgs_MT64x128x128_MI16x16x1_SN_LDSB1_CLR1_GSU0_GSUC0_GSUWGMRR0_K1_LBSPPA512_LBSPPB1024_MIWT2_4_PLR1_SU0_SUM0_SUS0_VWA2_VWB4_WGM1_WGMXCC1_WGMXCCGn1
    SolutionIndex: 73
    SolutionNameMin: Cijk_Alik_Bljk_HHS_BH_Bias_AS_SAV_UserArgs_MT64x128x128_MI16x16x1_SN_LDSB1_CLR1_GSU0_GSUC0_GSUWGMRR0_K1_LBSPPA512_LBSPPB1024_MIWT2_4_PLR1_SU0_SUM0_SUS0_VWA2_VWB4_WGM1_WGMXCC1_WGMXCCGn1
    SolutionIndex: 74
    SolutionNameMin: Cijk_Alik_Bljk_HHS_BH_Bias_AS_SAV_UserArgs_MT64x128x128_MI16x16x1_SN_LDSB1_CLR1_GSU0_GSUC0_GSUWGMRR0_K1_LBSPPA512_LBSPPB1024_MIWT2_4_PLR1_SU0_SUM0_SUS0_VWA2_VWB4_WGM1_WGMXCC1_WGMXCCGn1
    SolutionIndex: 75
    SolutionNameMin: Cijk_Alik_Bljk_HHS_BH_Bias_AS_SAV_UserArgs_MT64x128x128_MI16x16x1_SN_LDSB1_CLR1_GSU0_GSUC0_GSUWGMRR0_K1_LBSPPA512_LBSPPB1024_MIWT2_4_PLR1_SU0_SUM0_SUS0_VWA2_VWB4_WGM8_WGMXCC1_WGMXCCGn1
    SolutionIndex: 76
    SolutionNameMin: Cijk_Alik_Bljk_HHS_BH_Bias_AS_SAV_UserArgs_MT128x64x128_MI16x16x1_SN_LDSB1_CLR1_GSU0_GSUC0_GSUWGMRR0_K1_LBSPPA1024_LBSPPB512_MIWT4_2_PLR1_SU0_SUM0_SUS0_VWA4_VWB2_WGM1_WGMXCC1_WGMXCCGn1
    SolutionIndex: 77
    SolutionNameMin: Cijk_Alik_Bljk_HHS_BH_Bias_AS_SAV_UserArgs_MT128x64x128_MI16x16x1_SN_LDSB1_CLR1_GSU0_GSUC0_GSUWGMRR0_K1_LBSPPA1024_LBSPPB512_MIWT4_2_PLR1_SU0_SUM0_SUS0_VWA4_VWB2_WGM1_WGMXCC1_WGMXCCGn1
    SolutionIndex: 78
    SolutionNameMin: Cijk_Alik_Bljk_HHS_BH_Bias_AS_SAV_UserArgs_MT128x64x128_MI16x16x1_SN_LDSB1_CLR1_GSU0_GSUC0_GSUWGMRR0_K1_LBSPPA1024_LBSPPB512_MIWT4_2_PLR1_SU0_SUM0_SUS0_VWA4_VWB2_WGM6_WGMXCC1_WGMXCCGn1
    SolutionIndex: 79
    SolutionNameMin: Cijk_Alik_Bljk_HHS_BH_Bias_AS_SAV_UserArgs_MT128x64x128_MI16x16x1_SN_LDSB1_CLR1_GSU0_GSUC0_GSUWGMRR0_K1_LBSPPA1024_LBSPPB512_MIWT4_2_PLR1_SU0_SUM0_SUS0_VWA4_VWB2_WGM8_WGMXCC1_WGMXCCGn1
    SolutionIndex: 80
    SolutionNameMin: Cijk_Alik_Bljk_HHS_BH_Bias_AS_SAV_UserArgs_MT128x64x128_MI16x16x1_SN_LDSB1_CLR1_GSU0_GSUC0_GSUWGMRR0_K1_LBSPPA1024_LBSPPB512_MIWT4_2_PLR1_SU0_SUM0_SUS0_VWA4_VWB2_WGM8_WGMXCC1_WGMXCCGn1
    SolutionIndex: 81
    SolutionNameMin: Cijk_Alik_Bljk_HHS_BH_Bias_AS_SAV_UserArgs_MT64x64x128_MI16x16x1_SN_LDSB1_CLR1_GSU0_GSUC0_GSUWGMRR0_K1_LBSPPA512_LBSPPB512_MIWT2_2_PLR1_SU0_SUM0_SUS0_VWA2_VWB2_WGM1_WGMXCC1_WGMXCCGn1
    SolutionIndex: 82
    SolutionNameMin: Cijk_Alik_Bljk_HHS_BH_Bias_AS_SAV_UserArgs_MT64x64x128_MI16x16x1_SN_LDSB1_CLR1_GSU0_GSUC0_GSUWGMRR0_K1_LBSPPA512_LBSPPB512_MIWT2_2_PLR1_SU0_SUM0_SUS0_VWA2_VWB2_WGM1_WGMXCC1_WGMXCCGn1
    SolutionIndex: 83
    SolutionNameMin: Cijk_Alik_Bljk_HHS_BH_Bias_AS_SAV_UserArgs_MT64x64x128_MI16x16x1_SN_LDSB1_CLR1_GSU0_GSUC0_GSUWGMRR0_K1_LBSPPA512_LBSPPB512_MIWT2_2_PLR1_SU0_SUM0_SUS0_VWA2_VWB2_WGM1_WGMXCC1_WGMXCCGn1
    SolutionIndex: 84
    SolutionNameMin: Cijk_Alik_Bljk_HHS_BH_Bias_AS_SAV_UserArgs_MT64x64x128_MI16x16x1_SN_LDSB1_CLR1_GSU0_GSUC0_GSUWGMRR0_K1_LBSPPA512_LBSPPB512_MIWT2_2_PLR1_SU0_SUM0_SUS0_VWA2_VWB2_WGM1_WGMXCC1_WGMXCCGn1
    SolutionIndex: 85
    SolutionNameMin: Cijk_Alik_Bljk_HHS_BH_Bias_AS_SAV_UserArgs_MT64x64x128_MI16x16x1_SN_LDSB1_CLR1_GSU0_GSUC0_GSUWGMRR0_K1_LBSPPA512_LBSPPB512_MIWT2_2_PLR1_SU0_SUM0_SUS0_VWA2_VWB2_WGM6_WGMXCC1_WGMXCCGn1
    SolutionIndex: 86
    SolutionNameMin: Cijk_Alik_Bljk_HHS_BH_Bias_AS_SAV_UserArgs_MT64x64x128_MI16x16x1_SN_LDSB1_CLR1_GSU0_GSUC0_GSUWGMRR0_K1_LBSPPA512_LBSPPB512_MIWT2_2_PLR1_SU0_SUM0_SUS0_VWA2_VWB2_WGM6_WGMXCC1_WGMXCCGn1
    SolutionIndex: 87
    SolutionNameMin: Cijk_Alik_Bljk_HHS_BH_Bias_AS_SAV_UserArgs_MT64x64x128_MI16x16x1_SN_LDSB1_CLR1_GSU0_GSUC0_GSUWGMRR0_K1_LBSPPA512_LBSPPB512_MIWT2_2_PLR1_SU0_SUM0_SUS0_VWA2_VWB2_WGM6_WGMXCC1_WGMXCCGn1
    SolutionIndex: 88
    SolutionNameMin: Cijk_Alik_Bljk_HHS_BH_Bias_AS_SAV_UserArgs_MT64x64x128_MI16x16x1_SN_LDSB1_CLR1_GSU0_GSUC0_GSUWGMRR0_K1_LBSPPA512_LBSPPB512_MIWT2_2_PLR1_SU0_SUM0_SUS0_VWA2_VWB2_WGM6_WGMXCC1_WGMXCCGn1
    SolutionIndex: 89
    SolutionNameMin: Cijk_Alik_Bljk_HHS_BH_Bias_AS_SAV_UserArgs_MT64x64x128_MI16x16x1_SN_LDSB1_CLR1_GSU0_GSUC0_GSUWGMRR0_K1_LBSPPA512_LBSPPB512_MIWT2_2_PLR1_SU0_SUM0_SUS0_VWA2_VWB2_WGM6_WGMXCC1_WGMXCCGn1
    SolutionIndex: 90
    SolutionNameMin: Cijk_Alik_Bljk_HHS_BH_Bias_AS_SAV_UserArgs_MT64x64x128_MI16x16x1_SN_LDSB1_CLR1_GSU0_GSUC0_GSUWGMRR0_K1_LBSPPA512_LBSPPB512_MIWT2_2_PLR1_SU0_SUM0_SUS0_VWA2_VWB2_WGM8_WGMXCC1_WGMXCCGn1
    SolutionIndex: 91
    SolutionNameMin: Cijk_Alik_Bljk_HHS_BH_Bias_AS_SAV_UserArgs_MT64x64x128_MI16x16x1_SN_LDSB1_CLR1_GSU0_GSUC0_GSUWGMRR0_K1_LBSPPA512_LBSPPB512_MIWT2_2_PLR1_SU0_SUM0_SUS0_VWA2_VWB2_WGM8_WGMXCC1_WGMXCCGn1
    SolutionIndex: 92
    SolutionNameMin: Cijk_Alik_Bljk_HHS_BH_Bias_AS_SAV_UserArgs_MT64x64x128_MI16x16x1_SN_LDSB1_CLR1_GSU0_GSUC0_GSUWGMRR0_K1_LBSPPA512_LBSPPB512_MIWT2_2_PLR1_SU0_SUM0_SUS0_VWA2_VWB2_WGM8_WGMXCC1_WGMXCCGn1
    SolutionIndex: 93
    SolutionNameMin: Cijk_Alik_Bljk_HHS_BH_Bias_AS_SAV_UserArgs_MT64x64x128_MI16x16x1_SN_LDSB1_CLR1_GSU0_GSUC0_GSUWGMRR0_K1_LBSPPA512_LBSPPB512_MIWT2_2_PLR1_SU0_SUM0_SUS0_VWA2_VWB2_WGM8_WGMXCC1_WGMXCCGn1
    SolutionIndex: 94
    SolutionNameMin: Cijk_Alik_Bljk_HHS_BH_Bias_AS_SAV_UserArgs_MT64x64x128_MI16x16x1_SN_LDSB1_CLR1_GSU0_GSUC0_GSUWGMRR0_K1_LBSPPA512_LBSPPB512_MIWT2_2_PLR1_SU0_SUM0_SUS0_VWA2_VWB2_WGM8_WGMXCC1_WGMXCCGn1
    SolutionIndex: 95
    SolutionNameMin: Cijk_Alik_Bljk_HHS_BH_Bias_AS_SAV_UserArgs_MT64x64x128_MI16x16x1_SN_LDSB1_CLR1_GSU0_GSUC0_GSUWGMRR0_K1_LBSPPA512_LBSPPB512_MIWT2_2_PLR1_SU0_SUM0_SUS0_VWA2_VWB2_WGM8_WGMXCC1_WGMXCCGn1
    SolutionIndex: 96
    SolutionNameMin: Cijk_Alik_Bljk_HHS_BH_Bias_AS_SAV_UserArgs_MT32x64x128_MI16x16x1_SN_LDSB1_CLR1_GSU0_GSUC0_GSUWGMRR0_K1_LBSPPA256_LBSPPB512_MIWT1_2_PLR1_SU0_SUM0_SUS0_VWA1_VWB2_WGM1_WGMXCC1_WGMXCCGn1
    SolutionIndex: 97
    SolutionNameMin: Cijk_Alik_Bljk_HHS_BH_Bias_AS_SAV_UserArgs_MT32x64x128_MI16x16x1_SN_LDSB1_CLR1_GSU0_GSUC0_GSUWGMRR0_K1_LBSPPA256_LBSPPB512_MIWT1_2_PLR1_SU0_SUM0_SUS0_VWA1_VWB2_WGM1_WGMXCC1_WGMXCCGn1
    SolutionIndex: 98
    SolutionNameMin: Cijk_Alik_Bljk_HHS_BH_Bias_AS_SAV_UserArgs_MT32x64x128_MI16x16x1_SN_LDSB1_CLR1_GSU0_GSUC0_GSUWGMRR0_K1_LBSPPA256_LBSPPB512_MIWT1_2_PLR1_SU0_SUM0_SUS0_VWA1_VWB2_WGM6_WGMXCC1_WGMXCCGn1
    SolutionIndex: 99
    SolutionNameMin: Cijk_Alik_Bljk_HHS_BH_Bias_AS_SAV_UserArgs_MT64x32x128_MI16x16x1_SN_LDSB1_CLR1_GSU0_GSUC0_GSUWGMRR0_K1_LBSPPA512_LBSPPB256_MIWT2_1_PLR1_SU0_SUM0_SUS0_VWA2_VWB1_WGM1_WGMXCC1_WGMXCCGn1
    SolutionIndex: 100
    SolutionNameMin: Cijk_Alik_Bljk_HHS_BH_Bias_AS_SAV_UserArgs_MT32x32x128_MI16x16x1_SN_LDSB1_CLR1_GSU0_GSUC0_GSUWGMRR0_K1_LBSPPA256_LBSPPB256_MIWT1_1_PLR1_SU0_SUM0_SUS0_VWA1_VWB1_WGM1_WGMXCC1_WGMXCCGn1
    SolutionIndex: 101
    SolutionNameMin: Cijk_Alik_Bljk_HHS_BH_Bias_AS_SAV_UserArgs_MT32x32x128_MI16x16x1_SN_LDSB1_CLR1_GSU0_GSUC0_GSUWGMRR0_K1_LBSPPA256_LBSPPB256_MIWT1_1_PLR1_SU0_SUM0_SUS0_VWA1_VWB1_WGM1_WGMXCC1_WGMXCCGn1
    SolutionIndex: 102
    SolutionNameMin: Cijk_Alik_Bljk_HHS_BH_Bias_AS_SAV_UserArgs_MT32x32x128_MI16x16x1_SN_LDSB1_CLR1_GSU0_GSUC0_GSUWGMRR0_K1_LBSPPA256_LBSPPB256_MIWT1_1_PLR1_SU0_SUM0_SUS0_VWA1_VWB1_WGM1_WGMXCC1_WGMXCCGn1
    SolutionIndex: 103
    SolutionNameMin: Cijk_Alik_Bljk_HHS_BH_Bias_AS_SAV_UserArgs_MT32x32x128_MI16x16x1_SN_LDSB1_CLR1_GSU0_GSUC0_GSUWGMRR0_K1_LBSPPA256_LBSPPB256_MIWT1_1_PLR1_SU0_SUM0_SUS0_VWA1_VWB1_WGM1_WGMXCC1_WGMXCCGn1
    SolutionIndex: 104
    SolutionNameMin: Cijk_Alik_Bljk_HHS_BH_Bias_AS_SAV_UserArgs_MT32x32x128_MI16x16x1_SN_LDSB1_CLR1_GSU0_GSUC0_GSUWGMRR0_K1_LBSPPA256_LBSPPB256_MIWT1_1_PLR1_SU0_SUM0_SUS0_VWA1_VWB1_WGM1_WGMXCC1_WGMXCCGn1
    SolutionIndex: 105
    SolutionNameMin: Cijk_Alik_Bljk_HHS_BH_Bias_AS_SAV_UserArgs_MT32x32x128_MI16x16x1_SN_LDSB1_CLR1_GSU0_GSUC0_GSUWGMRR0_K1_LBSPPA256_LBSPPB256_MIWT1_1_PLR1_SU0_SUM0_SUS0_VWA1_VWB1_WGM1_WGMXCC1_WGMXCCGn1
    SolutionIndex: 106
    SolutionNameMin: Cijk_Alik_Bljk_HHS_BH_Bias_AS_SAV_UserArgs_MT32x32x128_MI16x16x1_SN_LDSB1_CLR1_GSU0_GSUC0_GSUWGMRR0_K1_LBSPPA256_LBSPPB256_MIWT1_1_PLR1_SU0_SUM0_SUS0_VWA1_VWB1_WGM8_WGMXCC1_WGMXCCGn1
    SolutionIndex: 107
    SolutionNameMin: Cijk_Alik_Bljk_HHS_BH_Bias_AS_SAV_UserArgs_MT128x64x128_MI32x32x1_SN_LDSB1_CLR1_GSU0_GSUC0_GSUWGMRR0_K1_LBSPPA512_LBSPPB256_MIWT2_1_PLR1_SU0_SUM0_SUS0_VWA2_VWB1_WGM6_WGMXCC1_WGMXCCGn1
    SolutionIndex: 108
    SolutionNameMin: Cijk_Alik_Bljk_HHS_BH_Bias_AS_SAV_UserArgs_MT64x64x128_MI32x32x1_SN_LDSB1_CLR1_GSU0_GSUC0_GSUWGMRR0_K1_LBSPPA256_LBSPPB256_MIWT1_1_PLR1_SU0_SUM0_SUS0_VWA1_VWB1_WGM1_WGMXCC1_WGMXCCGn1
    SolutionIndex: 109
    SolutionNameMin: Cijk_Alik_Bljk_HHS_BH_Bias_AS_SAV_UserArgs_MT64x64x256_MI16x16x1_SN_LDSB1_CLR1_GSU0_GSUC0_GSUWGMRR0_K1_LBSPPA1024_LBSPPB1024_MIWT2_2_PLR1_SU0_SUM0_SUS0_VWA2_VWB2_WGM1_WGMXCC1_WGMXCCGn1
    SolutionIndex: 110
    SolutionNameMin: Cijk_Alik_Bljk_HHS_BH_Bias_AS_SAV_UserArgs_MT64x64x256_MI16x16x1_SN_LDSB1_CLR1_GSU0_GSUC0_GSUWGMRR0_K1_LBSPPA1024_LBSPPB1024_MIWT2_2_PLR1_SU0_SUM0_SUS0_VWA2_VWB2_WGM1_WGMXCC1_WGMXCCGn1
    SolutionIndex: 111
    SolutionNameMin: Cijk_Alik_Bljk_HHS_BH_Bias_AS_SAV_UserArgs_MT64x64x256_MI16x16x1_SN_LDSB1_CLR1_GSU0_GSUC0_GSUWGMRR0_K1_LBSPPA1024_LBSPPB1024_MIWT2_2_PLR1_SU0_SUM0_SUS0_VWA2_VWB2_WGM8_WGMXCC1_WGMXCCGn1
    SolutionIndex: 112
    SolutionNameMin: Cijk_Alik_Bljk_HHS_BH_Bias_AS_SAV_UserArgs_MT32x64x256_MI16x16x1_SN_LDSB1_CLR1_GSU0_GSUC0_GSUWGMRR0_K1_LBSPPA512_LBSPPB1024_MIWT1_2_PLR1_SU0_SUM0_SUS0_VWA1_VWB2_WGM1_WGMXCC1_WGMXCCGn1
    SolutionIndex: 113
    SolutionNameMin: Cijk_Alik_Bljk_HHS_BH_Bias_AS_SAV_UserArgs_MT32x64x256_MI16x16x1_SN_LDSB1_CLR1_GSU0_GSUC0_GSUWGMRR0_K1_LBSPPA512_LBSPPB1024_MIWT1_2_PLR1_SU0_SUM0_SUS0_VWA1_VWB2_WGM1_WGMXCC1_WGMXCCGn1
    SolutionIndex: 114
    SolutionNameMin: Cijk_Alik_Bljk_HHS_BH_Bias_AS_SAV_UserArgs_MT32x64x256_MI16x16x1_SN_LDSB1_CLR1_GSU0_GSUC0_GSUWGMRR0_K1_LBSPPA512_LBSPPB1024_MIWT1_2_PLR1_SU0_SUM0_SUS0_VWA1_VWB2_WGM6_WGMXCC1_WGMXCCGn1
    SolutionIndex: 115
    SolutionNameMin: Cijk_Alik_Bljk_HHS_BH_Bias_AS_SAV_UserArgs_MT32x64x256_MI16x16x1_SN_LDSB1_CLR1_GSU0_GSUC0_GSUWGMRR0_K1_LBSPPA512_LBSPPB1024_MIWT1_2_PLR1_SU0_SUM0_SUS0_VWA1_VWB2_WGM6_WGMXCC1_WGMXCCGn1
    SolutionIndex: 116
    SolutionNameMin: Cijk_Alik_Bljk_HHS_BH_Bias_AS_SAV_UserArgs_MT32x64x256_MI16x16x1_SN_LDSB1_CLR1_GSU0_GSUC0_GSUWGMRR0_K1_LBSPPA512_LBSPPB1024_MIWT1_2_PLR1_SU0_SUM0_SUS0_VWA1_VWB2_WGM8_WGMXCC1_WGMXCCGn1
    SolutionIndex: 117
    SolutionNameMin: Cijk_Alik_Bljk_HHS_BH_Bias_AS_SAV_UserArgs_MT32x64x256_MI16x16x1_SN_LDSB1_CLR1_GSU0_GSUC0_GSUWGMRR0_K1_LBSPPA512_LBSPPB1024_MIWT1_2_PLR1_SU0_SUM0_SUS0_VWA1_VWB2_WGM8_WGMXCC1_WGMXCCGn1
    SolutionIndex: 118
    SolutionNameMin: Cijk_Alik_Bljk_HHS_BH_Bias_AS_SAV_UserArgs_MT64x32x256_MI16x16x1_SN_LDSB1_CLR1_GSU0_GSUC0_GSUWGMRR0_K1_LBSPPA1024_LBSPPB512_MIWT2_1_PLR1_SU0_SUM0_SUS0_VWA2_VWB1_WGM1_WGMXCC1_WGMXCCGn1
    SolutionIndex: 119
    SolutionNameMin: Cijk_Alik_Bljk_HHS_BH_Bias_AS_SAV_UserArgs_MT64x32x256_MI16x16x1_SN_LDSB1_CLR1_GSU0_GSUC0_GSUWGMRR0_K1_LBSPPA1024_LBSPPB512_MIWT2_1_PLR1_SU0_SUM0_SUS0_VWA2_VWB1_WGM1_WGMXCC1_WGMXCCGn1
    SolutionIndex: 120
    SolutionNameMin: Cijk_Alik_Bljk_HHS_BH_Bias_AS_SAV_UserArgs_MT64x32x256_MI16x16x1_SN_LDSB1_CLR1_GSU0_GSUC0_GSUWGMRR0_K1_LBSPPA1024_LBSPPB512_MIWT2_1_PLR1_SU0_SUM0_SUS0_VWA2_VWB1_WGM6_WGMXCC1_WGMXCCGn1
    SolutionIndex: 121
    SolutionNameMin: Cijk_Alik_Bljk_HHS_BH_Bias_AS_SAV_UserArgs_MT64x32x256_MI16x16x1_SN_LDSB1_CLR1_GSU0_GSUC0_GSUWGMRR0_K1_LBSPPA1024_LBSPPB512_MIWT2_1_PLR1_SU0_SUM0_SUS0_VWA2_VWB1_WGM6_WGMXCC1_WGMXCCGn1
    SolutionIndex: 122
    SolutionNameMin: Cijk_Alik_Bljk_HHS_BH_Bias_AS_SAV_UserArgs_MT64x32x256_MI16x16x1_SN_LDSB1_CLR1_GSU0_GSUC0_GSUWGMRR0_K1_LBSPPA1024_LBSPPB512_MIWT2_1_PLR1_SU0_SUM0_SUS0_VWA2_VWB1_WGM8_WGMXCC1_WGMXCCGn1
    SolutionIndex: 123
    SolutionNameMin: Cijk_Alik_Bljk_HHS_BH_Bias_AS_SAV_UserArgs_MT64x32x256_MI16x16x1_SN_LDSB1_CLR1_GSU0_GSUC0_GSUWGMRR0_K1_LBSPPA1024_LBSPPB512_MIWT2_1_PLR1_SU0_SUM0_SUS0_VWA2_VWB1_WGM8_WGMXCC1_WGMXCCGn1
    SolutionIndex: 124
    SolutionNameMin: Cijk_Alik_Bljk_HHS_BH_Bias_AS_SAV_UserArgs_MT32x32x256_MI16x16x1_SN_LDSB1_CLR1_GSU0_GSUC0_GSUWGMRR0_K1_LBSPPA512_LBSPPB512_MIWT1_1_PLR1_SU0_SUM0_SUS0_VWA1_VWB1_WGM1_WGMXCC1_WGMXCCGn1
    SolutionIndex: 125
    SolutionNameMin: Cijk_Alik_Bljk_HHS_BH_Bias_AS_SAV_UserArgs_MT32x32x256_MI16x16x1_SN_LDSB1_CLR1_GSU0_GSUC0_GSUWGMRR0_K1_LBSPPA512_LBSPPB512_MIWT1_1_PLR1_SU0_SUM0_SUS0_VWA1_VWB1_WGM1_WGMXCC1_WGMXCCGn1
    SolutionIndex: 126
    SolutionNameMin: Cijk_Alik_Bljk_HHS_BH_Bias_AS_SAV_UserArgs_MT32x32x256_MI16x16x1_SN_LDSB1_CLR1_GSU0_GSUC0_GSUWGMRR0_K1_LBSPPA512_LBSPPB512_MIWT1_1_PLR1_SU0_SUM0_SUS0_VWA1_VWB1_WGM6_WGMXCC1_WGMXCCGn1
    SolutionIndex: 127
    SolutionNameMin: Cijk_Alik_Bljk_HHS_BH_Bias_AS_SAV_UserArgs_MT32x32x256_MI16x16x1_SN_LDSB1_CLR1_GSU0_GSUC0_GSUWGMRR0_K1_LBSPPA512_LBSPPB512_MIWT1_1_PLR1_SU0_SUM0_SUS0_VWA1_VWB1_WGM6_WGMXCC1_WGMXCCGn1
    SolutionIndex: 128
    SolutionNameMin: Cijk_Alik_Bljk_HHS_BH_Bias_AS_SAV_UserArgs_MT32x32x256_MI16x16x1_SN_LDSB1_CLR1_GSU0_GSUC0_GSUWGMRR0_K1_LBSPPA512_LBSPPB512_MIWT1_1_PLR1_SU0_SUM0_SUS0_VWA1_VWB1_WGM8_WGMXCC1_WGMXCCGn1
    SolutionIndex: 129
    SolutionNameMin: Cijk_Alik_Bljk_HHS_BH_Bias_AS_SAV_UserArgs_MT32x32x256_MI16x16x1_SN_LDSB1_CLR1_GSU0_GSUC0_GSUWGMRR0_K1_LBSPPA512_LBSPPB512_MIWT1_1_PLR1_SU0_SUM0_SUS0_VWA1_VWB1_WGM8_WGMXCC1_WGMXCCGn1
    SolutionIndex: 130
    SolutionNameMin: Cijk_Alik_Bljk_HHS_BH_Bias_AS_SAV_UserArgs_MT32x32x32_MI16x16x1_SN_LDSB0_CLR0_GSU0_GSUC0_GSUWGMRR0_K1_LBSPPA128_LBSPPB128_MIWT1_1_PLR0_SU32_SUM0_SUS256_VWA1_VWB1_WGM1_WGMXCC1_WGMXCCGn1
- - - [128, 128, 1, 128, 128, 128, 128, 128]
    - [103, 0.043]
  - - [128, 128, 1, 256, 128, 128, 256, 256]
    - [125, 0.078]
  - - [128, 128, 1, 512, 128, 128, 512, 512]
    - [124, 0.135]
  - - [128, 128, 1, 1024, 128, 128, 1024, 1024]
    - [125, 0.234]
  - - [128, 128, 1, 2048, 128, 128, 2048, 2048]
    - [124, 0.352]
  - - [128, 128, 1, 4096, 128, 128, 4096, 4096]
    - [125, 0.472]
  - - [128, 128, 1, 8192, 128, 128, 8192, 8192]
    - [124, 0.583]
  - - [128, 256, 1, 128, 128, 128, 128, 128]
    - [106, 0.084]
  - - [128, 256, 1, 256, 128, 128, 256, 256]
    - [125, 0.155]
  - - [128, 256, 1, 512, 128, 128, 512, 512]
    - [124, 0.269]
  - - [128, 256, 1, 1024, 128, 128, 1024, 1024]
    - [124, 0.455]
  - - [128, 256, 1, 2048, 128, 128, 2048, 2048]
    - [125, 0.7]
  - - [128, 256, 1, 4096, 128, 128, 4096, 4096]
    - [125, 0.938]
  - - [128, 256, 1, 8192, 128, 128, 8192, 8192]
    - [129, 1.156]
  - - [128, 512, 1, 128, 128, 128, 128, 128]
    - [103, 0.168]
  - - [128, 512, 1, 256, 128, 128, 256, 256]
    - [125, 0.312]
  - - [128, 512, 1, 512, 128, 128, 512, 512]
    - [124, 0.523]
  - - [128, 512, 1, 1024, 128, 128, 1024, 1024]
    - [124, 0.894]
  - - [128, 512, 1, 2048, 128, 128, 2048, 2048]
    - [127, 1.362]
  - - [128, 512, 1, 4096, 128, 128, 4096, 4096]
    - [124, 1.839]
  - - [128, 512, 1, 8192, 128, 128, 8192, 8192]
    - [125, 2.283]
  - - [128, 1024, 1, 128, 128, 128, 128, 128]
    - [104, 0.326]
  - - [128, 1024, 1, 256, 128, 128, 256, 256]
    - [125, 0.611]
  - - [128, 1024, 1, 512, 128, 128, 512, 512]
    - [125, 1.041]
  - - [128, 1024, 1, 1024, 128, 128, 1024, 1024]
    - [125, 1.764]
  - - [128, 1024, 1, 2048, 128, 128, 2048, 2048]
    - [124, 2.676]
  - - [128, 1024, 1, 4096, 128, 128, 4096, 4096]
    - [124, 3.604]
  - - [128, 1024, 1, 8192, 128, 128, 8192, 8192]
    - [124, 4.522]
  - - [128, 2048, 1, 128, 128, 128, 128, 128]
    - [103, 0.642]
  - - [128, 2048, 1, 256, 128, 128, 256, 256]
    - [124, 1.173]
  - - [128, 2048, 1, 512, 128, 128, 512, 512]
    - [125, 2.024]
  - - [128, 2048, 1, 1024, 128, 128, 1024, 1024]
    - [125, 3.399]
  - - [128, 2048, 1, 2048, 128, 128, 2048, 2048]
    - [124, 5.124]
  - - [128, 2048, 1, 4096, 128, 128, 4096, 4096]
    - [124, 7.078]
  - - [128, 2048, 1, 8192, 128, 128, 8192, 8192]
    - [125, 8.278]
  - - [128, 4096, 1, 128, 128, 128, 128, 128]
    - [99, 1.189]
  - - [128, 4096, 1, 256, 128, 128, 256, 256]
    - [99, 2.074]
  - - [128, 4096, 1, 512, 128, 128, 512, 512]
    - [112, 3.488]
  - - [128, 4096, 1, 1024, 128, 128, 1024, 1024]
    - [118, 5.49]
  - - [128, 4096, 1, 2048, 128, 128, 2048, 2048]
    - [116, 7.821]
  - - [128, 4096, 1, 4096, 128, 128, 4096, 4096]
    - [119, 9.421]
  - - [128, 4096, 1, 8192, 128, 128, 8192, 8192]
    - [123, 11.808]
  - - [128, 8192, 1, 128, 128, 128, 128, 128]
    - [84, 2.125]
  - - [128, 8192, 1, 256, 128, 128, 256, 256]
    - [84, 3.703]
  - - [128, 8192, 1, 512, 128, 128, 512, 512]
    - [84, 6.012]
  - - [128, 8192, 1, 1024, 128, 128, 1024, 1024]
    - [91, 8.443]
  - - [128, 8192, 1, 2048, 128, 128, 2048, 2048]
    - [81, 10.961]
  - - [128, 8192, 1, 4096, 128, 128, 4096, 4096]
    - [90, 13.232]
  - - [128, 8192, 1, 8192, 128, 128, 8192, 8192]
    - [109, 15.61]
  - - [256, 128, 1, 128, 256, 256, 128, 128]
    - [102, 0.084]
  - - [256, 128, 1, 256, 256, 256, 256, 256]
    - [124, 0.159]
  - - [256, 128, 1, 512, 256, 256, 512, 512]
    - [124, 0.272]
  - - [256, 128, 1, 1024, 256, 256, 1024, 1024]
    - [125, 0.456]
  - - [256, 128, 1, 2048, 256, 256, 2048, 2048]
    - [124, 0.703]
  - - [256, 128, 1, 4096, 256, 256, 4096, 4096]
    - [125, 0.946]
  - - [256, 128, 1, 8192, 256, 256, 8192, 8192]
    - [125, 1.162]
  - - [256, 256, 1, 128, 256, 256, 128, 128]
    - [105, 0.168]
  - - [256, 256, 1, 256, 256, 256, 256, 256]
    - [124, 0.305]
  - - [256, 256, 1, 512, 256, 256, 512, 512]
    - [124, 0.533]
  - - [256, 256, 1, 1024, 256, 256, 1024, 1024]
    - [124, 0.905]
  - - [256, 256, 1, 2048, 256, 256, 2048, 2048]
    - [125, 1.376]
  - - [256, 256, 1, 4096, 256, 256, 4096, 4096]
    - [125, 1.861]
  - - [256, 256, 1, 8192, 256, 256, 8192, 8192]
    - [125, 2.306]
  - - [256, 512, 1, 128, 256, 256, 128, 128]
    - [105, 0.335]
  - - [256, 512, 1, 256, 256, 256, 256, 256]
    - [128, 0.601]
  - - [256, 512, 1, 512, 256, 256, 512, 512]
    - [125, 1.058]
  - - [256, 512, 1, 1024, 256, 256, 1024, 1024]
    - [124, 1.778]
  - - [256, 512, 1, 2048, 256, 256, 2048, 2048]
    - [127, 2.719]
  - - [256, 512, 1, 4096, 256, 256, 4096, 4096]
    - [125, 3.649]
  - - [256, 512, 1, 8192, 256, 256, 8192, 8192]
    - [128, 4.542]
  - - [256, 1024, 1, 128, 256, 256, 128, 128]
    - [103, 0.658]
  - - [256, 1024, 1, 256, 256, 256, 256, 256]
    - [124, 1.186]
  - - [256, 1024, 1, 512, 256, 256, 512, 512]
    - [125, 2.036]
  - - [256, 1024, 1, 1024, 256, 256, 1024, 1024]
    - [124, 3.44]
  - - [256, 1024, 1, 2048, 256, 256, 2048, 2048]
    - [124, 5.215]
  - - [256, 1024, 1, 4096, 256, 256, 4096, 4096]
    - [128, 7.065]
  - - [256, 1024, 1, 8192, 256, 256, 8192, 8192]
    - [125, 8.761]
  - - [256, 2048, 1, 128, 256, 256, 128, 128]
    - [99, 1.197]
  - - [256, 2048, 1, 256, 256, 256, 256, 256]
    - [113, 2.119]
  - - [256, 2048, 1, 512, 256, 256, 512, 512]
    - [112, 3.58]
  - - [256, 2048, 1, 1024, 256, 256, 1024, 1024]
    - [113, 5.866]
  - - [256, 2048, 1, 2048, 256, 256, 2048, 2048]
    - [118, 8.343]
  - - [256, 2048, 1, 4096, 256, 256, 4096, 4096]
    - [113, 10.779]
  - - [256, 2048, 1, 8192, 256, 256, 8192, 8192]
    - [119, 12.581]
  - - [256, 4096, 1, 128, 256, 256, 128, 128]
    - [84, 2.169]
  - - [256, 4096, 1, 256, 256, 256, 256, 256]
    - [84, 3.779]
  - - [256, 4096, 1, 512, 256, 256, 512, 512]
    - [81, 6.346]
  - - [256, 4096, 1, 1024, 256, 256, 1024, 1024]
    - [83, 9.017]
  - - [256, 4096, 1, 2048, 256, 256, 2048, 2048]
    - [84, 12.339]
  - - [256, 4096, 1, 4096, 256, 256, 4096, 4096]
    - [84, 14.893]
  - - [256, 4096, 1, 8192, 256, 256, 8192, 8192]
    - [111, 17.702]
  - - [256, 8192, 1, 128, 256, 256, 128, 128]
    - [76, 3.527]
  - - [256, 8192, 1, 256, 256, 256, 256, 256]
    - [53, 6.123]
  - - [256, 8192, 1, 512, 256, 256, 512, 512]
    - [64, 9.107]
  - - [256, 8192, 1, 1024, 256, 256, 1024, 1024]
    - [53, 12.417]
  - - [256, 8192, 1, 2048, 256, 256, 2048, 2048]
    - [53, 15.629]
  - - [256, 8192, 1, 4096, 256, 256, 4096, 4096]
    - [72, 19.553]
  - - [256, 8192, 1, 8192, 256, 256, 8192, 8192]
    - [77, 21.93]
  - - [512, 128, 1, 128, 512, 512, 128, 128]
    - [105, 0.17]
  - - [512, 128, 1, 256, 512, 512, 256, 256]
    - [125, 0.313]
  - - [512, 128, 1, 512, 512, 512, 512, 512]
    - [124, 0.533]
  - - [512, 128, 1, 1024, 512, 512, 1024, 1024]
    - [125, 0.906]
  - - [512, 128, 1, 2048, 512, 512, 2048, 2048]
    - [125, 1.394]
  - - [512, 128, 1, 4096, 512, 512, 4096, 4096]
    - [125, 1.856]
  - - [512, 128, 1, 8192, 512, 512, 8192, 8192]
    - [125, 2.3]
  - - [512, 256, 1, 128, 512, 512, 128, 128]
    - [100, 0.329]
  - - [512, 256, 1, 256, 512, 512, 256, 256]
    - [124, 0.604]
  - - [512, 256, 1, 512, 512, 512, 512, 512]
    - [126, 1.037]
  - - [512, 256, 1, 1024, 512, 512, 1024, 1024]
    - [125, 1.754]
  - - [512, 256, 1, 2048, 512, 512, 2048, 2048]
    - [129, 2.684]
  - - [512, 256, 1, 4096, 512, 512, 4096, 4096]
    - [127, 3.643]
  - - [512, 256, 1, 8192, 512, 512, 8192, 8192]
    - [127, 4.555]
  - - [512, 512, 1, 128, 512, 512, 128, 128]
    - [101, 0.648]
  - - [512, 512, 1, 256, 512, 512, 256, 256]
    - [125, 1.191]
  - - [512, 512, 1, 512, 512, 512, 512, 512]
    - [129, 2.02]
  - - [512, 512, 1, 1024, 512, 512, 1024, 1024]
    - [127, 3.457]
  - - [512, 512, 1, 2048, 512, 512, 2048, 2048]
    - [128, 5.241]
  - - [512, 512, 1, 4096, 512, 512, 4096, 4096]
    - [128, 7.062]
  - - [512, 512, 1, 8192, 512, 512, 8192, 8192]
    - [129, 8.874]
  - - [512, 1024, 1, 128, 512, 512, 128, 128]
    - [97, 1.194]
  - - [512, 1024, 1, 256, 512, 512, 256, 256]
    - [119, 2.125]
  - - [512, 1024, 1, 512, 512, 512, 512, 512]
    - [119, 3.631]
  - - [512, 1024, 1, 1024, 512, 512, 1024, 1024]
    - [113, 5.909]
  - - [512, 1024, 1, 2048, 512, 512, 2048, 2048]
    - [114, 8.356]
  - - [512, 1024, 1, 4096, 512, 512, 4096, 4096]
    - [123, 10.774]
  - - [512, 1024, 1, 8192, 512, 512, 8192, 8192]
    - [119, 13.109]
  - - [512, 2048, 1, 128, 512, 512, 128, 128]
    - [108, 2.163]
  - - [512, 2048, 1, 256, 512, 512, 256, 256]
    - [84, 3.804]
  - - [512, 2048, 1, 512, 512, 512, 512, 512]
    - [84, 6.386]
  - - [512, 2048, 1, 1024, 512, 512, 1024, 1024]
    - [82, 9.223]
  - - [512, 2048, 1, 2048, 512, 512, 2048, 2048]
    - [81, 12.702]
  - - [512, 2048, 1, 4096, 512, 512, 4096, 4096]
    - [95, 15.679]
  - - [512, 2048, 1, 8192, 512, 512, 8192, 8192]
    - [110, 18.076]
  - - [512, 4096, 1, 128, 512, 512, 128, 128]
    - [72, 3.541]
  - - [512, 4096, 1, 256, 512, 512, 256, 256]
    - [54, 6.166]
  - - [512, 4096, 1, 512, 512, 512, 512, 512]
    - [53, 9.515]
  - - [512, 4096, 1, 1024, 512, 512, 1024, 1024]
    - [73, 13.193]
  - - [512, 4096, 1, 2048, 512, 512, 2048, 2048]
    - [71, 16.471]
  - - [512, 4096, 1, 4096, 512, 512, 4096, 4096]
    - [74, 20.385]
  - - [512, 4096, 1, 8192, 512, 512, 8192, 8192]
    - [80, 23.366]
  - - [512, 8192, 1, 128, 512, 512, 128, 128]
    - [42, 5.564]
  - - [512, 8192, 1, 256, 512, 512, 256, 256]
    - [41, 8.926]
  - - [512, 8192, 1, 512, 512, 512, 512, 512]
    - [39, 13.243]
  - - [512, 8192, 1, 1024, 512, 512, 1024, 1024]
    - [41, 17.515]
  - - [512, 8192, 1, 2048, 512, 512, 2048, 2048]
    - [40, 21.876]
  - - [512, 8192, 1, 4096, 512, 512, 4096, 4096]
    - [42, 27.647]
  - - [512, 8192, 1, 8192, 512, 512, 8192, 8192]
    - [68, 27.127]
  - - [1024, 128, 1, 128, 1024, 1024, 128, 128]
    - [105, 0.334]
  - - [1024, 128, 1, 256, 1024, 1024, 256, 256]
    - [125, 0.615]
  - - [1024, 128, 1, 512, 1024, 1024, 512, 512]
    - [124, 1.038]
  - - [1024, 128, 1, 1024, 1024, 1024, 1024, 1024]
    - [125, 1.775]
  - - [1024, 128, 1, 2048, 1024, 1024, 2048, 2048]
    - [125, 2.671]
  - - [1024, 128, 1, 4096, 1024, 1024, 4096, 4096]
    - [129, 3.594]
  - - [1024, 128, 1, 8192, 1024, 1024, 8192, 8192]
    - [129, 4.538]
  - - [1024, 256, 1, 128, 1024, 1024, 128, 128]
    - [103, 0.656]
  - - [1024, 256, 1, 256, 1024, 1024, 256, 256]
    - [126, 1.177]
  - - [1024, 256, 1, 512, 1024, 1024, 512, 512]
    - [127, 1.999]
  - - [1024, 256, 1, 1024, 1024, 1024, 1024, 1024]
    - [127, 3.423]
  - - [1024, 256, 1, 2048, 1024, 1024, 2048, 2048]
    - [129, 5.18]
  - - [1024, 256, 1, 4096, 1024, 1024, 4096, 4096]
    - [127, 7.073]
  - - [1024, 256, 1, 8192, 1024, 1024, 8192, 8192]
    - [127, 8.813]
  - - [1024, 512, 1, 128, 1024, 1024, 128, 128]
    - [96, 1.189]
  - - [1024, 512, 1, 256, 1024, 1024, 256, 256]
    - [121, 2.104]
  - - [1024, 512, 1, 512, 1024, 1024, 512, 512]
    - [123, 3.601]
  - - [1024, 512, 1, 1024, 1024, 1024, 1024, 1024]
    - [122, 5.855]
  - - [1024, 512, 1, 2048, 1024, 1024, 2048, 2048]
    - [123, 8.399]
  - - [1024, 512, 1, 4096, 1024, 1024, 4096, 4096]
    - [123, 10.845]
  - - [1024, 512, 1, 8192, 1024, 1024, 8192, 8192]
    - [123, 13.071]
  - - [1024, 1024, 1, 128, 1024, 1024, 128, 128]
    - [84, 2.16]
  - - [1024, 1024, 1, 256, 1024, 1024, 256, 256]
    - [81, 3.765]
  - - [1024, 1024, 1, 512, 1024, 1024, 512, 512]
    - [89, 6.44]
  - - [1024, 1024, 1, 1024, 1024, 1024, 1024, 1024]
    - [86, 9.041]
  - - [1024, 1024, 1, 2048, 1024, 1024, 2048, 2048]
    - [95, 12.662]
  - - [1024, 1024, 1, 4096, 1024, 1024, 4096, 4096]
    - [95, 15.841]
  - - [1024, 1024, 1, 8192, 1024, 1024, 8192, 8192]
    - [92, 18.156]
  - - [1024, 2048, 1, 128, 1024, 1024, 128, 128]
    - [76, 3.532]
  - - [1024, 2048, 1, 256, 1024, 1024, 256, 256]
    - [54, 6.153]
  - - [1024, 2048, 1, 512, 1024, 1024, 512, 512]
    - [59, 9.48]
  - - [1024, 2048, 1, 1024, 1024, 1024, 1024, 1024]
    - [59, 13.175]
  - - [1024, 2048, 1, 2048, 1024, 1024, 2048, 2048]
    - [60, 16.942]
  - - [1024, 2048, 1, 4096, 1024, 1024, 4096, 4096]
    - [72, 20.493]
  - - [1024, 2048, 1, 8192, 1024, 1024, 8192, 8192]
    - [80, 23.118]
  - - [1024, 4096, 1, 128, 1024, 1024, 128, 128]
    - [43, 5.594]
  - - [1024, 4096, 1, 256, 1024, 1024, 256, 256]
    - [41, 9.017]
  - - [1024, 4096, 1, 512, 1024, 1024, 512, 512]
    - [38, 13.653]
  - - [1024, 4096, 1, 1024, 1024, 1024, 1024, 1024]
    - [41, 18.218]
  - - [1024, 4096, 1, 2048, 1024, 1024, 2048, 2048]
    - [67, 22.524]
  - - [1024, 4096, 1, 4096, 1024, 1024, 4096, 4096]
    - [43, 27.874]
  - - [1024, 4096, 1, 8192, 1024, 1024, 8192, 8192]
    - [70, 28.415]
  - - [1024, 8192, 1, 128, 1024, 1024, 128, 128]
    - [7, 6.896]
  - - [1024, 8192, 1, 256, 1024, 1024, 256, 256]
    - [8, 11.239]
  - - [1024, 8192, 1, 512, 1024, 1024, 512, 512]
    - [25, 16.099]
  - - [1024, 8192, 1, 1024, 1024, 1024, 1024, 1024]
    - [26, 22.562]
  - - [1024, 8192, 1, 2048, 1024, 1024, 2048, 2048]
    - [31, 30.405]
  - - [1024, 8192, 1, 4096, 1024, 1024, 4096, 4096]
    - [28, 35.282]
  - - [1024, 8192, 1, 8192, 1024, 1024, 8192, 8192]
    - [37, 33.076]
  - - [2048, 128, 1, 128, 2048, 2048, 128, 128]
    - [105, 0.647]
  - - [2048, 128, 1, 256, 2048, 2048, 256, 256]
    - [129, 1.165]
  - - [2048, 128, 1, 512, 2048, 2048, 512, 512]
    - [127, 1.988]
  - - [2048, 128, 1, 1024, 2048, 2048, 1024, 1024]
    - [127, 3.395]
  - - [2048, 128, 1, 2048, 2048, 2048, 2048, 2048]
    - [129, 5.096]
  - - [2048, 128, 1, 4096, 2048, 2048, 4096, 4096]
    - [129, 7.102]
  - - [2048, 128, 1, 8192, 2048, 2048, 8192, 8192]
    - [128, 8.37]
  - - [2048, 256, 1, 128, 2048, 2048, 128, 128]
    - [98, 1.174]
  - - [2048, 256, 1, 256, 2048, 2048, 256, 256]
    - [117, 2.091]
  - - [2048, 256, 1, 512, 2048, 2048, 512, 512]
    - [123, 3.543]
  - - [2048, 256, 1, 1024, 2048, 2048, 1024, 1024]
    - [115, 5.81]
  - - [2048, 256, 1, 2048, 2048, 2048, 2048, 2048]
    - [117, 8.296]
  - - [2048, 256, 1, 4096, 2048, 2048, 4096, 4096]
    - [117, 10.787]
  - - [2048, 256, 1, 8192, 2048, 2048, 8192, 8192]
    - [117, 12.604]
  - - [2048, 512, 1, 128, 2048, 2048, 128, 128]
    - [89, 2.114]
  - - [2048, 512, 1, 256, 2048, 2048, 256, 256]
    - [89, 3.705]
  - - [2048, 512, 1, 512, 2048, 2048, 512, 512]
    - [87, 6.268]
  - - [2048, 512, 1, 1024, 2048, 2048, 1024, 1024]
    - [93, 8.991]
  - - [2048, 512, 1, 2048, 2048, 2048, 2048, 2048]
    - [92, 12.643]
  - - [2048, 512, 1, 4096, 2048, 2048, 4096, 4096]
    - [87, 15.556]
  - - [2048, 512, 1, 8192, 2048, 2048, 8192, 8192]
    - [88, 17.328]
  - - [2048, 1024, 1, 128, 2048, 2048, 128, 128]
    - [80, 3.519]
  - - [2048, 1024, 1, 256, 2048, 2048, 256, 256]
    - [65, 6.117]
  - - [2048, 1024, 1, 512, 2048, 2048, 512, 512]
    - [78, 9.298]
  - - [2048, 1024, 1, 1024, 2048, 2048, 1024, 1024]
    - [58, 13.022]
  - - [2048, 1024, 1, 2048, 2048, 2048, 2048, 2048]
    - [63, 16.863]
  - - [2048, 1024, 1, 4096, 2048, 2048, 4096, 4096]
    - [79, 20.852]
  - - [2048, 1024, 1, 8192, 2048, 2048, 8192, 8192]
    - [107, 23.106]
  - - [2048, 2048, 1, 128, 2048, 2048, 128, 128]
    - [42, 5.537]
  - - [2048, 2048, 1, 256, 2048, 2048, 256, 256]
    - [41, 8.864]
  - - [2048, 2048, 1, 512, 2048, 2048, 512, 512]
    - [48, 13.553]
  - - [2048, 2048, 1, 1024, 2048, 2048, 1024, 1024]
    - [44, 18.283]
  - - [2048, 2048, 1, 2048, 2048, 2048, 2048, 2048]
    - [50, 23.025]
  - - [2048, 2048, 1, 4096, 2048, 2048, 4096, 4096]
    - [52, 28.607]
  - - [2048, 2048, 1, 8192, 2048, 2048, 8192, 8192]
    - [70, 28.502]
  - - [2048, 4096, 1, 128, 2048, 2048, 128, 128]
    - [35, 6.876]
  - - [2048, 4096, 1, 256, 2048, 2048, 256, 256]
    - [24, 10.979]
  - - [2048, 4096, 1, 512, 2048, 2048, 512, 512]
    - [25, 16.217]
  - - [2048, 4096, 1, 1024, 2048, 2048, 1024, 1024]
    - [22, 22.874]
  - - [2048, 4096, 1, 2048, 2048, 2048, 2048, 2048]
    - [27, 29.497]
  - - [2048, 4096, 1, 4096, 2048, 2048, 4096, 4096]
    - [37, 36.07]
  - - [2048, 4096, 1, 8192, 2048, 2048, 8192, 8192]
    - [28, 32.758]
  - - [2048, 8192, 1, 128, 2048, 2048, 128, 128]
    - [7, 8.08]
  - - [2048, 8192, 1, 256, 2048, 2048, 256, 256]
    - [11, 12.747]
  - - [2048, 8192, 1, 512, 2048, 2048, 512, 512]
    - [0, 19.763]
  - - [2048, 8192, 1, 1024, 2048, 2048, 1024, 1024]
    - [14, 29.402]
  - - [2048, 8192, 1, 2048, 2048, 2048, 2048, 2048]
    - [20, 36.851]
  - - [2048, 8192, 1, 4096, 2048, 2048, 4096, 4096]
    - [14, 39.72]
  - - [2048, 8192, 1, 8192, 2048, 2048, 8192, 8192]
    - [21, 39.805]
  - - [4096, 128, 1, 128, 4096, 4096, 128, 128]
    - [97, 1.197]
  - - [4096, 128, 1, 256, 4096, 4096, 256, 256]
    - [112, 2.07]
  - - [4096, 128, 1, 512, 4096, 4096, 512, 512]
    - [97, 3.487]
  - - [4096, 128, 1, 1024, 4096, 4096, 1024, 1024]
    - [121, 5.575]
  - - [4096, 128, 1, 2048, 4096, 4096, 2048, 2048]
    - [122, 7.915]
  - - [4096, 128, 1, 4096, 4096, 4096, 4096, 4096]
    - [117, 9.525]
  - - [4096, 128, 1, 8192, 4096, 4096, 8192, 8192]
    - [120, 11.622]
  - - [4096, 256, 1, 128, 4096, 4096, 128, 128]
    - [87, 2.125]
  - - [4096, 256, 1, 256, 4096, 4096, 256, 256]
    - [92, 3.688]
  - - [4096, 256, 1, 512, 4096, 4096, 512, 512]
    - [92, 6.176]
  - - [4096, 256, 1, 1024, 4096, 4096, 1024, 1024]
    - [94, 8.994]
  - - [4096, 256, 1, 2048, 4096, 4096, 2048, 2048]
    - [87, 12.499]
  - - [4096, 256, 1, 4096, 4096, 4096, 4096, 4096]
    - [95, 14.806]
  - - [4096, 256, 1, 8192, 4096, 4096, 8192, 8192]
    - [111, 17.158]
  - - [4096, 512, 1, 128, 4096, 4096, 128, 128]
    - [80, 3.494]
  - - [4096, 512, 1, 256, 4096, 4096, 256, 256]
    - [62, 6.046]
  - - [4096, 512, 1, 512, 4096, 4096, 512, 512]
    - [56, 9.222]
  - - [4096, 512, 1, 1024, 4096, 4096, 1024, 1024]
    - [55, 13.059]
  - - [4096, 512, 1, 2048, 4096, 4096, 2048, 2048]
    - [61, 16.348]
  - - [4096, 512, 1, 4096, 4096, 4096, 4096, 4096]
    - [80, 20.308]
  - - [4096, 512, 1, 8192, 4096, 4096, 8192, 8192]
    - [80, 23.102]
  - - [4096, 1024, 1, 128, 4096, 4096, 128, 128]
    - [45, 5.523]
  - - [4096, 1024, 1, 256, 4096, 4096, 256, 256]
    - [48, 8.871]
  - - [4096, 1024, 1, 512, 4096, 4096, 512, 512]
    - [46, 13.444]
  - - [4096, 1024, 1, 1024, 4096, 4096, 1024, 1024]
    - [48, 18.1]
  - - [4096, 1024, 1, 2048, 4096, 4096, 2048, 2048]
    - [50, 22.269]
  - - [4096, 1024, 1, 4096, 4096, 4096, 4096, 4096]
    - [51, 28.226]
  - - [4096, 1024, 1, 8192, 4096, 4096, 8192, 8192]
    - [66, 27.636]
  - - [4096, 2048, 1, 128, 4096, 4096, 128, 128]
    - [31, 6.7]
  - - [4096, 2048, 1, 256, 4096, 4096, 256, 256]
    - [34, 10.895]
  - - [4096, 2048, 1, 512, 4096, 4096, 512, 512]
    - [29, 16.198]
  - - [4096, 2048, 1, 1024, 4096, 4096, 1024, 1024]
    - [30, 22.727]
  - - [4096, 2048, 1, 2048, 4096, 4096, 2048, 2048]
    - [36, 29.104]
  - - [4096, 2048, 1, 4096, 4096, 4096, 4096, 4096]
    - [37, 34.532]
  - - [4096, 2048, 1, 8192, 4096, 4096, 8192, 8192]
    - [33, 33.28]
  - - [4096, 4096, 1, 128, 4096, 4096, 128, 128]
    - [7, 8.002]
  - - [4096, 4096, 1, 256, 4096, 4096, 256, 256]
    - [11, 12.829]
  - - [4096, 4096, 1, 512, 4096, 4096, 512, 512]
    - [12, 19.669]
  - - [4096, 4096, 1, 1024, 4096, 4096, 1024, 1024]
    - [15, 29.058]
  - - [4096, 4096, 1, 2048, 4096, 4096, 2048, 2048]
    - [16, 38.748]
  - - [4096, 8192, 1, 128, 4096, 4096, 128, 128]
    - [6, 8.99]
  - - [4096, 8192, 1, 256, 4096, 4096, 256, 256]
    - [2, 14.274]
  - - [4096, 8192, 1, 512, 4096, 4096, 512, 512]
    - [13, 22.979]
  - - [4096, 8192, 1, 1024, 4096, 4096, 1024, 1024]
    - [21, 32.536]
  - - [4096, 8192, 1, 2048, 4096, 4096, 2048, 2048]
    - [17, 37.779]
  - - [8192, 128, 1, 128, 8192, 8192, 128, 128]
    - [87, 2.056]
  - - [8192, 128, 1, 256, 8192, 8192, 256, 256]
    - [89, 3.559]
  - - [8192, 128, 1, 512, 8192, 8192, 512, 512]
    - [95, 5.912]
  - - [8192, 128, 1, 1024, 8192, 8192, 1024, 1024]
    - [85, 8.362]
  - - [8192, 128, 1, 2048, 8192, 8192, 2048, 2048]
    - [95, 10.684]
  - - [8192, 128, 1, 4096, 8192, 8192, 4096, 4096]
    - [111, 13.345]
  - - [8192, 128, 1, 8192, 8192, 8192, 8192, 8192]
    - [111, 15.464]
  - - [8192, 256, 1, 128, 8192, 8192, 128, 128]
    - [61, 3.461]
  - - [8192, 256, 1, 256, 8192, 8192, 256, 256]
    - [62, 6.056]
  - - [8192, 256, 1, 512, 8192, 8192, 512, 512]
    - [56, 9.147]
  - - [8192, 256, 1, 1024, 8192, 8192, 1024, 1024]
    - [54, 12.408]
  - - [8192, 256, 1, 2048, 8192, 8192, 2048, 2048]
    - [57, 15.589]
  - - [8192, 256, 1, 4096, 8192, 8192, 4096, 4096]
    - [75, 19.36]
  - - [8192, 256, 1, 8192, 8192, 8192, 8192, 8192]
    - [107, 21.346]
  - - [8192, 512, 1, 128, 8192, 8192, 128, 128]
    - [49, 5.492]
  - - [8192, 512, 1, 256, 8192, 8192, 256, 256]
    - [69, 8.973]
  - - [8192, 512, 1, 512, 8192, 8192, 512, 512]
    - [47, 13.042]
  - - [8192, 512, 1, 1024, 8192, 8192, 1024, 1024]
    - [47, 17.321]
  - - [8192, 512, 1, 2048, 8192, 8192, 2048, 2048]
    - [45, 22.337]
  - - [8192, 512, 1, 4096, 8192, 8192, 4096, 4096]
    - [51, 27.452]
  - - [8192, 512, 1, 8192, 8192, 8192, 8192, 8192]
    - [45, 27.053]
  - - [8192, 1024, 1, 128, 8192, 8192, 128, 128]
    - [37, 6.68]
  - - [8192, 1024, 1, 256, 8192, 8192, 256, 256]
    - [9, 11.027]
  - - [8192, 1024, 1, 512, 8192, 8192, 512, 512]
    - [34, 15.954]
  - - [8192, 1024, 1, 1024, 8192, 8192, 1024, 1024]
    - [23, 22.676]
  - - [8192, 1024, 1, 2048, 8192, 8192, 2048, 2048]
    - [32, 28.734]
  - - [8192, 1024, 1, 4096, 8192, 8192, 4096, 4096]
    - [33, 33.629]
  - - [8192, 1024, 1, 8192, 8192, 8192, 8192, 8192]
    - [37, 31.937]
  - - [8192, 2048, 1, 128, 8192, 8192, 128, 128]
    - [6, 8.212]
  - - [8192, 2048, 1, 256, 8192, 8192, 256, 256]
    - [5, 12.467]
  - - [8192, 2048, 1, 512, 8192, 8192, 512, 512]
    - [1, 19.03]
  - - [8192, 2048, 1, 1024, 8192, 8192, 1024, 1024]
    - [19, 28.478]
  - - [8192, 2048, 1, 2048, 8192, 8192, 2048, 2048]
    - [17, 38.382]
  - - [8192, 2048, 1, 4096, 8192, 8192, 4096, 4096]
    - [21, 38.971]
  - - [8192, 2048, 1, 8192, 8192, 8192, 8192, 8192]
    - [16, 39.235]
  - - [8192, 4096, 1, 128, 8192, 8192, 128, 128]
    - [10, 8.994]
  - - [8192, 4096, 1, 256, 8192, 8192, 256, 256]
    - [3, 14.248]
  - - [8192, 4096, 1, 512, 8192, 8192, 512, 512]
    - [18, 22.328]
  - - [8192, 4096, 1, 1024, 8192, 8192, 1024, 1024]
    - [19, 32.786]
  - - [8192, 4096, 1, 2048, 8192, 8192, 2048, 2048]
    - [19, 35.555]
  - - [8192, 8192, 1, 128, 8192, 8192, 128, 128]
    - [4, 9.973]
  - - [8192, 8192, 1, 256, 8192, 8192, 256, 256]
    - [17, 16.842]
  - - [8192, 8192, 1, 512, 8192, 8192, 512, 512]
    - [16, 25.391]
  - - [8192, 8192, 1, 1024, 8192, 8192, 1024, 1024]
    - [17, 30.663]
  - - [8192, 8192, 1, 2048, 8192, 8192, 2048, 2048]
    - [17, 35.654]
  - - [4096, 4096, 1, 4096, 4096, 4096, 4096, 4096]
    - [14, 40.173]
  - - [4096, 4096, 1, 8192, 4096, 4096, 8192, 8192]
    - [17, 40.199]
  - - [4096, 8192, 1, 4096, 4096, 4096, 4096, 4096]
    - [17, 38.523]
  - - [4096, 8192, 1, 8192, 4096, 4096, 8192, 8192]
    - [21, 42.616]
  - - [8192, 4096, 1, 4096, 8192, 8192, 4096, 4096]
    - [21, 38.021]
  - - [8192, 4096, 1, 8192, 8192, 8192, 8192, 8192]
    - [21, 42.497]
  - - [8192, 8192, 1, 4096, 8192, 8192, 4096, 4096]
    - [17, 41.076]
  - - [8192, 8192, 1, 8192, 8192, 8192, 8192, 8192]
    - [17, 45.47]
  - - [1, 1, 1, 32, 1, 1, 32, 32]
    - [130, 0.0]
- null
- null
- DeviceEfficiency
- GridBased
