projects/hipblaslt/library/src/amd_detail/rocblaslt/src/Tensile/Logic/asm_full/gfx950/GridBased/gfx950_Cijk_Ailk_Bljk_HSS_BH_Bias_HAS_SAV_UserArgs.yaml
- {MinimumRequiredVersion: 4.33.0}
- gfx950
- gfx950
- [Device 75a0]
    SolutionIndex: 0
    SolutionNameMin: Cijk_Ailk_Bljk_HSS_BH_Bias_HAS_SAV_UserArgs_MT256x256x32_MI16x16x1_SN_LDSB0_CLR0_GSU0_GSUC0_GSUWGMRR0_K1_LBSPPA4096_LBSPPB512_LPA0_MIWT8_8_PLR0_SU0_SUM0_SUS0_VWA8_VWB8_WGM8_WGMXCC1_WGMXCCGn1
    SolutionIndex: 1
    SolutionNameMin: Cijk_Ailk_Bljk_HSS_BH_Bias_HAS_SAV_UserArgs_MT128x256x32_MI16x16x1_SN_LDSB1_CLR0_GSU0_GSUC0_GSUWGMRR0_K1_LBSPPA512_LBSPPB512_LPA0_MIWT4_8_PLR0_SU0_SUM0_SUS0_VWA4_VWB8_WGM1_WGMXCC1_WGMXCCGn1
    SolutionIndex: 2
    SolutionNameMin: Cijk_Ailk_Bljk_HSS_BH_Bias_HAS_SAV_UserArgs_MT128x256x32_MI16x16x1_SN_LDSB1_CLR0_GSU0_GSUC0_GSUWGMRR0_K1_LBSPPA512_LBSPPB512_LPA0_MIWT4_8_PLR0_SU0_SUM0_SUS0_VWA4_VWB8_WGM1_WGMXCC1_WGMXCCGn1
    SolutionIndex: 3
    SolutionNameMin: Cijk_Ailk_Bljk_HSS_BH_Bias_HAS_SAV_UserArgs_MT128x256x32_MI16x16x1_SN_LDSB1_CLR0_GSU0_GSUC0_GSUWGMRR0_K1_LBSPPA1024_LBSPPB512_LPA0_MIWT4_8_PLR0_SU0_SUM0_SUS0_VWA4_VWB8_WGM1_WGMXCC1_WGMXCCGn1
    SolutionIndex: 4
    SolutionNameMin: Cijk_Ailk_Bljk_HSS_BH_Bias_HAS_SAV_UserArgs_MT128x256x32_MI16x16x1_SN_LDSB1_CLR0_GSU0_GSUC0_GSUWGMRR0_K1_LBSPPA512_LBSPPB512_LPA0_MIWT4_8_PLR0_SU0_SUM0_SUS0_VWA4_VWB8_WGM6_WGMXCC1_WGMXCCGn1
    SolutionIndex: 5
    SolutionNameMin: Cijk_Ailk_Bljk_HSS_BH_Bias_HAS_SAV_UserArgs_MT128x256x32_MI16x16x1_SN_LDSB1_CLR0_GSU0_GSUC0_GSUWGMRR0_K1_LBSPPA2048_LBSPPB512_LPA0_MIWT4_8_PLR0_SU0_SUM0_SUS0_VWA4_VWB8_WGM6_WGMXCC1_WGMXCCGn1
    SolutionIndex: 6
    SolutionNameMin: Cijk_Ailk_Bljk_HSS_BH_Bias_HAS_SAV_UserArgs_MT128x256x32_MI16x16x1_SN_LDSB1_CLR0_GSU0_GSUC0_GSUWGMRR0_K1_LBSPPA1024_LBSPPB512_LPA0_MIWT4_8_PLR0_SU0_SUM0_SUS0_VWA4_VWB8_WGM8_WGMXCC1_WGMXCCGn1
    SolutionIndex: 7
    SolutionNameMin: Cijk_Ailk_Bljk_HSS_BH_Bias_HAS_SAV_UserArgs_MT256x128x32_MI16x16x1_SN_LDSB1_CLR0_GSU0_GSUC0_GSUWGMRR0_K1_LBSPPA4096_LBSPPB256_LPA0_MIWT8_4_PLR0_SU0_SUM0_SUS0_VWA8_VWB4_WGM8_WGMXCC1_WGMXCCGn1
    SolutionIndex: 8
    SolutionNameMin: Cijk_Ailk_Bljk_HSS_BH_Bias_HAS_SAV_UserArgs_MT256x128x32_MI16x16x1_SN_LDSB1_CLR0_GSU0_GSUC0_GSUWGMRR0_K1_LBSPPA4096_LBSPPB256_LPA0_MIWT8_4_PLR0_SU0_SUM0_SUS0_VWA8_VWB4_WGM8_WGMXCC1_WGMXCCGn1
    SolutionIndex: 9
    SolutionNameMin: Cijk_Ailk_Bljk_HSS_BH_Bias_HAS_SAV_UserArgs_MT128x128x32_MI16x16x1_SN_LDSB1_CLR0_GSU0_GSUC0_GSUWGMRR0_K1_LBSPPA1024_LBSPPB256_LPA0_MIWT4_4_PLR0_SU0_SUM0_SUS0_VWA4_VWB4_WGM1_WGMXCC1_WGMXCCGn1
    SolutionIndex: 10
    SolutionNameMin: Cijk_Ailk_Bljk_HSS_BH_Bias_HAS_SAV_UserArgs_MT128x128x32_MI16x16x1_SN_LDSB1_CLR0_GSU0_GSUC0_GSUWGMRR0_K1_LBSPPA1024_LBSPPB256_LPA0_MIWT4_4_PLR0_SU0_SUM0_SUS0_VWA4_VWB4_WGM1_WGMXCC1_WGMXCCGn1
    SolutionIndex: 11
    SolutionNameMin: Cijk_Ailk_Bljk_HSS_BH_Bias_HAS_SAV_UserArgs_MT128x128x32_MI16x16x1_SN_LDSB1_CLR0_GSU0_GSUC0_GSUWGMRR0_K1_LBSPPA1024_LBSPPB256_LPA0_MIWT4_4_PLR0_SU0_SUM0_SUS0_VWA4_VWB4_WGM6_WGMXCC1_WGMXCCGn1
    SolutionIndex: 12
    SolutionNameMin: Cijk_Ailk_Bljk_HSS_BH_Bias_HAS_SAV_UserArgs_MT128x128x32_MI16x16x1_SN_LDSB1_CLR0_GSU0_GSUC0_GSUWGMRR0_K1_LBSPPA1024_LBSPPB256_LPA0_MIWT4_4_PLR0_SU0_SUM0_SUS0_VWA4_VWB4_WGM6_WGMXCC1_WGMXCCGn1
    SolutionIndex: 13
    SolutionNameMin: Cijk_Ailk_Bljk_HSS_BH_Bias_HAS_SAV_UserArgs_MT128x128x32_MI16x16x1_SN_LDSB1_CLR0_GSU0_GSUC0_GSUWGMRR0_K1_LBSPPA2048_LBSPPB256_LPA0_MIWT4_4_PLR0_SU0_SUM0_SUS0_VWA4_VWB4_WGM6_WGMXCC1_WGMXCCGn1
    SolutionIndex: 14
    SolutionNameMin: Cijk_Ailk_Bljk_HSS_BH_Bias_HAS_SAV_UserArgs_MT128x128x32_MI16x16x1_SN_LDSB1_CLR0_GSU0_GSUC0_GSUWGMRR0_K1_LBSPPA2048_LBSPPB256_LPA0_MIWT4_4_PLR0_SU0_SUM0_SUS0_VWA4_VWB4_WGM8_WGMXCC1_WGMXCCGn1
    SolutionIndex: 15
    SolutionNameMin: Cijk_Ailk_Bljk_HSS_BH_Bias_HAS_SAV_UserArgs_MT256x256x32_MI32x32x1_SN_LDSB0_CLR1_GSU0_GSUC0_GSUWGMRR0_K1_LBSPPA0_LBSPPB256_LPA0_MIWT4_4_PLR1_SU0_SUM0_SUS0_VWA4_VWB4_WGM1_WGMXCC1_WGMXCCGn1
    SolutionIndex: 16
    SolutionNameMin: Cijk_Ailk_Bljk_HSS_BH_Bias_HAS_SAV_UserArgs_MT256x256x32_MI32x32x1_SN_LDSB0_CLR1_GSU0_GSUC0_GSUWGMRR0_K1_LBSPPA0_LBSPPB256_LPA0_MIWT4_4_PLR1_SU0_SUM0_SUS0_VWA4_VWB4_WGM1_WGMXCC1_WGMXCCGn1
    SolutionIndex: 17
    SolutionNameMin: Cijk_Ailk_Bljk_HSS_BH_Bias_HAS_SAV_UserArgs_MT256x256x32_MI32x32x1_SN_LDSB0_CLR1_GSU0_GSUC0_GSUWGMRR0_K1_LBSPPA0_LBSPPB256_LPA0_MIWT4_4_PLR1_SU0_SUM0_SUS0_VWA4_VWB4_WGM1_WGMXCC1_WGMXCCGn1
    SolutionIndex: 18
    SolutionNameMin: Cijk_Ailk_Bljk_HSS_BH_Bias_HAS_SAV_UserArgs_MT256x256x32_MI32x32x1_SN_LDSB0_CLR1_GSU0_GSUC0_GSUWGMRR0_K1_LBSPPA0_LBSPPB256_LPA0_MIWT4_4_PLR1_SU0_SUM0_SUS0_VWA4_VWB4_WGM6_WGMXCC1_WGMXCCGn1
    SolutionIndex: 19
    SolutionNameMin: Cijk_Ailk_Bljk_HSS_BH_Bias_HAS_SAV_UserArgs_MT256x256x32_MI32x32x1_SN_LDSB0_CLR1_GSU0_GSUC0_GSUWGMRR0_K1_LBSPPA0_LBSPPB256_LPA0_MIWT4_4_PLR1_SU0_SUM0_SUS0_VWA4_VWB4_WGM6_WGMXCC1_WGMXCCGn1
    SolutionIndex: 20
    SolutionNameMin: Cijk_Ailk_Bljk_HSS_BH_Bias_HAS_SAV_UserArgs_MT256x256x32_MI32x32x1_SN_LDSB0_CLR1_GSU0_GSUC0_GSUWGMRR0_K1_LBSPPA0_LBSPPB256_LPA0_MIWT4_4_PLR1_SU0_SUM0_SUS0_VWA4_VWB4_WGM6_WGMXCC1_WGMXCCGn1
    SolutionIndex: 21
    SolutionNameMin: Cijk_Ailk_Bljk_HSS_BH_Bias_HAS_SAV_UserArgs_MT256x256x32_MI32x32x1_SN_LDSB0_CLR1_GSU0_GSUC0_GSUWGMRR0_K1_LBSPPA0_LBSPPB256_LPA0_MIWT4_4_PLR1_SU0_SUM0_SUS0_VWA4_VWB4_WGM6_WGMXCC1_WGMXCCGn1
    SolutionIndex: 22
    SolutionNameMin: Cijk_Ailk_Bljk_HSS_BH_Bias_HAS_SAV_UserArgs_MT256x256x32_MI32x32x1_SN_LDSB0_CLR1_GSU0_GSUC0_GSUWGMRR0_K1_LBSPPA0_LBSPPB256_LPA0_MIWT4_4_PLR1_SU0_SUM0_SUS0_VWA4_VWB4_WGM6_WGMXCC1_WGMXCCGn1
    SolutionIndex: 23
    SolutionNameMin: Cijk_Ailk_Bljk_HSS_BH_Bias_HAS_SAV_UserArgs_MT256x256x32_MI32x32x1_SN_LDSB0_CLR1_GSU0_GSUC0_GSUWGMRR0_K1_LBSPPA0_LBSPPB256_LPA0_MIWT4_4_PLR1_SU0_SUM0_SUS0_VWA4_VWB4_WGM8_WGMXCC1_WGMXCCGn1
    SolutionIndex: 24
    SolutionNameMin: Cijk_Ailk_Bljk_HSS_BH_Bias_HAS_SAV_UserArgs_MT256x128x32_MI32x32x1_SN_LDSB1_CLR1_GSU0_GSUC0_GSUWGMRR0_K1_LBSPPA0_LBSPPB128_LPA0_MIWT4_2_PLR1_SU0_SUM0_SUS0_VWA4_VWB2_WGM1_WGMXCC1_WGMXCCGn1
    SolutionIndex: 25
    SolutionNameMin: Cijk_Ailk_Bljk_HSS_BH_Bias_HAS_SAV_UserArgs_MT256x128x32_MI32x32x1_SN_LDSB1_CLR1_GSU0_GSUC0_GSUWGMRR0_K1_LBSPPA0_LBSPPB128_LPA0_MIWT4_2_PLR1_SU0_SUM0_SUS0_VWA4_VWB2_WGM6_WGMXCC1_WGMXCCGn1
    SolutionIndex: 26
    SolutionNameMin: Cijk_Ailk_Bljk_HSS_BH_Bias_HAS_SAV_UserArgs_MT256x128x32_MI32x32x1_SN_LDSB1_CLR1_GSU0_GSUC0_GSUWGMRR0_K1_LBSPPA0_LBSPPB128_LPA0_MIWT4_2_PLR1_SU0_SUM0_SUS0_VWA4_VWB2_WGM6_WGMXCC1_WGMXCCGn1
    SolutionIndex: 27
    SolutionNameMin: Cijk_Ailk_Bljk_HSS_BH_Bias_HAS_SAV_UserArgs_MT256x128x32_MI32x32x1_SN_LDSB1_CLR1_GSU0_GSUC0_GSUWGMRR0_K1_LBSPPA0_LBSPPB128_LPA0_MIWT4_2_PLR1_SU0_SUM0_SUS0_VWA4_VWB2_WGM8_WGMXCC1_WGMXCCGn1
    SolutionIndex: 28
    SolutionNameMin: Cijk_Ailk_Bljk_HSS_BH_Bias_HAS_SAV_UserArgs_MT256x256x64_MI16x16x1_SN_LDSB1_CLR1_GSU0_GSUC0_GSUWGMRR0_K1_LBSPPA2048_LBSPPB1024_LPA0_MIWT8_8_PLR1_SU0_SUM0_SUS0_VWA8_VWB8_WGM6_WGMXCC1_WGMXCCGn1
    SolutionIndex: 29
    SolutionNameMin: Cijk_Ailk_Bljk_HSS_BH_Bias_HAS_SAV_UserArgs_MT256x256x64_MI16x16x1_SN_LDSB1_CLR1_GSU0_GSUC0_GSUWGMRR0_K1_LBSPPA4096_LBSPPB1024_LPA0_MIWT8_8_PLR1_SU0_SUM0_SUS0_VWA8_VWB8_WGM6_WGMXCC1_WGMXCCGn1
    SolutionIndex: 30
    SolutionNameMin: Cijk_Ailk_Bljk_HSS_BH_Bias_HAS_SAV_UserArgs_MT256x256x64_MI16x16x1_SN_LDSB1_CLR1_GSU0_GSUC0_GSUWGMRR0_K1_LBSPPA1024_LBSPPB1024_LPA0_MIWT8_8_PLR1_SU0_SUM0_SUS0_VWA8_VWB8_WGM8_WGMXCC1_WGMXCCGn1
    SolutionIndex: 31
    SolutionNameMin: Cijk_Ailk_Bljk_HSS_BH_Bias_HAS_SAV_UserArgs_MT256x256x64_MI16x16x1_SN_LDSB1_CLR1_GSU0_GSUC0_GSUWGMRR0_K1_LBSPPA2048_LBSPPB1024_LPA0_MIWT8_8_PLR1_SU0_SUM0_SUS0_VWA8_VWB8_WGM8_WGMXCC1_WGMXCCGn1
    SolutionIndex: 32
    SolutionNameMin: Cijk_Ailk_Bljk_HSS_BH_Bias_HAS_SAV_UserArgs_MT256x256x64_MI16x16x1_SN_LDSB1_CLR1_GSU0_GSUC0_GSUWGMRR0_K1_LBSPPA4096_LBSPPB1024_LPA0_MIWT8_8_PLR1_SU0_SUM0_SUS0_VWA8_VWB8_WGM8_WGMXCC1_WGMXCCGn1
    SolutionIndex: 33
    SolutionNameMin: Cijk_Ailk_Bljk_HSS_BH_Bias_HAS_SAV_UserArgs_MT128x256x64_MI16x16x1_SN_LDSB1_CLR1_GSU0_GSUC0_GSUWGMRR0_K1_LBSPPA512_LBSPPB1024_LPA0_MIWT4_8_PLR1_SU0_SUM0_SUS0_VWA4_VWB8_WGM1_WGMXCC1_WGMXCCGn1
    SolutionIndex: 34
    SolutionNameMin: Cijk_Ailk_Bljk_HSS_BH_Bias_HAS_SAV_UserArgs_MT128x256x64_MI16x16x1_SN_LDSB1_CLR1_GSU0_GSUC0_GSUWGMRR0_K1_LBSPPA1024_LBSPPB1024_LPA0_MIWT4_8_PLR1_SU0_SUM0_SUS0_VWA4_VWB8_WGM1_WGMXCC1_WGMXCCGn1
    SolutionIndex: 35
    SolutionNameMin: Cijk_Ailk_Bljk_HSS_BH_Bias_HAS_SAV_UserArgs_MT128x256x64_MI16x16x1_SN_LDSB1_CLR1_GSU0_GSUC0_GSUWGMRR0_K1_LBSPPA2048_LBSPPB1024_LPA0_MIWT4_8_PLR1_SU0_SUM0_SUS0_VWA4_VWB8_WGM1_WGMXCC1_WGMXCCGn1
    SolutionIndex: 36
    SolutionNameMin: Cijk_Ailk_Bljk_HSS_BH_Bias_HAS_SAV_UserArgs_MT128x256x64_MI16x16x1_SN_LDSB1_CLR1_GSU0_GSUC0_GSUWGMRR0_K1_LBSPPA512_LBSPPB1024_LPA0_MIWT4_8_PLR1_SU0_SUM0_SUS0_VWA4_VWB8_WGM6_WGMXCC1_WGMXCCGn1
    SolutionIndex: 37
    SolutionNameMin: Cijk_Ailk_Bljk_HSS_BH_Bias_HAS_SAV_UserArgs_MT128x256x64_MI16x16x1_SN_LDSB1_CLR1_GSU0_GSUC0_GSUWGMRR0_K1_LBSPPA2048_LBSPPB1024_LPA0_MIWT4_8_PLR1_SU0_SUM0_SUS0_VWA4_VWB8_WGM6_WGMXCC1_WGMXCCGn1
    SolutionIndex: 38
    SolutionNameMin: Cijk_Ailk_Bljk_HSS_BH_Bias_HAS_SAV_UserArgs_MT128x256x64_MI16x16x1_SN_LDSB1_CLR1_GSU0_GSUC0_GSUWGMRR0_K1_LBSPPA512_LBSPPB1024_LPA0_MIWT4_8_PLR1_SU0_SUM0_SUS0_VWA4_VWB8_WGM8_WGMXCC1_WGMXCCGn1
    SolutionIndex: 39
    SolutionNameMin: Cijk_Ailk_Bljk_HSS_BH_Bias_HAS_SAV_UserArgs_MT128x256x64_MI16x16x1_SN_LDSB1_CLR1_GSU0_GSUC0_GSUWGMRR0_K1_LBSPPA2048_LBSPPB1024_LPA0_MIWT4_8_PLR1_SU0_SUM0_SUS0_VWA4_VWB8_WGM8_WGMXCC1_WGMXCCGn1
    SolutionIndex: 40
    SolutionNameMin: Cijk_Ailk_Bljk_HSS_BH_Bias_HAS_SAV_UserArgs_MT128x256x64_MI16x16x1_SN_LDSB1_CLR1_GSU0_GSUC0_GSUWGMRR0_K1_LBSPPA2048_LBSPPB1024_LPA0_MIWT4_8_PLR1_SU0_SUM0_SUS0_VWA4_VWB8_WGM8_WGMXCC1_WGMXCCGn1
    SolutionIndex: 41
    SolutionNameMin: Cijk_Ailk_Bljk_HSS_BH_Bias_HAS_SAV_UserArgs_MT256x128x64_MI16x16x1_SN_LDSB1_CLR1_GSU0_GSUC0_GSUWGMRR0_K1_LBSPPA2048_LBSPPB512_LPA0_MIWT8_4_PLR1_SU0_SUM0_SUS0_VWA8_VWB4_WGM1_WGMXCC1_WGMXCCGn1
    SolutionIndex: 42
    SolutionNameMin: Cijk_Ailk_Bljk_HSS_BH_Bias_HAS_SAV_UserArgs_MT256x128x64_MI16x16x1_SN_LDSB1_CLR1_GSU0_GSUC0_GSUWGMRR0_K1_LBSPPA4096_LBSPPB512_LPA0_MIWT8_4_PLR1_SU0_SUM0_SUS0_VWA8_VWB4_WGM1_WGMXCC1_WGMXCCGn1
    SolutionIndex: 43
    SolutionNameMin: Cijk_Ailk_Bljk_HSS_BH_Bias_HAS_SAV_UserArgs_MT256x128x64_MI16x16x1_SN_LDSB1_CLR1_GSU0_GSUC0_GSUWGMRR0_K1_LBSPPA4096_LBSPPB512_LPA0_MIWT8_4_PLR1_SU0_SUM0_SUS0_VWA8_VWB4_WGM8_WGMXCC1_WGMXCCGn1
    SolutionIndex: 44
    SolutionNameMin: Cijk_Ailk_Bljk_HSS_BH_Bias_HAS_SAV_UserArgs_MT128x128x64_MI16x16x1_SN_LDSB1_CLR1_GSU0_GSUC0_GSUWGMRR0_K1_LBSPPA2048_LBSPPB512_LPA0_MIWT4_4_PLR1_SU0_SUM0_SUS0_VWA4_VWB4_WGM1_WGMXCC1_WGMXCCGn1
    SolutionIndex: 45
    SolutionNameMin: Cijk_Ailk_Bljk_HSS_BH_Bias_HAS_SAV_UserArgs_MT128x128x64_MI16x16x1_SN_LDSB1_CLR1_GSU0_GSUC0_GSUWGMRR0_K1_LBSPPA512_LBSPPB512_LPA0_MIWT4_4_PLR1_SU0_SUM0_SUS0_VWA4_VWB4_WGM6_WGMXCC1_WGMXCCGn1
    SolutionIndex: 46
    SolutionNameMin: Cijk_Ailk_Bljk_HSS_BH_Bias_HAS_SAV_UserArgs_MT128x128x64_MI16x16x1_SN_LDSB1_CLR1_GSU0_GSUC0_GSUWGMRR0_K1_LBSPPA1024_LBSPPB512_LPA0_MIWT4_4_PLR1_SU0_SUM0_SUS0_VWA4_VWB4_WGM6_WGMXCC1_WGMXCCGn1
    SolutionIndex: 47
    SolutionNameMin: Cijk_Ailk_Bljk_HSS_BH_Bias_HAS_SAV_UserArgs_MT128x128x64_MI16x16x1_SN_LDSB1_CLR1_GSU0_GSUC0_GSUWGMRR0_K1_LBSPPA2048_LBSPPB512_LPA0_MIWT4_4_PLR1_SU0_SUM0_SUS0_VWA4_VWB4_WGM6_WGMXCC1_WGMXCCGn1
    SolutionIndex: 48
    SolutionNameMin: Cijk_Ailk_Bljk_HSS_BH_Bias_HAS_SAV_UserArgs_MT128x128x64_MI16x16x1_SN_LDSB1_CLR1_GSU0_GSUC0_GSUWGMRR0_K1_LBSPPA2048_LBSPPB512_LPA0_MIWT4_4_PLR1_SU0_SUM0_SUS0_VWA4_VWB4_WGM6_WGMXCC1_WGMXCCGn1
    SolutionIndex: 49
    SolutionNameMin: Cijk_Ailk_Bljk_HSS_BH_Bias_HAS_SAV_UserArgs_MT128x128x64_MI16x16x1_SN_LDSB1_CLR1_GSU0_GSUC0_GSUWGMRR0_K1_LBSPPA2048_LBSPPB512_LPA0_MIWT4_4_PLR1_SU0_SUM0_SUS0_VWA4_VWB4_WGM8_WGMXCC1_WGMXCCGn1
    SolutionIndex: 50
    SolutionNameMin: Cijk_Ailk_Bljk_HSS_BH_Bias_HAS_SAV_UserArgs_MT128x128x64_MI16x16x1_SN_LDSB1_CLR1_GSU0_GSUC0_GSUWGMRR0_K1_LBSPPA2048_LBSPPB512_LPA0_MIWT4_4_PLR1_SU0_SUM0_SUS0_VWA4_VWB4_WGM8_WGMXCC1_WGMXCCGn1
    SolutionIndex: 51
    SolutionNameMin: Cijk_Ailk_Bljk_HSS_BH_Bias_HAS_SAV_UserArgs_MT64x128x64_MI16x16x1_SN_LDSB1_CLR1_GSU0_GSUC0_GSUWGMRR0_K1_LBSPPA256_LBSPPB512_LPA32_MIWT2_4_PLR1_SU0_SUM0_SUS0_VWA2_VWB4_WGM1_WGMXCC1_WGMXCCGn1
    SolutionIndex: 52
    SolutionNameMin: Cijk_Ailk_Bljk_HSS_BH_Bias_HAS_SAV_UserArgs_MT64x128x64_MI16x16x1_SN_LDSB1_CLR1_GSU0_GSUC0_GSUWGMRR0_K1_LBSPPA512_LBSPPB512_LPA32_MIWT2_4_PLR1_SU0_SUM0_SUS0_VWA2_VWB4_WGM1_WGMXCC1_WGMXCCGn1
    SolutionIndex: 53
    SolutionNameMin: Cijk_Ailk_Bljk_HSS_BH_Bias_HAS_SAV_UserArgs_MT64x128x64_MI16x16x1_SN_LDSB1_CLR1_GSU0_GSUC0_GSUWGMRR0_K1_LBSPPA512_LBSPPB512_LPA32_MIWT2_4_PLR1_SU0_SUM0_SUS0_VWA2_VWB4_WGM1_WGMXCC1_WGMXCCGn1
    SolutionIndex: 54
    SolutionNameMin: Cijk_Ailk_Bljk_HSS_BH_Bias_HAS_SAV_UserArgs_MT64x128x64_MI16x16x1_SN_LDSB1_CLR1_GSU0_GSUC0_GSUWGMRR0_K1_LBSPPA512_LBSPPB512_LPA32_MIWT2_4_PLR1_SU0_SUM0_SUS0_VWA2_VWB4_WGM1_WGMXCC1_WGMXCCGn1
    SolutionIndex: 55
    SolutionNameMin: Cijk_Ailk_Bljk_HSS_BH_Bias_HAS_SAV_UserArgs_MT64x128x64_MI16x16x1_SN_LDSB1_CLR1_GSU0_GSUC0_GSUWGMRR0_K1_LBSPPA512_LBSPPB512_LPA32_MIWT2_4_PLR1_SU0_SUM0_SUS0_VWA2_VWB4_WGM6_WGMXCC1_WGMXCCGn1
    SolutionIndex: 56
    SolutionNameMin: Cijk_Ailk_Bljk_HSS_BH_Bias_HAS_SAV_UserArgs_MT64x128x64_MI16x16x1_SN_LDSB1_CLR1_GSU0_GSUC0_GSUWGMRR0_K1_LBSPPA512_LBSPPB512_LPA32_MIWT2_4_PLR1_SU0_SUM0_SUS0_VWA2_VWB4_WGM6_WGMXCC1_WGMXCCGn1
    SolutionIndex: 57
    SolutionNameMin: Cijk_Ailk_Bljk_HSS_BH_Bias_HAS_SAV_UserArgs_MT64x128x64_MI16x16x1_SN_LDSB1_CLR1_GSU0_GSUC0_GSUWGMRR0_K1_LBSPPA512_LBSPPB512_LPA32_MIWT2_4_PLR1_SU0_SUM0_SUS0_VWA2_VWB4_WGM6_WGMXCC1_WGMXCCGn1
    SolutionIndex: 58
    SolutionNameMin: Cijk_Ailk_Bljk_HSS_BH_Bias_HAS_SAV_UserArgs_MT64x128x64_MI16x16x1_SN_LDSB1_CLR1_GSU0_GSUC0_GSUWGMRR0_K1_LBSPPA1024_LBSPPB512_LPA32_MIWT2_4_PLR1_SU0_SUM0_SUS0_VWA2_VWB4_WGM6_WGMXCC1_WGMXCCGn1
    SolutionIndex: 59
    SolutionNameMin: Cijk_Ailk_Bljk_HSS_BH_Bias_HAS_SAV_UserArgs_MT64x128x64_MI16x16x1_SN_LDSB1_CLR1_GSU0_GSUC0_GSUWGMRR0_K1_LBSPPA1024_LBSPPB512_LPA32_MIWT2_4_PLR1_SU0_SUM0_SUS0_VWA2_VWB4_WGM6_WGMXCC1_WGMXCCGn1
    SolutionIndex: 60
    SolutionNameMin: Cijk_Ailk_Bljk_HSS_BH_Bias_HAS_SAV_UserArgs_MT64x128x64_MI16x16x1_SN_LDSB1_CLR1_GSU0_GSUC0_GSUWGMRR0_K1_LBSPPA256_LBSPPB512_LPA32_MIWT2_4_PLR1_SU0_SUM0_SUS0_VWA2_VWB4_WGM8_WGMXCC1_WGMXCCGn1
    SolutionIndex: 61
    SolutionNameMin: Cijk_Ailk_Bljk_HSS_BH_Bias_HAS_SAV_UserArgs_MT64x128x64_MI16x16x1_SN_LDSB1_CLR1_GSU0_GSUC0_GSUWGMRR0_K1_LBSPPA512_LBSPPB512_LPA32_MIWT2_4_PLR1_SU0_SUM0_SUS0_VWA2_VWB4_WGM8_WGMXCC1_WGMXCCGn1
    SolutionIndex: 62
    SolutionNameMin: Cijk_Ailk_Bljk_HSS_BH_Bias_HAS_SAV_UserArgs_MT64x128x64_MI16x16x1_SN_LDSB1_CLR1_GSU0_GSUC0_GSUWGMRR0_K1_LBSPPA1024_LBSPPB512_LPA32_MIWT2_4_PLR1_SU0_SUM0_SUS0_VWA2_VWB4_WGM8_WGMXCC1_WGMXCCGn1
    SolutionIndex: 63
    SolutionNameMin: Cijk_Ailk_Bljk_HSS_BH_Bias_HAS_SAV_UserArgs_MT128x64x64_MI16x16x1_SN_LDSB1_CLR1_GSU0_GSUC0_GSUWGMRR0_K1_LBSPPA1024_LBSPPB256_LPA0_MIWT4_2_PLR1_SU0_SUM0_SUS0_VWA4_VWB2_WGM1_WGMXCC1_WGMXCCGn1
    SolutionIndex: 64
    SolutionNameMin: Cijk_Ailk_Bljk_HSS_BH_Bias_HAS_SAV_UserArgs_MT128x64x64_MI16x16x1_SN_LDSB1_CLR1_GSU0_GSUC0_GSUWGMRR0_K1_LBSPPA2048_LBSPPB256_LPA0_MIWT4_2_PLR1_SU0_SUM0_SUS0_VWA4_VWB2_WGM1_WGMXCC1_WGMXCCGn1
    SolutionIndex: 65
    SolutionNameMin: Cijk_Ailk_Bljk_HSS_BH_Bias_HAS_SAV_UserArgs_MT128x64x64_MI16x16x1_SN_LDSB1_CLR1_GSU0_GSUC0_GSUWGMRR0_K1_LBSPPA1024_LBSPPB256_LPA0_MIWT4_2_PLR1_SU0_SUM0_SUS0_VWA4_VWB2_WGM6_WGMXCC1_WGMXCCGn1
    SolutionIndex: 66
    SolutionNameMin: Cijk_Ailk_Bljk_HSS_BH_Bias_HAS_SAV_UserArgs_MT128x64x64_MI16x16x1_SN_LDSB1_CLR1_GSU0_GSUC0_GSUWGMRR0_K1_LBSPPA1024_LBSPPB256_LPA0_MIWT4_2_PLR1_SU0_SUM0_SUS0_VWA4_VWB2_WGM8_WGMXCC1_WGMXCCGn1
    SolutionIndex: 67
    SolutionNameMin: Cijk_Ailk_Bljk_HSS_BH_Bias_HAS_SAV_UserArgs_MT128x64x64_MI16x16x1_SN_LDSB1_CLR1_GSU0_GSUC0_GSUWGMRR0_K1_LBSPPA2048_LBSPPB256_LPA0_MIWT4_2_PLR1_SU0_SUM0_SUS0_VWA4_VWB2_WGM8_WGMXCC1_WGMXCCGn1
    SolutionIndex: 68
    SolutionNameMin: Cijk_Ailk_Bljk_HSS_BH_Bias_HAS_SAV_UserArgs_MT64x64x64_MI16x16x1_SN_LDSB1_CLR1_GSU0_GSUC0_GSUWGMRR0_K1_LBSPPA512_LBSPPB256_LPA32_MIWT2_2_PLR1_SU0_SUM0_SUS0_VWA2_VWB2_WGM1_WGMXCC1_WGMXCCGn1
    SolutionIndex: 69
    SolutionNameMin: Cijk_Ailk_Bljk_HSS_BH_Bias_HAS_SAV_UserArgs_MT64x64x64_MI16x16x1_SN_LDSB1_CLR1_GSU0_GSUC0_GSUWGMRR0_K1_LBSPPA1024_LBSPPB256_LPA32_MIWT2_2_PLR1_SU0_SUM0_SUS0_VWA2_VWB2_WGM6_WGMXCC1_WGMXCCGn1
    SolutionIndex: 70
    SolutionNameMin: Cijk_Ailk_Bljk_HSS_BH_Bias_HAS_SAV_UserArgs_MT64x64x64_MI16x16x1_SN_LDSB1_CLR1_GSU0_GSUC0_GSUWGMRR0_K1_LBSPPA1024_LBSPPB256_LPA32_MIWT2_2_PLR1_SU0_SUM0_SUS0_VWA2_VWB2_WGM8_WGMXCC1_WGMXCCGn1
    SolutionIndex: 71
    SolutionNameMin: Cijk_Ailk_Bljk_HSS_BH_Bias_HAS_SAV_UserArgs_MT256x256x64_MI32x32x1_SN_LDSB1_CLR1_GSU0_GSUC0_GSUWGMRR0_K1_LBSPPA0_LBSPPB512_LPA0_MIWT4_4_PLR1_SU0_SUM0_SUS0_VWA4_VWB4_WGM1_WGMXCC1_WGMXCCGn1
    SolutionIndex: 72
    SolutionNameMin: Cijk_Ailk_Bljk_HSS_BH_Bias_HAS_SAV_UserArgs_MT256x256x64_MI32x32x1_SN_LDSB1_CLR1_GSU0_GSUC0_GSUWGMRR0_K1_LBSPPA0_LBSPPB512_LPA0_MIWT4_4_PLR1_SU0_SUM0_SUS0_VWA4_VWB4_WGM6_WGMXCC1_WGMXCCGn1
    SolutionIndex: 73
    SolutionNameMin: Cijk_Ailk_Bljk_HSS_BH_Bias_HAS_SAV_UserArgs_MT256x256x64_MI32x32x1_SN_LDSB1_CLR1_GSU0_GSUC0_GSUWGMRR0_K1_LBSPPA0_LBSPPB512_LPA0_MIWT4_4_PLR1_SU0_SUM0_SUS0_VWA4_VWB4_WGM6_WGMXCC1_WGMXCCGn1
    SolutionIndex: 74
    SolutionNameMin: Cijk_Ailk_Bljk_HSS_BH_Bias_HAS_SAV_UserArgs_MT256x256x64_MI32x32x1_SN_LDSB1_CLR1_GSU0_GSUC0_GSUWGMRR0_K1_LBSPPA0_LBSPPB512_LPA0_MIWT4_4_PLR1_SU0_SUM0_SUS0_VWA4_VWB4_WGM6_WGMXCC1_WGMXCCGn1
    SolutionIndex: 75
    SolutionNameMin: Cijk_Ailk_Bljk_HSS_BH_Bias_HAS_SAV_UserArgs_MT256x256x64_MI32x32x1_SN_LDSB1_CLR1_GSU0_GSUC0_GSUWGMRR0_K1_LBSPPA0_LBSPPB512_LPA0_MIWT4_4_PLR1_SU0_SUM0_SUS0_VWA4_VWB4_WGM8_WGMXCC1_WGMXCCGn1
    SolutionIndex: 76
    SolutionNameMin: Cijk_Ailk_Bljk_HSS_BH_Bias_HAS_SAV_UserArgs_MT256x256x64_MI32x32x1_SN_LDSB1_CLR1_GSU0_GSUC0_GSUWGMRR0_K1_LBSPPA0_LBSPPB512_LPA0_MIWT4_4_PLR1_SU0_SUM0_SUS0_VWA4_VWB4_WGM8_WGMXCC1_WGMXCCGn1
    SolutionIndex: 77
    SolutionNameMin: Cijk_Ailk_Bljk_HSS_BH_Bias_HAS_SAV_UserArgs_MT128x256x64_MI32x32x1_SN_LDSB1_CLR1_GSU0_GSUC0_GSUWGMRR0_K1_LBSPPA0_LBSPPB512_LPA0_MIWT2_4_PLR1_SU0_SUM0_SUS0_VWA2_VWB4_WGM6_WGMXCC1_WGMXCCGn1
    SolutionIndex: 78
    SolutionNameMin: Cijk_Ailk_Bljk_HSS_BH_Bias_HAS_SAV_UserArgs_MT256x128x64_MI32x32x1_SN_LDSB1_CLR1_GSU0_GSUC0_GSUWGMRR0_K1_LBSPPA0_LBSPPB256_LPA0_MIWT4_2_PLR1_SU0_SUM0_SUS0_VWA4_VWB2_WGM1_WGMXCC1_WGMXCCGn1
    SolutionIndex: 79
    SolutionNameMin: Cijk_Ailk_Bljk_HSS_BH_Bias_HAS_SAV_UserArgs_MT256x128x64_MI32x32x1_SN_LDSB1_CLR1_GSU0_GSUC0_GSUWGMRR0_K1_LBSPPA0_LBSPPB256_LPA0_MIWT4_2_PLR1_SU0_SUM0_SUS0_VWA4_VWB2_WGM6_WGMXCC1_WGMXCCGn1
    SolutionIndex: 80
    SolutionNameMin: Cijk_Ailk_Bljk_HSS_BH_Bias_HAS_SAV_UserArgs_MT256x128x64_MI32x32x1_SN_LDSB1_CLR1_GSU0_GSUC0_GSUWGMRR0_K1_LBSPPA0_LBSPPB256_LPA0_MIWT4_2_PLR1_SU0_SUM0_SUS0_VWA4_VWB2_WGM8_WGMXCC1_WGMXCCGn1
    SolutionIndex: 81
    SolutionNameMin: Cijk_Ailk_Bljk_HSS_BH_Bias_HAS_SAV_UserArgs_MT128x128x128_MI16x16x1_SN_LDSB1_CLR1_GSU0_GSUC0_GSUWGMRR0_K1_LBSPPA1024_LBSPPB1024_LPA0_MIWT4_4_PLR1_SU0_SUM0_SUS0_VWA4_VWB4_WGM1_WGMXCC1_WGMXCCGn1
    SolutionIndex: 82
    SolutionNameMin: Cijk_Ailk_Bljk_HSS_BH_Bias_HAS_SAV_UserArgs_MT128x128x128_MI16x16x1_SN_LDSB1_CLR1_GSU0_GSUC0_GSUWGMRR0_K1_LBSPPA2048_LBSPPB1024_LPA0_MIWT4_4_PLR1_SU0_SUM0_SUS0_VWA4_VWB4_WGM1_WGMXCC1_WGMXCCGn1
    SolutionIndex: 83
    SolutionNameMin: Cijk_Ailk_Bljk_HSS_BH_Bias_HAS_SAV_UserArgs_MT128x128x128_MI16x16x1_SN_LDSB1_CLR1_GSU0_GSUC0_GSUWGMRR0_K1_LBSPPA512_LBSPPB1024_LPA0_MIWT4_4_PLR1_SU0_SUM0_SUS0_VWA4_VWB4_WGM6_WGMXCC1_WGMXCCGn1
    SolutionIndex: 84
    SolutionNameMin: Cijk_Ailk_Bljk_HSS_BH_Bias_HAS_SAV_UserArgs_MT128x128x128_MI16x16x1_SN_LDSB1_CLR1_GSU0_GSUC0_GSUWGMRR0_K1_LBSPPA512_LBSPPB1024_LPA0_MIWT4_4_PLR1_SU0_SUM0_SUS0_VWA4_VWB4_WGM6_WGMXCC1_WGMXCCGn1
    SolutionIndex: 85
    SolutionNameMin: Cijk_Ailk_Bljk_HSS_BH_Bias_HAS_SAV_UserArgs_MT128x128x128_MI16x16x1_SN_LDSB1_CLR1_GSU0_GSUC0_GSUWGMRR0_K1_LBSPPA512_LBSPPB1024_LPA0_MIWT4_4_PLR1_SU0_SUM0_SUS0_VWA4_VWB4_WGM6_WGMXCC1_WGMXCCGn1
    SolutionIndex: 86
    SolutionNameMin: Cijk_Ailk_Bljk_HSS_BH_Bias_HAS_SAV_UserArgs_MT128x128x128_MI16x16x1_SN_LDSB1_CLR1_GSU0_GSUC0_GSUWGMRR0_K1_LBSPPA512_LBSPPB1024_LPA0_MIWT4_4_PLR1_SU0_SUM0_SUS0_VWA4_VWB4_WGM8_WGMXCC1_WGMXCCGn1
    SolutionIndex: 87
    SolutionNameMin: Cijk_Ailk_Bljk_HSS_BH_Bias_HAS_SAV_UserArgs_MT128x128x128_MI16x16x1_SN_LDSB1_CLR1_GSU0_GSUC0_GSUWGMRR0_K1_LBSPPA1024_LBSPPB1024_LPA0_MIWT4_4_PLR1_SU0_SUM0_SUS0_VWA4_VWB4_WGM8_WGMXCC1_WGMXCCGn1
    SolutionIndex: 88
    SolutionNameMin: Cijk_Ailk_Bljk_HSS_BH_Bias_HAS_SAV_UserArgs_MT128x128x128_MI16x16x1_SN_LDSB1_CLR1_GSU0_GSUC0_GSUWGMRR0_K1_LBSPPA2048_LBSPPB1024_LPA0_MIWT4_4_PLR1_SU0_SUM0_SUS0_VWA4_VWB4_WGM8_WGMXCC1_WGMXCCGn1
    SolutionIndex: 89
    SolutionNameMin: Cijk_Ailk_Bljk_HSS_BH_Bias_HAS_SAV_UserArgs_MT128x64x128_MI16x16x1_SN_LDSB1_CLR1_GSU0_GSUC0_GSUWGMRR0_K1_LBSPPA1024_LBSPPB512_LPA0_MIWT4_2_PLR1_SU0_SUM0_SUS0_VWA4_VWB2_WGM1_WGMXCC1_WGMXCCGn1
    SolutionIndex: 90
    SolutionNameMin: Cijk_Ailk_Bljk_HSS_BH_Bias_HAS_SAV_UserArgs_MT128x64x128_MI16x16x1_SN_LDSB1_CLR1_GSU0_GSUC0_GSUWGMRR0_K1_LBSPPA1024_LBSPPB512_LPA0_MIWT4_2_PLR1_SU0_SUM0_SUS0_VWA4_VWB2_WGM1_WGMXCC1_WGMXCCGn1
    SolutionIndex: 91
    SolutionNameMin: Cijk_Ailk_Bljk_HSS_BH_Bias_HAS_SAV_UserArgs_MT128x64x128_MI16x16x1_SN_LDSB1_CLR1_GSU0_GSUC0_GSUWGMRR0_K1_LBSPPA1024_LBSPPB512_LPA0_MIWT4_2_PLR1_SU0_SUM0_SUS0_VWA4_VWB2_WGM1_WGMXCC1_WGMXCCGn1
    SolutionIndex: 92
    SolutionNameMin: Cijk_Ailk_Bljk_HSS_BH_Bias_HAS_SAV_UserArgs_MT128x64x128_MI16x16x1_SN_LDSB1_CLR1_GSU0_GSUC0_GSUWGMRR0_K1_LBSPPA512_LBSPPB512_LPA0_MIWT4_2_PLR1_SU0_SUM0_SUS0_VWA4_VWB2_WGM6_WGMXCC1_WGMXCCGn1
    SolutionIndex: 93
    SolutionNameMin: Cijk_Ailk_Bljk_HSS_BH_Bias_HAS_SAV_UserArgs_MT128x64x128_MI16x16x1_SN_LDSB1_CLR1_GSU0_GSUC0_GSUWGMRR0_K1_LBSPPA1024_LBSPPB512_LPA0_MIWT4_2_PLR1_SU0_SUM0_SUS0_VWA4_VWB2_WGM6_WGMXCC1_WGMXCCGn1
    SolutionIndex: 94
    SolutionNameMin: Cijk_Ailk_Bljk_HSS_BH_Bias_HAS_SAV_UserArgs_MT128x64x128_MI16x16x1_SN_LDSB1_CLR1_GSU0_GSUC0_GSUWGMRR0_K1_LBSPPA2048_LBSPPB512_LPA0_MIWT4_2_PLR1_SU0_SUM0_SUS0_VWA4_VWB2_WGM6_WGMXCC1_WGMXCCGn1
    SolutionIndex: 95
    SolutionNameMin: Cijk_Ailk_Bljk_HSS_BH_Bias_HAS_SAV_UserArgs_MT128x64x128_MI16x16x1_SN_LDSB1_CLR1_GSU0_GSUC0_GSUWGMRR0_K1_LBSPPA1024_LBSPPB512_LPA0_MIWT4_2_PLR1_SU0_SUM0_SUS0_VWA4_VWB2_WGM8_WGMXCC1_WGMXCCGn1
    SolutionIndex: 96
    SolutionNameMin: Cijk_Ailk_Bljk_HSS_BH_Bias_HAS_SAV_UserArgs_MT128x64x128_MI16x16x1_SN_LDSB1_CLR1_GSU0_GSUC0_GSUWGMRR0_K1_LBSPPA1024_LBSPPB512_LPA0_MIWT4_2_PLR1_SU0_SUM0_SUS0_VWA4_VWB2_WGM8_WGMXCC1_WGMXCCGn1
    SolutionIndex: 97
    SolutionNameMin: Cijk_Ailk_Bljk_HSS_BH_Bias_HAS_SAV_UserArgs_MT128x64x128_MI16x16x1_SN_LDSB1_CLR1_GSU0_GSUC0_GSUWGMRR0_K1_LBSPPA2048_LBSPPB512_LPA0_MIWT4_2_PLR1_SU0_SUM0_SUS0_VWA4_VWB2_WGM8_WGMXCC1_WGMXCCGn1
    SolutionIndex: 98
    SolutionNameMin: Cijk_Ailk_Bljk_HSS_BH_Bias_HAS_SAV_UserArgs_MT128x64x128_MI16x16x1_SN_LDSB1_CLR1_GSU0_GSUC0_GSUWGMRR0_K1_LBSPPA2048_LBSPPB512_LPA0_MIWT4_2_PLR1_SU0_SUM0_SUS0_VWA4_VWB2_WGM8_WGMXCC1_WGMXCCGn1
    SolutionIndex: 99
    SolutionNameMin: Cijk_Ailk_Bljk_HSS_BH_Bias_HAS_SAV_UserArgs_MT64x64x128_MI16x16x1_SN_LDSB1_CLR1_GSU0_GSUC0_GSUWGMRR0_K1_LBSPPA256_LBSPPB512_LPA32_MIWT2_2_PLR1_SU0_SUM0_SUS0_VWA2_VWB2_WGM1_WGMXCC1_WGMXCCGn1
    SolutionIndex: 100
    SolutionNameMin: Cijk_Ailk_Bljk_HSS_BH_Bias_HAS_SAV_UserArgs_MT64x64x128_MI16x16x1_SN_LDSB1_CLR1_GSU0_GSUC0_GSUWGMRR0_K1_LBSPPA512_LBSPPB512_LPA32_MIWT2_2_PLR1_SU0_SUM0_SUS0_VWA2_VWB2_WGM1_WGMXCC1_WGMXCCGn1
    SolutionIndex: 101
    SolutionNameMin: Cijk_Ailk_Bljk_HSS_BH_Bias_HAS_SAV_UserArgs_MT64x64x128_MI16x16x1_SN_LDSB1_CLR1_GSU0_GSUC0_GSUWGMRR0_K1_LBSPPA512_LBSPPB512_LPA32_MIWT2_2_PLR1_SU0_SUM0_SUS0_VWA2_VWB2_WGM1_WGMXCC1_WGMXCCGn1
    SolutionIndex: 102
    SolutionNameMin: Cijk_Ailk_Bljk_HSS_BH_Bias_HAS_SAV_UserArgs_MT64x64x128_MI16x16x1_SN_LDSB1_CLR1_GSU0_GSUC0_GSUWGMRR0_K1_LBSPPA512_LBSPPB512_LPA32_MIWT2_2_PLR1_SU0_SUM0_SUS0_VWA2_VWB2_WGM1_WGMXCC1_WGMXCCGn1
    SolutionIndex: 103
    SolutionNameMin: Cijk_Ailk_Bljk_HSS_BH_Bias_HAS_SAV_UserArgs_MT64x64x128_MI16x16x1_SN_LDSB1_CLR1_GSU0_GSUC0_GSUWGMRR0_K1_LBSPPA1024_LBSPPB512_LPA32_MIWT2_2_PLR1_SU0_SUM0_SUS0_VWA2_VWB2_WGM1_WGMXCC1_WGMXCCGn1
    SolutionIndex: 104
    SolutionNameMin: Cijk_Ailk_Bljk_HSS_BH_Bias_HAS_SAV_UserArgs_MT64x64x128_MI16x16x1_SN_LDSB1_CLR1_GSU0_GSUC0_GSUWGMRR0_K1_LBSPPA1024_LBSPPB512_LPA32_MIWT2_2_PLR1_SU0_SUM0_SUS0_VWA2_VWB2_WGM1_WGMXCC1_WGMXCCGn1
    SolutionIndex: 105
    SolutionNameMin: Cijk_Ailk_Bljk_HSS_BH_Bias_HAS_SAV_UserArgs_MT64x64x128_MI16x16x1_SN_LDSB1_CLR1_GSU0_GSUC0_GSUWGMRR0_K1_LBSPPA1024_LBSPPB512_LPA32_MIWT2_2_PLR1_SU0_SUM0_SUS0_VWA2_VWB2_WGM1_WGMXCC1_WGMXCCGn1
    SolutionIndex: 106
    SolutionNameMin: Cijk_Ailk_Bljk_HSS_BH_Bias_HAS_SAV_UserArgs_MT64x64x128_MI16x16x1_SN_LDSB1_CLR1_GSU0_GSUC0_GSUWGMRR0_K1_LBSPPA256_LBSPPB512_LPA32_MIWT2_2_PLR1_SU0_SUM0_SUS0_VWA2_VWB2_WGM6_WGMXCC1_WGMXCCGn1
    SolutionIndex: 107
    SolutionNameMin: Cijk_Ailk_Bljk_HSS_BH_Bias_HAS_SAV_UserArgs_MT64x64x128_MI16x16x1_SN_LDSB1_CLR1_GSU0_GSUC0_GSUWGMRR0_K1_LBSPPA256_LBSPPB512_LPA32_MIWT2_2_PLR1_SU0_SUM0_SUS0_VWA2_VWB2_WGM6_WGMXCC1_WGMXCCGn1
    SolutionIndex: 108
    SolutionNameMin: Cijk_Ailk_Bljk_HSS_BH_Bias_HAS_SAV_UserArgs_MT64x64x128_MI16x16x1_SN_LDSB1_CLR1_GSU0_GSUC0_GSUWGMRR0_K1_LBSPPA512_LBSPPB512_LPA32_MIWT2_2_PLR1_SU0_SUM0_SUS0_VWA2_VWB2_WGM6_WGMXCC1_WGMXCCGn1
    SolutionIndex: 109
    SolutionNameMin: Cijk_Ailk_Bljk_HSS_BH_Bias_HAS_SAV_UserArgs_MT64x64x128_MI16x16x1_SN_LDSB1_CLR1_GSU0_GSUC0_GSUWGMRR0_K1_LBSPPA512_LBSPPB512_LPA32_MIWT2_2_PLR1_SU0_SUM0_SUS0_VWA2_VWB2_WGM6_WGMXCC1_WGMXCCGn1
    SolutionIndex: 110
    SolutionNameMin: Cijk_Ailk_Bljk_HSS_BH_Bias_HAS_SAV_UserArgs_MT64x64x128_MI16x16x1_SN_LDSB1_CLR1_GSU0_GSUC0_GSUWGMRR0_K1_LBSPPA512_LBSPPB512_LPA32_MIWT2_2_PLR1_SU0_SUM0_SUS0_VWA2_VWB2_WGM6_WGMXCC1_WGMXCCGn1
    SolutionIndex: 111
    SolutionNameMin: Cijk_Ailk_Bljk_HSS_BH_Bias_HAS_SAV_UserArgs_MT64x64x128_MI16x16x1_SN_LDSB1_CLR1_GSU0_GSUC0_GSUWGMRR0_K1_LBSPPA1024_LBSPPB512_LPA32_MIWT2_2_PLR1_SU0_SUM0_SUS0_VWA2_VWB2_WGM6_WGMXCC1_WGMXCCGn1
    SolutionIndex: 112
    SolutionNameMin: Cijk_Ailk_Bljk_HSS_BH_Bias_HAS_SAV_UserArgs_MT64x64x128_MI16x16x1_SN_LDSB1_CLR1_GSU0_GSUC0_GSUWGMRR0_K1_LBSPPA256_LBSPPB512_LPA32_MIWT2_2_PLR1_SU0_SUM0_SUS0_VWA2_VWB2_WGM8_WGMXCC1_WGMXCCGn1
    SolutionIndex: 113
    SolutionNameMin: Cijk_Ailk_Bljk_HSS_BH_Bias_HAS_SAV_UserArgs_MT64x64x128_MI16x16x1_SN_LDSB1_CLR1_GSU0_GSUC0_GSUWGMRR0_K1_LBSPPA512_LBSPPB512_LPA32_MIWT2_2_PLR1_SU0_SUM0_SUS0_VWA2_VWB2_WGM8_WGMXCC1_WGMXCCGn1
    SolutionIndex: 114
    SolutionNameMin: Cijk_Ailk_Bljk_HSS_BH_Bias_HAS_SAV_UserArgs_MT64x64x128_MI16x16x1_SN_LDSB1_CLR1_GSU0_GSUC0_GSUWGMRR0_K1_LBSPPA512_LBSPPB512_LPA32_MIWT2_2_PLR1_SU0_SUM0_SUS0_VWA2_VWB2_WGM8_WGMXCC1_WGMXCCGn1
    SolutionIndex: 115
    SolutionNameMin: Cijk_Ailk_Bljk_HSS_BH_Bias_HAS_SAV_UserArgs_MT64x64x128_MI16x16x1_SN_LDSB1_CLR1_GSU0_GSUC0_GSUWGMRR0_K1_LBSPPA512_LBSPPB512_LPA32_MIWT2_2_PLR1_SU0_SUM0_SUS0_VWA2_VWB2_WGM8_WGMXCC1_WGMXCCGn1
    SolutionIndex: 116
    SolutionNameMin: Cijk_Ailk_Bljk_HSS_BH_Bias_HAS_SAV_UserArgs_MT64x64x128_MI16x16x1_SN_LDSB1_CLR1_GSU0_GSUC0_GSUWGMRR0_K1_LBSPPA1024_LBSPPB512_LPA32_MIWT2_2_PLR1_SU0_SUM0_SUS0_VWA2_VWB2_WGM8_WGMXCC1_WGMXCCGn1
    SolutionIndex: 117
    SolutionNameMin: Cijk_Ailk_Bljk_HSS_BH_Bias_HAS_SAV_UserArgs_MT64x64x128_MI16x16x1_SN_LDSB1_CLR1_GSU0_GSUC0_GSUWGMRR0_K1_LBSPPA1024_LBSPPB512_LPA32_MIWT2_2_PLR1_SU0_SUM0_SUS0_VWA2_VWB2_WGM8_WGMXCC1_WGMXCCGn1
    SolutionIndex: 118
    SolutionNameMin: Cijk_Ailk_Bljk_HSS_BH_Bias_HAS_SAV_UserArgs_MT32x64x128_MI16x16x1_SN_LDSB1_CLR1_GSU0_GSUC0_GSUWGMRR0_K1_LBSPPA256_LBSPPB512_LPA16_MIWT1_2_PLR1_SU0_SUM0_SUS0_VWA1_VWB2_WGM1_WGMXCC1_WGMXCCGn1
    SolutionIndex: 119
    SolutionNameMin: Cijk_Ailk_Bljk_HSS_BH_Bias_HAS_SAV_UserArgs_MT32x64x128_MI16x16x1_SN_LDSB1_CLR1_GSU0_GSUC0_GSUWGMRR0_K1_LBSPPA512_LBSPPB512_LPA16_MIWT1_2_PLR1_SU0_SUM0_SUS0_VWA1_VWB2_WGM1_WGMXCC1_WGMXCCGn1
    SolutionIndex: 120
    SolutionNameMin: Cijk_Ailk_Bljk_HSS_BH_Bias_HAS_SAV_UserArgs_MT32x64x128_MI16x16x1_SN_LDSB1_CLR1_GSU0_GSUC0_GSUWGMRR0_K1_LBSPPA512_LBSPPB512_LPA16_MIWT1_2_PLR1_SU0_SUM0_SUS0_VWA1_VWB2_WGM1_WGMXCC1_WGMXCCGn1
    SolutionIndex: 121
    SolutionNameMin: Cijk_Ailk_Bljk_HSS_BH_Bias_HAS_SAV_UserArgs_MT64x32x128_MI16x16x1_SN_LDSB1_CLR1_GSU0_GSUC0_GSUWGMRR0_K1_LBSPPA512_LBSPPB256_LPA32_MIWT2_1_PLR1_SU0_SUM0_SUS0_VWA2_VWB1_WGM1_WGMXCC1_WGMXCCGn1
    SolutionIndex: 122
    SolutionNameMin: Cijk_Ailk_Bljk_HSS_BH_Bias_HAS_SAV_UserArgs_MT64x32x128_MI16x16x1_SN_LDSB1_CLR1_GSU0_GSUC0_GSUWGMRR0_K1_LBSPPA1024_LBSPPB256_LPA32_MIWT2_1_PLR1_SU0_SUM0_SUS0_VWA2_VWB1_WGM1_WGMXCC1_WGMXCCGn1
    SolutionIndex: 123
    SolutionNameMin: Cijk_Ailk_Bljk_HSS_BH_Bias_HAS_SAV_UserArgs_MT64x32x128_MI16x16x1_SN_LDSB1_CLR1_GSU0_GSUC0_GSUWGMRR0_K1_LBSPPA1024_LBSPPB256_LPA32_MIWT2_1_PLR1_SU0_SUM0_SUS0_VWA2_VWB1_WGM6_WGMXCC1_WGMXCCGn1
    SolutionIndex: 124
    SolutionNameMin: Cijk_Ailk_Bljk_HSS_BH_Bias_HAS_SAV_UserArgs_MT64x32x128_MI16x16x1_SN_LDSB1_CLR1_GSU0_GSUC0_GSUWGMRR0_K1_LBSPPA512_LBSPPB256_LPA32_MIWT2_1_PLR1_SU0_SUM0_SUS0_VWA2_VWB1_WGM8_WGMXCC1_WGMXCCGn1
    SolutionIndex: 125
    SolutionNameMin: Cijk_Ailk_Bljk_HSS_BH_Bias_HAS_SAV_UserArgs_MT64x32x128_MI16x16x1_SN_LDSB1_CLR1_GSU0_GSUC0_GSUWGMRR0_K1_LBSPPA1024_LBSPPB256_LPA32_MIWT2_1_PLR1_SU0_SUM0_SUS0_VWA2_VWB1_WGM8_WGMXCC1_WGMXCCGn1
    SolutionIndex: 126
    SolutionNameMin: Cijk_Ailk_Bljk_HSS_BH_Bias_HAS_SAV_UserArgs_MT32x32x128_MI16x16x1_SN_LDSB1_CLR1_GSU0_GSUC0_GSUWGMRR0_K1_LBSPPA256_LBSPPB256_LPA16_MIWT1_1_PLR1_SU0_SUM0_SUS0_VWA1_VWB1_WGM1_WGMXCC1_WGMXCCGn1
    SolutionIndex: 127
    SolutionNameMin: Cijk_Ailk_Bljk_HSS_BH_Bias_HAS_SAV_UserArgs_MT32x32x128_MI16x16x1_SN_LDSB1_CLR1_GSU0_GSUC0_GSUWGMRR0_K1_LBSPPA256_LBSPPB256_LPA16_MIWT1_1_PLR1_SU0_SUM0_SUS0_VWA1_VWB1_WGM1_WGMXCC1_WGMXCCGn1
    SolutionIndex: 128
    SolutionNameMin: Cijk_Ailk_Bljk_HSS_BH_Bias_HAS_SAV_UserArgs_MT32x32x128_MI16x16x1_SN_LDSB1_CLR1_GSU0_GSUC0_GSUWGMRR0_K1_LBSPPA256_LBSPPB256_LPA16_MIWT1_1_PLR1_SU0_SUM0_SUS0_VWA1_VWB1_WGM1_WGMXCC1_WGMXCCGn1
    SolutionIndex: 129
    SolutionNameMin: Cijk_Ailk_Bljk_HSS_BH_Bias_HAS_SAV_UserArgs_MT32x32x128_MI16x16x1_SN_LDSB1_CLR1_GSU0_GSUC0_GSUWGMRR0_K1_LBSPPA256_LBSPPB256_LPA16_MIWT1_1_PLR1_SU0_SUM0_SUS0_VWA1_VWB1_WGM1_WGMXCC1_WGMXCCGn1
    SolutionIndex: 130
    SolutionNameMin: Cijk_Ailk_Bljk_HSS_BH_Bias_HAS_SAV_UserArgs_MT32x32x128_MI16x16x1_SN_LDSB1_CLR1_GSU0_GSUC0_GSUWGMRR0_K1_LBSPPA512_LBSPPB256_LPA16_MIWT1_1_PLR1_SU0_SUM0_SUS0_VWA1_VWB1_WGM1_WGMXCC1_WGMXCCGn1
    SolutionIndex: 131
    SolutionNameMin: Cijk_Ailk_Bljk_HSS_BH_Bias_HAS_SAV_UserArgs_MT32x32x128_MI16x16x1_SN_LDSB1_CLR1_GSU0_GSUC0_GSUWGMRR0_K1_LBSPPA512_LBSPPB256_LPA16_MIWT1_1_PLR1_SU0_SUM0_SUS0_VWA1_VWB1_WGM1_WGMXCC1_WGMXCCGn1
    SolutionIndex: 132
    SolutionNameMin: Cijk_Ailk_Bljk_HSS_BH_Bias_HAS_SAV_UserArgs_MT32x32x128_MI16x16x1_SN_LDSB1_CLR1_GSU0_GSUC0_GSUWGMRR0_K1_LBSPPA512_LBSPPB256_LPA16_MIWT1_1_PLR1_SU0_SUM0_SUS0_VWA1_VWB1_WGM1_WGMXCC1_WGMXCCGn1
    SolutionIndex: 133
    SolutionNameMin: Cijk_Ailk_Bljk_HSS_BH_Bias_HAS_SAV_UserArgs_MT32x32x128_MI16x16x1_SN_LDSB1_CLR1_GSU0_GSUC0_GSUWGMRR0_K1_LBSPPA512_LBSPPB256_LPA16_MIWT1_1_PLR1_SU0_SUM0_SUS0_VWA1_VWB1_WGM1_WGMXCC1_WGMXCCGn1
    SolutionIndex: 134
    SolutionNameMin: Cijk_Ailk_Bljk_HSS_BH_Bias_HAS_SAV_UserArgs_MT32x32x128_MI16x16x1_SN_LDSB1_CLR1_GSU0_GSUC0_GSUWGMRR0_K1_LBSPPA512_LBSPPB256_LPA16_MIWT1_1_PLR1_SU0_SUM0_SUS0_VWA1_VWB1_WGM1_WGMXCC1_WGMXCCGn1
    SolutionIndex: 135
    SolutionNameMin: Cijk_Ailk_Bljk_HSS_BH_Bias_HAS_SAV_UserArgs_MT32x32x128_MI16x16x1_SN_LDSB1_CLR1_GSU0_GSUC0_GSUWGMRR0_K1_LBSPPA256_LBSPPB256_LPA16_MIWT1_1_PLR1_SU0_SUM0_SUS0_VWA1_VWB1_WGM6_WGMXCC1_WGMXCCGn1
    SolutionIndex: 136
    SolutionNameMin: Cijk_Ailk_Bljk_HSS_BH_Bias_HAS_SAV_UserArgs_MT32x32x128_MI16x16x1_SN_LDSB1_CLR1_GSU0_GSUC0_GSUWGMRR0_K1_LBSPPA256_LBSPPB256_LPA16_MIWT1_1_PLR1_SU0_SUM0_SUS0_VWA1_VWB1_WGM6_WGMXCC1_WGMXCCGn1
    SolutionIndex: 137
    SolutionNameMin: Cijk_Ailk_Bljk_HSS_BH_Bias_HAS_SAV_UserArgs_MT32x32x128_MI16x16x1_SN_LDSB1_CLR1_GSU0_GSUC0_GSUWGMRR0_K1_LBSPPA512_LBSPPB256_LPA16_MIWT1_1_PLR1_SU0_SUM0_SUS0_VWA1_VWB1_WGM6_WGMXCC1_WGMXCCGn1
    SolutionIndex: 138
    SolutionNameMin: Cijk_Ailk_Bljk_HSS_BH_Bias_HAS_SAV_UserArgs_MT32x32x128_MI16x16x1_SN_LDSB1_CLR1_GSU0_GSUC0_GSUWGMRR0_K1_LBSPPA256_LBSPPB256_LPA16_MIWT1_1_PLR1_SU0_SUM0_SUS0_VWA1_VWB1_WGM8_WGMXCC1_WGMXCCGn1
    SolutionIndex: 139
    SolutionNameMin: Cijk_Ailk_Bljk_HSS_BH_Bias_HAS_SAV_UserArgs_MT32x32x128_MI16x16x1_SN_LDSB1_CLR1_GSU0_GSUC0_GSUWGMRR0_K1_LBSPPA512_LBSPPB256_LPA16_MIWT1_1_PLR1_SU0_SUM0_SUS0_VWA1_VWB1_WGM8_WGMXCC1_WGMXCCGn1
    SolutionIndex: 140
    SolutionNameMin: Cijk_Ailk_Bljk_HSS_BH_Bias_HAS_SAV_UserArgs_MT128x128x128_MI32x32x1_SN_LDSB1_CLR1_GSU0_GSUC0_GSUWGMRR0_K1_LBSPPA0_LBSPPB512_LPA0_MIWT2_2_PLR1_SU0_SUM0_SUS0_VWA2_VWB2_WGM8_WGMXCC1_WGMXCCGn1
    SolutionIndex: 141
    SolutionNameMin: Cijk_Ailk_Bljk_HSS_BH_Bias_HAS_SAV_UserArgs_MT64x64x128_MI32x32x1_SN_LDSB1_CLR1_GSU0_GSUC0_GSUWGMRR0_K1_LBSPPA0_LBSPPB256_LPA0_MIWT1_1_PLR1_SU0_SUM0_SUS0_VWA1_VWB1_WGM1_WGMXCC1_WGMXCCGn1
    SolutionIndex: 142
    SolutionNameMin: Cijk_Ailk_Bljk_HSS_BH_Bias_HAS_SAV_UserArgs_MT64x64x128_MI32x32x1_SN_LDSB1_CLR1_GSU0_GSUC0_GSUWGMRR0_K1_LBSPPA0_LBSPPB256_LPA0_MIWT1_1_PLR1_SU0_SUM0_SUS0_VWA1_VWB1_WGM1_WGMXCC1_WGMXCCGn1
    SolutionIndex: 143
    SolutionNameMin: Cijk_Ailk_Bljk_HSS_BH_Bias_HAS_SAV_UserArgs_MT64x32x256_MI16x16x1_SN_LDSB1_CLR1_GSU0_GSUC0_GSUWGMRR0_K1_LBSPPA512_LBSPPB512_LPA32_MIWT2_1_PLR1_SU0_SUM0_SUS0_VWA2_VWB1_WGM1_WGMXCC1_WGMXCCGn1
    SolutionIndex: 144
    SolutionNameMin: Cijk_Ailk_Bljk_HSS_BH_Bias_HAS_SAV_UserArgs_MT64x32x256_MI16x16x1_SN_LDSB1_CLR1_GSU0_GSUC0_GSUWGMRR0_K1_LBSPPA1024_LBSPPB512_LPA32_MIWT2_1_PLR1_SU0_SUM0_SUS0_VWA2_VWB1_WGM1_WGMXCC1_WGMXCCGn1
    SolutionIndex: 145
    SolutionNameMin: Cijk_Ailk_Bljk_HSS_BH_Bias_HAS_SAV_UserArgs_MT64x32x256_MI16x16x1_SN_LDSB1_CLR1_GSU0_GSUC0_GSUWGMRR0_K1_LBSPPA1024_LBSPPB512_LPA32_MIWT2_1_PLR1_SU0_SUM0_SUS0_VWA2_VWB1_WGM8_WGMXCC1_WGMXCCGn1
    SolutionIndex: 146
    SolutionNameMin: Cijk_Ailk_Bljk_HSS_BH_Bias_HAS_SAV_UserArgs_MT32x32x256_MI16x16x1_SN_LDSB1_CLR1_GSU0_GSUC0_GSUWGMRR0_K1_LBSPPA256_LBSPPB512_LPA16_MIWT1_1_PLR1_SU0_SUM0_SUS0_VWA1_VWB1_WGM1_WGMXCC1_WGMXCCGn1
    SolutionIndex: 147
    SolutionNameMin: Cijk_Ailk_Bljk_HSS_BH_Bias_HAS_SAV_UserArgs_MT32x32x256_MI16x16x1_SN_LDSB1_CLR1_GSU0_GSUC0_GSUWGMRR0_K1_LBSPPA256_LBSPPB512_LPA16_MIWT1_1_PLR1_SU0_SUM0_SUS0_VWA1_VWB1_WGM1_WGMXCC1_WGMXCCGn1
    SolutionIndex: 148
    SolutionNameMin: Cijk_Ailk_Bljk_HSS_BH_Bias_HAS_SAV_UserArgs_MT32x32x256_MI16x16x1_SN_LDSB1_CLR1_GSU0_GSUC0_GSUWGMRR0_K1_LBSPPA512_LBSPPB512_LPA16_MIWT1_1_PLR1_SU0_SUM0_SUS0_VWA1_VWB1_WGM1_WGMXCC1_WGMXCCGn1
    SolutionIndex: 149
    SolutionNameMin: Cijk_Ailk_Bljk_HSS_BH_Bias_HAS_SAV_UserArgs_MT32x32x256_MI16x16x1_SN_LDSB1_CLR1_GSU0_GSUC0_GSUWGMRR0_K1_LBSPPA512_LBSPPB512_LPA16_MIWT1_1_PLR1_SU0_SUM0_SUS0_VWA1_VWB1_WGM1_WGMXCC1_WGMXCCGn1
    SolutionIndex: 150
    SolutionNameMin: Cijk_Ailk_Bljk_HSS_BH_Bias_HAS_SAV_UserArgs_MT32x32x256_MI16x16x1_SN_LDSB1_CLR1_GSU0_GSUC0_GSUWGMRR0_K1_LBSPPA512_LBSPPB512_LPA16_MIWT1_1_PLR1_SU0_SUM0_SUS0_VWA1_VWB1_WGM6_WGMXCC1_WGMXCCGn1
    SolutionIndex: 151
    SolutionNameMin: Cijk_Ailk_Bljk_HSS_BH_Bias_HAS_SAV_UserArgs_MT32x32x256_MI16x16x1_SN_LDSB1_CLR1_GSU0_GSUC0_GSUWGMRR0_K1_LBSPPA512_LBSPPB512_LPA16_MIWT1_1_PLR1_SU0_SUM0_SUS0_VWA1_VWB1_WGM8_WGMXCC1_WGMXCCGn1
    SolutionIndex: 152
    SolutionNameMin: Cijk_Ailk_Bljk_HSS_BH_Bias_HAS_SAV_UserArgs_MT32x32x32_MI16x16x1_SN_LDSB0_CLR0_GSU0_GSUC0_GSUWGMRR0_K1_LBSPPA256_LBSPPB128_LPA16_MIWT1_1_PLR0_SU32_SUM0_SUS256_VWA1_VWB1_WGM1_WGMXCC1_WGMXCCGn1
- - - [128, 128, 1, 128, 128, 128, 128, 128]
    - [127, 0.04]
  - - [128, 128, 1, 256, 128, 128, 128, 256]
    - [132, 0.071]
  - - [128, 128, 1, 512, 128, 128, 128, 512]
    - [134, 0.12]
  - - [128, 128, 1, 1024, 128, 128, 128, 1024]
    - [147, 0.191]
  - - [128, 128, 1, 2048, 128, 128, 128, 2048]
    - [149, 0.273]
  - - [128, 128, 1, 4096, 128, 128, 128, 4096]
    - [149, 0.339]
  - - [128, 128, 1, 8192, 128, 128, 128, 8192]
    - [149, 0.39]
  - - [128, 256, 1, 128, 128, 128, 128, 128]
    - [134, 0.079]
  - - [128, 256, 1, 256, 128, 128, 128, 256]
    - [127, 0.14]
  - - [128, 256, 1, 512, 128, 128, 128, 512]
    - [127, 0.24]
  - - [128, 256, 1, 1024, 128, 128, 128, 1024]
    - [147, 0.379]
  - - [128, 256, 1, 2048, 128, 128, 128, 2048]
    - [150, 0.537]
  - - [128, 256, 1, 4096, 128, 128, 128, 4096]
    - [151, 0.681]
  - - [128, 256, 1, 8192, 128, 128, 128, 8192]
    - [151, 0.791]
  - - [128, 512, 1, 128, 128, 128, 128, 128]
    - [134, 0.157]
  - - [128, 512, 1, 256, 128, 128, 128, 256]
    - [127, 0.279]
  - - [128, 512, 1, 512, 128, 128, 128, 512]
    - [127, 0.471]
  - - [128, 512, 1, 1024, 128, 128, 128, 1024]
    - [147, 0.757]
  - - [128, 512, 1, 2048, 128, 128, 128, 2048]
    - [151, 1.075]
  - - [128, 512, 1, 4096, 128, 128, 128, 4096]
    - [151, 1.359]
  - - [128, 512, 1, 8192, 128, 128, 128, 8192]
    - [151, 1.574]
  - - [128, 1024, 1, 128, 128, 128, 128, 128]
    - [132, 0.31]
  - - [128, 1024, 1, 256, 128, 128, 128, 256]
    - [149, 0.54]
  - - [128, 1024, 1, 512, 128, 128, 128, 512]
    - [134, 0.921]
  - - [128, 1024, 1, 1024, 128, 128, 128, 1024]
    - [147, 1.491]
  - - [128, 1024, 1, 2048, 128, 128, 128, 2048]
    - [151, 2.125]
  - - [128, 1024, 1, 4096, 128, 128, 128, 4096]
    - [151, 2.691]
  - - [128, 1024, 1, 8192, 128, 128, 128, 8192]
    - [151, 3.144]
  - - [128, 2048, 1, 128, 128, 128, 128, 128]
    - [128, 0.605]
  - - [128, 2048, 1, 256, 128, 128, 128, 256]
    - [148, 1.054]
  - - [128, 2048, 1, 512, 128, 128, 128, 512]
    - [146, 1.747]
  - - [128, 2048, 1, 1024, 128, 128, 128, 1024]
    - [149, 2.884]
  - - [128, 2048, 1, 2048, 128, 128, 128, 2048]
    - [149, 4.125]
  - - [128, 2048, 1, 4096, 128, 128, 128, 4096]
    - [149, 5.231]
  - - [128, 2048, 1, 8192, 128, 128, 128, 8192]
    - [149, 5.931]
  - - [128, 4096, 1, 128, 128, 128, 128, 128]
    - [120, 1.08]
  - - [128, 4096, 1, 256, 128, 128, 128, 256]
    - [122, 1.9]
  - - [128, 4096, 1, 512, 128, 128, 128, 512]
    - [122, 3.176]
  - - [128, 4096, 1, 1024, 128, 128, 128, 1024]
    - [122, 4.871]
  - - [128, 4096, 1, 2048, 128, 128, 128, 2048]
    - [122, 6.715]
  - - [128, 4096, 1, 4096, 128, 128, 128, 4096]
    - [122, 7.924]
  - - [128, 4096, 1, 8192, 128, 128, 128, 8192]
    - [143, 9.091]
  - - [128, 8192, 1, 128, 128, 128, 128, 128]
    - [102, 1.827]
  - - [128, 8192, 1, 256, 128, 128, 128, 256]
    - [105, 3.25]
  - - [128, 8192, 1, 512, 128, 128, 128, 512]
    - [68, 4.984]
  - - [128, 8192, 1, 1024, 128, 128, 128, 1024]
    - [99, 7.228]
  - - [128, 8192, 1, 2048, 128, 128, 128, 2048]
    - [101, 9.145]
  - - [128, 8192, 1, 4096, 128, 128, 128, 4096]
    - [116, 11.883]
  - - [128, 8192, 1, 8192, 128, 128, 128, 8192]
    - [117, 13.567]
  - - [256, 128, 1, 128, 256, 256, 256, 128]
    - [126, 0.079]
  - - [256, 128, 1, 256, 256, 256, 256, 256]
    - [132, 0.14]
  - - [256, 128, 1, 512, 256, 256, 256, 512]
    - [127, 0.241]
  - - [256, 128, 1, 1024, 256, 256, 256, 1024]
    - [149, 0.369]
  - - [256, 128, 1, 2048, 256, 256, 256, 2048]
    - [149, 0.503]
  - - [256, 128, 1, 4096, 256, 256, 256, 4096]
    - [149, 0.616]
  - - [256, 128, 1, 8192, 256, 256, 256, 8192]
    - [150, 0.695]
  - - [256, 256, 1, 128, 256, 256, 256, 128]
    - [134, 0.158]
  - - [256, 256, 1, 256, 256, 256, 256, 256]
    - [147, 0.279]
  - - [256, 256, 1, 512, 256, 256, 256, 512]
    - [132, 0.471]
  - - [256, 256, 1, 1024, 256, 256, 256, 1024]
    - [149, 0.727]
  - - [256, 256, 1, 2048, 256, 256, 256, 2048]
    - [151, 1.0]
  - - [256, 256, 1, 4096, 256, 256, 256, 4096]
    - [150, 1.223]
  - - [256, 256, 1, 8192, 256, 256, 256, 8192]
    - [150, 1.393]
  - - [256, 512, 1, 128, 256, 256, 256, 128]
    - [127, 0.312]
  - - [256, 512, 1, 256, 256, 256, 256, 256]
    - [127, 0.548]
  - - [256, 512, 1, 512, 256, 256, 256, 512]
    - [134, 0.928]
  - - [256, 512, 1, 1024, 256, 256, 256, 1024]
    - [150, 1.441]
  - - [256, 512, 1, 2048, 256, 256, 256, 2048]
    - [151, 2.004]
  - - [256, 512, 1, 4096, 256, 256, 256, 4096]
    - [151, 2.446]
  - - [256, 512, 1, 8192, 256, 256, 256, 8192]
    - [151, 2.778]
  - - [256, 1024, 1, 128, 256, 256, 256, 128]
    - [133, 0.603]
  - - [256, 1024, 1, 256, 256, 256, 256, 256]
    - [148, 1.062]
  - - [256, 1024, 1, 512, 256, 256, 256, 512]
    - [129, 1.777]
  - - [256, 1024, 1, 1024, 256, 256, 256, 1024]
    - [149, 2.804]
  - - [256, 1024, 1, 2048, 256, 256, 256, 2048]
    - [151, 3.857]
  - - [256, 1024, 1, 4096, 256, 256, 256, 4096]
    - [151, 4.754]
  - - [256, 1024, 1, 8192, 256, 256, 256, 8192]
    - [150, 5.402]
  - - [256, 2048, 1, 128, 256, 256, 256, 128]
    - [122, 1.085]
  - - [256, 2048, 1, 256, 256, 256, 256, 256]
    - [144, 1.916]
  - - [256, 2048, 1, 512, 256, 256, 256, 512]
    - [122, 3.23]
  - - [256, 2048, 1, 1024, 256, 256, 256, 1024]
    - [144, 5.0]
  - - [256, 2048, 1, 2048, 256, 256, 256, 2048]
    - [144, 6.714]
  - - [256, 2048, 1, 4096, 256, 256, 256, 4096]
    - [145, 8.264]
  - - [256, 2048, 1, 8192, 256, 256, 256, 8192]
    - [125, 8.821]
  - - [256, 4096, 1, 128, 256, 256, 256, 128]
    - [105, 1.855]
  - - [256, 4096, 1, 256, 256, 256, 256, 256]
    - [105, 3.259]
  - - [256, 4096, 1, 512, 256, 256, 256, 512]
    - [105, 5.401]
  - - [256, 4096, 1, 1024, 256, 256, 256, 1024]
    - [104, 7.845]
  - - [256, 4096, 1, 2048, 256, 256, 256, 2048]
    - [101, 10.591]
  - - [256, 4096, 1, 4096, 256, 256, 256, 4096]
    - [102, 13.136]
  - - [256, 4096, 1, 8192, 256, 256, 256, 8192]
    - [102, 14.392]
  - - [256, 8192, 1, 128, 256, 256, 256, 128]
    - [63, 2.912]
  - - [256, 8192, 1, 256, 256, 256, 256, 256]
    - [63, 5.056]
  - - [256, 8192, 1, 512, 256, 256, 256, 512]
    - [51, 7.491]
  - - [256, 8192, 1, 1024, 256, 256, 256, 1024]
    - [51, 10.431]
  - - [256, 8192, 1, 2048, 256, 256, 256, 2048]
    - [52, 13.975]
  - - [256, 8192, 1, 4096, 256, 256, 256, 4096]
    - [96, 16.834]
  - - [256, 8192, 1, 8192, 256, 256, 256, 8192]
    - [98, 17.618]
  - - [512, 128, 1, 128, 512, 512, 512, 128]
    - [134, 0.157]
  - - [512, 128, 1, 256, 512, 512, 512, 256]
    - [149, 0.278]
  - - [512, 128, 1, 512, 512, 512, 512, 512]
    - [132, 0.475]
  - - [512, 128, 1, 1024, 512, 512, 512, 1024]
    - [134, 0.713]
  - - [512, 128, 1, 2048, 512, 512, 512, 2048]
    - [127, 0.972]
  - - [512, 128, 1, 4096, 512, 512, 512, 4096]
    - [134, 1.193]
  - - [512, 128, 1, 8192, 512, 512, 512, 8192]
    - [134, 1.341]
  - - [512, 256, 1, 128, 512, 512, 512, 128]
    - [130, 0.306]
  - - [512, 256, 1, 256, 512, 512, 512, 256]
    - [148, 0.54]
  - - [512, 256, 1, 512, 512, 512, 512, 512]
    - [129, 0.915]
  - - [512, 256, 1, 1024, 512, 512, 512, 1024]
    - [135, 1.402]
  - - [512, 256, 1, 2048, 512, 512, 512, 2048]
    - [136, 1.933]
  - - [512, 256, 1, 4096, 512, 512, 512, 4096]
    - [137, 2.367]
  - - [512, 256, 1, 8192, 512, 512, 512, 8192]
    - [137, 2.706]
  - - [512, 512, 1, 128, 512, 512, 512, 128]
    - [130, 0.605]
  - - [512, 512, 1, 256, 512, 512, 512, 256]
    - [147, 1.059]
  - - [512, 512, 1, 512, 512, 512, 512, 512]
    - [127, 1.789]
  - - [512, 512, 1, 1024, 512, 512, 512, 1024]
    - [139, 2.741]
  - - [512, 512, 1, 2048, 512, 512, 512, 2048]
    - [139, 3.761]
  - - [512, 512, 1, 4096, 512, 512, 512, 4096]
    - [139, 4.621]
  - - [512, 512, 1, 8192, 512, 512, 512, 8192]
    - [138, 5.284]
  - - [512, 1024, 1, 128, 512, 512, 512, 128]
    - [121, 1.084]
  - - [512, 1024, 1, 256, 512, 512, 512, 256]
    - [144, 1.924]
  - - [512, 1024, 1, 512, 512, 512, 512, 512]
    - [122, 3.223]
  - - [512, 1024, 1, 1024, 512, 512, 512, 1024]
    - [122, 4.944]
  - - [512, 1024, 1, 2048, 512, 512, 512, 2048]
    - [122, 6.709]
  - - [512, 1024, 1, 4096, 512, 512, 512, 4096]
    - [122, 8.206]
  - - [512, 1024, 1, 8192, 512, 512, 512, 8192]
    - [122, 8.918]
  - - [512, 2048, 1, 128, 512, 512, 512, 128]
    - [142, 1.846]
  - - [512, 2048, 1, 256, 512, 512, 512, 256]
    - [105, 3.253]
  - - [512, 2048, 1, 512, 512, 512, 512, 512]
    - [105, 5.449]
  - - [512, 2048, 1, 1024, 512, 512, 512, 1024]
    - [104, 8.021]
  - - [512, 2048, 1, 2048, 512, 512, 512, 2048]
    - [100, 10.729]
  - - [512, 2048, 1, 4096, 512, 512, 512, 4096]
    - [103, 13.505]
  - - [512, 2048, 1, 8192, 512, 512, 512, 8192]
    - [102, 14.702]
  - - [512, 4096, 1, 128, 512, 512, 512, 128]
    - [91, 2.91]
  - - [512, 4096, 1, 256, 512, 512, 512, 256]
    - [54, 5.122]
  - - [512, 4096, 1, 512, 512, 512, 512, 512]
    - [90, 7.847]
  - - [512, 4096, 1, 1024, 512, 512, 512, 1024]
    - [53, 11.005]
  - - [512, 4096, 1, 2048, 512, 512, 512, 2048]
    - [66, 14.525]
  - - [512, 4096, 1, 4096, 512, 512, 512, 4096]
    - [63, 16.906]
  - - [512, 4096, 1, 8192, 512, 512, 512, 8192]
    - [64, 17.334]
  - - [512, 8192, 1, 128, 512, 512, 512, 128]
    - [44, 3.711]
  - - [512, 8192, 1, 256, 512, 512, 512, 256]
    - [9, 6.568]
  - - [512, 8192, 1, 512, 512, 512, 512, 512]
    - [9, 9.892]
  - - [512, 8192, 1, 1024, 512, 512, 512, 1024]
    - [87, 13.939]
  - - [512, 8192, 1, 2048, 512, 512, 512, 2048]
    - [82, 19.26]
  - - [512, 8192, 1, 4096, 512, 512, 512, 4096]
    - [49, 24.364]
  - - [512, 8192, 1, 8192, 512, 512, 512, 8192]
    - [88, 24.06]
  - - [1024, 128, 1, 128, 1024, 1024, 1024, 128]
    - [129, 0.307]
  - - [1024, 128, 1, 256, 1024, 1024, 1024, 256]
    - [149, 0.535]
  - - [1024, 128, 1, 512, 1024, 1024, 1024, 512]
    - [129, 0.908]
  - - [1024, 128, 1, 1024, 1024, 1024, 1024, 1024]
    - [134, 1.398]
  - - [1024, 128, 1, 2048, 1024, 1024, 1024, 2048]
    - [134, 1.904]
  - - [1024, 128, 1, 4096, 1024, 1024, 1024, 4096]
    - [134, 2.328]
  - - [1024, 128, 1, 8192, 1024, 1024, 1024, 8192]
    - [139, 2.651]
  - - [1024, 256, 1, 128, 1024, 1024, 1024, 128]
    - [127, 0.594]
  - - [1024, 256, 1, 256, 1024, 1024, 1024, 256]
    - [137, 1.027]
  - - [1024, 256, 1, 512, 1024, 1024, 1024, 512]
    - [127, 1.744]
  - - [1024, 256, 1, 1024, 1024, 1024, 1024, 1024]
    - [137, 2.689]
  - - [1024, 256, 1, 2048, 1024, 1024, 1024, 2048]
    - [137, 3.697]
  - - [1024, 256, 1, 4096, 1024, 1024, 1024, 4096]
    - [136, 4.58]
  - - [1024, 256, 1, 8192, 1024, 1024, 1024, 8192]
    - [136, 5.197]
  - - [1024, 512, 1, 128, 1024, 1024, 1024, 128]
    - [122, 1.076]
  - - [1024, 512, 1, 256, 1024, 1024, 1024, 256]
    - [122, 1.902]
  - - [1024, 512, 1, 512, 1024, 1024, 1024, 512]
    - [125, 3.19]
  - - [1024, 512, 1, 1024, 1024, 1024, 1024, 1024]
    - [125, 4.924]
  - - [1024, 512, 1, 2048, 1024, 1024, 1024, 2048]
    - [125, 6.695]
  - - [1024, 512, 1, 4096, 1024, 1024, 1024, 4096]
    - [124, 8.201]
  - - [1024, 512, 1, 8192, 1024, 1024, 1024, 8192]
    - [125, 9.068]
  - - [1024, 1024, 1, 128, 1024, 1024, 1024, 128]
    - [103, 1.821]
  - - [1024, 1024, 1, 256, 1024, 1024, 1024, 256]
    - [117, 3.241]
  - - [1024, 1024, 1, 512, 1024, 1024, 1024, 512]
    - [113, 5.417]
  - - [1024, 1024, 1, 1024, 1024, 1024, 1024, 1024]
    - [116, 7.992]
  - - [1024, 1024, 1, 2048, 1024, 1024, 1024, 2048]
    - [108, 10.766]
  - - [1024, 1024, 1, 4096, 1024, 1024, 1024, 4096]
    - [115, 13.695]
  - - [1024, 1024, 1, 8192, 1024, 1024, 1024, 8192]
    - [117, 15.152]
  - - [1024, 2048, 1, 128, 1024, 1024, 1024, 128]
    - [91, 2.894]
  - - [1024, 2048, 1, 256, 1024, 1024, 1024, 256]
    - [64, 5.107]
  - - [1024, 2048, 1, 512, 1024, 1024, 1024, 512]
    - [89, 7.873]
  - - [1024, 2048, 1, 1024, 1024, 1024, 1024, 1024]
    - [89, 11.433]
  - - [1024, 2048, 1, 2048, 1024, 1024, 1024, 2048]
    - [57, 14.914]
  - - [1024, 2048, 1, 4096, 1024, 1024, 1024, 4096]
    - [59, 16.935]
  - - [1024, 2048, 1, 8192, 1024, 1024, 1024, 8192]
    - [62, 17.675]
  - - [1024, 4096, 1, 128, 1024, 1024, 1024, 128]
    - [48, 3.69]
  - - [1024, 4096, 1, 256, 1024, 1024, 1024, 256]
    - [10, 6.233]
  - - [1024, 4096, 1, 512, 1024, 1024, 1024, 512]
    - [10, 10.026]
  - - [1024, 4096, 1, 1024, 1024, 1024, 1024, 1024]
    - [81, 14.59]
  - - [1024, 4096, 1, 2048, 1024, 1024, 1024, 2048]
    - [82, 19.77]
  - - [1024, 4096, 1, 4096, 1024, 1024, 1024, 4096]
    - [44, 25.207]
  - - [1024, 4096, 1, 8192, 1024, 1024, 1024, 8192]
    - [50, 24.738]
  - - [1024, 8192, 1, 128, 1024, 1024, 1024, 128]
    - [1, 4.448]
  - - [1024, 8192, 1, 256, 1024, 1024, 1024, 256]
    - [13, 7.262]
  - - [1024, 8192, 1, 512, 1024, 1024, 1024, 512]
    - [2, 11.79]
  - - [1024, 8192, 1, 1024, 1024, 1024, 1024, 1024]
    - [33, 18.314]
  - - [1024, 8192, 1, 2048, 1024, 1024, 1024, 2048]
    - [42, 26.187]
  - - [1024, 8192, 1, 4096, 1024, 1024, 1024, 4096]
    - [79, 29.863]
  - - [1024, 8192, 1, 8192, 1024, 1024, 1024, 8192]
    - [42, 30.468]
  - - [2048, 128, 1, 128, 2048, 2048, 2048, 128]
    - [131, 0.581]
  - - [2048, 128, 1, 256, 2048, 2048, 2048, 256]
    - [134, 1.032]
  - - [2048, 128, 1, 512, 2048, 2048, 2048, 512]
    - [129, 1.73]
  - - [2048, 128, 1, 1024, 2048, 2048, 2048, 1024]
    - [129, 2.638]
  - - [2048, 128, 1, 2048, 2048, 2048, 2048, 2048]
    - [137, 3.618]
  - - [2048, 128, 1, 4096, 2048, 2048, 2048, 4096]
    - [139, 4.515]
  - - [2048, 128, 1, 8192, 2048, 2048, 2048, 8192]
    - [138, 4.69]
  - - [2048, 256, 1, 128, 2048, 2048, 2048, 128]
    - [118, 1.064]
  - - [2048, 256, 1, 256, 2048, 2048, 2048, 256]
    - [125, 1.865]
  - - [2048, 256, 1, 512, 2048, 2048, 2048, 512]
    - [119, 3.149]
  - - [2048, 256, 1, 1024, 2048, 2048, 2048, 1024]
    - [123, 4.825]
  - - [2048, 256, 1, 2048, 2048, 2048, 2048, 2048]
    - [123, 6.626]
  - - [2048, 256, 1, 4096, 2048, 2048, 2048, 4096]
    - [123, 8.135]
  - - [2048, 256, 1, 8192, 2048, 2048, 2048, 8192]
    - [123, 8.619]
  - - [2048, 512, 1, 128, 2048, 2048, 2048, 128]
    - [117, 1.822]
  - - [2048, 512, 1, 256, 2048, 2048, 2048, 256]
    - [117, 3.193]
  - - [2048, 512, 1, 512, 2048, 2048, 2048, 512]
    - [116, 5.27]
  - - [2048, 512, 1, 1024, 2048, 2048, 2048, 1024]
    - [114, 7.91]
  - - [2048, 512, 1, 2048, 2048, 2048, 2048, 2048]
    - [117, 10.477]
  - - [2048, 512, 1, 4096, 2048, 2048, 2048, 4096]
    - [111, 13.413]
  - - [2048, 512, 1, 8192, 2048, 2048, 2048, 8192]
    - [117, 14.783]
  - - [2048, 1024, 1, 128, 2048, 2048, 2048, 128]
    - [96, 2.858]
  - - [2048, 1024, 1, 256, 2048, 2048, 2048, 256]
    - [64, 4.962]
  - - [2048, 1024, 1, 512, 2048, 2048, 2048, 512]
    - [93, 7.784]
  - - [2048, 1024, 1, 1024, 2048, 2048, 2048, 1024]
    - [95, 11.14]
  - - [2048, 1024, 1, 2048, 2048, 2048, 2048, 2048]
    - [56, 14.496]
  - - [2048, 1024, 1, 4096, 2048, 2048, 2048, 4096]
    - [65, 16.882]
  - - [2048, 1024, 1, 8192, 2048, 2048, 2048, 8192]
    - [59, 17.616]
  - - [2048, 2048, 1, 128, 2048, 2048, 2048, 128]
    - [44, 3.685]
  - - [2048, 2048, 1, 256, 2048, 2048, 2048, 256]
    - [85, 6.103]
  - - [2048, 2048, 1, 512, 2048, 2048, 2048, 512]
    - [83, 10.132]
  - - [2048, 2048, 1, 1024, 2048, 2048, 2048, 1024]
    - [85, 14.659]
  - - [2048, 2048, 1, 2048, 2048, 2048, 2048, 2048]
    - [85, 19.468]
  - - [2048, 2048, 1, 4096, 2048, 2048, 2048, 4096]
    - [50, 25.158]
  - - [2048, 2048, 1, 8192, 2048, 2048, 2048, 8192]
    - [44, 25.052]
  - - [2048, 4096, 1, 128, 2048, 2048, 2048, 128]
    - [2, 4.543]
  - - [2048, 4096, 1, 256, 2048, 2048, 2048, 256]
    - [1, 7.516]
  - - [2048, 4096, 1, 512, 2048, 2048, 2048, 512]
    - [3, 11.72]
  - - [2048, 4096, 1, 1024, 2048, 2048, 2048, 1024]
    - [35, 18.214]
  - - [2048, 4096, 1, 2048, 2048, 2048, 2048, 2048]
    - [37, 25.562]
  - - [2048, 4096, 1, 4096, 2048, 2048, 2048, 4096]
    - [78, 30.48]
  - - [2048, 4096, 1, 8192, 2048, 2048, 2048, 8192]
    - [41, 30.377]
  - - [2048, 8192, 1, 128, 2048, 2048, 2048, 128]
    - [4, 4.972]
  - - [2048, 8192, 1, 256, 2048, 2048, 2048, 256]
    - [5, 8.516]
  - - [2048, 8192, 1, 512, 2048, 2048, 2048, 512]
    - [23, 14.225]
  - - [2048, 8192, 1, 1024, 2048, 2048, 2048, 1024]
    - [15, 22.989]
  - - [2048, 8192, 1, 2048, 2048, 2048, 2048, 2048]
    - [17, 32.088]
  - - [2048, 8192, 1, 4096, 2048, 2048, 2048, 4096]
    - [71, 35.777]
  - - [2048, 8192, 1, 8192, 2048, 2048, 2048, 8192]
    - [32, 37.473]
  - - [4096, 128, 1, 128, 4096, 4096, 4096, 128]
    - [119, 1.064]
  - - [4096, 128, 1, 256, 4096, 4096, 4096, 256]
    - [120, 1.851]
  - - [4096, 128, 1, 512, 4096, 4096, 4096, 512]
    - [125, 3.118]
  - - [4096, 128, 1, 1024, 4096, 4096, 4096, 1024]
    - [123, 4.754]
  - - [4096, 128, 1, 2048, 4096, 4096, 4096, 2048]
    - [123, 6.543]
  - - [4096, 128, 1, 4096, 4096, 4096, 4096, 4096]
    - [125, 7.727]
  - - [4096, 128, 1, 8192, 4096, 4096, 4096, 8192]
    - [123, 8.603]
  - - [4096, 256, 1, 128, 4096, 4096, 4096, 128]
    - [110, 1.797]
  - - [4096, 256, 1, 256, 4096, 4096, 4096, 256]
    - [108, 3.144]
  - - [4096, 256, 1, 512, 4096, 4096, 4096, 512]
    - [109, 5.236]
  - - [4096, 256, 1, 1024, 4096, 4096, 4096, 1024]
    - [107, 7.781]
  - - [4096, 256, 1, 2048, 4096, 4096, 4096, 2048]
    - [108, 10.13]
  - - [4096, 256, 1, 4096, 4096, 4096, 4096, 4096]
    - [115, 13.05]
  - - [4096, 256, 1, 8192, 4096, 4096, 4096, 8192]
    - [110, 14.572]
  - - [4096, 512, 1, 128, 4096, 4096, 4096, 128]
    - [67, 2.838]
  - - [4096, 512, 1, 256, 4096, 4096, 4096, 256]
    - [67, 5.052]
  - - [4096, 512, 1, 512, 4096, 4096, 4096, 512]
    - [97, 7.816]
  - - [4096, 512, 1, 1024, 4096, 4096, 4096, 1024]
    - [92, 10.815]
  - - [4096, 512, 1, 2048, 4096, 4096, 4096, 2048]
    - [61, 14.401]
  - - [4096, 512, 1, 4096, 4096, 4096, 4096, 4096]
    - [55, 16.62]
  - - [4096, 512, 1, 8192, 4096, 4096, 4096, 8192]
    - [58, 17.209]
  - - [4096, 1024, 1, 128, 4096, 4096, 4096, 128]
    - [48, 3.634]
  - - [4096, 1024, 1, 256, 4096, 4096, 4096, 256]
    - [85, 6.121]
  - - [4096, 1024, 1, 512, 4096, 4096, 4096, 512]
    - [86, 10.04]
  - - [4096, 1024, 1, 1024, 4096, 4096, 4096, 1024]
    - [86, 14.287]
  - - [4096, 1024, 1, 2048, 4096, 4096, 4096, 2048]
    - [85, 19.37]
  - - [4096, 1024, 1, 4096, 4096, 4096, 4096, 4096]
    - [46, 24.851]
  - - [4096, 1024, 1, 8192, 4096, 4096, 4096, 8192]
    - [50, 25.653]
  - - [4096, 2048, 1, 128, 4096, 4096, 4096, 128]
    - [13, 4.44]
  - - [4096, 2048, 1, 256, 4096, 4096, 4096, 256]
    - [77, 7.296]
  - - [4096, 2048, 1, 512, 4096, 4096, 4096, 512]
    - [34, 11.473]
  - - [4096, 2048, 1, 1024, 4096, 4096, 4096, 1024]
    - [7, 17.608]
  - - [4096, 2048, 1, 2048, 4096, 4096, 4096, 2048]
    - [43, 25.855]
  - - [4096, 2048, 1, 4096, 4096, 4096, 4096, 4096]
    - [80, 30.292]
  - - [4096, 2048, 1, 8192, 4096, 4096, 4096, 8192]
    - [43, 29.952]
  - - [4096, 4096, 1, 128, 4096, 4096, 4096, 128]
    - [13, 5.081]
  - - [4096, 4096, 1, 256, 4096, 4096, 4096, 256]
    - [8, 8.321]
  - - [4096, 4096, 1, 512, 4096, 4096, 4096, 512]
    - [19, 13.994]
  - - [4096, 4096, 1, 1024, 4096, 4096, 4096, 1024]
    - [75, 22.196]
  - - [4096, 4096, 1, 2048, 4096, 4096, 4096, 2048]
    - [28, 31.334]
  - - [4096, 8192, 1, 128, 4096, 4096, 4096, 128]
    - [24, 5.577]
  - - [4096, 8192, 1, 256, 4096, 4096, 4096, 256]
    - [16, 9.7]
  - - [4096, 8192, 1, 512, 4096, 4096, 4096, 512]
    - [20, 16.185]
  - - [4096, 8192, 1, 1024, 4096, 4096, 4096, 1024]
    - [20, 24.267]
  - - [4096, 8192, 1, 2048, 4096, 4096, 4096, 2048]
    - [73, 31.332]
  - - [8192, 128, 1, 128, 8192, 8192, 8192, 128]
    - [141, 1.773]
  - - [8192, 128, 1, 256, 8192, 8192, 8192, 256]
    - [110, 3.137]
  - - [8192, 128, 1, 512, 8192, 8192, 8192, 512]
    - [69, 4.997]
  - - [8192, 128, 1, 1024, 8192, 8192, 8192, 1024]
    - [70, 7.043]
  - - [8192, 128, 1, 2048, 8192, 8192, 8192, 2048]
    - [106, 9.047]
  - - [8192, 128, 1, 4096, 8192, 8192, 8192, 4096]
    - [112, 11.613]
  - - [8192, 128, 1, 8192, 8192, 8192, 8192, 8192]
    - [111, 13.442]
  - - [8192, 256, 1, 128, 8192, 8192, 8192, 128]
    - [66, 2.85]
  - - [8192, 256, 1, 256, 8192, 8192, 8192, 256]
    - [94, 4.947]
  - - [8192, 256, 1, 512, 8192, 8192, 8192, 512]
    - [60, 7.442]
  - - [8192, 256, 1, 1024, 8192, 8192, 8192, 1024]
    - [60, 10.23]
  - - [8192, 256, 1, 2048, 8192, 8192, 8192, 2048]
    - [61, 13.659]
  - - [8192, 256, 1, 4096, 8192, 8192, 8192, 4096]
    - [65, 16.65]
  - - [8192, 256, 1, 8192, 8192, 8192, 8192, 8192]
    - [58, 16.751]
  - - [8192, 512, 1, 128, 8192, 8192, 8192, 128]
    - [140, 3.566]
  - - [8192, 512, 1, 256, 8192, 8192, 8192, 256]
    - [13, 6.275]
  - - [8192, 512, 1, 512, 8192, 8192, 8192, 512]
    - [14, 9.511]
  - - [8192, 512, 1, 1024, 8192, 8192, 8192, 1024]
    - [84, 14.045]
  - - [8192, 512, 1, 2048, 8192, 8192, 8192, 2048]
    - [45, 19.194]
  - - [8192, 512, 1, 4096, 8192, 8192, 8192, 4096]
    - [47, 24.232]
  - - [8192, 512, 1, 8192, 8192, 8192, 8192, 8192]
    - [49, 23.723]
  - - [8192, 1024, 1, 128, 8192, 8192, 8192, 128]
    - [38, 4.429]
  - - [8192, 1024, 1, 256, 8192, 8192, 8192, 256]
    - [18, 7.084]
  - - [8192, 1024, 1, 512, 8192, 8192, 8192, 512]
    - [6, 11.519]
  - - [8192, 1024, 1, 1024, 8192, 8192, 8192, 1024]
    - [36, 18.687]
  - - [8192, 1024, 1, 2048, 8192, 8192, 8192, 2048]
    - [39, 25.523]
  - - [8192, 1024, 1, 4096, 8192, 8192, 8192, 4096]
    - [80, 29.842]
  - - [8192, 1024, 1, 8192, 8192, 8192, 8192, 8192]
    - [40, 29.519]
  - - [8192, 2048, 1, 128, 8192, 8192, 8192, 128]
    - [11, 5.014]
  - - [8192, 2048, 1, 256, 8192, 8192, 8192, 256]
    - [12, 8.166]
  - - [8192, 2048, 1, 512, 8192, 8192, 8192, 512]
    - [0, 13.845]
  - - [8192, 2048, 1, 1024, 8192, 8192, 8192, 1024]
    - [30, 22.243]
  - - [8192, 2048, 1, 2048, 8192, 8192, 8192, 2048]
    - [72, 30.377]
  - - [8192, 2048, 1, 4096, 8192, 8192, 8192, 4096]
    - [31, 35.315]
  - - [8192, 2048, 1, 8192, 8192, 8192, 8192, 8192]
    - [28, 37.358]
  - - [8192, 4096, 1, 128, 8192, 8192, 8192, 128]
    - [27, 5.547]
  - - [8192, 4096, 1, 256, 8192, 8192, 8192, 256]
    - [25, 9.599]
  - - [8192, 4096, 1, 512, 8192, 8192, 8192, 512]
    - [21, 16.026]
  - - [8192, 4096, 1, 1024, 8192, 8192, 8192, 1024]
    - [74, 23.771]
  - - [8192, 4096, 1, 2048, 8192, 8192, 8192, 2048]
    - [73, 30.602]
  - - [8192, 8192, 1, 128, 8192, 8192, 8192, 128]
    - [26, 6.113]
  - - [8192, 8192, 1, 256, 8192, 8192, 8192, 256]
    - [22, 10.626]
  - - [8192, 8192, 1, 512, 8192, 8192, 8192, 512]
    - [22, 17.056]
  - - [8192, 8192, 1, 1024, 8192, 8192, 8192, 1024]
    - [76, 23.943]
  - - [8192, 8192, 1, 2048, 8192, 8192, 8192, 2048]
    - [76, 30.219]
  - - [4096, 4096, 1, 4096, 4096, 4096, 4096, 4096]
    - [74, 35.684]
  - - [4096, 4096, 1, 8192, 4096, 4096, 4096, 8192]
    - [28, 37.579]
  - - [4096, 8192, 1, 4096, 4096, 4096, 4096, 4096]
    - [32, 34.362]
  - - [4096, 8192, 1, 8192, 4096, 4096, 4096, 8192]
    - [32, 39.414]
  - - [8192, 4096, 1, 4096, 8192, 8192, 8192, 4096]
    - [32, 34.573]
  - - [8192, 4096, 1, 8192, 8192, 8192, 8192, 8192]
    - [28, 38.915]
  - - [8192, 8192, 1, 4096, 8192, 8192, 8192, 4096]
    - [32, 36.63]
  - - [8192, 8192, 1, 8192, 8192, 8192, 8192, 8192]
    - [29, 41.239]
  - - [1, 1, 1, 32, 1, 1, 1, 32]
    - [152, 0.0]
- null
- null
- DeviceEfficiency
- GridBased
