projects/hipblaslt/library/src/amd_detail/rocblaslt/src/Tensile/Logic/asm_full/gfx950/GridBased/gfx950_Cijk_Ailk_Bjlk_I8II_BH_UserArgs.yaml
- {MinimumRequiredVersion: 4.33.0}
- gfx950
- gfx950
- [Device 75a0]
    SolutionIndex: 0
    SolutionNameMin: Cijk_Ailk_Bjlk_I8II_BH_UserArgs_MT256x256x32_MI32x32x1_SN_LDSB0_AFC0_AFEM1_AFEM1_ASEM1_CLR0_CADS0_DTVA0_DTVB0_EPS0_FDSI0_GRPM1_GRVWA16_GRVWB4_GSU0_GSUAMB_GSUC0_GSUWGMRR0_GLS0_ISA950_IU1_K1_LBSPPA0_LBSPPB0_LBSPPM0_LPA0_LPB0_LPM0_LRVW16_LWPMn1_MIAV0_MIWT4_4_MO40_NTn1_NTA0_NTB0_NTC0_NTD0_NTM0_NEPBS0_NLCA1_NLCB1_ONLL1_PGR2_PLR0_PKA1_SIA3_SS1_SU0_SUM0_SUS32_SPO0_SRVW0_SSO0_SVW4_SK3_SKXCCM8_TLDS0_ULSGRO0_USL1_UIOFGRO0_USFGRO0_VSn1_VWA4_VWB2_WSGRA0_WSGRB0_WS64_WG64_4_1_WGM6_WGMXCC1_WGMXCCGn1
    SolutionIndex: 1
    SolutionNameMin: Cijk_Ailk_Bjlk_I8II_BH_UserArgs_MT256x256x32_MI32x32x1_SN_LDSB0_AFC0_AFEM1_AFEM1_ASEM1_CLR0_CADS0_DTVA0_DTVB0_EPS0_FDSI0_GRPM1_GRVWA4_GRVWB8_GSU0_GSUAMB_GSUC0_GSUWGMRR0_GLS0_ISA950_IU1_K1_LBSPPA0_LBSPPB0_LBSPPM0_LPA0_LPB0_LPM0_LRVW16_LWPMn1_MIAV0_MIWT4_4_MO40_NTn1_NTA0_NTB0_NTC0_NTD0_NTM0_NEPBS0_NLCA1_NLCB1_ONLL1_PGR2_PLR0_PKA1_SIA3_SS1_SU0_SUM0_SUS32_SPO0_SRVW0_SSO0_SVW4_SK3_SKXCCM8_TLDS0_ULSGRO0_USL1_UIOFGRO0_USFGRO0_VSn1_VWA4_VWB2_WSGRA0_WSGRB0_WS64_WG64_4_1_WGM6_WGMXCC1_WGMXCCGn1
    SolutionIndex: 2
    SolutionNameMin: Cijk_Ailk_Bjlk_I8II_BH_UserArgs_MT256x256x32_MI32x32x1_SN_LDSB0_AFC0_AFEM1_AFEM1_ASEM1_CLR0_CADS0_DTVA0_DTVB0_EPS0_FDSI0_GRPM1_GRVWA4_GRVWB8_GSU0_GSUAMB_GSUC0_GSUWGMRR0_GLS0_ISA950_IU1_K1_LBSPPA0_LBSPPB0_LBSPPM0_LPA0_LPB0_LPM0_LRVW16_LWPMn1_MIAV0_MIWT4_4_MO40_NTn1_NTA0_NTB0_NTC0_NTD0_NTM0_NEPBS0_NLCA1_NLCB1_ONLL1_PGR2_PLR0_PKA1_SIA3_SS1_SU0_SUM0_SUS32_SPO0_SRVW0_SSO0_SVW4_SK3_SKXCCM8_TLDS0_ULSGRO0_USL1_UIOFGRO0_USFGRO0_VSn1_VWA4_VWB4_WSGRA0_WSGRB0_WS64_WG64_4_1_WGM6_WGMXCC1_WGMXCCGn1
    SolutionIndex: 3
    SolutionNameMin: Cijk_Ailk_Bjlk_I8II_BH_UserArgs_MT128x256x64_MI16x16x1_SN_LDSB1_AFC0_AFEM1_AFEM1_ASEM1_CLR1_CADS0_DTVA0_DTVB0_EPS0_FDSI0_GRPM1_GRVWA16_GRVWB8_GSU0_GSUAMB_GSUC0_GSUWGMRR0_GLS0_ISA950_IU1_K1_LBSPPA1024_LBSPPB2048_LBSPPM0_LPA64_LPB0_LPM0_LRVW8_LWPMn1_MIAV0_MIWT4_8_MO40_NTn1_NTA0_NTB0_NTC0_NTD0_NTM0_NEPBS0_NLCA1_NLCB1_ONLL1_PGR2_PLR1_PKA1_SIA3_SS1_SU0_SUM0_SUS64_SPO0_SRVW0_SSO0_SVW4_SK3_SKXCCM8_TLDS0_ULSGRO0_USL1_UIOFGRO0_USFGRO0_VSn1_VWA4_VWB8_WSGRA0_WSGRB0_WS64_WG32_8_1_WGM6_WGMXCC1_WGMXCCGn1
    SolutionIndex: 4
    SolutionNameMin: Cijk_Ailk_Bjlk_I8II_BH_UserArgs_MT128x256x64_MI16x16x1_SN_LDSB1_AFC0_AFEM1_AFEM1_ASEM1_CLR1_CADS0_DTVA0_DTVB0_EPS0_FDSI0_GRPM1_GRVWA4_GRVWB16_GSU0_GSUAMB_GSUC0_GSUWGMRR0_GLS0_ISA950_IU1_K1_LBSPPA1024_LBSPPB2048_LBSPPM0_LPA64_LPB0_LPM0_LRVW8_LWPMn1_MIAV0_MIWT4_8_MO40_NTn1_NTA0_NTB0_NTC0_NTD0_NTM0_NEPBS0_NLCA1_NLCB1_ONLL1_PGR2_PLR1_PKA1_SIA3_SS1_SU0_SUM0_SUS64_SPO0_SRVW0_SSO0_SVW4_SK3_SKXCCM8_TLDS0_ULSGRO0_USL1_UIOFGRO0_USFGRO0_VSn1_VWA4_VWB8_WSGRA0_WSGRB0_WS64_WG32_8_1_WGM6_WGMXCC1_WGMXCCGn1
    SolutionIndex: 5
    SolutionNameMin: Cijk_Ailk_Bjlk_I8II_BH_UserArgs_MT128x128x64_MI16x16x1_SN_LDSB1_AFC0_AFEM1_AFEM1_ASEM1_CLR1_CADS0_DTVA0_DTVB0_EPS0_FDSI0_GRPM1_GRVWA4_GRVWB4_GSU0_GSUAMB_GSUC0_GSUWGMRR0_GLS0_ISA950_IU1_K1_LBSPPA1024_LBSPPB1024_LBSPPM0_LPA32_LPB32_LPM0_LRVW8_LWPMn1_MIAV0_MIWT4_4_MO40_NTn1_NTA0_NTB0_NTC0_NTD0_NTM0_NEPBS0_NLCA1_NLCB1_ONLL1_PGR2_PLR1_PKA1_SIA3_SS1_SU0_SUM0_SUS64_SPO0_SRVW0_SSO0_SVW2_SK3_SKXCCM8_TLDS0_ULSGRO0_USL1_UIOFGRO0_USFGRO0_VSn1_VWA2_VWB2_WSGRA0_WSGRB0_WS64_WG32_8_1_WGM6_WGMXCC1_WGMXCCGn1
    SolutionIndex: 6
    SolutionNameMin: Cijk_Ailk_Bjlk_I8II_BH_UserArgs_MT128x128x64_MI16x16x1_SN_LDSB1_AFC0_AFEM1_AFEM1_ASEM1_CLR1_CADS0_DTVA0_DTVB0_EPS0_FDSI0_GRPM1_GRVWA4_GRVWB4_GSU0_GSUAMB_GSUC0_GSUWGMRR0_GLS0_ISA950_IU1_K1_LBSPPA1024_LBSPPB1024_LBSPPM0_LPA64_LPB32_LPM0_LRVW8_LWPMn1_MIAV0_MIWT4_4_MO40_NTn1_NTA0_NTB0_NTC0_NTD0_NTM0_NEPBS0_NLCA1_NLCB1_ONLL1_PGR2_PLR1_PKA1_SIA3_SS1_SU0_SUM0_SUS64_SPO0_SRVW0_SSO0_SVW4_SK3_SKXCCM8_TLDS0_ULSGRO0_USL1_UIOFGRO0_USFGRO0_VSn1_VWA4_VWB2_WSGRA0_WSGRB0_WS64_WG32_8_1_WGM6_WGMXCC1_WGMXCCGn1
    SolutionIndex: 7
    SolutionNameMin: Cijk_Ailk_Bjlk_I8II_BH_UserArgs_MT128x128x64_MI16x16x1_SN_LDSB1_AFC0_AFEM1_AFEM1_ASEM1_CLR1_CADS0_DTVA0_DTVB0_EPS0_FDSI0_GRPM1_GRVWA4_GRVWB4_GSU0_GSUAMB_GSUC0_GSUWGMRR0_GLS0_ISA950_IU1_K1_LBSPPA1024_LBSPPB1024_LBSPPM0_LPA64_LPB64_LPM0_LRVW8_LWPMn1_MIAV0_MIWT4_4_MO40_NTn1_NTA0_NTB0_NTC0_NTD0_NTM0_NEPBS0_NLCA1_NLCB1_ONLL1_PGR2_PLR1_PKA1_SIA3_SS1_SU0_SUM0_SUS64_SPO0_SRVW0_SSO0_SVW4_SK3_SKXCCM8_TLDS0_ULSGRO0_USL1_UIOFGRO0_USFGRO0_VSn1_VWA4_VWB4_WSGRA0_WSGRB0_WS64_WG32_8_1_WGM6_WGMXCC1_WGMXCCGn1
    SolutionIndex: 8
    SolutionNameMin: Cijk_Ailk_Bjlk_I8II_BH_UserArgs_MT128x128x64_MI16x16x1_SN_LDSB1_AFC0_AFEM1_AFEM1_ASEM1_CLR1_CADS0_DTVA0_DTVB0_EPS0_FDSI0_GRPM1_GRVWA4_GRVWB8_GSU0_GSUAMB_GSUC0_GSUWGMRR0_GLS0_ISA950_IU1_K1_LBSPPA1024_LBSPPB1024_LBSPPM0_LPA64_LPB32_LPM0_LRVW8_LWPMn1_MIAV0_MIWT4_4_MO40_NTn1_NTA0_NTB0_NTC0_NTD0_NTM0_NEPBS0_NLCA1_NLCB1_ONLL1_PGR2_PLR1_PKA1_SIA3_SS1_SU0_SUM0_SUS64_SPO0_SRVW0_SSO0_SVW4_SK3_SKXCCM8_TLDS0_ULSGRO0_USL1_UIOFGRO0_USFGRO0_VSn1_VWA4_VWB2_WSGRA0_WSGRB0_WS64_WG32_8_1_WGM6_WGMXCC1_WGMXCCGn1
    SolutionIndex: 9
    SolutionNameMin: Cijk_Ailk_Bjlk_I8II_BH_UserArgs_MT128x128x64_MI16x16x1_SN_LDSB1_AFC0_AFEM1_AFEM1_ASEM1_CLR1_CADS0_DTVA0_DTVB0_EPS0_FDSI0_GRPM1_GRVWA4_GRVWB8_GSU0_GSUAMB_GSUC0_GSUWGMRR0_GLS0_ISA950_IU1_K1_LBSPPA1024_LBSPPB1024_LBSPPM0_LPA64_LPB64_LPM0_LRVW8_LWPMn1_MIAV0_MIWT4_4_MO40_NTn1_NTA0_NTB0_NTC0_NTD0_NTM0_NEPBS0_NLCA1_NLCB1_ONLL1_PGR2_PLR1_PKA1_SIA3_SS1_SU0_SUM0_SUS64_SPO0_SRVW0_SSO0_SVW4_SK3_SKXCCM8_TLDS0_ULSGRO0_USL1_UIOFGRO0_USFGRO0_VSn1_VWA4_VWB4_WSGRA0_WSGRB0_WS64_WG32_8_1_WGM6_WGMXCC1_WGMXCCGn1
    SolutionIndex: 10
    SolutionNameMin: Cijk_Ailk_Bjlk_I8II_BH_UserArgs_MT128x128x64_MI16x16x1_SN_LDSB1_AFC0_AFEM1_AFEM1_ASEM1_CLR1_CADS0_DTVA0_DTVB0_EPS0_FDSI0_GRPM1_GRVWA4_GRVWB16_GSU0_GSUAMB_GSUC0_GSUWGMRR0_GLS0_ISA950_IU1_K1_LBSPPA1024_LBSPPB1024_LBSPPM0_LPA64_LPB32_LPM0_LRVW8_LWPMn1_MIAV0_MIWT4_4_MO40_NTn1_NTA0_NTB0_NTC0_NTD0_NTM0_NEPBS0_NLCA1_NLCB1_ONLL1_PGR2_PLR1_PKA1_SIA3_SS1_SU0_SUM0_SUS64_SPO0_SRVW0_SSO0_SVW4_SK3_SKXCCM8_TLDS0_ULSGRO0_USL1_UIOFGRO0_USFGRO0_VSn1_VWA4_VWB2_WSGRA0_WSGRB0_WS64_WG32_8_1_WGM6_WGMXCC1_WGMXCCGn1
    SolutionIndex: 11
    SolutionNameMin: Cijk_Ailk_Bjlk_I8II_BH_UserArgs_MT128x128x64_MI16x16x1_SN_LDSB1_AFC0_AFEM1_AFEM1_ASEM1_CLR1_CADS0_DTVA0_DTVB0_EPS0_FDSI0_GRPM1_GRVWA4_GRVWB16_GSU0_GSUAMB_GSUC0_GSUWGMRR0_GLS0_ISA950_IU1_K1_LBSPPA1024_LBSPPB1024_LBSPPM0_LPA64_LPB64_LPM0_LRVW8_LWPMn1_MIAV0_MIWT4_4_MO40_NTn1_NTA0_NTB0_NTC0_NTD0_NTM0_NEPBS0_NLCA1_NLCB1_ONLL1_PGR2_PLR1_PKA1_SIA3_SS1_SU0_SUM0_SUS64_SPO0_SRVW0_SSO0_SVW4_SK3_SKXCCM8_TLDS0_ULSGRO0_USL1_UIOFGRO0_USFGRO0_VSn1_VWA4_VWB4_WSGRA0_WSGRB0_WS64_WG32_8_1_WGM6_WGMXCC1_WGMXCCGn1
    SolutionIndex: 12
    SolutionNameMin: Cijk_Ailk_Bjlk_I8II_BH_UserArgs_MT128x128x64_MI16x16x1_SN_LDSB1_AFC0_AFEM1_AFEM1_ASEM1_CLR1_CADS0_DTVA0_DTVB0_EPS0_FDSI0_GRPM1_GRVWA16_GRVWB16_GSU0_GSUAMB_GSUC0_GSUWGMRR0_GLS0_ISA950_IU1_K1_LBSPPA1024_LBSPPB1024_LBSPPM0_LPA64_LPB64_LPM0_LRVW8_LWPMn1_MIAV0_MIWT4_4_MO40_NTn1_NTA0_NTB0_NTC0_NTD0_NTM0_NEPBS0_NLCA1_NLCB1_ONLL1_PGR2_PLR1_PKA1_SIA3_SS1_SU0_SUM0_SUS64_SPO0_SRVW0_SSO0_SVW4_SK3_SKXCCM8_TLDS0_ULSGRO0_USL1_UIOFGRO0_USFGRO0_VSn1_VWA4_VWB4_WSGRA0_WSGRB0_WS64_WG32_8_1_WGM6_WGMXCC1_WGMXCCGn1
    SolutionIndex: 13
    SolutionNameMin: Cijk_Ailk_Bjlk_I8II_BH_UserArgs_MT128x64x64_MI16x16x1_SN_LDSB0_AFC0_AFEM1_AFEM1_ASEM1_CLR1_CADS0_DTVA0_DTVB0_EPS0_FDSI0_GRPM1_GRVWA4_GRVWB4_GSU0_GSUAMB_GSUC0_GSUWGMRR0_GLS0_ISA950_IU1_K1_LBSPPA1024_LBSPPB512_LBSPPM0_LPA64_LPB32_LPM0_LRVW8_LWPMn1_MIAV0_MIWT4_2_MO40_NTn1_NTA0_NTB0_NTC0_NTD0_NTM0_NEPBS0_NLCA1_NLCB1_ONLL1_PGR2_PLR1_PKA1_SIA3_SS1_SU0_SUM0_SUS64_SPO0_SRVW0_SSO0_SVW4_SK3_SKXCCM8_TLDS0_ULSGRO0_USL1_UIOFGRO0_USFGRO0_VSn1_VWA4_VWB2_WSGRA0_WSGRB0_WS64_WG32_8_1_WGM6_WGMXCC1_WGMXCCGn1
    SolutionIndex: 14
    SolutionNameMin: Cijk_Ailk_Bjlk_I8II_BH_UserArgs_MT64x64x64_MI16x16x1_SN_LDSB0_AFC0_AFEM1_AFEM1_ASEM1_CLR0_CADS0_DTVA0_DTVB0_EPS0_FDSI0_GRPM1_GRVWA4_GRVWB4_GSU0_GSUAMB_GSUC0_GSUWGMRR0_GLS0_ISA950_IU1_K1_LBSPPA512_LBSPPB512_LBSPPM0_LPA32_LPB32_LPM0_LRVW8_LWPMn1_MIAV0_MIWT2_2_MO40_NTn1_NTA0_NTB0_NTC0_NTD0_NTM0_NEPBS0_NLCA1_NLCB1_ONLL1_PGR2_PLR0_PKA1_SIA3_SS1_SU0_SUM0_SUS64_SPO0_SRVW0_SSO0_SVW2_SK3_SKXCCM8_TLDS0_ULSGRO0_USL1_UIOFGRO0_USFGRO0_VSn1_VWA2_VWB2_WSGRA0_WSGRB0_WS64_WG32_8_1_WGM6_WGMXCC1_WGMXCCGn1
    SolutionIndex: 15
    SolutionNameMin: Cijk_Ailk_Bjlk_I8II_BH_UserArgs_MT256x256x64_MI32x32x1_SN_LDSB0_AFC0_AFEM1_AFEM1_ASEM1_CLR1_CADS0_DTVA0_DTVB0_EPS0_FDSI0_GRPM1_GRVWA4_GRVWB4_GSU0_GSUAMB_GSUC0_GSUWGMRR0_GLS0_ISA950_IU1_K1_LBSPPA0_LBSPPB0_LBSPPM0_LPA0_LPB0_LPM0_LRVW16_LWPMn1_MIAV0_MIWT4_4_MO40_NTn1_NTA0_NTB0_NTC0_NTD0_NTM0_NEPBS0_NLCA1_NLCB1_ONLL1_PGR2_PLR1_PKA1_SIA3_SS1_SU0_SUM0_SUS64_SPO0_SRVW0_SSO0_SVW4_SK3_SKXCCM8_TLDS0_ULSGRO0_USL1_UIOFGRO0_USFGRO0_VSn1_VWA4_VWB4_WSGRA0_WSGRB0_WS64_WG64_4_1_WGM6_WGMXCC1_WGMXCCGn1
    SolutionIndex: 16
    SolutionNameMin: Cijk_Ailk_Bjlk_I8II_BH_UserArgs_MT256x256x64_MI32x32x1_SN_LDSB0_AFC0_AFEM1_AFEM1_ASEM1_CLR1_CADS0_DTVA0_DTVB0_EPS0_FDSI0_GRPM1_GRVWA16_GRVWB4_GSU0_GSUAMB_GSUC0_GSUWGMRR0_GLS0_ISA950_IU1_K1_LBSPPA0_LBSPPB0_LBSPPM0_LPA0_LPB0_LPM0_LRVW16_LWPMn1_MIAV0_MIWT4_4_MO40_NTn1_NTA0_NTB0_NTC0_NTD0_NTM0_NEPBS0_NLCA1_NLCB1_ONLL1_PGR2_PLR1_PKA1_SIA3_SS1_SU0_SUM0_SUS64_SPO0_SRVW0_SSO0_SVW4_SK3_SKXCCM8_TLDS0_ULSGRO0_USL1_UIOFGRO0_USFGRO0_VSn1_VWA4_VWB2_WSGRA0_WSGRB0_WS64_WG64_4_1_WGM6_WGMXCC1_WGMXCCGn1
    SolutionIndex: 17
    SolutionNameMin: Cijk_Ailk_Bjlk_I8II_BH_UserArgs_MT256x256x64_MI32x32x1_SN_LDSB0_AFC0_AFEM1_AFEM1_ASEM1_CLR1_CADS0_DTVA0_DTVB0_EPS0_FDSI0_GRPM1_GRVWA16_GRVWB4_GSU0_GSUAMB_GSUC0_GSUWGMRR0_GLS0_ISA950_IU1_K1_LBSPPA0_LBSPPB0_LBSPPM0_LPA0_LPB0_LPM0_LRVW16_LWPMn1_MIAV0_MIWT4_4_MO40_NTn1_NTA0_NTB0_NTC0_NTD0_NTM0_NEPBS0_NLCA1_NLCB1_ONLL1_PGR2_PLR1_PKA1_SIA3_SS1_SU0_SUM0_SUS64_SPO0_SRVW0_SSO0_SVW4_SK3_SKXCCM8_TLDS0_ULSGRO0_USL1_UIOFGRO0_USFGRO0_VSn1_VWA4_VWB4_WSGRA0_WSGRB0_WS64_WG64_4_1_WGM6_WGMXCC1_WGMXCCGn1
    SolutionIndex: 18
    SolutionNameMin: Cijk_Ailk_Bjlk_I8II_BH_UserArgs_MT256x256x64_MI32x32x1_SN_LDSB0_AFC0_AFEM1_AFEM1_ASEM1_CLR1_CADS0_DTVA0_DTVB0_EPS0_FDSI0_GRPM1_GRVWA4_GRVWB8_GSU0_GSUAMB_GSUC0_GSUWGMRR0_GLS0_ISA950_IU1_K1_LBSPPA0_LBSPPB0_LBSPPM0_LPA0_LPB0_LPM0_LRVW16_LWPMn1_MIAV0_MIWT4_4_MO40_NTn1_NTA0_NTB0_NTC0_NTD0_NTM0_NEPBS0_NLCA1_NLCB1_ONLL1_PGR2_PLR1_PKA1_SIA3_SS1_SU0_SUM0_SUS64_SPO0_SRVW0_SSO0_SVW4_SK3_SKXCCM8_TLDS0_ULSGRO0_USL1_UIOFGRO0_USFGRO0_VSn1_VWA4_VWB4_WSGRA0_WSGRB0_WS64_WG64_4_1_WGM6_WGMXCC1_WGMXCCGn1
    SolutionIndex: 19
    SolutionNameMin: Cijk_Ailk_Bjlk_I8II_BH_UserArgs_MT256x256x64_MI32x32x1_SN_LDSB0_AFC0_AFEM1_AFEM1_ASEM1_CLR1_CADS0_DTVA0_DTVB0_EPS0_FDSI0_GRPM1_GRVWA16_GRVWB8_GSU0_GSUAMB_GSUC0_GSUWGMRR0_GLS0_ISA950_IU1_K1_LBSPPA0_LBSPPB0_LBSPPM0_LPA0_LPB0_LPM0_LRVW16_LWPMn1_MIAV0_MIWT4_4_MO40_NTn1_NTA0_NTB0_NTC0_NTD0_NTM0_NEPBS0_NLCA1_NLCB1_ONLL1_PGR2_PLR1_PKA1_SIA3_SS1_SU0_SUM0_SUS64_SPO0_SRVW0_SSO0_SVW4_SK3_SKXCCM8_TLDS0_ULSGRO0_USL1_UIOFGRO0_USFGRO0_VSn1_VWA4_VWB2_WSGRA0_WSGRB0_WS64_WG64_4_1_WGM6_WGMXCC1_WGMXCCGn1
    SolutionIndex: 20
    SolutionNameMin: Cijk_Ailk_Bjlk_I8II_BH_UserArgs_MT256x256x64_MI32x32x1_SN_LDSB0_AFC0_AFEM1_AFEM1_ASEM1_CLR1_CADS0_DTVA0_DTVB0_EPS0_FDSI0_GRPM1_GRVWA16_GRVWB8_GSU0_GSUAMB_GSUC0_GSUWGMRR0_GLS0_ISA950_IU1_K1_LBSPPA0_LBSPPB0_LBSPPM0_LPA0_LPB0_LPM0_LRVW16_LWPMn1_MIAV0_MIWT4_4_MO40_NTn1_NTA0_NTB0_NTC0_NTD0_NTM0_NEPBS0_NLCA1_NLCB1_ONLL1_PGR2_PLR1_PKA1_SIA3_SS1_SU0_SUM0_SUS64_SPO0_SRVW0_SSO0_SVW4_SK3_SKXCCM8_TLDS0_ULSGRO0_USL1_UIOFGRO0_USFGRO0_VSn1_VWA4_VWB4_WSGRA0_WSGRB0_WS64_WG64_4_1_WGM6_WGMXCC1_WGMXCCGn1
    SolutionIndex: 21
    SolutionNameMin: Cijk_Ailk_Bjlk_I8II_BH_UserArgs_MT128x256x64_MI32x32x1_SN_LDSB1_AFC0_AFEM1_AFEM1_ASEM1_CLR1_CADS0_DTVA0_DTVB0_EPS0_FDSI0_GRPM1_GRVWA16_GRVWB4_GSU0_GSUAMB_GSUC0_GSUWGMRR0_GLS0_ISA950_IU1_K1_LBSPPA0_LBSPPB0_LBSPPM0_LPA0_LPB0_LPM0_LRVW16_LWPMn1_MIAV0_MIWT2_4_MO40_NTn1_NTA0_NTB0_NTC0_NTD0_NTM0_NEPBS0_NLCA1_NLCB1_ONLL1_PGR2_PLR1_PKA1_SIA3_SS1_SU0_SUM0_SUS64_SPO0_SRVW0_SSO0_SVW2_SK3_SKXCCM8_TLDS0_ULSGRO0_USL1_UIOFGRO0_USFGRO0_VSn1_VWA2_VWB4_WSGRA0_WSGRB0_WS64_WG64_4_1_WGM6_WGMXCC1_WGMXCCGn1
    SolutionIndex: 22
    SolutionNameMin: Cijk_Ailk_Bjlk_I8II_BH_UserArgs_MT256x128x64_MI32x32x1_SN_LDSB1_AFC0_AFEM1_AFEM1_ASEM1_CLR1_CADS0_DTVA0_DTVB0_EPS0_FDSI0_GRPM1_GRVWA16_GRVWB4_GSU0_GSUAMB_GSUC0_GSUWGMRR0_GLS0_ISA950_IU1_K1_LBSPPA0_LBSPPB0_LBSPPM0_LPA0_LPB0_LPM0_LRVW16_LWPMn1_MIAV0_MIWT4_2_MO40_NTn1_NTA0_NTB0_NTC0_NTD0_NTM0_NEPBS0_NLCA1_NLCB1_ONLL1_PGR2_PLR1_PKA1_SIA3_SS1_SU0_SUM0_SUS64_SPO0_SRVW0_SSO0_SVW4_SK3_SKXCCM8_TLDS0_ULSGRO0_USL1_UIOFGRO0_USFGRO0_VSn1_VWA4_VWB2_WSGRA0_WSGRB0_WS64_WG64_4_1_WGM6_WGMXCC1_WGMXCCGn1
    SolutionIndex: 23
    SolutionNameMin: Cijk_Ailk_Bjlk_I8II_BH_UserArgs_MT256x128x64_MI32x32x1_SN_LDSB1_AFC0_AFEM1_AFEM1_ASEM1_CLR1_CADS0_DTVA0_DTVB0_EPS0_FDSI0_GRPM1_GRVWA4_GRVWB8_GSU0_GSUAMB_GSUC0_GSUWGMRR0_GLS0_ISA950_IU1_K1_LBSPPA0_LBSPPB0_LBSPPM0_LPA0_LPB0_LPM0_LRVW16_LWPMn1_MIAV0_MIWT4_2_MO40_NTn1_NTA0_NTB0_NTC0_NTD0_NTM0_NEPBS0_NLCA1_NLCB1_ONLL1_PGR2_PLR1_PKA1_SIA3_SS1_SU0_SUM0_SUS64_SPO0_SRVW0_SSO0_SVW4_SK3_SKXCCM8_TLDS0_ULSGRO0_USL1_UIOFGRO0_USFGRO0_VSn1_VWA4_VWB2_WSGRA0_WSGRB0_WS64_WG64_4_1_WGM6_WGMXCC1_WGMXCCGn1
    SolutionIndex: 24
    SolutionNameMin: Cijk_Ailk_Bjlk_I8II_BH_UserArgs_MT256x128x64_MI32x32x1_SN_LDSB1_AFC0_AFEM1_AFEM1_ASEM1_CLR1_CADS0_DTVA0_DTVB0_EPS0_FDSI0_GRPM1_GRVWA16_GRVWB8_GSU0_GSUAMB_GSUC0_GSUWGMRR0_GLS0_ISA950_IU1_K1_LBSPPA0_LBSPPB0_LBSPPM0_LPA0_LPB0_LPM0_LRVW16_LWPMn1_MIAV0_MIWT4_2_MO40_NTn1_NTA0_NTB0_NTC0_NTD0_NTM0_NEPBS0_NLCA1_NLCB1_ONLL1_PGR2_PLR1_PKA1_SIA3_SS1_SU0_SUM0_SUS64_SPO0_SRVW0_SSO0_SVW4_SK3_SKXCCM8_TLDS0_ULSGRO0_USL1_UIOFGRO0_USFGRO0_VSn1_VWA4_VWB2_WSGRA0_WSGRB0_WS64_WG64_4_1_WGM6_WGMXCC1_WGMXCCGn1
    SolutionIndex: 25
    SolutionNameMin: Cijk_Ailk_Bjlk_I8II_BH_UserArgs_MT128x256x128_MI16x16x1_SN_LDSB1_AFC0_AFEM1_AFEM1_ASEM1_CLR1_CADS0_DTVA0_DTVB0_EPS0_FDSI0_GRPM1_GRVWA16_GRVWB16_GSU0_GSUAMB_GSUC0_GSUWGMRR0_GLS0_ISA950_IU1_K1_LBSPPA1024_LBSPPB2048_LBSPPM0_LPA64_LPB0_LPM0_LRVW8_LWPMn1_MIAV0_MIWT4_8_MO40_NTn1_NTA0_NTB0_NTC0_NTD0_NTM0_NEPBS0_NLCA1_NLCB1_ONLL1_PGR2_PLR1_PKA1_SIA3_SS1_SU0_SUM0_SUS128_SPO0_SRVW0_SSO0_SVW4_SK3_SKXCCM8_TLDS0_ULSGRO0_USL1_UIOFGRO0_USFGRO0_VSn1_VWA4_VWB8_WSGRA0_WSGRB0_WS64_WG32_8_1_WGM6_WGMXCC1_WGMXCCGn1
    SolutionIndex: 26
    SolutionNameMin: Cijk_Ailk_Bjlk_I8II_BH_UserArgs_MT128x256x128_MI16x16x1_SN_LDSB1_AFC0_AFEM1_AFEM1_ASEM1_CLR1_CADS0_DTVA0_DTVB0_EPS0_FDSI0_GRPM1_GRVWA16_GRVWB16_GSU0_GSUAMB_GSUC0_GSUWGMRR0_GLS0_ISA950_IU1_K1_LBSPPA1024_LBSPPB2048_LBSPPM0_LPA64_LPB0_LPM0_LRVW8_LWPMn1_MIAV0_MIWT4_8_MO40_NTn1_NTA0_NTB0_NTC0_NTD0_NTM0_NEPBS0_NLCA1_NLCB1_ONLL1_PGR2_PLR2_PKA1_SIA3_SS1_SU0_SUM0_SUS128_SPO0_SRVW0_SSO0_SVW4_SK3_SKXCCM8_TLDS0_ULSGRO0_USL1_UIOFGRO0_USFGRO0_VSn1_VWA4_VWB8_WSGRA0_WSGRB0_WS64_WG32_8_1_WGM6_WGMXCC1_WGMXCCGn1
    SolutionIndex: 27
    SolutionNameMin: Cijk_Ailk_Bjlk_I8II_BH_UserArgs_MT128x128x128_MI16x16x1_SN_LDSB1_AFC0_AFEM1_AFEM1_ASEM1_CLR1_CADS0_DTVA0_DTVB0_EPS0_FDSI0_GRPM1_GRVWA4_GRVWB4_GSU0_GSUAMB_GSUC0_GSUWGMRR0_GLS0_ISA950_IU1_K1_LBSPPA1024_LBSPPB1024_LBSPPM0_LPA64_LPB64_LPM0_LRVW8_LWPMn1_MIAV0_MIWT4_4_MO40_NTn1_NTA0_NTB0_NTC0_NTD0_NTM0_NEPBS0_NLCA1_NLCB1_ONLL1_PGR2_PLR1_PKA1_SIA3_SS1_SU0_SUM0_SUS128_SPO0_SRVW0_SSO0_SVW4_SK3_SKXCCM8_TLDS0_ULSGRO0_USL1_UIOFGRO0_USFGRO0_VSn1_VWA4_VWB4_WSGRA0_WSGRB0_WS64_WG32_8_1_WGM6_WGMXCC1_WGMXCCGn1
    SolutionIndex: 28
    SolutionNameMin: Cijk_Ailk_Bjlk_I8II_BH_UserArgs_MT128x128x128_MI16x16x1_SN_LDSB1_AFC0_AFEM1_AFEM1_ASEM1_CLR1_CADS0_DTVA0_DTVB0_EPS0_FDSI0_GRPM1_GRVWA16_GRVWB4_GSU0_GSUAMB_GSUC0_GSUWGMRR0_GLS0_ISA950_IU1_K1_LBSPPA1024_LBSPPB1024_LBSPPM0_LPA64_LPB64_LPM0_LRVW8_LWPMn1_MIAV0_MIWT4_4_MO40_NTn1_NTA0_NTB0_NTC0_NTD0_NTM0_NEPBS0_NLCA1_NLCB1_ONLL1_PGR2_PLR1_PKA1_SIA3_SS1_SU0_SUM0_SUS128_SPO0_SRVW0_SSO0_SVW4_SK3_SKXCCM8_TLDS0_ULSGRO0_USL1_UIOFGRO0_USFGRO0_VSn1_VWA4_VWB4_WSGRA0_WSGRB0_WS64_WG32_8_1_WGM6_WGMXCC1_WGMXCCGn1
    SolutionIndex: 29
    SolutionNameMin: Cijk_Ailk_Bjlk_I8II_BH_UserArgs_MT128x128x128_MI16x16x1_SN_LDSB1_AFC0_AFEM1_AFEM1_ASEM1_CLR1_CADS0_DTVA0_DTVB0_EPS0_FDSI0_GRPM1_GRVWA16_GRVWB16_GSU0_GSUAMB_GSUC0_GSUWGMRR0_GLS0_ISA950_IU1_K1_LBSPPA1024_LBSPPB1024_LBSPPM0_LPA64_LPB64_LPM0_LRVW8_LWPMn1_MIAV0_MIWT4_4_MO40_NTn1_NTA0_NTB0_NTC0_NTD0_NTM0_NEPBS0_NLCA1_NLCB1_ONLL1_PGR2_PLR1_PKA1_SIA3_SS1_SU0_SUM0_SUS128_SPO0_SRVW0_SSO0_SVW4_SK3_SKXCCM8_TLDS0_ULSGRO0_USL1_UIOFGRO0_USFGRO0_VSn1_VWA4_VWB4_WSGRA0_WSGRB0_WS64_WG32_8_1_WGM6_WGMXCC1_WGMXCCGn1
    SolutionIndex: 30
    SolutionNameMin: Cijk_Ailk_Bjlk_I8II_BH_UserArgs_MT128x128x128_MI16x16x1_SN_LDSB1_AFC0_AFEM1_AFEM1_ASEM1_CLR1_CADS0_DTVA0_DTVB0_EPS0_FDSI0_GRPM1_GRVWA4_GRVWB16_GSU0_GSUAMB_GSUC0_GSUWGMRR0_GLS0_ISA950_IU1_K1_LBSPPA1024_LBSPPB1024_LBSPPM0_LPA64_LPB64_LPM0_LRVW8_LWPMn1_MIAV0_MIWT4_4_MO40_NTn1_NTA0_NTB0_NTC0_NTD0_NTM0_NEPBS0_NLCA1_NLCB1_ONLL1_PGR2_PLR2_PKA1_SIA3_SS1_SU0_SUM0_SUS128_SPO0_SRVW0_SSO0_SVW4_SK3_SKXCCM8_TLDS0_ULSGRO0_USL1_UIOFGRO0_USFGRO0_VSn1_VWA4_VWB4_WSGRA0_WSGRB0_WS64_WG32_8_1_WGM6_WGMXCC1_WGMXCCGn1
    SolutionIndex: 31
    SolutionNameMin: Cijk_Ailk_Bjlk_I8II_BH_UserArgs_MT128x128x128_MI16x16x1_SN_LDSB1_AFC0_AFEM1_AFEM1_ASEM1_CLR1_CADS0_DTVA0_DTVB0_EPS0_FDSI0_GRPM1_GRVWA16_GRVWB16_GSU0_GSUAMB_GSUC0_GSUWGMRR0_GLS0_ISA950_IU1_K1_LBSPPA1024_LBSPPB1024_LBSPPM0_LPA64_LPB32_LPM0_LRVW8_LWPMn1_MIAV0_MIWT4_4_MO40_NTn1_NTA0_NTB0_NTC0_NTD0_NTM0_NEPBS0_NLCA1_NLCB1_ONLL1_PGR2_PLR2_PKA1_SIA3_SS1_SU0_SUM0_SUS128_SPO0_SRVW0_SSO0_SVW4_SK3_SKXCCM8_TLDS0_ULSGRO0_USL1_UIOFGRO0_USFGRO0_VSn1_VWA4_VWB2_WSGRA0_WSGRB0_WS64_WG32_8_1_WGM6_WGMXCC1_WGMXCCGn1
    SolutionIndex: 32
    SolutionNameMin: Cijk_Ailk_Bjlk_I8II_BH_UserArgs_MT128x128x128_MI16x16x1_SN_LDSB1_AFC0_AFEM1_AFEM1_ASEM1_CLR1_CADS0_DTVA0_DTVB0_EPS0_FDSI0_GRPM1_GRVWA16_GRVWB16_GSU0_GSUAMB_GSUC0_GSUWGMRR0_GLS0_ISA950_IU1_K1_LBSPPA1024_LBSPPB1024_LBSPPM0_LPA64_LPB64_LPM0_LRVW8_LWPMn1_MIAV0_MIWT4_4_MO40_NTn1_NTA0_NTB0_NTC0_NTD0_NTM0_NEPBS0_NLCA1_NLCB1_ONLL1_PGR2_PLR2_PKA1_SIA3_SS1_SU0_SUM0_SUS128_SPO0_SRVW0_SSO0_SVW4_SK3_SKXCCM8_TLDS0_ULSGRO0_USL1_UIOFGRO0_USFGRO0_VSn1_VWA4_VWB4_WSGRA0_WSGRB0_WS64_WG32_8_1_WGM6_WGMXCC1_WGMXCCGn1
    SolutionIndex: 33
    SolutionNameMin: Cijk_Ailk_Bjlk_I8II_BH_UserArgs_MT64x128x128_MI16x16x1_SN_LDSB1_AFC0_AFEM1_AFEM1_ASEM1_CLR1_CADS0_DTVA0_DTVB0_EPS0_FDSI0_GRPM1_GRVWA16_GRVWB16_GSU0_GSUAMB_GSUC0_GSUWGMRR0_GLS0_ISA950_IU1_K1_LBSPPA512_LBSPPB1024_LBSPPM0_LPA32_LPB64_LPM0_LRVW8_LWPMn1_MIAV0_MIWT2_4_MO40_NTn1_NTA0_NTB0_NTC0_NTD0_NTM0_NEPBS0_NLCA1_NLCB1_ONLL1_PGR2_PLR1_PKA1_SIA3_SS1_SU0_SUM0_SUS128_SPO0_SRVW0_SSO0_SVW2_SK3_SKXCCM8_TLDS0_ULSGRO0_USL1_UIOFGRO0_USFGRO0_VSn1_VWA2_VWB4_WSGRA0_WSGRB0_WS64_WG32_8_1_WGM6_WGMXCC1_WGMXCCGn1
    SolutionIndex: 34
    SolutionNameMin: Cijk_Ailk_Bjlk_I8II_BH_UserArgs_MT64x128x128_MI16x16x1_SN_LDSB1_AFC0_AFEM1_AFEM1_ASEM1_CLR1_CADS0_DTVA0_DTVB0_EPS0_FDSI0_GRPM1_GRVWA4_GRVWB16_GSU0_GSUAMB_GSUC0_GSUWGMRR0_GLS0_ISA950_IU1_K1_LBSPPA512_LBSPPB1024_LBSPPM0_LPA32_LPB64_LPM0_LRVW8_LWPMn1_MIAV0_MIWT2_4_MO40_NTn1_NTA0_NTB0_NTC0_NTD0_NTM0_NEPBS0_NLCA1_NLCB1_ONLL1_PGR2_PLR2_PKA1_SIA3_SS1_SU0_SUM0_SUS128_SPO0_SRVW0_SSO0_SVW2_SK3_SKXCCM8_TLDS0_ULSGRO0_USL1_UIOFGRO0_USFGRO0_VSn1_VWA2_VWB4_WSGRA0_WSGRB0_WS64_WG32_8_1_WGM6_WGMXCC1_WGMXCCGn1
    SolutionIndex: 35
    SolutionNameMin: Cijk_Ailk_Bjlk_I8II_BH_UserArgs_MT64x128x128_MI16x16x1_SN_LDSB1_AFC0_AFEM1_AFEM1_ASEM1_CLR1_CADS0_DTVA0_DTVB0_EPS0_FDSI0_GRPM1_GRVWA8_GRVWB16_GSU0_GSUAMB_GSUC0_GSUWGMRR0_GLS0_ISA950_IU1_K1_LBSPPA512_LBSPPB1024_LBSPPM0_LPA32_LPB64_LPM0_LRVW8_LWPMn1_MIAV0_MIWT2_4_MO40_NTn1_NTA0_NTB0_NTC0_NTD0_NTM0_NEPBS0_NLCA1_NLCB1_ONLL1_PGR2_PLR2_PKA1_SIA3_SS1_SU0_SUM0_SUS128_SPO0_SRVW0_SSO0_SVW2_SK3_SKXCCM8_TLDS0_ULSGRO0_USL1_UIOFGRO0_USFGRO0_VSn1_VWA2_VWB4_WSGRA0_WSGRB0_WS64_WG32_8_1_WGM6_WGMXCC1_WGMXCCGn1
    SolutionIndex: 36
    SolutionNameMin: Cijk_Ailk_Bjlk_I8II_BH_UserArgs_MT64x128x128_MI16x16x1_SN_LDSB1_AFC0_AFEM1_AFEM1_ASEM1_CLR1_CADS0_DTVA0_DTVB0_EPS0_FDSI0_GRPM1_GRVWA16_GRVWB16_GSU0_GSUAMB_GSUC0_GSUWGMRR0_GLS0_ISA950_IU1_K1_LBSPPA512_LBSPPB1024_LBSPPM0_LPA32_LPB64_LPM0_LRVW8_LWPMn1_MIAV0_MIWT2_4_MO40_NTn1_NTA0_NTB0_NTC0_NTD0_NTM0_NEPBS0_NLCA1_NLCB1_ONLL1_PGR2_PLR2_PKA1_SIA3_SS1_SU0_SUM0_SUS128_SPO0_SRVW0_SSO0_SVW2_SK3_SKXCCM8_TLDS0_ULSGRO0_USL1_UIOFGRO0_USFGRO0_VSn1_VWA2_VWB4_WSGRA0_WSGRB0_WS64_WG32_8_1_WGM6_WGMXCC1_WGMXCCGn1
    SolutionIndex: 37
    SolutionNameMin: Cijk_Ailk_Bjlk_I8II_BH_UserArgs_MT128x64x128_MI16x16x1_SN_LDSB1_AFC0_AFEM1_AFEM1_ASEM1_CLR1_CADS0_DTVA0_DTVB0_EPS0_FDSI0_GRPM1_GRVWA16_GRVWB16_GSU0_GSUAMB_GSUC0_GSUWGMRR0_GLS0_ISA950_IU1_K1_LBSPPA1024_LBSPPB512_LBSPPM0_LPA64_LPB32_LPM0_LRVW8_LWPMn1_MIAV0_MIWT4_2_MO40_NTn1_NTA0_NTB0_NTC0_NTD0_NTM0_NEPBS0_NLCA1_NLCB1_ONLL1_PGR2_PLR1_PKA1_SIA3_SS1_SU0_SUM0_SUS128_SPO0_SRVW0_SSO0_SVW4_SK3_SKXCCM8_TLDS0_ULSGRO0_USL1_UIOFGRO0_USFGRO0_VSn1_VWA4_VWB2_WSGRA0_WSGRB0_WS64_WG32_8_1_WGM6_WGMXCC1_WGMXCCGn1
    SolutionIndex: 38
    SolutionNameMin: Cijk_Ailk_Bjlk_I8II_BH_UserArgs_MT128x64x128_MI16x16x1_SN_LDSB1_AFC0_AFEM1_AFEM1_ASEM1_CLR1_CADS0_DTVA0_DTVB0_EPS0_FDSI0_GRPM1_GRVWA4_GRVWB4_GSU0_GSUAMB_GSUC0_GSUWGMRR0_GLS0_ISA950_IU1_K1_LBSPPA1024_LBSPPB512_LBSPPM0_LPA64_LPB32_LPM0_LRVW8_LWPMn1_MIAV0_MIWT4_2_MO40_NTn1_NTA0_NTB0_NTC0_NTD0_NTM0_NEPBS0_NLCA1_NLCB1_ONLL1_PGR2_PLR2_PKA1_SIA3_SS1_SU0_SUM0_SUS128_SPO0_SRVW0_SSO0_SVW4_SK3_SKXCCM8_TLDS0_ULSGRO0_USL1_UIOFGRO0_USFGRO0_VSn1_VWA4_VWB2_WSGRA0_WSGRB0_WS64_WG32_8_1_WGM6_WGMXCC1_WGMXCCGn1
    SolutionIndex: 39
    SolutionNameMin: Cijk_Ailk_Bjlk_I8II_BH_UserArgs_MT128x64x128_MI16x16x1_SN_LDSB1_AFC0_AFEM1_AFEM1_ASEM1_CLR1_CADS0_DTVA0_DTVB0_EPS0_FDSI0_GRPM1_GRVWA8_GRVWB4_GSU0_GSUAMB_GSUC0_GSUWGMRR0_GLS0_ISA950_IU1_K1_LBSPPA1024_LBSPPB512_LBSPPM0_LPA64_LPB32_LPM0_LRVW8_LWPMn1_MIAV0_MIWT4_2_MO40_NTn1_NTA0_NTB0_NTC0_NTD0_NTM0_NEPBS0_NLCA1_NLCB1_ONLL1_PGR2_PLR2_PKA1_SIA3_SS1_SU0_SUM0_SUS128_SPO0_SRVW0_SSO0_SVW4_SK3_SKXCCM8_TLDS0_ULSGRO0_USL1_UIOFGRO0_USFGRO0_VSn1_VWA4_VWB2_WSGRA0_WSGRB0_WS64_WG32_8_1_WGM6_WGMXCC1_WGMXCCGn1
    SolutionIndex: 40
    SolutionNameMin: Cijk_Ailk_Bjlk_I8II_BH_UserArgs_MT128x64x128_MI16x16x1_SN_LDSB1_AFC0_AFEM1_AFEM1_ASEM1_CLR1_CADS0_DTVA0_DTVB0_EPS0_FDSI0_GRPM1_GRVWA16_GRVWB8_GSU0_GSUAMB_GSUC0_GSUWGMRR0_GLS0_ISA950_IU1_K1_LBSPPA1024_LBSPPB512_LBSPPM0_LPA64_LPB32_LPM0_LRVW8_LWPMn1_MIAV0_MIWT4_2_MO40_NTn1_NTA0_NTB0_NTC0_NTD0_NTM0_NEPBS0_NLCA1_NLCB1_ONLL1_PGR2_PLR2_PKA1_SIA3_SS1_SU0_SUM0_SUS128_SPO0_SRVW0_SSO0_SVW4_SK3_SKXCCM8_TLDS0_ULSGRO0_USL1_UIOFGRO0_USFGRO0_VSn1_VWA4_VWB2_WSGRA0_WSGRB0_WS64_WG32_8_1_WGM6_WGMXCC1_WGMXCCGn1
    SolutionIndex: 41
    SolutionNameMin: Cijk_Ailk_Bjlk_I8II_BH_UserArgs_MT128x64x128_MI16x16x1_SN_LDSB1_AFC0_AFEM1_AFEM1_ASEM1_CLR1_CADS0_DTVA0_DTVB0_EPS0_FDSI0_GRPM1_GRVWA16_GRVWB16_GSU0_GSUAMB_GSUC0_GSUWGMRR0_GLS0_ISA950_IU1_K1_LBSPPA1024_LBSPPB512_LBSPPM0_LPA64_LPB32_LPM0_LRVW8_LWPMn1_MIAV0_MIWT4_2_MO40_NTn1_NTA0_NTB0_NTC0_NTD0_NTM0_NEPBS0_NLCA1_NLCB1_ONLL1_PGR2_PLR2_PKA1_SIA3_SS1_SU0_SUM0_SUS128_SPO0_SRVW0_SSO0_SVW4_SK3_SKXCCM8_TLDS0_ULSGRO0_USL1_UIOFGRO0_USFGRO0_VSn1_VWA4_VWB2_WSGRA0_WSGRB0_WS64_WG32_8_1_WGM6_WGMXCC1_WGMXCCGn1
    SolutionIndex: 42
    SolutionNameMin: Cijk_Ailk_Bjlk_I8II_BH_UserArgs_MT64x64x128_MI16x16x1_SN_LDSB1_AFC0_AFEM1_AFEM1_ASEM1_CLR1_CADS0_DTVA0_DTVB0_EPS0_FDSI0_GRPM1_GRVWA4_GRVWB4_GSU0_GSUAMB_GSUC0_GSUWGMRR0_GLS0_ISA950_IU1_K1_LBSPPA512_LBSPPB512_LBSPPM0_LPA32_LPB32_LPM0_LRVW8_LWPMn1_MIAV0_MIWT2_2_MO40_NTn1_NTA0_NTB0_NTC0_NTD0_NTM0_NEPBS0_NLCA1_NLCB1_ONLL1_PGR2_PLR1_PKA1_SIA3_SS1_SU0_SUM0_SUS128_SPO0_SRVW0_SSO0_SVW2_SK3_SKXCCM8_TLDS0_ULSGRO0_USL1_UIOFGRO0_USFGRO0_VSn1_VWA2_VWB2_WSGRA0_WSGRB0_WS64_WG32_8_1_WGM6_WGMXCC1_WGMXCCGn1
    SolutionIndex: 43
    SolutionNameMin: Cijk_Ailk_Bjlk_I8II_BH_UserArgs_MT64x64x128_MI16x16x1_SN_LDSB1_AFC0_AFEM1_AFEM1_ASEM1_CLR1_CADS0_DTVA0_DTVB0_EPS0_FDSI0_GRPM1_GRVWA8_GRVWB4_GSU0_GSUAMB_GSUC0_GSUWGMRR0_GLS0_ISA950_IU1_K1_LBSPPA512_LBSPPB512_LBSPPM0_LPA32_LPB32_LPM0_LRVW8_LWPMn1_MIAV0_MIWT2_2_MO40_NTn1_NTA0_NTB0_NTC0_NTD0_NTM0_NEPBS0_NLCA1_NLCB1_ONLL1_PGR2_PLR1_PKA1_SIA3_SS1_SU0_SUM0_SUS128_SPO0_SRVW0_SSO0_SVW2_SK3_SKXCCM8_TLDS0_ULSGRO0_USL1_UIOFGRO0_USFGRO0_VSn1_VWA2_VWB2_WSGRA0_WSGRB0_WS64_WG32_8_1_WGM6_WGMXCC1_WGMXCCGn1
    SolutionIndex: 44
    SolutionNameMin: Cijk_Ailk_Bjlk_I8II_BH_UserArgs_MT64x64x128_MI16x16x1_SN_LDSB1_AFC0_AFEM1_AFEM1_ASEM1_CLR1_CADS0_DTVA0_DTVB0_EPS0_FDSI0_GRPM1_GRVWA4_GRVWB8_GSU0_GSUAMB_GSUC0_GSUWGMRR0_GLS0_ISA950_IU1_K1_LBSPPA512_LBSPPB512_LBSPPM0_LPA32_LPB32_LPM0_LRVW8_LWPMn1_MIAV0_MIWT2_2_MO40_NTn1_NTA0_NTB0_NTC0_NTD0_NTM0_NEPBS0_NLCA1_NLCB1_ONLL1_PGR2_PLR1_PKA1_SIA3_SS1_SU0_SUM0_SUS128_SPO0_SRVW0_SSO0_SVW2_SK3_SKXCCM8_TLDS0_ULSGRO0_USL1_UIOFGRO0_USFGRO0_VSn1_VWA2_VWB2_WSGRA0_WSGRB0_WS64_WG32_8_1_WGM6_WGMXCC1_WGMXCCGn1
    SolutionIndex: 45
    SolutionNameMin: Cijk_Ailk_Bjlk_I8II_BH_UserArgs_MT64x64x128_MI16x16x1_SN_LDSB1_AFC0_AFEM1_AFEM1_ASEM1_CLR1_CADS0_DTVA0_DTVB0_EPS0_FDSI0_GRPM1_GRVWA8_GRVWB8_GSU0_GSUAMB_GSUC0_GSUWGMRR0_GLS0_ISA950_IU1_K1_LBSPPA512_LBSPPB512_LBSPPM0_LPA32_LPB32_LPM0_LRVW8_LWPMn1_MIAV0_MIWT2_2_MO40_NTn1_NTA0_NTB0_NTC0_NTD0_NTM0_NEPBS0_NLCA1_NLCB1_ONLL1_PGR2_PLR1_PKA1_SIA3_SS1_SU0_SUM0_SUS128_SPO0_SRVW0_SSO0_SVW2_SK3_SKXCCM8_TLDS0_ULSGRO0_USL1_UIOFGRO0_USFGRO0_VSn1_VWA2_VWB2_WSGRA0_WSGRB0_WS64_WG32_8_1_WGM6_WGMXCC1_WGMXCCGn1
    SolutionIndex: 46
    SolutionNameMin: Cijk_Ailk_Bjlk_I8II_BH_UserArgs_MT64x64x128_MI16x16x1_SN_LDSB1_AFC0_AFEM1_AFEM1_ASEM1_CLR1_CADS0_DTVA0_DTVB0_EPS0_FDSI0_GRPM1_GRVWA4_GRVWB16_GSU0_GSUAMB_GSUC0_GSUWGMRR0_GLS0_ISA950_IU1_K1_LBSPPA512_LBSPPB512_LBSPPM0_LPA32_LPB32_LPM0_LRVW8_LWPMn1_MIAV0_MIWT2_2_MO40_NTn1_NTA0_NTB0_NTC0_NTD0_NTM0_NEPBS0_NLCA1_NLCB1_ONLL1_PGR2_PLR1_PKA1_SIA3_SS1_SU0_SUM0_SUS128_SPO0_SRVW0_SSO0_SVW2_SK3_SKXCCM8_TLDS0_ULSGRO0_USL1_UIOFGRO0_USFGRO0_VSn1_VWA2_VWB2_WSGRA0_WSGRB0_WS64_WG32_8_1_WGM6_WGMXCC1_WGMXCCGn1
    SolutionIndex: 47
    SolutionNameMin: Cijk_Ailk_Bjlk_I8II_BH_UserArgs_MT64x64x128_MI16x16x1_SN_LDSB1_AFC0_AFEM1_AFEM1_ASEM1_CLR1_CADS0_DTVA0_DTVB0_EPS0_FDSI0_GRPM1_GRVWA16_GRVWB16_GSU0_GSUAMB_GSUC0_GSUWGMRR0_GLS0_ISA950_IU1_K1_LBSPPA512_LBSPPB512_LBSPPM0_LPA32_LPB32_LPM0_LRVW8_LWPMn1_MIAV0_MIWT2_2_MO40_NTn1_NTA0_NTB0_NTC0_NTD0_NTM0_NEPBS0_NLCA1_NLCB1_ONLL1_PGR2_PLR1_PKA1_SIA3_SS1_SU0_SUM0_SUS128_SPO0_SRVW0_SSO0_SVW2_SK3_SKXCCM8_TLDS0_ULSGRO0_USL1_UIOFGRO0_USFGRO0_VSn1_VWA2_VWB2_WSGRA0_WSGRB0_WS64_WG32_8_1_WGM6_WGMXCC1_WGMXCCGn1
    SolutionIndex: 48
    SolutionNameMin: Cijk_Ailk_Bjlk_I8II_BH_UserArgs_MT64x64x128_MI16x16x1_SN_LDSB1_AFC0_AFEM1_AFEM1_ASEM1_CLR1_CADS0_DTVA0_DTVB0_EPS0_FDSI0_GRPM1_GRVWA4_GRVWB4_GSU0_GSUAMB_GSUC0_GSUWGMRR0_GLS0_ISA950_IU1_K1_LBSPPA512_LBSPPB512_LBSPPM0_LPA32_LPB32_LPM0_LRVW8_LWPMn1_MIAV0_MIWT2_2_MO40_NTn1_NTA0_NTB0_NTC0_NTD0_NTM0_NEPBS0_NLCA1_NLCB1_ONLL1_PGR2_PLR2_PKA1_SIA3_SS1_SU0_SUM0_SUS128_SPO0_SRVW0_SSO0_SVW2_SK3_SKXCCM8_TLDS0_ULSGRO0_USL1_UIOFGRO0_USFGRO0_VSn1_VWA2_VWB2_WSGRA0_WSGRB0_WS64_WG32_8_1_WGM6_WGMXCC1_WGMXCCGn1
    SolutionIndex: 49
    SolutionNameMin: Cijk_Ailk_Bjlk_I8II_BH_UserArgs_MT64x64x128_MI16x16x1_SN_LDSB1_AFC0_AFEM1_AFEM1_ASEM1_CLR1_CADS0_DTVA0_DTVB0_EPS0_FDSI0_GRPM1_GRVWA8_GRVWB4_GSU0_GSUAMB_GSUC0_GSUWGMRR0_GLS0_ISA950_IU1_K1_LBSPPA512_LBSPPB512_LBSPPM0_LPA32_LPB32_LPM0_LRVW8_LWPMn1_MIAV0_MIWT2_2_MO40_NTn1_NTA0_NTB0_NTC0_NTD0_NTM0_NEPBS0_NLCA1_NLCB1_ONLL1_PGR2_PLR2_PKA1_SIA3_SS1_SU0_SUM0_SUS128_SPO0_SRVW0_SSO0_SVW2_SK3_SKXCCM8_TLDS0_ULSGRO0_USL1_UIOFGRO0_USFGRO0_VSn1_VWA2_VWB2_WSGRA0_WSGRB0_WS64_WG32_8_1_WGM6_WGMXCC1_WGMXCCGn1
    SolutionIndex: 50
    SolutionNameMin: Cijk_Ailk_Bjlk_I8II_BH_UserArgs_MT64x64x128_MI16x16x1_SN_LDSB1_AFC0_AFEM1_AFEM1_ASEM1_CLR1_CADS0_DTVA0_DTVB0_EPS0_FDSI0_GRPM1_GRVWA16_GRVWB4_GSU0_GSUAMB_GSUC0_GSUWGMRR0_GLS0_ISA950_IU1_K1_LBSPPA512_LBSPPB512_LBSPPM0_LPA32_LPB32_LPM0_LRVW8_LWPMn1_MIAV0_MIWT2_2_MO40_NTn1_NTA0_NTB0_NTC0_NTD0_NTM0_NEPBS0_NLCA1_NLCB1_ONLL1_PGR2_PLR2_PKA1_SIA3_SS1_SU0_SUM0_SUS128_SPO0_SRVW0_SSO0_SVW2_SK3_SKXCCM8_TLDS0_ULSGRO0_USL1_UIOFGRO0_USFGRO0_VSn1_VWA2_VWB2_WSGRA0_WSGRB0_WS64_WG32_8_1_WGM6_WGMXCC1_WGMXCCGn1
    SolutionIndex: 51
    SolutionNameMin: Cijk_Ailk_Bjlk_I8II_BH_UserArgs_MT64x64x128_MI16x16x1_SN_LDSB1_AFC0_AFEM1_AFEM1_ASEM1_CLR1_CADS0_DTVA0_DTVB0_EPS0_FDSI0_GRPM1_GRVWA4_GRVWB8_GSU0_GSUAMB_GSUC0_GSUWGMRR0_GLS0_ISA950_IU1_K1_LBSPPA512_LBSPPB512_LBSPPM0_LPA32_LPB32_LPM0_LRVW8_LWPMn1_MIAV0_MIWT2_2_MO40_NTn1_NTA0_NTB0_NTC0_NTD0_NTM0_NEPBS0_NLCA1_NLCB1_ONLL1_PGR2_PLR2_PKA1_SIA3_SS1_SU0_SUM0_SUS128_SPO0_SRVW0_SSO0_SVW2_SK3_SKXCCM8_TLDS0_ULSGRO0_USL1_UIOFGRO0_USFGRO0_VSn1_VWA2_VWB2_WSGRA0_WSGRB0_WS64_WG32_8_1_WGM6_WGMXCC1_WGMXCCGn1
    SolutionIndex: 52
    SolutionNameMin: Cijk_Ailk_Bjlk_I8II_BH_UserArgs_MT64x64x128_MI16x16x1_SN_LDSB1_AFC0_AFEM1_AFEM1_ASEM1_CLR1_CADS0_DTVA0_DTVB0_EPS0_FDSI0_GRPM1_GRVWA8_GRVWB8_GSU0_GSUAMB_GSUC0_GSUWGMRR0_GLS0_ISA950_IU1_K1_LBSPPA512_LBSPPB512_LBSPPM0_LPA32_LPB32_LPM0_LRVW8_LWPMn1_MIAV0_MIWT2_2_MO40_NTn1_NTA0_NTB0_NTC0_NTD0_NTM0_NEPBS0_NLCA1_NLCB1_ONLL1_PGR2_PLR2_PKA1_SIA3_SS1_SU0_SUM0_SUS128_SPO0_SRVW0_SSO0_SVW2_SK3_SKXCCM8_TLDS0_ULSGRO0_USL1_UIOFGRO0_USFGRO0_VSn1_VWA2_VWB2_WSGRA0_WSGRB0_WS64_WG32_8_1_WGM6_WGMXCC1_WGMXCCGn1
    SolutionIndex: 53
    SolutionNameMin: Cijk_Ailk_Bjlk_I8II_BH_UserArgs_MT64x64x128_MI16x16x1_SN_LDSB1_AFC0_AFEM1_AFEM1_ASEM1_CLR1_CADS0_DTVA0_DTVB0_EPS0_FDSI0_GRPM1_GRVWA16_GRVWB8_GSU0_GSUAMB_GSUC0_GSUWGMRR0_GLS0_ISA950_IU1_K1_LBSPPA512_LBSPPB512_LBSPPM0_LPA32_LPB32_LPM0_LRVW8_LWPMn1_MIAV0_MIWT2_2_MO40_NTn1_NTA0_NTB0_NTC0_NTD0_NTM0_NEPBS0_NLCA1_NLCB1_ONLL1_PGR2_PLR2_PKA1_SIA3_SS1_SU0_SUM0_SUS128_SPO0_SRVW0_SSO0_SVW2_SK3_SKXCCM8_TLDS0_ULSGRO0_USL1_UIOFGRO0_USFGRO0_VSn1_VWA2_VWB2_WSGRA0_WSGRB0_WS64_WG32_8_1_WGM6_WGMXCC1_WGMXCCGn1
    SolutionIndex: 54
    SolutionNameMin: Cijk_Ailk_Bjlk_I8II_BH_UserArgs_MT64x64x128_MI16x16x1_SN_LDSB1_AFC0_AFEM1_AFEM1_ASEM1_CLR1_CADS0_DTVA0_DTVB0_EPS0_FDSI0_GRPM1_GRVWA4_GRVWB16_GSU0_GSUAMB_GSUC0_GSUWGMRR0_GLS0_ISA950_IU1_K1_LBSPPA512_LBSPPB512_LBSPPM0_LPA32_LPB32_LPM0_LRVW8_LWPMn1_MIAV0_MIWT2_2_MO40_NTn1_NTA0_NTB0_NTC0_NTD0_NTM0_NEPBS0_NLCA1_NLCB1_ONLL1_PGR2_PLR2_PKA1_SIA3_SS1_SU0_SUM0_SUS128_SPO0_SRVW0_SSO0_SVW2_SK3_SKXCCM8_TLDS0_ULSGRO0_USL1_UIOFGRO0_USFGRO0_VSn1_VWA2_VWB2_WSGRA0_WSGRB0_WS64_WG32_8_1_WGM6_WGMXCC1_WGMXCCGn1
    SolutionIndex: 55
    SolutionNameMin: Cijk_Ailk_Bjlk_I8II_BH_UserArgs_MT64x64x128_MI16x16x1_SN_LDSB1_AFC0_AFEM1_AFEM1_ASEM1_CLR1_CADS0_DTVA0_DTVB0_EPS0_FDSI0_GRPM1_GRVWA8_GRVWB16_GSU0_GSUAMB_GSUC0_GSUWGMRR0_GLS0_ISA950_IU1_K1_LBSPPA512_LBSPPB512_LBSPPM0_LPA32_LPB32_LPM0_LRVW8_LWPMn1_MIAV0_MIWT2_2_MO40_NTn1_NTA0_NTB0_NTC0_NTD0_NTM0_NEPBS0_NLCA1_NLCB1_ONLL1_PGR2_PLR2_PKA1_SIA3_SS1_SU0_SUM0_SUS128_SPO0_SRVW0_SSO0_SVW2_SK3_SKXCCM8_TLDS0_ULSGRO0_USL1_UIOFGRO0_USFGRO0_VSn1_VWA2_VWB2_WSGRA0_WSGRB0_WS64_WG32_8_1_WGM6_WGMXCC1_WGMXCCGn1
    SolutionIndex: 56
    SolutionNameMin: Cijk_Ailk_Bjlk_I8II_BH_UserArgs_MT64x64x128_MI16x16x1_SN_LDSB1_AFC0_AFEM1_AFEM1_ASEM1_CLR1_CADS0_DTVA0_DTVB0_EPS0_FDSI0_GRPM1_GRVWA16_GRVWB16_GSU0_GSUAMB_GSUC0_GSUWGMRR0_GLS0_ISA950_IU1_K1_LBSPPA512_LBSPPB512_LBSPPM0_LPA32_LPB32_LPM0_LRVW8_LWPMn1_MIAV0_MIWT2_2_MO40_NTn1_NTA0_NTB0_NTC0_NTD0_NTM0_NEPBS0_NLCA1_NLCB1_ONLL1_PGR2_PLR2_PKA1_SIA3_SS1_SU0_SUM0_SUS128_SPO0_SRVW0_SSO0_SVW2_SK3_SKXCCM8_TLDS0_ULSGRO0_USL1_UIOFGRO0_USFGRO0_VSn1_VWA2_VWB2_WSGRA0_WSGRB0_WS64_WG32_8_1_WGM6_WGMXCC1_WGMXCCGn1
    SolutionIndex: 57
    SolutionNameMin: Cijk_Ailk_Bjlk_I8II_BH_UserArgs_MT128x64x256_MI16x16x1_SN_LDSB1_AFC0_AFEM1_AFEM1_ASEM1_CLR1_CADS0_DTVA0_DTVB0_EPS0_FDSI0_GRPM1_GRVWA4_GRVWB16_GSU0_GSUAMB_GSUC0_GSUWGMRR0_GLS0_ISA950_IU1_K1_LBSPPA1024_LBSPPB512_LBSPPM0_LPA64_LPB32_LPM0_LRVW8_LWPMn1_MIAV0_MIWT4_2_MO40_NTn1_NTA0_NTB0_NTC0_NTD0_NTM0_NEPBS0_NLCA1_NLCB1_ONLL1_PGR2_PLR2_PKA1_SIA3_SS1_SU0_SUM0_SUS256_SPO0_SRVW0_SSO0_SVW4_SK3_SKXCCM8_TLDS0_ULSGRO0_USL1_UIOFGRO0_USFGRO0_VSn1_VWA4_VWB2_WSGRA0_WSGRB0_WS64_WG32_8_1_WGM6_WGMXCC1_WGMXCCGn1
    SolutionIndex: 58
    SolutionNameMin: Cijk_Ailk_Bjlk_I8II_BH_UserArgs_MT128x64x256_MI16x16x1_SN_LDSB1_AFC0_AFEM1_AFEM1_ASEM1_CLR1_CADS0_DTVA0_DTVB0_EPS0_FDSI0_GRPM1_GRVWA16_GRVWB16_GSU0_GSUAMB_GSUC0_GSUWGMRR0_GLS0_ISA950_IU1_K1_LBSPPA1024_LBSPPB512_LBSPPM0_LPA64_LPB32_LPM0_LRVW8_LWPMn1_MIAV0_MIWT4_2_MO40_NTn1_NTA0_NTB0_NTC0_NTD0_NTM0_NEPBS0_NLCA1_NLCB1_ONLL1_PGR2_PLR2_PKA1_SIA3_SS1_SU0_SUM0_SUS256_SPO0_SRVW0_SSO0_SVW4_SK3_SKXCCM8_TLDS0_ULSGRO0_USL1_UIOFGRO0_USFGRO0_VSn1_VWA4_VWB2_WSGRA0_WSGRB0_WS64_WG32_8_1_WGM6_WGMXCC1_WGMXCCGn1
    SolutionIndex: 59
    SolutionNameMin: Cijk_Ailk_Bjlk_I8II_BH_UserArgs_MT64x64x256_MI16x16x1_SN_LDSB1_AFC0_AFEM1_AFEM1_ASEM1_CLR1_CADS0_DTVA0_DTVB0_EPS0_FDSI0_GRPM1_GRVWA8_GRVWB4_GSU0_GSUAMB_GSUC0_GSUWGMRR0_GLS0_ISA950_IU1_K1_LBSPPA512_LBSPPB512_LBSPPM0_LPA32_LPB32_LPM0_LRVW8_LWPMn1_MIAV0_MIWT2_2_MO40_NTn1_NTA0_NTB0_NTC0_NTD0_NTM0_NEPBS0_NLCA1_NLCB1_ONLL1_PGR2_PLR1_PKA1_SIA3_SS1_SU0_SUM0_SUS256_SPO0_SRVW0_SSO0_SVW2_SK3_SKXCCM8_TLDS0_ULSGRO0_USL1_UIOFGRO0_USFGRO0_VSn1_VWA2_VWB2_WSGRA0_WSGRB0_WS64_WG32_8_1_WGM6_WGMXCC1_WGMXCCGn1
    SolutionIndex: 60
    SolutionNameMin: Cijk_Ailk_Bjlk_I8II_BH_UserArgs_MT64x64x256_MI16x16x1_SN_LDSB1_AFC0_AFEM1_AFEM1_ASEM1_CLR1_CADS0_DTVA0_DTVB0_EPS0_FDSI0_GRPM1_GRVWA16_GRVWB16_GSU0_GSUAMB_GSUC0_GSUWGMRR0_GLS0_ISA950_IU1_K1_LBSPPA512_LBSPPB512_LBSPPM0_LPA32_LPB32_LPM0_LRVW8_LWPMn1_MIAV0_MIWT2_2_MO40_NTn1_NTA0_NTB0_NTC0_NTD0_NTM0_NEPBS0_NLCA1_NLCB1_ONLL1_PGR2_PLR1_PKA1_SIA3_SS1_SU0_SUM0_SUS256_SPO0_SRVW0_SSO0_SVW2_SK3_SKXCCM8_TLDS0_ULSGRO0_USL1_UIOFGRO0_USFGRO0_VSn1_VWA2_VWB2_WSGRA0_WSGRB0_WS64_WG32_8_1_WGM6_WGMXCC1_WGMXCCGn1
    SolutionIndex: 61
    SolutionNameMin: Cijk_Ailk_Bjlk_I8II_BH_UserArgs_MT64x64x256_MI16x16x1_SN_LDSB1_AFC0_AFEM1_AFEM1_ASEM1_CLR1_CADS0_DTVA0_DTVB0_EPS0_FDSI0_GRPM1_GRVWA4_GRVWB16_GSU0_GSUAMB_GSUC0_GSUWGMRR0_GLS0_ISA950_IU1_K1_LBSPPA512_LBSPPB512_LBSPPM0_LPA32_LPB32_LPM0_LRVW8_LWPMn1_MIAV0_MIWT2_2_MO40_NTn1_NTA0_NTB0_NTC0_NTD0_NTM0_NEPBS0_NLCA1_NLCB1_ONLL1_PGR2_PLR2_PKA1_SIA3_SS1_SU0_SUM0_SUS256_SPO0_SRVW0_SSO0_SVW2_SK3_SKXCCM8_TLDS0_ULSGRO0_USL1_UIOFGRO0_USFGRO0_VSn1_VWA2_VWB2_WSGRA0_WSGRB0_WS64_WG32_8_1_WGM6_WGMXCC1_WGMXCCGn1
    SolutionIndex: 62
    SolutionNameMin: Cijk_Ailk_Bjlk_I8II_BH_UserArgs_MT64x64x256_MI16x16x1_SN_LDSB1_AFC0_AFEM1_AFEM1_ASEM1_CLR1_CADS0_DTVA0_DTVB0_EPS0_FDSI0_GRPM1_GRVWA16_GRVWB16_GSU0_GSUAMB_GSUC0_GSUWGMRR0_GLS0_ISA950_IU1_K1_LBSPPA512_LBSPPB512_LBSPPM0_LPA32_LPB32_LPM0_LRVW8_LWPMn1_MIAV0_MIWT2_2_MO40_NTn1_NTA0_NTB0_NTC0_NTD0_NTM0_NEPBS0_NLCA1_NLCB1_ONLL1_PGR2_PLR2_PKA1_SIA3_SS1_SU0_SUM0_SUS256_SPO0_SRVW0_SSO0_SVW2_SK3_SKXCCM8_TLDS0_ULSGRO0_USL1_UIOFGRO0_USFGRO0_VSn1_VWA2_VWB2_WSGRA0_WSGRB0_WS64_WG32_8_1_WGM6_WGMXCC1_WGMXCCGn1
- - - [128, 128, 1, 128, 128, 128, 128, 128]
    - [49, 0.34]
  - - [128, 128, 1, 256, 128, 128, 128, 128]
    - [59, 0.58]
  - - [128, 128, 1, 512, 128, 128, 128, 128]
    - [44, 0.95]
  - - [128, 128, 1, 1024, 128, 128, 128, 128]
    - [62, 1.44]
  - - [128, 128, 1, 2048, 128, 128, 128, 128]
    - [60, 1.91]
  - - [128, 128, 1, 4096, 128, 128, 128, 128]
    - [62, 2.33]
  - - [128, 128, 1, 8192, 128, 128, 128, 128]
    - [62, 2.61]
  - - [128, 256, 1, 128, 128, 128, 128, 256]
    - [48, 0.67]
  - - [128, 256, 1, 256, 128, 128, 128, 256]
    - [52, 1.15]
  - - [128, 256, 1, 512, 128, 128, 128, 256]
    - [54, 1.89]
  - - [128, 256, 1, 1024, 128, 128, 128, 256]
    - [62, 2.85]
  - - [128, 256, 1, 2048, 128, 128, 128, 256]
    - [62, 3.79]
  - - [128, 256, 1, 4096, 128, 128, 128, 256]
    - [60, 4.59]
  - - [128, 256, 1, 8192, 128, 128, 128, 256]
    - [60, 5.17]
  - - [128, 512, 1, 128, 128, 128, 128, 512]
    - [42, 1.36]
  - - [128, 512, 1, 256, 128, 128, 128, 512]
    - [46, 2.35]
  - - [128, 512, 1, 512, 128, 128, 128, 512]
    - [54, 3.79]
  - - [128, 512, 1, 1024, 128, 128, 128, 512]
    - [62, 5.69]
  - - [128, 512, 1, 2048, 128, 128, 128, 512]
    - [60, 7.57]
  - - [128, 512, 1, 4096, 128, 128, 128, 512]
    - [60, 9.22]
  - - [128, 512, 1, 8192, 128, 128, 128, 512]
    - [60, 10.42]
  - - [128, 1024, 1, 128, 128, 128, 128, 1024]
    - [49, 2.7]
  - - [128, 1024, 1, 256, 128, 128, 128, 1024]
    - [56, 4.59]
  - - [128, 1024, 1, 512, 128, 128, 128, 1024]
    - [54, 7.45]
  - - [128, 1024, 1, 1024, 128, 128, 128, 1024]
    - [62, 11.06]
  - - [128, 1024, 1, 2048, 128, 128, 128, 1024]
    - [62, 14.97]
  - - [128, 1024, 1, 4096, 128, 128, 128, 1024]
    - [62, 18.38]
  - - [128, 1024, 1, 8192, 128, 128, 128, 1024]
    - [60, 20.82]
  - - [128, 2048, 1, 128, 128, 128, 128, 2048]
    - [51, 5.1]
  - - [128, 2048, 1, 256, 128, 128, 128, 2048]
    - [51, 8.96]
  - - [128, 2048, 1, 512, 128, 128, 128, 2048]
    - [54, 14.61]
  - - [128, 2048, 1, 1024, 128, 128, 128, 2048]
    - [60, 21.56]
  - - [128, 2048, 1, 2048, 128, 128, 128, 2048]
    - [62, 29.57]
  - - [128, 2048, 1, 4096, 128, 128, 128, 2048]
    - [60, 36.63]
  - - [128, 2048, 1, 8192, 128, 128, 128, 2048]
    - [60, 41.4]
  - - [128, 4096, 1, 128, 128, 128, 128, 4096]
    - [42, 10.03]
  - - [128, 4096, 1, 256, 128, 128, 128, 4096]
    - [51, 17.42]
  - - [128, 4096, 1, 512, 128, 128, 128, 4096]
    - [54, 28.38]
  - - [128, 4096, 1, 1024, 128, 128, 128, 4096]
    - [60, 42.67]
  - - [128, 4096, 1, 2048, 128, 128, 128, 4096]
    - [62, 57.8]
  - - [128, 4096, 1, 4096, 128, 128, 128, 4096]
    - [60, 70.94]
  - - [128, 4096, 1, 8192, 128, 128, 128, 4096]
    - [62, 80.08]
  - - [128, 8192, 1, 128, 128, 128, 128, 8192]
    - [48, 18.04]
  - - [128, 8192, 1, 256, 128, 128, 128, 8192]
    - [44, 31.8]
  - - [128, 8192, 1, 512, 128, 128, 128, 8192]
    - [54, 52.63]
  - - [128, 8192, 1, 1024, 128, 128, 128, 8192]
    - [60, 80.02]
  - - [128, 8192, 1, 2048, 128, 128, 128, 8192]
    - [60, 108.8]
  - - [128, 8192, 1, 4096, 128, 128, 128, 8192]
    - [60, 132.95]
  - - [128, 8192, 1, 8192, 128, 128, 128, 8192]
    - [62, 150.28]
  - - [256, 128, 1, 128, 256, 256, 256, 128]
    - [48, 0.67]
  - - [256, 128, 1, 256, 256, 256, 256, 128]
    - [48, 1.15]
  - - [256, 128, 1, 512, 256, 256, 256, 128]
    - [55, 1.88]
  - - [256, 128, 1, 1024, 256, 256, 256, 128]
    - [62, 2.78]
  - - [256, 128, 1, 2048, 256, 256, 256, 128]
    - [62, 3.68]
  - - [256, 128, 1, 4096, 256, 256, 256, 128]
    - [62, 4.41]
  - - [256, 128, 1, 8192, 256, 256, 256, 128]
    - [62, 4.92]
  - - [256, 256, 1, 128, 256, 256, 256, 256]
    - [42, 1.36]
  - - [256, 256, 1, 256, 256, 256, 256, 256]
    - [48, 2.36]
  - - [256, 256, 1, 512, 256, 256, 256, 256]
    - [55, 3.76]
  - - [256, 256, 1, 1024, 256, 256, 256, 256]
    - [60, 5.63]
  - - [256, 256, 1, 2048, 256, 256, 256, 256]
    - [62, 7.45]
  - - [256, 256, 1, 4096, 256, 256, 256, 256]
    - [62, 9.0]
  - - [256, 256, 1, 8192, 256, 256, 256, 256]
    - [62, 10.0]
  - - [256, 512, 1, 128, 256, 256, 256, 512]
    - [48, 2.7]
  - - [256, 512, 1, 256, 256, 256, 256, 512]
    - [51, 4.7]
  - - [256, 512, 1, 512, 256, 256, 256, 512]
    - [56, 7.57]
  - - [256, 512, 1, 1024, 256, 256, 256, 512]
    - [62, 11.13]
  - - [256, 512, 1, 2048, 256, 256, 256, 512]
    - [62, 14.89]
  - - [256, 512, 1, 4096, 256, 256, 256, 512]
    - [60, 17.99]
  - - [256, 512, 1, 8192, 256, 256, 256, 512]
    - [62, 20.18]
  - - [256, 1024, 1, 128, 256, 256, 256, 1024]
    - [48, 5.21]
  - - [256, 1024, 1, 256, 256, 256, 256, 1024]
    - [48, 9.2]
  - - [256, 1024, 1, 512, 256, 256, 256, 1024]
    - [46, 14.67]
  - - [256, 1024, 1, 1024, 256, 256, 256, 1024]
    - [62, 21.94]
  - - [256, 1024, 1, 2048, 256, 256, 256, 1024]
    - [62, 29.42]
  - - [256, 1024, 1, 4096, 256, 256, 256, 1024]
    - [60, 35.9]
  - - [256, 1024, 1, 8192, 256, 256, 256, 1024]
    - [62, 40.2]
  - - [256, 2048, 1, 128, 256, 256, 256, 2048]
    - [49, 9.96]
  - - [256, 2048, 1, 256, 256, 256, 256, 2048]
    - [51, 17.42]
  - - [256, 2048, 1, 512, 256, 256, 256, 2048]
    - [54, 28.56]
  - - [256, 2048, 1, 1024, 256, 256, 256, 2048]
    - [62, 42.94]
  - - [256, 2048, 1, 2048, 256, 256, 256, 2048]
    - [62, 57.59]
  - - [256, 2048, 1, 4096, 256, 256, 256, 2048]
    - [62, 70.28]
  - - [256, 2048, 1, 8192, 256, 256, 256, 2048]
    - [62, 79.38]
  - - [256, 4096, 1, 128, 256, 256, 256, 4096]
    - [14, 18.14]
  - - [256, 4096, 1, 256, 256, 256, 256, 4096]
    - [51, 31.98]
  - - [256, 4096, 1, 512, 256, 256, 256, 4096]
    - [51, 52.59]
  - - [256, 4096, 1, 1024, 256, 256, 256, 4096]
    - [62, 80.57]
  - - [256, 4096, 1, 2048, 256, 256, 256, 4096]
    - [60, 109.64]
  - - [256, 4096, 1, 4096, 256, 256, 256, 4096]
    - [62, 134.79]
  - - [256, 4096, 1, 8192, 256, 256, 256, 4096]
    - [62, 150.42]
  - - [256, 8192, 1, 128, 256, 256, 256, 8192]
    - [13, 29.76]
  - - [256, 8192, 1, 256, 256, 256, 256, 8192]
    - [13, 52.7]
  - - [256, 8192, 1, 512, 256, 256, 256, 8192]
    - [35, 88.17]
  - - [256, 8192, 1, 1024, 256, 256, 256, 8192]
    - [36, 131.84]
  - - [256, 8192, 1, 2048, 256, 256, 256, 8192]
    - [58, 179.62]
  - - [256, 8192, 1, 4096, 256, 256, 256, 8192]
    - [57, 216.9]
  - - [256, 8192, 1, 8192, 256, 256, 256, 8192]
    - [57, 241.82]
  - - [512, 128, 1, 128, 512, 512, 512, 128]
    - [45, 1.35]
  - - [512, 128, 1, 256, 512, 512, 512, 128]
    - [46, 2.36]
  - - [512, 128, 1, 512, 512, 512, 512, 128]
    - [54, 3.82]
  - - [512, 128, 1, 1024, 512, 512, 512, 128]
    - [62, 5.52]
  - - [512, 128, 1, 2048, 512, 512, 512, 128]
    - [53, 7.12]
  - - [512, 128, 1, 4096, 512, 512, 512, 128]
    - [62, 8.36]
  - - [512, 128, 1, 8192, 512, 512, 512, 128]
    - [62, 9.19]
  - - [512, 256, 1, 128, 512, 512, 512, 256]
    - [52, 2.69]
  - - [512, 256, 1, 256, 512, 512, 512, 256]
    - [54, 4.72]
  - - [512, 256, 1, 512, 512, 512, 512, 256]
    - [54, 7.58]
  - - [512, 256, 1, 1024, 512, 512, 512, 256]
    - [53, 10.85]
  - - [512, 256, 1, 2048, 512, 512, 512, 256]
    - [62, 14.12]
  - - [512, 256, 1, 4096, 512, 512, 512, 256]
    - [62, 16.83]
  - - [512, 256, 1, 8192, 512, 512, 512, 256]
    - [62, 18.64]
  - - [512, 512, 1, 128, 512, 512, 512, 512]
    - [48, 5.42]
  - - [512, 512, 1, 256, 512, 512, 512, 512]
    - [49, 9.27]
  - - [512, 512, 1, 512, 512, 512, 512, 512]
    - [51, 14.85]
  - - [512, 512, 1, 1024, 512, 512, 512, 512]
    - [54, 21.51]
  - - [512, 512, 1, 2048, 512, 512, 512, 512]
    - [62, 28.35]
  - - [512, 512, 1, 4096, 512, 512, 512, 512]
    - [62, 33.75]
  - - [512, 512, 1, 8192, 512, 512, 512, 512]
    - [62, 37.39]
  - - [512, 1024, 1, 128, 512, 512, 512, 1024]
    - [48, 10.15]
  - - [512, 1024, 1, 256, 512, 512, 512, 1024]
    - [44, 17.64]
  - - [512, 1024, 1, 512, 512, 512, 512, 1024]
    - [53, 28.71]
  - - [512, 1024, 1, 1024, 512, 512, 512, 1024]
    - [60, 41.8]
  - - [512, 1024, 1, 2048, 512, 512, 512, 1024]
    - [62, 55.52]
  - - [512, 1024, 1, 4096, 512, 512, 512, 1024]
    - [62, 66.7]
  - - [512, 1024, 1, 8192, 512, 512, 512, 1024]
    - [62, 74.92]
  - - [512, 2048, 1, 128, 512, 512, 512, 2048]
    - [51, 18.16]
  - - [512, 2048, 1, 256, 512, 512, 512, 2048]
    - [48, 32.15]
  - - [512, 2048, 1, 512, 512, 512, 512, 2048]
    - [54, 53.17]
  - - [512, 2048, 1, 1024, 512, 512, 512, 2048]
    - [62, 80.28]
  - - [512, 2048, 1, 2048, 512, 512, 512, 2048]
    - [60, 106.28]
  - - [512, 2048, 1, 4096, 512, 512, 512, 2048]
    - [62, 128.75]
  - - [512, 2048, 1, 8192, 512, 512, 512, 2048]
    - [62, 140.13]
  - - [512, 4096, 1, 128, 512, 512, 512, 4096]
    - [39, 29.62]
  - - [512, 4096, 1, 256, 512, 512, 512, 4096]
    - [40, 53.18]
  - - [512, 4096, 1, 512, 512, 512, 512, 4096]
    - [40, 88.34]
  - - [512, 4096, 1, 1024, 512, 512, 512, 4096]
    - [35, 134.18]
  - - [512, 4096, 1, 2048, 512, 512, 512, 4096]
    - [58, 180.84]
  - - [512, 4096, 1, 4096, 512, 512, 512, 4096]
    - [36, 217.65]
  - - [512, 4096, 1, 8192, 512, 512, 512, 4096]
    - [36, 240.52]
  - - [512, 8192, 1, 128, 512, 512, 512, 8192]
    - [7, 38.98]
  - - [512, 8192, 1, 256, 512, 512, 512, 8192]
    - [7, 69.65]
  - - [512, 8192, 1, 512, 512, 512, 512, 8192]
    - [32, 119.51]
  - - [512, 8192, 1, 1024, 512, 512, 512, 8192]
    - [29, 181.61]
  - - [512, 8192, 1, 2048, 512, 512, 512, 8192]
    - [32, 250.99]
  - - [512, 8192, 1, 4096, 512, 512, 512, 8192]
    - [32, 303.8]
  - - [512, 8192, 1, 8192, 512, 512, 512, 8192]
    - [32, 333.98]
  - - [1024, 128, 1, 128, 1024, 1024, 1024, 128]
    - [49, 2.72]
  - - [1024, 128, 1, 256, 1024, 1024, 1024, 128]
    - [48, 4.65]
  - - [1024, 128, 1, 512, 1024, 1024, 1024, 128]
    - [55, 7.55]
  - - [1024, 128, 1, 1024, 1024, 1024, 1024, 128]
    - [62, 10.81]
  - - [1024, 128, 1, 2048, 1024, 1024, 1024, 128]
    - [53, 13.98]
  - - [1024, 128, 1, 4096, 1024, 1024, 1024, 128]
    - [53, 16.46]
  - - [1024, 128, 1, 8192, 1024, 1024, 1024, 128]
    - [53, 18.06]
  - - [1024, 256, 1, 128, 1024, 1024, 1024, 256]
    - [42, 5.34]
  - - [1024, 256, 1, 256, 1024, 1024, 1024, 256]
    - [51, 9.24]
  - - [1024, 256, 1, 512, 1024, 1024, 1024, 256]
    - [54, 14.9]
  - - [1024, 256, 1, 1024, 1024, 1024, 1024, 256]
    - [54, 21.64]
  - - [1024, 256, 1, 2048, 1024, 1024, 1024, 256]
    - [53, 27.84]
  - - [1024, 256, 1, 4096, 1024, 1024, 1024, 256]
    - [53, 32.73]
  - - [1024, 256, 1, 8192, 1024, 1024, 1024, 256]
    - [53, 36.2]
  - - [1024, 512, 1, 128, 1024, 1024, 1024, 512]
    - [43, 10.09]
  - - [1024, 512, 1, 256, 1024, 1024, 1024, 512]
    - [44, 17.68]
  - - [1024, 512, 1, 512, 1024, 1024, 1024, 512]
    - [51, 28.75]
  - - [1024, 512, 1, 1024, 1024, 1024, 1024, 512]
    - [53, 42.23]
  - - [1024, 512, 1, 2048, 1024, 1024, 1024, 512]
    - [62, 54.77]
  - - [1024, 512, 1, 4096, 1024, 1024, 1024, 512]
    - [53, 65.18]
  - - [1024, 512, 1, 8192, 1024, 1024, 1024, 512]
    - [62, 71.96]
  - - [1024, 1024, 1, 128, 1024, 1024, 1024, 1024]
    - [51, 18.3]
  - - [1024, 1024, 1, 256, 1024, 1024, 1024, 1024]
    - [48, 32.34]
  - - [1024, 1024, 1, 512, 1024, 1024, 1024, 1024]
    - [51, 53.33]
  - - [1024, 1024, 1, 1024, 1024, 1024, 1024, 1024]
    - [62, 79.2]
  - - [1024, 1024, 1, 2048, 1024, 1024, 1024, 1024]
    - [62, 104.06]
  - - [1024, 1024, 1, 4096, 1024, 1024, 1024, 1024]
    - [62, 125.5]
  - - [1024, 1024, 1, 8192, 1024, 1024, 1024, 1024]
    - [62, 138.99]
  - - [1024, 2048, 1, 128, 1024, 1024, 1024, 2048]
    - [38, 29.73]
  - - [1024, 2048, 1, 256, 1024, 1024, 1024, 2048]
    - [40, 52.89]
  - - [1024, 2048, 1, 512, 1024, 1024, 1024, 2048]
    - [37, 89.01]
  - - [1024, 2048, 1, 1024, 1024, 1024, 1024, 2048]
    - [58, 133.36]
  - - [1024, 2048, 1, 2048, 1024, 1024, 1024, 2048]
    - [36, 181.26]
  - - [1024, 2048, 1, 4096, 1024, 1024, 1024, 2048]
    - [35, 217.99]
  - - [1024, 2048, 1, 8192, 1024, 1024, 1024, 2048]
    - [36, 240.43]
  - - [1024, 4096, 1, 128, 1024, 1024, 1024, 4096]
    - [28, 39.23]
  - - [1024, 4096, 1, 256, 1024, 1024, 1024, 4096]
    - [11, 68.77]
  - - [1024, 4096, 1, 512, 1024, 1024, 1024, 4096]
    - [30, 116.35]
  - - [1024, 4096, 1, 1024, 1024, 1024, 1024, 4096]
    - [32, 180.43]
  - - [1024, 4096, 1, 2048, 1024, 1024, 1024, 4096]
    - [32, 251.76]
  - - [1024, 4096, 1, 4096, 1024, 1024, 1024, 4096]
    - [32, 307.66]
  - - [1024, 4096, 1, 8192, 1024, 1024, 1024, 4096]
    - [32, 344.31]
  - - [1024, 8192, 1, 128, 1024, 1024, 1024, 8192]
    - [24, 52.73]
  - - [1024, 8192, 1, 256, 1024, 1024, 1024, 8192]
    - [24, 94.93]
  - - [1024, 8192, 1, 512, 1024, 1024, 1024, 8192]
    - [24, 158.64]
  - - [1024, 8192, 1, 1024, 1024, 1024, 1024, 8192]
    - [24, 244.22]
  - - [1024, 8192, 1, 2048, 1024, 1024, 1024, 8192]
    - [24, 341.17]
  - - [1024, 8192, 1, 4096, 1024, 1024, 1024, 8192]
    - [23, 406.66]
  - - [1024, 8192, 1, 8192, 1024, 1024, 1024, 8192]
    - [25, 429.56]
  - - [2048, 128, 1, 128, 2048, 2048, 2048, 128]
    - [44, 5.26]
  - - [2048, 128, 1, 256, 2048, 2048, 2048, 128]
    - [48, 9.27]
  - - [2048, 128, 1, 512, 2048, 2048, 2048, 128]
    - [51, 14.75]
  - - [2048, 128, 1, 1024, 2048, 2048, 2048, 128]
    - [53, 21.34]
  - - [2048, 128, 1, 2048, 2048, 2048, 2048, 128]
    - [53, 27.65]
  - - [2048, 128, 1, 4096, 2048, 2048, 2048, 128]
    - [53, 33.11]
  - - [2048, 128, 1, 8192, 2048, 2048, 2048, 128]
    - [53, 36.35]
  - - [2048, 256, 1, 128, 2048, 2048, 2048, 256]
    - [50, 10.14]
  - - [2048, 256, 1, 256, 2048, 2048, 2048, 256]
    - [48, 17.69]
  - - [2048, 256, 1, 512, 2048, 2048, 2048, 256]
    - [53, 28.73]
  - - [2048, 256, 1, 1024, 2048, 2048, 2048, 256]
    - [54, 42.2]
  - - [2048, 256, 1, 2048, 2048, 2048, 2048, 256]
    - [53, 54.7]
  - - [2048, 256, 1, 4096, 2048, 2048, 2048, 256]
    - [53, 64.87]
  - - [2048, 256, 1, 8192, 2048, 2048, 2048, 256]
    - [53, 71.46]
  - - [2048, 512, 1, 128, 2048, 2048, 2048, 512]
    - [42, 18.33]
  - - [2048, 512, 1, 256, 2048, 2048, 2048, 512]
    - [54, 32.22]
  - - [2048, 512, 1, 512, 2048, 2048, 2048, 512]
    - [54, 53.28]
  - - [2048, 512, 1, 1024, 2048, 2048, 2048, 512]
    - [62, 78.83]
  - - [2048, 512, 1, 2048, 2048, 2048, 2048, 512]
    - [55, 103.25]
  - - [2048, 512, 1, 4096, 2048, 2048, 2048, 512]
    - [62, 124.97]
  - - [2048, 512, 1, 8192, 2048, 2048, 2048, 512]
    - [61, 135.44]
  - - [2048, 1024, 1, 128, 2048, 2048, 2048, 1024]
    - [39, 29.78]
  - - [2048, 1024, 1, 256, 2048, 2048, 2048, 1024]
    - [34, 52.8]
  - - [2048, 1024, 1, 512, 2048, 2048, 2048, 1024]
    - [34, 89.71]
  - - [2048, 1024, 1, 1024, 2048, 2048, 2048, 1024]
    - [34, 134.6]
  - - [2048, 1024, 1, 2048, 2048, 2048, 2048, 1024]
    - [37, 180.4]
  - - [2048, 1024, 1, 4096, 2048, 2048, 2048, 1024]
    - [36, 221.16]
  - - [2048, 1024, 1, 8192, 2048, 2048, 2048, 1024]
    - [36, 240.05]
  - - [2048, 2048, 1, 128, 2048, 2048, 2048, 2048]
    - [27, 39.22]
  - - [2048, 2048, 1, 256, 2048, 2048, 2048, 2048]
    - [9, 69.27]
  - - [2048, 2048, 1, 512, 2048, 2048, 2048, 2048]
    - [12, 114.62]
  - - [2048, 2048, 1, 1024, 2048, 2048, 2048, 2048]
    - [32, 183.11]
  - - [2048, 2048, 1, 2048, 2048, 2048, 2048, 2048]
    - [32, 253.04]
  - - [2048, 2048, 1, 4096, 2048, 2048, 2048, 2048]
    - [32, 310.88]
  - - [2048, 2048, 1, 8192, 2048, 2048, 2048, 2048]
    - [32, 344.94]
  - - [2048, 4096, 1, 128, 2048, 2048, 2048, 4096]
    - [4, 51.17]
  - - [2048, 4096, 1, 256, 2048, 2048, 2048, 4096]
    - [4, 92.0]
  - - [2048, 4096, 1, 512, 2048, 2048, 2048, 4096]
    - [4, 152.71]
  - - [2048, 4096, 1, 1024, 2048, 2048, 2048, 4096]
    - [3, 234.16]
  - - [2048, 4096, 1, 2048, 2048, 2048, 2048, 4096]
    - [26, 337.18]
  - - [2048, 4096, 1, 4096, 2048, 2048, 2048, 4096]
    - [26, 395.0]
  - - [2048, 4096, 1, 8192, 2048, 2048, 2048, 4096]
    - [24, 435.23]
  - - [2048, 8192, 1, 128, 2048, 2048, 2048, 8192]
    - [0, 57.79]
  - - [2048, 8192, 1, 256, 2048, 2048, 2048, 8192]
    - [20, 107.44]
  - - [2048, 8192, 1, 512, 2048, 2048, 2048, 8192]
    - [20, 190.78]
  - - [2048, 8192, 1, 1024, 2048, 2048, 2048, 8192]
    - [20, 310.49]
  - - [2048, 8192, 1, 2048, 2048, 2048, 2048, 8192]
    - [20, 450.9]
  - - [2048, 8192, 1, 4096, 2048, 2048, 2048, 8192]
    - [20, 560.83]
  - - [2048, 8192, 1, 8192, 2048, 2048, 2048, 8192]
    - [20, 611.25]
  - - [4096, 128, 1, 128, 4096, 4096, 4096, 128]
    - [42, 10.09]
  - - [4096, 128, 1, 256, 4096, 4096, 4096, 128]
    - [48, 17.53]
  - - [4096, 128, 1, 512, 4096, 4096, 4096, 128]
    - [48, 28.46]
  - - [4096, 128, 1, 1024, 4096, 4096, 4096, 128]
    - [51, 41.31]
  - - [4096, 128, 1, 2048, 4096, 4096, 4096, 128]
    - [53, 55.02]
  - - [4096, 128, 1, 4096, 4096, 4096, 4096, 128]
    - [53, 64.91]
  - - [4096, 128, 1, 8192, 4096, 4096, 4096, 128]
    - [53, 71.2]
  - - [4096, 256, 1, 128, 4096, 4096, 4096, 256]
    - [48, 18.36]
  - - [4096, 256, 1, 256, 4096, 4096, 4096, 256]
    - [48, 31.99]
  - - [4096, 256, 1, 512, 4096, 4096, 4096, 256]
    - [51, 53.06]
  - - [4096, 256, 1, 1024, 4096, 4096, 4096, 256]
    - [53, 78.18]
  - - [4096, 256, 1, 2048, 4096, 4096, 4096, 256]
    - [60, 102.95]
  - - [4096, 256, 1, 4096, 4096, 4096, 4096, 256]
    - [53, 123.5]
  - - [4096, 256, 1, 8192, 4096, 4096, 4096, 256]
    - [53, 135.41]
  - - [4096, 512, 1, 128, 4096, 4096, 4096, 512]
    - [35, 29.33]
  - - [4096, 512, 1, 256, 4096, 4096, 4096, 512]
    - [34, 53.15]
  - - [4096, 512, 1, 512, 4096, 4096, 4096, 512]
    - [33, 88.34]
  - - [4096, 512, 1, 1024, 4096, 4096, 4096, 512]
    - [35, 134.31]
  - - [4096, 512, 1, 2048, 4096, 4096, 4096, 512]
    - [36, 181.18]
  - - [4096, 512, 1, 4096, 4096, 4096, 4096, 512]
    - [41, 214.29]
  - - [4096, 512, 1, 8192, 4096, 4096, 4096, 512]
    - [36, 242.59]
  - - [4096, 1024, 1, 128, 4096, 4096, 4096, 1024]
    - [5, 39.4]
  - - [4096, 1024, 1, 256, 4096, 4096, 4096, 1024]
    - [6, 68.87]
  - - [4096, 1024, 1, 512, 4096, 4096, 4096, 1024]
    - [30, 115.93]
  - - [4096, 1024, 1, 1024, 4096, 4096, 4096, 1024]
    - [32, 180.37]
  - - [4096, 1024, 1, 2048, 4096, 4096, 4096, 1024]
    - [32, 249.08]
  - - [4096, 1024, 1, 4096, 4096, 4096, 4096, 1024]
    - [32, 306.43]
  - - [4096, 1024, 1, 8192, 4096, 4096, 4096, 1024]
    - [32, 347.97]
  - - [4096, 2048, 1, 128, 4096, 4096, 4096, 2048]
    - [21, 50.86]
  - - [4096, 2048, 1, 256, 4096, 4096, 4096, 2048]
    - [24, 90.8]
  - - [4096, 2048, 1, 512, 4096, 4096, 4096, 2048]
    - [24, 153.53]
  - - [4096, 2048, 1, 1024, 4096, 4096, 4096, 2048]
    - [24, 238.64]
  - - [4096, 2048, 1, 2048, 4096, 4096, 4096, 2048]
    - [24, 335.25]
  - - [4096, 2048, 1, 4096, 4096, 4096, 4096, 2048]
    - [24, 399.11]
  - - [4096, 2048, 1, 8192, 4096, 4096, 4096, 2048]
    - [24, 435.7]
  - - [4096, 4096, 1, 128, 4096, 4096, 4096, 4096]
    - [2, 59.74]
  - - [4096, 4096, 1, 256, 4096, 4096, 4096, 4096]
    - [20, 109.17]
  - - [4096, 4096, 1, 512, 4096, 4096, 4096, 4096]
    - [20, 191.99]
  - - [4096, 4096, 1, 1024, 4096, 4096, 4096, 4096]
    - [20, 313.79]
  - - [4096, 4096, 1, 2048, 4096, 4096, 4096, 4096]
    - [20, 463.06]
  - - [4096, 4096, 1, 4096, 4096, 4096, 4096, 4096]
    - [17, 566.68]
  - - [4096, 4096, 1, 8192, 4096, 4096, 4096, 4096]
    - [20, 627.6]
  - - [4096, 8192, 1, 128, 4096, 4096, 4096, 8192]
    - [19, 63.3]
  - - [4096, 8192, 1, 256, 4096, 4096, 4096, 8192]
    - [19, 116.5]
  - - [4096, 8192, 1, 512, 4096, 4096, 4096, 8192]
    - [20, 205.07]
  - - [4096, 8192, 1, 1024, 4096, 4096, 4096, 8192]
    - [17, 322.64]
  - - [4096, 8192, 1, 2048, 4096, 4096, 4096, 8192]
    - [17, 438.72]
  - - [4096, 8192, 1, 4096, 4096, 4096, 4096, 8192]
    - [20, 564.8]
  - - [4096, 8192, 1, 8192, 4096, 4096, 4096, 8192]
    - [20, 673.75]
  - - [8192, 128, 1, 128, 8192, 8192, 8192, 128]
    - [52, 18.12]
  - - [8192, 128, 1, 256, 8192, 8192, 8192, 128]
    - [48, 31.92]
  - - [8192, 128, 1, 512, 8192, 8192, 8192, 128]
    - [51, 53.09]
  - - [8192, 128, 1, 1024, 8192, 8192, 8192, 128]
    - [55, 78.24]
  - - [8192, 128, 1, 2048, 8192, 8192, 8192, 128]
    - [55, 102.26]
  - - [8192, 128, 1, 4096, 8192, 8192, 8192, 128]
    - [47, 121.19]
  - - [8192, 128, 1, 8192, 8192, 8192, 8192, 128]
    - [53, 135.81]
  - - [8192, 256, 1, 128, 8192, 8192, 8192, 256]
    - [38, 29.81]
  - - [8192, 256, 1, 256, 8192, 8192, 8192, 256]
    - [38, 53.11]
  - - [8192, 256, 1, 512, 8192, 8192, 8192, 256]
    - [37, 88.62]
  - - [8192, 256, 1, 1024, 8192, 8192, 8192, 256]
    - [41, 132.93]
  - - [8192, 256, 1, 2048, 8192, 8192, 8192, 256]
    - [41, 177.51]
  - - [8192, 256, 1, 4096, 8192, 8192, 8192, 256]
    - [35, 218.51]
  - - [8192, 256, 1, 8192, 8192, 8192, 8192, 256]
    - [36, 242.66]
  - - [8192, 512, 1, 128, 8192, 8192, 8192, 512]
    - [8, 38.56]
  - - [8192, 512, 1, 256, 8192, 8192, 8192, 512]
    - [10, 68.44]
  - - [8192, 512, 1, 512, 8192, 8192, 8192, 512]
    - [31, 118.98]
  - - [8192, 512, 1, 1024, 8192, 8192, 8192, 512]
    - [32, 180.06]
  - - [8192, 512, 1, 2048, 8192, 8192, 8192, 512]
    - [32, 253.74]
  - - [8192, 512, 1, 4096, 8192, 8192, 8192, 512]
    - [32, 308.59]
  - - [8192, 512, 1, 8192, 8192, 8192, 8192, 512]
    - [32, 346.97]
  - - [8192, 1024, 1, 128, 8192, 8192, 8192, 1024]
    - [22, 51.57]
  - - [8192, 1024, 1, 256, 8192, 8192, 8192, 1024]
    - [24, 93.1]
  - - [8192, 1024, 1, 512, 8192, 8192, 8192, 1024]
    - [24, 156.26]
  - - [8192, 1024, 1, 1024, 8192, 8192, 8192, 1024]
    - [24, 241.84]
  - - [8192, 1024, 1, 2048, 8192, 8192, 8192, 1024]
    - [24, 336.94]
  - - [8192, 1024, 1, 4096, 8192, 8192, 8192, 1024]
    - [24, 406.73]
  - - [8192, 1024, 1, 8192, 8192, 8192, 8192, 1024]
    - [25, 430.3]
  - - [8192, 2048, 1, 128, 8192, 8192, 8192, 2048]
    - [20, 57.91]
  - - [8192, 2048, 1, 256, 8192, 8192, 8192, 2048]
    - [17, 108.22]
  - - [8192, 2048, 1, 512, 8192, 8192, 8192, 2048]
    - [17, 191.16]
  - - [8192, 2048, 1, 1024, 8192, 8192, 8192, 2048]
    - [20, 307.18]
  - - [8192, 2048, 1, 2048, 8192, 8192, 8192, 2048]
    - [18, 438.25]
  - - [8192, 2048, 1, 4096, 8192, 8192, 8192, 2048]
    - [20, 554.07]
  - - [8192, 2048, 1, 8192, 8192, 8192, 8192, 2048]
    - [20, 629.54]
  - - [8192, 4096, 1, 128, 8192, 8192, 8192, 4096]
    - [1, 63.37]
  - - [8192, 4096, 1, 256, 8192, 8192, 8192, 4096]
    - [16, 117.97]
  - - [8192, 4096, 1, 512, 8192, 8192, 8192, 4096]
    - [16, 204.22]
  - - [8192, 4096, 1, 1024, 8192, 8192, 8192, 4096]
    - [18, 323.45]
  - - [8192, 4096, 1, 2048, 8192, 8192, 8192, 4096]
    - [20, 445.4]
  - - [8192, 4096, 1, 4096, 8192, 8192, 8192, 4096]
    - [20, 564.1]
  - - [8192, 4096, 1, 8192, 8192, 8192, 8192, 4096]
    - [20, 666.86]
  - - [8192, 8192, 1, 128, 8192, 8192, 8192, 8192]
    - [16, 70.02]
  - - [8192, 8192, 1, 256, 8192, 8192, 8192, 8192]
    - [19, 129.45]
  - - [8192, 8192, 1, 512, 8192, 8192, 8192, 8192]
    - [15, 217.41]
  - - [8192, 8192, 1, 1024, 8192, 8192, 8192, 8192]
    - [20, 340.33]
  - - [8192, 8192, 1, 2048, 8192, 8192, 8192, 8192]
    - [18, 469.99]
  - - [8192, 8192, 1, 4096, 8192, 8192, 8192, 8192]
    - [20, 614.12]
  - - [8192, 8192, 1, 8192, 8192, 8192, 8192, 8192]
    - [20, 722.53]
- null
- null
- DeviceEfficiency
- GridBased
