projects/hipblaslt/library/src/amd_detail/rocblaslt/src/Tensile/Logic/asm_full/gfx950/GridBased/gfx950_Cijk_Ailk_Bljk_B8F8HS_BH_Bias_HAS_SAB_SAV_UserArgs.yaml
- {MinimumRequiredVersion: 4.33.0}
- gfx950
- gfx950
- [Device 75a0]
    SolutionIndex: 0
    SolutionNameMin: Cijk_Ailk_Bljk_F8HS_BH_Bias_HAS_SAB_SAV_UserArgs_MT256x256x64_MI32x32x1_SN_GSU0_GSUC0_GSUWGMRR0_K1_LBSPPA0_LBSPPB256_LPA0_MIWT4_4_SU0_SUM0_SUS0_VWA4_VWB4_WGM8_WGMXCC1_WGMXCCGn1
    SolutionIndex: 1
    SolutionNameMin: Cijk_Ailk_Bljk_F8HS_BH_Bias_HAS_SAB_SAV_UserArgs_MT256x256x64_MI32x32x1_SN_GSU0_GSUC0_GSUWGMRR0_K1_LBSPPA0_LBSPPB256_LPA0_MIWT4_4_SU0_SUM0_SUS0_VWA4_VWB4_WGM8_WGMXCC1_WGMXCCGn1
    SolutionIndex: 2
    SolutionNameMin: Cijk_Ailk_Bljk_F8HS_BH_Bias_HAS_SAB_SAV_UserArgs_MT256x256x64_MI32x32x1_SN_GSU0_GSUC0_GSUWGMRR0_K1_LBSPPA0_LBSPPB256_LPA0_MIWT4_4_SU0_SUM0_SUS0_VWA4_VWB4_WGM8_WGMXCC1_WGMXCCGn1
    SolutionIndex: 3
    SolutionNameMin: Cijk_Ailk_Bljk_F8HS_BH_Bias_HAS_SAB_SAV_UserArgs_MT256x256x64_MI32x32x1_SN_GSU0_GSUC0_GSUWGMRR0_K1_LBSPPA0_LBSPPB256_LPA0_MIWT4_4_SU0_SUM0_SUS0_VWA4_VWB4_WGM8_WGMXCC1_WGMXCCGn1
    SolutionIndex: 4
    SolutionNameMin: Cijk_Ailk_Bljk_F8HS_BH_Bias_HAS_SAB_SAV_UserArgs_MT256x256x64_MI32x32x1_SN_GSU0_GSUC0_GSUWGMRR0_K1_LBSPPA0_LBSPPB256_LPA0_MIWT4_4_SU0_SUM0_SUS0_VWA4_VWB4_WGM8_WGMXCC1_WGMXCCGn1
    SolutionIndex: 5
    SolutionNameMin: Cijk_Ailk_Bljk_F8HS_BH_Bias_HAS_SAB_SAV_UserArgs_MT128x256x64_MI32x32x1_SN_GSU0_GSUC0_GSUWGMRR0_K1_LBSPPA0_LBSPPB256_LPA0_MIWT2_4_SU0_SUM0_SUS0_VWA2_VWB4_WGM8_WGMXCC1_WGMXCCGn1
    SolutionIndex: 6
    SolutionNameMin: Cijk_Ailk_Bljk_F8HS_BH_Bias_HAS_SAB_SAV_UserArgs_MT128x256x64_MI32x32x1_SN_GSU0_GSUC0_GSUWGMRR0_K1_LBSPPA0_LBSPPB256_LPA0_MIWT2_4_SU0_SUM0_SUS0_VWA2_VWB4_WGM8_WGMXCC1_WGMXCCGn1
    SolutionIndex: 7
    SolutionNameMin: Cijk_Ailk_Bljk_F8HS_BH_Bias_HAS_SAB_SAV_UserArgs_MT128x256x64_MI32x32x1_SN_GSU0_GSUC0_GSUWGMRR0_K1_LBSPPA0_LBSPPB256_LPA0_MIWT2_4_SU0_SUM0_SUS0_VWA2_VWB4_WGM8_WGMXCC1_WGMXCCGn1
    SolutionIndex: 8
    SolutionNameMin: Cijk_Ailk_Bljk_F8HS_BH_Bias_HAS_SAB_SAV_UserArgs_MT128x256x64_MI32x32x1_SN_GSU0_GSUC0_GSUWGMRR0_K1_LBSPPA0_LBSPPB256_LPA0_MIWT2_4_SU0_SUM0_SUS0_VWA2_VWB4_WGM8_WGMXCC1_WGMXCCGn1
    SolutionIndex: 9
    SolutionNameMin: Cijk_Ailk_Bljk_F8HS_BH_Bias_HAS_SAB_SAV_UserArgs_MT256x128x64_MI32x32x1_SN_GSU0_GSUC0_GSUWGMRR0_K1_LBSPPA0_LBSPPB128_LPA0_MIWT4_2_SU0_SUM0_SUS0_VWA4_VWB2_WGM8_WGMXCC1_WGMXCCGn1
    SolutionIndex: 10
    SolutionNameMin: Cijk_Ailk_Bljk_F8HS_BH_Bias_HAS_SAB_SAV_UserArgs_MT256x128x64_MI32x32x1_SN_GSU0_GSUC0_GSUWGMRR0_K1_LBSPPA0_LBSPPB128_LPA0_MIWT4_2_SU0_SUM0_SUS0_VWA4_VWB2_WGM8_WGMXCC1_WGMXCCGn1
    SolutionIndex: 11
    SolutionNameMin: Cijk_Ailk_Bljk_F8HS_BH_Bias_HAS_SAB_SAV_UserArgs_MT128x256x128_MI16x16x1_SN_GSU0_GSUC0_GSUWGMRR0_K1_LBSPPA2048_LBSPPB1024_LPA64_MIWT4_8_SU0_SUM0_SUS0_VWA4_VWB8_WGM8_WGMXCC1_WGMXCCGn1
    SolutionIndex: 12
    SolutionNameMin: Cijk_Ailk_Bljk_F8HS_BH_Bias_HAS_SAB_SAV_UserArgs_MT128x256x128_MI16x16x1_SN_GSU0_GSUC0_GSUWGMRR0_K1_LBSPPA2048_LBSPPB1024_LPA64_MIWT4_8_SU0_SUM0_SUS0_VWA4_VWB8_WGM8_WGMXCC1_WGMXCCGn1
    SolutionIndex: 13
    SolutionNameMin: Cijk_Ailk_Bljk_F8HS_BH_Bias_HAS_SAB_SAV_UserArgs_MT128x256x128_MI16x16x1_SN_GSU0_GSUC0_GSUWGMRR0_K1_LBSPPA2048_LBSPPB1024_LPA64_MIWT4_8_SU0_SUM0_SUS0_VWA4_VWB8_WGM8_WGMXCC1_WGMXCCGn1
    SolutionIndex: 14
    SolutionNameMin: Cijk_Ailk_Bljk_F8HS_BH_Bias_HAS_SAB_SAV_UserArgs_MT256x128x128_MI16x16x1_SN_GSU0_GSUC0_GSUWGMRR0_K1_LBSPPA4096_LBSPPB512_LPA0_MIWT8_4_SU0_SUM0_SUS0_VWA8_VWB4_WGM8_WGMXCC1_WGMXCCGn1
    SolutionIndex: 15
    SolutionNameMin: Cijk_Ailk_Bljk_F8HS_BH_Bias_HAS_SAB_SAV_UserArgs_MT128x128x128_MI16x16x1_SN_GSU0_GSUC0_GSUWGMRR0_K1_LBSPPA2048_LBSPPB512_LPA64_MIWT4_4_SU0_SUM0_SUS0_VWA4_VWB4_WGM8_WGMXCC1_WGMXCCGn1
    SolutionIndex: 16
    SolutionNameMin: Cijk_Ailk_Bljk_F8HS_BH_Bias_HAS_SAB_SAV_UserArgs_MT128x128x128_MI16x16x1_SN_GSU0_GSUC0_GSUWGMRR0_K1_LBSPPA2048_LBSPPB512_LPA64_MIWT4_4_SU0_SUM0_SUS0_VWA4_VWB4_WGM8_WGMXCC1_WGMXCCGn1
    SolutionIndex: 17
    SolutionNameMin: Cijk_Ailk_Bljk_F8HS_BH_Bias_HAS_SAB_SAV_UserArgs_MT128x128x128_MI16x16x1_SN_GSU0_GSUC0_GSUWGMRR0_K1_LBSPPA2048_LBSPPB512_LPA64_MIWT4_4_SU0_SUM0_SUS0_VWA4_VWB4_WGM8_WGMXCC1_WGMXCCGn1
    SolutionIndex: 18
    SolutionNameMin: Cijk_Ailk_Bljk_F8HS_BH_Bias_HAS_SAB_SAV_UserArgs_MT64x128x128_MI16x16x1_SN_GSU0_GSUC0_GSUWGMRR0_K1_LBSPPA1024_LBSPPB512_LPA32_MIWT2_4_SU0_SUM0_SUS0_VWA2_VWB4_WGM8_WGMXCC1_WGMXCCGn1
    SolutionIndex: 19
    SolutionNameMin: Cijk_Ailk_Bljk_F8HS_BH_Bias_HAS_SAB_SAV_UserArgs_MT64x128x128_MI16x16x1_SN_GSU0_GSUC0_GSUWGMRR0_K1_LBSPPA1024_LBSPPB512_LPA32_MIWT2_4_SU0_SUM0_SUS0_VWA2_VWB4_WGM8_WGMXCC1_WGMXCCGn1
    SolutionIndex: 20
    SolutionNameMin: Cijk_Ailk_Bljk_F8HS_BH_Bias_HAS_SAB_SAV_UserArgs_MT64x128x128_MI16x16x1_SN_GSU0_GSUC0_GSUWGMRR0_K1_LBSPPA1024_LBSPPB512_LPA32_MIWT2_4_SU0_SUM0_SUS0_VWA2_VWB4_WGM8_WGMXCC1_WGMXCCGn1
    SolutionIndex: 21
    SolutionNameMin: Cijk_Ailk_Bljk_F8HS_BH_Bias_HAS_SAB_SAV_UserArgs_MT128x64x128_MI16x16x1_SN_GSU0_GSUC0_GSUWGMRR0_K1_LBSPPA2048_LBSPPB256_LPA64_MIWT4_2_SU0_SUM0_SUS0_VWA4_VWB2_WGM8_WGMXCC1_WGMXCCGn1
    SolutionIndex: 22
    SolutionNameMin: Cijk_Ailk_Bljk_F8HS_BH_Bias_HAS_SAB_SAV_UserArgs_MT128x32x128_MI16x16x1_SN_GSU0_GSUC0_GSUWGMRR0_K1_LBSPPA2048_LBSPPB128_LPA64_MIWT4_1_SU0_SUM0_SUS0_VWA4_VWB1_WGM8_WGMXCC1_WGMXCCGn1
    SolutionIndex: 23
    SolutionNameMin: Cijk_Ailk_Bljk_F8HS_BH_Bias_HAS_SAB_SAV_UserArgs_MT64x64x128_MI16x16x1_SN_GSU0_GSUC0_GSUWGMRR0_K1_LBSPPA1024_LBSPPB256_LPA32_MIWT2_2_SU0_SUM0_SUS0_VWA2_VWB2_WGM8_WGMXCC1_WGMXCCGn1
    SolutionIndex: 24
    SolutionNameMin: Cijk_Ailk_Bljk_F8HS_BH_Bias_HAS_SAB_SAV_UserArgs_MT64x64x128_MI16x16x1_SN_GSU0_GSUC0_GSUWGMRR0_K1_LBSPPA1024_LBSPPB256_LPA32_MIWT2_2_SU0_SUM0_SUS0_VWA2_VWB2_WGM8_WGMXCC1_WGMXCCGn1
    SolutionIndex: 25
    SolutionNameMin: Cijk_Ailk_Bljk_F8HS_BH_Bias_HAS_SAB_SAV_UserArgs_MT64x64x128_MI16x16x1_SN_GSU0_GSUC0_GSUWGMRR0_K1_LBSPPA1024_LBSPPB256_LPA32_MIWT2_2_SU0_SUM0_SUS0_VWA2_VWB2_WGM8_WGMXCC1_WGMXCCGn1
    SolutionIndex: 26
    SolutionNameMin: Cijk_Ailk_Bljk_F8HS_BH_Bias_HAS_SAB_SAV_UserArgs_MT64x64x128_MI16x16x1_SN_GSU0_GSUC0_GSUWGMRR0_K1_LBSPPA1024_LBSPPB256_LPA32_MIWT2_2_SU0_SUM0_SUS0_VWA2_VWB2_WGM8_WGMXCC1_WGMXCCGn1
    SolutionIndex: 27
    SolutionNameMin: Cijk_Ailk_Bljk_F8HS_BH_Bias_HAS_SAB_SAV_UserArgs_MT64x64x128_MI16x16x1_SN_GSU0_GSUC0_GSUWGMRR0_K1_LBSPPA1024_LBSPPB256_LPA32_MIWT2_2_SU0_SUM0_SUS0_VWA2_VWB2_WGM8_WGMXCC1_WGMXCCGn1
    SolutionIndex: 28
    SolutionNameMin: Cijk_Ailk_Bljk_F8HS_BH_Bias_HAS_SAB_SAV_UserArgs_MT32x64x128_MI16x16x1_SN_GSU0_GSUC0_GSUWGMRR0_K1_LBSPPA512_LBSPPB256_LPA16_MIWT1_2_SU0_SUM0_SUS0_VWA1_VWB2_WGM8_WGMXCC1_WGMXCCGn1
    SolutionIndex: 29
    SolutionNameMin: Cijk_Ailk_Bljk_F8HS_BH_Bias_HAS_SAB_SAV_UserArgs_MT64x32x128_MI16x16x1_SN_GSU0_GSUC0_GSUWGMRR0_K1_LBSPPA1024_LBSPPB128_LPA32_MIWT2_1_SU0_SUM0_SUS0_VWA2_VWB1_WGM8_WGMXCC1_WGMXCCGn1
    SolutionIndex: 30
    SolutionNameMin: Cijk_Ailk_Bljk_F8HS_BH_Bias_HAS_SAB_SAV_UserArgs_MT32x32x128_MI16x16x1_SN_GSU0_GSUC0_GSUWGMRR0_K1_LBSPPA512_LBSPPB128_LPA16_MIWT1_1_SU0_SUM0_SUS0_VWA1_VWB1_WGM8_WGMXCC1_WGMXCCGn1
    SolutionIndex: 31
    SolutionNameMin: Cijk_Ailk_Bljk_F8HS_BH_Bias_HAS_SAB_SAV_UserArgs_MT32x32x128_MI16x16x1_SN_GSU0_GSUC0_GSUWGMRR0_K1_LBSPPA512_LBSPPB128_LPA16_MIWT1_1_SU0_SUM0_SUS0_VWA1_VWB1_WGM8_WGMXCC1_WGMXCCGn1
    SolutionIndex: 32
    SolutionNameMin: Cijk_Ailk_Bljk_F8HS_BH_Bias_HAS_SAB_SAV_UserArgs_MT32x32x128_MI16x16x1_SN_GSU0_GSUC0_GSUWGMRR0_K1_LBSPPA512_LBSPPB128_LPA16_MIWT1_1_SU0_SUM0_SUS0_VWA1_VWB1_WGM8_WGMXCC1_WGMXCCGn1
    SolutionIndex: 33
    SolutionNameMin: Cijk_Ailk_Bljk_F8HS_BH_Bias_HAS_SAB_SAV_UserArgs_MT256x256x128_MI32x32x1_SN_GSU0_GSUC0_GSUWGMRR0_K1_LBSPPA0_LBSPPB512_LPA0_MIWT4_4_SU0_SUM0_SUS0_VWA4_VWB4_WGM8_WGMXCC1_WGMXCCGn1
    SolutionIndex: 34
    SolutionNameMin: Cijk_Ailk_Bljk_F8HS_BH_Bias_HAS_SAB_SAV_UserArgs_MT256x256x128_MI32x32x1_SN_GSU0_GSUC0_GSUWGMRR0_K1_LBSPPA0_LBSPPB512_LPA0_MIWT4_4_SU0_SUM0_SUS0_VWA4_VWB4_WGM8_WGMXCC1_WGMXCCGn1
    SolutionIndex: 35
    SolutionNameMin: Cijk_Ailk_Bljk_F8HS_BH_Bias_HAS_SAB_SAV_UserArgs_MT128x256x128_MI32x32x1_SN_GSU0_GSUC0_GSUWGMRR0_K1_LBSPPA0_LBSPPB512_LPA0_MIWT2_4_SU0_SUM0_SUS0_VWA2_VWB4_WGM8_WGMXCC1_WGMXCCGn1
    SolutionIndex: 36
    SolutionNameMin: Cijk_Ailk_Bljk_F8HS_BH_Bias_HAS_SAB_SAV_UserArgs_MT128x256x128_MI32x32x1_SN_GSU0_GSUC0_GSUWGMRR0_K1_LBSPPA0_LBSPPB512_LPA0_MIWT2_4_SU0_SUM0_SUS0_VWA2_VWB4_WGM8_WGMXCC1_WGMXCCGn1
    SolutionIndex: 37
    SolutionNameMin: Cijk_Ailk_Bljk_F8HS_BH_Bias_HAS_SAB_SAV_UserArgs_MT128x256x128_MI32x32x1_SN_GSU0_GSUC0_GSUWGMRR0_K1_LBSPPA0_LBSPPB512_LPA0_MIWT2_4_SU0_SUM0_SUS0_VWA2_VWB4_WGM8_WGMXCC1_WGMXCCGn1
    SolutionIndex: 38
    SolutionNameMin: Cijk_Ailk_Bljk_F8HS_BH_Bias_HAS_SAB_SAV_UserArgs_MT128x128x128_MI32x32x1_SN_GSU0_GSUC0_GSUWGMRR0_K1_LBSPPA0_LBSPPB256_LPA0_MIWT2_2_SU0_SUM0_SUS0_VWA2_VWB2_WGM8_WGMXCC1_WGMXCCGn1
    SolutionIndex: 39
    SolutionNameMin: Cijk_Ailk_Bljk_F8HS_BH_Bias_HAS_SAB_SAV_UserArgs_MT128x128x256_MI16x16x1_SN_GSU0_GSUC0_GSUWGMRR0_K1_LBSPPA2048_LBSPPB1024_LPA64_MIWT4_4_SU0_SUM0_SUS0_VWA4_VWB4_WGM8_WGMXCC1_WGMXCCGn1
    SolutionIndex: 40
    SolutionNameMin: Cijk_Ailk_Bljk_F8HS_BH_Bias_HAS_SAB_SAV_UserArgs_MT64x64x256_MI16x16x1_SN_GSU0_GSUC0_GSUWGMRR0_K1_LBSPPA1024_LBSPPB512_LPA32_MIWT2_2_SU0_SUM0_SUS0_VWA2_VWB2_WGM8_WGMXCC1_WGMXCCGn1
    SolutionIndex: 41
    SolutionNameMin: Cijk_Ailk_Bljk_F8HS_BH_Bias_HAS_SAB_SAV_UserArgs_MT32x64x256_MI16x16x1_SN_GSU0_GSUC0_GSUWGMRR0_K1_LBSPPA512_LBSPPB512_LPA16_MIWT1_2_SU0_SUM0_SUS0_VWA1_VWB2_WGM8_WGMXCC1_WGMXCCGn1
    SolutionIndex: 42
    SolutionNameMin: Cijk_Ailk_Bljk_F8HS_BH_Bias_HAS_SAB_SAV_UserArgs_MT32x64x256_MI16x16x1_SN_GSU0_GSUC0_GSUWGMRR0_K1_LBSPPA512_LBSPPB512_LPA16_MIWT1_2_SU0_SUM0_SUS0_VWA1_VWB2_WGM8_WGMXCC1_WGMXCCGn1
    SolutionIndex: 43
    SolutionNameMin: Cijk_Ailk_Bljk_F8HS_BH_Bias_HAS_SAB_SAV_UserArgs_MT64x32x256_MI16x16x1_SN_GSU0_GSUC0_GSUWGMRR0_K1_LBSPPA1024_LBSPPB256_LPA32_MIWT2_1_SU0_SUM0_SUS0_VWA2_VWB1_WGM8_WGMXCC1_WGMXCCGn1
    SolutionIndex: 44
    SolutionNameMin: Cijk_Ailk_Bljk_F8HS_BH_Bias_HAS_SAB_SAV_UserArgs_MT32x32x256_MI16x16x1_SN_GSU0_GSUC0_GSUWGMRR0_K1_LBSPPA512_LBSPPB256_LPA16_MIWT1_1_SU0_SUM0_SUS0_VWA1_VWB1_WGM8_WGMXCC1_WGMXCCGn1
    SolutionIndex: 45
    SolutionNameMin: Cijk_Ailk_Bljk_F8HS_BH_Bias_HAS_SAB_SAV_UserArgs_MT32x32x256_MI16x16x1_SN_GSU0_GSUC0_GSUWGMRR0_K1_LBSPPA512_LBSPPB256_LPA16_MIWT1_1_SU0_SUM0_SUS0_VWA1_VWB1_WGM8_WGMXCC1_WGMXCCGn1
    SolutionIndex: 46
    SolutionNameMin: Cijk_Ailk_Bljk_F8HS_BH_Bias_HAS_SAB_SAV_UserArgs_MT32x32x256_MI16x16x1_SN_GSU0_GSUC0_GSUWGMRR0_K1_LBSPPA512_LBSPPB256_LPA16_MIWT1_1_SU0_SUM0_SUS0_VWA1_VWB1_WGM8_WGMXCC1_WGMXCCGn1
    SolutionIndex: 47
    SolutionNameMin: Cijk_Ailk_Bljk_F8HS_BH_Bias_HAS_SAB_SAV_UserArgs_MT32x32x256_MI16x16x1_SN_GSU0_GSUC0_GSUWGMRR0_K1_LBSPPA512_LBSPPB256_LPA16_MIWT1_1_SU0_SUM0_SUS0_VWA1_VWB1_WGM8_WGMXCC1_WGMXCCGn1
    SolutionIndex: 48
    SolutionNameMin: Cijk_Ailk_Bljk_F8HS_BH_Bias_HAS_SAB_SAV_UserArgs_MT32x32x128_MI16x16x1_SN_GSU0_GSUC0_GSUWGMRR0_K1_LBSPPA256_LBSPPB128_LPA16_MIWT1_1_SU32_SUM0_SUS256_VWA1_VWB1_WGM8_WGMXCC1_WGMXCCGn1
- - - [128, 128, 1, 128, 128, 128, 128, 128]
    - [32, 0.43]
  - - [128, 128, 1, 256, 128, 128, 128, 256]
    - [32, 0.77]
  - - [128, 128, 1, 512, 128, 128, 128, 512]
    - [32, 1.31]
  - - [128, 128, 1, 1024, 128, 128, 128, 1024]
    - [46, 2.16]
  - - [128, 128, 1, 2048, 128, 128, 128, 2048]
    - [46, 3.18]
  - - [128, 128, 1, 4096, 128, 128, 128, 4096]
    - [46, 4.15]
  - - [128, 128, 1, 8192, 128, 128, 128, 8192]
    - [46, 4.93]
  - - [128, 256, 1, 128, 128, 128, 128, 128]
    - [32, 0.85]
  - - [128, 256, 1, 256, 128, 128, 128, 256]
    - [32, 1.54]
  - - [128, 256, 1, 512, 128, 128, 128, 512]
    - [46, 2.62]
  - - [128, 256, 1, 1024, 128, 128, 128, 1024]
    - [47, 4.32]
  - - [128, 256, 1, 2048, 128, 128, 128, 2048]
    - [46, 6.34]
  - - [128, 256, 1, 4096, 128, 128, 128, 4096]
    - [46, 8.32]
  - - [128, 256, 1, 8192, 128, 128, 128, 8192]
    - [46, 9.89]
  - - [128, 512, 1, 128, 128, 128, 128, 128]
    - [32, 1.67]
  - - [128, 512, 1, 256, 128, 128, 128, 256]
    - [45, 2.98]
  - - [128, 512, 1, 512, 128, 128, 128, 512]
    - [46, 5.13]
  - - [128, 512, 1, 1024, 128, 128, 128, 1024]
    - [46, 8.46]
  - - [128, 512, 1, 2048, 128, 128, 128, 2048]
    - [46, 12.77]
  - - [128, 512, 1, 4096, 128, 128, 128, 4096]
    - [46, 16.64]
  - - [128, 512, 1, 8192, 128, 128, 128, 8192]
    - [46, 19.78]
  - - [128, 1024, 1, 128, 128, 128, 128, 128]
    - [30, 3.26]
  - - [128, 1024, 1, 256, 128, 128, 128, 256]
    - [45, 5.8]
  - - [128, 1024, 1, 512, 128, 128, 128, 512]
    - [46, 10.23]
  - - [128, 1024, 1, 1024, 128, 128, 128, 1024]
    - [46, 17.07]
  - - [128, 1024, 1, 2048, 128, 128, 128, 2048]
    - [46, 25.26]
  - - [128, 1024, 1, 4096, 128, 128, 128, 4096]
    - [46, 33.16]
  - - [128, 1024, 1, 8192, 128, 128, 128, 8192]
    - [47, 39.42]
  - - [128, 2048, 1, 128, 128, 128, 128, 128]
    - [32, 6.29]
  - - [128, 2048, 1, 256, 128, 128, 128, 256]
    - [46, 11.46]
  - - [128, 2048, 1, 512, 128, 128, 128, 512]
    - [46, 19.92]
  - - [128, 2048, 1, 1024, 128, 128, 128, 1024]
    - [46, 32.59]
  - - [128, 2048, 1, 2048, 128, 128, 128, 2048]
    - [46, 48.62]
  - - [128, 2048, 1, 4096, 128, 128, 128, 4096]
    - [47, 64.21]
  - - [128, 2048, 1, 8192, 128, 128, 128, 8192]
    - [47, 77.65]
  - - [128, 4096, 1, 128, 128, 128, 128, 128]
    - [29, 12.15]
  - - [128, 4096, 1, 256, 128, 128, 128, 256]
    - [29, 21.34]
  - - [128, 4096, 1, 512, 128, 128, 128, 512]
    - [29, 36.4]
  - - [128, 4096, 1, 1024, 128, 128, 128, 1024]
    - [41, 58.87]
  - - [128, 4096, 1, 2048, 128, 128, 128, 2048]
    - [41, 86.49]
  - - [128, 4096, 1, 4096, 128, 128, 128, 4096]
    - [42, 113.45]
  - - [128, 4096, 1, 8192, 128, 128, 128, 8192]
    - [43, 131.55]
  - - [128, 8192, 1, 128, 128, 128, 128, 128]
    - [26, 22.19]
  - - [128, 8192, 1, 256, 128, 128, 128, 256]
    - [25, 39.61]
  - - [128, 8192, 1, 512, 128, 128, 128, 512]
    - [23, 66.66]
  - - [128, 8192, 1, 1024, 128, 128, 128, 1024]
    - [40, 103.3]
  - - [128, 8192, 1, 2048, 128, 128, 128, 2048]
    - [40, 151.52]
  - - [128, 8192, 1, 4096, 128, 128, 128, 4096]
    - [40, 189.81]
  - - [128, 8192, 1, 8192, 128, 128, 128, 8192]
    - [40, 214.49]
  - - [256, 128, 1, 128, 256, 256, 256, 128]
    - [31, 0.84]
  - - [256, 128, 1, 256, 256, 256, 256, 256]
    - [32, 1.49]
  - - [256, 128, 1, 512, 256, 256, 256, 512]
    - [32, 2.55]
  - - [256, 128, 1, 1024, 256, 256, 256, 1024]
    - [46, 4.27]
  - - [256, 128, 1, 2048, 256, 256, 256, 2048]
    - [46, 6.36]
  - - [256, 128, 1, 4096, 256, 256, 256, 4096]
    - [47, 8.32]
  - - [256, 128, 1, 8192, 256, 256, 256, 8192]
    - [46, 9.93]
  - - [256, 256, 1, 128, 256, 256, 256, 128]
    - [32, 1.67]
  - - [256, 256, 1, 256, 256, 256, 256, 256]
    - [46, 3.0]
  - - [256, 256, 1, 512, 256, 256, 256, 512]
    - [46, 5.22]
  - - [256, 256, 1, 1024, 256, 256, 256, 1024]
    - [46, 8.59]
  - - [256, 256, 1, 2048, 256, 256, 256, 2048]
    - [46, 12.82]
  - - [256, 256, 1, 4096, 256, 256, 256, 4096]
    - [46, 16.72]
  - - [256, 256, 1, 8192, 256, 256, 256, 8192]
    - [46, 19.89]
  - - [256, 512, 1, 128, 256, 256, 256, 128]
    - [32, 3.31]
  - - [256, 512, 1, 256, 256, 256, 256, 256]
    - [46, 5.94]
  - - [256, 512, 1, 512, 256, 256, 256, 512]
    - [46, 10.33]
  - - [256, 512, 1, 1024, 256, 256, 256, 1024]
    - [46, 17.37]
  - - [256, 512, 1, 2048, 256, 256, 256, 2048]
    - [46, 25.91]
  - - [256, 512, 1, 4096, 256, 256, 256, 4096]
    - [46, 33.72]
  - - [256, 512, 1, 8192, 256, 256, 256, 8192]
    - [47, 40.08]
  - - [256, 1024, 1, 128, 256, 256, 256, 128]
    - [30, 6.3]
  - - [256, 1024, 1, 256, 256, 256, 256, 256]
    - [46, 11.61]
  - - [256, 1024, 1, 512, 256, 256, 256, 512]
    - [46, 20.24]
  - - [256, 1024, 1, 1024, 256, 256, 256, 1024]
    - [46, 33.46]
  - - [256, 1024, 1, 2048, 256, 256, 256, 2048]
    - [46, 49.86]
  - - [256, 1024, 1, 4096, 256, 256, 256, 4096]
    - [46, 65.7]
  - - [256, 1024, 1, 8192, 256, 256, 256, 8192]
    - [47, 78.16]
  - - [256, 2048, 1, 128, 256, 256, 256, 128]
    - [28, 12.21]
  - - [256, 2048, 1, 256, 256, 256, 256, 256]
    - [41, 21.6]
  - - [256, 2048, 1, 512, 256, 256, 256, 512]
    - [41, 36.94]
  - - [256, 2048, 1, 1024, 256, 256, 256, 1024]
    - [41, 60.66]
  - - [256, 2048, 1, 2048, 256, 256, 256, 2048]
    - [41, 88.59]
  - - [256, 2048, 1, 4096, 256, 256, 256, 4096]
    - [42, 114.92]
  - - [256, 2048, 1, 8192, 256, 256, 256, 8192]
    - [42, 136.97]
  - - [256, 4096, 1, 128, 256, 256, 256, 128]
    - [25, 22.23]
  - - [256, 4096, 1, 256, 256, 256, 256, 256]
    - [25, 39.69]
  - - [256, 4096, 1, 512, 256, 256, 256, 512]
    - [25, 67.73]
  - - [256, 4096, 1, 1024, 256, 256, 256, 1024]
    - [40, 105.09]
  - - [256, 4096, 1, 2048, 256, 256, 256, 2048]
    - [40, 151.57]
  - - [256, 4096, 1, 4096, 256, 256, 256, 4096]
    - [40, 191.14]
  - - [256, 4096, 1, 8192, 256, 256, 256, 8192]
    - [40, 215.83]
  - - [256, 8192, 1, 128, 256, 256, 256, 128]
    - [21, 37.98]
  - - [256, 8192, 1, 256, 256, 256, 256, 256]
    - [18, 68.19]
  - - [256, 8192, 1, 512, 256, 256, 256, 512]
    - [18, 116.61]
  - - [256, 8192, 1, 1024, 256, 256, 256, 1024]
    - [18, 181.65]
  - - [256, 8192, 1, 2048, 256, 256, 256, 2048]
    - [18, 248.35]
  - - [256, 8192, 1, 4096, 256, 256, 256, 4096]
    - [18, 296.04]
  - - [256, 8192, 1, 8192, 256, 256, 256, 8192]
    - [20, 328.56]
  - - [512, 128, 1, 128, 512, 512, 512, 128]
    - [32, 1.63]
  - - [512, 128, 1, 256, 512, 512, 512, 256]
    - [32, 2.94]
  - - [512, 128, 1, 512, 512, 512, 512, 512]
    - [46, 5.05]
  - - [512, 128, 1, 1024, 512, 512, 512, 1024]
    - [46, 8.61]
  - - [512, 128, 1, 2048, 512, 512, 512, 2048]
    - [47, 12.56]
  - - [512, 128, 1, 4096, 512, 512, 512, 4096]
    - [47, 16.56]
  - - [512, 128, 1, 8192, 512, 512, 512, 8192]
    - [47, 19.38]
  - - [512, 256, 1, 128, 512, 512, 512, 128]
    - [32, 3.3]
  - - [512, 256, 1, 256, 512, 512, 512, 256]
    - [46, 5.91]
  - - [512, 256, 1, 512, 512, 512, 512, 512]
    - [46, 10.32]
  - - [512, 256, 1, 1024, 512, 512, 512, 1024]
    - [46, 17.37]
  - - [512, 256, 1, 2048, 512, 512, 512, 2048]
    - [46, 25.42]
  - - [512, 256, 1, 4096, 512, 512, 512, 4096]
    - [46, 32.96]
  - - [512, 256, 1, 8192, 512, 512, 512, 8192]
    - [47, 38.99]
  - - [512, 512, 1, 128, 512, 512, 512, 128]
    - [32, 6.4]
  - - [512, 512, 1, 256, 512, 512, 512, 256]
    - [46, 11.58]
  - - [512, 512, 1, 512, 512, 512, 512, 512]
    - [46, 20.38]
  - - [512, 512, 1, 1024, 512, 512, 512, 1024]
    - [46, 33.78]
  - - [512, 512, 1, 2048, 512, 512, 512, 2048]
    - [46, 49.93]
  - - [512, 512, 1, 4096, 512, 512, 512, 4096]
    - [46, 65.63]
  - - [512, 512, 1, 8192, 512, 512, 512, 8192]
    - [47, 77.39]
  - - [512, 1024, 1, 128, 512, 512, 512, 128]
    - [28, 12.21]
  - - [512, 1024, 1, 256, 512, 512, 512, 256]
    - [29, 21.88]
  - - [512, 1024, 1, 512, 512, 512, 512, 512]
    - [28, 37.17]
  - - [512, 1024, 1, 1024, 512, 512, 512, 1024]
    - [42, 60.34]
  - - [512, 1024, 1, 2048, 512, 512, 512, 2048]
    - [43, 86.96]
  - - [512, 1024, 1, 4096, 512, 512, 512, 4096]
    - [43, 111.38]
  - - [512, 1024, 1, 8192, 512, 512, 512, 8192]
    - [43, 130.71]
  - - [512, 2048, 1, 128, 512, 512, 512, 128]
    - [26, 22.4]
  - - [512, 2048, 1, 256, 512, 512, 512, 256]
    - [25, 40.1]
  - - [512, 2048, 1, 512, 512, 512, 512, 512]
    - [26, 68.35]
  - - [512, 2048, 1, 1024, 512, 512, 512, 1024]
    - [40, 105.95]
  - - [512, 2048, 1, 2048, 512, 512, 512, 2048]
    - [27, 144.7]
  - - [512, 2048, 1, 4096, 512, 512, 512, 4096]
    - [27, 179.73]
  - - [512, 2048, 1, 8192, 512, 512, 512, 8192]
    - [27, 202.06]
  - - [512, 4096, 1, 128, 512, 512, 512, 128]
    - [21, 38.29]
  - - [512, 4096, 1, 256, 512, 512, 512, 256]
    - [18, 68.05]
  - - [512, 4096, 1, 512, 512, 512, 512, 512]
    - [18, 117.05]
  - - [512, 4096, 1, 1024, 512, 512, 512, 1024]
    - [18, 179.85]
  - - [512, 4096, 1, 2048, 512, 512, 512, 2048]
    - [20, 250.4]
  - - [512, 4096, 1, 4096, 512, 512, 512, 4096]
    - [20, 306.9]
  - - [512, 4096, 1, 8192, 512, 512, 512, 8192]
    - [18, 332.89]
  - - [512, 8192, 1, 128, 512, 512, 512, 128]
    - [15, 59.76]
  - - [512, 8192, 1, 256, 512, 512, 512, 256]
    - [17, 107.19]
  - - [512, 8192, 1, 512, 512, 512, 512, 512]
    - [15, 181.08]
  - - [512, 8192, 1, 1024, 512, 512, 512, 1024]
    - [17, 273.45]
  - - [512, 8192, 1, 2048, 512, 512, 512, 2048]
    - [17, 369.54]
  - - [512, 8192, 1, 4096, 512, 512, 512, 4096]
    - [17, 444.7]
  - - [512, 8192, 1, 8192, 512, 512, 512, 8192]
    - [39, 454.18]
  - - [1024, 128, 1, 128, 1024, 1024, 1024, 128]
    - [32, 3.23]
  - - [1024, 128, 1, 256, 1024, 1024, 1024, 256]
    - [46, 5.84]
  - - [1024, 128, 1, 512, 1024, 1024, 1024, 512]
    - [46, 10.0]
  - - [1024, 128, 1, 1024, 1024, 1024, 1024, 1024]
    - [46, 16.47]
  - - [1024, 128, 1, 2048, 1024, 1024, 1024, 2048]
    - [47, 23.85]
  - - [1024, 128, 1, 4096, 1024, 1024, 1024, 4096]
    - [47, 30.62]
  - - [1024, 128, 1, 8192, 1024, 1024, 1024, 8192]
    - [47, 36.42]
  - - [1024, 256, 1, 128, 1024, 1024, 1024, 128]
    - [32, 6.26]
  - - [1024, 256, 1, 256, 1024, 1024, 1024, 256]
    - [46, 11.29]
  - - [1024, 256, 1, 512, 1024, 1024, 1024, 512]
    - [45, 19.57]
  - - [1024, 256, 1, 1024, 1024, 1024, 1024, 1024]
    - [46, 31.65]
  - - [1024, 256, 1, 2048, 1024, 1024, 1024, 2048]
    - [46, 46.55]
  - - [1024, 256, 1, 4096, 1024, 1024, 1024, 4096]
    - [47, 60.75]
  - - [1024, 256, 1, 8192, 1024, 1024, 1024, 8192]
    - [47, 72.19]
  - - [1024, 512, 1, 128, 1024, 1024, 1024, 128]
    - [29, 12.19]
  - - [1024, 512, 1, 256, 1024, 1024, 1024, 256]
    - [29, 21.78]
  - - [1024, 512, 1, 512, 1024, 1024, 1024, 512]
    - [29, 37.41]
  - - [1024, 512, 1, 1024, 1024, 1024, 1024, 1024]
    - [43, 59.48]
  - - [1024, 512, 1, 2048, 1024, 1024, 1024, 2048]
    - [43, 84.83]
  - - [1024, 512, 1, 4096, 1024, 1024, 1024, 4096]
    - [43, 108.05]
  - - [1024, 512, 1, 8192, 1024, 1024, 1024, 8192]
    - [43, 125.53]
  - - [1024, 1024, 1, 128, 1024, 1024, 1024, 128]
    - [25, 22.6]
  - - [1024, 1024, 1, 256, 1024, 1024, 1024, 256]
    - [25, 40.2]
  - - [1024, 1024, 1, 512, 1024, 1024, 1024, 512]
    - [25, 69.23]
  - - [1024, 1024, 1, 1024, 1024, 1024, 1024, 1024]
    - [25, 106.3]
  - - [1024, 1024, 1, 2048, 1024, 1024, 1024, 2048]
    - [25, 146.39]
  - - [1024, 1024, 1, 4096, 1024, 1024, 1024, 4096]
    - [27, 180.94]
  - - [1024, 1024, 1, 8192, 1024, 1024, 1024, 8192]
    - [27, 205.21]
  - - [1024, 2048, 1, 128, 1024, 1024, 1024, 128]
    - [18, 38.6]
  - - [1024, 2048, 1, 256, 1024, 1024, 1024, 256]
    - [18, 68.65]
  - - [1024, 2048, 1, 512, 1024, 1024, 1024, 512]
    - [18, 117.91]
  - - [1024, 2048, 1, 1024, 1024, 1024, 1024, 1024]
    - [18, 181.99]
  - - [1024, 2048, 1, 2048, 1024, 1024, 1024, 2048]
    - [18, 251.95]
  - - [1024, 2048, 1, 4096, 1024, 1024, 1024, 4096]
    - [20, 310.08]
  - - [1024, 2048, 1, 8192, 1024, 1024, 1024, 8192]
    - [20, 332.73]
  - - [1024, 4096, 1, 128, 1024, 1024, 1024, 128]
    - [15, 60.84]
  - - [1024, 4096, 1, 256, 1024, 1024, 1024, 256]
    - [15, 107.59]
  - - [1024, 4096, 1, 512, 1024, 1024, 1024, 512]
    - [17, 181.29]
  - - [1024, 4096, 1, 1024, 1024, 1024, 1024, 1024]
    - [17, 274.75]
  - - [1024, 4096, 1, 2048, 1024, 1024, 1024, 2048]
    - [17, 370.27]
  - - [1024, 4096, 1, 4096, 1024, 1024, 1024, 4096]
    - [17, 447.29]
  - - [1024, 4096, 1, 8192, 1024, 1024, 1024, 8192]
    - [17, 456.12]
  - - [1024, 8192, 1, 128, 1024, 1024, 1024, 128]
    - [11, 77.3]
  - - [1024, 8192, 1, 256, 1024, 1024, 1024, 256]
    - [11, 136.36]
  - - [1024, 8192, 1, 512, 1024, 1024, 1024, 512]
    - [12, 230.01]
  - - [1024, 8192, 1, 1024, 1024, 1024, 1024, 1024]
    - [13, 349.79]
  - - [1024, 8192, 1, 2048, 1024, 1024, 1024, 2048]
    - [12, 457.27]
  - - [1024, 8192, 1, 4096, 1024, 1024, 1024, 4096]
    - [35, 523.5]
  - - [1024, 8192, 1, 8192, 1024, 1024, 1024, 8192]
    - [36, 536.95]
  - - [2048, 128, 1, 128, 2048, 2048, 2048, 128]
    - [32, 6.33]
  - - [2048, 128, 1, 256, 2048, 2048, 2048, 256]
    - [44, 11.21]
  - - [2048, 128, 1, 512, 2048, 2048, 2048, 512]
    - [46, 19.57]
  - - [2048, 128, 1, 1024, 2048, 2048, 2048, 1024]
    - [46, 31.42]
  - - [2048, 128, 1, 2048, 2048, 2048, 2048, 2048]
    - [47, 46.37]
  - - [2048, 128, 1, 4096, 2048, 2048, 2048, 4096]
    - [46, 57.53]
  - - [2048, 128, 1, 8192, 2048, 2048, 2048, 8192]
    - [47, 69.99]
  - - [2048, 256, 1, 128, 2048, 2048, 2048, 128]
    - [29, 12.07]
  - - [2048, 256, 1, 256, 2048, 2048, 2048, 256]
    - [29, 21.46]
  - - [2048, 256, 1, 512, 2048, 2048, 2048, 512]
    - [29, 36.4]
  - - [2048, 256, 1, 1024, 2048, 2048, 2048, 1024]
    - [43, 58.46]
  - - [2048, 256, 1, 2048, 2048, 2048, 2048, 2048]
    - [43, 82.68]
  - - [2048, 256, 1, 4096, 2048, 2048, 2048, 4096]
    - [43, 104.86]
  - - [2048, 256, 1, 8192, 2048, 2048, 2048, 8192]
    - [43, 122.68]
  - - [2048, 512, 1, 128, 2048, 2048, 2048, 128]
    - [22, 21.96]
  - - [2048, 512, 1, 256, 2048, 2048, 2048, 256]
    - [26, 39.58]
  - - [2048, 512, 1, 512, 2048, 2048, 2048, 512]
    - [25, 68.27]
  - - [2048, 512, 1, 1024, 2048, 2048, 2048, 1024]
    - [25, 104.5]
  - - [2048, 512, 1, 2048, 2048, 2048, 2048, 2048]
    - [25, 143.62]
  - - [2048, 512, 1, 4096, 2048, 2048, 2048, 4096]
    - [27, 178.37]
  - - [2048, 512, 1, 8192, 2048, 2048, 2048, 8192]
    - [27, 202.58]
  - - [2048, 1024, 1, 128, 2048, 2048, 2048, 128]
    - [21, 38.02]
  - - [2048, 1024, 1, 256, 2048, 2048, 2048, 256]
    - [18, 67.65]
  - - [2048, 1024, 1, 512, 2048, 2048, 2048, 512]
    - [18, 116.9]
  - - [2048, 1024, 1, 1024, 2048, 2048, 2048, 1024]
    - [18, 180.07]
  - - [2048, 1024, 1, 2048, 2048, 2048, 2048, 2048]
    - [18, 250.96]
  - - [2048, 1024, 1, 4096, 2048, 2048, 2048, 4096]
    - [20, 309.13]
  - - [2048, 1024, 1, 8192, 2048, 2048, 2048, 8192]
    - [20, 331.3]
  - - [2048, 2048, 1, 128, 2048, 2048, 2048, 128]
    - [16, 59.89]
  - - [2048, 2048, 1, 256, 2048, 2048, 2048, 256]
    - [15, 106.46]
  - - [2048, 2048, 1, 512, 2048, 2048, 2048, 512]
    - [17, 180.83]
  - - [2048, 2048, 1, 1024, 2048, 2048, 2048, 1024]
    - [17, 276.9]
  - - [2048, 2048, 1, 2048, 2048, 2048, 2048, 2048]
    - [17, 372.61]
  - - [2048, 2048, 1, 4096, 2048, 2048, 2048, 4096]
    - [17, 445.93]
  - - [2048, 2048, 1, 8192, 2048, 2048, 2048, 8192]
    - [38, 456.81]
  - - [2048, 4096, 1, 128, 2048, 2048, 2048, 128]
    - [12, 76.96]
  - - [2048, 4096, 1, 256, 2048, 2048, 2048, 256]
    - [9, 135.75]
  - - [2048, 4096, 1, 512, 2048, 2048, 2048, 512]
    - [13, 230.83]
  - - [2048, 4096, 1, 1024, 2048, 2048, 2048, 1024]
    - [13, 356.57]
  - - [2048, 4096, 1, 2048, 2048, 2048, 2048, 2048]
    - [36, 455.0]
  - - [2048, 4096, 1, 4096, 2048, 2048, 2048, 4096]
    - [35, 539.13]
  - - [2048, 4096, 1, 8192, 2048, 2048, 2048, 8192]
    - [35, 561.0]
  - - [2048, 8192, 1, 128, 2048, 2048, 2048, 128]
    - [9, 89.12]
  - - [2048, 8192, 1, 256, 2048, 2048, 2048, 256]
    - [11, 156.77]
  - - [2048, 8192, 1, 512, 2048, 2048, 2048, 512]
    - [14, 255.81]
  - - [2048, 8192, 1, 1024, 2048, 2048, 2048, 1024]
    - [33, 389.93]
  - - [2048, 8192, 1, 2048, 2048, 2048, 2048, 2048]
    - [33, 552.55]
  - - [2048, 8192, 1, 4096, 2048, 2048, 2048, 4096]
    - [34, 686.24]
  - - [2048, 8192, 1, 8192, 2048, 2048, 2048, 8192]
    - [34, 732.07]
  - - [4096, 128, 1, 128, 4096, 4096, 4096, 128]
    - [29, 11.98]
  - - [4096, 128, 1, 256, 4096, 4096, 4096, 256]
    - [29, 21.29]
  - - [4096, 128, 1, 512, 4096, 4096, 4096, 512]
    - [28, 36.1]
  - - [4096, 128, 1, 1024, 4096, 4096, 4096, 1024]
    - [43, 56.49]
  - - [4096, 128, 1, 2048, 4096, 4096, 4096, 2048]
    - [43, 81.16]
  - - [4096, 128, 1, 4096, 4096, 4096, 4096, 4096]
    - [43, 103.94]
  - - [4096, 128, 1, 8192, 4096, 4096, 4096, 8192]
    - [43, 111.89]
  - - [4096, 256, 1, 128, 4096, 4096, 4096, 128]
    - [25, 22.4]
  - - [4096, 256, 1, 256, 4096, 4096, 4096, 256]
    - [25, 39.96]
  - - [4096, 256, 1, 512, 4096, 4096, 4096, 512]
    - [25, 68.12]
  - - [4096, 256, 1, 1024, 4096, 4096, 4096, 1024]
    - [25, 103.52]
  - - [4096, 256, 1, 2048, 4096, 4096, 4096, 2048]
    - [25, 142.72]
  - - [4096, 256, 1, 4096, 4096, 4096, 4096, 4096]
    - [27, 178.27]
  - - [4096, 256, 1, 8192, 4096, 4096, 4096, 8192]
    - [27, 187.84]
  - - [4096, 512, 1, 128, 4096, 4096, 4096, 128]
    - [18, 38.2]
  - - [4096, 512, 1, 256, 4096, 4096, 4096, 256]
    - [18, 68.15]
  - - [4096, 512, 1, 512, 4096, 4096, 4096, 512]
    - [18, 117.85]
  - - [4096, 512, 1, 1024, 4096, 4096, 4096, 1024]
    - [18, 181.36]
  - - [4096, 512, 1, 2048, 4096, 4096, 4096, 2048]
    - [18, 250.63]
  - - [4096, 512, 1, 4096, 4096, 4096, 4096, 4096]
    - [18, 304.97]
  - - [4096, 512, 1, 8192, 4096, 4096, 4096, 8192]
    - [18, 331.66]
  - - [4096, 1024, 1, 128, 4096, 4096, 4096, 128]
    - [15, 59.95]
  - - [4096, 1024, 1, 256, 4096, 4096, 4096, 256]
    - [15, 107.09]
  - - [4096, 1024, 1, 512, 4096, 4096, 4096, 512]
    - [17, 181.38]
  - - [4096, 1024, 1, 1024, 4096, 4096, 4096, 1024]
    - [15, 272.58]
  - - [4096, 1024, 1, 2048, 4096, 4096, 4096, 2048]
    - [17, 372.43]
  - - [4096, 1024, 1, 4096, 4096, 4096, 4096, 4096]
    - [17, 446.14]
  - - [4096, 1024, 1, 8192, 4096, 4096, 4096, 8192]
    - [17, 451.93]
  - - [4096, 2048, 1, 128, 4096, 4096, 4096, 128]
    - [6, 76.47]
  - - [4096, 2048, 1, 256, 4096, 4096, 4096, 256]
    - [8, 135.57]
  - - [4096, 2048, 1, 512, 4096, 4096, 4096, 512]
    - [13, 227.05]
  - - [4096, 2048, 1, 1024, 4096, 4096, 4096, 1024]
    - [13, 347.36]
  - - [4096, 2048, 1, 2048, 4096, 4096, 4096, 2048]
    - [36, 459.98]
  - - [4096, 2048, 1, 4096, 4096, 4096, 4096, 4096]
    - [35, 522.3]
  - - [4096, 2048, 1, 8192, 4096, 4096, 4096, 8192]
    - [35, 529.53]
  - - [4096, 4096, 1, 128, 4096, 4096, 4096, 128]
    - [4, 94.65]
  - - [4096, 4096, 1, 256, 4096, 4096, 4096, 256]
    - [33, 166.65]
  - - [4096, 4096, 1, 512, 4096, 4096, 4096, 512]
    - [14, 255.67]
  - - [4096, 4096, 1, 1024, 4096, 4096, 4096, 1024]
    - [13, 387.38]
  - - [4096, 4096, 1, 2048, 4096, 4096, 4096, 2048]
    - [33, 577.59]
  - - [4096, 4096, 1, 4096, 4096, 4096, 4096, 4096]
    - [34, 693.09]
  - - [4096, 4096, 1, 8192, 4096, 4096, 4096, 8192]
    - [34, 696.96]
  - - [4096, 8192, 1, 128, 4096, 4096, 4096, 128]
    - [4, 108.4]
  - - [4096, 8192, 1, 256, 4096, 4096, 4096, 256]
    - [6, 179.1]
  - - [4096, 8192, 1, 512, 4096, 4096, 4096, 512]
    - [4, 293.04]
  - - [4096, 8192, 1, 1024, 4096, 4096, 4096, 1024]
    - [4, 457.79]
  - - [4096, 8192, 1, 2048, 4096, 4096, 4096, 2048]
    - [34, 595.39]
  - - [4096, 8192, 1, 4096, 4096, 4096, 4096, 4096]
    - [34, 682.94]
  - - [4096, 8192, 1, 8192, 4096, 4096, 4096, 8192]
    - [34, 709.09]
  - - [8192, 128, 1, 128, 8192, 8192, 8192, 128]
    - [25, 22.21]
  - - [8192, 128, 1, 256, 8192, 8192, 8192, 256]
    - [26, 39.05]
  - - [8192, 128, 1, 512, 8192, 8192, 8192, 512]
    - [25, 66.32]
  - - [8192, 128, 1, 1024, 8192, 8192, 8192, 1024]
    - [26, 102.19]
  - - [8192, 128, 1, 2048, 8192, 8192, 8192, 2048]
    - [26, 141.47]
  - - [8192, 128, 1, 4096, 8192, 8192, 8192, 4096]
    - [24, 166.22]
  - - [8192, 128, 1, 8192, 8192, 8192, 8192, 8192]
    - [24, 188.12]
  - - [8192, 256, 1, 128, 8192, 8192, 8192, 128]
    - [18, 37.9]
  - - [8192, 256, 1, 256, 8192, 8192, 8192, 256]
    - [18, 67.83]
  - - [8192, 256, 1, 512, 8192, 8192, 8192, 512]
    - [18, 117.06]
  - - [8192, 256, 1, 1024, 8192, 8192, 8192, 1024]
    - [19, 180.27]
  - - [8192, 256, 1, 2048, 8192, 8192, 8192, 2048]
    - [18, 250.31]
  - - [8192, 256, 1, 4096, 8192, 8192, 8192, 4096]
    - [20, 295.61]
  - - [8192, 256, 1, 8192, 8192, 8192, 8192, 8192]
    - [18, 334.76]
  - - [8192, 512, 1, 128, 8192, 8192, 8192, 128]
    - [15, 59.63]
  - - [8192, 512, 1, 256, 8192, 8192, 8192, 256]
    - [15, 106.45]
  - - [8192, 512, 1, 512, 8192, 8192, 8192, 512]
    - [17, 179.37]
  - - [8192, 512, 1, 1024, 8192, 8192, 8192, 1024]
    - [16, 262.11]
  - - [8192, 512, 1, 2048, 8192, 8192, 8192, 2048]
    - [15, 351.56]
  - - [8192, 512, 1, 4096, 8192, 8192, 8192, 4096]
    - [17, 434.63]
  - - [8192, 512, 1, 8192, 8192, 8192, 8192, 8192]
    - [17, 459.95]
  - - [8192, 1024, 1, 128, 8192, 8192, 8192, 128]
    - [7, 75.81]
  - - [8192, 1024, 1, 256, 8192, 8192, 8192, 256]
    - [5, 134.67]
  - - [8192, 1024, 1, 512, 8192, 8192, 8192, 512]
    - [14, 226.63]
  - - [8192, 1024, 1, 1024, 8192, 8192, 8192, 1024]
    - [13, 344.69]
  - - [8192, 1024, 1, 2048, 8192, 8192, 8192, 2048]
    - [36, 458.77]
  - - [8192, 1024, 1, 4096, 8192, 8192, 8192, 4096]
    - [37, 519.35]
  - - [8192, 1024, 1, 8192, 8192, 8192, 8192, 8192]
    - [37, 522.89]
  - - [8192, 2048, 1, 128, 8192, 8192, 8192, 128]
    - [3, 96.6]
  - - [8192, 2048, 1, 256, 8192, 8192, 8192, 256]
    - [10, 157.01]
  - - [8192, 2048, 1, 512, 8192, 8192, 8192, 512]
    - [14, 259.12]
  - - [8192, 2048, 1, 1024, 8192, 8192, 8192, 1024]
    - [1, 393.16]
  - - [8192, 2048, 1, 2048, 8192, 8192, 8192, 2048]
    - [33, 584.67]
  - - [8192, 2048, 1, 4096, 8192, 8192, 8192, 4096]
    - [34, 705.55]
  - - [8192, 2048, 1, 8192, 8192, 8192, 8192, 8192]
    - [34, 689.47]
  - - [8192, 4096, 1, 128, 8192, 8192, 8192, 128]
    - [1, 107.63]
  - - [8192, 4096, 1, 256, 8192, 8192, 8192, 256]
    - [34, 182.66]
  - - [8192, 4096, 1, 512, 8192, 8192, 8192, 512]
    - [1, 293.22]
  - - [8192, 4096, 1, 1024, 8192, 8192, 8192, 1024]
    - [2, 453.36]
  - - [8192, 4096, 1, 2048, 8192, 8192, 8192, 2048]
    - [34, 609.31]
  - - [8192, 4096, 1, 4096, 8192, 8192, 8192, 4096]
    - [34, 654.4]
  - - [8192, 4096, 1, 8192, 8192, 8192, 8192, 8192]
    - [34, 721.11]
  - - [8192, 8192, 1, 128, 8192, 8192, 8192, 128]
    - [4, 115.89]
  - - [8192, 8192, 1, 256, 8192, 8192, 8192, 256]
    - [0, 199.3]
  - - [8192, 8192, 1, 512, 8192, 8192, 8192, 512]
    - [34, 334.59]
  - - [8192, 8192, 1, 1024, 8192, 8192, 8192, 1024]
    - [34, 471.96]
  - - [8192, 8192, 1, 2048, 8192, 8192, 8192, 2048]
    - [34, 579.88]
  - - [8192, 8192, 1, 4096, 8192, 8192, 8192, 4096]
    - [34, 661.99]
  - - [8192, 8192, 1, 8192, 8192, 8192, 8192, 8192]
    - [34, 784.15]
  - - [1, 1, 1, 32, 1, 1, 1, 32]
    - [48, 0.0]
- null
- null
- DeviceEfficiency
- GridBased
