projects/hipblaslt/library/src/amd_detail/rocblaslt/src/Tensile/Logic/asm_full/gfx950/GridBased/gfx950_Cijk_Alik_Bljk_BSS_BH_Bias_HAS_SAV_UserArgs.yaml
- {MinimumRequiredVersion: 4.33.0}
- gfx950
- gfx950
- [Device 75a0]
    SolutionIndex: 0
    SolutionNameMin: Cijk_Alik_Bljk_BSS_BH_Bias_HAS_SAV_UserArgs_MT128x256x32_MI16x16x1_SN_LDSB1_CLR0_GSU0_GSUC0_GSUWGMRR0_K1_LBSPPA256_LBSPPB512_MIWT4_8_PLR0_SU0_SUM0_SUS0_VWA4_VWB8_WGM1_WGMXCC1_WGMXCCGn1
    SolutionIndex: 1
    SolutionNameMin: Cijk_Alik_Bljk_BSS_BH_Bias_HAS_SAV_UserArgs_MT128x256x32_MI16x16x1_SN_LDSB1_CLR0_GSU0_GSUC0_GSUWGMRR0_K1_LBSPPA256_LBSPPB512_MIWT4_8_PLR0_SU0_SUM0_SUS0_VWA4_VWB8_WGM1_WGMXCC1_WGMXCCGn1
    SolutionIndex: 2
    SolutionNameMin: Cijk_Alik_Bljk_BSS_BH_Bias_HAS_SAV_UserArgs_MT128x256x32_MI16x16x1_SN_LDSB1_CLR0_GSU0_GSUC0_GSUWGMRR0_K1_LBSPPA256_LBSPPB512_MIWT4_8_PLR0_SU0_SUM0_SUS0_VWA4_VWB8_WGM1_WGMXCC1_WGMXCCGn1
    SolutionIndex: 3
    SolutionNameMin: Cijk_Alik_Bljk_BSS_BH_Bias_HAS_SAV_UserArgs_MT128x256x32_MI16x16x1_SN_LDSB1_CLR0_GSU0_GSUC0_GSUWGMRR0_K1_LBSPPA256_LBSPPB512_MIWT4_8_PLR0_SU0_SUM0_SUS0_VWA4_VWB8_WGM6_WGMXCC1_WGMXCCGn1
    SolutionIndex: 4
    SolutionNameMin: Cijk_Alik_Bljk_BSS_BH_Bias_HAS_SAV_UserArgs_MT128x256x32_MI16x16x1_SN_LDSB1_CLR0_GSU0_GSUC0_GSUWGMRR0_K1_LBSPPA256_LBSPPB512_MIWT4_8_PLR0_SU0_SUM0_SUS0_VWA4_VWB8_WGM6_WGMXCC1_WGMXCCGn1
    SolutionIndex: 5
    SolutionNameMin: Cijk_Alik_Bljk_BSS_BH_Bias_HAS_SAV_UserArgs_MT128x256x32_MI16x16x1_SN_LDSB1_CLR0_GSU0_GSUC0_GSUWGMRR0_K1_LBSPPA256_LBSPPB512_MIWT4_8_PLR0_SU0_SUM0_SUS0_VWA4_VWB8_WGM6_WGMXCC1_WGMXCCGn1
    SolutionIndex: 6
    SolutionNameMin: Cijk_Alik_Bljk_BSS_BH_Bias_HAS_SAV_UserArgs_MT128x256x32_MI16x16x1_SN_LDSB1_CLR0_GSU0_GSUC0_GSUWGMRR0_K1_LBSPPA256_LBSPPB512_MIWT4_8_PLR0_SU0_SUM0_SUS0_VWA4_VWB8_WGM8_WGMXCC1_WGMXCCGn1
    SolutionIndex: 7
    SolutionNameMin: Cijk_Alik_Bljk_BSS_BH_Bias_HAS_SAV_UserArgs_MT256x256x32_MI32x32x1_SN_LDSB0_CLR1_GSU0_GSUC0_GSUWGMRR0_K1_LBSPPA256_LBSPPB256_MIWT4_4_PLR1_SU0_SUM0_SUS0_VWA4_VWB4_WGM1_WGMXCC1_WGMXCCGn1
    SolutionIndex: 8
    SolutionNameMin: Cijk_Alik_Bljk_BSS_BH_Bias_HAS_SAV_UserArgs_MT256x256x32_MI32x32x1_SN_LDSB0_CLR1_GSU0_GSUC0_GSUWGMRR0_K1_LBSPPA256_LBSPPB256_MIWT4_4_PLR1_SU0_SUM0_SUS0_VWA4_VWB4_WGM1_WGMXCC1_WGMXCCGn1
    SolutionIndex: 9
    SolutionNameMin: Cijk_Alik_Bljk_BSS_BH_Bias_HAS_SAV_UserArgs_MT256x256x32_MI32x32x1_SN_LDSB0_CLR1_GSU0_GSUC0_GSUWGMRR0_K1_LBSPPA256_LBSPPB256_MIWT4_4_PLR1_SU0_SUM0_SUS0_VWA4_VWB4_WGM1_WGMXCC1_WGMXCCGn1
    SolutionIndex: 10
    SolutionNameMin: Cijk_Alik_Bljk_BSS_BH_Bias_HAS_SAV_UserArgs_MT256x256x32_MI32x32x1_SN_LDSB0_CLR1_GSU0_GSUC0_GSUWGMRR0_K1_LBSPPA256_LBSPPB256_MIWT4_4_PLR1_SU0_SUM0_SUS0_VWA4_VWB4_WGM1_WGMXCC1_WGMXCCGn1
    SolutionIndex: 11
    SolutionNameMin: Cijk_Alik_Bljk_BSS_BH_Bias_HAS_SAV_UserArgs_MT256x256x32_MI32x32x1_SN_LDSB0_CLR1_GSU0_GSUC0_GSUWGMRR0_K1_LBSPPA256_LBSPPB256_MIWT4_4_PLR1_SU0_SUM0_SUS0_VWA4_VWB4_WGM6_WGMXCC1_WGMXCCGn1
    SolutionIndex: 12
    SolutionNameMin: Cijk_Alik_Bljk_BSS_BH_Bias_HAS_SAV_UserArgs_MT256x256x32_MI32x32x1_SN_LDSB0_CLR1_GSU0_GSUC0_GSUWGMRR0_K1_LBSPPA256_LBSPPB256_MIWT4_4_PLR1_SU0_SUM0_SUS0_VWA4_VWB4_WGM6_WGMXCC1_WGMXCCGn1
    SolutionIndex: 13
    SolutionNameMin: Cijk_Alik_Bljk_BSS_BH_Bias_HAS_SAV_UserArgs_MT256x256x32_MI32x32x1_SN_LDSB0_CLR1_GSU0_GSUC0_GSUWGMRR0_K1_LBSPPA256_LBSPPB256_MIWT4_4_PLR1_SU0_SUM0_SUS0_VWA4_VWB4_WGM8_WGMXCC1_WGMXCCGn1
    SolutionIndex: 14
    SolutionNameMin: Cijk_Alik_Bljk_BSS_BH_Bias_HAS_SAV_UserArgs_MT256x128x32_MI32x32x1_SN_LDSB1_CLR1_GSU0_GSUC0_GSUWGMRR0_K1_LBSPPA256_LBSPPB128_MIWT4_2_PLR1_SU0_SUM0_SUS0_VWA4_VWB2_WGM1_WGMXCC1_WGMXCCGn1
    SolutionIndex: 15
    SolutionNameMin: Cijk_Alik_Bljk_BSS_BH_Bias_HAS_SAV_UserArgs_MT256x128x32_MI32x32x1_SN_LDSB1_CLR1_GSU0_GSUC0_GSUWGMRR0_K1_LBSPPA256_LBSPPB128_MIWT4_2_PLR1_SU0_SUM0_SUS0_VWA4_VWB2_WGM6_WGMXCC1_WGMXCCGn1
    SolutionIndex: 16
    SolutionNameMin: Cijk_Alik_Bljk_BSS_BH_Bias_HAS_SAV_UserArgs_MT256x128x32_MI32x32x1_SN_LDSB1_CLR1_GSU0_GSUC0_GSUWGMRR0_K1_LBSPPA256_LBSPPB128_MIWT4_2_PLR1_SU0_SUM0_SUS0_VWA4_VWB2_WGM6_WGMXCC1_WGMXCCGn1
    SolutionIndex: 17
    SolutionNameMin: Cijk_Alik_Bljk_BSS_BH_Bias_HAS_SAV_UserArgs_MT256x128x32_MI32x32x1_SN_LDSB1_CLR1_GSU0_GSUC0_GSUWGMRR0_K1_LBSPPA256_LBSPPB128_MIWT4_2_PLR1_SU0_SUM0_SUS0_VWA4_VWB2_WGM8_WGMXCC1_WGMXCCGn1
    SolutionIndex: 18
    SolutionNameMin: Cijk_Alik_Bljk_BSS_BH_Bias_HAS_SAV_UserArgs_MT256x256x64_MI16x16x1_SN_LDSB1_CLR1_GSU0_GSUC0_GSUWGMRR0_K1_LBSPPA1024_LBSPPB1024_MIWT8_8_PLR1_SU0_SUM0_SUS0_VWA8_VWB8_WGM1_WGMXCC1_WGMXCCGn1
    SolutionIndex: 19
    SolutionNameMin: Cijk_Alik_Bljk_BSS_BH_Bias_HAS_SAV_UserArgs_MT256x256x64_MI16x16x1_SN_LDSB1_CLR1_GSU0_GSUC0_GSUWGMRR0_K1_LBSPPA1024_LBSPPB1024_MIWT8_8_PLR1_SU0_SUM0_SUS0_VWA8_VWB8_WGM6_WGMXCC1_WGMXCCGn1
    SolutionIndex: 20
    SolutionNameMin: Cijk_Alik_Bljk_BSS_BH_Bias_HAS_SAV_UserArgs_MT256x256x64_MI16x16x1_SN_LDSB1_CLR1_GSU0_GSUC0_GSUWGMRR0_K1_LBSPPA1024_LBSPPB1024_MIWT8_8_PLR1_SU0_SUM0_SUS0_VWA8_VWB8_WGM6_WGMXCC1_WGMXCCGn1
    SolutionIndex: 21
    SolutionNameMin: Cijk_Alik_Bljk_BSS_BH_Bias_HAS_SAV_UserArgs_MT256x256x64_MI16x16x1_SN_LDSB1_CLR1_GSU0_GSUC0_GSUWGMRR0_K1_LBSPPA1024_LBSPPB1024_MIWT8_8_PLR1_SU0_SUM0_SUS0_VWA8_VWB8_WGM8_WGMXCC1_WGMXCCGn1
    SolutionIndex: 22
    SolutionNameMin: Cijk_Alik_Bljk_BSS_BH_Bias_HAS_SAV_UserArgs_MT256x256x64_MI16x16x1_SN_LDSB1_CLR1_GSU0_GSUC0_GSUWGMRR0_K1_LBSPPA1024_LBSPPB1024_MIWT8_8_PLR1_SU0_SUM0_SUS0_VWA8_VWB8_WGM8_WGMXCC1_WGMXCCGn1
    SolutionIndex: 23
    SolutionNameMin: Cijk_Alik_Bljk_BSS_BH_Bias_HAS_SAV_UserArgs_MT128x256x64_MI16x16x1_SN_LDSB1_CLR1_GSU0_GSUC0_GSUWGMRR0_K1_LBSPPA512_LBSPPB1024_MIWT4_8_PLR1_SU0_SUM0_SUS0_VWA4_VWB8_WGM1_WGMXCC1_WGMXCCGn1
    SolutionIndex: 24
    SolutionNameMin: Cijk_Alik_Bljk_BSS_BH_Bias_HAS_SAV_UserArgs_MT128x256x64_MI16x16x1_SN_LDSB1_CLR1_GSU0_GSUC0_GSUWGMRR0_K1_LBSPPA512_LBSPPB1024_MIWT4_8_PLR1_SU0_SUM0_SUS0_VWA4_VWB8_WGM1_WGMXCC1_WGMXCCGn1
    SolutionIndex: 25
    SolutionNameMin: Cijk_Alik_Bljk_BSS_BH_Bias_HAS_SAV_UserArgs_MT128x256x64_MI16x16x1_SN_LDSB1_CLR1_GSU0_GSUC0_GSUWGMRR0_K1_LBSPPA512_LBSPPB1024_MIWT4_8_PLR1_SU0_SUM0_SUS0_VWA4_VWB8_WGM1_WGMXCC1_WGMXCCGn1
    SolutionIndex: 26
    SolutionNameMin: Cijk_Alik_Bljk_BSS_BH_Bias_HAS_SAV_UserArgs_MT128x256x64_MI16x16x1_SN_LDSB1_CLR1_GSU0_GSUC0_GSUWGMRR0_K1_LBSPPA512_LBSPPB1024_MIWT4_8_PLR1_SU0_SUM0_SUS0_VWA4_VWB8_WGM1_WGMXCC1_WGMXCCGn1
    SolutionIndex: 27
    SolutionNameMin: Cijk_Alik_Bljk_BSS_BH_Bias_HAS_SAV_UserArgs_MT128x256x64_MI16x16x1_SN_LDSB1_CLR1_GSU0_GSUC0_GSUWGMRR0_K1_LBSPPA512_LBSPPB1024_MIWT4_8_PLR1_SU0_SUM0_SUS0_VWA4_VWB8_WGM6_WGMXCC1_WGMXCCGn1
    SolutionIndex: 28
    SolutionNameMin: Cijk_Alik_Bljk_BSS_BH_Bias_HAS_SAV_UserArgs_MT128x256x64_MI16x16x1_SN_LDSB1_CLR1_GSU0_GSUC0_GSUWGMRR0_K1_LBSPPA512_LBSPPB1024_MIWT4_8_PLR1_SU0_SUM0_SUS0_VWA4_VWB8_WGM6_WGMXCC1_WGMXCCGn1
    SolutionIndex: 29
    SolutionNameMin: Cijk_Alik_Bljk_BSS_BH_Bias_HAS_SAV_UserArgs_MT128x256x64_MI16x16x1_SN_LDSB1_CLR1_GSU0_GSUC0_GSUWGMRR0_K1_LBSPPA512_LBSPPB1024_MIWT4_8_PLR1_SU0_SUM0_SUS0_VWA4_VWB8_WGM6_WGMXCC1_WGMXCCGn1
    SolutionIndex: 30
    SolutionNameMin: Cijk_Alik_Bljk_BSS_BH_Bias_HAS_SAV_UserArgs_MT128x256x64_MI16x16x1_SN_LDSB1_CLR1_GSU0_GSUC0_GSUWGMRR0_K1_LBSPPA512_LBSPPB1024_MIWT4_8_PLR1_SU0_SUM0_SUS0_VWA4_VWB8_WGM6_WGMXCC1_WGMXCCGn1
    SolutionIndex: 31
    SolutionNameMin: Cijk_Alik_Bljk_BSS_BH_Bias_HAS_SAV_UserArgs_MT128x256x64_MI16x16x1_SN_LDSB1_CLR1_GSU0_GSUC0_GSUWGMRR0_K1_LBSPPA512_LBSPPB1024_MIWT4_8_PLR1_SU0_SUM0_SUS0_VWA4_VWB8_WGM8_WGMXCC1_WGMXCCGn1
    SolutionIndex: 32
    SolutionNameMin: Cijk_Alik_Bljk_BSS_BH_Bias_HAS_SAV_UserArgs_MT128x256x64_MI16x16x1_SN_LDSB1_CLR1_GSU0_GSUC0_GSUWGMRR0_K1_LBSPPA512_LBSPPB1024_MIWT4_8_PLR1_SU0_SUM0_SUS0_VWA4_VWB8_WGM8_WGMXCC1_WGMXCCGn1
    SolutionIndex: 33
    SolutionNameMin: Cijk_Alik_Bljk_BSS_BH_Bias_HAS_SAV_UserArgs_MT256x128x64_MI16x16x1_SN_LDSB1_CLR1_GSU0_GSUC0_GSUWGMRR0_K1_LBSPPA1024_LBSPPB512_MIWT8_4_PLR1_SU0_SUM0_SUS0_VWA8_VWB4_WGM1_WGMXCC1_WGMXCCGn1
    SolutionIndex: 34
    SolutionNameMin: Cijk_Alik_Bljk_BSS_BH_Bias_HAS_SAV_UserArgs_MT256x128x64_MI16x16x1_SN_LDSB1_CLR1_GSU0_GSUC0_GSUWGMRR0_K1_LBSPPA1024_LBSPPB512_MIWT8_4_PLR1_SU0_SUM0_SUS0_VWA8_VWB4_WGM8_WGMXCC1_WGMXCCGn1
    SolutionIndex: 35
    SolutionNameMin: Cijk_Alik_Bljk_BSS_BH_Bias_HAS_SAV_UserArgs_MT128x128x64_MI16x16x1_SN_LDSB1_CLR1_GSU0_GSUC0_GSUWGMRR0_K1_LBSPPA512_LBSPPB512_MIWT4_4_PLR1_SU0_SUM0_SUS0_VWA4_VWB4_WGM1_WGMXCC1_WGMXCCGn1
    SolutionIndex: 36
    SolutionNameMin: Cijk_Alik_Bljk_BSS_BH_Bias_HAS_SAV_UserArgs_MT128x128x64_MI16x16x1_SN_LDSB1_CLR1_GSU0_GSUC0_GSUWGMRR0_K1_LBSPPA512_LBSPPB512_MIWT4_4_PLR1_SU0_SUM0_SUS0_VWA4_VWB4_WGM1_WGMXCC1_WGMXCCGn1
    SolutionIndex: 37
    SolutionNameMin: Cijk_Alik_Bljk_BSS_BH_Bias_HAS_SAV_UserArgs_MT128x128x64_MI16x16x1_SN_LDSB1_CLR1_GSU0_GSUC0_GSUWGMRR0_K1_LBSPPA512_LBSPPB512_MIWT4_4_PLR1_SU0_SUM0_SUS0_VWA4_VWB4_WGM1_WGMXCC1_WGMXCCGn1
    SolutionIndex: 38
    SolutionNameMin: Cijk_Alik_Bljk_BSS_BH_Bias_HAS_SAV_UserArgs_MT128x128x64_MI16x16x1_SN_LDSB1_CLR1_GSU0_GSUC0_GSUWGMRR0_K1_LBSPPA512_LBSPPB512_MIWT4_4_PLR1_SU0_SUM0_SUS0_VWA4_VWB4_WGM1_WGMXCC1_WGMXCCGn1
    SolutionIndex: 39
    SolutionNameMin: Cijk_Alik_Bljk_BSS_BH_Bias_HAS_SAV_UserArgs_MT128x128x64_MI16x16x1_SN_LDSB1_CLR1_GSU0_GSUC0_GSUWGMRR0_K1_LBSPPA512_LBSPPB512_MIWT4_4_PLR1_SU0_SUM0_SUS0_VWA4_VWB4_WGM1_WGMXCC1_WGMXCCGn1
    SolutionIndex: 40
    SolutionNameMin: Cijk_Alik_Bljk_BSS_BH_Bias_HAS_SAV_UserArgs_MT128x128x64_MI16x16x1_SN_LDSB1_CLR1_GSU0_GSUC0_GSUWGMRR0_K1_LBSPPA512_LBSPPB512_MIWT4_4_PLR1_SU0_SUM0_SUS0_VWA4_VWB4_WGM6_WGMXCC1_WGMXCCGn1
    SolutionIndex: 41
    SolutionNameMin: Cijk_Alik_Bljk_BSS_BH_Bias_HAS_SAV_UserArgs_MT128x128x64_MI16x16x1_SN_LDSB1_CLR1_GSU0_GSUC0_GSUWGMRR0_K1_LBSPPA512_LBSPPB512_MIWT4_4_PLR1_SU0_SUM0_SUS0_VWA4_VWB4_WGM6_WGMXCC1_WGMXCCGn1
    SolutionIndex: 42
    SolutionNameMin: Cijk_Alik_Bljk_BSS_BH_Bias_HAS_SAV_UserArgs_MT128x128x64_MI16x16x1_SN_LDSB1_CLR1_GSU0_GSUC0_GSUWGMRR0_K1_LBSPPA512_LBSPPB512_MIWT4_4_PLR1_SU0_SUM0_SUS0_VWA4_VWB4_WGM6_WGMXCC1_WGMXCCGn1
    SolutionIndex: 43
    SolutionNameMin: Cijk_Alik_Bljk_BSS_BH_Bias_HAS_SAV_UserArgs_MT128x128x64_MI16x16x1_SN_LDSB1_CLR1_GSU0_GSUC0_GSUWGMRR0_K1_LBSPPA512_LBSPPB512_MIWT4_4_PLR1_SU0_SUM0_SUS0_VWA4_VWB4_WGM6_WGMXCC1_WGMXCCGn1
    SolutionIndex: 44
    SolutionNameMin: Cijk_Alik_Bljk_BSS_BH_Bias_HAS_SAV_UserArgs_MT128x128x64_MI16x16x1_SN_LDSB1_CLR1_GSU0_GSUC0_GSUWGMRR0_K1_LBSPPA512_LBSPPB512_MIWT4_4_PLR1_SU0_SUM0_SUS0_VWA4_VWB4_WGM6_WGMXCC1_WGMXCCGn1
    SolutionIndex: 45
    SolutionNameMin: Cijk_Alik_Bljk_BSS_BH_Bias_HAS_SAV_UserArgs_MT128x128x64_MI16x16x1_SN_LDSB1_CLR1_GSU0_GSUC0_GSUWGMRR0_K1_LBSPPA512_LBSPPB512_MIWT4_4_PLR1_SU0_SUM0_SUS0_VWA4_VWB4_WGM8_WGMXCC1_WGMXCCGn1
    SolutionIndex: 46
    SolutionNameMin: Cijk_Alik_Bljk_BSS_BH_Bias_HAS_SAV_UserArgs_MT128x128x64_MI16x16x1_SN_LDSB1_CLR1_GSU0_GSUC0_GSUWGMRR0_K1_LBSPPA512_LBSPPB512_MIWT4_4_PLR1_SU0_SUM0_SUS0_VWA4_VWB4_WGM8_WGMXCC1_WGMXCCGn1
    SolutionIndex: 47
    SolutionNameMin: Cijk_Alik_Bljk_BSS_BH_Bias_HAS_SAV_UserArgs_MT128x128x64_MI16x16x1_SN_LDSB1_CLR1_GSU0_GSUC0_GSUWGMRR0_K1_LBSPPA512_LBSPPB512_MIWT4_4_PLR1_SU0_SUM0_SUS0_VWA4_VWB4_WGM8_WGMXCC1_WGMXCCGn1
    SolutionIndex: 48
    SolutionNameMin: Cijk_Alik_Bljk_BSS_BH_Bias_HAS_SAV_UserArgs_MT128x128x64_MI16x16x1_SN_LDSB1_CLR1_GSU0_GSUC0_GSUWGMRR0_K1_LBSPPA512_LBSPPB512_MIWT4_4_PLR1_SU0_SUM0_SUS0_VWA4_VWB4_WGM8_WGMXCC1_WGMXCCGn1
    SolutionIndex: 49
    SolutionNameMin: Cijk_Alik_Bljk_BSS_BH_Bias_HAS_SAV_UserArgs_MT128x128x64_MI16x16x1_SN_LDSB1_CLR1_GSU0_GSUC0_GSUWGMRR0_K1_LBSPPA512_LBSPPB512_MIWT4_4_PLR1_SU0_SUM0_SUS0_VWA4_VWB4_WGM8_WGMXCC1_WGMXCCGn1
    SolutionIndex: 50
    SolutionNameMin: Cijk_Alik_Bljk_BSS_BH_Bias_HAS_SAV_UserArgs_MT64x128x64_MI16x16x1_SN_LDSB1_CLR1_GSU0_GSUC0_GSUWGMRR0_K1_LBSPPA256_LBSPPB512_MIWT2_4_PLR1_SU0_SUM0_SUS0_VWA2_VWB4_WGM1_WGMXCC1_WGMXCCGn1
    SolutionIndex: 51
    SolutionNameMin: Cijk_Alik_Bljk_BSS_BH_Bias_HAS_SAV_UserArgs_MT64x128x64_MI16x16x1_SN_LDSB1_CLR1_GSU0_GSUC0_GSUWGMRR0_K1_LBSPPA256_LBSPPB512_MIWT2_4_PLR1_SU0_SUM0_SUS0_VWA2_VWB4_WGM6_WGMXCC1_WGMXCCGn1
    SolutionIndex: 52
    SolutionNameMin: Cijk_Alik_Bljk_BSS_BH_Bias_HAS_SAV_UserArgs_MT128x64x64_MI16x16x1_SN_LDSB1_CLR1_GSU0_GSUC0_GSUWGMRR0_K1_LBSPPA512_LBSPPB256_MIWT4_2_PLR1_SU0_SUM0_SUS0_VWA4_VWB2_WGM1_WGMXCC1_WGMXCCGn1
    SolutionIndex: 53
    SolutionNameMin: Cijk_Alik_Bljk_BSS_BH_Bias_HAS_SAV_UserArgs_MT128x64x64_MI16x16x1_SN_LDSB1_CLR1_GSU0_GSUC0_GSUWGMRR0_K1_LBSPPA512_LBSPPB256_MIWT4_2_PLR1_SU0_SUM0_SUS0_VWA4_VWB2_WGM1_WGMXCC1_WGMXCCGn1
    SolutionIndex: 54
    SolutionNameMin: Cijk_Alik_Bljk_BSS_BH_Bias_HAS_SAV_UserArgs_MT128x64x64_MI16x16x1_SN_LDSB1_CLR1_GSU0_GSUC0_GSUWGMRR0_K1_LBSPPA512_LBSPPB256_MIWT4_2_PLR1_SU0_SUM0_SUS0_VWA4_VWB2_WGM6_WGMXCC1_WGMXCCGn1
    SolutionIndex: 55
    SolutionNameMin: Cijk_Alik_Bljk_BSS_BH_Bias_HAS_SAV_UserArgs_MT128x64x64_MI16x16x1_SN_LDSB1_CLR1_GSU0_GSUC0_GSUWGMRR0_K1_LBSPPA512_LBSPPB256_MIWT4_2_PLR1_SU0_SUM0_SUS0_VWA4_VWB2_WGM8_WGMXCC1_WGMXCCGn1
    SolutionIndex: 56
    SolutionNameMin: Cijk_Alik_Bljk_BSS_BH_Bias_HAS_SAV_UserArgs_MT256x256x64_MI32x32x1_SN_LDSB1_CLR1_GSU0_GSUC0_GSUWGMRR0_K1_LBSPPA512_LBSPPB512_MIWT4_4_PLR1_SU0_SUM0_SUS0_VWA4_VWB4_WGM1_WGMXCC1_WGMXCCGn1
    SolutionIndex: 57
    SolutionNameMin: Cijk_Alik_Bljk_BSS_BH_Bias_HAS_SAV_UserArgs_MT256x256x64_MI32x32x1_SN_LDSB1_CLR1_GSU0_GSUC0_GSUWGMRR0_K1_LBSPPA512_LBSPPB512_MIWT4_4_PLR1_SU0_SUM0_SUS0_VWA4_VWB4_WGM1_WGMXCC1_WGMXCCGn1
    SolutionIndex: 58
    SolutionNameMin: Cijk_Alik_Bljk_BSS_BH_Bias_HAS_SAV_UserArgs_MT256x256x64_MI32x32x1_SN_LDSB1_CLR1_GSU0_GSUC0_GSUWGMRR0_K1_LBSPPA512_LBSPPB512_MIWT4_4_PLR1_SU0_SUM0_SUS0_VWA4_VWB4_WGM1_WGMXCC1_WGMXCCGn1
    SolutionIndex: 59
    SolutionNameMin: Cijk_Alik_Bljk_BSS_BH_Bias_HAS_SAV_UserArgs_MT256x256x64_MI32x32x1_SN_LDSB1_CLR1_GSU0_GSUC0_GSUWGMRR0_K1_LBSPPA512_LBSPPB512_MIWT4_4_PLR1_SU0_SUM0_SUS0_VWA4_VWB4_WGM6_WGMXCC1_WGMXCCGn1
    SolutionIndex: 60
    SolutionNameMin: Cijk_Alik_Bljk_BSS_BH_Bias_HAS_SAV_UserArgs_MT256x256x64_MI32x32x1_SN_LDSB1_CLR1_GSU0_GSUC0_GSUWGMRR0_K1_LBSPPA512_LBSPPB512_MIWT4_4_PLR1_SU0_SUM0_SUS0_VWA4_VWB4_WGM8_WGMXCC1_WGMXCCGn1
    SolutionIndex: 61
    SolutionNameMin: Cijk_Alik_Bljk_BSS_BH_Bias_HAS_SAV_UserArgs_MT256x128x64_MI32x32x1_SN_LDSB1_CLR1_GSU0_GSUC0_GSUWGMRR0_K1_LBSPPA512_LBSPPB256_MIWT4_2_PLR1_SU0_SUM0_SUS0_VWA4_VWB2_WGM6_WGMXCC1_WGMXCCGn1
    SolutionIndex: 62
    SolutionNameMin: Cijk_Alik_Bljk_BSS_BH_Bias_HAS_SAV_UserArgs_MT128x128x64_MI32x32x1_SN_LDSB1_CLR1_GSU0_GSUC0_GSUWGMRR0_K1_LBSPPA256_LBSPPB256_MIWT2_2_PLR1_SU0_SUM0_SUS0_VWA2_VWB2_WGM6_WGMXCC1_WGMXCCGn1
    SolutionIndex: 63
    SolutionNameMin: Cijk_Alik_Bljk_BSS_BH_Bias_HAS_SAV_UserArgs_MT128x128x64_MI32x32x1_SN_LDSB1_CLR1_GSU0_GSUC0_GSUWGMRR0_K1_LBSPPA256_LBSPPB256_MIWT2_2_PLR1_SU0_SUM0_SUS0_VWA2_VWB2_WGM8_WGMXCC1_WGMXCCGn1
    SolutionIndex: 64
    SolutionNameMin: Cijk_Alik_Bljk_BSS_BH_Bias_HAS_SAV_UserArgs_MT64x128x64_MI32x32x1_SN_LDSB1_CLR1_GSU0_GSUC0_GSUWGMRR0_K1_LBSPPA128_LBSPPB256_MIWT1_2_PLR1_SU0_SUM0_SUS0_VWA1_VWB2_WGM1_WGMXCC1_WGMXCCGn1
    SolutionIndex: 65
    SolutionNameMin: Cijk_Alik_Bljk_BSS_BH_Bias_HAS_SAV_UserArgs_MT64x128x64_MI32x32x1_SN_LDSB1_CLR1_GSU0_GSUC0_GSUWGMRR0_K1_LBSPPA128_LBSPPB256_MIWT1_2_PLR1_SU0_SUM0_SUS0_VWA1_VWB2_WGM8_WGMXCC1_WGMXCCGn1
    SolutionIndex: 66
    SolutionNameMin: Cijk_Alik_Bljk_BSS_BH_Bias_HAS_SAV_UserArgs_MT128x64x64_MI32x32x1_SN_LDSB1_CLR1_GSU0_GSUC0_GSUWGMRR0_K1_LBSPPA256_LBSPPB128_MIWT2_1_PLR1_SU0_SUM0_SUS0_VWA2_VWB1_WGM1_WGMXCC1_WGMXCCGn1
    SolutionIndex: 67
    SolutionNameMin: Cijk_Alik_Bljk_BSS_BH_Bias_HAS_SAV_UserArgs_MT128x128x128_MI16x16x1_SN_LDSB1_CLR1_GSU0_GSUC0_GSUWGMRR0_K1_LBSPPA1024_LBSPPB1024_MIWT4_4_PLR1_SU0_SUM0_SUS0_VWA4_VWB4_WGM1_WGMXCC1_WGMXCCGn1
    SolutionIndex: 68
    SolutionNameMin: Cijk_Alik_Bljk_BSS_BH_Bias_HAS_SAV_UserArgs_MT128x128x128_MI16x16x1_SN_LDSB1_CLR1_GSU0_GSUC0_GSUWGMRR0_K1_LBSPPA1024_LBSPPB1024_MIWT4_4_PLR1_SU0_SUM0_SUS0_VWA4_VWB4_WGM6_WGMXCC1_WGMXCCGn1
    SolutionIndex: 69
    SolutionNameMin: Cijk_Alik_Bljk_BSS_BH_Bias_HAS_SAV_UserArgs_MT128x128x128_MI16x16x1_SN_LDSB1_CLR1_GSU0_GSUC0_GSUWGMRR0_K1_LBSPPA1024_LBSPPB1024_MIWT4_4_PLR1_SU0_SUM0_SUS0_VWA4_VWB4_WGM8_WGMXCC1_WGMXCCGn1
    SolutionIndex: 70
    SolutionNameMin: Cijk_Alik_Bljk_BSS_BH_Bias_HAS_SAV_UserArgs_MT64x128x128_MI16x16x1_SN_LDSB1_CLR1_GSU0_GSUC0_GSUWGMRR0_K1_LBSPPA512_LBSPPB1024_MIWT2_4_PLR1_SU0_SUM0_SUS0_VWA2_VWB4_WGM1_WGMXCC1_WGMXCCGn1
    SolutionIndex: 71
    SolutionNameMin: Cijk_Alik_Bljk_BSS_BH_Bias_HAS_SAV_UserArgs_MT64x128x128_MI16x16x1_SN_LDSB1_CLR1_GSU0_GSUC0_GSUWGMRR0_K1_LBSPPA512_LBSPPB1024_MIWT2_4_PLR1_SU0_SUM0_SUS0_VWA2_VWB4_WGM6_WGMXCC1_WGMXCCGn1
    SolutionIndex: 72
    SolutionNameMin: Cijk_Alik_Bljk_BSS_BH_Bias_HAS_SAV_UserArgs_MT64x128x128_MI16x16x1_SN_LDSB1_CLR1_GSU0_GSUC0_GSUWGMRR0_K1_LBSPPA512_LBSPPB1024_MIWT2_4_PLR1_SU0_SUM0_SUS0_VWA2_VWB4_WGM8_WGMXCC1_WGMXCCGn1
    SolutionIndex: 73
    SolutionNameMin: Cijk_Alik_Bljk_BSS_BH_Bias_HAS_SAV_UserArgs_MT128x64x128_MI16x16x1_SN_LDSB1_CLR1_GSU0_GSUC0_GSUWGMRR0_K1_LBSPPA1024_LBSPPB512_MIWT4_2_PLR1_SU0_SUM0_SUS0_VWA4_VWB2_WGM1_WGMXCC1_WGMXCCGn1
    SolutionIndex: 74
    SolutionNameMin: Cijk_Alik_Bljk_BSS_BH_Bias_HAS_SAV_UserArgs_MT128x64x128_MI16x16x1_SN_LDSB1_CLR1_GSU0_GSUC0_GSUWGMRR0_K1_LBSPPA1024_LBSPPB512_MIWT4_2_PLR1_SU0_SUM0_SUS0_VWA4_VWB2_WGM1_WGMXCC1_WGMXCCGn1
    SolutionIndex: 75
    SolutionNameMin: Cijk_Alik_Bljk_BSS_BH_Bias_HAS_SAV_UserArgs_MT128x64x128_MI16x16x1_SN_LDSB1_CLR1_GSU0_GSUC0_GSUWGMRR0_K1_LBSPPA1024_LBSPPB512_MIWT4_2_PLR1_SU0_SUM0_SUS0_VWA4_VWB2_WGM1_WGMXCC1_WGMXCCGn1
    SolutionIndex: 76
    SolutionNameMin: Cijk_Alik_Bljk_BSS_BH_Bias_HAS_SAV_UserArgs_MT128x64x128_MI16x16x1_SN_LDSB1_CLR1_GSU0_GSUC0_GSUWGMRR0_K1_LBSPPA1024_LBSPPB512_MIWT4_2_PLR1_SU0_SUM0_SUS0_VWA4_VWB2_WGM1_WGMXCC1_WGMXCCGn1
    SolutionIndex: 77
    SolutionNameMin: Cijk_Alik_Bljk_BSS_BH_Bias_HAS_SAV_UserArgs_MT128x64x128_MI16x16x1_SN_LDSB1_CLR1_GSU0_GSUC0_GSUWGMRR0_K1_LBSPPA1024_LBSPPB512_MIWT4_2_PLR1_SU0_SUM0_SUS0_VWA4_VWB2_WGM6_WGMXCC1_WGMXCCGn1
    SolutionIndex: 78
    SolutionNameMin: Cijk_Alik_Bljk_BSS_BH_Bias_HAS_SAV_UserArgs_MT128x64x128_MI16x16x1_SN_LDSB1_CLR1_GSU0_GSUC0_GSUWGMRR0_K1_LBSPPA1024_LBSPPB512_MIWT4_2_PLR1_SU0_SUM0_SUS0_VWA4_VWB2_WGM8_WGMXCC1_WGMXCCGn1
    SolutionIndex: 79
    SolutionNameMin: Cijk_Alik_Bljk_BSS_BH_Bias_HAS_SAV_UserArgs_MT128x64x128_MI16x16x1_SN_LDSB1_CLR1_GSU0_GSUC0_GSUWGMRR0_K1_LBSPPA1024_LBSPPB512_MIWT4_2_PLR1_SU0_SUM0_SUS0_VWA4_VWB2_WGM8_WGMXCC1_WGMXCCGn1
    SolutionIndex: 80
    SolutionNameMin: Cijk_Alik_Bljk_BSS_BH_Bias_HAS_SAV_UserArgs_MT128x64x128_MI16x16x1_SN_LDSB1_CLR1_GSU0_GSUC0_GSUWGMRR0_K1_LBSPPA1024_LBSPPB512_MIWT4_2_PLR1_SU0_SUM0_SUS0_VWA4_VWB2_WGM8_WGMXCC1_WGMXCCGn1
    SolutionIndex: 81
    SolutionNameMin: Cijk_Alik_Bljk_BSS_BH_Bias_HAS_SAV_UserArgs_MT128x64x128_MI16x16x1_SN_LDSB1_CLR1_GSU0_GSUC0_GSUWGMRR0_K1_LBSPPA1024_LBSPPB512_MIWT4_2_PLR1_SU0_SUM0_SUS0_VWA4_VWB2_WGM8_WGMXCC1_WGMXCCGn1
    SolutionIndex: 82
    SolutionNameMin: Cijk_Alik_Bljk_BSS_BH_Bias_HAS_SAV_UserArgs_MT128x64x128_MI16x16x1_SN_LDSB1_CLR1_GSU0_GSUC0_GSUWGMRR0_K1_LBSPPA1024_LBSPPB512_MIWT4_2_PLR1_SU0_SUM0_SUS0_VWA4_VWB2_WGM8_WGMXCC1_WGMXCCGn1
    SolutionIndex: 83
    SolutionNameMin: Cijk_Alik_Bljk_BSS_BH_Bias_HAS_SAV_UserArgs_MT64x64x128_MI16x16x1_SN_LDSB1_CLR1_GSU0_GSUC0_GSUWGMRR0_K1_LBSPPA512_LBSPPB512_MIWT2_2_PLR1_SU0_SUM0_SUS0_VWA2_VWB2_WGM1_WGMXCC1_WGMXCCGn1
    SolutionIndex: 84
    SolutionNameMin: Cijk_Alik_Bljk_BSS_BH_Bias_HAS_SAV_UserArgs_MT64x64x128_MI16x16x1_SN_LDSB1_CLR1_GSU0_GSUC0_GSUWGMRR0_K1_LBSPPA512_LBSPPB512_MIWT2_2_PLR1_SU0_SUM0_SUS0_VWA2_VWB2_WGM1_WGMXCC1_WGMXCCGn1
    SolutionIndex: 85
    SolutionNameMin: Cijk_Alik_Bljk_BSS_BH_Bias_HAS_SAV_UserArgs_MT64x64x128_MI16x16x1_SN_LDSB1_CLR1_GSU0_GSUC0_GSUWGMRR0_K1_LBSPPA512_LBSPPB512_MIWT2_2_PLR1_SU0_SUM0_SUS0_VWA2_VWB2_WGM1_WGMXCC1_WGMXCCGn1
    SolutionIndex: 86
    SolutionNameMin: Cijk_Alik_Bljk_BSS_BH_Bias_HAS_SAV_UserArgs_MT64x64x128_MI16x16x1_SN_LDSB1_CLR1_GSU0_GSUC0_GSUWGMRR0_K1_LBSPPA512_LBSPPB512_MIWT2_2_PLR1_SU0_SUM0_SUS0_VWA2_VWB2_WGM6_WGMXCC1_WGMXCCGn1
    SolutionIndex: 87
    SolutionNameMin: Cijk_Alik_Bljk_BSS_BH_Bias_HAS_SAV_UserArgs_MT64x64x128_MI16x16x1_SN_LDSB1_CLR1_GSU0_GSUC0_GSUWGMRR0_K1_LBSPPA512_LBSPPB512_MIWT2_2_PLR1_SU0_SUM0_SUS0_VWA2_VWB2_WGM6_WGMXCC1_WGMXCCGn1
    SolutionIndex: 88
    SolutionNameMin: Cijk_Alik_Bljk_BSS_BH_Bias_HAS_SAV_UserArgs_MT64x64x128_MI16x16x1_SN_LDSB1_CLR1_GSU0_GSUC0_GSUWGMRR0_K1_LBSPPA512_LBSPPB512_MIWT2_2_PLR1_SU0_SUM0_SUS0_VWA2_VWB2_WGM6_WGMXCC1_WGMXCCGn1
    SolutionIndex: 89
    SolutionNameMin: Cijk_Alik_Bljk_BSS_BH_Bias_HAS_SAV_UserArgs_MT64x64x128_MI16x16x1_SN_LDSB1_CLR1_GSU0_GSUC0_GSUWGMRR0_K1_LBSPPA512_LBSPPB512_MIWT2_2_PLR1_SU0_SUM0_SUS0_VWA2_VWB2_WGM8_WGMXCC1_WGMXCCGn1
    SolutionIndex: 90
    SolutionNameMin: Cijk_Alik_Bljk_BSS_BH_Bias_HAS_SAV_UserArgs_MT64x64x128_MI16x16x1_SN_LDSB1_CLR1_GSU0_GSUC0_GSUWGMRR0_K1_LBSPPA512_LBSPPB512_MIWT2_2_PLR1_SU0_SUM0_SUS0_VWA2_VWB2_WGM8_WGMXCC1_WGMXCCGn1
    SolutionIndex: 91
    SolutionNameMin: Cijk_Alik_Bljk_BSS_BH_Bias_HAS_SAV_UserArgs_MT32x64x128_MI16x16x1_SN_LDSB1_CLR1_GSU0_GSUC0_GSUWGMRR0_K1_LBSPPA256_LBSPPB512_MIWT1_2_PLR1_SU0_SUM0_SUS0_VWA1_VWB2_WGM1_WGMXCC1_WGMXCCGn1
    SolutionIndex: 92
    SolutionNameMin: Cijk_Alik_Bljk_BSS_BH_Bias_HAS_SAV_UserArgs_MT32x64x128_MI16x16x1_SN_LDSB1_CLR1_GSU0_GSUC0_GSUWGMRR0_K1_LBSPPA256_LBSPPB512_MIWT1_2_PLR1_SU0_SUM0_SUS0_VWA1_VWB2_WGM1_WGMXCC1_WGMXCCGn1
    SolutionIndex: 93
    SolutionNameMin: Cijk_Alik_Bljk_BSS_BH_Bias_HAS_SAV_UserArgs_MT64x32x128_MI16x16x1_SN_LDSB1_CLR1_GSU0_GSUC0_GSUWGMRR0_K1_LBSPPA512_LBSPPB256_MIWT2_1_PLR1_SU0_SUM0_SUS0_VWA2_VWB1_WGM1_WGMXCC1_WGMXCCGn1
    SolutionIndex: 94
    SolutionNameMin: Cijk_Alik_Bljk_BSS_BH_Bias_HAS_SAV_UserArgs_MT64x32x128_MI16x16x1_SN_LDSB1_CLR1_GSU0_GSUC0_GSUWGMRR0_K1_LBSPPA512_LBSPPB256_MIWT2_1_PLR1_SU0_SUM0_SUS0_VWA2_VWB1_WGM1_WGMXCC1_WGMXCCGn1
    SolutionIndex: 95
    SolutionNameMin: Cijk_Alik_Bljk_BSS_BH_Bias_HAS_SAV_UserArgs_MT32x32x128_MI16x16x1_SN_LDSB1_CLR1_GSU0_GSUC0_GSUWGMRR0_K1_LBSPPA256_LBSPPB256_MIWT1_1_PLR1_SU0_SUM0_SUS0_VWA1_VWB1_WGM1_WGMXCC1_WGMXCCGn1
    SolutionIndex: 96
    SolutionNameMin: Cijk_Alik_Bljk_BSS_BH_Bias_HAS_SAV_UserArgs_MT32x32x128_MI16x16x1_SN_LDSB1_CLR1_GSU0_GSUC0_GSUWGMRR0_K1_LBSPPA256_LBSPPB256_MIWT1_1_PLR1_SU0_SUM0_SUS0_VWA1_VWB1_WGM1_WGMXCC1_WGMXCCGn1
    SolutionIndex: 97
    SolutionNameMin: Cijk_Alik_Bljk_BSS_BH_Bias_HAS_SAV_UserArgs_MT32x32x128_MI16x16x1_SN_LDSB1_CLR1_GSU0_GSUC0_GSUWGMRR0_K1_LBSPPA256_LBSPPB256_MIWT1_1_PLR1_SU0_SUM0_SUS0_VWA1_VWB1_WGM1_WGMXCC1_WGMXCCGn1
    SolutionIndex: 98
    SolutionNameMin: Cijk_Alik_Bljk_BSS_BH_Bias_HAS_SAV_UserArgs_MT32x32x128_MI16x16x1_SN_LDSB1_CLR1_GSU0_GSUC0_GSUWGMRR0_K1_LBSPPA256_LBSPPB256_MIWT1_1_PLR1_SU0_SUM0_SUS0_VWA1_VWB1_WGM6_WGMXCC1_WGMXCCGn1
    SolutionIndex: 99
    SolutionNameMin: Cijk_Alik_Bljk_BSS_BH_Bias_HAS_SAV_UserArgs_MT32x32x128_MI16x16x1_SN_LDSB1_CLR1_GSU0_GSUC0_GSUWGMRR0_K1_LBSPPA256_LBSPPB256_MIWT1_1_PLR1_SU0_SUM0_SUS0_VWA1_VWB1_WGM8_WGMXCC1_WGMXCCGn1
    SolutionIndex: 100
    SolutionNameMin: Cijk_Alik_Bljk_BSS_BH_Bias_HAS_SAV_UserArgs_MT64x64x128_MI32x32x1_SN_LDSB1_CLR1_GSU0_GSUC0_GSUWGMRR0_K1_LBSPPA256_LBSPPB256_MIWT1_1_PLR1_SU0_SUM0_SUS0_VWA1_VWB1_WGM1_WGMXCC1_WGMXCCGn1
    SolutionIndex: 101
    SolutionNameMin: Cijk_Alik_Bljk_BSS_BH_Bias_HAS_SAV_UserArgs_MT64x64x128_MI32x32x1_SN_LDSB1_CLR1_GSU0_GSUC0_GSUWGMRR0_K1_LBSPPA256_LBSPPB256_MIWT1_1_PLR1_SU0_SUM0_SUS0_VWA1_VWB1_WGM1_WGMXCC1_WGMXCCGn1
    SolutionIndex: 102
    SolutionNameMin: Cijk_Alik_Bljk_BSS_BH_Bias_HAS_SAV_UserArgs_MT64x64x128_MI32x32x1_SN_LDSB1_CLR1_GSU0_GSUC0_GSUWGMRR0_K1_LBSPPA256_LBSPPB256_MIWT1_1_PLR1_SU0_SUM0_SUS0_VWA1_VWB1_WGM6_WGMXCC1_WGMXCCGn1
    SolutionIndex: 103
    SolutionNameMin: Cijk_Alik_Bljk_BSS_BH_Bias_HAS_SAV_UserArgs_MT64x64x128_MI32x32x1_SN_LDSB1_CLR1_GSU0_GSUC0_GSUWGMRR0_K1_LBSPPA256_LBSPPB256_MIWT1_1_PLR1_SU0_SUM0_SUS0_VWA1_VWB1_WGM8_WGMXCC1_WGMXCCGn1
    SolutionIndex: 104
    SolutionNameMin: Cijk_Alik_Bljk_BSS_BH_Bias_HAS_SAV_UserArgs_MT64x64x256_MI16x16x1_SN_LDSB1_CLR1_GSU0_GSUC0_GSUWGMRR0_K1_LBSPPA1024_LBSPPB1024_MIWT2_2_PLR1_SU0_SUM0_SUS0_VWA2_VWB2_WGM1_WGMXCC1_WGMXCCGn1
    SolutionIndex: 105
    SolutionNameMin: Cijk_Alik_Bljk_BSS_BH_Bias_HAS_SAV_UserArgs_MT64x64x256_MI16x16x1_SN_LDSB1_CLR1_GSU0_GSUC0_GSUWGMRR0_K1_LBSPPA1024_LBSPPB1024_MIWT2_2_PLR1_SU0_SUM0_SUS0_VWA2_VWB2_WGM1_WGMXCC1_WGMXCCGn1
    SolutionIndex: 106
    SolutionNameMin: Cijk_Alik_Bljk_BSS_BH_Bias_HAS_SAV_UserArgs_MT64x64x256_MI16x16x1_SN_LDSB1_CLR1_GSU0_GSUC0_GSUWGMRR0_K1_LBSPPA1024_LBSPPB1024_MIWT2_2_PLR1_SU0_SUM0_SUS0_VWA2_VWB2_WGM1_WGMXCC1_WGMXCCGn1
    SolutionIndex: 107
    SolutionNameMin: Cijk_Alik_Bljk_BSS_BH_Bias_HAS_SAV_UserArgs_MT64x64x256_MI16x16x1_SN_LDSB1_CLR1_GSU0_GSUC0_GSUWGMRR0_K1_LBSPPA1024_LBSPPB1024_MIWT2_2_PLR1_SU0_SUM0_SUS0_VWA2_VWB2_WGM6_WGMXCC1_WGMXCCGn1
    SolutionIndex: 108
    SolutionNameMin: Cijk_Alik_Bljk_BSS_BH_Bias_HAS_SAV_UserArgs_MT64x64x256_MI16x16x1_SN_LDSB1_CLR1_GSU0_GSUC0_GSUWGMRR0_K1_LBSPPA1024_LBSPPB1024_MIWT2_2_PLR1_SU0_SUM0_SUS0_VWA2_VWB2_WGM8_WGMXCC1_WGMXCCGn1
    SolutionIndex: 109
    SolutionNameMin: Cijk_Alik_Bljk_BSS_BH_Bias_HAS_SAV_UserArgs_MT64x64x256_MI16x16x1_SN_LDSB1_CLR1_GSU0_GSUC0_GSUWGMRR0_K1_LBSPPA1024_LBSPPB1024_MIWT2_2_PLR1_SU0_SUM0_SUS0_VWA2_VWB2_WGM8_WGMXCC1_WGMXCCGn1
    SolutionIndex: 110
    SolutionNameMin: Cijk_Alik_Bljk_BSS_BH_Bias_HAS_SAV_UserArgs_MT32x64x256_MI16x16x1_SN_LDSB1_CLR1_GSU0_GSUC0_GSUWGMRR0_K1_LBSPPA512_LBSPPB1024_MIWT1_2_PLR1_SU0_SUM0_SUS0_VWA1_VWB2_WGM1_WGMXCC1_WGMXCCGn1
    SolutionIndex: 111
    SolutionNameMin: Cijk_Alik_Bljk_BSS_BH_Bias_HAS_SAV_UserArgs_MT32x64x256_MI16x16x1_SN_LDSB1_CLR1_GSU0_GSUC0_GSUWGMRR0_K1_LBSPPA512_LBSPPB1024_MIWT1_2_PLR1_SU0_SUM0_SUS0_VWA1_VWB2_WGM1_WGMXCC1_WGMXCCGn1
    SolutionIndex: 112
    SolutionNameMin: Cijk_Alik_Bljk_BSS_BH_Bias_HAS_SAV_UserArgs_MT32x64x256_MI16x16x1_SN_LDSB1_CLR1_GSU0_GSUC0_GSUWGMRR0_K1_LBSPPA512_LBSPPB1024_MIWT1_2_PLR1_SU0_SUM0_SUS0_VWA1_VWB2_WGM6_WGMXCC1_WGMXCCGn1
    SolutionIndex: 113
    SolutionNameMin: Cijk_Alik_Bljk_BSS_BH_Bias_HAS_SAV_UserArgs_MT32x64x256_MI16x16x1_SN_LDSB1_CLR1_GSU0_GSUC0_GSUWGMRR0_K1_LBSPPA512_LBSPPB1024_MIWT1_2_PLR1_SU0_SUM0_SUS0_VWA1_VWB2_WGM8_WGMXCC1_WGMXCCGn1
    SolutionIndex: 114
    SolutionNameMin: Cijk_Alik_Bljk_BSS_BH_Bias_HAS_SAV_UserArgs_MT32x64x256_MI16x16x1_SN_LDSB1_CLR1_GSU0_GSUC0_GSUWGMRR0_K1_LBSPPA512_LBSPPB1024_MIWT1_2_PLR1_SU0_SUM0_SUS0_VWA1_VWB2_WGM8_WGMXCC1_WGMXCCGn1
    SolutionIndex: 115
    SolutionNameMin: Cijk_Alik_Bljk_BSS_BH_Bias_HAS_SAV_UserArgs_MT64x32x256_MI16x16x1_SN_LDSB1_CLR1_GSU0_GSUC0_GSUWGMRR0_K1_LBSPPA1024_LBSPPB512_MIWT2_1_PLR1_SU0_SUM0_SUS0_VWA2_VWB1_WGM1_WGMXCC1_WGMXCCGn1
    SolutionIndex: 116
    SolutionNameMin: Cijk_Alik_Bljk_BSS_BH_Bias_HAS_SAV_UserArgs_MT64x32x256_MI16x16x1_SN_LDSB1_CLR1_GSU0_GSUC0_GSUWGMRR0_K1_LBSPPA1024_LBSPPB512_MIWT2_1_PLR1_SU0_SUM0_SUS0_VWA2_VWB1_WGM8_WGMXCC1_WGMXCCGn1
    SolutionIndex: 117
    SolutionNameMin: Cijk_Alik_Bljk_BSS_BH_Bias_HAS_SAV_UserArgs_MT32x32x256_MI16x16x1_SN_LDSB1_CLR1_GSU0_GSUC0_GSUWGMRR0_K1_LBSPPA512_LBSPPB512_MIWT1_1_PLR1_SU0_SUM0_SUS0_VWA1_VWB1_WGM1_WGMXCC1_WGMXCCGn1
    SolutionIndex: 118
    SolutionNameMin: Cijk_Alik_Bljk_BSS_BH_Bias_HAS_SAV_UserArgs_MT32x32x256_MI16x16x1_SN_LDSB1_CLR1_GSU0_GSUC0_GSUWGMRR0_K1_LBSPPA512_LBSPPB512_MIWT1_1_PLR1_SU0_SUM0_SUS0_VWA1_VWB1_WGM1_WGMXCC1_WGMXCCGn1
    SolutionIndex: 119
    SolutionNameMin: Cijk_Alik_Bljk_BSS_BH_Bias_HAS_SAV_UserArgs_MT32x32x256_MI16x16x1_SN_LDSB1_CLR1_GSU0_GSUC0_GSUWGMRR0_K1_LBSPPA512_LBSPPB512_MIWT1_1_PLR1_SU0_SUM0_SUS0_VWA1_VWB1_WGM6_WGMXCC1_WGMXCCGn1
    SolutionIndex: 120
    SolutionNameMin: Cijk_Alik_Bljk_BSS_BH_Bias_HAS_SAV_UserArgs_MT32x32x256_MI16x16x1_SN_LDSB1_CLR1_GSU0_GSUC0_GSUWGMRR0_K1_LBSPPA512_LBSPPB512_MIWT1_1_PLR1_SU0_SUM0_SUS0_VWA1_VWB1_WGM6_WGMXCC1_WGMXCCGn1
    SolutionIndex: 121
    SolutionNameMin: Cijk_Alik_Bljk_BSS_BH_Bias_HAS_SAV_UserArgs_MT32x32x256_MI16x16x1_SN_LDSB1_CLR1_GSU0_GSUC0_GSUWGMRR0_K1_LBSPPA512_LBSPPB512_MIWT1_1_PLR1_SU0_SUM0_SUS0_VWA1_VWB1_WGM8_WGMXCC1_WGMXCCGn1
    SolutionIndex: 122
    SolutionNameMin: Cijk_Alik_Bljk_BSS_BH_Bias_HAS_SAV_UserArgs_MT32x32x256_MI16x16x1_SN_LDSB1_CLR1_GSU0_GSUC0_GSUWGMRR0_K1_LBSPPA512_LBSPPB512_MIWT1_1_PLR1_SU0_SUM0_SUS0_VWA1_VWB1_WGM8_WGMXCC1_WGMXCCGn1
    SolutionIndex: 123
    SolutionNameMin: Cijk_Alik_Bljk_BSS_BH_Bias_HAS_SAV_UserArgs_MT64x64x256_MI32x32x1_SN_LDSB1_CLR1_GSU0_GSUC0_GSUWGMRR0_K1_LBSPPA512_LBSPPB512_MIWT1_1_PLR1_SU0_SUM0_SUS0_VWA1_VWB1_WGM1_WGMXCC1_WGMXCCGn1
    SolutionIndex: 124
    SolutionNameMin: Cijk_Alik_Bljk_BSS_BH_Bias_HAS_SAV_UserArgs_MT64x64x256_MI32x32x1_SN_LDSB1_CLR1_GSU0_GSUC0_GSUWGMRR0_K1_LBSPPA512_LBSPPB512_MIWT1_1_PLR1_SU0_SUM0_SUS0_VWA1_VWB1_WGM6_WGMXCC1_WGMXCCGn1
    SolutionIndex: 125
    SolutionNameMin: Cijk_Alik_Bljk_BSS_BH_Bias_HAS_SAV_UserArgs_MT32x32x32_MI16x16x1_SN_LDSB0_CLR0_GSU0_GSUC0_GSUWGMRR0_K1_LBSPPA128_LBSPPB128_MIWT1_1_PLR0_SU32_SUM0_SUS256_VWA1_VWB1_WGM1_WGMXCC1_WGMXCCGn1
- - - [128, 128, 1, 128, 128, 128, 128, 128]
    - [96, 0.042]
  - - [128, 128, 1, 256, 128, 128, 256, 256]
    - [118, 0.078]
  - - [128, 128, 1, 512, 128, 128, 512, 512]
    - [117, 0.134]
  - - [128, 128, 1, 1024, 128, 128, 1024, 1024]
    - [118, 0.229]
  - - [128, 128, 1, 2048, 128, 128, 2048, 2048]
    - [117, 0.348]
  - - [128, 128, 1, 4096, 128, 128, 4096, 4096]
    - [117, 0.47]
  - - [128, 128, 1, 8192, 128, 128, 8192, 8192]
    - [118, 0.58]
  - - [128, 256, 1, 128, 128, 128, 128, 128]
    - [95, 0.084]
  - - [128, 256, 1, 256, 128, 128, 256, 256]
    - [117, 0.155]
  - - [128, 256, 1, 512, 128, 128, 512, 512]
    - [117, 0.265]
  - - [128, 256, 1, 1024, 128, 128, 1024, 1024]
    - [118, 0.452]
  - - [128, 256, 1, 2048, 128, 128, 2048, 2048]
    - [117, 0.689]
  - - [128, 256, 1, 4096, 128, 128, 4096, 4096]
    - [118, 0.929]
  - - [128, 256, 1, 8192, 128, 128, 8192, 8192]
    - [118, 1.152]
  - - [128, 512, 1, 128, 128, 128, 128, 128]
    - [99, 0.163]
  - - [128, 512, 1, 256, 128, 128, 256, 256]
    - [121, 0.3]
  - - [128, 512, 1, 512, 128, 128, 512, 512]
    - [117, 0.523]
  - - [128, 512, 1, 1024, 128, 128, 1024, 1024]
    - [117, 0.892]
  - - [128, 512, 1, 2048, 128, 128, 2048, 2048]
    - [118, 1.374]
  - - [128, 512, 1, 4096, 128, 128, 4096, 4096]
    - [117, 1.835]
  - - [128, 512, 1, 8192, 128, 128, 8192, 8192]
    - [122, 2.282]
  - - [128, 1024, 1, 128, 128, 128, 128, 128]
    - [97, 0.327]
  - - [128, 1024, 1, 256, 128, 128, 256, 256]
    - [117, 0.598]
  - - [128, 1024, 1, 512, 128, 128, 512, 512]
    - [118, 1.033]
  - - [128, 1024, 1, 1024, 128, 128, 1024, 1024]
    - [118, 1.737]
  - - [128, 1024, 1, 2048, 128, 128, 2048, 2048]
    - [117, 2.642]
  - - [128, 1024, 1, 4096, 128, 128, 4096, 4096]
    - [118, 3.558]
  - - [128, 1024, 1, 8192, 128, 128, 8192, 8192]
    - [117, 4.524]
  - - [128, 2048, 1, 128, 128, 128, 128, 128]
    - [97, 0.624]
  - - [128, 2048, 1, 256, 128, 128, 256, 256]
    - [117, 1.156]
  - - [128, 2048, 1, 512, 128, 128, 512, 512]
    - [118, 1.982]
  - - [128, 2048, 1, 1024, 128, 128, 1024, 1024]
    - [118, 3.362]
  - - [128, 2048, 1, 2048, 128, 128, 2048, 2048]
    - [117, 5.11]
  - - [128, 2048, 1, 4096, 128, 128, 4096, 4096]
    - [118, 7.048]
  - - [128, 2048, 1, 8192, 128, 128, 8192, 8192]
    - [117, 8.291]
  - - [128, 4096, 1, 128, 128, 128, 128, 128]
    - [92, 1.132]
  - - [128, 4096, 1, 256, 128, 128, 256, 256]
    - [111, 1.998]
  - - [128, 4096, 1, 512, 128, 128, 512, 512]
    - [111, 3.405]
  - - [128, 4096, 1, 1024, 128, 128, 1024, 1024]
    - [115, 5.641]
  - - [128, 4096, 1, 2048, 128, 128, 2048, 2048]
    - [111, 8.123]
  - - [128, 4096, 1, 4096, 128, 128, 4096, 4096]
    - [110, 9.795]
  - - [128, 4096, 1, 8192, 128, 128, 8192, 8192]
    - [111, 12.008]
  - - [128, 8192, 1, 128, 128, 128, 128, 128]
    - [101, 1.921]
  - - [128, 8192, 1, 256, 128, 128, 256, 256]
    - [101, 3.405]
  - - [128, 8192, 1, 512, 128, 128, 512, 512]
    - [85, 5.812]
  - - [128, 8192, 1, 1024, 128, 128, 1024, 1024]
    - [83, 8.276]
  - - [128, 8192, 1, 2048, 128, 128, 2048, 2048]
    - [83, 10.898]
  - - [128, 8192, 1, 4096, 128, 128, 4096, 4096]
    - [90, 13.488]
  - - [128, 8192, 1, 8192, 128, 128, 8192, 8192]
    - [104, 16.002]
  - - [256, 128, 1, 128, 256, 256, 128, 128]
    - [97, 0.085]
  - - [256, 128, 1, 256, 256, 256, 256, 256]
    - [117, 0.156]
  - - [256, 128, 1, 512, 256, 256, 512, 512]
    - [118, 0.265]
  - - [256, 128, 1, 1024, 256, 256, 1024, 1024]
    - [118, 0.453]
  - - [256, 128, 1, 2048, 256, 256, 2048, 2048]
    - [117, 0.692]
  - - [256, 128, 1, 4096, 256, 256, 4096, 4096]
    - [117, 0.939]
  - - [256, 128, 1, 8192, 256, 256, 8192, 8192]
    - [118, 1.157]
  - - [256, 256, 1, 128, 256, 256, 128, 128]
    - [98, 0.163]
  - - [256, 256, 1, 256, 256, 256, 256, 256]
    - [119, 0.304]
  - - [256, 256, 1, 512, 256, 256, 512, 512]
    - [117, 0.525]
  - - [256, 256, 1, 1024, 256, 256, 1024, 1024]
    - [117, 0.89]
  - - [256, 256, 1, 2048, 256, 256, 2048, 2048]
    - [118, 1.357]
  - - [256, 256, 1, 4096, 256, 256, 4096, 4096]
    - [120, 1.845]
  - - [256, 256, 1, 8192, 256, 256, 8192, 8192]
    - [119, 2.297]
  - - [256, 512, 1, 128, 256, 256, 128, 128]
    - [97, 0.325]
  - - [256, 512, 1, 256, 256, 256, 256, 256]
    - [117, 0.598]
  - - [256, 512, 1, 512, 256, 256, 512, 512]
    - [118, 1.036]
  - - [256, 512, 1, 1024, 256, 256, 1024, 1024]
    - [118, 1.752]
  - - [256, 512, 1, 2048, 256, 256, 2048, 2048]
    - [122, 2.675]
  - - [256, 512, 1, 4096, 256, 256, 4096, 4096]
    - [118, 3.623]
  - - [256, 512, 1, 8192, 256, 256, 8192, 8192]
    - [122, 4.558]
  - - [256, 1024, 1, 128, 256, 256, 128, 128]
    - [97, 0.626]
  - - [256, 1024, 1, 256, 256, 256, 256, 256]
    - [118, 1.166]
  - - [256, 1024, 1, 512, 256, 256, 512, 512]
    - [118, 2.002]
  - - [256, 1024, 1, 1024, 256, 256, 1024, 1024]
    - [122, 3.366]
  - - [256, 1024, 1, 2048, 256, 256, 2048, 2048]
    - [117, 5.179]
  - - [256, 1024, 1, 4096, 256, 256, 4096, 4096]
    - [118, 7.028]
  - - [256, 1024, 1, 8192, 256, 256, 8192, 8192]
    - [118, 8.744]
  - - [256, 2048, 1, 128, 256, 256, 128, 128]
    - [94, 1.131]
  - - [256, 2048, 1, 256, 256, 256, 256, 256]
    - [110, 2.035]
  - - [256, 2048, 1, 512, 256, 256, 512, 512]
    - [110, 3.494]
  - - [256, 2048, 1, 1024, 256, 256, 1024, 1024]
    - [111, 5.762]
  - - [256, 2048, 1, 2048, 256, 256, 2048, 2048]
    - [111, 8.413]
  - - [256, 2048, 1, 4096, 256, 256, 4096, 4096]
    - [111, 11.114]
  - - [256, 2048, 1, 8192, 256, 256, 8192, 8192]
    - [115, 12.987]
  - - [256, 4096, 1, 128, 256, 256, 128, 128]
    - [101, 1.957]
  - - [256, 4096, 1, 256, 256, 256, 256, 256]
    - [101, 3.459]
  - - [256, 4096, 1, 512, 256, 256, 512, 512]
    - [84, 5.89]
  - - [256, 4096, 1, 1024, 256, 256, 1024, 1024]
    - [84, 9.181]
  - - [256, 4096, 1, 2048, 256, 256, 2048, 2048]
    - [84, 12.166]
  - - [256, 4096, 1, 4096, 256, 256, 4096, 4096]
    - [85, 15.092]
  - - [256, 4096, 1, 8192, 256, 256, 8192, 8192]
    - [105, 17.815]
  - - [256, 8192, 1, 128, 256, 256, 128, 128]
    - [52, 2.952]
  - - [256, 8192, 1, 256, 256, 256, 256, 256]
    - [53, 5.319]
  - - [256, 8192, 1, 512, 256, 256, 512, 512]
    - [53, 8.269]
  - - [256, 8192, 1, 1024, 256, 256, 1024, 1024]
    - [53, 11.701]
  - - [256, 8192, 1, 2048, 256, 256, 2048, 2048]
    - [53, 14.842]
  - - [256, 8192, 1, 4096, 256, 256, 4096, 4096]
    - [72, 19.648]
  - - [256, 8192, 1, 8192, 256, 256, 8192, 8192]
    - [70, 21.857]
  - - [512, 128, 1, 128, 512, 512, 128, 128]
    - [97, 0.169]
  - - [512, 128, 1, 256, 512, 512, 256, 256]
    - [117, 0.306]
  - - [512, 128, 1, 512, 512, 512, 512, 512]
    - [117, 0.532]
  - - [512, 128, 1, 1024, 512, 512, 1024, 1024]
    - [118, 0.897]
  - - [512, 128, 1, 2048, 512, 512, 2048, 2048]
    - [117, 1.359]
  - - [512, 128, 1, 4096, 512, 512, 4096, 4096]
    - [118, 1.849]
  - - [512, 128, 1, 8192, 512, 512, 8192, 8192]
    - [118, 2.295]
  - - [512, 256, 1, 128, 512, 512, 128, 128]
    - [95, 0.323]
  - - [512, 256, 1, 256, 512, 512, 256, 256]
    - [117, 0.604]
  - - [512, 256, 1, 512, 512, 512, 512, 512]
    - [117, 1.019]
  - - [512, 256, 1, 1024, 512, 512, 1024, 1024]
    - [120, 1.744]
  - - [512, 256, 1, 2048, 512, 512, 2048, 2048]
    - [120, 2.661]
  - - [512, 256, 1, 4096, 512, 512, 4096, 4096]
    - [120, 3.615]
  - - [512, 256, 1, 8192, 512, 512, 8192, 8192]
    - [119, 4.537]
  - - [512, 512, 1, 128, 512, 512, 128, 128]
    - [97, 0.641]
  - - [512, 512, 1, 256, 512, 512, 256, 256]
    - [117, 1.158]
  - - [512, 512, 1, 512, 512, 512, 512, 512]
    - [122, 1.994]
  - - [512, 512, 1, 1024, 512, 512, 1024, 1024]
    - [122, 3.407]
  - - [512, 512, 1, 2048, 512, 512, 2048, 2048]
    - [121, 5.193]
  - - [512, 512, 1, 4096, 512, 512, 4096, 4096]
    - [122, 7.074]
  - - [512, 512, 1, 8192, 512, 512, 8192, 8192]
    - [122, 8.933]
  - - [512, 1024, 1, 128, 512, 512, 128, 128]
    - [92, 1.136]
  - - [512, 1024, 1, 256, 512, 512, 256, 256]
    - [111, 2.041]
  - - [512, 1024, 1, 512, 512, 512, 512, 512]
    - [110, 3.481]
  - - [512, 1024, 1, 1024, 512, 512, 1024, 1024]
    - [111, 5.754]
  - - [512, 1024, 1, 2048, 512, 512, 2048, 2048]
    - [112, 8.403]
  - - [512, 1024, 1, 4096, 512, 512, 4096, 4096]
    - [112, 11.047]
  - - [512, 1024, 1, 8192, 512, 512, 8192, 8192]
    - [116, 13.18]
  - - [512, 2048, 1, 128, 512, 512, 128, 128]
    - [101, 1.941]
  - - [512, 2048, 1, 256, 512, 512, 256, 256]
    - [101, 3.39]
  - - [512, 2048, 1, 512, 512, 512, 512, 512]
    - [101, 5.952]
  - - [512, 2048, 1, 1024, 512, 512, 1024, 1024]
    - [89, 9.041]
  - - [512, 2048, 1, 2048, 512, 512, 2048, 2048]
    - [108, 12.448]
  - - [512, 2048, 1, 4096, 512, 512, 4096, 4096]
    - [106, 15.576]
  - - [512, 2048, 1, 8192, 512, 512, 8192, 8192]
    - [123, 18.085]
  - - [512, 4096, 1, 128, 512, 512, 128, 128]
    - [73, 2.981]
  - - [512, 4096, 1, 256, 512, 512, 256, 256]
    - [66, 5.252]
  - - [512, 4096, 1, 512, 512, 512, 512, 512]
    - [52, 8.692]
  - - [512, 4096, 1, 1024, 512, 512, 1024, 1024]
    - [75, 12.143]
  - - [512, 4096, 1, 2048, 512, 512, 2048, 2048]
    - [75, 15.516]
  - - [512, 4096, 1, 4096, 512, 512, 4096, 4096]
    - [79, 20.728]
  - - [512, 4096, 1, 8192, 512, 512, 8192, 8192]
    - [76, 23.281]
  - - [512, 8192, 1, 128, 512, 512, 128, 128]
    - [39, 3.809]
  - - [512, 8192, 1, 256, 512, 512, 256, 256]
    - [67, 6.753]
  - - [512, 8192, 1, 512, 512, 512, 512, 512]
    - [36, 10.7]
  - - [512, 8192, 1, 1024, 512, 512, 1024, 1024]
    - [36, 15.903]
  - - [512, 8192, 1, 2048, 512, 512, 2048, 2048]
    - [39, 22.051]
  - - [512, 8192, 1, 4096, 512, 512, 4096, 4096]
    - [48, 26.744]
  - - [512, 8192, 1, 8192, 512, 512, 8192, 8192]
    - [69, 27.699]
  - - [1024, 128, 1, 128, 1024, 1024, 128, 128]
    - [97, 0.326]
  - - [1024, 128, 1, 256, 1024, 1024, 256, 256]
    - [117, 0.601]
  - - [1024, 128, 1, 512, 1024, 1024, 512, 512]
    - [117, 1.025]
  - - [1024, 128, 1, 1024, 1024, 1024, 1024, 1024]
    - [118, 1.723]
  - - [1024, 128, 1, 2048, 1024, 1024, 2048, 2048]
    - [119, 2.623]
  - - [1024, 128, 1, 4096, 1024, 1024, 4096, 4096]
    - [121, 3.551]
  - - [1024, 128, 1, 8192, 1024, 1024, 8192, 8192]
    - [120, 4.495]
  - - [1024, 256, 1, 128, 1024, 1024, 128, 128]
    - [95, 0.629]
  - - [1024, 256, 1, 256, 1024, 1024, 256, 256]
    - [119, 1.129]
  - - [1024, 256, 1, 512, 1024, 1024, 512, 512]
    - [121, 1.976]
  - - [1024, 256, 1, 1024, 1024, 1024, 1024, 1024]
    - [122, 3.35]
  - - [1024, 256, 1, 2048, 1024, 1024, 2048, 2048]
    - [120, 5.069]
  - - [1024, 256, 1, 4096, 1024, 1024, 4096, 4096]
    - [121, 7.006]
  - - [1024, 256, 1, 8192, 1024, 1024, 8192, 8192]
    - [122, 8.753]
  - - [1024, 512, 1, 128, 1024, 1024, 128, 128]
    - [93, 1.129]
  - - [1024, 512, 1, 256, 1024, 1024, 256, 256]
    - [111, 2.001]
  - - [1024, 512, 1, 512, 1024, 1024, 512, 512]
    - [116, 3.461]
  - - [1024, 512, 1, 1024, 1024, 1024, 1024, 1024]
    - [112, 5.737]
  - - [1024, 512, 1, 2048, 1024, 1024, 2048, 2048]
    - [116, 8.304]
  - - [1024, 512, 1, 4096, 1024, 1024, 4096, 4096]
    - [116, 11.037]
  - - [1024, 512, 1, 8192, 1024, 1024, 8192, 8192]
    - [116, 13.179]
  - - [1024, 1024, 1, 128, 1024, 1024, 128, 128]
    - [100, 1.917]
  - - [1024, 1024, 1, 256, 1024, 1024, 256, 256]
    - [101, 3.426]
  - - [1024, 1024, 1, 512, 1024, 1024, 512, 512]
    - [103, 5.823]
  - - [1024, 1024, 1, 1024, 1024, 1024, 1024, 1024]
    - [89, 9.106]
  - - [1024, 1024, 1, 2048, 1024, 1024, 2048, 2048]
    - [108, 12.45]
  - - [1024, 1024, 1, 4096, 1024, 1024, 4096, 4096]
    - [107, 15.784]
  - - [1024, 1024, 1, 8192, 1024, 1024, 8192, 8192]
    - [124, 18.474]
  - - [1024, 2048, 1, 128, 1024, 1024, 128, 128]
    - [53, 3.008]
  - - [1024, 2048, 1, 256, 1024, 1024, 256, 256]
    - [53, 5.297]
  - - [1024, 2048, 1, 512, 1024, 1024, 512, 512]
    - [53, 8.556]
  - - [1024, 2048, 1, 1024, 1024, 1024, 1024, 1024]
    - [74, 12.468]
  - - [1024, 2048, 1, 2048, 1024, 1024, 2048, 2048]
    - [51, 16.223]
  - - [1024, 2048, 1, 4096, 1024, 1024, 4096, 4096]
    - [82, 21.078]
  - - [1024, 2048, 1, 8192, 1024, 1024, 8192, 8192]
    - [82, 23.837]
  - - [1024, 4096, 1, 128, 1024, 1024, 128, 128]
    - [39, 3.77]
  - - [1024, 4096, 1, 256, 1024, 1024, 256, 256]
    - [37, 6.745]
  - - [1024, 4096, 1, 512, 1024, 1024, 512, 512]
    - [35, 10.748]
  - - [1024, 4096, 1, 1024, 1024, 1024, 1024, 1024]
    - [45, 15.84]
  - - [1024, 4096, 1, 2048, 1024, 1024, 2048, 2048]
    - [41, 22.173]
  - - [1024, 4096, 1, 4096, 1024, 1024, 4096, 4096]
    - [38, 27.3]
  - - [1024, 4096, 1, 8192, 1024, 1024, 8192, 8192]
    - [69, 28.785]
  - - [1024, 8192, 1, 128, 1024, 1024, 128, 128]
    - [14, 4.711]
  - - [1024, 8192, 1, 256, 1024, 1024, 256, 256]
    - [2, 8.036]
  - - [1024, 8192, 1, 512, 1024, 1024, 512, 512]
    - [1, 12.814]
  - - [1024, 8192, 1, 1024, 1024, 1024, 1024, 1024]
    - [25, 19.819]
  - - [1024, 8192, 1, 2048, 1024, 1024, 2048, 2048]
    - [29, 27.164]
  - - [1024, 8192, 1, 4096, 1024, 1024, 4096, 4096]
    - [33, 32.113]
  - - [1024, 8192, 1, 8192, 1024, 1024, 8192, 8192]
    - [34, 32.829]
  - - [2048, 128, 1, 128, 2048, 2048, 128, 128]
    - [97, 0.635]
  - - [2048, 128, 1, 256, 2048, 2048, 256, 256]
    - [119, 1.136]
  - - [2048, 128, 1, 512, 2048, 2048, 512, 512]
    - [119, 1.962]
  - - [2048, 128, 1, 1024, 2048, 2048, 1024, 1024]
    - [122, 3.316]
  - - [2048, 128, 1, 2048, 2048, 2048, 2048, 2048]
    - [122, 5.081]
  - - [2048, 128, 1, 4096, 2048, 2048, 4096, 4096]
    - [122, 7.033]
  - - [2048, 128, 1, 8192, 2048, 2048, 8192, 8192]
    - [122, 8.285]
  - - [2048, 256, 1, 128, 2048, 2048, 128, 128]
    - [91, 1.126]
  - - [2048, 256, 1, 256, 2048, 2048, 256, 256]
    - [111, 2.001]
  - - [2048, 256, 1, 512, 2048, 2048, 512, 512]
    - [112, 3.411]
  - - [2048, 256, 1, 1024, 2048, 2048, 1024, 1024]
    - [112, 5.659]
  - - [2048, 256, 1, 2048, 2048, 2048, 2048, 2048]
    - [114, 8.279]
  - - [2048, 256, 1, 4096, 2048, 2048, 4096, 4096]
    - [112, 10.979]
  - - [2048, 256, 1, 8192, 2048, 2048, 8192, 8192]
    - [112, 12.742]
  - - [2048, 512, 1, 128, 2048, 2048, 128, 128]
    - [102, 1.902]
  - - [2048, 512, 1, 256, 2048, 2048, 256, 256]
    - [103, 3.357]
  - - [2048, 512, 1, 512, 2048, 2048, 512, 512]
    - [102, 5.841]
  - - [2048, 512, 1, 1024, 2048, 2048, 1024, 1024]
    - [89, 8.897]
  - - [2048, 512, 1, 2048, 2048, 2048, 2048, 2048]
    - [90, 12.473]
  - - [2048, 512, 1, 4096, 2048, 2048, 4096, 4096]
    - [90, 15.479]
  - - [2048, 512, 1, 8192, 2048, 2048, 8192, 8192]
    - [124, 17.738]
  - - [2048, 1024, 1, 128, 2048, 2048, 128, 128]
    - [82, 2.983]
  - - [2048, 1024, 1, 256, 2048, 2048, 256, 256]
    - [53, 5.218]
  - - [2048, 1024, 1, 512, 2048, 2048, 512, 512]
    - [55, 8.484]
  - - [2048, 1024, 1, 1024, 2048, 2048, 1024, 1024]
    - [78, 12.341]
  - - [2048, 1024, 1, 2048, 2048, 2048, 2048, 2048]
    - [80, 16.281]
  - - [2048, 1024, 1, 4096, 2048, 2048, 4096, 4096]
    - [79, 21.193]
  - - [2048, 1024, 1, 8192, 2048, 2048, 8192, 8192]
    - [77, 24.003]
  - - [2048, 2048, 1, 128, 2048, 2048, 128, 128]
    - [49, 3.747]
  - - [2048, 2048, 1, 256, 2048, 2048, 256, 256]
    - [69, 6.595]
  - - [2048, 2048, 1, 512, 2048, 2048, 512, 512]
    - [40, 10.775]
  - - [2048, 2048, 1, 1024, 2048, 2048, 1024, 1024]
    - [40, 15.818]
  - - [2048, 2048, 1, 2048, 2048, 2048, 2048, 2048]
    - [46, 22.42]
  - - [2048, 2048, 1, 4096, 2048, 2048, 4096, 4096]
    - [69, 27.135]
  - - [2048, 2048, 1, 8192, 2048, 2048, 8192, 8192]
    - [44, 28.802]
  - - [2048, 4096, 1, 128, 2048, 2048, 128, 128]
    - [5, 4.791]
  - - [2048, 4096, 1, 256, 2048, 2048, 256, 256]
    - [2, 8.142]
  - - [2048, 4096, 1, 512, 2048, 2048, 512, 512]
    - [4, 12.854]
  - - [2048, 4096, 1, 1024, 2048, 2048, 1024, 1024]
    - [23, 20.046]
  - - [2048, 4096, 1, 2048, 2048, 2048, 2048, 2048]
    - [30, 27.538]
  - - [2048, 4096, 1, 4096, 2048, 2048, 4096, 4096]
    - [24, 32.774]
  - - [2048, 4096, 1, 8192, 2048, 2048, 8192, 8192]
    - [34, 33.284]
  - - [2048, 8192, 1, 128, 2048, 2048, 128, 128]
    - [2, 5.34]
  - - [2048, 8192, 1, 256, 2048, 2048, 256, 256]
    - [3, 8.88]
  - - [2048, 8192, 1, 512, 2048, 2048, 512, 512]
    - [7, 14.756]
  - - [2048, 8192, 1, 1024, 2048, 2048, 1024, 1024]
    - [9, 23.098]
  - - [2048, 8192, 1, 2048, 2048, 2048, 2048, 2048]
    - [58, 32.837]
  - - [2048, 8192, 1, 4096, 2048, 2048, 4096, 4096]
    - [18, 37.237]
  - - [2048, 8192, 1, 8192, 2048, 2048, 8192, 8192]
    - [22, 39.786]
  - - [4096, 128, 1, 128, 4096, 4096, 128, 128]
    - [91, 1.121]
  - - [4096, 128, 1, 256, 4096, 4096, 256, 256]
    - [91, 1.973]
  - - [4096, 128, 1, 512, 4096, 4096, 512, 512]
    - [92, 3.363]
  - - [4096, 128, 1, 1024, 4096, 4096, 1024, 1024]
    - [112, 5.509]
  - - [4096, 128, 1, 2048, 4096, 4096, 2048, 2048]
    - [114, 8.112]
  - - [4096, 128, 1, 4096, 4096, 4096, 4096, 4096]
    - [113, 10.055]
  - - [4096, 128, 1, 8192, 4096, 4096, 8192, 8192]
    - [116, 11.988]
  - - [4096, 256, 1, 128, 4096, 4096, 128, 128]
    - [102, 1.91]
  - - [4096, 256, 1, 256, 4096, 4096, 256, 256]
    - [103, 3.383]
  - - [4096, 256, 1, 512, 4096, 4096, 512, 512]
    - [102, 5.815]
  - - [4096, 256, 1, 1024, 4096, 4096, 1024, 1024]
    - [87, 8.83]
  - - [4096, 256, 1, 2048, 4096, 4096, 2048, 2048]
    - [87, 12.053]
  - - [4096, 256, 1, 4096, 4096, 4096, 4096, 4096]
    - [89, 15.083]
  - - [4096, 256, 1, 8192, 4096, 4096, 8192, 8192]
    - [107, 17.374]
  - - [4096, 512, 1, 128, 4096, 4096, 128, 128]
    - [82, 2.915]
  - - [4096, 512, 1, 256, 4096, 4096, 256, 256]
    - [55, 5.128]
  - - [4096, 512, 1, 512, 4096, 4096, 512, 512]
    - [55, 8.454]
  - - [4096, 512, 1, 1024, 4096, 4096, 1024, 1024]
    - [81, 11.849]
  - - [4096, 512, 1, 2048, 4096, 4096, 2048, 2048]
    - [71, 15.447]
  - - [4096, 512, 1, 4096, 4096, 4096, 4096, 4096]
    - [72, 20.705]
  - - [4096, 512, 1, 8192, 4096, 4096, 8192, 8192]
    - [82, 22.726]
  - - [4096, 1024, 1, 128, 4096, 4096, 128, 128]
    - [62, 3.76]
  - - [4096, 1024, 1, 256, 4096, 4096, 256, 256]
    - [47, 6.573]
  - - [4096, 1024, 1, 512, 4096, 4096, 512, 512]
    - [45, 10.651]
  - - [4096, 1024, 1, 1024, 4096, 4096, 1024, 1024]
    - [45, 15.623]
  - - [4096, 1024, 1, 2048, 4096, 4096, 2048, 2048]
    - [44, 21.869]
  - - [4096, 1024, 1, 4096, 4096, 4096, 4096, 4096]
    - [44, 27.269]
  - - [4096, 1024, 1, 8192, 4096, 4096, 8192, 8192]
    - [49, 28.017]
  - - [4096, 2048, 1, 128, 4096, 4096, 128, 128]
    - [0, 4.614]
  - - [4096, 2048, 1, 256, 4096, 4096, 256, 256]
    - [0, 7.942]
  - - [4096, 2048, 1, 512, 4096, 4096, 512, 512]
    - [25, 12.587]
  - - [4096, 2048, 1, 1024, 4096, 4096, 1024, 1024]
    - [28, 19.613]
  - - [4096, 2048, 1, 2048, 4096, 4096, 2048, 2048]
    - [34, 26.598]
  - - [4096, 2048, 1, 4096, 4096, 4096, 4096, 4096]
    - [30, 31.745]
  - - [4096, 2048, 1, 8192, 4096, 4096, 8192, 8192]
    - [34, 32.567]
  - - [4096, 4096, 1, 128, 4096, 4096, 128, 128]
    - [32, 5.271]
  - - [4096, 4096, 1, 256, 4096, 4096, 256, 256]
    - [4, 8.956]
  - - [4096, 4096, 1, 512, 4096, 4096, 512, 512]
    - [11, 14.46]
  - - [4096, 4096, 1, 1024, 4096, 4096, 1024, 1024]
    - [56, 23.61]
  - - [4096, 4096, 1, 2048, 4096, 4096, 2048, 2048]
    - [57, 32.41]
  - - [4096, 8192, 1, 128, 4096, 4096, 128, 128]
    - [16, 5.851]
  - - [4096, 8192, 1, 256, 4096, 4096, 256, 256]
    - [10, 10.149]
  - - [4096, 8192, 1, 512, 4096, 4096, 512, 512]
    - [13, 16.751]
  - - [4096, 8192, 1, 1024, 4096, 4096, 1024, 1024]
    - [59, 24.684]
  - - [4096, 8192, 1, 2048, 4096, 4096, 2048, 2048]
    - [22, 30.805]
  - - [8192, 128, 1, 128, 8192, 8192, 128, 128]
    - [102, 1.896]
  - - [8192, 128, 1, 256, 8192, 8192, 256, 256]
    - [103, 3.348]
  - - [8192, 128, 1, 512, 8192, 8192, 512, 512]
    - [88, 5.727]
  - - [8192, 128, 1, 1024, 8192, 8192, 1024, 1024]
    - [86, 8.023]
  - - [8192, 128, 1, 2048, 8192, 8192, 2048, 2048]
    - [87, 10.589]
  - - [8192, 128, 1, 4096, 8192, 8192, 4096, 4096]
    - [109, 13.514]
  - - [8192, 128, 1, 8192, 8192, 8192, 8192, 8192]
    - [109, 15.714]
  - - [8192, 256, 1, 128, 8192, 8192, 128, 128]
    - [64, 2.913]
  - - [8192, 256, 1, 256, 8192, 8192, 256, 256]
    - [54, 5.206]
  - - [8192, 256, 1, 512, 8192, 8192, 512, 512]
    - [50, 8.123]
  - - [8192, 256, 1, 1024, 8192, 8192, 1024, 1024]
    - [65, 11.606]
  - - [8192, 256, 1, 2048, 8192, 8192, 2048, 2048]
    - [81, 15.015]
  - - [8192, 256, 1, 4096, 8192, 8192, 4096, 4096]
    - [82, 19.65]
  - - [8192, 256, 1, 8192, 8192, 8192, 8192, 8192]
    - [77, 21.328]
  - - [8192, 512, 1, 128, 8192, 8192, 128, 128]
    - [63, 3.733]
  - - [8192, 512, 1, 256, 8192, 8192, 256, 256]
    - [43, 6.575]
  - - [8192, 512, 1, 512, 8192, 8192, 512, 512]
    - [42, 10.433]
  - - [8192, 512, 1, 1024, 8192, 8192, 1024, 1024]
    - [42, 15.707]
  - - [8192, 512, 1, 2048, 8192, 8192, 2048, 2048]
    - [68, 21.255]
  - - [8192, 512, 1, 4096, 8192, 8192, 4096, 4096]
    - [49, 26.577]
  - - [8192, 512, 1, 8192, 8192, 8192, 8192, 8192]
    - [44, 26.643]
  - - [8192, 1024, 1, 128, 8192, 8192, 128, 128]
    - [32, 4.802]
  - - [8192, 1024, 1, 256, 8192, 8192, 256, 256]
    - [6, 7.878]
  - - [8192, 1024, 1, 512, 8192, 8192, 512, 512]
    - [31, 12.914]
  - - [8192, 1024, 1, 1024, 8192, 8192, 1024, 1024]
    - [27, 20.051]
  - - [8192, 1024, 1, 2048, 8192, 8192, 2048, 2048]
    - [30, 27.041]
  - - [8192, 1024, 1, 4096, 8192, 8192, 4096, 4096]
    - [30, 31.453]
  - - [8192, 1024, 1, 8192, 8192, 8192, 8192, 8192]
    - [30, 31.797]
  - - [8192, 2048, 1, 128, 8192, 8192, 128, 128]
    - [26, 5.259]
  - - [8192, 2048, 1, 256, 8192, 8192, 256, 256]
    - [2, 8.841]
  - - [8192, 2048, 1, 512, 8192, 8192, 512, 512]
    - [8, 14.272]
  - - [8192, 2048, 1, 1024, 8192, 8192, 1024, 1024]
    - [22, 22.877]
  - - [8192, 2048, 1, 2048, 8192, 8192, 2048, 2048]
    - [21, 31.631]
  - - [8192, 2048, 1, 4096, 8192, 8192, 4096, 4096]
    - [22, 36.427]
  - - [8192, 2048, 1, 8192, 8192, 8192, 8192, 8192]
    - [20, 39.46]
  - - [8192, 4096, 1, 128, 8192, 8192, 128, 128]
    - [17, 6.005]
  - - [8192, 4096, 1, 256, 8192, 8192, 256, 256]
    - [16, 10.054]
  - - [8192, 4096, 1, 512, 8192, 8192, 512, 512]
    - [61, 16.55]
  - - [8192, 4096, 1, 1024, 8192, 8192, 1024, 1024]
    - [20, 24.392]
  - - [8192, 4096, 1, 2048, 8192, 8192, 2048, 2048]
    - [20, 31.128]
  - - [8192, 8192, 1, 128, 8192, 8192, 128, 128]
    - [15, 6.222]
  - - [8192, 8192, 1, 256, 8192, 8192, 256, 256]
    - [12, 10.834]
  - - [8192, 8192, 1, 512, 8192, 8192, 512, 512]
    - [60, 17.428]
  - - [8192, 8192, 1, 1024, 8192, 8192, 1024, 1024]
    - [60, 24.59]
  - - [8192, 8192, 1, 2048, 8192, 8192, 2048, 2048]
    - [21, 31.306]
  - - [4096, 4096, 1, 4096, 4096, 4096, 4096, 4096]
    - [21, 37.205]
  - - [4096, 4096, 1, 8192, 4096, 4096, 8192, 8192]
    - [19, 39.928]
  - - [4096, 8192, 1, 4096, 4096, 4096, 4096, 4096]
    - [21, 36.601]
  - - [4096, 8192, 1, 8192, 4096, 4096, 8192, 8192]
    - [22, 42.599]
  - - [8192, 4096, 1, 4096, 8192, 8192, 4096, 4096]
    - [21, 36.167]
  - - [8192, 4096, 1, 8192, 8192, 8192, 8192, 8192]
    - [20, 41.624]
  - - [8192, 8192, 1, 4096, 8192, 8192, 4096, 4096]
    - [21, 39.503]
  - - [8192, 8192, 1, 8192, 8192, 8192, 8192, 8192]
    - [20, 45.525]
  - - [1, 1, 1, 32, 1, 1, 32, 32]
    - [125, 0.0]
- null
- null
- DeviceEfficiency
- GridBased
