projects/hipblaslt/library/src/amd_detail/rocblaslt/src/Tensile/Logic/asm_full/gfx950/GridBased/gfx950_Cijk_Alik_Bjlk_B8F8BS_BH_Bias_HAS_SAB_SAV_UserArgs.yaml
- {MinimumRequiredVersion: 4.33.0}
- gfx950
- gfx950
- [Device 75a0]
    SolutionIndex: 0
    SolutionNameMin: Cijk_Alik_Bjlk_F8HS_BH_Bias_HAS_SAB_SAV_UserArgs_MT256x256x64_MI32x32x1_SN_GSU0_GSUC0_GSUWGMRR0_K1_LBSPPA256_LBSPPB0_LPB0_MIWT4_4_SU0_SUM0_SUS0_VWA4_VWB4_WGM8_WGMXCC1_WGMXCCGn1
    SolutionIndex: 1
    SolutionNameMin: Cijk_Alik_Bjlk_F8HS_BH_Bias_HAS_SAB_SAV_UserArgs_MT256x256x64_MI32x32x1_SN_GSU0_GSUC0_GSUWGMRR0_K1_LBSPPA256_LBSPPB0_LPB0_MIWT4_4_SU0_SUM0_SUS0_VWA4_VWB4_WGM8_WGMXCC1_WGMXCCGn1
    SolutionIndex: 2
    SolutionNameMin: Cijk_Alik_Bjlk_F8HS_BH_Bias_HAS_SAB_SAV_UserArgs_MT256x256x64_MI32x32x1_SN_GSU0_GSUC0_GSUWGMRR0_K1_LBSPPA256_LBSPPB0_LPB0_MIWT4_4_SU0_SUM0_SUS0_VWA4_VWB4_WGM8_WGMXCC1_WGMXCCGn1
    SolutionIndex: 3
    SolutionNameMin: Cijk_Alik_Bjlk_F8HS_BH_Bias_HAS_SAB_SAV_UserArgs_MT256x256x64_MI32x32x1_SN_GSU0_GSUC0_GSUWGMRR0_K1_LBSPPA256_LBSPPB0_LPB0_MIWT4_4_SU0_SUM0_SUS0_VWA4_VWB4_WGM8_WGMXCC1_WGMXCCGn1
    SolutionIndex: 4
    SolutionNameMin: Cijk_Alik_Bjlk_F8HS_BH_Bias_HAS_SAB_SAV_UserArgs_MT256x256x64_MI32x32x1_SN_GSU0_GSUC0_GSUWGMRR0_K1_LBSPPA256_LBSPPB0_LPB0_MIWT4_4_SU0_SUM0_SUS0_VWA4_VWB4_WGM8_WGMXCC1_WGMXCCGn1
    SolutionIndex: 5
    SolutionNameMin: Cijk_Alik_Bjlk_F8HS_BH_Bias_HAS_SAB_SAV_UserArgs_MT256x256x64_MI32x32x1_SN_GSU0_GSUC0_GSUWGMRR0_K1_LBSPPA256_LBSPPB0_LPB0_MIWT4_4_SU0_SUM0_SUS0_VWA4_VWB4_WGM8_WGMXCC1_WGMXCCGn1
    SolutionIndex: 6
    SolutionNameMin: Cijk_Alik_Bjlk_F8HS_BH_Bias_HAS_SAB_SAV_UserArgs_MT256x128x64_MI32x32x1_SN_GSU0_GSUC0_GSUWGMRR0_K1_LBSPPA256_LBSPPB0_LPB0_MIWT4_2_SU0_SUM0_SUS0_VWA4_VWB2_WGM8_WGMXCC1_WGMXCCGn1
    SolutionIndex: 7
    SolutionNameMin: Cijk_Alik_Bjlk_F8HS_BH_Bias_HAS_SAB_SAV_UserArgs_MT256x128x64_MI32x32x1_SN_GSU0_GSUC0_GSUWGMRR0_K1_LBSPPA256_LBSPPB0_LPB0_MIWT4_2_SU0_SUM0_SUS0_VWA4_VWB2_WGM8_WGMXCC1_WGMXCCGn1
    SolutionIndex: 8
    SolutionNameMin: Cijk_Alik_Bjlk_F8HS_BH_Bias_HAS_SAB_SAV_UserArgs_MT256x128x128_MI16x16x1_SN_GSU0_GSUC0_GSUWGMRR0_K1_LBSPPA1024_LBSPPB2048_LPB64_MIWT8_4_SU0_SUM0_SUS0_VWA8_VWB4_WGM8_WGMXCC1_WGMXCCGn1
    SolutionIndex: 9
    SolutionNameMin: Cijk_Alik_Bjlk_F8HS_BH_Bias_HAS_SAB_SAV_UserArgs_MT256x128x128_MI16x16x1_SN_GSU0_GSUC0_GSUWGMRR0_K1_LBSPPA1024_LBSPPB2048_LPB64_MIWT8_4_SU0_SUM0_SUS0_VWA8_VWB4_WGM8_WGMXCC1_WGMXCCGn1
    SolutionIndex: 10
    SolutionNameMin: Cijk_Alik_Bjlk_F8HS_BH_Bias_HAS_SAB_SAV_UserArgs_MT256x128x128_MI16x16x1_SN_GSU0_GSUC0_GSUWGMRR0_K1_LBSPPA1024_LBSPPB2048_LPB64_MIWT8_4_SU0_SUM0_SUS0_VWA8_VWB4_WGM8_WGMXCC1_WGMXCCGn1
    SolutionIndex: 11
    SolutionNameMin: Cijk_Alik_Bjlk_F8HS_BH_Bias_HAS_SAB_SAV_UserArgs_MT128x128x128_MI16x16x1_SN_GSU0_GSUC0_GSUWGMRR0_K1_LBSPPA512_LBSPPB2048_LPB64_MIWT4_4_SU0_SUM0_SUS0_VWA4_VWB4_WGM8_WGMXCC1_WGMXCCGn1
    SolutionIndex: 12
    SolutionNameMin: Cijk_Alik_Bjlk_F8HS_BH_Bias_HAS_SAB_SAV_UserArgs_MT128x128x128_MI16x16x1_SN_GSU0_GSUC0_GSUWGMRR0_K1_LBSPPA512_LBSPPB2048_LPB64_MIWT4_4_SU0_SUM0_SUS0_VWA4_VWB4_WGM8_WGMXCC1_WGMXCCGn1
    SolutionIndex: 13
    SolutionNameMin: Cijk_Alik_Bjlk_F8HS_BH_Bias_HAS_SAB_SAV_UserArgs_MT128x128x128_MI16x16x1_SN_GSU0_GSUC0_GSUWGMRR0_K1_LBSPPA512_LBSPPB2048_LPB64_MIWT4_4_SU0_SUM0_SUS0_VWA4_VWB4_WGM8_WGMXCC1_WGMXCCGn1
    SolutionIndex: 14
    SolutionNameMin: Cijk_Alik_Bjlk_F8HS_BH_Bias_HAS_SAB_SAV_UserArgs_MT128x64x128_MI16x16x1_SN_GSU0_GSUC0_GSUWGMRR0_K1_LBSPPA512_LBSPPB1024_LPB32_MIWT4_2_SU0_SUM0_SUS0_VWA4_VWB2_WGM8_WGMXCC1_WGMXCCGn1
    SolutionIndex: 15
    SolutionNameMin: Cijk_Alik_Bjlk_F8HS_BH_Bias_HAS_SAB_SAV_UserArgs_MT128x64x128_MI16x16x1_SN_GSU0_GSUC0_GSUWGMRR0_K1_LBSPPA512_LBSPPB1024_LPB32_MIWT4_2_SU0_SUM0_SUS0_VWA4_VWB2_WGM8_WGMXCC1_WGMXCCGn1
    SolutionIndex: 16
    SolutionNameMin: Cijk_Alik_Bjlk_F8HS_BH_Bias_HAS_SAB_SAV_UserArgs_MT128x64x128_MI16x16x1_SN_GSU0_GSUC0_GSUWGMRR0_K1_LBSPPA512_LBSPPB1024_LPB32_MIWT4_2_SU0_SUM0_SUS0_VWA4_VWB2_WGM8_WGMXCC1_WGMXCCGn1
    SolutionIndex: 17
    SolutionNameMin: Cijk_Alik_Bjlk_F8HS_BH_Bias_HAS_SAB_SAV_UserArgs_MT128x64x128_MI16x16x1_SN_GSU0_GSUC0_GSUWGMRR0_K1_LBSPPA512_LBSPPB1024_LPB32_MIWT4_2_SU0_SUM0_SUS0_VWA4_VWB2_WGM8_WGMXCC1_WGMXCCGn1
    SolutionIndex: 18
    SolutionNameMin: Cijk_Alik_Bjlk_F8HS_BH_Bias_HAS_SAB_SAV_UserArgs_MT128x32x128_MI16x16x1_SN_GSU0_GSUC0_GSUWGMRR0_K1_LBSPPA512_LBSPPB512_LPB16_MIWT4_1_SU0_SUM0_SUS0_VWA4_VWB1_WGM8_WGMXCC1_WGMXCCGn1
    SolutionIndex: 19
    SolutionNameMin: Cijk_Alik_Bjlk_F8HS_BH_Bias_HAS_SAB_SAV_UserArgs_MT64x64x128_MI16x16x1_SN_GSU0_GSUC0_GSUWGMRR0_K1_LBSPPA256_LBSPPB1024_LPB32_MIWT2_2_SU0_SUM0_SUS0_VWA2_VWB2_WGM8_WGMXCC1_WGMXCCGn1
    SolutionIndex: 20
    SolutionNameMin: Cijk_Alik_Bjlk_F8HS_BH_Bias_HAS_SAB_SAV_UserArgs_MT64x64x128_MI16x16x1_SN_GSU0_GSUC0_GSUWGMRR0_K1_LBSPPA256_LBSPPB1024_LPB32_MIWT2_2_SU0_SUM0_SUS0_VWA2_VWB2_WGM8_WGMXCC1_WGMXCCGn1
    SolutionIndex: 21
    SolutionNameMin: Cijk_Alik_Bjlk_F8HS_BH_Bias_HAS_SAB_SAV_UserArgs_MT64x64x128_MI16x16x1_SN_GSU0_GSUC0_GSUWGMRR0_K1_LBSPPA256_LBSPPB1024_LPB32_MIWT2_2_SU0_SUM0_SUS0_VWA2_VWB2_WGM8_WGMXCC1_WGMXCCGn1
    SolutionIndex: 22
    SolutionNameMin: Cijk_Alik_Bjlk_F8HS_BH_Bias_HAS_SAB_SAV_UserArgs_MT32x64x128_MI16x16x1_SN_GSU0_GSUC0_GSUWGMRR0_K1_LBSPPA128_LBSPPB1024_LPB32_MIWT1_2_SU0_SUM0_SUS0_VWA1_VWB2_WGM8_WGMXCC1_WGMXCCGn1
    SolutionIndex: 23
    SolutionNameMin: Cijk_Alik_Bjlk_F8HS_BH_Bias_HAS_SAB_SAV_UserArgs_MT64x32x128_MI16x16x1_SN_GSU0_GSUC0_GSUWGMRR0_K1_LBSPPA256_LBSPPB512_LPB16_MIWT2_1_SU0_SUM0_SUS0_VWA2_VWB1_WGM8_WGMXCC1_WGMXCCGn1
    SolutionIndex: 24
    SolutionNameMin: Cijk_Alik_Bjlk_F8HS_BH_Bias_HAS_SAB_SAV_UserArgs_MT64x32x128_MI16x16x1_SN_GSU0_GSUC0_GSUWGMRR0_K1_LBSPPA256_LBSPPB512_LPB16_MIWT2_1_SU0_SUM0_SUS0_VWA2_VWB1_WGM8_WGMXCC1_WGMXCCGn1
    SolutionIndex: 25
    SolutionNameMin: Cijk_Alik_Bjlk_F8HS_BH_Bias_HAS_SAB_SAV_UserArgs_MT64x32x128_MI16x16x1_SN_GSU0_GSUC0_GSUWGMRR0_K1_LBSPPA256_LBSPPB512_LPB16_MIWT2_1_SU0_SUM0_SUS0_VWA2_VWB1_WGM8_WGMXCC1_WGMXCCGn1
    SolutionIndex: 26
    SolutionNameMin: Cijk_Alik_Bjlk_F8HS_BH_Bias_HAS_SAB_SAV_UserArgs_MT32x32x128_MI16x16x1_SN_GSU0_GSUC0_GSUWGMRR0_K1_LBSPPA128_LBSPPB512_LPB16_MIWT1_1_SU0_SUM0_SUS0_VWA1_VWB1_WGM8_WGMXCC1_WGMXCCGn1
    SolutionIndex: 27
    SolutionNameMin: Cijk_Alik_Bjlk_F8HS_BH_Bias_HAS_SAB_SAV_UserArgs_MT32x32x128_MI16x16x1_SN_GSU0_GSUC0_GSUWGMRR0_K1_LBSPPA128_LBSPPB512_LPB16_MIWT1_1_SU0_SUM0_SUS0_VWA1_VWB1_WGM8_WGMXCC1_WGMXCCGn1
    SolutionIndex: 28
    SolutionNameMin: Cijk_Alik_Bjlk_F8HS_BH_Bias_HAS_SAB_SAV_UserArgs_MT32x32x128_MI16x16x1_SN_GSU0_GSUC0_GSUWGMRR0_K1_LBSPPA128_LBSPPB512_LPB16_MIWT1_1_SU0_SUM0_SUS0_VWA1_VWB1_WGM8_WGMXCC1_WGMXCCGn1
    SolutionIndex: 29
    SolutionNameMin: Cijk_Alik_Bjlk_F8HS_BH_Bias_HAS_SAB_SAV_UserArgs_MT256x256x128_MI32x32x1_SN_GSU0_GSUC0_GSUWGMRR0_K1_LBSPPA512_LBSPPB0_LPB0_MIWT4_4_SU0_SUM0_SUS0_VWA4_VWB4_WGM8_WGMXCC1_WGMXCCGn1
    SolutionIndex: 30
    SolutionNameMin: Cijk_Alik_Bjlk_F8HS_BH_Bias_HAS_SAB_SAV_UserArgs_MT256x128x128_MI32x32x1_SN_GSU0_GSUC0_GSUWGMRR0_K1_LBSPPA512_LBSPPB0_LPB0_MIWT4_2_SU0_SUM0_SUS0_VWA4_VWB2_WGM8_WGMXCC1_WGMXCCGn1
    SolutionIndex: 31
    SolutionNameMin: Cijk_Alik_Bjlk_F8HS_BH_Bias_HAS_SAB_SAV_UserArgs_MT256x128x128_MI32x32x1_SN_GSU0_GSUC0_GSUWGMRR0_K1_LBSPPA512_LBSPPB0_LPB0_MIWT4_2_SU0_SUM0_SUS0_VWA4_VWB2_WGM8_WGMXCC1_WGMXCCGn1
    SolutionIndex: 32
    SolutionNameMin: Cijk_Alik_Bjlk_F8HS_BH_Bias_HAS_SAB_SAV_UserArgs_MT128x128x256_MI16x16x1_SN_GSU0_GSUC0_GSUWGMRR0_K1_LBSPPA1024_LBSPPB2048_LPB64_MIWT4_4_SU0_SUM0_SUS0_VWA4_VWB4_WGM8_WGMXCC1_WGMXCCGn1
    SolutionIndex: 33
    SolutionNameMin: Cijk_Alik_Bjlk_F8HS_BH_Bias_HAS_SAB_SAV_UserArgs_MT128x64x256_MI16x16x1_SN_GSU0_GSUC0_GSUWGMRR0_K1_LBSPPA1024_LBSPPB1024_LPB32_MIWT4_2_SU0_SUM0_SUS0_VWA4_VWB2_WGM8_WGMXCC1_WGMXCCGn1
    SolutionIndex: 34
    SolutionNameMin: Cijk_Alik_Bjlk_F8HS_BH_Bias_HAS_SAB_SAV_UserArgs_MT64x64x256_MI16x16x1_SN_GSU0_GSUC0_GSUWGMRR0_K1_LBSPPA512_LBSPPB1024_LPB32_MIWT2_2_SU0_SUM0_SUS0_VWA2_VWB2_WGM8_WGMXCC1_WGMXCCGn1
    SolutionIndex: 35
    SolutionNameMin: Cijk_Alik_Bjlk_F8HS_BH_Bias_HAS_SAB_SAV_UserArgs_MT32x64x256_MI16x16x1_SN_GSU0_GSUC0_GSUWGMRR0_K1_LBSPPA256_LBSPPB1024_LPB32_MIWT1_2_SU0_SUM0_SUS0_VWA1_VWB2_WGM8_WGMXCC1_WGMXCCGn1
    SolutionIndex: 36
    SolutionNameMin: Cijk_Alik_Bjlk_F8HS_BH_Bias_HAS_SAB_SAV_UserArgs_MT32x64x256_MI16x16x1_SN_GSU0_GSUC0_GSUWGMRR0_K1_LBSPPA256_LBSPPB1024_LPB32_MIWT1_2_SU0_SUM0_SUS0_VWA1_VWB2_WGM8_WGMXCC1_WGMXCCGn1
    SolutionIndex: 37
    SolutionNameMin: Cijk_Alik_Bjlk_F8HS_BH_Bias_HAS_SAB_SAV_UserArgs_MT64x32x256_MI16x16x1_SN_GSU0_GSUC0_GSUWGMRR0_K1_LBSPPA512_LBSPPB512_LPB16_MIWT2_1_SU0_SUM0_SUS0_VWA2_VWB1_WGM8_WGMXCC1_WGMXCCGn1
    SolutionIndex: 38
    SolutionNameMin: Cijk_Alik_Bjlk_F8HS_BH_Bias_HAS_SAB_SAV_UserArgs_MT64x32x256_MI16x16x1_SN_GSU0_GSUC0_GSUWGMRR0_K1_LBSPPA512_LBSPPB512_LPB16_MIWT2_1_SU0_SUM0_SUS0_VWA2_VWB1_WGM8_WGMXCC1_WGMXCCGn1
    SolutionIndex: 39
    SolutionNameMin: Cijk_Alik_Bjlk_F8HS_BH_Bias_HAS_SAB_SAV_UserArgs_MT64x32x256_MI16x16x1_SN_GSU0_GSUC0_GSUWGMRR0_K1_LBSPPA512_LBSPPB512_LPB16_MIWT2_1_SU0_SUM0_SUS0_VWA2_VWB1_WGM8_WGMXCC1_WGMXCCGn1
    SolutionIndex: 40
    SolutionNameMin: Cijk_Alik_Bjlk_F8HS_BH_Bias_HAS_SAB_SAV_UserArgs_MT64x32x256_MI16x16x1_SN_GSU0_GSUC0_GSUWGMRR0_K1_LBSPPA512_LBSPPB512_LPB16_MIWT2_1_SU0_SUM0_SUS0_VWA2_VWB1_WGM8_WGMXCC1_WGMXCCGn1
    SolutionIndex: 41
    SolutionNameMin: Cijk_Alik_Bjlk_F8HS_BH_Bias_HAS_SAB_SAV_UserArgs_MT32x32x256_MI16x16x1_SN_GSU0_GSUC0_GSUWGMRR0_K1_LBSPPA256_LBSPPB512_LPB16_MIWT1_1_SU0_SUM0_SUS0_VWA1_VWB1_WGM8_WGMXCC1_WGMXCCGn1
    SolutionIndex: 42
    SolutionNameMin: Cijk_Alik_Bjlk_F8HS_BH_Bias_HAS_SAB_SAV_UserArgs_MT32x32x256_MI16x16x1_SN_GSU0_GSUC0_GSUWGMRR0_K1_LBSPPA256_LBSPPB512_LPB16_MIWT1_1_SU0_SUM0_SUS0_VWA1_VWB1_WGM8_WGMXCC1_WGMXCCGn1
    SolutionIndex: 43
    SolutionNameMin: Cijk_Alik_Bjlk_F8HS_BH_Bias_HAS_SAB_SAV_UserArgs_MT32x32x256_MI16x16x1_SN_GSU0_GSUC0_GSUWGMRR0_K1_LBSPPA256_LBSPPB512_LPB16_MIWT1_1_SU0_SUM0_SUS0_VWA1_VWB1_WGM8_WGMXCC1_WGMXCCGn1
    SolutionIndex: 44
    SolutionNameMin: Cijk_Alik_Bjlk_F8HS_BH_Bias_HAS_SAB_SAV_UserArgs_MT32x32x256_MI16x16x1_SN_GSU0_GSUC0_GSUWGMRR0_K1_LBSPPA256_LBSPPB512_LPB16_MIWT1_1_SU0_SUM0_SUS0_VWA1_VWB1_WGM8_WGMXCC1_WGMXCCGn1
    SolutionIndex: 45
    SolutionNameMin: Cijk_Alik_Bjlk_F8HS_BH_Bias_HAS_SAB_SAV_UserArgs_MT32x32x256_MI16x16x1_SN_GSU0_GSUC0_GSUWGMRR0_K1_LBSPPA256_LBSPPB512_LPB16_MIWT1_1_SU0_SUM0_SUS0_VWA1_VWB1_WGM8_WGMXCC1_WGMXCCGn1
    SolutionIndex: 46
    SolutionNameMin: Cijk_Alik_Bjlk_F8HS_BH_Bias_HAS_SAB_SAV_UserArgs_MT32x32x256_MI16x16x1_SN_GSU0_GSUC0_GSUWGMRR0_K1_LBSPPA256_LBSPPB512_LPB16_MIWT1_1_SU0_SUM0_SUS0_VWA1_VWB1_WGM8_WGMXCC1_WGMXCCGn1
    SolutionIndex: 47
    SolutionNameMin: Cijk_Alik_Bjlk_F8HS_BH_Bias_HAS_SAB_SAV_UserArgs_MT32x32x256_MI16x16x1_SN_GSU0_GSUC0_GSUWGMRR0_K1_LBSPPA256_LBSPPB512_LPB16_MIWT1_1_SU0_SUM0_SUS0_VWA1_VWB1_WGM8_WGMXCC1_WGMXCCGn1
    SolutionIndex: 48
    SolutionNameMin: Cijk_Alik_Bjlk_F8HS_BH_Bias_HAS_SAB_SAV_UserArgs_MT32x32x128_MI16x16x1_SN_GSU0_GSUC0_GSUWGMRR0_K1_LBSPPA128_LBSPPB256_LPB16_MIWT1_1_SU32_SUM0_SUS256_VWA1_VWB1_WGM8_WGMXCC1_WGMXCCGn1
- - - [128, 128, 1, 128, 128, 128, 128, 128]
    - [28, 0.42]
  - - [128, 128, 1, 256, 128, 128, 256, 128]
    - [42, 0.76]
  - - [128, 128, 1, 512, 128, 128, 512, 128]
    - [42, 1.3]
  - - [128, 128, 1, 1024, 128, 128, 1024, 128]
    - [44, 2.17]
  - - [128, 128, 1, 2048, 128, 128, 2048, 128]
    - [47, 3.23]
  - - [128, 128, 1, 4096, 128, 128, 4096, 128]
    - [47, 4.23]
  - - [128, 128, 1, 8192, 128, 128, 8192, 128]
    - [46, 5.01]
  - - [128, 256, 1, 128, 128, 128, 128, 256]
    - [28, 0.84]
  - - [128, 256, 1, 256, 128, 128, 256, 256]
    - [44, 1.5]
  - - [128, 256, 1, 512, 128, 128, 512, 256]
    - [44, 2.59]
  - - [128, 256, 1, 1024, 128, 128, 1024, 256]
    - [44, 4.33]
  - - [128, 256, 1, 2048, 128, 128, 2048, 256]
    - [46, 6.4]
  - - [128, 256, 1, 4096, 128, 128, 4096, 256]
    - [46, 8.54]
  - - [128, 256, 1, 8192, 128, 128, 8192, 256]
    - [47, 10.21]
  - - [128, 512, 1, 128, 128, 128, 128, 512]
    - [26, 1.66]
  - - [128, 512, 1, 256, 128, 128, 256, 512]
    - [44, 3.02]
  - - [128, 512, 1, 512, 128, 128, 512, 512]
    - [44, 5.22]
  - - [128, 512, 1, 1024, 128, 128, 1024, 512]
    - [44, 8.65]
  - - [128, 512, 1, 2048, 128, 128, 2048, 512]
    - [44, 12.87]
  - - [128, 512, 1, 4096, 128, 128, 4096, 512]
    - [46, 16.63]
  - - [128, 512, 1, 8192, 128, 128, 8192, 512]
    - [47, 19.72]
  - - [128, 1024, 1, 128, 128, 128, 128, 1024]
    - [27, 3.22]
  - - [128, 1024, 1, 256, 128, 128, 256, 1024]
    - [44, 5.89]
  - - [128, 1024, 1, 512, 128, 128, 512, 1024]
    - [44, 10.22]
  - - [128, 1024, 1, 1024, 128, 128, 1024, 1024]
    - [44, 16.63]
  - - [128, 1024, 1, 2048, 128, 128, 2048, 1024]
    - [46, 23.74]
  - - [128, 1024, 1, 4096, 128, 128, 4096, 1024]
    - [44, 31.51]
  - - [128, 1024, 1, 8192, 128, 128, 8192, 1024]
    - [45, 36.61]
  - - [128, 2048, 1, 128, 128, 128, 128, 2048]
    - [28, 6.28]
  - - [128, 2048, 1, 256, 128, 128, 256, 2048]
    - [44, 11.37]
  - - [128, 2048, 1, 512, 128, 128, 512, 2048]
    - [44, 19.53]
  - - [128, 2048, 1, 1024, 128, 128, 1024, 2048]
    - [43, 31.83]
  - - [128, 2048, 1, 2048, 128, 128, 2048, 2048]
    - [44, 46.95]
  - - [128, 2048, 1, 4096, 128, 128, 4096, 2048]
    - [46, 59.8]
  - - [128, 2048, 1, 8192, 128, 128, 8192, 2048]
    - [46, 70.35]
  - - [128, 4096, 1, 128, 128, 128, 128, 4096]
    - [24, 11.93]
  - - [128, 4096, 1, 256, 128, 128, 256, 4096]
    - [24, 21.38]
  - - [128, 4096, 1, 512, 128, 128, 512, 4096]
    - [24, 36.27]
  - - [128, 4096, 1, 1024, 128, 128, 1024, 4096]
    - [40, 57.56]
  - - [128, 4096, 1, 2048, 128, 128, 2048, 4096]
    - [40, 81.2]
  - - [128, 4096, 1, 4096, 128, 128, 4096, 4096]
    - [40, 103.69]
  - - [128, 4096, 1, 8192, 128, 128, 8192, 4096]
    - [36, 110.98]
  - - [128, 8192, 1, 128, 128, 128, 128, 8192]
    - [20, 22.0]
  - - [128, 8192, 1, 256, 128, 128, 256, 8192]
    - [20, 39.19]
  - - [128, 8192, 1, 512, 128, 128, 512, 8192]
    - [20, 66.86]
  - - [128, 8192, 1, 1024, 128, 128, 1024, 8192]
    - [20, 102.47]
  - - [128, 8192, 1, 2048, 128, 128, 2048, 8192]
    - [34, 143.98]
  - - [128, 8192, 1, 4096, 128, 128, 4096, 8192]
    - [34, 172.27]
  - - [128, 8192, 1, 8192, 128, 128, 8192, 8192]
    - [34, 197.12]
  - - [256, 128, 1, 128, 256, 256, 128, 128]
    - [27, 0.83]
  - - [256, 128, 1, 256, 256, 256, 256, 128]
    - [43, 1.49]
  - - [256, 128, 1, 512, 256, 256, 512, 128]
    - [42, 2.61]
  - - [256, 128, 1, 1024, 256, 256, 1024, 128]
    - [47, 4.33]
  - - [256, 128, 1, 2048, 256, 256, 2048, 128]
    - [47, 6.45]
  - - [256, 128, 1, 4096, 256, 256, 4096, 128]
    - [47, 8.61]
  - - [256, 128, 1, 8192, 256, 256, 8192, 128]
    - [47, 10.15]
  - - [256, 256, 1, 128, 256, 256, 128, 256]
    - [27, 1.65]
  - - [256, 256, 1, 256, 256, 256, 256, 256]
    - [44, 3.0]
  - - [256, 256, 1, 512, 256, 256, 512, 256]
    - [44, 5.28]
  - - [256, 256, 1, 1024, 256, 256, 1024, 256]
    - [44, 8.8]
  - - [256, 256, 1, 2048, 256, 256, 2048, 256]
    - [44, 12.95]
  - - [256, 256, 1, 4096, 256, 256, 4096, 256]
    - [47, 17.12]
  - - [256, 256, 1, 8192, 256, 256, 8192, 256]
    - [47, 20.64]
  - - [256, 512, 1, 128, 256, 256, 128, 512]
    - [28, 3.27]
  - - [256, 512, 1, 256, 256, 256, 256, 512]
    - [44, 5.99]
  - - [256, 512, 1, 512, 256, 256, 512, 512]
    - [44, 10.46]
  - - [256, 512, 1, 1024, 256, 256, 1024, 512]
    - [44, 17.48]
  - - [256, 512, 1, 2048, 256, 256, 2048, 512]
    - [44, 25.62]
  - - [256, 512, 1, 4096, 256, 256, 4096, 512]
    - [47, 33.84]
  - - [256, 512, 1, 8192, 256, 256, 8192, 512]
    - [47, 39.87]
  - - [256, 1024, 1, 128, 256, 256, 128, 1024]
    - [28, 6.34]
  - - [256, 1024, 1, 256, 256, 256, 256, 1024]
    - [44, 11.61]
  - - [256, 1024, 1, 512, 256, 256, 512, 1024]
    - [44, 20.03]
  - - [256, 1024, 1, 1024, 256, 256, 1024, 1024]
    - [44, 32.71]
  - - [256, 1024, 1, 2048, 256, 256, 2048, 1024]
    - [47, 47.89]
  - - [256, 1024, 1, 4096, 256, 256, 4096, 1024]
    - [47, 62.08]
  - - [256, 1024, 1, 8192, 256, 256, 8192, 1024]
    - [46, 72.3]
  - - [256, 2048, 1, 128, 256, 256, 128, 2048]
    - [23, 12.09]
  - - [256, 2048, 1, 256, 256, 256, 256, 2048]
    - [22, 21.39]
  - - [256, 2048, 1, 512, 256, 256, 512, 2048]
    - [24, 36.76]
  - - [256, 2048, 1, 1024, 256, 256, 1024, 2048]
    - [40, 59.64]
  - - [256, 2048, 1, 2048, 256, 256, 2048, 2048]
    - [40, 86.29]
  - - [256, 2048, 1, 4096, 256, 256, 4096, 2048]
    - [40, 110.19]
  - - [256, 2048, 1, 8192, 256, 256, 8192, 2048]
    - [40, 124.04]
  - - [256, 4096, 1, 128, 256, 256, 128, 4096]
    - [20, 22.19]
  - - [256, 4096, 1, 256, 256, 256, 256, 4096]
    - [20, 39.64]
  - - [256, 4096, 1, 512, 256, 256, 512, 4096]
    - [20, 67.67]
  - - [256, 4096, 1, 1024, 256, 256, 1024, 4096]
    - [20, 103.08]
  - - [256, 4096, 1, 2048, 256, 256, 2048, 4096]
    - [34, 146.88]
  - - [256, 4096, 1, 4096, 256, 256, 4096, 4096]
    - [34, 187.19]
  - - [256, 4096, 1, 8192, 256, 256, 8192, 4096]
    - [34, 203.0]
  - - [256, 8192, 1, 128, 256, 256, 128, 8192]
    - [14, 38.0]
  - - [256, 8192, 1, 256, 256, 256, 256, 8192]
    - [14, 67.61]
  - - [256, 8192, 1, 512, 256, 256, 512, 8192]
    - [15, 115.73]
  - - [256, 8192, 1, 1024, 256, 256, 1024, 8192]
    - [17, 180.38]
  - - [256, 8192, 1, 2048, 256, 256, 2048, 8192]
    - [17, 247.26]
  - - [256, 8192, 1, 4096, 256, 256, 4096, 8192]
    - [16, 293.69]
  - - [256, 8192, 1, 8192, 256, 256, 8192, 8192]
    - [33, 338.97]
  - - [512, 128, 1, 128, 512, 512, 128, 128]
    - [28, 1.66]
  - - [512, 128, 1, 256, 512, 512, 256, 128]
    - [42, 3.02]
  - - [512, 128, 1, 512, 512, 512, 512, 128]
    - [42, 5.29]
  - - [512, 128, 1, 1024, 512, 512, 1024, 128]
    - [44, 8.8]
  - - [512, 128, 1, 2048, 512, 512, 2048, 128]
    - [44, 13.09]
  - - [512, 128, 1, 4096, 512, 512, 4096, 128]
    - [47, 17.27]
  - - [512, 128, 1, 8192, 512, 512, 8192, 128]
    - [47, 20.49]
  - - [512, 256, 1, 128, 512, 512, 128, 256]
    - [28, 3.27]
  - - [512, 256, 1, 256, 512, 512, 256, 256]
    - [41, 5.95]
  - - [512, 256, 1, 512, 512, 512, 512, 256]
    - [42, 10.4]
  - - [512, 256, 1, 1024, 512, 512, 1024, 256]
    - [44, 17.42]
  - - [512, 256, 1, 2048, 512, 512, 2048, 256]
    - [44, 25.67]
  - - [512, 256, 1, 4096, 512, 512, 4096, 256]
    - [47, 34.17]
  - - [512, 256, 1, 8192, 512, 512, 8192, 256]
    - [47, 41.19]
  - - [512, 512, 1, 128, 512, 512, 128, 512]
    - [28, 6.47]
  - - [512, 512, 1, 256, 512, 512, 256, 512]
    - [42, 11.76]
  - - [512, 512, 1, 512, 512, 512, 512, 512]
    - [44, 20.5]
  - - [512, 512, 1, 1024, 512, 512, 1024, 512]
    - [44, 34.12]
  - - [512, 512, 1, 2048, 512, 512, 2048, 512]
    - [44, 50.26]
  - - [512, 512, 1, 4096, 512, 512, 4096, 512]
    - [47, 65.83]
  - - [512, 512, 1, 8192, 512, 512, 8192, 512]
    - [47, 78.67]
  - - [512, 1024, 1, 128, 512, 512, 128, 1024]
    - [22, 12.12]
  - - [512, 1024, 1, 256, 512, 512, 256, 1024]
    - [24, 21.81]
  - - [512, 1024, 1, 512, 512, 512, 512, 1024]
    - [24, 37.67]
  - - [512, 1024, 1, 1024, 512, 512, 1024, 1024]
    - [40, 60.98]
  - - [512, 1024, 1, 2048, 512, 512, 2048, 1024]
    - [40, 89.41]
  - - [512, 1024, 1, 4096, 512, 512, 4096, 1024]
    - [40, 112.81]
  - - [512, 1024, 1, 8192, 512, 512, 8192, 1024]
    - [40, 127.86]
  - - [512, 2048, 1, 128, 512, 512, 128, 2048]
    - [19, 22.44]
  - - [512, 2048, 1, 256, 512, 512, 256, 2048]
    - [20, 39.76]
  - - [512, 2048, 1, 512, 512, 512, 512, 2048]
    - [20, 68.58]
  - - [512, 2048, 1, 1024, 512, 512, 1024, 2048]
    - [20, 105.69]
  - - [512, 2048, 1, 2048, 512, 512, 2048, 2048]
    - [34, 149.19]
  - - [512, 2048, 1, 4096, 512, 512, 4096, 2048]
    - [34, 188.55]
  - - [512, 2048, 1, 8192, 512, 512, 8192, 2048]
    - [34, 215.81]
  - - [512, 4096, 1, 128, 512, 512, 128, 4096]
    - [14, 38.18]
  - - [512, 4096, 1, 256, 512, 512, 256, 4096]
    - [14, 68.2]
  - - [512, 4096, 1, 512, 512, 512, 512, 4096]
    - [14, 116.3]
  - - [512, 4096, 1, 1024, 512, 512, 1024, 4096]
    - [17, 180.13]
  - - [512, 4096, 1, 2048, 512, 512, 2048, 4096]
    - [33, 249.85]
  - - [512, 4096, 1, 4096, 512, 512, 4096, 4096]
    - [33, 313.81]
  - - [512, 4096, 1, 8192, 512, 512, 8192, 4096]
    - [33, 341.98]
  - - [512, 8192, 1, 128, 512, 512, 128, 8192]
    - [11, 59.81]
  - - [512, 8192, 1, 256, 512, 512, 256, 8192]
    - [13, 106.3]
  - - [512, 8192, 1, 512, 512, 512, 512, 8192]
    - [11, 177.55]
  - - [512, 8192, 1, 1024, 512, 512, 1024, 8192]
    - [11, 266.66]
  - - [512, 8192, 1, 2048, 512, 512, 2048, 8192]
    - [12, 358.06]
  - - [512, 8192, 1, 4096, 512, 512, 4096, 8192]
    - [13, 435.89]
  - - [512, 8192, 1, 8192, 512, 512, 8192, 8192]
    - [32, 466.16]
  - - [1024, 128, 1, 128, 1024, 1024, 128, 128]
    - [28, 3.23]
  - - [1024, 128, 1, 256, 1024, 1024, 256, 128]
    - [41, 5.97]
  - - [1024, 128, 1, 512, 1024, 1024, 512, 128]
    - [42, 10.39]
  - - [1024, 128, 1, 1024, 1024, 1024, 1024, 128]
    - [44, 17.45]
  - - [1024, 128, 1, 2048, 1024, 1024, 2048, 128]
    - [47, 25.57]
  - - [1024, 128, 1, 4096, 1024, 1024, 4096, 128]
    - [47, 34.12]
  - - [1024, 128, 1, 8192, 1024, 1024, 8192, 128]
    - [47, 40.76]
  - - [1024, 256, 1, 128, 1024, 1024, 128, 256]
    - [28, 6.39]
  - - [1024, 256, 1, 256, 1024, 1024, 256, 256]
    - [44, 11.74]
  - - [1024, 256, 1, 512, 1024, 1024, 512, 256]
    - [44, 20.39]
  - - [1024, 256, 1, 1024, 1024, 1024, 1024, 256]
    - [44, 33.76]
  - - [1024, 256, 1, 2048, 1024, 1024, 2048, 256]
    - [44, 50.01]
  - - [1024, 256, 1, 4096, 1024, 1024, 4096, 256]
    - [47, 65.8]
  - - [1024, 256, 1, 8192, 1024, 1024, 8192, 256]
    - [47, 79.28]
  - - [1024, 512, 1, 128, 1024, 1024, 128, 512]
    - [24, 12.29]
  - - [1024, 512, 1, 256, 1024, 1024, 256, 512]
    - [37, 21.9]
  - - [1024, 512, 1, 512, 1024, 1024, 512, 512]
    - [39, 37.67]
  - - [1024, 512, 1, 1024, 1024, 1024, 1024, 512]
    - [39, 62.18]
  - - [1024, 512, 1, 2048, 1024, 1024, 2048, 512]
    - [40, 91.59]
  - - [1024, 512, 1, 4096, 1024, 1024, 4096, 512]
    - [40, 119.2]
  - - [1024, 512, 1, 8192, 1024, 1024, 8192, 512]
    - [40, 140.87]
  - - [1024, 1024, 1, 128, 1024, 1024, 128, 1024]
    - [19, 22.48]
  - - [1024, 1024, 1, 256, 1024, 1024, 256, 1024]
    - [20, 40.01]
  - - [1024, 1024, 1, 512, 1024, 1024, 512, 1024]
    - [20, 68.76]
  - - [1024, 1024, 1, 1024, 1024, 1024, 1024, 1024]
    - [34, 107.17]
  - - [1024, 1024, 1, 2048, 1024, 1024, 2048, 1024]
    - [34, 152.05]
  - - [1024, 1024, 1, 4096, 1024, 1024, 4096, 1024]
    - [34, 190.07]
  - - [1024, 1024, 1, 8192, 1024, 1024, 8192, 1024]
    - [34, 219.43]
  - - [1024, 2048, 1, 128, 1024, 1024, 128, 2048]
    - [14, 38.23]
  - - [1024, 2048, 1, 256, 1024, 1024, 256, 2048]
    - [14, 68.15]
  - - [1024, 2048, 1, 512, 1024, 1024, 512, 2048]
    - [14, 116.51]
  - - [1024, 2048, 1, 1024, 1024, 1024, 1024, 2048]
    - [17, 181.71]
  - - [1024, 2048, 1, 2048, 1024, 1024, 2048, 2048]
    - [33, 254.19]
  - - [1024, 2048, 1, 4096, 1024, 1024, 4096, 2048]
    - [33, 320.45]
  - - [1024, 2048, 1, 8192, 1024, 1024, 8192, 2048]
    - [33, 358.71]
  - - [1024, 4096, 1, 128, 1024, 1024, 128, 4096]
    - [11, 59.92]
  - - [1024, 4096, 1, 256, 1024, 1024, 256, 4096]
    - [13, 107.55]
  - - [1024, 4096, 1, 512, 1024, 1024, 512, 4096]
    - [13, 181.58]
  - - [1024, 4096, 1, 1024, 1024, 1024, 1024, 4096]
    - [13, 276.96]
  - - [1024, 4096, 1, 2048, 1024, 1024, 2048, 4096]
    - [13, 368.57]
  - - [1024, 4096, 1, 4096, 1024, 1024, 4096, 4096]
    - [13, 450.97]
  - - [1024, 4096, 1, 8192, 1024, 1024, 8192, 4096]
    - [32, 474.26]
  - - [1024, 8192, 1, 128, 1024, 1024, 128, 8192]
    - [9, 77.54]
  - - [1024, 8192, 1, 256, 1024, 1024, 256, 8192]
    - [10, 135.16]
  - - [1024, 8192, 1, 512, 1024, 1024, 512, 8192]
    - [10, 238.13]
  - - [1024, 8192, 1, 1024, 1024, 1024, 1024, 8192]
    - [10, 366.27]
  - - [1024, 8192, 1, 2048, 1024, 1024, 2048, 8192]
    - [10, 495.38]
  - - [1024, 8192, 1, 4096, 1024, 1024, 4096, 8192]
    - [10, 576.15]
  - - [1024, 8192, 1, 8192, 1024, 1024, 8192, 8192]
    - [10, 559.72]
  - - [2048, 128, 1, 128, 2048, 2048, 128, 128]
    - [28, 6.42]
  - - [2048, 128, 1, 256, 2048, 2048, 256, 128]
    - [44, 11.74]
  - - [2048, 128, 1, 512, 2048, 2048, 512, 128]
    - [44, 20.13]
  - - [2048, 128, 1, 1024, 2048, 2048, 1024, 128]
    - [42, 33.08]
  - - [2048, 128, 1, 2048, 2048, 2048, 2048, 128]
    - [47, 49.08]
  - - [2048, 128, 1, 4096, 2048, 2048, 4096, 128]
    - [47, 65.28]
  - - [2048, 128, 1, 8192, 2048, 2048, 8192, 128]
    - [47, 78.54]
  - - [2048, 256, 1, 128, 2048, 2048, 128, 256]
    - [24, 12.23]
  - - [2048, 256, 1, 256, 2048, 2048, 256, 256]
    - [38, 21.73]
  - - [2048, 256, 1, 512, 2048, 2048, 512, 256]
    - [39, 37.19]
  - - [2048, 256, 1, 1024, 2048, 2048, 1024, 256]
    - [39, 61.67]
  - - [2048, 256, 1, 2048, 2048, 2048, 2048, 256]
    - [40, 90.4]
  - - [2048, 256, 1, 4096, 2048, 2048, 4096, 256]
    - [40, 118.51]
  - - [2048, 256, 1, 8192, 2048, 2048, 8192, 256]
    - [40, 140.33]
  - - [2048, 512, 1, 128, 2048, 2048, 128, 512]
    - [21, 22.34]
  - - [2048, 512, 1, 256, 2048, 2048, 256, 512]
    - [18, 39.66]
  - - [2048, 512, 1, 512, 2048, 2048, 512, 512]
    - [18, 68.5]
  - - [2048, 512, 1, 1024, 2048, 2048, 1024, 512]
    - [34, 107.26]
  - - [2048, 512, 1, 2048, 2048, 2048, 2048, 512]
    - [34, 154.11]
  - - [2048, 512, 1, 4096, 2048, 2048, 4096, 512]
    - [34, 196.01]
  - - [2048, 512, 1, 8192, 2048, 2048, 8192, 512]
    - [34, 227.55]
  - - [2048, 1024, 1, 128, 2048, 2048, 128, 1024]
    - [14, 38.63]
  - - [2048, 1024, 1, 256, 2048, 2048, 256, 1024]
    - [14, 68.48]
  - - [2048, 1024, 1, 512, 2048, 2048, 512, 1024]
    - [17, 117.18]
  - - [2048, 1024, 1, 1024, 2048, 2048, 1024, 1024]
    - [17, 181.69]
  - - [2048, 1024, 1, 2048, 2048, 2048, 2048, 1024]
    - [17, 251.47]
  - - [2048, 1024, 1, 4096, 2048, 2048, 4096, 1024]
    - [33, 319.0]
  - - [2048, 1024, 1, 8192, 2048, 2048, 8192, 1024]
    - [33, 360.41]
  - - [2048, 2048, 1, 128, 2048, 2048, 128, 2048]
    - [11, 59.64]
  - - [2048, 2048, 1, 256, 2048, 2048, 256, 2048]
    - [13, 106.04]
  - - [2048, 2048, 1, 512, 2048, 2048, 512, 2048]
    - [13, 181.23]
  - - [2048, 2048, 1, 1024, 2048, 2048, 1024, 2048]
    - [13, 274.49]
  - - [2048, 2048, 1, 2048, 2048, 2048, 2048, 2048]
    - [13, 374.9]
  - - [2048, 2048, 1, 4096, 2048, 2048, 4096, 2048]
    - [13, 443.63]
  - - [2048, 2048, 1, 8192, 2048, 2048, 8192, 2048]
    - [13, 458.37]
  - - [2048, 4096, 1, 128, 2048, 2048, 128, 4096]
    - [7, 77.42]
  - - [2048, 4096, 1, 256, 2048, 2048, 256, 4096]
    - [10, 136.16]
  - - [2048, 4096, 1, 512, 2048, 2048, 512, 4096]
    - [10, 231.97]
  - - [2048, 4096, 1, 1024, 2048, 2048, 1024, 4096]
    - [10, 361.12]
  - - [2048, 4096, 1, 2048, 2048, 2048, 2048, 4096]
    - [10, 487.34]
  - - [2048, 4096, 1, 4096, 2048, 2048, 4096, 4096]
    - [10, 584.45]
  - - [2048, 4096, 1, 8192, 2048, 2048, 8192, 4096]
    - [10, 551.38]
  - - [2048, 8192, 1, 128, 2048, 2048, 128, 8192]
    - [10, 90.0]
  - - [2048, 8192, 1, 256, 2048, 2048, 256, 8192]
    - [10, 157.51]
  - - [2048, 8192, 1, 512, 2048, 2048, 512, 8192]
    - [8, 253.62]
  - - [2048, 8192, 1, 1024, 2048, 2048, 1024, 8192]
    - [10, 396.29]
  - - [2048, 8192, 1, 2048, 2048, 2048, 2048, 8192]
    - [29, 542.27]
  - - [2048, 8192, 1, 4096, 2048, 2048, 4096, 8192]
    - [29, 684.34]
  - - [2048, 8192, 1, 8192, 2048, 2048, 8192, 8192]
    - [29, 698.2]
  - - [4096, 128, 1, 128, 4096, 4096, 128, 128]
    - [25, 11.99]
  - - [4096, 128, 1, 256, 4096, 4096, 256, 128]
    - [35, 21.63]
  - - [4096, 128, 1, 512, 4096, 4096, 512, 128]
    - [39, 36.99]
  - - [4096, 128, 1, 1024, 4096, 4096, 1024, 128]
    - [39, 60.26]
  - - [4096, 128, 1, 2048, 4096, 4096, 2048, 128]
    - [39, 89.02]
  - - [4096, 128, 1, 4096, 4096, 4096, 4096, 128]
    - [40, 117.19]
  - - [4096, 128, 1, 8192, 4096, 4096, 8192, 128]
    - [40, 134.9]
  - - [4096, 256, 1, 128, 4096, 4096, 128, 256]
    - [19, 22.3]
  - - [4096, 256, 1, 256, 4096, 4096, 256, 256]
    - [20, 39.84]
  - - [4096, 256, 1, 512, 4096, 4096, 512, 256]
    - [20, 67.86]
  - - [4096, 256, 1, 1024, 4096, 4096, 1024, 256]
    - [34, 107.25]
  - - [4096, 256, 1, 2048, 4096, 4096, 2048, 256]
    - [34, 155.62]
  - - [4096, 256, 1, 4096, 4096, 4096, 4096, 256]
    - [34, 200.03]
  - - [4096, 256, 1, 8192, 4096, 4096, 8192, 256]
    - [34, 231.22]
  - - [4096, 512, 1, 128, 4096, 4096, 128, 512]
    - [14, 38.43]
  - - [4096, 512, 1, 256, 4096, 4096, 256, 512]
    - [14, 68.16]
  - - [4096, 512, 1, 512, 4096, 4096, 512, 512]
    - [14, 116.26]
  - - [4096, 512, 1, 1024, 4096, 4096, 1024, 512]
    - [17, 181.14]
  - - [4096, 512, 1, 2048, 4096, 4096, 2048, 512]
    - [33, 257.22]
  - - [4096, 512, 1, 4096, 4096, 4096, 4096, 512]
    - [33, 316.6]
  - - [4096, 512, 1, 8192, 4096, 4096, 8192, 512]
    - [33, 352.73]
  - - [4096, 1024, 1, 128, 4096, 4096, 128, 1024]
    - [11, 59.76]
  - - [4096, 1024, 1, 256, 4096, 4096, 256, 1024]
    - [13, 106.43]
  - - [4096, 1024, 1, 512, 4096, 4096, 512, 1024]
    - [13, 181.33]
  - - [4096, 1024, 1, 1024, 4096, 4096, 1024, 1024]
    - [13, 275.04]
  - - [4096, 1024, 1, 2048, 4096, 4096, 2048, 1024]
    - [13, 374.46]
  - - [4096, 1024, 1, 4096, 4096, 4096, 4096, 1024]
    - [13, 450.05]
  - - [4096, 1024, 1, 8192, 4096, 4096, 8192, 1024]
    - [12, 454.63]
  - - [4096, 2048, 1, 128, 4096, 4096, 128, 2048]
    - [9, 77.25]
  - - [4096, 2048, 1, 256, 4096, 4096, 256, 2048]
    - [8, 134.28]
  - - [4096, 2048, 1, 512, 4096, 4096, 512, 2048]
    - [10, 231.74]
  - - [4096, 2048, 1, 1024, 4096, 4096, 1024, 2048]
    - [10, 358.18]
  - - [4096, 2048, 1, 2048, 4096, 4096, 2048, 2048]
    - [10, 495.82]
  - - [4096, 2048, 1, 4096, 4096, 4096, 4096, 2048]
    - [10, 568.43]
  - - [4096, 2048, 1, 8192, 4096, 4096, 8192, 2048]
    - [30, 553.65]
  - - [4096, 4096, 1, 128, 4096, 4096, 128, 4096]
    - [5, 94.74]
  - - [4096, 4096, 1, 256, 4096, 4096, 256, 4096]
    - [10, 156.9]
  - - [4096, 4096, 1, 512, 4096, 4096, 512, 4096]
    - [8, 257.74]
  - - [4096, 4096, 1, 1024, 4096, 4096, 1024, 4096]
    - [10, 395.33]
  - - [4096, 4096, 1, 2048, 4096, 4096, 2048, 4096]
    - [3, 545.62]
  - - [4096, 4096, 1, 4096, 4096, 4096, 4096, 4096]
    - [29, 649.16]
  - - [4096, 4096, 1, 8192, 4096, 4096, 8192, 4096]
    - [29, 687.25]
  - - [4096, 8192, 1, 128, 4096, 4096, 128, 8192]
    - [1, 106.39]
  - - [4096, 8192, 1, 256, 4096, 4096, 256, 8192]
    - [1, 180.12]
  - - [4096, 8192, 1, 512, 4096, 4096, 512, 8192]
    - [0, 294.13]
  - - [4096, 8192, 1, 1024, 4096, 4096, 1024, 8192]
    - [5, 454.96]
  - - [4096, 8192, 1, 2048, 4096, 4096, 2048, 8192]
    - [29, 572.68]
  - - [4096, 8192, 1, 4096, 4096, 4096, 4096, 8192]
    - [29, 646.45]
  - - [4096, 8192, 1, 8192, 4096, 4096, 8192, 8192]
    - [29, 725.7]
  - - [8192, 128, 1, 128, 8192, 8192, 128, 128]
    - [20, 22.2]
  - - [8192, 128, 1, 256, 8192, 8192, 256, 128]
    - [20, 39.06]
  - - [8192, 128, 1, 512, 8192, 8192, 512, 128]
    - [20, 65.64]
  - - [8192, 128, 1, 1024, 8192, 8192, 1024, 128]
    - [34, 105.13]
  - - [8192, 128, 1, 2048, 8192, 8192, 2048, 128]
    - [34, 154.49]
  - - [8192, 128, 1, 4096, 8192, 8192, 4096, 128]
    - [34, 194.25]
  - - [8192, 128, 1, 8192, 8192, 8192, 8192, 128]
    - [34, 224.47]
  - - [8192, 256, 1, 128, 8192, 8192, 128, 256]
    - [14, 38.22]
  - - [8192, 256, 1, 256, 8192, 8192, 256, 256]
    - [14, 68.43]
  - - [8192, 256, 1, 512, 8192, 8192, 512, 256]
    - [14, 116.36]
  - - [8192, 256, 1, 1024, 8192, 8192, 1024, 256]
    - [17, 180.48]
  - - [8192, 256, 1, 2048, 8192, 8192, 2048, 256]
    - [17, 244.48]
  - - [8192, 256, 1, 4096, 8192, 8192, 4096, 256]
    - [17, 296.35]
  - - [8192, 256, 1, 8192, 8192, 8192, 8192, 256]
    - [33, 352.46]
  - - [8192, 512, 1, 128, 8192, 8192, 128, 512]
    - [11, 59.9]
  - - [8192, 512, 1, 256, 8192, 8192, 256, 512]
    - [13, 106.8]
  - - [8192, 512, 1, 512, 8192, 8192, 512, 512]
    - [11, 176.45]
  - - [8192, 512, 1, 1024, 8192, 8192, 1024, 512]
    - [12, 266.15]
  - - [8192, 512, 1, 2048, 8192, 8192, 2048, 512]
    - [12, 352.88]
  - - [8192, 512, 1, 4096, 8192, 8192, 4096, 512]
    - [13, 433.99]
  - - [8192, 512, 1, 8192, 8192, 8192, 8192, 512]
    - [13, 463.39]
  - - [8192, 1024, 1, 128, 8192, 8192, 128, 1024]
    - [31, 76.24]
  - - [8192, 1024, 1, 256, 8192, 8192, 256, 1024]
    - [7, 133.96]
  - - [8192, 1024, 1, 512, 8192, 8192, 512, 1024]
    - [10, 232.33]
  - - [8192, 1024, 1, 1024, 8192, 8192, 1024, 1024]
    - [10, 360.67]
  - - [8192, 1024, 1, 2048, 8192, 8192, 2048, 1024]
    - [10, 488.38]
  - - [8192, 1024, 1, 4096, 8192, 8192, 4096, 1024]
    - [10, 567.49]
  - - [8192, 1024, 1, 8192, 8192, 8192, 8192, 1024]
    - [10, 549.4]
  - - [8192, 2048, 1, 128, 8192, 8192, 128, 2048]
    - [5, 96.05]
  - - [8192, 2048, 1, 256, 8192, 8192, 256, 2048]
    - [7, 161.36]
  - - [8192, 2048, 1, 512, 8192, 8192, 512, 2048]
    - [8, 264.65]
  - - [8192, 2048, 1, 1024, 8192, 8192, 1024, 2048]
    - [10, 407.7]
  - - [8192, 2048, 1, 2048, 8192, 8192, 2048, 2048]
    - [2, 549.8]
  - - [8192, 2048, 1, 4096, 8192, 8192, 4096, 2048]
    - [29, 682.92]
  - - [8192, 2048, 1, 8192, 8192, 8192, 8192, 2048]
    - [29, 711.39]
  - - [8192, 4096, 1, 128, 8192, 8192, 128, 4096]
    - [6, 104.57]
  - - [8192, 4096, 1, 256, 8192, 8192, 256, 4096]
    - [4, 180.21]
  - - [8192, 4096, 1, 512, 8192, 8192, 512, 4096]
    - [2, 300.0]
  - - [8192, 4096, 1, 1024, 8192, 8192, 1024, 4096]
    - [3, 445.34]
  - - [8192, 4096, 1, 2048, 8192, 8192, 2048, 4096]
    - [29, 566.4]
  - - [8192, 4096, 1, 4096, 8192, 8192, 4096, 4096]
    - [29, 652.53]
  - - [8192, 4096, 1, 8192, 8192, 8192, 8192, 4096]
    - [29, 727.72]
  - - [8192, 8192, 1, 128, 8192, 8192, 128, 8192]
    - [0, 115.27]
  - - [8192, 8192, 1, 256, 8192, 8192, 256, 8192]
    - [2, 200.55]
  - - [8192, 8192, 1, 512, 8192, 8192, 512, 8192]
    - [0, 314.12]
  - - [8192, 8192, 1, 1024, 8192, 8192, 1024, 8192]
    - [29, 475.52]
  - - [8192, 8192, 1, 2048, 8192, 8192, 2048, 8192]
    - [29, 564.99]
  - - [8192, 8192, 1, 4096, 8192, 8192, 4096, 8192]
    - [29, 670.68]
  - - [8192, 8192, 1, 8192, 8192, 8192, 8192, 8192]
    - [29, 791.22]
  - - [1, 1, 1, 32, 1, 1, 32, 1]
    - [48, 0.0]
- null
- null
- DeviceEfficiency
- GridBased
