projects/hipblaslt/library/src/amd_detail/rocblaslt/src/Tensile/Logic/asm_full/gfx950/GridBased/gfx950_Cijk_Ailk_Bljk_F8B8F8S_BH_Bias_HAS_SAB_SAV_UserArgs.yaml
- {MinimumRequiredVersion: 4.33.0}
- gfx950
- gfx950
- [Device 75a0]
    SolutionIndex: 0
    SolutionNameMin: Cijk_Ailk_Bljk_F8F8S_BH_Bias_HAS_SAB_SAV_UserArgs_MT256x256x64_MI32x32x1_SN_GSU0_GSUC0_GSUWGMRR0_K1_LBSPPA0_LBSPPB256_LPA0_MIWT4_4_SU0_SUM0_SUS0_VWA4_VWB4_WGM8_WGMXCC1_WGMXCCGn1
    SolutionIndex: 1
    SolutionNameMin: Cijk_Ailk_Bljk_F8F8S_BH_Bias_HAS_SAB_SAV_UserArgs_MT256x256x64_MI32x32x1_SN_GSU0_GSUC0_GSUWGMRR0_K1_LBSPPA0_LBSPPB256_LPA0_MIWT4_4_SU0_SUM0_SUS0_VWA4_VWB4_WGM8_WGMXCC1_WGMXCCGn1
    SolutionIndex: 2
    SolutionNameMin: Cijk_Ailk_Bljk_F8F8S_BH_Bias_HAS_SAB_SAV_UserArgs_MT256x256x64_MI32x32x1_SN_GSU0_GSUC0_GSUWGMRR0_K1_LBSPPA0_LBSPPB256_LPA0_MIWT4_4_SU0_SUM0_SUS0_VWA4_VWB4_WGM8_WGMXCC1_WGMXCCGn1
    SolutionIndex: 3
    SolutionNameMin: Cijk_Ailk_Bljk_F8F8S_BH_Bias_HAS_SAB_SAV_UserArgs_MT256x256x64_MI32x32x1_SN_GSU0_GSUC0_GSUWGMRR0_K1_LBSPPA0_LBSPPB256_LPA0_MIWT4_4_SU0_SUM0_SUS0_VWA4_VWB4_WGM8_WGMXCC1_WGMXCCGn1
    SolutionIndex: 4
    SolutionNameMin: Cijk_Ailk_Bljk_F8F8S_BH_Bias_HAS_SAB_SAV_UserArgs_MT256x256x64_MI32x32x1_SN_GSU0_GSUC0_GSUWGMRR0_K1_LBSPPA0_LBSPPB256_LPA0_MIWT4_4_SU0_SUM0_SUS0_VWA4_VWB4_WGM8_WGMXCC1_WGMXCCGn1
    SolutionIndex: 5
    SolutionNameMin: Cijk_Ailk_Bljk_F8F8S_BH_Bias_HAS_SAB_SAV_UserArgs_MT256x256x64_MI32x32x1_SN_GSU0_GSUC0_GSUWGMRR0_K1_LBSPPA0_LBSPPB256_LPA0_MIWT4_4_SU0_SUM0_SUS0_VWA4_VWB4_WGM8_WGMXCC1_WGMXCCGn1
    SolutionIndex: 6
    SolutionNameMin: Cijk_Ailk_Bljk_F8F8S_BH_Bias_HAS_SAB_SAV_UserArgs_MT256x256x64_MI32x32x1_SN_GSU0_GSUC0_GSUWGMRR0_K1_LBSPPA0_LBSPPB256_LPA0_MIWT4_4_SU0_SUM0_SUS0_VWA4_VWB4_WGM8_WGMXCC1_WGMXCCGn1
    SolutionIndex: 7
    SolutionNameMin: Cijk_Ailk_Bljk_F8F8S_BH_Bias_HAS_SAB_SAV_UserArgs_MT256x256x64_MI32x32x1_SN_GSU0_GSUC0_GSUWGMRR0_K1_LBSPPA0_LBSPPB256_LPA0_MIWT4_4_SU0_SUM0_SUS0_VWA4_VWB4_WGM8_WGMXCC1_WGMXCCGn1
    SolutionIndex: 8
    SolutionNameMin: Cijk_Ailk_Bljk_F8F8S_BH_Bias_HAS_SAB_SAV_UserArgs_MT256x128x64_MI32x32x1_SN_GSU0_GSUC0_GSUWGMRR0_K1_LBSPPA0_LBSPPB128_LPA0_MIWT4_2_SU0_SUM0_SUS0_VWA4_VWB2_WGM8_WGMXCC1_WGMXCCGn1
    SolutionIndex: 9
    SolutionNameMin: Cijk_Ailk_Bljk_F8F8S_BH_Bias_HAS_SAB_SAV_UserArgs_MT256x128x64_MI32x32x1_SN_GSU0_GSUC0_GSUWGMRR0_K1_LBSPPA0_LBSPPB128_LPA0_MIWT4_2_SU0_SUM0_SUS0_VWA4_VWB2_WGM8_WGMXCC1_WGMXCCGn1
    SolutionIndex: 10
    SolutionNameMin: Cijk_Ailk_Bljk_F8F8S_BH_Bias_HAS_SAB_SAV_UserArgs_MT128x256x128_MI16x16x1_SN_GSU0_GSUC0_GSUWGMRR0_K1_LBSPPA2048_LBSPPB1024_LPA64_MIWT4_8_SU0_SUM0_SUS0_VWA4_VWB8_WGM8_WGMXCC1_WGMXCCGn1
    SolutionIndex: 11
    SolutionNameMin: Cijk_Ailk_Bljk_F8F8S_BH_Bias_HAS_SAB_SAV_UserArgs_MT128x256x128_MI16x16x1_SN_GSU0_GSUC0_GSUWGMRR0_K1_LBSPPA2048_LBSPPB1024_LPA64_MIWT4_8_SU0_SUM0_SUS0_VWA4_VWB8_WGM8_WGMXCC1_WGMXCCGn1
    SolutionIndex: 12
    SolutionNameMin: Cijk_Ailk_Bljk_F8F8S_BH_Bias_HAS_SAB_SAV_UserArgs_MT128x256x128_MI16x16x1_SN_GSU0_GSUC0_GSUWGMRR0_K1_LBSPPA2048_LBSPPB1024_LPA64_MIWT4_8_SU0_SUM0_SUS0_VWA4_VWB8_WGM8_WGMXCC1_WGMXCCGn1
    SolutionIndex: 13
    SolutionNameMin: Cijk_Ailk_Bljk_F8F8S_BH_Bias_HAS_SAB_SAV_UserArgs_MT256x128x128_MI16x16x1_SN_GSU0_GSUC0_GSUWGMRR0_K1_LBSPPA4096_LBSPPB512_LPA0_MIWT8_4_SU0_SUM0_SUS0_VWA8_VWB4_WGM8_WGMXCC1_WGMXCCGn1
    SolutionIndex: 14
    SolutionNameMin: Cijk_Ailk_Bljk_F8F8S_BH_Bias_HAS_SAB_SAV_UserArgs_MT256x128x128_MI16x16x1_SN_GSU0_GSUC0_GSUWGMRR0_K1_LBSPPA4096_LBSPPB512_LPA0_MIWT8_4_SU0_SUM0_SUS0_VWA8_VWB4_WGM8_WGMXCC1_WGMXCCGn1
    SolutionIndex: 15
    SolutionNameMin: Cijk_Ailk_Bljk_F8F8S_BH_Bias_HAS_SAB_SAV_UserArgs_MT128x128x128_MI16x16x1_SN_GSU0_GSUC0_GSUWGMRR0_K1_LBSPPA2048_LBSPPB512_LPA64_MIWT4_4_SU0_SUM0_SUS0_VWA4_VWB4_WGM8_WGMXCC1_WGMXCCGn1
    SolutionIndex: 16
    SolutionNameMin: Cijk_Ailk_Bljk_F8F8S_BH_Bias_HAS_SAB_SAV_UserArgs_MT128x128x128_MI16x16x1_SN_GSU0_GSUC0_GSUWGMRR0_K1_LBSPPA2048_LBSPPB512_LPA64_MIWT4_4_SU0_SUM0_SUS0_VWA4_VWB4_WGM8_WGMXCC1_WGMXCCGn1
    SolutionIndex: 17
    SolutionNameMin: Cijk_Ailk_Bljk_F8F8S_BH_Bias_HAS_SAB_SAV_UserArgs_MT64x128x128_MI16x16x1_SN_GSU0_GSUC0_GSUWGMRR0_K1_LBSPPA1024_LBSPPB512_LPA32_MIWT2_4_SU0_SUM0_SUS0_VWA2_VWB4_WGM8_WGMXCC1_WGMXCCGn1
    SolutionIndex: 18
    SolutionNameMin: Cijk_Ailk_Bljk_F8F8S_BH_Bias_HAS_SAB_SAV_UserArgs_MT64x128x128_MI16x16x1_SN_GSU0_GSUC0_GSUWGMRR0_K1_LBSPPA1024_LBSPPB512_LPA32_MIWT2_4_SU0_SUM0_SUS0_VWA2_VWB4_WGM8_WGMXCC1_WGMXCCGn1
    SolutionIndex: 19
    SolutionNameMin: Cijk_Ailk_Bljk_F8F8S_BH_Bias_HAS_SAB_SAV_UserArgs_MT64x128x128_MI16x16x1_SN_GSU0_GSUC0_GSUWGMRR0_K1_LBSPPA1024_LBSPPB512_LPA32_MIWT2_4_SU0_SUM0_SUS0_VWA2_VWB4_WGM8_WGMXCC1_WGMXCCGn1
    SolutionIndex: 20
    SolutionNameMin: Cijk_Ailk_Bljk_F8F8S_BH_Bias_HAS_SAB_SAV_UserArgs_MT128x64x128_MI16x16x1_SN_GSU0_GSUC0_GSUWGMRR0_K1_LBSPPA2048_LBSPPB256_LPA64_MIWT4_2_SU0_SUM0_SUS0_VWA4_VWB2_WGM8_WGMXCC1_WGMXCCGn1
    SolutionIndex: 21
    SolutionNameMin: Cijk_Ailk_Bljk_F8F8S_BH_Bias_HAS_SAB_SAV_UserArgs_MT128x64x128_MI16x16x1_SN_GSU0_GSUC0_GSUWGMRR0_K1_LBSPPA2048_LBSPPB256_LPA64_MIWT4_2_SU0_SUM0_SUS0_VWA4_VWB2_WGM8_WGMXCC1_WGMXCCGn1
    SolutionIndex: 22
    SolutionNameMin: Cijk_Ailk_Bljk_F8F8S_BH_Bias_HAS_SAB_SAV_UserArgs_MT64x64x128_MI16x16x1_SN_GSU0_GSUC0_GSUWGMRR0_K1_LBSPPA1024_LBSPPB256_LPA32_MIWT2_2_SU0_SUM0_SUS0_VWA2_VWB2_WGM8_WGMXCC1_WGMXCCGn1
    SolutionIndex: 23
    SolutionNameMin: Cijk_Ailk_Bljk_F8F8S_BH_Bias_HAS_SAB_SAV_UserArgs_MT64x64x128_MI16x16x1_SN_GSU0_GSUC0_GSUWGMRR0_K1_LBSPPA1024_LBSPPB256_LPA32_MIWT2_2_SU0_SUM0_SUS0_VWA2_VWB2_WGM8_WGMXCC1_WGMXCCGn1
    SolutionIndex: 24
    SolutionNameMin: Cijk_Ailk_Bljk_F8F8S_BH_Bias_HAS_SAB_SAV_UserArgs_MT64x64x128_MI16x16x1_SN_GSU0_GSUC0_GSUWGMRR0_K1_LBSPPA1024_LBSPPB256_LPA32_MIWT2_2_SU0_SUM0_SUS0_VWA2_VWB2_WGM8_WGMXCC1_WGMXCCGn1
    SolutionIndex: 25
    SolutionNameMin: Cijk_Ailk_Bljk_F8F8S_BH_Bias_HAS_SAB_SAV_UserArgs_MT64x64x128_MI16x16x1_SN_GSU0_GSUC0_GSUWGMRR0_K1_LBSPPA1024_LBSPPB256_LPA32_MIWT2_2_SU0_SUM0_SUS0_VWA2_VWB2_WGM8_WGMXCC1_WGMXCCGn1
    SolutionIndex: 26
    SolutionNameMin: Cijk_Ailk_Bljk_F8F8S_BH_Bias_HAS_SAB_SAV_UserArgs_MT32x64x128_MI16x16x1_SN_GSU0_GSUC0_GSUWGMRR0_K1_LBSPPA512_LBSPPB256_LPA16_MIWT1_2_SU0_SUM0_SUS0_VWA1_VWB2_WGM8_WGMXCC1_WGMXCCGn1
    SolutionIndex: 27
    SolutionNameMin: Cijk_Ailk_Bljk_F8F8S_BH_Bias_HAS_SAB_SAV_UserArgs_MT32x64x128_MI16x16x1_SN_GSU0_GSUC0_GSUWGMRR0_K1_LBSPPA512_LBSPPB256_LPA16_MIWT1_2_SU0_SUM0_SUS0_VWA1_VWB2_WGM8_WGMXCC1_WGMXCCGn1
    SolutionIndex: 28
    SolutionNameMin: Cijk_Ailk_Bljk_F8F8S_BH_Bias_HAS_SAB_SAV_UserArgs_MT64x32x128_MI16x16x1_SN_GSU0_GSUC0_GSUWGMRR0_K1_LBSPPA1024_LBSPPB128_LPA32_MIWT2_1_SU0_SUM0_SUS0_VWA2_VWB1_WGM8_WGMXCC1_WGMXCCGn1
    SolutionIndex: 29
    SolutionNameMin: Cijk_Ailk_Bljk_F8F8S_BH_Bias_HAS_SAB_SAV_UserArgs_MT64x32x128_MI16x16x1_SN_GSU0_GSUC0_GSUWGMRR0_K1_LBSPPA1024_LBSPPB128_LPA32_MIWT2_1_SU0_SUM0_SUS0_VWA2_VWB1_WGM8_WGMXCC1_WGMXCCGn1
    SolutionIndex: 30
    SolutionNameMin: Cijk_Ailk_Bljk_F8F8S_BH_Bias_HAS_SAB_SAV_UserArgs_MT32x32x128_MI16x16x1_SN_GSU0_GSUC0_GSUWGMRR0_K1_LBSPPA512_LBSPPB128_LPA16_MIWT1_1_SU0_SUM0_SUS0_VWA1_VWB1_WGM8_WGMXCC1_WGMXCCGn1
    SolutionIndex: 31
    SolutionNameMin: Cijk_Ailk_Bljk_F8F8S_BH_Bias_HAS_SAB_SAV_UserArgs_MT32x32x128_MI16x16x1_SN_GSU0_GSUC0_GSUWGMRR0_K1_LBSPPA512_LBSPPB128_LPA16_MIWT1_1_SU0_SUM0_SUS0_VWA1_VWB1_WGM8_WGMXCC1_WGMXCCGn1
    SolutionIndex: 32
    SolutionNameMin: Cijk_Ailk_Bljk_F8F8S_BH_Bias_HAS_SAB_SAV_UserArgs_MT32x32x128_MI16x16x1_SN_GSU0_GSUC0_GSUWGMRR0_K1_LBSPPA512_LBSPPB128_LPA16_MIWT1_1_SU0_SUM0_SUS0_VWA1_VWB1_WGM8_WGMXCC1_WGMXCCGn1
    SolutionIndex: 33
    SolutionNameMin: Cijk_Ailk_Bljk_F8F8S_BH_Bias_HAS_SAB_SAV_UserArgs_MT256x256x128_MI32x32x1_SN_GSU0_GSUC0_GSUWGMRR0_K1_LBSPPA0_LBSPPB512_LPA0_MIWT4_4_SU0_SUM0_SUS0_VWA4_VWB4_WGM8_WGMXCC1_WGMXCCGn1
    SolutionIndex: 34
    SolutionNameMin: Cijk_Ailk_Bljk_F8F8S_BH_Bias_HAS_SAB_SAV_UserArgs_MT256x256x128_MI32x32x1_SN_GSU0_GSUC0_GSUWGMRR0_K1_LBSPPA0_LBSPPB512_LPA0_MIWT4_4_SU0_SUM0_SUS0_VWA4_VWB4_WGM8_WGMXCC1_WGMXCCGn1
    SolutionIndex: 35
    SolutionNameMin: Cijk_Ailk_Bljk_F8F8S_BH_Bias_HAS_SAB_SAV_UserArgs_MT256x256x128_MI32x32x1_SN_GSU0_GSUC0_GSUWGMRR0_K1_LBSPPA0_LBSPPB512_LPA0_MIWT4_4_SU0_SUM0_SUS0_VWA4_VWB4_WGM8_WGMXCC1_WGMXCCGn1
    SolutionIndex: 36
    SolutionNameMin: Cijk_Ailk_Bljk_F8F8S_BH_Bias_HAS_SAB_SAV_UserArgs_MT128x256x128_MI32x32x1_SN_GSU0_GSUC0_GSUWGMRR0_K1_LBSPPA0_LBSPPB512_LPA0_MIWT2_4_SU0_SUM0_SUS0_VWA2_VWB4_WGM8_WGMXCC1_WGMXCCGn1
    SolutionIndex: 37
    SolutionNameMin: Cijk_Ailk_Bljk_F8F8S_BH_Bias_HAS_SAB_SAV_UserArgs_MT128x256x128_MI32x32x1_SN_GSU0_GSUC0_GSUWGMRR0_K1_LBSPPA0_LBSPPB512_LPA0_MIWT2_4_SU0_SUM0_SUS0_VWA2_VWB4_WGM8_WGMXCC1_WGMXCCGn1
    SolutionIndex: 38
    SolutionNameMin: Cijk_Ailk_Bljk_F8F8S_BH_Bias_HAS_SAB_SAV_UserArgs_MT128x256x128_MI32x32x1_SN_GSU0_GSUC0_GSUWGMRR0_K1_LBSPPA0_LBSPPB512_LPA0_MIWT2_4_SU0_SUM0_SUS0_VWA2_VWB4_WGM8_WGMXCC1_WGMXCCGn1
    SolutionIndex: 39
    SolutionNameMin: Cijk_Ailk_Bljk_F8F8S_BH_Bias_HAS_SAB_SAV_UserArgs_MT64x64x256_MI16x16x1_SN_GSU0_GSUC0_GSUWGMRR0_K1_LBSPPA1024_LBSPPB512_LPA32_MIWT2_2_SU0_SUM0_SUS0_VWA2_VWB2_WGM8_WGMXCC1_WGMXCCGn1
    SolutionIndex: 40
    SolutionNameMin: Cijk_Ailk_Bljk_F8F8S_BH_Bias_HAS_SAB_SAV_UserArgs_MT64x64x256_MI16x16x1_SN_GSU0_GSUC0_GSUWGMRR0_K1_LBSPPA1024_LBSPPB512_LPA32_MIWT2_2_SU0_SUM0_SUS0_VWA2_VWB2_WGM8_WGMXCC1_WGMXCCGn1
    SolutionIndex: 41
    SolutionNameMin: Cijk_Ailk_Bljk_F8F8S_BH_Bias_HAS_SAB_SAV_UserArgs_MT32x64x256_MI16x16x1_SN_GSU0_GSUC0_GSUWGMRR0_K1_LBSPPA512_LBSPPB512_LPA16_MIWT1_2_SU0_SUM0_SUS0_VWA1_VWB2_WGM8_WGMXCC1_WGMXCCGn1
    SolutionIndex: 42
    SolutionNameMin: Cijk_Ailk_Bljk_F8F8S_BH_Bias_HAS_SAB_SAV_UserArgs_MT32x64x256_MI16x16x1_SN_GSU0_GSUC0_GSUWGMRR0_K1_LBSPPA512_LBSPPB512_LPA16_MIWT1_2_SU0_SUM0_SUS0_VWA1_VWB2_WGM8_WGMXCC1_WGMXCCGn1
    SolutionIndex: 43
    SolutionNameMin: Cijk_Ailk_Bljk_F8F8S_BH_Bias_HAS_SAB_SAV_UserArgs_MT64x32x256_MI16x16x1_SN_GSU0_GSUC0_GSUWGMRR0_K1_LBSPPA1024_LBSPPB256_LPA32_MIWT2_1_SU0_SUM0_SUS0_VWA2_VWB1_WGM8_WGMXCC1_WGMXCCGn1
    SolutionIndex: 44
    SolutionNameMin: Cijk_Ailk_Bljk_F8F8S_BH_Bias_HAS_SAB_SAV_UserArgs_MT64x32x256_MI16x16x1_SN_GSU0_GSUC0_GSUWGMRR0_K1_LBSPPA1024_LBSPPB256_LPA32_MIWT2_1_SU0_SUM0_SUS0_VWA2_VWB1_WGM8_WGMXCC1_WGMXCCGn1
    SolutionIndex: 45
    SolutionNameMin: Cijk_Ailk_Bljk_F8F8S_BH_Bias_HAS_SAB_SAV_UserArgs_MT32x32x256_MI16x16x1_SN_GSU0_GSUC0_GSUWGMRR0_K1_LBSPPA512_LBSPPB256_LPA16_MIWT1_1_SU0_SUM0_SUS0_VWA1_VWB1_WGM8_WGMXCC1_WGMXCCGn1
    SolutionIndex: 46
    SolutionNameMin: Cijk_Ailk_Bljk_F8F8S_BH_Bias_HAS_SAB_SAV_UserArgs_MT32x32x256_MI16x16x1_SN_GSU0_GSUC0_GSUWGMRR0_K1_LBSPPA512_LBSPPB256_LPA16_MIWT1_1_SU0_SUM0_SUS0_VWA1_VWB1_WGM8_WGMXCC1_WGMXCCGn1
    SolutionIndex: 47
    SolutionNameMin: Cijk_Ailk_Bljk_F8F8S_BH_Bias_HAS_SAB_SAV_UserArgs_MT32x32x256_MI16x16x1_SN_GSU0_GSUC0_GSUWGMRR0_K1_LBSPPA512_LBSPPB256_LPA16_MIWT1_1_SU0_SUM0_SUS0_VWA1_VWB1_WGM8_WGMXCC1_WGMXCCGn1
    SolutionIndex: 48
    SolutionNameMin: Cijk_Ailk_Bljk_F8F8S_BH_Bias_HAS_SAB_SAV_UserArgs_MT32x32x256_MI16x16x1_SN_GSU0_GSUC0_GSUWGMRR0_K1_LBSPPA512_LBSPPB256_LPA16_MIWT1_1_SU0_SUM0_SUS0_VWA1_VWB1_WGM8_WGMXCC1_WGMXCCGn1
    SolutionIndex: 49
    SolutionNameMin: Cijk_Ailk_Bljk_F8F8S_BH_Bias_HAS_SAB_SAV_UserArgs_MT32x32x128_MI16x16x1_SN_GSU0_GSUC0_GSUWGMRR0_K1_LBSPPA256_LBSPPB128_LPA16_MIWT1_1_SU32_SUM0_SUS256_VWA1_VWB1_WGM8_WGMXCC1_WGMXCCGn1
- - - [128, 128, 1, 128, 128, 128, 128, 128]
    - [31, 0.44]
  - - [128, 128, 1, 256, 128, 128, 128, 256]
    - [31, 0.78]
  - - [128, 128, 1, 512, 128, 128, 128, 512]
    - [31, 1.33]
  - - [128, 128, 1, 1024, 128, 128, 128, 1024]
    - [47, 2.18]
  - - [128, 128, 1, 2048, 128, 128, 128, 2048]
    - [47, 3.19]
  - - [128, 128, 1, 4096, 128, 128, 128, 4096]
    - [47, 4.18]
  - - [128, 128, 1, 8192, 128, 128, 128, 8192]
    - [47, 4.97]
  - - [128, 256, 1, 128, 128, 128, 128, 128]
    - [31, 0.88]
  - - [128, 256, 1, 256, 128, 128, 128, 256]
    - [31, 1.55]
  - - [128, 256, 1, 512, 128, 128, 128, 512]
    - [31, 2.67]
  - - [128, 256, 1, 1024, 128, 128, 128, 1024]
    - [47, 4.33]
  - - [128, 256, 1, 2048, 128, 128, 128, 2048]
    - [47, 6.38]
  - - [128, 256, 1, 4096, 128, 128, 128, 4096]
    - [47, 8.39]
  - - [128, 256, 1, 8192, 128, 128, 128, 8192]
    - [47, 10.03]
  - - [128, 512, 1, 128, 128, 128, 128, 128]
    - [26, 1.68]
  - - [128, 512, 1, 256, 128, 128, 128, 256]
    - [46, 2.97]
  - - [128, 512, 1, 512, 128, 128, 128, 512]
    - [46, 5.16]
  - - [128, 512, 1, 1024, 128, 128, 128, 1024]
    - [47, 8.55]
  - - [128, 512, 1, 2048, 128, 128, 128, 2048]
    - [47, 12.67]
  - - [128, 512, 1, 4096, 128, 128, 128, 4096]
    - [47, 16.64]
  - - [128, 512, 1, 8192, 128, 128, 128, 8192]
    - [47, 20.13]
  - - [128, 1024, 1, 128, 128, 128, 128, 128]
    - [30, 3.29]
  - - [128, 1024, 1, 256, 128, 128, 128, 256]
    - [47, 5.84]
  - - [128, 1024, 1, 512, 128, 128, 128, 512]
    - [47, 10.4]
  - - [128, 1024, 1, 1024, 128, 128, 128, 1024]
    - [47, 17.14]
  - - [128, 1024, 1, 2048, 128, 128, 128, 2048]
    - [47, 25.41]
  - - [128, 1024, 1, 4096, 128, 128, 128, 4096]
    - [47, 33.47]
  - - [128, 1024, 1, 8192, 128, 128, 128, 8192]
    - [48, 39.48]
  - - [128, 2048, 1, 128, 128, 128, 128, 128]
    - [31, 6.39]
  - - [128, 2048, 1, 256, 128, 128, 128, 256]
    - [47, 11.54]
  - - [128, 2048, 1, 512, 128, 128, 128, 512]
    - [47, 20.36]
  - - [128, 2048, 1, 1024, 128, 128, 128, 1024]
    - [47, 33.31]
  - - [128, 2048, 1, 2048, 128, 128, 128, 2048]
    - [47, 48.81]
  - - [128, 2048, 1, 4096, 128, 128, 128, 4096]
    - [48, 64.17]
  - - [128, 2048, 1, 8192, 128, 128, 128, 8192]
    - [48, 77.54]
  - - [128, 4096, 1, 128, 128, 128, 128, 128]
    - [28, 12.12]
  - - [128, 4096, 1, 256, 128, 128, 128, 256]
    - [28, 21.68]
  - - [128, 4096, 1, 512, 128, 128, 128, 512]
    - [28, 36.53]
  - - [128, 4096, 1, 1024, 128, 128, 128, 1024]
    - [41, 59.45]
  - - [128, 4096, 1, 2048, 128, 128, 128, 2048]
    - [42, 87.08]
  - - [128, 4096, 1, 4096, 128, 128, 128, 4096]
    - [42, 114.38]
  - - [128, 4096, 1, 8192, 128, 128, 128, 8192]
    - [44, 132.18]
  - - [128, 8192, 1, 128, 128, 128, 128, 128]
    - [23, 23.01]
  - - [128, 8192, 1, 256, 128, 128, 128, 256]
    - [23, 40.65]
  - - [128, 8192, 1, 512, 128, 128, 128, 512]
    - [23, 68.49]
  - - [128, 8192, 1, 1024, 128, 128, 128, 1024]
    - [23, 103.87]
  - - [128, 8192, 1, 2048, 128, 128, 128, 2048]
    - [40, 152.24]
  - - [128, 8192, 1, 4096, 128, 128, 128, 4096]
    - [39, 189.93]
  - - [128, 8192, 1, 8192, 128, 128, 128, 8192]
    - [40, 218.76]
  - - [256, 128, 1, 128, 256, 256, 256, 128]
    - [31, 0.84]
  - - [256, 128, 1, 256, 256, 256, 256, 256]
    - [31, 1.49]
  - - [256, 128, 1, 512, 256, 256, 256, 512]
    - [47, 2.57]
  - - [256, 128, 1, 1024, 256, 256, 256, 1024]
    - [47, 4.33]
  - - [256, 128, 1, 2048, 256, 256, 256, 2048]
    - [47, 6.41]
  - - [256, 128, 1, 4096, 256, 256, 256, 4096]
    - [47, 8.33]
  - - [256, 128, 1, 8192, 256, 256, 256, 8192]
    - [47, 9.98]
  - - [256, 256, 1, 128, 256, 256, 256, 128]
    - [31, 1.66]
  - - [256, 256, 1, 256, 256, 256, 256, 256]
    - [47, 2.98]
  - - [256, 256, 1, 512, 256, 256, 256, 512]
    - [47, 5.2]
  - - [256, 256, 1, 1024, 256, 256, 256, 1024]
    - [47, 8.68]
  - - [256, 256, 1, 2048, 256, 256, 256, 2048]
    - [47, 12.88]
  - - [256, 256, 1, 4096, 256, 256, 256, 4096]
    - [47, 16.75]
  - - [256, 256, 1, 8192, 256, 256, 256, 8192]
    - [48, 20.05]
  - - [256, 512, 1, 128, 256, 256, 256, 128]
    - [31, 3.33]
  - - [256, 512, 1, 256, 256, 256, 256, 256]
    - [47, 5.93]
  - - [256, 512, 1, 512, 256, 256, 256, 512]
    - [47, 10.44]
  - - [256, 512, 1, 1024, 256, 256, 256, 1024]
    - [47, 17.26]
  - - [256, 512, 1, 2048, 256, 256, 256, 2048]
    - [47, 25.82]
  - - [256, 512, 1, 4096, 256, 256, 256, 4096]
    - [48, 33.9]
  - - [256, 512, 1, 8192, 256, 256, 256, 8192]
    - [48, 39.99]
  - - [256, 1024, 1, 128, 256, 256, 256, 128]
    - [31, 6.36]
  - - [256, 1024, 1, 256, 256, 256, 256, 256]
    - [45, 11.6]
  - - [256, 1024, 1, 512, 256, 256, 256, 512]
    - [47, 20.46]
  - - [256, 1024, 1, 1024, 256, 256, 256, 1024]
    - [47, 33.89]
  - - [256, 1024, 1, 2048, 256, 256, 256, 2048]
    - [47, 50.05]
  - - [256, 1024, 1, 4096, 256, 256, 256, 4096]
    - [47, 66.09]
  - - [256, 1024, 1, 8192, 256, 256, 256, 8192]
    - [48, 78.39]
  - - [256, 2048, 1, 128, 256, 256, 256, 128]
    - [26, 12.3]
  - - [256, 2048, 1, 256, 256, 256, 256, 256]
    - [41, 21.98]
  - - [256, 2048, 1, 512, 256, 256, 256, 512]
    - [28, 37.17]
  - - [256, 2048, 1, 1024, 256, 256, 256, 1024]
    - [41, 60.99]
  - - [256, 2048, 1, 2048, 256, 256, 256, 2048]
    - [41, 89.1]
  - - [256, 2048, 1, 4096, 256, 256, 256, 4096]
    - [42, 116.16]
  - - [256, 2048, 1, 8192, 256, 256, 256, 8192]
    - [42, 137.3]
  - - [256, 4096, 1, 128, 256, 256, 256, 128]
    - [23, 23.07]
  - - [256, 4096, 1, 256, 256, 256, 256, 256]
    - [23, 41.07]
  - - [256, 4096, 1, 512, 256, 256, 256, 512]
    - [23, 69.03]
  - - [256, 4096, 1, 1024, 256, 256, 256, 1024]
    - [40, 107.08]
  - - [256, 4096, 1, 2048, 256, 256, 256, 2048]
    - [40, 153.03]
  - - [256, 4096, 1, 4096, 256, 256, 256, 4096]
    - [40, 192.32]
  - - [256, 4096, 1, 8192, 256, 256, 256, 8192]
    - [40, 219.41]
  - - [256, 8192, 1, 128, 256, 256, 256, 128]
    - [20, 41.01]
  - - [256, 8192, 1, 256, 256, 256, 256, 256]
    - [21, 71.82]
  - - [256, 8192, 1, 512, 256, 256, 256, 512]
    - [18, 120.53]
  - - [256, 8192, 1, 1024, 256, 256, 256, 1024]
    - [18, 185.16]
  - - [256, 8192, 1, 2048, 256, 256, 256, 2048]
    - [18, 255.13]
  - - [256, 8192, 1, 4096, 256, 256, 256, 4096]
    - [18, 300.69]
  - - [256, 8192, 1, 8192, 256, 256, 256, 8192]
    - [17, 329.6]
  - - [512, 128, 1, 128, 512, 512, 512, 128]
    - [31, 1.65]
  - - [512, 128, 1, 256, 512, 512, 512, 256]
    - [46, 2.96]
  - - [512, 128, 1, 512, 512, 512, 512, 512]
    - [47, 5.18]
  - - [512, 128, 1, 1024, 512, 512, 512, 1024]
    - [47, 8.66]
  - - [512, 128, 1, 2048, 512, 512, 512, 2048]
    - [47, 12.62]
  - - [512, 128, 1, 4096, 512, 512, 512, 4096]
    - [48, 16.46]
  - - [512, 128, 1, 8192, 512, 512, 512, 8192]
    - [48, 19.54]
  - - [512, 256, 1, 128, 512, 512, 512, 128]
    - [31, 3.32]
  - - [512, 256, 1, 256, 512, 512, 512, 256]
    - [47, 5.93]
  - - [512, 256, 1, 512, 512, 512, 512, 512]
    - [46, 10.21]
  - - [512, 256, 1, 1024, 512, 512, 512, 1024]
    - [47, 17.27]
  - - [512, 256, 1, 2048, 512, 512, 512, 2048]
    - [47, 25.69]
  - - [512, 256, 1, 4096, 512, 512, 512, 4096]
    - [47, 33.38]
  - - [512, 256, 1, 8192, 512, 512, 512, 8192]
    - [48, 39.4]
  - - [512, 512, 1, 128, 512, 512, 512, 128]
    - [32, 6.41]
  - - [512, 512, 1, 256, 512, 512, 512, 256]
    - [47, 11.62]
  - - [512, 512, 1, 512, 512, 512, 512, 512]
    - [47, 20.53]
  - - [512, 512, 1, 1024, 512, 512, 512, 1024]
    - [47, 34.2]
  - - [512, 512, 1, 2048, 512, 512, 512, 2048]
    - [47, 50.47]
  - - [512, 512, 1, 4096, 512, 512, 512, 4096]
    - [47, 65.56]
  - - [512, 512, 1, 8192, 512, 512, 512, 8192]
    - [48, 77.69]
  - - [512, 1024, 1, 128, 512, 512, 512, 128]
    - [26, 12.31]
  - - [512, 1024, 1, 256, 512, 512, 512, 256]
    - [43, 22.03]
  - - [512, 1024, 1, 512, 512, 512, 512, 512]
    - [28, 37.95]
  - - [512, 1024, 1, 1024, 512, 512, 512, 1024]
    - [44, 60.78]
  - - [512, 1024, 1, 2048, 512, 512, 512, 2048]
    - [44, 88.7]
  - - [512, 1024, 1, 4096, 512, 512, 512, 4096]
    - [44, 112.43]
  - - [512, 1024, 1, 8192, 512, 512, 512, 8192]
    - [44, 132.01]
  - - [512, 2048, 1, 128, 512, 512, 512, 128]
    - [23, 23.15]
  - - [512, 2048, 1, 256, 512, 512, 512, 256]
    - [23, 41.37]
  - - [512, 2048, 1, 512, 512, 512, 512, 512]
    - [23, 70.07]
  - - [512, 2048, 1, 1024, 512, 512, 512, 1024]
    - [40, 107.39]
  - - [512, 2048, 1, 2048, 512, 512, 512, 2048]
    - [25, 147.26]
  - - [512, 2048, 1, 4096, 512, 512, 512, 4096]
    - [25, 181.22]
  - - [512, 2048, 1, 8192, 512, 512, 512, 8192]
    - [25, 206.82]
  - - [512, 4096, 1, 128, 512, 512, 512, 128]
    - [20, 40.76]
  - - [512, 4096, 1, 256, 512, 512, 512, 256]
    - [20, 72.31]
  - - [512, 4096, 1, 512, 512, 512, 512, 512]
    - [18, 122.72]
  - - [512, 4096, 1, 1024, 512, 512, 512, 1024]
    - [18, 186.36]
  - - [512, 4096, 1, 2048, 512, 512, 512, 2048]
    - [19, 254.86]
  - - [512, 4096, 1, 4096, 512, 512, 512, 4096]
    - [19, 313.87]
  - - [512, 4096, 1, 8192, 512, 512, 512, 8192]
    - [17, 333.97]
  - - [512, 8192, 1, 128, 512, 512, 512, 128]
    - [15, 67.89]
  - - [512, 8192, 1, 256, 512, 512, 512, 256]
    - [15, 119.55]
  - - [512, 8192, 1, 512, 512, 512, 512, 512]
    - [15, 196.76]
  - - [512, 8192, 1, 1024, 512, 512, 512, 1024]
    - [16, 295.14]
  - - [512, 8192, 1, 2048, 512, 512, 512, 2048]
    - [16, 390.45]
  - - [512, 8192, 1, 4096, 512, 512, 512, 4096]
    - [16, 460.65]
  - - [512, 8192, 1, 8192, 512, 512, 512, 8192]
    - [16, 451.08]
  - - [1024, 128, 1, 128, 1024, 1024, 1024, 128]
    - [31, 3.24]
  - - [1024, 128, 1, 256, 1024, 1024, 1024, 256]
    - [45, 5.81]
  - - [1024, 128, 1, 512, 1024, 1024, 1024, 512]
    - [47, 10.05]
  - - [1024, 128, 1, 1024, 1024, 1024, 1024, 1024]
    - [47, 16.34]
  - - [1024, 128, 1, 2048, 1024, 1024, 1024, 2048]
    - [48, 23.54]
  - - [1024, 128, 1, 4096, 1024, 1024, 1024, 4096]
    - [48, 30.89]
  - - [1024, 128, 1, 8192, 1024, 1024, 1024, 8192]
    - [48, 35.82]
  - - [1024, 256, 1, 128, 1024, 1024, 1024, 128]
    - [31, 6.39]
  - - [1024, 256, 1, 256, 1024, 1024, 1024, 256]
    - [47, 11.54]
  - - [1024, 256, 1, 512, 1024, 1024, 1024, 512]
    - [47, 19.75]
  - - [1024, 256, 1, 1024, 1024, 1024, 1024, 1024]
    - [47, 32.66]
  - - [1024, 256, 1, 2048, 1024, 1024, 1024, 2048]
    - [47, 47.37]
  - - [1024, 256, 1, 4096, 1024, 1024, 1024, 4096]
    - [48, 60.77]
  - - [1024, 256, 1, 8192, 1024, 1024, 1024, 8192]
    - [48, 71.79]
  - - [1024, 512, 1, 128, 1024, 1024, 1024, 128]
    - [29, 12.31]
  - - [1024, 512, 1, 256, 1024, 1024, 1024, 256]
    - [43, 21.89]
  - - [1024, 512, 1, 512, 1024, 1024, 1024, 512]
    - [28, 37.47]
  - - [1024, 512, 1, 1024, 1024, 1024, 1024, 1024]
    - [44, 60.26]
  - - [1024, 512, 1, 2048, 1024, 1024, 1024, 2048]
    - [44, 86.13]
  - - [1024, 512, 1, 4096, 1024, 1024, 1024, 4096]
    - [44, 109.09]
  - - [1024, 512, 1, 8192, 1024, 1024, 1024, 8192]
    - [44, 125.74]
  - - [1024, 1024, 1, 128, 1024, 1024, 1024, 128]
    - [24, 23.17]
  - - [1024, 1024, 1, 256, 1024, 1024, 1024, 256]
    - [23, 41.87]
  - - [1024, 1024, 1, 512, 1024, 1024, 1024, 512]
    - [24, 70.64]
  - - [1024, 1024, 1, 1024, 1024, 1024, 1024, 1024]
    - [23, 109.28]
  - - [1024, 1024, 1, 2048, 1024, 1024, 1024, 2048]
    - [23, 148.21]
  - - [1024, 1024, 1, 4096, 1024, 1024, 1024, 4096]
    - [25, 181.6]
  - - [1024, 1024, 1, 8192, 1024, 1024, 1024, 8192]
    - [25, 207.74]
  - - [1024, 2048, 1, 128, 1024, 1024, 1024, 128]
    - [20, 40.98]
  - - [1024, 2048, 1, 256, 1024, 1024, 1024, 256]
    - [20, 72.48]
  - - [1024, 2048, 1, 512, 1024, 1024, 1024, 512]
    - [18, 123.45]
  - - [1024, 2048, 1, 1024, 1024, 1024, 1024, 1024]
    - [18, 188.47]
  - - [1024, 2048, 1, 2048, 1024, 1024, 1024, 2048]
    - [18, 257.31]
  - - [1024, 2048, 1, 4096, 1024, 1024, 1024, 4096]
    - [18, 314.75]
  - - [1024, 2048, 1, 8192, 1024, 1024, 1024, 8192]
    - [19, 339.93]
  - - [1024, 4096, 1, 128, 1024, 1024, 1024, 128]
    - [15, 67.59]
  - - [1024, 4096, 1, 256, 1024, 1024, 1024, 256]
    - [16, 118.87]
  - - [1024, 4096, 1, 512, 1024, 1024, 1024, 512]
    - [16, 196.32]
  - - [1024, 4096, 1, 1024, 1024, 1024, 1024, 1024]
    - [15, 291.91]
  - - [1024, 4096, 1, 2048, 1024, 1024, 1024, 2048]
    - [16, 392.1]
  - - [1024, 4096, 1, 4096, 1024, 1024, 1024, 4096]
    - [16, 461.37]
  - - [1024, 4096, 1, 8192, 1024, 1024, 1024, 8192]
    - [16, 470.85]
  - - [1024, 8192, 1, 128, 1024, 1024, 1024, 128]
    - [9, 99.2]
  - - [1024, 8192, 1, 256, 1024, 1024, 1024, 256]
    - [9, 173.76]
  - - [1024, 8192, 1, 512, 1024, 1024, 1024, 512]
    - [9, 272.76]
  - - [1024, 8192, 1, 1024, 1024, 1024, 1024, 1024]
    - [11, 389.53]
  - - [1024, 8192, 1, 2048, 1024, 1024, 1024, 2048]
    - [37, 480.27]
  - - [1024, 8192, 1, 4096, 1024, 1024, 1024, 4096]
    - [37, 535.59]
  - - [1024, 8192, 1, 8192, 1024, 1024, 1024, 8192]
    - [36, 539.41]
  - - [2048, 128, 1, 128, 2048, 2048, 2048, 128]
    - [31, 6.36]
  - - [2048, 128, 1, 256, 2048, 2048, 2048, 256]
    - [47, 11.34]
  - - [2048, 128, 1, 512, 2048, 2048, 2048, 512]
    - [47, 19.5]
  - - [2048, 128, 1, 1024, 2048, 2048, 2048, 1024]
    - [48, 31.19]
  - - [2048, 128, 1, 2048, 2048, 2048, 2048, 2048]
    - [47, 45.75]
  - - [2048, 128, 1, 4096, 2048, 2048, 2048, 4096]
    - [48, 59.36]
  - - [2048, 128, 1, 8192, 2048, 2048, 2048, 8192]
    - [48, 70.06]
  - - [2048, 256, 1, 128, 2048, 2048, 2048, 128]
    - [28, 12.16]
  - - [2048, 256, 1, 256, 2048, 2048, 2048, 256]
    - [28, 21.8]
  - - [2048, 256, 1, 512, 2048, 2048, 2048, 512]
    - [27, 36.78]
  - - [2048, 256, 1, 1024, 2048, 2048, 2048, 1024]
    - [44, 58.22]
  - - [2048, 256, 1, 2048, 2048, 2048, 2048, 2048]
    - [44, 83.08]
  - - [2048, 256, 1, 4096, 2048, 2048, 2048, 4096]
    - [44, 104.61]
  - - [2048, 256, 1, 8192, 2048, 2048, 2048, 8192]
    - [44, 122.49]
  - - [2048, 512, 1, 128, 2048, 2048, 2048, 128]
    - [23, 22.94]
  - - [2048, 512, 1, 256, 2048, 2048, 2048, 256]
    - [23, 41.4]
  - - [2048, 512, 1, 512, 2048, 2048, 2048, 512]
    - [23, 69.72]
  - - [2048, 512, 1, 1024, 2048, 2048, 2048, 1024]
    - [23, 106.75]
  - - [2048, 512, 1, 2048, 2048, 2048, 2048, 2048]
    - [23, 145.71]
  - - [2048, 512, 1, 4096, 2048, 2048, 2048, 4096]
    - [25, 179.25]
  - - [2048, 512, 1, 8192, 2048, 2048, 2048, 8192]
    - [25, 201.18]
  - - [2048, 1024, 1, 128, 2048, 2048, 2048, 128]
    - [20, 41.46]
  - - [2048, 1024, 1, 256, 2048, 2048, 2048, 256]
    - [21, 72.75]
  - - [2048, 1024, 1, 512, 2048, 2048, 2048, 512]
    - [18, 122.64]
  - - [2048, 1024, 1, 1024, 2048, 2048, 2048, 1024]
    - [18, 188.76]
  - - [2048, 1024, 1, 2048, 2048, 2048, 2048, 2048]
    - [19, 254.82]
  - - [2048, 1024, 1, 4096, 2048, 2048, 2048, 4096]
    - [18, 311.79]
  - - [2048, 1024, 1, 8192, 2048, 2048, 2048, 8192]
    - [19, 336.58]
  - - [2048, 2048, 1, 128, 2048, 2048, 2048, 128]
    - [15, 67.91]
  - - [2048, 2048, 1, 256, 2048, 2048, 2048, 256]
    - [16, 118.96]
  - - [2048, 2048, 1, 512, 2048, 2048, 2048, 512]
    - [16, 197.88]
  - - [2048, 2048, 1, 1024, 2048, 2048, 2048, 1024]
    - [16, 297.03]
  - - [2048, 2048, 1, 2048, 2048, 2048, 2048, 2048]
    - [16, 394.33]
  - - [2048, 2048, 1, 4096, 2048, 2048, 2048, 4096]
    - [16, 457.15]
  - - [2048, 2048, 1, 8192, 2048, 2048, 2048, 8192]
    - [15, 459.31]
  - - [2048, 4096, 1, 128, 2048, 2048, 2048, 128]
    - [14, 99.78]
  - - [2048, 4096, 1, 256, 2048, 2048, 2048, 256]
    - [8, 172.36]
  - - [2048, 4096, 1, 512, 2048, 2048, 2048, 512]
    - [10, 272.68]
  - - [2048, 4096, 1, 1024, 2048, 2048, 2048, 1024]
    - [12, 400.99]
  - - [2048, 4096, 1, 2048, 2048, 2048, 2048, 2048]
    - [12, 498.27]
  - - [2048, 4096, 1, 4096, 2048, 2048, 2048, 4096]
    - [38, 543.31]
  - - [2048, 4096, 1, 8192, 2048, 2048, 2048, 8192]
    - [38, 540.22]
  - - [2048, 8192, 1, 128, 2048, 2048, 2048, 128]
    - [5, 125.27]
  - - [2048, 8192, 1, 256, 2048, 2048, 2048, 256]
    - [35, 195.08]
  - - [2048, 8192, 1, 512, 2048, 2048, 2048, 512]
    - [3, 304.09]
  - - [2048, 8192, 1, 1024, 2048, 2048, 2048, 1024]
    - [1, 458.47]
  - - [2048, 8192, 1, 2048, 2048, 2048, 2048, 2048]
    - [34, 618.4]
  - - [2048, 8192, 1, 4096, 2048, 2048, 2048, 4096]
    - [35, 727.29]
  - - [2048, 8192, 1, 8192, 2048, 2048, 2048, 8192]
    - [35, 706.38]
  - - [4096, 128, 1, 128, 4096, 4096, 4096, 128]
    - [28, 12.22]
  - - [4096, 128, 1, 256, 4096, 4096, 4096, 256]
    - [26, 21.47]
  - - [4096, 128, 1, 512, 4096, 4096, 4096, 512]
    - [28, 36.38]
  - - [4096, 128, 1, 1024, 4096, 4096, 4096, 1024]
    - [44, 56.36]
  - - [4096, 128, 1, 2048, 4096, 4096, 4096, 2048]
    - [44, 80.4]
  - - [4096, 128, 1, 4096, 4096, 4096, 4096, 4096]
    - [44, 104.26]
  - - [4096, 128, 1, 8192, 4096, 4096, 4096, 8192]
    - [44, 112.78]
  - - [4096, 256, 1, 128, 4096, 4096, 4096, 128]
    - [23, 22.91]
  - - [4096, 256, 1, 256, 4096, 4096, 4096, 256]
    - [23, 40.89]
  - - [4096, 256, 1, 512, 4096, 4096, 4096, 512]
    - [23, 68.88]
  - - [4096, 256, 1, 1024, 4096, 4096, 4096, 1024]
    - [23, 105.22]
  - - [4096, 256, 1, 2048, 4096, 4096, 4096, 2048]
    - [23, 143.5]
  - - [4096, 256, 1, 4096, 4096, 4096, 4096, 4096]
    - [23, 176.98]
  - - [4096, 256, 1, 8192, 4096, 4096, 4096, 8192]
    - [25, 189.73]
  - - [4096, 512, 1, 128, 4096, 4096, 4096, 128]
    - [18, 40.66]
  - - [4096, 512, 1, 256, 4096, 4096, 4096, 256]
    - [18, 71.88]
  - - [4096, 512, 1, 512, 4096, 4096, 4096, 512]
    - [18, 122.25]
  - - [4096, 512, 1, 1024, 4096, 4096, 4096, 1024]
    - [18, 186.56]
  - - [4096, 512, 1, 2048, 4096, 4096, 4096, 2048]
    - [18, 254.64]
  - - [4096, 512, 1, 4096, 4096, 4096, 4096, 4096]
    - [19, 313.43]
  - - [4096, 512, 1, 8192, 4096, 4096, 4096, 8192]
    - [18, 336.42]
  - - [4096, 1024, 1, 128, 4096, 4096, 4096, 128]
    - [16, 66.95]
  - - [4096, 1024, 1, 256, 4096, 4096, 4096, 256]
    - [16, 119.02]
  - - [4096, 1024, 1, 512, 4096, 4096, 4096, 512]
    - [15, 194.69]
  - - [4096, 1024, 1, 1024, 4096, 4096, 4096, 1024]
    - [16, 294.22]
  - - [4096, 1024, 1, 2048, 4096, 4096, 4096, 2048]
    - [16, 392.76]
  - - [4096, 1024, 1, 4096, 4096, 4096, 4096, 4096]
    - [16, 466.92]
  - - [4096, 1024, 1, 8192, 4096, 4096, 4096, 8192]
    - [16, 459.0]
  - - [4096, 2048, 1, 128, 4096, 4096, 4096, 128]
    - [13, 98.93]
  - - [4096, 2048, 1, 256, 4096, 4096, 4096, 256]
    - [9, 170.27]
  - - [4096, 2048, 1, 512, 4096, 4096, 4096, 512]
    - [9, 269.17]
  - - [4096, 2048, 1, 1024, 4096, 4096, 4096, 1024]
    - [10, 395.18]
  - - [4096, 2048, 1, 2048, 4096, 4096, 4096, 2048]
    - [10, 480.76]
  - - [4096, 2048, 1, 4096, 4096, 4096, 4096, 4096]
    - [37, 534.54]
  - - [4096, 2048, 1, 8192, 4096, 4096, 4096, 8192]
    - [38, 523.32]
  - - [4096, 4096, 1, 128, 4096, 4096, 4096, 128]
    - [5, 119.82]
  - - [4096, 4096, 1, 256, 4096, 4096, 4096, 256]
    - [33, 196.61]
  - - [4096, 4096, 1, 512, 4096, 4096, 4096, 512]
    - [12, 302.68]
  - - [4096, 4096, 1, 1024, 4096, 4096, 4096, 1024]
    - [10, 432.25]
  - - [4096, 4096, 1, 2048, 4096, 4096, 4096, 2048]
    - [33, 607.17]
  - - [4096, 4096, 1, 4096, 4096, 4096, 4096, 4096]
    - [35, 706.28]
  - - [4096, 4096, 1, 8192, 4096, 4096, 4096, 8192]
    - [35, 707.75]
  - - [4096, 8192, 1, 128, 4096, 4096, 4096, 128]
    - [6, 143.24]
  - - [4096, 8192, 1, 256, 4096, 4096, 4096, 256]
    - [33, 229.92]
  - - [4096, 8192, 1, 512, 4096, 4096, 4096, 512]
    - [2, 347.72]
  - - [4096, 8192, 1, 1024, 4096, 4096, 4096, 1024]
    - [2, 494.68]
  - - [4096, 8192, 1, 2048, 4096, 4096, 4096, 2048]
    - [35, 614.46]
  - - [4096, 8192, 1, 4096, 4096, 4096, 4096, 4096]
    - [35, 672.38]
  - - [4096, 8192, 1, 8192, 4096, 4096, 4096, 8192]
    - [35, 735.25]
  - - [8192, 128, 1, 128, 8192, 8192, 8192, 128]
    - [23, 22.72]
  - - [8192, 128, 1, 256, 8192, 8192, 8192, 256]
    - [23, 39.98]
  - - [8192, 128, 1, 512, 8192, 8192, 8192, 512]
    - [25, 67.25]
  - - [8192, 128, 1, 1024, 8192, 8192, 8192, 1024]
    - [24, 102.75]
  - - [8192, 128, 1, 2048, 8192, 8192, 8192, 2048]
    - [22, 142.43]
  - - [8192, 128, 1, 4096, 8192, 8192, 8192, 4096]
    - [23, 166.54]
  - - [8192, 128, 1, 8192, 8192, 8192, 8192, 8192]
    - [23, 187.54]
  - - [8192, 256, 1, 128, 8192, 8192, 8192, 128]
    - [18, 40.39]
  - - [8192, 256, 1, 256, 8192, 8192, 8192, 256]
    - [18, 71.75]
  - - [8192, 256, 1, 512, 8192, 8192, 8192, 512]
    - [18, 120.96]
  - - [8192, 256, 1, 1024, 8192, 8192, 8192, 1024]
    - [18, 186.92]
  - - [8192, 256, 1, 2048, 8192, 8192, 8192, 2048]
    - [18, 256.12]
  - - [8192, 256, 1, 4096, 8192, 8192, 8192, 4096]
    - [18, 301.9]
  - - [8192, 256, 1, 8192, 8192, 8192, 8192, 8192]
    - [19, 328.89]
  - - [8192, 512, 1, 128, 8192, 8192, 8192, 128]
    - [16, 66.76]
  - - [8192, 512, 1, 256, 8192, 8192, 8192, 256]
    - [16, 117.07]
  - - [8192, 512, 1, 512, 8192, 8192, 8192, 512]
    - [16, 195.83]
  - - [8192, 512, 1, 1024, 8192, 8192, 8192, 1024]
    - [15, 288.29]
  - - [8192, 512, 1, 2048, 8192, 8192, 8192, 2048]
    - [15, 382.03]
  - - [8192, 512, 1, 4096, 8192, 8192, 8192, 4096]
    - [16, 451.54]
  - - [8192, 512, 1, 8192, 8192, 8192, 8192, 8192]
    - [15, 445.61]
  - - [8192, 1024, 1, 128, 8192, 8192, 8192, 128]
    - [14, 98.5]
  - - [8192, 1024, 1, 256, 8192, 8192, 8192, 256]
    - [9, 168.65]
  - - [8192, 1024, 1, 512, 8192, 8192, 8192, 512]
    - [11, 265.06]
  - - [8192, 1024, 1, 1024, 8192, 8192, 8192, 1024]
    - [12, 385.18]
  - - [8192, 1024, 1, 2048, 8192, 8192, 8192, 2048]
    - [12, 472.69]
  - - [8192, 1024, 1, 4096, 8192, 8192, 8192, 4096]
    - [10, 531.1]
  - - [8192, 1024, 1, 8192, 8192, 8192, 8192, 8192]
    - [38, 527.26]
  - - [8192, 2048, 1, 128, 8192, 8192, 8192, 128]
    - [5, 123.77]
  - - [8192, 2048, 1, 256, 8192, 8192, 8192, 256]
    - [35, 189.65]
  - - [8192, 2048, 1, 512, 8192, 8192, 8192, 512]
    - [3, 302.15]
  - - [8192, 2048, 1, 1024, 8192, 8192, 8192, 1024]
    - [3, 440.32]
  - - [8192, 2048, 1, 2048, 8192, 8192, 8192, 2048]
    - [7, 618.67]
  - - [8192, 2048, 1, 4096, 8192, 8192, 8192, 4096]
    - [7, 718.58]
  - - [8192, 2048, 1, 8192, 8192, 8192, 8192, 8192]
    - [35, 719.3]
  - - [8192, 4096, 1, 128, 8192, 8192, 8192, 128]
    - [5, 146.28]
  - - [8192, 4096, 1, 256, 8192, 8192, 8192, 256]
    - [33, 226.38]
  - - [8192, 4096, 1, 512, 8192, 8192, 8192, 512]
    - [0, 310.81]
  - - [8192, 4096, 1, 1024, 8192, 8192, 8192, 1024]
    - [4, 516.4]
  - - [8192, 4096, 1, 2048, 8192, 8192, 8192, 2048]
    - [6, 617.8]
  - - [8192, 4096, 1, 4096, 8192, 8192, 8192, 4096]
    - [35, 680.39]
  - - [8192, 4096, 1, 8192, 8192, 8192, 8192, 8192]
    - [35, 725.19]
  - - [8192, 8192, 1, 128, 8192, 8192, 8192, 128]
    - [4, 149.15]
  - - [8192, 8192, 1, 256, 8192, 8192, 8192, 256]
    - [4, 254.13]
  - - [8192, 8192, 1, 512, 8192, 8192, 8192, 512]
    - [0, 389.07]
  - - [8192, 8192, 1, 1024, 8192, 8192, 8192, 1024]
    - [7, 508.81]
  - - [8192, 8192, 1, 2048, 8192, 8192, 8192, 2048]
    - [35, 598.69]
  - - [8192, 8192, 1, 4096, 8192, 8192, 8192, 4096]
    - [35, 700.02]
  - - [8192, 8192, 1, 8192, 8192, 8192, 8192, 8192]
    - [35, 804.35]
  - - [1, 1, 1, 32, 1, 1, 1, 32]
    - [49, 0.0]
- null
- null
- DeviceEfficiency
- GridBased
