projects/hipblaslt/library/src/amd_detail/rocblaslt/src/Tensile/Logic/asm_full/gfx950/GridBased/gfx950_Cijk_Alik_Bjlk_F8B8F8S_BH_Bias_HAS_SAB_SAV_UserArgs.yaml
- {MinimumRequiredVersion: 4.33.0}
- gfx950
- gfx950
- [Device 75a0]
    SolutionIndex: 0
    SolutionNameMin: Cijk_Alik_Bjlk_F8F8S_BH_Bias_HAS_SAB_SAV_UserArgs_MT256x256x64_MI32x32x1_SN_GSU0_GSUC0_GSUWGMRR0_K1_LBSPPA256_LBSPPB0_LPB0_MIWT4_4_SU0_SUM0_SUS0_VWA4_VWB4_WGM8_WGMXCC1_WGMXCCGn1
    SolutionIndex: 1
    SolutionNameMin: Cijk_Alik_Bjlk_F8F8S_BH_Bias_HAS_SAB_SAV_UserArgs_MT256x256x64_MI32x32x1_SN_GSU0_GSUC0_GSUWGMRR0_K1_LBSPPA256_LBSPPB0_LPB0_MIWT4_4_SU0_SUM0_SUS0_VWA4_VWB4_WGM8_WGMXCC1_WGMXCCGn1
    SolutionIndex: 2
    SolutionNameMin: Cijk_Alik_Bjlk_F8F8S_BH_Bias_HAS_SAB_SAV_UserArgs_MT256x256x64_MI32x32x1_SN_GSU0_GSUC0_GSUWGMRR0_K1_LBSPPA256_LBSPPB0_LPB0_MIWT4_4_SU0_SUM0_SUS0_VWA4_VWB4_WGM8_WGMXCC1_WGMXCCGn1
    SolutionIndex: 3
    SolutionNameMin: Cijk_Alik_Bjlk_F8F8S_BH_Bias_HAS_SAB_SAV_UserArgs_MT256x256x64_MI32x32x1_SN_GSU0_GSUC0_GSUWGMRR0_K1_LBSPPA256_LBSPPB0_LPB0_MIWT4_4_SU0_SUM0_SUS0_VWA4_VWB4_WGM8_WGMXCC1_WGMXCCGn1
    SolutionIndex: 4
    SolutionNameMin: Cijk_Alik_Bjlk_F8F8S_BH_Bias_HAS_SAB_SAV_UserArgs_MT256x256x64_MI32x32x1_SN_GSU0_GSUC0_GSUWGMRR0_K1_LBSPPA256_LBSPPB0_LPB0_MIWT4_4_SU0_SUM0_SUS0_VWA4_VWB4_WGM8_WGMXCC1_WGMXCCGn1
    SolutionIndex: 5
    SolutionNameMin: Cijk_Alik_Bjlk_F8F8S_BH_Bias_HAS_SAB_SAV_UserArgs_MT256x256x64_MI32x32x1_SN_GSU0_GSUC0_GSUWGMRR0_K1_LBSPPA256_LBSPPB0_LPB0_MIWT4_4_SU0_SUM0_SUS0_VWA4_VWB4_WGM8_WGMXCC1_WGMXCCGn1
    SolutionIndex: 6
    SolutionNameMin: Cijk_Alik_Bjlk_F8F8S_BH_Bias_HAS_SAB_SAV_UserArgs_MT256x128x64_MI32x32x1_SN_GSU0_GSUC0_GSUWGMRR0_K1_LBSPPA256_LBSPPB0_LPB0_MIWT4_2_SU0_SUM0_SUS0_VWA4_VWB2_WGM8_WGMXCC1_WGMXCCGn1
    SolutionIndex: 7
    SolutionNameMin: Cijk_Alik_Bjlk_F8F8S_BH_Bias_HAS_SAB_SAV_UserArgs_MT256x128x64_MI32x32x1_SN_GSU0_GSUC0_GSUWGMRR0_K1_LBSPPA256_LBSPPB0_LPB0_MIWT4_2_SU0_SUM0_SUS0_VWA4_VWB2_WGM8_WGMXCC1_WGMXCCGn1
    SolutionIndex: 8
    SolutionNameMin: Cijk_Alik_Bjlk_F8F8S_BH_Bias_HAS_SAB_SAV_UserArgs_MT256x128x128_MI16x16x1_SN_GSU0_GSUC0_GSUWGMRR0_K1_LBSPPA1024_LBSPPB2048_LPB64_MIWT8_4_SU0_SUM0_SUS0_VWA8_VWB4_WGM8_WGMXCC1_WGMXCCGn1
    SolutionIndex: 9
    SolutionNameMin: Cijk_Alik_Bjlk_F8F8S_BH_Bias_HAS_SAB_SAV_UserArgs_MT256x128x128_MI16x16x1_SN_GSU0_GSUC0_GSUWGMRR0_K1_LBSPPA1024_LBSPPB2048_LPB64_MIWT8_4_SU0_SUM0_SUS0_VWA8_VWB4_WGM8_WGMXCC1_WGMXCCGn1
    SolutionIndex: 10
    SolutionNameMin: Cijk_Alik_Bjlk_F8F8S_BH_Bias_HAS_SAB_SAV_UserArgs_MT256x128x128_MI16x16x1_SN_GSU0_GSUC0_GSUWGMRR0_K1_LBSPPA1024_LBSPPB2048_LPB64_MIWT8_4_SU0_SUM0_SUS0_VWA8_VWB4_WGM8_WGMXCC1_WGMXCCGn1
    SolutionIndex: 11
    SolutionNameMin: Cijk_Alik_Bjlk_F8F8S_BH_Bias_HAS_SAB_SAV_UserArgs_MT256x64x128_MI16x16x1_SN_GSU0_GSUC0_GSUWGMRR0_K1_LBSPPA1024_LBSPPB1024_LPB32_MIWT8_2_SU0_SUM0_SUS0_VWA8_VWB2_WGM8_WGMXCC1_WGMXCCGn1
    SolutionIndex: 12
    SolutionNameMin: Cijk_Alik_Bjlk_F8F8S_BH_Bias_HAS_SAB_SAV_UserArgs_MT256x64x128_MI16x16x1_SN_GSU0_GSUC0_GSUWGMRR0_K1_LBSPPA1024_LBSPPB1024_LPB32_MIWT8_2_SU0_SUM0_SUS0_VWA8_VWB2_WGM8_WGMXCC1_WGMXCCGn1
    SolutionIndex: 13
    SolutionNameMin: Cijk_Alik_Bjlk_F8F8S_BH_Bias_HAS_SAB_SAV_UserArgs_MT128x128x128_MI16x16x1_SN_GSU0_GSUC0_GSUWGMRR0_K1_LBSPPA512_LBSPPB2048_LPB64_MIWT4_4_SU0_SUM0_SUS0_VWA4_VWB4_WGM8_WGMXCC1_WGMXCCGn1
    SolutionIndex: 14
    SolutionNameMin: Cijk_Alik_Bjlk_F8F8S_BH_Bias_HAS_SAB_SAV_UserArgs_MT128x128x128_MI16x16x1_SN_GSU0_GSUC0_GSUWGMRR0_K1_LBSPPA512_LBSPPB2048_LPB64_MIWT4_4_SU0_SUM0_SUS0_VWA4_VWB4_WGM8_WGMXCC1_WGMXCCGn1
    SolutionIndex: 15
    SolutionNameMin: Cijk_Alik_Bjlk_F8F8S_BH_Bias_HAS_SAB_SAV_UserArgs_MT128x128x128_MI16x16x1_SN_GSU0_GSUC0_GSUWGMRR0_K1_LBSPPA512_LBSPPB2048_LPB64_MIWT4_4_SU0_SUM0_SUS0_VWA4_VWB4_WGM8_WGMXCC1_WGMXCCGn1
    SolutionIndex: 16
    SolutionNameMin: Cijk_Alik_Bjlk_F8F8S_BH_Bias_HAS_SAB_SAV_UserArgs_MT128x64x128_MI16x16x1_SN_GSU0_GSUC0_GSUWGMRR0_K1_LBSPPA512_LBSPPB1024_LPB32_MIWT4_2_SU0_SUM0_SUS0_VWA4_VWB2_WGM8_WGMXCC1_WGMXCCGn1
    SolutionIndex: 17
    SolutionNameMin: Cijk_Alik_Bjlk_F8F8S_BH_Bias_HAS_SAB_SAV_UserArgs_MT128x64x128_MI16x16x1_SN_GSU0_GSUC0_GSUWGMRR0_K1_LBSPPA512_LBSPPB1024_LPB32_MIWT4_2_SU0_SUM0_SUS0_VWA4_VWB2_WGM8_WGMXCC1_WGMXCCGn1
    SolutionIndex: 18
    SolutionNameMin: Cijk_Alik_Bjlk_F8F8S_BH_Bias_HAS_SAB_SAV_UserArgs_MT128x64x128_MI16x16x1_SN_GSU0_GSUC0_GSUWGMRR0_K1_LBSPPA512_LBSPPB1024_LPB32_MIWT4_2_SU0_SUM0_SUS0_VWA4_VWB2_WGM8_WGMXCC1_WGMXCCGn1
    SolutionIndex: 19
    SolutionNameMin: Cijk_Alik_Bjlk_F8F8S_BH_Bias_HAS_SAB_SAV_UserArgs_MT128x32x128_MI16x16x1_SN_GSU0_GSUC0_GSUWGMRR0_K1_LBSPPA512_LBSPPB512_LPB16_MIWT4_1_SU0_SUM0_SUS0_VWA4_VWB1_WGM8_WGMXCC1_WGMXCCGn1
    SolutionIndex: 20
    SolutionNameMin: Cijk_Alik_Bjlk_F8F8S_BH_Bias_HAS_SAB_SAV_UserArgs_MT64x64x128_MI16x16x1_SN_GSU0_GSUC0_GSUWGMRR0_K1_LBSPPA256_LBSPPB1024_LPB32_MIWT2_2_SU0_SUM0_SUS0_VWA2_VWB2_WGM8_WGMXCC1_WGMXCCGn1
    SolutionIndex: 21
    SolutionNameMin: Cijk_Alik_Bjlk_F8F8S_BH_Bias_HAS_SAB_SAV_UserArgs_MT64x64x128_MI16x16x1_SN_GSU0_GSUC0_GSUWGMRR0_K1_LBSPPA256_LBSPPB1024_LPB32_MIWT2_2_SU0_SUM0_SUS0_VWA2_VWB2_WGM8_WGMXCC1_WGMXCCGn1
    SolutionIndex: 22
    SolutionNameMin: Cijk_Alik_Bjlk_F8F8S_BH_Bias_HAS_SAB_SAV_UserArgs_MT64x64x128_MI16x16x1_SN_GSU0_GSUC0_GSUWGMRR0_K1_LBSPPA256_LBSPPB1024_LPB32_MIWT2_2_SU0_SUM0_SUS0_VWA2_VWB2_WGM8_WGMXCC1_WGMXCCGn1
    SolutionIndex: 23
    SolutionNameMin: Cijk_Alik_Bjlk_F8F8S_BH_Bias_HAS_SAB_SAV_UserArgs_MT64x64x128_MI16x16x1_SN_GSU0_GSUC0_GSUWGMRR0_K1_LBSPPA256_LBSPPB1024_LPB32_MIWT2_2_SU0_SUM0_SUS0_VWA2_VWB2_WGM8_WGMXCC1_WGMXCCGn1
    SolutionIndex: 24
    SolutionNameMin: Cijk_Alik_Bjlk_F8F8S_BH_Bias_HAS_SAB_SAV_UserArgs_MT64x32x128_MI16x16x1_SN_GSU0_GSUC0_GSUWGMRR0_K1_LBSPPA256_LBSPPB512_LPB16_MIWT2_1_SU0_SUM0_SUS0_VWA2_VWB1_WGM8_WGMXCC1_WGMXCCGn1
    SolutionIndex: 25
    SolutionNameMin: Cijk_Alik_Bjlk_F8F8S_BH_Bias_HAS_SAB_SAV_UserArgs_MT64x32x128_MI16x16x1_SN_GSU0_GSUC0_GSUWGMRR0_K1_LBSPPA256_LBSPPB512_LPB16_MIWT2_1_SU0_SUM0_SUS0_VWA2_VWB1_WGM8_WGMXCC1_WGMXCCGn1
    SolutionIndex: 26
    SolutionNameMin: Cijk_Alik_Bjlk_F8F8S_BH_Bias_HAS_SAB_SAV_UserArgs_MT64x32x128_MI16x16x1_SN_GSU0_GSUC0_GSUWGMRR0_K1_LBSPPA256_LBSPPB512_LPB16_MIWT2_1_SU0_SUM0_SUS0_VWA2_VWB1_WGM8_WGMXCC1_WGMXCCGn1
    SolutionIndex: 27
    SolutionNameMin: Cijk_Alik_Bjlk_F8F8S_BH_Bias_HAS_SAB_SAV_UserArgs_MT32x32x128_MI16x16x1_SN_GSU0_GSUC0_GSUWGMRR0_K1_LBSPPA128_LBSPPB512_LPB16_MIWT1_1_SU0_SUM0_SUS0_VWA1_VWB1_WGM8_WGMXCC1_WGMXCCGn1
    SolutionIndex: 28
    SolutionNameMin: Cijk_Alik_Bjlk_F8F8S_BH_Bias_HAS_SAB_SAV_UserArgs_MT32x32x128_MI16x16x1_SN_GSU0_GSUC0_GSUWGMRR0_K1_LBSPPA128_LBSPPB512_LPB16_MIWT1_1_SU0_SUM0_SUS0_VWA1_VWB1_WGM8_WGMXCC1_WGMXCCGn1
    SolutionIndex: 29
    SolutionNameMin: Cijk_Alik_Bjlk_F8F8S_BH_Bias_HAS_SAB_SAV_UserArgs_MT32x32x128_MI16x16x1_SN_GSU0_GSUC0_GSUWGMRR0_K1_LBSPPA128_LBSPPB512_LPB16_MIWT1_1_SU0_SUM0_SUS0_VWA1_VWB1_WGM8_WGMXCC1_WGMXCCGn1
    SolutionIndex: 30
    SolutionNameMin: Cijk_Alik_Bjlk_F8F8S_BH_Bias_HAS_SAB_SAV_UserArgs_MT32x32x128_MI16x16x1_SN_GSU0_GSUC0_GSUWGMRR0_K1_LBSPPA128_LBSPPB512_LPB16_MIWT1_1_SU0_SUM0_SUS0_VWA1_VWB1_WGM8_WGMXCC1_WGMXCCGn1
    SolutionIndex: 31
    SolutionNameMin: Cijk_Alik_Bjlk_F8F8S_BH_Bias_HAS_SAB_SAV_UserArgs_MT32x32x128_MI16x16x1_SN_GSU0_GSUC0_GSUWGMRR0_K1_LBSPPA128_LBSPPB512_LPB16_MIWT1_1_SU0_SUM0_SUS0_VWA1_VWB1_WGM8_WGMXCC1_WGMXCCGn1
    SolutionIndex: 32
    SolutionNameMin: Cijk_Alik_Bjlk_F8F8S_BH_Bias_HAS_SAB_SAV_UserArgs_MT256x256x128_MI32x32x1_SN_GSU0_GSUC0_GSUWGMRR0_K1_LBSPPA512_LBSPPB0_LPB0_MIWT4_4_SU0_SUM0_SUS0_VWA4_VWB4_WGM8_WGMXCC1_WGMXCCGn1
    SolutionIndex: 33
    SolutionNameMin: Cijk_Alik_Bjlk_F8F8S_BH_Bias_HAS_SAB_SAV_UserArgs_MT128x128x256_MI16x16x1_SN_GSU0_GSUC0_GSUWGMRR0_K1_LBSPPA1024_LBSPPB2048_LPB64_MIWT4_4_SU0_SUM0_SUS0_VWA4_VWB4_WGM8_WGMXCC1_WGMXCCGn1
    SolutionIndex: 34
    SolutionNameMin: Cijk_Alik_Bjlk_F8F8S_BH_Bias_HAS_SAB_SAV_UserArgs_MT128x64x256_MI16x16x1_SN_GSU0_GSUC0_GSUWGMRR0_K1_LBSPPA1024_LBSPPB1024_LPB32_MIWT4_2_SU0_SUM0_SUS0_VWA4_VWB2_WGM8_WGMXCC1_WGMXCCGn1
    SolutionIndex: 35
    SolutionNameMin: Cijk_Alik_Bjlk_F8F8S_BH_Bias_HAS_SAB_SAV_UserArgs_MT64x64x256_MI16x16x1_SN_GSU0_GSUC0_GSUWGMRR0_K1_LBSPPA512_LBSPPB1024_LPB32_MIWT2_2_SU0_SUM0_SUS0_VWA2_VWB2_WGM8_WGMXCC1_WGMXCCGn1
    SolutionIndex: 36
    SolutionNameMin: Cijk_Alik_Bjlk_F8F8S_BH_Bias_HAS_SAB_SAV_UserArgs_MT64x64x256_MI16x16x1_SN_GSU0_GSUC0_GSUWGMRR0_K1_LBSPPA512_LBSPPB1024_LPB32_MIWT2_2_SU0_SUM0_SUS0_VWA2_VWB2_WGM8_WGMXCC1_WGMXCCGn1
    SolutionIndex: 37
    SolutionNameMin: Cijk_Alik_Bjlk_F8F8S_BH_Bias_HAS_SAB_SAV_UserArgs_MT32x64x256_MI16x16x1_SN_GSU0_GSUC0_GSUWGMRR0_K1_LBSPPA256_LBSPPB1024_LPB32_MIWT1_2_SU0_SUM0_SUS0_VWA1_VWB2_WGM8_WGMXCC1_WGMXCCGn1
    SolutionIndex: 38
    SolutionNameMin: Cijk_Alik_Bjlk_F8F8S_BH_Bias_HAS_SAB_SAV_UserArgs_MT32x64x256_MI16x16x1_SN_GSU0_GSUC0_GSUWGMRR0_K1_LBSPPA256_LBSPPB1024_LPB32_MIWT1_2_SU0_SUM0_SUS0_VWA1_VWB2_WGM8_WGMXCC1_WGMXCCGn1
    SolutionIndex: 39
    SolutionNameMin: Cijk_Alik_Bjlk_F8F8S_BH_Bias_HAS_SAB_SAV_UserArgs_MT64x32x256_MI16x16x1_SN_GSU0_GSUC0_GSUWGMRR0_K1_LBSPPA512_LBSPPB512_LPB16_MIWT2_1_SU0_SUM0_SUS0_VWA2_VWB1_WGM8_WGMXCC1_WGMXCCGn1
    SolutionIndex: 40
    SolutionNameMin: Cijk_Alik_Bjlk_F8F8S_BH_Bias_HAS_SAB_SAV_UserArgs_MT64x32x256_MI16x16x1_SN_GSU0_GSUC0_GSUWGMRR0_K1_LBSPPA512_LBSPPB512_LPB16_MIWT2_1_SU0_SUM0_SUS0_VWA2_VWB1_WGM8_WGMXCC1_WGMXCCGn1
    SolutionIndex: 41
    SolutionNameMin: Cijk_Alik_Bjlk_F8F8S_BH_Bias_HAS_SAB_SAV_UserArgs_MT64x32x256_MI16x16x1_SN_GSU0_GSUC0_GSUWGMRR0_K1_LBSPPA512_LBSPPB512_LPB16_MIWT2_1_SU0_SUM0_SUS0_VWA2_VWB1_WGM8_WGMXCC1_WGMXCCGn1
    SolutionIndex: 42
    SolutionNameMin: Cijk_Alik_Bjlk_F8F8S_BH_Bias_HAS_SAB_SAV_UserArgs_MT32x32x256_MI16x16x1_SN_GSU0_GSUC0_GSUWGMRR0_K1_LBSPPA256_LBSPPB512_LPB16_MIWT1_1_SU0_SUM0_SUS0_VWA1_VWB1_WGM8_WGMXCC1_WGMXCCGn1
    SolutionIndex: 43
    SolutionNameMin: Cijk_Alik_Bjlk_F8F8S_BH_Bias_HAS_SAB_SAV_UserArgs_MT32x32x256_MI16x16x1_SN_GSU0_GSUC0_GSUWGMRR0_K1_LBSPPA256_LBSPPB512_LPB16_MIWT1_1_SU0_SUM0_SUS0_VWA1_VWB1_WGM8_WGMXCC1_WGMXCCGn1
    SolutionIndex: 44
    SolutionNameMin: Cijk_Alik_Bjlk_F8F8S_BH_Bias_HAS_SAB_SAV_UserArgs_MT32x32x256_MI16x16x1_SN_GSU0_GSUC0_GSUWGMRR0_K1_LBSPPA256_LBSPPB512_LPB16_MIWT1_1_SU0_SUM0_SUS0_VWA1_VWB1_WGM8_WGMXCC1_WGMXCCGn1
    SolutionIndex: 45
    SolutionNameMin: Cijk_Alik_Bjlk_F8F8S_BH_Bias_HAS_SAB_SAV_UserArgs_MT32x32x256_MI16x16x1_SN_GSU0_GSUC0_GSUWGMRR0_K1_LBSPPA256_LBSPPB512_LPB16_MIWT1_1_SU0_SUM0_SUS0_VWA1_VWB1_WGM8_WGMXCC1_WGMXCCGn1
    SolutionIndex: 46
    SolutionNameMin: Cijk_Alik_Bjlk_F8F8S_BH_Bias_HAS_SAB_SAV_UserArgs_MT32x32x256_MI16x16x1_SN_GSU0_GSUC0_GSUWGMRR0_K1_LBSPPA256_LBSPPB512_LPB16_MIWT1_1_SU0_SUM0_SUS0_VWA1_VWB1_WGM8_WGMXCC1_WGMXCCGn1
    SolutionIndex: 47
    SolutionNameMin: Cijk_Alik_Bjlk_F8F8S_BH_Bias_HAS_SAB_SAV_UserArgs_MT32x32x256_MI16x16x1_SN_GSU0_GSUC0_GSUWGMRR0_K1_LBSPPA256_LBSPPB512_LPB16_MIWT1_1_SU0_SUM0_SUS0_VWA1_VWB1_WGM8_WGMXCC1_WGMXCCGn1
    SolutionIndex: 48
    SolutionNameMin: Cijk_Alik_Bjlk_F8F8S_BH_Bias_HAS_SAB_SAV_UserArgs_MT32x32x128_MI16x16x1_SN_GSU0_GSUC0_GSUWGMRR0_K1_LBSPPA128_LBSPPB256_LPB16_MIWT1_1_SU32_SUM0_SUS256_VWA1_VWB1_WGM8_WGMXCC1_WGMXCCGn1
- - - [128, 128, 1, 128, 128, 128, 128, 128]
    - [29, 0.43]
  - - [128, 128, 1, 256, 128, 128, 256, 128]
    - [43, 0.76]
  - - [128, 128, 1, 512, 128, 128, 512, 128]
    - [43, 1.32]
  - - [128, 128, 1, 1024, 128, 128, 1024, 128]
    - [44, 2.18]
  - - [128, 128, 1, 2048, 128, 128, 2048, 128]
    - [44, 3.26]
  - - [128, 128, 1, 4096, 128, 128, 4096, 128]
    - [47, 4.25]
  - - [128, 128, 1, 8192, 128, 128, 8192, 128]
    - [47, 5.06]
  - - [128, 256, 1, 128, 128, 128, 128, 256]
    - [29, 0.86]
  - - [128, 256, 1, 256, 128, 128, 256, 256]
    - [29, 1.52]
  - - [128, 256, 1, 512, 128, 128, 512, 256]
    - [42, 2.63]
  - - [128, 256, 1, 1024, 128, 128, 1024, 256]
    - [44, 4.39]
  - - [128, 256, 1, 2048, 128, 128, 2048, 256]
    - [47, 6.55]
  - - [128, 256, 1, 4096, 128, 128, 4096, 256]
    - [47, 8.5]
  - - [128, 256, 1, 8192, 128, 128, 8192, 256]
    - [45, 10.29]
  - - [128, 512, 1, 128, 128, 128, 128, 512]
    - [29, 1.66]
  - - [128, 512, 1, 256, 128, 128, 256, 512]
    - [44, 3.01]
  - - [128, 512, 1, 512, 128, 128, 512, 512]
    - [44, 5.16]
  - - [128, 512, 1, 1024, 128, 128, 1024, 512]
    - [44, 8.55]
  - - [128, 512, 1, 2048, 128, 128, 2048, 512]
    - [44, 12.85]
  - - [128, 512, 1, 4096, 128, 128, 4096, 512]
    - [47, 16.81]
  - - [128, 512, 1, 8192, 128, 128, 8192, 512]
    - [46, 19.73]
  - - [128, 1024, 1, 128, 128, 128, 128, 1024]
    - [29, 3.29]
  - - [128, 1024, 1, 256, 128, 128, 256, 1024]
    - [44, 5.89]
  - - [128, 1024, 1, 512, 128, 128, 512, 1024]
    - [44, 10.29]
  - - [128, 1024, 1, 1024, 128, 128, 1024, 1024]
    - [44, 16.84]
  - - [128, 1024, 1, 2048, 128, 128, 2048, 1024]
    - [44, 24.7]
  - - [128, 1024, 1, 4096, 128, 128, 4096, 1024]
    - [46, 31.21]
  - - [128, 1024, 1, 8192, 128, 128, 8192, 1024]
    - [46, 36.51]
  - - [128, 2048, 1, 128, 128, 128, 128, 2048]
    - [31, 6.3]
  - - [128, 2048, 1, 256, 128, 128, 256, 2048]
    - [44, 11.46]
  - - [128, 2048, 1, 512, 128, 128, 512, 2048]
    - [43, 19.85]
  - - [128, 2048, 1, 1024, 128, 128, 1024, 2048]
    - [43, 32.19]
  - - [128, 2048, 1, 2048, 128, 128, 2048, 2048]
    - [44, 47.67]
  - - [128, 2048, 1, 4096, 128, 128, 4096, 2048]
    - [46, 60.48]
  - - [128, 2048, 1, 8192, 128, 128, 8192, 2048]
    - [46, 70.7]
  - - [128, 4096, 1, 128, 128, 128, 128, 4096]
    - [24, 12.18]
  - - [128, 4096, 1, 256, 128, 128, 256, 4096]
    - [26, 21.68]
  - - [128, 4096, 1, 512, 128, 128, 512, 4096]
    - [26, 36.7]
  - - [128, 4096, 1, 1024, 128, 128, 1024, 4096]
    - [41, 58.33]
  - - [128, 4096, 1, 2048, 128, 128, 2048, 4096]
    - [41, 82.97]
  - - [128, 4096, 1, 4096, 128, 128, 4096, 4096]
    - [41, 105.43]
  - - [128, 4096, 1, 8192, 128, 128, 8192, 4096]
    - [38, 109.95]
  - - [128, 8192, 1, 128, 128, 128, 128, 8192]
    - [22, 22.59]
  - - [128, 8192, 1, 256, 128, 128, 256, 8192]
    - [22, 40.0]
  - - [128, 8192, 1, 512, 128, 128, 512, 8192]
    - [22, 67.23]
  - - [128, 8192, 1, 1024, 128, 128, 1024, 8192]
    - [22, 104.19]
  - - [128, 8192, 1, 2048, 128, 128, 2048, 8192]
    - [36, 146.29]
  - - [128, 8192, 1, 4096, 128, 128, 4096, 8192]
    - [36, 173.77]
  - - [128, 8192, 1, 8192, 128, 128, 8192, 8192]
    - [36, 201.39]
  - - [256, 128, 1, 128, 256, 256, 128, 128]
    - [27, 0.84]
  - - [256, 128, 1, 256, 256, 256, 256, 128]
    - [43, 1.5]
  - - [256, 128, 1, 512, 256, 256, 512, 128]
    - [43, 2.6]
  - - [256, 128, 1, 1024, 256, 256, 1024, 128]
    - [44, 4.32]
  - - [256, 128, 1, 2048, 256, 256, 2048, 128]
    - [47, 6.49]
  - - [256, 128, 1, 4096, 256, 256, 4096, 128]
    - [47, 8.53]
  - - [256, 128, 1, 8192, 256, 256, 8192, 128]
    - [47, 10.15]
  - - [256, 256, 1, 128, 256, 256, 128, 256]
    - [29, 1.67]
  - - [256, 256, 1, 256, 256, 256, 256, 256]
    - [44, 3.02]
  - - [256, 256, 1, 512, 256, 256, 512, 256]
    - [44, 5.27]
  - - [256, 256, 1, 1024, 256, 256, 1024, 256]
    - [44, 8.82]
  - - [256, 256, 1, 2048, 256, 256, 2048, 256]
    - [44, 12.97]
  - - [256, 256, 1, 4096, 256, 256, 4096, 256]
    - [47, 17.19]
  - - [256, 256, 1, 8192, 256, 256, 8192, 256]
    - [47, 20.68]
  - - [256, 512, 1, 128, 256, 256, 128, 512]
    - [27, 3.34]
  - - [256, 512, 1, 256, 256, 256, 256, 512]
    - [44, 6.11]
  - - [256, 512, 1, 512, 256, 256, 512, 512]
    - [44, 10.63]
  - - [256, 512, 1, 1024, 256, 256, 1024, 512]
    - [44, 17.46]
  - - [256, 512, 1, 2048, 256, 256, 2048, 512]
    - [44, 25.81]
  - - [256, 512, 1, 4096, 256, 256, 4096, 512]
    - [47, 33.87]
  - - [256, 512, 1, 8192, 256, 256, 8192, 512]
    - [47, 39.74]
  - - [256, 1024, 1, 128, 256, 256, 128, 1024]
    - [29, 6.46]
  - - [256, 1024, 1, 256, 256, 256, 256, 1024]
    - [42, 11.7]
  - - [256, 1024, 1, 512, 256, 256, 512, 1024]
    - [44, 20.06]
  - - [256, 1024, 1, 1024, 256, 256, 1024, 1024]
    - [44, 33.41]
  - - [256, 1024, 1, 2048, 256, 256, 2048, 1024]
    - [44, 48.33]
  - - [256, 1024, 1, 4096, 256, 256, 4096, 1024]
    - [44, 62.63]
  - - [256, 1024, 1, 8192, 256, 256, 8192, 1024]
    - [46, 73.1]
  - - [256, 2048, 1, 128, 256, 256, 128, 2048]
    - [25, 12.3]
  - - [256, 2048, 1, 256, 256, 256, 256, 2048]
    - [26, 21.73]
  - - [256, 2048, 1, 512, 256, 256, 512, 2048]
    - [26, 37.47]
  - - [256, 2048, 1, 1024, 256, 256, 1024, 2048]
    - [41, 61.23]
  - - [256, 2048, 1, 2048, 256, 256, 2048, 2048]
    - [41, 88.1]
  - - [256, 2048, 1, 4096, 256, 256, 4096, 2048]
    - [41, 110.49]
  - - [256, 2048, 1, 8192, 256, 256, 8192, 2048]
    - [41, 125.65]
  - - [256, 4096, 1, 128, 256, 256, 128, 4096]
    - [19, 22.87]
  - - [256, 4096, 1, 256, 256, 256, 256, 4096]
    - [22, 40.56]
  - - [256, 4096, 1, 512, 256, 256, 512, 4096]
    - [22, 68.78]
  - - [256, 4096, 1, 1024, 256, 256, 1024, 4096]
    - [22, 105.11]
  - - [256, 4096, 1, 2048, 256, 256, 2048, 4096]
    - [36, 148.25]
  - - [256, 4096, 1, 4096, 256, 256, 4096, 4096]
    - [36, 188.29]
  - - [256, 4096, 1, 8192, 256, 256, 8192, 4096]
    - [35, 202.28]
  - - [256, 8192, 1, 128, 256, 256, 128, 8192]
    - [16, 40.69]
  - - [256, 8192, 1, 256, 256, 256, 256, 8192]
    - [16, 71.2]
  - - [256, 8192, 1, 512, 256, 256, 512, 8192]
    - [18, 120.38]
  - - [256, 8192, 1, 1024, 256, 256, 1024, 8192]
    - [16, 185.21]
  - - [256, 8192, 1, 2048, 256, 256, 2048, 8192]
    - [18, 254.17]
  - - [256, 8192, 1, 4096, 256, 256, 4096, 8192]
    - [18, 301.18]
  - - [256, 8192, 1, 8192, 256, 256, 8192, 8192]
    - [34, 342.69]
  - - [512, 128, 1, 128, 512, 512, 128, 128]
    - [28, 1.67]
  - - [512, 128, 1, 256, 512, 512, 256, 128]
    - [43, 3.08]
  - - [512, 128, 1, 512, 512, 512, 512, 128]
    - [44, 5.31]
  - - [512, 128, 1, 1024, 512, 512, 1024, 128]
    - [43, 8.84]
  - - [512, 128, 1, 2048, 512, 512, 2048, 128]
    - [47, 13.14]
  - - [512, 128, 1, 4096, 512, 512, 4096, 128]
    - [47, 17.33]
  - - [512, 128, 1, 8192, 512, 512, 8192, 128]
    - [47, 20.63]
  - - [512, 256, 1, 128, 512, 512, 128, 256]
    - [28, 3.28]
  - - [512, 256, 1, 256, 512, 512, 256, 256]
    - [43, 6.09]
  - - [512, 256, 1, 512, 512, 512, 512, 256]
    - [44, 10.6]
  - - [512, 256, 1, 1024, 512, 512, 1024, 256]
    - [44, 17.77]
  - - [512, 256, 1, 2048, 512, 512, 2048, 256]
    - [44, 26.01]
  - - [512, 256, 1, 4096, 512, 512, 4096, 256]
    - [47, 34.48]
  - - [512, 256, 1, 8192, 512, 512, 8192, 256]
    - [47, 41.32]
  - - [512, 512, 1, 128, 512, 512, 128, 512]
    - [28, 6.53]
  - - [512, 512, 1, 256, 512, 512, 256, 512]
    - [44, 11.93]
  - - [512, 512, 1, 512, 512, 512, 512, 512]
    - [44, 20.63]
  - - [512, 512, 1, 1024, 512, 512, 1024, 512]
    - [44, 34.46]
  - - [512, 512, 1, 2048, 512, 512, 2048, 512]
    - [44, 50.41]
  - - [512, 512, 1, 4096, 512, 512, 4096, 512]
    - [47, 66.38]
  - - [512, 512, 1, 8192, 512, 512, 8192, 512]
    - [47, 78.65]
  - - [512, 1024, 1, 128, 512, 512, 128, 1024]
    - [26, 12.36]
  - - [512, 1024, 1, 256, 512, 512, 256, 1024]
    - [26, 22.2]
  - - [512, 1024, 1, 512, 512, 512, 512, 1024]
    - [26, 38.38]
  - - [512, 1024, 1, 1024, 512, 512, 1024, 1024]
    - [41, 61.75]
  - - [512, 1024, 1, 2048, 512, 512, 2048, 1024]
    - [41, 90.39]
  - - [512, 1024, 1, 4096, 512, 512, 4096, 1024]
    - [41, 114.43]
  - - [512, 1024, 1, 8192, 512, 512, 8192, 1024]
    - [41, 127.52]
  - - [512, 2048, 1, 128, 512, 512, 128, 2048]
    - [22, 23.09]
  - - [512, 2048, 1, 256, 512, 512, 256, 2048]
    - [22, 41.36]
  - - [512, 2048, 1, 512, 512, 512, 512, 2048]
    - [22, 70.05]
  - - [512, 2048, 1, 1024, 512, 512, 1024, 2048]
    - [36, 107.53]
  - - [512, 2048, 1, 2048, 512, 512, 2048, 2048]
    - [36, 151.22]
  - - [512, 2048, 1, 4096, 512, 512, 4096, 2048]
    - [36, 190.56]
  - - [512, 2048, 1, 8192, 512, 512, 8192, 2048]
    - [36, 219.12]
  - - [512, 4096, 1, 128, 512, 512, 128, 4096]
    - [16, 40.93]
  - - [512, 4096, 1, 256, 512, 512, 256, 4096]
    - [16, 72.38]
  - - [512, 4096, 1, 512, 512, 512, 512, 4096]
    - [16, 122.51]
  - - [512, 4096, 1, 1024, 512, 512, 1024, 4096]
    - [18, 186.04]
  - - [512, 4096, 1, 2048, 512, 512, 2048, 4096]
    - [34, 255.5]
  - - [512, 4096, 1, 4096, 512, 512, 4096, 4096]
    - [34, 320.73]
  - - [512, 4096, 1, 8192, 512, 512, 8192, 4096]
    - [34, 350.16]
  - - [512, 8192, 1, 128, 512, 512, 128, 8192]
    - [13, 66.83]
  - - [512, 8192, 1, 256, 512, 512, 256, 8192]
    - [15, 115.37]
  - - [512, 8192, 1, 512, 512, 512, 512, 8192]
    - [13, 193.05]
  - - [512, 8192, 1, 1024, 512, 512, 1024, 8192]
    - [13, 286.62]
  - - [512, 8192, 1, 2048, 512, 512, 2048, 8192]
    - [14, 383.59]
  - - [512, 8192, 1, 4096, 512, 512, 4096, 8192]
    - [14, 445.03]
  - - [512, 8192, 1, 8192, 512, 512, 8192, 8192]
    - [33, 477.22]
  - - [1024, 128, 1, 128, 1024, 1024, 128, 128]
    - [30, 3.27]
  - - [1024, 128, 1, 256, 1024, 1024, 256, 128]
    - [43, 6.06]
  - - [1024, 128, 1, 512, 1024, 1024, 512, 128]
    - [43, 10.49]
  - - [1024, 128, 1, 1024, 1024, 1024, 1024, 128]
    - [44, 17.51]
  - - [1024, 128, 1, 2048, 1024, 1024, 2048, 128]
    - [47, 25.98]
  - - [1024, 128, 1, 4096, 1024, 1024, 4096, 128]
    - [47, 34.21]
  - - [1024, 128, 1, 8192, 1024, 1024, 8192, 128]
    - [47, 40.84]
  - - [1024, 256, 1, 128, 1024, 1024, 128, 256]
    - [28, 6.38]
  - - [1024, 256, 1, 256, 1024, 1024, 256, 256]
    - [44, 11.81]
  - - [1024, 256, 1, 512, 1024, 1024, 512, 256]
    - [44, 20.56]
  - - [1024, 256, 1, 1024, 1024, 1024, 1024, 256]
    - [44, 34.07]
  - - [1024, 256, 1, 2048, 1024, 1024, 2048, 256]
    - [44, 50.36]
  - - [1024, 256, 1, 4096, 1024, 1024, 4096, 256]
    - [47, 66.41]
  - - [1024, 256, 1, 8192, 1024, 1024, 8192, 256]
    - [47, 79.41]
  - - [1024, 512, 1, 128, 1024, 1024, 128, 512]
    - [26, 12.49]
  - - [1024, 512, 1, 256, 1024, 1024, 256, 512]
    - [39, 22.28]
  - - [1024, 512, 1, 512, 1024, 1024, 512, 512]
    - [40, 38.21]
  - - [1024, 512, 1, 1024, 1024, 1024, 1024, 512]
    - [41, 62.8]
  - - [1024, 512, 1, 2048, 1024, 1024, 2048, 512]
    - [41, 92.55]
  - - [1024, 512, 1, 4096, 1024, 1024, 4096, 512]
    - [41, 119.92]
  - - [1024, 512, 1, 8192, 1024, 1024, 8192, 512]
    - [41, 141.54]
  - - [1024, 1024, 1, 128, 1024, 1024, 128, 1024]
    - [21, 23.36]
  - - [1024, 1024, 1, 256, 1024, 1024, 256, 1024]
    - [22, 41.5]
  - - [1024, 1024, 1, 512, 1024, 1024, 512, 1024]
    - [23, 70.59]
  - - [1024, 1024, 1, 1024, 1024, 1024, 1024, 1024]
    - [36, 108.66]
  - - [1024, 1024, 1, 2048, 1024, 1024, 2048, 1024]
    - [36, 152.76]
  - - [1024, 1024, 1, 4096, 1024, 1024, 4096, 1024]
    - [36, 191.37]
  - - [1024, 1024, 1, 8192, 1024, 1024, 8192, 1024]
    - [36, 218.86]
  - - [1024, 2048, 1, 128, 1024, 1024, 128, 2048]
    - [16, 41.35]
  - - [1024, 2048, 1, 256, 1024, 1024, 256, 2048]
    - [16, 73.39]
  - - [1024, 2048, 1, 512, 1024, 1024, 512, 2048]
    - [16, 124.28]
  - - [1024, 2048, 1, 1024, 1024, 1024, 1024, 2048]
    - [18, 189.04]
  - - [1024, 2048, 1, 2048, 1024, 1024, 2048, 2048]
    - [34, 260.2]
  - - [1024, 2048, 1, 4096, 1024, 1024, 4096, 2048]
    - [34, 324.16]
  - - [1024, 2048, 1, 8192, 1024, 1024, 8192, 2048]
    - [34, 364.38]
  - - [1024, 4096, 1, 128, 1024, 1024, 128, 4096]
    - [13, 66.99]
  - - [1024, 4096, 1, 256, 1024, 1024, 256, 4096]
    - [15, 116.4]
  - - [1024, 4096, 1, 512, 1024, 1024, 512, 4096]
    - [15, 194.91]
  - - [1024, 4096, 1, 1024, 1024, 1024, 1024, 4096]
    - [15, 291.03]
  - - [1024, 4096, 1, 2048, 1024, 1024, 2048, 4096]
    - [15, 385.89]
  - - [1024, 4096, 1, 4096, 1024, 1024, 4096, 4096]
    - [15, 456.68]
  - - [1024, 4096, 1, 8192, 1024, 1024, 8192, 4096]
    - [15, 465.85]
  - - [1024, 8192, 1, 128, 1024, 1024, 128, 8192]
    - [9, 100.34]
  - - [1024, 8192, 1, 256, 1024, 1024, 256, 8192]
    - [9, 173.65]
  - - [1024, 8192, 1, 512, 1024, 1024, 512, 8192]
    - [8, 278.64]
  - - [1024, 8192, 1, 1024, 1024, 1024, 1024, 8192]
    - [10, 415.25]
  - - [1024, 8192, 1, 2048, 1024, 1024, 2048, 8192]
    - [10, 531.0]
  - - [1024, 8192, 1, 4096, 1024, 1024, 4096, 8192]
    - [10, 608.55]
  - - [1024, 8192, 1, 8192, 1024, 1024, 8192, 8192]
    - [10, 585.0]
  - - [2048, 128, 1, 128, 2048, 2048, 128, 128]
    - [29, 6.47]
  - - [2048, 128, 1, 256, 2048, 2048, 256, 128]
    - [44, 11.77]
  - - [2048, 128, 1, 512, 2048, 2048, 512, 128]
    - [44, 20.28]
  - - [2048, 128, 1, 1024, 2048, 2048, 1024, 128]
    - [44, 33.4]
  - - [2048, 128, 1, 2048, 2048, 2048, 2048, 128]
    - [47, 49.42]
  - - [2048, 128, 1, 4096, 2048, 2048, 4096, 128]
    - [47, 65.47]
  - - [2048, 128, 1, 8192, 2048, 2048, 8192, 128]
    - [47, 78.79]
  - - [2048, 256, 1, 128, 2048, 2048, 128, 256]
    - [25, 12.43]
  - - [2048, 256, 1, 256, 2048, 2048, 256, 256]
    - [39, 22.09]
  - - [2048, 256, 1, 512, 2048, 2048, 512, 256]
    - [40, 38.05]
  - - [2048, 256, 1, 1024, 2048, 2048, 1024, 256]
    - [40, 61.96]
  - - [2048, 256, 1, 2048, 2048, 2048, 2048, 256]
    - [41, 91.52]
  - - [2048, 256, 1, 4096, 2048, 2048, 4096, 256]
    - [41, 118.12]
  - - [2048, 256, 1, 8192, 2048, 2048, 8192, 256]
    - [41, 140.29]
  - - [2048, 512, 1, 128, 2048, 2048, 128, 512]
    - [22, 23.33]
  - - [2048, 512, 1, 256, 2048, 2048, 256, 512]
    - [19, 41.21]
  - - [2048, 512, 1, 512, 2048, 2048, 512, 512]
    - [19, 70.42]
  - - [2048, 512, 1, 1024, 2048, 2048, 1024, 512]
    - [36, 109.35]
  - - [2048, 512, 1, 2048, 2048, 2048, 2048, 512]
    - [36, 156.47]
  - - [2048, 512, 1, 4096, 2048, 2048, 4096, 512]
    - [36, 197.55]
  - - [2048, 512, 1, 8192, 2048, 2048, 8192, 512]
    - [36, 228.55]
  - - [2048, 1024, 1, 128, 2048, 2048, 128, 1024]
    - [16, 41.21]
  - - [2048, 1024, 1, 256, 2048, 2048, 256, 1024]
    - [16, 73.5]
  - - [2048, 1024, 1, 512, 2048, 2048, 512, 1024]
    - [16, 125.17]
  - - [2048, 1024, 1, 1024, 2048, 2048, 1024, 1024]
    - [18, 188.47]
  - - [2048, 1024, 1, 2048, 2048, 2048, 2048, 1024]
    - [34, 259.86]
  - - [2048, 1024, 1, 4096, 2048, 2048, 4096, 1024]
    - [34, 325.0]
  - - [2048, 1024, 1, 8192, 2048, 2048, 8192, 1024]
    - [34, 364.01]
  - - [2048, 2048, 1, 128, 2048, 2048, 128, 2048]
    - [13, 67.25]
  - - [2048, 2048, 1, 256, 2048, 2048, 256, 2048]
    - [15, 117.19]
  - - [2048, 2048, 1, 512, 2048, 2048, 512, 2048]
    - [15, 195.53]
  - - [2048, 2048, 1, 1024, 2048, 2048, 1024, 2048]
    - [15, 292.7]
  - - [2048, 2048, 1, 2048, 2048, 2048, 2048, 2048]
    - [15, 388.7]
  - - [2048, 2048, 1, 4096, 2048, 2048, 4096, 2048]
    - [15, 470.25]
  - - [2048, 2048, 1, 8192, 2048, 2048, 8192, 2048]
    - [33, 468.16]
  - - [2048, 4096, 1, 128, 2048, 2048, 128, 4096]
    - [8, 101.67]
  - - [2048, 4096, 1, 256, 2048, 2048, 256, 4096]
    - [8, 173.2]
  - - [2048, 4096, 1, 512, 2048, 2048, 512, 4096]
    - [10, 285.71]
  - - [2048, 4096, 1, 1024, 2048, 2048, 1024, 4096]
    - [10, 416.76]
  - - [2048, 4096, 1, 2048, 2048, 2048, 2048, 4096]
    - [10, 544.68]
  - - [2048, 4096, 1, 4096, 2048, 2048, 4096, 4096]
    - [10, 614.3]
  - - [2048, 4096, 1, 8192, 2048, 2048, 8192, 4096]
    - [10, 562.54]
  - - [2048, 8192, 1, 128, 2048, 2048, 128, 8192]
    - [3, 121.3]
  - - [2048, 8192, 1, 256, 2048, 2048, 256, 8192]
    - [7, 189.07]
  - - [2048, 8192, 1, 512, 2048, 2048, 512, 8192]
    - [6, 294.09]
  - - [2048, 8192, 1, 1024, 2048, 2048, 1024, 8192]
    - [10, 454.74]
  - - [2048, 8192, 1, 2048, 2048, 2048, 2048, 8192]
    - [2, 600.84]
  - - [2048, 8192, 1, 4096, 2048, 2048, 4096, 8192]
    - [32, 724.18]
  - - [2048, 8192, 1, 8192, 2048, 2048, 8192, 8192]
    - [32, 720.57]
  - - [4096, 128, 1, 128, 4096, 4096, 128, 128]
    - [26, 12.45]
  - - [4096, 128, 1, 256, 4096, 4096, 256, 128]
    - [37, 21.94]
  - - [4096, 128, 1, 512, 4096, 4096, 512, 128]
    - [40, 37.71]
  - - [4096, 128, 1, 1024, 4096, 4096, 1024, 128]
    - [40, 61.85]
  - - [4096, 128, 1, 2048, 4096, 4096, 2048, 128]
    - [41, 90.45]
  - - [4096, 128, 1, 4096, 4096, 4096, 4096, 128]
    - [41, 118.98]
  - - [4096, 128, 1, 8192, 4096, 4096, 8192, 128]
    - [41, 135.98]
  - - [4096, 256, 1, 128, 4096, 4096, 128, 256]
    - [23, 23.18]
  - - [4096, 256, 1, 256, 4096, 4096, 256, 256]
    - [22, 40.91]
  - - [4096, 256, 1, 512, 4096, 4096, 512, 256]
    - [22, 69.94]
  - - [4096, 256, 1, 1024, 4096, 4096, 1024, 256]
    - [36, 110.23]
  - - [4096, 256, 1, 2048, 4096, 4096, 2048, 256]
    - [36, 157.34]
  - - [4096, 256, 1, 4096, 4096, 4096, 4096, 256]
    - [36, 201.65]
  - - [4096, 256, 1, 8192, 4096, 4096, 8192, 256]
    - [35, 229.09]
  - - [4096, 512, 1, 128, 4096, 4096, 128, 512]
    - [16, 41.12]
  - - [4096, 512, 1, 256, 4096, 4096, 256, 512]
    - [16, 72.07]
  - - [4096, 512, 1, 512, 4096, 4096, 512, 512]
    - [16, 123.6]
  - - [4096, 512, 1, 1024, 4096, 4096, 1024, 512]
    - [18, 187.05]
  - - [4096, 512, 1, 2048, 4096, 4096, 2048, 512]
    - [34, 263.0]
  - - [4096, 512, 1, 4096, 4096, 4096, 4096, 512]
    - [34, 330.24]
  - - [4096, 512, 1, 8192, 4096, 4096, 8192, 512]
    - [34, 372.85]
  - - [4096, 1024, 1, 128, 4096, 4096, 128, 1024]
    - [11, 67.39]
  - - [4096, 1024, 1, 256, 4096, 4096, 256, 1024]
    - [12, 116.62]
  - - [4096, 1024, 1, 512, 4096, 4096, 512, 1024]
    - [15, 195.29]
  - - [4096, 1024, 1, 1024, 4096, 4096, 1024, 1024]
    - [15, 290.75]
  - - [4096, 1024, 1, 2048, 4096, 4096, 2048, 1024]
    - [15, 383.11]
  - - [4096, 1024, 1, 4096, 4096, 4096, 4096, 1024]
    - [14, 457.1]
  - - [4096, 1024, 1, 8192, 4096, 4096, 8192, 1024]
    - [15, 475.13]
  - - [4096, 2048, 1, 128, 4096, 4096, 128, 2048]
    - [8, 102.2]
  - - [4096, 2048, 1, 256, 4096, 4096, 256, 2048]
    - [9, 173.42]
  - - [4096, 2048, 1, 512, 4096, 4096, 512, 2048]
    - [10, 285.23]
  - - [4096, 2048, 1, 1024, 4096, 4096, 1024, 2048]
    - [10, 417.58]
  - - [4096, 2048, 1, 2048, 4096, 4096, 2048, 2048]
    - [10, 538.93]
  - - [4096, 2048, 1, 4096, 4096, 4096, 4096, 2048]
    - [10, 602.03]
  - - [4096, 2048, 1, 8192, 4096, 4096, 8192, 2048]
    - [10, 577.31]
  - - [4096, 4096, 1, 128, 4096, 4096, 128, 4096]
    - [3, 116.8]
  - - [4096, 4096, 1, 256, 4096, 4096, 256, 4096]
    - [7, 188.44]
  - - [4096, 4096, 1, 512, 4096, 4096, 512, 4096]
    - [10, 299.28]
  - - [4096, 4096, 1, 1024, 4096, 4096, 1024, 4096]
    - [10, 460.1]
  - - [4096, 4096, 1, 2048, 4096, 4096, 2048, 4096]
    - [5, 598.76]
  - - [4096, 4096, 1, 4096, 4096, 4096, 4096, 4096]
    - [32, 685.43]
  - - [4096, 4096, 1, 8192, 4096, 4096, 8192, 4096]
    - [32, 708.75]
  - - [4096, 8192, 1, 128, 4096, 4096, 128, 8192]
    - [3, 137.53]
  - - [4096, 8192, 1, 256, 4096, 4096, 256, 8192]
    - [1, 221.07]
  - - [4096, 8192, 1, 512, 4096, 4096, 512, 8192]
    - [4, 344.48]
  - - [4096, 8192, 1, 1024, 4096, 4096, 1024, 8192]
    - [2, 488.74]
  - - [4096, 8192, 1, 2048, 4096, 4096, 2048, 8192]
    - [32, 615.31]
  - - [4096, 8192, 1, 4096, 4096, 4096, 4096, 8192]
    - [32, 668.4]
  - - [4096, 8192, 1, 8192, 4096, 4096, 8192, 8192]
    - [32, 739.46]
  - - [8192, 128, 1, 128, 8192, 8192, 128, 128]
    - [22, 23.26]
  - - [8192, 128, 1, 256, 8192, 8192, 256, 128]
    - [20, 40.85]
  - - [8192, 128, 1, 512, 8192, 8192, 512, 128]
    - [22, 68.12]
  - - [8192, 128, 1, 1024, 8192, 8192, 1024, 128]
    - [36, 107.65]
  - - [8192, 128, 1, 2048, 8192, 8192, 2048, 128]
    - [36, 155.89]
  - - [8192, 128, 1, 4096, 8192, 8192, 4096, 128]
    - [36, 196.4]
  - - [8192, 128, 1, 8192, 8192, 8192, 8192, 128]
    - [36, 219.15]
  - - [8192, 256, 1, 128, 8192, 8192, 128, 256]
    - [16, 41.23]
  - - [8192, 256, 1, 256, 8192, 8192, 256, 256]
    - [17, 71.94]
  - - [8192, 256, 1, 512, 8192, 8192, 512, 256]
    - [16, 122.73]
  - - [8192, 256, 1, 1024, 8192, 8192, 1024, 256]
    - [18, 185.66]
  - - [8192, 256, 1, 2048, 8192, 8192, 2048, 256]
    - [18, 256.42]
  - - [8192, 256, 1, 4096, 8192, 8192, 4096, 256]
    - [18, 301.41]
  - - [8192, 256, 1, 8192, 8192, 8192, 8192, 256]
    - [34, 340.12]
  - - [8192, 512, 1, 128, 8192, 8192, 128, 512]
    - [13, 67.31]
  - - [8192, 512, 1, 256, 8192, 8192, 256, 512]
    - [15, 117.1]
  - - [8192, 512, 1, 512, 8192, 8192, 512, 512]
    - [13, 193.42]
  - - [8192, 512, 1, 1024, 8192, 8192, 1024, 512]
    - [13, 284.83]
  - - [8192, 512, 1, 2048, 8192, 8192, 2048, 512]
    - [14, 381.79]
  - - [8192, 512, 1, 4096, 8192, 8192, 4096, 512]
    - [14, 453.17]
  - - [8192, 512, 1, 8192, 8192, 8192, 8192, 512]
    - [33, 462.01]
  - - [8192, 1024, 1, 128, 8192, 8192, 128, 1024]
    - [9, 100.8]
  - - [8192, 1024, 1, 256, 8192, 8192, 256, 1024]
    - [9, 172.03]
  - - [8192, 1024, 1, 512, 8192, 8192, 512, 1024]
    - [10, 278.24]
  - - [8192, 1024, 1, 1024, 8192, 8192, 1024, 1024]
    - [10, 395.85]
  - - [8192, 1024, 1, 2048, 8192, 8192, 2048, 1024]
    - [10, 517.87]
  - - [8192, 1024, 1, 4096, 8192, 8192, 4096, 1024]
    - [10, 586.06]
  - - [8192, 1024, 1, 8192, 8192, 8192, 8192, 1024]
    - [10, 557.44]
  - - [8192, 2048, 1, 128, 8192, 8192, 128, 2048]
    - [3, 119.65]
  - - [8192, 2048, 1, 256, 8192, 8192, 256, 2048]
    - [7, 186.82]
  - - [8192, 2048, 1, 512, 8192, 8192, 512, 2048]
    - [4, 303.25]
  - - [8192, 2048, 1, 1024, 8192, 8192, 1024, 2048]
    - [3, 447.33]
  - - [8192, 2048, 1, 2048, 8192, 8192, 2048, 2048]
    - [5, 603.39]
  - - [8192, 2048, 1, 4096, 8192, 8192, 4096, 2048]
    - [32, 720.25]
  - - [8192, 2048, 1, 8192, 8192, 8192, 8192, 2048]
    - [32, 699.9]
  - - [8192, 4096, 1, 128, 8192, 8192, 128, 4096]
    - [5, 139.7]
  - - [8192, 4096, 1, 256, 8192, 8192, 256, 4096]
    - [4, 222.26]
  - - [8192, 4096, 1, 512, 8192, 8192, 512, 4096]
    - [5, 328.67]
  - - [8192, 4096, 1, 1024, 8192, 8192, 1024, 4096]
    - [0, 501.14]
  - - [8192, 4096, 1, 2048, 8192, 8192, 2048, 4096]
    - [5, 595.5]
  - - [8192, 4096, 1, 4096, 8192, 8192, 4096, 4096]
    - [32, 669.67]
  - - [8192, 4096, 1, 8192, 8192, 8192, 8192, 4096]
    - [32, 732.79]
  - - [8192, 8192, 1, 128, 8192, 8192, 128, 8192]
    - [5, 146.1]
  - - [8192, 8192, 1, 256, 8192, 8192, 256, 8192]
    - [4, 247.62]
  - - [8192, 8192, 1, 512, 8192, 8192, 512, 8192]
    - [5, 359.5]
  - - [8192, 8192, 1, 1024, 8192, 8192, 1024, 8192]
    - [32, 503.55]
  - - [8192, 8192, 1, 2048, 8192, 8192, 2048, 8192]
    - [32, 595.57]
  - - [8192, 8192, 1, 4096, 8192, 8192, 4096, 8192]
    - [32, 690.5]
  - - [8192, 8192, 1, 8192, 8192, 8192, 8192, 8192]
    - [32, 807.5]
  - - [1, 1, 1, 32, 1, 1, 32, 1]
    - [48, 0.0]
- null
- null
- DeviceEfficiency
- GridBased
