projects/hipblaslt/library/src/amd_detail/rocblaslt/src/Tensile/Logic/asm_full/gfx950/GridBased/gfx950_Cijk_Alik_Bljk_HSS_BH_Bias_HAS_SAV_UserArgs.yaml
- {MinimumRequiredVersion: 4.33.0}
- gfx950
- gfx950
- [Device 75a0]
    SolutionIndex: 0
    SolutionNameMin: Cijk_Alik_Bljk_HSS_BH_Bias_HAS_SAV_UserArgs_MT128x256x32_MI16x16x1_SN_LDSB1_CLR0_GSU0_GSUC0_GSUWGMRR0_K1_LBSPPA256_LBSPPB512_MIWT4_8_PLR0_SU0_SUM0_SUS0_VWA4_VWB8_WGM1_WGMXCC1_WGMXCCGn1
    SolutionIndex: 1
    SolutionNameMin: Cijk_Alik_Bljk_HSS_BH_Bias_HAS_SAV_UserArgs_MT128x256x32_MI16x16x1_SN_LDSB1_CLR0_GSU0_GSUC0_GSUWGMRR0_K1_LBSPPA256_LBSPPB512_MIWT4_8_PLR0_SU0_SUM0_SUS0_VWA4_VWB8_WGM1_WGMXCC1_WGMXCCGn1
    SolutionIndex: 2
    SolutionNameMin: Cijk_Alik_Bljk_HSS_BH_Bias_HAS_SAV_UserArgs_MT128x256x32_MI16x16x1_SN_LDSB1_CLR0_GSU0_GSUC0_GSUWGMRR0_K1_LBSPPA256_LBSPPB512_MIWT4_8_PLR0_SU0_SUM0_SUS0_VWA4_VWB8_WGM1_WGMXCC1_WGMXCCGn1
    SolutionIndex: 3
    SolutionNameMin: Cijk_Alik_Bljk_HSS_BH_Bias_HAS_SAV_UserArgs_MT128x256x32_MI16x16x1_SN_LDSB1_CLR0_GSU0_GSUC0_GSUWGMRR0_K1_LBSPPA256_LBSPPB512_MIWT4_8_PLR0_SU0_SUM0_SUS0_VWA4_VWB8_WGM1_WGMXCC1_WGMXCCGn1
    SolutionIndex: 4
    SolutionNameMin: Cijk_Alik_Bljk_HSS_BH_Bias_HAS_SAV_UserArgs_MT128x256x32_MI16x16x1_SN_LDSB1_CLR0_GSU0_GSUC0_GSUWGMRR0_K1_LBSPPA256_LBSPPB512_MIWT4_8_PLR0_SU0_SUM0_SUS0_VWA4_VWB8_WGM1_WGMXCC1_WGMXCCGn1
    SolutionIndex: 5
    SolutionNameMin: Cijk_Alik_Bljk_HSS_BH_Bias_HAS_SAV_UserArgs_MT128x128x32_MI16x16x1_SN_LDSB1_CLR0_GSU0_GSUC0_GSUWGMRR0_K1_LBSPPA256_LBSPPB256_MIWT4_4_PLR0_SU0_SUM0_SUS0_VWA4_VWB4_WGM6_WGMXCC1_WGMXCCGn1
    SolutionIndex: 6
    SolutionNameMin: Cijk_Alik_Bljk_HSS_BH_Bias_HAS_SAV_UserArgs_MT256x256x32_MI32x32x1_SN_LDSB0_CLR1_GSU0_GSUC0_GSUWGMRR0_K1_LBSPPA256_LBSPPB256_MIWT4_4_PLR1_SU0_SUM0_SUS0_VWA4_VWB4_WGM1_WGMXCC1_WGMXCCGn1
    SolutionIndex: 7
    SolutionNameMin: Cijk_Alik_Bljk_HSS_BH_Bias_HAS_SAV_UserArgs_MT256x256x32_MI32x32x1_SN_LDSB0_CLR1_GSU0_GSUC0_GSUWGMRR0_K1_LBSPPA256_LBSPPB256_MIWT4_4_PLR1_SU0_SUM0_SUS0_VWA4_VWB4_WGM1_WGMXCC1_WGMXCCGn1
    SolutionIndex: 8
    SolutionNameMin: Cijk_Alik_Bljk_HSS_BH_Bias_HAS_SAV_UserArgs_MT256x256x32_MI32x32x1_SN_LDSB0_CLR1_GSU0_GSUC0_GSUWGMRR0_K1_LBSPPA256_LBSPPB256_MIWT4_4_PLR1_SU0_SUM0_SUS0_VWA4_VWB4_WGM6_WGMXCC1_WGMXCCGn1
    SolutionIndex: 9
    SolutionNameMin: Cijk_Alik_Bljk_HSS_BH_Bias_HAS_SAV_UserArgs_MT256x256x32_MI32x32x1_SN_LDSB0_CLR1_GSU0_GSUC0_GSUWGMRR0_K1_LBSPPA256_LBSPPB256_MIWT4_4_PLR1_SU0_SUM0_SUS0_VWA4_VWB4_WGM6_WGMXCC1_WGMXCCGn1
    SolutionIndex: 10
    SolutionNameMin: Cijk_Alik_Bljk_HSS_BH_Bias_HAS_SAV_UserArgs_MT256x128x32_MI32x32x1_SN_LDSB1_CLR1_GSU0_GSUC0_GSUWGMRR0_K1_LBSPPA256_LBSPPB128_MIWT4_2_PLR1_SU0_SUM0_SUS0_VWA4_VWB2_WGM6_WGMXCC1_WGMXCCGn1
    SolutionIndex: 11
    SolutionNameMin: Cijk_Alik_Bljk_HSS_BH_Bias_HAS_SAV_UserArgs_MT256x128x32_MI32x32x1_SN_LDSB1_CLR1_GSU0_GSUC0_GSUWGMRR0_K1_LBSPPA256_LBSPPB128_MIWT4_2_PLR1_SU0_SUM0_SUS0_VWA4_VWB2_WGM6_WGMXCC1_WGMXCCGn1
    SolutionIndex: 12
    SolutionNameMin: Cijk_Alik_Bljk_HSS_BH_Bias_HAS_SAV_UserArgs_MT256x128x32_MI32x32x1_SN_LDSB1_CLR1_GSU0_GSUC0_GSUWGMRR0_K1_LBSPPA256_LBSPPB128_MIWT4_2_PLR1_SU0_SUM0_SUS0_VWA4_VWB2_WGM6_WGMXCC1_WGMXCCGn1
    SolutionIndex: 13
    SolutionNameMin: Cijk_Alik_Bljk_HSS_BH_Bias_HAS_SAV_UserArgs_MT128x128x32_MI32x32x1_SN_LDSB1_CLR1_GSU0_GSUC0_GSUWGMRR0_K1_LBSPPA128_LBSPPB128_MIWT2_2_PLR1_SU0_SUM0_SUS0_VWA2_VWB2_WGM8_WGMXCC1_WGMXCCGn1
    SolutionIndex: 14
    SolutionNameMin: Cijk_Alik_Bljk_HSS_BH_Bias_HAS_SAV_UserArgs_MT256x256x64_MI16x16x1_SN_LDSB1_CLR1_GSU0_GSUC0_GSUWGMRR0_K1_LBSPPA1024_LBSPPB1024_MIWT8_8_PLR1_SU0_SUM0_SUS0_VWA8_VWB8_WGM6_WGMXCC1_WGMXCCGn1
    SolutionIndex: 15
    SolutionNameMin: Cijk_Alik_Bljk_HSS_BH_Bias_HAS_SAV_UserArgs_MT256x256x64_MI16x16x1_SN_LDSB1_CLR1_GSU0_GSUC0_GSUWGMRR0_K1_LBSPPA1024_LBSPPB1024_MIWT8_8_PLR1_SU0_SUM0_SUS0_VWA8_VWB8_WGM6_WGMXCC1_WGMXCCGn1
    SolutionIndex: 16
    SolutionNameMin: Cijk_Alik_Bljk_HSS_BH_Bias_HAS_SAV_UserArgs_MT256x256x64_MI16x16x1_SN_LDSB1_CLR1_GSU0_GSUC0_GSUWGMRR0_K1_LBSPPA1024_LBSPPB1024_MIWT8_8_PLR1_SU0_SUM0_SUS0_VWA8_VWB8_WGM8_WGMXCC1_WGMXCCGn1
    SolutionIndex: 17
    SolutionNameMin: Cijk_Alik_Bljk_HSS_BH_Bias_HAS_SAV_UserArgs_MT256x256x64_MI16x16x1_SN_LDSB1_CLR1_GSU0_GSUC0_GSUWGMRR0_K1_LBSPPA1024_LBSPPB1024_MIWT8_8_PLR1_SU0_SUM0_SUS0_VWA8_VWB8_WGM8_WGMXCC1_WGMXCCGn1
    SolutionIndex: 18
    SolutionNameMin: Cijk_Alik_Bljk_HSS_BH_Bias_HAS_SAV_UserArgs_MT128x256x64_MI16x16x1_SN_LDSB1_CLR1_GSU0_GSUC0_GSUWGMRR0_K1_LBSPPA512_LBSPPB1024_MIWT4_8_PLR1_SU0_SUM0_SUS0_VWA4_VWB8_WGM1_WGMXCC1_WGMXCCGn1
    SolutionIndex: 19
    SolutionNameMin: Cijk_Alik_Bljk_HSS_BH_Bias_HAS_SAV_UserArgs_MT128x256x64_MI16x16x1_SN_LDSB1_CLR1_GSU0_GSUC0_GSUWGMRR0_K1_LBSPPA512_LBSPPB1024_MIWT4_8_PLR1_SU0_SUM0_SUS0_VWA4_VWB8_WGM1_WGMXCC1_WGMXCCGn1
    SolutionIndex: 20
    SolutionNameMin: Cijk_Alik_Bljk_HSS_BH_Bias_HAS_SAV_UserArgs_MT128x256x64_MI16x16x1_SN_LDSB1_CLR1_GSU0_GSUC0_GSUWGMRR0_K1_LBSPPA512_LBSPPB1024_MIWT4_8_PLR1_SU0_SUM0_SUS0_VWA4_VWB8_WGM1_WGMXCC1_WGMXCCGn1
    SolutionIndex: 21
    SolutionNameMin: Cijk_Alik_Bljk_HSS_BH_Bias_HAS_SAV_UserArgs_MT128x256x64_MI16x16x1_SN_LDSB1_CLR1_GSU0_GSUC0_GSUWGMRR0_K1_LBSPPA512_LBSPPB1024_MIWT4_8_PLR1_SU0_SUM0_SUS0_VWA4_VWB8_WGM1_WGMXCC1_WGMXCCGn1
    SolutionIndex: 22
    SolutionNameMin: Cijk_Alik_Bljk_HSS_BH_Bias_HAS_SAV_UserArgs_MT128x256x64_MI16x16x1_SN_LDSB1_CLR1_GSU0_GSUC0_GSUWGMRR0_K1_LBSPPA512_LBSPPB1024_MIWT4_8_PLR1_SU0_SUM0_SUS0_VWA4_VWB8_WGM1_WGMXCC1_WGMXCCGn1
    SolutionIndex: 23
    SolutionNameMin: Cijk_Alik_Bljk_HSS_BH_Bias_HAS_SAV_UserArgs_MT128x256x64_MI16x16x1_SN_LDSB1_CLR1_GSU0_GSUC0_GSUWGMRR0_K1_LBSPPA512_LBSPPB1024_MIWT4_8_PLR1_SU0_SUM0_SUS0_VWA4_VWB8_WGM6_WGMXCC1_WGMXCCGn1
    SolutionIndex: 24
    SolutionNameMin: Cijk_Alik_Bljk_HSS_BH_Bias_HAS_SAV_UserArgs_MT128x256x64_MI16x16x1_SN_LDSB1_CLR1_GSU0_GSUC0_GSUWGMRR0_K1_LBSPPA512_LBSPPB1024_MIWT4_8_PLR1_SU0_SUM0_SUS0_VWA4_VWB8_WGM6_WGMXCC1_WGMXCCGn1
    SolutionIndex: 25
    SolutionNameMin: Cijk_Alik_Bljk_HSS_BH_Bias_HAS_SAV_UserArgs_MT128x256x64_MI16x16x1_SN_LDSB1_CLR1_GSU0_GSUC0_GSUWGMRR0_K1_LBSPPA512_LBSPPB1024_MIWT4_8_PLR1_SU0_SUM0_SUS0_VWA4_VWB8_WGM6_WGMXCC1_WGMXCCGn1
    SolutionIndex: 26
    SolutionNameMin: Cijk_Alik_Bljk_HSS_BH_Bias_HAS_SAV_UserArgs_MT128x256x64_MI16x16x1_SN_LDSB1_CLR1_GSU0_GSUC0_GSUWGMRR0_K1_LBSPPA512_LBSPPB1024_MIWT4_8_PLR1_SU0_SUM0_SUS0_VWA4_VWB8_WGM8_WGMXCC1_WGMXCCGn1
    SolutionIndex: 27
    SolutionNameMin: Cijk_Alik_Bljk_HSS_BH_Bias_HAS_SAV_UserArgs_MT128x256x64_MI16x16x1_SN_LDSB1_CLR1_GSU0_GSUC0_GSUWGMRR0_K1_LBSPPA512_LBSPPB1024_MIWT4_8_PLR1_SU0_SUM0_SUS0_VWA4_VWB8_WGM8_WGMXCC1_WGMXCCGn1
    SolutionIndex: 28
    SolutionNameMin: Cijk_Alik_Bljk_HSS_BH_Bias_HAS_SAV_UserArgs_MT128x256x64_MI16x16x1_SN_LDSB1_CLR1_GSU0_GSUC0_GSUWGMRR0_K1_LBSPPA512_LBSPPB1024_MIWT4_8_PLR1_SU0_SUM0_SUS0_VWA4_VWB8_WGM8_WGMXCC1_WGMXCCGn1
    SolutionIndex: 29
    SolutionNameMin: Cijk_Alik_Bljk_HSS_BH_Bias_HAS_SAV_UserArgs_MT256x128x64_MI16x16x1_SN_LDSB1_CLR1_GSU0_GSUC0_GSUWGMRR0_K1_LBSPPA1024_LBSPPB512_MIWT8_4_PLR1_SU0_SUM0_SUS0_VWA8_VWB4_WGM1_WGMXCC1_WGMXCCGn1
    SolutionIndex: 30
    SolutionNameMin: Cijk_Alik_Bljk_HSS_BH_Bias_HAS_SAV_UserArgs_MT256x128x64_MI16x16x1_SN_LDSB1_CLR1_GSU0_GSUC0_GSUWGMRR0_K1_LBSPPA1024_LBSPPB512_MIWT8_4_PLR1_SU0_SUM0_SUS0_VWA8_VWB4_WGM6_WGMXCC1_WGMXCCGn1
    SolutionIndex: 31
    SolutionNameMin: Cijk_Alik_Bljk_HSS_BH_Bias_HAS_SAV_UserArgs_MT256x128x64_MI16x16x1_SN_LDSB1_CLR1_GSU0_GSUC0_GSUWGMRR0_K1_LBSPPA1024_LBSPPB512_MIWT8_4_PLR1_SU0_SUM0_SUS0_VWA8_VWB4_WGM8_WGMXCC1_WGMXCCGn1
    SolutionIndex: 32
    SolutionNameMin: Cijk_Alik_Bljk_HSS_BH_Bias_HAS_SAV_UserArgs_MT256x128x64_MI16x16x1_SN_LDSB1_CLR1_GSU0_GSUC0_GSUWGMRR0_K1_LBSPPA1024_LBSPPB512_MIWT8_4_PLR1_SU0_SUM0_SUS0_VWA8_VWB4_WGM8_WGMXCC1_WGMXCCGn1
    SolutionIndex: 33
    SolutionNameMin: Cijk_Alik_Bljk_HSS_BH_Bias_HAS_SAV_UserArgs_MT128x128x64_MI16x16x1_SN_LDSB1_CLR1_GSU0_GSUC0_GSUWGMRR0_K1_LBSPPA512_LBSPPB512_MIWT4_4_PLR1_SU0_SUM0_SUS0_VWA4_VWB4_WGM1_WGMXCC1_WGMXCCGn1
    SolutionIndex: 34
    SolutionNameMin: Cijk_Alik_Bljk_HSS_BH_Bias_HAS_SAV_UserArgs_MT128x128x64_MI16x16x1_SN_LDSB1_CLR1_GSU0_GSUC0_GSUWGMRR0_K1_LBSPPA512_LBSPPB512_MIWT4_4_PLR1_SU0_SUM0_SUS0_VWA4_VWB4_WGM1_WGMXCC1_WGMXCCGn1
    SolutionIndex: 35
    SolutionNameMin: Cijk_Alik_Bljk_HSS_BH_Bias_HAS_SAV_UserArgs_MT128x128x64_MI16x16x1_SN_LDSB1_CLR1_GSU0_GSUC0_GSUWGMRR0_K1_LBSPPA512_LBSPPB512_MIWT4_4_PLR1_SU0_SUM0_SUS0_VWA4_VWB4_WGM1_WGMXCC1_WGMXCCGn1
    SolutionIndex: 36
    SolutionNameMin: Cijk_Alik_Bljk_HSS_BH_Bias_HAS_SAV_UserArgs_MT128x128x64_MI16x16x1_SN_LDSB1_CLR1_GSU0_GSUC0_GSUWGMRR0_K1_LBSPPA512_LBSPPB512_MIWT4_4_PLR1_SU0_SUM0_SUS0_VWA4_VWB4_WGM6_WGMXCC1_WGMXCCGn1
    SolutionIndex: 37
    SolutionNameMin: Cijk_Alik_Bljk_HSS_BH_Bias_HAS_SAV_UserArgs_MT128x128x64_MI16x16x1_SN_LDSB1_CLR1_GSU0_GSUC0_GSUWGMRR0_K1_LBSPPA512_LBSPPB512_MIWT4_4_PLR1_SU0_SUM0_SUS0_VWA4_VWB4_WGM6_WGMXCC1_WGMXCCGn1
    SolutionIndex: 38
    SolutionNameMin: Cijk_Alik_Bljk_HSS_BH_Bias_HAS_SAV_UserArgs_MT128x128x64_MI16x16x1_SN_LDSB1_CLR1_GSU0_GSUC0_GSUWGMRR0_K1_LBSPPA512_LBSPPB512_MIWT4_4_PLR1_SU0_SUM0_SUS0_VWA4_VWB4_WGM6_WGMXCC1_WGMXCCGn1
    SolutionIndex: 39
    SolutionNameMin: Cijk_Alik_Bljk_HSS_BH_Bias_HAS_SAV_UserArgs_MT128x128x64_MI16x16x1_SN_LDSB1_CLR1_GSU0_GSUC0_GSUWGMRR0_K1_LBSPPA512_LBSPPB512_MIWT4_4_PLR1_SU0_SUM0_SUS0_VWA4_VWB4_WGM8_WGMXCC1_WGMXCCGn1
    SolutionIndex: 40
    SolutionNameMin: Cijk_Alik_Bljk_HSS_BH_Bias_HAS_SAV_UserArgs_MT128x128x64_MI16x16x1_SN_LDSB1_CLR1_GSU0_GSUC0_GSUWGMRR0_K1_LBSPPA512_LBSPPB512_MIWT4_4_PLR1_SU0_SUM0_SUS0_VWA4_VWB4_WGM8_WGMXCC1_WGMXCCGn1
    SolutionIndex: 41
    SolutionNameMin: Cijk_Alik_Bljk_HSS_BH_Bias_HAS_SAV_UserArgs_MT128x128x64_MI16x16x1_SN_LDSB1_CLR1_GSU0_GSUC0_GSUWGMRR0_K1_LBSPPA512_LBSPPB512_MIWT4_4_PLR1_SU0_SUM0_SUS0_VWA4_VWB4_WGM8_WGMXCC1_WGMXCCGn1
    SolutionIndex: 42
    SolutionNameMin: Cijk_Alik_Bljk_HSS_BH_Bias_HAS_SAV_UserArgs_MT128x128x64_MI16x16x1_SN_LDSB1_CLR1_GSU0_GSUC0_GSUWGMRR0_K1_LBSPPA512_LBSPPB512_MIWT4_4_PLR1_SU0_SUM0_SUS0_VWA4_VWB4_WGM8_WGMXCC1_WGMXCCGn1
    SolutionIndex: 43
    SolutionNameMin: Cijk_Alik_Bljk_HSS_BH_Bias_HAS_SAV_UserArgs_MT128x128x64_MI16x16x1_SN_LDSB1_CLR1_GSU0_GSUC0_GSUWGMRR0_K1_LBSPPA512_LBSPPB512_MIWT4_4_PLR1_SU0_SUM0_SUS0_VWA4_VWB4_WGM8_WGMXCC1_WGMXCCGn1
    SolutionIndex: 44
    SolutionNameMin: Cijk_Alik_Bljk_HSS_BH_Bias_HAS_SAV_UserArgs_MT128x128x64_MI16x16x1_SN_LDSB1_CLR1_GSU0_GSUC0_GSUWGMRR0_K1_LBSPPA512_LBSPPB512_MIWT4_4_PLR1_SU0_SUM0_SUS0_VWA4_VWB4_WGM8_WGMXCC1_WGMXCCGn1
    SolutionIndex: 45
    SolutionNameMin: Cijk_Alik_Bljk_HSS_BH_Bias_HAS_SAV_UserArgs_MT64x128x64_MI16x16x1_SN_LDSB1_CLR1_GSU0_GSUC0_GSUWGMRR0_K1_LBSPPA256_LBSPPB512_MIWT2_4_PLR1_SU0_SUM0_SUS0_VWA2_VWB4_WGM8_WGMXCC1_WGMXCCGn1
    SolutionIndex: 46
    SolutionNameMin: Cijk_Alik_Bljk_HSS_BH_Bias_HAS_SAV_UserArgs_MT64x128x64_MI16x16x1_SN_LDSB1_CLR1_GSU0_GSUC0_GSUWGMRR0_K1_LBSPPA256_LBSPPB512_MIWT2_4_PLR1_SU0_SUM0_SUS0_VWA2_VWB4_WGM8_WGMXCC1_WGMXCCGn1
    SolutionIndex: 47
    SolutionNameMin: Cijk_Alik_Bljk_HSS_BH_Bias_HAS_SAV_UserArgs_MT128x64x64_MI16x16x1_SN_LDSB1_CLR1_GSU0_GSUC0_GSUWGMRR0_K1_LBSPPA512_LBSPPB256_MIWT4_2_PLR1_SU0_SUM0_SUS0_VWA4_VWB2_WGM1_WGMXCC1_WGMXCCGn1
    SolutionIndex: 48
    SolutionNameMin: Cijk_Alik_Bljk_HSS_BH_Bias_HAS_SAV_UserArgs_MT128x64x64_MI16x16x1_SN_LDSB1_CLR1_GSU0_GSUC0_GSUWGMRR0_K1_LBSPPA512_LBSPPB256_MIWT4_2_PLR1_SU0_SUM0_SUS0_VWA4_VWB2_WGM1_WGMXCC1_WGMXCCGn1
    SolutionIndex: 49
    SolutionNameMin: Cijk_Alik_Bljk_HSS_BH_Bias_HAS_SAV_UserArgs_MT128x64x64_MI16x16x1_SN_LDSB1_CLR1_GSU0_GSUC0_GSUWGMRR0_K1_LBSPPA512_LBSPPB256_MIWT4_2_PLR1_SU0_SUM0_SUS0_VWA4_VWB2_WGM1_WGMXCC1_WGMXCCGn1
    SolutionIndex: 50
    SolutionNameMin: Cijk_Alik_Bljk_HSS_BH_Bias_HAS_SAV_UserArgs_MT128x64x64_MI16x16x1_SN_LDSB1_CLR1_GSU0_GSUC0_GSUWGMRR0_K1_LBSPPA512_LBSPPB256_MIWT4_2_PLR1_SU0_SUM0_SUS0_VWA4_VWB2_WGM6_WGMXCC1_WGMXCCGn1
    SolutionIndex: 51
    SolutionNameMin: Cijk_Alik_Bljk_HSS_BH_Bias_HAS_SAV_UserArgs_MT128x64x64_MI16x16x1_SN_LDSB1_CLR1_GSU0_GSUC0_GSUWGMRR0_K1_LBSPPA512_LBSPPB256_MIWT4_2_PLR1_SU0_SUM0_SUS0_VWA4_VWB2_WGM6_WGMXCC1_WGMXCCGn1
    SolutionIndex: 52
    SolutionNameMin: Cijk_Alik_Bljk_HSS_BH_Bias_HAS_SAV_UserArgs_MT128x64x64_MI16x16x1_SN_LDSB1_CLR1_GSU0_GSUC0_GSUWGMRR0_K1_LBSPPA512_LBSPPB256_MIWT4_2_PLR1_SU0_SUM0_SUS0_VWA4_VWB2_WGM8_WGMXCC1_WGMXCCGn1
    SolutionIndex: 53
    SolutionNameMin: Cijk_Alik_Bljk_HSS_BH_Bias_HAS_SAV_UserArgs_MT128x64x64_MI16x16x1_SN_LDSB1_CLR1_GSU0_GSUC0_GSUWGMRR0_K1_LBSPPA512_LBSPPB256_MIWT4_2_PLR1_SU0_SUM0_SUS0_VWA4_VWB2_WGM8_WGMXCC1_WGMXCCGn1
    SolutionIndex: 54
    SolutionNameMin: Cijk_Alik_Bljk_HSS_BH_Bias_HAS_SAV_UserArgs_MT256x256x64_MI32x32x1_SN_LDSB1_CLR1_GSU0_GSUC0_GSUWGMRR0_K1_LBSPPA512_LBSPPB512_MIWT4_4_PLR1_SU0_SUM0_SUS0_VWA4_VWB4_WGM1_WGMXCC1_WGMXCCGn1
    SolutionIndex: 55
    SolutionNameMin: Cijk_Alik_Bljk_HSS_BH_Bias_HAS_SAV_UserArgs_MT256x256x64_MI32x32x1_SN_LDSB1_CLR1_GSU0_GSUC0_GSUWGMRR0_K1_LBSPPA512_LBSPPB512_MIWT4_4_PLR1_SU0_SUM0_SUS0_VWA4_VWB4_WGM1_WGMXCC1_WGMXCCGn1
    SolutionIndex: 56
    SolutionNameMin: Cijk_Alik_Bljk_HSS_BH_Bias_HAS_SAV_UserArgs_MT256x256x64_MI32x32x1_SN_LDSB1_CLR1_GSU0_GSUC0_GSUWGMRR0_K1_LBSPPA512_LBSPPB512_MIWT4_4_PLR1_SU0_SUM0_SUS0_VWA4_VWB4_WGM1_WGMXCC1_WGMXCCGn1
    SolutionIndex: 57
    SolutionNameMin: Cijk_Alik_Bljk_HSS_BH_Bias_HAS_SAV_UserArgs_MT256x256x64_MI32x32x1_SN_LDSB1_CLR1_GSU0_GSUC0_GSUWGMRR0_K1_LBSPPA512_LBSPPB512_MIWT4_4_PLR1_SU0_SUM0_SUS0_VWA4_VWB4_WGM6_WGMXCC1_WGMXCCGn1
    SolutionIndex: 58
    SolutionNameMin: Cijk_Alik_Bljk_HSS_BH_Bias_HAS_SAV_UserArgs_MT256x256x64_MI32x32x1_SN_LDSB1_CLR1_GSU0_GSUC0_GSUWGMRR0_K1_LBSPPA512_LBSPPB512_MIWT4_4_PLR1_SU0_SUM0_SUS0_VWA4_VWB4_WGM6_WGMXCC1_WGMXCCGn1
    SolutionIndex: 59
    SolutionNameMin: Cijk_Alik_Bljk_HSS_BH_Bias_HAS_SAV_UserArgs_MT256x256x64_MI32x32x1_SN_LDSB1_CLR1_GSU0_GSUC0_GSUWGMRR0_K1_LBSPPA512_LBSPPB512_MIWT4_4_PLR1_SU0_SUM0_SUS0_VWA4_VWB4_WGM6_WGMXCC1_WGMXCCGn1
    SolutionIndex: 60
    SolutionNameMin: Cijk_Alik_Bljk_HSS_BH_Bias_HAS_SAV_UserArgs_MT256x256x64_MI32x32x1_SN_LDSB1_CLR1_GSU0_GSUC0_GSUWGMRR0_K1_LBSPPA512_LBSPPB512_MIWT4_4_PLR1_SU0_SUM0_SUS0_VWA4_VWB4_WGM6_WGMXCC1_WGMXCCGn1
    SolutionIndex: 61
    SolutionNameMin: Cijk_Alik_Bljk_HSS_BH_Bias_HAS_SAV_UserArgs_MT256x256x64_MI32x32x1_SN_LDSB1_CLR1_GSU0_GSUC0_GSUWGMRR0_K1_LBSPPA512_LBSPPB512_MIWT4_4_PLR1_SU0_SUM0_SUS0_VWA4_VWB4_WGM8_WGMXCC1_WGMXCCGn1
    SolutionIndex: 62
    SolutionNameMin: Cijk_Alik_Bljk_HSS_BH_Bias_HAS_SAV_UserArgs_MT128x128x64_MI32x32x1_SN_LDSB1_CLR1_GSU0_GSUC0_GSUWGMRR0_K1_LBSPPA256_LBSPPB256_MIWT2_2_PLR1_SU0_SUM0_SUS0_VWA2_VWB2_WGM1_WGMXCC1_WGMXCCGn1
    SolutionIndex: 63
    SolutionNameMin: Cijk_Alik_Bljk_HSS_BH_Bias_HAS_SAV_UserArgs_MT128x128x64_MI32x32x1_SN_LDSB1_CLR1_GSU0_GSUC0_GSUWGMRR0_K1_LBSPPA256_LBSPPB256_MIWT2_2_PLR1_SU0_SUM0_SUS0_VWA2_VWB2_WGM6_WGMXCC1_WGMXCCGn1
    SolutionIndex: 64
    SolutionNameMin: Cijk_Alik_Bljk_HSS_BH_Bias_HAS_SAV_UserArgs_MT64x128x64_MI32x32x1_SN_LDSB1_CLR1_GSU0_GSUC0_GSUWGMRR0_K1_LBSPPA128_LBSPPB256_MIWT1_2_PLR1_SU0_SUM0_SUS0_VWA1_VWB2_WGM1_WGMXCC1_WGMXCCGn1
    SolutionIndex: 65
    SolutionNameMin: Cijk_Alik_Bljk_HSS_BH_Bias_HAS_SAV_UserArgs_MT128x64x64_MI32x32x1_SN_LDSB1_CLR1_GSU0_GSUC0_GSUWGMRR0_K1_LBSPPA256_LBSPPB128_MIWT2_1_PLR1_SU0_SUM0_SUS0_VWA2_VWB1_WGM1_WGMXCC1_WGMXCCGn1
    SolutionIndex: 66
    SolutionNameMin: Cijk_Alik_Bljk_HSS_BH_Bias_HAS_SAV_UserArgs_MT128x128x128_MI16x16x1_SN_LDSB1_CLR1_GSU0_GSUC0_GSUWGMRR0_K1_LBSPPA1024_LBSPPB1024_MIWT4_4_PLR1_SU0_SUM0_SUS0_VWA4_VWB4_WGM1_WGMXCC1_WGMXCCGn1
    SolutionIndex: 67
    SolutionNameMin: Cijk_Alik_Bljk_HSS_BH_Bias_HAS_SAV_UserArgs_MT128x128x128_MI16x16x1_SN_LDSB1_CLR1_GSU0_GSUC0_GSUWGMRR0_K1_LBSPPA1024_LBSPPB1024_MIWT4_4_PLR1_SU0_SUM0_SUS0_VWA4_VWB4_WGM1_WGMXCC1_WGMXCCGn1
    SolutionIndex: 68
    SolutionNameMin: Cijk_Alik_Bljk_HSS_BH_Bias_HAS_SAV_UserArgs_MT128x128x128_MI16x16x1_SN_LDSB1_CLR1_GSU0_GSUC0_GSUWGMRR0_K1_LBSPPA1024_LBSPPB1024_MIWT4_4_PLR1_SU0_SUM0_SUS0_VWA4_VWB4_WGM6_WGMXCC1_WGMXCCGn1
    SolutionIndex: 69
    SolutionNameMin: Cijk_Alik_Bljk_HSS_BH_Bias_HAS_SAV_UserArgs_MT128x128x128_MI16x16x1_SN_LDSB1_CLR1_GSU0_GSUC0_GSUWGMRR0_K1_LBSPPA1024_LBSPPB1024_MIWT4_4_PLR1_SU0_SUM0_SUS0_VWA4_VWB4_WGM6_WGMXCC1_WGMXCCGn1
    SolutionIndex: 70
    SolutionNameMin: Cijk_Alik_Bljk_HSS_BH_Bias_HAS_SAV_UserArgs_MT128x128x128_MI16x16x1_SN_LDSB1_CLR1_GSU0_GSUC0_GSUWGMRR0_K1_LBSPPA1024_LBSPPB1024_MIWT4_4_PLR1_SU0_SUM0_SUS0_VWA4_VWB4_WGM6_WGMXCC1_WGMXCCGn1
    SolutionIndex: 71
    SolutionNameMin: Cijk_Alik_Bljk_HSS_BH_Bias_HAS_SAV_UserArgs_MT128x128x128_MI16x16x1_SN_LDSB1_CLR1_GSU0_GSUC0_GSUWGMRR0_K1_LBSPPA1024_LBSPPB1024_MIWT4_4_PLR1_SU0_SUM0_SUS0_VWA4_VWB4_WGM6_WGMXCC1_WGMXCCGn1
    SolutionIndex: 72
    SolutionNameMin: Cijk_Alik_Bljk_HSS_BH_Bias_HAS_SAV_UserArgs_MT128x128x128_MI16x16x1_SN_LDSB1_CLR1_GSU0_GSUC0_GSUWGMRR0_K1_LBSPPA1024_LBSPPB1024_MIWT4_4_PLR1_SU0_SUM0_SUS0_VWA4_VWB4_WGM8_WGMXCC1_WGMXCCGn1
    SolutionIndex: 73
    SolutionNameMin: Cijk_Alik_Bljk_HSS_BH_Bias_HAS_SAV_UserArgs_MT128x128x128_MI16x16x1_SN_LDSB1_CLR1_GSU0_GSUC0_GSUWGMRR0_K1_LBSPPA1024_LBSPPB1024_MIWT4_4_PLR1_SU0_SUM0_SUS0_VWA4_VWB4_WGM8_WGMXCC1_WGMXCCGn1
    SolutionIndex: 74
    SolutionNameMin: Cijk_Alik_Bljk_HSS_BH_Bias_HAS_SAV_UserArgs_MT64x128x128_MI16x16x1_SN_LDSB1_CLR1_GSU0_GSUC0_GSUWGMRR0_K1_LBSPPA512_LBSPPB1024_MIWT2_4_PLR1_SU0_SUM0_SUS0_VWA2_VWB4_WGM1_WGMXCC1_WGMXCCGn1
    SolutionIndex: 75
    SolutionNameMin: Cijk_Alik_Bljk_HSS_BH_Bias_HAS_SAV_UserArgs_MT64x128x128_MI16x16x1_SN_LDSB1_CLR1_GSU0_GSUC0_GSUWGMRR0_K1_LBSPPA512_LBSPPB1024_MIWT2_4_PLR1_SU0_SUM0_SUS0_VWA2_VWB4_WGM1_WGMXCC1_WGMXCCGn1
    SolutionIndex: 76
    SolutionNameMin: Cijk_Alik_Bljk_HSS_BH_Bias_HAS_SAV_UserArgs_MT64x128x128_MI16x16x1_SN_LDSB1_CLR1_GSU0_GSUC0_GSUWGMRR0_K1_LBSPPA512_LBSPPB1024_MIWT2_4_PLR1_SU0_SUM0_SUS0_VWA2_VWB4_WGM1_WGMXCC1_WGMXCCGn1
    SolutionIndex: 77
    SolutionNameMin: Cijk_Alik_Bljk_HSS_BH_Bias_HAS_SAV_UserArgs_MT64x128x128_MI16x16x1_SN_LDSB1_CLR1_GSU0_GSUC0_GSUWGMRR0_K1_LBSPPA512_LBSPPB1024_MIWT2_4_PLR1_SU0_SUM0_SUS0_VWA2_VWB4_WGM6_WGMXCC1_WGMXCCGn1
    SolutionIndex: 78
    SolutionNameMin: Cijk_Alik_Bljk_HSS_BH_Bias_HAS_SAV_UserArgs_MT64x128x128_MI16x16x1_SN_LDSB1_CLR1_GSU0_GSUC0_GSUWGMRR0_K1_LBSPPA512_LBSPPB1024_MIWT2_4_PLR1_SU0_SUM0_SUS0_VWA2_VWB4_WGM6_WGMXCC1_WGMXCCGn1
    SolutionIndex: 79
    SolutionNameMin: Cijk_Alik_Bljk_HSS_BH_Bias_HAS_SAV_UserArgs_MT64x128x128_MI16x16x1_SN_LDSB1_CLR1_GSU0_GSUC0_GSUWGMRR0_K1_LBSPPA512_LBSPPB1024_MIWT2_4_PLR1_SU0_SUM0_SUS0_VWA2_VWB4_WGM8_WGMXCC1_WGMXCCGn1
    SolutionIndex: 80
    SolutionNameMin: Cijk_Alik_Bljk_HSS_BH_Bias_HAS_SAV_UserArgs_MT64x128x128_MI16x16x1_SN_LDSB1_CLR1_GSU0_GSUC0_GSUWGMRR0_K1_LBSPPA512_LBSPPB1024_MIWT2_4_PLR1_SU0_SUM0_SUS0_VWA2_VWB4_WGM8_WGMXCC1_WGMXCCGn1
    SolutionIndex: 81
    SolutionNameMin: Cijk_Alik_Bljk_HSS_BH_Bias_HAS_SAV_UserArgs_MT128x64x128_MI16x16x1_SN_LDSB1_CLR1_GSU0_GSUC0_GSUWGMRR0_K1_LBSPPA1024_LBSPPB512_MIWT4_2_PLR1_SU0_SUM0_SUS0_VWA4_VWB2_WGM1_WGMXCC1_WGMXCCGn1
    SolutionIndex: 82
    SolutionNameMin: Cijk_Alik_Bljk_HSS_BH_Bias_HAS_SAV_UserArgs_MT128x64x128_MI16x16x1_SN_LDSB1_CLR1_GSU0_GSUC0_GSUWGMRR0_K1_LBSPPA1024_LBSPPB512_MIWT4_2_PLR1_SU0_SUM0_SUS0_VWA4_VWB2_WGM1_WGMXCC1_WGMXCCGn1
    SolutionIndex: 83
    SolutionNameMin: Cijk_Alik_Bljk_HSS_BH_Bias_HAS_SAV_UserArgs_MT128x64x128_MI16x16x1_SN_LDSB1_CLR1_GSU0_GSUC0_GSUWGMRR0_K1_LBSPPA1024_LBSPPB512_MIWT4_2_PLR1_SU0_SUM0_SUS0_VWA4_VWB2_WGM8_WGMXCC1_WGMXCCGn1
    SolutionIndex: 84
    SolutionNameMin: Cijk_Alik_Bljk_HSS_BH_Bias_HAS_SAV_UserArgs_MT128x64x128_MI16x16x1_SN_LDSB1_CLR1_GSU0_GSUC0_GSUWGMRR0_K1_LBSPPA1024_LBSPPB512_MIWT4_2_PLR1_SU0_SUM0_SUS0_VWA4_VWB2_WGM8_WGMXCC1_WGMXCCGn1
    SolutionIndex: 85
    SolutionNameMin: Cijk_Alik_Bljk_HSS_BH_Bias_HAS_SAV_UserArgs_MT64x64x128_MI16x16x1_SN_LDSB1_CLR1_GSU0_GSUC0_GSUWGMRR0_K1_LBSPPA512_LBSPPB512_MIWT2_2_PLR1_SU0_SUM0_SUS0_VWA2_VWB2_WGM1_WGMXCC1_WGMXCCGn1
    SolutionIndex: 86
    SolutionNameMin: Cijk_Alik_Bljk_HSS_BH_Bias_HAS_SAV_UserArgs_MT64x64x128_MI16x16x1_SN_LDSB1_CLR1_GSU0_GSUC0_GSUWGMRR0_K1_LBSPPA512_LBSPPB512_MIWT2_2_PLR1_SU0_SUM0_SUS0_VWA2_VWB2_WGM1_WGMXCC1_WGMXCCGn1
    SolutionIndex: 87
    SolutionNameMin: Cijk_Alik_Bljk_HSS_BH_Bias_HAS_SAV_UserArgs_MT64x64x128_MI16x16x1_SN_LDSB1_CLR1_GSU0_GSUC0_GSUWGMRR0_K1_LBSPPA512_LBSPPB512_MIWT2_2_PLR1_SU0_SUM0_SUS0_VWA2_VWB2_WGM1_WGMXCC1_WGMXCCGn1
    SolutionIndex: 88
    SolutionNameMin: Cijk_Alik_Bljk_HSS_BH_Bias_HAS_SAV_UserArgs_MT64x64x128_MI16x16x1_SN_LDSB1_CLR1_GSU0_GSUC0_GSUWGMRR0_K1_LBSPPA512_LBSPPB512_MIWT2_2_PLR1_SU0_SUM0_SUS0_VWA2_VWB2_WGM1_WGMXCC1_WGMXCCGn1
    SolutionIndex: 89
    SolutionNameMin: Cijk_Alik_Bljk_HSS_BH_Bias_HAS_SAV_UserArgs_MT64x64x128_MI16x16x1_SN_LDSB1_CLR1_GSU0_GSUC0_GSUWGMRR0_K1_LBSPPA512_LBSPPB512_MIWT2_2_PLR1_SU0_SUM0_SUS0_VWA2_VWB2_WGM6_WGMXCC1_WGMXCCGn1
    SolutionIndex: 90
    SolutionNameMin: Cijk_Alik_Bljk_HSS_BH_Bias_HAS_SAV_UserArgs_MT64x64x128_MI16x16x1_SN_LDSB1_CLR1_GSU0_GSUC0_GSUWGMRR0_K1_LBSPPA512_LBSPPB512_MIWT2_2_PLR1_SU0_SUM0_SUS0_VWA2_VWB2_WGM6_WGMXCC1_WGMXCCGn1
    SolutionIndex: 91
    SolutionNameMin: Cijk_Alik_Bljk_HSS_BH_Bias_HAS_SAV_UserArgs_MT64x64x128_MI16x16x1_SN_LDSB1_CLR1_GSU0_GSUC0_GSUWGMRR0_K1_LBSPPA512_LBSPPB512_MIWT2_2_PLR1_SU0_SUM0_SUS0_VWA2_VWB2_WGM8_WGMXCC1_WGMXCCGn1
    SolutionIndex: 92
    SolutionNameMin: Cijk_Alik_Bljk_HSS_BH_Bias_HAS_SAV_UserArgs_MT64x64x128_MI16x16x1_SN_LDSB1_CLR1_GSU0_GSUC0_GSUWGMRR0_K1_LBSPPA512_LBSPPB512_MIWT2_2_PLR1_SU0_SUM0_SUS0_VWA2_VWB2_WGM8_WGMXCC1_WGMXCCGn1
    SolutionIndex: 93
    SolutionNameMin: Cijk_Alik_Bljk_HSS_BH_Bias_HAS_SAV_UserArgs_MT64x64x128_MI16x16x1_SN_LDSB1_CLR1_GSU0_GSUC0_GSUWGMRR0_K1_LBSPPA512_LBSPPB512_MIWT2_2_PLR1_SU0_SUM0_SUS0_VWA2_VWB2_WGM8_WGMXCC1_WGMXCCGn1
    SolutionIndex: 94
    SolutionNameMin: Cijk_Alik_Bljk_HSS_BH_Bias_HAS_SAV_UserArgs_MT64x64x128_MI16x16x1_SN_LDSB1_CLR1_GSU0_GSUC0_GSUWGMRR0_K1_LBSPPA512_LBSPPB512_MIWT2_2_PLR1_SU0_SUM0_SUS0_VWA2_VWB2_WGM8_WGMXCC1_WGMXCCGn1
    SolutionIndex: 95
    SolutionNameMin: Cijk_Alik_Bljk_HSS_BH_Bias_HAS_SAV_UserArgs_MT32x64x128_MI16x16x1_SN_LDSB1_CLR1_GSU0_GSUC0_GSUWGMRR0_K1_LBSPPA256_LBSPPB512_MIWT1_2_PLR1_SU0_SUM0_SUS0_VWA1_VWB2_WGM1_WGMXCC1_WGMXCCGn1
    SolutionIndex: 96
    SolutionNameMin: Cijk_Alik_Bljk_HSS_BH_Bias_HAS_SAV_UserArgs_MT32x64x128_MI16x16x1_SN_LDSB1_CLR1_GSU0_GSUC0_GSUWGMRR0_K1_LBSPPA256_LBSPPB512_MIWT1_2_PLR1_SU0_SUM0_SUS0_VWA1_VWB2_WGM1_WGMXCC1_WGMXCCGn1
    SolutionIndex: 97
    SolutionNameMin: Cijk_Alik_Bljk_HSS_BH_Bias_HAS_SAV_UserArgs_MT32x32x128_MI16x16x1_SN_LDSB1_CLR1_GSU0_GSUC0_GSUWGMRR0_K1_LBSPPA256_LBSPPB256_MIWT1_1_PLR1_SU0_SUM0_SUS0_VWA1_VWB1_WGM1_WGMXCC1_WGMXCCGn1
    SolutionIndex: 98
    SolutionNameMin: Cijk_Alik_Bljk_HSS_BH_Bias_HAS_SAV_UserArgs_MT32x32x128_MI16x16x1_SN_LDSB1_CLR1_GSU0_GSUC0_GSUWGMRR0_K1_LBSPPA256_LBSPPB256_MIWT1_1_PLR1_SU0_SUM0_SUS0_VWA1_VWB1_WGM1_WGMXCC1_WGMXCCGn1
    SolutionIndex: 99
    SolutionNameMin: Cijk_Alik_Bljk_HSS_BH_Bias_HAS_SAV_UserArgs_MT32x32x128_MI16x16x1_SN_LDSB1_CLR1_GSU0_GSUC0_GSUWGMRR0_K1_LBSPPA256_LBSPPB256_MIWT1_1_PLR1_SU0_SUM0_SUS0_VWA1_VWB1_WGM1_WGMXCC1_WGMXCCGn1
    SolutionIndex: 100
    SolutionNameMin: Cijk_Alik_Bljk_HSS_BH_Bias_HAS_SAV_UserArgs_MT32x32x128_MI16x16x1_SN_LDSB1_CLR1_GSU0_GSUC0_GSUWGMRR0_K1_LBSPPA256_LBSPPB256_MIWT1_1_PLR1_SU0_SUM0_SUS0_VWA1_VWB1_WGM1_WGMXCC1_WGMXCCGn1
    SolutionIndex: 101
    SolutionNameMin: Cijk_Alik_Bljk_HSS_BH_Bias_HAS_SAV_UserArgs_MT32x32x128_MI16x16x1_SN_LDSB1_CLR1_GSU0_GSUC0_GSUWGMRR0_K1_LBSPPA256_LBSPPB256_MIWT1_1_PLR1_SU0_SUM0_SUS0_VWA1_VWB1_WGM1_WGMXCC1_WGMXCCGn1
    SolutionIndex: 102
    SolutionNameMin: Cijk_Alik_Bljk_HSS_BH_Bias_HAS_SAV_UserArgs_MT32x32x128_MI16x16x1_SN_LDSB1_CLR1_GSU0_GSUC0_GSUWGMRR0_K1_LBSPPA256_LBSPPB256_MIWT1_1_PLR1_SU0_SUM0_SUS0_VWA1_VWB1_WGM8_WGMXCC1_WGMXCCGn1
    SolutionIndex: 103
    SolutionNameMin: Cijk_Alik_Bljk_HSS_BH_Bias_HAS_SAV_UserArgs_MT64x128x128_MI32x32x1_SN_LDSB1_CLR1_GSU0_GSUC0_GSUWGMRR0_K1_LBSPPA256_LBSPPB512_MIWT1_2_PLR1_SU0_SUM0_SUS0_VWA1_VWB2_WGM1_WGMXCC1_WGMXCCGn1
    SolutionIndex: 104
    SolutionNameMin: Cijk_Alik_Bljk_HSS_BH_Bias_HAS_SAV_UserArgs_MT64x128x128_MI32x32x1_SN_LDSB1_CLR1_GSU0_GSUC0_GSUWGMRR0_K1_LBSPPA256_LBSPPB512_MIWT1_2_PLR1_SU0_SUM0_SUS0_VWA1_VWB2_WGM6_WGMXCC1_WGMXCCGn1
    SolutionIndex: 105
    SolutionNameMin: Cijk_Alik_Bljk_HSS_BH_Bias_HAS_SAV_UserArgs_MT128x64x128_MI32x32x1_SN_LDSB1_CLR1_GSU0_GSUC0_GSUWGMRR0_K1_LBSPPA512_LBSPPB256_MIWT2_1_PLR1_SU0_SUM0_SUS0_VWA2_VWB1_WGM1_WGMXCC1_WGMXCCGn1
    SolutionIndex: 106
    SolutionNameMin: Cijk_Alik_Bljk_HSS_BH_Bias_HAS_SAV_UserArgs_MT128x64x128_MI32x32x1_SN_LDSB1_CLR1_GSU0_GSUC0_GSUWGMRR0_K1_LBSPPA512_LBSPPB256_MIWT2_1_PLR1_SU0_SUM0_SUS0_VWA2_VWB1_WGM8_WGMXCC1_WGMXCCGn1
    SolutionIndex: 107
    SolutionNameMin: Cijk_Alik_Bljk_HSS_BH_Bias_HAS_SAV_UserArgs_MT64x64x128_MI32x32x1_SN_LDSB1_CLR1_GSU0_GSUC0_GSUWGMRR0_K1_LBSPPA256_LBSPPB256_MIWT1_1_PLR1_SU0_SUM0_SUS0_VWA1_VWB1_WGM1_WGMXCC1_WGMXCCGn1
    SolutionIndex: 108
    SolutionNameMin: Cijk_Alik_Bljk_HSS_BH_Bias_HAS_SAV_UserArgs_MT64x64x128_MI32x32x1_SN_LDSB1_CLR1_GSU0_GSUC0_GSUWGMRR0_K1_LBSPPA256_LBSPPB256_MIWT1_1_PLR1_SU0_SUM0_SUS0_VWA1_VWB1_WGM6_WGMXCC1_WGMXCCGn1
    SolutionIndex: 109
    SolutionNameMin: Cijk_Alik_Bljk_HSS_BH_Bias_HAS_SAV_UserArgs_MT64x64x128_MI32x32x1_SN_LDSB1_CLR1_GSU0_GSUC0_GSUWGMRR0_K1_LBSPPA256_LBSPPB256_MIWT1_1_PLR1_SU0_SUM0_SUS0_VWA1_VWB1_WGM8_WGMXCC1_WGMXCCGn1
    SolutionIndex: 110
    SolutionNameMin: Cijk_Alik_Bljk_HSS_BH_Bias_HAS_SAV_UserArgs_MT64x64x256_MI16x16x1_SN_LDSB1_CLR1_GSU0_GSUC0_GSUWGMRR0_K1_LBSPPA1024_LBSPPB1024_MIWT2_2_PLR1_SU0_SUM0_SUS0_VWA2_VWB2_WGM1_WGMXCC1_WGMXCCGn1
    SolutionIndex: 111
    SolutionNameMin: Cijk_Alik_Bljk_HSS_BH_Bias_HAS_SAV_UserArgs_MT64x64x256_MI16x16x1_SN_LDSB1_CLR1_GSU0_GSUC0_GSUWGMRR0_K1_LBSPPA1024_LBSPPB1024_MIWT2_2_PLR1_SU0_SUM0_SUS0_VWA2_VWB2_WGM6_WGMXCC1_WGMXCCGn1
    SolutionIndex: 112
    SolutionNameMin: Cijk_Alik_Bljk_HSS_BH_Bias_HAS_SAV_UserArgs_MT64x64x256_MI16x16x1_SN_LDSB1_CLR1_GSU0_GSUC0_GSUWGMRR0_K1_LBSPPA1024_LBSPPB1024_MIWT2_2_PLR1_SU0_SUM0_SUS0_VWA2_VWB2_WGM8_WGMXCC1_WGMXCCGn1
    SolutionIndex: 113
    SolutionNameMin: Cijk_Alik_Bljk_HSS_BH_Bias_HAS_SAV_UserArgs_MT64x64x256_MI16x16x1_SN_LDSB1_CLR1_GSU0_GSUC0_GSUWGMRR0_K1_LBSPPA1024_LBSPPB1024_MIWT2_2_PLR1_SU0_SUM0_SUS0_VWA2_VWB2_WGM8_WGMXCC1_WGMXCCGn1
    SolutionIndex: 114
    SolutionNameMin: Cijk_Alik_Bljk_HSS_BH_Bias_HAS_SAV_UserArgs_MT64x64x256_MI16x16x1_SN_LDSB1_CLR1_GSU0_GSUC0_GSUWGMRR0_K1_LBSPPA1024_LBSPPB1024_MIWT2_2_PLR1_SU0_SUM0_SUS0_VWA2_VWB2_WGM8_WGMXCC1_WGMXCCGn1
    SolutionIndex: 115
    SolutionNameMin: Cijk_Alik_Bljk_HSS_BH_Bias_HAS_SAV_UserArgs_MT32x64x256_MI16x16x1_SN_LDSB1_CLR1_GSU0_GSUC0_GSUWGMRR0_K1_LBSPPA512_LBSPPB1024_MIWT1_2_PLR1_SU0_SUM0_SUS0_VWA1_VWB2_WGM1_WGMXCC1_WGMXCCGn1
    SolutionIndex: 116
    SolutionNameMin: Cijk_Alik_Bljk_HSS_BH_Bias_HAS_SAV_UserArgs_MT32x64x256_MI16x16x1_SN_LDSB1_CLR1_GSU0_GSUC0_GSUWGMRR0_K1_LBSPPA512_LBSPPB1024_MIWT1_2_PLR1_SU0_SUM0_SUS0_VWA1_VWB2_WGM1_WGMXCC1_WGMXCCGn1
    SolutionIndex: 117
    SolutionNameMin: Cijk_Alik_Bljk_HSS_BH_Bias_HAS_SAV_UserArgs_MT32x64x256_MI16x16x1_SN_LDSB1_CLR1_GSU0_GSUC0_GSUWGMRR0_K1_LBSPPA512_LBSPPB1024_MIWT1_2_PLR1_SU0_SUM0_SUS0_VWA1_VWB2_WGM1_WGMXCC1_WGMXCCGn1
    SolutionIndex: 118
    SolutionNameMin: Cijk_Alik_Bljk_HSS_BH_Bias_HAS_SAV_UserArgs_MT32x64x256_MI16x16x1_SN_LDSB1_CLR1_GSU0_GSUC0_GSUWGMRR0_K1_LBSPPA512_LBSPPB1024_MIWT1_2_PLR1_SU0_SUM0_SUS0_VWA1_VWB2_WGM6_WGMXCC1_WGMXCCGn1
    SolutionIndex: 119
    SolutionNameMin: Cijk_Alik_Bljk_HSS_BH_Bias_HAS_SAV_UserArgs_MT32x64x256_MI16x16x1_SN_LDSB1_CLR1_GSU0_GSUC0_GSUWGMRR0_K1_LBSPPA512_LBSPPB1024_MIWT1_2_PLR1_SU0_SUM0_SUS0_VWA1_VWB2_WGM6_WGMXCC1_WGMXCCGn1
    SolutionIndex: 120
    SolutionNameMin: Cijk_Alik_Bljk_HSS_BH_Bias_HAS_SAV_UserArgs_MT32x64x256_MI16x16x1_SN_LDSB1_CLR1_GSU0_GSUC0_GSUWGMRR0_K1_LBSPPA512_LBSPPB1024_MIWT1_2_PLR1_SU0_SUM0_SUS0_VWA1_VWB2_WGM8_WGMXCC1_WGMXCCGn1
    SolutionIndex: 121
    SolutionNameMin: Cijk_Alik_Bljk_HSS_BH_Bias_HAS_SAV_UserArgs_MT32x64x256_MI16x16x1_SN_LDSB1_CLR1_GSU0_GSUC0_GSUWGMRR0_K1_LBSPPA512_LBSPPB1024_MIWT1_2_PLR1_SU0_SUM0_SUS0_VWA1_VWB2_WGM8_WGMXCC1_WGMXCCGn1
    SolutionIndex: 122
    SolutionNameMin: Cijk_Alik_Bljk_HSS_BH_Bias_HAS_SAV_UserArgs_MT64x32x256_MI16x16x1_SN_LDSB1_CLR1_GSU0_GSUC0_GSUWGMRR0_K1_LBSPPA1024_LBSPPB512_MIWT2_1_PLR1_SU0_SUM0_SUS0_VWA2_VWB1_WGM1_WGMXCC1_WGMXCCGn1
    SolutionIndex: 123
    SolutionNameMin: Cijk_Alik_Bljk_HSS_BH_Bias_HAS_SAV_UserArgs_MT64x32x256_MI16x16x1_SN_LDSB1_CLR1_GSU0_GSUC0_GSUWGMRR0_K1_LBSPPA1024_LBSPPB512_MIWT2_1_PLR1_SU0_SUM0_SUS0_VWA2_VWB1_WGM1_WGMXCC1_WGMXCCGn1
    SolutionIndex: 124
    SolutionNameMin: Cijk_Alik_Bljk_HSS_BH_Bias_HAS_SAV_UserArgs_MT64x32x256_MI16x16x1_SN_LDSB1_CLR1_GSU0_GSUC0_GSUWGMRR0_K1_LBSPPA1024_LBSPPB512_MIWT2_1_PLR1_SU0_SUM0_SUS0_VWA2_VWB1_WGM6_WGMXCC1_WGMXCCGn1
    SolutionIndex: 125
    SolutionNameMin: Cijk_Alik_Bljk_HSS_BH_Bias_HAS_SAV_UserArgs_MT64x32x256_MI16x16x1_SN_LDSB1_CLR1_GSU0_GSUC0_GSUWGMRR0_K1_LBSPPA1024_LBSPPB512_MIWT2_1_PLR1_SU0_SUM0_SUS0_VWA2_VWB1_WGM6_WGMXCC1_WGMXCCGn1
    SolutionIndex: 126
    SolutionNameMin: Cijk_Alik_Bljk_HSS_BH_Bias_HAS_SAV_UserArgs_MT64x32x256_MI16x16x1_SN_LDSB1_CLR1_GSU0_GSUC0_GSUWGMRR0_K1_LBSPPA1024_LBSPPB512_MIWT2_1_PLR1_SU0_SUM0_SUS0_VWA2_VWB1_WGM8_WGMXCC1_WGMXCCGn1
    SolutionIndex: 127
    SolutionNameMin: Cijk_Alik_Bljk_HSS_BH_Bias_HAS_SAV_UserArgs_MT64x32x256_MI16x16x1_SN_LDSB1_CLR1_GSU0_GSUC0_GSUWGMRR0_K1_LBSPPA1024_LBSPPB512_MIWT2_1_PLR1_SU0_SUM0_SUS0_VWA2_VWB1_WGM8_WGMXCC1_WGMXCCGn1
    SolutionIndex: 128
    SolutionNameMin: Cijk_Alik_Bljk_HSS_BH_Bias_HAS_SAV_UserArgs_MT32x32x256_MI16x16x1_SN_LDSB1_CLR1_GSU0_GSUC0_GSUWGMRR0_K1_LBSPPA512_LBSPPB512_MIWT1_1_PLR1_SU0_SUM0_SUS0_VWA1_VWB1_WGM1_WGMXCC1_WGMXCCGn1
    SolutionIndex: 129
    SolutionNameMin: Cijk_Alik_Bljk_HSS_BH_Bias_HAS_SAV_UserArgs_MT32x32x256_MI16x16x1_SN_LDSB1_CLR1_GSU0_GSUC0_GSUWGMRR0_K1_LBSPPA512_LBSPPB512_MIWT1_1_PLR1_SU0_SUM0_SUS0_VWA1_VWB1_WGM1_WGMXCC1_WGMXCCGn1
    SolutionIndex: 130
    SolutionNameMin: Cijk_Alik_Bljk_HSS_BH_Bias_HAS_SAV_UserArgs_MT32x32x256_MI16x16x1_SN_LDSB1_CLR1_GSU0_GSUC0_GSUWGMRR0_K1_LBSPPA512_LBSPPB512_MIWT1_1_PLR1_SU0_SUM0_SUS0_VWA1_VWB1_WGM1_WGMXCC1_WGMXCCGn1
    SolutionIndex: 131
    SolutionNameMin: Cijk_Alik_Bljk_HSS_BH_Bias_HAS_SAV_UserArgs_MT32x32x256_MI16x16x1_SN_LDSB1_CLR1_GSU0_GSUC0_GSUWGMRR0_K1_LBSPPA512_LBSPPB512_MIWT1_1_PLR1_SU0_SUM0_SUS0_VWA1_VWB1_WGM6_WGMXCC1_WGMXCCGn1
    SolutionIndex: 132
    SolutionNameMin: Cijk_Alik_Bljk_HSS_BH_Bias_HAS_SAV_UserArgs_MT32x32x256_MI16x16x1_SN_LDSB1_CLR1_GSU0_GSUC0_GSUWGMRR0_K1_LBSPPA512_LBSPPB512_MIWT1_1_PLR1_SU0_SUM0_SUS0_VWA1_VWB1_WGM6_WGMXCC1_WGMXCCGn1
    SolutionIndex: 133
    SolutionNameMin: Cijk_Alik_Bljk_HSS_BH_Bias_HAS_SAV_UserArgs_MT32x32x256_MI16x16x1_SN_LDSB1_CLR1_GSU0_GSUC0_GSUWGMRR0_K1_LBSPPA512_LBSPPB512_MIWT1_1_PLR1_SU0_SUM0_SUS0_VWA1_VWB1_WGM8_WGMXCC1_WGMXCCGn1
    SolutionIndex: 134
    SolutionNameMin: Cijk_Alik_Bljk_HSS_BH_Bias_HAS_SAV_UserArgs_MT32x32x256_MI16x16x1_SN_LDSB1_CLR1_GSU0_GSUC0_GSUWGMRR0_K1_LBSPPA512_LBSPPB512_MIWT1_1_PLR1_SU0_SUM0_SUS0_VWA1_VWB1_WGM8_WGMXCC1_WGMXCCGn1
    SolutionIndex: 135
    SolutionNameMin: Cijk_Alik_Bljk_HSS_BH_Bias_HAS_SAV_UserArgs_MT64x64x256_MI32x32x1_SN_LDSB1_CLR1_GSU0_GSUC0_GSUWGMRR0_K1_LBSPPA512_LBSPPB512_MIWT1_1_PLR1_SU0_SUM0_SUS0_VWA1_VWB1_WGM1_WGMXCC1_WGMXCCGn1
    SolutionIndex: 136
    SolutionNameMin: Cijk_Alik_Bljk_HSS_BH_Bias_HAS_SAV_UserArgs_MT32x32x32_MI16x16x1_SN_LDSB0_CLR0_GSU0_GSUC0_GSUWGMRR0_K1_LBSPPA128_LBSPPB128_MIWT1_1_PLR0_SU32_SUM0_SUS256_VWA1_VWB1_WGM1_WGMXCC1_WGMXCCGn1
- - - [128, 128, 1, 128, 128, 128, 128, 128]
    - [101, 0.043]
  - - [128, 128, 1, 256, 128, 128, 256, 256]
    - [129, 0.076]
  - - [128, 128, 1, 512, 128, 128, 512, 512]
    - [130, 0.134]
  - - [128, 128, 1, 1024, 128, 128, 1024, 1024]
    - [130, 0.229]
  - - [128, 128, 1, 2048, 128, 128, 2048, 2048]
    - [130, 0.35]
  - - [128, 128, 1, 4096, 128, 128, 4096, 4096]
    - [130, 0.476]
  - - [128, 128, 1, 8192, 128, 128, 8192, 8192]
    - [130, 0.582]
  - - [128, 256, 1, 128, 128, 128, 128, 128]
    - [98, 0.085]
  - - [128, 256, 1, 256, 128, 128, 256, 256]
    - [128, 0.155]
  - - [128, 256, 1, 512, 128, 128, 512, 512]
    - [128, 0.268]
  - - [128, 256, 1, 1024, 128, 128, 1024, 1024]
    - [130, 0.452]
  - - [128, 256, 1, 2048, 128, 128, 2048, 2048]
    - [130, 0.698]
  - - [128, 256, 1, 4096, 128, 128, 4096, 4096]
    - [128, 0.932]
  - - [128, 256, 1, 8192, 128, 128, 8192, 8192]
    - [132, 1.156]
  - - [128, 512, 1, 128, 128, 128, 128, 128]
    - [101, 0.167]
  - - [128, 512, 1, 256, 128, 128, 256, 256]
    - [130, 0.306]
  - - [128, 512, 1, 512, 128, 128, 512, 512]
    - [130, 0.523]
  - - [128, 512, 1, 1024, 128, 128, 1024, 1024]
    - [130, 0.897]
  - - [128, 512, 1, 2048, 128, 128, 2048, 2048]
    - [130, 1.368]
  - - [128, 512, 1, 4096, 128, 128, 4096, 4096]
    - [132, 1.831]
  - - [128, 512, 1, 8192, 128, 128, 8192, 8192]
    - [133, 2.284]
  - - [128, 1024, 1, 128, 128, 128, 128, 128]
    - [100, 0.322]
  - - [128, 1024, 1, 256, 128, 128, 256, 256]
    - [130, 0.595]
  - - [128, 1024, 1, 512, 128, 128, 512, 512]
    - [130, 1.032]
  - - [128, 1024, 1, 1024, 128, 128, 1024, 1024]
    - [130, 1.73]
  - - [128, 1024, 1, 2048, 128, 128, 2048, 2048]
    - [128, 2.66]
  - - [128, 1024, 1, 4096, 128, 128, 4096, 4096]
    - [130, 3.584]
  - - [128, 1024, 1, 8192, 128, 128, 8192, 8192]
    - [130, 4.524]
  - - [128, 2048, 1, 128, 128, 128, 128, 128]
    - [98, 0.639]
  - - [128, 2048, 1, 256, 128, 128, 256, 256]
    - [130, 1.155]
  - - [128, 2048, 1, 512, 128, 128, 512, 512]
    - [130, 1.983]
  - - [128, 2048, 1, 1024, 128, 128, 1024, 1024]
    - [130, 3.371]
  - - [128, 2048, 1, 2048, 128, 128, 2048, 2048]
    - [130, 5.085]
  - - [128, 2048, 1, 4096, 128, 128, 4096, 4096]
    - [130, 7.061]
  - - [128, 2048, 1, 8192, 128, 128, 8192, 8192]
    - [130, 8.259]
  - - [128, 4096, 1, 128, 128, 128, 128, 128]
    - [95, 1.143]
  - - [128, 4096, 1, 256, 128, 128, 256, 256]
    - [116, 2.007]
  - - [128, 4096, 1, 512, 128, 128, 512, 512]
    - [123, 3.385]
  - - [128, 4096, 1, 1024, 128, 128, 1024, 1024]
    - [115, 5.346]
  - - [128, 4096, 1, 2048, 128, 128, 2048, 2048]
    - [120, 7.629]
  - - [128, 4096, 1, 4096, 128, 128, 4096, 4096]
    - [117, 9.265]
  - - [128, 4096, 1, 8192, 128, 128, 8192, 8192]
    - [123, 11.83]
  - - [128, 8192, 1, 128, 128, 128, 128, 128]
    - [88, 1.931]
  - - [128, 8192, 1, 256, 128, 128, 256, 256]
    - [107, 3.362]
  - - [128, 8192, 1, 512, 128, 128, 512, 512]
    - [88, 5.723]
  - - [128, 8192, 1, 1024, 128, 128, 1024, 1024]
    - [85, 7.868]
  - - [128, 8192, 1, 2048, 128, 128, 2048, 2048]
    - [87, 10.135]
  - - [128, 8192, 1, 4096, 128, 128, 4096, 4096]
    - [87, 12.744]
  - - [128, 8192, 1, 8192, 128, 128, 8192, 8192]
    - [114, 15.88]
  - - [256, 128, 1, 128, 256, 256, 128, 128]
    - [101, 0.084]
  - - [256, 128, 1, 256, 256, 256, 256, 256]
    - [130, 0.157]
  - - [256, 128, 1, 512, 256, 256, 512, 512]
    - [128, 0.263]
  - - [256, 128, 1, 1024, 256, 256, 1024, 1024]
    - [128, 0.457]
  - - [256, 128, 1, 2048, 256, 256, 2048, 2048]
    - [128, 0.686]
  - - [256, 128, 1, 4096, 256, 256, 4096, 4096]
    - [128, 0.941]
  - - [256, 128, 1, 8192, 256, 256, 8192, 8192]
    - [128, 1.159]
  - - [256, 256, 1, 128, 256, 256, 128, 128]
    - [99, 0.164]
  - - [256, 256, 1, 256, 256, 256, 256, 256]
    - [128, 0.309]
  - - [256, 256, 1, 512, 256, 256, 512, 512]
    - [128, 0.529]
  - - [256, 256, 1, 1024, 256, 256, 1024, 1024]
    - [130, 0.896]
  - - [256, 256, 1, 2048, 256, 256, 2048, 2048]
    - [130, 1.382]
  - - [256, 256, 1, 4096, 256, 256, 4096, 4096]
    - [130, 1.85]
  - - [256, 256, 1, 8192, 256, 256, 8192, 8192]
    - [132, 2.298]
  - - [256, 512, 1, 128, 256, 256, 128, 128]
    - [99, 0.323]
  - - [256, 512, 1, 256, 256, 256, 256, 256]
    - [128, 0.603]
  - - [256, 512, 1, 512, 256, 256, 512, 512]
    - [130, 1.034]
  - - [256, 512, 1, 1024, 256, 256, 1024, 1024]
    - [128, 1.763]
  - - [256, 512, 1, 2048, 256, 256, 2048, 2048]
    - [128, 2.671]
  - - [256, 512, 1, 4096, 256, 256, 4096, 4096]
    - [128, 3.641]
  - - [256, 512, 1, 8192, 256, 256, 8192, 8192]
    - [134, 4.578]
  - - [256, 1024, 1, 128, 256, 256, 128, 128]
    - [102, 0.626]
  - - [256, 1024, 1, 256, 256, 256, 256, 256]
    - [130, 1.184]
  - - [256, 1024, 1, 512, 256, 256, 512, 512]
    - [128, 2.012]
  - - [256, 1024, 1, 1024, 256, 256, 1024, 1024]
    - [130, 3.42]
  - - [256, 1024, 1, 2048, 256, 256, 2048, 2048]
    - [130, 5.141]
  - - [256, 1024, 1, 4096, 256, 256, 4096, 4096]
    - [130, 7.037]
  - - [256, 1024, 1, 8192, 256, 256, 8192, 8192]
    - [130, 8.799]
  - - [256, 2048, 1, 128, 256, 256, 128, 128]
    - [95, 1.141]
  - - [256, 2048, 1, 256, 256, 256, 256, 256]
    - [117, 2.031]
  - - [256, 2048, 1, 512, 256, 256, 512, 512]
    - [116, 3.45]
  - - [256, 2048, 1, 1024, 256, 256, 1024, 1024]
    - [116, 5.697]
  - - [256, 2048, 1, 2048, 256, 256, 2048, 2048]
    - [116, 8.149]
  - - [256, 2048, 1, 4096, 256, 256, 4096, 4096]
    - [116, 10.484]
  - - [256, 2048, 1, 8192, 256, 256, 8192, 8192]
    - [123, 12.582]
  - - [256, 4096, 1, 128, 256, 256, 128, 128]
    - [107, 1.949]
  - - [256, 4096, 1, 256, 256, 256, 256, 256]
    - [135, 3.427]
  - - [256, 4096, 1, 512, 256, 256, 512, 512]
    - [88, 5.871]
  - - [256, 4096, 1, 1024, 256, 256, 1024, 1024]
    - [86, 8.485]
  - - [256, 4096, 1, 2048, 256, 256, 2048, 2048]
    - [86, 11.478]
  - - [256, 4096, 1, 4096, 256, 256, 4096, 4096]
    - [88, 14.473]
  - - [256, 4096, 1, 8192, 256, 256, 8192, 8192]
    - [114, 17.675]
  - - [256, 8192, 1, 128, 256, 256, 128, 128]
    - [81, 2.977]
  - - [256, 8192, 1, 256, 256, 256, 256, 256]
    - [49, 5.279]
  - - [256, 8192, 1, 512, 256, 256, 512, 512]
    - [48, 7.947]
  - - [256, 8192, 1, 1024, 256, 256, 1024, 1024]
    - [48, 11.57]
  - - [256, 8192, 1, 2048, 256, 256, 2048, 2048]
    - [49, 14.735]
  - - [256, 8192, 1, 4096, 256, 256, 4096, 4096]
    - [76, 19.01]
  - - [256, 8192, 1, 8192, 256, 256, 8192, 8192]
    - [105, 21.384]
  - - [512, 128, 1, 128, 512, 512, 128, 128]
    - [98, 0.167]
  - - [512, 128, 1, 256, 512, 512, 256, 256]
    - [128, 0.306]
  - - [512, 128, 1, 512, 512, 512, 512, 512]
    - [130, 0.524]
  - - [512, 128, 1, 1024, 512, 512, 1024, 1024]
    - [128, 0.896]
  - - [512, 128, 1, 2048, 512, 512, 2048, 2048]
    - [130, 1.369]
  - - [512, 128, 1, 4096, 512, 512, 4096, 4096]
    - [130, 1.847]
  - - [512, 128, 1, 8192, 512, 512, 8192, 8192]
    - [130, 2.293]
  - - [512, 256, 1, 128, 512, 512, 128, 128]
    - [97, 0.321]
  - - [512, 256, 1, 256, 512, 512, 256, 256]
    - [128, 0.606]
  - - [512, 256, 1, 512, 512, 512, 512, 512]
    - [132, 1.019]
  - - [512, 256, 1, 1024, 512, 512, 1024, 1024]
    - [131, 1.755]
  - - [512, 256, 1, 2048, 512, 512, 2048, 2048]
    - [132, 2.688]
  - - [512, 256, 1, 4096, 512, 512, 4096, 4096]
    - [132, 3.635]
  - - [512, 256, 1, 8192, 512, 512, 8192, 8192]
    - [132, 4.541]
  - - [512, 512, 1, 128, 512, 512, 128, 128]
    - [99, 0.635]
  - - [512, 512, 1, 256, 512, 512, 256, 256]
    - [134, 1.156]
  - - [512, 512, 1, 512, 512, 512, 512, 512]
    - [133, 1.998]
  - - [512, 512, 1, 1024, 512, 512, 1024, 1024]
    - [133, 3.413]
  - - [512, 512, 1, 2048, 512, 512, 2048, 2048]
    - [131, 5.158]
  - - [512, 512, 1, 4096, 512, 512, 4096, 4096]
    - [134, 7.031]
  - - [512, 512, 1, 8192, 512, 512, 8192, 8192]
    - [133, 8.909]
  - - [512, 1024, 1, 128, 512, 512, 128, 128]
    - [95, 1.14]
  - - [512, 1024, 1, 256, 512, 512, 256, 256]
    - [116, 2.03]
  - - [512, 1024, 1, 512, 512, 512, 512, 512]
    - [117, 3.485]
  - - [512, 1024, 1, 1024, 512, 512, 1024, 1024]
    - [117, 5.65]
  - - [512, 1024, 1, 2048, 512, 512, 2048, 2048]
    - [122, 8.04]
  - - [512, 1024, 1, 4096, 512, 512, 4096, 4096]
    - [118, 10.612]
  - - [512, 1024, 1, 8192, 512, 512, 8192, 8192]
    - [127, 12.727]
  - - [512, 2048, 1, 128, 512, 512, 128, 128]
    - [107, 1.945]
  - - [512, 2048, 1, 256, 512, 512, 256, 256]
    - [107, 3.423]
  - - [512, 2048, 1, 512, 512, 512, 512, 512]
    - [107, 5.893]
  - - [512, 2048, 1, 1024, 512, 512, 1024, 1024]
    - [91, 8.466]
  - - [512, 2048, 1, 2048, 512, 512, 2048, 2048]
    - [93, 11.735]
  - - [512, 2048, 1, 4096, 512, 512, 4096, 4096]
    - [114, 14.914]
  - - [512, 2048, 1, 8192, 512, 512, 8192, 8192]
    - [110, 17.9]
  - - [512, 4096, 1, 128, 512, 512, 128, 128]
    - [82, 3.001]
  - - [512, 4096, 1, 256, 512, 512, 256, 256]
    - [49, 5.353]
  - - [512, 4096, 1, 512, 512, 512, 512, 512]
    - [47, 8.125]
  - - [512, 4096, 1, 1024, 512, 512, 1024, 1024]
    - [80, 11.476]
  - - [512, 4096, 1, 2048, 512, 512, 2048, 2048]
    - [49, 15.211]
  - - [512, 4096, 1, 4096, 512, 512, 4096, 4096]
    - [75, 19.329]
  - - [512, 4096, 1, 8192, 512, 512, 8192, 8192]
    - [103, 22.299]
  - - [512, 8192, 1, 128, 512, 512, 128, 128]
    - [38, 3.795]
  - - [512, 8192, 1, 256, 512, 512, 256, 256]
    - [34, 6.71]
  - - [512, 8192, 1, 512, 512, 512, 512, 512]
    - [5, 10.254]
  - - [512, 8192, 1, 1024, 512, 512, 1024, 1024]
    - [33, 15.354]
  - - [512, 8192, 1, 2048, 512, 512, 2048, 2048]
    - [33, 20.364]
  - - [512, 8192, 1, 4096, 512, 512, 4096, 4096]
    - [35, 26.129]
  - - [512, 8192, 1, 8192, 512, 512, 8192, 8192]
    - [67, 27.456]
  - - [1024, 128, 1, 128, 1024, 1024, 128, 128]
    - [98, 0.326]
  - - [1024, 128, 1, 256, 1024, 1024, 256, 256]
    - [130, 0.599]
  - - [1024, 128, 1, 512, 1024, 1024, 512, 512]
    - [130, 1.021]
  - - [1024, 128, 1, 1024, 1024, 1024, 1024, 1024]
    - [128, 1.73]
  - - [1024, 128, 1, 2048, 1024, 1024, 2048, 2048]
    - [130, 2.622]
  - - [1024, 128, 1, 4096, 1024, 1024, 4096, 4096]
    - [133, 3.575]
  - - [1024, 128, 1, 8192, 1024, 1024, 8192, 8192]
    - [132, 4.51]
  - - [1024, 256, 1, 128, 1024, 1024, 128, 128]
    - [102, 0.626]
  - - [1024, 256, 1, 256, 1024, 1024, 256, 256]
    - [133, 1.142]
  - - [1024, 256, 1, 512, 1024, 1024, 512, 512]
    - [131, 1.973]
  - - [1024, 256, 1, 1024, 1024, 1024, 1024, 1024]
    - [134, 3.358]
  - - [1024, 256, 1, 2048, 1024, 1024, 2048, 2048]
    - [134, 5.101]
  - - [1024, 256, 1, 4096, 1024, 1024, 4096, 4096]
    - [134, 6.976]
  - - [1024, 256, 1, 8192, 1024, 1024, 8192, 8192]
    - [132, 8.809]
  - - [1024, 512, 1, 128, 1024, 1024, 128, 128]
    - [96, 1.129]
  - - [1024, 512, 1, 256, 1024, 1024, 256, 256]
    - [116, 2.003]
  - - [1024, 512, 1, 512, 1024, 1024, 512, 512]
    - [127, 3.461]
  - - [1024, 512, 1, 1024, 1024, 1024, 1024, 1024]
    - [127, 5.702]
  - - [1024, 512, 1, 2048, 1024, 1024, 2048, 2048]
    - [126, 8.18]
  - - [1024, 512, 1, 4096, 1024, 1024, 4096, 4096]
    - [126, 10.624]
  - - [1024, 512, 1, 8192, 1024, 1024, 8192, 8192]
    - [125, 12.637]
  - - [1024, 1024, 1, 128, 1024, 1024, 128, 128]
    - [107, 1.925]
  - - [1024, 1024, 1, 256, 1024, 1024, 256, 256]
    - [107, 3.396]
  - - [1024, 1024, 1, 512, 1024, 1024, 512, 512]
    - [90, 5.868]
  - - [1024, 1024, 1, 1024, 1024, 1024, 1024, 1024]
    - [92, 8.422]
  - - [1024, 1024, 1, 2048, 1024, 1024, 2048, 2048]
    - [87, 11.757]
  - - [1024, 1024, 1, 4096, 1024, 1024, 4096, 4096]
    - [93, 14.989]
  - - [1024, 1024, 1, 8192, 1024, 1024, 8192, 8192]
    - [114, 17.775]
  - - [1024, 2048, 1, 128, 1024, 1024, 128, 128]
    - [81, 2.984]
  - - [1024, 2048, 1, 256, 1024, 1024, 256, 256]
    - [48, 5.356]
  - - [1024, 2048, 1, 512, 1024, 1024, 512, 512]
    - [74, 8.061]
  - - [1024, 2048, 1, 1024, 1024, 1024, 1024, 1024]
    - [74, 11.851]
  - - [1024, 2048, 1, 2048, 1024, 1024, 2048, 2048]
    - [53, 15.671]
  - - [1024, 2048, 1, 4096, 1024, 1024, 4096, 4096]
    - [81, 19.635]
  - - [1024, 2048, 1, 8192, 1024, 1024, 8192, 8192]
    - [78, 23.155]
  - - [1024, 4096, 1, 128, 1024, 1024, 128, 128]
    - [35, 3.77]
  - - [1024, 4096, 1, 256, 1024, 1024, 256, 256]
    - [34, 6.437]
  - - [1024, 4096, 1, 512, 1024, 1024, 512, 512]
    - [34, 10.74]
  - - [1024, 4096, 1, 1024, 1024, 1024, 1024, 1024]
    - [33, 15.795]
  - - [1024, 4096, 1, 2048, 1024, 1024, 2048, 2048]
    - [66, 20.553]
  - - [1024, 4096, 1, 4096, 1024, 1024, 4096, 4096]
    - [42, 26.524]
  - - [1024, 4096, 1, 8192, 1024, 1024, 8192, 8192]
    - [73, 28.287]
  - - [1024, 8192, 1, 128, 1024, 1024, 128, 128]
    - [3, 4.608]
  - - [1024, 8192, 1, 256, 1024, 1024, 256, 256]
    - [1, 7.721]
  - - [1024, 8192, 1, 512, 1024, 1024, 512, 512]
    - [3, 12.239]
  - - [1024, 8192, 1, 1024, 1024, 1024, 1024, 1024]
    - [21, 19.338]
  - - [1024, 8192, 1, 2048, 1024, 1024, 2048, 2048]
    - [31, 26.0]
  - - [1024, 8192, 1, 4096, 1024, 1024, 4096, 4096]
    - [32, 32.133]
  - - [1024, 8192, 1, 8192, 1024, 1024, 8192, 8192]
    - [32, 31.853]
  - - [2048, 128, 1, 128, 2048, 2048, 128, 128]
    - [98, 0.623]
  - - [2048, 128, 1, 256, 2048, 2048, 256, 256]
    - [133, 1.134]
  - - [2048, 128, 1, 512, 2048, 2048, 512, 512]
    - [134, 1.962]
  - - [2048, 128, 1, 1024, 2048, 2048, 1024, 1024]
    - [131, 3.314]
  - - [2048, 128, 1, 2048, 2048, 2048, 2048, 2048]
    - [132, 5.043]
  - - [2048, 128, 1, 4096, 2048, 2048, 4096, 4096]
    - [132, 7.011]
  - - [2048, 128, 1, 8192, 2048, 2048, 8192, 8192]
    - [132, 8.28]
  - - [2048, 256, 1, 128, 2048, 2048, 128, 128]
    - [96, 1.134]
  - - [2048, 256, 1, 256, 2048, 2048, 256, 256]
    - [116, 1.999]
  - - [2048, 256, 1, 512, 2048, 2048, 512, 512]
    - [119, 3.441]
  - - [2048, 256, 1, 1024, 2048, 2048, 1024, 1024]
    - [121, 5.616]
  - - [2048, 256, 1, 2048, 2048, 2048, 2048, 2048]
    - [118, 8.083]
  - - [2048, 256, 1, 4096, 2048, 2048, 4096, 4096]
    - [119, 10.624]
  - - [2048, 256, 1, 8192, 2048, 2048, 8192, 8192]
    - [119, 12.336]
  - - [2048, 512, 1, 128, 2048, 2048, 128, 128]
    - [109, 1.912]
  - - [2048, 512, 1, 256, 2048, 2048, 256, 256]
    - [109, 3.377]
  - - [2048, 512, 1, 512, 2048, 2048, 512, 512]
    - [94, 5.756]
  - - [2048, 512, 1, 1024, 2048, 2048, 1024, 1024]
    - [92, 8.382]
  - - [2048, 512, 1, 2048, 2048, 2048, 2048, 2048]
    - [89, 11.653]
  - - [2048, 512, 1, 4096, 2048, 2048, 4096, 4096]
    - [94, 14.696]
  - - [2048, 512, 1, 8192, 2048, 2048, 8192, 8192]
    - [111, 17.475]
  - - [2048, 1024, 1, 128, 2048, 2048, 128, 128]
    - [65, 2.951]
  - - [2048, 1024, 1, 256, 2048, 2048, 256, 256]
    - [53, 5.299]
  - - [2048, 1024, 1, 512, 2048, 2048, 512, 512]
    - [77, 8.024]
  - - [2048, 1024, 1, 1024, 2048, 2048, 1024, 1024]
    - [49, 11.554]
  - - [2048, 1024, 1, 2048, 2048, 2048, 2048, 2048]
    - [53, 15.624]
  - - [2048, 1024, 1, 4096, 2048, 2048, 4096, 4096]
    - [83, 19.986]
  - - [2048, 1024, 1, 8192, 2048, 2048, 8192, 8192]
    - [84, 22.934]
  - - [2048, 2048, 1, 128, 2048, 2048, 128, 128]
    - [44, 3.77]
  - - [2048, 2048, 1, 256, 2048, 2048, 256, 256]
    - [41, 6.36]
  - - [2048, 2048, 1, 512, 2048, 2048, 512, 512]
    - [39, 10.52]
  - - [2048, 2048, 1, 1024, 2048, 2048, 1024, 1024]
    - [39, 15.477]
  - - [2048, 2048, 1, 2048, 2048, 2048, 2048, 2048]
    - [68, 20.85]
  - - [2048, 2048, 1, 4096, 2048, 2048, 4096, 4096]
    - [71, 26.587]
  - - [2048, 2048, 1, 8192, 2048, 2048, 8192, 8192]
    - [44, 28.19]
  - - [2048, 4096, 1, 128, 2048, 2048, 128, 128]
    - [3, 4.636]
  - - [2048, 4096, 1, 256, 2048, 2048, 256, 256]
    - [0, 7.824]
  - - [2048, 4096, 1, 512, 2048, 2048, 512, 512]
    - [18, 12.302]
  - - [2048, 4096, 1, 1024, 2048, 2048, 1024, 1024]
    - [20, 19.329]
  - - [2048, 4096, 1, 2048, 2048, 2048, 2048, 2048]
    - [22, 26.429]
  - - [2048, 4096, 1, 4096, 2048, 2048, 4096, 4096]
    - [29, 31.752]
  - - [2048, 4096, 1, 8192, 2048, 2048, 8192, 8192]
    - [30, 31.247]
  - - [2048, 8192, 1, 128, 2048, 2048, 128, 128]
    - [3, 5.168]
  - - [2048, 8192, 1, 256, 2048, 2048, 256, 256]
    - [4, 8.778]
  - - [2048, 8192, 1, 512, 2048, 2048, 512, 512]
    - [55, 13.933]
  - - [2048, 8192, 1, 1024, 2048, 2048, 1024, 1024]
    - [14, 23.05]
  - - [2048, 8192, 1, 2048, 2048, 2048, 2048, 2048]
    - [56, 32.427]
  - - [2048, 8192, 1, 4096, 2048, 2048, 4096, 4096]
    - [17, 35.379]
  - - [2048, 8192, 1, 8192, 2048, 2048, 8192, 8192]
    - [16, 37.92]
  - - [4096, 128, 1, 128, 4096, 4096, 128, 128]
    - [96, 1.121]
  - - [4096, 128, 1, 256, 4096, 4096, 256, 256]
    - [117, 1.982]
  - - [4096, 128, 1, 512, 4096, 4096, 512, 512]
    - [96, 3.31]
  - - [4096, 128, 1, 1024, 4096, 4096, 1024, 1024]
    - [127, 5.379]
  - - [4096, 128, 1, 2048, 4096, 4096, 2048, 2048]
    - [124, 7.672]
  - - [4096, 128, 1, 4096, 4096, 4096, 4096, 4096]
    - [120, 9.387]
  - - [4096, 128, 1, 8192, 4096, 4096, 8192, 8192]
    - [118, 11.559]
  - - [4096, 256, 1, 128, 4096, 4096, 128, 128]
    - [109, 1.905]
  - - [4096, 256, 1, 256, 4096, 4096, 256, 256]
    - [109, 3.37]
  - - [4096, 256, 1, 512, 4096, 4096, 512, 512]
    - [94, 5.82]
  - - [4096, 256, 1, 1024, 4096, 4096, 1024, 1024]
    - [113, 8.179]
  - - [4096, 256, 1, 2048, 4096, 4096, 2048, 2048]
    - [94, 11.238]
  - - [4096, 256, 1, 4096, 4096, 4096, 4096, 4096]
    - [112, 14.409]
  - - [4096, 256, 1, 8192, 4096, 4096, 8192, 8192]
    - [114, 16.952]
  - - [4096, 512, 1, 128, 4096, 4096, 128, 128]
    - [104, 2.924]
  - - [4096, 512, 1, 256, 4096, 4096, 256, 256]
    - [52, 5.196]
  - - [4096, 512, 1, 512, 4096, 4096, 512, 512]
    - [77, 8.033]
  - - [4096, 512, 1, 1024, 4096, 4096, 1024, 1024]
    - [77, 11.363]
  - - [4096, 512, 1, 2048, 4096, 4096, 2048, 2048]
    - [46, 15.104]
  - - [4096, 512, 1, 4096, 4096, 4096, 4096, 4096]
    - [79, 19.269]
  - - [4096, 512, 1, 8192, 4096, 4096, 8192, 8192]
    - [84, 22.079]
  - - [4096, 1024, 1, 128, 4096, 4096, 128, 128]
    - [63, 3.739]
  - - [4096, 1024, 1, 256, 4096, 4096, 256, 256]
    - [36, 6.396]
  - - [4096, 1024, 1, 512, 4096, 4096, 512, 512]
    - [39, 10.554]
  - - [4096, 1024, 1, 1024, 4096, 4096, 1024, 1024]
    - [39, 15.605]
  - - [4096, 1024, 1, 2048, 4096, 4096, 2048, 2048]
    - [68, 20.511]
  - - [4096, 1024, 1, 4096, 4096, 4096, 4096, 4096]
    - [44, 26.566]
  - - [4096, 1024, 1, 8192, 4096, 4096, 8192, 8192]
    - [69, 27.051]
  - - [4096, 2048, 1, 128, 4096, 4096, 128, 128]
    - [2, 4.538]
  - - [4096, 2048, 1, 256, 4096, 4096, 256, 256]
    - [1, 7.589]
  - - [4096, 2048, 1, 512, 4096, 4096, 512, 512]
    - [18, 12.004]
  - - [4096, 2048, 1, 1024, 4096, 4096, 1024, 1024]
    - [20, 18.591]
  - - [4096, 2048, 1, 2048, 4096, 4096, 2048, 2048]
    - [24, 25.832]
  - - [4096, 2048, 1, 4096, 4096, 4096, 4096, 4096]
    - [30, 31.482]
  - - [4096, 2048, 1, 8192, 4096, 4096, 8192, 8192]
    - [32, 31.892]
  - - [4096, 4096, 1, 128, 4096, 4096, 128, 128]
    - [5, 5.157]
  - - [4096, 4096, 1, 256, 4096, 4096, 256, 256]
    - [5, 8.558]
  - - [4096, 4096, 1, 512, 4096, 4096, 512, 512]
    - [54, 14.274]
  - - [4096, 4096, 1, 1024, 4096, 4096, 1024, 1024]
    - [57, 22.93]
  - - [4096, 4096, 1, 2048, 4096, 4096, 2048, 2048]
    - [59, 31.604]
  - - [4096, 8192, 1, 128, 4096, 4096, 128, 128]
    - [11, 5.758]
  - - [4096, 8192, 1, 256, 4096, 4096, 256, 256]
    - [61, 9.831]
  - - [4096, 8192, 1, 512, 4096, 4096, 512, 512]
    - [7, 16.419]
  - - [4096, 8192, 1, 1024, 4096, 4096, 1024, 1024]
    - [58, 24.153]
  - - [4096, 8192, 1, 2048, 4096, 4096, 2048, 2048]
    - [17, 30.599]
  - - [8192, 128, 1, 128, 8192, 8192, 128, 128]
    - [109, 1.881]
  - - [8192, 128, 1, 256, 8192, 8192, 256, 256]
    - [108, 3.318]
  - - [8192, 128, 1, 512, 8192, 8192, 512, 512]
    - [93, 5.479]
  - - [8192, 128, 1, 1024, 8192, 8192, 1024, 1024]
    - [113, 7.735]
  - - [8192, 128, 1, 2048, 8192, 8192, 2048, 2048]
    - [111, 10.198]
  - - [8192, 128, 1, 4096, 8192, 8192, 4096, 4096]
    - [111, 12.994]
  - - [8192, 128, 1, 8192, 8192, 8192, 8192, 8192]
    - [114, 14.874]
  - - [8192, 256, 1, 128, 8192, 8192, 128, 128]
    - [64, 2.938]
  - - [8192, 256, 1, 256, 8192, 8192, 256, 256]
    - [53, 5.175]
  - - [8192, 256, 1, 512, 8192, 8192, 512, 512]
    - [50, 7.624]
  - - [8192, 256, 1, 1024, 8192, 8192, 1024, 1024]
    - [51, 11.416]
  - - [8192, 256, 1, 2048, 8192, 8192, 2048, 2048]
    - [45, 14.666]
  - - [8192, 256, 1, 4096, 8192, 8192, 4096, 4096]
    - [78, 18.16]
  - - [8192, 256, 1, 8192, 8192, 8192, 8192, 8192]
    - [106, 20.553]
  - - [8192, 512, 1, 128, 8192, 8192, 128, 128]
    - [62, 3.698]
  - - [8192, 512, 1, 256, 8192, 8192, 256, 256]
    - [13, 6.428]
  - - [8192, 512, 1, 512, 8192, 8192, 512, 512]
    - [39, 10.333]
  - - [8192, 512, 1, 1024, 8192, 8192, 1024, 1024]
    - [40, 15.198]
  - - [8192, 512, 1, 2048, 8192, 8192, 2048, 2048]
    - [70, 20.057]
  - - [8192, 512, 1, 4096, 8192, 8192, 4096, 4096]
    - [37, 25.399]
  - - [8192, 512, 1, 8192, 8192, 8192, 8192, 8192]
    - [43, 26.985]
  - - [8192, 1024, 1, 128, 8192, 8192, 128, 128]
    - [27, 4.588]
  - - [8192, 1024, 1, 256, 8192, 8192, 256, 256]
    - [26, 7.641]
  - - [8192, 1024, 1, 512, 8192, 8192, 512, 512]
    - [18, 12.447]
  - - [8192, 1024, 1, 1024, 8192, 8192, 1024, 1024]
    - [28, 19.121]
  - - [8192, 1024, 1, 2048, 8192, 8192, 2048, 2048]
    - [23, 25.881]
  - - [8192, 1024, 1, 4096, 8192, 8192, 4096, 4096]
    - [32, 31.139]
  - - [8192, 1024, 1, 8192, 8192, 8192, 8192, 8192]
    - [25, 30.772]
  - - [8192, 2048, 1, 128, 8192, 8192, 128, 128]
    - [19, 5.158]
  - - [8192, 2048, 1, 256, 8192, 8192, 256, 256]
    - [18, 8.532]
  - - [8192, 2048, 1, 512, 8192, 8192, 512, 512]
    - [8, 14.075]
  - - [8192, 2048, 1, 1024, 8192, 8192, 1024, 1024]
    - [14, 22.449]
  - - [8192, 2048, 1, 2048, 8192, 8192, 2048, 2048]
    - [15, 31.536]
  - - [8192, 2048, 1, 4096, 8192, 8192, 4096, 4096]
    - [17, 35.547]
  - - [8192, 2048, 1, 8192, 8192, 8192, 8192, 8192]
    - [17, 37.717]
  - - [8192, 4096, 1, 128, 8192, 8192, 128, 128]
    - [72, 5.658]
  - - [8192, 4096, 1, 256, 8192, 8192, 256, 256]
    - [10, 9.804]
  - - [8192, 4096, 1, 512, 8192, 8192, 512, 512]
    - [6, 16.006]
  - - [8192, 4096, 1, 1024, 8192, 8192, 1024, 1024]
    - [60, 24.03]
  - - [8192, 4096, 1, 2048, 8192, 8192, 2048, 2048]
    - [60, 29.946]
  - - [8192, 8192, 1, 128, 8192, 8192, 128, 128]
    - [12, 6.226]
  - - [8192, 8192, 1, 256, 8192, 8192, 256, 256]
    - [9, 10.743]
  - - [8192, 8192, 1, 512, 8192, 8192, 512, 512]
    - [9, 17.176]
  - - [8192, 8192, 1, 1024, 8192, 8192, 1024, 1024]
    - [60, 24.281]
  - - [8192, 8192, 1, 2048, 8192, 8192, 2048, 2048]
    - [14, 30.29]
  - - [4096, 4096, 1, 4096, 4096, 4096, 4096, 4096]
    - [14, 36.587]
  - - [4096, 4096, 1, 8192, 4096, 4096, 8192, 8192]
    - [15, 38.308]
  - - [4096, 8192, 1, 4096, 4096, 4096, 4096, 4096]
    - [16, 34.888]
  - - [4096, 8192, 1, 8192, 4096, 4096, 8192, 8192]
    - [17, 41.176]
  - - [8192, 4096, 1, 4096, 8192, 8192, 4096, 4096]
    - [15, 35.168]
  - - [8192, 4096, 1, 8192, 8192, 8192, 8192, 8192]
    - [15, 40.151]
  - - [8192, 8192, 1, 4096, 8192, 8192, 4096, 4096]
    - [17, 38.559]
  - - [8192, 8192, 1, 8192, 8192, 8192, 8192, 8192]
    - [15, 44.01]
  - - [1, 1, 1, 32, 1, 1, 32, 32]
    - [136, 0.0]
- null
- null
- DeviceEfficiency
- GridBased
