projects/hipblaslt/library/src/amd_detail/rocblaslt/src/Tensile/Logic/asm_full/gfx950/GridBased/gfx950_Cijk_Ailk_Bjlk_HHS_BH_Bias_HAS_SAV_UserArgs.yaml
- {MinimumRequiredVersion: 4.33.0}
- gfx950
- gfx950
- [Device 75a0]
    SolutionIndex: 0
    SolutionNameMin: Cijk_Ailk_Bjlk_HHS_BH_Bias_AS_SAV_UserArgs_MT256x256x32_MI16x16x1_SN_LDSB0_CLR0_GSU0_GSUC0_GSUWGMRR0_K1_LBSPPA2048_LBSPPB2048_LPA0_LPB0_MIWT8_8_PLR0_SU0_SUM0_SUS0_VWA8_VWB8_WGM1_WGMXCC1_WGMXCCGn1
    SolutionIndex: 1
    SolutionNameMin: Cijk_Ailk_Bjlk_HHS_BH_Bias_AS_SAV_UserArgs_MT256x256x32_MI16x16x1_SN_LDSB0_CLR0_GSU0_GSUC0_GSUWGMRR0_K1_LBSPPA2048_LBSPPB2048_LPA0_LPB0_MIWT8_8_PLR0_SU0_SUM0_SUS0_VWA8_VWB8_WGM1_WGMXCC1_WGMXCCGn1
    SolutionIndex: 2
    SolutionNameMin: Cijk_Ailk_Bjlk_HHS_BH_Bias_AS_SAV_UserArgs_MT256x256x32_MI16x16x1_SN_LDSB0_CLR0_GSU0_GSUC0_GSUWGMRR0_K1_LBSPPA1024_LBSPPB1024_LPA0_LPB0_MIWT8_8_PLR0_SU0_SUM0_SUS0_VWA8_VWB8_WGM6_WGMXCC1_WGMXCCGn1
    SolutionIndex: 3
    SolutionNameMin: Cijk_Ailk_Bjlk_HHS_BH_Bias_AS_SAV_UserArgs_MT256x256x32_MI16x16x1_SN_LDSB0_CLR0_GSU0_GSUC0_GSUWGMRR0_K1_LBSPPA1024_LBSPPB1024_LPA0_LPB0_MIWT8_8_PLR0_SU0_SUM0_SUS0_VWA8_VWB8_WGM6_WGMXCC1_WGMXCCGn1
    SolutionIndex: 4
    SolutionNameMin: Cijk_Ailk_Bjlk_HHS_BH_Bias_AS_SAV_UserArgs_MT256x256x32_MI16x16x1_SN_LDSB0_CLR0_GSU0_GSUC0_GSUWGMRR0_K1_LBSPPA1024_LBSPPB1024_LPA0_LPB0_MIWT8_8_PLR0_SU0_SUM0_SUS0_VWA8_VWB8_WGM6_WGMXCC1_WGMXCCGn1
    SolutionIndex: 5
    SolutionNameMin: Cijk_Ailk_Bjlk_HHS_BH_Bias_AS_SAV_UserArgs_MT256x256x32_MI16x16x1_SN_LDSB0_CLR0_GSU0_GSUC0_GSUWGMRR0_K1_LBSPPA1024_LBSPPB1024_LPA0_LPB0_MIWT8_8_PLR0_SU0_SUM0_SUS0_VWA8_VWB8_WGM6_WGMXCC1_WGMXCCGn1
    SolutionIndex: 6
    SolutionNameMin: Cijk_Ailk_Bjlk_HHS_BH_Bias_AS_SAV_UserArgs_MT256x256x32_MI16x16x1_SN_LDSB0_CLR0_GSU0_GSUC0_GSUWGMRR0_K1_LBSPPA2048_LBSPPB2048_LPA0_LPB0_MIWT8_8_PLR0_SU0_SUM0_SUS0_VWA8_VWB8_WGM6_WGMXCC1_WGMXCCGn1
    SolutionIndex: 7
    SolutionNameMin: Cijk_Ailk_Bjlk_HHS_BH_Bias_AS_SAV_UserArgs_MT256x256x32_MI16x16x1_SN_LDSB0_CLR0_GSU0_GSUC0_GSUWGMRR0_K1_LBSPPA4096_LBSPPB4096_LPA0_LPB0_MIWT8_8_PLR0_SU0_SUM0_SUS0_VWA8_VWB8_WGM6_WGMXCC1_WGMXCCGn1
    SolutionIndex: 8
    SolutionNameMin: Cijk_Ailk_Bjlk_HHS_BH_Bias_AS_SAV_UserArgs_MT256x256x32_MI16x16x1_SN_LDSB0_CLR0_GSU0_GSUC0_GSUWGMRR0_K1_LBSPPA4096_LBSPPB4096_LPA0_LPB0_MIWT8_8_PLR0_SU0_SUM0_SUS0_VWA8_VWB8_WGM6_WGMXCC1_WGMXCCGn1
    SolutionIndex: 9
    SolutionNameMin: Cijk_Ailk_Bjlk_HHS_BH_Bias_AS_SAV_UserArgs_MT256x256x32_MI16x16x1_SN_LDSB0_CLR0_GSU0_GSUC0_GSUWGMRR0_K1_LBSPPA1024_LBSPPB1024_LPA0_LPB0_MIWT8_8_PLR0_SU0_SUM0_SUS0_VWA8_VWB8_WGM8_WGMXCC1_WGMXCCGn1
    SolutionIndex: 10
    SolutionNameMin: Cijk_Ailk_Bjlk_HHS_BH_Bias_AS_SAV_UserArgs_MT256x256x32_MI16x16x1_SN_LDSB0_CLR0_GSU0_GSUC0_GSUWGMRR0_K1_LBSPPA2048_LBSPPB2048_LPA0_LPB0_MIWT8_8_PLR0_SU0_SUM0_SUS0_VWA8_VWB8_WGM8_WGMXCC1_WGMXCCGn1
    SolutionIndex: 11
    SolutionNameMin: Cijk_Ailk_Bjlk_HHS_BH_Bias_AS_SAV_UserArgs_MT256x256x32_MI16x16x1_SN_LDSB0_CLR0_GSU0_GSUC0_GSUWGMRR0_K1_LBSPPA4096_LBSPPB4096_LPA0_LPB0_MIWT8_8_PLR0_SU0_SUM0_SUS0_VWA8_VWB8_WGM8_WGMXCC1_WGMXCCGn1
    SolutionIndex: 12
    SolutionNameMin: Cijk_Ailk_Bjlk_HHS_BH_Bias_AS_SAV_UserArgs_MT128x256x32_MI16x16x1_SN_LDSB1_CLR0_GSU0_GSUC0_GSUWGMRR0_K1_LBSPPA1024_LBSPPB2048_LPA0_LPB0_MIWT4_8_PLR0_SU0_SUM0_SUS0_VWA4_VWB8_WGM1_WGMXCC1_WGMXCCGn1
    SolutionIndex: 13
    SolutionNameMin: Cijk_Ailk_Bjlk_HHS_BH_Bias_AS_SAV_UserArgs_MT128x256x32_MI16x16x1_SN_LDSB1_CLR0_GSU0_GSUC0_GSUWGMRR0_K1_LBSPPA512_LBSPPB1024_LPA0_LPB0_MIWT4_8_PLR0_SU0_SUM0_SUS0_VWA4_VWB8_WGM6_WGMXCC1_WGMXCCGn1
    SolutionIndex: 14
    SolutionNameMin: Cijk_Ailk_Bjlk_HHS_BH_Bias_AS_SAV_UserArgs_MT256x128x32_MI16x16x1_SN_LDSB1_CLR0_GSU0_GSUC0_GSUWGMRR0_K1_LBSPPA1024_LBSPPB512_LPA0_LPB0_MIWT8_4_PLR0_SU0_SUM0_SUS0_VWA8_VWB4_WGM1_WGMXCC1_WGMXCCGn1
    SolutionIndex: 15
    SolutionNameMin: Cijk_Ailk_Bjlk_HHS_BH_Bias_AS_SAV_UserArgs_MT256x128x32_MI16x16x1_SN_LDSB1_CLR0_GSU0_GSUC0_GSUWGMRR0_K1_LBSPPA1024_LBSPPB512_LPA0_LPB0_MIWT8_4_PLR0_SU0_SUM0_SUS0_VWA8_VWB4_WGM1_WGMXCC1_WGMXCCGn1
    SolutionIndex: 16
    SolutionNameMin: Cijk_Ailk_Bjlk_HHS_BH_Bias_AS_SAV_UserArgs_MT256x128x32_MI16x16x1_SN_LDSB1_CLR0_GSU0_GSUC0_GSUWGMRR0_K1_LBSPPA1024_LBSPPB512_LPA0_LPB0_MIWT8_4_PLR0_SU0_SUM0_SUS0_VWA8_VWB4_WGM1_WGMXCC1_WGMXCCGn1
    SolutionIndex: 17
    SolutionNameMin: Cijk_Ailk_Bjlk_HHS_BH_Bias_AS_SAV_UserArgs_MT256x128x32_MI16x16x1_SN_LDSB1_CLR0_GSU0_GSUC0_GSUWGMRR0_K1_LBSPPA2048_LBSPPB1024_LPA0_LPB0_MIWT8_4_PLR0_SU0_SUM0_SUS0_VWA8_VWB4_WGM1_WGMXCC1_WGMXCCGn1
    SolutionIndex: 18
    SolutionNameMin: Cijk_Ailk_Bjlk_HHS_BH_Bias_AS_SAV_UserArgs_MT256x128x32_MI16x16x1_SN_LDSB1_CLR0_GSU0_GSUC0_GSUWGMRR0_K1_LBSPPA4096_LBSPPB2048_LPA0_LPB0_MIWT8_4_PLR0_SU0_SUM0_SUS0_VWA8_VWB4_WGM1_WGMXCC1_WGMXCCGn1
    SolutionIndex: 19
    SolutionNameMin: Cijk_Ailk_Bjlk_HHS_BH_Bias_AS_SAV_UserArgs_MT256x128x32_MI16x16x1_SN_LDSB1_CLR0_GSU0_GSUC0_GSUWGMRR0_K1_LBSPPA1024_LBSPPB512_LPA0_LPB0_MIWT8_4_PLR0_SU0_SUM0_SUS0_VWA8_VWB4_WGM6_WGMXCC1_WGMXCCGn1
    SolutionIndex: 20
    SolutionNameMin: Cijk_Ailk_Bjlk_HHS_BH_Bias_AS_SAV_UserArgs_MT256x128x32_MI16x16x1_SN_LDSB1_CLR0_GSU0_GSUC0_GSUWGMRR0_K1_LBSPPA2048_LBSPPB1024_LPA0_LPB0_MIWT8_4_PLR0_SU0_SUM0_SUS0_VWA8_VWB4_WGM6_WGMXCC1_WGMXCCGn1
    SolutionIndex: 21
    SolutionNameMin: Cijk_Ailk_Bjlk_HHS_BH_Bias_AS_SAV_UserArgs_MT256x128x32_MI16x16x1_SN_LDSB1_CLR0_GSU0_GSUC0_GSUWGMRR0_K1_LBSPPA1024_LBSPPB512_LPA0_LPB0_MIWT8_4_PLR0_SU0_SUM0_SUS0_VWA8_VWB4_WGM8_WGMXCC1_WGMXCCGn1
    SolutionIndex: 22
    SolutionNameMin: Cijk_Ailk_Bjlk_HHS_BH_Bias_AS_SAV_UserArgs_MT256x128x32_MI16x16x1_SN_LDSB1_CLR0_GSU0_GSUC0_GSUWGMRR0_K1_LBSPPA1024_LBSPPB512_LPA0_LPB0_MIWT8_4_PLR0_SU0_SUM0_SUS0_VWA8_VWB4_WGM8_WGMXCC1_WGMXCCGn1
    SolutionIndex: 23
    SolutionNameMin: Cijk_Ailk_Bjlk_HHS_BH_Bias_AS_SAV_UserArgs_MT256x128x32_MI16x16x1_SN_LDSB1_CLR0_GSU0_GSUC0_GSUWGMRR0_K1_LBSPPA2048_LBSPPB1024_LPA0_LPB0_MIWT8_4_PLR0_SU0_SUM0_SUS0_VWA8_VWB4_WGM8_WGMXCC1_WGMXCCGn1
    SolutionIndex: 24
    SolutionNameMin: Cijk_Ailk_Bjlk_HHS_BH_Bias_AS_SAV_UserArgs_MT256x128x32_MI16x16x1_SN_LDSB1_CLR0_GSU0_GSUC0_GSUWGMRR0_K1_LBSPPA4096_LBSPPB2048_LPA0_LPB0_MIWT8_4_PLR0_SU0_SUM0_SUS0_VWA8_VWB4_WGM8_WGMXCC1_WGMXCCGn1
    SolutionIndex: 25
    SolutionNameMin: Cijk_Ailk_Bjlk_HHS_BH_Bias_AS_SAV_UserArgs_MT256x128x32_MI16x16x1_SN_LDSB1_CLR0_GSU0_GSUC0_GSUWGMRR0_K1_LBSPPA4096_LBSPPB2048_LPA0_LPB0_MIWT8_4_PLR0_SU0_SUM0_SUS0_VWA8_VWB4_WGM8_WGMXCC1_WGMXCCGn1
    SolutionIndex: 26
    SolutionNameMin: Cijk_Ailk_Bjlk_HHS_BH_Bias_AS_SAV_UserArgs_MT256x128x32_MI16x16x1_SN_LDSB1_CLR0_GSU0_GSUC0_GSUWGMRR0_K1_LBSPPA4096_LBSPPB2048_LPA0_LPB0_MIWT8_4_PLR0_SU0_SUM0_SUS0_VWA8_VWB4_WGM8_WGMXCC1_WGMXCCGn1
    SolutionIndex: 27
    SolutionNameMin: Cijk_Ailk_Bjlk_HHS_BH_Bias_AS_SAV_UserArgs_MT128x128x32_MI16x16x1_SN_LDSB0_CLR0_GSU0_GSUC0_GSUWGMRR0_K1_LBSPPA1024_LBSPPB1024_LPA0_LPB0_MIWT4_4_PLR0_SU0_SUM0_SUS0_VWA4_VWB4_WGM1_WGMXCC1_WGMXCCGn1
    SolutionIndex: 28
    SolutionNameMin: Cijk_Ailk_Bjlk_HHS_BH_Bias_AS_SAV_UserArgs_MT128x128x32_MI16x16x1_SN_LDSB0_CLR0_GSU0_GSUC0_GSUWGMRR0_K1_LBSPPA512_LBSPPB512_LPA0_LPB0_MIWT4_4_PLR0_SU0_SUM0_SUS0_VWA4_VWB4_WGM6_WGMXCC1_WGMXCCGn1
    SolutionIndex: 29
    SolutionNameMin: Cijk_Ailk_Bjlk_HHS_BH_Bias_AS_SAV_UserArgs_MT128x128x32_MI16x16x1_SN_LDSB0_CLR0_GSU0_GSUC0_GSUWGMRR0_K1_LBSPPA2048_LBSPPB2048_LPA0_LPB0_MIWT4_4_PLR0_SU0_SUM0_SUS0_VWA4_VWB4_WGM6_WGMXCC1_WGMXCCGn1
    SolutionIndex: 30
    SolutionNameMin: Cijk_Ailk_Bjlk_HHS_BH_Bias_AS_SAV_UserArgs_MT256x256x32_MI32x32x1_SN_LDSB0_CLR1_GSU0_GSUC0_GSUWGMRR0_K1_LBSPPA0_LBSPPB0_LPA0_LPB0_MIWT4_4_PLR1_SU0_SUM0_SUS0_VWA4_VWB4_WGM1_WGMXCC1_WGMXCCGn1
    SolutionIndex: 31
    SolutionNameMin: Cijk_Ailk_Bjlk_HHS_BH_Bias_AS_SAV_UserArgs_MT256x256x32_MI32x32x1_SN_LDSB0_CLR1_GSU0_GSUC0_GSUWGMRR0_K1_LBSPPA0_LBSPPB0_LPA0_LPB0_MIWT4_4_PLR1_SU0_SUM0_SUS0_VWA4_VWB4_WGM6_WGMXCC1_WGMXCCGn1
    SolutionIndex: 32
    SolutionNameMin: Cijk_Ailk_Bjlk_HHS_BH_Bias_AS_SAV_UserArgs_MT256x256x32_MI32x32x1_SN_LDSB0_CLR1_GSU0_GSUC0_GSUWGMRR0_K1_LBSPPA0_LBSPPB0_LPA0_LPB0_MIWT4_4_PLR1_SU0_SUM0_SUS0_VWA4_VWB4_WGM8_WGMXCC1_WGMXCCGn1
    SolutionIndex: 33
    SolutionNameMin: Cijk_Ailk_Bjlk_HHS_BH_Bias_AS_SAV_UserArgs_MT256x256x32_MI32x32x1_SN_LDSB0_CLR1_GSU0_GSUC0_GSUWGMRR0_K1_LBSPPA0_LBSPPB0_LPA0_LPB0_MIWT4_4_PLR1_SU0_SUM0_SUS0_VWA4_VWB4_WGM8_WGMXCC1_WGMXCCGn1
    SolutionIndex: 34
    SolutionNameMin: Cijk_Ailk_Bjlk_HHS_BH_Bias_AS_SAV_UserArgs_MT256x256x32_MI32x32x1_SN_LDSB0_CLR1_GSU0_GSUC0_GSUWGMRR0_K1_LBSPPA0_LBSPPB0_LPA0_LPB0_MIWT4_4_PLR1_SU0_SUM0_SUS0_VWA4_VWB4_WGM8_WGMXCC1_WGMXCCGn1
    SolutionIndex: 35
    SolutionNameMin: Cijk_Ailk_Bjlk_HHS_BH_Bias_AS_SAV_UserArgs_MT256x128x64_MI16x16x1_SN_LDSB1_CLR1_GSU0_GSUC0_GSUWGMRR0_K1_LBSPPA1024_LBSPPB512_LPA0_LPB0_MIWT8_4_PLR1_SU0_SUM0_SUS0_VWA8_VWB4_WGM1_WGMXCC1_WGMXCCGn1
    SolutionIndex: 36
    SolutionNameMin: Cijk_Ailk_Bjlk_HHS_BH_Bias_AS_SAV_UserArgs_MT256x128x64_MI16x16x1_SN_LDSB1_CLR1_GSU0_GSUC0_GSUWGMRR0_K1_LBSPPA4096_LBSPPB2048_LPA0_LPB0_MIWT8_4_PLR1_SU0_SUM0_SUS0_VWA8_VWB4_WGM1_WGMXCC1_WGMXCCGn1
    SolutionIndex: 37
    SolutionNameMin: Cijk_Ailk_Bjlk_HHS_BH_Bias_AS_SAV_UserArgs_MT256x128x64_MI16x16x1_SN_LDSB1_CLR1_GSU0_GSUC0_GSUWGMRR0_K1_LBSPPA2048_LBSPPB1024_LPA0_LPB0_MIWT8_4_PLR1_SU0_SUM0_SUS0_VWA8_VWB4_WGM6_WGMXCC1_WGMXCCGn1
    SolutionIndex: 38
    SolutionNameMin: Cijk_Ailk_Bjlk_HHS_BH_Bias_AS_SAV_UserArgs_MT256x128x64_MI16x16x1_SN_LDSB1_CLR1_GSU0_GSUC0_GSUWGMRR0_K1_LBSPPA2048_LBSPPB1024_LPA0_LPB0_MIWT8_4_PLR1_SU0_SUM0_SUS0_VWA8_VWB4_WGM6_WGMXCC1_WGMXCCGn1
    SolutionIndex: 39
    SolutionNameMin: Cijk_Ailk_Bjlk_HHS_BH_Bias_AS_SAV_UserArgs_MT256x128x64_MI16x16x1_SN_LDSB1_CLR1_GSU0_GSUC0_GSUWGMRR0_K1_LBSPPA4096_LBSPPB2048_LPA0_LPB0_MIWT8_4_PLR1_SU0_SUM0_SUS0_VWA8_VWB4_WGM6_WGMXCC1_WGMXCCGn1
    SolutionIndex: 40
    SolutionNameMin: Cijk_Ailk_Bjlk_HHS_BH_Bias_AS_SAV_UserArgs_MT256x128x64_MI16x16x1_SN_LDSB1_CLR1_GSU0_GSUC0_GSUWGMRR0_K1_LBSPPA1024_LBSPPB512_LPA0_LPB0_MIWT8_4_PLR1_SU0_SUM0_SUS0_VWA8_VWB4_WGM8_WGMXCC1_WGMXCCGn1
    SolutionIndex: 41
    SolutionNameMin: Cijk_Ailk_Bjlk_HHS_BH_Bias_AS_SAV_UserArgs_MT256x128x64_MI16x16x1_SN_LDSB1_CLR1_GSU0_GSUC0_GSUWGMRR0_K1_LBSPPA1024_LBSPPB512_LPA0_LPB0_MIWT8_4_PLR1_SU0_SUM0_SUS0_VWA8_VWB4_WGM8_WGMXCC1_WGMXCCGn1
    SolutionIndex: 42
    SolutionNameMin: Cijk_Ailk_Bjlk_HHS_BH_Bias_AS_SAV_UserArgs_MT256x128x64_MI16x16x1_SN_LDSB1_CLR1_GSU0_GSUC0_GSUWGMRR0_K1_LBSPPA2048_LBSPPB1024_LPA0_LPB0_MIWT8_4_PLR1_SU0_SUM0_SUS0_VWA8_VWB4_WGM8_WGMXCC1_WGMXCCGn1
    SolutionIndex: 43
    SolutionNameMin: Cijk_Ailk_Bjlk_HHS_BH_Bias_AS_SAV_UserArgs_MT256x128x64_MI16x16x1_SN_LDSB1_CLR1_GSU0_GSUC0_GSUWGMRR0_K1_LBSPPA4096_LBSPPB2048_LPA0_LPB0_MIWT8_4_PLR1_SU0_SUM0_SUS0_VWA8_VWB4_WGM8_WGMXCC1_WGMXCCGn1
    SolutionIndex: 44
    SolutionNameMin: Cijk_Ailk_Bjlk_HHS_BH_Bias_AS_SAV_UserArgs_MT128x128x64_MI16x16x1_SN_LDSB1_CLR1_GSU0_GSUC0_GSUWGMRR0_K1_LBSPPA512_LBSPPB512_LPA0_LPB0_MIWT4_4_PLR1_SU0_SUM0_SUS0_VWA4_VWB4_WGM1_WGMXCC1_WGMXCCGn1
    SolutionIndex: 45
    SolutionNameMin: Cijk_Ailk_Bjlk_HHS_BH_Bias_AS_SAV_UserArgs_MT128x128x64_MI16x16x1_SN_LDSB1_CLR1_GSU0_GSUC0_GSUWGMRR0_K1_LBSPPA1024_LBSPPB1024_LPA0_LPB0_MIWT4_4_PLR1_SU0_SUM0_SUS0_VWA4_VWB4_WGM1_WGMXCC1_WGMXCCGn1
    SolutionIndex: 46
    SolutionNameMin: Cijk_Ailk_Bjlk_HHS_BH_Bias_AS_SAV_UserArgs_MT128x128x64_MI16x16x1_SN_LDSB1_CLR1_GSU0_GSUC0_GSUWGMRR0_K1_LBSPPA512_LBSPPB512_LPA0_LPB0_MIWT4_4_PLR1_SU0_SUM0_SUS0_VWA4_VWB4_WGM6_WGMXCC1_WGMXCCGn1
    SolutionIndex: 47
    SolutionNameMin: Cijk_Ailk_Bjlk_HHS_BH_Bias_AS_SAV_UserArgs_MT128x128x64_MI16x16x1_SN_LDSB1_CLR1_GSU0_GSUC0_GSUWGMRR0_K1_LBSPPA1024_LBSPPB1024_LPA0_LPB0_MIWT4_4_PLR1_SU0_SUM0_SUS0_VWA4_VWB4_WGM6_WGMXCC1_WGMXCCGn1
    SolutionIndex: 48
    SolutionNameMin: Cijk_Ailk_Bjlk_HHS_BH_Bias_AS_SAV_UserArgs_MT128x128x64_MI16x16x1_SN_LDSB1_CLR1_GSU0_GSUC0_GSUWGMRR0_K1_LBSPPA2048_LBSPPB2048_LPA0_LPB0_MIWT4_4_PLR1_SU0_SUM0_SUS0_VWA4_VWB4_WGM6_WGMXCC1_WGMXCCGn1
    SolutionIndex: 49
    SolutionNameMin: Cijk_Ailk_Bjlk_HHS_BH_Bias_AS_SAV_UserArgs_MT128x128x64_MI16x16x1_SN_LDSB1_CLR1_GSU0_GSUC0_GSUWGMRR0_K1_LBSPPA512_LBSPPB512_LPA0_LPB0_MIWT4_4_PLR1_SU0_SUM0_SUS0_VWA4_VWB4_WGM8_WGMXCC1_WGMXCCGn1
    SolutionIndex: 50
    SolutionNameMin: Cijk_Ailk_Bjlk_HHS_BH_Bias_AS_SAV_UserArgs_MT128x128x64_MI16x16x1_SN_LDSB1_CLR1_GSU0_GSUC0_GSUWGMRR0_K1_LBSPPA1024_LBSPPB1024_LPA0_LPB0_MIWT4_4_PLR1_SU0_SUM0_SUS0_VWA4_VWB4_WGM8_WGMXCC1_WGMXCCGn1
    SolutionIndex: 51
    SolutionNameMin: Cijk_Ailk_Bjlk_HHS_BH_Bias_AS_SAV_UserArgs_MT128x128x64_MI16x16x1_SN_LDSB1_CLR1_GSU0_GSUC0_GSUWGMRR0_K1_LBSPPA2048_LBSPPB2048_LPA0_LPB0_MIWT4_4_PLR1_SU0_SUM0_SUS0_VWA4_VWB4_WGM8_WGMXCC1_WGMXCCGn1
    SolutionIndex: 52
    SolutionNameMin: Cijk_Ailk_Bjlk_HHS_BH_Bias_AS_SAV_UserArgs_MT64x128x64_MI16x16x1_SN_LDSB1_CLR1_GSU0_GSUC0_GSUWGMRR0_K1_LBSPPA256_LBSPPB512_LPA32_LPB0_MIWT2_4_PLR1_SU0_SUM0_SUS0_VWA2_VWB4_WGM1_WGMXCC1_WGMXCCGn1
    SolutionIndex: 53
    SolutionNameMin: Cijk_Ailk_Bjlk_HHS_BH_Bias_AS_SAV_UserArgs_MT64x128x64_MI16x16x1_SN_LDSB1_CLR1_GSU0_GSUC0_GSUWGMRR0_K1_LBSPPA512_LBSPPB1024_LPA32_LPB0_MIWT2_4_PLR1_SU0_SUM0_SUS0_VWA2_VWB4_WGM1_WGMXCC1_WGMXCCGn1
    SolutionIndex: 54
    SolutionNameMin: Cijk_Ailk_Bjlk_HHS_BH_Bias_AS_SAV_UserArgs_MT64x128x64_MI16x16x1_SN_LDSB1_CLR1_GSU0_GSUC0_GSUWGMRR0_K1_LBSPPA512_LBSPPB1024_LPA32_LPB0_MIWT2_4_PLR1_SU0_SUM0_SUS0_VWA2_VWB4_WGM6_WGMXCC1_WGMXCCGn1
    SolutionIndex: 55
    SolutionNameMin: Cijk_Ailk_Bjlk_HHS_BH_Bias_AS_SAV_UserArgs_MT64x128x64_MI16x16x1_SN_LDSB1_CLR1_GSU0_GSUC0_GSUWGMRR0_K1_LBSPPA1024_LBSPPB2048_LPA32_LPB0_MIWT2_4_PLR1_SU0_SUM0_SUS0_VWA2_VWB4_WGM6_WGMXCC1_WGMXCCGn1
    SolutionIndex: 56
    SolutionNameMin: Cijk_Ailk_Bjlk_HHS_BH_Bias_AS_SAV_UserArgs_MT128x64x64_MI16x16x1_SN_LDSB1_CLR1_GSU0_GSUC0_GSUWGMRR0_K1_LBSPPA512_LBSPPB256_LPA0_LPB32_MIWT4_2_PLR1_SU0_SUM0_SUS0_VWA4_VWB2_WGM1_WGMXCC1_WGMXCCGn1
    SolutionIndex: 57
    SolutionNameMin: Cijk_Ailk_Bjlk_HHS_BH_Bias_AS_SAV_UserArgs_MT128x64x64_MI16x16x1_SN_LDSB1_CLR1_GSU0_GSUC0_GSUWGMRR0_K1_LBSPPA512_LBSPPB256_LPA0_LPB32_MIWT4_2_PLR1_SU0_SUM0_SUS0_VWA4_VWB2_WGM1_WGMXCC1_WGMXCCGn1
    SolutionIndex: 58
    SolutionNameMin: Cijk_Ailk_Bjlk_HHS_BH_Bias_AS_SAV_UserArgs_MT128x64x64_MI16x16x1_SN_LDSB1_CLR1_GSU0_GSUC0_GSUWGMRR0_K1_LBSPPA1024_LBSPPB512_LPA0_LPB32_MIWT4_2_PLR1_SU0_SUM0_SUS0_VWA4_VWB2_WGM1_WGMXCC1_WGMXCCGn1
    SolutionIndex: 59
    SolutionNameMin: Cijk_Ailk_Bjlk_HHS_BH_Bias_AS_SAV_UserArgs_MT128x64x64_MI16x16x1_SN_LDSB1_CLR1_GSU0_GSUC0_GSUWGMRR0_K1_LBSPPA2048_LBSPPB1024_LPA0_LPB32_MIWT4_2_PLR1_SU0_SUM0_SUS0_VWA4_VWB2_WGM1_WGMXCC1_WGMXCCGn1
    SolutionIndex: 60
    SolutionNameMin: Cijk_Ailk_Bjlk_HHS_BH_Bias_AS_SAV_UserArgs_MT128x64x64_MI16x16x1_SN_LDSB1_CLR1_GSU0_GSUC0_GSUWGMRR0_K1_LBSPPA2048_LBSPPB1024_LPA0_LPB32_MIWT4_2_PLR1_SU0_SUM0_SUS0_VWA4_VWB2_WGM1_WGMXCC1_WGMXCCGn1
    SolutionIndex: 61
    SolutionNameMin: Cijk_Ailk_Bjlk_HHS_BH_Bias_AS_SAV_UserArgs_MT128x64x64_MI16x16x1_SN_LDSB1_CLR1_GSU0_GSUC0_GSUWGMRR0_K1_LBSPPA512_LBSPPB256_LPA0_LPB32_MIWT4_2_PLR1_SU0_SUM0_SUS0_VWA4_VWB2_WGM6_WGMXCC1_WGMXCCGn1
    SolutionIndex: 62
    SolutionNameMin: Cijk_Ailk_Bjlk_HHS_BH_Bias_AS_SAV_UserArgs_MT128x64x64_MI16x16x1_SN_LDSB1_CLR1_GSU0_GSUC0_GSUWGMRR0_K1_LBSPPA1024_LBSPPB512_LPA0_LPB32_MIWT4_2_PLR1_SU0_SUM0_SUS0_VWA4_VWB2_WGM6_WGMXCC1_WGMXCCGn1
    SolutionIndex: 63
    SolutionNameMin: Cijk_Ailk_Bjlk_HHS_BH_Bias_AS_SAV_UserArgs_MT128x64x64_MI16x16x1_SN_LDSB1_CLR1_GSU0_GSUC0_GSUWGMRR0_K1_LBSPPA512_LBSPPB256_LPA0_LPB32_MIWT4_2_PLR1_SU0_SUM0_SUS0_VWA4_VWB2_WGM8_WGMXCC1_WGMXCCGn1
    SolutionIndex: 64
    SolutionNameMin: Cijk_Ailk_Bjlk_HHS_BH_Bias_AS_SAV_UserArgs_MT128x64x64_MI16x16x1_SN_LDSB1_CLR1_GSU0_GSUC0_GSUWGMRR0_K1_LBSPPA1024_LBSPPB512_LPA0_LPB32_MIWT4_2_PLR1_SU0_SUM0_SUS0_VWA4_VWB2_WGM8_WGMXCC1_WGMXCCGn1
    SolutionIndex: 65
    SolutionNameMin: Cijk_Ailk_Bjlk_HHS_BH_Bias_AS_SAV_UserArgs_MT128x64x64_MI16x16x1_SN_LDSB1_CLR1_GSU0_GSUC0_GSUWGMRR0_K1_LBSPPA2048_LBSPPB1024_LPA0_LPB32_MIWT4_2_PLR1_SU0_SUM0_SUS0_VWA4_VWB2_WGM8_WGMXCC1_WGMXCCGn1
    SolutionIndex: 66
    SolutionNameMin: Cijk_Ailk_Bjlk_HHS_BH_Bias_AS_SAV_UserArgs_MT64x64x64_MI16x16x1_SN_LDSB1_CLR1_GSU0_GSUC0_GSUWGMRR0_K1_LBSPPA512_LBSPPB512_LPA32_LPB32_MIWT2_2_PLR1_SU0_SUM0_SUS0_VWA2_VWB2_WGM1_WGMXCC1_WGMXCCGn1
    SolutionIndex: 67
    SolutionNameMin: Cijk_Ailk_Bjlk_HHS_BH_Bias_AS_SAV_UserArgs_MT64x64x64_MI16x16x1_SN_LDSB1_CLR1_GSU0_GSUC0_GSUWGMRR0_K1_LBSPPA1024_LBSPPB1024_LPA32_LPB32_MIWT2_2_PLR1_SU0_SUM0_SUS0_VWA2_VWB2_WGM1_WGMXCC1_WGMXCCGn1
    SolutionIndex: 68
    SolutionNameMin: Cijk_Ailk_Bjlk_HHS_BH_Bias_AS_SAV_UserArgs_MT64x64x64_MI16x16x1_SN_LDSB1_CLR1_GSU0_GSUC0_GSUWGMRR0_K1_LBSPPA1024_LBSPPB1024_LPA32_LPB32_MIWT2_2_PLR1_SU0_SUM0_SUS0_VWA2_VWB2_WGM1_WGMXCC1_WGMXCCGn1
    SolutionIndex: 69
    SolutionNameMin: Cijk_Ailk_Bjlk_HHS_BH_Bias_AS_SAV_UserArgs_MT256x256x64_MI32x32x1_SN_LDSB0_CLR1_GSU0_GSUC0_GSUWGMRR0_K1_LBSPPA0_LBSPPB0_LPA0_LPB0_MIWT4_4_PLR1_SU0_SUM0_SUS0_VWA4_VWB4_WGM1_WGMXCC1_WGMXCCGn1
    SolutionIndex: 70
    SolutionNameMin: Cijk_Ailk_Bjlk_HHS_BH_Bias_AS_SAV_UserArgs_MT256x256x64_MI32x32x1_SN_LDSB0_CLR1_GSU0_GSUC0_GSUWGMRR0_K1_LBSPPA0_LBSPPB0_LPA0_LPB0_MIWT4_4_PLR1_SU0_SUM0_SUS0_VWA4_VWB4_WGM6_WGMXCC1_WGMXCCGn1
    SolutionIndex: 71
    SolutionNameMin: Cijk_Ailk_Bjlk_HHS_BH_Bias_AS_SAV_UserArgs_MT256x256x64_MI32x32x1_SN_LDSB0_CLR1_GSU0_GSUC0_GSUWGMRR0_K1_LBSPPA0_LBSPPB0_LPA0_LPB0_MIWT4_4_PLR1_SU0_SUM0_SUS0_VWA4_VWB4_WGM8_WGMXCC1_WGMXCCGn1
    SolutionIndex: 72
    SolutionNameMin: Cijk_Ailk_Bjlk_HHS_BH_Bias_AS_SAV_UserArgs_MT256x256x64_MI32x32x1_SN_LDSB0_CLR1_GSU0_GSUC0_GSUWGMRR0_K1_LBSPPA0_LBSPPB0_LPA0_LPB0_MIWT4_4_PLR1_SU0_SUM0_SUS0_VWA4_VWB4_WGM8_WGMXCC1_WGMXCCGn1
    SolutionIndex: 73
    SolutionNameMin: Cijk_Ailk_Bjlk_HHS_BH_Bias_AS_SAV_UserArgs_MT256x256x64_MI32x32x1_SN_LDSB0_CLR1_GSU0_GSUC0_GSUWGMRR0_K1_LBSPPA0_LBSPPB0_LPA0_LPB0_MIWT4_4_PLR1_SU0_SUM0_SUS0_VWA4_VWB4_WGM8_WGMXCC1_WGMXCCGn1
    SolutionIndex: 74
    SolutionNameMin: Cijk_Ailk_Bjlk_HHS_BH_Bias_AS_SAV_UserArgs_MT128x128x128_MI16x16x1_SN_LDSB1_CLR1_GSU0_GSUC0_GSUWGMRR0_K1_LBSPPA512_LBSPPB512_LPA0_LPB0_MIWT4_4_PLR1_SU0_SUM0_SUS0_VWA4_VWB4_WGM1_WGMXCC1_WGMXCCGn1
    SolutionIndex: 75
    SolutionNameMin: Cijk_Ailk_Bjlk_HHS_BH_Bias_AS_SAV_UserArgs_MT128x128x128_MI16x16x1_SN_LDSB1_CLR1_GSU0_GSUC0_GSUWGMRR0_K1_LBSPPA1024_LBSPPB1024_LPA0_LPB0_MIWT4_4_PLR1_SU0_SUM0_SUS0_VWA4_VWB4_WGM1_WGMXCC1_WGMXCCGn1
    SolutionIndex: 76
    SolutionNameMin: Cijk_Ailk_Bjlk_HHS_BH_Bias_AS_SAV_UserArgs_MT128x128x128_MI16x16x1_SN_LDSB1_CLR1_GSU0_GSUC0_GSUWGMRR0_K1_LBSPPA1024_LBSPPB1024_LPA0_LPB0_MIWT4_4_PLR1_SU0_SUM0_SUS0_VWA4_VWB4_WGM1_WGMXCC1_WGMXCCGn1
    SolutionIndex: 77
    SolutionNameMin: Cijk_Ailk_Bjlk_HHS_BH_Bias_AS_SAV_UserArgs_MT128x128x128_MI16x16x1_SN_LDSB1_CLR1_GSU0_GSUC0_GSUWGMRR0_K1_LBSPPA512_LBSPPB512_LPA0_LPB0_MIWT4_4_PLR1_SU0_SUM0_SUS0_VWA4_VWB4_WGM6_WGMXCC1_WGMXCCGn1
    SolutionIndex: 78
    SolutionNameMin: Cijk_Ailk_Bjlk_HHS_BH_Bias_AS_SAV_UserArgs_MT128x128x128_MI16x16x1_SN_LDSB1_CLR1_GSU0_GSUC0_GSUWGMRR0_K1_LBSPPA512_LBSPPB512_LPA0_LPB0_MIWT4_4_PLR1_SU0_SUM0_SUS0_VWA4_VWB4_WGM6_WGMXCC1_WGMXCCGn1
    SolutionIndex: 79
    SolutionNameMin: Cijk_Ailk_Bjlk_HHS_BH_Bias_AS_SAV_UserArgs_MT128x128x128_MI16x16x1_SN_LDSB1_CLR1_GSU0_GSUC0_GSUWGMRR0_K1_LBSPPA1024_LBSPPB1024_LPA0_LPB0_MIWT4_4_PLR1_SU0_SUM0_SUS0_VWA4_VWB4_WGM6_WGMXCC1_WGMXCCGn1
    SolutionIndex: 80
    SolutionNameMin: Cijk_Ailk_Bjlk_HHS_BH_Bias_AS_SAV_UserArgs_MT128x128x128_MI16x16x1_SN_LDSB1_CLR1_GSU0_GSUC0_GSUWGMRR0_K1_LBSPPA2048_LBSPPB2048_LPA0_LPB0_MIWT4_4_PLR1_SU0_SUM0_SUS0_VWA4_VWB4_WGM6_WGMXCC1_WGMXCCGn1
    SolutionIndex: 81
    SolutionNameMin: Cijk_Ailk_Bjlk_HHS_BH_Bias_AS_SAV_UserArgs_MT128x128x128_MI16x16x1_SN_LDSB1_CLR1_GSU0_GSUC0_GSUWGMRR0_K1_LBSPPA512_LBSPPB512_LPA0_LPB0_MIWT4_4_PLR1_SU0_SUM0_SUS0_VWA4_VWB4_WGM8_WGMXCC1_WGMXCCGn1
    SolutionIndex: 82
    SolutionNameMin: Cijk_Ailk_Bjlk_HHS_BH_Bias_AS_SAV_UserArgs_MT128x128x128_MI16x16x1_SN_LDSB1_CLR1_GSU0_GSUC0_GSUWGMRR0_K1_LBSPPA2048_LBSPPB2048_LPA0_LPB0_MIWT4_4_PLR1_SU0_SUM0_SUS0_VWA4_VWB4_WGM8_WGMXCC1_WGMXCCGn1
    SolutionIndex: 83
    SolutionNameMin: Cijk_Ailk_Bjlk_HHS_BH_Bias_AS_SAV_UserArgs_MT128x128x128_MI16x16x1_SN_LDSB1_CLR1_GSU0_GSUC0_GSUWGMRR0_K1_LBSPPA2048_LBSPPB2048_LPA0_LPB0_MIWT4_4_PLR1_SU0_SUM0_SUS0_VWA4_VWB4_WGM8_WGMXCC1_WGMXCCGn1
    SolutionIndex: 84
    SolutionNameMin: Cijk_Ailk_Bjlk_HHS_BH_Bias_AS_SAV_UserArgs_MT128x64x128_MI16x16x1_SN_LDSB1_CLR1_GSU0_GSUC0_GSUWGMRR0_K1_LBSPPA2048_LBSPPB1024_LPA0_LPB32_MIWT4_2_PLR1_SU0_SUM0_SUS0_VWA4_VWB2_WGM6_WGMXCC1_WGMXCCGn1
    SolutionIndex: 85
    SolutionNameMin: Cijk_Ailk_Bjlk_HHS_BH_Bias_AS_SAV_UserArgs_MT64x64x128_MI16x16x1_SN_LDSB1_CLR1_GSU0_GSUC0_GSUWGMRR0_K1_LBSPPA256_LBSPPB256_LPA32_LPB32_MIWT2_2_PLR1_SU0_SUM0_SUS0_VWA2_VWB2_WGM1_WGMXCC1_WGMXCCGn1
    SolutionIndex: 86
    SolutionNameMin: Cijk_Ailk_Bjlk_HHS_BH_Bias_AS_SAV_UserArgs_MT64x64x128_MI16x16x1_SN_LDSB1_CLR1_GSU0_GSUC0_GSUWGMRR0_K1_LBSPPA512_LBSPPB512_LPA32_LPB32_MIWT2_2_PLR1_SU0_SUM0_SUS0_VWA2_VWB2_WGM1_WGMXCC1_WGMXCCGn1
    SolutionIndex: 87
    SolutionNameMin: Cijk_Ailk_Bjlk_HHS_BH_Bias_AS_SAV_UserArgs_MT64x64x128_MI16x16x1_SN_LDSB1_CLR1_GSU0_GSUC0_GSUWGMRR0_K1_LBSPPA1024_LBSPPB1024_LPA32_LPB32_MIWT2_2_PLR1_SU0_SUM0_SUS0_VWA2_VWB2_WGM1_WGMXCC1_WGMXCCGn1
    SolutionIndex: 88
    SolutionNameMin: Cijk_Ailk_Bjlk_HHS_BH_Bias_AS_SAV_UserArgs_MT64x64x128_MI16x16x1_SN_LDSB1_CLR1_GSU0_GSUC0_GSUWGMRR0_K1_LBSPPA256_LBSPPB256_LPA32_LPB32_MIWT2_2_PLR1_SU0_SUM0_SUS0_VWA2_VWB2_WGM6_WGMXCC1_WGMXCCGn1
    SolutionIndex: 89
    SolutionNameMin: Cijk_Ailk_Bjlk_HHS_BH_Bias_AS_SAV_UserArgs_MT64x64x128_MI16x16x1_SN_LDSB1_CLR1_GSU0_GSUC0_GSUWGMRR0_K1_LBSPPA512_LBSPPB512_LPA32_LPB32_MIWT2_2_PLR1_SU0_SUM0_SUS0_VWA2_VWB2_WGM6_WGMXCC1_WGMXCCGn1
    SolutionIndex: 90
    SolutionNameMin: Cijk_Ailk_Bjlk_HHS_BH_Bias_AS_SAV_UserArgs_MT64x64x128_MI16x16x1_SN_LDSB1_CLR1_GSU0_GSUC0_GSUWGMRR0_K1_LBSPPA512_LBSPPB512_LPA32_LPB32_MIWT2_2_PLR1_SU0_SUM0_SUS0_VWA2_VWB2_WGM6_WGMXCC1_WGMXCCGn1
    SolutionIndex: 91
    SolutionNameMin: Cijk_Ailk_Bjlk_HHS_BH_Bias_AS_SAV_UserArgs_MT64x64x128_MI16x16x1_SN_LDSB1_CLR1_GSU0_GSUC0_GSUWGMRR0_K1_LBSPPA1024_LBSPPB1024_LPA32_LPB32_MIWT2_2_PLR1_SU0_SUM0_SUS0_VWA2_VWB2_WGM6_WGMXCC1_WGMXCCGn1
    SolutionIndex: 92
    SolutionNameMin: Cijk_Ailk_Bjlk_HHS_BH_Bias_AS_SAV_UserArgs_MT64x64x128_MI16x16x1_SN_LDSB1_CLR1_GSU0_GSUC0_GSUWGMRR0_K1_LBSPPA256_LBSPPB256_LPA32_LPB32_MIWT2_2_PLR1_SU0_SUM0_SUS0_VWA2_VWB2_WGM8_WGMXCC1_WGMXCCGn1
    SolutionIndex: 93
    SolutionNameMin: Cijk_Ailk_Bjlk_HHS_BH_Bias_AS_SAV_UserArgs_MT64x64x128_MI16x16x1_SN_LDSB1_CLR1_GSU0_GSUC0_GSUWGMRR0_K1_LBSPPA256_LBSPPB256_LPA32_LPB32_MIWT2_2_PLR1_SU0_SUM0_SUS0_VWA2_VWB2_WGM8_WGMXCC1_WGMXCCGn1
    SolutionIndex: 94
    SolutionNameMin: Cijk_Ailk_Bjlk_HHS_BH_Bias_AS_SAV_UserArgs_MT64x64x128_MI16x16x1_SN_LDSB1_CLR1_GSU0_GSUC0_GSUWGMRR0_K1_LBSPPA512_LBSPPB512_LPA32_LPB32_MIWT2_2_PLR1_SU0_SUM0_SUS0_VWA2_VWB2_WGM8_WGMXCC1_WGMXCCGn1
    SolutionIndex: 95
    SolutionNameMin: Cijk_Ailk_Bjlk_HHS_BH_Bias_AS_SAV_UserArgs_MT32x64x128_MI16x16x1_SN_LDSB1_CLR1_GSU0_GSUC0_GSUWGMRR0_K1_LBSPPA128_LBSPPB256_LPA16_LPB32_MIWT1_2_PLR1_SU0_SUM0_SUS0_VWA1_VWB2_WGM1_WGMXCC1_WGMXCCGn1
    SolutionIndex: 96
    SolutionNameMin: Cijk_Ailk_Bjlk_HHS_BH_Bias_AS_SAV_UserArgs_MT32x64x128_MI16x16x1_SN_LDSB1_CLR1_GSU0_GSUC0_GSUWGMRR0_K1_LBSPPA256_LBSPPB512_LPA16_LPB32_MIWT1_2_PLR1_SU0_SUM0_SUS0_VWA1_VWB2_WGM1_WGMXCC1_WGMXCCGn1
    SolutionIndex: 97
    SolutionNameMin: Cijk_Ailk_Bjlk_HHS_BH_Bias_AS_SAV_UserArgs_MT32x64x128_MI16x16x1_SN_LDSB1_CLR1_GSU0_GSUC0_GSUWGMRR0_K1_LBSPPA512_LBSPPB1024_LPA16_LPB32_MIWT1_2_PLR1_SU0_SUM0_SUS0_VWA1_VWB2_WGM1_WGMXCC1_WGMXCCGn1
    SolutionIndex: 98
    SolutionNameMin: Cijk_Ailk_Bjlk_HHS_BH_Bias_AS_SAV_UserArgs_MT32x64x128_MI16x16x1_SN_LDSB1_CLR1_GSU0_GSUC0_GSUWGMRR0_K1_LBSPPA512_LBSPPB1024_LPA16_LPB32_MIWT1_2_PLR1_SU0_SUM0_SUS0_VWA1_VWB2_WGM1_WGMXCC1_WGMXCCGn1
    SolutionIndex: 99
    SolutionNameMin: Cijk_Ailk_Bjlk_HHS_BH_Bias_AS_SAV_UserArgs_MT32x64x128_MI16x16x1_SN_LDSB1_CLR1_GSU0_GSUC0_GSUWGMRR0_K1_LBSPPA128_LBSPPB256_LPA16_LPB32_MIWT1_2_PLR1_SU0_SUM0_SUS0_VWA1_VWB2_WGM6_WGMXCC1_WGMXCCGn1
    SolutionIndex: 100
    SolutionNameMin: Cijk_Ailk_Bjlk_HHS_BH_Bias_AS_SAV_UserArgs_MT64x32x128_MI16x16x1_SN_LDSB1_CLR1_GSU0_GSUC0_GSUWGMRR0_K1_LBSPPA256_LBSPPB128_LPA32_LPB16_MIWT2_1_PLR1_SU0_SUM0_SUS0_VWA2_VWB1_WGM1_WGMXCC1_WGMXCCGn1
    SolutionIndex: 101
    SolutionNameMin: Cijk_Ailk_Bjlk_HHS_BH_Bias_AS_SAV_UserArgs_MT64x32x128_MI16x16x1_SN_LDSB1_CLR1_GSU0_GSUC0_GSUWGMRR0_K1_LBSPPA256_LBSPPB128_LPA32_LPB16_MIWT2_1_PLR1_SU0_SUM0_SUS0_VWA2_VWB1_WGM1_WGMXCC1_WGMXCCGn1
    SolutionIndex: 102
    SolutionNameMin: Cijk_Ailk_Bjlk_HHS_BH_Bias_AS_SAV_UserArgs_MT64x32x128_MI16x16x1_SN_LDSB1_CLR1_GSU0_GSUC0_GSUWGMRR0_K1_LBSPPA256_LBSPPB128_LPA32_LPB16_MIWT2_1_PLR1_SU0_SUM0_SUS0_VWA2_VWB1_WGM1_WGMXCC1_WGMXCCGn1
    SolutionIndex: 103
    SolutionNameMin: Cijk_Ailk_Bjlk_HHS_BH_Bias_AS_SAV_UserArgs_MT64x32x128_MI16x16x1_SN_LDSB1_CLR1_GSU0_GSUC0_GSUWGMRR0_K1_LBSPPA512_LBSPPB256_LPA32_LPB16_MIWT2_1_PLR1_SU0_SUM0_SUS0_VWA2_VWB1_WGM1_WGMXCC1_WGMXCCGn1
    SolutionIndex: 104
    SolutionNameMin: Cijk_Ailk_Bjlk_HHS_BH_Bias_AS_SAV_UserArgs_MT64x32x128_MI16x16x1_SN_LDSB1_CLR1_GSU0_GSUC0_GSUWGMRR0_K1_LBSPPA512_LBSPPB256_LPA32_LPB16_MIWT2_1_PLR1_SU0_SUM0_SUS0_VWA2_VWB1_WGM1_WGMXCC1_WGMXCCGn1
    SolutionIndex: 105
    SolutionNameMin: Cijk_Ailk_Bjlk_HHS_BH_Bias_AS_SAV_UserArgs_MT64x32x128_MI16x16x1_SN_LDSB1_CLR1_GSU0_GSUC0_GSUWGMRR0_K1_LBSPPA512_LBSPPB256_LPA32_LPB16_MIWT2_1_PLR1_SU0_SUM0_SUS0_VWA2_VWB1_WGM1_WGMXCC1_WGMXCCGn1
    SolutionIndex: 106
    SolutionNameMin: Cijk_Ailk_Bjlk_HHS_BH_Bias_AS_SAV_UserArgs_MT64x32x128_MI16x16x1_SN_LDSB1_CLR1_GSU0_GSUC0_GSUWGMRR0_K1_LBSPPA1024_LBSPPB512_LPA32_LPB16_MIWT2_1_PLR1_SU0_SUM0_SUS0_VWA2_VWB1_WGM1_WGMXCC1_WGMXCCGn1
    SolutionIndex: 107
    SolutionNameMin: Cijk_Ailk_Bjlk_HHS_BH_Bias_AS_SAV_UserArgs_MT64x32x128_MI16x16x1_SN_LDSB1_CLR1_GSU0_GSUC0_GSUWGMRR0_K1_LBSPPA1024_LBSPPB512_LPA32_LPB16_MIWT2_1_PLR1_SU0_SUM0_SUS0_VWA2_VWB1_WGM1_WGMXCC1_WGMXCCGn1
    SolutionIndex: 108
    SolutionNameMin: Cijk_Ailk_Bjlk_HHS_BH_Bias_AS_SAV_UserArgs_MT64x32x128_MI16x16x1_SN_LDSB1_CLR1_GSU0_GSUC0_GSUWGMRR0_K1_LBSPPA1024_LBSPPB512_LPA32_LPB16_MIWT2_1_PLR1_SU0_SUM0_SUS0_VWA2_VWB1_WGM1_WGMXCC1_WGMXCCGn1
    SolutionIndex: 109
    SolutionNameMin: Cijk_Ailk_Bjlk_HHS_BH_Bias_AS_SAV_UserArgs_MT64x32x128_MI16x16x1_SN_LDSB1_CLR1_GSU0_GSUC0_GSUWGMRR0_K1_LBSPPA256_LBSPPB128_LPA32_LPB16_MIWT2_1_PLR1_SU0_SUM0_SUS0_VWA2_VWB1_WGM6_WGMXCC1_WGMXCCGn1
    SolutionIndex: 110
    SolutionNameMin: Cijk_Ailk_Bjlk_HHS_BH_Bias_AS_SAV_UserArgs_MT64x32x128_MI16x16x1_SN_LDSB1_CLR1_GSU0_GSUC0_GSUWGMRR0_K1_LBSPPA512_LBSPPB256_LPA32_LPB16_MIWT2_1_PLR1_SU0_SUM0_SUS0_VWA2_VWB1_WGM6_WGMXCC1_WGMXCCGn1
    SolutionIndex: 111
    SolutionNameMin: Cijk_Ailk_Bjlk_HHS_BH_Bias_AS_SAV_UserArgs_MT64x32x128_MI16x16x1_SN_LDSB1_CLR1_GSU0_GSUC0_GSUWGMRR0_K1_LBSPPA256_LBSPPB128_LPA32_LPB16_MIWT2_1_PLR1_SU0_SUM0_SUS0_VWA2_VWB1_WGM8_WGMXCC1_WGMXCCGn1
    SolutionIndex: 112
    SolutionNameMin: Cijk_Ailk_Bjlk_HHS_BH_Bias_AS_SAV_UserArgs_MT64x32x128_MI16x16x1_SN_LDSB1_CLR1_GSU0_GSUC0_GSUWGMRR0_K1_LBSPPA256_LBSPPB128_LPA32_LPB16_MIWT2_1_PLR1_SU0_SUM0_SUS0_VWA2_VWB1_WGM8_WGMXCC1_WGMXCCGn1
    SolutionIndex: 113
    SolutionNameMin: Cijk_Ailk_Bjlk_HHS_BH_Bias_AS_SAV_UserArgs_MT64x32x128_MI16x16x1_SN_LDSB1_CLR1_GSU0_GSUC0_GSUWGMRR0_K1_LBSPPA512_LBSPPB256_LPA32_LPB16_MIWT2_1_PLR1_SU0_SUM0_SUS0_VWA2_VWB1_WGM8_WGMXCC1_WGMXCCGn1
    SolutionIndex: 114
    SolutionNameMin: Cijk_Ailk_Bjlk_HHS_BH_Bias_AS_SAV_UserArgs_MT64x32x128_MI16x16x1_SN_LDSB1_CLR1_GSU0_GSUC0_GSUWGMRR0_K1_LBSPPA1024_LBSPPB512_LPA32_LPB16_MIWT2_1_PLR1_SU0_SUM0_SUS0_VWA2_VWB1_WGM8_WGMXCC1_WGMXCCGn1
    SolutionIndex: 115
    SolutionNameMin: Cijk_Ailk_Bjlk_HHS_BH_Bias_AS_SAV_UserArgs_MT32x32x128_MI16x16x1_SN_LDSB1_CLR1_GSU0_GSUC0_GSUWGMRR0_K1_LBSPPA128_LBSPPB128_LPA16_LPB16_MIWT1_1_PLR1_SU0_SUM0_SUS0_VWA1_VWB1_WGM1_WGMXCC1_WGMXCCGn1
    SolutionIndex: 116
    SolutionNameMin: Cijk_Ailk_Bjlk_HHS_BH_Bias_AS_SAV_UserArgs_MT32x32x128_MI16x16x1_SN_LDSB1_CLR1_GSU0_GSUC0_GSUWGMRR0_K1_LBSPPA128_LBSPPB128_LPA16_LPB16_MIWT1_1_PLR1_SU0_SUM0_SUS0_VWA1_VWB1_WGM1_WGMXCC1_WGMXCCGn1
    SolutionIndex: 117
    SolutionNameMin: Cijk_Ailk_Bjlk_HHS_BH_Bias_AS_SAV_UserArgs_MT32x32x128_MI16x16x1_SN_LDSB1_CLR1_GSU0_GSUC0_GSUWGMRR0_K1_LBSPPA128_LBSPPB128_LPA16_LPB16_MIWT1_1_PLR1_SU0_SUM0_SUS0_VWA1_VWB1_WGM1_WGMXCC1_WGMXCCGn1
    SolutionIndex: 118
    SolutionNameMin: Cijk_Ailk_Bjlk_HHS_BH_Bias_AS_SAV_UserArgs_MT32x32x128_MI16x16x1_SN_LDSB1_CLR1_GSU0_GSUC0_GSUWGMRR0_K1_LBSPPA128_LBSPPB128_LPA16_LPB16_MIWT1_1_PLR1_SU0_SUM0_SUS0_VWA1_VWB1_WGM1_WGMXCC1_WGMXCCGn1
    SolutionIndex: 119
    SolutionNameMin: Cijk_Ailk_Bjlk_HHS_BH_Bias_AS_SAV_UserArgs_MT32x32x128_MI16x16x1_SN_LDSB1_CLR1_GSU0_GSUC0_GSUWGMRR0_K1_LBSPPA128_LBSPPB128_LPA16_LPB16_MIWT1_1_PLR1_SU0_SUM0_SUS0_VWA1_VWB1_WGM1_WGMXCC1_WGMXCCGn1
    SolutionIndex: 120
    SolutionNameMin: Cijk_Ailk_Bjlk_HHS_BH_Bias_AS_SAV_UserArgs_MT32x32x128_MI16x16x1_SN_LDSB1_CLR1_GSU0_GSUC0_GSUWGMRR0_K1_LBSPPA128_LBSPPB128_LPA16_LPB16_MIWT1_1_PLR1_SU0_SUM0_SUS0_VWA1_VWB1_WGM1_WGMXCC1_WGMXCCGn1
    SolutionIndex: 121
    SolutionNameMin: Cijk_Ailk_Bjlk_HHS_BH_Bias_AS_SAV_UserArgs_MT32x32x128_MI16x16x1_SN_LDSB1_CLR1_GSU0_GSUC0_GSUWGMRR0_K1_LBSPPA128_LBSPPB128_LPA16_LPB16_MIWT1_1_PLR1_SU0_SUM0_SUS0_VWA1_VWB1_WGM1_WGMXCC1_WGMXCCGn1
    SolutionIndex: 122
    SolutionNameMin: Cijk_Ailk_Bjlk_HHS_BH_Bias_AS_SAV_UserArgs_MT32x32x128_MI16x16x1_SN_LDSB1_CLR1_GSU0_GSUC0_GSUWGMRR0_K1_LBSPPA256_LBSPPB256_LPA16_LPB16_MIWT1_1_PLR1_SU0_SUM0_SUS0_VWA1_VWB1_WGM1_WGMXCC1_WGMXCCGn1
    SolutionIndex: 123
    SolutionNameMin: Cijk_Ailk_Bjlk_HHS_BH_Bias_AS_SAV_UserArgs_MT32x32x128_MI16x16x1_SN_LDSB1_CLR1_GSU0_GSUC0_GSUWGMRR0_K1_LBSPPA256_LBSPPB256_LPA16_LPB16_MIWT1_1_PLR1_SU0_SUM0_SUS0_VWA1_VWB1_WGM1_WGMXCC1_WGMXCCGn1
    SolutionIndex: 124
    SolutionNameMin: Cijk_Ailk_Bjlk_HHS_BH_Bias_AS_SAV_UserArgs_MT32x32x128_MI16x16x1_SN_LDSB1_CLR1_GSU0_GSUC0_GSUWGMRR0_K1_LBSPPA256_LBSPPB256_LPA16_LPB16_MIWT1_1_PLR1_SU0_SUM0_SUS0_VWA1_VWB1_WGM1_WGMXCC1_WGMXCCGn1
    SolutionIndex: 125
    SolutionNameMin: Cijk_Ailk_Bjlk_HHS_BH_Bias_AS_SAV_UserArgs_MT32x32x128_MI16x16x1_SN_LDSB1_CLR1_GSU0_GSUC0_GSUWGMRR0_K1_LBSPPA256_LBSPPB256_LPA16_LPB16_MIWT1_1_PLR1_SU0_SUM0_SUS0_VWA1_VWB1_WGM1_WGMXCC1_WGMXCCGn1
    SolutionIndex: 126
    SolutionNameMin: Cijk_Ailk_Bjlk_HHS_BH_Bias_AS_SAV_UserArgs_MT32x32x128_MI16x16x1_SN_LDSB1_CLR1_GSU0_GSUC0_GSUWGMRR0_K1_LBSPPA256_LBSPPB256_LPA16_LPB16_MIWT1_1_PLR1_SU0_SUM0_SUS0_VWA1_VWB1_WGM1_WGMXCC1_WGMXCCGn1
    SolutionIndex: 127
    SolutionNameMin: Cijk_Ailk_Bjlk_HHS_BH_Bias_AS_SAV_UserArgs_MT32x32x128_MI16x16x1_SN_LDSB1_CLR1_GSU0_GSUC0_GSUWGMRR0_K1_LBSPPA512_LBSPPB512_LPA16_LPB16_MIWT1_1_PLR1_SU0_SUM0_SUS0_VWA1_VWB1_WGM1_WGMXCC1_WGMXCCGn1
    SolutionIndex: 128
    SolutionNameMin: Cijk_Ailk_Bjlk_HHS_BH_Bias_AS_SAV_UserArgs_MT32x32x128_MI16x16x1_SN_LDSB1_CLR1_GSU0_GSUC0_GSUWGMRR0_K1_LBSPPA512_LBSPPB512_LPA16_LPB16_MIWT1_1_PLR1_SU0_SUM0_SUS0_VWA1_VWB1_WGM1_WGMXCC1_WGMXCCGn1
    SolutionIndex: 129
    SolutionNameMin: Cijk_Ailk_Bjlk_HHS_BH_Bias_AS_SAV_UserArgs_MT32x32x128_MI16x16x1_SN_LDSB1_CLR1_GSU0_GSUC0_GSUWGMRR0_K1_LBSPPA512_LBSPPB512_LPA16_LPB16_MIWT1_1_PLR1_SU0_SUM0_SUS0_VWA1_VWB1_WGM1_WGMXCC1_WGMXCCGn1
    SolutionIndex: 130
    SolutionNameMin: Cijk_Ailk_Bjlk_HHS_BH_Bias_AS_SAV_UserArgs_MT32x32x128_MI16x16x1_SN_LDSB1_CLR1_GSU0_GSUC0_GSUWGMRR0_K1_LBSPPA512_LBSPPB512_LPA16_LPB16_MIWT1_1_PLR1_SU0_SUM0_SUS0_VWA1_VWB1_WGM1_WGMXCC1_WGMXCCGn1
    SolutionIndex: 131
    SolutionNameMin: Cijk_Ailk_Bjlk_HHS_BH_Bias_AS_SAV_UserArgs_MT32x32x128_MI16x16x1_SN_LDSB1_CLR1_GSU0_GSUC0_GSUWGMRR0_K1_LBSPPA512_LBSPPB512_LPA16_LPB16_MIWT1_1_PLR1_SU0_SUM0_SUS0_VWA1_VWB1_WGM1_WGMXCC1_WGMXCCGn1
    SolutionIndex: 132
    SolutionNameMin: Cijk_Ailk_Bjlk_HHS_BH_Bias_AS_SAV_UserArgs_MT32x32x128_MI16x16x1_SN_LDSB1_CLR1_GSU0_GSUC0_GSUWGMRR0_K1_LBSPPA512_LBSPPB512_LPA16_LPB16_MIWT1_1_PLR1_SU0_SUM0_SUS0_VWA1_VWB1_WGM1_WGMXCC1_WGMXCCGn1
    SolutionIndex: 133
    SolutionNameMin: Cijk_Ailk_Bjlk_HHS_BH_Bias_AS_SAV_UserArgs_MT32x32x128_MI16x16x1_SN_LDSB1_CLR1_GSU0_GSUC0_GSUWGMRR0_K1_LBSPPA128_LBSPPB128_LPA16_LPB16_MIWT1_1_PLR1_SU0_SUM0_SUS0_VWA1_VWB1_WGM6_WGMXCC1_WGMXCCGn1
    SolutionIndex: 134
    SolutionNameMin: Cijk_Ailk_Bjlk_HHS_BH_Bias_AS_SAV_UserArgs_MT32x32x128_MI16x16x1_SN_LDSB1_CLR1_GSU0_GSUC0_GSUWGMRR0_K1_LBSPPA128_LBSPPB128_LPA16_LPB16_MIWT1_1_PLR1_SU0_SUM0_SUS0_VWA1_VWB1_WGM6_WGMXCC1_WGMXCCGn1
    SolutionIndex: 135
    SolutionNameMin: Cijk_Ailk_Bjlk_HHS_BH_Bias_AS_SAV_UserArgs_MT32x32x128_MI16x16x1_SN_LDSB1_CLR1_GSU0_GSUC0_GSUWGMRR0_K1_LBSPPA128_LBSPPB128_LPA16_LPB16_MIWT1_1_PLR1_SU0_SUM0_SUS0_VWA1_VWB1_WGM6_WGMXCC1_WGMXCCGn1
    SolutionIndex: 136
    SolutionNameMin: Cijk_Ailk_Bjlk_HHS_BH_Bias_AS_SAV_UserArgs_MT32x32x128_MI16x16x1_SN_LDSB1_CLR1_GSU0_GSUC0_GSUWGMRR0_K1_LBSPPA128_LBSPPB128_LPA16_LPB16_MIWT1_1_PLR1_SU0_SUM0_SUS0_VWA1_VWB1_WGM6_WGMXCC1_WGMXCCGn1
    SolutionIndex: 137
    SolutionNameMin: Cijk_Ailk_Bjlk_HHS_BH_Bias_AS_SAV_UserArgs_MT32x32x128_MI16x16x1_SN_LDSB1_CLR1_GSU0_GSUC0_GSUWGMRR0_K1_LBSPPA256_LBSPPB256_LPA16_LPB16_MIWT1_1_PLR1_SU0_SUM0_SUS0_VWA1_VWB1_WGM6_WGMXCC1_WGMXCCGn1
    SolutionIndex: 138
    SolutionNameMin: Cijk_Ailk_Bjlk_HHS_BH_Bias_AS_SAV_UserArgs_MT32x32x128_MI16x16x1_SN_LDSB1_CLR1_GSU0_GSUC0_GSUWGMRR0_K1_LBSPPA256_LBSPPB256_LPA16_LPB16_MIWT1_1_PLR1_SU0_SUM0_SUS0_VWA1_VWB1_WGM6_WGMXCC1_WGMXCCGn1
    SolutionIndex: 139
    SolutionNameMin: Cijk_Ailk_Bjlk_HHS_BH_Bias_AS_SAV_UserArgs_MT32x32x128_MI16x16x1_SN_LDSB1_CLR1_GSU0_GSUC0_GSUWGMRR0_K1_LBSPPA512_LBSPPB512_LPA16_LPB16_MIWT1_1_PLR1_SU0_SUM0_SUS0_VWA1_VWB1_WGM6_WGMXCC1_WGMXCCGn1
    SolutionIndex: 140
    SolutionNameMin: Cijk_Ailk_Bjlk_HHS_BH_Bias_AS_SAV_UserArgs_MT32x32x128_MI16x16x1_SN_LDSB1_CLR1_GSU0_GSUC0_GSUWGMRR0_K1_LBSPPA128_LBSPPB128_LPA16_LPB16_MIWT1_1_PLR1_SU0_SUM0_SUS0_VWA1_VWB1_WGM8_WGMXCC1_WGMXCCGn1
    SolutionIndex: 141
    SolutionNameMin: Cijk_Ailk_Bjlk_HHS_BH_Bias_AS_SAV_UserArgs_MT32x32x128_MI16x16x1_SN_LDSB1_CLR1_GSU0_GSUC0_GSUWGMRR0_K1_LBSPPA256_LBSPPB256_LPA16_LPB16_MIWT1_1_PLR1_SU0_SUM0_SUS0_VWA1_VWB1_WGM8_WGMXCC1_WGMXCCGn1
    SolutionIndex: 142
    SolutionNameMin: Cijk_Ailk_Bjlk_HHS_BH_Bias_AS_SAV_UserArgs_MT32x32x128_MI16x16x1_SN_LDSB1_CLR1_GSU0_GSUC0_GSUWGMRR0_K1_LBSPPA256_LBSPPB256_LPA16_LPB16_MIWT1_1_PLR1_SU0_SUM0_SUS0_VWA1_VWB1_WGM8_WGMXCC1_WGMXCCGn1
    SolutionIndex: 143
    SolutionNameMin: Cijk_Ailk_Bjlk_HHS_BH_Bias_AS_SAV_UserArgs_MT32x32x128_MI16x16x1_SN_LDSB1_CLR1_GSU0_GSUC0_GSUWGMRR0_K1_LBSPPA512_LBSPPB512_LPA16_LPB16_MIWT1_1_PLR1_SU0_SUM0_SUS0_VWA1_VWB1_WGM8_WGMXCC1_WGMXCCGn1
    SolutionIndex: 144
    SolutionNameMin: Cijk_Ailk_Bjlk_HHS_BH_Bias_AS_SAV_UserArgs_MT64x32x256_MI16x16x1_SN_LDSB1_CLR1_GSU0_GSUC0_GSUWGMRR0_K1_LBSPPA1024_LBSPPB512_LPA32_LPB16_MIWT2_1_PLR1_SU0_SUM0_SUS0_VWA2_VWB1_WGM1_WGMXCC1_WGMXCCGn1
    SolutionIndex: 145
    SolutionNameMin: Cijk_Ailk_Bjlk_HHS_BH_Bias_AS_SAV_UserArgs_MT32x32x256_MI16x16x1_SN_LDSB1_CLR1_GSU0_GSUC0_GSUWGMRR0_K1_LBSPPA128_LBSPPB128_LPA16_LPB16_MIWT1_1_PLR1_SU0_SUM0_SUS0_VWA1_VWB1_WGM1_WGMXCC1_WGMXCCGn1
    SolutionIndex: 146
    SolutionNameMin: Cijk_Ailk_Bjlk_HHS_BH_Bias_AS_SAV_UserArgs_MT32x32x256_MI16x16x1_SN_LDSB1_CLR1_GSU0_GSUC0_GSUWGMRR0_K1_LBSPPA256_LBSPPB256_LPA16_LPB16_MIWT1_1_PLR1_SU0_SUM0_SUS0_VWA1_VWB1_WGM1_WGMXCC1_WGMXCCGn1
    SolutionIndex: 147
    SolutionNameMin: Cijk_Ailk_Bjlk_HHS_BH_Bias_AS_SAV_UserArgs_MT32x32x256_MI16x16x1_SN_LDSB1_CLR1_GSU0_GSUC0_GSUWGMRR0_K1_LBSPPA256_LBSPPB256_LPA16_LPB16_MIWT1_1_PLR1_SU0_SUM0_SUS0_VWA1_VWB1_WGM1_WGMXCC1_WGMXCCGn1
    SolutionIndex: 148
    SolutionNameMin: Cijk_Ailk_Bjlk_HHS_BH_Bias_AS_SAV_UserArgs_MT32x32x256_MI16x16x1_SN_LDSB1_CLR1_GSU0_GSUC0_GSUWGMRR0_K1_LBSPPA512_LBSPPB512_LPA16_LPB16_MIWT1_1_PLR1_SU0_SUM0_SUS0_VWA1_VWB1_WGM1_WGMXCC1_WGMXCCGn1
    SolutionIndex: 149
    SolutionNameMin: Cijk_Ailk_Bjlk_HHS_BH_Bias_AS_SAV_UserArgs_MT32x32x256_MI16x16x1_SN_LDSB1_CLR1_GSU0_GSUC0_GSUWGMRR0_K1_LBSPPA512_LBSPPB512_LPA16_LPB16_MIWT1_1_PLR1_SU0_SUM0_SUS0_VWA1_VWB1_WGM6_WGMXCC1_WGMXCCGn1
    SolutionIndex: 150
    SolutionNameMin: Cijk_Ailk_Bjlk_HHS_BH_Bias_AS_SAV_UserArgs_MT32x32x256_MI16x16x1_SN_LDSB1_CLR1_GSU0_GSUC0_GSUWGMRR0_K1_LBSPPA128_LBSPPB128_LPA16_LPB16_MIWT1_1_PLR1_SU0_SUM0_SUS0_VWA1_VWB1_WGM8_WGMXCC1_WGMXCCGn1
    SolutionIndex: 151
    SolutionNameMin: Cijk_Ailk_Bjlk_HHS_BH_Bias_AS_SAV_UserArgs_MT32x32x256_MI16x16x1_SN_LDSB1_CLR1_GSU0_GSUC0_GSUWGMRR0_K1_LBSPPA256_LBSPPB256_LPA16_LPB16_MIWT1_1_PLR1_SU0_SUM0_SUS0_VWA1_VWB1_WGM8_WGMXCC1_WGMXCCGn1
    SolutionIndex: 152
    SolutionNameMin: Cijk_Ailk_Bjlk_HHS_BH_Bias_AS_SAV_UserArgs_MT32x32x256_MI16x16x1_SN_LDSB1_CLR1_GSU0_GSUC0_GSUWGMRR0_K1_LBSPPA512_LBSPPB512_LPA16_LPB16_MIWT1_1_PLR1_SU0_SUM0_SUS0_VWA1_VWB1_WGM8_WGMXCC1_WGMXCCGn1
    SolutionIndex: 153
    SolutionNameMin: Cijk_Ailk_Bjlk_HHS_BH_Bias_AS_SAV_UserArgs_MT32x32x32_MI16x16x1_SN_LDSB0_CLR0_GSU0_GSUC0_GSUWGMRR0_K1_LBSPPA256_LBSPPB256_LPA16_LPB16_MIWT1_1_PLR0_SU32_SUM0_SUS256_VWA1_VWB1_WGM1_WGMXCC1_WGMXCCGn1
- - - [128, 128, 1, 128, 128, 128, 128, 128]
    - [122, 0.038]
  - - [128, 128, 1, 256, 128, 128, 128, 128]
    - [126, 0.066]
  - - [128, 128, 1, 512, 128, 128, 128, 128]
    - [121, 0.112]
  - - [128, 128, 1, 1024, 128, 128, 128, 128]
    - [145, 0.168]
  - - [128, 128, 1, 2048, 128, 128, 128, 128]
    - [145, 0.227]
  - - [128, 128, 1, 4096, 128, 128, 128, 128]
    - [148, 0.275]
  - - [128, 128, 1, 8192, 128, 128, 128, 128]
    - [149, 0.313]
  - - [128, 256, 1, 128, 128, 128, 128, 256]
    - [126, 0.074]
  - - [128, 256, 1, 256, 128, 128, 128, 256]
    - [121, 0.131]
  - - [128, 256, 1, 512, 128, 128, 128, 256]
    - [119, 0.22]
  - - [128, 256, 1, 1024, 128, 128, 128, 256]
    - [145, 0.332]
  - - [128, 256, 1, 2048, 128, 128, 128, 256]
    - [145, 0.451]
  - - [128, 256, 1, 4096, 128, 128, 128, 256]
    - [151, 0.552]
  - - [128, 256, 1, 8192, 128, 128, 128, 256]
    - [149, 0.627]
  - - [128, 512, 1, 128, 128, 128, 128, 512]
    - [126, 0.147]
  - - [128, 512, 1, 256, 128, 128, 128, 512]
    - [132, 0.256]
  - - [128, 512, 1, 512, 128, 128, 128, 512]
    - [132, 0.43]
  - - [128, 512, 1, 1024, 128, 128, 128, 512]
    - [147, 0.649]
  - - [128, 512, 1, 2048, 128, 128, 128, 512]
    - [149, 0.888]
  - - [128, 512, 1, 4096, 128, 128, 128, 512]
    - [149, 1.09]
  - - [128, 512, 1, 8192, 128, 128, 128, 512]
    - [152, 1.234]
  - - [128, 1024, 1, 128, 128, 128, 128, 1024]
    - [124, 0.291]
  - - [128, 1024, 1, 256, 128, 128, 128, 1024]
    - [121, 0.504]
  - - [128, 1024, 1, 512, 128, 128, 128, 1024]
    - [121, 0.836]
  - - [128, 1024, 1, 1024, 128, 128, 128, 1024]
    - [132, 1.277]
  - - [128, 1024, 1, 2048, 128, 128, 128, 1024]
    - [147, 1.751]
  - - [128, 1024, 1, 4096, 128, 128, 128, 1024]
    - [147, 2.134]
  - - [128, 1024, 1, 8192, 128, 128, 128, 1024]
    - [150, 2.454]
  - - [128, 2048, 1, 128, 128, 128, 128, 2048]
    - [120, 0.558]
  - - [128, 2048, 1, 256, 128, 128, 128, 2048]
    - [118, 0.972]
  - - [128, 2048, 1, 512, 128, 128, 128, 2048]
    - [120, 1.633]
  - - [128, 2048, 1, 1024, 128, 128, 128, 2048]
    - [145, 2.45]
  - - [128, 2048, 1, 2048, 128, 128, 128, 2048]
    - [147, 3.355]
  - - [128, 2048, 1, 4096, 128, 128, 128, 2048]
    - [147, 4.177]
  - - [128, 2048, 1, 8192, 128, 128, 128, 2048]
    - [148, 4.554]
  - - [128, 4096, 1, 128, 128, 128, 128, 4096]
    - [103, 1.057]
  - - [128, 4096, 1, 256, 128, 128, 128, 4096]
    - [104, 1.82]
  - - [128, 4096, 1, 512, 128, 128, 128, 4096]
    - [102, 3.006]
  - - [128, 4096, 1, 1024, 128, 128, 128, 4096]
    - [105, 4.481]
  - - [128, 4096, 1, 2048, 128, 128, 128, 4096]
    - [108, 6.015]
  - - [128, 4096, 1, 4096, 128, 128, 128, 4096]
    - [144, 7.161]
  - - [128, 4096, 1, 8192, 128, 128, 128, 4096]
    - [114, 7.766]
  - - [128, 8192, 1, 128, 128, 128, 128, 8192]
    - [66, 1.912]
  - - [128, 8192, 1, 256, 128, 128, 128, 8192]
    - [87, 3.291]
  - - [128, 8192, 1, 512, 128, 128, 128, 8192]
    - [86, 5.381]
  - - [128, 8192, 1, 1024, 128, 128, 128, 8192]
    - [85, 7.925]
  - - [128, 8192, 1, 2048, 128, 128, 128, 8192]
    - [86, 9.917]
  - - [128, 8192, 1, 4096, 128, 128, 128, 8192]
    - [86, 12.2]
  - - [128, 8192, 1, 8192, 128, 128, 128, 8192]
    - [85, 12.93]
  - - [256, 128, 1, 128, 256, 256, 256, 128]
    - [123, 0.075]
  - - [256, 128, 1, 256, 256, 256, 256, 128]
    - [123, 0.131]
  - - [256, 128, 1, 512, 256, 256, 256, 128]
    - [126, 0.22]
  - - [256, 128, 1, 1024, 256, 256, 256, 128]
    - [125, 0.33]
  - - [256, 128, 1, 2048, 256, 256, 256, 128]
    - [121, 0.445]
  - - [256, 128, 1, 4096, 256, 256, 256, 128]
    - [121, 0.538]
  - - [256, 128, 1, 8192, 256, 256, 256, 128]
    - [130, 0.605]
  - - [256, 256, 1, 128, 256, 256, 256, 256]
    - [131, 0.148]
  - - [256, 256, 1, 256, 256, 256, 256, 256]
    - [126, 0.26]
  - - [256, 256, 1, 512, 256, 256, 256, 256]
    - [132, 0.436]
  - - [256, 256, 1, 1024, 256, 256, 256, 256]
    - [121, 0.66]
  - - [256, 256, 1, 2048, 256, 256, 256, 256]
    - [126, 0.885]
  - - [256, 256, 1, 4096, 256, 256, 256, 256]
    - [121, 1.068]
  - - [256, 256, 1, 8192, 256, 256, 256, 256]
    - [139, 1.195]
  - - [256, 512, 1, 128, 256, 256, 256, 512]
    - [123, 0.291]
  - - [256, 512, 1, 256, 256, 256, 256, 512]
    - [146, 0.507]
  - - [256, 512, 1, 512, 256, 256, 256, 512]
    - [132, 0.853]
  - - [256, 512, 1, 1024, 256, 256, 256, 512]
    - [132, 1.288]
  - - [256, 512, 1, 2048, 256, 256, 256, 512]
    - [139, 1.731]
  - - [256, 512, 1, 4096, 256, 256, 256, 512]
    - [143, 2.092]
  - - [256, 512, 1, 8192, 256, 256, 256, 512]
    - [142, 2.363]
  - - [256, 1024, 1, 128, 256, 256, 256, 1024]
    - [129, 0.563]
  - - [256, 1024, 1, 256, 256, 256, 256, 1024]
    - [146, 0.99]
  - - [256, 1024, 1, 512, 256, 256, 256, 1024]
    - [126, 1.637]
  - - [256, 1024, 1, 1024, 256, 256, 256, 1024]
    - [121, 2.489]
  - - [256, 1024, 1, 2048, 256, 256, 256, 1024]
    - [142, 3.325]
  - - [256, 1024, 1, 4096, 256, 256, 256, 1024]
    - [140, 4.045]
  - - [256, 1024, 1, 8192, 256, 256, 256, 1024]
    - [143, 4.564]
  - - [256, 2048, 1, 128, 256, 256, 256, 2048]
    - [106, 1.069]
  - - [256, 2048, 1, 256, 256, 256, 256, 2048]
    - [102, 1.85]
  - - [256, 2048, 1, 512, 256, 256, 256, 2048]
    - [108, 3.039]
  - - [256, 2048, 1, 1024, 256, 256, 256, 2048]
    - [102, 4.517]
  - - [256, 2048, 1, 2048, 256, 256, 256, 2048]
    - [102, 5.992]
  - - [256, 2048, 1, 4096, 256, 256, 256, 2048]
    - [105, 7.257]
  - - [256, 2048, 1, 8192, 256, 256, 256, 2048]
    - [96, 7.844]
  - - [256, 4096, 1, 128, 256, 256, 256, 4096]
    - [85, 1.955]
  - - [256, 4096, 1, 256, 256, 256, 256, 4096]
    - [87, 3.374]
  - - [256, 4096, 1, 512, 256, 256, 256, 4096]
    - [87, 5.552]
  - - [256, 4096, 1, 1024, 256, 256, 256, 4096]
    - [86, 8.267]
  - - [256, 4096, 1, 2048, 256, 256, 256, 4096]
    - [86, 10.911]
  - - [256, 4096, 1, 4096, 256, 256, 256, 4096]
    - [93, 12.688]
  - - [256, 4096, 1, 8192, 256, 256, 256, 4096]
    - [86, 13.231]
  - - [256, 8192, 1, 128, 256, 256, 256, 8192]
    - [59, 3.283]
  - - [256, 8192, 1, 256, 256, 256, 256, 8192]
    - [59, 5.634]
  - - [256, 8192, 1, 512, 256, 256, 256, 8192]
    - [52, 8.737]
  - - [256, 8192, 1, 1024, 256, 256, 256, 8192]
    - [52, 12.053]
  - - [256, 8192, 1, 2048, 256, 256, 256, 8192]
    - [53, 14.638]
  - - [256, 8192, 1, 4096, 256, 256, 256, 8192]
    - [60, 16.766]
  - - [256, 8192, 1, 8192, 256, 256, 256, 8192]
    - [84, 16.153]
  - - [512, 128, 1, 128, 512, 512, 512, 128]
    - [127, 0.15]
  - - [512, 128, 1, 256, 512, 512, 512, 128]
    - [123, 0.26]
  - - [512, 128, 1, 512, 512, 512, 512, 128]
    - [127, 0.435]
  - - [512, 128, 1, 1024, 512, 512, 512, 128]
    - [127, 0.652]
  - - [512, 128, 1, 2048, 512, 512, 512, 128]
    - [130, 0.877]
  - - [512, 128, 1, 4096, 512, 512, 512, 128]
    - [132, 1.06]
  - - [512, 128, 1, 8192, 512, 512, 512, 128]
    - [121, 1.19]
  - - [512, 256, 1, 128, 512, 512, 512, 256]
    - [115, 0.292]
  - - [512, 256, 1, 256, 512, 512, 512, 256]
    - [117, 0.51]
  - - [512, 256, 1, 512, 512, 512, 512, 256]
    - [123, 0.843]
  - - [512, 256, 1, 1024, 512, 512, 512, 256]
    - [138, 1.276]
  - - [512, 256, 1, 2048, 512, 512, 512, 256]
    - [139, 1.735]
  - - [512, 256, 1, 4096, 512, 512, 512, 256]
    - [136, 2.094]
  - - [512, 256, 1, 8192, 512, 512, 512, 256]
    - [138, 2.366]
  - - [512, 512, 1, 128, 512, 512, 512, 512]
    - [128, 0.573]
  - - [512, 512, 1, 256, 512, 512, 512, 512]
    - [131, 0.989]
  - - [512, 512, 1, 512, 512, 512, 512, 512]
    - [120, 1.648]
  - - [512, 512, 1, 1024, 512, 512, 512, 512]
    - [143, 2.501]
  - - [512, 512, 1, 2048, 512, 512, 512, 512]
    - [136, 3.359]
  - - [512, 512, 1, 4096, 512, 512, 512, 512]
    - [140, 4.069]
  - - [512, 512, 1, 8192, 512, 512, 512, 512]
    - [142, 4.523]
  - - [512, 1024, 1, 128, 512, 512, 512, 1024]
    - [100, 1.078]
  - - [512, 1024, 1, 256, 512, 512, 512, 1024]
    - [105, 1.87]
  - - [512, 1024, 1, 512, 512, 512, 512, 1024]
    - [107, 3.075]
  - - [512, 1024, 1, 1024, 512, 512, 512, 1024]
    - [102, 4.571]
  - - [512, 1024, 1, 2048, 512, 512, 512, 1024]
    - [102, 6.043]
  - - [512, 1024, 1, 4096, 512, 512, 512, 1024]
    - [112, 7.272]
  - - [512, 1024, 1, 8192, 512, 512, 512, 1024]
    - [108, 7.958]
  - - [512, 2048, 1, 128, 512, 512, 512, 2048]
    - [85, 1.958]
  - - [512, 2048, 1, 256, 512, 512, 512, 2048]
    - [86, 3.392]
  - - [512, 2048, 1, 512, 512, 512, 512, 2048]
    - [85, 5.593]
  - - [512, 2048, 1, 1024, 512, 512, 512, 2048]
    - [86, 8.235]
  - - [512, 2048, 1, 2048, 512, 512, 512, 2048]
    - [93, 10.843]
  - - [512, 2048, 1, 4096, 512, 512, 512, 2048]
    - [85, 12.904]
  - - [512, 2048, 1, 8192, 512, 512, 512, 2048]
    - [86, 13.317]
  - - [512, 4096, 1, 128, 512, 512, 512, 4096]
    - [56, 3.272]
  - - [512, 4096, 1, 256, 512, 512, 512, 4096]
    - [60, 5.653]
  - - [512, 4096, 1, 512, 512, 512, 512, 4096]
    - [57, 8.921]
  - - [512, 4096, 1, 1024, 512, 512, 512, 4096]
    - [57, 12.492]
  - - [512, 4096, 1, 2048, 512, 512, 512, 4096]
    - [60, 15.464]
  - - [512, 4096, 1, 4096, 512, 512, 512, 4096]
    - [62, 17.012]
  - - [512, 4096, 1, 8192, 512, 512, 512, 4096]
    - [63, 16.417]
  - - [512, 8192, 1, 128, 512, 512, 512, 8192]
    - [45, 5.225]
  - - [512, 8192, 1, 256, 512, 512, 512, 8192]
    - [27, 8.384]
  - - [512, 8192, 1, 512, 512, 512, 512, 8192]
    - [75, 12.292]
  - - [512, 8192, 1, 1024, 512, 512, 512, 8192]
    - [81, 16.147]
  - - [512, 8192, 1, 2048, 512, 512, 512, 8192]
    - [76, 21.036]
  - - [512, 8192, 1, 4096, 512, 512, 512, 8192]
    - [50, 24.204]
  - - [512, 8192, 1, 8192, 512, 512, 512, 8192]
    - [51, 21.859]
  - - [1024, 128, 1, 128, 1024, 1024, 1024, 128]
    - [117, 0.295]
  - - [1024, 128, 1, 256, 1024, 1024, 1024, 128]
    - [115, 0.518]
  - - [1024, 128, 1, 512, 1024, 1024, 1024, 128]
    - [122, 0.85]
  - - [1024, 128, 1, 1024, 1024, 1024, 1024, 128]
    - [115, 1.281]
  - - [1024, 128, 1, 2048, 1024, 1024, 1024, 128]
    - [122, 1.717]
  - - [1024, 128, 1, 4096, 1024, 1024, 1024, 128]
    - [121, 2.072]
  - - [1024, 128, 1, 8192, 1024, 1024, 1024, 128]
    - [125, 2.356]
  - - [1024, 256, 1, 128, 1024, 1024, 1024, 256]
    - [128, 0.57]
  - - [1024, 256, 1, 256, 1024, 1024, 1024, 256]
    - [134, 0.979]
  - - [1024, 256, 1, 512, 1024, 1024, 1024, 256]
    - [135, 1.63]
  - - [1024, 256, 1, 1024, 1024, 1024, 1024, 256]
    - [136, 2.479]
  - - [1024, 256, 1, 2048, 1024, 1024, 1024, 256]
    - [136, 3.351]
  - - [1024, 256, 1, 4096, 1024, 1024, 1024, 256]
    - [136, 4.043]
  - - [1024, 256, 1, 8192, 1024, 1024, 1024, 256]
    - [136, 4.496]
  - - [1024, 512, 1, 128, 1024, 1024, 1024, 512]
    - [106, 1.067]
  - - [1024, 512, 1, 256, 1024, 1024, 1024, 512]
    - [101, 1.857]
  - - [1024, 512, 1, 512, 1024, 1024, 1024, 512]
    - [110, 3.076]
  - - [1024, 512, 1, 1024, 1024, 1024, 1024, 512]
    - [113, 4.573]
  - - [1024, 512, 1, 2048, 1024, 1024, 1024, 512]
    - [109, 6.064]
  - - [1024, 512, 1, 4096, 1024, 1024, 1024, 512]
    - [114, 7.285]
  - - [1024, 512, 1, 8192, 1024, 1024, 1024, 512]
    - [113, 7.892]
  - - [1024, 1024, 1, 128, 1024, 1024, 1024, 1024]
    - [85, 1.952]
  - - [1024, 1024, 1, 256, 1024, 1024, 1024, 1024]
    - [85, 3.375]
  - - [1024, 1024, 1, 512, 1024, 1024, 1024, 1024]
    - [86, 5.599]
  - - [1024, 1024, 1, 1024, 1024, 1024, 1024, 1024]
    - [87, 8.259]
  - - [1024, 1024, 1, 2048, 1024, 1024, 1024, 1024]
    - [85, 10.851]
  - - [1024, 1024, 1, 4096, 1024, 1024, 1024, 1024]
    - [87, 12.864]
  - - [1024, 1024, 1, 8192, 1024, 1024, 1024, 1024]
    - [93, 13.37]
  - - [1024, 2048, 1, 128, 1024, 1024, 1024, 2048]
    - [59, 3.25]
  - - [1024, 2048, 1, 256, 1024, 1024, 1024, 2048]
    - [57, 5.609]
  - - [1024, 2048, 1, 512, 1024, 1024, 1024, 2048]
    - [58, 8.768]
  - - [1024, 2048, 1, 1024, 1024, 1024, 1024, 2048]
    - [64, 12.336]
  - - [1024, 2048, 1, 2048, 1024, 1024, 1024, 2048]
    - [57, 15.501]
  - - [1024, 2048, 1, 4096, 1024, 1024, 1024, 2048]
    - [65, 17.063]
  - - [1024, 2048, 1, 8192, 1024, 1024, 1024, 2048]
    - [58, 16.209]
  - - [1024, 4096, 1, 128, 1024, 1024, 1024, 4096]
    - [45, 5.216]
  - - [1024, 4096, 1, 256, 1024, 1024, 1024, 4096]
    - [27, 8.43]
  - - [1024, 4096, 1, 512, 1024, 1024, 1024, 4096]
    - [74, 12.583]
  - - [1024, 4096, 1, 1024, 1024, 1024, 1024, 4096]
    - [74, 16.995]
  - - [1024, 4096, 1, 2048, 1024, 1024, 1024, 4096]
    - [47, 21.641]
  - - [1024, 4096, 1, 4096, 1024, 1024, 1024, 4096]
    - [45, 24.464]
  - - [1024, 4096, 1, 8192, 1024, 1024, 1024, 4096]
    - [45, 21.802]
  - - [1024, 8192, 1, 128, 1024, 1024, 1024, 8192]
    - [14, 6.622]
  - - [1024, 8192, 1, 256, 1024, 1024, 1024, 8192]
    - [17, 11.163]
  - - [1024, 8192, 1, 512, 1024, 1024, 1024, 8192]
    - [12, 16.333]
  - - [1024, 8192, 1, 1024, 1024, 1024, 1024, 8192]
    - [16, 22.862]
  - - [1024, 8192, 1, 2048, 1024, 1024, 1024, 8192]
    - [41, 28.379]
  - - [1024, 8192, 1, 4096, 1024, 1024, 1024, 8192]
    - [38, 29.343]
  - - [1024, 8192, 1, 8192, 1024, 1024, 1024, 8192]
    - [42, 28.932]
  - - [2048, 128, 1, 128, 2048, 2048, 2048, 128]
    - [116, 0.566]
  - - [2048, 128, 1, 256, 2048, 2048, 2048, 128]
    - [122, 0.961]
  - - [2048, 128, 1, 512, 2048, 2048, 2048, 128]
    - [141, 1.608]
  - - [2048, 128, 1, 1024, 2048, 2048, 2048, 128]
    - [137, 2.411]
  - - [2048, 128, 1, 2048, 2048, 2048, 2048, 128]
    - [135, 3.238]
  - - [2048, 128, 1, 4096, 2048, 2048, 2048, 128]
    - [136, 3.986]
  - - [2048, 128, 1, 8192, 2048, 2048, 2048, 128]
    - [133, 4.245]
  - - [2048, 256, 1, 128, 2048, 2048, 2048, 256]
    - [95, 1.054]
  - - [2048, 256, 1, 256, 2048, 2048, 2048, 256]
    - [111, 1.82]
  - - [2048, 256, 1, 512, 2048, 2048, 2048, 256]
    - [99, 3.027]
  - - [2048, 256, 1, 1024, 2048, 2048, 2048, 256]
    - [114, 4.525]
  - - [2048, 256, 1, 2048, 2048, 2048, 2048, 256]
    - [114, 5.979]
  - - [2048, 256, 1, 4096, 2048, 2048, 2048, 256]
    - [112, 7.218]
  - - [2048, 256, 1, 8192, 2048, 2048, 2048, 256]
    - [114, 7.697]
  - - [2048, 512, 1, 128, 2048, 2048, 2048, 512]
    - [94, 1.917]
  - - [2048, 512, 1, 256, 2048, 2048, 2048, 512]
    - [88, 3.333]
  - - [2048, 512, 1, 512, 2048, 2048, 2048, 512]
    - [88, 5.507]
  - - [2048, 512, 1, 1024, 2048, 2048, 2048, 512]
    - [94, 8.164]
  - - [2048, 512, 1, 2048, 2048, 2048, 2048, 512]
    - [91, 10.803]
  - - [2048, 512, 1, 4096, 2048, 2048, 2048, 512]
    - [90, 12.796]
  - - [2048, 512, 1, 8192, 2048, 2048, 2048, 512]
    - [94, 13.268]
  - - [2048, 1024, 1, 128, 2048, 2048, 2048, 1024]
    - [60, 3.253]
  - - [2048, 1024, 1, 256, 2048, 2048, 2048, 1024]
    - [60, 5.563]
  - - [2048, 1024, 1, 512, 2048, 2048, 2048, 1024]
    - [62, 8.724]
  - - [2048, 1024, 1, 1024, 2048, 2048, 2048, 1024]
    - [65, 12.234]
  - - [2048, 1024, 1, 2048, 2048, 2048, 2048, 1024]
    - [62, 15.465]
  - - [2048, 1024, 1, 4096, 2048, 2048, 2048, 1024]
    - [61, 16.915]
  - - [2048, 1024, 1, 8192, 2048, 2048, 2048, 1024]
    - [63, 16.249]
  - - [2048, 2048, 1, 128, 2048, 2048, 2048, 2048]
    - [44, 5.139]
  - - [2048, 2048, 1, 256, 2048, 2048, 2048, 2048]
    - [27, 8.335]
  - - [2048, 2048, 1, 512, 2048, 2048, 2048, 2048]
    - [82, 12.481]
  - - [2048, 2048, 1, 1024, 2048, 2048, 2048, 2048]
    - [80, 17.313]
  - - [2048, 2048, 1, 2048, 2048, 2048, 2048, 2048]
    - [46, 21.752]
  - - [2048, 2048, 1, 4096, 2048, 2048, 2048, 2048]
    - [50, 24.312]
  - - [2048, 2048, 1, 8192, 2048, 2048, 2048, 2048]
    - [50, 22.385]
  - - [2048, 4096, 1, 128, 2048, 2048, 2048, 4096]
    - [18, 6.594]
  - - [2048, 4096, 1, 256, 2048, 2048, 2048, 4096]
    - [17, 10.762]
  - - [2048, 4096, 1, 512, 2048, 2048, 2048, 4096]
    - [14, 16.212]
  - - [2048, 4096, 1, 1024, 2048, 2048, 2048, 4096]
    - [13, 22.475]
  - - [2048, 4096, 1, 2048, 2048, 2048, 2048, 4096]
    - [36, 27.581]
  - - [2048, 4096, 1, 4096, 2048, 2048, 2048, 4096]
    - [38, 30.851]
  - - [2048, 4096, 1, 8192, 2048, 2048, 2048, 4096]
    - [43, 29.239]
  - - [2048, 8192, 1, 128, 2048, 2048, 2048, 8192]
    - [35, 7.676]
  - - [2048, 8192, 1, 256, 2048, 2048, 2048, 8192]
    - [15, 12.037]
  - - [2048, 8192, 1, 512, 2048, 2048, 2048, 8192]
    - [6, 19.691]
  - - [2048, 8192, 1, 1024, 2048, 2048, 2048, 8192]
    - [1, 28.807]
  - - [2048, 8192, 1, 2048, 2048, 2048, 2048, 8192]
    - [30, 33.942]
  - - [2048, 8192, 1, 4096, 2048, 2048, 2048, 8192]
    - [69, 33.676]
  - - [2048, 8192, 1, 8192, 2048, 2048, 2048, 8192]
    - [71, 34.532]
  - - [4096, 128, 1, 128, 4096, 4096, 4096, 128]
    - [97, 1.055]
  - - [4096, 128, 1, 256, 4096, 4096, 4096, 128]
    - [98, 1.82]
  - - [4096, 128, 1, 512, 4096, 4096, 4096, 128]
    - [98, 3.008]
  - - [4096, 128, 1, 1024, 4096, 4096, 4096, 128]
    - [114, 4.47]
  - - [4096, 128, 1, 2048, 4096, 4096, 4096, 128]
    - [110, 6.014]
  - - [4096, 128, 1, 4096, 4096, 4096, 4096, 128]
    - [114, 7.111]
  - - [4096, 128, 1, 8192, 4096, 4096, 4096, 128]
    - [114, 7.739]
  - - [4096, 256, 1, 128, 4096, 4096, 4096, 256]
    - [89, 1.914]
  - - [4096, 256, 1, 256, 4096, 4096, 4096, 256]
    - [90, 3.33]
  - - [4096, 256, 1, 512, 4096, 4096, 4096, 256]
    - [88, 5.479]
  - - [4096, 256, 1, 1024, 4096, 4096, 4096, 256]
    - [91, 8.179]
  - - [4096, 256, 1, 2048, 4096, 4096, 4096, 256]
    - [94, 10.808]
  - - [4096, 256, 1, 4096, 4096, 4096, 4096, 256]
    - [90, 12.715]
  - - [4096, 256, 1, 8192, 4096, 4096, 4096, 256]
    - [91, 13.139]
  - - [4096, 512, 1, 128, 4096, 4096, 4096, 512]
    - [55, 3.221]
  - - [4096, 512, 1, 256, 4096, 4096, 4096, 512]
    - [63, 5.567]
  - - [4096, 512, 1, 512, 4096, 4096, 4096, 512]
    - [65, 8.685]
  - - [4096, 512, 1, 1024, 4096, 4096, 4096, 512]
    - [64, 12.32]
  - - [4096, 512, 1, 2048, 4096, 4096, 4096, 512]
    - [61, 15.365]
  - - [4096, 512, 1, 4096, 4096, 4096, 4096, 512]
    - [63, 16.617]
  - - [4096, 512, 1, 8192, 4096, 4096, 4096, 512]
    - [63, 16.34]
  - - [4096, 1024, 1, 128, 4096, 4096, 4096, 1024]
    - [48, 5.155]
  - - [4096, 1024, 1, 256, 4096, 4096, 4096, 1024]
    - [28, 8.341]
  - - [4096, 1024, 1, 512, 4096, 4096, 4096, 1024]
    - [77, 12.396]
  - - [4096, 1024, 1, 1024, 4096, 4096, 4096, 1024]
    - [78, 16.995]
  - - [4096, 1024, 1, 2048, 4096, 4096, 4096, 1024]
    - [51, 21.417]
  - - [4096, 1024, 1, 4096, 4096, 4096, 4096, 1024]
    - [48, 23.902]
  - - [4096, 1024, 1, 8192, 4096, 4096, 4096, 1024]
    - [51, 21.938]
  - - [4096, 2048, 1, 128, 4096, 4096, 4096, 2048]
    - [20, 6.571]
  - - [4096, 2048, 1, 256, 4096, 4096, 4096, 2048]
    - [23, 10.789]
  - - [4096, 2048, 1, 512, 4096, 4096, 4096, 2048]
    - [22, 15.84]
  - - [4096, 2048, 1, 1024, 4096, 4096, 4096, 2048]
    - [40, 22.412]
  - - [4096, 2048, 1, 2048, 4096, 4096, 4096, 2048]
    - [39, 28.194]
  - - [4096, 2048, 1, 4096, 4096, 4096, 4096, 2048]
    - [41, 30.079]
  - - [4096, 2048, 1, 8192, 4096, 4096, 4096, 2048]
    - [42, 29.382]
  - - [4096, 4096, 1, 128, 4096, 4096, 4096, 4096]
    - [35, 7.578]
  - - [4096, 4096, 1, 256, 4096, 4096, 4096, 4096]
    - [24, 11.982]
  - - [4096, 4096, 1, 512, 4096, 4096, 4096, 4096]
    - [10, 19.997]
  - - [4096, 4096, 1, 1024, 4096, 4096, 4096, 4096]
    - [0, 28.486]
  - - [4096, 4096, 1, 2048, 4096, 4096, 4096, 4096]
    - [31, 34.663]
  - - [4096, 8192, 1, 128, 4096, 4096, 4096, 8192]
    - [2, 8.702]
  - - [4096, 8192, 1, 256, 4096, 4096, 4096, 8192]
    - [6, 14.764]
  - - [4096, 8192, 1, 512, 4096, 4096, 4096, 8192]
    - [6, 22.938]
  - - [4096, 8192, 1, 1024, 4096, 4096, 4096, 8192]
    - [31, 29.379]
  - - [4096, 8192, 1, 2048, 4096, 4096, 4096, 8192]
    - [73, 32.38]
  - - [8192, 128, 1, 128, 8192, 8192, 8192, 128]
    - [67, 1.872]
  - - [8192, 128, 1, 256, 8192, 8192, 8192, 128]
    - [68, 3.223]
  - - [8192, 128, 1, 512, 8192, 8192, 8192, 128]
    - [91, 5.285]
  - - [8192, 128, 1, 1024, 8192, 8192, 8192, 128]
    - [92, 7.732]
  - - [8192, 128, 1, 2048, 8192, 8192, 8192, 128]
    - [88, 10.046]
  - - [8192, 128, 1, 4096, 8192, 8192, 8192, 128]
    - [91, 12.245]
  - - [8192, 128, 1, 8192, 8192, 8192, 8192, 128]
    - [91, 12.743]
  - - [8192, 256, 1, 128, 8192, 8192, 8192, 256]
    - [54, 3.208]
  - - [8192, 256, 1, 256, 8192, 8192, 8192, 256]
    - [62, 5.569]
  - - [8192, 256, 1, 512, 8192, 8192, 8192, 256]
    - [54, 8.607]
  - - [8192, 256, 1, 1024, 8192, 8192, 8192, 256]
    - [61, 11.953]
  - - [8192, 256, 1, 2048, 8192, 8192, 8192, 256]
    - [61, 14.61]
  - - [8192, 256, 1, 4096, 8192, 8192, 8192, 256]
    - [64, 16.785]
  - - [8192, 256, 1, 8192, 8192, 8192, 8192, 256]
    - [62, 15.746]
  - - [8192, 512, 1, 128, 8192, 8192, 8192, 512]
    - [48, 5.163]
  - - [8192, 512, 1, 256, 8192, 8192, 8192, 512]
    - [29, 8.272]
  - - [8192, 512, 1, 512, 8192, 8192, 8192, 512]
    - [79, 12.133]
  - - [8192, 512, 1, 1024, 8192, 8192, 8192, 512]
    - [82, 16.267]
  - - [8192, 512, 1, 2048, 8192, 8192, 8192, 512]
    - [83, 20.633]
  - - [8192, 512, 1, 4096, 8192, 8192, 8192, 512]
    - [48, 24.028]
  - - [8192, 512, 1, 8192, 8192, 8192, 8192, 512]
    - [49, 21.477]
  - - [8192, 1024, 1, 128, 8192, 8192, 8192, 1024]
    - [19, 6.481]
  - - [8192, 1024, 1, 256, 8192, 8192, 8192, 1024]
    - [25, 10.752]
  - - [8192, 1024, 1, 512, 8192, 8192, 8192, 1024]
    - [13, 15.986]
  - - [8192, 1024, 1, 1024, 8192, 8192, 8192, 1024]
    - [26, 22.838]
  - - [8192, 1024, 1, 2048, 8192, 8192, 8192, 1024]
    - [43, 27.895]
  - - [8192, 1024, 1, 4096, 8192, 8192, 8192, 1024]
    - [38, 29.319]
  - - [8192, 1024, 1, 8192, 8192, 8192, 8192, 1024]
    - [42, 28.543]
  - - [8192, 2048, 1, 128, 8192, 8192, 8192, 2048]
    - [37, 7.495]
  - - [8192, 2048, 1, 256, 8192, 8192, 8192, 2048]
    - [21, 12.072]
  - - [8192, 2048, 1, 512, 8192, 8192, 8192, 2048]
    - [9, 19.647]
  - - [8192, 2048, 1, 1024, 8192, 8192, 8192, 2048]
    - [11, 27.793]
  - - [8192, 2048, 1, 2048, 8192, 8192, 8192, 2048]
    - [32, 35.079]
  - - [8192, 2048, 1, 4096, 8192, 8192, 8192, 2048]
    - [73, 33.776]
  - - [8192, 2048, 1, 8192, 8192, 8192, 8192, 2048]
    - [72, 34.699]
  - - [8192, 4096, 1, 128, 8192, 8192, 8192, 4096]
    - [4, 8.844]
  - - [8192, 4096, 1, 256, 8192, 8192, 8192, 4096]
    - [7, 14.959]
  - - [8192, 4096, 1, 512, 8192, 8192, 8192, 4096]
    - [3, 22.649]
  - - [8192, 4096, 1, 1024, 8192, 8192, 8192, 4096]
    - [34, 29.242]
  - - [8192, 4096, 1, 2048, 8192, 8192, 8192, 4096]
    - [31, 32.17]
  - - [8192, 8192, 1, 128, 8192, 8192, 8192, 8192]
    - [5, 9.941]
  - - [8192, 8192, 1, 256, 8192, 8192, 8192, 8192]
    - [8, 16.046]
  - - [8192, 8192, 1, 512, 8192, 8192, 8192, 8192]
    - [33, 22.89]
  - - [8192, 8192, 1, 1024, 8192, 8192, 8192, 8192]
    - [73, 27.713]
  - - [8192, 8192, 1, 2048, 8192, 8192, 8192, 8192]
    - [33, 31.563]
  - - [4096, 4096, 1, 4096, 4096, 4096, 4096, 4096]
    - [72, 34.791]
  - - [4096, 4096, 1, 8192, 4096, 4096, 4096, 4096]
    - [72, 35.065]
  - - [4096, 8192, 1, 4096, 4096, 4096, 4096, 8192]
    - [72, 34.042]
  - - [4096, 8192, 1, 8192, 4096, 4096, 4096, 8192]
    - [70, 37.763]
  - - [8192, 4096, 1, 4096, 8192, 8192, 8192, 4096]
    - [70, 34.204]
  - - [8192, 4096, 1, 8192, 8192, 8192, 8192, 4096]
    - [72, 37.713]
  - - [8192, 8192, 1, 4096, 8192, 8192, 8192, 8192]
    - [70, 36.431]
  - - [8192, 8192, 1, 8192, 8192, 8192, 8192, 8192]
    - [72, 40.419]
  - - [1, 1, 1, 32, 1, 1, 1, 1]
    - [153, 0.0]
- null
- null
- DeviceEfficiency
- GridBased
