projects/hipblaslt/library/src/amd_detail/rocblaslt/src/Tensile/Logic/asm_full/gfx950/GridBased/gfx950_Cijk_Ailk_Bjlk_B8F8HS_BH_Bias_HAS_SAB_SAV_UserArgs.yaml
- {MinimumRequiredVersion: 4.33.0}
- gfx950
- gfx950
- [Device 75a0]
    SolutionIndex: 0
    SolutionNameMin: Cijk_Ailk_Bjlk_F8HS_BH_Bias_HAS_SAB_SAV_UserArgs_MT256x256x64_MI32x32x1_SN_GSU0_GSUC0_GSUWGMRR0_K1_LBSPPA0_LBSPPB0_LPA0_LPB0_MIWT4_4_SU0_SUM0_SUS64_VWA4_VWB4_WGM8_WGMXCC1_WGMXCCGn1
    SolutionIndex: 1
    SolutionNameMin: Cijk_Ailk_Bjlk_F8HS_BH_Bias_HAS_SAB_SAV_UserArgs_MT256x256x64_MI32x32x1_SN_GSU0_GSUC0_GSUWGMRR0_K1_LBSPPA0_LBSPPB0_LPA0_LPB0_MIWT4_4_SU0_SUM0_SUS64_VWA4_VWB4_WGM8_WGMXCC1_WGMXCCGn1
    SolutionIndex: 2
    SolutionNameMin: Cijk_Ailk_Bjlk_F8HS_BH_Bias_HAS_SAB_SAV_UserArgs_MT256x256x64_MI32x32x1_SN_GSU0_GSUC0_GSUWGMRR0_K1_LBSPPA0_LBSPPB0_LPA0_LPB0_MIWT4_4_SU0_SUM0_SUS64_VWA4_VWB4_WGM8_WGMXCC1_WGMXCCGn1
    SolutionIndex: 3
    SolutionNameMin: Cijk_Ailk_Bjlk_F8HS_BH_Bias_HAS_SAB_SAV_UserArgs_MT256x256x64_MI32x32x1_SN_GSU0_GSUC0_GSUWGMRR0_K1_LBSPPA0_LBSPPB0_LPA0_LPB0_MIWT4_4_SU0_SUM0_SUS64_VWA4_VWB4_WGM8_WGMXCC1_WGMXCCGn1
    SolutionIndex: 4
    SolutionNameMin: Cijk_Ailk_Bjlk_F8HS_BH_Bias_HAS_SAB_SAV_UserArgs_MT256x256x64_MI32x32x1_SN_GSU0_GSUC0_GSUWGMRR0_K1_LBSPPA0_LBSPPB0_LPA0_LPB0_MIWT4_4_SU0_SUM0_SUS64_VWA4_VWB4_WGM8_WGMXCC1_WGMXCCGn1
    SolutionIndex: 5
    SolutionNameMin: Cijk_Ailk_Bjlk_F8HS_BH_Bias_HAS_SAB_SAV_UserArgs_MT256x256x64_MI32x32x1_SN_GSU0_GSUC0_GSUWGMRR0_K1_LBSPPA0_LBSPPB0_LPA0_LPB0_MIWT4_4_SU0_SUM0_SUS64_VWA4_VWB4_WGM8_WGMXCC1_WGMXCCGn1
    SolutionIndex: 6
    SolutionNameMin: Cijk_Ailk_Bjlk_F8HS_BH_Bias_HAS_SAB_SAV_UserArgs_MT256x256x64_MI32x32x1_SN_GSU0_GSUC0_GSUWGMRR0_K1_LBSPPA0_LBSPPB0_LPA0_LPB0_MIWT4_4_SU0_SUM0_SUS64_VWA4_VWB4_WGM8_WGMXCC1_WGMXCCGn1
    SolutionIndex: 7
    SolutionNameMin: Cijk_Ailk_Bjlk_F8HS_BH_Bias_HAS_SAB_SAV_UserArgs_MT256x256x64_MI32x32x1_SN_GSU0_GSUC0_GSUWGMRR0_K1_LBSPPA0_LBSPPB0_LPA0_LPB0_MIWT4_4_SU0_SUM0_SUS64_VWA4_VWB4_WGM8_WGMXCC1_WGMXCCGn1
    SolutionIndex: 8
    SolutionNameMin: Cijk_Ailk_Bjlk_F8HS_BH_Bias_HAS_SAB_SAV_UserArgs_MT256x256x64_MI32x32x1_SN_GSU0_GSUC0_GSUWGMRR0_K1_LBSPPA0_LBSPPB0_LPA0_LPB0_MIWT4_4_SU0_SUM0_SUS64_VWA4_VWB4_WGM8_WGMXCC1_WGMXCCGn1
    SolutionIndex: 9
    SolutionNameMin: Cijk_Ailk_Bjlk_F8HS_BH_Bias_HAS_SAB_SAV_UserArgs_MT256x256x64_MI32x32x1_SN_GSU0_GSUC0_GSUWGMRR0_K1_LBSPPA0_LBSPPB0_LPA0_LPB0_MIWT4_4_SU0_SUM0_SUS64_VWA4_VWB4_WGM8_WGMXCC1_WGMXCCGn1
    SolutionIndex: 10
    SolutionNameMin: Cijk_Ailk_Bjlk_F8HS_BH_Bias_HAS_SAB_SAV_UserArgs_MT256x256x64_MI32x32x1_SN_GSU0_GSUC0_GSUWGMRR0_K1_LBSPPA0_LBSPPB0_LPA0_LPB0_MIWT4_4_SU0_SUM0_SUS64_VWA4_VWB4_WGM8_WGMXCC1_WGMXCCGn1
    SolutionIndex: 11
    SolutionNameMin: Cijk_Ailk_Bjlk_F8HS_BH_Bias_HAS_SAB_SAV_UserArgs_MT256x256x64_MI32x32x1_SN_GSU0_GSUC0_GSUWGMRR0_K1_LBSPPA0_LBSPPB0_LPA0_LPB0_MIWT4_4_SU0_SUM0_SUS64_VWA4_VWB4_WGM8_WGMXCC1_WGMXCCGn1
    SolutionIndex: 12
    SolutionNameMin: Cijk_Ailk_Bjlk_F8HS_BH_Bias_HAS_SAB_SAV_UserArgs_MT256x256x64_MI32x32x1_SN_GSU0_GSUC0_GSUWGMRR0_K1_LBSPPA0_LBSPPB0_LPA0_LPB0_MIWT4_4_SU0_SUM0_SUS64_VWA4_VWB4_WGM8_WGMXCC1_WGMXCCGn1
    SolutionIndex: 13
    SolutionNameMin: Cijk_Ailk_Bjlk_F8HS_BH_Bias_HAS_SAB_SAV_UserArgs_MT256x256x64_MI32x32x1_SN_GSU0_GSUC0_GSUWGMRR0_K1_LBSPPA0_LBSPPB0_LPA0_LPB0_MIWT4_4_SU0_SUM0_SUS64_VWA4_VWB4_WGM8_WGMXCC1_WGMXCCGn1
    SolutionIndex: 14
    SolutionNameMin: Cijk_Ailk_Bjlk_F8HS_BH_Bias_HAS_SAB_SAV_UserArgs_MT128x256x64_MI32x32x1_SN_GSU0_GSUC0_GSUWGMRR0_K1_LBSPPA0_LBSPPB0_LPA0_LPB0_MIWT2_4_SU0_SUM0_SUS64_VWA2_VWB4_WGM8_WGMXCC1_WGMXCCGn1
    SolutionIndex: 15
    SolutionNameMin: Cijk_Ailk_Bjlk_F8HS_BH_Bias_HAS_SAB_SAV_UserArgs_MT256x128x64_MI32x32x1_SN_GSU0_GSUC0_GSUWGMRR0_K1_LBSPPA0_LBSPPB0_LPA0_LPB0_MIWT4_2_SU0_SUM0_SUS64_VWA4_VWB2_WGM8_WGMXCC1_WGMXCCGn1
    SolutionIndex: 16
    SolutionNameMin: Cijk_Ailk_Bjlk_F8HS_BH_Bias_HAS_SAB_SAV_UserArgs_MT256x128x64_MI32x32x1_SN_GSU0_GSUC0_GSUWGMRR0_K1_LBSPPA0_LBSPPB0_LPA0_LPB0_MIWT4_2_SU0_SUM0_SUS64_VWA4_VWB2_WGM8_WGMXCC1_WGMXCCGn1
    SolutionIndex: 17
    SolutionNameMin: Cijk_Ailk_Bjlk_F8HS_BH_Bias_HAS_SAB_SAV_UserArgs_MT256x128x64_MI32x32x1_SN_GSU0_GSUC0_GSUWGMRR0_K1_LBSPPA0_LBSPPB0_LPA0_LPB0_MIWT4_2_SU0_SUM0_SUS64_VWA4_VWB2_WGM8_WGMXCC1_WGMXCCGn1
    SolutionIndex: 18
    SolutionNameMin: Cijk_Ailk_Bjlk_F8HS_BH_Bias_HAS_SAB_SAV_UserArgs_MT256x128x64_MI32x32x1_SN_GSU0_GSUC0_GSUWGMRR0_K1_LBSPPA0_LBSPPB0_LPA0_LPB0_MIWT4_2_SU0_SUM0_SUS64_VWA4_VWB2_WGM8_WGMXCC1_WGMXCCGn1
    SolutionIndex: 19
    SolutionNameMin: Cijk_Ailk_Bjlk_F8HS_BH_Bias_HAS_SAB_SAV_UserArgs_MT256x128x64_MI32x32x1_SN_GSU0_GSUC0_GSUWGMRR0_K1_LBSPPA0_LBSPPB0_LPA0_LPB0_MIWT4_2_SU0_SUM0_SUS64_VWA4_VWB2_WGM8_WGMXCC1_WGMXCCGn1
    SolutionIndex: 20
    SolutionNameMin: Cijk_Ailk_Bjlk_F8HS_BH_Bias_HAS_SAB_SAV_UserArgs_MT256x128x64_MI32x32x1_SN_GSU0_GSUC0_GSUWGMRR0_K1_LBSPPA0_LBSPPB0_LPA0_LPB0_MIWT4_2_SU0_SUM0_SUS64_VWA4_VWB2_WGM8_WGMXCC1_WGMXCCGn1
    SolutionIndex: 21
    SolutionNameMin: Cijk_Ailk_Bjlk_F8HS_BH_Bias_HAS_SAB_SAV_UserArgs_MT256x128x64_MI32x32x1_SN_GSU0_GSUC0_GSUWGMRR0_K1_LBSPPA0_LBSPPB0_LPA0_LPB0_MIWT4_2_SU0_SUM0_SUS64_VWA4_VWB2_WGM8_WGMXCC1_WGMXCCGn1
    SolutionIndex: 22
    SolutionNameMin: Cijk_Ailk_Bjlk_F8HS_BH_Bias_HAS_SAB_SAV_UserArgs_MT256x128x64_MI32x32x1_SN_GSU0_GSUC0_GSUWGMRR0_K1_LBSPPA0_LBSPPB0_LPA0_LPB0_MIWT4_2_SU0_SUM0_SUS64_VWA4_VWB2_WGM8_WGMXCC1_WGMXCCGn1
    SolutionIndex: 23
    SolutionNameMin: Cijk_Ailk_Bjlk_F8HS_BH_Bias_HAS_SAB_SAV_UserArgs_MT256x128x64_MI32x32x1_SN_GSU0_GSUC0_GSUWGMRR0_K1_LBSPPA0_LBSPPB0_LPA0_LPB0_MIWT4_2_SU0_SUM0_SUS64_VWA4_VWB2_WGM8_WGMXCC1_WGMXCCGn1
    SolutionIndex: 24
    SolutionNameMin: Cijk_Ailk_Bjlk_F8HS_BH_Bias_HAS_SAB_SAV_UserArgs_MT128x128x128_MI16x16x1_SN_GSU0_GSUC0_GSUWGMRR0_K1_LBSPPA2048_LBSPPB2048_LPA64_LPB64_MIWT4_4_SU0_SUM0_SUS128_VWA4_VWB4_WGM8_WGMXCC1_WGMXCCGn1
    SolutionIndex: 25
    SolutionNameMin: Cijk_Ailk_Bjlk_F8HS_BH_Bias_HAS_SAB_SAV_UserArgs_MT128x128x128_MI16x16x1_SN_GSU0_GSUC0_GSUWGMRR0_K1_LBSPPA2048_LBSPPB2048_LPA64_LPB64_MIWT4_4_SU0_SUM0_SUS128_VWA4_VWB4_WGM8_WGMXCC1_WGMXCCGn1
    SolutionIndex: 26
    SolutionNameMin: Cijk_Ailk_Bjlk_F8HS_BH_Bias_HAS_SAB_SAV_UserArgs_MT128x128x128_MI16x16x1_SN_GSU0_GSUC0_GSUWGMRR0_K1_LBSPPA2048_LBSPPB2048_LPA64_LPB64_MIWT4_4_SU0_SUM0_SUS128_VWA4_VWB4_WGM8_WGMXCC1_WGMXCCGn1
    SolutionIndex: 27
    SolutionNameMin: Cijk_Ailk_Bjlk_F8HS_BH_Bias_HAS_SAB_SAV_UserArgs_MT128x128x128_MI16x16x1_SN_GSU0_GSUC0_GSUWGMRR0_K1_LBSPPA2048_LBSPPB2048_LPA64_LPB64_MIWT4_4_SU0_SUM0_SUS128_VWA4_VWB4_WGM8_WGMXCC1_WGMXCCGn1
    SolutionIndex: 28
    SolutionNameMin: Cijk_Ailk_Bjlk_F8HS_BH_Bias_HAS_SAB_SAV_UserArgs_MT128x128x128_MI16x16x1_SN_GSU0_GSUC0_GSUWGMRR0_K1_LBSPPA2048_LBSPPB2048_LPA64_LPB64_MIWT4_4_SU0_SUM0_SUS128_VWA4_VWB4_WGM8_WGMXCC1_WGMXCCGn1
    SolutionIndex: 29
    SolutionNameMin: Cijk_Ailk_Bjlk_F8HS_BH_Bias_HAS_SAB_SAV_UserArgs_MT64x128x128_MI16x16x1_SN_GSU0_GSUC0_GSUWGMRR0_K1_LBSPPA1024_LBSPPB2048_LPA32_LPB64_MIWT2_4_SU0_SUM0_SUS128_VWA2_VWB4_WGM8_WGMXCC1_WGMXCCGn1
    SolutionIndex: 30
    SolutionNameMin: Cijk_Ailk_Bjlk_F8HS_BH_Bias_HAS_SAB_SAV_UserArgs_MT64x128x128_MI16x16x1_SN_GSU0_GSUC0_GSUWGMRR0_K1_LBSPPA1024_LBSPPB2048_LPA32_LPB64_MIWT2_4_SU0_SUM0_SUS128_VWA2_VWB4_WGM8_WGMXCC1_WGMXCCGn1
    SolutionIndex: 31
    SolutionNameMin: Cijk_Ailk_Bjlk_F8HS_BH_Bias_HAS_SAB_SAV_UserArgs_MT64x128x128_MI16x16x1_SN_GSU0_GSUC0_GSUWGMRR0_K1_LBSPPA1024_LBSPPB2048_LPA32_LPB64_MIWT2_4_SU0_SUM0_SUS128_VWA2_VWB4_WGM8_WGMXCC1_WGMXCCGn1
    SolutionIndex: 32
    SolutionNameMin: Cijk_Ailk_Bjlk_F8HS_BH_Bias_HAS_SAB_SAV_UserArgs_MT64x128x128_MI16x16x1_SN_GSU0_GSUC0_GSUWGMRR0_K1_LBSPPA1024_LBSPPB2048_LPA32_LPB64_MIWT2_4_SU0_SUM0_SUS128_VWA2_VWB4_WGM8_WGMXCC1_WGMXCCGn1
    SolutionIndex: 33
    SolutionNameMin: Cijk_Ailk_Bjlk_F8HS_BH_Bias_HAS_SAB_SAV_UserArgs_MT128x64x128_MI16x16x1_SN_GSU0_GSUC0_GSUWGMRR0_K1_LBSPPA2048_LBSPPB1024_LPA64_LPB32_MIWT4_2_SU0_SUM0_SUS128_VWA4_VWB2_WGM8_WGMXCC1_WGMXCCGn1
    SolutionIndex: 34
    SolutionNameMin: Cijk_Ailk_Bjlk_F8HS_BH_Bias_HAS_SAB_SAV_UserArgs_MT128x64x128_MI16x16x1_SN_GSU0_GSUC0_GSUWGMRR0_K1_LBSPPA2048_LBSPPB1024_LPA64_LPB32_MIWT4_2_SU0_SUM0_SUS128_VWA4_VWB2_WGM8_WGMXCC1_WGMXCCGn1
    SolutionIndex: 35
    SolutionNameMin: Cijk_Ailk_Bjlk_F8HS_BH_Bias_HAS_SAB_SAV_UserArgs_MT128x64x128_MI16x16x1_SN_GSU0_GSUC0_GSUWGMRR0_K1_LBSPPA2048_LBSPPB1024_LPA64_LPB32_MIWT4_2_SU0_SUM0_SUS128_VWA4_VWB2_WGM8_WGMXCC1_WGMXCCGn1
    SolutionIndex: 36
    SolutionNameMin: Cijk_Ailk_Bjlk_F8HS_BH_Bias_HAS_SAB_SAV_UserArgs_MT128x64x128_MI16x16x1_SN_GSU0_GSUC0_GSUWGMRR0_K1_LBSPPA2048_LBSPPB1024_LPA64_LPB32_MIWT4_2_SU0_SUM0_SUS128_VWA4_VWB2_WGM8_WGMXCC1_WGMXCCGn1
    SolutionIndex: 37
    SolutionNameMin: Cijk_Ailk_Bjlk_F8HS_BH_Bias_HAS_SAB_SAV_UserArgs_MT128x64x128_MI16x16x1_SN_GSU0_GSUC0_GSUWGMRR0_K1_LBSPPA2048_LBSPPB1024_LPA64_LPB32_MIWT4_2_SU0_SUM0_SUS128_VWA4_VWB2_WGM8_WGMXCC1_WGMXCCGn1
    SolutionIndex: 38
    SolutionNameMin: Cijk_Ailk_Bjlk_F8HS_BH_Bias_HAS_SAB_SAV_UserArgs_MT128x64x128_MI16x16x1_SN_GSU0_GSUC0_GSUWGMRR0_K1_LBSPPA2048_LBSPPB1024_LPA64_LPB32_MIWT4_2_SU0_SUM0_SUS128_VWA4_VWB2_WGM8_WGMXCC1_WGMXCCGn1
    SolutionIndex: 39
    SolutionNameMin: Cijk_Ailk_Bjlk_F8HS_BH_Bias_HAS_SAB_SAV_UserArgs_MT128x32x128_MI16x16x1_SN_GSU0_GSUC0_GSUWGMRR0_K1_LBSPPA2048_LBSPPB512_LPA64_LPB16_MIWT4_1_SU0_SUM0_SUS128_VWA4_VWB1_WGM8_WGMXCC1_WGMXCCGn1
    SolutionIndex: 40
    SolutionNameMin: Cijk_Ailk_Bjlk_F8HS_BH_Bias_HAS_SAB_SAV_UserArgs_MT64x64x128_MI16x16x1_SN_GSU0_GSUC0_GSUWGMRR0_K1_LBSPPA512_LBSPPB512_LPA32_LPB32_MIWT2_2_SU0_SUM0_SUS128_VWA2_VWB2_WGM8_WGMXCC1_WGMXCCGn1
    SolutionIndex: 41
    SolutionNameMin: Cijk_Ailk_Bjlk_F8HS_BH_Bias_HAS_SAB_SAV_UserArgs_MT64x64x128_MI16x16x1_SN_GSU0_GSUC0_GSUWGMRR0_K1_LBSPPA512_LBSPPB512_LPA32_LPB32_MIWT2_2_SU0_SUM0_SUS128_VWA2_VWB2_WGM8_WGMXCC1_WGMXCCGn1
    SolutionIndex: 42
    SolutionNameMin: Cijk_Ailk_Bjlk_F8HS_BH_Bias_HAS_SAB_SAV_UserArgs_MT64x64x128_MI16x16x1_SN_GSU0_GSUC0_GSUWGMRR0_K1_LBSPPA512_LBSPPB512_LPA32_LPB32_MIWT2_2_SU0_SUM0_SUS128_VWA2_VWB2_WGM8_WGMXCC1_WGMXCCGn1
    SolutionIndex: 43
    SolutionNameMin: Cijk_Ailk_Bjlk_F8HS_BH_Bias_HAS_SAB_SAV_UserArgs_MT64x64x128_MI16x16x1_SN_GSU0_GSUC0_GSUWGMRR0_K1_LBSPPA1024_LBSPPB1024_LPA32_LPB32_MIWT2_2_SU0_SUM0_SUS128_VWA2_VWB2_WGM8_WGMXCC1_WGMXCCGn1
    SolutionIndex: 44
    SolutionNameMin: Cijk_Ailk_Bjlk_F8HS_BH_Bias_HAS_SAB_SAV_UserArgs_MT64x64x128_MI16x16x1_SN_GSU0_GSUC0_GSUWGMRR0_K1_LBSPPA1024_LBSPPB1024_LPA32_LPB32_MIWT2_2_SU0_SUM0_SUS128_VWA2_VWB2_WGM8_WGMXCC1_WGMXCCGn1
    SolutionIndex: 45
    SolutionNameMin: Cijk_Ailk_Bjlk_F8HS_BH_Bias_HAS_SAB_SAV_UserArgs_MT64x64x128_MI16x16x1_SN_GSU0_GSUC0_GSUWGMRR0_K1_LBSPPA1024_LBSPPB1024_LPA32_LPB32_MIWT2_2_SU0_SUM0_SUS128_VWA2_VWB2_WGM8_WGMXCC1_WGMXCCGn1
    SolutionIndex: 46
    SolutionNameMin: Cijk_Ailk_Bjlk_F8HS_BH_Bias_HAS_SAB_SAV_UserArgs_MT64x64x128_MI16x16x1_SN_GSU0_GSUC0_GSUWGMRR0_K1_LBSPPA1024_LBSPPB1024_LPA32_LPB32_MIWT2_2_SU0_SUM0_SUS128_VWA2_VWB2_WGM8_WGMXCC1_WGMXCCGn1
    SolutionIndex: 47
    SolutionNameMin: Cijk_Ailk_Bjlk_F8HS_BH_Bias_HAS_SAB_SAV_UserArgs_MT64x64x128_MI16x16x1_SN_GSU0_GSUC0_GSUWGMRR0_K1_LBSPPA1024_LBSPPB1024_LPA32_LPB32_MIWT2_2_SU0_SUM0_SUS128_VWA2_VWB2_WGM8_WGMXCC1_WGMXCCGn1
    SolutionIndex: 48
    SolutionNameMin: Cijk_Ailk_Bjlk_F8HS_BH_Bias_HAS_SAB_SAV_UserArgs_MT64x32x128_MI16x16x1_SN_GSU0_GSUC0_GSUWGMRR0_K1_LBSPPA512_LBSPPB256_LPA32_LPB16_MIWT2_1_SU0_SUM0_SUS128_VWA2_VWB1_WGM8_WGMXCC1_WGMXCCGn1
    SolutionIndex: 49
    SolutionNameMin: Cijk_Ailk_Bjlk_F8HS_BH_Bias_HAS_SAB_SAV_UserArgs_MT64x32x128_MI16x16x1_SN_GSU0_GSUC0_GSUWGMRR0_K1_LBSPPA512_LBSPPB256_LPA32_LPB16_MIWT2_1_SU0_SUM0_SUS128_VWA2_VWB1_WGM8_WGMXCC1_WGMXCCGn1
    SolutionIndex: 50
    SolutionNameMin: Cijk_Ailk_Bjlk_F8HS_BH_Bias_HAS_SAB_SAV_UserArgs_MT64x32x128_MI16x16x1_SN_GSU0_GSUC0_GSUWGMRR0_K1_LBSPPA512_LBSPPB256_LPA32_LPB16_MIWT2_1_SU0_SUM0_SUS128_VWA2_VWB1_WGM8_WGMXCC1_WGMXCCGn1
    SolutionIndex: 51
    SolutionNameMin: Cijk_Ailk_Bjlk_F8HS_BH_Bias_HAS_SAB_SAV_UserArgs_MT64x32x128_MI16x16x1_SN_GSU0_GSUC0_GSUWGMRR0_K1_LBSPPA512_LBSPPB256_LPA32_LPB16_MIWT2_1_SU0_SUM0_SUS128_VWA2_VWB1_WGM8_WGMXCC1_WGMXCCGn1
    SolutionIndex: 52
    SolutionNameMin: Cijk_Ailk_Bjlk_F8HS_BH_Bias_HAS_SAB_SAV_UserArgs_MT64x32x128_MI16x16x1_SN_GSU0_GSUC0_GSUWGMRR0_K1_LBSPPA1024_LBSPPB512_LPA32_LPB16_MIWT2_1_SU0_SUM0_SUS128_VWA2_VWB1_WGM8_WGMXCC1_WGMXCCGn1
    SolutionIndex: 53
    SolutionNameMin: Cijk_Ailk_Bjlk_F8HS_BH_Bias_HAS_SAB_SAV_UserArgs_MT64x32x128_MI16x16x1_SN_GSU0_GSUC0_GSUWGMRR0_K1_LBSPPA1024_LBSPPB512_LPA32_LPB16_MIWT2_1_SU0_SUM0_SUS128_VWA2_VWB1_WGM8_WGMXCC1_WGMXCCGn1
    SolutionIndex: 54
    SolutionNameMin: Cijk_Ailk_Bjlk_F8HS_BH_Bias_HAS_SAB_SAV_UserArgs_MT32x32x128_MI16x16x1_SN_GSU0_GSUC0_GSUWGMRR0_K1_LBSPPA128_LBSPPB128_LPA16_LPB16_MIWT1_1_SU0_SUM0_SUS128_VWA1_VWB1_WGM8_WGMXCC1_WGMXCCGn1
    SolutionIndex: 55
    SolutionNameMin: Cijk_Ailk_Bjlk_F8HS_BH_Bias_HAS_SAB_SAV_UserArgs_MT32x32x128_MI16x16x1_SN_GSU0_GSUC0_GSUWGMRR0_K1_LBSPPA128_LBSPPB128_LPA16_LPB16_MIWT1_1_SU0_SUM0_SUS128_VWA1_VWB1_WGM8_WGMXCC1_WGMXCCGn1
    SolutionIndex: 56
    SolutionNameMin: Cijk_Ailk_Bjlk_F8HS_BH_Bias_HAS_SAB_SAV_UserArgs_MT32x32x128_MI16x16x1_SN_GSU0_GSUC0_GSUWGMRR0_K1_LBSPPA128_LBSPPB128_LPA16_LPB16_MIWT1_1_SU0_SUM0_SUS128_VWA1_VWB1_WGM8_WGMXCC1_WGMXCCGn1
    SolutionIndex: 57
    SolutionNameMin: Cijk_Ailk_Bjlk_F8HS_BH_Bias_HAS_SAB_SAV_UserArgs_MT32x32x128_MI16x16x1_SN_GSU0_GSUC0_GSUWGMRR0_K1_LBSPPA128_LBSPPB128_LPA16_LPB16_MIWT1_1_SU0_SUM0_SUS128_VWA1_VWB1_WGM8_WGMXCC1_WGMXCCGn1
    SolutionIndex: 58
    SolutionNameMin: Cijk_Ailk_Bjlk_F8HS_BH_Bias_HAS_SAB_SAV_UserArgs_MT32x32x128_MI16x16x1_SN_GSU0_GSUC0_GSUWGMRR0_K1_LBSPPA256_LBSPPB256_LPA16_LPB16_MIWT1_1_SU0_SUM0_SUS128_VWA1_VWB1_WGM8_WGMXCC1_WGMXCCGn1
    SolutionIndex: 59
    SolutionNameMin: Cijk_Ailk_Bjlk_F8HS_BH_Bias_HAS_SAB_SAV_UserArgs_MT32x32x128_MI16x16x1_SN_GSU0_GSUC0_GSUWGMRR0_K1_LBSPPA256_LBSPPB256_LPA16_LPB16_MIWT1_1_SU0_SUM0_SUS128_VWA1_VWB1_WGM8_WGMXCC1_WGMXCCGn1
    SolutionIndex: 60
    SolutionNameMin: Cijk_Ailk_Bjlk_F8HS_BH_Bias_HAS_SAB_SAV_UserArgs_MT32x32x128_MI16x16x1_SN_GSU0_GSUC0_GSUWGMRR0_K1_LBSPPA256_LBSPPB256_LPA16_LPB16_MIWT1_1_SU0_SUM0_SUS128_VWA1_VWB1_WGM8_WGMXCC1_WGMXCCGn1
    SolutionIndex: 61
    SolutionNameMin: Cijk_Ailk_Bjlk_F8HS_BH_Bias_HAS_SAB_SAV_UserArgs_MT32x32x128_MI16x16x1_SN_GSU0_GSUC0_GSUWGMRR0_K1_LBSPPA256_LBSPPB256_LPA16_LPB16_MIWT1_1_SU0_SUM0_SUS128_VWA1_VWB1_WGM8_WGMXCC1_WGMXCCGn1
    SolutionIndex: 62
    SolutionNameMin: Cijk_Ailk_Bjlk_F8HS_BH_Bias_HAS_SAB_SAV_UserArgs_MT32x32x128_MI16x16x1_SN_GSU0_GSUC0_GSUWGMRR0_K1_LBSPPA512_LBSPPB512_LPA16_LPB16_MIWT1_1_SU0_SUM0_SUS128_VWA1_VWB1_WGM8_WGMXCC1_WGMXCCGn1
    SolutionIndex: 63
    SolutionNameMin: Cijk_Ailk_Bjlk_F8HS_BH_Bias_HAS_SAB_SAV_UserArgs_MT32x32x128_MI16x16x1_SN_GSU0_GSUC0_GSUWGMRR0_K1_LBSPPA512_LBSPPB512_LPA16_LPB16_MIWT1_1_SU0_SUM0_SUS128_VWA1_VWB1_WGM8_WGMXCC1_WGMXCCGn1
    SolutionIndex: 64
    SolutionNameMin: Cijk_Ailk_Bjlk_F8HS_BH_Bias_HAS_SAB_SAV_UserArgs_MT32x32x128_MI16x16x1_SN_GSU0_GSUC0_GSUWGMRR0_K1_LBSPPA512_LBSPPB512_LPA16_LPB16_MIWT1_1_SU0_SUM0_SUS128_VWA1_VWB1_WGM8_WGMXCC1_WGMXCCGn1
    SolutionIndex: 65
    SolutionNameMin: Cijk_Ailk_Bjlk_F8HS_BH_Bias_HAS_SAB_SAV_UserArgs_MT32x32x128_MI16x16x1_SN_GSU0_GSUC0_GSUWGMRR0_K1_LBSPPA512_LBSPPB512_LPA16_LPB16_MIWT1_1_SU0_SUM0_SUS128_VWA1_VWB1_WGM8_WGMXCC1_WGMXCCGn1
    SolutionIndex: 66
    SolutionNameMin: Cijk_Ailk_Bjlk_F8HS_BH_Bias_HAS_SAB_SAV_UserArgs_MT256x128x128_MI32x32x1_SN_GSU0_GSUC0_GSUWGMRR0_K1_LBSPPA0_LBSPPB0_LPA0_LPB0_MIWT4_2_SU0_SUM0_SUS128_VWA4_VWB2_WGM8_WGMXCC1_WGMXCCGn1
    SolutionIndex: 67
    SolutionNameMin: Cijk_Ailk_Bjlk_F8HS_BH_Bias_HAS_SAB_SAV_UserArgs_MT256x128x128_MI32x32x1_SN_GSU0_GSUC0_GSUWGMRR0_K1_LBSPPA0_LBSPPB0_LPA0_LPB0_MIWT4_2_SU0_SUM0_SUS128_VWA4_VWB2_WGM8_WGMXCC1_WGMXCCGn1
    SolutionIndex: 68
    SolutionNameMin: Cijk_Ailk_Bjlk_F8HS_BH_Bias_HAS_SAB_SAV_UserArgs_MT256x128x128_MI32x32x1_SN_GSU0_GSUC0_GSUWGMRR0_K1_LBSPPA0_LBSPPB0_LPA0_LPB0_MIWT4_2_SU0_SUM0_SUS128_VWA4_VWB2_WGM8_WGMXCC1_WGMXCCGn1
    SolutionIndex: 69
    SolutionNameMin: Cijk_Ailk_Bjlk_F8HS_BH_Bias_HAS_SAB_SAV_UserArgs_MT64x64x256_MI16x16x1_SN_GSU0_GSUC0_GSUWGMRR0_K1_LBSPPA512_LBSPPB512_LPA32_LPB32_MIWT2_2_SU0_SUM0_SUS256_VWA2_VWB2_WGM8_WGMXCC1_WGMXCCGn1
    SolutionIndex: 70
    SolutionNameMin: Cijk_Ailk_Bjlk_F8HS_BH_Bias_HAS_SAB_SAV_UserArgs_MT64x64x256_MI16x16x1_SN_GSU0_GSUC0_GSUWGMRR0_K1_LBSPPA1024_LBSPPB1024_LPA32_LPB32_MIWT2_2_SU0_SUM0_SUS256_VWA2_VWB2_WGM8_WGMXCC1_WGMXCCGn1
    SolutionIndex: 71
    SolutionNameMin: Cijk_Ailk_Bjlk_F8HS_BH_Bias_HAS_SAB_SAV_UserArgs_MT64x64x256_MI16x16x1_SN_GSU0_GSUC0_GSUWGMRR0_K1_LBSPPA1024_LBSPPB1024_LPA32_LPB32_MIWT2_2_SU0_SUM0_SUS256_VWA2_VWB2_WGM8_WGMXCC1_WGMXCCGn1
    SolutionIndex: 72
    SolutionNameMin: Cijk_Ailk_Bjlk_F8HS_BH_Bias_HAS_SAB_SAV_UserArgs_MT32x64x256_MI16x16x1_SN_GSU0_GSUC0_GSUWGMRR0_K1_LBSPPA256_LBSPPB512_LPA16_LPB32_MIWT1_2_SU0_SUM0_SUS256_VWA1_VWB2_WGM8_WGMXCC1_WGMXCCGn1
    SolutionIndex: 73
    SolutionNameMin: Cijk_Ailk_Bjlk_F8HS_BH_Bias_HAS_SAB_SAV_UserArgs_MT32x64x256_MI16x16x1_SN_GSU0_GSUC0_GSUWGMRR0_K1_LBSPPA512_LBSPPB1024_LPA16_LPB32_MIWT1_2_SU0_SUM0_SUS256_VWA1_VWB2_WGM8_WGMXCC1_WGMXCCGn1
    SolutionIndex: 74
    SolutionNameMin: Cijk_Ailk_Bjlk_F8HS_BH_Bias_HAS_SAB_SAV_UserArgs_MT32x64x256_MI16x16x1_SN_GSU0_GSUC0_GSUWGMRR0_K1_LBSPPA512_LBSPPB1024_LPA16_LPB32_MIWT1_2_SU0_SUM0_SUS256_VWA1_VWB2_WGM8_WGMXCC1_WGMXCCGn1
    SolutionIndex: 75
    SolutionNameMin: Cijk_Ailk_Bjlk_F8HS_BH_Bias_HAS_SAB_SAV_UserArgs_MT64x32x256_MI16x16x1_SN_GSU0_GSUC0_GSUWGMRR0_K1_LBSPPA512_LBSPPB256_LPA32_LPB16_MIWT2_1_SU0_SUM0_SUS256_VWA2_VWB1_WGM8_WGMXCC1_WGMXCCGn1
    SolutionIndex: 76
    SolutionNameMin: Cijk_Ailk_Bjlk_F8HS_BH_Bias_HAS_SAB_SAV_UserArgs_MT64x32x256_MI16x16x1_SN_GSU0_GSUC0_GSUWGMRR0_K1_LBSPPA1024_LBSPPB512_LPA32_LPB16_MIWT2_1_SU0_SUM0_SUS256_VWA2_VWB1_WGM8_WGMXCC1_WGMXCCGn1
    SolutionIndex: 77
    SolutionNameMin: Cijk_Ailk_Bjlk_F8HS_BH_Bias_HAS_SAB_SAV_UserArgs_MT32x32x256_MI16x16x1_SN_GSU0_GSUC0_GSUWGMRR0_K1_LBSPPA128_LBSPPB128_LPA16_LPB16_MIWT1_1_SU0_SUM0_SUS256_VWA1_VWB1_WGM8_WGMXCC1_WGMXCCGn1
    SolutionIndex: 78
    SolutionNameMin: Cijk_Ailk_Bjlk_F8HS_BH_Bias_HAS_SAB_SAV_UserArgs_MT32x32x256_MI16x16x1_SN_GSU0_GSUC0_GSUWGMRR0_K1_LBSPPA256_LBSPPB256_LPA16_LPB16_MIWT1_1_SU0_SUM0_SUS256_VWA1_VWB1_WGM8_WGMXCC1_WGMXCCGn1
    SolutionIndex: 79
    SolutionNameMin: Cijk_Ailk_Bjlk_F8HS_BH_Bias_HAS_SAB_SAV_UserArgs_MT32x32x256_MI16x16x1_SN_GSU0_GSUC0_GSUWGMRR0_K1_LBSPPA256_LBSPPB256_LPA16_LPB16_MIWT1_1_SU0_SUM0_SUS256_VWA1_VWB1_WGM8_WGMXCC1_WGMXCCGn1
    SolutionIndex: 80
    SolutionNameMin: Cijk_Ailk_Bjlk_F8HS_BH_Bias_HAS_SAB_SAV_UserArgs_MT32x32x256_MI16x16x1_SN_GSU0_GSUC0_GSUWGMRR0_K1_LBSPPA256_LBSPPB256_LPA16_LPB16_MIWT1_1_SU0_SUM0_SUS256_VWA1_VWB1_WGM8_WGMXCC1_WGMXCCGn1
    SolutionIndex: 81
    SolutionNameMin: Cijk_Ailk_Bjlk_F8HS_BH_Bias_HAS_SAB_SAV_UserArgs_MT32x32x256_MI16x16x1_SN_GSU0_GSUC0_GSUWGMRR0_K1_LBSPPA512_LBSPPB512_LPA16_LPB16_MIWT1_1_SU0_SUM0_SUS256_VWA1_VWB1_WGM8_WGMXCC1_WGMXCCGn1
    SolutionIndex: 82
    SolutionNameMin: Cijk_Ailk_Bjlk_F8HS_BH_Bias_HAS_SAB_SAV_UserArgs_MT32x32x256_MI16x16x1_SN_GSU0_GSUC0_GSUWGMRR0_K1_LBSPPA512_LBSPPB512_LPA16_LPB16_MIWT1_1_SU0_SUM0_SUS256_VWA1_VWB1_WGM8_WGMXCC1_WGMXCCGn1
    SolutionIndex: 83
    SolutionNameMin: Cijk_Ailk_Bjlk_F8HS_BH_Bias_HAS_SAB_SAV_UserArgs_MT32x32x128_MI16x16x1_SN_GSU0_GSUC0_GSUWGMRR0_K1_LBSPPA256_LBSPPB256_LPA16_LPB16_MIWT1_1_SU32_SUM0_SUS256_VWA1_VWB1_WGM8_WGMXCC1_WGMXCCGn1
- - - [128, 128, 1, 128, 128, 128, 128, 128]
    - [55, 0.39]
  - - [128, 128, 1, 256, 128, 128, 128, 128]
    - [61, 0.69]
  - - [128, 128, 1, 512, 128, 128, 128, 128]
    - [59, 1.17]
  - - [128, 128, 1, 1024, 128, 128, 128, 128]
    - [65, 1.77]
  - - [128, 128, 1, 2048, 128, 128, 128, 128]
    - [77, 2.47]
  - - [128, 128, 1, 4096, 128, 128, 128, 128]
    - [77, 3.11]
  - - [128, 128, 1, 8192, 128, 128, 128, 128]
    - [82, 3.59]
  - - [128, 256, 1, 128, 128, 128, 128, 256]
    - [59, 0.79]
  - - [128, 256, 1, 256, 128, 128, 128, 256]
    - [63, 1.39]
  - - [128, 256, 1, 512, 128, 128, 128, 256]
    - [59, 2.33]
  - - [128, 256, 1, 1024, 128, 128, 128, 256]
    - [82, 3.54]
  - - [128, 256, 1, 2048, 128, 128, 128, 256]
    - [81, 4.95]
  - - [128, 256, 1, 4096, 128, 128, 128, 256]
    - [82, 6.21]
  - - [128, 256, 1, 8192, 128, 128, 128, 256]
    - [79, 7.19]
  - - [128, 512, 1, 128, 128, 128, 128, 512]
    - [57, 1.52]
  - - [128, 512, 1, 256, 128, 128, 128, 512]
    - [55, 2.7]
  - - [128, 512, 1, 512, 128, 128, 128, 512]
    - [58, 4.58]
  - - [128, 512, 1, 1024, 128, 128, 128, 512]
    - [81, 7.03]
  - - [128, 512, 1, 2048, 128, 128, 128, 512]
    - [77, 9.9]
  - - [128, 512, 1, 4096, 128, 128, 128, 512]
    - [77, 12.42]
  - - [128, 512, 1, 8192, 128, 128, 128, 512]
    - [82, 14.29]
  - - [128, 1024, 1, 128, 128, 128, 128, 1024]
    - [59, 3.02]
  - - [128, 1024, 1, 256, 128, 128, 128, 1024]
    - [63, 5.3]
  - - [128, 1024, 1, 512, 128, 128, 128, 1024]
    - [60, 8.97]
  - - [128, 1024, 1, 1024, 128, 128, 128, 1024]
    - [82, 13.82]
  - - [128, 1024, 1, 2048, 128, 128, 128, 1024]
    - [79, 19.12]
  - - [128, 1024, 1, 4096, 128, 128, 128, 1024]
    - [82, 24.02]
  - - [128, 1024, 1, 8192, 128, 128, 128, 1024]
    - [77, 27.41]
  - - [128, 2048, 1, 128, 128, 128, 128, 2048]
    - [63, 5.85]
  - - [128, 2048, 1, 256, 128, 128, 128, 2048]
    - [55, 10.2]
  - - [128, 2048, 1, 512, 128, 128, 128, 2048]
    - [63, 17.09]
  - - [128, 2048, 1, 1024, 128, 128, 128, 2048]
    - [78, 26.24]
  - - [128, 2048, 1, 2048, 128, 128, 128, 2048]
    - [79, 36.8]
  - - [128, 2048, 1, 4096, 128, 128, 128, 2048]
    - [79, 45.61]
  - - [128, 2048, 1, 8192, 128, 128, 128, 2048]
    - [77, 52.34]
  - - [128, 4096, 1, 128, 128, 128, 128, 4096]
    - [48, 11.05]
  - - [128, 4096, 1, 256, 128, 128, 128, 4096]
    - [53, 19.46]
  - - [128, 4096, 1, 512, 128, 128, 128, 4096]
    - [50, 32.14]
  - - [128, 4096, 1, 1024, 128, 128, 128, 4096]
    - [53, 48.37]
  - - [128, 4096, 1, 2048, 128, 128, 128, 4096]
    - [74, 66.14]
  - - [128, 4096, 1, 4096, 128, 128, 128, 4096]
    - [72, 83.64]
  - - [128, 4096, 1, 8192, 128, 128, 128, 4096]
    - [76, 94.34]
  - - [128, 8192, 1, 128, 128, 128, 128, 8192]
    - [40, 20.33]
  - - [128, 8192, 1, 256, 128, 128, 128, 8192]
    - [41, 36.0]
  - - [128, 8192, 1, 512, 128, 128, 128, 8192]
    - [45, 59.61]
  - - [128, 8192, 1, 1024, 128, 128, 128, 8192]
    - [41, 89.04]
  - - [128, 8192, 1, 2048, 128, 128, 128, 8192]
    - [47, 119.36]
  - - [128, 8192, 1, 4096, 128, 128, 128, 8192]
    - [70, 144.37]
  - - [128, 8192, 1, 8192, 128, 128, 128, 8192]
    - [71, 159.43]
  - - [256, 128, 1, 128, 256, 256, 256, 128]
    - [55, 0.77]
  - - [256, 128, 1, 256, 256, 256, 256, 128]
    - [55, 1.37]
  - - [256, 128, 1, 512, 256, 256, 256, 128]
    - [63, 2.31]
  - - [256, 128, 1, 1024, 256, 256, 256, 128]
    - [79, 3.51]
  - - [256, 128, 1, 2048, 256, 256, 256, 128]
    - [82, 4.95]
  - - [256, 128, 1, 4096, 256, 256, 256, 128]
    - [77, 6.24]
  - - [256, 128, 1, 8192, 256, 256, 256, 128]
    - [82, 7.18]
  - - [256, 256, 1, 128, 256, 256, 256, 256]
    - [62, 1.53]
  - - [256, 256, 1, 256, 256, 256, 256, 256]
    - [62, 2.72]
  - - [256, 256, 1, 512, 256, 256, 256, 256]
    - [59, 4.59]
  - - [256, 256, 1, 1024, 256, 256, 256, 256]
    - [77, 7.07]
  - - [256, 256, 1, 2048, 256, 256, 256, 256]
    - [79, 9.99]
  - - [256, 256, 1, 4096, 256, 256, 256, 256]
    - [77, 12.5]
  - - [256, 256, 1, 8192, 256, 256, 256, 256]
    - [79, 14.37]
  - - [256, 512, 1, 128, 256, 256, 256, 512]
    - [58, 3.06]
  - - [256, 512, 1, 256, 256, 256, 256, 512]
    - [55, 5.39]
  - - [256, 512, 1, 512, 256, 256, 256, 512]
    - [60, 9.12]
  - - [256, 512, 1, 1024, 256, 256, 256, 512]
    - [77, 14.19]
  - - [256, 512, 1, 2048, 256, 256, 256, 512]
    - [77, 19.97]
  - - [256, 512, 1, 4096, 256, 256, 256, 512]
    - [82, 24.87]
  - - [256, 512, 1, 8192, 256, 256, 256, 512]
    - [77, 28.49]
  - - [256, 1024, 1, 128, 256, 256, 256, 1024]
    - [55, 5.88]
  - - [256, 1024, 1, 256, 256, 256, 256, 1024]
    - [59, 10.42]
  - - [256, 1024, 1, 512, 256, 256, 256, 1024]
    - [55, 17.51]
  - - [256, 1024, 1, 1024, 256, 256, 256, 1024]
    - [79, 27.0]
  - - [256, 1024, 1, 2048, 256, 256, 256, 1024]
    - [79, 37.42]
  - - [256, 1024, 1, 4096, 256, 256, 256, 1024]
    - [82, 46.55]
  - - [256, 1024, 1, 8192, 256, 256, 256, 1024]
    - [79, 52.82]
  - - [256, 2048, 1, 128, 256, 256, 256, 2048]
    - [49, 11.08]
  - - [256, 2048, 1, 256, 256, 256, 256, 2048]
    - [48, 19.68]
  - - [256, 2048, 1, 512, 256, 256, 256, 2048]
    - [51, 32.64]
  - - [256, 2048, 1, 1024, 256, 256, 256, 2048]
    - [73, 48.65]
  - - [256, 2048, 1, 2048, 256, 256, 256, 2048]
    - [76, 68.13]
  - - [256, 2048, 1, 4096, 256, 256, 256, 2048]
    - [75, 85.07]
  - - [256, 2048, 1, 8192, 256, 256, 256, 2048]
    - [74, 97.65]
  - - [256, 4096, 1, 128, 256, 256, 256, 4096]
    - [40, 20.53]
  - - [256, 4096, 1, 256, 256, 256, 256, 4096]
    - [45, 36.32]
  - - [256, 4096, 1, 512, 256, 256, 256, 4096]
    - [45, 59.97]
  - - [256, 4096, 1, 1024, 256, 256, 256, 4096]
    - [43, 89.41]
  - - [256, 4096, 1, 2048, 256, 256, 256, 4096]
    - [42, 119.61]
  - - [256, 4096, 1, 4096, 256, 256, 256, 4096]
    - [42, 145.57]
  - - [256, 4096, 1, 8192, 256, 256, 256, 4096]
    - [69, 157.38]
  - - [256, 8192, 1, 128, 256, 256, 256, 8192]
    - [30, 35.3]
  - - [256, 8192, 1, 256, 256, 256, 256, 8192]
    - [37, 61.35]
  - - [256, 8192, 1, 512, 256, 256, 256, 8192]
    - [38, 100.9]
  - - [256, 8192, 1, 1024, 256, 256, 256, 8192]
    - [38, 149.81]
  - - [256, 8192, 1, 2048, 256, 256, 256, 8192]
    - [38, 198.05]
  - - [256, 8192, 1, 4096, 256, 256, 256, 8192]
    - [32, 230.48]
  - - [256, 8192, 1, 8192, 256, 256, 256, 8192]
    - [36, 239.52]
  - - [512, 128, 1, 128, 512, 512, 512, 128]
    - [55, 1.54]
  - - [512, 128, 1, 256, 512, 512, 512, 128]
    - [60, 2.7]
  - - [512, 128, 1, 512, 512, 512, 512, 128]
    - [56, 4.56]
  - - [512, 128, 1, 1024, 512, 512, 512, 128]
    - [82, 7.08]
  - - [512, 128, 1, 2048, 512, 512, 512, 128]
    - [82, 9.96]
  - - [512, 128, 1, 4096, 512, 512, 512, 128]
    - [80, 12.38]
  - - [512, 128, 1, 8192, 512, 512, 512, 128]
    - [80, 14.25]
  - - [512, 256, 1, 128, 512, 512, 512, 256]
    - [58, 3.05]
  - - [512, 256, 1, 256, 512, 512, 512, 256]
    - [60, 5.35]
  - - [512, 256, 1, 512, 512, 512, 512, 256]
    - [64, 9.05]
  - - [512, 256, 1, 1024, 512, 512, 512, 256]
    - [79, 14.14]
  - - [512, 256, 1, 2048, 512, 512, 512, 256]
    - [79, 19.73]
  - - [512, 256, 1, 4096, 512, 512, 512, 256]
    - [79, 24.52]
  - - [512, 256, 1, 8192, 512, 512, 512, 256]
    - [80, 28.22]
  - - [512, 512, 1, 128, 512, 512, 512, 512]
    - [54, 5.98]
  - - [512, 512, 1, 256, 512, 512, 512, 512]
    - [55, 10.44]
  - - [512, 512, 1, 512, 512, 512, 512, 512]
    - [59, 17.6]
  - - [512, 512, 1, 1024, 512, 512, 512, 512]
    - [77, 27.43]
  - - [512, 512, 1, 2048, 512, 512, 512, 512]
    - [79, 38.44]
  - - [512, 512, 1, 4096, 512, 512, 512, 512]
    - [82, 47.59]
  - - [512, 512, 1, 8192, 512, 512, 512, 512]
    - [80, 54.66]
  - - [512, 1024, 1, 128, 512, 512, 512, 1024]
    - [48, 11.27]
  - - [512, 1024, 1, 256, 512, 512, 512, 1024]
    - [48, 20.1]
  - - [512, 1024, 1, 512, 512, 512, 512, 1024]
    - [50, 33.11]
  - - [512, 1024, 1, 1024, 512, 512, 512, 1024]
    - [75, 49.52]
  - - [512, 1024, 1, 2048, 512, 512, 512, 1024]
    - [76, 69.42]
  - - [512, 1024, 1, 4096, 512, 512, 512, 1024]
    - [76, 85.91]
  - - [512, 1024, 1, 8192, 512, 512, 512, 1024]
    - [76, 99.54]
  - - [512, 2048, 1, 128, 512, 512, 512, 2048]
    - [44, 20.77]
  - - [512, 2048, 1, 256, 512, 512, 512, 2048]
    - [45, 36.51]
  - - [512, 2048, 1, 512, 512, 512, 512, 2048]
    - [45, 60.63]
  - - [512, 2048, 1, 1024, 512, 512, 512, 2048]
    - [43, 90.44]
  - - [512, 2048, 1, 2048, 512, 512, 512, 2048]
    - [47, 120.33]
  - - [512, 2048, 1, 4096, 512, 512, 512, 2048]
    - [42, 145.98]
  - - [512, 2048, 1, 8192, 512, 512, 512, 2048]
    - [42, 161.37]
  - - [512, 4096, 1, 128, 512, 512, 512, 4096]
    - [30, 35.2]
  - - [512, 4096, 1, 256, 512, 512, 512, 4096]
    - [33, 61.52]
  - - [512, 4096, 1, 512, 512, 512, 512, 4096]
    - [38, 101.53]
  - - [512, 4096, 1, 1024, 512, 512, 512, 4096]
    - [38, 150.1]
  - - [512, 4096, 1, 2048, 512, 512, 512, 4096]
    - [38, 197.33]
  - - [512, 4096, 1, 4096, 512, 512, 512, 4096]
    - [38, 235.1]
  - - [512, 4096, 1, 8192, 512, 512, 512, 4096]
    - [38, 239.45]
  - - [512, 8192, 1, 128, 512, 512, 512, 8192]
    - [25, 56.47]
  - - [512, 8192, 1, 256, 512, 512, 512, 8192]
    - [28, 97.08]
  - - [512, 8192, 1, 512, 512, 512, 512, 8192]
    - [28, 159.15]
  - - [512, 8192, 1, 1024, 512, 512, 512, 8192]
    - [28, 230.45]
  - - [512, 8192, 1, 2048, 512, 512, 512, 8192]
    - [28, 295.48]
  - - [512, 8192, 1, 4096, 512, 512, 512, 8192]
    - [27, 332.91]
  - - [512, 8192, 1, 8192, 512, 512, 512, 8192]
    - [28, 327.18]
  - - [1024, 128, 1, 128, 1024, 1024, 1024, 128]
    - [64, 3.0]
  - - [1024, 128, 1, 256, 1024, 1024, 1024, 128]
    - [60, 5.27]
  - - [1024, 128, 1, 512, 1024, 1024, 1024, 128]
    - [56, 8.95]
  - - [1024, 128, 1, 1024, 1024, 1024, 1024, 128]
    - [79, 13.73]
  - - [1024, 128, 1, 2048, 1024, 1024, 1024, 128]
    - [79, 18.98]
  - - [1024, 128, 1, 4096, 1024, 1024, 1024, 128]
    - [77, 23.51]
  - - [1024, 128, 1, 8192, 1024, 1024, 1024, 128]
    - [79, 26.62]
  - - [1024, 256, 1, 128, 1024, 1024, 1024, 256]
    - [54, 5.88]
  - - [1024, 256, 1, 256, 1024, 1024, 1024, 256]
    - [64, 10.25]
  - - [1024, 256, 1, 512, 1024, 1024, 1024, 256]
    - [56, 17.33]
  - - [1024, 256, 1, 1024, 1024, 1024, 1024, 256]
    - [79, 26.43]
  - - [1024, 256, 1, 2048, 1024, 1024, 1024, 256]
    - [79, 36.99]
  - - [1024, 256, 1, 4096, 1024, 1024, 1024, 256]
    - [82, 45.79]
  - - [1024, 256, 1, 8192, 1024, 1024, 1024, 256]
    - [77, 52.05]
  - - [1024, 512, 1, 128, 1024, 1024, 1024, 512]
    - [48, 11.31]
  - - [1024, 512, 1, 256, 1024, 1024, 1024, 512]
    - [52, 20.01]
  - - [1024, 512, 1, 512, 1024, 1024, 1024, 512]
    - [48, 33.16]
  - - [1024, 512, 1, 1024, 1024, 1024, 1024, 512]
    - [76, 49.9]
  - - [1024, 512, 1, 2048, 1024, 1024, 1024, 512]
    - [75, 69.55]
  - - [1024, 512, 1, 4096, 1024, 1024, 1024, 512]
    - [76, 86.36]
  - - [1024, 512, 1, 8192, 1024, 1024, 1024, 512]
    - [75, 99.38]
  - - [1024, 1024, 1, 128, 1024, 1024, 1024, 1024]
    - [41, 20.66]
  - - [1024, 1024, 1, 256, 1024, 1024, 1024, 1024]
    - [45, 36.56]
  - - [1024, 1024, 1, 512, 1024, 1024, 1024, 1024]
    - [45, 60.95]
  - - [1024, 1024, 1, 1024, 1024, 1024, 1024, 1024]
    - [45, 90.61]
  - - [1024, 1024, 1, 2048, 1024, 1024, 1024, 1024]
    - [47, 120.44]
  - - [1024, 1024, 1, 4096, 1024, 1024, 1024, 1024]
    - [47, 146.15]
  - - [1024, 1024, 1, 8192, 1024, 1024, 1024, 1024]
    - [42, 160.22]
  - - [1024, 2048, 1, 128, 1024, 1024, 1024, 2048]
    - [29, 35.71]
  - - [1024, 2048, 1, 256, 1024, 1024, 1024, 2048]
    - [31, 61.35]
  - - [1024, 2048, 1, 512, 1024, 1024, 1024, 2048]
    - [34, 100.88]
  - - [1024, 2048, 1, 1024, 1024, 1024, 1024, 2048]
    - [38, 148.5]
  - - [1024, 2048, 1, 2048, 1024, 1024, 1024, 2048]
    - [38, 197.96]
  - - [1024, 2048, 1, 4096, 1024, 1024, 1024, 2048]
    - [38, 231.46]
  - - [1024, 2048, 1, 8192, 1024, 1024, 1024, 2048]
    - [31, 239.41]
  - - [1024, 4096, 1, 128, 1024, 1024, 1024, 4096]
    - [24, 56.57]
  - - [1024, 4096, 1, 256, 1024, 1024, 1024, 4096]
    - [27, 98.32]
  - - [1024, 4096, 1, 512, 1024, 1024, 1024, 4096]
    - [28, 159.19]
  - - [1024, 4096, 1, 1024, 1024, 1024, 1024, 4096]
    - [28, 231.39]
  - - [1024, 4096, 1, 2048, 1024, 1024, 1024, 4096]
    - [28, 298.04]
  - - [1024, 4096, 1, 4096, 1024, 1024, 1024, 4096]
    - [28, 332.19]
  - - [1024, 4096, 1, 8192, 1024, 1024, 1024, 4096]
    - [28, 332.52]
  - - [1024, 8192, 1, 128, 1024, 1024, 1024, 8192]
    - [16, 71.61]
  - - [1024, 8192, 1, 256, 1024, 1024, 1024, 8192]
    - [23, 124.29]
  - - [1024, 8192, 1, 512, 1024, 1024, 1024, 8192]
    - [21, 204.27]
  - - [1024, 8192, 1, 1024, 1024, 1024, 1024, 8192]
    - [66, 294.18]
  - - [1024, 8192, 1, 2048, 1024, 1024, 1024, 8192]
    - [66, 377.82]
  - - [1024, 8192, 1, 4096, 1024, 1024, 1024, 8192]
    - [68, 424.57]
  - - [1024, 8192, 1, 8192, 1024, 1024, 1024, 8192]
    - [68, 411.24]
  - - [2048, 128, 1, 128, 2048, 2048, 2048, 128]
    - [56, 5.91]
  - - [2048, 128, 1, 256, 2048, 2048, 2048, 128]
    - [48, 10.26]
  - - [2048, 128, 1, 512, 2048, 2048, 2048, 128]
    - [60, 17.17]
  - - [2048, 128, 1, 1024, 2048, 2048, 2048, 128]
    - [82, 26.24]
  - - [2048, 128, 1, 2048, 2048, 2048, 2048, 128]
    - [82, 36.49]
  - - [2048, 128, 1, 4096, 2048, 2048, 2048, 128]
    - [79, 45.51]
  - - [2048, 128, 1, 8192, 2048, 2048, 2048, 128]
    - [77, 52.01]
  - - [2048, 256, 1, 128, 2048, 2048, 2048, 256]
    - [52, 11.18]
  - - [2048, 256, 1, 256, 2048, 2048, 2048, 256]
    - [48, 19.8]
  - - [2048, 256, 1, 512, 2048, 2048, 2048, 256]
    - [52, 33.01]
  - - [2048, 256, 1, 1024, 2048, 2048, 2048, 256]
    - [52, 48.72]
  - - [2048, 256, 1, 2048, 2048, 2048, 2048, 256]
    - [76, 68.02]
  - - [2048, 256, 1, 4096, 2048, 2048, 2048, 256]
    - [76, 84.94]
  - - [2048, 256, 1, 8192, 2048, 2048, 2048, 256]
    - [75, 97.49]
  - - [2048, 512, 1, 128, 2048, 2048, 2048, 512]
    - [39, 20.53]
  - - [2048, 512, 1, 256, 2048, 2048, 2048, 512]
    - [41, 36.33]
  - - [2048, 512, 1, 512, 2048, 2048, 2048, 512]
    - [41, 60.43]
  - - [2048, 512, 1, 1024, 2048, 2048, 2048, 512]
    - [46, 90.15]
  - - [2048, 512, 1, 2048, 2048, 2048, 2048, 512]
    - [42, 119.87]
  - - [2048, 512, 1, 4096, 2048, 2048, 2048, 512]
    - [47, 145.19]
  - - [2048, 512, 1, 8192, 2048, 2048, 2048, 512]
    - [47, 160.28]
  - - [2048, 1024, 1, 128, 2048, 2048, 2048, 1024]
    - [33, 35.75]
  - - [2048, 1024, 1, 256, 2048, 2048, 2048, 1024]
    - [35, 61.74]
  - - [2048, 1024, 1, 512, 2048, 2048, 2048, 1024]
    - [38, 101.74]
  - - [2048, 1024, 1, 1024, 2048, 2048, 2048, 1024]
    - [38, 150.57]
  - - [2048, 1024, 1, 2048, 2048, 2048, 2048, 1024]
    - [38, 198.51]
  - - [2048, 1024, 1, 4096, 2048, 2048, 2048, 1024]
    - [38, 233.94]
  - - [2048, 1024, 1, 8192, 2048, 2048, 2048, 1024]
    - [36, 243.11]
  - - [2048, 2048, 1, 128, 2048, 2048, 2048, 2048]
    - [24, 56.18]
  - - [2048, 2048, 1, 256, 2048, 2048, 2048, 2048]
    - [27, 98.17]
  - - [2048, 2048, 1, 512, 2048, 2048, 2048, 2048]
    - [28, 158.58]
  - - [2048, 2048, 1, 1024, 2048, 2048, 2048, 2048]
    - [28, 230.57]
  - - [2048, 2048, 1, 2048, 2048, 2048, 2048, 2048]
    - [28, 302.37]
  - - [2048, 2048, 1, 4096, 2048, 2048, 2048, 2048]
    - [28, 337.94]
  - - [2048, 2048, 1, 8192, 2048, 2048, 2048, 2048]
    - [28, 344.27]
  - - [2048, 4096, 1, 128, 2048, 2048, 2048, 4096]
    - [20, 72.43]
  - - [2048, 4096, 1, 256, 2048, 2048, 2048, 4096]
    - [18, 125.57]
  - - [2048, 4096, 1, 512, 2048, 2048, 2048, 4096]
    - [21, 203.04]
  - - [2048, 4096, 1, 1024, 2048, 2048, 2048, 4096]
    - [66, 294.86]
  - - [2048, 4096, 1, 2048, 2048, 2048, 2048, 4096]
    - [67, 379.99]
  - - [2048, 4096, 1, 4096, 2048, 2048, 2048, 4096]
    - [68, 410.95]
  - - [2048, 4096, 1, 8192, 2048, 2048, 2048, 4096]
    - [68, 405.99]
  - - [2048, 8192, 1, 128, 2048, 2048, 2048, 8192]
    - [15, 83.94]
  - - [2048, 8192, 1, 256, 2048, 2048, 2048, 8192]
    - [22, 144.25]
  - - [2048, 8192, 1, 512, 2048, 2048, 2048, 8192]
    - [12, 234.05]
  - - [2048, 8192, 1, 1024, 2048, 2048, 2048, 8192]
    - [6, 367.33]
  - - [2048, 8192, 1, 2048, 2048, 2048, 2048, 8192]
    - [13, 479.9]
  - - [2048, 8192, 1, 4096, 2048, 2048, 2048, 8192]
    - [4, 529.72]
  - - [2048, 8192, 1, 8192, 2048, 2048, 2048, 8192]
    - [4, 555.95]
  - - [4096, 128, 1, 128, 4096, 4096, 4096, 128]
    - [48, 11.22]
  - - [4096, 128, 1, 256, 4096, 4096, 4096, 128]
    - [52, 19.69]
  - - [4096, 128, 1, 512, 4096, 4096, 4096, 128]
    - [52, 32.56]
  - - [4096, 128, 1, 1024, 4096, 4096, 4096, 128]
    - [48, 48.69]
  - - [4096, 128, 1, 2048, 4096, 4096, 4096, 128]
    - [76, 67.34]
  - - [4096, 128, 1, 4096, 4096, 4096, 4096, 128]
    - [75, 84.33]
  - - [4096, 128, 1, 8192, 4096, 4096, 4096, 128]
    - [75, 92.83]
  - - [4096, 256, 1, 128, 4096, 4096, 4096, 256]
    - [43, 20.63]
  - - [4096, 256, 1, 256, 4096, 4096, 4096, 256]
    - [40, 36.02]
  - - [4096, 256, 1, 512, 4096, 4096, 4096, 256]
    - [41, 60.65]
  - - [4096, 256, 1, 1024, 4096, 4096, 4096, 256]
    - [45, 89.08]
  - - [4096, 256, 1, 2048, 4096, 4096, 4096, 256]
    - [47, 119.7]
  - - [4096, 256, 1, 4096, 4096, 4096, 4096, 256]
    - [47, 145.42]
  - - [4096, 256, 1, 8192, 4096, 4096, 4096, 256]
    - [47, 156.64]
  - - [4096, 512, 1, 128, 4096, 4096, 4096, 512]
    - [29, 35.46]
  - - [4096, 512, 1, 256, 4096, 4096, 4096, 512]
    - [34, 61.64]
  - - [4096, 512, 1, 512, 4096, 4096, 4096, 512]
    - [31, 101.39]
  - - [4096, 512, 1, 1024, 4096, 4096, 4096, 512]
    - [38, 150.77]
  - - [4096, 512, 1, 2048, 4096, 4096, 4096, 512]
    - [38, 198.02]
  - - [4096, 512, 1, 4096, 4096, 4096, 4096, 512]
    - [32, 231.51]
  - - [4096, 512, 1, 8192, 4096, 4096, 4096, 512]
    - [38, 245.08]
  - - [4096, 1024, 1, 128, 4096, 4096, 4096, 1024]
    - [26, 56.51]
  - - [4096, 1024, 1, 256, 4096, 4096, 4096, 1024]
    - [28, 97.93]
  - - [4096, 1024, 1, 512, 4096, 4096, 4096, 1024]
    - [27, 157.72]
  - - [4096, 1024, 1, 1024, 4096, 4096, 4096, 1024]
    - [28, 230.55]
  - - [4096, 1024, 1, 2048, 4096, 4096, 4096, 1024]
    - [28, 293.09]
  - - [4096, 1024, 1, 4096, 4096, 4096, 4096, 1024]
    - [27, 334.15]
  - - [4096, 1024, 1, 8192, 4096, 4096, 4096, 1024]
    - [28, 323.84]
  - - [4096, 2048, 1, 128, 4096, 4096, 4096, 2048]
    - [14, 70.02]
  - - [4096, 2048, 1, 256, 4096, 4096, 4096, 2048]
    - [14, 120.59]
  - - [4096, 2048, 1, 512, 4096, 4096, 4096, 2048]
    - [67, 197.69]
  - - [4096, 2048, 1, 1024, 4096, 4096, 4096, 2048]
    - [68, 289.65]
  - - [4096, 2048, 1, 2048, 4096, 4096, 4096, 2048]
    - [67, 375.64]
  - - [4096, 2048, 1, 4096, 4096, 4096, 4096, 2048]
    - [66, 394.74]
  - - [4096, 2048, 1, 8192, 4096, 4096, 4096, 2048]
    - [68, 402.32]
  - - [4096, 4096, 1, 128, 4096, 4096, 4096, 4096]
    - [5, 90.81]
  - - [4096, 4096, 1, 256, 4096, 4096, 4096, 4096]
    - [3, 149.77]
  - - [4096, 4096, 1, 512, 4096, 4096, 4096, 4096]
    - [12, 243.02]
  - - [4096, 4096, 1, 1024, 4096, 4096, 4096, 4096]
    - [10, 384.2]
  - - [4096, 4096, 1, 2048, 4096, 4096, 4096, 4096]
    - [13, 499.73]
  - - [4096, 4096, 1, 4096, 4096, 4096, 4096, 4096]
    - [7, 533.33]
  - - [4096, 4096, 1, 8192, 4096, 4096, 4096, 4096]
    - [7, 558.05]
  - - [4096, 8192, 1, 128, 4096, 4096, 4096, 8192]
    - [8, 103.07]
  - - [4096, 8192, 1, 256, 4096, 4096, 4096, 8192]
    - [3, 171.78]
  - - [4096, 8192, 1, 512, 4096, 4096, 4096, 8192]
    - [10, 283.48]
  - - [4096, 8192, 1, 1024, 4096, 4096, 4096, 8192]
    - [1, 397.9]
  - - [4096, 8192, 1, 2048, 4096, 4096, 4096, 8192]
    - [6, 461.74]
  - - [4096, 8192, 1, 4096, 4096, 4096, 4096, 8192]
    - [0, 527.34]
  - - [4096, 8192, 1, 8192, 4096, 4096, 4096, 8192]
    - [4, 589.4]
  - - [8192, 128, 1, 128, 8192, 8192, 8192, 128]
    - [40, 20.21]
  - - [8192, 128, 1, 256, 8192, 8192, 8192, 128]
    - [45, 35.67]
  - - [8192, 128, 1, 512, 8192, 8192, 8192, 128]
    - [41, 59.44]
  - - [8192, 128, 1, 1024, 8192, 8192, 8192, 128]
    - [45, 89.01]
  - - [8192, 128, 1, 2048, 8192, 8192, 8192, 128]
    - [41, 118.86]
  - - [8192, 128, 1, 4096, 8192, 8192, 8192, 128]
    - [47, 142.66]
  - - [8192, 128, 1, 8192, 8192, 8192, 8192, 128]
    - [47, 156.58]
  - - [8192, 256, 1, 128, 8192, 8192, 8192, 256]
    - [29, 35.87]
  - - [8192, 256, 1, 256, 8192, 8192, 8192, 256]
    - [31, 61.49]
  - - [8192, 256, 1, 512, 8192, 8192, 8192, 256]
    - [33, 100.93]
  - - [8192, 256, 1, 1024, 8192, 8192, 8192, 256]
    - [38, 149.66]
  - - [8192, 256, 1, 2048, 8192, 8192, 8192, 256]
    - [38, 198.21]
  - - [8192, 256, 1, 4096, 8192, 8192, 8192, 256]
    - [32, 229.36]
  - - [8192, 256, 1, 8192, 8192, 8192, 8192, 256]
    - [38, 236.1]
  - - [8192, 512, 1, 128, 8192, 8192, 8192, 512]
    - [24, 56.59]
  - - [8192, 512, 1, 256, 8192, 8192, 8192, 512]
    - [27, 97.19]
  - - [8192, 512, 1, 512, 8192, 8192, 8192, 512]
    - [28, 158.09]
  - - [8192, 512, 1, 1024, 8192, 8192, 8192, 512]
    - [28, 229.69]
  - - [8192, 512, 1, 2048, 8192, 8192, 8192, 512]
    - [28, 295.06]
  - - [8192, 512, 1, 4096, 8192, 8192, 8192, 512]
    - [28, 335.35]
  - - [8192, 512, 1, 8192, 8192, 8192, 8192, 512]
    - [28, 332.99]
  - - [8192, 1024, 1, 128, 8192, 8192, 8192, 1024]
    - [19, 72.2]
  - - [8192, 1024, 1, 256, 8192, 8192, 8192, 1024]
    - [17, 124.84]
  - - [8192, 1024, 1, 512, 8192, 8192, 8192, 1024]
    - [21, 203.79]
  - - [8192, 1024, 1, 1024, 8192, 8192, 8192, 1024]
    - [21, 292.0]
  - - [8192, 1024, 1, 2048, 8192, 8192, 8192, 1024]
    - [66, 370.05]
  - - [8192, 1024, 1, 4096, 8192, 8192, 8192, 1024]
    - [67, 391.34]
  - - [8192, 1024, 1, 8192, 8192, 8192, 8192, 1024]
    - [67, 387.88]
  - - [8192, 2048, 1, 128, 8192, 8192, 8192, 2048]
    - [11, 92.68]
  - - [8192, 2048, 1, 256, 8192, 8192, 8192, 2048]
    - [6, 147.04]
  - - [8192, 2048, 1, 512, 8192, 8192, 8192, 2048]
    - [3, 254.56]
  - - [8192, 2048, 1, 1024, 8192, 8192, 8192, 2048]
    - [3, 394.89]
  - - [8192, 2048, 1, 2048, 8192, 8192, 8192, 2048]
    - [7, 509.35]
  - - [8192, 2048, 1, 4096, 8192, 8192, 8192, 2048]
    - [7, 543.53]
  - - [8192, 2048, 1, 8192, 8192, 8192, 8192, 2048]
    - [13, 560.5]
  - - [8192, 4096, 1, 128, 8192, 8192, 8192, 4096]
    - [2, 103.94]
  - - [8192, 4096, 1, 256, 8192, 8192, 8192, 4096]
    - [8, 173.38]
  - - [8192, 4096, 1, 512, 8192, 8192, 8192, 4096]
    - [9, 285.74]
  - - [8192, 4096, 1, 1024, 8192, 8192, 8192, 4096]
    - [7, 399.37]
  - - [8192, 4096, 1, 2048, 8192, 8192, 8192, 4096]
    - [7, 468.95]
  - - [8192, 4096, 1, 4096, 8192, 8192, 8192, 4096]
    - [4, 525.26]
  - - [8192, 4096, 1, 8192, 8192, 8192, 8192, 4096]
    - [7, 595.96]
  - - [8192, 8192, 1, 128, 8192, 8192, 8192, 8192]
    - [8, 111.17]
  - - [8192, 8192, 1, 256, 8192, 8192, 8192, 8192]
    - [11, 188.55]
  - - [8192, 8192, 1, 512, 8192, 8192, 8192, 8192]
    - [0, 289.9]
  - - [8192, 8192, 1, 1024, 8192, 8192, 8192, 8192]
    - [7, 387.88]
  - - [8192, 8192, 1, 2048, 8192, 8192, 8192, 8192]
    - [7, 464.42]
  - - [8192, 8192, 1, 4096, 8192, 8192, 8192, 8192]
    - [4, 557.15]
  - - [8192, 8192, 1, 8192, 8192, 8192, 8192, 8192]
    - [7, 636.79]
  - - [1, 1, 1, 32, 1, 1, 1, 1]
    - [83, 0.0]
- null
- null
- DeviceEfficiency
- GridBased
