projects/hipblaslt/library/src/amd_detail/rocblaslt/src/Tensile/Logic/asm_full/gfx950/GridBased/gfx950_Cijk_Alik_Bjlk_HSS_BH_Bias_HAS_SAV_UserArgs.yaml
- {MinimumRequiredVersion: 4.33.0}
- gfx950
- gfx950
- [Device 75a0]
    SolutionIndex: 0
    SolutionNameMin: Cijk_Alik_Bjlk_HSS_BH_Bias_HAS_SAV_UserArgs_MT256x256x32_MI16x16x1_SN_LDSB0_CLR0_GSU0_GSUC0_GSUWGMRR0_K1_LBSPPA512_LBSPPB2048_LPB0_MIWT8_8_PLR0_SU0_SUM0_SUS0_VWA8_VWB8_WGM6_WGMXCC1_WGMXCCGn1
    SolutionIndex: 1
    SolutionNameMin: Cijk_Alik_Bjlk_HSS_BH_Bias_HAS_SAV_UserArgs_MT128x256x32_MI16x16x1_SN_LDSB1_CLR0_GSU0_GSUC0_GSUWGMRR0_K1_LBSPPA256_LBSPPB1024_LPB0_MIWT4_8_PLR0_SU0_SUM0_SUS0_VWA4_VWB8_WGM1_WGMXCC1_WGMXCCGn1
    SolutionIndex: 2
    SolutionNameMin: Cijk_Alik_Bjlk_HSS_BH_Bias_HAS_SAV_UserArgs_MT128x256x32_MI16x16x1_SN_LDSB1_CLR0_GSU0_GSUC0_GSUWGMRR0_K1_LBSPPA256_LBSPPB1024_LPB0_MIWT4_8_PLR0_SU0_SUM0_SUS0_VWA4_VWB8_WGM1_WGMXCC1_WGMXCCGn1
    SolutionIndex: 3
    SolutionNameMin: Cijk_Alik_Bjlk_HSS_BH_Bias_HAS_SAV_UserArgs_MT128x256x32_MI16x16x1_SN_LDSB1_CLR0_GSU0_GSUC0_GSUWGMRR0_K1_LBSPPA256_LBSPPB2048_LPB0_MIWT4_8_PLR0_SU0_SUM0_SUS0_VWA4_VWB8_WGM1_WGMXCC1_WGMXCCGn1
    SolutionIndex: 4
    SolutionNameMin: Cijk_Alik_Bjlk_HSS_BH_Bias_HAS_SAV_UserArgs_MT128x256x32_MI16x16x1_SN_LDSB1_CLR0_GSU0_GSUC0_GSUWGMRR0_K1_LBSPPA256_LBSPPB1024_LPB0_MIWT4_8_PLR0_SU0_SUM0_SUS0_VWA4_VWB8_WGM6_WGMXCC1_WGMXCCGn1
    SolutionIndex: 5
    SolutionNameMin: Cijk_Alik_Bjlk_HSS_BH_Bias_HAS_SAV_UserArgs_MT128x256x32_MI16x16x1_SN_LDSB1_CLR0_GSU0_GSUC0_GSUWGMRR0_K1_LBSPPA256_LBSPPB1024_LPB0_MIWT4_8_PLR0_SU0_SUM0_SUS0_VWA4_VWB8_WGM6_WGMXCC1_WGMXCCGn1
    SolutionIndex: 6
    SolutionNameMin: Cijk_Alik_Bjlk_HSS_BH_Bias_HAS_SAV_UserArgs_MT128x256x32_MI16x16x1_SN_LDSB1_CLR0_GSU0_GSUC0_GSUWGMRR0_K1_LBSPPA256_LBSPPB2048_LPB0_MIWT4_8_PLR0_SU0_SUM0_SUS0_VWA4_VWB8_WGM6_WGMXCC1_WGMXCCGn1
    SolutionIndex: 7
    SolutionNameMin: Cijk_Alik_Bjlk_HSS_BH_Bias_HAS_SAV_UserArgs_MT128x256x32_MI16x16x1_SN_LDSB1_CLR0_GSU0_GSUC0_GSUWGMRR0_K1_LBSPPA256_LBSPPB2048_LPB0_MIWT4_8_PLR0_SU0_SUM0_SUS0_VWA4_VWB8_WGM6_WGMXCC1_WGMXCCGn1
    SolutionIndex: 8
    SolutionNameMin: Cijk_Alik_Bjlk_HSS_BH_Bias_HAS_SAV_UserArgs_MT128x256x32_MI16x16x1_SN_LDSB1_CLR0_GSU0_GSUC0_GSUWGMRR0_K1_LBSPPA256_LBSPPB2048_LPB0_MIWT4_8_PLR0_SU0_SUM0_SUS0_VWA4_VWB8_WGM6_WGMXCC1_WGMXCCGn1
    SolutionIndex: 9
    SolutionNameMin: Cijk_Alik_Bjlk_HSS_BH_Bias_HAS_SAV_UserArgs_MT128x256x32_MI16x16x1_SN_LDSB1_CLR0_GSU0_GSUC0_GSUWGMRR0_K1_LBSPPA256_LBSPPB4096_LPB0_MIWT4_8_PLR0_SU0_SUM0_SUS0_VWA4_VWB8_WGM6_WGMXCC1_WGMXCCGn1
    SolutionIndex: 10
    SolutionNameMin: Cijk_Alik_Bjlk_HSS_BH_Bias_HAS_SAV_UserArgs_MT128x256x32_MI16x16x1_SN_LDSB1_CLR0_GSU0_GSUC0_GSUWGMRR0_K1_LBSPPA256_LBSPPB1024_LPB0_MIWT4_8_PLR0_SU0_SUM0_SUS0_VWA4_VWB8_WGM8_WGMXCC1_WGMXCCGn1
    SolutionIndex: 11
    SolutionNameMin: Cijk_Alik_Bjlk_HSS_BH_Bias_HAS_SAV_UserArgs_MT256x128x32_MI16x16x1_SN_LDSB1_CLR0_GSU0_GSUC0_GSUWGMRR0_K1_LBSPPA512_LBSPPB1024_LPB0_MIWT8_4_PLR0_SU0_SUM0_SUS0_VWA8_VWB4_WGM8_WGMXCC1_WGMXCCGn1
    SolutionIndex: 12
    SolutionNameMin: Cijk_Alik_Bjlk_HSS_BH_Bias_HAS_SAV_UserArgs_MT128x128x32_MI16x16x1_SN_LDSB1_CLR0_GSU0_GSUC0_GSUWGMRR0_K1_LBSPPA256_LBSPPB1024_LPB0_MIWT4_4_PLR0_SU0_SUM0_SUS0_VWA4_VWB4_WGM1_WGMXCC1_WGMXCCGn1
    SolutionIndex: 13
    SolutionNameMin: Cijk_Alik_Bjlk_HSS_BH_Bias_HAS_SAV_UserArgs_MT128x128x32_MI16x16x1_SN_LDSB1_CLR0_GSU0_GSUC0_GSUWGMRR0_K1_LBSPPA256_LBSPPB2048_LPB0_MIWT4_4_PLR0_SU0_SUM0_SUS0_VWA4_VWB4_WGM1_WGMXCC1_WGMXCCGn1
    SolutionIndex: 14
    SolutionNameMin: Cijk_Alik_Bjlk_HSS_BH_Bias_HAS_SAV_UserArgs_MT256x256x32_MI32x32x1_SN_LDSB0_CLR1_GSU0_GSUC0_GSUWGMRR0_K1_LBSPPA256_LBSPPB0_LPB0_MIWT4_4_PLR1_SU0_SUM0_SUS0_VWA4_VWB4_WGM1_WGMXCC1_WGMXCCGn1
    SolutionIndex: 15
    SolutionNameMin: Cijk_Alik_Bjlk_HSS_BH_Bias_HAS_SAV_UserArgs_MT256x256x32_MI32x32x1_SN_LDSB0_CLR1_GSU0_GSUC0_GSUWGMRR0_K1_LBSPPA256_LBSPPB0_LPB0_MIWT4_4_PLR1_SU0_SUM0_SUS0_VWA4_VWB4_WGM1_WGMXCC1_WGMXCCGn1
    SolutionIndex: 16
    SolutionNameMin: Cijk_Alik_Bjlk_HSS_BH_Bias_HAS_SAV_UserArgs_MT256x256x32_MI32x32x1_SN_LDSB0_CLR1_GSU0_GSUC0_GSUWGMRR0_K1_LBSPPA256_LBSPPB0_LPB0_MIWT4_4_PLR1_SU0_SUM0_SUS0_VWA4_VWB4_WGM1_WGMXCC1_WGMXCCGn1
    SolutionIndex: 17
    SolutionNameMin: Cijk_Alik_Bjlk_HSS_BH_Bias_HAS_SAV_UserArgs_MT256x256x32_MI32x32x1_SN_LDSB0_CLR1_GSU0_GSUC0_GSUWGMRR0_K1_LBSPPA256_LBSPPB0_LPB0_MIWT4_4_PLR1_SU0_SUM0_SUS0_VWA4_VWB4_WGM6_WGMXCC1_WGMXCCGn1
    SolutionIndex: 18
    SolutionNameMin: Cijk_Alik_Bjlk_HSS_BH_Bias_HAS_SAV_UserArgs_MT256x256x32_MI32x32x1_SN_LDSB0_CLR1_GSU0_GSUC0_GSUWGMRR0_K1_LBSPPA256_LBSPPB0_LPB0_MIWT4_4_PLR1_SU0_SUM0_SUS0_VWA4_VWB4_WGM6_WGMXCC1_WGMXCCGn1
    SolutionIndex: 19
    SolutionNameMin: Cijk_Alik_Bjlk_HSS_BH_Bias_HAS_SAV_UserArgs_MT256x256x32_MI32x32x1_SN_LDSB0_CLR1_GSU0_GSUC0_GSUWGMRR0_K1_LBSPPA256_LBSPPB0_LPB0_MIWT4_4_PLR1_SU0_SUM0_SUS0_VWA4_VWB4_WGM8_WGMXCC1_WGMXCCGn1
    SolutionIndex: 20
    SolutionNameMin: Cijk_Alik_Bjlk_HSS_BH_Bias_HAS_SAV_UserArgs_MT256x256x32_MI32x32x1_SN_LDSB0_CLR1_GSU0_GSUC0_GSUWGMRR0_K1_LBSPPA256_LBSPPB0_LPB0_MIWT4_4_PLR1_SU0_SUM0_SUS0_VWA4_VWB4_WGM8_WGMXCC1_WGMXCCGn1
    SolutionIndex: 21
    SolutionNameMin: Cijk_Alik_Bjlk_HSS_BH_Bias_HAS_SAV_UserArgs_MT256x256x32_MI32x32x1_SN_LDSB0_CLR1_GSU0_GSUC0_GSUWGMRR0_K1_LBSPPA256_LBSPPB0_LPB0_MIWT4_4_PLR1_SU0_SUM0_SUS0_VWA4_VWB4_WGM8_WGMXCC1_WGMXCCGn1
    SolutionIndex: 22
    SolutionNameMin: Cijk_Alik_Bjlk_HSS_BH_Bias_HAS_SAV_UserArgs_MT256x128x32_MI32x32x1_SN_LDSB1_CLR1_GSU0_GSUC0_GSUWGMRR0_K1_LBSPPA256_LBSPPB0_LPB0_MIWT4_2_PLR1_SU0_SUM0_SUS0_VWA4_VWB2_WGM1_WGMXCC1_WGMXCCGn1
    SolutionIndex: 23
    SolutionNameMin: Cijk_Alik_Bjlk_HSS_BH_Bias_HAS_SAV_UserArgs_MT256x128x32_MI32x32x1_SN_LDSB1_CLR1_GSU0_GSUC0_GSUWGMRR0_K1_LBSPPA256_LBSPPB0_LPB0_MIWT4_2_PLR1_SU0_SUM0_SUS0_VWA4_VWB2_WGM1_WGMXCC1_WGMXCCGn1
    SolutionIndex: 24
    SolutionNameMin: Cijk_Alik_Bjlk_HSS_BH_Bias_HAS_SAV_UserArgs_MT256x128x32_MI32x32x1_SN_LDSB1_CLR1_GSU0_GSUC0_GSUWGMRR0_K1_LBSPPA256_LBSPPB0_LPB0_MIWT4_2_PLR1_SU0_SUM0_SUS0_VWA4_VWB2_WGM6_WGMXCC1_WGMXCCGn1
    SolutionIndex: 25
    SolutionNameMin: Cijk_Alik_Bjlk_HSS_BH_Bias_HAS_SAV_UserArgs_MT256x128x32_MI32x32x1_SN_LDSB1_CLR1_GSU0_GSUC0_GSUWGMRR0_K1_LBSPPA256_LBSPPB0_LPB0_MIWT4_2_PLR1_SU0_SUM0_SUS0_VWA4_VWB2_WGM6_WGMXCC1_WGMXCCGn1
    SolutionIndex: 26
    SolutionNameMin: Cijk_Alik_Bjlk_HSS_BH_Bias_HAS_SAV_UserArgs_MT256x128x32_MI32x32x1_SN_LDSB1_CLR1_GSU0_GSUC0_GSUWGMRR0_K1_LBSPPA256_LBSPPB0_LPB0_MIWT4_2_PLR1_SU0_SUM0_SUS0_VWA4_VWB2_WGM8_WGMXCC1_WGMXCCGn1
    SolutionIndex: 27
    SolutionNameMin: Cijk_Alik_Bjlk_HSS_BH_Bias_HAS_SAV_UserArgs_MT128x128x32_MI32x32x1_SN_LDSB1_CLR1_GSU0_GSUC0_GSUWGMRR0_K1_LBSPPA128_LBSPPB0_LPB0_MIWT2_2_PLR1_SU0_SUM0_SUS0_VWA2_VWB2_WGM8_WGMXCC1_WGMXCCGn1
    SolutionIndex: 28
    SolutionNameMin: Cijk_Alik_Bjlk_HSS_BH_Bias_HAS_SAV_UserArgs_MT256x256x64_MI16x16x1_SN_LDSB1_CLR1_GSU0_GSUC0_GSUWGMRR0_K1_LBSPPA1024_LBSPPB2048_LPB0_MIWT8_8_PLR1_SU0_SUM0_SUS0_VWA8_VWB8_WGM6_WGMXCC1_WGMXCCGn1
    SolutionIndex: 29
    SolutionNameMin: Cijk_Alik_Bjlk_HSS_BH_Bias_HAS_SAV_UserArgs_MT256x256x64_MI16x16x1_SN_LDSB1_CLR1_GSU0_GSUC0_GSUWGMRR0_K1_LBSPPA1024_LBSPPB4096_LPB0_MIWT8_8_PLR1_SU0_SUM0_SUS0_VWA8_VWB8_WGM6_WGMXCC1_WGMXCCGn1
    SolutionIndex: 30
    SolutionNameMin: Cijk_Alik_Bjlk_HSS_BH_Bias_HAS_SAV_UserArgs_MT256x256x64_MI16x16x1_SN_LDSB1_CLR1_GSU0_GSUC0_GSUWGMRR0_K1_LBSPPA1024_LBSPPB4096_LPB0_MIWT8_8_PLR1_SU0_SUM0_SUS0_VWA8_VWB8_WGM6_WGMXCC1_WGMXCCGn1
    SolutionIndex: 31
    SolutionNameMin: Cijk_Alik_Bjlk_HSS_BH_Bias_HAS_SAV_UserArgs_MT256x256x64_MI16x16x1_SN_LDSB1_CLR1_GSU0_GSUC0_GSUWGMRR0_K1_LBSPPA1024_LBSPPB4096_LPB0_MIWT8_8_PLR1_SU0_SUM0_SUS0_VWA8_VWB8_WGM8_WGMXCC1_WGMXCCGn1
    SolutionIndex: 32
    SolutionNameMin: Cijk_Alik_Bjlk_HSS_BH_Bias_HAS_SAV_UserArgs_MT128x256x64_MI16x16x1_SN_LDSB1_CLR1_GSU0_GSUC0_GSUWGMRR0_K1_LBSPPA512_LBSPPB4096_LPB0_MIWT4_8_PLR1_SU0_SUM0_SUS0_VWA4_VWB8_WGM1_WGMXCC1_WGMXCCGn1
    SolutionIndex: 33
    SolutionNameMin: Cijk_Alik_Bjlk_HSS_BH_Bias_HAS_SAV_UserArgs_MT128x256x64_MI16x16x1_SN_LDSB1_CLR1_GSU0_GSUC0_GSUWGMRR0_K1_LBSPPA512_LBSPPB1024_LPB0_MIWT4_8_PLR1_SU0_SUM0_SUS0_VWA4_VWB8_WGM6_WGMXCC1_WGMXCCGn1
    SolutionIndex: 34
    SolutionNameMin: Cijk_Alik_Bjlk_HSS_BH_Bias_HAS_SAV_UserArgs_MT128x256x64_MI16x16x1_SN_LDSB1_CLR1_GSU0_GSUC0_GSUWGMRR0_K1_LBSPPA512_LBSPPB4096_LPB0_MIWT4_8_PLR1_SU0_SUM0_SUS0_VWA4_VWB8_WGM6_WGMXCC1_WGMXCCGn1
    SolutionIndex: 35
    SolutionNameMin: Cijk_Alik_Bjlk_HSS_BH_Bias_HAS_SAV_UserArgs_MT256x128x64_MI16x16x1_SN_LDSB1_CLR1_GSU0_GSUC0_GSUWGMRR0_K1_LBSPPA1024_LBSPPB1024_LPB0_MIWT8_4_PLR1_SU0_SUM0_SUS0_VWA8_VWB4_WGM1_WGMXCC1_WGMXCCGn1
    SolutionIndex: 36
    SolutionNameMin: Cijk_Alik_Bjlk_HSS_BH_Bias_HAS_SAV_UserArgs_MT256x128x64_MI16x16x1_SN_LDSB1_CLR1_GSU0_GSUC0_GSUWGMRR0_K1_LBSPPA1024_LBSPPB2048_LPB0_MIWT8_4_PLR1_SU0_SUM0_SUS0_VWA8_VWB4_WGM1_WGMXCC1_WGMXCCGn1
    SolutionIndex: 37
    SolutionNameMin: Cijk_Alik_Bjlk_HSS_BH_Bias_HAS_SAV_UserArgs_MT256x128x64_MI16x16x1_SN_LDSB1_CLR1_GSU0_GSUC0_GSUWGMRR0_K1_LBSPPA1024_LBSPPB2048_LPB0_MIWT8_4_PLR1_SU0_SUM0_SUS0_VWA8_VWB4_WGM6_WGMXCC1_WGMXCCGn1
    SolutionIndex: 38
    SolutionNameMin: Cijk_Alik_Bjlk_HSS_BH_Bias_HAS_SAV_UserArgs_MT256x128x64_MI16x16x1_SN_LDSB1_CLR1_GSU0_GSUC0_GSUWGMRR0_K1_LBSPPA1024_LBSPPB1024_LPB0_MIWT8_4_PLR1_SU0_SUM0_SUS0_VWA8_VWB4_WGM8_WGMXCC1_WGMXCCGn1
    SolutionIndex: 39
    SolutionNameMin: Cijk_Alik_Bjlk_HSS_BH_Bias_HAS_SAV_UserArgs_MT256x128x64_MI16x16x1_SN_LDSB1_CLR1_GSU0_GSUC0_GSUWGMRR0_K1_LBSPPA1024_LBSPPB2048_LPB0_MIWT8_4_PLR1_SU0_SUM0_SUS0_VWA8_VWB4_WGM8_WGMXCC1_WGMXCCGn1
    SolutionIndex: 40
    SolutionNameMin: Cijk_Alik_Bjlk_HSS_BH_Bias_HAS_SAV_UserArgs_MT128x128x64_MI16x16x1_SN_LDSB1_CLR1_GSU0_GSUC0_GSUWGMRR0_K1_LBSPPA512_LBSPPB512_LPB0_MIWT4_4_PLR1_SU0_SUM0_SUS0_VWA4_VWB4_WGM1_WGMXCC1_WGMXCCGn1
    SolutionIndex: 41
    SolutionNameMin: Cijk_Alik_Bjlk_HSS_BH_Bias_HAS_SAV_UserArgs_MT128x128x64_MI16x16x1_SN_LDSB1_CLR1_GSU0_GSUC0_GSUWGMRR0_K1_LBSPPA512_LBSPPB512_LPB0_MIWT4_4_PLR1_SU0_SUM0_SUS0_VWA4_VWB4_WGM1_WGMXCC1_WGMXCCGn1
    SolutionIndex: 42
    SolutionNameMin: Cijk_Alik_Bjlk_HSS_BH_Bias_HAS_SAV_UserArgs_MT128x128x64_MI16x16x1_SN_LDSB1_CLR1_GSU0_GSUC0_GSUWGMRR0_K1_LBSPPA512_LBSPPB1024_LPB0_MIWT4_4_PLR1_SU0_SUM0_SUS0_VWA4_VWB4_WGM1_WGMXCC1_WGMXCCGn1
    SolutionIndex: 43
    SolutionNameMin: Cijk_Alik_Bjlk_HSS_BH_Bias_HAS_SAV_UserArgs_MT128x128x64_MI16x16x1_SN_LDSB1_CLR1_GSU0_GSUC0_GSUWGMRR0_K1_LBSPPA512_LBSPPB512_LPB0_MIWT4_4_PLR1_SU0_SUM0_SUS0_VWA4_VWB4_WGM6_WGMXCC1_WGMXCCGn1
    SolutionIndex: 44
    SolutionNameMin: Cijk_Alik_Bjlk_HSS_BH_Bias_HAS_SAV_UserArgs_MT128x128x64_MI16x16x1_SN_LDSB1_CLR1_GSU0_GSUC0_GSUWGMRR0_K1_LBSPPA512_LBSPPB512_LPB0_MIWT4_4_PLR1_SU0_SUM0_SUS0_VWA4_VWB4_WGM6_WGMXCC1_WGMXCCGn1
    SolutionIndex: 45
    SolutionNameMin: Cijk_Alik_Bjlk_HSS_BH_Bias_HAS_SAV_UserArgs_MT128x128x64_MI16x16x1_SN_LDSB1_CLR1_GSU0_GSUC0_GSUWGMRR0_K1_LBSPPA512_LBSPPB512_LPB0_MIWT4_4_PLR1_SU0_SUM0_SUS0_VWA4_VWB4_WGM6_WGMXCC1_WGMXCCGn1
    SolutionIndex: 46
    SolutionNameMin: Cijk_Alik_Bjlk_HSS_BH_Bias_HAS_SAV_UserArgs_MT128x128x64_MI16x16x1_SN_LDSB1_CLR1_GSU0_GSUC0_GSUWGMRR0_K1_LBSPPA512_LBSPPB1024_LPB0_MIWT4_4_PLR1_SU0_SUM0_SUS0_VWA4_VWB4_WGM6_WGMXCC1_WGMXCCGn1
    SolutionIndex: 47
    SolutionNameMin: Cijk_Alik_Bjlk_HSS_BH_Bias_HAS_SAV_UserArgs_MT128x128x64_MI16x16x1_SN_LDSB1_CLR1_GSU0_GSUC0_GSUWGMRR0_K1_LBSPPA512_LBSPPB2048_LPB0_MIWT4_4_PLR1_SU0_SUM0_SUS0_VWA4_VWB4_WGM6_WGMXCC1_WGMXCCGn1
    SolutionIndex: 48
    SolutionNameMin: Cijk_Alik_Bjlk_HSS_BH_Bias_HAS_SAV_UserArgs_MT128x128x64_MI16x16x1_SN_LDSB1_CLR1_GSU0_GSUC0_GSUWGMRR0_K1_LBSPPA512_LBSPPB512_LPB0_MIWT4_4_PLR1_SU0_SUM0_SUS0_VWA4_VWB4_WGM8_WGMXCC1_WGMXCCGn1
    SolutionIndex: 49
    SolutionNameMin: Cijk_Alik_Bjlk_HSS_BH_Bias_HAS_SAV_UserArgs_MT128x128x64_MI16x16x1_SN_LDSB1_CLR1_GSU0_GSUC0_GSUWGMRR0_K1_LBSPPA512_LBSPPB512_LPB0_MIWT4_4_PLR1_SU0_SUM0_SUS0_VWA4_VWB4_WGM8_WGMXCC1_WGMXCCGn1
    SolutionIndex: 50
    SolutionNameMin: Cijk_Alik_Bjlk_HSS_BH_Bias_HAS_SAV_UserArgs_MT128x128x64_MI16x16x1_SN_LDSB1_CLR1_GSU0_GSUC0_GSUWGMRR0_K1_LBSPPA512_LBSPPB1024_LPB0_MIWT4_4_PLR1_SU0_SUM0_SUS0_VWA4_VWB4_WGM8_WGMXCC1_WGMXCCGn1
    SolutionIndex: 51
    SolutionNameMin: Cijk_Alik_Bjlk_HSS_BH_Bias_HAS_SAV_UserArgs_MT128x128x64_MI16x16x1_SN_LDSB1_CLR1_GSU0_GSUC0_GSUWGMRR0_K1_LBSPPA512_LBSPPB2048_LPB0_MIWT4_4_PLR1_SU0_SUM0_SUS0_VWA4_VWB4_WGM8_WGMXCC1_WGMXCCGn1
    SolutionIndex: 52
    SolutionNameMin: Cijk_Alik_Bjlk_HSS_BH_Bias_HAS_SAV_UserArgs_MT64x128x64_MI16x16x1_SN_LDSB1_CLR1_GSU0_GSUC0_GSUWGMRR0_K1_LBSPPA256_LBSPPB512_LPB0_MIWT2_4_PLR1_SU0_SUM0_SUS0_VWA2_VWB4_WGM1_WGMXCC1_WGMXCCGn1
    SolutionIndex: 53
    SolutionNameMin: Cijk_Alik_Bjlk_HSS_BH_Bias_HAS_SAV_UserArgs_MT64x128x64_MI16x16x1_SN_LDSB1_CLR1_GSU0_GSUC0_GSUWGMRR0_K1_LBSPPA256_LBSPPB2048_LPB0_MIWT2_4_PLR1_SU0_SUM0_SUS0_VWA2_VWB4_WGM8_WGMXCC1_WGMXCCGn1
    SolutionIndex: 54
    SolutionNameMin: Cijk_Alik_Bjlk_HSS_BH_Bias_HAS_SAV_UserArgs_MT128x64x64_MI16x16x1_SN_LDSB1_CLR1_GSU0_GSUC0_GSUWGMRR0_K1_LBSPPA512_LBSPPB512_LPB32_MIWT4_2_PLR1_SU0_SUM0_SUS0_VWA4_VWB2_WGM1_WGMXCC1_WGMXCCGn1
    SolutionIndex: 55
    SolutionNameMin: Cijk_Alik_Bjlk_HSS_BH_Bias_HAS_SAV_UserArgs_MT128x64x64_MI16x16x1_SN_LDSB1_CLR1_GSU0_GSUC0_GSUWGMRR0_K1_LBSPPA512_LBSPPB1024_LPB32_MIWT4_2_PLR1_SU0_SUM0_SUS0_VWA4_VWB2_WGM1_WGMXCC1_WGMXCCGn1
    SolutionIndex: 56
    SolutionNameMin: Cijk_Alik_Bjlk_HSS_BH_Bias_HAS_SAV_UserArgs_MT128x64x64_MI16x16x1_SN_LDSB1_CLR1_GSU0_GSUC0_GSUWGMRR0_K1_LBSPPA512_LBSPPB1024_LPB32_MIWT4_2_PLR1_SU0_SUM0_SUS0_VWA4_VWB2_WGM1_WGMXCC1_WGMXCCGn1
    SolutionIndex: 57
    SolutionNameMin: Cijk_Alik_Bjlk_HSS_BH_Bias_HAS_SAV_UserArgs_MT128x64x64_MI16x16x1_SN_LDSB1_CLR1_GSU0_GSUC0_GSUWGMRR0_K1_LBSPPA512_LBSPPB1024_LPB32_MIWT4_2_PLR1_SU0_SUM0_SUS0_VWA4_VWB2_WGM1_WGMXCC1_WGMXCCGn1
    SolutionIndex: 58
    SolutionNameMin: Cijk_Alik_Bjlk_HSS_BH_Bias_HAS_SAV_UserArgs_MT128x64x64_MI16x16x1_SN_LDSB1_CLR1_GSU0_GSUC0_GSUWGMRR0_K1_LBSPPA512_LBSPPB1024_LPB32_MIWT4_2_PLR1_SU0_SUM0_SUS0_VWA4_VWB2_WGM6_WGMXCC1_WGMXCCGn1
    SolutionIndex: 59
    SolutionNameMin: Cijk_Alik_Bjlk_HSS_BH_Bias_HAS_SAV_UserArgs_MT128x64x64_MI16x16x1_SN_LDSB1_CLR1_GSU0_GSUC0_GSUWGMRR0_K1_LBSPPA512_LBSPPB512_LPB32_MIWT4_2_PLR1_SU0_SUM0_SUS0_VWA4_VWB2_WGM8_WGMXCC1_WGMXCCGn1
    SolutionIndex: 60
    SolutionNameMin: Cijk_Alik_Bjlk_HSS_BH_Bias_HAS_SAV_UserArgs_MT128x64x64_MI16x16x1_SN_LDSB1_CLR1_GSU0_GSUC0_GSUWGMRR0_K1_LBSPPA512_LBSPPB1024_LPB32_MIWT4_2_PLR1_SU0_SUM0_SUS0_VWA4_VWB2_WGM8_WGMXCC1_WGMXCCGn1
    SolutionIndex: 61
    SolutionNameMin: Cijk_Alik_Bjlk_HSS_BH_Bias_HAS_SAV_UserArgs_MT128x64x64_MI16x16x1_SN_LDSB1_CLR1_GSU0_GSUC0_GSUWGMRR0_K1_LBSPPA512_LBSPPB1024_LPB32_MIWT4_2_PLR1_SU0_SUM0_SUS0_VWA4_VWB2_WGM8_WGMXCC1_WGMXCCGn1
    SolutionIndex: 62
    SolutionNameMin: Cijk_Alik_Bjlk_HSS_BH_Bias_HAS_SAV_UserArgs_MT256x256x64_MI32x32x1_SN_LDSB1_CLR1_GSU0_GSUC0_GSUWGMRR0_K1_LBSPPA512_LBSPPB0_LPB0_MIWT4_4_PLR1_SU0_SUM0_SUS0_VWA4_VWB4_WGM1_WGMXCC1_WGMXCCGn1
    SolutionIndex: 63
    SolutionNameMin: Cijk_Alik_Bjlk_HSS_BH_Bias_HAS_SAV_UserArgs_MT256x256x64_MI32x32x1_SN_LDSB1_CLR1_GSU0_GSUC0_GSUWGMRR0_K1_LBSPPA512_LBSPPB0_LPB0_MIWT4_4_PLR1_SU0_SUM0_SUS0_VWA4_VWB4_WGM1_WGMXCC1_WGMXCCGn1
    SolutionIndex: 64
    SolutionNameMin: Cijk_Alik_Bjlk_HSS_BH_Bias_HAS_SAV_UserArgs_MT256x256x64_MI32x32x1_SN_LDSB1_CLR1_GSU0_GSUC0_GSUWGMRR0_K1_LBSPPA512_LBSPPB0_LPB0_MIWT4_4_PLR1_SU0_SUM0_SUS0_VWA4_VWB4_WGM1_WGMXCC1_WGMXCCGn1
    SolutionIndex: 65
    SolutionNameMin: Cijk_Alik_Bjlk_HSS_BH_Bias_HAS_SAV_UserArgs_MT256x256x64_MI32x32x1_SN_LDSB1_CLR1_GSU0_GSUC0_GSUWGMRR0_K1_LBSPPA512_LBSPPB0_LPB0_MIWT4_4_PLR1_SU0_SUM0_SUS0_VWA4_VWB4_WGM6_WGMXCC1_WGMXCCGn1
    SolutionIndex: 66
    SolutionNameMin: Cijk_Alik_Bjlk_HSS_BH_Bias_HAS_SAV_UserArgs_MT256x256x64_MI32x32x1_SN_LDSB1_CLR1_GSU0_GSUC0_GSUWGMRR0_K1_LBSPPA512_LBSPPB0_LPB0_MIWT4_4_PLR1_SU0_SUM0_SUS0_VWA4_VWB4_WGM6_WGMXCC1_WGMXCCGn1
    SolutionIndex: 67
    SolutionNameMin: Cijk_Alik_Bjlk_HSS_BH_Bias_HAS_SAV_UserArgs_MT256x256x64_MI32x32x1_SN_LDSB1_CLR1_GSU0_GSUC0_GSUWGMRR0_K1_LBSPPA512_LBSPPB0_LPB0_MIWT4_4_PLR1_SU0_SUM0_SUS0_VWA4_VWB4_WGM6_WGMXCC1_WGMXCCGn1
    SolutionIndex: 68
    SolutionNameMin: Cijk_Alik_Bjlk_HSS_BH_Bias_HAS_SAV_UserArgs_MT256x256x64_MI32x32x1_SN_LDSB1_CLR1_GSU0_GSUC0_GSUWGMRR0_K1_LBSPPA512_LBSPPB0_LPB0_MIWT4_4_PLR1_SU0_SUM0_SUS0_VWA4_VWB4_WGM8_WGMXCC1_WGMXCCGn1
    SolutionIndex: 69
    SolutionNameMin: Cijk_Alik_Bjlk_HSS_BH_Bias_HAS_SAV_UserArgs_MT256x128x64_MI32x32x1_SN_LDSB1_CLR1_GSU0_GSUC0_GSUWGMRR0_K1_LBSPPA512_LBSPPB0_LPB0_MIWT4_2_PLR1_SU0_SUM0_SUS0_VWA4_VWB2_WGM8_WGMXCC1_WGMXCCGn1
    SolutionIndex: 70
    SolutionNameMin: Cijk_Alik_Bjlk_HSS_BH_Bias_HAS_SAV_UserArgs_MT128x128x64_MI32x32x1_SN_LDSB1_CLR1_GSU0_GSUC0_GSUWGMRR0_K1_LBSPPA256_LBSPPB0_LPB0_MIWT2_2_PLR1_SU0_SUM0_SUS0_VWA2_VWB2_WGM1_WGMXCC1_WGMXCCGn1
    SolutionIndex: 71
    SolutionNameMin: Cijk_Alik_Bjlk_HSS_BH_Bias_HAS_SAV_UserArgs_MT128x128x64_MI32x32x1_SN_LDSB1_CLR1_GSU0_GSUC0_GSUWGMRR0_K1_LBSPPA256_LBSPPB0_LPB0_MIWT2_2_PLR1_SU0_SUM0_SUS0_VWA2_VWB2_WGM6_WGMXCC1_WGMXCCGn1
    SolutionIndex: 72
    SolutionNameMin: Cijk_Alik_Bjlk_HSS_BH_Bias_HAS_SAV_UserArgs_MT128x128x64_MI32x32x1_SN_LDSB1_CLR1_GSU0_GSUC0_GSUWGMRR0_K1_LBSPPA256_LBSPPB0_LPB0_MIWT2_2_PLR1_SU0_SUM0_SUS0_VWA2_VWB2_WGM6_WGMXCC1_WGMXCCGn1
    SolutionIndex: 73
    SolutionNameMin: Cijk_Alik_Bjlk_HSS_BH_Bias_HAS_SAV_UserArgs_MT64x128x64_MI32x32x1_SN_LDSB1_CLR1_GSU0_GSUC0_GSUWGMRR0_K1_LBSPPA128_LBSPPB0_LPB0_MIWT1_2_PLR1_SU0_SUM0_SUS0_VWA1_VWB2_WGM8_WGMXCC1_WGMXCCGn1
    SolutionIndex: 74
    SolutionNameMin: Cijk_Alik_Bjlk_HSS_BH_Bias_HAS_SAV_UserArgs_MT128x128x128_MI16x16x1_SN_LDSB1_CLR1_GSU0_GSUC0_GSUWGMRR0_K1_LBSPPA1024_LBSPPB2048_LPB0_MIWT4_4_PLR1_SU0_SUM0_SUS0_VWA4_VWB4_WGM1_WGMXCC1_WGMXCCGn1
    SolutionIndex: 75
    SolutionNameMin: Cijk_Alik_Bjlk_HSS_BH_Bias_HAS_SAV_UserArgs_MT128x128x128_MI16x16x1_SN_LDSB1_CLR1_GSU0_GSUC0_GSUWGMRR0_K1_LBSPPA1024_LBSPPB1024_LPB0_MIWT4_4_PLR1_SU0_SUM0_SUS0_VWA4_VWB4_WGM6_WGMXCC1_WGMXCCGn1
    SolutionIndex: 76
    SolutionNameMin: Cijk_Alik_Bjlk_HSS_BH_Bias_HAS_SAV_UserArgs_MT128x128x128_MI16x16x1_SN_LDSB1_CLR1_GSU0_GSUC0_GSUWGMRR0_K1_LBSPPA1024_LBSPPB2048_LPB0_MIWT4_4_PLR1_SU0_SUM0_SUS0_VWA4_VWB4_WGM6_WGMXCC1_WGMXCCGn1
    SolutionIndex: 77
    SolutionNameMin: Cijk_Alik_Bjlk_HSS_BH_Bias_HAS_SAV_UserArgs_MT128x128x128_MI16x16x1_SN_LDSB1_CLR1_GSU0_GSUC0_GSUWGMRR0_K1_LBSPPA1024_LBSPPB2048_LPB0_MIWT4_4_PLR1_SU0_SUM0_SUS0_VWA4_VWB4_WGM8_WGMXCC1_WGMXCCGn1
    SolutionIndex: 78
    SolutionNameMin: Cijk_Alik_Bjlk_HSS_BH_Bias_HAS_SAV_UserArgs_MT128x128x128_MI16x16x1_SN_LDSB1_CLR1_GSU0_GSUC0_GSUWGMRR0_K1_LBSPPA1024_LBSPPB2048_LPB0_MIWT4_4_PLR1_SU0_SUM0_SUS0_VWA4_VWB4_WGM8_WGMXCC1_WGMXCCGn1
    SolutionIndex: 79
    SolutionNameMin: Cijk_Alik_Bjlk_HSS_BH_Bias_HAS_SAV_UserArgs_MT64x128x128_MI16x16x1_SN_LDSB1_CLR1_GSU0_GSUC0_GSUWGMRR0_K1_LBSPPA512_LBSPPB2048_LPB0_MIWT2_4_PLR1_SU0_SUM0_SUS0_VWA2_VWB4_WGM1_WGMXCC1_WGMXCCGn1
    SolutionIndex: 80
    SolutionNameMin: Cijk_Alik_Bjlk_HSS_BH_Bias_HAS_SAV_UserArgs_MT64x128x128_MI16x16x1_SN_LDSB1_CLR1_GSU0_GSUC0_GSUWGMRR0_K1_LBSPPA512_LBSPPB1024_LPB0_MIWT2_4_PLR1_SU0_SUM0_SUS0_VWA2_VWB4_WGM6_WGMXCC1_WGMXCCGn1
    SolutionIndex: 81
    SolutionNameMin: Cijk_Alik_Bjlk_HSS_BH_Bias_HAS_SAV_UserArgs_MT64x128x128_MI16x16x1_SN_LDSB1_CLR1_GSU0_GSUC0_GSUWGMRR0_K1_LBSPPA512_LBSPPB2048_LPB0_MIWT2_4_PLR1_SU0_SUM0_SUS0_VWA2_VWB4_WGM6_WGMXCC1_WGMXCCGn1
    SolutionIndex: 82
    SolutionNameMin: Cijk_Alik_Bjlk_HSS_BH_Bias_HAS_SAV_UserArgs_MT64x128x128_MI16x16x1_SN_LDSB1_CLR1_GSU0_GSUC0_GSUWGMRR0_K1_LBSPPA512_LBSPPB2048_LPB0_MIWT2_4_PLR1_SU0_SUM0_SUS0_VWA2_VWB4_WGM6_WGMXCC1_WGMXCCGn1
    SolutionIndex: 83
    SolutionNameMin: Cijk_Alik_Bjlk_HSS_BH_Bias_HAS_SAV_UserArgs_MT64x128x128_MI16x16x1_SN_LDSB1_CLR1_GSU0_GSUC0_GSUWGMRR0_K1_LBSPPA512_LBSPPB512_LPB0_MIWT2_4_PLR1_SU0_SUM0_SUS0_VWA2_VWB4_WGM8_WGMXCC1_WGMXCCGn1
    SolutionIndex: 84
    SolutionNameMin: Cijk_Alik_Bjlk_HSS_BH_Bias_HAS_SAV_UserArgs_MT64x128x128_MI16x16x1_SN_LDSB1_CLR1_GSU0_GSUC0_GSUWGMRR0_K1_LBSPPA512_LBSPPB2048_LPB0_MIWT2_4_PLR1_SU0_SUM0_SUS0_VWA2_VWB4_WGM8_WGMXCC1_WGMXCCGn1
    SolutionIndex: 85
    SolutionNameMin: Cijk_Alik_Bjlk_HSS_BH_Bias_HAS_SAV_UserArgs_MT64x128x128_MI16x16x1_SN_LDSB1_CLR1_GSU0_GSUC0_GSUWGMRR0_K1_LBSPPA512_LBSPPB2048_LPB0_MIWT2_4_PLR1_SU0_SUM0_SUS0_VWA2_VWB4_WGM8_WGMXCC1_WGMXCCGn1
    SolutionIndex: 86
    SolutionNameMin: Cijk_Alik_Bjlk_HSS_BH_Bias_HAS_SAV_UserArgs_MT128x64x128_MI16x16x1_SN_LDSB1_CLR1_GSU0_GSUC0_GSUWGMRR0_K1_LBSPPA1024_LBSPPB1024_LPB32_MIWT4_2_PLR1_SU0_SUM0_SUS0_VWA4_VWB2_WGM1_WGMXCC1_WGMXCCGn1
    SolutionIndex: 87
    SolutionNameMin: Cijk_Alik_Bjlk_HSS_BH_Bias_HAS_SAV_UserArgs_MT128x64x128_MI16x16x1_SN_LDSB1_CLR1_GSU0_GSUC0_GSUWGMRR0_K1_LBSPPA1024_LBSPPB1024_LPB32_MIWT4_2_PLR1_SU0_SUM0_SUS0_VWA4_VWB2_WGM1_WGMXCC1_WGMXCCGn1
    SolutionIndex: 88
    SolutionNameMin: Cijk_Alik_Bjlk_HSS_BH_Bias_HAS_SAV_UserArgs_MT128x64x128_MI16x16x1_SN_LDSB1_CLR1_GSU0_GSUC0_GSUWGMRR0_K1_LBSPPA1024_LBSPPB512_LPB32_MIWT4_2_PLR1_SU0_SUM0_SUS0_VWA4_VWB2_WGM6_WGMXCC1_WGMXCCGn1
    SolutionIndex: 89
    SolutionNameMin: Cijk_Alik_Bjlk_HSS_BH_Bias_HAS_SAV_UserArgs_MT128x64x128_MI16x16x1_SN_LDSB1_CLR1_GSU0_GSUC0_GSUWGMRR0_K1_LBSPPA1024_LBSPPB1024_LPB32_MIWT4_2_PLR1_SU0_SUM0_SUS0_VWA4_VWB2_WGM6_WGMXCC1_WGMXCCGn1
    SolutionIndex: 90
    SolutionNameMin: Cijk_Alik_Bjlk_HSS_BH_Bias_HAS_SAV_UserArgs_MT128x64x128_MI16x16x1_SN_LDSB1_CLR1_GSU0_GSUC0_GSUWGMRR0_K1_LBSPPA1024_LBSPPB512_LPB32_MIWT4_2_PLR1_SU0_SUM0_SUS0_VWA4_VWB2_WGM8_WGMXCC1_WGMXCCGn1
    SolutionIndex: 91
    SolutionNameMin: Cijk_Alik_Bjlk_HSS_BH_Bias_HAS_SAV_UserArgs_MT128x64x128_MI16x16x1_SN_LDSB1_CLR1_GSU0_GSUC0_GSUWGMRR0_K1_LBSPPA1024_LBSPPB1024_LPB32_MIWT4_2_PLR1_SU0_SUM0_SUS0_VWA4_VWB2_WGM8_WGMXCC1_WGMXCCGn1
    SolutionIndex: 92
    SolutionNameMin: Cijk_Alik_Bjlk_HSS_BH_Bias_HAS_SAV_UserArgs_MT64x64x128_MI16x16x1_SN_LDSB1_CLR1_GSU0_GSUC0_GSUWGMRR0_K1_LBSPPA512_LBSPPB256_LPB32_MIWT2_2_PLR1_SU0_SUM0_SUS0_VWA2_VWB2_WGM1_WGMXCC1_WGMXCCGn1
    SolutionIndex: 93
    SolutionNameMin: Cijk_Alik_Bjlk_HSS_BH_Bias_HAS_SAV_UserArgs_MT64x64x128_MI16x16x1_SN_LDSB1_CLR1_GSU0_GSUC0_GSUWGMRR0_K1_LBSPPA512_LBSPPB256_LPB32_MIWT2_2_PLR1_SU0_SUM0_SUS0_VWA2_VWB2_WGM1_WGMXCC1_WGMXCCGn1
    SolutionIndex: 94
    SolutionNameMin: Cijk_Alik_Bjlk_HSS_BH_Bias_HAS_SAV_UserArgs_MT64x64x128_MI16x16x1_SN_LDSB1_CLR1_GSU0_GSUC0_GSUWGMRR0_K1_LBSPPA512_LBSPPB512_LPB32_MIWT2_2_PLR1_SU0_SUM0_SUS0_VWA2_VWB2_WGM1_WGMXCC1_WGMXCCGn1
    SolutionIndex: 95
    SolutionNameMin: Cijk_Alik_Bjlk_HSS_BH_Bias_HAS_SAV_UserArgs_MT64x64x128_MI16x16x1_SN_LDSB1_CLR1_GSU0_GSUC0_GSUWGMRR0_K1_LBSPPA512_LBSPPB1024_LPB32_MIWT2_2_PLR1_SU0_SUM0_SUS0_VWA2_VWB2_WGM1_WGMXCC1_WGMXCCGn1
    SolutionIndex: 96
    SolutionNameMin: Cijk_Alik_Bjlk_HSS_BH_Bias_HAS_SAV_UserArgs_MT64x64x128_MI16x16x1_SN_LDSB1_CLR1_GSU0_GSUC0_GSUWGMRR0_K1_LBSPPA512_LBSPPB256_LPB32_MIWT2_2_PLR1_SU0_SUM0_SUS0_VWA2_VWB2_WGM6_WGMXCC1_WGMXCCGn1
    SolutionIndex: 97
    SolutionNameMin: Cijk_Alik_Bjlk_HSS_BH_Bias_HAS_SAV_UserArgs_MT64x64x128_MI16x16x1_SN_LDSB1_CLR1_GSU0_GSUC0_GSUWGMRR0_K1_LBSPPA512_LBSPPB512_LPB32_MIWT2_2_PLR1_SU0_SUM0_SUS0_VWA2_VWB2_WGM6_WGMXCC1_WGMXCCGn1
    SolutionIndex: 98
    SolutionNameMin: Cijk_Alik_Bjlk_HSS_BH_Bias_HAS_SAV_UserArgs_MT64x64x128_MI16x16x1_SN_LDSB1_CLR1_GSU0_GSUC0_GSUWGMRR0_K1_LBSPPA512_LBSPPB1024_LPB32_MIWT2_2_PLR1_SU0_SUM0_SUS0_VWA2_VWB2_WGM6_WGMXCC1_WGMXCCGn1
    SolutionIndex: 99
    SolutionNameMin: Cijk_Alik_Bjlk_HSS_BH_Bias_HAS_SAV_UserArgs_MT64x64x128_MI16x16x1_SN_LDSB1_CLR1_GSU0_GSUC0_GSUWGMRR0_K1_LBSPPA512_LBSPPB512_LPB32_MIWT2_2_PLR1_SU0_SUM0_SUS0_VWA2_VWB2_WGM8_WGMXCC1_WGMXCCGn1
    SolutionIndex: 100
    SolutionNameMin: Cijk_Alik_Bjlk_HSS_BH_Bias_HAS_SAV_UserArgs_MT64x64x128_MI16x16x1_SN_LDSB1_CLR1_GSU0_GSUC0_GSUWGMRR0_K1_LBSPPA512_LBSPPB512_LPB32_MIWT2_2_PLR1_SU0_SUM0_SUS0_VWA2_VWB2_WGM8_WGMXCC1_WGMXCCGn1
    SolutionIndex: 101
    SolutionNameMin: Cijk_Alik_Bjlk_HSS_BH_Bias_HAS_SAV_UserArgs_MT64x64x128_MI16x16x1_SN_LDSB1_CLR1_GSU0_GSUC0_GSUWGMRR0_K1_LBSPPA512_LBSPPB1024_LPB32_MIWT2_2_PLR1_SU0_SUM0_SUS0_VWA2_VWB2_WGM8_WGMXCC1_WGMXCCGn1
    SolutionIndex: 102
    SolutionNameMin: Cijk_Alik_Bjlk_HSS_BH_Bias_HAS_SAV_UserArgs_MT64x64x128_MI16x16x1_SN_LDSB1_CLR1_GSU0_GSUC0_GSUWGMRR0_K1_LBSPPA512_LBSPPB1024_LPB32_MIWT2_2_PLR1_SU0_SUM0_SUS0_VWA2_VWB2_WGM8_WGMXCC1_WGMXCCGn1
    SolutionIndex: 103
    SolutionNameMin: Cijk_Alik_Bjlk_HSS_BH_Bias_HAS_SAV_UserArgs_MT64x64x128_MI16x16x1_SN_LDSB1_CLR1_GSU0_GSUC0_GSUWGMRR0_K1_LBSPPA512_LBSPPB1024_LPB32_MIWT2_2_PLR1_SU0_SUM0_SUS0_VWA2_VWB2_WGM8_WGMXCC1_WGMXCCGn1
    SolutionIndex: 104
    SolutionNameMin: Cijk_Alik_Bjlk_HSS_BH_Bias_HAS_SAV_UserArgs_MT32x64x128_MI16x16x1_SN_LDSB1_CLR1_GSU0_GSUC0_GSUWGMRR0_K1_LBSPPA256_LBSPPB512_LPB32_MIWT1_2_PLR1_SU0_SUM0_SUS0_VWA1_VWB2_WGM1_WGMXCC1_WGMXCCGn1
    SolutionIndex: 105
    SolutionNameMin: Cijk_Alik_Bjlk_HSS_BH_Bias_HAS_SAV_UserArgs_MT32x64x128_MI16x16x1_SN_LDSB1_CLR1_GSU0_GSUC0_GSUWGMRR0_K1_LBSPPA256_LBSPPB1024_LPB32_MIWT1_2_PLR1_SU0_SUM0_SUS0_VWA1_VWB2_WGM1_WGMXCC1_WGMXCCGn1
    SolutionIndex: 106
    SolutionNameMin: Cijk_Alik_Bjlk_HSS_BH_Bias_HAS_SAV_UserArgs_MT32x64x128_MI16x16x1_SN_LDSB1_CLR1_GSU0_GSUC0_GSUWGMRR0_K1_LBSPPA256_LBSPPB1024_LPB32_MIWT1_2_PLR1_SU0_SUM0_SUS0_VWA1_VWB2_WGM1_WGMXCC1_WGMXCCGn1
    SolutionIndex: 107
    SolutionNameMin: Cijk_Alik_Bjlk_HSS_BH_Bias_HAS_SAV_UserArgs_MT32x64x128_MI16x16x1_SN_LDSB1_CLR1_GSU0_GSUC0_GSUWGMRR0_K1_LBSPPA256_LBSPPB1024_LPB32_MIWT1_2_PLR1_SU0_SUM0_SUS0_VWA1_VWB2_WGM1_WGMXCC1_WGMXCCGn1
    SolutionIndex: 108
    SolutionNameMin: Cijk_Alik_Bjlk_HSS_BH_Bias_HAS_SAV_UserArgs_MT32x64x128_MI16x16x1_SN_LDSB1_CLR1_GSU0_GSUC0_GSUWGMRR0_K1_LBSPPA256_LBSPPB1024_LPB32_MIWT1_2_PLR1_SU0_SUM0_SUS0_VWA1_VWB2_WGM8_WGMXCC1_WGMXCCGn1
    SolutionIndex: 109
    SolutionNameMin: Cijk_Alik_Bjlk_HSS_BH_Bias_HAS_SAV_UserArgs_MT32x32x128_MI16x16x1_SN_LDSB1_CLR1_GSU0_GSUC0_GSUWGMRR0_K1_LBSPPA256_LBSPPB256_LPB16_MIWT1_1_PLR1_SU0_SUM0_SUS0_VWA1_VWB1_WGM1_WGMXCC1_WGMXCCGn1
    SolutionIndex: 110
    SolutionNameMin: Cijk_Alik_Bjlk_HSS_BH_Bias_HAS_SAV_UserArgs_MT32x32x128_MI16x16x1_SN_LDSB1_CLR1_GSU0_GSUC0_GSUWGMRR0_K1_LBSPPA256_LBSPPB256_LPB16_MIWT1_1_PLR1_SU0_SUM0_SUS0_VWA1_VWB1_WGM1_WGMXCC1_WGMXCCGn1
    SolutionIndex: 111
    SolutionNameMin: Cijk_Alik_Bjlk_HSS_BH_Bias_HAS_SAV_UserArgs_MT32x32x128_MI16x16x1_SN_LDSB1_CLR1_GSU0_GSUC0_GSUWGMRR0_K1_LBSPPA256_LBSPPB512_LPB16_MIWT1_1_PLR1_SU0_SUM0_SUS0_VWA1_VWB1_WGM1_WGMXCC1_WGMXCCGn1
    SolutionIndex: 112
    SolutionNameMin: Cijk_Alik_Bjlk_HSS_BH_Bias_HAS_SAV_UserArgs_MT32x32x128_MI16x16x1_SN_LDSB1_CLR1_GSU0_GSUC0_GSUWGMRR0_K1_LBSPPA256_LBSPPB512_LPB16_MIWT1_1_PLR1_SU0_SUM0_SUS0_VWA1_VWB1_WGM1_WGMXCC1_WGMXCCGn1
    SolutionIndex: 113
    SolutionNameMin: Cijk_Alik_Bjlk_HSS_BH_Bias_HAS_SAV_UserArgs_MT32x32x128_MI16x16x1_SN_LDSB1_CLR1_GSU0_GSUC0_GSUWGMRR0_K1_LBSPPA256_LBSPPB512_LPB16_MIWT1_1_PLR1_SU0_SUM0_SUS0_VWA1_VWB1_WGM1_WGMXCC1_WGMXCCGn1
    SolutionIndex: 114
    SolutionNameMin: Cijk_Alik_Bjlk_HSS_BH_Bias_HAS_SAV_UserArgs_MT32x32x128_MI16x16x1_SN_LDSB1_CLR1_GSU0_GSUC0_GSUWGMRR0_K1_LBSPPA256_LBSPPB512_LPB16_MIWT1_1_PLR1_SU0_SUM0_SUS0_VWA1_VWB1_WGM1_WGMXCC1_WGMXCCGn1
    SolutionIndex: 115
    SolutionNameMin: Cijk_Alik_Bjlk_HSS_BH_Bias_HAS_SAV_UserArgs_MT32x32x128_MI16x16x1_SN_LDSB1_CLR1_GSU0_GSUC0_GSUWGMRR0_K1_LBSPPA256_LBSPPB512_LPB16_MIWT1_1_PLR1_SU0_SUM0_SUS0_VWA1_VWB1_WGM1_WGMXCC1_WGMXCCGn1
    SolutionIndex: 116
    SolutionNameMin: Cijk_Alik_Bjlk_HSS_BH_Bias_HAS_SAV_UserArgs_MT64x64x128_MI32x32x1_SN_LDSB1_CLR1_GSU0_GSUC0_GSUWGMRR0_K1_LBSPPA256_LBSPPB0_LPB0_MIWT1_1_PLR1_SU0_SUM0_SUS0_VWA1_VWB1_WGM6_WGMXCC1_WGMXCCGn1
    SolutionIndex: 117
    SolutionNameMin: Cijk_Alik_Bjlk_HSS_BH_Bias_HAS_SAV_UserArgs_MT64x64x256_MI16x16x1_SN_LDSB1_CLR1_GSU0_GSUC0_GSUWGMRR0_K1_LBSPPA1024_LBSPPB1024_LPB32_MIWT2_2_PLR1_SU0_SUM0_SUS0_VWA2_VWB2_WGM8_WGMXCC1_WGMXCCGn1
    SolutionIndex: 118
    SolutionNameMin: Cijk_Alik_Bjlk_HSS_BH_Bias_HAS_SAV_UserArgs_MT32x64x256_MI16x16x1_SN_LDSB1_CLR1_GSU0_GSUC0_GSUWGMRR0_K1_LBSPPA512_LBSPPB256_LPB32_MIWT1_2_PLR1_SU0_SUM0_SUS0_VWA1_VWB2_WGM1_WGMXCC1_WGMXCCGn1
    SolutionIndex: 119
    SolutionNameMin: Cijk_Alik_Bjlk_HSS_BH_Bias_HAS_SAV_UserArgs_MT32x64x256_MI16x16x1_SN_LDSB1_CLR1_GSU0_GSUC0_GSUWGMRR0_K1_LBSPPA512_LBSPPB512_LPB32_MIWT1_2_PLR1_SU0_SUM0_SUS0_VWA1_VWB2_WGM1_WGMXCC1_WGMXCCGn1
    SolutionIndex: 120
    SolutionNameMin: Cijk_Alik_Bjlk_HSS_BH_Bias_HAS_SAV_UserArgs_MT32x64x256_MI16x16x1_SN_LDSB1_CLR1_GSU0_GSUC0_GSUWGMRR0_K1_LBSPPA512_LBSPPB512_LPB32_MIWT1_2_PLR1_SU0_SUM0_SUS0_VWA1_VWB2_WGM1_WGMXCC1_WGMXCCGn1
    SolutionIndex: 121
    SolutionNameMin: Cijk_Alik_Bjlk_HSS_BH_Bias_HAS_SAV_UserArgs_MT32x64x256_MI16x16x1_SN_LDSB1_CLR1_GSU0_GSUC0_GSUWGMRR0_K1_LBSPPA512_LBSPPB1024_LPB32_MIWT1_2_PLR1_SU0_SUM0_SUS0_VWA1_VWB2_WGM1_WGMXCC1_WGMXCCGn1
    SolutionIndex: 122
    SolutionNameMin: Cijk_Alik_Bjlk_HSS_BH_Bias_HAS_SAV_UserArgs_MT32x64x256_MI16x16x1_SN_LDSB1_CLR1_GSU0_GSUC0_GSUWGMRR0_K1_LBSPPA512_LBSPPB1024_LPB32_MIWT1_2_PLR1_SU0_SUM0_SUS0_VWA1_VWB2_WGM1_WGMXCC1_WGMXCCGn1
    SolutionIndex: 123
    SolutionNameMin: Cijk_Alik_Bjlk_HSS_BH_Bias_HAS_SAV_UserArgs_MT32x64x256_MI16x16x1_SN_LDSB1_CLR1_GSU0_GSUC0_GSUWGMRR0_K1_LBSPPA512_LBSPPB512_LPB32_MIWT1_2_PLR1_SU0_SUM0_SUS0_VWA1_VWB2_WGM6_WGMXCC1_WGMXCCGn1
    SolutionIndex: 124
    SolutionNameMin: Cijk_Alik_Bjlk_HSS_BH_Bias_HAS_SAV_UserArgs_MT32x64x256_MI16x16x1_SN_LDSB1_CLR1_GSU0_GSUC0_GSUWGMRR0_K1_LBSPPA512_LBSPPB1024_LPB32_MIWT1_2_PLR1_SU0_SUM0_SUS0_VWA1_VWB2_WGM6_WGMXCC1_WGMXCCGn1
    SolutionIndex: 125
    SolutionNameMin: Cijk_Alik_Bjlk_HSS_BH_Bias_HAS_SAV_UserArgs_MT32x64x256_MI16x16x1_SN_LDSB1_CLR1_GSU0_GSUC0_GSUWGMRR0_K1_LBSPPA512_LBSPPB1024_LPB32_MIWT1_2_PLR1_SU0_SUM0_SUS0_VWA1_VWB2_WGM6_WGMXCC1_WGMXCCGn1
    SolutionIndex: 126
    SolutionNameMin: Cijk_Alik_Bjlk_HSS_BH_Bias_HAS_SAV_UserArgs_MT32x64x256_MI16x16x1_SN_LDSB1_CLR1_GSU0_GSUC0_GSUWGMRR0_K1_LBSPPA512_LBSPPB512_LPB32_MIWT1_2_PLR1_SU0_SUM0_SUS0_VWA1_VWB2_WGM8_WGMXCC1_WGMXCCGn1
    SolutionIndex: 127
    SolutionNameMin: Cijk_Alik_Bjlk_HSS_BH_Bias_HAS_SAV_UserArgs_MT32x64x256_MI16x16x1_SN_LDSB1_CLR1_GSU0_GSUC0_GSUWGMRR0_K1_LBSPPA512_LBSPPB1024_LPB32_MIWT1_2_PLR1_SU0_SUM0_SUS0_VWA1_VWB2_WGM8_WGMXCC1_WGMXCCGn1
    SolutionIndex: 128
    SolutionNameMin: Cijk_Alik_Bjlk_HSS_BH_Bias_HAS_SAV_UserArgs_MT32x32x256_MI16x16x1_SN_LDSB1_CLR1_GSU0_GSUC0_GSUWGMRR0_K1_LBSPPA512_LBSPPB256_LPB16_MIWT1_1_PLR1_SU0_SUM0_SUS0_VWA1_VWB1_WGM1_WGMXCC1_WGMXCCGn1
    SolutionIndex: 129
    SolutionNameMin: Cijk_Alik_Bjlk_HSS_BH_Bias_HAS_SAV_UserArgs_MT32x32x256_MI16x16x1_SN_LDSB1_CLR1_GSU0_GSUC0_GSUWGMRR0_K1_LBSPPA512_LBSPPB512_LPB16_MIWT1_1_PLR1_SU0_SUM0_SUS0_VWA1_VWB1_WGM1_WGMXCC1_WGMXCCGn1
    SolutionIndex: 130
    SolutionNameMin: Cijk_Alik_Bjlk_HSS_BH_Bias_HAS_SAV_UserArgs_MT32x32x256_MI16x16x1_SN_LDSB1_CLR1_GSU0_GSUC0_GSUWGMRR0_K1_LBSPPA512_LBSPPB512_LPB16_MIWT1_1_PLR1_SU0_SUM0_SUS0_VWA1_VWB1_WGM1_WGMXCC1_WGMXCCGn1
    SolutionIndex: 131
    SolutionNameMin: Cijk_Alik_Bjlk_HSS_BH_Bias_HAS_SAV_UserArgs_MT32x32x256_MI16x16x1_SN_LDSB1_CLR1_GSU0_GSUC0_GSUWGMRR0_K1_LBSPPA512_LBSPPB256_LPB16_MIWT1_1_PLR1_SU0_SUM0_SUS0_VWA1_VWB1_WGM6_WGMXCC1_WGMXCCGn1
    SolutionIndex: 132
    SolutionNameMin: Cijk_Alik_Bjlk_HSS_BH_Bias_HAS_SAV_UserArgs_MT32x32x256_MI16x16x1_SN_LDSB1_CLR1_GSU0_GSUC0_GSUWGMRR0_K1_LBSPPA512_LBSPPB512_LPB16_MIWT1_1_PLR1_SU0_SUM0_SUS0_VWA1_VWB1_WGM6_WGMXCC1_WGMXCCGn1
    SolutionIndex: 133
    SolutionNameMin: Cijk_Alik_Bjlk_HSS_BH_Bias_HAS_SAV_UserArgs_MT32x32x256_MI16x16x1_SN_LDSB1_CLR1_GSU0_GSUC0_GSUWGMRR0_K1_LBSPPA512_LBSPPB256_LPB16_MIWT1_1_PLR1_SU0_SUM0_SUS0_VWA1_VWB1_WGM8_WGMXCC1_WGMXCCGn1
    SolutionIndex: 134
    SolutionNameMin: Cijk_Alik_Bjlk_HSS_BH_Bias_HAS_SAV_UserArgs_MT32x32x256_MI16x16x1_SN_LDSB1_CLR1_GSU0_GSUC0_GSUWGMRR0_K1_LBSPPA512_LBSPPB512_LPB16_MIWT1_1_PLR1_SU0_SUM0_SUS0_VWA1_VWB1_WGM8_WGMXCC1_WGMXCCGn1
    SolutionIndex: 135
    SolutionNameMin: Cijk_Alik_Bjlk_HSS_BH_Bias_HAS_SAV_UserArgs_MT32x32x32_MI16x16x1_SN_LDSB0_CLR0_GSU0_GSUC0_GSUWGMRR0_K1_LBSPPA128_LBSPPB256_LPB16_MIWT1_1_PLR0_SU32_SUM0_SUS256_VWA1_VWB1_WGM1_WGMXCC1_WGMXCCGn1
- - - [128, 128, 1, 128, 128, 128, 128, 128]
    - [112, 0.04]
  - - [128, 128, 1, 256, 128, 128, 256, 128]
    - [115, 0.07]
  - - [128, 128, 1, 512, 128, 128, 512, 128]
    - [112, 0.119]
  - - [128, 128, 1, 1024, 128, 128, 1024, 128]
    - [130, 0.194]
  - - [128, 128, 1, 2048, 128, 128, 2048, 128]
    - [130, 0.276]
  - - [128, 128, 1, 4096, 128, 128, 4096, 128]
    - [130, 0.355]
  - - [128, 128, 1, 8192, 128, 128, 8192, 128]
    - [134, 0.414]
  - - [128, 256, 1, 128, 128, 128, 128, 256]
    - [109, 0.079]
  - - [128, 256, 1, 256, 128, 128, 256, 256]
    - [112, 0.139]
  - - [128, 256, 1, 512, 128, 128, 512, 256]
    - [130, 0.237]
  - - [128, 256, 1, 1024, 128, 128, 1024, 256]
    - [128, 0.384]
  - - [128, 256, 1, 2048, 128, 128, 2048, 256]
    - [130, 0.543]
  - - [128, 256, 1, 4096, 128, 128, 4096, 256]
    - [128, 0.69]
  - - [128, 256, 1, 8192, 128, 128, 8192, 256]
    - [128, 0.792]
  - - [128, 512, 1, 128, 128, 128, 128, 512]
    - [115, 0.154]
  - - [128, 512, 1, 256, 128, 128, 256, 512]
    - [130, 0.273]
  - - [128, 512, 1, 512, 128, 128, 512, 512]
    - [115, 0.464]
  - - [128, 512, 1, 1024, 128, 128, 1024, 512]
    - [128, 0.741]
  - - [128, 512, 1, 2048, 128, 128, 2048, 512]
    - [128, 1.031]
  - - [128, 512, 1, 4096, 128, 128, 4096, 512]
    - [128, 1.274]
  - - [128, 512, 1, 8192, 128, 128, 8192, 512]
    - [131, 1.453]
  - - [128, 1024, 1, 128, 128, 128, 128, 1024]
    - [109, 0.303]
  - - [128, 1024, 1, 256, 128, 128, 256, 1024]
    - [130, 0.538]
  - - [128, 1024, 1, 512, 128, 128, 512, 1024]
    - [112, 0.912]
  - - [128, 1024, 1, 1024, 128, 128, 1024, 1024]
    - [130, 1.447]
  - - [128, 1024, 1, 2048, 128, 128, 2048, 1024]
    - [128, 1.996]
  - - [128, 1024, 1, 4096, 128, 128, 4096, 1024]
    - [134, 2.482]
  - - [128, 1024, 1, 8192, 128, 128, 8192, 1024]
    - [134, 2.879]
  - - [128, 2048, 1, 128, 128, 128, 128, 2048]
    - [109, 0.593]
  - - [128, 2048, 1, 256, 128, 128, 256, 2048]
    - [129, 1.036]
  - - [128, 2048, 1, 512, 128, 128, 512, 2048]
    - [130, 1.774]
  - - [128, 2048, 1, 1024, 128, 128, 1024, 2048]
    - [134, 2.774]
  - - [128, 2048, 1, 2048, 128, 128, 2048, 2048]
    - [130, 3.9]
  - - [128, 2048, 1, 4096, 128, 128, 4096, 2048]
    - [131, 4.858]
  - - [128, 2048, 1, 8192, 128, 128, 8192, 2048]
    - [128, 5.086]
  - - [128, 4096, 1, 128, 128, 128, 128, 4096]
    - [106, 1.072]
  - - [128, 4096, 1, 256, 128, 128, 256, 4096]
    - [122, 1.881]
  - - [128, 4096, 1, 512, 128, 128, 512, 4096]
    - [107, 3.147]
  - - [128, 4096, 1, 1024, 128, 128, 1024, 4096]
    - [107, 4.841]
  - - [128, 4096, 1, 2048, 128, 128, 2048, 4096]
    - [107, 6.706]
  - - [128, 4096, 1, 4096, 128, 128, 4096, 4096]
    - [118, 7.876]
  - - [128, 4096, 1, 8192, 128, 128, 8192, 4096]
    - [119, 8.911]
  - - [128, 8192, 1, 128, 128, 128, 128, 8192]
    - [95, 1.814]
  - - [128, 8192, 1, 256, 128, 128, 256, 8192]
    - [95, 3.178]
  - - [128, 8192, 1, 512, 128, 128, 512, 8192]
    - [93, 5.217]
  - - [128, 8192, 1, 1024, 128, 128, 1024, 8192]
    - [92, 7.677]
  - - [128, 8192, 1, 2048, 128, 128, 2048, 8192]
    - [92, 9.704]
  - - [128, 8192, 1, 4096, 128, 128, 4096, 8192]
    - [94, 12.646]
  - - [128, 8192, 1, 8192, 128, 128, 8192, 8192]
    - [117, 14.064]
  - - [256, 128, 1, 128, 256, 256, 128, 128]
    - [111, 0.079]
  - - [256, 128, 1, 256, 256, 256, 256, 128]
    - [128, 0.141]
  - - [256, 128, 1, 512, 256, 256, 512, 128]
    - [130, 0.239]
  - - [256, 128, 1, 1024, 256, 256, 1024, 128]
    - [130, 0.386]
  - - [256, 128, 1, 2048, 256, 256, 2048, 128]
    - [130, 0.555]
  - - [256, 128, 1, 4096, 256, 256, 4096, 128]
    - [128, 0.714]
  - - [256, 128, 1, 8192, 256, 256, 8192, 128]
    - [128, 0.833]
  - - [256, 256, 1, 128, 256, 256, 128, 256]
    - [109, 0.155]
  - - [256, 256, 1, 256, 256, 256, 256, 256]
    - [130, 0.276]
  - - [256, 256, 1, 512, 256, 256, 512, 256]
    - [130, 0.469]
  - - [256, 256, 1, 1024, 256, 256, 1024, 256]
    - [130, 0.77]
  - - [256, 256, 1, 2048, 256, 256, 2048, 256]
    - [128, 1.094]
  - - [256, 256, 1, 4096, 256, 256, 4096, 256]
    - [130, 1.371]
  - - [256, 256, 1, 8192, 256, 256, 8192, 256]
    - [132, 1.575]
  - - [256, 512, 1, 128, 256, 256, 128, 512]
    - [113, 0.302]
  - - [256, 512, 1, 256, 256, 256, 256, 512]
    - [130, 0.543]
  - - [256, 512, 1, 512, 256, 256, 512, 512]
    - [130, 0.922]
  - - [256, 512, 1, 1024, 256, 256, 1024, 512]
    - [130, 1.49]
  - - [256, 512, 1, 2048, 256, 256, 2048, 512]
    - [130, 2.08]
  - - [256, 512, 1, 4096, 256, 256, 4096, 512]
    - [131, 2.581]
  - - [256, 512, 1, 8192, 256, 256, 8192, 512]
    - [133, 2.914]
  - - [256, 1024, 1, 128, 256, 256, 128, 1024]
    - [110, 0.593]
  - - [256, 1024, 1, 256, 256, 256, 256, 1024]
    - [128, 1.045]
  - - [256, 1024, 1, 512, 256, 256, 512, 1024]
    - [134, 1.784]
  - - [256, 1024, 1, 1024, 256, 256, 1024, 1024]
    - [130, 2.887]
  - - [256, 1024, 1, 2048, 256, 256, 2048, 1024]
    - [134, 3.983]
  - - [256, 1024, 1, 4096, 256, 256, 4096, 1024]
    - [134, 4.958]
  - - [256, 1024, 1, 8192, 256, 256, 8192, 1024]
    - [134, 5.669]
  - - [256, 2048, 1, 128, 256, 256, 128, 2048]
    - [107, 1.075]
  - - [256, 2048, 1, 256, 256, 256, 256, 2048]
    - [122, 1.908]
  - - [256, 2048, 1, 512, 256, 256, 512, 2048]
    - [104, 3.187]
  - - [256, 2048, 1, 1024, 256, 256, 1024, 2048]
    - [120, 4.905]
  - - [256, 2048, 1, 2048, 256, 256, 2048, 2048]
    - [122, 6.831]
  - - [256, 2048, 1, 4096, 256, 256, 4096, 2048]
    - [122, 8.573]
  - - [256, 2048, 1, 8192, 256, 256, 8192, 2048]
    - [121, 9.186]
  - - [256, 4096, 1, 128, 256, 256, 128, 4096]
    - [95, 1.835]
  - - [256, 4096, 1, 256, 256, 256, 256, 4096]
    - [94, 3.255]
  - - [256, 4096, 1, 512, 256, 256, 512, 4096]
    - [95, 5.504]
  - - [256, 4096, 1, 1024, 256, 256, 1024, 4096]
    - [100, 8.431]
  - - [256, 4096, 1, 2048, 256, 256, 2048, 4096]
    - [100, 11.132]
  - - [256, 4096, 1, 4096, 256, 256, 4096, 4096]
    - [94, 13.769]
  - - [256, 4096, 1, 8192, 256, 256, 8192, 4096]
    - [103, 15.337]
  - - [256, 8192, 1, 128, 256, 256, 128, 8192]
    - [55, 2.88]
  - - [256, 8192, 1, 256, 256, 256, 256, 8192]
    - [57, 5.127]
  - - [256, 8192, 1, 512, 256, 256, 512, 8192]
    - [52, 7.782]
  - - [256, 8192, 1, 1024, 256, 256, 1024, 8192]
    - [52, 11.046]
  - - [256, 8192, 1, 2048, 256, 256, 2048, 8192]
    - [57, 14.463]
  - - [256, 8192, 1, 4096, 256, 256, 4096, 8192]
    - [91, 18.05]
  - - [256, 8192, 1, 8192, 256, 256, 8192, 8192]
    - [90, 19.229]
  - - [512, 128, 1, 128, 512, 512, 128, 128]
    - [109, 0.158]
  - - [512, 128, 1, 256, 512, 512, 256, 128]
    - [112, 0.276]
  - - [512, 128, 1, 512, 512, 512, 512, 128]
    - [128, 0.473]
  - - [512, 128, 1, 1024, 512, 512, 1024, 128]
    - [128, 0.768]
  - - [512, 128, 1, 2048, 512, 512, 2048, 128]
    - [130, 1.117]
  - - [512, 128, 1, 4096, 512, 512, 4096, 128]
    - [130, 1.42]
  - - [512, 128, 1, 8192, 512, 512, 8192, 128]
    - [128, 1.659]
  - - [512, 256, 1, 128, 512, 512, 128, 256]
    - [109, 0.306]
  - - [512, 256, 1, 256, 512, 512, 256, 256]
    - [115, 0.539]
  - - [512, 256, 1, 512, 512, 512, 512, 256]
    - [132, 0.926]
  - - [512, 256, 1, 1024, 512, 512, 1024, 256]
    - [130, 1.514]
  - - [512, 256, 1, 2048, 512, 512, 2048, 256]
    - [132, 2.149]
  - - [512, 256, 1, 4096, 512, 512, 4096, 256]
    - [131, 2.706]
  - - [512, 256, 1, 8192, 512, 512, 8192, 256]
    - [131, 3.114]
  - - [512, 512, 1, 128, 512, 512, 128, 512]
    - [114, 0.592]
  - - [512, 512, 1, 256, 512, 512, 256, 512]
    - [130, 1.049]
  - - [512, 512, 1, 512, 512, 512, 512, 512]
    - [131, 1.802]
  - - [512, 512, 1, 1024, 512, 512, 1024, 512]
    - [134, 2.922]
  - - [512, 512, 1, 2048, 512, 512, 2048, 512]
    - [130, 4.038]
  - - [512, 512, 1, 4096, 512, 512, 4096, 512]
    - [128, 5.033]
  - - [512, 512, 1, 8192, 512, 512, 8192, 512]
    - [131, 5.73]
  - - [512, 1024, 1, 128, 512, 512, 128, 1024]
    - [105, 1.077]
  - - [512, 1024, 1, 256, 512, 512, 256, 1024]
    - [122, 1.895]
  - - [512, 1024, 1, 512, 512, 512, 512, 1024]
    - [107, 3.221]
  - - [512, 1024, 1, 1024, 512, 512, 1024, 1024]
    - [122, 4.994]
  - - [512, 1024, 1, 2048, 512, 512, 2048, 1024]
    - [126, 6.892]
  - - [512, 1024, 1, 4096, 512, 512, 4096, 1024]
    - [127, 8.64]
  - - [512, 1024, 1, 8192, 512, 512, 8192, 1024]
    - [127, 9.626]
  - - [512, 2048, 1, 128, 512, 512, 128, 2048]
    - [94, 1.824]
  - - [512, 2048, 1, 256, 512, 512, 256, 2048]
    - [95, 3.215]
  - - [512, 2048, 1, 512, 512, 512, 512, 2048]
    - [95, 5.462]
  - - [512, 2048, 1, 1024, 512, 512, 1024, 2048]
    - [95, 8.304]
  - - [512, 2048, 1, 2048, 512, 512, 2048, 2048]
    - [95, 11.481]
  - - [512, 2048, 1, 4096, 512, 512, 4096, 2048]
    - [95, 14.016]
  - - [512, 2048, 1, 8192, 512, 512, 8192, 2048]
    - [100, 15.253]
  - - [512, 4096, 1, 128, 512, 512, 128, 4096]
    - [55, 2.9]
  - - [512, 4096, 1, 256, 512, 512, 256, 4096]
    - [55, 5.076]
  - - [512, 4096, 1, 512, 512, 512, 512, 4096]
    - [56, 8.047]
  - - [512, 4096, 1, 1024, 512, 512, 1024, 4096]
    - [57, 11.659]
  - - [512, 4096, 1, 2048, 512, 512, 2048, 4096]
    - [54, 14.704]
  - - [512, 4096, 1, 4096, 512, 512, 4096, 4096]
    - [79, 18.608]
  - - [512, 4096, 1, 8192, 512, 512, 8192, 4096]
    - [89, 20.553]
  - - [512, 8192, 1, 128, 512, 512, 128, 8192]
    - [47, 3.722]
  - - [512, 8192, 1, 256, 512, 512, 256, 8192]
    - [13, 6.442]
  - - [512, 8192, 1, 512, 512, 512, 512, 8192]
    - [12, 10.035]
  - - [512, 8192, 1, 1024, 512, 512, 1024, 8192]
    - [49, 14.715]
  - - [512, 8192, 1, 2048, 512, 512, 2048, 8192]
    - [77, 19.858]
  - - [512, 8192, 1, 4096, 512, 512, 4096, 8192]
    - [78, 24.998]
  - - [512, 8192, 1, 8192, 512, 512, 8192, 8192]
    - [74, 24.243]
  - - [1024, 128, 1, 128, 1024, 1024, 128, 128]
    - [111, 0.306]
  - - [1024, 128, 1, 256, 1024, 1024, 256, 128]
    - [128, 0.543]
  - - [1024, 128, 1, 512, 1024, 1024, 512, 128]
    - [134, 0.916]
  - - [1024, 128, 1, 1024, 1024, 1024, 1024, 128]
    - [130, 1.512]
  - - [1024, 128, 1, 2048, 1024, 1024, 2048, 128]
    - [132, 2.169]
  - - [1024, 128, 1, 4096, 1024, 1024, 4096, 128]
    - [134, 2.776]
  - - [1024, 128, 1, 8192, 1024, 1024, 8192, 128]
    - [131, 3.293]
  - - [1024, 256, 1, 128, 1024, 1024, 128, 256]
    - [113, 0.587]
  - - [1024, 256, 1, 256, 1024, 1024, 256, 256]
    - [134, 1.046]
  - - [1024, 256, 1, 512, 1024, 1024, 512, 256]
    - [134, 1.801]
  - - [1024, 256, 1, 1024, 1024, 1024, 1024, 256]
    - [134, 2.928]
  - - [1024, 256, 1, 2048, 1024, 1024, 2048, 256]
    - [134, 4.159]
  - - [1024, 256, 1, 4096, 1024, 1024, 4096, 256]
    - [134, 5.237]
  - - [1024, 256, 1, 8192, 1024, 1024, 8192, 256]
    - [133, 6.101]
  - - [1024, 512, 1, 128, 1024, 1024, 128, 512]
    - [107, 1.06]
  - - [1024, 512, 1, 256, 1024, 1024, 256, 512]
    - [107, 1.886]
  - - [1024, 512, 1, 512, 1024, 1024, 512, 512]
    - [104, 3.185]
  - - [1024, 512, 1, 1024, 1024, 1024, 1024, 512]
    - [125, 5.011]
  - - [1024, 512, 1, 2048, 1024, 1024, 2048, 512]
    - [127, 6.886]
  - - [1024, 512, 1, 4096, 1024, 1024, 4096, 512]
    - [125, 8.693]
  - - [1024, 512, 1, 8192, 1024, 1024, 8192, 512]
    - [123, 9.662]
  - - [1024, 1024, 1, 128, 1024, 1024, 128, 1024]
    - [94, 1.818]
  - - [1024, 1024, 1, 256, 1024, 1024, 256, 1024]
    - [103, 3.244]
  - - [1024, 1024, 1, 512, 1024, 1024, 512, 1024]
    - [98, 5.492]
  - - [1024, 1024, 1, 1024, 1024, 1024, 1024, 1024]
    - [94, 8.387]
  - - [1024, 1024, 1, 2048, 1024, 1024, 2048, 1024]
    - [101, 11.361]
  - - [1024, 1024, 1, 4096, 1024, 1024, 4096, 1024]
    - [97, 14.289]
  - - [1024, 1024, 1, 8192, 1024, 1024, 8192, 1024]
    - [103, 15.492]
  - - [1024, 2048, 1, 128, 1024, 1024, 128, 2048]
    - [55, 2.888]
  - - [1024, 2048, 1, 256, 1024, 1024, 256, 2048]
    - [57, 5.055]
  - - [1024, 2048, 1, 512, 1024, 1024, 512, 2048]
    - [86, 8.084]
  - - [1024, 2048, 1, 1024, 1024, 1024, 1024, 2048]
    - [53, 11.682]
  - - [1024, 2048, 1, 2048, 1024, 1024, 2048, 2048]
    - [79, 15.248]
  - - [1024, 2048, 1, 4096, 1024, 1024, 4096, 2048]
    - [85, 19.057]
  - - [1024, 2048, 1, 8192, 1024, 1024, 8192, 2048]
    - [87, 20.367]
  - - [1024, 4096, 1, 128, 1024, 1024, 128, 4096]
    - [42, 3.659]
  - - [1024, 4096, 1, 256, 1024, 1024, 256, 4096]
    - [75, 6.362]
  - - [1024, 4096, 1, 512, 1024, 1024, 512, 4096]
    - [41, 10.362]
  - - [1024, 4096, 1, 1024, 1024, 1024, 1024, 4096]
    - [40, 15.23]
  - - [1024, 4096, 1, 2048, 1024, 1024, 2048, 4096]
    - [74, 21.01]
  - - [1024, 4096, 1, 4096, 1024, 1024, 4096, 4096]
    - [74, 25.116]
  - - [1024, 4096, 1, 8192, 1024, 1024, 8192, 4096]
    - [70, 24.505]
  - - [1024, 8192, 1, 128, 1024, 1024, 128, 8192]
    - [23, 4.614]
  - - [1024, 8192, 1, 256, 1024, 1024, 256, 8192]
    - [2, 7.584]
  - - [1024, 8192, 1, 512, 1024, 1024, 512, 8192]
    - [3, 12.334]
  - - [1024, 8192, 1, 1024, 1024, 1024, 1024, 8192]
    - [3, 19.331]
  - - [1024, 8192, 1, 2048, 1024, 1024, 2048, 8192]
    - [38, 25.391]
  - - [1024, 8192, 1, 4096, 1024, 1024, 4096, 8192]
    - [37, 29.708]
  - - [1024, 8192, 1, 8192, 1024, 1024, 8192, 8192]
    - [39, 30.43]
  - - [2048, 128, 1, 128, 2048, 2048, 128, 128]
    - [112, 0.595]
  - - [2048, 128, 1, 256, 2048, 2048, 256, 128]
    - [115, 1.032]
  - - [2048, 128, 1, 512, 2048, 2048, 512, 128]
    - [134, 1.769]
  - - [2048, 128, 1, 1024, 2048, 2048, 1024, 128]
    - [132, 2.897]
  - - [2048, 128, 1, 2048, 2048, 2048, 2048, 128]
    - [134, 4.204]
  - - [2048, 128, 1, 4096, 2048, 2048, 4096, 128]
    - [134, 5.419]
  - - [2048, 128, 1, 8192, 2048, 2048, 8192, 128]
    - [134, 6.275]
  - - [2048, 256, 1, 128, 2048, 2048, 128, 256]
    - [104, 1.066]
  - - [2048, 256, 1, 256, 2048, 2048, 256, 256]
    - [126, 1.886]
  - - [2048, 256, 1, 512, 2048, 2048, 512, 256]
    - [108, 3.144]
  - - [2048, 256, 1, 1024, 2048, 2048, 1024, 256]
    - [127, 5.021]
  - - [2048, 256, 1, 2048, 2048, 2048, 2048, 256]
    - [127, 7.117]
  - - [2048, 256, 1, 4096, 2048, 2048, 4096, 256]
    - [125, 9.042]
  - - [2048, 256, 1, 8192, 2048, 2048, 8192, 256]
    - [126, 9.976]
  - - [2048, 512, 1, 128, 2048, 2048, 128, 512]
    - [100, 1.798]
  - - [2048, 512, 1, 256, 2048, 2048, 256, 512]
    - [103, 3.195]
  - - [2048, 512, 1, 512, 2048, 2048, 512, 512]
    - [98, 5.454]
  - - [2048, 512, 1, 1024, 2048, 2048, 1024, 512]
    - [99, 8.236]
  - - [2048, 512, 1, 2048, 2048, 2048, 2048, 512]
    - [97, 11.308]
  - - [2048, 512, 1, 4096, 2048, 2048, 4096, 512]
    - [103, 13.866]
  - - [2048, 512, 1, 8192, 2048, 2048, 8192, 512]
    - [103, 15.205]
  - - [2048, 1024, 1, 128, 2048, 2048, 128, 1024]
    - [54, 2.838]
  - - [2048, 1024, 1, 256, 2048, 2048, 256, 1024]
    - [60, 5.039]
  - - [2048, 1024, 1, 512, 2048, 2048, 512, 1024]
    - [59, 8.025]
  - - [2048, 1024, 1, 1024, 2048, 2048, 1024, 1024]
    - [88, 11.587]
  - - [2048, 1024, 1, 2048, 2048, 2048, 2048, 1024]
    - [61, 15.137]
  - - [2048, 1024, 1, 4096, 2048, 2048, 4096, 1024]
    - [82, 19.253]
  - - [2048, 1024, 1, 8192, 2048, 2048, 8192, 1024]
    - [91, 20.01]
  - - [2048, 2048, 1, 128, 2048, 2048, 128, 2048]
    - [51, 3.63]
  - - [2048, 2048, 1, 256, 2048, 2048, 256, 2048]
    - [75, 6.347]
  - - [2048, 2048, 1, 512, 2048, 2048, 512, 2048]
    - [43, 10.416]
  - - [2048, 2048, 1, 1024, 2048, 2048, 1024, 2048]
    - [44, 15.084]
  - - [2048, 2048, 1, 2048, 2048, 2048, 2048, 2048]
    - [76, 20.882]
  - - [2048, 2048, 1, 4096, 2048, 2048, 4096, 2048]
    - [46, 25.291]
  - - [2048, 2048, 1, 8192, 2048, 2048, 8192, 2048]
    - [76, 24.921]
  - - [2048, 4096, 1, 128, 2048, 2048, 128, 4096]
    - [1, 4.637]
  - - [2048, 4096, 1, 256, 2048, 2048, 256, 4096]
    - [4, 7.62]
  - - [2048, 4096, 1, 512, 2048, 2048, 512, 4096]
    - [6, 12.481]
  - - [2048, 4096, 1, 1024, 2048, 2048, 1024, 4096]
    - [7, 19.061]
  - - [2048, 4096, 1, 2048, 2048, 2048, 2048, 4096]
    - [36, 25.878]
  - - [2048, 4096, 1, 4096, 2048, 2048, 4096, 4096]
    - [35, 30.062]
  - - [2048, 4096, 1, 8192, 2048, 2048, 8192, 4096]
    - [36, 30.066]
  - - [2048, 8192, 1, 128, 2048, 2048, 128, 8192]
    - [4, 5.0]
  - - [2048, 8192, 1, 256, 2048, 2048, 256, 8192]
    - [5, 8.671]
  - - [2048, 8192, 1, 512, 2048, 2048, 512, 8192]
    - [14, 14.324]
  - - [2048, 8192, 1, 1024, 2048, 2048, 1024, 8192]
    - [62, 22.802]
  - - [2048, 8192, 1, 2048, 2048, 2048, 2048, 8192]
    - [63, 31.47]
  - - [2048, 8192, 1, 4096, 2048, 2048, 4096, 8192]
    - [68, 34.691]
  - - [2048, 8192, 1, 8192, 2048, 2048, 8192, 8192]
    - [30, 36.718]
  - - [4096, 128, 1, 128, 4096, 4096, 128, 128]
    - [104, 1.065]
  - - [4096, 128, 1, 256, 4096, 4096, 256, 128]
    - [107, 1.869]
  - - [4096, 128, 1, 512, 4096, 4096, 512, 128]
    - [104, 3.135]
  - - [4096, 128, 1, 1024, 4096, 4096, 1024, 128]
    - [125, 4.929]
  - - [4096, 128, 1, 2048, 4096, 4096, 2048, 128]
    - [127, 7.017]
  - - [4096, 128, 1, 4096, 4096, 4096, 4096, 128]
    - [125, 8.686]
  - - [4096, 128, 1, 8192, 4096, 4096, 8192, 128]
    - [124, 9.915]
  - - [4096, 256, 1, 128, 4096, 4096, 128, 256]
    - [98, 1.801]
  - - [4096, 256, 1, 256, 4096, 4096, 256, 256]
    - [103, 3.195]
  - - [4096, 256, 1, 512, 4096, 4096, 512, 256]
    - [100, 5.484]
  - - [4096, 256, 1, 1024, 4096, 4096, 1024, 256]
    - [102, 8.096]
  - - [4096, 256, 1, 2048, 4096, 4096, 2048, 256]
    - [97, 11.074]
  - - [4096, 256, 1, 4096, 4096, 4096, 4096, 256]
    - [98, 13.474]
  - - [4096, 256, 1, 8192, 4096, 4096, 8192, 256]
    - [98, 14.944]
  - - [4096, 512, 1, 128, 4096, 4096, 128, 512]
    - [61, 2.804]
  - - [4096, 512, 1, 256, 4096, 4096, 256, 512]
    - [61, 4.944]
  - - [4096, 512, 1, 512, 4096, 4096, 512, 512]
    - [73, 7.953]
  - - [4096, 512, 1, 1024, 4096, 4096, 1024, 512]
    - [83, 11.376]
  - - [4096, 512, 1, 2048, 4096, 4096, 2048, 512]
    - [80, 14.736]
  - - [4096, 512, 1, 4096, 4096, 4096, 4096, 512]
    - [91, 18.437]
  - - [4096, 512, 1, 8192, 4096, 4096, 8192, 512]
    - [85, 19.242]
  - - [4096, 1024, 1, 128, 4096, 4096, 128, 1024]
    - [72, 3.671]
  - - [4096, 1024, 1, 256, 4096, 4096, 256, 1024]
    - [75, 6.34]
  - - [4096, 1024, 1, 512, 4096, 4096, 512, 1024]
    - [48, 10.336]
  - - [4096, 1024, 1, 1024, 4096, 4096, 1024, 1024]
    - [48, 14.996]
  - - [4096, 1024, 1, 2048, 4096, 4096, 2048, 1024]
    - [75, 20.417]
  - - [4096, 1024, 1, 4096, 4096, 4096, 4096, 1024]
    - [50, 24.826]
  - - [4096, 1024, 1, 8192, 4096, 4096, 8192, 1024]
    - [47, 24.055]
  - - [4096, 2048, 1, 128, 4096, 4096, 128, 2048]
    - [22, 4.407]
  - - [4096, 2048, 1, 256, 4096, 4096, 256, 2048]
    - [21, 7.499]
  - - [4096, 2048, 1, 512, 4096, 4096, 512, 2048]
    - [20, 12.116]
  - - [4096, 2048, 1, 1024, 4096, 4096, 1024, 2048]
    - [8, 18.881]
  - - [4096, 2048, 1, 2048, 4096, 4096, 2048, 2048]
    - [32, 25.129]
  - - [4096, 2048, 1, 4096, 4096, 4096, 4096, 2048]
    - [39, 30.2]
  - - [4096, 2048, 1, 8192, 4096, 4096, 8192, 2048]
    - [39, 30.074]
  - - [4096, 4096, 1, 128, 4096, 4096, 128, 4096]
    - [11, 5.008]
  - - [4096, 4096, 1, 256, 4096, 4096, 256, 4096]
    - [8, 8.873]
  - - [4096, 4096, 1, 512, 4096, 4096, 512, 4096]
    - [65, 14.019]
  - - [4096, 4096, 1, 1024, 4096, 4096, 1024, 4096]
    - [17, 22.66]
  - - [4096, 4096, 1, 2048, 4096, 4096, 2048, 4096]
    - [18, 31.187]
  - - [4096, 8192, 1, 128, 4096, 4096, 128, 8192]
    - [9, 5.581]
  - - [4096, 8192, 1, 256, 4096, 4096, 256, 8192]
    - [19, 9.928]
  - - [4096, 8192, 1, 512, 4096, 4096, 512, 8192]
    - [16, 16.14]
  - - [4096, 8192, 1, 1024, 4096, 4096, 1024, 8192]
    - [64, 23.605]
  - - [4096, 8192, 1, 2048, 4096, 4096, 2048, 8192]
    - [67, 30.502]
  - - [8192, 128, 1, 128, 8192, 8192, 128, 128]
    - [98, 1.78]
  - - [8192, 128, 1, 256, 8192, 8192, 256, 128]
    - [98, 3.172]
  - - [8192, 128, 1, 512, 8192, 8192, 512, 128]
    - [96, 5.05]
  - - [8192, 128, 1, 1024, 8192, 8192, 1024, 128]
    - [116, 7.423]
  - - [8192, 128, 1, 2048, 8192, 8192, 2048, 128]
    - [103, 9.674]
  - - [8192, 128, 1, 4096, 8192, 8192, 4096, 128]
    - [101, 12.468]
  - - [8192, 128, 1, 8192, 8192, 8192, 8192, 128]
    - [98, 13.614]
  - - [8192, 256, 1, 128, 8192, 8192, 128, 256]
    - [58, 2.809]
  - - [8192, 256, 1, 256, 8192, 8192, 256, 256]
    - [61, 5.029]
  - - [8192, 256, 1, 512, 8192, 8192, 512, 256]
    - [61, 7.524]
  - - [8192, 256, 1, 1024, 8192, 8192, 1024, 256]
    - [61, 11.038]
  - - [8192, 256, 1, 2048, 8192, 8192, 2048, 256]
    - [81, 14.261]
  - - [8192, 256, 1, 4096, 8192, 8192, 4096, 256]
    - [84, 18.078]
  - - [8192, 256, 1, 8192, 8192, 8192, 8192, 256]
    - [85, 18.776]
  - - [8192, 512, 1, 128, 8192, 8192, 128, 512]
    - [71, 3.636]
  - - [8192, 512, 1, 256, 8192, 8192, 256, 512]
    - [27, 6.318]
  - - [8192, 512, 1, 512, 8192, 8192, 512, 512]
    - [43, 10.191]
  - - [8192, 512, 1, 1024, 8192, 8192, 1024, 512]
    - [45, 14.677]
  - - [8192, 512, 1, 2048, 8192, 8192, 2048, 512]
    - [76, 20.093]
  - - [8192, 512, 1, 4096, 8192, 8192, 4096, 512]
    - [47, 23.934]
  - - [8192, 512, 1, 8192, 8192, 8192, 8192, 512]
    - [51, 23.753]
  - - [8192, 1024, 1, 128, 8192, 8192, 128, 1024]
    - [33, 4.609]
  - - [8192, 1024, 1, 256, 8192, 8192, 256, 1024]
    - [6, 7.717]
  - - [8192, 1024, 1, 512, 8192, 8192, 512, 1024]
    - [10, 12.427]
  - - [8192, 1024, 1, 1024, 8192, 8192, 1024, 1024]
    - [9, 19.366]
  - - [8192, 1024, 1, 2048, 8192, 8192, 2048, 1024]
    - [34, 25.959]
  - - [8192, 1024, 1, 4096, 8192, 8192, 4096, 1024]
    - [37, 29.17]
  - - [8192, 1024, 1, 8192, 8192, 8192, 8192, 1024]
    - [69, 29.235]
  - - [8192, 2048, 1, 128, 8192, 8192, 128, 2048]
    - [26, 5.072]
  - - [8192, 2048, 1, 256, 8192, 8192, 256, 2048]
    - [2, 8.537]
  - - [8192, 2048, 1, 512, 8192, 8192, 512, 2048]
    - [0, 14.246]
  - - [8192, 2048, 1, 1024, 8192, 8192, 1024, 2048]
    - [29, 22.158]
  - - [8192, 2048, 1, 2048, 8192, 8192, 2048, 2048]
    - [30, 30.446]
  - - [8192, 2048, 1, 4096, 8192, 8192, 4096, 2048]
    - [31, 33.709]
  - - [8192, 2048, 1, 8192, 8192, 8192, 8192, 2048]
    - [31, 36.825]
  - - [8192, 4096, 1, 128, 8192, 8192, 128, 4096]
    - [24, 5.668]
  - - [8192, 4096, 1, 256, 8192, 8192, 256, 4096]
    - [25, 9.731]
  - - [8192, 4096, 1, 512, 8192, 8192, 512, 4096]
    - [15, 16.149]
  - - [8192, 4096, 1, 1024, 8192, 8192, 1024, 4096]
    - [30, 23.164]
  - - [8192, 4096, 1, 2048, 8192, 8192, 2048, 4096]
    - [66, 29.284]
  - - [8192, 8192, 1, 128, 8192, 8192, 128, 8192]
    - [25, 6.096]
  - - [8192, 8192, 1, 256, 8192, 8192, 256, 8192]
    - [18, 10.638]
  - - [8192, 8192, 1, 512, 8192, 8192, 512, 8192]
    - [66, 16.894]
  - - [8192, 8192, 1, 1024, 8192, 8192, 1024, 8192]
    - [18, 23.655]
  - - [8192, 8192, 1, 2048, 8192, 8192, 2048, 8192]
    - [31, 29.932]
  - - [4096, 4096, 1, 4096, 4096, 4096, 4096, 4096]
    - [68, 35.339]
  - - [4096, 4096, 1, 8192, 4096, 4096, 8192, 4096]
    - [30, 37.067]
  - - [4096, 8192, 1, 4096, 4096, 4096, 4096, 8192]
    - [31, 34.281]
  - - [4096, 8192, 1, 8192, 4096, 4096, 8192, 8192]
    - [31, 39.837]
  - - [8192, 4096, 1, 4096, 8192, 8192, 4096, 4096]
    - [30, 33.885]
  - - [8192, 4096, 1, 8192, 8192, 8192, 8192, 4096]
    - [28, 39.173]
  - - [8192, 8192, 1, 4096, 8192, 8192, 4096, 8192]
    - [31, 36.994]
  - - [8192, 8192, 1, 8192, 8192, 8192, 8192, 8192]
    - [31, 42.566]
  - - [1, 1, 1, 32, 1, 1, 32, 1]
    - [135, 0.0]
- null
- null
- DeviceEfficiency
- GridBased
