projects/hipblaslt/library/src/amd_detail/rocblaslt/src/Tensile/Logic/asm_full/gfx950/GridBased/gfx950_Cijk_Alik_Bljk_HHS_BH_Bias_HAS_SAV_UserArgs.yaml
- {MinimumRequiredVersion: 4.33.0}
- gfx950
- gfx950
- [Device 0049, Device 0050]
    SolutionIndex: 0
    SolutionNameMin: Cijk_Alik_Bljk_HHS_BH_Bias_AS_SAV_UserArgs_MT128x16x128_MI16x16x1_SN_GSU1_GSUC0_GSUWGMRR0_K1_MIWT2_1_SU32_SUM0_SUS256_WGM8_WGMXCC1_WGMXCCGn1
    SolutionIndex: 1
    SolutionNameMin: Cijk_Alik_Bljk_HHS_BH_Bias_AS_SAV_UserArgs_MT256x256x64_MI32x32x1_SN_GSU1_GSUC0_GSUWGMRR0_K1_MIWT4_4_SU0_SUM0_SUS0_WGM8_WGMXCC1_WGMXCCGn1
    SolutionIndex: 2
    SolutionNameMin: Cijk_Alik_Bljk_HHS_BH_Bias_AS_SAV_UserArgs_MT160x256x64_MI32x32x1_SN_GSU1_GSUC0_GSUWGMRR0_K1_MIWT5_2_SU0_SUM0_SUS0_WGM8_WGMXCC1_WGMXCCGn1
    SolutionIndex: 3
    SolutionNameMin: Cijk_Alik_Bljk_HHS_BH_Bias_AS_SAV_UserArgs_MT224x256x64_MI32x32x1_SN_GSU1_GSUC0_GSUWGMRR0_K1_MIWT7_2_SU0_SUM0_SUS0_WGM8_WGMXCC1_WGMXCCGn1
    SolutionIndex: 4
    SolutionNameMin: Cijk_Alik_Bljk_HHS_BH_Bias_AS_SAV_UserArgs_MT256x128x64_MI32x32x1_SN_GSU1_GSUC0_GSUWGMRR0_K1_LBSPPA512_LBSPPB256_MIWT4_2_SU0_SUM0_SUS0_SVW4_VWA4_VWB2_WG64_4_1_WGM8_WGMXCC1_WGMXCCGn1
- - - [57344, 8192, 1, 8192]
    - [1, 0]
  - - [57344, 16, 1, 8192]
    - [0, 0]
  - - [10240, 8192, 1, 8192]
    - [1, 0]
  - - [10240, 16, 1, 8192]
    - [0, 0]
  - - [8192, 8192, 1, 8192]
    - [1, 0]
  - - [8192, 16, 1, 8192]
    - [0, 0]
  - - [7168, 8192, 1, 8192]
    - [3, 0.0]
  - - [7168, 16, 1, 8192]
    - [0, 0]
  - - [1280, 8192, 1, 8192]
    - [2, 0.0]
  - - [1280, 16, 1, 8192]
    - [0, 0]
  - - [4096, 2048, 1, 8192]
    - [4, 0.0]
- null
- null
- DeviceEfficiency
- GridBased
