projects/hipblaslt/library/src/amd_detail/rocblaslt/src/Tensile/Logic/asm_full/gfx950/GridBased/gfx950_Cijk_Alik_Bljk_BBS_BH_Bias_HAS_SAV_UserArgs.yaml
- {MinimumRequiredVersion: 4.33.0}
- gfx950
- gfx950
- [Device 0049, Device 0050]
    SolutionIndex: 0
    SolutionNameMin: Cijk_Alik_Bljk_BBS_BH_Bias_AS_SAV_UserArgs_MT128x16x128_MI16x16x1_SN_GSU1_GSUC0_GSUWGMRR0_K1_MIWT2_1_SU32_SUM0_SUS256_WGM8_WGMXCC1_WGMXCCGn1
    SolutionIndex: 1
    SolutionNameMin: Cijk_Alik_Bljk_BBS_BH_Bias_AS_SAV_UserArgs_MT256x256x64_MI32x32x1_SN_GSU1_GSUC0_GSUWGMRR0_K1_MIWT4_4_SU0_SUM0_SUS0_WGM8_WGMXCC1_WGMXCCGn1
    SolutionIndex: 2
    SolutionNameMin: Cijk_Alik_Bljk_BBS_BH_Bias_AS_SAV_UserArgs_MT160x256x64_MI32x32x1_SN_GSU1_GSUC0_GSUWGMRR0_K1_MIWT5_2_SU0_SUM0_SUS0_WGM8_WGMXCC1_WGMXCCGn1
    SolutionIndex: 3
    SolutionNameMin: Cijk_Alik_Bljk_BBS_BH_Bias_AS_SAV_UserArgs_MT256x128x64_MI32x32x1_SN_GSU1_GSUC0_GSUWGMRR0_K1_LBSPPA512_LBSPPB256_MIWT4_2_SU0_SUM0_SUS0_SVW4_VWA4_VWB2_WG64_4_1_WGM8_WGMXCC1_WGMXCCGn1
    SolutionIndex: 4
    SolutionNameMin: Cijk_Alik_Bljk_BBS_BH_Bias_AS_SAV_UserArgs_MT64x16x128_MI16x16x1_SN_LDSB1_CLR1_GRVWA8_GRVWB2_GSU11_GSUC0_GSUWGMRR0_K1_LBSPPA256_LBSPPB256_LPA16_LPB16_LRVW8_MIWT1_1_NTA4_NTC3_NTD3_PLR1_SU0_SUM0_SUS0_SVW1_VWA1_WG64_4_1_WGM1_WGMXCC1_WGMXCCGn1
    SolutionIndex: 5
    SolutionNameMin: Cijk_Alik_Bljk_BBS_BH_Bias_AS_SAV_UserArgs_MT192x16x128_MI16x16x1_SN_LDSB1_GRVWA8_GRVWB8_GSU5_GSUC0_GSUWGMRR0_K1_LBSPPA256_LBSPPB256_LPA8_LPB8_LRVW4_MIWT3_1_NTA4_NTC0_NTD0_SU0_SUM0_SUS0_SVW1_VWA1_WG64_4_1_WGM1_WGMXCC1_WGMXCCGn1
    SolutionIndex: 6
    SolutionNameMin: Cijk_Alik_Bljk_BBS_BH_Bias_AS_SAV_UserArgs_MT256x256x64_MI16x16x1_SN_LDSB1_CLR1_GRVWA8_GRVWB8_GSU1_GSUC0_GSUWGMRR0_K1_LBSPPA1024_LBSPPB1024_LPA16_LPB16_LRVW8_MIWT8_8_PLR1_SU8_SUM0_SUS256_SVW8_VWA8_VWB8_WG32_8_1_WGM16_WGMXCC1_WGMXCCGn1
    SolutionIndex: 7
    SolutionNameMin: Cijk_Alik_Bljk_BBS_BH_Bias_AS_SAV_UserArgs_MT224x256x64_MI16x16x1_SN_LDSB1_CLR1_GRVWA8_GRVWB8_GSU1_GSUC0_GSUWGMRR0_K1_LBSPPA256_LBSPPB512_LPA16_LPB16_LRVW8_MIWT14_4_PLR1_SU8_SUM0_SUS256_SVW2_VWA2_VWB4_WG16_16_1_WGM16_WGMXCC1_WGMXCCGn1
    SolutionIndex: 8
    SolutionNameMin: Cijk_Alik_Bljk_BBS_BH_Bias_AS_SAV_UserArgs_MT256x256x64_MI16x16x1_SN_LDSB1_CLR1_GRVWA8_GRVWB8_GSU1_GSUC0_GSUWGMRR0_K1_LBSPPA1024_LBSPPB512_LPA16_LPB16_LRVW8_MIWT16_4_PLR1_SU8_SUM0_SUS256_SVW8_VWA8_VWB4_WG16_16_1_WGMn40_WGMXCC1_WGMXCCGn1
    SolutionIndex: 9
    SolutionNameMin: Cijk_Alik_Bljk_BBS_BH_Bias_AS_SAV_UserArgs_MT256x256x64_MI16x16x1_SN_LDSB1_CLR1_GRVWA8_GRVWB8_GSU1_GSUC0_GSUWGMRR0_K1_LBSPPA1024_LBSPPB512_LPA16_LPB16_LRVW8_MIWT16_4_PLR1_SU8_SUM0_SUS256_SVW8_VWA8_VWB4_WG16_16_1_WGM32_WGMXCC1_WGMXCCGn1
    SolutionIndex: 10
    SolutionNameMin: Cijk_Alik_Bljk_BBS_BH_Bias_AS_SAV_UserArgs_MT256x256x64_MI16x16x1_SN_LDSB1_CLR1_GRVWA8_GRVWB8_GSU1_GSUC0_GSUWGMRR0_K1_LBSPPA1024_LBSPPB1024_LPA8_LPB8_LRVW4_MIWT8_8_PLR1_SU8_SUM0_SUS256_SVW8_VWA8_VWB8_WG32_8_1_WGM32_WGMXCC1_WGMXCCGn1
    SolutionIndex: 11
    SolutionNameMin: Cijk_Alik_Bljk_BBS_BH_Bias_AS_SAV_UserArgs_MT192x16x128_MI16x16x1_SN_LDSB1_CLR1_EPS0_GRVWA8_GRVWB2_GSU5_GSUC0_GSUWGMRR0_K1_LBSPPA256_LBSPPB256_LPA8_LPB4_LRVW4_MIWT3_1_NTA4_PGR2_PLR1_SU0_SUM0_SUS0_SVW1_VWA1_WG64_4_1_WGM1_WGMXCC1_WGMXCCGn1
    SolutionIndex: 12
    SolutionNameMin: Cijk_Alik_Bljk_BBS_BH_Bias_AS_SAV_UserArgs_MT256x16x128_MI16x16x1_SN_LDSB1_CLR1_GRVWA8_GRVWB8_GSU7_GSUC0_GSUWGMRR0_K1_LBSPPA2048_LBSPPB256_LPA16_LPB16_LRVW8_MIWT8_1_NTA4_PLR1_SU0_SUM0_SUS0_SVW8_VWA8_WG32_4_2_WGM1_WGMXCC1_WGMXCCGn1
    SolutionIndex: 13
    SolutionNameMin: Cijk_Alik_Bljk_BBS_BH_Bias_AS_SAV_UserArgs_MT64x16x128_MI16x16x1_SN_LDSB0_CLR1_GRVWA8_GRVWB4_GSU13_GSUC0_GSUWGMRR0_K1_LBSPPA256_LBSPPB256_LPA8_LPB4_LRVW4_MIWT1_1_NLCA1_NLCB1_PLR1_SU0_SUM0_SUS0_SVW1_VWA1_WG64_4_1_WGM1_WGMXCC1_WGMXCCGn1
    SolutionIndex: 14
    SolutionNameMin: Cijk_Alik_Bljk_BBS_BH_Bias_AS_SAV_UserArgs_MT32x16x256_MI16x16x1_SN_LDSB1_CLR1_GRVWA8_GRVWB2_GSU1_GSUC0_GSUWGMRR0_K1_LBSPPA512_LBSPPB512_LPA16_LPB16_LRVW8_MIWT1_1_NTA4_PLR1_SU0_SUM0_SUS0_SVW1_VWA1_WG32_4_1_WGM1_WGMXCC1_WGMXCCGn1
    SolutionIndex: 15
    SolutionNameMin: Cijk_Alik_Bljk_BBS_BH_Bias_AS_SAV_UserArgs_MT16x16x256_MI16x16x1_SN_LDSB1_CLR1_GRVWA8_GRVWB8_GSU1_GSUC0_GSUWGMRR0_K1_LBSPPA512_LBSPPB512_LPA8_LPB8_LRVW4_MIWT1_1_NTA4_NLCA1_NLCB1_PLR1_SU0_SUM0_SUS0_SVW1_VWA1_WG16_4_1_WGM1_WGMXCC1_WGMXCCGn1
    SolutionIndex: 16
    SolutionNameMin: Cijk_Alik_Bljk_BBS_BH_Bias_AS_SAV_UserArgs_MT32x16x256_MI16x16x1_SN_LDSB1_CLR1_GRVWA8_GRVWB8_GSU1_GSUC0_GSUWGMRR0_K1_LBSPPA512_LBSPPB512_LPA16_LPB16_LRVW8_MIWT1_1_NTA4_PLR1_SU0_SUM0_SUS0_SVW1_VWA1_WG32_4_1_WGM1_WGMXCC1_WGMXCCGn1
- - - [57344, 8192, 1, 8192]
    - [1, 0]
  - - [57344, 16, 1, 8192]
    - [0, 0]
  - - [10240, 8192, 1, 8192]
    - [8, 0.0]
  - - [10240, 16, 1, 8192]
    - [0, 0]
  - - [8192, 8192, 1, 8192]
    - [9, 0.0]
  - - [8192, 16, 1, 8192]
    - [0, 0]
  - - [7168, 8192, 1, 8192]
    - [7, 0.0]
  - - [7168, 16, 1, 8192]
    - [0, 0]
  - - [1280, 8192, 1, 8192]
    - [2, 0.0]
  - - [1280, 16, 1, 8192]
    - [0, 0]
  - - [4096, 2048, 1, 8192]
    - [3, 0.0]
  - - [10240, 2, 1, 8192]
    - [4, 0.0]
  - - [8192, 2, 1, 8192]
    - [11, 0.0]
  - - [57344, 2, 1, 8192]
    - [5, 0.0]
  - - [8192, 2, 1, 28672]
    - [12, 0.0]
  - - [1280, 2, 1, 8192]
    - [13, 3870.91]
  - - [8192, 2, 1, 1024]
    - [14, 0.0]
  - - [7168, 2, 1, 8192]
    - [15, 0.0]
  - - [8192, 2, 1, 3584]
    - [16, 0.0]
  - - [8192, 8192, 1, 3584]
    - [6, 1251180.0]
  - - [8192, 8192, 1, 28672]
    - [10, 0.0]
- null
- null
- DeviceEfficiency
- GridBased
