projects/hipblaslt/library/src/amd_detail/rocblaslt/src/Tensile/Logic/asm_full/gfx950/GridBased/gfx950_Cijk_Ailk_Bjlk_BSS_BH_Bias_HAS_SAV_UserArgs.yaml
- {MinimumRequiredVersion: 4.33.0}
- gfx950
- gfx950
- [Device 75a0]
    SolutionIndex: 0
    SolutionNameMin: Cijk_Ailk_Bjlk_BSS_BH_Bias_HAS_SAV_UserArgs_MT256x256x32_MI16x16x1_SN_LDSB0_CLR0_GSU0_GSUC0_GSUWGMRR0_K1_LBSPPA4096_LBSPPB4096_LPA0_LPB0_MIWT8_8_PLR0_SU0_SUM0_SUS0_VWA8_VWB8_WGM8_WGMXCC1_WGMXCCGn1
    SolutionIndex: 1
    SolutionNameMin: Cijk_Ailk_Bjlk_BSS_BH_Bias_HAS_SAV_UserArgs_MT128x256x32_MI16x16x1_SN_LDSB1_CLR0_GSU0_GSUC0_GSUWGMRR0_K1_LBSPPA512_LBSPPB1024_LPA0_LPB0_MIWT4_8_PLR0_SU0_SUM0_SUS0_VWA4_VWB8_WGM1_WGMXCC1_WGMXCCGn1
    SolutionIndex: 2
    SolutionNameMin: Cijk_Ailk_Bjlk_BSS_BH_Bias_HAS_SAV_UserArgs_MT128x256x32_MI16x16x1_SN_LDSB1_CLR0_GSU0_GSUC0_GSUWGMRR0_K1_LBSPPA512_LBSPPB1024_LPA0_LPB0_MIWT4_8_PLR0_SU0_SUM0_SUS0_VWA4_VWB8_WGM1_WGMXCC1_WGMXCCGn1
    SolutionIndex: 3
    SolutionNameMin: Cijk_Ailk_Bjlk_BSS_BH_Bias_HAS_SAV_UserArgs_MT128x256x32_MI16x16x1_SN_LDSB1_CLR0_GSU0_GSUC0_GSUWGMRR0_K1_LBSPPA1024_LBSPPB2048_LPA0_LPB0_MIWT4_8_PLR0_SU0_SUM0_SUS0_VWA4_VWB8_WGM1_WGMXCC1_WGMXCCGn1
    SolutionIndex: 4
    SolutionNameMin: Cijk_Ailk_Bjlk_BSS_BH_Bias_HAS_SAV_UserArgs_MT128x256x32_MI16x16x1_SN_LDSB1_CLR0_GSU0_GSUC0_GSUWGMRR0_K1_LBSPPA512_LBSPPB1024_LPA0_LPB0_MIWT4_8_PLR0_SU0_SUM0_SUS0_VWA4_VWB8_WGM6_WGMXCC1_WGMXCCGn1
    SolutionIndex: 5
    SolutionNameMin: Cijk_Ailk_Bjlk_BSS_BH_Bias_HAS_SAV_UserArgs_MT128x256x32_MI16x16x1_SN_LDSB1_CLR0_GSU0_GSUC0_GSUWGMRR0_K1_LBSPPA1024_LBSPPB2048_LPA0_LPB0_MIWT4_8_PLR0_SU0_SUM0_SUS0_VWA4_VWB8_WGM6_WGMXCC1_WGMXCCGn1
    SolutionIndex: 6
    SolutionNameMin: Cijk_Ailk_Bjlk_BSS_BH_Bias_HAS_SAV_UserArgs_MT128x256x32_MI16x16x1_SN_LDSB1_CLR0_GSU0_GSUC0_GSUWGMRR0_K1_LBSPPA2048_LBSPPB4096_LPA0_LPB0_MIWT4_8_PLR0_SU0_SUM0_SUS0_VWA4_VWB8_WGM6_WGMXCC1_WGMXCCGn1
    SolutionIndex: 7
    SolutionNameMin: Cijk_Ailk_Bjlk_BSS_BH_Bias_HAS_SAV_UserArgs_MT128x256x32_MI16x16x1_SN_LDSB1_CLR0_GSU0_GSUC0_GSUWGMRR0_K1_LBSPPA512_LBSPPB1024_LPA0_LPB0_MIWT4_8_PLR0_SU0_SUM0_SUS0_VWA4_VWB8_WGM8_WGMXCC1_WGMXCCGn1
    SolutionIndex: 8
    SolutionNameMin: Cijk_Ailk_Bjlk_BSS_BH_Bias_HAS_SAV_UserArgs_MT128x256x32_MI16x16x1_SN_LDSB1_CLR0_GSU0_GSUC0_GSUWGMRR0_K1_LBSPPA1024_LBSPPB2048_LPA0_LPB0_MIWT4_8_PLR0_SU0_SUM0_SUS0_VWA4_VWB8_WGM8_WGMXCC1_WGMXCCGn1
    SolutionIndex: 9
    SolutionNameMin: Cijk_Ailk_Bjlk_BSS_BH_Bias_HAS_SAV_UserArgs_MT256x256x32_MI32x32x1_SN_LDSB0_CLR1_GSU0_GSUC0_GSUWGMRR0_K1_LBSPPA0_LBSPPB0_LPA0_LPB0_MIWT4_4_PLR1_SU0_SUM0_SUS0_VWA4_VWB4_WGM1_WGMXCC1_WGMXCCGn1
    SolutionIndex: 10
    SolutionNameMin: Cijk_Ailk_Bjlk_BSS_BH_Bias_HAS_SAV_UserArgs_MT256x256x32_MI32x32x1_SN_LDSB0_CLR1_GSU0_GSUC0_GSUWGMRR0_K1_LBSPPA0_LBSPPB0_LPA0_LPB0_MIWT4_4_PLR1_SU0_SUM0_SUS0_VWA4_VWB4_WGM1_WGMXCC1_WGMXCCGn1
    SolutionIndex: 11
    SolutionNameMin: Cijk_Ailk_Bjlk_BSS_BH_Bias_HAS_SAV_UserArgs_MT256x256x32_MI32x32x1_SN_LDSB0_CLR1_GSU0_GSUC0_GSUWGMRR0_K1_LBSPPA0_LBSPPB0_LPA0_LPB0_MIWT4_4_PLR1_SU0_SUM0_SUS0_VWA4_VWB4_WGM6_WGMXCC1_WGMXCCGn1
    SolutionIndex: 12
    SolutionNameMin: Cijk_Ailk_Bjlk_BSS_BH_Bias_HAS_SAV_UserArgs_MT256x256x32_MI32x32x1_SN_LDSB0_CLR1_GSU0_GSUC0_GSUWGMRR0_K1_LBSPPA0_LBSPPB0_LPA0_LPB0_MIWT4_4_PLR1_SU0_SUM0_SUS0_VWA4_VWB4_WGM6_WGMXCC1_WGMXCCGn1
    SolutionIndex: 13
    SolutionNameMin: Cijk_Ailk_Bjlk_BSS_BH_Bias_HAS_SAV_UserArgs_MT256x256x32_MI32x32x1_SN_LDSB0_CLR1_GSU0_GSUC0_GSUWGMRR0_K1_LBSPPA0_LBSPPB0_LPA0_LPB0_MIWT4_4_PLR1_SU0_SUM0_SUS0_VWA4_VWB4_WGM6_WGMXCC1_WGMXCCGn1
    SolutionIndex: 14
    SolutionNameMin: Cijk_Ailk_Bjlk_BSS_BH_Bias_HAS_SAV_UserArgs_MT256x256x32_MI32x32x1_SN_LDSB0_CLR1_GSU0_GSUC0_GSUWGMRR0_K1_LBSPPA0_LBSPPB0_LPA0_LPB0_MIWT4_4_PLR1_SU0_SUM0_SUS0_VWA4_VWB4_WGM6_WGMXCC1_WGMXCCGn1
    SolutionIndex: 15
    SolutionNameMin: Cijk_Ailk_Bjlk_BSS_BH_Bias_HAS_SAV_UserArgs_MT256x256x32_MI32x32x1_SN_LDSB0_CLR1_GSU0_GSUC0_GSUWGMRR0_K1_LBSPPA0_LBSPPB0_LPA0_LPB0_MIWT4_4_PLR1_SU0_SUM0_SUS0_VWA4_VWB4_WGM6_WGMXCC1_WGMXCCGn1
    SolutionIndex: 16
    SolutionNameMin: Cijk_Ailk_Bjlk_BSS_BH_Bias_HAS_SAV_UserArgs_MT256x256x32_MI32x32x1_SN_LDSB0_CLR1_GSU0_GSUC0_GSUWGMRR0_K1_LBSPPA0_LBSPPB0_LPA0_LPB0_MIWT4_4_PLR1_SU0_SUM0_SUS0_VWA4_VWB4_WGM6_WGMXCC1_WGMXCCGn1
    SolutionIndex: 17
    SolutionNameMin: Cijk_Ailk_Bjlk_BSS_BH_Bias_HAS_SAV_UserArgs_MT256x256x32_MI32x32x1_SN_LDSB0_CLR1_GSU0_GSUC0_GSUWGMRR0_K1_LBSPPA0_LBSPPB0_LPA0_LPB0_MIWT4_4_PLR1_SU0_SUM0_SUS0_VWA4_VWB4_WGM6_WGMXCC1_WGMXCCGn1
    SolutionIndex: 18
    SolutionNameMin: Cijk_Ailk_Bjlk_BSS_BH_Bias_HAS_SAV_UserArgs_MT256x256x32_MI32x32x1_SN_LDSB0_CLR1_GSU0_GSUC0_GSUWGMRR0_K1_LBSPPA0_LBSPPB0_LPA0_LPB0_MIWT4_4_PLR1_SU0_SUM0_SUS0_VWA4_VWB4_WGM8_WGMXCC1_WGMXCCGn1
    SolutionIndex: 19
    SolutionNameMin: Cijk_Ailk_Bjlk_BSS_BH_Bias_HAS_SAV_UserArgs_MT256x256x32_MI32x32x1_SN_LDSB0_CLR1_GSU0_GSUC0_GSUWGMRR0_K1_LBSPPA0_LBSPPB0_LPA0_LPB0_MIWT4_4_PLR1_SU0_SUM0_SUS0_VWA4_VWB4_WGM8_WGMXCC1_WGMXCCGn1
    SolutionIndex: 20
    SolutionNameMin: Cijk_Ailk_Bjlk_BSS_BH_Bias_HAS_SAV_UserArgs_MT256x128x32_MI32x32x1_SN_LDSB1_CLR1_GSU0_GSUC0_GSUWGMRR0_K1_LBSPPA0_LBSPPB0_LPA0_LPB0_MIWT4_2_PLR1_SU0_SUM0_SUS0_VWA4_VWB2_WGM6_WGMXCC1_WGMXCCGn1
    SolutionIndex: 21
    SolutionNameMin: Cijk_Ailk_Bjlk_BSS_BH_Bias_HAS_SAV_UserArgs_MT256x128x32_MI32x32x1_SN_LDSB1_CLR1_GSU0_GSUC0_GSUWGMRR0_K1_LBSPPA0_LBSPPB0_LPA0_LPB0_MIWT4_2_PLR1_SU0_SUM0_SUS0_VWA4_VWB2_WGM8_WGMXCC1_WGMXCCGn1
    SolutionIndex: 22
    SolutionNameMin: Cijk_Ailk_Bjlk_BSS_BH_Bias_HAS_SAV_UserArgs_MT128x128x32_MI32x32x1_SN_LDSB0_CLR1_GSU0_GSUC0_GSUWGMRR0_K1_LBSPPA0_LBSPPB0_LPA0_LPB0_MIWT2_2_PLR1_SU0_SUM0_SUS0_VWA2_VWB2_WGM6_WGMXCC1_WGMXCCGn1
    SolutionIndex: 23
    SolutionNameMin: Cijk_Ailk_Bjlk_BSS_BH_Bias_HAS_SAV_UserArgs_MT128x128x32_MI32x32x1_SN_LDSB0_CLR1_GSU0_GSUC0_GSUWGMRR0_K1_LBSPPA0_LBSPPB0_LPA0_LPB0_MIWT2_2_PLR1_SU0_SUM0_SUS0_VWA2_VWB2_WGM8_WGMXCC1_WGMXCCGn1
    SolutionIndex: 24
    SolutionNameMin: Cijk_Ailk_Bjlk_BSS_BH_Bias_HAS_SAV_UserArgs_MT128x256x64_MI16x16x1_SN_LDSB1_CLR1_GSU0_GSUC0_GSUWGMRR0_K1_LBSPPA512_LBSPPB1024_LPA0_LPB0_MIWT4_8_PLR1_SU0_SUM0_SUS0_VWA4_VWB8_WGM1_WGMXCC1_WGMXCCGn1
    SolutionIndex: 25
    SolutionNameMin: Cijk_Ailk_Bjlk_BSS_BH_Bias_HAS_SAV_UserArgs_MT128x256x64_MI16x16x1_SN_LDSB1_CLR1_GSU0_GSUC0_GSUWGMRR0_K1_LBSPPA512_LBSPPB1024_LPA0_LPB0_MIWT4_8_PLR1_SU0_SUM0_SUS0_VWA4_VWB8_WGM1_WGMXCC1_WGMXCCGn1
    SolutionIndex: 26
    SolutionNameMin: Cijk_Ailk_Bjlk_BSS_BH_Bias_HAS_SAV_UserArgs_MT128x256x64_MI16x16x1_SN_LDSB1_CLR1_GSU0_GSUC0_GSUWGMRR0_K1_LBSPPA1024_LBSPPB2048_LPA0_LPB0_MIWT4_8_PLR1_SU0_SUM0_SUS0_VWA4_VWB8_WGM1_WGMXCC1_WGMXCCGn1
    SolutionIndex: 27
    SolutionNameMin: Cijk_Ailk_Bjlk_BSS_BH_Bias_HAS_SAV_UserArgs_MT128x256x64_MI16x16x1_SN_LDSB1_CLR1_GSU0_GSUC0_GSUWGMRR0_K1_LBSPPA2048_LBSPPB4096_LPA0_LPB0_MIWT4_8_PLR1_SU0_SUM0_SUS0_VWA4_VWB8_WGM1_WGMXCC1_WGMXCCGn1
    SolutionIndex: 28
    SolutionNameMin: Cijk_Ailk_Bjlk_BSS_BH_Bias_HAS_SAV_UserArgs_MT128x256x64_MI16x16x1_SN_LDSB1_CLR1_GSU0_GSUC0_GSUWGMRR0_K1_LBSPPA512_LBSPPB1024_LPA0_LPB0_MIWT4_8_PLR1_SU0_SUM0_SUS0_VWA4_VWB8_WGM6_WGMXCC1_WGMXCCGn1
    SolutionIndex: 29
    SolutionNameMin: Cijk_Ailk_Bjlk_BSS_BH_Bias_HAS_SAV_UserArgs_MT128x256x64_MI16x16x1_SN_LDSB1_CLR1_GSU0_GSUC0_GSUWGMRR0_K1_LBSPPA512_LBSPPB1024_LPA0_LPB0_MIWT4_8_PLR1_SU0_SUM0_SUS0_VWA4_VWB8_WGM8_WGMXCC1_WGMXCCGn1
    SolutionIndex: 30
    SolutionNameMin: Cijk_Ailk_Bjlk_BSS_BH_Bias_HAS_SAV_UserArgs_MT128x256x64_MI16x16x1_SN_LDSB1_CLR1_GSU0_GSUC0_GSUWGMRR0_K1_LBSPPA2048_LBSPPB4096_LPA0_LPB0_MIWT4_8_PLR1_SU0_SUM0_SUS0_VWA4_VWB8_WGM8_WGMXCC1_WGMXCCGn1
    SolutionIndex: 31
    SolutionNameMin: Cijk_Ailk_Bjlk_BSS_BH_Bias_HAS_SAV_UserArgs_MT256x128x64_MI16x16x1_SN_LDSB1_CLR1_GSU0_GSUC0_GSUWGMRR0_K1_LBSPPA4096_LBSPPB2048_LPA0_LPB0_MIWT8_4_PLR1_SU0_SUM0_SUS0_VWA8_VWB4_WGM1_WGMXCC1_WGMXCCGn1
    SolutionIndex: 32
    SolutionNameMin: Cijk_Ailk_Bjlk_BSS_BH_Bias_HAS_SAV_UserArgs_MT256x128x64_MI16x16x1_SN_LDSB1_CLR1_GSU0_GSUC0_GSUWGMRR0_K1_LBSPPA1024_LBSPPB512_LPA0_LPB0_MIWT8_4_PLR1_SU0_SUM0_SUS0_VWA8_VWB4_WGM6_WGMXCC1_WGMXCCGn1
    SolutionIndex: 33
    SolutionNameMin: Cijk_Ailk_Bjlk_BSS_BH_Bias_HAS_SAV_UserArgs_MT256x128x64_MI16x16x1_SN_LDSB1_CLR1_GSU0_GSUC0_GSUWGMRR0_K1_LBSPPA4096_LBSPPB2048_LPA0_LPB0_MIWT8_4_PLR1_SU0_SUM0_SUS0_VWA8_VWB4_WGM6_WGMXCC1_WGMXCCGn1
    SolutionIndex: 34
    SolutionNameMin: Cijk_Ailk_Bjlk_BSS_BH_Bias_HAS_SAV_UserArgs_MT256x128x64_MI16x16x1_SN_LDSB1_CLR1_GSU0_GSUC0_GSUWGMRR0_K1_LBSPPA1024_LBSPPB512_LPA0_LPB0_MIWT8_4_PLR1_SU0_SUM0_SUS0_VWA8_VWB4_WGM8_WGMXCC1_WGMXCCGn1
    SolutionIndex: 35
    SolutionNameMin: Cijk_Ailk_Bjlk_BSS_BH_Bias_HAS_SAV_UserArgs_MT256x128x64_MI16x16x1_SN_LDSB1_CLR1_GSU0_GSUC0_GSUWGMRR0_K1_LBSPPA4096_LBSPPB2048_LPA0_LPB0_MIWT8_4_PLR1_SU0_SUM0_SUS0_VWA8_VWB4_WGM8_WGMXCC1_WGMXCCGn1
    SolutionIndex: 36
    SolutionNameMin: Cijk_Ailk_Bjlk_BSS_BH_Bias_HAS_SAV_UserArgs_MT128x128x64_MI16x16x1_SN_LDSB1_CLR1_GSU0_GSUC0_GSUWGMRR0_K1_LBSPPA512_LBSPPB512_LPA0_LPB0_MIWT4_4_PLR1_SU0_SUM0_SUS0_VWA4_VWB4_WGM1_WGMXCC1_WGMXCCGn1
    SolutionIndex: 37
    SolutionNameMin: Cijk_Ailk_Bjlk_BSS_BH_Bias_HAS_SAV_UserArgs_MT128x128x64_MI16x16x1_SN_LDSB1_CLR1_GSU0_GSUC0_GSUWGMRR0_K1_LBSPPA512_LBSPPB512_LPA0_LPB0_MIWT4_4_PLR1_SU0_SUM0_SUS0_VWA4_VWB4_WGM1_WGMXCC1_WGMXCCGn1
    SolutionIndex: 38
    SolutionNameMin: Cijk_Ailk_Bjlk_BSS_BH_Bias_HAS_SAV_UserArgs_MT128x128x64_MI16x16x1_SN_LDSB1_CLR1_GSU0_GSUC0_GSUWGMRR0_K1_LBSPPA1024_LBSPPB1024_LPA0_LPB0_MIWT4_4_PLR1_SU0_SUM0_SUS0_VWA4_VWB4_WGM1_WGMXCC1_WGMXCCGn1
    SolutionIndex: 39
    SolutionNameMin: Cijk_Ailk_Bjlk_BSS_BH_Bias_HAS_SAV_UserArgs_MT128x128x64_MI16x16x1_SN_LDSB1_CLR1_GSU0_GSUC0_GSUWGMRR0_K1_LBSPPA1024_LBSPPB1024_LPA0_LPB0_MIWT4_4_PLR1_SU0_SUM0_SUS0_VWA4_VWB4_WGM1_WGMXCC1_WGMXCCGn1
    SolutionIndex: 40
    SolutionNameMin: Cijk_Ailk_Bjlk_BSS_BH_Bias_HAS_SAV_UserArgs_MT128x128x64_MI16x16x1_SN_LDSB1_CLR1_GSU0_GSUC0_GSUWGMRR0_K1_LBSPPA1024_LBSPPB1024_LPA0_LPB0_MIWT4_4_PLR1_SU0_SUM0_SUS0_VWA4_VWB4_WGM1_WGMXCC1_WGMXCCGn1
    SolutionIndex: 41
    SolutionNameMin: Cijk_Ailk_Bjlk_BSS_BH_Bias_HAS_SAV_UserArgs_MT128x128x64_MI16x16x1_SN_LDSB1_CLR1_GSU0_GSUC0_GSUWGMRR0_K1_LBSPPA2048_LBSPPB2048_LPA0_LPB0_MIWT4_4_PLR1_SU0_SUM0_SUS0_VWA4_VWB4_WGM1_WGMXCC1_WGMXCCGn1
    SolutionIndex: 42
    SolutionNameMin: Cijk_Ailk_Bjlk_BSS_BH_Bias_HAS_SAV_UserArgs_MT128x128x64_MI16x16x1_SN_LDSB1_CLR1_GSU0_GSUC0_GSUWGMRR0_K1_LBSPPA512_LBSPPB512_LPA0_LPB0_MIWT4_4_PLR1_SU0_SUM0_SUS0_VWA4_VWB4_WGM6_WGMXCC1_WGMXCCGn1
    SolutionIndex: 43
    SolutionNameMin: Cijk_Ailk_Bjlk_BSS_BH_Bias_HAS_SAV_UserArgs_MT128x128x64_MI16x16x1_SN_LDSB1_CLR1_GSU0_GSUC0_GSUWGMRR0_K1_LBSPPA1024_LBSPPB1024_LPA0_LPB0_MIWT4_4_PLR1_SU0_SUM0_SUS0_VWA4_VWB4_WGM6_WGMXCC1_WGMXCCGn1
    SolutionIndex: 44
    SolutionNameMin: Cijk_Ailk_Bjlk_BSS_BH_Bias_HAS_SAV_UserArgs_MT128x128x64_MI16x16x1_SN_LDSB1_CLR1_GSU0_GSUC0_GSUWGMRR0_K1_LBSPPA2048_LBSPPB2048_LPA0_LPB0_MIWT4_4_PLR1_SU0_SUM0_SUS0_VWA4_VWB4_WGM6_WGMXCC1_WGMXCCGn1
    SolutionIndex: 45
    SolutionNameMin: Cijk_Ailk_Bjlk_BSS_BH_Bias_HAS_SAV_UserArgs_MT128x128x64_MI16x16x1_SN_LDSB1_CLR1_GSU0_GSUC0_GSUWGMRR0_K1_LBSPPA2048_LBSPPB2048_LPA0_LPB0_MIWT4_4_PLR1_SU0_SUM0_SUS0_VWA4_VWB4_WGM6_WGMXCC1_WGMXCCGn1
    SolutionIndex: 46
    SolutionNameMin: Cijk_Ailk_Bjlk_BSS_BH_Bias_HAS_SAV_UserArgs_MT128x128x64_MI16x16x1_SN_LDSB1_CLR1_GSU0_GSUC0_GSUWGMRR0_K1_LBSPPA2048_LBSPPB2048_LPA0_LPB0_MIWT4_4_PLR1_SU0_SUM0_SUS0_VWA4_VWB4_WGM6_WGMXCC1_WGMXCCGn1
    SolutionIndex: 47
    SolutionNameMin: Cijk_Ailk_Bjlk_BSS_BH_Bias_HAS_SAV_UserArgs_MT128x128x64_MI16x16x1_SN_LDSB1_CLR1_GSU0_GSUC0_GSUWGMRR0_K1_LBSPPA512_LBSPPB512_LPA0_LPB0_MIWT4_4_PLR1_SU0_SUM0_SUS0_VWA4_VWB4_WGM8_WGMXCC1_WGMXCCGn1
    SolutionIndex: 48
    SolutionNameMin: Cijk_Ailk_Bjlk_BSS_BH_Bias_HAS_SAV_UserArgs_MT128x128x64_MI16x16x1_SN_LDSB1_CLR1_GSU0_GSUC0_GSUWGMRR0_K1_LBSPPA1024_LBSPPB1024_LPA0_LPB0_MIWT4_4_PLR1_SU0_SUM0_SUS0_VWA4_VWB4_WGM8_WGMXCC1_WGMXCCGn1
    SolutionIndex: 49
    SolutionNameMin: Cijk_Ailk_Bjlk_BSS_BH_Bias_HAS_SAV_UserArgs_MT128x128x64_MI16x16x1_SN_LDSB1_CLR1_GSU0_GSUC0_GSUWGMRR0_K1_LBSPPA2048_LBSPPB2048_LPA0_LPB0_MIWT4_4_PLR1_SU0_SUM0_SUS0_VWA4_VWB4_WGM8_WGMXCC1_WGMXCCGn1
    SolutionIndex: 50
    SolutionNameMin: Cijk_Ailk_Bjlk_BSS_BH_Bias_HAS_SAV_UserArgs_MT128x128x64_MI16x16x1_SN_LDSB1_CLR1_GSU0_GSUC0_GSUWGMRR0_K1_LBSPPA2048_LBSPPB2048_LPA0_LPB0_MIWT4_4_PLR1_SU0_SUM0_SUS0_VWA4_VWB4_WGM8_WGMXCC1_WGMXCCGn1
    SolutionIndex: 51
    SolutionNameMin: Cijk_Ailk_Bjlk_BSS_BH_Bias_HAS_SAV_UserArgs_MT128x64x64_MI16x16x1_SN_LDSB1_CLR1_GSU0_GSUC0_GSUWGMRR0_K1_LBSPPA512_LBSPPB256_LPA0_LPB32_MIWT4_2_PLR1_SU0_SUM0_SUS0_VWA4_VWB2_WGM1_WGMXCC1_WGMXCCGn1
    SolutionIndex: 52
    SolutionNameMin: Cijk_Ailk_Bjlk_BSS_BH_Bias_HAS_SAV_UserArgs_MT128x64x64_MI16x16x1_SN_LDSB1_CLR1_GSU0_GSUC0_GSUWGMRR0_K1_LBSPPA512_LBSPPB256_LPA0_LPB32_MIWT4_2_PLR1_SU0_SUM0_SUS0_VWA4_VWB2_WGM1_WGMXCC1_WGMXCCGn1
    SolutionIndex: 53
    SolutionNameMin: Cijk_Ailk_Bjlk_BSS_BH_Bias_HAS_SAV_UserArgs_MT128x64x64_MI16x16x1_SN_LDSB1_CLR1_GSU0_GSUC0_GSUWGMRR0_K1_LBSPPA1024_LBSPPB512_LPA0_LPB32_MIWT4_2_PLR1_SU0_SUM0_SUS0_VWA4_VWB2_WGM1_WGMXCC1_WGMXCCGn1
    SolutionIndex: 54
    SolutionNameMin: Cijk_Ailk_Bjlk_BSS_BH_Bias_HAS_SAV_UserArgs_MT128x64x64_MI16x16x1_SN_LDSB1_CLR1_GSU0_GSUC0_GSUWGMRR0_K1_LBSPPA1024_LBSPPB512_LPA0_LPB32_MIWT4_2_PLR1_SU0_SUM0_SUS0_VWA4_VWB2_WGM1_WGMXCC1_WGMXCCGn1
    SolutionIndex: 55
    SolutionNameMin: Cijk_Ailk_Bjlk_BSS_BH_Bias_HAS_SAV_UserArgs_MT128x64x64_MI16x16x1_SN_LDSB1_CLR1_GSU0_GSUC0_GSUWGMRR0_K1_LBSPPA2048_LBSPPB1024_LPA0_LPB32_MIWT4_2_PLR1_SU0_SUM0_SUS0_VWA4_VWB2_WGM1_WGMXCC1_WGMXCCGn1
    SolutionIndex: 56
    SolutionNameMin: Cijk_Ailk_Bjlk_BSS_BH_Bias_HAS_SAV_UserArgs_MT128x64x64_MI16x16x1_SN_LDSB1_CLR1_GSU0_GSUC0_GSUWGMRR0_K1_LBSPPA2048_LBSPPB1024_LPA0_LPB32_MIWT4_2_PLR1_SU0_SUM0_SUS0_VWA4_VWB2_WGM1_WGMXCC1_WGMXCCGn1
    SolutionIndex: 57
    SolutionNameMin: Cijk_Ailk_Bjlk_BSS_BH_Bias_HAS_SAV_UserArgs_MT128x64x64_MI16x16x1_SN_LDSB1_CLR1_GSU0_GSUC0_GSUWGMRR0_K1_LBSPPA512_LBSPPB256_LPA0_LPB32_MIWT4_2_PLR1_SU0_SUM0_SUS0_VWA4_VWB2_WGM6_WGMXCC1_WGMXCCGn1
    SolutionIndex: 58
    SolutionNameMin: Cijk_Ailk_Bjlk_BSS_BH_Bias_HAS_SAV_UserArgs_MT128x64x64_MI16x16x1_SN_LDSB1_CLR1_GSU0_GSUC0_GSUWGMRR0_K1_LBSPPA1024_LBSPPB512_LPA0_LPB32_MIWT4_2_PLR1_SU0_SUM0_SUS0_VWA4_VWB2_WGM6_WGMXCC1_WGMXCCGn1
    SolutionIndex: 59
    SolutionNameMin: Cijk_Ailk_Bjlk_BSS_BH_Bias_HAS_SAV_UserArgs_MT128x64x64_MI16x16x1_SN_LDSB1_CLR1_GSU0_GSUC0_GSUWGMRR0_K1_LBSPPA2048_LBSPPB1024_LPA0_LPB32_MIWT4_2_PLR1_SU0_SUM0_SUS0_VWA4_VWB2_WGM6_WGMXCC1_WGMXCCGn1
    SolutionIndex: 60
    SolutionNameMin: Cijk_Ailk_Bjlk_BSS_BH_Bias_HAS_SAV_UserArgs_MT128x64x64_MI16x16x1_SN_LDSB1_CLR1_GSU0_GSUC0_GSUWGMRR0_K1_LBSPPA2048_LBSPPB1024_LPA0_LPB32_MIWT4_2_PLR1_SU0_SUM0_SUS0_VWA4_VWB2_WGM6_WGMXCC1_WGMXCCGn1
    SolutionIndex: 61
    SolutionNameMin: Cijk_Ailk_Bjlk_BSS_BH_Bias_HAS_SAV_UserArgs_MT128x64x64_MI16x16x1_SN_LDSB1_CLR1_GSU0_GSUC0_GSUWGMRR0_K1_LBSPPA512_LBSPPB256_LPA0_LPB32_MIWT4_2_PLR1_SU0_SUM0_SUS0_VWA4_VWB2_WGM8_WGMXCC1_WGMXCCGn1
    SolutionIndex: 62
    SolutionNameMin: Cijk_Ailk_Bjlk_BSS_BH_Bias_HAS_SAV_UserArgs_MT128x64x64_MI16x16x1_SN_LDSB1_CLR1_GSU0_GSUC0_GSUWGMRR0_K1_LBSPPA1024_LBSPPB512_LPA0_LPB32_MIWT4_2_PLR1_SU0_SUM0_SUS0_VWA4_VWB2_WGM8_WGMXCC1_WGMXCCGn1
    SolutionIndex: 63
    SolutionNameMin: Cijk_Ailk_Bjlk_BSS_BH_Bias_HAS_SAV_UserArgs_MT128x64x64_MI16x16x1_SN_LDSB1_CLR1_GSU0_GSUC0_GSUWGMRR0_K1_LBSPPA2048_LBSPPB1024_LPA0_LPB32_MIWT4_2_PLR1_SU0_SUM0_SUS0_VWA4_VWB2_WGM8_WGMXCC1_WGMXCCGn1
    SolutionIndex: 64
    SolutionNameMin: Cijk_Ailk_Bjlk_BSS_BH_Bias_HAS_SAV_UserArgs_MT64x64x64_MI16x16x1_SN_LDSB1_CLR1_GSU0_GSUC0_GSUWGMRR0_K1_LBSPPA1024_LBSPPB1024_LPA32_LPB32_MIWT2_2_PLR1_SU0_SUM0_SUS0_VWA2_VWB2_WGM6_WGMXCC1_WGMXCCGn1
    SolutionIndex: 65
    SolutionNameMin: Cijk_Ailk_Bjlk_BSS_BH_Bias_HAS_SAV_UserArgs_MT256x256x64_MI32x32x1_SN_LDSB0_CLR1_GSU0_GSUC0_GSUWGMRR0_K1_LBSPPA0_LBSPPB0_LPA0_LPB0_MIWT4_4_PLR1_SU0_SUM0_SUS0_VWA4_VWB4_WGM1_WGMXCC1_WGMXCCGn1
    SolutionIndex: 66
    SolutionNameMin: Cijk_Ailk_Bjlk_BSS_BH_Bias_HAS_SAV_UserArgs_MT256x256x64_MI32x32x1_SN_LDSB0_CLR1_GSU0_GSUC0_GSUWGMRR0_K1_LBSPPA0_LBSPPB0_LPA0_LPB0_MIWT4_4_PLR1_SU0_SUM0_SUS0_VWA4_VWB4_WGM6_WGMXCC1_WGMXCCGn1
    SolutionIndex: 67
    SolutionNameMin: Cijk_Ailk_Bjlk_BSS_BH_Bias_HAS_SAV_UserArgs_MT256x256x64_MI32x32x1_SN_LDSB0_CLR1_GSU0_GSUC0_GSUWGMRR0_K1_LBSPPA0_LBSPPB0_LPA0_LPB0_MIWT4_4_PLR1_SU0_SUM0_SUS0_VWA4_VWB4_WGM6_WGMXCC1_WGMXCCGn1
    SolutionIndex: 68
    SolutionNameMin: Cijk_Ailk_Bjlk_BSS_BH_Bias_HAS_SAV_UserArgs_MT256x256x64_MI32x32x1_SN_LDSB0_CLR1_GSU0_GSUC0_GSUWGMRR0_K1_LBSPPA0_LBSPPB0_LPA0_LPB0_MIWT4_4_PLR1_SU0_SUM0_SUS0_VWA4_VWB4_WGM6_WGMXCC1_WGMXCCGn1
    SolutionIndex: 69
    SolutionNameMin: Cijk_Ailk_Bjlk_BSS_BH_Bias_HAS_SAV_UserArgs_MT256x256x64_MI32x32x1_SN_LDSB0_CLR1_GSU0_GSUC0_GSUWGMRR0_K1_LBSPPA0_LBSPPB0_LPA0_LPB0_MIWT4_4_PLR1_SU0_SUM0_SUS0_VWA4_VWB4_WGM8_WGMXCC1_WGMXCCGn1
    SolutionIndex: 70
    SolutionNameMin: Cijk_Ailk_Bjlk_BSS_BH_Bias_HAS_SAV_UserArgs_MT256x256x64_MI32x32x1_SN_LDSB0_CLR1_GSU0_GSUC0_GSUWGMRR0_K1_LBSPPA0_LBSPPB0_LPA0_LPB0_MIWT4_4_PLR1_SU0_SUM0_SUS0_VWA4_VWB4_WGM8_WGMXCC1_WGMXCCGn1
    SolutionIndex: 71
    SolutionNameMin: Cijk_Ailk_Bjlk_BSS_BH_Bias_HAS_SAV_UserArgs_MT256x256x64_MI32x32x1_SN_LDSB0_CLR1_GSU0_GSUC0_GSUWGMRR0_K1_LBSPPA0_LBSPPB0_LPA0_LPB0_MIWT4_4_PLR1_SU0_SUM0_SUS0_VWA4_VWB4_WGM8_WGMXCC1_WGMXCCGn1
    SolutionIndex: 72
    SolutionNameMin: Cijk_Ailk_Bjlk_BSS_BH_Bias_HAS_SAV_UserArgs_MT256x128x64_MI32x32x1_SN_LDSB1_CLR1_GSU0_GSUC0_GSUWGMRR0_K1_LBSPPA0_LBSPPB0_LPA0_LPB0_MIWT4_2_PLR1_SU0_SUM0_SUS0_VWA4_VWB2_WGM6_WGMXCC1_WGMXCCGn1
    SolutionIndex: 73
    SolutionNameMin: Cijk_Ailk_Bjlk_BSS_BH_Bias_HAS_SAV_UserArgs_MT256x128x64_MI32x32x1_SN_LDSB1_CLR1_GSU0_GSUC0_GSUWGMRR0_K1_LBSPPA0_LBSPPB0_LPA0_LPB0_MIWT4_2_PLR1_SU0_SUM0_SUS0_VWA4_VWB2_WGM6_WGMXCC1_WGMXCCGn1
    SolutionIndex: 74
    SolutionNameMin: Cijk_Ailk_Bjlk_BSS_BH_Bias_HAS_SAV_UserArgs_MT256x128x64_MI32x32x1_SN_LDSB1_CLR1_GSU0_GSUC0_GSUWGMRR0_K1_LBSPPA0_LBSPPB0_LPA0_LPB0_MIWT4_2_PLR1_SU0_SUM0_SUS0_VWA4_VWB2_WGM8_WGMXCC1_WGMXCCGn1
    SolutionIndex: 75
    SolutionNameMin: Cijk_Ailk_Bjlk_BSS_BH_Bias_HAS_SAV_UserArgs_MT128x128x64_MI32x32x1_SN_LDSB1_CLR1_GSU0_GSUC0_GSUWGMRR0_K1_LBSPPA0_LBSPPB0_LPA0_LPB0_MIWT2_2_PLR1_SU0_SUM0_SUS0_VWA2_VWB2_WGM1_WGMXCC1_WGMXCCGn1
    SolutionIndex: 76
    SolutionNameMin: Cijk_Ailk_Bjlk_BSS_BH_Bias_HAS_SAV_UserArgs_MT128x128x64_MI32x32x1_SN_LDSB1_CLR1_GSU0_GSUC0_GSUWGMRR0_K1_LBSPPA0_LBSPPB0_LPA0_LPB0_MIWT2_2_PLR1_SU0_SUM0_SUS0_VWA2_VWB2_WGM6_WGMXCC1_WGMXCCGn1
    SolutionIndex: 77
    SolutionNameMin: Cijk_Ailk_Bjlk_BSS_BH_Bias_HAS_SAV_UserArgs_MT128x128x128_MI16x16x1_SN_LDSB1_CLR1_GSU0_GSUC0_GSUWGMRR0_K1_LBSPPA512_LBSPPB512_LPA0_LPB0_MIWT4_4_PLR1_SU0_SUM0_SUS0_VWA4_VWB4_WGM1_WGMXCC1_WGMXCCGn1
    SolutionIndex: 78
    SolutionNameMin: Cijk_Ailk_Bjlk_BSS_BH_Bias_HAS_SAV_UserArgs_MT128x128x128_MI16x16x1_SN_LDSB1_CLR1_GSU0_GSUC0_GSUWGMRR0_K1_LBSPPA2048_LBSPPB2048_LPA0_LPB0_MIWT4_4_PLR1_SU0_SUM0_SUS0_VWA4_VWB4_WGM1_WGMXCC1_WGMXCCGn1
    SolutionIndex: 79
    SolutionNameMin: Cijk_Ailk_Bjlk_BSS_BH_Bias_HAS_SAV_UserArgs_MT128x128x128_MI16x16x1_SN_LDSB1_CLR1_GSU0_GSUC0_GSUWGMRR0_K1_LBSPPA512_LBSPPB512_LPA0_LPB0_MIWT4_4_PLR1_SU0_SUM0_SUS0_VWA4_VWB4_WGM6_WGMXCC1_WGMXCCGn1
    SolutionIndex: 80
    SolutionNameMin: Cijk_Ailk_Bjlk_BSS_BH_Bias_HAS_SAV_UserArgs_MT128x128x128_MI16x16x1_SN_LDSB1_CLR1_GSU0_GSUC0_GSUWGMRR0_K1_LBSPPA2048_LBSPPB2048_LPA0_LPB0_MIWT4_4_PLR1_SU0_SUM0_SUS0_VWA4_VWB4_WGM6_WGMXCC1_WGMXCCGn1
    SolutionIndex: 81
    SolutionNameMin: Cijk_Ailk_Bjlk_BSS_BH_Bias_HAS_SAV_UserArgs_MT128x128x128_MI16x16x1_SN_LDSB1_CLR1_GSU0_GSUC0_GSUWGMRR0_K1_LBSPPA512_LBSPPB512_LPA0_LPB0_MIWT4_4_PLR1_SU0_SUM0_SUS0_VWA4_VWB4_WGM8_WGMXCC1_WGMXCCGn1
    SolutionIndex: 82
    SolutionNameMin: Cijk_Ailk_Bjlk_BSS_BH_Bias_HAS_SAV_UserArgs_MT128x64x128_MI16x16x1_SN_LDSB1_CLR1_GSU0_GSUC0_GSUWGMRR0_K1_LBSPPA512_LBSPPB256_LPA0_LPB32_MIWT4_2_PLR1_SU0_SUM0_SUS0_VWA4_VWB2_WGM1_WGMXCC1_WGMXCCGn1
    SolutionIndex: 83
    SolutionNameMin: Cijk_Ailk_Bjlk_BSS_BH_Bias_HAS_SAV_UserArgs_MT128x64x128_MI16x16x1_SN_LDSB1_CLR1_GSU0_GSUC0_GSUWGMRR0_K1_LBSPPA2048_LBSPPB1024_LPA0_LPB32_MIWT4_2_PLR1_SU0_SUM0_SUS0_VWA4_VWB2_WGM1_WGMXCC1_WGMXCCGn1
    SolutionIndex: 84
    SolutionNameMin: Cijk_Ailk_Bjlk_BSS_BH_Bias_HAS_SAV_UserArgs_MT128x64x128_MI16x16x1_SN_LDSB1_CLR1_GSU0_GSUC0_GSUWGMRR0_K1_LBSPPA1024_LBSPPB512_LPA0_LPB32_MIWT4_2_PLR1_SU0_SUM0_SUS0_VWA4_VWB2_WGM8_WGMXCC1_WGMXCCGn1
    SolutionIndex: 85
    SolutionNameMin: Cijk_Ailk_Bjlk_BSS_BH_Bias_HAS_SAV_UserArgs_MT128x64x128_MI16x16x1_SN_LDSB1_CLR1_GSU0_GSUC0_GSUWGMRR0_K1_LBSPPA2048_LBSPPB1024_LPA0_LPB32_MIWT4_2_PLR1_SU0_SUM0_SUS0_VWA4_VWB2_WGM8_WGMXCC1_WGMXCCGn1
    SolutionIndex: 86
    SolutionNameMin: Cijk_Ailk_Bjlk_BSS_BH_Bias_HAS_SAV_UserArgs_MT64x64x128_MI16x16x1_SN_LDSB1_CLR1_GSU0_GSUC0_GSUWGMRR0_K1_LBSPPA256_LBSPPB256_LPA32_LPB32_MIWT2_2_PLR1_SU0_SUM0_SUS0_VWA2_VWB2_WGM1_WGMXCC1_WGMXCCGn1
    SolutionIndex: 87
    SolutionNameMin: Cijk_Ailk_Bjlk_BSS_BH_Bias_HAS_SAV_UserArgs_MT64x64x128_MI16x16x1_SN_LDSB1_CLR1_GSU0_GSUC0_GSUWGMRR0_K1_LBSPPA512_LBSPPB512_LPA32_LPB32_MIWT2_2_PLR1_SU0_SUM0_SUS0_VWA2_VWB2_WGM1_WGMXCC1_WGMXCCGn1
    SolutionIndex: 88
    SolutionNameMin: Cijk_Ailk_Bjlk_BSS_BH_Bias_HAS_SAV_UserArgs_MT64x64x128_MI16x16x1_SN_LDSB1_CLR1_GSU0_GSUC0_GSUWGMRR0_K1_LBSPPA1024_LBSPPB1024_LPA32_LPB32_MIWT2_2_PLR1_SU0_SUM0_SUS0_VWA2_VWB2_WGM1_WGMXCC1_WGMXCCGn1
    SolutionIndex: 89
    SolutionNameMin: Cijk_Ailk_Bjlk_BSS_BH_Bias_HAS_SAV_UserArgs_MT64x64x128_MI16x16x1_SN_LDSB1_CLR1_GSU0_GSUC0_GSUWGMRR0_K1_LBSPPA1024_LBSPPB1024_LPA32_LPB32_MIWT2_2_PLR1_SU0_SUM0_SUS0_VWA2_VWB2_WGM1_WGMXCC1_WGMXCCGn1
    SolutionIndex: 90
    SolutionNameMin: Cijk_Ailk_Bjlk_BSS_BH_Bias_HAS_SAV_UserArgs_MT64x64x128_MI16x16x1_SN_LDSB1_CLR1_GSU0_GSUC0_GSUWGMRR0_K1_LBSPPA256_LBSPPB256_LPA32_LPB32_MIWT2_2_PLR1_SU0_SUM0_SUS0_VWA2_VWB2_WGM6_WGMXCC1_WGMXCCGn1
    SolutionIndex: 91
    SolutionNameMin: Cijk_Ailk_Bjlk_BSS_BH_Bias_HAS_SAV_UserArgs_MT64x64x128_MI16x16x1_SN_LDSB1_CLR1_GSU0_GSUC0_GSUWGMRR0_K1_LBSPPA512_LBSPPB512_LPA32_LPB32_MIWT2_2_PLR1_SU0_SUM0_SUS0_VWA2_VWB2_WGM6_WGMXCC1_WGMXCCGn1
    SolutionIndex: 92
    SolutionNameMin: Cijk_Ailk_Bjlk_BSS_BH_Bias_HAS_SAV_UserArgs_MT64x64x128_MI16x16x1_SN_LDSB1_CLR1_GSU0_GSUC0_GSUWGMRR0_K1_LBSPPA1024_LBSPPB1024_LPA32_LPB32_MIWT2_2_PLR1_SU0_SUM0_SUS0_VWA2_VWB2_WGM6_WGMXCC1_WGMXCCGn1
    SolutionIndex: 93
    SolutionNameMin: Cijk_Ailk_Bjlk_BSS_BH_Bias_HAS_SAV_UserArgs_MT64x64x128_MI16x16x1_SN_LDSB1_CLR1_GSU0_GSUC0_GSUWGMRR0_K1_LBSPPA256_LBSPPB256_LPA32_LPB32_MIWT2_2_PLR1_SU0_SUM0_SUS0_VWA2_VWB2_WGM8_WGMXCC1_WGMXCCGn1
    SolutionIndex: 94
    SolutionNameMin: Cijk_Ailk_Bjlk_BSS_BH_Bias_HAS_SAV_UserArgs_MT64x64x128_MI16x16x1_SN_LDSB1_CLR1_GSU0_GSUC0_GSUWGMRR0_K1_LBSPPA512_LBSPPB512_LPA32_LPB32_MIWT2_2_PLR1_SU0_SUM0_SUS0_VWA2_VWB2_WGM8_WGMXCC1_WGMXCCGn1
    SolutionIndex: 95
    SolutionNameMin: Cijk_Ailk_Bjlk_BSS_BH_Bias_HAS_SAV_UserArgs_MT64x64x128_MI16x16x1_SN_LDSB1_CLR1_GSU0_GSUC0_GSUWGMRR0_K1_LBSPPA1024_LBSPPB1024_LPA32_LPB32_MIWT2_2_PLR1_SU0_SUM0_SUS0_VWA2_VWB2_WGM8_WGMXCC1_WGMXCCGn1
    SolutionIndex: 96
    SolutionNameMin: Cijk_Ailk_Bjlk_BSS_BH_Bias_HAS_SAV_UserArgs_MT32x64x128_MI16x16x1_SN_LDSB1_CLR1_GSU0_GSUC0_GSUWGMRR0_K1_LBSPPA128_LBSPPB256_LPA16_LPB32_MIWT1_2_PLR1_SU0_SUM0_SUS0_VWA1_VWB2_WGM1_WGMXCC1_WGMXCCGn1
    SolutionIndex: 97
    SolutionNameMin: Cijk_Ailk_Bjlk_BSS_BH_Bias_HAS_SAV_UserArgs_MT32x64x128_MI16x16x1_SN_LDSB1_CLR1_GSU0_GSUC0_GSUWGMRR0_K1_LBSPPA128_LBSPPB256_LPA16_LPB32_MIWT1_2_PLR1_SU0_SUM0_SUS0_VWA1_VWB2_WGM1_WGMXCC1_WGMXCCGn1
    SolutionIndex: 98
    SolutionNameMin: Cijk_Ailk_Bjlk_BSS_BH_Bias_HAS_SAV_UserArgs_MT32x64x128_MI16x16x1_SN_LDSB1_CLR1_GSU0_GSUC0_GSUWGMRR0_K1_LBSPPA128_LBSPPB256_LPA16_LPB32_MIWT1_2_PLR1_SU0_SUM0_SUS0_VWA1_VWB2_WGM1_WGMXCC1_WGMXCCGn1
    SolutionIndex: 99
    SolutionNameMin: Cijk_Ailk_Bjlk_BSS_BH_Bias_HAS_SAV_UserArgs_MT32x64x128_MI16x16x1_SN_LDSB1_CLR1_GSU0_GSUC0_GSUWGMRR0_K1_LBSPPA256_LBSPPB512_LPA16_LPB32_MIWT1_2_PLR1_SU0_SUM0_SUS0_VWA1_VWB2_WGM1_WGMXCC1_WGMXCCGn1
    SolutionIndex: 100
    SolutionNameMin: Cijk_Ailk_Bjlk_BSS_BH_Bias_HAS_SAV_UserArgs_MT32x64x128_MI16x16x1_SN_LDSB1_CLR1_GSU0_GSUC0_GSUWGMRR0_K1_LBSPPA256_LBSPPB512_LPA16_LPB32_MIWT1_2_PLR1_SU0_SUM0_SUS0_VWA1_VWB2_WGM1_WGMXCC1_WGMXCCGn1
    SolutionIndex: 101
    SolutionNameMin: Cijk_Ailk_Bjlk_BSS_BH_Bias_HAS_SAV_UserArgs_MT32x64x128_MI16x16x1_SN_LDSB1_CLR1_GSU0_GSUC0_GSUWGMRR0_K1_LBSPPA512_LBSPPB1024_LPA16_LPB32_MIWT1_2_PLR1_SU0_SUM0_SUS0_VWA1_VWB2_WGM1_WGMXCC1_WGMXCCGn1
    SolutionIndex: 102
    SolutionNameMin: Cijk_Ailk_Bjlk_BSS_BH_Bias_HAS_SAV_UserArgs_MT32x64x128_MI16x16x1_SN_LDSB1_CLR1_GSU0_GSUC0_GSUWGMRR0_K1_LBSPPA512_LBSPPB1024_LPA16_LPB32_MIWT1_2_PLR1_SU0_SUM0_SUS0_VWA1_VWB2_WGM1_WGMXCC1_WGMXCCGn1
    SolutionIndex: 103
    SolutionNameMin: Cijk_Ailk_Bjlk_BSS_BH_Bias_HAS_SAV_UserArgs_MT32x64x128_MI16x16x1_SN_LDSB1_CLR1_GSU0_GSUC0_GSUWGMRR0_K1_LBSPPA512_LBSPPB1024_LPA16_LPB32_MIWT1_2_PLR1_SU0_SUM0_SUS0_VWA1_VWB2_WGM1_WGMXCC1_WGMXCCGn1
    SolutionIndex: 104
    SolutionNameMin: Cijk_Ailk_Bjlk_BSS_BH_Bias_HAS_SAV_UserArgs_MT32x64x128_MI16x16x1_SN_LDSB1_CLR1_GSU0_GSUC0_GSUWGMRR0_K1_LBSPPA512_LBSPPB1024_LPA16_LPB32_MIWT1_2_PLR1_SU0_SUM0_SUS0_VWA1_VWB2_WGM6_WGMXCC1_WGMXCCGn1
    SolutionIndex: 105
    SolutionNameMin: Cijk_Ailk_Bjlk_BSS_BH_Bias_HAS_SAV_UserArgs_MT32x64x128_MI16x16x1_SN_LDSB1_CLR1_GSU0_GSUC0_GSUWGMRR0_K1_LBSPPA128_LBSPPB256_LPA16_LPB32_MIWT1_2_PLR1_SU0_SUM0_SUS0_VWA1_VWB2_WGM8_WGMXCC1_WGMXCCGn1
    SolutionIndex: 106
    SolutionNameMin: Cijk_Ailk_Bjlk_BSS_BH_Bias_HAS_SAV_UserArgs_MT32x64x128_MI16x16x1_SN_LDSB1_CLR1_GSU0_GSUC0_GSUWGMRR0_K1_LBSPPA512_LBSPPB1024_LPA16_LPB32_MIWT1_2_PLR1_SU0_SUM0_SUS0_VWA1_VWB2_WGM8_WGMXCC1_WGMXCCGn1
    SolutionIndex: 107
    SolutionNameMin: Cijk_Ailk_Bjlk_BSS_BH_Bias_HAS_SAV_UserArgs_MT64x32x128_MI16x16x1_SN_LDSB1_CLR1_GSU0_GSUC0_GSUWGMRR0_K1_LBSPPA256_LBSPPB128_LPA32_LPB16_MIWT2_1_PLR1_SU0_SUM0_SUS0_VWA2_VWB1_WGM1_WGMXCC1_WGMXCCGn1
    SolutionIndex: 108
    SolutionNameMin: Cijk_Ailk_Bjlk_BSS_BH_Bias_HAS_SAV_UserArgs_MT64x32x128_MI16x16x1_SN_LDSB1_CLR1_GSU0_GSUC0_GSUWGMRR0_K1_LBSPPA256_LBSPPB128_LPA32_LPB16_MIWT2_1_PLR1_SU0_SUM0_SUS0_VWA2_VWB1_WGM1_WGMXCC1_WGMXCCGn1
    SolutionIndex: 109
    SolutionNameMin: Cijk_Ailk_Bjlk_BSS_BH_Bias_HAS_SAV_UserArgs_MT64x32x128_MI16x16x1_SN_LDSB1_CLR1_GSU0_GSUC0_GSUWGMRR0_K1_LBSPPA1024_LBSPPB512_LPA32_LPB16_MIWT2_1_PLR1_SU0_SUM0_SUS0_VWA2_VWB1_WGM1_WGMXCC1_WGMXCCGn1
    SolutionIndex: 110
    SolutionNameMin: Cijk_Ailk_Bjlk_BSS_BH_Bias_HAS_SAV_UserArgs_MT64x32x128_MI16x16x1_SN_LDSB1_CLR1_GSU0_GSUC0_GSUWGMRR0_K1_LBSPPA256_LBSPPB128_LPA32_LPB16_MIWT2_1_PLR1_SU0_SUM0_SUS0_VWA2_VWB1_WGM6_WGMXCC1_WGMXCCGn1
    SolutionIndex: 111
    SolutionNameMin: Cijk_Ailk_Bjlk_BSS_BH_Bias_HAS_SAV_UserArgs_MT64x32x128_MI16x16x1_SN_LDSB1_CLR1_GSU0_GSUC0_GSUWGMRR0_K1_LBSPPA1024_LBSPPB512_LPA32_LPB16_MIWT2_1_PLR1_SU0_SUM0_SUS0_VWA2_VWB1_WGM6_WGMXCC1_WGMXCCGn1
    SolutionIndex: 112
    SolutionNameMin: Cijk_Ailk_Bjlk_BSS_BH_Bias_HAS_SAV_UserArgs_MT64x32x128_MI16x16x1_SN_LDSB1_CLR1_GSU0_GSUC0_GSUWGMRR0_K1_LBSPPA256_LBSPPB128_LPA32_LPB16_MIWT2_1_PLR1_SU0_SUM0_SUS0_VWA2_VWB1_WGM8_WGMXCC1_WGMXCCGn1
    SolutionIndex: 113
    SolutionNameMin: Cijk_Ailk_Bjlk_BSS_BH_Bias_HAS_SAV_UserArgs_MT64x32x128_MI16x16x1_SN_LDSB1_CLR1_GSU0_GSUC0_GSUWGMRR0_K1_LBSPPA512_LBSPPB256_LPA32_LPB16_MIWT2_1_PLR1_SU0_SUM0_SUS0_VWA2_VWB1_WGM8_WGMXCC1_WGMXCCGn1
    SolutionIndex: 114
    SolutionNameMin: Cijk_Ailk_Bjlk_BSS_BH_Bias_HAS_SAV_UserArgs_MT64x32x128_MI16x16x1_SN_LDSB1_CLR1_GSU0_GSUC0_GSUWGMRR0_K1_LBSPPA1024_LBSPPB512_LPA32_LPB16_MIWT2_1_PLR1_SU0_SUM0_SUS0_VWA2_VWB1_WGM8_WGMXCC1_WGMXCCGn1
    SolutionIndex: 115
    SolutionNameMin: Cijk_Ailk_Bjlk_BSS_BH_Bias_HAS_SAV_UserArgs_MT32x32x128_MI16x16x1_SN_LDSB1_CLR1_GSU0_GSUC0_GSUWGMRR0_K1_LBSPPA128_LBSPPB128_LPA16_LPB16_MIWT1_1_PLR1_SU0_SUM0_SUS0_VWA1_VWB1_WGM1_WGMXCC1_WGMXCCGn1
    SolutionIndex: 116
    SolutionNameMin: Cijk_Ailk_Bjlk_BSS_BH_Bias_HAS_SAV_UserArgs_MT32x32x128_MI16x16x1_SN_LDSB1_CLR1_GSU0_GSUC0_GSUWGMRR0_K1_LBSPPA128_LBSPPB128_LPA16_LPB16_MIWT1_1_PLR1_SU0_SUM0_SUS0_VWA1_VWB1_WGM1_WGMXCC1_WGMXCCGn1
    SolutionIndex: 117
    SolutionNameMin: Cijk_Ailk_Bjlk_BSS_BH_Bias_HAS_SAV_UserArgs_MT32x32x128_MI16x16x1_SN_LDSB1_CLR1_GSU0_GSUC0_GSUWGMRR0_K1_LBSPPA128_LBSPPB128_LPA16_LPB16_MIWT1_1_PLR1_SU0_SUM0_SUS0_VWA1_VWB1_WGM1_WGMXCC1_WGMXCCGn1
    SolutionIndex: 118
    SolutionNameMin: Cijk_Ailk_Bjlk_BSS_BH_Bias_HAS_SAV_UserArgs_MT32x32x128_MI16x16x1_SN_LDSB1_CLR1_GSU0_GSUC0_GSUWGMRR0_K1_LBSPPA128_LBSPPB128_LPA16_LPB16_MIWT1_1_PLR1_SU0_SUM0_SUS0_VWA1_VWB1_WGM1_WGMXCC1_WGMXCCGn1
    SolutionIndex: 119
    SolutionNameMin: Cijk_Ailk_Bjlk_BSS_BH_Bias_HAS_SAV_UserArgs_MT32x32x128_MI16x16x1_SN_LDSB1_CLR1_GSU0_GSUC0_GSUWGMRR0_K1_LBSPPA128_LBSPPB128_LPA16_LPB16_MIWT1_1_PLR1_SU0_SUM0_SUS0_VWA1_VWB1_WGM1_WGMXCC1_WGMXCCGn1
    SolutionIndex: 120
    SolutionNameMin: Cijk_Ailk_Bjlk_BSS_BH_Bias_HAS_SAV_UserArgs_MT32x32x128_MI16x16x1_SN_LDSB1_CLR1_GSU0_GSUC0_GSUWGMRR0_K1_LBSPPA128_LBSPPB128_LPA16_LPB16_MIWT1_1_PLR1_SU0_SUM0_SUS0_VWA1_VWB1_WGM1_WGMXCC1_WGMXCCGn1
    SolutionIndex: 121
    SolutionNameMin: Cijk_Ailk_Bjlk_BSS_BH_Bias_HAS_SAV_UserArgs_MT32x32x128_MI16x16x1_SN_LDSB1_CLR1_GSU0_GSUC0_GSUWGMRR0_K1_LBSPPA128_LBSPPB128_LPA16_LPB16_MIWT1_1_PLR1_SU0_SUM0_SUS0_VWA1_VWB1_WGM1_WGMXCC1_WGMXCCGn1
    SolutionIndex: 122
    SolutionNameMin: Cijk_Ailk_Bjlk_BSS_BH_Bias_HAS_SAV_UserArgs_MT32x32x128_MI16x16x1_SN_LDSB1_CLR1_GSU0_GSUC0_GSUWGMRR0_K1_LBSPPA128_LBSPPB128_LPA16_LPB16_MIWT1_1_PLR1_SU0_SUM0_SUS0_VWA1_VWB1_WGM1_WGMXCC1_WGMXCCGn1
    SolutionIndex: 123
    SolutionNameMin: Cijk_Ailk_Bjlk_BSS_BH_Bias_HAS_SAV_UserArgs_MT32x32x128_MI16x16x1_SN_LDSB1_CLR1_GSU0_GSUC0_GSUWGMRR0_K1_LBSPPA256_LBSPPB256_LPA16_LPB16_MIWT1_1_PLR1_SU0_SUM0_SUS0_VWA1_VWB1_WGM1_WGMXCC1_WGMXCCGn1
    SolutionIndex: 124
    SolutionNameMin: Cijk_Ailk_Bjlk_BSS_BH_Bias_HAS_SAV_UserArgs_MT32x32x128_MI16x16x1_SN_LDSB1_CLR1_GSU0_GSUC0_GSUWGMRR0_K1_LBSPPA256_LBSPPB256_LPA16_LPB16_MIWT1_1_PLR1_SU0_SUM0_SUS0_VWA1_VWB1_WGM1_WGMXCC1_WGMXCCGn1
    SolutionIndex: 125
    SolutionNameMin: Cijk_Ailk_Bjlk_BSS_BH_Bias_HAS_SAV_UserArgs_MT32x32x128_MI16x16x1_SN_LDSB1_CLR1_GSU0_GSUC0_GSUWGMRR0_K1_LBSPPA256_LBSPPB256_LPA16_LPB16_MIWT1_1_PLR1_SU0_SUM0_SUS0_VWA1_VWB1_WGM1_WGMXCC1_WGMXCCGn1
    SolutionIndex: 126
    SolutionNameMin: Cijk_Ailk_Bjlk_BSS_BH_Bias_HAS_SAV_UserArgs_MT32x32x128_MI16x16x1_SN_LDSB1_CLR1_GSU0_GSUC0_GSUWGMRR0_K1_LBSPPA256_LBSPPB256_LPA16_LPB16_MIWT1_1_PLR1_SU0_SUM0_SUS0_VWA1_VWB1_WGM1_WGMXCC1_WGMXCCGn1
    SolutionIndex: 127
    SolutionNameMin: Cijk_Ailk_Bjlk_BSS_BH_Bias_HAS_SAV_UserArgs_MT32x32x128_MI16x16x1_SN_LDSB1_CLR1_GSU0_GSUC0_GSUWGMRR0_K1_LBSPPA512_LBSPPB512_LPA16_LPB16_MIWT1_1_PLR1_SU0_SUM0_SUS0_VWA1_VWB1_WGM1_WGMXCC1_WGMXCCGn1
    SolutionIndex: 128
    SolutionNameMin: Cijk_Ailk_Bjlk_BSS_BH_Bias_HAS_SAV_UserArgs_MT32x32x128_MI16x16x1_SN_LDSB1_CLR1_GSU0_GSUC0_GSUWGMRR0_K1_LBSPPA512_LBSPPB512_LPA16_LPB16_MIWT1_1_PLR1_SU0_SUM0_SUS0_VWA1_VWB1_WGM1_WGMXCC1_WGMXCCGn1
    SolutionIndex: 129
    SolutionNameMin: Cijk_Ailk_Bjlk_BSS_BH_Bias_HAS_SAV_UserArgs_MT32x32x128_MI16x16x1_SN_LDSB1_CLR1_GSU0_GSUC0_GSUWGMRR0_K1_LBSPPA512_LBSPPB512_LPA16_LPB16_MIWT1_1_PLR1_SU0_SUM0_SUS0_VWA1_VWB1_WGM1_WGMXCC1_WGMXCCGn1
    SolutionIndex: 130
    SolutionNameMin: Cijk_Ailk_Bjlk_BSS_BH_Bias_HAS_SAV_UserArgs_MT32x32x128_MI16x16x1_SN_LDSB1_CLR1_GSU0_GSUC0_GSUWGMRR0_K1_LBSPPA512_LBSPPB512_LPA16_LPB16_MIWT1_1_PLR1_SU0_SUM0_SUS0_VWA1_VWB1_WGM1_WGMXCC1_WGMXCCGn1
    SolutionIndex: 131
    SolutionNameMin: Cijk_Ailk_Bjlk_BSS_BH_Bias_HAS_SAV_UserArgs_MT32x32x128_MI16x16x1_SN_LDSB1_CLR1_GSU0_GSUC0_GSUWGMRR0_K1_LBSPPA512_LBSPPB512_LPA16_LPB16_MIWT1_1_PLR1_SU0_SUM0_SUS0_VWA1_VWB1_WGM1_WGMXCC1_WGMXCCGn1
    SolutionIndex: 132
    SolutionNameMin: Cijk_Ailk_Bjlk_BSS_BH_Bias_HAS_SAV_UserArgs_MT32x32x128_MI16x16x1_SN_LDSB1_CLR1_GSU0_GSUC0_GSUWGMRR0_K1_LBSPPA128_LBSPPB128_LPA16_LPB16_MIWT1_1_PLR1_SU0_SUM0_SUS0_VWA1_VWB1_WGM6_WGMXCC1_WGMXCCGn1
    SolutionIndex: 133
    SolutionNameMin: Cijk_Ailk_Bjlk_BSS_BH_Bias_HAS_SAV_UserArgs_MT32x32x128_MI16x16x1_SN_LDSB1_CLR1_GSU0_GSUC0_GSUWGMRR0_K1_LBSPPA256_LBSPPB256_LPA16_LPB16_MIWT1_1_PLR1_SU0_SUM0_SUS0_VWA1_VWB1_WGM6_WGMXCC1_WGMXCCGn1
    SolutionIndex: 134
    SolutionNameMin: Cijk_Ailk_Bjlk_BSS_BH_Bias_HAS_SAV_UserArgs_MT32x32x128_MI16x16x1_SN_LDSB1_CLR1_GSU0_GSUC0_GSUWGMRR0_K1_LBSPPA512_LBSPPB512_LPA16_LPB16_MIWT1_1_PLR1_SU0_SUM0_SUS0_VWA1_VWB1_WGM6_WGMXCC1_WGMXCCGn1
    SolutionIndex: 135
    SolutionNameMin: Cijk_Ailk_Bjlk_BSS_BH_Bias_HAS_SAV_UserArgs_MT32x32x128_MI16x16x1_SN_LDSB1_CLR1_GSU0_GSUC0_GSUWGMRR0_K1_LBSPPA512_LBSPPB512_LPA16_LPB16_MIWT1_1_PLR1_SU0_SUM0_SUS0_VWA1_VWB1_WGM6_WGMXCC1_WGMXCCGn1
    SolutionIndex: 136
    SolutionNameMin: Cijk_Ailk_Bjlk_BSS_BH_Bias_HAS_SAV_UserArgs_MT32x32x128_MI16x16x1_SN_LDSB1_CLR1_GSU0_GSUC0_GSUWGMRR0_K1_LBSPPA128_LBSPPB128_LPA16_LPB16_MIWT1_1_PLR1_SU0_SUM0_SUS0_VWA1_VWB1_WGM8_WGMXCC1_WGMXCCGn1
    SolutionIndex: 137
    SolutionNameMin: Cijk_Ailk_Bjlk_BSS_BH_Bias_HAS_SAV_UserArgs_MT32x32x128_MI16x16x1_SN_LDSB1_CLR1_GSU0_GSUC0_GSUWGMRR0_K1_LBSPPA256_LBSPPB256_LPA16_LPB16_MIWT1_1_PLR1_SU0_SUM0_SUS0_VWA1_VWB1_WGM8_WGMXCC1_WGMXCCGn1
    SolutionIndex: 138
    SolutionNameMin: Cijk_Ailk_Bjlk_BSS_BH_Bias_HAS_SAV_UserArgs_MT32x32x128_MI16x16x1_SN_LDSB1_CLR1_GSU0_GSUC0_GSUWGMRR0_K1_LBSPPA512_LBSPPB512_LPA16_LPB16_MIWT1_1_PLR1_SU0_SUM0_SUS0_VWA1_VWB1_WGM8_WGMXCC1_WGMXCCGn1
    SolutionIndex: 139
    SolutionNameMin: Cijk_Ailk_Bjlk_BSS_BH_Bias_HAS_SAV_UserArgs_MT64x32x256_MI16x16x1_SN_LDSB1_CLR1_GSU0_GSUC0_GSUWGMRR0_K1_LBSPPA256_LBSPPB128_LPA32_LPB16_MIWT2_1_PLR1_SU0_SUM0_SUS0_VWA2_VWB1_WGM1_WGMXCC1_WGMXCCGn1
    SolutionIndex: 140
    SolutionNameMin: Cijk_Ailk_Bjlk_BSS_BH_Bias_HAS_SAV_UserArgs_MT64x32x256_MI16x16x1_SN_LDSB1_CLR1_GSU0_GSUC0_GSUWGMRR0_K1_LBSPPA512_LBSPPB256_LPA32_LPB16_MIWT2_1_PLR1_SU0_SUM0_SUS0_VWA2_VWB1_WGM1_WGMXCC1_WGMXCCGn1
    SolutionIndex: 141
    SolutionNameMin: Cijk_Ailk_Bjlk_BSS_BH_Bias_HAS_SAV_UserArgs_MT32x32x256_MI16x16x1_SN_LDSB1_CLR1_GSU0_GSUC0_GSUWGMRR0_K1_LBSPPA128_LBSPPB128_LPA16_LPB16_MIWT1_1_PLR1_SU0_SUM0_SUS0_VWA1_VWB1_WGM1_WGMXCC1_WGMXCCGn1
    SolutionIndex: 142
    SolutionNameMin: Cijk_Ailk_Bjlk_BSS_BH_Bias_HAS_SAV_UserArgs_MT32x32x256_MI16x16x1_SN_LDSB1_CLR1_GSU0_GSUC0_GSUWGMRR0_K1_LBSPPA256_LBSPPB256_LPA16_LPB16_MIWT1_1_PLR1_SU0_SUM0_SUS0_VWA1_VWB1_WGM1_WGMXCC1_WGMXCCGn1
    SolutionIndex: 143
    SolutionNameMin: Cijk_Ailk_Bjlk_BSS_BH_Bias_HAS_SAV_UserArgs_MT32x32x256_MI16x16x1_SN_LDSB1_CLR1_GSU0_GSUC0_GSUWGMRR0_K1_LBSPPA512_LBSPPB512_LPA16_LPB16_MIWT1_1_PLR1_SU0_SUM0_SUS0_VWA1_VWB1_WGM1_WGMXCC1_WGMXCCGn1
    SolutionIndex: 144
    SolutionNameMin: Cijk_Ailk_Bjlk_BSS_BH_Bias_HAS_SAV_UserArgs_MT32x32x256_MI16x16x1_SN_LDSB1_CLR1_GSU0_GSUC0_GSUWGMRR0_K1_LBSPPA128_LBSPPB128_LPA16_LPB16_MIWT1_1_PLR1_SU0_SUM0_SUS0_VWA1_VWB1_WGM6_WGMXCC1_WGMXCCGn1
    SolutionIndex: 145
    SolutionNameMin: Cijk_Ailk_Bjlk_BSS_BH_Bias_HAS_SAV_UserArgs_MT32x32x256_MI16x16x1_SN_LDSB1_CLR1_GSU0_GSUC0_GSUWGMRR0_K1_LBSPPA512_LBSPPB512_LPA16_LPB16_MIWT1_1_PLR1_SU0_SUM0_SUS0_VWA1_VWB1_WGM6_WGMXCC1_WGMXCCGn1
    SolutionIndex: 146
    SolutionNameMin: Cijk_Ailk_Bjlk_BSS_BH_Bias_HAS_SAV_UserArgs_MT32x32x256_MI16x16x1_SN_LDSB1_CLR1_GSU0_GSUC0_GSUWGMRR0_K1_LBSPPA128_LBSPPB128_LPA16_LPB16_MIWT1_1_PLR1_SU0_SUM0_SUS0_VWA1_VWB1_WGM8_WGMXCC1_WGMXCCGn1
    SolutionIndex: 147
    SolutionNameMin: Cijk_Ailk_Bjlk_BSS_BH_Bias_HAS_SAV_UserArgs_MT32x32x256_MI16x16x1_SN_LDSB1_CLR1_GSU0_GSUC0_GSUWGMRR0_K1_LBSPPA256_LBSPPB256_LPA16_LPB16_MIWT1_1_PLR1_SU0_SUM0_SUS0_VWA1_VWB1_WGM8_WGMXCC1_WGMXCCGn1
    SolutionIndex: 148
    SolutionNameMin: Cijk_Ailk_Bjlk_BSS_BH_Bias_HAS_SAV_UserArgs_MT32x32x32_MI16x16x1_SN_LDSB0_CLR0_GSU0_GSUC0_GSUWGMRR0_K1_LBSPPA256_LBSPPB256_LPA16_LPB16_MIWT1_1_PLR0_SU32_SUM0_SUS256_VWA1_VWB1_WGM1_WGMXCC1_WGMXCCGn1
- - - [128, 128, 1, 128, 128, 128, 128, 128]
    - [123, 0.037]
  - - [128, 128, 1, 256, 128, 128, 128, 128]
    - [131, 0.065]
  - - [128, 128, 1, 512, 128, 128, 128, 128]
    - [131, 0.109]
  - - [128, 128, 1, 1024, 128, 128, 128, 128]
    - [120, 0.166]
  - - [128, 128, 1, 2048, 128, 128, 128, 128]
    - [142, 0.225]
  - - [128, 128, 1, 4096, 128, 128, 128, 128]
    - [142, 0.276]
  - - [128, 128, 1, 8192, 128, 128, 128, 128]
    - [143, 0.313]
  - - [128, 256, 1, 128, 128, 128, 128, 256]
    - [117, 0.073]
  - - [128, 256, 1, 256, 128, 128, 128, 256]
    - [126, 0.13]
  - - [128, 256, 1, 512, 128, 128, 128, 256]
    - [126, 0.217]
  - - [128, 256, 1, 1024, 128, 128, 128, 256]
    - [122, 0.331]
  - - [128, 256, 1, 2048, 128, 128, 128, 256]
    - [146, 0.45]
  - - [128, 256, 1, 4096, 128, 128, 128, 256]
    - [147, 0.551]
  - - [128, 256, 1, 8192, 128, 128, 128, 256]
    - [145, 0.626]
  - - [128, 512, 1, 128, 128, 128, 128, 512]
    - [115, 0.145]
  - - [128, 512, 1, 256, 128, 128, 128, 512]
    - [131, 0.254]
  - - [128, 512, 1, 512, 128, 128, 128, 512]
    - [126, 0.425]
  - - [128, 512, 1, 1024, 128, 128, 128, 512]
    - [122, 0.645]
  - - [128, 512, 1, 2048, 128, 128, 128, 512]
    - [145, 0.881]
  - - [128, 512, 1, 4096, 128, 128, 128, 512]
    - [146, 1.089]
  - - [128, 512, 1, 8192, 128, 128, 128, 512]
    - [144, 1.234]
  - - [128, 1024, 1, 128, 128, 128, 128, 1024]
    - [119, 0.282]
  - - [128, 1024, 1, 256, 128, 128, 128, 1024]
    - [118, 0.497]
  - - [128, 1024, 1, 512, 128, 128, 128, 1024]
    - [122, 0.841]
  - - [128, 1024, 1, 1024, 128, 128, 128, 1024]
    - [142, 1.267]
  - - [128, 1024, 1, 2048, 128, 128, 128, 1024]
    - [142, 1.745]
  - - [128, 1024, 1, 4096, 128, 128, 128, 1024]
    - [143, 2.145]
  - - [128, 1024, 1, 8192, 128, 128, 128, 1024]
    - [142, 2.464]
  - - [128, 2048, 1, 128, 128, 128, 128, 2048]
    - [124, 0.549]
  - - [128, 2048, 1, 256, 128, 128, 128, 2048]
    - [122, 0.962]
  - - [128, 2048, 1, 512, 128, 128, 128, 2048]
    - [131, 1.611]
  - - [128, 2048, 1, 1024, 128, 128, 128, 2048]
    - [143, 2.431]
  - - [128, 2048, 1, 2048, 128, 128, 128, 2048]
    - [142, 3.369]
  - - [128, 2048, 1, 4096, 128, 128, 128, 2048]
    - [141, 4.184]
  - - [128, 2048, 1, 8192, 128, 128, 128, 2048]
    - [141, 4.522]
  - - [128, 4096, 1, 128, 128, 128, 128, 4096]
    - [97, 1.01]
  - - [128, 4096, 1, 256, 128, 128, 128, 4096]
    - [101, 1.764]
  - - [128, 4096, 1, 512, 128, 128, 128, 4096]
    - [98, 2.93]
  - - [128, 4096, 1, 1024, 128, 128, 128, 4096]
    - [98, 4.431]
  - - [128, 4096, 1, 2048, 128, 128, 128, 4096]
    - [103, 5.981]
  - - [128, 4096, 1, 4096, 128, 128, 128, 4096]
    - [139, 7.094]
  - - [128, 4096, 1, 8192, 128, 128, 128, 4096]
    - [140, 7.675]
  - - [128, 8192, 1, 128, 128, 128, 128, 8192]
    - [86, 1.733]
  - - [128, 8192, 1, 256, 128, 128, 128, 8192]
    - [89, 3.037]
  - - [128, 8192, 1, 512, 128, 128, 128, 8192]
    - [86, 5.109]
  - - [128, 8192, 1, 1024, 128, 128, 128, 8192]
    - [89, 7.757]
  - - [128, 8192, 1, 2048, 128, 128, 128, 8192]
    - [89, 10.262]
  - - [128, 8192, 1, 4096, 128, 128, 128, 8192]
    - [91, 12.239]
  - - [128, 8192, 1, 8192, 128, 128, 128, 8192]
    - [95, 13.016]
  - - [256, 128, 1, 128, 256, 256, 256, 128]
    - [118, 0.074]
  - - [256, 128, 1, 256, 256, 256, 256, 128]
    - [115, 0.13]
  - - [256, 128, 1, 512, 256, 256, 256, 128]
    - [126, 0.218]
  - - [256, 128, 1, 1024, 256, 256, 256, 128]
    - [122, 0.332]
  - - [256, 128, 1, 2048, 256, 256, 256, 128]
    - [122, 0.447]
  - - [256, 128, 1, 4096, 256, 256, 256, 128]
    - [122, 0.54]
  - - [256, 128, 1, 8192, 256, 256, 256, 128]
    - [122, 0.603]
  - - [256, 256, 1, 128, 256, 256, 256, 256]
    - [130, 0.148]
  - - [256, 256, 1, 256, 256, 256, 256, 256]
    - [123, 0.258]
  - - [256, 256, 1, 512, 256, 256, 256, 256]
    - [122, 0.434]
  - - [256, 256, 1, 1024, 256, 256, 256, 256]
    - [122, 0.658]
  - - [256, 256, 1, 2048, 256, 256, 256, 256]
    - [126, 0.885]
  - - [256, 256, 1, 4096, 256, 256, 256, 256]
    - [131, 1.073]
  - - [256, 256, 1, 8192, 256, 256, 256, 256]
    - [126, 1.191]
  - - [256, 512, 1, 128, 256, 256, 256, 512]
    - [123, 0.286]
  - - [256, 512, 1, 256, 256, 256, 256, 512]
    - [122, 0.504]
  - - [256, 512, 1, 512, 256, 256, 256, 512]
    - [131, 0.845]
  - - [256, 512, 1, 1024, 256, 256, 256, 512]
    - [126, 1.281]
  - - [256, 512, 1, 2048, 256, 256, 256, 512]
    - [133, 1.72]
  - - [256, 512, 1, 4096, 256, 256, 256, 512]
    - [138, 2.092]
  - - [256, 512, 1, 8192, 256, 256, 256, 512]
    - [132, 2.369]
  - - [256, 1024, 1, 128, 256, 256, 256, 1024]
    - [116, 0.556]
  - - [256, 1024, 1, 256, 256, 256, 256, 1024]
    - [121, 0.975]
  - - [256, 1024, 1, 512, 256, 256, 256, 1024]
    - [122, 1.632]
  - - [256, 1024, 1, 1024, 256, 256, 256, 1024]
    - [131, 2.465]
  - - [256, 1024, 1, 2048, 256, 256, 256, 1024]
    - [136, 3.318]
  - - [256, 1024, 1, 4096, 256, 256, 256, 1024]
    - [126, 4.045]
  - - [256, 1024, 1, 8192, 256, 256, 256, 1024]
    - [132, 4.556]
  - - [256, 2048, 1, 128, 256, 256, 256, 2048]
    - [102, 1.015]
  - - [256, 2048, 1, 256, 256, 256, 256, 2048]
    - [103, 1.776]
  - - [256, 2048, 1, 512, 256, 256, 256, 2048]
    - [98, 2.951]
  - - [256, 2048, 1, 1024, 256, 256, 256, 2048]
    - [100, 4.438]
  - - [256, 2048, 1, 2048, 256, 256, 256, 2048]
    - [103, 5.942]
  - - [256, 2048, 1, 4096, 256, 256, 256, 2048]
    - [103, 7.206]
  - - [256, 2048, 1, 8192, 256, 256, 256, 2048]
    - [110, 7.828]
  - - [256, 4096, 1, 128, 256, 256, 256, 4096]
    - [88, 1.747]
  - - [256, 4096, 1, 256, 256, 256, 256, 4096]
    - [86, 3.087]
  - - [256, 4096, 1, 512, 256, 256, 256, 4096]
    - [86, 5.177]
  - - [256, 4096, 1, 1024, 256, 256, 256, 4096]
    - [86, 7.879]
  - - [256, 4096, 1, 2048, 256, 256, 256, 4096]
    - [87, 10.552]
  - - [256, 4096, 1, 4096, 256, 256, 256, 4096]
    - [94, 12.573]
  - - [256, 4096, 1, 8192, 256, 256, 256, 4096]
    - [94, 13.138]
  - - [256, 8192, 1, 128, 256, 256, 256, 8192]
    - [55, 2.782]
  - - [256, 8192, 1, 256, 256, 256, 256, 8192]
    - [53, 4.9]
  - - [256, 8192, 1, 512, 256, 256, 256, 8192]
    - [52, 7.781]
  - - [256, 8192, 1, 1024, 256, 256, 256, 8192]
    - [54, 11.03]
  - - [256, 8192, 1, 2048, 256, 256, 256, 8192]
    - [54, 14.381]
  - - [256, 8192, 1, 4096, 256, 256, 256, 8192]
    - [82, 16.674]
  - - [256, 8192, 1, 8192, 256, 256, 256, 8192]
    - [84, 16.129]
  - - [512, 128, 1, 128, 512, 512, 512, 128]
    - [123, 0.148]
  - - [512, 128, 1, 256, 512, 512, 512, 128]
    - [127, 0.26]
  - - [512, 128, 1, 512, 512, 512, 512, 128]
    - [115, 0.435]
  - - [512, 128, 1, 1024, 512, 512, 512, 128]
    - [117, 0.653]
  - - [512, 128, 1, 2048, 512, 512, 512, 128]
    - [120, 0.876]
  - - [512, 128, 1, 4096, 512, 512, 512, 128]
    - [123, 1.057]
  - - [512, 128, 1, 8192, 512, 512, 512, 128]
    - [122, 1.19]
  - - [512, 256, 1, 128, 512, 512, 512, 256]
    - [127, 0.29]
  - - [512, 256, 1, 256, 512, 512, 512, 256]
    - [123, 0.505]
  - - [512, 256, 1, 512, 512, 512, 512, 256]
    - [123, 0.845]
  - - [512, 256, 1, 1024, 512, 512, 512, 256]
    - [135, 1.271]
  - - [512, 256, 1, 2048, 512, 512, 512, 256]
    - [132, 1.718]
  - - [512, 256, 1, 4096, 512, 512, 512, 256]
    - [135, 2.094]
  - - [512, 256, 1, 8192, 512, 512, 512, 256]
    - [132, 2.361]
  - - [512, 512, 1, 128, 512, 512, 512, 512]
    - [125, 0.56]
  - - [512, 512, 1, 256, 512, 512, 512, 512]
    - [116, 0.975]
  - - [512, 512, 1, 512, 512, 512, 512, 512]
    - [118, 1.631]
  - - [512, 512, 1, 1024, 512, 512, 512, 512]
    - [136, 2.474]
  - - [512, 512, 1, 2048, 512, 512, 512, 512]
    - [137, 3.361]
  - - [512, 512, 1, 4096, 512, 512, 512, 512]
    - [135, 4.064]
  - - [512, 512, 1, 8192, 512, 512, 512, 512]
    - [133, 4.534]
  - - [512, 1024, 1, 128, 512, 512, 512, 1024]
    - [107, 1.022]
  - - [512, 1024, 1, 256, 512, 512, 512, 1024]
    - [97, 1.791]
  - - [512, 1024, 1, 512, 512, 512, 512, 1024]
    - [101, 2.983]
  - - [512, 1024, 1, 1024, 512, 512, 512, 1024]
    - [98, 4.479]
  - - [512, 1024, 1, 2048, 512, 512, 512, 1024]
    - [100, 5.951]
  - - [512, 1024, 1, 4096, 512, 512, 512, 1024]
    - [109, 7.229]
  - - [512, 1024, 1, 8192, 512, 512, 512, 1024]
    - [108, 7.889]
  - - [512, 2048, 1, 128, 512, 512, 512, 2048]
    - [89, 1.749]
  - - [512, 2048, 1, 256, 512, 512, 512, 2048]
    - [87, 3.053]
  - - [512, 2048, 1, 512, 512, 512, 512, 2048]
    - [86, 5.13]
  - - [512, 2048, 1, 1024, 512, 512, 512, 2048]
    - [89, 7.809]
  - - [512, 2048, 1, 2048, 512, 512, 512, 2048]
    - [87, 10.556]
  - - [512, 2048, 1, 4096, 512, 512, 512, 2048]
    - [89, 12.794]
  - - [512, 2048, 1, 8192, 512, 512, 512, 2048]
    - [89, 13.297]
  - - [512, 4096, 1, 128, 512, 512, 512, 4096]
    - [54, 2.792]
  - - [512, 4096, 1, 256, 512, 512, 512, 4096]
    - [52, 4.926]
  - - [512, 4096, 1, 512, 512, 512, 512, 4096]
    - [83, 8.051]
  - - [512, 4096, 1, 1024, 512, 512, 512, 4096]
    - [82, 11.568]
  - - [512, 4096, 1, 2048, 512, 512, 512, 4096]
    - [82, 14.548]
  - - [512, 4096, 1, 4096, 512, 512, 512, 4096]
    - [52, 16.557]
  - - [512, 4096, 1, 8192, 512, 512, 512, 4096]
    - [56, 16.348]
  - - [512, 8192, 1, 128, 512, 512, 512, 8192]
    - [42, 3.608]
  - - [512, 8192, 1, 256, 512, 512, 512, 8192]
    - [36, 6.435]
  - - [512, 8192, 1, 512, 512, 512, 512, 8192]
    - [38, 10.15]
  - - [512, 8192, 1, 1024, 512, 512, 512, 8192]
    - [39, 14.919]
  - - [512, 8192, 1, 2048, 512, 512, 512, 8192]
    - [40, 20.742]
  - - [512, 8192, 1, 4096, 512, 512, 512, 8192]
    - [47, 23.577]
  - - [512, 8192, 1, 8192, 512, 512, 512, 8192]
    - [48, 21.799]
  - - [1024, 128, 1, 128, 1024, 1024, 1024, 128]
    - [128, 0.29]
  - - [1024, 128, 1, 256, 1024, 1024, 1024, 128]
    - [125, 0.504]
  - - [1024, 128, 1, 512, 1024, 1024, 1024, 128]
    - [123, 0.841]
  - - [1024, 128, 1, 1024, 1024, 1024, 1024, 128]
    - [123, 1.27]
  - - [1024, 128, 1, 2048, 1024, 1024, 1024, 128]
    - [123, 1.711]
  - - [1024, 128, 1, 4096, 1024, 1024, 1024, 128]
    - [129, 2.056]
  - - [1024, 128, 1, 8192, 1024, 1024, 1024, 128]
    - [131, 2.35]
  - - [1024, 256, 1, 128, 1024, 1024, 1024, 256]
    - [124, 0.555]
  - - [1024, 256, 1, 256, 1024, 1024, 1024, 256]
    - [134, 0.959]
  - - [1024, 256, 1, 512, 1024, 1024, 1024, 256]
    - [125, 1.606]
  - - [1024, 256, 1, 1024, 1024, 1024, 1024, 256]
    - [132, 2.441]
  - - [1024, 256, 1, 2048, 1024, 1024, 1024, 256]
    - [132, 3.312]
  - - [1024, 256, 1, 4096, 1024, 1024, 1024, 256]
    - [133, 4.018]
  - - [1024, 256, 1, 8192, 1024, 1024, 1024, 256]
    - [132, 4.525]
  - - [1024, 512, 1, 128, 1024, 1024, 1024, 512]
    - [102, 1.013]
  - - [1024, 512, 1, 256, 1024, 1024, 1024, 512]
    - [101, 1.773]
  - - [1024, 512, 1, 512, 1024, 1024, 1024, 512]
    - [103, 2.946]
  - - [1024, 512, 1, 1024, 1024, 1024, 1024, 512]
    - [112, 4.455]
  - - [1024, 512, 1, 2048, 1024, 1024, 1024, 512]
    - [104, 5.948]
  - - [1024, 512, 1, 4096, 1024, 1024, 1024, 512]
    - [114, 7.232]
  - - [1024, 512, 1, 8192, 1024, 1024, 1024, 512]
    - [113, 7.86]
  - - [1024, 1024, 1, 128, 1024, 1024, 1024, 1024]
    - [87, 1.743]
  - - [1024, 1024, 1, 256, 1024, 1024, 1024, 1024]
    - [94, 3.072]
  - - [1024, 1024, 1, 512, 1024, 1024, 1024, 1024]
    - [86, 5.15]
  - - [1024, 1024, 1, 1024, 1024, 1024, 1024, 1024]
    - [90, 7.806]
  - - [1024, 1024, 1, 2048, 1024, 1024, 1024, 1024]
    - [94, 10.549]
  - - [1024, 1024, 1, 4096, 1024, 1024, 1024, 1024]
    - [89, 12.627]
  - - [1024, 1024, 1, 8192, 1024, 1024, 1024, 1024]
    - [95, 13.28]
  - - [1024, 2048, 1, 128, 1024, 1024, 1024, 2048]
    - [51, 2.789]
  - - [1024, 2048, 1, 256, 1024, 1024, 1024, 2048]
    - [51, 4.914]
  - - [1024, 2048, 1, 512, 1024, 1024, 1024, 2048]
    - [82, 8.004]
  - - [1024, 2048, 1, 1024, 1024, 1024, 1024, 2048]
    - [82, 11.717]
  - - [1024, 2048, 1, 2048, 1024, 1024, 1024, 2048]
    - [84, 14.735]
  - - [1024, 2048, 1, 4096, 1024, 1024, 1024, 2048]
    - [61, 16.452]
  - - [1024, 2048, 1, 8192, 1024, 1024, 1024, 2048]
    - [56, 16.379]
  - - [1024, 4096, 1, 128, 1024, 1024, 1024, 4096]
    - [40, 3.578]
  - - [1024, 4096, 1, 256, 1024, 1024, 1024, 4096]
    - [45, 6.298]
  - - [1024, 4096, 1, 512, 1024, 1024, 1024, 4096]
    - [78, 10.349]
  - - [1024, 4096, 1, 1024, 1024, 1024, 1024, 4096]
    - [77, 15.429]
  - - [1024, 4096, 1, 2048, 1024, 1024, 1024, 4096]
    - [40, 20.853]
  - - [1024, 4096, 1, 4096, 1024, 1024, 1024, 4096]
    - [37, 23.376]
  - - [1024, 4096, 1, 8192, 1024, 1024, 1024, 4096]
    - [48, 23.014]
  - - [1024, 8192, 1, 128, 1024, 1024, 1024, 8192]
    - [27, 4.569]
  - - [1024, 8192, 1, 256, 1024, 1024, 1024, 8192]
    - [3, 7.757]
  - - [1024, 8192, 1, 512, 1024, 1024, 1024, 8192]
    - [24, 12.572]
  - - [1024, 8192, 1, 1024, 1024, 1024, 1024, 8192]
    - [25, 20.334]
  - - [1024, 8192, 1, 2048, 1024, 1024, 1024, 8192]
    - [74, 26.297]
  - - [1024, 8192, 1, 4096, 1024, 1024, 1024, 8192]
    - [73, 28.562]
  - - [1024, 8192, 1, 8192, 1024, 1024, 1024, 8192]
    - [31, 28.633]
  - - [2048, 128, 1, 128, 2048, 2048, 2048, 128]
    - [119, 0.561]
  - - [2048, 128, 1, 256, 2048, 2048, 2048, 128]
    - [127, 0.959]
  - - [2048, 128, 1, 512, 2048, 2048, 2048, 128]
    - [123, 1.59]
  - - [2048, 128, 1, 1024, 2048, 2048, 2048, 128]
    - [127, 2.399]
  - - [2048, 128, 1, 2048, 2048, 2048, 2048, 128]
    - [132, 3.222]
  - - [2048, 128, 1, 4096, 2048, 2048, 2048, 128]
    - [132, 3.991]
  - - [2048, 128, 1, 8192, 2048, 2048, 2048, 128]
    - [138, 4.267]
  - - [2048, 256, 1, 128, 2048, 2048, 2048, 256]
    - [99, 1.012]
  - - [2048, 256, 1, 256, 2048, 2048, 2048, 256]
    - [96, 1.767]
  - - [2048, 256, 1, 512, 2048, 2048, 2048, 256]
    - [100, 2.945]
  - - [2048, 256, 1, 1024, 2048, 2048, 2048, 256]
    - [100, 4.4]
  - - [2048, 256, 1, 2048, 2048, 2048, 2048, 256]
    - [110, 5.909]
  - - [2048, 256, 1, 4096, 2048, 2048, 2048, 256]
    - [114, 7.163]
  - - [2048, 256, 1, 8192, 2048, 2048, 2048, 256]
    - [106, 7.669]
  - - [2048, 512, 1, 128, 2048, 2048, 2048, 512]
    - [95, 1.721]
  - - [2048, 512, 1, 256, 2048, 2048, 2048, 512]
    - [95, 3.033]
  - - [2048, 512, 1, 512, 2048, 2048, 2048, 512]
    - [93, 5.104]
  - - [2048, 512, 1, 1024, 2048, 2048, 2048, 512]
    - [94, 7.78]
  - - [2048, 512, 1, 2048, 2048, 2048, 2048, 512]
    - [95, 10.501]
  - - [2048, 512, 1, 4096, 2048, 2048, 2048, 512]
    - [95, 12.508]
  - - [2048, 512, 1, 8192, 2048, 2048, 2048, 512]
    - [92, 13.237]
  - - [2048, 1024, 1, 128, 2048, 2048, 2048, 1024]
    - [54, 2.764]
  - - [2048, 1024, 1, 256, 2048, 2048, 2048, 1024]
    - [56, 4.895]
  - - [2048, 1024, 1, 512, 2048, 2048, 2048, 1024]
    - [85, 7.91]
  - - [2048, 1024, 1, 1024, 2048, 2048, 2048, 1024]
    - [85, 11.553]
  - - [2048, 1024, 1, 2048, 2048, 2048, 2048, 1024]
    - [85, 14.612]
  - - [2048, 1024, 1, 4096, 2048, 2048, 2048, 1024]
    - [60, 16.595]
  - - [2048, 1024, 1, 8192, 2048, 2048, 2048, 1024]
    - [61, 16.325]
  - - [2048, 2048, 1, 128, 2048, 2048, 2048, 2048]
    - [41, 3.576]
  - - [2048, 2048, 1, 256, 2048, 2048, 2048, 2048]
    - [44, 6.255]
  - - [2048, 2048, 1, 512, 2048, 2048, 2048, 2048]
    - [80, 10.264]
  - - [2048, 2048, 1, 1024, 2048, 2048, 2048, 2048]
    - [80, 15.531]
  - - [2048, 2048, 1, 2048, 2048, 2048, 2048, 2048]
    - [46, 20.966]
  - - [2048, 2048, 1, 4096, 2048, 2048, 2048, 2048]
    - [50, 24.267]
  - - [2048, 2048, 1, 8192, 2048, 2048, 2048, 2048]
    - [46, 22.442]
  - - [2048, 4096, 1, 128, 2048, 2048, 2048, 4096]
    - [26, 4.619]
  - - [2048, 4096, 1, 256, 2048, 2048, 2048, 4096]
    - [2, 7.92]
  - - [2048, 4096, 1, 512, 2048, 2048, 2048, 4096]
    - [8, 12.722]
  - - [2048, 4096, 1, 1024, 2048, 2048, 2048, 4096]
    - [28, 20.678]
  - - [2048, 4096, 1, 2048, 2048, 2048, 2048, 4096]
    - [29, 25.984]
  - - [2048, 4096, 1, 4096, 2048, 2048, 2048, 4096]
    - [72, 28.548]
  - - [2048, 4096, 1, 8192, 2048, 2048, 2048, 4096]
    - [33, 28.839]
  - - [2048, 8192, 1, 128, 2048, 2048, 2048, 8192]
    - [25, 5.116]
  - - [2048, 8192, 1, 256, 2048, 2048, 2048, 8192]
    - [1, 8.679]
  - - [2048, 8192, 1, 512, 2048, 2048, 2048, 8192]
    - [19, 14.709]
  - - [2048, 8192, 1, 1024, 2048, 2048, 2048, 8192]
    - [11, 23.351]
  - - [2048, 8192, 1, 2048, 2048, 2048, 2048, 8192]
    - [69, 31.943]
  - - [2048, 8192, 1, 4096, 2048, 2048, 2048, 8192]
    - [71, 33.827]
  - - [2048, 8192, 1, 8192, 2048, 2048, 2048, 8192]
    - [10, 35.799]
  - - [4096, 128, 1, 128, 4096, 4096, 4096, 128]
    - [101, 1.007]
  - - [4096, 128, 1, 256, 4096, 4096, 4096, 128]
    - [101, 1.76]
  - - [4096, 128, 1, 512, 4096, 4096, 4096, 128]
    - [97, 2.913]
  - - [4096, 128, 1, 1024, 4096, 4096, 4096, 128]
    - [101, 4.386]
  - - [4096, 128, 1, 2048, 4096, 4096, 4096, 128]
    - [105, 5.896]
  - - [4096, 128, 1, 4096, 4096, 4096, 4096, 128]
    - [111, 7.058]
  - - [4096, 128, 1, 8192, 4096, 4096, 4096, 128]
    - [114, 7.721]
  - - [4096, 256, 1, 128, 4096, 4096, 4096, 256]
    - [91, 1.721]
  - - [4096, 256, 1, 256, 4096, 4096, 4096, 256]
    - [95, 3.035]
  - - [4096, 256, 1, 512, 4096, 4096, 4096, 256]
    - [91, 5.104]
  - - [4096, 256, 1, 1024, 4096, 4096, 4096, 256]
    - [94, 7.822]
  - - [4096, 256, 1, 2048, 4096, 4096, 4096, 256]
    - [92, 10.488]
  - - [4096, 256, 1, 4096, 4096, 4096, 4096, 256]
    - [95, 12.553]
  - - [4096, 256, 1, 8192, 4096, 4096, 4096, 256]
    - [95, 13.043]
  - - [4096, 512, 1, 128, 4096, 4096, 4096, 512]
    - [63, 2.725]
  - - [4096, 512, 1, 256, 4096, 4096, 4096, 512]
    - [63, 4.827]
  - - [4096, 512, 1, 512, 4096, 4096, 4096, 512]
    - [85, 7.946]
  - - [4096, 512, 1, 1024, 4096, 4096, 4096, 512]
    - [84, 11.193]
  - - [4096, 512, 1, 2048, 4096, 4096, 4096, 512]
    - [62, 14.15]
  - - [4096, 512, 1, 4096, 4096, 4096, 4096, 512]
    - [61, 16.29]
  - - [4096, 512, 1, 8192, 4096, 4096, 4096, 512]
    - [62, 16.161]
  - - [4096, 1024, 1, 128, 4096, 4096, 4096, 1024]
    - [76, 3.57]
  - - [4096, 1024, 1, 256, 4096, 4096, 4096, 1024]
    - [22, 6.18]
  - - [4096, 1024, 1, 512, 4096, 4096, 4096, 1024]
    - [81, 10.325]
  - - [4096, 1024, 1, 1024, 4096, 4096, 4096, 1024]
    - [81, 15.386]
  - - [4096, 1024, 1, 2048, 4096, 4096, 4096, 1024]
    - [50, 20.524]
  - - [4096, 1024, 1, 4096, 4096, 4096, 4096, 1024]
    - [43, 23.355]
  - - [4096, 1024, 1, 8192, 4096, 4096, 4096, 1024]
    - [43, 23.142]
  - - [4096, 2048, 1, 128, 4096, 4096, 4096, 2048]
    - [1, 4.459]
  - - [4096, 2048, 1, 256, 4096, 4096, 4096, 2048]
    - [7, 7.718]
  - - [4096, 2048, 1, 512, 4096, 4096, 4096, 2048]
    - [5, 12.466]
  - - [4096, 2048, 1, 1024, 4096, 4096, 4096, 2048]
    - [29, 20.122]
  - - [4096, 2048, 1, 2048, 4096, 4096, 4096, 2048]
    - [72, 25.678]
  - - [4096, 2048, 1, 4096, 4096, 4096, 4096, 2048]
    - [32, 27.36]
  - - [4096, 2048, 1, 8192, 4096, 4096, 4096, 2048]
    - [34, 28.347]
  - - [4096, 4096, 1, 128, 4096, 4096, 4096, 4096]
    - [4, 5.055]
  - - [4096, 4096, 1, 256, 4096, 4096, 4096, 4096]
    - [4, 8.79]
  - - [4096, 4096, 1, 512, 4096, 4096, 4096, 4096]
    - [15, 14.734]
  - - [4096, 4096, 1, 1024, 4096, 4096, 4096, 4096]
    - [67, 23.75]
  - - [4096, 4096, 1, 2048, 4096, 4096, 4096, 4096]
    - [68, 31.555]
  - - [4096, 8192, 1, 128, 4096, 4096, 4096, 8192]
    - [20, 5.649]
  - - [4096, 8192, 1, 256, 4096, 4096, 4096, 8192]
    - [18, 10.231]
  - - [4096, 8192, 1, 512, 4096, 4096, 4096, 8192]
    - [16, 16.979]
  - - [4096, 8192, 1, 1024, 4096, 4096, 4096, 8192]
    - [65, 24.008]
  - - [4096, 8192, 1, 2048, 4096, 4096, 4096, 8192]
    - [67, 29.642]
  - - [8192, 128, 1, 128, 8192, 8192, 8192, 128]
    - [64, 1.694]
  - - [8192, 128, 1, 256, 8192, 8192, 8192, 128]
    - [90, 2.962]
  - - [8192, 128, 1, 512, 8192, 8192, 8192, 128]
    - [95, 5.017]
  - - [8192, 128, 1, 1024, 8192, 8192, 8192, 128]
    - [90, 7.555]
  - - [8192, 128, 1, 2048, 8192, 8192, 8192, 128]
    - [92, 10.044]
  - - [8192, 128, 1, 4096, 8192, 8192, 8192, 128]
    - [91, 12.379]
  - - [8192, 128, 1, 8192, 8192, 8192, 8192, 128]
    - [91, 12.989]
  - - [8192, 256, 1, 128, 8192, 8192, 8192, 256]
    - [59, 2.761]
  - - [8192, 256, 1, 256, 8192, 8192, 8192, 256]
    - [58, 4.85]
  - - [8192, 256, 1, 512, 8192, 8192, 8192, 256]
    - [63, 7.693]
  - - [8192, 256, 1, 1024, 8192, 8192, 8192, 256]
    - [61, 10.926]
  - - [8192, 256, 1, 2048, 8192, 8192, 8192, 256]
    - [57, 14.262]
  - - [8192, 256, 1, 4096, 8192, 8192, 8192, 256]
    - [62, 16.503]
  - - [8192, 256, 1, 8192, 8192, 8192, 8192, 256]
    - [60, 15.543]
  - - [8192, 512, 1, 128, 8192, 8192, 8192, 512]
    - [75, 3.538]
  - - [8192, 512, 1, 256, 8192, 8192, 8192, 512]
    - [23, 6.227]
  - - [8192, 512, 1, 512, 8192, 8192, 8192, 512]
    - [79, 10.148]
  - - [8192, 512, 1, 1024, 8192, 8192, 8192, 512]
    - [79, 15.278]
  - - [8192, 512, 1, 2048, 8192, 8192, 8192, 512]
    - [49, 20.378]
  - - [8192, 512, 1, 4096, 8192, 8192, 8192, 512]
    - [42, 22.964]
  - - [8192, 512, 1, 8192, 8192, 8192, 8192, 512]
    - [46, 22.624]
  - - [8192, 1024, 1, 128, 8192, 8192, 8192, 1024]
    - [30, 4.674]
  - - [8192, 1024, 1, 256, 8192, 8192, 8192, 1024]
    - [4, 7.976]
  - - [8192, 1024, 1, 512, 8192, 8192, 8192, 1024]
    - [6, 13.048]
  - - [8192, 1024, 1, 1024, 8192, 8192, 8192, 1024]
    - [28, 20.69]
  - - [8192, 1024, 1, 2048, 8192, 8192, 8192, 1024]
    - [29, 25.568]
  - - [8192, 1024, 1, 4096, 8192, 8192, 8192, 1024]
    - [74, 27.961]
  - - [8192, 1024, 1, 8192, 8192, 8192, 8192, 1024]
    - [35, 28.916]
  - - [8192, 2048, 1, 128, 8192, 8192, 8192, 2048]
    - [25, 5.121]
  - - [8192, 2048, 1, 256, 8192, 8192, 8192, 2048]
    - [0, 8.716]
  - - [8192, 2048, 1, 512, 8192, 8192, 8192, 2048]
    - [0, 14.651]
  - - [8192, 2048, 1, 1024, 8192, 8192, 8192, 2048]
    - [13, 23.75]
  - - [8192, 2048, 1, 2048, 8192, 8192, 8192, 2048]
    - [67, 30.957]
  - - [8192, 2048, 1, 4096, 8192, 8192, 8192, 2048]
    - [70, 33.582]
  - - [8192, 2048, 1, 8192, 8192, 8192, 8192, 2048]
    - [71, 35.87]
  - - [8192, 4096, 1, 128, 8192, 8192, 8192, 4096]
    - [21, 5.669]
  - - [8192, 4096, 1, 256, 8192, 8192, 8192, 4096]
    - [9, 9.841]
  - - [8192, 4096, 1, 512, 8192, 8192, 8192, 4096]
    - [17, 16.654]
  - - [8192, 4096, 1, 1024, 8192, 8192, 8192, 4096]
    - [14, 24.059]
  - - [8192, 4096, 1, 2048, 8192, 8192, 8192, 4096]
    - [67, 29.325]
  - - [8192, 8192, 1, 128, 8192, 8192, 8192, 8192]
    - [16, 6.077]
  - - [8192, 8192, 1, 256, 8192, 8192, 8192, 8192]
    - [14, 10.743]
  - - [8192, 8192, 1, 512, 8192, 8192, 8192, 8192]
    - [12, 16.91]
  - - [8192, 8192, 1, 1024, 8192, 8192, 8192, 8192]
    - [12, 23.337]
  - - [8192, 8192, 1, 2048, 8192, 8192, 8192, 8192]
    - [12, 29.791]
  - - [4096, 4096, 1, 4096, 4096, 4096, 4096, 4096]
    - [67, 34.453]
  - - [4096, 4096, 1, 8192, 4096, 4096, 4096, 4096]
    - [67, 36.46]
  - - [4096, 8192, 1, 4096, 4096, 4096, 4096, 8192]
    - [66, 33.387]
  - - [4096, 8192, 1, 8192, 4096, 4096, 4096, 8192]
    - [69, 38.834]
  - - [8192, 4096, 1, 4096, 8192, 8192, 8192, 4096]
    - [67, 33.713]
  - - [8192, 4096, 1, 8192, 8192, 8192, 8192, 4096]
    - [68, 38.434]
  - - [8192, 8192, 1, 4096, 8192, 8192, 8192, 8192]
    - [71, 36.565]
  - - [8192, 8192, 1, 8192, 8192, 8192, 8192, 8192]
    - [70, 41.861]
  - - [1, 1, 1, 32, 1, 1, 1, 1]
    - [148, 0.0]
- null
- null
- DeviceEfficiency
- GridBased
