projects/hipblaslt/library/src/amd_detail/rocblaslt/src/Tensile/Logic/asm_full/gfx950/GridBased/gfx950_Cijk_Ailk_Bjlk_F8B8F8S_BH_Bias_HAS_SAB_SAV_UserArgs.yaml
- {MinimumRequiredVersion: 4.33.0}
- gfx950
- gfx950
- [Device 75a0]
    SolutionIndex: 0
    SolutionNameMin: Cijk_Ailk_Bjlk_F8F8S_BH_Bias_HAS_SAB_SAV_UserArgs_MT256x256x64_MI32x32x1_SN_GSU0_GSUC0_GSUWGMRR0_K1_LBSPPA0_LBSPPB0_LPA0_LPB0_MIWT4_4_SU0_SUM0_SUS64_VWA4_VWB4_WGM8_WGMXCC1_WGMXCCGn1
    SolutionIndex: 1
    SolutionNameMin: Cijk_Ailk_Bjlk_F8F8S_BH_Bias_HAS_SAB_SAV_UserArgs_MT256x256x64_MI32x32x1_SN_GSU0_GSUC0_GSUWGMRR0_K1_LBSPPA0_LBSPPB0_LPA0_LPB0_MIWT4_4_SU0_SUM0_SUS64_VWA4_VWB4_WGM8_WGMXCC1_WGMXCCGn1
    SolutionIndex: 2
    SolutionNameMin: Cijk_Ailk_Bjlk_F8F8S_BH_Bias_HAS_SAB_SAV_UserArgs_MT256x256x64_MI32x32x1_SN_GSU0_GSUC0_GSUWGMRR0_K1_LBSPPA0_LBSPPB0_LPA0_LPB0_MIWT4_4_SU0_SUM0_SUS64_VWA4_VWB4_WGM8_WGMXCC1_WGMXCCGn1
    SolutionIndex: 3
    SolutionNameMin: Cijk_Ailk_Bjlk_F8F8S_BH_Bias_HAS_SAB_SAV_UserArgs_MT256x256x64_MI32x32x1_SN_GSU0_GSUC0_GSUWGMRR0_K1_LBSPPA0_LBSPPB0_LPA0_LPB0_MIWT4_4_SU0_SUM0_SUS64_VWA4_VWB4_WGM8_WGMXCC1_WGMXCCGn1
    SolutionIndex: 4
    SolutionNameMin: Cijk_Ailk_Bjlk_F8F8S_BH_Bias_HAS_SAB_SAV_UserArgs_MT256x256x64_MI32x32x1_SN_GSU0_GSUC0_GSUWGMRR0_K1_LBSPPA0_LBSPPB0_LPA0_LPB0_MIWT4_4_SU0_SUM0_SUS64_VWA4_VWB4_WGM8_WGMXCC1_WGMXCCGn1
    SolutionIndex: 5
    SolutionNameMin: Cijk_Ailk_Bjlk_F8F8S_BH_Bias_HAS_SAB_SAV_UserArgs_MT256x256x64_MI32x32x1_SN_GSU0_GSUC0_GSUWGMRR0_K1_LBSPPA0_LBSPPB0_LPA0_LPB0_MIWT4_4_SU0_SUM0_SUS64_VWA4_VWB4_WGM8_WGMXCC1_WGMXCCGn1
    SolutionIndex: 6
    SolutionNameMin: Cijk_Ailk_Bjlk_F8F8S_BH_Bias_HAS_SAB_SAV_UserArgs_MT256x256x64_MI32x32x1_SN_GSU0_GSUC0_GSUWGMRR0_K1_LBSPPA0_LBSPPB0_LPA0_LPB0_MIWT4_4_SU0_SUM0_SUS64_VWA4_VWB4_WGM8_WGMXCC1_WGMXCCGn1
    SolutionIndex: 7
    SolutionNameMin: Cijk_Ailk_Bjlk_F8F8S_BH_Bias_HAS_SAB_SAV_UserArgs_MT256x256x64_MI32x32x1_SN_GSU0_GSUC0_GSUWGMRR0_K1_LBSPPA0_LBSPPB0_LPA0_LPB0_MIWT4_4_SU0_SUM0_SUS64_VWA4_VWB4_WGM8_WGMXCC1_WGMXCCGn1
    SolutionIndex: 8
    SolutionNameMin: Cijk_Ailk_Bjlk_F8F8S_BH_Bias_HAS_SAB_SAV_UserArgs_MT256x256x64_MI32x32x1_SN_GSU0_GSUC0_GSUWGMRR0_K1_LBSPPA0_LBSPPB0_LPA0_LPB0_MIWT4_4_SU0_SUM0_SUS64_VWA4_VWB4_WGM8_WGMXCC1_WGMXCCGn1
    SolutionIndex: 9
    SolutionNameMin: Cijk_Ailk_Bjlk_F8F8S_BH_Bias_HAS_SAB_SAV_UserArgs_MT256x256x64_MI32x32x1_SN_GSU0_GSUC0_GSUWGMRR0_K1_LBSPPA0_LBSPPB0_LPA0_LPB0_MIWT4_4_SU0_SUM0_SUS64_VWA4_VWB4_WGM8_WGMXCC1_WGMXCCGn1
    SolutionIndex: 10
    SolutionNameMin: Cijk_Ailk_Bjlk_F8F8S_BH_Bias_HAS_SAB_SAV_UserArgs_MT256x128x64_MI32x32x1_SN_GSU0_GSUC0_GSUWGMRR0_K1_LBSPPA0_LBSPPB0_LPA0_LPB0_MIWT4_2_SU0_SUM0_SUS64_VWA4_VWB2_WGM8_WGMXCC1_WGMXCCGn1
    SolutionIndex: 11
    SolutionNameMin: Cijk_Ailk_Bjlk_F8F8S_BH_Bias_HAS_SAB_SAV_UserArgs_MT256x128x64_MI32x32x1_SN_GSU0_GSUC0_GSUWGMRR0_K1_LBSPPA0_LBSPPB0_LPA0_LPB0_MIWT4_2_SU0_SUM0_SUS64_VWA4_VWB2_WGM8_WGMXCC1_WGMXCCGn1
    SolutionIndex: 12
    SolutionNameMin: Cijk_Ailk_Bjlk_F8F8S_BH_Bias_HAS_SAB_SAV_UserArgs_MT256x128x64_MI32x32x1_SN_GSU0_GSUC0_GSUWGMRR0_K1_LBSPPA0_LBSPPB0_LPA0_LPB0_MIWT4_2_SU0_SUM0_SUS64_VWA4_VWB2_WGM8_WGMXCC1_WGMXCCGn1
    SolutionIndex: 13
    SolutionNameMin: Cijk_Ailk_Bjlk_F8F8S_BH_Bias_HAS_SAB_SAV_UserArgs_MT256x128x64_MI32x32x1_SN_GSU0_GSUC0_GSUWGMRR0_K1_LBSPPA0_LBSPPB0_LPA0_LPB0_MIWT4_2_SU0_SUM0_SUS64_VWA4_VWB2_WGM8_WGMXCC1_WGMXCCGn1
    SolutionIndex: 14
    SolutionNameMin: Cijk_Ailk_Bjlk_F8F8S_BH_Bias_HAS_SAB_SAV_UserArgs_MT256x128x64_MI32x32x1_SN_GSU0_GSUC0_GSUWGMRR0_K1_LBSPPA0_LBSPPB0_LPA0_LPB0_MIWT4_2_SU0_SUM0_SUS64_VWA4_VWB2_WGM8_WGMXCC1_WGMXCCGn1
    SolutionIndex: 15
    SolutionNameMin: Cijk_Ailk_Bjlk_F8F8S_BH_Bias_HAS_SAB_SAV_UserArgs_MT256x128x64_MI32x32x1_SN_GSU0_GSUC0_GSUWGMRR0_K1_LBSPPA0_LBSPPB0_LPA0_LPB0_MIWT4_2_SU0_SUM0_SUS64_VWA4_VWB2_WGM8_WGMXCC1_WGMXCCGn1
    SolutionIndex: 16
    SolutionNameMin: Cijk_Ailk_Bjlk_F8F8S_BH_Bias_HAS_SAB_SAV_UserArgs_MT256x128x64_MI32x32x1_SN_GSU0_GSUC0_GSUWGMRR0_K1_LBSPPA0_LBSPPB0_LPA0_LPB0_MIWT4_2_SU0_SUM0_SUS64_VWA4_VWB2_WGM8_WGMXCC1_WGMXCCGn1
    SolutionIndex: 17
    SolutionNameMin: Cijk_Ailk_Bjlk_F8F8S_BH_Bias_HAS_SAB_SAV_UserArgs_MT128x128x128_MI16x16x1_SN_GSU0_GSUC0_GSUWGMRR0_K1_LBSPPA2048_LBSPPB2048_LPA64_LPB64_MIWT4_4_SU0_SUM0_SUS128_VWA4_VWB4_WGM8_WGMXCC1_WGMXCCGn1
    SolutionIndex: 18
    SolutionNameMin: Cijk_Ailk_Bjlk_F8F8S_BH_Bias_HAS_SAB_SAV_UserArgs_MT128x128x128_MI16x16x1_SN_GSU0_GSUC0_GSUWGMRR0_K1_LBSPPA2048_LBSPPB2048_LPA64_LPB64_MIWT4_4_SU0_SUM0_SUS128_VWA4_VWB4_WGM8_WGMXCC1_WGMXCCGn1
    SolutionIndex: 19
    SolutionNameMin: Cijk_Ailk_Bjlk_F8F8S_BH_Bias_HAS_SAB_SAV_UserArgs_MT128x128x128_MI16x16x1_SN_GSU0_GSUC0_GSUWGMRR0_K1_LBSPPA2048_LBSPPB2048_LPA64_LPB64_MIWT4_4_SU0_SUM0_SUS128_VWA4_VWB4_WGM8_WGMXCC1_WGMXCCGn1
    SolutionIndex: 20
    SolutionNameMin: Cijk_Ailk_Bjlk_F8F8S_BH_Bias_HAS_SAB_SAV_UserArgs_MT128x128x128_MI16x16x1_SN_GSU0_GSUC0_GSUWGMRR0_K1_LBSPPA2048_LBSPPB2048_LPA64_LPB64_MIWT4_4_SU0_SUM0_SUS128_VWA4_VWB4_WGM8_WGMXCC1_WGMXCCGn1
    SolutionIndex: 21
    SolutionNameMin: Cijk_Ailk_Bjlk_F8F8S_BH_Bias_HAS_SAB_SAV_UserArgs_MT64x128x128_MI16x16x1_SN_GSU0_GSUC0_GSUWGMRR0_K1_LBSPPA1024_LBSPPB2048_LPA32_LPB64_MIWT2_4_SU0_SUM0_SUS128_VWA2_VWB4_WGM8_WGMXCC1_WGMXCCGn1
    SolutionIndex: 22
    SolutionNameMin: Cijk_Ailk_Bjlk_F8F8S_BH_Bias_HAS_SAB_SAV_UserArgs_MT64x128x128_MI16x16x1_SN_GSU0_GSUC0_GSUWGMRR0_K1_LBSPPA1024_LBSPPB2048_LPA32_LPB64_MIWT2_4_SU0_SUM0_SUS128_VWA2_VWB4_WGM8_WGMXCC1_WGMXCCGn1
    SolutionIndex: 23
    SolutionNameMin: Cijk_Ailk_Bjlk_F8F8S_BH_Bias_HAS_SAB_SAV_UserArgs_MT64x128x128_MI16x16x1_SN_GSU0_GSUC0_GSUWGMRR0_K1_LBSPPA1024_LBSPPB2048_LPA32_LPB64_MIWT2_4_SU0_SUM0_SUS128_VWA2_VWB4_WGM8_WGMXCC1_WGMXCCGn1
    SolutionIndex: 24
    SolutionNameMin: Cijk_Ailk_Bjlk_F8F8S_BH_Bias_HAS_SAB_SAV_UserArgs_MT128x64x128_MI16x16x1_SN_GSU0_GSUC0_GSUWGMRR0_K1_LBSPPA2048_LBSPPB1024_LPA64_LPB32_MIWT4_2_SU0_SUM0_SUS128_VWA4_VWB2_WGM8_WGMXCC1_WGMXCCGn1
    SolutionIndex: 25
    SolutionNameMin: Cijk_Ailk_Bjlk_F8F8S_BH_Bias_HAS_SAB_SAV_UserArgs_MT128x64x128_MI16x16x1_SN_GSU0_GSUC0_GSUWGMRR0_K1_LBSPPA2048_LBSPPB1024_LPA64_LPB32_MIWT4_2_SU0_SUM0_SUS128_VWA4_VWB2_WGM8_WGMXCC1_WGMXCCGn1
    SolutionIndex: 26
    SolutionNameMin: Cijk_Ailk_Bjlk_F8F8S_BH_Bias_HAS_SAB_SAV_UserArgs_MT128x64x128_MI16x16x1_SN_GSU0_GSUC0_GSUWGMRR0_K1_LBSPPA2048_LBSPPB1024_LPA64_LPB32_MIWT4_2_SU0_SUM0_SUS128_VWA4_VWB2_WGM8_WGMXCC1_WGMXCCGn1
    SolutionIndex: 27
    SolutionNameMin: Cijk_Ailk_Bjlk_F8F8S_BH_Bias_HAS_SAB_SAV_UserArgs_MT128x64x128_MI16x16x1_SN_GSU0_GSUC0_GSUWGMRR0_K1_LBSPPA2048_LBSPPB1024_LPA64_LPB32_MIWT4_2_SU0_SUM0_SUS128_VWA4_VWB2_WGM8_WGMXCC1_WGMXCCGn1
    SolutionIndex: 28
    SolutionNameMin: Cijk_Ailk_Bjlk_F8F8S_BH_Bias_HAS_SAB_SAV_UserArgs_MT128x64x128_MI16x16x1_SN_GSU0_GSUC0_GSUWGMRR0_K1_LBSPPA2048_LBSPPB1024_LPA64_LPB32_MIWT4_2_SU0_SUM0_SUS128_VWA4_VWB2_WGM8_WGMXCC1_WGMXCCGn1
    SolutionIndex: 29
    SolutionNameMin: Cijk_Ailk_Bjlk_F8F8S_BH_Bias_HAS_SAB_SAV_UserArgs_MT128x64x128_MI16x16x1_SN_GSU0_GSUC0_GSUWGMRR0_K1_LBSPPA2048_LBSPPB1024_LPA64_LPB32_MIWT4_2_SU0_SUM0_SUS128_VWA4_VWB2_WGM8_WGMXCC1_WGMXCCGn1
    SolutionIndex: 30
    SolutionNameMin: Cijk_Ailk_Bjlk_F8F8S_BH_Bias_HAS_SAB_SAV_UserArgs_MT128x32x128_MI16x16x1_SN_GSU0_GSUC0_GSUWGMRR0_K1_LBSPPA2048_LBSPPB512_LPA64_LPB16_MIWT4_1_SU0_SUM0_SUS128_VWA4_VWB1_WGM8_WGMXCC1_WGMXCCGn1
    SolutionIndex: 31
    SolutionNameMin: Cijk_Ailk_Bjlk_F8F8S_BH_Bias_HAS_SAB_SAV_UserArgs_MT64x64x128_MI16x16x1_SN_GSU0_GSUC0_GSUWGMRR0_K1_LBSPPA512_LBSPPB512_LPA32_LPB32_MIWT2_2_SU0_SUM0_SUS128_VWA2_VWB2_WGM8_WGMXCC1_WGMXCCGn1
    SolutionIndex: 32
    SolutionNameMin: Cijk_Ailk_Bjlk_F8F8S_BH_Bias_HAS_SAB_SAV_UserArgs_MT64x64x128_MI16x16x1_SN_GSU0_GSUC0_GSUWGMRR0_K1_LBSPPA512_LBSPPB512_LPA32_LPB32_MIWT2_2_SU0_SUM0_SUS128_VWA2_VWB2_WGM8_WGMXCC1_WGMXCCGn1
    SolutionIndex: 33
    SolutionNameMin: Cijk_Ailk_Bjlk_F8F8S_BH_Bias_HAS_SAB_SAV_UserArgs_MT64x64x128_MI16x16x1_SN_GSU0_GSUC0_GSUWGMRR0_K1_LBSPPA512_LBSPPB512_LPA32_LPB32_MIWT2_2_SU0_SUM0_SUS128_VWA2_VWB2_WGM8_WGMXCC1_WGMXCCGn1
    SolutionIndex: 34
    SolutionNameMin: Cijk_Ailk_Bjlk_F8F8S_BH_Bias_HAS_SAB_SAV_UserArgs_MT64x64x128_MI16x16x1_SN_GSU0_GSUC0_GSUWGMRR0_K1_LBSPPA512_LBSPPB512_LPA32_LPB32_MIWT2_2_SU0_SUM0_SUS128_VWA2_VWB2_WGM8_WGMXCC1_WGMXCCGn1
    SolutionIndex: 35
    SolutionNameMin: Cijk_Ailk_Bjlk_F8F8S_BH_Bias_HAS_SAB_SAV_UserArgs_MT64x64x128_MI16x16x1_SN_GSU0_GSUC0_GSUWGMRR0_K1_LBSPPA512_LBSPPB512_LPA32_LPB32_MIWT2_2_SU0_SUM0_SUS128_VWA2_VWB2_WGM8_WGMXCC1_WGMXCCGn1
    SolutionIndex: 36
    SolutionNameMin: Cijk_Ailk_Bjlk_F8F8S_BH_Bias_HAS_SAB_SAV_UserArgs_MT64x64x128_MI16x16x1_SN_GSU0_GSUC0_GSUWGMRR0_K1_LBSPPA1024_LBSPPB1024_LPA32_LPB32_MIWT2_2_SU0_SUM0_SUS128_VWA2_VWB2_WGM8_WGMXCC1_WGMXCCGn1
    SolutionIndex: 37
    SolutionNameMin: Cijk_Ailk_Bjlk_F8F8S_BH_Bias_HAS_SAB_SAV_UserArgs_MT64x64x128_MI16x16x1_SN_GSU0_GSUC0_GSUWGMRR0_K1_LBSPPA1024_LBSPPB1024_LPA32_LPB32_MIWT2_2_SU0_SUM0_SUS128_VWA2_VWB2_WGM8_WGMXCC1_WGMXCCGn1
    SolutionIndex: 38
    SolutionNameMin: Cijk_Ailk_Bjlk_F8F8S_BH_Bias_HAS_SAB_SAV_UserArgs_MT64x64x128_MI16x16x1_SN_GSU0_GSUC0_GSUWGMRR0_K1_LBSPPA1024_LBSPPB1024_LPA32_LPB32_MIWT2_2_SU0_SUM0_SUS128_VWA2_VWB2_WGM8_WGMXCC1_WGMXCCGn1
    SolutionIndex: 39
    SolutionNameMin: Cijk_Ailk_Bjlk_F8F8S_BH_Bias_HAS_SAB_SAV_UserArgs_MT64x64x128_MI16x16x1_SN_GSU0_GSUC0_GSUWGMRR0_K1_LBSPPA1024_LBSPPB1024_LPA32_LPB32_MIWT2_2_SU0_SUM0_SUS128_VWA2_VWB2_WGM8_WGMXCC1_WGMXCCGn1
    SolutionIndex: 40
    SolutionNameMin: Cijk_Ailk_Bjlk_F8F8S_BH_Bias_HAS_SAB_SAV_UserArgs_MT64x64x128_MI16x16x1_SN_GSU0_GSUC0_GSUWGMRR0_K1_LBSPPA1024_LBSPPB1024_LPA32_LPB32_MIWT2_2_SU0_SUM0_SUS128_VWA2_VWB2_WGM8_WGMXCC1_WGMXCCGn1
    SolutionIndex: 41
    SolutionNameMin: Cijk_Ailk_Bjlk_F8F8S_BH_Bias_HAS_SAB_SAV_UserArgs_MT64x32x128_MI16x16x1_SN_GSU0_GSUC0_GSUWGMRR0_K1_LBSPPA512_LBSPPB256_LPA32_LPB16_MIWT2_1_SU0_SUM0_SUS128_VWA2_VWB1_WGM8_WGMXCC1_WGMXCCGn1
    SolutionIndex: 42
    SolutionNameMin: Cijk_Ailk_Bjlk_F8F8S_BH_Bias_HAS_SAB_SAV_UserArgs_MT64x32x128_MI16x16x1_SN_GSU0_GSUC0_GSUWGMRR0_K1_LBSPPA512_LBSPPB256_LPA32_LPB16_MIWT2_1_SU0_SUM0_SUS128_VWA2_VWB1_WGM8_WGMXCC1_WGMXCCGn1
    SolutionIndex: 43
    SolutionNameMin: Cijk_Ailk_Bjlk_F8F8S_BH_Bias_HAS_SAB_SAV_UserArgs_MT64x32x128_MI16x16x1_SN_GSU0_GSUC0_GSUWGMRR0_K1_LBSPPA512_LBSPPB256_LPA32_LPB16_MIWT2_1_SU0_SUM0_SUS128_VWA2_VWB1_WGM8_WGMXCC1_WGMXCCGn1
    SolutionIndex: 44
    SolutionNameMin: Cijk_Ailk_Bjlk_F8F8S_BH_Bias_HAS_SAB_SAV_UserArgs_MT64x32x128_MI16x16x1_SN_GSU0_GSUC0_GSUWGMRR0_K1_LBSPPA1024_LBSPPB512_LPA32_LPB16_MIWT2_1_SU0_SUM0_SUS128_VWA2_VWB1_WGM8_WGMXCC1_WGMXCCGn1
    SolutionIndex: 45
    SolutionNameMin: Cijk_Ailk_Bjlk_F8F8S_BH_Bias_HAS_SAB_SAV_UserArgs_MT64x32x128_MI16x16x1_SN_GSU0_GSUC0_GSUWGMRR0_K1_LBSPPA1024_LBSPPB512_LPA32_LPB16_MIWT2_1_SU0_SUM0_SUS128_VWA2_VWB1_WGM8_WGMXCC1_WGMXCCGn1
    SolutionIndex: 46
    SolutionNameMin: Cijk_Ailk_Bjlk_F8F8S_BH_Bias_HAS_SAB_SAV_UserArgs_MT64x32x128_MI16x16x1_SN_GSU0_GSUC0_GSUWGMRR0_K1_LBSPPA1024_LBSPPB512_LPA32_LPB16_MIWT2_1_SU0_SUM0_SUS128_VWA2_VWB1_WGM8_WGMXCC1_WGMXCCGn1
    SolutionIndex: 47
    SolutionNameMin: Cijk_Ailk_Bjlk_F8F8S_BH_Bias_HAS_SAB_SAV_UserArgs_MT32x32x128_MI16x16x1_SN_GSU0_GSUC0_GSUWGMRR0_K1_LBSPPA128_LBSPPB128_LPA16_LPB16_MIWT1_1_SU0_SUM0_SUS128_VWA1_VWB1_WGM8_WGMXCC1_WGMXCCGn1
    SolutionIndex: 48
    SolutionNameMin: Cijk_Ailk_Bjlk_F8F8S_BH_Bias_HAS_SAB_SAV_UserArgs_MT32x32x128_MI16x16x1_SN_GSU0_GSUC0_GSUWGMRR0_K1_LBSPPA128_LBSPPB128_LPA16_LPB16_MIWT1_1_SU0_SUM0_SUS128_VWA1_VWB1_WGM8_WGMXCC1_WGMXCCGn1
    SolutionIndex: 49
    SolutionNameMin: Cijk_Ailk_Bjlk_F8F8S_BH_Bias_HAS_SAB_SAV_UserArgs_MT32x32x128_MI16x16x1_SN_GSU0_GSUC0_GSUWGMRR0_K1_LBSPPA128_LBSPPB128_LPA16_LPB16_MIWT1_1_SU0_SUM0_SUS128_VWA1_VWB1_WGM8_WGMXCC1_WGMXCCGn1
    SolutionIndex: 50
    SolutionNameMin: Cijk_Ailk_Bjlk_F8F8S_BH_Bias_HAS_SAB_SAV_UserArgs_MT32x32x128_MI16x16x1_SN_GSU0_GSUC0_GSUWGMRR0_K1_LBSPPA128_LBSPPB128_LPA16_LPB16_MIWT1_1_SU0_SUM0_SUS128_VWA1_VWB1_WGM8_WGMXCC1_WGMXCCGn1
    SolutionIndex: 51
    SolutionNameMin: Cijk_Ailk_Bjlk_F8F8S_BH_Bias_HAS_SAB_SAV_UserArgs_MT32x32x128_MI16x16x1_SN_GSU0_GSUC0_GSUWGMRR0_K1_LBSPPA256_LBSPPB256_LPA16_LPB16_MIWT1_1_SU0_SUM0_SUS128_VWA1_VWB1_WGM8_WGMXCC1_WGMXCCGn1
    SolutionIndex: 52
    SolutionNameMin: Cijk_Ailk_Bjlk_F8F8S_BH_Bias_HAS_SAB_SAV_UserArgs_MT32x32x128_MI16x16x1_SN_GSU0_GSUC0_GSUWGMRR0_K1_LBSPPA256_LBSPPB256_LPA16_LPB16_MIWT1_1_SU0_SUM0_SUS128_VWA1_VWB1_WGM8_WGMXCC1_WGMXCCGn1
    SolutionIndex: 53
    SolutionNameMin: Cijk_Ailk_Bjlk_F8F8S_BH_Bias_HAS_SAB_SAV_UserArgs_MT32x32x128_MI16x16x1_SN_GSU0_GSUC0_GSUWGMRR0_K1_LBSPPA256_LBSPPB256_LPA16_LPB16_MIWT1_1_SU0_SUM0_SUS128_VWA1_VWB1_WGM8_WGMXCC1_WGMXCCGn1
    SolutionIndex: 54
    SolutionNameMin: Cijk_Ailk_Bjlk_F8F8S_BH_Bias_HAS_SAB_SAV_UserArgs_MT32x32x128_MI16x16x1_SN_GSU0_GSUC0_GSUWGMRR0_K1_LBSPPA256_LBSPPB256_LPA16_LPB16_MIWT1_1_SU0_SUM0_SUS128_VWA1_VWB1_WGM8_WGMXCC1_WGMXCCGn1
    SolutionIndex: 55
    SolutionNameMin: Cijk_Ailk_Bjlk_F8F8S_BH_Bias_HAS_SAB_SAV_UserArgs_MT32x32x128_MI16x16x1_SN_GSU0_GSUC0_GSUWGMRR0_K1_LBSPPA512_LBSPPB512_LPA16_LPB16_MIWT1_1_SU0_SUM0_SUS128_VWA1_VWB1_WGM8_WGMXCC1_WGMXCCGn1
    SolutionIndex: 56
    SolutionNameMin: Cijk_Ailk_Bjlk_F8F8S_BH_Bias_HAS_SAB_SAV_UserArgs_MT32x32x128_MI16x16x1_SN_GSU0_GSUC0_GSUWGMRR0_K1_LBSPPA512_LBSPPB512_LPA16_LPB16_MIWT1_1_SU0_SUM0_SUS128_VWA1_VWB1_WGM8_WGMXCC1_WGMXCCGn1
    SolutionIndex: 57
    SolutionNameMin: Cijk_Ailk_Bjlk_F8F8S_BH_Bias_HAS_SAB_SAV_UserArgs_MT32x32x128_MI16x16x1_SN_GSU0_GSUC0_GSUWGMRR0_K1_LBSPPA512_LBSPPB512_LPA16_LPB16_MIWT1_1_SU0_SUM0_SUS128_VWA1_VWB1_WGM8_WGMXCC1_WGMXCCGn1
    SolutionIndex: 58
    SolutionNameMin: Cijk_Ailk_Bjlk_F8F8S_BH_Bias_HAS_SAB_SAV_UserArgs_MT32x32x128_MI16x16x1_SN_GSU0_GSUC0_GSUWGMRR0_K1_LBSPPA512_LBSPPB512_LPA16_LPB16_MIWT1_1_SU0_SUM0_SUS128_VWA1_VWB1_WGM8_WGMXCC1_WGMXCCGn1
    SolutionIndex: 59
    SolutionNameMin: Cijk_Ailk_Bjlk_F8F8S_BH_Bias_HAS_SAB_SAV_UserArgs_MT256x128x128_MI32x32x1_SN_GSU0_GSUC0_GSUWGMRR0_K1_LBSPPA0_LBSPPB0_LPA0_LPB0_MIWT4_2_SU0_SUM0_SUS128_VWA4_VWB2_WGM8_WGMXCC1_WGMXCCGn1
    SolutionIndex: 60
    SolutionNameMin: Cijk_Ailk_Bjlk_F8F8S_BH_Bias_HAS_SAB_SAV_UserArgs_MT256x128x128_MI32x32x1_SN_GSU0_GSUC0_GSUWGMRR0_K1_LBSPPA0_LBSPPB0_LPA0_LPB0_MIWT4_2_SU0_SUM0_SUS128_VWA4_VWB2_WGM8_WGMXCC1_WGMXCCGn1
    SolutionIndex: 61
    SolutionNameMin: Cijk_Ailk_Bjlk_F8F8S_BH_Bias_HAS_SAB_SAV_UserArgs_MT256x128x128_MI32x32x1_SN_GSU0_GSUC0_GSUWGMRR0_K1_LBSPPA0_LBSPPB0_LPA0_LPB0_MIWT4_2_SU0_SUM0_SUS128_VWA4_VWB2_WGM8_WGMXCC1_WGMXCCGn1
    SolutionIndex: 62
    SolutionNameMin: Cijk_Ailk_Bjlk_F8F8S_BH_Bias_HAS_SAB_SAV_UserArgs_MT64x64x256_MI16x16x1_SN_GSU0_GSUC0_GSUWGMRR0_K1_LBSPPA512_LBSPPB512_LPA32_LPB32_MIWT2_2_SU0_SUM0_SUS256_VWA2_VWB2_WGM8_WGMXCC1_WGMXCCGn1
    SolutionIndex: 63
    SolutionNameMin: Cijk_Ailk_Bjlk_F8F8S_BH_Bias_HAS_SAB_SAV_UserArgs_MT64x64x256_MI16x16x1_SN_GSU0_GSUC0_GSUWGMRR0_K1_LBSPPA1024_LBSPPB1024_LPA32_LPB32_MIWT2_2_SU0_SUM0_SUS256_VWA2_VWB2_WGM8_WGMXCC1_WGMXCCGn1
    SolutionIndex: 64
    SolutionNameMin: Cijk_Ailk_Bjlk_F8F8S_BH_Bias_HAS_SAB_SAV_UserArgs_MT32x64x256_MI16x16x1_SN_GSU0_GSUC0_GSUWGMRR0_K1_LBSPPA256_LBSPPB512_LPA16_LPB32_MIWT1_2_SU0_SUM0_SUS256_VWA1_VWB2_WGM8_WGMXCC1_WGMXCCGn1
    SolutionIndex: 65
    SolutionNameMin: Cijk_Ailk_Bjlk_F8F8S_BH_Bias_HAS_SAB_SAV_UserArgs_MT64x32x256_MI16x16x1_SN_GSU0_GSUC0_GSUWGMRR0_K1_LBSPPA512_LBSPPB256_LPA32_LPB16_MIWT2_1_SU0_SUM0_SUS256_VWA2_VWB1_WGM8_WGMXCC1_WGMXCCGn1
    SolutionIndex: 66
    SolutionNameMin: Cijk_Ailk_Bjlk_F8F8S_BH_Bias_HAS_SAB_SAV_UserArgs_MT64x32x256_MI16x16x1_SN_GSU0_GSUC0_GSUWGMRR0_K1_LBSPPA1024_LBSPPB512_LPA32_LPB16_MIWT2_1_SU0_SUM0_SUS256_VWA2_VWB1_WGM8_WGMXCC1_WGMXCCGn1
    SolutionIndex: 67
    SolutionNameMin: Cijk_Ailk_Bjlk_F8F8S_BH_Bias_HAS_SAB_SAV_UserArgs_MT64x32x256_MI16x16x1_SN_GSU0_GSUC0_GSUWGMRR0_K1_LBSPPA1024_LBSPPB512_LPA32_LPB16_MIWT2_1_SU0_SUM0_SUS256_VWA2_VWB1_WGM8_WGMXCC1_WGMXCCGn1
    SolutionIndex: 68
    SolutionNameMin: Cijk_Ailk_Bjlk_F8F8S_BH_Bias_HAS_SAB_SAV_UserArgs_MT32x32x256_MI16x16x1_SN_GSU0_GSUC0_GSUWGMRR0_K1_LBSPPA128_LBSPPB128_LPA16_LPB16_MIWT1_1_SU0_SUM0_SUS256_VWA1_VWB1_WGM8_WGMXCC1_WGMXCCGn1
    SolutionIndex: 69
    SolutionNameMin: Cijk_Ailk_Bjlk_F8F8S_BH_Bias_HAS_SAB_SAV_UserArgs_MT32x32x256_MI16x16x1_SN_GSU0_GSUC0_GSUWGMRR0_K1_LBSPPA128_LBSPPB128_LPA16_LPB16_MIWT1_1_SU0_SUM0_SUS256_VWA1_VWB1_WGM8_WGMXCC1_WGMXCCGn1
    SolutionIndex: 70
    SolutionNameMin: Cijk_Ailk_Bjlk_F8F8S_BH_Bias_HAS_SAB_SAV_UserArgs_MT32x32x256_MI16x16x1_SN_GSU0_GSUC0_GSUWGMRR0_K1_LBSPPA256_LBSPPB256_LPA16_LPB16_MIWT1_1_SU0_SUM0_SUS256_VWA1_VWB1_WGM8_WGMXCC1_WGMXCCGn1
    SolutionIndex: 71
    SolutionNameMin: Cijk_Ailk_Bjlk_F8F8S_BH_Bias_HAS_SAB_SAV_UserArgs_MT32x32x256_MI16x16x1_SN_GSU0_GSUC0_GSUWGMRR0_K1_LBSPPA256_LBSPPB256_LPA16_LPB16_MIWT1_1_SU0_SUM0_SUS256_VWA1_VWB1_WGM8_WGMXCC1_WGMXCCGn1
    SolutionIndex: 72
    SolutionNameMin: Cijk_Ailk_Bjlk_F8F8S_BH_Bias_HAS_SAB_SAV_UserArgs_MT32x32x256_MI16x16x1_SN_GSU0_GSUC0_GSUWGMRR0_K1_LBSPPA512_LBSPPB512_LPA16_LPB16_MIWT1_1_SU0_SUM0_SUS256_VWA1_VWB1_WGM8_WGMXCC1_WGMXCCGn1
    SolutionIndex: 73
    SolutionNameMin: Cijk_Ailk_Bjlk_F8F8S_BH_Bias_HAS_SAB_SAV_UserArgs_MT32x32x256_MI16x16x1_SN_GSU0_GSUC0_GSUWGMRR0_K1_LBSPPA512_LBSPPB512_LPA16_LPB16_MIWT1_1_SU0_SUM0_SUS256_VWA1_VWB1_WGM8_WGMXCC1_WGMXCCGn1
    SolutionIndex: 74
    SolutionNameMin: Cijk_Ailk_Bjlk_F8F8S_BH_Bias_HAS_SAB_SAV_UserArgs_MT32x32x128_MI16x16x1_SN_GSU0_GSUC0_GSUWGMRR0_K1_LBSPPA256_LBSPPB256_LPA16_LPB16_MIWT1_1_SU32_SUM0_SUS256_VWA1_VWB1_WGM8_WGMXCC1_WGMXCCGn1
- - - [128, 128, 1, 128, 128, 128, 128, 128]
    - [56, 0.4]
  - - [128, 128, 1, 256, 128, 128, 128, 128]
    - [48, 0.7]
  - - [128, 128, 1, 512, 128, 128, 128, 128]
    - [48, 1.19]
  - - [128, 128, 1, 1024, 128, 128, 128, 128]
    - [58, 1.8]
  - - [128, 128, 1, 2048, 128, 128, 128, 128]
    - [69, 2.5]
  - - [128, 128, 1, 4096, 128, 128, 128, 128]
    - [68, 3.16]
  - - [128, 128, 1, 8192, 128, 128, 128, 128]
    - [69, 3.63]
  - - [128, 256, 1, 128, 128, 128, 128, 256]
    - [56, 0.8]
  - - [128, 256, 1, 256, 128, 128, 128, 256]
    - [56, 1.41]
  - - [128, 256, 1, 512, 128, 128, 128, 256]
    - [50, 2.36]
  - - [128, 256, 1, 1024, 128, 128, 128, 256]
    - [54, 3.58]
  - - [128, 256, 1, 2048, 128, 128, 128, 256]
    - [70, 5.0]
  - - [128, 256, 1, 4096, 128, 128, 128, 256]
    - [68, 6.32]
  - - [128, 256, 1, 8192, 128, 128, 128, 256]
    - [71, 7.23]
  - - [128, 512, 1, 128, 128, 128, 128, 512]
    - [55, 1.5]
  - - [128, 512, 1, 256, 128, 128, 128, 512]
    - [48, 2.7]
  - - [128, 512, 1, 512, 128, 128, 128, 512]
    - [52, 4.56]
  - - [128, 512, 1, 1024, 128, 128, 128, 512]
    - [72, 7.0]
  - - [128, 512, 1, 2048, 128, 128, 128, 512]
    - [69, 9.99]
  - - [128, 512, 1, 4096, 128, 128, 128, 512]
    - [72, 12.51]
  - - [128, 512, 1, 8192, 128, 128, 128, 512]
    - [69, 14.54]
  - - [128, 1024, 1, 128, 128, 128, 128, 1024]
    - [48, 3.01]
  - - [128, 1024, 1, 256, 128, 128, 128, 1024]
    - [48, 5.31]
  - - [128, 1024, 1, 512, 128, 128, 128, 1024]
    - [52, 9.0]
  - - [128, 1024, 1, 1024, 128, 128, 128, 1024]
    - [56, 13.84]
  - - [128, 1024, 1, 2048, 128, 128, 128, 1024]
    - [68, 19.48]
  - - [128, 1024, 1, 4096, 128, 128, 128, 1024]
    - [72, 24.1]
  - - [128, 1024, 1, 8192, 128, 128, 128, 1024]
    - [70, 27.8]
  - - [128, 2048, 1, 128, 128, 128, 128, 2048]
    - [48, 5.85]
  - - [128, 2048, 1, 256, 128, 128, 128, 2048]
    - [56, 10.37]
  - - [128, 2048, 1, 512, 128, 128, 128, 2048]
    - [56, 17.41]
  - - [128, 2048, 1, 1024, 128, 128, 128, 2048]
    - [72, 26.73]
  - - [128, 2048, 1, 2048, 128, 128, 128, 2048]
    - [72, 36.7]
  - - [128, 2048, 1, 4096, 128, 128, 128, 2048]
    - [72, 45.74]
  - - [128, 2048, 1, 8192, 128, 128, 128, 2048]
    - [73, 52.02]
  - - [128, 4096, 1, 128, 128, 128, 128, 4096]
    - [45, 11.13]
  - - [128, 4096, 1, 256, 128, 128, 128, 4096]
    - [46, 19.6]
  - - [128, 4096, 1, 512, 128, 128, 128, 4096]
    - [41, 32.68]
  - - [128, 4096, 1, 1024, 128, 128, 128, 4096]
    - [44, 48.36]
  - - [128, 4096, 1, 2048, 128, 128, 128, 4096]
    - [66, 66.11]
  - - [128, 4096, 1, 4096, 128, 128, 128, 4096]
    - [65, 84.22]
  - - [128, 4096, 1, 8192, 128, 128, 128, 4096]
    - [67, 93.52]
  - - [128, 8192, 1, 128, 128, 128, 128, 8192]
    - [30, 20.77]
  - - [128, 8192, 1, 256, 128, 128, 128, 8192]
    - [38, 36.46]
  - - [128, 8192, 1, 512, 128, 128, 128, 8192]
    - [33, 60.15]
  - - [128, 8192, 1, 1024, 128, 128, 128, 8192]
    - [38, 89.5]
  - - [128, 8192, 1, 2048, 128, 128, 128, 8192]
    - [40, 119.59]
  - - [128, 8192, 1, 4096, 128, 128, 128, 8192]
    - [62, 144.34]
  - - [128, 8192, 1, 8192, 128, 128, 128, 8192]
    - [63, 162.15]
  - - [256, 128, 1, 128, 256, 256, 256, 128]
    - [52, 0.77]
  - - [256, 128, 1, 256, 256, 256, 256, 128]
    - [52, 1.37]
  - - [256, 128, 1, 512, 256, 256, 256, 128]
    - [56, 2.31]
  - - [256, 128, 1, 1024, 256, 256, 256, 128]
    - [50, 3.54]
  - - [256, 128, 1, 2048, 256, 256, 256, 128]
    - [69, 5.05]
  - - [256, 128, 1, 4096, 256, 256, 256, 128]
    - [70, 6.32]
  - - [256, 128, 1, 8192, 256, 256, 256, 128]
    - [69, 7.25]
  - - [256, 256, 1, 128, 256, 256, 256, 256]
    - [48, 1.54]
  - - [256, 256, 1, 256, 256, 256, 256, 256]
    - [48, 2.72]
  - - [256, 256, 1, 512, 256, 256, 256, 256]
    - [49, 4.61]
  - - [256, 256, 1, 1024, 256, 256, 256, 256]
    - [70, 7.09]
  - - [256, 256, 1, 2048, 256, 256, 256, 256]
    - [69, 10.0]
  - - [256, 256, 1, 4096, 256, 256, 256, 256]
    - [72, 12.56]
  - - [256, 256, 1, 8192, 256, 256, 256, 256]
    - [72, 14.45]
  - - [256, 512, 1, 128, 256, 256, 256, 512]
    - [51, 3.05]
  - - [256, 512, 1, 256, 256, 256, 256, 512]
    - [49, 5.44]
  - - [256, 512, 1, 512, 256, 256, 256, 512]
    - [49, 9.16]
  - - [256, 512, 1, 1024, 256, 256, 256, 512]
    - [68, 14.09]
  - - [256, 512, 1, 2048, 256, 256, 256, 512]
    - [69, 19.85]
  - - [256, 512, 1, 4096, 256, 256, 256, 512]
    - [70, 25.22]
  - - [256, 512, 1, 8192, 256, 256, 256, 512]
    - [70, 28.64]
  - - [256, 1024, 1, 128, 256, 256, 256, 1024]
    - [56, 5.91]
  - - [256, 1024, 1, 256, 256, 256, 256, 1024]
    - [56, 10.42]
  - - [256, 1024, 1, 512, 256, 256, 256, 1024]
    - [48, 17.45]
  - - [256, 1024, 1, 1024, 256, 256, 256, 1024]
    - [70, 27.28]
  - - [256, 1024, 1, 2048, 256, 256, 256, 1024]
    - [69, 37.89]
  - - [256, 1024, 1, 4096, 256, 256, 256, 1024]
    - [69, 47.09]
  - - [256, 1024, 1, 8192, 256, 256, 256, 1024]
    - [70, 53.14]
  - - [256, 2048, 1, 128, 256, 256, 256, 2048]
    - [41, 11.32]
  - - [256, 2048, 1, 256, 256, 256, 256, 2048]
    - [44, 19.91]
  - - [256, 2048, 1, 512, 256, 256, 256, 2048]
    - [41, 33.14]
  - - [256, 2048, 1, 1024, 256, 256, 256, 2048]
    - [43, 49.0]
  - - [256, 2048, 1, 2048, 256, 256, 256, 2048]
    - [65, 68.36]
  - - [256, 2048, 1, 4096, 256, 256, 256, 2048]
    - [65, 85.23]
  - - [256, 2048, 1, 8192, 256, 256, 256, 2048]
    - [64, 97.58]
  - - [256, 4096, 1, 128, 256, 256, 256, 4096]
    - [32, 20.94]
  - - [256, 4096, 1, 256, 256, 256, 256, 4096]
    - [31, 36.56]
  - - [256, 4096, 1, 512, 256, 256, 256, 4096]
    - [36, 60.66]
  - - [256, 4096, 1, 1024, 256, 256, 256, 4096]
    - [35, 89.97]
  - - [256, 4096, 1, 2048, 256, 256, 256, 4096]
    - [40, 119.84]
  - - [256, 4096, 1, 4096, 256, 256, 256, 4096]
    - [35, 145.43]
  - - [256, 4096, 1, 8192, 256, 256, 256, 4096]
    - [35, 158.28]
  - - [256, 8192, 1, 128, 256, 256, 256, 8192]
    - [21, 37.27]
  - - [256, 8192, 1, 256, 256, 256, 256, 8192]
    - [28, 64.03]
  - - [256, 8192, 1, 512, 256, 256, 256, 8192]
    - [29, 104.37]
  - - [256, 8192, 1, 1024, 256, 256, 256, 8192]
    - [29, 153.67]
  - - [256, 8192, 1, 2048, 256, 256, 256, 8192]
    - [29, 201.63]
  - - [256, 8192, 1, 4096, 256, 256, 256, 8192]
    - [29, 232.48]
  - - [256, 8192, 1, 8192, 256, 256, 256, 8192]
    - [29, 240.48]
  - - [512, 128, 1, 128, 512, 512, 512, 128]
    - [55, 1.55]
  - - [512, 128, 1, 256, 512, 512, 512, 128]
    - [51, 2.71]
  - - [512, 128, 1, 512, 512, 512, 512, 128]
    - [51, 4.58]
  - - [512, 128, 1, 1024, 512, 512, 512, 128]
    - [69, 7.09]
  - - [512, 128, 1, 2048, 512, 512, 512, 128]
    - [72, 9.92]
  - - [512, 128, 1, 4096, 512, 512, 512, 128]
    - [73, 12.44]
  - - [512, 128, 1, 8192, 512, 512, 512, 128]
    - [71, 14.33]
  - - [512, 256, 1, 128, 512, 512, 512, 256]
    - [49, 3.04]
  - - [512, 256, 1, 256, 512, 512, 512, 256]
    - [49, 5.37]
  - - [512, 256, 1, 512, 512, 512, 512, 256]
    - [53, 9.17]
  - - [512, 256, 1, 1024, 512, 512, 512, 256]
    - [70, 14.09]
  - - [512, 256, 1, 2048, 512, 512, 512, 256]
    - [70, 19.69]
  - - [512, 256, 1, 4096, 512, 512, 512, 256]
    - [73, 24.73]
  - - [512, 256, 1, 8192, 512, 512, 512, 256]
    - [72, 28.46]
  - - [512, 512, 1, 128, 512, 512, 512, 512]
    - [51, 6.03]
  - - [512, 512, 1, 256, 512, 512, 512, 512]
    - [47, 10.48]
  - - [512, 512, 1, 512, 512, 512, 512, 512]
    - [57, 17.71]
  - - [512, 512, 1, 1024, 512, 512, 512, 512]
    - [72, 27.72]
  - - [512, 512, 1, 2048, 512, 512, 512, 512]
    - [69, 38.66]
  - - [512, 512, 1, 4096, 512, 512, 512, 512]
    - [70, 48.13]
  - - [512, 512, 1, 8192, 512, 512, 512, 512]
    - [73, 54.76]
  - - [512, 1024, 1, 128, 512, 512, 512, 1024]
    - [45, 11.46]
  - - [512, 1024, 1, 256, 512, 512, 512, 1024]
    - [41, 20.18]
  - - [512, 1024, 1, 512, 512, 512, 512, 1024]
    - [42, 33.3]
  - - [512, 1024, 1, 1024, 512, 512, 512, 1024]
    - [67, 50.02]
  - - [512, 1024, 1, 2048, 512, 512, 512, 1024]
    - [65, 69.77]
  - - [512, 1024, 1, 4096, 512, 512, 512, 1024]
    - [67, 86.78]
  - - [512, 1024, 1, 8192, 512, 512, 512, 1024]
    - [67, 99.1]
  - - [512, 2048, 1, 128, 512, 512, 512, 2048]
    - [37, 21.31]
  - - [512, 2048, 1, 256, 512, 512, 512, 2048]
    - [36, 37.27]
  - - [512, 2048, 1, 512, 512, 512, 512, 2048]
    - [33, 61.66]
  - - [512, 2048, 1, 1024, 512, 512, 512, 2048]
    - [38, 91.56]
  - - [512, 2048, 1, 2048, 512, 512, 512, 2048]
    - [35, 121.41]
  - - [512, 2048, 1, 4096, 512, 512, 512, 2048]
    - [40, 146.25]
  - - [512, 2048, 1, 8192, 512, 512, 512, 2048]
    - [35, 159.61]
  - - [512, 4096, 1, 128, 512, 512, 512, 4096]
    - [21, 37.6]
  - - [512, 4096, 1, 256, 512, 512, 512, 4096]
    - [26, 64.63]
  - - [512, 4096, 1, 512, 512, 512, 512, 4096]
    - [27, 105.18]
  - - [512, 4096, 1, 1024, 512, 512, 512, 4096]
    - [29, 154.0]
  - - [512, 4096, 1, 2048, 512, 512, 512, 4096]
    - [29, 201.57]
  - - [512, 4096, 1, 4096, 512, 512, 512, 4096]
    - [29, 238.19]
  - - [512, 4096, 1, 8192, 512, 512, 512, 4096]
    - [23, 240.24]
  - - [512, 8192, 1, 128, 512, 512, 512, 8192]
    - [17, 62.21]
  - - [512, 8192, 1, 256, 512, 512, 512, 8192]
    - [20, 107.21]
  - - [512, 8192, 1, 512, 512, 512, 512, 8192]
    - [20, 171.02]
  - - [512, 8192, 1, 1024, 512, 512, 512, 8192]
    - [20, 244.62]
  - - [512, 8192, 1, 2048, 512, 512, 512, 8192]
    - [20, 312.15]
  - - [512, 8192, 1, 4096, 512, 512, 512, 8192]
    - [20, 351.15]
  - - [512, 8192, 1, 8192, 512, 512, 512, 8192]
    - [19, 330.86]
  - - [1024, 128, 1, 128, 1024, 1024, 1024, 128]
    - [53, 3.03]
  - - [1024, 128, 1, 256, 1024, 1024, 1024, 128]
    - [57, 5.31]
  - - [1024, 128, 1, 512, 1024, 1024, 1024, 128]
    - [53, 8.96]
  - - [1024, 128, 1, 1024, 1024, 1024, 1024, 128]
    - [57, 13.66]
  - - [1024, 128, 1, 2048, 1024, 1024, 1024, 128]
    - [70, 19.19]
  - - [1024, 128, 1, 4096, 1024, 1024, 1024, 128]
    - [70, 23.57]
  - - [1024, 128, 1, 8192, 1024, 1024, 1024, 128]
    - [69, 26.85]
  - - [1024, 256, 1, 128, 1024, 1024, 1024, 256]
    - [48, 5.87]
  - - [1024, 256, 1, 256, 1024, 1024, 1024, 256]
    - [53, 10.35]
  - - [1024, 256, 1, 512, 1024, 1024, 1024, 256]
    - [57, 17.33]
  - - [1024, 256, 1, 1024, 1024, 1024, 1024, 256]
    - [69, 26.74]
  - - [1024, 256, 1, 2048, 1024, 1024, 1024, 256]
    - [70, 37.35]
  - - [1024, 256, 1, 4096, 1024, 1024, 1024, 256]
    - [70, 45.83]
  - - [1024, 256, 1, 8192, 1024, 1024, 1024, 256]
    - [72, 51.77]
  - - [1024, 512, 1, 128, 1024, 1024, 1024, 512]
    - [41, 11.53]
  - - [1024, 512, 1, 256, 1024, 1024, 1024, 512]
    - [41, 20.33]
  - - [1024, 512, 1, 512, 1024, 1024, 1024, 512]
    - [44, 33.81]
  - - [1024, 512, 1, 1024, 1024, 1024, 1024, 512]
    - [67, 50.38]
  - - [1024, 512, 1, 2048, 1024, 1024, 1024, 512]
    - [67, 69.93]
  - - [1024, 512, 1, 4096, 1024, 1024, 1024, 512]
    - [67, 87.15]
  - - [1024, 512, 1, 8192, 1024, 1024, 1024, 512]
    - [65, 98.41]
  - - [1024, 1024, 1, 128, 1024, 1024, 1024, 1024]
    - [37, 21.45]
  - - [1024, 1024, 1, 256, 1024, 1024, 1024, 1024]
    - [33, 37.72]
  - - [1024, 1024, 1, 512, 1024, 1024, 1024, 1024]
    - [38, 62.21]
  - - [1024, 1024, 1, 1024, 1024, 1024, 1024, 1024]
    - [33, 92.31]
  - - [1024, 1024, 1, 2048, 1024, 1024, 1024, 1024]
    - [35, 122.13]
  - - [1024, 1024, 1, 4096, 1024, 1024, 1024, 1024]
    - [35, 146.6]
  - - [1024, 1024, 1, 8192, 1024, 1024, 1024, 1024]
    - [35, 160.01]
  - - [1024, 2048, 1, 128, 1024, 1024, 1024, 2048]
    - [25, 37.59]
  - - [1024, 2048, 1, 256, 1024, 1024, 1024, 2048]
    - [26, 64.91]
  - - [1024, 2048, 1, 512, 1024, 1024, 1024, 2048]
    - [29, 105.85]
  - - [1024, 2048, 1, 1024, 1024, 1024, 1024, 2048]
    - [29, 155.54]
  - - [1024, 2048, 1, 2048, 1024, 1024, 1024, 2048]
    - [29, 202.02]
  - - [1024, 2048, 1, 4096, 1024, 1024, 1024, 2048]
    - [29, 237.55]
  - - [1024, 2048, 1, 8192, 1024, 1024, 1024, 2048]
    - [29, 242.37]
  - - [1024, 4096, 1, 128, 1024, 1024, 1024, 4096]
    - [18, 62.49]
  - - [1024, 4096, 1, 256, 1024, 1024, 1024, 4096]
    - [20, 106.38]
  - - [1024, 4096, 1, 512, 1024, 1024, 1024, 4096]
    - [20, 170.77]
  - - [1024, 4096, 1, 1024, 1024, 1024, 1024, 4096]
    - [20, 244.07]
  - - [1024, 4096, 1, 2048, 1024, 1024, 1024, 4096]
    - [20, 312.11]
  - - [1024, 4096, 1, 4096, 1024, 1024, 1024, 4096]
    - [20, 347.72]
  - - [1024, 4096, 1, 8192, 1024, 1024, 1024, 4096]
    - [20, 337.89]
  - - [1024, 8192, 1, 128, 1024, 1024, 1024, 8192]
    - [12, 94.74]
  - - [1024, 8192, 1, 256, 1024, 1024, 1024, 8192]
    - [10, 159.49]
  - - [1024, 8192, 1, 512, 1024, 1024, 1024, 8192]
    - [14, 242.3]
  - - [1024, 8192, 1, 1024, 1024, 1024, 1024, 8192]
    - [14, 327.48]
  - - [1024, 8192, 1, 2048, 1024, 1024, 1024, 8192]
    - [61, 395.79]
  - - [1024, 8192, 1, 4096, 1024, 1024, 1024, 8192]
    - [61, 413.7]
  - - [1024, 8192, 1, 8192, 1024, 1024, 1024, 8192]
    - [60, 412.7]
  - - [2048, 128, 1, 128, 2048, 2048, 2048, 128]
    - [49, 5.8]
  - - [2048, 128, 1, 256, 2048, 2048, 2048, 128]
    - [44, 10.25]
  - - [2048, 128, 1, 512, 2048, 2048, 2048, 128]
    - [49, 17.34]
  - - [2048, 128, 1, 1024, 2048, 2048, 2048, 128]
    - [70, 26.55]
  - - [2048, 128, 1, 2048, 2048, 2048, 2048, 128]
    - [72, 36.49]
  - - [2048, 128, 1, 4096, 2048, 2048, 2048, 128]
    - [70, 45.3]
  - - [2048, 128, 1, 8192, 2048, 2048, 2048, 128]
    - [73, 52.32]
  - - [2048, 256, 1, 128, 2048, 2048, 2048, 256]
    - [41, 11.27]
  - - [2048, 256, 1, 256, 2048, 2048, 2048, 256]
    - [44, 20.03]
  - - [2048, 256, 1, 512, 2048, 2048, 2048, 256]
    - [41, 33.09]
  - - [2048, 256, 1, 1024, 2048, 2048, 2048, 256]
    - [44, 49.28]
  - - [2048, 256, 1, 2048, 2048, 2048, 2048, 256]
    - [67, 68.24]
  - - [2048, 256, 1, 4096, 2048, 2048, 2048, 256]
    - [67, 84.74]
  - - [2048, 256, 1, 8192, 2048, 2048, 2048, 256]
    - [67, 97.02]
  - - [2048, 512, 1, 128, 2048, 2048, 2048, 512]
    - [38, 21.27]
  - - [2048, 512, 1, 256, 2048, 2048, 2048, 512]
    - [38, 37.35]
  - - [2048, 512, 1, 512, 2048, 2048, 2048, 512]
    - [38, 61.91]
  - - [2048, 512, 1, 1024, 2048, 2048, 2048, 512]
    - [34, 91.36]
  - - [2048, 512, 1, 2048, 2048, 2048, 2048, 512]
    - [35, 120.71]
  - - [2048, 512, 1, 4096, 2048, 2048, 2048, 512]
    - [35, 145.95]
  - - [2048, 512, 1, 8192, 2048, 2048, 2048, 512]
    - [35, 161.07]
  - - [2048, 1024, 1, 128, 2048, 2048, 2048, 1024]
    - [24, 37.83]
  - - [2048, 1024, 1, 256, 2048, 2048, 2048, 1024]
    - [24, 65.49]
  - - [2048, 1024, 1, 512, 2048, 2048, 2048, 1024]
    - [29, 106.48]
  - - [2048, 1024, 1, 1024, 2048, 2048, 2048, 1024]
    - [29, 155.99]
  - - [2048, 1024, 1, 2048, 2048, 2048, 2048, 1024]
    - [29, 202.89]
  - - [2048, 1024, 1, 4096, 2048, 2048, 2048, 1024]
    - [29, 238.45]
  - - [2048, 1024, 1, 8192, 2048, 2048, 2048, 1024]
    - [29, 246.97]
  - - [2048, 2048, 1, 128, 2048, 2048, 2048, 2048]
    - [17, 62.71]
  - - [2048, 2048, 1, 256, 2048, 2048, 2048, 2048]
    - [20, 107.44]
  - - [2048, 2048, 1, 512, 2048, 2048, 2048, 2048]
    - [20, 171.29]
  - - [2048, 2048, 1, 1024, 2048, 2048, 2048, 2048]
    - [20, 245.63]
  - - [2048, 2048, 1, 2048, 2048, 2048, 2048, 2048]
    - [20, 313.09]
  - - [2048, 2048, 1, 4096, 2048, 2048, 2048, 2048]
    - [20, 349.1]
  - - [2048, 2048, 1, 8192, 2048, 2048, 2048, 2048]
    - [19, 335.49]
  - - [2048, 4096, 1, 128, 2048, 2048, 2048, 4096]
    - [10, 95.41]
  - - [2048, 4096, 1, 256, 2048, 2048, 2048, 4096]
    - [13, 159.92]
  - - [2048, 4096, 1, 512, 2048, 2048, 2048, 4096]
    - [15, 242.55]
  - - [2048, 4096, 1, 1024, 2048, 2048, 2048, 4096]
    - [14, 329.56]
  - - [2048, 4096, 1, 2048, 2048, 2048, 2048, 4096]
    - [59, 403.74]
  - - [2048, 4096, 1, 4096, 2048, 2048, 2048, 4096]
    - [59, 410.58]
  - - [2048, 4096, 1, 8192, 2048, 2048, 2048, 4096]
    - [60, 411.34]
  - - [2048, 8192, 1, 128, 2048, 2048, 2048, 8192]
    - [1, 116.43]
  - - [2048, 8192, 1, 256, 2048, 2048, 2048, 8192]
    - [5, 194.2]
  - - [2048, 8192, 1, 512, 2048, 2048, 2048, 8192]
    - [8, 316.28]
  - - [2048, 8192, 1, 1024, 2048, 2048, 2048, 8192]
    - [5, 445.47]
  - - [2048, 8192, 1, 2048, 2048, 2048, 2048, 8192]
    - [9, 545.05]
  - - [2048, 8192, 1, 4096, 2048, 2048, 2048, 8192]
    - [6, 562.86]
  - - [2048, 8192, 1, 8192, 2048, 2048, 2048, 8192]
    - [3, 566.15]
  - - [4096, 128, 1, 128, 4096, 4096, 4096, 128]
    - [41, 11.33]
  - - [4096, 128, 1, 256, 4096, 4096, 4096, 128]
    - [44, 19.87]
  - - [4096, 128, 1, 512, 4096, 4096, 4096, 128]
    - [44, 32.93]
  - - [4096, 128, 1, 1024, 4096, 4096, 4096, 128]
    - [41, 48.78]
  - - [4096, 128, 1, 2048, 4096, 4096, 4096, 128]
    - [65, 66.59]
  - - [4096, 128, 1, 4096, 4096, 4096, 4096, 128]
    - [67, 83.17]
  - - [4096, 128, 1, 8192, 4096, 4096, 4096, 128]
    - [65, 91.31]
  - - [4096, 256, 1, 128, 4096, 4096, 4096, 256]
    - [37, 21.28]
  - - [4096, 256, 1, 256, 4096, 4096, 4096, 256]
    - [37, 37.09]
  - - [4096, 256, 1, 512, 4096, 4096, 4096, 256]
    - [31, 60.7]
  - - [4096, 256, 1, 1024, 4096, 4096, 4096, 256]
    - [38, 90.96]
  - - [4096, 256, 1, 2048, 4096, 4096, 4096, 256]
    - [35, 120.56]
  - - [4096, 256, 1, 4096, 4096, 4096, 4096, 256]
    - [35, 145.2]
  - - [4096, 256, 1, 8192, 4096, 4096, 4096, 256]
    - [39, 157.71]
  - - [4096, 512, 1, 128, 4096, 4096, 4096, 512]
    - [24, 37.31]
  - - [4096, 512, 1, 256, 4096, 4096, 4096, 512]
    - [29, 64.87]
  - - [4096, 512, 1, 512, 4096, 4096, 4096, 512]
    - [29, 105.73]
  - - [4096, 512, 1, 1024, 4096, 4096, 4096, 512]
    - [29, 155.13]
  - - [4096, 512, 1, 2048, 4096, 4096, 4096, 512]
    - [29, 201.31]
  - - [4096, 512, 1, 4096, 4096, 4096, 4096, 512]
    - [29, 237.16]
  - - [4096, 512, 1, 8192, 4096, 4096, 4096, 512]
    - [22, 239.1]
  - - [4096, 1024, 1, 128, 4096, 4096, 4096, 1024]
    - [20, 62.42]
  - - [4096, 1024, 1, 256, 4096, 4096, 4096, 1024]
    - [20, 106.69]
  - - [4096, 1024, 1, 512, 4096, 4096, 4096, 1024]
    - [20, 170.54]
  - - [4096, 1024, 1, 1024, 4096, 4096, 4096, 1024]
    - [20, 244.85]
  - - [4096, 1024, 1, 2048, 4096, 4096, 4096, 1024]
    - [20, 312.0]
  - - [4096, 1024, 1, 4096, 4096, 4096, 4096, 1024]
    - [20, 353.48]
  - - [4096, 1024, 1, 8192, 4096, 4096, 4096, 1024]
    - [20, 338.74]
  - - [4096, 2048, 1, 128, 4096, 4096, 4096, 2048]
    - [15, 94.24]
  - - [4096, 2048, 1, 256, 4096, 4096, 4096, 2048]
    - [12, 159.38]
  - - [4096, 2048, 1, 512, 4096, 4096, 4096, 2048]
    - [14, 242.04]
  - - [4096, 2048, 1, 1024, 4096, 4096, 4096, 2048]
    - [16, 328.18]
  - - [4096, 2048, 1, 2048, 4096, 4096, 4096, 2048]
    - [61, 398.04]
  - - [4096, 2048, 1, 4096, 4096, 4096, 4096, 2048]
    - [59, 406.7]
  - - [4096, 2048, 1, 8192, 4096, 4096, 4096, 2048]
    - [61, 411.68]
  - - [4096, 4096, 1, 128, 4096, 4096, 4096, 4096]
    - [4, 112.21]
  - - [4096, 4096, 1, 256, 4096, 4096, 4096, 4096]
    - [8, 171.28]
  - - [4096, 4096, 1, 512, 4096, 4096, 4096, 4096]
    - [5, 304.1]
  - - [4096, 4096, 1, 1024, 4096, 4096, 4096, 4096]
    - [5, 435.0]
  - - [4096, 4096, 1, 2048, 4096, 4096, 4096, 4096]
    - [3, 538.96]
  - - [4096, 4096, 1, 4096, 4096, 4096, 4096, 4096]
    - [6, 540.75]
  - - [4096, 4096, 1, 8192, 4096, 4096, 4096, 4096]
    - [6, 570.61]
  - - [4096, 8192, 1, 128, 4096, 4096, 4096, 8192]
    - [4, 132.69]
  - - [4096, 8192, 1, 256, 4096, 4096, 4096, 8192]
    - [5, 219.43]
  - - [4096, 8192, 1, 512, 4096, 4096, 4096, 8192]
    - [7, 338.38]
  - - [4096, 8192, 1, 1024, 4096, 4096, 4096, 8192]
    - [9, 450.67]
  - - [4096, 8192, 1, 2048, 4096, 4096, 4096, 8192]
    - [3, 496.24]
  - - [4096, 8192, 1, 4096, 4096, 4096, 4096, 8192]
    - [0, 535.39]
  - - [4096, 8192, 1, 8192, 4096, 4096, 4096, 8192]
    - [9, 600.45]
  - - [8192, 128, 1, 128, 8192, 8192, 8192, 128]
    - [37, 20.93]
  - - [8192, 128, 1, 256, 8192, 8192, 8192, 128]
    - [38, 36.74]
  - - [8192, 128, 1, 512, 8192, 8192, 8192, 128]
    - [38, 60.88]
  - - [8192, 128, 1, 1024, 8192, 8192, 8192, 128]
    - [33, 89.94]
  - - [8192, 128, 1, 2048, 8192, 8192, 8192, 128]
    - [33, 120.17]
  - - [8192, 128, 1, 4096, 8192, 8192, 8192, 128]
    - [35, 142.99]
  - - [8192, 128, 1, 8192, 8192, 8192, 8192, 128]
    - [34, 154.72]
  - - [8192, 256, 1, 128, 8192, 8192, 8192, 256]
    - [24, 37.69]
  - - [8192, 256, 1, 256, 8192, 8192, 8192, 256]
    - [24, 64.65]
  - - [8192, 256, 1, 512, 8192, 8192, 8192, 256]
    - [24, 104.9]
  - - [8192, 256, 1, 1024, 8192, 8192, 8192, 256]
    - [29, 154.64]
  - - [8192, 256, 1, 2048, 8192, 8192, 8192, 256]
    - [29, 201.28]
  - - [8192, 256, 1, 4096, 8192, 8192, 8192, 256]
    - [29, 237.01]
  - - [8192, 256, 1, 8192, 8192, 8192, 8192, 256]
    - [29, 245.59]
  - - [8192, 512, 1, 128, 8192, 8192, 8192, 512]
    - [19, 62.36]
  - - [8192, 512, 1, 256, 8192, 8192, 8192, 512]
    - [20, 106.66]
  - - [8192, 512, 1, 512, 8192, 8192, 8192, 512]
    - [20, 171.0]
  - - [8192, 512, 1, 1024, 8192, 8192, 8192, 512]
    - [20, 244.8]
  - - [8192, 512, 1, 2048, 8192, 8192, 8192, 512]
    - [20, 311.69]
  - - [8192, 512, 1, 4096, 8192, 8192, 8192, 512]
    - [20, 350.51]
  - - [8192, 512, 1, 8192, 8192, 8192, 8192, 512]
    - [20, 342.68]
  - - [8192, 1024, 1, 128, 8192, 8192, 8192, 1024]
    - [10, 93.11]
  - - [8192, 1024, 1, 256, 8192, 8192, 8192, 1024]
    - [11, 155.97]
  - - [8192, 1024, 1, 512, 8192, 8192, 8192, 1024]
    - [16, 240.03]
  - - [8192, 1024, 1, 1024, 8192, 8192, 8192, 1024]
    - [16, 324.25]
  - - [8192, 1024, 1, 2048, 8192, 8192, 8192, 1024]
    - [14, 392.84]
  - - [8192, 1024, 1, 4096, 8192, 8192, 8192, 1024]
    - [60, 409.02]
  - - [8192, 1024, 1, 8192, 8192, 8192, 8192, 1024]
    - [61, 396.6]
  - - [8192, 2048, 1, 128, 8192, 8192, 8192, 2048]
    - [4, 115.1]
  - - [8192, 2048, 1, 256, 8192, 8192, 8192, 2048]
    - [5, 187.82]
  - - [8192, 2048, 1, 512, 8192, 8192, 8192, 2048]
    - [5, 311.79]
  - - [8192, 2048, 1, 1024, 8192, 8192, 8192, 2048]
    - [2, 447.52]
  - - [8192, 2048, 1, 2048, 8192, 8192, 8192, 2048]
    - [3, 538.95]
  - - [8192, 2048, 1, 4096, 8192, 8192, 8192, 2048]
    - [6, 561.08]
  - - [8192, 2048, 1, 8192, 8192, 8192, 8192, 2048]
    - [6, 552.22]
  - - [8192, 4096, 1, 128, 8192, 8192, 8192, 4096]
    - [1, 134.86]
  - - [8192, 4096, 1, 256, 8192, 8192, 8192, 4096]
    - [2, 227.47]
  - - [8192, 4096, 1, 512, 8192, 8192, 8192, 4096]
    - [8, 354.37]
  - - [8192, 4096, 1, 1024, 8192, 8192, 8192, 4096]
    - [2, 460.76]
  - - [8192, 4096, 1, 2048, 8192, 8192, 8192, 4096]
    - [9, 509.78]
  - - [8192, 4096, 1, 4096, 8192, 8192, 8192, 4096]
    - [3, 543.84]
  - - [8192, 4096, 1, 8192, 8192, 8192, 8192, 4096]
    - [3, 597.42]
  - - [8192, 8192, 1, 128, 8192, 8192, 8192, 8192]
    - [4, 140.09]
  - - [8192, 8192, 1, 256, 8192, 8192, 8192, 8192]
    - [1, 234.76]
  - - [8192, 8192, 1, 512, 8192, 8192, 8192, 8192]
    - [8, 332.54]
  - - [8192, 8192, 1, 1024, 8192, 8192, 8192, 8192]
    - [3, 418.02]
  - - [8192, 8192, 1, 2048, 8192, 8192, 8192, 8192]
    - [6, 494.17]
  - - [8192, 8192, 1, 4096, 8192, 8192, 8192, 8192]
    - [6, 568.32]
  - - [8192, 8192, 1, 8192, 8192, 8192, 8192, 8192]
    - [3, 648.57]
  - - [1, 1, 1, 32, 1, 1, 1, 1]
    - [74, 0.0]
- null
- null
- DeviceEfficiency
- GridBased
