projects/hipblaslt/library/src/amd_detail/rocblaslt/src/Tensile/Logic/asm_full/gfx950/GridBased/gfx950_Cijk_Alik_Bljk_B8F8SS_BH_Bias_HAS_SAB_SAV_UserArgs.yaml
- {MinimumRequiredVersion: 4.33.0}
- gfx950
- gfx950
- [Device 75a0]
    SolutionIndex: 0
    SolutionNameMin: Cijk_Alik_Bljk_F8SS_BH_Bias_HAS_SAB_SAV_UserArgs_MT256x256x64_MI32x32x1_SN_GSU0_GSUC0_GSUWGMRR0_K1_LBSPPA256_LBSPPB256_MIWT4_4_SU0_SUM0_SUS0_VWA4_VWB4_WGM8_WGMXCC1_WGMXCCGn1
    SolutionIndex: 1
    SolutionNameMin: Cijk_Alik_Bljk_F8SS_BH_Bias_HAS_SAB_SAV_UserArgs_MT256x256x64_MI32x32x1_SN_GSU0_GSUC0_GSUWGMRR0_K1_LBSPPA256_LBSPPB256_MIWT4_4_SU0_SUM0_SUS0_VWA4_VWB4_WGM8_WGMXCC1_WGMXCCGn1
    SolutionIndex: 2
    SolutionNameMin: Cijk_Alik_Bljk_F8SS_BH_Bias_HAS_SAB_SAV_UserArgs_MT128x256x64_MI32x32x1_SN_GSU0_GSUC0_GSUWGMRR0_K1_LBSPPA128_LBSPPB256_MIWT2_4_SU0_SUM0_SUS0_VWA2_VWB4_WGM8_WGMXCC1_WGMXCCGn1
    SolutionIndex: 3
    SolutionNameMin: Cijk_Alik_Bljk_F8SS_BH_Bias_HAS_SAB_SAV_UserArgs_MT256x128x64_MI32x32x1_SN_GSU0_GSUC0_GSUWGMRR0_K1_LBSPPA256_LBSPPB128_MIWT4_2_SU0_SUM0_SUS0_VWA4_VWB2_WGM8_WGMXCC1_WGMXCCGn1
    SolutionIndex: 4
    SolutionNameMin: Cijk_Alik_Bljk_F8SS_BH_Bias_HAS_SAB_SAV_UserArgs_MT256x128x64_MI32x32x1_SN_GSU0_GSUC0_GSUWGMRR0_K1_LBSPPA256_LBSPPB128_MIWT4_2_SU0_SUM0_SUS0_VWA4_VWB2_WGM8_WGMXCC1_WGMXCCGn1
    SolutionIndex: 5
    SolutionNameMin: Cijk_Alik_Bljk_F8SS_BH_Bias_HAS_SAB_SAV_UserArgs_MT256x128x64_MI32x32x1_SN_GSU0_GSUC0_GSUWGMRR0_K1_LBSPPA256_LBSPPB128_MIWT4_2_SU0_SUM0_SUS0_VWA4_VWB2_WGM8_WGMXCC1_WGMXCCGn1
    SolutionIndex: 6
    SolutionNameMin: Cijk_Alik_Bljk_F8SS_BH_Bias_HAS_SAB_SAV_UserArgs_MT256x128x64_MI32x32x1_SN_GSU0_GSUC0_GSUWGMRR0_K1_LBSPPA256_LBSPPB128_MIWT4_2_SU0_SUM0_SUS0_VWA4_VWB2_WGM8_WGMXCC1_WGMXCCGn1
    SolutionIndex: 7
    SolutionNameMin: Cijk_Alik_Bljk_F8SS_BH_Bias_HAS_SAB_SAV_UserArgs_MT256x128x64_MI32x32x1_SN_GSU0_GSUC0_GSUWGMRR0_K1_LBSPPA256_LBSPPB128_MIWT4_2_SU0_SUM0_SUS0_VWA4_VWB2_WGM8_WGMXCC1_WGMXCCGn1
    SolutionIndex: 8
    SolutionNameMin: Cijk_Alik_Bljk_F8SS_BH_Bias_HAS_SAB_SAV_UserArgs_MT128x128x64_MI32x32x1_SN_GSU0_GSUC0_GSUWGMRR0_K1_LBSPPA128_LBSPPB128_MIWT2_2_SU0_SUM0_SUS0_VWA2_VWB2_WGM8_WGMXCC1_WGMXCCGn1
    SolutionIndex: 9
    SolutionNameMin: Cijk_Alik_Bljk_F8SS_BH_Bias_HAS_SAB_SAV_UserArgs_MT128x64x64_MI32x32x1_SN_GSU0_GSUC0_GSUWGMRR0_K1_LBSPPA128_LBSPPB128_MIWT2_1_SU0_SUM0_SUS0_VWA2_VWB1_WGM8_WGMXCC1_WGMXCCGn1
    SolutionIndex: 10
    SolutionNameMin: Cijk_Alik_Bljk_F8SS_BH_Bias_HAS_SAB_SAV_UserArgs_MT64x64x64_MI32x32x1_SN_GSU0_GSUC0_GSUWGMRR0_K1_LBSPPA128_LBSPPB128_MIWT1_1_SU0_SUM0_SUS0_VWA1_VWB1_WGM8_WGMXCC1_WGMXCCGn1
    SolutionIndex: 11
    SolutionNameMin: Cijk_Alik_Bljk_F8SS_BH_Bias_HAS_SAB_SAV_UserArgs_MT64x64x64_MI32x32x1_SN_GSU0_GSUC0_GSUWGMRR0_K1_LBSPPA128_LBSPPB128_MIWT1_1_SU0_SUM0_SUS0_VWA1_VWB1_WGM8_WGMXCC1_WGMXCCGn1
    SolutionIndex: 12
    SolutionNameMin: Cijk_Alik_Bljk_F8SS_BH_Bias_HAS_SAB_SAV_UserArgs_MT64x64x64_MI32x32x1_SN_GSU0_GSUC0_GSUWGMRR0_K1_LBSPPA128_LBSPPB128_MIWT1_1_SU0_SUM0_SUS0_VWA1_VWB1_WGM8_WGMXCC1_WGMXCCGn1
    SolutionIndex: 13
    SolutionNameMin: Cijk_Alik_Bljk_F8SS_BH_Bias_HAS_SAB_SAV_UserArgs_MT256x256x128_MI16x16x1_SN_GSU0_GSUC0_GSUWGMRR0_K1_LBSPPA1024_LBSPPB1024_MIWT8_8_SU0_SUM0_SUS0_VWA8_VWB8_WGM8_WGMXCC1_WGMXCCGn1
    SolutionIndex: 14
    SolutionNameMin: Cijk_Alik_Bljk_F8SS_BH_Bias_HAS_SAB_SAV_UserArgs_MT128x256x128_MI16x16x1_SN_GSU0_GSUC0_GSUWGMRR0_K1_LBSPPA512_LBSPPB1024_MIWT4_8_SU0_SUM0_SUS0_VWA4_VWB8_WGM8_WGMXCC1_WGMXCCGn1
    SolutionIndex: 15
    SolutionNameMin: Cijk_Alik_Bljk_F8SS_BH_Bias_HAS_SAB_SAV_UserArgs_MT128x256x128_MI16x16x1_SN_GSU0_GSUC0_GSUWGMRR0_K1_LBSPPA512_LBSPPB1024_MIWT4_8_SU0_SUM0_SUS0_VWA4_VWB8_WGM8_WGMXCC1_WGMXCCGn1
    SolutionIndex: 16
    SolutionNameMin: Cijk_Alik_Bljk_F8SS_BH_Bias_HAS_SAB_SAV_UserArgs_MT128x256x128_MI16x16x1_SN_GSU0_GSUC0_GSUWGMRR0_K1_LBSPPA512_LBSPPB1024_MIWT4_8_SU0_SUM0_SUS0_VWA4_VWB8_WGM8_WGMXCC1_WGMXCCGn1
    SolutionIndex: 17
    SolutionNameMin: Cijk_Alik_Bljk_F8SS_BH_Bias_HAS_SAB_SAV_UserArgs_MT128x256x128_MI16x16x1_SN_GSU0_GSUC0_GSUWGMRR0_K1_LBSPPA512_LBSPPB1024_MIWT4_8_SU0_SUM0_SUS0_VWA4_VWB8_WGM8_WGMXCC1_WGMXCCGn1
    SolutionIndex: 18
    SolutionNameMin: Cijk_Alik_Bljk_F8SS_BH_Bias_HAS_SAB_SAV_UserArgs_MT128x256x128_MI16x16x1_SN_GSU0_GSUC0_GSUWGMRR0_K1_LBSPPA512_LBSPPB1024_MIWT4_8_SU0_SUM0_SUS0_VWA4_VWB8_WGM8_WGMXCC1_WGMXCCGn1
    SolutionIndex: 19
    SolutionNameMin: Cijk_Alik_Bljk_F8SS_BH_Bias_HAS_SAB_SAV_UserArgs_MT128x256x128_MI16x16x1_SN_GSU0_GSUC0_GSUWGMRR0_K1_LBSPPA512_LBSPPB1024_MIWT4_8_SU0_SUM0_SUS0_VWA4_VWB8_WGM8_WGMXCC1_WGMXCCGn1
    SolutionIndex: 20
    SolutionNameMin: Cijk_Alik_Bljk_F8SS_BH_Bias_HAS_SAB_SAV_UserArgs_MT256x128x128_MI16x16x1_SN_GSU0_GSUC0_GSUWGMRR0_K1_LBSPPA1024_LBSPPB512_MIWT8_4_SU0_SUM0_SUS0_VWA8_VWB4_WGM8_WGMXCC1_WGMXCCGn1
    SolutionIndex: 21
    SolutionNameMin: Cijk_Alik_Bljk_F8SS_BH_Bias_HAS_SAB_SAV_UserArgs_MT256x128x128_MI16x16x1_SN_GSU0_GSUC0_GSUWGMRR0_K1_LBSPPA1024_LBSPPB512_MIWT8_4_SU0_SUM0_SUS0_VWA8_VWB4_WGM8_WGMXCC1_WGMXCCGn1
    SolutionIndex: 22
    SolutionNameMin: Cijk_Alik_Bljk_F8SS_BH_Bias_HAS_SAB_SAV_UserArgs_MT128x128x128_MI16x16x1_SN_GSU0_GSUC0_GSUWGMRR0_K1_LBSPPA512_LBSPPB512_MIWT4_4_SU0_SUM0_SUS0_VWA4_VWB4_WGM8_WGMXCC1_WGMXCCGn1
    SolutionIndex: 23
    SolutionNameMin: Cijk_Alik_Bljk_F8SS_BH_Bias_HAS_SAB_SAV_UserArgs_MT128x128x128_MI16x16x1_SN_GSU0_GSUC0_GSUWGMRR0_K1_LBSPPA512_LBSPPB512_MIWT4_4_SU0_SUM0_SUS0_VWA4_VWB4_WGM8_WGMXCC1_WGMXCCGn1
    SolutionIndex: 24
    SolutionNameMin: Cijk_Alik_Bljk_F8SS_BH_Bias_HAS_SAB_SAV_UserArgs_MT128x128x128_MI16x16x1_SN_GSU0_GSUC0_GSUWGMRR0_K1_LBSPPA512_LBSPPB512_MIWT4_4_SU0_SUM0_SUS0_VWA4_VWB4_WGM8_WGMXCC1_WGMXCCGn1
    SolutionIndex: 25
    SolutionNameMin: Cijk_Alik_Bljk_F8SS_BH_Bias_HAS_SAB_SAV_UserArgs_MT128x128x128_MI16x16x1_SN_GSU0_GSUC0_GSUWGMRR0_K1_LBSPPA512_LBSPPB512_MIWT4_4_SU0_SUM0_SUS0_VWA4_VWB4_WGM8_WGMXCC1_WGMXCCGn1
    SolutionIndex: 26
    SolutionNameMin: Cijk_Alik_Bljk_F8SS_BH_Bias_HAS_SAB_SAV_UserArgs_MT128x128x128_MI16x16x1_SN_GSU0_GSUC0_GSUWGMRR0_K1_LBSPPA512_LBSPPB512_MIWT4_4_SU0_SUM0_SUS0_VWA4_VWB4_WGM8_WGMXCC1_WGMXCCGn1
    SolutionIndex: 27
    SolutionNameMin: Cijk_Alik_Bljk_F8SS_BH_Bias_HAS_SAB_SAV_UserArgs_MT128x128x128_MI16x16x1_SN_GSU0_GSUC0_GSUWGMRR0_K1_LBSPPA512_LBSPPB512_MIWT4_4_SU0_SUM0_SUS0_VWA4_VWB4_WGM8_WGMXCC1_WGMXCCGn1
    SolutionIndex: 28
    SolutionNameMin: Cijk_Alik_Bljk_F8SS_BH_Bias_HAS_SAB_SAV_UserArgs_MT64x128x128_MI16x16x1_SN_GSU0_GSUC0_GSUWGMRR0_K1_LBSPPA256_LBSPPB512_MIWT2_4_SU0_SUM0_SUS0_VWA2_VWB4_WGM8_WGMXCC1_WGMXCCGn1
    SolutionIndex: 29
    SolutionNameMin: Cijk_Alik_Bljk_F8SS_BH_Bias_HAS_SAB_SAV_UserArgs_MT64x128x128_MI16x16x1_SN_GSU0_GSUC0_GSUWGMRR0_K1_LBSPPA256_LBSPPB512_MIWT2_4_SU0_SUM0_SUS0_VWA2_VWB4_WGM8_WGMXCC1_WGMXCCGn1
    SolutionIndex: 30
    SolutionNameMin: Cijk_Alik_Bljk_F8SS_BH_Bias_HAS_SAB_SAV_UserArgs_MT128x64x128_MI16x16x1_SN_GSU0_GSUC0_GSUWGMRR0_K1_LBSPPA512_LBSPPB256_MIWT4_2_SU0_SUM0_SUS0_VWA4_VWB2_WGM8_WGMXCC1_WGMXCCGn1
    SolutionIndex: 31
    SolutionNameMin: Cijk_Alik_Bljk_F8SS_BH_Bias_HAS_SAB_SAV_UserArgs_MT128x64x128_MI16x16x1_SN_GSU0_GSUC0_GSUWGMRR0_K1_LBSPPA512_LBSPPB256_MIWT4_2_SU0_SUM0_SUS0_VWA4_VWB2_WGM8_WGMXCC1_WGMXCCGn1
    SolutionIndex: 32
    SolutionNameMin: Cijk_Alik_Bljk_F8SS_BH_Bias_HAS_SAB_SAV_UserArgs_MT64x64x128_MI16x16x1_SN_GSU0_GSUC0_GSUWGMRR0_K1_LBSPPA256_LBSPPB256_MIWT2_2_SU0_SUM0_SUS0_VWA2_VWB2_WGM8_WGMXCC1_WGMXCCGn1
    SolutionIndex: 33
    SolutionNameMin: Cijk_Alik_Bljk_F8SS_BH_Bias_HAS_SAB_SAV_UserArgs_MT32x64x128_MI16x16x1_SN_GSU0_GSUC0_GSUWGMRR0_K1_LBSPPA128_LBSPPB256_MIWT1_2_SU0_SUM0_SUS0_VWA1_VWB2_WGM8_WGMXCC1_WGMXCCGn1
    SolutionIndex: 34
    SolutionNameMin: Cijk_Alik_Bljk_F8SS_BH_Bias_HAS_SAB_SAV_UserArgs_MT32x64x128_MI16x16x1_SN_GSU0_GSUC0_GSUWGMRR0_K1_LBSPPA128_LBSPPB256_MIWT1_2_SU0_SUM0_SUS0_VWA1_VWB2_WGM8_WGMXCC1_WGMXCCGn1
    SolutionIndex: 35
    SolutionNameMin: Cijk_Alik_Bljk_F8SS_BH_Bias_HAS_SAB_SAV_UserArgs_MT64x32x128_MI16x16x1_SN_GSU0_GSUC0_GSUWGMRR0_K1_LBSPPA256_LBSPPB128_MIWT2_1_SU0_SUM0_SUS0_VWA2_VWB1_WGM8_WGMXCC1_WGMXCCGn1
    SolutionIndex: 36
    SolutionNameMin: Cijk_Alik_Bljk_F8SS_BH_Bias_HAS_SAB_SAV_UserArgs_MT32x32x128_MI16x16x1_SN_GSU0_GSUC0_GSUWGMRR0_K1_LBSPPA128_LBSPPB128_MIWT1_1_SU0_SUM0_SUS0_VWA1_VWB1_WGM8_WGMXCC1_WGMXCCGn1
    SolutionIndex: 37
    SolutionNameMin: Cijk_Alik_Bljk_F8SS_BH_Bias_HAS_SAB_SAV_UserArgs_MT32x32x128_MI16x16x1_SN_GSU0_GSUC0_GSUWGMRR0_K1_LBSPPA128_LBSPPB128_MIWT1_1_SU0_SUM0_SUS0_VWA1_VWB1_WGM8_WGMXCC1_WGMXCCGn1
    SolutionIndex: 38
    SolutionNameMin: Cijk_Alik_Bljk_F8SS_BH_Bias_HAS_SAB_SAV_UserArgs_MT32x32x128_MI16x16x1_SN_GSU0_GSUC0_GSUWGMRR0_K1_LBSPPA128_LBSPPB128_MIWT1_1_SU0_SUM0_SUS0_VWA1_VWB1_WGM8_WGMXCC1_WGMXCCGn1
    SolutionIndex: 39
    SolutionNameMin: Cijk_Alik_Bljk_F8SS_BH_Bias_HAS_SAB_SAV_UserArgs_MT32x32x128_MI16x16x1_SN_GSU0_GSUC0_GSUWGMRR0_K1_LBSPPA128_LBSPPB128_MIWT1_1_SU0_SUM0_SUS0_VWA1_VWB1_WGM8_WGMXCC1_WGMXCCGn1
    SolutionIndex: 40
    SolutionNameMin: Cijk_Alik_Bljk_F8SS_BH_Bias_HAS_SAB_SAV_UserArgs_MT32x32x128_MI16x16x1_SN_GSU0_GSUC0_GSUWGMRR0_K1_LBSPPA128_LBSPPB128_MIWT1_1_SU0_SUM0_SUS0_VWA1_VWB1_WGM8_WGMXCC1_WGMXCCGn1
    SolutionIndex: 41
    SolutionNameMin: Cijk_Alik_Bljk_F8SS_BH_Bias_HAS_SAB_SAV_UserArgs_MT32x32x128_MI16x16x1_SN_GSU0_GSUC0_GSUWGMRR0_K1_LBSPPA128_LBSPPB128_MIWT1_1_SU0_SUM0_SUS0_VWA1_VWB1_WGM8_WGMXCC1_WGMXCCGn1
    SolutionIndex: 42
    SolutionNameMin: Cijk_Alik_Bljk_F8SS_BH_Bias_HAS_SAB_SAV_UserArgs_MT256x256x128_MI32x32x1_SN_GSU0_GSUC0_GSUWGMRR0_K1_LBSPPA512_LBSPPB512_MIWT4_4_SU0_SUM0_SUS0_VWA4_VWB4_WGM8_WGMXCC1_WGMXCCGn1
    SolutionIndex: 43
    SolutionNameMin: Cijk_Alik_Bljk_F8SS_BH_Bias_HAS_SAB_SAV_UserArgs_MT256x256x128_MI32x32x1_SN_GSU0_GSUC0_GSUWGMRR0_K1_LBSPPA512_LBSPPB512_MIWT4_4_SU0_SUM0_SUS0_VWA4_VWB4_WGM8_WGMXCC1_WGMXCCGn1
    SolutionIndex: 44
    SolutionNameMin: Cijk_Alik_Bljk_F8SS_BH_Bias_HAS_SAB_SAV_UserArgs_MT256x256x128_MI32x32x1_SN_GSU0_GSUC0_GSUWGMRR0_K1_LBSPPA512_LBSPPB512_MIWT4_4_SU0_SUM0_SUS0_VWA4_VWB4_WGM8_WGMXCC1_WGMXCCGn1
    SolutionIndex: 45
    SolutionNameMin: Cijk_Alik_Bljk_F8SS_BH_Bias_HAS_SAB_SAV_UserArgs_MT256x256x128_MI32x32x1_SN_GSU0_GSUC0_GSUWGMRR0_K1_LBSPPA512_LBSPPB512_MIWT4_4_SU0_SUM0_SUS0_VWA4_VWB4_WGM8_WGMXCC1_WGMXCCGn1
    SolutionIndex: 46
    SolutionNameMin: Cijk_Alik_Bljk_F8SS_BH_Bias_HAS_SAB_SAV_UserArgs_MT128x256x128_MI32x32x1_SN_GSU0_GSUC0_GSUWGMRR0_K1_LBSPPA256_LBSPPB512_MIWT2_4_SU0_SUM0_SUS0_VWA2_VWB4_WGM8_WGMXCC1_WGMXCCGn1
    SolutionIndex: 47
    SolutionNameMin: Cijk_Alik_Bljk_F8SS_BH_Bias_HAS_SAB_SAV_UserArgs_MT256x128x128_MI32x32x1_SN_GSU0_GSUC0_GSUWGMRR0_K1_LBSPPA512_LBSPPB256_MIWT4_2_SU0_SUM0_SUS0_VWA4_VWB2_WGM8_WGMXCC1_WGMXCCGn1
    SolutionIndex: 48
    SolutionNameMin: Cijk_Alik_Bljk_F8SS_BH_Bias_HAS_SAB_SAV_UserArgs_MT256x128x128_MI32x32x1_SN_GSU0_GSUC0_GSUWGMRR0_K1_LBSPPA512_LBSPPB256_MIWT4_2_SU0_SUM0_SUS0_VWA4_VWB2_WGM8_WGMXCC1_WGMXCCGn1
    SolutionIndex: 49
    SolutionNameMin: Cijk_Alik_Bljk_F8SS_BH_Bias_HAS_SAB_SAV_UserArgs_MT128x128x128_MI32x32x1_SN_GSU0_GSUC0_GSUWGMRR0_K1_LBSPPA256_LBSPPB256_MIWT2_2_SU0_SUM0_SUS0_VWA2_VWB2_WGM8_WGMXCC1_WGMXCCGn1
    SolutionIndex: 50
    SolutionNameMin: Cijk_Alik_Bljk_F8SS_BH_Bias_HAS_SAB_SAV_UserArgs_MT128x128x128_MI32x32x1_SN_GSU0_GSUC0_GSUWGMRR0_K1_LBSPPA256_LBSPPB256_MIWT2_2_SU0_SUM0_SUS0_VWA2_VWB2_WGM8_WGMXCC1_WGMXCCGn1
    SolutionIndex: 51
    SolutionNameMin: Cijk_Alik_Bljk_F8SS_BH_Bias_HAS_SAB_SAV_UserArgs_MT128x128x128_MI32x32x1_SN_GSU0_GSUC0_GSUWGMRR0_K1_LBSPPA256_LBSPPB256_MIWT2_2_SU0_SUM0_SUS0_VWA2_VWB2_WGM8_WGMXCC1_WGMXCCGn1
    SolutionIndex: 52
    SolutionNameMin: Cijk_Alik_Bljk_F8SS_BH_Bias_HAS_SAB_SAV_UserArgs_MT128x128x128_MI32x32x1_SN_GSU0_GSUC0_GSUWGMRR0_K1_LBSPPA256_LBSPPB256_MIWT2_2_SU0_SUM0_SUS0_VWA2_VWB2_WGM8_WGMXCC1_WGMXCCGn1
    SolutionIndex: 53
    SolutionNameMin: Cijk_Alik_Bljk_F8SS_BH_Bias_HAS_SAB_SAV_UserArgs_MT128x64x128_MI32x32x1_SN_GSU0_GSUC0_GSUWGMRR0_K1_LBSPPA256_LBSPPB128_MIWT2_1_SU0_SUM0_SUS0_VWA2_VWB1_WGM8_WGMXCC1_WGMXCCGn1
    SolutionIndex: 54
    SolutionNameMin: Cijk_Alik_Bljk_F8SS_BH_Bias_HAS_SAB_SAV_UserArgs_MT64x64x128_MI32x32x1_SN_GSU0_GSUC0_GSUWGMRR0_K1_LBSPPA128_LBSPPB128_MIWT1_1_SU0_SUM0_SUS0_VWA1_VWB1_WGM8_WGMXCC1_WGMXCCGn1
    SolutionIndex: 55
    SolutionNameMin: Cijk_Alik_Bljk_F8SS_BH_Bias_HAS_SAB_SAV_UserArgs_MT128x128x256_MI16x16x1_SN_GSU0_GSUC0_GSUWGMRR0_K1_LBSPPA1024_LBSPPB1024_MIWT4_4_SU0_SUM0_SUS0_VWA4_VWB4_WGM8_WGMXCC1_WGMXCCGn1
    SolutionIndex: 56
    SolutionNameMin: Cijk_Alik_Bljk_F8SS_BH_Bias_HAS_SAB_SAV_UserArgs_MT64x128x256_MI16x16x1_SN_GSU0_GSUC0_GSUWGMRR0_K1_LBSPPA512_LBSPPB1024_MIWT2_4_SU0_SUM0_SUS0_VWA2_VWB4_WGM8_WGMXCC1_WGMXCCGn1
    SolutionIndex: 57
    SolutionNameMin: Cijk_Alik_Bljk_F8SS_BH_Bias_HAS_SAB_SAV_UserArgs_MT64x128x256_MI16x16x1_SN_GSU0_GSUC0_GSUWGMRR0_K1_LBSPPA512_LBSPPB1024_MIWT2_4_SU0_SUM0_SUS0_VWA2_VWB4_WGM8_WGMXCC1_WGMXCCGn1
    SolutionIndex: 58
    SolutionNameMin: Cijk_Alik_Bljk_F8SS_BH_Bias_HAS_SAB_SAV_UserArgs_MT64x128x256_MI16x16x1_SN_GSU0_GSUC0_GSUWGMRR0_K1_LBSPPA512_LBSPPB1024_MIWT2_4_SU0_SUM0_SUS0_VWA2_VWB4_WGM8_WGMXCC1_WGMXCCGn1
    SolutionIndex: 59
    SolutionNameMin: Cijk_Alik_Bljk_F8SS_BH_Bias_HAS_SAB_SAV_UserArgs_MT128x64x256_MI16x16x1_SN_GSU0_GSUC0_GSUWGMRR0_K1_LBSPPA1024_LBSPPB512_MIWT4_2_SU0_SUM0_SUS0_VWA4_VWB2_WGM8_WGMXCC1_WGMXCCGn1
    SolutionIndex: 60
    SolutionNameMin: Cijk_Alik_Bljk_F8SS_BH_Bias_HAS_SAB_SAV_UserArgs_MT128x64x256_MI16x16x1_SN_GSU0_GSUC0_GSUWGMRR0_K1_LBSPPA1024_LBSPPB512_MIWT4_2_SU0_SUM0_SUS0_VWA4_VWB2_WGM8_WGMXCC1_WGMXCCGn1
    SolutionIndex: 61
    SolutionNameMin: Cijk_Alik_Bljk_F8SS_BH_Bias_HAS_SAB_SAV_UserArgs_MT128x64x256_MI16x16x1_SN_GSU0_GSUC0_GSUWGMRR0_K1_LBSPPA1024_LBSPPB512_MIWT4_2_SU0_SUM0_SUS0_VWA4_VWB2_WGM8_WGMXCC1_WGMXCCGn1
    SolutionIndex: 62
    SolutionNameMin: Cijk_Alik_Bljk_F8SS_BH_Bias_HAS_SAB_SAV_UserArgs_MT128x64x256_MI16x16x1_SN_GSU0_GSUC0_GSUWGMRR0_K1_LBSPPA1024_LBSPPB512_MIWT4_2_SU0_SUM0_SUS0_VWA4_VWB2_WGM8_WGMXCC1_WGMXCCGn1
    SolutionIndex: 63
    SolutionNameMin: Cijk_Alik_Bljk_F8SS_BH_Bias_HAS_SAB_SAV_UserArgs_MT64x64x256_MI16x16x1_SN_GSU0_GSUC0_GSUWGMRR0_K1_LBSPPA512_LBSPPB512_MIWT2_2_SU0_SUM0_SUS0_VWA2_VWB2_WGM8_WGMXCC1_WGMXCCGn1
    SolutionIndex: 64
    SolutionNameMin: Cijk_Alik_Bljk_F8SS_BH_Bias_HAS_SAB_SAV_UserArgs_MT64x64x256_MI16x16x1_SN_GSU0_GSUC0_GSUWGMRR0_K1_LBSPPA512_LBSPPB512_MIWT2_2_SU0_SUM0_SUS0_VWA2_VWB2_WGM8_WGMXCC1_WGMXCCGn1
    SolutionIndex: 65
    SolutionNameMin: Cijk_Alik_Bljk_F8SS_BH_Bias_HAS_SAB_SAV_UserArgs_MT64x64x256_MI16x16x1_SN_GSU0_GSUC0_GSUWGMRR0_K1_LBSPPA512_LBSPPB512_MIWT2_2_SU0_SUM0_SUS0_VWA2_VWB2_WGM8_WGMXCC1_WGMXCCGn1
    SolutionIndex: 66
    SolutionNameMin: Cijk_Alik_Bljk_F8SS_BH_Bias_HAS_SAB_SAV_UserArgs_MT32x64x256_MI16x16x1_SN_GSU0_GSUC0_GSUWGMRR0_K1_LBSPPA256_LBSPPB512_MIWT1_2_SU0_SUM0_SUS0_VWA1_VWB2_WGM8_WGMXCC1_WGMXCCGn1
    SolutionIndex: 67
    SolutionNameMin: Cijk_Alik_Bljk_F8SS_BH_Bias_HAS_SAB_SAV_UserArgs_MT32x64x256_MI16x16x1_SN_GSU0_GSUC0_GSUWGMRR0_K1_LBSPPA256_LBSPPB512_MIWT1_2_SU0_SUM0_SUS0_VWA1_VWB2_WGM8_WGMXCC1_WGMXCCGn1
    SolutionIndex: 68
    SolutionNameMin: Cijk_Alik_Bljk_F8SS_BH_Bias_HAS_SAB_SAV_UserArgs_MT32x64x256_MI16x16x1_SN_GSU0_GSUC0_GSUWGMRR0_K1_LBSPPA256_LBSPPB512_MIWT1_2_SU0_SUM0_SUS0_VWA1_VWB2_WGM8_WGMXCC1_WGMXCCGn1
    SolutionIndex: 69
    SolutionNameMin: Cijk_Alik_Bljk_F8SS_BH_Bias_HAS_SAB_SAV_UserArgs_MT32x64x256_MI16x16x1_SN_GSU0_GSUC0_GSUWGMRR0_K1_LBSPPA256_LBSPPB512_MIWT1_2_SU0_SUM0_SUS0_VWA1_VWB2_WGM8_WGMXCC1_WGMXCCGn1
    SolutionIndex: 70
    SolutionNameMin: Cijk_Alik_Bljk_F8SS_BH_Bias_HAS_SAB_SAV_UserArgs_MT64x32x256_MI16x16x1_SN_GSU0_GSUC0_GSUWGMRR0_K1_LBSPPA512_LBSPPB256_MIWT2_1_SU0_SUM0_SUS0_VWA2_VWB1_WGM8_WGMXCC1_WGMXCCGn1
    SolutionIndex: 71
    SolutionNameMin: Cijk_Alik_Bljk_F8SS_BH_Bias_HAS_SAB_SAV_UserArgs_MT64x32x256_MI16x16x1_SN_GSU0_GSUC0_GSUWGMRR0_K1_LBSPPA512_LBSPPB256_MIWT2_1_SU0_SUM0_SUS0_VWA2_VWB1_WGM8_WGMXCC1_WGMXCCGn1
    SolutionIndex: 72
    SolutionNameMin: Cijk_Alik_Bljk_F8SS_BH_Bias_HAS_SAB_SAV_UserArgs_MT32x32x256_MI16x16x1_SN_GSU0_GSUC0_GSUWGMRR0_K1_LBSPPA256_LBSPPB256_MIWT1_1_SU0_SUM0_SUS0_VWA1_VWB1_WGM8_WGMXCC1_WGMXCCGn1
    SolutionIndex: 73
    SolutionNameMin: Cijk_Alik_Bljk_F8SS_BH_Bias_HAS_SAB_SAV_UserArgs_MT32x32x256_MI16x16x1_SN_GSU0_GSUC0_GSUWGMRR0_K1_LBSPPA256_LBSPPB256_MIWT1_1_SU0_SUM0_SUS0_VWA1_VWB1_WGM8_WGMXCC1_WGMXCCGn1
    SolutionIndex: 74
    SolutionNameMin: Cijk_Alik_Bljk_F8SS_BH_Bias_HAS_SAB_SAV_UserArgs_MT32x32x256_MI16x16x1_SN_GSU0_GSUC0_GSUWGMRR0_K1_LBSPPA256_LBSPPB256_MIWT1_1_SU0_SUM0_SUS0_VWA1_VWB1_WGM8_WGMXCC1_WGMXCCGn1
    SolutionIndex: 75
    SolutionNameMin: Cijk_Alik_Bljk_F8SS_BH_Bias_HAS_SAB_SAV_UserArgs_MT32x32x256_MI16x16x1_SN_GSU0_GSUC0_GSUWGMRR0_K1_LBSPPA256_LBSPPB256_MIWT1_1_SU0_SUM0_SUS0_VWA1_VWB1_WGM8_WGMXCC1_WGMXCCGn1
    SolutionIndex: 76
    SolutionNameMin: Cijk_Alik_Bljk_F8SS_BH_Bias_HAS_SAB_SAV_UserArgs_MT64x128x256_MI32x32x1_SN_GSU0_GSUC0_GSUWGMRR0_K1_LBSPPA256_LBSPPB512_MIWT1_2_SU0_SUM0_SUS0_VWA1_VWB2_WGM8_WGMXCC1_WGMXCCGn1
    SolutionIndex: 77
    SolutionNameMin: Cijk_Alik_Bljk_F8SS_BH_Bias_HAS_SAB_SAV_UserArgs_MT64x128x256_MI32x32x1_SN_GSU0_GSUC0_GSUWGMRR0_K1_LBSPPA256_LBSPPB512_MIWT1_2_SU0_SUM0_SUS0_VWA1_VWB2_WGM8_WGMXCC1_WGMXCCGn1
    SolutionIndex: 78
    SolutionNameMin: Cijk_Alik_Bljk_F8SS_BH_Bias_HAS_SAB_SAV_UserArgs_MT128x64x256_MI32x32x1_SN_GSU0_GSUC0_GSUWGMRR0_K1_LBSPPA512_LBSPPB256_MIWT2_1_SU0_SUM0_SUS0_VWA2_VWB1_WGM8_WGMXCC1_WGMXCCGn1
    SolutionIndex: 79
    SolutionNameMin: Cijk_Alik_Bljk_F8SS_BH_Bias_HAS_SAB_SAV_UserArgs_MT64x64x256_MI32x32x1_SN_GSU0_GSUC0_GSUWGMRR0_K1_LBSPPA256_LBSPPB256_MIWT1_1_SU0_SUM0_SUS0_VWA1_VWB1_WGM8_WGMXCC1_WGMXCCGn1
    SolutionIndex: 80
    SolutionNameMin: Cijk_Alik_Bljk_F8SS_BH_Bias_HAS_SAB_SAV_UserArgs_MT64x64x256_MI32x32x1_SN_GSU0_GSUC0_GSUWGMRR0_K1_LBSPPA256_LBSPPB256_MIWT1_1_SU0_SUM0_SUS0_VWA1_VWB1_WGM8_WGMXCC1_WGMXCCGn1
    SolutionIndex: 81
    SolutionNameMin: Cijk_Alik_Bljk_F8SS_BH_Bias_HAS_SAB_SAV_UserArgs_MT64x64x256_MI32x32x1_SN_GSU0_GSUC0_GSUWGMRR0_K1_LBSPPA256_LBSPPB256_MIWT1_1_SU0_SUM0_SUS0_VWA1_VWB1_WGM8_WGMXCC1_WGMXCCGn1
    SolutionIndex: 82
    SolutionNameMin: Cijk_Alik_Bljk_F8SS_BH_Bias_HAS_SAB_SAV_UserArgs_MT32x32x128_MI16x16x1_SN_GSU0_GSUC0_GSUWGMRR0_K1_LBSPPA128_LBSPPB128_MIWT1_1_SU32_SUM0_SUS256_VWA1_VWB1_WGM8_WGMXCC1_WGMXCCGn1
- - - [128, 128, 1, 128, 128, 128, 128, 128]
    - [41, 0.45]
  - - [128, 128, 1, 256, 128, 128, 256, 256]
    - [74, 0.85]
  - - [128, 128, 1, 512, 128, 128, 512, 512]
    - [75, 1.53]
  - - [128, 128, 1, 1024, 128, 128, 1024, 1024]
    - [75, 2.64]
  - - [128, 128, 1, 2048, 128, 128, 2048, 2048]
    - [74, 4.08]
  - - [128, 128, 1, 4096, 128, 128, 4096, 4096]
    - [72, 5.73]
  - - [128, 128, 1, 8192, 128, 128, 8192, 8192]
    - [72, 7.12]
  - - [128, 256, 1, 128, 128, 128, 128, 128]
    - [41, 0.9]
  - - [128, 256, 1, 256, 128, 128, 256, 256]
    - [75, 1.74]
  - - [128, 256, 1, 512, 128, 128, 512, 512]
    - [75, 3.08]
  - - [128, 256, 1, 1024, 128, 128, 1024, 1024]
    - [75, 5.27]
  - - [128, 256, 1, 2048, 128, 128, 2048, 2048]
    - [74, 8.19]
  - - [128, 256, 1, 4096, 128, 128, 4096, 4096]
    - [72, 11.32]
  - - [128, 256, 1, 8192, 128, 128, 8192, 8192]
    - [72, 14.28]
  - - [128, 512, 1, 128, 128, 128, 128, 128]
    - [39, 1.8]
  - - [128, 512, 1, 256, 128, 128, 256, 256]
    - [75, 3.43]
  - - [128, 512, 1, 512, 128, 128, 512, 512]
    - [73, 5.89]
  - - [128, 512, 1, 1024, 128, 128, 1024, 1024]
    - [75, 10.3]
  - - [128, 512, 1, 2048, 128, 128, 2048, 2048]
    - [75, 16.01]
  - - [128, 512, 1, 4096, 128, 128, 4096, 4096]
    - [73, 22.24]
  - - [128, 512, 1, 8192, 128, 128, 8192, 8192]
    - [72, 27.83]
  - - [128, 1024, 1, 128, 128, 128, 128, 128]
    - [39, 3.5]
  - - [128, 1024, 1, 256, 128, 128, 256, 256]
    - [75, 6.55]
  - - [128, 1024, 1, 512, 128, 128, 512, 512]
    - [74, 11.7]
  - - [128, 1024, 1, 1024, 128, 128, 1024, 1024]
    - [75, 19.92]
  - - [128, 1024, 1, 2048, 128, 128, 2048, 2048]
    - [73, 31.1]
  - - [128, 1024, 1, 4096, 128, 128, 4096, 4096]
    - [73, 43.13]
  - - [128, 1024, 1, 8192, 128, 128, 8192, 8192]
    - [72, 54.37]
  - - [128, 2048, 1, 128, 128, 128, 128, 128]
    - [38, 6.62]
  - - [128, 2048, 1, 256, 128, 128, 256, 256]
    - [74, 12.67]
  - - [128, 2048, 1, 512, 128, 128, 512, 512]
    - [75, 22.88]
  - - [128, 2048, 1, 1024, 128, 128, 1024, 1024]
    - [75, 38.08]
  - - [128, 2048, 1, 2048, 128, 128, 2048, 2048]
    - [73, 59.31]
  - - [128, 2048, 1, 4096, 128, 128, 4096, 4096]
    - [75, 82.31]
  - - [128, 2048, 1, 8192, 128, 128, 8192, 8192]
    - [75, 106.62]
  - - [128, 4096, 1, 128, 128, 128, 128, 128]
    - [34, 12.41]
  - - [128, 4096, 1, 256, 128, 128, 256, 256]
    - [69, 23.17]
  - - [128, 4096, 1, 512, 128, 128, 512, 512]
    - [71, 40.84]
  - - [128, 4096, 1, 1024, 128, 128, 1024, 1024]
    - [69, 69.44]
  - - [128, 4096, 1, 2048, 128, 128, 2048, 2048]
    - [66, 108.34]
  - - [128, 4096, 1, 4096, 128, 128, 4096, 4096]
    - [69, 154.68]
  - - [128, 4096, 1, 8192, 128, 128, 8192, 8192]
    - [70, 179.47]
  - - [128, 8192, 1, 128, 128, 128, 128, 128]
    - [12, 21.43]
  - - [128, 8192, 1, 256, 128, 128, 256, 256]
    - [81, 39.36]
  - - [128, 8192, 1, 512, 128, 128, 512, 512]
    - [65, 69.66]
  - - [128, 8192, 1, 1024, 128, 128, 1024, 1024]
    - [65, 119.62]
  - - [128, 8192, 1, 2048, 128, 128, 2048, 2048]
    - [79, 167.12]
  - - [128, 8192, 1, 4096, 128, 128, 4096, 4096]
    - [65, 219.88]
  - - [128, 8192, 1, 8192, 128, 128, 8192, 8192]
    - [64, 275.34]
  - - [256, 128, 1, 128, 256, 256, 128, 128]
    - [36, 0.89]
  - - [256, 128, 1, 256, 256, 256, 256, 256]
    - [74, 1.68]
  - - [256, 128, 1, 512, 256, 256, 512, 512]
    - [75, 3.05]
  - - [256, 128, 1, 1024, 256, 256, 1024, 1024]
    - [75, 5.19]
  - - [256, 128, 1, 2048, 256, 256, 2048, 2048]
    - [74, 8.08]
  - - [256, 128, 1, 4096, 256, 256, 4096, 4096]
    - [72, 11.19]
  - - [256, 128, 1, 8192, 256, 256, 8192, 8192]
    - [72, 14.04]
  - - [256, 256, 1, 128, 256, 256, 128, 128]
    - [41, 1.77]
  - - [256, 256, 1, 256, 256, 256, 256, 256]
    - [74, 3.31]
  - - [256, 256, 1, 512, 256, 256, 512, 512]
    - [75, 6.01]
  - - [256, 256, 1, 1024, 256, 256, 1024, 1024]
    - [75, 10.29]
  - - [256, 256, 1, 2048, 256, 256, 2048, 2048]
    - [75, 15.9]
  - - [256, 256, 1, 4096, 256, 256, 4096, 4096]
    - [75, 22.19]
  - - [256, 256, 1, 8192, 256, 256, 8192, 8192]
    - [72, 27.9]
  - - [256, 512, 1, 128, 256, 256, 128, 128]
    - [41, 3.45]
  - - [256, 512, 1, 256, 256, 256, 256, 256]
    - [75, 6.69]
  - - [256, 512, 1, 512, 256, 256, 512, 512]
    - [75, 11.8]
  - - [256, 512, 1, 1024, 256, 256, 1024, 1024]
    - [75, 20.33]
  - - [256, 512, 1, 2048, 256, 256, 2048, 2048]
    - [74, 31.65]
  - - [256, 512, 1, 4096, 256, 256, 4096, 4096]
    - [72, 44.55]
  - - [256, 512, 1, 8192, 256, 256, 8192, 8192]
    - [72, 55.71]
  - - [256, 1024, 1, 128, 256, 256, 128, 128]
    - [39, 6.8]
  - - [256, 1024, 1, 256, 256, 256, 256, 256]
    - [75, 12.82]
  - - [256, 1024, 1, 512, 256, 256, 512, 512]
    - [75, 23.22]
  - - [256, 1024, 1, 1024, 256, 256, 1024, 1024]
    - [75, 39.27]
  - - [256, 1024, 1, 2048, 256, 256, 2048, 2048]
    - [73, 61.09]
  - - [256, 1024, 1, 4096, 256, 256, 4096, 4096]
    - [73, 85.71]
  - - [256, 1024, 1, 8192, 256, 256, 8192, 8192]
    - [73, 108.9]
  - - [256, 2048, 1, 128, 256, 256, 128, 128]
    - [34, 12.59]
  - - [256, 2048, 1, 256, 256, 256, 256, 256]
    - [69, 23.1]
  - - [256, 2048, 1, 512, 256, 256, 512, 512]
    - [69, 40.94]
  - - [256, 2048, 1, 1024, 256, 256, 1024, 1024]
    - [69, 70.83]
  - - [256, 2048, 1, 2048, 256, 256, 2048, 2048]
    - [69, 109.53]
  - - [256, 2048, 1, 4096, 256, 256, 4096, 4096]
    - [70, 155.25]
  - - [256, 2048, 1, 8192, 256, 256, 8192, 8192]
    - [71, 200.16]
  - - [256, 4096, 1, 128, 256, 256, 128, 128]
    - [10, 21.5]
  - - [256, 4096, 1, 256, 256, 256, 256, 256]
    - [81, 39.79]
  - - [256, 4096, 1, 512, 256, 256, 512, 512]
    - [81, 70.39]
  - - [256, 4096, 1, 1024, 256, 256, 1024, 1024]
    - [81, 122.71]
  - - [256, 4096, 1, 2048, 256, 256, 2048, 2048]
    - [80, 182.79]
  - - [256, 4096, 1, 4096, 256, 256, 4096, 4096]
    - [63, 249.38]
  - - [256, 4096, 1, 8192, 256, 256, 8192, 8192]
    - [65, 314.08]
  - - [256, 8192, 1, 128, 256, 256, 128, 128]
    - [9, 33.61]
  - - [256, 8192, 1, 256, 256, 256, 256, 256]
    - [31, 61.68]
  - - [256, 8192, 1, 512, 256, 256, 512, 512]
    - [31, 109.83]
  - - [256, 8192, 1, 1024, 256, 256, 1024, 1024]
    - [30, 167.96]
  - - [256, 8192, 1, 2048, 256, 256, 2048, 2048]
    - [53, 244.09]
  - - [256, 8192, 1, 4096, 256, 256, 4096, 4096]
    - [53, 311.75]
  - - [256, 8192, 1, 8192, 256, 256, 8192, 8192]
    - [62, 398.63]
  - - [512, 128, 1, 128, 512, 512, 128, 128]
    - [41, 1.75]
  - - [512, 128, 1, 256, 512, 512, 256, 256]
    - [75, 3.4]
  - - [512, 128, 1, 512, 512, 512, 512, 512]
    - [75, 5.98]
  - - [512, 128, 1, 1024, 512, 512, 1024, 1024]
    - [75, 10.24]
  - - [512, 128, 1, 2048, 512, 512, 2048, 2048]
    - [72, 15.82]
  - - [512, 128, 1, 4096, 512, 512, 4096, 4096]
    - [72, 21.84]
  - - [512, 128, 1, 8192, 512, 512, 8192, 8192]
    - [72, 27.55]
  - - [512, 256, 1, 128, 512, 512, 128, 128]
    - [37, 3.43]
  - - [512, 256, 1, 256, 512, 512, 256, 256]
    - [75, 6.64]
  - - [512, 256, 1, 512, 512, 512, 512, 512]
    - [75, 11.91]
  - - [512, 256, 1, 1024, 512, 512, 1024, 1024]
    - [75, 20.01]
  - - [512, 256, 1, 2048, 512, 512, 2048, 2048]
    - [72, 31.23]
  - - [512, 256, 1, 4096, 512, 512, 4096, 4096]
    - [75, 43.68]
  - - [512, 256, 1, 8192, 512, 512, 8192, 8192]
    - [72, 54.94]
  - - [512, 512, 1, 128, 512, 512, 128, 128]
    - [40, 6.86]
  - - [512, 512, 1, 256, 512, 512, 256, 256]
    - [75, 12.87]
  - - [512, 512, 1, 512, 512, 512, 512, 512]
    - [73, 22.97]
  - - [512, 512, 1, 1024, 512, 512, 1024, 1024]
    - [75, 39.51]
  - - [512, 512, 1, 2048, 512, 512, 2048, 2048]
    - [75, 62.85]
  - - [512, 512, 1, 4096, 512, 512, 4096, 4096]
    - [73, 86.59]
  - - [512, 512, 1, 8192, 512, 512, 8192, 8192]
    - [73, 110.12]
  - - [512, 1024, 1, 128, 512, 512, 128, 128]
    - [33, 12.57]
  - - [512, 1024, 1, 256, 512, 512, 256, 256]
    - [68, 23.33]
  - - [512, 1024, 1, 512, 512, 512, 512, 512]
    - [71, 41.24]
  - - [512, 1024, 1, 1024, 512, 512, 1024, 1024]
    - [69, 71.47]
  - - [512, 1024, 1, 2048, 512, 512, 2048, 2048]
    - [69, 113.39]
  - - [512, 1024, 1, 4096, 512, 512, 4096, 4096]
    - [69, 158.66]
  - - [512, 1024, 1, 8192, 512, 512, 8192, 8192]
    - [71, 202.74]
  - - [512, 2048, 1, 128, 512, 512, 128, 128]
    - [54, 21.45]
  - - [512, 2048, 1, 256, 512, 512, 256, 256]
    - [65, 39.41]
  - - [512, 2048, 1, 512, 512, 512, 512, 512]
    - [81, 70.01]
  - - [512, 2048, 1, 1024, 512, 512, 1024, 1024]
    - [81, 122.36]
  - - [512, 2048, 1, 2048, 512, 512, 2048, 2048]
    - [80, 180.47]
  - - [512, 2048, 1, 4096, 512, 512, 4096, 4096]
    - [63, 253.8]
  - - [512, 2048, 1, 8192, 512, 512, 8192, 8192]
    - [65, 314.25]
  - - [512, 4096, 1, 128, 512, 512, 128, 128]
    - [29, 33.79]
  - - [512, 4096, 1, 256, 512, 512, 256, 256]
    - [31, 61.97]
  - - [512, 4096, 1, 512, 512, 512, 512, 512]
    - [53, 110.0]
  - - [512, 4096, 1, 1024, 512, 512, 1024, 1024]
    - [31, 177.11]
  - - [512, 4096, 1, 2048, 512, 512, 2048, 2048]
    - [56, 245.98]
  - - [512, 4096, 1, 4096, 512, 512, 4096, 4096]
    - [61, 326.81]
  - - [512, 4096, 1, 8192, 512, 512, 8192, 8192]
    - [58, 411.91]
  - - [512, 8192, 1, 128, 512, 512, 128, 128]
    - [27, 42.73]
  - - [512, 8192, 1, 256, 512, 512, 256, 256]
    - [27, 79.02]
  - - [512, 8192, 1, 512, 512, 512, 512, 512]
    - [25, 144.45]
  - - [512, 8192, 1, 1024, 512, 512, 1024, 1024]
    - [25, 222.33]
  - - [512, 8192, 1, 2048, 512, 512, 2048, 2048]
    - [27, 334.13]
  - - [512, 8192, 1, 4096, 512, 512, 4096, 4096]
    - [51, 439.93]
  - - [512, 8192, 1, 8192, 512, 512, 8192, 8192]
    - [52, 564.78]
  - - [1024, 128, 1, 128, 1024, 1024, 128, 128]
    - [36, 3.48]
  - - [1024, 128, 1, 256, 1024, 1024, 256, 256]
    - [75, 6.74]
  - - [1024, 128, 1, 512, 1024, 1024, 512, 512]
    - [73, 11.52]
  - - [1024, 128, 1, 1024, 1024, 1024, 1024, 1024]
    - [75, 20.02]
  - - [1024, 128, 1, 2048, 1024, 1024, 2048, 2048]
    - [74, 30.89]
  - - [1024, 128, 1, 4096, 1024, 1024, 4096, 4096]
    - [75, 43.18]
  - - [1024, 128, 1, 8192, 1024, 1024, 8192, 8192]
    - [72, 54.23]
  - - [1024, 256, 1, 128, 1024, 1024, 128, 128]
    - [39, 6.76]
  - - [1024, 256, 1, 256, 1024, 1024, 256, 256]
    - [75, 12.76]
  - - [1024, 256, 1, 512, 1024, 1024, 512, 512]
    - [75, 23.0]
  - - [1024, 256, 1, 1024, 1024, 1024, 1024, 1024]
    - [75, 38.67]
  - - [1024, 256, 1, 2048, 1024, 1024, 2048, 2048]
    - [74, 60.38]
  - - [1024, 256, 1, 4096, 1024, 1024, 4096, 4096]
    - [75, 84.5]
  - - [1024, 256, 1, 8192, 1024, 1024, 8192, 8192]
    - [72, 107.3]
  - - [1024, 512, 1, 128, 1024, 1024, 128, 128]
    - [35, 12.52]
  - - [1024, 512, 1, 256, 1024, 1024, 256, 256]
    - [69, 23.29]
  - - [1024, 512, 1, 512, 1024, 1024, 512, 512]
    - [71, 41.24]
  - - [1024, 512, 1, 1024, 1024, 1024, 1024, 1024]
    - [71, 71.52]
  - - [1024, 512, 1, 2048, 1024, 1024, 2048, 2048]
    - [71, 113.76]
  - - [1024, 512, 1, 4096, 1024, 1024, 4096, 4096]
    - [71, 158.78]
  - - [1024, 512, 1, 8192, 1024, 1024, 8192, 8192]
    - [71, 203.02]
  - - [1024, 1024, 1, 128, 1024, 1024, 128, 128]
    - [11, 21.56]
  - - [1024, 1024, 1, 256, 1024, 1024, 256, 256]
    - [65, 39.7]
  - - [1024, 1024, 1, 512, 1024, 1024, 512, 512]
    - [81, 70.58]
  - - [1024, 1024, 1, 1024, 1024, 1024, 1024, 1024]
    - [81, 122.77]
  - - [1024, 1024, 1, 2048, 1024, 1024, 2048, 2048]
    - [63, 185.73]
  - - [1024, 1024, 1, 4096, 1024, 1024, 4096, 4096]
    - [63, 259.78]
  - - [1024, 1024, 1, 8192, 1024, 1024, 8192, 8192]
    - [65, 326.74]
  - - [1024, 2048, 1, 128, 1024, 1024, 128, 128]
    - [31, 34.0]
  - - [1024, 2048, 1, 256, 1024, 1024, 256, 256]
    - [31, 61.81]
  - - [1024, 2048, 1, 512, 1024, 1024, 512, 512]
    - [31, 110.93]
  - - [1024, 2048, 1, 1024, 1024, 1024, 1024, 1024]
    - [31, 179.56]
  - - [1024, 2048, 1, 2048, 1024, 1024, 2048, 2048]
    - [61, 256.89]
  - - [1024, 2048, 1, 4096, 1024, 1024, 4096, 4096]
    - [31, 343.94]
  - - [1024, 2048, 1, 8192, 1024, 1024, 8192, 8192]
    - [57, 413.98]
  - - [1024, 4096, 1, 128, 1024, 1024, 128, 128]
    - [8, 42.6]
  - - [1024, 4096, 1, 256, 1024, 1024, 256, 256]
    - [27, 78.99]
  - - [1024, 4096, 1, 512, 1024, 1024, 512, 512]
    - [23, 140.68]
  - - [1024, 4096, 1, 1024, 1024, 1024, 1024, 1024]
    - [22, 225.26]
  - - [1024, 4096, 1, 2048, 1024, 1024, 2048, 2048]
    - [25, 338.1]
  - - [1024, 4096, 1, 4096, 1024, 1024, 4096, 4096]
    - [27, 460.55]
  - - [1024, 4096, 1, 8192, 1024, 1024, 8192, 8192]
    - [26, 566.78]
  - - [1024, 8192, 1, 128, 1024, 1024, 128, 128]
    - [7, 57.31]
  - - [1024, 8192, 1, 256, 1024, 1024, 256, 256]
    - [6, 97.53]
  - - [1024, 8192, 1, 512, 1024, 1024, 512, 512]
    - [4, 166.57]
  - - [1024, 8192, 1, 1024, 1024, 1024, 1024, 1024]
    - [15, 271.32]
  - - [1024, 8192, 1, 2048, 1024, 1024, 2048, 2048]
    - [21, 416.57]
  - - [1024, 8192, 1, 4096, 1024, 1024, 4096, 4096]
    - [17, 564.15]
  - - [1024, 8192, 1, 8192, 1024, 1024, 8192, 8192]
    - [48, 695.82]
  - - [2048, 128, 1, 128, 2048, 2048, 128, 128]
    - [39, 6.79]
  - - [2048, 128, 1, 256, 2048, 2048, 256, 256]
    - [73, 12.74]
  - - [2048, 128, 1, 512, 2048, 2048, 512, 512]
    - [75, 22.55]
  - - [2048, 128, 1, 1024, 2048, 2048, 1024, 1024]
    - [75, 38.27]
  - - [2048, 128, 1, 2048, 2048, 2048, 2048, 2048]
    - [74, 59.74]
  - - [2048, 128, 1, 4096, 2048, 2048, 4096, 4096]
    - [75, 82.86]
  - - [2048, 128, 1, 8192, 2048, 2048, 8192, 8192]
    - [72, 107.14]
  - - [2048, 256, 1, 128, 2048, 2048, 128, 128]
    - [34, 12.62]
  - - [2048, 256, 1, 256, 2048, 2048, 256, 256]
    - [71, 23.42]
  - - [2048, 256, 1, 512, 2048, 2048, 512, 512]
    - [69, 41.22]
  - - [2048, 256, 1, 1024, 2048, 2048, 1024, 1024]
    - [69, 70.87]
  - - [2048, 256, 1, 2048, 2048, 2048, 2048, 2048]
    - [69, 109.84]
  - - [2048, 256, 1, 4096, 2048, 2048, 4096, 4096]
    - [69, 156.01]
  - - [2048, 256, 1, 8192, 2048, 2048, 8192, 8192]
    - [69, 199.95]
  - - [2048, 512, 1, 128, 2048, 2048, 128, 128]
    - [32, 21.53]
  - - [2048, 512, 1, 256, 2048, 2048, 256, 256]
    - [81, 39.91]
  - - [2048, 512, 1, 512, 2048, 2048, 512, 512]
    - [81, 70.16]
  - - [2048, 512, 1, 1024, 2048, 2048, 1024, 1024]
    - [81, 121.85]
  - - [2048, 512, 1, 2048, 2048, 2048, 2048, 2048]
    - [65, 183.27]
  - - [2048, 512, 1, 4096, 2048, 2048, 4096, 4096]
    - [65, 256.91]
  - - [2048, 512, 1, 8192, 2048, 2048, 8192, 8192]
    - [65, 321.71]
  - - [2048, 1024, 1, 128, 2048, 2048, 128, 128]
    - [9, 33.96]
  - - [2048, 1024, 1, 256, 2048, 2048, 256, 256]
    - [78, 61.88]
  - - [2048, 1024, 1, 512, 2048, 2048, 512, 512]
    - [31, 110.71]
  - - [2048, 1024, 1, 1024, 2048, 2048, 1024, 1024]
    - [30, 176.28]
  - - [2048, 1024, 1, 2048, 2048, 2048, 2048, 2048]
    - [61, 255.94]
  - - [2048, 1024, 1, 4096, 2048, 2048, 4096, 4096]
    - [61, 339.59]
  - - [2048, 1024, 1, 8192, 2048, 2048, 8192, 8192]
    - [62, 414.17]
  - - [2048, 2048, 1, 128, 2048, 2048, 128, 128]
    - [27, 42.7]
  - - [2048, 2048, 1, 256, 2048, 2048, 256, 256]
    - [27, 78.74]
  - - [2048, 2048, 1, 512, 2048, 2048, 512, 512]
    - [23, 139.9]
  - - [2048, 2048, 1, 1024, 2048, 2048, 1024, 1024]
    - [24, 231.46]
  - - [2048, 2048, 1, 2048, 2048, 2048, 2048, 2048]
    - [25, 348.58]
  - - [2048, 2048, 1, 4096, 2048, 2048, 4096, 4096]
    - [26, 461.93]
  - - [2048, 2048, 1, 8192, 2048, 2048, 8192, 8192]
    - [55, 578.12]
  - - [2048, 4096, 1, 128, 2048, 2048, 128, 128]
    - [7, 54.02]
  - - [2048, 4096, 1, 256, 2048, 2048, 256, 256]
    - [19, 99.56]
  - - [2048, 4096, 1, 512, 2048, 2048, 512, 512]
    - [16, 165.77]
  - - [2048, 4096, 1, 1024, 2048, 2048, 1024, 1024]
    - [16, 272.35]
  - - [2048, 4096, 1, 2048, 2048, 2048, 2048, 2048]
    - [18, 424.23]
  - - [2048, 4096, 1, 4096, 2048, 2048, 4096, 4096]
    - [17, 552.21]
  - - [2048, 4096, 1, 8192, 2048, 2048, 8192, 8192]
    - [48, 706.45]
  - - [2048, 8192, 1, 128, 2048, 2048, 128, 128]
    - [1, 60.28]
  - - [2048, 8192, 1, 256, 2048, 2048, 256, 256]
    - [19, 109.75]
  - - [2048, 8192, 1, 512, 2048, 2048, 512, 512]
    - [16, 182.36]
  - - [2048, 8192, 1, 1024, 2048, 2048, 1024, 1024]
    - [14, 297.39]
  - - [2048, 8192, 1, 2048, 2048, 2048, 2048, 2048]
    - [43, 499.61]
  - - [2048, 8192, 1, 4096, 2048, 2048, 4096, 4096]
    - [44, 708.61]
  - - [2048, 8192, 1, 8192, 2048, 2048, 8192, 8192]
    - [45, 842.58]
  - - [4096, 128, 1, 128, 4096, 4096, 128, 128]
    - [34, 12.38]
  - - [4096, 128, 1, 256, 4096, 4096, 256, 256]
    - [69, 23.1]
  - - [4096, 128, 1, 512, 4096, 4096, 512, 512]
    - [69, 40.38]
  - - [4096, 128, 1, 1024, 4096, 4096, 1024, 1024]
    - [69, 69.36]
  - - [4096, 128, 1, 2048, 4096, 4096, 2048, 2048]
    - [69, 109.55]
  - - [4096, 128, 1, 4096, 4096, 4096, 4096, 4096]
    - [67, 155.19]
  - - [4096, 128, 1, 8192, 4096, 4096, 8192, 8192]
    - [67, 179.24]
  - - [4096, 256, 1, 128, 4096, 4096, 128, 128]
    - [54, 21.47]
  - - [4096, 256, 1, 256, 4096, 4096, 256, 256]
    - [81, 39.75]
  - - [4096, 256, 1, 512, 4096, 4096, 512, 512]
    - [81, 70.19]
  - - [4096, 256, 1, 1024, 4096, 4096, 1024, 1024]
    - [81, 122.13]
  - - [4096, 256, 1, 2048, 4096, 4096, 2048, 2048]
    - [64, 181.67]
  - - [4096, 256, 1, 4096, 4096, 4096, 4096, 4096]
    - [65, 248.01]
  - - [4096, 256, 1, 8192, 4096, 4096, 8192, 8192]
    - [81, 309.86]
  - - [4096, 512, 1, 128, 4096, 4096, 128, 128]
    - [29, 33.49]
  - - [4096, 512, 1, 256, 4096, 4096, 256, 256]
    - [77, 61.42]
  - - [4096, 512, 1, 512, 4096, 4096, 512, 512]
    - [28, 109.07]
  - - [4096, 512, 1, 1024, 4096, 4096, 1024, 1024]
    - [60, 177.04]
  - - [4096, 512, 1, 2048, 4096, 4096, 2048, 2048]
    - [76, 244.61]
  - - [4096, 512, 1, 4096, 4096, 4096, 4096, 4096]
    - [60, 327.05]
  - - [4096, 512, 1, 8192, 4096, 4096, 8192, 8192]
    - [57, 410.51]
  - - [4096, 1024, 1, 128, 4096, 4096, 128, 128]
    - [51, 42.22]
  - - [4096, 1024, 1, 256, 4096, 4096, 256, 256]
    - [27, 77.64]
  - - [4096, 1024, 1, 512, 4096, 4096, 512, 512]
    - [23, 137.73]
  - - [4096, 1024, 1, 1024, 4096, 4096, 1024, 1024]
    - [25, 228.44]
  - - [4096, 1024, 1, 2048, 4096, 4096, 2048, 2048]
    - [24, 338.03]
  - - [4096, 1024, 1, 4096, 4096, 4096, 4096, 4096]
    - [27, 463.89]
  - - [4096, 1024, 1, 8192, 4096, 4096, 8192, 8192]
    - [27, 572.46]
  - - [4096, 2048, 1, 128, 4096, 4096, 128, 128]
    - [46, 54.32]
  - - [4096, 2048, 1, 256, 4096, 4096, 256, 256]
    - [2, 96.86]
  - - [4096, 2048, 1, 512, 4096, 4096, 512, 512]
    - [16, 164.55]
  - - [4096, 2048, 1, 1024, 4096, 4096, 1024, 1024]
    - [14, 265.46]
  - - [4096, 2048, 1, 2048, 4096, 4096, 2048, 2048]
    - [20, 417.82]
  - - [4096, 2048, 1, 4096, 4096, 4096, 4096, 4096]
    - [47, 549.6]
  - - [4096, 2048, 1, 8192, 4096, 4096, 8192, 8192]
    - [48, 735.92]
  - - [4096, 4096, 1, 128, 4096, 4096, 128, 128]
    - [1, 61.57]
  - - [4096, 4096, 1, 256, 4096, 4096, 256, 256]
    - [19, 108.23]
  - - [4096, 4096, 1, 512, 4096, 4096, 512, 512]
    - [6, 182.97]
  - - [4096, 4096, 1, 1024, 4096, 4096, 1024, 1024]
    - [19, 306.48]
  - - [4096, 4096, 1, 2048, 4096, 4096, 2048, 2048]
    - [42, 501.9]
  - - [4096, 4096, 1, 4096, 4096, 4096, 4096, 4096]
    - [45, 737.5]
  - - [4096, 4096, 1, 8192, 4096, 4096, 8192, 8192]
    - [45, 822.29]
  - - [4096, 8192, 1, 128, 4096, 4096, 128, 128]
    - [7, 68.16]
  - - [4096, 8192, 1, 256, 4096, 4096, 256, 256]
    - [55, 119.99]
  - - [4096, 8192, 1, 512, 4096, 4096, 512, 512]
    - [1, 211.76]
  - - [4096, 8192, 1, 1024, 4096, 4096, 1024, 1024]
    - [44, 356.2]
  - - [4096, 8192, 1, 2048, 4096, 4096, 2048, 2048]
    - [45, 542.25]
  - - [4096, 8192, 1, 4096, 4096, 4096, 4096, 4096]
    - [45, 699.96]
  - - [4096, 8192, 1, 8192, 4096, 4096, 8192, 8192]
    - [45, 824.92]
  - - [8192, 128, 1, 128, 8192, 8192, 128, 128]
    - [54, 21.46]
  - - [8192, 128, 1, 256, 8192, 8192, 256, 256]
    - [81, 39.48]
  - - [8192, 128, 1, 512, 8192, 8192, 512, 512]
    - [81, 70.06]
  - - [8192, 128, 1, 1024, 8192, 8192, 1024, 1024]
    - [65, 120.02]
  - - [8192, 128, 1, 2048, 8192, 8192, 2048, 2048]
    - [79, 163.19]
  - - [8192, 128, 1, 4096, 8192, 8192, 4096, 4096]
    - [65, 210.97]
  - - [8192, 128, 1, 8192, 8192, 8192, 8192, 8192]
    - [81, 274.09]
  - - [8192, 256, 1, 128, 8192, 8192, 128, 128]
    - [31, 33.71]
  - - [8192, 256, 1, 256, 8192, 8192, 256, 256]
    - [31, 61.44]
  - - [8192, 256, 1, 512, 8192, 8192, 512, 512]
    - [31, 109.1]
  - - [8192, 256, 1, 1024, 8192, 8192, 1024, 1024]
    - [59, 167.31]
  - - [8192, 256, 1, 2048, 8192, 8192, 2048, 2048]
    - [29, 243.95]
  - - [8192, 256, 1, 4096, 8192, 8192, 4096, 4096]
    - [60, 317.38]
  - - [8192, 256, 1, 8192, 8192, 8192, 8192, 8192]
    - [78, 384.75]
  - - [8192, 512, 1, 128, 8192, 8192, 128, 128]
    - [8, 42.44]
  - - [8192, 512, 1, 256, 8192, 8192, 256, 256]
    - [8, 78.25]
  - - [8192, 512, 1, 512, 8192, 8192, 512, 512]
    - [25, 140.51]
  - - [8192, 512, 1, 1024, 8192, 8192, 1024, 1024]
    - [49, 218.81]
  - - [8192, 512, 1, 2048, 8192, 8192, 2048, 2048]
    - [25, 343.71]
  - - [8192, 512, 1, 4096, 8192, 8192, 4096, 4096]
    - [25, 454.7]
  - - [8192, 512, 1, 8192, 8192, 8192, 8192, 8192]
    - [50, 550.03]
  - - [8192, 1024, 1, 128, 8192, 8192, 128, 128]
    - [48, 54.93]
  - - [8192, 1024, 1, 256, 8192, 8192, 256, 256]
    - [19, 99.29]
  - - [8192, 1024, 1, 512, 8192, 8192, 512, 512]
    - [16, 165.41]
  - - [8192, 1024, 1, 1024, 8192, 8192, 1024, 1024]
    - [14, 273.17]
  - - [8192, 1024, 1, 2048, 8192, 8192, 2048, 2048]
    - [18, 407.62]
  - - [8192, 1024, 1, 4096, 8192, 8192, 4096, 4096]
    - [46, 548.09]
  - - [8192, 1024, 1, 8192, 8192, 8192, 8192, 8192]
    - [48, 697.31]
  - - [8192, 2048, 1, 128, 8192, 8192, 128, 128]
    - [7, 63.91]
  - - [8192, 2048, 1, 256, 8192, 8192, 256, 256]
    - [4, 109.74]
  - - [8192, 2048, 1, 512, 8192, 8192, 512, 512]
    - [4, 184.53]
  - - [8192, 2048, 1, 1024, 8192, 8192, 1024, 1024]
    - [13, 309.82]
  - - [8192, 2048, 1, 2048, 8192, 8192, 2048, 2048]
    - [1, 487.35]
  - - [8192, 2048, 1, 4096, 8192, 8192, 4096, 4096]
    - [45, 707.13]
  - - [8192, 2048, 1, 8192, 8192, 8192, 8192, 8192]
    - [45, 814.68]
  - - [8192, 4096, 1, 128, 8192, 8192, 128, 128]
    - [3, 68.74]
  - - [8192, 4096, 1, 256, 8192, 8192, 256, 256]
    - [3, 123.27]
  - - [8192, 4096, 1, 512, 8192, 8192, 512, 512]
    - [48, 207.46]
  - - [8192, 4096, 1, 1024, 8192, 8192, 1024, 1024]
    - [1, 352.48]
  - - [8192, 4096, 1, 2048, 8192, 8192, 2048, 2048]
    - [42, 520.89]
  - - [8192, 4096, 1, 4096, 8192, 8192, 4096, 4096]
    - [45, 679.67]
  - - [8192, 4096, 1, 8192, 8192, 8192, 8192, 8192]
    - [45, 821.08]
  - - [8192, 8192, 1, 128, 8192, 8192, 128, 128]
    - [5, 71.06]
  - - [8192, 8192, 1, 256, 8192, 8192, 256, 256]
    - [45, 127.09]
  - - [8192, 8192, 1, 512, 8192, 8192, 512, 512]
    - [0, 224.89]
  - - [8192, 8192, 1, 1024, 8192, 8192, 1024, 1024]
    - [45, 368.7]
  - - [8192, 8192, 1, 2048, 8192, 8192, 2048, 2048]
    - [45, 544.01]
  - - [8192, 8192, 1, 4096, 8192, 8192, 4096, 4096]
    - [45, 699.09]
  - - [8192, 8192, 1, 8192, 8192, 8192, 8192, 8192]
    - [45, 890.45]
  - - [1, 1, 1, 32, 1, 1, 32, 32]
    - [82, 0.0]
- null
- null
- DeviceEfficiency
- GridBased
