projects/hipblaslt/library/src/amd_detail/rocblaslt/src/Tensile/Logic/asm_full/gfx950/GridBased/gfx950_Cijk_Alik_Bjlk_BBS_BH_Bias_HAS_SAV_UserArgs.yaml
- {MinimumRequiredVersion: 4.33.0}
- gfx950
- gfx950
- [Device 75a0]
    SolutionIndex: 0
    SolutionNameMin: Cijk_Alik_Bjlk_BBS_BH_Bias_AS_SAV_UserArgs_MT256x256x32_MI16x16x1_SN_LDSB0_CLR0_GSU0_GSUC0_GSUWGMRR0_K1_LBSPPA512_LBSPPB1024_LPB0_MIWT8_8_PLR0_SU0_SUM0_SUS0_VWA8_VWB8_WGM1_WGMXCC1_WGMXCCGn1
    SolutionIndex: 1
    SolutionNameMin: Cijk_Alik_Bjlk_BBS_BH_Bias_AS_SAV_UserArgs_MT256x256x32_MI16x16x1_SN_LDSB0_CLR0_GSU0_GSUC0_GSUWGMRR0_K1_LBSPPA512_LBSPPB1024_LPB0_MIWT8_8_PLR0_SU0_SUM0_SUS0_VWA8_VWB8_WGM6_WGMXCC1_WGMXCCGn1
    SolutionIndex: 2
    SolutionNameMin: Cijk_Alik_Bjlk_BBS_BH_Bias_AS_SAV_UserArgs_MT256x256x32_MI16x16x1_SN_LDSB0_CLR0_GSU0_GSUC0_GSUWGMRR0_K1_LBSPPA512_LBSPPB2048_LPB0_MIWT8_8_PLR0_SU0_SUM0_SUS0_VWA8_VWB8_WGM6_WGMXCC1_WGMXCCGn1
    SolutionIndex: 3
    SolutionNameMin: Cijk_Alik_Bjlk_BBS_BH_Bias_AS_SAV_UserArgs_MT256x256x32_MI16x16x1_SN_LDSB0_CLR0_GSU0_GSUC0_GSUWGMRR0_K1_LBSPPA512_LBSPPB4096_LPB0_MIWT8_8_PLR0_SU0_SUM0_SUS0_VWA8_VWB8_WGM6_WGMXCC1_WGMXCCGn1
    SolutionIndex: 4
    SolutionNameMin: Cijk_Alik_Bjlk_BBS_BH_Bias_AS_SAV_UserArgs_MT256x256x32_MI16x16x1_SN_LDSB0_CLR0_GSU0_GSUC0_GSUWGMRR0_K1_LBSPPA512_LBSPPB1024_LPB0_MIWT8_8_PLR0_SU0_SUM0_SUS0_VWA8_VWB8_WGM8_WGMXCC1_WGMXCCGn1
    SolutionIndex: 5
    SolutionNameMin: Cijk_Alik_Bjlk_BBS_BH_Bias_AS_SAV_UserArgs_MT256x256x32_MI16x16x1_SN_LDSB0_CLR0_GSU0_GSUC0_GSUWGMRR0_K1_LBSPPA512_LBSPPB1024_LPB0_MIWT8_8_PLR0_SU0_SUM0_SUS0_VWA8_VWB8_WGM8_WGMXCC1_WGMXCCGn1
    SolutionIndex: 6
    SolutionNameMin: Cijk_Alik_Bjlk_BBS_BH_Bias_AS_SAV_UserArgs_MT256x256x32_MI16x16x1_SN_LDSB0_CLR0_GSU0_GSUC0_GSUWGMRR0_K1_LBSPPA512_LBSPPB2048_LPB0_MIWT8_8_PLR0_SU0_SUM0_SUS0_VWA8_VWB8_WGM8_WGMXCC1_WGMXCCGn1
    SolutionIndex: 7
    SolutionNameMin: Cijk_Alik_Bjlk_BBS_BH_Bias_AS_SAV_UserArgs_MT256x256x32_MI16x16x1_SN_LDSB0_CLR0_GSU0_GSUC0_GSUWGMRR0_K1_LBSPPA512_LBSPPB2048_LPB0_MIWT8_8_PLR0_SU0_SUM0_SUS0_VWA8_VWB8_WGM8_WGMXCC1_WGMXCCGn1
    SolutionIndex: 8
    SolutionNameMin: Cijk_Alik_Bjlk_BBS_BH_Bias_AS_SAV_UserArgs_MT256x256x32_MI16x16x1_SN_LDSB0_CLR0_GSU0_GSUC0_GSUWGMRR0_K1_LBSPPA512_LBSPPB4096_LPB0_MIWT8_8_PLR0_SU0_SUM0_SUS0_VWA8_VWB8_WGM8_WGMXCC1_WGMXCCGn1
    SolutionIndex: 9
    SolutionNameMin: Cijk_Alik_Bjlk_BBS_BH_Bias_AS_SAV_UserArgs_MT128x256x32_MI16x16x1_SN_LDSB1_CLR0_GSU0_GSUC0_GSUWGMRR0_K1_LBSPPA256_LBSPPB1024_LPB0_MIWT4_8_PLR0_SU0_SUM0_SUS0_VWA4_VWB8_WGM1_WGMXCC1_WGMXCCGn1
    SolutionIndex: 10
    SolutionNameMin: Cijk_Alik_Bjlk_BBS_BH_Bias_AS_SAV_UserArgs_MT128x256x32_MI16x16x1_SN_LDSB1_CLR0_GSU0_GSUC0_GSUWGMRR0_K1_LBSPPA256_LBSPPB4096_LPB0_MIWT4_8_PLR0_SU0_SUM0_SUS0_VWA4_VWB8_WGM1_WGMXCC1_WGMXCCGn1
    SolutionIndex: 11
    SolutionNameMin: Cijk_Alik_Bjlk_BBS_BH_Bias_AS_SAV_UserArgs_MT128x256x32_MI16x16x1_SN_LDSB1_CLR0_GSU0_GSUC0_GSUWGMRR0_K1_LBSPPA256_LBSPPB2048_LPB0_MIWT4_8_PLR0_SU0_SUM0_SUS0_VWA4_VWB8_WGM6_WGMXCC1_WGMXCCGn1
    SolutionIndex: 12
    SolutionNameMin: Cijk_Alik_Bjlk_BBS_BH_Bias_AS_SAV_UserArgs_MT128x256x32_MI16x16x1_SN_LDSB1_CLR0_GSU0_GSUC0_GSUWGMRR0_K1_LBSPPA256_LBSPPB2048_LPB0_MIWT4_8_PLR0_SU0_SUM0_SUS0_VWA4_VWB8_WGM6_WGMXCC1_WGMXCCGn1
    SolutionIndex: 13
    SolutionNameMin: Cijk_Alik_Bjlk_BBS_BH_Bias_AS_SAV_UserArgs_MT128x256x32_MI16x16x1_SN_LDSB1_CLR0_GSU0_GSUC0_GSUWGMRR0_K1_LBSPPA256_LBSPPB4096_LPB0_MIWT4_8_PLR0_SU0_SUM0_SUS0_VWA4_VWB8_WGM6_WGMXCC1_WGMXCCGn1
    SolutionIndex: 14
    SolutionNameMin: Cijk_Alik_Bjlk_BBS_BH_Bias_AS_SAV_UserArgs_MT128x256x32_MI16x16x1_SN_LDSB1_CLR0_GSU0_GSUC0_GSUWGMRR0_K1_LBSPPA256_LBSPPB1024_LPB0_MIWT4_8_PLR0_SU0_SUM0_SUS0_VWA4_VWB8_WGM8_WGMXCC1_WGMXCCGn1
    SolutionIndex: 15
    SolutionNameMin: Cijk_Alik_Bjlk_BBS_BH_Bias_AS_SAV_UserArgs_MT128x256x32_MI16x16x1_SN_LDSB1_CLR0_GSU0_GSUC0_GSUWGMRR0_K1_LBSPPA256_LBSPPB2048_LPB0_MIWT4_8_PLR0_SU0_SUM0_SUS0_VWA4_VWB8_WGM8_WGMXCC1_WGMXCCGn1
    SolutionIndex: 16
    SolutionNameMin: Cijk_Alik_Bjlk_BBS_BH_Bias_AS_SAV_UserArgs_MT128x256x32_MI16x16x1_SN_LDSB1_CLR0_GSU0_GSUC0_GSUWGMRR0_K1_LBSPPA256_LBSPPB2048_LPB0_MIWT4_8_PLR0_SU0_SUM0_SUS0_VWA4_VWB8_WGM8_WGMXCC1_WGMXCCGn1
    SolutionIndex: 17
    SolutionNameMin: Cijk_Alik_Bjlk_BBS_BH_Bias_AS_SAV_UserArgs_MT256x128x32_MI16x16x1_SN_LDSB1_CLR0_GSU0_GSUC0_GSUWGMRR0_K1_LBSPPA512_LBSPPB512_LPB0_MIWT8_4_PLR0_SU0_SUM0_SUS0_VWA8_VWB4_WGM1_WGMXCC1_WGMXCCGn1
    SolutionIndex: 18
    SolutionNameMin: Cijk_Alik_Bjlk_BBS_BH_Bias_AS_SAV_UserArgs_MT256x128x32_MI16x16x1_SN_LDSB1_CLR0_GSU0_GSUC0_GSUWGMRR0_K1_LBSPPA512_LBSPPB512_LPB0_MIWT8_4_PLR0_SU0_SUM0_SUS0_VWA8_VWB4_WGM1_WGMXCC1_WGMXCCGn1
    SolutionIndex: 19
    SolutionNameMin: Cijk_Alik_Bjlk_BBS_BH_Bias_AS_SAV_UserArgs_MT256x128x32_MI16x16x1_SN_LDSB1_CLR0_GSU0_GSUC0_GSUWGMRR0_K1_LBSPPA512_LBSPPB512_LPB0_MIWT8_4_PLR0_SU0_SUM0_SUS0_VWA8_VWB4_WGM6_WGMXCC1_WGMXCCGn1
    SolutionIndex: 20
    SolutionNameMin: Cijk_Alik_Bjlk_BBS_BH_Bias_AS_SAV_UserArgs_MT256x128x32_MI16x16x1_SN_LDSB1_CLR0_GSU0_GSUC0_GSUWGMRR0_K1_LBSPPA512_LBSPPB512_LPB0_MIWT8_4_PLR0_SU0_SUM0_SUS0_VWA8_VWB4_WGM6_WGMXCC1_WGMXCCGn1
    SolutionIndex: 21
    SolutionNameMin: Cijk_Alik_Bjlk_BBS_BH_Bias_AS_SAV_UserArgs_MT256x128x32_MI16x16x1_SN_LDSB1_CLR0_GSU0_GSUC0_GSUWGMRR0_K1_LBSPPA512_LBSPPB1024_LPB0_MIWT8_4_PLR0_SU0_SUM0_SUS0_VWA8_VWB4_WGM6_WGMXCC1_WGMXCCGn1
    SolutionIndex: 22
    SolutionNameMin: Cijk_Alik_Bjlk_BBS_BH_Bias_AS_SAV_UserArgs_MT256x128x32_MI16x16x1_SN_LDSB1_CLR0_GSU0_GSUC0_GSUWGMRR0_K1_LBSPPA512_LBSPPB512_LPB0_MIWT8_4_PLR0_SU0_SUM0_SUS0_VWA8_VWB4_WGM8_WGMXCC1_WGMXCCGn1
    SolutionIndex: 23
    SolutionNameMin: Cijk_Alik_Bjlk_BBS_BH_Bias_AS_SAV_UserArgs_MT256x128x32_MI16x16x1_SN_LDSB1_CLR0_GSU0_GSUC0_GSUWGMRR0_K1_LBSPPA512_LBSPPB1024_LPB0_MIWT8_4_PLR0_SU0_SUM0_SUS0_VWA8_VWB4_WGM8_WGMXCC1_WGMXCCGn1
    SolutionIndex: 24
    SolutionNameMin: Cijk_Alik_Bjlk_BBS_BH_Bias_AS_SAV_UserArgs_MT64x128x32_MI16x16x1_SN_LDSB0_CLR0_GSU0_GSUC0_GSUWGMRR0_K1_LBSPPA128_LBSPPB2048_LPB0_MIWT2_4_PLR0_SU0_SUM0_SUS0_VWA2_VWB4_WGM1_WGMXCC1_WGMXCCGn1
    SolutionIndex: 25
    SolutionNameMin: Cijk_Alik_Bjlk_BBS_BH_Bias_AS_SAV_UserArgs_MT64x128x32_MI16x16x1_SN_LDSB0_CLR0_GSU0_GSUC0_GSUWGMRR0_K1_LBSPPA128_LBSPPB2048_LPB0_MIWT2_4_PLR0_SU0_SUM0_SUS0_VWA2_VWB4_WGM8_WGMXCC1_WGMXCCGn1
    SolutionIndex: 26
    SolutionNameMin: Cijk_Alik_Bjlk_BBS_BH_Bias_AS_SAV_UserArgs_MT64x64x32_MI16x16x1_SN_LDSB0_CLR0_GSU0_GSUC0_GSUWGMRR0_K1_LBSPPA128_LBSPPB1024_LPB32_MIWT2_2_PLR0_SU0_SUM0_SUS0_VWA2_VWB2_WGM1_WGMXCC1_WGMXCCGn1
    SolutionIndex: 27
    SolutionNameMin: Cijk_Alik_Bjlk_BBS_BH_Bias_AS_SAV_UserArgs_MT64x64x32_MI16x16x1_SN_LDSB0_CLR0_GSU0_GSUC0_GSUWGMRR0_K1_LBSPPA128_LBSPPB1024_LPB32_MIWT2_2_PLR0_SU0_SUM0_SUS0_VWA2_VWB2_WGM8_WGMXCC1_WGMXCCGn1
    SolutionIndex: 28
    SolutionNameMin: Cijk_Alik_Bjlk_BBS_BH_Bias_AS_SAV_UserArgs_MT32x64x32_MI16x16x1_SN_LDSB0_CLR0_GSU0_GSUC0_GSUWGMRR0_K1_LBSPPA128_LBSPPB512_LPB32_MIWT1_2_PLR0_SU0_SUM0_SUS0_VWA1_VWB2_WGM1_WGMXCC1_WGMXCCGn1
    SolutionIndex: 29
    SolutionNameMin: Cijk_Alik_Bjlk_BBS_BH_Bias_AS_SAV_UserArgs_MT32x32x32_MI16x16x1_SN_LDSB0_CLR0_GSU0_GSUC0_GSUWGMRR0_K1_LBSPPA128_LBSPPB128_LPB16_MIWT1_1_PLR0_SU0_SUM0_SUS0_VWA1_VWB1_WGM1_WGMXCC1_WGMXCCGn1
    SolutionIndex: 30
    SolutionNameMin: Cijk_Alik_Bjlk_BBS_BH_Bias_AS_SAV_UserArgs_MT32x32x32_MI16x16x1_SN_LDSB0_CLR0_GSU0_GSUC0_GSUWGMRR0_K1_LBSPPA128_LBSPPB256_LPB16_MIWT1_1_PLR0_SU0_SUM0_SUS0_VWA1_VWB1_WGM1_WGMXCC1_WGMXCCGn1
    SolutionIndex: 31
    SolutionNameMin: Cijk_Alik_Bjlk_BBS_BH_Bias_AS_SAV_UserArgs_MT32x32x32_MI16x16x1_SN_LDSB0_CLR0_GSU0_GSUC0_GSUWGMRR0_K1_LBSPPA128_LBSPPB512_LPB16_MIWT1_1_PLR0_SU0_SUM0_SUS0_VWA1_VWB1_WGM1_WGMXCC1_WGMXCCGn1
    SolutionIndex: 32
    SolutionNameMin: Cijk_Alik_Bjlk_BBS_BH_Bias_AS_SAV_UserArgs_MT256x256x32_MI32x32x1_SN_LDSB0_CLR1_GSU0_GSUC0_GSUWGMRR0_K1_LBSPPA256_LBSPPB0_LPB0_MIWT4_4_PLR1_SU0_SUM0_SUS0_VWA4_VWB4_WGM8_WGMXCC1_WGMXCCGn1
    SolutionIndex: 33
    SolutionNameMin: Cijk_Alik_Bjlk_BBS_BH_Bias_AS_SAV_UserArgs_MT64x128x32_MI32x32x1_SN_LDSB0_CLR1_GSU0_GSUC0_GSUWGMRR0_K1_LBSPPA128_LBSPPB0_LPB0_MIWT1_2_PLR1_SU0_SUM0_SUS0_VWA1_VWB2_WGM1_WGMXCC1_WGMXCCGn1
    SolutionIndex: 34
    SolutionNameMin: Cijk_Alik_Bjlk_BBS_BH_Bias_AS_SAV_UserArgs_MT256x256x64_MI16x16x1_SN_LDSB1_CLR1_GSU0_GSUC0_GSUWGMRR0_K1_LBSPPA1024_LBSPPB4096_LPB0_MIWT8_8_PLR1_SU0_SUM0_SUS0_VWA8_VWB8_WGM1_WGMXCC1_WGMXCCGn1
    SolutionIndex: 35
    SolutionNameMin: Cijk_Alik_Bjlk_BBS_BH_Bias_AS_SAV_UserArgs_MT256x256x64_MI16x16x1_SN_LDSB1_CLR1_GSU0_GSUC0_GSUWGMRR0_K1_LBSPPA1024_LBSPPB2048_LPB0_MIWT8_8_PLR1_SU0_SUM0_SUS0_VWA8_VWB8_WGM6_WGMXCC1_WGMXCCGn1
    SolutionIndex: 36
    SolutionNameMin: Cijk_Alik_Bjlk_BBS_BH_Bias_AS_SAV_UserArgs_MT256x256x64_MI16x16x1_SN_LDSB1_CLR1_GSU0_GSUC0_GSUWGMRR0_K1_LBSPPA1024_LBSPPB4096_LPB0_MIWT8_8_PLR1_SU0_SUM0_SUS0_VWA8_VWB8_WGM6_WGMXCC1_WGMXCCGn1
    SolutionIndex: 37
    SolutionNameMin: Cijk_Alik_Bjlk_BBS_BH_Bias_AS_SAV_UserArgs_MT256x256x64_MI16x16x1_SN_LDSB1_CLR1_GSU0_GSUC0_GSUWGMRR0_K1_LBSPPA1024_LBSPPB4096_LPB0_MIWT8_8_PLR1_SU0_SUM0_SUS0_VWA8_VWB8_WGM6_WGMXCC1_WGMXCCGn1
    SolutionIndex: 38
    SolutionNameMin: Cijk_Alik_Bjlk_BBS_BH_Bias_AS_SAV_UserArgs_MT256x256x64_MI16x16x1_SN_LDSB1_CLR1_GSU0_GSUC0_GSUWGMRR0_K1_LBSPPA1024_LBSPPB2048_LPB0_MIWT8_8_PLR1_SU0_SUM0_SUS0_VWA8_VWB8_WGM8_WGMXCC1_WGMXCCGn1
    SolutionIndex: 39
    SolutionNameMin: Cijk_Alik_Bjlk_BBS_BH_Bias_AS_SAV_UserArgs_MT256x256x64_MI16x16x1_SN_LDSB1_CLR1_GSU0_GSUC0_GSUWGMRR0_K1_LBSPPA1024_LBSPPB4096_LPB0_MIWT8_8_PLR1_SU0_SUM0_SUS0_VWA8_VWB8_WGM8_WGMXCC1_WGMXCCGn1
    SolutionIndex: 40
    SolutionNameMin: Cijk_Alik_Bjlk_BBS_BH_Bias_AS_SAV_UserArgs_MT128x256x64_MI16x16x1_SN_LDSB1_CLR1_GSU0_GSUC0_GSUWGMRR0_K1_LBSPPA512_LBSPPB1024_LPB0_MIWT4_8_PLR1_SU0_SUM0_SUS0_VWA4_VWB8_WGM1_WGMXCC1_WGMXCCGn1
    SolutionIndex: 41
    SolutionNameMin: Cijk_Alik_Bjlk_BBS_BH_Bias_AS_SAV_UserArgs_MT128x256x64_MI16x16x1_SN_LDSB1_CLR1_GSU0_GSUC0_GSUWGMRR0_K1_LBSPPA512_LBSPPB4096_LPB0_MIWT4_8_PLR1_SU0_SUM0_SUS0_VWA4_VWB8_WGM6_WGMXCC1_WGMXCCGn1
    SolutionIndex: 42
    SolutionNameMin: Cijk_Alik_Bjlk_BBS_BH_Bias_AS_SAV_UserArgs_MT128x256x64_MI16x16x1_SN_LDSB1_CLR1_GSU0_GSUC0_GSUWGMRR0_K1_LBSPPA512_LBSPPB4096_LPB0_MIWT4_8_PLR1_SU0_SUM0_SUS0_VWA4_VWB8_WGM8_WGMXCC1_WGMXCCGn1
    SolutionIndex: 43
    SolutionNameMin: Cijk_Alik_Bjlk_BBS_BH_Bias_AS_SAV_UserArgs_MT128x256x64_MI16x16x1_SN_LDSB1_CLR1_GSU0_GSUC0_GSUWGMRR0_K1_LBSPPA512_LBSPPB4096_LPB0_MIWT4_8_PLR1_SU0_SUM0_SUS0_VWA4_VWB8_WGM8_WGMXCC1_WGMXCCGn1
    SolutionIndex: 44
    SolutionNameMin: Cijk_Alik_Bjlk_BBS_BH_Bias_AS_SAV_UserArgs_MT128x128x64_MI16x16x1_SN_LDSB1_CLR1_GSU0_GSUC0_GSUWGMRR0_K1_LBSPPA512_LBSPPB512_LPB0_MIWT4_4_PLR1_SU0_SUM0_SUS0_VWA4_VWB4_WGM1_WGMXCC1_WGMXCCGn1
    SolutionIndex: 45
    SolutionNameMin: Cijk_Alik_Bjlk_BBS_BH_Bias_AS_SAV_UserArgs_MT128x128x64_MI16x16x1_SN_LDSB1_CLR1_GSU0_GSUC0_GSUWGMRR0_K1_LBSPPA512_LBSPPB2048_LPB0_MIWT4_4_PLR1_SU0_SUM0_SUS0_VWA4_VWB4_WGM1_WGMXCC1_WGMXCCGn1
    SolutionIndex: 46
    SolutionNameMin: Cijk_Alik_Bjlk_BBS_BH_Bias_AS_SAV_UserArgs_MT64x128x64_MI16x16x1_SN_LDSB1_CLR1_GSU0_GSUC0_GSUWGMRR0_K1_LBSPPA256_LBSPPB512_LPB0_MIWT2_4_PLR1_SU0_SUM0_SUS0_VWA2_VWB4_WGM6_WGMXCC1_WGMXCCGn1
    SolutionIndex: 47
    SolutionNameMin: Cijk_Alik_Bjlk_BBS_BH_Bias_AS_SAV_UserArgs_MT128x64x64_MI16x16x1_SN_LDSB1_CLR1_GSU0_GSUC0_GSUWGMRR0_K1_LBSPPA512_LBSPPB1024_LPB32_MIWT4_2_PLR1_SU0_SUM0_SUS0_VWA4_VWB2_WGM6_WGMXCC1_WGMXCCGn1
    SolutionIndex: 48
    SolutionNameMin: Cijk_Alik_Bjlk_BBS_BH_Bias_AS_SAV_UserArgs_MT128x64x64_MI16x16x1_SN_LDSB1_CLR1_GSU0_GSUC0_GSUWGMRR0_K1_LBSPPA512_LBSPPB256_LPB32_MIWT4_2_PLR1_SU0_SUM0_SUS0_VWA4_VWB2_WGM8_WGMXCC1_WGMXCCGn1
    SolutionIndex: 49
    SolutionNameMin: Cijk_Alik_Bjlk_BBS_BH_Bias_AS_SAV_UserArgs_MT128x64x64_MI16x16x1_SN_LDSB1_CLR1_GSU0_GSUC0_GSUWGMRR0_K1_LBSPPA512_LBSPPB512_LPB32_MIWT4_2_PLR1_SU0_SUM0_SUS0_VWA4_VWB2_WGM8_WGMXCC1_WGMXCCGn1
    SolutionIndex: 50
    SolutionNameMin: Cijk_Alik_Bjlk_BBS_BH_Bias_AS_SAV_UserArgs_MT64x64x64_MI16x16x1_SN_LDSB1_CLR1_GSU0_GSUC0_GSUWGMRR0_K1_LBSPPA256_LBSPPB256_LPB32_MIWT2_2_PLR1_SU0_SUM0_SUS0_VWA2_VWB2_WGM1_WGMXCC1_WGMXCCGn1
    SolutionIndex: 51
    SolutionNameMin: Cijk_Alik_Bjlk_BBS_BH_Bias_AS_SAV_UserArgs_MT64x64x64_MI16x16x1_SN_LDSB1_CLR1_GSU0_GSUC0_GSUWGMRR0_K1_LBSPPA256_LBSPPB1024_LPB32_MIWT2_2_PLR1_SU0_SUM0_SUS0_VWA2_VWB2_WGM1_WGMXCC1_WGMXCCGn1
    SolutionIndex: 52
    SolutionNameMin: Cijk_Alik_Bjlk_BBS_BH_Bias_AS_SAV_UserArgs_MT64x64x64_MI16x16x1_SN_LDSB1_CLR1_GSU0_GSUC0_GSUWGMRR0_K1_LBSPPA256_LBSPPB1024_LPB32_MIWT2_2_PLR1_SU0_SUM0_SUS0_VWA2_VWB2_WGM1_WGMXCC1_WGMXCCGn1
    SolutionIndex: 53
    SolutionNameMin: Cijk_Alik_Bjlk_BBS_BH_Bias_AS_SAV_UserArgs_MT32x32x64_MI16x16x1_SN_LDSB0_CLR1_GSU0_GSUC0_GSUWGMRR0_K1_LBSPPA128_LBSPPB256_LPB16_MIWT1_1_PLR1_SU0_SUM0_SUS0_VWA1_VWB1_WGM1_WGMXCC1_WGMXCCGn1
    SolutionIndex: 54
    SolutionNameMin: Cijk_Alik_Bjlk_BBS_BH_Bias_AS_SAV_UserArgs_MT32x32x64_MI16x16x1_SN_LDSB0_CLR1_GSU0_GSUC0_GSUWGMRR0_K1_LBSPPA128_LBSPPB512_LPB16_MIWT1_1_PLR1_SU0_SUM0_SUS0_VWA1_VWB1_WGM1_WGMXCC1_WGMXCCGn1
    SolutionIndex: 55
    SolutionNameMin: Cijk_Alik_Bjlk_BBS_BH_Bias_AS_SAV_UserArgs_MT256x256x64_MI32x32x1_SN_LDSB1_CLR1_GSU0_GSUC0_GSUWGMRR0_K1_LBSPPA512_LBSPPB0_LPB0_MIWT4_4_PLR1_SU0_SUM0_SUS0_VWA4_VWB4_WGM6_WGMXCC1_WGMXCCGn1
    SolutionIndex: 56
    SolutionNameMin: Cijk_Alik_Bjlk_BBS_BH_Bias_AS_SAV_UserArgs_MT256x256x64_MI32x32x1_SN_LDSB1_CLR1_GSU0_GSUC0_GSUWGMRR0_K1_LBSPPA512_LBSPPB0_LPB0_MIWT4_4_PLR1_SU0_SUM0_SUS0_VWA4_VWB4_WGM8_WGMXCC1_WGMXCCGn1
    SolutionIndex: 57
    SolutionNameMin: Cijk_Alik_Bjlk_BBS_BH_Bias_AS_SAV_UserArgs_MT256x256x64_MI32x32x1_SN_LDSB1_CLR1_GSU0_GSUC0_GSUWGMRR0_K1_LBSPPA512_LBSPPB0_LPB0_MIWT4_4_PLR1_SU0_SUM0_SUS0_VWA4_VWB4_WGM8_WGMXCC1_WGMXCCGn1
    SolutionIndex: 58
    SolutionNameMin: Cijk_Alik_Bjlk_BBS_BH_Bias_AS_SAV_UserArgs_MT256x256x64_MI32x32x1_SN_LDSB1_CLR1_GSU0_GSUC0_GSUWGMRR0_K1_LBSPPA512_LBSPPB0_LPB0_MIWT4_4_PLR1_SU0_SUM0_SUS0_VWA4_VWB4_WGM8_WGMXCC1_WGMXCCGn1
    SolutionIndex: 59
    SolutionNameMin: Cijk_Alik_Bjlk_BBS_BH_Bias_AS_SAV_UserArgs_MT256x256x64_MI32x32x1_SN_LDSB1_CLR1_GSU0_GSUC0_GSUWGMRR0_K1_LBSPPA512_LBSPPB0_LPB0_MIWT4_4_PLR1_SU0_SUM0_SUS0_VWA4_VWB4_WGM8_WGMXCC1_WGMXCCGn1
    SolutionIndex: 60
    SolutionNameMin: Cijk_Alik_Bjlk_BBS_BH_Bias_AS_SAV_UserArgs_MT128x256x64_MI32x32x1_SN_LDSB1_CLR1_GSU0_GSUC0_GSUWGMRR0_K1_LBSPPA256_LBSPPB0_LPB0_MIWT2_4_PLR1_SU0_SUM0_SUS0_VWA2_VWB4_WGM1_WGMXCC1_WGMXCCGn1
    SolutionIndex: 61
    SolutionNameMin: Cijk_Alik_Bjlk_BBS_BH_Bias_AS_SAV_UserArgs_MT128x256x64_MI32x32x1_SN_LDSB1_CLR1_GSU0_GSUC0_GSUWGMRR0_K1_LBSPPA256_LBSPPB0_LPB0_MIWT2_4_PLR1_SU0_SUM0_SUS0_VWA2_VWB4_WGM6_WGMXCC1_WGMXCCGn1
    SolutionIndex: 62
    SolutionNameMin: Cijk_Alik_Bjlk_BBS_BH_Bias_AS_SAV_UserArgs_MT128x256x64_MI32x32x1_SN_LDSB1_CLR1_GSU0_GSUC0_GSUWGMRR0_K1_LBSPPA256_LBSPPB0_LPB0_MIWT2_4_PLR1_SU0_SUM0_SUS0_VWA2_VWB4_WGM6_WGMXCC1_WGMXCCGn1
    SolutionIndex: 63
    SolutionNameMin: Cijk_Alik_Bjlk_BBS_BH_Bias_AS_SAV_UserArgs_MT128x256x64_MI32x32x1_SN_LDSB1_CLR1_GSU0_GSUC0_GSUWGMRR0_K1_LBSPPA256_LBSPPB0_LPB0_MIWT2_4_PLR1_SU0_SUM0_SUS0_VWA2_VWB4_WGM6_WGMXCC1_WGMXCCGn1
    SolutionIndex: 64
    SolutionNameMin: Cijk_Alik_Bjlk_BBS_BH_Bias_AS_SAV_UserArgs_MT128x256x64_MI32x32x1_SN_LDSB1_CLR1_GSU0_GSUC0_GSUWGMRR0_K1_LBSPPA256_LBSPPB0_LPB0_MIWT2_4_PLR1_SU0_SUM0_SUS0_VWA2_VWB4_WGM8_WGMXCC1_WGMXCCGn1
    SolutionIndex: 65
    SolutionNameMin: Cijk_Alik_Bjlk_BBS_BH_Bias_AS_SAV_UserArgs_MT256x128x64_MI32x32x1_SN_LDSB1_CLR1_GSU0_GSUC0_GSUWGMRR0_K1_LBSPPA512_LBSPPB0_LPB0_MIWT4_2_PLR1_SU0_SUM0_SUS0_VWA4_VWB2_WGM8_WGMXCC1_WGMXCCGn1
    SolutionIndex: 66
    SolutionNameMin: Cijk_Alik_Bjlk_BBS_BH_Bias_AS_SAV_UserArgs_MT128x128x64_MI32x32x1_SN_LDSB1_CLR1_GSU0_GSUC0_GSUWGMRR0_K1_LBSPPA256_LBSPPB0_LPB0_MIWT2_2_PLR1_SU0_SUM0_SUS0_VWA2_VWB2_WGM1_WGMXCC1_WGMXCCGn1
    SolutionIndex: 67
    SolutionNameMin: Cijk_Alik_Bjlk_BBS_BH_Bias_AS_SAV_UserArgs_MT128x128x64_MI32x32x1_SN_LDSB1_CLR1_GSU0_GSUC0_GSUWGMRR0_K1_LBSPPA256_LBSPPB0_LPB0_MIWT2_2_PLR1_SU0_SUM0_SUS0_VWA2_VWB2_WGM1_WGMXCC1_WGMXCCGn1
    SolutionIndex: 68
    SolutionNameMin: Cijk_Alik_Bjlk_BBS_BH_Bias_AS_SAV_UserArgs_MT128x64x64_MI32x32x1_SN_LDSB1_CLR1_GSU0_GSUC0_GSUWGMRR0_K1_LBSPPA256_LBSPPB0_LPB0_MIWT2_1_PLR1_SU0_SUM0_SUS0_VWA2_VWB1_WGM1_WGMXCC1_WGMXCCGn1
    SolutionIndex: 69
    SolutionNameMin: Cijk_Alik_Bjlk_BBS_BH_Bias_AS_SAV_UserArgs_MT128x64x64_MI32x32x1_SN_LDSB1_CLR1_GSU0_GSUC0_GSUWGMRR0_K1_LBSPPA256_LBSPPB0_LPB0_MIWT2_1_PLR1_SU0_SUM0_SUS0_VWA2_VWB1_WGM1_WGMXCC1_WGMXCCGn1
    SolutionIndex: 70
    SolutionNameMin: Cijk_Alik_Bjlk_BBS_BH_Bias_AS_SAV_UserArgs_MT128x128x128_MI16x16x1_SN_LDSB1_CLR1_GSU0_GSUC0_GSUWGMRR0_K1_LBSPPA1024_LBSPPB512_LPB0_MIWT4_4_PLR1_SU0_SUM0_SUS0_VWA4_VWB4_WGM1_WGMXCC1_WGMXCCGn1
    SolutionIndex: 71
    SolutionNameMin: Cijk_Alik_Bjlk_BBS_BH_Bias_AS_SAV_UserArgs_MT128x128x128_MI16x16x1_SN_LDSB1_CLR1_GSU0_GSUC0_GSUWGMRR0_K1_LBSPPA1024_LBSPPB2048_LPB0_MIWT4_4_PLR1_SU0_SUM0_SUS0_VWA4_VWB4_WGM1_WGMXCC1_WGMXCCGn1
    SolutionIndex: 72
    SolutionNameMin: Cijk_Alik_Bjlk_BBS_BH_Bias_AS_SAV_UserArgs_MT128x128x128_MI16x16x1_SN_LDSB1_CLR1_GSU0_GSUC0_GSUWGMRR0_K1_LBSPPA1024_LBSPPB512_LPB0_MIWT4_4_PLR1_SU0_SUM0_SUS0_VWA4_VWB4_WGM6_WGMXCC1_WGMXCCGn1
    SolutionIndex: 73
    SolutionNameMin: Cijk_Alik_Bjlk_BBS_BH_Bias_AS_SAV_UserArgs_MT128x128x128_MI16x16x1_SN_LDSB1_CLR1_GSU0_GSUC0_GSUWGMRR0_K1_LBSPPA1024_LBSPPB512_LPB0_MIWT4_4_PLR1_SU0_SUM0_SUS0_VWA4_VWB4_WGM6_WGMXCC1_WGMXCCGn1
    SolutionIndex: 74
    SolutionNameMin: Cijk_Alik_Bjlk_BBS_BH_Bias_AS_SAV_UserArgs_MT128x128x128_MI16x16x1_SN_LDSB1_CLR1_GSU0_GSUC0_GSUWGMRR0_K1_LBSPPA1024_LBSPPB1024_LPB0_MIWT4_4_PLR1_SU0_SUM0_SUS0_VWA4_VWB4_WGM6_WGMXCC1_WGMXCCGn1
    SolutionIndex: 75
    SolutionNameMin: Cijk_Alik_Bjlk_BBS_BH_Bias_AS_SAV_UserArgs_MT128x128x128_MI16x16x1_SN_LDSB1_CLR1_GSU0_GSUC0_GSUWGMRR0_K1_LBSPPA1024_LBSPPB2048_LPB0_MIWT4_4_PLR1_SU0_SUM0_SUS0_VWA4_VWB4_WGM6_WGMXCC1_WGMXCCGn1
    SolutionIndex: 76
    SolutionNameMin: Cijk_Alik_Bjlk_BBS_BH_Bias_AS_SAV_UserArgs_MT128x128x128_MI16x16x1_SN_LDSB1_CLR1_GSU0_GSUC0_GSUWGMRR0_K1_LBSPPA1024_LBSPPB512_LPB0_MIWT4_4_PLR1_SU0_SUM0_SUS0_VWA4_VWB4_WGM8_WGMXCC1_WGMXCCGn1
    SolutionIndex: 77
    SolutionNameMin: Cijk_Alik_Bjlk_BBS_BH_Bias_AS_SAV_UserArgs_MT128x128x128_MI16x16x1_SN_LDSB1_CLR1_GSU0_GSUC0_GSUWGMRR0_K1_LBSPPA1024_LBSPPB512_LPB0_MIWT4_4_PLR1_SU0_SUM0_SUS0_VWA4_VWB4_WGM8_WGMXCC1_WGMXCCGn1
    SolutionIndex: 78
    SolutionNameMin: Cijk_Alik_Bjlk_BBS_BH_Bias_AS_SAV_UserArgs_MT128x128x128_MI16x16x1_SN_LDSB1_CLR1_GSU0_GSUC0_GSUWGMRR0_K1_LBSPPA1024_LBSPPB2048_LPB0_MIWT4_4_PLR1_SU0_SUM0_SUS0_VWA4_VWB4_WGM8_WGMXCC1_WGMXCCGn1
    SolutionIndex: 79
    SolutionNameMin: Cijk_Alik_Bjlk_BBS_BH_Bias_AS_SAV_UserArgs_MT128x128x128_MI16x16x1_SN_LDSB1_CLR1_GSU0_GSUC0_GSUWGMRR0_K1_LBSPPA1024_LBSPPB2048_LPB0_MIWT4_4_PLR1_SU0_SUM0_SUS0_VWA4_VWB4_WGM8_WGMXCC1_WGMXCCGn1
    SolutionIndex: 80
    SolutionNameMin: Cijk_Alik_Bjlk_BBS_BH_Bias_AS_SAV_UserArgs_MT64x128x128_MI16x16x1_SN_LDSB1_CLR1_GSU0_GSUC0_GSUWGMRR0_K1_LBSPPA512_LBSPPB512_LPB0_MIWT2_4_PLR1_SU0_SUM0_SUS0_VWA2_VWB4_WGM1_WGMXCC1_WGMXCCGn1
    SolutionIndex: 81
    SolutionNameMin: Cijk_Alik_Bjlk_BBS_BH_Bias_AS_SAV_UserArgs_MT64x128x128_MI16x16x1_SN_LDSB1_CLR1_GSU0_GSUC0_GSUWGMRR0_K1_LBSPPA512_LBSPPB512_LPB0_MIWT2_4_PLR1_SU0_SUM0_SUS0_VWA2_VWB4_WGM1_WGMXCC1_WGMXCCGn1
    SolutionIndex: 82
    SolutionNameMin: Cijk_Alik_Bjlk_BBS_BH_Bias_AS_SAV_UserArgs_MT64x128x128_MI16x16x1_SN_LDSB1_CLR1_GSU0_GSUC0_GSUWGMRR0_K1_LBSPPA512_LBSPPB512_LPB0_MIWT2_4_PLR1_SU0_SUM0_SUS0_VWA2_VWB4_WGM1_WGMXCC1_WGMXCCGn1
    SolutionIndex: 83
    SolutionNameMin: Cijk_Alik_Bjlk_BBS_BH_Bias_AS_SAV_UserArgs_MT64x128x128_MI16x16x1_SN_LDSB1_CLR1_GSU0_GSUC0_GSUWGMRR0_K1_LBSPPA512_LBSPPB512_LPB0_MIWT2_4_PLR1_SU0_SUM0_SUS0_VWA2_VWB4_WGM1_WGMXCC1_WGMXCCGn1
    SolutionIndex: 84
    SolutionNameMin: Cijk_Alik_Bjlk_BBS_BH_Bias_AS_SAV_UserArgs_MT64x128x128_MI16x16x1_SN_LDSB1_CLR1_GSU0_GSUC0_GSUWGMRR0_K1_LBSPPA512_LBSPPB1024_LPB0_MIWT2_4_PLR1_SU0_SUM0_SUS0_VWA2_VWB4_WGM1_WGMXCC1_WGMXCCGn1
    SolutionIndex: 85
    SolutionNameMin: Cijk_Alik_Bjlk_BBS_BH_Bias_AS_SAV_UserArgs_MT64x128x128_MI16x16x1_SN_LDSB1_CLR1_GSU0_GSUC0_GSUWGMRR0_K1_LBSPPA512_LBSPPB512_LPB0_MIWT2_4_PLR1_SU0_SUM0_SUS0_VWA2_VWB4_WGM6_WGMXCC1_WGMXCCGn1
    SolutionIndex: 86
    SolutionNameMin: Cijk_Alik_Bjlk_BBS_BH_Bias_AS_SAV_UserArgs_MT64x128x128_MI16x16x1_SN_LDSB1_CLR1_GSU0_GSUC0_GSUWGMRR0_K1_LBSPPA512_LBSPPB1024_LPB0_MIWT2_4_PLR1_SU0_SUM0_SUS0_VWA2_VWB4_WGM6_WGMXCC1_WGMXCCGn1
    SolutionIndex: 87
    SolutionNameMin: Cijk_Alik_Bjlk_BBS_BH_Bias_AS_SAV_UserArgs_MT64x128x128_MI16x16x1_SN_LDSB1_CLR1_GSU0_GSUC0_GSUWGMRR0_K1_LBSPPA512_LBSPPB2048_LPB0_MIWT2_4_PLR1_SU0_SUM0_SUS0_VWA2_VWB4_WGM6_WGMXCC1_WGMXCCGn1
    SolutionIndex: 88
    SolutionNameMin: Cijk_Alik_Bjlk_BBS_BH_Bias_AS_SAV_UserArgs_MT64x128x128_MI16x16x1_SN_LDSB1_CLR1_GSU0_GSUC0_GSUWGMRR0_K1_LBSPPA512_LBSPPB2048_LPB0_MIWT2_4_PLR1_SU0_SUM0_SUS0_VWA2_VWB4_WGM6_WGMXCC1_WGMXCCGn1
    SolutionIndex: 89
    SolutionNameMin: Cijk_Alik_Bjlk_BBS_BH_Bias_AS_SAV_UserArgs_MT64x128x128_MI16x16x1_SN_LDSB1_CLR1_GSU0_GSUC0_GSUWGMRR0_K1_LBSPPA512_LBSPPB512_LPB0_MIWT2_4_PLR1_SU0_SUM0_SUS0_VWA2_VWB4_WGM8_WGMXCC1_WGMXCCGn1
    SolutionIndex: 90
    SolutionNameMin: Cijk_Alik_Bjlk_BBS_BH_Bias_AS_SAV_UserArgs_MT64x128x128_MI16x16x1_SN_LDSB1_CLR1_GSU0_GSUC0_GSUWGMRR0_K1_LBSPPA512_LBSPPB512_LPB0_MIWT2_4_PLR1_SU0_SUM0_SUS0_VWA2_VWB4_WGM8_WGMXCC1_WGMXCCGn1
    SolutionIndex: 91
    SolutionNameMin: Cijk_Alik_Bjlk_BBS_BH_Bias_AS_SAV_UserArgs_MT64x128x128_MI16x16x1_SN_LDSB1_CLR1_GSU0_GSUC0_GSUWGMRR0_K1_LBSPPA512_LBSPPB512_LPB0_MIWT2_4_PLR1_SU0_SUM0_SUS0_VWA2_VWB4_WGM8_WGMXCC1_WGMXCCGn1
    SolutionIndex: 92
    SolutionNameMin: Cijk_Alik_Bjlk_BBS_BH_Bias_AS_SAV_UserArgs_MT64x128x128_MI16x16x1_SN_LDSB1_CLR1_GSU0_GSUC0_GSUWGMRR0_K1_LBSPPA512_LBSPPB1024_LPB0_MIWT2_4_PLR1_SU0_SUM0_SUS0_VWA2_VWB4_WGM8_WGMXCC1_WGMXCCGn1
    SolutionIndex: 93
    SolutionNameMin: Cijk_Alik_Bjlk_BBS_BH_Bias_AS_SAV_UserArgs_MT64x128x128_MI16x16x1_SN_LDSB1_CLR1_GSU0_GSUC0_GSUWGMRR0_K1_LBSPPA512_LBSPPB1024_LPB0_MIWT2_4_PLR1_SU0_SUM0_SUS0_VWA2_VWB4_WGM8_WGMXCC1_WGMXCCGn1
    SolutionIndex: 94
    SolutionNameMin: Cijk_Alik_Bjlk_BBS_BH_Bias_AS_SAV_UserArgs_MT64x128x128_MI16x16x1_SN_LDSB1_CLR1_GSU0_GSUC0_GSUWGMRR0_K1_LBSPPA512_LBSPPB1024_LPB0_MIWT2_4_PLR1_SU0_SUM0_SUS0_VWA2_VWB4_WGM8_WGMXCC1_WGMXCCGn1
    SolutionIndex: 95
    SolutionNameMin: Cijk_Alik_Bjlk_BBS_BH_Bias_AS_SAV_UserArgs_MT64x128x128_MI16x16x1_SN_LDSB1_CLR1_GSU0_GSUC0_GSUWGMRR0_K1_LBSPPA512_LBSPPB2048_LPB0_MIWT2_4_PLR1_SU0_SUM0_SUS0_VWA2_VWB4_WGM8_WGMXCC1_WGMXCCGn1
    SolutionIndex: 96
    SolutionNameMin: Cijk_Alik_Bjlk_BBS_BH_Bias_AS_SAV_UserArgs_MT128x64x128_MI16x16x1_SN_LDSB1_CLR1_GSU0_GSUC0_GSUWGMRR0_K1_LBSPPA1024_LBSPPB256_LPB32_MIWT4_2_PLR1_SU0_SUM0_SUS0_VWA4_VWB2_WGM1_WGMXCC1_WGMXCCGn1
    SolutionIndex: 97
    SolutionNameMin: Cijk_Alik_Bjlk_BBS_BH_Bias_AS_SAV_UserArgs_MT128x64x128_MI16x16x1_SN_LDSB1_CLR1_GSU0_GSUC0_GSUWGMRR0_K1_LBSPPA1024_LBSPPB512_LPB32_MIWT4_2_PLR1_SU0_SUM0_SUS0_VWA4_VWB2_WGM1_WGMXCC1_WGMXCCGn1
    SolutionIndex: 98
    SolutionNameMin: Cijk_Alik_Bjlk_BBS_BH_Bias_AS_SAV_UserArgs_MT128x64x128_MI16x16x1_SN_LDSB1_CLR1_GSU0_GSUC0_GSUWGMRR0_K1_LBSPPA1024_LBSPPB512_LPB32_MIWT4_2_PLR1_SU0_SUM0_SUS0_VWA4_VWB2_WGM1_WGMXCC1_WGMXCCGn1
    SolutionIndex: 99
    SolutionNameMin: Cijk_Alik_Bjlk_BBS_BH_Bias_AS_SAV_UserArgs_MT128x64x128_MI16x16x1_SN_LDSB1_CLR1_GSU0_GSUC0_GSUWGMRR0_K1_LBSPPA1024_LBSPPB1024_LPB32_MIWT4_2_PLR1_SU0_SUM0_SUS0_VWA4_VWB2_WGM6_WGMXCC1_WGMXCCGn1
    SolutionIndex: 100
    SolutionNameMin: Cijk_Alik_Bjlk_BBS_BH_Bias_AS_SAV_UserArgs_MT128x64x128_MI16x16x1_SN_LDSB1_CLR1_GSU0_GSUC0_GSUWGMRR0_K1_LBSPPA1024_LBSPPB1024_LPB32_MIWT4_2_PLR1_SU0_SUM0_SUS0_VWA4_VWB2_WGM8_WGMXCC1_WGMXCCGn1
    SolutionIndex: 101
    SolutionNameMin: Cijk_Alik_Bjlk_BBS_BH_Bias_AS_SAV_UserArgs_MT64x64x128_MI16x16x1_SN_LDSB1_CLR1_GSU0_GSUC0_GSUWGMRR0_K1_LBSPPA512_LBSPPB256_LPB32_MIWT2_2_PLR1_SU0_SUM0_SUS0_VWA2_VWB2_WGM1_WGMXCC1_WGMXCCGn1
    SolutionIndex: 102
    SolutionNameMin: Cijk_Alik_Bjlk_BBS_BH_Bias_AS_SAV_UserArgs_MT64x64x128_MI16x16x1_SN_LDSB1_CLR1_GSU0_GSUC0_GSUWGMRR0_K1_LBSPPA512_LBSPPB512_LPB32_MIWT2_2_PLR1_SU0_SUM0_SUS0_VWA2_VWB2_WGM1_WGMXCC1_WGMXCCGn1
    SolutionIndex: 103
    SolutionNameMin: Cijk_Alik_Bjlk_BBS_BH_Bias_AS_SAV_UserArgs_MT64x64x128_MI16x16x1_SN_LDSB1_CLR1_GSU0_GSUC0_GSUWGMRR0_K1_LBSPPA512_LBSPPB512_LPB32_MIWT2_2_PLR1_SU0_SUM0_SUS0_VWA2_VWB2_WGM1_WGMXCC1_WGMXCCGn1
    SolutionIndex: 104
    SolutionNameMin: Cijk_Alik_Bjlk_BBS_BH_Bias_AS_SAV_UserArgs_MT64x64x128_MI16x16x1_SN_LDSB1_CLR1_GSU0_GSUC0_GSUWGMRR0_K1_LBSPPA512_LBSPPB1024_LPB32_MIWT2_2_PLR1_SU0_SUM0_SUS0_VWA2_VWB2_WGM1_WGMXCC1_WGMXCCGn1
    SolutionIndex: 105
    SolutionNameMin: Cijk_Alik_Bjlk_BBS_BH_Bias_AS_SAV_UserArgs_MT64x64x128_MI16x16x1_SN_LDSB1_CLR1_GSU0_GSUC0_GSUWGMRR0_K1_LBSPPA512_LBSPPB1024_LPB32_MIWT2_2_PLR1_SU0_SUM0_SUS0_VWA2_VWB2_WGM1_WGMXCC1_WGMXCCGn1
    SolutionIndex: 106
    SolutionNameMin: Cijk_Alik_Bjlk_BBS_BH_Bias_AS_SAV_UserArgs_MT64x64x128_MI16x16x1_SN_LDSB1_CLR1_GSU0_GSUC0_GSUWGMRR0_K1_LBSPPA512_LBSPPB1024_LPB32_MIWT2_2_PLR1_SU0_SUM0_SUS0_VWA2_VWB2_WGM1_WGMXCC1_WGMXCCGn1
    SolutionIndex: 107
    SolutionNameMin: Cijk_Alik_Bjlk_BBS_BH_Bias_AS_SAV_UserArgs_MT64x64x128_MI16x16x1_SN_LDSB1_CLR1_GSU0_GSUC0_GSUWGMRR0_K1_LBSPPA512_LBSPPB1024_LPB32_MIWT2_2_PLR1_SU0_SUM0_SUS0_VWA2_VWB2_WGM1_WGMXCC1_WGMXCCGn1
    SolutionIndex: 108
    SolutionNameMin: Cijk_Alik_Bjlk_BBS_BH_Bias_AS_SAV_UserArgs_MT64x64x128_MI16x16x1_SN_LDSB1_CLR1_GSU0_GSUC0_GSUWGMRR0_K1_LBSPPA512_LBSPPB256_LPB32_MIWT2_2_PLR1_SU0_SUM0_SUS0_VWA2_VWB2_WGM6_WGMXCC1_WGMXCCGn1
    SolutionIndex: 109
    SolutionNameMin: Cijk_Alik_Bjlk_BBS_BH_Bias_AS_SAV_UserArgs_MT64x64x128_MI16x16x1_SN_LDSB1_CLR1_GSU0_GSUC0_GSUWGMRR0_K1_LBSPPA512_LBSPPB1024_LPB32_MIWT2_2_PLR1_SU0_SUM0_SUS0_VWA2_VWB2_WGM6_WGMXCC1_WGMXCCGn1
    SolutionIndex: 110
    SolutionNameMin: Cijk_Alik_Bjlk_BBS_BH_Bias_AS_SAV_UserArgs_MT64x64x128_MI16x16x1_SN_LDSB1_CLR1_GSU0_GSUC0_GSUWGMRR0_K1_LBSPPA512_LBSPPB512_LPB32_MIWT2_2_PLR1_SU0_SUM0_SUS0_VWA2_VWB2_WGM8_WGMXCC1_WGMXCCGn1
    SolutionIndex: 111
    SolutionNameMin: Cijk_Alik_Bjlk_BBS_BH_Bias_AS_SAV_UserArgs_MT64x64x128_MI16x16x1_SN_LDSB1_CLR1_GSU0_GSUC0_GSUWGMRR0_K1_LBSPPA512_LBSPPB1024_LPB32_MIWT2_2_PLR1_SU0_SUM0_SUS0_VWA2_VWB2_WGM8_WGMXCC1_WGMXCCGn1
    SolutionIndex: 112
    SolutionNameMin: Cijk_Alik_Bjlk_BBS_BH_Bias_AS_SAV_UserArgs_MT64x64x128_MI16x16x1_SN_LDSB1_CLR1_GSU0_GSUC0_GSUWGMRR0_K1_LBSPPA512_LBSPPB1024_LPB32_MIWT2_2_PLR1_SU0_SUM0_SUS0_VWA2_VWB2_WGM8_WGMXCC1_WGMXCCGn1
    SolutionIndex: 113
    SolutionNameMin: Cijk_Alik_Bjlk_BBS_BH_Bias_AS_SAV_UserArgs_MT64x64x128_MI16x16x1_SN_LDSB1_CLR1_GSU0_GSUC0_GSUWGMRR0_K1_LBSPPA512_LBSPPB1024_LPB32_MIWT2_2_PLR1_SU0_SUM0_SUS0_VWA2_VWB2_WGM8_WGMXCC1_WGMXCCGn1
    SolutionIndex: 114
    SolutionNameMin: Cijk_Alik_Bjlk_BBS_BH_Bias_AS_SAV_UserArgs_MT32x64x128_MI16x16x1_SN_LDSB1_CLR1_GSU0_GSUC0_GSUWGMRR0_K1_LBSPPA256_LBSPPB512_LPB32_MIWT1_2_PLR1_SU0_SUM0_SUS0_VWA1_VWB2_WGM1_WGMXCC1_WGMXCCGn1
    SolutionIndex: 115
    SolutionNameMin: Cijk_Alik_Bjlk_BBS_BH_Bias_AS_SAV_UserArgs_MT32x64x128_MI16x16x1_SN_LDSB1_CLR1_GSU0_GSUC0_GSUWGMRR0_K1_LBSPPA256_LBSPPB512_LPB32_MIWT1_2_PLR1_SU0_SUM0_SUS0_VWA1_VWB2_WGM1_WGMXCC1_WGMXCCGn1
    SolutionIndex: 116
    SolutionNameMin: Cijk_Alik_Bjlk_BBS_BH_Bias_AS_SAV_UserArgs_MT32x64x128_MI16x16x1_SN_LDSB1_CLR1_GSU0_GSUC0_GSUWGMRR0_K1_LBSPPA256_LBSPPB512_LPB32_MIWT1_2_PLR1_SU0_SUM0_SUS0_VWA1_VWB2_WGM1_WGMXCC1_WGMXCCGn1
    SolutionIndex: 117
    SolutionNameMin: Cijk_Alik_Bjlk_BBS_BH_Bias_AS_SAV_UserArgs_MT32x64x128_MI16x16x1_SN_LDSB1_CLR1_GSU0_GSUC0_GSUWGMRR0_K1_LBSPPA256_LBSPPB1024_LPB32_MIWT1_2_PLR1_SU0_SUM0_SUS0_VWA1_VWB2_WGM1_WGMXCC1_WGMXCCGn1
    SolutionIndex: 118
    SolutionNameMin: Cijk_Alik_Bjlk_BBS_BH_Bias_AS_SAV_UserArgs_MT32x64x128_MI16x16x1_SN_LDSB1_CLR1_GSU0_GSUC0_GSUWGMRR0_K1_LBSPPA256_LBSPPB1024_LPB32_MIWT1_2_PLR1_SU0_SUM0_SUS0_VWA1_VWB2_WGM1_WGMXCC1_WGMXCCGn1
    SolutionIndex: 119
    SolutionNameMin: Cijk_Alik_Bjlk_BBS_BH_Bias_AS_SAV_UserArgs_MT32x64x128_MI16x16x1_SN_LDSB1_CLR1_GSU0_GSUC0_GSUWGMRR0_K1_LBSPPA256_LBSPPB512_LPB32_MIWT1_2_PLR1_SU0_SUM0_SUS0_VWA1_VWB2_WGM6_WGMXCC1_WGMXCCGn1
    SolutionIndex: 120
    SolutionNameMin: Cijk_Alik_Bjlk_BBS_BH_Bias_AS_SAV_UserArgs_MT32x64x128_MI16x16x1_SN_LDSB1_CLR1_GSU0_GSUC0_GSUWGMRR0_K1_LBSPPA256_LBSPPB1024_LPB32_MIWT1_2_PLR1_SU0_SUM0_SUS0_VWA1_VWB2_WGM6_WGMXCC1_WGMXCCGn1
    SolutionIndex: 121
    SolutionNameMin: Cijk_Alik_Bjlk_BBS_BH_Bias_AS_SAV_UserArgs_MT32x64x128_MI16x16x1_SN_LDSB1_CLR1_GSU0_GSUC0_GSUWGMRR0_K1_LBSPPA256_LBSPPB1024_LPB32_MIWT1_2_PLR1_SU0_SUM0_SUS0_VWA1_VWB2_WGM6_WGMXCC1_WGMXCCGn1
    SolutionIndex: 122
    SolutionNameMin: Cijk_Alik_Bjlk_BBS_BH_Bias_AS_SAV_UserArgs_MT32x64x128_MI16x16x1_SN_LDSB1_CLR1_GSU0_GSUC0_GSUWGMRR0_K1_LBSPPA256_LBSPPB512_LPB32_MIWT1_2_PLR1_SU0_SUM0_SUS0_VWA1_VWB2_WGM8_WGMXCC1_WGMXCCGn1
    SolutionIndex: 123
    SolutionNameMin: Cijk_Alik_Bjlk_BBS_BH_Bias_AS_SAV_UserArgs_MT32x64x128_MI16x16x1_SN_LDSB1_CLR1_GSU0_GSUC0_GSUWGMRR0_K1_LBSPPA256_LBSPPB1024_LPB32_MIWT1_2_PLR1_SU0_SUM0_SUS0_VWA1_VWB2_WGM8_WGMXCC1_WGMXCCGn1
    SolutionIndex: 124
    SolutionNameMin: Cijk_Alik_Bjlk_BBS_BH_Bias_AS_SAV_UserArgs_MT32x64x128_MI16x16x1_SN_LDSB1_CLR1_GSU0_GSUC0_GSUWGMRR0_K1_LBSPPA256_LBSPPB1024_LPB32_MIWT1_2_PLR1_SU0_SUM0_SUS0_VWA1_VWB2_WGM8_WGMXCC1_WGMXCCGn1
    SolutionIndex: 125
    SolutionNameMin: Cijk_Alik_Bjlk_BBS_BH_Bias_AS_SAV_UserArgs_MT64x32x128_MI16x16x1_SN_LDSB1_CLR1_GSU0_GSUC0_GSUWGMRR0_K1_LBSPPA512_LBSPPB256_LPB16_MIWT2_1_PLR1_SU0_SUM0_SUS0_VWA2_VWB1_WGM1_WGMXCC1_WGMXCCGn1
    SolutionIndex: 126
    SolutionNameMin: Cijk_Alik_Bjlk_BBS_BH_Bias_AS_SAV_UserArgs_MT64x32x128_MI16x16x1_SN_LDSB1_CLR1_GSU0_GSUC0_GSUWGMRR0_K1_LBSPPA512_LBSPPB512_LPB16_MIWT2_1_PLR1_SU0_SUM0_SUS0_VWA2_VWB1_WGM1_WGMXCC1_WGMXCCGn1
    SolutionIndex: 127
    SolutionNameMin: Cijk_Alik_Bjlk_BBS_BH_Bias_AS_SAV_UserArgs_MT64x32x128_MI16x16x1_SN_LDSB1_CLR1_GSU0_GSUC0_GSUWGMRR0_K1_LBSPPA512_LBSPPB256_LPB16_MIWT2_1_PLR1_SU0_SUM0_SUS0_VWA2_VWB1_WGM8_WGMXCC1_WGMXCCGn1
    SolutionIndex: 128
    SolutionNameMin: Cijk_Alik_Bjlk_BBS_BH_Bias_AS_SAV_UserArgs_MT64x32x128_MI16x16x1_SN_LDSB1_CLR1_GSU0_GSUC0_GSUWGMRR0_K1_LBSPPA512_LBSPPB512_LPB16_MIWT2_1_PLR1_SU0_SUM0_SUS0_VWA2_VWB1_WGM8_WGMXCC1_WGMXCCGn1
    SolutionIndex: 129
    SolutionNameMin: Cijk_Alik_Bjlk_BBS_BH_Bias_AS_SAV_UserArgs_MT32x32x128_MI16x16x1_SN_LDSB1_CLR1_GSU0_GSUC0_GSUWGMRR0_K1_LBSPPA256_LBSPPB128_LPB16_MIWT1_1_PLR1_SU0_SUM0_SUS0_VWA1_VWB1_WGM1_WGMXCC1_WGMXCCGn1
    SolutionIndex: 130
    SolutionNameMin: Cijk_Alik_Bjlk_BBS_BH_Bias_AS_SAV_UserArgs_MT32x32x128_MI16x16x1_SN_LDSB1_CLR1_GSU0_GSUC0_GSUWGMRR0_K1_LBSPPA256_LBSPPB256_LPB16_MIWT1_1_PLR1_SU0_SUM0_SUS0_VWA1_VWB1_WGM1_WGMXCC1_WGMXCCGn1
    SolutionIndex: 131
    SolutionNameMin: Cijk_Alik_Bjlk_BBS_BH_Bias_AS_SAV_UserArgs_MT32x32x128_MI16x16x1_SN_LDSB1_CLR1_GSU0_GSUC0_GSUWGMRR0_K1_LBSPPA256_LBSPPB256_LPB16_MIWT1_1_PLR1_SU0_SUM0_SUS0_VWA1_VWB1_WGM1_WGMXCC1_WGMXCCGn1
    SolutionIndex: 132
    SolutionNameMin: Cijk_Alik_Bjlk_BBS_BH_Bias_AS_SAV_UserArgs_MT32x32x128_MI16x16x1_SN_LDSB1_CLR1_GSU0_GSUC0_GSUWGMRR0_K1_LBSPPA256_LBSPPB256_LPB16_MIWT1_1_PLR1_SU0_SUM0_SUS0_VWA1_VWB1_WGM1_WGMXCC1_WGMXCCGn1
    SolutionIndex: 133
    SolutionNameMin: Cijk_Alik_Bjlk_BBS_BH_Bias_AS_SAV_UserArgs_MT32x32x128_MI16x16x1_SN_LDSB1_CLR1_GSU0_GSUC0_GSUWGMRR0_K1_LBSPPA256_LBSPPB256_LPB16_MIWT1_1_PLR1_SU0_SUM0_SUS0_VWA1_VWB1_WGM1_WGMXCC1_WGMXCCGn1
    SolutionIndex: 134
    SolutionNameMin: Cijk_Alik_Bjlk_BBS_BH_Bias_AS_SAV_UserArgs_MT32x32x128_MI16x16x1_SN_LDSB1_CLR1_GSU0_GSUC0_GSUWGMRR0_K1_LBSPPA256_LBSPPB256_LPB16_MIWT1_1_PLR1_SU0_SUM0_SUS0_VWA1_VWB1_WGM1_WGMXCC1_WGMXCCGn1
    SolutionIndex: 135
    SolutionNameMin: Cijk_Alik_Bjlk_BBS_BH_Bias_AS_SAV_UserArgs_MT32x32x128_MI16x16x1_SN_LDSB1_CLR1_GSU0_GSUC0_GSUWGMRR0_K1_LBSPPA256_LBSPPB512_LPB16_MIWT1_1_PLR1_SU0_SUM0_SUS0_VWA1_VWB1_WGM1_WGMXCC1_WGMXCCGn1
    SolutionIndex: 136
    SolutionNameMin: Cijk_Alik_Bjlk_BBS_BH_Bias_AS_SAV_UserArgs_MT32x32x128_MI16x16x1_SN_LDSB1_CLR1_GSU0_GSUC0_GSUWGMRR0_K1_LBSPPA256_LBSPPB512_LPB16_MIWT1_1_PLR1_SU0_SUM0_SUS0_VWA1_VWB1_WGM1_WGMXCC1_WGMXCCGn1
    SolutionIndex: 137
    SolutionNameMin: Cijk_Alik_Bjlk_BBS_BH_Bias_AS_SAV_UserArgs_MT32x32x128_MI16x16x1_SN_LDSB1_CLR1_GSU0_GSUC0_GSUWGMRR0_K1_LBSPPA256_LBSPPB512_LPB16_MIWT1_1_PLR1_SU0_SUM0_SUS0_VWA1_VWB1_WGM1_WGMXCC1_WGMXCCGn1
    SolutionIndex: 138
    SolutionNameMin: Cijk_Alik_Bjlk_BBS_BH_Bias_AS_SAV_UserArgs_MT32x32x128_MI16x16x1_SN_LDSB1_CLR1_GSU0_GSUC0_GSUWGMRR0_K1_LBSPPA256_LBSPPB256_LPB16_MIWT1_1_PLR1_SU0_SUM0_SUS0_VWA1_VWB1_WGM6_WGMXCC1_WGMXCCGn1
    SolutionIndex: 139
    SolutionNameMin: Cijk_Alik_Bjlk_BBS_BH_Bias_AS_SAV_UserArgs_MT32x32x128_MI16x16x1_SN_LDSB1_CLR1_GSU0_GSUC0_GSUWGMRR0_K1_LBSPPA256_LBSPPB256_LPB16_MIWT1_1_PLR1_SU0_SUM0_SUS0_VWA1_VWB1_WGM6_WGMXCC1_WGMXCCGn1
    SolutionIndex: 140
    SolutionNameMin: Cijk_Alik_Bjlk_BBS_BH_Bias_AS_SAV_UserArgs_MT32x32x128_MI16x16x1_SN_LDSB1_CLR1_GSU0_GSUC0_GSUWGMRR0_K1_LBSPPA256_LBSPPB512_LPB16_MIWT1_1_PLR1_SU0_SUM0_SUS0_VWA1_VWB1_WGM6_WGMXCC1_WGMXCCGn1
    SolutionIndex: 141
    SolutionNameMin: Cijk_Alik_Bjlk_BBS_BH_Bias_AS_SAV_UserArgs_MT32x32x128_MI16x16x1_SN_LDSB1_CLR1_GSU0_GSUC0_GSUWGMRR0_K1_LBSPPA256_LBSPPB512_LPB16_MIWT1_1_PLR1_SU0_SUM0_SUS0_VWA1_VWB1_WGM6_WGMXCC1_WGMXCCGn1
    SolutionIndex: 142
    SolutionNameMin: Cijk_Alik_Bjlk_BBS_BH_Bias_AS_SAV_UserArgs_MT32x32x128_MI16x16x1_SN_LDSB1_CLR1_GSU0_GSUC0_GSUWGMRR0_K1_LBSPPA256_LBSPPB512_LPB16_MIWT1_1_PLR1_SU0_SUM0_SUS0_VWA1_VWB1_WGM6_WGMXCC1_WGMXCCGn1
    SolutionIndex: 143
    SolutionNameMin: Cijk_Alik_Bjlk_BBS_BH_Bias_AS_SAV_UserArgs_MT32x32x128_MI16x16x1_SN_LDSB1_CLR1_GSU0_GSUC0_GSUWGMRR0_K1_LBSPPA256_LBSPPB256_LPB16_MIWT1_1_PLR1_SU0_SUM0_SUS0_VWA1_VWB1_WGM8_WGMXCC1_WGMXCCGn1
    SolutionIndex: 144
    SolutionNameMin: Cijk_Alik_Bjlk_BBS_BH_Bias_AS_SAV_UserArgs_MT32x32x128_MI16x16x1_SN_LDSB1_CLR1_GSU0_GSUC0_GSUWGMRR0_K1_LBSPPA256_LBSPPB512_LPB16_MIWT1_1_PLR1_SU0_SUM0_SUS0_VWA1_VWB1_WGM8_WGMXCC1_WGMXCCGn1
    SolutionIndex: 145
    SolutionNameMin: Cijk_Alik_Bjlk_BBS_BH_Bias_AS_SAV_UserArgs_MT128x128x128_MI32x32x1_SN_LDSB1_CLR1_GSU0_GSUC0_GSUWGMRR0_K1_LBSPPA512_LBSPPB0_LPB0_MIWT2_2_PLR1_SU0_SUM0_SUS0_VWA2_VWB2_WGM1_WGMXCC1_WGMXCCGn1
    SolutionIndex: 146
    SolutionNameMin: Cijk_Alik_Bjlk_BBS_BH_Bias_AS_SAV_UserArgs_MT128x128x128_MI32x32x1_SN_LDSB1_CLR1_GSU0_GSUC0_GSUWGMRR0_K1_LBSPPA512_LBSPPB0_LPB0_MIWT2_2_PLR1_SU0_SUM0_SUS0_VWA2_VWB2_WGM6_WGMXCC1_WGMXCCGn1
    SolutionIndex: 147
    SolutionNameMin: Cijk_Alik_Bjlk_BBS_BH_Bias_AS_SAV_UserArgs_MT128x128x128_MI32x32x1_SN_LDSB1_CLR1_GSU0_GSUC0_GSUWGMRR0_K1_LBSPPA512_LBSPPB0_LPB0_MIWT2_2_PLR1_SU0_SUM0_SUS0_VWA2_VWB2_WGM8_WGMXCC1_WGMXCCGn1
    SolutionIndex: 148
    SolutionNameMin: Cijk_Alik_Bjlk_BBS_BH_Bias_AS_SAV_UserArgs_MT128x128x128_MI32x32x1_SN_LDSB1_CLR1_GSU0_GSUC0_GSUWGMRR0_K1_LBSPPA512_LBSPPB0_LPB0_MIWT2_2_PLR1_SU0_SUM0_SUS0_VWA2_VWB2_WGM8_WGMXCC1_WGMXCCGn1
    SolutionIndex: 149
    SolutionNameMin: Cijk_Alik_Bjlk_BBS_BH_Bias_AS_SAV_UserArgs_MT64x128x128_MI32x32x1_SN_LDSB1_CLR1_GSU0_GSUC0_GSUWGMRR0_K1_LBSPPA256_LBSPPB0_LPB0_MIWT1_2_PLR1_SU0_SUM0_SUS0_VWA1_VWB2_WGM6_WGMXCC1_WGMXCCGn1
    SolutionIndex: 150
    SolutionNameMin: Cijk_Alik_Bjlk_BBS_BH_Bias_AS_SAV_UserArgs_MT64x64x256_MI16x16x1_SN_LDSB1_CLR1_GSU0_GSUC0_GSUWGMRR0_K1_LBSPPA1024_LBSPPB256_LPB32_MIWT2_2_PLR1_SU0_SUM0_SUS0_VWA2_VWB2_WGM1_WGMXCC1_WGMXCCGn1
    SolutionIndex: 151
    SolutionNameMin: Cijk_Alik_Bjlk_BBS_BH_Bias_AS_SAV_UserArgs_MT64x64x256_MI16x16x1_SN_LDSB1_CLR1_GSU0_GSUC0_GSUWGMRR0_K1_LBSPPA1024_LBSPPB512_LPB32_MIWT2_2_PLR1_SU0_SUM0_SUS0_VWA2_VWB2_WGM1_WGMXCC1_WGMXCCGn1
    SolutionIndex: 152
    SolutionNameMin: Cijk_Alik_Bjlk_BBS_BH_Bias_AS_SAV_UserArgs_MT64x64x256_MI16x16x1_SN_LDSB1_CLR1_GSU0_GSUC0_GSUWGMRR0_K1_LBSPPA1024_LBSPPB1024_LPB32_MIWT2_2_PLR1_SU0_SUM0_SUS0_VWA2_VWB2_WGM1_WGMXCC1_WGMXCCGn1
    SolutionIndex: 153
    SolutionNameMin: Cijk_Alik_Bjlk_BBS_BH_Bias_AS_SAV_UserArgs_MT64x64x256_MI16x16x1_SN_LDSB1_CLR1_GSU0_GSUC0_GSUWGMRR0_K1_LBSPPA1024_LBSPPB256_LPB32_MIWT2_2_PLR1_SU0_SUM0_SUS0_VWA2_VWB2_WGM6_WGMXCC1_WGMXCCGn1
    SolutionIndex: 154
    SolutionNameMin: Cijk_Alik_Bjlk_BBS_BH_Bias_AS_SAV_UserArgs_MT64x64x256_MI16x16x1_SN_LDSB1_CLR1_GSU0_GSUC0_GSUWGMRR0_K1_LBSPPA1024_LBSPPB256_LPB32_MIWT2_2_PLR1_SU0_SUM0_SUS0_VWA2_VWB2_WGM6_WGMXCC1_WGMXCCGn1
    SolutionIndex: 155
    SolutionNameMin: Cijk_Alik_Bjlk_BBS_BH_Bias_AS_SAV_UserArgs_MT64x64x256_MI16x16x1_SN_LDSB1_CLR1_GSU0_GSUC0_GSUWGMRR0_K1_LBSPPA1024_LBSPPB512_LPB32_MIWT2_2_PLR1_SU0_SUM0_SUS0_VWA2_VWB2_WGM6_WGMXCC1_WGMXCCGn1
    SolutionIndex: 156
    SolutionNameMin: Cijk_Alik_Bjlk_BBS_BH_Bias_AS_SAV_UserArgs_MT64x64x256_MI16x16x1_SN_LDSB1_CLR1_GSU0_GSUC0_GSUWGMRR0_K1_LBSPPA1024_LBSPPB1024_LPB32_MIWT2_2_PLR1_SU0_SUM0_SUS0_VWA2_VWB2_WGM6_WGMXCC1_WGMXCCGn1
    SolutionIndex: 157
    SolutionNameMin: Cijk_Alik_Bjlk_BBS_BH_Bias_AS_SAV_UserArgs_MT64x64x256_MI16x16x1_SN_LDSB1_CLR1_GSU0_GSUC0_GSUWGMRR0_K1_LBSPPA1024_LBSPPB512_LPB32_MIWT2_2_PLR1_SU0_SUM0_SUS0_VWA2_VWB2_WGM8_WGMXCC1_WGMXCCGn1
    SolutionIndex: 158
    SolutionNameMin: Cijk_Alik_Bjlk_BBS_BH_Bias_AS_SAV_UserArgs_MT64x64x256_MI16x16x1_SN_LDSB1_CLR1_GSU0_GSUC0_GSUWGMRR0_K1_LBSPPA1024_LBSPPB1024_LPB32_MIWT2_2_PLR1_SU0_SUM0_SUS0_VWA2_VWB2_WGM8_WGMXCC1_WGMXCCGn1
    SolutionIndex: 159
    SolutionNameMin: Cijk_Alik_Bjlk_BBS_BH_Bias_AS_SAV_UserArgs_MT32x64x256_MI16x16x1_SN_LDSB1_CLR1_GSU0_GSUC0_GSUWGMRR0_K1_LBSPPA512_LBSPPB512_LPB32_MIWT1_2_PLR1_SU0_SUM0_SUS0_VWA1_VWB2_WGM1_WGMXCC1_WGMXCCGn1
    SolutionIndex: 160
    SolutionNameMin: Cijk_Alik_Bjlk_BBS_BH_Bias_AS_SAV_UserArgs_MT32x64x256_MI16x16x1_SN_LDSB1_CLR1_GSU0_GSUC0_GSUWGMRR0_K1_LBSPPA512_LBSPPB512_LPB32_MIWT1_2_PLR1_SU0_SUM0_SUS0_VWA1_VWB2_WGM1_WGMXCC1_WGMXCCGn1
    SolutionIndex: 161
    SolutionNameMin: Cijk_Alik_Bjlk_BBS_BH_Bias_AS_SAV_UserArgs_MT32x64x256_MI16x16x1_SN_LDSB1_CLR1_GSU0_GSUC0_GSUWGMRR0_K1_LBSPPA512_LBSPPB1024_LPB32_MIWT1_2_PLR1_SU0_SUM0_SUS0_VWA1_VWB2_WGM1_WGMXCC1_WGMXCCGn1
    SolutionIndex: 162
    SolutionNameMin: Cijk_Alik_Bjlk_BBS_BH_Bias_AS_SAV_UserArgs_MT32x64x256_MI16x16x1_SN_LDSB1_CLR1_GSU0_GSUC0_GSUWGMRR0_K1_LBSPPA512_LBSPPB1024_LPB32_MIWT1_2_PLR1_SU0_SUM0_SUS0_VWA1_VWB2_WGM1_WGMXCC1_WGMXCCGn1
    SolutionIndex: 163
    SolutionNameMin: Cijk_Alik_Bjlk_BBS_BH_Bias_AS_SAV_UserArgs_MT32x64x256_MI16x16x1_SN_LDSB1_CLR1_GSU0_GSUC0_GSUWGMRR0_K1_LBSPPA512_LBSPPB1024_LPB32_MIWT1_2_PLR1_SU0_SUM0_SUS0_VWA1_VWB2_WGM6_WGMXCC1_WGMXCCGn1
    SolutionIndex: 164
    SolutionNameMin: Cijk_Alik_Bjlk_BBS_BH_Bias_AS_SAV_UserArgs_MT32x64x256_MI16x16x1_SN_LDSB1_CLR1_GSU0_GSUC0_GSUWGMRR0_K1_LBSPPA512_LBSPPB1024_LPB32_MIWT1_2_PLR1_SU0_SUM0_SUS0_VWA1_VWB2_WGM8_WGMXCC1_WGMXCCGn1
    SolutionIndex: 165
    SolutionNameMin: Cijk_Alik_Bjlk_BBS_BH_Bias_AS_SAV_UserArgs_MT32x32x256_MI16x16x1_SN_LDSB1_CLR1_GSU0_GSUC0_GSUWGMRR0_K1_LBSPPA512_LBSPPB256_LPB16_MIWT1_1_PLR1_SU0_SUM0_SUS0_VWA1_VWB1_WGM1_WGMXCC1_WGMXCCGn1
    SolutionIndex: 166
    SolutionNameMin: Cijk_Alik_Bjlk_BBS_BH_Bias_AS_SAV_UserArgs_MT32x32x256_MI16x16x1_SN_LDSB1_CLR1_GSU0_GSUC0_GSUWGMRR0_K1_LBSPPA512_LBSPPB256_LPB16_MIWT1_1_PLR1_SU0_SUM0_SUS0_VWA1_VWB1_WGM1_WGMXCC1_WGMXCCGn1
    SolutionIndex: 167
    SolutionNameMin: Cijk_Alik_Bjlk_BBS_BH_Bias_AS_SAV_UserArgs_MT32x32x256_MI16x16x1_SN_LDSB1_CLR1_GSU0_GSUC0_GSUWGMRR0_K1_LBSPPA512_LBSPPB512_LPB16_MIWT1_1_PLR1_SU0_SUM0_SUS0_VWA1_VWB1_WGM1_WGMXCC1_WGMXCCGn1
    SolutionIndex: 168
    SolutionNameMin: Cijk_Alik_Bjlk_BBS_BH_Bias_AS_SAV_UserArgs_MT32x32x256_MI16x16x1_SN_LDSB1_CLR1_GSU0_GSUC0_GSUWGMRR0_K1_LBSPPA512_LBSPPB512_LPB16_MIWT1_1_PLR1_SU0_SUM0_SUS0_VWA1_VWB1_WGM1_WGMXCC1_WGMXCCGn1
    SolutionIndex: 169
    SolutionNameMin: Cijk_Alik_Bjlk_BBS_BH_Bias_AS_SAV_UserArgs_MT32x32x256_MI16x16x1_SN_LDSB1_CLR1_GSU0_GSUC0_GSUWGMRR0_K1_LBSPPA512_LBSPPB512_LPB16_MIWT1_1_PLR1_SU0_SUM0_SUS0_VWA1_VWB1_WGM1_WGMXCC1_WGMXCCGn1
    SolutionIndex: 170
    SolutionNameMin: Cijk_Alik_Bjlk_BBS_BH_Bias_AS_SAV_UserArgs_MT32x32x256_MI16x16x1_SN_LDSB1_CLR1_GSU0_GSUC0_GSUWGMRR0_K1_LBSPPA512_LBSPPB512_LPB16_MIWT1_1_PLR1_SU0_SUM0_SUS0_VWA1_VWB1_WGM1_WGMXCC1_WGMXCCGn1
    SolutionIndex: 171
    SolutionNameMin: Cijk_Alik_Bjlk_BBS_BH_Bias_AS_SAV_UserArgs_MT32x32x256_MI16x16x1_SN_LDSB1_CLR1_GSU0_GSUC0_GSUWGMRR0_K1_LBSPPA512_LBSPPB512_LPB16_MIWT1_1_PLR1_SU0_SUM0_SUS0_VWA1_VWB1_WGM1_WGMXCC1_WGMXCCGn1
    SolutionIndex: 172
    SolutionNameMin: Cijk_Alik_Bjlk_BBS_BH_Bias_AS_SAV_UserArgs_MT32x32x256_MI16x16x1_SN_LDSB1_CLR1_GSU0_GSUC0_GSUWGMRR0_K1_LBSPPA512_LBSPPB256_LPB16_MIWT1_1_PLR1_SU0_SUM0_SUS0_VWA1_VWB1_WGM6_WGMXCC1_WGMXCCGn1
    SolutionIndex: 173
    SolutionNameMin: Cijk_Alik_Bjlk_BBS_BH_Bias_AS_SAV_UserArgs_MT32x32x256_MI16x16x1_SN_LDSB1_CLR1_GSU0_GSUC0_GSUWGMRR0_K1_LBSPPA512_LBSPPB256_LPB16_MIWT1_1_PLR1_SU0_SUM0_SUS0_VWA1_VWB1_WGM6_WGMXCC1_WGMXCCGn1
    SolutionIndex: 174
    SolutionNameMin: Cijk_Alik_Bjlk_BBS_BH_Bias_AS_SAV_UserArgs_MT32x32x256_MI16x16x1_SN_LDSB1_CLR1_GSU0_GSUC0_GSUWGMRR0_K1_LBSPPA512_LBSPPB512_LPB16_MIWT1_1_PLR1_SU0_SUM0_SUS0_VWA1_VWB1_WGM6_WGMXCC1_WGMXCCGn1
    SolutionIndex: 175
    SolutionNameMin: Cijk_Alik_Bjlk_BBS_BH_Bias_AS_SAV_UserArgs_MT32x32x256_MI16x16x1_SN_LDSB1_CLR1_GSU0_GSUC0_GSUWGMRR0_K1_LBSPPA512_LBSPPB256_LPB16_MIWT1_1_PLR1_SU0_SUM0_SUS0_VWA1_VWB1_WGM8_WGMXCC1_WGMXCCGn1
    SolutionIndex: 176
    SolutionNameMin: Cijk_Alik_Bjlk_BBS_BH_Bias_AS_SAV_UserArgs_MT32x32x256_MI16x16x1_SN_LDSB1_CLR1_GSU0_GSUC0_GSUWGMRR0_K1_LBSPPA512_LBSPPB512_LPB16_MIWT1_1_PLR1_SU0_SUM0_SUS0_VWA1_VWB1_WGM8_WGMXCC1_WGMXCCGn1
    SolutionIndex: 177
    SolutionNameMin: Cijk_Alik_Bjlk_BBS_BH_Bias_AS_SAV_UserArgs_MT32x32x256_MI16x16x1_SN_LDSB1_CLR1_GSU0_GSUC0_GSUWGMRR0_K1_LBSPPA512_LBSPPB512_LPB16_MIWT1_1_PLR1_SU0_SUM0_SUS0_VWA1_VWB1_WGM8_WGMXCC1_WGMXCCGn1
    SolutionIndex: 178
    SolutionNameMin: Cijk_Alik_Bjlk_BBS_BH_Bias_AS_SAV_UserArgs_MT32x32x32_MI16x16x1_SN_LDSB0_CLR0_GSU0_GSUC0_GSUWGMRR0_K1_LBSPPA128_LBSPPB256_LPB16_MIWT1_1_PLR0_SU32_SUM0_SUS256_VWA1_VWB1_WGM4_WGMXCC1_WGMXCCGn1
- - - [128, 128, 1, 128, 128, 128, 128, 128]
    - [131, 0.037]
  - - [128, 128, 1, 256, 128, 128, 256, 128]
    - [166, 0.066]
  - - [128, 128, 1, 512, 128, 128, 512, 128]
    - [166, 0.109]
  - - [128, 128, 1, 1024, 128, 128, 1024, 128]
    - [175, 0.171]
  - - [128, 128, 1, 2048, 128, 128, 2048, 128]
    - [166, 0.233]
  - - [128, 128, 1, 4096, 128, 128, 4096, 128]
    - [166, 0.285]
  - - [128, 128, 1, 8192, 128, 128, 8192, 128]
    - [177, 0.329]
  - - [128, 256, 1, 128, 128, 128, 128, 256]
    - [53, 0.073]
  - - [128, 256, 1, 256, 128, 128, 256, 256]
    - [136, 0.12]
  - - [128, 256, 1, 512, 128, 128, 512, 256]
    - [144, 0.195]
  - - [128, 256, 1, 1024, 128, 128, 1024, 256]
    - [175, 0.278]
  - - [128, 256, 1, 2048, 128, 128, 2048, 256]
    - [143, 0.347]
  - - [128, 256, 1, 4096, 128, 128, 4096, 256]
    - [143, 0.403]
  - - [128, 256, 1, 8192, 128, 128, 8192, 256]
    - [31, 0.469]
  - - [128, 512, 1, 128, 128, 128, 128, 512]
    - [54, 0.142]
  - - [128, 512, 1, 256, 128, 128, 256, 512]
    - [130, 0.239]
  - - [128, 512, 1, 512, 128, 128, 512, 512]
    - [169, 0.389]
  - - [128, 512, 1, 1024, 128, 128, 1024, 512]
    - [133, 0.546]
  - - [128, 512, 1, 2048, 128, 128, 2048, 512]
    - [133, 0.686]
  - - [128, 512, 1, 4096, 128, 128, 4096, 512]
    - [140, 0.804]
  - - [128, 512, 1, 8192, 128, 128, 8192, 512]
    - [31, 0.891]
  - - [128, 1024, 1, 128, 128, 128, 128, 1024]
    - [53, 0.273]
  - - [128, 1024, 1, 256, 128, 128, 256, 1024]
    - [135, 0.466]
  - - [128, 1024, 1, 512, 128, 128, 512, 1024]
    - [169, 0.747]
  - - [128, 1024, 1, 1024, 128, 128, 1024, 1024]
    - [136, 1.034]
  - - [128, 1024, 1, 2048, 128, 128, 2048, 1024]
    - [143, 1.329]
  - - [128, 1024, 1, 4096, 128, 128, 4096, 1024]
    - [140, 1.511]
  - - [128, 1024, 1, 8192, 128, 128, 8192, 1024]
    - [30, 1.73]
  - - [128, 2048, 1, 128, 128, 128, 128, 2048]
    - [131, 0.525]
  - - [128, 2048, 1, 256, 128, 128, 256, 2048]
    - [168, 0.901]
  - - [128, 2048, 1, 512, 128, 128, 512, 2048]
    - [166, 1.458]
  - - [128, 2048, 1, 1024, 128, 128, 1024, 2048]
    - [177, 2.082]
  - - [128, 2048, 1, 2048, 128, 128, 2048, 2048]
    - [143, 2.604]
  - - [128, 2048, 1, 4096, 128, 128, 4096, 2048]
    - [140, 2.984]
  - - [128, 2048, 1, 8192, 128, 128, 8192, 2048]
    - [28, 2.873]
  - - [128, 4096, 1, 128, 128, 128, 128, 4096]
    - [116, 0.967]
  - - [128, 4096, 1, 256, 128, 128, 256, 4096]
    - [162, 1.615]
  - - [128, 4096, 1, 512, 128, 128, 512, 4096]
    - [162, 2.506]
  - - [128, 4096, 1, 1024, 128, 128, 1024, 4096]
    - [162, 3.501]
  - - [128, 4096, 1, 2048, 128, 128, 2048, 4096]
    - [122, 4.399]
  - - [128, 4096, 1, 4096, 128, 128, 4096, 4096]
    - [122, 4.374]
  - - [128, 4096, 1, 8192, 128, 128, 8192, 4096]
    - [124, 4.83]
  - - [128, 8192, 1, 128, 128, 128, 128, 8192]
    - [51, 1.782]
  - - [128, 8192, 1, 256, 128, 128, 256, 8192]
    - [52, 2.939]
  - - [128, 8192, 1, 512, 128, 128, 512, 8192]
    - [50, 4.409]
  - - [128, 8192, 1, 1024, 128, 128, 1024, 8192]
    - [50, 6.051]
  - - [128, 8192, 1, 2048, 128, 128, 2048, 8192]
    - [150, 7.04]
  - - [128, 8192, 1, 4096, 128, 128, 4096, 8192]
    - [103, 8.215]
  - - [128, 8192, 1, 8192, 128, 128, 8192, 8192]
    - [101, 8.684]
  - - [256, 128, 1, 128, 256, 256, 128, 128]
    - [137, 0.076]
  - - [256, 128, 1, 256, 256, 256, 256, 128]
    - [166, 0.132]
  - - [256, 128, 1, 512, 256, 256, 512, 128]
    - [166, 0.217]
  - - [256, 128, 1, 1024, 256, 256, 1024, 128]
    - [171, 0.343]
  - - [256, 128, 1, 2048, 256, 256, 2048, 128]
    - [171, 0.474]
  - - [256, 128, 1, 4096, 256, 256, 4096, 128]
    - [166, 0.581]
  - - [256, 128, 1, 8192, 256, 256, 8192, 128]
    - [166, 0.666]
  - - [256, 256, 1, 128, 256, 256, 128, 256]
    - [53, 0.144]
  - - [256, 256, 1, 256, 256, 256, 256, 256]
    - [165, 0.241]
  - - [256, 256, 1, 512, 256, 256, 512, 256]
    - [133, 0.392]
  - - [256, 256, 1, 1024, 256, 256, 1024, 256]
    - [171, 0.574]
  - - [256, 256, 1, 2048, 256, 256, 2048, 256]
    - [171, 0.705]
  - - [256, 256, 1, 4096, 256, 256, 4096, 256]
    - [140, 0.823]
  - - [256, 256, 1, 8192, 256, 256, 8192, 256]
    - [30, 0.971]
  - - [256, 512, 1, 128, 256, 256, 128, 512]
    - [53, 0.28]
  - - [256, 512, 1, 256, 256, 256, 256, 512]
    - [169, 0.482]
  - - [256, 512, 1, 512, 256, 256, 512, 512]
    - [136, 0.779]
  - - [256, 512, 1, 1024, 256, 256, 1024, 512]
    - [138, 1.111]
  - - [256, 512, 1, 2048, 256, 256, 2048, 512]
    - [140, 1.415]
  - - [256, 512, 1, 4096, 256, 256, 4096, 512]
    - [138, 1.664]
  - - [256, 512, 1, 8192, 256, 256, 8192, 512]
    - [29, 1.834]
  - - [256, 1024, 1, 128, 256, 256, 128, 1024]
    - [135, 0.539]
  - - [256, 1024, 1, 256, 256, 256, 256, 1024]
    - [135, 0.938]
  - - [256, 1024, 1, 512, 256, 256, 512, 1024]
    - [170, 1.497]
  - - [256, 1024, 1, 1024, 256, 256, 1024, 1024]
    - [171, 2.148]
  - - [256, 1024, 1, 2048, 256, 256, 2048, 1024]
    - [133, 2.808]
  - - [256, 1024, 1, 4096, 256, 256, 4096, 1024]
    - [136, 3.355]
  - - [256, 1024, 1, 8192, 256, 256, 8192, 1024]
    - [133, 3.729]
  - - [256, 2048, 1, 128, 256, 256, 128, 2048]
    - [125, 0.987]
  - - [256, 2048, 1, 256, 256, 256, 256, 2048]
    - [159, 1.695]
  - - [256, 2048, 1, 512, 256, 256, 512, 2048]
    - [162, 2.672]
  - - [256, 2048, 1, 1024, 256, 256, 1024, 2048]
    - [117, 3.731]
  - - [256, 2048, 1, 2048, 256, 256, 2048, 2048]
    - [117, 4.577]
  - - [256, 2048, 1, 4096, 256, 256, 4096, 2048]
    - [117, 5.206]
  - - [256, 2048, 1, 8192, 256, 256, 8192, 2048]
    - [26, 5.285]
  - - [256, 4096, 1, 128, 256, 256, 128, 4096]
    - [106, 1.804]
  - - [256, 4096, 1, 256, 256, 256, 256, 4096]
    - [107, 2.992]
  - - [256, 4096, 1, 512, 256, 256, 512, 4096]
    - [151, 4.576]
  - - [256, 4096, 1, 1024, 256, 256, 1024, 4096]
    - [151, 6.244]
  - - [256, 4096, 1, 2048, 256, 256, 2048, 4096]
    - [151, 7.922]
  - - [256, 4096, 1, 4096, 256, 256, 4096, 4096]
    - [152, 8.007]
  - - [256, 4096, 1, 8192, 256, 256, 8192, 4096]
    - [24, 8.724]
  - - [256, 8192, 1, 128, 256, 256, 128, 8192]
    - [69, 3.05]
  - - [256, 8192, 1, 256, 256, 256, 256, 8192]
    - [83, 4.871]
  - - [256, 8192, 1, 512, 256, 256, 512, 8192]
    - [96, 7.122]
  - - [256, 8192, 1, 1024, 256, 256, 1024, 8192]
    - [92, 9.304]
  - - [256, 8192, 1, 2048, 256, 256, 2048, 8192]
    - [93, 11.322]
  - - [256, 8192, 1, 4096, 256, 256, 4096, 8192]
    - [84, 14.087]
  - - [256, 8192, 1, 8192, 256, 256, 8192, 8192]
    - [94, 15.291]
  - - [512, 128, 1, 128, 512, 512, 128, 128]
    - [129, 0.15]
  - - [512, 128, 1, 256, 512, 512, 256, 128]
    - [166, 0.263]
  - - [512, 128, 1, 512, 512, 512, 512, 128]
    - [171, 0.433]
  - - [512, 128, 1, 1024, 512, 512, 1024, 128]
    - [171, 0.685]
  - - [512, 128, 1, 2048, 512, 512, 2048, 128]
    - [171, 0.968]
  - - [512, 128, 1, 4096, 512, 512, 4096, 128]
    - [166, 1.18]
  - - [512, 128, 1, 8192, 512, 512, 8192, 128]
    - [171, 1.348]
  - - [512, 256, 1, 128, 512, 512, 128, 256]
    - [53, 0.282]
  - - [512, 256, 1, 256, 512, 512, 256, 256]
    - [132, 0.477]
  - - [512, 256, 1, 512, 512, 512, 512, 256]
    - [174, 0.778]
  - - [512, 256, 1, 1024, 512, 512, 1024, 256]
    - [174, 1.158]
  - - [512, 256, 1, 2048, 512, 512, 2048, 256]
    - [139, 1.45]
  - - [512, 256, 1, 4096, 512, 512, 4096, 256]
    - [142, 1.705]
  - - [512, 256, 1, 8192, 512, 512, 8192, 256]
    - [138, 1.891]
  - - [512, 512, 1, 128, 512, 512, 128, 512]
    - [130, 0.549]
  - - [512, 512, 1, 256, 512, 512, 256, 512]
    - [167, 0.951]
  - - [512, 512, 1, 512, 512, 512, 512, 512]
    - [175, 1.544]
  - - [512, 512, 1, 1024, 512, 512, 1024, 512]
    - [174, 2.26]
  - - [512, 512, 1, 2048, 512, 512, 2048, 512]
    - [143, 2.884]
  - - [512, 512, 1, 4096, 512, 512, 4096, 512]
    - [138, 3.41]
  - - [512, 512, 1, 8192, 512, 512, 8192, 512]
    - [133, 3.766]
  - - [512, 1024, 1, 128, 512, 512, 128, 1024]
    - [114, 1.022]
  - - [512, 1024, 1, 256, 512, 512, 256, 1024]
    - [161, 1.726]
  - - [512, 1024, 1, 512, 512, 512, 512, 1024]
    - [115, 2.771]
  - - [512, 1024, 1, 1024, 512, 512, 1024, 1024]
    - [121, 3.999]
  - - [512, 1024, 1, 2048, 512, 512, 2048, 1024]
    - [121, 5.077]
  - - [512, 1024, 1, 4096, 512, 512, 4096, 1024]
    - [122, 5.738]
  - - [512, 1024, 1, 8192, 512, 512, 8192, 1024]
    - [27, 6.016]
  - - [512, 2048, 1, 128, 512, 512, 128, 2048]
    - [102, 1.879]
  - - [512, 2048, 1, 256, 512, 512, 256, 2048]
    - [107, 3.12]
  - - [512, 2048, 1, 512, 512, 512, 512, 2048]
    - [152, 4.772]
  - - [512, 2048, 1, 1024, 512, 512, 1024, 2048]
    - [152, 6.486]
  - - [512, 2048, 1, 2048, 512, 512, 2048, 2048]
    - [151, 7.867]
  - - [512, 2048, 1, 4096, 512, 512, 4096, 2048]
    - [158, 8.871]
  - - [512, 2048, 1, 8192, 512, 512, 8192, 2048]
    - [25, 9.415]
  - - [512, 4096, 1, 128, 512, 512, 128, 4096]
    - [69, 3.105]
  - - [512, 4096, 1, 256, 512, 512, 256, 4096]
    - [97, 4.889]
  - - [512, 4096, 1, 512, 512, 512, 512, 4096]
    - [81, 7.148]
  - - [512, 4096, 1, 1024, 512, 512, 1024, 4096]
    - [81, 9.759]
  - - [512, 4096, 1, 2048, 512, 512, 2048, 4096]
    - [82, 12.171]
  - - [512, 4096, 1, 4096, 512, 512, 4096, 4096]
    - [94, 13.435]
  - - [512, 4096, 1, 8192, 512, 512, 8192, 4096]
    - [94, 14.745]
  - - [512, 8192, 1, 128, 512, 512, 128, 8192]
    - [67, 4.661]
  - - [512, 8192, 1, 256, 512, 512, 256, 8192]
    - [66, 6.99]
  - - [512, 8192, 1, 512, 512, 512, 512, 8192]
    - [44, 9.573]
  - - [512, 8192, 1, 1024, 512, 512, 1024, 8192]
    - [72, 12.237]
  - - [512, 8192, 1, 2048, 512, 512, 2048, 8192]
    - [78, 16.123]
  - - [512, 8192, 1, 4096, 512, 512, 4096, 8192]
    - [74, 20.341]
  - - [512, 8192, 1, 8192, 512, 512, 8192, 8192]
    - [71, 21.836]
  - - [1024, 128, 1, 128, 1024, 1024, 128, 128]
    - [137, 0.295]
  - - [1024, 128, 1, 256, 1024, 1024, 256, 128]
    - [171, 0.517]
  - - [1024, 128, 1, 512, 1024, 1024, 512, 128]
    - [171, 0.852]
  - - [1024, 128, 1, 1024, 1024, 1024, 1024, 128]
    - [173, 1.36]
  - - [1024, 128, 1, 2048, 1024, 1024, 2048, 128]
    - [173, 1.889]
  - - [1024, 128, 1, 4096, 1024, 1024, 4096, 128]
    - [171, 2.324]
  - - [1024, 128, 1, 8192, 1024, 1024, 8192, 128]
    - [173, 2.682]
  - - [1024, 256, 1, 128, 1024, 1024, 128, 256]
    - [54, 0.545]
  - - [1024, 256, 1, 256, 1024, 1024, 256, 256]
    - [172, 0.942]
  - - [1024, 256, 1, 512, 1024, 1024, 512, 256]
    - [174, 1.548]
  - - [1024, 256, 1, 1024, 1024, 1024, 1024, 256]
    - [174, 2.348]
  - - [1024, 256, 1, 2048, 1024, 1024, 2048, 256]
    - [141, 2.92]
  - - [1024, 256, 1, 4096, 1024, 1024, 4096, 256]
    - [139, 3.425]
  - - [1024, 256, 1, 8192, 1024, 1024, 8192, 256]
    - [142, 3.802]
  - - [1024, 512, 1, 128, 1024, 1024, 128, 512]
    - [126, 1.03]
  - - [1024, 512, 1, 256, 1024, 1024, 256, 512]
    - [127, 1.75]
  - - [1024, 512, 1, 512, 1024, 1024, 512, 512]
    - [120, 2.854]
  - - [1024, 512, 1, 1024, 1024, 1024, 1024, 512]
    - [121, 4.189]
  - - [1024, 512, 1, 2048, 1024, 1024, 2048, 512]
    - [121, 5.327]
  - - [1024, 512, 1, 4096, 1024, 1024, 4096, 512]
    - [121, 6.043]
  - - [1024, 512, 1, 8192, 1024, 1024, 8192, 512]
    - [26, 6.055]
  - - [1024, 1024, 1, 128, 1024, 1024, 128, 1024]
    - [104, 1.873]
  - - [1024, 1024, 1, 256, 1024, 1024, 256, 1024]
    - [107, 3.159]
  - - [1024, 1024, 1, 512, 1024, 1024, 512, 1024]
    - [156, 4.899]
  - - [1024, 1024, 1, 1024, 1024, 1024, 1024, 1024]
    - [108, 6.653]
  - - [1024, 1024, 1, 2048, 1024, 1024, 2048, 1024]
    - [155, 8.027]
  - - [1024, 1024, 1, 4096, 1024, 1024, 4096, 1024]
    - [157, 9.166]
  - - [1024, 1024, 1, 8192, 1024, 1024, 8192, 1024]
    - [33, 9.817]
  - - [1024, 2048, 1, 128, 1024, 1024, 128, 2048]
    - [69, 3.12]
  - - [1024, 2048, 1, 256, 1024, 1024, 256, 2048]
    - [98, 4.986]
  - - [1024, 2048, 1, 512, 1024, 1024, 512, 2048]
    - [81, 7.229]
  - - [1024, 2048, 1, 1024, 1024, 1024, 1024, 2048]
    - [80, 9.621]
  - - [1024, 2048, 1, 2048, 1024, 1024, 2048, 2048]
    - [83, 12.062]
  - - [1024, 2048, 1, 4096, 1024, 1024, 4096, 2048]
    - [95, 13.126]
  - - [1024, 2048, 1, 8192, 1024, 1024, 8192, 2048]
    - [94, 13.968]
  - - [1024, 4096, 1, 128, 1024, 1024, 128, 4096]
    - [145, 4.578]
  - - [1024, 4096, 1, 256, 1024, 1024, 256, 4096]
    - [147, 7.219]
  - - [1024, 4096, 1, 512, 1024, 1024, 512, 4096]
    - [44, 10.169]
  - - [1024, 4096, 1, 1024, 1024, 1024, 1024, 4096]
    - [145, 12.874]
  - - [1024, 4096, 1, 2048, 1024, 1024, 2048, 4096]
    - [70, 16.901]
  - - [1024, 4096, 1, 4096, 1024, 1024, 4096, 4096]
    - [79, 20.308]
  - - [1024, 4096, 1, 8192, 1024, 1024, 8192, 4096]
    - [71, 21.693]
  - - [1024, 8192, 1, 128, 1024, 1024, 128, 8192]
    - [65, 5.439]
  - - [1024, 8192, 1, 256, 1024, 1024, 256, 8192]
    - [9, 8.835]
  - - [1024, 8192, 1, 512, 1024, 1024, 512, 8192]
    - [10, 12.736]
  - - [1024, 8192, 1, 1024, 1024, 1024, 1024, 8192]
    - [40, 16.729]
  - - [1024, 8192, 1, 2048, 1024, 1024, 2048, 8192]
    - [60, 21.289]
  - - [1024, 8192, 1, 4096, 1024, 1024, 4096, 8192]
    - [60, 24.493]
  - - [1024, 8192, 1, 8192, 1024, 1024, 8192, 8192]
    - [60, 25.902]
  - - [2048, 128, 1, 128, 2048, 2048, 128, 128]
    - [134, 0.575]
  - - [2048, 128, 1, 256, 2048, 2048, 256, 128]
    - [176, 0.977]
  - - [2048, 128, 1, 512, 2048, 2048, 512, 128]
    - [177, 1.645]
  - - [2048, 128, 1, 1024, 2048, 2048, 1024, 128]
    - [177, 2.679]
  - - [2048, 128, 1, 2048, 2048, 2048, 2048, 128]
    - [173, 3.729]
  - - [2048, 128, 1, 4096, 2048, 2048, 4096, 128]
    - [177, 4.618]
  - - [2048, 128, 1, 8192, 2048, 2048, 8192, 128]
    - [173, 4.915]
  - - [2048, 256, 1, 128, 2048, 2048, 128, 256]
    - [119, 1.016]
  - - [2048, 256, 1, 256, 2048, 2048, 256, 256]
    - [163, 1.751]
  - - [2048, 256, 1, 512, 2048, 2048, 512, 256]
    - [128, 2.828]
  - - [2048, 256, 1, 1024, 2048, 2048, 1024, 256]
    - [164, 4.055]
  - - [2048, 256, 1, 2048, 2048, 2048, 2048, 256]
    - [123, 5.245]
  - - [2048, 256, 1, 4096, 2048, 2048, 4096, 256]
    - [128, 5.947]
  - - [2048, 256, 1, 8192, 2048, 2048, 8192, 256]
    - [26, 6.005]
  - - [2048, 512, 1, 128, 2048, 2048, 128, 512]
    - [109, 1.848]
  - - [2048, 512, 1, 256, 2048, 2048, 256, 512]
    - [110, 3.181]
  - - [2048, 512, 1, 512, 2048, 2048, 512, 512]
    - [110, 5.05]
  - - [2048, 512, 1, 1024, 2048, 2048, 1024, 512]
    - [108, 6.682]
  - - [2048, 512, 1, 2048, 2048, 2048, 2048, 512]
    - [113, 8.25]
  - - [2048, 512, 1, 4096, 2048, 2048, 4096, 512]
    - [155, 9.182]
  - - [2048, 512, 1, 8192, 2048, 2048, 8192, 512]
    - [33, 9.862]
  - - [2048, 1024, 1, 128, 2048, 2048, 128, 1024]
    - [68, 3.122]
  - - [2048, 1024, 1, 256, 2048, 2048, 256, 1024]
    - [88, 5.013]
  - - [2048, 1024, 1, 512, 2048, 2048, 512, 1024]
    - [48, 7.221]
  - - [2048, 1024, 1, 1024, 2048, 2048, 1024, 1024]
    - [46, 9.485]
  - - [2048, 1024, 1, 2048, 2048, 2048, 2048, 1024]
    - [149, 11.872]
  - - [2048, 1024, 1, 4096, 2048, 2048, 4096, 1024]
    - [91, 13.621]
  - - [2048, 1024, 1, 8192, 2048, 2048, 8192, 1024]
    - [94, 14.022]
  - - [2048, 2048, 1, 128, 2048, 2048, 128, 2048]
    - [77, 4.618]
  - - [2048, 2048, 1, 256, 2048, 2048, 256, 2048]
    - [44, 7.245]
  - - [2048, 2048, 1, 512, 2048, 2048, 512, 2048]
    - [45, 10.134]
  - - [2048, 2048, 1, 1024, 2048, 2048, 1024, 2048]
    - [147, 13.381]
  - - [2048, 2048, 1, 2048, 2048, 2048, 2048, 2048]
    - [77, 16.412]
  - - [2048, 2048, 1, 4096, 2048, 2048, 4096, 2048]
    - [75, 19.953]
  - - [2048, 2048, 1, 8192, 2048, 2048, 8192, 2048]
    - [75, 21.945]
  - - [2048, 4096, 1, 128, 2048, 2048, 128, 4096]
    - [7, 5.399]
  - - [2048, 4096, 1, 256, 2048, 2048, 256, 4096]
    - [14, 8.94]
  - - [2048, 4096, 1, 512, 2048, 2048, 512, 4096]
    - [11, 13.026]
  - - [2048, 4096, 1, 1024, 2048, 2048, 1024, 4096]
    - [43, 17.146]
  - - [2048, 4096, 1, 2048, 2048, 2048, 2048, 4096]
    - [62, 20.933]
  - - [2048, 4096, 1, 4096, 2048, 2048, 4096, 4096]
    - [63, 23.705]
  - - [2048, 4096, 1, 8192, 2048, 2048, 8192, 4096]
    - [64, 25.595]
  - - [2048, 8192, 1, 128, 2048, 2048, 128, 8192]
    - [17, 6.433]
  - - [2048, 8192, 1, 256, 2048, 2048, 256, 8192]
    - [21, 10.11]
  - - [2048, 8192, 1, 512, 2048, 2048, 512, 8192]
    - [6, 14.762]
  - - [2048, 8192, 1, 1024, 2048, 2048, 1024, 8192]
    - [34, 21.647]
  - - [2048, 8192, 1, 2048, 2048, 2048, 2048, 8192]
    - [56, 25.133]
  - - [2048, 8192, 1, 4096, 2048, 2048, 4096, 8192]
    - [58, 28.383]
  - - [2048, 8192, 1, 8192, 2048, 2048, 8192, 8192]
    - [39, 30.871]
  - - [4096, 128, 1, 128, 4096, 4096, 128, 128]
    - [117, 1.057]
  - - [4096, 128, 1, 256, 4096, 4096, 256, 128]
    - [160, 1.801]
  - - [4096, 128, 1, 512, 4096, 4096, 512, 128]
    - [118, 2.889]
  - - [4096, 128, 1, 1024, 4096, 4096, 1024, 128]
    - [164, 4.406]
  - - [4096, 128, 1, 2048, 4096, 4096, 2048, 128]
    - [164, 5.841]
  - - [4096, 128, 1, 4096, 4096, 4096, 4096, 128]
    - [163, 6.818]
  - - [4096, 128, 1, 8192, 4096, 4096, 8192, 128]
    - [163, 7.507]
  - - [4096, 256, 1, 128, 4096, 4096, 128, 256]
    - [111, 1.85]
  - - [4096, 256, 1, 256, 4096, 4096, 256, 256]
    - [113, 3.134]
  - - [4096, 256, 1, 512, 4096, 4096, 512, 256]
    - [108, 4.814]
  - - [4096, 256, 1, 1024, 4096, 4096, 1024, 256]
    - [155, 6.933]
  - - [4096, 256, 1, 2048, 4096, 4096, 2048, 256]
    - [157, 8.611]
  - - [4096, 256, 1, 4096, 4096, 4096, 4096, 256]
    - [157, 9.08]
  - - [4096, 256, 1, 8192, 4096, 4096, 8192, 256]
    - [158, 9.687]
  - - [4096, 512, 1, 128, 4096, 4096, 128, 512]
    - [49, 3.104]
  - - [4096, 512, 1, 256, 4096, 4096, 256, 512]
    - [99, 5.028]
  - - [4096, 512, 1, 512, 4096, 4096, 512, 512]
    - [85, 7.169]
  - - [4096, 512, 1, 1024, 4096, 4096, 1024, 512]
    - [90, 9.841]
  - - [4096, 512, 1, 2048, 4096, 4096, 2048, 512]
    - [91, 11.905]
  - - [4096, 512, 1, 4096, 4096, 4096, 4096, 512]
    - [95, 13.534]
  - - [4096, 512, 1, 8192, 4096, 4096, 8192, 512]
    - [86, 14.383]
  - - [4096, 1024, 1, 128, 4096, 4096, 128, 1024]
    - [73, 4.634]
  - - [4096, 1024, 1, 256, 4096, 4096, 256, 1024]
    - [146, 7.222]
  - - [4096, 1024, 1, 512, 4096, 4096, 512, 1024]
    - [147, 9.891]
  - - [4096, 1024, 1, 1024, 4096, 4096, 1024, 1024]
    - [147, 13.231]
  - - [4096, 1024, 1, 2048, 4096, 4096, 2048, 1024]
    - [77, 17.093]
  - - [4096, 1024, 1, 4096, 4096, 4096, 4096, 1024]
    - [78, 19.803]
  - - [4096, 1024, 1, 8192, 4096, 4096, 8192, 1024]
    - [79, 20.624]
  - - [4096, 2048, 1, 128, 4096, 4096, 128, 2048]
    - [19, 5.808]
  - - [4096, 2048, 1, 256, 4096, 4096, 256, 2048]
    - [15, 8.999]
  - - [4096, 2048, 1, 512, 4096, 4096, 512, 2048]
    - [13, 12.912]
  - - [4096, 2048, 1, 1024, 4096, 4096, 1024, 2048]
    - [41, 17.396]
  - - [4096, 2048, 1, 2048, 4096, 4096, 2048, 2048]
    - [61, 20.27]
  - - [4096, 2048, 1, 4096, 4096, 4096, 4096, 2048]
    - [63, 22.91]
  - - [4096, 2048, 1, 8192, 4096, 4096, 8192, 2048]
    - [32, 24.268]
  - - [4096, 4096, 1, 128, 4096, 4096, 128, 4096]
    - [18, 6.47]
  - - [4096, 4096, 1, 256, 4096, 4096, 256, 4096]
    - [16, 10.176]
  - - [4096, 4096, 1, 512, 4096, 4096, 512, 4096]
    - [4, 15.106]
  - - [4096, 4096, 1, 1024, 4096, 4096, 1024, 4096]
    - [37, 21.708]
  - - [4096, 4096, 1, 2048, 4096, 4096, 2048, 4096]
    - [56, 25.387]
  - - [4096, 8192, 1, 128, 4096, 4096, 128, 8192]
    - [18, 7.272]
  - - [4096, 8192, 1, 256, 4096, 4096, 256, 8192]
    - [3, 12.279]
  - - [4096, 8192, 1, 512, 4096, 4096, 512, 8192]
    - [8, 18.564]
  - - [4096, 8192, 1, 1024, 4096, 4096, 1024, 8192]
    - [37, 24.581]
  - - [4096, 8192, 1, 2048, 4096, 4096, 2048, 8192]
    - [56, 28.808]
  - - [8192, 128, 1, 128, 8192, 8192, 128, 128]
    - [105, 1.839]
  - - [8192, 128, 1, 256, 8192, 8192, 256, 128]
    - [158, 3.074]
  - - [8192, 128, 1, 512, 8192, 8192, 512, 128]
    - [154, 4.625]
  - - [8192, 128, 1, 1024, 8192, 8192, 1024, 128]
    - [112, 6.494]
  - - [8192, 128, 1, 2048, 8192, 8192, 2048, 128]
    - [153, 7.692]
  - - [8192, 128, 1, 4096, 8192, 8192, 4096, 128]
    - [154, 9.679]
  - - [8192, 128, 1, 8192, 8192, 8192, 8192, 128]
    - [158, 11.31]
  - - [8192, 256, 1, 128, 8192, 8192, 128, 256]
    - [47, 3.098]
  - - [8192, 256, 1, 256, 8192, 8192, 256, 256]
    - [100, 4.883]
  - - [8192, 256, 1, 512, 8192, 8192, 512, 256]
    - [85, 7.093]
  - - [8192, 256, 1, 1024, 8192, 8192, 1024, 256]
    - [89, 9.025]
  - - [8192, 256, 1, 2048, 8192, 8192, 2048, 256]
    - [87, 11.495]
  - - [8192, 256, 1, 4096, 8192, 8192, 4096, 256]
    - [93, 13.266]
  - - [8192, 256, 1, 8192, 8192, 8192, 8192, 256]
    - [95, 14.079]
  - - [8192, 512, 1, 128, 8192, 8192, 128, 512]
    - [147, 4.597]
  - - [8192, 512, 1, 256, 8192, 8192, 256, 512]
    - [146, 6.988]
  - - [8192, 512, 1, 512, 8192, 8192, 512, 512]
    - [76, 9.508]
  - - [8192, 512, 1, 1024, 8192, 8192, 1024, 512]
    - [146, 12.742]
  - - [8192, 512, 1, 2048, 8192, 8192, 2048, 512]
    - [79, 16.791]
  - - [8192, 512, 1, 4096, 8192, 8192, 4096, 512]
    - [78, 19.566]
  - - [8192, 512, 1, 8192, 8192, 8192, 8192, 512]
    - [148, 19.997]
  - - [8192, 1024, 1, 128, 8192, 8192, 128, 1024]
    - [22, 5.542]
  - - [8192, 1024, 1, 256, 8192, 8192, 256, 1024]
    - [11, 8.87]
  - - [8192, 1024, 1, 512, 8192, 8192, 512, 1024]
    - [12, 12.769]
  - - [8192, 1024, 1, 1024, 8192, 8192, 1024, 1024]
    - [42, 17.039]
  - - [8192, 1024, 1, 2048, 8192, 8192, 2048, 1024]
    - [64, 19.83]
  - - [8192, 1024, 1, 4096, 8192, 8192, 4096, 1024]
    - [62, 21.764]
  - - [8192, 1024, 1, 8192, 8192, 8192, 8192, 1024]
    - [64, 23.172]
  - - [8192, 2048, 1, 128, 8192, 8192, 128, 2048]
    - [20, 6.772]
  - - [8192, 2048, 1, 256, 8192, 8192, 256, 2048]
    - [5, 9.826]
  - - [8192, 2048, 1, 512, 8192, 8192, 512, 2048]
    - [1, 14.759]
  - - [8192, 2048, 1, 1024, 8192, 8192, 1024, 2048]
    - [35, 20.742]
  - - [8192, 2048, 1, 2048, 8192, 8192, 2048, 2048]
    - [55, 24.595]
  - - [8192, 2048, 1, 4096, 8192, 8192, 4096, 2048]
    - [37, 27.135]
  - - [8192, 2048, 1, 8192, 8192, 8192, 8192, 2048]
    - [37, 29.808]
  - - [8192, 4096, 1, 128, 8192, 8192, 128, 4096]
    - [23, 7.199]
  - - [8192, 4096, 1, 256, 8192, 8192, 256, 4096]
    - [8, 12.135]
  - - [8192, 4096, 1, 512, 8192, 8192, 512, 4096]
    - [38, 18.163]
  - - [8192, 4096, 1, 1024, 8192, 8192, 1024, 4096]
    - [37, 24.507]
  - - [8192, 4096, 1, 2048, 8192, 8192, 2048, 4096]
    - [58, 27.633]
  - - [8192, 8192, 1, 128, 8192, 8192, 128, 8192]
    - [0, 8.382]
  - - [8192, 8192, 1, 256, 8192, 8192, 256, 8192]
    - [2, 14.067]
  - - [8192, 8192, 1, 512, 8192, 8192, 512, 8192]
    - [37, 21.195]
  - - [8192, 8192, 1, 1024, 8192, 8192, 1024, 8192]
    - [39, 26.652]
  - - [8192, 8192, 1, 2048, 8192, 8192, 2048, 8192]
    - [36, 30.207]
  - - [4096, 4096, 1, 4096, 4096, 4096, 4096, 4096]
    - [57, 28.208]
  - - [4096, 4096, 1, 8192, 4096, 4096, 8192, 4096]
    - [39, 30.967]
  - - [4096, 8192, 1, 4096, 4096, 4096, 4096, 8192]
    - [59, 31.853]
  - - [4096, 8192, 1, 8192, 4096, 4096, 8192, 8192]
    - [39, 35.87]
  - - [8192, 4096, 1, 4096, 8192, 8192, 4096, 4096]
    - [39, 31.186]
  - - [8192, 4096, 1, 8192, 8192, 8192, 8192, 4096]
    - [37, 33.565]
  - - [8192, 8192, 1, 4096, 8192, 8192, 4096, 8192]
    - [37, 34.644]
  - - [8192, 8192, 1, 8192, 8192, 8192, 8192, 8192]
    - [39, 36.666]
  - - [1, 1, 1, 32, 1, 1, 32, 1]
    - [178, 0.0]
- null
- null
- DeviceEfficiency
- GridBased
