projects/hipblaslt/library/src/amd_detail/rocblaslt/src/Tensile/Logic/asm_full/gfx950/gfx950_id75a3/Equality/gfx950_Cijk_Alik_Bljk_F8B8BS_BH_BiasSB_HAS_SAB_SAV_UserArgs.yaml
- {MinimumRequiredVersion: 5.0.0}
- gfx950
- gfx950
- [Device 75a3, Device 75a2]
    SolutionIndex: 0
    SolutionNameMin: Cijk_Alik_Bljk_F8B8BS_BH_Bias_HA_S_SAB_SAV_UserArgs_MT256x320x128_MI16x16x1_SN_LDSB0_AFC0_AG1_AFEM1_AFEM1_ASEM1_CLR1_CADS0_DTLA1_DTLB1_DTVA0_DTVB0_DTVMXSA0_DTVMXSB0_DTVSM0_DPLB0_EPS0_ELFLR0_EMLL0_FDSI0_GRPM1_GRVWA16_GRVWB16_GSU0_GSUAMB_GSUC0_GSUWGMRR0_GLS0_ISA950_IU1_K1_LDSTI0_LBSPPA1024_LBSPPB1024_LBSPPM0_LPA32_LPB32_LPM0_LRVWn1_LWPMn1_MIAV0_MIWT8_10_MO40_MGRIPM1_NTn1_NTA0_NTB0_NTC4_NTD4_NTM0_NEPBS10_NLCA1_NLCB1_ONLL0_PGR2_PLR1_PKA1_SGROB1_SIA3_SS1_SU8_SUM0_SUS128_SPO0_SRVW0_SSO0_SVW8_SK3_SKFTR0_SKXCCM0_SGRO0_TDMI0_TIN0_TLDS1_TLDSMn1_ULSGRO0_USL1_UIOFGRO0_UPLRP0_USFGRO0_VSn1_VWA8_VWB2_WSGRA0_WSGRB0_WS64_WG32_8_1_WGM16_WGMXCC2_WGMXCCGn1
    SolutionIndex: 1
    SolutionNameMin: Cijk_Alik_Bljk_F8B8BS_BH_Bias_HA_S_SAB_SAV_UserArgs_MT256x256x128_MI16x16x1_SN_LDSB0_AFC0_AG1_AFEM1_AFEM1_ASEM1_CLR1_CADS0_DTLA1_DTLB1_DTVA0_DTVB0_DTVMXSA0_DTVMXSB0_DTVSM0_DPLB0_EPS0_ELFLR0_EMLL0_FDSI0_GRPM1_GRVWA16_GRVWB16_GSU0_GSUAMB_GSUC0_GSUWGMRR0_GLS0_ISA950_IU1_K1_LDSTI0_LBSPPA1024_LBSPPB1024_LBSPPM0_LPA32_LPB32_LPM0_LRVWn1_LWPMn1_MIAV0_MIWT8_8_MO40_MGRIPM1_NTn1_NTA0_NTB0_NTC4_NTD0_NTM0_NEPBS8_NLCA1_NLCB1_ONLL0_PGR2_PLR1_PKA1_SGROB1_SIA3_SS1_SU16_SUM0_SUS512_SPO0_SRVW0_SSO1_SVW8_SK3_SKFTR0_SKXCCM0_SGRO0_TDMI0_TIN0_TLDS2_TLDSMn1_ULSGRO1_USL1_UIOFGRO0_UPLRP0_USFGRO0_VSn1_VWA8_VWB8_WSGRA0_WSGRB0_WS64_WG32_8_1_WGMn16_WGMXCC4_WGMXCCGn1
    SolutionIndex: 2
    SolutionNameMin: Cijk_Alik_Bljk_F8B8BS_BH_Bias_HA_S_SAB_SAV_UserArgs_MT256x256x128_MI16x16x1_SN_LDSB0_AFC0_AG0_AFEM1_AFEM1_ASEM1_CLR1_CADS0_DTLA1_DTLB1_DTVA0_DTVB0_DTVMXSA0_DTVMXSB0_DTVSM0_DPLB0_EPS0_ELFLR0_EMLL0_FDSI0_GRPM1_GRVWA16_GRVWB16_GSU0_GSUAMB_GSUC0_GSUWGMRR0_GLS0_ISA950_IU1_K1_LDSTI0_LBSPPA1024_LBSPPB1024_LBSPPM0_LPA32_LPB32_LPM0_LRVWn1_LWPMn1_MIAV0_MIWT8_8_MO40_MGRIPM1_NTn1_NTA0_NTB0_NTC4_NTD4_NTM0_NEPBS8_NLCA1_NLCB1_ONLL0_PGR2_PLR1_PKA1_SGROB0_SIA3_SS1_SU0_SUM0_SUS0_SPO0_SRVW0_SSO0_SVW8_SK3_SKFTR0_SKXCCM4_SGRO0_TDMI0_TIN0_TLDS1_TLDSMn1_ULSGRO0_USL1_UIOFGRO0_UPLRP0_USFGRO0_VSn1_VWA8_VWB8_WSGRA0_WSGRB0_WS64_WG32_8_1_WGM4_WGMXCC1_WGMXCCGn1
    SolutionIndex: 3
    SolutionNameMin: Cijk_Alik_Bljk_F8B8BS_BH_Bias_HA_S_SAB_SAV_UserArgs_MT288x256x128_MI16x16x1_SN_LDSB0_AFC0_AG1_AFEM1_AFEM1_ASEM1_CLR1_CADS0_DTLA1_DTLB1_DTVA0_DTVB0_DTVMXSA0_DTVMXSB0_DTVSM0_DPLB0_EPS0_ELFLR0_EMLLn1_FDSI0_GRPM1_GRVWA16_GRVWB16_GSU0_GSUAMB_GSUC0_GSUWGMRR0_GLS0_ISA950_IU1_K1_LDSTI0_LBSPPA1024_LBSPPB1024_LBSPPM0_LPA32_LPB32_LPM0_LRVWn1_LWPMn1_MIAV0_MIWT18_4_MO40_MGRIPM1_NTn1_NTA0_NTB0_NTC0_NTD0_NTM0_NEPBS10_NLCA1_NLCB1_ONLL0_PGR2_PLR1_PKA1_SGROB1_SIA3_SS0_SU0_SUM0_SUS0_SPO1_SRVW0_SSO0_SVW8_SK3_SKFTR0_SKXCCM0_SGRO0_TDMI0_TIN0_TLDS2_TLDSMn1_ULSGRO0_USL1_UIOFGRO0_UPLRP0_USFGRO0_VSn1_VWA2_VWB4_WSGRA0_WSGRB0_WS64_WG16_16_1_WGM48_WGMXCC2_WGMXCCGn1
    SolutionIndex: 4
    SolutionNameMin: Cijk_Alik_Bljk_F8B8BS_BH_Bias_HA_S_SAB_SAV_UserArgs_MT256x256x128_MI32x32x1_SN_LDSB0_AFC0_AG1_AFEM1_AFEM1_ASEM1_CLR0_CADS0_DTLA1_DTLB1_DTVA0_DTVB0_DTVMXSA0_DTVMXSB0_DTVSM0_DPLB0_EPS0_ELFLR0_EMLL0_FDSI0_GRPM1_GRVWA16_GRVWB16_GSU0_GSUAMB_GSUC0_GSUWGMRR0_GLS0_ISA950_IU1_K1_LDSTI0_LBSPPA1024_LBSPPB1024_LBSPPM0_LPA32_LPB32_LPM0_LRVWn1_LWPMn1_MIAV0_MIWT4_4_MO40_MGRIPM1_NTn1_NTA0_NTB0_NTC0_NTD0_NTM0_NEPBS16_NLCA1_NLCB1_ONLL0_PGR2_PLR1_PKA1_SGROB1_SIA3_SS1_SU0_SUM0_SUS0_SPO1_SRVW0_SSO0_SVW4_SK3_SKFTR0_SKXCCM4_SGRO0_TDMI0_TIN1_TLDS1_TLDSMn1_ULSGRO0_USL1_UIOFGRO0_UPLRP0_USFGRO0_VSn1_VWA4_VWB4_WSGRA0_WSGRB0_WS64_WG64_4_1_WGMn2_WGMXCC32_WGMXCCGn1
    SolutionIndex: 5
    SolutionNameMin: Cijk_Alik_Bljk_F8B8BS_BH_Bias_HA_S_SAB_SAV_UserArgs_MT256x256x128_MI32x32x1_SN_LDSB0_AFC0_AG0_AFEM1_AFEM1_ASEM1_CLR1_CADS0_DTLA0_DTLB0_DTVA0_DTVB0_DTVMXSA0_DTVMXSB0_DTVSM0_DPLB0_EPS0_ELFLR0_EMLL0_FDSI0_GRPM1_GRVWA16_GRVWB16_GSU0_GSUAMB_GSUC0_GSUWGMRR0_GLS0_ISA950_IU1_K1_LDSTI0_LBSPPA1024_LBSPPB256_LBSPPM0_LPA16_LPB16_LPM0_LRVWn1_LWPMn1_MIAV0_MIWT8_2_MO40_MGRIPM1_NTn1_NTA0_NTB0_NTC4_NTD0_NTM0_NEPBS10_NLCA1_NLCB1_ONLL0_PGR2_PLR1_PKA1_SGROB0_SIA3_SS1_SU0_SUM0_SUS0_SPO0_SRVW0_SSO4_SVW8_SK3_SKFTR0_SKXCCM0_SGRO0_TDMI0_TIN1_TLDS2_TLDSMn1_ULSGRO0_USL1_UIOFGRO0_UPLRP0_USFGRO1_VSn1_VWA8_VWB2_WSGRA0_WSGRB0_WS64_WG32_8_1_WGM24_WGMXCC2_WGMXCCGn1
    SolutionIndex: 6
    SolutionNameMin: Cijk_Alik_Bljk_F8B8BS_BH_Bias_HA_S_SAB_SAV_UserArgs_MT256x256x128_MI16x16x1_SN_LDSB0_AFC0_AG1_AFEM1_AFEM1_ASEM1_CLR1_CADS0_DTLA1_DTLB1_DTVA0_DTVB0_DTVMXSA0_DTVMXSB0_DTVSM0_DPLB0_EPS0_ELFLR0_EMLLn1_FDSI0_GRPM1_GRVWA16_GRVWB16_GSU0_GSUAMB_GSUC0_GSUWGMRR0_GLS0_ISA950_IU1_K1_LDSTI0_LBSPPA1024_LBSPPB1024_LBSPPM0_LPA32_LPB32_LPM0_LRVWn1_LWPMn1_MIAV0_MIWT8_8_MO40_MGRIPM1_NTn1_NTA0_NTB0_NTC4_NTD0_NTM0_NEPBS12_NLCA1_NLCB1_ONLL0_PGR2_PLR1_PKA1_SGROB1_SIA3_SS1_SU0_SUM0_SUS0_SPO0_SRVW0_SSO0_SVW8_SK3_SKFTR0_SKXCCM4_SGRO0_TDMI0_TIN0_TLDS1_TLDSMn1_ULSGRO1_USL1_UIOFGRO0_UPLRP0_USFGRO0_VSn1_VWA8_VWB8_WSGRA0_WSGRB0_WS64_WG32_8_1_WGM32_WGMXCC8_WGMXCCGn1
    SolutionIndex: 7
    SolutionNameMin: Cijk_Alik_Bljk_F8B8BS_BH_Bias_HA_S_SAB_SAV_UserArgs_MT256x256x128_MI32x32x1_SN_LDSB0_AFC0_AG0_AFEM1_AFEM1_ASEM1_CLR1_CADS0_DTLA0_DTLB0_DTVA0_DTVB0_DTVMXSA0_DTVMXSB0_DTVSM0_DPLB0_EPS0_ELFLR0_EMLLn1_FDSI0_GRPM1_GRVWA16_GRVWB16_GSU0_GSUAMB_GSUC0_GSUWGMRR0_GLS0_ISA950_IU1_K1_LDSTI0_LBSPPA1024_LBSPPB256_LBSPPM0_LPA16_LPB16_LPM0_LRVWn1_LWPMn1_MIAV0_MIWT8_2_MO40_MGRIPM1_NTn1_NTA0_NTB0_NTC4_NTD4_NTM0_NEPBS16_NLCA1_NLCB1_ONLL0_PGR2_PLR1_PKA1_SGROB0_SIA3_SS1_SU0_SUM0_SUS0_SPO1_SRVW0_SSO1_SVW8_SK3_SKFTR0_SKXCCM0_SGRO0_TDMI0_TIN1_TLDS1_TLDSMn1_ULSGRO1_USL1_UIOFGRO0_UPLRP0_USFGRO1_VSn1_VWA8_VWB2_WSGRA0_WSGRB2_WS64_WG32_8_1_WGMn1_WGMXCC8_WGMXCCGn1
    SolutionIndex: 8
    SolutionNameMin: Cijk_Alik_Bljk_F8B8BS_BH_Bias_HA_S_SAB_SAV_UserArgs_MT256x256x128_MI32x32x1_SN_LDSB0_AFC0_AG1_AFEM1_AFEM1_ASEM1_CLR0_CADS0_DTLA0_DTLB0_DTVA0_DTVB0_DTVMXSA0_DTVMXSB0_DTVSM0_DPLB0_EPS0_ELFLR0_EMLLn1_FDSI0_GRPM1_GRVWA16_GRVWB16_GSU0_GSUAMB_GSUC0_GSUWGMRR0_GLS0_ISA950_IU1_K1_LDSTI0_LBSPPA512_LBSPPB512_LBSPPM0_LPA16_LPB16_LPM0_LRVWn1_LWPMn1_MIAV0_MIWT4_4_MO40_MGRIPM1_NTn1_NTA0_NTB0_NTC0_NTD0_NTM0_NEPBS12_NLCA1_NLCB1_ONLL0_PGR2_PLR1_PKA1_SGROB0_SIA3_SS1_SU16_SUM0_SUS512_SPO0_SRVW0_SSO0_SVW4_SK3_SKFTR0_SKXCCM4_SGRO0_TDMI0_TIN0_TLDS1_TLDSMn1_ULSGRO0_USL1_UIOFGRO0_UPLRP0_USFGRO0_VSn1_VWA4_VWB4_WSGRA0_WSGRB0_WS64_WG64_4_1_WGM4_WGMXCC2_WGMXCCGn1
    SolutionIndex: 9
    SolutionNameMin: Cijk_Alik_Bljk_F8B8BS_BH_Bias_HA_S_SAB_SAV_UserArgs_MT256x256x128_MI16x16x1_SN_LDSB0_AFC0_AG0_AFEM1_AFEM1_ASEM1_CLR1_CADS0_DTLA1_DTLB1_DTVA0_DTVB0_DTVMXSA0_DTVMXSB0_DTVSM0_DPLB0_EPS0_ELFLR0_EMLLn1_FDSI0_GRPM1_GRVWA16_GRVWB16_GSU0_GSUAMB_GSUC0_GSUWGMRR0_GLS0_ISA950_IU1_K1_LDSTI0_LBSPPA1024_LBSPPB1024_LBSPPM0_LPA32_LPB32_LPM0_LRVWn1_LWPMn1_MIAV0_MIWT8_8_MO40_MGRIPM1_NTn1_NTA0_NTB0_NTC4_NTD4_NTM0_NEPBS0_NLCA1_NLCB1_ONLL0_PGR2_PLR1_PKA1_SGROB1_SIA3_SS1_SU16_SUM0_SUS128_SPO0_SRVW0_SSO1_SVW8_SK3_SKFTR0_SKXCCM0_SGRO0_TDMI0_TIN0_TLDS2_TLDSMn1_ULSGRO1_USL1_UIOFGRO0_UPLRP0_USFGRO0_VSn1_VWA8_VWB8_WSGRA0_WSGRB0_WS64_WG32_8_1_WGMn16_WGMXCC32_WGMXCCGn1
    SolutionIndex: 10
    SolutionNameMin: Cijk_Alik_Bljk_F8B8BS_BH_Bias_HA_S_SAB_SAV_UserArgs_MT256x320x128_MI16x16x1_SN_LDSB0_AFC0_AG0_AFEM1_AFEM1_ASEM1_CLR1_CADS0_DTLA1_DTLB1_DTVA0_DTVB0_DTVMXSA0_DTVMXSB0_DTVSM0_DPLB0_EPS0_ELFLR0_EMLL0_FDSI0_GRPM1_GRVWA16_GRVWB16_GSU0_GSUAMB_GSUC0_GSUWGMRR0_GLS0_ISA950_IU1_K1_LDSTI0_LBSPPA1024_LBSPPB1024_LBSPPM0_LPA32_LPB32_LPM0_LRVWn1_LWPMn1_MIAV0_MIWT8_10_MO40_MGRIPM1_NTn1_NTA0_NTB0_NTC4_NTD4_NTM0_NEPBS0_NLCA1_NLCB1_ONLL0_PGR2_PLR1_PKA1_SGROB0_SIA3_SS1_SU8_SUM0_SUS256_SPO1_SRVW0_SSO0_SVW8_SK3_SKFTR0_SKXCCM0_SGRO0_TDMI0_TIN0_TLDS1_TLDSMn1_ULSGRO1_USL1_UIOFGRO0_UPLRP0_USFGRO0_VSn1_VWA8_VWB2_WSGRA0_WSGRB0_WS64_WG32_8_1_WGM8_WGMXCC4_WGMXCCGn1
    SolutionIndex: 11
    SolutionNameMin: Cijk_Alik_Bljk_F8B8BS_BH_Bias_HA_S_SAB_SAV_UserArgs_MT256x256x128_MI16x16x1_SN_LDSB0_AFC0_AG1_AFEM1_AFEM1_ASEM1_CLR1_CADS0_DTLA1_DTLB1_DTVA0_DTVB0_DTVMXSA0_DTVMXSB0_DTVSM0_DPLB0_EPS0_ELFLR0_EMLLn1_FDSI0_GRPM1_GRVWA16_GRVWB16_GSU0_GSUAMB_GSUC0_GSUWGMRR0_GLS0_ISA950_IU1_K1_LDSTI0_LBSPPA1024_LBSPPB1024_LBSPPM0_LPA32_LPB32_LPM0_LRVWn1_LWPMn1_MIAV0_MIWT8_8_MO40_MGRIPM1_NTn1_NTA0_NTB0_NTC4_NTD0_NTM0_NEPBS12_NLCA1_NLCB1_ONLL0_PGR2_PLR1_PKA1_SGROB1_SIA3_SS1_SU8_SUM0_SUS256_SPO1_SRVW0_SSO1_SVW8_SK3_SKFTR0_SKXCCM4_SGRO0_TDMI0_TIN0_TLDS2_TLDSMn1_ULSGRO1_USL1_UIOFGRO0_UPLRP0_USFGRO0_VSn1_VWA8_VWB8_WSGRA0_WSGRB0_WS64_WG32_8_1_WGM16_WGMXCC1_WGMXCCGn1
    SolutionIndex: 12
    SolutionNameMin: Cijk_Alik_Bljk_F8B8BS_BH_Bias_HA_S_SAB_SAV_UserArgs_MT256x256x128_MI32x32x1_SN_LDSB0_AFC0_AG0_AFEM1_AFEM1_ASEM1_CLR0_CADS0_DTLA0_DTLB0_DTVA0_DTVB0_DTVMXSA0_DTVMXSB0_DTVSM0_DPLB0_EPS0_ELFLR0_EMLL0_FDSI0_GRPM1_GRVWA16_GRVWB16_GSU0_GSUAMB_GSUC0_GSUWGMRR0_GLS0_ISA950_IU1_K1_LDSTI0_LBSPPA1024_LBSPPB256_LBSPPM0_LPA16_LPB16_LPM0_LRVWn1_LWPMn1_MIAV0_MIWT8_2_MO40_MGRIPM1_NTn1_NTA0_NTB0_NTC4_NTD4_NTM0_NEPBS12_NLCA1_NLCB1_ONLL0_PGR2_PLR1_PKA1_SGROB0_SIA3_SS1_SU0_SUM0_SUS0_SPO1_SRVW0_SSO0_SVW8_SK3_SKFTR0_SKXCCM0_SGRO0_TDMI0_TIN1_TLDS1_TLDSMn1_ULSGRO0_USL1_UIOFGRO0_UPLRP0_USFGRO1_VSn1_VWA8_VWB2_WSGRA2_WSGRB2_WS64_WG32_8_1_WGM8_WGMXCC4_WGMXCCGn1
    SolutionIndex: 13
    SolutionNameMin: Cijk_Alik_Bljk_F8B8BS_BH_Bias_HA_S_SAB_SAV_UserArgs_MT256x256x128_MI16x16x1_CMS_SN_LDSB0_AFC0_AG0_AFEM1_AFEM1_ASEM1_CLR1_CADS0_DTLA1_DTLB1_DTVA0_DTVB0_DTVMXSA0_DTVMXSB0_DTVSM0_DPLB0_EPS0_ELFLR0_EMLLn1_FDSI0_GRPM1_GRVWA16_GRVWB16_GSU0_GSUAMB_GSUC0_GSUWGMRR0_GLS0_ISA950_IU1_K1_LDSTI0_LBSPPA1024_LBSPPB1024_LBSPPM0_LPA32_LPB32_LPM0_LRVW16_LWPMn1_MIAV0_MIWT8_8_MO40_MGRIPM1_NTn1_NTA0_NTB0_NTC0_NTD4_NTM0_NEPBS0_NLCA1_NLCB1_ONLL0_PGR2_PLR0_PKA1_SGROB0_SIA3_SS1_SU0_SUM0_SUS0_SPO0_SRVW0_SSO0_SVW8_SK3_SKFTR0_SKXCCM0_SGRO0_TDMI0_TIN0_TLDS1_TLDSM1_ULSGRO0_USL1_UIOFGRO0_UPLRP0_USFGRO0_VSn1_VWA8_VWB8_WSGRA0_WSGRB0_WS64_WG32_8_1_WGM16_WGMXCC2_WGMXCCGn1
- - - [8192, 81920, 1, 28672]
    - [0, 3361000.0]
  - - [28672, 8192, 1, 81920]
    - [1, 3453130.0]
  - - [2048, 30720, 8, 1408]
    - [2, 1621540.0]
  - - [1408, 30720, 8, 2048]
    - [3, 1468270.0]
  - - [768, 16384, 16, 2048]
    - [13, 0.0]
  - - [4096, 4096, 1, 45056]
    - [13, 0.0]
  - - [4096, 2048, 1, 32768]
    - [4, 2038630.0]
  - - [2048, 32768, 1, 10944]
    - [5, 1437820.0]
  - - [28672, 81920, 1, 8192]
    - [6, 3157380.0]
  - - [2816, 32768, 1, 2048]
    - [7, 1522850.0]
  - - [2048, 2048, 1, 32768]
    - [8, 1660370.0]
  - - [8192, 8192, 1, 81920]
    - [9, 3468520.0]
  - - [65536, 8192, 4, 2048]
    - [10, 2211840.0]
  - - [65536, 2048, 4, 8192]
    - [11, 2973400.0]
  - - [8192, 4096, 11, 4096]
    - [12, 1507630.0]
  - - [2048, 16384, 16, 768]
    - [13, 0.0]
  - - [4096, 90112, 1, 14336]
    - [13, 0.0]
  - - [4096, 45056, 1, 4096]
    - [13, 0.0]
  - - [30720, 2048, 1, 4096]
    - [13, 0.0]
  - - [2048, 16384, 1, 768]
    - [13, 0.0]
  - - [768, 16384, 1, 2048]
    - [13, 0.0]
  - - [10944, 32768, 1, 2048]
    - [13, 0.0]
  - - [2048, 32768, 1, 2048]
    - [13, 0.0]
  - - [8192, 81920, 1, 8192]
    - [13, 0.0]
  - - [30720, 2048, 8, 4096]
    - [13, 0.0]
- null
- null
- DeviceEfficiency
- Equality
