projects/hipblaslt/library/src/amd_detail/rocblaslt/src/Tensile/Logic/asm_full/gfx950/gfx950_id75a3/Equality/gfx950_Cijk_Alik_Bljk_F8BS_BH_SAB_UserArgs.yaml
- {MinimumRequiredVersion: 5.0.0}
- gfx950
- gfx950
- [Device 75a3, Device 75a2]
    SolutionIndex: 0
    SolutionNameMin: Custom_Cijk_Alik_Bljk_F8BS_BH_SAB_UserArgs_shortname0_gfx950
    SolutionIndex: 1
    SolutionNameMin: Custom_Cijk_Alik_Bljk_F8BS_BH_SAB_NTD_UserArgs_shortname0_gfx950
    SolutionIndex: 2
    SolutionNameMin: Custom_Cijk_Alik_Bljk_F8BS_BH_SAB_NTD_UserArgs_shortname0_gfx950
    SolutionIndex: 3
    SolutionNameMin: Custom_Cijk_Alik_Bljk_F8BS_BH_SAB_NTD_UserArgs_shortname1_gfx950
    SolutionIndex: 4
    SolutionNameMin: Custom_Cijk_Alik_Bljk_F8BS_BH_SAB_NTD_UserArgs_shortname0_gfx950
- - - [28672, 49152, 1, 8192]
    - [3, 0]
  - - [8192, 28672, 1, 49152]
    - [3, 0]
  - - [8192, 49152, 1, 28672]
    - [1, 0]
  - - [8192, 49152, 1, 8192]
    - [2, 0]
  - - [28672, 8192, 1, 49152]
    - [3, 0]
  - - [8192, 8192, 1, 49152]
    - [3, 0]
  - - [1024, 49152, 1, 8192]
    - [4, 0]
  - - [57344, 32768, 1, 8192]
    - [3, 0]
  - - [8192, 57344, 1, 32768]
    - [4, 0]
  - - [8192, 32768, 1, 57344]
    - [1, 0]
  - - [8192, 32768, 1, 28672]
    - [1, 0]
  - - [28672, 32768, 1, 8192]
    - [1, 0]
  - - [10240, 32768, 1, 8192]
    - [1, 0]
  - - [28672, 8192, 1, 32768]
    - [0, 0]
  - - [8192, 32768, 1, 8192]
    - [1, 0]
  - - [8192, 10240, 1, 32768]
    - [4, 0]
  - - [8192, 32768, 1, 10240]
    - [1, 0]
  - - [8192, 8192, 1, 32768]
    - [1, 0]
  - - [4096, 4096, 1, 16384]
    - [1, 0]
  - - [8192, 8192, 1, 16384]
    - [3, 0]
  - - [57344, 8192, 1, 8192]
    - [3, 0]
  - - [8192, 8192, 1, 57344]
    - [3, 0]
  - - [8192, 8192, 1, 28672]
    - [1, 0]
  - - [28672, 8192, 1, 8192]
    - [3, 0]
  - - [8192, 8192, 1, 8192]
    - [3, 0]
  - - [8192, 8192, 1, 10240]
    - [2, 0]
  - - [10240, 8192, 1, 8192]
    - [3, 0]
  - - [4096, 28672, 1, 32768]
    - [2, 0]
  - - [4096, 32768, 1, 28672]
    - [2, 0]
  - - [14336, 4096, 1, 32768]
    - [1, 0]
  - - [14336, 32768, 1, 4096]
    - [1, 0]
  - - [4096, 32768, 1, 6144]
    - [2, 0]
  - - [4096, 4096, 1, 32768]
    - [2, 0]
  - - [4096, 65536, 1, 4096]
    - [2, 0]
  - - [2048, 65536, 1, 4096]
    - [4, 0]
  - - [14336, 65536, 1, 4096]
    - [1, 0]
  - - [4096, 65536, 1, 14336]
    - [2, 0]
  - - [14336, 4096, 1, 49152]
    - [0, 0]
  - - [14336, 49152, 1, 4096]
    - [1, 0]
  - - [28672, 49152, 1, 4096]
    - [1, 0]
  - - [4096, 28672, 1, 49152]
    - [0, 0]
  - - [4096, 4096, 1, 49152]
    - [2, 0]
  - - [4096, 49152, 1, 14336]
    - [2, 0]
  - - [4096, 49152, 1, 28672]
    - [4, 0]
  - - [4096, 49152, 1, 4096]
    - [1, 0]
  - - [4096, 49152, 1, 6144]
    - [2, 0]
  - - [6144, 49152, 1, 4096]
    - [1, 0]
- null
- null
- DeviceEfficiency
- Equality
