projects/hipsparselt/library/src/hcc_detail/rocsparselt/src/spmm/Tensile/Logic/asm_full/gfx950/Gridbased/gfx950_Cijk_Alik_Bljk_I8BS_BH_Bias_FDMN_SPA_AS_SAV.yaml
- {MinimumRequiredVersion: 4.33.0}
- gfx950
- gfx950
- [Device 0058]
    SolutionIndex: 0
    SolutionNameMin: Cijk_Alik_Bljk_I8BS_BH_Bias_FDMN_SPA_AS_SAV_MT128x128x128_MI16x16x1_SN_LDSB1_CLR1_GRVWA16_GRVWB16_GSU1_GSUC0_GSUWGMRR0_K1_LBSPPB128_LPA16_LPB32_LPM4_MIWT2_4_PLR0_SU32_SUM0_SUS256_WG64_8_1_WGM16_WGMXCC1_WGMXCCGn1
    SolutionIndex: 1
    SolutionNameMin: Cijk_Alik_Bljk_I8BS_BH_Bias_FDMN_SPA_AS_SAV_MT128x128x128_MI16x16x1_SN_LDSB1_CLR0_GRVWA16_GRVWB16_GSU1_GSUC0_GSUWGMRR0_K1_LBSPPB128_LPA16_LPB32_LPM4_MIWT2_4_PLR0_SU32_SUM0_SUS256_WG64_8_1_WGM16_WGMXCC1_WGMXCCGn1
    SolutionIndex: 2
    SolutionNameMin: Cijk_Alik_Bljk_I8BS_BH_Bias_FDMN_SPA_AS_SAV_MT64x192x128_MI32x32x1_SN_LDSB1_CLR1_GRVWA16_GRVWB16_GSU1_GSUC0_GSUWGMRR0_K1_LBSPPB128_LPA16_LPB16_LPM4_MIWT1_3_PLR0_SU32_SUM0_SUS256_WG64_4_1_WGM8_WGMXCC1_WGMXCCGn1
    SolutionIndex: 3
    SolutionNameMin: Cijk_Alik_Bljk_I8BS_BH_Bias_FDMN_SPA_AS_SAV_MT64x192x128_MI32x32x1_SN_LDSB1_CLR1_GRVWA16_GRVWB16_GSU1_GSUC0_GSUWGMRR0_K1_LBSPPB128_LPA16_LPB16_LPM4_MIWT1_3_PLR0_SU32_SUM0_SUS256_WG64_4_1_WGM16_WGMXCC1_WGMXCCGn1
    SolutionIndex: 4
    SolutionNameMin: Cijk_Alik_Bljk_I8BS_BH_Bias_FDMN_SPA_AS_SAV_MT16x16x256_MI16x16x1_SN_LDSB0_CLR0_GRVWA16_GRVWB16_GSU1_GSUC0_GSUWGMRR0_K1_LBSPPB256_LPA16_LPB32_LPM4_MIWT1_1_PLR0_SU32_SUM0_SUS256_WG16_4_1_WGM0_WGMXCC1_WGMXCCGn1
    SolutionIndex: 5
    SolutionNameMin: Cijk_Alik_Bljk_I8BS_BH_Bias_FDMN_SPA_AS_SAV_MT16x16x256_MI16x16x1_SN_LDSB0_CLR1_GRVWA16_GRVWB16_GSU2_GSUC0_GSUWGMRR0_K1_LBSPPB256_LPA16_LPB32_LPM4_MIWT1_1_PLR0_SU32_SUM0_SUS256_WG16_4_1_WGM0_WGMXCC1_WGMXCCGn1
    SolutionIndex: 6
    SolutionNameMin: Cijk_Alik_Bljk_I8BS_BH_Bias_FDMN_SPA_AS_SAV_MT32x96x256_MI16x16x1_SN_LDSB1_CLR1_GRVWA16_GRVWB16_GSU1_GSUC0_GSUWGMRR0_K1_LBSPPB256_LPA16_LPB32_LPM4_MIWT1_3_PLR0_SU32_SUM0_SUS256_WG32_8_1_WGM8_WGMXCC1_WGMXCCGn1
    SolutionIndex: 7
    SolutionNameMin: Cijk_Alik_Bljk_I8BS_BH_Bias_FDMN_SPA_AS_SAV_MT64x192x256_MI32x32x1_SN_LDSB1_CLR1_GRVWA16_GRVWB16_GSU1_GSUC0_GSUWGMRR0_K1_LBSPPB256_LPA16_LPB16_LPM4_MIWT1_3_PLR1_SU32_SUM0_SUS256_WG64_4_1_WGM8_WGMXCC1_WGMXCCGn1
    SolutionIndex: 8
    SolutionNameMin: Cijk_Alik_Bljk_I8BS_BH_Bias_FDMN_SPA_AS_SAV_MT64x192x256_MI32x32x1_SN_LDSB1_CLR1_GRVWA16_GRVWB16_GSU1_GSUC0_GSUWGMRR0_K1_LBSPPB256_LPA16_LPB16_LPM4_MIWT1_3_PLR1_SU32_SUM0_SUS256_WG64_4_1_WGM16_WGMXCC1_WGMXCCGn1
    SolutionIndex: 9
    SolutionNameMin: Cijk_Alik_Bljk_I8BS_BH_Bias_FDMN_SPA_AS_SAV_MT64x192x256_MI32x32x1_SN_LDSB1_CLR1_GRVWA16_GRVWB16_GSU1_GSUC0_GSUWGMRR0_K1_LBSPPB256_LPA16_LPB16_LPM4_MIWT1_3_PLR2_SU32_SUM0_SUS256_WG64_4_1_WGM16_WGMXCC1_WGMXCCGn1
- - - [14336, 8, 1, 4096, 14336, 14336, 4096, 4096]
    - [4, 21.52]
  - - [4096, 8, 1, 14336, 4096, 4096, 14336, 14336]
    - [5, 14.39]
  - - [3072, 3072, 1, 10240, 3072, 3072, 10240, 10240]
    - [7, 522.04]
  - - [3072, 1536, 1, 768, 3072, 3072, 768, 768]
    - [9, 224.65]
  - - [3072, 17664, 1, 768, 3072, 3072, 768, 768]
    - [0, 391.25]
  - - [3072, 196608, 1, 768, 3072, 3072, 768, 768]
    - [3, 440.46]
  - - [3072, 24576, 1, 768, 3072, 3072, 768, 768]
    - [2, 414.28]
  - - [3072, 6144, 1, 768, 3072, 3072, 768, 768]
    - [1, 339.66]
  - - [3072, 98304, 1, 768, 3072, 3072, 768, 768]
    - [3, 437.9]
  - - [768, 1536, 1, 3072, 768, 768, 3072, 3072]
    - [6, 180.18]
  - - [768, 1536, 1, 768, 768, 768, 768, 768]
    - [6, 99.3]
  - - [768, 17664, 1, 3072, 768, 768, 3072, 3072]
    - [8, 434.4]
  - - [768, 17664, 1, 768, 768, 768, 768, 768]
    - [2, 289.33]
  - - [768, 196608, 1, 3072, 768, 768, 3072, 3072]
    - [9, 524.94]
  - - [768, 196608, 1, 768, 768, 768, 768, 768]
    - [3, 390.33]
  - - [768, 24576, 1, 3072, 768, 768, 3072, 3072]
    - [8, 468.56]
  - - [768, 24576, 1, 768, 768, 768, 768, 768]
    - [3, 326.46]
  - - [768, 6144, 1, 3072, 768, 768, 3072, 3072]
    - [9, 365.6]
  - - [768, 6144, 1, 768, 768, 768, 768, 768]
    - [7, 221.86]
  - - [768, 98304, 1, 3072, 768, 768, 3072, 3072]
    - [9, 517.36]
  - - [768, 98304, 1, 768, 768, 768, 768, 768]
    - [3, 378.92]
- null
- null
- DeviceEfficiency
- GridBased
