projects/hipsparselt/library/src/hcc_detail/rocsparselt/src/spmm/Tensile/Logic/asm_full/gfx950/Gridbased/gfx950_Cijk_Ailk_Bjlk_I8HS_BH_Bias_FDMN_SPB_AS_SAV.yaml
- {MinimumRequiredVersion: 4.33.0}
- gfx950
- gfx950
- [Device 0058]
    SolutionIndex: 0
    SolutionNameMin: Cijk_Ailk_Bjlk_I8HS_BH_Bias_FDMN_SPB_AS_SAV_MT128x128x128_MI16x16x1_SN_LDSB1_CLR1_GRVWB16_GSU1_GSUC0_GSUWGMRR0_K1_LBSPPA2048_LBSPPB2048_LPA16_LPB16_MIWT2_4_NLCB1_PLR0_SU32_SUM0_SUS256_WG64_8_1_WGM8_WGMXCC1_WGMXCCGn1
    SolutionIndex: 1
    SolutionNameMin: Cijk_Ailk_Bjlk_I8HS_BH_Bias_FDMN_SPB_AS_SAV_MT128x128x128_MI16x16x1_SN_LDSB1_CLR0_GRVWB16_GSU1_GSUC0_GSUWGMRR0_K1_LBSPPA2048_LBSPPB2048_LPA16_LPB16_MIWT2_4_NLCB1_PLR0_SU32_SUM0_SUS256_WG64_8_1_WGM8_WGMXCC1_WGMXCCGn1
    SolutionIndex: 2
    SolutionNameMin: Cijk_Ailk_Bjlk_I8HS_BH_Bias_FDMN_SPB_AS_SAV_MT128x128x128_MI16x16x1_SN_LDSB1_CLR1_GRVWB16_GSU1_GSUC0_GSUWGMRR0_K1_LBSPPA2048_LBSPPB2048_LPA16_LPB16_MIWT2_4_NLCB1_PLR0_SU32_SUM0_SUS256_WG64_8_1_WGM16_WGMXCC1_WGMXCCGn1
    SolutionIndex: 3
    SolutionNameMin: Cijk_Ailk_Bjlk_I8HS_BH_Bias_FDMN_SPB_AS_SAV_MT128x128x128_MI16x16x1_SN_LDSB1_CLR0_GRVWB16_GSU1_GSUC0_GSUWGMRR0_K1_LBSPPA2048_LBSPPB2048_LPA16_LPB16_MIWT2_4_NLCB1_PLR0_SU32_SUM0_SUS256_WG64_8_1_WGM16_WGMXCC1_WGMXCCGn1
    SolutionIndex: 4
    SolutionNameMin: Cijk_Ailk_Bjlk_I8HS_BH_Bias_FDMN_SPB_AS_SAV_MT32x32x128_MI32x32x1_SN_LDSB0_CLR1_GRVWB8_GSU2_GSUC0_GSUWGMRR0_K1_LBSPPA0_LBSPPB0_LPA0_LPB0_MIWT1_1_NLCB1_PLR0_SU32_SUM0_SUS256_WG32_2_1_WGM0_WGMXCC1_WGMXCCGn1
    SolutionIndex: 5
    SolutionNameMin: Cijk_Ailk_Bjlk_I8HS_BH_Bias_FDMN_SPB_AS_SAV_MT128x64x128_MI32x32x1_SN_LDSB1_CLR1_GRVWB8_GSU1_GSUC0_GSUWGMRR0_K1_LBSPPA0_LBSPPB0_LPA0_LPB0_MIWT1_1_NLCB1_PLR0_SU32_SUM0_SUS256_WG128_4_1_WGM0_WGMXCC1_WGMXCCGn1
    SolutionIndex: 6
    SolutionNameMin: Cijk_Ailk_Bjlk_I8HS_BH_Bias_FDMN_SPB_AS_SAV_MT128x64x128_MI32x32x1_SN_LDSB1_CLR1_GRVWB8_GSU2_GSUC0_GSUWGMRR0_K1_LBSPPA0_LBSPPB0_LPA0_LPB0_MIWT1_1_NLCB1_PLR0_SU32_SUM0_SUS256_WG128_4_1_WGM0_WGMXCC1_WGMXCCGn1
    SolutionIndex: 7
    SolutionNameMin: Cijk_Ailk_Bjlk_I8HS_BH_Bias_FDMN_SPB_AS_SAV_MT128x64x128_MI32x32x1_SN_LDSB1_CLR1_GRVWB8_GSU1_GSUC0_GSUWGMRR0_K1_LBSPPA0_LBSPPB0_LPA0_LPB0_MIWT1_1_NLCB1_PLR0_SU32_SUM0_SUS256_WG128_4_1_WGM8_WGMXCC1_WGMXCCGn1
- - - [14336, 8, 1, 4096, 14336, 14336, 14336, 8]
    - [6, 9.57]
  - - [4096, 8, 1, 14336, 4096, 4096, 4096, 8]
    - [4, 4.37]
  - - [3072, 3072, 1, 10240, 3072, 3072, 3072, 3072]
    - [1, 176.13]
  - - [3072, 1536, 1, 768, 3072, 3072, 3072, 1536]
    - [1, 92.27]
  - - [3072, 17664, 1, 768, 3072, 3072, 3072, 17664]
    - [0, 173.22]
  - - [3072, 196608, 1, 768, 3072, 3072, 3072, 196608]
    - [0, 178.57]
  - - [3072, 24576, 1, 768, 3072, 3072, 3072, 24576]
    - [0, 176.52]
  - - [3072, 6144, 1, 768, 3072, 3072, 3072, 6144]
    - [1, 155.62]
  - - [3072, 98304, 1, 768, 3072, 3072, 3072, 98304]
    - [1, 179.48]
  - - [768, 1536, 1, 3072, 768, 768, 768, 1536]
    - [7, 75.7]
  - - [768, 1536, 1, 768, 768, 768, 768, 1536]
    - [5, 56.38]
  - - [768, 17664, 1, 3072, 768, 768, 768, 17664]
    - [2, 181.3]
  - - [768, 17664, 1, 768, 768, 768, 768, 17664]
    - [3, 139.57]
  - - [768, 196608, 1, 3072, 768, 768, 768, 196608]
    - [1, 219.51]
  - - [768, 196608, 1, 768, 768, 768, 768, 196608]
    - [2, 176.03]
  - - [768, 24576, 1, 3072, 768, 768, 768, 24576]
    - [2, 190.2]
  - - [768, 24576, 1, 768, 768, 768, 768, 24576]
    - [2, 149.92]
  - - [768, 6144, 1, 3072, 768, 768, 768, 6144]
    - [0, 125.15]
  - - [768, 6144, 1, 768, 768, 768, 768, 6144]
    - [1, 94.79]
  - - [768, 98304, 1, 3072, 768, 768, 768, 98304]
    - [1, 216.24]
  - - [768, 98304, 1, 768, 768, 768, 768, 98304]
    - [0, 171.91]
- null
- null
- DeviceEfficiency
- GridBased
