projects/hipsparselt/library/src/hcc_detail/rocsparselt/src/spmm/Tensile/Logic/asm_full/gfx950/Gridbased/gfx950_Cijk_Ailk_Bjlk_BBS_BH_Bias_FDMN_SPB_AS_SAV.yaml
- {MinimumRequiredVersion: 4.33.0}
- gfx950
- gfx950
- [Device 0058]
    SolutionIndex: 0
    SolutionNameMin: Cijk_Ailk_Bjlk_BBS_BH_Bias_FDMN_SPB_AS_SAV_MT64x192x64_MI32x32x1_SN_LDSB1_CLR1_EPS1_GRVWB8_GSU1_GSUC0_GSUWGMRR0_K1_LBSPPA0_LBSPPB0_LPA0_LPB0_MIWT1_3_NLCA1_NLCB3_PGR2_PLR0_SU32_SUM0_SUS256_WG64_4_1_WGM0_WGMXCC1_WGMXCCGn1
    SolutionIndex: 1
    SolutionNameMin: Cijk_Ailk_Bjlk_BBS_BH_Bias_FDMN_SPB_AS_SAV_MT64x192x64_MI32x32x1_SN_LDSB1_CLR1_EPS1_GRVWB8_GSU1_GSUC0_GSUWGMRR0_K1_LBSPPA0_LBSPPB0_LPA0_LPB0_MIWT1_3_NLCA1_NLCB3_PGR2_PLR1_SU32_SUM0_SUS256_WG64_4_1_WGM0_WGMXCC1_WGMXCCGn1
    SolutionIndex: 2
    SolutionNameMin: Cijk_Ailk_Bjlk_BBS_BH_Bias_FDMN_SPB_AS_SAV_MT64x192x64_MI32x32x1_SN_LDSB1_CLR1_EPS1_GRVWB8_GSU1_GSUC0_GSUWGMRR0_K1_LBSPPA0_LBSPPB0_LPA0_LPB0_MIWT1_3_NLCA1_NLCB3_PGR2_PLR0_SU32_SUM0_SUS256_WG64_4_1_WGM16_WGMXCC1_WGMXCCGn1
    SolutionIndex: 3
    SolutionNameMin: Cijk_Ailk_Bjlk_BBS_BH_Bias_FDMN_SPB_AS_SAV_MT64x192x64_MI32x32x1_SN_LDSB1_CLR1_EPS1_GRVWB8_GSU1_GSUC0_GSUWGMRR0_K1_LBSPPA0_LBSPPB0_LPA0_LPB0_MIWT1_3_NLCA1_NLCB3_PGR2_PLR1_SU32_SUM0_SUS256_WG64_4_1_WGM16_WGMXCC1_WGMXCCGn1
    SolutionIndex: 4
    SolutionNameMin: Cijk_Ailk_Bjlk_BBS_BH_Bias_FDMN_SPB_AS_SAV_MT256x128x64_MI32x32x1_SN_LDSB1_CLR1_EPS1_GRVWB8_GSU1_GSUC0_GSUWGMRR0_K1_LBSPPA0_LBSPPB0_LPA0_LPB0_MIWT2_2_NLCA1_NLCB1_PGR2_PLR1_SU32_SUM0_SUS256_WG128_4_1_WGM0_WGMXCC1_WGMXCCGn1
    SolutionIndex: 5
    SolutionNameMin: Cijk_Ailk_Bjlk_BBS_BH_Bias_FDMN_SPB_AS_SAV_MT256x128x64_MI32x32x1_SN_LDSB1_CLR1_EPS1_GRVWB8_GSU1_GSUC0_GSUWGMRR0_K1_LBSPPA0_LBSPPB0_LPA0_LPB0_MIWT2_2_NLCA1_NLCB1_PGR2_PLR1_SU32_SUM0_SUS256_WG128_4_1_WGM8_WGMXCC1_WGMXCCGn1
    SolutionIndex: 6
    SolutionNameMin: Cijk_Ailk_Bjlk_BBS_BH_Bias_FDMN_SPB_AS_SAV_MT256x128x64_MI32x32x1_SN_LDSB1_CLR1_EPS1_GRVWB8_GSU1_GSUC0_GSUWGMRR0_K1_LBSPPA0_LBSPPB0_LPA0_LPB0_MIWT2_2_NLCA1_NLCB1_PGR2_PLR1_SU32_SUM0_SUS256_WG128_4_1_WGM16_WGMXCC1_WGMXCCGn1
    SolutionIndex: 7
    SolutionNameMin: Cijk_Ailk_Bjlk_BBS_BH_Bias_FDMN_SPB_AS_SAV_MT256x128x64_MI32x32x1_SN_LDSB1_CLR1_EPS1_GRVWB8_GSU1_GSUC0_GSUWGMRR0_K1_LBSPPA0_LBSPPB0_LPA0_LPB0_MIWT2_2_NLCA1_NLCB1_PGR2_PLR1_SU32_SUM0_SUS256_WG128_4_1_WGM32_WGMXCC1_WGMXCCGn1
    SolutionIndex: 8
    SolutionNameMin: Cijk_Ailk_Bjlk_BBS_BH_Bias_FDMN_SPB_AS_SAV_MT16x16x128_MI16x16x1_SN_LDSB0_CLR1_EPS1_GRVWB8_GSU1_GSUC0_GSUWGMRR0_K1_LBSPPA256_LBSPPB256_LPA16_LPB16_MIWT1_1_NLCA1_NLCB1_PGR2_PLR0_SU32_SUM0_SUS256_WG16_4_1_WGM8_WGMXCC1_WGMXCCGn1
    SolutionIndex: 9
    SolutionNameMin: Cijk_Ailk_Bjlk_BBS_BH_Bias_FDMN_SPB_AS_SAV_MT32x96x128_MI16x16x1_SN_LDSB1_CLR1_EPS1_GRVWB8_GSU1_GSUC0_GSUWGMRR0_K1_LBSPPA512_LBSPPB1536_LPA16_LPB16_MIWT1_3_NLCA1_NLCB3_PGR2_PLR1_SU32_SUM0_SUS256_WG32_8_1_WGM0_WGMXCC1_WGMXCCGn1
    SolutionIndex: 10
    SolutionNameMin: Cijk_Ailk_Bjlk_BBS_BH_Bias_FDMN_SPB_AS_SAV_MT64x32x128_MI16x16x1_SN_LDSB1_CLR1_EPS1_GRVWB4_GSU1_GSUC0_GSUWGMRR0_K1_LBSPPA1024_LBSPPB512_LPA16_LPB16_MIWT1_1_NLCA1_NLCB1_PGR2_PLR0_SU32_SUM0_SUS256_WG64_8_1_WGM16_WGMXCC1_WGMXCCGn1
    SolutionIndex: 11
    SolutionNameMin: Cijk_Ailk_Bjlk_BBS_BH_Bias_FDMN_SPB_AS_SAV_MT128x64x128_MI32x32x1_SN_LDSB1_CLR1_EPS1_GRVWB8_GSU1_GSUC0_GSUWGMRR0_K1_LBSPPA0_LBSPPB0_LPA0_LPB0_MIWT1_1_NLCA1_NLCB1_PGR2_PLR1_SU32_SUM0_SUS256_WG128_4_1_WGM0_WGMXCC1_WGMXCCGn1
- - - [14336, 8, 1, 4096, 14336, 14336, 14336, 8]
    - [10, 13.53]
  - - [4096, 8, 1, 14336, 4096, 4096, 4096, 8]
    - [8, 5.88]
  - - [3072, 3072, 1, 10240, 3072, 3072, 3072, 3072]
    - [1, 256.92]
  - - [3072, 1536, 1, 768, 3072, 3072, 3072, 1536]
    - [0, 135.56]
  - - [3072, 17664, 1, 768, 3072, 3072, 3072, 17664]
    - [7, 231.34]
  - - [3072, 196608, 1, 768, 3072, 3072, 3072, 196608]
    - [4, 256.32]
  - - [3072, 24576, 1, 768, 3072, 3072, 3072, 24576]
    - [7, 248.18]
  - - [3072, 6144, 1, 768, 3072, 3072, 3072, 6144]
    - [3, 211.43]
  - - [3072, 98304, 1, 768, 3072, 3072, 3072, 98304]
    - [7, 254.2]
  - - [768, 1536, 1, 3072, 768, 768, 768, 1536]
    - [9, 86.16]
  - - [768, 1536, 1, 768, 768, 768, 768, 1536]
    - [11, 61.71]
  - - [768, 17664, 1, 3072, 768, 768, 768, 17664]
    - [5, 253.26]
  - - [768, 17664, 1, 768, 768, 768, 768, 17664]
    - [5, 196.62]
  - - [768, 196608, 1, 3072, 768, 768, 768, 196608]
    - [6, 311.68]
  - - [768, 196608, 1, 768, 768, 768, 768, 196608]
    - [5, 251.76]
  - - [768, 24576, 1, 3072, 768, 768, 768, 24576]
    - [3, 251.09]
  - - [768, 24576, 1, 768, 768, 768, 768, 24576]
    - [3, 207.69]
  - - [768, 6144, 1, 3072, 768, 768, 768, 6144]
    - [3, 181.59]
  - - [768, 6144, 1, 768, 768, 768, 768, 6144]
    - [2, 137.66]
  - - [768, 98304, 1, 3072, 768, 768, 768, 98304]
    - [7, 311.12]
  - - [768, 98304, 1, 768, 768, 768, 768, 98304]
    - [5, 249.35]
- null
- null
- DeviceEfficiency
- GridBased
