projects/hipsparselt/library/src/hcc_detail/rocsparselt/src/spmm/Tensile/Logic/asm_full/gfx950/Gridbased/gfx950_Cijk_Alik_Bjlk_F8SS_BH_Bias_FDMN_SPA_AS_SAV.yaml
- {MinimumRequiredVersion: 4.33.0}
- gfx950
- gfx950
- [Device 0058]
    SolutionIndex: 0
    SolutionNameMin: Cijk_Alik_Bjlk_F8SS_BH_Bias_FDMN_SPA_AS_SAV_MT64x32x128_MI16x16x1_SN_LDSB0_CLR1_GRVWA8_GRVWB8_GSU2_GSUC0_GSUWGMRR0_K1_LBSPPB512_LPA8_LPB16_LPM2_MIWT1_1_NLCB1_PLR0_SU32_SUM0_SUS256_WG64_8_1_WGM0_WGMXCC1_WGMXCCGn1
    SolutionIndex: 1
    SolutionNameMin: Cijk_Alik_Bjlk_F8SS_BH_Bias_FDMN_SPA_AS_SAV_MT64x32x128_MI16x16x1_SN_LDSB0_CLR0_GRVWA8_GRVWB8_GSU2_GSUC0_GSUWGMRR0_K1_LBSPPB512_LPA8_LPB16_LPM2_MIWT1_1_NLCB1_PLR0_SU32_SUM0_SUS256_WG64_8_1_WGM0_WGMXCC1_WGMXCCGn1
    SolutionIndex: 2
    SolutionNameMin: Cijk_Alik_Bjlk_F8SS_BH_Bias_FDMN_SPA_AS_SAV_MT128x64x128_MI16x16x1_SN_LDSB1_CLR1_GRVWA16_GRVWB16_GSU1_GSUC0_GSUWGMRR0_K1_LBSPPB1024_LPA16_LPB16_LPM4_MIWT2_2_NLCB1_PLR0_SU32_SUM0_SUS256_WG64_8_1_WGM0_WGMXCC1_WGMXCCGn1
    SolutionIndex: 3
    SolutionNameMin: Cijk_Alik_Bjlk_F8SS_BH_Bias_FDMN_SPA_AS_SAV_MT128x64x128_MI16x16x1_SN_LDSB1_CLR0_GRVWA16_GRVWB16_GSU1_GSUC0_GSUWGMRR0_K1_LBSPPB1024_LPA16_LPB16_LPM4_MIWT2_2_NLCB1_PLR0_SU32_SUM0_SUS256_WG64_8_1_WGM0_WGMXCC1_WGMXCCGn1
    SolutionIndex: 4
    SolutionNameMin: Cijk_Alik_Bjlk_F8SS_BH_Bias_FDMN_SPA_AS_SAV_MT128x64x128_MI16x16x1_SN_LDSB1_CLR1_GRVWA16_GRVWB16_GSU1_GSUC0_GSUWGMRR0_K1_LBSPPB1024_LPA16_LPB16_LPM4_MIWT2_2_NLCB1_PLR0_SU32_SUM0_SUS256_WG64_8_1_WGM8_WGMXCC1_WGMXCCGn1
    SolutionIndex: 5
    SolutionNameMin: Cijk_Alik_Bjlk_F8SS_BH_Bias_FDMN_SPA_AS_SAV_MT128x64x128_MI16x16x1_SN_LDSB1_CLR0_GRVWA16_GRVWB16_GSU1_GSUC0_GSUWGMRR0_K1_LBSPPB1024_LPA16_LPB16_LPM4_MIWT2_2_NLCB1_PLR0_SU32_SUM0_SUS256_WG64_8_1_WGM8_WGMXCC1_WGMXCCGn1
    SolutionIndex: 6
    SolutionNameMin: Cijk_Alik_Bjlk_F8SS_BH_Bias_FDMN_SPA_AS_SAV_MT128x128x128_MI16x16x1_SN_LDSB1_CLR1_GRVWA16_GRVWB16_GSU1_GSUC0_GSUWGMRR0_K1_LBSPPB2048_LPA16_LPB16_LPM4_MIWT4_2_NLCB1_PLR0_SU32_SUM0_SUS256_WG32_16_1_WGM8_WGMXCC1_WGMXCCGn1
    SolutionIndex: 7
    SolutionNameMin: Cijk_Alik_Bjlk_F8SS_BH_Bias_FDMN_SPA_AS_SAV_MT128x128x128_MI16x16x1_SN_LDSB1_CLR0_GRVWA16_GRVWB16_GSU1_GSUC0_GSUWGMRR0_K1_LBSPPB2048_LPA16_LPB16_LPM4_MIWT4_2_NLCB1_PLR0_SU32_SUM0_SUS256_WG32_16_1_WGM8_WGMXCC1_WGMXCCGn1
    SolutionIndex: 8
    SolutionNameMin: Cijk_Alik_Bjlk_F8SS_BH_Bias_FDMN_SPA_AS_SAV_MT128x128x128_MI16x16x1_SN_LDSB1_CLR1_GRVWA16_GRVWB16_GSU1_GSUC0_GSUWGMRR0_K1_LBSPPB2048_LPA16_LPB16_LPM4_MIWT4_2_NLCB1_PLR0_SU32_SUM0_SUS256_WG32_16_1_WGM16_WGMXCC1_WGMXCCGn1
    SolutionIndex: 9
    SolutionNameMin: Cijk_Alik_Bjlk_F8SS_BH_Bias_FDMN_SPA_AS_SAV_MT128x128x128_MI16x16x1_SN_LDSB1_CLR0_GRVWA16_GRVWB16_GSU1_GSUC0_GSUWGMRR0_K1_LBSPPB2048_LPA16_LPB16_LPM4_MIWT4_2_NLCB1_PLR0_SU32_SUM0_SUS256_WG32_16_1_WGM16_WGMXCC1_WGMXCCGn1
    SolutionIndex: 10
    SolutionNameMin: Cijk_Alik_Bjlk_F8SS_BH_Bias_FDMN_SPA_AS_SAV_MT128x64x128_MI32x32x1_SN_LDSB1_CLR1_GRVWA16_GRVWB16_GSU1_GSUC0_GSUWGMRR0_K1_LBSPPB0_LPA16_LPB0_LPM4_MIWT1_1_NLCB1_PLR0_SU32_SUM0_SUS256_WG128_4_1_WGM8_WGMXCC1_WGMXCCGn1
    SolutionIndex: 11
    SolutionNameMin: Cijk_Alik_Bjlk_F8SS_BH_Bias_FDMN_SPA_AS_SAV_MT128x64x128_MI32x32x1_SN_LDSB1_CLR1_GRVWA16_GRVWB16_GSU1_GSUC0_GSUWGMRR0_K1_LBSPPB0_LPA16_LPB0_LPM4_MIWT1_1_NLCB1_PLR0_SU32_SUM0_SUS256_WG128_4_1_WGM16_WGMXCC1_WGMXCCGn1
    SolutionIndex: 12
    SolutionNameMin: Cijk_Alik_Bjlk_F8SS_BH_Bias_FDMN_SPA_AS_SAV_MT128x64x256_MI32x32x1_SN_LDSB1_CLR1_GRVWA16_GRVWB16_GSU1_GSUC0_GSUWGMRR0_K1_LBSPPB0_LPA16_LPB0_LPM4_MIWT1_1_NLCB1_PLR0_SU32_SUM0_SUS256_WG128_4_1_WGM0_WGMXCC1_WGMXCCGn1
    SolutionIndex: 13
    SolutionNameMin: Cijk_Alik_Bjlk_F8SS_BH_Bias_FDMN_SPA_AS_SAV_MT128x64x256_MI32x32x1_SN_LDSB1_CLR1_GRVWA16_GRVWB16_GSU1_GSUC0_GSUWGMRR0_K1_LBSPPB0_LPA16_LPB0_LPM4_MIWT1_1_NLCB1_PLR0_SU32_SUM0_SUS256_WG128_4_1_WGM8_WGMXCC1_WGMXCCGn1
- - - [14336, 8, 1, 4096, 14336, 14336, 4096, 8]
    - [0, 12.35]
  - - [4096, 8, 1, 14336, 4096, 4096, 14336, 8]
    - [1, 5.9]
  - - [3072, 3072, 1, 10240, 3072, 3072, 10240, 3072]
    - [6, 254.86]
  - - [3072, 1536, 1, 768, 3072, 3072, 768, 1536]
    - [10, 132.75]
  - - [3072, 17664, 1, 768, 3072, 3072, 768, 17664]
    - [9, 213.91]
  - - [3072, 196608, 1, 768, 3072, 3072, 768, 196608]
    - [4, 213.33]
  - - [3072, 24576, 1, 768, 3072, 3072, 768, 24576]
    - [7, 210.92]
  - - [3072, 6144, 1, 768, 3072, 3072, 768, 6144]
    - [11, 193.96]
  - - [3072, 98304, 1, 768, 3072, 3072, 768, 98304]
    - [5, 212.65]
  - - [768, 1536, 1, 3072, 768, 768, 3072, 1536]
    - [13, 117.82]
  - - [768, 1536, 1, 768, 768, 768, 768, 1536]
    - [12, 70.34]
  - - [768, 17664, 1, 3072, 768, 768, 3072, 17664]
    - [9, 241.49]
  - - [768, 17664, 1, 768, 768, 768, 768, 17664]
    - [8, 169.45]
  - - [768, 196608, 1, 3072, 768, 768, 3072, 196608]
    - [6, 281.04]
  - - [768, 196608, 1, 768, 768, 768, 768, 196608]
    - [2, 198.04]
  - - [768, 24576, 1, 3072, 768, 768, 3072, 24576]
    - [9, 244.69]
  - - [768, 24576, 1, 768, 768, 768, 768, 24576]
    - [10, 181.27]
  - - [768, 6144, 1, 3072, 768, 768, 3072, 6144]
    - [11, 179.51]
  - - [768, 6144, 1, 768, 768, 768, 768, 6144]
    - [11, 131.74]
  - - [768, 98304, 1, 3072, 768, 768, 3072, 98304]
    - [6, 274.29]
  - - [768, 98304, 1, 768, 768, 768, 768, 98304]
    - [3, 196.11]
- null
- null
- DeviceEfficiency
- GridBased
