projects/hipsparselt/library/src/hcc_detail/rocsparselt/src/spmm/Tensile/Logic/asm_full/gfx950/Gridbased/gfx950_Cijk_Ailk_Bljk_BBS_BH_Bias_FDMN_SPB_AS_SAV.yaml
- {MinimumRequiredVersion: 4.33.0}
- gfx950
- gfx950
- [Device 0058]
    SolutionIndex: 0
    SolutionNameMin: Cijk_Ailk_Bljk_BBS_BH_Bias_FDMN_SPB_AS_SAV_MT64x192x64_MI32x32x1_SN_LDSB1_CLR1_EPS1_GRVWB8_GSU1_GSUC0_GSUWGMRR0_K1_LBSPPA0_LPA0_LPB8_MIWT1_3_NLCA1_PGR2_PLR0_SU32_SUM0_SUS256_WG64_4_1_WGM0_WGMXCC1_WGMXCCGn1
    SolutionIndex: 1
    SolutionNameMin: Cijk_Ailk_Bljk_BBS_BH_Bias_FDMN_SPB_AS_SAV_MT64x192x64_MI32x32x1_SN_LDSB1_CLR1_EPS1_GRVWB8_GSU1_GSUC0_GSUWGMRR0_K1_LBSPPA0_LPA0_LPB8_MIWT1_3_NLCA1_PGR2_PLR1_SU32_SUM0_SUS256_WG64_4_1_WGM0_WGMXCC1_WGMXCCGn1
    SolutionIndex: 2
    SolutionNameMin: Cijk_Ailk_Bljk_BBS_BH_Bias_FDMN_SPB_AS_SAV_MT64x192x64_MI32x32x1_SN_LDSB1_CLR1_EPS1_GRVWB8_GSU1_GSUC0_GSUWGMRR0_K1_LBSPPA0_LPA0_LPB8_MIWT1_3_NLCA1_PGR2_PLR0_SU32_SUM0_SUS256_WG64_4_1_WGM8_WGMXCC1_WGMXCCGn1
    SolutionIndex: 3
    SolutionNameMin: Cijk_Ailk_Bljk_BBS_BH_Bias_FDMN_SPB_AS_SAV_MT64x192x64_MI32x32x1_SN_LDSB1_CLR1_EPS1_GRVWB8_GSU1_GSUC0_GSUWGMRR0_K1_LBSPPA0_LPA0_LPB8_MIWT1_3_NLCA1_PGR2_PLR0_SU32_SUM0_SUS256_WG64_4_1_WGM16_WGMXCC1_WGMXCCGn1
    SolutionIndex: 4
    SolutionNameMin: Cijk_Ailk_Bljk_BBS_BH_Bias_FDMN_SPB_AS_SAV_MT64x192x64_MI32x32x1_SN_LDSB1_CLR1_EPS1_GRVWB8_GSU1_GSUC0_GSUWGMRR0_K1_LBSPPA0_LPA0_LPB8_MIWT1_3_NLCA1_PGR2_PLR1_SU32_SUM0_SUS256_WG64_4_1_WGM16_WGMXCC1_WGMXCCGn1
    SolutionIndex: 5
    SolutionNameMin: Cijk_Ailk_Bljk_BBS_BH_Bias_FDMN_SPB_AS_SAV_MT256x128x64_MI32x32x1_SN_LDSB1_CLR1_EPS1_GRVWB8_GSU1_GSUC0_GSUWGMRR0_K1_LBSPPA0_LPA0_LPB8_MIWT2_2_NLCA1_PGR2_PLR1_SU32_SUM0_SUS256_WG128_4_1_WGM16_WGMXCC1_WGMXCCGn1
    SolutionIndex: 6
    SolutionNameMin: Cijk_Ailk_Bljk_BBS_BH_Bias_FDMN_SPB_AS_SAV_MT256x256x64_MI32x32x1_SN_LDSB0_CLR0_EPS0_GRVWB8_GSU1_GSUC0_GSUWGMRR0_K1_LBSPPA0_LPA0_LPB8_MIWT2_4_NLCA1_PGR0_PLR0_SU32_SUM0_SUS256_WG128_4_1_WGM8_WGMXCC1_WGMXCCGn1
    SolutionIndex: 7
    SolutionNameMin: Cijk_Ailk_Bljk_BBS_BH_Bias_FDMN_SPB_AS_SAV_MT256x256x64_MI32x32x1_SN_LDSB0_CLR0_EPS0_GRVWB8_GSU1_GSUC0_GSUWGMRR0_K1_LBSPPA0_LPA0_LPB8_MIWT2_4_NLCA1_PGR0_PLR0_SU32_SUM0_SUS256_WG128_4_1_WGM16_WGMXCC1_WGMXCCGn1
    SolutionIndex: 8
    SolutionNameMin: Cijk_Ailk_Bljk_BBS_BH_Bias_FDMN_SPB_AS_SAV_MT32x96x128_MI16x16x1_SN_LDSB1_CLR1_EPS1_GRVWB8_GSU1_GSUC0_GSUWGMRR0_K1_LBSPPA512_LPA16_LPB8_MIWT1_3_NLCA1_PGR2_PLR1_SU32_SUM0_SUS256_WG32_8_1_WGM8_WGMXCC1_WGMXCCGn1
    SolutionIndex: 9
    SolutionNameMin: Cijk_Ailk_Bljk_BBS_BH_Bias_FDMN_SPB_AS_SAV_MT64x32x128_MI16x16x1_SN_LDSB1_CLR1_EPS1_GRVWB4_GSU1_GSUC0_GSUWGMRR0_K1_LBSPPA1024_LPA16_LPB4_MIWT1_1_NLCA1_PGR2_PLR1_SU32_SUM0_SUS256_WG64_8_1_WGM0_WGMXCC1_WGMXCCGn1
    SolutionIndex: 10
    SolutionNameMin: Cijk_Ailk_Bljk_BBS_BH_Bias_FDMN_SPB_AS_SAV_MT32x32x128_MI32x32x1_SN_LDSB0_CLR1_EPS1_GRVWB8_GSU1_GSUC0_GSUWGMRR0_K1_LBSPPA0_LPA0_LPB8_MIWT1_1_NLCA1_PGR2_PLR1_SU32_SUM0_SUS256_WG32_2_1_WGM0_WGMXCC1_WGMXCCGn1
- - - [14336, 8, 1, 4096, 14336, 14336, 14336, 4096]
    - [9, 14.24]
  - - [4096, 8, 1, 14336, 4096, 4096, 4096, 14336]
    - [10, 6.01]
  - - [3072, 3072, 1, 10240, 3072, 3072, 3072, 10240]
    - [1, 287.33]
  - - [3072, 1536, 1, 768, 3072, 3072, 3072, 768]
    - [0, 149.85]
  - - [3072, 17664, 1, 768, 3072, 3072, 3072, 768]
    - [7, 249.6]
  - - [3072, 196608, 1, 768, 3072, 3072, 3072, 768]
    - [7, 311.91]
  - - [3072, 24576, 1, 768, 3072, 3072, 3072, 768]
    - [7, 279.57]
  - - [3072, 6144, 1, 768, 3072, 3072, 3072, 768]
    - [4, 225.28]
  - - [3072, 98304, 1, 768, 3072, 3072, 3072, 768]
    - [7, 309.92]
  - - [768, 1536, 1, 3072, 768, 768, 768, 3072]
    - [8, 103.05]
  - - [768, 1536, 1, 768, 768, 768, 768, 768]
    - [8, 69.8]
  - - [768, 17664, 1, 3072, 768, 768, 768, 3072]
    - [6, 291.4]
  - - [768, 17664, 1, 768, 768, 768, 768, 768]
    - [6, 225.93]
  - - [768, 196608, 1, 3072, 768, 768, 768, 3072]
    - [6, 361.97]
  - - [768, 196608, 1, 768, 768, 768, 768, 768]
    - [6, 299.23]
  - - [768, 24576, 1, 3072, 768, 768, 768, 3072]
    - [4, 275.65]
  - - [768, 24576, 1, 768, 768, 768, 768, 768]
    - [4, 226.7]
  - - [768, 6144, 1, 3072, 768, 768, 768, 3072]
    - [3, 206.13]
  - - [768, 6144, 1, 768, 768, 768, 768, 768]
    - [2, 151.79]
  - - [768, 98304, 1, 3072, 768, 768, 768, 3072]
    - [5, 334.18]
  - - [768, 98304, 1, 768, 768, 768, 768, 768]
    - [7, 269.12]
- null
- null
- DeviceEfficiency
- GridBased
