projects/hipsparselt/library/src/hcc_detail/rocsparselt/src/spmm/Tensile/Logic/asm_full/gfx950/Gridbased/gfx950_Cijk_Ailk_Bljk_HHS_BH_Bias_FDMN_SPA_AS_SAV.yaml
- {MinimumRequiredVersion: 4.33.0}
- gfx950
- gfx950
- [Device 0058]
    SolutionIndex: 0
    SolutionNameMin: Cijk_Ailk_Bljk_HHS_BH_Bias_FDMN_SPA_AS_SAV_MT128x128x64_MI16x16x1_SN_LDSB1_CLR1_EPS1_GRVWA8_GRVWB8_GSU1_GSUC0_GSUWGMRR0_K1_LBSPPA2048_LBSPPB128_LPA16_LPB16_LPM2_MIWT2_4_PGR2_PLR0_SU32_SUM0_SUS256_WG64_8_1_WGM8_WGMXCC1_WGMXCCGn1
    SolutionIndex: 1
    SolutionNameMin: Cijk_Ailk_Bljk_HHS_BH_Bias_FDMN_SPA_AS_SAV_MT128x128x64_MI16x16x1_SN_LDSB1_CLR0_EPS1_GRVWA8_GRVWB8_GSU1_GSUC0_GSUWGMRR0_K1_LBSPPA2048_LBSPPB128_LPA16_LPB16_LPM2_MIWT2_4_PGR2_PLR0_SU32_SUM0_SUS256_WG64_8_1_WGM8_WGMXCC1_WGMXCCGn1
    SolutionIndex: 2
    SolutionNameMin: Cijk_Ailk_Bljk_HHS_BH_Bias_FDMN_SPA_AS_SAV_MT128x128x64_MI16x16x1_SN_LDSB1_CLR1_EPS1_GRVWA8_GRVWB8_GSU1_GSUC0_GSUWGMRR0_K1_LBSPPA2048_LBSPPB128_LPA16_LPB16_LPM2_MIWT2_4_PGR2_PLR0_SU32_SUM0_SUS256_WG64_8_1_WGM16_WGMXCC1_WGMXCCGn1
    SolutionIndex: 3
    SolutionNameMin: Cijk_Ailk_Bljk_HHS_BH_Bias_FDMN_SPA_AS_SAV_MT128x128x64_MI16x16x1_SN_LDSB1_CLR0_EPS1_GRVWA8_GRVWB8_GSU1_GSUC0_GSUWGMRR0_K1_LBSPPA2048_LBSPPB128_LPA16_LPB16_LPM2_MIWT2_4_PGR2_PLR0_SU32_SUM0_SUS256_WG64_8_1_WGM16_WGMXCC1_WGMXCCGn1
    SolutionIndex: 4
    SolutionNameMin: Cijk_Ailk_Bljk_HHS_BH_Bias_FDMN_SPA_AS_SAV_MT64x192x64_MI32x32x1_SN_LDSB1_CLR1_EPS1_GRVWA8_GRVWB8_GSU1_GSUC0_GSUWGMRR0_K1_LBSPPA0_LBSPPB128_LPA0_LPB8_LPM2_MIWT1_3_PGR2_PLR0_SU32_SUM0_SUS256_WG64_4_1_WGM0_WGMXCC1_WGMXCCGn1
    SolutionIndex: 5
    SolutionNameMin: Cijk_Ailk_Bljk_HHS_BH_Bias_FDMN_SPA_AS_SAV_MT64x192x64_MI32x32x1_SN_LDSB1_CLR1_EPS1_GRVWA8_GRVWB8_GSU1_GSUC0_GSUWGMRR0_K1_LBSPPA0_LBSPPB128_LPA0_LPB8_LPM2_MIWT1_3_PGR2_PLR0_SU32_SUM0_SUS256_WG64_4_1_WGM16_WGMXCC1_WGMXCCGn1
    SolutionIndex: 6
    SolutionNameMin: Cijk_Ailk_Bljk_HHS_BH_Bias_FDMN_SPA_AS_SAV_MT64x192x64_MI32x32x1_SN_LDSB1_CLR1_EPS1_GRVWA8_GRVWB8_GSU1_GSUC0_GSUWGMRR0_K1_LBSPPA0_LBSPPB128_LPA0_LPB8_LPM2_MIWT1_3_PGR2_PLR1_SU32_SUM0_SUS256_WG64_4_1_WGM16_WGMXCC1_WGMXCCGn1
    SolutionIndex: 7
    SolutionNameMin: Cijk_Ailk_Bljk_HHS_BH_Bias_FDMN_SPA_AS_SAV_MT32x96x128_MI16x16x1_SN_LDSB1_CLR1_EPS1_GRVWA8_GRVWB8_GSU1_GSUC0_GSUWGMRR0_K1_LBSPPA512_LBSPPB256_LPA16_LPB16_LPM2_MIWT1_3_PGR2_PLR1_SU32_SUM0_SUS256_WG32_8_1_WGM8_WGMXCC1_WGMXCCGn1
    SolutionIndex: 8
    SolutionNameMin: Cijk_Ailk_Bljk_HHS_BH_Bias_FDMN_SPA_AS_SAV_MT64x32x128_MI16x16x1_SN_LDSB1_CLR1_EPS1_GRVWA8_GRVWB8_GSU1_GSUC0_GSUWGMRR0_K1_LBSPPA1024_LBSPPB256_LPA16_LPB16_LPM2_MIWT1_1_PGR2_PLR1_SU32_SUM0_SUS256_WG64_8_1_WGM0_WGMXCC1_WGMXCCGn1
    SolutionIndex: 9
    SolutionNameMin: Cijk_Ailk_Bljk_HHS_BH_Bias_FDMN_SPA_AS_SAV_MT32x32x128_MI32x32x1_SN_LDSB0_CLR1_EPS1_GRVWA8_GRVWB8_GSU1_GSUC0_GSUWGMRR0_K1_LBSPPA0_LBSPPB256_LPA0_LPB8_LPM2_MIWT1_1_PGR2_PLR1_SU32_SUM0_SUS256_WG32_2_1_WGM0_WGMXCC1_WGMXCCGn1
- - - [14336, 8, 1, 4096, 14336, 14336, 14336, 4096]
    - [8, 18.13]
  - - [4096, 8, 1, 14336, 4096, 4096, 4096, 14336]
    - [9, 7.0]
  - - [3072, 3072, 1, 10240, 3072, 3072, 3072, 10240]
    - [6, 345.82]
  - - [3072, 1536, 1, 768, 3072, 3072, 3072, 768]
    - [4, 173.51]
  - - [3072, 17664, 1, 768, 3072, 3072, 3072, 768]
    - [2, 325.3]
  - - [3072, 196608, 1, 768, 3072, 3072, 3072, 768]
    - [0, 342.03]
  - - [3072, 24576, 1, 768, 3072, 3072, 3072, 768]
    - [2, 328.68]
  - - [3072, 6144, 1, 768, 3072, 3072, 3072, 768]
    - [2, 282.45]
  - - [3072, 98304, 1, 768, 3072, 3072, 3072, 768]
    - [0, 341.28]
  - - [768, 1536, 1, 3072, 768, 768, 768, 3072]
    - [7, 122.84]
  - - [768, 1536, 1, 768, 768, 768, 768, 768]
    - [7, 78.13]
  - - [768, 17664, 1, 3072, 768, 768, 768, 3072]
    - [2, 312.18]
  - - [768, 17664, 1, 768, 768, 768, 768, 768]
    - [2, 242.52]
  - - [768, 196608, 1, 3072, 768, 768, 768, 3072]
    - [1, 389.0]
  - - [768, 196608, 1, 768, 768, 768, 768, 768]
    - [3, 319.96]
  - - [768, 24576, 1, 3072, 768, 768, 768, 3072]
    - [3, 344.82]
  - - [768, 24576, 1, 768, 768, 768, 768, 768]
    - [2, 266.46]
  - - [768, 6144, 1, 3072, 768, 768, 768, 3072]
    - [5, 250.3]
  - - [768, 6144, 1, 768, 768, 768, 768, 768]
    - [5, 175.5]
  - - [768, 98304, 1, 3072, 768, 768, 768, 3072]
    - [1, 385.87]
  - - [768, 98304, 1, 768, 768, 768, 768, 768]
    - [3, 310.96]
- null
- null
- DeviceEfficiency
- GridBased
