projects/hipsparselt/library/src/hcc_detail/rocsparselt/src/spmm/Tensile/Logic/asm_full/gfx950/Gridbased/gfx950_Cijk_Ailk_Bjlk_HHS_BH_Bias_FDMN_SPA_AS_SAV.yaml
- {MinimumRequiredVersion: 4.33.0}
- gfx950
- gfx950
- [Device 0058]
    SolutionIndex: 0
    SolutionNameMin: Cijk_Ailk_Bjlk_HHS_BH_Bias_FDMN_SPA_AS_SAV_MT64x192x64_MI32x32x1_SN_LDSB1_CLR1_EPS1_GRVWA8_GRVWB8_GSU1_GSUC0_GSUWGMRR0_K1_LBSPPA0_LBSPPB0_LPA0_LPB0_LPM2_MIWT1_3_NLCB3_PGR2_PLR1_SU32_SUM0_SUS256_WG64_4_1_WGM0_WGMXCC1_WGMXCCGn1
    SolutionIndex: 1
    SolutionNameMin: Cijk_Ailk_Bjlk_HHS_BH_Bias_FDMN_SPA_AS_SAV_MT64x192x64_MI32x32x1_SN_LDSB1_CLR1_EPS1_GRVWA8_GRVWB8_GSU1_GSUC0_GSUWGMRR0_K1_LBSPPA0_LBSPPB0_LPA0_LPB0_LPM2_MIWT1_3_NLCB3_PGR2_PLR1_SU32_SUM0_SUS256_WG64_4_1_WGM8_WGMXCC1_WGMXCCGn1
    SolutionIndex: 2
    SolutionNameMin: Cijk_Ailk_Bjlk_HHS_BH_Bias_FDMN_SPA_AS_SAV_MT64x192x64_MI32x32x1_SN_LDSB1_CLR1_EPS1_GRVWA8_GRVWB8_GSU1_GSUC0_GSUWGMRR0_K1_LBSPPA0_LBSPPB0_LPA0_LPB0_LPM2_MIWT1_3_NLCB3_PGR2_PLR1_SU32_SUM0_SUS256_WG64_4_1_WGM16_WGMXCC1_WGMXCCGn1
    SolutionIndex: 3
    SolutionNameMin: Cijk_Ailk_Bjlk_HHS_BH_Bias_FDMN_SPA_AS_SAV_MT64x192x64_MI32x32x1_SN_LDSB1_CLR1_EPS1_GRVWA8_GRVWB8_GSU1_GSUC0_GSUWGMRR0_K1_LBSPPA0_LBSPPB0_LPA0_LPB0_LPM2_MIWT1_3_NLCB3_PGR2_PLR1_SU32_SUM0_SUS256_WG64_4_1_WGM32_WGMXCC1_WGMXCCGn1
    SolutionIndex: 4
    SolutionNameMin: Cijk_Ailk_Bjlk_HHS_BH_Bias_FDMN_SPA_AS_SAV_MT128x64x64_MI32x32x1_SN_LDSB1_CLR1_EPS1_GRVWA8_GRVWB8_GSU1_GSUC0_GSUWGMRR0_K1_LBSPPA0_LBSPPB0_LPA0_LPB0_LPM2_MIWT1_1_NLCB1_PGR2_PLR1_SU32_SUM0_SUS256_WG128_4_1_WGM0_WGMXCC1_WGMXCCGn1
    SolutionIndex: 5
    SolutionNameMin: Cijk_Ailk_Bjlk_HHS_BH_Bias_FDMN_SPA_AS_SAV_MT128x64x64_MI32x32x1_SN_LDSB1_CLR1_EPS1_GRVWA8_GRVWB8_GSU1_GSUC0_GSUWGMRR0_K1_LBSPPA0_LBSPPB0_LPA0_LPB0_LPM2_MIWT1_1_NLCB1_PGR2_PLR1_SU32_SUM0_SUS256_WG128_4_1_WGM32_WGMXCC1_WGMXCCGn1
    SolutionIndex: 6
    SolutionNameMin: Cijk_Ailk_Bjlk_HHS_BH_Bias_FDMN_SPA_AS_SAV_MT16x16x128_MI16x16x1_SN_LDSB0_CLR1_EPS1_GRVWA8_GRVWB8_GSU1_GSUC0_GSUWGMRR0_K1_LBSPPA256_LBSPPB256_LPA16_LPB16_LPM2_MIWT1_1_NLCB1_PGR2_PLR0_SU32_SUM0_SUS256_WG16_4_1_WGM32_WGMXCC1_WGMXCCGn1
    SolutionIndex: 7
    SolutionNameMin: Cijk_Ailk_Bjlk_HHS_BH_Bias_FDMN_SPA_AS_SAV_MT64x32x128_MI16x16x1_SN_LDSB1_CLR1_EPS1_GRVWA8_GRVWB8_GSU1_GSUC0_GSUWGMRR0_K1_LBSPPA1024_LBSPPB512_LPA16_LPB16_LPM2_MIWT1_1_NLCB1_PGR2_PLR1_SU32_SUM0_SUS256_WG64_8_1_WGM0_WGMXCC1_WGMXCCGn1
- - - [14336, 8, 1, 4096, 14336, 14336, 14336, 8]
    - [7, 15.72]
  - - [4096, 8, 1, 14336, 4096, 4096, 4096, 8]
    - [6, 6.68]
  - - [3072, 3072, 1, 10240, 3072, 3072, 3072, 3072]
    - [2, 232.75]
  - - [3072, 1536, 1, 768, 3072, 3072, 3072, 1536]
    - [0, 129.3]
  - - [3072, 17664, 1, 768, 3072, 3072, 3072, 17664]
    - [0, 206.94]
  - - [3072, 196608, 1, 768, 3072, 3072, 3072, 196608]
    - [0, 221.09]
  - - [3072, 24576, 1, 768, 3072, 3072, 3072, 24576]
    - [3, 214.84]
  - - [3072, 6144, 1, 768, 3072, 3072, 3072, 6144]
    - [3, 196.76]
  - - [3072, 98304, 1, 768, 3072, 3072, 3072, 98304]
    - [0, 220.04]
  - - [768, 1536, 1, 3072, 768, 768, 768, 1536]
    - [5, 87.77]
  - - [768, 1536, 1, 768, 768, 768, 768, 1536]
    - [4, 62.49]
  - - [768, 17664, 1, 3072, 768, 768, 768, 17664]
    - [1, 202.03]
  - - [768, 17664, 1, 768, 768, 768, 768, 17664]
    - [3, 171.39]
  - - [768, 196608, 1, 3072, 768, 768, 768, 196608]
    - [1, 238.49]
  - - [768, 196608, 1, 768, 768, 768, 768, 196608]
    - [2, 214.43]
  - - [768, 24576, 1, 3072, 768, 768, 768, 24576]
    - [1, 229.42]
  - - [768, 24576, 1, 768, 768, 768, 768, 24576]
    - [2, 195.55]
  - - [768, 6144, 1, 3072, 768, 768, 768, 6144]
    - [2, 166.45]
  - - [768, 6144, 1, 768, 768, 768, 768, 6144]
    - [2, 130.44]
  - - [768, 98304, 1, 3072, 768, 768, 768, 98304]
    - [1, 237.63]
  - - [768, 98304, 1, 768, 768, 768, 768, 98304]
    - [2, 211.56]
- null
- null
- DeviceEfficiency
- GridBased
