projects/hipsparselt/library/src/hcc_detail/rocsparselt/src/spmm/Tensile/Logic/asm_full/gfx950/Gridbased/gfx950_Cijk_Ailk_Bjlk_I8I8S_BH_Bias_FDMN_SPB_AS_SAV.yaml
- {MinimumRequiredVersion: 4.33.0}
- gfx950
- gfx950
- [Device 0058]
    SolutionIndex: 0
    SolutionNameMin: Cijk_Ailk_Bjlk_I8I8S_BH_Bias_FDMN_SPB_AS_SAV_MT128x64x128_MI16x16x1_SN_LDSB1_CLR1_GRVWB8_GSU2_GSUC0_GSUWGMRR0_K1_LBSPPA2048_LBSPPB1024_LPA16_LPB16_MIWT2_2_NLCB1_PLR0_SU32_SUM0_SUS256_WG64_8_1_WGM16_WGMXCC1_WGMXCCGn1
    SolutionIndex: 1
    SolutionNameMin: Cijk_Ailk_Bjlk_I8I8S_BH_Bias_FDMN_SPB_AS_SAV_MT128x128x128_MI16x16x1_SN_LDSB1_CLR0_GRVWB16_GSU1_GSUC0_GSUWGMRR0_K1_LBSPPA2048_LBSPPB2048_LPA16_LPB16_MIWT2_4_NLCB1_PLR0_SU32_SUM0_SUS256_WG64_8_1_WGM0_WGMXCC1_WGMXCCGn1
    SolutionIndex: 2
    SolutionNameMin: Cijk_Ailk_Bjlk_I8I8S_BH_Bias_FDMN_SPB_AS_SAV_MT128x128x128_MI16x16x1_SN_LDSB1_CLR1_GRVWB16_GSU1_GSUC0_GSUWGMRR0_K1_LBSPPA2048_LBSPPB2048_LPA16_LPB16_MIWT2_4_NLCB1_PLR0_SU32_SUM0_SUS256_WG64_8_1_WGM8_WGMXCC1_WGMXCCGn1
    SolutionIndex: 3
    SolutionNameMin: Cijk_Ailk_Bjlk_I8I8S_BH_Bias_FDMN_SPB_AS_SAV_MT128x128x128_MI16x16x1_SN_LDSB1_CLR0_GRVWB16_GSU1_GSUC0_GSUWGMRR0_K1_LBSPPA2048_LBSPPB2048_LPA16_LPB16_MIWT2_4_NLCB1_PLR0_SU32_SUM0_SUS256_WG64_8_1_WGM8_WGMXCC1_WGMXCCGn1
    SolutionIndex: 4
    SolutionNameMin: Cijk_Ailk_Bjlk_I8I8S_BH_Bias_FDMN_SPB_AS_SAV_MT128x128x128_MI16x16x1_SN_LDSB1_CLR1_GRVWB16_GSU2_GSUC0_GSUWGMRR0_K1_LBSPPA2048_LBSPPB2048_LPA16_LPB16_MIWT2_4_NLCB1_PLR0_SU32_SUM0_SUS256_WG64_8_1_WGM8_WGMXCC1_WGMXCCGn1
    SolutionIndex: 5
    SolutionNameMin: Cijk_Ailk_Bjlk_I8I8S_BH_Bias_FDMN_SPB_AS_SAV_MT128x128x128_MI16x16x1_SN_LDSB1_CLR1_GRVWB16_GSU1_GSUC0_GSUWGMRR0_K1_LBSPPA2048_LBSPPB2048_LPA16_LPB16_MIWT2_4_NLCB1_PLR0_SU32_SUM0_SUS256_WG64_8_1_WGM16_WGMXCC1_WGMXCCGn1
    SolutionIndex: 6
    SolutionNameMin: Cijk_Ailk_Bjlk_I8I8S_BH_Bias_FDMN_SPB_AS_SAV_MT128x128x128_MI16x16x1_SN_LDSB1_CLR0_GRVWB16_GSU1_GSUC0_GSUWGMRR0_K1_LBSPPA2048_LBSPPB2048_LPA16_LPB16_MIWT2_4_NLCB1_PLR0_SU32_SUM0_SUS256_WG64_8_1_WGM16_WGMXCC1_WGMXCCGn1
    SolutionIndex: 7
    SolutionNameMin: Cijk_Ailk_Bjlk_I8I8S_BH_Bias_FDMN_SPB_AS_SAV_MT128x64x128_MI32x32x1_SN_LDSB1_CLR1_GRVWB8_GSU1_GSUC0_GSUWGMRR0_K1_LBSPPA0_LBSPPB0_LPA0_LPB0_MIWT1_1_NLCB1_PLR0_SU32_SUM0_SUS256_WG128_4_1_WGM0_WGMXCC1_WGMXCCGn1
    SolutionIndex: 8
    SolutionNameMin: Cijk_Ailk_Bjlk_I8I8S_BH_Bias_FDMN_SPB_AS_SAV_MT128x64x128_MI32x32x1_SN_LDSB1_CLR1_GRVWB8_GSU1_GSUC0_GSUWGMRR0_K1_LBSPPA0_LBSPPB0_LPA0_LPB0_MIWT1_1_NLCB1_PLR0_SU32_SUM0_SUS256_WG128_4_1_WGM8_WGMXCC1_WGMXCCGn1
    SolutionIndex: 9
    SolutionNameMin: Cijk_Ailk_Bjlk_I8I8S_BH_Bias_FDMN_SPB_AS_SAV_MT64x32x256_MI16x16x1_SN_LDSB1_CLR1_GRVWB8_GSU2_GSUC0_GSUWGMRR0_K1_LBSPPA1024_LBSPPB512_LPA16_LPB16_MIWT1_1_NLCB1_PLR1_SU32_SUM0_SUS256_WG64_8_1_WGM0_WGMXCC1_WGMXCCGn1
- - - [14336, 8, 1, 4096, 14336, 14336, 14336, 8]
    - [0, 10.09]
  - - [4096, 8, 1, 14336, 4096, 4096, 4096, 8]
    - [9, 6.11]
  - - [3072, 3072, 1, 10240, 3072, 3072, 3072, 3072]
    - [4, 195.64]
  - - [3072, 1536, 1, 768, 3072, 3072, 3072, 1536]
    - [3, 92.21]
  - - [3072, 17664, 1, 768, 3072, 3072, 3072, 17664]
    - [6, 172.36]
  - - [3072, 196608, 1, 768, 3072, 3072, 3072, 196608]
    - [3, 177.34]
  - - [3072, 24576, 1, 768, 3072, 3072, 3072, 24576]
    - [2, 175.38]
  - - [3072, 6144, 1, 768, 3072, 3072, 3072, 6144]
    - [3, 154.12]
  - - [3072, 98304, 1, 768, 3072, 3072, 3072, 98304]
    - [2, 177.79]
  - - [768, 1536, 1, 3072, 768, 768, 768, 1536]
    - [8, 76.74]
  - - [768, 1536, 1, 768, 768, 768, 768, 1536]
    - [7, 56.94]
  - - [768, 17664, 1, 3072, 768, 768, 768, 17664]
    - [6, 180.95]
  - - [768, 17664, 1, 768, 768, 768, 768, 17664]
    - [6, 138.97]
  - - [768, 196608, 1, 3072, 768, 768, 768, 196608]
    - [2, 218.89]
  - - [768, 196608, 1, 768, 768, 768, 768, 196608]
    - [2, 174.45]
  - - [768, 24576, 1, 3072, 768, 768, 768, 24576]
    - [1, 192.17]
  - - [768, 24576, 1, 768, 768, 768, 768, 24576]
    - [5, 149.07]
  - - [768, 6144, 1, 3072, 768, 768, 768, 6144]
    - [2, 125.14]
  - - [768, 6144, 1, 768, 768, 768, 768, 6144]
    - [3, 94.64]
  - - [768, 98304, 1, 3072, 768, 768, 768, 98304]
    - [3, 215.83]
  - - [768, 98304, 1, 768, 768, 768, 768, 98304]
    - [2, 171.18]
- null
- null
- DeviceEfficiency
- GridBased
