projects/hipsparselt/library/src/hcc_detail/rocsparselt/src/spmm/Tensile/Logic/asm_full/gfx950/Gridbased/gfx950_Cijk_Ailk_Bjlk_I8BS_BH_Bias_FDMN_SPA_AS_SAV.yaml
- {MinimumRequiredVersion: 4.33.0}
- gfx950
- gfx950
- [Device 0058]
    SolutionIndex: 0
    SolutionNameMin: Cijk_Ailk_Bjlk_I8BS_BH_Bias_FDMN_SPA_AS_SAV_MT64x32x128_MI16x16x1_SN_LDSB0_CLR1_GRVWA8_GRVWB8_GSU2_GSUC0_GSUWGMRR0_K1_LBSPPA1024_LBSPPB512_LPA16_LPB16_LPM2_MIWT1_1_NLCB1_PLR0_SU32_SUM0_SUS256_WG64_8_1_WGM0_WGMXCC1_WGMXCCGn1
    SolutionIndex: 1
    SolutionNameMin: Cijk_Ailk_Bjlk_I8BS_BH_Bias_FDMN_SPA_AS_SAV_MT64x32x128_MI16x16x1_SN_LDSB0_CLR0_GRVWA8_GRVWB8_GSU2_GSUC0_GSUWGMRR0_K1_LBSPPA1024_LBSPPB512_LPA16_LPB16_LPM2_MIWT1_1_NLCB1_PLR0_SU32_SUM0_SUS256_WG64_8_1_WGM0_WGMXCC1_WGMXCCGn1
    SolutionIndex: 2
    SolutionNameMin: Cijk_Ailk_Bjlk_I8BS_BH_Bias_FDMN_SPA_AS_SAV_MT128x128x128_MI16x16x1_SN_LDSB1_CLR1_GRVWA16_GRVWB16_GSU1_GSUC0_GSUWGMRR0_K1_LBSPPA2048_LBSPPB2048_LPA16_LPB16_LPM4_MIWT2_4_NLCB1_PLR0_SU32_SUM0_SUS256_WG64_8_1_WGM8_WGMXCC1_WGMXCCGn1
    SolutionIndex: 3
    SolutionNameMin: Cijk_Ailk_Bjlk_I8BS_BH_Bias_FDMN_SPA_AS_SAV_MT128x128x128_MI16x16x1_SN_LDSB1_CLR0_GRVWA16_GRVWB16_GSU1_GSUC0_GSUWGMRR0_K1_LBSPPA2048_LBSPPB2048_LPA16_LPB16_LPM4_MIWT2_4_NLCB1_PLR0_SU32_SUM0_SUS256_WG64_8_1_WGM8_WGMXCC1_WGMXCCGn1
    SolutionIndex: 4
    SolutionNameMin: Cijk_Ailk_Bjlk_I8BS_BH_Bias_FDMN_SPA_AS_SAV_MT128x128x128_MI16x16x1_SN_LDSB1_CLR1_GRVWA16_GRVWB16_GSU1_GSUC0_GSUWGMRR0_K1_LBSPPA2048_LBSPPB2048_LPA16_LPB16_LPM4_MIWT2_4_NLCB1_PLR0_SU32_SUM0_SUS256_WG64_8_1_WGM16_WGMXCC1_WGMXCCGn1
    SolutionIndex: 5
    SolutionNameMin: Cijk_Ailk_Bjlk_I8BS_BH_Bias_FDMN_SPA_AS_SAV_MT128x128x128_MI16x16x1_SN_LDSB1_CLR0_GRVWA16_GRVWB16_GSU1_GSUC0_GSUWGMRR0_K1_LBSPPA2048_LBSPPB2048_LPA16_LPB16_LPM4_MIWT2_4_NLCB1_PLR0_SU32_SUM0_SUS256_WG64_8_1_WGM16_WGMXCC1_WGMXCCGn1
    SolutionIndex: 6
    SolutionNameMin: Cijk_Ailk_Bjlk_I8BS_BH_Bias_FDMN_SPA_AS_SAV_MT128x64x256_MI16x16x1_SN_LDSB1_CLR1_GRVWA16_GRVWB16_GSU1_GSUC0_GSUWGMRR0_K1_LBSPPA2048_LBSPPB1024_LPA16_LPB16_LPM4_MIWT2_2_NLCB1_PLR0_SU32_SUM0_SUS256_WG64_8_1_WGM0_WGMXCC1_WGMXCCGn1
    SolutionIndex: 7
    SolutionNameMin: Cijk_Ailk_Bjlk_I8BS_BH_Bias_FDMN_SPA_AS_SAV_MT128x64x256_MI16x16x1_SN_LDSB1_CLR1_GRVWA16_GRVWB16_GSU1_GSUC0_GSUWGMRR0_K1_LBSPPA2048_LBSPPB1024_LPA16_LPB16_LPM4_MIWT2_2_NLCB1_PLR0_SU32_SUM0_SUS256_WG64_8_1_WGM8_WGMXCC1_WGMXCCGn1
- - - [14336, 8, 1, 4096, 14336, 14336, 14336, 8]
    - [1, 10.2]
  - - [4096, 8, 1, 14336, 4096, 4096, 4096, 8]
    - [0, 4.84]
  - - [3072, 3072, 1, 10240, 3072, 3072, 3072, 3072]
    - [3, 178.65]
  - - [3072, 1536, 1, 768, 3072, 3072, 3072, 1536]
    - [2, 92.84]
  - - [3072, 17664, 1, 768, 3072, 3072, 3072, 17664]
    - [5, 173.74]
  - - [3072, 196608, 1, 768, 3072, 3072, 3072, 196608]
    - [3, 176.4]
  - - [3072, 24576, 1, 768, 3072, 3072, 3072, 24576]
    - [2, 174.21]
  - - [3072, 6144, 1, 768, 3072, 3072, 3072, 6144]
    - [2, 154.11]
  - - [3072, 98304, 1, 768, 3072, 3072, 3072, 98304]
    - [3, 176.19]
  - - [768, 1536, 1, 3072, 768, 768, 768, 1536]
    - [7, 87.79]
  - - [768, 1536, 1, 768, 768, 768, 768, 1536]
    - [6, 56.68]
  - - [768, 17664, 1, 3072, 768, 768, 768, 17664]
    - [5, 177.29]
  - - [768, 17664, 1, 768, 768, 768, 768, 17664]
    - [5, 136.98]
  - - [768, 196608, 1, 3072, 768, 768, 768, 196608]
    - [3, 210.45]
  - - [768, 196608, 1, 768, 768, 768, 768, 196608]
    - [3, 167.81]
  - - [768, 24576, 1, 3072, 768, 768, 768, 24576]
    - [4, 180.99]
  - - [768, 24576, 1, 768, 768, 768, 768, 24576]
    - [4, 141.9]
  - - [768, 6144, 1, 3072, 768, 768, 768, 6144]
    - [7, 125.9]
  - - [768, 6144, 1, 768, 768, 768, 768, 6144]
    - [2, 92.28]
  - - [768, 98304, 1, 3072, 768, 768, 768, 98304]
    - [5, 205.54]
  - - [768, 98304, 1, 768, 768, 768, 768, 98304]
    - [2, 163.59]
- null
- null
- DeviceEfficiency
- GridBased
