projects/hipsparselt/library/src/hcc_detail/rocsparselt/src/spmm/Tensile/Logic/asm_full/gfx950/Gridbased/gfx950_Cijk_Alik_Bjlk_I8BS_BH_Bias_FDMN_SPA_AS_SAV.yaml
- {MinimumRequiredVersion: 4.33.0}
- gfx950
- gfx950
- [Device 0058]
    SolutionIndex: 0
    SolutionNameMin: Cijk_Alik_Bjlk_I8BS_BH_Bias_FDMN_SPA_AS_SAV_MT64x32x128_MI16x16x1_SN_LDSB0_CLR1_GRVWA8_GRVWB8_GSU2_GSUC0_GSUWGMRR0_K1_LBSPPB512_LPA8_LPB16_LPM2_MIWT1_1_NLCB1_PLR0_SU32_SUM0_SUS256_WG64_8_1_WGM0_WGMXCC1_WGMXCCGn1
    SolutionIndex: 1
    SolutionNameMin: Cijk_Alik_Bjlk_I8BS_BH_Bias_FDMN_SPA_AS_SAV_MT128x64x128_MI16x16x1_SN_LDSB1_CLR1_GRVWA16_GRVWB16_GSU1_GSUC0_GSUWGMRR0_K1_LBSPPB1024_LPA16_LPB16_LPM4_MIWT2_2_NLCB1_PLR0_SU32_SUM0_SUS256_WG64_8_1_WGM8_WGMXCC1_WGMXCCGn1
    SolutionIndex: 2
    SolutionNameMin: Cijk_Alik_Bjlk_I8BS_BH_Bias_FDMN_SPA_AS_SAV_MT128x64x128_MI16x16x1_SN_LDSB1_CLR0_GRVWA16_GRVWB16_GSU1_GSUC0_GSUWGMRR0_K1_LBSPPB1024_LPA16_LPB16_LPM4_MIWT2_2_NLCB1_PLR0_SU32_SUM0_SUS256_WG64_8_1_WGM8_WGMXCC1_WGMXCCGn1
    SolutionIndex: 3
    SolutionNameMin: Cijk_Alik_Bjlk_I8BS_BH_Bias_FDMN_SPA_AS_SAV_MT128x64x128_MI16x16x1_SN_LDSB1_CLR1_GRVWA16_GRVWB16_GSU1_GSUC0_GSUWGMRR0_K1_LBSPPB1024_LPA16_LPB16_LPM4_MIWT2_2_NLCB1_PLR0_SU32_SUM0_SUS256_WG64_8_1_WGM16_WGMXCC1_WGMXCCGn1
    SolutionIndex: 4
    SolutionNameMin: Cijk_Alik_Bjlk_I8BS_BH_Bias_FDMN_SPA_AS_SAV_MT128x64x128_MI16x16x1_SN_LDSB1_CLR0_GRVWA16_GRVWB16_GSU1_GSUC0_GSUWGMRR0_K1_LBSPPB1024_LPA16_LPB16_LPM4_MIWT2_2_NLCB1_PLR0_SU32_SUM0_SUS256_WG64_8_1_WGM16_WGMXCC1_WGMXCCGn1
    SolutionIndex: 5
    SolutionNameMin: Cijk_Alik_Bjlk_I8BS_BH_Bias_FDMN_SPA_AS_SAV_MT64x192x128_MI32x32x1_SN_LDSB1_CLR1_GRVWA16_GRVWB16_GSU1_GSUC0_GSUWGMRR0_K1_LBSPPB0_LPA16_LPB0_LPM4_MIWT1_3_NLCB3_PLR0_SU32_SUM0_SUS256_WG64_4_1_WGM0_WGMXCC1_WGMXCCGn1
    SolutionIndex: 6
    SolutionNameMin: Cijk_Alik_Bjlk_I8BS_BH_Bias_FDMN_SPA_AS_SAV_MT128x64x256_MI16x16x1_SN_LDSB1_CLR1_GRVWA16_GRVWB16_GSU1_GSUC0_GSUWGMRR0_K1_LBSPPB1024_LPA16_LPB16_LPM4_MIWT2_2_NLCB1_PLR0_SU32_SUM0_SUS256_WG64_8_1_WGM8_WGMXCC1_WGMXCCGn1
    SolutionIndex: 7
    SolutionNameMin: Cijk_Alik_Bjlk_I8BS_BH_Bias_FDMN_SPA_AS_SAV_MT128x64x256_MI32x32x1_SN_LDSB1_CLR1_GRVWA16_GRVWB16_GSU1_GSUC0_GSUWGMRR0_K1_LBSPPB0_LPA16_LPB0_LPM4_MIWT1_1_NLCB1_PLR0_SU32_SUM0_SUS256_WG128_4_1_WGM8_WGMXCC1_WGMXCCGn1
- - - [14336, 8, 1, 4096, 14336, 14336, 4096, 8]
    - [0, 11.86]
  - - [4096, 8, 1, 14336, 4096, 4096, 14336, 8]
    - [0, 4.76]
  - - [3072, 3072, 1, 10240, 3072, 3072, 10240, 3072]
    - [5, 223.21]
  - - [3072, 1536, 1, 768, 3072, 3072, 768, 1536]
    - [1, 127.62]
  - - [3072, 17664, 1, 768, 3072, 3072, 768, 17664]
    - [3, 213.45]
  - - [3072, 196608, 1, 768, 3072, 3072, 768, 196608]
    - [2, 216.94]
  - - [3072, 24576, 1, 768, 3072, 3072, 768, 24576]
    - [3, 210.99]
  - - [3072, 6144, 1, 768, 3072, 3072, 768, 6144]
    - [4, 190.34]
  - - [3072, 98304, 1, 768, 3072, 3072, 768, 98304]
    - [2, 217.34]
  - - [768, 1536, 1, 3072, 768, 768, 3072, 1536]
    - [7, 99.77]
  - - [768, 1536, 1, 768, 768, 768, 768, 1536]
    - [6, 63.06]
  - - [768, 17664, 1, 3072, 768, 768, 3072, 17664]
    - [3, 196.81]
  - - [768, 17664, 1, 768, 768, 768, 768, 17664]
    - [3, 170.31]
  - - [768, 196608, 1, 3072, 768, 768, 3072, 196608]
    - [3, 230.73]
  - - [768, 196608, 1, 768, 768, 768, 768, 196608]
    - [4, 193.57]
  - - [768, 24576, 1, 3072, 768, 768, 3072, 24576]
    - [3, 205.94]
  - - [768, 24576, 1, 768, 768, 768, 768, 24576]
    - [3, 172.53]
  - - [768, 6144, 1, 3072, 768, 768, 3072, 6144]
    - [4, 155.74]
  - - [768, 6144, 1, 768, 768, 768, 768, 6144]
    - [4, 123.33]
  - - [768, 98304, 1, 3072, 768, 768, 3072, 98304]
    - [3, 228.1]
  - - [768, 98304, 1, 768, 768, 768, 768, 98304]
    - [4, 191.53]
- null
- null
- DeviceEfficiency
- GridBased
