projects/hipsparselt/library/src/hcc_detail/rocsparselt/src/spmm/Tensile/Logic/asm_full/gfx950/Gridbased/gfx950_Cijk_Alik_Bljk_F8SS_BH_Bias_FDMN_SPB_AS_SAV.yaml
- {MinimumRequiredVersion: 4.33.0}
- gfx950
- gfx950
- [Device 0058]
    SolutionIndex: 0
    SolutionNameMin: Cijk_Alik_Bljk_F8SS_BH_Bias_FDMN_SPB_AS_SAV_MT64x192x128_MI32x32x1_SN_LDSB1_CLR1_GRVWB16_GSU1_GSUC0_GSUWGMRR0_K1_LBSPPA128_LPA16_LPB16_MIWT1_3_PLR0_SU32_SUM0_SUS256_WG64_4_1_WGM0_WGMXCC1_WGMXCCGn1
    SolutionIndex: 1
    SolutionNameMin: Cijk_Alik_Bljk_F8SS_BH_Bias_FDMN_SPB_AS_SAV_MT64x192x128_MI32x32x1_SN_LDSB1_CLR1_GRVWB16_GSU1_GSUC0_GSUWGMRR0_K1_LBSPPA128_LPA16_LPB16_MIWT1_3_PLR0_SU32_SUM0_SUS256_WG64_4_1_WGM16_WGMXCC1_WGMXCCGn1
    SolutionIndex: 2
    SolutionNameMin: Cijk_Alik_Bljk_F8SS_BH_Bias_FDMN_SPB_AS_SAV_MT256x128x128_MI32x32x1_SN_LDSB1_CLR1_GRVWB16_GSU1_GSUC0_GSUWGMRR0_K1_LBSPPA128_LPA16_LPB16_MIWT2_2_PLR0_SU32_SUM0_SUS256_WG128_4_1_WGM0_WGMXCC1_WGMXCCGn1
    SolutionIndex: 3
    SolutionNameMin: Cijk_Alik_Bljk_F8SS_BH_Bias_FDMN_SPB_AS_SAV_MT256x128x128_MI32x32x1_SN_LDSB1_CLR1_GRVWB16_GSU1_GSUC0_GSUWGMRR0_K1_LBSPPA128_LPA16_LPB16_MIWT2_2_PLR0_SU32_SUM0_SUS256_WG128_4_1_WGM8_WGMXCC1_WGMXCCGn1
    SolutionIndex: 4
    SolutionNameMin: Cijk_Alik_Bljk_F8SS_BH_Bias_FDMN_SPB_AS_SAV_MT256x128x128_MI32x32x1_SN_LDSB1_CLR1_GRVWB16_GSU1_GSUC0_GSUWGMRR0_K1_LBSPPA128_LPA16_LPB16_MIWT2_2_PLR1_SU32_SUM0_SUS256_WG128_4_1_WGM8_WGMXCC1_WGMXCCGn1
    SolutionIndex: 5
    SolutionNameMin: Cijk_Alik_Bljk_F8SS_BH_Bias_FDMN_SPB_AS_SAV_MT256x128x128_MI32x32x1_SN_LDSB1_CLR1_GRVWB16_GSU1_GSUC0_GSUWGMRR0_K1_LBSPPA128_LPA16_LPB16_MIWT2_2_PLR0_SU32_SUM0_SUS256_WG128_4_1_WGM16_WGMXCC1_WGMXCCGn1
    SolutionIndex: 6
    SolutionNameMin: Cijk_Alik_Bljk_F8SS_BH_Bias_FDMN_SPB_AS_SAV_MT16x16x256_MI16x16x1_SN_LDSB0_CLR0_GRVWB16_GSU1_GSUC0_GSUWGMRR0_K1_LBSPPA256_LPA32_LPB16_MIWT1_1_PLR0_SU32_SUM0_SUS256_WG16_4_1_WGM0_WGMXCC1_WGMXCCGn1
    SolutionIndex: 7
    SolutionNameMin: Cijk_Alik_Bljk_F8SS_BH_Bias_FDMN_SPB_AS_SAV_MT16x16x256_MI16x16x1_SN_LDSB0_CLR1_GRVWB16_GSU2_GSUC0_GSUWGMRR0_K1_LBSPPA256_LPA32_LPB16_MIWT1_1_PLR0_SU32_SUM0_SUS256_WG16_4_1_WGM0_WGMXCC1_WGMXCCGn1
    SolutionIndex: 8
    SolutionNameMin: Cijk_Alik_Bljk_F8SS_BH_Bias_FDMN_SPB_AS_SAV_MT32x32x256_MI32x32x1_SN_LDSB0_CLR1_GRVWB16_GSU1_GSUC0_GSUWGMRR0_K1_LBSPPA256_LPA16_LPB16_MIWT1_1_PLR0_SU32_SUM0_SUS256_WG32_2_1_WGM8_WGMXCC1_WGMXCCGn1
    SolutionIndex: 9
    SolutionNameMin: Cijk_Alik_Bljk_F8SS_BH_Bias_FDMN_SPB_AS_SAV_MT32x32x256_MI32x32x1_SN_LDSB0_CLR1_GRVWB16_GSU1_GSUC0_GSUWGMRR0_K1_LBSPPA256_LPA16_LPB16_MIWT1_1_PLR0_SU32_SUM0_SUS256_WG32_2_1_WGM16_WGMXCC1_WGMXCCGn1
- - - [14336, 8, 1, 4096, 14336, 14336, 4096, 4096]
    - [6, 23.2]
  - - [4096, 8, 1, 14336, 4096, 4096, 14336, 14336]
    - [7, 15.63]
  - - [3072, 3072, 1, 10240, 3072, 3072, 10240, 10240]
    - [0, 479.61]
  - - [3072, 1536, 1, 768, 3072, 3072, 768, 768]
    - [0, 202.15]
  - - [3072, 17664, 1, 768, 3072, 3072, 768, 768]
    - [5, 371.92]
  - - [3072, 196608, 1, 768, 3072, 3072, 768, 768]
    - [5, 407.42]
  - - [3072, 24576, 1, 768, 3072, 3072, 768, 768]
    - [5, 398.61]
  - - [3072, 6144, 1, 768, 3072, 3072, 768, 768]
    - [5, 316.8]
  - - [3072, 98304, 1, 768, 3072, 3072, 768, 768]
    - [5, 407.07]
  - - [768, 1536, 1, 3072, 768, 768, 3072, 3072]
    - [9, 172.64]
  - - [768, 1536, 1, 768, 768, 768, 768, 768]
    - [8, 92.97]
  - - [768, 17664, 1, 3072, 768, 768, 3072, 3072]
    - [3, 486.4]
  - - [768, 17664, 1, 768, 768, 768, 768, 768]
    - [3, 296.59]
  - - [768, 196608, 1, 3072, 768, 768, 3072, 3072]
    - [3, 609.17]
  - - [768, 196608, 1, 768, 768, 768, 768, 768]
    - [4, 392.3]
  - - [768, 24576, 1, 3072, 768, 768, 3072, 3072]
    - [5, 470.25]
  - - [768, 24576, 1, 768, 768, 768, 768, 768]
    - [5, 296.21]
  - - [768, 6144, 1, 3072, 768, 768, 3072, 3072]
    - [1, 331.78]
  - - [768, 6144, 1, 768, 768, 768, 768, 768]
    - [1, 198.57]
  - - [768, 98304, 1, 3072, 768, 768, 3072, 3072]
    - [2, 607.77]
  - - [768, 98304, 1, 768, 768, 768, 768, 768]
    - [3, 384.55]
- null
- null
- DeviceEfficiency
- GridBased
