projects/hipsparselt/library/src/hcc_detail/rocsparselt/src/spmm/Tensile/Logic/asm_full/gfx950/Gridbased/gfx950_Cijk_Alik_Bljk_HHS_BH_Bias_FDMN_SPB_AS_SAV.yaml
- {MinimumRequiredVersion: 4.33.0}
- gfx950
- gfx950
- [Device 0058]
    SolutionIndex: 0
    SolutionNameMin: Cijk_Alik_Bljk_HHS_BH_Bias_FDMN_SPB_AS_SAV_MT128x128x64_MI16x16x1_SN_LDSB1_CLR1_EPS1_GRVWB8_GSU1_GSUC0_GSUWGMRR0_K1_LBSPPA128_LPA16_LPB8_MIWT4_2_PGR2_PLR0_SU32_SUM0_SUS256_WG32_16_1_WGM16_WGMXCC1_WGMXCCGn1
    SolutionIndex: 1
    SolutionNameMin: Cijk_Alik_Bljk_HHS_BH_Bias_FDMN_SPB_AS_SAV_MT128x128x64_MI16x16x1_SN_LDSB1_CLR0_EPS1_GRVWB8_GSU1_GSUC0_GSUWGMRR0_K1_LBSPPA128_LPA16_LPB8_MIWT4_2_PGR2_PLR0_SU32_SUM0_SUS256_WG32_16_1_WGM16_WGMXCC1_WGMXCCGn1
    SolutionIndex: 2
    SolutionNameMin: Cijk_Alik_Bljk_HHS_BH_Bias_FDMN_SPB_AS_SAV_MT64x192x64_MI32x32x1_SN_LDSB1_CLR1_EPS1_GRVWB8_GSU1_GSUC0_GSUWGMRR0_K1_LBSPPA128_LPA8_LPB8_MIWT1_3_PGR2_PLR1_SU32_SUM0_SUS256_WG64_4_1_WGM0_WGMXCC1_WGMXCCGn1
    SolutionIndex: 3
    SolutionNameMin: Cijk_Alik_Bljk_HHS_BH_Bias_FDMN_SPB_AS_SAV_MT256x128x64_MI32x32x1_SN_LDSB1_CLR1_EPS1_GRVWB8_GSU1_GSUC0_GSUWGMRR0_K1_LBSPPA128_LPA8_LPB8_MIWT2_2_PGR2_PLR1_SU32_SUM0_SUS256_WG128_4_1_WGM0_WGMXCC1_WGMXCCGn1
    SolutionIndex: 4
    SolutionNameMin: Cijk_Alik_Bljk_HHS_BH_Bias_FDMN_SPB_AS_SAV_MT256x128x64_MI32x32x1_SN_LDSB1_CLR1_EPS1_GRVWB8_GSU1_GSUC0_GSUWGMRR0_K1_LBSPPA128_LPA8_LPB8_MIWT2_2_PGR2_PLR0_SU32_SUM0_SUS256_WG128_4_1_WGM8_WGMXCC1_WGMXCCGn1
    SolutionIndex: 5
    SolutionNameMin: Cijk_Alik_Bljk_HHS_BH_Bias_FDMN_SPB_AS_SAV_MT256x128x64_MI32x32x1_SN_LDSB1_CLR1_EPS1_GRVWB8_GSU1_GSUC0_GSUWGMRR0_K1_LBSPPA128_LPA8_LPB8_MIWT2_2_PGR2_PLR1_SU32_SUM0_SUS256_WG128_4_1_WGM8_WGMXCC1_WGMXCCGn1
    SolutionIndex: 6
    SolutionNameMin: Cijk_Alik_Bljk_HHS_BH_Bias_FDMN_SPB_AS_SAV_MT256x128x64_MI32x32x1_SN_LDSB1_CLR1_EPS1_GRVWB8_GSU1_GSUC0_GSUWGMRR0_K1_LBSPPA128_LPA8_LPB8_MIWT2_2_PGR2_PLR1_SU32_SUM0_SUS256_WG128_4_1_WGM16_WGMXCC1_WGMXCCGn1
    SolutionIndex: 7
    SolutionNameMin: Cijk_Alik_Bljk_HHS_BH_Bias_FDMN_SPB_AS_SAV_MT256x256x64_MI32x32x1_SN_LDSB0_CLR0_EPS0_GRVWB8_GSU1_GSUC0_GSUWGMRR0_K1_LBSPPA128_LPA8_LPB8_MIWT4_2_PGR0_PLR0_SU32_SUM0_SUS256_WG64_8_1_WGM8_WGMXCC1_WGMXCCGn1
    SolutionIndex: 8
    SolutionNameMin: Cijk_Alik_Bljk_HHS_BH_Bias_FDMN_SPB_AS_SAV_MT256x256x64_MI32x32x1_SN_LDSB0_CLR0_EPS0_GRVWB8_GSU1_GSUC0_GSUWGMRR0_K1_LBSPPA128_LPA8_LPB8_MIWT4_2_PGR0_PLR0_SU32_SUM0_SUS256_WG64_8_1_WGM16_WGMXCC1_WGMXCCGn1
    SolutionIndex: 9
    SolutionNameMin: Cijk_Alik_Bljk_HHS_BH_Bias_FDMN_SPB_AS_SAV_MT16x16x128_MI16x16x1_SN_LDSB0_CLR1_EPS1_GRVWB8_GSU1_GSUC0_GSUWGMRR0_K1_LBSPPA256_LPA16_LPB8_MIWT1_1_PGR2_PLR0_SU32_SUM0_SUS256_WG16_4_1_WGM0_WGMXCC1_WGMXCCGn1
    SolutionIndex: 10
    SolutionNameMin: Cijk_Alik_Bljk_HHS_BH_Bias_FDMN_SPB_AS_SAV_MT16x16x128_MI16x16x1_SN_LDSB0_CLR0_EPS1_GRVWB8_GSU1_GSUC0_GSUWGMRR0_K1_LBSPPA256_LPA16_LPB8_MIWT1_1_PGR2_PLR0_SU32_SUM0_SUS256_WG16_4_1_WGM0_WGMXCC1_WGMXCCGn1
    SolutionIndex: 11
    SolutionNameMin: Cijk_Alik_Bljk_HHS_BH_Bias_FDMN_SPB_AS_SAV_MT128x64x128_MI32x32x1_SN_LDSB1_CLR1_EPS1_GRVWB8_GSU1_GSUC0_GSUWGMRR0_K1_LBSPPA256_LPA8_LPB8_MIWT1_1_PGR2_PLR2_SU32_SUM0_SUS256_WG128_4_1_WGM0_WGMXCC1_WGMXCCGn1
    SolutionIndex: 12
    SolutionNameMin: Cijk_Alik_Bljk_HHS_BH_Bias_FDMN_SPB_AS_SAV_MT128x64x128_MI32x32x1_SN_LDSB1_CLR1_EPS1_GRVWB8_GSU1_GSUC0_GSUWGMRR0_K1_LBSPPA256_LPA8_LPB8_MIWT1_1_PGR2_PLR2_SU32_SUM0_SUS256_WG128_4_1_WGM8_WGMXCC1_WGMXCCGn1
- - - [14336, 8, 1, 4096, 14336, 14336, 4096, 4096]
    - [9, 15.01]
  - - [4096, 8, 1, 14336, 4096, 4096, 14336, 14336]
    - [10, 7.06]
  - - [3072, 3072, 1, 10240, 3072, 3072, 10240, 10240]
    - [2, 302.18]
  - - [3072, 1536, 1, 768, 3072, 3072, 768, 768]
    - [3, 167.6]
  - - [3072, 17664, 1, 768, 3072, 3072, 768, 768]
    - [0, 308.23]
  - - [3072, 196608, 1, 768, 3072, 3072, 768, 768]
    - [8, 340.0]
  - - [3072, 24576, 1, 768, 3072, 3072, 768, 768]
    - [6, 319.9]
  - - [3072, 6144, 1, 768, 3072, 3072, 768, 768]
    - [0, 269.18]
  - - [3072, 98304, 1, 768, 3072, 3072, 768, 768]
    - [8, 338.15]
  - - [768, 1536, 1, 3072, 768, 768, 3072, 3072]
    - [12, 134.58]
  - - [768, 1536, 1, 768, 768, 768, 768, 768]
    - [11, 82.47]
  - - [768, 17664, 1, 3072, 768, 768, 3072, 3072]
    - [5, 360.52]
  - - [768, 17664, 1, 768, 768, 768, 768, 768]
    - [7, 245.92]
  - - [768, 196608, 1, 3072, 768, 768, 3072, 3072]
    - [6, 442.54]
  - - [768, 196608, 1, 768, 768, 768, 768, 768]
    - [7, 329.74]
  - - [768, 24576, 1, 3072, 768, 768, 3072, 3072]
    - [6, 343.81]
  - - [768, 24576, 1, 768, 768, 768, 768, 768]
    - [1, 257.82]
  - - [768, 6144, 1, 3072, 768, 768, 3072, 3072]
    - [5, 250.04]
  - - [768, 6144, 1, 768, 768, 768, 768, 768]
    - [4, 170.45]
  - - [768, 98304, 1, 3072, 768, 768, 3072, 3072]
    - [6, 441.08]
  - - [768, 98304, 1, 768, 768, 768, 768, 768]
    - [6, 311.37]
- null
- null
- DeviceEfficiency
- GridBased
