projects/hipsparselt/library/src/hcc_detail/rocsparselt/src/spmm/Tensile/Logic/asm_full/gfx950/Gridbased/gfx950_Cijk_Alik_Bjlk_BBS_BH_Bias_FDMN_SPA_AS_SAV.yaml
- {MinimumRequiredVersion: 4.33.0}
- gfx950
- gfx950
- [Device 0058]
    SolutionIndex: 0
    SolutionNameMin: Cijk_Alik_Bjlk_BBS_BH_Bias_FDMN_SPA_AS_SAV_MT128x128x64_MI16x16x1_SN_LDSB1_CLR0_EPS1_GRVWA8_GRVWB8_GSU1_GSUC0_GSUWGMRR0_K1_LBSPPB2048_LPA8_LPB16_LPM2_MIWT4_2_NLCB1_PGR2_PLR0_SU32_SUM0_SUS256_WG32_16_1_WGM0_WGMXCC1_WGMXCCGn1
    SolutionIndex: 1
    SolutionNameMin: Cijk_Alik_Bjlk_BBS_BH_Bias_FDMN_SPA_AS_SAV_MT128x128x64_MI16x16x1_SN_LDSB1_CLR1_EPS1_GRVWA8_GRVWB8_GSU1_GSUC0_GSUWGMRR0_K1_LBSPPB2048_LPA8_LPB16_LPM2_MIWT4_2_NLCB1_PGR2_PLR0_SU32_SUM0_SUS256_WG32_16_1_WGM8_WGMXCC1_WGMXCCGn1
    SolutionIndex: 2
    SolutionNameMin: Cijk_Alik_Bjlk_BBS_BH_Bias_FDMN_SPA_AS_SAV_MT128x128x64_MI16x16x1_SN_LDSB1_CLR0_EPS1_GRVWA8_GRVWB8_GSU1_GSUC0_GSUWGMRR0_K1_LBSPPB2048_LPA8_LPB16_LPM2_MIWT4_2_NLCB1_PGR2_PLR0_SU32_SUM0_SUS256_WG32_16_1_WGM8_WGMXCC1_WGMXCCGn1
    SolutionIndex: 3
    SolutionNameMin: Cijk_Alik_Bjlk_BBS_BH_Bias_FDMN_SPA_AS_SAV_MT128x128x64_MI16x16x1_SN_LDSB1_CLR1_EPS1_GRVWA8_GRVWB8_GSU1_GSUC0_GSUWGMRR0_K1_LBSPPB2048_LPA8_LPB16_LPM2_MIWT4_2_NLCB1_PGR2_PLR0_SU32_SUM0_SUS256_WG32_16_1_WGM16_WGMXCC1_WGMXCCGn1
    SolutionIndex: 4
    SolutionNameMin: Cijk_Alik_Bjlk_BBS_BH_Bias_FDMN_SPA_AS_SAV_MT128x128x64_MI16x16x1_SN_LDSB1_CLR0_EPS1_GRVWA8_GRVWB8_GSU1_GSUC0_GSUWGMRR0_K1_LBSPPB2048_LPA8_LPB16_LPM2_MIWT4_2_NLCB1_PGR2_PLR0_SU32_SUM0_SUS256_WG32_16_1_WGM16_WGMXCC1_WGMXCCGn1
    SolutionIndex: 5
    SolutionNameMin: Cijk_Alik_Bjlk_BBS_BH_Bias_FDMN_SPA_AS_SAV_MT64x192x64_MI32x32x1_SN_LDSB1_CLR1_EPS1_GRVWA8_GRVWB8_GSU1_GSUC0_GSUWGMRR0_K1_LBSPPB0_LPA8_LPB0_LPM2_MIWT1_3_NLCB3_PGR2_PLR0_SU32_SUM0_SUS256_WG64_4_1_WGM0_WGMXCC1_WGMXCCGn1
    SolutionIndex: 6
    SolutionNameMin: Cijk_Alik_Bjlk_BBS_BH_Bias_FDMN_SPA_AS_SAV_MT64x192x64_MI32x32x1_SN_LDSB1_CLR1_EPS1_GRVWA8_GRVWB8_GSU1_GSUC0_GSUWGMRR0_K1_LBSPPB0_LPA8_LPB0_LPM2_MIWT1_3_NLCB3_PGR2_PLR0_SU32_SUM0_SUS256_WG64_4_1_WGM16_WGMXCC1_WGMXCCGn1
    SolutionIndex: 7
    SolutionNameMin: Cijk_Alik_Bjlk_BBS_BH_Bias_FDMN_SPA_AS_SAV_MT64x192x64_MI32x32x1_SN_LDSB1_CLR1_EPS1_GRVWA8_GRVWB8_GSU1_GSUC0_GSUWGMRR0_K1_LBSPPB0_LPA8_LPB0_LPM2_MIWT1_3_NLCB3_PGR2_PLR1_SU32_SUM0_SUS256_WG64_4_1_WGM16_WGMXCC1_WGMXCCGn1
    SolutionIndex: 8
    SolutionNameMin: Cijk_Alik_Bjlk_BBS_BH_Bias_FDMN_SPA_AS_SAV_MT128x64x64_MI32x32x1_SN_LDSB1_CLR1_EPS1_GRVWA8_GRVWB8_GSU1_GSUC0_GSUWGMRR0_K1_LBSPPB0_LPA8_LPB0_LPM2_MIWT1_1_NLCB1_PGR2_PLR1_SU32_SUM0_SUS256_WG128_4_1_WGM0_WGMXCC1_WGMXCCGn1
    SolutionIndex: 9
    SolutionNameMin: Cijk_Alik_Bjlk_BBS_BH_Bias_FDMN_SPA_AS_SAV_MT128x64x64_MI32x32x1_SN_LDSB1_CLR1_EPS1_GRVWA8_GRVWB8_GSU1_GSUC0_GSUWGMRR0_K1_LBSPPB0_LPA8_LPB0_LPM2_MIWT1_1_NLCB1_PGR2_PLR1_SU32_SUM0_SUS256_WG128_4_1_WGM16_WGMXCC1_WGMXCCGn1
    SolutionIndex: 10
    SolutionNameMin: Cijk_Alik_Bjlk_BBS_BH_Bias_FDMN_SPA_AS_SAV_MT16x16x128_MI16x16x1_SN_LDSB0_CLR0_EPS1_GRVWA8_GRVWB8_GSU1_GSUC0_GSUWGMRR0_K1_LBSPPB256_LPA8_LPB16_LPM2_MIWT1_1_NLCB1_PGR2_PLR0_SU32_SUM0_SUS256_WG16_4_1_WGM0_WGMXCC1_WGMXCCGn1
- - - [14336, 8, 1, 4096, 14336, 14336, 4096, 8]
    - [10, 17.3]
  - - [4096, 8, 1, 14336, 4096, 4096, 14336, 8]
    - [10, 7.29]
  - - [3072, 3072, 1, 10240, 3072, 3072, 10240, 3072]
    - [7, 242.16]
  - - [3072, 1536, 1, 768, 3072, 3072, 768, 1536]
    - [5, 134.09]
  - - [3072, 17664, 1, 768, 3072, 3072, 768, 17664]
    - [4, 261.91]
  - - [3072, 196608, 1, 768, 3072, 3072, 768, 196608]
    - [0, 275.01]
  - - [3072, 24576, 1, 768, 3072, 3072, 768, 24576]
    - [4, 264.48]
  - - [3072, 6144, 1, 768, 3072, 3072, 768, 6144]
    - [4, 225.01]
  - - [3072, 98304, 1, 768, 3072, 3072, 768, 98304]
    - [3, 273.41]
  - - [768, 1536, 1, 3072, 768, 768, 3072, 1536]
    - [9, 88.63]
  - - [768, 1536, 1, 768, 768, 768, 768, 1536]
    - [8, 64.53]
  - - [768, 17664, 1, 3072, 768, 768, 3072, 17664]
    - [3, 238.99]
  - - [768, 17664, 1, 768, 768, 768, 768, 17664]
    - [3, 198.5]
  - - [768, 196608, 1, 3072, 768, 768, 3072, 196608]
    - [2, 303.35]
  - - [768, 196608, 1, 768, 768, 768, 768, 196608]
    - [3, 261.21]
  - - [768, 24576, 1, 3072, 768, 768, 3072, 24576]
    - [3, 265.01]
  - - [768, 24576, 1, 768, 768, 768, 768, 24576]
    - [4, 218.4]
  - - [768, 6144, 1, 3072, 768, 768, 3072, 6144]
    - [7, 173.22]
  - - [768, 6144, 1, 768, 768, 768, 768, 6144]
    - [6, 135.15]
  - - [768, 98304, 1, 3072, 768, 768, 3072, 98304]
    - [1, 300.55]
  - - [768, 98304, 1, 768, 768, 768, 768, 98304]
    - [4, 253.66]
- null
- null
- DeviceEfficiency
- GridBased
