projects/hipsparselt/library/src/hcc_detail/rocsparselt/src/spmm/Tensile/Logic/asm_full/gfx950/Gridbased/gfx950_Cijk_Ailk_Bljk_F8SS_BH_Bias_FDMN_SPB_AS_SAV.yaml
- {MinimumRequiredVersion: 4.33.0}
- gfx950
- gfx950
- [Device 0058]
    SolutionIndex: 0
    SolutionNameMin: Cijk_Ailk_Bljk_F8SS_BH_Bias_FDMN_SPB_AS_SAV_MT32x96x128_MI16x16x1_SN_LDSB0_CLR0_GRVWB8_GSU1_GSUC0_GSUWGMRR0_K1_LBSPPA512_LPA16_LPB8_MIWT1_3_PLR0_SU32_SUM0_SUS256_WG32_8_1_WGM8_WGMXCC1_WGMXCCGn1
    SolutionIndex: 1
    SolutionNameMin: Cijk_Ailk_Bljk_F8SS_BH_Bias_FDMN_SPB_AS_SAV_MT64x32x128_MI16x16x1_SN_LDSB0_CLR0_GRVWB4_GSU2_GSUC0_GSUWGMRR0_K1_LBSPPA1024_LPA16_LPB8_MIWT1_1_PLR0_SU32_SUM0_SUS256_WG64_8_1_WGM0_WGMXCC1_WGMXCCGn1
    SolutionIndex: 2
    SolutionNameMin: Cijk_Ailk_Bljk_F8SS_BH_Bias_FDMN_SPB_AS_SAV_MT128x128x128_MI16x16x1_SN_LDSB1_CLR1_GRVWB16_GSU1_GSUC0_GSUWGMRR0_K1_LBSPPA2048_LPA16_LPB16_MIWT2_4_PLR0_SU32_SUM0_SUS256_WG64_8_1_WGM0_WGMXCC1_WGMXCCGn1
    SolutionIndex: 3
    SolutionNameMin: Cijk_Ailk_Bljk_F8SS_BH_Bias_FDMN_SPB_AS_SAV_MT128x128x128_MI16x16x1_SN_LDSB1_CLR0_GRVWB16_GSU1_GSUC0_GSUWGMRR0_K1_LBSPPA2048_LPA16_LPB16_MIWT2_4_PLR0_SU32_SUM0_SUS256_WG64_8_1_WGM0_WGMXCC1_WGMXCCGn1
    SolutionIndex: 4
    SolutionNameMin: Cijk_Ailk_Bljk_F8SS_BH_Bias_FDMN_SPB_AS_SAV_MT128x128x128_MI16x16x1_SN_LDSB1_CLR1_GRVWB16_GSU1_GSUC0_GSUWGMRR0_K1_LBSPPA2048_LPA16_LPB16_MIWT2_4_PLR0_SU32_SUM0_SUS256_WG64_8_1_WGM8_WGMXCC1_WGMXCCGn1
    SolutionIndex: 5
    SolutionNameMin: Cijk_Ailk_Bljk_F8SS_BH_Bias_FDMN_SPB_AS_SAV_MT128x128x128_MI16x16x1_SN_LDSB1_CLR0_GRVWB16_GSU1_GSUC0_GSUWGMRR0_K1_LBSPPA2048_LPA16_LPB16_MIWT2_4_PLR0_SU32_SUM0_SUS256_WG64_8_1_WGM16_WGMXCC1_WGMXCCGn1
    SolutionIndex: 6
    SolutionNameMin: Cijk_Ailk_Bljk_F8SS_BH_Bias_FDMN_SPB_AS_SAV_MT64x192x128_MI32x32x1_SN_LDSB1_CLR1_GRVWB16_GSU1_GSUC0_GSUWGMRR0_K1_LBSPPA0_LPA0_LPB16_MIWT1_3_PLR0_SU32_SUM0_SUS256_WG64_4_1_WGM0_WGMXCC1_WGMXCCGn1
    SolutionIndex: 7
    SolutionNameMin: Cijk_Ailk_Bljk_F8SS_BH_Bias_FDMN_SPB_AS_SAV_MT64x192x128_MI32x32x1_SN_LDSB1_CLR1_GRVWB16_GSU2_GSUC0_GSUWGMRR0_K1_LBSPPA0_LPA0_LPB16_MIWT1_3_PLR0_SU32_SUM0_SUS256_WG64_4_1_WGM0_WGMXCC1_WGMXCCGn1
    SolutionIndex: 8
    SolutionNameMin: Cijk_Ailk_Bljk_F8SS_BH_Bias_FDMN_SPB_AS_SAV_MT64x192x128_MI32x32x1_SN_LDSB1_CLR1_GRVWB16_GSU1_GSUC0_GSUWGMRR0_K1_LBSPPA0_LPA0_LPB16_MIWT1_3_PLR0_SU32_SUM0_SUS256_WG64_4_1_WGM16_WGMXCC1_WGMXCCGn1
    SolutionIndex: 9
    SolutionNameMin: Cijk_Ailk_Bljk_F8SS_BH_Bias_FDMN_SPB_AS_SAV_MT64x32x256_MI16x16x1_SN_LDSB1_CLR1_GRVWB8_GSU2_GSUC0_GSUWGMRR0_K1_LBSPPA1024_LPA16_LPB8_MIWT1_1_PLR0_SU32_SUM0_SUS256_WG64_8_1_WGM0_WGMXCC1_WGMXCCGn1
- - - [14336, 8, 1, 4096, 14336, 14336, 14336, 4096]
    - [1, 14.17]
  - - [4096, 8, 1, 14336, 4096, 4096, 4096, 14336]
    - [9, 8.0]
  - - [3072, 3072, 1, 10240, 3072, 3072, 3072, 10240]
    - [6, 299.32]
  - - [3072, 1536, 1, 768, 3072, 3072, 3072, 768]
    - [6, 110.5]
  - - [3072, 17664, 1, 768, 3072, 3072, 3072, 768]
    - [3, 173.27]
  - - [3072, 196608, 1, 768, 3072, 3072, 3072, 768]
    - [3, 187.45]
  - - [3072, 24576, 1, 768, 3072, 3072, 3072, 768]
    - [3, 176.96]
  - - [3072, 6144, 1, 768, 3072, 3072, 3072, 768]
    - [6, 159.82]
  - - [3072, 98304, 1, 768, 3072, 3072, 3072, 768]
    - [3, 185.2]
  - - [768, 1536, 1, 3072, 768, 768, 768, 3072]
    - [7, 105.23]
  - - [768, 1536, 1, 768, 768, 768, 768, 768]
    - [0, 63.71]
  - - [768, 17664, 1, 3072, 768, 768, 768, 3072]
    - [8, 228.04]
  - - [768, 17664, 1, 768, 768, 768, 768, 768]
    - [8, 139.56]
  - - [768, 196608, 1, 3072, 768, 768, 768, 3072]
    - [4, 274.91]
  - - [768, 196608, 1, 768, 768, 768, 768, 768]
    - [2, 179.49]
  - - [768, 24576, 1, 3072, 768, 768, 768, 3072]
    - [8, 253.18]
  - - [768, 24576, 1, 768, 768, 768, 768, 768]
    - [8, 157.53]
  - - [768, 6144, 1, 3072, 768, 768, 768, 3072]
    - [8, 195.12]
  - - [768, 6144, 1, 768, 768, 768, 768, 768]
    - [8, 110.72]
  - - [768, 98304, 1, 3072, 768, 768, 768, 3072]
    - [4, 270.31]
  - - [768, 98304, 1, 768, 768, 768, 768, 768]
    - [5, 175.24]
- null
- null
- DeviceEfficiency
- GridBased
