projects/hipsparselt/library/src/hcc_detail/rocsparselt/src/spmm/Tensile/Logic/asm_full/gfx950/Gridbased/gfx950_Cijk_Alik_Bjlk_B8SS_BH_Bias_FDMN_SPB_AS_SAV.yaml
- {MinimumRequiredVersion: 4.33.0}
- gfx950
- gfx950
- [Device 0058]
    SolutionIndex: 0
    SolutionNameMin: Cijk_Alik_Bjlk_B8SS_BH_Bias_FDMN_SPB_AS_SAV_MT128x128x128_MI16x16x1_SN_LDSB1_CLR0_GRVWB16_GSU1_GSUC0_GSUWGMRR0_K1_LBSPPA128_LBSPPB2048_LPA32_LPB16_MIWT4_2_NLCB1_PLR0_SU32_SUM0_SUS256_WG32_16_1_WGM8_WGMXCC1_WGMXCCGn1
    SolutionIndex: 1
    SolutionNameMin: Cijk_Alik_Bjlk_B8SS_BH_Bias_FDMN_SPB_AS_SAV_MT128x128x128_MI16x16x1_SN_LDSB1_CLR0_GRVWB16_GSU1_GSUC0_GSUWGMRR0_K1_LBSPPA128_LBSPPB2048_LPA32_LPB16_MIWT4_2_NLCB1_PLR0_SU32_SUM0_SUS256_WG32_16_1_WGM16_WGMXCC1_WGMXCCGn1
    SolutionIndex: 2
    SolutionNameMin: Cijk_Alik_Bjlk_B8SS_BH_Bias_FDMN_SPB_AS_SAV_MT128x64x128_MI32x32x1_SN_LDSB1_CLR1_GRVWB8_GSU1_GSUC0_GSUWGMRR0_K1_LBSPPA128_LBSPPB0_LPA16_LPB0_MIWT1_1_NLCB1_PLR0_SU32_SUM0_SUS256_WG128_4_1_WGM0_WGMXCC1_WGMXCCGn1
    SolutionIndex: 3
    SolutionNameMin: Cijk_Alik_Bjlk_B8SS_BH_Bias_FDMN_SPB_AS_SAV_MT128x64x128_MI32x32x1_SN_LDSB1_CLR1_GRVWB8_GSU1_GSUC0_GSUWGMRR0_K1_LBSPPA128_LBSPPB0_LPA16_LPB0_MIWT1_1_NLCB1_PLR0_SU32_SUM0_SUS256_WG128_4_1_WGM8_WGMXCC1_WGMXCCGn1
    SolutionIndex: 4
    SolutionNameMin: Cijk_Alik_Bjlk_B8SS_BH_Bias_FDMN_SPB_AS_SAV_MT128x64x128_MI32x32x1_SN_LDSB1_CLR1_GRVWB8_GSU1_GSUC0_GSUWGMRR0_K1_LBSPPA128_LBSPPB0_LPA16_LPB0_MIWT1_1_NLCB1_PLR0_SU32_SUM0_SUS256_WG128_4_1_WGM16_WGMXCC1_WGMXCCGn1
    SolutionIndex: 5
    SolutionNameMin: Cijk_Alik_Bjlk_B8SS_BH_Bias_FDMN_SPB_AS_SAV_MT32x32x256_MI32x32x1_SN_LDSB0_CLR1_GRVWB8_GSU2_GSUC0_GSUWGMRR0_K1_LBSPPA256_LBSPPB0_LPA16_LPB0_MIWT1_1_NLCB1_PLR0_SU32_SUM0_SUS256_WG32_2_1_WGM0_WGMXCC1_WGMXCCGn1
    SolutionIndex: 6
    SolutionNameMin: Cijk_Alik_Bjlk_B8SS_BH_Bias_FDMN_SPB_AS_SAV_MT128x64x256_MI32x32x1_SN_LDSB1_CLR1_GRVWB8_GSU1_GSUC0_GSUWGMRR0_K1_LBSPPA256_LBSPPB0_LPA16_LPB0_MIWT1_1_NLCB1_PLR0_SU32_SUM0_SUS256_WG128_4_1_WGM0_WGMXCC1_WGMXCCGn1
    SolutionIndex: 7
    SolutionNameMin: Cijk_Alik_Bjlk_B8SS_BH_Bias_FDMN_SPB_AS_SAV_MT128x64x256_MI32x32x1_SN_LDSB1_CLR1_GRVWB8_GSU1_GSUC0_GSUWGMRR0_K1_LBSPPA256_LBSPPB0_LPA16_LPB0_MIWT1_1_NLCB1_PLR0_SU32_SUM0_SUS256_WG128_4_1_WGM8_WGMXCC1_WGMXCCGn1
- - - [14336, 8, 1, 4096, 14336, 14336, 4096, 8]
    - [5, 20.8]
  - - [4096, 8, 1, 14336, 4096, 4096, 14336, 8]
    - [5, 12.91]
  - - [3072, 3072, 1, 10240, 3072, 3072, 10240, 3072]
    - [0, 310.32]
  - - [3072, 1536, 1, 768, 3072, 3072, 768, 1536]
    - [4, 151.42]
  - - [3072, 17664, 1, 768, 3072, 3072, 768, 17664]
    - [4, 246.77]
  - - [3072, 196608, 1, 768, 3072, 3072, 768, 196608]
    - [3, 258.78]
  - - [3072, 24576, 1, 768, 3072, 3072, 768, 24576]
    - [3, 251.77]
  - - [3072, 6144, 1, 768, 3072, 3072, 768, 6144]
    - [4, 227.09]
  - - [3072, 98304, 1, 768, 3072, 3072, 768, 98304]
    - [3, 258.69]
  - - [768, 1536, 1, 3072, 768, 768, 3072, 1536]
    - [7, 137.08]
  - - [768, 1536, 1, 768, 768, 768, 768, 1536]
    - [6, 80.92]
  - - [768, 17664, 1, 3072, 768, 768, 3072, 17664]
    - [1, 291.99]
  - - [768, 17664, 1, 768, 768, 768, 768, 17664]
    - [2, 197.89]
  - - [768, 196608, 1, 3072, 768, 768, 3072, 196608]
    - [0, 337.91]
  - - [768, 196608, 1, 768, 768, 768, 768, 196608]
    - [4, 232.09]
  - - [768, 24576, 1, 3072, 768, 768, 3072, 24576]
    - [4, 298.84]
  - - [768, 24576, 1, 768, 768, 768, 768, 24576]
    - [2, 209.45]
  - - [768, 6144, 1, 3072, 768, 768, 3072, 6144]
    - [4, 218.12]
  - - [768, 6144, 1, 768, 768, 768, 768, 6144]
    - [4, 154.05]
  - - [768, 98304, 1, 3072, 768, 768, 3072, 98304]
    - [0, 332.32]
  - - [768, 98304, 1, 768, 768, 768, 768, 98304]
    - [4, 228.86]
- null
- null
- DeviceEfficiency
- GridBased
