projects/hipblaslt/library/src/amd_detail/rocblaslt/src/Tensile/Logic/asm_full/aquavanjaram/gfx942_80cu/Equality/aquavanjaram_Cijk_Ailk_Bljk_SB_UserArgs.yaml
- {MinimumRequiredVersion: 4.33.0}
- aquavanjaram
- {Architecture: gfx942, CUCount: 80}
- [Device 0049, Device 0050]
    SolutionIndex: 0
    SolutionNameMin: Cijk_Ailk_Bljk_SB_UserArgs_MT128x64x32_MI16x16x1_SN_GRVWB4_GSU1_LBSPPA2048_LBSPPB512_MIWT2_4_NTC0_NTD0_NEPBS8_PLR1_SU4_SUM0_SUS256_SVW2_VWA2_VWB4_WSGRA1_WSGRB0_WG64_4_1_WGM1
    SolutionIndex: 1
    SolutionNameMin: Cijk_Ailk_Bljk_SB_UserArgs_MT128x64x32_MI16x16x1_SN_GRVWB4_GSU1_LBSPPA2048_LBSPPB256_MIWT2_4_NTC3_NTD3_NEPBS8_PLR1_SU0_SUM0_SUS0_SVW2_VWA2_VWB2_WSGRA0_WSGRB1_WG64_4_1_WGM1
    SolutionIndex: 2
    SolutionNameMin: Cijk_Ailk_Bljk_SB_UserArgs_MT64x128x32_MI16x16x1_SN_GRVWB4_GSU1_LBSPPA1024_LBSPPB256_MIWT4_2_NTC3_NTD3_NEPBS8_PLR1_SU0_SUM0_SUS0_SVW4_VWA4_VWB2_WSGRA0_WSGRB0_WG16_16_1_WGM8
    SolutionIndex: 3
    SolutionNameMin: Cijk_Ailk_Bljk_SB_HAS_UserArgs_MT32x16x32_MI16x16x1_SN_GRVWA4_GRVWB4_GSU8_GSUC0_GSUWGMRR0_K1_LBSPPA512_LBSPPB128_LPA16_LPB8_LRVW4_MIWT1_1_NLCA1_SU4_SUM0_SUS256_SVW1_VWA1_VWB1_WG32_4_1_WGM8_WGMXCC4_WGMXCCG80
    SolutionIndex: 4
    SolutionNameMin: Cijk_Ailk_Bljk_SB_HAS_UserArgs_MT32x16x64_MI16x16x1_SN_GRVWA4_GRVWB4_GSU1_GSUC0_GSUWGMRR0_K1_LBSPPA512_LBSPPB256_LPA16_LPB8_LRVW4_MIWT1_1_NLCA1_SU0_SUM0_SUS0_SVW1_VWA1_VWB1_WG32_4_1_WGM8_WGMXCC4_WGMXCCG80
    SolutionIndex: 5
    SolutionNameMin: Cijk_Ailk_Bljk_SB_HAS_UserArgs_MT32x32x32_MI16x16x1_SN_GRVWA4_GRVWB4_GSU1_GSUC0_GSUWGMRR0_K1_LBSPPA512_LBSPPB128_LPA16_LPB8_LRVW4_MIWT1_1_NLCA1_SU0_SUM0_SUS0_SVW1_VWA1_VWB1_WG32_8_1_WGM8_WGMXCC4_WGMXCCG80
    SolutionIndex: 6
    SolutionNameMin: Cijk_Ailk_Bljk_SB_HAS_UserArgs_MT64x32x64_MI16x16x1_SN_GRVWA4_GRVWB4_GSU1_GSUC0_GSUWGMRR0_K1_LBSPPA1024_LBSPPB256_LPA0_LPB8_LRVW4_MIWT2_1_NLCA1_SU0_SUM0_SUS0_SVW2_VWA2_VWB1_WG32_8_1_WGM8_WGMXCC4_WGMXCCG80
    SolutionIndex: 7
    SolutionNameMin: Cijk_Ailk_Bljk_SB_HAS_UserArgs_MT64x48x32_MI16x16x1_SN_GRVWA4_GRVWB2_GSU8_GSUC0_GSUWGMRR0_K1_LBSPPA1024_LBSPPB128_LPA16_LPB8_LRVW4_MIWT1_3_NLCA1_SU4_SUM0_SUS256_SVW1_VWA1_VWB1_WG64_4_1_WGM8_WGMXCC4_WGMXCCG80
    SolutionIndex: 8
    SolutionNameMin: Cijk_Ailk_Bljk_SB_HAS_UserArgs_MT32x32x64_MI16x16x1_SN_GRVWA4_GRVWB4_GSU1_GSUC0_GSUWGMRR0_K1_LBSPPA512_LBSPPB256_LPA16_LPB8_LRVW4_MIWT1_1_NLCA1_SU0_SUM0_SUS0_SVW1_VWA1_VWB1_WG32_8_1_WGM8_WGMXCC4_WGMXCCG80
    SolutionIndex: 9
    SolutionNameMin: Cijk_Ailk_Bljk_SB_HAS_UserArgs_MT32x32x32_MI16x16x1_SN_GRVWA4_GRVWB4_GSU8_GSUC0_GSUWGMRR0_K1_LBSPPA512_LBSPPB128_LPA0_LPB8_LRVW4_MIWT2_1_NLCA1_SU4_SUM0_SUS256_SVW2_VWA2_VWB1_WG16_8_1_WGM8_WGMXCC4_WGMXCCG80
    SolutionIndex: 10
    SolutionNameMin: Cijk_Ailk_Bljk_SB_HAS_UserArgs_MT32x32x32_MI16x16x1_SN_GRVWA4_GRVWB4_GSU1_GSUC0_GSUWGMRR0_K1_LBSPPA512_LBSPPB128_LPA16_LPB8_LRVW4_MIWT1_1_NLCA1_SU4_SUM0_SUS256_SVW1_VWA1_VWB1_WG32_8_1_WGM8_WGMXCC4_WGMXCCG80
    SolutionIndex: 11
    SolutionNameMin: Cijk_Ailk_Bljk_SB_HAS_UserArgs_MT32x32x32_MI16x16x1_SN_GRVWA4_GRVWB4_GSU3_GSUC0_GSUWGMRR0_K1_LBSPPA512_LBSPPB256_LPA0_LPB8_LRVW4_MIWT2_2_NLCA1_SU4_SUM0_SUS256_SVW2_VWA2_VWB2_WG16_4_1_WGM8_WGMXCC4_WGMXCCG80
    SolutionIndex: 12
    SolutionNameMin: Cijk_Ailk_Bljk_SB_HAS_UserArgs_MT64x16x32_MI16x16x1_SN_GRVWA4_GRVWB4_GSU8_GSUC0_GSUWGMRR0_K1_LBSPPA1024_LBSPPB128_LPA0_LPB8_LRVW4_MIWT4_1_NLCA1_SU0_SUM0_SUS0_SVW4_VWA4_VWB1_WG16_4_1_WGM8_WGMXCC4_WGMXCCG80
    SolutionIndex: 13
    SolutionNameMin: Cijk_Ailk_Bljk_SB_HAS_UserArgs_MT32x32x32_MI16x16x1_SN_GRVWA4_GRVWB4_GSU16_GSUC0_GSUWGMRR0_K1_LBSPPA512_LBSPPB128_LPA16_LPB8_LRVW4_MIWT1_1_NLCA1_SU0_SUM0_SUS0_SVW1_VWA1_VWB1_WG32_8_1_WGM8_WGMXCC4_WGMXCCG80
    SolutionIndex: 14
    SolutionNameMin: Cijk_Ailk_Bljk_SB_HAS_UserArgs_MT32x32x32_MI16x16x1_SN_GRVWA4_GRVWB4_GSU1_GSUC0_GSUWGMRR0_K1_LBSPPA512_LBSPPB128_LPA0_LPB8_LRVW4_MIWT2_1_NLCA1_SU0_SUM0_SUS0_SVW2_VWA2_VWB1_WG16_8_1_WGM8_WGMXCC4_WGMXCCG80
    SolutionIndex: 15
    SolutionNameMin: Cijk_Ailk_Bljk_SB_HAS_UserArgs_MT192x32x32_MI16x16x1_SN_GRVWA4_GRVWB4_GSU1_GSUC0_GSUWGMRR0_K1_LBSPPA3072_LBSPPB128_LPA0_LPB8_LRVW4_MIWT6_1_NLCA3_SU0_SUM0_SUS0_SVW2_VWA2_VWB1_WG32_8_1_WGM8_WGMXCC4_WGMXCCG80
    SolutionIndex: 16
    SolutionNameMin: Cijk_Ailk_Bljk_SB_HAS_UserArgs_MT32x32x32_MI16x16x1_SN_GRVWA4_GRVWB4_GSU8_GSUC0_GSUWGMRR0_K1_LBSPPA512_LBSPPB128_LPA0_LPB8_LRVW4_MIWT2_1_NLCA1_SU0_SUM0_SUS0_SVW2_VWA2_VWB1_WG16_8_1_WGM8_WGMXCC4_WGMXCCG80
    SolutionIndex: 17
    SolutionNameMin: Cijk_Ailk_Bljk_SB_HAS_UserArgs_MT192x256x32_MI16x16x1_SN_GRVWA4_GRVWB4_GSU5_GSUC0_GSUWGMRR0_K1_LBSPPA3072_LBSPPB512_LPA16_LPB8_LRVW4_MIWT3_8_NLCA3_SU0_SUM0_SUS0_SVW1_VWA1_VWB4_WG64_8_1_WGM8_WGMXCC4_WGMXCCG80
    SolutionIndex: 18
    SolutionNameMin: Cijk_Ailk_Bljk_SB_HAS_UserArgs_MT32x16x32_MI16x16x1_SN_GRVWA4_GRVWB4_GSU8_GSUC0_GSUWGMRR0_K1_LBSPPA512_LBSPPB128_LPA16_LPB8_LRVW4_MIWT1_1_NLCA1_SU0_SUM0_SUS0_SVW1_VWA1_VWB1_WG32_4_1_WGM8_WGMXCC4_WGMXCCG80
    SolutionIndex: 19
    SolutionNameMin: Cijk_Ailk_Bljk_SB_HAS_UserArgs_MT48x64x32_MI16x16x1_SN_GRVWA2_GRVWB4_GSU1_GSUC0_GSUWGMRR0_K1_LBSPPA768_LBSPPB128_LPA16_LPB8_LRVW4_MIWT3_1_NLCA3_SU0_SUM0_SUS0_SVW1_VWA1_VWB1_WG16_16_1_WGM8_WGMXCC4_WGMXCCG80
    SolutionIndex: 20
    SolutionNameMin: Cijk_Ailk_Bljk_SB_HAS_UserArgs_MT64x32x32_MI16x16x1_SN_GRVWA4_GRVWB4_GSU3_GSUC0_GSUWGMRR0_K1_LBSPPA1024_LBSPPB128_LPA0_LPB8_LRVW4_MIWT2_1_NLCA1_SU4_SUM0_SUS256_SVW2_VWA2_VWB1_WG32_8_1_WGM8_WGMXCC4_WGMXCCG80
    SolutionIndex: 21
    SolutionNameMin: Cijk_Ailk_Bljk_SB_HAS_UserArgs_MT256x208x32_MI16x16x1_SN_GRVWA4_GRVWB2_GSU1_GSUC0_GSUWGMRR0_K1_LBSPPA2048_LBSPPB128_LPA0_LPB2_LRVW2_MIWT4_13_NLCA1_SU4_SUM0_SUS256_SVW4_VWA4_VWB1_WG64_4_1_WGM8_WGMXCC4_WGMXCCG80
    SolutionIndex: 22
    SolutionNameMin: Cijk_Ailk_Bljk_SB_HAS_UserArgs_MT128x16x32_MI16x16x1_SN_GRVWA4_GRVWB2_GSU4_GSUC0_GSUWGMRR0_K1_LBSPPA2048_LBSPPB128_LPA0_LPB8_LRVW4_MIWT2_1_NLCA1_SU4_SUM0_SUS256_SVW2_VWA2_VWB1_WG64_4_1_WGM8_WGMXCC4_WGMXCCG80
    SolutionIndex: 23
    SolutionNameMin: Cijk_Ailk_Bljk_SB_HAS_UserArgs_MT32x16x64_MI16x16x1_SN_GRVWA4_GRVWB4_GSU1_GSUC0_GSUWGMRR0_K1_LBSPPA512_LBSPPB256_LPA16_LPB8_LRVW4_MIWT1_1_NLCA1_SU4_SUM0_SUS256_SVW1_VWA1_VWB1_WG32_4_1_WGM8_WGMXCC4_WGMXCCG80
    SolutionIndex: 24
    SolutionNameMin: Cijk_Ailk_Bljk_SB_HAS_UserArgs_MT64x32x32_MI16x16x1_SN_GRVWA4_GRVWB4_GSU5_GSUC0_GSUWGMRR0_K1_LBSPPA1024_LBSPPB128_LPA0_LPB8_LRVW4_MIWT2_1_NLCA1_SU0_SUM0_SUS0_SVW2_VWA2_VWB1_WG32_8_1_WGM8_WGMXCC4_WGMXCCG80
    SolutionIndex: 25
    SolutionNameMin: Cijk_Ailk_Bljk_SB_HAS_UserArgs_MT64x48x32_MI16x16x1_SN_GRVWA4_GRVWB2_GSU5_GSUC0_GSUWGMRR0_K1_LBSPPA1024_LBSPPB128_LPA16_LPB8_LRVW4_MIWT1_3_NLCA1_SU0_SUM0_SUS0_SVW1_VWA1_VWB1_WG64_4_1_WGM8_WGMXCC4_WGMXCCG80
    SolutionIndex: 26
    SolutionNameMin: Cijk_Ailk_Bljk_SB_HAS_UserArgs_MT64x64x32_MI16x16x1_SN_GRVWA4_GRVWB4_GSU5_GSUC0_GSUWGMRR0_K1_LBSPPA1024_LBSPPB128_LPA0_LPB8_LRVW4_MIWT4_1_NLCA1_SU0_SUM0_SUS0_SVW4_VWA4_VWB1_WG16_16_1_WGM8_WGMXCC4_WGMXCCG80
    SolutionIndex: 27
    SolutionNameMin: Cijk_Ailk_Bljk_SB_HAS_UserArgs_MT32x64x32_MI16x16x1_SN_GRVWA4_GRVWB4_GSU1_GSUC0_GSUWGMRR0_K1_LBSPPA512_LBSPPB128_LPA0_LPB8_LRVW4_MIWT2_1_NLCA1_SU0_SUM0_SUS0_SVW2_VWA2_VWB1_WG16_16_1_WGM8_WGMXCC4_WGMXCCG80
    SolutionIndex: 28
    SolutionNameMin: Cijk_Ailk_Bljk_SB_HAS_UserArgs_MT128x208x32_MI16x16x1_SN_GRVWA4_GRVWB2_GSU1_GSUC0_GSUWGMRR0_K1_LBSPPA2048_LBSPPB128_LPA0_LPB8_LRVW4_MIWT2_13_NLCA1_SU4_SUM0_SUS256_SVW2_VWA2_VWB1_WG64_4_1_WGM8_WGMXCC4_WGMXCCG80
    SolutionIndex: 29
    SolutionNameMin: Cijk_Ailk_Bljk_SB_HAS_UserArgs_MT64x16x32_MI16x16x1_SN_GRVWA4_GRVWB4_GSU3_GSUC0_GSUWGMRR0_K1_LBSPPA1024_LBSPPB128_LPA0_LPB8_LRVW4_MIWT4_1_NLCA1_SU0_SUM0_SUS0_SVW4_VWA4_VWB1_WG16_4_1_WGM8_WGMXCC4_WGMXCCG80
    SolutionIndex: 30
    SolutionNameMin: Cijk_Ailk_Bljk_SB_HAS_UserArgs_MT64x128x32_MI16x16x1_SN_GRVWA4_GRVWB4_GSU5_GSUC0_GSUWGMRR0_K1_LBSPPA1024_LBSPPB256_LPA0_LPB8_LRVW4_MIWT4_2_NLCA1_SU0_SUM0_SUS0_SVW4_VWA4_VWB2_WG16_16_1_WGM8_WGMXCC4_WGMXCCG80
    SolutionIndex: 31
    SolutionNameMin: Cijk_Ailk_Bljk_SB_HAS_UserArgs_MT160x32x32_MI16x16x1_SN_GRVWA4_GRVWB4_GSU1_GSUC0_GSUWGMRR0_K1_LBSPPA2560_LBSPPB128_LPA16_LPB8_LRVW4_MIWT5_1_NLCA5_SU0_SUM0_SUS0_SVW1_VWA1_VWB1_WG32_8_1_WGM8_WGMXCC4_WGMXCCG80
    SolutionIndex: 32
    SolutionNameMin: Cijk_Ailk_Bljk_SB_HAS_UserArgs_MT32x32x64_MI16x16x1_SN_GRVWA4_GRVWB4_GSU4_GSUC0_GSUWGMRR0_K1_LBSPPA512_LBSPPB256_LPA16_LPB8_LRVW4_MIWT1_1_NLCA1_SU0_SUM0_SUS0_SVW1_VWA1_VWB1_WG32_8_1_WGM8_WGMXCC4_WGMXCCG80
    SolutionIndex: 33
    SolutionNameMin: Cijk_Ailk_Bljk_SB_HAS_UserArgs_MT64x32x32_MI16x16x1_SN_GRVWA4_GRVWB4_GSU5_GSUC0_GSUWGMRR0_K1_LBSPPA1024_LBSPPB128_LPA0_LPB8_LRVW4_MIWT2_1_NLCA1_SU4_SUM0_SUS256_SVW2_VWA2_VWB1_WG32_8_1_WGM8_WGMXCC4_WGMXCCG80
    SolutionIndex: 34
    SolutionNameMin: Cijk_Ailk_Bljk_SB_HAS_UserArgs_MT64x64x32_MI16x16x1_SN_GRVWA4_GRVWB4_GSU1_GSUC0_GSUWGMRR0_K1_LBSPPA1024_LBSPPB128_LPA0_LPB8_LRVW4_MIWT4_1_NLCA1_SU0_SUM0_SUS0_SVW4_VWA4_VWB1_WG16_16_1_WGM8_WGMXCC4_WGMXCCG80
    SolutionIndex: 35
    SolutionNameMin: Cijk_Ailk_Bljk_SB_HAS_UserArgs_MT32x16x64_MI16x16x1_SN_GRVWA4_GRVWB4_GSU8_GSUC0_GSUWGMRR0_K1_LBSPPA512_LBSPPB256_LPA16_LPB8_LRVW4_MIWT1_1_NLCA1_SU0_SUM0_SUS0_SVW1_VWA1_VWB1_WG32_4_1_WGM8_WGMXCC4_WGMXCCG80
    SolutionIndex: 36
    SolutionNameMin: Cijk_Ailk_Bljk_SB_HAS_UserArgs_MT32x64x32_MI16x16x1_SN_GRVWA4_GRVWB4_GSU1_GSUC0_GSUWGMRR0_K1_LBSPPA512_LBSPPB128_LPA0_LPB8_LRVW4_MIWT2_1_NLCA1_SU4_SUM0_SUS256_SVW2_VWA2_VWB1_WG16_16_1_WGM8_WGMXCC4_WGMXCCG80
    SolutionIndex: 37
    SolutionNameMin: Cijk_Ailk_Bljk_SB_HAS_UserArgs_MT64x16x64_MI16x16x1_SN_GRVWA4_GRVWB4_GSU8_GSUC0_GSUWGMRR0_K1_LBSPPA1024_LBSPPB256_LPA16_LPB8_LRVW4_MIWT1_1_NLCA1_SU0_SUM0_SUS0_SVW1_VWA1_VWB1_WG64_4_1_WGM8_WGMXCC4_WGMXCCG80
    SolutionIndex: 38
    SolutionNameMin: Cijk_Ailk_Bljk_SB_HAS_UserArgs_MT32x32x32_MI16x16x1_SN_GRVWA4_GRVWB4_GSU1_GSUC0_GSUWGMRR0_K1_LBSPPA512_LBSPPB256_LPA0_LPB8_LRVW4_MIWT2_2_NLCA1_SU0_SUM0_SUS0_SVW2_VWA2_VWB2_WG16_4_1_WGM8_WGMXCC4_WGMXCCG80
    SolutionIndex: 39
    SolutionNameMin: Cijk_Ailk_Bljk_SB_HAS_UserArgs_MT112x64x32_MI16x16x1_SN_GRVWA2_GRVWB4_GSU2_GSUC0_GSUWGMRR0_K1_LBSPPA1792_LBSPPB128_LPA16_LPB8_LRVW4_MIWT7_1_NLCA7_SU0_SUM0_SUS0_SVW1_VWA1_VWB1_WG16_16_1_WGM8_WGMXCC4_WGMXCCG80
    SolutionIndex: 40
    SolutionNameMin: Cijk_Ailk_Bljk_SB_HAS_UserArgs_MT16x16x32_MI16x16x1_SN_GRVWA4_GRVWB4_GSU16_GSUC0_GSUWGMRR0_K1_LBSPPA256_LBSPPB128_LPA16_LPB8_LRVW4_MIWT1_1_NLCA1_SU0_SUM0_SUS0_SVW1_VWA1_VWB1_WG16_4_1_WGM8_WGMXCC4_WGMXCCG80
    SolutionIndex: 41
    SolutionNameMin: Cijk_Ailk_Bljk_SB_HAS_UserArgs_MT32x16x32_MI16x16x1_SN_GRVWA4_GRVWB4_GSU6_GSUC0_GSUWGMRR0_K1_LBSPPA512_LBSPPB128_LPA0_LPB8_LRVW4_MIWT2_1_NLCA1_SU4_SUM0_SUS256_SVW2_VWA2_VWB1_WG16_4_1_WGM8_WGMXCC4_WGMXCCG80
    SolutionIndex: 42
    SolutionNameMin: Cijk_Ailk_Bljk_SB_HAS_UserArgs_MT32x64x32_MI16x16x1_SN_GRVWA4_GRVWB4_GSU5_GSUC0_GSUWGMRR0_K1_LBSPPA512_LBSPPB128_LPA0_LPB8_LRVW4_MIWT2_1_NLCA1_SU0_SUM0_SUS0_SVW2_VWA2_VWB1_WG16_16_1_WGM8_WGMXCC4_WGMXCCG80
    SolutionIndex: 43
    SolutionNameMin: Cijk_Ailk_Bljk_SB_HAS_UserArgs_MT32x80x32_MI16x16x1_SN_GRVWA4_GRVWB4_GSU1_GSUC0_GSUWGMRR0_K1_LBSPPA512_LBSPPB128_LPA16_LPB8_LRVW4_MIWT1_5_NLCA1_SU0_SUM0_SUS0_SVW1_VWA1_VWB1_WG32_4_1_WGM8_WGMXCC4_WGMXCCG80
    SolutionIndex: 44
    SolutionNameMin: Cijk_Ailk_Bljk_SB_HAS_UserArgs_MT32x16x32_MI16x16x1_SN_GRVWA4_GRVWB4_GSU1_GSUC0_GSUWGMRR0_K1_LBSPPA512_LBSPPB128_LPA16_LPB8_LRVW4_MIWT1_1_NLCA1_SU0_SUM0_SUS0_SVW1_VWA1_VWB1_WG32_4_1_WGM8_WGMXCC4_WGMXCCG80
    SolutionIndex: 45
    SolutionNameMin: Cijk_Ailk_Bljk_SB_HAS_UserArgs_MT32x128x32_MI16x16x1_SN_GRVWA4_GRVWB4_GSU5_GSUC0_GSUWGMRR0_K1_LBSPPA512_LBSPPB256_LPA0_LPB8_LRVW4_MIWT2_2_NLCA1_SU4_SUM0_SUS256_SVW2_VWA2_VWB2_WG16_16_1_WGM8_WGMXCC4_WGMXCCG80
    SolutionIndex: 46
    SolutionNameMin: Cijk_Ailk_Bljk_SB_HAS_UserArgs_MT32x32x32_MI16x16x1_SN_GRVWA4_GRVWB4_GSU1_GSUC0_GSUWGMRR0_K1_LBSPPA512_LBSPPB128_LPA0_LPB8_LRVW4_MIWT2_1_NLCA1_SU4_SUM0_SUS256_SVW2_VWA2_VWB1_WG16_8_1_WGM8_WGMXCC4_WGMXCCG80
    SolutionIndex: 47
    SolutionNameMin: Cijk_Ailk_Bljk_SB_HAS_UserArgs_MT80x64x32_MI16x16x1_SN_GRVWA2_GRVWB4_GSU1_GSUC0_GSUWGMRR0_K1_LBSPPA1280_LBSPPB128_LPA16_LPB8_LRVW4_MIWT5_1_NLCA5_SU4_SUM0_SUS256_SVW1_VWA1_VWB1_WG16_16_1_WGM8_WGMXCC4_WGMXCCG80
    SolutionIndex: 48
    SolutionNameMin: Cijk_Ailk_Bljk_SB_HAS_UserArgs_MT128x32x32_MI16x16x1_SN_GRVWA4_GRVWB4_GSU1_GSUC0_GSUWGMRR0_K1_LBSPPA2048_LBSPPB128_LPA0_LPB8_LRVW4_MIWT4_1_NLCA1_SU0_SUM0_SUS0_SVW4_VWA4_VWB1_WG32_8_1_WGM8_WGMXCC4_WGMXCCG80
    SolutionIndex: 49
    SolutionNameMin: Cijk_Ailk_Bljk_SB_HAS_UserArgs_MT64x16x32_MI16x16x1_SN_GRVWA4_GRVWB4_GSU8_GSUC0_GSUWGMRR0_K1_LBSPPA1024_LBSPPB128_LPA0_LPB8_LRVW4_MIWT4_1_NLCA1_SU4_SUM0_SUS256_SVW4_VWA4_VWB1_WG16_4_1_WGM8_WGMXCC4_WGMXCCG80
    SolutionIndex: 50
    SolutionNameMin: Cijk_Ailk_Bljk_SB_HAS_UserArgs_MT64x16x32_MI16x16x1_SN_GRVWA4_GRVWB4_GSU6_GSUC0_GSUWGMRR0_K1_LBSPPA1024_LBSPPB128_LPA0_LPB8_LRVW4_MIWT4_1_NLCA1_SU4_SUM0_SUS256_SVW4_VWA4_VWB1_WG16_4_1_WGM8_WGMXCC4_WGMXCCG80
    SolutionIndex: 51
    SolutionNameMin: Cijk_Ailk_Bljk_SB_UserArgs_MT16x64x16_MI16x16x1_SN_GRVWA1_GRVWB2_GSU1_GSUC0_GSUWGMRR0_K1_LBSPPA128_LPB2_LRVW2_MIWT1_1_NTA0_NTB0_NTD0_NEPBS0_SU8_SUM0_SUS64_WGM1_WGMXCC8_WGMXCCG0
    SolutionIndex: 52
    SolutionNameMin: Cijk_Ailk_Bljk_SB_UserArgs_MT32x32x64_MI16x16x1_SN_GRVWA4_GRVWB4_GSU1_LBSPPA512_LBSPPB256_LPA16_LPB8_LRVW4_MIWT1_1_NLCA1_SU0_SUM0_SUS0_SVW1_VWA1_WG32_8_1_WGM0
    SolutionIndex: 53
    SolutionNameMin: Cijk_Ailk_Bljk_SB_UserArgs_MT16x64x16_MI16x16x1_SN_GSU1_GSUC0_GSUWGMRR0_K1_MIWT1_1_NTA0_NTB0_NTD0_NEPBS16_SU0_SUM0_SUS0_WGM1_WGMXCC1_WGMXCCG0
    SolutionIndex: 54
    SolutionNameMin: Cijk_Ailk_Bljk_SB_UserArgs_MT48x64x16_MI16x16x1_SN_GSU1_GSUC0_GSUWGMRR0_K1_MIWT3_1_SU4_SUM0_SUS256_WGM8_WGMXCC1_WGMXCCGn1
    SolutionIndex: 55
    SolutionNameMin: Cijk_Ailk_Bljk_SB_UserArgs_MT64x32x16_MI16x16x1_SN_GRVWB2_GSU1_GSUC0_GSUWGMRR0_K1_LBSPPA512_LPB2_LRVW2_MIWT2_1_SU4_SUM0_SUS256_WG32_8_1_WGM8_WGMXCC1_WGMXCCGn1
    SolutionIndex: 56
    SolutionNameMin: Cijk_Ailk_Bljk_SB_SAV_MT128x64x16_MI32x32x2x1_SN_1LDSB0_GRVW4_GSU5_LPB4_LRVW4_NEPBS2_NLCA1_PLR9_SPO1_TT2_32_WG64_4_1
    SolutionIndex: 57
    SolutionNameMin: Cijk_Ailk_Bljk_SB_SAV_MT256x64x16_MI32x32x2x1_SN_1LDSB1_AMAS3_GRVW4_GSU1_LPA0_LPB4_NLCA1_SVW2_TT2_64_VW2_WG128_2_1
    SolutionIndex: 58
    SolutionNameMin: Cijk_Ailk_Bljk_SB_SAV_MT64x16x16_MI16x16x4x1_SN_1LDSB0_GRVW1_GSU7_LPB2_LRVW2_NEPBS2_NLCA1_PLR5_SPO1_TT1_16_WG64_4_1
    SolutionIndex: 59
    SolutionNameMin: Cijk_Ailk_Bljk_SB_SAV_MT128x64x16_MI32x32x2x1_SN_1LDSB0_GRVW4_GSU5_LPB4_LRVW4_NLCA1_PLR9_TT2_32_WG64_4_1
    SolutionIndex: 60
    SolutionNameMin: Cijk_Ailk_Bljk_SB_SAV_MT128x144x16_MI16x16x4x1_SN_1LDSB1_GRVW1_GSU1_LPB2_LRVW2_NEPBS2_NLCA1_PLR5_SPO1_TT2_144_WG64_4_1
    SolutionIndex: 61
    SolutionNameMin: Cijk_Ailk_Bljk_SB_SAV_MT64x32x32_MI16x16x4x1_SN_1LDSB0_GRVW4_GSU5_LPB8_LRVW4_NEPBS2_NLCA1_PLR9_SPO1_TT2_16_WG32_8_1
    SolutionIndex: 62
    SolutionNameMin: Cijk_Ailk_Bljk_SB_UserArgs_MT16x128x32_MI16x16x1_SN_GRVWB4_GSU1_GSUC0_GSUWGMRR0_K1_LBSPPA256_LBSPPB256_LPB8_LRVW4_MIWT1_2_NTB4_SU8_SUM0_SUS256_VWB2_WGM1_WGMXCC1_WGMXCCGn1
    SolutionIndex: 63
    SolutionNameMin: Cijk_Ailk_Bljk_SB_UserArgs_MT256x192x8_MI16x16x1_SN_GRVWB1_GSU1_GSUC0_GSUWGMRR0_K1_LBSPPA2048_LBSPPB128_LPA0_LPB2_LRVW2_MIWT8_6_NTB0_NLCA1_SU8_SUM0_SUS256_SVW4_VWA4_VWB2_WG32_8_1_WGM1_WGMXCC1_WGMXCCGn1
    SolutionIndex: 64
    SolutionNameMin: Cijk_Ailk_Bljk_SB_UserArgs_MT128x256x8_MI32x32x1_SN_GRVWB1_GSU1_GSUC0_GSUWGMRR0_K1_LBSPPA0_LBSPPB128_LPA0_LPB2_LRVW2_MIAV0_MIWT4_2_NTB0_NLCA1_SU8_SUM0_SUS256_SVW4_VWA4_VWB2_WG32_8_1_WGM1_WGMXCC1_WGMXCCGn1
    SolutionIndex: 65
    SolutionNameMin: Cijk_Ailk_Bljk_SB_UserArgs_MT128x224x8_MI16x16x1_SN_GRVWB1_GSU1_GSUC0_GSUWGMRR0_K1_LBSPPA1024_LBSPPB128_LPA0_LPB2_LRVW2_MIWT4_7_NTB0_NLCA1_SU8_SUM0_SUS256_SVW4_VWA4_VWB1_WG32_8_1_WGM1_WGMXCC1_WGMXCCGn1
    SolutionIndex: 66
    SolutionNameMin: Cijk_Ailk_Bljk_SB_UserArgs_MT64x16x128_MI16x16x1_SN_LDSB1_GRVWB4_GSU30_GSUC0_GSUWGMRR0_K1_LBSPPA1024_LBSPPB512_LPA0_LPB8_LRVW4_MIWT2_1_NLCB1_SU0_SUM0_SUS512_SVW2_VWA2_WSGRB0_WG32_4_2_WGM1_WGMXCC1_WGMXCCGn1
    SolutionIndex: 67
    SolutionNameMin: Cijk_Ailk_Bljk_SB_UserArgs_MT16x64x32_MI16x16x1_SN_GRVWB4_GSU1_GSUC0_GSUWGMRR0_K1_LBSPPA256_LBSPPB128_LPB8_LRVW4_MIWT1_1_NTB0_NTC0_NTD0_SU0_SUM0_SUS128_VWB1_WGM1_WGMXCC1_WGMXCCGn1
    SolutionIndex: 68
    SolutionNameMin: Cijk_Ailk_Bljk_SB_UserArgs_MT16x64x32_MI16x16x1_SN_GRVWB1_GSU1_GSUC0_GSUWGMRR0_K1_LBSPPA256_LBSPPB128_LPB8_LRVW4_MIWT1_1_NTB0_NTC0_NTD0_SU0_SUM0_SUS128_VWB1_WGM1_WGMXCC1_WGMXCCGn1
    SolutionIndex: 69
    SolutionNameMin: Cijk_Ailk_Bljk_SB_UserArgs_MT128x224x8_MI16x16x1_SN_GRVWB1_GSU1_GSUC0_GSUWGMRR0_K1_LBSPPA1024_LBSPPB128_LPA0_LPB2_LRVW2_MIAV0_MIWT4_7_NTB0_NLCA1_SU8_SUM0_SUS256_SVW4_VWA4_VWB1_WG32_8_1_WGM1_WGMXCC1_WGMXCCGn1
- - - [4096, 5120, 1, 4096]
    - [1, 0.0]
  - - [8192, 10240, 1, 16384]
    - [0, 0.0]
  - - [8192, 8960, 1, 8192]
    - [1, 0.0]
  - - [10240, 7168, 1, 8192]
    - [2, 0.0]
  - - [512, 15, 1, 1128]
    - [3, 1707.0]
  - - [256, 49, 1, 512]
    - [4, 1504.1]
  - - [128, 512, 1, 160]
    - [5, 3554.49]
  - - [256, 512, 1, 1168]
    - [6, 13987.4]
  - - [256, 512, 1, 256]
    - [6, 8614.75]
  - - [512, 48, 1, 1128]
    - [7, 4514.94]
  - - [256, 235, 1, 512]
    - [8, 6777.1]
  - - [512, 19, 1, 1128]
    - [9, 2051.06]
  - - [128, 512, 1, 444]
    - [10, 5413.58]
  - - [512, 190, 1, 1128]
    - [11, 11202.8]
  - - [512, 73, 1, 1128]
    - [12, 6048.8]
  - - [32, 35, 1, 1302]
    - [13, 290.197]
  - - [256, 512, 1, 540]
    - [14, 10243.0]
  - - [512, 14, 1, 1128]
    - [3, 1601.09]
  - - [768, 512, 1, 128]
    - [15, 10147.5]
  - - [512, 31, 1, 1128]
    - [16, 3300.21]
  - - [1520, 512, 1, 5897]
    - [17, 26225.2]
  - - [256, 16, 1, 512]
    - [18, 515.271]
  - - [444, 512, 1, 444]
    - [19, 13015.3]
  - - [512, 93, 1, 1128]
    - [20, 7367.74]
  - - [256, 57, 1, 512]
    - [4, 1713.56]
  - - [256, 16384, 1, 128]
    - [21, 19259.9]
  - - [512, 76, 1, 1128]
    - [22, 6292.87]
  - - [256, 92, 1, 512]
    - [4, 2759.41]
  - - [512, 72, 1, 1128]
    - [22, 5877.4]
  - - [256, 81, 1, 512]
    - [23, 2477.67]
  - - [512, 49, 1, 1128]
    - [24, 4535.14]
  - - [512, 96, 1, 1128]
    - [25, 7652.65]
  - - [512, 98, 1, 1128]
    - [26, 7251.57]
  - - [512, 86, 1, 1128]
    - [20, 6850.77]
  - - [32, 64, 512, 32]
    - [27, 5111.11]
  - - [128, 16384, 1, 256]
    - [28, 20676.7]
  - - [512, 74, 1, 1128]
    - [22, 6114.12]
  - - [512, 203, 1, 1128]
    - [29, 11683.1]
  - - [256, 101, 1, 512]
    - [4, 3050.29]
  - - [512, 101, 1, 1128]
    - [26, 7531.46]
  - - [256, 512, 1, 1888]
    - [30, 17390.3]
  - - [256, 76, 1, 512]
    - [4, 2289.99]
  - - [512, 16, 1, 1128]
    - [18, 1853.68]
  - - [256, 125, 1, 512]
    - [4, 3669.43]
  - - [768, 512, 1, 320]
    - [31, 15679.6]
  - - [256, 83, 1, 512]
    - [23, 2524.12]
  - - [256, 43, 1, 512]
    - [32, 1310.72]
  - - [256, 512, 1, 640]
    - [6, 13508.2]
  - - [512, 62, 1, 1128]
    - [33, 5670.19]
  - - [128, 512, 1, 800]
    - [10, 8065.97]
  - - [512, 512, 1, 1144]
    - [34, 17512.0]
  - - [32, 17, 1, 1302]
    - [35, 142.369]
  - - [256, 74, 1, 512]
    - [4, 2224.62]
  - - [256, 512, 1, 896]
    - [6, 15008.4]
  - - [32, 40960, 1, 128]
    - [36, 13774.4]
  - - [256, 51, 1, 512]
    - [4, 1540.25]
  - - [128, 512, 1, 352]
    - [5, 5752.79]
  - - [256, 190, 1, 512]
    - [8, 5461.33]
  - - [256, 19, 1, 512]
    - [37, 597.211]
  - - [256, 227, 1, 512]
    - [8, 6597.19]
  - - [256, 512, 1, 776]
    - [6, 12072.6]
  - - [512, 256, 1, 1128]
    - [6, 13295.8]
  - - [32, 32, 512, 32]
    - [38, 4479.9]
  - - [160, 512, 1, 416]
    - [5, 7789.42]
  - - [256, 65, 1, 512]
    - [4, 1992.91]
  - - [540, 512, 1, 5897]
    - [39, 24359.8]
  - - [256, 31, 1, 512]
    - [37, 966.286]
  - - [32, 23, 1, 1302]
    - [40, 191.081]
  - - [32, 22, 1, 1302]
    - [40, 185.361]
  - - [256, 62, 1, 512]
    - [4, 1859.6]
  - - [256, 44, 1, 512]
    - [32, 1347.47]
  - - [512, 44, 1, 1128]
    - [41, 4310.7]
  - - [256, 85, 1, 512]
    - [4, 2555.3]
  - - [512, 57, 1, 1128]
    - [42, 5188.27]
  - - [256, 203, 1, 512]
    - [8, 5867.17]
  - - [256, 23, 1, 512]
    - [18, 711.843]
  - - [256, 50, 1, 512]
    - [23, 1520.56]
  - - [32, 80, 512, 32]
    - [43, 4234.53]
  - - [64, 512, 1, 416]
    - [44, 3133.68]
  - - [257, 512, 1, 1792]
    - [6, 17217.9]
  - - [128, 512, 1, 1792]
    - [45, 12668.9]
  - - [256, 27, 1, 512]
    - [37, 828.793]
  - - [512, 47, 1, 1128]
    - [41, 4539.16]
  - - [512, 23, 1, 1128]
    - [16, 2417.35]
  - - [512, 125, 1, 1128]
    - [26, 9161.42]
  - - [768, 512, 1, 512]
    - [31, 18572.6]
  - - [512, 50, 1, 1128]
    - [33, 4565.5]
  - - [256, 13, 1, 512]
    - [18, 409.108]
  - - [640, 512, 1, 2668]
    - [34, 25165.5]
  - - [512, 235, 1, 1128]
    - [6, 12232.6]
  - - [512, 43, 1, 1128]
    - [41, 4159.81]
  - - [32, 32768, 1, 128]
    - [27, 12674.0]
  - - [512, 51, 1, 1128]
    - [24, 4701.41]
  - - [768, 512, 1, 256]
    - [31, 14268.4]
  - - [32, 24, 1, 1302]
    - [40, 200.187]
  - - [256, 512, 1, 288]
    - [46, 9173.45]
  - - [256, 512, 1, 1824]
    - [30, 16913.7]
  - - [256, 47, 1, 512]
    - [32, 1422.72]
  - - [256, 86, 1, 512]
    - [4, 2570.63]
  - - [512, 27, 1, 1128]
    - [9, 2893.04]
  - - [32, 20, 1, 1302]
    - [40, 168.339]
  - - [768, 512, 1, 1293]
    - [47, 21672.1]
  - - [256, 251, 1, 512]
    - [8, 7159.75]
  - - [256, 15, 1, 512]
    - [3, 474.326]
  - - [1024, 512, 1, 128]
    - [48, 11671.1]
  - - [256, 93, 1, 512]
    - [23, 2799.01]
  - - [512, 83, 1, 1128]
    - [20, 6634.67]
  - - [512, 251, 1, 1128]
    - [6, 13018.5]
  - - [352, 512, 1, 352]
    - [19, 10511.8]
  - - [512, 65, 1, 1128]
    - [49, 5484.27]
  - - [256, 512, 1, 1312]
    - [46, 14396.5]
  - - [256, 73, 1, 512]
    - [23, 2197.07]
  - - [768, 512, 1, 640]
    - [31, 19776.7]
  - - [256, 14, 1, 512]
    - [35, 444.312]
  - - [512, 81, 1, 1128]
    - [50, 6483.77]
  - - [512, 13, 1, 1128]
    - [18, 1491.16]
  - - [256, 98, 1, 512]
    - [4, 2956.28]
  - - [32, 16384, 1, 128]
    - [38, 10324.4]
  - - [512, 85, 1, 1128]
    - [50, 6822.87]
  - - [540, 512, 1, 740]
    - [34, 16433.3]
  - - [128, 512, 1, 416]
    - [10, 6238.67]
  - - [512, 227, 1, 1128]
    - [6, 11832.2]
  - - [512, 92, 1, 1128]
    - [20, 7165.65]
  - - [1, 1, 98, 256]
    - [51, 5.23758]
  - - [256, 96, 1, 512]
    - [52, 3141.8]
  - - [128, 512, 1, 320]
    - [52, 6563.86]
  - - [128, 512, 1, 80]
    - [53, 2064.13]
  - - [1, 1, 73, 256]
    - [53, 4.39718]
  - - [16, 512, 1, 32]
    - [53, 137.971]
  - - [1, 512, 1, 16]
    - [53, 4.12695]
  - - [128, 512, 1, 112]
    - [51, 2557.5]
  - - [1, 22, 1, 16]
    - [53, 0.17129]
  - - [128, 512, 1, 704]
    - [52, 9473.79]
  - - [1, 35, 1, 16]
    - [53, 0.291667]
  - - [128, 512, 1, 192]
    - [52, 4730.42]
  - - [1, 256, 1, 256]
    - [53, 15.384]
  - - [128, 512, 1, 48]
    - [53, 1413.81]
  - - [1, 1, 125, 256]
    - [51, 6.59114]
  - - [256, 256, 1, 512]
    - [52, 8305.55]
  - - [1, 1, 65, 256]
    - [53, 3.91991]
  - - [128, 512, 1, 16]
    - [51, 511.5]
  - - [1, 1, 13, 256]
    - [53, 0.895828]
  - - [128, 512, 1, 128]
    - [52, 3445.01]
  - - [1, 1, 31, 256]
    - [53, 2.12477]
  - - [16, 8192, 1, 82]
    - [53, 2904.84]
  - - [1, 1, 83, 256]
    - [51, 4.57438]
  - - [32, 512, 1, 20]
    - [53, 146.613]
  - - [128, 512, 1, 256]
    - [52, 5500.73]
  - - [1, 1, 16, 256]
    - [53, 1.10404]
  - - [256, 72, 1, 512]
    - [52, 2315.87]
  - - [1, 1, 81, 256]
    - [51, 4.58761]
  - - [256, 512, 1, 128]
    - [52, 5564.58]
  - - [16, 23, 1, 32]
    - [51, 5.5028]
  - - [1, 1, 96, 256]
    - [51, 5.12534]
  - - [1, 20, 1, 16]
    - [53, 0.170213]
  - - [1, 1, 93, 256]
    - [53, 4.86871]
  - - [16, 17, 1, 32]
    - [53, 4.36291]
  - - [1, 1, 43, 256]
    - [53, 2.60853]
  - - [1, 1, 15, 256]
    - [53, 1.03087]
  - - [16, 20, 1, 32]
    - [51, 5.03194]
  - - [32, 512, 1, 32]
    - [53, 257.004]
  - - [1, 1, 44, 256]
    - [53, 2.97989]
  - - [1, 1, 14, 256]
    - [53, 0.967341]
  - - [1, 1, 85, 256]
    - [51, 4.64461]
  - - [1, 1, 57, 256]
    - [53, 3.47429]
  - - [256, 512, 1, 64]
    - [52, 3423.92]
  - - [1, 235, 1, 256]
    - [51, 13.8618]
  - - [1, 1, 72, 256]
    - [53, 4.66633]
  - - [1, 1, 27, 256]
    - [53, 1.8506]
  - - [1, 1, 92, 256]
    - [51, 4.9479]
  - - [1, 1, 48, 256]
    - [53, 3.28556]
  - - [1, 101, 1, 256]
    - [53, 6.8766]
  - - [160, 512, 1, 64]
    - [52, 2438.55]
  - - [1, 1, 23, 256]
    - [53, 1.57855]
  - - [1, 1, 50, 256]
    - [53, 3.329]
  - - [16, 82, 512, 16]
    - [53, 1332.66]
  - - [1312, 512, 1, 64]
    - [54, 9127.73]
  - - [1, 1, 74, 256]
    - [53, 4.62613]
  - - [128, 512, 1, 64]
    - [52, 2002.05]
  - - [128, 512, 1, 896]
    - [52, 10247.9]
  - - [3, 512, 1, 32]
    - [53, 24.0352]
  - - [1, 227, 1, 256]
    - [51, 13.3899]
  - - [1, 23, 1, 16]
    - [53, 0.196791]
  - - [1, 1, 19, 256]
    - [53, 1.30228]
  - - [1, 1, 101, 256]
    - [51, 5.39228]
  - - [1, 203, 1, 256]
    - [53, 12.1848]
  - - [768, 512, 1, 272]
    - [55, 13572.9]
  - - [1, 1, 47, 256]
    - [53, 2.86136]
  - - [1, 1, 86, 256]
    - [51, 4.69925]
  - - [64, 512, 1, 128]
    - [52, 1811.79]
  - - [8, 512, 1, 16]
    - [53, 34.8596]
  - - [32, 512, 1, 128]
    - [52, 915.787]
  - - [1, 1, 51, 256]
    - [51, 3.03275]
  - - [1, 1, 76, 256]
    - [53, 4.72807]
  - - [1, 17, 1, 16]
    - [51, 0.134321]
  - - [64, 512, 1, 256]
    - [52, 2933.08]
  - - [256, 48, 1, 512]
    - [52, 1540.14]
  - - [16, 24, 1, 32]
    - [53, 6.08317]
  - - [1, 1, 62, 256]
    - [53, 4.21567]
  - - [1, 251, 1, 256]
    - [53, 14.8741]
  - - [64, 512, 1, 704]
    - [52, 4821.04]
  - - [64, 512, 1, 512]
    - [52, 4231.33]
  - - [768, 512, 1, 64]
    - [54, 6710.89]
  - - [1, 24, 1, 16]
    - [53, 0.202105]
  - - [16, 22, 1, 32]
    - [53, 5.68889]
  - - [64, 32, 1, 32]
    - [51, 30.7681]
  - - [64, 512, 1, 32]
    - [53, 517.815]
  - - [32, 512, 1, 64]
    - [52, 519.097]
  - - [1, 1, 49, 256]
    - [53, 2.96548]
  - - [160, 512, 1, 704]
    - [52, 11805.9]
  - - [16, 35, 1, 32]
    - [53, 8.91542]
  - - [256, 512, 1, 3384]
    - [56, 20458.8]
  - - [256, 40960, 1, 128]
    - [57, 21188.4]
  - - [1, 190, 1, 256]
    - [58, 11.6225]
  - - [256, 512, 1, 2968]
    - [59, 19742.3]
  - - [128, 32768, 1, 256]
    - [60, 21888.5]
  - - [128, 512, 1, 1236]
    - [61, 9025.35]
  - - [1, 8000000, 1, 128]
    - [62, 676.898]
  - - [256, 8000000, 1, 256]
    - [63, 26405.2]
  - - [128, 8000000, 1, 1]
    - [64, 793.745]
  - - [256, 8000000, 1, 128]
    - [65, 23938.7]
  - - [128, 1, 1, 8000000]
    - [66, 882.911]
  - - [1, 1048576, 1, 128]
    - [67, 780.377]
  - - [1, 356305, 1, 128]
    - [68, 682.559]
  - - [128, 8000000, 1, 64]
    - [69, 20743.8]
- null
- null
- DeviceEfficiency
- Equality
