projects/hipsparselt/library/src/hcc_detail/rocsparselt/src/spmm/Tensile/Logic/asm_full/aquavanjaram/gfx942/Equality/aquavanjaram_Cijk_Ailk_Bjlk_HHS_BH_Bias_FDMN_SPB_A_S_SAV.yaml
- {MinimumRequiredVersion: 4.33.0}
- aquavanjaram
- gfx942
- [Device 0049, Device 0050]
    SolutionIndex: 0
    SolutionNameMin: Cijk_Ailk_Bjlk_HHS_BH_Bias_FDMN_SPB_AS_SAV_MT32x32x32_MI32x32x1_SN_LDSB0_AFC1_AFEM1_GRVWA4_GSU1_LPM0_MIWT1_1_NLCA1_PLR1_SU0_SUS0_SVW1_VWA1_VWB1_WG32_2_1
    SolutionIndex: 1
    SolutionNameMin: Cijk_Ailk_Bjlk_HHS_BH_Bias_FDMN_SPB_AS_SAV_MT32x32x32_MI32x32x1_SN_LDSB0_AFC1_AFEM1_GRVWA8_GSU1_LPM0_MIWT1_1_NLCA1_PLR1_SU0_SUS0_SVW1_VWA1_VWB1_WG32_2_1
    SolutionIndex: 2
    SolutionNameMin: Cijk_Ailk_Bjlk_HHS_BH_Bias_FDMN_SPB_AS_SAV_MT32x32x32_MI32x32x1_SN_LDSB0_AFC1_AFEM8_GRVWA8_GSU1_LPM0_MIWT1_1_NLCA1_PLR1_SU0_SUS0_SVW1_VWA1_VWB1_WG32_2_1
    SolutionIndex: 3
    SolutionNameMin: Cijk_Ailk_Bjlk_HHS_BH_Bias_FDMN_SPB_AS_SAV_MT32x32x32_MI32x32x1_SN_LDSB0_AFC1_AFEM8_GRVWA8_GSU1_LPM0_MIWT1_1_NLCA1_PLR1_SU4_SUS256_SVW1_VWA1_VWB1_WG32_2_1
    SolutionIndex: 4
    SolutionNameMin: Cijk_Ailk_Bjlk_HHS_BH_Bias_FDMN_SPB_AS_SAV_MT32x32x32_MI32x32x1_SN_LDSB0_AFC0_AFEM8_GRVWA8_GSU2_LPM0_MIWT1_1_NLCA1_PLR1_SU0_SUS0_SVW1_VWA1_VWB1_WG32_2_1
    SolutionIndex: 5
    SolutionNameMin: Cijk_Ailk_Bjlk_HHS_BH_Bias_FDMN_SPB_AS_SAV_MT128x128x32_MI32x32x1_SN_LDSB0_AFC1_AFEM1_GRVWA8_GSU1_LPM0_MIWT2_2_NLCA1_PLR1_SU0_SUS0_SVW1_VWA1_VWB2_WG64_4_1
    SolutionIndex: 6
    SolutionNameMin: Cijk_Ailk_Bjlk_HHS_BH_Bias_FDMN_SPB_AS_SAV_MT128x128x32_MI32x32x1_SN_LDSB0_AFC1_AFEM1_GRVWA4_GSU1_LPM0_MIWT2_2_NLCA1_PLR1_SU4_SUS256_SVW2_VWA2_VWB1_WG64_4_1
    SolutionIndex: 7
    SolutionNameMin: Cijk_Ailk_Bjlk_HHS_BH_Bias_FDMN_SPB_AS_SAV_MT128x128x32_MI32x32x1_SN_LDSB0_AFC1_AFEM1_GRVWA8_GSU1_LPM0_MIWT2_2_NLCA1_PLR1_SU4_SUS256_SVW2_VWA2_VWB1_WG64_4_1
    SolutionIndex: 8
    SolutionNameMin: Cijk_Ailk_Bjlk_HHS_BH_Bias_FDMN_SPB_AS_SAV_MT128x128x32_MI32x32x1_SN_LDSB0_AFC1_AFEM8_GRVWA8_GSU1_LPM0_MIWT2_2_NLCA1_PLR1_SU4_SUS256_SVW2_VWA2_VWB2_WG64_4_1
    SolutionIndex: 9
    SolutionNameMin: Cijk_Ailk_Bjlk_HHS_BH_Bias_FDMN_SPB_AS_SAV_MT32x32x64_MI32x32x1_SN_LDSB0_AFC1_AFEM1_GRVWA8_GSU1_LPM0_MIWT1_1_NLCA1_PLR1_SU0_SUS0_SVW1_VWA1_VWB1_WG32_2_1
    SolutionIndex: 10
    SolutionNameMin: Cijk_Ailk_Bjlk_HHS_BH_Bias_FDMN_SPB_AS_SAV_MT32x32x64_MI32x32x1_SN_LDSB0_AFC1_AFEM1_GRVWA8_GSU1_LPM0_MIWT1_1_NLCA1_PLR3_SU0_SUS0_SVW1_VWA1_VWB1_WG32_2_1
    SolutionIndex: 11
    SolutionNameMin: Cijk_Ailk_Bjlk_HHS_BH_Bias_FDMN_SPB_AS_SAV_MT32x32x64_MI32x32x1_SN_LDSB0_AFC1_AFEM8_GRVWA8_GSU1_LPM0_MIWT1_1_NLCA1_PLR1_SU0_SUS0_SVW1_VWA1_VWB1_WG32_2_1
    SolutionIndex: 12
    SolutionNameMin: Cijk_Ailk_Bjlk_HHS_BH_Bias_FDMN_SPB_AS_SAV_MT32x32x64_MI32x32x1_SN_LDSB0_AFC1_AFEM1_GRVWA8_GSU1_LPM0_MIWT1_1_NLCA1_PLR1_SU4_SUS256_SVW1_VWA1_VWB1_WG32_2_1
    SolutionIndex: 13
    SolutionNameMin: Cijk_Ailk_Bjlk_HHS_BH_Bias_FDMN_SPB_AS_SAV_MT32x32x64_MI32x32x1_SN_LDSB0_AFC1_AFEM8_GRVWA8_GSU1_LPM0_MIWT1_1_NLCA1_PLR3_SU4_SUS256_SVW1_VWA1_VWB1_WG32_2_1
    SolutionIndex: 14
    SolutionNameMin: Cijk_Ailk_Bjlk_HHS_BH_Bias_FDMN_SPB_AS_SAV_MT32x32x64_MI32x32x1_SN_LDSB0_AFC0_AFEM8_GRVWA8_GSU2_LPM0_MIWT1_1_NLCA1_PLR3_SU0_SUS0_SVW1_VWA1_VWB1_WG32_2_1
    SolutionIndex: 15
    SolutionNameMin: Cijk_Ailk_Bjlk_HHS_BH_Bias_FDMN_SPB_AS_SAV_MT128x128x64_MI32x32x1_SN_LDSB1_AFC1_AFEM8_GRVWA4_GSU1_LPM0_MIWT2_2_NLCA1_PLR1_SU0_SUS0_SVW2_VWA2_VWB1_WG64_4_1
    SolutionIndex: 16
    SolutionNameMin: Cijk_Ailk_Bjlk_HHS_BH_Bias_FDMN_SPB_AS_SAV_MT128x128x64_MI32x32x1_SN_LDSB1_AFC1_AFEM1_GRVWA4_GSU1_LPM0_MIWT2_2_NLCA1_PLR3_SU4_SUS256_SVW2_VWA2_VWB1_WG64_4_1
    SolutionIndex: 17
    SolutionNameMin: Cijk_Ailk_Bjlk_HHS_BH_Bias_FDMN_SPB_A_S_SAV_MT256x256x64_MI16x16x1_SN_LDSB1_AFC1_AFEM1_AFEM1_ASEM8_CLR1_CADS0_DTVA0_DTVB0_EPS1_FDSI0_GRPM1_GRVWA8_GRVWB8_GSU1_GSUAMBSK_GSUC0_GSUWGMRR0_GLS0_ISA942_IU1_K1_LBSPPA4096_LBSPPB4096_LBSPPM0_LPA0_LPB0_LPM0_LRVW8_LWPMn1_MIAV0_MIWT8_8_MO40_NTn1_NTA0_NTB0_NTC0_NTD0_NTM0_NEPBS0_NLCA1_NLCB1_ONLL1_PGR2_PLR1_PKA1_SIA3_SS1_SU0_SUM0_SUS128_SPO0_SRVW0_SSO0_SVW8_SK0_SKXCCM0_TLDS0_ULSGRO0_USL1_UIOFGRO0_USFGROn1_VSn1_VWA8_VWB8_WSGRA0_WSGRB0_WS64_WG32_8_1_WGM1_WGMXCC1_WGMXCCGn1
    SolutionIndex: 18
    SolutionNameMin: Cijk_Ailk_Bjlk_HHS_BH_Bias_FDMN_SPB_A_S_SAV_MT256x256x64_MI16x16x1_SN_LDSB1_AFC1_AFEM1_AFEM1_ASEM8_CLR1_CADS0_DTVA0_DTVB0_EPS1_FDSI0_GRPM1_GRVWA8_GRVWB8_GSU1_GSUAMB_GSUC0_GSUWGMRR0_GLS0_ISA942_IU1_K1_LBSPPA4096_LBSPPB4096_LBSPPM0_LPA0_LPB0_LPM0_LRVW8_LWPMn1_MIAV0_MIWT8_8_MO40_NTn1_NTA0_NTB0_NTC0_NTD0_NTM0_NEPBS0_NLCA1_NLCB1_ONLL1_PGR2_PLR1_PKA1_SIA3_SS1_SU0_SUM0_SUS128_SPO0_SRVW0_SSO0_SVW8_SK0_SKXCCM0_TLDS0_ULSGRO0_USL1_UIOFGRO0_USFGROn1_VSn1_VWA8_VWB8_WSGRA0_WSGRB0_WS64_WG32_8_1_WGM1_WGMXCC1_WGMXCCGn1
    SolutionIndex: 19
    SolutionNameMin: Cijk_Ailk_Bjlk_HHS_BH_Bias_FDMN_SPB_A_S_SAV_MT256x256x64_MI16x16x1_SN_LDSB1_AFC1_AFEM1_AFEM1_ASEM8_CLR1_CADS0_DTVA0_DTVB0_EPS1_FDSI0_GRPM1_GRVWA8_GRVWB8_GSU1_GSUAMBSK_GSUC0_GSUWGMRR0_GLS0_ISA942_IU1_K1_LBSPPA4096_LBSPPB4096_LBSPPM0_LPA0_LPB0_LPM0_LRVW8_LWPMn1_MIAV0_MIWT8_8_MO40_NTn1_NTA0_NTB0_NTC0_NTD0_NTM0_NEPBS0_NLCA1_NLCB1_ONLL1_PGR2_PLR1_PKA1_SIA3_SS1_SU0_SUM0_SUS128_SPO0_SRVW0_SSO0_SVW8_SK0_SKXCCM0_TLDS0_ULSGRO0_USL1_UIOFGRO0_USFGROn1_VSn1_VWA8_VWB8_WSGRA0_WSGRB0_WS64_WG32_8_1_WGM8_WGMXCC8_WGMXCCGn1
    SolutionIndex: 20
    SolutionNameMin: Cijk_Ailk_Bjlk_HHS_BH_Bias_FDMN_SPB_A_S_SAV_MT256x256x64_MI16x16x1_SN_LDSB1_AFC1_AFEM1_AFEM1_ASEM8_CLR1_CADS0_DTVA0_DTVB0_EPS1_FDSI0_GRPM1_GRVWA8_GRVWB8_GSU1_GSUAMB_GSUC0_GSUWGMRR0_GLS0_ISA942_IU1_K1_LBSPPA4096_LBSPPB4096_LBSPPM0_LPA0_LPB0_LPM0_LRVW8_LWPMn1_MIAV0_MIWT8_8_MO40_NTn1_NTA0_NTB0_NTC0_NTD0_NTM0_NEPBS0_NLCA1_NLCB1_ONLL1_PGR2_PLR1_PKA1_SIA3_SS1_SU0_SUM0_SUS128_SPO0_SRVW0_SSO0_SVW8_SK0_SKXCCM0_TLDS0_ULSGRO0_USL1_UIOFGRO0_USFGROn1_VSn1_VWA8_VWB8_WSGRA0_WSGRB0_WS64_WG32_8_1_WGM8_WGMXCC8_WGMXCCGn1
- - - [16, 16, 1, 16]
    - [9, 0.0]
  - - [16, 16, 1, 32]
    - [1, 0.0]
  - - [16, 16, 1, 96]
    - [4, 0.0]
  - - [16, 16, 1, 128]
    - [14, 0.0]
  - - [16, 16, 1, 136]
    - [9, 0.0]
  - - [256, 256, 1, 16]
    - [15, 0.004]
  - - [256, 256, 1, 32]
    - [13, 0.011]
  - - [256, 256, 1, 64]
    - [8, 0.018]
  - - [256, 256, 1, 96]
    - [10, 0.03]
  - - [256, 256, 1, 128]
    - [11, 0.04]
  - - [256, 256, 1, 136]
    - [16, 0.031]
  - - [256, 256, 1, 256]
    - [3, 0.082]
  - - [384, 384, 1, 16]
    - [6, 0.01]
  - - [384, 384, 1, 24]
    - [2, 0.016]
  - - [384, 384, 1, 32]
    - [7, 0.02]
  - - [384, 384, 1, 96]
    - [9, 0.064]
  - - [384, 384, 1, 128]
    - [12, 0.08]
  - - [384, 384, 1, 136]
    - [5, 0.067]
  - - [384, 384, 1, 256]
    - [0, 0.156]
  - - [10240, 10240, 1, 3072]
    - [17, 384.51]
  - - [10240, 10240, 1, 4096]
    - [17, 391.35]
  - - [10240, 10240, 1, 5120]
    - [18, 395.06]
  - - [10240, 10240, 1, 6144]
    - [18, 397.54]
  - - [10240, 10240, 1, 7168]
    - [17, 400.01]
  - - [10240, 10240, 1, 8192]
    - [18, 406.43]
  - - [10240, 10240, 1, 9216]
    - [17, 406.86]
  - - [10240, 10240, 1, 10240]
    - [17, 404.04]
  - - [10240, 10240, 1, 11264]
    - [18, 397.97]
  - - [10240, 10240, 1, 12288]
    - [19, 392.19]
  - - [10240, 10240, 1, 13312]
    - [20, 392.12]
  - - [10240, 10240, 1, 14336]
    - [19, 389.67]
  - - [10240, 10240, 1, 15360]
    - [20, 388.37]
  - - [10240, 10240, 1, 16384]
    - [19, 388.28]
  - - [10240, 10240, 1, 17408]
    - [19, 387.92]
  - - [10240, 10240, 1, 18432]
    - [20, 388.43]
  - - [10240, 10240, 1, 19456]
    - [20, 387.65]
  - - [10240, 10240, 1, 20480]
    - [17, 387.47]
- null
- null
- DeviceEfficiency
- Equality
