projects/hipsparselt/library/src/hcc_detail/rocsparselt/src/spmm/Tensile/Logic/asm_full/aquavanjaram/gfx942/Equality/aquavanjaram_Cijk_Ailk_Bjlk_BBS_BH_Bias_FDMN_SPB_A_S_SAV.yaml
- {MinimumRequiredVersion: 5.0.0}
- aquavanjaram
- gfx942
- [Device 0049, Device 0050]
    SolutionIndex: 0
    SolutionNameMin: Cijk_Ailk_Bjlk_BBS_BH_Bias_FDMN_SPB_A_S_SAV_MT32x32x32_MI32x32x1_CMS_SN_LDSB0_AFC1_AG0_AFEM1_AFEM1_ASEM8_CLR1_CADS0_DTLA0_DTLB0_DTVA0_DTVB0_DTVSM0_DPLBn1_EPS1_ELFLR0_EMLLn1_FDSI0_GRPM1_GRVWA4_GRVWB8_GSU1_GSUAMB_GSUC0_GSUWGMRR0_GLS0_ISA942_IU1_LDSTI0_LBSPPA0_LBSPPB0_LBSPPM0_LPA0_LPB0_LPM0_LRVW8_LWPMn1_MIAV0_MIWT1_1_MO40_MGRIPMn1_NTn1_NTA0_NTB0_NTC0_NTD0_NTM0_NEPBS0_NLCA1_NLCB1_ONLL1_PGR2_PLR1_PKA0_SGROBn1_SIA3_SS1_SU0_SUM0_SUS0_SPO0_SRVW0_SSO0_SVW1_SK0_SKFTR0_SKXCCM0_SGRO0_TIN0_TLDS0_TLDSM0_ULSGRO0_USL1_UIOFGRO0_UPLRP0_USFGROn1_VSn1_VWA1_VWB1_WSGRA0_WSGRB0_WS64_WG32_2_1_WGM18_WGMXCC1_WGMXCCGn1
    SolutionIndex: 1
    SolutionNameMin: Cijk_Ailk_Bjlk_BBS_BH_Bias_FDMN_SPB_A_S_SAV_MT32x32x32_MI32x32x1_CMS_SN_LDSB0_AFC1_AG0_AFEM8_AFEM1_ASEM8_CLR1_CADS0_DTLA0_DTLB0_DTVA0_DTVB0_DTVSM0_DPLBn1_EPS1_ELFLR0_EMLLn1_FDSI0_GRPM1_GRVWA8_GRVWB8_GSU1_GSUAMB_GSUC0_GSUWGMRR0_GLS0_ISA942_IU1_LDSTI0_LBSPPA0_LBSPPB0_LBSPPM0_LPA0_LPB0_LPM0_LRVW8_LWPMn1_MIAV0_MIWT1_1_MO40_MGRIPMn1_NTn1_NTA0_NTB0_NTC0_NTD0_NTM0_NEPBS0_NLCA1_NLCB1_ONLL1_PGR2_PLR1_PKA0_SGROBn1_SIA3_SS1_SU0_SUM0_SUS0_SPO0_SRVW0_SSO0_SVW1_SK0_SKFTR0_SKXCCM0_SGRO0_TIN0_TLDS0_TLDSM0_ULSGRO0_USL1_UIOFGRO0_UPLRP0_USFGROn1_VSn1_VWA1_VWB1_WSGRA0_WSGRB0_WS64_WG32_2_1_WGM18_WGMXCC1_WGMXCCGn1
    SolutionIndex: 2
    SolutionNameMin: Cijk_Ailk_Bjlk_BBS_BH_Bias_FDMN_SPB_A_S_SAV_MT32x32x32_MI32x32x1_CMS_SN_LDSB0_AFC1_AG0_AFEM8_AFEM1_ASEM8_CLR1_CADS0_DTLA0_DTLB0_DTVA0_DTVB0_DTVSM0_DPLBn1_EPS1_ELFLR0_EMLLn1_FDSI0_GRPM1_GRVWA8_GRVWB8_GSU1_GSUAMB_GSUC0_GSUWGMRR0_GLS0_ISA942_IU1_LDSTI0_LBSPPA0_LBSPPB0_LBSPPM0_LPA0_LPB0_LPM0_LRVW8_LWPMn1_MIAV0_MIWT1_1_MO40_MGRIPMn1_NTn1_NTA0_NTB0_NTC0_NTD0_NTM0_NEPBS0_NLCA1_NLCB1_ONLL1_PGR2_PLR1_PKA0_SGROBn1_SIA3_SS1_SU4_SUM0_SUS256_SPO0_SRVW0_SSO0_SVW1_SK0_SKFTR0_SKXCCM0_SGRO0_TIN0_TLDS0_TLDSM0_ULSGRO0_USL1_UIOFGRO0_UPLRP0_USFGROn1_VSn1_VWA1_VWB1_WSGRA0_WSGRB0_WS64_WG32_2_1_WGM18_WGMXCC1_WGMXCCGn1
    SolutionIndex: 3
    SolutionNameMin: Cijk_Ailk_Bjlk_BBS_BH_Bias_FDMN_SPB_A_S_SAV_MT128x128x32_MI32x32x1_CMS_SN_LDSB0_AFC1_AG0_AFEM1_AFEM1_ASEM8_CLR1_CADS0_DTLA0_DTLB0_DTVA0_DTVB0_DTVSM0_DPLBn1_EPS1_ELFLR0_EMLLn1_FDSI0_GRPM1_GRVWA4_GRVWB8_GSU1_GSUAMB_GSUC0_GSUWGMRR0_GLS0_ISA942_IU1_LDSTI0_LBSPPA0_LBSPPB0_LBSPPM0_LPA0_LPB0_LPM0_LRVW8_LWPMn1_MIAV0_MIWT2_2_MO40_MGRIPMn1_NTn1_NTA0_NTB0_NTC0_NTD0_NTM0_NEPBS0_NLCA1_NLCB1_ONLL1_PGR2_PLR1_PKA0_SGROBn1_SIA3_SS1_SU4_SUM0_SUS256_SPO0_SRVW0_SSO0_SVW2_SK0_SKFTR0_SKXCCM0_SGRO0_TIN0_TLDS0_TLDSM0_ULSGRO0_USL1_UIOFGRO0_UPLRP0_USFGROn1_VSn1_VWA2_VWB1_WSGRA0_WSGRB0_WS64_WG64_4_1_WGM18_WGMXCC1_WGMXCCGn1
    SolutionIndex: 4
    SolutionNameMin: Cijk_Ailk_Bjlk_BBS_BH_Bias_FDMN_SPB_A_S_SAV_MT128x128x32_MI32x32x1_CMS_SN_LDSB0_AFC1_AG0_AFEM1_AFEM1_ASEM8_CLR1_CADS0_DTLA0_DTLB0_DTVA0_DTVB0_DTVSM0_DPLBn1_EPS1_ELFLR0_EMLLn1_FDSI0_GRPM1_GRVWA8_GRVWB8_GSU1_GSUAMB_GSUC0_GSUWGMRR0_GLS0_ISA942_IU1_LDSTI0_LBSPPA0_LBSPPB0_LBSPPM0_LPA0_LPB0_LPM0_LRVW8_LWPMn1_MIAV0_MIWT2_2_MO40_MGRIPMn1_NTn1_NTA0_NTB0_NTC0_NTD0_NTM0_NEPBS0_NLCA1_NLCB1_ONLL1_PGR2_PLR1_PKA0_SGROBn1_SIA3_SS1_SU4_SUM0_SUS256_SPO0_SRVW0_SSO0_SVW2_SK0_SKFTR0_SKXCCM0_SGRO0_TIN0_TLDS0_TLDSM0_ULSGRO0_USL1_UIOFGRO0_UPLRP0_USFGROn1_VSn1_VWA2_VWB1_WSGRA0_WSGRB0_WS64_WG64_4_1_WGM18_WGMXCC1_WGMXCCGn1
    SolutionIndex: 5
    SolutionNameMin: Cijk_Ailk_Bjlk_BBS_BH_Bias_FDMN_SPB_A_S_SAV_MT32x32x64_MI32x32x1_CMS_SN_LDSB0_AFC1_AG0_AFEM1_AFEM1_ASEM8_CLR1_CADS0_DTLA0_DTLB0_DTVA0_DTVB0_DTVSM0_DPLBn1_EPS1_ELFLR0_EMLLn1_FDSI0_GRPM1_GRVWA8_GRVWB8_GSU1_GSUAMB_GSUC0_GSUWGMRR0_GLS0_ISA942_IU1_LDSTI0_LBSPPA0_LBSPPB0_LBSPPM0_LPA0_LPB0_LPM0_LRVW8_LWPMn1_MIAV0_MIWT1_1_MO40_MGRIPMn1_NTn1_NTA0_NTB0_NTC0_NTD0_NTM0_NEPBS0_NLCA1_NLCB1_ONLL1_PGR2_PLR1_PKA0_SGROBn1_SIA3_SS1_SU0_SUM0_SUS0_SPO0_SRVW0_SSO0_SVW1_SK0_SKFTR0_SKXCCM0_SGRO0_TIN0_TLDS0_TLDSM0_ULSGRO0_USL1_UIOFGRO0_UPLRP0_USFGROn1_VSn1_VWA1_VWB1_WSGRA0_WSGRB0_WS64_WG32_2_1_WGM18_WGMXCC1_WGMXCCGn1
    SolutionIndex: 6
    SolutionNameMin: Cijk_Ailk_Bjlk_BBS_BH_Bias_FDMN_SPB_A_S_SAV_MT32x32x64_MI32x32x1_CMS_SN_LDSB0_AFC1_AG0_AFEM8_AFEM1_ASEM8_CLR1_CADS0_DTLA0_DTLB0_DTVA0_DTVB0_DTVSM0_DPLBn1_EPS1_ELFLR0_EMLLn1_FDSI0_GRPM1_GRVWA8_GRVWB8_GSU1_GSUAMB_GSUC0_GSUWGMRR0_GLS0_ISA942_IU1_LDSTI0_LBSPPA0_LBSPPB0_LBSPPM0_LPA0_LPB0_LPM0_LRVW8_LWPMn1_MIAV0_MIWT1_1_MO40_MGRIPMn1_NTn1_NTA0_NTB0_NTC0_NTD0_NTM0_NEPBS0_NLCA1_NLCB1_ONLL1_PGR2_PLR1_PKA0_SGROBn1_SIA3_SS1_SU0_SUM0_SUS0_SPO0_SRVW0_SSO0_SVW1_SK0_SKFTR0_SKXCCM0_SGRO0_TIN0_TLDS0_TLDSM0_ULSGRO0_USL1_UIOFGRO0_UPLRP0_USFGROn1_VSn1_VWA1_VWB1_WSGRA0_WSGRB0_WS64_WG32_2_1_WGM18_WGMXCC1_WGMXCCGn1
    SolutionIndex: 7
    SolutionNameMin: Cijk_Ailk_Bjlk_BBS_BH_Bias_FDMN_SPB_A_S_SAV_MT32x32x64_MI32x32x1_CMS_SN_LDSB0_AFC1_AG0_AFEM1_AFEM1_ASEM8_CLR1_CADS0_DTLA0_DTLB0_DTVA0_DTVB0_DTVSM0_DPLBn1_EPS1_ELFLR0_EMLLn1_FDSI0_GRPM1_GRVWA8_GRVWB8_GSU1_GSUAMB_GSUC0_GSUWGMRR0_GLS0_ISA942_IU1_LDSTI0_LBSPPA0_LBSPPB0_LBSPPM0_LPA0_LPB0_LPM0_LRVW8_LWPMn1_MIAV0_MIWT1_1_MO40_MGRIPMn1_NTn1_NTA0_NTB0_NTC0_NTD0_NTM0_NEPBS0_NLCA1_NLCB1_ONLL1_PGR2_PLR1_PKA0_SGROBn1_SIA3_SS1_SU4_SUM0_SUS256_SPO0_SRVW0_SSO0_SVW1_SK0_SKFTR0_SKXCCM0_SGRO0_TIN0_TLDS0_TLDSM0_ULSGRO0_USL1_UIOFGRO0_UPLRP0_USFGROn1_VSn1_VWA1_VWB1_WSGRA0_WSGRB0_WS64_WG32_2_1_WGM18_WGMXCC1_WGMXCCGn1
    SolutionIndex: 8
    SolutionNameMin: Cijk_Ailk_Bjlk_BBS_BH_Bias_FDMN_SPB_A_S_SAV_MT128x128x64_MI32x32x1_CMS_SN_LDSB1_AFC1_AG0_AFEM1_AFEM1_ASEM8_CLR1_CADS0_DTLA0_DTLB0_DTVA0_DTVB0_DTVSM0_DPLBn1_EPS1_ELFLR0_EMLLn1_FDSI0_GRPM1_GRVWA4_GRVWB8_GSU1_GSUAMB_GSUC0_GSUWGMRR0_GLS0_ISA942_IU1_LDSTI0_LBSPPA0_LBSPPB0_LBSPPM0_LPA0_LPB0_LPM0_LRVW8_LWPMn1_MIAV0_MIWT2_2_MO40_MGRIPMn1_NTn1_NTA0_NTB0_NTC0_NTD0_NTM0_NEPBS0_NLCA1_NLCB1_ONLL1_PGR2_PLR1_PKA0_SGROBn1_SIA3_SS1_SU4_SUM0_SUS256_SPO0_SRVW0_SSO0_SVW2_SK0_SKFTR0_SKXCCM0_SGRO0_TIN0_TLDS0_TLDSM0_ULSGRO0_USL1_UIOFGRO0_UPLRP0_USFGROn1_VSn1_VWA2_VWB1_WSGRA0_WSGRB0_WS64_WG64_4_1_WGM18_WGMXCC1_WGMXCCGn1
    SolutionIndex: 9
    SolutionNameMin: Cijk_Ailk_Bjlk_BBS_BH_Bias_FDMN_SPB_A_S_SAV_MT256x256x64_MI16x16x1_CMS_SN_LDSB1_AFC1_AG0_AFEM1_AFEM1_ASEM8_CLR1_CADS0_DTLA0_DTLB0_DTVA0_DTVB0_DTVSM0_DPLBn1_EPS1_ELFLR0_EMLLn1_FDSI0_GRPM1_GRVWA8_GRVWB8_GSU1_GSUAMBSK_GSUC0_GSUWGMRR0_GLS0_ISA942_IU1_K1_LDSTI0_LBSPPA4096_LBSPPB4096_LBSPPM0_LPA0_LPB0_LPM0_LRVW8_LWPMn1_MIAV0_MIWT8_8_MO40_MGRIPMn1_NTn1_NTA0_NTB0_NTC0_NTD0_NTM0_NEPBS0_NLCA1_NLCB1_ONLL1_PGR2_PLR1_PKA1_SGROBn1_SIA3_SS1_SU0_SUM0_SUS0_SPO0_SRVW0_SSO0_SVW8_SK0_SKFTR0_SKXCCM0_SGRO0_TIN0_TLDS0_TLDSM0_ULSGRO0_USL1_UIOFGRO0_UPLRP0_USFGROn1_VSn1_VWA8_VWB8_WSGRA0_WSGRB0_WS64_WG32_8_1_WGM1_WGMXCC1_WGMXCCGn1
    SolutionIndex: 10
    SolutionNameMin: Cijk_Ailk_Bjlk_BBS_BH_Bias_FDMN_SPB_A_S_SAV_MT256x256x64_MI16x16x1_CMS_SN_LDSB1_AFC1_AG0_AFEM1_AFEM1_ASEM8_CLR1_CADS0_DTLA0_DTLB0_DTVA0_DTVB0_DTVSM0_DPLBn1_EPS1_ELFLR0_EMLLn1_FDSI0_GRPM1_GRVWA8_GRVWB8_GSU1_GSUAMB_GSUC0_GSUWGMRR0_GLS0_ISA942_IU1_K1_LDSTI0_LBSPPA4096_LBSPPB4096_LBSPPM0_LPA0_LPB0_LPM0_LRVW8_LWPMn1_MIAV0_MIWT8_8_MO40_MGRIPMn1_NTn1_NTA0_NTB0_NTC0_NTD0_NTM0_NEPBS0_NLCA1_NLCB1_ONLL1_PGR2_PLR1_PKA1_SGROBn1_SIA3_SS1_SU0_SUM0_SUS0_SPO0_SRVW0_SSO0_SVW8_SK0_SKFTR0_SKXCCM0_SGRO0_TIN0_TLDS0_TLDSM0_ULSGRO0_USL1_UIOFGRO0_UPLRP0_USFGROn1_VSn1_VWA8_VWB8_WSGRA0_WSGRB0_WS64_WG32_8_1_WGM1_WGMXCC1_WGMXCCGn1
    SolutionIndex: 11
    SolutionNameMin: Cijk_Ailk_Bjlk_BBS_BH_Bias_FDMN_SPB_A_S_SAV_MT256x256x64_MI16x16x1_CMS_SN_LDSB1_AFC1_AG0_AFEM1_AFEM1_ASEM8_CLR1_CADS0_DTLA0_DTLB0_DTVA0_DTVB0_DTVSM0_DPLBn1_EPS1_ELFLR0_EMLLn1_FDSI0_GRPM1_GRVWA8_GRVWB8_GSU1_GSUAMBSK_GSUC0_GSUWGMRR0_GLS0_ISA942_IU1_K1_LDSTI0_LBSPPA4096_LBSPPB4096_LBSPPM0_LPA0_LPB0_LPM0_LRVW8_LWPMn1_MIAV0_MIWT8_8_MO40_MGRIPMn1_NTn1_NTA0_NTB0_NTC0_NTD0_NTM0_NEPBS0_NLCA1_NLCB1_ONLL1_PGR2_PLR1_PKA1_SGROBn1_SIA3_SS1_SU0_SUM0_SUS0_SPO0_SRVW0_SSO0_SVW8_SK0_SKFTR0_SKXCCM0_SGRO0_TIN0_TLDS0_TLDSM0_ULSGRO0_USL1_UIOFGRO0_UPLRP0_USFGROn1_VSn1_VWA8_VWB8_WSGRA0_WSGRB0_WS64_WG32_8_1_WGM8_WGMXCC8_WGMXCCGn1
    SolutionIndex: 12
    SolutionNameMin: Cijk_Ailk_Bjlk_BBS_BH_Bias_FDMN_SPB_A_S_SAV_MT256x256x64_MI16x16x1_CMS_SN_LDSB1_AFC1_AG0_AFEM1_AFEM1_ASEM8_CLR1_CADS0_DTLA0_DTLB0_DTVA0_DTVB0_DTVSM0_DPLBn1_EPS1_ELFLR0_EMLLn1_FDSI0_GRPM1_GRVWA8_GRVWB8_GSU1_GSUAMB_GSUC0_GSUWGMRR0_GLS0_ISA942_IU1_K1_LDSTI0_LBSPPA4096_LBSPPB4096_LBSPPM0_LPA0_LPB0_LPM0_LRVW8_LWPMn1_MIAV0_MIWT8_8_MO40_MGRIPMn1_NTn1_NTA0_NTB0_NTC0_NTD0_NTM0_NEPBS0_NLCA1_NLCB1_ONLL1_PGR2_PLR1_PKA1_SGROBn1_SIA3_SS1_SU0_SUM0_SUS0_SPO0_SRVW0_SSO0_SVW8_SK0_SKFTR0_SKXCCM0_SGRO0_TIN0_TLDS0_TLDSM0_ULSGRO0_USL1_UIOFGRO0_UPLRP0_USFGROn1_VSn1_VWA8_VWB8_WSGRA0_WSGRB0_WS64_WG32_8_1_WGM8_WGMXCC8_WGMXCCGn1
    SolutionIndex: 13
    SolutionNameMin: Cijk_Ailk_Bjlk_BBS_BH_Bias_FDMN_SPB_A_S_SAV_MT256x256x64_MI16x16x1_CMS_SN_LDSB1_AFC1_AG0_AFEM1_AFEM1_ASEM8_CLR1_CADS0_DTLA0_DTLB0_DTVA0_DTVB0_DTVSM0_DPLBn1_EPS1_ELFLR0_EMLLn1_FDSI0_GRPM1_GRVWA8_GRVWB8_GSU1_GSUAMBSK_GSUC0_GSUWGMRR0_GLS0_ISA942_IU1_K1_LDSTI0_LBSPPA4096_LBSPPB4096_LBSPPM0_LPA0_LPB0_LPM0_LRVW8_LWPMn1_MIAV0_MIWT8_8_MO40_MGRIPMn1_NTn1_NTA0_NTB0_NTC0_NTD0_NTM0_NEPBS0_NLCA1_NLCB1_ONLL1_PGR2_PLR1_PKA1_SGROBn1_SIA3_SS1_SU0_SUM0_SUS0_SPO0_SRVW0_SSO0_SVW8_SK0_SKFTR0_SKXCCM0_SGRO0_TIN0_TLDS0_TLDSM0_ULSGRO0_USL1_UIOFGRO0_UPLRP0_USFGROn1_VSn1_VWA8_VWB4_WSGRA0_WSGRB0_WS64_WG32_8_1_WGM4_WGMXCC8_WGMXCCGn1
    SolutionIndex: 14
    SolutionNameMin: Cijk_Ailk_Bjlk_BBS_BH_Bias_FDMN_SPB_A_S_SAV_MT256x256x64_MI16x16x1_CMS_SN_LDSB1_AFC1_AG0_AFEM1_AFEM1_ASEM8_CLR1_CADS0_DTLA0_DTLB0_DTVA0_DTVB0_DTVSM0_DPLBn1_EPS1_ELFLR0_EMLLn1_FDSI0_GRPM1_GRVWA8_GRVWB8_GSU1_GSUAMB_GSUC0_GSUWGMRR0_GLS0_ISA942_IU1_K1_LDSTI0_LBSPPA4096_LBSPPB4096_LBSPPM0_LPA0_LPB0_LPM0_LRVW8_LWPMn1_MIAV0_MIWT8_8_MO40_MGRIPMn1_NTn1_NTA0_NTB0_NTC0_NTD0_NTM0_NEPBS0_NLCA1_NLCB1_ONLL1_PGR2_PLR1_PKA1_SGROBn1_SIA3_SS1_SU0_SUM0_SUS0_SPO0_SRVW0_SSO0_SVW8_SK0_SKFTR0_SKXCCM0_SGRO0_TIN0_TLDS0_TLDSM0_ULSGRO0_USL1_UIOFGRO0_UPLRP0_USFGROn1_VSn1_VWA8_VWB4_WSGRA0_WSGRB0_WS64_WG32_8_1_WGM8_WGMXCC8_WGMXCCGn1
    SolutionIndex: 15
    SolutionNameMin: Cijk_Ailk_Bjlk_BBS_BH_Bias_FDMN_SPB_A_S_SAV_MT256x256x64_MI16x16x1_CMS_SN_LDSB1_AFC1_AG0_AFEM1_AFEM1_ASEM8_CLR1_CADS0_DTLA0_DTLB0_DTVA0_DTVB0_DTVSM0_DPLBn1_EPS1_ELFLR0_EMLLn1_FDSI0_GRPM1_GRVWA8_GRVWB8_GSU1_GSUAMBSK_GSUC0_GSUWGMRR0_GLS0_ISA942_IU1_K1_LDSTI0_LBSPPA4096_LBSPPB4096_LBSPPM0_LPA0_LPB0_LPM0_LRVW8_LWPMn1_MIAV0_MIWT8_8_MO40_MGRIPMn1_NTn1_NTA0_NTB0_NTC0_NTD0_NTM0_NEPBS0_NLCA1_NLCB1_ONLL1_PGR2_PLR1_PKA1_SGROBn1_SIA3_SS1_SU0_SUM0_SUS0_SPO0_SRVW0_SSO0_SVW8_SK0_SKFTR0_SKXCCM0_SGRO0_TIN0_TLDS0_TLDSM0_ULSGRO0_USL1_UIOFGRO0_UPLRP0_USFGROn1_VSn1_VWA8_VWB4_WSGRA0_WSGRB0_WS64_WG32_8_1_WGM1_WGMXCC1_WGMXCCGn1
    SolutionIndex: 16
    SolutionNameMin: Cijk_Ailk_Bjlk_BBS_BH_Bias_FDMN_SPB_A_S_SAV_MT256x256x64_MI16x16x1_CMS_SN_LDSB1_AFC1_AG0_AFEM1_AFEM1_ASEM8_CLR1_CADS0_DTLA0_DTLB0_DTVA0_DTVB0_DTVSM0_DPLBn1_EPS1_ELFLR0_EMLLn1_FDSI0_GRPM1_GRVWA8_GRVWB8_GSU1_GSUAMBSK_GSUC0_GSUWGMRR0_GLS0_ISA942_IU1_K1_LDSTI0_LBSPPA4096_LBSPPB4096_LBSPPM0_LPA0_LPB32_LPM0_LRVW8_LWPMn1_MIAV0_MIWT8_8_MO40_MGRIPMn1_NTn1_NTA0_NTB0_NTC0_NTD0_NTM0_NEPBS0_NLCA1_NLCB1_ONLL1_PGR2_PLR1_PKA1_SGROBn1_SIA3_SS1_SU0_SUM0_SUS0_SPO0_SRVW0_SSO0_SVW8_SK0_SKFTR0_SKXCCM0_SGRO0_TIN0_TLDS0_TLDSM0_ULSGRO0_USL1_UIOFGRO0_UPLRP0_USFGROn1_VSn1_VWA8_VWB2_WSGRA0_WSGRB0_WS64_WG32_8_1_WGM8_WGMXCC8_WGMXCCGn1
    SolutionIndex: 17
    SolutionNameMin: Cijk_Ailk_Bjlk_BBS_BH_Bias_FDMN_SPB_A_S_SAV_MT256x256x64_MI16x16x1_CMS_SN_LDSB1_AFC1_AG0_AFEM1_AFEM1_ASEM8_CLR1_CADS0_DTLA0_DTLB0_DTVA0_DTVB0_DTVSM0_DPLBn1_EPS1_ELFLR0_EMLLn1_FDSI0_GRPM1_GRVWA2_GRVWB8_GSU1_GSUAMB_GSUC0_GSUWGMRR0_GLS0_ISA942_IU1_K1_LDSTI0_LBSPPA4096_LBSPPB4096_LBSPPM0_LPA0_LPB0_LPM0_LRVW8_LWPMn1_MIAV0_MIWT8_8_MO40_MGRIPMn1_NTn1_NTA0_NTB0_NTC0_NTD0_NTM0_NEPBS0_NLCA1_NLCB1_ONLL1_PGR2_PLR1_PKA1_SGROBn1_SIA3_SS1_SU0_SUM0_SUS0_SPO0_SRVW0_SSO0_SVW8_SK0_SKFTR0_SKXCCM0_SGRO0_TIN0_TLDS0_TLDSM0_ULSGRO0_USL1_UIOFGRO0_UPLRP0_USFGROn1_VSn1_VWA8_VWB4_WSGRA0_WSGRB0_WS64_WG32_8_1_WGM4_WGMXCC8_WGMXCCGn1
    SolutionIndex: 18
    SolutionNameMin: Cijk_Ailk_Bjlk_BBS_BH_Bias_FDMN_SPB_A_S_SAV_MT256x256x64_MI16x16x1_CMS_SN_LDSB1_AFC1_AG0_AFEM1_AFEM1_ASEM8_CLR1_CADS0_DTLA0_DTLB0_DTVA0_DTVB0_DTVSM0_DPLBn1_EPS1_ELFLR0_EMLLn1_FDSI0_GRPM1_GRVWA8_GRVWB8_GSU1_GSUAMBSK_GSUC0_GSUWGMRR0_GLS0_ISA942_IU1_K1_LDSTI0_LBSPPA4096_LBSPPB4096_LBSPPM0_LPA0_LPB0_LPM0_LRVW8_LWPMn1_MIAV0_MIWT8_8_MO40_MGRIPMn1_NTn1_NTA0_NTB0_NTC0_NTD0_NTM0_NEPBS0_NLCA1_NLCB1_ONLL1_PGR2_PLR1_PKA1_SGROBn1_SIA3_SS1_SU0_SUM0_SUS0_SPO0_SRVW0_SSO0_SVW8_SK0_SKFTR0_SKXCCM0_SGRO0_TIN0_TLDS0_TLDSM0_ULSGRO0_USL1_UIOFGRO0_UPLRP0_USFGROn1_VSn1_VWA8_VWB4_WSGRA0_WSGRB0_WS64_WG32_8_1_WGM8_WGMXCC8_WGMXCCGn1
    SolutionIndex: 19
    SolutionNameMin: Cijk_Ailk_Bjlk_BBS_BH_Bias_FDMN_SPB_A_S_SAV_MT256x256x64_MI16x16x1_CMS_SN_LDSB1_AFC1_AG0_AFEM1_AFEM1_ASEM8_CLR1_CADS0_DTLA0_DTLB0_DTVA0_DTVB0_DTVSM0_DPLBn1_EPS1_ELFLR0_EMLLn1_FDSI0_GRPM1_GRVWA8_GRVWB8_GSU1_GSUAMB_GSUC0_GSUWGMRR0_GLS0_ISA942_IU1_K1_LDSTI0_LBSPPA4096_LBSPPB4096_LBSPPM0_LPA0_LPB32_LPM0_LRVW8_LWPMn1_MIAV0_MIWT8_8_MO40_MGRIPMn1_NTn1_NTA0_NTB0_NTC0_NTD0_NTM0_NEPBS0_NLCA1_NLCB1_ONLL1_PGR2_PLR1_PKA1_SGROBn1_SIA3_SS1_SU0_SUM0_SUS0_SPO0_SRVW0_SSO0_SVW4_SK0_SKFTR0_SKXCCM0_SGRO0_TIN0_TLDS0_TLDSM0_ULSGRO0_USL1_UIOFGRO0_UPLRP0_USFGROn1_VSn1_VWA4_VWB2_WSGRA0_WSGRB0_WS64_WG32_8_1_WGM1_WGMXCC1_WGMXCCGn1
    SolutionIndex: 20
    SolutionNameMin: Cijk_Ailk_Bjlk_BBS_BH_Bias_FDMN_SPB_A_S_SAV_MT256x256x64_MI16x16x1_CMS_SN_LDSB1_AFC1_AG0_AFEM1_AFEM1_ASEM8_CLR1_CADS0_DTLA0_DTLB0_DTVA0_DTVB0_DTVSM0_DPLBn1_EPS1_ELFLR0_EMLLn1_FDSI0_GRPM1_GRVWA8_GRVWB8_GSU1_GSUAMB_GSUC0_GSUWGMRR0_GLS0_ISA942_IU1_K1_LDSTI0_LBSPPA4096_LBSPPB4096_LBSPPM0_LPA0_LPB0_LPM0_LRVW8_LWPMn1_MIAV0_MIWT8_8_MO40_MGRIPMn1_NTn1_NTA0_NTB0_NTC0_NTD0_NTM0_NEPBS0_NLCA1_NLCB1_ONLL1_PGR2_PLR1_PKA1_SGROBn1_SIA3_SS1_SU0_SUM0_SUS0_SPO0_SRVW0_SSO0_SVW8_SK0_SKFTR0_SKXCCM0_SGRO0_TIN0_TLDS0_TLDSM0_ULSGRO0_USL1_UIOFGRO0_UPLRP0_USFGROn1_VSn1_VWA8_VWB4_WSGRA0_WSGRB0_WS64_WG32_8_1_WGM1_WGMXCC1_WGMXCCGn1
    SolutionIndex: 21
    SolutionNameMin: Cijk_Ailk_Bjlk_BBS_BH_Bias_FDMN_SPB_A_S_SAV_MT128x128x64_MI16x16x1_CMS_SN_LDSB1_AFC1_AG0_AFEM1_AFEM1_ASEM8_CLR1_CADS0_DTLA0_DTLB0_DTVA0_DTVB0_DTVSM0_DPLBn1_EPS1_ELFLR0_EMLLn1_FDSI0_GRPM1_GRVWA8_GRVWB8_GSU1_GSUAMB_GSUC0_GSUWGMRR0_GLS0_ISA942_IU1_K1_LDSTI0_LBSPPA2048_LBSPPB2048_LBSPPM0_LPA0_LPB0_LPM0_LRVW8_LWPMn1_MIAV0_MIWT4_4_MO40_MGRIPMn1_NTn1_NTA0_NTB0_NTC0_NTD0_NTM0_NEPBS0_NLCA1_NLCB1_ONLL1_PGR2_PLR1_PKA1_SGROBn1_SIA3_SS1_SU16_SUM0_SUS256_SPO0_SRVW0_SSO0_SVW4_SK0_SKFTR0_SKXCCM0_SGRO0_TIN0_TLDS0_TLDSM0_ULSGRO0_USL1_UIOFGRO0_UPLRP0_USFGROn1_VSn1_VWA4_VWB4_WSGRA0_WSGRB0_WS64_WG32_8_1_WGM1_WGMXCC1_WGMXCCGn1
    SolutionIndex: 22
    SolutionNameMin: Cijk_Ailk_Bjlk_BBS_BH_Bias_FDMN_SPB_A_S_SAV_MT64x64x128_MI16x16x1_CMS_SN_LDSB1_AFC1_AG0_AFEM1_AFEM1_ASEM8_CLR1_CADS0_DTLA0_DTLB0_DTVA0_DTVB0_DTVSM0_DPLBn1_EPS1_ELFLR0_EMLLn1_FDSI0_GRPM1_GRVWA8_GRVWB8_GSU1_GSUAMB_GSUC0_GSUWGMRR0_GLS0_ISA942_IU1_K1_LDSTI0_LBSPPA1024_LBSPPB1024_LBSPPM0_LPA32_LPB32_LPM0_LRVW8_LWPMn1_MIAV0_MIWT2_2_MO40_MGRIPMn1_NTn1_NTA0_NTB0_NTC0_NTD0_NTM0_NEPBS0_NLCA1_NLCB1_ONLL1_PGR2_PLR1_PKA1_SGROBn1_SIA3_SS1_SU8_SUM0_SUS256_SPO0_SRVW0_SSO0_SVW2_SK0_SKFTR0_SKXCCM0_SGRO0_TIN0_TLDS0_TLDSM0_ULSGRO0_USL1_UIOFGRO0_UPLRP0_USFGROn1_VSn1_VWA2_VWB2_WSGRA0_WSGRB0_WS64_WG32_8_1_WGM1_WGMXCC1_WGMXCCGn1
    SolutionIndex: 23
    SolutionNameMin: Cijk_Ailk_Bjlk_BBS_BH_Bias_FDMN_SPB_A_S_SAV_MT128x128x64_MI16x16x1_CMS_SN_LDSB1_AFC1_AG0_AFEM1_AFEM1_ASEM8_CLR1_CADS0_DTLA0_DTLB0_DTVA0_DTVB0_DTVSM0_DPLBn1_EPS1_ELFLR0_EMLLn1_FDSI0_GRPM1_GRVWA8_GRVWB8_GSU1_GSUAMB_GSUC0_GSUWGMRR0_GLS0_ISA942_IU1_K1_LDSTI0_LBSPPA2048_LBSPPB2048_LBSPPM0_LPA0_LPB0_LPM0_LRVW8_LWPMn1_MIAV0_MIWT4_4_MO40_MGRIPMn1_NTn1_NTA0_NTB0_NTC0_NTD0_NTM0_NEPBS0_NLCA1_NLCB1_ONLL1_PGR2_PLR1_PKA1_SGROBn1_SIA3_SS1_SU0_SUM0_SUS0_SPO0_SRVW0_SSO0_SVW4_SK0_SKFTR0_SKXCCM0_SGRO0_TIN0_TLDS0_TLDSM0_ULSGRO0_USL1_UIOFGRO0_UPLRP0_USFGROn1_VSn1_VWA4_VWB4_WSGRA0_WSGRB0_WS64_WG32_8_1_WGM1_WGMXCC1_WGMXCCGn1
    SolutionIndex: 24
    SolutionNameMin: Cijk_Ailk_Bjlk_BBS_BH_Bias_FDMN_SPB_A_S_SAV_MT64x64x128_MI16x16x1_CMS_SN_LDSB1_AFC1_AG0_AFEM1_AFEM1_ASEM8_CLR1_CADS0_DTLA0_DTLB0_DTVA0_DTVB0_DTVSM0_DPLBn1_EPS1_ELFLR0_EMLLn1_FDSI0_GRPM1_GRVWA8_GRVWB8_GSU1_GSUAMBSK_GSUC0_GSUWGMRR0_GLS0_ISA942_IU1_K1_LDSTI0_LBSPPA1024_LBSPPB1024_LBSPPM0_LPA32_LPB32_LPM0_LRVW8_LWPMn1_MIAV0_MIWT2_2_MO40_MGRIPMn1_NTn1_NTA0_NTB0_NTC0_NTD0_NTM0_NEPBS0_NLCA1_NLCB1_ONLL1_PGR2_PLR1_PKA1_SGROBn1_SIA3_SS1_SU16_SUM0_SUS256_SPO0_SRVW0_SSO0_SVW2_SK0_SKFTR0_SKXCCM0_SGRO0_TIN0_TLDS0_TLDSM0_ULSGRO0_USL1_UIOFGRO0_UPLRP0_USFGROn1_VSn1_VWA2_VWB2_WSGRA0_WSGRB0_WS64_WG32_8_1_WGM8_WGMXCC8_WGMXCCGn1
    SolutionIndex: 25
    SolutionNameMin: Cijk_Ailk_Bjlk_BBS_BH_Bias_FDMN_SPB_A_S_SAV_MT256x256x64_MI16x16x1_SN_LDSB1_AFC1_AG0_AFEM1_AFEM1_ASEM8_CLR1_CADS0_DTLA0_DTLB0_DTVA0_DTVB0_DTVSM0_DPLB0_EPS1_ELFLR0_EMLLn1_FDSI0_GRPM1_GRVWA8_GRVWB8_GSUn1_GSUAMB_GSUC0_GSUWGMRR0_GLS0_ISA942_IU1_K1_LDSTI0_LBSPPA0_LBSPPB4096_LBSPPM0_LPA0_LPB32_LPM0_LRVW8_LWPMn1_MIAV0_MIWT8_8_MO40_MGRIPM1_NTn1_NTA0_NTB0_NTC0_NTD4_NTM0_NEPBS0_NLCA1_NLCB1_ONLL1_PGR2_PLR1_PKA1_SGROB0_SIA3_SS1_SU8_SUM0_SUS256_SPO0_SRVW0_SSO0_SVW8_SK0_SKFTR0_SKXCCM0_SGRO0_TIN0_TLDS0_TLDSM1_ULSGRO0_USL1_UIOFGRO0_UPLRP0_USFGROn1_VSn1_VWA8_VWB2_WSGRA0_WSGRB0_WS64_WG32_8_1_WGM1_WGMXCC1_WGMXCCGn1
    SolutionIndex: 26
    SolutionNameMin: Cijk_Ailk_Bjlk_BBS_BH_Bias_FDMN_SPB_A_S_SAV_MT256x256x64_MI16x16x1_SN_LDSB1_AFC1_AG0_AFEM1_AFEM1_ASEM8_CLR1_CADS0_DTLA0_DTLB0_DTVA0_DTVB0_DTVSM0_DPLB0_EPS1_ELFLR0_EMLLn1_FDSI0_GRPM1_GRVWA8_GRVWB8_GSUn1_GSUAMB_GSUC0_GSUWGMRR0_GLS0_ISA942_IU1_K1_LDSTI0_LBSPPA0_LBSPPB4096_LBSPPM0_LPA0_LPB32_LPM0_LRVW8_LWPMn1_MIAV0_MIWT8_8_MO40_MGRIPM1_NTn1_NTA0_NTB0_NTC0_NTD4_NTM0_NEPBS0_NLCA1_NLCB1_ONLL1_PGR2_PLR1_PKA1_SGROB0_SIA3_SS1_SU0_SUM0_SUS0_SPO0_SRVW0_SSO0_SVW8_SK0_SKFTR0_SKXCCM0_SGRO0_TIN0_TLDS0_TLDSM1_ULSGRO0_USL1_UIOFGRO0_UPLRP0_USFGROn1_VSn1_VWA8_VWB2_WSGRA0_WSGRB0_WS64_WG32_8_1_WGM1_WGMXCC1_WGMXCCGn1
    SolutionIndex: 27
    SolutionNameMin: Cijk_Ailk_Bjlk_BBS_BH_Bias_FDMN_SPB_A_S_SAV_MT256x256x64_MI16x16x1_SN_LDSB1_AFC1_AG0_AFEM1_AFEM1_ASEM8_CLR1_CADS0_DTLA0_DTLB0_DTVA0_DTVB0_DTVSM0_DPLB0_EPS1_ELFLR0_EMLLn1_FDSI0_GRPM1_GRVWA8_GRVWB8_GSUn1_GSUAMB_GSUC0_GSUWGMRR0_GLS0_ISA942_IU1_K1_LDSTI0_LBSPPA0_LBSPPB4096_LBSPPM0_LPA0_LPB32_LPM0_LRVW8_LWPMn1_MIAV0_MIWT8_8_MO40_MGRIPM1_NTn1_NTA0_NTB0_NTC0_NTD4_NTM0_NEPBS0_NLCA1_NLCB1_ONLL1_PGR2_PLR1_PKA1_SGROB0_SIA3_SS1_SU16_SUM0_SUS256_SPO0_SRVW0_SSO0_SVW8_SK0_SKFTR0_SKXCCM0_SGRO0_TIN0_TLDS0_TLDSM1_ULSGRO0_USL1_UIOFGRO0_UPLRP0_USFGROn1_VSn1_VWA8_VWB2_WSGRA0_WSGRB0_WS64_WG32_8_1_WGM1_WGMXCC1_WGMXCCGn1
    SolutionIndex: 28
    SolutionNameMin: Cijk_Ailk_Bjlk_BBS_BH_Bias_FDMN_SPB_A_S_SAV_MT256x256x64_MI16x16x1_SN_LDSB1_AFC1_AG0_AFEM1_AFEM1_ASEM8_CLR1_CADS0_DTLA0_DTLB0_DTVA0_DTVB0_DTVSM0_DPLB0_EPS1_ELFLR0_EMLLn1_FDSI0_GRPM1_GRVWA8_GRVWB8_GSUn1_GSUAMB_GSUC0_GSUWGMRR0_GLS0_ISA942_IU1_K1_LDSTI0_LBSPPA0_LBSPPB4096_LBSPPM0_LPA0_LPB32_LPM0_LRVW8_LWPMn1_MIAV0_MIWT8_8_MO40_MGRIPM1_NTn1_NTA0_NTB0_NTC0_NTD4_NTM0_NEPBS0_NLCA1_NLCB1_ONLL1_PGR2_PLR1_PKA1_SGROB0_SIA3_SS1_SU0_SUM0_SUS0_SPO0_SRVW0_SSO0_SVW8_SK0_SKFTR0_SKXCCM0_SGRO0_TIN0_TLDS0_TLDSM1_ULSGRO0_USL1_UIOFGRO0_UPLRP0_USFGROn1_VSn1_VWA8_VWB2_WSGRA0_WSGRB0_WS64_WG32_8_1_WGM4_WGMXCC8_WGMXCCGn1
    SolutionIndex: 29
    SolutionNameMin: Cijk_Ailk_Bjlk_BBS_BH_Bias_FDMN_SPB_A_S_SAV_MT256x256x64_MI16x16x1_SN_LDSB1_AFC1_AG0_AFEM1_AFEM1_ASEM8_CLR1_CADS0_DTLA0_DTLB0_DTVA0_DTVB0_DTVSM0_DPLB0_EPS1_ELFLR0_EMLLn1_FDSI0_GRPM1_GRVWA2_GRVWB8_GSUn1_GSUAMB_GSUC0_GSUWGMRR0_GLS0_ISA942_IU1_K1_LDSTI0_LBSPPA0_LBSPPB4096_LBSPPM0_LPA0_LPB32_LPM0_LRVW8_LWPMn1_MIAV0_MIWT8_8_MO40_MGRIPM1_NTn1_NTA0_NTB0_NTC0_NTD4_NTM0_NEPBS0_NLCA1_NLCB1_ONLL1_PGR2_PLR1_PKA1_SGROB0_SIA3_SS1_SU16_SUM0_SUS256_SPO0_SRVW0_SSO0_SVW8_SK0_SKFTR0_SKXCCM0_SGRO0_TIN0_TLDS0_TLDSM1_ULSGRO0_USL1_UIOFGRO0_UPLRP0_USFGROn1_VSn1_VWA8_VWB2_WSGRA0_WSGRB0_WS64_WG32_8_1_WGM4_WGMXCC8_WGMXCCGn1
    SolutionIndex: 30
    SolutionNameMin: Cijk_Ailk_Bjlk_BBS_BH_Bias_FDMN_SPB_A_S_SAV_MT192x256x64_MI16x16x1_SN_LDSB1_AFC1_AG0_AFEM1_AFEM1_ASEM8_CLR1_CADS0_DTLA0_DTLB0_DTVA0_DTVB0_DTVSM0_DPLB0_EPS1_ELFLR0_EMLLn1_FDSI0_GRPM1_GRVWA8_GRVWB8_GSUn1_GSUAMB_GSUC0_GSUWGMRR0_GLS0_ISA942_IU1_K1_LDSTI0_LBSPPA0_LBSPPB4096_LBSPPM0_LPA0_LPB32_LPM0_LRVW8_LWPMn1_MIAV0_MIWT12_4_MO40_MGRIPM1_NTn1_NTA0_NTB0_NTC0_NTD4_NTM0_NEPBS0_NLCA3_NLCB1_ONLL1_PGR2_PLR1_PKA1_SGROB0_SIA3_SS1_SU0_SUM0_SUS0_SPO0_SRVW0_SSO0_SVW4_SK0_SKFTR0_SKXCCM0_SGRO0_TIN0_TLDS0_TLDSM1_ULSGRO0_USL1_UIOFGRO0_UPLRP0_USFGROn1_VSn1_VWA4_VWB2_WSGRA0_WSGRB0_WS64_WG16_16_1_WGM4_WGMXCC8_WGMXCCGn1
- - - [16, 16, 1, 16]
    - [5, 0.0]
  - - [16, 16, 1, 136]
    - [5, 0.0]
  - - [256, 256, 1, 128]
    - [6, 0.04]
  - - [256, 256, 1, 136]
    - [8, 0.031]
  - - [256, 256, 1, 256]
    - [2, 0.082]
  - - [384, 384, 1, 16]
    - [3, 0.01]
  - - [384, 384, 1, 24]
    - [1, 0.016]
  - - [384, 384, 1, 32]
    - [4, 0.02]
  - - [384, 384, 1, 128]
    - [7, 0.08]
  - - [384, 384, 1, 256]
    - [0, 0.156]
  - - [10240, 10240, 1, 3072]
    - [9, 384.51]
  - - [10240, 10240, 1, 4096]
    - [9, 391.35]
  - - [10240, 10240, 1, 5120]
    - [9, 413.95]
  - - [10240, 10240, 1, 6144]
    - [10, 397.54]
  - - [10240, 10240, 1, 7168]
    - [9, 400.01]
  - - [10240, 10240, 1, 8192]
    - [10, 406.43]
  - - [10240, 10240, 1, 9216]
    - [9, 406.86]
  - - [10240, 10240, 1, 10240]
    - [9, 422.35]
  - - [10240, 10240, 1, 11264]
    - [10, 397.97]
  - - [10240, 10240, 1, 12288]
    - [11, 392.19]
  - - [10240, 10240, 1, 13312]
    - [12, 392.12]
  - - [10240, 10240, 1, 14336]
    - [11, 389.67]
  - - [10240, 10240, 1, 15360]
    - [11, 406.79]
  - - [10240, 10240, 1, 16384]
    - [11, 388.28]
  - - [10240, 10240, 1, 17408]
    - [11, 387.92]
  - - [10240, 10240, 1, 18432]
    - [12, 388.43]
  - - [10240, 10240, 1, 19456]
    - [12, 387.65]
  - - [10240, 10240, 1, 20480]
    - [9, 400.06]
  - - [10240, 10240, 1, 2560]
    - [9, 397.44]
  - - [10240, 10240, 1, 3840]
    - [9, 409.01]
  - - [10240, 10240, 1, 6400]
    - [9, 417.42]
  - - [10240, 10240, 1, 7680]
    - [10, 420.33]
  - - [10240, 10240, 1, 8960]
    - [10, 426.22]
  - - [10240, 10240, 1, 11520]
    - [9, 415.87]
  - - [10240, 10240, 1, 12800]
    - [11, 411.2]
  - - [10240, 10240, 1, 14080]
    - [12, 409.32]
  - - [10240, 10240, 1, 16640]
    - [12, 404.65]
  - - [10240, 10240, 1, 17920]
    - [11, 402.38]
  - - [10240, 10240, 1, 19200]
    - [9, 400.57]
  - - [10240, 10240, 1, 21760]
    - [9, 397.99]
  - - [10240, 10240, 1, 23040]
    - [9, 396.15]
  - - [10240, 10240, 1, 24320]
    - [9, 396.55]
  - - [17664, 3072, 1, 768]
    - [13, 304.42]
  - - [196608, 3072, 1, 768]
    - [14, 302.67]
  - - [24576, 3072, 1, 768]
    - [15, 313.84]
  - - [98304, 3072, 1, 768]
    - [14, 313.12]
  - - [196608, 768, 1, 768]
    - [14, 285.41]
  - - [98304, 768, 1, 768]
    - [16, 289.03]
  - - [196608, 768, 1, 3072]
    - [17, 340.54]
  - - [98304, 768, 1, 3072]
    - [18, 358.37]
  - - [6144, 3072, 1, 768]
    - [19, 297.34]
  - - [17664, 768, 1, 768]
    - [16, 234.97]
  - - [24576, 768, 1, 768]
    - [20, 278.64]
  - - [17664, 768, 1, 3072]
    - [13, 317.81]
  - - [24576, 768, 1, 3072]
    - [9, 359.33]
  - - [1536, 3072, 1, 768]
    - [21, 187.01]
  - - [1536, 768, 1, 768]
    - [22, 90.2]
  - - [6144, 768, 1, 768]
    - [23, 177.63]
  - - [1536, 768, 1, 3072]
    - [24, 117.52]
  - - [6144, 768, 1, 3072]
    - [23, 238.99]
  - - [16384, 3072, 1, 1024]
    - [25, 334.09]
  - - [16384, 4096, 1, 1024]
    - [26, 335.55]
  - - [16384, 1024, 1, 1024]
    - [26, 324.47]
  - - [16384, 1024, 1, 4096]
    - [27, 397.26]
  - - [133120, 512, 1, 6144]
    - [28, 352.22]
  - - [133120, 1024, 1, 6144]
    - [29, 385.71]
  - - [20544, 1024, 1, 6144]
    - [30, 325.79]
  - - [20544, 512, 1, 6144]
    - [30, 313.89]
- null
- null
- DeviceEfficiency
- Equality
