projects/hipsparselt/library/src/hcc_detail/rocsparselt/src/spmm/Tensile/Logic/asm_full/aquavanjaram/gfx942/Equality/aquavanjaram_Cijk_Alik_Bjlk_HHS_BH_Bias_FDMN_SPB_A_S_SAV.yaml
- {MinimumRequiredVersion: 5.0.0}
- aquavanjaram
- gfx942
- [Device 0049, Device 0050]
    SolutionIndex: 0
    SolutionNameMin: Cijk_Alik_Bjlk_HHS_BH_Bias_FDMN_SPB_AS_SAV_MT32x32x32_MI32x32x1_SN_LDSB0_AFC1_AFEM1_GRVWA4_GSU1_LPA8_LPM0_MIWT1_1_PLR1_SU0_SUS0_SVW1_TLDS1_VWA1_VWB1_WG32_2_1
    SolutionIndex: 1
    SolutionNameMin: Cijk_Alik_Bjlk_HHS_BH_Bias_FDMN_SPB_AS_SAV_MT32x32x32_MI32x32x1_SN_LDSB0_AFC1_AFEM1_GRVWA8_GSU1_LPA8_LPM0_MIWT1_1_PLR1_SU0_SUS0_SVW1_TLDS1_VWA1_VWB1_WG32_2_1
    SolutionIndex: 2
    SolutionNameMin: Cijk_Alik_Bjlk_HHS_BH_Bias_FDMN_SPB_AS_SAV_MT32x32x32_MI32x32x1_SN_LDSB0_AFC1_AFEM8_GRVWA4_GSU1_LPA8_LPM0_MIWT1_1_PLR1_SU0_SUS0_SVW1_TLDS1_VWA1_VWB1_WG32_2_1
    SolutionIndex: 3
    SolutionNameMin: Cijk_Alik_Bjlk_HHS_BH_Bias_FDMN_SPB_AS_SAV_MT32x32x32_MI32x32x1_SN_LDSB0_AFC1_AFEM1_GRVWA8_GSU1_LPA8_LPM0_MIWT1_1_PLR1_SU4_SUS256_SVW1_TLDS1_VWA1_VWB1_WG32_2_1
    SolutionIndex: 4
    SolutionNameMin: Cijk_Alik_Bjlk_HHS_BH_Bias_FDMN_SPB_AS_SAV_MT32x32x64_MI32x32x1_SN_LDSB0_AFC1_AFEM8_GRVWA8_GSU1_LPA8_LPM0_MIWT1_1_PLR1_SU0_SUS0_SVW1_TLDS1_VWA1_VWB1_WG32_2_1
    SolutionIndex: 5
    SolutionNameMin: Cijk_Alik_Bjlk_HHS_BH_Bias_FDMN_SPB_AS_SAV_MT32x32x64_MI32x32x1_SN_LDSB0_AFC1_AFEM1_GRVWA4_GSU1_LPA8_LPM0_MIWT1_1_PLR1_SU4_SUS256_SVW1_TLDS1_VWA1_VWB1_WG32_2_1
    SolutionIndex: 6
    SolutionNameMin: Cijk_Alik_Bjlk_HHS_BH_Bias_FDMN_SPB_AS_SAV_MT32x32x64_MI32x32x1_SN_LDSB0_AFC1_AFEM1_GRVWA8_GSU1_LPA8_LPM0_MIWT1_1_PLR1_SU4_SUS256_SVW1_TLDS1_VWA1_VWB1_WG32_2_1
    SolutionIndex: 7
    SolutionNameMin: Cijk_Alik_Bjlk_HHS_BH_Bias_FDMN_SPB_AS_SAV_MT32x32x64_MI32x32x1_SN_LDSB0_AFC1_AFEM8_GRVWA8_GSU1_LPA8_LPM0_MIWT1_1_PLR1_SU4_SUS256_SVW1_TLDS1_VWA1_VWB1_WG32_2_1
    SolutionIndex: 8
    SolutionNameMin: Cijk_Alik_Bjlk_HHS_BH_Bias_FDMN_SPB_A_S_SAV_MT256x256x64_MI16x16x1_SN_LDSB1_AFC1_AFEM1_AFEM1_ASEM8_CLR1_CADS0_DTVA0_DTVB0_EPS1_FDSI0_GRPM1_GRVWA2_GRVWB8_GSU1_GSUAMB_GSUC0_GSUWGMRR0_GLS0_ISA942_IU1_K1_LBSPPA1024_LBSPPB4096_LBSPPM0_LPA16_LPB0_LPM0_LRVW8_LWPMn1_MIAV0_MIWT8_8_MO40_NTn1_NTA0_NTB0_NTC0_NTD0_NTM0_NEPBS0_NLCA1_NLCB1_ONLL1_PGR2_PLR1_PKA1_SIA3_SS1_SU16_SUM0_SUS256_SPO0_SRVW0_SSO0_SVW8_SK0_SKXCCM0_TLDS1_ULSGRO0_USL1_UIOFGRO0_USFGROn1_VSn1_VWA8_VWB8_WSGRA0_WSGRB0_WS64_WG32_8_1_WGM1_WGMXCC1_WGMXCCGn1
    SolutionIndex: 9
    SolutionNameMin: Cijk_Alik_Bjlk_HHS_BH_Bias_FDMN_SPB_A_S_SAV_MT256x256x64_MI16x16x1_SN_LDSB1_AFC1_AFEM1_AFEM1_ASEM8_CLR1_CADS0_DTVA0_DTVB0_EPS1_FDSI0_GRPM1_GRVWA2_GRVWB8_GSU1_GSUAMB_GSUC0_GSUWGMRR0_GLS0_ISA942_IU1_K1_LBSPPA1024_LBSPPB4096_LBSPPM0_LPA16_LPB0_LPM0_LRVW8_LWPMn1_MIAV0_MIWT8_8_MO40_NTn1_NTA0_NTB0_NTC0_NTD0_NTM0_NEPBS0_NLCA1_NLCB1_ONLL1_PGR2_PLR1_PKA1_SIA3_SS1_SU16_SUM0_SUS256_SPO0_SRVW0_SSO0_SVW8_SK0_SKXCCM0_TLDS1_ULSGRO0_USL1_UIOFGRO0_USFGROn1_VSn1_VWA8_VWB4_WSGRA0_WSGRB0_WS64_WG32_8_1_WGM1_WGMXCC1_WGMXCCGn1
    SolutionIndex: 10
    SolutionNameMin: Cijk_Alik_Bjlk_HHS_BH_Bias_FDMN_SPB_A_S_SAV_MT256x256x64_MI16x16x1_SN_LDSB1_AFC1_AFEM1_AFEM1_ASEM8_CLR1_CADS0_DTVA0_DTVB0_EPS1_FDSI0_GRPM1_GRVWA2_GRVWB8_GSU1_GSUAMBSK_GSUC0_GSUWGMRR0_GLS0_ISA942_IU1_K1_LBSPPA1024_LBSPPB4096_LBSPPM0_LPA16_LPB0_LPM0_LRVW8_LWPMn1_MIAV0_MIWT8_8_MO40_NTn1_NTA0_NTB0_NTC0_NTD0_NTM0_NEPBS0_NLCA1_NLCB1_ONLL1_PGR2_PLR1_PKA1_SIA3_SS1_SU16_SUM0_SUS256_SPO0_SRVW0_SSO0_SVW8_SK0_SKXCCM0_TLDS1_ULSGRO0_USL1_UIOFGRO0_USFGROn1_VSn1_VWA8_VWB4_WSGRA0_WSGRB0_WS64_WG32_8_1_WGM1_WGMXCC1_WGMXCCGn1
    SolutionIndex: 11
    SolutionNameMin: Cijk_Alik_Bjlk_HHS_BH_Bias_FDMN_SPB_A_S_SAV_MT256x256x64_MI16x16x1_SN_LDSB1_AFC1_AFEM1_AFEM1_ASEM8_CLR1_CADS0_DTVA0_DTVB0_EPS1_FDSI0_GRPM1_GRVWA2_GRVWB8_GSU1_GSUAMB_GSUC0_GSUWGMRR0_GLS0_ISA942_IU1_K1_LBSPPA1024_LBSPPB4096_LBSPPM0_LPA16_LPB0_LPM0_LRVW8_LWPMn1_MIAV0_MIWT8_8_MO40_NTn1_NTA0_NTB0_NTC0_NTD0_NTM0_NEPBS0_NLCA1_NLCB1_ONLL1_PGR2_PLR1_PKA1_SIA3_SS1_SU0_SUM0_SUS128_SPO0_SRVW0_SSO0_SVW8_SK0_SKXCCM0_TLDS1_ULSGRO0_USL1_UIOFGRO0_USFGROn1_VSn1_VWA8_VWB4_WSGRA0_WSGRB0_WS64_WG32_8_1_WGM4_WGMXCC8_WGMXCCGn1
    SolutionIndex: 12
    SolutionNameMin: Cijk_Alik_Bjlk_HHS_BH_Bias_FDMN_SPB_A_S_SAV_MT256x256x64_MI16x16x1_SN_LDSB1_AFC1_AFEM1_AFEM1_ASEM8_CLR1_CADS0_DTVA0_DTVB0_EPS1_FDSI0_GRPM1_GRVWA2_GRVWB8_GSU1_GSUAMB_GSUC0_GSUWGMRR0_GLS0_ISA942_IU1_K1_LBSPPA1024_LBSPPB4096_LBSPPM0_LPA16_LPB0_LPM0_LRVW8_LWPMn1_MIAV0_MIWT8_8_MO40_NTn1_NTA0_NTB0_NTC0_NTD0_NTM0_NEPBS0_NLCA1_NLCB1_ONLL1_PGR2_PLR1_PKA1_SIA3_SS1_SU8_SUM0_SUS256_SPO0_SRVW0_SSO0_SVW8_SK0_SKXCCM0_TLDS1_ULSGRO0_USL1_UIOFGRO0_USFGROn1_VSn1_VWA8_VWB4_WSGRA0_WSGRB0_WS64_WG32_8_1_WGM1_WGMXCC1_WGMXCCGn1
    SolutionIndex: 13
    SolutionNameMin: Cijk_Alik_Bjlk_HHS_BH_Bias_FDMN_SPB_A_S_SAV_MT256x256x64_MI16x16x1_SN_LDSB1_AFC1_AFEM1_AFEM1_ASEM8_CLR1_CADS0_DTVA0_DTVB0_EPS1_FDSI0_GRPM1_GRVWA2_GRVWB8_GSU1_GSUAMBSK_GSUC0_GSUWGMRR0_GLS0_ISA942_IU1_K1_LBSPPA1024_LBSPPB4096_LBSPPM0_LPA16_LPB0_LPM0_LRVW8_LWPMn1_MIAV0_MIWT8_8_MO40_NTn1_NTA0_NTB0_NTC0_NTD0_NTM0_NEPBS0_NLCA1_NLCB1_ONLL1_PGR2_PLR1_PKA1_SIA3_SS1_SU8_SUM0_SUS256_SPO0_SRVW0_SSO0_SVW8_SK0_SKXCCM0_TLDS1_ULSGRO0_USL1_UIOFGRO0_USFGROn1_VSn1_VWA8_VWB4_WSGRA0_WSGRB0_WS64_WG32_8_1_WGM1_WGMXCC1_WGMXCCGn1
    SolutionIndex: 14
    SolutionNameMin: Cijk_Alik_Bjlk_HHS_BH_Bias_FDMN_SPB_A_S_SAV_MT160x384x64_MI16x16x1_SN_LDSB1_AFC1_AFEM1_AFEM1_ASEM8_CLR1_CADS0_DTVA0_DTVB0_EPS1_FDSI0_GRPM1_GRVWA2_GRVWB8_GSU1_GSUAMB_GSUC0_GSUWGMRR0_GLS0_ISA942_IU1_K1_LBSPPA256_LBSPPB6144_LBSPPM0_LPA16_LPB32_LPM0_LRVW8_LWPMn1_MIAV0_MIWT10_6_MO40_NTn1_NTA0_NTB0_NTC0_NTD0_NTM0_NEPBS0_NLCA1_NLCB3_ONLL1_PGR2_PLR1_PKA1_SIA3_SS1_SU8_SUM0_SUS256_SPO0_SRVW0_SSO0_SVW2_SK0_SKXCCM0_TLDS1_ULSGRO0_USL1_UIOFGRO0_USFGROn1_VSn1_VWA2_VWB2_WSGRA0_WSGRB0_WS64_WG16_16_1_WGM1_WGMXCC1_WGMXCCGn1
    SolutionIndex: 15
    SolutionNameMin: Cijk_Alik_Bjlk_HHS_BH_Bias_FDMN_SPB_A_S_SAV_MT160x384x64_MI16x16x1_SN_LDSB1_AFC1_AFEM1_AFEM1_ASEM8_CLR1_CADS0_DTVA0_DTVB0_EPS1_FDSI0_GRPM1_GRVWA2_GRVWB8_GSU1_GSUAMB_GSUC0_GSUWGMRR0_GLS0_ISA942_IU1_K1_LBSPPA256_LBSPPB6144_LBSPPM0_LPA16_LPB32_LPM0_LRVW8_LWPMn1_MIAV0_MIWT10_6_MO40_NTn1_NTA0_NTB0_NTC0_NTD0_NTM0_NEPBS0_NLCA1_NLCB3_ONLL1_PGR2_PLR1_PKA1_SIA3_SS1_SU16_SUM0_SUS256_SPO0_SRVW0_SSO0_SVW2_SK0_SKXCCM0_TLDS1_ULSGRO0_USL1_UIOFGRO0_USFGROn1_VSn1_VWA2_VWB2_WSGRA0_WSGRB0_WS64_WG16_16_1_WGM1_WGMXCC1_WGMXCCGn1
    SolutionIndex: 16
    SolutionNameMin: Cijk_Alik_Bjlk_HHS_BH_Bias_FDMN_SPB_A_S_SAV_MT160x384x64_MI16x16x1_SN_LDSB1_AFC1_AFEM1_AFEM1_ASEM8_CLR1_CADS0_DTVA0_DTVB0_EPS1_FDSI0_GRPM1_GRVWA2_GRVWB8_GSU1_GSUAMB_GSUC0_GSUWGMRR0_GLS0_ISA942_IU1_K1_LBSPPA256_LBSPPB6144_LBSPPM0_LPA16_LPB32_LPM0_LRVW8_LWPMn1_MIAV0_MIWT10_6_MO40_NTn1_NTA0_NTB0_NTC0_NTD0_NTM0_NEPBS0_NLCA1_NLCB3_ONLL1_PGR2_PLR1_PKA1_SIA3_SS1_SU0_SUM0_SUS128_SPO0_SRVW0_SSO0_SVW2_SK0_SKXCCM0_TLDS1_ULSGRO0_USL1_UIOFGRO0_USFGROn1_VSn1_VWA2_VWB2_WSGRA0_WSGRB0_WS64_WG16_16_1_WGM8_WGMXCC8_WGMXCCGn1
    SolutionIndex: 17
    SolutionNameMin: Cijk_Alik_Bjlk_HHS_BH_Bias_FDMN_SPB_A_S_SAV_MT256x256x64_MI16x16x1_SN_LDSB1_AFC1_AFEM1_AFEM1_ASEM8_CLR1_CADS0_DTVA0_DTVB0_EPS1_FDSI0_GRPM1_GRVWA2_GRVWB8_GSU1_GSUAMBSK_GSUC0_GSUWGMRR0_GLS0_ISA942_IU1_K1_LBSPPA1024_LBSPPB4096_LBSPPM0_LPA16_LPB0_LPM0_LRVW8_LWPMn1_MIAV0_MIWT8_8_MO40_NTn1_NTA0_NTB0_NTC0_NTD0_NTM0_NEPBS0_NLCA1_NLCB1_ONLL1_PGR2_PLR1_PKA1_SIA3_SS1_SU16_SUM0_SUS256_SPO0_SRVW0_SSO0_SVW8_SK0_SKXCCM0_TLDS1_ULSGRO0_USL1_UIOFGRO0_USFGROn1_VSn1_VWA8_VWB4_WSGRA0_WSGRB0_WS64_WG32_8_1_WGM8_WGMXCC8_WGMXCCGn1
    SolutionIndex: 18
    SolutionNameMin: Cijk_Alik_Bjlk_HHS_BH_Bias_FDMN_SPB_A_S_SAV_MT256x256x64_MI16x16x1_SN_LDSB1_AFC1_AFEM1_AFEM1_ASEM8_CLR1_CADS0_DTVA0_DTVB0_EPS1_FDSI0_GRPM1_GRVWA2_GRVWB8_GSU1_GSUAMB_GSUC0_GSUWGMRR0_GLS0_ISA942_IU1_K1_LBSPPA1024_LBSPPB4096_LBSPPM0_LPA16_LPB0_LPM0_LRVW8_LWPMn1_MIAV0_MIWT16_4_MO40_NTn1_NTA0_NTB0_NTC0_NTD0_NTM0_NEPBS0_NLCA1_NLCB1_ONLL1_PGR2_PLR1_PKA1_SIA3_SS1_SU8_SUM0_SUS256_SPO0_SRVW0_SSO0_SVW8_SK0_SKXCCM0_TLDS1_ULSGRO0_USL1_UIOFGRO0_USFGROn1_VSn1_VWA8_VWB4_WSGRA0_WSGRB0_WS64_WG16_16_1_WGM8_WGMXCC8_WGMXCCGn1
    SolutionIndex: 19
    SolutionNameMin: Cijk_Alik_Bjlk_HHS_BH_Bias_FDMN_SPB_A_S_SAV_MT256x256x64_MI16x16x1_SN_LDSB1_AFC1_AFEM1_AFEM1_ASEM8_CLR1_CADS0_DTVA0_DTVB0_EPS1_FDSI0_GRPM1_GRVWA2_GRVWB8_GSU1_GSUAMB_GSUC0_GSUWGMRR0_GLS0_ISA942_IU1_K1_LBSPPA1024_LBSPPB4096_LBSPPM0_LPA16_LPB0_LPM0_LRVW8_LWPMn1_MIAV0_MIWT16_4_MO40_NTn1_NTA0_NTB0_NTC0_NTD0_NTM0_NEPBS0_NLCA1_NLCB1_ONLL1_PGR2_PLR1_PKA1_SIA3_SS1_SU16_SUM0_SUS256_SPO0_SRVW0_SSO0_SVW8_SK0_SKXCCM0_TLDS1_ULSGRO0_USL1_UIOFGRO0_USFGROn1_VSn1_VWA8_VWB4_WSGRA0_WSGRB0_WS64_WG16_16_1_WGM8_WGMXCC8_WGMXCCGn1
    SolutionIndex: 20
    SolutionNameMin: Cijk_Alik_Bjlk_HHS_BH_Bias_FDMN_SPB_A_S_SAV_MT256x256x64_MI16x16x1_SN_LDSB1_AFC1_AFEM1_AFEM1_ASEM8_CLR1_CADS0_DTVA0_DTVB0_EPS1_FDSI0_GRPM1_GRVWA2_GRVWB8_GSU1_GSUAMBSK_GSUC0_GSUWGMRR0_GLS0_ISA942_IU1_K1_LBSPPA1024_LBSPPB4096_LBSPPM0_LPA16_LPB0_LPM0_LRVW8_LWPMn1_MIAV0_MIWT8_8_MO40_NTn1_NTA0_NTB0_NTC0_NTD0_NTM0_NEPBS0_NLCA1_NLCB1_ONLL1_PGR2_PLR1_PKA1_SIA3_SS1_SU8_SUM0_SUS256_SPO0_SRVW0_SSO0_SVW8_SK0_SKXCCM0_TLDS1_ULSGRO0_USL1_UIOFGRO0_USFGROn1_VSn1_VWA8_VWB4_WSGRA0_WSGRB0_WS64_WG32_8_1_WGM8_WGMXCC8_WGMXCCGn1
    SolutionIndex: 21
    SolutionNameMin: Cijk_Alik_Bjlk_HHS_BH_Bias_FDMN_SPB_A_S_SAV_MT256x256x64_MI16x16x1_SN_LDSB1_AFC1_AFEM1_AFEM1_ASEM8_CLR1_CADS0_DTVA0_DTVB0_EPS1_FDSI0_GRPM1_GRVWA2_GRVWB8_GSU1_GSUAMB_GSUC0_GSUWGMRR0_GLS0_ISA942_IU1_K1_LBSPPA1024_LBSPPB4096_LBSPPM0_LPA16_LPB0_LPM0_LRVW8_LWPMn1_MIAV0_MIWT8_8_MO40_NTn1_NTA0_NTB0_NTC0_NTD0_NTM0_NEPBS0_NLCA1_NLCB1_ONLL1_PGR2_PLR1_PKA1_SIA3_SS1_SU16_SUM0_SUS256_SPO0_SRVW0_SSO0_SVW8_SK0_SKXCCM0_TLDS1_ULSGRO0_USL1_UIOFGRO0_USFGROn1_VSn1_VWA8_VWB8_WSGRA0_WSGRB0_WS64_WG32_8_1_WGM4_WGMXCC8_WGMXCCGn1
    SolutionIndex: 22
    SolutionNameMin: Cijk_Alik_Bjlk_HHS_BH_Bias_FDMN_SPB_A_S_SAV_MT256x256x64_MI16x16x1_SN_LDSB1_AFC1_AFEM1_AFEM1_ASEM8_CLR1_CADS0_DTVA0_DTVB0_EPS1_FDSI0_GRPM1_GRVWA8_GRVWB8_GSU1_GSUAMB_GSUC0_GSUWGMRR0_GLS0_ISA942_IU1_K1_LBSPPA1024_LBSPPB4096_LBSPPM0_LPA16_LPB0_LPM0_LRVW8_LWPMn1_MIAV0_MIWT8_8_MO40_NTn1_NTA0_NTB0_NTC0_NTD0_NTM0_NEPBS0_NLCA1_NLCB1_ONLL1_PGR2_PLR1_PKA1_SIA3_SS1_SU16_SUM0_SUS256_SPO0_SRVW0_SSO0_SVW8_SK0_SKXCCM0_TLDS1_ULSGRO0_USL1_UIOFGRO0_USFGROn1_VSn1_VWA8_VWB8_WSGRA0_WSGRB0_WS64_WG32_8_1_WGM1_WGMXCC1_WGMXCCGn1
    SolutionIndex: 23
    SolutionNameMin: Cijk_Alik_Bjlk_HHS_BH_Bias_FDMN_SPB_A_S_SAV_MT128x384x64_MI16x16x1_SN_LDSB1_AFC1_AFEM1_AFEM1_ASEM8_CLR1_CADS0_DTVA0_DTVB0_EPS1_FDSI0_GRPM1_GRVWA8_GRVWB8_GSU1_GSUAMB_GSUC0_GSUWGMRR0_GLS0_ISA942_IU1_K1_LBSPPA1024_LBSPPB6144_LBSPPM0_LPA16_LPB32_LPM0_LRVW8_LWPMn1_MIAV0_MIWT8_6_MO40_NTn1_NTA0_NTB0_NTC0_NTD0_NTM0_NEPBS0_NLCA1_NLCB3_ONLL1_PGR2_PLR1_PKA1_SIA3_SS1_SU8_SUM0_SUS256_SPO0_SRVW0_SSO0_SVW8_SK0_SKXCCM0_TLDS1_ULSGRO0_USL1_UIOFGRO0_USFGROn1_VSn1_VWA8_VWB2_WSGRA0_WSGRB0_WS64_WG16_16_1_WGM4_WGMXCC1_WGMXCCGn1
    SolutionIndex: 24
    SolutionNameMin: Cijk_Alik_Bjlk_HHS_BH_Bias_FDMN_SPB_A_S_SAV_MT256x256x64_MI16x16x1_SN_LDSB1_AFC1_AFEM1_AFEM1_ASEM8_CLR1_CADS0_DTVA0_DTVB0_EPS1_FDSI0_GRPM1_GRVWA8_GRVWB8_GSU1_GSUAMBSK_GSUC0_GSUWGMRR0_GLS0_ISA942_IU1_K1_LBSPPA1024_LBSPPB4096_LBSPPM0_LPA16_LPB0_LPM0_LRVW8_LWPMn1_MIAV0_MIWT8_8_MO40_NTn1_NTA0_NTB0_NTC0_NTD0_NTM0_NEPBS0_NLCA1_NLCB1_ONLL1_PGR2_PLR1_PKA1_SIA3_SS1_SU8_SUM0_SUS256_SPO0_SRVW0_SSO0_SVW8_SK0_SKXCCM0_TLDS1_ULSGRO0_USL1_UIOFGRO0_USFGROn1_VSn1_VWA8_VWB4_WSGRA0_WSGRB0_WS64_WG32_8_1_WGM1_WGMXCC1_WGMXCCGn1
    SolutionIndex: 25
    SolutionNameMin: Cijk_Alik_Bjlk_HHS_BH_Bias_FDMN_SPB_A_S_SAV_MT192x256x64_MI16x16x1_SN_LDSB1_AFC1_AFEM1_AFEM1_ASEM8_CLR1_CADS0_DTVA0_DTVB0_EPS1_FDSI0_GRPM1_GRVWA2_GRVWB8_GSU1_GSUAMBSK_GSUC0_GSUWGMRR0_GLS0_ISA942_IU1_K1_LBSPPA512_LBSPPB4096_LBSPPM0_LPA16_LPB0_LPM0_LRVW8_LWPMn1_MIAV0_MIWT12_4_MO40_NTn1_NTA0_NTB0_NTC0_NTD0_NTM0_NEPBS0_NLCA1_NLCB1_ONLL1_PGR2_PLR1_PKA1_SIA3_SS1_SU8_SUM0_SUS256_SPO0_SRVW0_SSO0_SVW4_SK0_SKXCCM0_TLDS1_ULSGRO0_USL1_UIOFGRO0_USFGROn1_VSn1_VWA4_VWB4_WSGRA0_WSGRB0_WS64_WG16_16_1_WGM4_WGMXCC8_WGMXCCGn1
    SolutionIndex: 26
    SolutionNameMin: Cijk_Alik_Bjlk_HHS_BH_Bias_FDMN_SPB_A_S_SAV_MT256x256x64_MI16x16x1_SN_LDSB1_AFC1_AFEM1_AFEM1_ASEM8_CLR1_CADS0_DTVA0_DTVB0_EPS1_FDSI0_GRPM1_GRVWA2_GRVWB8_GSU1_GSUAMBSK_GSUC0_GSUWGMRR0_GLS0_ISA942_IU1_K1_LBSPPA1024_LBSPPB4096_LBSPPM0_LPA16_LPB0_LPM0_LRVW8_LWPMn1_MIAV0_MIWT8_8_MO40_NTn1_NTA0_NTB0_NTC0_NTD0_NTM0_NEPBS0_NLCA1_NLCB1_ONLL1_PGR2_PLR1_PKA1_SIA3_SS1_SU0_SUM0_SUS128_SPO0_SRVW0_SSO0_SVW8_SK0_SKXCCM0_TLDS1_ULSGRO0_USL1_UIOFGRO0_USFGROn1_VSn1_VWA8_VWB4_WSGRA0_WSGRB0_WS64_WG32_8_1_WGM8_WGMXCC8_WGMXCCGn1
    SolutionIndex: 27
    SolutionNameMin: Cijk_Alik_Bjlk_HHS_BH_Bias_FDMN_SPB_A_S_SAV_MT128x128x128_MI16x16x1_SN_LDSB1_AFC1_AFEM1_AFEM1_ASEM8_CLR1_CADS0_DTVA0_DTVB0_EPS1_FDSI0_GRPM1_GRVWA8_GRVWB8_GSU1_GSUAMBSK_GSUC0_GSUWGMRR0_GLS0_ISA942_IU1_K1_LBSPPA1024_LBSPPB2048_LBSPPM0_LPA16_LPB0_LPM0_LRVW8_LWPMn1_MIAV0_MIWT4_4_MO40_NTn1_NTA0_NTB0_NTC0_NTD0_NTM0_NEPBS0_NLCA1_NLCB1_ONLL1_PGR2_PLR1_PKA1_SIA3_SS1_SU8_SUM0_SUS256_SPO0_SRVW0_SSO0_SVW4_SK0_SKXCCM0_TLDS1_ULSGRO0_USL1_UIOFGRO0_USFGROn1_VSn1_VWA4_VWB4_WSGRA0_WSGRB0_WS64_WG32_8_1_WGM1_WGMXCC1_WGMXCCGn1
    SolutionIndex: 28
    SolutionNameMin: Cijk_Alik_Bjlk_HHS_BH_Bias_FDMN_SPB_A_S_SAV_MT64x64x128_MI16x16x1_SN_LDSB1_AFC1_AFEM1_AFEM1_ASEM8_CLR1_CADS0_DTVA0_DTVB0_EPS1_FDSI0_GRPM1_GRVWA8_GRVWB8_GSU1_GSUAMBSK_GSUC0_GSUWGMRR0_GLS0_ISA942_IU1_K1_LBSPPA512_LBSPPB1024_LBSPPM0_LPA16_LPB32_LPM0_LRVW8_LWPMn1_MIAV0_MIWT2_2_MO40_NTn1_NTA0_NTB0_NTC0_NTD0_NTM0_NEPBS0_NLCA1_NLCB1_ONLL1_PGR2_PLR1_PKA1_SIA3_SS1_SU0_SUM0_SUS256_SPO0_SRVW0_SSO0_SVW2_SK0_SKXCCM0_TLDS1_ULSGRO0_USL1_UIOFGRO0_USFGROn1_VSn1_VWA2_VWB2_WSGRA0_WSGRB0_WS64_WG32_8_1_WGM1_WGMXCC1_WGMXCCGn1
    SolutionIndex: 29
    SolutionNameMin: Cijk_Alik_Bjlk_HHS_BH_Bias_FDMN_SPB_A_S_SAV_MT128x128x128_MI16x16x1_SN_LDSB1_AFC1_AFEM1_AFEM1_ASEM8_CLR1_CADS0_DTVA0_DTVB0_EPS1_FDSI0_GRPM1_GRVWA8_GRVWB8_GSU1_GSUAMB_GSUC0_GSUWGMRR0_GLS0_ISA942_IU1_K1_LBSPPA1024_LBSPPB2048_LBSPPM0_LPA16_LPB0_LPM0_LRVW8_LWPMn1_MIAV0_MIWT4_4_MO40_NTn1_NTA0_NTB0_NTC0_NTD0_NTM0_NEPBS0_NLCA1_NLCB1_ONLL1_PGR2_PLR1_PKA1_SIA3_SS1_SU16_SUM0_SUS256_SPO0_SRVW0_SSO0_SVW4_SK0_SKXCCM0_TLDS1_ULSGRO0_USL1_UIOFGRO0_USFGROn1_VSn1_VWA4_VWB4_WSGRA0_WSGRB0_WS64_WG32_8_1_WGM1_WGMXCC1_WGMXCCGn1
    SolutionIndex: 30
    SolutionNameMin: Cijk_Alik_Bjlk_HHS_BH_Bias_FDMN_SPB_A_S_SAV_MT64x64x128_MI16x16x1_SN_LDSB1_AFC1_AFEM1_AFEM1_ASEM8_CLR1_CADS0_DTVA0_DTVB0_EPS1_FDSI0_GRPM1_GRVWA8_GRVWB8_GSU1_GSUAMBSK_GSUC0_GSUWGMRR0_GLS0_ISA942_IU1_K1_LBSPPA256_LBSPPB1024_LBSPPM0_LPA16_LPB32_LPM0_LRVW8_LWPMn1_MIAV0_MIWT2_2_MO40_NTn1_NTA0_NTB0_NTC0_NTD0_NTM0_NEPBS0_NLCA1_NLCB1_ONLL1_PGR2_PLR1_PKA1_SIA3_SS1_SU0_SUM0_SUS256_SPO0_SRVW0_SSO0_SVW1_SK0_SKXCCM0_TLDS1_ULSGRO0_USL1_UIOFGRO0_USFGROn1_VSn1_VWA1_VWB2_WSGRA0_WSGRB0_WS64_WG32_8_1_WGM1_WGMXCC1_WGMXCCGn1
    SolutionIndex: 31
    SolutionNameMin: Cijk_Alik_Bjlk_HHS_BH_Bias_FDMN_SPB_A_S_SAV_MT128x128x128_MI16x16x1_SN_LDSB1_AFC1_AFEM1_AFEM1_ASEM8_CLR1_CADS0_DTVA0_DTVB0_EPS1_FDSI0_GRPM1_GRVWA8_GRVWB8_GSU1_GSUAMBSK_GSUC0_GSUWGMRR0_GLS0_ISA942_IU1_K1_LBSPPA1024_LBSPPB2048_LBSPPM0_LPA16_LPB0_LPM0_LRVW8_LWPMn1_MIAV0_MIWT4_4_MO40_NTn1_NTA0_NTB0_NTC0_NTD0_NTM0_NEPBS0_NLCA1_NLCB1_ONLL1_PGR2_PLR1_PKA1_SIA3_SS1_SU8_SUM0_SUS256_SPO0_SRVW0_SSO0_SVW4_SK0_SKXCCM0_TLDS1_ULSGRO0_USL1_UIOFGRO0_USFGROn1_VSn1_VWA4_VWB4_WSGRA0_WSGRB0_WS64_WG32_8_1_WGM8_WGMXCC8_WGMXCCGn1
- - - [16, 16, 1, 32]
    - [3, 0.0]
  - - [16, 16, 1, 64]
    - [5, 0.0]
  - - [16, 16, 1, 96]
    - [0, 0.0]
  - - [16, 16, 1, 128]
    - [3, 0.0]
  - - [16, 16, 1, 256]
    - [3, 0.0]
  - - [16, 16, 1, 264]
    - [0, 0.0]
  - - [256, 256, 1, 24]
    - [2, 0.009]
  - - [256, 256, 1, 96]
    - [1, 0.033]
  - - [256, 256, 1, 128]
    - [0, 0.046]
  - - [256, 256, 1, 136]
    - [4, 0.047]
  - - [256, 256, 1, 256]
    - [1, 0.089]
  - - [384, 384, 1, 16]
    - [7, 0.011]
  - - [384, 384, 1, 128]
    - [0, 0.085]
  - - [384, 384, 1, 256]
    - [6, 0.174]
  - - [10240, 10240, 1, 2560]
    - [8, 383.43]
  - - [10240, 10240, 1, 3840]
    - [9, 391.37]
  - - [10240, 10240, 1, 5120]
    - [10, 395.86]
  - - [10240, 10240, 1, 6400]
    - [11, 397.82]
  - - [10240, 10240, 1, 7680]
    - [12, 400.57]
  - - [10240, 10240, 1, 8960]
    - [13, 410.19]
  - - [10240, 10240, 1, 10240]
    - [10, 399.8]
  - - [10240, 10240, 1, 11520]
    - [10, 386.43]
  - - [10240, 10240, 1, 12800]
    - [10, 377.55]
  - - [10240, 10240, 1, 14080]
    - [14, 373.84]
  - - [10240, 10240, 1, 15360]
    - [15, 372.26]
  - - [10240, 10240, 1, 16640]
    - [14, 373.23]
  - - [10240, 10240, 1, 17920]
    - [15, 372.19]
  - - [10240, 10240, 1, 19200]
    - [15, 371.84]
  - - [10240, 10240, 1, 20480]
    - [16, 374.3]
  - - [10240, 10240, 1, 21760]
    - [15, 371.82]
  - - [10240, 10240, 1, 23040]
    - [14, 371.7]
  - - [10240, 10240, 1, 24320]
    - [15, 372.1]
  - - [17664, 3072, 1, 768]
    - [17, 290.43]
  - - [196608, 3072, 1, 768]
    - [18, 297.12]
  - - [24576, 3072, 1, 768]
    - [8, 302.82]
  - - [98304, 3072, 1, 768]
    - [18, 292.91]
  - - [196608, 768, 1, 768]
    - [19, 279.4]
  - - [98304, 768, 1, 768]
    - [20, 271.86]
  - - [196608, 768, 1, 3072]
    - [21, 342.68]
  - - [98304, 768, 1, 3072]
    - [17, 341.21]
  - - [6144, 3072, 1, 768]
    - [22, 295.08]
  - - [17664, 768, 1, 768]
    - [23, 228.36]
  - - [24576, 768, 1, 768]
    - [24, 258.6]
  - - [17664, 768, 1, 3072]
    - [25, 300.03]
  - - [24576, 768, 1, 3072]
    - [26, 324.65]
  - - [1536, 3072, 1, 768]
    - [27, 195.17]
  - - [1536, 768, 1, 768]
    - [28, 99.45]
  - - [6144, 768, 1, 768]
    - [29, 181.07]
  - - [1536, 768, 1, 3072]
    - [30, 140.73]
  - - [6144, 768, 1, 3072]
    - [31, 241.78]
- null
- null
- DeviceEfficiency
- Equality
