projects/hipsparselt/library/src/hcc_detail/rocsparselt/src/spmm/Tensile/Logic/asm_full/aquavanjaram/gfx942/Equality/aquavanjaram_Cijk_Alik_Bljk_HHS_BH_Bias_FDMN_SPA_A_S_SAV.yaml
- {MinimumRequiredVersion: 4.33.0}
- aquavanjaram
- gfx942
- [Device 0049, Device 0050]
    SolutionIndex: 0
    SolutionNameMin: Cijk_Alik_Bljk_HHS_BH_Bias_FDMN_SPA_AS_SAV_MT32x32x32_MI32x32x1_SN_LDSB0_AFC1_AFEM1_DTVSM0_GRVWA8_GSU1_LPA8_LPB8_LPM2_MIWT1_1_PLR1_SU0_SUS0_SVW4_TLDS1_VWA1_VWB1_WG32_2_1
    SolutionIndex: 1
    SolutionNameMin: Cijk_Alik_Bljk_HHS_BH_Bias_FDMN_SPA_AS_SAV_MT32x32x32_MI32x32x1_SN_LDSB0_AFC1_AFEM8_DTVSM1_GRVWA8_GSU1_LPA8_LPB8_LPMn1_MIWT1_1_PLR1_SU0_SUS0_SVW4_TLDS1_VWA1_VWB1_WG32_2_1
    SolutionIndex: 2
    SolutionNameMin: Cijk_Alik_Bljk_HHS_BH_Bias_FDMN_SPA_AS_SAV_MT32x32x32_MI32x32x1_SN_LDSB0_AFC1_AFEM8_DTVSM1_GRVWA4_GSU1_LPA0_LPB0_LPMn1_MIWT1_1_PLR1_SU4_SUS256_SVW4_TLDS0_VWA1_VWB1_WG32_2_1
    SolutionIndex: 3
    SolutionNameMin: Cijk_Alik_Bljk_HHS_BH_Bias_FDMN_SPA_AS_SAV_MT32x32x32_MI32x32x1_SN_LDSB0_AFC1_AFEM8_DTVSM1_GRVWA4_GSU1_LPA4_LPB8_LPMn1_MIWT1_1_PLR1_SU4_SUS256_SVW4_TLDS1_VWA1_VWB1_WG32_2_1
    SolutionIndex: 4
    SolutionNameMin: Cijk_Alik_Bljk_HHS_BH_Bias_FDMN_SPA_AS_SAV_MT32x32x64_MI32x32x1_SN_LDSB0_AFC1_AFEM1_DTVSM0_GRVWA8_GSU1_LPA8_LPB8_LPM2_MIWT1_1_PLR1_SU0_SUS0_SVW4_TLDS1_VWA1_VWB1_WG32_2_1
    SolutionIndex: 5
    SolutionNameMin: Cijk_Alik_Bljk_HHS_BH_Bias_FDMN_SPA_AS_SAV_MT32x32x64_MI32x32x1_SN_LDSB0_AFC1_AFEM8_DTVSM0_GRVWA8_GSU1_LPA8_LPB8_LPM2_MIWT1_1_PLR1_SU0_SUS0_SVW4_TLDS1_VWA1_VWB1_WG32_2_1
    SolutionIndex: 6
    SolutionNameMin: Cijk_Alik_Bljk_HHS_BH_Bias_FDMN_SPA_AS_SAV_MT32x32x64_MI32x32x1_SN_LDSB0_AFC1_AFEM8_DTVSM1_GRVWA4_GSU1_LPA4_LPB8_LPMn1_MIWT1_1_PLR1_SU0_SUS0_SVW4_TLDS1_VWA1_VWB1_WG32_2_1
    SolutionIndex: 7
    SolutionNameMin: Cijk_Alik_Bljk_HHS_BH_Bias_FDMN_SPA_AS_SAV_MT32x32x64_MI32x32x1_SN_LDSB0_AFC1_AFEM8_DTVSM1_GRVWA8_GSU1_LPA8_LPB8_LPMn1_MIWT1_1_PLR1_SU0_SUS0_SVW4_TLDS1_VWA1_VWB1_WG32_2_1
    SolutionIndex: 8
    SolutionNameMin: Cijk_Alik_Bljk_HHS_BH_Bias_FDMN_SPA_AS_SAV_MT32x32x64_MI32x32x1_SN_LDSB0_AFC1_AFEM8_DTVSM1_GRVWA4_GSU1_LPA4_LPB8_LPMn1_MIWT1_1_PLR3_SU0_SUS0_SVW4_TLDS1_VWA1_VWB1_WG32_2_1
    SolutionIndex: 9
    SolutionNameMin: Cijk_Alik_Bljk_HHS_BH_Bias_FDMN_SPA_AS_SAV_MT32x32x64_MI32x32x1_SN_LDSB0_AFC1_AFEM8_DTVSM1_GRVWA8_GSU1_LPA8_LPB8_LPMn1_MIWT1_1_PLR3_SU0_SUS0_SVW4_TLDS1_VWA1_VWB1_WG32_2_1
    SolutionIndex: 10
    SolutionNameMin: Cijk_Alik_Bljk_HHS_BH_Bias_FDMN_SPA_AS_SAV_MT256x256x64_MI16x16x1_SN_LDSB1_AFEM1_GRVWA8_GSU1_LBSPPA128_LBSPPB128_LPA8_LPB16_MIWT4_8_PLR1_SU32_SUS128_SVW8_TLDS1_VWA2_VWB1_WG64_8_1_WGM1
    SolutionIndex: 11
    SolutionNameMin: Cijk_Alik_Bljk_HHS_BH_Bias_FDMN_SPA_AS_SAV_MT256x256x64_MI16x16x1_SN_LDSB1_AFEM8_GRVWA8_GSU1_LBSPPA128_LBSPPB128_LPA8_LPB16_MIWT8_8_PLR1_SU32_SUS128_SVW8_TLDS1_VWA2_VWB1_WG32_8_1_WGM18
    SolutionIndex: 12
    SolutionNameMin: Cijk_Alik_Bljk_HHS_BH_Bias_FDMN_SPA_AS_SAV_MT256x256x64_MI16x16x1_SN_LDSB1_AFEM1_GRVWA8_GSU1_LBSPPA128_LBSPPB128_LPA8_LPB16_MIWT8_8_PLR1_SU32_SUS128_SVW8_TLDS1_VWA2_VWB1_WG32_8_1_WGM1
    SolutionIndex: 13
    SolutionNameMin: Cijk_Alik_Bljk_HHS_BH_Bias_FDMN_SPA_AS_SAV_MT256x256x64_MI16x16x1_SN_LDSB1_AFEM8_GRVWA8_GSU1_LBSPPA128_LBSPPB128_LPA8_LPB16_MIWT8_8_PLR1_SU32_SUS128_SVW8_TLDS1_VWA2_VWB1_WG32_8_1_WGM6
    SolutionIndex: 14
    SolutionNameMin: Cijk_Alik_Bljk_HHS_BH_Bias_FDMN_SPA_AS_SAV_MT256x256x64_MI16x16x1_SN_LDSB1_AFEM8_GRVWA8_GSU1_LBSPPA128_LBSPPB128_LPA8_LPB16_MIWT8_8_PLR1_SU32_SUS128_SVW8_TLDS1_VWA2_VWB1_WG32_8_1_WGM1
    SolutionIndex: 15
    SolutionNameMin: Cijk_Alik_Bljk_HHS_BH_Bias_FDMN_SPA_AS_SAV_MT256x256x64_MI16x16x1_SN_LDSB1_AFEM1_GRVWA8_GSU1_LBSPPA128_LBSPPB128_LPA8_LPB16_MIWT8_8_PLR1_SU32_SUS256_SVW8_TLDS1_VWA2_VWB1_WG32_8_1_WGM18
    SolutionIndex: 16
    SolutionNameMin: Cijk_Alik_Bljk_HHS_BH_Bias_FDMN_SPA_AS_SAV_MT256x256x64_MI16x16x1_SN_LDSB1_AFEM1_GRVWA8_GSU1_LBSPPA128_LBSPPB128_LPA8_LPB16_MIWT8_8_PLR1_SU0_SUS0_SVW8_TLDS1_VWA2_VWB1_WG32_8_1_WGM1
- - - [16, 16, 1, 128]
    - [1, 0.0]
  - - [16, 16, 1, 136]
    - [1, 0.0]
  - - [16, 16, 1, 256]
    - [5, 0.001]
  - - [16, 16, 1, 264]
    - [5, 0.001]
  - - [256, 256, 1, 16]
    - [3, 0.008]
  - - [256, 256, 1, 24]
    - [0, 0.013]
  - - [256, 256, 1, 136]
    - [9, 0.071]
  - - [256, 256, 1, 256]
    - [6, 0.128]
  - - [384, 384, 1, 24]
    - [7, 0.024]
  - - [384, 384, 1, 64]
    - [2, 0.065]
  - - [384, 384, 1, 96]
    - [4, 0.098]
  - - [384, 384, 1, 136]
    - [8, 0.14]
  - - [9216, 9216, 1, 1024]
    - [10, 31.562]
  - - [10240, 10240, 1, 1024]
    - [11, 29.747]
  - - [15360, 15360, 1, 1024]
    - [12, 35.261]
  - - [17408, 17408, 1, 1024]
    - [13, 33.97]
  - - [18432, 18432, 1, 1024]
    - [14, 35.881]
  - - [19456, 19456, 1, 1024]
    - [15, 34.512]
  - - [10240, 10240, 1, 14080]
    - [16, 46.282]
- null
- null
- DeviceEfficiency
- Equality
