projects/hipblaslt/library/src/amd_detail/rocblaslt/src/Tensile/Logic/asm_full/aquavanjaram/gfx942_64cu/StreamK/aquavanjaram942_Cijk_Alik_Bjlk_I8BH_UserArgs.yaml
- {MinimumRequiredVersion: 4.33.0}
- aquavanjaram942
- {Architecture: gfx942, CUCount: 64}
- [Device 0049, Device 0050]
    SolutionIndex: 0
    SolutionNameMin: Cijk_Alik_Bjlk_I8BH_UserArgs_MT256x256x32_MI16x16x1_SN_CLR0_GSU0_GSUC0_GSUWGMRR0_K1_LBSPPA128_LBSPPB2048_LPB0_MIWT8_8_PLR0_SU0_SUM0_SUS32_SKXCCM8_VWA4_VWB8_WGM1_WGMXCC1_WGMXCCGn1
    SolutionIndex: 1
    SolutionNameMin: Cijk_Alik_Bjlk_I8BH_UserArgs_MT256x256x32_MI16x16x1_SN_CLR0_GSU0_GSUC0_GSUWGMRR0_K1_LBSPPA256_LBSPPB2048_LPB0_MIWT8_8_PLR0_SU0_SUM0_SUS32_SKXCCM8_VWA8_VWB8_WGM1_WGMXCC1_WGMXCCGn1
    SolutionIndex: 2
    SolutionNameMin: Cijk_Alik_Bjlk_I8BH_UserArgs_MT256x128x32_MI16x16x1_SN_CLR0_GSU0_GSUC0_GSUWGMRR0_K1_LBSPPA256_LBSPPB1024_LPB64_MIWT8_4_PLR0_SU0_SUM0_SUS32_SKXCCM8_VWA8_VWB4_WGM1_WGMXCC1_WGMXCCGn1
    SolutionIndex: 3
    SolutionNameMin: Cijk_Alik_Bjlk_I8BH_UserArgs_MT256x128x32_MI16x16x1_SN_CLR0_GSU0_GSUC0_GSUWGMRR0_K1_LBSPPA256_LBSPPB1024_LPB64_MIWT8_4_PLR0_SU0_SUM0_SUS32_SKXCCM8_VWA8_VWB4_WGM1_WGMXCC1_WGMXCCGn1
    SolutionIndex: 4
    SolutionNameMin: Cijk_Alik_Bjlk_I8BH_UserArgs_MT256x64x32_MI16x16x1_SN_CLR0_GSU0_GSUC0_GSUWGMRR0_K1_LBSPPA128_LBSPPB512_LPB32_MIWT8_2_PLR0_SU0_SUM0_SUS32_SKXCCM8_VWA4_VWB2_WGM1_WGMXCC1_WGMXCCGn1
    SolutionIndex: 5
    SolutionNameMin: Cijk_Alik_Bjlk_I8BH_UserArgs_MT256x64x32_MI16x16x1_SN_CLR0_GSU0_GSUC0_GSUWGMRR0_K1_LBSPPA256_LBSPPB512_LPB32_MIWT8_2_PLR0_SU0_SUM0_SUS32_SKXCCM8_VWA8_VWB2_WGM1_WGMXCC1_WGMXCCGn1
    SolutionIndex: 6
    SolutionNameMin: Cijk_Alik_Bjlk_I8BH_UserArgs_MT128x128x32_MI16x16x1_SN_CLR0_GSU0_GSUC0_GSUWGMRR0_K1_LBSPPA128_LBSPPB1024_LPB64_MIWT4_4_PLR0_SU0_SUM0_SUS32_SKXCCM8_VWA4_VWB4_WGM1_WGMXCC1_WGMXCCGn1
    SolutionIndex: 7
    SolutionNameMin: Cijk_Alik_Bjlk_I8BH_UserArgs_MT128x64x32_MI16x16x1_SN_CLR0_GSU0_GSUC0_GSUWGMRR0_K1_LBSPPA128_LBSPPB512_LPB32_MIWT4_2_PLR0_SU0_SUM0_SUS32_SKXCCM8_VWA4_VWB2_WGM1_WGMXCC1_WGMXCCGn1
    SolutionIndex: 8
    SolutionNameMin: Cijk_Alik_Bjlk_I8BH_UserArgs_MT128x32x32_MI16x16x1_SN_CLR0_GSU0_GSUC0_GSUWGMRR0_K1_LBSPPA128_LBSPPB256_LPB16_MIWT4_1_PLR0_SU0_SUM0_SUS32_SKXCCM8_VWA4_VWB1_WGM1_WGMXCC1_WGMXCCGn1
    SolutionIndex: 9
    SolutionNameMin: Cijk_Alik_Bjlk_I8BH_UserArgs_MT256x256x64_MI16x16x1_SN_CLR1_GSU0_GSUC0_GSUWGMRR0_K1_LBSPPA256_LBSPPB2048_LPB32_MIWT8_8_PLR1_SU0_SUM0_SUS64_SKXCCM8_VWA4_VWB2_WGM1_WGMXCC1_WGMXCCGn1
    SolutionIndex: 10
    SolutionNameMin: Cijk_Alik_Bjlk_I8BH_UserArgs_MT256x256x64_MI16x16x1_SN_CLR1_GSU0_GSUC0_GSUWGMRR0_K1_LBSPPA256_LBSPPB2048_LPB64_MIWT8_8_PLR1_SU0_SUM0_SUS64_SKXCCM8_VWA4_VWB4_WGM1_WGMXCC1_WGMXCCGn1
    SolutionIndex: 11
    SolutionNameMin: Cijk_Alik_Bjlk_I8BH_UserArgs_MT256x256x64_MI16x16x1_SN_CLR1_GSU0_GSUC0_GSUWGMRR0_K1_LBSPPA256_LBSPPB2048_LPB0_MIWT8_8_PLR1_SU0_SUM0_SUS64_SKXCCM8_VWA4_VWB8_WGM1_WGMXCC1_WGMXCCGn1
    SolutionIndex: 12
    SolutionNameMin: Cijk_Alik_Bjlk_I8BH_UserArgs_MT256x256x64_MI16x16x1_SN_CLR1_GSU0_GSUC0_GSUWGMRR0_K1_LBSPPA512_LBSPPB2048_LPB0_MIWT8_8_PLR1_SU0_SUM0_SUS64_SKXCCM8_VWA8_VWB8_WGM1_WGMXCC1_WGMXCCGn1
    SolutionIndex: 13
    SolutionNameMin: Cijk_Alik_Bjlk_I8BH_UserArgs_MT256x256x64_MI16x16x1_SN_CLR1_GSU0_GSUC0_GSUWGMRR0_K1_LBSPPA512_LBSPPB2048_LPB0_MIWT8_8_PLR1_SU0_SUM0_SUS64_SKXCCM8_VWA8_VWB8_WGM1_WGMXCC1_WGMXCCGn1
    SolutionIndex: 14
    SolutionNameMin: Cijk_Alik_Bjlk_I8BH_UserArgs_MT256x256x64_MI16x16x1_SN_CLR1_GSU0_GSUC0_GSUWGMRR0_K1_LBSPPA512_LBSPPB2048_LPB0_MIWT8_8_PLR1_SU0_SUM0_SUS64_SKXCCM8_VWA8_VWB8_WGM4_WGMXCC1_WGMXCCGn1
    SolutionIndex: 15
    SolutionNameMin: Cijk_Alik_Bjlk_I8BH_UserArgs_MT256x256x64_MI16x16x1_SN_CLR1_GSU0_GSUC0_GSUWGMRR0_K1_LBSPPA512_LBSPPB2048_LPB0_MIWT8_8_PLR1_SU0_SUM0_SUS64_SKXCCM8_VWA8_VWB8_WGM4_WGMXCC1_WGMXCCGn1
    SolutionIndex: 16
    SolutionNameMin: Cijk_Alik_Bjlk_I8BH_UserArgs_MT256x256x64_MI16x16x1_SN_CLR1_GSU0_GSUC0_GSUWGMRR0_K1_LBSPPA256_LBSPPB2048_LPB64_MIWT8_8_PLR1_SU0_SUM0_SUS64_SKXCCM8_VWA4_VWB4_WGM8_WGMXCC1_WGMXCCGn1
    SolutionIndex: 17
    SolutionNameMin: Cijk_Alik_Bjlk_I8BH_UserArgs_MT256x256x64_MI16x16x1_SN_CLR1_GSU0_GSUC0_GSUWGMRR0_K1_LBSPPA512_LBSPPB2048_LPB0_MIWT8_8_PLR1_SU0_SUM0_SUS64_SKXCCM8_VWA8_VWB8_WGM8_WGMXCC1_WGMXCCGn1
    SolutionIndex: 18
    SolutionNameMin: Cijk_Alik_Bjlk_I8BH_UserArgs_MT256x256x64_MI16x16x1_SN_CLR1_GSU0_GSUC0_GSUWGMRR0_K1_LBSPPA512_LBSPPB2048_LPB0_MIWT8_8_PLR1_SU0_SUM0_SUS64_SKXCCM8_VWA8_VWB8_WGM8_WGMXCC1_WGMXCCGn1
    SolutionIndex: 19
    SolutionNameMin: Cijk_Alik_Bjlk_I8BH_UserArgs_MT128x256x64_MI16x16x1_SN_CLR1_GSU0_GSUC0_GSUWGMRR0_K1_LBSPPA256_LBSPPB2048_LPB0_MIWT4_8_PLR1_SU0_SUM0_SUS64_SKXCCM8_VWA4_VWB8_WGM1_WGMXCC1_WGMXCCGn1
    SolutionIndex: 20
    SolutionNameMin: Cijk_Alik_Bjlk_I8BH_UserArgs_MT256x128x64_MI16x16x1_SN_CLR1_GSU0_GSUC0_GSUWGMRR0_K1_LBSPPA512_LBSPPB1024_LPB64_MIWT8_4_PLR1_SU0_SUM0_SUS64_SKXCCM8_VWA8_VWB4_WGM1_WGMXCC1_WGMXCCGn1
    SolutionIndex: 21
    SolutionNameMin: Cijk_Alik_Bjlk_I8BH_UserArgs_MT256x128x64_MI16x16x1_SN_CLR1_GSU0_GSUC0_GSUWGMRR0_K1_LBSPPA512_LBSPPB1024_LPB64_MIWT8_4_PLR1_SU0_SUM0_SUS64_SKXCCM8_VWA8_VWB4_WGM1_WGMXCC1_WGMXCCGn1
    SolutionIndex: 22
    SolutionNameMin: Cijk_Alik_Bjlk_I8BH_UserArgs_MT256x128x64_MI16x16x1_SN_CLR1_GSU0_GSUC0_GSUWGMRR0_K1_LBSPPA512_LBSPPB1024_LPB64_MIWT8_4_PLR1_SU0_SUM0_SUS64_SKXCCM8_VWA8_VWB4_WGM1_WGMXCC1_WGMXCCGn1
    SolutionIndex: 23
    SolutionNameMin: Cijk_Alik_Bjlk_I8BH_UserArgs_MT128x128x64_MI16x16x1_SN_CLR1_GSU0_GSUC0_GSUWGMRR0_K1_LBSPPA256_LBSPPB1024_LPB64_MIWT4_4_PLR1_SU0_SUM0_SUS64_SKXCCM8_VWA4_VWB4_WGM1_WGMXCC1_WGMXCCGn1
    SolutionIndex: 24
    SolutionNameMin: Cijk_Alik_Bjlk_I8BH_UserArgs_MT128x128x64_MI16x16x1_SN_CLR1_GSU0_GSUC0_GSUWGMRR0_K1_LBSPPA256_LBSPPB1024_LPB64_MIWT4_4_PLR1_SU0_SUM0_SUS64_SKXCCM8_VWA4_VWB4_WGM1_WGMXCC1_WGMXCCGn1
    SolutionIndex: 25
    SolutionNameMin: Cijk_Alik_Bjlk_I8BH_UserArgs_MT128x64x64_MI16x16x1_SN_CLR1_GSU0_GSUC0_GSUWGMRR0_K1_LBSPPA256_LBSPPB512_LPB32_MIWT4_2_PLR1_SU0_SUM0_SUS64_SKXCCM8_VWA4_VWB2_WGM1_WGMXCC1_WGMXCCGn1
    SolutionIndex: 26
    SolutionNameMin: Cijk_Alik_Bjlk_I8BH_UserArgs_MT128x64x64_MI16x16x1_SN_CLR1_GSU0_GSUC0_GSUWGMRR0_K1_LBSPPA256_LBSPPB512_LPB32_MIWT4_2_PLR1_SU0_SUM0_SUS64_SKXCCM8_VWA4_VWB2_WGM1_WGMXCC1_WGMXCCGn1
    SolutionIndex: 27
    SolutionNameMin: Cijk_Alik_Bjlk_I8BH_UserArgs_MT128x64x64_MI16x16x1_SN_CLR1_GSU0_GSUC0_GSUWGMRR0_K1_LBSPPA256_LBSPPB512_LPB32_MIWT4_2_PLR1_SU0_SUM0_SUS64_SKXCCM8_VWA4_VWB2_WGM1_WGMXCC1_WGMXCCGn1
    SolutionIndex: 28
    SolutionNameMin: Cijk_Alik_Bjlk_I8BH_UserArgs_MT128x64x64_MI16x16x1_SN_CLR1_GSU0_GSUC0_GSUWGMRR0_K1_LBSPPA256_LBSPPB512_LPB32_MIWT4_2_PLR1_SU0_SUM0_SUS64_SKXCCM8_VWA4_VWB2_WGM1_WGMXCC1_WGMXCCGn1
    SolutionIndex: 29
    SolutionNameMin: Cijk_Alik_Bjlk_I8BH_UserArgs_MT128x32x64_MI16x16x1_SN_CLR1_GSU0_GSUC0_GSUWGMRR0_K1_LBSPPA256_LBSPPB256_LPB16_MIWT4_1_PLR1_SU0_SUM0_SUS64_SKXCCM8_VWA4_VWB1_WGM1_WGMXCC1_WGMXCCGn1
    SolutionIndex: 30
    SolutionNameMin: Cijk_Alik_Bjlk_I8BH_UserArgs_MT128x32x64_MI16x16x1_SN_CLR1_GSU0_GSUC0_GSUWGMRR0_K1_LBSPPA256_LBSPPB256_LPB16_MIWT4_1_PLR1_SU0_SUM0_SUS64_SKXCCM8_VWA4_VWB1_WGM1_WGMXCC1_WGMXCCGn1
    SolutionIndex: 31
    SolutionNameMin: Cijk_Alik_Bjlk_I8BH_UserArgs_MT64x64x64_MI16x16x1_SN_CLR1_GSU0_GSUC0_GSUWGMRR0_K1_LBSPPA128_LBSPPB512_LPB32_MIWT2_2_PLR1_SU0_SUM0_SUS64_SKXCCM8_VWA2_VWB2_WGM1_WGMXCC1_WGMXCCGn1
    SolutionIndex: 32
    SolutionNameMin: Cijk_Alik_Bjlk_I8BH_UserArgs_MT64x64x64_MI16x16x1_SN_CLR1_GSU0_GSUC0_GSUWGMRR0_K1_LBSPPA128_LBSPPB512_LPB32_MIWT2_2_PLR1_SU0_SUM0_SUS64_SKXCCM8_VWA2_VWB2_WGM1_WGMXCC1_WGMXCCGn1
    SolutionIndex: 33
    SolutionNameMin: Cijk_Alik_Bjlk_I8BH_UserArgs_MT64x32x64_MI16x16x1_SN_CLR1_GSU0_GSUC0_GSUWGMRR0_K1_LBSPPA128_LBSPPB256_LPB16_MIWT2_1_PLR1_SU0_SUM0_SUS64_SKXCCM8_VWA2_VWB1_WGM1_WGMXCC1_WGMXCCGn1
    SolutionIndex: 34
    SolutionNameMin: Cijk_Alik_Bjlk_I8BH_UserArgs_MT64x32x64_MI16x16x1_SN_CLR1_GSU0_GSUC0_GSUWGMRR0_K1_LBSPPA128_LBSPPB256_LPB16_MIWT2_1_PLR1_SU0_SUM0_SUS64_SKXCCM8_VWA2_VWB1_WGM1_WGMXCC1_WGMXCCGn1
    SolutionIndex: 35
    SolutionNameMin: Cijk_Alik_Bjlk_I8BH_UserArgs_MT64x32x64_MI16x16x1_SN_CLR0_GSU0_GSUC0_GSUWGMRR0_K1_LBSPPA128_LBSPPB256_LPB16_MIWT2_1_PLR0_SU0_SUM0_SUS64_SKXCCM8_VWA2_VWB1_WGM1_WGMXCC1_WGMXCCGn1
    SolutionIndex: 36
    SolutionNameMin: Cijk_Alik_Bjlk_I8BH_UserArgs_MT32x32x64_MI16x16x1_SN_CLR1_GSU0_GSUC0_GSUWGMRR0_K1_LBSPPA128_LBSPPB256_LPB16_MIWT1_1_PLR1_SU0_SUM0_SUS64_SKXCCM8_VWA1_VWB1_WGM1_WGMXCC1_WGMXCCGn1
    SolutionIndex: 37
    SolutionNameMin: Cijk_Alik_Bjlk_I8BH_UserArgs_MT32x32x64_MI16x16x1_SN_CLR1_GSU0_GSUC0_GSUWGMRR0_K1_LBSPPA128_LBSPPB256_LPB16_MIWT1_1_PLR1_SU0_SUM0_SUS64_SKXCCM8_VWA1_VWB1_WGM1_WGMXCC1_WGMXCCGn1
    SolutionIndex: 38
    SolutionNameMin: Cijk_Alik_Bjlk_I8BH_UserArgs_MT32x32x64_MI16x16x1_SN_CLR1_GSU0_GSUC0_GSUWGMRR0_K1_LBSPPA128_LBSPPB256_LPB16_MIWT1_1_PLR1_SU0_SUM0_SUS64_SKXCCM8_VWA1_VWB1_WGM1_WGMXCC1_WGMXCCGn1
    SolutionIndex: 39
    SolutionNameMin: Cijk_Alik_Bjlk_I8BH_UserArgs_MT32x32x64_MI16x16x1_SN_CLR0_GSU0_GSUC0_GSUWGMRR0_K1_LBSPPA128_LBSPPB256_LPB16_MIWT1_1_PLR0_SU0_SUM0_SUS64_SKXCCM8_VWA1_VWB1_WGM1_WGMXCC1_WGMXCCGn1
    SolutionIndex: 40
    SolutionNameMin: Cijk_Alik_Bjlk_I8BH_UserArgs_MT128x256x128_MI16x16x1_SN_CLR1_GSU0_GSUC0_GSUWGMRR0_K1_LBSPPA512_LBSPPB4096_LPB0_MIWT4_8_PLR1_SU0_SUM0_SUS128_SKXCCM8_VWA4_VWB8_WGM1_WGMXCC1_WGMXCCGn1
    SolutionIndex: 41
    SolutionNameMin: Cijk_Alik_Bjlk_I8BH_UserArgs_MT256x128x128_MI16x16x1_SN_CLR1_GSU0_GSUC0_GSUWGMRR0_K1_LBSPPA512_LBSPPB2048_LPB64_MIWT8_4_PLR1_SU0_SUM0_SUS128_SKXCCM8_VWA4_VWB4_WGM1_WGMXCC1_WGMXCCGn1
    SolutionIndex: 42
    SolutionNameMin: Cijk_Alik_Bjlk_I8BH_UserArgs_MT256x128x128_MI16x16x1_SN_CLR1_GSU0_GSUC0_GSUWGMRR0_K1_LBSPPA512_LBSPPB2048_LPB64_MIWT8_4_PLR1_SU0_SUM0_SUS128_SKXCCM8_VWA4_VWB4_WGM4_WGMXCC1_WGMXCCGn1
    SolutionIndex: 43
    SolutionNameMin: Cijk_Alik_Bjlk_I8BH_UserArgs_MT256x128x128_MI16x16x1_SN_CLR1_GSU0_GSUC0_GSUWGMRR0_K1_LBSPPA1024_LBSPPB2048_LPB64_MIWT8_4_PLR1_SU0_SUM0_SUS128_SKXCCM8_VWA8_VWB4_WGM4_WGMXCC1_WGMXCCGn1
    SolutionIndex: 44
    SolutionNameMin: Cijk_Alik_Bjlk_I8BH_UserArgs_MT256x128x128_MI16x16x1_SN_CLR1_GSU0_GSUC0_GSUWGMRR0_K1_LBSPPA512_LBSPPB2048_LPB64_MIWT8_4_PLR1_SU0_SUM0_SUS128_SKXCCM8_VWA4_VWB4_WGM8_WGMXCC1_WGMXCCGn1
    SolutionIndex: 45
    SolutionNameMin: Cijk_Alik_Bjlk_I8BH_UserArgs_MT256x128x128_MI16x16x1_SN_CLR1_GSU0_GSUC0_GSUWGMRR0_K1_LBSPPA1024_LBSPPB2048_LPB64_MIWT8_4_PLR1_SU0_SUM0_SUS128_SKXCCM8_VWA8_VWB4_WGM8_WGMXCC1_WGMXCCGn1
    SolutionIndex: 46
    SolutionNameMin: Cijk_Alik_Bjlk_I8BH_UserArgs_MT128x128x128_MI16x16x1_SN_CLR1_GSU0_GSUC0_GSUWGMRR0_K1_LBSPPA512_LBSPPB2048_LPB64_MIWT4_4_PLR1_SU0_SUM0_SUS128_SKXCCM8_VWA4_VWB4_WGM1_WGMXCC1_WGMXCCGn1
    SolutionIndex: 47
    SolutionNameMin: Cijk_Alik_Bjlk_I8BH_UserArgs_MT128x128x128_MI16x16x1_SN_CLR1_GSU0_GSUC0_GSUWGMRR0_K1_LBSPPA512_LBSPPB2048_LPB64_MIWT4_4_PLR1_SU0_SUM0_SUS128_SKXCCM8_VWA4_VWB4_WGM4_WGMXCC1_WGMXCCGn1
    SolutionIndex: 48
    SolutionNameMin: Cijk_Alik_Bjlk_I8BH_UserArgs_MT128x128x128_MI16x16x1_SN_CLR1_GSU0_GSUC0_GSUWGMRR0_K1_LBSPPA512_LBSPPB2048_LPB64_MIWT4_4_PLR1_SU0_SUM0_SUS128_SKXCCM8_VWA4_VWB4_WGM8_WGMXCC1_WGMXCCGn1
    SolutionIndex: 49
    SolutionNameMin: Cijk_Alik_Bjlk_I8BH_UserArgs_MT128x64x128_MI16x16x1_SN_CLR1_GSU0_GSUC0_GSUWGMRR0_K1_LBSPPA512_LBSPPB1024_LPB32_MIWT4_2_PLR1_SU0_SUM0_SUS128_SKXCCM8_VWA4_VWB2_WGM1_WGMXCC1_WGMXCCGn1
    SolutionIndex: 50
    SolutionNameMin: Cijk_Alik_Bjlk_I8BH_UserArgs_MT64x64x128_MI16x16x1_SN_CLR1_GSU0_GSUC0_GSUWGMRR0_K1_LBSPPA256_LBSPPB1024_LPB32_MIWT2_2_PLR1_SU0_SUM0_SUS128_SKXCCM8_VWA2_VWB2_WGM1_WGMXCC1_WGMXCCGn1
    SolutionIndex: 51
    SolutionNameMin: Cijk_Alik_Bjlk_I8BH_UserArgs_MT64x64x128_MI16x16x1_SN_CLR1_GSU0_GSUC0_GSUWGMRR0_K1_LBSPPA256_LBSPPB1024_LPB32_MIWT2_2_PLR1_SU0_SUM0_SUS128_SKXCCM8_VWA2_VWB2_WGM1_WGMXCC1_WGMXCCGn1
    SolutionIndex: 52
    SolutionNameMin: Cijk_Alik_Bjlk_I8BH_UserArgs_MT64x64x128_MI16x16x1_SN_CLR1_GSU0_GSUC0_GSUWGMRR0_K1_LBSPPA128_LBSPPB1024_LPB32_MIWT2_2_PLR1_SU0_SUM0_SUS128_SKXCCM8_VWA1_VWB2_WGM4_WGMXCC1_WGMXCCGn1
    SolutionIndex: 53
    SolutionNameMin: Cijk_Alik_Bjlk_I8BH_UserArgs_MT64x32x128_MI16x16x1_SN_CLR1_GSU0_GSUC0_GSUWGMRR0_K1_LBSPPA256_LBSPPB512_LPB16_MIWT2_1_PLR1_SU0_SUM0_SUS128_SKXCCM8_VWA2_VWB1_WGM1_WGMXCC1_WGMXCCGn1
    SolutionIndex: 54
    SolutionNameMin: Cijk_Alik_Bjlk_I8BH_UserArgs_MT64x32x128_MI16x16x1_SN_CLR1_GSU0_GSUC0_GSUWGMRR0_K1_LBSPPA128_LBSPPB512_LPB16_MIWT2_1_PLR1_SU0_SUM0_SUS128_SKXCCM8_VWA1_VWB1_WGM1_WGMXCC1_WGMXCCGn1
    SolutionIndex: 55
    SolutionNameMin: Cijk_Alik_Bjlk_I8BH_UserArgs_MT64x32x128_MI16x16x1_SN_CLR1_GSU0_GSUC0_GSUWGMRR0_K1_LBSPPA256_LBSPPB512_LPB16_MIWT2_1_PLR1_SU0_SUM0_SUS128_SKXCCM8_VWA2_VWB1_WGM1_WGMXCC1_WGMXCCGn1
    SolutionIndex: 56
    SolutionNameMin: Cijk_Alik_Bjlk_I8BH_UserArgs_MT32x32x128_MI16x16x1_SN_CLR1_GSU0_GSUC0_GSUWGMRR0_K1_LBSPPA128_LBSPPB512_LPB16_MIWT1_1_PLR1_SU0_SUM0_SUS128_SKXCCM8_VWA1_VWB1_WGM1_WGMXCC1_WGMXCCGn1
    SolutionIndex: 57
    SolutionNameMin: Cijk_Alik_Bjlk_I8BH_UserArgs_MT32x32x128_MI16x16x1_SN_CLR1_GSU0_GSUC0_GSUWGMRR0_K1_LBSPPA128_LBSPPB512_LPB16_MIWT1_1_PLR1_SU0_SUM0_SUS128_SKXCCM8_VWA1_VWB1_WGM1_WGMXCC1_WGMXCCGn1
    SolutionIndex: 58
    SolutionNameMin: Cijk_Alik_Bjlk_I8BH_UserArgs_MT32x32x128_MI16x16x1_SN_CLR1_GSU0_GSUC0_GSUWGMRR0_K1_LBSPPA128_LBSPPB512_LPB16_MIWT1_1_PLR1_SU0_SUM0_SUS128_SKXCCM8_VWA1_VWB1_WGM1_WGMXCC1_WGMXCCGn1
    SolutionIndex: 59
    SolutionNameMin: Cijk_Alik_Bjlk_I8BH_UserArgs_MT32x32x128_MI16x16x1_SN_CLR1_GSU0_GSUC0_GSUWGMRR0_K1_LBSPPA128_LBSPPB512_LPB16_MIWT1_1_PLR1_SU0_SUM0_SUS128_SKXCCM8_VWA1_VWB1_WGM1_WGMXCC1_WGMXCCGn1
    SolutionIndex: 60
    SolutionNameMin: Cijk_Alik_Bjlk_I8BH_UserArgs_MT32x32x128_MI16x16x1_SN_CLR1_GSU0_GSUC0_GSUWGMRR0_K1_LBSPPA128_LBSPPB512_LPB16_MIWT1_1_PLR1_SU0_SUM0_SUS128_SKXCCM8_VWA1_VWB1_WGM1_WGMXCC1_WGMXCCGn1
    SolutionIndex: 61
    SolutionNameMin: Cijk_Alik_Bjlk_I8BH_UserArgs_MT128x64x256_MI16x16x1_SN_CLR1_GSU0_GSUC0_GSUWGMRR0_K1_LBSPPA1024_LBSPPB1024_LPB32_MIWT4_2_PLR2_SU0_SUM0_SUS256_SKXCCM8_VWA4_VWB2_WGM1_WGMXCC1_WGMXCCGn1
    SolutionIndex: 62
    SolutionNameMin: Cijk_Alik_Bjlk_I8BH_UserArgs_MT128x64x256_MI16x16x1_SN_CLR1_GSU0_GSUC0_GSUWGMRR0_K1_LBSPPA1024_LBSPPB1024_LPB32_MIWT4_2_PLR2_SU0_SUM0_SUS256_SKXCCM8_VWA4_VWB2_WGM4_WGMXCC1_WGMXCCGn1
    SolutionIndex: 63
    SolutionNameMin: Cijk_Alik_Bjlk_I8BH_UserArgs_MT128x64x256_MI16x16x1_SN_CLR1_GSU0_GSUC0_GSUWGMRR0_K1_LBSPPA1024_LBSPPB1024_LPB32_MIWT4_2_PLR2_SU0_SUM0_SUS256_SKXCCM8_VWA4_VWB2_WGM4_WGMXCC1_WGMXCCGn1
    SolutionIndex: 64
    SolutionNameMin: Cijk_Alik_Bjlk_I8BH_UserArgs_MT128x64x256_MI16x16x1_SN_CLR1_GSU0_GSUC0_GSUWGMRR0_K1_LBSPPA1024_LBSPPB1024_LPB32_MIWT4_2_PLR2_SU0_SUM0_SUS256_SKXCCM8_VWA4_VWB2_WGM8_WGMXCC1_WGMXCCGn1
    SolutionIndex: 65
    SolutionNameMin: Cijk_Alik_Bjlk_I8BH_UserArgs_MT128x32x256_MI16x16x1_SN_CLR1_GSU0_GSUC0_GSUWGMRR0_K1_LBSPPA1024_LBSPPB512_LPB16_MIWT4_1_PLR2_SU0_SUM0_SUS256_SKXCCM8_VWA4_VWB1_WGM4_WGMXCC1_WGMXCCGn1
    SolutionIndex: 66
    SolutionNameMin: Cijk_Alik_Bjlk_I8BH_UserArgs_MT64x64x256_MI16x16x1_SN_CLR1_GSU0_GSUC0_GSUWGMRR0_K1_LBSPPA512_LBSPPB1024_LPB32_MIWT2_2_PLR2_SU0_SUM0_SUS256_SKXCCM8_VWA2_VWB2_WGM1_WGMXCC1_WGMXCCGn1
    SolutionIndex: 67
    SolutionNameMin: Cijk_Alik_Bjlk_I8BH_UserArgs_MT64x64x256_MI16x16x1_SN_CLR1_GSU0_GSUC0_GSUWGMRR0_K1_LBSPPA512_LBSPPB1024_LPB32_MIWT2_2_PLR2_SU0_SUM0_SUS256_SKXCCM8_VWA2_VWB2_WGM8_WGMXCC1_WGMXCCGn1
    SolutionIndex: 68
    SolutionNameMin: Cijk_Alik_Bjlk_I8BH_UserArgs_MT64x32x256_MI16x16x1_SN_CLR1_GSU0_GSUC0_GSUWGMRR0_K1_LBSPPA256_LBSPPB512_LPB16_MIWT2_1_PLR2_SU0_SUM0_SUS256_SKXCCM8_VWA1_VWB1_WGM1_WGMXCC1_WGMXCCGn1
    SolutionIndex: 69
    SolutionNameMin: Cijk_Alik_Bjlk_I8BH_UserArgs_MT64x32x256_MI16x16x1_SN_CLR1_GSU0_GSUC0_GSUWGMRR0_K1_LBSPPA512_LBSPPB512_LPB16_MIWT2_1_PLR2_SU0_SUM0_SUS256_SKXCCM8_VWA2_VWB1_WGM1_WGMXCC1_WGMXCCGn1
    SolutionIndex: 70
    SolutionNameMin: Cijk_Alik_Bjlk_I8BH_UserArgs_MT64x32x256_MI16x16x1_SN_CLR1_GSU0_GSUC0_GSUWGMRR0_K1_LBSPPA256_LBSPPB512_LPB16_MIWT2_1_PLR2_SU0_SUM0_SUS256_SKXCCM8_VWA1_VWB1_WGM4_WGMXCC1_WGMXCCGn1
    SolutionIndex: 71
    SolutionNameMin: Cijk_Alik_Bjlk_I8BH_UserArgs_MT64x32x256_MI16x16x1_SN_CLR1_GSU0_GSUC0_GSUWGMRR0_K1_LBSPPA512_LBSPPB512_LPB16_MIWT2_1_PLR2_SU0_SUM0_SUS256_SKXCCM8_VWA2_VWB1_WGM4_WGMXCC1_WGMXCCGn1
    SolutionIndex: 72
    SolutionNameMin: Cijk_Alik_Bjlk_I8BH_UserArgs_MT64x32x256_MI16x16x1_SN_CLR1_GSU0_GSUC0_GSUWGMRR0_K1_LBSPPA256_LBSPPB512_LPB16_MIWT2_1_PLR2_SU0_SUM0_SUS256_SKXCCM8_VWA1_VWB1_WGM8_WGMXCC1_WGMXCCGn1
    SolutionIndex: 73
    SolutionNameMin: Cijk_Alik_Bjlk_I8BH_UserArgs_MT32x32x256_MI16x16x1_SN_CLR1_GSU0_GSUC0_GSUWGMRR0_K1_LBSPPA256_LBSPPB512_LPB16_MIWT1_1_PLR2_SU0_SUM0_SUS256_SKXCCM8_VWA1_VWB1_WGM1_WGMXCC1_WGMXCCGn1
    SolutionIndex: 74
    SolutionNameMin: Cijk_Alik_Bjlk_I8BH_UserArgs_MT32x32x32_MI16x16x1_SN_CLR0_GSU0_GSUC0_GSUWGMRR0_K1_LBSPPA128_LBSPPB256_LPB16_MIWT1_1_PLR0_SU32_SUM0_SUS256_SKXCCM0_VWA1_VWB1_WGM1_WGMXCC1_WGMXCCGn1
- - - [128, 128, 1, 128, 128, 128, 128, 128]
    - [58, 0.63]
  - - [128, 128, 1, 256, 128, 128, 256, 128]
    - [60, 1.13]
  - - [128, 128, 1, 512, 128, 128, 512, 128]
    - [59, 1.89]
  - - [128, 128, 1, 1024, 128, 128, 1024, 128]
    - [60, 2.88]
  - - [128, 128, 1, 2048, 128, 128, 2048, 128]
    - [60, 3.87]
  - - [128, 128, 1, 4096, 128, 128, 4096, 128]
    - [73, 4.78]
  - - [128, 128, 1, 8192, 128, 128, 8192, 128]
    - [73, 5.39]
  - - [128, 256, 1, 128, 128, 128, 128, 256]
    - [58, 1.24]
  - - [128, 256, 1, 256, 128, 128, 256, 256]
    - [58, 2.24]
  - - [128, 256, 1, 512, 128, 128, 512, 256]
    - [60, 3.77]
  - - [128, 256, 1, 1024, 128, 128, 1024, 256]
    - [60, 5.71]
  - - [128, 256, 1, 2048, 128, 128, 2048, 256]
    - [60, 7.72]
  - - [128, 256, 1, 4096, 128, 128, 4096, 256]
    - [73, 9.48]
  - - [128, 256, 1, 8192, 128, 128, 8192, 256]
    - [73, 10.72]
  - - [128, 512, 1, 128, 128, 128, 128, 512]
    - [37, 2.5]
  - - [128, 512, 1, 256, 128, 128, 256, 512]
    - [58, 4.48]
  - - [128, 512, 1, 512, 128, 128, 512, 512]
    - [59, 7.45]
  - - [128, 512, 1, 1024, 128, 128, 1024, 512]
    - [60, 11.36]
  - - [128, 512, 1, 2048, 128, 128, 2048, 512]
    - [60, 15.31]
  - - [128, 512, 1, 4096, 128, 128, 4096, 512]
    - [73, 18.85]
  - - [128, 512, 1, 8192, 128, 128, 8192, 512]
    - [73, 21.29]
  - - [128, 1024, 1, 128, 128, 128, 128, 1024]
    - [33, 4.61]
  - - [128, 1024, 1, 256, 128, 128, 256, 1024]
    - [53, 8.09]
  - - [128, 1024, 1, 512, 128, 128, 512, 1024]
    - [53, 13.32]
  - - [128, 1024, 1, 1024, 128, 128, 1024, 1024]
    - [55, 20.13]
  - - [128, 1024, 1, 2048, 128, 128, 2048, 1024]
    - [69, 27.87]
  - - [128, 1024, 1, 4096, 128, 128, 4096, 1024]
    - [69, 34.62]
  - - [128, 1024, 1, 8192, 128, 128, 8192, 1024]
    - [53, 31.5]
  - - [128, 2048, 1, 128, 128, 128, 128, 2048]
    - [31, 8.34]
  - - [128, 2048, 1, 256, 128, 128, 256, 2048]
    - [32, 14.61]
  - - [128, 2048, 1, 512, 128, 128, 512, 2048]
    - [50, 23.5]
  - - [128, 2048, 1, 1024, 128, 128, 1024, 2048]
    - [66, 34.6]
  - - [128, 2048, 1, 2048, 128, 128, 2048, 2048]
    - [50, 43.18]
  - - [128, 2048, 1, 4096, 128, 128, 4096, 2048]
    - [50, 51.21]
  - - [128, 2048, 1, 8192, 128, 128, 8192, 2048]
    - [50, 56.87]
  - - [128, 4096, 1, 128, 128, 128, 128, 4096]
    - [7, 14.25]
  - - [128, 4096, 1, 256, 128, 128, 256, 4096]
    - [25, 24.85]
  - - [128, 4096, 1, 512, 128, 128, 512, 4096]
    - [25, 38.94]
  - - [128, 4096, 1, 1024, 128, 128, 1024, 4096]
    - [25, 51.96]
  - - [128, 4096, 1, 2048, 128, 128, 2048, 4096]
    - [49, 66.23]
  - - [128, 4096, 1, 4096, 128, 128, 4096, 4096]
    - [49, 76.7]
  - - [128, 4096, 1, 8192, 128, 128, 8192, 4096]
    - [61, 84.71]
  - - [128, 8192, 1, 128, 128, 128, 128, 8192]
    - [6, 22.47]
  - - [128, 8192, 1, 256, 128, 128, 256, 8192]
    - [24, 37.75]
  - - [128, 8192, 1, 512, 128, 128, 512, 8192]
    - [46, 57.18]
  - - [128, 8192, 1, 1024, 128, 128, 1024, 8192]
    - [46, 75.98]
  - - [128, 8192, 1, 2048, 128, 128, 2048, 8192]
    - [46, 97.42]
  - - [128, 8192, 1, 4096, 128, 128, 4096, 8192]
    - [46, 112.74]
  - - [128, 8192, 1, 8192, 128, 128, 8192, 8192]
    - [46, 121.89]
  - - [256, 128, 1, 128, 256, 256, 128, 128]
    - [36, 1.25]
  - - [256, 128, 1, 256, 256, 256, 256, 128]
    - [60, 2.23]
  - - [256, 128, 1, 512, 256, 256, 512, 128]
    - [60, 3.73]
  - - [256, 128, 1, 1024, 256, 256, 1024, 128]
    - [60, 5.71]
  - - [256, 128, 1, 2048, 256, 256, 2048, 128]
    - [60, 7.7]
  - - [256, 128, 1, 4096, 256, 256, 4096, 128]
    - [73, 9.48]
  - - [256, 128, 1, 8192, 256, 256, 8192, 128]
    - [73, 10.71]
  - - [256, 256, 1, 128, 256, 256, 128, 256]
    - [39, 2.29]
  - - [256, 256, 1, 256, 256, 256, 256, 256]
    - [57, 4.44]
  - - [256, 256, 1, 512, 256, 256, 512, 256]
    - [60, 7.51]
  - - [256, 256, 1, 1024, 256, 256, 1024, 256]
    - [59, 11.2]
  - - [256, 256, 1, 2048, 256, 256, 2048, 256]
    - [60, 15.38]
  - - [256, 256, 1, 4096, 256, 256, 4096, 256]
    - [73, 18.86]
  - - [256, 256, 1, 8192, 256, 256, 8192, 256]
    - [73, 21.22]
  - - [256, 512, 1, 128, 256, 256, 128, 512]
    - [53, 4.62]
  - - [256, 512, 1, 256, 256, 256, 256, 512]
    - [35, 8.04]
  - - [256, 512, 1, 512, 256, 256, 512, 512]
    - [53, 13.21]
  - - [256, 512, 1, 1024, 256, 256, 1024, 512]
    - [53, 20.03]
  - - [256, 512, 1, 2048, 256, 256, 2048, 512]
    - [69, 27.85]
  - - [256, 512, 1, 4096, 256, 256, 4096, 512]
    - [69, 34.64]
  - - [256, 512, 1, 8192, 256, 256, 8192, 512]
    - [70, 39.15]
  - - [256, 1024, 1, 128, 256, 256, 128, 1024]
    - [50, 8.25]
  - - [256, 1024, 1, 256, 256, 256, 256, 1024]
    - [32, 14.64]
  - - [256, 1024, 1, 512, 256, 256, 512, 1024]
    - [50, 23.51]
  - - [256, 1024, 1, 1024, 256, 256, 1024, 1024]
    - [51, 34.61]
  - - [256, 1024, 1, 2048, 256, 256, 2048, 1024]
    - [66, 46.72]
  - - [256, 1024, 1, 4096, 256, 256, 4096, 1024]
    - [66, 56.81]
  - - [256, 1024, 1, 8192, 256, 256, 8192, 1024]
    - [52, 55.53]
  - - [256, 2048, 1, 128, 256, 256, 128, 2048]
    - [26, 14.33]
  - - [256, 2048, 1, 256, 256, 256, 256, 2048]
    - [25, 24.86]
  - - [256, 2048, 1, 512, 256, 256, 512, 2048]
    - [25, 39.06]
  - - [256, 2048, 1, 1024, 256, 256, 1024, 2048]
    - [27, 54.57]
  - - [256, 2048, 1, 2048, 256, 256, 2048, 2048]
    - [49, 66.22]
  - - [256, 2048, 1, 4096, 256, 256, 4096, 2048]
    - [49, 76.98]
  - - [256, 2048, 1, 8192, 256, 256, 8192, 2048]
    - [61, 84.44]
  - - [256, 4096, 1, 128, 256, 256, 128, 4096]
    - [6, 22.34]
  - - [256, 4096, 1, 256, 256, 256, 256, 4096]
    - [24, 37.74]
  - - [256, 4096, 1, 512, 256, 256, 512, 4096]
    - [24, 57.5]
  - - [256, 4096, 1, 1024, 256, 256, 1024, 4096]
    - [46, 77.0]
  - - [256, 4096, 1, 2048, 256, 256, 2048, 4096]
    - [46, 98.62]
  - - [256, 4096, 1, 4096, 256, 256, 4096, 4096]
    - [46, 114.21]
  - - [256, 4096, 1, 8192, 256, 256, 8192, 4096]
    - [46, 124.47]
  - - [256, 8192, 1, 128, 256, 256, 128, 8192]
    - [2, 32.42]
  - - [256, 8192, 1, 256, 256, 256, 256, 8192]
    - [21, 54.12]
  - - [256, 8192, 1, 512, 256, 256, 512, 8192]
    - [22, 83.3]
  - - [256, 8192, 1, 1024, 256, 256, 1024, 8192]
    - [19, 102.58]
  - - [256, 8192, 1, 2048, 256, 256, 2048, 8192]
    - [41, 133.35]
  - - [256, 8192, 1, 4096, 256, 256, 4096, 8192]
    - [41, 153.53]
  - - [256, 8192, 1, 8192, 256, 256, 8192, 8192]
    - [41, 168.12]
  - - [512, 128, 1, 128, 512, 512, 128, 128]
    - [56, 2.44]
  - - [512, 128, 1, 256, 512, 512, 256, 128]
    - [38, 4.38]
  - - [512, 128, 1, 512, 512, 512, 512, 128]
    - [60, 7.37]
  - - [512, 128, 1, 1024, 512, 512, 1024, 128]
    - [60, 11.06]
  - - [512, 128, 1, 2048, 512, 512, 2048, 128]
    - [73, 15.17]
  - - [512, 128, 1, 4096, 512, 512, 4096, 128]
    - [73, 18.75]
  - - [512, 128, 1, 8192, 512, 512, 8192, 128]
    - [73, 21.27]
  - - [512, 256, 1, 128, 512, 512, 128, 256]
    - [35, 4.62]
  - - [512, 256, 1, 256, 512, 512, 256, 256]
    - [34, 8.08]
  - - [512, 256, 1, 512, 512, 512, 512, 256]
    - [53, 13.47]
  - - [512, 256, 1, 1024, 512, 512, 1024, 256]
    - [54, 20.06]
  - - [512, 256, 1, 2048, 512, 512, 2048, 256]
    - [68, 27.94]
  - - [512, 256, 1, 4096, 512, 512, 4096, 256]
    - [69, 34.78]
  - - [512, 256, 1, 8192, 512, 512, 8192, 256]
    - [71, 39.22]
  - - [512, 512, 1, 128, 512, 512, 128, 512]
    - [30, 8.32]
  - - [512, 512, 1, 256, 512, 512, 256, 512]
    - [32, 14.53]
  - - [512, 512, 1, 512, 512, 512, 512, 512]
    - [51, 23.43]
  - - [512, 512, 1, 1024, 512, 512, 1024, 512]
    - [51, 34.71]
  - - [512, 512, 1, 2048, 512, 512, 2048, 512]
    - [66, 46.41]
  - - [512, 512, 1, 4096, 512, 512, 4096, 512]
    - [66, 56.61]
  - - [512, 512, 1, 8192, 512, 512, 8192, 512]
    - [65, 58.49]
  - - [512, 1024, 1, 128, 512, 512, 128, 1024]
    - [28, 14.36]
  - - [512, 1024, 1, 256, 512, 512, 256, 1024]
    - [28, 24.54]
  - - [512, 1024, 1, 512, 512, 512, 512, 1024]
    - [25, 39.0]
  - - [512, 1024, 1, 1024, 512, 512, 1024, 1024]
    - [27, 54.5]
  - - [512, 1024, 1, 2048, 512, 512, 2048, 1024]
    - [61, 70.81]
  - - [512, 1024, 1, 4096, 512, 512, 4096, 1024]
    - [61, 75.04]
  - - [512, 1024, 1, 8192, 512, 512, 8192, 1024]
    - [62, 82.83]
  - - [512, 2048, 1, 128, 512, 512, 128, 2048]
    - [6, 22.44]
  - - [512, 2048, 1, 256, 512, 512, 256, 2048]
    - [24, 37.63]
  - - [512, 2048, 1, 512, 512, 512, 512, 2048]
    - [24, 57.36]
  - - [512, 2048, 1, 1024, 512, 512, 1024, 2048]
    - [46, 80.35]
  - - [512, 2048, 1, 2048, 512, 512, 2048, 2048]
    - [46, 98.45]
  - - [512, 2048, 1, 4096, 512, 512, 4096, 2048]
    - [46, 113.72]
  - - [512, 2048, 1, 8192, 512, 512, 8192, 2048]
    - [47, 122.66]
  - - [512, 4096, 1, 128, 512, 512, 128, 4096]
    - [2, 32.38]
  - - [512, 4096, 1, 256, 512, 512, 256, 4096]
    - [20, 54.34]
  - - [512, 4096, 1, 512, 512, 512, 512, 4096]
    - [22, 83.23]
  - - [512, 4096, 1, 1024, 512, 512, 1024, 4096]
    - [21, 107.91]
  - - [512, 4096, 1, 2048, 512, 512, 2048, 4096]
    - [41, 136.37]
  - - [512, 4096, 1, 4096, 512, 512, 4096, 4096]
    - [41, 158.24]
  - - [512, 4096, 1, 8192, 512, 512, 8192, 4096]
    - [44, 167.93]
  - - [512, 8192, 1, 128, 512, 512, 128, 8192]
    - [9, 39.52]
  - - [512, 8192, 1, 256, 512, 512, 256, 8192]
    - [10, 66.55]
  - - [512, 8192, 1, 512, 512, 512, 512, 8192]
    - [10, 99.36]
  - - [512, 8192, 1, 1024, 512, 512, 1024, 8192]
    - [17, 131.39]
  - - [512, 8192, 1, 2048, 512, 512, 2048, 8192]
    - [12, 159.48]
  - - [512, 8192, 1, 4096, 512, 512, 4096, 8192]
    - [14, 178.36]
  - - [512, 8192, 1, 8192, 512, 512, 8192, 8192]
    - [15, 189.34]
  - - [1024, 128, 1, 128, 1024, 1024, 128, 128]
    - [53, 4.63]
  - - [1024, 128, 1, 256, 1024, 1024, 256, 128]
    - [53, 8.06]
  - - [1024, 128, 1, 512, 1024, 1024, 512, 128]
    - [53, 13.43]
  - - [1024, 128, 1, 1024, 1024, 1024, 1024, 128]
    - [55, 20.11]
  - - [1024, 128, 1, 2048, 1024, 1024, 2048, 128]
    - [69, 27.81]
  - - [1024, 128, 1, 4096, 1024, 1024, 4096, 128]
    - [69, 34.69]
  - - [1024, 128, 1, 8192, 1024, 1024, 8192, 128]
    - [72, 39.2]
  - - [1024, 256, 1, 128, 1024, 1024, 128, 256]
    - [29, 8.3]
  - - [1024, 256, 1, 256, 1024, 1024, 256, 256]
    - [32, 14.54]
  - - [1024, 256, 1, 512, 1024, 1024, 512, 256]
    - [51, 23.46]
  - - [1024, 256, 1, 1024, 1024, 1024, 1024, 256]
    - [51, 34.55]
  - - [1024, 256, 1, 2048, 1024, 1024, 2048, 256]
    - [66, 46.87]
  - - [1024, 256, 1, 4096, 1024, 1024, 4096, 256]
    - [66, 57.16]
  - - [1024, 256, 1, 8192, 1024, 1024, 8192, 256]
    - [67, 61.88]
  - - [1024, 512, 1, 128, 1024, 1024, 128, 512]
    - [26, 14.41]
  - - [1024, 512, 1, 256, 1024, 1024, 256, 512]
    - [25, 24.92]
  - - [1024, 512, 1, 512, 1024, 1024, 512, 512]
    - [25, 38.89]
  - - [1024, 512, 1, 1024, 1024, 1024, 1024, 512]
    - [27, 54.44]
  - - [1024, 512, 1, 2048, 1024, 1024, 2048, 512]
    - [61, 70.34]
  - - [1024, 512, 1, 4096, 1024, 1024, 4096, 512]
    - [64, 84.0]
  - - [1024, 512, 1, 8192, 1024, 1024, 8192, 512]
    - [62, 81.8]
  - - [1024, 1024, 1, 128, 1024, 1024, 128, 1024]
    - [4, 22.31]
  - - [1024, 1024, 1, 256, 1024, 1024, 256, 1024]
    - [24, 37.61]
  - - [1024, 1024, 1, 512, 1024, 1024, 512, 1024]
    - [23, 57.3]
  - - [1024, 1024, 1, 1024, 1024, 1024, 1024, 1024]
    - [46, 80.81]
  - - [1024, 1024, 1, 2048, 1024, 1024, 2048, 1024]
    - [46, 101.24]
  - - [1024, 1024, 1, 4096, 1024, 1024, 4096, 1024]
    - [48, 107.77]
  - - [1024, 1024, 1, 8192, 1024, 1024, 8192, 1024]
    - [47, 118.45]
  - - [1024, 2048, 1, 128, 1024, 1024, 128, 2048]
    - [2, 32.49]
  - - [1024, 2048, 1, 256, 1024, 1024, 256, 2048]
    - [21, 54.11]
  - - [1024, 2048, 1, 512, 1024, 1024, 512, 2048]
    - [22, 83.23]
  - - [1024, 2048, 1, 1024, 1024, 1024, 1024, 2048]
    - [21, 114.6]
  - - [1024, 2048, 1, 2048, 1024, 1024, 2048, 2048]
    - [41, 136.96]
  - - [1024, 2048, 1, 4096, 1024, 1024, 4096, 2048]
    - [42, 153.21]
  - - [1024, 2048, 1, 8192, 1024, 1024, 8192, 2048]
    - [43, 161.55]
  - - [1024, 4096, 1, 128, 1024, 1024, 128, 4096]
    - [0, 39.67]
  - - [1024, 4096, 1, 256, 1024, 1024, 256, 4096]
    - [10, 66.37]
  - - [1024, 4096, 1, 512, 1024, 1024, 512, 4096]
    - [10, 97.46]
  - - [1024, 4096, 1, 1024, 1024, 1024, 1024, 4096]
    - [17, 131.92]
  - - [1024, 4096, 1, 2048, 1024, 1024, 2048, 4096]
    - [11, 160.95]
  - - [1024, 4096, 1, 4096, 1024, 1024, 4096, 4096]
    - [15, 176.36]
  - - [1024, 4096, 1, 8192, 1024, 1024, 8192, 4096]
    - [14, 190.7]
  - - [1024, 8192, 1, 128, 1024, 1024, 128, 8192]
    - [1, 42.78]
  - - [1024, 8192, 1, 256, 1024, 1024, 256, 8192]
    - [10, 70.18]
  - - [1024, 8192, 1, 512, 1024, 1024, 512, 8192]
    - [12, 102.43]
  - - [1024, 8192, 1, 1024, 1024, 1024, 1024, 8192]
    - [12, 136.14]
  - - [1024, 8192, 1, 2048, 1024, 1024, 2048, 8192]
    - [12, 164.84]
  - - [1024, 8192, 1, 4096, 1024, 1024, 4096, 8192]
    - [15, 178.81]
  - - [1024, 8192, 1, 8192, 1024, 1024, 8192, 8192]
    - [14, 192.07]
  - - [2048, 128, 1, 128, 2048, 2048, 128, 128]
    - [8, 8.27]
  - - [2048, 128, 1, 256, 2048, 2048, 256, 128]
    - [32, 14.5]
  - - [2048, 128, 1, 512, 2048, 2048, 512, 128]
    - [50, 23.45]
  - - [2048, 128, 1, 1024, 2048, 2048, 1024, 128]
    - [66, 34.68]
  - - [2048, 128, 1, 2048, 2048, 2048, 2048, 128]
    - [66, 47.15]
  - - [2048, 128, 1, 4096, 2048, 2048, 4096, 128]
    - [66, 57.37]
  - - [2048, 128, 1, 8192, 2048, 2048, 8192, 128]
    - [66, 62.29]
  - - [2048, 256, 1, 128, 2048, 2048, 128, 256]
    - [25, 14.34]
  - - [2048, 256, 1, 256, 2048, 2048, 256, 256]
    - [25, 24.73]
  - - [2048, 256, 1, 512, 2048, 2048, 512, 256]
    - [25, 38.54]
  - - [2048, 256, 1, 1024, 2048, 2048, 1024, 256]
    - [27, 54.3]
  - - [2048, 256, 1, 2048, 2048, 2048, 2048, 256]
    - [61, 71.2]
  - - [2048, 256, 1, 4096, 2048, 2048, 4096, 256]
    - [62, 85.25]
  - - [2048, 256, 1, 8192, 2048, 2048, 8192, 256]
    - [63, 86.02]
  - - [2048, 512, 1, 128, 2048, 2048, 128, 512]
    - [5, 22.41]
  - - [2048, 512, 1, 256, 2048, 2048, 256, 512]
    - [24, 37.87]
  - - [2048, 512, 1, 512, 2048, 2048, 512, 512]
    - [24, 57.7]
  - - [2048, 512, 1, 1024, 2048, 2048, 1024, 512]
    - [46, 80.49]
  - - [2048, 512, 1, 2048, 2048, 2048, 2048, 512]
    - [46, 101.12]
  - - [2048, 512, 1, 4096, 2048, 2048, 4096, 512]
    - [47, 113.23]
  - - [2048, 512, 1, 8192, 2048, 2048, 8192, 512]
    - [48, 117.3]
  - - [2048, 1024, 1, 128, 2048, 2048, 128, 1024]
    - [3, 32.31]
  - - [2048, 1024, 1, 256, 2048, 2048, 256, 1024]
    - [20, 54.31]
  - - [2048, 1024, 1, 512, 2048, 2048, 512, 1024]
    - [20, 83.25]
  - - [2048, 1024, 1, 1024, 2048, 2048, 1024, 1024]
    - [21, 114.83]
  - - [2048, 1024, 1, 2048, 2048, 2048, 2048, 1024]
    - [43, 135.48]
  - - [2048, 1024, 1, 4096, 2048, 2048, 4096, 1024]
    - [40, 144.69]
  - - [2048, 1024, 1, 8192, 2048, 2048, 8192, 1024]
    - [42, 160.36]
  - - [2048, 2048, 1, 128, 2048, 2048, 128, 2048]
    - [0, 39.78]
  - - [2048, 2048, 1, 256, 2048, 2048, 256, 2048]
    - [10, 66.57]
  - - [2048, 2048, 1, 512, 2048, 2048, 512, 2048]
    - [10, 99.94]
  - - [2048, 2048, 1, 1024, 2048, 2048, 1024, 2048]
    - [12, 131.92]
  - - [2048, 2048, 1, 2048, 2048, 2048, 2048, 2048]
    - [15, 155.07]
  - - [2048, 2048, 1, 4096, 2048, 2048, 4096, 2048]
    - [15, 174.25]
  - - [2048, 2048, 1, 8192, 2048, 2048, 8192, 2048]
    - [15, 188.98]
  - - [2048, 4096, 1, 128, 2048, 2048, 128, 4096]
    - [1, 42.57]
  - - [2048, 4096, 1, 256, 2048, 2048, 256, 4096]
    - [12, 70.15]
  - - [2048, 4096, 1, 512, 2048, 2048, 512, 4096]
    - [12, 104.15]
  - - [2048, 4096, 1, 1024, 2048, 2048, 1024, 4096]
    - [12, 137.05]
  - - [2048, 4096, 1, 2048, 2048, 2048, 2048, 4096]
    - [15, 159.14]
  - - [2048, 4096, 1, 4096, 2048, 2048, 4096, 4096]
    - [15, 176.47]
  - - [2048, 4096, 1, 8192, 2048, 2048, 8192, 4096]
    - [15, 190.64]
  - - [2048, 8192, 1, 128, 2048, 2048, 128, 8192]
    - [1, 44.83]
  - - [2048, 8192, 1, 256, 2048, 2048, 256, 8192]
    - [12, 73.12]
  - - [2048, 8192, 1, 512, 2048, 2048, 512, 8192]
    - [12, 107.36]
  - - [2048, 8192, 1, 1024, 2048, 2048, 1024, 8192]
    - [12, 139.86]
  - - [2048, 8192, 1, 2048, 2048, 2048, 2048, 8192]
    - [18, 161.57]
  - - [2048, 8192, 1, 4096, 2048, 2048, 4096, 8192]
    - [15, 178.02]
  - - [2048, 8192, 1, 8192, 2048, 2048, 8192, 8192]
    - [18, 191.44]
  - - [4096, 128, 1, 128, 4096, 4096, 128, 128]
    - [26, 14.47]
  - - [4096, 128, 1, 256, 4096, 4096, 256, 128]
    - [28, 24.58]
  - - [4096, 128, 1, 512, 4096, 4096, 512, 128]
    - [25, 39.14]
  - - [4096, 128, 1, 1024, 4096, 4096, 1024, 128]
    - [27, 54.47]
  - - [4096, 128, 1, 2048, 4096, 4096, 2048, 128]
    - [61, 71.66]
  - - [4096, 128, 1, 4096, 4096, 4096, 4096, 128]
    - [61, 77.15]
  - - [4096, 128, 1, 8192, 4096, 4096, 8192, 128]
    - [61, 89.05]
  - - [4096, 256, 1, 128, 4096, 4096, 128, 256]
    - [6, 22.38]
  - - [4096, 256, 1, 256, 4096, 4096, 256, 256]
    - [24, 37.45]
  - - [4096, 256, 1, 512, 4096, 4096, 512, 256]
    - [23, 57.33]
  - - [4096, 256, 1, 1024, 4096, 4096, 1024, 256]
    - [46, 80.43]
  - - [4096, 256, 1, 2048, 4096, 4096, 2048, 256]
    - [46, 100.72]
  - - [4096, 256, 1, 4096, 4096, 4096, 4096, 256]
    - [46, 104.91]
  - - [4096, 256, 1, 8192, 4096, 4096, 8192, 256]
    - [46, 115.86]
  - - [4096, 512, 1, 128, 4096, 4096, 128, 512]
    - [2, 32.37]
  - - [4096, 512, 1, 256, 4096, 4096, 256, 512]
    - [21, 54.02]
  - - [4096, 512, 1, 512, 4096, 4096, 512, 512]
    - [20, 83.11]
  - - [4096, 512, 1, 1024, 4096, 4096, 1024, 512]
    - [21, 114.76]
  - - [4096, 512, 1, 2048, 4096, 4096, 2048, 512]
    - [45, 135.17]
  - - [4096, 512, 1, 4096, 4096, 4096, 4096, 512]
    - [40, 144.63]
  - - [4096, 512, 1, 8192, 4096, 4096, 8192, 512]
    - [45, 160.37]
  - - [4096, 1024, 1, 128, 4096, 4096, 128, 1024]
    - [10, 39.68]
  - - [4096, 1024, 1, 256, 4096, 4096, 256, 1024]
    - [10, 66.29]
  - - [4096, 1024, 1, 512, 4096, 4096, 512, 1024]
    - [10, 99.37]
  - - [4096, 1024, 1, 1024, 4096, 4096, 1024, 1024]
    - [10, 132.18]
  - - [4096, 1024, 1, 2048, 4096, 4096, 2048, 1024]
    - [14, 158.93]
  - - [4096, 1024, 1, 4096, 4096, 4096, 4096, 1024]
    - [15, 173.75]
  - - [4096, 1024, 1, 8192, 4096, 4096, 8192, 1024]
    - [15, 189.0]
  - - [4096, 2048, 1, 128, 4096, 4096, 128, 2048]
    - [1, 42.58]
  - - [4096, 2048, 1, 256, 4096, 4096, 256, 2048]
    - [10, 70.11]
  - - [4096, 2048, 1, 512, 4096, 4096, 512, 2048]
    - [12, 104.0]
  - - [4096, 2048, 1, 1024, 4096, 4096, 1024, 2048]
    - [16, 136.54]
  - - [4096, 2048, 1, 2048, 4096, 4096, 2048, 2048]
    - [14, 161.16]
  - - [4096, 2048, 1, 4096, 4096, 4096, 4096, 2048]
    - [15, 177.11]
  - - [4096, 2048, 1, 8192, 4096, 4096, 8192, 2048]
    - [18, 190.61]
  - - [4096, 4096, 1, 128, 4096, 4096, 128, 4096]
    - [1, 45.04]
  - - [4096, 4096, 1, 256, 4096, 4096, 256, 4096]
    - [12, 73.21]
  - - [4096, 4096, 1, 512, 4096, 4096, 512, 4096]
    - [12, 107.57]
  - - [4096, 4096, 1, 1024, 4096, 4096, 1024, 4096]
    - [17, 138.42]
  - - [4096, 4096, 1, 2048, 4096, 4096, 2048, 4096]
    - [14, 163.49]
  - - [4096, 4096, 1, 4096, 4096, 4096, 4096, 4096]
    - [15, 178.53]
  - - [4096, 4096, 1, 8192, 4096, 4096, 8192, 4096]
    - [15, 191.46]
  - - [4096, 8192, 1, 128, 4096, 4096, 128, 8192]
    - [1, 46.34]
  - - [4096, 8192, 1, 256, 4096, 4096, 256, 8192]
    - [12, 75.02]
  - - [4096, 8192, 1, 512, 4096, 4096, 512, 8192]
    - [12, 109.42]
  - - [4096, 8192, 1, 1024, 4096, 4096, 1024, 8192]
    - [17, 140.22]
  - - [4096, 8192, 1, 2048, 4096, 4096, 2048, 8192]
    - [14, 165.0]
  - - [4096, 8192, 1, 4096, 4096, 4096, 4096, 8192]
    - [15, 178.83]
  - - [4096, 8192, 1, 8192, 4096, 4096, 8192, 8192]
    - [15, 191.94]
  - - [8192, 128, 1, 128, 8192, 8192, 128, 128]
    - [24, 22.3]
  - - [8192, 128, 1, 256, 8192, 8192, 256, 128]
    - [24, 37.86]
  - - [8192, 128, 1, 512, 8192, 8192, 512, 128]
    - [24, 57.49]
  - - [8192, 128, 1, 1024, 8192, 8192, 1024, 128]
    - [46, 80.39]
  - - [8192, 128, 1, 2048, 8192, 8192, 2048, 128]
    - [46, 89.87]
  - - [8192, 128, 1, 4096, 8192, 8192, 4096, 128]
    - [46, 101.35]
  - - [8192, 128, 1, 8192, 8192, 8192, 8192, 128]
    - [46, 113.03]
  - - [8192, 256, 1, 128, 8192, 8192, 128, 256]
    - [2, 32.37]
  - - [8192, 256, 1, 256, 8192, 8192, 256, 256]
    - [20, 54.39]
  - - [8192, 256, 1, 512, 8192, 8192, 512, 256]
    - [22, 83.41]
  - - [8192, 256, 1, 1024, 8192, 8192, 1024, 256]
    - [21, 114.54]
  - - [8192, 256, 1, 2048, 8192, 8192, 2048, 256]
    - [40, 125.69]
  - - [8192, 256, 1, 4096, 8192, 8192, 4096, 256]
    - [40, 144.53]
  - - [8192, 256, 1, 8192, 8192, 8192, 8192, 256]
    - [43, 159.3]
  - - [8192, 512, 1, 128, 8192, 8192, 128, 512]
    - [1, 39.68]
  - - [8192, 512, 1, 256, 8192, 8192, 256, 512]
    - [10, 66.32]
  - - [8192, 512, 1, 512, 8192, 8192, 512, 512]
    - [10, 99.78]
  - - [8192, 512, 1, 1024, 8192, 8192, 1024, 512]
    - [10, 131.52]
  - - [8192, 512, 1, 2048, 8192, 8192, 2048, 512]
    - [13, 155.5]
  - - [8192, 512, 1, 4096, 8192, 8192, 4096, 512]
    - [13, 172.7]
  - - [8192, 512, 1, 8192, 8192, 8192, 8192, 512]
    - [15, 188.66]
  - - [8192, 1024, 1, 128, 8192, 8192, 128, 1024]
    - [1, 42.69]
  - - [8192, 1024, 1, 256, 8192, 8192, 256, 1024]
    - [10, 69.98]
  - - [8192, 1024, 1, 512, 8192, 8192, 512, 1024]
    - [12, 103.99]
  - - [8192, 1024, 1, 1024, 8192, 8192, 1024, 1024]
    - [12, 135.65]
  - - [8192, 1024, 1, 2048, 8192, 8192, 2048, 1024]
    - [13, 159.06]
  - - [8192, 1024, 1, 4096, 8192, 8192, 4096, 1024]
    - [15, 176.48]
  - - [8192, 1024, 1, 8192, 8192, 8192, 8192, 1024]
    - [15, 190.61]
  - - [8192, 2048, 1, 128, 8192, 8192, 128, 2048]
    - [1, 45.06]
  - - [8192, 2048, 1, 256, 8192, 8192, 256, 2048]
    - [12, 73.09]
  - - [8192, 2048, 1, 512, 8192, 8192, 512, 2048]
    - [12, 107.42]
  - - [8192, 2048, 1, 1024, 8192, 8192, 1024, 2048]
    - [17, 139.64]
  - - [8192, 2048, 1, 2048, 8192, 8192, 2048, 2048]
    - [18, 161.32]
  - - [8192, 2048, 1, 4096, 8192, 8192, 4096, 2048]
    - [15, 177.96]
  - - [8192, 2048, 1, 8192, 8192, 8192, 8192, 2048]
    - [15, 191.35]
  - - [8192, 4096, 1, 128, 8192, 8192, 128, 4096]
    - [1, 46.36]
  - - [8192, 4096, 1, 256, 8192, 8192, 256, 4096]
    - [12, 74.92]
  - - [8192, 4096, 1, 512, 8192, 8192, 512, 4096]
    - [12, 109.44]
  - - [8192, 4096, 1, 1024, 8192, 8192, 1024, 4096]
    - [14, 139.26]
  - - [8192, 4096, 1, 2048, 8192, 8192, 2048, 4096]
    - [13, 162.79]
  - - [8192, 4096, 1, 4096, 8192, 8192, 4096, 4096]
    - [15, 178.75]
  - - [8192, 4096, 1, 8192, 8192, 8192, 8192, 4096]
    - [18, 191.47]
  - - [8192, 8192, 1, 128, 8192, 8192, 128, 8192]
    - [1, 46.78]
  - - [8192, 8192, 1, 256, 8192, 8192, 256, 8192]
    - [12, 75.61]
  - - [8192, 8192, 1, 512, 8192, 8192, 512, 8192]
    - [12, 110.22]
  - - [8192, 8192, 1, 1024, 8192, 8192, 1024, 8192]
    - [14, 140.42]
  - - [8192, 8192, 1, 2048, 8192, 8192, 2048, 8192]
    - [18, 162.99]
  - - [8192, 8192, 1, 4096, 8192, 8192, 4096, 8192]
    - [15, 179.01]
  - - [8192, 8192, 1, 8192, 8192, 8192, 8192, 8192]
    - [15, 191.69]
  - - [1, 1, 1, 32, 1, 1, 32, 1]
    - [74, 0.0]
- null
- null
- ExperimentalStreamK
- GridBased
