projects/hipblaslt/library/src/amd_detail/rocblaslt/src/Tensile/Logic/asm_full/aquavanjaram/gfx942_64cu/StreamK/aquavanjaram942_Cijk_Ailk_Bjlk_I8BH_UserArgs.yaml
- {MinimumRequiredVersion: 4.33.0}
- aquavanjaram942
- {Architecture: gfx942, CUCount: 64}
- [Device 0049, Device 0050]
    SolutionIndex: 0
    SolutionNameMin: Cijk_Ailk_Bjlk_I8BH_UserArgs_MT128x128x32_MI16x16x1_SN_CLR0_GSU0_GSUC0_GSUWGMRR0_K1_LBSPPA1024_LBSPPB1024_LPA64_LPB64_MIWT4_4_PLR0_SU0_SUM0_SUS32_SKXCCM8_VWA4_VWB4_WGM1_WGMXCC1_WGMXCCGn1
    SolutionIndex: 1
    SolutionNameMin: Cijk_Ailk_Bjlk_I8BH_UserArgs_MT128x128x32_MI16x16x1_SN_CLR0_GSU0_GSUC0_GSUWGMRR0_K1_LBSPPA1024_LBSPPB1024_LPA64_LPB64_MIWT4_4_PLR0_SU0_SUM0_SUS32_SKXCCM8_VWA4_VWB4_WGM1_WGMXCC1_WGMXCCGn1
    SolutionIndex: 2
    SolutionNameMin: Cijk_Ailk_Bjlk_I8BH_UserArgs_MT128x64x32_MI16x16x1_SN_CLR0_GSU0_GSUC0_GSUWGMRR0_K1_LBSPPA1024_LBSPPB512_LPA64_LPB32_MIWT4_2_PLR0_SU0_SUM0_SUS32_SKXCCM8_VWA4_VWB2_WGM1_WGMXCC1_WGMXCCGn1
    SolutionIndex: 3
    SolutionNameMin: Cijk_Ailk_Bjlk_I8BH_UserArgs_MT64x32x32_MI16x16x1_SN_CLR0_GSU0_GSUC0_GSUWGMRR0_K1_LBSPPA512_LBSPPB256_LPA32_LPB16_MIWT2_1_PLR0_SU0_SUM0_SUS32_SKXCCM8_VWA2_VWB1_WGM1_WGMXCC1_WGMXCCGn1
    SolutionIndex: 4
    SolutionNameMin: Cijk_Ailk_Bjlk_I8BH_UserArgs_MT32x32x32_MI16x16x1_SN_CLR0_GSU0_GSUC0_GSUWGMRR0_K1_LBSPPA256_LBSPPB256_LPA16_LPB16_MIWT1_1_PLR0_SU0_SUM0_SUS32_SKXCCM8_VWA1_VWB1_WGM1_WGMXCC1_WGMXCCGn1
    SolutionIndex: 5
    SolutionNameMin: Cijk_Ailk_Bjlk_I8BH_UserArgs_MT256x256x64_MI16x16x1_SN_CLR1_GSU0_GSUC0_GSUWGMRR0_K1_LBSPPA2048_LBSPPB2048_LPA0_LPB64_MIWT8_8_PLR1_SU0_SUM0_SUS64_SKXCCM8_VWA8_VWB4_WGM1_WGMXCC1_WGMXCCGn1
    SolutionIndex: 6
    SolutionNameMin: Cijk_Ailk_Bjlk_I8BH_UserArgs_MT256x256x64_MI16x16x1_SN_CLR1_GSU0_GSUC0_GSUWGMRR0_K1_LBSPPA2048_LBSPPB2048_LPA64_LPB0_MIWT8_8_PLR1_SU0_SUM0_SUS64_SKXCCM8_VWA4_VWB8_WGM1_WGMXCC1_WGMXCCGn1
    SolutionIndex: 7
    SolutionNameMin: Cijk_Ailk_Bjlk_I8BH_UserArgs_MT256x128x64_MI16x16x1_SN_CLR1_GSU0_GSUC0_GSUWGMRR0_K1_LBSPPA2048_LBSPPB1024_LPA0_LPB64_MIWT8_4_PLR1_SU0_SUM0_SUS64_SKXCCM8_VWA8_VWB4_WGM1_WGMXCC1_WGMXCCGn1
    SolutionIndex: 8
    SolutionNameMin: Cijk_Ailk_Bjlk_I8BH_UserArgs_MT256x128x64_MI16x16x1_SN_CLR1_GSU0_GSUC0_GSUWGMRR0_K1_LBSPPA2048_LBSPPB1024_LPA0_LPB64_MIWT8_4_PLR1_SU0_SUM0_SUS64_SKXCCM8_VWA8_VWB4_WGM1_WGMXCC1_WGMXCCGn1
    SolutionIndex: 9
    SolutionNameMin: Cijk_Ailk_Bjlk_I8BH_UserArgs_MT256x128x64_MI16x16x1_SN_CLR1_GSU0_GSUC0_GSUWGMRR0_K1_LBSPPA2048_LBSPPB1024_LPA0_LPB64_MIWT8_4_PLR1_SU0_SUM0_SUS64_SKXCCM8_VWA8_VWB4_WGM1_WGMXCC1_WGMXCCGn1
    SolutionIndex: 10
    SolutionNameMin: Cijk_Ailk_Bjlk_I8BH_UserArgs_MT128x128x64_MI16x16x1_SN_CLR1_GSU0_GSUC0_GSUWGMRR0_K1_LBSPPA1024_LBSPPB1024_LPA64_LPB32_MIWT4_4_PLR1_SU0_SUM0_SUS64_SKXCCM8_VWA4_VWB2_WGM1_WGMXCC1_WGMXCCGn1
    SolutionIndex: 11
    SolutionNameMin: Cijk_Ailk_Bjlk_I8BH_UserArgs_MT128x128x64_MI16x16x1_SN_CLR1_GSU0_GSUC0_GSUWGMRR0_K1_LBSPPA1024_LBSPPB1024_LPA64_LPB64_MIWT4_4_PLR1_SU0_SUM0_SUS64_SKXCCM8_VWA4_VWB4_WGM1_WGMXCC1_WGMXCCGn1
    SolutionIndex: 12
    SolutionNameMin: Cijk_Ailk_Bjlk_I8BH_UserArgs_MT64x128x64_MI16x16x1_SN_CLR1_GSU0_GSUC0_GSUWGMRR0_K1_LBSPPA512_LBSPPB1024_LPA32_LPB64_MIWT2_4_PLR1_SU0_SUM0_SUS64_SKXCCM8_VWA2_VWB4_WGM1_WGMXCC1_WGMXCCGn1
    SolutionIndex: 13
    SolutionNameMin: Cijk_Ailk_Bjlk_I8BH_UserArgs_MT128x64x64_MI16x16x1_SN_CLR1_GSU0_GSUC0_GSUWGMRR0_K1_LBSPPA1024_LBSPPB512_LPA64_LPB32_MIWT4_2_PLR1_SU0_SUM0_SUS64_SKXCCM8_VWA4_VWB2_WGM1_WGMXCC1_WGMXCCGn1
    SolutionIndex: 14
    SolutionNameMin: Cijk_Ailk_Bjlk_I8BH_UserArgs_MT128x64x64_MI16x16x1_SN_CLR1_GSU0_GSUC0_GSUWGMRR0_K1_LBSPPA1024_LBSPPB512_LPA64_LPB32_MIWT4_2_PLR1_SU0_SUM0_SUS64_SKXCCM8_VWA4_VWB2_WGM1_WGMXCC1_WGMXCCGn1
    SolutionIndex: 15
    SolutionNameMin: Cijk_Ailk_Bjlk_I8BH_UserArgs_MT128x32x64_MI16x16x1_SN_CLR1_GSU0_GSUC0_GSUWGMRR0_K1_LBSPPA1024_LBSPPB256_LPA64_LPB16_MIWT4_1_PLR1_SU0_SUM0_SUS64_SKXCCM8_VWA4_VWB1_WGM1_WGMXCC1_WGMXCCGn1
    SolutionIndex: 16
    SolutionNameMin: Cijk_Ailk_Bjlk_I8BH_UserArgs_MT64x64x64_MI16x16x1_SN_CLR1_GSU0_GSUC0_GSUWGMRR0_K1_LBSPPA512_LBSPPB512_LPA32_LPB32_MIWT2_2_PLR1_SU0_SUM0_SUS64_SKXCCM8_VWA2_VWB2_WGM1_WGMXCC1_WGMXCCGn1
    SolutionIndex: 17
    SolutionNameMin: Cijk_Ailk_Bjlk_I8BH_UserArgs_MT64x64x64_MI16x16x1_SN_CLR1_GSU0_GSUC0_GSUWGMRR0_K1_LBSPPA512_LBSPPB512_LPA32_LPB32_MIWT2_2_PLR1_SU0_SUM0_SUS64_SKXCCM8_VWA2_VWB2_WGM1_WGMXCC1_WGMXCCGn1
    SolutionIndex: 18
    SolutionNameMin: Cijk_Ailk_Bjlk_I8BH_UserArgs_MT64x64x64_MI16x16x1_SN_CLR1_GSU0_GSUC0_GSUWGMRR0_K1_LBSPPA512_LBSPPB512_LPA32_LPB32_MIWT2_2_PLR1_SU0_SUM0_SUS64_SKXCCM8_VWA2_VWB2_WGM1_WGMXCC1_WGMXCCGn1
    SolutionIndex: 19
    SolutionNameMin: Cijk_Ailk_Bjlk_I8BH_UserArgs_MT64x64x64_MI16x16x1_SN_CLR1_GSU0_GSUC0_GSUWGMRR0_K1_LBSPPA512_LBSPPB512_LPA32_LPB32_MIWT2_2_PLR1_SU0_SUM0_SUS64_SKXCCM8_VWA2_VWB2_WGM4_WGMXCC1_WGMXCCGn1
    SolutionIndex: 20
    SolutionNameMin: Cijk_Ailk_Bjlk_I8BH_UserArgs_MT64x32x64_MI16x16x1_SN_CLR1_GSU0_GSUC0_GSUWGMRR0_K1_LBSPPA512_LBSPPB256_LPA32_LPB16_MIWT2_1_PLR1_SU0_SUM0_SUS64_SKXCCM8_VWA2_VWB1_WGM1_WGMXCC1_WGMXCCGn1
    SolutionIndex: 21
    SolutionNameMin: Cijk_Ailk_Bjlk_I8BH_UserArgs_MT64x32x64_MI16x16x1_SN_CLR1_GSU0_GSUC0_GSUWGMRR0_K1_LBSPPA512_LBSPPB256_LPA32_LPB16_MIWT2_1_PLR1_SU0_SUM0_SUS64_SKXCCM8_VWA2_VWB1_WGM1_WGMXCC1_WGMXCCGn1
    SolutionIndex: 22
    SolutionNameMin: Cijk_Ailk_Bjlk_I8BH_UserArgs_MT64x32x64_MI16x16x1_SN_CLR1_GSU0_GSUC0_GSUWGMRR0_K1_LBSPPA512_LBSPPB256_LPA32_LPB16_MIWT2_1_PLR1_SU0_SUM0_SUS64_SKXCCM8_VWA2_VWB1_WGM1_WGMXCC1_WGMXCCGn1
    SolutionIndex: 23
    SolutionNameMin: Cijk_Ailk_Bjlk_I8BH_UserArgs_MT64x32x64_MI16x16x1_SN_CLR1_GSU0_GSUC0_GSUWGMRR0_K1_LBSPPA512_LBSPPB256_LPA32_LPB16_MIWT2_1_PLR1_SU0_SUM0_SUS64_SKXCCM8_VWA2_VWB1_WGM1_WGMXCC1_WGMXCCGn1
    SolutionIndex: 24
    SolutionNameMin: Cijk_Ailk_Bjlk_I8BH_UserArgs_MT32x32x64_MI16x16x1_SN_CLR1_GSU0_GSUC0_GSUWGMRR0_K1_LBSPPA256_LBSPPB256_LPA16_LPB16_MIWT1_1_PLR1_SU0_SUM0_SUS64_SKXCCM8_VWA1_VWB1_WGM1_WGMXCC1_WGMXCCGn1
    SolutionIndex: 25
    SolutionNameMin: Cijk_Ailk_Bjlk_I8BH_UserArgs_MT32x32x64_MI16x16x1_SN_CLR0_GSU0_GSUC0_GSUWGMRR0_K1_LBSPPA256_LBSPPB256_LPA16_LPB16_MIWT1_1_PLR0_SU0_SUM0_SUS64_SKXCCM8_VWA1_VWB1_WGM1_WGMXCC1_WGMXCCGn1
    SolutionIndex: 26
    SolutionNameMin: Cijk_Ailk_Bjlk_I8BH_UserArgs_MT128x128x128_MI16x16x1_SN_CLR1_GSU0_GSUC0_GSUWGMRR0_K1_LBSPPA1024_LBSPPB1024_LPA64_LPB64_MIWT4_4_PLR2_SU0_SUM0_SUS128_SKXCCM8_VWA4_VWB4_WGM1_WGMXCC1_WGMXCCGn1
    SolutionIndex: 27
    SolutionNameMin: Cijk_Ailk_Bjlk_I8BH_UserArgs_MT128x64x128_MI16x16x1_SN_CLR1_GSU0_GSUC0_GSUWGMRR0_K1_LBSPPA1024_LBSPPB512_LPA64_LPB32_MIWT4_2_PLR1_SU0_SUM0_SUS128_SKXCCM8_VWA4_VWB2_WGM1_WGMXCC1_WGMXCCGn1
    SolutionIndex: 28
    SolutionNameMin: Cijk_Ailk_Bjlk_I8BH_UserArgs_MT128x64x128_MI16x16x1_SN_CLR1_GSU0_GSUC0_GSUWGMRR0_K1_LBSPPA1024_LBSPPB512_LPA64_LPB32_MIWT4_2_PLR2_SU0_SUM0_SUS128_SKXCCM8_VWA4_VWB2_WGM1_WGMXCC1_WGMXCCGn1
    SolutionIndex: 29
    SolutionNameMin: Cijk_Ailk_Bjlk_I8BH_UserArgs_MT64x64x128_MI16x16x1_SN_CLR1_GSU0_GSUC0_GSUWGMRR0_K1_LBSPPA512_LBSPPB512_LPA32_LPB32_MIWT2_2_PLR1_SU0_SUM0_SUS128_SKXCCM8_VWA2_VWB2_WGM1_WGMXCC1_WGMXCCGn1
    SolutionIndex: 30
    SolutionNameMin: Cijk_Ailk_Bjlk_I8BH_UserArgs_MT64x64x128_MI16x16x1_SN_CLR1_GSU0_GSUC0_GSUWGMRR0_K1_LBSPPA512_LBSPPB512_LPA32_LPB32_MIWT2_2_PLR2_SU0_SUM0_SUS128_SKXCCM8_VWA2_VWB2_WGM1_WGMXCC1_WGMXCCGn1
    SolutionIndex: 31
    SolutionNameMin: Cijk_Ailk_Bjlk_I8BH_UserArgs_MT64x64x128_MI16x16x1_SN_CLR1_GSU0_GSUC0_GSUWGMRR0_K1_LBSPPA512_LBSPPB512_LPA32_LPB32_MIWT2_2_PLR1_SU0_SUM0_SUS128_SKXCCM8_VWA2_VWB2_WGM8_WGMXCC1_WGMXCCGn1
    SolutionIndex: 32
    SolutionNameMin: Cijk_Ailk_Bjlk_I8BH_UserArgs_MT32x64x128_MI16x16x1_SN_CLR1_GSU0_GSUC0_GSUWGMRR0_K1_LBSPPA256_LBSPPB512_LPA16_LPB32_MIWT1_2_PLR2_SU0_SUM0_SUS128_SKXCCM8_VWA1_VWB2_WGM1_WGMXCC1_WGMXCCGn1
    SolutionIndex: 33
    SolutionNameMin: Cijk_Ailk_Bjlk_I8BH_UserArgs_MT64x32x128_MI16x16x1_SN_CLR1_GSU0_GSUC0_GSUWGMRR0_K1_LBSPPA512_LBSPPB256_LPA32_LPB16_MIWT2_1_PLR1_SU0_SUM0_SUS128_SKXCCM8_VWA2_VWB1_WGM1_WGMXCC1_WGMXCCGn1
    SolutionIndex: 34
    SolutionNameMin: Cijk_Ailk_Bjlk_I8BH_UserArgs_MT64x32x128_MI16x16x1_SN_CLR1_GSU0_GSUC0_GSUWGMRR0_K1_LBSPPA512_LBSPPB256_LPA32_LPB16_MIWT2_1_PLR1_SU0_SUM0_SUS128_SKXCCM8_VWA2_VWB1_WGM1_WGMXCC1_WGMXCCGn1
    SolutionIndex: 35
    SolutionNameMin: Cijk_Ailk_Bjlk_I8BH_UserArgs_MT64x32x128_MI16x16x1_SN_CLR1_GSU0_GSUC0_GSUWGMRR0_K1_LBSPPA512_LBSPPB256_LPA32_LPB16_MIWT2_1_PLR2_SU0_SUM0_SUS128_SKXCCM8_VWA2_VWB1_WGM1_WGMXCC1_WGMXCCGn1
    SolutionIndex: 36
    SolutionNameMin: Cijk_Ailk_Bjlk_I8BH_UserArgs_MT64x32x128_MI16x16x1_SN_CLR1_GSU0_GSUC0_GSUWGMRR0_K1_LBSPPA512_LBSPPB256_LPA32_LPB16_MIWT2_1_PLR2_SU0_SUM0_SUS128_SKXCCM8_VWA2_VWB1_WGM1_WGMXCC1_WGMXCCGn1
    SolutionIndex: 37
    SolutionNameMin: Cijk_Ailk_Bjlk_I8BH_UserArgs_MT64x32x128_MI16x16x1_SN_CLR1_GSU0_GSUC0_GSUWGMRR0_K1_LBSPPA512_LBSPPB256_LPA32_LPB16_MIWT2_1_PLR1_SU0_SUM0_SUS128_SKXCCM8_VWA2_VWB1_WGM4_WGMXCC1_WGMXCCGn1
    SolutionIndex: 38
    SolutionNameMin: Cijk_Ailk_Bjlk_I8BH_UserArgs_MT64x32x128_MI16x16x1_SN_CLR1_GSU0_GSUC0_GSUWGMRR0_K1_LBSPPA512_LBSPPB256_LPA32_LPB16_MIWT2_1_PLR2_SU0_SUM0_SUS128_SKXCCM8_VWA2_VWB1_WGM8_WGMXCC1_WGMXCCGn1
    SolutionIndex: 39
    SolutionNameMin: Cijk_Ailk_Bjlk_I8BH_UserArgs_MT32x32x128_MI16x16x1_SN_CLR1_GSU0_GSUC0_GSUWGMRR0_K1_LBSPPA256_LBSPPB256_LPA16_LPB16_MIWT1_1_PLR1_SU0_SUM0_SUS128_SKXCCM8_VWA1_VWB1_WGM1_WGMXCC1_WGMXCCGn1
    SolutionIndex: 40
    SolutionNameMin: Cijk_Ailk_Bjlk_I8BH_UserArgs_MT32x32x128_MI16x16x1_SN_CLR1_GSU0_GSUC0_GSUWGMRR0_K1_LBSPPA256_LBSPPB256_LPA16_LPB16_MIWT1_1_PLR1_SU0_SUM0_SUS128_SKXCCM8_VWA1_VWB1_WGM1_WGMXCC1_WGMXCCGn1
    SolutionIndex: 41
    SolutionNameMin: Cijk_Ailk_Bjlk_I8BH_UserArgs_MT32x32x128_MI16x16x1_SN_CLR1_GSU0_GSUC0_GSUWGMRR0_K1_LBSPPA256_LBSPPB256_LPA16_LPB16_MIWT1_1_PLR2_SU0_SUM0_SUS128_SKXCCM8_VWA1_VWB1_WGM1_WGMXCC1_WGMXCCGn1
    SolutionIndex: 42
    SolutionNameMin: Cijk_Ailk_Bjlk_I8BH_UserArgs_MT32x32x128_MI16x16x1_SN_CLR1_GSU0_GSUC0_GSUWGMRR0_K1_LBSPPA256_LBSPPB256_LPA16_LPB16_MIWT1_1_PLR2_SU0_SUM0_SUS128_SKXCCM8_VWA1_VWB1_WGM1_WGMXCC1_WGMXCCGn1
    SolutionIndex: 43
    SolutionNameMin: Cijk_Ailk_Bjlk_I8BH_UserArgs_MT32x32x128_MI16x16x1_SN_CLR1_GSU0_GSUC0_GSUWGMRR0_K1_LBSPPA256_LBSPPB256_LPA16_LPB16_MIWT1_1_PLR1_SU0_SUM0_SUS128_SKXCCM8_VWA1_VWB1_WGM4_WGMXCC1_WGMXCCGn1
    SolutionIndex: 44
    SolutionNameMin: Cijk_Ailk_Bjlk_I8BH_UserArgs_MT32x32x128_MI16x16x1_SN_CLR1_GSU0_GSUC0_GSUWGMRR0_K1_LBSPPA256_LBSPPB256_LPA16_LPB16_MIWT1_1_PLR1_SU0_SUM0_SUS128_SKXCCM8_VWA1_VWB1_WGM8_WGMXCC1_WGMXCCGn1
    SolutionIndex: 45
    SolutionNameMin: Cijk_Ailk_Bjlk_I8BH_UserArgs_MT128x64x256_MI16x16x1_SN_CLR1_GSU0_GSUC0_GSUWGMRR0_K1_LBSPPA1024_LBSPPB512_LPA64_LPB32_MIWT4_2_PLR2_SU0_SUM0_SUS256_SKXCCM8_VWA4_VWB2_WGM1_WGMXCC1_WGMXCCGn1
    SolutionIndex: 46
    SolutionNameMin: Cijk_Ailk_Bjlk_I8BH_UserArgs_MT64x64x256_MI16x16x1_SN_CLR1_GSU0_GSUC0_GSUWGMRR0_K1_LBSPPA512_LBSPPB512_LPA32_LPB32_MIWT2_2_PLR2_SU0_SUM0_SUS256_SKXCCM8_VWA2_VWB2_WGM1_WGMXCC1_WGMXCCGn1
    SolutionIndex: 47
    SolutionNameMin: Cijk_Ailk_Bjlk_I8BH_UserArgs_MT64x32x256_MI16x16x1_SN_CLR1_GSU0_GSUC0_GSUWGMRR0_K1_LBSPPA512_LBSPPB256_LPA32_LPB16_MIWT2_1_PLR2_SU0_SUM0_SUS256_SKXCCM8_VWA2_VWB1_WGM1_WGMXCC1_WGMXCCGn1
    SolutionIndex: 48
    SolutionNameMin: Cijk_Ailk_Bjlk_I8BH_UserArgs_MT64x32x256_MI16x16x1_SN_CLR1_GSU0_GSUC0_GSUWGMRR0_K1_LBSPPA512_LBSPPB256_LPA32_LPB16_MIWT2_1_PLR2_SU0_SUM0_SUS256_SKXCCM8_VWA2_VWB1_WGM4_WGMXCC1_WGMXCCGn1
    SolutionIndex: 49
    SolutionNameMin: Cijk_Ailk_Bjlk_I8BH_UserArgs_MT32x32x32_MI16x16x1_SN_CLR0_GSU0_GSUC0_GSUWGMRR0_K1_LBSPPA256_LBSPPB256_LPA16_LPB16_MIWT1_1_PLR0_SU32_SUM0_SUS256_SKXCCM0_VWA1_VWB1_WGM4_WGMXCC1_WGMXCCGn1
- - - [128, 128, 1, 128, 128, 128, 128, 128]
    - [39, 0.58]
  - - [128, 128, 1, 256, 128, 128, 128, 128]
    - [40, 1.0]
  - - [128, 128, 1, 512, 128, 128, 128, 128]
    - [40, 1.62]
  - - [128, 128, 1, 1024, 128, 128, 128, 128]
    - [40, 2.35]
  - - [128, 128, 1, 2048, 128, 128, 128, 128]
    - [40, 3.04]
  - - [128, 128, 1, 4096, 128, 128, 128, 128]
    - [40, 3.54]
  - - [128, 128, 1, 8192, 128, 128, 128, 128]
    - [40, 3.88]
  - - [128, 256, 1, 128, 128, 128, 128, 256]
    - [25, 1.14]
  - - [128, 256, 1, 256, 128, 128, 128, 256]
    - [24, 1.99]
  - - [128, 256, 1, 512, 128, 128, 128, 256]
    - [40, 3.23]
  - - [128, 256, 1, 1024, 128, 128, 128, 256]
    - [40, 4.68]
  - - [128, 256, 1, 2048, 128, 128, 128, 256]
    - [40, 6.05]
  - - [128, 256, 1, 4096, 128, 128, 128, 256]
    - [40, 7.07]
  - - [128, 256, 1, 8192, 128, 128, 128, 256]
    - [4, 7.78]
  - - [128, 512, 1, 128, 128, 128, 128, 512]
    - [24, 2.29]
  - - [128, 512, 1, 256, 128, 128, 128, 512]
    - [24, 3.92]
  - - [128, 512, 1, 512, 128, 128, 128, 512]
    - [42, 6.29]
  - - [128, 512, 1, 1024, 128, 128, 128, 512]
    - [41, 9.18]
  - - [128, 512, 1, 2048, 128, 128, 128, 512]
    - [42, 11.71]
  - - [128, 512, 1, 4096, 128, 128, 128, 512]
    - [42, 13.97]
  - - [128, 512, 1, 8192, 128, 128, 128, 512]
    - [40, 15.31]
  - - [128, 1024, 1, 128, 128, 128, 128, 1024]
    - [20, 4.22]
  - - [128, 1024, 1, 256, 128, 128, 128, 1024]
    - [21, 7.23]
  - - [128, 1024, 1, 512, 128, 128, 128, 1024]
    - [33, 11.41]
  - - [128, 1024, 1, 1024, 128, 128, 128, 1024]
    - [32, 16.24]
  - - [128, 1024, 1, 2048, 128, 128, 128, 1024]
    - [32, 20.69]
  - - [128, 1024, 1, 4096, 128, 128, 128, 1024]
    - [32, 23.76]
  - - [128, 1024, 1, 8192, 128, 128, 128, 1024]
    - [47, 25.73]
  - - [128, 2048, 1, 128, 128, 128, 128, 2048]
    - [15, 7.7]
  - - [128, 2048, 1, 256, 128, 128, 128, 2048]
    - [16, 13.07]
  - - [128, 2048, 1, 512, 128, 128, 128, 2048]
    - [30, 20.25]
  - - [128, 2048, 1, 1024, 128, 128, 128, 2048]
    - [29, 28.44]
  - - [128, 2048, 1, 2048, 128, 128, 128, 2048]
    - [29, 34.84]
  - - [128, 2048, 1, 4096, 128, 128, 128, 2048]
    - [29, 40.05]
  - - [128, 2048, 1, 8192, 128, 128, 128, 2048]
    - [29, 43.64]
  - - [128, 4096, 1, 128, 128, 128, 128, 4096]
    - [14, 13.31]
  - - [128, 4096, 1, 256, 128, 128, 128, 4096]
    - [13, 22.14]
  - - [128, 4096, 1, 512, 128, 128, 128, 4096]
    - [28, 33.73]
  - - [128, 4096, 1, 1024, 128, 128, 128, 4096]
    - [28, 44.9]
  - - [128, 4096, 1, 2048, 128, 128, 128, 4096]
    - [28, 55.97]
  - - [128, 4096, 1, 4096, 128, 128, 128, 4096]
    - [28, 63.87]
  - - [128, 4096, 1, 8192, 128, 128, 128, 4096]
    - [28, 68.72]
  - - [128, 8192, 1, 128, 128, 128, 128, 8192]
    - [10, 20.54]
  - - [128, 8192, 1, 256, 128, 128, 128, 8192]
    - [11, 34.22]
  - - [128, 8192, 1, 512, 128, 128, 128, 8192]
    - [11, 51.37]
  - - [128, 8192, 1, 1024, 128, 128, 128, 8192]
    - [11, 67.61]
  - - [128, 8192, 1, 2048, 128, 128, 128, 8192]
    - [11, 81.2]
  - - [128, 8192, 1, 4096, 128, 128, 128, 8192]
    - [11, 90.18]
  - - [128, 8192, 1, 8192, 128, 128, 128, 8192]
    - [11, 94.53]
  - - [256, 128, 1, 128, 256, 256, 256, 128]
    - [24, 1.15]
  - - [256, 128, 1, 256, 256, 256, 256, 128]
    - [39, 1.97]
  - - [256, 128, 1, 512, 256, 256, 256, 128]
    - [40, 3.22]
  - - [256, 128, 1, 1024, 256, 256, 256, 128]
    - [40, 4.67]
  - - [256, 128, 1, 2048, 256, 256, 256, 128]
    - [40, 5.99]
  - - [256, 128, 1, 4096, 256, 256, 256, 128]
    - [40, 7.0]
  - - [256, 128, 1, 8192, 256, 256, 256, 128]
    - [4, 7.8]
  - - [256, 256, 1, 128, 256, 256, 256, 256]
    - [24, 2.29]
  - - [256, 256, 1, 256, 256, 256, 256, 256]
    - [24, 3.92]
  - - [256, 256, 1, 512, 256, 256, 256, 256]
    - [40, 6.38]
  - - [256, 256, 1, 1024, 256, 256, 256, 256]
    - [40, 9.31]
  - - [256, 256, 1, 2048, 256, 256, 256, 256]
    - [40, 11.97]
  - - [256, 256, 1, 4096, 256, 256, 256, 256]
    - [40, 14.05]
  - - [256, 256, 1, 8192, 256, 256, 256, 256]
    - [43, 15.29]
  - - [256, 512, 1, 128, 256, 256, 256, 512]
    - [23, 4.22]
  - - [256, 512, 1, 256, 256, 256, 256, 512]
    - [21, 7.23]
  - - [256, 512, 1, 512, 256, 256, 256, 512]
    - [35, 11.43]
  - - [256, 512, 1, 1024, 256, 256, 256, 512]
    - [32, 16.26]
  - - [256, 512, 1, 2048, 256, 256, 256, 512]
    - [36, 20.61]
  - - [256, 512, 1, 4096, 256, 256, 256, 512]
    - [32, 23.85]
  - - [256, 512, 1, 8192, 256, 256, 256, 512]
    - [48, 25.78]
  - - [256, 1024, 1, 128, 256, 256, 256, 1024]
    - [16, 7.75]
  - - [256, 1024, 1, 256, 256, 256, 256, 1024]
    - [16, 13.06]
  - - [256, 1024, 1, 512, 256, 256, 256, 1024]
    - [30, 20.31]
  - - [256, 1024, 1, 1024, 256, 256, 256, 1024]
    - [29, 28.52]
  - - [256, 1024, 1, 2048, 256, 256, 256, 1024]
    - [29, 35.7]
  - - [256, 1024, 1, 4096, 256, 256, 256, 1024]
    - [46, 41.35]
  - - [256, 1024, 1, 8192, 256, 256, 256, 1024]
    - [29, 43.83]
  - - [256, 2048, 1, 128, 256, 256, 256, 2048]
    - [14, 13.31]
  - - [256, 2048, 1, 256, 256, 256, 256, 2048]
    - [14, 22.22]
  - - [256, 2048, 1, 512, 256, 256, 256, 2048]
    - [14, 33.62]
  - - [256, 2048, 1, 1024, 256, 256, 256, 2048]
    - [28, 46.42]
  - - [256, 2048, 1, 2048, 256, 256, 256, 2048]
    - [28, 56.28]
  - - [256, 2048, 1, 4096, 256, 256, 256, 2048]
    - [28, 64.1]
  - - [256, 2048, 1, 8192, 256, 256, 256, 2048]
    - [28, 69.04]
  - - [256, 4096, 1, 128, 256, 256, 256, 4096]
    - [1, 20.73]
  - - [256, 4096, 1, 256, 256, 256, 256, 4096]
    - [11, 34.19]
  - - [256, 4096, 1, 512, 256, 256, 256, 4096]
    - [11, 51.69]
  - - [256, 4096, 1, 1024, 256, 256, 256, 4096]
    - [11, 68.03]
  - - [256, 4096, 1, 2048, 256, 256, 256, 4096]
    - [26, 81.53]
  - - [256, 4096, 1, 4096, 256, 256, 256, 4096]
    - [26, 91.67]
  - - [256, 4096, 1, 8192, 256, 256, 256, 4096]
    - [26, 97.51]
  - - [256, 8192, 1, 128, 256, 256, 256, 8192]
    - [8, 30.35]
  - - [256, 8192, 1, 256, 256, 256, 256, 8192]
    - [8, 49.23]
  - - [256, 8192, 1, 512, 256, 256, 256, 8192]
    - [8, 74.14]
  - - [256, 8192, 1, 1024, 256, 256, 256, 8192]
    - [9, 97.62]
  - - [256, 8192, 1, 2048, 256, 256, 256, 8192]
    - [9, 117.27]
  - - [256, 8192, 1, 4096, 256, 256, 256, 8192]
    - [9, 130.3]
  - - [256, 8192, 1, 8192, 256, 256, 256, 8192]
    - [9, 137.74]
  - - [512, 128, 1, 128, 512, 512, 512, 128]
    - [24, 2.25]
  - - [512, 128, 1, 256, 512, 512, 512, 128]
    - [24, 3.91]
  - - [512, 128, 1, 512, 512, 512, 512, 128]
    - [42, 6.3]
  - - [512, 128, 1, 1024, 512, 512, 512, 128]
    - [42, 9.2]
  - - [512, 128, 1, 2048, 512, 512, 512, 128]
    - [42, 11.92]
  - - [512, 128, 1, 4096, 512, 512, 512, 128]
    - [42, 13.92]
  - - [512, 128, 1, 8192, 512, 512, 512, 128]
    - [44, 15.23]
  - - [512, 256, 1, 128, 512, 512, 512, 256]
    - [3, 4.16]
  - - [512, 256, 1, 256, 512, 512, 512, 256]
    - [22, 7.11]
  - - [512, 256, 1, 512, 512, 512, 512, 256]
    - [34, 11.42]
  - - [512, 256, 1, 1024, 512, 512, 512, 256]
    - [36, 16.06]
  - - [512, 256, 1, 2048, 512, 512, 512, 256]
    - [36, 20.24]
  - - [512, 256, 1, 4096, 512, 512, 512, 256]
    - [34, 23.66]
  - - [512, 256, 1, 8192, 512, 512, 512, 256]
    - [37, 25.5]
  - - [512, 512, 1, 128, 512, 512, 512, 512]
    - [17, 7.65]
  - - [512, 512, 1, 256, 512, 512, 512, 512]
    - [16, 12.79]
  - - [512, 512, 1, 512, 512, 512, 512, 512]
    - [30, 20.2]
  - - [512, 512, 1, 1024, 512, 512, 512, 512]
    - [29, 28.44]
  - - [512, 512, 1, 2048, 512, 512, 512, 512]
    - [29, 35.5]
  - - [512, 512, 1, 4096, 512, 512, 512, 512]
    - [29, 40.76]
  - - [512, 512, 1, 8192, 512, 512, 512, 512]
    - [19, 40.12]
  - - [512, 1024, 1, 128, 512, 512, 512, 1024]
    - [14, 13.25]
  - - [512, 1024, 1, 256, 512, 512, 512, 1024]
    - [14, 22.16]
  - - [512, 1024, 1, 512, 512, 512, 512, 1024]
    - [27, 33.5]
  - - [512, 1024, 1, 1024, 512, 512, 512, 1024]
    - [28, 46.45]
  - - [512, 1024, 1, 2048, 512, 512, 512, 1024]
    - [45, 57.53]
  - - [512, 1024, 1, 4096, 512, 512, 512, 1024]
    - [28, 62.78]
  - - [512, 1024, 1, 8192, 512, 512, 512, 1024]
    - [12, 66.15]
  - - [512, 2048, 1, 128, 512, 512, 512, 2048]
    - [0, 20.89]
  - - [512, 2048, 1, 256, 512, 512, 512, 2048]
    - [11, 34.6]
  - - [512, 2048, 1, 512, 512, 512, 512, 2048]
    - [11, 51.43]
  - - [512, 2048, 1, 1024, 512, 512, 512, 2048]
    - [11, 68.52]
  - - [512, 2048, 1, 2048, 512, 512, 512, 2048]
    - [11, 81.41]
  - - [512, 2048, 1, 4096, 512, 512, 512, 2048]
    - [11, 90.35]
  - - [512, 2048, 1, 8192, 512, 512, 512, 2048]
    - [11, 95.63]
  - - [512, 4096, 1, 128, 512, 512, 512, 4096]
    - [8, 30.17]
  - - [512, 4096, 1, 256, 512, 512, 512, 4096]
    - [8, 50.09]
  - - [512, 4096, 1, 512, 512, 512, 512, 4096]
    - [7, 73.76]
  - - [512, 4096, 1, 1024, 512, 512, 512, 4096]
    - [9, 97.8]
  - - [512, 4096, 1, 2048, 512, 512, 512, 4096]
    - [9, 117.27]
  - - [512, 4096, 1, 4096, 512, 512, 512, 4096]
    - [9, 130.19]
  - - [512, 4096, 1, 8192, 512, 512, 512, 4096]
    - [9, 137.85]
  - - [512, 8192, 1, 128, 512, 512, 512, 8192]
    - [6, 38.64]
  - - [512, 8192, 1, 256, 512, 512, 512, 8192]
    - [6, 63.33]
  - - [512, 8192, 1, 512, 512, 512, 512, 8192]
    - [6, 93.11]
  - - [512, 8192, 1, 1024, 512, 512, 512, 8192]
    - [6, 121.92]
  - - [512, 8192, 1, 2048, 512, 512, 512, 8192]
    - [6, 144.64]
  - - [512, 8192, 1, 4096, 512, 512, 512, 8192]
    - [6, 159.91]
  - - [512, 8192, 1, 8192, 512, 512, 512, 8192]
    - [6, 168.59]
  - - [1024, 128, 1, 128, 1024, 1024, 1024, 128]
    - [21, 4.23]
  - - [1024, 128, 1, 256, 1024, 1024, 1024, 128]
    - [21, 7.19]
  - - [1024, 128, 1, 512, 1024, 1024, 1024, 128]
    - [33, 11.43]
  - - [1024, 128, 1, 1024, 1024, 1024, 1024, 128]
    - [36, 16.2]
  - - [1024, 128, 1, 2048, 1024, 1024, 1024, 128]
    - [34, 20.56]
  - - [1024, 128, 1, 4096, 1024, 1024, 1024, 128]
    - [38, 23.58]
  - - [1024, 128, 1, 8192, 1024, 1024, 1024, 128]
    - [34, 25.4]
  - - [1024, 256, 1, 128, 1024, 1024, 1024, 256]
    - [15, 7.69]
  - - [1024, 256, 1, 256, 1024, 1024, 1024, 256]
    - [18, 12.92]
  - - [1024, 256, 1, 512, 1024, 1024, 1024, 256]
    - [29, 20.2]
  - - [1024, 256, 1, 1024, 1024, 1024, 1024, 256]
    - [29, 28.36]
  - - [1024, 256, 1, 2048, 1024, 1024, 1024, 256]
    - [29, 35.55]
  - - [1024, 256, 1, 4096, 1024, 1024, 1024, 256]
    - [31, 40.52]
  - - [1024, 256, 1, 8192, 1024, 1024, 1024, 256]
    - [18, 39.52]
  - - [1024, 512, 1, 128, 1024, 1024, 1024, 512]
    - [14, 13.26]
  - - [1024, 512, 1, 256, 1024, 1024, 1024, 512]
    - [14, 22.2]
  - - [1024, 512, 1, 512, 1024, 1024, 1024, 512]
    - [28, 33.75]
  - - [1024, 512, 1, 1024, 1024, 1024, 1024, 512]
    - [28, 46.33]
  - - [1024, 512, 1, 2048, 1024, 1024, 1024, 512]
    - [45, 57.31]
  - - [1024, 512, 1, 4096, 1024, 1024, 1024, 512]
    - [12, 61.86]
  - - [1024, 512, 1, 8192, 1024, 1024, 1024, 512]
    - [12, 66.16]
  - - [1024, 1024, 1, 128, 1024, 1024, 1024, 1024]
    - [10, 20.91]
  - - [1024, 1024, 1, 256, 1024, 1024, 1024, 1024]
    - [11, 34.65]
  - - [1024, 1024, 1, 512, 1024, 1024, 1024, 1024]
    - [11, 51.46]
  - - [1024, 1024, 1, 1024, 1024, 1024, 1024, 1024]
    - [11, 68.39]
  - - [1024, 1024, 1, 2048, 1024, 1024, 1024, 1024]
    - [26, 82.04]
  - - [1024, 1024, 1, 4096, 1024, 1024, 1024, 1024]
    - [11, 90.29]
  - - [1024, 1024, 1, 8192, 1024, 1024, 1024, 1024]
    - [11, 95.65]
  - - [1024, 2048, 1, 128, 1024, 1024, 1024, 2048]
    - [8, 30.4]
  - - [1024, 2048, 1, 256, 1024, 1024, 1024, 2048]
    - [8, 49.73]
  - - [1024, 2048, 1, 512, 1024, 1024, 1024, 2048]
    - [8, 74.04]
  - - [1024, 2048, 1, 1024, 1024, 1024, 1024, 2048]
    - [9, 97.28]
  - - [1024, 2048, 1, 2048, 1024, 1024, 1024, 2048]
    - [9, 117.02]
  - - [1024, 2048, 1, 4096, 1024, 1024, 1024, 2048]
    - [9, 130.11]
  - - [1024, 2048, 1, 8192, 1024, 1024, 1024, 2048]
    - [9, 137.57]
  - - [1024, 4096, 1, 128, 1024, 1024, 1024, 4096]
    - [6, 38.53]
  - - [1024, 4096, 1, 256, 1024, 1024, 1024, 4096]
    - [6, 63.36]
  - - [1024, 4096, 1, 512, 1024, 1024, 1024, 4096]
    - [6, 93.0]
  - - [1024, 4096, 1, 1024, 1024, 1024, 1024, 4096]
    - [6, 122.11]
  - - [1024, 4096, 1, 2048, 1024, 1024, 1024, 4096]
    - [6, 144.73]
  - - [1024, 4096, 1, 4096, 1024, 1024, 1024, 4096]
    - [6, 159.7]
  - - [1024, 4096, 1, 8192, 1024, 1024, 1024, 4096]
    - [6, 168.63]
  - - [1024, 8192, 1, 128, 1024, 1024, 1024, 8192]
    - [6, 41.25]
  - - [1024, 8192, 1, 256, 1024, 1024, 1024, 8192]
    - [6, 66.92]
  - - [1024, 8192, 1, 512, 1024, 1024, 1024, 8192]
    - [6, 97.32]
  - - [1024, 8192, 1, 1024, 1024, 1024, 1024, 8192]
    - [6, 125.65]
  - - [1024, 8192, 1, 2048, 1024, 1024, 1024, 8192]
    - [6, 147.54]
  - - [1024, 8192, 1, 4096, 1024, 1024, 1024, 8192]
    - [6, 161.56]
  - - [1024, 8192, 1, 8192, 1024, 1024, 1024, 8192]
    - [6, 169.57]
  - - [2048, 128, 1, 128, 2048, 2048, 2048, 128]
    - [16, 7.69]
  - - [2048, 128, 1, 256, 2048, 2048, 2048, 128]
    - [16, 12.84]
  - - [2048, 128, 1, 512, 2048, 2048, 2048, 128]
    - [30, 20.21]
  - - [2048, 128, 1, 1024, 2048, 2048, 2048, 128]
    - [29, 28.41]
  - - [2048, 128, 1, 2048, 2048, 2048, 2048, 128]
    - [16, 31.54]
  - - [2048, 128, 1, 4096, 2048, 2048, 2048, 128]
    - [16, 35.4]
  - - [2048, 128, 1, 8192, 2048, 2048, 2048, 128]
    - [2, 39.2]
  - - [2048, 256, 1, 128, 2048, 2048, 2048, 256]
    - [14, 13.23]
  - - [2048, 256, 1, 256, 2048, 2048, 2048, 256]
    - [14, 22.07]
  - - [2048, 256, 1, 512, 2048, 2048, 2048, 256]
    - [28, 33.54]
  - - [2048, 256, 1, 1024, 2048, 2048, 2048, 256]
    - [28, 46.22]
  - - [2048, 256, 1, 2048, 2048, 2048, 2048, 256]
    - [12, 54.81]
  - - [2048, 256, 1, 4096, 2048, 2048, 2048, 256]
    - [12, 61.88]
  - - [2048, 256, 1, 8192, 2048, 2048, 2048, 256]
    - [12, 66.19]
  - - [2048, 512, 1, 128, 2048, 2048, 2048, 512]
    - [0, 20.84]
  - - [2048, 512, 1, 256, 2048, 2048, 2048, 512]
    - [10, 34.36]
  - - [2048, 512, 1, 512, 2048, 2048, 2048, 512]
    - [11, 51.6]
  - - [2048, 512, 1, 1024, 2048, 2048, 2048, 512]
    - [11, 67.28]
  - - [2048, 512, 1, 2048, 2048, 2048, 2048, 512]
    - [11, 81.52]
  - - [2048, 512, 1, 4096, 2048, 2048, 2048, 512]
    - [11, 90.43]
  - - [2048, 512, 1, 8192, 2048, 2048, 2048, 512]
    - [11, 95.66]
  - - [2048, 1024, 1, 128, 2048, 2048, 2048, 1024]
    - [8, 30.34]
  - - [2048, 1024, 1, 256, 2048, 2048, 2048, 1024]
    - [8, 50.17]
  - - [2048, 1024, 1, 512, 2048, 2048, 2048, 1024]
    - [8, 74.03]
  - - [2048, 1024, 1, 1024, 2048, 2048, 2048, 1024]
    - [9, 97.74]
  - - [2048, 1024, 1, 2048, 2048, 2048, 2048, 1024]
    - [9, 117.03]
  - - [2048, 1024, 1, 4096, 2048, 2048, 2048, 1024]
    - [9, 130.17]
  - - [2048, 1024, 1, 8192, 2048, 2048, 2048, 1024]
    - [9, 137.75]
  - - [2048, 2048, 1, 128, 2048, 2048, 2048, 2048]
    - [6, 38.7]
  - - [2048, 2048, 1, 256, 2048, 2048, 2048, 2048]
    - [6, 63.31]
  - - [2048, 2048, 1, 512, 2048, 2048, 2048, 2048]
    - [6, 92.95]
  - - [2048, 2048, 1, 1024, 2048, 2048, 2048, 2048]
    - [6, 121.21]
  - - [2048, 2048, 1, 2048, 2048, 2048, 2048, 2048]
    - [6, 143.89]
  - - [2048, 2048, 1, 4096, 2048, 2048, 2048, 2048]
    - [6, 159.25]
  - - [2048, 2048, 1, 8192, 2048, 2048, 2048, 2048]
    - [6, 168.21]
  - - [2048, 4096, 1, 128, 2048, 2048, 2048, 4096]
    - [6, 41.11]
  - - [2048, 4096, 1, 256, 2048, 2048, 2048, 4096]
    - [5, 66.47]
  - - [2048, 4096, 1, 512, 2048, 2048, 2048, 4096]
    - [5, 96.96]
  - - [2048, 4096, 1, 1024, 2048, 2048, 2048, 4096]
    - [6, 125.36]
  - - [2048, 4096, 1, 2048, 2048, 2048, 2048, 4096]
    - [6, 146.94]
  - - [2048, 4096, 1, 4096, 2048, 2048, 2048, 4096]
    - [6, 161.35]
  - - [2048, 4096, 1, 8192, 2048, 2048, 2048, 4096]
    - [6, 169.67]
  - - [2048, 8192, 1, 128, 2048, 2048, 2048, 8192]
    - [5, 43.03]
  - - [2048, 8192, 1, 256, 2048, 2048, 2048, 8192]
    - [5, 69.14]
  - - [2048, 8192, 1, 512, 2048, 2048, 2048, 8192]
    - [5, 99.57]
  - - [2048, 8192, 1, 1024, 2048, 2048, 2048, 8192]
    - [6, 127.87]
  - - [2048, 8192, 1, 2048, 2048, 2048, 2048, 8192]
    - [6, 148.93]
  - - [2048, 8192, 1, 4096, 2048, 2048, 2048, 8192]
    - [6, 162.49]
  - - [2048, 8192, 1, 8192, 2048, 2048, 2048, 8192]
    - [6, 170.29]
  - - [4096, 128, 1, 128, 4096, 4096, 4096, 128]
    - [14, 13.38]
  - - [4096, 128, 1, 256, 4096, 4096, 4096, 128]
    - [14, 22.36]
  - - [4096, 128, 1, 512, 4096, 4096, 4096, 128]
    - [28, 33.81]
  - - [4096, 128, 1, 1024, 4096, 4096, 4096, 128]
    - [28, 46.4]
  - - [4096, 128, 1, 2048, 4096, 4096, 4096, 128]
    - [12, 53.58]
  - - [4096, 128, 1, 4096, 4096, 4096, 4096, 128]
    - [12, 61.07]
  - - [4096, 128, 1, 8192, 4096, 4096, 4096, 128]
    - [12, 65.28]
  - - [4096, 256, 1, 128, 4096, 4096, 4096, 256]
    - [0, 20.87]
  - - [4096, 256, 1, 256, 4096, 4096, 4096, 256]
    - [10, 34.61]
  - - [4096, 256, 1, 512, 4096, 4096, 4096, 256]
    - [11, 51.74]
  - - [4096, 256, 1, 1024, 4096, 4096, 4096, 256]
    - [11, 68.48]
  - - [4096, 256, 1, 2048, 4096, 4096, 4096, 256]
    - [11, 81.19]
  - - [4096, 256, 1, 4096, 4096, 4096, 4096, 256]
    - [11, 90.26]
  - - [4096, 256, 1, 8192, 4096, 4096, 4096, 256]
    - [11, 95.51]
  - - [4096, 512, 1, 128, 4096, 4096, 4096, 512]
    - [8, 30.39]
  - - [4096, 512, 1, 256, 4096, 4096, 4096, 512]
    - [8, 50.02]
  - - [4096, 512, 1, 512, 4096, 4096, 4096, 512]
    - [8, 74.07]
  - - [4096, 512, 1, 1024, 4096, 4096, 4096, 512]
    - [9, 97.26]
  - - [4096, 512, 1, 2048, 4096, 4096, 4096, 512]
    - [9, 117.05]
  - - [4096, 512, 1, 4096, 4096, 4096, 4096, 512]
    - [9, 130.11]
  - - [4096, 512, 1, 8192, 4096, 4096, 4096, 512]
    - [9, 137.97]
  - - [4096, 1024, 1, 128, 4096, 4096, 4096, 1024]
    - [6, 38.51]
  - - [4096, 1024, 1, 256, 4096, 4096, 4096, 1024]
    - [6, 63.37]
  - - [4096, 1024, 1, 512, 4096, 4096, 4096, 1024]
    - [6, 93.2]
  - - [4096, 1024, 1, 1024, 4096, 4096, 4096, 1024]
    - [6, 121.83]
  - - [4096, 1024, 1, 2048, 4096, 4096, 4096, 1024]
    - [6, 143.99]
  - - [4096, 1024, 1, 4096, 4096, 4096, 4096, 1024]
    - [6, 159.23]
  - - [4096, 1024, 1, 8192, 4096, 4096, 4096, 1024]
    - [6, 168.41]
  - - [4096, 2048, 1, 128, 4096, 4096, 4096, 2048]
    - [6, 41.23]
  - - [4096, 2048, 1, 256, 4096, 4096, 4096, 2048]
    - [6, 66.96]
  - - [4096, 2048, 1, 512, 4096, 4096, 4096, 2048]
    - [5, 97.12]
  - - [4096, 2048, 1, 1024, 4096, 4096, 4096, 2048]
    - [6, 125.53]
  - - [4096, 2048, 1, 2048, 4096, 4096, 4096, 2048]
    - [6, 147.08]
  - - [4096, 2048, 1, 4096, 4096, 4096, 4096, 2048]
    - [6, 161.14]
  - - [4096, 2048, 1, 8192, 4096, 4096, 4096, 2048]
    - [6, 169.47]
  - - [4096, 4096, 1, 128, 4096, 4096, 4096, 4096]
    - [5, 43.02]
  - - [4096, 4096, 1, 256, 4096, 4096, 4096, 4096]
    - [5, 69.24]
  - - [4096, 4096, 1, 512, 4096, 4096, 4096, 4096]
    - [5, 99.93]
  - - [4096, 4096, 1, 1024, 4096, 4096, 4096, 4096]
    - [6, 127.66]
  - - [4096, 4096, 1, 2048, 4096, 4096, 4096, 4096]
    - [6, 148.66]
  - - [4096, 4096, 1, 4096, 4096, 4096, 4096, 4096]
    - [6, 162.27]
  - - [4096, 4096, 1, 8192, 4096, 4096, 4096, 4096]
    - [6, 170.15]
  - - [4096, 8192, 1, 128, 4096, 4096, 4096, 8192]
    - [5, 44.2]
  - - [4096, 8192, 1, 256, 4096, 4096, 4096, 8192]
    - [5, 70.79]
  - - [4096, 8192, 1, 512, 4096, 4096, 4096, 8192]
    - [5, 101.41]
  - - [4096, 8192, 1, 1024, 4096, 4096, 4096, 8192]
    - [5, 129.01]
  - - [4096, 8192, 1, 2048, 4096, 4096, 4096, 8192]
    - [6, 149.63]
  - - [4096, 8192, 1, 4096, 4096, 4096, 4096, 8192]
    - [6, 163.14]
  - - [4096, 8192, 1, 8192, 4096, 4096, 4096, 8192]
    - [6, 170.53]
  - - [8192, 128, 1, 128, 8192, 8192, 8192, 128]
    - [0, 20.79]
  - - [8192, 128, 1, 256, 8192, 8192, 8192, 128]
    - [11, 34.63]
  - - [8192, 128, 1, 512, 8192, 8192, 8192, 128]
    - [11, 51.63]
  - - [8192, 128, 1, 1024, 8192, 8192, 8192, 128]
    - [11, 67.48]
  - - [8192, 128, 1, 2048, 8192, 8192, 8192, 128]
    - [11, 81.06]
  - - [8192, 128, 1, 4096, 8192, 8192, 8192, 128]
    - [11, 90.16]
  - - [8192, 128, 1, 8192, 8192, 8192, 8192, 128]
    - [11, 94.36]
  - - [8192, 256, 1, 128, 8192, 8192, 8192, 256]
    - [8, 30.36]
  - - [8192, 256, 1, 256, 8192, 8192, 8192, 256]
    - [8, 50.1]
  - - [8192, 256, 1, 512, 8192, 8192, 8192, 256]
    - [8, 73.91]
  - - [8192, 256, 1, 1024, 8192, 8192, 8192, 256]
    - [9, 97.46]
  - - [8192, 256, 1, 2048, 8192, 8192, 8192, 256]
    - [9, 117.22]
  - - [8192, 256, 1, 4096, 8192, 8192, 8192, 256]
    - [9, 130.14]
  - - [8192, 256, 1, 8192, 8192, 8192, 8192, 256]
    - [9, 136.15]
  - - [8192, 512, 1, 128, 8192, 8192, 8192, 512]
    - [6, 38.53]
  - - [8192, 512, 1, 256, 8192, 8192, 8192, 512]
    - [6, 63.44]
  - - [8192, 512, 1, 512, 8192, 8192, 8192, 512]
    - [6, 93.3]
  - - [8192, 512, 1, 1024, 8192, 8192, 8192, 512]
    - [6, 122.22]
  - - [8192, 512, 1, 2048, 8192, 8192, 8192, 512]
    - [6, 144.41]
  - - [8192, 512, 1, 4096, 8192, 8192, 8192, 512]
    - [6, 159.59]
  - - [8192, 512, 1, 8192, 8192, 8192, 8192, 512]
    - [6, 168.22]
  - - [8192, 1024, 1, 128, 8192, 8192, 8192, 1024]
    - [6, 41.07]
  - - [8192, 1024, 1, 256, 8192, 8192, 8192, 1024]
    - [6, 66.85]
  - - [8192, 1024, 1, 512, 8192, 8192, 8192, 1024]
    - [6, 96.43]
  - - [8192, 1024, 1, 1024, 8192, 8192, 8192, 1024]
    - [5, 125.46]
  - - [8192, 1024, 1, 2048, 8192, 8192, 8192, 1024]
    - [6, 147.41]
  - - [8192, 1024, 1, 4096, 8192, 8192, 8192, 1024]
    - [6, 161.54]
  - - [8192, 1024, 1, 8192, 8192, 8192, 8192, 1024]
    - [6, 169.57]
  - - [8192, 2048, 1, 128, 8192, 8192, 8192, 2048]
    - [5, 42.72]
  - - [8192, 2048, 1, 256, 8192, 8192, 8192, 2048]
    - [5, 68.63]
  - - [8192, 2048, 1, 512, 8192, 8192, 8192, 2048]
    - [6, 99.13]
  - - [8192, 2048, 1, 1024, 8192, 8192, 8192, 2048]
    - [6, 127.83]
  - - [8192, 2048, 1, 2048, 8192, 8192, 8192, 2048]
    - [6, 149.07]
  - - [8192, 2048, 1, 4096, 8192, 8192, 8192, 2048]
    - [6, 162.66]
  - - [8192, 2048, 1, 8192, 8192, 8192, 8192, 2048]
    - [6, 170.28]
  - - [8192, 4096, 1, 128, 8192, 8192, 8192, 4096]
    - [5, 44.08]
  - - [8192, 4096, 1, 256, 8192, 8192, 8192, 4096]
    - [5, 70.6]
  - - [8192, 4096, 1, 512, 8192, 8192, 8192, 4096]
    - [5, 100.97]
  - - [8192, 4096, 1, 1024, 8192, 8192, 8192, 4096]
    - [6, 129.08]
  - - [8192, 4096, 1, 2048, 8192, 8192, 8192, 4096]
    - [6, 150.11]
  - - [8192, 4096, 1, 4096, 8192, 8192, 8192, 4096]
    - [6, 163.25]
  - - [8192, 4096, 1, 8192, 8192, 8192, 8192, 4096]
    - [6, 170.58]
  - - [8192, 8192, 1, 128, 8192, 8192, 8192, 8192]
    - [5, 44.53]
  - - [8192, 8192, 1, 256, 8192, 8192, 8192, 8192]
    - [5, 71.3]
  - - [8192, 8192, 1, 512, 8192, 8192, 8192, 8192]
    - [5, 101.73]
  - - [8192, 8192, 1, 1024, 8192, 8192, 8192, 8192]
    - [6, 129.72]
  - - [8192, 8192, 1, 2048, 8192, 8192, 8192, 8192]
    - [6, 150.56]
  - - [8192, 8192, 1, 4096, 8192, 8192, 8192, 8192]
    - [6, 163.36]
  - - [8192, 8192, 1, 8192, 8192, 8192, 8192, 8192]
    - [6, 170.74]
  - - [1, 1, 1, 32, 1, 1, 1, 1]
    - [49, 0.0]
- null
- null
- ExperimentalStreamK
- GridBased
