projects/hipblaslt/library/src/amd_detail/rocblaslt/src/Tensile/Logic/asm_full/aquavanjaram/gfx942_64cu/StreamK/aquavanjaram942_Cijk_Alik_Bljk_I8BH_UserArgs.yaml
- {MinimumRequiredVersion: 4.33.0}
- aquavanjaram942
- {Architecture: gfx942, CUCount: 64}
- [Device 0049, Device 0050]
    SolutionIndex: 0
    SolutionNameMin: Cijk_Alik_Bljk_I8BH_UserArgs_MT256x256x32_MI16x16x1_SN_CLR0_GSU0_GSUC0_GSUWGMRR0_K1_LBSPPA256_LBSPPB128_MIWT8_8_PLR0_SU0_SUM0_SUS32_SKXCCM8_VWA8_VWB1_WGM1_WGMXCC1_WGMXCCGn1
    SolutionIndex: 1
    SolutionNameMin: Cijk_Alik_Bljk_I8BH_UserArgs_MT256x256x32_MI16x16x1_SN_CLR0_GSU0_GSUC0_GSUWGMRR0_K1_LBSPPA128_LBSPPB128_MIWT8_8_PLR0_SU0_SUM0_SUS32_SKXCCM8_VWA4_VWB4_WGM1_WGMXCC1_WGMXCCGn1
    SolutionIndex: 2
    SolutionNameMin: Cijk_Alik_Bljk_I8BH_UserArgs_MT256x256x32_MI16x16x1_SN_CLR0_GSU0_GSUC0_GSUWGMRR0_K1_LBSPPA128_LBSPPB128_MIWT8_8_PLR0_SU0_SUM0_SUS32_SKXCCM8_VWA4_VWB4_WGM1_WGMXCC1_WGMXCCGn1
    SolutionIndex: 3
    SolutionNameMin: Cijk_Alik_Bljk_I8BH_UserArgs_MT256x128x32_MI16x16x1_SN_CLR0_GSU0_GSUC0_GSUWGMRR0_K1_LBSPPA256_LBSPPB128_MIWT8_4_PLR0_SU0_SUM0_SUS32_SKXCCM8_VWA8_VWB1_WGM1_WGMXCC1_WGMXCCGn1
    SolutionIndex: 4
    SolutionNameMin: Cijk_Alik_Bljk_I8BH_UserArgs_MT256x128x32_MI16x16x1_SN_CLR0_GSU0_GSUC0_GSUWGMRR0_K1_LBSPPA128_LBSPPB128_MIWT8_4_PLR0_SU0_SUM0_SUS32_SKXCCM8_VWA4_VWB2_WGM1_WGMXCC1_WGMXCCGn1
    SolutionIndex: 5
    SolutionNameMin: Cijk_Alik_Bljk_I8BH_UserArgs_MT256x128x32_MI16x16x1_SN_CLR0_GSU0_GSUC0_GSUWGMRR0_K1_LBSPPA128_LBSPPB128_MIWT8_4_PLR0_SU0_SUM0_SUS32_SKXCCM8_VWA4_VWB4_WGM1_WGMXCC1_WGMXCCGn1
    SolutionIndex: 6
    SolutionNameMin: Cijk_Alik_Bljk_I8BH_UserArgs_MT128x128x32_MI16x16x1_SN_CLR0_GSU0_GSUC0_GSUWGMRR0_K1_LBSPPA128_LBSPPB128_MIWT4_4_PLR0_SU0_SUM0_SUS32_SKXCCM8_VWA4_VWB1_WGM1_WGMXCC1_WGMXCCGn1
    SolutionIndex: 7
    SolutionNameMin: Cijk_Alik_Bljk_I8BH_UserArgs_MT128x64x32_MI16x16x1_SN_CLR0_GSU0_GSUC0_GSUWGMRR0_K1_LBSPPA128_LBSPPB128_MIWT4_2_PLR0_SU0_SUM0_SUS32_SKXCCM8_VWA4_VWB1_WGM1_WGMXCC1_WGMXCCGn1
    SolutionIndex: 8
    SolutionNameMin: Cijk_Alik_Bljk_I8BH_UserArgs_MT256x256x64_MI16x16x1_SN_CLR1_GSU0_GSUC0_GSUWGMRR0_K1_LBSPPA512_LBSPPB128_MIWT8_8_PLR1_SU0_SUM0_SUS64_SKXCCM8_VWA8_VWB1_WGM1_WGMXCC1_WGMXCCGn1
    SolutionIndex: 9
    SolutionNameMin: Cijk_Alik_Bljk_I8BH_UserArgs_MT256x256x64_MI16x16x1_SN_CLR1_GSU0_GSUC0_GSUWGMRR0_K1_LBSPPA256_LBSPPB256_MIWT8_8_PLR1_SU0_SUM0_SUS64_SKXCCM8_VWA4_VWB4_WGM1_WGMXCC1_WGMXCCGn1
    SolutionIndex: 10
    SolutionNameMin: Cijk_Alik_Bljk_I8BH_UserArgs_MT256x256x64_MI16x16x1_SN_CLR1_GSU0_GSUC0_GSUWGMRR0_K1_LBSPPA256_LBSPPB512_MIWT8_8_PLR1_SU0_SUM0_SUS64_SKXCCM8_VWA4_VWB8_WGM1_WGMXCC1_WGMXCCGn1
    SolutionIndex: 11
    SolutionNameMin: Cijk_Alik_Bljk_I8BH_UserArgs_MT256x256x64_MI16x16x1_SN_CLR1_GSU0_GSUC0_GSUWGMRR0_K1_LBSPPA256_LBSPPB256_MIWT8_8_PLR1_SU0_SUM0_SUS64_SKXCCM8_VWA4_VWB4_WGM1_WGMXCC1_WGMXCCGn1
    SolutionIndex: 12
    SolutionNameMin: Cijk_Alik_Bljk_I8BH_UserArgs_MT256x256x64_MI16x16x1_SN_CLR1_GSU0_GSUC0_GSUWGMRR0_K1_LBSPPA512_LBSPPB128_MIWT8_8_PLR1_SU0_SUM0_SUS64_SKXCCM8_VWA8_VWB1_WGM1_WGMXCC1_WGMXCCGn1
    SolutionIndex: 13
    SolutionNameMin: Cijk_Alik_Bljk_I8BH_UserArgs_MT256x256x64_MI16x16x1_SN_CLR1_GSU0_GSUC0_GSUWGMRR0_K1_LBSPPA256_LBSPPB256_MIWT8_8_PLR1_SU0_SUM0_SUS64_SKXCCM8_VWA4_VWB4_WGM1_WGMXCC1_WGMXCCGn1
    SolutionIndex: 14
    SolutionNameMin: Cijk_Alik_Bljk_I8BH_UserArgs_MT256x256x64_MI16x16x1_SN_CLR1_GSU0_GSUC0_GSUWGMRR0_K1_LBSPPA512_LBSPPB128_MIWT8_8_PLR1_SU0_SUM0_SUS64_SKXCCM8_VWA8_VWB1_WGM4_WGMXCC1_WGMXCCGn1
    SolutionIndex: 15
    SolutionNameMin: Cijk_Alik_Bljk_I8BH_UserArgs_MT256x256x64_MI16x16x1_SN_CLR1_GSU0_GSUC0_GSUWGMRR0_K1_LBSPPA512_LBSPPB128_MIWT8_8_PLR1_SU0_SUM0_SUS64_SKXCCM8_VWA8_VWB1_WGM4_WGMXCC1_WGMXCCGn1
    SolutionIndex: 16
    SolutionNameMin: Cijk_Alik_Bljk_I8BH_UserArgs_MT256x256x64_MI16x16x1_SN_CLR1_GSU0_GSUC0_GSUWGMRR0_K1_LBSPPA256_LBSPPB128_MIWT8_8_PLR1_SU0_SUM0_SUS64_SKXCCM8_VWA4_VWB2_WGM4_WGMXCC1_WGMXCCGn1
    SolutionIndex: 17
    SolutionNameMin: Cijk_Alik_Bljk_I8BH_UserArgs_MT256x256x64_MI16x16x1_SN_CLR1_GSU0_GSUC0_GSUWGMRR0_K1_LBSPPA512_LBSPPB128_MIWT8_8_PLR1_SU0_SUM0_SUS64_SKXCCM8_VWA8_VWB1_WGM8_WGMXCC1_WGMXCCGn1
    SolutionIndex: 18
    SolutionNameMin: Cijk_Alik_Bljk_I8BH_UserArgs_MT256x256x64_MI16x16x1_SN_CLR1_GSU0_GSUC0_GSUWGMRR0_K1_LBSPPA256_LBSPPB256_MIWT8_8_PLR1_SU0_SUM0_SUS64_SKXCCM8_VWA4_VWB4_WGM8_WGMXCC1_WGMXCCGn1
    SolutionIndex: 19
    SolutionNameMin: Cijk_Alik_Bljk_I8BH_UserArgs_MT256x128x64_MI16x16x1_SN_CLR1_GSU0_GSUC0_GSUWGMRR0_K1_LBSPPA256_LBSPPB128_MIWT8_4_PLR1_SU0_SUM0_SUS64_SKXCCM8_VWA4_VWB1_WGM1_WGMXCC1_WGMXCCGn1
    SolutionIndex: 20
    SolutionNameMin: Cijk_Alik_Bljk_I8BH_UserArgs_MT256x128x64_MI16x16x1_SN_CLR1_GSU0_GSUC0_GSUWGMRR0_K1_LBSPPA512_LBSPPB128_MIWT8_4_PLR1_SU0_SUM0_SUS64_SKXCCM8_VWA8_VWB1_WGM1_WGMXCC1_WGMXCCGn1
    SolutionIndex: 21
    SolutionNameMin: Cijk_Alik_Bljk_I8BH_UserArgs_MT256x128x64_MI16x16x1_SN_CLR1_GSU0_GSUC0_GSUWGMRR0_K1_LBSPPA256_LBSPPB128_MIWT8_4_PLR1_SU0_SUM0_SUS64_SKXCCM8_VWA4_VWB2_WGM1_WGMXCC1_WGMXCCGn1
    SolutionIndex: 22
    SolutionNameMin: Cijk_Alik_Bljk_I8BH_UserArgs_MT256x128x64_MI16x16x1_SN_CLR1_GSU0_GSUC0_GSUWGMRR0_K1_LBSPPA512_LBSPPB128_MIWT8_4_PLR1_SU0_SUM0_SUS64_SKXCCM8_VWA8_VWB1_WGM1_WGMXCC1_WGMXCCGn1
    SolutionIndex: 23
    SolutionNameMin: Cijk_Alik_Bljk_I8BH_UserArgs_MT256x128x64_MI16x16x1_SN_CLR1_GSU0_GSUC0_GSUWGMRR0_K1_LBSPPA256_LBSPPB128_MIWT8_4_PLR1_SU0_SUM0_SUS64_SKXCCM8_VWA4_VWB2_WGM1_WGMXCC1_WGMXCCGn1
    SolutionIndex: 24
    SolutionNameMin: Cijk_Alik_Bljk_I8BH_UserArgs_MT128x128x64_MI16x16x1_SN_CLR1_GSU0_GSUC0_GSUWGMRR0_K1_LBSPPA256_LBSPPB128_MIWT4_4_PLR1_SU0_SUM0_SUS64_SKXCCM8_VWA4_VWB1_WGM1_WGMXCC1_WGMXCCGn1
    SolutionIndex: 25
    SolutionNameMin: Cijk_Alik_Bljk_I8BH_UserArgs_MT128x64x64_MI16x16x1_SN_CLR1_GSU0_GSUC0_GSUWGMRR0_K1_LBSPPA256_LBSPPB128_MIWT4_2_PLR1_SU0_SUM0_SUS64_SKXCCM8_VWA4_VWB1_WGM1_WGMXCC1_WGMXCCGn1
    SolutionIndex: 26
    SolutionNameMin: Cijk_Alik_Bljk_I8BH_UserArgs_MT128x64x64_MI16x16x1_SN_CLR1_GSU0_GSUC0_GSUWGMRR0_K1_LBSPPA256_LBSPPB128_MIWT4_2_PLR1_SU0_SUM0_SUS64_SKXCCM8_VWA4_VWB2_WGM1_WGMXCC1_WGMXCCGn1
    SolutionIndex: 27
    SolutionNameMin: Cijk_Alik_Bljk_I8BH_UserArgs_MT128x64x64_MI16x16x1_SN_CLR1_GSU0_GSUC0_GSUWGMRR0_K1_LBSPPA256_LBSPPB128_MIWT4_2_PLR1_SU0_SUM0_SUS64_SKXCCM8_VWA4_VWB1_WGM1_WGMXCC1_WGMXCCGn1
    SolutionIndex: 28
    SolutionNameMin: Cijk_Alik_Bljk_I8BH_UserArgs_MT64x64x64_MI16x16x1_SN_CLR1_GSU0_GSUC0_GSUWGMRR0_K1_LBSPPA128_LBSPPB128_MIWT2_2_PLR1_SU0_SUM0_SUS64_SKXCCM8_VWA2_VWB1_WGM1_WGMXCC1_WGMXCCGn1
    SolutionIndex: 29
    SolutionNameMin: Cijk_Alik_Bljk_I8BH_UserArgs_MT64x64x64_MI16x16x1_SN_CLR1_GSU0_GSUC0_GSUWGMRR0_K1_LBSPPA128_LBSPPB128_MIWT2_2_PLR1_SU0_SUM0_SUS64_SKXCCM8_VWA2_VWB2_WGM1_WGMXCC1_WGMXCCGn1
    SolutionIndex: 30
    SolutionNameMin: Cijk_Alik_Bljk_I8BH_UserArgs_MT64x32x64_MI16x16x1_SN_CLR1_GSU0_GSUC0_GSUWGMRR0_K1_LBSPPA128_LBSPPB128_MIWT2_1_PLR1_SU0_SUM0_SUS64_SKXCCM8_VWA2_VWB1_WGM1_WGMXCC1_WGMXCCGn1
    SolutionIndex: 31
    SolutionNameMin: Cijk_Alik_Bljk_I8BH_UserArgs_MT64x32x64_MI16x16x1_SN_CLR1_GSU0_GSUC0_GSUWGMRR0_K1_LBSPPA128_LBSPPB128_MIWT2_1_PLR1_SU0_SUM0_SUS64_SKXCCM8_VWA2_VWB1_WGM1_WGMXCC1_WGMXCCGn1
    SolutionIndex: 32
    SolutionNameMin: Cijk_Alik_Bljk_I8BH_UserArgs_MT32x32x64_MI16x16x1_SN_CLR1_GSU0_GSUC0_GSUWGMRR0_K1_LBSPPA128_LBSPPB128_MIWT1_1_PLR1_SU0_SUM0_SUS64_SKXCCM8_VWA1_VWB1_WGM1_WGMXCC1_WGMXCCGn1
    SolutionIndex: 33
    SolutionNameMin: Cijk_Alik_Bljk_I8BH_UserArgs_MT32x32x64_MI16x16x1_SN_CLR1_GSU0_GSUC0_GSUWGMRR0_K1_LBSPPA128_LBSPPB128_MIWT1_1_PLR1_SU0_SUM0_SUS64_SKXCCM8_VWA1_VWB1_WGM1_WGMXCC1_WGMXCCGn1
    SolutionIndex: 34
    SolutionNameMin: Cijk_Alik_Bljk_I8BH_UserArgs_MT32x32x64_MI16x16x1_SN_CLR1_GSU0_GSUC0_GSUWGMRR0_K1_LBSPPA128_LBSPPB128_MIWT1_1_PLR1_SU0_SUM0_SUS64_SKXCCM8_VWA1_VWB1_WGM1_WGMXCC1_WGMXCCGn1
    SolutionIndex: 35
    SolutionNameMin: Cijk_Alik_Bljk_I8BH_UserArgs_MT32x32x64_MI16x16x1_SN_CLR1_GSU0_GSUC0_GSUWGMRR0_K1_LBSPPA128_LBSPPB128_MIWT1_1_PLR1_SU0_SUM0_SUS64_SKXCCM8_VWA1_VWB1_WGM1_WGMXCC1_WGMXCCGn1
    SolutionIndex: 36
    SolutionNameMin: Cijk_Alik_Bljk_I8BH_UserArgs_MT32x32x64_MI16x16x1_SN_CLR0_GSU0_GSUC0_GSUWGMRR0_K1_LBSPPA128_LBSPPB128_MIWT1_1_PLR0_SU0_SUM0_SUS64_SKXCCM8_VWA1_VWB1_WGM1_WGMXCC1_WGMXCCGn1
    SolutionIndex: 37
    SolutionNameMin: Cijk_Alik_Bljk_I8BH_UserArgs_MT128x256x128_MI16x16x1_SN_CLR1_GSU0_GSUC0_GSUWGMRR0_K1_LBSPPA512_LBSPPB128_MIWT4_8_PLR1_SU0_SUM0_SUS128_SKXCCM8_VWA4_VWB1_WGM1_WGMXCC1_WGMXCCGn1
    SolutionIndex: 38
    SolutionNameMin: Cijk_Alik_Bljk_I8BH_UserArgs_MT128x256x128_MI16x16x1_SN_CLR1_GSU0_GSUC0_GSUWGMRR0_K1_LBSPPA512_LBSPPB256_MIWT4_8_PLR1_SU0_SUM0_SUS128_SKXCCM8_VWA4_VWB2_WGM1_WGMXCC1_WGMXCCGn1
    SolutionIndex: 39
    SolutionNameMin: Cijk_Alik_Bljk_I8BH_UserArgs_MT256x128x128_MI16x16x1_SN_CLR1_GSU0_GSUC0_GSUWGMRR0_K1_LBSPPA512_LBSPPB128_MIWT8_4_PLR1_SU0_SUM0_SUS128_SKXCCM8_VWA4_VWB1_WGM1_WGMXCC1_WGMXCCGn1
    SolutionIndex: 40
    SolutionNameMin: Cijk_Alik_Bljk_I8BH_UserArgs_MT256x128x128_MI16x16x1_SN_CLR1_GSU0_GSUC0_GSUWGMRR0_K1_LBSPPA1024_LBSPPB128_MIWT8_4_PLR1_SU0_SUM0_SUS128_SKXCCM8_VWA8_VWB1_WGM1_WGMXCC1_WGMXCCGn1
    SolutionIndex: 41
    SolutionNameMin: Cijk_Alik_Bljk_I8BH_UserArgs_MT256x128x128_MI16x16x1_SN_CLR1_GSU0_GSUC0_GSUWGMRR0_K1_LBSPPA1024_LBSPPB512_MIWT8_4_PLR1_SU0_SUM0_SUS128_SKXCCM8_VWA8_VWB4_WGM1_WGMXCC1_WGMXCCGn1
    SolutionIndex: 42
    SolutionNameMin: Cijk_Alik_Bljk_I8BH_UserArgs_MT256x128x128_MI16x16x1_SN_CLR1_GSU0_GSUC0_GSUWGMRR0_K1_LBSPPA512_LBSPPB128_MIWT8_4_PLR1_SU0_SUM0_SUS128_SKXCCM8_VWA4_VWB1_WGM4_WGMXCC1_WGMXCCGn1
    SolutionIndex: 43
    SolutionNameMin: Cijk_Alik_Bljk_I8BH_UserArgs_MT256x128x128_MI16x16x1_SN_CLR1_GSU0_GSUC0_GSUWGMRR0_K1_LBSPPA1024_LBSPPB128_MIWT8_4_PLR1_SU0_SUM0_SUS128_SKXCCM8_VWA8_VWB1_WGM4_WGMXCC1_WGMXCCGn1
    SolutionIndex: 44
    SolutionNameMin: Cijk_Alik_Bljk_I8BH_UserArgs_MT256x128x128_MI16x16x1_SN_CLR1_GSU0_GSUC0_GSUWGMRR0_K1_LBSPPA1024_LBSPPB256_MIWT8_4_PLR1_SU0_SUM0_SUS128_SKXCCM8_VWA8_VWB2_WGM4_WGMXCC1_WGMXCCGn1
    SolutionIndex: 45
    SolutionNameMin: Cijk_Alik_Bljk_I8BH_UserArgs_MT256x128x128_MI16x16x1_SN_CLR1_GSU0_GSUC0_GSUWGMRR0_K1_LBSPPA512_LBSPPB512_MIWT8_4_PLR1_SU0_SUM0_SUS128_SKXCCM8_VWA4_VWB4_WGM4_WGMXCC1_WGMXCCGn1
    SolutionIndex: 46
    SolutionNameMin: Cijk_Alik_Bljk_I8BH_UserArgs_MT256x128x128_MI16x16x1_SN_CLR1_GSU0_GSUC0_GSUWGMRR0_K1_LBSPPA1024_LBSPPB128_MIWT8_4_PLR1_SU0_SUM0_SUS128_SKXCCM8_VWA8_VWB1_WGM8_WGMXCC1_WGMXCCGn1
    SolutionIndex: 47
    SolutionNameMin: Cijk_Alik_Bljk_I8BH_UserArgs_MT256x128x128_MI16x16x1_SN_CLR1_GSU0_GSUC0_GSUWGMRR0_K1_LBSPPA1024_LBSPPB512_MIWT8_4_PLR1_SU0_SUM0_SUS128_SKXCCM8_VWA8_VWB4_WGM8_WGMXCC1_WGMXCCGn1
    SolutionIndex: 48
    SolutionNameMin: Cijk_Alik_Bljk_I8BH_UserArgs_MT256x128x128_MI16x16x1_SN_CLR1_GSU0_GSUC0_GSUWGMRR0_K1_LBSPPA512_LBSPPB512_MIWT8_4_PLR1_SU0_SUM0_SUS128_SKXCCM8_VWA4_VWB4_WGM8_WGMXCC1_WGMXCCGn1
    SolutionIndex: 49
    SolutionNameMin: Cijk_Alik_Bljk_I8BH_UserArgs_MT128x128x128_MI16x16x1_SN_CLR1_GSU0_GSUC0_GSUWGMRR0_K1_LBSPPA512_LBSPPB128_MIWT4_4_PLR1_SU0_SUM0_SUS128_SKXCCM8_VWA4_VWB1_WGM1_WGMXCC1_WGMXCCGn1
    SolutionIndex: 50
    SolutionNameMin: Cijk_Alik_Bljk_I8BH_UserArgs_MT128x128x128_MI16x16x1_SN_CLR1_GSU0_GSUC0_GSUWGMRR0_K1_LBSPPA512_LBSPPB256_MIWT4_4_PLR1_SU0_SUM0_SUS128_SKXCCM8_VWA4_VWB2_WGM1_WGMXCC1_WGMXCCGn1
    SolutionIndex: 51
    SolutionNameMin: Cijk_Alik_Bljk_I8BH_UserArgs_MT128x128x128_MI16x16x1_SN_CLR1_GSU0_GSUC0_GSUWGMRR0_K1_LBSPPA512_LBSPPB512_MIWT4_4_PLR1_SU0_SUM0_SUS128_SKXCCM8_VWA4_VWB4_WGM1_WGMXCC1_WGMXCCGn1
    SolutionIndex: 52
    SolutionNameMin: Cijk_Alik_Bljk_I8BH_UserArgs_MT128x128x128_MI16x16x1_SN_CLR1_GSU0_GSUC0_GSUWGMRR0_K1_LBSPPA512_LBSPPB128_MIWT4_4_PLR1_SU0_SUM0_SUS128_SKXCCM8_VWA4_VWB1_WGM1_WGMXCC1_WGMXCCGn1
    SolutionIndex: 53
    SolutionNameMin: Cijk_Alik_Bljk_I8BH_UserArgs_MT128x128x128_MI16x16x1_SN_CLR1_GSU0_GSUC0_GSUWGMRR0_K1_LBSPPA512_LBSPPB256_MIWT4_4_PLR1_SU0_SUM0_SUS128_SKXCCM8_VWA4_VWB2_WGM1_WGMXCC1_WGMXCCGn1
    SolutionIndex: 54
    SolutionNameMin: Cijk_Alik_Bljk_I8BH_UserArgs_MT128x128x128_MI16x16x1_SN_CLR1_GSU0_GSUC0_GSUWGMRR0_K1_LBSPPA512_LBSPPB512_MIWT4_4_PLR1_SU0_SUM0_SUS128_SKXCCM8_VWA4_VWB4_WGM1_WGMXCC1_WGMXCCGn1
    SolutionIndex: 55
    SolutionNameMin: Cijk_Alik_Bljk_I8BH_UserArgs_MT128x128x128_MI16x16x1_SN_CLR1_GSU0_GSUC0_GSUWGMRR0_K1_LBSPPA512_LBSPPB128_MIWT4_4_PLR1_SU0_SUM0_SUS128_SKXCCM8_VWA4_VWB1_WGM4_WGMXCC1_WGMXCCGn1
    SolutionIndex: 56
    SolutionNameMin: Cijk_Alik_Bljk_I8BH_UserArgs_MT128x128x128_MI16x16x1_SN_CLR1_GSU0_GSUC0_GSUWGMRR0_K1_LBSPPA512_LBSPPB512_MIWT4_4_PLR1_SU0_SUM0_SUS128_SKXCCM8_VWA4_VWB4_WGM4_WGMXCC1_WGMXCCGn1
    SolutionIndex: 57
    SolutionNameMin: Cijk_Alik_Bljk_I8BH_UserArgs_MT128x128x128_MI16x16x1_SN_CLR1_GSU0_GSUC0_GSUWGMRR0_K1_LBSPPA512_LBSPPB128_MIWT4_4_PLR1_SU0_SUM0_SUS128_SKXCCM8_VWA4_VWB1_WGM8_WGMXCC1_WGMXCCGn1
    SolutionIndex: 58
    SolutionNameMin: Cijk_Alik_Bljk_I8BH_UserArgs_MT128x128x128_MI16x16x1_SN_CLR1_GSU0_GSUC0_GSUWGMRR0_K1_LBSPPA512_LBSPPB512_MIWT4_4_PLR1_SU0_SUM0_SUS128_SKXCCM8_VWA4_VWB4_WGM8_WGMXCC1_WGMXCCGn1
    SolutionIndex: 59
    SolutionNameMin: Cijk_Alik_Bljk_I8BH_UserArgs_MT128x64x128_MI16x16x1_SN_CLR1_GSU0_GSUC0_GSUWGMRR0_K1_LBSPPA512_LBSPPB128_MIWT4_2_PLR1_SU0_SUM0_SUS128_SKXCCM8_VWA4_VWB1_WGM1_WGMXCC1_WGMXCCGn1
    SolutionIndex: 60
    SolutionNameMin: Cijk_Alik_Bljk_I8BH_UserArgs_MT128x64x128_MI16x16x1_SN_CLR1_GSU0_GSUC0_GSUWGMRR0_K1_LBSPPA512_LBSPPB256_MIWT4_2_PLR1_SU0_SUM0_SUS128_SKXCCM8_VWA4_VWB2_WGM1_WGMXCC1_WGMXCCGn1
    SolutionIndex: 61
    SolutionNameMin: Cijk_Alik_Bljk_I8BH_UserArgs_MT128x64x128_MI16x16x1_SN_CLR1_GSU0_GSUC0_GSUWGMRR0_K1_LBSPPA512_LBSPPB128_MIWT4_2_PLR1_SU0_SUM0_SUS128_SKXCCM8_VWA4_VWB1_WGM8_WGMXCC1_WGMXCCGn1
    SolutionIndex: 62
    SolutionNameMin: Cijk_Alik_Bljk_I8BH_UserArgs_MT128x64x128_MI16x16x1_SN_CLR1_GSU0_GSUC0_GSUWGMRR0_K1_LBSPPA512_LBSPPB256_MIWT4_2_PLR1_SU0_SUM0_SUS128_SKXCCM8_VWA4_VWB2_WGM8_WGMXCC1_WGMXCCGn1
    SolutionIndex: 63
    SolutionNameMin: Cijk_Alik_Bljk_I8BH_UserArgs_MT64x64x128_MI16x16x1_SN_CLR1_GSU0_GSUC0_GSUWGMRR0_K1_LBSPPA256_LBSPPB128_MIWT2_2_PLR1_SU0_SUM0_SUS128_SKXCCM8_VWA2_VWB1_WGM1_WGMXCC1_WGMXCCGn1
    SolutionIndex: 64
    SolutionNameMin: Cijk_Alik_Bljk_I8BH_UserArgs_MT64x64x128_MI16x16x1_SN_CLR1_GSU0_GSUC0_GSUWGMRR0_K1_LBSPPA256_LBSPPB256_MIWT2_2_PLR1_SU0_SUM0_SUS128_SKXCCM8_VWA2_VWB2_WGM1_WGMXCC1_WGMXCCGn1
    SolutionIndex: 65
    SolutionNameMin: Cijk_Alik_Bljk_I8BH_UserArgs_MT32x64x128_MI16x16x1_SN_CLR1_GSU0_GSUC0_GSUWGMRR0_K1_LBSPPA128_LBSPPB128_MIWT1_2_PLR1_SU0_SUM0_SUS128_SKXCCM8_VWA1_VWB1_WGM1_WGMXCC1_WGMXCCGn1
    SolutionIndex: 66
    SolutionNameMin: Cijk_Alik_Bljk_I8BH_UserArgs_MT32x64x128_MI16x16x1_SN_CLR1_GSU0_GSUC0_GSUWGMRR0_K1_LBSPPA128_LBSPPB256_MIWT1_2_PLR1_SU0_SUM0_SUS128_SKXCCM8_VWA1_VWB2_WGM1_WGMXCC1_WGMXCCGn1
    SolutionIndex: 67
    SolutionNameMin: Cijk_Alik_Bljk_I8BH_UserArgs_MT64x32x128_MI16x16x1_SN_CLR1_GSU0_GSUC0_GSUWGMRR0_K1_LBSPPA256_LBSPPB128_MIWT2_1_PLR1_SU0_SUM0_SUS128_SKXCCM8_VWA2_VWB1_WGM1_WGMXCC1_WGMXCCGn1
    SolutionIndex: 68
    SolutionNameMin: Cijk_Alik_Bljk_I8BH_UserArgs_MT64x32x128_MI16x16x1_SN_CLR1_GSU0_GSUC0_GSUWGMRR0_K1_LBSPPA256_LBSPPB128_MIWT2_1_PLR1_SU0_SUM0_SUS128_SKXCCM8_VWA2_VWB1_WGM1_WGMXCC1_WGMXCCGn1
    SolutionIndex: 69
    SolutionNameMin: Cijk_Alik_Bljk_I8BH_UserArgs_MT64x32x128_MI16x16x1_SN_CLR1_GSU0_GSUC0_GSUWGMRR0_K1_LBSPPA256_LBSPPB128_MIWT2_1_PLR1_SU0_SUM0_SUS128_SKXCCM8_VWA2_VWB1_WGM1_WGMXCC1_WGMXCCGn1
    SolutionIndex: 70
    SolutionNameMin: Cijk_Alik_Bljk_I8BH_UserArgs_MT32x32x128_MI16x16x1_SN_CLR1_GSU0_GSUC0_GSUWGMRR0_K1_LBSPPA128_LBSPPB128_MIWT1_1_PLR1_SU0_SUM0_SUS128_SKXCCM8_VWA1_VWB1_WGM1_WGMXCC1_WGMXCCGn1
    SolutionIndex: 71
    SolutionNameMin: Cijk_Alik_Bljk_I8BH_UserArgs_MT32x32x128_MI16x16x1_SN_CLR1_GSU0_GSUC0_GSUWGMRR0_K1_LBSPPA128_LBSPPB128_MIWT1_1_PLR1_SU0_SUM0_SUS128_SKXCCM8_VWA1_VWB1_WGM1_WGMXCC1_WGMXCCGn1
    SolutionIndex: 72
    SolutionNameMin: Cijk_Alik_Bljk_I8BH_UserArgs_MT32x32x128_MI16x16x1_SN_CLR1_GSU0_GSUC0_GSUWGMRR0_K1_LBSPPA128_LBSPPB128_MIWT1_1_PLR1_SU0_SUM0_SUS128_SKXCCM8_VWA1_VWB1_WGM1_WGMXCC1_WGMXCCGn1
    SolutionIndex: 73
    SolutionNameMin: Cijk_Alik_Bljk_I8BH_UserArgs_MT32x32x128_MI16x16x1_SN_CLR1_GSU0_GSUC0_GSUWGMRR0_K1_LBSPPA128_LBSPPB128_MIWT1_1_PLR1_SU0_SUM0_SUS128_SKXCCM8_VWA1_VWB1_WGM1_WGMXCC1_WGMXCCGn1
    SolutionIndex: 74
    SolutionNameMin: Cijk_Alik_Bljk_I8BH_UserArgs_MT64x128x256_MI16x16x1_SN_CLR1_GSU0_GSUC0_GSUWGMRR0_K1_LBSPPA512_LBSPPB1024_MIWT2_4_PLR1_SU0_SUM0_SUS256_SKXCCM8_VWA2_VWB4_WGM1_WGMXCC1_WGMXCCGn1
    SolutionIndex: 75
    SolutionNameMin: Cijk_Alik_Bljk_I8BH_UserArgs_MT64x128x256_MI16x16x1_SN_CLR1_GSU0_GSUC0_GSUWGMRR0_K1_LBSPPA512_LBSPPB512_MIWT2_4_PLR2_SU0_SUM0_SUS256_SKXCCM8_VWA2_VWB2_WGM1_WGMXCC1_WGMXCCGn1
    SolutionIndex: 76
    SolutionNameMin: Cijk_Alik_Bljk_I8BH_UserArgs_MT128x64x256_MI16x16x1_SN_CLR1_GSU0_GSUC0_GSUWGMRR0_K1_LBSPPA1024_LBSPPB256_MIWT4_2_PLR2_SU0_SUM0_SUS256_SKXCCM8_VWA4_VWB1_WGM1_WGMXCC1_WGMXCCGn1
    SolutionIndex: 77
    SolutionNameMin: Cijk_Alik_Bljk_I8BH_UserArgs_MT128x64x256_MI16x16x1_SN_CLR1_GSU0_GSUC0_GSUWGMRR0_K1_LBSPPA1024_LBSPPB512_MIWT4_2_PLR2_SU0_SUM0_SUS256_SKXCCM8_VWA4_VWB2_WGM4_WGMXCC1_WGMXCCGn1
    SolutionIndex: 78
    SolutionNameMin: Cijk_Alik_Bljk_I8BH_UserArgs_MT64x64x256_MI16x16x1_SN_CLR1_GSU0_GSUC0_GSUWGMRR0_K1_LBSPPA512_LBSPPB256_MIWT2_2_PLR1_SU0_SUM0_SUS256_SKXCCM8_VWA2_VWB1_WGM1_WGMXCC1_WGMXCCGn1
    SolutionIndex: 79
    SolutionNameMin: Cijk_Alik_Bljk_I8BH_UserArgs_MT64x64x256_MI16x16x1_SN_CLR1_GSU0_GSUC0_GSUWGMRR0_K1_LBSPPA512_LBSPPB256_MIWT2_2_PLR2_SU0_SUM0_SUS256_SKXCCM8_VWA2_VWB1_WGM1_WGMXCC1_WGMXCCGn1
    SolutionIndex: 80
    SolutionNameMin: Cijk_Alik_Bljk_I8BH_UserArgs_MT64x64x256_MI16x16x1_SN_CLR1_GSU0_GSUC0_GSUWGMRR0_K1_LBSPPA512_LBSPPB512_MIWT2_2_PLR1_SU0_SUM0_SUS256_SKXCCM8_VWA2_VWB2_WGM4_WGMXCC1_WGMXCCGn1
    SolutionIndex: 81
    SolutionNameMin: Cijk_Alik_Bljk_I8BH_UserArgs_MT64x32x256_MI16x16x1_SN_CLR1_GSU0_GSUC0_GSUWGMRR0_K1_LBSPPA512_LBSPPB256_MIWT2_1_PLR2_SU0_SUM0_SUS256_SKXCCM8_VWA2_VWB1_WGM1_WGMXCC1_WGMXCCGn1
    SolutionIndex: 82
    SolutionNameMin: Cijk_Alik_Bljk_I8BH_UserArgs_MT32x32x256_MI16x16x1_SN_CLR1_GSU0_GSUC0_GSUWGMRR0_K1_LBSPPA256_LBSPPB256_MIWT1_1_PLR1_SU0_SUM0_SUS256_SKXCCM8_VWA1_VWB1_WGM1_WGMXCC1_WGMXCCGn1
    SolutionIndex: 83
    SolutionNameMin: Cijk_Alik_Bljk_I8BH_UserArgs_MT32x32x256_MI16x16x1_SN_CLR1_GSU0_GSUC0_GSUWGMRR0_K1_LBSPPA256_LBSPPB256_MIWT1_1_PLR1_SU0_SUM0_SUS256_SKXCCM8_VWA1_VWB1_WGM1_WGMXCC1_WGMXCCGn1
    SolutionIndex: 84
    SolutionNameMin: Cijk_Alik_Bljk_I8BH_UserArgs_MT32x32x256_MI16x16x1_SN_CLR1_GSU0_GSUC0_GSUWGMRR0_K1_LBSPPA256_LBSPPB256_MIWT1_1_PLR2_SU0_SUM0_SUS256_SKXCCM8_VWA1_VWB1_WGM1_WGMXCC1_WGMXCCGn1
    SolutionIndex: 85
    SolutionNameMin: Cijk_Alik_Bljk_I8BH_UserArgs_MT32x32x32_MI16x16x1_SN_CLR0_GSU0_GSUC0_GSUWGMRR0_K1_LBSPPA128_LBSPPB128_MIWT1_1_PLR0_SU32_SUM0_SUS256_SKXCCM0_VWA1_VWB1_WGM4_WGMXCC1_WGMXCCGn1
- - - [128, 128, 1, 128, 128, 128, 128, 128]
    - [35, 0.69]
  - - [128, 128, 1, 256, 128, 128, 256, 256]
    - [70, 1.27]
  - - [128, 128, 1, 512, 128, 128, 512, 512]
    - [72, 2.32]
  - - [128, 128, 1, 1024, 128, 128, 1024, 1024]
    - [72, 3.92]
  - - [128, 128, 1, 2048, 128, 128, 2048, 2048]
    - [72, 5.95]
  - - [128, 128, 1, 4096, 128, 128, 4096, 4096]
    - [84, 8.2]
  - - [128, 128, 1, 8192, 128, 128, 8192, 8192]
    - [84, 10.07]
  - - [128, 256, 1, 128, 128, 128, 128, 128]
    - [36, 1.35]
  - - [128, 256, 1, 256, 128, 128, 256, 256]
    - [73, 2.52]
  - - [128, 256, 1, 512, 128, 128, 512, 512]
    - [72, 4.6]
  - - [128, 256, 1, 1024, 128, 128, 1024, 1024]
    - [72, 7.76]
  - - [128, 256, 1, 2048, 128, 128, 2048, 2048]
    - [72, 11.87]
  - - [128, 256, 1, 4096, 128, 128, 4096, 4096]
    - [84, 16.3]
  - - [128, 256, 1, 8192, 128, 128, 8192, 8192]
    - [84, 20.11]
  - - [128, 512, 1, 128, 128, 128, 128, 128]
    - [32, 2.7]
  - - [128, 512, 1, 256, 128, 128, 256, 256]
    - [34, 5.0]
  - - [128, 512, 1, 512, 128, 128, 512, 512]
    - [72, 9.11]
  - - [128, 512, 1, 1024, 128, 128, 1024, 1024]
    - [72, 15.45]
  - - [128, 512, 1, 2048, 128, 128, 2048, 2048]
    - [72, 23.6]
  - - [128, 512, 1, 4096, 128, 128, 4096, 4096]
    - [84, 32.63]
  - - [128, 512, 1, 8192, 128, 128, 8192, 8192]
    - [84, 40.22]
  - - [128, 1024, 1, 128, 128, 128, 128, 128]
    - [67, 5.03]
  - - [128, 1024, 1, 256, 128, 128, 256, 256]
    - [69, 9.17]
  - - [128, 1024, 1, 512, 128, 128, 512, 512]
    - [68, 16.14]
  - - [128, 1024, 1, 1024, 128, 128, 1024, 1024]
    - [66, 26.33]
  - - [128, 1024, 1, 2048, 128, 128, 2048, 2048]
    - [66, 38.3]
  - - [128, 1024, 1, 4096, 128, 128, 4096, 4096]
    - [81, 49.87]
  - - [128, 1024, 1, 8192, 128, 128, 8192, 8192]
    - [81, 59.44]
  - - [128, 2048, 1, 128, 128, 128, 128, 128]
    - [28, 9.16]
  - - [128, 2048, 1, 256, 128, 128, 256, 256]
    - [29, 16.63]
  - - [128, 2048, 1, 512, 128, 128, 512, 512]
    - [63, 28.15]
  - - [128, 2048, 1, 1024, 128, 128, 1024, 1024]
    - [63, 44.01]
  - - [128, 2048, 1, 2048, 128, 128, 2048, 2048]
    - [63, 61.63]
  - - [128, 2048, 1, 4096, 128, 128, 4096, 4096]
    - [79, 76.99]
  - - [128, 2048, 1, 8192, 128, 128, 8192, 8192]
    - [79, 84.38]
  - - [128, 4096, 1, 128, 128, 128, 128, 128]
    - [25, 15.48]
  - - [128, 4096, 1, 256, 128, 128, 256, 256]
    - [27, 27.6]
  - - [128, 4096, 1, 512, 128, 128, 512, 512]
    - [26, 44.87]
  - - [128, 4096, 1, 1024, 128, 128, 1024, 1024]
    - [60, 67.18]
  - - [128, 4096, 1, 2048, 128, 128, 2048, 2048]
    - [59, 89.89]
  - - [128, 4096, 1, 4096, 128, 128, 4096, 4096]
    - [75, 98.86]
  - - [128, 4096, 1, 8192, 128, 128, 8192, 8192]
    - [75, 117.42]
  - - [128, 8192, 1, 128, 128, 128, 128, 128]
    - [6, 24.4]
  - - [128, 8192, 1, 256, 128, 128, 256, 256]
    - [24, 42.44]
  - - [128, 8192, 1, 512, 128, 128, 512, 512]
    - [24, 67.09]
  - - [128, 8192, 1, 1024, 128, 128, 1024, 1024]
    - [52, 99.74]
  - - [128, 8192, 1, 2048, 128, 128, 2048, 2048]
    - [49, 107.49]
  - - [128, 8192, 1, 4096, 128, 128, 4096, 4096]
    - [50, 124.24]
  - - [128, 8192, 1, 8192, 128, 128, 8192, 8192]
    - [50, 143.79]
  - - [256, 128, 1, 128, 256, 256, 128, 128]
    - [33, 1.36]
  - - [256, 128, 1, 256, 256, 256, 256, 256]
    - [71, 2.48]
  - - [256, 128, 1, 512, 256, 256, 512, 512]
    - [72, 4.58]
  - - [256, 128, 1, 1024, 256, 256, 1024, 1024]
    - [72, 7.75]
  - - [256, 128, 1, 2048, 256, 256, 2048, 2048]
    - [72, 11.86]
  - - [256, 128, 1, 4096, 256, 256, 4096, 4096]
    - [84, 16.34]
  - - [256, 128, 1, 8192, 256, 256, 8192, 8192]
    - [84, 20.18]
  - - [256, 256, 1, 128, 256, 256, 128, 128]
    - [35, 2.71]
  - - [256, 256, 1, 256, 256, 256, 256, 256]
    - [33, 5.01]
  - - [256, 256, 1, 512, 256, 256, 512, 512]
    - [72, 9.27]
  - - [256, 256, 1, 1024, 256, 256, 1024, 1024]
    - [72, 15.47]
  - - [256, 256, 1, 2048, 256, 256, 2048, 2048]
    - [84, 23.49]
  - - [256, 256, 1, 4096, 256, 256, 4096, 4096]
    - [83, 32.37]
  - - [256, 256, 1, 8192, 256, 256, 8192, 8192]
    - [84, 40.53]
  - - [256, 512, 1, 128, 256, 256, 128, 128]
    - [30, 5.04]
  - - [256, 512, 1, 256, 256, 256, 256, 256]
    - [31, 9.19]
  - - [256, 512, 1, 512, 256, 256, 512, 512]
    - [66, 16.13]
  - - [256, 512, 1, 1024, 256, 256, 1024, 1024]
    - [66, 26.29]
  - - [256, 512, 1, 2048, 256, 256, 2048, 2048]
    - [66, 38.41]
  - - [256, 512, 1, 4096, 256, 256, 4096, 4096]
    - [81, 50.05]
  - - [256, 512, 1, 8192, 256, 256, 8192, 8192]
    - [81, 59.28]
  - - [256, 1024, 1, 128, 256, 256, 128, 128]
    - [29, 9.12]
  - - [256, 1024, 1, 256, 256, 256, 256, 256]
    - [29, 16.63]
  - - [256, 1024, 1, 512, 256, 256, 512, 512]
    - [63, 27.98]
  - - [256, 1024, 1, 1024, 256, 256, 1024, 1024]
    - [64, 43.93]
  - - [256, 1024, 1, 2048, 256, 256, 2048, 2048]
    - [63, 61.51]
  - - [256, 1024, 1, 4096, 256, 256, 4096, 4096]
    - [63, 77.16]
  - - [256, 1024, 1, 8192, 256, 256, 8192, 8192]
    - [79, 85.74]
  - - [256, 2048, 1, 128, 256, 256, 128, 128]
    - [27, 15.62]
  - - [256, 2048, 1, 256, 256, 256, 256, 256]
    - [27, 27.67]
  - - [256, 2048, 1, 512, 256, 256, 512, 512]
    - [25, 45.09]
  - - [256, 2048, 1, 1024, 256, 256, 1024, 1024]
    - [60, 66.98]
  - - [256, 2048, 1, 2048, 256, 256, 2048, 2048]
    - [59, 89.73]
  - - [256, 2048, 1, 4096, 256, 256, 4096, 4096]
    - [59, 108.07]
  - - [256, 2048, 1, 8192, 256, 256, 8192, 8192]
    - [75, 118.25]
  - - [256, 4096, 1, 128, 256, 256, 128, 128]
    - [6, 24.4]
  - - [256, 4096, 1, 256, 256, 256, 256, 256]
    - [24, 42.45]
  - - [256, 4096, 1, 512, 256, 256, 512, 512]
    - [24, 67.59]
  - - [256, 4096, 1, 1024, 256, 256, 1024, 1024]
    - [52, 99.75]
  - - [256, 4096, 1, 2048, 256, 256, 2048, 2048]
    - [53, 132.17]
  - - [256, 4096, 1, 4096, 256, 256, 4096, 4096]
    - [51, 124.99]
  - - [256, 4096, 1, 8192, 256, 256, 8192, 8192]
    - [55, 144.81]
  - - [256, 8192, 1, 128, 256, 256, 128, 128]
    - [5, 34.4]
  - - [256, 8192, 1, 256, 256, 256, 256, 256]
    - [22, 58.5]
  - - [256, 8192, 1, 512, 256, 256, 512, 512]
    - [22, 91.77]
  - - [256, 8192, 1, 1024, 256, 256, 1024, 1024]
    - [22, 131.2]
  - - [256, 8192, 1, 2048, 256, 256, 2048, 2048]
    - [50, 140.71]
  - - [256, 8192, 1, 4096, 256, 256, 4096, 4096]
    - [39, 153.58]
  - - [256, 8192, 1, 8192, 256, 256, 8192, 8192]
    - [37, 178.23]
  - - [512, 128, 1, 128, 512, 512, 128, 128]
    - [34, 2.68]
  - - [512, 128, 1, 256, 512, 512, 256, 256]
    - [82, 4.91]
  - - [512, 128, 1, 512, 512, 512, 512, 512]
    - [73, 9.03]
  - - [512, 128, 1, 1024, 512, 512, 1024, 1024]
    - [72, 15.37]
  - - [512, 128, 1, 2048, 512, 512, 2048, 2048]
    - [72, 23.55]
  - - [512, 128, 1, 4096, 512, 512, 4096, 4096]
    - [84, 32.58]
  - - [512, 128, 1, 8192, 512, 512, 8192, 8192]
    - [84, 40.35]
  - - [512, 256, 1, 128, 512, 512, 128, 128]
    - [31, 5.09]
  - - [512, 256, 1, 256, 512, 512, 256, 256]
    - [31, 9.27]
  - - [512, 256, 1, 512, 512, 512, 512, 512]
    - [68, 16.18]
  - - [512, 256, 1, 1024, 512, 512, 1024, 1024]
    - [65, 26.25]
  - - [512, 256, 1, 2048, 512, 512, 2048, 2048]
    - [65, 37.95]
  - - [512, 256, 1, 4096, 512, 512, 4096, 4096]
    - [81, 49.82]
  - - [512, 256, 1, 8192, 512, 512, 8192, 8192]
    - [81, 59.28]
  - - [512, 512, 1, 128, 512, 512, 128, 128]
    - [28, 9.11]
  - - [512, 512, 1, 256, 512, 512, 256, 256]
    - [28, 16.6]
  - - [512, 512, 1, 512, 512, 512, 512, 512]
    - [63, 28.0]
  - - [512, 512, 1, 1024, 512, 512, 1024, 1024]
    - [63, 44.0]
  - - [512, 512, 1, 2048, 512, 512, 2048, 2048]
    - [63, 61.91]
  - - [512, 512, 1, 4096, 512, 512, 4096, 4096]
    - [63, 77.37]
  - - [512, 512, 1, 8192, 512, 512, 8192, 8192]
    - [79, 83.86]
  - - [512, 1024, 1, 128, 512, 512, 128, 128]
    - [25, 15.45]
  - - [512, 1024, 1, 256, 512, 512, 256, 256]
    - [27, 27.55]
  - - [512, 1024, 1, 512, 512, 512, 512, 512]
    - [60, 44.48]
  - - [512, 1024, 1, 1024, 512, 512, 1024, 1024]
    - [59, 67.03]
  - - [512, 1024, 1, 2048, 512, 512, 2048, 2048]
    - [60, 89.22]
  - - [512, 1024, 1, 4096, 512, 512, 4096, 4096]
    - [60, 107.93]
  - - [512, 1024, 1, 8192, 512, 512, 8192, 8192]
    - [77, 117.4]
  - - [512, 2048, 1, 128, 512, 512, 128, 128]
    - [6, 24.46]
  - - [512, 2048, 1, 256, 512, 512, 256, 256]
    - [24, 42.5]
  - - [512, 2048, 1, 512, 512, 512, 512, 512]
    - [24, 67.28]
  - - [512, 2048, 1, 1024, 512, 512, 1024, 1024]
    - [49, 99.82]
  - - [512, 2048, 1, 2048, 512, 512, 2048, 2048]
    - [52, 132.46]
  - - [512, 2048, 1, 4096, 512, 512, 4096, 4096]
    - [49, 126.28]
  - - [512, 2048, 1, 8192, 512, 512, 8192, 8192]
    - [56, 144.44]
  - - [512, 4096, 1, 128, 512, 512, 128, 128]
    - [5, 34.33]
  - - [512, 4096, 1, 256, 512, 512, 256, 256]
    - [22, 58.83]
  - - [512, 4096, 1, 512, 512, 512, 512, 512]
    - [22, 91.88]
  - - [512, 4096, 1, 1024, 512, 512, 1024, 1024]
    - [22, 130.8]
  - - [512, 4096, 1, 2048, 512, 512, 2048, 2048]
    - [22, 165.13]
  - - [512, 4096, 1, 4096, 512, 512, 4096, 4096]
    - [40, 154.64]
  - - [512, 4096, 1, 8192, 512, 512, 8192, 8192]
    - [45, 178.8]
  - - [512, 8192, 1, 128, 512, 512, 128, 128]
    - [1, 42.6]
  - - [512, 8192, 1, 256, 512, 512, 256, 256]
    - [13, 70.66]
  - - [512, 8192, 1, 512, 512, 512, 512, 512]
    - [11, 108.66]
  - - [512, 8192, 1, 1024, 512, 512, 1024, 1024]
    - [8, 143.99]
  - - [512, 8192, 1, 2048, 512, 512, 2048, 2048]
    - [21, 164.37]
  - - [512, 8192, 1, 4096, 512, 512, 4096, 4096]
    - [41, 157.74]
  - - [512, 8192, 1, 8192, 512, 512, 8192, 8192]
    - [43, 181.28]
  - - [1024, 128, 1, 128, 1024, 1024, 128, 128]
    - [31, 5.04]
  - - [1024, 128, 1, 256, 1024, 1024, 256, 256]
    - [31, 9.15]
  - - [1024, 128, 1, 512, 1024, 1024, 512, 512]
    - [66, 16.14]
  - - [1024, 128, 1, 1024, 1024, 1024, 1024, 1024]
    - [66, 26.2]
  - - [1024, 128, 1, 2048, 1024, 1024, 2048, 2048]
    - [66, 38.36]
  - - [1024, 128, 1, 4096, 1024, 1024, 4096, 4096]
    - [81, 49.99]
  - - [1024, 128, 1, 8192, 1024, 1024, 8192, 8192]
    - [81, 59.0]
  - - [1024, 256, 1, 128, 1024, 1024, 128, 128]
    - [28, 8.93]
  - - [1024, 256, 1, 256, 1024, 1024, 256, 256]
    - [63, 16.17]
  - - [1024, 256, 1, 512, 1024, 1024, 512, 512]
    - [63, 27.87]
  - - [1024, 256, 1, 1024, 1024, 1024, 1024, 1024]
    - [63, 43.92]
  - - [1024, 256, 1, 2048, 1024, 1024, 2048, 2048]
    - [63, 61.57]
  - - [1024, 256, 1, 4096, 1024, 1024, 4096, 4096]
    - [64, 77.26]
  - - [1024, 256, 1, 8192, 1024, 1024, 8192, 8192]
    - [80, 86.88]
  - - [1024, 512, 1, 128, 1024, 1024, 128, 128]
    - [27, 15.58]
  - - [1024, 512, 1, 256, 1024, 1024, 256, 256]
    - [27, 27.66]
  - - [1024, 512, 1, 512, 1024, 1024, 512, 512]
    - [26, 44.86]
  - - [1024, 512, 1, 1024, 1024, 1024, 1024, 1024]
    - [59, 66.94]
  - - [1024, 512, 1, 2048, 1024, 1024, 2048, 2048]
    - [60, 89.58]
  - - [1024, 512, 1, 4096, 1024, 1024, 4096, 4096]
    - [61, 107.01]
  - - [1024, 512, 1, 8192, 1024, 1024, 8192, 8192]
    - [77, 117.23]
  - - [1024, 1024, 1, 128, 1024, 1024, 128, 128]
    - [6, 24.46]
  - - [1024, 1024, 1, 256, 1024, 1024, 256, 256]
    - [24, 42.45]
  - - [1024, 1024, 1, 512, 1024, 1024, 512, 512]
    - [24, 67.2]
  - - [1024, 1024, 1, 1024, 1024, 1024, 1024, 1024]
    - [49, 99.69]
  - - [1024, 1024, 1, 2048, 1024, 1024, 2048, 2048]
    - [54, 132.14]
  - - [1024, 1024, 1, 4096, 1024, 1024, 4096, 4096]
    - [49, 125.27]
  - - [1024, 1024, 1, 8192, 1024, 1024, 8192, 8192]
    - [55, 144.18]
  - - [1024, 2048, 1, 128, 1024, 1024, 128, 128]
    - [4, 34.31]
  - - [1024, 2048, 1, 256, 1024, 1024, 256, 256]
    - [22, 58.47]
  - - [1024, 2048, 1, 512, 1024, 1024, 512, 512]
    - [19, 91.7]
  - - [1024, 2048, 1, 1024, 1024, 1024, 1024, 1024]
    - [22, 131.07]
  - - [1024, 2048, 1, 2048, 1024, 1024, 2048, 2048]
    - [22, 165.13]
  - - [1024, 2048, 1, 4096, 1024, 1024, 4096, 4096]
    - [44, 155.06]
  - - [1024, 2048, 1, 8192, 1024, 1024, 8192, 8192]
    - [45, 179.42]
  - - [1024, 4096, 1, 128, 1024, 1024, 128, 128]
    - [1, 42.57]
  - - [1024, 4096, 1, 256, 1024, 1024, 256, 256]
    - [9, 70.72]
  - - [1024, 4096, 1, 512, 1024, 1024, 512, 512]
    - [11, 108.67]
  - - [1024, 4096, 1, 1024, 1024, 1024, 1024, 1024]
    - [9, 151.84]
  - - [1024, 4096, 1, 2048, 1024, 1024, 2048, 2048]
    - [19, 165.64]
  - - [1024, 4096, 1, 4096, 1024, 1024, 4096, 4096]
    - [8, 178.76]
  - - [1024, 4096, 1, 8192, 1024, 1024, 8192, 8192]
    - [8, 198.48]
  - - [1024, 8192, 1, 128, 1024, 1024, 128, 128]
    - [1, 45.67]
  - - [1024, 8192, 1, 256, 1024, 1024, 256, 256]
    - [8, 74.8]
  - - [1024, 8192, 1, 512, 1024, 1024, 512, 512]
    - [8, 113.41]
  - - [1024, 8192, 1, 1024, 1024, 1024, 1024, 1024]
    - [9, 155.22]
  - - [1024, 8192, 1, 2048, 1024, 1024, 2048, 2048]
    - [23, 169.17]
  - - [1024, 8192, 1, 4096, 1024, 1024, 4096, 4096]
    - [8, 181.45]
  - - [1024, 8192, 1, 8192, 1024, 1024, 8192, 8192]
    - [8, 199.72]
  - - [2048, 128, 1, 128, 2048, 2048, 128, 128]
    - [29, 9.21]
  - - [2048, 128, 1, 256, 2048, 2048, 256, 256]
    - [29, 16.56]
  - - [2048, 128, 1, 512, 2048, 2048, 512, 512]
    - [63, 27.99]
  - - [2048, 128, 1, 1024, 2048, 2048, 1024, 1024]
    - [63, 43.86]
  - - [2048, 128, 1, 2048, 2048, 2048, 2048, 2048]
    - [63, 61.51]
  - - [2048, 128, 1, 4096, 2048, 2048, 4096, 4096]
    - [63, 76.85]
  - - [2048, 128, 1, 8192, 2048, 2048, 8192, 8192]
    - [78, 84.34]
  - - [2048, 256, 1, 128, 2048, 2048, 128, 128]
    - [25, 15.39]
  - - [2048, 256, 1, 256, 2048, 2048, 256, 256]
    - [25, 27.28]
  - - [2048, 256, 1, 512, 2048, 2048, 512, 512]
    - [25, 44.55]
  - - [2048, 256, 1, 1024, 2048, 2048, 1024, 1024]
    - [59, 66.63]
  - - [2048, 256, 1, 2048, 2048, 2048, 2048, 2048]
    - [60, 89.45]
  - - [2048, 256, 1, 4096, 2048, 2048, 4096, 4096]
    - [62, 107.06]
  - - [2048, 256, 1, 8192, 2048, 2048, 8192, 8192]
    - [74, 116.67]
  - - [2048, 512, 1, 128, 2048, 2048, 128, 128]
    - [24, 24.32]
  - - [2048, 512, 1, 256, 2048, 2048, 256, 256]
    - [24, 42.27]
  - - [2048, 512, 1, 512, 2048, 2048, 512, 512]
    - [24, 67.17]
  - - [2048, 512, 1, 1024, 2048, 2048, 1024, 1024]
    - [52, 99.74]
  - - [2048, 512, 1, 2048, 2048, 2048, 2048, 2048]
    - [52, 131.55]
  - - [2048, 512, 1, 4096, 2048, 2048, 4096, 4096]
    - [58, 146.64]
  - - [2048, 512, 1, 8192, 2048, 2048, 8192, 8192]
    - [57, 143.8]
  - - [2048, 1024, 1, 128, 2048, 2048, 128, 128]
    - [4, 34.3]
  - - [2048, 1024, 1, 256, 2048, 2048, 256, 256]
    - [20, 58.03]
  - - [2048, 1024, 1, 512, 2048, 2048, 512, 512]
    - [22, 91.73]
  - - [2048, 1024, 1, 1024, 2048, 2048, 1024, 1024]
    - [22, 130.92]
  - - [2048, 1024, 1, 2048, 2048, 2048, 2048, 2048]
    - [37, 157.83]
  - - [2048, 1024, 1, 4096, 2048, 2048, 4096, 4096]
    - [47, 154.06]
  - - [2048, 1024, 1, 8192, 2048, 2048, 8192, 8192]
    - [48, 178.01]
  - - [2048, 2048, 1, 128, 2048, 2048, 128, 128]
    - [1, 42.4]
  - - [2048, 2048, 1, 256, 2048, 2048, 256, 256]
    - [2, 70.5]
  - - [2048, 2048, 1, 512, 2048, 2048, 512, 512]
    - [11, 108.93]
  - - [2048, 2048, 1, 1024, 2048, 2048, 1024, 1024]
    - [18, 144.53]
  - - [2048, 2048, 1, 2048, 2048, 2048, 2048, 2048]
    - [8, 160.64]
  - - [2048, 2048, 1, 4096, 2048, 2048, 4096, 4096]
    - [46, 156.93]
  - - [2048, 2048, 1, 8192, 2048, 2048, 8192, 8192]
    - [46, 181.04]
  - - [2048, 4096, 1, 128, 2048, 2048, 128, 128]
    - [0, 45.77]
  - - [2048, 4096, 1, 256, 2048, 2048, 256, 256]
    - [12, 75.0]
  - - [2048, 4096, 1, 512, 2048, 2048, 512, 512]
    - [8, 113.76]
  - - [2048, 4096, 1, 1024, 2048, 2048, 1024, 1024]
    - [17, 150.61]
  - - [2048, 4096, 1, 2048, 2048, 2048, 2048, 2048]
    - [8, 163.91]
  - - [2048, 4096, 1, 4096, 2048, 2048, 4096, 4096]
    - [46, 159.66]
  - - [2048, 4096, 1, 8192, 2048, 2048, 8192, 8192]
    - [43, 182.92]
  - - [2048, 8192, 1, 128, 2048, 2048, 128, 128]
    - [0, 48.42]
  - - [2048, 8192, 1, 256, 2048, 2048, 256, 256]
    - [8, 78.61]
  - - [2048, 8192, 1, 512, 2048, 2048, 512, 512]
    - [8, 117.61]
  - - [2048, 8192, 1, 1024, 2048, 2048, 1024, 1024]
    - [17, 154.03]
  - - [2048, 8192, 1, 2048, 2048, 2048, 2048, 2048]
    - [8, 166.23]
  - - [2048, 8192, 1, 4096, 2048, 2048, 4096, 4096]
    - [40, 160.64]
  - - [2048, 8192, 1, 8192, 2048, 2048, 8192, 8192]
    - [43, 183.42]
  - - [4096, 128, 1, 128, 4096, 4096, 128, 128]
    - [7, 15.36]
  - - [4096, 128, 1, 256, 4096, 4096, 256, 256]
    - [27, 27.55]
  - - [4096, 128, 1, 512, 4096, 4096, 512, 512]
    - [25, 44.82]
  - - [4096, 128, 1, 1024, 4096, 4096, 1024, 1024]
    - [60, 67.02]
  - - [4096, 128, 1, 2048, 4096, 4096, 2048, 2048]
    - [60, 89.7]
  - - [4096, 128, 1, 4096, 4096, 4096, 4096, 4096]
    - [75, 99.35]
  - - [4096, 128, 1, 8192, 4096, 4096, 8192, 8192]
    - [76, 116.11]
  - - [4096, 256, 1, 128, 4096, 4096, 128, 128]
    - [6, 24.31]
  - - [4096, 256, 1, 256, 4096, 4096, 256, 256]
    - [24, 42.12]
  - - [4096, 256, 1, 512, 4096, 4096, 512, 512]
    - [24, 67.06]
  - - [4096, 256, 1, 1024, 4096, 4096, 1024, 1024]
    - [52, 99.59]
  - - [4096, 256, 1, 2048, 4096, 4096, 2048, 2048]
    - [52, 131.68]
  - - [4096, 256, 1, 4096, 4096, 4096, 4096, 4096]
    - [49, 125.22]
  - - [4096, 256, 1, 8192, 4096, 4096, 8192, 8192]
    - [58, 142.55]
  - - [4096, 512, 1, 128, 4096, 4096, 128, 128]
    - [3, 34.2]
  - - [4096, 512, 1, 256, 4096, 4096, 256, 256]
    - [22, 58.56]
  - - [4096, 512, 1, 512, 4096, 4096, 512, 512]
    - [20, 91.59]
  - - [4096, 512, 1, 1024, 4096, 4096, 1024, 1024]
    - [22, 130.95]
  - - [4096, 512, 1, 2048, 4096, 4096, 2048, 2048]
    - [37, 157.7]
  - - [4096, 512, 1, 4096, 4096, 4096, 4096, 4096]
    - [40, 154.76]
  - - [4096, 512, 1, 8192, 4096, 4096, 8192, 8192]
    - [42, 178.57]
  - - [4096, 1024, 1, 128, 4096, 4096, 128, 128]
    - [1, 42.39]
  - - [4096, 1024, 1, 256, 4096, 4096, 256, 256]
    - [9, 70.6]
  - - [4096, 1024, 1, 512, 4096, 4096, 512, 512]
    - [11, 108.71]
  - - [4096, 1024, 1, 1024, 4096, 4096, 1024, 1024]
    - [8, 143.68]
  - - [4096, 1024, 1, 2048, 4096, 4096, 2048, 2048]
    - [17, 180.15]
  - - [4096, 1024, 1, 4096, 4096, 4096, 4096, 4096]
    - [17, 178.21]
  - - [4096, 1024, 1, 8192, 4096, 4096, 8192, 8192]
    - [17, 199.0]
  - - [4096, 2048, 1, 128, 4096, 4096, 128, 128]
    - [0, 45.69]
  - - [4096, 2048, 1, 256, 4096, 4096, 256, 256]
    - [12, 75.2]
  - - [4096, 2048, 1, 512, 4096, 4096, 512, 512]
    - [8, 113.32]
  - - [4096, 2048, 1, 1024, 4096, 4096, 1024, 1024]
    - [17, 151.4]
  - - [4096, 2048, 1, 2048, 4096, 4096, 2048, 2048]
    - [15, 179.18]
  - - [4096, 2048, 1, 4096, 4096, 4096, 4096, 4096]
    - [14, 180.8]
  - - [4096, 2048, 1, 8192, 4096, 4096, 8192, 8192]
    - [14, 200.4]
  - - [4096, 4096, 1, 128, 4096, 4096, 128, 128]
    - [0, 48.29]
  - - [4096, 4096, 1, 256, 4096, 4096, 256, 256]
    - [8, 78.44]
  - - [4096, 4096, 1, 512, 4096, 4096, 512, 512]
    - [8, 117.25]
  - - [4096, 4096, 1, 1024, 4096, 4096, 1024, 1024]
    - [17, 152.04]
  - - [4096, 4096, 1, 2048, 4096, 4096, 2048, 2048]
    - [15, 181.86]
  - - [4096, 4096, 1, 4096, 4096, 4096, 4096, 4096]
    - [15, 182.18]
  - - [4096, 4096, 1, 8192, 4096, 4096, 8192, 8192]
    - [14, 201.28]
  - - [4096, 8192, 1, 128, 4096, 4096, 128, 128]
    - [0, 49.9]
  - - [4096, 8192, 1, 256, 4096, 4096, 256, 256]
    - [8, 80.58]
  - - [4096, 8192, 1, 512, 4096, 4096, 512, 512]
    - [8, 119.66]
  - - [4096, 8192, 1, 1024, 4096, 4096, 1024, 1024]
    - [17, 153.99]
  - - [4096, 8192, 1, 2048, 4096, 4096, 2048, 2048]
    - [16, 182.32]
  - - [4096, 8192, 1, 4096, 4096, 4096, 4096, 4096]
    - [14, 183.01]
  - - [4096, 8192, 1, 8192, 4096, 4096, 8192, 8192]
    - [14, 201.39]
  - - [8192, 128, 1, 128, 8192, 8192, 128, 128]
    - [24, 24.11]
  - - [8192, 128, 1, 256, 8192, 8192, 256, 256]
    - [24, 42.23]
  - - [8192, 128, 1, 512, 8192, 8192, 512, 512]
    - [52, 66.63]
  - - [8192, 128, 1, 1024, 8192, 8192, 1024, 1024]
    - [52, 99.42]
  - - [8192, 128, 1, 2048, 8192, 8192, 2048, 2048]
    - [49, 107.41]
  - - [8192, 128, 1, 4096, 8192, 8192, 4096, 4096]
    - [49, 124.31]
  - - [8192, 128, 1, 8192, 8192, 8192, 8192, 8192]
    - [51, 140.64]
  - - [8192, 256, 1, 128, 8192, 8192, 128, 128]
    - [4, 34.16]
  - - [8192, 256, 1, 256, 8192, 8192, 256, 256]
    - [22, 58.62]
  - - [8192, 256, 1, 512, 8192, 8192, 512, 512]
    - [22, 91.65]
  - - [8192, 256, 1, 1024, 8192, 8192, 1024, 1024]
    - [22, 130.74]
  - - [8192, 256, 1, 2048, 8192, 8192, 2048, 2048]
    - [37, 138.91]
  - - [8192, 256, 1, 4096, 8192, 8192, 4096, 4096]
    - [40, 154.98]
  - - [8192, 256, 1, 8192, 8192, 8192, 8192, 8192]
    - [38, 177.31]
  - - [8192, 512, 1, 128, 8192, 8192, 128, 128]
    - [1, 42.56]
  - - [8192, 512, 1, 256, 8192, 8192, 256, 256]
    - [13, 70.62]
  - - [8192, 512, 1, 512, 8192, 8192, 512, 512]
    - [11, 108.78]
  - - [8192, 512, 1, 1024, 8192, 8192, 1024, 1024]
    - [8, 143.71]
  - - [8192, 512, 1, 2048, 8192, 8192, 2048, 2048]
    - [14, 161.45]
  - - [8192, 512, 1, 4096, 8192, 8192, 4096, 4096]
    - [39, 157.92]
  - - [8192, 512, 1, 8192, 8192, 8192, 8192, 8192]
    - [48, 180.27]
  - - [8192, 1024, 1, 128, 8192, 8192, 128, 128]
    - [1, 45.82]
  - - [8192, 1024, 1, 256, 8192, 8192, 256, 256]
    - [12, 75.03]
  - - [8192, 1024, 1, 512, 8192, 8192, 512, 512]
    - [10, 111.88]
  - - [8192, 1024, 1, 1024, 8192, 8192, 1024, 1024]
    - [17, 146.84]
  - - [8192, 1024, 1, 2048, 8192, 8192, 2048, 2048]
    - [14, 168.53]
  - - [8192, 1024, 1, 4096, 8192, 8192, 4096, 4096]
    - [14, 180.85]
  - - [8192, 1024, 1, 8192, 8192, 8192, 8192, 8192]
    - [17, 200.14]
  - - [8192, 2048, 1, 128, 8192, 8192, 128, 128]
    - [0, 48.21]
  - - [8192, 2048, 1, 256, 8192, 8192, 256, 256]
    - [8, 78.29]
  - - [8192, 2048, 1, 512, 8192, 8192, 512, 512]
    - [8, 116.83]
  - - [8192, 2048, 1, 1024, 8192, 8192, 1024, 1024]
    - [17, 155.18]
  - - [8192, 2048, 1, 2048, 8192, 8192, 2048, 2048]
    - [14, 168.84]
  - - [8192, 2048, 1, 4096, 8192, 8192, 4096, 4096]
    - [15, 182.36]
  - - [8192, 2048, 1, 8192, 8192, 8192, 8192, 8192]
    - [14, 201.24]
  - - [8192, 4096, 1, 128, 8192, 8192, 128, 128]
    - [0, 49.84]
  - - [8192, 4096, 1, 256, 8192, 8192, 256, 256]
    - [8, 80.61]
  - - [8192, 4096, 1, 512, 8192, 8192, 512, 512]
    - [8, 119.68]
  - - [8192, 4096, 1, 1024, 8192, 8192, 1024, 1024]
    - [15, 151.13]
  - - [8192, 4096, 1, 2048, 8192, 8192, 2048, 2048]
    - [14, 170.09]
  - - [8192, 4096, 1, 4096, 8192, 8192, 4096, 4096]
    - [15, 183.11]
  - - [8192, 4096, 1, 8192, 8192, 8192, 8192, 8192]
    - [14, 201.49]
  - - [8192, 8192, 1, 128, 8192, 8192, 128, 128]
    - [0, 50.49]
  - - [8192, 8192, 1, 256, 8192, 8192, 256, 256]
    - [8, 81.58]
  - - [8192, 8192, 1, 512, 8192, 8192, 512, 512]
    - [8, 120.83]
  - - [8192, 8192, 1, 1024, 8192, 8192, 1024, 1024]
    - [14, 153.1]
  - - [8192, 8192, 1, 2048, 8192, 8192, 2048, 2048]
    - [14, 170.73]
  - - [8192, 8192, 1, 4096, 8192, 8192, 4096, 4096]
    - [14, 183.78]
  - - [8192, 8192, 1, 8192, 8192, 8192, 8192, 8192]
    - [14, 201.67]
  - - [1, 1, 1, 32, 1, 1, 32, 32]
    - [85, 0.0]
- null
- null
- ExperimentalStreamK
- GridBased
