projects/hipblaslt/library/src/amd_detail/rocblaslt/src/Tensile/Logic/asm_full/aquavanjaram/gfx942_64cu/StreamK/aquavanjaram942_Cijk_Alik_Bjlk_I8II_BH_UserArgs.yaml
- {MinimumRequiredVersion: 4.33.0}
- aquavanjaram942
- {Architecture: gfx942, CUCount: 64}
- [Device 0049, Device 0050]
    SolutionIndex: 0
    SolutionNameMin: Cijk_Alik_Bjlk_I8II_BH_UserArgs_MT256x256x32_MI16x16x1_SN_CLR0_GSU0_GSUC0_GSUWGMRR0_K1_LBSPPA128_LBSPPB2048_LPB0_MIWT8_8_PLR0_SU0_SUM0_SUS32_SKXCCM8_VWA4_VWB8_WGM1_WGMXCC1_WGMXCCGn1
    SolutionIndex: 1
    SolutionNameMin: Cijk_Alik_Bjlk_I8II_BH_UserArgs_MT256x256x32_MI16x16x1_SN_CLR0_GSU0_GSUC0_GSUWGMRR0_K1_LBSPPA128_LBSPPB2048_LPB0_MIWT8_8_PLR0_SU0_SUM0_SUS32_SKXCCM8_VWA4_VWB8_WGM1_WGMXCC1_WGMXCCGn1
    SolutionIndex: 2
    SolutionNameMin: Cijk_Alik_Bjlk_I8II_BH_UserArgs_MT256x256x32_MI16x16x1_SN_CLR0_GSU0_GSUC0_GSUWGMRR0_K1_LBSPPA128_LBSPPB2048_LPB0_MIWT8_8_PLR0_SU0_SUM0_SUS32_SKXCCM8_VWA4_VWB8_WGM4_WGMXCC1_WGMXCCGn1
    SolutionIndex: 3
    SolutionNameMin: Cijk_Alik_Bjlk_I8II_BH_UserArgs_MT256x256x32_MI16x16x1_SN_CLR0_GSU0_GSUC0_GSUWGMRR0_K1_LBSPPA128_LBSPPB2048_LPB0_MIWT8_8_PLR0_SU0_SUM0_SUS32_SKXCCM8_VWA4_VWB8_WGM8_WGMXCC1_WGMXCCGn1
    SolutionIndex: 4
    SolutionNameMin: Cijk_Alik_Bjlk_I8II_BH_UserArgs_MT256x128x32_MI16x16x1_SN_CLR0_GSU0_GSUC0_GSUWGMRR0_K1_LBSPPA128_LBSPPB1024_LPB64_MIWT8_4_PLR0_SU0_SUM0_SUS32_SKXCCM8_VWA4_VWB4_WGM1_WGMXCC1_WGMXCCGn1
    SolutionIndex: 5
    SolutionNameMin: Cijk_Alik_Bjlk_I8II_BH_UserArgs_MT256x128x32_MI16x16x1_SN_CLR0_GSU0_GSUC0_GSUWGMRR0_K1_LBSPPA128_LBSPPB1024_LPB64_MIWT8_4_PLR0_SU0_SUM0_SUS32_SKXCCM8_VWA4_VWB4_WGM1_WGMXCC1_WGMXCCGn1
    SolutionIndex: 6
    SolutionNameMin: Cijk_Alik_Bjlk_I8II_BH_UserArgs_MT256x128x32_MI16x16x1_SN_CLR0_GSU0_GSUC0_GSUWGMRR0_K1_LBSPPA128_LBSPPB1024_LPB64_MIWT8_4_PLR0_SU0_SUM0_SUS32_SKXCCM8_VWA4_VWB4_WGM4_WGMXCC1_WGMXCCGn1
    SolutionIndex: 7
    SolutionNameMin: Cijk_Alik_Bjlk_I8II_BH_UserArgs_MT128x32x32_MI16x16x1_SN_CLR0_GSU0_GSUC0_GSUWGMRR0_K1_LBSPPA128_LBSPPB256_LPB16_MIWT4_1_PLR0_SU0_SUM0_SUS32_SKXCCM8_VWA1_VWB1_WGM1_WGMXCC1_WGMXCCGn1
    SolutionIndex: 8
    SolutionNameMin: Cijk_Alik_Bjlk_I8II_BH_UserArgs_MT128x32x32_MI16x16x1_SN_CLR0_GSU0_GSUC0_GSUWGMRR0_K1_LBSPPA128_LBSPPB256_LPB16_MIWT4_1_PLR0_SU0_SUM0_SUS32_SKXCCM8_VWA4_VWB1_WGM1_WGMXCC1_WGMXCCGn1
    SolutionIndex: 9
    SolutionNameMin: Cijk_Alik_Bjlk_I8II_BH_UserArgs_MT256x256x64_MI16x16x1_SN_CLR1_GSU0_GSUC0_GSUWGMRR0_K1_LBSPPA256_LBSPPB2048_LPB16_MIWT8_8_PLR1_SU0_SUM0_SUS64_SKXCCM8_VWA4_VWB1_WGM1_WGMXCC1_WGMXCCGn1
    SolutionIndex: 10
    SolutionNameMin: Cijk_Alik_Bjlk_I8II_BH_UserArgs_MT256x256x64_MI16x16x1_SN_CLR1_GSU0_GSUC0_GSUWGMRR0_K1_LBSPPA256_LBSPPB2048_LPB32_MIWT8_8_PLR1_SU0_SUM0_SUS64_SKXCCM8_VWA4_VWB2_WGM1_WGMXCC1_WGMXCCGn1
    SolutionIndex: 11
    SolutionNameMin: Cijk_Alik_Bjlk_I8II_BH_UserArgs_MT256x256x64_MI16x16x1_SN_CLR1_GSU0_GSUC0_GSUWGMRR0_K1_LBSPPA256_LBSPPB2048_LPB64_MIWT8_8_PLR1_SU0_SUM0_SUS64_SKXCCM8_VWA4_VWB4_WGM1_WGMXCC1_WGMXCCGn1
    SolutionIndex: 12
    SolutionNameMin: Cijk_Alik_Bjlk_I8II_BH_UserArgs_MT256x256x64_MI16x16x1_SN_CLR1_GSU0_GSUC0_GSUWGMRR0_K1_LBSPPA256_LBSPPB2048_LPB0_MIWT8_8_PLR1_SU0_SUM0_SUS64_SKXCCM8_VWA4_VWB8_WGM1_WGMXCC1_WGMXCCGn1
    SolutionIndex: 13
    SolutionNameMin: Cijk_Alik_Bjlk_I8II_BH_UserArgs_MT256x256x64_MI16x16x1_SN_CLR1_GSU0_GSUC0_GSUWGMRR0_K1_LBSPPA256_LBSPPB2048_LPB0_MIWT8_8_PLR1_SU0_SUM0_SUS64_SKXCCM8_VWA4_VWB8_WGM1_WGMXCC1_WGMXCCGn1
    SolutionIndex: 14
    SolutionNameMin: Cijk_Alik_Bjlk_I8II_BH_UserArgs_MT256x256x64_MI16x16x1_SN_CLR1_GSU0_GSUC0_GSUWGMRR0_K1_LBSPPA256_LBSPPB2048_LPB64_MIWT8_8_PLR1_SU0_SUM0_SUS64_SKXCCM8_VWA4_VWB4_WGM4_WGMXCC1_WGMXCCGn1
    SolutionIndex: 15
    SolutionNameMin: Cijk_Alik_Bjlk_I8II_BH_UserArgs_MT256x256x64_MI16x16x1_SN_CLR1_GSU0_GSUC0_GSUWGMRR0_K1_LBSPPA256_LBSPPB2048_LPB0_MIWT8_8_PLR1_SU0_SUM0_SUS64_SKXCCM8_VWA4_VWB8_WGM4_WGMXCC1_WGMXCCGn1
    SolutionIndex: 16
    SolutionNameMin: Cijk_Alik_Bjlk_I8II_BH_UserArgs_MT256x256x64_MI16x16x1_SN_CLR1_GSU0_GSUC0_GSUWGMRR0_K1_LBSPPA256_LBSPPB2048_LPB0_MIWT8_8_PLR1_SU0_SUM0_SUS64_SKXCCM8_VWA4_VWB8_WGM4_WGMXCC1_WGMXCCGn1
    SolutionIndex: 17
    SolutionNameMin: Cijk_Alik_Bjlk_I8II_BH_UserArgs_MT256x256x64_MI16x16x1_SN_CLR1_GSU0_GSUC0_GSUWGMRR0_K1_LBSPPA256_LBSPPB2048_LPB64_MIWT8_8_PLR1_SU0_SUM0_SUS64_SKXCCM8_VWA4_VWB4_WGM8_WGMXCC1_WGMXCCGn1
    SolutionIndex: 18
    SolutionNameMin: Cijk_Alik_Bjlk_I8II_BH_UserArgs_MT256x256x64_MI16x16x1_SN_CLR1_GSU0_GSUC0_GSUWGMRR0_K1_LBSPPA256_LBSPPB2048_LPB0_MIWT8_8_PLR1_SU0_SUM0_SUS64_SKXCCM8_VWA4_VWB8_WGM8_WGMXCC1_WGMXCCGn1
    SolutionIndex: 19
    SolutionNameMin: Cijk_Alik_Bjlk_I8II_BH_UserArgs_MT256x256x64_MI16x16x1_SN_CLR1_GSU0_GSUC0_GSUWGMRR0_K1_LBSPPA256_LBSPPB2048_LPB64_MIWT8_8_PLR1_SU0_SUM0_SUS64_SKXCCM8_VWA4_VWB4_WGM8_WGMXCC1_WGMXCCGn1
    SolutionIndex: 20
    SolutionNameMin: Cijk_Alik_Bjlk_I8II_BH_UserArgs_MT256x256x64_MI16x16x1_SN_CLR1_GSU0_GSUC0_GSUWGMRR0_K1_LBSPPA128_LBSPPB2048_LPB0_MIWT8_8_PLR1_SU0_SUM0_SUS64_SKXCCM8_VWA1_VWB8_WGM8_WGMXCC1_WGMXCCGn1
    SolutionIndex: 21
    SolutionNameMin: Cijk_Alik_Bjlk_I8II_BH_UserArgs_MT256x256x64_MI16x16x1_SN_CLR1_GSU0_GSUC0_GSUWGMRR0_K1_LBSPPA256_LBSPPB2048_LPB0_MIWT8_8_PLR1_SU0_SUM0_SUS64_SKXCCM8_VWA4_VWB8_WGM8_WGMXCC1_WGMXCCGn1
    SolutionIndex: 22
    SolutionNameMin: Cijk_Alik_Bjlk_I8II_BH_UserArgs_MT128x256x64_MI16x16x1_SN_CLR1_GSU0_GSUC0_GSUWGMRR0_K1_LBSPPA256_LBSPPB2048_LPB0_MIWT4_8_PLR1_SU0_SUM0_SUS64_SKXCCM8_VWA4_VWB8_WGM1_WGMXCC1_WGMXCCGn1
    SolutionIndex: 23
    SolutionNameMin: Cijk_Alik_Bjlk_I8II_BH_UserArgs_MT128x256x64_MI16x16x1_SN_CLR1_GSU0_GSUC0_GSUWGMRR0_K1_LBSPPA256_LBSPPB2048_LPB0_MIWT4_8_PLR1_SU0_SUM0_SUS64_SKXCCM8_VWA4_VWB8_WGM1_WGMXCC1_WGMXCCGn1
    SolutionIndex: 24
    SolutionNameMin: Cijk_Alik_Bjlk_I8II_BH_UserArgs_MT128x256x64_MI16x16x1_SN_CLR1_GSU0_GSUC0_GSUWGMRR0_K1_LBSPPA256_LBSPPB2048_LPB0_MIWT4_8_PLR1_SU0_SUM0_SUS64_SKXCCM8_VWA4_VWB8_WGM1_WGMXCC1_WGMXCCGn1
    SolutionIndex: 25
    SolutionNameMin: Cijk_Alik_Bjlk_I8II_BH_UserArgs_MT128x256x64_MI16x16x1_SN_CLR1_GSU0_GSUC0_GSUWGMRR0_K1_LBSPPA256_LBSPPB2048_LPB0_MIWT4_8_PLR1_SU0_SUM0_SUS64_SKXCCM8_VWA4_VWB8_WGM4_WGMXCC1_WGMXCCGn1
    SolutionIndex: 26
    SolutionNameMin: Cijk_Alik_Bjlk_I8II_BH_UserArgs_MT128x256x64_MI16x16x1_SN_CLR1_GSU0_GSUC0_GSUWGMRR0_K1_LBSPPA256_LBSPPB2048_LPB0_MIWT4_8_PLR1_SU0_SUM0_SUS64_SKXCCM8_VWA4_VWB8_WGM8_WGMXCC1_WGMXCCGn1
    SolutionIndex: 27
    SolutionNameMin: Cijk_Alik_Bjlk_I8II_BH_UserArgs_MT256x128x64_MI16x16x1_SN_CLR1_GSU0_GSUC0_GSUWGMRR0_K1_LBSPPA256_LBSPPB1024_LPB64_MIWT8_4_PLR1_SU0_SUM0_SUS64_SKXCCM8_VWA4_VWB4_WGM1_WGMXCC1_WGMXCCGn1
    SolutionIndex: 28
    SolutionNameMin: Cijk_Alik_Bjlk_I8II_BH_UserArgs_MT256x128x64_MI16x16x1_SN_CLR1_GSU0_GSUC0_GSUWGMRR0_K1_LBSPPA256_LBSPPB1024_LPB32_MIWT8_4_PLR1_SU0_SUM0_SUS64_SKXCCM8_VWA4_VWB2_WGM1_WGMXCC1_WGMXCCGn1
    SolutionIndex: 29
    SolutionNameMin: Cijk_Alik_Bjlk_I8II_BH_UserArgs_MT256x128x64_MI16x16x1_SN_CLR1_GSU0_GSUC0_GSUWGMRR0_K1_LBSPPA256_LBSPPB1024_LPB64_MIWT8_4_PLR1_SU0_SUM0_SUS64_SKXCCM8_VWA4_VWB4_WGM4_WGMXCC1_WGMXCCGn1
    SolutionIndex: 30
    SolutionNameMin: Cijk_Alik_Bjlk_I8II_BH_UserArgs_MT256x128x64_MI16x16x1_SN_CLR1_GSU0_GSUC0_GSUWGMRR0_K1_LBSPPA256_LBSPPB1024_LPB64_MIWT8_4_PLR1_SU0_SUM0_SUS64_SKXCCM8_VWA4_VWB4_WGM4_WGMXCC1_WGMXCCGn1
    SolutionIndex: 31
    SolutionNameMin: Cijk_Alik_Bjlk_I8II_BH_UserArgs_MT256x128x64_MI16x16x1_SN_CLR1_GSU0_GSUC0_GSUWGMRR0_K1_LBSPPA256_LBSPPB1024_LPB64_MIWT8_4_PLR1_SU0_SUM0_SUS64_SKXCCM8_VWA4_VWB4_WGM8_WGMXCC1_WGMXCCGn1
    SolutionIndex: 32
    SolutionNameMin: Cijk_Alik_Bjlk_I8II_BH_UserArgs_MT256x64x64_MI16x16x1_SN_CLR1_GSU0_GSUC0_GSUWGMRR0_K1_LBSPPA256_LBSPPB512_LPB32_MIWT8_2_PLR1_SU0_SUM0_SUS64_SKXCCM8_VWA4_VWB2_WGM1_WGMXCC1_WGMXCCGn1
    SolutionIndex: 33
    SolutionNameMin: Cijk_Alik_Bjlk_I8II_BH_UserArgs_MT128x128x64_MI16x16x1_SN_CLR1_GSU0_GSUC0_GSUWGMRR0_K1_LBSPPA256_LBSPPB1024_LPB32_MIWT4_4_PLR1_SU0_SUM0_SUS64_SKXCCM8_VWA4_VWB2_WGM1_WGMXCC1_WGMXCCGn1
    SolutionIndex: 34
    SolutionNameMin: Cijk_Alik_Bjlk_I8II_BH_UserArgs_MT128x128x64_MI16x16x1_SN_CLR1_GSU0_GSUC0_GSUWGMRR0_K1_LBSPPA128_LBSPPB1024_LPB64_MIWT4_4_PLR1_SU0_SUM0_SUS64_SKXCCM8_VWA1_VWB4_WGM1_WGMXCC1_WGMXCCGn1
    SolutionIndex: 35
    SolutionNameMin: Cijk_Alik_Bjlk_I8II_BH_UserArgs_MT128x128x64_MI16x16x1_SN_CLR1_GSU0_GSUC0_GSUWGMRR0_K1_LBSPPA256_LBSPPB1024_LPB64_MIWT4_4_PLR1_SU0_SUM0_SUS64_SKXCCM8_VWA4_VWB4_WGM1_WGMXCC1_WGMXCCGn1
    SolutionIndex: 36
    SolutionNameMin: Cijk_Alik_Bjlk_I8II_BH_UserArgs_MT128x128x64_MI16x16x1_SN_CLR1_GSU0_GSUC0_GSUWGMRR0_K1_LBSPPA256_LBSPPB1024_LPB64_MIWT4_4_PLR1_SU0_SUM0_SUS64_SKXCCM8_VWA4_VWB4_WGM8_WGMXCC1_WGMXCCGn1
    SolutionIndex: 37
    SolutionNameMin: Cijk_Alik_Bjlk_I8II_BH_UserArgs_MT64x128x64_MI16x16x1_SN_CLR1_GSU0_GSUC0_GSUWGMRR0_K1_LBSPPA128_LBSPPB1024_LPB64_MIWT2_4_PLR1_SU0_SUM0_SUS64_SKXCCM8_VWA1_VWB4_WGM1_WGMXCC1_WGMXCCGn1
    SolutionIndex: 38
    SolutionNameMin: Cijk_Alik_Bjlk_I8II_BH_UserArgs_MT128x64x64_MI16x16x1_SN_CLR1_GSU0_GSUC0_GSUWGMRR0_K1_LBSPPA256_LBSPPB512_LPB32_MIWT4_2_PLR1_SU0_SUM0_SUS64_SKXCCM8_VWA4_VWB2_WGM1_WGMXCC1_WGMXCCGn1
    SolutionIndex: 39
    SolutionNameMin: Cijk_Alik_Bjlk_I8II_BH_UserArgs_MT128x64x64_MI16x16x1_SN_CLR1_GSU0_GSUC0_GSUWGMRR0_K1_LBSPPA256_LBSPPB512_LPB32_MIWT4_2_PLR1_SU0_SUM0_SUS64_SKXCCM8_VWA4_VWB2_WGM1_WGMXCC1_WGMXCCGn1
    SolutionIndex: 40
    SolutionNameMin: Cijk_Alik_Bjlk_I8II_BH_UserArgs_MT128x64x64_MI16x16x1_SN_CLR1_GSU0_GSUC0_GSUWGMRR0_K1_LBSPPA128_LBSPPB512_LPB32_MIWT4_2_PLR1_SU0_SUM0_SUS64_SKXCCM8_VWA1_VWB2_WGM1_WGMXCC1_WGMXCCGn1
    SolutionIndex: 41
    SolutionNameMin: Cijk_Alik_Bjlk_I8II_BH_UserArgs_MT128x64x64_MI16x16x1_SN_CLR1_GSU0_GSUC0_GSUWGMRR0_K1_LBSPPA256_LBSPPB512_LPB32_MIWT4_2_PLR1_SU0_SUM0_SUS64_SKXCCM8_VWA4_VWB2_WGM1_WGMXCC1_WGMXCCGn1
    SolutionIndex: 42
    SolutionNameMin: Cijk_Alik_Bjlk_I8II_BH_UserArgs_MT128x64x64_MI16x16x1_SN_CLR1_GSU0_GSUC0_GSUWGMRR0_K1_LBSPPA128_LBSPPB512_LPB32_MIWT4_2_PLR1_SU0_SUM0_SUS64_SKXCCM8_VWA1_VWB2_WGM1_WGMXCC1_WGMXCCGn1
    SolutionIndex: 43
    SolutionNameMin: Cijk_Alik_Bjlk_I8II_BH_UserArgs_MT128x64x64_MI16x16x1_SN_CLR1_GSU0_GSUC0_GSUWGMRR0_K1_LBSPPA256_LBSPPB512_LPB32_MIWT4_2_PLR1_SU0_SUM0_SUS64_SKXCCM8_VWA4_VWB2_WGM1_WGMXCC1_WGMXCCGn1
    SolutionIndex: 44
    SolutionNameMin: Cijk_Alik_Bjlk_I8II_BH_UserArgs_MT128x64x64_MI16x16x1_SN_CLR1_GSU0_GSUC0_GSUWGMRR0_K1_LBSPPA256_LBSPPB512_LPB32_MIWT4_2_PLR1_SU0_SUM0_SUS64_SKXCCM8_VWA4_VWB2_WGM4_WGMXCC1_WGMXCCGn1
    SolutionIndex: 45
    SolutionNameMin: Cijk_Alik_Bjlk_I8II_BH_UserArgs_MT128x64x64_MI16x16x1_SN_CLR1_GSU0_GSUC0_GSUWGMRR0_K1_LBSPPA256_LBSPPB512_LPB32_MIWT4_2_PLR1_SU0_SUM0_SUS64_SKXCCM8_VWA4_VWB2_WGM8_WGMXCC1_WGMXCCGn1
    SolutionIndex: 46
    SolutionNameMin: Cijk_Alik_Bjlk_I8II_BH_UserArgs_MT128x32x64_MI16x16x1_SN_CLR1_GSU0_GSUC0_GSUWGMRR0_K1_LBSPPA256_LBSPPB256_LPB16_MIWT4_1_PLR1_SU0_SUM0_SUS64_SKXCCM8_VWA4_VWB1_WGM1_WGMXCC1_WGMXCCGn1
    SolutionIndex: 47
    SolutionNameMin: Cijk_Alik_Bjlk_I8II_BH_UserArgs_MT64x64x64_MI16x16x1_SN_CLR1_GSU0_GSUC0_GSUWGMRR0_K1_LBSPPA128_LBSPPB512_LPB32_MIWT2_2_PLR1_SU0_SUM0_SUS64_SKXCCM8_VWA2_VWB2_WGM1_WGMXCC1_WGMXCCGn1
    SolutionIndex: 48
    SolutionNameMin: Cijk_Alik_Bjlk_I8II_BH_UserArgs_MT64x64x64_MI16x16x1_SN_CLR1_GSU0_GSUC0_GSUWGMRR0_K1_LBSPPA128_LBSPPB512_LPB32_MIWT2_2_PLR1_SU0_SUM0_SUS64_SKXCCM8_VWA1_VWB2_WGM1_WGMXCC1_WGMXCCGn1
    SolutionIndex: 49
    SolutionNameMin: Cijk_Alik_Bjlk_I8II_BH_UserArgs_MT64x64x64_MI16x16x1_SN_CLR1_GSU0_GSUC0_GSUWGMRR0_K1_LBSPPA128_LBSPPB512_LPB16_MIWT2_2_PLR1_SU0_SUM0_SUS64_SKXCCM8_VWA1_VWB1_WGM1_WGMXCC1_WGMXCCGn1
    SolutionIndex: 50
    SolutionNameMin: Cijk_Alik_Bjlk_I8II_BH_UserArgs_MT64x64x64_MI16x16x1_SN_CLR1_GSU0_GSUC0_GSUWGMRR0_K1_LBSPPA128_LBSPPB512_LPB32_MIWT2_2_PLR1_SU0_SUM0_SUS64_SKXCCM8_VWA1_VWB2_WGM1_WGMXCC1_WGMXCCGn1
    SolutionIndex: 51
    SolutionNameMin: Cijk_Alik_Bjlk_I8II_BH_UserArgs_MT64x32x64_MI16x16x1_SN_CLR1_GSU0_GSUC0_GSUWGMRR0_K1_LBSPPA128_LBSPPB256_LPB16_MIWT2_1_PLR1_SU0_SUM0_SUS64_SKXCCM8_VWA1_VWB1_WGM1_WGMXCC1_WGMXCCGn1
    SolutionIndex: 52
    SolutionNameMin: Cijk_Alik_Bjlk_I8II_BH_UserArgs_MT32x32x64_MI16x16x1_SN_CLR1_GSU0_GSUC0_GSUWGMRR0_K1_LBSPPA128_LBSPPB256_LPB16_MIWT1_1_PLR1_SU0_SUM0_SUS64_SKXCCM8_VWA1_VWB1_WGM1_WGMXCC1_WGMXCCGn1
    SolutionIndex: 53
    SolutionNameMin: Cijk_Alik_Bjlk_I8II_BH_UserArgs_MT32x32x64_MI16x16x1_SN_CLR1_GSU0_GSUC0_GSUWGMRR0_K1_LBSPPA128_LBSPPB256_LPB16_MIWT1_1_PLR1_SU0_SUM0_SUS64_SKXCCM8_VWA1_VWB1_WGM1_WGMXCC1_WGMXCCGn1
    SolutionIndex: 54
    SolutionNameMin: Cijk_Alik_Bjlk_I8II_BH_UserArgs_MT32x32x64_MI16x16x1_SN_CLR1_GSU0_GSUC0_GSUWGMRR0_K1_LBSPPA128_LBSPPB256_LPB16_MIWT1_1_PLR1_SU0_SUM0_SUS64_SKXCCM8_VWA1_VWB1_WGM1_WGMXCC1_WGMXCCGn1
    SolutionIndex: 55
    SolutionNameMin: Cijk_Alik_Bjlk_I8II_BH_UserArgs_MT128x256x128_MI16x16x1_SN_CLR1_GSU0_GSUC0_GSUWGMRR0_K1_LBSPPA128_LBSPPB4096_LPB0_MIWT4_8_PLR1_SU0_SUM0_SUS128_SKXCCM8_VWA1_VWB8_WGM1_WGMXCC1_WGMXCCGn1
    SolutionIndex: 56
    SolutionNameMin: Cijk_Alik_Bjlk_I8II_BH_UserArgs_MT128x256x128_MI16x16x1_SN_CLR1_GSU0_GSUC0_GSUWGMRR0_K1_LBSPPA512_LBSPPB4096_LPB0_MIWT4_8_PLR1_SU0_SUM0_SUS128_SKXCCM8_VWA4_VWB8_WGM1_WGMXCC1_WGMXCCGn1
    SolutionIndex: 57
    SolutionNameMin: Cijk_Alik_Bjlk_I8II_BH_UserArgs_MT128x256x128_MI16x16x1_SN_CLR1_GSU0_GSUC0_GSUWGMRR0_K1_LBSPPA128_LBSPPB4096_LPB0_MIWT4_8_PLR1_SU0_SUM0_SUS128_SKXCCM8_VWA1_VWB8_WGM4_WGMXCC1_WGMXCCGn1
    SolutionIndex: 58
    SolutionNameMin: Cijk_Alik_Bjlk_I8II_BH_UserArgs_MT128x256x128_MI16x16x1_SN_CLR1_GSU0_GSUC0_GSUWGMRR0_K1_LBSPPA512_LBSPPB4096_LPB0_MIWT4_8_PLR1_SU0_SUM0_SUS128_SKXCCM8_VWA4_VWB8_WGM4_WGMXCC1_WGMXCCGn1
    SolutionIndex: 59
    SolutionNameMin: Cijk_Alik_Bjlk_I8II_BH_UserArgs_MT256x128x128_MI16x16x1_SN_CLR1_GSU0_GSUC0_GSUWGMRR0_K1_LBSPPA512_LBSPPB2048_LPB64_MIWT8_4_PLR1_SU0_SUM0_SUS128_SKXCCM8_VWA4_VWB4_WGM1_WGMXCC1_WGMXCCGn1
    SolutionIndex: 60
    SolutionNameMin: Cijk_Alik_Bjlk_I8II_BH_UserArgs_MT256x128x128_MI16x16x1_SN_CLR1_GSU0_GSUC0_GSUWGMRR0_K1_LBSPPA512_LBSPPB2048_LPB64_MIWT8_4_PLR1_SU0_SUM0_SUS128_SKXCCM8_VWA4_VWB4_WGM4_WGMXCC1_WGMXCCGn1
    SolutionIndex: 61
    SolutionNameMin: Cijk_Alik_Bjlk_I8II_BH_UserArgs_MT256x128x128_MI16x16x1_SN_CLR1_GSU0_GSUC0_GSUWGMRR0_K1_LBSPPA512_LBSPPB2048_LPB64_MIWT8_4_PLR1_SU0_SUM0_SUS128_SKXCCM8_VWA4_VWB4_WGM8_WGMXCC1_WGMXCCGn1
    SolutionIndex: 62
    SolutionNameMin: Cijk_Alik_Bjlk_I8II_BH_UserArgs_MT256x64x128_MI16x16x1_SN_CLR1_GSU0_GSUC0_GSUWGMRR0_K1_LBSPPA128_LBSPPB1024_LPB32_MIWT8_2_PLR1_SU0_SUM0_SUS128_SKXCCM8_VWA1_VWB2_WGM4_WGMXCC1_WGMXCCGn1
    SolutionIndex: 63
    SolutionNameMin: Cijk_Alik_Bjlk_I8II_BH_UserArgs_MT128x128x128_MI16x16x1_SN_CLR1_GSU0_GSUC0_GSUWGMRR0_K1_LBSPPA128_LBSPPB2048_LPB64_MIWT4_4_PLR1_SU0_SUM0_SUS128_SKXCCM8_VWA1_VWB4_WGM1_WGMXCC1_WGMXCCGn1
    SolutionIndex: 64
    SolutionNameMin: Cijk_Alik_Bjlk_I8II_BH_UserArgs_MT128x128x128_MI16x16x1_SN_CLR1_GSU0_GSUC0_GSUWGMRR0_K1_LBSPPA512_LBSPPB2048_LPB64_MIWT4_4_PLR1_SU0_SUM0_SUS128_SKXCCM8_VWA4_VWB4_WGM1_WGMXCC1_WGMXCCGn1
    SolutionIndex: 65
    SolutionNameMin: Cijk_Alik_Bjlk_I8II_BH_UserArgs_MT128x128x128_MI16x16x1_SN_CLR1_GSU0_GSUC0_GSUWGMRR0_K1_LBSPPA512_LBSPPB2048_LPB64_MIWT4_4_PLR1_SU0_SUM0_SUS128_SKXCCM8_VWA4_VWB4_WGM4_WGMXCC1_WGMXCCGn1
    SolutionIndex: 66
    SolutionNameMin: Cijk_Alik_Bjlk_I8II_BH_UserArgs_MT128x128x128_MI16x16x1_SN_CLR1_GSU0_GSUC0_GSUWGMRR0_K1_LBSPPA512_LBSPPB2048_LPB64_MIWT4_4_PLR1_SU0_SUM0_SUS128_SKXCCM8_VWA4_VWB4_WGM8_WGMXCC1_WGMXCCGn1
    SolutionIndex: 67
    SolutionNameMin: Cijk_Alik_Bjlk_I8II_BH_UserArgs_MT128x64x128_MI16x16x1_SN_CLR1_GSU0_GSUC0_GSUWGMRR0_K1_LBSPPA512_LBSPPB1024_LPB32_MIWT4_2_PLR1_SU0_SUM0_SUS128_SKXCCM8_VWA4_VWB2_WGM1_WGMXCC1_WGMXCCGn1
    SolutionIndex: 68
    SolutionNameMin: Cijk_Alik_Bjlk_I8II_BH_UserArgs_MT64x64x128_MI16x16x1_SN_CLR1_GSU0_GSUC0_GSUWGMRR0_K1_LBSPPA128_LBSPPB1024_LPB32_MIWT2_2_PLR1_SU0_SUM0_SUS128_SKXCCM8_VWA1_VWB2_WGM1_WGMXCC1_WGMXCCGn1
    SolutionIndex: 69
    SolutionNameMin: Cijk_Alik_Bjlk_I8II_BH_UserArgs_MT64x64x128_MI16x16x1_SN_CLR1_GSU0_GSUC0_GSUWGMRR0_K1_LBSPPA128_LBSPPB1024_LPB32_MIWT2_2_PLR1_SU0_SUM0_SUS128_SKXCCM8_VWA1_VWB2_WGM1_WGMXCC1_WGMXCCGn1
    SolutionIndex: 70
    SolutionNameMin: Cijk_Alik_Bjlk_I8II_BH_UserArgs_MT64x64x128_MI16x16x1_SN_CLR1_GSU0_GSUC0_GSUWGMRR0_K1_LBSPPA128_LBSPPB1024_LPB32_MIWT2_2_PLR1_SU0_SUM0_SUS128_SKXCCM8_VWA1_VWB2_WGM4_WGMXCC1_WGMXCCGn1
    SolutionIndex: 71
    SolutionNameMin: Cijk_Alik_Bjlk_I8II_BH_UserArgs_MT32x64x128_MI16x16x1_SN_CLR1_GSU0_GSUC0_GSUWGMRR0_K1_LBSPPA128_LBSPPB1024_LPB32_MIWT1_2_PLR1_SU0_SUM0_SUS128_SKXCCM8_VWA1_VWB2_WGM1_WGMXCC1_WGMXCCGn1
    SolutionIndex: 72
    SolutionNameMin: Cijk_Alik_Bjlk_I8II_BH_UserArgs_MT64x32x128_MI16x16x1_SN_CLR1_GSU0_GSUC0_GSUWGMRR0_K1_LBSPPA128_LBSPPB512_LPB16_MIWT2_1_PLR1_SU0_SUM0_SUS128_SKXCCM8_VWA1_VWB1_WGM1_WGMXCC1_WGMXCCGn1
    SolutionIndex: 73
    SolutionNameMin: Cijk_Alik_Bjlk_I8II_BH_UserArgs_MT64x32x128_MI16x16x1_SN_CLR1_GSU0_GSUC0_GSUWGMRR0_K1_LBSPPA256_LBSPPB512_LPB16_MIWT2_1_PLR1_SU0_SUM0_SUS128_SKXCCM8_VWA2_VWB1_WGM1_WGMXCC1_WGMXCCGn1
    SolutionIndex: 74
    SolutionNameMin: Cijk_Alik_Bjlk_I8II_BH_UserArgs_MT64x32x128_MI16x16x1_SN_CLR1_GSU0_GSUC0_GSUWGMRR0_K1_LBSPPA128_LBSPPB512_LPB16_MIWT2_1_PLR1_SU0_SUM0_SUS128_SKXCCM8_VWA1_VWB1_WGM1_WGMXCC1_WGMXCCGn1
    SolutionIndex: 75
    SolutionNameMin: Cijk_Alik_Bjlk_I8II_BH_UserArgs_MT64x32x128_MI16x16x1_SN_CLR1_GSU0_GSUC0_GSUWGMRR0_K1_LBSPPA128_LBSPPB512_LPB16_MIWT2_1_PLR1_SU0_SUM0_SUS128_SKXCCM8_VWA1_VWB1_WGM1_WGMXCC1_WGMXCCGn1
    SolutionIndex: 76
    SolutionNameMin: Cijk_Alik_Bjlk_I8II_BH_UserArgs_MT64x32x128_MI16x16x1_SN_CLR1_GSU0_GSUC0_GSUWGMRR0_K1_LBSPPA256_LBSPPB512_LPB16_MIWT2_1_PLR1_SU0_SUM0_SUS128_SKXCCM8_VWA2_VWB1_WGM1_WGMXCC1_WGMXCCGn1
    SolutionIndex: 77
    SolutionNameMin: Cijk_Alik_Bjlk_I8II_BH_UserArgs_MT64x32x128_MI16x16x1_SN_CLR1_GSU0_GSUC0_GSUWGMRR0_K1_LBSPPA128_LBSPPB512_LPB16_MIWT2_1_PLR1_SU0_SUM0_SUS128_SKXCCM8_VWA1_VWB1_WGM1_WGMXCC1_WGMXCCGn1
    SolutionIndex: 78
    SolutionNameMin: Cijk_Alik_Bjlk_I8II_BH_UserArgs_MT32x32x128_MI16x16x1_SN_CLR1_GSU0_GSUC0_GSUWGMRR0_K1_LBSPPA128_LBSPPB512_LPB16_MIWT1_1_PLR1_SU0_SUM0_SUS128_SKXCCM8_VWA1_VWB1_WGM1_WGMXCC1_WGMXCCGn1
    SolutionIndex: 79
    SolutionNameMin: Cijk_Alik_Bjlk_I8II_BH_UserArgs_MT32x32x128_MI16x16x1_SN_CLR1_GSU0_GSUC0_GSUWGMRR0_K1_LBSPPA128_LBSPPB512_LPB16_MIWT1_1_PLR1_SU0_SUM0_SUS128_SKXCCM8_VWA1_VWB1_WGM1_WGMXCC1_WGMXCCGn1
    SolutionIndex: 80
    SolutionNameMin: Cijk_Alik_Bjlk_I8II_BH_UserArgs_MT32x32x128_MI16x16x1_SN_CLR1_GSU0_GSUC0_GSUWGMRR0_K1_LBSPPA128_LBSPPB512_LPB16_MIWT1_1_PLR1_SU0_SUM0_SUS128_SKXCCM8_VWA1_VWB1_WGM1_WGMXCC1_WGMXCCGn1
    SolutionIndex: 81
    SolutionNameMin: Cijk_Alik_Bjlk_I8II_BH_UserArgs_MT32x32x128_MI16x16x1_SN_CLR1_GSU0_GSUC0_GSUWGMRR0_K1_LBSPPA128_LBSPPB512_LPB16_MIWT1_1_PLR1_SU0_SUM0_SUS128_SKXCCM8_VWA1_VWB1_WGM1_WGMXCC1_WGMXCCGn1
    SolutionIndex: 82
    SolutionNameMin: Cijk_Alik_Bjlk_I8II_BH_UserArgs_MT128x64x256_MI16x16x1_SN_CLR1_GSU0_GSUC0_GSUWGMRR0_K1_LBSPPA256_LBSPPB1024_LPB32_MIWT4_2_PLR2_SU0_SUM0_SUS256_SKXCCM8_VWA1_VWB2_WGM1_WGMXCC1_WGMXCCGn1
    SolutionIndex: 83
    SolutionNameMin: Cijk_Alik_Bjlk_I8II_BH_UserArgs_MT128x64x256_MI16x16x1_SN_CLR1_GSU0_GSUC0_GSUWGMRR0_K1_LBSPPA1024_LBSPPB1024_LPB32_MIWT4_2_PLR2_SU0_SUM0_SUS256_SKXCCM8_VWA4_VWB2_WGM1_WGMXCC1_WGMXCCGn1
    SolutionIndex: 84
    SolutionNameMin: Cijk_Alik_Bjlk_I8II_BH_UserArgs_MT128x64x256_MI16x16x1_SN_CLR1_GSU0_GSUC0_GSUWGMRR0_K1_LBSPPA256_LBSPPB1024_LPB32_MIWT4_2_PLR2_SU0_SUM0_SUS256_SKXCCM8_VWA1_VWB2_WGM4_WGMXCC1_WGMXCCGn1
    SolutionIndex: 85
    SolutionNameMin: Cijk_Alik_Bjlk_I8II_BH_UserArgs_MT128x64x256_MI16x16x1_SN_CLR1_GSU0_GSUC0_GSUWGMRR0_K1_LBSPPA1024_LBSPPB1024_LPB32_MIWT4_2_PLR2_SU0_SUM0_SUS256_SKXCCM8_VWA4_VWB2_WGM4_WGMXCC1_WGMXCCGn1
    SolutionIndex: 86
    SolutionNameMin: Cijk_Alik_Bjlk_I8II_BH_UserArgs_MT128x64x256_MI16x16x1_SN_CLR1_GSU0_GSUC0_GSUWGMRR0_K1_LBSPPA256_LBSPPB1024_LPB32_MIWT4_2_PLR2_SU0_SUM0_SUS256_SKXCCM8_VWA1_VWB2_WGM4_WGMXCC1_WGMXCCGn1
    SolutionIndex: 87
    SolutionNameMin: Cijk_Alik_Bjlk_I8II_BH_UserArgs_MT128x64x256_MI16x16x1_SN_CLR1_GSU0_GSUC0_GSUWGMRR0_K1_LBSPPA256_LBSPPB1024_LPB32_MIWT4_2_PLR2_SU0_SUM0_SUS256_SKXCCM8_VWA1_VWB2_WGM8_WGMXCC1_WGMXCCGn1
    SolutionIndex: 88
    SolutionNameMin: Cijk_Alik_Bjlk_I8II_BH_UserArgs_MT128x64x256_MI16x16x1_SN_CLR1_GSU0_GSUC0_GSUWGMRR0_K1_LBSPPA256_LBSPPB1024_LPB32_MIWT4_2_PLR2_SU0_SUM0_SUS256_SKXCCM8_VWA1_VWB2_WGM8_WGMXCC1_WGMXCCGn1
    SolutionIndex: 89
    SolutionNameMin: Cijk_Alik_Bjlk_I8II_BH_UserArgs_MT64x64x256_MI16x16x1_SN_CLR1_GSU0_GSUC0_GSUWGMRR0_K1_LBSPPA256_LBSPPB1024_LPB32_MIWT2_2_PLR2_SU0_SUM0_SUS256_SKXCCM8_VWA1_VWB2_WGM1_WGMXCC1_WGMXCCGn1
    SolutionIndex: 90
    SolutionNameMin: Cijk_Alik_Bjlk_I8II_BH_UserArgs_MT64x64x256_MI16x16x1_SN_CLR1_GSU0_GSUC0_GSUWGMRR0_K1_LBSPPA512_LBSPPB1024_LPB32_MIWT2_2_PLR2_SU0_SUM0_SUS256_SKXCCM8_VWA2_VWB2_WGM1_WGMXCC1_WGMXCCGn1
    SolutionIndex: 91
    SolutionNameMin: Cijk_Alik_Bjlk_I8II_BH_UserArgs_MT64x64x256_MI16x16x1_SN_CLR1_GSU0_GSUC0_GSUWGMRR0_K1_LBSPPA256_LBSPPB1024_LPB32_MIWT2_2_PLR2_SU0_SUM0_SUS256_SKXCCM8_VWA1_VWB2_WGM8_WGMXCC1_WGMXCCGn1
    SolutionIndex: 92
    SolutionNameMin: Cijk_Alik_Bjlk_I8II_BH_UserArgs_MT64x32x256_MI16x16x1_SN_CLR1_GSU0_GSUC0_GSUWGMRR0_K1_LBSPPA256_LBSPPB512_LPB16_MIWT2_1_PLR2_SU0_SUM0_SUS256_SKXCCM8_VWA1_VWB1_WGM1_WGMXCC1_WGMXCCGn1
    SolutionIndex: 93
    SolutionNameMin: Cijk_Alik_Bjlk_I8II_BH_UserArgs_MT64x32x256_MI16x16x1_SN_CLR1_GSU0_GSUC0_GSUWGMRR0_K1_LBSPPA512_LBSPPB512_LPB16_MIWT2_1_PLR2_SU0_SUM0_SUS256_SKXCCM8_VWA2_VWB1_WGM1_WGMXCC1_WGMXCCGn1
    SolutionIndex: 94
    SolutionNameMin: Cijk_Alik_Bjlk_I8II_BH_UserArgs_MT64x32x256_MI16x16x1_SN_CLR1_GSU0_GSUC0_GSUWGMRR0_K1_LBSPPA256_LBSPPB512_LPB16_MIWT2_1_PLR2_SU0_SUM0_SUS256_SKXCCM8_VWA1_VWB1_WGM4_WGMXCC1_WGMXCCGn1
    SolutionIndex: 95
    SolutionNameMin: Cijk_Alik_Bjlk_I8II_BH_UserArgs_MT64x32x256_MI16x16x1_SN_CLR1_GSU0_GSUC0_GSUWGMRR0_K1_LBSPPA256_LBSPPB512_LPB16_MIWT2_1_PLR2_SU0_SUM0_SUS256_SKXCCM8_VWA1_VWB1_WGM8_WGMXCC1_WGMXCCGn1
    SolutionIndex: 96
    SolutionNameMin: Cijk_Alik_Bjlk_I8II_BH_UserArgs_MT32x32x256_MI16x16x1_SN_CLR1_GSU0_GSUC0_GSUWGMRR0_K1_LBSPPA256_LBSPPB512_LPB16_MIWT1_1_PLR1_SU0_SUM0_SUS256_SKXCCM8_VWA1_VWB1_WGM1_WGMXCC1_WGMXCCGn1
    SolutionIndex: 97
    SolutionNameMin: Cijk_Alik_Bjlk_I8II_BH_UserArgs_MT32x32x256_MI16x16x1_SN_CLR1_GSU0_GSUC0_GSUWGMRR0_K1_LBSPPA256_LBSPPB512_LPB16_MIWT1_1_PLR2_SU0_SUM0_SUS256_SKXCCM8_VWA1_VWB1_WGM1_WGMXCC1_WGMXCCGn1
    SolutionIndex: 98
    SolutionNameMin: Cijk_Alik_Bjlk_I8II_BH_UserArgs_MT32x32x256_MI16x16x1_SN_CLR1_GSU0_GSUC0_GSUWGMRR0_K1_LBSPPA256_LBSPPB512_LPB16_MIWT1_1_PLR2_SU0_SUM0_SUS256_SKXCCM8_VWA1_VWB1_WGM1_WGMXCC1_WGMXCCGn1
    SolutionIndex: 99
    SolutionNameMin: Cijk_Alik_Bjlk_I8II_BH_UserArgs_MT32x32x256_MI16x16x1_SN_CLR1_GSU0_GSUC0_GSUWGMRR0_K1_LBSPPA256_LBSPPB512_LPB16_MIWT1_1_PLR2_SU0_SUM0_SUS256_SKXCCM8_VWA1_VWB1_WGM8_WGMXCC1_WGMXCCGn1
    SolutionIndex: 100
    SolutionNameMin: Cijk_Alik_Bjlk_I8II_BH_UserArgs_MT32x32x32_MI16x16x1_SN_CLR0_GSU0_GSUC0_GSUWGMRR0_K1_LBSPPA128_LBSPPB256_LPB16_MIWT1_1_PLR0_SU32_SUM0_SUS256_SKXCCM0_VWA1_VWB1_WGM1_WGMXCC1_WGMXCCGn1
- - - [128, 128, 1, 128, 128, 128, 128, 128]
    - [78, 0.61]
  - - [128, 128, 1, 256, 128, 128, 256, 128]
    - [79, 1.13]
  - - [128, 128, 1, 512, 128, 128, 512, 128]
    - [79, 1.87]
  - - [128, 128, 1, 1024, 128, 128, 1024, 128]
    - [81, 2.85]
  - - [128, 128, 1, 2048, 128, 128, 2048, 128]
    - [81, 3.88]
  - - [128, 128, 1, 4096, 128, 128, 4096, 128]
    - [97, 4.78]
  - - [128, 128, 1, 8192, 128, 128, 8192, 128]
    - [97, 5.39]
  - - [128, 256, 1, 128, 128, 128, 128, 256]
    - [52, 1.24]
  - - [128, 256, 1, 256, 128, 128, 256, 256]
    - [54, 2.2]
  - - [128, 256, 1, 512, 128, 128, 512, 256]
    - [81, 3.74]
  - - [128, 256, 1, 1024, 128, 128, 1024, 256]
    - [81, 5.67]
  - - [128, 256, 1, 2048, 128, 128, 2048, 256]
    - [81, 7.7]
  - - [128, 256, 1, 4096, 128, 128, 4096, 256]
    - [97, 9.51]
  - - [128, 256, 1, 8192, 128, 128, 8192, 256]
    - [97, 10.75]
  - - [128, 512, 1, 128, 128, 128, 128, 512]
    - [53, 2.46]
  - - [128, 512, 1, 256, 128, 128, 256, 512]
    - [80, 4.4]
  - - [128, 512, 1, 512, 128, 128, 512, 512]
    - [81, 7.42]
  - - [128, 512, 1, 1024, 128, 128, 1024, 512]
    - [81, 11.33]
  - - [128, 512, 1, 2048, 128, 128, 2048, 512]
    - [81, 15.25]
  - - [128, 512, 1, 4096, 128, 128, 4096, 512]
    - [97, 18.78]
  - - [128, 512, 1, 8192, 128, 128, 8192, 512]
    - [97, 21.23]
  - - [128, 1024, 1, 128, 128, 128, 128, 1024]
    - [74, 4.42]
  - - [128, 1024, 1, 256, 128, 128, 256, 1024]
    - [71, 7.79]
  - - [128, 1024, 1, 512, 128, 128, 512, 1024]
    - [75, 13.04]
  - - [128, 1024, 1, 1024, 128, 128, 1024, 1024]
    - [75, 19.66]
  - - [128, 1024, 1, 2048, 128, 128, 2048, 1024]
    - [92, 27.48]
  - - [128, 1024, 1, 4096, 128, 128, 4096, 1024]
    - [92, 34.43]
  - - [128, 1024, 1, 8192, 128, 128, 8192, 1024]
    - [73, 31.04]
  - - [128, 2048, 1, 128, 128, 128, 128, 2048]
    - [49, 7.75]
  - - [128, 2048, 1, 256, 128, 128, 256, 2048]
    - [46, 13.36]
  - - [128, 2048, 1, 512, 128, 128, 512, 2048]
    - [68, 22.09]
  - - [128, 2048, 1, 1024, 128, 128, 1024, 2048]
    - [89, 32.86]
  - - [128, 2048, 1, 2048, 128, 128, 2048, 2048]
    - [68, 42.2]
  - - [128, 2048, 1, 4096, 128, 128, 4096, 2048]
    - [68, 50.6]
  - - [128, 2048, 1, 8192, 128, 128, 8192, 2048]
    - [68, 56.64]
  - - [128, 4096, 1, 128, 128, 128, 128, 4096]
    - [40, 12.86]
  - - [128, 4096, 1, 256, 128, 128, 256, 4096]
    - [40, 22.69]
  - - [128, 4096, 1, 512, 128, 128, 512, 4096]
    - [42, 36.22]
  - - [128, 4096, 1, 1024, 128, 128, 1024, 4096]
    - [38, 48.6]
  - - [128, 4096, 1, 2048, 128, 128, 2048, 4096]
    - [67, 63.97]
  - - [128, 4096, 1, 4096, 128, 128, 4096, 4096]
    - [67, 75.55]
  - - [128, 4096, 1, 8192, 128, 128, 8192, 4096]
    - [82, 84.11]
  - - [128, 8192, 1, 128, 128, 128, 128, 8192]
    - [34, 19.31]
  - - [128, 8192, 1, 256, 128, 128, 256, 8192]
    - [35, 33.56]
  - - [128, 8192, 1, 512, 128, 128, 512, 8192]
    - [35, 52.12]
  - - [128, 8192, 1, 1024, 128, 128, 1024, 8192]
    - [63, 70.14]
  - - [128, 8192, 1, 2048, 128, 128, 2048, 8192]
    - [64, 92.5]
  - - [128, 8192, 1, 4096, 128, 128, 4096, 8192]
    - [64, 109.67]
  - - [128, 8192, 1, 8192, 128, 128, 8192, 8192]
    - [64, 120.22]
  - - [256, 128, 1, 128, 256, 256, 128, 128]
    - [78, 1.2]
  - - [256, 128, 1, 256, 256, 256, 256, 128]
    - [80, 2.18]
  - - [256, 128, 1, 512, 256, 256, 512, 128]
    - [98, 3.54]
  - - [256, 128, 1, 1024, 256, 256, 1024, 128]
    - [81, 5.65]
  - - [256, 128, 1, 2048, 256, 256, 2048, 128]
    - [81, 7.65]
  - - [256, 128, 1, 4096, 256, 256, 4096, 128]
    - [97, 9.45]
  - - [256, 128, 1, 8192, 256, 256, 8192, 128]
    - [97, 10.67]
  - - [256, 256, 1, 128, 256, 256, 128, 256]
    - [54, 2.39]
  - - [256, 256, 1, 256, 256, 256, 256, 256]
    - [80, 4.34]
  - - [256, 256, 1, 512, 256, 256, 512, 256]
    - [81, 7.41]
  - - [256, 256, 1, 1024, 256, 256, 1024, 256]
    - [81, 11.22]
  - - [256, 256, 1, 2048, 256, 256, 2048, 256]
    - [81, 15.27]
  - - [256, 256, 1, 4096, 256, 256, 4096, 256]
    - [96, 18.71]
  - - [256, 256, 1, 8192, 256, 256, 8192, 256]
    - [99, 21.13]
  - - [256, 512, 1, 128, 256, 256, 128, 512]
    - [72, 4.43]
  - - [256, 512, 1, 256, 256, 256, 256, 512]
    - [51, 7.79]
  - - [256, 512, 1, 512, 256, 256, 512, 512]
    - [77, 13.0]
  - - [256, 512, 1, 1024, 256, 256, 1024, 512]
    - [92, 19.6]
  - - [256, 512, 1, 2048, 256, 256, 2048, 512]
    - [93, 27.44]
  - - [256, 512, 1, 4096, 256, 256, 4096, 512]
    - [92, 34.51]
  - - [256, 512, 1, 8192, 256, 256, 8192, 512]
    - [94, 39.13]
  - - [256, 1024, 1, 128, 256, 256, 128, 1024]
    - [47, 7.93]
  - - [256, 1024, 1, 256, 256, 256, 256, 1024]
    - [50, 14.11]
  - - [256, 1024, 1, 512, 256, 256, 512, 1024]
    - [50, 22.57]
  - - [256, 1024, 1, 1024, 256, 256, 1024, 1024]
    - [69, 33.79]
  - - [256, 1024, 1, 2048, 256, 256, 2048, 1024]
    - [89, 45.87]
  - - [256, 1024, 1, 4096, 256, 256, 4096, 1024]
    - [90, 55.91]
  - - [256, 1024, 1, 8192, 256, 256, 8192, 1024]
    - [70, 55.44]
  - - [256, 2048, 1, 128, 256, 256, 128, 2048]
    - [39, 13.2]
  - - [256, 2048, 1, 256, 256, 256, 256, 2048]
    - [42, 23.07]
  - - [256, 2048, 1, 512, 256, 256, 512, 2048]
    - [40, 36.5]
  - - [256, 2048, 1, 1024, 256, 256, 1024, 2048]
    - [41, 52.37]
  - - [256, 2048, 1, 2048, 256, 256, 2048, 2048]
    - [67, 64.21]
  - - [256, 2048, 1, 4096, 256, 256, 4096, 2048]
    - [67, 76.05]
  - - [256, 2048, 1, 8192, 256, 256, 8192, 2048]
    - [83, 84.06]
  - - [256, 4096, 1, 128, 256, 256, 128, 4096]
    - [35, 19.52]
  - - [256, 4096, 1, 256, 256, 256, 256, 4096]
    - [35, 33.64]
  - - [256, 4096, 1, 512, 256, 256, 512, 4096]
    - [35, 52.15]
  - - [256, 4096, 1, 1024, 256, 256, 1024, 4096]
    - [64, 71.99]
  - - [256, 4096, 1, 2048, 256, 256, 2048, 4096]
    - [64, 93.72]
  - - [256, 4096, 1, 4096, 256, 256, 4096, 4096]
    - [64, 111.79]
  - - [256, 4096, 1, 8192, 256, 256, 8192, 4096]
    - [64, 123.47]
  - - [256, 8192, 1, 128, 256, 256, 128, 8192]
    - [28, 26.57]
  - - [256, 8192, 1, 256, 256, 256, 256, 8192]
    - [24, 44.94]
  - - [256, 8192, 1, 512, 256, 256, 512, 8192]
    - [24, 68.93]
  - - [256, 8192, 1, 1024, 256, 256, 1024, 8192]
    - [23, 95.76]
  - - [256, 8192, 1, 2048, 256, 256, 2048, 8192]
    - [56, 120.03]
  - - [256, 8192, 1, 4096, 256, 256, 4096, 8192]
    - [56, 140.48]
  - - [256, 8192, 1, 8192, 256, 256, 8192, 8192]
    - [59, 156.84]
  - - [512, 128, 1, 128, 512, 512, 128, 128]
    - [54, 2.4]
  - - [512, 128, 1, 256, 512, 512, 256, 128]
    - [80, 4.29]
  - - [512, 128, 1, 512, 512, 512, 512, 128]
    - [79, 7.3]
  - - [512, 128, 1, 1024, 512, 512, 1024, 128]
    - [81, 11.08]
  - - [512, 128, 1, 2048, 512, 512, 2048, 128]
    - [81, 15.13]
  - - [512, 128, 1, 4096, 512, 512, 4096, 128]
    - [97, 18.7]
  - - [512, 128, 1, 8192, 512, 512, 8192, 128]
    - [96, 21.14]
  - - [512, 256, 1, 128, 512, 512, 128, 256]
    - [74, 4.38]
  - - [512, 256, 1, 256, 512, 512, 256, 256]
    - [76, 7.8]
  - - [512, 256, 1, 512, 512, 512, 512, 256]
    - [75, 13.05]
  - - [512, 256, 1, 1024, 512, 512, 1024, 256]
    - [93, 19.71]
  - - [512, 256, 1, 2048, 512, 512, 2048, 256]
    - [92, 27.69]
  - - [512, 256, 1, 4096, 512, 512, 4096, 256]
    - [92, 34.57]
  - - [512, 256, 1, 8192, 512, 512, 8192, 256]
    - [95, 39.19]
  - - [512, 512, 1, 128, 512, 512, 128, 512]
    - [50, 7.93]
  - - [512, 512, 1, 256, 512, 512, 256, 512]
    - [48, 13.94]
  - - [512, 512, 1, 512, 512, 512, 512, 512]
    - [68, 22.82]
  - - [512, 512, 1, 1024, 512, 512, 1024, 512]
    - [69, 33.8]
  - - [512, 512, 1, 2048, 512, 512, 2048, 512]
    - [89, 45.89]
  - - [512, 512, 1, 4096, 512, 512, 4096, 512]
    - [90, 55.94]
  - - [512, 512, 1, 8192, 512, 512, 8192, 512]
    - [68, 56.03]
  - - [512, 1024, 1, 128, 512, 512, 128, 1024]
    - [38, 13.18]
  - - [512, 1024, 1, 256, 512, 512, 256, 1024]
    - [38, 23.07]
  - - [512, 1024, 1, 512, 512, 512, 512, 1024]
    - [38, 36.65]
  - - [512, 1024, 1, 1024, 512, 512, 1024, 1024]
    - [41, 52.32]
  - - [512, 1024, 1, 2048, 512, 512, 2048, 1024]
    - [83, 69.11]
  - - [512, 1024, 1, 4096, 512, 512, 4096, 1024]
    - [67, 73.54]
  - - [512, 1024, 1, 8192, 512, 512, 8192, 1024]
    - [86, 82.79]
  - - [512, 2048, 1, 128, 512, 512, 128, 2048]
    - [35, 19.56]
  - - [512, 2048, 1, 256, 512, 512, 256, 2048]
    - [35, 33.64]
  - - [512, 2048, 1, 512, 512, 512, 512, 2048]
    - [35, 52.47]
  - - [512, 2048, 1, 1024, 512, 512, 1024, 2048]
    - [64, 73.93]
  - - [512, 2048, 1, 2048, 512, 512, 2048, 2048]
    - [64, 94.34]
  - - [512, 2048, 1, 4096, 512, 512, 4096, 2048]
    - [64, 110.66]
  - - [512, 2048, 1, 8192, 512, 512, 8192, 2048]
    - [65, 118.96]
  - - [512, 4096, 1, 128, 512, 512, 128, 4096]
    - [4, 27.26]
  - - [512, 4096, 1, 256, 512, 512, 256, 4096]
    - [27, 46.59]
  - - [512, 4096, 1, 512, 512, 512, 512, 4096]
    - [22, 69.1]
  - - [512, 4096, 1, 1024, 512, 512, 1024, 4096]
    - [26, 96.51]
  - - [512, 4096, 1, 2048, 512, 512, 2048, 4096]
    - [56, 120.69]
  - - [512, 4096, 1, 4096, 512, 512, 4096, 4096]
    - [56, 141.26]
  - - [512, 4096, 1, 8192, 512, 512, 8192, 4096]
    - [60, 158.44]
  - - [512, 8192, 1, 128, 512, 512, 128, 8192]
    - [3, 32.99]
  - - [512, 8192, 1, 256, 512, 512, 256, 8192]
    - [18, 54.87]
  - - [512, 8192, 1, 512, 512, 512, 512, 8192]
    - [18, 84.87]
  - - [512, 8192, 1, 1024, 512, 512, 1024, 8192]
    - [21, 119.23]
  - - [512, 8192, 1, 2048, 512, 512, 2048, 8192]
    - [20, 148.05]
  - - [512, 8192, 1, 4096, 512, 512, 4096, 8192]
    - [21, 169.08]
  - - [512, 8192, 1, 8192, 512, 512, 8192, 8192]
    - [21, 186.27]
  - - [1024, 128, 1, 128, 1024, 1024, 128, 128]
    - [73, 4.47]
  - - [1024, 128, 1, 256, 1024, 1024, 256, 128]
    - [72, 7.88]
  - - [1024, 128, 1, 512, 1024, 1024, 512, 128]
    - [75, 13.12]
  - - [1024, 128, 1, 1024, 1024, 1024, 1024, 128]
    - [75, 19.79]
  - - [1024, 128, 1, 2048, 1024, 1024, 2048, 128]
    - [92, 27.71]
  - - [1024, 128, 1, 4096, 1024, 1024, 4096, 128]
    - [92, 34.42]
  - - [1024, 128, 1, 8192, 1024, 1024, 8192, 128]
    - [95, 39.1]
  - - [1024, 256, 1, 128, 1024, 1024, 128, 256]
    - [7, 7.83]
  - - [1024, 256, 1, 256, 1024, 1024, 256, 256]
    - [50, 13.63]
  - - [1024, 256, 1, 512, 1024, 1024, 512, 256]
    - [68, 22.2]
  - - [1024, 256, 1, 1024, 1024, 1024, 1024, 256]
    - [89, 33.25]
  - - [1024, 256, 1, 2048, 1024, 1024, 2048, 256]
    - [89, 45.66]
  - - [1024, 256, 1, 4096, 1024, 1024, 4096, 256]
    - [90, 56.02]
  - - [1024, 256, 1, 8192, 1024, 1024, 8192, 256]
    - [91, 61.84]
  - - [1024, 512, 1, 128, 1024, 1024, 128, 512]
    - [43, 13.32]
  - - [1024, 512, 1, 256, 1024, 1024, 256, 512]
    - [38, 23.07]
  - - [1024, 512, 1, 512, 1024, 1024, 512, 512]
    - [41, 36.95]
  - - [1024, 512, 1, 1024, 1024, 1024, 1024, 512]
    - [41, 52.72]
  - - [1024, 512, 1, 2048, 1024, 1024, 2048, 512]
    - [82, 68.92]
  - - [1024, 512, 1, 4096, 1024, 1024, 4096, 512]
    - [86, 77.44]
  - - [1024, 512, 1, 8192, 1024, 1024, 8192, 512]
    - [84, 81.38]
  - - [1024, 1024, 1, 128, 1024, 1024, 128, 1024]
    - [35, 19.63]
  - - [1024, 1024, 1, 256, 1024, 1024, 256, 1024]
    - [35, 33.83]
  - - [1024, 1024, 1, 512, 1024, 1024, 512, 1024]
    - [35, 52.77]
  - - [1024, 1024, 1, 1024, 1024, 1024, 1024, 1024]
    - [64, 75.56]
  - - [1024, 1024, 1, 2048, 1024, 1024, 2048, 1024]
    - [64, 94.42]
  - - [1024, 1024, 1, 4096, 1024, 1024, 4096, 1024]
    - [65, 105.66]
  - - [1024, 1024, 1, 8192, 1024, 1024, 8192, 1024]
    - [66, 116.88]
  - - [1024, 2048, 1, 128, 1024, 1024, 128, 2048]
    - [4, 27.33]
  - - [1024, 2048, 1, 256, 1024, 1024, 256, 2048]
    - [27, 46.74]
  - - [1024, 2048, 1, 512, 1024, 1024, 512, 2048]
    - [31, 68.29]
  - - [1024, 2048, 1, 1024, 1024, 1024, 1024, 2048]
    - [25, 95.0]
  - - [1024, 2048, 1, 2048, 1024, 1024, 2048, 2048]
    - [58, 120.13]
  - - [1024, 2048, 1, 4096, 1024, 1024, 4096, 2048]
    - [57, 140.62]
  - - [1024, 2048, 1, 8192, 1024, 1024, 8192, 2048]
    - [60, 158.53]
  - - [1024, 4096, 1, 128, 1024, 1024, 128, 4096]
    - [3, 31.65]
  - - [1024, 4096, 1, 256, 1024, 1024, 256, 4096]
    - [3, 53.23]
  - - [1024, 4096, 1, 512, 1024, 1024, 512, 4096]
    - [18, 82.46]
  - - [1024, 4096, 1, 1024, 1024, 1024, 1024, 4096]
    - [21, 116.4]
  - - [1024, 4096, 1, 2048, 1024, 1024, 2048, 4096]
    - [21, 146.39]
  - - [1024, 4096, 1, 4096, 1024, 1024, 4096, 4096]
    - [16, 169.08]
  - - [1024, 4096, 1, 8192, 1024, 1024, 8192, 4096]
    - [16, 186.39]
  - - [1024, 8192, 1, 128, 1024, 1024, 128, 8192]
    - [3, 34.48]
  - - [1024, 8192, 1, 256, 1024, 1024, 256, 8192]
    - [3, 57.51]
  - - [1024, 8192, 1, 512, 1024, 1024, 512, 8192]
    - [18, 88.64]
  - - [1024, 8192, 1, 1024, 1024, 1024, 1024, 8192]
    - [21, 123.05]
  - - [1024, 8192, 1, 2048, 1024, 1024, 2048, 8192]
    - [16, 152.03]
  - - [1024, 8192, 1, 4096, 1024, 1024, 4096, 8192]
    - [16, 172.4]
  - - [1024, 8192, 1, 8192, 1024, 1024, 8192, 8192]
    - [16, 188.68]
  - - [2048, 128, 1, 128, 2048, 2048, 128, 128]
    - [8, 7.84]
  - - [2048, 128, 1, 256, 2048, 2048, 256, 128]
    - [50, 13.73]
  - - [2048, 128, 1, 512, 2048, 2048, 512, 128]
    - [69, 22.54]
  - - [2048, 128, 1, 1024, 2048, 2048, 1024, 128]
    - [89, 33.47]
  - - [2048, 128, 1, 2048, 2048, 2048, 2048, 128]
    - [90, 46.06]
  - - [2048, 128, 1, 4096, 2048, 2048, 4096, 128]
    - [90, 56.94]
  - - [2048, 128, 1, 8192, 2048, 2048, 8192, 128]
    - [89, 61.94]
  - - [2048, 256, 1, 128, 2048, 2048, 128, 256]
    - [39, 13.27]
  - - [2048, 256, 1, 256, 2048, 2048, 256, 256]
    - [38, 23.09]
  - - [2048, 256, 1, 512, 2048, 2048, 512, 256]
    - [43, 36.65]
  - - [2048, 256, 1, 1024, 2048, 2048, 1024, 256]
    - [41, 52.24]
  - - [2048, 256, 1, 2048, 2048, 2048, 2048, 256]
    - [83, 69.8]
  - - [2048, 256, 1, 4096, 2048, 2048, 4096, 256]
    - [87, 80.9]
  - - [2048, 256, 1, 8192, 2048, 2048, 8192, 256]
    - [88, 85.92]
  - - [2048, 512, 1, 128, 2048, 2048, 128, 512]
    - [33, 19.18]
  - - [2048, 512, 1, 256, 2048, 2048, 256, 512]
    - [36, 33.21]
  - - [2048, 512, 1, 512, 2048, 2048, 512, 512]
    - [32, 50.74]
  - - [2048, 512, 1, 1024, 2048, 2048, 1024, 512]
    - [62, 70.6]
  - - [2048, 512, 1, 2048, 2048, 2048, 2048, 512]
    - [65, 92.48]
  - - [2048, 512, 1, 4096, 2048, 2048, 4096, 512]
    - [66, 109.43]
  - - [2048, 512, 1, 8192, 2048, 2048, 8192, 512]
    - [66, 116.2]
  - - [2048, 1024, 1, 128, 2048, 2048, 128, 1024]
    - [5, 26.99]
  - - [2048, 1024, 1, 256, 2048, 2048, 256, 1024]
    - [29, 46.16]
  - - [2048, 1024, 1, 512, 2048, 2048, 512, 1024]
    - [23, 67.71]
  - - [2048, 1024, 1, 1024, 2048, 2048, 1024, 1024]
    - [23, 94.43]
  - - [2048, 1024, 1, 2048, 2048, 2048, 2048, 1024]
    - [61, 125.19]
  - - [2048, 1024, 1, 4096, 2048, 2048, 4096, 1024]
    - [61, 141.14]
  - - [2048, 1024, 1, 8192, 2048, 2048, 8192, 1024]
    - [60, 158.9]
  - - [2048, 2048, 1, 128, 2048, 2048, 128, 2048]
    - [2, 31.76]
  - - [2048, 2048, 1, 256, 2048, 2048, 256, 2048]
    - [2, 53.2]
  - - [2048, 2048, 1, 512, 2048, 2048, 512, 2048]
    - [15, 81.95]
  - - [2048, 2048, 1, 1024, 2048, 2048, 1024, 2048]
    - [16, 116.49]
  - - [2048, 2048, 1, 2048, 2048, 2048, 2048, 2048]
    - [16, 146.92]
  - - [2048, 2048, 1, 4096, 2048, 2048, 4096, 2048]
    - [16, 168.67]
  - - [2048, 2048, 1, 8192, 2048, 2048, 8192, 2048]
    - [16, 186.44]
  - - [2048, 4096, 1, 128, 2048, 2048, 128, 4096]
    - [0, 34.82]
  - - [2048, 4096, 1, 256, 2048, 2048, 256, 4096]
    - [1, 57.81]
  - - [2048, 4096, 1, 512, 2048, 2048, 512, 4096]
    - [16, 89.06]
  - - [2048, 4096, 1, 1024, 2048, 2048, 1024, 4096]
    - [16, 123.29]
  - - [2048, 4096, 1, 2048, 2048, 2048, 2048, 4096]
    - [16, 152.51]
  - - [2048, 4096, 1, 4096, 2048, 2048, 4096, 4096]
    - [16, 172.69]
  - - [2048, 4096, 1, 8192, 2048, 2048, 8192, 4096]
    - [16, 188.57]
  - - [2048, 8192, 1, 128, 2048, 2048, 128, 8192]
    - [0, 37.67]
  - - [2048, 8192, 1, 256, 2048, 2048, 256, 8192]
    - [11, 62.4]
  - - [2048, 8192, 1, 512, 2048, 2048, 512, 8192]
    - [15, 93.23]
  - - [2048, 8192, 1, 1024, 2048, 2048, 1024, 8192]
    - [16, 126.97]
  - - [2048, 8192, 1, 2048, 2048, 2048, 2048, 8192]
    - [16, 155.49]
  - - [2048, 8192, 1, 4096, 2048, 2048, 4096, 8192]
    - [16, 174.44]
  - - [2048, 8192, 1, 8192, 2048, 2048, 8192, 8192]
    - [16, 189.77]
  - - [4096, 128, 1, 128, 4096, 4096, 128, 128]
    - [37, 12.9]
  - - [4096, 128, 1, 256, 4096, 4096, 256, 128]
    - [45, 22.56]
  - - [4096, 128, 1, 512, 4096, 4096, 512, 128]
    - [45, 35.79]
  - - [4096, 128, 1, 1024, 4096, 4096, 1024, 128]
    - [44, 51.35]
  - - [4096, 128, 1, 2048, 4096, 4096, 2048, 128]
    - [85, 69.28]
  - - [4096, 128, 1, 4096, 4096, 4096, 4096, 128]
    - [87, 75.85]
  - - [4096, 128, 1, 8192, 4096, 4096, 8192, 128]
    - [84, 88.61]
  - - [4096, 256, 1, 128, 4096, 4096, 128, 256]
    - [35, 19.41]
  - - [4096, 256, 1, 256, 4096, 4096, 256, 256]
    - [35, 33.39]
  - - [4096, 256, 1, 512, 4096, 4096, 512, 256]
    - [35, 52.33]
  - - [4096, 256, 1, 1024, 4096, 4096, 1024, 256]
    - [64, 74.53]
  - - [4096, 256, 1, 2048, 4096, 4096, 2048, 256]
    - [64, 94.46]
  - - [4096, 256, 1, 4096, 4096, 4096, 4096, 256]
    - [65, 102.46]
  - - [4096, 256, 1, 8192, 4096, 4096, 8192, 256]
    - [64, 114.86]
  - - [4096, 512, 1, 128, 4096, 4096, 128, 512]
    - [6, 27.24]
  - - [4096, 512, 1, 256, 4096, 4096, 256, 512]
    - [30, 46.46]
  - - [4096, 512, 1, 512, 4096, 4096, 512, 512]
    - [23, 68.79]
  - - [4096, 512, 1, 1024, 4096, 4096, 1024, 512]
    - [23, 95.09]
  - - [4096, 512, 1, 2048, 4096, 4096, 2048, 512]
    - [23, 118.85]
  - - [4096, 512, 1, 4096, 4096, 4096, 4096, 512]
    - [55, 139.41]
  - - [4096, 512, 1, 8192, 4096, 4096, 8192, 512]
    - [61, 158.29]
  - - [4096, 1024, 1, 128, 4096, 4096, 128, 1024]
    - [1, 31.66]
  - - [4096, 1024, 1, 256, 4096, 4096, 256, 1024]
    - [12, 52.71]
  - - [4096, 1024, 1, 512, 4096, 4096, 512, 1024]
    - [13, 81.15]
  - - [4096, 1024, 1, 1024, 4096, 4096, 1024, 1024]
    - [13, 114.34]
  - - [4096, 1024, 1, 2048, 4096, 4096, 2048, 1024]
    - [13, 143.66]
  - - [4096, 1024, 1, 4096, 4096, 4096, 4096, 1024]
    - [16, 165.27]
  - - [4096, 1024, 1, 8192, 4096, 4096, 8192, 1024]
    - [13, 184.32]
  - - [4096, 2048, 1, 128, 4096, 4096, 128, 2048]
    - [1, 34.71]
  - - [4096, 2048, 1, 256, 4096, 4096, 256, 2048]
    - [1, 57.83]
  - - [4096, 2048, 1, 512, 4096, 4096, 512, 2048]
    - [13, 88.23]
  - - [4096, 2048, 1, 1024, 4096, 4096, 1024, 2048]
    - [13, 121.85]
  - - [4096, 2048, 1, 2048, 4096, 4096, 2048, 2048]
    - [13, 149.87]
  - - [4096, 2048, 1, 4096, 4096, 4096, 4096, 2048]
    - [21, 170.74]
  - - [4096, 2048, 1, 8192, 4096, 4096, 8192, 2048]
    - [13, 187.34]
  - - [4096, 4096, 1, 128, 4096, 4096, 128, 4096]
    - [1, 37.6]
  - - [4096, 4096, 1, 256, 4096, 4096, 256, 4096]
    - [12, 62.06]
  - - [4096, 4096, 1, 512, 4096, 4096, 512, 4096]
    - [12, 93.57]
  - - [4096, 4096, 1, 1024, 4096, 4096, 1024, 4096]
    - [13, 126.71]
  - - [4096, 4096, 1, 2048, 4096, 4096, 2048, 4096]
    - [13, 154.33]
  - - [4096, 4096, 1, 4096, 4096, 4096, 4096, 4096]
    - [21, 173.76]
  - - [4096, 4096, 1, 8192, 4096, 4096, 8192, 4096]
    - [21, 188.74]
  - - [4096, 8192, 1, 128, 4096, 4096, 128, 8192]
    - [0, 38.85]
  - - [4096, 8192, 1, 256, 4096, 4096, 256, 8192]
    - [14, 65.1]
  - - [4096, 8192, 1, 512, 4096, 4096, 512, 8192]
    - [14, 94.91]
  - - [4096, 8192, 1, 1024, 4096, 4096, 1024, 8192]
    - [14, 127.44]
  - - [4096, 8192, 1, 2048, 4096, 4096, 2048, 8192]
    - [13, 150.64]
  - - [4096, 8192, 1, 4096, 4096, 4096, 4096, 8192]
    - [16, 171.15]
  - - [4096, 8192, 1, 8192, 4096, 4096, 8192, 8192]
    - [13, 187.48]
  - - [8192, 128, 1, 128, 8192, 8192, 128, 128]
    - [35, 19.42]
  - - [8192, 128, 1, 256, 8192, 8192, 256, 128]
    - [35, 33.86]
  - - [8192, 128, 1, 512, 8192, 8192, 512, 128]
    - [35, 52.84]
  - - [8192, 128, 1, 1024, 8192, 8192, 1024, 128]
    - [35, 73.06]
  - - [8192, 128, 1, 2048, 8192, 8192, 2048, 128]
    - [63, 85.56]
  - - [8192, 128, 1, 4096, 8192, 8192, 4096, 128]
    - [64, 99.46]
  - - [8192, 128, 1, 8192, 8192, 8192, 8192, 128]
    - [64, 112.22]
  - - [8192, 256, 1, 128, 8192, 8192, 128, 256]
    - [4, 26.62]
  - - [8192, 256, 1, 256, 8192, 8192, 256, 256]
    - [27, 45.52]
  - - [8192, 256, 1, 512, 8192, 8192, 512, 256]
    - [30, 66.95]
  - - [8192, 256, 1, 1024, 8192, 8192, 1024, 256]
    - [30, 92.09]
  - - [8192, 256, 1, 2048, 8192, 8192, 2048, 256]
    - [55, 117.96]
  - - [8192, 256, 1, 4096, 8192, 8192, 4096, 256]
    - [55, 139.57]
  - - [8192, 256, 1, 8192, 8192, 8192, 8192, 256]
    - [61, 155.82]
  - - [8192, 512, 1, 128, 8192, 8192, 128, 512]
    - [2, 31.41]
  - - [8192, 512, 1, 256, 8192, 8192, 256, 512]
    - [2, 52.31]
  - - [8192, 512, 1, 512, 8192, 8192, 512, 512]
    - [18, 80.95]
  - - [8192, 512, 1, 1024, 8192, 8192, 1024, 512]
    - [21, 114.74]
  - - [8192, 512, 1, 2048, 8192, 8192, 2048, 512]
    - [21, 145.03]
  - - [8192, 512, 1, 4096, 8192, 8192, 4096, 512]
    - [21, 166.81]
  - - [8192, 512, 1, 8192, 8192, 8192, 8192, 512]
    - [21, 185.33]
  - - [8192, 1024, 1, 128, 8192, 8192, 128, 1024]
    - [5, 33.77]
  - - [8192, 1024, 1, 256, 8192, 8192, 256, 1024]
    - [11, 57.09]
  - - [8192, 1024, 1, 512, 8192, 8192, 512, 1024]
    - [11, 86.77]
  - - [8192, 1024, 1, 1024, 8192, 8192, 1024, 1024]
    - [18, 120.86]
  - - [8192, 1024, 1, 2048, 8192, 8192, 2048, 1024]
    - [16, 151.01]
  - - [8192, 1024, 1, 4096, 8192, 8192, 4096, 1024]
    - [16, 172.01]
  - - [8192, 1024, 1, 8192, 8192, 8192, 8192, 1024]
    - [16, 188.29]
  - - [8192, 2048, 1, 128, 8192, 8192, 128, 2048]
    - [1, 36.41]
  - - [8192, 2048, 1, 256, 8192, 8192, 256, 2048]
    - [17, 61.34]
  - - [8192, 2048, 1, 512, 8192, 8192, 512, 2048]
    - [19, 93.32]
  - - [8192, 2048, 1, 1024, 8192, 8192, 1024, 2048]
    - [18, 128.45]
  - - [8192, 2048, 1, 2048, 8192, 8192, 2048, 2048]
    - [16, 156.04]
  - - [8192, 2048, 1, 4096, 8192, 8192, 4096, 2048]
    - [16, 175.4]
  - - [8192, 2048, 1, 8192, 8192, 8192, 8192, 2048]
    - [16, 190.07]
  - - [8192, 4096, 1, 128, 8192, 8192, 128, 4096]
    - [9, 38.86]
  - - [8192, 4096, 1, 256, 8192, 8192, 256, 4096]
    - [10, 64.71]
  - - [8192, 4096, 1, 512, 8192, 8192, 512, 4096]
    - [17, 94.02]
  - - [8192, 4096, 1, 1024, 8192, 8192, 1024, 4096]
    - [11, 127.15]
  - - [8192, 4096, 1, 2048, 8192, 8192, 2048, 4096]
    - [16, 152.46]
  - - [8192, 4096, 1, 4096, 8192, 8192, 4096, 4096]
    - [16, 172.66]
  - - [8192, 4096, 1, 8192, 8192, 8192, 8192, 4096]
    - [16, 188.25]
  - - [8192, 8192, 1, 128, 8192, 8192, 128, 8192]
    - [10, 34.58]
  - - [8192, 8192, 1, 256, 8192, 8192, 256, 8192]
    - [10, 59.47]
  - - [8192, 8192, 1, 512, 8192, 8192, 512, 8192]
    - [18, 90.37]
  - - [8192, 8192, 1, 1024, 8192, 8192, 1024, 8192]
    - [21, 125.72]
  - - [8192, 8192, 1, 2048, 8192, 8192, 2048, 8192]
    - [16, 154.66]
  - - [8192, 8192, 1, 4096, 8192, 8192, 4096, 8192]
    - [16, 174.52]
  - - [8192, 8192, 1, 8192, 8192, 8192, 8192, 8192]
    - [16, 189.32]
  - - [1, 1, 1, 32, 1, 1, 32, 1]
    - [100, 0.0]
- null
- null
- ExperimentalStreamK
- GridBased
