projects/hipblaslt/library/src/amd_detail/rocblaslt/src/Tensile/Logic/asm_full/aquavanjaram/gfx942_64cu/StreamK/aquavanjaram942_Cijk_Ailk_Bljk_I8BH_UserArgs.yaml
- {MinimumRequiredVersion: 4.33.0}
- aquavanjaram942
- {Architecture: gfx942, CUCount: 64}
- [Device 0049, Device 0050]
    SolutionIndex: 0
    SolutionNameMin: Cijk_Ailk_Bljk_I8BH_UserArgs_MT256x256x32_MI16x16x1_SN_CLR0_GSU0_GSUC0_GSUWGMRR0_K1_LBSPPA2048_LBSPPB128_LPA64_MIWT8_8_PLR0_SU0_SUM0_SUS32_SKXCCM8_VWA4_VWB1_WGM1_WGMXCC1_WGMXCCGn1
    SolutionIndex: 1
    SolutionNameMin: Cijk_Ailk_Bljk_I8BH_UserArgs_MT256x256x32_MI16x16x1_SN_CLR0_GSU0_GSUC0_GSUWGMRR0_K1_LBSPPA2048_LBSPPB128_LPA0_MIWT8_8_PLR0_SU0_SUM0_SUS32_SKXCCM8_VWA8_VWB1_WGM1_WGMXCC1_WGMXCCGn1
    SolutionIndex: 2
    SolutionNameMin: Cijk_Ailk_Bljk_I8BH_UserArgs_MT128x256x32_MI16x16x1_SN_CLR0_GSU0_GSUC0_GSUWGMRR0_K1_LBSPPA1024_LBSPPB128_LPA64_MIWT4_8_PLR0_SU0_SUM0_SUS32_SKXCCM8_VWA4_VWB1_WGM1_WGMXCC1_WGMXCCGn1
    SolutionIndex: 3
    SolutionNameMin: Cijk_Ailk_Bljk_I8BH_UserArgs_MT128x256x32_MI16x16x1_SN_CLR0_GSU0_GSUC0_GSUWGMRR0_K1_LBSPPA1024_LBSPPB128_LPA64_MIWT4_8_PLR0_SU0_SUM0_SUS32_SKXCCM8_VWA4_VWB1_WGM1_WGMXCC1_WGMXCCGn1
    SolutionIndex: 4
    SolutionNameMin: Cijk_Ailk_Bljk_I8BH_UserArgs_MT256x256x64_MI16x16x1_SN_CLR1_GSU0_GSUC0_GSUWGMRR0_K1_LBSPPA2048_LBSPPB128_LPA64_MIWT8_8_PLR1_SU0_SUM0_SUS64_SKXCCM8_VWA4_VWB1_WGM1_WGMXCC1_WGMXCCGn1
    SolutionIndex: 5
    SolutionNameMin: Cijk_Ailk_Bljk_I8BH_UserArgs_MT256x256x64_MI16x16x1_SN_CLR1_GSU0_GSUC0_GSUWGMRR0_K1_LBSPPA2048_LBSPPB128_LPA0_MIWT8_8_PLR1_SU0_SUM0_SUS64_SKXCCM8_VWA8_VWB1_WGM1_WGMXCC1_WGMXCCGn1
    SolutionIndex: 6
    SolutionNameMin: Cijk_Ailk_Bljk_I8BH_UserArgs_MT256x256x64_MI16x16x1_SN_CLR1_GSU0_GSUC0_GSUWGMRR0_K1_LBSPPA2048_LBSPPB128_LPA64_MIWT8_8_PLR1_SU0_SUM0_SUS64_SKXCCM8_VWA4_VWB2_WGM1_WGMXCC1_WGMXCCGn1
    SolutionIndex: 7
    SolutionNameMin: Cijk_Ailk_Bljk_I8BH_UserArgs_MT256x256x64_MI16x16x1_SN_CLR1_GSU0_GSUC0_GSUWGMRR0_K1_LBSPPA2048_LBSPPB512_LPA64_MIWT8_8_PLR1_SU0_SUM0_SUS64_SKXCCM8_VWA4_VWB8_WGM1_WGMXCC1_WGMXCCGn1
    SolutionIndex: 8
    SolutionNameMin: Cijk_Ailk_Bljk_I8BH_UserArgs_MT256x256x64_MI16x16x1_SN_CLR1_GSU0_GSUC0_GSUWGMRR0_K1_LBSPPA2048_LBSPPB128_LPA64_MIWT8_8_PLR1_SU0_SUM0_SUS64_SKXCCM8_VWA4_VWB1_WGM1_WGMXCC1_WGMXCCGn1
    SolutionIndex: 9
    SolutionNameMin: Cijk_Ailk_Bljk_I8BH_UserArgs_MT128x256x64_MI16x16x1_SN_CLR1_GSU0_GSUC0_GSUWGMRR0_K1_LBSPPA1024_LBSPPB128_LPA64_MIWT4_8_PLR1_SU0_SUM0_SUS64_SKXCCM8_VWA4_VWB1_WGM1_WGMXCC1_WGMXCCGn1
    SolutionIndex: 10
    SolutionNameMin: Cijk_Ailk_Bljk_I8BH_UserArgs_MT128x256x64_MI16x16x1_SN_CLR1_GSU0_GSUC0_GSUWGMRR0_K1_LBSPPA1024_LBSPPB128_LPA64_MIWT4_8_PLR1_SU0_SUM0_SUS64_SKXCCM8_VWA4_VWB2_WGM1_WGMXCC1_WGMXCCGn1
    SolutionIndex: 11
    SolutionNameMin: Cijk_Ailk_Bljk_I8BH_UserArgs_MT128x256x64_MI16x16x1_SN_CLR1_GSU0_GSUC0_GSUWGMRR0_K1_LBSPPA1024_LBSPPB512_LPA64_MIWT4_8_PLR1_SU0_SUM0_SUS64_SKXCCM8_VWA4_VWB8_WGM1_WGMXCC1_WGMXCCGn1
    SolutionIndex: 12
    SolutionNameMin: Cijk_Ailk_Bljk_I8BH_UserArgs_MT256x128x64_MI16x16x1_SN_CLR1_GSU0_GSUC0_GSUWGMRR0_K1_LBSPPA2048_LBSPPB128_LPA0_MIWT8_4_PLR1_SU0_SUM0_SUS64_SKXCCM8_VWA8_VWB1_WGM1_WGMXCC1_WGMXCCGn1
    SolutionIndex: 13
    SolutionNameMin: Cijk_Ailk_Bljk_I8BH_UserArgs_MT256x128x64_MI16x16x1_SN_CLR1_GSU0_GSUC0_GSUWGMRR0_K1_LBSPPA2048_LBSPPB256_LPA0_MIWT8_4_PLR1_SU0_SUM0_SUS64_SKXCCM8_VWA8_VWB4_WGM1_WGMXCC1_WGMXCCGn1
    SolutionIndex: 14
    SolutionNameMin: Cijk_Ailk_Bljk_I8BH_UserArgs_MT256x128x64_MI16x16x1_SN_CLR1_GSU0_GSUC0_GSUWGMRR0_K1_LBSPPA2048_LBSPPB128_LPA0_MIWT8_4_PLR1_SU0_SUM0_SUS64_SKXCCM8_VWA8_VWB1_WGM1_WGMXCC1_WGMXCCGn1
    SolutionIndex: 15
    SolutionNameMin: Cijk_Ailk_Bljk_I8BH_UserArgs_MT256x128x64_MI16x16x1_SN_CLR1_GSU0_GSUC0_GSUWGMRR0_K1_LBSPPA2048_LBSPPB128_LPA0_MIWT8_4_PLR1_SU0_SUM0_SUS64_SKXCCM8_VWA8_VWB2_WGM1_WGMXCC1_WGMXCCGn1
    SolutionIndex: 16
    SolutionNameMin: Cijk_Ailk_Bljk_I8BH_UserArgs_MT128x128x64_MI16x16x1_SN_CLR1_GSU0_GSUC0_GSUWGMRR0_K1_LBSPPA1024_LBSPPB128_LPA64_MIWT4_4_PLR1_SU0_SUM0_SUS64_SKXCCM8_VWA4_VWB1_WGM1_WGMXCC1_WGMXCCGn1
    SolutionIndex: 17
    SolutionNameMin: Cijk_Ailk_Bljk_I8BH_UserArgs_MT128x128x64_MI16x16x1_SN_CLR1_GSU0_GSUC0_GSUWGMRR0_K1_LBSPPA1024_LBSPPB128_LPA64_MIWT4_4_PLR1_SU0_SUM0_SUS64_SKXCCM8_VWA4_VWB1_WGM1_WGMXCC1_WGMXCCGn1
    SolutionIndex: 18
    SolutionNameMin: Cijk_Ailk_Bljk_I8BH_UserArgs_MT128x128x64_MI16x16x1_SN_CLR1_GSU0_GSUC0_GSUWGMRR0_K1_LBSPPA1024_LBSPPB128_LPA64_MIWT4_4_PLR1_SU0_SUM0_SUS64_SKXCCM8_VWA4_VWB2_WGM1_WGMXCC1_WGMXCCGn1
    SolutionIndex: 19
    SolutionNameMin: Cijk_Ailk_Bljk_I8BH_UserArgs_MT128x128x64_MI16x16x1_SN_CLR1_GSU0_GSUC0_GSUWGMRR0_K1_LBSPPA1024_LBSPPB256_LPA64_MIWT4_4_PLR1_SU0_SUM0_SUS64_SKXCCM8_VWA4_VWB4_WGM1_WGMXCC1_WGMXCCGn1
    SolutionIndex: 20
    SolutionNameMin: Cijk_Ailk_Bljk_I8BH_UserArgs_MT64x128x64_MI16x16x1_SN_CLR1_GSU0_GSUC0_GSUWGMRR0_K1_LBSPPA512_LBSPPB128_LPA32_MIWT2_4_PLR1_SU0_SUM0_SUS64_SKXCCM8_VWA2_VWB1_WGM1_WGMXCC1_WGMXCCGn1
    SolutionIndex: 21
    SolutionNameMin: Cijk_Ailk_Bljk_I8BH_UserArgs_MT64x128x64_MI16x16x1_SN_CLR1_GSU0_GSUC0_GSUWGMRR0_K1_LBSPPA512_LBSPPB128_LPA32_MIWT2_4_PLR1_SU0_SUM0_SUS64_SKXCCM8_VWA2_VWB2_WGM1_WGMXCC1_WGMXCCGn1
    SolutionIndex: 22
    SolutionNameMin: Cijk_Ailk_Bljk_I8BH_UserArgs_MT64x128x64_MI16x16x1_SN_CLR1_GSU0_GSUC0_GSUWGMRR0_K1_LBSPPA512_LBSPPB128_LPA32_MIWT2_4_PLR1_SU0_SUM0_SUS64_SKXCCM8_VWA2_VWB1_WGM1_WGMXCC1_WGMXCCGn1
    SolutionIndex: 23
    SolutionNameMin: Cijk_Ailk_Bljk_I8BH_UserArgs_MT64x128x64_MI16x16x1_SN_CLR1_GSU0_GSUC0_GSUWGMRR0_K1_LBSPPA512_LBSPPB128_LPA32_MIWT2_4_PLR1_SU0_SUM0_SUS64_SKXCCM8_VWA2_VWB2_WGM1_WGMXCC1_WGMXCCGn1
    SolutionIndex: 24
    SolutionNameMin: Cijk_Ailk_Bljk_I8BH_UserArgs_MT64x128x64_MI16x16x1_SN_CLR1_GSU0_GSUC0_GSUWGMRR0_K1_LBSPPA512_LBSPPB256_LPA32_MIWT2_4_PLR1_SU0_SUM0_SUS64_SKXCCM8_VWA2_VWB4_WGM1_WGMXCC1_WGMXCCGn1
    SolutionIndex: 25
    SolutionNameMin: Cijk_Ailk_Bljk_I8BH_UserArgs_MT64x128x64_MI16x16x1_SN_CLR1_GSU0_GSUC0_GSUWGMRR0_K1_LBSPPA512_LBSPPB128_LPA32_MIWT2_4_PLR1_SU0_SUM0_SUS64_SKXCCM8_VWA2_VWB1_WGM4_WGMXCC1_WGMXCCGn1
    SolutionIndex: 26
    SolutionNameMin: Cijk_Ailk_Bljk_I8BH_UserArgs_MT64x128x64_MI16x16x1_SN_CLR1_GSU0_GSUC0_GSUWGMRR0_K1_LBSPPA512_LBSPPB256_LPA32_MIWT2_4_PLR1_SU0_SUM0_SUS64_SKXCCM8_VWA2_VWB4_WGM4_WGMXCC1_WGMXCCGn1
    SolutionIndex: 27
    SolutionNameMin: Cijk_Ailk_Bljk_I8BH_UserArgs_MT128x64x64_MI16x16x1_SN_CLR1_GSU0_GSUC0_GSUWGMRR0_K1_LBSPPA1024_LBSPPB128_LPA64_MIWT4_2_PLR1_SU0_SUM0_SUS64_SKXCCM8_VWA4_VWB2_WGM1_WGMXCC1_WGMXCCGn1
    SolutionIndex: 28
    SolutionNameMin: Cijk_Ailk_Bljk_I8BH_UserArgs_MT64x64x64_MI16x16x1_SN_CLR1_GSU0_GSUC0_GSUWGMRR0_K1_LBSPPA512_LBSPPB128_LPA32_MIWT2_2_PLR1_SU0_SUM0_SUS64_SKXCCM8_VWA2_VWB2_WGM1_WGMXCC1_WGMXCCGn1
    SolutionIndex: 29
    SolutionNameMin: Cijk_Ailk_Bljk_I8BH_UserArgs_MT64x64x64_MI16x16x1_SN_CLR1_GSU0_GSUC0_GSUWGMRR0_K1_LBSPPA512_LBSPPB128_LPA32_MIWT2_2_PLR1_SU0_SUM0_SUS64_SKXCCM8_VWA2_VWB1_WGM1_WGMXCC1_WGMXCCGn1
    SolutionIndex: 30
    SolutionNameMin: Cijk_Ailk_Bljk_I8BH_UserArgs_MT64x32x64_MI16x16x1_SN_CLR1_GSU0_GSUC0_GSUWGMRR0_K1_LBSPPA512_LBSPPB128_LPA32_MIWT2_1_PLR1_SU0_SUM0_SUS64_SKXCCM8_VWA2_VWB1_WGM1_WGMXCC1_WGMXCCGn1
    SolutionIndex: 31
    SolutionNameMin: Cijk_Ailk_Bljk_I8BH_UserArgs_MT32x32x64_MI16x16x1_SN_CLR1_GSU0_GSUC0_GSUWGMRR0_K1_LBSPPA256_LBSPPB128_LPA16_MIWT1_1_PLR1_SU0_SUM0_SUS64_SKXCCM8_VWA1_VWB1_WGM1_WGMXCC1_WGMXCCGn1
    SolutionIndex: 32
    SolutionNameMin: Cijk_Ailk_Bljk_I8BH_UserArgs_MT32x32x64_MI16x16x1_SN_CLR1_GSU0_GSUC0_GSUWGMRR0_K1_LBSPPA256_LBSPPB128_LPA16_MIWT1_1_PLR1_SU0_SUM0_SUS64_SKXCCM8_VWA1_VWB1_WGM1_WGMXCC1_WGMXCCGn1
    SolutionIndex: 33
    SolutionNameMin: Cijk_Ailk_Bljk_I8BH_UserArgs_MT32x32x64_MI16x16x1_SN_CLR1_GSU0_GSUC0_GSUWGMRR0_K1_LBSPPA256_LBSPPB128_LPA16_MIWT1_1_PLR1_SU0_SUM0_SUS64_SKXCCM8_VWA1_VWB1_WGM1_WGMXCC1_WGMXCCGn1
    SolutionIndex: 34
    SolutionNameMin: Cijk_Ailk_Bljk_I8BH_UserArgs_MT128x256x128_MI16x16x1_SN_CLR1_GSU0_GSUC0_GSUWGMRR0_K1_LBSPPA2048_LBSPPB256_LPA64_MIWT4_8_PLR1_SU0_SUM0_SUS128_SKXCCM8_VWA4_VWB2_WGM1_WGMXCC1_WGMXCCGn1
    SolutionIndex: 35
    SolutionNameMin: Cijk_Ailk_Bljk_I8BH_UserArgs_MT128x256x128_MI16x16x1_SN_CLR1_GSU0_GSUC0_GSUWGMRR0_K1_LBSPPA2048_LBSPPB512_LPA64_MIWT4_8_PLR1_SU0_SUM0_SUS128_SKXCCM8_VWA4_VWB4_WGM1_WGMXCC1_WGMXCCGn1
    SolutionIndex: 36
    SolutionNameMin: Cijk_Ailk_Bljk_I8BH_UserArgs_MT128x256x128_MI16x16x1_SN_CLR1_GSU0_GSUC0_GSUWGMRR0_K1_LBSPPA2048_LBSPPB1024_LPA64_MIWT4_8_PLR1_SU0_SUM0_SUS128_SKXCCM8_VWA4_VWB8_WGM1_WGMXCC1_WGMXCCGn1
    SolutionIndex: 37
    SolutionNameMin: Cijk_Ailk_Bljk_I8BH_UserArgs_MT128x256x128_MI16x16x1_SN_CLR1_GSU0_GSUC0_GSUWGMRR0_K1_LBSPPA2048_LBSPPB256_LPA64_MIWT4_8_PLR1_SU0_SUM0_SUS128_SKXCCM8_VWA4_VWB2_WGM4_WGMXCC1_WGMXCCGn1
    SolutionIndex: 38
    SolutionNameMin: Cijk_Ailk_Bljk_I8BH_UserArgs_MT128x256x128_MI16x16x1_SN_CLR1_GSU0_GSUC0_GSUWGMRR0_K1_LBSPPA2048_LBSPPB256_LPA64_MIWT4_8_PLR1_SU0_SUM0_SUS128_SKXCCM8_VWA4_VWB2_WGM8_WGMXCC1_WGMXCCGn1
    SolutionIndex: 39
    SolutionNameMin: Cijk_Ailk_Bljk_I8BH_UserArgs_MT128x256x128_MI16x16x1_SN_CLR1_GSU0_GSUC0_GSUWGMRR0_K1_LBSPPA2048_LBSPPB512_LPA64_MIWT4_8_PLR1_SU0_SUM0_SUS128_SKXCCM8_VWA4_VWB4_WGM8_WGMXCC1_WGMXCCGn1
    SolutionIndex: 40
    SolutionNameMin: Cijk_Ailk_Bljk_I8BH_UserArgs_MT256x128x128_MI16x16x1_SN_CLR1_GSU0_GSUC0_GSUWGMRR0_K1_LBSPPA4096_LBSPPB128_LPA0_MIWT8_4_PLR1_SU0_SUM0_SUS128_SKXCCM8_VWA8_VWB1_WGM1_WGMXCC1_WGMXCCGn1
    SolutionIndex: 41
    SolutionNameMin: Cijk_Ailk_Bljk_I8BH_UserArgs_MT128x128x128_MI16x16x1_SN_CLR1_GSU0_GSUC0_GSUWGMRR0_K1_LBSPPA2048_LBSPPB256_LPA64_MIWT4_4_PLR1_SU0_SUM0_SUS128_SKXCCM8_VWA4_VWB2_WGM1_WGMXCC1_WGMXCCGn1
    SolutionIndex: 42
    SolutionNameMin: Cijk_Ailk_Bljk_I8BH_UserArgs_MT128x128x128_MI16x16x1_SN_CLR1_GSU0_GSUC0_GSUWGMRR0_K1_LBSPPA2048_LBSPPB512_LPA64_MIWT4_4_PLR1_SU0_SUM0_SUS128_SKXCCM8_VWA4_VWB4_WGM1_WGMXCC1_WGMXCCGn1
    SolutionIndex: 43
    SolutionNameMin: Cijk_Ailk_Bljk_I8BH_UserArgs_MT128x128x128_MI16x16x1_SN_CLR1_GSU0_GSUC0_GSUWGMRR0_K1_LBSPPA2048_LBSPPB256_LPA64_MIWT4_4_PLR1_SU0_SUM0_SUS128_SKXCCM8_VWA4_VWB2_WGM4_WGMXCC1_WGMXCCGn1
    SolutionIndex: 44
    SolutionNameMin: Cijk_Ailk_Bljk_I8BH_UserArgs_MT128x128x128_MI16x16x1_SN_CLR1_GSU0_GSUC0_GSUWGMRR0_K1_LBSPPA2048_LBSPPB256_LPA64_MIWT4_4_PLR1_SU0_SUM0_SUS128_SKXCCM8_VWA4_VWB2_WGM8_WGMXCC1_WGMXCCGn1
    SolutionIndex: 45
    SolutionNameMin: Cijk_Ailk_Bljk_I8BH_UserArgs_MT128x128x128_MI16x16x1_SN_CLR1_GSU0_GSUC0_GSUWGMRR0_K1_LBSPPA2048_LBSPPB512_LPA64_MIWT4_4_PLR1_SU0_SUM0_SUS128_SKXCCM8_VWA4_VWB4_WGM8_WGMXCC1_WGMXCCGn1
    SolutionIndex: 46
    SolutionNameMin: Cijk_Ailk_Bljk_I8BH_UserArgs_MT128x64x128_MI16x16x1_SN_CLR1_GSU0_GSUC0_GSUWGMRR0_K1_LBSPPA2048_LBSPPB128_LPA64_MIWT4_2_PLR1_SU0_SUM0_SUS128_SKXCCM8_VWA4_VWB1_WGM1_WGMXCC1_WGMXCCGn1
    SolutionIndex: 47
    SolutionNameMin: Cijk_Ailk_Bljk_I8BH_UserArgs_MT64x64x128_MI16x16x1_SN_CLR1_GSU0_GSUC0_GSUWGMRR0_K1_LBSPPA1024_LBSPPB256_LPA32_MIWT2_2_PLR1_SU0_SUM0_SUS128_SKXCCM8_VWA2_VWB2_WGM1_WGMXCC1_WGMXCCGn1
    SolutionIndex: 48
    SolutionNameMin: Cijk_Ailk_Bljk_I8BH_UserArgs_MT64x64x128_MI16x16x1_SN_CLR1_GSU0_GSUC0_GSUWGMRR0_K1_LBSPPA1024_LBSPPB128_LPA32_MIWT2_2_PLR1_SU0_SUM0_SUS128_SKXCCM8_VWA2_VWB1_WGM1_WGMXCC1_WGMXCCGn1
    SolutionIndex: 49
    SolutionNameMin: Cijk_Ailk_Bljk_I8BH_UserArgs_MT64x64x128_MI16x16x1_SN_CLR1_GSU0_GSUC0_GSUWGMRR0_K1_LBSPPA1024_LBSPPB256_LPA32_MIWT2_2_PLR1_SU0_SUM0_SUS128_SKXCCM8_VWA2_VWB2_WGM1_WGMXCC1_WGMXCCGn1
    SolutionIndex: 50
    SolutionNameMin: Cijk_Ailk_Bljk_I8BH_UserArgs_MT32x64x128_MI16x16x1_SN_CLR1_GSU0_GSUC0_GSUWGMRR0_K1_LBSPPA512_LBSPPB128_LPA16_MIWT1_2_PLR1_SU0_SUM0_SUS128_SKXCCM8_VWA1_VWB1_WGM1_WGMXCC1_WGMXCCGn1
    SolutionIndex: 51
    SolutionNameMin: Cijk_Ailk_Bljk_I8BH_UserArgs_MT32x64x128_MI16x16x1_SN_CLR1_GSU0_GSUC0_GSUWGMRR0_K1_LBSPPA512_LBSPPB256_LPA16_MIWT1_2_PLR1_SU0_SUM0_SUS128_SKXCCM8_VWA1_VWB2_WGM1_WGMXCC1_WGMXCCGn1
    SolutionIndex: 52
    SolutionNameMin: Cijk_Ailk_Bljk_I8BH_UserArgs_MT32x64x128_MI16x16x1_SN_CLR1_GSU0_GSUC0_GSUWGMRR0_K1_LBSPPA512_LBSPPB128_LPA16_MIWT1_2_PLR1_SU0_SUM0_SUS128_SKXCCM8_VWA1_VWB1_WGM4_WGMXCC1_WGMXCCGn1
    SolutionIndex: 53
    SolutionNameMin: Cijk_Ailk_Bljk_I8BH_UserArgs_MT32x64x128_MI16x16x1_SN_CLR1_GSU0_GSUC0_GSUWGMRR0_K1_LBSPPA512_LBSPPB128_LPA16_MIWT1_2_PLR1_SU0_SUM0_SUS128_SKXCCM8_VWA1_VWB1_WGM8_WGMXCC1_WGMXCCGn1
    SolutionIndex: 54
    SolutionNameMin: Cijk_Ailk_Bljk_I8BH_UserArgs_MT64x32x128_MI16x16x1_SN_CLR1_GSU0_GSUC0_GSUWGMRR0_K1_LBSPPA1024_LBSPPB128_LPA32_MIWT2_1_PLR1_SU0_SUM0_SUS128_SKXCCM8_VWA2_VWB1_WGM1_WGMXCC1_WGMXCCGn1
    SolutionIndex: 55
    SolutionNameMin: Cijk_Ailk_Bljk_I8BH_UserArgs_MT64x32x128_MI16x16x1_SN_CLR1_GSU0_GSUC0_GSUWGMRR0_K1_LBSPPA1024_LBSPPB128_LPA32_MIWT2_1_PLR1_SU0_SUM0_SUS128_SKXCCM8_VWA2_VWB1_WGM1_WGMXCC1_WGMXCCGn1
    SolutionIndex: 56
    SolutionNameMin: Cijk_Ailk_Bljk_I8BH_UserArgs_MT32x32x128_MI16x16x1_SN_CLR1_GSU0_GSUC0_GSUWGMRR0_K1_LBSPPA512_LBSPPB128_LPA16_MIWT1_1_PLR1_SU0_SUM0_SUS128_SKXCCM8_VWA1_VWB1_WGM1_WGMXCC1_WGMXCCGn1
    SolutionIndex: 57
    SolutionNameMin: Cijk_Ailk_Bljk_I8BH_UserArgs_MT32x32x128_MI16x16x1_SN_CLR1_GSU0_GSUC0_GSUWGMRR0_K1_LBSPPA512_LBSPPB128_LPA16_MIWT1_1_PLR1_SU0_SUM0_SUS128_SKXCCM8_VWA1_VWB1_WGM1_WGMXCC1_WGMXCCGn1
    SolutionIndex: 58
    SolutionNameMin: Cijk_Ailk_Bljk_I8BH_UserArgs_MT32x32x128_MI16x16x1_SN_CLR1_GSU0_GSUC0_GSUWGMRR0_K1_LBSPPA512_LBSPPB128_LPA16_MIWT1_1_PLR1_SU0_SUM0_SUS128_SKXCCM8_VWA1_VWB1_WGM1_WGMXCC1_WGMXCCGn1
    SolutionIndex: 59
    SolutionNameMin: Cijk_Ailk_Bljk_I8BH_UserArgs_MT32x32x128_MI16x16x1_SN_CLR1_GSU0_GSUC0_GSUWGMRR0_K1_LBSPPA512_LBSPPB128_LPA16_MIWT1_1_PLR1_SU0_SUM0_SUS128_SKXCCM8_VWA1_VWB1_WGM8_WGMXCC1_WGMXCCGn1
    SolutionIndex: 60
    SolutionNameMin: Cijk_Ailk_Bljk_I8BH_UserArgs_MT64x128x256_MI16x16x1_SN_CLR1_GSU0_GSUC0_GSUWGMRR0_K1_LBSPPA1024_LBSPPB1024_LPA32_MIWT2_4_PLR2_SU0_SUM0_SUS256_SKXCCM8_VWA2_VWB4_WGM1_WGMXCC1_WGMXCCGn1
    SolutionIndex: 61
    SolutionNameMin: Cijk_Ailk_Bljk_I8BH_UserArgs_MT128x64x256_MI16x16x1_SN_CLR1_GSU0_GSUC0_GSUWGMRR0_K1_LBSPPA2048_LBSPPB256_LPA64_MIWT4_2_PLR2_SU0_SUM0_SUS256_SKXCCM8_VWA4_VWB1_WGM1_WGMXCC1_WGMXCCGn1
    SolutionIndex: 62
    SolutionNameMin: Cijk_Ailk_Bljk_I8BH_UserArgs_MT64x64x256_MI16x16x1_SN_CLR1_GSU0_GSUC0_GSUWGMRR0_K1_LBSPPA1024_LBSPPB256_LPA32_MIWT2_2_PLR2_SU0_SUM0_SUS256_SKXCCM8_VWA2_VWB1_WGM1_WGMXCC1_WGMXCCGn1
    SolutionIndex: 63
    SolutionNameMin: Cijk_Ailk_Bljk_I8BH_UserArgs_MT64x64x256_MI16x16x1_SN_CLR1_GSU0_GSUC0_GSUWGMRR0_K1_LBSPPA1024_LBSPPB256_LPA32_MIWT2_2_PLR2_SU0_SUM0_SUS256_SKXCCM8_VWA2_VWB1_WGM4_WGMXCC1_WGMXCCGn1
    SolutionIndex: 64
    SolutionNameMin: Cijk_Ailk_Bljk_I8BH_UserArgs_MT32x32x256_MI16x16x1_SN_CLR1_GSU0_GSUC0_GSUWGMRR0_K1_LBSPPA512_LBSPPB256_LPA16_MIWT1_1_PLR2_SU0_SUM0_SUS256_SKXCCM8_VWA1_VWB1_WGM1_WGMXCC1_WGMXCCGn1
    SolutionIndex: 65
    SolutionNameMin: Cijk_Ailk_Bljk_I8BH_UserArgs_MT32x32x32_MI16x16x1_SN_CLR0_GSU0_GSUC0_GSUWGMRR0_K1_LBSPPA256_LBSPPB128_LPA16_MIWT1_1_PLR0_SU32_SUM0_SUS256_SKXCCM0_VWA1_VWB1_WGM1_WGMXCC1_WGMXCCGn1
- - - [128, 128, 1, 128, 128, 128, 128, 128]
    - [31, 0.64]
  - - [128, 128, 1, 256, 128, 128, 128, 256]
    - [33, 1.13]
  - - [128, 128, 1, 512, 128, 128, 128, 512]
    - [58, 1.93]
  - - [128, 128, 1, 1024, 128, 128, 128, 1024]
    - [58, 2.96]
  - - [128, 128, 1, 2048, 128, 128, 128, 2048]
    - [58, 4.03]
  - - [128, 128, 1, 4096, 128, 128, 128, 4096]
    - [64, 5.01]
  - - [128, 128, 1, 8192, 128, 128, 128, 8192]
    - [64, 5.67]
  - - [128, 256, 1, 128, 128, 128, 128, 128]
    - [31, 1.28]
  - - [128, 256, 1, 256, 128, 128, 128, 256]
    - [56, 2.27]
  - - [128, 256, 1, 512, 128, 128, 128, 512]
    - [57, 3.85]
  - - [128, 256, 1, 1024, 128, 128, 128, 1024]
    - [58, 5.89]
  - - [128, 256, 1, 2048, 128, 128, 128, 2048]
    - [58, 8.04]
  - - [128, 256, 1, 4096, 128, 128, 128, 4096]
    - [64, 9.98]
  - - [128, 256, 1, 8192, 128, 128, 128, 8192]
    - [64, 11.32]
  - - [128, 512, 1, 128, 128, 128, 128, 128]
    - [57, 2.48]
  - - [128, 512, 1, 256, 128, 128, 128, 256]
    - [33, 4.45]
  - - [128, 512, 1, 512, 128, 128, 128, 512]
    - [58, 7.47]
  - - [128, 512, 1, 1024, 128, 128, 128, 1024]
    - [58, 11.43]
  - - [128, 512, 1, 2048, 128, 128, 128, 2048]
    - [64, 15.69]
  - - [128, 512, 1, 4096, 128, 128, 128, 4096]
    - [64, 19.68]
  - - [128, 512, 1, 8192, 128, 128, 128, 8192]
    - [64, 22.36]
  - - [128, 1024, 1, 128, 128, 128, 128, 128]
    - [30, 4.62]
  - - [128, 1024, 1, 256, 128, 128, 128, 256]
    - [55, 8.24]
  - - [128, 1024, 1, 512, 128, 128, 128, 512]
    - [51, 13.69]
  - - [128, 1024, 1, 1024, 128, 128, 128, 1024]
    - [50, 20.83]
  - - [128, 1024, 1, 2048, 128, 128, 128, 2048]
    - [51, 27.95]
  - - [128, 1024, 1, 4096, 128, 128, 128, 4096]
    - [51, 34.05]
  - - [128, 1024, 1, 8192, 128, 128, 128, 8192]
    - [51, 38.34]
  - - [128, 2048, 1, 128, 128, 128, 128, 128]
    - [29, 8.37]
  - - [128, 2048, 1, 256, 128, 128, 128, 256]
    - [29, 14.6]
  - - [128, 2048, 1, 512, 128, 128, 128, 512]
    - [49, 23.61]
  - - [128, 2048, 1, 1024, 128, 128, 128, 1024]
    - [62, 34.76]
  - - [128, 2048, 1, 2048, 128, 128, 128, 2048]
    - [62, 46.91]
  - - [128, 2048, 1, 4096, 128, 128, 128, 4096]
    - [62, 56.65]
  - - [128, 2048, 1, 8192, 128, 128, 128, 8192]
    - [62, 59.02]
  - - [128, 4096, 1, 128, 128, 128, 128, 128]
    - [27, 14.33]
  - - [128, 4096, 1, 256, 128, 128, 128, 256]
    - [27, 24.39]
  - - [128, 4096, 1, 512, 128, 128, 128, 512]
    - [23, 38.55]
  - - [128, 4096, 1, 1024, 128, 128, 128, 1024]
    - [22, 54.29]
  - - [128, 4096, 1, 2048, 128, 128, 128, 2048]
    - [60, 70.53]
  - - [128, 4096, 1, 4096, 128, 128, 128, 4096]
    - [61, 76.73]
  - - [128, 4096, 1, 8192, 128, 128, 128, 8192]
    - [60, 87.33]
  - - [128, 8192, 1, 128, 128, 128, 128, 128]
    - [18, 22.71]
  - - [128, 8192, 1, 256, 128, 128, 128, 256]
    - [18, 38.36]
  - - [128, 8192, 1, 512, 128, 128, 128, 512]
    - [18, 58.31]
  - - [128, 8192, 1, 1024, 128, 128, 128, 1024]
    - [42, 81.18]
  - - [128, 8192, 1, 2048, 128, 128, 128, 2048]
    - [41, 97.75]
  - - [128, 8192, 1, 4096, 128, 128, 128, 4096]
    - [42, 111.92]
  - - [128, 8192, 1, 8192, 128, 128, 128, 8192]
    - [41, 120.79]
  - - [256, 128, 1, 128, 256, 256, 256, 128]
    - [31, 1.26]
  - - [256, 128, 1, 256, 256, 256, 256, 256]
    - [56, 2.26]
  - - [256, 128, 1, 512, 256, 256, 256, 512]
    - [56, 3.82]
  - - [256, 128, 1, 1024, 256, 256, 256, 1024]
    - [58, 5.9]
  - - [256, 128, 1, 2048, 256, 256, 256, 2048]
    - [58, 8.05]
  - - [256, 128, 1, 4096, 256, 256, 256, 4096]
    - [58, 9.83]
  - - [256, 128, 1, 8192, 256, 256, 256, 8192]
    - [64, 11.27]
  - - [256, 256, 1, 128, 256, 256, 256, 128]
    - [33, 2.49]
  - - [256, 256, 1, 256, 256, 256, 256, 256]
    - [31, 4.45]
  - - [256, 256, 1, 512, 256, 256, 256, 512]
    - [57, 7.59]
  - - [256, 256, 1, 1024, 256, 256, 256, 1024]
    - [57, 11.54]
  - - [256, 256, 1, 2048, 256, 256, 256, 2048]
    - [64, 15.5]
  - - [256, 256, 1, 4096, 256, 256, 256, 4096]
    - [58, 19.36]
  - - [256, 256, 1, 8192, 256, 256, 256, 8192]
    - [64, 22.12]
  - - [256, 512, 1, 128, 256, 256, 256, 128]
    - [30, 4.67]
  - - [256, 512, 1, 256, 256, 256, 256, 256]
    - [55, 8.21]
  - - [256, 512, 1, 512, 256, 256, 256, 512]
    - [50, 13.66]
  - - [256, 512, 1, 1024, 256, 256, 256, 1024]
    - [50, 20.69]
  - - [256, 512, 1, 2048, 256, 256, 256, 2048]
    - [50, 28.29]
  - - [256, 512, 1, 4096, 256, 256, 256, 4096]
    - [50, 34.28]
  - - [256, 512, 1, 8192, 256, 256, 256, 8192]
    - [51, 38.25]
  - - [256, 1024, 1, 128, 256, 256, 256, 128]
    - [29, 8.35]
  - - [256, 1024, 1, 256, 256, 256, 256, 256]
    - [29, 14.56]
  - - [256, 1024, 1, 512, 256, 256, 256, 512]
    - [49, 23.51]
  - - [256, 1024, 1, 1024, 256, 256, 256, 1024]
    - [49, 34.5]
  - - [256, 1024, 1, 2048, 256, 256, 256, 2048]
    - [62, 46.63]
  - - [256, 1024, 1, 4096, 256, 256, 256, 4096]
    - [62, 56.52]
  - - [256, 1024, 1, 8192, 256, 256, 256, 8192]
    - [62, 59.67]
  - - [256, 2048, 1, 128, 256, 256, 256, 128]
    - [27, 14.35]
  - - [256, 2048, 1, 256, 256, 256, 256, 256]
    - [27, 24.37]
  - - [256, 2048, 1, 512, 256, 256, 256, 512]
    - [22, 38.68]
  - - [256, 2048, 1, 1024, 256, 256, 256, 1024]
    - [22, 54.59]
  - - [256, 2048, 1, 2048, 256, 256, 256, 2048]
    - [60, 70.24]
  - - [256, 2048, 1, 4096, 256, 256, 256, 4096]
    - [60, 84.51]
  - - [256, 2048, 1, 8192, 256, 256, 256, 8192]
    - [46, 80.08]
  - - [256, 4096, 1, 128, 256, 256, 256, 128]
    - [18, 22.73]
  - - [256, 4096, 1, 256, 256, 256, 256, 256]
    - [17, 38.16]
  - - [256, 4096, 1, 512, 256, 256, 256, 512]
    - [42, 57.88]
  - - [256, 4096, 1, 1024, 256, 256, 256, 1024]
    - [41, 80.86]
  - - [256, 4096, 1, 2048, 256, 256, 256, 2048]
    - [42, 101.81]
  - - [256, 4096, 1, 4096, 256, 256, 256, 4096]
    - [42, 113.55]
  - - [256, 4096, 1, 8192, 256, 256, 256, 8192]
    - [44, 123.1]
  - - [256, 8192, 1, 128, 256, 256, 256, 128]
    - [2, 31.87]
  - - [256, 8192, 1, 256, 256, 256, 256, 256]
    - [9, 53.74]
  - - [256, 8192, 1, 512, 256, 256, 256, 512]
    - [10, 82.71]
  - - [256, 8192, 1, 1024, 256, 256, 256, 1024]
    - [9, 113.67]
  - - [256, 8192, 1, 2048, 256, 256, 256, 2048]
    - [35, 131.32]
  - - [256, 8192, 1, 4096, 256, 256, 256, 4096]
    - [34, 150.2]
  - - [256, 8192, 1, 8192, 256, 256, 256, 8192]
    - [36, 166.08]
  - - [512, 128, 1, 128, 512, 512, 512, 128]
    - [32, 2.48]
  - - [512, 128, 1, 256, 512, 512, 512, 256]
    - [56, 4.46]
  - - [512, 128, 1, 512, 512, 512, 512, 512]
    - [57, 7.59]
  - - [512, 128, 1, 1024, 512, 512, 512, 1024]
    - [57, 11.6]
  - - [512, 128, 1, 2048, 512, 512, 512, 2048]
    - [58, 15.89]
  - - [512, 128, 1, 4096, 512, 512, 512, 4096]
    - [58, 19.28]
  - - [512, 128, 1, 8192, 512, 512, 512, 8192]
    - [59, 21.68]
  - - [512, 256, 1, 128, 512, 512, 512, 128]
    - [30, 4.67]
  - - [512, 256, 1, 256, 512, 512, 512, 256]
    - [55, 8.18]
  - - [512, 256, 1, 512, 512, 512, 512, 512]
    - [55, 13.57]
  - - [512, 256, 1, 1024, 512, 512, 512, 1024]
    - [50, 20.49]
  - - [512, 256, 1, 2048, 512, 512, 512, 2048]
    - [50, 27.28]
  - - [512, 256, 1, 4096, 512, 512, 512, 4096]
    - [50, 32.94]
  - - [512, 256, 1, 8192, 512, 512, 512, 8192]
    - [53, 34.47]
  - - [512, 512, 1, 128, 512, 512, 512, 128]
    - [29, 8.38]
  - - [512, 512, 1, 256, 512, 512, 512, 256]
    - [29, 14.53]
  - - [512, 512, 1, 512, 512, 512, 512, 512]
    - [48, 23.48]
  - - [512, 512, 1, 1024, 512, 512, 512, 1024]
    - [49, 34.45]
  - - [512, 512, 1, 2048, 512, 512, 512, 2048]
    - [49, 44.82]
  - - [512, 512, 1, 4096, 512, 512, 512, 4096]
    - [62, 53.74]
  - - [512, 512, 1, 8192, 512, 512, 512, 8192]
    - [29, 48.92]
  - - [512, 1024, 1, 128, 512, 512, 512, 128]
    - [27, 14.43]
  - - [512, 1024, 1, 256, 512, 512, 512, 256]
    - [27, 24.44]
  - - [512, 1024, 1, 512, 512, 512, 512, 512]
    - [22, 38.62]
  - - [512, 1024, 1, 1024, 512, 512, 512, 1024]
    - [22, 54.46]
  - - [512, 1024, 1, 2048, 512, 512, 512, 2048]
    - [22, 68.41]
  - - [512, 1024, 1, 4096, 512, 512, 512, 4096]
    - [60, 81.43]
  - - [512, 1024, 1, 8192, 512, 512, 512, 8192]
    - [20, 74.25]
  - - [512, 2048, 1, 128, 512, 512, 512, 128]
    - [18, 22.3]
  - - [512, 2048, 1, 256, 512, 512, 512, 256]
    - [19, 38.22]
  - - [512, 2048, 1, 512, 512, 512, 512, 512]
    - [18, 58.41]
  - - [512, 2048, 1, 1024, 512, 512, 512, 1024]
    - [41, 81.3]
  - - [512, 2048, 1, 2048, 512, 512, 512, 2048]
    - [42, 102.14]
  - - [512, 2048, 1, 4096, 512, 512, 512, 4096]
    - [41, 109.85]
  - - [512, 2048, 1, 8192, 512, 512, 512, 8192]
    - [45, 114.9]
  - - [512, 4096, 1, 128, 512, 512, 512, 128]
    - [3, 31.74]
  - - [512, 4096, 1, 256, 512, 512, 512, 256]
    - [9, 53.65]
  - - [512, 4096, 1, 512, 512, 512, 512, 512]
    - [9, 82.8]
  - - [512, 4096, 1, 1024, 512, 512, 512, 1024]
    - [9, 113.27]
  - - [512, 4096, 1, 2048, 512, 512, 512, 2048]
    - [35, 140.56]
  - - [512, 4096, 1, 4096, 512, 512, 512, 4096]
    - [40, 147.3]
  - - [512, 4096, 1, 8192, 512, 512, 512, 8192]
    - [40, 158.7]
  - - [512, 8192, 1, 128, 512, 512, 512, 128]
    - [0, 40.67]
  - - [512, 8192, 1, 256, 512, 512, 512, 256]
    - [8, 67.02]
  - - [512, 8192, 1, 512, 512, 512, 512, 512]
    - [4, 100.92]
  - - [512, 8192, 1, 1024, 512, 512, 512, 1024]
    - [4, 134.27]
  - - [512, 8192, 1, 2048, 512, 512, 512, 2048]
    - [5, 162.84]
  - - [512, 8192, 1, 4096, 512, 512, 512, 4096]
    - [7, 182.44]
  - - [512, 8192, 1, 8192, 512, 512, 512, 8192]
    - [6, 194.29]
  - - [1024, 128, 1, 128, 1024, 1024, 1024, 128]
    - [54, 4.68]
  - - [1024, 128, 1, 256, 1024, 1024, 1024, 256]
    - [54, 8.21]
  - - [1024, 128, 1, 512, 1024, 1024, 1024, 512]
    - [50, 13.55]
  - - [1024, 128, 1, 1024, 1024, 1024, 1024, 1024]
    - [51, 20.36]
  - - [1024, 128, 1, 2048, 1024, 1024, 1024, 2048]
    - [50, 27.41]
  - - [1024, 128, 1, 4096, 1024, 1024, 1024, 4096]
    - [52, 32.73]
  - - [1024, 128, 1, 8192, 1024, 1024, 1024, 8192]
    - [54, 32.5]
  - - [1024, 256, 1, 128, 1024, 1024, 1024, 128]
    - [29, 8.33]
  - - [1024, 256, 1, 256, 1024, 1024, 1024, 256]
    - [47, 14.32]
  - - [1024, 256, 1, 512, 1024, 1024, 1024, 512]
    - [49, 23.48]
  - - [1024, 256, 1, 1024, 1024, 1024, 1024, 1024]
    - [49, 34.14]
  - - [1024, 256, 1, 2048, 1024, 1024, 1024, 2048]
    - [49, 44.45]
  - - [1024, 256, 1, 4096, 1024, 1024, 1024, 4096]
    - [63, 53.26]
  - - [1024, 256, 1, 8192, 1024, 1024, 1024, 8192]
    - [29, 49.1]
  - - [1024, 512, 1, 128, 1024, 1024, 1024, 128]
    - [27, 14.36]
  - - [1024, 512, 1, 256, 1024, 1024, 1024, 256]
    - [27, 24.36]
  - - [1024, 512, 1, 512, 1024, 1024, 1024, 512]
    - [22, 38.39]
  - - [1024, 512, 1, 1024, 1024, 1024, 1024, 1024]
    - [22, 54.44]
  - - [1024, 512, 1, 2048, 1024, 1024, 1024, 2048]
    - [60, 68.07]
  - - [1024, 512, 1, 4096, 1024, 1024, 1024, 4096]
    - [25, 70.06]
  - - [1024, 512, 1, 8192, 1024, 1024, 1024, 8192]
    - [20, 77.89]
  - - [1024, 1024, 1, 128, 1024, 1024, 1024, 128]
    - [18, 22.65]
  - - [1024, 1024, 1, 256, 1024, 1024, 1024, 256]
    - [19, 37.75]
  - - [1024, 1024, 1, 512, 1024, 1024, 1024, 512]
    - [18, 58.04]
  - - [1024, 1024, 1, 1024, 1024, 1024, 1024, 1024]
    - [44, 80.05]
  - - [1024, 1024, 1, 2048, 1024, 1024, 1024, 2048]
    - [41, 101.97]
  - - [1024, 1024, 1, 4096, 1024, 1024, 1024, 4096]
    - [45, 107.45]
  - - [1024, 1024, 1, 8192, 1024, 1024, 1024, 8192]
    - [43, 115.78]
  - - [1024, 2048, 1, 128, 1024, 1024, 1024, 128]
    - [2, 31.93]
  - - [1024, 2048, 1, 256, 1024, 1024, 1024, 256]
    - [9, 53.45]
  - - [1024, 2048, 1, 512, 1024, 1024, 1024, 512]
    - [9, 82.62]
  - - [1024, 2048, 1, 1024, 1024, 1024, 1024, 1024]
    - [10, 113.6]
  - - [1024, 2048, 1, 2048, 1024, 1024, 1024, 2048]
    - [34, 140.8]
  - - [1024, 2048, 1, 4096, 1024, 1024, 1024, 4096]
    - [14, 147.3]
  - - [1024, 2048, 1, 8192, 1024, 1024, 1024, 8192]
    - [40, 158.7]
  - - [1024, 4096, 1, 128, 1024, 1024, 1024, 128]
    - [0, 40.62]
  - - [1024, 4096, 1, 256, 1024, 1024, 1024, 256]
    - [4, 67.02]
  - - [1024, 4096, 1, 512, 1024, 1024, 1024, 512]
    - [8, 100.7]
  - - [1024, 4096, 1, 1024, 1024, 1024, 1024, 1024]
    - [4, 135.65]
  - - [1024, 4096, 1, 2048, 1024, 1024, 1024, 2048]
    - [5, 162.76]
  - - [1024, 4096, 1, 4096, 1024, 1024, 1024, 4096]
    - [6, 182.4]
  - - [1024, 4096, 1, 8192, 1024, 1024, 1024, 8192]
    - [7, 194.58]
  - - [1024, 8192, 1, 128, 1024, 1024, 1024, 128]
    - [1, 43.59]
  - - [1024, 8192, 1, 256, 1024, 1024, 1024, 256]
    - [5, 70.45]
  - - [1024, 8192, 1, 512, 1024, 1024, 1024, 512]
    - [5, 104.48]
  - - [1024, 8192, 1, 1024, 1024, 1024, 1024, 1024]
    - [5, 138.73]
  - - [1024, 8192, 1, 2048, 1024, 1024, 1024, 2048]
    - [5, 166.12]
  - - [1024, 8192, 1, 4096, 1024, 1024, 1024, 4096]
    - [6, 184.79]
  - - [1024, 8192, 1, 8192, 1024, 1024, 1024, 8192]
    - [7, 196.27]
  - - [2048, 128, 1, 128, 2048, 2048, 2048, 128]
    - [47, 8.3]
  - - [2048, 128, 1, 256, 2048, 2048, 2048, 256]
    - [29, 14.51]
  - - [2048, 128, 1, 512, 2048, 2048, 2048, 512]
    - [49, 23.46]
  - - [2048, 128, 1, 1024, 2048, 2048, 2048, 1024]
    - [49, 34.32]
  - - [2048, 128, 1, 2048, 2048, 2048, 2048, 2048]
    - [28, 38.11]
  - - [2048, 128, 1, 4096, 2048, 2048, 2048, 4096]
    - [28, 43.79]
  - - [2048, 128, 1, 8192, 2048, 2048, 2048, 8192]
    - [28, 47.59]
  - - [2048, 256, 1, 128, 2048, 2048, 2048, 128]
    - [27, 14.13]
  - - [2048, 256, 1, 256, 2048, 2048, 2048, 256]
    - [27, 24.37]
  - - [2048, 256, 1, 512, 2048, 2048, 2048, 512]
    - [22, 38.35]
  - - [2048, 256, 1, 1024, 2048, 2048, 2048, 1024]
    - [22, 53.7]
  - - [2048, 256, 1, 2048, 2048, 2048, 2048, 2048]
    - [20, 64.12]
  - - [2048, 256, 1, 4096, 2048, 2048, 2048, 4096]
    - [26, 73.21]
  - - [2048, 256, 1, 8192, 2048, 2048, 2048, 8192]
    - [21, 80.88]
  - - [2048, 512, 1, 128, 2048, 2048, 2048, 128]
    - [18, 22.56]
  - - [2048, 512, 1, 256, 2048, 2048, 2048, 256]
    - [18, 38.19]
  - - [2048, 512, 1, 512, 2048, 2048, 2048, 512]
    - [18, 58.14]
  - - [2048, 512, 1, 1024, 2048, 2048, 2048, 1024]
    - [42, 81.32]
  - - [2048, 512, 1, 2048, 2048, 2048, 2048, 2048]
    - [16, 93.6]
  - - [2048, 512, 1, 4096, 2048, 2048, 2048, 4096]
    - [42, 106.47]
  - - [2048, 512, 1, 8192, 2048, 2048, 2048, 8192]
    - [45, 114.63]
  - - [2048, 1024, 1, 128, 2048, 2048, 2048, 128]
    - [3, 31.7]
  - - [2048, 1024, 1, 256, 2048, 2048, 2048, 256]
    - [12, 53.11]
  - - [2048, 1024, 1, 512, 2048, 2048, 2048, 512]
    - [10, 82.33]
  - - [2048, 1024, 1, 1024, 2048, 2048, 2048, 1024]
    - [10, 110.12]
  - - [2048, 1024, 1, 2048, 2048, 2048, 2048, 2048]
    - [13, 130.86]
  - - [2048, 1024, 1, 4096, 2048, 2048, 2048, 4096]
    - [37, 147.64]
  - - [2048, 1024, 1, 8192, 2048, 2048, 2048, 8192]
    - [40, 158.64]
  - - [2048, 2048, 1, 128, 2048, 2048, 2048, 128]
    - [0, 40.8]
  - - [2048, 2048, 1, 256, 2048, 2048, 2048, 256]
    - [4, 66.79]
  - - [2048, 2048, 1, 512, 2048, 2048, 2048, 512]
    - [8, 100.88]
  - - [2048, 2048, 1, 1024, 2048, 2048, 2048, 1024]
    - [4, 133.8]
  - - [2048, 2048, 1, 2048, 2048, 2048, 2048, 2048]
    - [5, 162.52]
  - - [2048, 2048, 1, 4096, 2048, 2048, 2048, 4096]
    - [6, 182.06]
  - - [2048, 2048, 1, 8192, 2048, 2048, 2048, 8192]
    - [7, 194.39]
  - - [2048, 4096, 1, 128, 2048, 2048, 2048, 128]
    - [0, 43.59]
  - - [2048, 4096, 1, 256, 2048, 2048, 2048, 256]
    - [5, 70.84]
  - - [2048, 4096, 1, 512, 2048, 2048, 2048, 512]
    - [5, 105.29]
  - - [2048, 4096, 1, 1024, 2048, 2048, 2048, 1024]
    - [5, 138.52]
  - - [2048, 4096, 1, 2048, 2048, 2048, 2048, 2048]
    - [5, 166.45]
  - - [2048, 4096, 1, 4096, 2048, 2048, 2048, 4096]
    - [5, 184.84]
  - - [2048, 4096, 1, 8192, 2048, 2048, 2048, 8192]
    - [7, 196.09]
  - - [2048, 8192, 1, 128, 2048, 2048, 2048, 128]
    - [1, 46.05]
  - - [2048, 8192, 1, 256, 2048, 2048, 2048, 256]
    - [5, 73.78]
  - - [2048, 8192, 1, 512, 2048, 2048, 2048, 512]
    - [5, 108.54]
  - - [2048, 8192, 1, 1024, 2048, 2048, 2048, 1024]
    - [5, 141.44]
  - - [2048, 8192, 1, 2048, 2048, 2048, 2048, 2048]
    - [5, 168.46]
  - - [2048, 8192, 1, 4096, 2048, 2048, 2048, 4096]
    - [6, 186.24]
  - - [2048, 8192, 1, 8192, 2048, 2048, 2048, 8192]
    - [6, 197.15]
  - - [4096, 128, 1, 128, 4096, 4096, 4096, 128]
    - [27, 14.12]
  - - [4096, 128, 1, 256, 4096, 4096, 4096, 256]
    - [24, 24.21]
  - - [4096, 128, 1, 512, 4096, 4096, 4096, 512]
    - [22, 38.61]
  - - [4096, 128, 1, 1024, 4096, 4096, 4096, 1024]
    - [46, 51.89]
  - - [4096, 128, 1, 2048, 4096, 4096, 4096, 2048]
    - [21, 64.44]
  - - [4096, 128, 1, 4096, 4096, 4096, 4096, 4096]
    - [21, 73.84]
  - - [4096, 128, 1, 8192, 4096, 4096, 4096, 8192]
    - [21, 81.03]
  - - [4096, 256, 1, 128, 4096, 4096, 4096, 128]
    - [18, 22.54]
  - - [4096, 256, 1, 256, 4096, 4096, 4096, 256]
    - [18, 38.13]
  - - [4096, 256, 1, 512, 4096, 4096, 4096, 512]
    - [19, 58.06]
  - - [4096, 256, 1, 1024, 4096, 4096, 4096, 1024]
    - [41, 81.55]
  - - [4096, 256, 1, 2048, 4096, 4096, 4096, 2048]
    - [16, 92.62]
  - - [4096, 256, 1, 4096, 4096, 4096, 4096, 4096]
    - [42, 106.0]
  - - [4096, 256, 1, 8192, 4096, 4096, 4096, 8192]
    - [41, 114.3]
  - - [4096, 512, 1, 128, 4096, 4096, 4096, 128]
    - [2, 31.73]
  - - [4096, 512, 1, 256, 4096, 4096, 4096, 256]
    - [10, 53.41]
  - - [4096, 512, 1, 512, 4096, 4096, 4096, 512]
    - [9, 82.18]
  - - [4096, 512, 1, 1024, 4096, 4096, 4096, 1024]
    - [11, 109.89]
  - - [4096, 512, 1, 2048, 4096, 4096, 4096, 2048]
    - [13, 131.1]
  - - [4096, 512, 1, 4096, 4096, 4096, 4096, 4096]
    - [39, 147.44]
  - - [4096, 512, 1, 8192, 4096, 4096, 4096, 8192]
    - [38, 160.43]
  - - [4096, 1024, 1, 128, 4096, 4096, 4096, 128]
    - [0, 40.66]
  - - [4096, 1024, 1, 256, 4096, 4096, 4096, 256]
    - [4, 67.07]
  - - [4096, 1024, 1, 512, 4096, 4096, 4096, 512]
    - [8, 100.29]
  - - [4096, 1024, 1, 1024, 4096, 4096, 4096, 1024]
    - [5, 133.48]
  - - [4096, 1024, 1, 2048, 4096, 4096, 4096, 2048]
    - [5, 162.64]
  - - [4096, 1024, 1, 4096, 4096, 4096, 4096, 4096]
    - [6, 182.18]
  - - [4096, 1024, 1, 8192, 4096, 4096, 4096, 8192]
    - [6, 194.58]
  - - [4096, 2048, 1, 128, 4096, 4096, 4096, 128]
    - [0, 43.6]
  - - [4096, 2048, 1, 256, 4096, 4096, 4096, 256]
    - [5, 70.74]
  - - [4096, 2048, 1, 512, 4096, 4096, 4096, 512]
    - [5, 104.83]
  - - [4096, 2048, 1, 1024, 4096, 4096, 4096, 1024]
    - [5, 138.77]
  - - [4096, 2048, 1, 2048, 4096, 4096, 4096, 2048]
    - [5, 166.43]
  - - [4096, 2048, 1, 4096, 4096, 4096, 4096, 4096]
    - [6, 184.86]
  - - [4096, 2048, 1, 8192, 4096, 4096, 4096, 8192]
    - [7, 196.0]
  - - [4096, 4096, 1, 128, 4096, 4096, 4096, 128]
    - [1, 45.94]
  - - [4096, 4096, 1, 256, 4096, 4096, 4096, 256]
    - [5, 73.45]
  - - [4096, 4096, 1, 512, 4096, 4096, 4096, 512]
    - [5, 108.23]
  - - [4096, 4096, 1, 1024, 4096, 4096, 4096, 1024]
    - [5, 141.74]
  - - [4096, 4096, 1, 2048, 4096, 4096, 4096, 2048]
    - [5, 168.46]
  - - [4096, 4096, 1, 4096, 4096, 4096, 4096, 4096]
    - [6, 186.32]
  - - [4096, 4096, 1, 8192, 4096, 4096, 4096, 8192]
    - [6, 197.13]
  - - [4096, 8192, 1, 128, 4096, 4096, 4096, 128]
    - [1, 47.33]
  - - [4096, 8192, 1, 256, 4096, 4096, 4096, 256]
    - [5, 75.3]
  - - [4096, 8192, 1, 512, 4096, 4096, 4096, 512]
    - [5, 110.19]
  - - [4096, 8192, 1, 1024, 4096, 4096, 4096, 1024]
    - [5, 143.23]
  - - [4096, 8192, 1, 2048, 4096, 4096, 4096, 2048]
    - [5, 169.59]
  - - [4096, 8192, 1, 4096, 4096, 4096, 4096, 4096]
    - [5, 187.23]
  - - [4096, 8192, 1, 8192, 4096, 4096, 4096, 8192]
    - [6, 197.6]
  - - [8192, 128, 1, 128, 8192, 8192, 8192, 128]
    - [18, 22.52]
  - - [8192, 128, 1, 256, 8192, 8192, 8192, 256]
    - [19, 37.78]
  - - [8192, 128, 1, 512, 8192, 8192, 8192, 512]
    - [18, 58.21]
  - - [8192, 128, 1, 1024, 8192, 8192, 8192, 1024]
    - [18, 75.59]
  - - [8192, 128, 1, 2048, 8192, 8192, 8192, 2048]
    - [16, 92.9]
  - - [8192, 128, 1, 4096, 8192, 8192, 8192, 4096]
    - [41, 104.61]
  - - [8192, 128, 1, 8192, 8192, 8192, 8192, 8192]
    - [41, 111.44]
  - - [8192, 256, 1, 128, 8192, 8192, 8192, 128]
    - [3, 31.65]
  - - [8192, 256, 1, 256, 8192, 8192, 8192, 256]
    - [9, 53.43]
  - - [8192, 256, 1, 512, 8192, 8192, 8192, 512]
    - [9, 80.74]
  - - [8192, 256, 1, 1024, 8192, 8192, 8192, 1024]
    - [15, 107.78]
  - - [8192, 256, 1, 2048, 8192, 8192, 8192, 2048]
    - [13, 130.84]
  - - [8192, 256, 1, 4096, 8192, 8192, 8192, 4096]
    - [40, 147.39]
  - - [8192, 256, 1, 8192, 8192, 8192, 8192, 8192]
    - [40, 158.66]
  - - [8192, 512, 1, 128, 8192, 8192, 8192, 128]
    - [0, 40.89]
  - - [8192, 512, 1, 256, 8192, 8192, 8192, 256]
    - [8, 67.12]
  - - [8192, 512, 1, 512, 8192, 8192, 8192, 512]
    - [4, 100.86]
  - - [8192, 512, 1, 1024, 8192, 8192, 8192, 1024]
    - [4, 133.47]
  - - [8192, 512, 1, 2048, 8192, 8192, 8192, 2048]
    - [5, 162.09]
  - - [8192, 512, 1, 4096, 8192, 8192, 8192, 4096]
    - [5, 182.22]
  - - [8192, 512, 1, 8192, 8192, 8192, 8192, 8192]
    - [6, 194.29]
  - - [8192, 1024, 1, 128, 8192, 8192, 8192, 128]
    - [0, 43.9]
  - - [8192, 1024, 1, 256, 8192, 8192, 8192, 256]
    - [5, 71.11]
  - - [8192, 1024, 1, 512, 8192, 8192, 8192, 512]
    - [5, 103.97]
  - - [8192, 1024, 1, 1024, 8192, 8192, 8192, 1024]
    - [5, 138.58]
  - - [8192, 1024, 1, 2048, 8192, 8192, 8192, 2048]
    - [5, 166.22]
  - - [8192, 1024, 1, 4096, 8192, 8192, 8192, 4096]
    - [6, 184.9]
  - - [8192, 1024, 1, 8192, 8192, 8192, 8192, 8192]
    - [6, 196.12]
  - - [8192, 2048, 1, 128, 8192, 8192, 8192, 128]
    - [1, 45.88]
  - - [8192, 2048, 1, 256, 8192, 8192, 8192, 256]
    - [5, 73.4]
  - - [8192, 2048, 1, 512, 8192, 8192, 8192, 512]
    - [5, 107.99]
  - - [8192, 2048, 1, 1024, 8192, 8192, 8192, 1024]
    - [5, 141.76]
  - - [8192, 2048, 1, 2048, 8192, 8192, 8192, 2048]
    - [5, 168.33]
  - - [8192, 2048, 1, 4096, 8192, 8192, 8192, 4096]
    - [5, 186.16]
  - - [8192, 2048, 1, 8192, 8192, 8192, 8192, 8192]
    - [6, 196.97]
  - - [8192, 4096, 1, 128, 8192, 8192, 8192, 128]
    - [1, 47.26]
  - - [8192, 4096, 1, 256, 8192, 8192, 8192, 256]
    - [5, 75.29]
  - - [8192, 4096, 1, 512, 8192, 8192, 8192, 512]
    - [5, 110.27]
  - - [8192, 4096, 1, 1024, 8192, 8192, 8192, 1024]
    - [5, 143.22]
  - - [8192, 4096, 1, 2048, 8192, 8192, 8192, 2048]
    - [5, 169.77]
  - - [8192, 4096, 1, 4096, 8192, 8192, 8192, 4096]
    - [5, 187.17]
  - - [8192, 4096, 1, 8192, 8192, 8192, 8192, 8192]
    - [6, 197.63]
  - - [8192, 8192, 1, 128, 8192, 8192, 8192, 128]
    - [1, 47.81]
  - - [8192, 8192, 1, 256, 8192, 8192, 8192, 256]
    - [5, 76.14]
  - - [8192, 8192, 1, 512, 8192, 8192, 8192, 512]
    - [5, 111.18]
  - - [8192, 8192, 1, 1024, 8192, 8192, 8192, 1024]
    - [5, 143.69]
  - - [8192, 8192, 1, 2048, 8192, 8192, 8192, 2048]
    - [5, 170.4]
  - - [8192, 8192, 1, 4096, 8192, 8192, 8192, 4096]
    - [6, 187.5]
  - - [8192, 8192, 1, 8192, 8192, 8192, 8192, 8192]
    - [6, 197.74]
  - - [1, 1, 1, 32, 1, 1, 1, 32]
    - [65, 0.0]
- null
- null
- ExperimentalStreamK
- GridBased
