projects/hipblaslt/library/src/amd_detail/rocblaslt/src/Tensile/Logic/asm_full/aquavanjaram/gfx942_64cu/StreamK/aquavanjaram942_Cijk_Ailk_Bjlk_I8II_BH_UserArgs.yaml
- {MinimumRequiredVersion: 4.33.0}
- aquavanjaram942
- {Architecture: gfx942, CUCount: 64}
- [Device 0049, Device 0050]
    SolutionIndex: 0
    SolutionNameMin: Cijk_Ailk_Bjlk_I8II_BH_UserArgs_MT256x256x32_MI16x16x1_SN_CLR0_GSU0_GSUC0_GSUWGMRR0_K1_LBSPPA2048_LBSPPB2048_LPA64_LPB64_MIWT8_8_PLR0_SU0_SUM0_SUS32_SKXCCM8_VWA4_VWB4_WGM1_WGMXCC1_WGMXCCGn1
    SolutionIndex: 1
    SolutionNameMin: Cijk_Ailk_Bjlk_I8II_BH_UserArgs_MT256x256x32_MI16x16x1_SN_CLR0_GSU0_GSUC0_GSUWGMRR0_K1_LBSPPA2048_LBSPPB2048_LPA64_LPB64_MIWT8_8_PLR0_SU0_SUM0_SUS32_SKXCCM8_VWA4_VWB4_WGM1_WGMXCC1_WGMXCCGn1
    SolutionIndex: 2
    SolutionNameMin: Cijk_Ailk_Bjlk_I8II_BH_UserArgs_MT256x256x32_MI16x16x1_SN_CLR0_GSU0_GSUC0_GSUWGMRR0_K1_LBSPPA2048_LBSPPB2048_LPA64_LPB0_MIWT8_8_PLR0_SU0_SUM0_SUS32_SKXCCM8_VWA4_VWB8_WGM1_WGMXCC1_WGMXCCGn1
    SolutionIndex: 3
    SolutionNameMin: Cijk_Ailk_Bjlk_I8II_BH_UserArgs_MT256x256x32_MI16x16x1_SN_CLR0_GSU0_GSUC0_GSUWGMRR0_K1_LBSPPA2048_LBSPPB2048_LPA64_LPB0_MIWT8_8_PLR0_SU0_SUM0_SUS32_SKXCCM8_VWA4_VWB8_WGM4_WGMXCC1_WGMXCCGn1
    SolutionIndex: 4
    SolutionNameMin: Cijk_Ailk_Bjlk_I8II_BH_UserArgs_MT256x256x32_MI16x16x1_SN_CLR0_GSU0_GSUC0_GSUWGMRR0_K1_LBSPPA2048_LBSPPB2048_LPA64_LPB0_MIWT8_8_PLR0_SU0_SUM0_SUS32_SKXCCM8_VWA4_VWB8_WGM8_WGMXCC1_WGMXCCGn1
    SolutionIndex: 5
    SolutionNameMin: Cijk_Ailk_Bjlk_I8II_BH_UserArgs_MT256x128x32_MI16x16x1_SN_CLR0_GSU0_GSUC0_GSUWGMRR0_K1_LBSPPA2048_LBSPPB1024_LPA64_LPB64_MIWT8_4_PLR0_SU0_SUM0_SUS32_SKXCCM8_VWA4_VWB4_WGM1_WGMXCC1_WGMXCCGn1
    SolutionIndex: 6
    SolutionNameMin: Cijk_Ailk_Bjlk_I8II_BH_UserArgs_MT256x128x32_MI16x16x1_SN_CLR0_GSU0_GSUC0_GSUWGMRR0_K1_LBSPPA2048_LBSPPB1024_LPA64_LPB32_MIWT8_4_PLR0_SU0_SUM0_SUS32_SKXCCM8_VWA4_VWB2_WGM1_WGMXCC1_WGMXCCGn1
    SolutionIndex: 7
    SolutionNameMin: Cijk_Ailk_Bjlk_I8II_BH_UserArgs_MT128x64x32_MI16x16x1_SN_CLR0_GSU0_GSUC0_GSUWGMRR0_K1_LBSPPA1024_LBSPPB512_LPA64_LPB32_MIWT4_2_PLR0_SU0_SUM0_SUS32_SKXCCM8_VWA4_VWB2_WGM1_WGMXCC1_WGMXCCGn1
    SolutionIndex: 8
    SolutionNameMin: Cijk_Ailk_Bjlk_I8II_BH_UserArgs_MT32x32x32_MI16x16x1_SN_CLR0_GSU0_GSUC0_GSUWGMRR0_K1_LBSPPA256_LBSPPB256_LPA16_LPB16_MIWT1_1_PLR0_SU0_SUM0_SUS32_SKXCCM8_VWA1_VWB1_WGM1_WGMXCC1_WGMXCCGn1
    SolutionIndex: 9
    SolutionNameMin: Cijk_Ailk_Bjlk_I8II_BH_UserArgs_MT256x256x64_MI16x16x1_SN_CLR1_GSU0_GSUC0_GSUWGMRR0_K1_LBSPPA2048_LBSPPB2048_LPA64_LPB64_MIWT8_8_PLR1_SU0_SUM0_SUS64_SKXCCM8_VWA4_VWB4_WGM1_WGMXCC1_WGMXCCGn1
    SolutionIndex: 10
    SolutionNameMin: Cijk_Ailk_Bjlk_I8II_BH_UserArgs_MT256x256x64_MI16x16x1_SN_CLR1_GSU0_GSUC0_GSUWGMRR0_K1_LBSPPA2048_LBSPPB2048_LPA64_LPB0_MIWT8_8_PLR1_SU0_SUM0_SUS64_SKXCCM8_VWA4_VWB8_WGM1_WGMXCC1_WGMXCCGn1
    SolutionIndex: 11
    SolutionNameMin: Cijk_Ailk_Bjlk_I8II_BH_UserArgs_MT256x256x64_MI16x16x1_SN_CLR1_GSU0_GSUC0_GSUWGMRR0_K1_LBSPPA2048_LBSPPB2048_LPA64_LPB32_MIWT8_8_PLR1_SU0_SUM0_SUS64_SKXCCM8_VWA4_VWB2_WGM1_WGMXCC1_WGMXCCGn1
    SolutionIndex: 12
    SolutionNameMin: Cijk_Ailk_Bjlk_I8II_BH_UserArgs_MT256x256x64_MI16x16x1_SN_CLR1_GSU0_GSUC0_GSUWGMRR0_K1_LBSPPA2048_LBSPPB2048_LPA64_LPB0_MIWT8_8_PLR1_SU0_SUM0_SUS64_SKXCCM8_VWA4_VWB8_WGM1_WGMXCC1_WGMXCCGn1
    SolutionIndex: 13
    SolutionNameMin: Cijk_Ailk_Bjlk_I8II_BH_UserArgs_MT256x256x64_MI16x16x1_SN_CLR1_GSU0_GSUC0_GSUWGMRR0_K1_LBSPPA2048_LBSPPB2048_LPA64_LPB0_MIWT8_8_PLR1_SU0_SUM0_SUS64_SKXCCM8_VWA4_VWB8_WGM1_WGMXCC1_WGMXCCGn1
    SolutionIndex: 14
    SolutionNameMin: Cijk_Ailk_Bjlk_I8II_BH_UserArgs_MT256x256x64_MI16x16x1_SN_CLR1_GSU0_GSUC0_GSUWGMRR0_K1_LBSPPA2048_LBSPPB2048_LPA64_LPB64_MIWT8_8_PLR1_SU0_SUM0_SUS64_SKXCCM8_VWA4_VWB4_WGM4_WGMXCC1_WGMXCCGn1
    SolutionIndex: 15
    SolutionNameMin: Cijk_Ailk_Bjlk_I8II_BH_UserArgs_MT256x256x64_MI16x16x1_SN_CLR1_GSU0_GSUC0_GSUWGMRR0_K1_LBSPPA2048_LBSPPB2048_LPA64_LPB0_MIWT8_8_PLR1_SU0_SUM0_SUS64_SKXCCM8_VWA4_VWB8_WGM4_WGMXCC1_WGMXCCGn1
    SolutionIndex: 16
    SolutionNameMin: Cijk_Ailk_Bjlk_I8II_BH_UserArgs_MT256x256x64_MI16x16x1_SN_CLR1_GSU0_GSUC0_GSUWGMRR0_K1_LBSPPA2048_LBSPPB2048_LPA64_LPB64_MIWT8_8_PLR1_SU0_SUM0_SUS64_SKXCCM8_VWA4_VWB4_WGM8_WGMXCC1_WGMXCCGn1
    SolutionIndex: 17
    SolutionNameMin: Cijk_Ailk_Bjlk_I8II_BH_UserArgs_MT256x256x64_MI16x16x1_SN_CLR1_GSU0_GSUC0_GSUWGMRR0_K1_LBSPPA2048_LBSPPB2048_LPA64_LPB0_MIWT8_8_PLR1_SU0_SUM0_SUS64_SKXCCM8_VWA4_VWB8_WGM8_WGMXCC1_WGMXCCGn1
    SolutionIndex: 18
    SolutionNameMin: Cijk_Ailk_Bjlk_I8II_BH_UserArgs_MT128x256x64_MI16x16x1_SN_CLR1_GSU0_GSUC0_GSUWGMRR0_K1_LBSPPA1024_LBSPPB2048_LPA64_LPB0_MIWT4_8_PLR1_SU0_SUM0_SUS64_SKXCCM8_VWA4_VWB8_WGM1_WGMXCC1_WGMXCCGn1
    SolutionIndex: 19
    SolutionNameMin: Cijk_Ailk_Bjlk_I8II_BH_UserArgs_MT128x256x64_MI16x16x1_SN_CLR1_GSU0_GSUC0_GSUWGMRR0_K1_LBSPPA1024_LBSPPB2048_LPA64_LPB0_MIWT4_8_PLR1_SU0_SUM0_SUS64_SKXCCM8_VWA4_VWB8_WGM1_WGMXCC1_WGMXCCGn1
    SolutionIndex: 20
    SolutionNameMin: Cijk_Ailk_Bjlk_I8II_BH_UserArgs_MT128x256x64_MI16x16x1_SN_CLR1_GSU0_GSUC0_GSUWGMRR0_K1_LBSPPA1024_LBSPPB2048_LPA64_LPB0_MIWT4_8_PLR1_SU0_SUM0_SUS64_SKXCCM8_VWA4_VWB8_WGM4_WGMXCC1_WGMXCCGn1
    SolutionIndex: 21
    SolutionNameMin: Cijk_Ailk_Bjlk_I8II_BH_UserArgs_MT128x256x64_MI16x16x1_SN_CLR1_GSU0_GSUC0_GSUWGMRR0_K1_LBSPPA1024_LBSPPB2048_LPA64_LPB0_MIWT4_8_PLR1_SU0_SUM0_SUS64_SKXCCM8_VWA4_VWB8_WGM4_WGMXCC1_WGMXCCGn1
    SolutionIndex: 22
    SolutionNameMin: Cijk_Ailk_Bjlk_I8II_BH_UserArgs_MT256x128x64_MI16x16x1_SN_CLR1_GSU0_GSUC0_GSUWGMRR0_K1_LBSPPA2048_LBSPPB1024_LPA64_LPB64_MIWT8_4_PLR1_SU0_SUM0_SUS64_SKXCCM8_VWA4_VWB4_WGM1_WGMXCC1_WGMXCCGn1
    SolutionIndex: 23
    SolutionNameMin: Cijk_Ailk_Bjlk_I8II_BH_UserArgs_MT256x128x64_MI16x16x1_SN_CLR1_GSU0_GSUC0_GSUWGMRR0_K1_LBSPPA2048_LBSPPB1024_LPA64_LPB64_MIWT8_4_PLR1_SU0_SUM0_SUS64_SKXCCM8_VWA4_VWB4_WGM1_WGMXCC1_WGMXCCGn1
    SolutionIndex: 24
    SolutionNameMin: Cijk_Ailk_Bjlk_I8II_BH_UserArgs_MT256x128x64_MI16x16x1_SN_CLR1_GSU0_GSUC0_GSUWGMRR0_K1_LBSPPA2048_LBSPPB1024_LPA0_LPB64_MIWT8_4_PLR1_SU0_SUM0_SUS64_SKXCCM8_VWA8_VWB4_WGM1_WGMXCC1_WGMXCCGn1
    SolutionIndex: 25
    SolutionNameMin: Cijk_Ailk_Bjlk_I8II_BH_UserArgs_MT256x128x64_MI16x16x1_SN_CLR1_GSU0_GSUC0_GSUWGMRR0_K1_LBSPPA2048_LBSPPB1024_LPA64_LPB64_MIWT8_4_PLR1_SU0_SUM0_SUS64_SKXCCM8_VWA4_VWB4_WGM4_WGMXCC1_WGMXCCGn1
    SolutionIndex: 26
    SolutionNameMin: Cijk_Ailk_Bjlk_I8II_BH_UserArgs_MT256x128x64_MI16x16x1_SN_CLR1_GSU0_GSUC0_GSUWGMRR0_K1_LBSPPA2048_LBSPPB1024_LPA64_LPB64_MIWT8_4_PLR1_SU0_SUM0_SUS64_SKXCCM8_VWA4_VWB4_WGM8_WGMXCC1_WGMXCCGn1
    SolutionIndex: 27
    SolutionNameMin: Cijk_Ailk_Bjlk_I8II_BH_UserArgs_MT128x128x64_MI16x16x1_SN_CLR1_GSU0_GSUC0_GSUWGMRR0_K1_LBSPPA1024_LBSPPB1024_LPA64_LPB32_MIWT4_4_PLR1_SU0_SUM0_SUS64_SKXCCM8_VWA4_VWB2_WGM1_WGMXCC1_WGMXCCGn1
    SolutionIndex: 28
    SolutionNameMin: Cijk_Ailk_Bjlk_I8II_BH_UserArgs_MT128x128x64_MI16x16x1_SN_CLR1_GSU0_GSUC0_GSUWGMRR0_K1_LBSPPA1024_LBSPPB1024_LPA64_LPB64_MIWT4_4_PLR1_SU0_SUM0_SUS64_SKXCCM8_VWA4_VWB4_WGM1_WGMXCC1_WGMXCCGn1
    SolutionIndex: 29
    SolutionNameMin: Cijk_Ailk_Bjlk_I8II_BH_UserArgs_MT128x128x64_MI16x16x1_SN_CLR1_GSU0_GSUC0_GSUWGMRR0_K1_LBSPPA1024_LBSPPB1024_LPA64_LPB64_MIWT4_4_PLR1_SU0_SUM0_SUS64_SKXCCM8_VWA4_VWB4_WGM4_WGMXCC1_WGMXCCGn1
    SolutionIndex: 30
    SolutionNameMin: Cijk_Ailk_Bjlk_I8II_BH_UserArgs_MT128x128x64_MI16x16x1_SN_CLR1_GSU0_GSUC0_GSUWGMRR0_K1_LBSPPA1024_LBSPPB1024_LPA64_LPB64_MIWT4_4_PLR1_SU0_SUM0_SUS64_SKXCCM8_VWA4_VWB4_WGM8_WGMXCC1_WGMXCCGn1
    SolutionIndex: 31
    SolutionNameMin: Cijk_Ailk_Bjlk_I8II_BH_UserArgs_MT64x128x64_MI16x16x1_SN_CLR1_GSU0_GSUC0_GSUWGMRR0_K1_LBSPPA512_LBSPPB1024_LPA16_LPB64_MIWT2_4_PLR1_SU0_SUM0_SUS64_SKXCCM8_VWA1_VWB4_WGM1_WGMXCC1_WGMXCCGn1
    SolutionIndex: 32
    SolutionNameMin: Cijk_Ailk_Bjlk_I8II_BH_UserArgs_MT64x128x64_MI16x16x1_SN_CLR1_GSU0_GSUC0_GSUWGMRR0_K1_LBSPPA512_LBSPPB1024_LPA32_LPB64_MIWT2_4_PLR1_SU0_SUM0_SUS64_SKXCCM8_VWA2_VWB4_WGM1_WGMXCC1_WGMXCCGn1
    SolutionIndex: 33
    SolutionNameMin: Cijk_Ailk_Bjlk_I8II_BH_UserArgs_MT128x64x64_MI16x16x1_SN_CLR1_GSU0_GSUC0_GSUWGMRR0_K1_LBSPPA1024_LBSPPB512_LPA64_LPB32_MIWT4_2_PLR1_SU0_SUM0_SUS64_SKXCCM8_VWA4_VWB2_WGM1_WGMXCC1_WGMXCCGn1
    SolutionIndex: 34
    SolutionNameMin: Cijk_Ailk_Bjlk_I8II_BH_UserArgs_MT128x64x64_MI16x16x1_SN_CLR1_GSU0_GSUC0_GSUWGMRR0_K1_LBSPPA1024_LBSPPB512_LPA64_LPB32_MIWT4_2_PLR1_SU0_SUM0_SUS64_SKXCCM8_VWA4_VWB2_WGM1_WGMXCC1_WGMXCCGn1
    SolutionIndex: 35
    SolutionNameMin: Cijk_Ailk_Bjlk_I8II_BH_UserArgs_MT128x32x64_MI16x16x1_SN_CLR1_GSU0_GSUC0_GSUWGMRR0_K1_LBSPPA1024_LBSPPB256_LPA64_LPB16_MIWT4_1_PLR1_SU0_SUM0_SUS64_SKXCCM8_VWA4_VWB1_WGM1_WGMXCC1_WGMXCCGn1
    SolutionIndex: 36
    SolutionNameMin: Cijk_Ailk_Bjlk_I8II_BH_UserArgs_MT128x32x64_MI16x16x1_SN_CLR1_GSU0_GSUC0_GSUWGMRR0_K1_LBSPPA1024_LBSPPB256_LPA64_LPB16_MIWT4_1_PLR1_SU0_SUM0_SUS64_SKXCCM8_VWA4_VWB1_WGM1_WGMXCC1_WGMXCCGn1
    SolutionIndex: 37
    SolutionNameMin: Cijk_Ailk_Bjlk_I8II_BH_UserArgs_MT128x32x64_MI16x16x1_SN_CLR1_GSU0_GSUC0_GSUWGMRR0_K1_LBSPPA1024_LBSPPB256_LPA64_LPB16_MIWT4_1_PLR1_SU0_SUM0_SUS64_SKXCCM8_VWA4_VWB1_WGM1_WGMXCC1_WGMXCCGn1
    SolutionIndex: 38
    SolutionNameMin: Cijk_Ailk_Bjlk_I8II_BH_UserArgs_MT64x64x64_MI16x16x1_SN_CLR1_GSU0_GSUC0_GSUWGMRR0_K1_LBSPPA512_LBSPPB512_LPA32_LPB32_MIWT2_2_PLR1_SU0_SUM0_SUS64_SKXCCM8_VWA2_VWB2_WGM1_WGMXCC1_WGMXCCGn1
    SolutionIndex: 39
    SolutionNameMin: Cijk_Ailk_Bjlk_I8II_BH_UserArgs_MT64x64x64_MI16x16x1_SN_CLR1_GSU0_GSUC0_GSUWGMRR0_K1_LBSPPA512_LBSPPB512_LPA32_LPB32_MIWT2_2_PLR1_SU0_SUM0_SUS64_SKXCCM8_VWA2_VWB2_WGM1_WGMXCC1_WGMXCCGn1
    SolutionIndex: 40
    SolutionNameMin: Cijk_Ailk_Bjlk_I8II_BH_UserArgs_MT64x64x64_MI16x16x1_SN_CLR1_GSU0_GSUC0_GSUWGMRR0_K1_LBSPPA512_LBSPPB512_LPA32_LPB32_MIWT2_2_PLR1_SU0_SUM0_SUS64_SKXCCM8_VWA2_VWB2_WGM1_WGMXCC1_WGMXCCGn1
    SolutionIndex: 41
    SolutionNameMin: Cijk_Ailk_Bjlk_I8II_BH_UserArgs_MT32x64x64_MI16x16x1_SN_CLR1_GSU0_GSUC0_GSUWGMRR0_K1_LBSPPA256_LBSPPB512_LPA16_LPB32_MIWT1_2_PLR1_SU0_SUM0_SUS64_SKXCCM8_VWA1_VWB2_WGM1_WGMXCC1_WGMXCCGn1
    SolutionIndex: 42
    SolutionNameMin: Cijk_Ailk_Bjlk_I8II_BH_UserArgs_MT32x64x64_MI16x16x1_SN_CLR1_GSU0_GSUC0_GSUWGMRR0_K1_LBSPPA256_LBSPPB512_LPA16_LPB32_MIWT1_2_PLR1_SU0_SUM0_SUS64_SKXCCM8_VWA1_VWB2_WGM1_WGMXCC1_WGMXCCGn1
    SolutionIndex: 43
    SolutionNameMin: Cijk_Ailk_Bjlk_I8II_BH_UserArgs_MT64x32x64_MI16x16x1_SN_CLR1_GSU0_GSUC0_GSUWGMRR0_K1_LBSPPA512_LBSPPB256_LPA32_LPB16_MIWT2_1_PLR1_SU0_SUM0_SUS64_SKXCCM8_VWA2_VWB1_WGM1_WGMXCC1_WGMXCCGn1
    SolutionIndex: 44
    SolutionNameMin: Cijk_Ailk_Bjlk_I8II_BH_UserArgs_MT64x32x64_MI16x16x1_SN_CLR1_GSU0_GSUC0_GSUWGMRR0_K1_LBSPPA512_LBSPPB256_LPA32_LPB16_MIWT2_1_PLR1_SU0_SUM0_SUS64_SKXCCM8_VWA2_VWB1_WGM1_WGMXCC1_WGMXCCGn1
    SolutionIndex: 45
    SolutionNameMin: Cijk_Ailk_Bjlk_I8II_BH_UserArgs_MT64x32x64_MI16x16x1_SN_CLR1_GSU0_GSUC0_GSUWGMRR0_K1_LBSPPA512_LBSPPB256_LPA32_LPB16_MIWT2_1_PLR1_SU0_SUM0_SUS64_SKXCCM8_VWA2_VWB1_WGM1_WGMXCC1_WGMXCCGn1
    SolutionIndex: 46
    SolutionNameMin: Cijk_Ailk_Bjlk_I8II_BH_UserArgs_MT32x32x64_MI16x16x1_SN_CLR1_GSU0_GSUC0_GSUWGMRR0_K1_LBSPPA256_LBSPPB256_LPA16_LPB16_MIWT1_1_PLR1_SU0_SUM0_SUS64_SKXCCM8_VWA1_VWB1_WGM1_WGMXCC1_WGMXCCGn1
    SolutionIndex: 47
    SolutionNameMin: Cijk_Ailk_Bjlk_I8II_BH_UserArgs_MT32x32x64_MI16x16x1_SN_CLR1_GSU0_GSUC0_GSUWGMRR0_K1_LBSPPA256_LBSPPB256_LPA16_LPB16_MIWT1_1_PLR1_SU0_SUM0_SUS64_SKXCCM8_VWA1_VWB1_WGM1_WGMXCC1_WGMXCCGn1
    SolutionIndex: 48
    SolutionNameMin: Cijk_Ailk_Bjlk_I8II_BH_UserArgs_MT32x32x64_MI16x16x1_SN_CLR1_GSU0_GSUC0_GSUWGMRR0_K1_LBSPPA256_LBSPPB256_LPA16_LPB16_MIWT1_1_PLR1_SU0_SUM0_SUS64_SKXCCM8_VWA1_VWB1_WGM1_WGMXCC1_WGMXCCGn1
    SolutionIndex: 49
    SolutionNameMin: Cijk_Ailk_Bjlk_I8II_BH_UserArgs_MT32x32x64_MI16x16x1_SN_CLR0_GSU0_GSUC0_GSUWGMRR0_K1_LBSPPA256_LBSPPB256_LPA16_LPB16_MIWT1_1_PLR0_SU0_SUM0_SUS64_SKXCCM8_VWA1_VWB1_WGM1_WGMXCC1_WGMXCCGn1
    SolutionIndex: 50
    SolutionNameMin: Cijk_Ailk_Bjlk_I8II_BH_UserArgs_MT128x128x128_MI16x16x1_SN_CLR1_GSU0_GSUC0_GSUWGMRR0_K1_LBSPPA1024_LBSPPB1024_LPA64_LPB64_MIWT4_4_PLR2_SU0_SUM0_SUS128_SKXCCM8_VWA4_VWB4_WGM1_WGMXCC1_WGMXCCGn1
    SolutionIndex: 51
    SolutionNameMin: Cijk_Ailk_Bjlk_I8II_BH_UserArgs_MT128x64x128_MI16x16x1_SN_CLR1_GSU0_GSUC0_GSUWGMRR0_K1_LBSPPA1024_LBSPPB512_LPA64_LPB32_MIWT4_2_PLR2_SU0_SUM0_SUS128_SKXCCM8_VWA4_VWB2_WGM1_WGMXCC1_WGMXCCGn1
    SolutionIndex: 52
    SolutionNameMin: Cijk_Ailk_Bjlk_I8II_BH_UserArgs_MT64x64x128_MI16x16x1_SN_CLR1_GSU0_GSUC0_GSUWGMRR0_K1_LBSPPA512_LBSPPB512_LPA32_LPB32_MIWT2_2_PLR1_SU0_SUM0_SUS128_SKXCCM8_VWA2_VWB2_WGM1_WGMXCC1_WGMXCCGn1
    SolutionIndex: 53
    SolutionNameMin: Cijk_Ailk_Bjlk_I8II_BH_UserArgs_MT64x64x128_MI16x16x1_SN_CLR1_GSU0_GSUC0_GSUWGMRR0_K1_LBSPPA512_LBSPPB512_LPA32_LPB32_MIWT2_2_PLR2_SU0_SUM0_SUS128_SKXCCM8_VWA2_VWB2_WGM1_WGMXCC1_WGMXCCGn1
    SolutionIndex: 54
    SolutionNameMin: Cijk_Ailk_Bjlk_I8II_BH_UserArgs_MT64x64x128_MI16x16x1_SN_CLR1_GSU0_GSUC0_GSUWGMRR0_K1_LBSPPA512_LBSPPB512_LPA32_LPB32_MIWT2_2_PLR1_SU0_SUM0_SUS128_SKXCCM8_VWA2_VWB2_WGM8_WGMXCC1_WGMXCCGn1
    SolutionIndex: 55
    SolutionNameMin: Cijk_Ailk_Bjlk_I8II_BH_UserArgs_MT32x64x128_MI16x16x1_SN_CLR1_GSU0_GSUC0_GSUWGMRR0_K1_LBSPPA256_LBSPPB512_LPA16_LPB32_MIWT1_2_PLR2_SU0_SUM0_SUS128_SKXCCM8_VWA1_VWB2_WGM1_WGMXCC1_WGMXCCGn1
    SolutionIndex: 56
    SolutionNameMin: Cijk_Ailk_Bjlk_I8II_BH_UserArgs_MT64x32x128_MI16x16x1_SN_CLR1_GSU0_GSUC0_GSUWGMRR0_K1_LBSPPA512_LBSPPB256_LPA32_LPB16_MIWT2_1_PLR1_SU0_SUM0_SUS128_SKXCCM8_VWA2_VWB1_WGM1_WGMXCC1_WGMXCCGn1
    SolutionIndex: 57
    SolutionNameMin: Cijk_Ailk_Bjlk_I8II_BH_UserArgs_MT64x32x128_MI16x16x1_SN_CLR1_GSU0_GSUC0_GSUWGMRR0_K1_LBSPPA512_LBSPPB256_LPA32_LPB16_MIWT2_1_PLR1_SU0_SUM0_SUS128_SKXCCM8_VWA2_VWB1_WGM1_WGMXCC1_WGMXCCGn1
    SolutionIndex: 58
    SolutionNameMin: Cijk_Ailk_Bjlk_I8II_BH_UserArgs_MT64x32x128_MI16x16x1_SN_CLR1_GSU0_GSUC0_GSUWGMRR0_K1_LBSPPA512_LBSPPB256_LPA32_LPB16_MIWT2_1_PLR2_SU0_SUM0_SUS128_SKXCCM8_VWA2_VWB1_WGM1_WGMXCC1_WGMXCCGn1
    SolutionIndex: 59
    SolutionNameMin: Cijk_Ailk_Bjlk_I8II_BH_UserArgs_MT64x32x128_MI16x16x1_SN_CLR1_GSU0_GSUC0_GSUWGMRR0_K1_LBSPPA512_LBSPPB256_LPA32_LPB16_MIWT2_1_PLR2_SU0_SUM0_SUS128_SKXCCM8_VWA2_VWB1_WGM4_WGMXCC1_WGMXCCGn1
    SolutionIndex: 60
    SolutionNameMin: Cijk_Ailk_Bjlk_I8II_BH_UserArgs_MT32x32x128_MI16x16x1_SN_CLR1_GSU0_GSUC0_GSUWGMRR0_K1_LBSPPA256_LBSPPB256_LPA16_LPB16_MIWT1_1_PLR1_SU0_SUM0_SUS128_SKXCCM8_VWA1_VWB1_WGM1_WGMXCC1_WGMXCCGn1
    SolutionIndex: 61
    SolutionNameMin: Cijk_Ailk_Bjlk_I8II_BH_UserArgs_MT32x32x128_MI16x16x1_SN_CLR1_GSU0_GSUC0_GSUWGMRR0_K1_LBSPPA256_LBSPPB256_LPA16_LPB16_MIWT1_1_PLR1_SU0_SUM0_SUS128_SKXCCM8_VWA1_VWB1_WGM1_WGMXCC1_WGMXCCGn1
    SolutionIndex: 62
    SolutionNameMin: Cijk_Ailk_Bjlk_I8II_BH_UserArgs_MT32x32x128_MI16x16x1_SN_CLR1_GSU0_GSUC0_GSUWGMRR0_K1_LBSPPA256_LBSPPB256_LPA16_LPB16_MIWT1_1_PLR2_SU0_SUM0_SUS128_SKXCCM8_VWA1_VWB1_WGM1_WGMXCC1_WGMXCCGn1
    SolutionIndex: 63
    SolutionNameMin: Cijk_Ailk_Bjlk_I8II_BH_UserArgs_MT32x32x128_MI16x16x1_SN_CLR1_GSU0_GSUC0_GSUWGMRR0_K1_LBSPPA256_LBSPPB256_LPA16_LPB16_MIWT1_1_PLR2_SU0_SUM0_SUS128_SKXCCM8_VWA1_VWB1_WGM1_WGMXCC1_WGMXCCGn1
    SolutionIndex: 64
    SolutionNameMin: Cijk_Ailk_Bjlk_I8II_BH_UserArgs_MT32x32x128_MI16x16x1_SN_CLR1_GSU0_GSUC0_GSUWGMRR0_K1_LBSPPA256_LBSPPB256_LPA16_LPB16_MIWT1_1_PLR1_SU0_SUM0_SUS128_SKXCCM8_VWA1_VWB1_WGM4_WGMXCC1_WGMXCCGn1
    SolutionIndex: 65
    SolutionNameMin: Cijk_Ailk_Bjlk_I8II_BH_UserArgs_MT32x32x128_MI16x16x1_SN_CLR1_GSU0_GSUC0_GSUWGMRR0_K1_LBSPPA256_LBSPPB256_LPA16_LPB16_MIWT1_1_PLR2_SU0_SUM0_SUS128_SKXCCM8_VWA1_VWB1_WGM8_WGMXCC1_WGMXCCGn1
    SolutionIndex: 66
    SolutionNameMin: Cijk_Ailk_Bjlk_I8II_BH_UserArgs_MT128x64x256_MI16x16x1_SN_CLR1_GSU0_GSUC0_GSUWGMRR0_K1_LBSPPA1024_LBSPPB512_LPA64_LPB32_MIWT4_2_PLR2_SU0_SUM0_SUS256_SKXCCM8_VWA4_VWB2_WGM1_WGMXCC1_WGMXCCGn1
    SolutionIndex: 67
    SolutionNameMin: Cijk_Ailk_Bjlk_I8II_BH_UserArgs_MT64x64x256_MI16x16x1_SN_CLR1_GSU0_GSUC0_GSUWGMRR0_K1_LBSPPA512_LBSPPB512_LPA32_LPB32_MIWT2_2_PLR2_SU0_SUM0_SUS256_SKXCCM8_VWA2_VWB2_WGM1_WGMXCC1_WGMXCCGn1
    SolutionIndex: 68
    SolutionNameMin: Cijk_Ailk_Bjlk_I8II_BH_UserArgs_MT64x32x256_MI16x16x1_SN_CLR1_GSU0_GSUC0_GSUWGMRR0_K1_LBSPPA512_LBSPPB256_LPA32_LPB16_MIWT2_1_PLR2_SU0_SUM0_SUS256_SKXCCM8_VWA2_VWB1_WGM1_WGMXCC1_WGMXCCGn1
    SolutionIndex: 69
    SolutionNameMin: Cijk_Ailk_Bjlk_I8II_BH_UserArgs_MT64x32x256_MI16x16x1_SN_CLR1_GSU0_GSUC0_GSUWGMRR0_K1_LBSPPA512_LBSPPB256_LPA32_LPB16_MIWT2_1_PLR2_SU0_SUM0_SUS256_SKXCCM8_VWA2_VWB1_WGM4_WGMXCC1_WGMXCCGn1
    SolutionIndex: 70
    SolutionNameMin: Cijk_Ailk_Bjlk_I8II_BH_UserArgs_MT32x32x32_MI16x16x1_SN_CLR0_GSU0_GSUC0_GSUWGMRR0_K1_LBSPPA256_LBSPPB256_LPA16_LPB16_MIWT1_1_PLR0_SU32_SUM0_SUS256_SKXCCM8_VWA1_VWB1_WGM1_WGMXCC1_WGMXCCGn1
- - - [128, 128, 1, 128, 128, 128, 128, 128]
    - [46, 0.57]
  - - [128, 128, 1, 256, 128, 128, 128, 128]
    - [62, 0.99]
  - - [128, 128, 1, 512, 128, 128, 128, 128]
    - [61, 1.6]
  - - [128, 128, 1, 1024, 128, 128, 128, 128]
    - [61, 2.32]
  - - [128, 128, 1, 2048, 128, 128, 128, 128]
    - [61, 3.03]
  - - [128, 128, 1, 4096, 128, 128, 128, 128]
    - [61, 3.54]
  - - [128, 128, 1, 8192, 128, 128, 128, 128]
    - [61, 3.87]
  - - [128, 256, 1, 128, 128, 128, 128, 256]
    - [47, 1.13]
  - - [128, 256, 1, 256, 128, 128, 128, 256]
    - [47, 1.96]
  - - [128, 256, 1, 512, 128, 128, 128, 256]
    - [61, 3.2]
  - - [128, 256, 1, 1024, 128, 128, 128, 256]
    - [63, 4.59]
  - - [128, 256, 1, 2048, 128, 128, 128, 256]
    - [63, 6.01]
  - - [128, 256, 1, 4096, 128, 128, 128, 256]
    - [61, 7.05]
  - - [128, 256, 1, 8192, 128, 128, 128, 256]
    - [8, 7.75]
  - - [128, 512, 1, 128, 128, 128, 128, 512]
    - [47, 2.25]
  - - [128, 512, 1, 256, 128, 128, 128, 512]
    - [47, 3.87]
  - - [128, 512, 1, 512, 128, 128, 128, 512]
    - [60, 6.15]
  - - [128, 512, 1, 1024, 128, 128, 128, 512]
    - [63, 9.17]
  - - [128, 512, 1, 2048, 128, 128, 128, 512]
    - [63, 11.88]
  - - [128, 512, 1, 4096, 128, 128, 128, 512]
    - [63, 13.87]
  - - [128, 512, 1, 8192, 128, 128, 128, 512]
    - [61, 15.36]
  - - [128, 1024, 1, 128, 128, 128, 128, 1024]
    - [41, 4.12]
  - - [128, 1024, 1, 256, 128, 128, 128, 1024]
    - [42, 7.06]
  - - [128, 1024, 1, 512, 128, 128, 128, 1024]
    - [55, 11.13]
  - - [128, 1024, 1, 1024, 128, 128, 128, 1024]
    - [55, 16.11]
  - - [128, 1024, 1, 2048, 128, 128, 128, 1024]
    - [55, 20.57]
  - - [128, 1024, 1, 4096, 128, 128, 128, 1024]
    - [55, 23.88]
  - - [128, 1024, 1, 8192, 128, 128, 128, 1024]
    - [68, 25.56]
  - - [128, 2048, 1, 128, 128, 128, 128, 2048]
    - [35, 7.27]
  - - [128, 2048, 1, 256, 128, 128, 128, 2048]
    - [39, 12.21]
  - - [128, 2048, 1, 512, 128, 128, 128, 2048]
    - [52, 19.36]
  - - [128, 2048, 1, 1024, 128, 128, 128, 2048]
    - [52, 27.6]
  - - [128, 2048, 1, 2048, 128, 128, 128, 2048]
    - [52, 34.3]
  - - [128, 2048, 1, 4096, 128, 128, 128, 2048]
    - [52, 39.96]
  - - [128, 2048, 1, 8192, 128, 128, 128, 2048]
    - [52, 43.68]
  - - [128, 4096, 1, 128, 128, 128, 128, 4096]
    - [34, 12.15]
  - - [128, 4096, 1, 256, 128, 128, 128, 4096]
    - [34, 20.56]
  - - [128, 4096, 1, 512, 128, 128, 128, 4096]
    - [51, 31.77]
  - - [128, 4096, 1, 1024, 128, 128, 128, 4096]
    - [51, 43.05]
  - - [128, 4096, 1, 2048, 128, 128, 128, 4096]
    - [51, 54.68]
  - - [128, 4096, 1, 4096, 128, 128, 128, 4096]
    - [51, 63.16]
  - - [128, 4096, 1, 8192, 128, 128, 128, 4096]
    - [51, 68.73]
  - - [128, 8192, 1, 128, 128, 128, 128, 8192]
    - [28, 18.31]
  - - [128, 8192, 1, 256, 128, 128, 128, 8192]
    - [28, 30.92]
  - - [128, 8192, 1, 512, 128, 128, 128, 8192]
    - [28, 47.55]
  - - [128, 8192, 1, 1024, 128, 128, 128, 8192]
    - [28, 64.6]
  - - [128, 8192, 1, 2048, 128, 128, 128, 8192]
    - [28, 78.83]
  - - [128, 8192, 1, 4096, 128, 128, 128, 8192]
    - [28, 88.87]
  - - [128, 8192, 1, 8192, 128, 128, 128, 8192]
    - [28, 93.82]
  - - [256, 128, 1, 128, 256, 256, 256, 128]
    - [47, 1.14]
  - - [256, 128, 1, 256, 256, 256, 256, 128]
    - [48, 1.96]
  - - [256, 128, 1, 512, 256, 256, 256, 128]
    - [63, 3.14]
  - - [256, 128, 1, 1024, 256, 256, 256, 128]
    - [61, 4.64]
  - - [256, 128, 1, 2048, 256, 256, 256, 128]
    - [61, 6.0]
  - - [256, 128, 1, 4096, 256, 256, 256, 128]
    - [61, 7.03]
  - - [256, 128, 1, 8192, 256, 256, 256, 128]
    - [8, 7.73]
  - - [256, 256, 1, 128, 256, 256, 256, 256]
    - [49, 2.2]
  - - [256, 256, 1, 256, 256, 256, 256, 256]
    - [47, 3.87]
  - - [256, 256, 1, 512, 256, 256, 256, 256]
    - [63, 6.29]
  - - [256, 256, 1, 1024, 256, 256, 256, 256]
    - [61, 9.18]
  - - [256, 256, 1, 2048, 256, 256, 256, 256]
    - [61, 11.94]
  - - [256, 256, 1, 4096, 256, 256, 256, 256]
    - [61, 14.0]
  - - [256, 256, 1, 8192, 256, 256, 256, 256]
    - [64, 15.3]
  - - [256, 512, 1, 128, 256, 256, 256, 512]
    - [42, 4.1]
  - - [256, 512, 1, 256, 256, 256, 256, 512]
    - [44, 6.99]
  - - [256, 512, 1, 512, 256, 256, 256, 512]
    - [56, 11.24]
  - - [256, 512, 1, 1024, 256, 256, 256, 512]
    - [58, 16.06]
  - - [256, 512, 1, 2048, 256, 256, 256, 512]
    - [55, 20.5]
  - - [256, 512, 1, 4096, 256, 256, 256, 512]
    - [55, 23.79]
  - - [256, 512, 1, 8192, 256, 256, 256, 512]
    - [69, 25.84]
  - - [256, 1024, 1, 128, 256, 256, 256, 1024]
    - [38, 7.31]
  - - [256, 1024, 1, 256, 256, 256, 256, 1024]
    - [38, 12.33]
  - - [256, 1024, 1, 512, 256, 256, 256, 1024]
    - [53, 19.66]
  - - [256, 1024, 1, 1024, 256, 256, 256, 1024]
    - [52, 27.94]
  - - [256, 1024, 1, 2048, 256, 256, 256, 1024]
    - [52, 35.33]
  - - [256, 1024, 1, 4096, 256, 256, 256, 1024]
    - [67, 41.12]
  - - [256, 1024, 1, 8192, 256, 256, 256, 1024]
    - [52, 43.56]
  - - [256, 2048, 1, 128, 256, 256, 256, 2048]
    - [7, 12.09]
  - - [256, 2048, 1, 256, 256, 256, 256, 2048]
    - [33, 20.69]
  - - [256, 2048, 1, 512, 256, 256, 256, 2048]
    - [51, 32.18]
  - - [256, 2048, 1, 1024, 256, 256, 256, 2048]
    - [51, 45.01]
  - - [256, 2048, 1, 2048, 256, 256, 256, 2048]
    - [51, 54.81]
  - - [256, 2048, 1, 4096, 256, 256, 256, 2048]
    - [51, 63.65]
  - - [256, 2048, 1, 8192, 256, 256, 256, 2048]
    - [51, 68.79]
  - - [256, 4096, 1, 128, 256, 256, 256, 4096]
    - [28, 18.25]
  - - [256, 4096, 1, 256, 256, 256, 256, 4096]
    - [28, 31.22]
  - - [256, 4096, 1, 512, 256, 256, 256, 4096]
    - [28, 47.36]
  - - [256, 4096, 1, 1024, 256, 256, 256, 4096]
    - [28, 64.7]
  - - [256, 4096, 1, 2048, 256, 256, 256, 4096]
    - [28, 78.97]
  - - [256, 4096, 1, 4096, 256, 256, 256, 4096]
    - [50, 89.77]
  - - [256, 4096, 1, 8192, 256, 256, 256, 4096]
    - [50, 96.96]
  - - [256, 8192, 1, 128, 256, 256, 256, 8192]
    - [6, 25.25]
  - - [256, 8192, 1, 256, 256, 256, 256, 8192]
    - [18, 42.67]
  - - [256, 8192, 1, 512, 256, 256, 256, 8192]
    - [18, 65.09]
  - - [256, 8192, 1, 1024, 256, 256, 256, 8192]
    - [18, 89.62]
  - - [256, 8192, 1, 2048, 256, 256, 256, 8192]
    - [18, 110.95]
  - - [256, 8192, 1, 4096, 256, 256, 256, 8192]
    - [18, 125.04]
  - - [256, 8192, 1, 8192, 256, 256, 256, 8192]
    - [18, 133.81]
  - - [512, 128, 1, 128, 512, 512, 512, 128]
    - [47, 2.23]
  - - [512, 128, 1, 256, 512, 512, 512, 128]
    - [47, 3.88]
  - - [512, 128, 1, 512, 512, 512, 512, 128]
    - [60, 6.23]
  - - [512, 128, 1, 1024, 512, 512, 512, 128]
    - [63, 9.15]
  - - [512, 128, 1, 2048, 512, 512, 512, 128]
    - [61, 11.89]
  - - [512, 128, 1, 4096, 512, 512, 512, 128]
    - [61, 13.96]
  - - [512, 128, 1, 8192, 512, 512, 512, 128]
    - [65, 15.27]
  - - [512, 256, 1, 128, 512, 512, 512, 256]
    - [44, 4.11]
  - - [512, 256, 1, 256, 512, 512, 512, 256]
    - [45, 7.01]
  - - [512, 256, 1, 512, 512, 512, 512, 256]
    - [58, 11.21]
  - - [512, 256, 1, 1024, 512, 512, 512, 256]
    - [58, 16.07]
  - - [512, 256, 1, 2048, 512, 512, 512, 256]
    - [58, 20.46]
  - - [512, 256, 1, 4096, 512, 512, 512, 256]
    - [58, 23.69]
  - - [512, 256, 1, 8192, 512, 512, 512, 256]
    - [57, 25.29]
  - - [512, 512, 1, 128, 512, 512, 512, 512]
    - [38, 7.34]
  - - [512, 512, 1, 256, 512, 512, 512, 512]
    - [52, 12.45]
  - - [512, 512, 1, 512, 512, 512, 512, 512]
    - [53, 19.33]
  - - [512, 512, 1, 1024, 512, 512, 512, 512]
    - [52, 27.35]
  - - [512, 512, 1, 2048, 512, 512, 512, 512]
    - [52, 35.26]
  - - [512, 512, 1, 4096, 512, 512, 512, 512]
    - [52, 40.47]
  - - [512, 512, 1, 8192, 512, 512, 512, 512]
    - [40, 39.66]
  - - [512, 1024, 1, 128, 512, 512, 512, 1024]
    - [33, 12.15]
  - - [512, 1024, 1, 256, 512, 512, 512, 1024]
    - [34, 20.8]
  - - [512, 1024, 1, 512, 512, 512, 512, 1024]
    - [51, 32.14]
  - - [512, 1024, 1, 1024, 512, 512, 512, 1024]
    - [51, 44.99]
  - - [512, 1024, 1, 2048, 512, 512, 512, 1024]
    - [66, 56.12]
  - - [512, 1024, 1, 4096, 512, 512, 512, 1024]
    - [32, 61.1]
  - - [512, 1024, 1, 8192, 512, 512, 512, 1024]
    - [32, 65.69]
  - - [512, 2048, 1, 128, 512, 512, 512, 2048]
    - [28, 18.31]
  - - [512, 2048, 1, 256, 512, 512, 512, 2048]
    - [28, 31.29]
  - - [512, 2048, 1, 512, 512, 512, 512, 2048]
    - [28, 47.99]
  - - [512, 2048, 1, 1024, 512, 512, 512, 2048]
    - [28, 64.89]
  - - [512, 2048, 1, 2048, 512, 512, 512, 2048]
    - [28, 79.18]
  - - [512, 2048, 1, 4096, 512, 512, 512, 2048]
    - [28, 88.95]
  - - [512, 2048, 1, 8192, 512, 512, 512, 2048]
    - [28, 95.1]
  - - [512, 4096, 1, 128, 512, 512, 512, 4096]
    - [5, 25.58]
  - - [512, 4096, 1, 256, 512, 512, 512, 4096]
    - [23, 42.98]
  - - [512, 4096, 1, 512, 512, 512, 512, 4096]
    - [19, 65.27]
  - - [512, 4096, 1, 1024, 512, 512, 512, 4096]
    - [19, 89.68]
  - - [512, 4096, 1, 2048, 512, 512, 512, 4096]
    - [19, 110.51]
  - - [512, 4096, 1, 4096, 512, 512, 512, 4096]
    - [18, 125.11]
  - - [512, 4096, 1, 8192, 512, 512, 512, 4096]
    - [18, 133.96]
  - - [512, 8192, 1, 128, 512, 512, 512, 8192]
    - [17, 30.49]
  - - [512, 8192, 1, 256, 512, 512, 512, 8192]
    - [17, 52.28]
  - - [512, 8192, 1, 512, 512, 512, 512, 8192]
    - [17, 80.67]
  - - [512, 8192, 1, 1024, 512, 512, 512, 8192]
    - [17, 111.39]
  - - [512, 8192, 1, 2048, 512, 512, 512, 8192]
    - [17, 137.12]
  - - [512, 8192, 1, 4096, 512, 512, 512, 8192]
    - [17, 155.31]
  - - [512, 8192, 1, 8192, 512, 512, 512, 8192]
    - [17, 166.06]
  - - [1024, 128, 1, 128, 1024, 1024, 1024, 128]
    - [43, 4.14]
  - - [1024, 128, 1, 256, 1024, 1024, 1024, 128]
    - [43, 7.09]
  - - [1024, 128, 1, 512, 1024, 1024, 1024, 128]
    - [58, 11.28]
  - - [1024, 128, 1, 1024, 1024, 1024, 1024, 128]
    - [58, 16.08]
  - - [1024, 128, 1, 2048, 1024, 1024, 1024, 128]
    - [58, 20.54]
  - - [1024, 128, 1, 4096, 1024, 1024, 1024, 128]
    - [59, 23.54]
  - - [1024, 128, 1, 8192, 1024, 1024, 1024, 128]
    - [57, 25.33]
  - - [1024, 256, 1, 128, 1024, 1024, 1024, 256]
    - [36, 7.35]
  - - [1024, 256, 1, 256, 1024, 1024, 1024, 256]
    - [36, 12.35]
  - - [1024, 256, 1, 512, 1024, 1024, 1024, 256]
    - [52, 18.94]
  - - [1024, 256, 1, 1024, 1024, 1024, 1024, 256]
    - [52, 27.3]
  - - [1024, 256, 1, 2048, 1024, 1024, 1024, 256]
    - [52, 34.9]
  - - [1024, 256, 1, 4096, 1024, 1024, 1024, 256]
    - [54, 38.09]
  - - [1024, 256, 1, 8192, 1024, 1024, 1024, 256]
    - [39, 39.4]
  - - [1024, 512, 1, 128, 1024, 1024, 1024, 512]
    - [34, 12.44]
  - - [1024, 512, 1, 256, 1024, 1024, 1024, 512]
    - [34, 21.04]
  - - [1024, 512, 1, 512, 1024, 1024, 1024, 512]
    - [51, 32.43]
  - - [1024, 512, 1, 1024, 1024, 1024, 1024, 512]
    - [51, 45.2]
  - - [1024, 512, 1, 2048, 1024, 1024, 1024, 512]
    - [51, 56.14]
  - - [1024, 512, 1, 4096, 1024, 1024, 1024, 512]
    - [32, 61.07]
  - - [1024, 512, 1, 8192, 1024, 1024, 1024, 512]
    - [32, 65.78]
  - - [1024, 1024, 1, 128, 1024, 1024, 1024, 1024]
    - [27, 18.38]
  - - [1024, 1024, 1, 256, 1024, 1024, 1024, 1024]
    - [27, 31.44]
  - - [1024, 1024, 1, 512, 1024, 1024, 1024, 1024]
    - [28, 47.96]
  - - [1024, 1024, 1, 1024, 1024, 1024, 1024, 1024]
    - [50, 64.36]
  - - [1024, 1024, 1, 2048, 1024, 1024, 1024, 1024]
    - [28, 78.69]
  - - [1024, 1024, 1, 4096, 1024, 1024, 1024, 1024]
    - [28, 88.88]
  - - [1024, 1024, 1, 8192, 1024, 1024, 1024, 1024]
    - [28, 95.05]
  - - [1024, 2048, 1, 128, 1024, 1024, 1024, 2048]
    - [22, 25.81]
  - - [1024, 2048, 1, 256, 1024, 1024, 1024, 2048]
    - [23, 43.13]
  - - [1024, 2048, 1, 512, 1024, 1024, 1024, 2048]
    - [21, 65.13]
  - - [1024, 2048, 1, 1024, 1024, 1024, 1024, 2048]
    - [21, 89.34]
  - - [1024, 2048, 1, 2048, 1024, 1024, 1024, 2048]
    - [21, 110.15]
  - - [1024, 2048, 1, 4096, 1024, 1024, 1024, 2048]
    - [20, 124.61]
  - - [1024, 2048, 1, 8192, 1024, 1024, 1024, 2048]
    - [24, 133.83]
  - - [1024, 4096, 1, 128, 1024, 1024, 1024, 4096]
    - [4, 30.62]
  - - [1024, 4096, 1, 256, 1024, 1024, 1024, 4096]
    - [17, 51.36]
  - - [1024, 4096, 1, 512, 1024, 1024, 1024, 4096]
    - [17, 79.99]
  - - [1024, 4096, 1, 1024, 1024, 1024, 1024, 4096]
    - [17, 110.19]
  - - [1024, 4096, 1, 2048, 1024, 1024, 1024, 4096]
    - [17, 136.51]
  - - [1024, 4096, 1, 4096, 1024, 1024, 1024, 4096]
    - [17, 155.02]
  - - [1024, 4096, 1, 8192, 1024, 1024, 1024, 4096]
    - [10, 166.17]
  - - [1024, 8192, 1, 128, 1024, 1024, 1024, 8192]
    - [4, 33.31]
  - - [1024, 8192, 1, 256, 1024, 1024, 1024, 8192]
    - [17, 55.92]
  - - [1024, 8192, 1, 512, 1024, 1024, 1024, 8192]
    - [17, 85.55]
  - - [1024, 8192, 1, 1024, 1024, 1024, 1024, 8192]
    - [10, 115.98]
  - - [1024, 8192, 1, 2048, 1024, 1024, 1024, 8192]
    - [10, 140.93]
  - - [1024, 8192, 1, 4096, 1024, 1024, 1024, 8192]
    - [10, 157.8]
  - - [1024, 8192, 1, 8192, 1024, 1024, 1024, 8192]
    - [10, 167.8]
  - - [2048, 128, 1, 128, 2048, 2048, 2048, 128]
    - [37, 7.23]
  - - [2048, 128, 1, 256, 2048, 2048, 2048, 128]
    - [39, 12.31]
  - - [2048, 128, 1, 512, 2048, 2048, 2048, 128]
    - [52, 19.43]
  - - [2048, 128, 1, 1024, 2048, 2048, 2048, 128]
    - [52, 27.69]
  - - [2048, 128, 1, 2048, 2048, 2048, 2048, 128]
    - [38, 31.06]
  - - [2048, 128, 1, 4096, 2048, 2048, 2048, 128]
    - [38, 35.35]
  - - [2048, 128, 1, 8192, 2048, 2048, 2048, 128]
    - [7, 39.27]
  - - [2048, 256, 1, 128, 2048, 2048, 2048, 256]
    - [33, 12.35]
  - - [2048, 256, 1, 256, 2048, 2048, 2048, 256]
    - [34, 20.9]
  - - [2048, 256, 1, 512, 2048, 2048, 2048, 256]
    - [51, 32.19]
  - - [2048, 256, 1, 1024, 2048, 2048, 2048, 256]
    - [51, 44.69]
  - - [2048, 256, 1, 2048, 2048, 2048, 2048, 256]
    - [32, 53.72]
  - - [2048, 256, 1, 4096, 2048, 2048, 2048, 256]
    - [32, 61.2]
  - - [2048, 256, 1, 8192, 2048, 2048, 2048, 256]
    - [32, 65.87]
  - - [2048, 512, 1, 128, 2048, 2048, 2048, 512]
    - [27, 18.52]
  - - [2048, 512, 1, 256, 2048, 2048, 2048, 512]
    - [27, 31.36]
  - - [2048, 512, 1, 512, 2048, 2048, 2048, 512]
    - [27, 47.66]
  - - [2048, 512, 1, 1024, 2048, 2048, 2048, 512]
    - [30, 64.44]
  - - [2048, 512, 1, 2048, 2048, 2048, 2048, 512]
    - [29, 78.91]
  - - [2048, 512, 1, 4096, 2048, 2048, 2048, 512]
    - [28, 88.86]
  - - [2048, 512, 1, 8192, 2048, 2048, 2048, 512]
    - [28, 95.13]
  - - [2048, 1024, 1, 128, 2048, 2048, 2048, 1024]
    - [23, 25.51]
  - - [2048, 1024, 1, 256, 2048, 2048, 2048, 1024]
    - [18, 42.69]
  - - [2048, 1024, 1, 512, 2048, 2048, 2048, 1024]
    - [18, 66.04]
  - - [2048, 1024, 1, 1024, 2048, 2048, 2048, 1024]
    - [18, 90.35]
  - - [2048, 1024, 1, 2048, 2048, 2048, 2048, 1024]
    - [18, 110.82]
  - - [2048, 1024, 1, 4096, 2048, 2048, 2048, 1024]
    - [18, 125.19]
  - - [2048, 1024, 1, 8192, 2048, 2048, 2048, 1024]
    - [18, 133.96]
  - - [2048, 2048, 1, 128, 2048, 2048, 2048, 2048]
    - [3, 30.66]
  - - [2048, 2048, 1, 256, 2048, 2048, 2048, 2048]
    - [16, 51.35]
  - - [2048, 2048, 1, 512, 2048, 2048, 2048, 2048]
    - [15, 79.76]
  - - [2048, 2048, 1, 1024, 2048, 2048, 2048, 2048]
    - [15, 110.64]
  - - [2048, 2048, 1, 2048, 2048, 2048, 2048, 2048]
    - [15, 136.04]
  - - [2048, 2048, 1, 4096, 2048, 2048, 2048, 2048]
    - [15, 154.89]
  - - [2048, 2048, 1, 8192, 2048, 2048, 2048, 2048]
    - [15, 166.08]
  - - [2048, 4096, 1, 128, 2048, 2048, 2048, 4096]
    - [3, 33.52]
  - - [2048, 4096, 1, 256, 2048, 2048, 2048, 4096]
    - [15, 55.86]
  - - [2048, 4096, 1, 512, 2048, 2048, 2048, 4096]
    - [15, 84.99]
  - - [2048, 4096, 1, 1024, 2048, 2048, 2048, 4096]
    - [15, 115.58]
  - - [2048, 4096, 1, 2048, 2048, 2048, 2048, 4096]
    - [15, 140.62]
  - - [2048, 4096, 1, 4096, 2048, 2048, 2048, 4096]
    - [15, 157.51]
  - - [2048, 4096, 1, 8192, 2048, 2048, 2048, 4096]
    - [15, 167.69]
  - - [2048, 8192, 1, 128, 2048, 2048, 2048, 8192]
    - [2, 36.34]
  - - [2048, 8192, 1, 256, 2048, 2048, 2048, 8192]
    - [12, 59.72]
  - - [2048, 8192, 1, 512, 2048, 2048, 2048, 8192]
    - [12, 89.29]
  - - [2048, 8192, 1, 1024, 2048, 2048, 2048, 8192]
    - [15, 119.12]
  - - [2048, 8192, 1, 2048, 2048, 2048, 2048, 8192]
    - [15, 143.23]
  - - [2048, 8192, 1, 4096, 2048, 2048, 2048, 8192]
    - [10, 159.45]
  - - [2048, 8192, 1, 8192, 2048, 2048, 2048, 8192]
    - [10, 168.67]
  - - [4096, 128, 1, 128, 4096, 4096, 4096, 128]
    - [31, 12.06]
  - - [4096, 128, 1, 256, 4096, 4096, 4096, 128]
    - [32, 20.53]
  - - [4096, 128, 1, 512, 4096, 4096, 4096, 128]
    - [32, 31.82]
  - - [4096, 128, 1, 1024, 4096, 4096, 4096, 128]
    - [51, 43.2]
  - - [4096, 128, 1, 2048, 4096, 4096, 4096, 128]
    - [32, 53.22]
  - - [4096, 128, 1, 4096, 4096, 4096, 4096, 128]
    - [32, 60.41]
  - - [4096, 128, 1, 8192, 4096, 4096, 4096, 128]
    - [32, 64.81]
  - - [4096, 256, 1, 128, 4096, 4096, 4096, 256]
    - [28, 18.45]
  - - [4096, 256, 1, 256, 4096, 4096, 4096, 256]
    - [28, 31.18]
  - - [4096, 256, 1, 512, 4096, 4096, 4096, 256]
    - [28, 47.66]
  - - [4096, 256, 1, 1024, 4096, 4096, 4096, 256]
    - [28, 64.42]
  - - [4096, 256, 1, 2048, 4096, 4096, 4096, 256]
    - [30, 78.66]
  - - [4096, 256, 1, 4096, 4096, 4096, 4096, 256]
    - [28, 89.15]
  - - [4096, 256, 1, 8192, 4096, 4096, 4096, 256]
    - [30, 94.92]
  - - [4096, 512, 1, 128, 4096, 4096, 4096, 512]
    - [26, 25.62]
  - - [4096, 512, 1, 256, 4096, 4096, 4096, 512]
    - [25, 42.68]
  - - [4096, 512, 1, 512, 4096, 4096, 4096, 512]
    - [19, 65.43]
  - - [4096, 512, 1, 1024, 4096, 4096, 4096, 512]
    - [19, 89.64]
  - - [4096, 512, 1, 2048, 4096, 4096, 4096, 512]
    - [18, 110.28]
  - - [4096, 512, 1, 4096, 4096, 4096, 4096, 512]
    - [18, 125.09]
  - - [4096, 512, 1, 8192, 4096, 4096, 4096, 512]
    - [18, 133.87]
  - - [4096, 1024, 1, 128, 4096, 4096, 4096, 1024]
    - [2, 30.41]
  - - [4096, 1024, 1, 256, 4096, 4096, 4096, 1024]
    - [13, 51.09]
  - - [4096, 1024, 1, 512, 4096, 4096, 4096, 1024]
    - [10, 78.67]
  - - [4096, 1024, 1, 1024, 4096, 4096, 4096, 1024]
    - [10, 109.0]
  - - [4096, 1024, 1, 2048, 4096, 4096, 4096, 1024]
    - [10, 135.57]
  - - [4096, 1024, 1, 4096, 4096, 4096, 4096, 1024]
    - [10, 154.45]
  - - [4096, 1024, 1, 8192, 4096, 4096, 4096, 1024]
    - [10, 165.86]
  - - [4096, 2048, 1, 128, 4096, 4096, 4096, 2048]
    - [2, 33.63]
  - - [4096, 2048, 1, 256, 4096, 4096, 4096, 2048]
    - [12, 55.48]
  - - [4096, 2048, 1, 512, 4096, 4096, 4096, 2048]
    - [10, 84.73]
  - - [4096, 2048, 1, 1024, 4096, 4096, 4096, 2048]
    - [10, 115.96]
  - - [4096, 2048, 1, 2048, 4096, 4096, 4096, 2048]
    - [10, 140.67]
  - - [4096, 2048, 1, 4096, 4096, 4096, 4096, 2048]
    - [10, 157.62]
  - - [4096, 2048, 1, 8192, 4096, 4096, 4096, 2048]
    - [10, 167.55]
  - - [4096, 4096, 1, 128, 4096, 4096, 4096, 4096]
    - [2, 36.22]
  - - [4096, 4096, 1, 256, 4096, 4096, 4096, 4096]
    - [10, 59.68]
  - - [4096, 4096, 1, 512, 4096, 4096, 4096, 4096]
    - [10, 90.14]
  - - [4096, 4096, 1, 1024, 4096, 4096, 4096, 4096]
    - [10, 119.94]
  - - [4096, 4096, 1, 2048, 4096, 4096, 4096, 4096]
    - [10, 143.69]
  - - [4096, 4096, 1, 4096, 4096, 4096, 4096, 4096]
    - [10, 159.49]
  - - [4096, 4096, 1, 8192, 4096, 4096, 4096, 4096]
    - [10, 168.58]
  - - [4096, 8192, 1, 128, 4096, 4096, 4096, 8192]
    - [9, 37.45]
  - - [4096, 8192, 1, 256, 4096, 4096, 4096, 8192]
    - [14, 61.85]
  - - [4096, 8192, 1, 512, 4096, 4096, 4096, 8192]
    - [10, 91.48]
  - - [4096, 8192, 1, 1024, 4096, 4096, 4096, 8192]
    - [10, 121.07]
  - - [4096, 8192, 1, 2048, 4096, 4096, 4096, 8192]
    - [10, 139.46]
  - - [4096, 8192, 1, 4096, 4096, 4096, 4096, 8192]
    - [10, 156.93]
  - - [4096, 8192, 1, 8192, 4096, 4096, 4096, 8192]
    - [10, 167.49]
  - - [8192, 128, 1, 128, 8192, 8192, 8192, 128]
    - [28, 18.61]
  - - [8192, 128, 1, 256, 8192, 8192, 8192, 128]
    - [28, 31.36]
  - - [8192, 128, 1, 512, 8192, 8192, 8192, 128]
    - [28, 47.49]
  - - [8192, 128, 1, 1024, 8192, 8192, 8192, 128]
    - [28, 64.43]
  - - [8192, 128, 1, 2048, 8192, 8192, 8192, 128]
    - [28, 78.95]
  - - [8192, 128, 1, 4096, 8192, 8192, 8192, 128]
    - [28, 88.54]
  - - [8192, 128, 1, 8192, 8192, 8192, 8192, 128]
    - [28, 93.61]
  - - [8192, 256, 1, 128, 8192, 8192, 8192, 256]
    - [19, 25.33]
  - - [8192, 256, 1, 256, 8192, 8192, 8192, 256]
    - [19, 42.76]
  - - [8192, 256, 1, 512, 8192, 8192, 8192, 256]
    - [19, 65.61]
  - - [8192, 256, 1, 1024, 8192, 8192, 8192, 256]
    - [18, 89.51]
  - - [8192, 256, 1, 2048, 8192, 8192, 8192, 256]
    - [18, 110.75]
  - - [8192, 256, 1, 4096, 8192, 8192, 8192, 256]
    - [18, 125.15]
  - - [8192, 256, 1, 8192, 8192, 8192, 8192, 256]
    - [18, 132.46]
  - - [8192, 512, 1, 128, 8192, 8192, 8192, 512]
    - [4, 30.21]
  - - [8192, 512, 1, 256, 8192, 8192, 8192, 512]
    - [15, 51.22]
  - - [8192, 512, 1, 512, 8192, 8192, 8192, 512]
    - [15, 79.34]
  - - [8192, 512, 1, 1024, 8192, 8192, 8192, 512]
    - [17, 109.88]
  - - [8192, 512, 1, 2048, 8192, 8192, 8192, 512]
    - [17, 136.34]
  - - [8192, 512, 1, 4096, 8192, 8192, 8192, 512]
    - [17, 154.76]
  - - [8192, 512, 1, 8192, 8192, 8192, 8192, 512]
    - [15, 165.45]
  - - [8192, 1024, 1, 128, 8192, 8192, 8192, 1024]
    - [1, 33.21]
  - - [8192, 1024, 1, 256, 8192, 8192, 8192, 1024]
    - [9, 55.38]
  - - [8192, 1024, 1, 512, 8192, 8192, 8192, 1024]
    - [9, 84.09]
  - - [8192, 1024, 1, 1024, 8192, 8192, 8192, 1024]
    - [9, 114.21]
  - - [8192, 1024, 1, 2048, 8192, 8192, 8192, 1024]
    - [10, 139.33]
  - - [8192, 1024, 1, 4096, 8192, 8192, 8192, 1024]
    - [10, 156.56]
  - - [8192, 1024, 1, 8192, 8192, 8192, 8192, 1024]
    - [10, 166.98]
  - - [8192, 2048, 1, 128, 8192, 8192, 8192, 2048]
    - [0, 35.41]
  - - [8192, 2048, 1, 256, 8192, 8192, 8192, 2048]
    - [9, 58.6]
  - - [8192, 2048, 1, 512, 8192, 8192, 8192, 2048]
    - [9, 88.13]
  - - [8192, 2048, 1, 1024, 8192, 8192, 8192, 2048]
    - [17, 118.05]
  - - [8192, 2048, 1, 2048, 8192, 8192, 8192, 2048]
    - [17, 142.53]
  - - [8192, 2048, 1, 4096, 8192, 8192, 8192, 2048]
    - [17, 158.8]
  - - [8192, 2048, 1, 8192, 8192, 8192, 8192, 2048]
    - [17, 168.13]
  - - [8192, 4096, 1, 128, 8192, 8192, 8192, 4096]
    - [1, 38.07]
  - - [8192, 4096, 1, 256, 8192, 8192, 8192, 4096]
    - [9, 61.87]
  - - [8192, 4096, 1, 512, 8192, 8192, 8192, 4096]
    - [9, 91.23]
  - - [8192, 4096, 1, 1024, 8192, 8192, 8192, 4096]
    - [10, 120.72]
  - - [8192, 4096, 1, 2048, 8192, 8192, 8192, 4096]
    - [10, 140.71]
  - - [8192, 4096, 1, 4096, 8192, 8192, 8192, 4096]
    - [10, 157.54]
  - - [8192, 4096, 1, 8192, 8192, 8192, 8192, 4096]
    - [10, 167.5]
  - - [8192, 8192, 1, 128, 8192, 8192, 8192, 8192]
    - [11, 33.56]
  - - [8192, 8192, 1, 256, 8192, 8192, 8192, 8192]
    - [11, 57.18]
  - - [8192, 8192, 1, 512, 8192, 8192, 8192, 8192]
    - [10, 87.18]
  - - [8192, 8192, 1, 1024, 8192, 8192, 8192, 8192]
    - [10, 118.7]
  - - [8192, 8192, 1, 2048, 8192, 8192, 8192, 8192]
    - [10, 142.86]
  - - [8192, 8192, 1, 4096, 8192, 8192, 8192, 8192]
    - [10, 158.58]
  - - [8192, 8192, 1, 8192, 8192, 8192, 8192, 8192]
    - [10, 168.29]
  - - [1, 1, 1, 32, 1, 1, 1, 1]
    - [70, 0.0]
- null
- null
- ExperimentalStreamK
- GridBased
