projects/hipblaslt/library/src/amd_detail/rocblaslt/src/Tensile/Logic/asm_full/aquavanjaram/gfx942_64cu/StreamK/aquavanjaram942_Cijk_Ailk_Bljk_I8II_BH_UserArgs.yaml
- {MinimumRequiredVersion: 4.33.0}
- aquavanjaram942
- {Architecture: gfx942, CUCount: 64}
- [Device 0049, Device 0050]
    SolutionIndex: 0
    SolutionNameMin: Cijk_Ailk_Bljk_I8II_BH_UserArgs_MT256x256x32_MI16x16x1_SN_CLR0_GSU0_GSUC0_GSUWGMRR0_K1_LBSPPA2048_LBSPPB128_LPA64_MIWT8_8_PLR0_SU0_SUM0_SUS32_SKXCCM8_VWA4_VWB1_WGM1_WGMXCC1_WGMXCCGn1
    SolutionIndex: 1
    SolutionNameMin: Cijk_Ailk_Bljk_I8II_BH_UserArgs_MT256x256x32_MI16x16x1_SN_CLR0_GSU0_GSUC0_GSUWGMRR0_K1_LBSPPA2048_LBSPPB128_LPA64_MIWT8_8_PLR0_SU0_SUM0_SUS32_SKXCCM8_VWA4_VWB4_WGM1_WGMXCC1_WGMXCCGn1
    SolutionIndex: 2
    SolutionNameMin: Cijk_Ailk_Bljk_I8II_BH_UserArgs_MT256x256x32_MI16x16x1_SN_CLR0_GSU0_GSUC0_GSUWGMRR0_K1_LBSPPA2048_LBSPPB256_LPA64_MIWT8_8_PLR0_SU0_SUM0_SUS32_SKXCCM8_VWA4_VWB8_WGM1_WGMXCC1_WGMXCCGn1
    SolutionIndex: 3
    SolutionNameMin: Cijk_Ailk_Bljk_I8II_BH_UserArgs_MT256x256x32_MI16x16x1_SN_CLR0_GSU0_GSUC0_GSUWGMRR0_K1_LBSPPA2048_LBSPPB128_LPA64_MIWT8_8_PLR0_SU0_SUM0_SUS32_SKXCCM8_VWA4_VWB1_WGM4_WGMXCC1_WGMXCCGn1
    SolutionIndex: 4
    SolutionNameMin: Cijk_Ailk_Bljk_I8II_BH_UserArgs_MT256x256x32_MI16x16x1_SN_CLR0_GSU0_GSUC0_GSUWGMRR0_K1_LBSPPA2048_LBSPPB128_LPA64_MIWT8_8_PLR0_SU0_SUM0_SUS32_SKXCCM8_VWA4_VWB4_WGM4_WGMXCC1_WGMXCCGn1
    SolutionIndex: 5
    SolutionNameMin: Cijk_Ailk_Bljk_I8II_BH_UserArgs_MT256x256x32_MI16x16x1_SN_CLR0_GSU0_GSUC0_GSUWGMRR0_K1_LBSPPA2048_LBSPPB256_LPA64_MIWT8_8_PLR0_SU0_SUM0_SUS32_SKXCCM8_VWA4_VWB8_WGM4_WGMXCC1_WGMXCCGn1
    SolutionIndex: 6
    SolutionNameMin: Cijk_Ailk_Bljk_I8II_BH_UserArgs_MT256x256x32_MI16x16x1_SN_CLR0_GSU0_GSUC0_GSUWGMRR0_K1_LBSPPA2048_LBSPPB256_LPA64_MIWT8_8_PLR0_SU0_SUM0_SUS32_SKXCCM8_VWA4_VWB8_WGM8_WGMXCC1_WGMXCCGn1
    SolutionIndex: 7
    SolutionNameMin: Cijk_Ailk_Bljk_I8II_BH_UserArgs_MT128x256x32_MI16x16x1_SN_CLR0_GSU0_GSUC0_GSUWGMRR0_K1_LBSPPA1024_LBSPPB128_LPA64_MIWT4_8_PLR0_SU0_SUM0_SUS32_SKXCCM8_VWA4_VWB1_WGM1_WGMXCC1_WGMXCCGn1
    SolutionIndex: 8
    SolutionNameMin: Cijk_Ailk_Bljk_I8II_BH_UserArgs_MT128x256x32_MI16x16x1_SN_CLR0_GSU0_GSUC0_GSUWGMRR0_K1_LBSPPA1024_LBSPPB128_LPA64_MIWT4_8_PLR0_SU0_SUM0_SUS32_SKXCCM8_VWA4_VWB4_WGM1_WGMXCC1_WGMXCCGn1
    SolutionIndex: 9
    SolutionNameMin: Cijk_Ailk_Bljk_I8II_BH_UserArgs_MT128x256x32_MI16x16x1_SN_CLR0_GSU0_GSUC0_GSUWGMRR0_K1_LBSPPA1024_LBSPPB256_LPA64_MIWT4_8_PLR0_SU0_SUM0_SUS32_SKXCCM8_VWA4_VWB8_WGM1_WGMXCC1_WGMXCCGn1
    SolutionIndex: 10
    SolutionNameMin: Cijk_Ailk_Bljk_I8II_BH_UserArgs_MT128x256x32_MI16x16x1_SN_CLR0_GSU0_GSUC0_GSUWGMRR0_K1_LBSPPA1024_LBSPPB128_LPA64_MIWT4_8_PLR0_SU0_SUM0_SUS32_SKXCCM8_VWA4_VWB4_WGM8_WGMXCC1_WGMXCCGn1
    SolutionIndex: 11
    SolutionNameMin: Cijk_Ailk_Bljk_I8II_BH_UserArgs_MT256x256x64_MI16x16x1_SN_CLR1_GSU0_GSUC0_GSUWGMRR0_K1_LBSPPA2048_LBSPPB128_LPA64_MIWT8_8_PLR1_SU0_SUM0_SUS64_SKXCCM8_VWA4_VWB1_WGM1_WGMXCC1_WGMXCCGn1
    SolutionIndex: 12
    SolutionNameMin: Cijk_Ailk_Bljk_I8II_BH_UserArgs_MT256x256x64_MI16x16x1_SN_CLR1_GSU0_GSUC0_GSUWGMRR0_K1_LBSPPA2048_LBSPPB128_LPA64_MIWT8_8_PLR1_SU0_SUM0_SUS64_SKXCCM8_VWA4_VWB2_WGM1_WGMXCC1_WGMXCCGn1
    SolutionIndex: 13
    SolutionNameMin: Cijk_Ailk_Bljk_I8II_BH_UserArgs_MT256x256x64_MI16x16x1_SN_CLR1_GSU0_GSUC0_GSUWGMRR0_K1_LBSPPA2048_LBSPPB256_LPA64_MIWT8_8_PLR1_SU0_SUM0_SUS64_SKXCCM8_VWA4_VWB4_WGM1_WGMXCC1_WGMXCCGn1
    SolutionIndex: 14
    SolutionNameMin: Cijk_Ailk_Bljk_I8II_BH_UserArgs_MT256x256x64_MI16x16x1_SN_CLR1_GSU0_GSUC0_GSUWGMRR0_K1_LBSPPA2048_LBSPPB512_LPA64_MIWT8_8_PLR1_SU0_SUM0_SUS64_SKXCCM8_VWA4_VWB8_WGM1_WGMXCC1_WGMXCCGn1
    SolutionIndex: 15
    SolutionNameMin: Cijk_Ailk_Bljk_I8II_BH_UserArgs_MT256x256x64_MI16x16x1_SN_CLR1_GSU0_GSUC0_GSUWGMRR0_K1_LBSPPA2048_LBSPPB128_LPA64_MIWT8_8_PLR1_SU0_SUM0_SUS64_SKXCCM8_VWA4_VWB1_WGM1_WGMXCC1_WGMXCCGn1
    SolutionIndex: 16
    SolutionNameMin: Cijk_Ailk_Bljk_I8II_BH_UserArgs_MT256x256x64_MI16x16x1_SN_CLR1_GSU0_GSUC0_GSUWGMRR0_K1_LBSPPA2048_LBSPPB128_LPA64_MIWT8_8_PLR1_SU0_SUM0_SUS64_SKXCCM8_VWA4_VWB1_WGM4_WGMXCC1_WGMXCCGn1
    SolutionIndex: 17
    SolutionNameMin: Cijk_Ailk_Bljk_I8II_BH_UserArgs_MT256x256x64_MI16x16x1_SN_CLR1_GSU0_GSUC0_GSUWGMRR0_K1_LBSPPA2048_LBSPPB128_LPA64_MIWT8_8_PLR1_SU0_SUM0_SUS64_SKXCCM8_VWA4_VWB2_WGM4_WGMXCC1_WGMXCCGn1
    SolutionIndex: 18
    SolutionNameMin: Cijk_Ailk_Bljk_I8II_BH_UserArgs_MT256x256x64_MI16x16x1_SN_CLR1_GSU0_GSUC0_GSUWGMRR0_K1_LBSPPA2048_LBSPPB256_LPA64_MIWT8_8_PLR1_SU0_SUM0_SUS64_SKXCCM8_VWA4_VWB4_WGM4_WGMXCC1_WGMXCCGn1
    SolutionIndex: 19
    SolutionNameMin: Cijk_Ailk_Bljk_I8II_BH_UserArgs_MT256x256x64_MI16x16x1_SN_CLR1_GSU0_GSUC0_GSUWGMRR0_K1_LBSPPA2048_LBSPPB512_LPA64_MIWT8_8_PLR1_SU0_SUM0_SUS64_SKXCCM8_VWA4_VWB8_WGM4_WGMXCC1_WGMXCCGn1
    SolutionIndex: 20
    SolutionNameMin: Cijk_Ailk_Bljk_I8II_BH_UserArgs_MT256x256x64_MI16x16x1_SN_CLR1_GSU0_GSUC0_GSUWGMRR0_K1_LBSPPA2048_LBSPPB128_LPA64_MIWT8_8_PLR1_SU0_SUM0_SUS64_SKXCCM8_VWA4_VWB1_WGM8_WGMXCC1_WGMXCCGn1
    SolutionIndex: 21
    SolutionNameMin: Cijk_Ailk_Bljk_I8II_BH_UserArgs_MT256x256x64_MI16x16x1_SN_CLR1_GSU0_GSUC0_GSUWGMRR0_K1_LBSPPA2048_LBSPPB128_LPA64_MIWT8_8_PLR1_SU0_SUM0_SUS64_SKXCCM8_VWA4_VWB2_WGM8_WGMXCC1_WGMXCCGn1
    SolutionIndex: 22
    SolutionNameMin: Cijk_Ailk_Bljk_I8II_BH_UserArgs_MT256x256x64_MI16x16x1_SN_CLR1_GSU0_GSUC0_GSUWGMRR0_K1_LBSPPA2048_LBSPPB256_LPA64_MIWT8_8_PLR1_SU0_SUM0_SUS64_SKXCCM8_VWA4_VWB4_WGM8_WGMXCC1_WGMXCCGn1
    SolutionIndex: 23
    SolutionNameMin: Cijk_Ailk_Bljk_I8II_BH_UserArgs_MT256x256x64_MI16x16x1_SN_CLR1_GSU0_GSUC0_GSUWGMRR0_K1_LBSPPA2048_LBSPPB512_LPA64_MIWT8_8_PLR1_SU0_SUM0_SUS64_SKXCCM8_VWA4_VWB8_WGM8_WGMXCC1_WGMXCCGn1
    SolutionIndex: 24
    SolutionNameMin: Cijk_Ailk_Bljk_I8II_BH_UserArgs_MT256x256x64_MI16x16x1_SN_CLR1_GSU0_GSUC0_GSUWGMRR0_K1_LBSPPA2048_LBSPPB128_LPA64_MIWT8_8_PLR1_SU0_SUM0_SUS64_SKXCCM8_VWA4_VWB1_WGM8_WGMXCC1_WGMXCCGn1
    SolutionIndex: 25
    SolutionNameMin: Cijk_Ailk_Bljk_I8II_BH_UserArgs_MT128x256x64_MI16x16x1_SN_CLR1_GSU0_GSUC0_GSUWGMRR0_K1_LBSPPA1024_LBSPPB128_LPA64_MIWT4_8_PLR1_SU0_SUM0_SUS64_SKXCCM8_VWA4_VWB2_WGM1_WGMXCC1_WGMXCCGn1
    SolutionIndex: 26
    SolutionNameMin: Cijk_Ailk_Bljk_I8II_BH_UserArgs_MT128x256x64_MI16x16x1_SN_CLR1_GSU0_GSUC0_GSUWGMRR0_K1_LBSPPA1024_LBSPPB512_LPA64_MIWT4_8_PLR1_SU0_SUM0_SUS64_SKXCCM8_VWA4_VWB8_WGM1_WGMXCC1_WGMXCCGn1
    SolutionIndex: 27
    SolutionNameMin: Cijk_Ailk_Bljk_I8II_BH_UserArgs_MT128x256x64_MI16x16x1_SN_CLR1_GSU0_GSUC0_GSUWGMRR0_K1_LBSPPA1024_LBSPPB512_LPA64_MIWT4_8_PLR1_SU0_SUM0_SUS64_SKXCCM8_VWA4_VWB8_WGM1_WGMXCC1_WGMXCCGn1
    SolutionIndex: 28
    SolutionNameMin: Cijk_Ailk_Bljk_I8II_BH_UserArgs_MT128x256x64_MI16x16x1_SN_CLR1_GSU0_GSUC0_GSUWGMRR0_K1_LBSPPA1024_LBSPPB128_LPA64_MIWT4_8_PLR1_SU0_SUM0_SUS64_SKXCCM8_VWA4_VWB2_WGM4_WGMXCC1_WGMXCCGn1
    SolutionIndex: 29
    SolutionNameMin: Cijk_Ailk_Bljk_I8II_BH_UserArgs_MT128x256x64_MI16x16x1_SN_CLR1_GSU0_GSUC0_GSUWGMRR0_K1_LBSPPA1024_LBSPPB512_LPA64_MIWT4_8_PLR1_SU0_SUM0_SUS64_SKXCCM8_VWA4_VWB8_WGM4_WGMXCC1_WGMXCCGn1
    SolutionIndex: 30
    SolutionNameMin: Cijk_Ailk_Bljk_I8II_BH_UserArgs_MT128x256x64_MI16x16x1_SN_CLR1_GSU0_GSUC0_GSUWGMRR0_K1_LBSPPA1024_LBSPPB128_LPA64_MIWT4_8_PLR1_SU0_SUM0_SUS64_SKXCCM8_VWA4_VWB2_WGM8_WGMXCC1_WGMXCCGn1
    SolutionIndex: 31
    SolutionNameMin: Cijk_Ailk_Bljk_I8II_BH_UserArgs_MT128x256x64_MI16x16x1_SN_CLR1_GSU0_GSUC0_GSUWGMRR0_K1_LBSPPA1024_LBSPPB256_LPA64_MIWT4_8_PLR1_SU0_SUM0_SUS64_SKXCCM8_VWA4_VWB4_WGM8_WGMXCC1_WGMXCCGn1
    SolutionIndex: 32
    SolutionNameMin: Cijk_Ailk_Bljk_I8II_BH_UserArgs_MT256x128x64_MI16x16x1_SN_CLR1_GSU0_GSUC0_GSUWGMRR0_K1_LBSPPA2048_LBSPPB128_LPA64_MIWT8_4_PLR1_SU0_SUM0_SUS64_SKXCCM8_VWA4_VWB1_WGM1_WGMXCC1_WGMXCCGn1
    SolutionIndex: 33
    SolutionNameMin: Cijk_Ailk_Bljk_I8II_BH_UserArgs_MT256x128x64_MI16x16x1_SN_CLR1_GSU0_GSUC0_GSUWGMRR0_K1_LBSPPA2048_LBSPPB128_LPA64_MIWT8_4_PLR1_SU0_SUM0_SUS64_SKXCCM8_VWA4_VWB2_WGM1_WGMXCC1_WGMXCCGn1
    SolutionIndex: 34
    SolutionNameMin: Cijk_Ailk_Bljk_I8II_BH_UserArgs_MT256x128x64_MI16x16x1_SN_CLR1_GSU0_GSUC0_GSUWGMRR0_K1_LBSPPA2048_LBSPPB128_LPA0_MIWT8_4_PLR1_SU0_SUM0_SUS64_SKXCCM8_VWA8_VWB1_WGM4_WGMXCC1_WGMXCCGn1
    SolutionIndex: 35
    SolutionNameMin: Cijk_Ailk_Bljk_I8II_BH_UserArgs_MT256x128x64_MI16x16x1_SN_CLR1_GSU0_GSUC0_GSUWGMRR0_K1_LBSPPA2048_LBSPPB256_LPA64_MIWT8_4_PLR1_SU0_SUM0_SUS64_SKXCCM8_VWA4_VWB4_WGM8_WGMXCC1_WGMXCCGn1
    SolutionIndex: 36
    SolutionNameMin: Cijk_Ailk_Bljk_I8II_BH_UserArgs_MT256x128x64_MI16x16x1_SN_CLR1_GSU0_GSUC0_GSUWGMRR0_K1_LBSPPA2048_LBSPPB256_LPA0_MIWT8_4_PLR1_SU0_SUM0_SUS64_SKXCCM8_VWA8_VWB4_WGM8_WGMXCC1_WGMXCCGn1
    SolutionIndex: 37
    SolutionNameMin: Cijk_Ailk_Bljk_I8II_BH_UserArgs_MT128x128x64_MI16x16x1_SN_CLR1_GSU0_GSUC0_GSUWGMRR0_K1_LBSPPA1024_LBSPPB128_LPA64_MIWT4_4_PLR1_SU0_SUM0_SUS64_SKXCCM8_VWA4_VWB2_WGM1_WGMXCC1_WGMXCCGn1
    SolutionIndex: 38
    SolutionNameMin: Cijk_Ailk_Bljk_I8II_BH_UserArgs_MT128x128x64_MI16x16x1_SN_CLR1_GSU0_GSUC0_GSUWGMRR0_K1_LBSPPA1024_LBSPPB128_LPA64_MIWT4_4_PLR1_SU0_SUM0_SUS64_SKXCCM8_VWA4_VWB1_WGM1_WGMXCC1_WGMXCCGn1
    SolutionIndex: 39
    SolutionNameMin: Cijk_Ailk_Bljk_I8II_BH_UserArgs_MT128x128x64_MI16x16x1_SN_CLR1_GSU0_GSUC0_GSUWGMRR0_K1_LBSPPA1024_LBSPPB128_LPA64_MIWT4_4_PLR1_SU0_SUM0_SUS64_SKXCCM8_VWA4_VWB2_WGM1_WGMXCC1_WGMXCCGn1
    SolutionIndex: 40
    SolutionNameMin: Cijk_Ailk_Bljk_I8II_BH_UserArgs_MT128x128x64_MI16x16x1_SN_CLR1_GSU0_GSUC0_GSUWGMRR0_K1_LBSPPA1024_LBSPPB256_LPA64_MIWT4_4_PLR1_SU0_SUM0_SUS64_SKXCCM8_VWA4_VWB4_WGM1_WGMXCC1_WGMXCCGn1
    SolutionIndex: 41
    SolutionNameMin: Cijk_Ailk_Bljk_I8II_BH_UserArgs_MT128x128x64_MI16x16x1_SN_CLR1_GSU0_GSUC0_GSUWGMRR0_K1_LBSPPA1024_LBSPPB128_LPA64_MIWT4_4_PLR1_SU0_SUM0_SUS64_SKXCCM8_VWA4_VWB1_WGM4_WGMXCC1_WGMXCCGn1
    SolutionIndex: 42
    SolutionNameMin: Cijk_Ailk_Bljk_I8II_BH_UserArgs_MT128x128x64_MI16x16x1_SN_CLR1_GSU0_GSUC0_GSUWGMRR0_K1_LBSPPA1024_LBSPPB256_LPA64_MIWT4_4_PLR1_SU0_SUM0_SUS64_SKXCCM8_VWA4_VWB4_WGM8_WGMXCC1_WGMXCCGn1
    SolutionIndex: 43
    SolutionNameMin: Cijk_Ailk_Bljk_I8II_BH_UserArgs_MT64x128x64_MI16x16x1_SN_CLR1_GSU0_GSUC0_GSUWGMRR0_K1_LBSPPA512_LBSPPB128_LPA32_MIWT2_4_PLR1_SU0_SUM0_SUS64_SKXCCM8_VWA2_VWB1_WGM1_WGMXCC1_WGMXCCGn1
    SolutionIndex: 44
    SolutionNameMin: Cijk_Ailk_Bljk_I8II_BH_UserArgs_MT64x128x64_MI16x16x1_SN_CLR1_GSU0_GSUC0_GSUWGMRR0_K1_LBSPPA512_LBSPPB128_LPA32_MIWT2_4_PLR1_SU0_SUM0_SUS64_SKXCCM8_VWA2_VWB2_WGM1_WGMXCC1_WGMXCCGn1
    SolutionIndex: 45
    SolutionNameMin: Cijk_Ailk_Bljk_I8II_BH_UserArgs_MT64x128x64_MI16x16x1_SN_CLR1_GSU0_GSUC0_GSUWGMRR0_K1_LBSPPA512_LBSPPB256_LPA32_MIWT2_4_PLR1_SU0_SUM0_SUS64_SKXCCM8_VWA2_VWB4_WGM1_WGMXCC1_WGMXCCGn1
    SolutionIndex: 46
    SolutionNameMin: Cijk_Ailk_Bljk_I8II_BH_UserArgs_MT64x128x64_MI16x16x1_SN_CLR1_GSU0_GSUC0_GSUWGMRR0_K1_LBSPPA512_LBSPPB128_LPA16_MIWT2_4_PLR1_SU0_SUM0_SUS64_SKXCCM8_VWA1_VWB1_WGM1_WGMXCC1_WGMXCCGn1
    SolutionIndex: 47
    SolutionNameMin: Cijk_Ailk_Bljk_I8II_BH_UserArgs_MT64x128x64_MI16x16x1_SN_CLR1_GSU0_GSUC0_GSUWGMRR0_K1_LBSPPA512_LBSPPB128_LPA32_MIWT2_4_PLR1_SU0_SUM0_SUS64_SKXCCM8_VWA2_VWB1_WGM1_WGMXCC1_WGMXCCGn1
    SolutionIndex: 48
    SolutionNameMin: Cijk_Ailk_Bljk_I8II_BH_UserArgs_MT64x128x64_MI16x16x1_SN_CLR1_GSU0_GSUC0_GSUWGMRR0_K1_LBSPPA512_LBSPPB128_LPA32_MIWT2_4_PLR1_SU0_SUM0_SUS64_SKXCCM8_VWA2_VWB2_WGM1_WGMXCC1_WGMXCCGn1
    SolutionIndex: 49
    SolutionNameMin: Cijk_Ailk_Bljk_I8II_BH_UserArgs_MT64x128x64_MI16x16x1_SN_CLR1_GSU0_GSUC0_GSUWGMRR0_K1_LBSPPA512_LBSPPB256_LPA32_MIWT2_4_PLR1_SU0_SUM0_SUS64_SKXCCM8_VWA2_VWB4_WGM1_WGMXCC1_WGMXCCGn1
    SolutionIndex: 50
    SolutionNameMin: Cijk_Ailk_Bljk_I8II_BH_UserArgs_MT64x128x64_MI16x16x1_SN_CLR1_GSU0_GSUC0_GSUWGMRR0_K1_LBSPPA512_LBSPPB256_LPA32_MIWT2_4_PLR1_SU0_SUM0_SUS64_SKXCCM8_VWA2_VWB4_WGM4_WGMXCC1_WGMXCCGn1
    SolutionIndex: 51
    SolutionNameMin: Cijk_Ailk_Bljk_I8II_BH_UserArgs_MT64x128x64_MI16x16x1_SN_CLR1_GSU0_GSUC0_GSUWGMRR0_K1_LBSPPA512_LBSPPB256_LPA32_MIWT2_4_PLR1_SU0_SUM0_SUS64_SKXCCM8_VWA2_VWB4_WGM8_WGMXCC1_WGMXCCGn1
    SolutionIndex: 52
    SolutionNameMin: Cijk_Ailk_Bljk_I8II_BH_UserArgs_MT128x64x64_MI16x16x1_SN_CLR1_GSU0_GSUC0_GSUWGMRR0_K1_LBSPPA1024_LBSPPB128_LPA64_MIWT4_2_PLR1_SU0_SUM0_SUS64_SKXCCM8_VWA4_VWB1_WGM1_WGMXCC1_WGMXCCGn1
    SolutionIndex: 53
    SolutionNameMin: Cijk_Ailk_Bljk_I8II_BH_UserArgs_MT128x64x64_MI16x16x1_SN_CLR1_GSU0_GSUC0_GSUWGMRR0_K1_LBSPPA1024_LBSPPB128_LPA64_MIWT4_2_PLR1_SU0_SUM0_SUS64_SKXCCM8_VWA4_VWB1_WGM1_WGMXCC1_WGMXCCGn1
    SolutionIndex: 54
    SolutionNameMin: Cijk_Ailk_Bljk_I8II_BH_UserArgs_MT128x64x64_MI16x16x1_SN_CLR1_GSU0_GSUC0_GSUWGMRR0_K1_LBSPPA1024_LBSPPB128_LPA64_MIWT4_2_PLR1_SU0_SUM0_SUS64_SKXCCM8_VWA4_VWB2_WGM1_WGMXCC1_WGMXCCGn1
    SolutionIndex: 55
    SolutionNameMin: Cijk_Ailk_Bljk_I8II_BH_UserArgs_MT128x64x64_MI16x16x1_SN_CLR1_GSU0_GSUC0_GSUWGMRR0_K1_LBSPPA1024_LBSPPB128_LPA64_MIWT4_2_PLR1_SU0_SUM0_SUS64_SKXCCM8_VWA4_VWB2_WGM4_WGMXCC1_WGMXCCGn1
    SolutionIndex: 56
    SolutionNameMin: Cijk_Ailk_Bljk_I8II_BH_UserArgs_MT128x32x64_MI16x16x1_SN_CLR1_GSU0_GSUC0_GSUWGMRR0_K1_LBSPPA1024_LBSPPB128_LPA64_MIWT4_1_PLR1_SU0_SUM0_SUS64_SKXCCM8_VWA4_VWB1_WGM1_WGMXCC1_WGMXCCGn1
    SolutionIndex: 57
    SolutionNameMin: Cijk_Ailk_Bljk_I8II_BH_UserArgs_MT64x64x64_MI16x16x1_SN_CLR1_GSU0_GSUC0_GSUWGMRR0_K1_LBSPPA512_LBSPPB128_LPA32_MIWT2_2_PLR1_SU0_SUM0_SUS64_SKXCCM8_VWA2_VWB1_WGM1_WGMXCC1_WGMXCCGn1
    SolutionIndex: 58
    SolutionNameMin: Cijk_Ailk_Bljk_I8II_BH_UserArgs_MT64x64x64_MI16x16x1_SN_CLR1_GSU0_GSUC0_GSUWGMRR0_K1_LBSPPA512_LBSPPB128_LPA32_MIWT2_2_PLR1_SU0_SUM0_SUS64_SKXCCM8_VWA2_VWB2_WGM1_WGMXCC1_WGMXCCGn1
    SolutionIndex: 59
    SolutionNameMin: Cijk_Ailk_Bljk_I8II_BH_UserArgs_MT64x64x64_MI16x16x1_SN_CLR1_GSU0_GSUC0_GSUWGMRR0_K1_LBSPPA512_LBSPPB128_LPA32_MIWT2_2_PLR1_SU0_SUM0_SUS64_SKXCCM8_VWA2_VWB1_WGM1_WGMXCC1_WGMXCCGn1
    SolutionIndex: 60
    SolutionNameMin: Cijk_Ailk_Bljk_I8II_BH_UserArgs_MT64x32x64_MI16x16x1_SN_CLR1_GSU0_GSUC0_GSUWGMRR0_K1_LBSPPA512_LBSPPB128_LPA32_MIWT2_1_PLR1_SU0_SUM0_SUS64_SKXCCM8_VWA2_VWB1_WGM1_WGMXCC1_WGMXCCGn1
    SolutionIndex: 61
    SolutionNameMin: Cijk_Ailk_Bljk_I8II_BH_UserArgs_MT32x32x64_MI16x16x1_SN_CLR1_GSU0_GSUC0_GSUWGMRR0_K1_LBSPPA256_LBSPPB128_LPA16_MIWT1_1_PLR1_SU0_SUM0_SUS64_SKXCCM8_VWA1_VWB1_WGM1_WGMXCC1_WGMXCCGn1
    SolutionIndex: 62
    SolutionNameMin: Cijk_Ailk_Bljk_I8II_BH_UserArgs_MT32x32x64_MI16x16x1_SN_CLR1_GSU0_GSUC0_GSUWGMRR0_K1_LBSPPA256_LBSPPB128_LPA16_MIWT1_1_PLR1_SU0_SUM0_SUS64_SKXCCM8_VWA1_VWB1_WGM1_WGMXCC1_WGMXCCGn1
    SolutionIndex: 63
    SolutionNameMin: Cijk_Ailk_Bljk_I8II_BH_UserArgs_MT32x32x64_MI16x16x1_SN_CLR1_GSU0_GSUC0_GSUWGMRR0_K1_LBSPPA256_LBSPPB128_LPA16_MIWT1_1_PLR1_SU0_SUM0_SUS64_SKXCCM8_VWA1_VWB1_WGM1_WGMXCC1_WGMXCCGn1
    SolutionIndex: 64
    SolutionNameMin: Cijk_Ailk_Bljk_I8II_BH_UserArgs_MT32x32x64_MI16x16x1_SN_CLR1_GSU0_GSUC0_GSUWGMRR0_K1_LBSPPA256_LBSPPB128_LPA16_MIWT1_1_PLR1_SU0_SUM0_SUS64_SKXCCM8_VWA1_VWB1_WGM1_WGMXCC1_WGMXCCGn1
    SolutionIndex: 65
    SolutionNameMin: Cijk_Ailk_Bljk_I8II_BH_UserArgs_MT32x32x64_MI16x16x1_SN_CLR1_GSU0_GSUC0_GSUWGMRR0_K1_LBSPPA256_LBSPPB128_LPA16_MIWT1_1_PLR1_SU0_SUM0_SUS64_SKXCCM8_VWA1_VWB1_WGM1_WGMXCC1_WGMXCCGn1
    SolutionIndex: 66
    SolutionNameMin: Cijk_Ailk_Bljk_I8II_BH_UserArgs_MT128x256x128_MI16x16x1_SN_CLR1_GSU0_GSUC0_GSUWGMRR0_K1_LBSPPA2048_LBSPPB1024_LPA64_MIWT4_8_PLR1_SU0_SUM0_SUS128_SKXCCM8_VWA4_VWB8_WGM1_WGMXCC1_WGMXCCGn1
    SolutionIndex: 67
    SolutionNameMin: Cijk_Ailk_Bljk_I8II_BH_UserArgs_MT128x256x128_MI16x16x1_SN_CLR1_GSU0_GSUC0_GSUWGMRR0_K1_LBSPPA2048_LBSPPB256_LPA64_MIWT4_8_PLR1_SU0_SUM0_SUS128_SKXCCM8_VWA4_VWB2_WGM4_WGMXCC1_WGMXCCGn1
    SolutionIndex: 68
    SolutionNameMin: Cijk_Ailk_Bljk_I8II_BH_UserArgs_MT256x128x128_MI16x16x1_SN_CLR1_GSU0_GSUC0_GSUWGMRR0_K1_LBSPPA4096_LBSPPB512_LPA64_MIWT8_4_PLR1_SU0_SUM0_SUS128_SKXCCM8_VWA4_VWB4_WGM1_WGMXCC1_WGMXCCGn1
    SolutionIndex: 69
    SolutionNameMin: Cijk_Ailk_Bljk_I8II_BH_UserArgs_MT256x128x128_MI16x16x1_SN_CLR1_GSU0_GSUC0_GSUWGMRR0_K1_LBSPPA4096_LBSPPB128_LPA0_MIWT8_4_PLR1_SU0_SUM0_SUS128_SKXCCM8_VWA8_VWB1_WGM1_WGMXCC1_WGMXCCGn1
    SolutionIndex: 70
    SolutionNameMin: Cijk_Ailk_Bljk_I8II_BH_UserArgs_MT256x128x128_MI16x16x1_SN_CLR1_GSU0_GSUC0_GSUWGMRR0_K1_LBSPPA4096_LBSPPB256_LPA0_MIWT8_4_PLR1_SU0_SUM0_SUS128_SKXCCM8_VWA8_VWB2_WGM1_WGMXCC1_WGMXCCGn1
    SolutionIndex: 71
    SolutionNameMin: Cijk_Ailk_Bljk_I8II_BH_UserArgs_MT256x128x128_MI16x16x1_SN_CLR1_GSU0_GSUC0_GSUWGMRR0_K1_LBSPPA4096_LBSPPB128_LPA0_MIWT8_4_PLR1_SU0_SUM0_SUS128_SKXCCM8_VWA8_VWB1_WGM4_WGMXCC1_WGMXCCGn1
    SolutionIndex: 72
    SolutionNameMin: Cijk_Ailk_Bljk_I8II_BH_UserArgs_MT256x128x128_MI16x16x1_SN_CLR1_GSU0_GSUC0_GSUWGMRR0_K1_LBSPPA4096_LBSPPB256_LPA64_MIWT8_4_PLR1_SU0_SUM0_SUS128_SKXCCM8_VWA4_VWB2_WGM8_WGMXCC1_WGMXCCGn1
    SolutionIndex: 73
    SolutionNameMin: Cijk_Ailk_Bljk_I8II_BH_UserArgs_MT256x128x128_MI16x16x1_SN_CLR1_GSU0_GSUC0_GSUWGMRR0_K1_LBSPPA4096_LBSPPB512_LPA0_MIWT8_4_PLR1_SU0_SUM0_SUS128_SKXCCM8_VWA8_VWB4_WGM8_WGMXCC1_WGMXCCGn1
    SolutionIndex: 74
    SolutionNameMin: Cijk_Ailk_Bljk_I8II_BH_UserArgs_MT128x128x128_MI16x16x1_SN_CLR1_GSU0_GSUC0_GSUWGMRR0_K1_LBSPPA2048_LBSPPB128_LPA64_MIWT4_4_PLR1_SU0_SUM0_SUS128_SKXCCM8_VWA4_VWB1_WGM1_WGMXCC1_WGMXCCGn1
    SolutionIndex: 75
    SolutionNameMin: Cijk_Ailk_Bljk_I8II_BH_UserArgs_MT128x128x128_MI16x16x1_SN_CLR1_GSU0_GSUC0_GSUWGMRR0_K1_LBSPPA2048_LBSPPB256_LPA64_MIWT4_4_PLR1_SU0_SUM0_SUS128_SKXCCM8_VWA4_VWB2_WGM1_WGMXCC1_WGMXCCGn1
    SolutionIndex: 76
    SolutionNameMin: Cijk_Ailk_Bljk_I8II_BH_UserArgs_MT128x128x128_MI16x16x1_SN_CLR1_GSU0_GSUC0_GSUWGMRR0_K1_LBSPPA2048_LBSPPB512_LPA64_MIWT4_4_PLR1_SU0_SUM0_SUS128_SKXCCM8_VWA4_VWB4_WGM1_WGMXCC1_WGMXCCGn1
    SolutionIndex: 77
    SolutionNameMin: Cijk_Ailk_Bljk_I8II_BH_UserArgs_MT128x128x128_MI16x16x1_SN_CLR1_GSU0_GSUC0_GSUWGMRR0_K1_LBSPPA2048_LBSPPB256_LPA64_MIWT4_4_PLR1_SU0_SUM0_SUS128_SKXCCM8_VWA4_VWB2_WGM4_WGMXCC1_WGMXCCGn1
    SolutionIndex: 78
    SolutionNameMin: Cijk_Ailk_Bljk_I8II_BH_UserArgs_MT128x128x128_MI16x16x1_SN_CLR1_GSU0_GSUC0_GSUWGMRR0_K1_LBSPPA2048_LBSPPB512_LPA64_MIWT4_4_PLR1_SU0_SUM0_SUS128_SKXCCM8_VWA4_VWB4_WGM4_WGMXCC1_WGMXCCGn1
    SolutionIndex: 79
    SolutionNameMin: Cijk_Ailk_Bljk_I8II_BH_UserArgs_MT128x128x128_MI16x16x1_SN_CLR1_GSU0_GSUC0_GSUWGMRR0_K1_LBSPPA2048_LBSPPB256_LPA64_MIWT4_4_PLR1_SU0_SUM0_SUS128_SKXCCM8_VWA4_VWB2_WGM8_WGMXCC1_WGMXCCGn1
    SolutionIndex: 80
    SolutionNameMin: Cijk_Ailk_Bljk_I8II_BH_UserArgs_MT128x128x128_MI16x16x1_SN_CLR1_GSU0_GSUC0_GSUWGMRR0_K1_LBSPPA2048_LBSPPB512_LPA64_MIWT4_4_PLR1_SU0_SUM0_SUS128_SKXCCM8_VWA4_VWB4_WGM8_WGMXCC1_WGMXCCGn1
    SolutionIndex: 81
    SolutionNameMin: Cijk_Ailk_Bljk_I8II_BH_UserArgs_MT128x64x128_MI16x16x1_SN_CLR1_GSU0_GSUC0_GSUWGMRR0_K1_LBSPPA2048_LBSPPB128_LPA64_MIWT4_2_PLR1_SU0_SUM0_SUS128_SKXCCM8_VWA4_VWB1_WGM1_WGMXCC1_WGMXCCGn1
    SolutionIndex: 82
    SolutionNameMin: Cijk_Ailk_Bljk_I8II_BH_UserArgs_MT128x32x128_MI16x16x1_SN_CLR1_GSU0_GSUC0_GSUWGMRR0_K1_LBSPPA2048_LBSPPB128_LPA64_MIWT4_1_PLR1_SU0_SUM0_SUS128_SKXCCM8_VWA4_VWB1_WGM1_WGMXCC1_WGMXCCGn1
    SolutionIndex: 83
    SolutionNameMin: Cijk_Ailk_Bljk_I8II_BH_UserArgs_MT64x64x128_MI16x16x1_SN_CLR1_GSU0_GSUC0_GSUWGMRR0_K1_LBSPPA1024_LBSPPB128_LPA32_MIWT2_2_PLR1_SU0_SUM0_SUS128_SKXCCM8_VWA2_VWB1_WGM1_WGMXCC1_WGMXCCGn1
    SolutionIndex: 84
    SolutionNameMin: Cijk_Ailk_Bljk_I8II_BH_UserArgs_MT64x64x128_MI16x16x1_SN_CLR1_GSU0_GSUC0_GSUWGMRR0_K1_LBSPPA1024_LBSPPB256_LPA32_MIWT2_2_PLR1_SU0_SUM0_SUS128_SKXCCM8_VWA2_VWB2_WGM1_WGMXCC1_WGMXCCGn1
    SolutionIndex: 85
    SolutionNameMin: Cijk_Ailk_Bljk_I8II_BH_UserArgs_MT64x64x128_MI16x16x1_SN_CLR1_GSU0_GSUC0_GSUWGMRR0_K1_LBSPPA1024_LBSPPB256_LPA32_MIWT2_2_PLR1_SU0_SUM0_SUS128_SKXCCM8_VWA2_VWB2_WGM4_WGMXCC1_WGMXCCGn1
    SolutionIndex: 86
    SolutionNameMin: Cijk_Ailk_Bljk_I8II_BH_UserArgs_MT32x64x128_MI16x16x1_SN_CLR1_GSU0_GSUC0_GSUWGMRR0_K1_LBSPPA512_LBSPPB128_LPA16_MIWT1_2_PLR1_SU0_SUM0_SUS128_SKXCCM8_VWA1_VWB1_WGM1_WGMXCC1_WGMXCCGn1
    SolutionIndex: 87
    SolutionNameMin: Cijk_Ailk_Bljk_I8II_BH_UserArgs_MT32x64x128_MI16x16x1_SN_CLR1_GSU0_GSUC0_GSUWGMRR0_K1_LBSPPA512_LBSPPB128_LPA16_MIWT1_2_PLR1_SU0_SUM0_SUS128_SKXCCM8_VWA1_VWB1_WGM1_WGMXCC1_WGMXCCGn1
    SolutionIndex: 88
    SolutionNameMin: Cijk_Ailk_Bljk_I8II_BH_UserArgs_MT32x64x128_MI16x16x1_SN_CLR1_GSU0_GSUC0_GSUWGMRR0_K1_LBSPPA512_LBSPPB256_LPA16_MIWT1_2_PLR1_SU0_SUM0_SUS128_SKXCCM8_VWA1_VWB2_WGM1_WGMXCC1_WGMXCCGn1
    SolutionIndex: 89
    SolutionNameMin: Cijk_Ailk_Bljk_I8II_BH_UserArgs_MT32x64x128_MI16x16x1_SN_CLR1_GSU0_GSUC0_GSUWGMRR0_K1_LBSPPA512_LBSPPB128_LPA16_MIWT1_2_PLR1_SU0_SUM0_SUS128_SKXCCM8_VWA1_VWB1_WGM1_WGMXCC1_WGMXCCGn1
    SolutionIndex: 90
    SolutionNameMin: Cijk_Ailk_Bljk_I8II_BH_UserArgs_MT32x64x128_MI16x16x1_SN_CLR1_GSU0_GSUC0_GSUWGMRR0_K1_LBSPPA512_LBSPPB128_LPA16_MIWT1_2_PLR1_SU0_SUM0_SUS128_SKXCCM8_VWA1_VWB1_WGM4_WGMXCC1_WGMXCCGn1
    SolutionIndex: 91
    SolutionNameMin: Cijk_Ailk_Bljk_I8II_BH_UserArgs_MT64x32x128_MI16x16x1_SN_CLR1_GSU0_GSUC0_GSUWGMRR0_K1_LBSPPA1024_LBSPPB128_LPA32_MIWT2_1_PLR1_SU0_SUM0_SUS128_SKXCCM8_VWA2_VWB1_WGM1_WGMXCC1_WGMXCCGn1
    SolutionIndex: 92
    SolutionNameMin: Cijk_Ailk_Bljk_I8II_BH_UserArgs_MT64x32x128_MI16x16x1_SN_CLR1_GSU0_GSUC0_GSUWGMRR0_K1_LBSPPA1024_LBSPPB128_LPA32_MIWT2_1_PLR1_SU0_SUM0_SUS128_SKXCCM8_VWA2_VWB1_WGM1_WGMXCC1_WGMXCCGn1
    SolutionIndex: 93
    SolutionNameMin: Cijk_Ailk_Bljk_I8II_BH_UserArgs_MT64x32x128_MI16x16x1_SN_CLR1_GSU0_GSUC0_GSUWGMRR0_K1_LBSPPA1024_LBSPPB128_LPA32_MIWT2_1_PLR1_SU0_SUM0_SUS128_SKXCCM8_VWA2_VWB1_WGM8_WGMXCC1_WGMXCCGn1
    SolutionIndex: 94
    SolutionNameMin: Cijk_Ailk_Bljk_I8II_BH_UserArgs_MT32x32x128_MI16x16x1_SN_CLR1_GSU0_GSUC0_GSUWGMRR0_K1_LBSPPA512_LBSPPB128_LPA16_MIWT1_1_PLR1_SU0_SUM0_SUS128_SKXCCM8_VWA1_VWB1_WGM1_WGMXCC1_WGMXCCGn1
    SolutionIndex: 95
    SolutionNameMin: Cijk_Ailk_Bljk_I8II_BH_UserArgs_MT32x32x128_MI16x16x1_SN_CLR1_GSU0_GSUC0_GSUWGMRR0_K1_LBSPPA512_LBSPPB128_LPA16_MIWT1_1_PLR1_SU0_SUM0_SUS128_SKXCCM8_VWA1_VWB1_WGM1_WGMXCC1_WGMXCCGn1
    SolutionIndex: 96
    SolutionNameMin: Cijk_Ailk_Bljk_I8II_BH_UserArgs_MT32x32x128_MI16x16x1_SN_CLR1_GSU0_GSUC0_GSUWGMRR0_K1_LBSPPA512_LBSPPB128_LPA16_MIWT1_1_PLR1_SU0_SUM0_SUS128_SKXCCM8_VWA1_VWB1_WGM1_WGMXCC1_WGMXCCGn1
    SolutionIndex: 97
    SolutionNameMin: Cijk_Ailk_Bljk_I8II_BH_UserArgs_MT32x32x128_MI16x16x1_SN_CLR1_GSU0_GSUC0_GSUWGMRR0_K1_LBSPPA512_LBSPPB128_LPA16_MIWT1_1_PLR1_SU0_SUM0_SUS128_SKXCCM8_VWA1_VWB1_WGM8_WGMXCC1_WGMXCCGn1
    SolutionIndex: 98
    SolutionNameMin: Cijk_Ailk_Bljk_I8II_BH_UserArgs_MT64x128x256_MI16x16x1_SN_CLR1_GSU0_GSUC0_GSUWGMRR0_K1_LBSPPA1024_LBSPPB512_LPA32_MIWT2_4_PLR2_SU0_SUM0_SUS256_SKXCCM8_VWA2_VWB2_WGM1_WGMXCC1_WGMXCCGn1
    SolutionIndex: 99
    SolutionNameMin: Cijk_Ailk_Bljk_I8II_BH_UserArgs_MT64x128x256_MI16x16x1_SN_CLR1_GSU0_GSUC0_GSUWGMRR0_K1_LBSPPA1024_LBSPPB1024_LPA32_MIWT2_4_PLR2_SU0_SUM0_SUS256_SKXCCM8_VWA2_VWB4_WGM1_WGMXCC1_WGMXCCGn1
    SolutionIndex: 100
    SolutionNameMin: Cijk_Ailk_Bljk_I8II_BH_UserArgs_MT128x64x256_MI16x16x1_SN_CLR1_GSU0_GSUC0_GSUWGMRR0_K1_LBSPPA2048_LBSPPB256_LPA64_MIWT4_2_PLR2_SU0_SUM0_SUS256_SKXCCM8_VWA4_VWB1_WGM1_WGMXCC1_WGMXCCGn1
    SolutionIndex: 101
    SolutionNameMin: Cijk_Ailk_Bljk_I8II_BH_UserArgs_MT64x64x256_MI16x16x1_SN_CLR1_GSU0_GSUC0_GSUWGMRR0_K1_LBSPPA1024_LBSPPB256_LPA32_MIWT2_2_PLR2_SU0_SUM0_SUS256_SKXCCM8_VWA2_VWB1_WGM1_WGMXCC1_WGMXCCGn1
    SolutionIndex: 102
    SolutionNameMin: Cijk_Ailk_Bljk_I8II_BH_UserArgs_MT64x64x256_MI16x16x1_SN_CLR1_GSU0_GSUC0_GSUWGMRR0_K1_LBSPPA1024_LBSPPB512_LPA32_MIWT2_2_PLR2_SU0_SUM0_SUS256_SKXCCM8_VWA2_VWB2_WGM1_WGMXCC1_WGMXCCGn1
    SolutionIndex: 103
    SolutionNameMin: Cijk_Ailk_Bljk_I8II_BH_UserArgs_MT32x32x256_MI16x16x1_SN_CLR1_GSU0_GSUC0_GSUWGMRR0_K1_LBSPPA512_LBSPPB256_LPA16_MIWT1_1_PLR1_SU0_SUM0_SUS256_SKXCCM8_VWA1_VWB1_WGM1_WGMXCC1_WGMXCCGn1
    SolutionIndex: 104
    SolutionNameMin: Cijk_Ailk_Bljk_I8II_BH_UserArgs_MT32x32x256_MI16x16x1_SN_CLR1_GSU0_GSUC0_GSUWGMRR0_K1_LBSPPA512_LBSPPB256_LPA16_MIWT1_1_PLR2_SU0_SUM0_SUS256_SKXCCM8_VWA1_VWB1_WGM1_WGMXCC1_WGMXCCGn1
    SolutionIndex: 105
    SolutionNameMin: Cijk_Ailk_Bljk_I8II_BH_UserArgs_MT32x32x32_MI16x16x1_SN_CLR0_GSU0_GSUC0_GSUWGMRR0_K1_LBSPPA256_LBSPPB128_LPA16_MIWT1_1_PLR0_SU32_SUM0_SUS256_SKXCCM8_VWA1_VWB1_WGM1_WGMXCC1_WGMXCCGn1
- - - [128, 128, 1, 128, 128, 128, 128, 128]
    - [64, 0.62]
  - - [128, 128, 1, 256, 128, 128, 128, 256]
    - [65, 1.12]
  - - [128, 128, 1, 512, 128, 128, 128, 512]
    - [94, 1.9]
  - - [128, 128, 1, 1024, 128, 128, 128, 1024]
    - [96, 2.92]
  - - [128, 128, 1, 2048, 128, 128, 128, 2048]
    - [103, 3.99]
  - - [128, 128, 1, 4096, 128, 128, 128, 4096]
    - [104, 4.98]
  - - [128, 128, 1, 8192, 128, 128, 128, 8192]
    - [104, 5.67]
  - - [128, 256, 1, 128, 128, 128, 128, 128]
    - [61, 1.22]
  - - [128, 256, 1, 256, 128, 128, 128, 256]
    - [94, 2.22]
  - - [128, 256, 1, 512, 128, 128, 128, 512]
    - [95, 3.76]
  - - [128, 256, 1, 1024, 128, 128, 128, 1024]
    - [96, 5.81]
  - - [128, 256, 1, 2048, 128, 128, 128, 2048]
    - [96, 7.96]
  - - [128, 256, 1, 4096, 128, 128, 128, 4096]
    - [104, 9.91]
  - - [128, 256, 1, 8192, 128, 128, 128, 8192]
    - [104, 11.29]
  - - [128, 512, 1, 128, 128, 128, 128, 128]
    - [62, 2.42]
  - - [128, 512, 1, 256, 128, 128, 128, 256]
    - [63, 4.34]
  - - [128, 512, 1, 512, 128, 128, 128, 512]
    - [95, 7.4]
  - - [128, 512, 1, 1024, 128, 128, 128, 1024]
    - [96, 11.38]
  - - [128, 512, 1, 2048, 128, 128, 128, 2048]
    - [96, 15.66]
  - - [128, 512, 1, 4096, 128, 128, 128, 4096]
    - [104, 19.53]
  - - [128, 512, 1, 8192, 128, 128, 128, 8192]
    - [104, 22.34]
  - - [128, 1024, 1, 128, 128, 128, 128, 128]
    - [86, 4.42]
  - - [128, 1024, 1, 256, 128, 128, 128, 256]
    - [92, 7.84]
  - - [128, 1024, 1, 512, 128, 128, 128, 512]
    - [87, 13.31]
  - - [128, 1024, 1, 1024, 128, 128, 128, 1024]
    - [88, 20.52]
  - - [128, 1024, 1, 2048, 128, 128, 128, 2048]
    - [88, 27.69]
  - - [128, 1024, 1, 4096, 128, 128, 128, 4096]
    - [88, 33.94]
  - - [128, 1024, 1, 8192, 128, 128, 128, 8192]
    - [87, 38.21]
  - - [128, 2048, 1, 128, 128, 128, 128, 128]
    - [59, 7.83]
  - - [128, 2048, 1, 256, 128, 128, 128, 256]
    - [59, 13.83]
  - - [128, 2048, 1, 512, 128, 128, 128, 512]
    - [83, 22.28]
  - - [128, 2048, 1, 1024, 128, 128, 128, 1024]
    - [101, 33.29]
  - - [128, 2048, 1, 2048, 128, 128, 128, 2048]
    - [101, 45.83]
  - - [128, 2048, 1, 4096, 128, 128, 128, 4096]
    - [101, 56.03]
  - - [128, 2048, 1, 8192, 128, 128, 128, 8192]
    - [101, 59.0]
  - - [128, 4096, 1, 128, 128, 128, 128, 128]
    - [53, 13.04]
  - - [128, 4096, 1, 256, 128, 128, 128, 256]
    - [52, 22.21]
  - - [128, 4096, 1, 512, 128, 128, 128, 512]
    - [49, 35.99]
  - - [128, 4096, 1, 1024, 128, 128, 128, 1024]
    - [49, 51.92]
  - - [128, 4096, 1, 2048, 128, 128, 128, 2048]
    - [99, 68.52]
  - - [128, 4096, 1, 4096, 128, 128, 128, 4096]
    - [100, 75.78]
  - - [128, 4096, 1, 8192, 128, 128, 128, 8192]
    - [99, 86.47]
  - - [128, 8192, 1, 128, 128, 128, 128, 128]
    - [40, 19.64]
  - - [128, 8192, 1, 256, 128, 128, 128, 256]
    - [38, 33.98]
  - - [128, 8192, 1, 512, 128, 128, 128, 512]
    - [38, 52.95]
  - - [128, 8192, 1, 1024, 128, 128, 128, 1024]
    - [76, 73.56]
  - - [128, 8192, 1, 2048, 128, 128, 128, 2048]
    - [75, 92.85]
  - - [128, 8192, 1, 4096, 128, 128, 128, 4096]
    - [76, 109.22]
  - - [128, 8192, 1, 8192, 128, 128, 128, 8192]
    - [75, 119.1]
  - - [256, 128, 1, 128, 256, 256, 256, 128]
    - [64, 1.23]
  - - [256, 128, 1, 256, 256, 256, 256, 256]
    - [95, 2.21]
  - - [256, 128, 1, 512, 256, 256, 256, 512]
    - [96, 3.79]
  - - [256, 128, 1, 1024, 256, 256, 256, 1024]
    - [96, 5.8]
  - - [256, 128, 1, 2048, 256, 256, 256, 2048]
    - [96, 7.93]
  - - [256, 128, 1, 4096, 256, 256, 256, 4096]
    - [103, 9.83]
  - - [256, 128, 1, 8192, 256, 256, 256, 8192]
    - [104, 11.19]
  - - [256, 256, 1, 128, 256, 256, 256, 128]
    - [65, 2.37]
  - - [256, 256, 1, 256, 256, 256, 256, 256]
    - [96, 4.36]
  - - [256, 256, 1, 512, 256, 256, 256, 512]
    - [96, 7.42]
  - - [256, 256, 1, 1024, 256, 256, 256, 1024]
    - [96, 11.3]
  - - [256, 256, 1, 2048, 256, 256, 256, 2048]
    - [96, 15.6]
  - - [256, 256, 1, 4096, 256, 256, 256, 4096]
    - [104, 19.24]
  - - [256, 256, 1, 8192, 256, 256, 256, 8192]
    - [104, 22.18]
  - - [256, 512, 1, 128, 256, 256, 256, 128]
    - [89, 4.42]
  - - [256, 512, 1, 256, 256, 256, 256, 256]
    - [60, 7.76]
  - - [256, 512, 1, 512, 256, 256, 256, 512]
    - [88, 13.34]
  - - [256, 512, 1, 1024, 256, 256, 256, 1024]
    - [87, 20.39]
  - - [256, 512, 1, 2048, 256, 256, 256, 2048]
    - [87, 27.91]
  - - [256, 512, 1, 4096, 256, 256, 256, 4096]
    - [88, 34.0]
  - - [256, 512, 1, 8192, 256, 256, 256, 8192]
    - [88, 38.26]
  - - [256, 1024, 1, 128, 256, 256, 256, 128]
    - [83, 7.81]
  - - [256, 1024, 1, 256, 256, 256, 256, 256]
    - [59, 13.8]
  - - [256, 1024, 1, 512, 256, 256, 256, 512]
    - [84, 22.48]
  - - [256, 1024, 1, 1024, 256, 256, 256, 1024]
    - [84, 33.35]
  - - [256, 1024, 1, 2048, 256, 256, 256, 2048]
    - [102, 45.55]
  - - [256, 1024, 1, 4096, 256, 256, 256, 4096]
    - [101, 55.81]
  - - [256, 1024, 1, 8192, 256, 256, 256, 8192]
    - [84, 57.31]
  - - [256, 2048, 1, 128, 256, 256, 256, 128]
    - [54, 12.96]
  - - [256, 2048, 1, 256, 256, 256, 256, 256]
    - [54, 22.49]
  - - [256, 2048, 1, 512, 256, 256, 256, 512]
    - [48, 36.13]
  - - [256, 2048, 1, 1024, 256, 256, 256, 1024]
    - [47, 51.88]
  - - [256, 2048, 1, 2048, 256, 256, 256, 2048]
    - [98, 68.37]
  - - [256, 2048, 1, 4096, 256, 256, 256, 4096]
    - [99, 83.27]
  - - [256, 2048, 1, 8192, 256, 256, 256, 8192]
    - [81, 79.68]
  - - [256, 4096, 1, 128, 256, 256, 256, 128]
    - [40, 19.65]
  - - [256, 4096, 1, 256, 256, 256, 256, 256]
    - [40, 33.9]
  - - [256, 4096, 1, 512, 256, 256, 256, 512]
    - [40, 53.08]
  - - [256, 4096, 1, 1024, 256, 256, 256, 1024]
    - [76, 74.92]
  - - [256, 4096, 1, 2048, 256, 256, 256, 2048]
    - [76, 95.04]
  - - [256, 4096, 1, 4096, 256, 256, 256, 4096]
    - [76, 110.53]
  - - [256, 4096, 1, 8192, 256, 256, 256, 8192]
    - [76, 121.33]
  - - [256, 8192, 1, 128, 256, 256, 256, 128]
    - [9, 27.1]
  - - [256, 8192, 1, 256, 256, 256, 256, 256]
    - [27, 46.64]
  - - [256, 8192, 1, 512, 256, 256, 256, 512]
    - [26, 69.36]
  - - [256, 8192, 1, 1024, 256, 256, 256, 1024]
    - [25, 96.57]
  - - [256, 8192, 1, 2048, 256, 256, 256, 2048]
    - [26, 120.76]
  - - [256, 8192, 1, 4096, 256, 256, 256, 4096]
    - [66, 142.98]
  - - [256, 8192, 1, 8192, 256, 256, 256, 8192]
    - [66, 161.84]
  - - [512, 128, 1, 128, 512, 512, 512, 128]
    - [65, 2.38]
  - - [512, 128, 1, 256, 512, 512, 512, 256]
    - [95, 4.37]
  - - [512, 128, 1, 512, 512, 512, 512, 512]
    - [95, 7.48]
  - - [512, 128, 1, 1024, 512, 512, 512, 1024]
    - [96, 11.45]
  - - [512, 128, 1, 2048, 512, 512, 512, 2048]
    - [96, 15.67]
  - - [512, 128, 1, 4096, 512, 512, 512, 4096]
    - [96, 19.35]
  - - [512, 128, 1, 8192, 512, 512, 512, 8192]
    - [97, 21.67]
  - - [512, 256, 1, 128, 512, 512, 512, 128]
    - [60, 4.45]
  - - [512, 256, 1, 256, 512, 512, 512, 256]
    - [91, 7.84]
  - - [512, 256, 1, 512, 512, 512, 512, 512]
    - [88, 13.22]
  - - [512, 256, 1, 1024, 512, 512, 512, 1024]
    - [88, 20.0]
  - - [512, 256, 1, 2048, 512, 512, 512, 2048]
    - [87, 27.01]
  - - [512, 256, 1, 4096, 512, 512, 512, 4096]
    - [87, 32.81]
  - - [512, 256, 1, 8192, 512, 512, 512, 8192]
    - [93, 32.64]
  - - [512, 512, 1, 128, 512, 512, 512, 128]
    - [83, 7.88]
  - - [512, 512, 1, 256, 512, 512, 512, 256]
    - [59, 14.0]
  - - [512, 512, 1, 512, 512, 512, 512, 512]
    - [84, 22.52]
  - - [512, 512, 1, 1024, 512, 512, 512, 1024]
    - [84, 33.42]
  - - [512, 512, 1, 2048, 512, 512, 512, 2048]
    - [101, 43.71]
  - - [512, 512, 1, 4096, 512, 512, 512, 4096]
    - [101, 53.3]
  - - [512, 512, 1, 8192, 512, 512, 512, 8192]
    - [85, 48.23]
  - - [512, 1024, 1, 128, 512, 512, 512, 128]
    - [54, 13.09]
  - - [512, 1024, 1, 256, 512, 512, 512, 256]
    - [54, 22.66]
  - - [512, 1024, 1, 512, 512, 512, 512, 512]
    - [47, 36.44]
  - - [512, 1024, 1, 1024, 512, 512, 512, 1024]
    - [47, 52.07]
  - - [512, 1024, 1, 2048, 512, 512, 512, 2048]
    - [47, 66.73]
  - - [512, 1024, 1, 4096, 512, 512, 512, 4096]
    - [99, 80.38]
  - - [512, 1024, 1, 8192, 512, 512, 512, 8192]
    - [55, 73.51]
  - - [512, 2048, 1, 128, 512, 512, 512, 128]
    - [39, 19.73]
  - - [512, 2048, 1, 256, 512, 512, 512, 256]
    - [39, 34.11]
  - - [512, 2048, 1, 512, 512, 512, 512, 512]
    - [39, 53.29]
  - - [512, 2048, 1, 1024, 512, 512, 512, 1024]
    - [76, 75.98]
  - - [512, 2048, 1, 2048, 512, 512, 512, 2048]
    - [76, 97.53]
  - - [512, 2048, 1, 4096, 512, 512, 512, 4096]
    - [76, 102.48]
  - - [512, 2048, 1, 8192, 512, 512, 512, 8192]
    - [78, 113.37]
  - - [512, 4096, 1, 128, 512, 512, 512, 128]
    - [9, 27.37]
  - - [512, 4096, 1, 256, 512, 512, 512, 256]
    - [9, 46.18]
  - - [512, 4096, 1, 512, 512, 512, 512, 512]
    - [32, 68.98]
  - - [512, 4096, 1, 1024, 512, 512, 512, 1024]
    - [26, 95.77]
  - - [512, 4096, 1, 2048, 512, 512, 512, 2048]
    - [29, 117.87]
  - - [512, 4096, 1, 4096, 512, 512, 512, 4096]
    - [68, 137.71]
  - - [512, 4096, 1, 8192, 512, 512, 512, 8192]
    - [34, 151.34]
  - - [512, 8192, 1, 128, 512, 512, 512, 128]
    - [6, 33.04]
  - - [512, 8192, 1, 256, 512, 512, 512, 256]
    - [6, 55.7]
  - - [512, 8192, 1, 512, 512, 512, 512, 512]
    - [23, 86.82]
  - - [512, 8192, 1, 1024, 512, 512, 512, 1024]
    - [23, 122.22]
  - - [512, 8192, 1, 2048, 512, 512, 512, 2048]
    - [23, 154.22]
  - - [512, 8192, 1, 4096, 512, 512, 512, 4096]
    - [23, 176.34]
  - - [512, 8192, 1, 8192, 512, 512, 512, 8192]
    - [23, 191.56]
  - - [1024, 128, 1, 128, 1024, 1024, 1024, 128]
    - [91, 4.44]
  - - [1024, 128, 1, 256, 1024, 1024, 1024, 256]
    - [91, 7.95]
  - - [1024, 128, 1, 512, 1024, 1024, 1024, 512]
    - [87, 13.13]
  - - [1024, 128, 1, 1024, 1024, 1024, 1024, 1024]
    - [87, 20.1]
  - - [1024, 128, 1, 2048, 1024, 1024, 1024, 2048]
    - [87, 27.13]
  - - [1024, 128, 1, 4096, 1024, 1024, 1024, 4096]
    - [90, 32.53]
  - - [1024, 128, 1, 8192, 1024, 1024, 1024, 8192]
    - [91, 32.17]
  - - [1024, 256, 1, 128, 1024, 1024, 1024, 128]
    - [82, 7.79]
  - - [1024, 256, 1, 256, 1024, 1024, 1024, 256]
    - [59, 13.39]
  - - [1024, 256, 1, 512, 1024, 1024, 1024, 512]
    - [84, 22.01]
  - - [1024, 256, 1, 1024, 1024, 1024, 1024, 1024]
    - [84, 32.61]
  - - [1024, 256, 1, 2048, 1024, 1024, 1024, 2048]
    - [84, 43.66]
  - - [1024, 256, 1, 4096, 1024, 1024, 1024, 4096]
    - [85, 47.38]
  - - [1024, 256, 1, 8192, 1024, 1024, 1024, 8192]
    - [58, 48.14]
  - - [1024, 512, 1, 128, 1024, 1024, 1024, 128]
    - [54, 13.17]
  - - [1024, 512, 1, 256, 1024, 1024, 1024, 256]
    - [54, 22.78]
  - - [1024, 512, 1, 512, 1024, 1024, 1024, 512]
    - [47, 35.79]
  - - [1024, 512, 1, 1024, 1024, 1024, 1024, 1024]
    - [47, 51.9]
  - - [1024, 512, 1, 2048, 1024, 1024, 1024, 2048]
    - [98, 66.5]
  - - [1024, 512, 1, 4096, 1024, 1024, 1024, 4096]
    - [50, 71.98]
  - - [1024, 512, 1, 8192, 1024, 1024, 1024, 8192]
    - [43, 76.99]
  - - [1024, 1024, 1, 128, 1024, 1024, 1024, 128]
    - [38, 19.94]
  - - [1024, 1024, 1, 256, 1024, 1024, 1024, 256]
    - [38, 34.62]
  - - [1024, 1024, 1, 512, 1024, 1024, 1024, 512]
    - [38, 54.01]
  - - [1024, 1024, 1, 1024, 1024, 1024, 1024, 1024]
    - [76, 76.07]
  - - [1024, 1024, 1, 2048, 1024, 1024, 1024, 2048]
    - [76, 94.45]
  - - [1024, 1024, 1, 4096, 1024, 1024, 1024, 4096]
    - [78, 104.6]
  - - [1024, 1024, 1, 8192, 1024, 1024, 1024, 8192]
    - [80, 114.4]
  - - [1024, 2048, 1, 128, 1024, 1024, 1024, 128]
    - [7, 27.41]
  - - [1024, 2048, 1, 256, 1024, 1024, 1024, 256]
    - [8, 46.46]
  - - [1024, 2048, 1, 512, 1024, 1024, 1024, 512]
    - [33, 69.76]
  - - [1024, 2048, 1, 1024, 1024, 1024, 1024, 1024]
    - [31, 101.01]
  - - [1024, 2048, 1, 2048, 1024, 1024, 1024, 2048]
    - [26, 119.96]
  - - [1024, 2048, 1, 4096, 1024, 1024, 1024, 4096]
    - [68, 137.95]
  - - [1024, 2048, 1, 8192, 1024, 1024, 1024, 8192]
    - [73, 151.88]
  - - [1024, 4096, 1, 128, 1024, 1024, 1024, 128]
    - [7, 31.7]
  - - [1024, 4096, 1, 256, 1024, 1024, 1024, 256]
    - [6, 53.31]
  - - [1024, 4096, 1, 512, 1024, 1024, 1024, 512]
    - [23, 83.85]
  - - [1024, 4096, 1, 1024, 1024, 1024, 1024, 1024]
    - [23, 119.31]
  - - [1024, 4096, 1, 2048, 1024, 1024, 1024, 2048]
    - [19, 151.75]
  - - [1024, 4096, 1, 4096, 1024, 1024, 1024, 4096]
    - [14, 175.87]
  - - [1024, 4096, 1, 8192, 1024, 1024, 1024, 8192]
    - [14, 191.33]
  - - [1024, 8192, 1, 128, 1024, 1024, 1024, 128]
    - [6, 34.61]
  - - [1024, 8192, 1, 256, 1024, 1024, 1024, 256]
    - [6, 58.09]
  - - [1024, 8192, 1, 512, 1024, 1024, 1024, 512]
    - [14, 90.17]
  - - [1024, 8192, 1, 1024, 1024, 1024, 1024, 1024]
    - [14, 126.51]
  - - [1024, 8192, 1, 2048, 1024, 1024, 1024, 2048]
    - [14, 157.5]
  - - [1024, 8192, 1, 4096, 1024, 1024, 1024, 4096]
    - [14, 180.0]
  - - [1024, 8192, 1, 8192, 1024, 1024, 1024, 8192]
    - [19, 193.82]
  - - [2048, 128, 1, 128, 2048, 2048, 2048, 128]
    - [56, 7.86]
  - - [2048, 128, 1, 256, 2048, 2048, 2048, 256]
    - [56, 13.61]
  - - [2048, 128, 1, 512, 2048, 2048, 2048, 512]
    - [84, 22.36]
  - - [2048, 128, 1, 1024, 2048, 2048, 2048, 1024]
    - [84, 33.19]
  - - [2048, 128, 1, 2048, 2048, 2048, 2048, 2048]
    - [59, 38.15]
  - - [2048, 128, 1, 4096, 2048, 2048, 2048, 4096]
    - [58, 44.16]
  - - [2048, 128, 1, 8192, 2048, 2048, 2048, 8192]
    - [57, 48.0]
  - - [2048, 256, 1, 128, 2048, 2048, 2048, 128]
    - [54, 13.17]
  - - [2048, 256, 1, 256, 2048, 2048, 2048, 256]
    - [54, 22.51]
  - - [2048, 256, 1, 512, 2048, 2048, 2048, 512]
    - [47, 36.05]
  - - [2048, 256, 1, 1024, 2048, 2048, 2048, 1024]
    - [47, 51.86]
  - - [2048, 256, 1, 2048, 2048, 2048, 2048, 2048]
    - [45, 62.78]
  - - [2048, 256, 1, 4096, 2048, 2048, 2048, 4096]
    - [51, 72.58]
  - - [2048, 256, 1, 8192, 2048, 2048, 2048, 8192]
    - [45, 80.62]
  - - [2048, 512, 1, 128, 2048, 2048, 2048, 128]
    - [39, 19.72]
  - - [2048, 512, 1, 256, 2048, 2048, 2048, 256]
    - [38, 33.89]
  - - [2048, 512, 1, 512, 2048, 2048, 2048, 512]
    - [38, 53.34]
  - - [2048, 512, 1, 1024, 2048, 2048, 2048, 1024]
    - [38, 74.19]
  - - [2048, 512, 1, 2048, 2048, 2048, 2048, 2048]
    - [37, 90.4]
  - - [2048, 512, 1, 4096, 2048, 2048, 2048, 4096]
    - [79, 104.68]
  - - [2048, 512, 1, 8192, 2048, 2048, 2048, 8192]
    - [77, 114.69]
  - - [2048, 1024, 1, 128, 2048, 2048, 2048, 128]
    - [10, 27.61]
  - - [2048, 1024, 1, 256, 2048, 2048, 2048, 256]
    - [10, 46.3]
  - - [2048, 1024, 1, 512, 2048, 2048, 2048, 512]
    - [28, 70.93]
  - - [2048, 1024, 1, 1024, 2048, 2048, 2048, 1024]
    - [30, 100.56]
  - - [2048, 1024, 1, 2048, 2048, 2048, 2048, 2048]
    - [30, 120.99]
  - - [2048, 1024, 1, 4096, 2048, 2048, 2048, 4096]
    - [67, 140.02]
  - - [2048, 1024, 1, 8192, 2048, 2048, 2048, 8192]
    - [70, 152.3]
  - - [2048, 2048, 1, 128, 2048, 2048, 2048, 128]
    - [5, 31.83]
  - - [2048, 2048, 1, 256, 2048, 2048, 2048, 256]
    - [22, 54.09]
  - - [2048, 2048, 1, 512, 2048, 2048, 2048, 512]
    - [22, 85.26]
  - - [2048, 2048, 1, 1024, 2048, 2048, 2048, 1024]
    - [13, 120.06]
  - - [2048, 2048, 1, 2048, 2048, 2048, 2048, 2048]
    - [13, 152.54]
  - - [2048, 2048, 1, 4096, 2048, 2048, 2048, 4096]
    - [13, 176.32]
  - - [2048, 2048, 1, 8192, 2048, 2048, 2048, 8192]
    - [13, 191.49]
  - - [2048, 4096, 1, 128, 2048, 2048, 2048, 128]
    - [5, 35.0]
  - - [2048, 4096, 1, 256, 2048, 2048, 2048, 256]
    - [22, 60.77]
  - - [2048, 4096, 1, 512, 2048, 2048, 2048, 512]
    - [22, 93.73]
  - - [2048, 4096, 1, 1024, 2048, 2048, 2048, 1024]
    - [22, 128.7]
  - - [2048, 4096, 1, 2048, 2048, 2048, 2048, 2048]
    - [13, 158.33]
  - - [2048, 4096, 1, 4096, 2048, 2048, 2048, 4096]
    - [13, 180.0]
  - - [2048, 4096, 1, 8192, 2048, 2048, 2048, 8192]
    - [13, 194.04]
  - - [2048, 8192, 1, 128, 2048, 2048, 2048, 128]
    - [1, 37.85]
  - - [2048, 8192, 1, 256, 2048, 2048, 2048, 256]
    - [22, 65.3]
  - - [2048, 8192, 1, 512, 2048, 2048, 2048, 512]
    - [22, 99.1]
  - - [2048, 8192, 1, 1024, 2048, 2048, 2048, 1024]
    - [22, 132.89]
  - - [2048, 8192, 1, 2048, 2048, 2048, 2048, 2048]
    - [13, 161.72]
  - - [2048, 8192, 1, 4096, 2048, 2048, 2048, 4096]
    - [13, 182.74]
  - - [2048, 8192, 1, 8192, 2048, 2048, 2048, 8192]
    - [12, 195.61]
  - - [4096, 128, 1, 128, 4096, 4096, 4096, 128]
    - [46, 12.99]
  - - [4096, 128, 1, 256, 4096, 4096, 4096, 256]
    - [49, 22.68]
  - - [4096, 128, 1, 512, 4096, 4096, 4096, 512]
    - [47, 36.3]
  - - [4096, 128, 1, 1024, 4096, 4096, 4096, 1024]
    - [45, 48.75]
  - - [4096, 128, 1, 2048, 4096, 4096, 4096, 2048]
    - [45, 63.3]
  - - [4096, 128, 1, 4096, 4096, 4096, 4096, 4096]
    - [43, 73.08]
  - - [4096, 128, 1, 8192, 4096, 4096, 4096, 8192]
    - [44, 80.36]
  - - [4096, 256, 1, 128, 4096, 4096, 4096, 128]
    - [38, 19.83]
  - - [4096, 256, 1, 256, 4096, 4096, 4096, 256]
    - [38, 34.18]
  - - [4096, 256, 1, 512, 4096, 4096, 4096, 512]
    - [38, 53.28]
  - - [4096, 256, 1, 1024, 4096, 4096, 4096, 1024]
    - [74, 73.63]
  - - [4096, 256, 1, 2048, 4096, 4096, 4096, 2048]
    - [41, 90.42]
  - - [4096, 256, 1, 4096, 4096, 4096, 4096, 4096]
    - [42, 103.48]
  - - [4096, 256, 1, 8192, 4096, 4096, 4096, 8192]
    - [79, 113.36]
  - - [4096, 512, 1, 128, 4096, 4096, 4096, 128]
    - [9, 27.5]
  - - [4096, 512, 1, 256, 4096, 4096, 4096, 256]
    - [9, 46.36]
  - - [4096, 512, 1, 512, 4096, 4096, 4096, 512]
    - [35, 68.9]
  - - [4096, 512, 1, 1024, 4096, 4096, 4096, 1024]
    - [26, 96.0]
  - - [4096, 512, 1, 2048, 4096, 4096, 4096, 2048]
    - [26, 119.2]
  - - [4096, 512, 1, 4096, 4096, 4096, 4096, 4096]
    - [72, 138.09]
  - - [4096, 512, 1, 8192, 4096, 4096, 4096, 8192]
    - [71, 152.27]
  - - [4096, 1024, 1, 128, 4096, 4096, 4096, 128]
    - [2, 31.79]
  - - [4096, 1024, 1, 256, 4096, 4096, 4096, 256]
    - [2, 53.53]
  - - [4096, 1024, 1, 512, 4096, 4096, 4096, 512]
    - [22, 83.43]
  - - [4096, 1024, 1, 1024, 4096, 4096, 4096, 1024]
    - [18, 119.02]
  - - [4096, 1024, 1, 2048, 4096, 4096, 4096, 2048]
    - [18, 151.56]
  - - [4096, 1024, 1, 4096, 4096, 4096, 4096, 4096]
    - [14, 175.83]
  - - [4096, 1024, 1, 8192, 4096, 4096, 4096, 8192]
    - [18, 190.91]
  - - [4096, 2048, 1, 128, 4096, 4096, 4096, 128]
    - [2, 34.82]
  - - [4096, 2048, 1, 256, 4096, 4096, 4096, 256]
    - [2, 58.48]
  - - [4096, 2048, 1, 512, 4096, 4096, 4096, 512]
    - [14, 90.17]
  - - [4096, 2048, 1, 1024, 4096, 4096, 4096, 1024]
    - [14, 126.27]
  - - [4096, 2048, 1, 2048, 4096, 4096, 4096, 2048]
    - [14, 157.51]
  - - [4096, 2048, 1, 4096, 4096, 4096, 4096, 4096]
    - [14, 179.89]
  - - [4096, 2048, 1, 8192, 4096, 4096, 4096, 8192]
    - [17, 193.65]
  - - [4096, 4096, 1, 128, 4096, 4096, 4096, 128]
    - [2, 37.61]
  - - [4096, 4096, 1, 256, 4096, 4096, 4096, 256]
    - [2, 62.23]
  - - [4096, 4096, 1, 512, 4096, 4096, 4096, 512]
    - [14, 95.09]
  - - [4096, 4096, 1, 1024, 4096, 4096, 4096, 1024]
    - [14, 131.23]
  - - [4096, 4096, 1, 2048, 4096, 4096, 4096, 2048]
    - [14, 161.35]
  - - [4096, 4096, 1, 4096, 4096, 4096, 4096, 4096]
    - [14, 182.5]
  - - [4096, 4096, 1, 8192, 4096, 4096, 4096, 8192]
    - [17, 195.11]
  - - [4096, 8192, 1, 128, 4096, 4096, 4096, 128]
    - [4, 39.49]
  - - [4096, 8192, 1, 256, 4096, 4096, 4096, 256]
    - [15, 65.34]
  - - [4096, 8192, 1, 512, 4096, 4096, 4096, 512]
    - [11, 98.97]
  - - [4096, 8192, 1, 1024, 4096, 4096, 4096, 1024]
    - [16, 133.93]
  - - [4096, 8192, 1, 2048, 4096, 4096, 4096, 2048]
    - [16, 159.41]
  - - [4096, 8192, 1, 4096, 4096, 4096, 4096, 4096]
    - [16, 180.69]
  - - [4096, 8192, 1, 8192, 4096, 4096, 4096, 8192]
    - [21, 191.31]
  - - [8192, 128, 1, 128, 8192, 8192, 8192, 128]
    - [40, 19.61]
  - - [8192, 128, 1, 256, 8192, 8192, 8192, 256]
    - [40, 33.82]
  - - [8192, 128, 1, 512, 8192, 8192, 8192, 512]
    - [40, 52.68]
  - - [8192, 128, 1, 1024, 8192, 8192, 8192, 1024]
    - [40, 72.14]
  - - [8192, 128, 1, 2048, 8192, 8192, 8192, 2048]
    - [40, 89.7]
  - - [8192, 128, 1, 4096, 8192, 8192, 8192, 4096]
    - [74, 103.29]
  - - [8192, 128, 1, 8192, 8192, 8192, 8192, 8192]
    - [75, 111.06]
  - - [8192, 256, 1, 128, 8192, 8192, 8192, 128]
    - [9, 27.21]
  - - [8192, 256, 1, 256, 8192, 8192, 8192, 256]
    - [9, 46.3]
  - - [8192, 256, 1, 512, 8192, 8192, 8192, 512]
    - [26, 69.05]
  - - [8192, 256, 1, 1024, 8192, 8192, 8192, 1024]
    - [26, 96.78]
  - - [8192, 256, 1, 2048, 8192, 8192, 8192, 2048]
    - [26, 120.46]
  - - [8192, 256, 1, 4096, 8192, 8192, 8192, 4096]
    - [36, 137.47]
  - - [8192, 256, 1, 8192, 8192, 8192, 8192, 8192]
    - [69, 151.44]
  - - [8192, 512, 1, 128, 8192, 8192, 8192, 128]
    - [9, 31.74]
  - - [8192, 512, 1, 256, 8192, 8192, 8192, 256]
    - [6, 53.69]
  - - [8192, 512, 1, 512, 8192, 8192, 8192, 512]
    - [23, 83.42]
  - - [8192, 512, 1, 1024, 8192, 8192, 8192, 1024]
    - [19, 118.83]
  - - [8192, 512, 1, 2048, 8192, 8192, 8192, 2048]
    - [23, 151.66]
  - - [8192, 512, 1, 4096, 8192, 8192, 8192, 4096]
    - [13, 175.92]
  - - [8192, 512, 1, 8192, 8192, 8192, 8192, 8192]
    - [18, 190.84]
  - - [8192, 1024, 1, 128, 8192, 8192, 8192, 128]
    - [1, 34.27]
  - - [8192, 1024, 1, 256, 8192, 8192, 8192, 256]
    - [1, 57.43]
  - - [8192, 1024, 1, 512, 8192, 8192, 8192, 512]
    - [24, 89.48]
  - - [8192, 1024, 1, 1024, 8192, 8192, 8192, 1024]
    - [13, 125.52]
  - - [8192, 1024, 1, 2048, 8192, 8192, 8192, 2048]
    - [13, 157.21]
  - - [8192, 1024, 1, 4096, 8192, 8192, 8192, 4096]
    - [13, 179.16]
  - - [8192, 1024, 1, 8192, 8192, 8192, 8192, 8192]
    - [13, 193.29]
  - - [8192, 2048, 1, 128, 8192, 8192, 8192, 128]
    - [3, 37.06]
  - - [8192, 2048, 1, 256, 8192, 8192, 8192, 256]
    - [22, 62.34]
  - - [8192, 2048, 1, 512, 8192, 8192, 8192, 512]
    - [16, 95.16]
  - - [8192, 2048, 1, 1024, 8192, 8192, 8192, 1024]
    - [16, 131.07]
  - - [8192, 2048, 1, 2048, 8192, 8192, 8192, 2048]
    - [16, 161.65]
  - - [8192, 2048, 1, 4096, 8192, 8192, 8192, 4096]
    - [13, 182.17]
  - - [8192, 2048, 1, 8192, 8192, 8192, 8192, 8192]
    - [13, 195.08]
  - - [8192, 4096, 1, 128, 8192, 8192, 8192, 128]
    - [0, 40.61]
  - - [8192, 4096, 1, 256, 8192, 8192, 8192, 256]
    - [15, 66.77]
  - - [8192, 4096, 1, 512, 8192, 8192, 8192, 512]
    - [11, 99.21]
  - - [8192, 4096, 1, 1024, 8192, 8192, 8192, 1024]
    - [11, 134.49]
  - - [8192, 4096, 1, 2048, 8192, 8192, 8192, 2048]
    - [11, 159.65]
  - - [8192, 4096, 1, 4096, 8192, 8192, 8192, 4096]
    - [11, 180.61]
  - - [8192, 4096, 1, 8192, 8192, 8192, 8192, 8192]
    - [17, 193.68]
  - - [8192, 8192, 1, 128, 8192, 8192, 8192, 128]
    - [0, 35.53]
  - - [8192, 8192, 1, 256, 8192, 8192, 8192, 256]
    - [15, 60.63]
  - - [8192, 8192, 1, 512, 8192, 8192, 8192, 512]
    - [11, 93.53]
  - - [8192, 8192, 1, 1024, 8192, 8192, 8192, 1024]
    - [11, 130.76]
  - - [8192, 8192, 1, 2048, 8192, 8192, 8192, 2048]
    - [16, 159.54]
  - - [8192, 8192, 1, 4096, 8192, 8192, 8192, 4096]
    - [20, 180.02]
  - - [8192, 8192, 1, 8192, 8192, 8192, 8192, 8192]
    - [21, 193.23]
  - - [1, 1, 1, 32, 1, 1, 1, 32]
    - [105, 0.0]
- null
- null
- ExperimentalStreamK
- GridBased
