projects/hipblaslt/library/src/amd_detail/rocblaslt/src/Tensile/Logic/asm_full/aquavanjaram/gfx942_64cu/StreamK/aquavanjaram942_Cijk_Alik_Bljk_I8II_BH_UserArgs.yaml
- {MinimumRequiredVersion: 4.33.0}
- aquavanjaram942
- {Architecture: gfx942, CUCount: 64}
- [Device 0049, Device 0050]
    SolutionIndex: 0
    SolutionNameMin: Cijk_Alik_Bljk_I8II_BH_UserArgs_MT256x256x32_MI16x16x1_SN_CLR0_GSU0_GSUC0_GSUWGMRR0_K1_LBSPPA128_LBSPPB128_MIWT8_8_PLR0_SU0_SUM0_SUS32_SKXCCM8_VWA4_VWB1_WGM1_WGMXCC1_WGMXCCGn1
    SolutionIndex: 1
    SolutionNameMin: Cijk_Alik_Bljk_I8II_BH_UserArgs_MT256x256x32_MI16x16x1_SN_CLR0_GSU0_GSUC0_GSUWGMRR0_K1_LBSPPA128_LBSPPB128_MIWT8_8_PLR0_SU0_SUM0_SUS32_SKXCCM8_VWA4_VWB4_WGM1_WGMXCC1_WGMXCCGn1
    SolutionIndex: 2
    SolutionNameMin: Cijk_Alik_Bljk_I8II_BH_UserArgs_MT256x256x32_MI16x16x1_SN_CLR0_GSU0_GSUC0_GSUWGMRR0_K1_LBSPPA128_LBSPPB256_MIWT8_8_PLR0_SU0_SUM0_SUS32_SKXCCM8_VWA4_VWB8_WGM1_WGMXCC1_WGMXCCGn1
    SolutionIndex: 3
    SolutionNameMin: Cijk_Alik_Bljk_I8II_BH_UserArgs_MT256x256x32_MI16x16x1_SN_CLR0_GSU0_GSUC0_GSUWGMRR0_K1_LBSPPA128_LBSPPB128_MIWT8_8_PLR0_SU0_SUM0_SUS32_SKXCCM8_VWA4_VWB1_WGM1_WGMXCC1_WGMXCCGn1
    SolutionIndex: 4
    SolutionNameMin: Cijk_Alik_Bljk_I8II_BH_UserArgs_MT256x256x32_MI16x16x1_SN_CLR0_GSU0_GSUC0_GSUWGMRR0_K1_LBSPPA128_LBSPPB128_MIWT8_8_PLR0_SU0_SUM0_SUS32_SKXCCM8_VWA4_VWB1_WGM4_WGMXCC1_WGMXCCGn1
    SolutionIndex: 5
    SolutionNameMin: Cijk_Alik_Bljk_I8II_BH_UserArgs_MT256x256x32_MI16x16x1_SN_CLR0_GSU0_GSUC0_GSUWGMRR0_K1_LBSPPA128_LBSPPB256_MIWT8_8_PLR0_SU0_SUM0_SUS32_SKXCCM8_VWA4_VWB8_WGM8_WGMXCC1_WGMXCCGn1
    SolutionIndex: 6
    SolutionNameMin: Cijk_Alik_Bljk_I8II_BH_UserArgs_MT256x256x32_MI16x16x1_SN_CLR0_GSU0_GSUC0_GSUWGMRR0_K1_LBSPPA128_LBSPPB128_MIWT8_8_PLR0_SU0_SUM0_SUS32_SKXCCM8_VWA4_VWB4_WGM8_WGMXCC1_WGMXCCGn1
    SolutionIndex: 7
    SolutionNameMin: Cijk_Alik_Bljk_I8II_BH_UserArgs_MT128x256x32_MI16x16x1_SN_CLR0_GSU0_GSUC0_GSUWGMRR0_K1_LBSPPA128_LBSPPB128_MIWT4_8_PLR0_SU0_SUM0_SUS32_SKXCCM8_VWA4_VWB1_WGM1_WGMXCC1_WGMXCCGn1
    SolutionIndex: 8
    SolutionNameMin: Cijk_Alik_Bljk_I8II_BH_UserArgs_MT128x256x32_MI16x16x1_SN_CLR0_GSU0_GSUC0_GSUWGMRR0_K1_LBSPPA128_LBSPPB256_MIWT4_8_PLR0_SU0_SUM0_SUS32_SKXCCM8_VWA4_VWB8_WGM1_WGMXCC1_WGMXCCGn1
    SolutionIndex: 9
    SolutionNameMin: Cijk_Alik_Bljk_I8II_BH_UserArgs_MT128x256x32_MI16x16x1_SN_CLR0_GSU0_GSUC0_GSUWGMRR0_K1_LBSPPA128_LBSPPB256_MIWT4_8_PLR0_SU0_SUM0_SUS32_SKXCCM8_VWA4_VWB8_WGM1_WGMXCC1_WGMXCCGn1
    SolutionIndex: 10
    SolutionNameMin: Cijk_Alik_Bljk_I8II_BH_UserArgs_MT256x128x32_MI16x16x1_SN_CLR0_GSU0_GSUC0_GSUWGMRR0_K1_LBSPPA128_LBSPPB128_MIWT8_4_PLR0_SU0_SUM0_SUS32_SKXCCM8_VWA4_VWB2_WGM1_WGMXCC1_WGMXCCGn1
    SolutionIndex: 11
    SolutionNameMin: Cijk_Alik_Bljk_I8II_BH_UserArgs_MT256x128x32_MI16x16x1_SN_CLR0_GSU0_GSUC0_GSUWGMRR0_K1_LBSPPA128_LBSPPB128_MIWT8_4_PLR0_SU0_SUM0_SUS32_SKXCCM8_VWA4_VWB4_WGM1_WGMXCC1_WGMXCCGn1
    SolutionIndex: 12
    SolutionNameMin: Cijk_Alik_Bljk_I8II_BH_UserArgs_MT256x128x32_MI16x16x1_SN_CLR0_GSU0_GSUC0_GSUWGMRR0_K1_LBSPPA128_LBSPPB128_MIWT8_4_PLR0_SU0_SUM0_SUS32_SKXCCM8_VWA4_VWB4_WGM4_WGMXCC1_WGMXCCGn1
    SolutionIndex: 13
    SolutionNameMin: Cijk_Alik_Bljk_I8II_BH_UserArgs_MT128x128x32_MI16x16x1_SN_CLR0_GSU0_GSUC0_GSUWGMRR0_K1_LBSPPA128_LBSPPB128_MIWT4_4_PLR0_SU0_SUM0_SUS32_SKXCCM8_VWA1_VWB2_WGM1_WGMXCC1_WGMXCCGn1
    SolutionIndex: 14
    SolutionNameMin: Cijk_Alik_Bljk_I8II_BH_UserArgs_MT128x32x32_MI16x16x1_SN_CLR0_GSU0_GSUC0_GSUWGMRR0_K1_LBSPPA128_LBSPPB128_MIWT4_1_PLR0_SU0_SUM0_SUS32_SKXCCM8_VWA4_VWB1_WGM1_WGMXCC1_WGMXCCGn1
    SolutionIndex: 15
    SolutionNameMin: Cijk_Alik_Bljk_I8II_BH_UserArgs_MT256x256x64_MI16x16x1_SN_CLR1_GSU0_GSUC0_GSUWGMRR0_K1_LBSPPA256_LBSPPB128_MIWT8_8_PLR1_SU0_SUM0_SUS64_SKXCCM8_VWA4_VWB1_WGM1_WGMXCC1_WGMXCCGn1
    SolutionIndex: 16
    SolutionNameMin: Cijk_Alik_Bljk_I8II_BH_UserArgs_MT256x256x64_MI16x16x1_SN_CLR1_GSU0_GSUC0_GSUWGMRR0_K1_LBSPPA256_LBSPPB256_MIWT8_8_PLR1_SU0_SUM0_SUS64_SKXCCM8_VWA4_VWB4_WGM1_WGMXCC1_WGMXCCGn1
    SolutionIndex: 17
    SolutionNameMin: Cijk_Alik_Bljk_I8II_BH_UserArgs_MT256x256x64_MI16x16x1_SN_CLR1_GSU0_GSUC0_GSUWGMRR0_K1_LBSPPA256_LBSPPB512_MIWT8_8_PLR1_SU0_SUM0_SUS64_SKXCCM8_VWA4_VWB8_WGM1_WGMXCC1_WGMXCCGn1
    SolutionIndex: 18
    SolutionNameMin: Cijk_Alik_Bljk_I8II_BH_UserArgs_MT256x256x64_MI16x16x1_SN_CLR1_GSU0_GSUC0_GSUWGMRR0_K1_LBSPPA256_LBSPPB128_MIWT8_8_PLR1_SU0_SUM0_SUS64_SKXCCM8_VWA4_VWB1_WGM1_WGMXCC1_WGMXCCGn1
    SolutionIndex: 19
    SolutionNameMin: Cijk_Alik_Bljk_I8II_BH_UserArgs_MT256x256x64_MI16x16x1_SN_CLR1_GSU0_GSUC0_GSUWGMRR0_K1_LBSPPA256_LBSPPB256_MIWT8_8_PLR1_SU0_SUM0_SUS64_SKXCCM8_VWA4_VWB4_WGM1_WGMXCC1_WGMXCCGn1
    SolutionIndex: 20
    SolutionNameMin: Cijk_Alik_Bljk_I8II_BH_UserArgs_MT256x256x64_MI16x16x1_SN_CLR1_GSU0_GSUC0_GSUWGMRR0_K1_LBSPPA256_LBSPPB512_MIWT8_8_PLR1_SU0_SUM0_SUS64_SKXCCM8_VWA4_VWB8_WGM1_WGMXCC1_WGMXCCGn1
    SolutionIndex: 21
    SolutionNameMin: Cijk_Alik_Bljk_I8II_BH_UserArgs_MT256x256x64_MI16x16x1_SN_CLR1_GSU0_GSUC0_GSUWGMRR0_K1_LBSPPA256_LBSPPB128_MIWT8_8_PLR1_SU0_SUM0_SUS64_SKXCCM8_VWA4_VWB1_WGM4_WGMXCC1_WGMXCCGn1
    SolutionIndex: 22
    SolutionNameMin: Cijk_Alik_Bljk_I8II_BH_UserArgs_MT256x256x64_MI16x16x1_SN_CLR1_GSU0_GSUC0_GSUWGMRR0_K1_LBSPPA256_LBSPPB128_MIWT8_8_PLR1_SU0_SUM0_SUS64_SKXCCM8_VWA4_VWB2_WGM4_WGMXCC1_WGMXCCGn1
    SolutionIndex: 23
    SolutionNameMin: Cijk_Alik_Bljk_I8II_BH_UserArgs_MT256x256x64_MI16x16x1_SN_CLR1_GSU0_GSUC0_GSUWGMRR0_K1_LBSPPA128_LBSPPB256_MIWT8_8_PLR1_SU0_SUM0_SUS64_SKXCCM8_VWA1_VWB4_WGM4_WGMXCC1_WGMXCCGn1
    SolutionIndex: 24
    SolutionNameMin: Cijk_Alik_Bljk_I8II_BH_UserArgs_MT256x256x64_MI16x16x1_SN_CLR1_GSU0_GSUC0_GSUWGMRR0_K1_LBSPPA256_LBSPPB256_MIWT8_8_PLR1_SU0_SUM0_SUS64_SKXCCM8_VWA4_VWB4_WGM4_WGMXCC1_WGMXCCGn1
    SolutionIndex: 25
    SolutionNameMin: Cijk_Alik_Bljk_I8II_BH_UserArgs_MT256x256x64_MI16x16x1_SN_CLR1_GSU0_GSUC0_GSUWGMRR0_K1_LBSPPA256_LBSPPB512_MIWT8_8_PLR1_SU0_SUM0_SUS64_SKXCCM8_VWA4_VWB8_WGM4_WGMXCC1_WGMXCCGn1
    SolutionIndex: 26
    SolutionNameMin: Cijk_Alik_Bljk_I8II_BH_UserArgs_MT256x256x64_MI16x16x1_SN_CLR1_GSU0_GSUC0_GSUWGMRR0_K1_LBSPPA256_LBSPPB128_MIWT8_8_PLR1_SU0_SUM0_SUS64_SKXCCM8_VWA4_VWB1_WGM4_WGMXCC1_WGMXCCGn1
    SolutionIndex: 27
    SolutionNameMin: Cijk_Alik_Bljk_I8II_BH_UserArgs_MT256x256x64_MI16x16x1_SN_CLR1_GSU0_GSUC0_GSUWGMRR0_K1_LBSPPA256_LBSPPB128_MIWT8_8_PLR1_SU0_SUM0_SUS64_SKXCCM8_VWA4_VWB2_WGM4_WGMXCC1_WGMXCCGn1
    SolutionIndex: 28
    SolutionNameMin: Cijk_Alik_Bljk_I8II_BH_UserArgs_MT256x256x64_MI16x16x1_SN_CLR1_GSU0_GSUC0_GSUWGMRR0_K1_LBSPPA256_LBSPPB256_MIWT8_8_PLR1_SU0_SUM0_SUS64_SKXCCM8_VWA4_VWB4_WGM4_WGMXCC1_WGMXCCGn1
    SolutionIndex: 29
    SolutionNameMin: Cijk_Alik_Bljk_I8II_BH_UserArgs_MT256x256x64_MI16x16x1_SN_CLR1_GSU0_GSUC0_GSUWGMRR0_K1_LBSPPA256_LBSPPB512_MIWT8_8_PLR1_SU0_SUM0_SUS64_SKXCCM8_VWA4_VWB8_WGM4_WGMXCC1_WGMXCCGn1
    SolutionIndex: 30
    SolutionNameMin: Cijk_Alik_Bljk_I8II_BH_UserArgs_MT256x256x64_MI16x16x1_SN_CLR1_GSU0_GSUC0_GSUWGMRR0_K1_LBSPPA256_LBSPPB256_MIWT8_8_PLR1_SU0_SUM0_SUS64_SKXCCM8_VWA4_VWB4_WGM8_WGMXCC1_WGMXCCGn1
    SolutionIndex: 31
    SolutionNameMin: Cijk_Alik_Bljk_I8II_BH_UserArgs_MT256x256x64_MI16x16x1_SN_CLR1_GSU0_GSUC0_GSUWGMRR0_K1_LBSPPA128_LBSPPB512_MIWT8_8_PLR1_SU0_SUM0_SUS64_SKXCCM8_VWA1_VWB8_WGM8_WGMXCC1_WGMXCCGn1
    SolutionIndex: 32
    SolutionNameMin: Cijk_Alik_Bljk_I8II_BH_UserArgs_MT256x256x64_MI16x16x1_SN_CLR1_GSU0_GSUC0_GSUWGMRR0_K1_LBSPPA256_LBSPPB512_MIWT8_8_PLR1_SU0_SUM0_SUS64_SKXCCM8_VWA4_VWB8_WGM8_WGMXCC1_WGMXCCGn1
    SolutionIndex: 33
    SolutionNameMin: Cijk_Alik_Bljk_I8II_BH_UserArgs_MT256x256x64_MI16x16x1_SN_CLR1_GSU0_GSUC0_GSUWGMRR0_K1_LBSPPA256_LBSPPB128_MIWT8_8_PLR1_SU0_SUM0_SUS64_SKXCCM8_VWA4_VWB1_WGM8_WGMXCC1_WGMXCCGn1
    SolutionIndex: 34
    SolutionNameMin: Cijk_Alik_Bljk_I8II_BH_UserArgs_MT256x256x64_MI16x16x1_SN_CLR1_GSU0_GSUC0_GSUWGMRR0_K1_LBSPPA256_LBSPPB256_MIWT8_8_PLR1_SU0_SUM0_SUS64_SKXCCM8_VWA4_VWB4_WGM8_WGMXCC1_WGMXCCGn1
    SolutionIndex: 35
    SolutionNameMin: Cijk_Alik_Bljk_I8II_BH_UserArgs_MT256x256x64_MI16x16x1_SN_CLR1_GSU0_GSUC0_GSUWGMRR0_K1_LBSPPA128_LBSPPB512_MIWT8_8_PLR1_SU0_SUM0_SUS64_SKXCCM8_VWA1_VWB8_WGM8_WGMXCC1_WGMXCCGn1
    SolutionIndex: 36
    SolutionNameMin: Cijk_Alik_Bljk_I8II_BH_UserArgs_MT256x256x64_MI16x16x1_SN_CLR1_GSU0_GSUC0_GSUWGMRR0_K1_LBSPPA256_LBSPPB512_MIWT8_8_PLR1_SU0_SUM0_SUS64_SKXCCM8_VWA4_VWB8_WGM8_WGMXCC1_WGMXCCGn1
    SolutionIndex: 37
    SolutionNameMin: Cijk_Alik_Bljk_I8II_BH_UserArgs_MT256x256x64_MI16x16x1_SN_CLR1_GSU0_GSUC0_GSUWGMRR0_K1_LBSPPA256_LBSPPB512_MIWT8_8_PLR1_SU0_SUM0_SUS64_SKXCCM8_VWA4_VWB8_WGM8_WGMXCC1_WGMXCCGn1
    SolutionIndex: 38
    SolutionNameMin: Cijk_Alik_Bljk_I8II_BH_UserArgs_MT256x128x64_MI16x16x1_SN_CLR1_GSU0_GSUC0_GSUWGMRR0_K1_LBSPPA256_LBSPPB128_MIWT8_4_PLR1_SU0_SUM0_SUS64_SKXCCM8_VWA4_VWB1_WGM1_WGMXCC1_WGMXCCGn1
    SolutionIndex: 39
    SolutionNameMin: Cijk_Alik_Bljk_I8II_BH_UserArgs_MT256x128x64_MI16x16x1_SN_CLR1_GSU0_GSUC0_GSUWGMRR0_K1_LBSPPA256_LBSPPB128_MIWT8_4_PLR1_SU0_SUM0_SUS64_SKXCCM8_VWA4_VWB2_WGM1_WGMXCC1_WGMXCCGn1
    SolutionIndex: 40
    SolutionNameMin: Cijk_Alik_Bljk_I8II_BH_UserArgs_MT256x128x64_MI16x16x1_SN_CLR1_GSU0_GSUC0_GSUWGMRR0_K1_LBSPPA256_LBSPPB256_MIWT8_4_PLR1_SU0_SUM0_SUS64_SKXCCM8_VWA4_VWB4_WGM1_WGMXCC1_WGMXCCGn1
    SolutionIndex: 41
    SolutionNameMin: Cijk_Alik_Bljk_I8II_BH_UserArgs_MT256x128x64_MI16x16x1_SN_CLR1_GSU0_GSUC0_GSUWGMRR0_K1_LBSPPA256_LBSPPB256_MIWT8_4_PLR1_SU0_SUM0_SUS64_SKXCCM8_VWA4_VWB4_WGM1_WGMXCC1_WGMXCCGn1
    SolutionIndex: 42
    SolutionNameMin: Cijk_Alik_Bljk_I8II_BH_UserArgs_MT256x128x64_MI16x16x1_SN_CLR1_GSU0_GSUC0_GSUWGMRR0_K1_LBSPPA256_LBSPPB256_MIWT8_4_PLR1_SU0_SUM0_SUS64_SKXCCM8_VWA4_VWB4_WGM4_WGMXCC1_WGMXCCGn1
    SolutionIndex: 43
    SolutionNameMin: Cijk_Alik_Bljk_I8II_BH_UserArgs_MT256x128x64_MI16x16x1_SN_CLR1_GSU0_GSUC0_GSUWGMRR0_K1_LBSPPA256_LBSPPB256_MIWT8_4_PLR1_SU0_SUM0_SUS64_SKXCCM8_VWA4_VWB4_WGM8_WGMXCC1_WGMXCCGn1
    SolutionIndex: 44
    SolutionNameMin: Cijk_Alik_Bljk_I8II_BH_UserArgs_MT256x64x64_MI16x16x1_SN_CLR1_GSU0_GSUC0_GSUWGMRR0_K1_LBSPPA256_LBSPPB128_MIWT8_2_PLR1_SU0_SUM0_SUS64_SKXCCM8_VWA4_VWB2_WGM1_WGMXCC1_WGMXCCGn1
    SolutionIndex: 45
    SolutionNameMin: Cijk_Alik_Bljk_I8II_BH_UserArgs_MT128x128x64_MI16x16x1_SN_CLR1_GSU0_GSUC0_GSUWGMRR0_K1_LBSPPA128_LBSPPB128_MIWT4_4_PLR1_SU0_SUM0_SUS64_SKXCCM8_VWA1_VWB1_WGM1_WGMXCC1_WGMXCCGn1
    SolutionIndex: 46
    SolutionNameMin: Cijk_Alik_Bljk_I8II_BH_UserArgs_MT128x128x64_MI16x16x1_SN_CLR1_GSU0_GSUC0_GSUWGMRR0_K1_LBSPPA256_LBSPPB128_MIWT4_4_PLR1_SU0_SUM0_SUS64_SKXCCM8_VWA4_VWB1_WGM1_WGMXCC1_WGMXCCGn1
    SolutionIndex: 47
    SolutionNameMin: Cijk_Alik_Bljk_I8II_BH_UserArgs_MT128x128x64_MI16x16x1_SN_CLR1_GSU0_GSUC0_GSUWGMRR0_K1_LBSPPA128_LBSPPB128_MIWT4_4_PLR1_SU0_SUM0_SUS64_SKXCCM8_VWA1_VWB2_WGM1_WGMXCC1_WGMXCCGn1
    SolutionIndex: 48
    SolutionNameMin: Cijk_Alik_Bljk_I8II_BH_UserArgs_MT128x128x64_MI16x16x1_SN_CLR1_GSU0_GSUC0_GSUWGMRR0_K1_LBSPPA256_LBSPPB128_MIWT4_4_PLR1_SU0_SUM0_SUS64_SKXCCM8_VWA4_VWB2_WGM1_WGMXCC1_WGMXCCGn1
    SolutionIndex: 49
    SolutionNameMin: Cijk_Alik_Bljk_I8II_BH_UserArgs_MT128x128x64_MI16x16x1_SN_CLR1_GSU0_GSUC0_GSUWGMRR0_K1_LBSPPA128_LBSPPB256_MIWT4_4_PLR1_SU0_SUM0_SUS64_SKXCCM8_VWA1_VWB4_WGM1_WGMXCC1_WGMXCCGn1
    SolutionIndex: 50
    SolutionNameMin: Cijk_Alik_Bljk_I8II_BH_UserArgs_MT128x128x64_MI16x16x1_SN_CLR1_GSU0_GSUC0_GSUWGMRR0_K1_LBSPPA256_LBSPPB256_MIWT4_4_PLR1_SU0_SUM0_SUS64_SKXCCM8_VWA4_VWB4_WGM1_WGMXCC1_WGMXCCGn1
    SolutionIndex: 51
    SolutionNameMin: Cijk_Alik_Bljk_I8II_BH_UserArgs_MT128x128x64_MI16x16x1_SN_CLR1_GSU0_GSUC0_GSUWGMRR0_K1_LBSPPA256_LBSPPB128_MIWT4_4_PLR1_SU0_SUM0_SUS64_SKXCCM8_VWA4_VWB1_WGM1_WGMXCC1_WGMXCCGn1
    SolutionIndex: 52
    SolutionNameMin: Cijk_Alik_Bljk_I8II_BH_UserArgs_MT64x128x64_MI16x16x1_SN_CLR1_GSU0_GSUC0_GSUWGMRR0_K1_LBSPPA128_LBSPPB128_MIWT2_4_PLR1_SU0_SUM0_SUS64_SKXCCM8_VWA1_VWB1_WGM1_WGMXCC1_WGMXCCGn1
    SolutionIndex: 53
    SolutionNameMin: Cijk_Alik_Bljk_I8II_BH_UserArgs_MT64x128x64_MI16x16x1_SN_CLR1_GSU0_GSUC0_GSUWGMRR0_K1_LBSPPA128_LBSPPB128_MIWT2_4_PLR1_SU0_SUM0_SUS64_SKXCCM8_VWA1_VWB1_WGM1_WGMXCC1_WGMXCCGn1
    SolutionIndex: 54
    SolutionNameMin: Cijk_Alik_Bljk_I8II_BH_UserArgs_MT64x128x64_MI16x16x1_SN_CLR1_GSU0_GSUC0_GSUWGMRR0_K1_LBSPPA128_LBSPPB256_MIWT2_4_PLR1_SU0_SUM0_SUS64_SKXCCM8_VWA1_VWB4_WGM1_WGMXCC1_WGMXCCGn1
    SolutionIndex: 55
    SolutionNameMin: Cijk_Alik_Bljk_I8II_BH_UserArgs_MT128x64x64_MI16x16x1_SN_CLR1_GSU0_GSUC0_GSUWGMRR0_K1_LBSPPA256_LBSPPB128_MIWT4_2_PLR1_SU0_SUM0_SUS64_SKXCCM8_VWA4_VWB1_WGM1_WGMXCC1_WGMXCCGn1
    SolutionIndex: 56
    SolutionNameMin: Cijk_Alik_Bljk_I8II_BH_UserArgs_MT128x64x64_MI16x16x1_SN_CLR1_GSU0_GSUC0_GSUWGMRR0_K1_LBSPPA128_LBSPPB128_MIWT4_2_PLR1_SU0_SUM0_SUS64_SKXCCM8_VWA1_VWB2_WGM1_WGMXCC1_WGMXCCGn1
    SolutionIndex: 57
    SolutionNameMin: Cijk_Alik_Bljk_I8II_BH_UserArgs_MT128x64x64_MI16x16x1_SN_CLR1_GSU0_GSUC0_GSUWGMRR0_K1_LBSPPA256_LBSPPB128_MIWT4_2_PLR1_SU0_SUM0_SUS64_SKXCCM8_VWA4_VWB2_WGM1_WGMXCC1_WGMXCCGn1
    SolutionIndex: 58
    SolutionNameMin: Cijk_Alik_Bljk_I8II_BH_UserArgs_MT128x64x64_MI16x16x1_SN_CLR1_GSU0_GSUC0_GSUWGMRR0_K1_LBSPPA256_LBSPPB128_MIWT4_2_PLR1_SU0_SUM0_SUS64_SKXCCM8_VWA4_VWB1_WGM1_WGMXCC1_WGMXCCGn1
    SolutionIndex: 59
    SolutionNameMin: Cijk_Alik_Bljk_I8II_BH_UserArgs_MT128x64x64_MI16x16x1_SN_CLR1_GSU0_GSUC0_GSUWGMRR0_K1_LBSPPA128_LBSPPB128_MIWT4_2_PLR1_SU0_SUM0_SUS64_SKXCCM8_VWA1_VWB2_WGM1_WGMXCC1_WGMXCCGn1
    SolutionIndex: 60
    SolutionNameMin: Cijk_Alik_Bljk_I8II_BH_UserArgs_MT128x64x64_MI16x16x1_SN_CLR1_GSU0_GSUC0_GSUWGMRR0_K1_LBSPPA256_LBSPPB128_MIWT4_2_PLR1_SU0_SUM0_SUS64_SKXCCM8_VWA4_VWB2_WGM1_WGMXCC1_WGMXCCGn1
    SolutionIndex: 61
    SolutionNameMin: Cijk_Alik_Bljk_I8II_BH_UserArgs_MT64x64x64_MI16x16x1_SN_CLR1_GSU0_GSUC0_GSUWGMRR0_K1_LBSPPA128_LBSPPB128_MIWT2_2_PLR1_SU0_SUM0_SUS64_SKXCCM8_VWA1_VWB1_WGM1_WGMXCC1_WGMXCCGn1
    SolutionIndex: 62
    SolutionNameMin: Cijk_Alik_Bljk_I8II_BH_UserArgs_MT64x64x64_MI16x16x1_SN_CLR1_GSU0_GSUC0_GSUWGMRR0_K1_LBSPPA128_LBSPPB128_MIWT2_2_PLR1_SU0_SUM0_SUS64_SKXCCM8_VWA1_VWB2_WGM1_WGMXCC1_WGMXCCGn1
    SolutionIndex: 63
    SolutionNameMin: Cijk_Alik_Bljk_I8II_BH_UserArgs_MT64x64x64_MI16x16x1_SN_CLR0_GSU0_GSUC0_GSUWGMRR0_K1_LBSPPA128_LBSPPB128_MIWT2_2_PLR0_SU0_SUM0_SUS64_SKXCCM8_VWA1_VWB1_WGM1_WGMXCC1_WGMXCCGn1
    SolutionIndex: 64
    SolutionNameMin: Cijk_Alik_Bljk_I8II_BH_UserArgs_MT64x64x64_MI16x16x1_SN_CLR0_GSU0_GSUC0_GSUWGMRR0_K1_LBSPPA128_LBSPPB128_MIWT2_2_PLR0_SU0_SUM0_SUS64_SKXCCM8_VWA1_VWB2_WGM1_WGMXCC1_WGMXCCGn1
    SolutionIndex: 65
    SolutionNameMin: Cijk_Alik_Bljk_I8II_BH_UserArgs_MT32x64x64_MI16x16x1_SN_CLR1_GSU0_GSUC0_GSUWGMRR0_K1_LBSPPA128_LBSPPB128_MIWT1_2_PLR1_SU0_SUM0_SUS64_SKXCCM8_VWA1_VWB1_WGM1_WGMXCC1_WGMXCCGn1
    SolutionIndex: 66
    SolutionNameMin: Cijk_Alik_Bljk_I8II_BH_UserArgs_MT64x32x64_MI16x16x1_SN_CLR1_GSU0_GSUC0_GSUWGMRR0_K1_LBSPPA128_LBSPPB128_MIWT2_1_PLR1_SU0_SUM0_SUS64_SKXCCM8_VWA1_VWB1_WGM1_WGMXCC1_WGMXCCGn1
    SolutionIndex: 67
    SolutionNameMin: Cijk_Alik_Bljk_I8II_BH_UserArgs_MT64x32x64_MI16x16x1_SN_CLR1_GSU0_GSUC0_GSUWGMRR0_K1_LBSPPA128_LBSPPB128_MIWT2_1_PLR1_SU0_SUM0_SUS64_SKXCCM8_VWA1_VWB1_WGM1_WGMXCC1_WGMXCCGn1
    SolutionIndex: 68
    SolutionNameMin: Cijk_Alik_Bljk_I8II_BH_UserArgs_MT64x32x64_MI16x16x1_SN_CLR0_GSU0_GSUC0_GSUWGMRR0_K1_LBSPPA128_LBSPPB128_MIWT2_1_PLR0_SU0_SUM0_SUS64_SKXCCM8_VWA1_VWB1_WGM1_WGMXCC1_WGMXCCGn1
    SolutionIndex: 69
    SolutionNameMin: Cijk_Alik_Bljk_I8II_BH_UserArgs_MT32x32x64_MI16x16x1_SN_CLR1_GSU0_GSUC0_GSUWGMRR0_K1_LBSPPA128_LBSPPB128_MIWT1_1_PLR1_SU0_SUM0_SUS64_SKXCCM8_VWA1_VWB1_WGM1_WGMXCC1_WGMXCCGn1
    SolutionIndex: 70
    SolutionNameMin: Cijk_Alik_Bljk_I8II_BH_UserArgs_MT32x32x64_MI16x16x1_SN_CLR1_GSU0_GSUC0_GSUWGMRR0_K1_LBSPPA128_LBSPPB128_MIWT1_1_PLR1_SU0_SUM0_SUS64_SKXCCM8_VWA1_VWB1_WGM1_WGMXCC1_WGMXCCGn1
    SolutionIndex: 71
    SolutionNameMin: Cijk_Alik_Bljk_I8II_BH_UserArgs_MT32x32x64_MI16x16x1_SN_CLR0_GSU0_GSUC0_GSUWGMRR0_K1_LBSPPA128_LBSPPB128_MIWT1_1_PLR0_SU0_SUM0_SUS64_SKXCCM8_VWA1_VWB1_WGM1_WGMXCC1_WGMXCCGn1
    SolutionIndex: 72
    SolutionNameMin: Cijk_Alik_Bljk_I8II_BH_UserArgs_MT32x32x64_MI16x16x1_SN_CLR0_GSU0_GSUC0_GSUWGMRR0_K1_LBSPPA128_LBSPPB128_MIWT1_1_PLR0_SU0_SUM0_SUS64_SKXCCM8_VWA1_VWB1_WGM1_WGMXCC1_WGMXCCGn1
    SolutionIndex: 73
    SolutionNameMin: Cijk_Alik_Bljk_I8II_BH_UserArgs_MT32x32x64_MI16x16x1_SN_CLR0_GSU0_GSUC0_GSUWGMRR0_K1_LBSPPA128_LBSPPB128_MIWT1_1_PLR0_SU0_SUM0_SUS64_SKXCCM8_VWA1_VWB1_WGM1_WGMXCC1_WGMXCCGn1
    SolutionIndex: 74
    SolutionNameMin: Cijk_Alik_Bljk_I8II_BH_UserArgs_MT32x32x64_MI16x16x1_SN_CLR0_GSU0_GSUC0_GSUWGMRR0_K1_LBSPPA128_LBSPPB128_MIWT1_1_PLR0_SU0_SUM0_SUS64_SKXCCM8_VWA1_VWB1_WGM1_WGMXCC1_WGMXCCGn1
    SolutionIndex: 75
    SolutionNameMin: Cijk_Alik_Bljk_I8II_BH_UserArgs_MT32x32x64_MI16x16x1_SN_CLR0_GSU0_GSUC0_GSUWGMRR0_K1_LBSPPA128_LBSPPB128_MIWT1_1_PLR0_SU0_SUM0_SUS64_SKXCCM8_VWA1_VWB1_WGM1_WGMXCC1_WGMXCCGn1
    SolutionIndex: 76
    SolutionNameMin: Cijk_Alik_Bljk_I8II_BH_UserArgs_MT32x32x64_MI16x16x1_SN_CLR0_GSU0_GSUC0_GSUWGMRR0_K1_LBSPPA128_LBSPPB128_MIWT1_1_PLR0_SU0_SUM0_SUS64_SKXCCM8_VWA1_VWB1_WGM1_WGMXCC1_WGMXCCGn1
    SolutionIndex: 77
    SolutionNameMin: Cijk_Alik_Bljk_I8II_BH_UserArgs_MT128x256x128_MI16x16x1_SN_CLR1_GSU0_GSUC0_GSUWGMRR0_K1_LBSPPA128_LBSPPB1024_MIWT4_8_PLR1_SU0_SUM0_SUS128_SKXCCM8_VWA1_VWB8_WGM1_WGMXCC1_WGMXCCGn1
    SolutionIndex: 78
    SolutionNameMin: Cijk_Alik_Bljk_I8II_BH_UserArgs_MT128x256x128_MI16x16x1_SN_CLR1_GSU0_GSUC0_GSUWGMRR0_K1_LBSPPA128_LBSPPB128_MIWT4_8_PLR1_SU0_SUM0_SUS128_SKXCCM8_VWA1_VWB1_WGM4_WGMXCC1_WGMXCCGn1
    SolutionIndex: 79
    SolutionNameMin: Cijk_Alik_Bljk_I8II_BH_UserArgs_MT256x128x128_MI16x16x1_SN_CLR1_GSU0_GSUC0_GSUWGMRR0_K1_LBSPPA128_LBSPPB128_MIWT8_4_PLR1_SU0_SUM0_SUS128_SKXCCM8_VWA1_VWB1_WGM1_WGMXCC1_WGMXCCGn1
    SolutionIndex: 80
    SolutionNameMin: Cijk_Alik_Bljk_I8II_BH_UserArgs_MT256x128x128_MI16x16x1_SN_CLR1_GSU0_GSUC0_GSUWGMRR0_K1_LBSPPA512_LBSPPB128_MIWT8_4_PLR1_SU0_SUM0_SUS128_SKXCCM8_VWA4_VWB1_WGM4_WGMXCC1_WGMXCCGn1
    SolutionIndex: 81
    SolutionNameMin: Cijk_Alik_Bljk_I8II_BH_UserArgs_MT256x128x128_MI16x16x1_SN_CLR1_GSU0_GSUC0_GSUWGMRR0_K1_LBSPPA128_LBSPPB256_MIWT8_4_PLR1_SU0_SUM0_SUS128_SKXCCM8_VWA1_VWB2_WGM4_WGMXCC1_WGMXCCGn1
    SolutionIndex: 82
    SolutionNameMin: Cijk_Alik_Bljk_I8II_BH_UserArgs_MT256x128x128_MI16x16x1_SN_CLR1_GSU0_GSUC0_GSUWGMRR0_K1_LBSPPA512_LBSPPB256_MIWT8_4_PLR1_SU0_SUM0_SUS128_SKXCCM8_VWA4_VWB2_WGM4_WGMXCC1_WGMXCCGn1
    SolutionIndex: 83
    SolutionNameMin: Cijk_Alik_Bljk_I8II_BH_UserArgs_MT256x128x128_MI16x16x1_SN_CLR1_GSU0_GSUC0_GSUWGMRR0_K1_LBSPPA128_LBSPPB512_MIWT8_4_PLR1_SU0_SUM0_SUS128_SKXCCM8_VWA1_VWB4_WGM4_WGMXCC1_WGMXCCGn1
    SolutionIndex: 84
    SolutionNameMin: Cijk_Alik_Bljk_I8II_BH_UserArgs_MT256x128x128_MI16x16x1_SN_CLR1_GSU0_GSUC0_GSUWGMRR0_K1_LBSPPA512_LBSPPB512_MIWT8_4_PLR1_SU0_SUM0_SUS128_SKXCCM8_VWA4_VWB4_WGM4_WGMXCC1_WGMXCCGn1
    SolutionIndex: 85
    SolutionNameMin: Cijk_Alik_Bljk_I8II_BH_UserArgs_MT256x128x128_MI16x16x1_SN_CLR1_GSU0_GSUC0_GSUWGMRR0_K1_LBSPPA512_LBSPPB128_MIWT8_4_PLR1_SU0_SUM0_SUS128_SKXCCM8_VWA4_VWB1_WGM4_WGMXCC1_WGMXCCGn1
    SolutionIndex: 86
    SolutionNameMin: Cijk_Alik_Bljk_I8II_BH_UserArgs_MT256x128x128_MI16x16x1_SN_CLR1_GSU0_GSUC0_GSUWGMRR0_K1_LBSPPA128_LBSPPB256_MIWT8_4_PLR1_SU0_SUM0_SUS128_SKXCCM8_VWA1_VWB2_WGM4_WGMXCC1_WGMXCCGn1
    SolutionIndex: 87
    SolutionNameMin: Cijk_Alik_Bljk_I8II_BH_UserArgs_MT256x128x128_MI16x16x1_SN_CLR1_GSU0_GSUC0_GSUWGMRR0_K1_LBSPPA512_LBSPPB512_MIWT8_4_PLR1_SU0_SUM0_SUS128_SKXCCM8_VWA4_VWB4_WGM4_WGMXCC1_WGMXCCGn1
    SolutionIndex: 88
    SolutionNameMin: Cijk_Alik_Bljk_I8II_BH_UserArgs_MT256x128x128_MI16x16x1_SN_CLR1_GSU0_GSUC0_GSUWGMRR0_K1_LBSPPA128_LBSPPB128_MIWT8_4_PLR1_SU0_SUM0_SUS128_SKXCCM8_VWA1_VWB1_WGM8_WGMXCC1_WGMXCCGn1
    SolutionIndex: 89
    SolutionNameMin: Cijk_Alik_Bljk_I8II_BH_UserArgs_MT256x128x128_MI16x16x1_SN_CLR1_GSU0_GSUC0_GSUWGMRR0_K1_LBSPPA512_LBSPPB128_MIWT8_4_PLR1_SU0_SUM0_SUS128_SKXCCM8_VWA4_VWB1_WGM8_WGMXCC1_WGMXCCGn1
    SolutionIndex: 90
    SolutionNameMin: Cijk_Alik_Bljk_I8II_BH_UserArgs_MT256x128x128_MI16x16x1_SN_CLR1_GSU0_GSUC0_GSUWGMRR0_K1_LBSPPA512_LBSPPB256_MIWT8_4_PLR1_SU0_SUM0_SUS128_SKXCCM8_VWA4_VWB2_WGM8_WGMXCC1_WGMXCCGn1
    SolutionIndex: 91
    SolutionNameMin: Cijk_Alik_Bljk_I8II_BH_UserArgs_MT256x128x128_MI16x16x1_SN_CLR1_GSU0_GSUC0_GSUWGMRR0_K1_LBSPPA128_LBSPPB512_MIWT8_4_PLR1_SU0_SUM0_SUS128_SKXCCM8_VWA1_VWB4_WGM8_WGMXCC1_WGMXCCGn1
    SolutionIndex: 92
    SolutionNameMin: Cijk_Alik_Bljk_I8II_BH_UserArgs_MT256x128x128_MI16x16x1_SN_CLR1_GSU0_GSUC0_GSUWGMRR0_K1_LBSPPA512_LBSPPB512_MIWT8_4_PLR1_SU0_SUM0_SUS128_SKXCCM8_VWA4_VWB4_WGM8_WGMXCC1_WGMXCCGn1
    SolutionIndex: 93
    SolutionNameMin: Cijk_Alik_Bljk_I8II_BH_UserArgs_MT256x64x128_MI16x16x1_SN_CLR1_GSU0_GSUC0_GSUWGMRR0_K1_LBSPPA512_LBSPPB256_MIWT8_2_PLR1_SU0_SUM0_SUS128_SKXCCM8_VWA4_VWB2_WGM4_WGMXCC1_WGMXCCGn1
    SolutionIndex: 94
    SolutionNameMin: Cijk_Alik_Bljk_I8II_BH_UserArgs_MT128x128x128_MI16x16x1_SN_CLR1_GSU0_GSUC0_GSUWGMRR0_K1_LBSPPA128_LBSPPB128_MIWT4_4_PLR1_SU0_SUM0_SUS128_SKXCCM8_VWA1_VWB1_WGM1_WGMXCC1_WGMXCCGn1
    SolutionIndex: 95
    SolutionNameMin: Cijk_Alik_Bljk_I8II_BH_UserArgs_MT128x128x128_MI16x16x1_SN_CLR1_GSU0_GSUC0_GSUWGMRR0_K1_LBSPPA128_LBSPPB256_MIWT4_4_PLR1_SU0_SUM0_SUS128_SKXCCM8_VWA1_VWB2_WGM1_WGMXCC1_WGMXCCGn1
    SolutionIndex: 96
    SolutionNameMin: Cijk_Alik_Bljk_I8II_BH_UserArgs_MT128x128x128_MI16x16x1_SN_CLR1_GSU0_GSUC0_GSUWGMRR0_K1_LBSPPA512_LBSPPB256_MIWT4_4_PLR1_SU0_SUM0_SUS128_SKXCCM8_VWA4_VWB2_WGM1_WGMXCC1_WGMXCCGn1
    SolutionIndex: 97
    SolutionNameMin: Cijk_Alik_Bljk_I8II_BH_UserArgs_MT128x128x128_MI16x16x1_SN_CLR1_GSU0_GSUC0_GSUWGMRR0_K1_LBSPPA128_LBSPPB512_MIWT4_4_PLR1_SU0_SUM0_SUS128_SKXCCM8_VWA1_VWB4_WGM1_WGMXCC1_WGMXCCGn1
    SolutionIndex: 98
    SolutionNameMin: Cijk_Alik_Bljk_I8II_BH_UserArgs_MT128x128x128_MI16x16x1_SN_CLR1_GSU0_GSUC0_GSUWGMRR0_K1_LBSPPA512_LBSPPB512_MIWT4_4_PLR1_SU0_SUM0_SUS128_SKXCCM8_VWA4_VWB4_WGM1_WGMXCC1_WGMXCCGn1
    SolutionIndex: 99
    SolutionNameMin: Cijk_Alik_Bljk_I8II_BH_UserArgs_MT128x128x128_MI16x16x1_SN_CLR1_GSU0_GSUC0_GSUWGMRR0_K1_LBSPPA128_LBSPPB256_MIWT4_4_PLR1_SU0_SUM0_SUS128_SKXCCM8_VWA1_VWB2_WGM1_WGMXCC1_WGMXCCGn1
    SolutionIndex: 100
    SolutionNameMin: Cijk_Alik_Bljk_I8II_BH_UserArgs_MT128x128x128_MI16x16x1_SN_CLR1_GSU0_GSUC0_GSUWGMRR0_K1_LBSPPA128_LBSPPB512_MIWT4_4_PLR1_SU0_SUM0_SUS128_SKXCCM8_VWA1_VWB4_WGM1_WGMXCC1_WGMXCCGn1
    SolutionIndex: 101
    SolutionNameMin: Cijk_Alik_Bljk_I8II_BH_UserArgs_MT128x128x128_MI16x16x1_SN_CLR1_GSU0_GSUC0_GSUWGMRR0_K1_LBSPPA128_LBSPPB256_MIWT4_4_PLR1_SU0_SUM0_SUS128_SKXCCM8_VWA1_VWB2_WGM4_WGMXCC1_WGMXCCGn1
    SolutionIndex: 102
    SolutionNameMin: Cijk_Alik_Bljk_I8II_BH_UserArgs_MT128x128x128_MI16x16x1_SN_CLR1_GSU0_GSUC0_GSUWGMRR0_K1_LBSPPA512_LBSPPB256_MIWT4_4_PLR1_SU0_SUM0_SUS128_SKXCCM8_VWA4_VWB2_WGM4_WGMXCC1_WGMXCCGn1
    SolutionIndex: 103
    SolutionNameMin: Cijk_Alik_Bljk_I8II_BH_UserArgs_MT128x128x128_MI16x16x1_SN_CLR1_GSU0_GSUC0_GSUWGMRR0_K1_LBSPPA128_LBSPPB512_MIWT4_4_PLR1_SU0_SUM0_SUS128_SKXCCM8_VWA1_VWB4_WGM4_WGMXCC1_WGMXCCGn1
    SolutionIndex: 104
    SolutionNameMin: Cijk_Alik_Bljk_I8II_BH_UserArgs_MT128x128x128_MI16x16x1_SN_CLR1_GSU0_GSUC0_GSUWGMRR0_K1_LBSPPA512_LBSPPB512_MIWT4_4_PLR1_SU0_SUM0_SUS128_SKXCCM8_VWA4_VWB4_WGM4_WGMXCC1_WGMXCCGn1
    SolutionIndex: 105
    SolutionNameMin: Cijk_Alik_Bljk_I8II_BH_UserArgs_MT128x128x128_MI16x16x1_SN_CLR1_GSU0_GSUC0_GSUWGMRR0_K1_LBSPPA512_LBSPPB256_MIWT4_4_PLR1_SU0_SUM0_SUS128_SKXCCM8_VWA4_VWB2_WGM8_WGMXCC1_WGMXCCGn1
    SolutionIndex: 106
    SolutionNameMin: Cijk_Alik_Bljk_I8II_BH_UserArgs_MT128x128x128_MI16x16x1_SN_CLR1_GSU0_GSUC0_GSUWGMRR0_K1_LBSPPA512_LBSPPB512_MIWT4_4_PLR1_SU0_SUM0_SUS128_SKXCCM8_VWA4_VWB4_WGM8_WGMXCC1_WGMXCCGn1
    SolutionIndex: 107
    SolutionNameMin: Cijk_Alik_Bljk_I8II_BH_UserArgs_MT128x64x128_MI16x16x1_SN_CLR1_GSU0_GSUC0_GSUWGMRR0_K1_LBSPPA512_LBSPPB128_MIWT4_2_PLR1_SU0_SUM0_SUS128_SKXCCM8_VWA4_VWB1_WGM1_WGMXCC1_WGMXCCGn1
    SolutionIndex: 108
    SolutionNameMin: Cijk_Alik_Bljk_I8II_BH_UserArgs_MT128x64x128_MI16x16x1_SN_CLR1_GSU0_GSUC0_GSUWGMRR0_K1_LBSPPA512_LBSPPB256_MIWT4_2_PLR1_SU0_SUM0_SUS128_SKXCCM8_VWA4_VWB2_WGM1_WGMXCC1_WGMXCCGn1
    SolutionIndex: 109
    SolutionNameMin: Cijk_Alik_Bljk_I8II_BH_UserArgs_MT128x64x128_MI16x16x1_SN_CLR1_GSU0_GSUC0_GSUWGMRR0_K1_LBSPPA512_LBSPPB128_MIWT4_2_PLR1_SU0_SUM0_SUS128_SKXCCM8_VWA4_VWB1_WGM8_WGMXCC1_WGMXCCGn1
    SolutionIndex: 110
    SolutionNameMin: Cijk_Alik_Bljk_I8II_BH_UserArgs_MT128x64x128_MI16x16x1_SN_CLR1_GSU0_GSUC0_GSUWGMRR0_K1_LBSPPA512_LBSPPB256_MIWT4_2_PLR1_SU0_SUM0_SUS128_SKXCCM8_VWA4_VWB2_WGM8_WGMXCC1_WGMXCCGn1
    SolutionIndex: 111
    SolutionNameMin: Cijk_Alik_Bljk_I8II_BH_UserArgs_MT64x64x128_MI16x16x1_SN_CLR1_GSU0_GSUC0_GSUWGMRR0_K1_LBSPPA128_LBSPPB128_MIWT2_2_PLR1_SU0_SUM0_SUS128_SKXCCM8_VWA1_VWB1_WGM1_WGMXCC1_WGMXCCGn1
    SolutionIndex: 112
    SolutionNameMin: Cijk_Alik_Bljk_I8II_BH_UserArgs_MT64x64x128_MI16x16x1_SN_CLR1_GSU0_GSUC0_GSUWGMRR0_K1_LBSPPA256_LBSPPB128_MIWT2_2_PLR1_SU0_SUM0_SUS128_SKXCCM8_VWA2_VWB1_WGM1_WGMXCC1_WGMXCCGn1
    SolutionIndex: 113
    SolutionNameMin: Cijk_Alik_Bljk_I8II_BH_UserArgs_MT64x64x128_MI16x16x1_SN_CLR1_GSU0_GSUC0_GSUWGMRR0_K1_LBSPPA128_LBSPPB256_MIWT2_2_PLR1_SU0_SUM0_SUS128_SKXCCM8_VWA1_VWB2_WGM1_WGMXCC1_WGMXCCGn1
    SolutionIndex: 114
    SolutionNameMin: Cijk_Alik_Bljk_I8II_BH_UserArgs_MT32x64x128_MI16x16x1_SN_CLR1_GSU0_GSUC0_GSUWGMRR0_K1_LBSPPA128_LBSPPB128_MIWT1_2_PLR1_SU0_SUM0_SUS128_SKXCCM8_VWA1_VWB1_WGM1_WGMXCC1_WGMXCCGn1
    SolutionIndex: 115
    SolutionNameMin: Cijk_Alik_Bljk_I8II_BH_UserArgs_MT32x64x128_MI16x16x1_SN_CLR1_GSU0_GSUC0_GSUWGMRR0_K1_LBSPPA128_LBSPPB128_MIWT1_2_PLR1_SU0_SUM0_SUS128_SKXCCM8_VWA1_VWB1_WGM1_WGMXCC1_WGMXCCGn1
    SolutionIndex: 116
    SolutionNameMin: Cijk_Alik_Bljk_I8II_BH_UserArgs_MT32x64x128_MI16x16x1_SN_CLR1_GSU0_GSUC0_GSUWGMRR0_K1_LBSPPA128_LBSPPB256_MIWT1_2_PLR1_SU0_SUM0_SUS128_SKXCCM8_VWA1_VWB2_WGM1_WGMXCC1_WGMXCCGn1
    SolutionIndex: 117
    SolutionNameMin: Cijk_Alik_Bljk_I8II_BH_UserArgs_MT32x64x128_MI16x16x1_SN_CLR1_GSU0_GSUC0_GSUWGMRR0_K1_LBSPPA128_LBSPPB128_MIWT1_2_PLR1_SU0_SUM0_SUS128_SKXCCM8_VWA1_VWB1_WGM1_WGMXCC1_WGMXCCGn1
    SolutionIndex: 118
    SolutionNameMin: Cijk_Alik_Bljk_I8II_BH_UserArgs_MT64x32x128_MI16x16x1_SN_CLR1_GSU0_GSUC0_GSUWGMRR0_K1_LBSPPA128_LBSPPB128_MIWT2_1_PLR1_SU0_SUM0_SUS128_SKXCCM8_VWA1_VWB1_WGM1_WGMXCC1_WGMXCCGn1
    SolutionIndex: 119
    SolutionNameMin: Cijk_Alik_Bljk_I8II_BH_UserArgs_MT64x32x128_MI16x16x1_SN_CLR1_GSU0_GSUC0_GSUWGMRR0_K1_LBSPPA128_LBSPPB128_MIWT2_1_PLR2_SU0_SUM0_SUS128_SKXCCM8_VWA1_VWB1_WGM1_WGMXCC1_WGMXCCGn1
    SolutionIndex: 120
    SolutionNameMin: Cijk_Alik_Bljk_I8II_BH_UserArgs_MT64x32x128_MI16x16x1_SN_CLR1_GSU0_GSUC0_GSUWGMRR0_K1_LBSPPA128_LBSPPB128_MIWT2_1_PLR2_SU0_SUM0_SUS128_SKXCCM8_VWA1_VWB1_WGM1_WGMXCC1_WGMXCCGn1
    SolutionIndex: 121
    SolutionNameMin: Cijk_Alik_Bljk_I8II_BH_UserArgs_MT32x32x128_MI16x16x1_SN_CLR1_GSU0_GSUC0_GSUWGMRR0_K1_LBSPPA128_LBSPPB128_MIWT1_1_PLR1_SU0_SUM0_SUS128_SKXCCM8_VWA1_VWB1_WGM1_WGMXCC1_WGMXCCGn1
    SolutionIndex: 122
    SolutionNameMin: Cijk_Alik_Bljk_I8II_BH_UserArgs_MT32x32x128_MI16x16x1_SN_CLR1_GSU0_GSUC0_GSUWGMRR0_K1_LBSPPA128_LBSPPB128_MIWT1_1_PLR1_SU0_SUM0_SUS128_SKXCCM8_VWA1_VWB1_WGM1_WGMXCC1_WGMXCCGn1
    SolutionIndex: 123
    SolutionNameMin: Cijk_Alik_Bljk_I8II_BH_UserArgs_MT32x32x128_MI16x16x1_SN_CLR1_GSU0_GSUC0_GSUWGMRR0_K1_LBSPPA128_LBSPPB128_MIWT1_1_PLR1_SU0_SUM0_SUS128_SKXCCM8_VWA1_VWB1_WGM1_WGMXCC1_WGMXCCGn1
    SolutionIndex: 124
    SolutionNameMin: Cijk_Alik_Bljk_I8II_BH_UserArgs_MT64x128x256_MI16x16x1_SN_CLR1_GSU0_GSUC0_GSUWGMRR0_K1_LBSPPA256_LBSPPB1024_MIWT2_4_PLR1_SU0_SUM0_SUS256_SKXCCM8_VWA1_VWB4_WGM1_WGMXCC1_WGMXCCGn1
    SolutionIndex: 125
    SolutionNameMin: Cijk_Alik_Bljk_I8II_BH_UserArgs_MT64x128x256_MI16x16x1_SN_CLR1_GSU0_GSUC0_GSUWGMRR0_K1_LBSPPA256_LBSPPB1024_MIWT2_4_PLR2_SU0_SUM0_SUS256_SKXCCM8_VWA1_VWB4_WGM1_WGMXCC1_WGMXCCGn1
    SolutionIndex: 126
    SolutionNameMin: Cijk_Alik_Bljk_I8II_BH_UserArgs_MT64x128x256_MI16x16x1_SN_CLR1_GSU0_GSUC0_GSUWGMRR0_K1_LBSPPA512_LBSPPB1024_MIWT2_4_PLR2_SU0_SUM0_SUS256_SKXCCM8_VWA2_VWB4_WGM1_WGMXCC1_WGMXCCGn1
    SolutionIndex: 127
    SolutionNameMin: Cijk_Alik_Bljk_I8II_BH_UserArgs_MT128x64x256_MI16x16x1_SN_CLR1_GSU0_GSUC0_GSUWGMRR0_K1_LBSPPA1024_LBSPPB512_MIWT4_2_PLR2_SU0_SUM0_SUS256_SKXCCM8_VWA4_VWB2_WGM1_WGMXCC1_WGMXCCGn1
    SolutionIndex: 128
    SolutionNameMin: Cijk_Alik_Bljk_I8II_BH_UserArgs_MT128x64x256_MI16x16x1_SN_CLR1_GSU0_GSUC0_GSUWGMRR0_K1_LBSPPA256_LBSPPB256_MIWT4_2_PLR2_SU0_SUM0_SUS256_SKXCCM8_VWA1_VWB1_WGM4_WGMXCC1_WGMXCCGn1
    SolutionIndex: 129
    SolutionNameMin: Cijk_Alik_Bljk_I8II_BH_UserArgs_MT128x64x256_MI16x16x1_SN_CLR1_GSU0_GSUC0_GSUWGMRR0_K1_LBSPPA1024_LBSPPB512_MIWT4_2_PLR2_SU0_SUM0_SUS256_SKXCCM8_VWA4_VWB2_WGM8_WGMXCC1_WGMXCCGn1
    SolutionIndex: 130
    SolutionNameMin: Cijk_Alik_Bljk_I8II_BH_UserArgs_MT64x64x256_MI16x16x1_SN_CLR1_GSU0_GSUC0_GSUWGMRR0_K1_LBSPPA256_LBSPPB512_MIWT2_2_PLR1_SU0_SUM0_SUS256_SKXCCM8_VWA1_VWB2_WGM1_WGMXCC1_WGMXCCGn1
    SolutionIndex: 131
    SolutionNameMin: Cijk_Alik_Bljk_I8II_BH_UserArgs_MT64x64x256_MI16x16x1_SN_CLR1_GSU0_GSUC0_GSUWGMRR0_K1_LBSPPA256_LBSPPB512_MIWT2_2_PLR2_SU0_SUM0_SUS256_SKXCCM8_VWA1_VWB2_WGM1_WGMXCC1_WGMXCCGn1
    SolutionIndex: 132
    SolutionNameMin: Cijk_Alik_Bljk_I8II_BH_UserArgs_MT64x64x256_MI16x16x1_SN_CLR1_GSU0_GSUC0_GSUWGMRR0_K1_LBSPPA256_LBSPPB256_MIWT2_2_PLR2_SU0_SUM0_SUS256_SKXCCM8_VWA1_VWB1_WGM4_WGMXCC1_WGMXCCGn1
    SolutionIndex: 133
    SolutionNameMin: Cijk_Alik_Bljk_I8II_BH_UserArgs_MT64x64x256_MI16x16x1_SN_CLR1_GSU0_GSUC0_GSUWGMRR0_K1_LBSPPA256_LBSPPB512_MIWT2_2_PLR2_SU0_SUM0_SUS256_SKXCCM8_VWA1_VWB2_WGM4_WGMXCC1_WGMXCCGn1
    SolutionIndex: 134
    SolutionNameMin: Cijk_Alik_Bljk_I8II_BH_UserArgs_MT64x32x256_MI16x16x1_SN_CLR1_GSU0_GSUC0_GSUWGMRR0_K1_LBSPPA256_LBSPPB256_MIWT2_1_PLR2_SU0_SUM0_SUS256_SKXCCM8_VWA1_VWB1_WGM1_WGMXCC1_WGMXCCGn1
    SolutionIndex: 135
    SolutionNameMin: Cijk_Alik_Bljk_I8II_BH_UserArgs_MT64x32x256_MI16x16x1_SN_CLR1_GSU0_GSUC0_GSUWGMRR0_K1_LBSPPA512_LBSPPB256_MIWT2_1_PLR2_SU0_SUM0_SUS256_SKXCCM8_VWA2_VWB1_WGM1_WGMXCC1_WGMXCCGn1
    SolutionIndex: 136
    SolutionNameMin: Cijk_Alik_Bljk_I8II_BH_UserArgs_MT32x32x256_MI16x16x1_SN_CLR1_GSU0_GSUC0_GSUWGMRR0_K1_LBSPPA256_LBSPPB256_MIWT1_1_PLR2_SU0_SUM0_SUS256_SKXCCM8_VWA1_VWB1_WGM1_WGMXCC1_WGMXCCGn1
    SolutionIndex: 137
    SolutionNameMin: Cijk_Alik_Bljk_I8II_BH_UserArgs_MT32x32x32_MI16x16x1_SN_CLR0_GSU0_GSUC0_GSUWGMRR0_K1_LBSPPA128_LBSPPB128_MIWT1_1_PLR0_SU32_SUM0_SUS256_SKXCCM8_VWA1_VWB1_WGM1_WGMXCC1_WGMXCCGn1
- - - [128, 128, 1, 128, 128, 128, 128, 128]
    - [71, 0.66]
  - - [128, 128, 1, 256, 128, 128, 256, 256]
    - [70, 1.27]
  - - [128, 128, 1, 512, 128, 128, 512, 512]
    - [122, 2.32]
  - - [128, 128, 1, 1024, 128, 128, 1024, 1024]
    - [122, 3.91]
  - - [128, 128, 1, 2048, 128, 128, 2048, 2048]
    - [122, 5.99]
  - - [128, 128, 1, 4096, 128, 128, 4096, 4096]
    - [136, 8.19]
  - - [128, 128, 1, 8192, 128, 128, 8192, 8192]
    - [136, 10.09]
  - - [128, 256, 1, 128, 128, 128, 128, 128]
    - [74, 1.24]
  - - [128, 256, 1, 256, 128, 128, 256, 256]
    - [70, 2.49]
  - - [128, 256, 1, 512, 128, 128, 512, 512]
    - [121, 4.54]
  - - [128, 256, 1, 1024, 128, 128, 1024, 1024]
    - [122, 7.77]
  - - [128, 256, 1, 2048, 128, 128, 2048, 2048]
    - [122, 11.83]
  - - [128, 256, 1, 4096, 128, 128, 4096, 4096]
    - [136, 16.43]
  - - [128, 256, 1, 8192, 128, 128, 8192, 8192]
    - [136, 20.12]
  - - [128, 512, 1, 128, 128, 128, 128, 128]
    - [69, 2.54]
  - - [128, 512, 1, 256, 128, 128, 256, 256]
    - [73, 4.94]
  - - [128, 512, 1, 512, 128, 128, 512, 512]
    - [121, 9.02]
  - - [128, 512, 1, 1024, 128, 128, 1024, 1024]
    - [122, 15.28]
  - - [128, 512, 1, 2048, 128, 128, 2048, 2048]
    - [122, 23.29]
  - - [128, 512, 1, 4096, 128, 128, 4096, 4096]
    - [136, 32.54]
  - - [128, 512, 1, 8192, 128, 128, 8192, 8192]
    - [136, 40.14]
  - - [128, 1024, 1, 128, 128, 128, 128, 128]
    - [65, 4.84]
  - - [128, 1024, 1, 256, 128, 128, 256, 256]
    - [119, 8.91]
  - - [128, 1024, 1, 512, 128, 128, 512, 512]
    - [117, 15.19]
  - - [128, 1024, 1, 1024, 128, 128, 1024, 1024]
    - [116, 25.39]
  - - [128, 1024, 1, 2048, 128, 128, 2048, 2048]
    - [116, 37.85]
  - - [128, 1024, 1, 4096, 128, 128, 4096, 4096]
    - [135, 49.45]
  - - [128, 1024, 1, 8192, 128, 128, 8192, 8192]
    - [134, 59.13]
  - - [128, 2048, 1, 128, 128, 128, 128, 128]
    - [63, 8.63]
  - - [128, 2048, 1, 256, 128, 128, 256, 256]
    - [61, 15.82]
  - - [128, 2048, 1, 512, 128, 128, 512, 512]
    - [111, 26.81]
  - - [128, 2048, 1, 1024, 128, 128, 1024, 1024]
    - [111, 42.73]
  - - [128, 2048, 1, 2048, 128, 128, 2048, 2048]
    - [112, 60.15]
  - - [128, 2048, 1, 4096, 128, 128, 4096, 4096]
    - [111, 76.44]
  - - [128, 2048, 1, 8192, 128, 128, 8192, 8192]
    - [132, 83.57]
  - - [128, 4096, 1, 128, 128, 128, 128, 128]
    - [58, 14.19]
  - - [128, 4096, 1, 256, 128, 128, 256, 256]
    - [58, 25.49]
  - - [128, 4096, 1, 512, 128, 128, 512, 512]
    - [55, 41.99]
  - - [128, 4096, 1, 1024, 128, 128, 1024, 1024]
    - [107, 63.84]
  - - [128, 4096, 1, 2048, 128, 128, 2048, 2048]
    - [107, 86.94]
  - - [128, 4096, 1, 4096, 128, 128, 4096, 4096]
    - [126, 95.89]
  - - [128, 4096, 1, 8192, 128, 128, 8192, 8192]
    - [125, 116.8]
  - - [128, 8192, 1, 128, 128, 128, 128, 128]
    - [50, 20.95]
  - - [128, 8192, 1, 256, 128, 128, 256, 256]
    - [50, 37.06]
  - - [128, 8192, 1, 512, 128, 128, 512, 512]
    - [48, 60.39]
  - - [128, 8192, 1, 1024, 128, 128, 1024, 1024]
    - [99, 86.14]
  - - [128, 8192, 1, 2048, 128, 128, 2048, 2048]
    - [95, 102.56]
  - - [128, 8192, 1, 4096, 128, 128, 4096, 4096]
    - [95, 121.7]
  - - [128, 8192, 1, 8192, 128, 128, 8192, 8192]
    - [97, 141.15]
  - - [256, 128, 1, 128, 256, 256, 128, 128]
    - [76, 1.27]
  - - [256, 128, 1, 256, 256, 256, 256, 256]
    - [123, 2.5]
  - - [256, 128, 1, 512, 256, 256, 512, 512]
    - [121, 4.54]
  - - [256, 128, 1, 1024, 256, 256, 1024, 1024]
    - [122, 7.71]
  - - [256, 128, 1, 2048, 256, 256, 2048, 2048]
    - [136, 11.78]
  - - [256, 128, 1, 4096, 256, 256, 4096, 4096]
    - [136, 16.27]
  - - [256, 128, 1, 8192, 256, 256, 8192, 8192]
    - [136, 20.08]
  - - [256, 256, 1, 128, 256, 256, 128, 128]
    - [74, 2.59]
  - - [256, 256, 1, 256, 256, 256, 256, 256]
    - [75, 4.94]
  - - [256, 256, 1, 512, 256, 256, 512, 512]
    - [122, 8.97]
  - - [256, 256, 1, 1024, 256, 256, 1024, 1024]
    - [122, 15.21]
  - - [256, 256, 1, 2048, 256, 256, 2048, 2048]
    - [136, 23.23]
  - - [256, 256, 1, 4096, 256, 256, 4096, 4096]
    - [136, 32.34]
  - - [256, 256, 1, 8192, 256, 256, 8192, 8192]
    - [136, 40.55]
  - - [256, 512, 1, 128, 256, 256, 128, 128]
    - [115, 4.84]
  - - [256, 512, 1, 256, 256, 256, 256, 256]
    - [120, 8.91]
  - - [256, 512, 1, 512, 256, 256, 512, 512]
    - [114, 15.67]
  - - [256, 512, 1, 1024, 256, 256, 1024, 1024]
    - [116, 25.75]
  - - [256, 512, 1, 2048, 256, 256, 2048, 2048]
    - [116, 37.97]
  - - [256, 512, 1, 4096, 256, 256, 4096, 4096]
    - [135, 49.43]
  - - [256, 512, 1, 8192, 256, 256, 8192, 8192]
    - [134, 59.09]
  - - [256, 1024, 1, 128, 256, 256, 128, 128]
    - [64, 8.58]
  - - [256, 1024, 1, 256, 256, 256, 256, 256]
    - [61, 15.71]
  - - [256, 1024, 1, 512, 256, 256, 512, 512]
    - [112, 26.74]
  - - [256, 1024, 1, 1024, 256, 256, 1024, 1024]
    - [113, 42.44]
  - - [256, 1024, 1, 2048, 256, 256, 2048, 2048]
    - [113, 59.9]
  - - [256, 1024, 1, 4096, 256, 256, 4096, 4096]
    - [111, 76.13]
  - - [256, 1024, 1, 8192, 256, 256, 8192, 8192]
    - [130, 83.69]
  - - [256, 2048, 1, 128, 256, 256, 128, 128]
    - [58, 14.29]
  - - [256, 2048, 1, 256, 256, 256, 256, 256]
    - [59, 25.39]
  - - [256, 2048, 1, 512, 256, 256, 512, 512]
    - [57, 41.69]
  - - [256, 2048, 1, 1024, 256, 256, 1024, 1024]
    - [108, 63.82]
  - - [256, 2048, 1, 2048, 256, 256, 2048, 2048]
    - [108, 86.85]
  - - [256, 2048, 1, 4096, 256, 256, 4096, 4096]
    - [108, 106.14]
  - - [256, 2048, 1, 8192, 256, 256, 8192, 8192]
    - [125, 118.06]
  - - [256, 4096, 1, 128, 256, 256, 128, 128]
    - [49, 20.83]
  - - [256, 4096, 1, 256, 256, 256, 256, 256]
    - [50, 37.2]
  - - [256, 4096, 1, 512, 256, 256, 512, 512]
    - [49, 60.16]
  - - [256, 4096, 1, 1024, 256, 256, 1024, 1024]
    - [97, 91.54]
  - - [256, 4096, 1, 2048, 256, 256, 2048, 2048]
    - [97, 113.79]
  - - [256, 4096, 1, 4096, 256, 256, 4096, 4096]
    - [97, 121.53]
  - - [256, 4096, 1, 8192, 256, 256, 8192, 8192]
    - [103, 142.18]
  - - [256, 8192, 1, 128, 256, 256, 128, 128]
    - [10, 28.24]
  - - [256, 8192, 1, 256, 256, 256, 256, 256]
    - [39, 48.65]
  - - [256, 8192, 1, 512, 256, 256, 512, 512]
    - [38, 69.12]
  - - [256, 8192, 1, 1024, 256, 256, 1024, 1024]
    - [98, 99.22]
  - - [256, 8192, 1, 2048, 256, 256, 2048, 2048]
    - [79, 124.87]
  - - [256, 8192, 1, 4096, 256, 256, 4096, 4096]
    - [79, 147.72]
  - - [256, 8192, 1, 8192, 256, 256, 8192, 8192]
    - [78, 174.33]
  - - [512, 128, 1, 128, 512, 512, 128, 128]
    - [72, 2.49]
  - - [512, 128, 1, 256, 512, 512, 256, 256]
    - [70, 4.95]
  - - [512, 128, 1, 512, 512, 512, 512, 512]
    - [122, 9.06]
  - - [512, 128, 1, 1024, 512, 512, 1024, 1024]
    - [122, 15.15]
  - - [512, 128, 1, 2048, 512, 512, 2048, 2048]
    - [122, 23.33]
  - - [512, 128, 1, 4096, 512, 512, 4096, 4096]
    - [136, 32.39]
  - - [512, 128, 1, 8192, 512, 512, 8192, 8192]
    - [136, 40.58]
  - - [512, 256, 1, 128, 512, 512, 128, 128]
    - [68, 4.86]
  - - [512, 256, 1, 256, 512, 512, 256, 256]
    - [67, 8.96]
  - - [512, 256, 1, 512, 512, 512, 512, 512]
    - [118, 15.9]
  - - [512, 256, 1, 1024, 512, 512, 1024, 1024]
    - [115, 25.62]
  - - [512, 256, 1, 2048, 512, 512, 2048, 2048]
    - [116, 37.4]
  - - [512, 256, 1, 4096, 512, 512, 4096, 4096]
    - [135, 49.41]
  - - [512, 256, 1, 8192, 512, 512, 8192, 8192]
    - [135, 58.74]
  - - [512, 512, 1, 128, 512, 512, 128, 128]
    - [61, 8.74]
  - - [512, 512, 1, 256, 512, 512, 256, 256]
    - [61, 15.8]
  - - [512, 512, 1, 512, 512, 512, 512, 512]
    - [62, 26.82]
  - - [512, 512, 1, 1024, 512, 512, 1024, 1024]
    - [111, 42.64]
  - - [512, 512, 1, 2048, 512, 512, 2048, 2048]
    - [113, 60.74]
  - - [512, 512, 1, 4096, 512, 512, 4096, 4096]
    - [113, 77.13]
  - - [512, 512, 1, 8192, 512, 512, 8192, 8192]
    - [130, 83.5]
  - - [512, 1024, 1, 128, 512, 512, 128, 128]
    - [60, 14.26]
  - - [512, 1024, 1, 256, 512, 512, 256, 256]
    - [56, 25.32]
  - - [512, 1024, 1, 512, 512, 512, 512, 512]
    - [57, 41.77]
  - - [512, 1024, 1, 1024, 512, 512, 1024, 1024]
    - [108, 63.43]
  - - [512, 1024, 1, 2048, 512, 512, 2048, 2048]
    - [108, 86.83]
  - - [512, 1024, 1, 4096, 512, 512, 4096, 4096]
    - [108, 105.92]
  - - [512, 1024, 1, 8192, 512, 512, 8192, 8192]
    - [125, 116.63]
  - - [512, 2048, 1, 128, 512, 512, 128, 128]
    - [51, 21.19]
  - - [512, 2048, 1, 256, 512, 512, 256, 256]
    - [50, 37.1]
  - - [512, 2048, 1, 512, 512, 512, 512, 512]
    - [46, 60.56]
  - - [512, 2048, 1, 1024, 512, 512, 1024, 1024]
    - [97, 91.98]
  - - [512, 2048, 1, 2048, 512, 512, 2048, 2048]
    - [100, 124.92]
  - - [512, 2048, 1, 4096, 512, 512, 4096, 4096]
    - [103, 122.7]
  - - [512, 2048, 1, 8192, 512, 512, 8192, 8192]
    - [104, 141.75]
  - - [512, 4096, 1, 128, 512, 512, 128, 128]
    - [11, 28.8]
  - - [512, 4096, 1, 256, 512, 512, 256, 256]
    - [40, 49.66]
  - - [512, 4096, 1, 512, 512, 512, 512, 512]
    - [41, 69.72]
  - - [512, 4096, 1, 1024, 512, 512, 1024, 1024]
    - [96, 100.79]
  - - [512, 4096, 1, 2048, 512, 512, 2048, 2048]
    - [95, 125.39]
  - - [512, 4096, 1, 4096, 512, 512, 4096, 4096]
    - [84, 147.74]
  - - [512, 4096, 1, 8192, 512, 512, 8192, 8192]
    - [84, 174.46]
  - - [512, 8192, 1, 128, 512, 512, 128, 128]
    - [5, 33.47]
  - - [512, 8192, 1, 256, 512, 512, 256, 256]
    - [32, 56.92]
  - - [512, 8192, 1, 512, 512, 512, 512, 512]
    - [35, 86.76]
  - - [512, 8192, 1, 1024, 512, 512, 1024, 1024]
    - [31, 121.33]
  - - [512, 8192, 1, 2048, 512, 512, 2048, 2048]
    - [21, 149.67]
  - - [512, 8192, 1, 4096, 512, 512, 4096, 4096]
    - [84, 151.74]
  - - [512, 8192, 1, 8192, 512, 512, 8192, 8192]
    - [87, 177.03]
  - - [1024, 128, 1, 128, 1024, 1024, 128, 128]
    - [67, 4.95]
  - - [1024, 128, 1, 256, 1024, 1024, 256, 256]
    - [66, 8.97]
  - - [1024, 128, 1, 512, 1024, 1024, 512, 512]
    - [118, 16.06]
  - - [1024, 128, 1, 1024, 1024, 1024, 1024, 1024]
    - [116, 26.05]
  - - [1024, 128, 1, 2048, 1024, 1024, 2048, 2048]
    - [116, 38.04]
  - - [1024, 128, 1, 4096, 1024, 1024, 4096, 4096]
    - [116, 49.62]
  - - [1024, 128, 1, 8192, 1024, 1024, 8192, 8192]
    - [134, 59.11]
  - - [1024, 256, 1, 128, 1024, 1024, 128, 128]
    - [14, 8.47]
  - - [1024, 256, 1, 256, 1024, 1024, 256, 256]
    - [62, 15.63]
  - - [1024, 256, 1, 512, 1024, 1024, 512, 512]
    - [113, 26.41]
  - - [1024, 256, 1, 1024, 1024, 1024, 1024, 1024]
    - [113, 41.94]
  - - [1024, 256, 1, 2048, 1024, 1024, 2048, 2048]
    - [112, 59.62]
  - - [1024, 256, 1, 4096, 1024, 1024, 4096, 4096]
    - [113, 76.62]
  - - [1024, 256, 1, 8192, 1024, 1024, 8192, 8192]
    - [133, 86.63]
  - - [1024, 512, 1, 128, 1024, 1024, 128, 128]
    - [55, 14.22]
  - - [1024, 512, 1, 256, 1024, 1024, 256, 256]
    - [58, 25.6]
  - - [1024, 512, 1, 512, 1024, 1024, 512, 512]
    - [57, 42.31]
  - - [1024, 512, 1, 1024, 1024, 1024, 1024, 1024]
    - [108, 63.98]
  - - [1024, 512, 1, 2048, 1024, 1024, 2048, 2048]
    - [108, 87.14]
  - - [1024, 512, 1, 4096, 1024, 1024, 4096, 4096]
    - [124, 105.68]
  - - [1024, 512, 1, 8192, 1024, 1024, 8192, 8192]
    - [127, 115.8]
  - - [1024, 1024, 1, 128, 1024, 1024, 128, 128]
    - [13, 21.09]
  - - [1024, 1024, 1, 256, 1024, 1024, 256, 256]
    - [47, 37.57]
  - - [1024, 1024, 1, 512, 1024, 1024, 512, 512]
    - [47, 60.76]
  - - [1024, 1024, 1, 1024, 1024, 1024, 1024, 1024]
    - [99, 92.23]
  - - [1024, 1024, 1, 2048, 1024, 1024, 2048, 2048]
    - [97, 115.58]
  - - [1024, 1024, 1, 4096, 1024, 1024, 4096, 4096]
    - [97, 121.89]
  - - [1024, 1024, 1, 8192, 1024, 1024, 8192, 8192]
    - [104, 142.0]
  - - [1024, 2048, 1, 128, 1024, 1024, 128, 128]
    - [10, 29.07]
  - - [1024, 2048, 1, 256, 1024, 1024, 256, 256]
    - [39, 50.05]
  - - [1024, 2048, 1, 512, 1024, 1024, 512, 512]
    - [39, 70.7]
  - - [1024, 2048, 1, 1024, 1024, 1024, 1024, 1024]
    - [98, 102.64]
  - - [1024, 2048, 1, 2048, 1024, 1024, 2048, 2048]
    - [106, 127.61]
  - - [1024, 2048, 1, 4096, 1024, 1024, 4096, 4096]
    - [83, 148.05]
  - - [1024, 2048, 1, 8192, 1024, 1024, 8192, 8192]
    - [91, 174.56]
  - - [1024, 4096, 1, 128, 1024, 1024, 128, 128]
    - [7, 32.9]
  - - [1024, 4096, 1, 256, 1024, 1024, 256, 256]
    - [36, 56.21]
  - - [1024, 4096, 1, 512, 1024, 1024, 512, 512]
    - [37, 85.64]
  - - [1024, 4096, 1, 1024, 1024, 1024, 1024, 1024]
    - [32, 119.96]
  - - [1024, 4096, 1, 2048, 1024, 1024, 2048, 2048]
    - [15, 150.24]
  - - [1024, 4096, 1, 4096, 1024, 1024, 4096, 4096]
    - [15, 172.37]
  - - [1024, 4096, 1, 8192, 1024, 1024, 8192, 8192]
    - [15, 193.61]
  - - [1024, 8192, 1, 128, 1024, 1024, 128, 128]
    - [7, 36.53]
  - - [1024, 8192, 1, 256, 1024, 1024, 256, 256]
    - [0, 61.79]
  - - [1024, 8192, 1, 512, 1024, 1024, 512, 512]
    - [36, 92.71]
  - - [1024, 8192, 1, 1024, 1024, 1024, 1024, 1024]
    - [15, 127.2]
  - - [1024, 8192, 1, 2048, 1024, 1024, 2048, 2048]
    - [15, 156.34]
  - - [1024, 8192, 1, 4096, 1024, 1024, 4096, 4096]
    - [15, 176.52]
  - - [1024, 8192, 1, 8192, 1024, 1024, 8192, 8192]
    - [15, 196.39]
  - - [2048, 128, 1, 128, 2048, 2048, 128, 128]
    - [62, 8.6]
  - - [2048, 128, 1, 256, 2048, 2048, 256, 256]
    - [61, 15.63]
  - - [2048, 128, 1, 512, 2048, 2048, 512, 512]
    - [111, 26.8]
  - - [2048, 128, 1, 1024, 2048, 2048, 1024, 1024]
    - [113, 42.35]
  - - [2048, 128, 1, 2048, 2048, 2048, 2048, 2048]
    - [113, 60.04]
  - - [2048, 128, 1, 4096, 2048, 2048, 4096, 4096]
    - [111, 76.42]
  - - [2048, 128, 1, 8192, 2048, 2048, 8192, 8192]
    - [131, 83.76]
  - - [2048, 256, 1, 128, 2048, 2048, 128, 128]
    - [55, 14.23]
  - - [2048, 256, 1, 256, 2048, 2048, 256, 256]
    - [55, 25.56]
  - - [2048, 256, 1, 512, 2048, 2048, 512, 512]
    - [58, 42.28]
  - - [2048, 256, 1, 1024, 2048, 2048, 1024, 1024]
    - [108, 64.22]
  - - [2048, 256, 1, 2048, 2048, 2048, 2048, 2048]
    - [108, 87.07]
  - - [2048, 256, 1, 4096, 2048, 2048, 4096, 4096]
    - [124, 105.71]
  - - [2048, 256, 1, 8192, 2048, 2048, 8192, 8192]
    - [124, 117.35]
  - - [2048, 512, 1, 128, 2048, 2048, 128, 128]
    - [48, 20.78]
  - - [2048, 512, 1, 256, 2048, 2048, 256, 256]
    - [45, 36.65]
  - - [2048, 512, 1, 512, 2048, 2048, 512, 512]
    - [44, 57.47]
  - - [2048, 512, 1, 1024, 2048, 2048, 1024, 1024]
    - [93, 83.07]
  - - [2048, 512, 1, 2048, 2048, 2048, 2048, 2048]
    - [101, 112.89]
  - - [2048, 512, 1, 4096, 2048, 2048, 4096, 4096]
    - [101, 136.47]
  - - [2048, 512, 1, 8192, 2048, 2048, 8192, 8192]
    - [102, 143.07]
  - - [2048, 1024, 1, 128, 2048, 2048, 128, 128]
    - [9, 28.36]
  - - [2048, 1024, 1, 256, 2048, 2048, 256, 256]
    - [42, 49.23]
  - - [2048, 1024, 1, 512, 2048, 2048, 512, 512]
    - [40, 70.3]
  - - [2048, 1024, 1, 1024, 2048, 2048, 1024, 1024]
    - [86, 98.42]
  - - [2048, 1024, 1, 2048, 2048, 2048, 2048, 2048]
    - [92, 137.39]
  - - [2048, 1024, 1, 4096, 2048, 2048, 4096, 4096]
    - [92, 150.2]
  - - [2048, 1024, 1, 8192, 2048, 2048, 8192, 8192]
    - [92, 176.3]
  - - [2048, 2048, 1, 128, 2048, 2048, 128, 128]
    - [6, 33.17]
  - - [2048, 2048, 1, 256, 2048, 2048, 256, 256]
    - [6, 56.76]
  - - [2048, 2048, 1, 512, 2048, 2048, 512, 512]
    - [29, 84.73]
  - - [2048, 2048, 1, 1024, 2048, 2048, 1024, 1024]
    - [34, 120.77]
  - - [2048, 2048, 1, 2048, 2048, 2048, 2048, 2048]
    - [25, 150.57]
  - - [2048, 2048, 1, 4096, 2048, 2048, 4096, 4096]
    - [90, 154.66]
  - - [2048, 2048, 1, 8192, 2048, 2048, 8192, 8192]
    - [82, 179.07]
  - - [2048, 4096, 1, 128, 2048, 2048, 128, 128]
    - [8, 36.61]
  - - [2048, 4096, 1, 256, 2048, 2048, 256, 256]
    - [0, 62.02]
  - - [2048, 4096, 1, 512, 2048, 2048, 512, 512]
    - [29, 92.23]
  - - [2048, 4096, 1, 1024, 2048, 2048, 1024, 1024]
    - [29, 127.4]
  - - [2048, 4096, 1, 2048, 2048, 2048, 2048, 2048]
    - [25, 155.89]
  - - [2048, 4096, 1, 4096, 2048, 2048, 4096, 4096]
    - [90, 158.18]
  - - [2048, 4096, 1, 8192, 2048, 2048, 8192, 8192]
    - [90, 181.73]
  - - [2048, 8192, 1, 128, 2048, 2048, 128, 128]
    - [1, 39.89]
  - - [2048, 8192, 1, 256, 2048, 2048, 256, 256]
    - [1, 66.65]
  - - [2048, 8192, 1, 512, 2048, 2048, 512, 512]
    - [29, 96.84]
  - - [2048, 8192, 1, 1024, 2048, 2048, 1024, 1024]
    - [25, 131.49]
  - - [2048, 8192, 1, 2048, 2048, 2048, 2048, 2048]
    - [30, 159.11]
  - - [2048, 8192, 1, 4096, 2048, 2048, 4096, 4096]
    - [90, 160.47]
  - - [2048, 8192, 1, 8192, 2048, 2048, 8192, 8192]
    - [92, 183.18]
  - - [4096, 128, 1, 128, 4096, 4096, 128, 128]
    - [54, 14.14]
  - - [4096, 128, 1, 256, 4096, 4096, 256, 256]
    - [53, 25.18]
  - - [4096, 128, 1, 512, 4096, 4096, 512, 512]
    - [52, 41.76]
  - - [4096, 128, 1, 1024, 4096, 4096, 1024, 1024]
    - [110, 62.41]
  - - [4096, 128, 1, 2048, 4096, 4096, 2048, 2048]
    - [109, 85.49]
  - - [4096, 128, 1, 4096, 4096, 4096, 4096, 4096]
    - [129, 96.05]
  - - [4096, 128, 1, 8192, 4096, 4096, 8192, 8192]
    - [128, 115.34]
  - - [4096, 256, 1, 128, 4096, 4096, 128, 128]
    - [50, 20.98]
  - - [4096, 256, 1, 256, 4096, 4096, 256, 256]
    - [50, 37.42]
  - - [4096, 256, 1, 512, 4096, 4096, 512, 512]
    - [50, 60.34]
  - - [4096, 256, 1, 1024, 4096, 4096, 1024, 1024]
    - [94, 91.96]
  - - [4096, 256, 1, 2048, 4096, 4096, 2048, 2048]
    - [101, 115.14]
  - - [4096, 256, 1, 4096, 4096, 4096, 4096, 4096]
    - [101, 122.1]
  - - [4096, 256, 1, 8192, 4096, 4096, 8192, 8192]
    - [105, 141.53]
  - - [4096, 512, 1, 128, 4096, 4096, 128, 128]
    - [12, 28.58]
  - - [4096, 512, 1, 256, 4096, 4096, 256, 256]
    - [42, 49.14]
  - - [4096, 512, 1, 512, 4096, 4096, 512, 512]
    - [43, 69.8]
  - - [4096, 512, 1, 1024, 4096, 4096, 1024, 1024]
    - [98, 100.79]
  - - [4096, 512, 1, 2048, 4096, 4096, 2048, 2048]
    - [88, 126.16]
  - - [4096, 512, 1, 4096, 4096, 4096, 4096, 4096]
    - [88, 149.65]
  - - [4096, 512, 1, 8192, 4096, 4096, 8192, 8192]
    - [85, 175.38]
  - - [4096, 1024, 1, 128, 4096, 4096, 128, 128]
    - [8, 33.18]
  - - [4096, 1024, 1, 256, 4096, 4096, 256, 256]
    - [2, 56.57]
  - - [4096, 1024, 1, 512, 4096, 4096, 512, 512]
    - [20, 85.46]
  - - [4096, 1024, 1, 1024, 4096, 4096, 1024, 1024]
    - [17, 120.39]
  - - [4096, 1024, 1, 2048, 4096, 4096, 2048, 2048]
    - [17, 150.54]
  - - [4096, 1024, 1, 4096, 4096, 4096, 4096, 4096]
    - [23, 172.24]
  - - [4096, 1024, 1, 8192, 4096, 4096, 8192, 8192]
    - [34, 194.51]
  - - [4096, 2048, 1, 128, 4096, 4096, 128, 128]
    - [8, 36.41]
  - - [4096, 2048, 1, 256, 4096, 4096, 256, 256]
    - [2, 61.69]
  - - [4096, 2048, 1, 512, 4096, 4096, 512, 512]
    - [20, 92.19]
  - - [4096, 2048, 1, 1024, 4096, 4096, 1024, 1024]
    - [17, 127.81]
  - - [4096, 2048, 1, 2048, 4096, 4096, 2048, 2048]
    - [17, 156.32]
  - - [4096, 2048, 1, 4096, 4096, 4096, 4096, 4096]
    - [24, 176.02]
  - - [4096, 2048, 1, 8192, 4096, 4096, 8192, 8192]
    - [28, 197.12]
  - - [4096, 4096, 1, 128, 4096, 4096, 128, 128]
    - [2, 39.59]
  - - [4096, 4096, 1, 256, 4096, 4096, 256, 256]
    - [2, 66.25]
  - - [4096, 4096, 1, 512, 4096, 4096, 512, 512]
    - [20, 97.58]
  - - [4096, 4096, 1, 1024, 4096, 4096, 1024, 1024]
    - [17, 132.6]
  - - [4096, 4096, 1, 2048, 4096, 4096, 2048, 2048]
    - [17, 159.81]
  - - [4096, 4096, 1, 4096, 4096, 4096, 4096, 4096]
    - [24, 178.16]
  - - [4096, 4096, 1, 8192, 4096, 4096, 8192, 8192]
    - [26, 198.22]
  - - [4096, 8192, 1, 128, 4096, 4096, 128, 128]
    - [7, 41.78]
  - - [4096, 8192, 1, 256, 4096, 4096, 256, 256]
    - [38, 69.0]
  - - [4096, 8192, 1, 512, 4096, 4096, 512, 512]
    - [26, 100.76]
  - - [4096, 8192, 1, 1024, 4096, 4096, 1024, 1024]
    - [17, 135.72]
  - - [4096, 8192, 1, 2048, 4096, 4096, 2048, 2048]
    - [21, 157.6]
  - - [4096, 8192, 1, 4096, 4096, 4096, 4096, 4096]
    - [21, 176.98]
  - - [4096, 8192, 1, 8192, 4096, 4096, 8192, 8192]
    - [89, 182.19]
  - - [8192, 128, 1, 128, 8192, 8192, 128, 128]
    - [49, 20.69]
  - - [8192, 128, 1, 256, 8192, 8192, 256, 256]
    - [50, 36.92]
  - - [8192, 128, 1, 512, 8192, 8192, 512, 512]
    - [47, 59.91]
  - - [8192, 128, 1, 1024, 8192, 8192, 1024, 1024]
    - [94, 86.63]
  - - [8192, 128, 1, 2048, 8192, 8192, 2048, 2048]
    - [95, 101.2]
  - - [8192, 128, 1, 4096, 8192, 8192, 4096, 4096]
    - [97, 120.89]
  - - [8192, 128, 1, 8192, 8192, 8192, 8192, 8192]
    - [94, 139.05]
  - - [8192, 256, 1, 128, 8192, 8192, 128, 128]
    - [40, 28.19]
  - - [8192, 256, 1, 256, 8192, 8192, 256, 256]
    - [40, 48.79]
  - - [8192, 256, 1, 512, 8192, 8192, 512, 512]
    - [40, 70.05]
  - - [8192, 256, 1, 1024, 8192, 8192, 1024, 1024]
    - [81, 95.74]
  - - [8192, 256, 1, 2048, 8192, 8192, 2048, 2048]
    - [77, 124.15]
  - - [8192, 256, 1, 4096, 8192, 8192, 4096, 4096]
    - [85, 147.52]
  - - [8192, 256, 1, 8192, 8192, 8192, 8192, 8192]
    - [77, 174.11]
  - - [8192, 512, 1, 128, 8192, 8192, 128, 128]
    - [11, 32.92]
  - - [8192, 512, 1, 256, 8192, 8192, 256, 256]
    - [40, 56.27]
  - - [8192, 512, 1, 512, 8192, 8192, 512, 512]
    - [37, 84.49]
  - - [8192, 512, 1, 1024, 8192, 8192, 1024, 1024]
    - [36, 119.57]
  - - [8192, 512, 1, 2048, 8192, 8192, 2048, 2048]
    - [25, 150.3]
  - - [8192, 512, 1, 4096, 8192, 8192, 4096, 4096]
    - [89, 154.19]
  - - [8192, 512, 1, 8192, 8192, 8192, 8192, 8192]
    - [80, 179.11]
  - - [8192, 1024, 1, 128, 8192, 8192, 128, 128]
    - [11, 36.34]
  - - [8192, 1024, 1, 256, 8192, 8192, 256, 256]
    - [40, 61.79]
  - - [8192, 1024, 1, 512, 8192, 8192, 512, 512]
    - [19, 90.33]
  - - [8192, 1024, 1, 1024, 8192, 8192, 1024, 1024]
    - [16, 126.68]
  - - [8192, 1024, 1, 2048, 8192, 8192, 2048, 2048]
    - [16, 155.53]
  - - [8192, 1024, 1, 4096, 8192, 8192, 4096, 4096]
    - [22, 175.71]
  - - [8192, 1024, 1, 8192, 8192, 8192, 8192, 8192]
    - [33, 196.72]
  - - [8192, 2048, 1, 128, 8192, 8192, 128, 128]
    - [4, 39.23]
  - - [8192, 2048, 1, 256, 8192, 8192, 256, 256]
    - [4, 66.09]
  - - [8192, 2048, 1, 512, 8192, 8192, 512, 512]
    - [18, 96.15]
  - - [8192, 2048, 1, 1024, 8192, 8192, 1024, 1024]
    - [30, 131.65]
  - - [8192, 2048, 1, 2048, 8192, 8192, 2048, 2048]
    - [30, 159.7]
  - - [8192, 2048, 1, 4096, 8192, 8192, 4096, 4096]
    - [21, 178.16]
  - - [8192, 2048, 1, 8192, 8192, 8192, 8192, 8192]
    - [26, 198.26]
  - - [8192, 4096, 1, 128, 8192, 8192, 128, 128]
    - [0, 43.86]
  - - [8192, 4096, 1, 256, 8192, 8192, 256, 256]
    - [0, 71.95]
  - - [8192, 4096, 1, 512, 8192, 8192, 512, 512]
    - [15, 100.61]
  - - [8192, 4096, 1, 1024, 8192, 8192, 1024, 1024]
    - [16, 136.13]
  - - [8192, 4096, 1, 2048, 8192, 8192, 2048, 2048]
    - [21, 156.48]
  - - [8192, 4096, 1, 4096, 8192, 8192, 4096, 4096]
    - [21, 176.05]
  - - [8192, 4096, 1, 8192, 8192, 8192, 8192, 8192]
    - [26, 188.46]
  - - [8192, 8192, 1, 128, 8192, 8192, 128, 128]
    - [3, 36.83]
  - - [8192, 8192, 1, 256, 8192, 8192, 256, 256]
    - [15, 64.08]
  - - [8192, 8192, 1, 512, 8192, 8192, 512, 512]
    - [26, 91.81]
  - - [8192, 8192, 1, 1024, 8192, 8192, 1024, 1024]
    - [21, 122.53]
  - - [8192, 8192, 1, 2048, 8192, 8192, 2048, 2048]
    - [30, 149.14]
  - - [8192, 8192, 1, 4096, 8192, 8192, 4096, 4096]
    - [21, 166.52]
  - - [8192, 8192, 1, 8192, 8192, 8192, 8192, 8192]
    - [27, 186.24]
  - - [1, 1, 1, 32, 1, 1, 32, 32]
    - [137, 0.0]
- null
- null
- ExperimentalStreamK
- GridBased
