projects/hipblaslt/library/src/amd_detail/rocblaslt/src/Tensile/Logic/asm_full/gfx1250/GridBased/gfx1250_Cijk_Ailk_Bjlk_B8_SS_BH_Bias_SHB_HA_S_SAB_SAV_UserArgs.yaml
- {MinimumRequiredVersion: 5.0.0}
- gfx1250
- gfx1250
- [Device 73f0]
    SolutionIndex: 0
    SolutionNameMin: Cijk_Ailk_Bjlk_B8_SS_BH_Bias_SHB_HA_S_SAB_SAV_UserArgs_MT16x16x128_MI16x16x1_SN_LDSB0_AFC1_AFEM1_AFEM1_ASEM1_CLR1_CADS0_DTVA0_DTVB0_EPS0_FDSI0_GRPM1_GRVWA1_GRVWB1_GSU1_GSUAMB_GSUC0_GSUWGMRR0_GLS0_ISA1250_IU1_K1_LDSTI0_LBSPPA256_LBSPPB256_LBSPPM0_LPA16_LPB16_LPM0_LRVW16_LWPMn1_MIAV1_MIWT1_1_MO40_NTn1_NTA0_NTB0_NTC0_NTD0_NTM0_NEPBS0_NLCA1_NLCB1_ONLL0_PGR2_PLR1_PKA0_SIA3_SS0_SU0_SUM0_SUS128_SPO0_SRVW0_SSO0_SVW8_SK0_SKXCCM0_TLDS0_ULSGRO0_USL1_UIOFGRO0_USFGROn1_VSn1_VWA1_VWB1_WSGRA0_WSGRB0_WS32_WG16_2_1_WGM1_WGMXCC1_WGMXCCGn1
- - - [1, 1, 1, 1, 1, 1, 1, 1]
    - [0, 0.0]
  - - [1, 1, 1, 512, 1, 1, 1, 1]
    - [0, 0.0]
  - - [1, 1024, 1, 512, 1, 1, 1, 1024]
    - [0, 0.0]
  - - [1024, 1, 1, 512, 1024, 1024, 1024, 1]
    - [0, 0.0]
  - - [1, 1, 1, 63, 1, 1, 1, 1]
    - [0, 0.0]
  - - [1, 1, 1, 64, 1, 1, 1, 1]
    - [0, 0.0]
  - - [1, 1, 1, 65, 1, 1, 1, 1]
    - [0, 0.0]
  - - [1, 1, 1, 127, 1, 1, 1, 1]
    - [0, 0.0]
  - - [1, 1, 1, 128, 1, 1, 1, 1]
    - [0, 0.0]
  - - [1, 1, 1, 129, 1, 1, 1, 1]
    - [0, 0.0]
  - - [1, 1, 1, 255, 1, 1, 1, 1]
    - [0, 0.0]
  - - [1, 1, 1, 256, 1, 1, 1, 1]
    - [0, 0.0]
  - - [1, 1, 1, 257, 1, 1, 1, 1]
    - [0, 0.0]
  - - [63, 1, 1, 1, 63, 63, 63, 1]
    - [0, 0.0]
  - - [64, 1, 1, 1, 64, 64, 64, 1]
    - [0, 0.0]
  - - [65, 1, 1, 1, 65, 65, 65, 1]
    - [0, 0.0]
  - - [127, 1, 1, 1, 127, 127, 127, 1]
    - [0, 0.0]
  - - [128, 1, 1, 1, 128, 128, 128, 1]
    - [0, 0.0]
  - - [129, 1, 1, 1, 129, 129, 129, 1]
    - [0, 0.0]
  - - [255, 1, 1, 1, 255, 255, 255, 1]
    - [0, 0.0]
  - - [256, 1, 1, 1, 256, 256, 256, 1]
    - [0, 0.0]
  - - [257, 1, 1, 1, 257, 257, 257, 1]
    - [0, 0.0]
  - - [1, 63, 1, 1, 1, 1, 1, 63]
    - [0, 0.0]
  - - [1, 64, 1, 1, 1, 1, 1, 64]
    - [0, 0.0]
  - - [1, 65, 1, 1, 1, 1, 1, 65]
    - [0, 0.0]
  - - [1, 127, 1, 1, 1, 1, 1, 127]
    - [0, 0.0]
  - - [1, 128, 1, 1, 1, 1, 1, 128]
    - [0, 0.0]
  - - [1, 129, 1, 1, 1, 1, 1, 129]
    - [0, 0.0]
  - - [1, 255, 1, 1, 1, 1, 1, 255]
    - [0, 0.0]
  - - [1, 256, 1, 1, 1, 1, 1, 256]
    - [0, 0.0]
  - - [1, 257, 1, 1, 1, 1, 1, 257]
    - [0, 0.0]
- null
- null
- DeviceEfficiency
- GridBased
