projects/hipblaslt/library/src/amd_detail/rocblaslt/src/Tensile/Logic/asm_full/gfx1250/GridBased/gfx1250_Cijk_Ailk_Bljk_H_HS_BH_Bias_AuxH_HA_S_SAV_UserArgs.yaml
- {MinimumRequiredVersion: 4.33.0}
- gfx1250
- gfx1250
- [Device 73f0]
    SolutionIndex: 0
    SolutionNameMin: Cijk_Ailk_Bljk_H_HS_BH_Bias_HA_S_SAV_UserArgs_MT32x16x32_MI16x16x1_SN_LDSB0_AFC1_AFEM1_AFEM1_ASEM1_CLR1_CADS0_DTVA0_DTVB0_EPS0_FDSI0_GRPM1_GRVWA1_GRVWB1_GSU1_GSUAMB_GSUC0_GSUWGMRR0_GLS0_ISA1250_IU1_K1_LDSTI0_LBSPPA512_LBSPPB128_LBSPPM0_LPA16_LPB16_LPM0_LRVW8_LWPMn1_MIAV1_MIWT1_1_MO40_NTn1_NTA0_NTB0_NTC0_NTD0_NTM0_NEPBS0_NLCA1_NLCB1_ONLL1_PGR2_PLR0_PKA0_SIA3_SS0_SU0_SUM0_SUS64_SPO0_SRVW0_SSO0_SVW8_SK0_SKXCCM0_TLDS1_ULSGRO0_USL1_UIOFGRO0_USFGROn1_VSn1_VWA1_VWB1_WSGRA0_WSGRB0_WS32_WG32_2_1_WGM1_WGMXCC1_WGMXCCGn1
- - - [1, 1, 1, 1, 1, 1, 1, 1]
    - [0, .inf]
  - - [1, 1, 1, 512, 1, 1, 1, 512]
    - [0, .inf]
  - - [1, 1024, 1, 512, 1, 1, 1, 512]
    - [0, .inf]
  - - [1024, 1, 1, 512, 1024, 1024, 1024, 512]
    - [0, .inf]
  - - [1, 1, 1, 63, 1, 1, 1, 63]
    - [0, .inf]
  - - [1, 1, 1, 64, 1, 1, 1, 64]
    - [0, .inf]
  - - [1, 1, 1, 65, 1, 1, 1, 65]
    - [0, .inf]
  - - [1, 1, 1, 127, 1, 1, 1, 127]
    - [0, .inf]
  - - [1, 1, 1, 128, 1, 1, 1, 128]
    - [0, .inf]
  - - [1, 1, 1, 129, 1, 1, 1, 129]
    - [0, .inf]
  - - [1, 1, 1, 255, 1, 1, 1, 255]
    - [0, .inf]
  - - [1, 1, 1, 256, 1, 1, 1, 256]
    - [0, .inf]
  - - [1, 1, 1, 257, 1, 1, 1, 257]
    - [0, .inf]
  - - [63, 1, 1, 1, 63, 63, 63, 1]
    - [0, .inf]
  - - [64, 1, 1, 1, 64, 64, 64, 1]
    - [0, .inf]
  - - [65, 1, 1, 1, 65, 65, 65, 1]
    - [0, .inf]
  - - [127, 1, 1, 1, 127, 127, 127, 1]
    - [0, .inf]
  - - [128, 1, 1, 1, 128, 128, 128, 1]
    - [0, .inf]
  - - [129, 1, 1, 1, 129, 129, 129, 1]
    - [0, .inf]
  - - [255, 1, 1, 1, 255, 255, 255, 1]
    - [0, .inf]
  - - [256, 1, 1, 1, 256, 256, 256, 1]
    - [0, .inf]
  - - [257, 1, 1, 1, 257, 257, 257, 1]
    - [0, .inf]
  - - [1, 63, 1, 1, 1, 1, 1, 1]
    - [0, .inf]
  - - [1, 64, 1, 1, 1, 1, 1, 1]
    - [0, .inf]
  - - [1, 65, 1, 1, 1, 1, 1, 1]
    - [0, .inf]
  - - [1, 127, 1, 1, 1, 1, 1, 1]
    - [0, .inf]
  - - [1, 128, 1, 1, 1, 1, 1, 1]
    - [0, .inf]
  - - [1, 129, 1, 1, 1, 1, 1, 1]
    - [0, .inf]
  - - [1, 255, 1, 1, 1, 1, 1, 1]
    - [0, .inf]
  - - [1, 256, 1, 1, 1, 1, 1, 1]
    - [0, .inf]
  - - [1, 257, 1, 1, 1, 1, 1, 1]
    - [0, .inf]
  - - [8, 8, 1, 8, 8, 8, 8, 8]
    - [0, .inf]
  - - [16, 16, 1, 16, 16, 16, 16, 16]
    - [0, .inf]
  - - [128, 128, 1, 128, 128, 128, 128, 128]
    - [0, .inf]
- null
- null
- DeviceEfficiency
- GridBased
