projects/hipblaslt/library/src/amd_detail/rocblaslt/src/Tensile/Logic/asm_full/aquavanjaram/gfx942_80cu/GridBased/aquavanjaram_Cijk_Ailk_Bljk_S_MX_B_Bias_HA_SAV_UserArgs.yaml
- {MinimumRequiredVersion: 5.0.0}
- aquavanjaram
- {Architecture: gfx942, CUCount: 80}
- [Device 0049, Device 0050]
    SolutionIndex: 0
    SolutionNameMin: Cijk_Ailk_Bljk_S_MX_B_Bias_HA_SAV_UserArgs_MT16x16x64_MI16x16x1_SN_LDSB1_GRVWB4_GSU16_LBSPPB256_MIWT1_1_NLCB1_SU0_SUM0_SUS0_WG16_4_4_WGM1
    SolutionIndex: 1
    SolutionNameMin: Cijk_Ailk_Bljk_S_MX_B_Bias_HA_SAV_UserArgs_MT16x16x128_MI16x16x1_SN_LDSB0_GRVWB4_GSU16_LBSPPB512_MIWT1_1_NLCB1_SU0_SUM0_SUS0_WG16_4_4_WGM1
    SolutionIndex: 2
    SolutionNameMin: Cijk_Ailk_Bljk_S_MX_B_Bias_HA_SAV_UserArgs_MT16x16x128_MI16x16x1_SN_LDSB0_GRVWB4_GSU28_LBSPPB512_MIWT1_1_NLCB1_SU0_SUM0_SUS0_WG16_4_4_WGM1
    SolutionIndex: 3
    SolutionNameMin: Cijk_Ailk_Bljk_S_MX_B_Bias_HA_SAV_UserArgs_MT16x16x256_MI16x16x1_SN_LDSB1_GRVWB4_GSU1_LBSPPA256_LBSPPB1024_LPA16_MIWT1_1_NLCB1_SU0_SUM0_SUS0_SVW1_VWA1_WG16_4_4_WGM1
    SolutionIndex: 4
    SolutionNameMin: Cijk_Ailk_Bljk_S_MX_B_Bias_HA_SAV_UserArgs_MT16x16x256_MI16x16x1_SN_LDSB1_GRVWB4_GSU16_LBSPPA256_LBSPPB1024_LPA16_MIWT1_1_NLCB1_SU0_SUM0_SUS0_SVW1_VWA1_WG16_4_4_WGM1
    SolutionIndex: 5
    SolutionNameMin: Cijk_Ailk_Bljk_S_MX_B_Bias_HA_SAV_UserArgs_MT16x16x128_MI16x16x1_SN_LDSB1_GRVWB4_GSU16_LBSPPA256_LBSPPB512_LPA16_MIWT1_1_NLCB1_SU0_SUM0_SUS0_SVW1_VWA1_WG16_4_4_WGM1
    SolutionIndex: 6
    SolutionNameMin: Cijk_Ailk_Bljk_S_MX_B_Bias_HA_SAV_UserArgs_MT32x16x128_MI16x16x1_SN_LDSB0_GRVWB4_GSU16_LBSPPA512_LBSPPB512_LPA16_MIWT1_1_NLCB1_SU0_SUM0_SUS0_SVW1_VWA1_WG32_4_2_WGM1
    SolutionIndex: 7
    SolutionNameMin: Cijk_Ailk_Bljk_S_MX_B_Bias_HA_SAV_UserArgs_MT32x16x128_MI16x16x1_SN_LDSB0_GRVWB4_GSU26_LBSPPA512_LBSPPB512_LPA16_MIWT1_1_NLCB1_SU0_SUM0_SUS0_SVW1_VWA1_WG32_4_2_WGM1
    SolutionIndex: 8
    SolutionNameMin: Cijk_Ailk_Bljk_S_MX_B_Bias_HA_SAV_UserArgs_MT32x16x128_MI16x16x1_SN_LDSB1_GRVWB4_GSU16_LBSPPA512_LBSPPB512_LPA16_MIWT1_1_NLCB1_SU0_SUM0_SUS0_SVW1_VWA1_WG32_4_2_WGM1
    SolutionIndex: 9
    SolutionNameMin: Cijk_Ailk_Bljk_S_MX_B_Bias_HA_SAV_UserArgs_MT32x16x32_MI16x16x1_SN_LDSB1_GRVWB4_GSU16_LBSPPA512_LBSPPB128_LPA16_MIWT1_1_NLCB1_SU0_SUM0_SUS0_SVW1_VWA1_WG32_4_1_WGM1
    SolutionIndex: 10
    SolutionNameMin: Cijk_Ailk_Bljk_S_MX_B_Bias_HA_SAV_UserArgs_MT32x16x64_MI16x16x1_SN_LDSB1_GRVWB4_GSU16_LBSPPA512_LBSPPB256_LPA16_MIWT1_1_NLCB1_SU0_SUM0_SUS0_SVW1_VWA1_WG32_4_1_WGM1
    SolutionIndex: 11
    SolutionNameMin: Cijk_Ailk_Bljk_S_MX_B_Bias_HA_SAV_UserArgs_MT64x16x64_MI16x16x1_SN_LDSB0_GRVWB4_GSU29_LBSPPA1024_LBSPPB256_LPA16_MIWT1_1_NLCB1_SU0_SUM0_SUS0_SVW1_VWA1_WG64_4_1_WGM1
    SolutionIndex: 12
    SolutionNameMin: Cijk_Ailk_Bljk_S_MX_B_Bias_HA_SAV_UserArgs_MT64x16x64_MI16x16x1_SN_LDSB0_GRVWB4_GSU22_LBSPPA1024_LBSPPB256_LPA16_MIWT1_1_NLCB1_SU0_SUM0_SUS0_SVW1_VWA1_WG64_4_1_WGM1
    SolutionIndex: 13
    SolutionNameMin: Cijk_Ailk_Bljk_S_MX_B_Bias_HA_SAV_UserArgs_MT64x16x128_MI16x16x1_SN_LDSB1_GRVWB4_GSU24_LBSPPA1024_LBSPPB512_LPA16_MIWT1_1_NLCB1_SU0_SUM0_SUS0_SVW1_VWA1_WG64_4_1_WGM1
    SolutionIndex: 14
    SolutionNameMin: Cijk_Ailk_Bljk_S_MX_B_Bias_HA_SAV_UserArgs_MT64x16x64_MI16x16x1_SN_LDSB0_GRVWB4_GSU16_LBSPPA1024_LBSPPB256_LPA16_MIWT1_1_NLCA1_NLCB1_SU0_SUM0_SUS0_SVW1_VWA1_WG64_4_1_WGM1
    SolutionIndex: 15
    SolutionNameMin: Cijk_Ailk_Bljk_S_MX_B_Bias_HA_SAV_UserArgs_MT64x16x64_MI16x16x1_SN_LDSB0_GRVWB4_GSU20_LBSPPA1024_LBSPPB256_LPA16_MIWT1_1_NLCA1_NLCB1_SU0_SUM0_SUS0_SVW1_VWA1_WG64_4_1_WGM1
    SolutionIndex: 16
    SolutionNameMin: Cijk_Ailk_Bljk_S_MX_B_Bias_HA_SAV_UserArgs_MT32x16x32_MI16x16x1_SN_LDSB1_GRVWB4_GSU13_LBSPPA512_LBSPPB128_LPA16_MIWT1_1_NLCA1_NLCB1_SU0_SUM0_SUS0_SVW1_VWA1_WG32_4_1_WGM1
    SolutionIndex: 17
    SolutionNameMin: Cijk_Ailk_Bljk_S_MX_B_Bias_HA_SAV_UserArgs_MT64x16x64_MI16x16x1_SN_LDSB1_GRVWB4_GSU13_LBSPPA1024_LBSPPB256_LPA16_MIWT1_1_NLCA1_NLCB1_SU0_SUM0_SUS0_SVW1_VWA1_WG64_4_1_WGM1
    SolutionIndex: 18
    SolutionNameMin: Cijk_Ailk_Bljk_S_MX_B_Bias_HA_SAV_UserArgs_MT128x16x64_MI16x16x1_SN_LDSB1_GRVWB4_GSU25_LBSPPA2048_LBSPPB256_LPA0_MIWT2_1_NLCA1_NLCB1_SU0_SUM0_SUS0_SVW2_VWA2_WG64_4_1_WGM1
    SolutionIndex: 19
    SolutionNameMin: Cijk_Ailk_Bljk_S_MX_B_Bias_HA_SAV_UserArgs_MT64x16x64_MI16x16x1_SN_GRVWB4_GSU8_LBSPPA1024_LBSPPB256_LPA16_MIWT1_1_NLCA1_NLCB1_SU0_SUM0_SUS0_SVW1_VWA1_WG64_4_1_WGM1
    SolutionIndex: 20
    SolutionNameMin: Cijk_Ailk_Bljk_S_MX_B_Bias_HA_SAV_UserArgs_MT128x16x64_MI16x16x1_SN_GRVWB4_GSU16_LBSPPA2048_LBSPPB256_LPA0_MIWT2_1_NLCA1_NLCB1_SU0_SUM0_SUS0_SVW2_VWA2_WG64_4_1_WGM1
    SolutionIndex: 21
    SolutionNameMin: Cijk_Ailk_Bljk_S_MX_B_Bias_HA_SAV_UserArgs_MT128x16x64_MI16x16x1_SN_GRVWB4_GSU20_LBSPPA2048_LBSPPB256_LPA0_MIWT2_1_NLCA1_NLCB1_SU0_SUM0_SUS0_SVW2_VWA2_WG64_4_1_WGM1
    SolutionIndex: 22
    SolutionNameMin: Cijk_Ailk_Bljk_S_MX_B_Bias_HA_SAV_UserArgs_MT64x16x64_MI16x16x1_SN_GRVWB4_GSU6_LBSPPA1024_LBSPPB256_LPA16_MIWT1_1_NLCA1_NLCB1_SU0_SUM0_SUS0_SVW1_VWA1_WG64_4_1_WGM1
    SolutionIndex: 23
    SolutionNameMin: Cijk_Ailk_Bljk_S_MX_B_Bias_HA_SAV_UserArgs_MT128x16x64_MI16x16x1_SN_GRVWB4_GSU13_LBSPPA2048_LBSPPB256_LPA0_MIWT2_1_NLCA1_NLCB1_SU0_SUM0_SUS0_SVW2_VWA2_WG64_4_1_WGM1
    SolutionIndex: 24
    SolutionNameMin: Cijk_Ailk_Bljk_S_MX_B_Bias_HA_SAV_UserArgs_MT192x16x64_MI16x16x1_SN_GRVWB4_GSU20_LBSPPA3072_LBSPPB256_LPA16_MIWT3_1_NLCA3_NLCB1_SU0_SUM0_SUS0_SVW1_VWA1_WG64_4_1_WGM1
    SolutionIndex: 25
    SolutionNameMin: Cijk_Ailk_Bljk_S_MX_B_Bias_HA_SAV_UserArgs_MT64x16x64_MI16x16x1_SN_GRVWB4_GSU4_LBSPPA1024_LBSPPB256_LPA16_MIWT1_1_NLCA1_NLCB1_SU0_SUM0_SUS0_SVW1_VWA1_WG64_4_1_WGM1
    SolutionIndex: 26
    SolutionNameMin: Cijk_Ailk_Bljk_S_MX_B_Bias_HA_SAV_UserArgs_MT64x16x64_MI16x16x1_SN_GRVWB4_GSU10_LBSPPA1024_LBSPPB256_LPA16_MIWT1_1_NLCA1_NLCB1_SU0_SUM0_SUS0_SVW1_VWA1_WG64_4_1_WGM1
    SolutionIndex: 27
    SolutionNameMin: Cijk_Ailk_Bljk_S_MX_B_Bias_HA_SAV_UserArgs_MT128x16x32_MI16x16x1_SN_GRVWB1_GSU20_LBSPPA2048_LBSPPB128_LPA0_MIWT2_1_NLCA1_NLCB1_SU0_SUM0_SUS0_SVW2_VWA2_WG64_4_1_WGM1
    SolutionIndex: 28
    SolutionNameMin: Cijk_Ailk_Bljk_S_MX_B_Bias_HA_SAV_UserArgs_MT320x16x32_MI16x16x1_SN_GRVWB1_GSU16_LBSPPA5120_LBSPPB128_LPA16_MIWT5_1_NLCA5_NLCB1_SU0_SUM0_SUS0_SVW1_VWA1_WG64_4_1_WGM1
    SolutionIndex: 29
    SolutionNameMin: Cijk_Ailk_Bljk_S_MX_B_Bias_HA_SAV_UserArgs_MT192x16x32_MI16x16x1_SN_GRVWB1_GSU20_LBSPPA3072_LBSPPB128_LPA16_MIWT3_1_NLCA3_NLCB1_SU0_SUM0_SUS0_SVW1_VWA1_WG64_4_1_WGM1
    SolutionIndex: 30
    SolutionNameMin: Cijk_Ailk_Bljk_S_MX_B_Bias_HA_SAV_UserArgs_MT32x16x128_MI16x16x1_SN_GRVWB4_GSU1_LBSPPA512_LBSPPB512_LPA16_MIWT1_1_NLCA1_NLCB1_SU0_SUM0_SUS0_SVW1_VWA1_WG32_4_2_WGM1
    SolutionIndex: 31
    SolutionNameMin: Cijk_Ailk_Bljk_S_MX_B_Bias_HA_SAV_UserArgs_MT128x16x64_MI16x16x1_SN_GRVWB4_GSU5_LBSPPA2048_LBSPPB256_LPA0_MIWT2_1_NLCA1_NLCB1_SU0_SUM0_SUS0_SVW2_VWA2_WG64_4_1_WGM1
    SolutionIndex: 32
    SolutionNameMin: Cijk_Ailk_Bljk_S_MX_B_Bias_HA_SAV_UserArgs_MT192x16x32_MI16x16x1_SN_GRVWB1_GSU14_LBSPPA3072_LBSPPB128_LPA16_MIWT3_1_NLCA3_NLCB1_SU0_SUM0_SUS0_SVW1_VWA1_WG64_4_1_WGM1
    SolutionIndex: 33
    SolutionNameMin: Cijk_Ailk_Bljk_S_MX_B_Bias_HA_SAV_UserArgs_MT64x16x64_MI16x16x1_SN_GRVWB4_GSU3_LBSPPA1024_LBSPPB256_LPA16_MIWT1_1_NLCA1_NLCB1_SU0_SUM0_SUS0_SVW1_VWA1_WG64_4_1_WGM1
    SolutionIndex: 34
    SolutionNameMin: Cijk_Ailk_Bljk_S_MX_B_Bias_HA_SAV_UserArgs_MT320x16x32_MI16x16x1_SN_GRVWB1_GSU8_LBSPPA5120_LBSPPB128_LPA16_MIWT5_1_NLCA5_NLCB1_SU0_SUM0_SUS0_SVW1_VWA1_WG64_4_1_WGM1
    SolutionIndex: 35
    SolutionNameMin: Cijk_Ailk_Bljk_S_MX_B_Bias_HA_SAV_UserArgs_MT192x16x32_MI16x16x1_SN_GRVWB1_GSU10_LBSPPA3072_LBSPPB128_LPA16_MIWT3_1_NLCA3_NLCB1_SU0_SUM0_SUS0_SVW1_VWA1_WG64_4_1_WGM1
    SolutionIndex: 36
    SolutionNameMin: Cijk_Ailk_Bljk_S_MX_B_Bias_HA_SAV_UserArgs_MT64x16x128_MI16x16x1_SN_GRVWB4_GSU1_LBSPPA1024_LBSPPB512_LPA16_MIWT1_1_NTA0_NLCA1_SU0_SUM0_SUS0_SVW1_VWA1_WG64_4_1_WGM1
    SolutionIndex: 37
    SolutionNameMin: Cijk_Ailk_Bljk_S_MX_B_Bias_HA_SAV_UserArgs_MT320x16x32_MI16x16x1_SN_GRVWB1_GSU6_LBSPPA5120_LBSPPB128_LPA16_MIWT5_1_NTA0_NLCA5_SU0_SUM0_SUS0_SVW1_VWA1_WG64_4_1_WGM1
    SolutionIndex: 38
    SolutionNameMin: Cijk_Ailk_Bljk_S_MX_B_Bias_HA_SAV_UserArgs_MT192x16x32_MI16x16x1_SN_GRVWB1_GSU7_LBSPPA3072_LBSPPB128_LPA16_MIWT3_1_NTA0_NLCA3_SU0_SUM0_SUS0_SVW1_VWA1_WG64_4_1_WGM1
    SolutionIndex: 39
    SolutionNameMin: Cijk_Ailk_Bljk_S_MX_B_Bias_HA_SAV_UserArgs_MT320x16x32_MI16x16x1_SN_GRVWB1_GSU4_LBSPPA5120_LBSPPB128_LPA16_MIWT5_1_NTA0_NLCA5_SU0_SUM0_SUS0_SVW1_VWA1_WG64_4_1_WGM1
    SolutionIndex: 40
    SolutionNameMin: Cijk_Ailk_Bljk_S_MX_B_Bias_HA_SAV_UserArgs_MT192x16x32_MI16x16x1_SN_GRVWB1_GSU5_LBSPPA3072_LBSPPB128_LPA16_MIWT3_1_NTA4_NLCA3_SU0_SUM0_SUS0_SVW1_VWA1_WG64_4_1_WGM1
    SolutionIndex: 41
    SolutionNameMin: Cijk_Ailk_Bljk_S_MX_B_Bias_HA_SAV_UserArgs_MT128x16x64_MI16x16x1_SN_CLR1_GRVWB4_GSU1_LBSPPA2048_LBSPPB256_LPA0_LPB8_LRVW4_MIWT2_1_NTA4_NLCA1_PLR1_SU0_SUM0_SUS0_SVW2_VWA2_WG64_4_1_WGM1
    SolutionIndex: 42
    SolutionNameMin: Cijk_Ailk_Bljk_S_MX_B_Bias_HA_SAV_UserArgs_MT320x16x16_MI16x16x1_SN_CLR1_GRVWB1_GSU6_LBSPPA2560_LBSPPB128_LPA16_LPB2_LRVW2_MIWT5_1_NTA0_NLCA5_PLR1_SU0_SUM0_SUS0_SVW1_VWA1_WG64_4_1_WGM1
    SolutionIndex: 43
    SolutionNameMin: Cijk_Ailk_Bljk_S_MX_B_Bias_HA_SAV_UserArgs_MT192x16x64_MI16x16x1_SN_CLR1_GRVWB4_GSU1_LBSPPA3072_LBSPPB256_LPA16_LPB8_LRVW4_MIWT3_1_NTA4_NLCA3_PLR1_SU0_SUM0_SUS0_SVW1_VWA1_WG64_4_1_WGM1
    SolutionIndex: 44
    SolutionNameMin: Cijk_Ailk_Bljk_S_MX_B_Bias_HA_SAV_UserArgs_MT320x16x16_MI16x16x1_SN_CLR1_GRVWB1_GSU4_LBSPPA2560_LBSPPB128_LPA16_LPB2_LRVW2_MIWT5_1_NTA0_NLCA5_PLR1_SU0_SUM0_SUS0_SVW1_VWA1_WG64_4_1_WGM1
    SolutionIndex: 45
    SolutionNameMin: Cijk_Ailk_Bljk_S_MX_B_Bias_HA_SAV_UserArgs_MT448x16x16_MI16x16x1_SN_CLR1_GRVWB1_GSU11_LBSPPA3584_LBSPPB128_LPA16_LPB2_LRVW2_MIWT7_1_NTA0_NLCA7_PLR1_SU0_SUM0_SUS0_SVW1_VWA1_WG64_4_1_WGM1
    SolutionIndex: 46
    SolutionNameMin: Cijk_Ailk_Bljk_S_MX_B_Bias_HA_SAV_UserArgs_MT320x16x16_MI16x16x1_SN_CLR1_GRVWB1_GSU3_LBSPPA2560_LBSPPB128_LPA16_LPB2_LRVW2_MIWT5_1_NTA0_NLCA5_PLR1_SU0_SUM0_SUS0_SVW1_VWA1_WG64_4_1_WGM1
    SolutionIndex: 47
    SolutionNameMin: Cijk_Ailk_Bljk_S_MX_B_Bias_HA_SAV_UserArgs_MT448x16x16_MI16x16x1_SN_CLR1_GRVWB1_GSU6_LBSPPA3584_LBSPPB128_LPA16_LPB2_LRVW2_MIWT7_1_NTA4_NLCA7_PLR1_SU0_SUM0_SUS0_SVW1_VWA1_WG64_4_1_WGM1
    SolutionIndex: 48
    SolutionNameMin: Cijk_Ailk_Bljk_S_MX_B_Bias_HA_SAV_UserArgs_MT128x16x32_MI16x16x1_SN_CLR1_GRVWB1_GSU1_LBSPPA2048_LBSPPB128_LPA0_LPB8_LRVW4_MIWT2_1_NTA4_NLCA1_PLR1_SU0_SUM0_SUS0_SVW2_VWA2_WG64_4_1_WGM1
    SolutionIndex: 49
    SolutionNameMin: Cijk_Ailk_Bljk_S_MX_B_Bias_HA_SAV_UserArgs_MT448x16x16_MI16x16x1_SN_CLR1_GRVWB1_GSU5_LBSPPA3584_LBSPPB128_LPA16_LPB2_LRVW2_MIWT7_1_NTA0_NLCA7_PLR1_SU0_SUM0_SUS0_SVW1_VWA1_WG64_4_1_WGM1
    SolutionIndex: 50
    SolutionNameMin: Cijk_Ailk_Bljk_S_MX_B_Bias_HA_SAV_UserArgs_MT448x16x16_MI16x16x1_SN_CLR1_GRVWB1_GSU10_LBSPPA3584_LBSPPB128_LPA16_LPB2_LRVW2_MIWT7_1_NTA0_NLCA7_PLR1_SU0_SUM0_SUS0_SVW1_VWA1_WG64_4_1_WGM1
    SolutionIndex: 51
    SolutionNameMin: Cijk_Ailk_Bljk_S_MX_B_Bias_HA_SAV_UserArgs_MT320x16x32_MI16x16x1_SN_CLR1_GRVWB1_GSU1_LBSPPA5120_LBSPPB128_LPA16_LPB8_LRVW4_MIWT5_1_NTA4_NLCA5_PLR1_SU0_SUM0_SUS0_SVW1_VWA1_WG64_4_1_WGM1
    SolutionIndex: 52
    SolutionNameMin: Cijk_Ailk_Bljk_S_MX_B_Bias_HA_SAV_UserArgs_MT320x16x16_MI16x16x1_SN_CLR1_GRVWB1_GSU2_LBSPPA2560_LBSPPB128_LPA16_LPB2_LRVW2_MIWT5_1_NTA4_NLCA5_PLR1_SU0_SUM0_SUS0_SVW1_VWA1_WG64_4_1_WGM1
    SolutionIndex: 53
    SolutionNameMin: Cijk_Ailk_Bljk_S_MX_B_Bias_HA_SAV_UserArgs_MT448x16x16_MI16x16x1_SN_CLR1_GRVWB1_GSU7_LBSPPA3584_LBSPPB128_LPA16_LPB2_LRVW2_MIWT7_1_NTA4_NLCA7_PLR1_SU0_SUM0_SUS0_SVW1_VWA1_WG64_4_1_WGM1
    SolutionIndex: 54
    SolutionNameMin: Cijk_Ailk_Bljk_S_MX_B_Bias_HA_SAV_UserArgs_MT448x16x16_MI16x16x1_SN_CLR1_GRVWB1_GSU1_LBSPPA3584_LBSPPB128_LPA16_LPB2_LRVW2_MIWT7_1_NTA0_NLCA7_PLR1_SU0_SUM0_SUS0_SVW1_VWA1_WG64_4_1_WGM1
    SolutionIndex: 55
    SolutionNameMin: Cijk_Ailk_Bljk_S_MX_B_Bias_HA_SAV_UserArgs_MT448x16x16_MI16x16x1_SN_CLR1_GRVWB1_GSU3_LBSPPA3584_LBSPPB128_LPA16_LPB2_LRVW2_MIWT7_1_NTA4_NLCA7_PLR1_SU0_SUM0_SUS0_SVW1_VWA1_WG64_4_1_WGM1
    SolutionIndex: 56
    SolutionNameMin: Cijk_Ailk_Bljk_S_MX_B_Bias_HA_SAV_UserArgs_MT448x16x16_MI16x16x1_SN_CLR1_GRVWB1_GSU4_LBSPPA3584_LBSPPB128_LPA16_LPB2_LRVW2_MIWT7_1_NTA4_NLCA7_PLR1_SU0_SUM0_SUS0_SVW1_VWA1_WG64_4_1_WGM1
    SolutionIndex: 57
    SolutionNameMin: Cijk_Ailk_Bljk_S_MX_B_Bias_HA_SAV_UserArgs_MT16x16x64_MI16x16x1_SN_LDSB0_GRVWB4_GSU16_LBSPPB256_MIWT1_1_NLCB1_SU0_SUM0_SUS0_WG16_4_4_WGM1
    SolutionIndex: 58
    SolutionNameMin: Cijk_Ailk_Bljk_S_MX_B_Bias_HA_SAV_UserArgs_MT16x16x128_MI16x16x1_SN_LDSB1_GRVWB4_GSU16_LBSPPB512_MIWT1_1_NLCB1_SU0_SUM0_SUS0_WG16_4_4_WGM1
    SolutionIndex: 59
    SolutionNameMin: Cijk_Ailk_Bljk_S_MX_B_Bias_HA_SAV_UserArgs_MT16x16x128_MI16x16x1_SN_LDSB0_GRVWB4_GSU19_LBSPPB512_MIWT1_1_NLCB1_SU0_SUM0_SUS0_WG16_4_4_WGM1
    SolutionIndex: 60
    SolutionNameMin: Cijk_Ailk_Bljk_S_MX_B_Bias_HA_SAV_UserArgs_MT16x16x256_MI16x16x1_SN_LDSB1_GRVWB4_GSU1_LBSPPA256_LBSPPB1024_LPA16_LPB8_MIWT1_1_NLCB1_SU0_SUM0_SUS0_SVW1_VWA1_WG16_4_4_WGM1
    SolutionIndex: 61
    SolutionNameMin: Cijk_Ailk_Bljk_S_MX_B_Bias_HA_SAV_UserArgs_MT16x16x128_MI16x16x1_SN_LDSB1_GRVWB4_GSU16_LBSPPA256_LBSPPB512_LPA16_LPB8_MIWT1_1_NLCB1_SU0_SUM0_SUS0_SVW1_VWA1_WG16_4_2_WGM1
    SolutionIndex: 62
    SolutionNameMin: Cijk_Ailk_Bljk_S_MX_B_Bias_HA_SAV_UserArgs_MT16x32x128_MI16x16x1_SN_LDSB0_GRVWB4_GSU26_LBSPPA256_LBSPPB512_LPA16_LPB8_MIWT1_1_NLCB1_SU0_SUM0_SUS0_SVW1_VWA1_WG16_8_2_WGM1
    SolutionIndex: 63
    SolutionNameMin: Cijk_Ailk_Bljk_S_MX_B_Bias_HA_SAV_UserArgs_MT32x16x128_MI16x16x1_SN_LDSB0_GRVWB4_GSU16_LBSPPA512_LBSPPB512_LPA16_LPB8_MIWT1_1_NLCB1_SU0_SUM0_SUS0_SVW1_VWA1_WG32_4_2_WGM1
    SolutionIndex: 64
    SolutionNameMin: Cijk_Ailk_Bljk_S_MX_B_Bias_HA_SAV_UserArgs_MT32x16x64_MI16x16x1_SN_LDSB1_GRVWB4_GSU16_LBSPPA512_LBSPPB256_LPA16_LPB8_MIWT1_1_NLCB1_SU0_SUM0_SUS0_SVW1_VWA1_WG32_4_1_WGM1
    SolutionIndex: 65
    SolutionNameMin: Cijk_Ailk_Bljk_S_MX_B_Bias_HA_SAV_UserArgs_MT32x32x128_MI16x16x1_SN_LDSB1_GRVWB4_GSU26_LBSPPA512_LBSPPB512_LPA16_LPB8_MIWT1_1_NLCB1_SU0_SUM0_SUS0_SVW1_VWA1_WG32_8_1_WGM1
    SolutionIndex: 66
    SolutionNameMin: Cijk_Ailk_Bljk_S_MX_B_Bias_HA_SAV_UserArgs_MT32x16x64_MI16x16x1_SN_LDSB0_GRVWB4_GSU16_LBSPPA512_LBSPPB256_LPA16_LPB8_MIWT1_1_NLCB1_SU0_SUM0_SUS0_SVW1_VWA1_WG32_4_1_WGM1
    SolutionIndex: 67
    SolutionNameMin: Cijk_Ailk_Bljk_S_MX_B_Bias_HA_SAV_UserArgs_MT32x32x64_MI16x16x1_SN_LDSB0_GRVWB4_GSU22_LBSPPA512_LBSPPB256_LPA16_LPB8_MIWT1_1_NLCB1_SU0_SUM0_SUS0_SVW1_VWA1_WG32_8_1_WGM1
    SolutionIndex: 68
    SolutionNameMin: Cijk_Ailk_Bljk_S_MX_B_Bias_HA_SAV_UserArgs_MT32x16x256_MI16x16x1_SN_LDSB1_GRVWB4_GSU13_LBSPPA512_LBSPPB1024_LPA16_LPB8_MIWT1_1_NLCB1_SU0_SUM0_SUS0_SVW1_VWA1_WG32_4_2_WGM1
    SolutionIndex: 69
    SolutionNameMin: Cijk_Ailk_Bljk_S_MX_B_Bias_HA_SAV_UserArgs_MT32x32x64_MI16x16x1_SN_LDSB0_GRVWB4_GSU16_LBSPPA512_LBSPPB256_LPA16_LPB8_MIWT1_1_NLCA1_NLCB1_SU0_SUM0_SUS0_SVW1_VWA1_WG32_8_1_WGM1
    SolutionIndex: 70
    SolutionNameMin: Cijk_Ailk_Bljk_S_MX_B_Bias_HA_SAV_UserArgs_MT64x16x64_MI16x16x1_SN_LDSB0_GRVWB4_GSU16_LBSPPA1024_LBSPPB256_LPA16_LPB8_MIWT1_1_NLCA1_NLCB1_SU0_SUM0_SUS0_SVW1_VWA1_WG64_4_1_WGM1
    SolutionIndex: 71
    SolutionNameMin: Cijk_Ailk_Bljk_S_MX_B_Bias_HA_SAV_UserArgs_MT64x16x128_MI16x16x1_SN_LDSB1_GRVWB4_GSU19_LBSPPA1024_LBSPPB512_LPA16_LPB8_MIWT1_1_NLCA1_NLCB1_SU0_SUM0_SUS0_SVW1_VWA1_WG64_4_1_WGM1
    SolutionIndex: 72
    SolutionNameMin: Cijk_Ailk_Bljk_S_MX_B_Bias_HA_SAV_UserArgs_MT16x16x256_MI16x16x1_SN_LDSB1_GRVWB4_GSU1_LBSPPA256_LBSPPB1024_LPA16_LPB8_MIWT1_1_NLCA1_NLCB1_SU0_SUM0_SUS0_SVW1_VWA1_WG16_4_4_WGM1
    SolutionIndex: 73
    SolutionNameMin: Cijk_Ailk_Bljk_S_MX_B_Bias_HA_SAV_UserArgs_MT32x32x64_MI16x16x1_SN_LDSB0_GRVWB4_GSU13_LBSPPA512_LBSPPB256_LPA16_LPB8_MIWT1_1_NLCA1_NLCB1_SU0_SUM0_SUS0_SVW1_VWA1_WG32_8_1_WGM1
    SolutionIndex: 74
    SolutionNameMin: Cijk_Ailk_Bljk_S_MX_B_Bias_HA_SAV_UserArgs_MT64x32x64_MI16x16x1_SN_LDSB0_GRVWB4_GSU24_LBSPPA1024_LBSPPB256_LPA16_LPB8_MIWT1_2_NLCA1_NLCB1_SU0_SUM0_SUS0_SVW1_VWA1_WG64_4_1_WGM1
    SolutionIndex: 75
    SolutionNameMin: Cijk_Ailk_Bljk_S_MX_B_Bias_HA_SAV_UserArgs_MT32x32x64_MI16x16x1_SN_LDSB0_GRVWB4_GSU8_LBSPPA512_LBSPPB256_LPA16_LPB8_MIWT1_1_NLCA1_NLCB1_SU0_SUM0_SUS0_SVW1_VWA1_WG32_8_1_WGM1
    SolutionIndex: 76
    SolutionNameMin: Cijk_Ailk_Bljk_S_MX_B_Bias_HA_SAV_UserArgs_MT64x32x64_MI16x16x1_SN_LDSB0_GRVWB4_GSU16_LBSPPA1024_LBSPPB256_LPA16_LPB8_MIWT1_2_NLCA1_NLCB1_SU0_SUM0_SUS0_SVW1_VWA1_WG64_4_1_WGM1
    SolutionIndex: 77
    SolutionNameMin: Cijk_Ailk_Bljk_S_MX_B_Bias_HA_SAV_UserArgs_MT64x32x64_MI32x32x1_SN_LDSB0_GRVWB4_GSU20_LBSPPA0_LBSPPB256_LPA0_LPB4_MIWT1_1_NLCA1_NLCB1_SU0_SUM0_SUS0_SVW1_VWA1_WG64_2_1_WGM1
    SolutionIndex: 78
    SolutionNameMin: Cijk_Ailk_Bljk_S_MX_B_Bias_HA_SAV_UserArgs_MT16x16x128_MI16x16x1_SN_LDSB1_GRVWB4_GSU1_LBSPPA256_LBSPPB512_LPA16_LPB8_MIWT1_1_NLCA1_NLCB1_SU0_SUM0_SUS0_SVW1_VWA1_WG16_4_4_WGM1
    SolutionIndex: 79
    SolutionNameMin: Cijk_Ailk_Bljk_S_MX_B_Bias_HA_SAV_UserArgs_MT64x32x64_MI16x16x1_SN_LDSB0_GRVWB4_GSU13_LBSPPA1024_LBSPPB256_LPA16_LPB8_MIWT1_2_NLCA1_NLCB1_SU0_SUM0_SUS0_SVW1_VWA1_WG64_4_1_WGM1
    SolutionIndex: 80
    SolutionNameMin: Cijk_Ailk_Bljk_S_MX_B_Bias_HA_SAV_UserArgs_MT128x32x64_MI32x32x1_SN_LDSB1_GRVWB4_GSU25_LBSPPA0_LBSPPB256_LPA0_LPB4_MIWT1_1_NLCA1_NLCB1_SU0_SUM0_SUS0_SVW1_VWA1_WG128_2_1_WGM1
    SolutionIndex: 81
    SolutionNameMin: Cijk_Ailk_Bljk_S_MX_B_Bias_HA_SAV_UserArgs_MT16x16x128_MI16x16x1_SN_GRVWB4_GSU1_LBSPPA256_LBSPPB512_LPA16_LPB8_MIWT1_1_NLCA1_NLCB1_SU0_SUM0_SUS0_SVW1_VWA1_WG16_4_2_WGM1
    SolutionIndex: 82
    SolutionNameMin: Cijk_Ailk_Bljk_S_MX_B_Bias_HA_SAV_UserArgs_MT128x32x64_MI32x32x1_SN_GRVWB4_GSU16_LBSPPA0_LBSPPB256_LPA0_LPB4_MIWT1_1_NLCA1_NLCB1_SU0_SUM0_SUS0_SVW1_VWA1_WG128_2_1_WGM1
    SolutionIndex: 83
    SolutionNameMin: Cijk_Ailk_Bljk_S_MX_B_Bias_HA_SAV_UserArgs_MT128x32x64_MI32x32x1_SN_GRVWB4_GSU20_LBSPPA0_LBSPPB256_LPA0_LPB4_MIWT1_1_NLCA1_NLCB1_SU0_SUM0_SUS0_SVW1_VWA1_WG128_2_1_WGM1
    SolutionIndex: 84
    SolutionNameMin: Cijk_Ailk_Bljk_S_MX_B_Bias_HA_SAV_UserArgs_MT32x16x128_MI16x16x1_SN_GRVWB4_GSU1_LBSPPA512_LBSPPB512_LPA16_LPB8_MIWT1_1_NLCA1_NLCB1_SU0_SUM0_SUS0_SVW1_VWA1_WG32_4_2_WGM1
    SolutionIndex: 85
    SolutionNameMin: Cijk_Ailk_Bljk_S_MX_B_Bias_HA_SAV_UserArgs_MT128x32x64_MI32x32x1_SN_GRVWB4_GSU13_LBSPPA0_LBSPPB256_LPA0_LPB4_MIWT1_1_NLCA1_NLCB1_SU0_SUM0_SUS0_SVW1_VWA1_WG128_2_1_WGM1
    SolutionIndex: 86
    SolutionNameMin: Cijk_Ailk_Bljk_S_MX_B_Bias_HA_SAV_UserArgs_MT128x32x32_MI32x32x1_SN_GRVWB4_GSU10_LBSPPA0_LBSPPB128_LPA0_LPB4_MIWT1_1_NLCA1_NLCB1_SU0_SUM0_SUS0_SVW1_VWA1_WG128_2_1_WGM1
    SolutionIndex: 87
    SolutionNameMin: Cijk_Ailk_Bljk_S_MX_B_Bias_HA_SAV_UserArgs_MT128x32x64_MI32x32x1_SN_GRVWB4_GSU10_LBSPPA0_LBSPPB256_LPA0_LPB4_MIWT1_1_NLCA1_NLCB1_SU0_SUM0_SUS0_SVW1_VWA1_WG128_2_1_WGM1
    SolutionIndex: 88
    SolutionNameMin: Cijk_Ailk_Bljk_S_MX_B_Bias_HA_SAV_UserArgs_MT32x32x128_MI32x32x1_SN_GRVWB4_GSU1_LBSPPA0_LBSPPB512_LPA0_LPB4_MIWT1_1_NLCA1_NLCB1_SU0_SUM0_SUS0_SVW1_VWA1_WG32_2_4_WGM1
    SolutionIndex: 89
    SolutionNameMin: Cijk_Ailk_Bljk_S_MX_B_Bias_HA_SAV_UserArgs_MT192x32x32_MI16x16x1_SN_GRVWB4_GSU10_LBSPPA3072_LBSPPB128_LPA16_LPB8_MIWT3_2_NLCA3_NLCB1_SU0_SUM0_SUS0_SVW1_VWA1_WG64_4_1_WGM1
    SolutionIndex: 90
    SolutionNameMin: Cijk_Ailk_Bljk_S_MX_B_Bias_HA_SAV_UserArgs_MT384x32x32_MI32x32x1_SN_GRVWB4_GSU20_LBSPPA0_LBSPPB128_LPA0_LPB4_MIWT3_1_NLCA3_NLCB1_SU0_SUM0_SUS0_SVW1_VWA1_WG128_2_1_WGM1
    SolutionIndex: 91
    SolutionNameMin: Cijk_Ailk_Bljk_S_MX_B_Bias_HA_SAV_UserArgs_MT32x32x128_MI16x16x1_SN_GRVWB4_GSU1_LBSPPA512_LBSPPB512_LPA16_LPB8_MIWT1_1_NLCA1_SU0_SUM0_SUS0_SVW1_VWA1_WG32_8_1_WGM1
    SolutionIndex: 92
    SolutionNameMin: Cijk_Ailk_Bljk_S_MX_B_Bias_HA_SAV_UserArgs_MT128x32x64_MI32x32x1_SN_GRVWB4_GSU5_LBSPPA0_LBSPPB256_LPA0_LPB4_MIWT1_1_NLCA1_SU0_SUM0_SUS0_SVW1_VWA1_WG128_2_1_WGM1
    SolutionIndex: 93
    SolutionNameMin: Cijk_Ailk_Bljk_S_MX_B_Bias_HA_SAV_UserArgs_MT128x32x32_MI32x32x1_SN_GRVWB4_GSU10_LBSPPA0_LBSPPB128_LPA0_LPB4_MIWT1_1_NLCA1_SU0_SUM0_SUS0_SVW1_VWA1_WG128_2_1_WGM1
    SolutionIndex: 94
    SolutionNameMin: Cijk_Ailk_Bljk_S_MX_B_Bias_HA_SAV_UserArgs_MT64x32x64_MI32x32x1_SN_GRVWB4_GSU1_LBSPPA0_LBSPPB256_LPA0_LPB4_MIWT1_1_NLCA1_SU0_SUM0_SUS0_SVW1_VWA1_WG64_2_2_WGM1
    SolutionIndex: 95
    SolutionNameMin: Cijk_Ailk_Bljk_S_MX_B_Bias_HA_SAV_UserArgs_MT384x32x32_MI32x32x1_SN_GRVWB4_GSU10_LBSPPA0_LBSPPB128_LPA0_LPB4_MIWT3_1_NLCA3_SU0_SUM0_SUS0_SVW1_VWA1_WG128_2_1_WGM1
    SolutionIndex: 96
    SolutionNameMin: Cijk_Ailk_Bljk_S_MX_B_Bias_HA_SAV_UserArgs_MT64x32x64_MI32x32x1_SN_CLR1_GRVWB4_GSU1_LBSPPA0_LBSPPB256_LPA0_LPB4_LRVW4_MIWT1_1_NTA0_NLCA1_PLR1_SU0_SUM0_SUS0_SVW1_VWA1_WG64_2_2_WGM1
    SolutionIndex: 97
    SolutionNameMin: Cijk_Ailk_Bljk_S_MX_B_Bias_HA_SAV_UserArgs_MT384x32x32_MI32x32x1_SN_CLR1_GRVWB4_GSU7_LBSPPA0_LBSPPB128_LPA0_LPB4_LRVW4_MIWT3_1_NTA0_NLCA3_PLR1_SU0_SUM0_SUS0_SVW1_VWA1_WG128_2_1_WGM1
    SolutionIndex: 98
    SolutionNameMin: Cijk_Ailk_Bljk_S_MX_B_Bias_HA_SAV_UserArgs_MT128x32x32_MI32x32x1_SN_CLR1_GRVWB4_GSU5_LBSPPA0_LBSPPB128_LPA0_LPB4_LRVW4_MIWT1_1_NTA0_NLCA1_PLR1_SU0_SUM0_SUS0_SVW1_VWA1_WG128_2_1_WGM1
    SolutionIndex: 99
    SolutionNameMin: Cijk_Ailk_Bljk_S_MX_B_Bias_HA_SAV_UserArgs_MT384x32x32_MI32x32x1_SN_CLR1_GRVWB4_GSU5_LBSPPA0_LBSPPB128_LPA0_LPB4_LRVW4_MIWT3_1_NTA0_NLCA3_PLR1_SU0_SUM0_SUS0_SVW1_VWA1_WG128_2_1_WGM1
    SolutionIndex: 100
    SolutionNameMin: Cijk_Ailk_Bljk_S_MX_B_Bias_HA_SAV_UserArgs_MT384x32x32_MI32x32x1_SN_CLR1_GRVWB4_GSU5_LBSPPA0_LBSPPB128_LPA0_LPB4_LRVW4_MIWT3_1_NTA4_NLCA3_PLR1_SU0_SUM0_SUS0_SVW1_VWA1_WG128_2_1_WGM1
    SolutionIndex: 101
    SolutionNameMin: Cijk_Ailk_Bljk_S_MX_B_Bias_HA_SAV_UserArgs_MT128x32x64_MI32x32x1_SN_CLR1_GRVWB4_GSU1_LBSPPA0_LBSPPB256_LPA0_LPB4_LRVW4_MIWT1_1_NTA4_NLCA1_PLR1_SU0_SUM0_SUS0_SVW1_VWA1_WG128_2_1_WGM1
    SolutionIndex: 102
    SolutionNameMin: Cijk_Ailk_Bljk_S_MX_B_Bias_HA_SAV_UserArgs_MT384x32x16_MI32x32x1_SN_CLR1_GRVWB1_GSU7_LBSPPA0_LBSPPB128_LPA0_LPB4_LRVW4_MIWT3_1_NTA0_NLCA3_PLR1_SU0_SUM0_SUS0_SVW1_VWA1_WG128_2_1_WGM1
    SolutionIndex: 103
    SolutionNameMin: Cijk_Ailk_Bljk_S_MX_B_Bias_HA_SAV_UserArgs_MT384x32x16_MI32x32x1_SN_CLR1_GRVWB1_GSU7_LBSPPA0_LBSPPB128_LPA0_LPB4_LRVW4_MIWT3_1_NTA4_NLCA3_PLR1_SU0_SUM0_SUS0_SVW1_VWA1_WG128_2_1_WGM1
    SolutionIndex: 104
    SolutionNameMin: Cijk_Ailk_Bljk_S_MX_B_Bias_HA_SAV_UserArgs_MT160x32x32_MI16x16x1_SN_CLR1_GRVWB4_GSU1_LBSPPA2560_LBSPPB128_LPA16_LPB8_LRVW4_MIWT5_1_NTA4_NLCA5_PLR1_SU0_SUM0_SUS0_SVW1_VWA1_WG32_8_1_WGM1
    SolutionIndex: 105
    SolutionNameMin: Cijk_Ailk_Bljk_S_MX_B_Bias_HA_SAV_UserArgs_MT384x32x16_MI32x32x1_SN_CLR1_GRVWB1_GSU5_LBSPPA0_LBSPPB128_LPA0_LPB4_LRVW4_MIWT3_1_NTA4_NLCA3_PLR1_SU0_SUM0_SUS0_SVW1_VWA1_WG128_2_1_WGM1
    SolutionIndex: 106
    SolutionNameMin: Cijk_Ailk_Bljk_S_MX_B_Bias_HA_SAV_UserArgs_MT128x32x32_MI32x32x1_SN_CLR1_GRVWB4_GSU1_LBSPPA0_LBSPPB128_LPA0_LPB4_LRVW4_MIWT1_1_NTA4_NLCA1_PLR1_SU0_SUM0_SUS0_SVW1_VWA1_WG128_2_1_WGM1
    SolutionIndex: 107
    SolutionNameMin: Cijk_Ailk_Bljk_S_MX_B_Bias_HA_SAV_UserArgs_MT384x32x32_MI32x32x1_SN_CLR1_GRVWB4_GSU7_LBSPPA0_LBSPPB128_LPA0_LPB4_LRVW4_MIWT3_1_NTA4_NLCA3_PLR1_SU0_SUM0_SUS0_SVW1_VWA1_WG128_2_1_WGM1
    SolutionIndex: 108
    SolutionNameMin: Cijk_Ailk_Bljk_S_MX_B_Bias_HA_SAV_UserArgs_MT448x32x16_MI16x16x1_SN_CLR1_GRVWB1_GSU5_LBSPPA3584_LBSPPB128_LPA16_LPB2_LRVW2_MIWT7_2_NTA4_NLCA7_PLR1_SU0_SUM0_SUS0_SVW1_VWA1_WG64_4_1_WGM1
    SolutionIndex: 109
    SolutionNameMin: Cijk_Ailk_Bljk_S_MX_B_Bias_HA_SAV_UserArgs_MT320x32x32_MI16x16x1_SN_CLR1_GRVWB4_GSU1_LBSPPA5120_LBSPPB128_LPA16_LPB8_LRVW4_MIWT5_2_NTA4_NLCA5_PLR1_SU0_SUM0_SUS0_SVW1_VWA1_WG64_4_1_WGM1
    SolutionIndex: 110
    SolutionNameMin: Cijk_Ailk_Bljk_S_MX_B_Bias_HA_SAV_UserArgs_MT448x32x32_MI16x16x1_SN_CLR1_GRVWB4_GSU1_LBSPPA7168_LBSPPB128_LPA16_LPB8_LRVW4_MIWT7_2_NTA0_NLCA7_PLR1_SU0_SUM0_SUS0_SVW1_VWA1_WG64_4_1_WGM1
    SolutionIndex: 111
    SolutionNameMin: Cijk_Ailk_Bljk_S_MX_B_Bias_HA_SAV_UserArgs_MT16x16x64_MI16x16x1_SN_LDSB0_GRVWB4_GSU16_LBSPPB256_MIWT1_1_NLCB1_SU0_SUM0_SUS0_WG16_4_2_WGM1
    SolutionIndex: 112
    SolutionNameMin: Cijk_Ailk_Bljk_S_MX_B_Bias_HA_SAV_UserArgs_MT16x16x128_MI16x16x1_SN_LDSB0_GRVWB4_GSU16_LBSPPB512_MIWT1_1_NLCB1_SU0_SUM0_SUS0_WG16_4_2_WGM1
    SolutionIndex: 113
    SolutionNameMin: Cijk_Ailk_Bljk_S_MX_B_Bias_HA_SAV_UserArgs_MT16x32x128_MI16x16x1_SN_LDSB0_GRVWB4_GSU27_LBSPPB512_MIWT1_1_NLCB1_SU0_SUM0_SUS0_WG16_8_2_WGM1
    SolutionIndex: 114
    SolutionNameMin: Cijk_Ailk_Bljk_S_MX_B_Bias_HA_SAV_UserArgs_MT16x32x128_MI16x16x1_SN_LDSB0_GRVWB4_GSU16_LBSPPA256_LBSPPB512_LPA16_LPB8_MIWT1_1_NLCB1_SU0_SUM0_SUS0_SVW1_VWA1_WG16_8_2_WGM1
    SolutionIndex: 115
    SolutionNameMin: Cijk_Ailk_Bljk_S_MX_B_Bias_HA_SAV_UserArgs_MT16x32x128_MI16x16x1_SN_LDSB0_GRVWB4_GSU28_LBSPPA256_LBSPPB512_LPA16_LPB8_MIWT1_1_NLCB1_SU0_SUM0_SUS0_SVW1_VWA1_WG16_8_1_WGM1
    SolutionIndex: 116
    SolutionNameMin: Cijk_Ailk_Bljk_S_MX_B_Bias_HA_SAV_UserArgs_MT32x32x128_MI16x16x1_SN_LDSB1_GRVWB4_GSU30_LBSPPA512_LBSPPB512_LPA16_LPB8_MIWT1_1_NLCB1_SU0_SUM0_SUS0_SVW1_VWA1_WG32_8_1_WGM1
    SolutionIndex: 117
    SolutionNameMin: Cijk_Ailk_Bljk_S_MX_B_Bias_HA_SAV_UserArgs_MT32x32x128_MI16x16x1_SN_LDSB1_GRVWB4_GSU19_LBSPPA512_LBSPPB512_LPA16_LPB8_MIWT1_1_NLCA1_NLCB1_SU0_SUM0_SUS0_SVW1_VWA1_WG32_8_1_WGM1
    SolutionIndex: 118
    SolutionNameMin: Cijk_Ailk_Bljk_S_MX_B_Bias_HA_SAV_UserArgs_MT32x64x128_MI32x32x1_SN_LDSB1_GRVWB4_GSU19_LBSPPA0_LBSPPB512_LPA0_LPB4_MIWT1_1_NLCA1_NLCB1_SU0_SUM0_SUS0_SVW1_VWA1_WG32_4_2_WGM1
    SolutionIndex: 119
    SolutionNameMin: Cijk_Ailk_Bljk_S_MX_B_Bias_HA_SAV_UserArgs_MT32x32x64_MI16x16x1_SN_LDSB0_GRVWB4_GSU10_LBSPPA512_LBSPPB256_LPA16_LPB8_MIWT1_1_NLCA1_NLCB1_SU0_SUM0_SUS0_SVW1_VWA1_WG32_8_1_WGM1
    SolutionIndex: 120
    SolutionNameMin: Cijk_Ailk_Bljk_S_MX_B_Bias_HA_SAV_UserArgs_MT64x32x64_MI16x16x1_SN_LDSB0_GRVWB4_GSU19_LBSPPA1024_LBSPPB256_LPA16_LPB8_MIWT1_2_NLCA1_NLCB1_SU0_SUM0_SUS0_SVW1_VWA1_WG64_4_1_WGM1
    SolutionIndex: 121
    SolutionNameMin: Cijk_Ailk_Bljk_S_MX_B_Bias_HA_SAV_UserArgs_MT32x64x64_MI32x32x1_SN_LDSB0_GRVWB4_GSU13_LBSPPA0_LBSPPB256_LPA0_LPB4_MIWT1_1_NLCA1_NLCB1_SU0_SUM0_SUS0_SVW1_VWA1_WG32_4_1_WGM1
    SolutionIndex: 122
    SolutionNameMin: Cijk_Ailk_Bljk_S_MX_B_Bias_HA_SAV_UserArgs_MT64x64x64_MI32x32x1_SN_LDSB1_GRVWB4_GSU24_LBSPPA0_LBSPPB256_LPA0_LPB4_MIWT1_1_NLCA1_NLCB1_SU0_SUM0_SUS0_SVW1_VWA1_WG64_4_1_WGM1
    SolutionIndex: 123
    SolutionNameMin: Cijk_Ailk_Bljk_S_MX_B_Bias_HA_SAV_UserArgs_MT32x16x128_MI16x16x1_SN_LDSB0_GRVWB4_GSU1_LBSPPA512_LBSPPB512_LPA16_LPB8_MIAV1_MIWT1_1_NLCA1_NLCB1_SU0_SUM0_SUS0_SVW1_VWA1_WG32_4_2_WGM1
    SolutionIndex: 124
    SolutionNameMin: Cijk_Ailk_Bljk_S_MX_B_Bias_HA_SAV_UserArgs_MT64x32x64_MI16x16x1_SN_LDSB0_GRVWB4_GSU10_LBSPPA1024_LBSPPB256_LPA16_LPB8_MIAV1_MIWT1_2_NLCA1_NLCB1_SU0_SUM0_SUS0_SVW1_VWA1_WG64_4_1_WGM1
    SolutionIndex: 125
    SolutionNameMin: Cijk_Ailk_Bljk_S_MX_B_Bias_HA_SAV_UserArgs_MT64x64x64_MI32x32x1_SN_LDSB1_GRVWB4_GSU16_LBSPPA0_LBSPPB256_LPA0_LPB4_MIAV1_MIWT1_1_NLCA1_NLCB1_SU0_SUM0_SUS0_SVW1_VWA1_WG64_4_1_WGM1
    SolutionIndex: 126
    SolutionNameMin: Cijk_Ailk_Bljk_S_MX_B_Bias_HA_SAV_UserArgs_MT128x32x64_MI32x32x1_SN_LDSB1_GRVWB4_GSU13_LBSPPA0_LBSPPB256_LPA0_LPB4_MIAV1_MIWT1_1_NLCA1_NLCB1_SU0_SUM0_SUS0_SVW1_VWA1_WG128_2_1_WGM1
    SolutionIndex: 127
    SolutionNameMin: Cijk_Ailk_Bljk_S_MX_B_Bias_HA_SAV_UserArgs_MT64x64x64_MI32x32x1_SN_LDSB1_GRVWB4_GSU13_LBSPPA0_LBSPPB256_LPA0_LPB4_MIAV1_MIWT1_1_NLCA1_NLCB1_SU0_SUM0_SUS0_SVW1_VWA1_WG64_4_1_WGM1
    SolutionIndex: 128
    SolutionNameMin: Cijk_Ailk_Bljk_S_MX_B_Bias_HA_SAV_UserArgs_MT32x16x128_MI16x16x1_SN_GRVWB4_GSU1_LBSPPA512_LBSPPB512_LPA16_LPB8_MIAV1_MIWT1_1_NLCA1_NLCB1_SU0_SUM0_SUS0_SVW1_VWA1_WG32_4_2_WGM1
    SolutionIndex: 129
    SolutionNameMin: Cijk_Ailk_Bljk_S_MX_B_Bias_HA_SAV_UserArgs_MT64x64x64_MI32x32x1_SN_GRVWB4_GSU10_LBSPPA0_LBSPPB256_LPA0_LPB4_MIAV1_MIWT1_1_NLCA1_NLCB1_SU0_SUM0_SUS0_SVW1_VWA1_WG64_4_1_WGM1
    SolutionIndex: 130
    SolutionNameMin: Cijk_Ailk_Bljk_S_MX_B_Bias_HA_SAV_UserArgs_MT64x64x64_MI32x32x1_SN_GRVWB4_GSU8_LBSPPA0_LBSPPB256_LPA0_LPB4_MIAV1_MIWT1_1_NLCA1_NLCB1_SU0_SUM0_SUS0_SVW1_VWA1_WG64_4_1_WGM1
    SolutionIndex: 131
    SolutionNameMin: Cijk_Ailk_Bljk_S_MX_B_Bias_HA_SAV_UserArgs_MT128x64x64_MI32x32x1_SN_GRVWB4_GSU16_LBSPPA0_LBSPPB256_LPA0_LPB4_MIAV1_MIWT1_2_NLCA1_NLCB1_SU0_SUM0_SUS0_SVW1_VWA1_WG128_2_1_WGM1
    SolutionIndex: 132
    SolutionNameMin: Cijk_Ailk_Bljk_S_MX_B_Bias_HA_SAV_UserArgs_MT32x32x128_MI32x32x1_SN_GRVWB4_GSU1_LBSPPA0_LBSPPB512_LPA0_LPB4_MIAV1_MIWT1_1_NLCA1_NLCB1_SU0_SUM0_SUS0_SVW1_VWA1_WG32_2_4_WGM1
    SolutionIndex: 133
    SolutionNameMin: Cijk_Ailk_Bljk_S_MX_B_Bias_HA_SAV_UserArgs_MT128x64x32_MI32x32x1_SN_GRVWB4_GSU13_LBSPPA0_LBSPPB128_LPA0_LPB4_MIAV1_MIWT1_2_NLCA1_NLCB1_SU0_SUM0_SUS0_SVW1_VWA1_WG128_2_1_WGM1
    SolutionIndex: 134
    SolutionNameMin: Cijk_Ailk_Bljk_S_MX_B_Bias_HA_SAV_UserArgs_MT192x64x32_MI16x16x1_SN_GRVWB4_GSU20_LBSPPA3072_LBSPPB128_LPA16_LPB8_MIAV1_MIWT3_4_NLCA3_NLCB1_SU0_SUM0_SUS0_SVW1_VWA1_WG64_4_1_WGM1
    SolutionIndex: 135
    SolutionNameMin: Cijk_Ailk_Bljk_S_MX_B_Bias_HA_SAV_UserArgs_MT32x32x128_MI16x16x1_SN_GRVWB4_GSU1_LBSPPA512_LBSPPB512_LPA16_LPB8_MIAV1_MIWT1_1_NLCA1_SU0_SUM0_SUS0_SVW1_VWA1_WG32_8_1_WGM1
    SolutionIndex: 136
    SolutionNameMin: Cijk_Ailk_Bljk_S_MX_B_Bias_HA_SAV_UserArgs_MT128x64x32_MI32x32x1_SN_GRVWB4_GSU10_LBSPPA0_LBSPPB128_LPA0_LPB4_MIAV1_MIWT1_2_NLCA1_SU0_SUM0_SUS0_SVW1_VWA1_WG128_2_1_WGM1
    SolutionIndex: 137
    SolutionNameMin: Cijk_Ailk_Bljk_S_MX_B_Bias_HA_SAV_UserArgs_MT256x64x32_MI32x32x1_SN_GRVWB4_GSU20_LBSPPA0_LBSPPB128_LPA0_LPB4_MIAV1_MIWT2_2_NLCA1_SU0_SUM0_SUS0_SVW2_VWA2_WG128_2_1_WGM1
    SolutionIndex: 138
    SolutionNameMin: Cijk_Ailk_Bljk_S_MX_B_Bias_HA_SAV_UserArgs_MT64x32x128_MI32x32x1_SN_GRVWB4_GSU1_LBSPPA0_LBSPPB512_LPA0_LPB4_MIAV1_MIWT1_1_NLCA1_SU0_SUM0_SUS0_SVW1_VWA1_WG64_2_2_WGM1
    SolutionIndex: 139
    SolutionNameMin: Cijk_Ailk_Bljk_S_MX_B_Bias_HA_SAV_UserArgs_MT192x64x32_MI16x16x1_SN_GRVWB4_GSU10_LBSPPA3072_LBSPPB128_LPA16_LPB8_MIAV1_MIWT3_4_NLCA3_SU0_SUM0_SUS0_SVW1_VWA1_WG64_4_1_WGM1
    SolutionIndex: 140
    SolutionNameMin: Cijk_Ailk_Bljk_S_MX_B_Bias_HA_SAV_UserArgs_MT384x64x32_MI32x32x1_SN_GRVWB4_GSU20_LBSPPA0_LBSPPB128_LPA0_LPB4_MIAV0_MIWT3_2_NLCA3_SU0_SUM0_SUS0_SVW1_VWA1_WG128_2_1_WGM1
    SolutionIndex: 141
    SolutionNameMin: Cijk_Ailk_Bljk_S_MX_B_Bias_HA_SAV_UserArgs_MT64x32x64_MI32x32x1_SN_CLR1_GRVWB4_GSU1_LBSPPA0_LBSPPB256_LPA0_LPB4_LRVW4_MIAV1_MIWT1_1_NLCA1_PLR1_SU0_SUM0_SUS0_SVW1_VWA1_WG64_2_2_WGM1
    SolutionIndex: 142
    SolutionNameMin: Cijk_Ailk_Bljk_S_MX_B_Bias_HA_SAV_UserArgs_MT192x64x32_MI16x16x1_SN_CLR1_GRVWB4_GSU7_LBSPPA3072_LBSPPB128_LPA16_LPB8_LRVW4_MIAV1_MIWT3_4_NLCA3_PLR1_SU0_SUM0_SUS0_SVW1_VWA1_WG64_4_1_WGM1
    SolutionIndex: 143
    SolutionNameMin: Cijk_Ailk_Bljk_S_MX_B_Bias_HA_SAV_UserArgs_MT256x64x32_MI32x32x1_SN_CLR1_GRVWB4_GSU10_LBSPPA0_LBSPPB128_LPA0_LPB4_LRVW4_MIAV1_MIWT2_2_NLCA1_PLR1_SU0_SUM0_SUS0_SVW2_VWA2_WG128_2_1_WGM1
    SolutionIndex: 144
    SolutionNameMin: Cijk_Ailk_Bljk_S_MX_B_Bias_HA_SAV_UserArgs_MT64x64x64_MI32x32x1_SN_CLR1_GRVWB4_GSU1_LBSPPA0_LBSPPB256_LPA0_LPB4_LRVW4_MIAV1_MIWT2_2_NLCA1_PLR1_SU0_SUM0_SUS0_SVW2_VWA2_WG32_2_4_WGM1
    SolutionIndex: 145
    SolutionNameMin: Cijk_Ailk_Bljk_S_MX_B_Bias_HA_SAV_UserArgs_MT384x64x32_MI32x32x1_SN_CLR1_GRVWB4_GSU10_LBSPPA0_LBSPPB128_LPA0_LPB4_LRVW4_MIAV0_MIWT3_2_NLCA3_PLR1_SU0_SUM0_SUS0_SVW1_VWA1_WG128_2_1_WGM1
    SolutionIndex: 146
    SolutionNameMin: Cijk_Ailk_Bljk_S_MX_B_Bias_HA_SAV_UserArgs_MT64x64x64_MI32x32x1_SN_CLR1_GRVWB4_GSU1_LBSPPA0_LBSPPB256_LPA0_LPB4_LRVW4_MIAV1_MIWT1_2_NTA0_NLCA1_PLR1_SU0_SUM0_SUS0_SVW1_VWA1_WG64_2_2_WGM1
    SolutionIndex: 147
    SolutionNameMin: Cijk_Ailk_Bljk_S_MX_B_Bias_HA_SAV_UserArgs_MT256x64x32_MI32x32x1_SN_CLR1_GRVWB4_GSU5_LBSPPA0_LBSPPB128_LPA0_LPB4_LRVW4_MIAV1_MIWT2_2_NTA0_NLCA1_PLR1_SU0_SUM0_SUS0_SVW2_VWA2_WG128_2_1_WGM1
    SolutionIndex: 148
    SolutionNameMin: Cijk_Ailk_Bljk_S_MX_B_Bias_HA_SAV_UserArgs_MT256x64x32_MI32x32x1_SN_CLR1_GRVWB4_GSU5_LBSPPA0_LBSPPB128_LPA0_LPB4_LRVW4_MIAV1_MIWT2_2_NTA4_NLCA1_PLR1_SU0_SUM0_SUS0_SVW2_VWA2_WG128_2_1_WGM1
    SolutionIndex: 149
    SolutionNameMin: Cijk_Ailk_Bljk_S_MX_B_Bias_HA_SAV_UserArgs_MT160x64x32_MI16x16x1_SN_CLR1_GRVWB4_GSU2_LBSPPA2560_LBSPPB128_LPA16_LPB8_LRVW4_MIAV1_MIWT5_2_NTA0_NLCA5_PLR1_SU0_SUM0_SUS0_SVW1_VWA1_WG32_8_1_WGM1
    SolutionIndex: 150
    SolutionNameMin: Cijk_Ailk_Bljk_S_MX_B_Bias_HA_SAV_UserArgs_MT384x64x32_MI32x32x1_SN_CLR1_GRVWB4_GSU5_LBSPPA0_LBSPPB128_LPA0_LPB4_LRVW4_MIAV0_MIWT3_2_NTA0_NLCA3_PLR1_SU0_SUM0_SUS0_SVW1_VWA1_WG128_2_1_WGM1
    SolutionIndex: 151
    SolutionNameMin: Cijk_Ailk_Bljk_S_MX_B_Bias_HA_SAV_UserArgs_MT384x64x32_MI32x32x1_SN_CLR1_GRVWB4_GSU5_LBSPPA0_LBSPPB128_LPA0_LPB4_LRVW4_MIAV0_MIWT3_2_NTA4_NLCA3_PLR1_SU0_SUM0_SUS0_SVW1_VWA1_WG128_2_1_WGM1
    SolutionIndex: 152
    SolutionNameMin: Cijk_Ailk_Bljk_S_MX_B_Bias_HA_SAV_UserArgs_MT128x64x64_MI32x32x1_SN_CLR1_GRVWB4_GSU1_LBSPPA0_LBSPPB256_LPA0_LPB4_LRVW4_MIAV1_MIWT2_2_NTA0_NLCA1_PLR1_SU0_SUM0_SUS0_SVW2_VWA2_WG64_2_2_WGM1
    SolutionIndex: 153
    SolutionNameMin: Cijk_Ailk_Bljk_S_MX_B_Bias_HA_SAV_UserArgs_MT320x64x32_MI16x16x1_SN_CLR1_GRVWB4_GSU3_LBSPPA5120_LBSPPB128_LPA16_LPB8_LRVW4_MIAV1_MIWT5_4_NTA0_NLCA5_PLR1_SU0_SUM0_SUS0_SVW1_VWA1_WG64_4_1_WGM1
    SolutionIndex: 154
    SolutionNameMin: Cijk_Ailk_Bljk_S_MX_B_Bias_HA_SAV_UserArgs_MT160x64x32_MI16x16x1_SN_CLR1_GRVWB4_GSU1_LBSPPA2560_LBSPPB128_LPA16_LPB8_LRVW4_MIAV1_MIWT5_2_NTA4_NLCA5_PLR1_SU0_SUM0_SUS0_SVW1_VWA1_WG32_8_1_WGM1
    SolutionIndex: 155
    SolutionNameMin: Cijk_Ailk_Bljk_S_MX_B_Bias_HA_SAV_UserArgs_MT384x64x16_MI32x32x1_SN_CLR1_GRVWB4_GSU5_LBSPPA0_LBSPPB128_LPA0_LPB4_LRVW4_MIAV0_MIWT3_2_NTA4_NLCA3_PLR1_SU0_SUM0_SUS0_SVW1_VWA1_WG128_2_1_WGM1
    SolutionIndex: 156
    SolutionNameMin: Cijk_Ailk_Bljk_S_MX_B_Bias_HA_SAV_UserArgs_MT256x64x32_MI32x32x1_SN_CLR1_GRVWB4_GSU1_LBSPPA0_LBSPPB128_LPA0_LPB4_LRVW4_MIAV1_MIWT2_2_NTA0_NLCA1_PLR1_SU0_SUM0_SUS0_SVW2_VWA2_WG128_2_1_WGM1
    SolutionIndex: 157
    SolutionNameMin: Cijk_Ailk_Bljk_S_MX_B_Bias_HA_SAV_UserArgs_MT256x64x32_MI32x32x1_SN_CLR1_GRVWB4_GSU1_LBSPPA0_LBSPPB128_LPA0_LPB4_LRVW4_MIAV1_MIWT2_2_NTA4_NLCA1_PLR1_SU0_SUM0_SUS0_SVW2_VWA2_WG128_2_1_WGM1
    SolutionIndex: 158
    SolutionNameMin: Cijk_Ailk_Bljk_S_MX_B_Bias_HA_SAV_UserArgs_MT448x64x16_MI16x16x1_SN_CLR1_GRVWB4_GSU2_LBSPPA3584_LBSPPB128_LPA16_LPB4_LRVW2_MIAV0_MIWT7_4_NTA4_NLCA7_PLR1_SU0_SUM0_SUS0_SVW1_VWA1_WG64_4_1_WGM1
    SolutionIndex: 159
    SolutionNameMin: Cijk_Ailk_Bljk_S_MX_B_Bias_HA_SAV_UserArgs_MT160x64x32_MI16x16x1_SN_CLR1_GRVWB4_GSU1_LBSPPA2560_LBSPPB128_LPA16_LPB8_LRVW4_MIAV1_MIWT5_2_NTA0_NLCA5_PLR1_SU0_SUM0_SUS0_SVW1_VWA1_WG32_8_1_WGM1
    SolutionIndex: 160
    SolutionNameMin: Cijk_Ailk_Bljk_S_MX_B_Bias_HA_SAV_UserArgs_MT320x64x32_MI16x16x1_SN_CLR1_GRVWB4_GSU1_LBSPPA5120_LBSPPB128_LPA16_LPB8_LRVW4_MIAV1_MIWT5_4_NTA4_NLCA5_PLR1_SU0_SUM0_SUS0_SVW1_VWA1_WG64_4_1_WGM1
    SolutionIndex: 161
    SolutionNameMin: Cijk_Ailk_Bljk_S_MX_B_Bias_HA_SAV_UserArgs_MT320x64x32_MI16x16x1_SN_CLR1_GRVWB4_GSU1_LBSPPA5120_LBSPPB128_LPA16_LPB8_LRVW4_MIAV1_MIWT5_4_NTA0_NLCA5_PLR1_SU0_SUM0_SUS0_SVW1_VWA1_WG64_4_1_WGM1
    SolutionIndex: 162
    SolutionNameMin: Cijk_Ailk_Bljk_S_MX_B_Bias_HA_SAV_UserArgs_MT256x64x16_MI32x32x1_SN_CLR1_GRVWB4_GSU1_LBSPPA0_LBSPPB128_LPA0_LPB4_LRVW4_MIAV1_MIWT2_2_NTA0_NLCA1_PLR1_SU0_SUM0_SUS0_SVW2_VWA2_WG128_2_1_WGM1
    SolutionIndex: 163
    SolutionNameMin: Cijk_Ailk_Bljk_S_MX_B_Bias_HA_SAV_UserArgs_MT448x64x16_MI16x16x1_SN_CLR1_GRVWB4_GSU1_LBSPPA3584_LBSPPB128_LPA16_LPB4_LRVW2_MIAV0_MIWT7_4_NTA4_NLCA7_PLR1_SU0_SUM0_SUS0_SVW1_VWA1_WG64_4_1_WGM1
    SolutionIndex: 164
    SolutionNameMin: Cijk_Ailk_Bljk_S_MX_B_Bias_HA_SAV_UserArgs_MT16x16x64_MI16x16x1_SN_LDSB1_GRVWB4_GSU16_LBSPPB256_MIWT1_1_NLCB1_SU0_SUM0_SUS0_WG16_4_1_WGM1
    SolutionIndex: 165
    SolutionNameMin: Cijk_Ailk_Bljk_S_MX_B_Bias_HA_SAV_UserArgs_MT16x32x128_MI16x16x1_SN_LDSB1_GRVWB4_GSU16_LBSPPB512_MIWT1_1_NLCB1_SU0_SUM0_SUS0_WG16_8_2_WGM1
    SolutionIndex: 166
    SolutionNameMin: Cijk_Ailk_Bljk_S_MX_B_Bias_HA_SAV_UserArgs_MT16x32x128_MI16x16x1_SN_LDSB0_GRVWB4_GSU26_LBSPPB512_MIWT1_1_NLCB1_SU0_SUM0_SUS0_WG16_8_2_WGM1
    SolutionIndex: 167
    SolutionNameMin: Cijk_Ailk_Bljk_S_MX_B_Bias_HA_SAV_UserArgs_MT16x32x64_MI16x16x1_SN_LDSB1_GRVWB4_GSU16_LBSPPA256_LBSPPB256_LPA16_LPB8_MIWT1_1_NLCB1_SU0_SUM0_SUS0_SVW1_VWA1_WG16_8_1_WGM1
    SolutionIndex: 168
    SolutionNameMin: Cijk_Ailk_Bljk_S_MX_B_Bias_HA_SAV_UserArgs_MT16x32x256_MI16x16x1_SN_LDSB1_GRVWB4_GSU22_LBSPPA256_LBSPPB1024_LPA16_LPB8_MIWT1_1_NLCB1_SU0_SUM0_SUS0_SVW1_VWA1_WG16_8_2_WGM1
    SolutionIndex: 169
    SolutionNameMin: Cijk_Ailk_Bljk_S_MX_B_Bias_HA_SAV_UserArgs_MT16x16x128_MI16x16x1_SN_LDSB1_GRVWB4_GSU4_LBSPPA256_LBSPPB512_LPA16_LPB8_MIWT1_1_NLCB1_SU0_SUM0_SUS0_SVW1_VWA1_WG16_4_4_WGM1
    SolutionIndex: 170
    SolutionNameMin: Cijk_Ailk_Bljk_S_MX_B_Bias_HA_SAV_UserArgs_MT32x32x64_MI16x16x1_SN_LDSB1_GRVWB4_GSU22_LBSPPA512_LBSPPB256_LPA16_LPB8_MIWT1_1_NLCB1_SU0_SUM0_SUS0_SVW1_VWA1_WG32_8_1_WGM1
    SolutionIndex: 171
    SolutionNameMin: Cijk_Ailk_Bljk_S_MX_B_Bias_HA_SAV_UserArgs_MT32x32x128_MI16x16x1_SN_LDSB1_GRVWB4_GSU22_LBSPPA512_LBSPPB512_LPA16_LPB8_MIWT1_1_NLCB1_SU0_SUM0_SUS0_SVW1_VWA1_WG32_8_1_WGM1
    SolutionIndex: 172
    SolutionNameMin: Cijk_Ailk_Bljk_S_MX_B_Bias_HA_SAV_UserArgs_MT64x32x64_MI32x32x1_SN_LDSB0_GRVWB4_GSU24_LBSPPA0_LBSPPB256_LPA0_LPB4_MIWT1_1_NLCA1_NLCB1_SU0_SUM0_SUS0_SVW1_VWA1_WG64_2_1_WGM1
    SolutionIndex: 173
    SolutionNameMin: Cijk_Ailk_Bljk_S_MX_B_Bias_HA_SAV_UserArgs_MT32x32x64_MI16x16x1_SN_LDSB1_GRVWB4_GSU16_LBSPPA512_LBSPPB256_LPA16_LPB8_MIWT1_1_NLCA1_NLCB1_SU0_SUM0_SUS0_SVW1_VWA1_WG32_8_1_WGM1
    SolutionIndex: 174
    SolutionNameMin: Cijk_Ailk_Bljk_S_MX_B_Bias_HA_SAV_UserArgs_MT96x32x64_MI16x16x1_SN_LDSB1_GRVWB4_GSU25_LBSPPA1536_LBSPPB256_LPA16_LPB8_MIWT3_1_NLCA3_NLCB1_SU0_SUM0_SUS0_SVW1_VWA1_WG32_8_1_WGM1
    SolutionIndex: 175
    SolutionNameMin: Cijk_Ailk_Bljk_S_MX_B_Bias_HA_SAV_UserArgs_MT32x16x128_MI16x16x1_SN_LDSB0_GRVWB4_GSU1_LBSPPA512_LBSPPB512_LPA16_LPB8_MIWT1_1_NLCA1_NLCB1_SU0_SUM0_SUS0_SVW1_VWA1_WG32_4_2_WGM1
    SolutionIndex: 176
    SolutionNameMin: Cijk_Ailk_Bljk_S_MX_B_Bias_HA_SAV_UserArgs_MT64x32x64_MI32x32x1_SN_LDSB0_GRVWB4_GSU13_LBSPPA0_LBSPPB256_LPA0_LPB4_MIWT1_1_NLCA1_NLCB1_SU0_SUM0_SUS0_SVW1_VWA1_WG64_2_1_WGM1
    SolutionIndex: 177
    SolutionNameMin: Cijk_Ailk_Bljk_S_MX_B_Bias_HA_SAV_UserArgs_MT128x32x64_MI32x32x1_SN_LDSB1_GRVWB4_GSU22_LBSPPA0_LBSPPB256_LPA0_LPB4_MIWT1_1_NLCA1_NLCB1_SU0_SUM0_SUS0_SVW1_VWA1_WG128_2_1_WGM1
    SolutionIndex: 178
    SolutionNameMin: Cijk_Ailk_Bljk_S_MX_B_Bias_HA_SAV_UserArgs_MT16x16x128_MI16x16x1_SN_LDSB0_GRVWB4_GSU1_LBSPPA256_LBSPPB512_LPA16_LPB8_MIWT1_1_NLCA1_NLCB1_SU0_SUM0_SUS0_SVW1_VWA1_WG16_4_2_WGM1
    SolutionIndex: 179
    SolutionNameMin: Cijk_Ailk_Bljk_S_MX_B_Bias_HA_SAV_UserArgs_MT64x48x64_MI16x16x1_SN_LDSB0_GRVWB4_GSU13_LBSPPA1024_LBSPPB256_LPA16_LPB8_MIWT1_3_NLCA1_NLCB1_SU0_SUM0_SUS0_SVW1_VWA1_WG64_4_1_WGM1
    SolutionIndex: 180
    SolutionNameMin: Cijk_Ailk_Bljk_S_MX_B_Bias_HA_SAV_UserArgs_MT64x96x64_MI16x16x1_SN_LDSB1_GRVWB4_GSU24_LBSPPA1024_LBSPPB256_LPA0_LPB8_MIWT2_3_NLCA1_NLCB1_SU0_SUM0_SUS0_SVW2_VWA2_WG32_8_1_WGM1
    SolutionIndex: 181
    SolutionNameMin: Cijk_Ailk_Bljk_S_MX_B_Bias_HA_SAV_UserArgs_MT128x32x64_MI32x32x1_SN_LDSB1_GRVWB4_GSU11_LBSPPA0_LBSPPB256_LPA0_LPB4_MIAV1_MIWT1_1_NLCA1_NLCB1_SU0_SUM0_SUS0_SVW1_VWA1_WG128_2_1_WGM1
    SolutionIndex: 182
    SolutionNameMin: Cijk_Ailk_Bljk_S_MX_B_Bias_HA_SAV_UserArgs_MT128x32x64_MI32x32x1_SN_LDSB1_GRVWB4_GSU12_LBSPPA0_LBSPPB256_LPA0_LPB4_MIAV1_MIWT1_1_NLCA1_NLCB1_SU0_SUM0_SUS0_SVW1_VWA1_WG128_2_1_WGM1
    SolutionIndex: 183
    SolutionNameMin: Cijk_Ailk_Bljk_S_MX_B_Bias_HA_SAV_UserArgs_MT192x48x32_MI16x16x1_SN_LDSB0_GRVWB1_GSU17_LBSPPA3072_LBSPPB128_LPA16_LPB8_MIAV1_MIWT3_3_NLCA3_NLCB1_SU0_SUM0_SUS0_SVW1_VWA1_WG64_4_1_WGM1
    SolutionIndex: 184
    SolutionNameMin: Cijk_Ailk_Bljk_S_MX_B_Bias_HA_SAV_UserArgs_MT128x96x32_MI32x32x1_SN_LDSB0_GRVWB4_GSU22_LBSPPA0_LBSPPB128_LPA0_LPB4_MIAV1_MIWT1_3_NLCA1_NLCB1_SU0_SUM0_SUS0_SVW1_VWA1_WG128_2_1_WGM1
    SolutionIndex: 185
    SolutionNameMin: Cijk_Ailk_Bljk_S_MX_B_Bias_HA_SAV_UserArgs_MT32x32x128_MI16x16x1_SN_GRVWB4_GSU1_LBSPPA512_LBSPPB512_LPA16_LPB8_MIAV1_MIWT1_2_NLCA1_SU0_SUM0_SUS0_SVW1_VWA1_WG32_4_2_WGM1
    SolutionIndex: 186
    SolutionNameMin: Cijk_Ailk_Bljk_S_MX_B_Bias_HA_SAV_UserArgs_MT128x96x32_MI32x32x1_SN_GRVWB4_GSU16_LBSPPA0_LBSPPB128_LPA0_LPB4_MIAV1_MIWT1_3_NLCA1_SU0_SUM0_SUS0_SVW1_VWA1_WG128_2_1_WGM1
    SolutionIndex: 187
    SolutionNameMin: Cijk_Ailk_Bljk_S_MX_B_Bias_HA_SAV_UserArgs_MT192x96x32_MI16x16x1_SN_GRVWB4_GSU22_LBSPPA3072_LBSPPB128_LPA16_LPB8_MIAV1_MIWT3_6_NLCA3_SU0_SUM0_SUS0_SVW1_VWA1_WG64_4_1_WGM1
    SolutionIndex: 188
    SolutionNameMin: Cijk_Ailk_Bljk_S_MX_B_Bias_HA_SAV_UserArgs_MT192x96x32_MI16x16x1_SN_GRVWB4_GSU20_LBSPPA3072_LBSPPB128_LPA16_LPB8_MIAV1_MIWT3_6_NLCA3_SU0_SUM0_SUS0_SVW1_VWA1_WG64_4_1_WGM1
    SolutionIndex: 189
    SolutionNameMin: Cijk_Ailk_Bljk_S_MX_B_Bias_HA_SAV_UserArgs_MT192x96x32_MI16x16x1_SN_CLR1_GRVWB4_GSU13_LBSPPA3072_LBSPPB128_LPA16_LPB8_LRVW4_MIAV1_MIWT3_6_NLCA3_PLR1_SU0_SUM0_SUS0_SVW1_VWA1_WG64_4_1_WGM1
    SolutionIndex: 190
    SolutionNameMin: Cijk_Ailk_Bljk_S_MX_B_Bias_HA_SAV_UserArgs_MT256x96x32_MI32x32x1_SN_CLR1_GRVWB4_GSU20_LBSPPA0_LBSPPB128_LPA0_LPB4_LRVW4_MIAV0_MIWT2_3_NLCA1_PLR1_SU0_SUM0_SUS0_SVW2_VWA2_WG128_2_1_WGM1
    SolutionIndex: 191
    SolutionNameMin: Cijk_Ailk_Bljk_S_MX_B_Bias_HA_SAV_UserArgs_MT192x96x32_MI16x16x1_SN_CLR1_GRVWB4_GSU10_LBSPPA3072_LBSPPB128_LPA16_LPB8_LRVW4_MIAV1_MIWT3_6_NLCA3_PLR1_SU0_SUM0_SUS0_SVW1_VWA1_WG64_4_1_WGM1
    SolutionIndex: 192
    SolutionNameMin: Cijk_Ailk_Bljk_S_MX_B_Bias_HA_SAV_UserArgs_MT384x96x32_MI32x32x1_SN_CLR1_GRVWB4_GSU20_LBSPPA0_LBSPPB128_LPA0_LPB4_LRVW4_MIAV0_MIWT3_3_NLCA3_PLR1_SU0_SUM0_SUS0_SVW1_VWA1_WG128_2_1_WGM1
    SolutionIndex: 193
    SolutionNameMin: Cijk_Ailk_Bljk_S_MX_B_Bias_HA_SAV_UserArgs_MT64x48x64_MI16x16x1_SN_CLR1_GRVWB4_GSU1_LBSPPA1024_LBSPPB256_LPA0_LPB8_LRVW4_MIAV1_MIWT2_3_NLCA1_PLR1_SU0_SUM0_SUS0_SVW2_VWA2_WG32_4_2_WGM1
    SolutionIndex: 194
    SolutionNameMin: Cijk_Ailk_Bljk_S_MX_B_Bias_HA_SAV_UserArgs_MT256x96x32_MI32x32x1_SN_CLR1_GRVWB4_GSU10_LBSPPA0_LBSPPB128_LPA0_LPB4_LRVW4_MIAV0_MIWT2_3_NLCA1_PLR1_SU0_SUM0_SUS0_SVW2_VWA2_WG128_2_1_WGM1
    SolutionIndex: 195
    SolutionNameMin: Cijk_Ailk_Bljk_S_MX_B_Bias_HA_SAV_UserArgs_MT128x32x64_MI32x32x1_SN_CLR1_GRVWB4_GSU1_LBSPPA0_LBSPPB256_LPA0_LPB4_LRVW4_MIAV1_MIWT1_1_NLCA1_PLR1_SU0_SUM0_SUS0_SVW1_VWA1_WG128_2_1_WGM1
    SolutionIndex: 196
    SolutionNameMin: Cijk_Ailk_Bljk_S_MX_B_Bias_HA_SAV_UserArgs_MT192x96x32_MI16x16x1_SN_CLR1_GRVWB4_GSU5_LBSPPA3072_LBSPPB128_LPA16_LPB8_LRVW4_MIAV1_MIWT3_6_NLCA3_PLR1_SU0_SUM0_SUS0_SVW1_VWA1_WG64_4_1_WGM1
    SolutionIndex: 197
    SolutionNameMin: Cijk_Ailk_Bljk_S_MX_B_Bias_HA_SAV_UserArgs_MT384x96x32_MI32x32x1_SN_CLR1_GRVWB4_GSU10_LBSPPA0_LBSPPB128_LPA0_LPB4_LRVW4_MIAV0_MIWT3_3_NLCA3_PLR1_SU0_SUM0_SUS0_SVW1_VWA1_WG128_2_1_WGM1
    SolutionIndex: 198
    SolutionNameMin: Cijk_Ailk_Bljk_S_MX_B_Bias_HA_SAV_UserArgs_MT64x96x64_MI32x32x1_SN_CLR1_GRVWB4_GSU1_LBSPPA0_LBSPPB256_LPA0_LPB4_LRVW4_MIAV1_MIWT1_3_NTA0_NLCA1_PLR1_SU0_SUM0_SUS0_SVW1_VWA1_WG64_2_2_WGM1
    SolutionIndex: 199
    SolutionNameMin: Cijk_Ailk_Bljk_S_MX_B_Bias_HA_SAV_UserArgs_MT256x96x32_MI32x32x1_SN_CLR1_GRVWB4_GSU5_LBSPPA0_LBSPPB128_LPA0_LPB4_LRVW4_MIAV0_MIWT2_3_NTA0_NLCA1_PLR1_SU0_SUM0_SUS0_SVW2_VWA2_WG128_2_1_WGM1
    SolutionIndex: 200
    SolutionNameMin: Cijk_Ailk_Bljk_S_MX_B_Bias_HA_SAV_UserArgs_MT256x96x32_MI32x32x1_SN_CLR1_GRVWB4_GSU5_LBSPPA0_LBSPPB128_LPA0_LPB4_LRVW4_MIAV0_MIWT2_3_NTA4_NLCA1_PLR1_SU0_SUM0_SUS0_SVW2_VWA2_WG128_2_1_WGM1
    SolutionIndex: 201
    SolutionNameMin: Cijk_Ailk_Bljk_S_MX_B_Bias_HA_SAV_UserArgs_MT160x96x32_MI16x16x1_SN_CLR1_GRVWB4_GSU2_LBSPPA2560_LBSPPB128_LPA16_LPB8_LRVW4_MIAV1_MIWT5_3_NTA0_NLCA5_PLR1_SU0_SUM0_SUS0_SVW1_VWA1_WG32_8_1_WGM1
    SolutionIndex: 202
    SolutionNameMin: Cijk_Ailk_Bljk_S_MX_B_Bias_HA_SAV_UserArgs_MT384x96x32_MI32x32x1_SN_CLR1_GRVWB4_GSU5_LBSPPA0_LBSPPB128_LPA0_LPB4_LRVW4_MIAV0_MIWT3_3_NTA0_NLCA3_PLR1_SU0_SUM0_SUS0_SVW1_VWA1_WG128_2_1_WGM1
    SolutionIndex: 203
    SolutionNameMin: Cijk_Ailk_Bljk_S_MX_B_Bias_HA_SAV_UserArgs_MT384x96x32_MI32x32x1_SN_CLR1_GRVWB4_GSU5_LBSPPA0_LBSPPB128_LPA0_LPB4_LRVW4_MIAV0_MIWT3_3_NTA4_NLCA3_PLR1_SU0_SUM0_SUS0_SVW1_VWA1_WG128_2_1_WGM1
    SolutionIndex: 204
    SolutionNameMin: Cijk_Ailk_Bljk_S_MX_B_Bias_HA_SAV_UserArgs_MT128x96x64_MI16x16x1_SN_GRVWB4_GSU1_LBSPPA2048_LBSPPB256_LPA0_LPB8_LRVW4_MIAV1_MIWT2_6_NTA0_NLCA1_SU0_SUM0_SUS0_SVW2_VWA2_WG64_4_1_WGM1
    SolutionIndex: 205
    SolutionNameMin: Cijk_Ailk_Bljk_S_MX_B_Bias_HA_SAV_UserArgs_MT320x96x32_MI16x16x1_SN_GRVWB4_GSU3_LBSPPA5120_LBSPPB128_LPA16_LPB8_LRVW4_MIAV0_MIWT5_6_NTA0_NLCA5_SU0_SUM0_SUS0_SVW1_VWA1_WG64_4_1_WGM1
    SolutionIndex: 206
    SolutionNameMin: Cijk_Ailk_Bljk_S_MX_B_Bias_HA_SAV_UserArgs_MT192x96x32_MI16x16x1_SN_GRVWB4_GSU1_LBSPPA3072_LBSPPB128_LPA16_LPB8_LRVW4_MIAV1_MIWT3_6_NTA0_NLCA3_SU0_SUM0_SUS0_SVW1_VWA1_WG64_4_1_WGM1
    SolutionIndex: 207
    SolutionNameMin: Cijk_Ailk_Bljk_S_MX_B_Bias_HA_SAV_UserArgs_MT192x96x32_MI16x16x1_SN_GRVWB4_GSU1_LBSPPA3072_LBSPPB128_LPA16_LPB8_LRVW4_MIAV1_MIWT3_6_NTA4_NLCA3_SU0_SUM0_SUS0_SVW1_VWA1_WG64_4_1_WGM1
    SolutionIndex: 208
    SolutionNameMin: Cijk_Ailk_Bljk_S_MX_B_Bias_HA_SAV_UserArgs_MT384x96x32_MI32x32x1_SN_GRVWB4_GSU5_LBSPPA0_LBSPPB128_LPA0_LPB4_LRVW4_MIAV0_MIWT3_3_NTA4_NLCA3_SU0_SUM0_SUS0_SVW1_VWA1_WG128_2_1_WGM1
    SolutionIndex: 209
    SolutionNameMin: Cijk_Ailk_Bljk_S_MX_B_Bias_HA_SAV_UserArgs_MT256x96x32_MI32x32x1_SN_GRVWB4_GSU1_LBSPPA0_LBSPPB128_LPA0_LPB4_LRVW4_MIAV0_MIWT2_3_NTA0_NLCA1_SU0_SUM0_SUS0_SVW2_VWA2_WG128_2_1_WGM1
    SolutionIndex: 210
    SolutionNameMin: Cijk_Ailk_Bljk_S_MX_B_Bias_HA_SAV_UserArgs_MT256x96x32_MI32x32x1_SN_GRVWB4_GSU1_LBSPPA0_LBSPPB128_LPA0_LPB4_LRVW4_MIAV0_MIWT2_3_NTA4_NLCA1_SU0_SUM0_SUS0_SVW2_VWA2_WG128_2_1_WGM1
    SolutionIndex: 211
    SolutionNameMin: Cijk_Ailk_Bljk_S_MX_B_Bias_HA_SAV_UserArgs_MT384x96x32_MI32x32x1_SN_GRVWB4_GSU1_LBSPPA0_LBSPPB128_LPA0_LPB4_LRVW4_MIAV0_MIWT3_3_NTA0_NLCA3_SU0_SUM0_SUS0_SVW1_VWA1_WG128_2_1_WGM1
    SolutionIndex: 212
    SolutionNameMin: Cijk_Ailk_Bljk_S_MX_B_Bias_HA_SAV_UserArgs_MT320x96x32_MI16x16x1_SN_GRVWB4_GSU1_LBSPPA5120_LBSPPB128_LPA16_LPB8_LRVW4_MIAV0_MIWT5_6_NTA4_NLCA5_SU0_SUM0_SUS0_SVW1_VWA1_WG64_4_1_WGM1
    SolutionIndex: 213
    SolutionNameMin: Cijk_Ailk_Bljk_S_MX_B_Bias_HA_SAV_UserArgs_MT448x96x16_MI16x16x1_SN_GRVWB1_GSU1_LBSPPA3584_LBSPPB128_LPA16_LPB2_LRVW2_MIAV0_MIWT7_6_NTA0_NLCA7_SU0_SUM0_SUS0_SVW1_VWA1_WG64_4_1_WGM1
    SolutionIndex: 214
    SolutionNameMin: Cijk_Ailk_Bljk_S_MX_B_Bias_HA_SAV_UserArgs_MT16x32x64_MI16x16x1_SN_LDSB1_GRVWB4_GSU16_LBSPPB256_MIWT1_1_NLCB1_SU0_SUM0_SUS0_WG16_8_1_WGM1
    SolutionIndex: 215
    SolutionNameMin: Cijk_Ailk_Bljk_S_MX_B_Bias_HA_SAV_UserArgs_MT16x32x128_MI16x16x1_SN_LDSB0_GRVWB4_GSU16_LBSPPB512_MIWT1_1_NLCB1_SU0_SUM0_SUS0_WG16_8_2_WGM1
    SolutionIndex: 216
    SolutionNameMin: Cijk_Ailk_Bljk_S_MX_B_Bias_HA_SAV_UserArgs_MT16x32x256_MI16x16x1_SN_LDSB1_GRVWB4_GSU16_LBSPPB1024_MIWT1_1_NLCB1_SU0_SUM0_SUS0_WG16_8_2_WGM1
    SolutionIndex: 217
    SolutionNameMin: Cijk_Ailk_Bljk_S_MX_B_Bias_HA_SAV_UserArgs_MT16x32x64_MI16x16x1_SN_LDSB0_GRVWB4_GSU16_LBSPPA256_LBSPPB256_LPA16_LPB8_MIWT1_1_NLCB1_SU0_SUM0_SUS0_SVW1_VWA1_WG16_8_1_WGM1
    SolutionIndex: 218
    SolutionNameMin: Cijk_Ailk_Bljk_S_MX_B_Bias_HA_SAV_UserArgs_MT16x64x128_MI16x16x1_SN_LDSB1_GRVWB4_GSU30_LBSPPA256_LBSPPB512_LPA16_LPB8_MIWT1_1_NLCB1_SU0_SUM0_SUS0_SVW1_VWA1_WG16_16_1_WGM1
    SolutionIndex: 219
    SolutionNameMin: Cijk_Ailk_Bljk_S_MX_B_Bias_HA_SAV_UserArgs_MT32x32x64_MI16x16x1_SN_LDSB0_GRVWB4_GSU16_LBSPPA512_LBSPPB256_LPA16_LPB8_MIWT1_1_NLCB1_SU0_SUM0_SUS0_SVW1_VWA1_WG32_8_1_WGM1
    SolutionIndex: 220
    SolutionNameMin: Cijk_Ailk_Bljk_S_MX_B_Bias_HA_SAV_UserArgs_MT32x32x128_MI16x16x1_SN_LDSB1_GRVWB4_GSU19_LBSPPA512_LBSPPB512_LPA16_LPB8_MIWT1_1_NLCB1_SU0_SUM0_SUS0_SVW1_VWA1_WG32_8_1_WGM1
    SolutionIndex: 221
    SolutionNameMin: Cijk_Ailk_Bljk_S_MX_B_Bias_HA_SAV_UserArgs_MT64x48x64_MI16x16x1_SN_LDSB0_GRVWB4_GSU25_LBSPPA1024_LBSPPB256_LPA16_LPB8_MIWT1_3_NLCA1_NLCB1_SU0_SUM0_SUS0_SVW1_VWA1_WG64_4_1_WGM1
    SolutionIndex: 222
    SolutionNameMin: Cijk_Ailk_Bljk_S_MX_B_Bias_HA_SAV_UserArgs_MT32x64x64_MI16x16x1_SN_LDSB0_GRVWB4_GSU13_LBSPPA512_LBSPPB256_LPA16_LPB8_MIWT1_2_NLCA1_NLCB1_SU0_SUM0_SUS0_SVW1_VWA1_WG32_8_1_WGM1
    SolutionIndex: 223
    SolutionNameMin: Cijk_Ailk_Bljk_S_MX_B_Bias_HA_SAV_UserArgs_MT32x128x64_MI32x32x1_SN_LDSB1_GRVWB4_GSU24_LBSPPA0_LBSPPB256_LPA0_LPB4_MIWT1_1_NLCA1_NLCB1_SU0_SUM0_SUS0_SVW1_VWA1_WG32_8_1_WGM1
    SolutionIndex: 224
    SolutionNameMin: Cijk_Ailk_Bljk_S_MX_B_Bias_HA_SAV_UserArgs_MT64x32x64_MI16x16x1_SN_LDSB0_GRVWB4_GSU10_LBSPPA1024_LBSPPB256_LPA16_LPB8_MIWT1_2_NLCA1_NLCB1_SU0_SUM0_SUS0_SVW1_VWA1_WG64_4_1_WGM1
    SolutionIndex: 225
    SolutionNameMin: Cijk_Ailk_Bljk_S_MX_B_Bias_HA_SAV_UserArgs_MT64x64x64_MI32x32x1_SN_LDSB1_GRVWB4_GSU16_LBSPPA0_LBSPPB256_LPA0_LPB4_MIWT1_1_NLCA1_NLCB1_SU0_SUM0_SUS0_SVW1_VWA1_WG64_4_1_WGM1
    SolutionIndex: 226
    SolutionNameMin: Cijk_Ailk_Bljk_S_MX_B_Bias_HA_SAV_UserArgs_MT64x64x64_MI32x32x1_SN_LDSB1_GRVWB4_GSU11_LBSPPA0_LBSPPB256_LPA0_LPB4_MIWT1_1_NLCA1_NLCB1_SU0_SUM0_SUS0_SVW1_VWA1_WG64_4_1_WGM1
    SolutionIndex: 227
    SolutionNameMin: Cijk_Ailk_Bljk_S_MX_B_Bias_HA_SAV_UserArgs_MT64x64x64_MI32x32x1_SN_LDSB1_GRVWB4_GSU12_LBSPPA0_LBSPPB256_LPA0_LPB4_MIWT1_1_NLCA1_NLCB1_SU0_SUM0_SUS0_SVW1_VWA1_WG64_4_1_WGM1
    SolutionIndex: 228
    SolutionNameMin: Cijk_Ailk_Bljk_S_MX_B_Bias_HA_SAV_UserArgs_MT32x16x128_MI16x16x1_SN_LDSB0_GRVWB4_GSU1_LBSPPA512_LBSPPB512_LPA16_LPB8_LRVW4_MIAV1_MIWT1_1_NLCA1_NLCB1_SU0_SUM0_SUS0_SVW1_VWA1_WG32_4_2_WGM1
    SolutionIndex: 229
    SolutionNameMin: Cijk_Ailk_Bljk_S_MX_B_Bias_HA_SAV_UserArgs_MT128x64x32_MI32x32x1_SN_LDSB0_GRVWB4_GSU15_LBSPPA0_LBSPPB128_LPA0_LPB4_LRVW4_MIAV1_MIWT1_2_NLCA1_NLCB1_SU0_SUM0_SUS0_SVW1_VWA1_WG128_2_1_WGM1
    SolutionIndex: 230
    SolutionNameMin: Cijk_Ailk_Bljk_S_MX_B_Bias_HA_SAV_UserArgs_MT128x64x32_MI32x32x1_SN_LDSB0_GRVWB4_GSU16_LBSPPA0_LBSPPB128_LPA0_LPB4_LRVW4_MIAV1_MIWT1_2_NLCA1_NLCB1_SU0_SUM0_SUS0_SVW1_VWA1_WG128_2_1_WGM1
    SolutionIndex: 231
    SolutionNameMin: Cijk_Ailk_Bljk_S_MX_B_Bias_HA_SAV_UserArgs_MT32x32x128_MI32x32x1_SN_LDSB1_GRVWB4_GSU1_LBSPPA0_LBSPPB512_LPA0_LPB4_LRVW4_MIAV1_MIWT1_1_NLCA1_NLCB1_SU0_SUM0_SUS0_SVW1_VWA1_WG32_2_4_WGM1
    SolutionIndex: 232
    SolutionNameMin: Cijk_Ailk_Bljk_S_MX_B_Bias_HA_SAV_UserArgs_MT128x64x32_MI32x32x1_SN_LDSB0_GRVWB4_GSU10_LBSPPA0_LBSPPB128_LPA0_LPB4_LRVW4_MIAV1_MIWT1_2_NLCA1_NLCB1_SU0_SUM0_SUS0_SVW1_VWA1_WG128_2_1_WGM1
    SolutionIndex: 233
    SolutionNameMin: Cijk_Ailk_Bljk_S_MX_B_Bias_HA_SAV_UserArgs_MT96x128x32_MI32x32x1_SN_LDSB0_GRVWB4_GSU20_LBSPPA0_LBSPPB128_LPA0_LPB4_LRVW4_MIAV1_MIWT3_1_NLCA3_NLCB1_SU0_SUM0_SUS0_SVW1_VWA1_WG32_8_1_WGM1
    SolutionIndex: 234
    SolutionNameMin: Cijk_Ailk_Bljk_S_MX_B_Bias_HA_SAV_UserArgs_MT32x32x128_MI16x16x1_SN_GRVWB4_GSU1_LBSPPA512_LBSPPB512_LPA16_LPB8_LRVW4_MIAV1_MIWT1_1_NLCA1_SU0_SUM0_SUS0_SVW1_VWA1_WG32_8_1_WGM1
    SolutionIndex: 235
    SolutionNameMin: Cijk_Ailk_Bljk_S_MX_B_Bias_HA_SAV_UserArgs_MT64x64x64_MI32x32x1_SN_GRVWB4_GSU5_LBSPPA0_LBSPPB256_LPA0_LPB4_LRVW4_MIAV1_MIWT1_1_NLCA1_SU0_SUM0_SUS0_SVW1_VWA1_WG64_4_1_WGM1
    SolutionIndex: 236
    SolutionNameMin: Cijk_Ailk_Bljk_S_MX_B_Bias_HA_SAV_UserArgs_MT256x128x32_MI32x32x1_SN_GRVWB4_GSU28_LBSPPA0_LBSPPB128_LPA0_LPB4_LRVW4_MIAV0_MIWT2_4_NLCA1_SU0_SUM0_SUS0_SVW2_VWA2_WG128_2_1_WGM1
    SolutionIndex: 237
    SolutionNameMin: Cijk_Ailk_Bljk_S_MX_B_Bias_HA_SAV_UserArgs_MT128x128x32_MI32x32x1_SN_GRVWB4_GSU15_LBSPPA0_LBSPPB128_LPA0_LPB4_LRVW4_MIAV1_MIWT2_2_NLCA1_SU0_SUM0_SUS0_SVW2_VWA2_WG64_4_1_WGM1
    SolutionIndex: 238
    SolutionNameMin: Cijk_Ailk_Bljk_S_MX_B_Bias_HA_SAV_UserArgs_MT192x128x32_MI32x32x1_SN_GRVWB4_GSU20_LBSPPA0_LBSPPB128_LPA0_LPB4_LRVW4_MIAV0_MIWT3_2_NLCA3_SU0_SUM0_SUS0_SVW1_VWA1_WG64_4_1_WGM1
    SolutionIndex: 239
    SolutionNameMin: Cijk_Ailk_Bljk_S_MX_B_Bias_HA_SAV_UserArgs_MT64x32x64_MI32x32x1_SN_GRVWB4_GSU1_LBSPPA0_LBSPPB256_LPA0_LPB4_LRVW4_MIAV1_MIWT1_1_NLCA1_SU0_SUM0_SUS0_SVW1_VWA1_WG64_2_2_WGM1
    SolutionIndex: 240
    SolutionNameMin: Cijk_Ailk_Bljk_S_MX_B_Bias_HA_SAV_UserArgs_MT96x128x32_MI16x16x1_SN_GRVWB4_GSU10_LBSPPA1536_LBSPPB128_LPA16_LPB8_LRVW4_MIAV1_MIWT3_4_NLCA3_SU0_SUM0_SUS0_SVW1_VWA1_WG32_8_1_WGM1
    SolutionIndex: 241
    SolutionNameMin: Cijk_Ailk_Bljk_S_MX_B_Bias_HA_SAV_UserArgs_MT256x128x32_MI32x32x1_SN_CLR1_GRVWB4_GSU20_LBSPPA0_LBSPPB128_LPA0_LPB4_LRVW4_MIAV0_MIWT2_4_NLCA1_PLR1_SU0_SUM0_SUS0_SVW2_VWA2_WG128_2_1_WGM1
    SolutionIndex: 242
    SolutionNameMin: Cijk_Ailk_Bljk_S_MX_B_Bias_HA_SAV_UserArgs_MT192x128x32_MI32x32x1_SN_CLR1_GRVWB4_GSU10_LBSPPA0_LBSPPB128_LPA0_LPB4_LRVW4_MIAV0_MIWT3_2_NLCA3_PLR1_SU0_SUM0_SUS0_SVW1_VWA1_WG64_4_1_WGM1
    SolutionIndex: 243
    SolutionNameMin: Cijk_Ailk_Bljk_S_MX_B_Bias_HA_SAV_UserArgs_MT256x128x32_MI32x32x1_SN_CLR1_GRVWB4_GSU13_LBSPPA0_LBSPPB128_LPA0_LPB4_LRVW4_MIAV0_MIWT2_4_NLCA1_PLR1_SU0_SUM0_SUS0_SVW2_VWA2_WG128_2_1_WGM1
    SolutionIndex: 244
    SolutionNameMin: Cijk_Ailk_Bljk_S_MX_B_Bias_HA_SAV_UserArgs_MT64x64x64_MI32x32x1_SN_CLR1_GRVWB4_GSU1_LBSPPA0_LBSPPB256_LPA0_LPB4_LRVW4_MIAV1_MIWT1_2_NLCA1_PLR1_SU0_SUM0_SUS0_SVW1_VWA1_WG64_2_2_WGM1
    SolutionIndex: 245
    SolutionNameMin: Cijk_Ailk_Bljk_S_MX_B_Bias_HA_SAV_UserArgs_MT192x128x32_MI32x32x1_SN_CLR1_GRVWB4_GSU7_LBSPPA0_LBSPPB128_LPA0_LPB4_LRVW4_MIAV0_MIWT3_2_NLCA3_PLR1_SU0_SUM0_SUS0_SVW1_VWA1_WG64_4_1_WGM1
    SolutionIndex: 246
    SolutionNameMin: Cijk_Ailk_Bljk_S_MX_B_Bias_HA_SAV_UserArgs_MT256x128x32_MI32x32x1_SN_CLR1_GRVWB4_GSU10_LBSPPA0_LBSPPB128_LPA0_LPB4_LRVW4_MIAV0_MIWT2_4_NLCA1_PLR1_SU0_SUM0_SUS0_SVW2_VWA2_WG128_2_1_WGM1
    SolutionIndex: 247
    SolutionNameMin: Cijk_Ailk_Bljk_S_MX_B_Bias_HA_SAV_UserArgs_MT192x128x32_MI32x32x1_SN_CLR1_GRVWB4_GSU5_LBSPPA0_LBSPPB128_LPA0_LPB4_LRVW4_MIAV0_MIWT3_2_NLCA3_PLR1_SU0_SUM0_SUS0_SVW1_VWA1_WG64_4_1_WGM1
    SolutionIndex: 248
    SolutionNameMin: Cijk_Ailk_Bljk_S_MX_B_Bias_HA_SAV_UserArgs_MT384x128x16_MI32x32x1_SN_CLR1_GRVWB4_GSU10_LBSPPA0_LBSPPB128_LPA0_LPB4_LRVW4_MIAV0_MIWT3_4_NLCA3_PLR1_SU0_SUM0_SUS0_SVW1_VWA1_WG128_2_1_WGM1
    SolutionIndex: 249
    SolutionNameMin: Cijk_Ailk_Bljk_S_MX_B_Bias_HA_SAV_UserArgs_MT256x128x32_MI32x32x1_SN_CLR1_GRVWB4_GSU5_LBSPPA0_LBSPPB128_LPA0_LPB4_LRVW4_MIAV0_MIWT2_4_NTA4_NLCA1_PLR1_SU0_SUM0_SUS0_SVW2_VWA2_WG128_2_1_WGM1
    SolutionIndex: 250
    SolutionNameMin: Cijk_Ailk_Bljk_S_MX_B_Bias_HA_SAV_UserArgs_MT384x128x16_MI32x32x1_SN_CLR1_GRVWB4_GSU5_LBSPPA0_LBSPPB128_LPA0_LPB4_LRVW4_MIAV0_MIWT3_4_NTA0_NLCA3_PLR1_SU0_SUM0_SUS0_SVW1_VWA1_WG128_2_1_WGM1
    SolutionIndex: 251
    SolutionNameMin: Cijk_Ailk_Bljk_S_MX_B_Bias_HA_SAV_UserArgs_MT384x128x16_MI32x32x1_SN_CLR1_GRVWB4_GSU5_LBSPPA0_LBSPPB128_LPA0_LPB4_LRVW4_MIAV0_MIWT3_4_NTA4_NLCA3_PLR1_SU0_SUM0_SUS0_SVW1_VWA1_WG128_2_1_WGM1
    SolutionIndex: 252
    SolutionNameMin: Cijk_Ailk_Bljk_S_MX_B_Bias_HA_SAV_UserArgs_MT128x128x32_MI32x32x1_SN_GRVWB4_GSU1_LBSPPA0_LBSPPB128_LPA0_LPB4_LRVW4_MIAV1_MIWT2_2_NTA0_NTC3_NTD3_NLCA1_SU0_SUM0_SUS0_SVW2_VWA2_WG64_4_1_WGM1
    SolutionIndex: 253
    SolutionNameMin: Cijk_Ailk_Bljk_S_MX_B_Bias_HA_SAV_UserArgs_MT128x128x32_MI32x32x1_SN_GRVWB4_GSU1_LBSPPA0_LBSPPB128_LPA0_LPB4_LRVW4_MIAV1_MIWT2_2_NTA4_NTC3_NTD3_NLCA1_SU0_SUM0_SUS0_SVW2_VWA2_WG64_4_1_WGM1
    SolutionIndex: 254
    SolutionNameMin: Cijk_Ailk_Bljk_S_MX_B_Bias_HA_SAV_UserArgs_MT320x128x32_MI32x32x1_SN_GRVWB4_GSU3_LBSPPA0_LBSPPB128_LPA0_LPB4_LRVW4_MIAV0_MIWT5_2_NTA0_NTC3_NTD3_NLCA5_SU0_SUM0_SUS0_SVW1_VWA1_WG64_4_1_WGM1
    SolutionIndex: 255
    SolutionNameMin: Cijk_Ailk_Bljk_S_MX_B_Bias_HA_SAV_UserArgs_MT192x128x32_MI32x32x1_SN_GRVWB4_GSU1_LBSPPA0_LBSPPB128_LPA0_LPB4_LRVW4_MIAV0_MIWT3_2_NTA4_NTC3_NTD3_NLCA3_SU0_SUM0_SUS0_SVW1_VWA1_WG64_4_1_WGM1
    SolutionIndex: 256
    SolutionNameMin: Cijk_Ailk_Bljk_S_MX_B_Bias_HA_SAV_UserArgs_MT160x128x32_MI16x16x1_SN_GRVWB4_GSU1_LBSPPA2560_LBSPPB128_LPA16_LPB8_LRVW4_MIAV1_MIWT5_4_NTA4_NTC3_NTD3_NLCA5_SU0_SUM0_SUS0_SVW1_VWA1_WG32_8_1_WGM1
    SolutionIndex: 257
    SolutionNameMin: Cijk_Ailk_Bljk_S_MX_B_Bias_HA_SAV_UserArgs_MT320x128x16_MI32x32x1_SN_GRVWB4_GSU2_LBSPPA0_LBSPPB128_LPA0_LPB4_LRVW4_MIAV0_MIWT5_2_NTA4_NTC3_NTD3_NLCA5_SU0_SUM0_SUS0_SVW1_VWA1_WG64_4_1_WGM1
    SolutionIndex: 258
    SolutionNameMin: Cijk_Ailk_Bljk_S_MX_B_Bias_HA_SAV_UserArgs_MT256x128x32_MI32x32x1_SN_GRVWB4_GSU1_LBSPPA0_LBSPPB128_LPA0_LPB4_LRVW4_MIAV0_MIWT2_4_NTA4_NTC3_NTD3_NLCA1_SU0_SUM0_SUS0_SVW2_VWA2_WG128_2_1_WGM1
    SolutionIndex: 259
    SolutionNameMin: Cijk_Ailk_Bljk_S_MX_B_Bias_HA_SAV_UserArgs_MT448x128x16_MI32x32x1_SN_GRVWB4_GSU2_LBSPPA0_LBSPPB128_LPA0_LPB4_LRVW4_MIAV0_MIWT7_2_NTA4_NTC3_NTD3_NLCA7_SU0_SUM0_SUS0_SVW1_VWA1_WG64_4_1_WGM1
    SolutionIndex: 260
    SolutionNameMin: Cijk_Ailk_Bljk_S_MX_B_Bias_HA_SAV_UserArgs_MT384x128x16_MI32x32x1_SN_GRVWB4_GSU1_LBSPPA0_LBSPPB128_LPA0_LPB4_LRVW4_MIAV0_MIWT6_2_NTA4_NTC3_NTD3_NLCA3_SU0_SUM0_SUS0_SVW2_VWA2_WG64_4_1_WGM1
    SolutionIndex: 261
    SolutionNameMin: Cijk_Ailk_Bljk_S_MX_B_Bias_HA_SAV_UserArgs_MT320x128x32_MI32x32x1_SN_GRVWB4_GSU1_LBSPPA0_LBSPPB128_LPA0_LPB4_LRVW4_MIAV0_MIWT5_2_NTA4_NTC3_NTD3_NLCA5_SU0_SUM0_SUS0_SVW1_VWA1_WG64_4_1_WGM1
    SolutionIndex: 262
    SolutionNameMin: Cijk_Ailk_Bljk_S_MX_B_Bias_HA_SAV_UserArgs_MT320x128x32_MI32x32x1_SN_GRVWB4_GSU1_LBSPPA0_LBSPPB128_LPA0_LPB4_LRVW4_MIAV0_MIWT5_2_NTA4_NTC0_NTD0_NLCA5_SU0_SUM0_SUS0_SVW1_VWA1_WG64_4_1_WGM1
    SolutionIndex: 263
    SolutionNameMin: Cijk_Ailk_Bljk_S_MX_B_Bias_HA_SAV_UserArgs_MT256x128x16_MI32x32x1_SN_GRVWB4_GSU1_LBSPPA0_LBSPPB128_LPA0_LPB4_LRVW4_MIAV0_MIWT2_4_NTA4_NTC3_NTD3_NLCA1_SU0_SUM0_SUS0_SVW2_VWA2_WG128_2_1_WGM1
    SolutionIndex: 264
    SolutionNameMin: Cijk_Ailk_Bljk_S_MX_B_Bias_HA_SAV_UserArgs_MT448x128x16_MI32x32x1_SN_GRVWB4_GSU1_LBSPPA0_LBSPPB128_LPA0_LPB4_LRVW4_MIAV0_MIWT7_2_NTA0_NTC3_NTD3_NLCA7_SU0_SUM0_SUS0_SVW1_VWA1_WG64_4_1_WGM1
    SolutionIndex: 265
    SolutionNameMin: Cijk_Ailk_Bljk_S_MX_B_Bias_HA_SAV_UserArgs_MT16x32x64_MI16x16x1_SN_LDSB0_GRVWB4_GSU16_LBSPPB256_MIWT1_1_NLCB1_SU0_SUM0_SUS0_WG16_8_1_WGM1
    SolutionIndex: 266
    SolutionNameMin: Cijk_Ailk_Bljk_S_MX_B_Bias_HA_SAV_UserArgs_MT16x64x64_MI16x16x1_SN_LDSB0_GRVWB4_GSU22_LBSPPB256_MIWT1_1_NLCB1_SU0_SUM0_SUS0_WG16_16_1_WGM1
    SolutionIndex: 267
    SolutionNameMin: Cijk_Ailk_Bljk_S_MX_B_Bias_HA_SAV_UserArgs_MT16x64x128_MI16x16x1_SN_LDSB1_GRVWB4_GSU26_LBSPPB512_MIWT1_1_NLCB1_SU0_SUM0_SUS0_WG16_16_1_WGM1
    SolutionIndex: 268
    SolutionNameMin: Cijk_Ailk_Bljk_S_MX_B_Bias_HA_SAV_UserArgs_MT16x32x128_MI16x16x1_SN_LDSB0_GRVWB4_GSU11_LBSPPA256_LBSPPB512_LPA16_LPB8_MIWT1_1_NLCB1_SU0_SUM0_SUS0_SVW1_VWA1_WG16_8_2_WGM1
    SolutionIndex: 269
    SolutionNameMin: Cijk_Ailk_Bljk_S_MX_B_Bias_HA_SAV_UserArgs_MT16x32x256_MI16x16x1_SN_LDSB1_GRVWB4_GSU13_LBSPPA256_LBSPPB1024_LPA16_LPB8_MIWT1_1_NLCB1_SU0_SUM0_SUS0_SVW1_VWA1_WG16_8_2_WGM1
    SolutionIndex: 270
    SolutionNameMin: Cijk_Ailk_Bljk_S_MX_B_Bias_HA_SAV_UserArgs_MT32x32x64_MI16x16x1_SN_LDSB0_GRVWB4_GSU13_LBSPPA512_LBSPPB256_LPA16_LPB8_MIWT1_1_NLCB1_SU0_SUM0_SUS0_SVW1_VWA1_WG32_8_1_WGM1
    SolutionIndex: 271
    SolutionNameMin: Cijk_Ailk_Bljk_S_MX_B_Bias_HA_SAV_UserArgs_MT32x32x128_MI16x16x1_SN_LDSB1_GRVWB4_GSU13_LBSPPA512_LBSPPB512_LPA16_LPB8_MIWT1_1_NLCB1_SU0_SUM0_SUS0_SVW1_VWA1_WG32_8_1_WGM1
    SolutionIndex: 272
    SolutionNameMin: Cijk_Ailk_Bljk_S_MX_B_Bias_HA_SAV_UserArgs_MT16x16x128_MI16x16x1_SN_LDSB0_GRVWB4_GSU1_LBSPPA256_LBSPPB512_LPA16_LPB8_LRVW4_MIWT1_1_NLCA1_NLCB1_SU0_SUM0_SUS0_SVW1_VWA1_WG16_4_2_WGM1
    SolutionIndex: 273
    SolutionNameMin: Cijk_Ailk_Bljk_S_MX_B_Bias_HA_SAV_UserArgs_MT32x64x32_MI16x16x1_SN_LDSB0_GRVWB4_GSU12_LBSPPA512_LBSPPB128_LPA16_LPB8_LRVW4_MIWT1_2_NLCA1_NLCB1_SU0_SUM0_SUS0_SVW1_VWA1_WG32_8_1_WGM1
    SolutionIndex: 274
    SolutionNameMin: Cijk_Ailk_Bljk_S_MX_B_Bias_HA_SAV_UserArgs_MT64x64x64_MI32x32x1_SN_LDSB1_GRVWB4_GSU23_LBSPPA0_LBSPPB256_LPA0_LPB4_LRVW4_MIWT1_1_NLCA1_NLCB1_SU0_SUM0_SUS0_SVW1_VWA1_WG64_4_1_WGM1
    SolutionIndex: 275
    SolutionNameMin: Cijk_Ailk_Bljk_S_MX_B_Bias_HA_SAV_UserArgs_MT16x16x256_MI16x16x1_SN_LDSB1_GRVWB4_GSU1_LBSPPA256_LBSPPB1024_LPA16_LPB8_LRVW4_MIWT1_1_NLCA1_NLCB1_SU0_SUM0_SUS0_SVW1_VWA1_WG16_4_2_WGM1
    SolutionIndex: 276
    SolutionNameMin: Cijk_Ailk_Bljk_S_MX_B_Bias_HA_SAV_UserArgs_MT64x64x64_MI32x32x1_SN_LDSB1_GRVWB4_GSU13_LBSPPA0_LBSPPB256_LPA0_LPB4_LRVW4_MIWT1_1_NLCA1_NLCB1_SU0_SUM0_SUS0_SVW1_VWA1_WG64_4_1_WGM1
    SolutionIndex: 277
    SolutionNameMin: Cijk_Ailk_Bljk_S_MX_B_Bias_HA_SAV_UserArgs_MT96x64x64_MI16x16x1_SN_LDSB1_GRVWB4_GSU23_LBSPPA1536_LBSPPB256_LPA16_LPB8_LRVW4_MIWT3_2_NLCA3_NLCB1_SU0_SUM0_SUS0_SVW1_VWA1_WG32_8_1_WGM1
    SolutionIndex: 278
    SolutionNameMin: Cijk_Ailk_Bljk_S_MX_B_Bias_HA_SAV_UserArgs_MT64x64x64_MI32x32x1_SN_LDSB1_GRVWB4_GSU11_LBSPPA0_LBSPPB256_LPA0_LPB4_LRVW4_MIAV1_MIWT1_1_NLCA1_NLCB1_SU0_SUM0_SUS0_SVW1_VWA1_WG64_4_1_WGM1
    SolutionIndex: 279
    SolutionNameMin: Cijk_Ailk_Bljk_S_MX_B_Bias_HA_SAV_UserArgs_MT128x64x64_MI16x16x1_SN_LDSB1_GRVWB4_GSU22_LBSPPA2048_LBSPPB256_LPA0_LPB8_LRVW4_MIAV1_MIWT2_4_NLCA1_NLCB1_SU0_SUM0_SUS0_SVW2_VWA2_WG64_4_1_WGM1
    SolutionIndex: 280
    SolutionNameMin: Cijk_Ailk_Bljk_S_MX_B_Bias_HA_SAV_UserArgs_MT64x64x64_MI32x32x1_SN_LDSB1_GRVWB4_GSU8_LBSPPA0_LBSPPB256_LPA0_LPB4_LRVW4_MIAV1_MIWT1_1_NLCA1_NLCB1_SU0_SUM0_SUS0_SVW1_VWA1_WG64_4_1_WGM1
    SolutionIndex: 281
    SolutionNameMin: Cijk_Ailk_Bljk_S_MX_B_Bias_HA_SAV_UserArgs_MT192x64x32_MI16x16x1_SN_LDSB1_GRVWB4_GSU21_LBSPPA3072_LBSPPB128_LPA16_LPB8_LRVW4_MIAV1_MIWT3_4_NLCA3_NLCB1_SU0_SUM0_SUS0_SVW1_VWA1_WG64_4_1_WGM1
    SolutionIndex: 282
    SolutionNameMin: Cijk_Ailk_Bljk_S_MX_B_Bias_HA_SAV_UserArgs_MT32x32x128_MI16x16x1_SN_LDSB1_GRVWB4_GSU1_LBSPPA512_LBSPPB512_LPA16_LPB8_LRVW4_MIAV1_MIWT1_2_NLCA1_SU0_SUM0_SUS0_SVW1_VWA1_WG32_4_2_WGM1
    SolutionIndex: 283
    SolutionNameMin: Cijk_Ailk_Bljk_S_MX_B_Bias_HA_SAV_UserArgs_MT128x96x32_MI32x32x1_SN_LDSB0_GRVWB4_GSU15_LBSPPA0_LBSPPB128_LPA0_LPB4_LRVW4_MIAV1_MIWT1_3_NLCA1_SU0_SUM0_SUS0_SVW1_VWA1_WG128_2_1_WGM1
    SolutionIndex: 284
    SolutionNameMin: Cijk_Ailk_Bljk_S_MX_B_Bias_HA_SAV_UserArgs_MT128x96x32_MI32x32x1_SN_LDSB0_GRVWB4_GSU16_LBSPPA0_LBSPPB128_LPA0_LPB4_LRVW4_MIAV1_MIWT1_3_NLCA1_SU0_SUM0_SUS0_SVW1_VWA1_WG128_2_1_WGM1
    SolutionIndex: 285
    SolutionNameMin: Cijk_Ailk_Bljk_S_MX_B_Bias_HA_SAV_UserArgs_MT32x32x128_MI16x16x1_SN_LDSB1_GRVWB4_GSU1_LBSPPA512_LBSPPB512_LPA16_LPB8_LRVW4_MIAV1_MIWT1_1_NLCA1_SU0_SUM0_SUS0_SVW1_VWA1_WG32_8_1_WGM1
    SolutionIndex: 286
    SolutionNameMin: Cijk_Ailk_Bljk_S_MX_B_Bias_HA_SAV_UserArgs_MT96x96x32_MI16x16x1_SN_LDSB0_GRVWB4_GSU10_LBSPPA1536_LBSPPB128_LPA16_LPB8_LRVW4_MIAV1_MIWT3_3_NLCA3_SU0_SUM0_SUS0_SVW1_VWA1_WG32_8_1_WGM1
    SolutionIndex: 287
    SolutionNameMin: Cijk_Ailk_Bljk_S_MX_B_Bias_HA_SAV_UserArgs_MT192x96x32_MI16x16x1_SN_LDSB1_GRVWB4_GSU16_LBSPPA3072_LBSPPB128_LPA16_LPB8_LRVW4_MIAV1_MIWT3_6_NLCA3_SU0_SUM0_SUS0_SVW1_VWA1_WG64_4_1_WGM1
    SolutionIndex: 288
    SolutionNameMin: Cijk_Ailk_Bljk_S_MX_B_Bias_HA_SAV_UserArgs_MT128x192x32_MI32x32x1_SN_CLR1_GRVWB4_GSU18_LBSPPA0_LBSPPB128_LPA0_LPB4_LRVW4_MIAV0_MIWT2_3_NLCA1_PLR1_SU0_SUM0_SUS0_SVW2_VWA2_WG64_4_1_WGM1
    SolutionIndex: 289
    SolutionNameMin: Cijk_Ailk_Bljk_S_MX_B_Bias_HA_SAV_UserArgs_MT256x96x32_MI32x32x1_SN_CLR1_GRVWB4_GSU18_LBSPPA0_LBSPPB128_LPA0_LPB4_LRVW4_MIAV0_MIWT2_3_NLCA1_PLR1_SU0_SUM0_SUS0_SVW2_VWA2_WG128_2_1_WGM1
    SolutionIndex: 290
    SolutionNameMin: Cijk_Ailk_Bljk_S_MX_B_Bias_HA_SAV_UserArgs_MT64x32x128_MI32x32x1_SN_CLR1_GRVWB4_GSU1_LBSPPA0_LBSPPB512_LPA0_LPB4_LRVW4_MIAV1_MIWT1_1_NLCA1_PLR1_SU0_SUM0_SUS0_SVW1_VWA1_WG64_2_2_WGM1
    SolutionIndex: 291
    SolutionNameMin: Cijk_Ailk_Bljk_S_MX_B_Bias_HA_SAV_UserArgs_MT128x192x32_MI32x32x1_SN_CLR1_GRVWB4_GSU15_LBSPPA0_LBSPPB128_LPA0_LPB4_LRVW4_MIAV0_MIWT2_3_NLCA1_PLR1_SU0_SUM0_SUS0_SVW2_VWA2_WG64_4_1_WGM1
    SolutionIndex: 292
    SolutionNameMin: Cijk_Ailk_Bljk_S_MX_B_Bias_HA_SAV_UserArgs_MT320x96x32_MI16x16x1_SN_CLR1_GRVWB4_GSU18_LBSPPA5120_LBSPPB128_LPA16_LPB8_LRVW4_MIAV0_MIWT5_6_NLCA5_PLR1_SU0_SUM0_SUS0_SVW1_VWA1_WG64_4_1_WGM1
    SolutionIndex: 293
    SolutionNameMin: Cijk_Ailk_Bljk_S_MX_B_Bias_HA_SAV_UserArgs_MT256x96x32_MI32x32x1_SN_CLR1_GRVWB4_GSU12_LBSPPA0_LBSPPB128_LPA0_LPB4_LRVW4_MIAV0_MIWT2_3_NLCA1_PLR1_SU0_SUM0_SUS0_SVW2_VWA2_WG128_2_1_WGM1
    SolutionIndex: 294
    SolutionNameMin: Cijk_Ailk_Bljk_S_MX_B_Bias_HA_SAV_UserArgs_MT384x96x32_MI32x32x1_SN_CLR1_GRVWB4_GSU18_LBSPPA0_LBSPPB128_LPA0_LPB4_LRVW4_MIAV0_MIWT3_3_NLCA3_PLR1_SU0_SUM0_SUS0_SVW1_VWA1_WG128_2_1_WGM1
    SolutionIndex: 295
    SolutionNameMin: Cijk_Ailk_Bljk_S_MX_B_Bias_HA_SAV_UserArgs_MT64x96x64_MI32x32x1_SN_CLR1_GRVWB4_GSU1_LBSPPA0_LBSPPB256_LPA0_LPB4_LRVW4_MIAV1_MIWT1_3_NLCA1_PLR1_SU0_SUM0_SUS0_SVW1_VWA1_WG64_2_2_WGM1
    SolutionIndex: 296
    SolutionNameMin: Cijk_Ailk_Bljk_S_MX_B_Bias_HA_SAV_UserArgs_MT256x96x32_MI32x32x1_SN_CLR1_GRVWB4_GSU5_LBSPPA0_LBSPPB128_LPA0_LPB4_LRVW4_MIAV0_MIWT2_3_NLCA1_PLR1_SU0_SUM0_SUS0_SVW2_VWA2_WG128_2_1_WGM1
    SolutionIndex: 297
    SolutionNameMin: Cijk_Ailk_Bljk_S_MX_B_Bias_HA_SAV_UserArgs_MT256x192x32_MI32x32x1_SN_CLR1_GRVWB4_GSU10_LBSPPA0_LBSPPB128_LPA0_LPB4_LRVW4_MIAV0_MIWT2_6_NLCA1_PLR1_SU0_SUM0_SUS0_SVW2_VWA2_WG128_2_1_WGM1
    SolutionIndex: 298
    SolutionNameMin: Cijk_Ailk_Bljk_S_MX_B_Bias_HA_SAV_UserArgs_MT128x64x64_MI32x32x1_SN_CLR1_GRVWB4_GSU1_LBSPPA0_LBSPPB256_LPA0_LPB4_LRVW4_MIAV1_MIWT2_2_NLCA1_PLR1_SU0_SUM0_SUS0_SVW2_VWA2_WG64_2_2_WGM1
    SolutionIndex: 299
    SolutionNameMin: Cijk_Ailk_Bljk_S_MX_B_Bias_HA_SAV_UserArgs_MT384x96x32_MI32x32x1_SN_CLR1_GRVWB4_GSU5_LBSPPA0_LBSPPB128_LPA0_LPB4_LRVW4_MIAV0_MIWT3_3_NLCA3_PLR1_SU0_SUM0_SUS0_SVW1_VWA1_WG128_2_1_WGM1
    SolutionIndex: 300
    SolutionNameMin: Cijk_Ailk_Bljk_S_MX_B_Bias_HA_SAV_UserArgs_MT256x192x32_MI32x32x1_SN_GRVWB4_GSU5_LBSPPA0_LBSPPB128_LPA0_LPB4_LRVW4_MIAV0_MIWT2_6_NTA4_NLCA1_SU0_SUM0_SUS0_SVW2_VWA2_WG128_2_1_WGM1
    SolutionIndex: 301
    SolutionNameMin: Cijk_Ailk_Bljk_S_MX_B_Bias_HA_SAV_UserArgs_MT256x64x32_MI32x32x1_SN_GRVWB4_GSU1_LBSPPA0_LBSPPB128_LPA0_LPB4_LRVW4_MIAV1_MIWT2_2_NTA0_NLCA1_SU0_SUM0_SUS0_SVW2_VWA2_WG128_2_1_WGM1
    SolutionIndex: 302
    SolutionNameMin: Cijk_Ailk_Bljk_S_MX_B_Bias_HA_SAV_UserArgs_MT320x192x16_MI32x32x1_SN_GRVWB4_GSU4_LBSPPA0_LBSPPB128_LPA0_LPB4_LRVW4_MIAV0_MIWT5_3_NTA4_NLCA5_SU0_SUM0_SUS0_SVW1_VWA1_WG64_4_1_WGM1
    SolutionIndex: 303
    SolutionNameMin: Cijk_Ailk_Bljk_S_MX_B_Bias_HA_SAV_UserArgs_MT256x96x32_MI32x32x1_SN_GRVWB4_GSU1_LBSPPA0_LBSPPB128_LPA0_LPB4_LRVW4_MIAV0_MIWT2_3_NTA0_NTC3_NTD3_NLCA1_SU0_SUM0_SUS0_SVW2_VWA2_WG128_2_1_WGM1
    SolutionIndex: 304
    SolutionNameMin: Cijk_Ailk_Bljk_S_MX_B_Bias_HA_SAV_UserArgs_MT256x96x32_MI32x32x1_SN_GRVWB4_GSU1_LBSPPA0_LBSPPB128_LPA0_LPB4_LRVW4_MIAV0_MIWT2_3_NTA4_NTC3_NTD3_NLCA1_SU0_SUM0_SUS0_SVW2_VWA2_WG128_2_1_WGM1
    SolutionIndex: 305
    SolutionNameMin: Cijk_Ailk_Bljk_S_MX_B_Bias_HA_SAV_UserArgs_MT320x192x16_MI32x32x1_SN_GRVWB4_GSU3_LBSPPA0_LBSPPB128_LPA0_LPB4_LRVW4_MIAV0_MIWT5_3_NTA4_NTC3_NTD3_NLCA5_SU0_SUM0_SUS0_SVW1_VWA1_WG64_4_1_WGM1
    SolutionIndex: 306
    SolutionNameMin: Cijk_Ailk_Bljk_S_MX_B_Bias_HA_SAV_UserArgs_MT384x96x32_MI32x32x1_SN_GRVWB4_GSU1_LBSPPA0_LBSPPB128_LPA0_LPB4_LRVW4_MIAV0_MIWT3_3_NTA4_NTC3_NTD3_NLCA3_SU0_SUM0_SUS0_SVW1_VWA1_WG128_2_1_WGM1
    SolutionIndex: 307
    SolutionNameMin: Cijk_Ailk_Bljk_S_MX_B_Bias_HA_SAV_UserArgs_MT320x192x16_MI32x32x1_SN_GRVWB4_GSU2_LBSPPA0_LBSPPB128_LPA0_LPB4_LRVW4_MIAV0_MIWT5_3_NTA4_NTC3_NTD3_NLCA5_SU0_SUM0_SUS0_SVW1_VWA1_WG64_4_1_WGM1
    SolutionIndex: 308
    SolutionNameMin: Cijk_Ailk_Bljk_S_MX_B_Bias_HA_SAV_UserArgs_MT256x192x16_MI32x32x1_SN_GRVWB4_GSU1_LBSPPA0_LBSPPB128_LPA0_LPB4_LRVW4_MIAV0_MIWT2_6_NTA4_NTC3_NTD3_NLCA1_SU0_SUM0_SUS0_SVW2_VWA2_WG128_2_1_WGM1
    SolutionIndex: 309
    SolutionNameMin: Cijk_Ailk_Bljk_S_MX_B_Bias_HA_SAV_UserArgs_MT256x192x32_MI32x32x1_SN_GRVWB4_GSU1_LBSPPA0_LBSPPB128_LPA0_LPB4_LRVW4_MIAV0_MIWT2_6_NTA4_NTC3_NTD3_NLCA1_SU0_SUM0_SUS0_SVW2_VWA2_WG128_2_1_WGM1
    SolutionIndex: 310
    SolutionNameMin: Cijk_Ailk_Bljk_S_MX_B_Bias_HA_SAV_UserArgs_MT256x192x16_MI32x32x1_SN_GRVWB4_GSU1_LBSPPA0_LBSPPB128_LPA0_LPB4_LRVW4_MIAV0_MIWT2_6_NTA0_NTC3_NTD3_NLCA1_SU0_SUM0_SUS0_SVW2_VWA2_WG128_2_1_WGM1
    SolutionIndex: 311
    SolutionNameMin: Cijk_Ailk_Bljk_S_MX_B_Bias_HA_SAV_UserArgs_MT256x192x32_MI32x32x1_SN_GRVWB4_GSU1_LBSPPA0_LBSPPB128_LPA0_LPB4_LRVW4_MIAV0_MIWT2_6_NTA0_NTC3_NTD3_NLCA1_SU0_SUM0_SUS0_SVW2_VWA2_WG128_2_1_WGM1
    SolutionIndex: 312
    SolutionNameMin: Cijk_Ailk_Bljk_S_MX_B_Bias_HA_SAV_UserArgs_MT320x96x16_MI16x16x1_SN_GRVWB1_GSU1_LBSPPA2560_LBSPPB128_LPA16_LPB2_LRVW2_MIAV0_MIWT5_6_NTA0_NTC0_NTD0_NLCA5_SU0_SUM0_SUS0_SVW1_VWA1_WG64_4_1_WGM1
    SolutionIndex: 313
    SolutionNameMin: Cijk_Ailk_Bljk_S_MX_B_Bias_HA_SAV_UserArgs_MT320x192x16_MI32x32x1_SN_GRVWB4_GSU1_LBSPPA0_LBSPPB128_LPA0_LPB4_LRVW4_MIAV0_MIWT5_3_NTA4_NTC3_NTD3_NLCA5_SU0_SUM0_SUS0_SVW1_VWA1_WG64_4_1_WGM1
    SolutionIndex: 314
    SolutionNameMin: Cijk_Ailk_Bljk_S_MX_B_Bias_HA_SAV_UserArgs_MT256x64x16_MI32x32x1_SN_GRVWB4_GSU1_LBSPPA0_LBSPPB128_LPA0_LPB4_LRVW4_MIAV1_MIWT2_2_NTA0_NTC3_NTD3_NLCA1_SU0_SUM0_SUS0_SVW2_VWA2_WG128_2_1_WGM1
    SolutionIndex: 315
    SolutionNameMin: Cijk_Ailk_Bljk_S_MX_B_Bias_HA_SAV_UserArgs_MT16x16x256_MI16x16x1_SN_LDSB1_GRVWB4_GSU1_LBSPPA256_LBSPPB1024_LPB8_LRVW4_MIWT1_1_NLCB1_SU0_SUM0_SUS0_WG16_4_4_WGM1
    SolutionIndex: 316
    SolutionNameMin: Cijk_Ailk_Bljk_S_MX_B_Bias_HA_SAV_UserArgs_MT16x64x64_MI16x16x1_SN_LDSB0_GRVWB4_GSU16_LBSPPA256_LBSPPB256_LPB8_LRVW4_MIWT1_1_NLCB1_SU0_SUM0_SUS0_WG16_16_1_WGM1
    SolutionIndex: 317
    SolutionNameMin: Cijk_Ailk_Bljk_S_MX_B_Bias_HA_SAV_UserArgs_MT16x64x128_MI16x16x1_SN_LDSB1_GRVWB4_GSU19_LBSPPA256_LBSPPB512_LPB8_LRVW4_MIWT1_1_NLCB1_SU0_SUM0_SUS0_WG16_16_1_WGM1
    SolutionIndex: 318
    SolutionNameMin: Cijk_Ailk_Bljk_S_MX_B_Bias_HA_SAV_UserArgs_MT16x64x128_MI16x16x1_SN_LDSB1_GRVWB4_GSU12_LBSPPA256_LBSPPB512_LPB8_LRVW4_MIWT1_1_NLCB1_SU0_SUM0_SUS0_WG16_16_1_WGM1
    SolutionIndex: 319
    SolutionNameMin: Cijk_Ailk_Bljk_S_MX_B_Bias_HA_SAV_UserArgs_MT16x96x128_MI16x16x1_SN_LDSB1_GRVWB4_GSU19_LBSPPA256_LBSPPB512_LPB8_LRVW4_MIWT1_3_NLCB1_SU0_SUM0_SUS0_WG16_8_2_WGM1
    SolutionIndex: 320
    SolutionNameMin: Cijk_Ailk_Bljk_S_MX_B_Bias_HA_SAV_UserArgs_MT16x16x256_MI16x16x1_SN_LDSB1_GRVWB4_GSU1_LBSPPA256_LBSPPB1024_LPA16_LPB8_LRVW4_MIWT1_1_NLCB1_SU0_SUM0_SUS0_SVW1_VWA1_WG16_4_4_WGM1
    SolutionIndex: 321
    SolutionNameMin: Cijk_Ailk_Bljk_S_MX_B_Bias_HA_SAV_UserArgs_MT16x64x64_MI16x16x1_SN_LDSB0_GRVWB4_GSU16_LBSPPA256_LBSPPB256_LPA16_LPB8_LRVW4_MIWT1_1_NLCB1_SU0_SUM0_SUS0_SVW1_VWA1_WG16_16_1_WGM1
    SolutionIndex: 322
    SolutionNameMin: Cijk_Ailk_Bljk_S_MX_B_Bias_HA_SAV_UserArgs_MT16x64x128_MI16x16x1_SN_LDSB1_GRVWB4_GSU20_LBSPPA256_LBSPPB512_LPA16_LPB8_LRVW4_MIWT1_1_NLCB1_SU0_SUM0_SUS0_SVW1_VWA1_WG16_16_1_WGM1
    SolutionIndex: 323
    SolutionNameMin: Cijk_Ailk_Bljk_S_MX_B_Bias_HA_SAV_UserArgs_MT32x64x64_MI16x16x1_SN_LDSB0_GRVWB4_GSU16_LBSPPA512_LBSPPB256_LPA16_LPB8_LRVW4_MIWT1_2_NLCB1_SU0_SUM0_SUS0_SVW1_VWA1_WG32_8_1_WGM1
    SolutionIndex: 324
    SolutionNameMin: Cijk_Ailk_Bljk_S_MX_B_Bias_HA_SAV_UserArgs_MT32x64x128_MI16x16x1_SN_LDSB1_GRVWB4_GSU16_LBSPPA512_LBSPPB512_LPA16_LPB8_LRVW4_MIWT1_2_NLCB1_SU0_SUM0_SUS0_SVW1_VWA1_WG32_8_1_WGM1
    SolutionIndex: 325
    SolutionNameMin: Cijk_Ailk_Bljk_S_MX_B_Bias_HA_SAV_UserArgs_MT16x64x128_MI16x16x1_SN_LDSB1_GRVWB4_GSU11_LBSPPA256_LBSPPB512_LPA16_LPB8_LRVW4_MIWT1_1_NLCB1_SU0_SUM0_SUS0_SVW1_VWA1_WG16_16_1_WGM1
    SolutionIndex: 326
    SolutionNameMin: Cijk_Ailk_Bljk_S_MX_B_Bias_HA_SAV_UserArgs_MT16x64x128_MI16x16x1_SN_LDSB1_GRVWB4_GSU13_LBSPPA256_LBSPPB512_LPA16_LPB8_LRVW4_MIWT1_1_NLCB1_SU0_SUM0_SUS0_SVW1_VWA1_WG16_16_1_WGM1
    SolutionIndex: 327
    SolutionNameMin: Cijk_Ailk_Bljk_S_MX_B_Bias_HA_SAV_UserArgs_MT32x64x128_MI16x16x1_SN_LDSB1_GRVWB4_GSU12_LBSPPA512_LBSPPB512_LPA16_LPB8_LRVW4_MIWT1_2_NLCB1_SU0_SUM0_SUS0_SVW1_VWA1_WG32_8_1_WGM1
    SolutionIndex: 328
    SolutionNameMin: Cijk_Ailk_Bljk_S_MX_B_Bias_HA_SAV_UserArgs_MT32x96x64_MI16x16x1_SN_LDSB1_GRVWB4_GSU19_LBSPPA512_LBSPPB256_LPA16_LPB8_LRVW4_MIWT1_3_NLCB1_SU0_SUM0_SUS0_SVW1_VWA1_WG32_8_1_WGM1
    SolutionIndex: 329
    SolutionNameMin: Cijk_Ailk_Bljk_S_MX_B_Bias_HA_SAV_UserArgs_MT16x16x128_MI16x16x1_SN_LDSB0_GRVWB4_GSU1_LBSPPA256_LBSPPB512_LPA16_LPB8_LRVW4_MIAV1_MIWT1_1_NLCA1_NLCB1_SU0_SUM0_SUS0_SVW1_VWA1_WG16_4_2_WGM1
    SolutionIndex: 330
    SolutionNameMin: Cijk_Ailk_Bljk_S_MX_B_Bias_HA_SAV_UserArgs_MT32x128x64_MI32x32x1_SN_LDSB1_GRVWB4_GSU16_LBSPPA0_LBSPPB256_LPA0_LPB4_LRVW4_MIAV1_MIWT1_1_NLCA1_NLCB1_SU0_SUM0_SUS0_SVW1_VWA1_WG32_8_1_WGM1
    SolutionIndex: 331
    SolutionNameMin: Cijk_Ailk_Bljk_S_MX_B_Bias_HA_SAV_UserArgs_MT64x64x64_MI32x32x1_SN_LDSB1_GRVWB4_GSU16_LBSPPA0_LBSPPB256_LPA0_LPB4_LRVW4_MIAV1_MIWT1_1_NLCA1_NLCB1_SU0_SUM0_SUS0_SVW1_VWA1_WG64_4_1_WGM1
    SolutionIndex: 332
    SolutionNameMin: Cijk_Ailk_Bljk_S_MX_B_Bias_HA_SAV_UserArgs_MT16x32x128_MI16x16x1_SN_LDSB1_GRVWB4_GSU1_LBSPPA256_LBSPPB512_LPA16_LPB8_LRVW4_MIAV1_MIWT1_2_NLCA1_NLCB1_SU0_SUM0_SUS0_SVW1_VWA1_WG16_4_4_WGM1
    SolutionIndex: 333
    SolutionNameMin: Cijk_Ailk_Bljk_S_MX_B_Bias_HA_SAV_UserArgs_MT64x64x64_MI32x32x1_SN_LDSB1_GRVWB4_GSU10_LBSPPA0_LBSPPB256_LPA0_LPB4_LRVW4_MIAV1_MIWT1_1_NLCA1_NLCB1_SU0_SUM0_SUS0_SVW1_VWA1_WG64_4_1_WGM1
    SolutionIndex: 334
    SolutionNameMin: Cijk_Ailk_Bljk_S_MX_B_Bias_HA_SAV_UserArgs_MT96x64x64_MI16x16x1_SN_LDSB1_GRVWB4_GSU16_LBSPPA1536_LBSPPB256_LPA16_LPB8_LRVW4_MIAV1_MIWT3_2_NLCA3_NLCB1_SU0_SUM0_SUS0_SVW1_VWA1_WG32_8_1_WGM1
    SolutionIndex: 335
    SolutionNameMin: Cijk_Ailk_Bljk_S_MX_B_Bias_HA_SAV_UserArgs_MT64x48x64_MI16x16x1_SN_LDSB0_GRVWB4_GSU10_LBSPPA1024_LBSPPB256_LPA16_LPB8_LRVW4_MIAV1_MIWT1_3_NLCA1_NLCB1_SU0_SUM0_SUS0_SVW1_VWA1_WG64_4_1_WGM1
    SolutionIndex: 336
    SolutionNameMin: Cijk_Ailk_Bljk_S_MX_B_Bias_HA_SAV_UserArgs_MT64x96x64_MI16x16x1_SN_LDSB1_GRVWB4_GSU19_LBSPPA1024_LBSPPB256_LPA0_LPB8_LRVW4_MIAV1_MIWT2_3_NLCA1_NLCB1_SU0_SUM0_SUS0_SVW2_VWA2_WG32_8_1_WGM1
    SolutionIndex: 337
    SolutionNameMin: Cijk_Ailk_Bljk_S_MX_B_Bias_HA_SAV_UserArgs_MT16x32x128_MI16x16x1_SN_LDSB0_GRVWB4_GSU1_LBSPPA256_LBSPPB512_LPA16_LPB8_LRVW4_MIAV1_MIWT1_2_NLCA1_NLCB1_SU0_SUM0_SUS0_SVW1_VWA1_WG16_4_4_WGM1
    SolutionIndex: 338
    SolutionNameMin: Cijk_Ailk_Bljk_S_MX_B_Bias_HA_SAV_UserArgs_MT32x64x128_MI32x32x1_SN_LDSB1_GRVWB4_GSU4_LBSPPA0_LBSPPB512_LPA0_LPB4_LRVW4_MIAV1_MIWT1_2_NLCA1_NLCB1_SU0_SUM0_SUS0_SVW1_VWA1_WG32_2_4_WGM1
    SolutionIndex: 339
    SolutionNameMin: Cijk_Ailk_Bljk_S_MX_B_Bias_HA_SAV_UserArgs_MT96x96x64_MI16x16x1_SN_LDSB1_GRVWB4_GSU19_LBSPPA1536_LBSPPB256_LPA16_LPB8_LRVW4_MIAV1_MIWT3_3_NLCA3_NLCB1_SU0_SUM0_SUS0_SVW1_VWA1_WG32_8_1_WGM1
    SolutionIndex: 340
    SolutionNameMin: Cijk_Ailk_Bljk_S_MX_B_Bias_HA_SAV_UserArgs_MT32x16x128_MI16x16x1_SN_LDSB1_GRVWB4_GSU1_LBSPPA512_LBSPPB512_LPA16_LPB8_LRVW4_MIAV1_MIWT1_1_NLCA1_SU0_SUM0_SUS0_SVW1_VWA1_WG32_4_1_WGM1
    SolutionIndex: 341
    SolutionNameMin: Cijk_Ailk_Bljk_S_MX_B_Bias_HA_SAV_UserArgs_MT64x128x32_MI32x32x1_SN_LDSB0_GRVWB4_GSU15_LBSPPA0_LBSPPB128_LPA0_LPB4_LRVW4_MIAV1_MIWT1_2_NLCA1_SU0_SUM0_SUS0_SVW1_VWA1_WG64_4_1_WGM1
    SolutionIndex: 342
    SolutionNameMin: Cijk_Ailk_Bljk_S_MX_B_Bias_HA_SAV_UserArgs_MT128x64x32_MI32x32x1_SN_LDSB0_GRVWB4_GSU15_LBSPPA0_LBSPPB128_LPA0_LPB4_LRVW4_MIAV1_MIWT1_2_NLCA1_SU0_SUM0_SUS0_SVW1_VWA1_WG128_2_1_WGM1
    SolutionIndex: 343
    SolutionNameMin: Cijk_Ailk_Bljk_S_MX_B_Bias_HA_SAV_UserArgs_MT64x128x32_MI32x32x1_SN_LDSB0_GRVWB4_GSU10_LBSPPA0_LBSPPB128_LPA0_LPB4_LRVW4_MIAV1_MIWT1_2_NLCA1_SU0_SUM0_SUS0_SVW1_VWA1_WG64_4_1_WGM1
    SolutionIndex: 344
    SolutionNameMin: Cijk_Ailk_Bljk_S_MX_B_Bias_HA_SAV_UserArgs_MT192x128x32_MI32x32x1_SN_LDSB1_GRVWB4_GSU29_LBSPPA0_LBSPPB128_LPA0_LPB4_LRVW4_MIAV0_MIWT3_2_NLCA3_SU0_SUM0_SUS0_SVW1_VWA1_WG64_4_1_WGM1
    SolutionIndex: 345
    SolutionNameMin: Cijk_Ailk_Bljk_S_MX_B_Bias_HA_SAV_UserArgs_MT128x96x32_MI32x32x1_SN_LDSB0_GRVWB4_GSU19_LBSPPA0_LBSPPB128_LPA0_LPB4_LRVW4_MIAV1_MIWT1_3_NLCA1_SU0_SUM0_SUS0_SVW1_VWA1_WG128_2_1_WGM1
    SolutionIndex: 346
    SolutionNameMin: Cijk_Ailk_Bljk_S_MX_B_Bias_HA_SAV_UserArgs_MT192x96x32_MI16x16x1_SN_LDSB1_GRVWB4_GSU19_LBSPPA3072_LBSPPB128_LPA16_LPB8_LRVW4_MIAV1_MIWT3_6_NLCA3_SU0_SUM0_SUS0_SVW1_VWA1_WG64_4_1_WGM1
    SolutionIndex: 347
    SolutionNameMin: Cijk_Ailk_Bljk_S_MX_B_Bias_HA_SAV_UserArgs_MT64x128x32_MI32x32x1_SN_LDSB0_GRVWB4_GSU8_LBSPPA0_LBSPPB128_LPA0_LPB4_LRVW4_MIAV1_MIWT1_2_NLCA1_SU0_SUM0_SUS0_SVW1_VWA1_WG64_4_1_WGM1
    SolutionIndex: 348
    SolutionNameMin: Cijk_Ailk_Bljk_S_MX_B_Bias_HA_SAV_UserArgs_MT256x128x32_MI32x32x1_SN_LDSB1_GRVWB4_GSU28_LBSPPA0_LBSPPB128_LPA0_LPB4_LRVW4_MIAV0_MIWT2_4_NLCA1_SU0_SUM0_SUS0_SVW2_VWA2_WG128_2_1_WGM1
    SolutionIndex: 349
    SolutionNameMin: Cijk_Ailk_Bljk_S_MX_B_Bias_HA_SAV_UserArgs_MT32x48x64_MI16x16x1_SN_LDSB0_GRVWB4_GSU1_LBSPPA512_LBSPPB256_LPA16_LPB8_LRVW4_MIAV1_MIWT1_3_NLCA1_SU0_SUM0_SUS0_SVW1_VWA1_WG32_4_2_WGM1
    SolutionIndex: 350
    SolutionNameMin: Cijk_Ailk_Bljk_S_MX_B_Bias_HA_SAV_UserArgs_MT128x96x32_MI32x32x1_SN_LDSB0_GRVWB4_GSU8_LBSPPA0_LBSPPB128_LPA0_LPB4_LRVW4_MIAV1_MIWT1_3_NLCA1_SU0_SUM0_SUS0_SVW1_VWA1_WG128_2_1_WGM1
    SolutionIndex: 351
    SolutionNameMin: Cijk_Ailk_Bljk_S_MX_B_Bias_HA_SAV_UserArgs_MT192x128x32_MI32x32x1_SN_LDSB1_GRVWB4_GSU14_LBSPPA0_LBSPPB128_LPA0_LPB4_LRVW4_MIAV0_MIWT3_2_NLCA3_SU0_SUM0_SUS0_SVW1_VWA1_WG64_4_1_WGM1
    SolutionIndex: 352
    SolutionNameMin: Cijk_Ailk_Bljk_S_MX_B_Bias_HA_SAV_UserArgs_MT256x96x32_MI32x32x1_SN_LDSB1_GRVWB4_GSU14_LBSPPA0_LBSPPB128_LPA0_LPB4_LRVW4_MIAV0_MIWT2_3_NLCA1_SU0_SUM0_SUS0_SVW2_VWA2_WG128_2_1_WGM1
    SolutionIndex: 353
    SolutionNameMin: Cijk_Ailk_Bljk_S_MX_B_Bias_HA_SAV_UserArgs_MT64x32x64_MI32x32x1_SN_LDSB0_GRVWB4_GSU1_LBSPPA0_LBSPPB256_LPA0_LPB4_LRVW4_MIAV1_MIWT1_1_NLCA1_SU0_SUM0_SUS0_SVW1_VWA1_WG64_2_2_WGM1
    SolutionIndex: 354
    SolutionNameMin: Cijk_Ailk_Bljk_S_MX_B_Bias_HA_SAV_UserArgs_MT192x96x32_MI16x16x1_SN_LDSB1_GRVWB4_GSU8_LBSPPA3072_LBSPPB128_LPA16_LPB8_LRVW4_MIAV1_MIWT3_6_NLCA3_SU0_SUM0_SUS0_SVW1_VWA1_WG64_4_1_WGM1
    SolutionIndex: 355
    SolutionNameMin: Cijk_Ailk_Bljk_S_MX_B_Bias_HA_SAV_UserArgs_MT384x96x32_MI32x32x1_SN_LDSB1_GRVWB4_GSU14_LBSPPA0_LBSPPB128_LPA0_LPB4_LRVW4_MIAV0_MIWT3_3_NLCA3_SU0_SUM0_SUS0_SVW1_VWA1_WG128_2_1_WGM1
    SolutionIndex: 356
    SolutionNameMin: Cijk_Ailk_Bljk_S_MX_B_Bias_HA_SAV_UserArgs_MT256x128x16_MI32x32x1_SN_CLR1_GRVWB4_GSU18_LBSPPA0_LBSPPB128_LPA0_LPB4_LRVW4_MIAV0_MIWT2_4_NLCA1_PLR1_SU0_SUM0_SUS0_SVW2_VWA2_WG128_2_1_WGM1
    SolutionIndex: 357
    SolutionNameMin: Cijk_Ailk_Bljk_S_MX_B_Bias_HA_SAV_UserArgs_MT256x128x32_MI32x32x1_SN_CLR1_GRVWB4_GSU18_LBSPPA0_LBSPPB128_LPA0_LPB4_LRVW4_MIAV0_MIWT2_4_NLCA1_PLR1_SU0_SUM0_SUS0_SVW2_VWA2_WG128_2_1_WGM1
    SolutionIndex: 358
    SolutionNameMin: Cijk_Ailk_Bljk_S_MX_B_Bias_HA_SAV_UserArgs_MT128x128x32_MI32x32x1_SN_CLR1_GRVWB4_GSU8_LBSPPA0_LBSPPB128_LPA0_LPB4_LRVW4_MIAV1_MIWT2_2_NLCA1_PLR1_SU0_SUM0_SUS0_SVW2_VWA2_WG64_4_1_WGM1
    SolutionIndex: 359
    SolutionNameMin: Cijk_Ailk_Bljk_S_MX_B_Bias_HA_SAV_UserArgs_MT320x128x32_MI32x32x1_SN_CLR1_GRVWB4_GSU18_LBSPPA0_LBSPPB128_LPA0_LPB4_LRVW4_MIAV0_MIWT5_2_NLCA5_PLR1_SU0_SUM0_SUS0_SVW1_VWA1_WG64_4_1_WGM1
    SolutionIndex: 360
    SolutionNameMin: Cijk_Ailk_Bljk_S_MX_B_Bias_HA_SAV_UserArgs_MT256x128x16_MI32x32x1_SN_CLR1_GRVWB4_GSU12_LBSPPA0_LBSPPB128_LPA0_LPB4_LRVW4_MIAV0_MIWT2_4_NLCA1_PLR1_SU0_SUM0_SUS0_SVW2_VWA2_WG128_2_1_WGM1
    SolutionIndex: 361
    SolutionNameMin: Cijk_Ailk_Bljk_S_MX_B_Bias_HA_SAV_UserArgs_MT256x128x32_MI32x32x1_SN_CLR1_GRVWB4_GSU12_LBSPPA0_LBSPPB128_LPA0_LPB4_LRVW4_MIAV0_MIWT2_4_NLCA1_PLR1_SU0_SUM0_SUS0_SVW2_VWA2_WG128_2_1_WGM1
    SolutionIndex: 362
    SolutionNameMin: Cijk_Ailk_Bljk_S_MX_B_Bias_HA_SAV_UserArgs_MT256x96x32_MI32x32x1_SN_CLR1_GRVWB4_GSU9_LBSPPA0_LBSPPB128_LPA0_LPB4_LRVW4_MIAV0_MIWT2_3_NLCA1_PLR1_SU0_SUM0_SUS0_SVW2_VWA2_WG128_2_1_WGM1
    SolutionIndex: 363
    SolutionNameMin: Cijk_Ailk_Bljk_S_MX_B_Bias_HA_SAV_UserArgs_MT128x192x32_MI32x32x1_SN_CLR1_GRVWB4_GSU7_LBSPPA0_LBSPPB128_LPA0_LPB4_LRVW4_MIAV0_MIWT2_3_NLCA1_PLR1_SU0_SUM0_SUS0_SVW2_VWA2_WG64_4_1_WGM1
    SolutionIndex: 364
    SolutionNameMin: Cijk_Ailk_Bljk_S_MX_B_Bias_HA_SAV_UserArgs_MT320x128x32_MI32x32x1_SN_CLR1_GRVWB4_GSU12_LBSPPA0_LBSPPB128_LPA0_LPB4_LRVW4_MIAV0_MIWT5_2_NLCA5_PLR1_SU0_SUM0_SUS0_SVW1_VWA1_WG64_4_1_WGM1
    SolutionIndex: 365
    SolutionNameMin: Cijk_Ailk_Bljk_S_MX_B_Bias_HA_SAV_UserArgs_MT128x192x32_MI32x32x1_SN_CLR1_GRVWB4_GSU6_LBSPPA0_LBSPPB128_LPA0_LPB4_LRVW4_MIAV0_MIWT2_3_NLCA1_PLR1_SU0_SUM0_SUS0_SVW2_VWA2_WG64_4_1_WGM1
    SolutionIndex: 366
    SolutionNameMin: Cijk_Ailk_Bljk_S_MX_B_Bias_HA_SAV_UserArgs_MT256x128x32_MI32x32x1_SN_CLR1_GRVWB4_GSU8_LBSPPA0_LBSPPB128_LPA0_LPB4_LRVW4_MIAV0_MIWT2_4_NLCA1_PLR1_SU0_SUM0_SUS0_SVW2_VWA2_WG128_2_1_WGM1
    SolutionIndex: 367
    SolutionNameMin: Cijk_Ailk_Bljk_S_MX_B_Bias_HA_SAV_UserArgs_MT128x128x32_MI32x32x1_SN_CLR1_GRVWB4_GSU5_LBSPPA0_LBSPPB128_LPA0_LPB4_LRVW4_MIAV1_MIWT2_2_NLCA1_PLR1_SU0_SUM0_SUS0_SVW2_VWA2_WG64_4_1_WGM1
    SolutionIndex: 368
    SolutionNameMin: Cijk_Ailk_Bljk_S_MX_B_Bias_HA_SAV_UserArgs_MT256x128x32_MI32x32x1_SN_CLR1_GRVWB4_GSU9_LBSPPA0_LBSPPB128_LPA0_LPB4_LRVW4_MIAV0_MIWT2_4_NLCA1_PLR1_SU0_SUM0_SUS0_SVW2_VWA2_WG128_2_1_WGM1
    SolutionIndex: 369
    SolutionNameMin: Cijk_Ailk_Bljk_S_MX_B_Bias_HA_SAV_UserArgs_MT64x96x64_MI16x16x1_SN_CLR1_GRVWB4_GSU1_LBSPPA1024_LBSPPB256_LPA0_LPB8_LRVW4_MIAV1_MIWT2_6_NLCA1_PLR1_SU0_SUM0_SUS0_SVW2_VWA2_WG32_4_2_WGM1
    SolutionIndex: 370
    SolutionNameMin: Cijk_Ailk_Bljk_S_MX_B_Bias_HA_SAV_UserArgs_MT64x80x64_MI16x16x1_SN_CLR1_GRVWB4_GSU1_LBSPPA1024_LBSPPB256_LPA0_LPB8_LRVW4_MIAV1_MIWT2_5_NLCA1_PLR1_SU0_SUM0_SUS0_SVW2_VWA2_WG32_4_2_WGM1
    SolutionIndex: 371
    SolutionNameMin: Cijk_Ailk_Bljk_S_MX_B_Bias_HA_SAV_UserArgs_MT128x256x32_MI32x32x1_SN_CLR1_GRVWB4_GSU5_LBSPPA0_LBSPPB128_LPA0_LPB4_LRVW4_MIAV0_MIWT2_4_NLCA1_PLR1_SU0_SUM0_SUS0_SVW2_VWA2_WG64_4_1_WGM1
    SolutionIndex: 372
    SolutionNameMin: Cijk_Ailk_Bljk_S_MX_B_Bias_HA_SAV_UserArgs_MT256x128x32_MI32x32x1_SN_CLR1_GRVWB4_GSU5_LBSPPA0_LBSPPB128_LPA0_LPB4_LRVW4_MIAV0_MIWT2_4_NLCA1_PLR1_SU0_SUM0_SUS0_SVW2_VWA2_WG128_2_1_WGM1
    SolutionIndex: 373
    SolutionNameMin: Cijk_Ailk_Bljk_S_MX_B_Bias_HA_SAV_UserArgs_MT128x96x64_MI16x16x1_SN_CLR1_GRVWB4_GSU1_LBSPPA2048_LBSPPB256_LPA0_LPB8_LRVW4_MIAV1_MIWT2_6_NLCA1_PLR1_SU0_SUM0_SUS0_SVW2_VWA2_WG64_4_1_WGM1
    SolutionIndex: 374
    SolutionNameMin: Cijk_Ailk_Bljk_S_MX_B_Bias_HA_SAV_UserArgs_MT384x128x16_MI32x32x1_SN_CLR1_GRVWB4_GSU5_LBSPPA0_LBSPPB128_LPA0_LPB4_LRVW4_MIAV0_MIWT3_4_NLCA3_PLR1_SU0_SUM0_SUS0_SVW1_VWA1_WG128_2_1_WGM1
    SolutionIndex: 375
    SolutionNameMin: Cijk_Ailk_Bljk_S_MX_B_Bias_HA_SAV_UserArgs_MT128x80x64_MI16x16x1_SN_CLR1_GRVWB4_GSU1_LBSPPA2048_LBSPPB256_LPA0_LPB8_LRVW4_MIAV1_MIWT2_5_NLCA1_PLR1_SU0_SUM0_SUS0_SVW2_VWA2_WG64_4_1_WGM1
    SolutionIndex: 376
    SolutionNameMin: Cijk_Ailk_Bljk_S_MX_B_Bias_HA_SAV_UserArgs_MT256x192x32_MI32x32x1_SN_CLR1_GRVWB4_GSU5_LBSPPA0_LBSPPB128_LPA0_LPB4_LRVW4_MIAV0_MIWT2_6_NLCA1_PLR1_SU0_SUM0_SUS0_SVW2_VWA2_WG128_2_1_WGM1
    SolutionIndex: 377
    SolutionNameMin: Cijk_Ailk_Bljk_S_MX_B_Bias_HA_SAV_UserArgs_MT128x128x32_MI32x32x1_SN_CLR1_GRVWB4_GSU1_LBSPPA0_LBSPPB128_LPA0_LPB4_LRVW4_MIAV1_MIWT2_2_NLCA1_PLR1_SU0_SUM0_SUS0_SVW2_VWA2_WG64_4_1_WGM1
    SolutionIndex: 378
    SolutionNameMin: Cijk_Ailk_Bljk_S_MX_B_Bias_HA_SAV_UserArgs_MT256x128x32_MI32x32x1_SN_CLR1_GRVWB4_GSU2_LBSPPA0_LBSPPB128_LPA0_LPB4_LRVW4_MIAV0_MIWT2_4_NLCA1_PLR1_SU0_SUM0_SUS0_SVW2_VWA2_WG128_2_1_WGM1
    SolutionIndex: 379
    SolutionNameMin: Cijk_Ailk_Bljk_S_MX_B_Bias_HA_SAV_UserArgs_MT320x128x32_MI32x32x1_SN_GRVWB4_GSU2_LBSPPA0_LBSPPB128_LPA0_LPB4_LRVW4_MIAV0_MIWT5_2_NTA0_NTC3_NTD3_NLCA5_SU0_SUM0_SUS0_SVW1_VWA1_WG64_4_1_WGM1
    SolutionIndex: 380
    SolutionNameMin: Cijk_Ailk_Bljk_S_MX_B_Bias_HA_SAV_UserArgs_MT128x192x32_MI32x32x1_SN_GRVWB4_GSU1_LBSPPA0_LBSPPB128_LPA0_LPB4_LRVW4_MIAV0_MIWT2_3_NTA0_NTC3_NTD3_NLCA1_SU0_SUM0_SUS0_SVW2_VWA2_WG64_4_1_WGM1
    SolutionIndex: 381
    SolutionNameMin: Cijk_Ailk_Bljk_S_MX_B_Bias_HA_SAV_UserArgs_MT224x128x32_MI16x16x1_SN_GRVWB4_GSU1_LBSPPA3584_LPA16_LPB8_LRVW4_MIWT7_4_NTA0_NTC3_NTD3_NLCA7_SU0_SUM0_SUS0_SVW1_VWA1_WG32_8_1_WGM1
    SolutionIndex: 382
    SolutionNameMin: Cijk_Ailk_Bljk_S_MX_B_Bias_HA_SAV_UserArgs_MT448x128x16_MI32x32x1_SN_GRVWB4_GSU2_LBSPPA0_LPA0_LPB4_LRVW4_MIWT7_2_NTA4_NTC3_NTD3_NLCA7_SU0_SUM0_SUS0_SVW1_VWA1_WG64_4_1_WGM1
    SolutionIndex: 383
    SolutionNameMin: Cijk_Ailk_Bljk_S_MX_B_Bias_HA_SAV_UserArgs_MT384x128x16_MI32x32x1_SN_GRVWB4_GSU1_LBSPPA0_LPA0_LPB4_LRVW4_MIWT6_2_NTA4_NTC3_NTD3_NLCA3_SU0_SUM0_SUS0_SVW2_VWA2_WG64_4_1_WGM1
    SolutionIndex: 384
    SolutionNameMin: Cijk_Ailk_Bljk_S_MX_B_Bias_HA_SAV_UserArgs_MT320x128x16_MI32x32x1_SN_GRVWB4_GSU1_LBSPPA0_LPA0_LPB4_LRVW4_MIWT5_2_NTA4_NTC3_NTD3_NLCA5_SU0_SUM0_SUS0_SVW1_VWA1_WG64_4_1_WGM1
    SolutionIndex: 385
    SolutionNameMin: Cijk_Ailk_Bljk_S_MX_B_Bias_HA_SAV_UserArgs_MT320x128x32_MI32x32x1_SN_GRVWB4_GSU1_LBSPPA0_LPA0_LPB4_LRVW4_MIWT5_2_NTA0_NTC3_NTD3_NLCA5_SU0_SUM0_SUS0_SVW1_VWA1_WG64_4_1_WGM1
    SolutionIndex: 386
    SolutionNameMin: Cijk_Ailk_Bljk_S_MX_B_Bias_HA_SAV_UserArgs_MT512x128x16_MI32x32x1_SN_GRVWB4_GSU1_LBSPPA0_LPA0_LPB4_LRVW4_MIWT4_4_NTA4_NTC0_NTD0_NLCA1_SU0_SUM0_SUS0_SVW4_VWA4_WG128_2_1_WGM1
    SolutionIndex: 387
    SolutionNameMin: Cijk_Ailk_Bljk_S_MX_B_Bias_HA_SAV_UserArgs_MT448x128x16_MI32x32x1_SN_GRVWB4_GSU1_LBSPPA0_LPA0_LPB4_LRVW4_MIWT7_2_NTA4_NTC3_NTD3_NLCA7_SU0_SUM0_SUS0_SVW1_VWA1_WG64_4_1_WGM1
    SolutionIndex: 388
    SolutionNameMin: Cijk_Ailk_Bljk_S_MX_B_Bias_HA_SAV_UserArgs_MT256x256x16_MI32x32x1_SN_GRVWB4_GSU1_LBSPPA0_LPA0_LPB4_LRVW4_MIWT4_4_NTA4_NTC3_NTD3_NLCA1_SU0_SUM0_SUS0_SVW4_VWA4_WG64_4_1_WGM1
    SolutionIndex: 389
    SolutionNameMin: Cijk_Ailk_Bljk_S_MX_B_Bias_HA_SAV_UserArgs_MT256x256x16_MI32x32x1_SN_GRVWB4_GSU1_LBSPPA0_LPA0_LPB4_LRVW4_MIWT2_8_NTA4_NTC3_NTD3_NLCA1_SU0_SUM0_SUS0_SVW2_VWA2_WG128_2_1_WGM1
    SolutionIndex: 390
    SolutionNameMin: Cijk_Ailk_Bljk_S_MX_B_Bias_HA_SAV_UserArgs_MT320x128x16_MI16x16x1_SN_GRVWB4_GSU1_LBSPPA2560_LPA16_LPB4_LRVW2_MIWT5_8_NTA4_NTC0_NTD0_NLCA5_SU0_SUM0_SUS0_SVW1_VWA1_WG64_4_1_WGM1
    SolutionIndex: 391
    SolutionNameMin: Cijk_Ailk_Bljk_S_MX_B_Bias_HA_SAV_UserArgs_MT320x128x16_MI16x16x1_SN_GRVWB4_GSU1_LBSPPA2560_LPA16_LPB4_LRVW2_MIWT5_8_NTA4_NTC3_NTD3_NLCA5_SU0_SUM0_SUS0_SVW1_VWA1_WG64_4_1_WGM1
    SolutionIndex: 392
    SolutionNameMin: Cijk_Ailk_Bljk_S_MX_B_Bias_HA_SAV_UserArgs_MT512x128x16_MI32x32x1_SN_GRVWB4_GSU1_LBSPPA0_LPA0_LPB4_LRVW4_MIWT4_4_NTA4_NTC3_NTD3_NLCA1_SU0_SUM0_SUS0_SVW4_VWA4_WG128_2_1_WGM1
    SolutionIndex: 393
    SolutionNameMin: Cijk_Ailk_Bljk_S_MX_B_Bias_HA_SAV_UserArgs_MT448x128x16_MI32x32x1_SN_GRVWB4_GSU1_LBSPPA0_LPA0_LPB4_LRVW4_MIWT7_2_NTA0_NTC0_NTD0_NLCA7_SU0_SUM0_SUS0_SVW1_VWA1_WG64_4_1_WGM1
    SolutionIndex: 394
    SolutionNameMin: Cijk_Ailk_Bljk_S_MX_B_Bias_HA_SAV_UserArgs_MT512x80x16_MI16x16x1_SN_GRVWB1_GSU1_LBSPPA4096_LPA0_LPB2_LRVW2_MIWT8_5_NTA4_NTC3_NTD3_NLCA1_SU0_SUM0_SUS0_SVW4_VWA4_WG64_4_1_WGM1
    SolutionIndex: 395
    SolutionNameMin: Cijk_Ailk_Bljk_S_MX_B_Bias_HA_SAV_UserArgs_MT512x128x16_MI32x32x1_SN_GRVWB1_GSU1_LBSPPA0_LPA0_LPB4_LRVW4_MIWT4_4_NTA4_NTC0_NTD0_NLCA1_SU0_SUM0_SUS0_SVW4_VWA4_WG128_2_1_WGM1
    SolutionIndex: 396
    SolutionNameMin: Cijk_Ailk_Bljk_S_MX_B_Bias_HA_SAV_UserArgs_MT320x192x16_MI32x32x1_SN_GRVWB4_GSU1_LBSPPA0_LPA0_LPB4_LRVW4_MIWT5_3_NTA4_NTC3_NTD3_NLCA5_SU0_SUM0_SUS0_SVW1_VWA1_WG64_4_1_WGM1
    SolutionIndex: 397
    SolutionNameMin: Cijk_Ailk_Bljk_S_MX_B_Bias_HA_SAV_UserArgs_MT512x96x16_MI32x32x1_SN_GRVWB1_GSU1_LBSPPA0_LPA0_LPB4_LRVW4_MIWT4_3_NTA4_NTC0_NTD0_NLCA1_SU0_SUM0_SUS0_SVW4_VWA4_WG128_2_1_WGM1
    SolutionIndex: 398
    SolutionNameMin: Cijk_Ailk_Bljk_S_MX_B_Bias_HA_SAV_UserArgs_MT512x96x16_MI32x32x1_SN_GRVWB1_GSU1_LBSPPA0_LPA0_LPB4_LRVW4_MIWT4_3_NTA0_NTC3_NTD3_NLCA1_SU0_SUM0_SUS0_SVW4_VWA4_WG128_2_1_WGM1
    SolutionIndex: 399
    SolutionNameMin: Cijk_Ailk_Bljk_S_MX_B_Bias_HA_SAV_UserArgs_MT512x128x16_MI32x32x1_SN_GRVWB4_GSU1_LBSPPA0_LPA0_LPB4_LRVW4_MIWT4_4_NTA0_NTC0_NTD0_NLCA1_SU0_SUM0_SUS0_SVW4_VWA4_WG128_2_1_WGM1
    SolutionIndex: 400
    SolutionNameMin: Cijk_Ailk_Bljk_S_MX_B_Bias_HA_SAV_UserArgs_MT320x128x16_MI16x16x1_SN_GRVWB4_GSU1_LBSPPA2560_LPA16_LPB4_LRVW2_MIWT5_8_NTA0_NTC0_NTD0_NLCA5_SU0_SUM0_SUS0_SVW1_VWA1_WG64_4_1_WGM1
    SolutionIndex: 401
    SolutionNameMin: Cijk_Ailk_Bljk_S_MX_B_Bias_HA_SAV_UserArgs_MT320x192x16_MI32x32x1_SN_GRVWB4_GSU1_LBSPPA0_LPA0_LPB4_LRVW4_MIWT5_3_NTA4_NTC0_NTD0_NLCA5_SU0_SUM0_SUS0_SVW1_VWA1_WG64_4_1_WGM1
    SolutionIndex: 402
    SolutionNameMin: Cijk_Ailk_Bljk_S_MX_B_Bias_HA_SAV_UserArgs_MT16x16x256_MI16x16x1_SN_GRVWB4_GSU1_LBSPPA256_LBSPPB1024_LPB8_LRVW4_MIWT1_1_NLCB1_SU0_SUM0_SUS0_WG16_4_4_WGM1
    SolutionIndex: 403
    SolutionNameMin: Cijk_Ailk_Bljk_S_MX_B_Bias_HA_SAV_UserArgs_MT16x64x128_MI16x16x1_SN_GRVWB4_GSU10_LBSPPA256_LBSPPB512_LPB8_LRVW4_MIWT1_1_NLCB1_SU0_SUM0_SUS0_WG16_16_1_WGM1
    SolutionIndex: 404
    SolutionNameMin: Cijk_Ailk_Bljk_S_MX_B_Bias_HA_SAV_UserArgs_MT16x96x128_MI16x16x1_SN_GRVWB4_GSU13_LBSPPA256_LBSPPB512_LPB8_LRVW4_MIWT1_3_NLCB1_SU0_SUM0_SUS0_WG16_8_2_WGM1
    SolutionIndex: 405
    SolutionNameMin: Cijk_Ailk_Bljk_S_MX_B_Bias_HA_SAV_UserArgs_MT16x64x128_MI16x16x1_SN_GRVWB4_GSU8_LBSPPA256_LBSPPB512_LPB8_LRVW4_MIWT1_1_NLCB1_SU0_SUM0_SUS0_WG16_16_1_WGM1
    SolutionIndex: 406
    SolutionNameMin: Cijk_Ailk_Bljk_S_MX_B_Bias_HA_SAV_UserArgs_MT16x96x128_MI16x16x1_SN_GRVWB4_GSU11_LBSPPA256_LBSPPB512_LPB8_LRVW4_MIWT1_3_NLCB1_SU0_SUM0_SUS0_WG16_8_2_WGM1
    SolutionIndex: 407
    SolutionNameMin: Cijk_Ailk_Bljk_S_MX_B_Bias_HA_SAV_UserArgs_MT16x64x64_MI16x16x1_SN_GRVWB4_GSU13_LBSPPA256_LBSPPB256_LPB8_LRVW4_MIWT1_1_NLCB1_SU0_SUM0_SUS0_WG16_16_1_WGM1
    SolutionIndex: 408
    SolutionNameMin: Cijk_Ailk_Bljk_S_MX_B_Bias_HA_SAV_UserArgs_MT16x96x128_MI16x16x1_SN_GRVWB4_GSU10_LBSPPA256_LBSPPB512_LPB8_LRVW4_MIWT1_3_NLCB1_SU0_SUM0_SUS0_WG16_8_2_WGM1
    SolutionIndex: 409
    SolutionNameMin: Cijk_Ailk_Bljk_S_MX_B_Bias_HA_SAV_UserArgs_MT16x16x256_MI16x16x1_SN_GRVWB4_GSU1_LBSPPA256_LBSPPB1024_LPA16_LPB8_LRVW4_MIWT1_1_NLCB1_SU0_SUM0_SUS0_SVW1_VWA1_WG16_4_4_WGM1
    SolutionIndex: 410
    SolutionNameMin: Cijk_Ailk_Bljk_S_MX_B_Bias_HA_SAV_UserArgs_MT16x64x128_MI16x16x1_SN_GRVWB4_GSU8_LBSPPA256_LBSPPB512_LPA16_LPB8_LRVW4_MIWT1_1_NLCB1_SU0_SUM0_SUS0_SVW1_VWA1_WG16_16_1_WGM1
    SolutionIndex: 411
    SolutionNameMin: Cijk_Ailk_Bljk_S_MX_B_Bias_HA_SAV_UserArgs_MT16x96x128_MI16x16x1_SN_GRVWB4_GSU13_LBSPPA256_LBSPPB512_LPA16_LPB8_LRVW4_MIWT1_3_NLCB1_SU0_SUM0_SUS0_SVW1_VWA1_WG16_8_2_WGM1
    SolutionIndex: 412
    SolutionNameMin: Cijk_Ailk_Bljk_S_MX_B_Bias_HA_SAV_UserArgs_MT32x64x64_MI16x16x1_SN_GRVWB4_GSU10_LBSPPA512_LBSPPB256_LPA16_LPB8_LRVW4_MIWT1_2_NLCB1_SU0_SUM0_SUS0_SVW1_VWA1_WG32_8_1_WGM1
    SolutionIndex: 413
    SolutionNameMin: Cijk_Ailk_Bljk_S_MX_B_Bias_HA_SAV_UserArgs_MT32x64x128_MI16x16x1_SN_GRVWB4_GSU10_LBSPPA512_LBSPPB512_LPA16_LPB8_LRVW4_MIWT1_2_NLCB1_SU0_SUM0_SUS0_SVW1_VWA1_WG32_8_1_WGM1
    SolutionIndex: 414
    SolutionNameMin: Cijk_Ailk_Bljk_S_MX_B_Bias_HA_SAV_UserArgs_MT16x96x128_MI16x16x1_SN_GRVWB4_GSU11_LBSPPA256_LBSPPB512_LPA16_LPB8_LRVW4_MIWT1_3_NLCB1_SU0_SUM0_SUS0_SVW1_VWA1_WG16_8_2_WGM1
    SolutionIndex: 415
    SolutionNameMin: Cijk_Ailk_Bljk_S_MX_B_Bias_HA_SAV_UserArgs_MT32x64x128_MI16x16x1_SN_GRVWB4_GSU8_LBSPPA512_LBSPPB512_LPA16_LPB8_LRVW4_MIWT1_2_NLCB1_SU0_SUM0_SUS0_SVW1_VWA1_WG32_8_1_WGM1
    SolutionIndex: 416
    SolutionNameMin: Cijk_Ailk_Bljk_S_MX_B_Bias_HA_SAV_UserArgs_MT32x128x64_MI32x32x1_SN_GRVWB4_GSU16_LBSPPA0_LBSPPB256_LPA0_LPB4_LRVW4_MIWT1_1_NLCB1_SU0_SUM0_SUS0_SVW1_VWA1_WG32_8_1_WGM1
    SolutionIndex: 417
    SolutionNameMin: Cijk_Ailk_Bljk_S_MX_B_Bias_HA_SAV_UserArgs_MT16x64x64_MI16x16x1_SN_GRVWB4_GSU13_LBSPPA256_LBSPPB256_LPA16_LPB8_LRVW4_MIWT1_1_NLCB1_SU0_SUM0_SUS0_SVW1_VWA1_WG16_16_1_WGM1
    SolutionIndex: 418
    SolutionNameMin: Cijk_Ailk_Bljk_S_MX_B_Bias_HA_SAV_UserArgs_MT16x96x128_MI16x16x1_SN_GRVWB4_GSU10_LBSPPA256_LBSPPB512_LPA16_LPB8_LRVW4_MIWT1_3_NLCB1_SU0_SUM0_SUS0_SVW1_VWA1_WG16_8_2_WGM1
    SolutionIndex: 419
    SolutionNameMin: Cijk_Ailk_Bljk_S_MX_B_Bias_HA_SAV_UserArgs_MT16x32x128_MI16x16x1_SN_GRVWB4_GSU1_LBSPPA256_LBSPPB512_LPA16_LPB8_LRVW4_MIWT1_2_NLCB1_SU0_SUM0_SUS0_SVW1_VWA1_WG16_4_4_WGM1
    SolutionIndex: 420
    SolutionNameMin: Cijk_Ailk_Bljk_S_MX_B_Bias_HA_SAV_UserArgs_MT32x128x64_MI32x32x1_SN_GRVWB4_GSU13_LBSPPA0_LBSPPB256_LPA0_LPB4_LRVW4_MIWT1_1_NLCB1_SU0_SUM0_SUS0_SVW1_VWA1_WG32_8_1_WGM1
    SolutionIndex: 421
    SolutionNameMin: Cijk_Ailk_Bljk_S_MX_B_Bias_HA_SAV_UserArgs_MT32x16x256_MI16x16x1_SN_GRVWB4_GSU1_LBSPPA512_LBSPPB1024_LPA16_LPB8_LRVW4_MIAV1_MIWT1_1_NLCA1_NLCB1_SU0_SUM0_SUS0_SVW1_VWA1_WG32_4_2_WGM1
    SolutionIndex: 422
    SolutionNameMin: Cijk_Ailk_Bljk_S_MX_B_Bias_HA_SAV_UserArgs_MT64x128x32_MI32x32x1_SN_GRVWB4_GSU16_LBSPPA0_LBSPPB128_LPA0_LPB4_LRVW4_MIAV1_MIWT1_2_NLCA1_NLCB1_SU0_SUM0_SUS0_SVW1_VWA1_WG64_4_1_WGM1
    SolutionIndex: 423
    SolutionNameMin: Cijk_Ailk_Bljk_S_MX_B_Bias_HA_SAV_UserArgs_MT64x128x64_MI32x32x1_SN_GRVWB4_GSU16_LBSPPA0_LBSPPB256_LPA0_LPB4_LRVW4_MIAV1_MIWT1_2_NLCA1_NLCB1_SU0_SUM0_SUS0_SVW1_VWA1_WG64_4_1_WGM1
    SolutionIndex: 424
    SolutionNameMin: Cijk_Ailk_Bljk_S_MX_B_Bias_HA_SAV_UserArgs_MT32x32x128_MI32x32x1_SN_GRVWB4_GSU1_LBSPPA0_LBSPPB512_LPA0_LPB4_LRVW4_MIAV1_MIWT1_1_NLCA1_NLCB1_SU0_SUM0_SUS0_SVW1_VWA1_WG32_2_4_WGM1
    SolutionIndex: 425
    SolutionNameMin: Cijk_Ailk_Bljk_S_MX_B_Bias_HA_SAV_UserArgs_MT96x128x32_MI16x16x1_SN_GRVWB4_GSU15_LBSPPA1536_LBSPPB128_LPA16_LPB8_LRVW4_MIAV1_MIWT3_4_NLCA3_NLCB1_SU0_SUM0_SUS0_SVW1_VWA1_WG32_8_1_WGM1
    SolutionIndex: 426
    SolutionNameMin: Cijk_Ailk_Bljk_S_MX_B_Bias_HA_SAV_UserArgs_MT96x128x64_MI16x16x1_SN_GRVWB4_GSU15_LBSPPA1536_LBSPPB256_LPA16_LPB8_LRVW4_MIAV1_MIWT3_4_NLCA3_NLCB1_SU0_SUM0_SUS0_SVW1_VWA1_WG32_8_1_WGM1
    SolutionIndex: 427
    SolutionNameMin: Cijk_Ailk_Bljk_S_MX_B_Bias_HA_SAV_UserArgs_MT64x64x32_MI32x32x1_SN_GRVWB4_GSU8_LBSPPA0_LBSPPB128_LPA0_LPB4_LRVW4_MIAV1_MIWT1_1_NLCA1_NLCB1_SU0_SUM0_SUS0_SVW1_VWA1_WG64_4_1_WGM1
    SolutionIndex: 428
    SolutionNameMin: Cijk_Ailk_Bljk_S_MX_B_Bias_HA_SAV_UserArgs_MT64x128x64_MI32x32x1_SN_GRVWB4_GSU15_LBSPPA0_LBSPPB256_LPA0_LPB4_LRVW4_MIAV1_MIWT1_2_NLCA1_NLCB1_SU0_SUM0_SUS0_SVW1_VWA1_WG64_4_1_WGM1
    SolutionIndex: 429
    SolutionNameMin: Cijk_Ailk_Bljk_S_MX_B_Bias_HA_SAV_UserArgs_MT64x64x64_MI32x32x1_SN_GRVWB4_GSU6_LBSPPA0_LBSPPB256_LPA0_LPB4_LRVW4_MIAV1_MIWT1_1_NLCA1_NLCB1_SU0_SUM0_SUS0_SVW1_VWA1_WG64_4_1_WGM1
    SolutionIndex: 430
    SolutionNameMin: Cijk_Ailk_Bljk_S_MX_B_Bias_HA_SAV_UserArgs_MT64x96x64_MI16x16x1_SN_GRVWB4_GSU10_LBSPPA1024_LBSPPB256_LPA0_LPB8_LRVW4_MIAV1_MIWT2_3_NLCA1_NLCB1_SU0_SUM0_SUS0_SVW2_VWA2_WG32_8_1_WGM1
    SolutionIndex: 431
    SolutionNameMin: Cijk_Ailk_Bljk_S_MX_B_Bias_HA_SAV_UserArgs_MT96x192x32_MI16x16x1_SN_GRVWB4_GSU19_LBSPPA1536_LBSPPB128_LPA16_LPB8_LRVW4_MIAV1_MIWT3_6_NLCA3_NLCB1_SU0_SUM0_SUS0_SVW1_VWA1_WG32_8_1_WGM1
    SolutionIndex: 432
    SolutionNameMin: Cijk_Ailk_Bljk_S_MX_B_Bias_HA_SAV_UserArgs_MT96x96x64_MI16x16x1_SN_GRVWB4_GSU10_LBSPPA1536_LBSPPB256_LPA16_LPB8_LRVW4_MIAV1_MIWT3_3_NLCA3_NLCB1_SU0_SUM0_SUS0_SVW1_VWA1_WG32_8_1_WGM1
    SolutionIndex: 433
    SolutionNameMin: Cijk_Ailk_Bljk_S_MX_B_Bias_HA_SAV_UserArgs_MT64x128x32_MI32x32x1_SN_GRVWB4_GSU8_LBSPPA0_LBSPPB128_LPA0_LPB4_LRVW4_MIAV1_MIWT1_2_NLCA1_SU0_SUM0_SUS0_SVW1_VWA1_WG64_4_1_WGM1
    SolutionIndex: 434
    SolutionNameMin: Cijk_Ailk_Bljk_S_MX_B_Bias_HA_SAV_UserArgs_MT128x192x32_MI32x32x1_SN_GRVWB4_GSU19_LBSPPA0_LBSPPB128_LPA0_LPB4_LRVW4_MIAV0_MIWT2_3_NLCA1_SU0_SUM0_SUS0_SVW2_VWA2_WG64_4_1_WGM1
    SolutionIndex: 435
    SolutionNameMin: Cijk_Ailk_Bljk_S_MX_B_Bias_HA_SAV_UserArgs_MT32x48x128_MI16x16x1_SN_GRVWB4_GSU1_LBSPPA512_LBSPPB512_LPA16_LPB8_LRVW4_MIAV1_MIWT1_3_NLCA1_SU0_SUM0_SUS0_SVW1_VWA1_WG32_4_2_WGM1
    SolutionIndex: 436
    SolutionNameMin: Cijk_Ailk_Bljk_S_MX_B_Bias_HA_SAV_UserArgs_MT192x128x32_MI16x16x1_SN_GRVWB4_GSU15_LBSPPA3072_LBSPPB128_LPA16_LPB8_LRVW4_MIAV0_MIWT3_8_NLCA3_SU0_SUM0_SUS0_SVW1_VWA1_WG64_4_1_WGM1
    SolutionIndex: 437
    SolutionNameMin: Cijk_Ailk_Bljk_S_MX_B_Bias_HA_SAV_UserArgs_MT32x64x128_MI32x32x1_SN_GRVWB4_GSU1_LBSPPA0_LBSPPB512_LPA0_LPB4_LRVW4_MIAV1_MIWT1_2_NLCA1_SU0_SUM0_SUS0_SVW1_VWA1_WG32_2_4_WGM1
    SolutionIndex: 438
    SolutionNameMin: Cijk_Ailk_Bljk_S_MX_B_Bias_HA_SAV_UserArgs_MT96x128x32_MI16x16x1_SN_GRVWB4_GSU8_LBSPPA1536_LBSPPB128_LPA16_LPB8_LRVW4_MIAV1_MIWT3_4_NLCA3_SU0_SUM0_SUS0_SVW1_VWA1_WG32_8_1_WGM1
    SolutionIndex: 439
    SolutionNameMin: Cijk_Ailk_Bljk_S_MX_B_Bias_HA_SAV_UserArgs_MT64x32x128_MI32x32x1_SN_GRVWB4_GSU1_LBSPPA0_LBSPPB512_LPA0_LPB4_LRVW4_MIAV1_MIWT1_1_NLCA1_SU0_SUM0_SUS0_SVW1_VWA1_WG64_2_2_WGM1
    SolutionIndex: 440
    SolutionNameMin: Cijk_Ailk_Bljk_S_MX_B_Bias_HA_SAV_UserArgs_MT96x160x32_MI16x16x1_SN_GRVWB4_GSU8_LBSPPA1536_LBSPPB128_LPA16_LPB8_LRVW4_MIAV1_MIWT3_5_NLCA3_SU0_SUM0_SUS0_SVW1_VWA1_WG32_8_1_WGM1
    SolutionIndex: 441
    SolutionNameMin: Cijk_Ailk_Bljk_S_MX_B_Bias_HA_SAV_UserArgs_MT192x192x32_MI32x32x1_SN_GRVWB4_GSU19_LBSPPA0_LBSPPB128_LPA0_LPB4_LRVW4_MIAV0_MIWT3_3_NLCA3_SU0_SUM0_SUS0_SVW1_VWA1_WG64_4_1_WGM1
    SolutionIndex: 442
    SolutionNameMin: Cijk_Ailk_Bljk_S_MX_B_Bias_HA_SAV_UserArgs_MT192x128x32_MI32x32x1_SN_CLR1_GRVWB4_GSU9_LBSPPA0_LBSPPB128_LPA0_LPB4_LRVW4_MIAV0_MIWT3_2_NLCA3_PLR1_SU0_SUM0_SUS0_SVW1_VWA1_WG64_4_1_WGM1
    SolutionIndex: 443
    SolutionNameMin: Cijk_Ailk_Bljk_S_MX_B_Bias_HA_SAV_UserArgs_MT192x256x32_MI32x32x1_SN_CLR1_GRVWB4_GSU18_LBSPPA0_LBSPPB128_LPA0_LPB4_LRVW4_MIAV0_MIWT3_4_NLCA3_PLR1_SU0_SUM0_SUS0_SVW1_VWA1_WG64_4_1_WGM1
    SolutionIndex: 444
    SolutionNameMin: Cijk_Ailk_Bljk_S_MX_B_Bias_HA_SAV_UserArgs_MT256x160x32_MI32x32x1_SN_CLR1_GRVWB4_GSU18_LBSPPA0_LBSPPB128_LPA0_LPB4_LRVW4_MIAV0_MIWT2_5_NLCA1_PLR1_SU0_SUM0_SUS0_SVW2_VWA2_WG128_2_1_WGM1
    SolutionIndex: 445
    SolutionNameMin: Cijk_Ailk_Bljk_S_MX_B_Bias_HA_SAV_UserArgs_MT96x160x32_MI16x16x1_SN_CLR1_GRVWB4_GSU5_LBSPPA1536_LBSPPB128_LPA16_LPB8_LRVW4_MIAV1_MIWT3_5_NLCA3_PLR1_SU0_SUM0_SUS0_SVW1_VWA1_WG32_8_1_WGM1
    SolutionIndex: 446
    SolutionNameMin: Cijk_Ailk_Bljk_S_MX_B_Bias_HA_SAV_UserArgs_MT384x160x16_MI32x32x1_SN_CLR1_GRVWB1_GSU18_LBSPPA0_LBSPPB128_LPA0_LPB4_LRVW4_MIAV0_MIWT3_5_NLCA3_PLR1_SU0_SUM0_SUS0_SVW1_VWA1_WG128_2_1_WGM1
    SolutionIndex: 447
    SolutionNameMin: Cijk_Ailk_Bljk_S_MX_B_Bias_HA_SAV_UserArgs_MT64x64x64_MI32x32x1_SN_CLR1_GRVWB4_GSU1_LBSPPA0_LBSPPB256_LPA0_LPB4_LRVW4_MIAV1_MIWT1_1_NLCA1_PLR1_SU0_SUM0_SUS0_SVW1_VWA1_WG64_4_1_WGM1
    SolutionIndex: 448
    SolutionNameMin: Cijk_Ailk_Bljk_S_MX_B_Bias_HA_SAV_UserArgs_MT128x256x32_MI32x32x1_SN_CLR1_GRVWB4_GSU7_LBSPPA0_LBSPPB128_LPA0_LPB4_LRVW4_MIAV0_MIWT2_4_NLCA1_PLR1_SU0_SUM0_SUS0_SVW2_VWA2_WG64_4_1_WGM1
    SolutionIndex: 449
    SolutionNameMin: Cijk_Ailk_Bljk_S_MX_B_Bias_HA_SAV_UserArgs_MT320x128x32_MI32x32x1_SN_CLR1_GRVWB4_GSU9_LBSPPA0_LBSPPB128_LPA0_LPB4_LRVW4_MIAV0_MIWT5_2_NLCA5_PLR1_SU0_SUM0_SUS0_SVW1_VWA1_WG64_4_1_WGM1
    SolutionIndex: 450
    SolutionNameMin: Cijk_Ailk_Bljk_S_MX_B_Bias_HA_SAV_UserArgs_MT256x128x32_MI32x32x1_SN_CLR1_GRVWB4_GSU6_LBSPPA0_LBSPPB128_LPA0_LPB4_LRVW4_MIAV0_MIWT2_4_NLCA1_PLR1_SU0_SUM0_SUS0_SVW2_VWA2_WG128_2_1_WGM1
    SolutionIndex: 451
    SolutionNameMin: Cijk_Ailk_Bljk_S_MX_B_Bias_HA_SAV_UserArgs_MT256x128x32_MI32x32x1_SN_CLR1_GRVWB4_GSU7_LBSPPA0_LBSPPB128_LPA0_LPB4_LRVW4_MIAV0_MIWT2_4_NLCA1_PLR1_SU0_SUM0_SUS0_SVW2_VWA2_WG128_2_1_WGM1
    SolutionIndex: 452
    SolutionNameMin: Cijk_Ailk_Bljk_S_MX_B_Bias_HA_SAV_UserArgs_MT256x160x32_MI32x32x1_SN_CLR1_GRVWB4_GSU9_LBSPPA0_LBSPPB128_LPA0_LPB4_LRVW4_MIAV0_MIWT2_5_NLCA1_PLR1_SU0_SUM0_SUS0_SVW2_VWA2_WG128_2_1_WGM1
    SolutionIndex: 453
    SolutionNameMin: Cijk_Ailk_Bljk_S_MX_B_Bias_HA_SAV_UserArgs_MT128x192x32_MI32x32x1_SN_CLR1_GRVWB4_GSU4_LBSPPA0_LBSPPB128_LPA0_LPB4_LRVW4_MIAV0_MIWT2_3_NLCA1_PLR1_SU0_SUM0_SUS0_SVW2_VWA2_WG64_4_1_WGM1
    SolutionIndex: 454
    SolutionNameMin: Cijk_Ailk_Bljk_S_MX_B_Bias_HA_SAV_UserArgs_MT320x128x32_MI32x32x1_SN_CLR1_GRVWB4_GSU7_LBSPPA0_LBSPPB128_LPA0_LPB4_LRVW4_MIAV0_MIWT5_2_NLCA5_PLR1_SU0_SUM0_SUS0_SVW1_VWA1_WG64_4_1_WGM1
    SolutionIndex: 455
    SolutionNameMin: Cijk_Ailk_Bljk_S_MX_B_Bias_HA_SAV_UserArgs_MT96x64x64_MI16x16x1_SN_CLR1_GRVWB4_GSU1_LBSPPA1536_LBSPPB256_LPA16_LPB8_LRVW4_MIAV1_MIWT3_2_NLCA3_PLR1_SU0_SUM0_SUS0_SVW1_VWA1_WG32_8_1_WGM1
    SolutionIndex: 456
    SolutionNameMin: Cijk_Ailk_Bljk_S_MX_B_Bias_HA_SAV_UserArgs_MT192x128x32_MI32x32x1_SN_CLR1_GRVWB4_GSU4_LBSPPA0_LBSPPB128_LPA0_LPB4_LRVW4_MIAV0_MIWT3_2_NLCA3_PLR1_SU0_SUM0_SUS0_SVW1_VWA1_WG64_4_1_WGM1
    SolutionIndex: 457
    SolutionNameMin: Cijk_Ailk_Bljk_S_MX_B_Bias_HA_SAV_UserArgs_MT320x128x32_MI32x32x1_SN_CLR1_GRVWB4_GSU6_LBSPPA0_LBSPPB128_LPA0_LPB4_LRVW4_MIAV0_MIWT5_2_NLCA5_PLR1_SU0_SUM0_SUS0_SVW1_VWA1_WG64_4_1_WGM1
    SolutionIndex: 458
    SolutionNameMin: Cijk_Ailk_Bljk_S_MX_B_Bias_HA_SAV_UserArgs_MT256x128x32_MI32x32x1_SN_CLR1_GRVWB4_GSU4_LBSPPA0_LBSPPB128_LPA0_LPB4_LRVW4_MIAV0_MIWT2_4_NLCA1_PLR1_SU0_SUM0_SUS0_SVW2_VWA2_WG128_2_1_WGM1
    SolutionIndex: 459
    SolutionNameMin: Cijk_Ailk_Bljk_S_MX_B_Bias_HA_SAV_UserArgs_MT256x256x16_MI32x32x1_SN_CLR1_GRVWB4_GSU9_LBSPPA0_LBSPPB128_LPA0_LPB4_LRVW4_MIAV0_MIWT2_8_NLCA1_PLR1_SU0_SUM0_SUS0_SVW2_VWA2_WG128_2_1_WGM1
    SolutionIndex: 460
    SolutionNameMin: Cijk_Ailk_Bljk_S_MX_B_Bias_HA_SAV_UserArgs_MT192x256x32_MI32x32x1_SN_CLR1_GRVWB4_GSU5_LBSPPA0_LBSPPB128_LPA0_LPB4_LRVW4_MIAV0_MIWT6_2_NLCA3_PLR1_SU0_SUM0_SUS0_SVW2_VWA2_WG32_8_1_WGM1
    SolutionIndex: 461
    SolutionNameMin: Cijk_Ailk_Bljk_S_MX_B_Bias_HA_SAV_UserArgs_MT192x256x32_MI32x32x1_SN_CLR1_GRVWB4_GSU5_LBSPPA0_LBSPPB128_LPA0_LPB4_LRVW4_MIAV0_MIWT3_4_NLCA3_PLR1_SU0_SUM0_SUS0_SVW1_VWA1_WG64_4_1_WGM1
    SolutionIndex: 462
    SolutionNameMin: Cijk_Ailk_Bljk_S_MX_B_Bias_HA_SAV_UserArgs_MT64x128x64_MI16x16x1_SN_CLR1_GRVWB4_GSU1_LBSPPA1024_LBSPPB256_LPA0_LPB8_LRVW4_MIAV1_MIWT2_8_NLCA1_PLR1_SU0_SUM0_SUS0_SVW2_VWA2_WG32_4_2_WGM1
    SolutionIndex: 463
    SolutionNameMin: Cijk_Ailk_Bljk_S_MX_B_Bias_HA_SAV_UserArgs_MT256x160x32_MI32x32x1_SN_CLR1_GRVWB4_GSU5_LBSPPA0_LBSPPB128_LPA0_LPB4_LRVW4_MIAV0_MIWT2_5_NLCA1_PLR1_SU0_SUM0_SUS0_SVW2_VWA2_WG128_2_1_WGM1
    SolutionIndex: 464
    SolutionNameMin: Cijk_Ailk_Bljk_S_MX_B_Bias_HA_SAV_UserArgs_MT96x128x32_MI16x16x1_SN_CLR1_GRVWB4_GSU1_LBSPPA1536_LBSPPB128_LPA16_LPB8_LRVW4_MIAV1_MIWT3_4_NLCA3_PLR1_SU0_SUM0_SUS0_SVW1_VWA1_WG32_8_1_WGM1
    SolutionIndex: 465
    SolutionNameMin: Cijk_Ailk_Bljk_S_MX_B_Bias_HA_SAV_UserArgs_MT96x128x64_MI16x16x1_SN_CLR1_GRVWB4_GSU1_LBSPPA1536_LBSPPB256_LPA16_LPB8_LRVW4_MIAV1_MIWT3_4_NLCA3_PLR1_SU0_SUM0_SUS0_SVW1_VWA1_WG32_8_1_WGM1
    SolutionIndex: 466
    SolutionNameMin: Cijk_Ailk_Bljk_S_MX_B_Bias_HA_SAV_UserArgs_MT384x128x16_MI32x32x1_SN_CLR1_GRVWB4_GSU4_LBSPPA0_LBSPPB128_LPA0_LPB4_LRVW4_MIAV0_MIWT3_4_NLCA3_PLR1_SU0_SUM0_SUS0_SVW1_VWA1_WG128_2_1_WGM1
    SolutionIndex: 467
    SolutionNameMin: Cijk_Ailk_Bljk_S_MX_B_Bias_HA_SAV_UserArgs_MT256x128x32_MI32x32x1_SN_CLR1_GRVWB4_GSU3_LBSPPA0_LBSPPB128_LPA0_LPB4_LRVW4_MIAV0_MIWT2_4_NLCA1_PLR1_SU0_SUM0_SUS0_SVW2_VWA2_WG128_2_1_WGM1
    SolutionIndex: 468
    SolutionNameMin: Cijk_Ailk_Bljk_S_MX_B_Bias_HA_SAV_UserArgs_MT128x128x32_MI32x32x1_SN_GRVWB4_GSU1_LBSPPA0_LBSPPB128_LPA0_LPB4_LRVW4_MIAV1_MIWT2_2_NTC3_NTD3_NLCA1_SU0_SUM0_SUS0_SVW2_VWA2_WG64_4_1_WGMn8
    SolutionIndex: 469
    SolutionNameMin: Cijk_Ailk_Bljk_S_MX_B_Bias_HA_SAV_UserArgs_MT256x192x32_MI32x32x1_SN_GRVWB4_GSU3_LBSPPA0_LBSPPB128_LPA0_LPB4_LRVW4_MIAV0_MIWT2_6_NTC3_NTD3_NLCA1_SU0_SUM0_SUS0_SVW2_VWA2_WG128_2_1_WGMn8
    SolutionIndex: 470
    SolutionNameMin: Cijk_Ailk_Bljk_S_MX_B_Bias_HA_SAV_UserArgs_MT256x96x32_MI32x32x1_SN_GRVWB4_GSU1_LBSPPA0_LBSPPB128_LPA0_LPB4_LRVW4_MIAV0_MIWT2_3_NTC3_NTD3_NLCA1_SU0_SUM0_SUS0_SVW2_VWA2_WG128_2_1_WGM1
    SolutionIndex: 471
    SolutionNameMin: Cijk_Ailk_Bljk_S_MX_B_Bias_HA_SAV_UserArgs_MT320x128x32_MI32x32x1_SN_GRVWB4_GSU2_LBSPPA0_LBSPPB128_LPA0_LPB4_LRVW4_MIAV0_MIWT5_2_NTC3_NTD3_NLCA5_SU0_SUM0_SUS0_SVW1_VWA1_WG64_4_1_WGMn8
    SolutionIndex: 472
    SolutionNameMin: Cijk_Ailk_Bljk_S_MX_B_Bias_HA_SAV_UserArgs_MT256x224x32_MI32x32x1_SN_GRVWB4_GSU3_LBSPPA0_LBSPPB128_LPA0_LPB4_LRVW4_MIAV0_MIWT2_7_NTC3_NTD3_NLCA1_SU0_SUM0_SUS0_SVW2_VWA2_WG128_2_1_WGMn8
    SolutionIndex: 473
    SolutionNameMin: Cijk_Ailk_Bljk_S_MX_B_Bias_HA_SAV_UserArgs_MT192x128x32_MI16x16x1_SN_GRVWB4_GSU1_LBSPPA3072_LBSPPB128_LPA0_LPB8_LRVW4_MIAV0_MIWT6_4_NTC3_NTD3_NLCA3_SU0_SUM0_SUS0_SVW2_VWA2_WG32_8_1_WGM1
    SolutionIndex: 474
    SolutionNameMin: Cijk_Ailk_Bljk_S_MX_B_Bias_HA_SAV_UserArgs_MT192x128x32_MI32x32x1_SN_GRVWB4_GSU1_LBSPPA0_LBSPPB128_LPA0_LPB4_LRVW4_MIAV0_MIWT3_2_NTC3_NTD3_NLCA3_SU0_SUM0_SUS0_SVW1_VWA1_WG64_4_1_WGM1
    SolutionIndex: 475
    SolutionNameMin: Cijk_Ailk_Bljk_S_MX_B_Bias_HA_SAV_UserArgs_MT384x128x16_MI32x32x1_SN_GRVWB4_GSU2_LBSPPA0_LBSPPB128_LPA0_LPB4_LRVW4_MIAV0_MIWT3_4_NTC3_NTD3_NLCA3_SU0_SUM0_SUS0_SVW1_VWA1_WG128_2_1_WGMn8
    SolutionIndex: 476
    SolutionNameMin: Cijk_Ailk_Bljk_S_MX_B_Bias_HA_SAV_UserArgs_MT128x192x32_MI32x32x1_SN_GRVWB4_GSU1_LBSPPA0_LBSPPB128_LPA0_LPB4_LRVW4_MIAV0_MIWT2_3_NTC3_NTD3_NLCA1_SU0_SUM0_SUS0_SVW2_VWA2_WG64_4_1_WGMn8
    SolutionIndex: 477
    SolutionNameMin: Cijk_Ailk_Bljk_S_MX_B_Bias_HA_SAV_UserArgs_MT256x256x16_MI32x32x1_SN_GRVWB4_GSU3_LBSPPA0_LBSPPB128_LPA0_LPB4_LRVW4_MIAV0_MIWT2_8_NTC3_NTD3_NLCA1_SU0_SUM0_SUS0_SVW2_VWA2_WG128_2_1_WGMn8
    SolutionIndex: 478
    SolutionNameMin: Cijk_Ailk_Bljk_S_MX_B_Bias_HA_SAV_UserArgs_MT256x128x16_MI32x32x1_SN_GRVWB4_GSU1_LBSPPA0_LBSPPB128_LPA0_LPB4_LRVW4_MIAV0_MIWT2_4_NTC3_NTD3_NLCA1_SU0_SUM0_SUS0_SVW2_VWA2_WG128_2_1_WGMn8
    SolutionIndex: 479
    SolutionNameMin: Cijk_Ailk_Bljk_S_MX_B_Bias_HA_SAV_UserArgs_MT256x128x32_MI32x32x1_SN_GRVWB4_GSU1_LBSPPA0_LBSPPB128_LPA0_LPB4_LRVW4_MIAV0_MIWT2_4_NTC3_NTD3_NLCA1_SU0_SUM0_SUS0_SVW2_VWA2_WG128_2_1_WGMn8
    SolutionIndex: 480
    SolutionNameMin: Cijk_Ailk_Bljk_S_MX_B_Bias_HA_SAV_UserArgs_MT256x128x16_MI32x32x1_SN_GRVWB4_GSU1_LBSPPA0_LPA0_LPB4_LRVW4_MIWT2_4_NTC3_NTD3_NLCA1_SU0_SUM0_SUS0_SVW2_VWA2_WG128_2_1_WGMn8
    SolutionIndex: 481
    SolutionNameMin: Cijk_Ailk_Bljk_S_MX_B_Bias_HA_SAV_UserArgs_MT256x128x32_MI32x32x1_SN_GRVWB4_GSU1_LBSPPA0_LPA0_LPB4_LRVW4_MIWT2_4_NTC3_NTD3_NLCA1_SU0_SUM0_SUS0_SVW2_VWA2_WG128_2_1_WGMn8
    SolutionIndex: 482
    SolutionNameMin: Cijk_Ailk_Bljk_S_MX_B_Bias_HA_SAV_UserArgs_MT448x128x16_MI32x32x1_SN_GRVWB4_GSU2_LBSPPA0_LPA0_LPB4_LRVW4_MIWT7_2_NTC3_NTD3_NLCA7_SU0_SUM0_SUS0_SVW1_VWA1_WG64_4_1_WGMn8
    SolutionIndex: 483
    SolutionNameMin: Cijk_Ailk_Bljk_S_MX_B_Bias_HA_SAV_UserArgs_MT384x112x16_MI16x16x1_SN_GRVWB1_GSU1_LBSPPA3072_LPA0_LPB2_LRVW2_MIWT6_7_NTC3_NTD3_NLCA3_SU0_SUM0_SUS0_SVW2_VWA2_WG64_4_1_WGMn16
    SolutionIndex: 484
    SolutionNameMin: Cijk_Ailk_Bljk_S_MX_B_Bias_HA_SAV_UserArgs_MT320x128x32_MI32x32x1_SN_GRVWB4_GSU1_LBSPPA0_LPA0_LPB4_LRVW4_MIWT5_2_NTC3_NTD3_NLCA5_SU0_SUM0_SUS0_SVW1_VWA1_WG64_4_1_WGMn16
    SolutionIndex: 485
    SolutionNameMin: Cijk_Ailk_Bljk_S_MX_B_Bias_HA_SAV_UserArgs_MT320x128x32_MI32x32x1_SN_GRVWB4_GSU1_LBSPPA0_LPA0_LPB4_LRVW4_MIWT5_2_NTC3_NTD3_NLCA5_SU0_SUM0_SUS0_SVW1_VWA1_WG64_4_1_WGMn8
    SolutionIndex: 486
    SolutionNameMin: Cijk_Ailk_Bljk_S_MX_B_Bias_HA_SAV_UserArgs_MT256x128x32_MI32x32x1_SN_GRVWB4_GSU1_LBSPPA0_LPA0_LPB4_LRVW4_MIWT2_4_NTC3_NTD3_NLCA1_SU0_SUM0_SUS0_SVW2_VWA2_WG128_2_1_WGMn16
    SolutionIndex: 487
    SolutionNameMin: Cijk_Ailk_Bljk_S_MX_B_Bias_HA_SAV_UserArgs_MT384x128x16_MI32x32x1_SN_GRVWB4_GSU1_LBSPPA0_LPA0_LPB4_LRVW4_MIWT6_2_NTC3_NTD3_NLCA3_SU0_SUM0_SUS0_SVW2_VWA2_WG64_4_1_WGMn16
    SolutionIndex: 488
    SolutionNameMin: Cijk_Ailk_Bljk_S_MX_B_Bias_HA_SAV_UserArgs_MT384x128x16_MI32x32x1_SN_GRVWB4_GSU1_LBSPPA0_LPA0_LPB4_LRVW4_MIWT6_2_NTC3_NTD3_NLCA3_SU0_SUM0_SUS0_SVW2_VWA2_WG64_4_1_WGMn8
    SolutionIndex: 489
    SolutionNameMin: Cijk_Ailk_Bljk_S_MX_B_Bias_HA_SAV_UserArgs_MT384x128x16_MI32x32x1_SN_GRVWB4_GSU1_LBSPPA0_LPA0_LPB4_LRVW4_MIWT3_4_NTC3_NTD3_NLCA3_SU0_SUM0_SUS0_SVW1_VWA1_WG128_2_1_WGMn16
    SolutionIndex: 490
    SolutionNameMin: Cijk_Ailk_Bljk_S_MX_B_Bias_HA_SAV_UserArgs_MT256x160x32_MI32x32x1_SN_GRVWB4_GSU1_LBSPPA0_LPA0_LPB4_LRVW4_MIWT2_5_NTC3_NTD3_NLCA1_SU0_SUM0_SUS0_SVW2_VWA2_WG128_2_1_WGMn8
    SolutionIndex: 491
    SolutionNameMin: Cijk_Ailk_Bljk_S_MX_B_Bias_HA_SAV_UserArgs_MT256x256x16_MI32x32x1_SN_GRVWB4_GSU1_LBSPPA0_LPA0_LPB4_LRVW4_MIWT2_8_NTC3_NTD3_NLCA1_SU0_SUM0_SUS0_SVW2_VWA2_WG128_2_1_WGMn16
    SolutionIndex: 492
    SolutionNameMin: Cijk_Ailk_Bljk_S_MX_B_Bias_HA_SAV_UserArgs_MT320x192x16_MI32x32x1_SN_GRVWB4_GSU1_LBSPPA0_LPA0_LPB4_LRVW4_MIWT5_3_NTC3_NTD3_NLCA5_SU0_SUM0_SUS0_SVW1_VWA1_WG64_4_1_WGMn8
    SolutionIndex: 493
    SolutionNameMin: Cijk_Ailk_Bljk_S_MX_B_Bias_HA_SAV_UserArgs_MT256x128x16_MI32x32x1_SN_GRVWB4_GSU1_LBSPPA0_LPA0_LPB4_LRVW4_MIWT2_4_NLCA1_SU8_SUM0_SUS256_SVW2_VWA2_WG128_2_1_WGMn16
    SolutionIndex: 494
    SolutionNameMin: Cijk_Ailk_Bljk_S_MX_B_Bias_HA_SAV_UserArgs_MT448x128x16_MI32x32x1_SN_GRVWB4_GSU1_LBSPPA0_LPA0_LPB4_LRVW4_MIWT7_2_NLCA7_SU8_SUM0_SUS256_SVW1_VWA1_WG64_4_1_WGMn16
    SolutionIndex: 495
    SolutionNameMin: Cijk_Ailk_Bljk_S_MX_B_Bias_HA_SAV_UserArgs_MT320x128x16_MI16x16x1_SN_GRVWB4_GSU1_LBSPPA2560_LPA16_LPB4_LRVW2_MIWT5_8_NLCA5_SU8_SUM0_SUS256_SVW1_VWA1_WG64_4_1_WGMn16
    SolutionIndex: 496
    SolutionNameMin: Cijk_Ailk_Bljk_S_MX_B_Bias_HA_SAV_UserArgs_MT256x160x32_MI32x32x1_SN_GRVWB4_GSU1_LBSPPA0_LPA0_LPB4_LRVW4_MIWT2_5_NLCA1_SU8_SUM0_SUS256_SVW2_VWA2_WG128_2_1_WGMn16
    SolutionIndex: 497
    SolutionNameMin: Cijk_Ailk_Bljk_S_MX_B_Bias_HA_SAV_UserArgs_MT256x128x16_MI16x16x1_SN_GRVWB4_GSU1_LBSPPA2048_LPA0_LPB4_LRVW2_MIWT4_8_NLCA1_SU8_SUM0_SUS256_SVW4_VWA4_WG64_4_1_WGMn16
    SolutionIndex: 498
    SolutionNameMin: Cijk_Ailk_Bljk_S_MX_B_Bias_HA_SAV_UserArgs_MT16x16x256_MI16x16x1_SN_GRVWB4_GSU1_LBSPPA256_LBSPPB1024_LPB8_LRVW4_MIWT1_1_NLCB1_SU0_SUM0_SUS0_WG16_4_2_WGM1
    SolutionIndex: 499
    SolutionNameMin: Cijk_Ailk_Bljk_S_MX_B_Bias_HA_SAV_UserArgs_MT16x64x128_MI16x16x1_SN_GRVWB4_GSU5_LBSPPA256_LBSPPB512_LPB8_LRVW4_MIWT1_1_NLCB1_SU0_SUM0_SUS0_WG16_16_1_WGM1
    SolutionIndex: 500
    SolutionNameMin: Cijk_Ailk_Bljk_S_MX_B_Bias_HA_SAV_UserArgs_MT16x96x128_MI16x16x1_SN_GRVWB4_GSU7_LBSPPA256_LBSPPB512_LPB8_LRVW4_MIWT1_3_NLCB1_SU0_SUM0_SUS0_WG16_8_2_WGM1
    SolutionIndex: 501
    SolutionNameMin: Cijk_Ailk_Bljk_S_MX_B_Bias_HA_SAV_UserArgs_MT16x32x256_MI16x16x1_SN_GRVWB4_GSU1_LBSPPA256_LBSPPB1024_LPB8_LRVW4_MIWT1_1_NLCB1_SU0_SUM0_SUS0_WG16_8_2_WGM1
    SolutionIndex: 502
    SolutionNameMin: Cijk_Ailk_Bljk_S_MX_B_Bias_HA_SAV_UserArgs_MT16x96x128_MI16x16x1_SN_GRVWB4_GSU5_LBSPPA256_LBSPPB512_LPB8_LRVW4_MIWT1_3_NLCB1_SU0_SUM0_SUS0_WG16_8_2_WGM1
    SolutionIndex: 503
    SolutionNameMin: Cijk_Ailk_Bljk_S_MX_B_Bias_HA_SAV_UserArgs_MT16x16x256_MI16x16x1_SN_GRVWB4_GSU1_LBSPPA256_LBSPPB1024_LPA16_LPB8_LRVW4_MIWT1_1_NLCB1_SU0_SUM0_SUS0_SVW1_VWA1_WG16_4_2_WGM1
    SolutionIndex: 504
    SolutionNameMin: Cijk_Ailk_Bljk_S_MX_B_Bias_HA_SAV_UserArgs_MT16x64x128_MI16x16x1_SN_GRVWB4_GSU5_LBSPPA256_LBSPPB512_LPA16_LPB8_LRVW4_MIWT1_1_NLCB1_SU0_SUM0_SUS0_SVW1_VWA1_WG16_16_1_WGM1
    SolutionIndex: 505
    SolutionNameMin: Cijk_Ailk_Bljk_S_MX_B_Bias_HA_SAV_UserArgs_MT16x96x128_MI16x16x1_SN_GRVWB4_GSU7_LBSPPA256_LBSPPB512_LPA16_LPB8_LRVW4_MIWT1_3_NLCB1_SU0_SUM0_SUS0_SVW1_VWA1_WG16_8_2_WGM1
    SolutionIndex: 506
    SolutionNameMin: Cijk_Ailk_Bljk_S_MX_B_Bias_HA_SAV_UserArgs_MT16x32x256_MI16x16x1_SN_GRVWB4_GSU1_LBSPPA256_LBSPPB1024_LPA16_LPB8_LRVW4_MIWT1_1_NLCB1_SU0_SUM0_SUS0_SVW1_VWA1_WG16_8_2_WGM1
    SolutionIndex: 507
    SolutionNameMin: Cijk_Ailk_Bljk_S_MX_B_Bias_HA_SAV_UserArgs_MT32x128x64_MI32x32x1_SN_GRVWB4_GSU10_LBSPPA0_LBSPPB256_LPA0_LPB4_LRVW4_MIWT1_1_NLCB1_SU0_SUM0_SUS0_SVW1_VWA1_WG32_8_1_WGM1
    SolutionIndex: 508
    SolutionNameMin: Cijk_Ailk_Bljk_S_MX_B_Bias_HA_SAV_UserArgs_MT16x96x128_MI16x16x1_SN_GRVWB4_GSU5_LBSPPA256_LBSPPB512_LPA16_LPB8_LRVW4_MIWT1_3_NLCB1_SU0_SUM0_SUS0_SVW1_VWA1_WG16_8_2_WGM1
    SolutionIndex: 509
    SolutionNameMin: Cijk_Ailk_Bljk_S_MX_B_Bias_HA_SAV_UserArgs_MT32x32x128_MI32x32x1_SN_GRVWB4_GSU1_LBSPPA0_LBSPPB512_LPA0_LPB4_LRVW4_MIWT1_1_NLCB1_SU0_SUM0_SUS0_SVW1_VWA1_WG32_2_4_WGM1
    SolutionIndex: 510
    SolutionNameMin: Cijk_Ailk_Bljk_S_MX_B_Bias_HA_SAV_UserArgs_MT32x64x128_MI32x32x1_SN_GRVWB4_GSU3_LBSPPA0_LBSPPB512_LPA0_LPB4_LRVW4_MIWT1_1_NLCB1_SU0_SUM0_SUS0_SVW1_VWA1_WG32_4_2_WGM1
    SolutionIndex: 511
    SolutionNameMin: Cijk_Ailk_Bljk_S_MX_B_Bias_HA_SAV_UserArgs_MT32x32x128_MI16x16x1_SN_GRVWB4_GSU1_LBSPPA512_LBSPPB512_LPA16_LPB8_LRVW4_MIAV1_MIWT1_2_NLCA1_SU0_SUM0_SUS0_SVW1_VWA1_WG32_4_2_WGM1
    SolutionIndex: 512
    SolutionNameMin: Cijk_Ailk_Bljk_S_MX_B_Bias_HA_SAV_UserArgs_MT96x256x32_MI16x16x1_SN_GRVWB4_GSU17_LBSPPA1536_LBSPPB128_LPA16_LPB8_LRVW4_MIAV0_MIWT3_8_NLCA3_SU0_SUM0_SUS0_SVW1_VWA1_WG32_8_1_WGM1
    SolutionIndex: 513
    SolutionNameMin: Cijk_Ailk_Bljk_S_MX_B_Bias_HA_SAV_UserArgs_MT96x96x64_MI16x16x1_SN_GRVWB4_GSU7_LBSPPA1536_LBSPPB256_LPA16_LPB8_LRVW4_MIAV1_MIWT3_3_NLCA3_SU0_SUM0_SUS0_SVW1_VWA1_WG32_8_1_WGM1
    SolutionIndex: 514
    SolutionNameMin: Cijk_Ailk_Bljk_S_MX_B_Bias_HA_SAV_UserArgs_MT64x96x64_MI32x32x1_SN_GRVWB4_GSU5_LBSPPA0_LBSPPB256_LPA0_LPB4_LRVW4_MIAV1_MIWT1_3_NLCA1_SU0_SUM0_SUS0_SVW1_VWA1_WG64_2_2_WGM1
    SolutionIndex: 515
    SolutionNameMin: Cijk_Ailk_Bljk_S_MX_B_Bias_HA_SAV_UserArgs_MT32x64x128_MI32x32x1_SN_GRVWB4_GSU1_LBSPPA0_LBSPPB512_LPA0_LPB4_LRVW4_MIAV1_MIWT1_1_NLCA1_SU0_SUM0_SUS0_SVW1_VWA1_WG32_4_2_WGM1
    SolutionIndex: 516
    SolutionNameMin: Cijk_Ailk_Bljk_S_MX_B_Bias_HA_SAV_UserArgs_MT96x96x64_MI16x16x1_SN_GRVWB4_GSU5_LBSPPA1536_LBSPPB256_LPA16_LPB8_LRVW4_MIAV1_MIWT3_3_NLCA3_SU0_SUM0_SUS0_SVW1_VWA1_WG32_8_1_WGM1
    SolutionIndex: 517
    SolutionNameMin: Cijk_Ailk_Bljk_S_MX_B_Bias_HA_SAV_UserArgs_MT96x192x32_MI16x16x1_SN_GRVWB4_GSU10_LBSPPA1536_LBSPPB128_LPA16_LPB8_LRVW4_MIAV1_MIWT3_6_NLCA3_SU0_SUM0_SUS0_SVW1_VWA1_WG32_8_1_WGM1
    SolutionIndex: 518
    SolutionNameMin: Cijk_Ailk_Bljk_S_MX_B_Bias_HA_SAV_UserArgs_MT128x128x32_MI32x32x1_SN_CLR1_GRVWB4_GSU9_LBSPPA0_LBSPPB128_LPA0_LPB4_LRVW4_MIAV1_MIWT2_2_NLCA1_PLR1_SU0_SUM0_SUS0_SVW2_VWA2_WG64_4_1_WGM1
    SolutionIndex: 519
    SolutionNameMin: Cijk_Ailk_Bljk_S_MX_B_Bias_HA_SAV_UserArgs_MT128x256x32_MI32x32x1_SN_CLR1_GRVWB4_GSU19_LBSPPA0_LBSPPB128_LPA0_LPB4_LRVW4_MIAV0_MIWT2_4_NLCA1_PLR1_SU0_SUM0_SUS0_SVW2_VWA2_WG64_4_1_WGM1
    SolutionIndex: 520
    SolutionNameMin: Cijk_Ailk_Bljk_S_MX_B_Bias_HA_SAV_UserArgs_MT64x48x128_MI16x16x1_SN_CLR1_GRVWB4_GSU1_LBSPPA1024_LBSPPB512_LPA0_LPB8_LRVW4_MIAV1_MIWT2_3_NLCA1_PLR1_SU0_SUM0_SUS0_SVW2_VWA2_WG32_4_2_WGM1
    SolutionIndex: 521
    SolutionNameMin: Cijk_Ailk_Bljk_S_MX_B_Bias_HA_SAV_UserArgs_MT192x256x32_MI32x32x1_SN_CLR1_GRVWB4_GSU19_LBSPPA0_LBSPPB128_LPA0_LPB4_LRVW4_MIAV0_MIWT3_4_NLCA3_PLR1_SU0_SUM0_SUS0_SVW1_VWA1_WG64_4_1_WGM1
    SolutionIndex: 522
    SolutionNameMin: Cijk_Ailk_Bljk_S_MX_B_Bias_HA_SAV_UserArgs_MT128x96x64_MI32x32x1_SN_CLR1_GRVWB4_GSU5_LBSPPA0_LBSPPB256_LPA0_LPB4_LRVW4_MIAV1_MIWT1_3_NLCA1_PLR1_SU0_SUM0_SUS0_SVW1_VWA1_WG128_2_1_WGM1
    SolutionIndex: 523
    SolutionNameMin: Cijk_Ailk_Bljk_S_MX_B_Bias_HA_SAV_UserArgs_MT128x192x32_MI16x16x1_SN_CLR1_GRVWB4_GSU10_LBSPPA2048_LBSPPB128_LPA0_LPB8_LRVW4_MIAV0_MIWT2_12_NLCA1_PLR1_SU0_SUM0_SUS0_SVW2_VWA2_WG64_4_1_WGM1
    SolutionIndex: 524
    SolutionNameMin: Cijk_Ailk_Bljk_S_MX_B_Bias_HA_SAV_UserArgs_MT192x192x32_MI32x32x1_SN_CLR1_GRVWB4_GSU10_LBSPPA0_LBSPPB128_LPA0_LPB4_LRVW4_MIAV0_MIWT3_3_NLCA3_PLR1_SU0_SUM0_SUS0_SVW1_VWA1_WG64_4_1_WGM1
    SolutionIndex: 525
    SolutionNameMin: Cijk_Ailk_Bljk_S_MX_B_Bias_HA_SAV_UserArgs_MT256x96x32_MI32x32x1_SN_CLR1_GRVWB4_GSU7_LBSPPA0_LBSPPB128_LPA0_LPB4_LRVW4_MIAV0_MIWT2_3_NLCA1_PLR1_SU0_SUM0_SUS0_SVW2_VWA2_WG128_2_1_WGM1
    SolutionIndex: 526
    SolutionNameMin: Cijk_Ailk_Bljk_S_MX_B_Bias_HA_SAV_UserArgs_MT384x96x32_MI32x32x1_SN_CLR1_GRVWB4_GSU7_LBSPPA0_LBSPPB128_LPA0_LPB4_LRVW4_MIAV0_MIWT3_3_NLCA3_PLR1_SU0_SUM0_SUS0_SVW1_VWA1_WG128_2_1_WGM1
    SolutionIndex: 527
    SolutionNameMin: Cijk_Ailk_Bljk_S_MX_B_Bias_HA_SAV_UserArgs_MT192x192x32_MI32x32x1_SN_CLR1_GRVWB4_GSU5_LBSPPA0_LBSPPB128_LPA0_LPB4_LRVW4_MIAV0_MIWT3_3_NLCA3_PLR1_SU0_SUM0_SUS0_SVW1_VWA1_WG64_4_1_WGM1
    SolutionIndex: 528
    SolutionNameMin: Cijk_Ailk_Bljk_S_MX_B_Bias_HA_SAV_UserArgs_MT128x256x32_MI32x32x1_SN_CLR1_GRVWB4_GSU4_LBSPPA0_LBSPPB128_LPA0_LPB4_LRVW4_MIAV0_MIWT2_4_NLCA1_PLR1_SU0_SUM0_SUS0_SVW2_VWA2_WG64_4_1_WGM1
    SolutionIndex: 529
    SolutionNameMin: Cijk_Ailk_Bljk_S_MX_B_Bias_HA_SAV_UserArgs_MT320x128x32_MI32x32x1_SN_CLR1_GRVWB4_GSU5_LBSPPA0_LBSPPB128_LPA0_LPB4_LRVW4_MIAV0_MIWT5_2_NLCA5_PLR1_SU0_SUM0_SUS0_SVW1_VWA1_WG64_4_1_WGM1
    SolutionIndex: 530
    SolutionNameMin: Cijk_Ailk_Bljk_S_MX_B_Bias_HA_SAV_UserArgs_MT384x128x16_MI16x16x1_SN_CLR1_GRVWB1_GSU5_LBSPPA3072_LBSPPB128_LPA0_LPB2_LRVW2_MIAV0_MIWT6_8_NLCA3_PLR1_SU0_SUM0_SUS0_SVW2_VWA2_WG64_4_1_WGM1
    SolutionIndex: 531
    SolutionNameMin: Cijk_Ailk_Bljk_S_MX_B_Bias_HA_SAV_UserArgs_MT256x192x16_MI32x32x1_SN_CLR1_GRVWB4_GSU5_LBSPPA0_LBSPPB128_LPA0_LPB4_LRVW4_MIAV0_MIWT2_6_NLCA1_PLR1_SU0_SUM0_SUS0_SVW2_VWA2_WG128_2_1_WGM1
    SolutionIndex: 532
    SolutionNameMin: Cijk_Ailk_Bljk_S_MX_B_Bias_HA_SAV_UserArgs_MT128x192x32_MI32x32x1_SN_CLR1_GRVWB4_GSU2_LBSPPA0_LBSPPB128_LPA0_LPB4_LRVW4_MIAV0_MIWT2_3_NLCA1_PLR1_SU0_SUM0_SUS0_SVW2_VWA2_WG64_4_1_WGM1
    SolutionIndex: 533
    SolutionNameMin: Cijk_Ailk_Bljk_S_MX_B_Bias_HA_SAV_UserArgs_MT96x160x32_MI16x16x1_SN_CLR1_GRVWB4_GSU1_LBSPPA1536_LBSPPB128_LPA16_LPB8_LRVW4_MIAV1_MIWT3_5_NLCA3_PLR1_SU0_SUM0_SUS0_SVW1_VWA1_WG32_8_1_WGM1
    SolutionIndex: 534
    SolutionNameMin: Cijk_Ailk_Bljk_S_MX_B_Bias_HA_SAV_UserArgs_MT128x128x32_MI32x32x1_SN_GRVWB4_GSU1_LBSPPA0_LBSPPB128_LPA0_LPB4_LRVW4_MIAV1_MIWT2_2_NTC3_NTD3_NLCA1_SU0_SUM0_SUS0_SVW2_VWA2_WG64_4_1_WGM1
    SolutionIndex: 535
    SolutionNameMin: Cijk_Ailk_Bljk_S_MX_B_Bias_HA_SAV_UserArgs_MT256x256x16_MI32x32x1_SN_GRVWB4_GSU5_LBSPPA0_LBSPPB128_LPA0_LPB4_LRVW4_MIAV0_MIWT2_8_NTC0_NTD0_NLCA1_SU0_SUM0_SUS0_SVW2_VWA2_WG128_2_1_WGM1
    SolutionIndex: 536
    SolutionNameMin: Cijk_Ailk_Bljk_S_MX_B_Bias_HA_SAV_UserArgs_MT128x192x32_MI32x32x1_SN_GRVWB4_GSU1_LBSPPA0_LBSPPB128_LPA0_LPB4_LRVW4_MIAV0_MIWT2_3_NTC3_NTD3_NLCA1_SU0_SUM0_SUS0_SVW2_VWA2_WG64_4_1_WGM1
    SolutionIndex: 537
    SolutionNameMin: Cijk_Ailk_Bljk_S_MX_B_Bias_HA_SAV_UserArgs_MT320x128x32_MI32x32x1_SN_GRVWB4_GSU2_LBSPPA0_LBSPPB128_LPA0_LPB4_LRVW4_MIAV0_MIWT5_2_NTC3_NTD3_NLCA5_SU0_SUM0_SUS0_SVW1_VWA1_WG64_4_1_WGM1
    SolutionIndex: 538
    SolutionNameMin: Cijk_Ailk_Bljk_S_MX_B_Bias_HA_SAV_UserArgs_MT128x160x32_MI16x16x1_SN_GRVWB4_GSU1_LBSPPA2048_LBSPPB128_LPA0_LPB8_LRVW4_MIAV1_MIWT2_10_NTC3_NTD3_NLCA1_SU0_SUM0_SUS0_SVW2_VWA2_WG64_4_1_WGM1
    SolutionIndex: 539
    SolutionNameMin: Cijk_Ailk_Bljk_S_MX_B_Bias_HA_SAV_UserArgs_MT256x160x32_MI32x32x1_SN_GRVWB4_GSU2_LBSPPA0_LBSPPB128_LPA0_LPB4_LRVW4_MIAV0_MIWT2_5_NTC3_NTD3_NLCA1_SU0_SUM0_SUS0_SVW2_VWA2_WG128_2_1_WGM1
    SolutionIndex: 540
    SolutionNameMin: Cijk_Ailk_Bljk_S_MX_B_Bias_HA_SAV_UserArgs_MT256x128x16_MI32x32x1_SN_GRVWB4_GSU1_LBSPPA0_LBSPPB128_LPA0_LPB4_LRVW4_MIAV0_MIWT2_4_NTC3_NTD3_NLCA1_SU0_SUM0_SUS0_SVW2_VWA2_WG128_2_1_WGM1
    SolutionIndex: 541
    SolutionNameMin: Cijk_Ailk_Bljk_S_MX_B_Bias_HA_SAV_UserArgs_MT256x128x32_MI32x32x1_SN_GRVWB4_GSU1_LBSPPA0_LBSPPB128_LPA0_LPB4_LRVW4_MIAV0_MIWT2_4_NTC3_NTD3_NLCA1_SU0_SUM0_SUS0_SVW2_VWA2_WG128_2_1_WGM1
    SolutionIndex: 542
    SolutionNameMin: Cijk_Ailk_Bljk_S_MX_B_Bias_HA_SAV_UserArgs_MT256x224x32_MI32x32x1_SN_GRVWB4_GSU2_LBSPPA0_LPA0_LPB4_LRVW4_MIWT2_7_NTC3_NTD3_NLCA1_SU0_SUM0_SUS0_SVW2_VWA2_WG128_2_1_WGM1
    SolutionIndex: 543
    SolutionNameMin: Cijk_Ailk_Bljk_S_MX_B_Bias_HA_SAV_UserArgs_MT384x112x16_MI16x16x1_SN_GRVWB1_GSU1_LBSPPA3072_LPA0_LPB2_LRVW2_MIWT6_7_NTC3_NTD3_NLCA3_SU0_SUM0_SUS0_SVW2_VWA2_WG64_4_1_WGM1
    SolutionIndex: 544
    SolutionNameMin: Cijk_Ailk_Bljk_S_MX_B_Bias_HA_SAV_UserArgs_MT256x128x16_MI32x32x1_SN_GRVWB4_GSU1_LBSPPA0_LPA0_LPB4_LRVW4_MIWT2_4_NTC3_NTD3_NLCA1_SU0_SUM0_SUS0_SVW2_VWA2_WG128_2_1_WGM1
    SolutionIndex: 545
    SolutionNameMin: Cijk_Ailk_Bljk_S_MX_B_Bias_HA_SAV_UserArgs_MT384x160x16_MI32x32x1_SN_GRVWB1_GSU1_LBSPPA0_LPA0_LPB4_LRVW4_MIWT3_5_NTC3_NTD3_NLCA3_SU0_SUM0_SUS0_SVW1_VWA1_WG128_2_1_WGMn8
    SolutionIndex: 546
    SolutionNameMin: Cijk_Ailk_Bljk_S_MX_B_Bias_HA_SAV_UserArgs_MT256x208x16_MI16x16x1_SN_GRVWB1_GSU1_LBSPPA2048_LPA0_LPB2_LRVW2_MIWT4_13_NLCA1_SU8_SUM0_SUS256_SVW4_VWA4_WG64_4_1_WGMn8
    SolutionIndex: 547
    SolutionNameMin: Cijk_Ailk_Bljk_S_MX_B_Bias_HA_SAV_UserArgs_MT256x224x32_MI32x32x1_SN_GRVWB4_GSU1_LBSPPA0_LPA0_LPB4_LRVW4_MIWT2_7_NLCA1_SU8_SUM0_SUS256_SVW2_VWA2_WG128_2_1_WGMn16
    SolutionIndex: 548
    SolutionNameMin: Cijk_Ailk_Bljk_S_MX_B_Bias_HA_SAV_UserArgs_MT256x112x16_MI16x16x1_SN_GRVWB1_GSU1_LBSPPA2048_LPA0_LPB2_LRVW2_MIWT4_7_NLCA1_SU8_SUM0_SUS256_SVW4_VWA4_WG64_4_1_WGMn16
    SolutionIndex: 549
    SolutionNameMin: Cijk_Ailk_Bljk_S_MX_B_Bias_HA_SAV_UserArgs_MT128x320x16_MI16x16x1_SN_GRVWB4_GSU1_LBSPPA1024_LPA0_LPB4_LRVW2_MIWT8_5_NLCA1_SU8_SUM0_SUS256_SVW4_VWA4_WG16_16_1_WGMn16
    SolutionIndex: 550
    SolutionNameMin: Cijk_Ailk_Bljk_S_MX_B_Bias_HA_SAV_UserArgs_MT256x160x32_MI32x32x1_SN_GRVWB4_GSU1_LBSPPA0_LPA0_LPB4_LRVW4_MIWT2_5_NLCA1_SU8_SUM0_SUS256_SVW2_VWA2_WG128_2_1_WGMn8
    SolutionIndex: 551
    SolutionNameMin: Cijk_Ailk_Bljk_S_MX_B_Bias_HA_SAV_UserArgs_MT192x128x16_MI32x32x1_SN_GRVWB4_GSU1_LBSPPA0_LPA0_LPB4_LRVW4_MIWT3_2_NLCA3_SU8_SUM0_SUS256_SVW1_VWA1_WG64_4_1_WGMn16
    SolutionIndex: 552
    SolutionNameMin: Cijk_Ailk_Bljk_S_MX_B_Bias_HA_SAV_UserArgs_MT192x128x16_MI32x32x1_SN_GRVWB4_GSU1_LBSPPA0_LPA0_LPB4_LRVW4_MIWT3_2_NLCA3_SU8_SUM0_SUS256_SVW1_VWA1_WG64_4_1_WGMn8
    SolutionIndex: 553
    SolutionNameMin: Cijk_Ailk_Bljk_S_MX_B_Bias_HA_SAV_UserArgs_MT256x208x16_MI16x16x1_SN_GRVWB1_GSU1_LBSPPA2048_LPA0_LPB2_LRVW2_MIAV0_MIWT4_13_NLCA1_SU8_SUM0_SUS256_SVW4_VWA4_WG64_4_1_WGMn16
    SolutionIndex: 554
    SolutionNameMin: Cijk_Ailk_Bljk_S_MX_B_Bias_HA_SAV_UserArgs_MT256x224x32_MI32x32x1_SN_GRVWB4_GSU1_LBSPPA0_LPA0_LPB4_LRVW4_MIAV0_MIWT2_7_NLCA1_SU8_SUM0_SUS256_SVW2_VWA2_WG128_2_1_WGMn16
    SolutionIndex: 555
    SolutionNameMin: Cijk_Ailk_Bljk_S_MX_B_Bias_HA_SAV_UserArgs_MT256x128x16_MI32x32x1_SN_GRVWB4_GSU1_LBSPPA0_LPA0_LPB4_LRVW4_MIAV0_MIWT2_4_NLCA1_SU8_SUM0_SUS256_SVW2_VWA2_WG128_2_1_WGMn16
    SolutionIndex: 556
    SolutionNameMin: Cijk_Ailk_Bljk_S_MX_B_Bias_HA_SAV_UserArgs_MT320x128x16_MI16x16x1_SN_GRVWB4_GSU1_LBSPPA2560_LPA16_LPB4_LRVW2_MIAV0_MIWT5_8_NLCA5_SU8_SUM0_SUS256_SVW1_VWA1_WG64_4_1_WGMn16
    SolutionIndex: 557
    SolutionNameMin: Cijk_Ailk_Bljk_S_MX_B_Bias_HA_SAV_UserArgs_MT192x192x16_MI32x32x1_SN_GRVWB4_GSU1_LBSPPA0_LPA0_LPB4_LRVW4_MIAV0_MIWT3_3_NLCA3_SU8_SUM0_SUS256_SVW1_VWA1_WG64_4_1_WGMn16
    SolutionIndex: 558
    SolutionNameMin: Cijk_Ailk_Bljk_S_MX_B_Bias_HA_SAV_UserArgs_MT16x64x64_MI16x16x1_SN_GRVWB4_GSU5_LBSPPA256_LBSPPB256_LPB8_LRVW4_MIWT1_1_NLCB1_SU0_SUM0_SUS0_WG16_16_1_WGM1
    SolutionIndex: 559
    SolutionNameMin: Cijk_Ailk_Bljk_S_MX_B_Bias_HA_SAV_UserArgs_MT16x64x128_MI16x16x1_SN_GRVWB4_GSU1_LBSPPA256_LBSPPB512_LPB8_LRVW4_MIWT1_4_NLCB1_SU0_SUM0_SUS0_WG16_4_4_WGM1
    SolutionIndex: 560
    SolutionNameMin: Cijk_Ailk_Bljk_S_MX_B_Bias_HA_SAV_UserArgs_MT16x192x64_MI16x16x1_SN_GRVWB4_GSU5_LBSPPA256_LBSPPB256_LPB8_LRVW4_MIWT1_3_NLCB1_SU0_SUM0_SUS0_WG16_16_1_WGM1
    SolutionIndex: 561
    SolutionNameMin: Cijk_Ailk_Bljk_S_MX_B_Bias_HA_SAV_UserArgs_MT16x96x128_MI16x16x1_SN_GRVWB4_GSU3_LBSPPA256_LBSPPB512_LPA16_LPB8_LRVW4_MIWT1_3_NLCB1_SU0_SUM0_SUS0_SVW1_VWA1_WG16_8_2_WGM1
    SolutionIndex: 562
    SolutionNameMin: Cijk_Ailk_Bljk_S_MX_B_Bias_HA_SAV_UserArgs_MT32x32x128_MI16x16x1_SN_GRVWB4_GSU1_LBSPPA512_LBSPPB512_LPA16_LPB8_LRVW4_MIWT1_1_NLCB1_SU0_SUM0_SUS0_SVW1_VWA1_WG32_8_1_WGM1
    SolutionIndex: 563
    SolutionNameMin: Cijk_Ailk_Bljk_S_MX_B_Bias_HA_SAV_UserArgs_MT32x128x64_MI32x32x1_SN_GRVWB4_GSU5_LBSPPA0_LBSPPB256_LPA0_LPB4_LRVW4_MIWT1_1_NLCB1_SU0_SUM0_SUS0_SVW1_VWA1_WG32_8_1_WGM1
    SolutionIndex: 564
    SolutionNameMin: Cijk_Ailk_Bljk_S_MX_B_Bias_HA_SAV_UserArgs_MT16x64x128_MI16x16x1_SN_GRVWB4_GSU1_LBSPPA256_LBSPPB512_LPA16_LPB8_LRVW4_MIWT1_4_NLCB1_SU0_SUM0_SUS0_SVW1_VWA1_WG16_4_4_WGM1
    SolutionIndex: 565
    SolutionNameMin: Cijk_Ailk_Bljk_S_MX_B_Bias_HA_SAV_UserArgs_MT16x96x128_MI16x16x1_SN_GRVWB4_GSU2_LBSPPA256_LBSPPB512_LPA16_LPB8_LRVW4_MIWT1_3_NLCB1_SU0_SUM0_SUS0_SVW1_VWA1_WG16_8_2_WGM1
    SolutionIndex: 566
    SolutionNameMin: Cijk_Ailk_Bljk_S_MX_B_Bias_HA_SAV_UserArgs_MT32x48x128_MI16x16x1_SN_GRVWB4_GSU1_LBSPPA512_LBSPPB512_LPA16_LPB8_LRVW4_MIWT1_3_NLCB1_SU0_SUM0_SUS0_SVW1_VWA1_WG32_4_2_WGM1
    SolutionIndex: 567
    SolutionNameMin: Cijk_Ailk_Bljk_S_MX_B_Bias_HA_SAV_UserArgs_MT32x192x64_MI32x32x1_SN_GRVWB4_GSU5_LBSPPA0_LBSPPB256_LPA0_LPB4_LRVW4_MIWT1_3_NLCB1_SU0_SUM0_SUS0_SVW1_VWA1_WG32_4_2_WGM1
    SolutionIndex: 568
    SolutionNameMin: Cijk_Ailk_Bljk_S_MX_B_Bias_HA_SAV_UserArgs_MT64x128x64_MI32x32x1_SN_CLR1_GRVWB4_GSU5_LBSPPA0_LBSPPB256_LPA0_LPB4_LRVW4_MIAV1_MIWT1_2_NLCA1_PLR1_SU0_SUM0_SUS0_SVW1_VWA1_WG64_4_1_WGM1
    SolutionIndex: 569
    SolutionNameMin: Cijk_Ailk_Bljk_S_MX_B_Bias_HA_SAV_UserArgs_MT64x112x64_MI16x16x1_SN_CLR1_GRVWB4_GSU4_LBSPPA1024_LBSPPB256_LPA0_LPB8_LRVW4_MIAV1_MIWT2_7_NLCA1_PLR1_SU0_SUM0_SUS0_SVW2_VWA2_WG32_4_2_WGM1
    SolutionIndex: 570
    SolutionNameMin: Cijk_Ailk_Bljk_S_MX_B_Bias_HA_SAV_UserArgs_MT32x80x128_MI16x16x1_SN_CLR1_GRVWB4_GSU1_LBSPPA512_LBSPPB512_LPA16_LPB8_LRVW4_MIAV1_MIWT1_5_NLCA1_PLR1_SU0_SUM0_SUS0_SVW1_VWA1_WG32_4_2_WGM1
    SolutionIndex: 571
    SolutionNameMin: Cijk_Ailk_Bljk_S_MX_B_Bias_HA_SAV_UserArgs_MT96x128x64_MI16x16x1_SN_CLR1_GRVWB4_GSU5_LBSPPA1536_LBSPPB256_LPA16_LPB8_LRVW4_MIAV1_MIWT3_4_NLCA3_PLR1_SU0_SUM0_SUS0_SVW1_VWA1_WG32_8_1_WGM1
    SolutionIndex: 572
    SolutionNameMin: Cijk_Ailk_Bljk_S_MX_B_Bias_HA_SAV_UserArgs_MT64x128x64_MI32x32x1_SN_CLR1_GRVWB4_GSU3_LBSPPA0_LBSPPB256_LPA0_LPB4_LRVW4_MIAV1_MIWT2_2_NLCA1_PLR1_SU0_SUM0_SUS0_SVW2_VWA2_WG32_4_2_WGM1
    SolutionIndex: 573
    SolutionNameMin: Cijk_Ailk_Bljk_S_MX_B_Bias_HA_SAV_UserArgs_MT64x160x64_MI16x16x1_SN_CLR1_GRVWB4_GSU4_LBSPPA1024_LBSPPB256_LPA0_LPB8_LRVW4_MIAV1_MIWT2_5_NLCA1_PLR1_SU0_SUM0_SUS0_SVW2_VWA2_WG32_8_1_WGM1
    SolutionIndex: 574
    SolutionNameMin: Cijk_Ailk_Bljk_S_MX_B_Bias_HA_SAV_UserArgs_MT32x128x64_MI32x32x1_SN_CLR1_GRVWB4_GSU1_LBSPPA0_LBSPPB256_LPA0_LPB4_LRVW4_MIAV1_MIWT1_1_NLCA1_PLR1_SU0_SUM0_SUS0_SVW1_VWA1_WG32_8_1_WGM1
    SolutionIndex: 575
    SolutionNameMin: Cijk_Ailk_Bljk_S_MX_B_Bias_HA_SAV_UserArgs_MT96x192x32_MI16x16x1_SN_CLR1_GRVWB4_GSU5_LBSPPA1536_LBSPPB128_LPA16_LPB8_LRVW4_MIAV1_MIWT3_6_NLCA3_PLR1_SU0_SUM0_SUS0_SVW1_VWA1_WG32_8_1_WGM1
    SolutionIndex: 576
    SolutionNameMin: Cijk_Ailk_Bljk_S_MX_B_Bias_HA_SAV_UserArgs_MT128x256x32_MI32x32x1_SN_CLR1_GRVWB4_GSU10_LBSPPA0_LBSPPB128_LPA0_LPB4_LRVW4_MIAV0_MIWT2_4_NLCA1_PLR1_SU0_SUM0_SUS0_SVW2_VWA2_WG64_4_1_WGM1
    SolutionIndex: 577
    SolutionNameMin: Cijk_Ailk_Bljk_S_MX_B_Bias_HA_SAV_UserArgs_MT192x256x32_MI32x32x1_SN_CLR1_GRVWB4_GSU10_LBSPPA0_LBSPPB128_LPA0_LPB4_LRVW4_MIAV0_MIWT3_4_NLCA3_PLR1_SU0_SUM0_SUS0_SVW1_VWA1_WG64_4_1_WGM1
    SolutionIndex: 578
    SolutionNameMin: Cijk_Ailk_Bljk_S_MX_B_Bias_HA_SAV_UserArgs_MT128x192x32_MI32x32x1_SN_CLR1_GRVWB4_GSU5_LBSPPA0_LBSPPB128_LPA0_LPB4_LRVW4_MIAV0_MIWT2_3_NLCA1_PLR1_SU0_SUM0_SUS0_SVW2_VWA2_WG64_4_1_WGM1
    SolutionIndex: 579
    SolutionNameMin: Cijk_Ailk_Bljk_S_MX_B_Bias_HA_SAV_UserArgs_MT64x128x64_MI32x32x1_SN_CLR1_GRVWB4_GSU1_LBSPPA0_LBSPPB256_LPA0_LPB4_LRVW4_MIAV1_MIWT2_2_NLCA1_PLR1_SU0_SUM0_SUS0_SVW2_VWA2_WG32_4_2_WGM1
    SolutionIndex: 580
    SolutionNameMin: Cijk_Ailk_Bljk_S_MX_B_Bias_HA_SAV_UserArgs_MT64x112x64_MI16x16x1_SN_CLR1_GRVWB4_GSU1_LBSPPA1024_LBSPPB256_LPA0_LPB8_LRVW4_MIAV1_MIWT2_7_NLCA1_PLR1_SU0_SUM0_SUS0_SVW2_VWA2_WG32_4_2_WGM1
    SolutionIndex: 581
    SolutionNameMin: Cijk_Ailk_Bljk_S_MX_B_Bias_HA_SAV_UserArgs_MT384x160x16_MI32x32x1_SN_CLR1_GRVWB1_GSU4_LBSPPA0_LBSPPB128_LPA0_LPB4_LRVW4_MIAV0_MIWT3_5_NLCA3_PLR1_SU0_SUM0_SUS0_SVW1_VWA1_WG128_2_1_WGM1
    SolutionIndex: 582
    SolutionNameMin: Cijk_Ailk_Bljk_S_MX_B_Bias_HA_SAV_UserArgs_MT128x128x32_MI32x32x1_SN_GRVWB4_GSU1_LBSPPA0_LBSPPB128_LPA0_LPB4_LRVW4_MIAV1_MIWT2_2_NTC3_NTD3_NLCA1_SU0_SUM0_SUS0_SVW2_VWA2_WG64_4_1_WGM8
    SolutionIndex: 583
    SolutionNameMin: Cijk_Ailk_Bljk_S_MX_B_Bias_HA_SAV_UserArgs_MT192x256x32_MI32x32x1_SN_GRVWB4_GSU3_LBSPPA0_LBSPPB128_LPA0_LPB4_LRVW4_MIAV0_MIWT3_4_NTC3_NTD3_NLCA3_SU0_SUM0_SUS0_SVW1_VWA1_WG64_4_1_WGM1
    SolutionIndex: 584
    SolutionNameMin: Cijk_Ailk_Bljk_S_MX_B_Bias_HA_SAV_UserArgs_MT320x176x16_MI16x16x1_SN_GRVWB1_GSU3_LBSPPA2560_LBSPPB128_LPA16_LPB2_LRVW2_MIAV0_MIWT5_11_NTC3_NTD3_NLCA5_SU0_SUM0_SUS0_SVW1_VWA1_WG64_4_1_WGM1
    SolutionIndex: 585
    SolutionNameMin: Cijk_Ailk_Bljk_S_MX_B_Bias_HA_SAV_UserArgs_MT256x128x16_MI32x32x1_SN_GRVWB4_GSU1_LBSPPA0_LPA0_LPB4_LRVW4_MIWT2_4_NTC3_NTD3_NLCA1_SU0_SUM0_SUS0_SVW2_VWA2_WG128_2_1_WGM8
    SolutionIndex: 586
    SolutionNameMin: Cijk_Ailk_Bljk_S_MX_B_Bias_HA_SAV_UserArgs_MT256x128x32_MI32x32x1_SN_GRVWB4_GSU1_LBSPPA0_LPA0_LPB4_LRVW4_MIWT2_4_NTC3_NTD3_NLCA1_SU0_SUM0_SUS0_SVW2_VWA2_WG128_2_1_WGM8
    SolutionIndex: 587
    SolutionNameMin: Cijk_Ailk_Bljk_S_MX_B_Bias_HA_SAV_UserArgs_MT256x160x32_MI32x32x1_SN_GRVWB4_GSU1_LBSPPA0_LPA0_LPB4_LRVW4_MIWT2_5_NTC3_NTD3_NLCA1_SU0_SUM0_SUS0_SVW2_VWA2_WG128_2_1_WGM1
    SolutionIndex: 588
    SolutionNameMin: Cijk_Ailk_Bljk_S_MX_B_Bias_HA_SAV_UserArgs_MT256x160x32_MI32x32x1_SN_GRVWB4_GSU1_LBSPPA0_LPA0_LPB4_LRVW4_MIWT2_5_NTC3_NTD3_NLCA1_SU0_SUM0_SUS0_SVW2_VWA2_WG128_2_1_WGM8
    SolutionIndex: 589
    SolutionNameMin: Cijk_Ailk_Bljk_S_MX_B_Bias_HA_SAV_UserArgs_MT384x160x16_MI16x16x1_SN_GRVWB1_GSU1_LBSPPA3072_LPA0_LPB2_LRVW2_MIWT6_10_NTC3_NTD3_NLCA3_SU0_SUM0_SUS0_SVW2_VWA2_WG64_4_1_WGM1
    SolutionIndex: 590
    SolutionNameMin: Cijk_Ailk_Bljk_S_MX_B_Bias_HA_SAV_UserArgs_MT384x160x16_MI32x32x1_SN_GRVWB1_GSU1_LBSPPA0_LPA0_LPB4_LRVW4_MIWT3_5_NTC3_NTD3_NLCA3_SU0_SUM0_SUS0_SVW1_VWA1_WG128_2_1_WGM8
    SolutionIndex: 591
    SolutionNameMin: Cijk_Ailk_Bljk_S_MX_B_Bias_HA_SAV_UserArgs_MT256x208x16_MI16x16x1_SN_GRVWB1_GSU1_LBSPPA2048_LPA0_LPB2_LRVW2_MIWT4_13_NLCA1_SU8_SUM0_SUS256_SVW4_VWA4_WG64_4_1_WGM8
    SolutionIndex: 592
    SolutionNameMin: Cijk_Ailk_Bljk_S_MX_B_Bias_HA_SAV_UserArgs_MT256x224x32_MI32x32x1_SN_GRVWB4_GSU1_LBSPPA0_LPA0_LPB4_LRVW4_MIWT2_7_NLCA1_SU8_SUM0_SUS256_SVW2_VWA2_WG128_2_1_WGM8
    SolutionIndex: 593
    SolutionNameMin: Cijk_Ailk_Bljk_S_MX_B_Bias_HA_SAV_UserArgs_MT256x112x16_MI16x16x1_SN_GRVWB1_GSU1_LBSPPA2048_LPA0_LPB2_LRVW2_MIWT4_7_NLCA1_SU8_SUM0_SUS256_SVW4_VWA4_WG64_4_1_WGM1
    SolutionIndex: 594
    SolutionNameMin: Cijk_Ailk_Bljk_S_MX_B_Bias_HA_SAV_UserArgs_MT320x128x16_MI16x16x1_SN_GRVWB4_GSU1_LBSPPA2560_LPA16_LPB4_LRVW2_MIWT5_8_NLCA5_SU8_SUM0_SUS256_SVW1_VWA1_WG64_4_1_WGM1
    SolutionIndex: 595
    SolutionNameMin: Cijk_Ailk_Bljk_S_MX_B_Bias_HA_SAV_UserArgs_MT256x160x32_MI32x32x1_SN_GRVWB4_GSU1_LBSPPA0_LPA0_LPB4_LRVW4_MIWT2_5_NLCA1_SU8_SUM0_SUS256_SVW2_VWA2_WG128_2_1_WGM1
    SolutionIndex: 596
    SolutionNameMin: Cijk_Ailk_Bljk_S_MX_B_Bias_HA_SAV_UserArgs_MT128x320x16_MI16x16x1_SN_GRVWB4_GSU1_LBSPPA1024_LPA0_LPB4_LRVW2_MIWT8_5_NLCA1_SU8_SUM0_SUS256_SVW4_VWA4_WG16_16_1_WGM1
    SolutionIndex: 597
    SolutionNameMin: Cijk_Ailk_Bljk_S_MX_B_Bias_HA_SAV_UserArgs_MT256x160x32_MI32x32x1_SN_GRVWB4_GSU1_LBSPPA0_LPA0_LPB4_LRVW4_MIWT2_5_NLCA1_SU8_SUM0_SUS256_SVW2_VWA2_WG128_2_1_WGM8
    SolutionIndex: 598
    SolutionNameMin: Cijk_Ailk_Bljk_S_MX_B_Bias_HA_SAV_UserArgs_MT256x128x16_MI32x32x1_SN_GRVWB4_GSU1_LBSPPA0_LPA0_LPB4_LRVW4_MIWT2_4_NLCA1_SU8_SUM0_SUS256_SVW2_VWA2_WG128_2_1_WGM1
    SolutionIndex: 599
    SolutionNameMin: Cijk_Ailk_Bljk_S_MX_B_Bias_HA_SAV_UserArgs_MT256x144x16_MI16x16x1_SN_GRVWB1_GSU1_LBSPPA2048_LPA0_LPB2_LRVW2_MIAV0_MIWT4_9_NLCA1_SU8_SUM0_SUS256_SVW4_VWA4_WG64_4_1_WGMn8
    SolutionIndex: 600
    SolutionNameMin: Cijk_Ailk_Bljk_S_MX_B_Bias_HA_SAV_UserArgs_MT256x208x16_MI16x16x1_SN_GRVWB1_GSU1_LBSPPA2048_LPA0_LPB2_LRVW2_MIAV0_MIWT4_13_NLCA1_SU8_SUM0_SUS256_SVW4_VWA4_WG64_4_1_WGMn8
    SolutionIndex: 601
    SolutionNameMin: Cijk_Ailk_Bljk_S_MX_B_Bias_HA_SAV_UserArgs_MT256x128x16_MI32x32x1_SN_GRVWB4_GSU1_LBSPPA0_LPA0_LPB4_LRVW4_MIAV0_MIWT2_4_NLCA1_SU8_SUM0_SUS256_SVW2_VWA2_WG128_2_1_WGMn8
    SolutionIndex: 602
    SolutionNameMin: Cijk_Ailk_Bljk_S_MX_B_Bias_HA_SAV_UserArgs_MT192x128x16_MI32x32x1_SN_GRVWB4_GSU1_LBSPPA0_LPA0_LPB4_LRVW4_MIAV0_MIWT3_2_NLCA3_SU8_SUM0_SUS256_SVW1_VWA1_WG64_4_1_WGMn8
    SolutionIndex: 603
    SolutionNameMin: Cijk_Ailk_Bljk_S_MX_B_Bias_HA_SAV_UserArgs_MT192x192x16_MI32x32x1_SN_GRVWB4_GSU1_LBSPPA0_LPA0_LPB4_LRVW4_MIWT3_3_NLCA3_SU8_SUM0_SUS256_SVW1_VWA1_WG64_4_1_WGMn16
    SolutionIndex: 604
    SolutionNameMin: Cijk_Ailk_Bljk_S_MX_B_Bias_HA_SAV_UserArgs_MT16x64x128_MI16x16x1_SN_GRVWB4_GSU1_LBSPPA256_LBSPPB512_LPB8_LRVW4_MIWT1_1_NTB4_SU0_SUM0_SUS0_WG16_16_1_WGM1
    SolutionIndex: 605
    SolutionNameMin: Cijk_Ailk_Bljk_S_MX_B_Bias_HA_SAV_UserArgs_MT16x64x64_MI16x16x1_SN_GRVWB4_GSU5_LBSPPA256_LBSPPB256_LPB8_LRVW4_MIWT1_1_NTB4_SU0_SUM0_SUS0_WG16_16_1_WGM1
    SolutionIndex: 606
    SolutionNameMin: Cijk_Ailk_Bljk_S_MX_B_Bias_HA_SAV_UserArgs_MT16x96x128_MI16x16x1_SN_GRVWB4_GSU1_LBSPPA256_LBSPPB512_LPB8_LRVW4_MIWT1_3_NTB0_SU0_SUM0_SUS0_WG16_8_2_WGM1
    SolutionIndex: 607
    SolutionNameMin: Cijk_Ailk_Bljk_S_MX_B_Bias_HA_SAV_UserArgs_MT16x96x128_MI16x16x1_SN_GRVWB4_GSU1_LBSPPA256_LBSPPB512_LPB8_LRVW4_MIWT1_3_NTB4_SU0_SUM0_SUS0_WG16_8_2_WGM1
    SolutionIndex: 608
    SolutionNameMin: Cijk_Ailk_Bljk_S_MX_B_Bias_HA_SAV_UserArgs_MT16x64x128_MI16x16x1_SN_GRVWB4_GSU1_LBSPPA256_LBSPPB512_LPA16_LPB8_LRVW4_MIWT1_2_NTB0_SU0_SUM0_SUS0_SVW1_VWA1_WG16_8_2_WGM1
    SolutionIndex: 609
    SolutionNameMin: Cijk_Ailk_Bljk_S_MX_B_Bias_HA_SAV_UserArgs_MT16x64x128_MI16x16x1_SN_GRVWB4_GSU1_LBSPPA256_LBSPPB512_LPA16_LPB8_LRVW4_MIWT1_2_NTB4_SU0_SUM0_SUS0_SVW1_VWA1_WG16_8_2_WGM1
    SolutionIndex: 610
    SolutionNameMin: Cijk_Ailk_Bljk_S_MX_B_Bias_HA_SAV_UserArgs_MT16x160x64_MI16x16x1_SN_GRVWB4_GSU3_LBSPPA256_LBSPPB256_LPA16_LPB8_LRVW4_MIWT1_5_NTB4_SU0_SUM0_SUS0_SVW1_VWA1_WG16_8_2_WGM1
    SolutionIndex: 611
    SolutionNameMin: Cijk_Ailk_Bljk_S_MX_B_Bias_HA_SAV_UserArgs_MT32x64x128_MI32x32x1_SN_GRVWB4_GSU1_LBSPPA0_LBSPPB512_LPA0_LPB4_LRVW4_MIWT1_1_NTB0_SU0_SUM0_SUS0_SVW1_VWA1_WG32_4_2_WGM1
    SolutionIndex: 612
    SolutionNameMin: Cijk_Ailk_Bljk_S_MX_B_Bias_HA_SAV_UserArgs_MT32x64x128_MI32x32x1_SN_GRVWB4_GSU1_LBSPPA0_LBSPPB512_LPA0_LPB4_LRVW4_MIWT1_1_NTB4_SU0_SUM0_SUS0_SVW1_VWA1_WG32_4_2_WGM1
    SolutionIndex: 613
    SolutionNameMin: Cijk_Ailk_Bljk_S_MX_B_Bias_HA_SAV_UserArgs_MT16x96x128_MI16x16x1_SN_GRVWB4_GSU1_LBSPPA256_LBSPPB512_LPA16_LPB8_LRVW4_MIWT1_3_NTB0_SU0_SUM0_SUS0_SVW1_VWA1_WG16_8_2_WGM1
    SolutionIndex: 614
    SolutionNameMin: Cijk_Ailk_Bljk_S_MX_B_Bias_HA_SAV_UserArgs_MT16x96x128_MI16x16x1_SN_GRVWB4_GSU1_LBSPPA256_LBSPPB512_LPA16_LPB8_LRVW4_MIWT1_3_NTB4_SU0_SUM0_SUS0_SVW1_VWA1_WG16_8_2_WGM1
    SolutionIndex: 615
    SolutionNameMin: Cijk_Ailk_Bljk_S_MX_B_Bias_HA_SAV_UserArgs_MT32x80x128_MI16x16x1_SN_GRVWB4_GSU1_LBSPPA512_LBSPPB512_LPA16_LPB8_LRVW4_MIWT1_5_NTB0_SU0_SUM0_SUS0_SVW1_VWA1_WG32_4_2_WGM1
    SolutionIndex: 616
    SolutionNameMin: Cijk_Ailk_Bljk_S_MX_B_Bias_HA_SAV_UserArgs_MT32x80x128_MI16x16x1_SN_GRVWB4_GSU1_LBSPPA512_LBSPPB512_LPA16_LPB8_LRVW4_MIWT1_5_NTB4_SU0_SUM0_SUS0_SVW1_VWA1_WG32_4_2_WGM1
    SolutionIndex: 617
    SolutionNameMin: Cijk_Ailk_Bljk_S_MX_B_Bias_HA_SAV_UserArgs_MT64x64x64_MI32x32x1_SN_CLR1_GRVWB4_GSU1_LBSPPA0_LBSPPB256_LPA0_LPB4_LRVW4_MIAV1_MIWT1_2_NTB0_NLCA1_PLR1_SU0_SUM0_SUS0_SVW1_VWA1_WG64_2_2_WGM1
    SolutionIndex: 618
    SolutionNameMin: Cijk_Ailk_Bljk_S_MX_B_Bias_HA_SAV_UserArgs_MT64x112x64_MI16x16x1_SN_CLR1_GRVWB4_GSU2_LBSPPA1024_LBSPPB256_LPA0_LPB8_LRVW4_MIAV1_MIWT2_7_NTB4_NLCA1_PLR1_SU0_SUM0_SUS0_SVW2_VWA2_WG32_4_2_WGM1
    SolutionIndex: 619
    SolutionNameMin: Cijk_Ailk_Bljk_S_MX_B_Bias_HA_SAV_UserArgs_MT96x160x32_MI16x16x1_SN_CLR1_GRVWB4_GSU3_LBSPPA1536_LBSPPB128_LPA16_LPB8_LRVW4_MIAV1_MIWT3_5_NTB0_NLCA3_PLR1_SU0_SUM0_SUS0_SVW1_VWA1_WG32_8_1_WGM1
    SolutionIndex: 620
    SolutionNameMin: Cijk_Ailk_Bljk_S_MX_B_Bias_HA_SAV_UserArgs_MT96x256x32_MI16x16x1_SN_CLR1_GRVWB4_GSU5_LBSPPA1536_LBSPPB128_LPA16_LPB8_LRVW4_MIAV0_MIWT3_8_NTB4_NLCA3_PLR1_SU0_SUM0_SUS0_SVW1_VWA1_WG32_8_1_WGM1
    SolutionIndex: 621
    SolutionNameMin: Cijk_Ailk_Bljk_S_MX_B_Bias_HA_SAV_UserArgs_MT64x80x64_MI16x16x1_SN_CLR1_GRVWB4_GSU1_LBSPPA1024_LBSPPB256_LPA0_LPB8_LRVW4_MIAV1_MIWT2_5_NTB0_NLCA1_PLR1_SU0_SUM0_SUS0_SVW2_VWA2_WG32_4_2_WGM1
    SolutionIndex: 622
    SolutionNameMin: Cijk_Ailk_Bljk_S_MX_B_Bias_HA_SAV_UserArgs_MT64x80x64_MI16x16x1_SN_CLR1_GRVWB4_GSU1_LBSPPA1024_LBSPPB256_LPA0_LPB8_LRVW4_MIAV1_MIWT2_5_NTB4_NLCA1_PLR1_SU0_SUM0_SUS0_SVW2_VWA2_WG32_4_2_WGM1
    SolutionIndex: 623
    SolutionNameMin: Cijk_Ailk_Bljk_S_MX_B_Bias_HA_SAV_UserArgs_MT64x160x64_MI16x16x1_SN_CLR1_GRVWB4_GSU2_LBSPPA1024_LBSPPB256_LPA0_LPB8_LRVW4_MIAV1_MIWT2_5_NTB4_NLCA1_PLR1_SU0_SUM0_SUS0_SVW2_VWA2_WG32_8_1_WGM1
    SolutionIndex: 624
    SolutionNameMin: Cijk_Ailk_Bljk_S_MX_B_Bias_HA_SAV_UserArgs_MT96x160x32_MI16x16x1_SN_CLR1_GRVWB4_GSU2_LBSPPA1536_LBSPPB128_LPA16_LPB8_LRVW4_MIAV1_MIWT3_5_NTB0_NLCA3_PLR1_SU0_SUM0_SUS0_SVW1_VWA1_WG32_8_1_WGM1
    SolutionIndex: 625
    SolutionNameMin: Cijk_Ailk_Bljk_S_MX_B_Bias_HA_SAV_UserArgs_MT96x128x64_MI16x16x1_SN_CLR1_GRVWB4_GSU3_LBSPPA1536_LBSPPB256_LPA16_LPB8_LRVW4_MIAV1_MIWT3_4_NTB4_NLCA3_PLR1_SU0_SUM0_SUS0_SVW1_VWA1_WG32_8_1_WGM1
    SolutionIndex: 626
    SolutionNameMin: Cijk_Ailk_Bljk_S_MX_B_Bias_HA_SAV_UserArgs_MT64x112x64_MI16x16x1_SN_CLR1_GRVWB4_GSU1_LBSPPA1024_LBSPPB256_LPA0_LPB8_LRVW4_MIAV1_MIWT2_7_NTB0_NLCA1_PLR1_SU0_SUM0_SUS0_SVW2_VWA2_WG32_4_2_WGM1
    SolutionIndex: 627
    SolutionNameMin: Cijk_Ailk_Bljk_S_MX_B_Bias_HA_SAV_UserArgs_MT128x256x32_MI32x32x1_SN_CLR1_GRVWB4_GSU5_LBSPPA0_LBSPPB128_LPA0_LPB4_LRVW4_MIAV0_MIWT2_4_NTB4_NLCA1_PLR1_SU0_SUM0_SUS0_SVW2_VWA2_WG64_4_1_WGM1
    SolutionIndex: 628
    SolutionNameMin: Cijk_Ailk_Bljk_S_MX_B_Bias_HA_SAV_UserArgs_MT96x128x64_MI16x16x1_SN_CLR1_GRVWB4_GSU1_LBSPPA1536_LBSPPB256_LPA16_LPB8_LRVW4_MIAV1_MIWT3_4_NTB0_NLCA3_PLR1_SU0_SUM0_SUS0_SVW1_VWA1_WG32_8_1_WGM1
    SolutionIndex: 629
    SolutionNameMin: Cijk_Ailk_Bljk_S_MX_B_Bias_HA_SAV_UserArgs_MT192x256x32_MI32x32x1_SN_CLR1_GRVWB4_GSU5_LBSPPA0_LBSPPB128_LPA0_LPB4_LRVW4_MIAV0_MIWT3_4_NTB4_NLCA3_PLR1_SU0_SUM0_SUS0_SVW1_VWA1_WG64_4_1_WGM1
    SolutionIndex: 630
    SolutionNameMin: Cijk_Ailk_Bljk_S_MX_B_Bias_HA_SAV_UserArgs_MT128x80x64_MI16x16x1_SN_CLR1_GRVWB4_GSU1_LBSPPA2048_LBSPPB256_LPA0_LPB8_LRVW4_MIAV1_MIWT2_5_NTB0_NLCA1_PLR1_SU0_SUM0_SUS0_SVW2_VWA2_WG64_4_1_WGM1
    SolutionIndex: 631
    SolutionNameMin: Cijk_Ailk_Bljk_S_MX_B_Bias_HA_SAV_UserArgs_MT128x256x32_MI32x32x1_SN_CLR1_GRVWB4_GSU3_LBSPPA0_LBSPPB128_LPA0_LPB4_LRVW4_MIAV0_MIWT2_4_NTB4_NLCA1_PLR1_SU0_SUM0_SUS0_SVW2_VWA2_WG64_4_1_WGM1
    SolutionIndex: 632
    SolutionNameMin: Cijk_Ailk_Bljk_S_MX_B_Bias_HA_SAV_UserArgs_MT128x320x32_MI32x32x1_SN_CLR1_GRVWB4_GSU4_LBSPPA0_LBSPPB128_LPA0_LPB4_LRVW4_MIAV0_MIWT2_5_NTB4_NLCA1_PLR1_SU0_SUM0_SUS0_SVW2_VWA2_WG64_4_1_WGM1
    SolutionIndex: 633
    SolutionNameMin: Cijk_Ailk_Bljk_S_MX_B_Bias_HA_SAV_UserArgs_MT96x160x32_MI16x16x1_SN_CLR1_GRVWB4_GSU1_LBSPPA1536_LBSPPB128_LPA16_LPB8_LRVW4_MIAV1_MIWT3_5_NTB0_NLCA3_PLR1_SU0_SUM0_SUS0_SVW1_VWA1_WG32_8_1_WGM1
    SolutionIndex: 634
    SolutionNameMin: Cijk_Ailk_Bljk_S_MX_B_Bias_HA_SAV_UserArgs_MT192x256x32_MI32x32x1_SN_CLR1_GRVWB4_GSU3_LBSPPA0_LBSPPB128_LPA0_LPB4_LRVW4_MIAV0_MIWT3_4_NTB4_NLCA3_PLR1_SU0_SUM0_SUS0_SVW1_VWA1_WG64_4_1_WGM1
    SolutionIndex: 635
    SolutionNameMin: Cijk_Ailk_Bljk_S_MX_B_Bias_HA_SAV_UserArgs_MT128x128x32_MI32x32x1_SN_GRVWB4_GSU1_LBSPPA0_LBSPPB128_LPA0_LPB4_LRVW4_MIAV1_MIWT2_2_NTB0_NTC3_NTD3_NLCA1_SU0_SUM0_SUS0_SVW2_VWA2_WG64_4_1_WGM1
    SolutionIndex: 636
    SolutionNameMin: Cijk_Ailk_Bljk_S_MX_B_Bias_HA_SAV_UserArgs_MT256x160x32_MI32x32x1_SN_GRVWB4_GSU3_LBSPPA0_LBSPPB128_LPA0_LPB4_LRVW4_MIAV0_MIWT2_5_NTB4_NTC3_NTD3_NLCA1_SU0_SUM0_SUS0_SVW2_VWA2_WG128_2_1_WGM1
    SolutionIndex: 637
    SolutionNameMin: Cijk_Ailk_Bljk_S_MX_B_Bias_HA_SAV_UserArgs_MT128x160x32_MI16x16x1_SN_GRVWB4_GSU1_LBSPPA2048_LBSPPB128_LPA0_LPB8_LRVW4_MIAV1_MIWT2_10_NTB0_NTC3_NTD3_NLCA1_SU0_SUM0_SUS0_SVW2_VWA2_WG64_4_1_WGM1
    SolutionIndex: 638
    SolutionNameMin: Cijk_Ailk_Bljk_S_MX_B_Bias_HA_SAV_UserArgs_MT384x160x16_MI32x32x1_SN_GRVWB1_GSU3_LBSPPA0_LBSPPB128_LPA0_LPB4_LRVW4_MIAV0_MIWT3_5_NTB4_NTC3_NTD3_NLCA3_SU0_SUM0_SUS0_SVW1_VWA1_WG128_2_1_WGM1
    SolutionIndex: 639
    SolutionNameMin: Cijk_Ailk_Bljk_S_MX_B_Bias_HA_SAV_UserArgs_MT256x96x32_MI32x32x1_SN_GRVWB4_GSU1_LBSPPA0_LBSPPB128_LPA0_LPB4_LRVW4_MIAV0_MIWT2_3_NTB4_NTC3_NTD3_NLCA1_SU0_SUM0_SUS0_SVW2_VWA2_WG128_2_1_WGM1
    SolutionIndex: 640
    SolutionNameMin: Cijk_Ailk_Bljk_S_MX_B_Bias_HA_SAV_UserArgs_MT256x160x32_MI32x32x1_SN_GRVWB4_GSU2_LBSPPA0_LBSPPB128_LPA0_LPB4_LRVW4_MIAV0_MIWT2_5_NTB4_NTC3_NTD3_NLCA1_SU0_SUM0_SUS0_SVW2_VWA2_WG128_2_1_WGM1
    SolutionIndex: 641
    SolutionNameMin: Cijk_Ailk_Bljk_S_MX_B_Bias_HA_SAV_UserArgs_MT192x160x32_MI16x16x1_SN_GRVWB4_GSU1_LBSPPA3072_LBSPPB128_LPA0_LPB8_LRVW4_MIAV0_MIWT6_5_NTB4_NTC3_NTD3_NLCA3_SU0_SUM0_SUS0_SVW2_VWA2_WG32_8_1_WGM1
    SolutionIndex: 642
    SolutionNameMin: Cijk_Ailk_Bljk_S_MX_B_Bias_HA_SAV_UserArgs_MT384x160x16_MI32x32x1_SN_GRVWB1_GSU2_LBSPPA0_LBSPPB128_LPA0_LPB4_LRVW4_MIAV0_MIWT3_5_NTB4_NTC3_NTD3_NLCA3_SU0_SUM0_SUS0_SVW1_VWA1_WG128_2_1_WGM1
    SolutionIndex: 643
    SolutionNameMin: Cijk_Ailk_Bljk_S_MX_B_Bias_HA_SAV_UserArgs_MT128x256x32_MI32x32x1_SN_GRVWB4_GSU1_LBSPPA0_LPA0_LPB4_LRVW4_MIWT2_4_NTC3_NTD3_NLCA1_SU0_SUM0_SUS0_SVW2_VWA2_WG64_4_1_WGM8
    SolutionIndex: 644
    SolutionNameMin: Cijk_Ailk_Bljk_S_MX_B_Bias_HA_SAV_UserArgs_MT128x256x32_MI32x32x1_SN_GRVWB4_GSU1_LBSPPA0_LPA0_LPB4_LRVW4_MIWT2_4_NTC3_NTD3_NLCA1_SU0_SUM0_SUS0_SVW2_VWA2_WG64_4_1_WGM16
    SolutionIndex: 645
    SolutionNameMin: Cijk_Ailk_Bljk_S_MX_B_Bias_HA_SAV_UserArgs_MT256x224x32_MI32x32x1_SN_GRVWB4_GSU2_LBSPPA0_LPA0_LPB4_LRVW4_MIWT2_7_NTC3_NTD3_NLCA1_SU0_SUM0_SUS0_SVW2_VWA2_WG128_2_1_WGM8
    SolutionIndex: 646
    SolutionNameMin: Cijk_Ailk_Bljk_S_MX_B_Bias_HA_SAV_UserArgs_MT128x320x32_MI32x32x1_SN_GRVWB4_GSU1_LBSPPA0_LPA0_LPB4_LRVW4_MIWT2_5_NTC3_NTD3_NLCA1_SU0_SUM0_SUS0_SVW2_VWA2_WG64_4_1_WGM16
    SolutionIndex: 647
    SolutionNameMin: Cijk_Ailk_Bljk_S_MX_B_Bias_HA_SAV_UserArgs_MT256x160x32_MI32x32x1_SN_GRVWB4_GSU1_LBSPPA0_LPA0_LPB4_LRVW4_MIWT2_5_NTC3_NTD3_NLCA1_SU0_SUM0_SUS0_SVW2_VWA2_WG128_2_1_WGM16
    SolutionIndex: 648
    SolutionNameMin: Cijk_Ailk_Bljk_S_MX_B_Bias_HA_SAV_UserArgs_MT128x192x16_MI32x32x1_SN_GRVWB4_GSU1_LBSPPA0_LPA0_LPB4_LRVW4_MIWT1_6_NTC0_NTD0_NLCA1_SU0_SUM0_SUS0_SVW1_VWA1_WG128_2_1_WGM8
    SolutionIndex: 649
    SolutionNameMin: Cijk_Ailk_Bljk_S_MX_B_Bias_HA_SAV_UserArgs_MT320x160x16_MI16x16x1_SN_GRVWB1_GSU1_LBSPPA2560_LPA0_LPB2_LRVW2_MIWT10_5_NTC3_NTD3_NLCA5_SU0_SUM0_SUS0_SVW2_VWA2_WG32_8_1_WGM8
    SolutionIndex: 650
    SolutionNameMin: Cijk_Ailk_Bljk_S_MX_B_Bias_HA_SAV_UserArgs_MT320x160x16_MI16x16x1_SN_GRVWB1_GSU1_LBSPPA2560_LPA16_LPB2_LRVW2_MIWT5_10_NTC0_NTD0_NLCA5_SU0_SUM0_SUS0_SVW1_VWA1_WG64_4_1_WGM16
    SolutionIndex: 651
    SolutionNameMin: Cijk_Ailk_Bljk_S_MX_B_Bias_HA_SAV_UserArgs_MT256x256x16_MI16x16x1_SN_GRVWB1_GSU1_LBSPPA2048_LPA0_LPB2_LRVW2_MIWT4_16_NTC0_NTD0_NLCA1_SU0_SUM0_SUS0_SVW4_VWA4_WG64_4_1_WGM16
    SolutionIndex: 652
    SolutionNameMin: Cijk_Ailk_Bljk_S_MX_B_Bias_HA_SAV_UserArgs_MT384x160x16_MI16x16x1_SN_GRVWB1_GSU1_LBSPPA3072_LPA0_LPB2_LRVW2_MIWT6_10_NTC3_NTD3_NLCA3_SU0_SUM0_SUS0_SVW2_VWA2_WG64_4_1_WGM8
    SolutionIndex: 653
    SolutionNameMin: Cijk_Ailk_Bljk_S_MX_B_Bias_HA_SAV_UserArgs_MT384x160x16_MI32x32x1_SN_GRVWB1_GSU1_LBSPPA0_LPA0_LPB4_LRVW4_MIWT3_5_NTC3_NTD3_NLCA3_SU0_SUM0_SUS0_SVW1_VWA1_WG128_2_1_WGM16
    SolutionIndex: 654
    SolutionNameMin: Cijk_Ailk_Bljk_S_MX_B_Bias_HA_SAV_UserArgs_MT256x208x16_MI16x16x1_SN_GRVWB1_GSU1_LBSPPA2048_LPA0_LPB2_LRVW2_MIWT4_13_NLCA1_SU8_SUM0_SUS256_SVW4_VWA4_WG64_4_1_WGM16
    SolutionIndex: 655
    SolutionNameMin: Cijk_Ailk_Bljk_S_MX_B_Bias_HA_SAV_UserArgs_MT256x224x32_MI32x32x1_SN_GRVWB4_GSU1_LBSPPA0_LPA0_LPB4_LRVW4_MIWT2_7_NLCA1_SU8_SUM0_SUS256_SVW2_VWA2_WG128_2_1_WGM16
    SolutionIndex: 656
    SolutionNameMin: Cijk_Ailk_Bljk_S_MX_B_Bias_HA_SAV_UserArgs_MT128x320x16_MI16x16x1_SN_GRVWB4_GSU1_LBSPPA1024_LPA0_LPB4_LRVW2_MIWT8_5_NLCA1_SU8_SUM0_SUS256_SVW4_VWA4_WG16_16_1_WGM16
    SolutionIndex: 657
    SolutionNameMin: Cijk_Ailk_Bljk_S_MX_B_Bias_HA_SAV_UserArgs_MT320x128x16_MI16x16x1_SN_GRVWB4_GSU1_LBSPPA2560_LPA16_LPB4_LRVW2_MIWT5_8_NLCA5_SU8_SUM0_SUS256_SVW1_VWA1_WG64_4_1_WGM16
    SolutionIndex: 658
    SolutionNameMin: Cijk_Ailk_Bljk_S_MX_B_Bias_HA_SAV_UserArgs_MT128x320x16_MI16x16x1_SN_GRVWB4_GSU1_LBSPPA1024_LPA0_LPB4_LRVW2_MIWT8_5_NLCA1_SU8_SUM0_SUS256_SVW4_VWA4_WG16_16_1_WGM8
    SolutionIndex: 659
    SolutionNameMin: Cijk_Ailk_Bljk_S_MX_B_Bias_HA_SAV_UserArgs_MT256x160x32_MI32x32x1_SN_GRVWB4_GSU1_LBSPPA0_LPA0_LPB4_LRVW4_MIWT2_5_NLCA1_SU8_SUM0_SUS256_SVW2_VWA2_WG128_2_1_WGM16
    SolutionIndex: 660
    SolutionNameMin: Cijk_Ailk_Bljk_S_MX_B_Bias_HA_SAV_UserArgs_MT256x128x16_MI16x16x1_SN_GRVWB4_GSU1_LBSPPA2048_LPA0_LPB4_LRVW2_MIWT4_8_NLCA1_SU8_SUM0_SUS256_SVW4_VWA4_WG64_4_1_WGM8
    SolutionIndex: 661
    SolutionNameMin: Cijk_Ailk_Bljk_S_MX_B_Bias_HA_SAV_UserArgs_MT256x128x16_MI32x32x1_SN_GRVWB4_GSU1_LBSPPA0_LPA0_LPB4_LRVW4_MIWT2_4_NLCA1_SU8_SUM0_SUS256_SVW2_VWA2_WG128_2_1_WGM8
    SolutionIndex: 662
    SolutionNameMin: Cijk_Ailk_Bljk_S_MX_B_Bias_HA_SAV_UserArgs_MT256x144x16_MI16x16x1_SN_GRVWB1_GSU1_LBSPPA2048_LPA0_LPB2_LRVW2_MIAV0_MIWT4_9_NLCA1_SU8_SUM0_SUS256_SVW4_VWA4_WG64_4_1_WGM8
    SolutionIndex: 663
    SolutionNameMin: Cijk_Ailk_Bljk_S_MX_B_Bias_HA_SAV_UserArgs_MT256x208x16_MI16x16x1_SN_GRVWB1_GSU1_LBSPPA2048_LPA0_LPB2_LRVW2_MIAV0_MIWT4_13_NLCA1_SU8_SUM0_SUS256_SVW4_VWA4_WG64_4_1_WGM16
    SolutionIndex: 664
    SolutionNameMin: Cijk_Ailk_Bljk_S_MX_B_Bias_HA_SAV_UserArgs_MT256x224x32_MI32x32x1_SN_GRVWB4_GSU1_LBSPPA0_LPA0_LPB4_LRVW4_MIAV0_MIWT2_7_NLCA1_SU8_SUM0_SUS256_SVW2_VWA2_WG128_2_1_WGM8
    SolutionIndex: 665
    SolutionNameMin: Cijk_Ailk_Bljk_S_MX_B_Bias_HA_SAV_UserArgs_MT256x128x16_MI32x32x1_SN_GRVWB4_GSU1_LBSPPA0_LPA0_LPB4_LRVW4_MIAV0_MIWT2_4_NLCA1_SU8_SUM0_SUS256_SVW2_VWA2_WG128_2_1_WGM8
    SolutionIndex: 666
    SolutionNameMin: Cijk_Ailk_Bljk_S_MX_B_Bias_HA_SAV_UserArgs_MT256x128x16_MI32x32x1_SN_GRVWB4_GSU1_LBSPPA0_LPA0_LPB4_LRVW4_MIAV0_MIWT2_4_NLCA1_SU8_SUM0_SUS256_SVW2_VWA2_WG128_2_1_WGM16
    SolutionIndex: 667
    SolutionNameMin: Cijk_Ailk_Bljk_S_MX_B_Bias_HA_SAV_UserArgs_MT192x128x16_MI32x32x1_SN_GRVWB4_GSU1_LBSPPA0_LPA0_LPB4_LRVW4_MIAV0_MIWT3_2_NLCA3_SU8_SUM0_SUS256_SVW1_VWA1_WG64_4_1_WGM16
    SolutionIndex: 668
    SolutionNameMin: Cijk_Ailk_Bljk_S_MX_B_Bias_HA_SAV_UserArgs_MT192x192x16_MI32x32x1_SN_GRVWB4_GSU1_LBSPPA0_LPA0_LPB4_LRVW4_MIWT3_3_NLCA3_SU8_SUM0_SUS256_SVW1_VWA1_WG64_4_1_WGM16
    SolutionIndex: 669
    SolutionNameMin: Cijk_Ailk_Bljk_S_MX_B_Bias_HA_SAV_UserArgs_MT16x64x64_MI16x16x1_SN_GRVWB4_GSU1_LBSPPA256_LBSPPB256_LPB8_LRVW4_MIWT1_1_NTB4_SU0_SUM0_SUS0_WG16_16_1_WGM1
    SolutionIndex: 670
    SolutionNameMin: Cijk_Ailk_Bljk_S_MX_B_Bias_HA_SAV_UserArgs_MT16x64x64_MI16x16x1_SN_GRVWB4_GSU3_LBSPPA256_LBSPPB256_LPB8_LRVW4_MIWT1_1_NTB4_SU0_SUM0_SUS0_WG16_16_1_WGM1
    SolutionIndex: 671
    SolutionNameMin: Cijk_Ailk_Bljk_S_MX_B_Bias_HA_SAV_UserArgs_MT16x128x64_MI16x16x1_SN_GRVWB4_GSU5_LBSPPA256_LBSPPB256_LPB8_LRVW4_MIWT1_2_NTB4_SU0_SUM0_SUS0_WG16_16_1_WGM1
    SolutionIndex: 672
    SolutionNameMin: Cijk_Ailk_Bljk_S_MX_B_Bias_HA_SAV_UserArgs_MT16x160x64_MI16x16x1_SN_GRVWB4_GSU1_LBSPPA256_LBSPPB256_LPB8_LRVW4_MIWT1_5_NTB4_SU0_SUM0_SUS0_WG16_8_2_WGM1
    SolutionIndex: 673
    SolutionNameMin: Cijk_Ailk_Bljk_S_MX_B_Bias_HA_SAV_UserArgs_MT16x64x64_MI16x16x1_SN_GRVWB4_GSU3_LBSPPA256_LBSPPB256_LPB8_LRVW4_MIWT1_1_NTB0_SU0_SUM0_SUS0_WG16_16_1_WGM1
    SolutionIndex: 674
    SolutionNameMin: Cijk_Ailk_Bljk_S_MX_B_Bias_HA_SAV_UserArgs_MT16x64x64_MI16x16x1_SN_GRVWB1_GSU1_LBSPPA256_LBSPPB256_LPB8_LRVW4_MIWT1_1_NTB0_SU0_SUM0_SUS0_WG16_16_1_WGM1
    SolutionIndex: 675
    SolutionNameMin: Cijk_Ailk_Bljk_S_MX_B_Bias_HA_SAV_UserArgs_MT16x64x64_MI16x16x1_SN_GRVWB1_GSU1_LBSPPA256_LBSPPB256_LPB8_LRVW4_MIWT1_1_NTB4_SU0_SUM0_SUS0_WG16_16_1_WGM1
    SolutionIndex: 676
    SolutionNameMin: Cijk_Ailk_Bljk_S_MX_B_Bias_HA_SAV_UserArgs_MT16x64x64_MI16x16x1_SN_GRVWB4_GSU1_LBSPPA256_LBSPPB256_LPA16_LPB8_LRVW4_MIWT1_1_NTB4_SU0_SUM0_SUS0_SVW1_VWA1_WG16_16_1_WGM1
    SolutionIndex: 677
    SolutionNameMin: Cijk_Ailk_Bljk_S_MX_B_Bias_HA_SAV_UserArgs_MT16x64x64_MI16x16x1_SN_GRVWB1_GSU3_LBSPPA256_LBSPPB256_LPA16_LPB8_LRVW4_MIWT1_1_NTB0_SU0_SUM0_SUS0_SVW1_VWA1_WG16_16_1_WGM1
    SolutionIndex: 678
    SolutionNameMin: Cijk_Ailk_Bljk_S_MX_B_Bias_HA_SAV_UserArgs_MT16x64x128_MI16x16x1_SN_GRVWB4_GSU3_LBSPPA256_LBSPPB512_LPA16_LPB8_LRVW4_MIWT1_1_NTB4_SU0_SUM0_SUS0_SVW1_VWA1_WG16_16_1_WGM1
    SolutionIndex: 679
    SolutionNameMin: Cijk_Ailk_Bljk_S_MX_B_Bias_HA_SAV_UserArgs_MT32x112x64_MI16x16x1_SN_GRVWB4_GSU1_LBSPPA512_LBSPPB256_LPA16_LPB8_LRVW4_MIWT1_7_NTB4_SU0_SUM0_SUS0_SVW1_VWA1_WG32_4_2_WGM1
    SolutionIndex: 680
    SolutionNameMin: Cijk_Ailk_Bljk_S_MX_B_Bias_HA_SAV_UserArgs_MT32x112x64_MI16x16x1_SN_GRVWB4_GSU1_LBSPPA512_LBSPPB256_LPA16_LPB8_LRVW4_MIWT1_7_NTB0_SU0_SUM0_SUS0_SVW1_VWA1_WG32_4_2_WGM1
    SolutionIndex: 681
    SolutionNameMin: Cijk_Ailk_Bljk_S_MX_B_Bias_HA_SAV_UserArgs_MT16x160x64_MI16x16x1_SN_GRVWB4_GSU1_LBSPPA256_LBSPPB256_LPA16_LPB8_LRVW4_MIWT1_5_NTB4_SU0_SUM0_SUS0_SVW1_VWA1_WG16_8_2_WGM1
    SolutionIndex: 682
    SolutionNameMin: Cijk_Ailk_Bljk_S_MX_B_Bias_HA_SAV_UserArgs_MT32x160x64_MI16x16x1_SN_GRVWB4_GSU1_LBSPPA512_LBSPPB256_LPA0_LPB8_LRVW4_MIWT2_5_NTB4_SU0_SUM0_SUS0_SVW2_VWA2_WG16_8_2_WGM1
    SolutionIndex: 683
    SolutionNameMin: Cijk_Ailk_Bljk_S_MX_B_Bias_HA_SAV_UserArgs_MT16x224x64_MI16x16x1_SN_GRVWB1_GSU1_LBSPPA128_LBSPPB256_LPA16_LPB2_LRVW2_MIWT1_14_NTB4_SU0_SUM0_SUS0_SVW1_VWA1_WG16_4_4_WGM1
    SolutionIndex: 684
    SolutionNameMin: Cijk_Ailk_Bljk_S_MX_B_Bias_HA_SAV_UserArgs_MT16x64x64_MI16x16x1_SN_GRVWB1_GSU3_LBSPPA256_LBSPPB256_LPA16_LPB8_LRVW4_MIWT1_1_NTB4_SU0_SUM0_SUS0_SVW1_VWA1_WG16_16_1_WGM1
    SolutionIndex: 685
    SolutionNameMin: Cijk_Ailk_Bljk_S_MX_B_Bias_HA_SAV_UserArgs_MT16x64x128_MI16x16x1_SN_GRVWB4_GSU4_LBSPPA256_LBSPPB512_LPA16_LPB8_LRVW4_MIWT1_1_NTB4_SU0_SUM0_SUS0_SVW1_VWA1_WG16_16_1_WGM1
    SolutionIndex: 686
    SolutionNameMin: Cijk_Ailk_Bljk_S_MX_B_Bias_HA_SAV_UserArgs_MT16x64x64_MI16x16x1_SN_GRVWB1_GSU1_LBSPPA256_LBSPPB256_LPA16_LPB8_LRVW4_MIWT1_1_NTB4_SU0_SUM0_SUS0_SVW1_VWA1_WG16_16_1_WGM1
    SolutionIndex: 687
    SolutionNameMin: Cijk_Ailk_Bljk_S_MX_B_Bias_HA_SAV_UserArgs_MT16x64x128_MI16x16x1_SN_GRVWB4_GSU1_LBSPPA256_LBSPPB512_LPA16_LPB8_LRVW4_MIWT1_1_NTB4_SU0_SUM0_SUS0_SVW1_VWA1_WG16_16_1_WGM1
    SolutionIndex: 688
    SolutionNameMin: Cijk_Ailk_Bljk_S_MX_B_Bias_HA_SAV_UserArgs_MT16x64x128_MI16x16x1_SN_GRVWB4_GSU2_LBSPPA256_LBSPPB512_LPA16_LPB8_LRVW4_MIWT1_1_NTB4_SU0_SUM0_SUS0_SVW1_VWA1_WG16_16_1_WGM1
    SolutionIndex: 689
    SolutionNameMin: Cijk_Ailk_Bljk_S_MX_B_Bias_HA_SAV_UserArgs_MT32x64x64_MI16x16x1_SN_GRVWB4_GSU1_LBSPPA512_LBSPPB256_LPA16_LPB8_LRVW4_MIWT1_2_NTB4_SU0_SUM0_SUS0_SVW1_VWA1_WG32_8_1_WGM1
    SolutionIndex: 690
    SolutionNameMin: Cijk_Ailk_Bljk_S_MX_B_Bias_HA_SAV_UserArgs_MT32x128x64_MI32x32x1_SN_GRVWB4_GSU1_LBSPPA0_LBSPPB256_LPA0_LPB4_LRVW4_MIWT1_1_NTB4_SU0_SUM0_SUS0_SVW1_VWA1_WG32_8_1_WGM1
    SolutionIndex: 691
    SolutionNameMin: Cijk_Ailk_Bljk_S_MX_B_Bias_HA_SAV_UserArgs_MT32x160x64_MI16x16x1_SN_GRVWB4_GSU1_LBSPPA512_LBSPPB256_LPA0_LPB8_LRVW4_MIWT2_5_NTB0_SU0_SUM0_SUS0_SVW2_VWA2_WG16_8_2_WGM1
    SolutionIndex: 692
    SolutionNameMin: Cijk_Ailk_Bljk_S_MX_B_Bias_HA_SAV_UserArgs_MT32x64x32_MI16x16x1_SN_GRVWB4_GSU1_LBSPPA512_LBSPPB128_LPA16_LPB8_LRVW4_MIWT1_2_NTB4_SU0_SUM0_SUS0_SVW1_VWA1_WG32_8_1_WGM1
    SolutionIndex: 693
    SolutionNameMin: Cijk_Ailk_Bljk_S_MX_B_Bias_HA_SAV_UserArgs_MT32x64x64_MI16x16x1_SN_GRVWB4_GSU2_LBSPPA512_LBSPPB256_LPA16_LPB8_LRVW4_MIWT1_2_NTB4_SU0_SUM0_SUS0_SVW1_VWA1_WG32_8_1_WGM1
    SolutionIndex: 694
    SolutionNameMin: Cijk_Ailk_Bljk_S_MX_B_Bias_HA_SAV_UserArgs_MT64x128x64_MI16x16x1_SN_CLR1_GRVWB4_GSU1_LBSPPA1024_LBSPPB256_LPA0_LPB8_LRVW4_MIAV1_MIWT2_8_NTB0_NLCA1_PLR1_SU0_SUM0_SUS0_SVW2_VWA2_WG32_4_2_WGM1
    SolutionIndex: 695
    SolutionNameMin: Cijk_Ailk_Bljk_S_MX_B_Bias_HA_SAV_UserArgs_MT64x128x64_MI16x16x1_SN_CLR1_GRVWB4_GSU1_LBSPPA1024_LBSPPB256_LPA0_LPB8_LRVW4_MIAV1_MIWT2_8_NTB4_NLCA1_PLR1_SU0_SUM0_SUS0_SVW2_VWA2_WG32_4_2_WGM1
    SolutionIndex: 696
    SolutionNameMin: Cijk_Ailk_Bljk_S_MX_B_Bias_HA_SAV_UserArgs_MT96x128x64_MI32x32x1_SN_CLR1_GRVWB4_GSU1_LBSPPA0_LBSPPB256_LPA0_LPB4_LRVW4_MIAV1_MIWT3_1_NTB0_NLCA3_PLR1_SU0_SUM0_SUS0_SVW1_VWA1_WG32_8_1_WGM1
    SolutionIndex: 697
    SolutionNameMin: Cijk_Ailk_Bljk_S_MX_B_Bias_HA_SAV_UserArgs_MT96x128x64_MI16x16x1_SN_CLR1_GRVWB4_GSU1_LBSPPA1536_LBSPPB256_LPA16_LPB8_LRVW4_MIAV1_MIWT3_4_NTB4_NLCA3_PLR1_SU0_SUM0_SUS0_SVW1_VWA1_WG32_8_1_WGM1
    SolutionIndex: 698
    SolutionNameMin: Cijk_Ailk_Bljk_S_MX_B_Bias_HA_SAV_UserArgs_MT96x320x32_MI16x16x1_SN_CLR1_GRVWB4_GSU3_LBSPPA1536_LBSPPB128_LPA16_LPB8_LRVW4_MIAV0_MIWT3_10_NTB4_NLCA3_PLR1_SU0_SUM0_SUS0_SVW1_VWA1_WG32_8_1_WGM1
    SolutionIndex: 699
    SolutionNameMin: Cijk_Ailk_Bljk_S_MX_B_Bias_HA_SAV_UserArgs_MT64x160x64_MI16x16x1_SN_CLR1_GRVWB4_GSU1_LBSPPA1024_LBSPPB256_LPA0_LPB8_LRVW4_MIAV1_MIWT2_5_NTB0_NLCA1_PLR1_SU0_SUM0_SUS0_SVW2_VWA2_WG32_8_1_WGM1
    SolutionIndex: 700
    SolutionNameMin: Cijk_Ailk_Bljk_S_MX_B_Bias_HA_SAV_UserArgs_MT64x160x64_MI16x16x1_SN_CLR1_GRVWB4_GSU1_LBSPPA1024_LBSPPB256_LPA0_LPB8_LRVW4_MIAV1_MIWT2_5_NTB4_NLCA1_PLR1_SU0_SUM0_SUS0_SVW2_VWA2_WG32_8_1_WGM1
    SolutionIndex: 701
    SolutionNameMin: Cijk_Ailk_Bljk_S_MX_B_Bias_HA_SAV_UserArgs_MT96x96x32_MI16x16x1_SN_CLR1_GRVWB4_GSU1_LBSPPA1536_LBSPPB128_LPA16_LPB8_LRVW4_MIAV1_MIWT3_3_NTB4_NLCA3_PLR1_SU0_SUM0_SUS0_SVW1_VWA1_WG32_8_1_WGM1
    SolutionIndex: 702
    SolutionNameMin: Cijk_Ailk_Bljk_S_MX_B_Bias_HA_SAV_UserArgs_MT96x160x32_MI16x16x1_SN_CLR1_GRVWB4_GSU1_LBSPPA1536_LBSPPB128_LPA16_LPB8_LRVW4_MIAV1_MIWT3_5_NTB4_NLCA3_PLR1_SU0_SUM0_SUS0_SVW1_VWA1_WG32_8_1_WGM1
    SolutionIndex: 703
    SolutionNameMin: Cijk_Ailk_Bljk_S_MX_B_Bias_HA_SAV_UserArgs_MT64x256x32_MI32x32x1_SN_CLR1_GRVWB4_GSU1_LBSPPA0_LBSPPB128_LPA0_LPB4_LRVW4_MIAV1_MIWT2_2_NTB0_NLCA1_PLR1_SU0_SUM0_SUS0_SVW2_VWA2_WG32_8_1_WGM1
    SolutionIndex: 704
    SolutionNameMin: Cijk_Ailk_Bljk_S_MX_B_Bias_HA_SAV_UserArgs_MT96x96x32_MI16x16x1_SN_CLR1_GRVWB4_GSU1_LBSPPA1536_LBSPPB128_LPA16_LPB8_LRVW4_MIAV1_MIWT3_3_NTB0_NLCA3_PLR1_SU0_SUM0_SUS0_SVW1_VWA1_WG32_8_1_WGM1
    SolutionIndex: 705
    SolutionNameMin: Cijk_Ailk_Bljk_S_MX_B_Bias_HA_SAV_UserArgs_MT96x224x32_MI16x16x1_SN_CLR1_GRVWB4_GSU1_LBSPPA1536_LBSPPB128_LPA16_LPB8_LRVW4_MIAV1_MIWT3_7_NTB4_NLCA3_PLR1_SU0_SUM0_SUS0_SVW1_VWA1_WG32_8_1_WGM1
    SolutionIndex: 706
    SolutionNameMin: Cijk_Ailk_Bljk_S_MX_B_Bias_HA_SAV_UserArgs_MT64x256x32_MI32x32x1_SN_CLR1_GRVWB4_GSU1_LBSPPA0_LBSPPB128_LPA0_LPB4_LRVW4_MIAV1_MIWT1_4_NTB0_NLCA1_PLR1_SU0_SUM0_SUS0_SVW1_VWA1_WG64_4_1_WGM1
    SolutionIndex: 707
    SolutionNameMin: Cijk_Ailk_Bljk_S_MX_B_Bias_HA_SAV_UserArgs_MT64x128x64_MI32x32x1_SN_CLR1_GRVWB4_GSU1_LBSPPA0_LBSPPB256_LPA0_LPB4_LRVW4_MIAV1_MIWT1_2_NTB4_NLCA1_PLR1_SU0_SUM0_SUS0_SVW1_VWA1_WG64_4_1_WGM1
    SolutionIndex: 708
    SolutionNameMin: Cijk_Ailk_Bljk_S_MX_B_Bias_HA_SAV_UserArgs_MT96x256x32_MI16x16x1_SN_CLR1_GRVWB4_GSU1_LBSPPA1536_LBSPPB128_LPA16_LPB8_LRVW4_MIAV0_MIWT3_8_NTB0_NLCA3_PLR1_SU0_SUM0_SUS0_SVW1_VWA1_WG32_8_1_WGM1
    SolutionIndex: 709
    SolutionNameMin: Cijk_Ailk_Bljk_S_MX_B_Bias_HA_SAV_UserArgs_MT64x320x32_MI16x16x1_SN_CLR1_GRVWB4_GSU1_LBSPPA1024_LBSPPB128_LPA0_LPB8_LRVW4_MIAV1_MIWT2_10_NTB0_NLCA1_PLR1_SU0_SUM0_SUS0_SVW2_VWA2_WG32_8_1_WGM1
    SolutionIndex: 710
    SolutionNameMin: Cijk_Ailk_Bljk_S_MX_B_Bias_HA_SAV_UserArgs_MT96x320x32_MI16x16x1_SN_CLR1_GRVWB4_GSU1_LBSPPA1536_LBSPPB128_LPA0_LPB8_LRVW4_MIAV0_MIWT6_5_NTB0_NLCA3_PLR1_SU0_SUM0_SUS0_SVW2_VWA2_WG16_16_1_WGM1
    SolutionIndex: 711
    SolutionNameMin: Cijk_Ailk_Bljk_S_MX_B_Bias_HA_SAV_UserArgs_MT96x320x32_MI16x16x1_SN_CLR1_GRVWB4_GSU1_LBSPPA1536_LBSPPB128_LPA0_LPB8_LRVW4_MIAV0_MIWT6_5_NTB4_NLCA3_PLR1_SU0_SUM0_SUS0_SVW2_VWA2_WG16_16_1_WGM1
    SolutionIndex: 712
    SolutionNameMin: Cijk_Ailk_Bljk_S_MX_B_Bias_HA_SAV_UserArgs_MT96x320x32_MI16x16x1_SN_CLR1_GRVWB4_GSU1_LBSPPA1536_LBSPPB128_LPA16_LPB8_LRVW4_MIAV0_MIWT3_10_NTB4_NLCA3_PLR1_SU0_SUM0_SUS0_SVW1_VWA1_WG32_8_1_WGM1
    SolutionIndex: 713
    SolutionNameMin: Cijk_Ailk_Bljk_S_MX_B_Bias_HA_SAV_UserArgs_MT64x64x32_MI32x32x1_SN_CLR1_GRVWB4_GSU1_LBSPPA0_LBSPPB128_LPA0_LPB4_LRVW4_MIAV1_MIWT1_1_NTB0_NLCA1_PLR1_SU0_SUM0_SUS0_SVW1_VWA1_WG64_4_1_WGM1
    SolutionIndex: 714
    SolutionNameMin: Cijk_Ailk_Bljk_S_MX_B_Bias_HA_SAV_UserArgs_MT128x112x32_MI16x16x1_SN_GRVWB1_GSU1_LBSPPA2048_LBSPPB128_LPA0_LPB8_LRVW4_MIAV1_MIWT2_7_NTB0_NTC3_NTD3_NLCA1_SU0_SUM0_SUS0_SVW2_VWA2_WG64_4_1_WGM1
    SolutionIndex: 715
    SolutionNameMin: Cijk_Ailk_Bljk_S_MX_B_Bias_HA_SAV_UserArgs_MT128x112x32_MI16x16x1_SN_GRVWB1_GSU1_LBSPPA2048_LBSPPB128_LPA0_LPB8_LRVW4_MIAV1_MIWT2_7_NTB4_NTC3_NTD3_NLCA1_SU0_SUM0_SUS0_SVW2_VWA2_WG64_4_1_WGM1
    SolutionIndex: 716
    SolutionNameMin: Cijk_Ailk_Bljk_S_MX_B_Bias_HA_SAV_UserArgs_MT128x224x32_MI32x32x1_SN_GRVWB4_GSU2_LBSPPA0_LBSPPB128_LPA0_LPB4_LRVW4_MIAV0_MIWT1_7_NTB4_NTC3_NTD3_NLCA1_SU0_SUM0_SUS0_SVW1_VWA1_WG128_2_1_WGM1
    SolutionIndex: 717
    SolutionNameMin: Cijk_Ailk_Bljk_S_MX_B_Bias_HA_SAV_UserArgs_MT192x112x32_MI16x16x1_SN_GRVWB1_GSU1_LBSPPA3072_LBSPPB128_LPA16_LPB8_LRVW4_MIAV1_MIWT3_7_NTB0_NTC3_NTD3_NLCA3_SU0_SUM0_SUS0_SVW1_VWA1_WG64_4_1_WGM1
    SolutionIndex: 718
    SolutionNameMin: Cijk_Ailk_Bljk_S_MX_B_Bias_HA_SAV_UserArgs_MT192x112x32_MI16x16x1_SN_GRVWB1_GSU1_LBSPPA3072_LBSPPB128_LPA16_LPB8_LRVW4_MIAV1_MIWT3_7_NTB4_NTC3_NTD3_NLCA3_SU0_SUM0_SUS0_SVW1_VWA1_WG64_4_1_WGM1
    SolutionIndex: 719
    SolutionNameMin: Cijk_Ailk_Bljk_S_MX_B_Bias_HA_SAV_UserArgs_MT128x160x32_MI16x16x1_SN_GRVWB4_GSU1_LBSPPA2048_LBSPPB128_LPA0_LPB8_LRVW4_MIAV1_MIWT2_10_NTB4_NTC3_NTD3_NLCA1_SU0_SUM0_SUS0_SVW2_VWA2_WG64_4_1_WGM1
    SolutionIndex: 720
    SolutionNameMin: Cijk_Ailk_Bljk_S_MX_B_Bias_HA_SAV_UserArgs_MT128x320x32_MI32x32x1_SN_GRVWB4_GSU2_LBSPPA0_LBSPPB128_LPA0_LPB4_LRVW4_MIAV0_MIWT2_5_NTB4_NTC3_NTD3_NLCA1_SU0_SUM0_SUS0_SVW2_VWA2_WG64_4_1_WGM1
    SolutionIndex: 721
    SolutionNameMin: Cijk_Ailk_Bljk_S_MX_B_Bias_HA_SAV_UserArgs_MT192x160x32_MI16x16x1_SN_GRVWB4_GSU1_LBSPPA3072_LBSPPB128_LPA16_LPB8_LRVW4_MIAV0_MIWT3_10_NTB4_NTC3_NTD3_NLCA3_SU0_SUM0_SUS0_SVW1_VWA1_WG64_4_1_WGM1
    SolutionIndex: 722
    SolutionNameMin: Cijk_Ailk_Bljk_S_MX_B_Bias_HA_SAV_UserArgs_MT128x224x32_MI16x16x1_SN_GRVWB4_GSU1_LBSPPA2048_LBSPPB128_LPA0_LPB8_LRVW4_MIAV0_MIWT2_14_NTB4_NTC3_NTD3_NLCA1_SU0_SUM0_SUS0_SVW2_VWA2_WG64_4_1_WGM1
    SolutionIndex: 723
    SolutionNameMin: Cijk_Ailk_Bljk_S_MX_B_Bias_HA_SAV_UserArgs_MT128x224x32_MI32x32x1_SN_GRVWB4_GSU1_LBSPPA0_LBSPPB128_LPA0_LPB4_LRVW4_MIAV0_MIWT1_7_NTB4_NTC0_NTD0_NLCA1_SU0_SUM0_SUS0_SVW1_VWA1_WG128_2_1_WGM1
    SolutionIndex: 724
    SolutionNameMin: Cijk_Ailk_Bljk_S_MX_B_Bias_HA_SAV_UserArgs_MT192x224x32_MI16x16x1_SN_GRVWB4_GSU1_LBSPPA3072_LBSPPB128_LPA0_LPB8_LRVW4_MIAV0_MIWT6_7_NTB4_NTC3_NTD3_NLCA3_SU0_SUM0_SUS0_SVW2_VWA2_WG32_8_1_WGM1
    SolutionIndex: 725
    SolutionNameMin: Cijk_Ailk_Bljk_S_MX_B_Bias_HA_SAV_UserArgs_MT192x208x32_MI16x16x1_SN_GRVWB1_GSU1_LBSPPA3072_LBSPPB128_LPA16_LPB8_LRVW4_MIAV0_MIWT3_13_NTB4_NTC3_NTD3_NLCA3_SU0_SUM0_SUS0_SVW1_VWA1_WG64_4_1_WGM1
    SolutionIndex: 726
    SolutionNameMin: Cijk_Ailk_Bljk_S_MX_B_Bias_HA_SAV_UserArgs_MT128x256x32_MI32x32x1_SN_GRVWB4_GSU1_LBSPPA0_LBSPPB128_LPA0_LPB4_LRVW4_MIAV0_MIWT2_4_NTB4_NTC3_NTD3_NLCA1_SU0_SUM0_SUS0_SVW2_VWA2_WG64_4_1_WGM1
    SolutionIndex: 727
    SolutionNameMin: Cijk_Ailk_Bljk_S_MX_B_Bias_HA_SAV_UserArgs_MT128x256x32_MI32x32x1_SN_GRVWB4_GSU1_LBSPPA0_LBSPPB128_LPA0_LPB4_LRVW4_MIAV0_MIWT2_4_NTB4_NTC0_NTD0_NLCA1_SU0_SUM0_SUS0_SVW2_VWA2_WG64_4_1_WGM1
    SolutionIndex: 728
    SolutionNameMin: Cijk_Ailk_Bljk_S_MX_B_Bias_HA_SAV_UserArgs_MT192x256x32_MI32x32x1_SN_GRVWB4_GSU1_LBSPPA0_LBSPPB128_LPA0_LPB4_LRVW4_MIAV0_MIWT6_2_NTB4_NTC3_NTD3_NLCA3_SU0_SUM0_SUS0_SVW2_VWA2_WG32_8_1_WGM1
    SolutionIndex: 729
    SolutionNameMin: Cijk_Ailk_Bljk_S_MX_B_Bias_HA_SAV_UserArgs_MT192x256x32_MI32x32x1_SN_GRVWB4_GSU1_LBSPPA0_LBSPPB128_LPA0_LPB4_LRVW4_MIAV0_MIWT3_4_NTB4_NTC3_NTD3_NLCA3_SU0_SUM0_SUS0_SVW1_VWA1_WG64_4_1_WGM1
    SolutionIndex: 730
    SolutionNameMin: Cijk_Ailk_Bljk_S_MX_B_Bias_HA_SAV_UserArgs_MT128x320x32_MI32x32x1_SN_GRVWB4_GSU1_LBSPPA0_LBSPPB128_LPA0_LPB4_LRVW4_MIAV0_MIWT2_5_NTB4_NTC3_NTD3_NLCA1_SU0_SUM0_SUS0_SVW2_VWA2_WG64_4_1_WGM1
    SolutionIndex: 731
    SolutionNameMin: Cijk_Ailk_Bljk_S_MX_B_Bias_HA_SAV_UserArgs_MT128x320x32_MI32x32x1_SN_GRVWB4_GSU1_LBSPPA0_LBSPPB128_LPA0_LPB4_LRVW4_MIAV0_MIWT2_5_NTB4_NTC0_NTD0_NLCA1_SU0_SUM0_SUS0_SVW2_VWA2_WG64_4_1_WGM1
    SolutionIndex: 732
    SolutionNameMin: Cijk_Ailk_Bljk_S_MX_B_Bias_HA_SAV_UserArgs_MT192x320x16_MI16x16x1_SN_GRVWB4_GSU1_LBSPPA1536_LBSPPB128_LPA0_LPB4_LRVW2_MIAV0_MIWT6_10_NTB0_NTC0_NTD0_NLCA3_SU0_SUM0_SUS0_SVW2_VWA2_WG32_8_1_WGM1
    SolutionIndex: 733
    SolutionNameMin: Cijk_Ailk_Bljk_S_MX_B_Bias_HA_SAV_UserArgs_MT192x160x32_MI16x16x1_SN_GRVWB4_GSU1_LBSPPA3072_LBSPPB128_LPA0_LPB8_LRVW4_MIAV0_MIWT6_5_NTB4_NTC0_NTD0_NLCA3_SU0_SUM0_SUS0_SVW2_VWA2_WG32_8_1_WGM1
    SolutionIndex: 734
    SolutionNameMin: Cijk_Ailk_Bljk_S_MX_B_Bias_HA_SAV_UserArgs_MT192x160x32_MI16x16x1_SN_GRVWB4_GSU1_LBSPPA3072_LBSPPB128_LPA16_LPB8_LRVW4_MIAV0_MIWT3_10_NTB4_NTC0_NTD0_NLCA3_SU0_SUM0_SUS0_SVW1_VWA1_WG64_4_1_WGM1
    SolutionIndex: 735
    SolutionNameMin: Cijk_Ailk_Bljk_S_MX_B_Bias_HA_SAV_UserArgs_MT128x224x32_MI16x16x1_SN_GRVWB4_GSU1_LBSPPA2048_LBSPPB128_LPA0_LPB8_LRVW4_MIAV0_MIWT4_7_NTB4_NTC0_NTD0_NLCA1_SU0_SUM0_SUS0_SVW4_VWA4_WG32_8_1_WGM1
    SolutionIndex: 736
    SolutionNameMin: Cijk_Ailk_Bljk_S_MX_B_Bias_HA_SAV_UserArgs_MT128x224x32_MI32x32x1_SN_GRVWB4_GSU1_LBSPPA0_LBSPPB128_LPA0_LPB4_LRVW4_MIAV0_MIWT1_7_NTB4_NTC3_NTD3_NLCA1_SU0_SUM0_SUS0_SVW1_VWA1_WG128_2_1_WGM1
    SolutionIndex: 737
    SolutionNameMin: Cijk_Ailk_Bljk_S_MX_B_Bias_HA_SAV_UserArgs_MT192x224x32_MI16x16x1_SN_GRVWB4_GSU1_LBSPPA3072_LBSPPB128_LPA0_LPB8_LRVW4_MIAV0_MIWT6_7_NTB0_NTC0_NTD0_NLCA3_SU0_SUM0_SUS0_SVW2_VWA2_WG32_8_1_WGM1
    SolutionIndex: 738
    SolutionNameMin: Cijk_Ailk_Bljk_S_MX_B_Bias_HA_SAV_UserArgs_MT192x208x32_MI16x16x1_SN_GRVWB1_GSU1_LBSPPA3072_LBSPPB128_LPA16_LPB8_LRVW4_MIAV0_MIWT3_13_NTB4_NTC0_NTD0_NLCA3_SU0_SUM0_SUS0_SVW1_VWA1_WG64_4_1_WGM1
    SolutionIndex: 739
    SolutionNameMin: Cijk_Ailk_Bljk_S_MX_B_Bias_HA_SAV_UserArgs_MT128x240x32_MI16x16x1_SN_GRVWB1_GSU1_LBSPPA2048_LPA0_LPB8_LRVW4_MIWT2_15_NTB0_NTC3_NTD3_NLCA1_SU0_SUM0_SUS0_SVW2_VWA2_WG64_4_1_WGM1
    SolutionIndex: 740
    SolutionNameMin: Cijk_Ailk_Bljk_S_MX_B_Bias_HA_SAV_UserArgs_MT128x224x32_MI32x32x1_SN_GRVWB4_GSU1_LBSPPA0_LPA0_LPB4_LRVW4_MIWT1_7_NTB0_NTC3_NTD3_NLCA1_SU0_SUM0_SUS0_SVW1_VWA1_WG128_2_1_WGM1
    SolutionIndex: 741
    SolutionNameMin: Cijk_Ailk_Bljk_S_MX_B_Bias_HA_SAV_UserArgs_MT256x224x32_MI32x32x1_SN_GRVWB4_GSU2_LBSPPA0_LPA0_LPB4_LRVW4_MIWT2_7_NTB4_NTC3_NTD3_NLCA1_SU0_SUM0_SUS0_SVW2_VWA2_WG128_2_1_WGM1
    SolutionIndex: 742
    SolutionNameMin: Cijk_Ailk_Bljk_S_MX_B_Bias_HA_SAV_UserArgs_MT128x320x32_MI32x32x1_SN_GRVWB4_GSU1_LBSPPA0_LPA0_LPB4_LRVW4_MIWT2_5_NTB0_NTC3_NTD3_NLCA1_SU0_SUM0_SUS0_SVW2_VWA2_WG64_4_1_WGM1
    SolutionIndex: 743
    SolutionNameMin: Cijk_Ailk_Bljk_S_MX_B_Bias_HA_SAV_UserArgs_MT384x112x16_MI16x16x1_SN_GRVWB1_GSU1_LBSPPA3072_LPA0_LPB2_LRVW2_MIWT6_7_NTB4_NTC3_NTD3_NLCA3_SU0_SUM0_SUS0_SVW2_VWA2_WG64_4_1_WGM1
    SolutionIndex: 744
    SolutionNameMin: Cijk_Ailk_Bljk_S_MX_B_Bias_HA_SAV_UserArgs_MT256x160x32_MI32x32x1_SN_GRVWB4_GSU1_LBSPPA0_LPA0_LPB4_LRVW4_MIWT2_5_NTB4_NTC3_NTD3_NLCA1_SU0_SUM0_SUS0_SVW2_VWA2_WG128_2_1_WGM1
    SolutionIndex: 745
    SolutionNameMin: Cijk_Ailk_Bljk_S_MX_B_Bias_HA_SAV_UserArgs_MT384x160x16_MI16x16x1_SN_GRVWB1_GSU1_LBSPPA3072_LPA0_LPB2_LRVW2_MIWT6_10_NTB4_NTC3_NTD3_NLCA3_SU0_SUM0_SUS0_SVW2_VWA2_WG64_4_1_WGM1
    SolutionIndex: 746
    SolutionNameMin: Cijk_Ailk_Bljk_S_MX_B_Bias_HA_SAV_UserArgs_MT384x160x16_MI32x32x1_SN_GRVWB1_GSU1_LBSPPA0_LPA0_LPB4_LRVW4_MIWT3_5_NTB4_NTC3_NTD3_NLCA3_SU0_SUM0_SUS0_SVW1_VWA1_WG128_2_1_WGM1
    SolutionIndex: 747
    SolutionNameMin: Cijk_Ailk_Bljk_S_MX_B_Bias_HA_SAV_UserArgs_MT256x224x32_MI32x32x1_SN_GRVWB4_GSU1_LBSPPA0_LPA0_LPB4_LRVW4_MIWT2_7_NTB4_NTC0_NTD0_NLCA1_SU0_SUM0_SUS0_SVW2_VWA2_WG128_2_1_WGM1
    SolutionIndex: 748
    SolutionNameMin: Cijk_Ailk_Bljk_S_MX_B_Bias_HA_SAV_UserArgs_MT256x224x32_MI32x32x1_SN_GRVWB4_GSU1_LBSPPA0_LPA0_LPB4_LRVW4_MIWT2_7_NTB4_NTC3_NTD3_NLCA1_SU0_SUM0_SUS0_SVW2_VWA2_WG128_2_1_WGM1
    SolutionIndex: 749
    SolutionNameMin: Cijk_Ailk_Bljk_S_MX_B_Bias_HA_SAV_UserArgs_MT256x256x16_MI32x32x1_SN_GRVWB4_GSU1_LBSPPA0_LPA0_LPB4_LRVW4_MIWT4_4_NTB4_NTC3_NTD3_NLCA1_SU0_SUM0_SUS0_SVW4_VWA4_WG64_4_1_WGM1
    SolutionIndex: 750
    SolutionNameMin: Cijk_Ailk_Bljk_S_MX_B_Bias_HA_SAV_UserArgs_MT256x256x16_MI32x32x1_SN_GRVWB4_GSU1_LBSPPA0_LPA0_LPB4_LRVW4_MIWT2_8_NTB0_NTC3_NTD3_NLCA1_SU0_SUM0_SUS0_SVW2_VWA2_WG128_2_1_WGM1
    SolutionIndex: 751
    SolutionNameMin: Cijk_Ailk_Bljk_S_MX_B_Bias_HA_SAV_UserArgs_MT384x96x16_MI16x16x1_SN_GRVWB1_GSU1_LBSPPA3072_LPA0_LPB2_LRVW2_MIWT6_6_NTB4_NTC0_NTD0_NLCA3_SU0_SUM0_SUS0_SVW2_VWA2_WG64_4_1_WGM1
    SolutionIndex: 752
    SolutionNameMin: Cijk_Ailk_Bljk_S_MX_B_Bias_HA_SAV_UserArgs_MT384x144x16_MI16x16x1_SN_GRVWB1_GSU1_LBSPPA3072_LPA0_LPB2_LRVW2_MIWT6_9_NTB4_NTC0_NTD0_NLCA3_SU0_SUM0_SUS0_SVW2_VWA2_WG64_4_1_WGM1
    SolutionIndex: 753
    SolutionNameMin: Cijk_Ailk_Bljk_S_MX_B_Bias_HA_SAV_UserArgs_MT384x144x16_MI16x16x1_SN_GRVWB1_GSU1_LBSPPA3072_LPA0_LPB2_LRVW2_MIWT6_9_NTB4_NTC3_NTD3_NLCA3_SU0_SUM0_SUS0_SVW2_VWA2_WG64_4_1_WGM1
    SolutionIndex: 754
    SolutionNameMin: Cijk_Ailk_Bljk_S_MX_B_Bias_HA_SAV_UserArgs_MT256x160x32_MI32x32x1_SN_GRVWB4_GSU1_LBSPPA0_LPA0_LPB4_LRVW4_MIWT2_5_NTB4_NTC0_NTD0_NLCA1_SU0_SUM0_SUS0_SVW2_VWA2_WG128_2_1_WGM1
    SolutionIndex: 755
    SolutionNameMin: Cijk_Ailk_Bljk_S_MX_B_Bias_HA_SAV_UserArgs_MT384x160x16_MI16x16x1_SN_GRVWB1_GSU1_LBSPPA3072_LPA0_LPB2_LRVW2_MIWT6_10_NTB0_NTC0_NTD0_NLCA3_SU0_SUM0_SUS0_SVW2_VWA2_WG64_4_1_WGM1
    SolutionIndex: 756
    SolutionNameMin: Cijk_Ailk_Bljk_S_MX_B_Bias_HA_SAV_UserArgs_MT384x160x16_MI32x32x1_SN_GRVWB1_GSU1_LBSPPA0_LPA0_LPB4_LRVW4_MIWT3_5_NTB4_NTC0_NTD0_NLCA3_SU0_SUM0_SUS0_SVW1_VWA1_WG128_2_1_WGM1
    SolutionIndex: 757
    SolutionNameMin: Cijk_Ailk_Bljk_S_MX_B_Bias_HA_SAV_UserArgs_MT256x144x16_MI16x16x1_SN_GRVWB1_GSU1_LBSPPA2048_LPA0_LPB2_LRVW2_MIWT4_9_NTB0_NTC3_NTD3_NLCA1_SU0_SUM0_SUS0_SVW4_VWA4_WG64_4_1_WGM1
    SolutionIndex: 758
    SolutionNameMin: Cijk_Ailk_Bljk_S_MX_B_Bias_HA_SAV_UserArgs_MT256x224x32_MI32x32x1_SN_GRVWB4_GSU1_LBSPPA0_LPA0_LPB4_LRVW4_MIWT2_7_NTB0_NTC3_NTD3_NLCA1_SU0_SUM0_SUS0_SVW2_VWA2_WG128_2_1_WGM1
    SolutionIndex: 759
    SolutionNameMin: Cijk_Ailk_Bljk_S_MX_B_Bias_HA_SAV_UserArgs_MT384x144x16_MI16x16x1_SN_GRVWB1_GSU1_LBSPPA3072_LPA0_LPB2_LRVW2_MIWT6_9_NTB0_NTC0_NTD0_NLCA3_SU0_SUM0_SUS0_SVW2_VWA2_WG64_4_1_WGM1
    SolutionIndex: 760
    SolutionNameMin: Cijk_Ailk_Bljk_S_MX_B_Bias_HA_SAV_UserArgs_MT128x256x16_MI32x32x1_SN_GRVWB4_GSU1_LBSPPA0_LPA0_LPB4_LRVW4_MIWT2_4_NLCA1_SU8_SUM0_SUS256_SVW2_VWA2_WG64_4_1_WGM16
    SolutionIndex: 761
    SolutionNameMin: Cijk_Ailk_Bljk_S_MX_B_Bias_HA_SAV_UserArgs_MT128x256x32_MI32x32x1_SN_GRVWB4_GSU1_LBSPPA0_LPA0_LPB4_LRVW4_MIWT2_4_NLCA1_SU8_SUM0_SUS256_SVW2_VWA2_WG64_4_1_WGM16
    SolutionIndex: 762
    SolutionNameMin: Cijk_Ailk_Bljk_S_MX_B_Bias_HA_SAV_UserArgs_MT128x256x16_MI16x16x1_SN_GRVWB4_GSU1_LBSPPA1024_LPA0_LPB4_LRVW2_MIWT4_8_NLCA1_SU8_SUM0_SUS256_SVW4_VWA4_WG32_8_1_WGM16
    SolutionIndex: 763
    SolutionNameMin: Cijk_Ailk_Bljk_S_MX_B_Bias_HA_SAV_UserArgs_MT320x160x16_MI16x16x1_SN_GRVWB1_GSU1_LBSPPA2560_LPA0_LPB2_LRVW2_MIWT10_5_NLCA5_SU8_SUM0_SUS256_SVW2_VWA2_WG32_8_1_WGM16
    SolutionIndex: 764
    SolutionNameMin: Cijk_Ailk_Bljk_S_MX_B_Bias_HA_SAV_UserArgs_MT256x128x16_MI32x32x1_SN_GRVWB4_GSU1_LBSPPA0_LPA0_LPB4_LRVW4_MIWT2_4_NLCA1_SU8_SUM0_SUS256_SVW2_VWA2_WG128_2_1_WGM16
    SolutionIndex: 765
    SolutionNameMin: Cijk_Ailk_Bljk_S_MX_B_Bias_HA_SAV_UserArgs_MT256x144x16_MI16x16x1_SN_GRVWB1_GSU1_LBSPPA2048_LPA0_LPB2_LRVW2_MIWT4_9_NLCA1_SU8_SUM0_SUS256_SVW4_VWA4_WG64_4_1_WGM16
    SolutionIndex: 766
    SolutionNameMin: Cijk_Ailk_Bljk_S_MX_B_Bias_HA_SAV_UserArgs_MT256x128x32_MI32x32x1_SN_GRVWB4_GSU1_LBSPPA0_LPA0_LPB4_LRVW4_MIWT2_4_NLCA1_SU8_SUM0_SUS256_SVW2_VWA2_WG128_2_1_WGM16
    SolutionIndex: 767
    SolutionNameMin: Cijk_Ailk_Bljk_S_MX_B_Bias_HA_SAV_UserArgs_MT256x192x32_MI32x32x1_SN_GRVWB4_GSU1_LBSPPA0_LPA0_LPB4_LRVW4_MIWT2_6_NLCA1_SU8_SUM0_SUS256_SVW2_VWA2_WG128_2_1_WGM16
    SolutionIndex: 768
    SolutionNameMin: Cijk_Ailk_Bljk_S_MX_B_Bias_HA_SAV_UserArgs_MT256x144x16_MI16x16x1_SN_GRVWB1_GSU1_LBSPPA2048_LPA0_LPB2_LRVW2_MIAV0_MIWT4_9_NLCA1_SU8_SUM0_SUS256_SVW4_VWA4_WG64_4_1_WGM16
    SolutionIndex: 769
    SolutionNameMin: Cijk_Ailk_Bljk_S_MX_B_Bias_HA_SAV_UserArgs_MT256x224x32_MI32x32x1_SN_GRVWB4_GSU1_LBSPPA0_LPA0_LPB4_LRVW4_MIAV0_MIWT2_7_NLCA1_SU8_SUM0_SUS256_SVW2_VWA2_WG128_2_1_WGM16
    SolutionIndex: 770
    SolutionNameMin: Cijk_Ailk_Bljk_S_MX_B_Bias_HA_SAV_UserArgs_MT192x192x16_MI32x32x1_SN_GRVWB4_GSU1_LBSPPA0_LPA0_LPB4_LRVW4_MIAV0_MIWT3_3_NLCA3_SU8_SUM0_SUS256_SVW1_VWA1_WG64_4_1_WGM16
    SolutionIndex: 771
    SolutionNameMin: Cijk_Ailk_Bljk_S_MX_B_Bias_HA_SAV_UserArgs_MT192x192x16_MI16x16x1_SN_GRVWB4_GSU1_LBSPPA1536_LPA0_LPB4_LRVW2_MIWT6_6_NLCA3_SU8_SUM0_SUS256_SVW2_VWA2_WG32_8_1_WGM16
- - - [3, 16, 1, 1024]
    - [0, 13.9903]
  - - [3, 16, 1, 4096]
    - [1, 50.6442]
  - - [3, 16, 1, 16384]
    - [2, 165.072]
  - - [16, 16, 1, 1024]
    - [3, 79.1108]
  - - [16, 16, 1, 4096]
    - [4, 269.963]
  - - [16, 16, 1, 16384]
    - [4, 846.204]
  - - [32, 16, 1, 1024]
    - [3, 155.235]
  - - [32, 16, 1, 4096]
    - [5, 515.96]
  - - [32, 16, 1, 16384]
    - [4, 1622.46]
  - - [64, 16, 1, 1024]
    - [3, 288.072]
  - - [64, 16, 1, 4096]
    - [6, 968.221]
  - - [64, 16, 1, 16384]
    - [7, 3055.38]
  - - [96, 16, 1, 1024]
    - [3, 453.853]
  - - [96, 16, 1, 4096]
    - [8, 1432.44]
  - - [96, 16, 1, 16384]
    - [7, 4175.18]
  - - [128, 16, 1, 1024]
    - [9, 544.705]
  - - [128, 16, 1, 4096]
    - [10, 1835.21]
  - - [128, 16, 1, 16384]
    - [11, 4661.52]
  - - [192, 16, 1, 1024]
    - [9, 757.722]
  - - [192, 16, 1, 4096]
    - [12, 2597.23]
  - - [192, 16, 1, 16384]
    - [13, 6796.57]
  - - [256, 16, 1, 1024]
    - [14, 988.344]
  - - [256, 16, 1, 4096]
    - [14, 3338.37]
  - - [256, 16, 1, 16384]
    - [15, 7816.3]
  - - [384, 16, 1, 1024]
    - [16, 1426.06]
  - - [384, 16, 1, 4096]
    - [17, 4242.63]
  - - [384, 16, 1, 16384]
    - [18, 10288.8]
  - - [512, 16, 1, 1024]
    - [19, 1899.53]
  - - [512, 16, 1, 4096]
    - [20, 5201.87]
  - - [512, 16, 1, 16384]
    - [21, 12167.3]
  - - [640, 16, 1, 1024]
    - [19, 2376.56]
  - - [640, 16, 1, 4096]
    - [20, 6355.4]
  - - [640, 16, 1, 16384]
    - [20, 13815.7]
  - - [768, 16, 1, 1024]
    - [22, 2697.45]
  - - [768, 16, 1, 4096]
    - [23, 7209.1]
  - - [768, 16, 1, 16384]
    - [24, 15028.4]
  - - [1024, 16, 1, 1024]
    - [25, 3486.34]
  - - [1024, 16, 1, 4096]
    - [26, 8357.17]
  - - [1024, 16, 1, 16384]
    - [27, 15708.5]
  - - [1536, 16, 1, 1024]
    - [22, 4251.25]
  - - [1536, 16, 1, 4096]
    - [28, 11220.4]
  - - [1536, 16, 1, 16384]
    - [29, 18840.2]
  - - [2048, 16, 1, 1024]
    - [30, 6556.42]
  - - [2048, 16, 1, 4096]
    - [31, 12206.8]
  - - [2048, 16, 1, 16384]
    - [32, 19417.0]
  - - [3072, 16, 1, 1024]
    - [33, 7526.4]
  - - [3072, 16, 1, 4096]
    - [34, 14980.9]
  - - [3072, 16, 1, 16384]
    - [35, 21418.6]
  - - [4096, 16, 1, 1024]
    - [36, 10303.9]
  - - [4096, 16, 1, 4096]
    - [37, 16211.7]
  - - [4096, 16, 1, 16384]
    - [38, 21355.4]
  - - [6144, 16, 1, 1024]
    - [39, 10911.8]
  - - [6144, 16, 1, 4096]
    - [40, 18258.6]
  - - [6144, 16, 1, 16384]
    - [40, 23152.3]
  - - [8192, 16, 1, 1024]
    - [41, 12978.2]
  - - [8192, 16, 1, 4096]
    - [42, 20383.4]
  - - [8192, 16, 1, 16384]
    - [42, 23690.2]
  - - [12288, 16, 1, 1024]
    - [43, 15014.5]
  - - [12288, 16, 1, 4096]
    - [44, 21419.7]
  - - [12288, 16, 1, 16384]
    - [45, 23677.3]
  - - [16384, 16, 1, 1024]
    - [46, 16067.8]
  - - [16384, 16, 1, 4096]
    - [46, 22310.7]
  - - [16384, 16, 1, 16384]
    - [47, 24171.8]
  - - [20480, 16, 1, 1024]
    - [48, 18448.8]
  - - [20480, 16, 1, 4096]
    - [49, 22620.5]
  - - [20480, 16, 1, 16384]
    - [50, 23597.3]
  - - [24576, 16, 1, 1024]
    - [51, 20000.4]
  - - [24576, 16, 1, 4096]
    - [52, 23369.1]
  - - [24576, 16, 1, 16384]
    - [53, 23582.2]
  - - [32768, 16, 1, 1024]
    - [54, 20046.2]
  - - [32768, 16, 1, 4096]
    - [55, 23077.3]
  - - [32768, 16, 1, 16384]
    - [56, 23968.9]
  - - [3, 32, 1, 1024]
    - [57, 28.4449]
  - - [3, 32, 1, 4096]
    - [58, 101.92]
  - - [3, 32, 1, 16384]
    - [59, 311.235]
  - - [16, 32, 1, 1024]
    - [60, 155.994]
  - - [16, 32, 1, 4096]
    - [61, 516.113]
  - - [16, 32, 1, 16384]
    - [62, 1614.57]
  - - [32, 32, 1, 1024]
    - [60, 307.514]
  - - [32, 32, 1, 4096]
    - [63, 997.39]
  - - [32, 32, 1, 16384]
    - [62, 3126.83]
  - - [64, 32, 1, 1024]
    - [64, 552.705]
  - - [64, 32, 1, 4096]
    - [64, 1865.65]
  - - [64, 32, 1, 16384]
    - [65, 5081.85]
  - - [96, 32, 1, 1024]
    - [66, 766.832]
  - - [96, 32, 1, 4096]
    - [67, 2630.97]
  - - [96, 32, 1, 16384]
    - [68, 7079.42]
  - - [128, 32, 1, 1024]
    - [69, 1016.09]
  - - [128, 32, 1, 4096]
    - [70, 3449.84]
  - - [128, 32, 1, 16384]
    - [71, 8070.68]
  - - [192, 32, 1, 1024]
    - [72, 1702.37]
  - - [192, 32, 1, 4096]
    - [73, 4888.61]
  - - [192, 32, 1, 16384]
    - [74, 11996.7]
  - - [256, 32, 1, 1024]
    - [75, 1927.7]
  - - [256, 32, 1, 4096]
    - [76, 5972.09]
  - - [256, 32, 1, 16384]
    - [77, 14259.6]
  - - [384, 32, 1, 1024]
    - [78, 2778.16]
  - - [384, 32, 1, 4096]
    - [79, 7614.0]
  - - [384, 32, 1, 16384]
    - [80, 20105.6]
  - - [512, 32, 1, 1024]
    - [81, 3490.7]
  - - [512, 32, 1, 4096]
    - [82, 9677.72]
  - - [512, 32, 1, 16384]
    - [83, 23286.9]
  - - [640, 32, 1, 1024]
    - [84, 4386.79]
  - - [640, 32, 1, 4096]
    - [82, 11615.6]
  - - [640, 32, 1, 16384]
    - [82, 27050.1]
  - - [768, 32, 1, 1024]
    - [84, 5241.73]
  - - [768, 32, 1, 4096]
    - [85, 13815.3]
  - - [768, 32, 1, 16384]
    - [85, 28024.6]
  - - [1024, 32, 1, 1024]
    - [84, 6533.37]
  - - [1024, 32, 1, 4096]
    - [86, 16033.2]
  - - [1024, 32, 1, 16384]
    - [87, 29731.1]
  - - [1536, 32, 1, 1024]
    - [88, 8803.63]
  - - [1536, 32, 1, 4096]
    - [89, 20215.7]
  - - [1536, 32, 1, 16384]
    - [90, 35724.9]
  - - [2048, 32, 1, 1024]
    - [91, 10795.6]
  - - [2048, 32, 1, 4096]
    - [92, 22937.4]
  - - [2048, 32, 1, 16384]
    - [93, 36803.3]
  - - [3072, 32, 1, 1024]
    - [94, 13894.7]
  - - [3072, 32, 1, 4096]
    - [95, 26968.8]
  - - [3072, 32, 1, 16384]
    - [95, 41483.5]
  - - [4096, 32, 1, 1024]
    - [96, 18298.5]
  - - [4096, 32, 1, 4096]
    - [97, 30068.2]
  - - [4096, 32, 1, 16384]
    - [97, 41808.9]
  - - [6144, 32, 1, 1024]
    - [98, 19247.1]
  - - [6144, 32, 1, 4096]
    - [99, 34850.9]
  - - [6144, 32, 1, 16384]
    - [100, 44760.6]
  - - [8192, 32, 1, 1024]
    - [101, 25251.6]
  - - [8192, 32, 1, 4096]
    - [102, 35907.7]
  - - [8192, 32, 1, 16384]
    - [103, 42732.9]
  - - [12288, 32, 1, 1024]
    - [104, 26856.9]
  - - [12288, 32, 1, 4096]
    - [105, 39277.1]
  - - [12288, 32, 1, 16384]
    - [105, 43900.3]
  - - [16384, 32, 1, 1024]
    - [106, 30437.3]
  - - [16384, 32, 1, 4096]
    - [102, 37679.6]
  - - [16384, 32, 1, 16384]
    - [107, 42896.3]
  - - [20480, 32, 1, 1024]
    - [106, 37396.3]
  - - [20480, 32, 1, 4096]
    - [106, 43013.2]
  - - [20480, 32, 1, 16384]
    - [108, 41147.3]
  - - [24576, 32, 1, 1024]
    - [109, 35830.0]
  - - [24576, 32, 1, 4096]
    - [109, 40991.4]
  - - [24576, 32, 1, 16384]
    - [105, 42302.8]
  - - [32768, 32, 1, 256]
    - [110, 22270.0]
  - - [32768, 32, 1, 1024]
    - [110, 34180.0]
  - - [32768, 32, 1, 4096]
    - [110, 38436.7]
  - - [3, 64, 1, 1024]
    - [111, 55.1805]
  - - [3, 64, 1, 4096]
    - [112, 193.105]
  - - [3, 64, 1, 16384]
    - [113, 582.151]
  - - [16, 64, 1, 1024]
    - [60, 303.658]
  - - [16, 64, 1, 4096]
    - [114, 983.42]
  - - [16, 64, 1, 16384]
    - [115, 2919.18]
  - - [32, 64, 1, 1024]
    - [60, 597.057]
  - - [32, 64, 1, 4096]
    - [64, 1888.89]
  - - [32, 64, 1, 16384]
    - [116, 5307.1]
  - - [64, 64, 1, 1024]
    - [72, 1151.53]
  - - [64, 64, 1, 4096]
    - [69, 3479.09]
  - - [64, 64, 1, 16384]
    - [117, 8903.51]
  - - [96, 64, 1, 1024]
    - [72, 1783.64]
  - - [96, 64, 1, 4096]
    - [73, 4843.34]
  - - [96, 64, 1, 16384]
    - [118, 11795.5]
  - - [128, 64, 1, 1024]
    - [75, 1933.93]
  - - [128, 64, 1, 4096]
    - [119, 5935.66]
  - - [128, 64, 1, 16384]
    - [120, 13891.0]
  - - [192, 64, 1, 1024]
    - [72, 3405.84]
  - - [192, 64, 1, 4096]
    - [121, 8185.41]
  - - [192, 64, 1, 16384]
    - [122, 20669.2]
  - - [256, 64, 1, 1024]
    - [123, 3656.0]
  - - [256, 64, 1, 4096]
    - [124, 9884.02]
  - - [256, 64, 1, 16384]
    - [125, 22748.8]
  - - [384, 64, 1, 1024]
    - [123, 5451.14]
  - - [384, 64, 1, 4096]
    - [126, 14111.9]
  - - [384, 64, 1, 16384]
    - [127, 29436.6]
  - - [512, 64, 1, 1024]
    - [128, 6595.14]
  - - [512, 64, 1, 4096]
    - [129, 16920.5]
  - - [512, 64, 1, 16384]
    - [129, 32620.9]
  - - [640, 64, 1, 1024]
    - [128, 8436.7]
  - - [640, 64, 1, 4096]
    - [130, 20457.8]
  - - [640, 64, 1, 16384]
    - [131, 39496.4]
  - - [768, 64, 1, 1024]
    - [132, 9034.82]
  - - [768, 64, 1, 4096]
    - [133, 21966.7]
  - - [768, 64, 1, 16384]
    - [134, 42596.3]
  - - [1024, 64, 1, 1024]
    - [135, 10933.2]
  - - [1024, 64, 1, 4096]
    - [136, 25390.3]
  - - [1024, 64, 1, 16384]
    - [137, 50737.5]
  - - [1536, 64, 1, 1024]
    - [138, 14331.0]
  - - [1536, 64, 1, 4096]
    - [139, 31832.4]
  - - [1536, 64, 1, 16384]
    - [140, 57442.8]
  - - [2048, 64, 1, 1024]
    - [141, 18697.1]
  - - [2048, 64, 1, 4096]
    - [142, 34813.0]
  - - [2048, 64, 1, 16384]
    - [143, 60400.8]
  - - [3072, 64, 1, 1024]
    - [144, 21668.1]
  - - [3072, 64, 1, 4096]
    - [145, 43126.8]
  - - [3072, 64, 1, 16384]
    - [145, 67116.5]
  - - [4096, 64, 1, 1024]
    - [146, 27502.2]
  - - [4096, 64, 1, 4096]
    - [147, 47824.5]
  - - [4096, 64, 1, 16384]
    - [148, 66866.6]
  - - [6144, 64, 1, 1024]
    - [149, 29374.6]
  - - [6144, 64, 1, 4096]
    - [150, 55402.9]
  - - [6144, 64, 1, 16384]
    - [151, 71687.3]
  - - [8192, 64, 1, 1024]
    - [152, 37488.4]
  - - [8192, 64, 1, 4096]
    - [153, 55534.9]
  - - [8192, 64, 1, 16384]
    - [153, 65549.2]
  - - [12288, 64, 1, 1024]
    - [154, 41820.2]
  - - [12288, 64, 1, 4096]
    - [155, 60573.9]
  - - [12288, 64, 1, 16384]
    - [150, 71319.7]
  - - [16384, 64, 1, 256]
    - [156, 29009.7]
  - - [16384, 64, 1, 1024]
    - [157, 47747.7]
  - - [16384, 64, 1, 4096]
    - [158, 59991.5]
  - - [20480, 64, 1, 256]
    - [156, 35358.4]
  - - [20480, 64, 1, 1024]
    - [157, 58866.1]
  - - [20480, 64, 1, 4096]
    - [157, 70738.9]
  - - [24576, 64, 1, 256]
    - [159, 34370.7]
  - - [24576, 64, 1, 1024]
    - [160, 53442.3]
  - - [24576, 64, 1, 4096]
    - [161, 65385.1]
  - - [32768, 64, 1, 256]
    - [162, 35444.3]
  - - [32768, 64, 1, 1024]
    - [163, 55894.4]
  - - [32768, 64, 1, 4096]
    - [163, 66590.2]
  - - [3, 96, 1, 1024]
    - [164, 78.9592]
  - - [3, 96, 1, 4096]
    - [165, 274.702]
  - - [3, 96, 1, 16384]
    - [166, 791.48]
  - - [16, 96, 1, 1024]
    - [167, 419.18]
  - - [16, 96, 1, 4096]
    - [114, 1451.26]
  - - [16, 96, 1, 16384]
    - [168, 4255.28]
  - - [32, 96, 1, 1024]
    - [169, 774.476]
  - - [32, 96, 1, 4096]
    - [170, 2652.76]
  - - [32, 96, 1, 16384]
    - [171, 7241.96]
  - - [64, 96, 1, 1024]
    - [72, 1727.29]
  - - [64, 96, 1, 4096]
    - [73, 4965.96]
  - - [64, 96, 1, 16384]
    - [172, 12108.3]
  - - [96, 96, 1, 1024]
    - [72, 2658.83]
  - - [96, 96, 1, 4096]
    - [173, 6553.98]
  - - [96, 96, 1, 16384]
    - [174, 15600.1]
  - - [128, 96, 1, 1024]
    - [175, 2799.97]
  - - [128, 96, 1, 4096]
    - [176, 8350.36]
  - - [128, 96, 1, 16384]
    - [177, 19784.0]
  - - [192, 96, 1, 1024]
    - [178, 4529.71]
  - - [192, 96, 1, 4096]
    - [179, 11609.0]
  - - [192, 96, 1, 16384]
    - [180, 24978.0]
  - - [256, 96, 1, 1024]
    - [123, 5468.22]
  - - [256, 96, 1, 4096]
    - [181, 13205.6]
  - - [256, 96, 1, 16384]
    - [182, 27372.2]
  - - [384, 96, 1, 1024]
    - [123, 8242.53]
  - - [384, 96, 1, 4096]
    - [183, 17158.8]
  - - [384, 96, 1, 16384]
    - [184, 37778.0]
  - - [512, 96, 1, 1024]
    - [185, 8256.44]
  - - [512, 96, 1, 4096]
    - [186, 20334.4]
  - - [512, 96, 1, 16384]
    - [187, 38601.5]
  - - [640, 96, 1, 1024]
    - [135, 10354.6]
  - - [640, 96, 1, 4096]
    - [186, 26307.6]
  - - [640, 96, 1, 16384]
    - [188, 46921.8]
  - - [768, 96, 1, 1024]
    - [135, 12429.6]
  - - [768, 96, 1, 4096]
    - [188, 28456.2]
  - - [768, 96, 1, 16384]
    - [188, 55888.5]
  - - [1024, 96, 1, 1024]
    - [141, 14302.4]
  - - [1024, 96, 1, 4096]
    - [189, 31817.3]
  - - [1024, 96, 1, 16384]
    - [190, 64492.9]
  - - [1536, 96, 1, 1024]
    - [141, 20940.7]
  - - [1536, 96, 1, 4096]
    - [191, 42115.6]
  - - [1536, 96, 1, 16384]
    - [192, 74343.2]
  - - [2048, 96, 1, 1024]
    - [193, 22253.8]
  - - [2048, 96, 1, 4096]
    - [194, 45943.1]
  - - [2048, 96, 1, 16384]
    - [194, 79037.1]
  - - [3072, 96, 1, 1024]
    - [195, 28976.2]
  - - [3072, 96, 1, 4096]
    - [196, 55288.5]
  - - [3072, 96, 1, 16384]
    - [197, 85373.8]
  - - [4096, 96, 1, 1024]
    - [198, 32428.6]
  - - [4096, 96, 1, 4096]
    - [199, 61332.3]
  - - [4096, 96, 1, 16384]
    - [200, 88061.6]
  - - [6144, 96, 1, 1024]
    - [201, 36348.7]
  - - [6144, 96, 1, 4096]
    - [202, 70465.9]
  - - [6144, 96, 1, 16384]
    - [203, 94403.5]
  - - [8192, 96, 1, 1024]
    - [204, 43345.4]
  - - [8192, 96, 1, 4096]
    - [205, 68694.6]
  - - [8192, 96, 1, 16384]
    - [205, 83625.5]
  - - [12288, 96, 1, 256]
    - [206, 30495.4]
  - - [12288, 96, 1, 1024]
    - [207, 52747.7]
  - - [12288, 96, 1, 4096]
    - [208, 75070.3]
  - - [16384, 96, 1, 256]
    - [209, 36720.7]
  - - [16384, 96, 1, 1024]
    - [210, 62283.0]
  - - [16384, 96, 1, 4096]
    - [210, 76001.8]
  - - [20480, 96, 1, 256]
    - [209, 45142.1]
  - - [20480, 96, 1, 1024]
    - [210, 76280.9]
  - - [20480, 96, 1, 4096]
    - [210, 92223.7]
  - - [24576, 96, 1, 256]
    - [211, 40065.8]
  - - [24576, 96, 1, 1024]
    - [212, 66887.4]
  - - [24576, 96, 1, 4096]
    - [212, 82659.7]
  - - [32768, 96, 1, 256]
    - [210, 38716.8]
  - - [32768, 96, 1, 1024]
    - [213, 64219.6]
  - - [32768, 96, 1, 4096]
    - [213, 76740.3]
  - - [3, 128, 1, 1024]
    - [214, 104.605]
  - - [3, 128, 1, 4096]
    - [215, 365.382]
  - - [3, 128, 1, 16384]
    - [216, 978.148]
  - - [16, 128, 1, 1024]
    - [60, 615.752]
  - - [16, 128, 1, 4096]
    - [217, 1882.43]
  - - [16, 128, 1, 16384]
    - [218, 5028.42]
  - - [32, 128, 1, 1024]
    - [60, 1206.79]
  - - [32, 128, 1, 4096]
    - [219, 3528.37]
  - - [32, 128, 1, 16384]
    - [220, 9163.3]
  - - [64, 128, 1, 1024]
    - [72, 2303.56]
  - - [64, 128, 1, 4096]
    - [76, 6084.54]
  - - [64, 128, 1, 16384]
    - [221, 14684.9]
  - - [96, 128, 1, 1024]
    - [72, 3529.16]
  - - [96, 128, 1, 4096]
    - [222, 8227.24]
  - - [96, 128, 1, 16384]
    - [223, 18414.3]
  - - [128, 128, 1, 1024]
    - [175, 3731.96]
  - - [128, 128, 1, 4096]
    - [224, 10038.1]
  - - [128, 128, 1, 16384]
    - [225, 22717.2]
  - - [192, 128, 1, 1024]
    - [175, 5798.58]
  - - [192, 128, 1, 4096]
    - [226, 13072.3]
  - - [192, 128, 1, 16384]
    - [227, 28292.2]
  - - [256, 128, 1, 1024]
    - [228, 6913.95]
  - - [256, 128, 1, 4096]
    - [229, 16680.2]
  - - [256, 128, 1, 16384]
    - [230, 35500.8]
  - - [384, 128, 1, 1024]
    - [231, 9100.33]
  - - [384, 128, 1, 4096]
    - [232, 21795.0]
  - - [384, 128, 1, 16384]
    - [233, 43789.6]
  - - [512, 128, 1, 1024]
    - [234, 11122.0]
  - - [512, 128, 1, 4096]
    - [235, 25011.0]
  - - [512, 128, 1, 16384]
    - [236, 44099.7]
  - - [640, 128, 1, 1024]
    - [234, 13856.4]
  - - [640, 128, 1, 4096]
    - [237, 31363.4]
  - - [640, 128, 1, 16384]
    - [238, 53930.3]
  - - [768, 128, 1, 1024]
    - [239, 14467.3]
  - - [768, 128, 1, 4096]
    - [240, 33327.1]
  - - [768, 128, 1, 16384]
    - [238, 63776.2]
  - - [1024, 128, 1, 1024]
    - [141, 18913.6]
  - - [1024, 128, 1, 4096]
    - [241, 37710.2]
  - - [1024, 128, 1, 16384]
    - [241, 73259.3]
  - - [1536, 128, 1, 1024]
    - [193, 22005.2]
  - - [1536, 128, 1, 4096]
    - [242, 47881.5]
  - - [1536, 128, 1, 16384]
    - [243, 80538.5]
  - - [2048, 128, 1, 1024]
    - [244, 27684.2]
  - - [2048, 128, 1, 4096]
    - [245, 51682.2]
  - - [2048, 128, 1, 16384]
    - [246, 86267.4]
  - - [3072, 128, 1, 1024]
    - [247, 31587.3]
  - - [3072, 128, 1, 4096]
    - [247, 62706.0]
  - - [3072, 128, 1, 16384]
    - [248, 89255.2]
  - - [4096, 128, 1, 1024]
    - [152, 37999.1]
  - - [4096, 128, 1, 4096]
    - [249, 69644.4]
  - - [4096, 128, 1, 16384]
    - [249, 95597.8]
  - - [6144, 128, 1, 1024]
    - [159, 42983.8]
  - - [6144, 128, 1, 4096]
    - [250, 73975.8]
  - - [6144, 128, 1, 16384]
    - [251, 96609.4]
  - - [8192, 128, 1, 256]
    - [252, 32306.2]
  - - [8192, 128, 1, 1024]
    - [253, 51832.3]
  - - [8192, 128, 1, 4096]
    - [254, 77868.0]
  - - [12288, 128, 1, 256]
    - [255, 35868.4]
  - - [12288, 128, 1, 1024]
    - [256, 62593.6]
  - - [12288, 128, 1, 4096]
    - [257, 82990.5]
  - - [16384, 128, 1, 256]
    - [258, 42396.3]
  - - [16384, 128, 1, 1024]
    - [258, 69735.0]
  - - [16384, 128, 1, 4096]
    - [259, 83461.5]
  - - [20480, 128, 1, 256]
    - [258, 52291.7]
  - - [20480, 128, 1, 1024]
    - [258, 86070.7]
  - - [20480, 128, 1, 4096]
    - [258, 99963.6]
  - - [24576, 128, 1, 256]
    - [260, 44905.8]
  - - [24576, 128, 1, 1024]
    - [261, 75282.5]
  - - [24576, 128, 1, 4096]
    - [262, 92258.0]
  - - [32768, 128, 1, 256]
    - [263, 43033.3]
  - - [32768, 128, 1, 1024]
    - [264, 73259.2]
  - - [32768, 128, 1, 4096]
    - [264, 89887.7]
  - - [3, 192, 1, 1024]
    - [265, 153.598]
  - - [3, 192, 1, 4096]
    - [266, 512.2]
  - - [3, 192, 1, 16384]
    - [267, 1388.3]
  - - [16, 192, 1, 1024]
    - [60, 898.251]
  - - [16, 192, 1, 4096]
    - [268, 2619.55]
  - - [16, 192, 1, 16384]
    - [269, 7209.53]
  - - [32, 192, 1, 1024]
    - [60, 1807.68]
  - - [32, 192, 1, 4096]
    - [270, 4999.97]
  - - [32, 192, 1, 16384]
    - [271, 12003.6]
  - - [64, 192, 1, 1024]
    - [272, 3077.85]
  - - [64, 192, 1, 4096]
    - [273, 7991.05]
  - - [64, 192, 1, 16384]
    - [274, 19994.3]
  - - [96, 192, 1, 1024]
    - [275, 4741.87]
  - - [96, 192, 1, 4096]
    - [276, 11271.3]
  - - [96, 192, 1, 16384]
    - [277, 24967.2]
  - - [128, 192, 1, 1024]
    - [228, 5512.4]
  - - [128, 192, 1, 4096]
    - [278, 12935.5]
  - - [128, 192, 1, 16384]
    - [279, 29294.0]
  - - [192, 192, 1, 1024]
    - [228, 8643.59]
  - - [192, 192, 1, 4096]
    - [280, 17890.8]
  - - [192, 192, 1, 16384]
    - [281, 34976.5]
  - - [256, 192, 1, 1024]
    - [282, 8322.17]
  - - [256, 192, 1, 4096]
    - [283, 20988.9]
  - - [256, 192, 1, 16384]
    - [284, 42198.1]
  - - [384, 192, 1, 1024]
    - [285, 12508.1]
  - - [384, 192, 1, 4096]
    - [286, 29263.2]
  - - [384, 192, 1, 16384]
    - [287, 50090.6]
  - - [512, 192, 1, 1024]
    - [141, 14467.3]
  - - [512, 192, 1, 4096]
    - [288, 32486.3]
  - - [512, 192, 1, 16384]
    - [289, 62365.2]
  - - [640, 192, 1, 1024]
    - [290, 17893.3]
  - - [640, 192, 1, 4096]
    - [291, 39115.0]
  - - [640, 192, 1, 16384]
    - [292, 61937.4]
  - - [768, 192, 1, 1024]
    - [141, 21320.0]
  - - [768, 192, 1, 4096]
    - [293, 42621.9]
  - - [768, 192, 1, 16384]
    - [294, 70461.8]
  - - [1024, 192, 1, 1024]
    - [193, 22422.8]
  - - [1024, 192, 1, 4096]
    - [194, 49947.2]
  - - [1024, 192, 1, 16384]
    - [194, 78874.3]
  - - [1536, 192, 1, 1024]
    - [244, 30908.5]
  - - [1536, 192, 1, 4096]
    - [196, 56148.8]
  - - [1536, 192, 1, 16384]
    - [197, 87035.3]
  - - [2048, 192, 1, 1024]
    - [295, 32570.7]
  - - [2048, 192, 1, 4096]
    - [296, 64993.7]
  - - [2048, 192, 1, 16384]
    - [297, 90040.3]
  - - [3072, 192, 1, 1024]
    - [298, 43615.4]
  - - [3072, 192, 1, 4096]
    - [299, 71240.6]
  - - [3072, 192, 1, 16384]
    - [299, 95609.3]
  - - [4096, 192, 1, 1024]
    - [204, 43637.4]
  - - [4096, 192, 1, 4096]
    - [300, 75159.2]
  - - [4096, 192, 1, 16384]
    - [300, 98549.9]
  - - [6144, 192, 1, 256]
    - [301, 32621.8]
  - - [6144, 192, 1, 1024]
    - [301, 54473.7]
  - - [6144, 192, 1, 4096]
    - [302, 78656.8]
  - - [8192, 192, 1, 256]
    - [303, 39485.7]
  - - [8192, 192, 1, 1024]
    - [304, 64153.0]
  - - [8192, 192, 1, 4096]
    - [305, 84754.6]
  - - [12288, 192, 1, 256]
    - [306, 40992.5]
  - - [12288, 192, 1, 1024]
    - [306, 68472.2]
  - - [12288, 192, 1, 4096]
    - [307, 89395.0]
  - - [16384, 192, 1, 256]
    - [308, 45474.9]
  - - [16384, 192, 1, 1024]
    - [308, 71354.5]
  - - [16384, 192, 1, 4096]
    - [309, 84291.1]
  - - [20480, 192, 1, 256]
    - [310, 52697.8]
  - - [20480, 192, 1, 1024]
    - [311, 86698.5]
  - - [20480, 192, 1, 4096]
    - [309, 104174.0]
  - - [24576, 192, 1, 256]
    - [312, 45454.4]
  - - [24576, 192, 1, 1024]
    - [313, 76995.9]
  - - [24576, 192, 1, 4096]
    - [313, 98204.5]
  - - [32768, 192, 1, 256]
    - [314, 45115.0]
  - - [32768, 192, 1, 1024]
    - [309, 71764.0]
  - - [32768, 192, 1, 4096]
    - [309, 84364.1]
  - - [3, 256, 1, 1024]
    - [315, 216.221]
  - - [3, 256, 1, 4096]
    - [316, 657.412]
  - - [3, 256, 1, 16384]
    - [317, 1638.47]
  - - [3, 384, 1, 1024]
    - [315, 322.8]
  - - [3, 384, 1, 4096]
    - [318, 848.913]
  - - [3, 384, 1, 16384]
    - [319, 2112.13]
  - - [16, 256, 1, 1024]
    - [320, 1217.74]
  - - [16, 256, 1, 4096]
    - [321, 3435.95]
  - - [16, 256, 1, 16384]
    - [322, 8596.68]
  - - [32, 256, 1, 1024]
    - [320, 2397.53]
  - - [32, 256, 1, 4096]
    - [323, 6019.77]
  - - [32, 256, 1, 16384]
    - [324, 13644.1]
  - - [16, 384, 1, 1024]
    - [320, 1822.8]
  - - [16, 384, 1, 4096]
    - [325, 4359.31]
  - - [16, 384, 1, 16384]
    - [326, 11215.9]
  - - [32, 384, 1, 1024]
    - [320, 3503.95]
  - - [32, 384, 1, 4096]
    - [327, 7511.94]
  - - [32, 384, 1, 16384]
    - [328, 18049.6]
  - - [64, 256, 1, 1024]
    - [329, 4057.25]
  - - [64, 256, 1, 4096]
    - [330, 9822.54]
  - - [64, 256, 1, 16384]
    - [331, 21829.8]
  - - [96, 256, 1, 1024]
    - [332, 5839.58]
  - - [96, 256, 1, 4096]
    - [333, 12811.5]
  - - [96, 256, 1, 16384]
    - [334, 26573.4]
  - - [64, 384, 1, 1024]
    - [228, 5789.49]
  - - [64, 384, 1, 4096]
    - [335, 12569.7]
  - - [64, 384, 1, 16384]
    - [336, 28977.0]
  - - [96, 384, 1, 1024]
    - [337, 8715.6]
  - - [96, 384, 1, 4096]
    - [338, 17407.8]
  - - [96, 384, 1, 16384]
    - [339, 37560.4]
  - - [128, 256, 1, 1024]
    - [340, 6217.93]
  - - [128, 256, 1, 4096]
    - [341, 16362.2]
  - - [128, 256, 1, 16384]
    - [342, 34261.0]
  - - [192, 256, 1, 1024]
    - [282, 8803.55]
  - - [192, 256, 1, 4096]
    - [343, 21640.0]
  - - [192, 256, 1, 16384]
    - [344, 38017.1]
  - - [128, 384, 1, 1024]
    - [285, 8419.83]
  - - [128, 384, 1, 4096]
    - [345, 22630.0]
  - - [128, 384, 1, 16384]
    - [345, 44790.5]
  - - [192, 384, 1, 1024]
    - [282, 13187.0]
  - - [192, 384, 1, 4096]
    - [286, 29274.6]
  - - [192, 384, 1, 16384]
    - [346, 54830.7]
  - - [256, 256, 1, 1024]
    - [285, 11188.9]
  - - [256, 256, 1, 4096]
    - [347, 25866.1]
  - - [256, 256, 1, 16384]
    - [348, 44205.2]
  - - [384, 256, 1, 1024]
    - [349, 14826.0]
  - - [384, 256, 1, 4096]
    - [350, 32350.3]
  - - [384, 256, 1, 16384]
    - [351, 50838.5]
  - - [256, 384, 1, 1024]
    - [349, 14648.8]
  - - [256, 384, 1, 4096]
    - [350, 32397.3]
  - - [256, 384, 1, 16384]
    - [352, 53103.3]
  - - [384, 384, 1, 1024]
    - [353, 21582.7]
  - - [384, 384, 1, 4096]
    - [354, 40028.5]
  - - [384, 384, 1, 16384]
    - [355, 60057.8]
  - - [512, 256, 1, 1024]
    - [141, 19059.1]
  - - [512, 256, 1, 4096]
    - [356, 39029.1]
  - - [512, 256, 1, 16384]
    - [357, 70431.9]
  - - [640, 256, 1, 1024]
    - [290, 23682.2]
  - - [640, 256, 1, 4096]
    - [358, 46181.8]
  - - [640, 256, 1, 16384]
    - [359, 70750.1]
  - - [768, 256, 1, 1024]
    - [193, 22462.8]
  - - [768, 256, 1, 4096]
    - [360, 47915.8]
  - - [768, 256, 1, 16384]
    - [361, 76947.9]
  - - [512, 384, 1, 1024]
    - [193, 22498.0]
  - - [512, 384, 1, 4096]
    - [362, 47756.2]
  - - [512, 384, 1, 16384]
    - [361, 77066.0]
  - - [640, 384, 1, 1024]
    - [193, 27891.4]
  - - [640, 384, 1, 4096]
    - [363, 53020.6]
  - - [640, 384, 1, 16384]
    - [364, 77269.9]
  - - [768, 384, 1, 1024]
    - [144, 32286.1]
  - - [768, 384, 1, 4096]
    - [365, 57846.8]
  - - [768, 384, 1, 16384]
    - [366, 82787.4]
  - - [1024, 256, 1, 1024]
    - [244, 27938.3]
  - - [1024, 256, 1, 4096]
    - [367, 52886.5]
  - - [1024, 256, 1, 16384]
    - [368, 79500.5]
  - - [1536, 256, 1, 1024]
    - [369, 32225.8]
  - - [1536, 256, 1, 4096]
    - [247, 63584.3]
  - - [1536, 256, 1, 16384]
    - [248, 89072.1]
  - - [1024, 384, 1, 1024]
    - [370, 34317.9]
  - - [1024, 384, 1, 4096]
    - [296, 65539.7]
  - - [1024, 384, 1, 16384]
    - [296, 88921.7]
  - - [1536, 384, 1, 1024]
    - [298, 43869.3]
  - - [1536, 384, 1, 4096]
    - [299, 72045.6]
  - - [1536, 384, 1, 16384]
    - [299, 96177.7]
  - - [2048, 256, 1, 1024]
    - [298, 38825.2]
  - - [2048, 256, 1, 4096]
    - [371, 70109.1]
  - - [2048, 256, 1, 16384]
    - [372, 95683.2]
  - - [3072, 256, 1, 1024]
    - [373, 43326.8]
  - - [3072, 256, 1, 4096]
    - [374, 74823.3]
  - - [3072, 256, 1, 16384]
    - [374, 97114.4]
  - - [2048, 384, 1, 1024]
    - [375, 46908.5]
  - - [2048, 384, 1, 4096]
    - [376, 75847.4]
  - - [2048, 384, 1, 16384]
    - [376, 98658.7]
  - - [3072, 384, 1, 256]
    - [377, 33255.5]
  - - [3072, 384, 1, 1024]
    - [377, 56751.7]
  - - [3072, 384, 1, 4096]
    - [378, 79434.3]
  - - [4096, 256, 1, 256]
    - [252, 32035.5]
  - - [4096, 256, 1, 1024]
    - [253, 51832.3]
  - - [4096, 256, 1, 4096]
    - [254, 78292.0]
  - - [6144, 256, 1, 256]
    - [303, 37727.9]
  - - [6144, 256, 1, 1024]
    - [304, 62971.5]
  - - [6144, 256, 1, 4096]
    - [379, 83986.0]
  - - [4096, 384, 1, 256]
    - [380, 39261.8]
  - - [4096, 384, 1, 1024]
    - [304, 63609.5]
  - - [4096, 384, 1, 4096]
    - [379, 84634.0]
  - - [6144, 384, 1, 256]
    - [258, 47530.3]
  - - [6144, 384, 1, 1024]
    - [258, 77423.7]
  - - [6144, 384, 1, 4096]
    - [258, 92174.2]
  - - [8192, 256, 1, 256]
    - [381, 37467.4]
  - - [8192, 256, 1, 1024]
    - [381, 64472.2]
  - - [8192, 256, 1, 4096]
    - [382, 83144.1]
  - - [12288, 256, 1, 256]
    - [383, 45546.9]
  - - [12288, 256, 1, 1024]
    - [384, 74366.2]
  - - [12288, 256, 1, 4096]
    - [385, 94415.5]
  - - [16384, 256, 1, 256]
    - [386, 48368.7]
  - - [16384, 256, 1, 1024]
    - [387, 75404.3]
  - - [16384, 256, 1, 4096]
    - [387, 90473.1]
  - - [20480, 256, 1, 256]
    - [388, 57689.3]
  - - [20480, 256, 1, 1024]
    - [389, 89667.1]
  - - [20480, 256, 1, 4096]
    - [389, 104294.0]
  - - [24576, 256, 1, 256]
    - [390, 53307.5]
  - - [24576, 256, 1, 1024]
    - [390, 81144.5]
  - - [24576, 256, 1, 4096]
    - [391, 92333.6]
  - - [32768, 256, 1, 256]
    - [392, 47026.8]
  - - [32768, 256, 1, 1024]
    - [393, 75063.5]
  - - [32768, 256, 1, 4096]
    - [393, 90380.6]
  - - [8192, 384, 1, 256]
    - [394, 44194.2]
  - - [8192, 384, 1, 1024]
    - [384, 75131.1]
  - - [8192, 384, 1, 4096]
    - [385, 94629.6]
  - - [12288, 384, 1, 256]
    - [395, 52979.5]
  - - [12288, 384, 1, 1024]
    - [396, 80147.5]
  - - [12288, 384, 1, 4096]
    - [396, 98231.6]
  - - [16384, 384, 1, 256]
    - [390, 55834.1]
  - - [16384, 384, 1, 1024]
    - [390, 82135.8]
  - - [16384, 384, 1, 4096]
    - [385, 94763.5]
  - - [20480, 384, 1, 256]
    - [397, 51983.3]
  - - [20480, 384, 1, 1024]
    - [398, 72466.6]
  - - [20480, 384, 1, 4096]
    - [387, 87372.6]
  - - [24576, 384, 1, 256]
    - [399, 52235.5]
  - - [24576, 384, 1, 1024]
    - [400, 82972.7]
  - - [24576, 384, 1, 4096]
    - [401, 99515.1]
  - - [32768, 384, 1, 256]
    - [400, 53919.3]
  - - [32768, 384, 1, 1024]
    - [400, 83909.2]
  - - [32768, 384, 1, 4096]
    - [390, 95666.9]
  - - [3, 512, 1, 1024]
    - [402, 424.671]
  - - [3, 512, 1, 4096]
    - [403, 1039.58]
  - - [3, 512, 1, 16384]
    - [404, 2384.6]
  - - [3, 640, 1, 1024]
    - [402, 527.072]
  - - [3, 640, 1, 4096]
    - [405, 1249.56]
  - - [3, 640, 1, 16384]
    - [406, 2672.6]
  - - [3, 768, 1, 1024]
    - [402, 632.283]
  - - [3, 768, 1, 4096]
    - [407, 1401.19]
  - - [3, 768, 1, 16384]
    - [408, 3014.01]
  - - [16, 512, 1, 1024]
    - [409, 2352.51]
  - - [16, 512, 1, 4096]
    - [410, 5372.16]
  - - [16, 512, 1, 16384]
    - [411, 12826.0]
  - - [32, 512, 1, 1024]
    - [409, 4610.67]
  - - [32, 512, 1, 4096]
    - [412, 9416.92]
  - - [32, 512, 1, 16384]
    - [413, 20342.2]
  - - [16, 640, 1, 1024]
    - [409, 2935.36]
  - - [16, 640, 1, 4096]
    - [410, 6647.37]
  - - [16, 640, 1, 16384]
    - [414, 14195.8]
  - - [32, 640, 1, 1024]
    - [409, 5709.88]
  - - [32, 640, 1, 4096]
    - [415, 11397.3]
  - - [32, 640, 1, 16384]
    - [416, 23874.1]
  - - [16, 768, 1, 1024]
    - [409, 3499.65]
  - - [16, 768, 1, 4096]
    - [417, 7189.29]
  - - [16, 768, 1, 16384]
    - [418, 16107.2]
  - - [32, 768, 1, 1024]
    - [419, 5774.06]
  - - [32, 768, 1, 4096]
    - [420, 13142.0]
  - - [32, 768, 1, 16384]
    - [420, 25674.0]
  - - [64, 512, 1, 1024]
    - [421, 7221.13]
  - - [64, 512, 1, 4096]
    - [422, 16818.5]
  - - [64, 512, 1, 16384]
    - [423, 29193.1]
  - - [96, 512, 1, 1024]
    - [424, 9800.06]
  - - [96, 512, 1, 4096]
    - [425, 20784.7]
  - - [96, 512, 1, 16384]
    - [426, 36633.8]
  - - [64, 640, 1, 1024]
    - [421, 9026.41]
  - - [64, 640, 1, 4096]
    - [427, 20089.5]
  - - [64, 640, 1, 16384]
    - [428, 34930.2]
  - - [96, 640, 1, 1024]
    - [424, 12089.8]
  - - [96, 640, 1, 4096]
    - [425, 25746.3]
  - - [96, 640, 1, 16384]
    - [426, 45341.5]
  - - [64, 768, 1, 1024]
    - [424, 9724.14]
  - - [64, 768, 1, 4096]
    - [429, 21871.0]
  - - [64, 768, 1, 16384]
    - [430, 36788.1]
  - - [96, 768, 1, 1024]
    - [424, 14513.2]
  - - [96, 768, 1, 4096]
    - [431, 28903.9]
  - - [96, 768, 1, 16384]
    - [432, 46759.4]
  - - [128, 512, 1, 1024]
    - [234, 11256.6]
  - - [128, 512, 1, 4096]
    - [433, 25385.5]
  - - [128, 512, 1, 16384]
    - [434, 39779.8]
  - - [192, 512, 1, 1024]
    - [435, 14954.1]
  - - [192, 512, 1, 4096]
    - [436, 31542.5]
  - - [192, 512, 1, 16384]
    - [436, 53012.2]
  - - [128, 640, 1, 1024]
    - [234, 13902.5]
  - - [128, 640, 1, 4096]
    - [433, 30634.4]
  - - [128, 640, 1, 16384]
    - [434, 49079.6]
  - - [192, 640, 1, 1024]
    - [437, 18332.1]
  - - [192, 640, 1, 4096]
    - [438, 38615.7]
  - - [192, 640, 1, 16384]
    - [436, 64857.3]
  - - [128, 768, 1, 1024]
    - [439, 14475.6]
  - - [128, 768, 1, 4096]
    - [434, 34201.1]
  - - [128, 768, 1, 16384]
    - [434, 57352.6]
  - - [192, 768, 1, 1024]
    - [437, 21807.6]
  - - [192, 768, 1, 4096]
    - [440, 41939.7]
  - - [192, 768, 1, 16384]
    - [441, 72627.3]
  - - [256, 512, 1, 1024]
    - [141, 18796.8]
  - - [256, 512, 1, 4096]
    - [356, 39006.4]
  - - [256, 512, 1, 16384]
    - [357, 69644.4]
  - - [384, 512, 1, 1024]
    - [193, 22189.9]
  - - [384, 512, 1, 4096]
    - [442, 47139.8]
  - - [384, 512, 1, 16384]
    - [443, 71913.4]
  - - [256, 640, 1, 1024]
    - [141, 22798.4]
  - - [256, 640, 1, 4096]
    - [358, 44827.4]
  - - [256, 640, 1, 16384]
    - [444, 72831.9]
  - - [384, 640, 1, 1024]
    - [144, 27026.8]
  - - [384, 640, 1, 4096]
    - [445, 51908.0]
  - - [384, 640, 1, 16384]
    - [446, 76353.4]
  - - [256, 768, 1, 1024]
    - [193, 22382.8]
  - - [256, 768, 1, 4096]
    - [194, 50531.6]
  - - [256, 768, 1, 16384]
    - [194, 79002.1]
  - - [384, 768, 1, 1024]
    - [144, 32460.2]
  - - [384, 768, 1, 4096]
    - [365, 57913.5]
  - - [384, 768, 1, 16384]
    - [197, 87815.4]
  - - [512, 512, 1, 1024]
    - [447, 27891.9]
  - - [512, 512, 1, 4096]
    - [368, 53249.3]
  - - [512, 512, 1, 16384]
    - [368, 80713.5]
  - - [640, 512, 1, 1024]
    - [244, 34370.7]
  - - [640, 512, 1, 4096]
    - [448, 57883.9]
  - - [640, 512, 1, 16384]
    - [449, 81139.6]
  - - [768, 512, 1, 1024]
    - [369, 32565.4]
  - - [768, 512, 1, 4096]
    - [450, 62882.6]
  - - [768, 512, 1, 16384]
    - [450, 86057.3]
  - - [512, 640, 1, 1024]
    - [447, 34153.5]
  - - [512, 640, 1, 4096]
    - [451, 59309.4]
  - - [512, 640, 1, 16384]
    - [452, 83349.1]
  - - [640, 640, 1, 1024]
    - [370, 36369.3]
  - - [640, 640, 1, 4096]
    - [453, 61985.6]
  - - [640, 640, 1, 16384]
    - [454, 81779.3]
  - - [768, 640, 1, 1024]
    - [455, 38350.3]
  - - [768, 640, 1, 4096]
    - [456, 69841.2]
  - - [768, 640, 1, 16384]
    - [456, 87491.5]
  - - [512, 768, 1, 1024]
    - [370, 34866.0]
  - - [512, 768, 1, 4096]
    - [296, 66560.6]
  - - [512, 768, 1, 16384]
    - [296, 89138.8]
  - - [640, 768, 1, 1024]
    - [369, 40347.0]
  - - [640, 768, 1, 4096]
    - [453, 69807.1]
  - - [640, 768, 1, 16384]
    - [457, 85317.5]
  - - [768, 768, 1, 1024]
    - [298, 44340.7]
  - - [768, 768, 1, 4096]
    - [299, 72335.3]
  - - [768, 768, 1, 16384]
    - [299, 96787.9]
  - - [1024, 512, 1, 1024]
    - [298, 38270.6]
  - - [1024, 512, 1, 4096]
    - [458, 62537.7]
  - - [1024, 512, 1, 16384]
    - [459, 81823.2]
  - - [1536, 512, 1, 1024]
    - [373, 43646.9]
  - - [1536, 512, 1, 4096]
    - [460, 76366.4]
  - - [1536, 512, 1, 16384]
    - [461, 96950.4]
  - - [1024, 640, 1, 1024]
    - [462, 43263.1]
  - - [1024, 640, 1, 4096]
    - [458, 75322.6]
  - - [1024, 640, 1, 16384]
    - [463, 97533.5]
  - - [1536, 640, 1, 256]
    - [464, 30206.7]
  - - [1536, 640, 1, 1024]
    - [465, 53228.6]
  - - [1536, 640, 1, 4096]
    - [466, 80499.9]
  - - [1024, 768, 1, 1024]
    - [375, 47451.9]
  - - [1024, 768, 1, 4096]
    - [467, 73976.0]
  - - [1024, 768, 1, 16384]
    - [467, 90557.9]
  - - [1536, 768, 1, 256]
    - [377, 32707.0]
  - - [1536, 768, 1, 1024]
    - [377, 56117.3]
  - - [1536, 768, 1, 4096]
    - [378, 80543.8]
  - - [2048, 512, 1, 256]
    - [468, 31981.9]
  - - [2048, 512, 1, 1024]
    - [468, 52287.6]
  - - [2048, 512, 1, 4096]
    - [469, 70425.0]
  - - [3072, 512, 1, 256]
    - [470, 39055.6]
  - - [3072, 512, 1, 1024]
    - [470, 62341.2]
  - - [3072, 512, 1, 4096]
    - [471, 84781.4]
  - - [2048, 640, 1, 256]
    - [468, 39394.2]
  - - [2048, 640, 1, 1024]
    - [468, 64441.2]
  - - [2048, 640, 1, 4096]
    - [472, 76052.1]
  - - [3072, 640, 1, 256]
    - [473, 45783.7]
  - - [3072, 640, 1, 1024]
    - [474, 71451.1]
  - - [3072, 640, 1, 4096]
    - [475, 90364.9]
  - - [2048, 768, 1, 256]
    - [476, 39462.3]
  - - [2048, 768, 1, 1024]
    - [476, 65321.4]
  - - [2048, 768, 1, 4096]
    - [477, 79097.5]
  - - [3072, 768, 1, 256]
    - [478, 48792.6]
  - - [3072, 768, 1, 1024]
    - [479, 75018.9]
  - - [3072, 768, 1, 4096]
    - [479, 91991.3]
  - - [4096, 512, 1, 256]
    - [480, 42878.0]
  - - [4096, 512, 1, 1024]
    - [481, 69284.2]
  - - [4096, 512, 1, 4096]
    - [482, 82008.0]
  - - [6144, 512, 1, 256]
    - [483, 47206.3]
  - - [6144, 512, 1, 1024]
    - [484, 75384.9]
  - - [6144, 512, 1, 4096]
    - [485, 94312.9]
  - - [4096, 640, 1, 256]
    - [480, 52504.7]
  - - [4096, 640, 1, 1024]
    - [486, 85521.1]
  - - [4096, 640, 1, 4096]
    - [486, 101094.0]
  - - [6144, 640, 1, 256]
    - [487, 56959.8]
  - - [6144, 640, 1, 1024]
    - [488, 83539.7]
  - - [6144, 640, 1, 4096]
    - [489, 99617.1]
  - - [4096, 768, 1, 256]
    - [490, 50556.9]
  - - [4096, 768, 1, 1024]
    - [490, 83052.5]
  - - [4096, 768, 1, 4096]
    - [490, 97648.5]
  - - [6144, 768, 1, 256]
    - [480, 56075.7]
  - - [6144, 768, 1, 1024]
    - [491, 78878.0]
  - - [6144, 768, 1, 4096]
    - [492, 96104.8]
  - - [8192, 512, 1, 256]
    - [493, 45772.9]
  - - [8192, 512, 1, 1024]
    - [493, 72481.1]
  - - [8192, 512, 1, 4096]
    - [494, 89356.2]
  - - [12288, 512, 1, 256]
    - [495, 48635.0]
  - - [12288, 512, 1, 1024]
    - [495, 81842.9]
  - - [12288, 512, 1, 4096]
    - [495, 95159.1]
  - - [16384, 512, 1, 256]
    - [493, 47970.2]
  - - [16384, 512, 1, 1024]
    - [495, 73837.3]
  - - [16384, 512, 1, 4096]
    - [494, 89957.5]
  - - [20480, 512, 1, 256]
    - [493, 56052.2]
  - - [20480, 512, 1, 1024]
    - [493, 86675.1]
  - - [20480, 512, 1, 4096]
    - [493, 102655.0]
  - - [24576, 512, 1, 256]
    - [493, 55958.5]
  - - [24576, 512, 1, 1024]
    - [493, 84705.4]
  - - [24576, 512, 1, 4096]
    - [493, 99676.9]
  - - [32768, 512, 1, 1024]
    - [493, 82489.4]
  - - [8192, 640, 1, 256]
    - [493, 56302.0]
  - - [8192, 640, 1, 1024]
    - [493, 88272.1]
  - - [8192, 640, 1, 4096]
    - [493, 101898.0]
  - - [12288, 640, 1, 256]
    - [493, 55493.2]
  - - [12288, 640, 1, 1024]
    - [493, 89519.2]
  - - [12288, 640, 1, 4096]
    - [493, 102908.0]
  - - [16384, 640, 1, 256]
    - [493, 59383.0]
  - - [16384, 640, 1, 1024]
    - [493, 91305.6]
  - - [16384, 640, 1, 4096]
    - [493, 103673.0]
  - - [20480, 640, 1, 256]
    - [493, 59055.2]
  - - [20480, 640, 1, 1024]
    - [493, 91181.2]
  - - [20480, 640, 1, 4096]
    - [495, 101014.0]
  - - [24576, 640, 1, 1024]
    - [493, 90228.9]
  - - [32768, 640, 1, 1024]
    - [493, 91693.2]
  - - [8192, 768, 1, 256]
    - [495, 49491.8]
  - - [8192, 768, 1, 1024]
    - [495, 81943.1]
  - - [8192, 768, 1, 4096]
    - [496, 97277.6]
  - - [12288, 768, 1, 256]
    - [497, 53496.9]
  - - [12288, 768, 1, 1024]
    - [493, 83141.6]
  - - [12288, 768, 1, 4096]
    - [496, 97554.7]
  - - [16384, 768, 1, 256]
    - [493, 57898.1]
  - - [16384, 768, 1, 1024]
    - [493, 88211.5]
  - - [16384, 768, 1, 4096]
    - [493, 100180.0]
  - - [20480, 768, 1, 1024]
    - [493, 90558.4]
  - - [24576, 768, 1, 1024]
    - [495, 87189.6]
  - - [32768, 768, 1, 1024]
    - [493, 89010.4]
  - - [3, 1024, 1, 1024]
    - [498, 704.392]
  - - [3, 1024, 1, 4096]
    - [499, 1652.79]
  - - [3, 1024, 1, 16384]
    - [500, 3153.78]
  - - [3, 1536, 1, 1024]
    - [501, 951.747]
  - - [3, 1536, 1, 4096]
    - [502, 2125.87]
  - - [3, 1536, 1, 16384]
    - [502, 3704.1]
  - - [16, 1024, 1, 1024]
    - [503, 4202.3]
  - - [16, 1024, 1, 4096]
    - [504, 8862.95]
  - - [16, 1024, 1, 16384]
    - [505, 17186.3]
  - - [32, 1024, 1, 1024]
    - [506, 7549.43]
  - - [32, 1024, 1, 4096]
    - [507, 15756.9]
  - - [32, 1024, 1, 16384]
    - [507, 28133.8]
  - - [16, 1536, 1, 1024]
    - [506, 5245.67]
  - - [16, 1536, 1, 4096]
    - [508, 11600.9]
  - - [16, 1536, 1, 16384]
    - [508, 20292.1]
  - - [32, 1536, 1, 1024]
    - [509, 9125.49]
  - - [32, 1536, 1, 4096]
    - [510, 20007.9]
  - - [32, 1536, 1, 16384]
    - [510, 30458.2]
  - - [64, 1024, 1, 1024]
    - [511, 11660.5]
  - - [64, 1024, 1, 4096]
    - [235, 26744.3]
  - - [64, 1024, 1, 16384]
    - [235, 38540.4]
  - - [96, 1024, 1, 1024]
    - [435, 15034.7]
  - - [96, 1024, 1, 4096]
    - [512, 31752.0]
  - - [96, 1024, 1, 16384]
    - [513, 47443.3]
  - - [64, 1536, 1, 1024]
    - [435, 15148.0]
  - - [64, 1536, 1, 4096]
    - [514, 31862.8]
  - - [64, 1536, 1, 16384]
    - [514, 48220.6]
  - - [96, 1536, 1, 1024]
    - [515, 21539.5]
  - - [96, 1536, 1, 4096]
    - [516, 38846.6]
  - - [96, 1536, 1, 16384]
    - [517, 54612.0]
  - - [128, 1024, 1, 1024]
    - [290, 19162.6]
  - - [128, 1024, 1, 4096]
    - [518, 38746.7]
  - - [128, 1024, 1, 16384]
    - [519, 59674.1]
  - - [192, 1024, 1, 1024]
    - [520, 22898.2]
  - - [192, 1024, 1, 4096]
    - [442, 46980.1]
  - - [192, 1024, 1, 16384]
    - [521, 74047.4]
  - - [128, 1536, 1, 1024]
    - [193, 22599.4]
  - - [128, 1536, 1, 4096]
    - [522, 45464.7]
  - - [128, 1536, 1, 16384]
    - [523, 67383.9]
  - - [192, 1536, 1, 1024]
    - [144, 32813.6]
  - - [192, 1536, 1, 4096]
    - [196, 56206.5]
  - - [192, 1536, 1, 16384]
    - [524, 86694.2]
  - - [256, 1024, 1, 1024]
    - [447, 27885.9]
  - - [256, 1024, 1, 4096]
    - [525, 55638.8]
  - - [256, 1024, 1, 16384]
    - [368, 80537.5]
  - - [384, 1024, 1, 1024]
    - [370, 34872.0]
  - - [384, 1024, 1, 4096]
    - [247, 64229.9]
  - - [384, 1024, 1, 16384]
    - [526, 86140.3]
  - - [256, 1536, 1, 1024]
    - [370, 34902.2]
  - - [256, 1536, 1, 4096]
    - [296, 64852.0]
  - - [256, 1536, 1, 16384]
    - [297, 89984.8]
  - - [384, 1536, 1, 1024]
    - [298, 44682.5]
  - - [384, 1536, 1, 4096]
    - [527, 72114.5]
  - - [384, 1536, 1, 16384]
    - [299, 96526.2]
  - - [512, 1024, 1, 1024]
    - [298, 38713.2]
  - - [512, 1024, 1, 4096]
    - [528, 63097.4]
  - - [512, 1024, 1, 16384]
    - [463, 79512.3]
  - - [640, 1024, 1, 1024]
    - [298, 48447.4]
  - - [640, 1024, 1, 4096]
    - [528, 77457.6]
  - - [640, 1024, 1, 16384]
    - [529, 95662.8]
  - - [768, 1024, 1, 1024]
    - [375, 47530.3]
  - - [768, 1024, 1, 4096]
    - [467, 75047.0]
  - - [768, 1024, 1, 16384]
    - [530, 92997.5]
  - - [512, 1536, 1, 1024]
    - [375, 47858.8]
  - - [512, 1536, 1, 4096]
    - [531, 76944.3]
  - - [512, 1536, 1, 16384]
    - [376, 98822.6]
  - - [640, 1536, 1, 256]
    - [373, 30724.5]
  - - [640, 1536, 1, 1024]
    - [373, 54988.9]
  - - [640, 1536, 1, 4096]
    - [532, 82544.2]
  - - [768, 1536, 1, 256]
    - [377, 32993.2]
  - - [768, 1536, 1, 1024]
    - [533, 56890.9]
  - - [768, 1536, 1, 4096]
    - [378, 80754.3]
  - - [1024, 1024, 1, 256]
    - [534, 32027.9]
  - - [1024, 1024, 1, 1024]
    - [534, 51922.6]
  - - [1024, 1024, 1, 4096]
    - [535, 75930.8]
  - - [1536, 1024, 1, 256]
    - [536, 39346.4]
  - - [1536, 1024, 1, 1024]
    - [536, 64962.1]
  - - [1536, 1024, 1, 4096]
    - [537, 84956.2]
  - - [1024, 1536, 1, 256]
    - [538, 39711.9]
  - - [1024, 1536, 1, 1024]
    - [536, 64846.9]
  - - [1024, 1536, 1, 4096]
    - [539, 86302.2]
  - - [1536, 1536, 1, 256]
    - [540, 47984.4]
  - - [1536, 1536, 1, 1024]
    - [541, 74605.6]
  - - [1536, 1536, 1, 4096]
    - [541, 91547.6]
  - - [2048, 1024, 1, 256]
    - [480, 43071.3]
  - - [2048, 1024, 1, 1024]
    - [481, 69716.9]
  - - [2048, 1024, 1, 4096]
    - [542, 84100.3]
  - - [3072, 1024, 1, 256]
    - [543, 49110.6]
  - - [3072, 1024, 1, 1024]
    - [485, 78339.7]
  - - [3072, 1024, 1, 4096]
    - [485, 94396.1]
  - - [2048, 1536, 1, 256]
    - [490, 51649.0]
  - - [2048, 1536, 1, 1024]
    - [490, 83902.7]
  - - [2048, 1536, 1, 4096]
    - [490, 98320.7]
  - - [3072, 1536, 1, 256]
    - [480, 56159.4]
  - - [3072, 1536, 1, 1024]
    - [544, 80350.7]
  - - [3072, 1536, 1, 4096]
    - [545, 97113.5]
  - - [4096, 1024, 1, 256]
    - [546, 50370.2]
  - - [4096, 1024, 1, 1024]
    - [546, 76557.6]
  - - [4096, 1024, 1, 4096]
    - [547, 93328.4]
  - - [6144, 1024, 1, 256]
    - [548, 48646.9]
  - - [6144, 1024, 1, 1024]
    - [495, 81901.4]
  - - [6144, 1024, 1, 4096]
    - [495, 94416.9]
  - - [4096, 1536, 1, 256]
    - [549, 50480.9]
  - - [4096, 1536, 1, 1024]
    - [495, 80985.0]
  - - [4096, 1536, 1, 4096]
    - [550, 97041.1]
  - - [6144, 1536, 1, 256]
    - [551, 54850.5]
  - - [6144, 1536, 1, 1024]
    - [552, 83181.8]
  - - [6144, 1536, 1, 4096]
    - [496, 97246.7]
  - - [8192, 1024, 1, 256]
    - [553, 52441.2]
  - - [8192, 1024, 1, 1024]
    - [553, 78297.8]
  - - [8192, 1024, 1, 4096]
    - [554, 94091.7]
  - - [12288, 1024, 1, 256]
    - [555, 57116.2]
  - - [12288, 1024, 1, 1024]
    - [555, 87914.6]
  - - [12288, 1024, 1, 4096]
    - [555, 100268.0]
  - - [16384, 1024, 1, 1024]
    - [555, 83833.8]
  - - [20480, 1024, 1, 1024]
    - [555, 90394.9]
  - - [24576, 1024, 1, 1024]
    - [556, 88693.5]
  - - [32768, 1024, 1, 1024]
    - [555, 90423.5]
  - - [8192, 1536, 1, 256]
    - [555, 58369.2]
  - - [8192, 1536, 1, 1024]
    - [555, 89937.0]
  - - [8192, 1536, 1, 4096]
    - [555, 100229.0]
  - - [12288, 1536, 1, 1024]
    - [556, 87986.9]
  - - [16384, 1536, 1, 1024]
    - [555, 90803.5]
  - - [20480, 1536, 1, 1024]
    - [555, 92499.7]
  - - [24576, 1536, 1, 1024]
    - [557, 91616.3]
  - - [32768, 1536, 1, 1024]
    - [555, 91033.1]
  - - [3, 2048, 1, 1024]
    - [501, 1208.5]
  - - [3, 2048, 1, 4096]
    - [558, 2378.72]
  - - [3, 2048, 1, 16384]
    - [558, 3413.3]
  - - [3, 3072, 1, 1024]
    - [559, 1432.75]
  - - [3, 3072, 1, 4096]
    - [560, 2677.36]
  - - [3, 3072, 1, 16384]
    - [560, 3592.14]
  - - [16, 2048, 1, 1024]
    - [506, 6610.8]
  - - [16, 2048, 1, 4096]
    - [506, 12366.9]
  - - [16, 2048, 1, 16384]
    - [561, 18650.2]
  - - [32, 2048, 1, 1024]
    - [562, 11379.0]
  - - [32, 2048, 1, 4096]
    - [563, 22284.8]
  - - [32, 2048, 1, 16384]
    - [563, 32794.7]
  - - [16, 3072, 1, 1024]
    - [564, 8316.6]
  - - [16, 3072, 1, 4096]
    - [565, 13914.1]
  - - [16, 3072, 1, 16384]
    - [565, 19071.7]
  - - [32, 3072, 1, 1024]
    - [566, 15226.1]
  - - [32, 3072, 1, 4096]
    - [567, 24092.9]
  - - [32, 3072, 1, 16384]
    - [567, 34121.2]
  - - [64, 2048, 1, 1024]
    - [290, 19168.2]
  - - [64, 2048, 1, 4096]
    - [568, 34503.7]
  - - [64, 2048, 1, 16384]
    - [569, 49125.0]
  - - [96, 2048, 1, 1024]
    - [570, 22498.0]
  - - [96, 2048, 1, 4096]
    - [571, 44775.4]
  - - [96, 2048, 1, 16384]
    - [571, 59905.5]
  - - [64, 3072, 1, 1024]
    - [520, 22945.3]
  - - [64, 3072, 1, 4096]
    - [572, 37981.1]
  - - [64, 3072, 1, 16384]
    - [573, 48955.2]
  - - [96, 3072, 1, 1024]
    - [574, 28859.6]
  - - [96, 3072, 1, 4096]
    - [575, 47139.9]
  - - [96, 3072, 1, 16384]
    - [575, 59194.9]
  - - [128, 2048, 1, 1024]
    - [447, 27816.4]
  - - [128, 2048, 1, 4096]
    - [363, 50054.6]
  - - [128, 2048, 1, 16384]
    - [576, 70900.4]
  - - [192, 2048, 1, 1024]
    - [370, 35388.1]
  - - [192, 2048, 1, 4096]
    - [247, 62745.2]
  - - [192, 2048, 1, 16384]
    - [577, 87691.6]
  - - [128, 3072, 1, 1024]
    - [370, 35245.3]
  - - [128, 3072, 1, 4096]
    - [578, 58352.3]
  - - [128, 3072, 1, 16384]
    - [578, 74994.4]
  - - [192, 3072, 1, 1024]
    - [579, 43805.5]
  - - [192, 3072, 1, 4096]
    - [527, 71287.1]
  - - [192, 3072, 1, 16384]
    - [527, 95484.2]
  - - [256, 2048, 1, 1024]
    - [580, 38724.1]
  - - [256, 2048, 1, 4096]
    - [372, 72246.5]
  - - [256, 2048, 1, 16384]
    - [372, 95542.3]
  - - [384, 2048, 1, 1024]
    - [375, 47745.1]
  - - [384, 2048, 1, 4096]
    - [460, 76200.0]
  - - [384, 2048, 1, 16384]
    - [461, 96481.7]
  - - [256, 3072, 1, 1024]
    - [375, 47801.7]
  - - [256, 3072, 1, 4096]
    - [376, 74698.0]
  - - [256, 3072, 1, 16384]
    - [376, 98356.8]
  - - [384, 3072, 1, 256]
    - [377, 32806.4]
  - - [384, 3072, 1, 1024]
    - [533, 57774.4]
  - - [384, 3072, 1, 4096]
    - [581, 76719.0]
  - - [512, 2048, 1, 256]
    - [582, 32228.4]
  - - [512, 2048, 1, 1024]
    - [582, 52226.6]
  - - [512, 2048, 1, 4096]
    - [583, 67956.7]
  - - [640, 2048, 1, 256]
    - [534, 39872.9]
  - - [640, 2048, 1, 1024]
    - [534, 64897.0]
  - - [640, 2048, 1, 4096]
    - [584, 73612.6]
  - - [768, 2048, 1, 256]
    - [538, 39223.4]
  - - [768, 2048, 1, 1024]
    - [536, 64477.4]
  - - [768, 2048, 1, 4096]
    - [539, 87083.3]
  - - [512, 3072, 1, 256]
    - [538, 40285.5]
  - - [512, 3072, 1, 1024]
    - [538, 61794.4]
  - - [512, 3072, 1, 4096]
    - [539, 86606.9]
  - - [640, 3072, 1, 256]
    - [536, 49096.4]
  - - [640, 3072, 1, 1024]
    - [536, 71486.6]
  - - [640, 3072, 1, 4096]
    - [536, 86627.4]
  - - [768, 3072, 1, 256]
    - [540, 49030.9]
  - - [768, 3072, 1, 1024]
    - [541, 75253.0]
  - - [768, 3072, 1, 4096]
    - [541, 92086.2]
  - - [1024, 2048, 1, 256]
    - [585, 42632.5]
  - - [1024, 2048, 1, 1024]
    - [586, 69572.1]
  - - [1024, 2048, 1, 4096]
    - [542, 84186.2]
  - - [1536, 2048, 1, 256]
    - [587, 50178.0]
  - - [1536, 2048, 1, 1024]
    - [587, 82473.1]
  - - [1536, 2048, 1, 4096]
    - [587, 97538.9]
  - - [1024, 3072, 1, 256]
    - [587, 52886.4]
  - - [1024, 3072, 1, 1024]
    - [588, 84290.0]
  - - [1024, 3072, 1, 4096]
    - [587, 97916.3]
  - - [1536, 3072, 1, 256]
    - [589, 56337.7]
  - - [1536, 3072, 1, 1024]
    - [544, 79707.5]
  - - [1536, 3072, 1, 4096]
    - [590, 96908.5]
  - - [2048, 2048, 1, 256]
    - [591, 50703.7]
  - - [2048, 2048, 1, 1024]
    - [591, 77448.6]
  - - [2048, 2048, 1, 4096]
    - [592, 93732.6]
  - - [3072, 2048, 1, 256]
    - [593, 49626.3]
  - - [3072, 2048, 1, 1024]
    - [594, 81934.7]
  - - [3072, 2048, 1, 4096]
    - [595, 97623.3]
  - - [2048, 3072, 1, 256]
    - [596, 51470.3]
  - - [2048, 3072, 1, 1024]
    - [597, 79913.7]
  - - [2048, 3072, 1, 4096]
    - [595, 97727.2]
  - - [3072, 3072, 1, 256]
    - [598, 54316.7]
  - - [3072, 3072, 1, 1024]
    - [598, 83675.4]
  - - [3072, 3072, 1, 4096]
    - [595, 98014.8]
  - - [4096, 2048, 1, 256]
    - [599, 55021.5]
  - - [4096, 2048, 1, 1024]
    - [600, 78066.6]
  - - [4096, 2048, 1, 4096]
    - [554, 93828.0]
  - - [6144, 2048, 1, 256]
    - [555, 57856.4]
  - - [6144, 2048, 1, 1024]
    - [601, 89603.5]
  - - [6144, 2048, 1, 4096]
    - [555, 100222.0]
  - - [4096, 3072, 1, 256]
    - [601, 58428.6]
  - - [4096, 3072, 1, 1024]
    - [601, 89686.0]
  - - [4096, 3072, 1, 4096]
    - [601, 100390.0]
  - - [6144, 3072, 1, 1024]
    - [602, 86522.9]
  - - [8192, 2048, 1, 1024]
    - [493, 86218.8]
  - - [12288, 2048, 1, 1024]
    - [493, 91711.7]
  - - [16384, 2048, 1, 1024]
    - [493, 93306.0]
  - - [20480, 2048, 1, 1024]
    - [493, 95491.4]
  - - [24576, 2048, 1, 1024]
    - [493, 92683.8]
  - - [32768, 2048, 1, 1024]
    - [493, 94637.8]
  - - [8192, 3072, 1, 1024]
    - [493, 92264.7]
  - - [12288, 3072, 1, 1024]
    - [603, 94325.0]
  - - [16384, 3072, 1, 1024]
    - [493, 92630.2]
  - - [20480, 3072, 1, 1024]
    - [493, 95834.5]
  - - [24576, 3072, 1, 1024]
    - [493, 95760.7]
  - - [32768, 3072, 1, 1024]
    - [493, 94849.9]
  - - [3, 4096, 1, 1024]
    - [604, 1896.83]
  - - [3, 4096, 1, 4096]
    - [605, 2836.86]
  - - [3, 4096, 1, 16384]
    - [605, 3758.61]
  - - [3, 6144, 1, 1024]
    - [606, 2289.64]
  - - [3, 6144, 1, 4096]
    - [607, 3364.29]
  - - [3, 6144, 1, 16384]
    - [605, 3857.73]
  - - [16, 4096, 1, 1024]
    - [608, 10685.4]
  - - [16, 4096, 1, 4096]
    - [609, 15621.7]
  - - [16, 4096, 1, 16384]
    - [610, 19532.3]
  - - [32, 4096, 1, 1024]
    - [611, 19026.5]
  - - [32, 4096, 1, 4096]
    - [611, 27431.8]
  - - [32, 4096, 1, 16384]
    - [612, 32622.8]
  - - [16, 6144, 1, 1024]
    - [613, 13535.2]
  - - [16, 6144, 1, 4096]
    - [614, 18449.8]
  - - [16, 6144, 1, 16384]
    - [614, 21919.9]
  - - [32, 6144, 1, 1024]
    - [615, 22194.9]
  - - [32, 6144, 1, 4096]
    - [616, 31088.5]
  - - [32, 6144, 1, 16384]
    - [616, 35361.6]
  - - [64, 4096, 1, 1024]
    - [617, 28226.9]
  - - [64, 4096, 1, 4096]
    - [618, 42376.2]
  - - [64, 4096, 1, 16384]
    - [618, 54761.4]
  - - [96, 4096, 1, 1024]
    - [619, 32697.9]
  - - [96, 4096, 1, 4096]
    - [619, 49216.1]
  - - [96, 4096, 1, 16384]
    - [620, 62027.1]
  - - [64, 6144, 1, 1024]
    - [621, 33393.7]
  - - [64, 6144, 1, 4096]
    - [622, 45241.9]
  - - [64, 6144, 1, 16384]
    - [623, 52535.5]
  - - [96, 6144, 1, 1024]
    - [624, 33373.4]
  - - [96, 6144, 1, 4096]
    - [625, 53618.3]
  - - [96, 6144, 1, 16384]
    - [625, 65780.4]
  - - [128, 4096, 1, 1024]
    - [626, 39466.2]
  - - [128, 4096, 1, 4096]
    - [627, 62052.2]
  - - [128, 4096, 1, 16384]
    - [627, 78755.4]
  - - [192, 4096, 1, 1024]
    - [628, 45219.1]
  - - [192, 4096, 1, 4096]
    - [629, 74153.4]
  - - [192, 4096, 1, 16384]
    - [629, 97388.2]
  - - [128, 6144, 1, 1024]
    - [630, 48007.5]
  - - [128, 6144, 1, 4096]
    - [631, 63544.0]
  - - [128, 6144, 1, 16384]
    - [632, 78783.3]
  - - [192, 6144, 1, 256]
    - [633, 31489.8]
  - - [192, 6144, 1, 1024]
    - [633, 57520.8]
  - - [192, 6144, 1, 4096]
    - [634, 76022.1]
  - - [256, 4096, 1, 256]
    - [635, 32236.0]
  - - [256, 4096, 1, 1024]
    - [635, 51232.4]
  - - [256, 4096, 1, 4096]
    - [636, 81586.4]
  - - [384, 4096, 1, 256]
    - [637, 39893.5]
  - - [384, 4096, 1, 1024]
    - [637, 60592.1]
  - - [384, 4096, 1, 4096]
    - [638, 82600.2]
  - - [256, 6144, 1, 256]
    - [637, 40212.6]
  - - [256, 6144, 1, 1024]
    - [639, 63644.7]
  - - [256, 6144, 1, 4096]
    - [640, 87581.7]
  - - [384, 6144, 1, 256]
    - [641, 45396.1]
  - - [384, 6144, 1, 1024]
    - [641, 70880.4]
  - - [384, 6144, 1, 4096]
    - [642, 87887.4]
  - - [512, 4096, 1, 256]
    - [643, 42056.7]
  - - [512, 4096, 1, 1024]
    - [644, 69239.3]
  - - [512, 4096, 1, 4096]
    - [645, 84484.9]
  - - [640, 4096, 1, 256]
    - [643, 51967.2]
  - - [640, 4096, 1, 1024]
    - [643, 85498.8]
  - - [640, 4096, 1, 4096]
    - [643, 87265.3]
  - - [768, 4096, 1, 256]
    - [646, 48717.9]
  - - [768, 4096, 1, 1024]
    - [647, 83972.7]
  - - [768, 4096, 1, 4096]
    - [588, 98380.8]
  - - [512, 6144, 1, 256]
    - [647, 52145.0]
  - - [512, 6144, 1, 1024]
    - [647, 82337.7]
  - - [512, 6144, 1, 4096]
    - [588, 98224.4]
  - - [640, 6144, 1, 256]
    - [648, 53902.7]
  - - [640, 6144, 1, 1024]
    - [649, 76976.6]
  - - [640, 6144, 1, 4096]
    - [650, 92109.4]
  - - [768, 6144, 1, 256]
    - [651, 53591.8]
  - - [768, 6144, 1, 1024]
    - [652, 79549.7]
  - - [768, 6144, 1, 4096]
    - [653, 97297.7]
  - - [1024, 4096, 1, 256]
    - [591, 50181.4]
  - - [1024, 4096, 1, 1024]
    - [654, 77108.5]
  - - [1024, 4096, 1, 4096]
    - [655, 93206.6]
  - - [1536, 4096, 1, 256]
    - [656, 50780.7]
  - - [1536, 4096, 1, 1024]
    - [657, 80506.3]
  - - [1536, 4096, 1, 4096]
    - [597, 97262.9]
  - - [1024, 6144, 1, 256]
    - [658, 50703.8]
  - - [1024, 6144, 1, 1024]
    - [597, 79091.7]
  - - [1024, 6144, 1, 4096]
    - [659, 97187.9]
  - - [1536, 6144, 1, 256]
    - [660, 53768.9]
  - - [1536, 6144, 1, 1024]
    - [661, 82884.2]
  - - [1536, 6144, 1, 4096]
    - [659, 97444.2]
  - - [2048, 4096, 1, 256]
    - [662, 55529.1]
  - - [2048, 4096, 1, 1024]
    - [663, 78659.9]
  - - [2048, 4096, 1, 4096]
    - [664, 94446.3]
  - - [3072, 4096, 1, 256]
    - [665, 58031.8]
  - - [3072, 4096, 1, 1024]
    - [666, 89448.9]
  - - [3072, 4096, 1, 4096]
    - [666, 100367.0]
  - - [2048, 6144, 1, 256]
    - [665, 58908.3]
  - - [2048, 6144, 1, 1024]
    - [665, 89921.9]
  - - [2048, 6144, 1, 4096]
    - [666, 100719.0]
  - - [3072, 6144, 1, 1024]
    - [667, 87695.5]
  - - [4096, 4096, 1, 1024]
    - [654, 78719.2]
  - - [6144, 4096, 1, 1024]
    - [668, 89347.0]
  - - [4096, 6144, 1, 1024]
    - [668, 89396.7]
  - - [6144, 6144, 1, 1024]
    - [668, 94026.0]
  - - [8192, 4096, 1, 1024]
    - [603, 88736.2]
  - - [12288, 4096, 1, 1024]
    - [603, 88997.4]
  - - [16384, 4096, 1, 1024]
    - [603, 89042.9]
  - - [20480, 4096, 1, 1024]
    - [603, 89587.9]
  - - [24576, 4096, 1, 1024]
    - [603, 89168.7]
  - - [32768, 4096, 1, 1024]
    - [603, 89883.4]
  - - [8192, 6144, 1, 1024]
    - [603, 89906.2]
  - - [12288, 6144, 1, 1024]
    - [603, 95867.8]
  - - [16384, 6144, 1, 1024]
    - [603, 93157.2]
  - - [20480, 6144, 1, 1024]
    - [603, 94738.3]
  - - [24576, 6144, 1, 1024]
    - [603, 96249.4]
  - - [32768, 6144, 1, 1024]
    - [603, 93638.2]
  - - [3, 8192, 1, 1024]
    - [669, 2343.46]
  - - [3, 8192, 1, 4096]
    - [670, 3079.97]
  - - [3, 8192, 1, 16384]
    - [671, 3753.62]
  - - [3, 12288, 1, 1024]
    - [672, 2519.18]
  - - [3, 12288, 1, 4096]
    - [672, 3280.16]
  - - [3, 12288, 1, 16384]
    - [672, 3964.72]
  - - [3, 16384, 1, 1024]
    - [669, 2449.02]
  - - [3, 16384, 1, 4096]
    - [670, 3438.82]
  - - [3, 16384, 1, 16384]
    - [673, 3831.77]
  - - [3, 20480, 1, 1024]
    - [669, 2836.41]
  - - [3, 20480, 1, 4096]
    - [669, 3695.64]
  - - [3, 20480, 1, 16384]
    - [670, 4071.98]
  - - [3, 24576, 1, 1024]
    - [674, 2660.6]
  - - [3, 24576, 1, 4096]
    - [670, 3554.63]
  - - [3, 24576, 1, 16384]
    - [672, 3986.38]
  - - [3, 32768, 1, 1024]
    - [675, 2654.45]
  - - [3, 32768, 1, 4096]
    - [670, 3627.59]
  - - [3, 32768, 1, 16384]
    - [670, 4003.54]
  - - [16, 8192, 1, 1024]
    - [676, 11992.6]
  - - [16, 8192, 1, 4096]
    - [677, 15747.5]
  - - [16, 8192, 1, 16384]
    - [678, 19804.2]
  - - [32, 8192, 1, 1024]
    - [679, 21901.9]
  - - [32, 8192, 1, 4096]
    - [679, 29593.1]
  - - [32, 8192, 1, 16384]
    - [680, 32972.3]
  - - [16, 12288, 1, 1024]
    - [681, 12940.5]
  - - [16, 12288, 1, 4096]
    - [681, 17665.3]
  - - [16, 12288, 1, 16384]
    - [681, 21428.2]
  - - [32, 12288, 1, 1024]
    - [682, 25048.4]
  - - [32, 12288, 1, 4096]
    - [682, 33149.8]
  - - [32, 12288, 1, 16384]
    - [682, 38071.5]
  - - [16, 16384, 1, 1024]
    - [683, 12904.4]
  - - [16, 16384, 1, 4096]
    - [684, 17043.8]
  - - [16, 16384, 1, 16384]
    - [685, 20107.0]
  - - [32, 16384, 1, 1024]
    - [679, 22572.0]
  - - [32, 16384, 1, 4096]
    - [679, 29783.9]
  - - [32, 16384, 1, 16384]
    - [679, 33540.8]
  - - [16, 20480, 1, 1024]
    - [686, 14885.4]
  - - [16, 20480, 1, 4096]
    - [687, 19581.3]
  - - [16, 20480, 1, 16384]
    - [688, 21038.6]
  - - [32, 20480, 1, 1024]
    - [689, 26839.7]
  - - [32, 20480, 1, 4096]
    - [690, 34197.9]
  - - [32, 20480, 1, 16384]
    - [690, 38888.8]
  - - [16, 24576, 1, 1024]
    - [686, 15225.0]
  - - [16, 24576, 1, 4096]
    - [687, 18818.8]
  - - [16, 24576, 1, 16384]
    - [681, 21349.5]
  - - [32, 24576, 1, 1024]
    - [689, 25964.7]
  - - [32, 24576, 1, 4096]
    - [691, 33072.0]
  - - [32, 24576, 1, 16384]
    - [682, 38099.1]
  - - [16, 32768, 1, 1024]
    - [686, 15315.2]
  - - [16, 32768, 1, 4096]
    - [687, 18363.8]
  - - [16, 32768, 1, 16384]
    - [688, 21232.8]
  - - [32, 32768, 1, 256]
    - [692, 19026.5]
  - - [32, 32768, 1, 1024]
    - [689, 26123.4]
  - - [32, 32768, 1, 4096]
    - [693, 31563.2]
  - - [64, 8192, 1, 1024]
    - [694, 37310.7]
  - - [64, 8192, 1, 4096]
    - [695, 47991.6]
  - - [64, 8192, 1, 16384]
    - [695, 53700.4]
  - - [96, 8192, 1, 1024]
    - [696, 43458.0]
  - - [96, 8192, 1, 4096]
    - [697, 57344.3]
  - - [96, 8192, 1, 16384]
    - [698, 63078.9]
  - - [64, 12288, 1, 1024]
    - [699, 39909.1]
  - - [64, 12288, 1, 4096]
    - [700, 50806.4]
  - - [64, 12288, 1, 16384]
    - [700, 54858.1]
  - - [96, 12288, 1, 256]
    - [633, 30769.5]
  - - [96, 12288, 1, 1024]
    - [701, 39964.8]
  - - [96, 12288, 1, 4096]
    - [702, 59403.5]
  - - [64, 16384, 1, 256]
    - [703, 27395.3]
  - - [64, 16384, 1, 1024]
    - [695, 36452.5]
  - - [64, 16384, 1, 4096]
    - [695, 48658.7]
  - - [96, 16384, 1, 256]
    - [704, 27621.4]
  - - [96, 16384, 1, 1024]
    - [705, 46952.5]
  - - [96, 16384, 1, 4096]
    - [705, 58906.3]
  - - [64, 20480, 1, 256]
    - [706, 31689.8]
  - - [64, 20480, 1, 1024]
    - [707, 43459.9]
  - - [64, 20480, 1, 4096]
    - [695, 58915.3]
  - - [96, 20480, 1, 256]
    - [708, 42240.5]
  - - [96, 20480, 1, 1024]
    - [697, 56992.0]
  - - [96, 20480, 1, 4096]
    - [697, 71494.2]
  - - [64, 24576, 1, 256]
    - [709, 33156.6]
  - - [64, 24576, 1, 1024]
    - [700, 41621.0]
  - - [64, 24576, 1, 4096]
    - [700, 51328.9]
  - - [96, 24576, 1, 256]
    - [710, 40204.7]
  - - [96, 24576, 1, 1024]
    - [711, 51472.5]
  - - [96, 24576, 1, 4096]
    - [712, 64448.0]
  - - [64, 32768, 1, 256]
    - [713, 33713.1]
  - - [64, 32768, 1, 1024]
    - [700, 38017.9]
  - - [64, 32768, 1, 4096]
    - [695, 49287.8]
  - - [96, 32768, 1, 256]
    - [705, 33923.8]
  - - [96, 32768, 1, 1024]
    - [705, 48447.4]
  - - [96, 32768, 1, 4096]
    - [705, 60305.6]
  - - [128, 8192, 1, 256]
    - [714, 31657.0]
  - - [128, 8192, 1, 1024]
    - [715, 48539.7]
  - - [128, 8192, 1, 4096]
    - [716, 65142.6]
  - - [192, 8192, 1, 256]
    - [717, 37134.9]
  - - [192, 8192, 1, 1024]
    - [718, 61661.8]
  - - [192, 8192, 1, 4096]
    - [718, 75342.5]
  - - [128, 12288, 1, 256]
    - [637, 39392.8]
  - - [128, 12288, 1, 1024]
    - [719, 59714.0]
  - - [128, 12288, 1, 4096]
    - [720, 72959.8]
  - - [192, 12288, 1, 256]
    - [641, 44537.2]
  - - [192, 12288, 1, 1024]
    - [641, 71219.6]
  - - [192, 12288, 1, 4096]
    - [721, 84400.6]
  - - [128, 16384, 1, 256]
    - [722, 39955.0]
  - - [128, 16384, 1, 1024]
    - [722, 59991.5]
  - - [128, 16384, 1, 4096]
    - [723, 72284.2]
  - - [192, 16384, 1, 256]
    - [724, 43599.5]
  - - [192, 16384, 1, 1024]
    - [724, 69004.4]
  - - [192, 16384, 1, 4096]
    - [725, 86049.2]
  - - [128, 20480, 1, 256]
    - [726, 47600.2]
  - - [128, 20480, 1, 1024]
    - [726, 68202.5]
  - - [128, 20480, 1, 4096]
    - [727, 84232.6]
  - - [192, 20480, 1, 256]
    - [728, 50175.6]
  - - [192, 20480, 1, 1024]
    - [728, 80840.0]
  - - [192, 20480, 1, 4096]
    - [729, 101547.0]
  - - [128, 24576, 1, 256]
    - [730, 43856.6]
  - - [128, 24576, 1, 1024]
    - [730, 66848.5]
  - - [128, 24576, 1, 4096]
    - [731, 82333.6]
  - - [192, 24576, 1, 256]
    - [732, 45043.3]
  - - [192, 24576, 1, 1024]
    - [733, 71238.6]
  - - [192, 24576, 1, 4096]
    - [734, 85463.8]
  - - [128, 32768, 1, 256]
    - [735, 39312.6]
  - - [128, 32768, 1, 1024]
    - [722, 61008.0]
  - - [128, 32768, 1, 4096]
    - [736, 73227.3]
  - - [192, 32768, 1, 256]
    - [737, 44656.1]
  - - [192, 32768, 1, 1024]
    - [738, 70896.5]
  - - [192, 32768, 1, 4096]
    - [738, 86808.1]
  - - [256, 8192, 1, 256]
    - [739, 36309.4]
  - - [256, 8192, 1, 1024]
    - [740, 61858.8]
  - - [256, 8192, 1, 4096]
    - [741, 85153.2]
  - - [384, 8192, 1, 256]
    - [742, 50392.1]
  - - [384, 8192, 1, 1024]
    - [743, 73428.3]
  - - [384, 8192, 1, 4096]
    - [743, 85580.6]
  - - [256, 12288, 1, 256]
    - [742, 51240.5]
  - - [256, 12288, 1, 1024]
    - [744, 82464.6]
  - - [256, 12288, 1, 4096]
    - [744, 98574.0]
  - - [384, 12288, 1, 256]
    - [745, 52045.9]
  - - [384, 12288, 1, 1024]
    - [745, 81923.6]
  - - [384, 12288, 1, 4096]
    - [746, 97048.9]
  - - [256, 16384, 1, 256]
    - [747, 51013.0]
  - - [256, 16384, 1, 1024]
    - [748, 81876.3]
  - - [256, 16384, 1, 4096]
    - [748, 95568.0]
  - - [384, 16384, 1, 256]
    - [743, 50385.8]
  - - [384, 16384, 1, 1024]
    - [743, 73027.8]
  - - [384, 16384, 1, 4096]
    - [743, 86190.0]
  - - [256, 20480, 1, 256]
    - [749, 55097.4]
  - - [256, 20480, 1, 1024]
    - [750, 81502.5]
  - - [256, 20480, 1, 4096]
    - [750, 99638.1]
  - - [384, 20480, 1, 256]
    - [751, 47710.9]
  - - [384, 20480, 1, 1024]
    - [752, 73944.5]
  - - [384, 20480, 1, 4096]
    - [753, 88772.4]
  - - [256, 24576, 1, 256]
    - [754, 52308.1]
  - - [256, 24576, 1, 1024]
    - [744, 83920.2]
  - - [256, 24576, 1, 4096]
    - [744, 99578.9]
  - - [384, 24576, 1, 256]
    - [755, 49599.8]
  - - [384, 24576, 1, 1024]
    - [755, 80099.6]
  - - [384, 24576, 1, 4096]
    - [756, 98551.8]
  - - [256, 32768, 1, 256]
    - [757, 51458.8]
  - - [256, 32768, 1, 1024]
    - [758, 80380.4]
  - - [256, 32768, 1, 4096]
    - [748, 95919.9]
  - - [384, 32768, 1, 256]
    - [759, 49179.9]
  - - [384, 32768, 1, 1024]
    - [759, 79025.4]
  - - [384, 32768, 1, 4096]
    - [752, 94538.3]
  - - [512, 8192, 1, 256]
    - [654, 49919.4]
  - - [512, 8192, 1, 1024]
    - [654, 77264.4]
  - - [512, 8192, 1, 4096]
    - [655, 93792.1]
  - - [640, 8192, 1, 256]
    - [760, 52031.9]
  - - [640, 8192, 1, 1024]
    - [760, 82380.1]
  - - [640, 8192, 1, 4096]
    - [761, 87550.7]
  - - [768, 8192, 1, 256]
    - [656, 51260.3]
  - - [768, 8192, 1, 1024]
    - [659, 79687.8]
  - - [768, 8192, 1, 4096]
    - [659, 97685.6]
  - - [512, 12288, 1, 256]
    - [656, 51045.3]
  - - [512, 12288, 1, 1024]
    - [659, 79925.6]
  - - [512, 12288, 1, 4096]
    - [659, 97624.8]
  - - [640, 12288, 1, 256]
    - [762, 53183.5]
  - - [640, 12288, 1, 1024]
    - [763, 76217.3]
  - - [640, 12288, 1, 4096]
    - [763, 91225.7]
  - - [768, 12288, 1, 256]
    - [764, 53937.5]
  - - [768, 12288, 1, 1024]
    - [764, 81417.2]
  - - [768, 12288, 1, 4096]
    - [659, 97801.1]
  - - [512, 16384, 1, 256]
    - [765, 54835.6]
  - - [512, 16384, 1, 1024]
    - [655, 77743.7]
  - - [512, 16384, 1, 4096]
    - [655, 94349.7]
  - - [640, 16384, 1, 256]
    - [762, 56721.8]
  - - [640, 16384, 1, 1024]
    - [657, 72081.1]
  - - [640, 16384, 1, 4096]
    - [761, 88457.9]
  - - [768, 16384, 1, 256]
    - [764, 57973.3]
  - - [768, 16384, 1, 1024]
    - [764, 84954.0]
  - - [768, 16384, 1, 4096]
    - [764, 98515.1]
  - - [512, 20480, 1, 256]
    - [764, 59053.1]
  - - [512, 20480, 1, 1024]
    - [764, 85518.2]
  - - [512, 20480, 1, 4096]
    - [766, 101101.0]
  - - [640, 20480, 1, 256]
    - [762, 56729.4]
  - - [640, 20480, 1, 1024]
    - [657, 87643.5]
  - - [640, 20480, 1, 4096]
    - [657, 101348.0]
  - - [768, 20480, 1, 1024]
    - [764, 88349.7]
  - - [512, 24576, 1, 256]
    - [764, 57906.4]
  - - [512, 24576, 1, 1024]
    - [764, 83308.9]
  - - [512, 24576, 1, 4096]
    - [659, 97996.2]
  - - [640, 24576, 1, 1024]
    - [657, 85422.8]
  - - [768, 24576, 1, 1024]
    - [767, 81936.2]
  - - [512, 32768, 1, 1024]
    - [764, 81648.6]
  - - [640, 32768, 1, 1024]
    - [657, 83944.8]
  - - [768, 32768, 1, 1024]
    - [764, 87697.6]
  - - [1024, 8192, 1, 256]
    - [768, 54690.0]
  - - [1024, 8192, 1, 1024]
    - [663, 78060.9]
  - - [1024, 8192, 1, 4096]
    - [769, 93880.4]
  - - [1536, 8192, 1, 256]
    - [666, 58019.3]
  - - [1536, 8192, 1, 1024]
    - [666, 88774.3]
  - - [1536, 8192, 1, 4096]
    - [666, 99384.8]
  - - [1024, 12288, 1, 256]
    - [666, 57533.2]
  - - [1024, 12288, 1, 1024]
    - [666, 87424.4]
  - - [1024, 12288, 1, 4096]
    - [666, 98792.1]
  - - [1536, 12288, 1, 1024]
    - [667, 85224.3]
  - - [1024, 16384, 1, 1024]
    - [666, 83494.0]
  - - [1536, 16384, 1, 1024]
    - [666, 89521.1]
  - - [1024, 20480, 1, 1024]
    - [666, 90679.5]
  - - [1536, 20480, 1, 1024]
    - [666, 92030.3]
  - - [1024, 24576, 1, 1024]
    - [666, 88484.7]
  - - [1536, 24576, 1, 1024]
    - [770, 91107.2]
  - - [1024, 32768, 1, 1024]
    - [666, 90794.2]
  - - [1536, 32768, 1, 1024]
    - [666, 90888.2]
  - - [2048, 8192, 1, 1024]
    - [668, 87148.2]
  - - [3072, 8192, 1, 1024]
    - [668, 88963.5]
  - - [2048, 12288, 1, 1024]
    - [668, 87965.2]
  - - [3072, 12288, 1, 1024]
    - [668, 94440.4]
  - - [2048, 16384, 1, 1024]
    - [668, 89235.2]
  - - [3072, 16384, 1, 1024]
    - [668, 91525.7]
  - - [2048, 20480, 1, 1024]
    - [668, 90159.0]
  - - [3072, 20480, 1, 1024]
    - [668, 93735.4]
  - - [2048, 24576, 1, 1024]
    - [668, 91020.2]
  - - [3072, 24576, 1, 1024]
    - [668, 95817.8]
  - - [2048, 32768, 1, 1024]
    - [668, 90807.2]
  - - [3072, 32768, 1, 1024]
    - [668, 95018.1]
  - - [4096, 8192, 1, 1024]
    - [668, 85458.0]
  - - [6144, 8192, 1, 1024]
    - [668, 90199.5]
  - - [4096, 12288, 1, 1024]
    - [668, 91259.2]
  - - [6144, 12288, 1, 1024]
    - [668, 95010.4]
  - - [4096, 16384, 1, 1024]
    - [668, 91171.8]
  - - [6144, 16384, 1, 1024]
    - [668, 94703.1]
  - - [4096, 20480, 1, 1024]
    - [668, 90608.9]
  - - [6144, 20480, 1, 1024]
    - [771, 89701.0]
  - - [4096, 24576, 1, 1024]
    - [668, 91892.0]
  - - [6144, 24576, 1, 1024]
    - [668, 96155.8]
  - - [4096, 32768, 1, 1024]
    - [668, 92138.6]
  - - [6144, 32768, 1, 1024]
    - [668, 96579.6]
  - - [8192, 8192, 1, 1024]
    - [668, 91534.6]
  - - [12288, 8192, 1, 1024]
    - [668, 94039.7]
  - - [16384, 8192, 1, 1024]
    - [668, 93251.4]
  - - [20480, 8192, 1, 1024]
    - [668, 94118.6]
  - - [24576, 8192, 1, 1024]
    - [668, 95355.5]
  - - [32768, 8192, 1, 1024]
    - [668, 94688.7]
  - - [8192, 12288, 1, 1024]
    - [668, 95425.4]
  - - [12288, 12288, 1, 1024]
    - [668, 96203.8]
  - - [16384, 12288, 1, 1024]
    - [668, 96485.4]
  - - [20480, 12288, 1, 1024]
    - [668, 96629.7]
  - - [8192, 16384, 1, 1024]
    - [668, 94700.5]
  - - [12288, 16384, 1, 1024]
    - [668, 96615.0]
  - - [16384, 16384, 1, 1024]
    - [668, 95593.7]
  - - [8192, 20480, 1, 1024]
    - [668, 95181.6]
  - - [12288, 20480, 1, 1024]
    - [668, 96864.9]
  - - [8192, 24576, 1, 1024]
    - [668, 97160.0]
  - - [8192, 32768, 1, 1024]
    - [668, 96617.5]
- null
- null
- DeviceEfficiency
- GridBased
