projects/hipblaslt/library/src/amd_detail/rocblaslt/src/Tensile/Logic/asm_full/aquavanjaram/gfx942_80cu/GridBased/aquavanjaram_Cijk_Alik_Bljk_F8NBS_STA_BH_Bias_HAS_SAB_SAV_UserArgs.yaml
- {MinimumRequiredVersion: 4.33.0}
- aquavanjaram
- {Architecture: gfx942, CUCount: 80}
- [Device 0049, Device 0050]
    SolutionIndex: 0
    SolutionNameMin: Cijk_Alik_Bljk_F8NBS_STA_BH_Bias_HAS_SAB_SAV_UserArgs_MT64x32x256_MI16x16x1_SN_LDSB0_GRVWB16_GSU1_GSUC0_GSUWGMRR0_K1_LBSPPB512_MIWT1_2_NLCA4_SU8_SUM0_SUS256_SVW1_VWA1_VWB2_WG64_4_1_WGM1_WGMXCC8_WGMXCCGn1
    SolutionIndex: 1
    SolutionNameMin: Cijk_Alik_Bljk_F8NBS_STA_BH_Bias_HAS_SAB_SAV_UserArgs_MT64x32x256_MI16x16x1_SN_LDSB0_GRVWB16_GSU1_GSUC0_GSUWGMRR0_K1_LBSPPB512_MIWT2_2_NLCA4_SU0_SUM0_SUS256_SVW2_VWA2_VWB2_WG32_4_1_WGM1_WGMXCC1_WGMXCCGn1
    SolutionIndex: 2
    SolutionNameMin: Cijk_Alik_Bljk_F8NBS_STA_BH_Bias_HAS_SAB_SAV_UserArgs_MT64x32x256_MI16x16x1_SN_LDSB0_GRVWB16_GSU1_GSUC0_GSUWGMRR0_K1_LBSPPB512_MIWT2_2_NLCA4_SU8_SUM0_SUS256_SVW2_VWA2_VWB2_WG32_4_1_WGM1_WGMXCC1_WGMXCCGn1
    SolutionIndex: 3
    SolutionNameMin: Cijk_Alik_Bljk_F8NBS_STA_BH_Bias_HAS_SAB_SAV_UserArgs_MT64x32x256_MI16x16x1_SN_LDSB0_GRVWB16_GSU1_GSUC0_GSUWGMRR0_K1_LBSPPB512_MIWT2_2_NLCA4_SU8_SUM0_SUS256_SVW2_VWA2_VWB2_WG32_4_1_WGM1_WGMXCC8_WGMXCCGn1
    SolutionIndex: 4
    SolutionNameMin: Cijk_Alik_Bljk_F8NBS_STA_BH_Bias_HAS_SAB_SAV_UserArgs_MT64x32x256_MI16x16x1_SN_LDSB1_GRVWB16_GSU1_GSUC0_GSUWGMRR0_K1_LBSPPB512_MIWT2_2_NLCA4_SU0_SUM0_SUS256_SVW2_VWA2_VWB2_WG32_4_1_WGM1_WGMXCC8_WGMXCCGn1
    SolutionIndex: 5
    SolutionNameMin: Cijk_Alik_Bljk_F8NBS_STA_BH_Bias_HAS_SAB_SAV_UserArgs_MT64x32x256_MI16x16x1_SN_LDSB1_GRVWB16_GSU1_GSUC0_GSUWGMRR0_K1_LBSPPB512_MIWT2_2_NLCA4_SU8_SUM0_SUS256_SVW2_VWA2_VWB2_WG32_4_1_WGM1_WGMXCC8_WGMXCCGn1
    SolutionIndex: 6
    SolutionNameMin: Cijk_Alik_Bljk_F8NBS_STA_BH_Bias_HAS_SAB_SAV_UserArgs_MT64x16x512_MI16x16x1_SN_LDSB0_GRVWB16_GSU1_GSUC0_GSUWGMRR0_K1_LBSPPB512_MIWT1_1_NLCA8_SU0_SUM0_SUS512_SVW1_VWA1_VWB1_WG64_4_1_WGM1_WGMXCC1_WGMXCCGn1
    SolutionIndex: 7
    SolutionNameMin: Cijk_Alik_Bljk_F8NBS_STA_BH_Bias_HAS_SAB_SAV_UserArgs_MT64x16x512_MI16x16x1_SN_LDSB0_GRVWB16_GSU1_GSUC0_GSUWGMRR0_K1_LBSPPB512_MIWT1_1_NLCA8_SU16_SUM0_SUS512_SVW1_VWA1_VWB1_WG64_4_1_WGM1_WGMXCC1_WGMXCCGn1
    SolutionIndex: 8
    SolutionNameMin: Cijk_Alik_Bljk_F8NBS_STA_BH_Bias_HAS_SAB_SAV_UserArgs_MT64x16x512_MI16x16x1_SN_LDSB0_GRVWB16_GSU4_GSUC0_GSUWGMRR0_K1_LBSPPB512_MIWT1_1_NLCA8_SU0_SUM0_SUS512_SVW1_VWA1_VWB1_WG64_4_1_WGM1_WGMXCC1_WGMXCCGn1
    SolutionIndex: 9
    SolutionNameMin: Cijk_Alik_Bljk_F8NBS_STA_BH_Bias_HAS_SAB_SAV_UserArgs_MT64x16x512_MI16x16x1_SN_LDSB0_GRVWB16_GSU4_GSUC0_GSUWGMRR0_K1_LBSPPB512_MIWT1_1_NLCA8_SU16_SUM0_SUS512_SVW1_VWA1_VWB1_WG64_4_1_WGM1_WGMXCC1_WGMXCCGn1
    SolutionIndex: 10
    SolutionNameMin: Cijk_Alik_Bljk_F8NBS_STA_BH_Bias_HAS_SAB_SAV_UserArgs_MT64x16x512_MI16x16x1_SN_LDSB0_GRVWB16_GSU1_GSUC0_GSUWGMRR0_K1_LBSPPB512_MIWT2_1_NLCA8_SU0_SUM0_SUS512_SVW2_VWA2_VWB1_WG32_4_1_WGM1_WGMXCC1_WGMXCCGn1
    SolutionIndex: 11
    SolutionNameMin: Cijk_Alik_Bljk_F8NBS_STA_BH_Bias_HAS_SAB_SAV_UserArgs_MT64x32x512_MI16x16x1_SN_LDSB1_GRVWB16_GSU1_GSUC0_GSUWGMRR0_K1_LBSPPB1024_MIWT2_2_NLCA8_SU0_SUM0_SUS512_SVW2_VWA2_VWB2_WG32_4_1_WGM1_WGMXCC1_WGMXCCGn1
    SolutionIndex: 12
    SolutionNameMin: Cijk_Alik_Bljk_F8NBS_STA_BH_Bias_HAS_SAB_SAV_UserArgs_MT64x32x512_MI16x16x1_SN_LDSB1_GRVWB16_GSU1_GSUC0_GSUWGMRR0_K1_LBSPPB1024_MIWT2_2_NLCA8_SU8_SUM0_SUS512_SVW2_VWA2_VWB2_WG32_4_1_WGM1_WGMXCC1_WGMXCCGn1
    SolutionIndex: 13
    SolutionNameMin: Cijk_Alik_Bljk_F8NBS_STA_BH_Bias_HAS_SAB_SAV_UserArgs_MT64x32x512_MI16x16x1_SN_LDSB1_GRVWB16_GSU1_GSUC0_GSUWGMRR0_K1_LBSPPB1024_MIWT2_2_NLCA8_SU16_SUM0_SUS512_SVW2_VWA2_VWB2_WG32_4_1_WGM1_WGMXCC1_WGMXCCGn1
    SolutionIndex: 14
    SolutionNameMin: Cijk_Alik_Bljk_F8NBS_STA_BH_Bias_HAS_SAB_SAV_UserArgs_MT64x16x512_MI16x16x1_SN_LDSB1_GRVWB16_GSU1_GSUC0_GSUWGMRR0_K1_LBSPPB512_MIWT1_1_NLCA8_SU0_SUM0_SUS512_SVW1_VWA1_VWB1_WG64_4_1_WGM1_WGMXCC1_WGMXCCGn1
    SolutionIndex: 15
    SolutionNameMin: Cijk_Alik_Bljk_F8NBS_STA_BH_Bias_HAS_SAB_SAV_UserArgs_MT64x16x512_MI16x16x1_SN_LDSB1_GRVWB16_GSU1_GSUC0_GSUWGMRR0_K1_LBSPPB512_MIWT2_1_NLCA8_SU0_SUM0_SUS512_SVW2_VWA2_VWB1_WG32_4_1_WGM1_WGMXCC1_WGMXCCGn1
    SolutionIndex: 16
    SolutionNameMin: Cijk_Alik_Bljk_F8NBS_STA_BH_Bias_HAS_SAB_SAV_UserArgs_MT64x16x512_MI16x16x1_SN_LDSB1_GRVWB16_GSU1_GSUC0_GSUWGMRR0_K1_LBSPPB512_MIWT2_1_NLCA8_SU0_SUM0_SUS512_SVW2_VWA2_VWB1_WG32_4_1_WGM1_WGMXCC8_WGMXCCGn1
    SolutionIndex: 17
    SolutionNameMin: Cijk_Alik_Bljk_F8NBS_STA_BH_Bias_HAS_SAB_SAV_UserArgs_MT32x16x1024_MI16x16x1_SN_LDSB1_GRVWB16_GSU1_GSUC0_GSUWGMRR0_K1_LBSPPB1024_MIWT1_1_NLCA16_SU8_SUM0_SUS1024_SVW1_VWA1_VWB1_WG32_4_1_WGM1_WGMXCC1_WGMXCCGn1
    SolutionIndex: 18
    SolutionNameMin: Cijk_Alik_Bljk_F8NBS_STA_BH_Bias_HAS_SAB_SAV_UserArgs_MT32x16x1024_MI16x16x1_SN_LDSB1_GRVWB16_GSU1_GSUC0_GSUWGMRR0_K1_LBSPPB1024_MIWT1_1_NLCA16_SU16_SUM0_SUS1024_SVW1_VWA1_VWB1_WG32_4_1_WGM1_WGMXCC1_WGMXCCGn1
    SolutionIndex: 19
    SolutionNameMin: Cijk_Alik_Bljk_F8NBS_STA_BH_Bias_HAS_SAB_SAV_UserArgs_MT32x16x512_MI16x16x1_SN_LDSB1_GRVWB16_GSU4_GSUC0_GSUWGMRR0_K1_LBSPPB512_MIWT1_1_NLCA8_SU0_SUM0_SUS512_SVW1_VWA1_VWB1_WG32_4_1_WGM1_WGMXCC1_WGMXCCGn1
    SolutionIndex: 20
    SolutionNameMin: Cijk_Alik_Bljk_F8NBS_STA_BH_Bias_HAS_SAB_SAV_UserArgs_MT128x64x256_MI16x16x1_SN_LDSB1_GRVWB16_GSU1_GSUC0_GSUWGMRR0_K1_LBSPPB1024_MIWT4_4_NEPBS16_NLCA4_SU0_SUM0_SUS256_SVW8_VWA2_VWB4_WG32_4_1_WGM1_WGMXCC1_WGMXCCGn1
    SolutionIndex: 21
    SolutionNameMin: Cijk_Alik_Bljk_F8NBS_STA_BH_Bias_HAS_SAB_SAV_UserArgs_MT128x64x256_MI16x16x1_SN_LDSB1_GRVWB16_GSU1_GSUC0_GSUWGMRR0_K1_LBSPPB1024_MIWT4_4_NEPBS16_NLCA4_SU8_SUM0_SUS256_SVW8_VWA2_VWB4_WG32_4_1_WGM1_WGMXCC1_WGMXCCGn1
    SolutionIndex: 22
    SolutionNameMin: Cijk_Alik_Bljk_F8NBS_STA_BH_Bias_HAS_SAB_SAV_UserArgs_MT128x128x256_MI16x16x1_SN_LDSB1_GRVWB16_GSU1_GSUC0_GSUWGMRR0_K1_LBSPPB2048_MIWT2_8_NEPBS0_NLCA4_SU0_SUM0_SUS256_SVW8_VWA2_VWB8_WG64_4_1_WGM8_WGMXCC1_WGMXCCGn1
    SolutionIndex: 23
    SolutionNameMin: Cijk_Alik_Bljk_F8NBS_STA_BH_Bias_HAS_SAB_SAV_UserArgs_MT128x64x256_MI16x16x1_SN_LDSB1_GRVWB16_GSU1_GSUC0_GSUWGMRR0_K1_LBSPPB1024_MIWT4_4_NEPBS16_NLCA4_SU0_SUM0_SUS256_SVW8_VWA2_VWB4_WG32_4_1_WGM1_WGMXCC8_WGMXCCGn1
    SolutionIndex: 24
    SolutionNameMin: Cijk_Alik_Bljk_F8NBS_STA_BH_Bias_HAS_SAB_SAV_UserArgs_MT128x64x256_MI16x16x1_SN_LDSB1_GRVWB16_GSU1_GSUC0_GSUWGMRR0_K1_LBSPPB1024_MIWT4_4_NEPBS16_NLCA4_SU0_SUM0_SUS256_SVW8_VWA2_VWB4_WG32_4_1_WGM8_WGMXCC1_WGMXCCGn1
    SolutionIndex: 25
    SolutionNameMin: Cijk_Alik_Bljk_F8NBS_STA_BH_Bias_HAS_SAB_SAV_UserArgs_MT128x128x256_MI16x16x1_SN_LDSB1_GRVWB16_GSU1_GSUC0_GSUWGMRR0_K1_LBSPPB2048_MIWT2_8_NEPBS0_NLCA4_SU0_SUM0_SUS256_SVW8_VWA2_VWB8_WG64_4_1_WGM1_WGMXCC8_WGMXCCGn1
    SolutionIndex: 26
    SolutionNameMin: Cijk_Alik_Bljk_F8NBS_STA_BH_Bias_HAS_SAB_SAV_UserArgs_MT128x224x128_MI16x16x1_SN_LDSB1_GRVWB16_GSU1_GSUC0_GSUWGMRR0_K1_LBSPPB256_MIWT2_14_NEPBS0_NLCA2_SU8_SUM0_SUS256_SVW8_VWA2_VWB2_WG64_4_1_WGM1_WGMXCC1_WGMXCCGn1
    SolutionIndex: 27
    SolutionNameMin: Cijk_Alik_Bljk_F8NBS_STA_BH_Bias_HAS_SAB_SAV_UserArgs_MT128x224x128_MI16x16x1_SN_LDSB1_GRVWB16_GSU1_GSUC0_GSUWGMRR0_K1_LBSPPB256_MIWT2_14_NEPBS0_NLCA2_SU8_SUM0_SUS256_SVW8_VWA2_VWB2_WG64_4_1_WGM6_WGMXCC1_WGMXCCGn1
    SolutionIndex: 28
    SolutionNameMin: Cijk_Alik_Bljk_F8NBS_STA_BH_Bias_HAS_SAB_SAV_UserArgs_MT128x224x128_MI16x16x1_SN_LDSB1_GRVWB16_GSU1_GSUC0_GSUWGMRR0_K1_LBSPPB256_MIWT2_14_NEPBS16_NLCA2_SU8_SUM0_SUS256_SVW8_VWA2_VWB2_WG64_4_1_WGM6_WGMXCC1_WGMXCCGn1
    SolutionIndex: 29
    SolutionNameMin: Cijk_Alik_Bljk_F8NBS_STA_BH_Bias_HAS_SAB_SAV_UserArgs_MT256x128x128_MI16x16x1_SN_LDSB1_GRVWB16_GSU1_GSUC0_GSUWGMRR0_K1_LBSPPB1024_MIWT4_8_NEPBS16_NLCA2_SU8_SUM0_SUS128_SVW8_VWA2_VWB8_WG64_4_1_WGM1_WGMXCC8_WGMXCCGn1
    SolutionIndex: 30
    SolutionNameMin: Cijk_Alik_Bljk_F8NBS_STA_BH_Bias_HAS_SAB_SAV_UserArgs_MT256x64x128_MI16x16x1_SN_LDSB0_GRVWB16_GSU1_GSUC0_GSUWGMRR0_K1_LBSPPB512_MIWT8_4_NEPBS16_NLCA2_SU0_SUM0_SUS128_SVW8_VWA2_VWB4_WG32_4_1_WGM1_WGMXCC1_WGMXCCGn1
    SolutionIndex: 31
    SolutionNameMin: Cijk_Alik_Bljk_F8NBS_STA_BH_Bias_HAS_SAB_SAV_UserArgs_MT256x128x128_MI16x16x1_SN_LDSB1_GRVWB16_GSU1_GSUC0_GSUWGMRR0_K1_LBSPPB1024_MIWT4_8_NEPBS0_NLCA2_SU0_SUM0_SUS128_SVW8_VWA2_VWB8_WG64_4_1_WGM1_WGMXCC8_WGMXCCGn1
    SolutionIndex: 32
    SolutionNameMin: Cijk_Alik_Bljk_F8NBS_STA_BH_Bias_HAS_SAB_SAV_UserArgs_MT256x128x128_MI16x16x1_SN_LDSB1_GRVWB16_GSU1_GSUC0_GSUWGMRR0_K1_LBSPPB1024_MIWT4_8_NEPBS16_NLCA2_SU8_SUM0_SUS256_SVW8_VWA2_VWB8_WG64_4_1_WGM8_WGMXCC1_WGMXCCGn1
    SolutionIndex: 33
    SolutionNameMin: Cijk_Alik_Bljk_F8NBS_STA_BH_Bias_HAS_SAB_SAV_UserArgs_MT256x192x128_MI16x16x1_SN_LDSB0_GRVWB16_GSU1_GSUC0_GSUWGMRR0_K1_LBSPPB512_MIWT4_12_NEPBS16_NLCA2_SU8_SUM0_SUS256_SVW8_VWA2_VWB4_WG64_4_1_WGM6_WGMXCC1_WGMXCCGn1
    SolutionIndex: 34
    SolutionNameMin: Cijk_Alik_Bljk_F8NBS_STA_BH_Bias_HAS_SAB_SAV_UserArgs_MT256x192x128_MI16x16x1_SN_LDSB0_GRVWB16_GSU1_GSUC0_GSUWGMRR0_K1_LBSPPB512_MIWT4_12_NEPBS0_NLCA2_SU0_SUM0_SUS128_SVW8_VWA2_VWB4_WG64_4_1_WGM8_WGMXCC1_WGMXCCGn1
    SolutionIndex: 35
    SolutionNameMin: Cijk_Alik_Bljk_F8NBS_STA_BH_Bias_HAS_SAB_SAV_UserArgs_MT256x192x128_MI16x16x1_SN_LDSB0_GRVWB16_GSU1_GSUC0_GSUWGMRR0_K1_LBSPPB512_MIWT4_12_NEPBS16_NLCA2_SU0_SUM0_SUS128_SVW8_VWA2_VWB4_WG64_4_1_WGM8_WGMXCC1_WGMXCCGn1
    SolutionIndex: 36
    SolutionNameMin: Cijk_Alik_Bljk_F8NBS_STA_BH_Bias_HAS_SAB_SAV_UserArgs_MT256x192x128_MI16x16x1_SN_LDSB0_GRVWB16_GSU1_GSUC0_GSUWGMRR0_K1_LBSPPB512_MIWT4_12_NEPBS16_NLCA2_SU0_SUM0_SUS128_SVW8_VWA2_VWB4_WG64_4_1_WGM6_WGMXCC1_WGMXCCGn1
    SolutionIndex: 37
    SolutionNameMin: Cijk_Alik_Bljk_F8NBS_STA_BH_Bias_HAS_SAB_SAV_UserArgs_MT256x192x128_MI16x16x1_SN_LDSB0_GRVWB16_GSU1_GSUC0_GSUWGMRR0_K1_LBSPPB512_MIWT4_12_NEPBS16_NLCA2_SU8_SUM0_SUS128_SVW8_VWA2_VWB4_WG64_4_1_WGM1_WGMXCC8_WGMXCCGn1
    SolutionIndex: 38
    SolutionNameMin: Cijk_Alik_Bljk_F8NBS_STA_BH_Bias_HAS_SAB_SAV_UserArgs_MT256x192x128_MI16x16x1_SN_LDSB0_GRVWB16_GSU1_GSUC0_GSUWGMRR0_K1_LBSPPB512_MIWT4_12_NEPBS16_NLCA2_SU0_SUM0_SUS128_SVW8_VWA2_VWB4_WG64_4_1_WGM1_WGMXCC8_WGMXCCGn1
    SolutionIndex: 39
    SolutionNameMin: Cijk_Alik_Bljk_F8NBS_STA_BH_Bias_HAS_SAB_SAV_UserArgs_MT256x224x128_MI16x16x1_SN_LDSB0_GRVWB16_GSU1_GSUC0_GSUWGMRR0_K1_LBSPPB256_MIWT4_14_NEPBS16_NLCA2_SU8_SUM0_SUS256_SVW8_VWA2_VWB2_WG64_4_1_WGM6_WGMXCC1_WGMXCCGn1
    SolutionIndex: 40
    SolutionNameMin: Cijk_Alik_Bljk_F8NBS_STA_BH_Bias_HAS_SAB_SAV_UserArgs_MT256x224x128_MI16x16x1_SN_LDSB0_GRVWB16_GSU1_GSUC0_GSUWGMRR0_K1_LBSPPB256_MIWT4_14_NEPBS16_NLCA2_SU0_SUM0_SUS128_SVW8_VWA2_VWB2_WG64_4_1_WGM8_WGMXCC1_WGMXCCGn1
    SolutionIndex: 41
    SolutionNameMin: Cijk_Alik_Bljk_F8NBS_STA_BH_Bias_HAS_SAB_SAV_UserArgs_MT256x224x128_MI16x16x1_SN_LDSB0_GRVWB16_GSU1_GSUC0_GSUWGMRR0_K1_LBSPPB256_MIWT4_14_NEPBS16_NLCA2_SU0_SUM0_SUS128_SVW8_VWA2_VWB2_WG64_4_1_WGM1_WGMXCC8_WGMXCCGn1
    SolutionIndex: 42
    SolutionNameMin: Cijk_Alik_Bljk_F8NBS_STA_BH_Bias_HAS_SAB_SAV_UserArgs_MT256x64x128_MI16x16x1_SN_LDSB0_GRVWB16_GSU1_GSUC0_GSUWGMRR0_K1_LBSPPB512_MIWT4_4_NEPBS16_NLCA2_SU8_SUM0_SUS128_SVW8_VWA2_VWB4_WG64_4_1_WGM1_WGMXCC1_WGMXCCGn1
    SolutionIndex: 43
    SolutionNameMin: Cijk_Alik_Bljk_F8NBS_STA_BH_Bias_HAS_SAB_SAV_UserArgs_MT256x192x128_MI16x16x1_SN_LDSB0_GRVWB16_GSU1_GSUC0_GSUWGMRR0_K1_LBSPPB512_MIWT4_12_NEPBS16_NLCA2_SU8_SUM0_SUS256_SVW8_VWA2_VWB4_WG64_4_1_WGM1_WGMXCC8_WGMXCCGn1
    SolutionIndex: 44
    SolutionNameMin: Cijk_Alik_Bljk_F8NBS_STA_BH_Bias_HAS_SAB_SAV_UserArgs_MT256x192x128_MI16x16x1_SN_LDSB0_GRVWB16_GSU1_GSUC0_GSUWGMRR0_K1_LBSPPB512_MIWT4_12_NEPBS0_NLCA2_SU0_SUM0_SUS128_SVW8_VWA2_VWB4_WG64_4_1_WGM1_WGMXCC8_WGMXCCGn1
    SolutionIndex: 45
    SolutionNameMin: Cijk_Alik_Bljk_F8NBS_STA_BH_Bias_HAS_SAB_SAV_UserArgs_MT256x192x128_MI16x16x1_SN_LDSB0_GRVWB16_GSU1_GSUC0_GSUWGMRR0_K1_LBSPPB512_MIWT4_12_NEPBS0_NLCA2_SU8_SUM0_SUS256_SVW8_VWA2_VWB4_WG64_4_1_WGM1_WGMXCC8_WGMXCCGn1
    SolutionIndex: 46
    SolutionNameMin: Cijk_Alik_Bljk_F8NBS_STA_BH_Bias_HAS_SAB_SAV_UserArgs_MT256x192x128_MI16x16x1_SN_LDSB0_GRVWB16_GSU1_GSUC0_GSUWGMRR0_K1_LBSPPB512_MIWT4_12_NEPBS0_NLCA2_SU8_SUM0_SUS128_SVW8_VWA2_VWB4_WG64_4_1_WGM6_WGMXCC1_WGMXCCGn1
    SolutionIndex: 47
    SolutionNameMin: Cijk_Alik_Bljk_F8NBS_STA_BH_Bias_HAS_SAB_SAV_UserArgs_MT256x64x128_MI16x16x1_SN_LDSB0_GRVWB16_GSU1_GSUC0_GSUWGMRR0_K1_LBSPPB512_MIWT4_4_NEPBS0_NLCA2_SU8_SUM0_SUS128_SVW8_VWA2_VWB4_WG64_4_1_WGM1_WGMXCC1_WGMXCCGn1
    SolutionIndex: 48
    SolutionNameMin: Cijk_Alik_Bljk_F8NBS_STA_BH_Bias_HAS_SAB_SAV_UserArgs_MT256x64x128_MI16x16x1_SN_LDSB0_GRVWB16_GSU1_GSUC0_GSUWGMRR0_K1_LBSPPB512_MIWT4_4_NEPBS0_NLCA2_SU8_SUM0_SUS256_SVW8_VWA2_VWB4_WG64_4_1_WGM1_WGMXCC1_WGMXCCGn1
    SolutionIndex: 49
    SolutionNameMin: Cijk_Alik_Bljk_F8NBS_STA_BH_Bias_HAS_SAB_SAV_UserArgs_MT256x160x64_MI16x16x1_SN_LDSB0_GRVWB8_GSU1_GSUC0_GSUWGMRR0_K1_LBSPPB128_MIWT4_10_NEPBS0_NLCA1_SU8_SUM0_SUS256_VWA4_VWB2_WG64_4_1_WGM1_WGMXCC1_WGMXCCGn1
    SolutionIndex: 50
    SolutionNameMin: Cijk_Alik_Bljk_F8NBS_STA_BH_Bias_HAS_SAB_SAV_UserArgs_MT256x160x64_MI16x16x1_SN_LDSB0_GRVWB8_GSU1_GSUC0_GSUWGMRR0_K1_LBSPPB128_MIWT4_10_NEPBS0_NLCA1_SU8_SUM0_SUS64_VWA4_VWB2_WG64_4_1_WGM1_WGMXCC1_WGMXCCGn1
    SolutionIndex: 51
    SolutionNameMin: Cijk_Alik_Bljk_F8NBS_STA_BH_Bias_HAS_SAB_SAV_UserArgs_MT256x160x64_MI16x16x1_SN_LDSB0_GRVWB8_GSU1_GSUC0_GSUWGMRR0_K1_LBSPPB128_MIWT4_10_NEPBS0_NLCA1_SU0_SUM0_SUS64_VWA4_VWB2_WG64_4_1_WGM1_WGMXCC1_WGMXCCGn1
    SolutionIndex: 52
    SolutionNameMin: Cijk_Alik_Bljk_F8NBS_STA_BH_Bias_HAS_SAB_SAV_UserArgs_MT256x160x64_MI16x16x1_SN_LDSB0_GRVWB8_GSU1_GSUC0_GSUWGMRR0_K1_LBSPPB128_MIWT4_10_NEPBS0_NLCA1_SU8_SUM0_SUS128_VWA4_VWB2_WG64_4_1_WGM1_WGMXCC1_WGMXCCGn1
    SolutionIndex: 53
    SolutionNameMin: Cijk_Alik_Bljk_F8NBS_STA_BH_Bias_HAS_SAB_SAV_UserArgs_MT256x128x128_MI16x16x1_SN_LDSB1_GRVWB16_GSU1_GSUC0_GSUWGMRR0_K1_LBSPPB1024_MIWT8_8_NEPBS0_NLCA2_SU8_SUM0_SUS128_VWA4_VWB8_WG32_4_1_WGM6_WGMXCC8_WGMXCCGn1
    SolutionIndex: 54
    SolutionNameMin: Cijk_Alik_Bljk_F8NBS_STA_BH_Bias_HAS_SAB_SAV_UserArgs_MT256x160x64_MI16x16x1_SN_LDSB0_GRVWB8_GSU1_GSUC0_GSUWGMRR0_K1_LBSPPB128_MIWT4_10_NEPBS16_NLCA1_SU0_SUM0_SUS64_VWA4_VWB2_WG64_4_1_WGM1_WGMXCC8_WGMXCCGn1
    SolutionIndex: 55
    SolutionNameMin: Cijk_Alik_Bljk_F8NBS_STA_BH_Bias_HAS_SAB_SAV_UserArgs_MT256x160x64_MI16x16x1_SN_LDSB0_GRVWB8_GSU1_GSUC0_GSUWGMRR0_K1_LBSPPB128_MIWT4_10_NEPBS0_NLCA1_SU8_SUM0_SUS64_VWA4_VWB2_WG64_4_1_WGM1_WGMXCC8_WGMXCCGn1
    SolutionIndex: 56
    SolutionNameMin: Cijk_Alik_Bljk_F8NBS_STA_BH_Bias_HAS_SAB_SAV_UserArgs_MT256x160x64_MI16x16x1_SN_LDSB0_GRVWB8_GSU1_GSUC0_GSUWGMRR0_K1_LBSPPB128_MIWT4_10_NEPBS0_NLCA1_SU0_SUM0_SUS64_VWA4_VWB2_WG64_4_1_WGM1_WGMXCC8_WGMXCCGn1
    SolutionIndex: 57
    SolutionNameMin: Cijk_Alik_Bljk_F8NBS_STA_BH_Bias_HAS_SAB_SAV_UserArgs_MT256x192x128_MI16x16x1_SN_LDSB0_GRVWB16_GSU1_GSUC0_GSUWGMRR0_K1_LBSPPB512_MIWT4_12_NEPBS0_NLCA2_SU8_SUM0_SUS128_VWA4_VWB4_WG64_4_1_WGM1_WGMXCC1_WGMXCCGn1
    SolutionIndex: 58
    SolutionNameMin: Cijk_Alik_Bljk_F8NBS_STA_BH_Bias_HAS_SAB_SAV_UserArgs_MT192x128x128_MI16x16x1_SN_LDSB1_GRVWB16_GSU1_GSUC0_GSUWGMRR0_K1_LBSPPB1024_MIWT3_8_NEPBS0_NLCA2_SU8_SUM0_SUS256_VWA3_VWB8_WG64_4_1_WGM1_WGMXCC8_WGMXCCGn1
    SolutionIndex: 59
    SolutionNameMin: Cijk_Alik_Bljk_F8NBS_STA_BH_Bias_HAS_SAB_SAV_UserArgs_MT256x128x128_MI16x16x1_SN_LDSB1_GRVWB16_GSU1_GSUC0_GSUWGMRR0_K1_LBSPPB1024_MIWT8_8_NEPBS0_NLCA2_SU0_SUM0_SUS128_VWA4_VWB8_WG32_4_1_WGM1_WGMXCC1_WGMXCCGn1
    SolutionIndex: 60
    SolutionNameMin: Cijk_Alik_Bljk_F8NBS_STA_BH_Bias_HAS_SAB_SAV_UserArgs_MT256x128x128_MI16x16x1_SN_LDSB1_GRVWB16_GSU1_GSUC0_GSUWGMRR0_K1_LBSPPB1024_MIWT8_8_NEPBS16_NLCA2_SU8_SUM0_SUS128_VWA4_VWB8_WG32_4_1_WGM1_WGMXCC1_WGMXCCGn1
    SolutionIndex: 61
    SolutionNameMin: Cijk_Alik_Bljk_F8NBS_STA_BH_Bias_HAS_SAB_SAV_UserArgs_MT256x128x128_MI16x16x1_SN_LDSB1_GRVWB16_GSU1_GSUC0_GSUWGMRR0_K1_LBSPPB1024_MIWT8_8_NEPBS0_NLCA2_SU0_SUM0_SUS128_VWA4_VWB8_WG32_4_1_WGM8_WGMXCC1_WGMXCCGn1
    SolutionIndex: 62
    SolutionNameMin: Cijk_Alik_Bljk_F8NBS_STA_BH_Bias_HAS_SAB_SAV_UserArgs_MT512x128x128_MI16x16x1_SN_LDSB0_GRVWB16_GSU1_GSUC0_GSUWGMRR0_K1_LBSPPB1024_MIWT8_8_NEPBS0_NLCA2_SU8_SUM0_SUS128_VWA4_VWB8_WG64_4_1_WGM1_WGMXCC1_WGMXCCGn1
    SolutionIndex: 63
    SolutionNameMin: Cijk_Alik_Bljk_F8NBS_STA_BH_Bias_HAS_SAB_SAV_UserArgs_MT192x128x128_MI16x16x1_SN_LDSB1_GRVWB16_GSU1_GSUC0_GSUWGMRR0_K1_LBSPPB1024_MIWT3_8_NEPBS16_NLCA2_SU0_SUM0_SUS128_VWA3_VWB8_WG64_4_1_WGM8_WGMXCC1_WGMXCCGn1
    SolutionIndex: 64
    SolutionNameMin: Cijk_Alik_Bljk_F8NBS_STA_BH_Bias_HAS_SAB_SAV_UserArgs_MT512x128x128_MI16x16x1_SN_LDSB0_GRVWB16_GSU1_GSUC0_GSUWGMRR0_K1_LBSPPB1024_MIWT8_8_NEPBS0_NLCA2_SU0_SUM0_SUS128_VWA4_VWB8_WG64_4_1_WGM1_WGMXCC1_WGMXCCGn1
    SolutionIndex: 65
    SolutionNameMin: Cijk_Alik_Bljk_F8NBS_STA_BH_Bias_HAS_SAB_SAV_UserArgs_MT192x128x128_MI16x16x1_SN_LDSB1_GRVWB16_GSU1_GSUC0_GSUWGMRR0_K1_LBSPPB1024_MIWT3_8_NEPBS0_NLCA2_SU0_SUM0_SUS128_VWA3_VWB8_WG64_4_1_WGM8_WGMXCC1_WGMXCCGn1
    SolutionIndex: 66
    SolutionNameMin: Cijk_Alik_Bljk_F8NBS_STA_BH_Bias_HAS_SAB_SAV_UserArgs_MT256x160x64_MI16x16x1_SN_LDSB0_GRVWB8_GSU1_GSUC0_GSUWGMRR0_K1_LBSPPB128_MIWT4_10_NEPBS16_NLCA1_SU0_SUM0_SUS64_VWA4_VWB2_WG64_4_1_WGM1_WGMXCC1_WGMXCCGn1
    SolutionIndex: 67
    SolutionNameMin: Cijk_Alik_Bljk_F8NBS_STA_BH_Bias_HAS_SAB_SAV_UserArgs_MT192x128x128_MI16x16x1_SN_LDSB1_GRVWB16_GSU1_GSUC0_GSUWGMRR0_K1_LBSPPB1024_MIWT3_8_NEPBS16_NLCA2_SU0_SUM0_SUS128_VWA3_VWB8_WG64_4_1_WGM1_WGMXCC8_WGMXCCGn1
    SolutionIndex: 68
    SolutionNameMin: Cijk_Alik_Bljk_F8NBS_STA_BH_Bias_HAS_SAB_SAV_UserArgs_MT512x128x128_MI16x16x1_SN_LDSB0_GRVWB16_GSU1_GSUC0_GSUWGMRR0_K1_LBSPPB1024_MIWT8_8_NEPBS0_NLCA2_SU8_SUM0_SUS256_VWA4_VWB8_WG64_4_1_WGM1_WGMXCC1_WGMXCCGn1
    SolutionIndex: 69
    SolutionNameMin: Cijk_Alik_Bljk_F8NBS_STA_BH_Bias_HAS_SAB_SAV_UserArgs_MT256x160x64_MI16x16x1_SN_LDSB0_GRVWB8_GSU1_GSUC0_GSUWGMRR0_K1_LBSPPB128_MIWT4_10_NEPBS16_NLCA1_SU8_SUM0_SUS128_VWA4_VWB2_WG64_4_1_WGM1_WGMXCC1_WGMXCCGn1
    SolutionIndex: 70
    SolutionNameMin: Cijk_Alik_Bljk_F8NBS_STA_BH_Bias_HAS_SAB_SAV_UserArgs_MT256x128x64_MI16x16x1_SN_LDSB0_GRVWB16_GSU1_GSUC0_GSUWGMRR0_K1_LBSPPB512_MIWT4_8_NEPBS0_NLCA1_SU0_SUM0_SUS64_SVW8_VWA2_VWB8_WG64_4_1_WGM1_WGMXCC8_WGMXCCGn1
    SolutionIndex: 71
    SolutionNameMin: Cijk_Alik_Bljk_F8NBS_STA_BH_Bias_HAS_SAB_SAV_UserArgs_MT256x128x64_MI16x16x1_SN_LDSB0_GRVWB16_GSU1_GSUC0_GSUWGMRR0_K1_LBSPPB512_MIWT4_8_NEPBS16_NLCA1_SU0_SUM0_SUS64_SVW8_VWA2_VWB8_WG64_4_1_WGM1_WGMXCC8_WGMXCCGn1
    SolutionIndex: 72
    SolutionNameMin: Cijk_Alik_Bljk_F8NBS_STA_BH_Bias_HAS_SAB_SAV_UserArgs_MT256x64x128_MI16x16x1_SN_LDSB0_GRVWB16_GSU1_GSUC0_GSUWGMRR0_K1_LBSPPB512_MIWT4_4_NEPBS16_NLCA2_SU0_SUM0_SUS128_SVW8_VWA2_VWB4_WG64_4_1_WGM1_WGMXCC1_WGMXCCGn1
    SolutionIndex: 73
    SolutionNameMin: Cijk_Alik_Bljk_F8NBS_STA_BH_Bias_HAS_SAB_SAV_UserArgs_MT256x64x128_MI16x16x1_SN_LDSB0_GRVWB16_GSU1_GSUC0_GSUWGMRR0_K1_LBSPPB512_MIWT4_4_NEPBS0_NLCA2_SU0_SUM0_SUS128_SVW8_VWA2_VWB4_WG64_4_1_WGM1_WGMXCC1_WGMXCCGn1
    SolutionIndex: 74
    SolutionNameMin: Cijk_Alik_Bljk_F8NBS_STA_BH_Bias_HAS_SAB_SAV_UserArgs_MT256x128x64_MI16x16x1_SN_LDSB0_GRVWB16_GSU1_GSUC0_GSUWGMRR0_K1_LBSPPB512_MIWT4_8_NEPBS0_NLCA1_SU8_SUM0_SUS128_SVW8_VWA2_VWB8_WG64_4_1_WGM1_WGMXCC8_WGMXCCGn1
    SolutionIndex: 75
    SolutionNameMin: Cijk_Alik_Bljk_F8NBS_STA_BH_Bias_HAS_SAB_SAV_UserArgs_MT256x128x64_MI16x16x1_SN_LDSB0_GRVWB16_GSU1_GSUC0_GSUWGMRR0_K1_LBSPPB512_MIWT4_8_NEPBS16_NLCA1_SU8_SUM0_SUS128_SVW8_VWA2_VWB8_WG64_4_1_WGM1_WGMXCC8_WGMXCCGn1
    SolutionIndex: 76
    SolutionNameMin: Cijk_Alik_Bljk_F8NBS_STA_BH_Bias_HAS_SAB_SAV_UserArgs_MT256x64x128_MI16x16x1_SN_LDSB0_GRVWB16_GSU1_GSUC0_GSUWGMRR0_K1_LBSPPB512_MIWT4_4_NEPBS16_NLCA2_SU8_SUM0_SUS256_SVW8_VWA2_VWB4_WG64_4_1_WGM1_WGMXCC1_WGMXCCGn1
    SolutionIndex: 77
    SolutionNameMin: Cijk_Alik_Bljk_F8NBS_STA_BH_Bias_HAS_SAB_SAV_UserArgs_MT256x128x64_MI16x16x1_SN_LDSB0_GRVWB16_GSU1_GSUC0_GSUWGMRR0_K1_LBSPPB512_MIWT4_8_NEPBS16_NLCA1_SU0_SUM0_SUS64_SVW8_VWA2_VWB8_WG64_4_1_WGM1_WGMXCC1_WGMXCCGn1
    SolutionIndex: 78
    SolutionNameMin: Cijk_Alik_Bljk_F8NBS_STA_BH_Bias_HAS_SAB_SAV_UserArgs_MT256x128x64_MI16x16x1_SN_LDSB0_GRVWB16_GSU1_GSUC0_GSUWGMRR0_K1_LBSPPB512_MIWT4_8_NEPBS16_NLCA1_SU0_SUM0_SUS64_SVW8_VWA2_VWB8_WG64_4_1_WGM6_WGMXCC8_WGMXCCGn1
    SolutionIndex: 79
    SolutionNameMin: Cijk_Alik_Bljk_F8NBS_STA_BH_Bias_HAS_SAB_SAV_UserArgs_MT512x80x128_MI16x16x1_SN_LDSB0_GRVWB8_GSU1_GSUC0_GSUWGMRR0_K1_LBSPPB128_MIWT8_5_NEPBS16_NLCA2_SU8_SUM0_SUS256_SVW8_VWA2_VWB1_WG64_4_1_WGM1_WGMXCC1_WGMXCCGn1
    SolutionIndex: 80
    SolutionNameMin: Cijk_Alik_Bljk_F8NBS_STA_BH_Bias_HAS_SAB_SAV_UserArgs_MT512x80x128_MI16x16x1_SN_LDSB0_GRVWB8_GSU1_GSUC0_GSUWGMRR0_K1_LBSPPB128_MIWT8_5_NEPBS16_NLCA2_SU8_SUM0_SUS128_SVW8_VWA2_VWB1_WG64_4_1_WGM1_WGMXCC1_WGMXCCGn1
    SolutionIndex: 81
    SolutionNameMin: Cijk_Alik_Bljk_F8NBS_STA_BH_Bias_HAS_SAB_SAV_UserArgs_MT256x224x128_MI16x16x1_SN_LDSB0_GRVWB16_GSU1_GSUC0_GSUWGMRR0_K1_LBSPPB256_MIWT4_14_NEPBS0_NLCA2_SU0_SUM0_SUS128_SVW8_VWA2_VWB2_WG64_4_1_WGM1_WGMXCC1_WGMXCCGn1
    SolutionIndex: 82
    SolutionNameMin: Cijk_Alik_Bljk_F8NBS_STA_BH_Bias_HAS_SAB_SAV_UserArgs_MT256x224x128_MI16x16x1_SN_LDSB0_GRVWB16_GSU1_GSUC0_GSUWGMRR0_K1_LBSPPB256_MIWT4_14_NEPBS0_NLCA2_SU0_SUM0_SUS128_SVW8_VWA2_VWB2_WG64_4_1_WGM1_WGMXCC8_WGMXCCGn1
    SolutionIndex: 83
    SolutionNameMin: Cijk_Alik_Bljk_F8NBS_STA_BH_Bias_HAS_SAB_SAV_UserArgs_MT256x224x128_MI16x16x1_SN_LDSB0_GRVWB16_GSU1_GSUC0_GSUWGMRR0_K1_LBSPPB256_MIWT4_14_NEPBS0_NLCA2_SU8_SUM0_SUS256_SVW8_VWA2_VWB2_WG64_4_1_WGM1_WGMXCC1_WGMXCCGn1
    SolutionIndex: 84
    SolutionNameMin: Cijk_Alik_Bljk_F8NBS_STA_BH_Bias_HAS_SAB_SAV_UserArgs_MT256x224x128_MI16x16x1_SN_LDSB0_GRVWB16_GSU1_GSUC0_GSUWGMRR0_K1_LBSPPB256_MIWT4_14_NEPBS0_NLCA2_SU0_SUM0_SUS128_SVW8_VWA2_VWB2_WG64_4_1_WGM8_WGMXCC1_WGMXCCGn1
    SolutionIndex: 85
    SolutionNameMin: Cijk_Alik_Bljk_F8NBS_STA_BH_Bias_HAS_SAB_SAV_UserArgs_MT256x224x128_MI16x16x1_SN_LDSB0_GRVWB16_GSU1_GSUC0_GSUWGMRR0_K1_LBSPPB256_MIWT4_14_NEPBS0_NLCA2_SU8_SUM0_SUS256_SVW8_VWA2_VWB2_WG64_4_1_WGM1_WGMXCC8_WGMXCCGn1
    SolutionIndex: 86
    SolutionNameMin: Cijk_Alik_Bljk_F8NBS_STA_BH_Bias_HAS_SAB_SAV_UserArgs_MT256x224x128_MI16x16x1_SN_LDSB0_GRVWB16_GSU1_GSUC0_GSUWGMRR0_K1_LBSPPB256_MIWT4_14_NEPBS0_NLCA2_SU8_SUM0_SUS128_SVW8_VWA2_VWB2_WG64_4_1_WGM1_WGMXCC8_WGMXCCGn1
    SolutionIndex: 87
    SolutionNameMin: Cijk_Alik_Bljk_F8NBS_STA_BH_Bias_HAS_SAB_SAV_UserArgs_MT256x128x128_MI16x16x1_SN_LDSB1_GRVWB16_GSU1_GSUC0_GSUWGMRR0_K1_LBSPPB1024_MIWT8_8_NEPBS16_NLCA2_SU8_SUM0_SUS256_SVW8_VWA2_VWB8_WG32_4_1_WGM8_WGMXCC1_WGMXCCGn1
    SolutionIndex: 88
    SolutionNameMin: Cijk_Alik_Bljk_F8NBS_STA_BH_Bias_HAS_SAB_SAV_UserArgs_MT256x128x128_MI16x16x1_SN_LDSB1_GRVWB16_GSU1_GSUC0_GSUWGMRR0_K1_LBSPPB1024_MIWT8_8_NEPBS0_NLCA2_SU0_SUM0_SUS128_SVW8_VWA2_VWB8_WG32_4_1_WGM8_WGMXCC1_WGMXCCGn1
    SolutionIndex: 89
    SolutionNameMin: Cijk_Alik_Bljk_F8NBS_STA_BH_Bias_HAS_SAB_SAV_UserArgs_MT256x160x64_MI16x16x1_SN_LDSB0_GRVWB8_GSU1_GSUC0_GSUWGMRR0_K1_LBSPPB128_MIWT4_10_NEPBS0_NLCA1_SU8_SUM0_SUS256_SVW8_VWA2_VWB2_WG64_4_1_WGM1_WGMXCC1_WGMXCCGn1
    SolutionIndex: 90
    SolutionNameMin: Cijk_Alik_Bljk_F8NBS_STA_BH_Bias_HAS_SAB_SAV_UserArgs_MT256x160x64_MI16x16x1_SN_LDSB0_GRVWB8_GSU1_GSUC0_GSUWGMRR0_K1_LBSPPB128_MIWT4_10_NEPBS16_NLCA1_SU8_SUM0_SUS256_SVW8_VWA2_VWB2_WG64_4_1_WGM1_WGMXCC1_WGMXCCGn1
    SolutionIndex: 91
    SolutionNameMin: Cijk_Alik_Bljk_F8NBS_STA_BH_Bias_HAS_SAB_SAV_UserArgs_MT256x128x128_MI16x16x1_SN_LDSB1_GRVWB16_GSU1_GSUC0_GSUWGMRR0_K1_LBSPPB1024_MIWT8_8_NEPBS16_NLCA2_SU8_SUM0_SUS128_SVW8_VWA2_VWB8_WG32_4_1_WGM8_WGMXCC1_WGMXCCGn1
    SolutionIndex: 92
    SolutionNameMin: Cijk_Alik_Bljk_F8NBS_STA_BH_Bias_HAS_SAB_SAV_UserArgs_MT256x128x128_MI16x16x1_SN_LDSB1_GRVWB16_GSU1_GSUC0_GSUWGMRR0_K1_LBSPPB1024_MIWT8_8_NEPBS0_NLCA2_SU0_SUM0_SUS128_SVW8_VWA2_VWB8_WG32_4_1_WGM1_WGMXCC8_WGMXCCGn1
    SolutionIndex: 93
    SolutionNameMin: Cijk_Alik_Bljk_F8NBS_STA_BH_Bias_HAS_SAB_SAV_UserArgs_MT256x128x128_MI16x16x1_SN_LDSB1_GRVWB16_GSU1_GSUC0_GSUWGMRR0_K1_LBSPPB1024_MIWT8_8_NEPBS16_NLCA2_SU0_SUM0_SUS128_SVW8_VWA2_VWB8_WG32_4_1_WGM1_WGMXCC8_WGMXCCGn1
    SolutionIndex: 94
    SolutionNameMin: Cijk_Alik_Bljk_F8NBS_STA_BH_Bias_HAS_SAB_SAV_UserArgs_MT256x160x64_MI16x16x1_SN_LDSB0_GRVWB8_GSU1_GSUC0_GSUWGMRR0_K1_LBSPPB128_MIWT4_10_NEPBS16_NLCA1_SU8_SUM0_SUS64_SVW8_VWA2_VWB2_WG64_4_1_WGM1_WGMXCC8_WGMXCCGn1
    SolutionIndex: 95
    SolutionNameMin: Cijk_Alik_Bljk_F8NBS_STA_BH_Bias_HAS_SAB_SAV_UserArgs_MT256x160x64_MI16x16x1_SN_LDSB0_GRVWB8_GSU1_GSUC0_GSUWGMRR0_K1_LBSPPB128_MIWT4_10_NEPBS16_NLCA1_SU0_SUM0_SUS64_SVW8_VWA2_VWB2_WG64_4_1_WGM8_WGMXCC1_WGMXCCGn1
    SolutionIndex: 96
    SolutionNameMin: Cijk_Alik_Bljk_F8NBS_STA_BH_Bias_HAS_SAB_SAV_UserArgs_MT256x160x64_MI16x16x1_SN_LDSB0_GRVWB8_GSU1_GSUC0_GSUWGMRR0_K1_LBSPPB128_MIWT4_10_NEPBS0_NLCA1_SU0_SUM0_SUS64_SVW8_VWA2_VWB2_WG64_4_1_WGM8_WGMXCC1_WGMXCCGn1
    SolutionIndex: 97
    SolutionNameMin: Cijk_Alik_Bljk_F8NBS_STA_BH_Bias_HAS_SAB_SAV_UserArgs_MT256x128x64_MI16x16x1_SN_LDSB0_GRVWB16_GSU1_GSUC0_GSUWGMRR0_K1_LBSPPB512_MIWT4_8_NEPBS16_NLCA1_SU8_SUM0_SUS128_SVW8_VWA2_VWB8_WG64_4_1_WGM1_WGMXCC1_WGMXCCGn1
    SolutionIndex: 98
    SolutionNameMin: Cijk_Alik_Bljk_F8NBS_STA_BH_Bias_HAS_SAB_SAV_UserArgs_MT256x128x64_MI16x16x1_SN_LDSB0_GRVWB16_GSU1_GSUC0_GSUWGMRR0_K1_LBSPPB512_MIWT4_8_NEPBS0_NLCA1_SU0_SUM0_SUS64_SVW8_VWA2_VWB8_WG64_4_1_WGM1_WGMXCC1_WGMXCCGn1
    SolutionIndex: 99
    SolutionNameMin: Cijk_Alik_Bljk_F8NBS_STA_BH_Bias_HAS_SAB_SAV_UserArgs_MT256x128x64_MI16x16x1_SN_LDSB0_GRVWB16_GSU1_GSUC0_GSUWGMRR0_K1_LBSPPB512_MIWT4_8_NEPBS0_NLCA1_SU8_SUM0_SUS128_SVW8_VWA2_VWB8_WG64_4_1_WGM1_WGMXCC1_WGMXCCGn1
    SolutionIndex: 100
    SolutionNameMin: Cijk_Alik_Bljk_F8NBS_STA_BH_Bias_HAS_SAB_SAV_UserArgs_MT256x160x64_MI16x16x1_SN_LDSB0_GRVWB8_GSU1_GSUC0_GSUWGMRR0_K1_LBSPPB128_MIWT4_10_NEPBS16_NLCA1_SU0_SUM0_SUS64_SVW8_VWA2_VWB2_WG64_4_1_WGM1_WGMXCC8_WGMXCCGn1
    SolutionIndex: 101
    SolutionNameMin: Cijk_Alik_Bljk_F8NBS_STA_BH_Bias_HAS_SAB_SAV_UserArgs_MT256x128x64_MI16x16x1_SN_LDSB0_GRVWB16_GSU1_GSUC0_GSUWGMRR0_K1_LBSPPB512_MIWT4_8_NEPBS0_NLCA1_SU8_SUM0_SUS64_SVW8_VWA2_VWB8_WG64_4_1_WGM1_WGMXCC1_WGMXCCGn1
    SolutionIndex: 102
    SolutionNameMin: Cijk_Alik_Bljk_F8NBS_STA_BH_Bias_HAS_SAB_SAV_UserArgs_MT256x224x128_MI16x16x1_SN_LDSB0_GRVWB16_GSU1_GSUC0_GSUWGMRR0_K1_LBSPPB256_MIWT4_14_NEPBS16_NLCA2_SU8_SUM0_SUS256_VWA4_VWB2_WG64_4_1_WGM1_WGMXCC1_WGMXCCGn1
    SolutionIndex: 103
    SolutionNameMin: Cijk_Alik_Bljk_F8NBS_STA_BH_Bias_HAS_SAB_SAV_UserArgs_MT256x224x128_MI16x16x1_SN_LDSB0_GRVWB16_GSU1_GSUC0_GSUWGMRR0_K1_LBSPPB256_MIWT4_14_NEPBS16_NLCA2_SU0_SUM0_SUS128_VWA4_VWB2_WG64_4_1_WGM1_WGMXCC8_WGMXCCGn1
    SolutionIndex: 104
    SolutionNameMin: Cijk_Alik_Bljk_F8NBS_STA_BH_Bias_HAS_SAB_SAV_UserArgs_MT256x224x128_MI16x16x1_SN_LDSB0_GRVWB16_GSU1_GSUC0_GSUWGMRR0_K1_LBSPPB256_MIWT4_14_NEPBS0_NLCA2_SU0_SUM0_SUS128_VWA4_VWB2_WG64_4_1_WGM1_WGMXCC1_WGMXCCGn1
    SolutionIndex: 105
    SolutionNameMin: Cijk_Alik_Bljk_F8NBS_STA_BH_Bias_HAS_SAB_SAV_UserArgs_MT256x224x128_MI16x16x1_SN_LDSB0_GRVWB16_GSU1_GSUC0_GSUWGMRR0_K1_LBSPPB256_MIWT4_14_NEPBS16_NLCA2_SU8_SUM0_SUS128_VWA4_VWB2_WG64_4_1_WGM1_WGMXCC1_WGMXCCGn1
    SolutionIndex: 106
    SolutionNameMin: Cijk_Alik_Bljk_F8NBS_STA_BH_Bias_HAS_SAB_SAV_UserArgs_MT256x224x128_MI16x16x1_SN_LDSB0_GRVWB16_GSU1_GSUC0_GSUWGMRR0_K1_LBSPPB256_MIWT4_14_NEPBS16_NLCA2_SU0_SUM0_SUS128_VWA4_VWB2_WG64_4_1_WGM1_WGMXCC1_WGMXCCGn1
    SolutionIndex: 107
    SolutionNameMin: Cijk_Alik_Bljk_F8NBS_STA_BH_Bias_HAS_SAB_SAV_UserArgs_MT256x224x128_MI16x16x1_SN_LDSB0_GRVWB16_GSU1_GSUC0_GSUWGMRR0_K1_LBSPPB256_MIWT4_14_NEPBS0_NLCA2_SU8_SUM0_SUS128_VWA4_VWB2_WG64_4_1_WGM1_WGMXCC1_WGMXCCGn1
    SolutionIndex: 108
    SolutionNameMin: Cijk_Alik_Bljk_F8NBS_STA_BH_Bias_HAS_SAB_SAV_UserArgs_MT256x224x128_MI16x16x1_SN_LDSB0_GRVWB16_GSU1_GSUC0_GSUWGMRR0_K1_LBSPPB256_MIWT4_14_NEPBS0_NLCA2_SU0_SUM0_SUS128_VWA4_VWB2_WG64_4_1_WGM6_WGMXCC1_WGMXCCGn1
    SolutionIndex: 109
    SolutionNameMin: Cijk_Alik_Bljk_F8NBS_STA_BH_Bias_HAS_SAB_SAV_UserArgs_MT256x160x64_MI16x16x1_SN_LDSB0_GRVWB8_GSU1_GSUC0_GSUWGMRR0_K1_LBSPPB128_MIWT4_10_NEPBS16_NLCA1_SU8_SUM0_SUS64_VWA4_VWB2_WG64_4_1_WGM1_WGMXCC1_WGMXCCGn1
    SolutionIndex: 110
    SolutionNameMin: Cijk_Alik_Bljk_F8NBS_STA_BH_Bias_HAS_SAB_SAV_UserArgs_MT256x224x128_MI16x16x1_SN_LDSB0_GRVWB16_GSU1_GSUC0_GSUWGMRR0_K1_LBSPPB256_MIWT4_14_NEPBS0_NLCA2_SU8_SUM0_SUS256_VWA4_VWB2_WG64_4_1_WGM1_WGMXCC1_WGMXCCGn1
    SolutionIndex: 111
    SolutionNameMin: Cijk_Alik_Bljk_F8NBS_STA_BH_Bias_HAS_SAB_SAV_UserArgs_MT256x128x128_MI16x16x1_SN_LDSB1_GRVWB16_GSU1_GSUC0_GSUWGMRR0_K1_LBSPPB1024_MIWT8_8_NEPBS0_NLCA2_SU0_SUM0_SUS128_VWA4_VWB8_WG32_4_1_WGM1_WGMXCC8_WGMXCCGn1
    SolutionIndex: 112
    SolutionNameMin: Cijk_Alik_Bljk_F8NBS_STA_BH_Bias_HAS_SAB_SAV_UserArgs_MT256x128x64_MI16x16x1_SN_LDSB0_GRVWB16_GSU1_GSUC0_GSUWGMRR0_K1_LBSPPB512_MIWT4_8_NEPBS0_NLCA1_SU8_SUM0_SUS256_VWA4_VWB8_WG64_4_1_WGM1_WGMXCC1_WGMXCCGn1
    SolutionIndex: 113
    SolutionNameMin: Cijk_Alik_Bljk_F8NBS_STA_BH_Bias_HAS_SAB_SAV_UserArgs_MT256x224x128_MI16x16x1_SN_LDSB0_GRVWB16_GSU1_GSUC0_GSUWGMRR0_K1_LBSPPB256_MIWT4_14_NEPBS16_NLCA2_SU0_SUM0_SUS128_VWA4_VWB2_WG64_4_1_WGM8_WGMXCC1_WGMXCCGn1
    SolutionIndex: 114
    SolutionNameMin: Cijk_Alik_Bljk_F8NBS_STA_BH_Bias_HAS_SAB_SAV_UserArgs_MT384x64x128_MI16x16x1_SN_LDSB0_GRVWB16_GSU1_GSUC0_GSUWGMRR0_K1_LBSPPB512_MIWT6_4_NEPBS0_NLCA2_SU8_SUM0_SUS128_VWA3_VWB4_WG64_4_1_WGM1_WGMXCC8_WGMXCCGn1
    SolutionIndex: 115
    SolutionNameMin: Cijk_Alik_Bljk_F8NBS_STA_BH_Bias_HAS_SAB_SAV_UserArgs_MT256x128x128_MI16x16x1_SN_LDSB1_GRVWB16_GSU1_GSUC0_GSUWGMRR0_K1_LBSPPB1024_MIWT8_8_NEPBS0_NLCA2_SU0_SUM0_SUS128_VWA4_VWB8_WG32_4_1_WGM6_WGMXCC8_WGMXCCGn1
    SolutionIndex: 116
    SolutionNameMin: Cijk_Alik_Bljk_F8NBS_STA_BH_Bias_HAS_SAB_SAV_UserArgs_MT256x208x128_MI16x16x1_SN_LDSB1_GRVWB8_GSU1_GSUC0_GSUWGMRR0_K1_LBSPPB128_MIWT4_13_NEPBS0_NLCA2_SU8_SUM0_SUS128_VWA4_VWB1_WG64_4_1_WGM1_WGMXCC8_WGMXCCGn1
    SolutionIndex: 117
    SolutionNameMin: Cijk_Alik_Bljk_F8NBS_STA_BH_Bias_HAS_SAB_SAV_UserArgs_MT256x208x128_MI16x16x1_SN_LDSB1_GRVWB8_GSU1_GSUC0_GSUWGMRR0_K1_LBSPPB128_MIWT4_13_NEPBS0_NLCA2_SU8_SUM0_SUS128_VWA4_VWB1_WG64_4_1_WGM1_WGMXCC1_WGMXCCGn1
    SolutionIndex: 118
    SolutionNameMin: Cijk_Alik_Bljk_F8NBS_STA_BH_Bias_HAS_SAB_SAV_UserArgs_MT256x160x64_MI16x16x1_SN_LDSB0_GRVWB8_GSU1_GSUC0_GSUWGMRR0_K1_LBSPPB128_MIWT4_10_NEPBS16_NLCA1_SU0_SUM0_SUS64_SVW8_VWA2_VWB2_WG64_4_1_WGM1_WGMXCC1_WGMXCCGn1
    SolutionIndex: 119
    SolutionNameMin: Cijk_Alik_Bljk_F8NBS_STA_BH_Bias_HAS_SAB_SAV_UserArgs_MT256x160x64_MI16x16x1_SN_LDSB0_GRVWB8_GSU1_GSUC0_GSUWGMRR0_K1_LBSPPB128_MIWT4_10_NEPBS16_NLCA1_SU8_SUM0_SUS128_SVW8_VWA2_VWB2_WG64_4_1_WGM1_WGMXCC1_WGMXCCGn1
    SolutionIndex: 120
    SolutionNameMin: Cijk_Alik_Bljk_F8NBS_STA_BH_Bias_HAS_SAB_SAV_UserArgs_MT256x64x128_MI16x16x1_SN_LDSB0_GRVWB16_GSU1_GSUC0_GSUWGMRR0_K1_LBSPPB512_MIWT4_4_NEPBS16_NLCA2_SU8_SUM0_SUS128_SVW8_VWA2_VWB4_WG64_4_1_WGM8_WGMXCC8_WGMXCCGn1
    SolutionIndex: 121
    SolutionNameMin: Cijk_Alik_Bljk_F8NBS_STA_BH_Bias_HAS_SAB_SAV_UserArgs_MT256x160x64_MI16x16x1_SN_LDSB0_GRVWB8_GSU1_GSUC0_GSUWGMRR0_K1_LBSPPB128_MIWT4_10_NEPBS16_NLCA1_SU8_SUM0_SUS64_SVW8_VWA2_VWB2_WG64_4_1_WGM1_WGMXCC1_WGMXCCGn1
    SolutionIndex: 122
    SolutionNameMin: Cijk_Alik_Bljk_F8NBS_STA_BH_Bias_HAS_SAB_SAV_UserArgs_MT256x128x64_MI16x16x1_SN_LDSB0_GRVWB16_GSU1_GSUC0_GSUWGMRR0_K1_LBSPPB512_MIWT4_8_NEPBS16_NLCA1_SU8_SUM0_SUS64_SVW8_VWA2_VWB8_WG64_4_1_WGM1_WGMXCC1_WGMXCCGn1
- - - [1280, 8, 1, 8192]
    - [19, 0.0]
  - - [1280, 12, 1, 8192]
    - [8, 14.37]
  - - [1280, 16, 1, 8192]
    - [8, 0.0]
  - - [1280, 20, 1, 8192]
    - [9, 21.18]
  - - [1280, 24, 1, 8192]
    - [17, 0.0]
  - - [1280, 28, 1, 8192]
    - [17, 29.25]
  - - [1280, 32, 1, 8192]
    - [18, 0.0]
  - - [4096, 8, 1, 8192]
    - [6, 19.79]
  - - [4096, 12, 1, 8192]
    - [7, 29.16]
  - - [4096, 16, 1, 8192]
    - [7, 38.79]
  - - [4096, 20, 1, 8192]
    - [11, 38.0]
  - - [4096, 24, 1, 8192]
    - [13, 45.35]
  - - [4096, 28, 1, 8192]
    - [12, 52.67]
  - - [4096, 32, 1, 8192]
    - [12, 62.03]
  - - [8192, 8, 1, 1024]
    - [14, 10.34]
  - - [8192, 12, 1, 1024]
    - [16, 15.21]
  - - [8192, 16, 1, 1024]
    - [16, 20.74]
  - - [8192, 20, 1, 1024]
    - [0, 21.96]
  - - [8192, 24, 1, 1024]
    - [4, 25.99]
  - - [8192, 28, 1, 1024]
    - [5, 30.21]
  - - [8192, 32, 1, 1024]
    - [3, 35.47]
  - - [8192, 8, 1, 2048]
    - [6, 15.77]
  - - [8192, 12, 1, 2048]
    - [15, 22.99]
  - - [8192, 16, 1, 2048]
    - [10, 30.64]
  - - [8192, 20, 1, 2048]
    - [2, 33.44]
  - - [8192, 24, 1, 2048]
    - [2, 39.33]
  - - [8192, 28, 1, 2048]
    - [1, 45.09]
  - - [8192, 32, 1, 2048]
    - [1, 51.82]
  - - [1280, 816, 1, 8192]
    - [20, 0.0]
  - - [1280, 832, 1, 8192]
    - [21, 0.0]
  - - [1280, 848, 1, 8192]
    - [21, 0.0]
  - - [1280, 864, 1, 8192]
    - [21, 0.0]
  - - [1280, 880, 1, 8192]
    - [21, 0.0]
  - - [1280, 896, 1, 8192]
    - [21, 0.0]
  - - [1280, 912, 1, 8192]
    - [20, 0.0]
  - - [1280, 928, 1, 8192]
    - [22, 0.0]
  - - [1280, 944, 1, 8192]
    - [20, 0.0]
  - - [1280, 960, 1, 8192]
    - [21, 0.0]
  - - [1280, 976, 1, 8192]
    - [23, 0.0]
  - - [1280, 992, 1, 8192]
    - [23, 0.0]
  - - [1280, 1008, 1, 8192]
    - [24, 0.0]
  - - [1280, 1024, 1, 8192]
    - [25, 0.0]
  - - [1280, 1632, 1, 8192]
    - [26, 0.0]
  - - [1280, 1664, 1, 8192]
    - [27, 0.0]
  - - [1280, 1696, 1, 8192]
    - [26, 0.0]
  - - [1280, 1728, 1, 8192]
    - [27, 0.0]
  - - [1280, 1760, 1, 8192]
    - [27, 0.0]
  - - [1280, 1792, 1, 8192]
    - [28, 0.0]
  - - [1280, 1824, 1, 8192]
    - [29, 0.0]
  - - [1280, 1856, 1, 8192]
    - [30, 0.0]
  - - [1280, 1888, 1, 8192]
    - [30, 0.0]
  - - [1280, 1920, 1, 8192]
    - [29, 0.0]
  - - [1280, 1952, 1, 8192]
    - [31, 0.0]
  - - [1280, 1984, 1, 8192]
    - [32, 0.0]
  - - [1280, 2016, 1, 8192]
    - [29, 0.0]
  - - [1280, 2048, 1, 8192]
    - [31, 0.0]
  - - [4096, 816, 1, 8192]
    - [33, 0.0]
  - - [4096, 832, 1, 8192]
    - [34, 0.0]
  - - [4096, 848, 1, 8192]
    - [35, 0.0]
  - - [4096, 864, 1, 8192]
    - [36, 0.0]
  - - [4096, 880, 1, 8192]
    - [37, 0.0]
  - - [4096, 896, 1, 8192]
    - [37, 0.0]
  - - [4096, 912, 1, 8192]
    - [38, 0.0]
  - - [4096, 928, 1, 8192]
    - [38, 0.0]
  - - [4096, 944, 1, 8192]
    - [38, 0.0]
  - - [4096, 960, 1, 8192]
    - [38, 0.0]
  - - [4096, 976, 1, 8192]
    - [39, 0.0]
  - - [4096, 992, 1, 8192]
    - [40, 0.0]
  - - [4096, 1008, 1, 8192]
    - [39, 0.0]
  - - [4096, 1024, 1, 8192]
    - [41, 0.0]
  - - [4096, 1632, 1, 8192]
    - [42, 0.0]
  - - [4096, 1664, 1, 8192]
    - [42, 0.0]
  - - [4096, 1696, 1, 8192]
    - [43, 0.0]
  - - [4096, 1728, 1, 8192]
    - [38, 0.0]
  - - [4096, 1760, 1, 8192]
    - [44, 0.0]
  - - [4096, 1792, 1, 8192]
    - [44, 0.0]
  - - [4096, 1824, 1, 8192]
    - [38, 0.0]
  - - [4096, 1856, 1, 8192]
    - [45, 0.0]
  - - [4096, 1888, 1, 8192]
    - [46, 0.0]
  - - [4096, 1920, 1, 8192]
    - [38, 0.0]
  - - [4096, 1952, 1, 8192]
    - [47, 0.0]
  - - [4096, 1984, 1, 8192]
    - [48, 0.0]
  - - [4096, 2016, 1, 8192]
    - [40, 0.0]
  - - [4096, 2048, 1, 8192]
    - [42, 0.0]
  - - [8192, 16384, 1, 2048]
    - [49, 0.0]
  - - [8192, 16896, 1, 2048]
    - [49, 0.0]
  - - [8192, 17408, 1, 2048]
    - [49, 0.0]
  - - [8192, 17920, 1, 2048]
    - [50, 0.0]
  - - [8192, 18432, 1, 2048]
    - [50, 0.0]
  - - [8192, 18944, 1, 2048]
    - [49, 0.0]
  - - [8192, 19456, 1, 2048]
    - [50, 0.0]
  - - [8192, 19968, 1, 2048]
    - [51, 0.0]
  - - [8192, 20480, 1, 2048]
    - [52, 0.0]
  - - [1280, 16384, 1, 8192]
    - [53, 0.0]
  - - [1280, 16896, 1, 8192]
    - [54, 0.0]
  - - [1280, 17408, 1, 8192]
    - [55, 0.0]
  - - [1280, 17920, 1, 8192]
    - [56, 0.0]
  - - [1280, 18432, 1, 8192]
    - [57, 0.0]
  - - [1280, 18944, 1, 8192]
    - [58, 0.0]
  - - [1280, 19456, 1, 8192]
    - [59, 0.0]
  - - [1280, 19968, 1, 8192]
    - [60, 0.0]
  - - [1280, 20480, 1, 8192]
    - [61, 0.0]
  - - [4096, 16384, 1, 8192]
    - [62, 0.0]
  - - [4096, 16896, 1, 8192]
    - [63, 0.0]
  - - [4096, 17408, 1, 8192]
    - [51, 0.0]
  - - [4096, 17920, 1, 8192]
    - [64, 0.0]
  - - [4096, 18432, 1, 8192]
    - [65, 0.0]
  - - [4096, 18944, 1, 8192]
    - [66, 0.0]
  - - [4096, 19456, 1, 8192]
    - [67, 0.0]
  - - [4096, 19968, 1, 8192]
    - [52, 0.0]
  - - [4096, 20480, 1, 8192]
    - [68, 0.0]
  - - [8192, 16384, 1, 1024]
    - [52, 0.0]
  - - [8192, 16896, 1, 1024]
    - [52, 0.0]
  - - [8192, 17408, 1, 1024]
    - [69, 0.0]
  - - [8192, 17920, 1, 1024]
    - [51, 0.0]
  - - [8192, 18432, 1, 1024]
    - [50, 0.0]
  - - [8192, 18944, 1, 1024]
    - [51, 0.0]
  - - [8192, 19456, 1, 1024]
    - [50, 0.0]
  - - [8192, 19968, 1, 1024]
    - [50, 0.0]
  - - [8192, 20480, 1, 1024]
    - [52, 0.0]
  - - [8192, 816, 1, 1024]
    - [70, 0.0]
  - - [8192, 832, 1, 1024]
    - [70, 0.0]
  - - [8192, 848, 1, 1024]
    - [42, 0.0]
  - - [8192, 864, 1, 1024]
    - [42, 0.0]
  - - [8192, 880, 1, 1024]
    - [47, 0.0]
  - - [8192, 896, 1, 1024]
    - [71, 0.0]
  - - [8192, 912, 1, 1024]
    - [47, 0.0]
  - - [8192, 928, 1, 1024]
    - [72, 0.0]
  - - [8192, 944, 1, 1024]
    - [72, 0.0]
  - - [8192, 960, 1, 1024]
    - [73, 0.0]
  - - [8192, 976, 1, 1024]
    - [47, 0.0]
  - - [8192, 992, 1, 1024]
    - [47, 0.0]
  - - [8192, 1008, 1, 1024]
    - [42, 0.0]
  - - [8192, 1024, 1, 1024]
    - [47, 0.0]
  - - [8192, 1632, 1, 1024]
    - [42, 0.0]
  - - [8192, 1664, 1, 1024]
    - [42, 0.0]
  - - [8192, 1696, 1, 1024]
    - [42, 0.0]
  - - [8192, 1728, 1, 1024]
    - [47, 0.0]
  - - [8192, 1760, 1, 1024]
    - [71, 0.0]
  - - [8192, 1792, 1, 1024]
    - [71, 0.0]
  - - [8192, 1824, 1, 1024]
    - [74, 0.0]
  - - [8192, 1856, 1, 1024]
    - [71, 0.0]
  - - [8192, 1888, 1, 1024]
    - [71, 0.0]
  - - [8192, 1920, 1, 1024]
    - [75, 0.0]
  - - [8192, 1952, 1, 1024]
    - [42, 0.0]
  - - [8192, 1984, 1, 1024]
    - [42, 0.0]
  - - [8192, 2016, 1, 1024]
    - [42, 0.0]
  - - [8192, 2048, 1, 1024]
    - [72, 0.0]
  - - [8192, 816, 1, 2048]
    - [47, 0.0]
  - - [8192, 832, 1, 2048]
    - [47, 0.0]
  - - [8192, 848, 1, 2048]
    - [76, 0.0]
  - - [8192, 864, 1, 2048]
    - [42, 0.0]
  - - [8192, 880, 1, 2048]
    - [42, 0.0]
  - - [8192, 896, 1, 2048]
    - [76, 0.0]
  - - [8192, 912, 1, 2048]
    - [72, 0.0]
  - - [8192, 928, 1, 2048]
    - [76, 0.0]
  - - [8192, 944, 1, 2048]
    - [73, 0.0]
  - - [8192, 960, 1, 2048]
    - [42, 0.0]
  - - [8192, 976, 1, 2048]
    - [42, 0.0]
  - - [8192, 992, 1, 2048]
    - [73, 0.0]
  - - [8192, 1008, 1, 2048]
    - [47, 0.0]
  - - [8192, 1024, 1, 2048]
    - [47, 0.0]
  - - [8192, 1632, 1, 2048]
    - [76, 0.0]
  - - [8192, 1664, 1, 2048]
    - [47, 0.0]
  - - [8192, 1696, 1, 2048]
    - [73, 0.0]
  - - [8192, 1728, 1, 2048]
    - [47, 0.0]
  - - [8192, 1760, 1, 2048]
    - [77, 0.0]
  - - [8192, 1792, 1, 2048]
    - [78, 0.0]
  - - [8192, 1824, 1, 2048]
    - [77, 0.0]
  - - [8192, 1856, 1, 2048]
    - [77, 0.0]
  - - [8192, 1888, 1, 2048]
    - [77, 0.0]
  - - [8192, 1920, 1, 2048]
    - [77, 0.0]
  - - [8192, 1952, 1, 2048]
    - [79, 0.0]
  - - [8192, 1984, 1, 2048]
    - [80, 0.0]
  - - [8192, 2016, 1, 2048]
    - [76, 0.0]
  - - [8192, 2048, 1, 2048]
    - [48, 0.0]
  - - [1280, 3072, 1, 8192]
    - [34, 0.0]
  - - [1280, 3120, 1, 8192]
    - [81, 0.0]
  - - [1280, 3168, 1, 8192]
    - [82, 0.0]
  - - [1280, 3216, 1, 8192]
    - [83, 0.0]
  - - [1280, 3264, 1, 8192]
    - [84, 0.0]
  - - [1280, 3312, 1, 8192]
    - [82, 0.0]
  - - [1280, 3360, 1, 8192]
    - [85, 0.0]
  - - [1280, 3408, 1, 8192]
    - [83, 0.0]
  - - [1280, 3456, 1, 8192]
    - [82, 0.0]
  - - [1280, 3504, 1, 8192]
    - [85, 0.0]
  - - [1280, 3552, 1, 8192]
    - [86, 0.0]
  - - [1280, 3600, 1, 8192]
    - [87, 0.0]
  - - [1280, 3648, 1, 8192]
    - [88, 0.0]
  - - [4096, 3072, 1, 8192]
    - [89, 0.0]
  - - [4096, 3120, 1, 8192]
    - [90, 0.0]
  - - [4096, 3168, 1, 8192]
    - [90, 0.0]
  - - [4096, 3216, 1, 8192]
    - [82, 0.0]
  - - [4096, 3264, 1, 8192]
    - [85, 0.0]
  - - [4096, 3312, 1, 8192]
    - [86, 0.0]
  - - [4096, 3360, 1, 8192]
    - [85, 0.0]
  - - [4096, 3408, 1, 8192]
    - [72, 0.0]
  - - [4096, 3456, 1, 8192]
    - [73, 0.0]
  - - [4096, 3504, 1, 8192]
    - [72, 0.0]
  - - [4096, 3552, 1, 8192]
    - [91, 0.0]
  - - [4096, 3600, 1, 8192]
    - [92, 0.0]
  - - [4096, 3648, 1, 8192]
    - [93, 0.0]
  - - [8192, 3072, 1, 1024]
    - [94, 0.0]
  - - [8192, 3120, 1, 1024]
    - [95, 0.0]
  - - [8192, 3168, 1, 1024]
    - [96, 0.0]
  - - [8192, 3216, 1, 1024]
    - [97, 0.0]
  - - [8192, 3264, 1, 1024]
    - [97, 0.0]
  - - [8192, 3312, 1, 1024]
    - [98, 0.0]
  - - [8192, 3360, 1, 1024]
    - [99, 0.0]
  - - [8192, 3408, 1, 1024]
    - [99, 0.0]
  - - [8192, 3456, 1, 1024]
    - [98, 0.0]
  - - [8192, 3504, 1, 1024]
    - [95, 0.0]
  - - [8192, 3552, 1, 1024]
    - [99, 0.0]
  - - [8192, 3600, 1, 1024]
    - [98, 0.0]
  - - [8192, 3648, 1, 1024]
    - [98, 0.0]
  - - [8192, 3072, 1, 2048]
    - [100, 0.0]
  - - [8192, 3120, 1, 2048]
    - [95, 0.0]
  - - [8192, 3168, 1, 2048]
    - [95, 0.0]
  - - [8192, 3216, 1, 2048]
    - [98, 0.0]
  - - [8192, 3264, 1, 2048]
    - [77, 0.0]
  - - [8192, 3312, 1, 2048]
    - [77, 0.0]
  - - [8192, 3360, 1, 2048]
    - [98, 0.0]
  - - [8192, 3408, 1, 2048]
    - [77, 0.0]
  - - [8192, 3456, 1, 2048]
    - [101, 0.0]
  - - [8192, 3504, 1, 2048]
    - [95, 0.0]
  - - [8192, 3552, 1, 2048]
    - [99, 0.0]
  - - [8192, 3600, 1, 2048]
    - [77, 0.0]
  - - [8192, 3648, 1, 2048]
    - [98, 0.0]
  - - [1280, 3080, 1, 8192]
    - [102, 0.0]
  - - [1280, 3128, 1, 8192]
    - [103, 0.0]
  - - [1280, 3176, 1, 8192]
    - [102, 0.0]
  - - [1280, 3224, 1, 8192]
    - [104, 0.0]
  - - [1280, 3272, 1, 8192]
    - [102, 0.0]
  - - [1280, 3320, 1, 8192]
    - [105, 0.0]
  - - [1280, 3368, 1, 8192]
    - [106, 0.0]
  - - [1280, 3416, 1, 8192]
    - [107, 0.0]
  - - [1280, 3464, 1, 8192]
    - [106, 0.0]
  - - [1280, 3512, 1, 8192]
    - [105, 0.0]
  - - [1280, 3560, 1, 8192]
    - [108, 0.0]
  - - [1280, 3608, 1, 8192]
    - [59, 0.0]
  - - [1280, 3656, 1, 8192]
    - [59, 0.0]
  - - [4096, 3080, 1, 8192]
    - [109, 0.0]
  - - [4096, 3128, 1, 8192]
    - [69, 0.0]
  - - [4096, 3176, 1, 8192]
    - [49, 0.0]
  - - [4096, 3224, 1, 8192]
    - [105, 0.0]
  - - [4096, 3272, 1, 8192]
    - [105, 0.0]
  - - [4096, 3320, 1, 8192]
    - [110, 0.0]
  - - [4096, 3368, 1, 8192]
    - [59, 0.0]
  - - [4096, 3416, 1, 8192]
    - [59, 0.0]
  - - [4096, 3464, 1, 8192]
    - [59, 0.0]
  - - [4096, 3512, 1, 8192]
    - [59, 0.0]
  - - [4096, 3560, 1, 8192]
    - [111, 0.0]
  - - [4096, 3608, 1, 8192]
    - [59, 0.0]
  - - [4096, 3656, 1, 8192]
    - [59, 0.0]
  - - [8192, 3080, 1, 1024]
    - [52, 0.0]
  - - [8192, 3128, 1, 1024]
    - [52, 0.0]
  - - [8192, 3176, 1, 1024]
    - [51, 0.0]
  - - [8192, 3224, 1, 1024]
    - [51, 0.0]
  - - [8192, 3272, 1, 1024]
    - [66, 0.0]
  - - [8192, 3320, 1, 1024]
    - [66, 0.0]
  - - [8192, 3368, 1, 1024]
    - [51, 0.0]
  - - [8192, 3416, 1, 1024]
    - [51, 0.0]
  - - [8192, 3464, 1, 1024]
    - [51, 0.0]
  - - [8192, 3512, 1, 1024]
    - [51, 0.0]
  - - [8192, 3560, 1, 1024]
    - [52, 0.0]
  - - [8192, 3608, 1, 1024]
    - [52, 0.0]
  - - [8192, 3656, 1, 1024]
    - [112, 0.0]
  - - [8192, 3080, 1, 2048]
    - [51, 0.0]
  - - [8192, 3128, 1, 2048]
    - [66, 0.0]
  - - [8192, 3176, 1, 2048]
    - [69, 0.0]
  - - [8192, 3224, 1, 2048]
    - [52, 0.0]
  - - [8192, 3272, 1, 2048]
    - [52, 0.0]
  - - [8192, 3320, 1, 2048]
    - [113, 0.0]
  - - [8192, 3368, 1, 2048]
    - [52, 0.0]
  - - [8192, 3416, 1, 2048]
    - [52, 0.0]
  - - [8192, 3464, 1, 2048]
    - [52, 0.0]
  - - [8192, 3512, 1, 2048]
    - [69, 0.0]
  - - [8192, 3560, 1, 2048]
    - [52, 0.0]
  - - [8192, 3608, 1, 2048]
    - [114, 0.0]
  - - [8192, 3656, 1, 2048]
    - [115, 0.0]
  - - [1280, 3084, 1, 8192]
    - [116, 0.0]
  - - [1280, 3148, 1, 8192]
    - [116, 0.0]
  - - [1280, 3212, 1, 8192]
    - [117, 0.0]
  - - [8192, 16880, 1, 2048]
    - [101, 0.0]
  - - [8192, 17392, 1, 2048]
    - [118, 0.0]
  - - [8192, 17904, 1, 2048]
    - [118, 0.0]
  - - [8192, 18416, 1, 2048]
    - [101, 0.0]
  - - [8192, 18928, 1, 2048]
    - [119, 0.0]
  - - [8192, 19440, 1, 2048]
    - [118, 0.0]
  - - [8192, 19952, 1, 2048]
    - [118, 0.0]
  - - [8192, 20464, 1, 2048]
    - [77, 0.0]
  - - [1280, 16880, 1, 8192]
    - [72, 0.0]
  - - [1280, 17392, 1, 8192]
    - [72, 0.0]
  - - [1280, 17904, 1, 8192]
    - [119, 0.0]
  - - [1280, 18416, 1, 8192]
    - [120, 0.0]
  - - [1280, 18928, 1, 8192]
    - [73, 0.0]
  - - [1280, 19440, 1, 8192]
    - [73, 0.0]
  - - [1280, 19952, 1, 8192]
    - [90, 0.0]
  - - [1280, 20464, 1, 8192]
    - [121, 0.0]
  - - [4096, 16880, 1, 8192]
    - [72, 0.0]
  - - [4096, 17392, 1, 8192]
    - [118, 0.0]
  - - [4096, 17904, 1, 8192]
    - [73, 0.0]
  - - [4096, 18416, 1, 8192]
    - [77, 0.0]
  - - [4096, 18928, 1, 8192]
    - [118, 0.0]
  - - [4096, 19440, 1, 8192]
    - [73, 0.0]
  - - [4096, 19952, 1, 8192]
    - [118, 0.0]
  - - [4096, 20464, 1, 8192]
    - [118, 0.0]
  - - [8192, 16880, 1, 1024]
    - [98, 0.0]
  - - [8192, 17392, 1, 1024]
    - [98, 0.0]
  - - [8192, 17904, 1, 1024]
    - [77, 0.0]
  - - [8192, 18416, 1, 1024]
    - [77, 0.0]
  - - [8192, 18928, 1, 1024]
    - [122, 0.0]
  - - [8192, 19440, 1, 1024]
    - [77, 0.0]
  - - [8192, 19952, 1, 1024]
    - [90, 0.0]
  - - [8192, 20464, 1, 1024]
    - [77, 0.0]
- null
- null
- DeviceEfficiency
- GridBased
