projects/hipblaslt/library/src/amd_detail/rocblaslt/src/Tensile/Logic/asm_full/aquavanjaram/gfx942_80cu/GridBased/aquavanjaram_Cijk_Ailk_Bljk_I8_II_BH_UserArgs.yaml
- {MinimumRequiredVersion: 5.0.0}
- aquavanjaram
- {Architecture: gfx942, CUCount: 80}
- [Device 0049, Device 0050]
    SolutionIndex: 0
    SolutionNameMin: Cijk_Ailk_Bljk_I8II_BH_UserArgs_MT16x16x256_MI16x16x1_SN_LDSB1_AFC0_AFEM1_AFEM1_ASEM1_CLR1_CADS0_DTVA0_DTVB0_EPS0_FDSI0_GRPM1_GRVWA1_GRVWB16_GSUn1_GSUAMBSK_GSUC1_GSUWGMRR1_GLS0_ISA942_IU1_K1_LBSPPA256_LBSPPB256_LBSPPM0_LPA16_LPB32_LPM0_LRVW16_LWPMn1_MIAV0_MIWT1_1_MO40_NTn1_NTA0_NTB0_NTC0_NTD4_NTM0_NEPBS8_NLCA1_NLCB1_ONLL1_PGR2_PLR1_PKA1_SIA3_SS1_SU0_SUM1_SUS0_SPO0_SRVW0_SSO0_SVW1_SK0_SKXCCM0_TLDS1_ULSGRO0_USL1_UIOFGRO0_USFGROn1_VSn1_VWA1_VWB1_WSGRA0_WSGRB0_WS64_WG16_4_4_WGM1_WGMXCC4_WGMXCCGn1
    SolutionIndex: 1
    SolutionNameMin: Cijk_Ailk_Bljk_I8II_BH_UserArgs_MT16x16x512_MI16x16x1_SN_LDSB0_AFC0_AFEM1_AFEM1_ASEM1_CLR1_CADS0_DTVA0_DTVB0_EPS0_FDSI0_GRPM1_GRVWA16_GRVWB16_GSUn1_GSUAMBSK_GSUC1_GSUWGMRR1_GLS0_ISA942_IU1_K1_LBSPPA256_LBSPPB512_LBSPPM0_LPA16_LPB32_LPM0_LRVW16_LWPMn1_MIAV0_MIWT1_1_MO40_NTn1_NTA0_NTB0_NTC0_NTD4_NTM0_NEPBS8_NLCA1_NLCB1_ONLL1_PGR2_PLR1_PKA1_SIA3_SS1_SU0_SUM1_SUS0_SPO0_SRVW0_SSO0_SVW1_SK0_SKXCCM0_TLDS1_ULSGRO0_USL1_UIOFGRO0_USFGROn1_VSn1_VWA1_VWB1_WSGRA0_WSGRB0_WS64_WG16_4_4_WGM1_WGMXCC4_WGMXCCGn1
    SolutionIndex: 2
    SolutionNameMin: Cijk_Ailk_Bljk_I8II_BH_UserArgs_MT16x16x512_MI16x16x1_SN_LDSB1_AFC0_AFEM1_AFEM1_ASEM1_CLR1_CADS0_DTVA0_DTVB0_EPS0_FDSI0_GRPM1_GRVWA16_GRVWB16_GSUn1_GSUAMBSK_GSUC1_GSUWGMRR1_GLS0_ISA942_IU1_K1_LBSPPA256_LBSPPB512_LBSPPM0_LPA16_LPB32_LPM0_LRVW16_LWPMn1_MIAV0_MIWT1_1_MO40_NTn1_NTA0_NTB0_NTC0_NTD4_NTM0_NEPBS8_NLCA1_NLCB1_ONLL1_PGR2_PLR1_PKA1_SIA3_SS1_SU0_SUM1_SUS0_SPO0_SRVW0_SSO0_SVW1_SK0_SKXCCM0_TLDS1_ULSGRO0_USL1_UIOFGRO0_USFGROn1_VSn1_VWA1_VWB1_WSGRA0_WSGRB0_WS64_WG16_4_4_WGM1_WGMXCC4_WGMXCCGn1
    SolutionIndex: 3
    SolutionNameMin: Cijk_Ailk_Bljk_I8II_BH_UserArgs_MT32x16x512_MI16x16x1_SN_LDSB0_AFC0_AFEM1_AFEM1_ASEM1_CLR1_CADS0_DTVA0_DTVB0_EPS0_FDSI0_GRPM1_GRVWA16_GRVWB16_GSUn1_GSUAMBSK_GSUC1_GSUWGMRR1_GLS0_ISA942_IU1_K1_LBSPPA512_LBSPPB512_LBSPPM0_LPA16_LPB32_LPM0_LRVW16_LWPMn1_MIAV0_MIWT1_1_MO40_NTn1_NTA0_NTB0_NTC0_NTD4_NTM0_NEPBS8_NLCA1_NLCB1_ONLL1_PGR2_PLR1_PKA1_SIA3_SS1_SU0_SUM1_SUS0_SPO0_SRVW0_SSO0_SVW1_SK0_SKXCCM0_TLDS1_ULSGRO0_USL1_UIOFGRO0_USFGROn1_VSn1_VWA1_VWB1_WSGRA0_WSGRB0_WS64_WG32_4_2_WGM1_WGMXCC4_WGMXCCGn1
    SolutionIndex: 4
    SolutionNameMin: Cijk_Ailk_Bljk_I8II_BH_UserArgs_MT16x16x512_MI16x16x1_SN_LDSB1_AFC0_AFEM1_AFEM1_ASEM1_CLR1_CADS0_DTVA0_DTVB0_EPS0_FDSI0_GRPM1_GRVWA16_GRVWB16_GSUn1_GSUAMBSK_GSUC1_GSUWGMRR1_GLS0_ISA942_IU1_K1_LBSPPA256_LBSPPB512_LBSPPM0_LPA16_LPB32_LPM0_LRVW16_LWPMn1_MIAV0_MIWT1_1_MO40_NTn1_NTA0_NTB0_NTC0_NTD4_NTM0_NEPBS8_NLCA1_NLCB1_ONLL1_PGR2_PLR1_PKA1_SIA3_SS1_SU0_SUM1_SUS0_SPO0_SRVW0_SSO0_SVW1_SK0_SKXCCM0_TLDS1_ULSGRO0_USL1_UIOFGRO0_USFGROn1_VSn1_VWA1_VWB1_WSGRA0_WSGRB0_WS64_WG16_4_2_WGM1_WGMXCC4_WGMXCCGn1
    SolutionIndex: 5
    SolutionNameMin: Cijk_Ailk_Bljk_I8II_BH_UserArgs_MT32x16x256_MI16x16x1_SN_LDSB1_AFC0_AFEM1_AFEM1_ASEM1_CLR1_CADS0_DTVA0_DTVB0_EPS0_FDSI0_GRPM1_GRVWA16_GRVWB16_GSUn1_GSUAMBSK_GSUC1_GSUWGMRR1_GLS0_ISA942_IU1_K1_LBSPPA512_LBSPPB256_LBSPPM0_LPA16_LPB32_LPM0_LRVW16_LWPMn1_MIAV0_MIWT1_1_MO40_NTn1_NTA0_NTB0_NTC0_NTD4_NTM0_NEPBS8_NLCA1_NLCB1_ONLL1_PGR2_PLR1_PKA1_SIA3_SS1_SU0_SUM1_SUS0_SPO0_SRVW0_SSO0_SVW1_SK0_SKXCCM0_TLDS1_ULSGRO0_USL1_UIOFGRO0_USFGROn1_VSn1_VWA1_VWB1_WSGRA0_WSGRB0_WS64_WG32_4_2_WGM1_WGMXCC4_WGMXCCGn1
    SolutionIndex: 6
    SolutionNameMin: Cijk_Ailk_Bljk_I8II_BH_UserArgs_MT64x16x256_MI16x16x1_SN_LDSB0_AFC0_AFEM1_AFEM1_ASEM1_CLR1_CADS0_DTVA0_DTVB0_EPS0_FDSI0_GRPM1_GRVWA16_GRVWB16_GSUn1_GSUAMBSK_GSUC1_GSUWGMRR1_GLS0_ISA942_IU1_K1_LBSPPA1024_LBSPPB256_LBSPPM0_LPA32_LPB32_LPM0_LRVW16_LWPMn1_MIAV0_MIWT2_1_MO40_NTn1_NTA0_NTB0_NTC0_NTD4_NTM0_NEPBS8_NLCA1_NLCB1_ONLL1_PGR2_PLR1_PKA1_SIA3_SS1_SU0_SUM1_SUS0_SPO0_SRVW0_SSO0_SVW2_SK0_SKXCCM0_TLDS1_ULSGRO0_USL1_UIOFGRO0_USFGROn1_VSn1_VWA2_VWB1_WSGRA0_WSGRB0_WS64_WG32_4_2_WGM1_WGMXCC4_WGMXCCGn1
    SolutionIndex: 7
    SolutionNameMin: Cijk_Ailk_Bljk_I8II_BH_UserArgs_MT32x16x256_MI16x16x1_SN_LDSB0_AFC0_AFEM1_AFEM1_ASEM1_CLR1_CADS0_DTVA0_DTVB0_EPS0_FDSI0_GRPM1_GRVWA16_GRVWB16_GSUn1_GSUAMBSK_GSUC1_GSUWGMRR1_GLS0_ISA942_IU1_K1_LBSPPA512_LBSPPB256_LBSPPM0_LPA16_LPB32_LPM0_LRVW16_LWPMn1_MIAV0_MIWT1_1_MO40_NTn1_NTA0_NTB0_NTC0_NTD4_NTM0_NEPBS8_NLCA1_NLCB1_ONLL1_PGR2_PLR1_PKA1_SIA3_SS1_SU0_SUM1_SUS0_SPO0_SRVW0_SSO0_SVW1_SK0_SKXCCM0_TLDS1_ULSGRO0_USL1_UIOFGRO0_USFGROn1_VSn1_VWA1_VWB1_WSGRA0_WSGRB0_WS64_WG32_4_1_WGM1_WGMXCC4_WGMXCCGn1
    SolutionIndex: 8
    SolutionNameMin: Cijk_Ailk_Bljk_I8II_BH_UserArgs_MT64x16x256_MI16x16x1_SN_LDSB0_AFC0_AFEM1_AFEM1_ASEM1_CLR1_CADS0_DTVA0_DTVB0_EPS0_FDSI0_GRPM1_GRVWA16_GRVWB16_GSUn1_GSUAMBSK_GSUC1_GSUWGMRR1_GLS0_ISA942_IU1_K1_LBSPPA1024_LBSPPB256_LBSPPM0_LPA16_LPB32_LPM0_LRVW16_LWPMn1_MIAV0_MIWT1_1_MO40_NTn1_NTA0_NTB0_NTC0_NTD4_NTM0_NEPBS8_NLCA1_NLCB1_ONLL1_PGR2_PLR1_PKA1_SIA3_SS1_SU0_SUM1_SUS0_SPO0_SRVW0_SSO0_SVW1_SK0_SKXCCM0_TLDS1_ULSGRO0_USL1_UIOFGRO0_USFGROn1_VSn1_VWA1_VWB1_WSGRA0_WSGRB0_WS64_WG64_4_1_WGM1_WGMXCC4_WGMXCCGn1
    SolutionIndex: 9
    SolutionNameMin: Cijk_Ailk_Bljk_I8II_BH_UserArgs_MT32x16x512_MI16x16x1_SN_LDSB1_AFC0_AFEM1_AFEM1_ASEM1_CLR1_CADS0_DTVA0_DTVB0_EPS0_FDSI0_GRPM1_GRVWA16_GRVWB16_GSUn1_GSUAMBSK_GSUC1_GSUWGMRR1_GLS0_ISA942_IU1_K1_LBSPPA512_LBSPPB512_LBSPPM0_LPA16_LPB32_LPM0_LRVW16_LWPMn1_MIAV0_MIWT1_1_MO40_NTn1_NTA0_NTB0_NTC0_NTD4_NTM0_NEPBS8_NLCA1_NLCB1_ONLL1_PGR2_PLR1_PKA1_SIA3_SS1_SU0_SUM1_SUS0_SPO0_SRVW0_SSO0_SVW1_SK0_SKXCCM0_TLDS1_ULSGRO0_USL1_UIOFGRO0_USFGROn1_VSn1_VWA1_VWB1_WSGRA0_WSGRB0_WS64_WG32_4_1_WGM1_WGMXCC4_WGMXCCGn1
    SolutionIndex: 10
    SolutionNameMin: Cijk_Ailk_Bljk_I8II_BH_UserArgs_MT64x16x128_MI16x16x1_SN_LDSB1_AFC0_AFEM1_AFEM1_ASEM1_CLR1_CADS0_DTVA0_DTVB0_EPS0_FDSI0_GRPM1_GRVWA16_GRVWB8_GSUn1_GSUAMBSK_GSUC1_GSUWGMRR1_GLS0_ISA942_IU1_K1_LBSPPA1024_LBSPPB128_LBSPPM0_LPA32_LPB32_LPM0_LRVW16_LWPMn1_MIAV0_MIWT2_1_MO40_NTn1_NTA0_NTB0_NTC0_NTD4_NTM0_NEPBS8_NLCA1_NLCB1_ONLL1_PGR2_PLR1_PKA1_SIA3_SS1_SU0_SUM1_SUS0_SPO0_SRVW0_SSO0_SVW2_SK0_SKXCCM0_TLDS1_ULSGRO0_USL1_UIOFGRO0_USFGROn1_VSn1_VWA2_VWB1_WSGRA0_WSGRB0_WS64_WG32_4_2_WGM1_WGMXCC4_WGMXCCGn1
    SolutionIndex: 11
    SolutionNameMin: Cijk_Ailk_Bljk_I8II_BH_UserArgs_MT128x16x128_MI16x16x1_SN_LDSB1_AFC0_AFEM1_AFEM1_ASEM1_CLR1_CADS0_DTVA0_DTVB0_EPS0_FDSI0_GRPM1_GRVWA16_GRVWB8_GSUn1_GSUAMBSK_GSUC1_GSUWGMRR1_GLS0_ISA942_IU1_K1_LBSPPA2048_LBSPPB128_LBSPPM0_LPA32_LPB32_LPM0_LRVW16_LWPMn1_MIAV0_MIWT2_1_MO40_NTn1_NTA0_NTB0_NTC0_NTD4_NTM0_NEPBS8_NLCA1_NLCB1_ONLL1_PGR2_PLR1_PKA1_SIA3_SS1_SU0_SUM1_SUS0_SPO0_SRVW0_SSO0_SVW2_SK0_SKXCCM0_TLDS1_ULSGRO0_USL1_UIOFGRO0_USFGROn1_VSn1_VWA2_VWB1_WSGRA0_WSGRB0_WS64_WG64_4_1_WGM1_WGMXCC4_WGMXCCGn1
    SolutionIndex: 12
    SolutionNameMin: Cijk_Ailk_Bljk_I8II_BH_UserArgs_MT64x16x256_MI16x16x1_SN_LDSB1_AFC0_AFEM1_AFEM1_ASEM1_CLR1_CADS0_DTVA0_DTVB0_EPS0_FDSI0_GRPM1_GRVWA16_GRVWB16_GSUn1_GSUAMBSK_GSUC1_GSUWGMRR1_GLS0_ISA942_IU1_K1_LBSPPA1024_LBSPPB256_LBSPPM0_LPA32_LPB32_LPM0_LRVW16_LWPMn1_MIAV0_MIWT2_1_MO40_NTn1_NTA0_NTB0_NTC0_NTD4_NTM0_NEPBS8_NLCA1_NLCB1_ONLL1_PGR2_PLR1_PKA1_SIA3_SS1_SU0_SUM1_SUS0_SPO0_SRVW0_SSO0_SVW2_SK0_SKXCCM0_TLDS1_ULSGRO0_USL1_UIOFGRO0_USFGROn1_VSn1_VWA2_VWB1_WSGRA0_WSGRB0_WS64_WG32_4_2_WGM1_WGMXCC4_WGMXCCGn1
    SolutionIndex: 13
    SolutionNameMin: Cijk_Ailk_Bljk_I8II_BH_UserArgs_MT64x16x512_MI16x16x1_SN_LDSB1_AFC0_AFEM1_AFEM1_ASEM1_CLR1_CADS0_DTVA0_DTVB0_EPS0_FDSI0_GRPM1_GRVWA16_GRVWB16_GSUn1_GSUAMBSK_GSUC1_GSUWGMRR1_GLS0_ISA942_IU1_K1_LBSPPA1024_LBSPPB512_LBSPPM0_LPA32_LPB32_LPM0_LRVW16_LWPMn1_MIAV0_MIWT2_1_MO40_NTn1_NTA0_NTB0_NTC0_NTD4_NTM0_NEPBS8_NLCA1_NLCB1_ONLL1_PGR2_PLR1_PKA1_SIA3_SS1_SU0_SUM1_SUS0_SPO0_SRVW0_SSO0_SVW2_SK0_SKXCCM0_TLDS1_ULSGRO0_USL1_UIOFGRO0_USFGROn1_VSn1_VWA2_VWB1_WSGRA0_WSGRB0_WS64_WG32_4_2_WGM1_WGMXCC4_WGMXCCGn1
    SolutionIndex: 14
    SolutionNameMin: Cijk_Ailk_Bljk_I8II_BH_UserArgs_MT16x16x256_MI16x16x1_SN_LDSB1_AFC0_AFEM1_AFEM1_ASEM1_CLR1_CADS0_DTVA0_DTVB0_EPS0_FDSI0_GRPM1_GRVWA16_GRVWB16_GSUn1_GSUAMBSK_GSUC1_GSUWGMRR1_GLS0_ISA942_IU1_K1_LBSPPA256_LBSPPB256_LBSPPM0_LPA16_LPB32_LPM0_LRVW16_LWPMn1_MIAV0_MIWT1_1_MO40_NTn1_NTA0_NTB0_NTC0_NTD4_NTM0_NEPBS8_NLCA1_NLCB1_ONLL1_PGR2_PLR1_PKA1_SIA3_SS1_SU0_SUM1_SUS0_SPO0_SRVW0_SSO0_SVW1_SK0_SKXCCM0_TLDS1_ULSGRO0_USL1_UIOFGRO0_USFGROn1_VSn1_VWA1_VWB1_WSGRA0_WSGRB0_WS64_WG16_4_4_WGM1_WGMXCC4_WGMXCCGn1
    SolutionIndex: 15
    SolutionNameMin: Cijk_Ailk_Bljk_I8II_BH_UserArgs_MT128x16x256_MI16x16x1_SN_LDSB1_AFC0_AFEM1_AFEM1_ASEM1_CLR1_CADS0_DTVA0_DTVB0_EPS0_FDSI0_GRPM1_GRVWA16_GRVWB16_GSUn1_GSUAMBSK_GSUC1_GSUWGMRR1_GLS0_ISA942_IU1_K1_LBSPPA2048_LBSPPB256_LBSPPM0_LPA64_LPB32_LPM0_LRVW16_LWPMn1_MIAV0_MIWT4_1_MO40_NTn1_NTA0_NTB0_NTC0_NTD4_NTM0_NEPBS8_NLCA1_NLCB1_ONLL1_PGR2_PLR1_PKA1_SIA3_SS1_SU0_SUM1_SUS0_SPO0_SRVW0_SSO0_SVW4_SK0_SKXCCM0_TLDS1_ULSGRO0_USL1_UIOFGRO0_USFGROn1_VSn1_VWA4_VWB1_WSGRA0_WSGRB0_WS64_WG32_4_2_WGM1_WGMXCC4_WGMXCCGn1
    SolutionIndex: 16
    SolutionNameMin: Cijk_Ailk_Bljk_I8II_BH_UserArgs_MT128x16x256_MI16x16x1_SN_LDSB1_AFC0_AFEM1_AFEM1_ASEM1_CLR1_CADS0_DTVA0_DTVB0_EPS0_FDSI0_GRPM1_GRVWA16_GRVWB16_GSUn1_GSUAMBSK_GSUC1_GSUWGMRR1_GLS0_ISA942_IU1_K1_LBSPPA2048_LBSPPB256_LBSPPM0_LPA32_LPB32_LPM0_LRVW16_LWPMn1_MIAV0_MIWT2_1_MO40_NTn1_NTA0_NTB0_NTC0_NTD4_NTM0_NEPBS8_NLCA1_NLCB1_ONLL1_PGR2_PLR1_PKA1_SIA3_SS1_SU0_SUM1_SUS0_SPO0_SRVW0_SSO0_SVW2_SK0_SKXCCM0_TLDS1_ULSGRO0_USL1_UIOFGRO0_USFGROn1_VSn1_VWA2_VWB1_WSGRA0_WSGRB0_WS64_WG64_4_1_WGM1_WGMXCC4_WGMXCCGn1
    SolutionIndex: 17
    SolutionNameMin: Cijk_Ailk_Bljk_I8II_BH_UserArgs_MT256x16x128_MI16x16x1_SN_LDSB1_AFC0_AFEM1_AFEM1_ASEM1_CLR1_CADS0_DTVA0_DTVB0_EPS0_FDSI0_GRPM1_GRVWA16_GRVWB8_GSUn1_GSUAMBSK_GSUC1_GSUWGMRR1_GLS0_ISA942_IU1_K1_LBSPPA4096_LBSPPB128_LBSPPM0_LPA64_LPB32_LPM0_LRVW16_LWPMn1_MIAV0_MIWT4_1_MO40_NTn1_NTA0_NTB0_NTC0_NTD4_NTM0_NEPBS8_NLCA1_NLCB1_ONLL1_PGR2_PLR1_PKA1_SIA3_SS1_SU0_SUM1_SUS0_SPO0_SRVW0_SSO0_SVW4_SK0_SKXCCM0_TLDS1_ULSGRO0_USL1_UIOFGRO0_USFGROn1_VSn1_VWA4_VWB1_WSGRA0_WSGRB0_WS64_WG64_4_1_WGM1_WGMXCC4_WGMXCCGn1
    SolutionIndex: 18
    SolutionNameMin: Cijk_Ailk_Bljk_I8II_BH_UserArgs_MT128x16x128_MI16x16x1_SN_LDSB1_AFC0_AFEM1_AFEM1_ASEM1_CLR1_CADS0_DTVA0_DTVB0_EPS0_FDSI0_GRPM1_GRVWA16_GRVWB8_GSUn1_GSUAMBSK_GSUC1_GSUWGMRR1_GLS0_ISA942_IU1_K1_LBSPPA2048_LBSPPB128_LBSPPM0_LPA64_LPB32_LPM0_LRVW16_LWPMn1_MIAV0_MIWT4_1_MO40_NTn1_NTA0_NTB0_NTC0_NTD4_NTM0_NEPBS8_NLCA1_NLCB1_ONLL1_PGR2_PLR1_PKA1_SIA3_SS1_SU0_SUM1_SUS0_SPO0_SRVW0_SSO0_SVW4_SK0_SKXCCM0_TLDS1_ULSGRO0_USL1_UIOFGRO0_USFGROn1_VSn1_VWA4_VWB1_WSGRA0_WSGRB0_WS64_WG32_4_2_WGM1_WGMXCC4_WGMXCCGn1
    SolutionIndex: 19
    SolutionNameMin: Cijk_Ailk_Bljk_I8II_BH_UserArgs_MT32x16x512_MI16x16x1_SN_LDSB1_AFC0_AFEM1_AFEM1_ASEM1_CLR1_CADS0_DTVA0_DTVB0_EPS0_FDSI0_GRPM1_GRVWA16_GRVWB16_GSUn1_GSUAMBSK_GSUC1_GSUWGMRR1_GLS0_ISA942_IU1_K1_LBSPPA512_LBSPPB512_LBSPPM0_LPA16_LPB32_LPM0_LRVW16_LWPMn1_MIAV0_MIWT1_1_MO40_NTn1_NTA0_NTB0_NTC0_NTD4_NTM0_NEPBS8_NLCA1_NLCB1_ONLL1_PGR2_PLR1_PKA1_SIA3_SS1_SU0_SUM1_SUS0_SPO0_SRVW0_SSO0_SVW1_SK0_SKXCCM0_TLDS1_ULSGRO0_USL1_UIOFGRO0_USFGROn1_VSn1_VWA1_VWB1_WSGRA0_WSGRB0_WS64_WG32_4_2_WGM1_WGMXCC4_WGMXCCGn1
    SolutionIndex: 20
    SolutionNameMin: Cijk_Ailk_Bljk_I8II_BH_UserArgs_MT256x16x64_MI16x16x1_SN_LDSB1_AFC0_AFEM1_AFEM1_ASEM1_CLR1_CADS0_DTVA0_DTVB0_EPS0_FDSI0_GRPM1_GRVWA16_GRVWB4_GSUn1_GSUAMBSK_GSUC1_GSUWGMRR1_GLS0_ISA942_IU1_K1_LBSPPA2048_LBSPPB128_LBSPPM0_LPA64_LPB8_LPM0_LRVW8_LWPMn1_MIAV0_MIWT4_1_MO40_NTn1_NTA0_NTB0_NTC0_NTD4_NTM0_NEPBS8_NLCA1_NLCB1_ONLL1_PGR2_PLR1_PKA1_SIA3_SS1_SU0_SUM1_SUS0_SPO0_SRVW0_SSO0_SVW4_SK0_SKXCCM0_TLDS1_ULSGRO0_USL1_UIOFGRO0_USFGROn1_VSn1_VWA4_VWB1_WSGRA0_WSGRB0_WS64_WG64_4_1_WGM1_WGMXCC4_WGMXCCGn1
    SolutionIndex: 21
    SolutionNameMin: Cijk_Ailk_Bljk_I8II_BH_UserArgs_MT512x16x64_MI16x16x1_SN_LDSB1_AFC0_AFEM1_AFEM1_ASEM1_CLR1_CADS0_DTVA0_DTVB0_EPS0_FDSI0_GRPM1_GRVWA16_GRVWB4_GSUn1_GSUAMBSK_GSUC1_GSUWGMRR1_GLS0_ISA942_IU1_K1_LBSPPA4096_LBSPPB128_LBSPPM0_LPA64_LPB8_LPM0_LRVW8_LWPMn1_MIAV0_MIWT8_1_MO40_NTn1_NTA0_NTB0_NTC0_NTD4_NTM0_NEPBS8_NLCA1_NLCB1_ONLL1_PGR2_PLR1_PKA1_SIA3_SS1_SU0_SUM1_SUS0_SPO0_SRVW0_SSO0_SVW8_SK0_SKXCCM0_TLDS1_ULSGRO0_USL1_UIOFGRO0_USFGROn1_VSn1_VWA8_VWB1_WSGRA0_WSGRB0_WS64_WG64_4_1_WGM1_WGMXCC4_WGMXCCGn1
    SolutionIndex: 22
    SolutionNameMin: Cijk_Ailk_Bljk_I8II_BH_UserArgs_MT256x16x64_MI16x16x1_SN_LDSB1_AFC0_AFEM1_AFEM1_ASEM1_CLR1_CADS0_DTVA0_DTVB0_EPS0_FDSI0_GRPM1_GRVWA16_GRVWB4_GSUn1_GSUAMBSK_GSUC1_GSUWGMRR1_GLS0_ISA942_IU1_K1_LBSPPA2048_LBSPPB128_LBSPPM0_LPA64_LPB8_LPM0_LRVW8_LWPMn1_MIAV0_MIWT4_1_MO40_NTn1_NTA0_NTB0_NTC0_NTD4_NTM0_NEPBS8_NLCA1_NLCB1_ONLL1_PGR2_PLR1_PKA1_SIA3_SS1_SU0_SUM1_SUS0_SPO0_SRVW0_SSO4_SVW4_SK0_SKXCCM0_TLDS1_ULSGRO0_USL1_UIOFGRO0_USFGROn1_VSn1_VWA4_VWB1_WSGRA0_WSGRB0_WS64_WG64_4_1_WGM1_WGMXCC4_WGMXCCGn1
    SolutionIndex: 23
    SolutionNameMin: Cijk_Ailk_Bljk_I8II_BH_UserArgs_MT384x16x64_MI16x16x1_SN_LDSB1_AFC0_AFEM1_AFEM1_ASEM1_CLR1_CADS0_DTVA0_DTVB0_EPS0_FDSI0_GRPM1_GRVWA16_GRVWB4_GSUn1_GSUAMBSK_GSUC1_GSUWGMRR1_GLS0_ISA942_IU1_K1_LBSPPA3072_LBSPPB128_LBSPPM0_LPA32_LPB8_LPM0_LRVW8_LWPMn1_MIAV0_MIWT6_1_MO40_NTn1_NTA0_NTB0_NTC0_NTD4_NTM0_NEPBS6_NLCA1_NLCB1_ONLL1_PGR2_PLR1_PKA1_SIA3_SS1_SU0_SUM1_SUS0_SPO0_SRVW0_SSO4_SVW2_SK0_SKXCCM0_TLDS1_ULSGRO0_USL1_UIOFGRO0_USFGROn1_VSn1_VWA2_VWB1_WSGRA0_WSGRB0_WS64_WG64_4_1_WGM1_WGMXCC4_WGMXCCGn1
    SolutionIndex: 24
    SolutionNameMin: Cijk_Ailk_Bljk_I8II_BH_UserArgs_MT384x16x64_MI16x16x1_SN_LDSB1_AFC0_AFEM1_AFEM1_ASEM1_CLR1_CADS0_DTVA0_DTVB0_EPS0_FDSI0_GRPM1_GRVWA16_GRVWB4_GSUn1_GSUAMBSK_GSUC1_GSUWGMRR1_GLS0_ISA942_IU1_K1_LBSPPA3072_LBSPPB128_LBSPPM0_LPA32_LPB8_LPM0_LRVW8_LWPMn1_MIAV0_MIWT6_1_MO40_NTn1_NTA0_NTB0_NTC0_NTD4_NTM0_NEPBS6_NLCA1_NLCB1_ONLL1_PGR2_PLR1_PKA1_SIA3_SS1_SU0_SUM1_SUS0_SPO0_SRVW0_SSO0_SVW2_SK0_SKXCCM0_TLDS1_ULSGRO0_USL1_UIOFGRO0_USFGROn1_VSn1_VWA2_VWB1_WSGRA0_WSGRB0_WS64_WG64_4_1_WGM1_WGMXCC4_WGMXCCGn1
    SolutionIndex: 25
    SolutionNameMin: Cijk_Ailk_Bljk_I8II_BH_UserArgs_MT16x16x128_MI16x16x1_SN_LDSB1_AFC0_AFEM1_AFEM1_ASEM1_CLR1_CADS0_DTVA0_DTVB0_EPS0_FDSI0_GRPM1_GRVWA1_GRVWB16_GSUn1_GSUAMBSK_GSUC1_GSUWGMRR1_GLS0_ISA942_IU1_K1_LBSPPA256_LBSPPB128_LBSPPM0_LPA16_LPB32_LPM0_LRVW16_LWPMn1_MIAV0_MIWT1_1_MO40_NTn1_NTA0_NTB0_NTC0_NTD4_NTM0_NEPBS8_NLCA1_NLCB1_ONLL1_PGR2_PLR1_PKA1_SIA3_SS1_SU0_SUM1_SUS0_SPO0_SRVW0_SSO0_SVW1_SK0_SKXCCM0_TLDS1_ULSGRO0_USL1_UIOFGRO0_USFGROn1_VSn1_VWA1_VWB1_WSGRA0_WSGRB0_WS64_WG16_4_2_WGM1_WGMXCC4_WGMXCCGn1
    SolutionIndex: 26
    SolutionNameMin: Cijk_Ailk_Bljk_I8II_BH_UserArgs_MT16x16x1024_MI16x16x1_SN_LDSB1_AFC0_AFEM1_AFEM1_ASEM1_CLR1_CADS0_DTVA0_DTVB0_EPS0_FDSI0_GRPM1_GRVWA16_GRVWB16_GSUn1_GSUAMBSK_GSUC1_GSUWGMRR1_GLS0_ISA942_IU1_K1_LBSPPA256_LBSPPB1024_LBSPPM0_LPA16_LPB32_LPM0_LRVW16_LWPMn1_MIAV0_MIWT1_1_MO40_NTn1_NTA0_NTB0_NTC0_NTD4_NTM0_NEPBS8_NLCA1_NLCB1_ONLL1_PGR2_PLR1_PKA1_SIA3_SS1_SU0_SUM1_SUS0_SPO0_SRVW0_SSO0_SVW1_SK0_SKXCCM0_TLDS1_ULSGRO0_USL1_UIOFGRO0_USFGROn1_VSn1_VWA1_VWB1_WSGRA0_WSGRB0_WS64_WG16_4_4_WGM1_WGMXCC4_WGMXCCGn1
    SolutionIndex: 27
    SolutionNameMin: Cijk_Ailk_Bljk_I8II_BH_UserArgs_MT16x16x512_MI16x16x1_SN_LDSB0_AFC0_AFEM1_AFEM1_ASEM1_CLR1_CADS0_DTVA0_DTVB0_EPS0_FDSI0_GRPM1_GRVWA16_GRVWB16_GSUn1_GSUAMBSK_GSUC1_GSUWGMRR1_GLS0_ISA942_IU1_K1_LBSPPA256_LBSPPB512_LBSPPM0_LPA16_LPB32_LPM0_LRVW16_LWPMn1_MIAV0_MIWT1_1_MO40_NTn1_NTA0_NTB0_NTC0_NTD4_NTM0_NEPBS8_NLCA1_NLCB1_ONLL1_PGR2_PLR1_PKA1_SIA3_SS1_SU0_SUM1_SUS0_SPO0_SRVW0_SSO0_SVW1_SK0_SKXCCM0_TLDS1_ULSGRO0_USL1_UIOFGRO0_USFGROn1_VSn1_VWA1_VWB1_WSGRA0_WSGRB0_WS64_WG16_4_2_WGM1_WGMXCC4_WGMXCCGn1
    SolutionIndex: 28
    SolutionNameMin: Cijk_Ailk_Bljk_I8II_BH_UserArgs_MT64x32x256_MI16x16x1_SN_LDSB0_AFC0_AFEM1_AFEM1_ASEM1_CLR1_CADS0_DTVA0_DTVB0_EPS0_FDSI0_GRPM1_GRVWA16_GRVWB16_GSUn1_GSUAMBSK_GSUC1_GSUWGMRR1_GLS0_ISA942_IU1_K1_LBSPPA1024_LBSPPB512_LBSPPM0_LPA16_LPB32_LPM0_LRVW16_LWPMn1_MIAV0_MIWT1_2_MO40_NTn1_NTA0_NTB0_NTC0_NTD4_NTM0_NEPBS8_NLCA1_NLCB1_ONLL1_PGR2_PLR1_PKA1_SIA3_SS1_SU0_SUM1_SUS0_SPO0_SRVW0_SSO0_SVW1_SK0_SKXCCM0_TLDS1_ULSGRO0_USL1_UIOFGRO0_USFGROn1_VSn1_VWA1_VWB2_WSGRA0_WSGRB0_WS64_WG64_4_1_WGM1_WGMXCC4_WGMXCCGn1
    SolutionIndex: 29
    SolutionNameMin: Cijk_Ailk_Bljk_I8II_BH_UserArgs_MT32x16x256_MI16x16x1_SN_LDSB1_AFC0_AFEM1_AFEM1_ASEM1_CLR1_CADS0_DTVA0_DTVB0_EPS0_FDSI0_GRPM1_GRVWA16_GRVWB16_GSUn1_GSUAMBSK_GSUC1_GSUWGMRR1_GLS0_ISA942_IU1_K1_LBSPPA512_LBSPPB256_LBSPPM0_LPA16_LPB32_LPM0_LRVW16_LWPMn1_MIAV0_MIWT1_1_MO40_NTn1_NTA0_NTB0_NTC0_NTD4_NTM0_NEPBS8_NLCA1_NLCB1_ONLL1_PGR2_PLR1_PKA1_SIA3_SS1_SU0_SUM1_SUS0_SPO0_SRVW0_SSO0_SVW1_SK0_SKXCCM0_TLDS1_ULSGRO0_USL1_UIOFGRO0_USFGROn1_VSn1_VWA1_VWB1_WSGRA0_WSGRB0_WS64_WG32_4_1_WGM1_WGMXCC4_WGMXCCGn1
    SolutionIndex: 30
    SolutionNameMin: Cijk_Ailk_Bljk_I8II_BH_UserArgs_MT32x16x512_MI16x16x1_SN_LDSB0_AFC0_AFEM1_AFEM1_ASEM1_CLR1_CADS0_DTVA0_DTVB0_EPS0_FDSI0_GRPM1_GRVWA16_GRVWB16_GSUn1_GSUAMBSK_GSUC1_GSUWGMRR1_GLS0_ISA942_IU1_K1_LBSPPA512_LBSPPB512_LBSPPM0_LPA16_LPB32_LPM0_LRVW16_LWPMn1_MIAV0_MIWT1_1_MO40_NTn1_NTA0_NTB0_NTC0_NTD4_NTM0_NEPBS8_NLCA1_NLCB1_ONLL1_PGR2_PLR1_PKA1_SIA3_SS1_SU0_SUM1_SUS0_SPO0_SRVW0_SSO0_SVW1_SK0_SKXCCM0_TLDS1_ULSGRO0_USL1_UIOFGRO0_USFGROn1_VSn1_VWA1_VWB1_WSGRA0_WSGRB0_WS64_WG32_4_1_WGM1_WGMXCC4_WGMXCCGn1
    SolutionIndex: 31
    SolutionNameMin: Cijk_Ailk_Bljk_I8II_BH_UserArgs_MT32x32x256_MI16x16x1_SN_LDSB0_AFC0_AFEM1_AFEM1_ASEM1_CLR1_CADS0_DTVA0_DTVB0_EPS0_FDSI0_GRPM1_GRVWA16_GRVWB16_GSUn1_GSUAMBSK_GSUC1_GSUWGMRR1_GLS0_ISA942_IU1_K1_LBSPPA512_LBSPPB256_LBSPPM0_LPA16_LPB32_LPM0_LRVW16_LWPMn1_MIAV0_MIWT1_1_MO40_NTn1_NTA0_NTB0_NTC0_NTD4_NTM0_NEPBS8_NLCA1_NLCB1_ONLL1_PGR2_PLR1_PKA1_SIA3_SS1_SU0_SUM1_SUS0_SPO0_SRVW0_SSO0_SVW1_SK0_SKXCCM0_TLDS1_ULSGRO0_USL1_UIOFGRO0_USFGROn1_VSn1_VWA1_VWB1_WSGRA0_WSGRB0_WS64_WG32_8_1_WGM1_WGMXCC4_WGMXCCGn1
    SolutionIndex: 32
    SolutionNameMin: Cijk_Ailk_Bljk_I8II_BH_UserArgs_MT64x16x128_MI16x16x1_SN_LDSB0_AFC0_AFEM1_AFEM1_ASEM1_CLR1_CADS0_DTVA0_DTVB0_EPS0_FDSI0_GRPM1_GRVWA16_GRVWB8_GSUn1_GSUAMBSK_GSUC1_GSUWGMRR1_GLS0_ISA942_IU1_K1_LBSPPA1024_LBSPPB128_LBSPPM0_LPA16_LPB32_LPM0_LRVW16_LWPMn1_MIAV0_MIWT1_1_MO40_NTn1_NTA0_NTB0_NTC0_NTD4_NTM0_NEPBS8_NLCA1_NLCB1_ONLL1_PGR2_PLR1_PKA1_SIA3_SS1_SU0_SUM1_SUS0_SPO0_SRVW0_SSO0_SVW1_SK0_SKXCCM0_TLDS1_ULSGRO0_USL1_UIOFGRO0_USFGROn1_VSn1_VWA1_VWB1_WSGRA0_WSGRB0_WS64_WG64_4_1_WGM1_WGMXCC4_WGMXCCGn1
    SolutionIndex: 33
    SolutionNameMin: Cijk_Ailk_Bljk_I8II_BH_UserArgs_MT32x16x512_MI16x16x1_SN_LDSB1_AFC0_AFEM1_AFEM1_ASEM1_CLR1_CADS0_DTVA0_DTVB0_EPS0_FDSI0_GRPM1_GRVWA16_GRVWB16_GSUn1_GSUAMBSK_GSUC1_GSUWGMRR1_GLS0_ISA942_IU1_K1_LBSPPA512_LBSPPB512_LBSPPM0_LPA32_LPB32_LPM0_LRVW16_LWPMn1_MIAV0_MIWT2_1_MO40_NTn1_NTA0_NTB0_NTC0_NTD4_NTM0_NEPBS8_NLCA1_NLCB1_ONLL1_PGR2_PLR1_PKA1_SIA3_SS1_SU0_SUM1_SUS0_SPO0_SRVW0_SSO0_SVW2_SK0_SKXCCM0_TLDS1_ULSGRO0_USL1_UIOFGRO0_USFGROn1_VSn1_VWA2_VWB1_WSGRA0_WSGRB0_WS64_WG16_4_4_WGM1_WGMXCC4_WGMXCCGn1
    SolutionIndex: 34
    SolutionNameMin: Cijk_Ailk_Bljk_I8II_BH_UserArgs_MT64x16x256_MI16x16x1_SN_LDSB1_AFC0_AFEM1_AFEM1_ASEM1_CLR1_CADS0_DTVA0_DTVB0_EPS0_FDSI0_GRPM1_GRVWA16_GRVWB16_GSUn1_GSUAMBSK_GSUC1_GSUWGMRR1_GLS0_ISA942_IU1_K1_LBSPPA1024_LBSPPB256_LBSPPM0_LPA16_LPB32_LPM0_LRVW16_LWPMn1_MIAV0_MIWT1_1_MO40_NTn1_NTA0_NTB0_NTC0_NTD4_NTM0_NEPBS8_NLCA1_NLCB1_ONLL1_PGR2_PLR1_PKA1_SIA3_SS1_SU0_SUM1_SUS0_SPO0_SRVW0_SSO0_SVW1_SK0_SKXCCM0_TLDS1_ULSGRO0_USL1_UIOFGRO0_USFGROn1_VSn1_VWA1_VWB1_WSGRA0_WSGRB0_WS64_WG64_4_1_WGM1_WGMXCC4_WGMXCCGn1
    SolutionIndex: 35
    SolutionNameMin: Cijk_Ailk_Bljk_I8II_BH_UserArgs_MT64x32x256_MI16x16x1_SN_LDSB1_AFC0_AFEM1_AFEM1_ASEM1_CLR1_CADS0_DTVA0_DTVB0_EPS0_FDSI0_GRPM1_GRVWA16_GRVWB16_GSUn1_GSUAMBSK_GSUC1_GSUWGMRR1_GLS0_ISA942_IU1_K1_LBSPPA1024_LBSPPB512_LBSPPM0_LPA32_LPB32_LPM0_LRVW16_LWPMn1_MIAV0_MIWT2_2_MO40_NTn1_NTA0_NTB0_NTC0_NTD4_NTM0_NEPBS8_NLCA1_NLCB1_ONLL1_PGR2_PLR1_PKA1_SIA3_SS1_SU0_SUM1_SUS0_SPO0_SRVW0_SSO0_SVW2_SK0_SKXCCM0_TLDS1_ULSGRO0_USL1_UIOFGRO0_USFGROn1_VSn1_VWA2_VWB2_WSGRA0_WSGRB0_WS64_WG32_4_2_WGM1_WGMXCC4_WGMXCCGn1
    SolutionIndex: 36
    SolutionNameMin: Cijk_Ailk_Bljk_I8II_BH_UserArgs_MT128x32x128_MI16x16x1_SN_LDSB1_AFC0_AFEM1_AFEM1_ASEM1_CLR1_CADS0_DTVA0_DTVB0_EPS0_FDSI0_GRPM1_GRVWA16_GRVWB16_GSUn1_GSUAMBSK_GSUC1_GSUWGMRR1_GLS0_ISA942_IU1_K1_LBSPPA2048_LBSPPB256_LBSPPM0_LPA32_LPB32_LPM0_LRVW16_LWPMn1_MIAV0_MIWT2_2_MO40_NTn1_NTA0_NTB0_NTC0_NTD4_NTM0_NEPBS8_NLCA1_NLCB1_ONLL1_PGR2_PLR1_PKA1_SIA3_SS1_SU0_SUM1_SUS0_SPO0_SRVW0_SSO0_SVW2_SK0_SKXCCM0_TLDS1_ULSGRO0_USL1_UIOFGRO0_USFGROn1_VSn1_VWA2_VWB2_WSGRA0_WSGRB0_WS64_WG64_4_1_WGM1_WGMXCC4_WGMXCCGn1
    SolutionIndex: 37
    SolutionNameMin: Cijk_Ailk_Bljk_I8II_BH_UserArgs_MT64x16x128_MI16x16x1_SN_LDSB1_AFC0_AFEM1_AFEM1_ASEM1_CLR1_CADS0_DTVA0_DTVB0_EPS0_FDSI0_GRPM1_GRVWA16_GRVWB8_GSUn1_GSUAMBSK_GSUC1_GSUWGMRR1_GLS0_ISA942_IU1_K1_LBSPPA1024_LBSPPB128_LBSPPM0_LPA16_LPB32_LPM0_LRVW16_LWPMn1_MIAV0_MIWT1_1_MO40_NTn1_NTA0_NTB0_NTC0_NTD4_NTM0_NEPBS8_NLCA1_NLCB1_ONLL1_PGR2_PLR1_PKA1_SIA3_SS1_SU0_SUM1_SUS0_SPO0_SRVW0_SSO0_SVW1_SK0_SKXCCM0_TLDS1_ULSGRO0_USL1_UIOFGRO0_USFGROn1_VSn1_VWA1_VWB1_WSGRA0_WSGRB0_WS64_WG64_4_1_WGM1_WGMXCC4_WGMXCCGn1
    SolutionIndex: 38
    SolutionNameMin: Cijk_Ailk_Bljk_I8II_BH_UserArgs_MT128x32x128_MI16x16x1_SN_LDSB1_AFC0_AFEM1_AFEM1_ASEM1_CLR1_CADS0_DTVA0_DTVB0_EPS0_FDSI0_GRPM1_GRVWA16_GRVWB16_GSUn1_GSUAMBSK_GSUC1_GSUWGMRR1_GLS0_ISA942_IU1_K1_LBSPPA2048_LBSPPB128_LBSPPM0_LPA64_LPB32_LPM0_LRVW16_LWPMn1_MIAV0_MIWT4_1_MO40_NTn1_NTA0_NTB0_NTC0_NTD4_NTM0_NEPBS8_NLCA1_NLCB1_ONLL1_PGR2_PLR1_PKA1_SIA3_SS1_SU0_SUM1_SUS0_SPO0_SRVW0_SSO0_SVW4_SK0_SKXCCM0_TLDS1_ULSGRO0_USL1_UIOFGRO0_USFGROn1_VSn1_VWA4_VWB1_WSGRA0_WSGRB0_WS64_WG32_8_1_WGM1_WGMXCC4_WGMXCCGn1
    SolutionIndex: 39
    SolutionNameMin: Cijk_Ailk_Bljk_I8II_BH_UserArgs_MT256x32x128_MI16x16x1_SN_LDSB1_AFC0_AFEM1_AFEM1_ASEM1_CLR1_CADS0_DTVA0_DTVB0_EPS0_FDSI0_GRPM1_GRVWA16_GRVWB16_GSUn1_GSUAMBSK_GSUC1_GSUWGMRR1_GLS0_ISA942_IU1_K1_LBSPPA4096_LBSPPB256_LBSPPM0_LPA64_LPB32_LPM0_LRVW16_LWPMn1_MIAV0_MIWT4_2_MO40_NTn1_NTA0_NTB0_NTC0_NTD4_NTM0_NEPBS8_NLCA1_NLCB1_ONLL1_PGR2_PLR1_PKA1_SIA3_SS1_SU0_SUM1_SUS0_SPO0_SRVW0_SSO0_SVW4_SK0_SKXCCM0_TLDS1_ULSGRO0_USL1_UIOFGRO0_USFGROn1_VSn1_VWA4_VWB2_WSGRA0_WSGRB0_WS64_WG64_4_1_WGM1_WGMXCC4_WGMXCCGn1
    SolutionIndex: 40
    SolutionNameMin: Cijk_Ailk_Bljk_I8II_BH_UserArgs_MT512x32x64_MI32x32x1_SN_LDSB1_AFC0_AFEM1_AFEM1_ASEM1_CLR1_CADS0_DTVA0_DTVB0_EPS0_FDSI0_GRPM1_GRVWA16_GRVWB8_GSUn1_GSUAMBSK_GSUC1_GSUWGMRR1_GLS0_ISA942_IU1_K1_LBSPPA0_LBSPPB128_LBSPPM0_LPA0_LPB16_LPM0_LRVW16_LWPMn1_MIAV0_MIWT4_1_MO40_NTn1_NTA0_NTB0_NTC0_NTD4_NTM0_NEPBS8_NLCA1_NLCB1_ONLL1_PGR2_PLR1_PKA1_SIA3_SS1_SU0_SUM1_SUS0_SPO0_SRVW0_SSO0_SVW4_SK0_SKXCCM0_TLDS1_ULSGRO0_USL1_UIOFGRO0_USFGROn1_VSn1_VWA4_VWB1_WSGRA0_WSGRB0_WS64_WG128_2_1_WGM1_WGMXCC4_WGMXCCGn1
    SolutionIndex: 41
    SolutionNameMin: Cijk_Ailk_Bljk_I8II_BH_UserArgs_MT512x16x64_MI16x16x1_SN_LDSB1_AFC0_AFEM1_AFEM1_ASEM1_CLR1_CADS0_DTVA0_DTVB0_EPS0_FDSI0_GRPM1_GRVWA16_GRVWB4_GSUn1_GSUAMBSK_GSUC1_GSUWGMRR1_GLS0_ISA942_IU1_K1_LBSPPA4096_LBSPPB128_LBSPPM0_LPA64_LPB8_LPM0_LRVW8_LWPMn1_MIAV0_MIWT8_1_MO40_NTn1_NTA0_NTB0_NTC0_NTD4_NTM0_NEPBS8_NLCA1_NLCB1_ONLL1_PGR2_PLR1_PKA1_SIA3_SS1_SU0_SUM1_SUS0_SPO0_SRVW0_SSO4_SVW8_SK0_SKXCCM0_TLDS1_ULSGRO0_USL1_UIOFGRO0_USFGROn1_VSn1_VWA8_VWB1_WSGRA0_WSGRB0_WS64_WG64_4_1_WGM1_WGMXCC4_WGMXCCGn1
    SolutionIndex: 42
    SolutionNameMin: Cijk_Ailk_Bljk_I8II_BH_UserArgs_MT32x16x256_MI16x16x1_SN_LDSB1_AFC0_AFEM1_AFEM1_ASEM1_CLR1_CADS0_DTVA0_DTVB0_EPS0_FDSI0_GRPM1_GRVWA16_GRVWB16_GSUn1_GSUAMBSK_GSUC1_GSUWGMRR1_GLS0_ISA942_IU1_K1_LBSPPA512_LBSPPB256_LBSPPM0_LPA32_LPB32_LPM0_LRVW16_LWPMn1_MIAV0_MIWT2_1_MO40_NTn1_NTA0_NTB0_NTC0_NTD4_NTM0_NEPBS8_NLCA1_NLCB1_ONLL1_PGR2_PLR1_PKA1_SIA3_SS1_SU0_SUM1_SUS0_SPO0_SRVW0_SSO0_SVW2_SK0_SKXCCM0_TLDS1_ULSGRO0_USL1_UIOFGRO0_USFGROn1_VSn1_VWA2_VWB1_WSGRA0_WSGRB0_WS64_WG16_4_4_WGM1_WGMXCC4_WGMXCCGn1
    SolutionIndex: 43
    SolutionNameMin: Cijk_Ailk_Bljk_I8II_BH_UserArgs_MT32x16x256_MI16x16x1_SN_LDSB1_AFC0_AFEM1_AFEM1_ASEM1_CLR1_CADS0_DTVA0_DTVB0_EPS0_FDSI0_GRPM1_GRVWA16_GRVWB16_GSUn1_GSUAMBSK_GSUC1_GSUWGMRR1_GLS0_ISA942_IU1_K1_LBSPPA512_LBSPPB256_LBSPPM0_LPA16_LPB32_LPM0_LRVW16_LWPMn1_MIAV0_MIWT2_1_MO40_NTn1_NTA0_NTB0_NTC0_NTD4_NTM0_NEPBS8_NLCA1_NLCB1_ONLL1_PGR2_PLR1_PKA1_SIA3_SS1_SU0_SUM1_SUS0_SPO0_SRVW0_SSO0_SVW2_SK0_SKXCCM0_TLDS1_ULSGRO0_USL1_UIOFGRO0_USFGROn1_VSn1_VWA2_VWB1_WSGRA0_WSGRB0_WS64_WG16_4_4_WGM1_WGMXCC4_WGMXCCGn1
    SolutionIndex: 44
    SolutionNameMin: Cijk_Ailk_Bljk_I8II_BH_UserArgs_MT32x16x128_MI16x16x1_SN_LDSB1_AFC0_AFEM1_AFEM1_ASEM1_CLR1_CADS0_DTVA0_DTVB0_EPS0_FDSI0_GRPM1_GRVWA16_GRVWB8_GSUn1_GSUAMBSK_GSUC1_GSUWGMRR1_GLS0_ISA942_IU1_K1_LBSPPA512_LBSPPB128_LBSPPM0_LPA16_LPB32_LPM0_LRVW16_LWPMn1_MIAV0_MIWT1_1_MO40_NTn1_NTA0_NTB0_NTC0_NTD4_NTM0_NEPBS8_NLCA1_NLCB1_ONLL1_PGR2_PLR1_PKA1_SIA3_SS1_SU0_SUM1_SUS0_SPO0_SRVW0_SSO0_SVW1_SK0_SKXCCM0_TLDS1_ULSGRO0_USL1_UIOFGRO0_USFGROn1_VSn1_VWA1_VWB1_WSGRA0_WSGRB0_WS64_WG32_4_2_WGM1_WGMXCC4_WGMXCCGn1
    SolutionIndex: 45
    SolutionNameMin: Cijk_Ailk_Bljk_I8II_BH_UserArgs_MT32x16x128_MI16x16x1_SN_LDSB1_AFC0_AFEM1_AFEM1_ASEM1_CLR1_CADS0_DTVA0_DTVB0_EPS0_FDSI0_GRPM1_GRVWA16_GRVWB16_GSUn1_GSUAMBSK_GSUC1_GSUWGMRR1_GLS0_ISA942_IU1_K1_LBSPPA512_LBSPPB128_LBSPPM0_LPA16_LPB32_LPM0_LRVW16_LWPMn1_MIAV0_MIWT1_1_MO40_NTn1_NTA0_NTB0_NTC0_NTD4_NTM0_NEPBS8_NLCA1_NLCB1_ONLL1_PGR2_PLR1_PKA1_SIA3_SS1_SU0_SUM1_SUS0_SPO0_SRVW0_SSO0_SVW1_SK0_SKXCCM0_TLDS1_ULSGRO0_USL1_UIOFGRO0_USFGROn1_VSn1_VWA1_VWB1_WSGRA0_WSGRB0_WS64_WG32_4_1_WGM1_WGMXCC4_WGMXCCGn1
    SolutionIndex: 46
    SolutionNameMin: Cijk_Ailk_Bljk_I8II_BH_UserArgs_MT16x32x512_MI16x16x1_SN_LDSB0_AFC0_AFEM1_AFEM1_ASEM1_CLR1_CADS0_DTVA0_DTVB0_EPS0_FDSI0_GRPM1_GRVWA16_GRVWB16_GSUn1_GSUAMBSK_GSUC1_GSUWGMRR1_GLS0_ISA942_IU1_K1_LBSPPA256_LBSPPB512_LBSPPM0_LPA16_LPB32_LPM0_LRVW16_LWPMn1_MIAV0_MIWT1_1_MO40_NTn1_NTA0_NTB0_NTC0_NTD4_NTM0_NEPBS8_NLCA1_NLCB1_ONLL1_PGR2_PLR1_PKA1_SIA3_SS1_SU0_SUM1_SUS0_SPO0_SRVW0_SSO0_SVW1_SK0_SKXCCM0_TLDS1_ULSGRO0_USL1_UIOFGRO0_USFGROn1_VSn1_VWA1_VWB1_WSGRA0_WSGRB0_WS64_WG16_8_2_WGM1_WGMXCC4_WGMXCCGn1
    SolutionIndex: 47
    SolutionNameMin: Cijk_Ailk_Bljk_I8II_BH_UserArgs_MT16x32x512_MI16x16x1_SN_LDSB0_AFC0_AFEM1_AFEM1_ASEM1_CLR1_CADS0_DTVA0_DTVB0_EPS0_FDSI0_GRPM1_GRVWA16_GRVWB16_GSUn1_GSUAMBSK_GSUC1_GSUWGMRR1_GLS0_ISA942_IU1_K1_LBSPPA256_LBSPPB1024_LBSPPM0_LPA16_LPB32_LPM0_LRVW16_LWPMn1_MIAV0_MIWT1_2_MO40_NTn1_NTA0_NTB0_NTC0_NTD4_NTM0_NEPBS8_NLCA1_NLCB1_ONLL1_PGR2_PLR1_PKA1_SIA3_SS1_SU0_SUM1_SUS0_SPO0_SRVW0_SSO0_SVW1_SK0_SKXCCM0_TLDS1_ULSGRO0_USL1_UIOFGRO0_USFGROn1_VSn1_VWA1_VWB2_WSGRA0_WSGRB0_WS64_WG16_4_4_WGM1_WGMXCC4_WGMXCCGn1
    SolutionIndex: 48
    SolutionNameMin: Cijk_Ailk_Bljk_I8II_BH_UserArgs_MT32x16x512_MI16x16x1_SN_LDSB0_AFC0_AFEM1_AFEM1_ASEM1_CLR1_CADS0_DTVA0_DTVB0_EPS0_FDSI0_GRPM1_GRVWA16_GRVWB16_GSUn1_GSUAMBSK_GSUC1_GSUWGMRR1_GLS0_ISA942_IU1_K1_LBSPPA512_LBSPPB512_LBSPPM0_LPA32_LPB32_LPM0_LRVW16_LWPMn1_MIAV0_MIWT2_1_MO40_NTn1_NTA0_NTB0_NTC0_NTD4_NTM0_NEPBS8_NLCA1_NLCB1_ONLL1_PGR2_PLR1_PKA1_SIA3_SS1_SU0_SUM1_SUS0_SPO0_SRVW0_SSO0_SVW2_SK0_SKXCCM0_TLDS1_ULSGRO0_USL1_UIOFGRO0_USFGROn1_VSn1_VWA2_VWB1_WSGRA0_WSGRB0_WS64_WG16_4_4_WGM1_WGMXCC4_WGMXCCGn1
    SolutionIndex: 49
    SolutionNameMin: Cijk_Ailk_Bljk_I8II_BH_UserArgs_MT32x32x128_MI16x16x1_SN_LDSB0_AFC0_AFEM1_AFEM1_ASEM1_CLR1_CADS0_DTVA0_DTVB0_EPS0_FDSI0_GRPM1_GRVWA16_GRVWB16_GSUn1_GSUAMBSK_GSUC1_GSUWGMRR1_GLS0_ISA942_IU1_K1_LBSPPA512_LBSPPB128_LBSPPM0_LPA16_LPB32_LPM0_LRVW16_LWPMn1_MIAV0_MIWT1_1_MO40_NTn1_NTA0_NTB0_NTC0_NTD4_NTM0_NEPBS8_NLCA1_NLCB1_ONLL1_PGR2_PLR1_PKA1_SIA3_SS1_SU0_SUM1_SUS0_SPO0_SRVW0_SSO0_SVW1_SK0_SKXCCM0_TLDS1_ULSGRO0_USL1_UIOFGRO0_USFGROn1_VSn1_VWA1_VWB1_WSGRA0_WSGRB0_WS64_WG32_8_1_WGM1_WGMXCC4_WGMXCCGn1
    SolutionIndex: 50
    SolutionNameMin: Cijk_Ailk_Bljk_I8II_BH_UserArgs_MT64x32x256_MI16x16x1_SN_LDSB1_AFC0_AFEM1_AFEM1_ASEM1_CLR1_CADS0_DTVA0_DTVB0_EPS0_FDSI0_GRPM1_GRVWA16_GRVWB16_GSUn1_GSUAMBSK_GSUC1_GSUWGMRR1_GLS0_ISA942_IU1_K1_LBSPPA1024_LBSPPB512_LBSPPM0_LPA16_LPB32_LPM0_LRVW16_LWPMn1_MIAV0_MIWT1_2_MO40_NTn1_NTA0_NTB0_NTC0_NTD4_NTM0_NEPBS8_NLCA1_NLCB1_ONLL1_PGR2_PLR1_PKA1_SIA3_SS1_SU0_SUM1_SUS0_SPO0_SRVW0_SSO0_SVW1_SK0_SKXCCM0_TLDS1_ULSGRO0_USL1_UIOFGRO0_USFGROn1_VSn1_VWA1_VWB2_WSGRA0_WSGRB0_WS64_WG64_4_1_WGM1_WGMXCC4_WGMXCCGn1
    SolutionIndex: 51
    SolutionNameMin: Cijk_Ailk_Bljk_I8II_BH_UserArgs_MT64x48x256_MI16x16x1_SN_LDSB1_AFC0_AFEM1_AFEM1_ASEM1_CLR1_CADS0_DTVA0_DTVB0_EPS0_FDSI0_GRPM1_GRVWA16_GRVWB16_GSUn1_GSUAMBSK_GSUC1_GSUWGMRR1_GLS0_ISA942_IU1_K1_LBSPPA1024_LBSPPB256_LBSPPM0_LPA32_LPB32_LPM0_LRVW16_LWPMn1_MIAV0_MIWT2_3_MO40_NTn1_NTA0_NTB0_NTC0_NTD4_NTM0_NEPBS8_NLCA1_NLCB1_ONLL1_PGR2_PLR1_PKA1_SIA3_SS1_SU0_SUM1_SUS0_SPO0_SRVW0_SSO0_SVW2_SK0_SKXCCM0_TLDS1_ULSGRO0_USL1_UIOFGRO0_USFGROn1_VSn1_VWA2_VWB1_WSGRA0_WSGRB0_WS64_WG32_4_2_WGM1_WGMXCC4_WGMXCCGn1
    SolutionIndex: 52
    SolutionNameMin: Cijk_Ailk_Bljk_I8II_BH_UserArgs_MT64x32x128_MI16x16x1_SN_LDSB1_AFC0_AFEM1_AFEM1_ASEM1_CLR1_CADS0_DTVA0_DTVB0_EPS0_FDSI0_GRPM1_GRVWA16_GRVWB16_GSUn1_GSUAMBSK_GSUC1_GSUWGMRR1_GLS0_ISA942_IU1_K1_LBSPPA1024_LBSPPB256_LBSPPM0_LPA16_LPB32_LPM0_LRVW16_LWPMn1_MIAV0_MIWT1_2_MO40_NTn1_NTA0_NTB0_NTC0_NTD4_NTM0_NEPBS8_NLCA1_NLCB1_ONLL1_PGR2_PLR1_PKA1_SIA3_SS1_SU0_SUM1_SUS0_SPO0_SRVW0_SSO0_SVW1_SK0_SKXCCM0_TLDS1_ULSGRO0_USL1_UIOFGRO0_USFGROn1_VSn1_VWA1_VWB2_WSGRA0_WSGRB0_WS64_WG64_4_1_WGM1_WGMXCC4_WGMXCCGn1
    SolutionIndex: 53
    SolutionNameMin: Cijk_Ailk_Bljk_I8II_BH_UserArgs_MT64x32x256_MI16x16x1_SN_LDSB1_AFC0_AFEM1_AFEM1_ASEM1_CLR1_CADS0_DTVA0_DTVB0_EPS0_FDSI0_GRPM1_GRVWA16_GRVWB16_GSUn1_GSUAMBSK_GSUC1_GSUWGMRR1_GLS0_ISA942_IU1_K1_LBSPPA1024_LBSPPB256_LBSPPM0_LPA32_LPB32_LPM0_LRVW16_LWPMn1_MIAV0_MIWT2_1_MO40_NTn1_NTA0_NTB0_NTC0_NTD4_NTM0_NEPBS8_NLCA1_NLCB1_ONLL1_PGR2_PLR1_PKA1_SIA3_SS1_SU0_SUM1_SUS0_SPO0_SRVW0_SSO0_SVW2_SK0_SKXCCM0_TLDS1_ULSGRO0_USL1_UIOFGRO0_USFGROn1_VSn1_VWA2_VWB1_WSGRA0_WSGRB0_WS64_WG32_8_1_WGM1_WGMXCC4_WGMXCCGn1
    SolutionIndex: 54
    SolutionNameMin: Cijk_Ailk_Bljk_I8II_BH_UserArgs_MT64x16x512_MI16x16x1_SN_LDSB1_AFC0_AFEM1_AFEM1_ASEM1_CLR1_CADS0_DTVA0_DTVB0_EPS0_FDSI0_GRPM1_GRVWA16_GRVWB16_GSUn1_GSUAMBSK_GSUC1_GSUWGMRR1_GLS0_ISA942_IU1_K1_LBSPPA1024_LBSPPB512_LBSPPM0_LPA16_LPB32_LPM0_LRVW16_LWPMn1_MIAV0_MIWT1_1_MO40_NTn1_NTA0_NTB0_NTC0_NTD4_NTM0_NEPBS8_NLCA1_NLCB1_ONLL1_PGR2_PLR1_PKA1_SIA3_SS1_SU0_SUM1_SUS0_SPO0_SRVW0_SSO0_SVW1_SK0_SKXCCM0_TLDS1_ULSGRO0_USL1_UIOFGRO0_USFGROn1_VSn1_VWA1_VWB1_WSGRA0_WSGRB0_WS64_WG64_4_1_WGM1_WGMXCC4_WGMXCCGn1
    SolutionIndex: 55
    SolutionNameMin: Cijk_Ailk_Bljk_I8II_BH_UserArgs_MT128x32x256_MI16x16x1_SN_LDSB1_AFC0_AFEM1_AFEM1_ASEM1_CLR1_CADS0_DTVA0_DTVB0_EPS0_FDSI0_GRPM1_GRVWA16_GRVWB16_GSUn1_GSUAMBSK_GSUC1_GSUWGMRR1_GLS0_ISA942_IU1_K1_LBSPPA2048_LBSPPB512_LBSPPM0_LPA32_LPB32_LPM0_LRVW16_LWPMn1_MIAV0_MIWT2_2_MO40_NTn1_NTA0_NTB0_NTC0_NTD4_NTM0_NEPBS8_NLCA1_NLCB1_ONLL1_PGR2_PLR1_PKA1_SIA3_SS1_SU0_SUM1_SUS0_SPO0_SRVW0_SSO0_SVW2_SK0_SKXCCM0_TLDS1_ULSGRO0_USL1_UIOFGRO0_USFGROn1_VSn1_VWA2_VWB2_WSGRA0_WSGRB0_WS64_WG64_4_1_WGM1_WGMXCC4_WGMXCCGn1
    SolutionIndex: 56
    SolutionNameMin: Cijk_Ailk_Bljk_I8II_BH_UserArgs_MT32x32x256_MI16x16x1_SN_LDSB1_AFC0_AFEM1_AFEM1_ASEM1_CLR1_CADS0_DTVA0_DTVB0_EPS0_FDSI0_GRPM1_GRVWA16_GRVWB16_GSUn1_GSUAMBSK_GSUC1_GSUWGMRR1_GLS0_ISA942_IU1_K1_LBSPPA512_LBSPPB512_LBSPPM0_LPA16_LPB32_LPM0_LRVW16_LWPMn1_MIAV0_MIWT1_2_MO40_NTn1_NTA0_NTB0_NTC0_NTD4_NTM0_NEPBS8_NLCA1_NLCB1_ONLL1_PGR2_PLR1_PKA1_SIA3_SS1_SU0_SUM1_SUS0_SPO0_SRVW0_SSO0_SVW1_SK0_SKXCCM0_TLDS1_ULSGRO0_USL1_UIOFGRO0_USFGROn1_VSn1_VWA1_VWB2_WSGRA0_WSGRB0_WS64_WG32_4_2_WGM1_WGMXCC4_WGMXCCGn1
    SolutionIndex: 57
    SolutionNameMin: Cijk_Ailk_Bljk_I8II_BH_UserArgs_MT32x32x256_MI16x16x1_SN_LDSB1_AFC0_AFEM1_AFEM1_ASEM1_CLR1_CADS0_DTVA0_DTVB0_EPS0_FDSI0_GRPM1_GRVWA16_GRVWB16_GSUn1_GSUAMBSK_GSUC1_GSUWGMRR1_GLS0_ISA942_IU1_K1_LBSPPA512_LBSPPB256_LBSPPM0_LPA32_LPB32_LPM0_LRVW16_LWPMn1_MIAV0_MIWT2_1_MO40_NTn1_NTA0_NTB0_NTC0_NTD4_NTM0_NEPBS8_NLCA1_NLCB1_ONLL1_PGR2_PLR1_PKA1_SIA3_SS1_SU0_SUM1_SUS0_SPO0_SRVW0_SSO0_SVW2_SK0_SKXCCM0_TLDS1_ULSGRO0_USL1_UIOFGRO0_USFGROn1_VSn1_VWA2_VWB1_WSGRA0_WSGRB0_WS64_WG16_8_2_WGM1_WGMXCC4_WGMXCCGn1
    SolutionIndex: 58
    SolutionNameMin: Cijk_Ailk_Bljk_I8II_BH_UserArgs_MT128x48x128_MI16x16x1_SN_LDSB1_AFC0_AFEM1_AFEM1_ASEM1_CLR1_CADS0_DTVA0_DTVB0_EPS0_FDSI0_GRPM1_GRVWA16_GRVWB8_GSUn1_GSUAMBSK_GSUC1_GSUWGMRR1_GLS0_ISA942_IU1_K1_LBSPPA2048_LBSPPB128_LBSPPM0_LPA32_LPB32_LPM0_LRVW16_LWPMn1_MIAV0_MIWT2_3_MO40_NTn1_NTA0_NTB0_NTC0_NTD4_NTM0_NEPBS8_NLCA1_NLCB1_ONLL1_PGR2_PLR1_PKA1_SIA3_SS1_SU0_SUM1_SUS0_SPO0_SRVW0_SSO0_SVW2_SK0_SKXCCM0_TLDS1_ULSGRO0_USL1_UIOFGRO0_USFGROn1_VSn1_VWA2_VWB1_WSGRA0_WSGRB0_WS64_WG64_4_1_WGM1_WGMXCC4_WGMXCCGn1
    SolutionIndex: 59
    SolutionNameMin: Cijk_Ailk_Bljk_I8II_BH_UserArgs_MT32x48x256_MI16x16x1_SN_LDSB1_AFC0_AFEM1_AFEM1_ASEM1_CLR1_CADS0_DTVA0_DTVB0_EPS0_FDSI0_GRPM1_GRVWA16_GRVWB16_GSUn1_GSUAMBSK_GSUC1_GSUWGMRR1_GLS0_ISA942_IU1_K1_LBSPPA512_LBSPPB256_LBSPPM0_LPA16_LPB32_LPM0_LRVW16_LWPMn1_MIAV0_MIWT1_3_MO40_NTn1_NTA0_NTB0_NTC0_NTD4_NTM0_NEPBS8_NLCA1_NLCB1_ONLL1_PGR2_PLR1_PKA1_SIA3_SS1_SU0_SUM1_SUS0_SPO0_SRVW0_SSO0_SVW1_SK0_SKXCCM0_TLDS1_ULSGRO0_USL1_UIOFGRO0_USFGROn1_VSn1_VWA1_VWB1_WSGRA0_WSGRB0_WS64_WG32_4_2_WGM1_WGMXCC4_WGMXCCGn1
    SolutionIndex: 60
    SolutionNameMin: Cijk_Ailk_Bljk_I8II_BH_UserArgs_MT256x32x128_MI32x32x1_SN_LDSB1_AFC0_AFEM1_AFEM1_ASEM1_CLR1_CADS0_DTVA0_DTVB0_EPS0_FDSI0_GRPM1_GRVWA16_GRVWB16_GSUn1_GSUAMBSK_GSUC1_GSUWGMRR1_GLS0_ISA942_IU1_K1_LBSPPA0_LBSPPB128_LBSPPM0_LPA0_LPB16_LPM0_LRVW16_LWPMn1_MIAV0_MIWT2_1_MO40_NTn1_NTA0_NTB0_NTC0_NTD4_NTM0_NEPBS8_NLCA1_NLCB1_ONLL1_PGR2_PLR1_PKA1_SIA3_SS1_SU0_SUM1_SUS0_SPO0_SRVW0_SSO0_SVW2_SK0_SKXCCM0_TLDS1_ULSGRO0_USL1_UIOFGRO0_USFGROn1_VSn1_VWA2_VWB1_WSGRA0_WSGRB0_WS64_WG128_2_1_WGM1_WGMXCC4_WGMXCCGn1
    SolutionIndex: 61
    SolutionNameMin: Cijk_Ailk_Bljk_I8II_BH_UserArgs_MT256x48x128_MI16x16x1_SN_LDSB1_AFC0_AFEM1_AFEM1_ASEM1_CLR1_CADS0_DTVA0_DTVB0_EPS0_FDSI0_GRPM1_GRVWA16_GRVWB8_GSUn1_GSUAMBSK_GSUC1_GSUWGMRR1_GLS0_ISA942_IU1_K1_LBSPPA4096_LBSPPB128_LBSPPM0_LPA64_LPB32_LPM0_LRVW16_LWPMn1_MIAV0_MIWT4_3_MO40_NTn1_NTA0_NTB0_NTC0_NTD4_NTM0_NEPBS8_NLCA1_NLCB1_ONLL1_PGR2_PLR1_PKA1_SIA3_SS1_SU0_SUM1_SUS0_SPO0_SRVW0_SSO0_SVW4_SK0_SKXCCM0_TLDS1_ULSGRO0_USL1_UIOFGRO0_USFGROn1_VSn1_VWA4_VWB1_WSGRA0_WSGRB0_WS64_WG64_4_1_WGM1_WGMXCC4_WGMXCCGn1
    SolutionIndex: 62
    SolutionNameMin: Cijk_Ailk_Bljk_I8II_BH_UserArgs_MT256x48x64_MI16x16x1_SN_LDSB1_AFC0_AFEM1_AFEM1_ASEM1_CLR1_CADS0_DTVA0_DTVB0_EPS0_FDSI0_GRPM1_GRVWA16_GRVWB4_GSUn1_GSUAMBSK_GSUC1_GSUWGMRR1_GLS0_ISA942_IU1_K1_LBSPPA2048_LBSPPB128_LBSPPM0_LPA64_LPB8_LPM0_LRVW8_LWPMn1_MIAV0_MIWT4_3_MO40_NTn1_NTA0_NTB0_NTC0_NTD4_NTM0_NEPBS8_NLCA1_NLCB1_ONLL1_PGR2_PLR1_PKA1_SIA3_SS1_SU0_SUM1_SUS0_SPO0_SRVW0_SSO0_SVW4_SK0_SKXCCM0_TLDS1_ULSGRO0_USL1_UIOFGRO0_USFGROn1_VSn1_VWA4_VWB1_WSGRA0_WSGRB0_WS64_WG64_4_1_WGM1_WGMXCC4_WGMXCCGn1
    SolutionIndex: 63
    SolutionNameMin: Cijk_Ailk_Bljk_I8II_BH_UserArgs_MT384x32x64_MI16x16x1_SN_LDSB1_AFC0_AFEM1_AFEM1_ASEM1_CLR1_CADS0_DTVA0_DTVB0_EPS0_FDSI0_GRPM1_GRVWA16_GRVWB8_GSUn1_GSUAMBSK_GSUC1_GSUWGMRR1_GLS0_ISA942_IU1_K1_LBSPPA3072_LBSPPB128_LBSPPM0_LPA32_LPB8_LPM0_LRVW8_LWPMn1_MIAV0_MIWT6_2_MO40_NTn1_NTA0_NTB0_NTC0_NTD4_NTM0_NEPBS6_NLCA1_NLCB1_ONLL1_PGR2_PLR1_PKA1_SIA3_SS1_SU0_SUM1_SUS0_SPO0_SRVW0_SSO0_SVW2_SK0_SKXCCM0_TLDS1_ULSGRO0_USL1_UIOFGRO0_USFGROn1_VSn1_VWA2_VWB2_WSGRA0_WSGRB0_WS64_WG64_4_1_WGM1_WGMXCC4_WGMXCCGn1
    SolutionIndex: 64
    SolutionNameMin: Cijk_Ailk_Bljk_I8II_BH_UserArgs_MT256x32x64_MI16x16x1_SN_LDSB1_AFC0_AFEM1_AFEM1_ASEM1_CLR1_CADS0_DTVA0_DTVB0_EPS0_FDSI0_GRPM1_GRVWA16_GRVWB8_GSUn1_GSUAMBSK_GSUC1_GSUWGMRR1_GLS0_ISA942_IU1_K1_LBSPPA2048_LBSPPB128_LBSPPM0_LPA64_LPB8_LPM0_LRVW8_LWPMn1_MIAV0_MIWT4_2_MO40_NTn1_NTA0_NTB0_NTC0_NTD4_NTM0_NEPBS8_NLCA1_NLCB1_ONLL1_PGR2_PLR1_PKA1_SIA3_SS1_SU0_SUM1_SUS0_SPO0_SRVW0_SSO0_SVW4_SK0_SKXCCM0_TLDS1_ULSGRO0_USL1_UIOFGRO0_USFGROn1_VSn1_VWA4_VWB2_WSGRA0_WSGRB0_WS64_WG64_4_1_WGM1_WGMXCC4_WGMXCCGn1
    SolutionIndex: 65
    SolutionNameMin: Cijk_Ailk_Bljk_I8II_BH_UserArgs_MT384x32x64_MI16x16x1_SN_LDSB1_AFC0_AFEM1_AFEM1_ASEM1_CLR1_CADS0_DTVA0_DTVB0_EPS0_FDSI0_GRPM1_GRVWA16_GRVWB8_GSUn1_GSUAMBSK_GSUC1_GSUWGMRR1_GLS0_ISA942_IU1_K1_LBSPPA3072_LBSPPB128_LBSPPM0_LPA32_LPB8_LPM0_LRVW8_LWPMn1_MIAV0_MIWT6_2_MO40_NTn1_NTA0_NTB0_NTC0_NTD4_NTM0_NEPBS6_NLCA1_NLCB1_ONLL1_PGR2_PLR1_PKA1_SIA3_SS1_SU0_SUM1_SUS0_SPO0_SRVW0_SSO4_SVW2_SK0_SKXCCM0_TLDS1_ULSGRO0_USL1_UIOFGRO0_USFGROn1_VSn1_VWA2_VWB2_WSGRA0_WSGRB0_WS64_WG64_4_1_WGM1_WGMXCC4_WGMXCCGn1
    SolutionIndex: 66
    SolutionNameMin: Cijk_Ailk_Bljk_I8II_BH_UserArgs_MT512x32x64_MI32x32x1_SN_LDSB1_AFC0_AFEM1_AFEM1_ASEM1_CLR1_CADS0_DTVA0_DTVB0_EPS0_FDSI0_GRPM1_GRVWA16_GRVWB8_GSUn1_GSUAMBSK_GSUC1_GSUWGMRR1_GLS0_ISA942_IU1_K1_LBSPPA0_LBSPPB128_LBSPPM0_LPA0_LPB16_LPM0_LRVW16_LWPMn1_MIAV0_MIWT4_1_MO40_NTn1_NTA0_NTB0_NTC0_NTD4_NTM0_NEPBS8_NLCA1_NLCB1_ONLL1_PGR2_PLR1_PKA1_SIA3_SS1_SU0_SUM1_SUS0_SPO0_SRVW0_SSO4_SVW4_SK0_SKXCCM0_TLDS1_ULSGRO0_USL1_UIOFGRO0_USFGROn1_VSn1_VWA4_VWB1_WSGRA0_WSGRB0_WS64_WG128_2_1_WGM1_WGMXCC4_WGMXCCGn1
    SolutionIndex: 67
    SolutionNameMin: Cijk_Ailk_Bljk_I8II_BH_UserArgs_MT256x32x64_MI16x16x1_SN_LDSB1_AFC0_AFEM1_AFEM1_ASEM1_CLR1_CADS0_DTVA0_DTVB0_EPS0_FDSI0_GRPM1_GRVWA16_GRVWB8_GSUn1_GSUAMBSK_GSUC1_GSUWGMRR1_GLS0_ISA942_IU1_K1_LBSPPA2048_LBSPPB128_LBSPPM0_LPA64_LPB8_LPM0_LRVW8_LWPMn1_MIAV0_MIWT4_2_MO40_NTn1_NTA0_NTB0_NTC0_NTD4_NTM0_NEPBS8_NLCA1_NLCB1_ONLL1_PGR2_PLR1_PKA1_SIA3_SS1_SU0_SUM1_SUS0_SPO0_SRVW0_SSO4_SVW4_SK0_SKXCCM0_TLDS1_ULSGRO0_USL1_UIOFGRO0_USFGROn1_VSn1_VWA4_VWB2_WSGRA0_WSGRB0_WS64_WG64_4_1_WGM1_WGMXCC4_WGMXCCGn1
    SolutionIndex: 68
    SolutionNameMin: Cijk_Ailk_Bljk_I8II_BH_UserArgs_MT16x16x256_MI16x16x1_SN_LDSB0_AFC0_AFEM1_AFEM1_ASEM1_CLR1_CADS0_DTVA0_DTVB0_EPS0_FDSI0_GRPM1_GRVWA1_GRVWB16_GSUn1_GSUAMBSK_GSUC1_GSUWGMRR1_GLS0_ISA942_IU1_K1_LBSPPA256_LBSPPB256_LBSPPM0_LPA16_LPB32_LPM0_LRVW16_LWPMn1_MIAV0_MIWT1_1_MO40_NTn1_NTA0_NTB0_NTC0_NTD4_NTM0_NEPBS8_NLCA1_NLCB1_ONLL1_PGR2_PLR1_PKA1_SIA3_SS1_SU0_SUM1_SUS0_SPO0_SRVW0_SSO0_SVW1_SK0_SKXCCM0_TLDS1_ULSGRO0_USL1_UIOFGRO0_USFGROn1_VSn1_VWA1_VWB1_WSGRA0_WSGRB0_WS64_WG16_4_4_WGM1_WGMXCC4_WGMXCCGn1
    SolutionIndex: 69
    SolutionNameMin: Cijk_Ailk_Bljk_I8II_BH_UserArgs_MT16x32x256_MI16x16x1_SN_LDSB1_AFC0_AFEM1_AFEM1_ASEM1_CLR1_CADS0_DTVA0_DTVB0_EPS0_FDSI0_GRPM1_GRVWA1_GRVWB16_GSUn1_GSUAMBSK_GSUC1_GSUWGMRR1_GLS0_ISA942_IU1_K1_LBSPPA256_LBSPPB512_LBSPPM0_LPA16_LPB32_LPM0_LRVW16_LWPMn1_MIAV0_MIWT1_2_MO40_NTn1_NTA0_NTB0_NTC0_NTD4_NTM0_NEPBS8_NLCA1_NLCB1_ONLL1_PGR2_PLR1_PKA1_SIA3_SS1_SU0_SUM1_SUS0_SPO0_SRVW0_SSO0_SVW1_SK0_SKXCCM0_TLDS1_ULSGRO0_USL1_UIOFGRO0_USFGROn1_VSn1_VWA1_VWB2_WSGRA0_WSGRB0_WS64_WG16_4_4_WGM1_WGMXCC4_WGMXCCGn1
    SolutionIndex: 70
    SolutionNameMin: Cijk_Ailk_Bljk_I8II_BH_UserArgs_MT32x32x128_MI16x16x1_SN_LDSB1_AFC0_AFEM1_AFEM1_ASEM1_CLR1_CADS0_DTVA0_DTVB0_EPS0_FDSI0_GRPM1_GRVWA16_GRVWB16_GSUn1_GSUAMBSK_GSUC1_GSUWGMRR1_GLS0_ISA942_IU1_K1_LBSPPA512_LBSPPB128_LBSPPM0_LPA32_LPB32_LPM0_LRVW16_LWPMn1_MIAV0_MIWT2_1_MO40_NTn1_NTA0_NTB0_NTC0_NTD4_NTM0_NEPBS8_NLCA1_NLCB1_ONLL1_PGR2_PLR1_PKA1_SIA3_SS1_SU0_SUM1_SUS0_SPO0_SRVW0_SSO0_SVW2_SK0_SKXCCM0_TLDS1_ULSGRO0_USL1_UIOFGRO0_USFGROn1_VSn1_VWA2_VWB1_WSGRA0_WSGRB0_WS64_WG16_8_2_WGM1_WGMXCC4_WGMXCCGn1
    SolutionIndex: 71
    SolutionNameMin: Cijk_Ailk_Bljk_I8II_BH_UserArgs_MT32x32x256_MI16x16x1_SN_LDSB1_AFC0_AFEM1_AFEM1_ASEM1_CLR1_CADS0_DTVA0_DTVB0_EPS0_FDSI0_GRPM1_GRVWA16_GRVWB16_GSUn1_GSUAMBSK_GSUC1_GSUWGMRR1_GLS0_ISA942_IU1_K1_LBSPPA512_LBSPPB512_LBSPPM0_LPA32_LPB32_LPM0_LRVW16_LWPMn1_MIAV0_MIWT2_2_MO40_NTn1_NTA0_NTB0_NTC0_NTD4_NTM0_NEPBS8_NLCA1_NLCB1_ONLL1_PGR2_PLR1_PKA1_SIA3_SS1_SU0_SUM1_SUS0_SPO0_SRVW0_SSO0_SVW2_SK0_SKXCCM0_TLDS1_ULSGRO0_USL1_UIOFGRO0_USFGROn1_VSn1_VWA2_VWB2_WSGRA0_WSGRB0_WS64_WG16_4_4_WGM1_WGMXCC4_WGMXCCGn1
    SolutionIndex: 72
    SolutionNameMin: Cijk_Ailk_Bljk_I8II_BH_UserArgs_MT32x32x256_MI32x32x1_SN_LDSB1_AFC0_AFEM1_AFEM1_ASEM1_CLR1_CADS0_DTVA0_DTVB0_EPS0_FDSI0_GRPM1_GRVWA16_GRVWB16_GSUn1_GSUAMBSK_GSUC1_GSUWGMRR1_GLS0_ISA942_IU1_K1_LBSPPA0_LBSPPB256_LBSPPM0_LPA0_LPB16_LPM0_LRVW16_LWPMn1_MIAV0_MIWT1_1_MO40_NTn1_NTA0_NTB0_NTC0_NTD4_NTM0_NEPBS8_NLCA1_NLCB1_ONLL1_PGR2_PLR1_PKA1_SIA3_SS1_SU0_SUM1_SUS0_SPO0_SRVW0_SSO0_SVW1_SK0_SKXCCM0_TLDS1_ULSGRO0_USL1_UIOFGRO0_USFGROn1_VSn1_VWA1_VWB1_WSGRA0_WSGRB0_WS64_WG32_2_4_WGM1_WGMXCC4_WGMXCCGn1
    SolutionIndex: 73
    SolutionNameMin: Cijk_Ailk_Bljk_I8II_BH_UserArgs_MT32x32x128_MI32x32x1_SN_LDSB1_AFC0_AFEM1_AFEM1_ASEM1_CLR1_CADS0_DTVA0_DTVB0_EPS0_FDSI0_GRPM1_GRVWA16_GRVWB16_GSUn1_GSUAMBSK_GSUC1_GSUWGMRR1_GLS0_ISA942_IU1_K1_LBSPPA0_LBSPPB128_LBSPPM0_LPA0_LPB16_LPM0_LRVW16_LWPMn1_MIAV0_MIWT1_1_MO40_NTn1_NTA0_NTB0_NTC0_NTD4_NTM0_NEPBS8_NLCA1_NLCB1_ONLL1_PGR2_PLR1_PKA1_SIA3_SS1_SU0_SUM1_SUS0_SPO0_SRVW0_SSO0_SVW1_SK0_SKXCCM0_TLDS1_ULSGRO0_USL1_UIOFGRO0_USFGROn1_VSn1_VWA1_VWB1_WSGRA0_WSGRB0_WS64_WG32_2_4_WGM1_WGMXCC4_WGMXCCGn1
    SolutionIndex: 74
    SolutionNameMin: Cijk_Ailk_Bljk_I8II_BH_UserArgs_MT32x32x128_MI32x32x1_SN_LDSB1_AFC0_AFEM1_AFEM1_ASEM1_CLR1_CADS0_DTVA0_DTVB0_EPS0_FDSI0_GRPM1_GRVWA16_GRVWB16_GSUn1_GSUAMBSK_GSUC1_GSUWGMRR1_GLS0_ISA942_IU1_K1_LBSPPA0_LBSPPB128_LBSPPM0_LPA0_LPB16_LPM0_LRVW16_LWPMn1_MIAV0_MIWT1_1_MO40_NTn1_NTA0_NTB0_NTC0_NTD4_NTM0_NEPBS8_NLCA1_NLCB1_ONLL1_PGR2_PLR1_PKA1_SIA3_SS1_SU0_SUM1_SUS0_SPO0_SRVW0_SSO0_SVW1_SK0_SKXCCM0_TLDS1_ULSGRO0_USL1_UIOFGRO0_USFGROn1_VSn1_VWA1_VWB1_WSGRA0_WSGRB0_WS64_WG32_2_2_WGM1_WGMXCC4_WGMXCCGn1
    SolutionIndex: 75
    SolutionNameMin: Cijk_Ailk_Bljk_I8II_BH_UserArgs_MT32x32x256_MI16x16x1_SN_LDSB1_AFC0_AFEM1_AFEM1_ASEM1_CLR1_CADS0_DTVA0_DTVB0_EPS0_FDSI0_GRPM1_GRVWA16_GRVWB16_GSUn1_GSUAMBSK_GSUC1_GSUWGMRR1_GLS0_ISA942_IU1_K1_LBSPPA512_LBSPPB512_LBSPPM0_LPA16_LPB32_LPM0_LRVW16_LWPMn1_MIAV0_MIWT2_2_MO40_NTn1_NTA0_NTB0_NTC0_NTD4_NTM0_NEPBS8_NLCA1_NLCB1_ONLL1_PGR2_PLR1_PKA1_SIA3_SS1_SU0_SUM1_SUS0_SPO0_SRVW0_SSO0_SVW2_SK0_SKXCCM0_TLDS1_ULSGRO0_USL1_UIOFGRO0_USFGROn1_VSn1_VWA2_VWB2_WSGRA0_WSGRB0_WS64_WG16_4_4_WGM1_WGMXCC4_WGMXCCGn1
    SolutionIndex: 76
    SolutionNameMin: Cijk_Ailk_Bljk_I8II_BH_UserArgs_MT32x48x256_MI16x16x1_SN_LDSB0_AFC0_AFEM1_AFEM1_ASEM1_CLR1_CADS0_DTVA0_DTVB0_EPS0_FDSI0_GRPM1_GRVWA16_GRVWB16_GSUn1_GSUAMBSK_GSUC1_GSUWGMRR1_GLS0_ISA942_IU1_K1_LBSPPA512_LBSPPB256_LBSPPM0_LPA16_LPB32_LPM0_LRVW16_LWPMn1_MIAV0_MIWT1_3_MO40_NTn1_NTA0_NTB0_NTC0_NTD4_NTM0_NEPBS8_NLCA1_NLCB1_ONLL1_PGR2_PLR1_PKA1_SIA3_SS1_SU0_SUM1_SUS0_SPO0_SRVW0_SSO0_SVW1_SK0_SKXCCM0_TLDS1_ULSGRO0_USL1_UIOFGRO0_USFGROn1_VSn1_VWA1_VWB1_WSGRA0_WSGRB0_WS64_WG32_4_2_WGM1_WGMXCC4_WGMXCCGn1
    SolutionIndex: 77
    SolutionNameMin: Cijk_Ailk_Bljk_I8II_BH_UserArgs_MT32x64x256_MI16x16x1_SN_LDSB0_AFC0_AFEM1_AFEM1_ASEM1_CLR1_CADS0_DTVA0_DTVB0_EPS0_FDSI0_GRPM1_GRVWA16_GRVWB16_GSUn1_GSUAMBSK_GSUC1_GSUWGMRR1_GLS0_ISA942_IU1_K1_LBSPPA512_LBSPPB512_LBSPPM0_LPA16_LPB32_LPM0_LRVW16_LWPMn1_MIAV0_MIWT1_2_MO40_NTn1_NTA0_NTB0_NTC0_NTD4_NTM0_NEPBS8_NLCA1_NLCB1_ONLL1_PGR2_PLR1_PKA1_SIA3_SS1_SU0_SUM1_SUS0_SPO0_SRVW0_SSO0_SVW1_SK0_SKXCCM0_TLDS1_ULSGRO0_USL1_UIOFGRO0_USFGROn1_VSn1_VWA1_VWB2_WSGRA0_WSGRB0_WS64_WG32_8_1_WGM1_WGMXCC4_WGMXCCGn1
    SolutionIndex: 78
    SolutionNameMin: Cijk_Ailk_Bljk_I8II_BH_UserArgs_MT128x64x128_MI16x16x1_SN_LDSB0_AFC0_AFEM1_AFEM1_ASEM1_CLR1_CADS0_DTVA0_DTVB0_EPS0_FDSI0_GRPM1_GRVWA16_GRVWB16_GSUn1_GSUAMBSK_GSUC1_GSUWGMRR1_GLS0_ISA942_IU1_K1_LBSPPA2048_LBSPPB512_LBSPPM0_LPA32_LPB32_LPM0_LRVW16_LWPMn1_MIAV0_MIWT2_4_MO40_NTn1_NTA0_NTB0_NTC0_NTD4_NTM0_NEPBS8_NLCA1_NLCB1_ONLL1_PGR2_PLR1_PKA1_SIA3_SS1_SU0_SUM1_SUS0_SPO0_SRVW0_SSO0_SVW2_SK0_SKXCCM0_TLDS1_ULSGRO0_USL1_UIOFGRO0_USFGROn1_VSn1_VWA2_VWB4_WSGRA0_WSGRB0_WS64_WG64_4_1_WGM1_WGMXCC4_WGMXCCGn1
    SolutionIndex: 79
    SolutionNameMin: Cijk_Ailk_Bljk_I8II_BH_UserArgs_MT64x32x128_MI16x16x1_SN_LDSB0_AFC0_AFEM1_AFEM1_ASEM1_CLR1_CADS0_DTVA0_DTVB0_EPS0_FDSI0_GRPM1_GRVWA16_GRVWB16_GSUn1_GSUAMBSK_GSUC1_GSUWGMRR1_GLS0_ISA942_IU1_K1_LBSPPA1024_LBSPPB256_LBSPPM0_LPA16_LPB32_LPM0_LRVW16_LWPMn1_MIAV0_MIWT1_2_MO40_NTn1_NTA0_NTB0_NTC0_NTD4_NTM0_NEPBS8_NLCA1_NLCB1_ONLL1_PGR2_PLR1_PKA1_SIA3_SS1_SU0_SUM1_SUS0_SPO0_SRVW0_SSO0_SVW1_SK0_SKXCCM0_TLDS1_ULSGRO0_USL1_UIOFGRO0_USFGROn1_VSn1_VWA1_VWB2_WSGRA0_WSGRB0_WS64_WG64_4_1_WGM1_WGMXCC4_WGMXCCGn1
    SolutionIndex: 80
    SolutionNameMin: Cijk_Ailk_Bljk_I8II_BH_UserArgs_MT64x64x256_MI16x16x1_SN_LDSB1_AFC0_AFEM1_AFEM1_ASEM1_CLR1_CADS0_DTVA0_DTVB0_EPS0_FDSI0_GRPM1_GRVWA16_GRVWB16_GSUn1_GSUAMBSK_GSUC1_GSUWGMRR1_GLS0_ISA942_IU1_K1_LBSPPA1024_LBSPPB512_LBSPPM0_LPA64_LPB32_LPM0_LRVW16_LWPMn1_MIAV0_MIWT4_2_MO40_NTn1_NTA0_NTB0_NTC0_NTD4_NTM0_NEPBS8_NLCA1_NLCB1_ONLL1_PGR2_PLR1_PKA1_SIA3_SS1_SU0_SUM1_SUS0_SPO0_SRVW0_SSO0_SVW4_SK0_SKXCCM0_TLDS1_ULSGRO0_USL1_UIOFGRO0_USFGROn1_VSn1_VWA4_VWB2_WSGRA0_WSGRB0_WS64_WG16_8_2_WGM1_WGMXCC4_WGMXCCGn1
    SolutionIndex: 81
    SolutionNameMin: Cijk_Ailk_Bljk_I8II_BH_UserArgs_MT64x64x256_MI16x16x1_SN_LDSB1_AFC0_AFEM1_AFEM1_ASEM1_CLR1_CADS0_DTVA0_DTVB0_EPS0_FDSI0_GRPM1_GRVWA16_GRVWB16_GSUn1_GSUAMBSK_GSUC1_GSUWGMRR1_GLS0_ISA942_IU1_K1_LBSPPA1024_LBSPPB1024_LBSPPM0_LPA32_LPB32_LPM0_LRVW16_LWPMn1_MIAV0_MIWT2_4_MO40_NTn1_NTA0_NTB0_NTC0_NTD4_NTM0_NEPBS8_NLCA1_NLCB1_ONLL1_PGR2_PLR1_PKA1_SIA3_SS1_SU0_SUM1_SUS0_SPO0_SRVW0_SSO0_SVW2_SK0_SKXCCM0_TLDS1_ULSGRO0_USL1_UIOFGRO0_USFGROn1_VSn1_VWA2_VWB4_WSGRA0_WSGRB0_WS64_WG32_4_2_WGM1_WGMXCC4_WGMXCCGn1
    SolutionIndex: 82
    SolutionNameMin: Cijk_Ailk_Bljk_I8II_BH_UserArgs_MT256x64x128_MI16x16x1_SN_LDSB1_AFC0_AFEM1_AFEM1_ASEM1_CLR1_CADS0_DTVA0_DTVB0_EPS0_FDSI0_GRPM1_GRVWA16_GRVWB16_GSUn1_GSUAMBSK_GSUC1_GSUWGMRR1_GLS0_ISA942_IU1_K1_LBSPPA4096_LBSPPB512_LBSPPM0_LPA64_LPB32_LPM0_LRVW16_LWPMn1_MIAV0_MIWT4_4_MO40_NTn1_NTA0_NTB0_NTC0_NTD4_NTM0_NEPBS8_NLCA1_NLCB1_ONLL1_PGR2_PLR1_PKA1_SIA3_SS1_SU0_SUM1_SUS0_SPO0_SRVW0_SSO0_SVW4_SK0_SKXCCM0_TLDS1_ULSGRO0_USL1_UIOFGRO0_USFGROn1_VSn1_VWA4_VWB4_WSGRA0_WSGRB0_WS64_WG64_4_1_WGM1_WGMXCC4_WGMXCCGn1
    SolutionIndex: 83
    SolutionNameMin: Cijk_Ailk_Bljk_I8II_BH_UserArgs_MT64x64x128_MI16x16x1_SN_LDSB1_AFC0_AFEM1_AFEM1_ASEM1_CLR1_CADS0_DTVA0_DTVB0_EPS0_FDSI0_GRPM1_GRVWA16_GRVWB16_GSUn1_GSUAMBSK_GSUC1_GSUWGMRR1_GLS0_ISA942_IU1_K1_LBSPPA1024_LBSPPB512_LBSPPM0_LPA16_LPB32_LPM0_LRVW16_LWPMn1_MIAV0_MIWT1_4_MO40_NTn1_NTA0_NTB0_NTC0_NTD4_NTM0_NEPBS8_NLCA1_NLCB1_ONLL1_PGR2_PLR1_PKA1_SIA3_SS1_SU0_SUM1_SUS0_SPO0_SRVW0_SSO0_SVW1_SK0_SKXCCM0_TLDS1_ULSGRO0_USL1_UIOFGRO0_USFGROn1_VSn1_VWA1_VWB4_WSGRA0_WSGRB0_WS64_WG64_4_1_WGM1_WGMXCC4_WGMXCCGn1
    SolutionIndex: 84
    SolutionNameMin: Cijk_Ailk_Bljk_I8II_BH_UserArgs_MT64x64x128_MI16x16x1_SN_LDSB1_AFC0_AFEM1_AFEM1_ASEM1_CLR1_CADS0_DTVA0_DTVB0_EPS0_FDSI0_GRPM1_GRVWA16_GRVWB16_GSUn1_GSUAMBSK_GSUC1_GSUWGMRR1_GLS0_ISA942_IU1_K1_LBSPPA1024_LBSPPB256_LBSPPM0_LPA32_LPB32_LPM0_LRVW16_LWPMn1_MIAV0_MIWT2_2_MO40_NTn1_NTA0_NTB0_NTC0_NTD4_NTM0_NEPBS8_NLCA1_NLCB1_ONLL1_PGR2_PLR1_PKA1_SIA3_SS1_SU0_SUM1_SUS0_SPO0_SRVW0_SSO0_SVW2_SK0_SKXCCM0_TLDS1_ULSGRO0_USL1_UIOFGRO0_USFGROn1_VSn1_VWA2_VWB2_WSGRA0_WSGRB0_WS64_WG32_8_1_WGM1_WGMXCC4_WGMXCCGn1
    SolutionIndex: 85
    SolutionNameMin: Cijk_Ailk_Bljk_I8II_BH_UserArgs_MT128x64x128_MI16x16x1_SN_LDSB1_AFC0_AFEM1_AFEM1_ASEM1_CLR1_CADS0_DTVA0_DTVB0_EPS0_FDSI0_GRPM1_GRVWA16_GRVWB16_GSUn1_GSUAMBSK_GSUC1_GSUWGMRR1_GLS0_ISA942_IU1_K1_LBSPPA2048_LBSPPB512_LBSPPM0_LPA32_LPB32_LPM0_LRVW16_LWPMn1_MIAV0_MIWT2_4_MO40_NTn1_NTA0_NTB0_NTC0_NTD4_NTM0_NEPBS8_NLCA1_NLCB1_ONLL1_PGR2_PLR1_PKA1_SIA3_SS1_SU0_SUM1_SUS0_SPO0_SRVW0_SSO0_SVW2_SK0_SKXCCM0_TLDS1_ULSGRO0_USL1_UIOFGRO0_USFGROn1_VSn1_VWA2_VWB4_WSGRA0_WSGRB0_WS64_WG64_4_1_WGM1_WGMXCC4_WGMXCCGn1
    SolutionIndex: 86
    SolutionNameMin: Cijk_Ailk_Bljk_I8II_BH_UserArgs_MT32x32x512_MI16x16x1_SN_LDSB1_AFC0_AFEM1_AFEM1_ASEM1_CLR1_CADS0_DTVA0_DTVB0_EPS0_FDSI0_GRPM1_GRVWA16_GRVWB16_GSUn1_GSUAMBSK_GSUC1_GSUWGMRR1_GLS0_ISA942_IU1_K1_LBSPPA512_LBSPPB512_LBSPPM0_LPA32_LPB32_LPM0_LRVW16_LWPMn1_MIAV0_MIWT2_1_MO40_NTn1_NTA0_NTB0_NTC0_NTD4_NTM0_NEPBS8_NLCA1_NLCB1_ONLL1_PGR2_PLR1_PKA1_SIA3_SS1_SU0_SUM1_SUS0_SPO0_SRVW0_SSO0_SVW2_SK0_SKXCCM0_TLDS1_ULSGRO0_USL1_UIOFGRO0_USFGROn1_VSn1_VWA2_VWB1_WSGRA0_WSGRB0_WS64_WG16_8_2_WGM1_WGMXCC4_WGMXCCGn1
    SolutionIndex: 87
    SolutionNameMin: Cijk_Ailk_Bljk_I8II_BH_UserArgs_MT64x64x256_MI16x16x1_SN_LDSB1_AFC0_AFEM1_AFEM1_ASEM1_CLR1_CADS0_DTVA0_DTVB0_EPS0_FDSI0_GRPM1_GRVWA16_GRVWB16_GSUn1_GSUAMBSK_GSUC1_GSUWGMRR1_GLS0_ISA942_IU1_K1_LBSPPA1024_LBSPPB1024_LBSPPM0_LPA16_LPB32_LPM0_LRVW16_LWPMn1_MIAV0_MIWT1_4_MO40_NTn1_NTA0_NTB0_NTC0_NTD4_NTM0_NEPBS8_NLCA1_NLCB1_ONLL1_PGR2_PLR1_PKA1_SIA3_SS1_SU0_SUM1_SUS0_SPO0_SRVW0_SSO0_SVW1_SK0_SKXCCM0_TLDS1_ULSGRO0_USL1_UIOFGRO0_USFGROn1_VSn1_VWA1_VWB4_WSGRA0_WSGRB0_WS64_WG64_4_1_WGM1_WGMXCC4_WGMXCCGn1
    SolutionIndex: 88
    SolutionNameMin: Cijk_Ailk_Bljk_I8II_BH_UserArgs_MT64x48x256_MI16x16x1_SN_LDSB1_AFC0_AFEM1_AFEM1_ASEM1_CLR1_CADS0_DTVA0_DTVB0_EPS0_FDSI0_GRPM1_GRVWA16_GRVWB16_GSUn1_GSUAMBSK_GSUC1_GSUWGMRR1_GLS0_ISA942_IU1_K1_LBSPPA1024_LBSPPB256_LBSPPM0_LPA16_LPB32_LPM0_LRVW16_LWPMn1_MIAV0_MIWT1_3_MO40_NTn1_NTA0_NTB0_NTC0_NTD4_NTM0_NEPBS8_NLCA1_NLCB1_ONLL1_PGR2_PLR1_PKA1_SIA3_SS1_SU0_SUM1_SUS0_SPO0_SRVW0_SSO0_SVW1_SK0_SKXCCM0_TLDS1_ULSGRO0_USL1_UIOFGRO0_USFGROn1_VSn1_VWA1_VWB1_WSGRA0_WSGRB0_WS64_WG64_4_1_WGM1_WGMXCC4_WGMXCCGn1
    SolutionIndex: 89
    SolutionNameMin: Cijk_Ailk_Bljk_I8II_BH_UserArgs_MT128x64x256_MI16x16x1_SN_LDSB1_AFC0_AFEM1_AFEM1_ASEM1_CLR1_CADS0_DTVA0_DTVB0_EPS0_FDSI0_GRPM1_GRVWA16_GRVWB16_GSUn1_GSUAMBSK_GSUC1_GSUWGMRR1_GLS0_ISA942_IU1_K1_LBSPPA2048_LBSPPB1024_LBSPPM0_LPA64_LPB32_LPM0_LRVW16_LWPMn1_MIAV0_MIWT4_4_MO40_NTn1_NTA0_NTB0_NTC0_NTD4_NTM0_NEPBS8_NLCA1_NLCB1_ONLL1_PGR2_PLR1_PKA1_SIA3_SS1_SU0_SUM1_SUS0_SPO0_SRVW0_SSO0_SVW4_SK0_SKXCCM0_TLDS1_ULSGRO0_USL1_UIOFGRO0_USFGROn1_VSn1_VWA4_VWB4_WSGRA0_WSGRB0_WS64_WG32_4_2_WGM1_WGMXCC4_WGMXCCGn1
    SolutionIndex: 90
    SolutionNameMin: Cijk_Ailk_Bljk_I8II_BH_UserArgs_MT512x64x64_MI32x32x1_SN_LDSB1_AFC0_AFEM1_AFEM1_ASEM1_CLR1_CADS0_DTVA0_DTVB0_EPS0_FDSI0_GRPM1_GRVWA16_GRVWB16_GSUn1_GSUAMBSK_GSUC1_GSUWGMRR1_GLS0_ISA942_IU1_K1_LBSPPA0_LBSPPB128_LBSPPM0_LPA0_LPB16_LPM0_LRVW16_LWPMn1_MIAV0_MIWT4_2_MO40_NTn1_NTA0_NTB0_NTC0_NTD4_NTM0_NEPBS8_NLCA1_NLCB1_ONLL1_PGR2_PLR1_PKA1_SIA3_SS1_SU0_SUM1_SUS0_SPO0_SRVW0_SSO0_SVW4_SK0_SKXCCM0_TLDS1_ULSGRO0_USL1_UIOFGRO0_USFGROn1_VSn1_VWA4_VWB2_WSGRA0_WSGRB0_WS64_WG128_2_1_WGM1_WGMXCC4_WGMXCCGn1
    SolutionIndex: 91
    SolutionNameMin: Cijk_Ailk_Bljk_I8II_BH_UserArgs_MT128x32x256_MI16x16x1_SN_LDSB1_AFC0_AFEM1_AFEM1_ASEM1_CLR1_CADS0_DTVA0_DTVB0_EPS0_FDSI0_GRPM1_GRVWA16_GRVWB16_GSUn1_GSUAMBSK_GSUC1_GSUWGMRR1_GLS0_ISA942_IU1_K1_LBSPPA2048_LBSPPB512_LBSPPM0_LPA64_LPB32_LPM0_LRVW16_LWPMn1_MIAV0_MIWT4_2_MO40_NTn1_NTA0_NTB0_NTC0_NTD4_NTM0_NEPBS8_NLCA1_NLCB1_ONLL1_PGR2_PLR1_PKA1_SIA3_SS1_SU0_SUM1_SUS0_SPO0_SRVW0_SSO0_SVW4_SK0_SKXCCM0_TLDS1_ULSGRO0_USL1_UIOFGRO0_USFGROn1_VSn1_VWA4_VWB2_WSGRA0_WSGRB0_WS64_WG32_4_2_WGM1_WGMXCC4_WGMXCCGn1
    SolutionIndex: 92
    SolutionNameMin: Cijk_Ailk_Bljk_I8II_BH_UserArgs_MT64x64x128_MI16x16x1_SN_LDSB1_AFC0_AFEM1_AFEM1_ASEM1_CLR1_CADS0_DTVA0_DTVB0_EPS0_FDSI0_GRPM1_GRVWA16_GRVWB16_GSUn1_GSUAMBSK_GSUC1_GSUWGMRR1_GLS0_ISA942_IU1_K1_LBSPPA1024_LBSPPB256_LBSPPM0_LPA64_LPB32_LPM0_LRVW16_LWPMn1_MIAV0_MIWT4_2_MO40_NTn1_NTA0_NTB0_NTC0_NTD4_NTM0_NEPBS8_NLCA1_NLCB1_ONLL1_PGR2_PLR1_PKA1_SIA3_SS1_SU0_SUM1_SUS0_SPO0_SRVW0_SSO0_SVW4_SK0_SKXCCM0_TLDS1_ULSGRO0_USL1_UIOFGRO0_USFGROn1_VSn1_VWA4_VWB2_WSGRA0_WSGRB0_WS64_WG16_8_2_WGM1_WGMXCC4_WGMXCCGn1
    SolutionIndex: 93
    SolutionNameMin: Cijk_Ailk_Bljk_I8II_BH_UserArgs_MT64x64x128_MI16x16x1_SN_LDSB1_AFC0_AFEM1_AFEM1_ASEM1_CLR1_CADS0_DTVA0_DTVB0_EPS0_FDSI0_GRPM1_GRVWA16_GRVWB16_GSUn1_GSUAMBSK_GSUC1_GSUWGMRR1_GLS0_ISA942_IU1_K1_LBSPPA1024_LBSPPB128_LBSPPM0_LPA64_LPB32_LPM0_LRVW16_LWPMn1_MIAV0_MIWT4_1_MO40_NTn1_NTA0_NTB0_NTC0_NTD4_NTM0_NEPBS8_NLCA1_NLCB1_ONLL1_PGR2_PLR1_PKA1_SIA3_SS1_SU0_SUM1_SUS0_SPO0_SRVW0_SSO0_SVW4_SK0_SKXCCM0_TLDS1_ULSGRO0_USL1_UIOFGRO0_USFGROn1_VSn1_VWA4_VWB1_WSGRA0_WSGRB0_WS64_WG16_16_1_WGM1_WGMXCC4_WGMXCCGn1
    SolutionIndex: 94
    SolutionNameMin: Cijk_Ailk_Bljk_I8II_BH_UserArgs_MT64x64x128_MI16x16x1_SN_LDSB1_AFC0_AFEM1_AFEM1_ASEM1_CLR1_CADS0_DTVA0_DTVB0_EPS0_FDSI0_GRPM1_GRVWA16_GRVWB16_GSUn1_GSUAMBSK_GSUC1_GSUWGMRR1_GLS0_ISA942_IU1_K1_LBSPPA1024_LBSPPB512_LBSPPM0_LPA32_LPB32_LPM0_LRVW16_LWPMn1_MIAV0_MIWT2_4_MO40_NTn1_NTA0_NTB0_NTC0_NTD4_NTM0_NEPBS8_NLCA1_NLCB1_ONLL1_PGR2_PLR1_PKA1_SIA3_SS1_SU0_SUM1_SUS0_SPO0_SRVW0_SSO0_SVW2_SK0_SKXCCM0_TLDS1_ULSGRO0_USL1_UIOFGRO0_USFGROn1_VSn1_VWA2_VWB4_WSGRA0_WSGRB0_WS64_WG32_4_2_WGM1_WGMXCC4_WGMXCCGn1
    SolutionIndex: 95
    SolutionNameMin: Cijk_Ailk_Bljk_I8II_BH_UserArgs_MT128x64x128_MI16x16x1_SN_LDSB1_AFC0_AFEM1_AFEM1_ASEM1_CLR1_CADS0_DTVA0_DTVB0_EPS0_FDSI0_GRPM1_GRVWA16_GRVWB16_GSUn1_GSUAMBSK_GSUC1_GSUWGMRR1_GLS0_ISA942_IU1_K1_LBSPPA2048_LBSPPB512_LBSPPM0_LPA64_LPB32_LPM0_LRVW16_LWPMn1_MIAV0_MIWT4_4_MO40_NTn1_NTA0_NTB0_NTC0_NTD4_NTM0_NEPBS8_NLCA1_NLCB1_ONLL1_PGR2_PLR1_PKA1_SIA3_SS1_SU0_SUM1_SUS0_SPO0_SRVW0_SSO0_SVW4_SK0_SKXCCM0_TLDS1_ULSGRO0_USL1_UIOFGRO0_USFGROn1_VSn1_VWA4_VWB4_WSGRA0_WSGRB0_WS64_WG32_4_2_WGM1_WGMXCC4_WGMXCCGn1
    SolutionIndex: 96
    SolutionNameMin: Cijk_Ailk_Bljk_I8II_BH_UserArgs_MT384x64x64_MI16x16x1_SN_LDSB1_AFC0_AFEM1_AFEM1_ASEM1_CLR1_CADS0_DTVA0_DTVB0_EPS0_FDSI0_GRPM1_GRVWA16_GRVWB8_GSUn1_GSUAMBSK_GSUC1_GSUWGMRR1_GLS0_ISA942_IU1_K1_LBSPPA3072_LBSPPB256_LBSPPM0_LPA32_LPB16_LPM0_LRVW8_LWPMn1_MIAV0_MIWT6_4_MO40_NTn1_NTA0_NTB0_NTC0_NTD4_NTM0_NEPBS6_NLCA1_NLCB1_ONLL1_PGR2_PLR1_PKA1_SIA3_SS1_SU0_SUM1_SUS0_SPO0_SRVW0_SSO0_SVW2_SK0_SKXCCM0_TLDS1_ULSGRO0_USL1_UIOFGRO0_USFGROn1_VSn1_VWA2_VWB4_WSGRA0_WSGRB0_WS64_WG64_4_1_WGM1_WGMXCC4_WGMXCCGn1
    SolutionIndex: 97
    SolutionNameMin: Cijk_Ailk_Bljk_I8II_BH_UserArgs_MT512x64x64_MI32x32x1_SN_LDSB1_AFC0_AFEM1_AFEM1_ASEM1_CLR1_CADS0_DTVA0_DTVB0_EPS0_FDSI0_GRPM1_GRVWA16_GRVWB16_GSUn1_GSUAMBSK_GSUC1_GSUWGMRR1_GLS0_ISA942_IU1_K1_LBSPPA0_LBSPPB128_LBSPPM0_LPA0_LPB16_LPM0_LRVW16_LWPMn1_MIAV0_MIWT4_2_MO40_NTn1_NTA0_NTB0_NTC0_NTD4_NTM0_NEPBS8_NLCA1_NLCB1_ONLL1_PGR2_PLR1_PKA1_SIA3_SS1_SU0_SUM1_SUS0_SPO0_SRVW0_SSO4_SVW4_SK0_SKXCCM0_TLDS1_ULSGRO0_USL1_UIOFGRO0_USFGROn1_VSn1_VWA4_VWB2_WSGRA0_WSGRB0_WS64_WG128_2_1_WGM1_WGMXCC4_WGMXCCGn1
    SolutionIndex: 98
    SolutionNameMin: Cijk_Ailk_Bljk_I8II_BH_UserArgs_MT384x48x64_MI16x16x1_SN_LDSB1_AFC0_AFEM1_AFEM1_ASEM1_CLR1_CADS0_DTVA0_DTVB0_EPS0_FDSI0_GRPM1_GRVWA16_GRVWB4_GSUn1_GSUAMBSK_GSUC1_GSUWGMRR1_GLS0_ISA942_IU1_K1_LBSPPA3072_LBSPPB128_LBSPPM0_LPA32_LPB8_LPM0_LRVW8_LWPMn1_MIAV0_MIWT6_3_MO40_NTn1_NTA0_NTB0_NTC0_NTD4_NTM0_NEPBS6_NLCA1_NLCB1_ONLL1_PGR2_PLR1_PKA1_SIA3_SS1_SU0_SUM1_SUS0_SPO0_SRVW0_SSO4_SVW2_SK0_SKXCCM0_TLDS1_ULSGRO0_USL1_UIOFGRO0_USFGROn1_VSn1_VWA2_VWB1_WSGRA0_WSGRB0_WS64_WG64_4_1_WGM1_WGMXCC4_WGMXCCGn1
    SolutionIndex: 99
    SolutionNameMin: Cijk_Ailk_Bljk_I8II_BH_UserArgs_MT384x48x64_MI16x16x1_SN_LDSB1_AFC0_AFEM1_AFEM1_ASEM1_CLR1_CADS0_DTVA0_DTVB0_EPS0_FDSI0_GRPM1_GRVWA16_GRVWB4_GSUn1_GSUAMBSK_GSUC1_GSUWGMRR1_GLS0_ISA942_IU1_K1_LBSPPA3072_LBSPPB128_LBSPPM0_LPA32_LPB8_LPM0_LRVW8_LWPMn1_MIAV0_MIWT6_3_MO40_NTn1_NTA0_NTB0_NTC0_NTD4_NTM0_NEPBS6_NLCA1_NLCB1_ONLL1_PGR2_PLR1_PKA1_SIA3_SS1_SU0_SUM1_SUS0_SPO0_SRVW0_SSO0_SVW2_SK0_SKXCCM0_TLDS1_ULSGRO0_USL1_UIOFGRO0_USFGROn1_VSn1_VWA2_VWB1_WSGRA0_WSGRB0_WS64_WG64_4_1_WGM1_WGMXCC4_WGMXCCGn1
    SolutionIndex: 100
    SolutionNameMin: Cijk_Ailk_Bljk_I8II_BH_UserArgs_MT256x64x64_MI16x16x1_SN_LDSB1_AFC0_AFEM1_AFEM1_ASEM1_CLR1_CADS0_DTVA0_DTVB0_EPS0_FDSI0_GRPM1_GRVWA16_GRVWB8_GSUn1_GSUAMBSK_GSUC1_GSUWGMRR1_GLS0_ISA942_IU1_K1_LBSPPA2048_LBSPPB256_LBSPPM0_LPA64_LPB16_LPM0_LRVW8_LWPMn1_MIAV0_MIWT4_4_MO40_NTn1_NTA0_NTB0_NTC0_NTD4_NTM0_NEPBS8_NLCA1_NLCB1_ONLL1_PGR2_PLR1_PKA1_SIA3_SS1_SU0_SUM1_SUS0_SPO0_SRVW0_SSO0_SVW4_SK0_SKXCCM0_TLDS1_ULSGRO0_USL1_UIOFGRO0_USFGROn1_VSn1_VWA4_VWB4_WSGRA0_WSGRB0_WS64_WG64_4_1_WGM1_WGMXCC4_WGMXCCGn1
    SolutionIndex: 101
    SolutionNameMin: Cijk_Ailk_Bljk_I8II_BH_UserArgs_MT16x48x256_MI16x16x1_SN_LDSB1_AFC0_AFEM1_AFEM1_ASEM1_CLR1_CADS0_DTVA0_DTVB0_EPS0_FDSI0_GRPM1_GRVWA1_GRVWB16_GSUn1_GSUAMBSK_GSUC1_GSUWGMRR1_GLS0_ISA942_IU1_K1_LBSPPA256_LBSPPB256_LBSPPM0_LPA16_LPB32_LPM0_LRVW16_LWPMn1_MIAV0_MIWT1_3_MO40_NTn1_NTA0_NTB0_NTC0_NTD4_NTM0_NEPBS8_NLCA1_NLCB1_ONLL1_PGR2_PLR1_PKA1_SIA3_SS1_SU0_SUM1_SUS0_SPO0_SRVW0_SSO0_SVW1_SK0_SKXCCM0_TLDS1_ULSGRO0_USL1_UIOFGRO0_USFGROn1_VSn1_VWA1_VWB1_WSGRA0_WSGRB0_WS64_WG16_4_4_WGM1_WGMXCC4_WGMXCCGn1
    SolutionIndex: 102
    SolutionNameMin: Cijk_Ailk_Bljk_I8II_BH_UserArgs_MT16x32x256_MI16x16x1_SN_LDSB0_AFC0_AFEM1_AFEM1_ASEM1_CLR1_CADS0_DTVA0_DTVB0_EPS0_FDSI0_GRPM1_GRVWA1_GRVWB16_GSUn1_GSUAMBSK_GSUC1_GSUWGMRR1_GLS0_ISA942_IU1_K1_LBSPPA256_LBSPPB512_LBSPPM0_LPA16_LPB32_LPM0_LRVW16_LWPMn1_MIAV0_MIWT1_2_MO40_NTn1_NTA0_NTB0_NTC0_NTD4_NTM0_NEPBS8_NLCA1_NLCB1_ONLL1_PGR2_PLR1_PKA1_SIA3_SS1_SU0_SUM1_SUS0_SPO0_SRVW0_SSO0_SVW1_SK0_SKXCCM0_TLDS1_ULSGRO0_USL1_UIOFGRO0_USFGROn1_VSn1_VWA1_VWB2_WSGRA0_WSGRB0_WS64_WG16_4_4_WGM1_WGMXCC4_WGMXCCGn1
    SolutionIndex: 103
    SolutionNameMin: Cijk_Ailk_Bljk_I8II_BH_UserArgs_MT32x48x256_MI16x16x1_SN_LDSB1_AFC0_AFEM1_AFEM1_ASEM1_CLR1_CADS0_DTVA0_DTVB0_EPS0_FDSI0_GRPM1_GRVWA16_GRVWB16_GSUn1_GSUAMBSK_GSUC1_GSUWGMRR1_GLS0_ISA942_IU1_K1_LBSPPA512_LBSPPB256_LBSPPM0_LPA32_LPB32_LPM0_LRVW16_LWPMn1_MIAV0_MIWT2_3_MO40_NTn1_NTA0_NTB0_NTC0_NTD4_NTM0_NEPBS8_NLCA1_NLCB1_ONLL1_PGR2_PLR1_PKA1_SIA3_SS1_SU0_SUM1_SUS0_SPO0_SRVW0_SSO0_SVW2_SK0_SKXCCM0_TLDS1_ULSGRO0_USL1_UIOFGRO0_USFGROn1_VSn1_VWA2_VWB1_WSGRA0_WSGRB0_WS64_WG16_4_4_WGM1_WGMXCC4_WGMXCCGn1
    SolutionIndex: 104
    SolutionNameMin: Cijk_Ailk_Bljk_I8II_BH_UserArgs_MT32x16x256_MI16x16x1_SN_LDSB0_AFC0_AFEM1_AFEM1_ASEM1_CLR1_CADS0_DTVA0_DTVB0_EPS0_FDSI0_GRPM1_GRVWA16_GRVWB16_GSUn1_GSUAMBSK_GSUC1_GSUWGMRR1_GLS0_ISA942_IU1_K1_LBSPPA512_LBSPPB256_LBSPPM0_LPA16_LPB32_LPM0_LRVW16_LWPMn1_MIAV0_MIWT2_1_MO40_NTn1_NTA0_NTB0_NTC0_NTD4_NTM0_NEPBS8_NLCA1_NLCB1_ONLL1_PGR2_PLR1_PKA1_SIA3_SS1_SU0_SUM1_SUS0_SPO0_SRVW0_SSO0_SVW2_SK0_SKXCCM0_TLDS1_ULSGRO0_USL1_UIOFGRO0_USFGROn1_VSn1_VWA2_VWB1_WSGRA0_WSGRB0_WS64_WG16_4_4_WGM1_WGMXCC4_WGMXCCGn1
    SolutionIndex: 105
    SolutionNameMin: Cijk_Ailk_Bljk_I8II_BH_UserArgs_MT32x48x128_MI16x16x1_SN_LDSB1_AFC0_AFEM1_AFEM1_ASEM1_CLR1_CADS0_DTVA0_DTVB0_EPS0_FDSI0_GRPM1_GRVWA16_GRVWB8_GSUn1_GSUAMBSK_GSUC1_GSUWGMRR1_GLS0_ISA942_IU1_K1_LBSPPA512_LBSPPB128_LBSPPM0_LPA16_LPB32_LPM0_LRVW16_LWPMn1_MIAV0_MIWT1_3_MO40_NTn1_NTA0_NTB0_NTC0_NTD4_NTM0_NEPBS8_NLCA1_NLCB1_ONLL1_PGR2_PLR1_PKA1_SIA3_SS1_SU0_SUM1_SUS0_SPO0_SRVW0_SSO0_SVW1_SK0_SKXCCM0_TLDS1_ULSGRO0_USL1_UIOFGRO0_USFGROn1_VSn1_VWA1_VWB1_WSGRA0_WSGRB0_WS64_WG32_4_2_WGM1_WGMXCC4_WGMXCCGn1
    SolutionIndex: 106
    SolutionNameMin: Cijk_Ailk_Bljk_I8II_BH_UserArgs_MT32x48x256_MI16x16x1_SN_LDSB1_AFC0_AFEM1_AFEM1_ASEM1_CLR1_CADS0_DTVA0_DTVB0_EPS0_FDSI0_GRPM1_GRVWA16_GRVWB16_GSUn1_GSUAMBSK_GSUC1_GSUWGMRR1_GLS0_ISA942_IU1_K1_LBSPPA512_LBSPPB256_LBSPPM0_LPA16_LPB32_LPM0_LRVW16_LWPMn1_MIAV0_MIWT2_3_MO40_NTn1_NTA0_NTB0_NTC0_NTD4_NTM0_NEPBS8_NLCA1_NLCB1_ONLL1_PGR2_PLR1_PKA1_SIA3_SS1_SU0_SUM1_SUS0_SPO0_SRVW0_SSO0_SVW2_SK0_SKXCCM0_TLDS1_ULSGRO0_USL1_UIOFGRO0_USFGROn1_VSn1_VWA2_VWB1_WSGRA0_WSGRB0_WS64_WG16_4_4_WGM1_WGMXCC4_WGMXCCGn1
    SolutionIndex: 107
    SolutionNameMin: Cijk_Ailk_Bljk_I8II_BH_UserArgs_MT64x48x256_MI16x16x1_SN_LDSB0_AFC0_AFEM1_AFEM1_ASEM1_CLR1_CADS0_DTVA0_DTVB0_EPS0_FDSI0_GRPM1_GRVWA16_GRVWB16_GSUn1_GSUAMBSK_GSUC1_GSUWGMRR1_GLS0_ISA942_IU1_K1_LBSPPA1024_LBSPPB256_LBSPPM0_LPA64_LPB32_LPM0_LRVW16_LWPMn1_MIAV0_MIWT4_3_MO40_NTn1_NTA0_NTB0_NTC0_NTD4_NTM0_NEPBS8_NLCA1_NLCB1_ONLL1_PGR2_PLR1_PKA1_SIA3_SS1_SU0_SUM1_SUS0_SPO0_SRVW0_SSO0_SVW4_SK0_SKXCCM0_TLDS1_ULSGRO0_USL1_UIOFGRO0_USFGROn1_VSn1_VWA4_VWB1_WSGRA0_WSGRB0_WS64_WG16_4_4_WGM1_WGMXCC4_WGMXCCGn1
    SolutionIndex: 108
    SolutionNameMin: Cijk_Ailk_Bljk_I8II_BH_UserArgs_MT16x32x512_MI16x16x1_SN_LDSB0_AFC0_AFEM1_AFEM1_ASEM1_CLR1_CADS0_DTVA0_DTVB0_EPS0_FDSI0_GRPM1_GRVWA16_GRVWB16_GSUn1_GSUAMBSK_GSUC1_GSUWGMRR1_GLS0_ISA942_IU1_K1_LBSPPA256_LBSPPB512_LBSPPM0_LPA16_LPB32_LPM0_LRVW16_LWPMn1_MIAV0_MIWT1_1_MO40_NTn1_NTA0_NTB0_NTC0_NTD4_NTM0_NEPBS8_NLCA1_NLCB1_ONLL1_PGR2_PLR1_PKA1_SIA3_SS1_SU0_SUM1_SUS0_SPO0_SRVW0_SSO0_SVW1_SK0_SKXCCM0_TLDS1_ULSGRO0_USL1_UIOFGRO0_USFGROn1_VSn1_VWA1_VWB1_WSGRA0_WSGRB0_WS64_WG16_8_1_WGM1_WGMXCC4_WGMXCCGn1
    SolutionIndex: 109
    SolutionNameMin: Cijk_Ailk_Bljk_I8II_BH_UserArgs_MT32x48x512_MI16x16x1_SN_LDSB1_AFC0_AFEM1_AFEM1_ASEM1_CLR1_CADS0_DTVA0_DTVB0_EPS0_FDSI0_GRPM1_GRVWA16_GRVWB16_GSUn1_GSUAMBSK_GSUC1_GSUWGMRR1_GLS0_ISA942_IU1_K1_LBSPPA512_LBSPPB512_LBSPPM0_LPA16_LPB32_LPM0_LRVW16_LWPMn1_MIAV0_MIWT1_3_MO40_NTn1_NTA0_NTB0_NTC0_NTD4_NTM0_NEPBS8_NLCA1_NLCB1_ONLL1_PGR2_PLR1_PKA1_SIA3_SS1_SU0_SUM1_SUS0_SPO0_SRVW0_SSO0_SVW1_SK0_SKXCCM0_TLDS1_ULSGRO0_USL1_UIOFGRO0_USFGROn1_VSn1_VWA1_VWB1_WSGRA0_WSGRB0_WS64_WG32_4_2_WGM1_WGMXCC4_WGMXCCGn1
    SolutionIndex: 110
    SolutionNameMin: Cijk_Ailk_Bljk_I8II_BH_UserArgs_MT64x48x256_MI16x16x1_SN_LDSB0_AFC0_AFEM1_AFEM1_ASEM1_CLR1_CADS0_DTVA0_DTVB0_EPS0_FDSI0_GRPM1_GRVWA16_GRVWB16_GSUn1_GSUAMBSK_GSUC1_GSUWGMRR1_GLS0_ISA942_IU1_K1_LBSPPA1024_LBSPPB256_LBSPPM0_LPA16_LPB32_LPM0_LRVW16_LWPMn1_MIAV0_MIWT1_3_MO40_NTn1_NTA0_NTB0_NTC0_NTD4_NTM0_NEPBS8_NLCA1_NLCB1_ONLL1_PGR2_PLR1_PKA1_SIA3_SS1_SU0_SUM1_SUS0_SPO0_SRVW0_SSO0_SVW1_SK0_SKXCCM0_TLDS1_ULSGRO0_USL1_UIOFGRO0_USFGROn1_VSn1_VWA1_VWB1_WSGRA0_WSGRB0_WS64_WG64_4_1_WGM1_WGMXCC4_WGMXCCGn1
    SolutionIndex: 111
    SolutionNameMin: Cijk_Ailk_Bljk_I8II_BH_UserArgs_MT64x80x256_MI16x16x1_SN_LDSB1_AFC0_AFEM1_AFEM1_ASEM1_CLR1_CADS0_DTVA0_DTVB0_EPS0_FDSI0_GRPM1_GRVWA16_GRVWB16_GSUn1_GSUAMBSK_GSUC1_GSUWGMRR1_GLS0_ISA942_IU1_K1_LBSPPA1024_LBSPPB256_LBSPPM0_LPA16_LPB32_LPM0_LRVW16_LWPMn1_MIAV0_MIWT1_5_MO40_NTn1_NTA0_NTB0_NTC0_NTD4_NTM0_NEPBS8_NLCA1_NLCB1_ONLL1_PGR2_PLR1_PKA1_SIA3_SS1_SU0_SUM1_SUS0_SPO0_SRVW0_SSO0_SVW1_SK0_SKXCCM0_TLDS1_ULSGRO0_USL1_UIOFGRO0_USFGROn1_VSn1_VWA1_VWB1_WSGRA0_WSGRB0_WS64_WG64_4_1_WGM1_WGMXCC4_WGMXCCGn1
    SolutionIndex: 112
    SolutionNameMin: Cijk_Ailk_Bljk_I8II_BH_UserArgs_MT128x80x128_MI16x16x1_SN_LDSB0_AFC0_AFEM1_AFEM1_ASEM1_CLR1_CADS0_DTVA0_DTVB0_EPS0_FDSI0_GRPM1_GRVWA16_GRVWB8_GSUn1_GSUAMBSK_GSUC1_GSUWGMRR1_GLS0_ISA942_IU1_K1_LBSPPA2048_LBSPPB128_LBSPPM0_LPA32_LPB32_LPM0_LRVW16_LWPMn1_MIAV0_MIWT2_5_MO40_NTn1_NTA0_NTB0_NTC0_NTD4_NTM0_NEPBS8_NLCA1_NLCB1_ONLL1_PGR2_PLR1_PKA1_SIA3_SS1_SU0_SUM1_SUS0_SPO0_SRVW0_SSO0_SVW2_SK0_SKXCCM0_TLDS1_ULSGRO0_USL1_UIOFGRO0_USFGROn1_VSn1_VWA2_VWB1_WSGRA0_WSGRB0_WS64_WG64_4_1_WGM1_WGMXCC4_WGMXCCGn1
    SolutionIndex: 113
    SolutionNameMin: Cijk_Ailk_Bljk_I8II_BH_UserArgs_MT32x32x256_MI16x16x1_SN_LDSB1_AFC0_AFEM1_AFEM1_ASEM1_CLR1_CADS0_DTVA0_DTVB0_EPS0_FDSI0_GRPM1_GRVWA16_GRVWB16_GSUn1_GSUAMBSK_GSUC1_GSUWGMRR1_GLS0_ISA942_IU1_K1_LBSPPA512_LBSPPB256_LBSPPM0_LPA16_LPB32_LPM0_LRVW16_LWPMn1_MIAV0_MIWT1_1_MO40_NTn1_NTA0_NTB0_NTC0_NTD4_NTM0_NEPBS8_NLCA1_NLCB1_ONLL1_PGR2_PLR1_PKA1_SIA3_SS1_SU0_SUM1_SUS0_SPO0_SRVW0_SSO0_SVW1_SK0_SKXCCM0_TLDS1_ULSGRO0_USL1_UIOFGRO0_USFGROn1_VSn1_VWA1_VWB1_WSGRA0_WSGRB0_WS64_WG32_8_1_WGM1_WGMXCC4_WGMXCCGn1
    SolutionIndex: 114
    SolutionNameMin: Cijk_Ailk_Bljk_I8II_BH_UserArgs_MT128x80x128_MI16x16x1_SN_LDSB1_AFC0_AFEM1_AFEM1_ASEM1_CLR1_CADS0_DTVA0_DTVB0_EPS0_FDSI0_GRPM1_GRVWA16_GRVWB8_GSUn1_GSUAMBSK_GSUC1_GSUWGMRR1_GLS0_ISA942_IU1_K1_LBSPPA2048_LBSPPB128_LBSPPM0_LPA32_LPB32_LPM0_LRVW16_LWPMn1_MIAV0_MIWT2_5_MO40_NTn1_NTA0_NTB0_NTC0_NTD4_NTM0_NEPBS8_NLCA1_NLCB1_ONLL1_PGR2_PLR1_PKA1_SIA3_SS1_SU0_SUM1_SUS0_SPO0_SRVW0_SSO0_SVW2_SK0_SKXCCM0_TLDS1_ULSGRO0_USL1_UIOFGRO0_USFGROn1_VSn1_VWA2_VWB1_WSGRA0_WSGRB0_WS64_WG64_4_1_WGM1_WGMXCC4_WGMXCCGn1
    SolutionIndex: 115
    SolutionNameMin: Cijk_Ailk_Bljk_I8II_BH_UserArgs_MT32x32x128_MI16x16x1_SN_LDSB1_AFC0_AFEM1_AFEM1_ASEM1_CLR1_CADS0_DTVA0_DTVB0_EPS0_FDSI0_GRPM1_GRVWA16_GRVWB16_GSUn1_GSUAMBSK_GSUC1_GSUWGMRR1_GLS0_ISA942_IU1_K1_LBSPPA512_LBSPPB128_LBSPPM0_LPA16_LPB32_LPM0_LRVW16_LWPMn1_MIAV0_MIWT1_1_MO40_NTn1_NTA0_NTB0_NTC0_NTD4_NTM0_NEPBS8_NLCA1_NLCB1_ONLL1_PGR2_PLR1_PKA1_SIA3_SS1_SU0_SUM1_SUS0_SPO0_SRVW0_SSO0_SVW1_SK0_SKXCCM0_TLDS1_ULSGRO0_USL1_UIOFGRO0_USFGROn1_VSn1_VWA1_VWB1_WSGRA0_WSGRB0_WS64_WG32_8_1_WGM1_WGMXCC4_WGMXCCGn1
    SolutionIndex: 116
    SolutionNameMin: Cijk_Ailk_Bljk_I8II_BH_UserArgs_MT256x80x128_MI16x16x1_SN_LDSB1_AFC0_AFEM1_AFEM1_ASEM1_CLR1_CADS0_DTVA0_DTVB0_EPS0_FDSI0_GRPM1_GRVWA16_GRVWB8_GSUn1_GSUAMBSK_GSUC1_GSUWGMRR1_GLS0_ISA942_IU1_K1_LBSPPA4096_LBSPPB128_LBSPPM0_LPA64_LPB32_LPM0_LRVW16_LWPMn1_MIAV0_MIWT4_5_MO40_NTn1_NTA0_NTB0_NTC0_NTD4_NTM0_NEPBS8_NLCA1_NLCB1_ONLL1_PGR2_PLR1_PKA1_SIA3_SS1_SU0_SUM1_SUS0_SPO0_SRVW0_SSO0_SVW4_SK0_SKXCCM0_TLDS1_ULSGRO0_USL1_UIOFGRO0_USFGROn1_VSn1_VWA4_VWB1_WSGRA0_WSGRB0_WS64_WG64_4_1_WGM1_WGMXCC4_WGMXCCGn1
    SolutionIndex: 117
    SolutionNameMin: Cijk_Ailk_Bljk_I8II_BH_UserArgs_MT32x64x256_MI16x16x1_SN_LDSB1_AFC0_AFEM1_AFEM1_ASEM1_CLR1_CADS0_DTVA0_DTVB0_EPS0_FDSI0_GRPM1_GRVWA16_GRVWB16_GSUn1_GSUAMBSK_GSUC1_GSUWGMRR1_GLS0_ISA942_IU1_K1_LBSPPA512_LBSPPB512_LBSPPM0_LPA16_LPB32_LPM0_LRVW16_LWPMn1_MIAV0_MIWT1_2_MO40_NTn1_NTA0_NTB0_NTC0_NTD4_NTM0_NEPBS8_NLCA1_NLCB1_ONLL1_PGR2_PLR1_PKA1_SIA3_SS1_SU0_SUM1_SUS0_SPO0_SRVW0_SSO0_SVW1_SK0_SKXCCM0_TLDS1_ULSGRO0_USL1_UIOFGRO0_USFGROn1_VSn1_VWA1_VWB2_WSGRA0_WSGRB0_WS64_WG32_8_1_WGM1_WGMXCC4_WGMXCCGn1
    SolutionIndex: 118
    SolutionNameMin: Cijk_Ailk_Bljk_I8II_BH_UserArgs_MT128x48x256_MI16x16x1_SN_LDSB1_AFC0_AFEM1_AFEM1_ASEM1_CLR1_CADS0_DTVA0_DTVB0_EPS0_FDSI0_GRPM1_GRVWA16_GRVWB16_GSUn1_GSUAMBSK_GSUC1_GSUWGMRR1_GLS0_ISA942_IU1_K1_LBSPPA2048_LBSPPB256_LBSPPM0_LPA32_LPB32_LPM0_LRVW16_LWPMn1_MIAV0_MIWT2_3_MO40_NTn1_NTA0_NTB0_NTC0_NTD4_NTM0_NEPBS8_NLCA1_NLCB1_ONLL1_PGR2_PLR1_PKA1_SIA3_SS1_SU0_SUM1_SUS0_SPO0_SRVW0_SSO0_SVW2_SK0_SKXCCM0_TLDS1_ULSGRO0_USL1_UIOFGRO0_USFGROn1_VSn1_VWA2_VWB1_WSGRA0_WSGRB0_WS64_WG64_4_1_WGM1_WGMXCC4_WGMXCCGn1
    SolutionIndex: 119
    SolutionNameMin: Cijk_Ailk_Bljk_I8II_BH_UserArgs_MT64x80x128_MI16x16x1_SN_LDSB1_AFC0_AFEM1_AFEM1_ASEM1_CLR1_CADS0_DTVA0_DTVB0_EPS0_FDSI0_GRPM1_GRVWA16_GRVWB8_GSUn1_GSUAMBSK_GSUC1_GSUWGMRR1_GLS0_ISA942_IU1_K1_LBSPPA1024_LBSPPB128_LBSPPM0_LPA16_LPB32_LPM0_LRVW16_LWPMn1_MIAV0_MIWT1_5_MO40_NTn1_NTA0_NTB0_NTC0_NTD4_NTM0_NEPBS8_NLCA1_NLCB1_ONLL1_PGR2_PLR1_PKA1_SIA3_SS1_SU0_SUM1_SUS0_SPO0_SRVW0_SSO0_SVW1_SK0_SKXCCM0_TLDS1_ULSGRO0_USL1_UIOFGRO0_USFGROn1_VSn1_VWA1_VWB1_WSGRA0_WSGRB0_WS64_WG64_4_1_WGM1_WGMXCC4_WGMXCCGn1
    SolutionIndex: 120
    SolutionNameMin: Cijk_Ailk_Bljk_I8II_BH_UserArgs_MT512x80x64_MI16x16x1_SN_LDSB1_AFC0_AFEM1_AFEM1_ASEM1_CLR1_CADS0_DTVA0_DTVB0_EPS0_FDSI0_GRPM1_GRVWA16_GRVWB4_GSUn1_GSUAMBSK_GSUC1_GSUWGMRR1_GLS0_ISA942_IU1_K1_LBSPPA4096_LBSPPB128_LBSPPM0_LPA64_LPB8_LPM0_LRVW8_LWPMn1_MIAV0_MIWT8_5_MO40_NTn1_NTA0_NTB0_NTC0_NTD4_NTM0_NEPBS8_NLCA1_NLCB1_ONLL1_PGR2_PLR1_PKA1_SIA3_SS1_SU0_SUM1_SUS0_SPO0_SRVW0_SSO0_SVW8_SK0_SKXCCM0_TLDS1_ULSGRO0_USL1_UIOFGRO0_USFGROn1_VSn1_VWA8_VWB1_WSGRA0_WSGRB0_WS64_WG64_4_1_WGM1_WGMXCC4_WGMXCCGn1
    SolutionIndex: 121
    SolutionNameMin: Cijk_Ailk_Bljk_I8II_BH_UserArgs_MT256x80x64_MI16x16x1_SN_LDSB1_AFC0_AFEM1_AFEM1_ASEM1_CLR1_CADS0_DTVA0_DTVB0_EPS0_FDSI0_GRPM1_GRVWA16_GRVWB4_GSUn1_GSUAMBSK_GSUC1_GSUWGMRR1_GLS0_ISA942_IU1_K1_LBSPPA2048_LBSPPB128_LBSPPM0_LPA64_LPB8_LPM0_LRVW8_LWPMn1_MIAV0_MIWT4_5_MO40_NTn1_NTA0_NTB0_NTC0_NTD4_NTM0_NEPBS8_NLCA1_NLCB1_ONLL1_PGR2_PLR1_PKA1_SIA3_SS1_SU0_SUM1_SUS0_SPO0_SRVW0_SSO0_SVW4_SK0_SKXCCM0_TLDS1_ULSGRO0_USL1_UIOFGRO0_USFGROn1_VSn1_VWA4_VWB1_WSGRA0_WSGRB0_WS64_WG64_4_1_WGM1_WGMXCC4_WGMXCCGn1
    SolutionIndex: 122
    SolutionNameMin: Cijk_Ailk_Bljk_I8II_BH_UserArgs_MT512x64x64_MI16x16x1_SN_LDSB1_AFC0_AFEM1_AFEM1_ASEM1_CLR1_CADS0_DTVA0_DTVB0_EPS0_FDSI0_GRPM1_GRVWA16_GRVWB8_GSUn1_GSUAMBSK_GSUC1_GSUWGMRR1_GLS0_ISA942_IU1_K1_LBSPPA4096_LBSPPB256_LBSPPM0_LPA64_LPB16_LPM0_LRVW8_LWPMn1_MIAV0_MIWT8_4_MO40_NTn1_NTA0_NTB0_NTC0_NTD4_NTM0_NEPBS8_NLCA1_NLCB1_ONLL1_PGR2_PLR1_PKA1_SIA3_SS1_SU0_SUM1_SUS0_SPO0_SRVW0_SSO0_SVW8_SK0_SKXCCM0_TLDS1_ULSGRO0_USL1_UIOFGRO0_USFGROn1_VSn1_VWA8_VWB4_WSGRA0_WSGRB0_WS64_WG64_4_1_WGM1_WGMXCC4_WGMXCCGn1
    SolutionIndex: 123
    SolutionNameMin: Cijk_Ailk_Bljk_I8II_BH_UserArgs_MT256x64x128_MI16x16x1_SN_LDSB1_AFC0_AFEM1_AFEM1_ASEM1_CLR1_CADS0_DTVA0_DTVB0_EPS0_FDSI0_GRPM1_GRVWA16_GRVWB16_GSUn1_GSUAMBSK_GSUC1_GSUWGMRR1_GLS0_ISA942_IU1_K1_LBSPPA4096_LBSPPB512_LBSPPM0_LPA64_LPB32_LPM0_LRVW16_LWPMn1_MIAV0_MIWT4_4_MO40_NTn1_NTA0_NTB0_NTC0_NTD4_NTM0_NEPBS8_NLCA1_NLCB1_ONLL1_PGR2_PLR1_PKA1_SIA3_SS1_SU0_SUM1_SUS0_SPO0_SRVW0_SSO4_SVW4_SK0_SKXCCM0_TLDS1_ULSGRO0_USL1_UIOFGRO0_USFGROn1_VSn1_VWA4_VWB4_WSGRA0_WSGRB0_WS64_WG64_4_1_WGM1_WGMXCC4_WGMXCCGn1
    SolutionIndex: 124
    SolutionNameMin: Cijk_Ailk_Bljk_I8II_BH_UserArgs_MT256x64x64_MI16x16x1_SN_LDSB1_AFC0_AFEM1_AFEM1_ASEM1_CLR1_CADS0_DTVA0_DTVB0_EPS0_FDSI0_GRPM1_GRVWA16_GRVWB8_GSUn1_GSUAMBSK_GSUC1_GSUWGMRR1_GLS0_ISA942_IU1_K1_LBSPPA2048_LBSPPB256_LBSPPM0_LPA64_LPB16_LPM0_LRVW8_LWPMn1_MIAV0_MIWT4_4_MO40_NTn1_NTA0_NTB0_NTC0_NTD4_NTM0_NEPBS8_NLCA1_NLCB1_ONLL1_PGR2_PLR1_PKA1_SIA3_SS1_SU0_SUM1_SUS0_SPO0_SRVW0_SSO4_SVW4_SK0_SKXCCM0_TLDS1_ULSGRO0_USL1_UIOFGRO0_USFGROn1_VSn1_VWA4_VWB4_WSGRA0_WSGRB0_WS64_WG64_4_1_WGM1_WGMXCC4_WGMXCCGn1
    SolutionIndex: 125
    SolutionNameMin: Cijk_Ailk_Bljk_I8II_BH_UserArgs_MT16x64x256_MI16x16x1_SN_LDSB1_AFC0_AFEM1_AFEM1_ASEM1_CLR1_CADS0_DTVA0_DTVB0_EPS0_FDSI0_GRPM1_GRVWA1_GRVWB16_GSUn1_GSUAMBSK_GSUC1_GSUWGMRR1_GLS0_ISA942_IU1_K1_LBSPPA256_LBSPPB1024_LBSPPM0_LPA16_LPB32_LPM0_LRVW16_LWPMn1_MIAV0_MIWT1_4_MO40_NTn1_NTA0_NTB0_NTC0_NTD4_NTM0_NEPBS8_NLCA1_NLCB1_ONLL1_PGR2_PLR1_PKA1_SIA3_SS1_SU0_SUM1_SUS0_SPO0_SRVW0_SSO0_SVW1_SK0_SKXCCM0_TLDS1_ULSGRO0_USL1_UIOFGRO0_USFGROn1_VSn1_VWA1_VWB4_WSGRA0_WSGRB0_WS64_WG16_4_4_WGM1_WGMXCC4_WGMXCCGn1
    SolutionIndex: 126
    SolutionNameMin: Cijk_Ailk_Bljk_I8II_BH_UserArgs_MT32x64x256_MI16x16x1_SN_LDSB1_AFC0_AFEM1_AFEM1_ASEM1_CLR1_CADS0_DTVA0_DTVB0_EPS0_FDSI0_GRPM1_GRVWA16_GRVWB16_GSUn1_GSUAMBSK_GSUC1_GSUWGMRR1_GLS0_ISA942_IU1_K1_LBSPPA512_LBSPPB1024_LBSPPM0_LPA32_LPB32_LPM0_LRVW16_LWPMn1_MIAV0_MIWT2_4_MO40_NTn1_NTA0_NTB0_NTC0_NTD4_NTM0_NEPBS8_NLCA1_NLCB1_ONLL1_PGR2_PLR1_PKA1_SIA3_SS1_SU0_SUM1_SUS0_SPO0_SRVW0_SSO0_SVW2_SK0_SKXCCM0_TLDS1_ULSGRO0_USL1_UIOFGRO0_USFGROn1_VSn1_VWA2_VWB4_WSGRA0_WSGRB0_WS64_WG16_4_4_WGM1_WGMXCC4_WGMXCCGn1
    SolutionIndex: 127
    SolutionNameMin: Cijk_Ailk_Bljk_I8II_BH_UserArgs_MT32x64x128_MI16x16x1_SN_LDSB1_AFC0_AFEM1_AFEM1_ASEM1_CLR1_CADS0_DTVA0_DTVB0_EPS0_FDSI0_GRPM1_GRVWA16_GRVWB16_GSUn1_GSUAMBSK_GSUC1_GSUWGMRR1_GLS0_ISA942_IU1_K1_LBSPPA512_LBSPPB256_LBSPPM0_LPA32_LPB32_LPM0_LRVW16_LWPMn1_MIAV0_MIWT2_2_MO40_NTn1_NTA0_NTB0_NTC0_NTD4_NTM0_NEPBS8_NLCA1_NLCB1_ONLL1_PGR2_PLR1_PKA1_SIA3_SS1_SU0_SUM1_SUS0_SPO0_SRVW0_SSO0_SVW2_SK0_SKXCCM0_TLDS1_ULSGRO0_USL1_UIOFGRO0_USFGROn1_VSn1_VWA2_VWB2_WSGRA0_WSGRB0_WS64_WG16_8_2_WGM1_WGMXCC4_WGMXCCGn1
    SolutionIndex: 128
    SolutionNameMin: Cijk_Ailk_Bljk_I8II_BH_UserArgs_MT32x64x128_MI32x32x1_SN_LDSB1_AFC0_AFEM1_AFEM1_ASEM1_CLR1_CADS0_DTVA0_DTVB0_EPS0_FDSI0_GRPM1_GRVWA16_GRVWB16_GSUn1_GSUAMBSK_GSUC1_GSUWGMRR1_GLS0_ISA942_IU1_K1_LBSPPA0_LBSPPB128_LBSPPM0_LPA0_LPB16_LPM0_LRVW16_LWPMn1_MIAV0_MIWT1_1_MO40_NTn1_NTA0_NTB0_NTC0_NTD4_NTM0_NEPBS8_NLCA1_NLCB1_ONLL1_PGR2_PLR1_PKA1_SIA3_SS1_SU0_SUM1_SUS0_SPO0_SRVW0_SSO0_SVW1_SK0_SKXCCM0_TLDS1_ULSGRO0_USL1_UIOFGRO0_USFGROn1_VSn1_VWA1_VWB1_WSGRA0_WSGRB0_WS64_WG32_4_2_WGM1_WGMXCC4_WGMXCCGn1
    SolutionIndex: 129
    SolutionNameMin: Cijk_Ailk_Bljk_I8II_BH_UserArgs_MT64x32x128_MI32x32x1_SN_LDSB0_AFC0_AFEM1_AFEM1_ASEM1_CLR1_CADS0_DTVA0_DTVB0_EPS0_FDSI0_GRPM1_GRVWA16_GRVWB16_GSUn1_GSUAMBSK_GSUC1_GSUWGMRR1_GLS0_ISA942_IU1_K1_LBSPPA0_LBSPPB128_LBSPPM0_LPA0_LPB16_LPM0_LRVW16_LWPMn1_MIAV0_MIWT2_1_MO40_NTn1_NTA0_NTB0_NTC0_NTD4_NTM0_NEPBS8_NLCA1_NLCB1_ONLL1_PGR2_PLR1_PKA1_SIA3_SS1_SU0_SUM1_SUS0_SPO0_SRVW0_SSO0_SVW2_SK0_SKXCCM0_TLDS1_ULSGRO0_USL1_UIOFGRO0_USFGROn1_VSn1_VWA2_VWB1_WSGRA0_WSGRB0_WS64_WG32_2_4_WGM1_WGMXCC4_WGMXCCGn1
    SolutionIndex: 130
    SolutionNameMin: Cijk_Ailk_Bljk_I8II_BH_UserArgs_MT32x32x512_MI16x16x1_SN_LDSB1_AFC0_AFEM1_AFEM1_ASEM1_CLR1_CADS0_DTVA0_DTVB0_EPS0_FDSI0_GRPM1_GRVWA16_GRVWB16_GSUn1_GSUAMBSK_GSUC1_GSUWGMRR1_GLS0_ISA942_IU1_K1_LBSPPA512_LBSPPB1024_LBSPPM0_LPA16_LPB32_LPM0_LRVW16_LWPMn1_MIAV0_MIWT1_2_MO40_NTn1_NTA0_NTB0_NTC0_NTD4_NTM0_NEPBS8_NLCA1_NLCB1_ONLL1_PGR2_PLR1_PKA1_SIA3_SS1_SU0_SUM1_SUS0_SPO0_SRVW0_SSO0_SVW1_SK0_SKXCCM0_TLDS1_ULSGRO0_USL1_UIOFGRO0_USFGROn1_VSn1_VWA1_VWB2_WSGRA0_WSGRB0_WS64_WG32_4_2_WGM1_WGMXCC4_WGMXCCGn1
    SolutionIndex: 131
    SolutionNameMin: Cijk_Ailk_Bljk_I8II_BH_UserArgs_MT16x64x256_MI16x16x1_SN_LDSB0_AFC0_AFEM1_AFEM1_ASEM1_CLR1_CADS0_DTVA0_DTVB0_EPS0_FDSI0_GRPM1_GRVWA16_GRVWB16_GSUn1_GSUAMBSK_GSUC1_GSUWGMRR1_GLS0_ISA942_IU1_K1_LBSPPA256_LBSPPB256_LBSPPM0_LPA16_LPB32_LPM0_LRVW16_LWPMn1_MIAV0_MIWT1_1_MO40_NTn1_NTA0_NTB0_NTC0_NTD4_NTM0_NEPBS8_NLCA1_NLCB1_ONLL1_PGR2_PLR1_PKA1_SIA3_SS1_SU0_SUM1_SUS0_SPO0_SRVW0_SSO0_SVW1_SK0_SKXCCM0_TLDS1_ULSGRO0_USL1_UIOFGRO0_USFGROn1_VSn1_VWA1_VWB1_WSGRA0_WSGRB0_WS64_WG16_16_1_WGM1_WGMXCC4_WGMXCCGn1
    SolutionIndex: 132
    SolutionNameMin: Cijk_Ailk_Bljk_I8II_BH_UserArgs_MT32x32x256_MI16x16x1_SN_LDSB0_AFC0_AFEM1_AFEM1_ASEM1_CLR1_CADS0_DTVA0_DTVB0_EPS0_FDSI0_GRPM1_GRVWA16_GRVWB16_GSUn1_GSUAMBSK_GSUC1_GSUWGMRR1_GLS0_ISA942_IU1_K1_LBSPPA512_LBSPPB512_LBSPPM0_LPA16_LPB32_LPM0_LRVW16_LWPMn1_MIAV0_MIWT1_2_MO40_NTn1_NTA0_NTB0_NTC0_NTD4_NTM0_NEPBS8_NLCA1_NLCB1_ONLL1_PGR2_PLR1_PKA1_SIA3_SS1_SU0_SUM1_SUS0_SPO0_SRVW0_SSO0_SVW1_SK0_SKXCCM0_TLDS1_ULSGRO0_USL1_UIOFGRO0_USFGROn1_VSn1_VWA1_VWB2_WSGRA0_WSGRB0_WS64_WG32_4_2_WGM1_WGMXCC4_WGMXCCGn1
    SolutionIndex: 133
    SolutionNameMin: Cijk_Ailk_Bljk_I8II_BH_UserArgs_MT128x96x128_MI16x16x1_SN_LDSB0_AFC0_AFEM1_AFEM1_ASEM1_CLR1_CADS0_DTVA0_DTVB0_EPS0_FDSI0_GRPM1_GRVWA16_GRVWB16_GSUn1_GSUAMBSK_GSUC1_GSUWGMRR1_GLS0_ISA942_IU1_K1_LBSPPA2048_LBSPPB256_LBSPPM0_LPA32_LPB32_LPM0_LRVW16_LWPMn1_MIAV0_MIWT2_6_MO40_NTn1_NTA0_NTB0_NTC0_NTD4_NTM0_NEPBS8_NLCA1_NLCB1_ONLL1_PGR2_PLR1_PKA1_SIA3_SS1_SU0_SUM1_SUS0_SPO0_SRVW0_SSO0_SVW2_SK0_SKXCCM0_TLDS1_ULSGRO0_USL1_UIOFGRO0_USFGROn1_VSn1_VWA2_VWB2_WSGRA0_WSGRB0_WS64_WG64_4_1_WGM1_WGMXCC4_WGMXCCGn1
    SolutionIndex: 134
    SolutionNameMin: Cijk_Ailk_Bljk_I8II_BH_UserArgs_MT64x96x128_MI16x16x1_SN_LDSB0_AFC0_AFEM1_AFEM1_ASEM1_CLR1_CADS0_DTVA0_DTVB0_EPS0_FDSI0_GRPM1_GRVWA16_GRVWB16_GSUn1_GSUAMBSK_GSUC1_GSUWGMRR1_GLS0_ISA942_IU1_K1_LBSPPA1024_LBSPPB128_LBSPPM0_LPA32_LPB32_LPM0_LRVW16_LWPMn1_MIAV0_MIWT2_3_MO40_NTn1_NTA0_NTB0_NTC0_NTD4_NTM0_NEPBS8_NLCA1_NLCB1_ONLL1_PGR2_PLR1_PKA1_SIA3_SS1_SU0_SUM1_SUS0_SPO0_SRVW0_SSO0_SVW2_SK0_SKXCCM0_TLDS1_ULSGRO0_USL1_UIOFGRO0_USFGROn1_VSn1_VWA2_VWB1_WSGRA0_WSGRB0_WS64_WG32_8_1_WGM1_WGMXCC4_WGMXCCGn1
    SolutionIndex: 135
    SolutionNameMin: Cijk_Ailk_Bljk_I8II_BH_UserArgs_MT128x96x128_MI16x16x1_SN_LDSB1_AFC0_AFEM1_AFEM1_ASEM1_CLR1_CADS0_DTVA0_DTVB0_EPS0_FDSI0_GRPM1_GRVWA16_GRVWB16_GSUn1_GSUAMBSK_GSUC1_GSUWGMRR1_GLS0_ISA942_IU1_K1_LBSPPA2048_LBSPPB256_LBSPPM0_LPA32_LPB32_LPM0_LRVW16_LWPMn1_MIAV0_MIWT2_6_MO40_NTn1_NTA0_NTB0_NTC0_NTD4_NTM0_NEPBS8_NLCA1_NLCB1_ONLL1_PGR2_PLR1_PKA1_SIA3_SS1_SU0_SUM1_SUS0_SPO0_SRVW0_SSO0_SVW2_SK0_SKXCCM0_TLDS1_ULSGRO0_USL1_UIOFGRO0_USFGROn1_VSn1_VWA2_VWB2_WSGRA0_WSGRB0_WS64_WG64_4_1_WGM1_WGMXCC4_WGMXCCGn1
    SolutionIndex: 136
    SolutionNameMin: Cijk_Ailk_Bljk_I8II_BH_UserArgs_MT64x96x128_MI16x16x1_SN_LDSB1_AFC0_AFEM1_AFEM1_ASEM1_CLR1_CADS0_DTVA0_DTVB0_EPS0_FDSI0_GRPM1_GRVWA16_GRVWB16_GSUn1_GSUAMBSK_GSUC1_GSUWGMRR1_GLS0_ISA942_IU1_K1_LBSPPA1024_LBSPPB128_LBSPPM0_LPA32_LPB32_LPM0_LRVW16_LWPMn1_MIAV0_MIWT2_3_MO40_NTn1_NTA0_NTB0_NTC0_NTD4_NTM0_NEPBS8_NLCA1_NLCB1_ONLL1_PGR2_PLR1_PKA1_SIA3_SS1_SU0_SUM1_SUS0_SPO0_SRVW0_SSO0_SVW2_SK0_SKXCCM0_TLDS1_ULSGRO0_USL1_UIOFGRO0_USFGROn1_VSn1_VWA2_VWB1_WSGRA0_WSGRB0_WS64_WG32_8_1_WGM1_WGMXCC4_WGMXCCGn1
    SolutionIndex: 137
    SolutionNameMin: Cijk_Ailk_Bljk_I8II_BH_UserArgs_MT64x96x128_MI16x16x1_SN_LDSB1_AFC0_AFEM1_AFEM1_ASEM1_CLR1_CADS0_DTVA0_DTVB0_EPS0_FDSI0_GRPM1_GRVWA16_GRVWB16_GSUn1_GSUAMBSK_GSUC1_GSUWGMRR1_GLS0_ISA942_IU1_K1_LBSPPA1024_LBSPPB256_LBSPPM0_LPA16_LPB32_LPM0_LRVW16_LWPMn1_MIAV0_MIWT1_6_MO40_NTn1_NTA0_NTB0_NTC0_NTD4_NTM0_NEPBS8_NLCA1_NLCB1_ONLL1_PGR2_PLR1_PKA1_SIA3_SS1_SU0_SUM1_SUS0_SPO0_SRVW0_SSO0_SVW1_SK0_SKXCCM0_TLDS1_ULSGRO0_USL1_UIOFGRO0_USFGROn1_VSn1_VWA1_VWB2_WSGRA0_WSGRB0_WS64_WG64_4_1_WGM1_WGMXCC4_WGMXCCGn1
    SolutionIndex: 138
    SolutionNameMin: Cijk_Ailk_Bljk_I8II_BH_UserArgs_MT256x96x128_MI16x16x1_SN_LDSB1_AFC0_AFEM1_AFEM1_ASEM1_CLR1_CADS0_DTVA0_DTVB0_EPS0_FDSI0_GRPM1_GRVWA16_GRVWB16_GSUn1_GSUAMBSK_GSUC1_GSUWGMRR1_GLS0_ISA942_IU1_K1_LBSPPA4096_LBSPPB256_LBSPPM0_LPA64_LPB32_LPM0_LRVW16_LWPMn1_MIAV0_MIWT4_6_MO40_NTn1_NTA0_NTB0_NTC0_NTD4_NTM0_NEPBS8_NLCA1_NLCB1_ONLL1_PGR2_PLR1_PKA1_SIA3_SS1_SU0_SUM1_SUS0_SPO0_SRVW0_SSO0_SVW4_SK0_SKXCCM0_TLDS1_ULSGRO0_USL1_UIOFGRO0_USFGROn1_VSn1_VWA4_VWB2_WSGRA0_WSGRB0_WS64_WG64_4_1_WGM1_WGMXCC4_WGMXCCGn1
    SolutionIndex: 139
    SolutionNameMin: Cijk_Ailk_Bljk_I8II_BH_UserArgs_MT256x96x128_MI32x32x1_SN_LDSB1_AFC0_AFEM1_AFEM1_ASEM1_CLR1_CADS0_DTVA0_DTVB0_EPS0_FDSI0_GRPM1_GRVWA16_GRVWB16_GSUn1_GSUAMBSK_GSUC1_GSUWGMRR1_GLS0_ISA942_IU1_K1_LBSPPA0_LBSPPB128_LBSPPM0_LPA0_LPB16_LPM0_LRVW16_LWPMn1_MIAV0_MIWT4_3_MO40_NTn1_NTA0_NTB0_NTC0_NTD4_NTM0_NEPBS8_NLCA1_NLCB1_ONLL1_PGR2_PLR1_PKA1_SIA3_SS1_SU0_SUM1_SUS0_SPO0_SRVW0_SSO0_SVW4_SK0_SKXCCM0_TLDS1_ULSGRO0_USL1_UIOFGRO0_USFGROn1_VSn1_VWA4_VWB1_WSGRA0_WSGRB0_WS64_WG64_2_2_WGM1_WGMXCC4_WGMXCCGn1
    SolutionIndex: 140
    SolutionNameMin: Cijk_Ailk_Bljk_I8II_BH_UserArgs_MT256x96x128_MI32x32x1_SN_LDSB1_AFC0_AFEM1_AFEM1_ASEM1_CLR1_CADS0_DTVA0_DTVB0_EPS0_FDSI0_GRPM1_GRVWA16_GRVWB16_GSUn1_GSUAMBSK_GSUC1_GSUWGMRR1_GLS0_ISA942_IU1_K1_LBSPPA0_LBSPPB128_LBSPPM0_LPA0_LPB16_LPM0_LRVW16_LWPMn1_MIAV0_MIWT2_3_MO40_NTn1_NTA0_NTB0_NTC0_NTD4_NTM0_NEPBS8_NLCA1_NLCB1_ONLL1_PGR2_PLR1_PKA1_SIA3_SS1_SU0_SUM1_SUS0_SPO0_SRVW0_SSO0_SVW2_SK0_SKXCCM0_TLDS1_ULSGRO0_USL1_UIOFGRO0_USFGROn1_VSn1_VWA2_VWB1_WSGRA0_WSGRB0_WS64_WG128_2_1_WGM1_WGMXCC4_WGMXCCGn1
    SolutionIndex: 141
    SolutionNameMin: Cijk_Ailk_Bljk_I8II_BH_UserArgs_MT128x32x256_MI16x16x1_SN_LDSB1_AFC0_AFEM1_AFEM1_ASEM1_CLR1_CADS0_DTVA0_DTVB0_EPS0_FDSI0_GRPM1_GRVWA16_GRVWB16_GSUn1_GSUAMBSK_GSUC1_GSUWGMRR1_GLS0_ISA942_IU1_K1_LBSPPA2048_LBSPPB256_LBSPPM0_LPA64_LPB32_LPM0_LRVW16_LWPMn1_MIAV0_MIWT4_1_MO40_NTn1_NTA0_NTB0_NTC0_NTD4_NTM0_NEPBS8_NLCA1_NLCB1_ONLL1_PGR2_PLR1_PKA1_SIA3_SS1_SU0_SUM1_SUS0_SPO0_SRVW0_SSO0_SVW4_SK0_SKXCCM0_TLDS1_ULSGRO0_USL1_UIOFGRO0_USFGROn1_VSn1_VWA4_VWB1_WSGRA0_WSGRB0_WS64_WG32_8_1_WGM1_WGMXCC4_WGMXCCGn1
    SolutionIndex: 142
    SolutionNameMin: Cijk_Ailk_Bljk_I8II_BH_UserArgs_MT512x96x64_MI32x32x1_SN_LDSB1_AFC0_AFEM1_AFEM1_ASEM1_CLR1_CADS0_DTVA0_DTVB0_EPS0_FDSI0_GRPM1_GRVWA16_GRVWB8_GSUn1_GSUAMBSK_GSUC1_GSUWGMRR1_GLS0_ISA942_IU1_K1_LBSPPA0_LBSPPB128_LBSPPM0_LPA0_LPB16_LPM0_LRVW16_LWPMn1_MIAV0_MIWT4_3_MO40_NTn1_NTA0_NTB0_NTC0_NTD4_NTM0_NEPBS8_NLCA1_NLCB1_ONLL1_PGR2_PLR1_PKA1_SIA3_SS1_SU0_SUM1_SUS0_SPO0_SRVW0_SSO0_SVW4_SK0_SKXCCM0_TLDS1_ULSGRO0_USL1_UIOFGRO0_USFGROn1_VSn1_VWA4_VWB1_WSGRA0_WSGRB0_WS64_WG128_2_1_WGM1_WGMXCC4_WGMXCCGn1
    SolutionIndex: 143
    SolutionNameMin: Cijk_Ailk_Bljk_I8II_BH_UserArgs_MT512x80x64_MI16x16x1_SN_LDSB1_AFC0_AFEM1_AFEM1_ASEM1_CLR1_CADS0_DTVA0_DTVB0_EPS0_FDSI0_GRPM1_GRVWA16_GRVWB4_GSUn1_GSUAMBSK_GSUC1_GSUWGMRR1_GLS0_ISA942_IU1_K1_LBSPPA4096_LBSPPB128_LBSPPM0_LPA64_LPB8_LPM0_LRVW8_LWPMn1_MIAV0_MIWT8_5_MO40_NTn1_NTA0_NTB0_NTC0_NTD4_NTM0_NEPBS8_NLCA1_NLCB1_ONLL1_PGR2_PLR1_PKA1_SIA3_SS1_SU0_SUM1_SUS0_SPO0_SRVW0_SSO4_SVW8_SK0_SKXCCM0_TLDS1_ULSGRO0_USL1_UIOFGRO0_USFGROn1_VSn1_VWA8_VWB1_WSGRA0_WSGRB0_WS64_WG64_4_1_WGM1_WGMXCC4_WGMXCCGn1
    SolutionIndex: 144
    SolutionNameMin: Cijk_Ailk_Bljk_I8II_BH_UserArgs_MT256x80x128_MI16x16x1_SN_LDSB1_AFC0_AFEM1_AFEM1_ASEM1_CLR1_CADS0_DTVA0_DTVB0_EPS0_FDSI0_GRPM1_GRVWA16_GRVWB8_GSUn1_GSUAMBSK_GSUC1_GSUWGMRR1_GLS0_ISA942_IU1_K1_LBSPPA4096_LBSPPB128_LBSPPM0_LPA64_LPB32_LPM0_LRVW16_LWPMn1_MIAV0_MIWT4_5_MO40_NTn1_NTA0_NTB0_NTC0_NTD4_NTM0_NEPBS8_NLCA1_NLCB1_ONLL1_PGR2_PLR1_PKA1_SIA3_SS1_SU0_SUM1_SUS0_SPO0_SRVW0_SSO4_SVW4_SK0_SKXCCM0_TLDS1_ULSGRO0_USL1_UIOFGRO0_USFGROn1_VSn1_VWA4_VWB1_WSGRA0_WSGRB0_WS64_WG64_4_1_WGM1_WGMXCC4_WGMXCCGn1
    SolutionIndex: 145
    SolutionNameMin: Cijk_Ailk_Bljk_I8II_BH_UserArgs_MT256x96x128_MI16x16x1_SN_LDSB1_AFC0_AFEM1_AFEM1_ASEM1_CLR1_CADS0_DTVA0_DTVB0_EPS0_FDSI0_GRPM1_GRVWA16_GRVWB16_GSUn1_GSUAMBSK_GSUC1_GSUWGMRR1_GLS0_ISA942_IU1_K1_LBSPPA4096_LBSPPB256_LBSPPM0_LPA64_LPB32_LPM0_LRVW16_LWPMn1_MIAV0_MIWT4_6_MO40_NTn1_NTA0_NTB0_NTC0_NTD4_NTM0_NEPBS8_NLCA1_NLCB1_ONLL1_PGR2_PLR1_PKA1_SIA3_SS1_SU0_SUM1_SUS0_SPO0_SRVW0_SSO4_SVW4_SK0_SKXCCM0_TLDS1_ULSGRO0_USL1_UIOFGRO0_USFGROn1_VSn1_VWA4_VWB2_WSGRA0_WSGRB0_WS64_WG64_4_1_WGM1_WGMXCC4_WGMXCCGn1
    SolutionIndex: 146
    SolutionNameMin: Cijk_Ailk_Bljk_I8II_BH_UserArgs_MT384x80x64_MI16x16x1_SN_LDSB1_AFC0_AFEM1_AFEM1_ASEM1_CLR1_CADS0_DTVA0_DTVB0_EPS0_FDSI0_GRPM1_GRVWA16_GRVWB4_GSUn1_GSUAMBSK_GSUC1_GSUWGMRR1_GLS0_ISA942_IU1_K1_LBSPPA3072_LBSPPB128_LBSPPM0_LPA32_LPB8_LPM0_LRVW8_LWPMn1_MIAV0_MIWT6_5_MO40_NTn1_NTA0_NTB0_NTC0_NTD4_NTM0_NEPBS6_NLCA1_NLCB1_ONLL1_PGR2_PLR1_PKA1_SIA3_SS1_SU0_SUM1_SUS0_SPO0_SRVW0_SSO4_SVW2_SK0_SKXCCM0_TLDS1_ULSGRO0_USL1_UIOFGRO0_USFGROn1_VSn1_VWA2_VWB1_WSGRA0_WSGRB0_WS64_WG64_4_1_WGM1_WGMXCC4_WGMXCCGn1
    SolutionIndex: 147
    SolutionNameMin: Cijk_Ailk_Bljk_I8II_BH_UserArgs_MT384x80x128_MI16x16x1_SN_LDSB1_AFC0_AFEM1_AFEM1_ASEM1_CLR1_CADS0_DTVA0_DTVB0_EPS0_FDSI0_GRPM1_GRVWA16_GRVWB8_GSUn1_GSUAMBSK_GSUC1_GSUWGMRR1_GLS0_ISA942_IU1_K1_LBSPPA6144_LBSPPB128_LBSPPM0_LPA32_LPB32_LPM0_LRVW16_LWPMn1_MIAV0_MIWT6_5_MO40_NTn1_NTA0_NTB0_NTC0_NTD4_NTM0_NEPBS6_NLCA1_NLCB1_ONLL1_PGR2_PLR1_PKA1_SIA3_SS1_SU0_SUM1_SUS0_SPO0_SRVW0_SSO0_SVW2_SK0_SKXCCM0_TLDS1_ULSGRO0_USL1_UIOFGRO0_USFGROn1_VSn1_VWA2_VWB1_WSGRA0_WSGRB0_WS64_WG64_4_1_WGM1_WGMXCC4_WGMXCCGn1
    SolutionIndex: 148
    SolutionNameMin: Cijk_Ailk_Bljk_I8II_BH_UserArgs_MT16x80x256_MI16x16x1_SN_LDSB1_AFC0_AFEM1_AFEM1_ASEM1_CLR1_CADS0_DTVA0_DTVB0_EPS0_FDSI0_GRPM1_GRVWA1_GRVWB16_GSUn1_GSUAMBSK_GSUC1_GSUWGMRR1_GLS0_ISA942_IU1_K1_LBSPPA256_LBSPPB256_LBSPPM0_LPA16_LPB32_LPM0_LRVW16_LWPMn1_MIAV0_MIWT1_5_MO40_NTn1_NTA0_NTB0_NTC0_NTD4_NTM0_NEPBS8_NLCA1_NLCB1_ONLL1_PGR2_PLR1_PKA1_SIA3_SS1_SU0_SUM1_SUS0_SPO0_SRVW0_SSO0_SVW1_SK0_SKXCCM0_TLDS1_ULSGRO0_USL1_UIOFGRO0_USFGROn1_VSn1_VWA1_VWB1_WSGRA0_WSGRB0_WS64_WG16_4_4_WGM1_WGMXCC4_WGMXCCGn1
    SolutionIndex: 149
    SolutionNameMin: Cijk_Ailk_Bljk_I8II_BH_UserArgs_MT32x80x256_MI16x16x1_SN_LDSB0_AFC0_AFEM1_AFEM1_ASEM1_CLR1_CADS0_DTVA0_DTVB0_EPS0_FDSI0_GRPM1_GRVWA16_GRVWB16_GSUn1_GSUAMBSK_GSUC1_GSUWGMRR1_GLS0_ISA942_IU1_K1_LBSPPA512_LBSPPB256_LBSPPM0_LPA32_LPB32_LPM0_LRVW16_LWPMn1_MIAV0_MIWT2_5_MO40_NTn1_NTA0_NTB0_NTC0_NTD4_NTM0_NEPBS8_NLCA1_NLCB1_ONLL1_PGR2_PLR1_PKA1_SIA3_SS1_SU0_SUM1_SUS0_SPO0_SRVW0_SSO0_SVW2_SK0_SKXCCM0_TLDS1_ULSGRO0_USL1_UIOFGRO0_USFGROn1_VSn1_VWA2_VWB1_WSGRA0_WSGRB0_WS64_WG16_4_4_WGM1_WGMXCC4_WGMXCCGn1
    SolutionIndex: 150
    SolutionNameMin: Cijk_Ailk_Bljk_I8II_BH_UserArgs_MT32x80x128_MI16x16x1_SN_LDSB1_AFC0_AFEM1_AFEM1_ASEM1_CLR1_CADS0_DTVA0_DTVB0_EPS0_FDSI0_GRPM1_GRVWA16_GRVWB8_GSUn1_GSUAMBSK_GSUC1_GSUWGMRR1_GLS0_ISA942_IU1_K1_LBSPPA512_LBSPPB128_LBSPPM0_LPA16_LPB32_LPM0_LRVW16_LWPMn1_MIAV0_MIWT1_5_MO40_NTn1_NTA0_NTB0_NTC0_NTD4_NTM0_NEPBS8_NLCA1_NLCB1_ONLL1_PGR2_PLR1_PKA1_SIA3_SS1_SU0_SUM1_SUS0_SPO0_SRVW0_SSO0_SVW1_SK0_SKXCCM0_TLDS1_ULSGRO0_USL1_UIOFGRO0_USFGROn1_VSn1_VWA1_VWB1_WSGRA0_WSGRB0_WS64_WG32_4_2_WGM1_WGMXCC4_WGMXCCGn1
    SolutionIndex: 151
    SolutionNameMin: Cijk_Ailk_Bljk_I8II_BH_UserArgs_MT64x32x128_MI16x16x1_SN_LDSB1_AFC0_AFEM1_AFEM1_ASEM1_CLR1_CADS0_DTVA0_DTVB0_EPS0_FDSI0_GRPM1_GRVWA16_GRVWB16_GSUn1_GSUAMBSK_GSUC1_GSUWGMRR1_GLS0_ISA942_IU1_K1_LBSPPA1024_LBSPPB128_LBSPPM0_LPA64_LPB32_LPM0_LRVW16_LWPMn1_MIAV0_MIWT4_1_MO40_NTn1_NTA0_NTB0_NTC0_NTD4_NTM0_NEPBS8_NLCA1_NLCB1_ONLL1_PGR2_PLR1_PKA1_SIA3_SS1_SU0_SUM1_SUS0_SPO0_SRVW0_SSO0_SVW4_SK0_SKXCCM0_TLDS1_ULSGRO0_USL1_UIOFGRO0_USFGROn1_VSn1_VWA4_VWB1_WSGRA0_WSGRB0_WS64_WG16_8_2_WGM1_WGMXCC4_WGMXCCGn1
    SolutionIndex: 152
    SolutionNameMin: Cijk_Ailk_Bljk_I8II_BH_UserArgs_MT64x80x256_MI16x16x1_SN_LDSB1_AFC0_AFEM1_AFEM1_ASEM1_CLR1_CADS0_DTVA0_DTVB0_EPS0_FDSI0_GRPM1_GRVWA16_GRVWB16_GSUn1_GSUAMBSK_GSUC1_GSUWGMRR1_GLS0_ISA942_IU1_K1_LBSPPA1024_LBSPPB256_LBSPPM0_LPA64_LPB32_LPM0_LRVW16_LWPMn1_MIAV0_MIWT4_5_MO40_NTn1_NTA0_NTB0_NTC0_NTD4_NTM0_NEPBS8_NLCA1_NLCB1_ONLL1_PGR2_PLR1_PKA1_SIA3_SS1_SU0_SUM1_SUS0_SPO0_SRVW0_SSO0_SVW4_SK0_SKXCCM0_TLDS1_ULSGRO0_USL1_UIOFGRO0_USFGROn1_VSn1_VWA4_VWB1_WSGRA0_WSGRB0_WS64_WG16_4_4_WGM1_WGMXCC4_WGMXCCGn1
    SolutionIndex: 153
    SolutionNameMin: Cijk_Ailk_Bljk_I8II_BH_UserArgs_MT64x32x256_MI32x32x1_SN_LDSB1_AFC0_AFEM1_AFEM1_ASEM1_CLR1_CADS0_DTVA0_DTVB0_EPS0_FDSI0_GRPM1_GRVWA16_GRVWB16_GSUn1_GSUAMBSK_GSUC1_GSUWGMRR1_GLS0_ISA942_IU1_K1_LBSPPA0_LBSPPB256_LBSPPM0_LPA0_LPB16_LPM0_LRVW16_LWPMn1_MIAV0_MIWT2_1_MO40_NTn1_NTA0_NTB0_NTC0_NTD4_NTM0_NEPBS8_NLCA1_NLCB1_ONLL1_PGR2_PLR1_PKA1_SIA3_SS1_SU0_SUM1_SUS0_SPO0_SRVW0_SSO0_SVW2_SK0_SKXCCM0_TLDS1_ULSGRO0_USL1_UIOFGRO0_USFGROn1_VSn1_VWA2_VWB1_WSGRA0_WSGRB0_WS64_WG32_2_4_WGM1_WGMXCC4_WGMXCCGn1
    SolutionIndex: 154
    SolutionNameMin: Cijk_Ailk_Bljk_I8II_BH_UserArgs_MT32x96x128_MI32x32x1_SN_LDSB1_AFC0_AFEM1_AFEM1_ASEM1_CLR1_CADS0_DTVA0_DTVB0_EPS0_FDSI0_GRPM1_GRVWA16_GRVWB16_GSUn1_GSUAMBSK_GSUC1_GSUWGMRR1_GLS0_ISA942_IU1_K1_LBSPPA0_LBSPPB128_LBSPPM0_LPA0_LPB16_LPM0_LRVW16_LWPMn1_MIAV0_MIWT1_3_MO40_NTn1_NTA0_NTB0_NTC0_NTD4_NTM0_NEPBS8_NLCA1_NLCB1_ONLL1_PGR2_PLR1_PKA1_SIA3_SS1_SU0_SUM1_SUS0_SPO0_SRVW0_SSO0_SVW1_SK0_SKXCCM0_TLDS1_ULSGRO0_USL1_UIOFGRO0_USFGROn1_VSn1_VWA1_VWB1_WSGRA0_WSGRB0_WS64_WG32_2_4_WGM1_WGMXCC4_WGMXCCGn1
    SolutionIndex: 155
    SolutionNameMin: Cijk_Ailk_Bljk_I8II_BH_UserArgs_MT64x64x128_MI16x16x1_SN_LDSB0_AFC0_AFEM1_AFEM1_ASEM1_CLR1_CADS0_DTVA0_DTVB0_EPS0_FDSI0_GRPM1_GRVWA16_GRVWB16_GSUn1_GSUAMBSK_GSUC1_GSUWGMRR1_GLS0_ISA942_IU1_K1_LBSPPA1024_LBSPPB512_LBSPPM0_LPA16_LPB32_LPM0_LRVW16_LWPMn1_MIAV0_MIWT1_4_MO40_NTn1_NTA0_NTB0_NTC0_NTD4_NTM0_NEPBS8_NLCA1_NLCB1_ONLL1_PGR2_PLR1_PKA1_SIA3_SS1_SU0_SUM1_SUS0_SPO0_SRVW0_SSO0_SVW1_SK0_SKXCCM0_TLDS1_ULSGRO0_USL1_UIOFGRO0_USFGROn1_VSn1_VWA1_VWB4_WSGRA0_WSGRB0_WS64_WG64_4_1_WGM1_WGMXCC4_WGMXCCGn1
    SolutionIndex: 156
    SolutionNameMin: Cijk_Ailk_Bljk_I8II_BH_UserArgs_MT32x64x512_MI16x16x1_SN_LDSB1_AFC0_AFEM1_AFEM1_ASEM1_CLR1_CADS0_DTVA0_DTVB0_EPS0_FDSI0_GRPM1_GRVWA16_GRVWB16_GSUn1_GSUAMBSK_GSUC1_GSUWGMRR1_GLS0_ISA942_IU1_K1_LBSPPA512_LBSPPB512_LBSPPM0_LPA32_LPB32_LPM0_LRVW16_LWPMn1_MIAV0_MIWT2_1_MO40_NTn1_NTA0_NTB0_NTC0_NTD4_NTM0_NEPBS8_NLCA1_NLCB1_ONLL1_PGR2_PLR1_PKA1_SIA3_SS1_SU0_SUM1_SUS0_SPO0_SRVW0_SSO0_SVW2_SK0_SKXCCM0_TLDS1_ULSGRO0_USL1_UIOFGRO0_USFGROn1_VSn1_VWA2_VWB1_WSGRA0_WSGRB0_WS64_WG16_16_1_WGM1_WGMXCC4_WGMXCCGn1
    SolutionIndex: 157
    SolutionNameMin: Cijk_Ailk_Bljk_I8II_BH_UserArgs_MT128x64x128_MI32x32x1_SN_LDSB1_AFC0_AFEM1_AFEM1_ASEM1_CLR1_CADS0_DTVA0_DTVB0_EPS0_FDSI0_GRPM1_GRVWA16_GRVWB16_GSUn1_GSUAMBSK_GSUC1_GSUWGMRR1_GLS0_ISA942_IU1_K1_LBSPPA0_LBSPPB256_LBSPPM0_LPA0_LPB16_LPM0_LRVW16_LWPMn1_MIAV0_MIWT1_2_MO40_NTn1_NTA0_NTB0_NTC0_NTD4_NTM0_NEPBS8_NLCA1_NLCB1_ONLL1_PGR2_PLR1_PKA1_SIA3_SS1_SU0_SUM1_SUS0_SPO0_SRVW0_SSO0_SVW1_SK0_SKXCCM0_TLDS1_ULSGRO0_USL1_UIOFGRO0_USFGROn1_VSn1_VWA1_VWB2_WSGRA0_WSGRB0_WS64_WG128_2_1_WGM1_WGMXCC4_WGMXCCGn1
    SolutionIndex: 158
    SolutionNameMin: Cijk_Ailk_Bljk_I8II_BH_UserArgs_MT256x112x128_MI16x16x1_SN_LDSB1_AFC0_AFEM1_AFEM1_ASEM1_CLR1_CADS0_DTVA0_DTVB0_EPS0_FDSI0_GRPM1_GRVWA16_GRVWB8_GSUn1_GSUAMBSK_GSUC1_GSUWGMRR1_GLS0_ISA942_IU1_K1_LBSPPA4096_LBSPPB128_LBSPPM0_LPA64_LPB32_LPM0_LRVW16_LWPMn1_MIAV0_MIWT4_7_MO40_NTn1_NTA0_NTB0_NTC0_NTD4_NTM0_NEPBS8_NLCA1_NLCB1_ONLL1_PGR2_PLR1_PKA1_SIA3_SS1_SU0_SUM1_SUS0_SPO0_SRVW0_SSO0_SVW4_SK0_SKXCCM0_TLDS1_ULSGRO0_USL1_UIOFGRO0_USFGROn1_VSn1_VWA4_VWB1_WSGRA0_WSGRB0_WS64_WG64_4_1_WGM1_WGMXCC4_WGMXCCGn1
    SolutionIndex: 159
    SolutionNameMin: Cijk_Ailk_Bljk_I8II_BH_UserArgs_MT512x112x64_MI16x16x1_SN_LDSB1_AFC0_AFEM1_AFEM1_ASEM1_CLR1_CADS0_DTVA0_DTVB0_EPS0_FDSI0_GRPM1_GRVWA16_GRVWB4_GSUn1_GSUAMBSK_GSUC1_GSUWGMRR1_GLS0_ISA942_IU1_K1_LBSPPA4096_LBSPPB128_LBSPPM0_LPA64_LPB8_LPM0_LRVW8_LWPMn1_MIAV0_MIWT8_7_MO40_NTn1_NTA0_NTB0_NTC0_NTD4_NTM0_NEPBS8_NLCA1_NLCB1_ONLL1_PGR2_PLR1_PKA1_SIA3_SS1_SU0_SUM1_SUS0_SPO0_SRVW0_SSO0_SVW8_SK0_SKXCCM0_TLDS1_ULSGRO0_USL1_UIOFGRO0_USFGROn1_VSn1_VWA8_VWB1_WSGRA0_WSGRB0_WS64_WG64_4_1_WGM1_WGMXCC4_WGMXCCGn1
    SolutionIndex: 160
    SolutionNameMin: Cijk_Ailk_Bljk_I8II_BH_UserArgs_MT128x112x64_MI16x16x1_SN_LDSB1_AFC0_AFEM1_AFEM1_ASEM1_CLR1_CADS0_DTVA0_DTVB0_EPS0_FDSI0_GRPM1_GRVWA16_GRVWB4_GSUn1_GSUAMBSK_GSUC1_GSUWGMRR1_GLS0_ISA942_IU1_K1_LBSPPA1024_LBSPPB128_LBSPPM0_LPA32_LPB8_LPM0_LRVW8_LWPMn1_MIAV0_MIWT2_7_MO40_NTn1_NTA0_NTB0_NTC0_NTD4_NTM0_NEPBS8_NLCA1_NLCB1_ONLL1_PGR2_PLR1_PKA1_SIA3_SS1_SU0_SUM1_SUS0_SPO0_SRVW0_SSO0_SVW2_SK0_SKXCCM0_TLDS1_ULSGRO0_USL1_UIOFGRO0_USFGROn1_VSn1_VWA2_VWB1_WSGRA0_WSGRB0_WS64_WG64_4_1_WGM1_WGMXCC4_WGMXCCGn1
    SolutionIndex: 161
    SolutionNameMin: Cijk_Ailk_Bljk_I8II_BH_UserArgs_MT256x112x64_MI16x16x1_SN_LDSB1_AFC0_AFEM1_AFEM1_ASEM1_CLR1_CADS0_DTVA0_DTVB0_EPS0_FDSI0_GRPM1_GRVWA16_GRVWB4_GSUn1_GSUAMBSK_GSUC1_GSUWGMRR1_GLS0_ISA942_IU1_K1_LBSPPA2048_LBSPPB128_LBSPPM0_LPA64_LPB8_LPM0_LRVW8_LWPMn1_MIAV0_MIWT4_7_MO40_NTn1_NTA0_NTB0_NTC0_NTD4_NTM0_NEPBS8_NLCA1_NLCB1_ONLL1_PGR2_PLR1_PKA1_SIA3_SS1_SU0_SUM1_SUS0_SPO0_SRVW0_SSO0_SVW4_SK0_SKXCCM0_TLDS1_ULSGRO0_USL1_UIOFGRO0_USFGROn1_VSn1_VWA4_VWB1_WSGRA0_WSGRB0_WS64_WG64_4_1_WGM1_WGMXCC4_WGMXCCGn1
    SolutionIndex: 162
    SolutionNameMin: Cijk_Ailk_Bljk_I8II_BH_UserArgs_MT128x96x128_MI16x16x1_SN_LDSB1_AFC0_AFEM1_AFEM1_ASEM1_CLR1_CADS0_DTVA0_DTVB0_EPS0_FDSI0_GRPM1_GRVWA16_GRVWB16_GSUn1_GSUAMBSK_GSUC1_GSUWGMRR1_GLS0_ISA942_IU1_K1_LBSPPA2048_LBSPPB256_LBSPPM0_LPA32_LPB32_LPM0_LRVW16_LWPMn1_MIAV0_MIWT2_6_MO40_NTn1_NTA0_NTB0_NTC0_NTD4_NTM0_NEPBS8_NLCA1_NLCB1_ONLL1_PGR2_PLR1_PKA1_SIA3_SS1_SU0_SUM1_SUS0_SPO0_SRVW0_SSO4_SVW2_SK0_SKXCCM0_TLDS1_ULSGRO0_USL1_UIOFGRO0_USFGROn1_VSn1_VWA2_VWB2_WSGRA0_WSGRB0_WS64_WG64_4_1_WGM1_WGMXCC4_WGMXCCGn1
    SolutionIndex: 163
    SolutionNameMin: Cijk_Ailk_Bljk_I8II_BH_UserArgs_MT512x96x64_MI32x32x1_SN_LDSB1_AFC0_AFEM1_AFEM1_ASEM1_CLR1_CADS0_DTVA0_DTVB0_EPS0_FDSI0_GRPM1_GRVWA16_GRVWB8_GSUn1_GSUAMBSK_GSUC1_GSUWGMRR1_GLS0_ISA942_IU1_K1_LBSPPA0_LBSPPB128_LBSPPM0_LPA0_LPB16_LPM0_LRVW16_LWPMn1_MIAV0_MIWT4_3_MO40_NTn1_NTA0_NTB0_NTC0_NTD4_NTM0_NEPBS8_NLCA1_NLCB1_ONLL1_PGR2_PLR1_PKA1_SIA3_SS1_SU0_SUM1_SUS0_SPO0_SRVW0_SSO4_SVW4_SK0_SKXCCM0_TLDS1_ULSGRO0_USL1_UIOFGRO0_USFGROn1_VSn1_VWA4_VWB1_WSGRA0_WSGRB0_WS64_WG128_2_1_WGM1_WGMXCC4_WGMXCCGn1
    SolutionIndex: 164
    SolutionNameMin: Cijk_Ailk_Bljk_I8II_BH_UserArgs_MT384x96x128_MI16x16x1_SN_LDSB1_AFC0_AFEM1_AFEM1_ASEM1_CLR1_CADS0_DTVA0_DTVB0_EPS0_FDSI0_GRPM1_GRVWA16_GRVWB16_GSUn1_GSUAMBSK_GSUC1_GSUWGMRR1_GLS0_ISA942_IU1_K1_LBSPPA6144_LBSPPB256_LBSPPM0_LPA32_LPB32_LPM0_LRVW16_LWPMn1_MIAV0_MIWT6_6_MO40_NTn1_NTA0_NTB0_NTC0_NTD4_NTM0_NEPBS6_NLCA1_NLCB1_ONLL1_PGR2_PLR1_PKA1_SIA3_SS1_SU0_SUM1_SUS0_SPO0_SRVW0_SSO0_SVW2_SK0_SKXCCM0_TLDS1_ULSGRO0_USL1_UIOFGRO0_USFGROn1_VSn1_VWA2_VWB2_WSGRA0_WSGRB0_WS64_WG64_4_1_WGM1_WGMXCC4_WGMXCCGn1
    SolutionIndex: 165
    SolutionNameMin: Cijk_Ailk_Bljk_I8II_BH_UserArgs_MT16x96x256_MI16x16x1_SN_LDSB1_AFC0_AFEM1_AFEM1_ASEM1_CLR1_CADS0_DTVA0_DTVB0_EPS0_FDSI0_GRPM1_GRVWA1_GRVWB16_GSUn1_GSUAMBSK_GSUC1_GSUWGMRR1_GLS0_ISA942_IU1_K1_LBSPPA256_LBSPPB512_LBSPPM0_LPA16_LPB32_LPM0_LRVW16_LWPMn1_MIAV0_MIWT1_6_MO40_NTn1_NTA0_NTB0_NTC0_NTD4_NTM0_NEPBS8_NLCA1_NLCB1_ONLL1_PGR2_PLR1_PKA1_SIA3_SS1_SU0_SUM1_SUS0_SPO0_SRVW0_SSO0_SVW1_SK0_SKXCCM0_TLDS1_ULSGRO0_USL1_UIOFGRO0_USFGROn1_VSn1_VWA1_VWB2_WSGRA0_WSGRB0_WS64_WG16_4_4_WGM1_WGMXCC4_WGMXCCGn1
    SolutionIndex: 166
    SolutionNameMin: Cijk_Ailk_Bljk_I8II_BH_UserArgs_MT64x96x128_MI32x32x1_SN_LDSB1_AFC0_AFEM1_AFEM1_ASEM1_CLR1_CADS0_DTVA0_DTVB0_EPS0_FDSI0_GRPM1_GRVWA16_GRVWB16_GSUn1_GSUAMBSK_GSUC1_GSUWGMRR1_GLS0_ISA942_IU1_K1_LBSPPA0_LBSPPB128_LBSPPM0_LPA0_LPB16_LPM0_LRVW16_LWPMn1_MIAV0_MIWT2_3_MO40_NTn1_NTA0_NTB0_NTC0_NTD4_NTM0_NEPBS8_NLCA1_NLCB1_ONLL1_PGR2_PLR1_PKA1_SIA3_SS1_SU0_SUM1_SUS0_SPO0_SRVW0_SSO0_SVW2_SK0_SKXCCM0_TLDS1_ULSGRO0_USL1_UIOFGRO0_USFGROn1_VSn1_VWA2_VWB1_WSGRA0_WSGRB0_WS64_WG32_2_4_WGM1_WGMXCC4_WGMXCCGn1
    SolutionIndex: 167
    SolutionNameMin: Cijk_Ailk_Bljk_I8II_BH_UserArgs_MT64x32x128_MI16x16x1_SN_LDSB1_AFC0_AFEM1_AFEM1_ASEM1_CLR1_CADS0_DTVA0_DTVB0_EPS0_FDSI0_GRPM1_GRVWA16_GRVWB16_GSUn1_GSUAMBSK_GSUC1_GSUWGMRR1_GLS0_ISA942_IU1_K1_LBSPPA1024_LBSPPB256_LBSPPM0_LPA32_LPB32_LPM0_LRVW16_LWPMn1_MIAV0_MIWT2_2_MO40_NTn1_NTA0_NTB0_NTC0_NTD4_NTM0_NEPBS8_NLCA1_NLCB1_ONLL1_PGR2_PLR1_PKA1_SIA3_SS1_SU0_SUM1_SUS0_SPO0_SRVW0_SSO0_SVW2_SK0_SKXCCM0_TLDS1_ULSGRO0_USL1_UIOFGRO0_USFGROn1_VSn1_VWA2_VWB2_WSGRA0_WSGRB0_WS64_WG32_4_2_WGM1_WGMXCC4_WGMXCCGn1
    SolutionIndex: 168
    SolutionNameMin: Cijk_Ailk_Bljk_I8II_BH_UserArgs_MT64x96x256_MI16x16x1_SN_LDSB1_AFC0_AFEM1_AFEM1_ASEM1_CLR1_CADS0_DTVA0_DTVB0_EPS0_FDSI0_GRPM1_GRVWA16_GRVWB16_GSUn1_GSUAMBSK_GSUC1_GSUWGMRR1_GLS0_ISA942_IU1_K1_LBSPPA1024_LBSPPB512_LBSPPM0_LPA64_LPB32_LPM0_LRVW16_LWPMn1_MIAV0_MIWT4_6_MO40_NTn1_NTA0_NTB0_NTC0_NTD4_NTM0_NEPBS8_NLCA1_NLCB1_ONLL1_PGR2_PLR1_PKA1_SIA3_SS1_SU0_SUM1_SUS0_SPO0_SRVW0_SSO0_SVW4_SK0_SKXCCM0_TLDS1_ULSGRO0_USL1_UIOFGRO0_USFGROn1_VSn1_VWA4_VWB2_WSGRA0_WSGRB0_WS64_WG16_4_4_WGM1_WGMXCC4_WGMXCCGn1
    SolutionIndex: 169
    SolutionNameMin: Cijk_Ailk_Bljk_I8II_BH_UserArgs_MT64x32x256_MI16x16x1_SN_LDSB1_AFC0_AFEM1_AFEM1_ASEM1_CLR1_CADS0_DTVA0_DTVB0_EPS0_FDSI0_GRPM1_GRVWA16_GRVWB16_GSUn1_GSUAMBSK_GSUC1_GSUWGMRR1_GLS0_ISA942_IU1_K1_LBSPPA1024_LBSPPB512_LBSPPM0_LPA32_LPB32_LPM0_LRVW16_LWPMn1_MIAV0_MIWT4_2_MO40_NTn1_NTA0_NTB0_NTC0_NTD4_NTM0_NEPBS8_NLCA1_NLCB1_ONLL1_PGR2_PLR1_PKA1_SIA3_SS1_SU0_SUM1_SUS0_SPO0_SRVW0_SSO0_SVW4_SK0_SKXCCM0_TLDS1_ULSGRO0_USL1_UIOFGRO0_USFGROn1_VSn1_VWA4_VWB2_WSGRA0_WSGRB0_WS64_WG16_4_4_WGM1_WGMXCC4_WGMXCCGn1
    SolutionIndex: 170
    SolutionNameMin: Cijk_Ailk_Bljk_I8II_BH_UserArgs_MT64x64x128_MI16x16x1_SN_LDSB0_AFC0_AFEM1_AFEM1_ASEM1_CLR1_CADS0_DTVA0_DTVB0_EPS0_FDSI0_GRPM1_GRVWA16_GRVWB16_GSUn1_GSUAMBSK_GSUC1_GSUWGMRR1_GLS0_ISA942_IU1_K1_LBSPPA1024_LBSPPB128_LBSPPM0_LPA64_LPB32_LPM0_LRVW16_LWPMn1_MIAV0_MIWT4_1_MO40_NTn1_NTA0_NTB0_NTC0_NTD4_NTM0_NEPBS8_NLCA1_NLCB1_ONLL1_PGR2_PLR1_PKA1_SIA3_SS1_SU0_SUM1_SUS0_SPO0_SRVW0_SSO0_SVW4_SK0_SKXCCM0_TLDS1_ULSGRO0_USL1_UIOFGRO0_USFGROn1_VSn1_VWA4_VWB1_WSGRA0_WSGRB0_WS64_WG16_16_1_WGM1_WGMXCC4_WGMXCCGn1
    SolutionIndex: 171
    SolutionNameMin: Cijk_Ailk_Bljk_I8II_BH_UserArgs_MT128x128x128_MI16x16x1_SN_LDSB1_AFC0_AFEM1_AFEM1_ASEM1_CLR1_CADS0_DTVA0_DTVB0_EPS0_FDSI0_GRPM1_GRVWA16_GRVWB16_GSUn1_GSUAMBSK_GSUC1_GSUWGMRR1_GLS0_ISA942_IU1_K1_LBSPPA2048_LBSPPB512_LBSPPM0_LPA64_LPB32_LPM0_LRVW16_LWPMn1_MIAV0_MIWT4_4_MO40_NTn1_NTA0_NTB0_NTC0_NTD4_NTM0_NEPBS8_NLCA1_NLCB1_ONLL1_PGR2_PLR1_PKA1_SIA3_SS1_SU0_SUM1_SUS0_SPO0_SRVW0_SSO0_SVW4_SK0_SKXCCM0_TLDS1_ULSGRO0_USL1_UIOFGRO0_USFGROn1_VSn1_VWA4_VWB4_WSGRA0_WSGRB0_WS64_WG32_8_1_WGM1_WGMXCC4_WGMXCCGn1
    SolutionIndex: 172
    SolutionNameMin: Cijk_Ailk_Bljk_I8II_BH_UserArgs_MT384x128x64_MI16x16x1_SN_LDSB1_AFC0_AFEM1_AFEM1_ASEM1_CLR1_CADS0_DTVA0_DTVB0_EPS0_FDSI0_GRPM1_GRVWA16_GRVWB8_GSUn1_GSUAMBSK_GSUC1_GSUWGMRR1_GLS0_ISA942_IU1_K1_LBSPPA3072_LBSPPB512_LBSPPM0_LPA32_LPB16_LPM0_LRVW8_LWPMn1_MIAV0_MIWT6_8_MO40_NTn1_NTA0_NTB0_NTC0_NTD4_NTM0_NEPBS6_NLCA1_NLCB1_ONLL1_PGR2_PLR1_PKA1_SIA3_SS1_SU0_SUM1_SUS0_SPO0_SRVW0_SSO0_SVW2_SK0_SKXCCM0_TLDS1_ULSGRO0_USL1_UIOFGRO0_USFGROn1_VSn1_VWA2_VWB8_WSGRA0_WSGRB0_WS64_WG64_4_1_WGM1_WGMXCC4_WGMXCCGn1
    SolutionIndex: 173
    SolutionNameMin: Cijk_Ailk_Bljk_I8II_BH_UserArgs_MT512x128x64_MI32x32x1_SN_LDSB1_AFC0_AFEM1_AFEM1_ASEM1_CLR1_CADS0_DTVA0_DTVB0_EPS0_FDSI0_GRPM1_GRVWA16_GRVWB16_GSUn1_GSUAMBSK_GSUC1_GSUWGMRR1_GLS0_ISA942_IU1_K1_LBSPPA0_LBSPPB256_LBSPPM0_LPA0_LPB16_LPM0_LRVW16_LWPMn1_MIAV0_MIWT4_4_MO40_NTn1_NTA0_NTB0_NTC0_NTD4_NTM0_NEPBS8_NLCA1_NLCB1_ONLL1_PGR2_PLR1_PKA1_SIA3_SS1_SU0_SUM1_SUS0_SPO0_SRVW0_SSO0_SVW4_SK0_SKXCCM0_TLDS1_ULSGRO0_USL1_UIOFGRO0_USFGROn1_VSn1_VWA4_VWB4_WSGRA0_WSGRB0_WS64_WG128_2_1_WGM1_WGMXCC4_WGMXCCGn1
    SolutionIndex: 174
    SolutionNameMin: Cijk_Ailk_Bljk_I8II_BH_UserArgs_MT256x128x128_MI32x32x1_SN_LDSB1_AFC0_AFEM1_AFEM1_ASEM1_CLR1_CADS0_DTVA0_DTVB0_EPS0_FDSI0_GRPM1_GRVWA16_GRVWB16_GSUn1_GSUAMBSK_GSUC1_GSUWGMRR1_GLS0_ISA942_IU1_K1_LBSPPA0_LBSPPB512_LBSPPM0_LPA0_LPB16_LPM0_LRVW16_LWPMn1_MIAV0_MIWT2_4_MO40_NTn1_NTA0_NTB0_NTC0_NTD4_NTM0_NEPBS8_NLCA1_NLCB1_ONLL1_PGR2_PLR1_PKA1_SIA3_SS1_SU0_SUM1_SUS0_SPO0_SRVW0_SSO4_SVW2_SK0_SKXCCM0_TLDS1_ULSGRO0_USL1_UIOFGRO0_USFGROn1_VSn1_VWA2_VWB4_WSGRA0_WSGRB0_WS64_WG128_2_1_WGM1_WGMXCC4_WGMXCCGn1
    SolutionIndex: 175
    SolutionNameMin: Cijk_Ailk_Bljk_I8II_BH_UserArgs_MT384x128x64_MI32x32x1_SN_LDSB1_AFC0_AFEM1_AFEM1_ASEM1_CLR1_CADS0_DTVA0_DTVB0_EPS0_FDSI0_GRPM1_GRVWA16_GRVWB16_GSUn1_GSUAMBSK_GSUC1_GSUWGMRR1_GLS0_ISA942_IU1_K1_LBSPPA0_LBSPPB256_LBSPPM0_LPA0_LPB16_LPM0_LRVW16_LWPMn1_MIAV0_MIWT3_4_MO40_NTn1_NTA0_NTB0_NTC0_NTD4_NTM0_NEPBS6_NLCA1_NLCB1_ONLL1_PGR2_PLR1_PKA1_SIA3_SS1_SU0_SUM1_SUS0_SPO0_SRVW0_SSO4_SVW1_SK0_SKXCCM0_TLDS1_ULSGRO0_USL1_UIOFGRO0_USFGROn1_VSn1_VWA1_VWB4_WSGRA0_WSGRB0_WS64_WG128_2_1_WGM1_WGMXCC4_WGMXCCGn1
    SolutionIndex: 176
    SolutionNameMin: Cijk_Ailk_Bljk_I8II_BH_UserArgs_MT384x128x64_MI16x16x1_SN_LDSB1_AFC0_AFEM1_AFEM1_ASEM1_CLR1_CADS0_DTVA0_DTVB0_EPS0_FDSI0_GRPM1_GRVWA16_GRVWB8_GSUn1_GSUAMBSK_GSUC1_GSUWGMRR1_GLS0_ISA942_IU1_K1_LBSPPA3072_LBSPPB512_LBSPPM0_LPA32_LPB16_LPM0_LRVW8_LWPMn1_MIAV0_MIWT6_8_MO40_NTn1_NTA0_NTB0_NTC0_NTD4_NTM0_NEPBS6_NLCA1_NLCB1_ONLL1_PGR2_PLR1_PKA1_SIA3_SS1_SU0_SUM1_SUS0_SPO0_SRVW0_SSO4_SVW2_SK0_SKXCCM0_TLDS1_ULSGRO0_USL1_UIOFGRO0_USFGROn1_VSn1_VWA2_VWB8_WSGRA0_WSGRB0_WS64_WG64_4_1_WGM1_WGMXCC4_WGMXCCGn1
    SolutionIndex: 177
    SolutionNameMin: Cijk_Ailk_Bljk_I8II_BH_UserArgs_MT256x128x64_MI16x16x1_SN_LDSB1_AFC0_AFEM1_AFEM1_ASEM1_CLR1_CADS0_DTVA0_DTVB0_EPS0_FDSI0_GRPM1_GRVWA16_GRVWB8_GSUn1_GSUAMBSK_GSUC1_GSUWGMRR1_GLS0_ISA942_IU1_K1_LBSPPA2048_LBSPPB512_LBSPPM0_LPA64_LPB16_LPM0_LRVW8_LWPMn1_MIAV0_MIWT4_8_MO40_NTn1_NTA0_NTB0_NTC0_NTD4_NTM0_NEPBS8_NLCA1_NLCB1_ONLL1_PGR2_PLR1_PKA1_SIA3_SS1_SU0_SUM1_SUS0_SPO0_SRVW0_SSO4_SVW4_SK0_SKXCCM0_TLDS1_ULSGRO0_USL1_UIOFGRO0_USFGROn1_VSn1_VWA4_VWB8_WSGRA0_WSGRB0_WS64_WG64_4_1_WGM1_WGMXCC4_WGMXCCGn1
    SolutionIndex: 178
    SolutionNameMin: Cijk_Ailk_Bljk_I8II_BH_UserArgs_MT512x112x64_MI16x16x1_SN_LDSB1_AFC0_AFEM1_AFEM1_ASEM1_CLR1_CADS0_DTVA0_DTVB0_EPS0_FDSI0_GRPM1_GRVWA16_GRVWB4_GSUn1_GSUAMBSK_GSUC1_GSUWGMRR1_GLS0_ISA942_IU1_K1_LBSPPA4096_LBSPPB128_LBSPPM0_LPA64_LPB8_LPM0_LRVW8_LWPMn1_MIAV0_MIWT8_7_MO40_NTn1_NTA0_NTB0_NTC0_NTD4_NTM0_NEPBS8_NLCA1_NLCB1_ONLL1_PGR2_PLR1_PKA1_SIA3_SS1_SU0_SUM1_SUS0_SPO0_SRVW0_SSO4_SVW8_SK0_SKXCCM0_TLDS1_ULSGRO0_USL1_UIOFGRO0_USFGROn1_VSn1_VWA8_VWB1_WSGRA0_WSGRB0_WS64_WG64_4_1_WGM1_WGMXCC4_WGMXCCGn1
    SolutionIndex: 179
    SolutionNameMin: Cijk_Ailk_Bljk_I8II_BH_UserArgs_MT256x112x128_MI16x16x1_SN_LDSB1_AFC0_AFEM1_AFEM1_ASEM1_CLR1_CADS0_DTVA0_DTVB0_EPS0_FDSI0_GRPM1_GRVWA16_GRVWB8_GSUn1_GSUAMBSK_GSUC1_GSUWGMRR1_GLS0_ISA942_IU1_K1_LBSPPA4096_LBSPPB128_LBSPPM0_LPA64_LPB32_LPM0_LRVW16_LWPMn1_MIAV0_MIWT4_7_MO40_NTn1_NTA0_NTB0_NTC0_NTD4_NTM0_NEPBS8_NLCA1_NLCB1_ONLL1_PGR2_PLR1_PKA1_SIA3_SS1_SU0_SUM1_SUS0_SPO0_SRVW0_SSO4_SVW4_SK0_SKXCCM0_TLDS1_ULSGRO0_USL1_UIOFGRO0_USFGROn1_VSn1_VWA4_VWB1_WSGRA0_WSGRB0_WS64_WG64_4_1_WGM1_WGMXCC4_WGMXCCGn1
    SolutionIndex: 180
    SolutionNameMin: Cijk_Ailk_Bljk_I8II_BH_UserArgs_MT256x112x64_MI16x16x1_SN_LDSB1_AFC0_AFEM1_AFEM1_ASEM1_CLR1_CADS0_DTVA0_DTVB0_EPS0_FDSI0_GRPM1_GRVWA16_GRVWB4_GSUn1_GSUAMBSK_GSUC1_GSUWGMRR1_GLS0_ISA942_IU1_K1_LBSPPA2048_LBSPPB128_LBSPPM0_LPA64_LPB8_LPM0_LRVW8_LWPMn1_MIAV0_MIWT4_7_MO40_NTn1_NTA0_NTB0_NTC0_NTD4_NTM0_NEPBS8_NLCA1_NLCB1_ONLL1_PGR2_PLR1_PKA1_SIA3_SS1_SU0_SUM1_SUS0_SPO0_SRVW0_SSO4_SVW4_SK0_SKXCCM0_TLDS1_ULSGRO0_USL1_UIOFGRO0_USFGROn1_VSn1_VWA4_VWB1_WSGRA0_WSGRB0_WS64_WG64_4_1_WGM1_WGMXCC4_WGMXCCGn1
    SolutionIndex: 181
    SolutionNameMin: Cijk_Ailk_Bljk_I8II_BH_UserArgs_MT256x128x64_MI16x16x1_SN_LDSB1_AFC0_AFEM1_AFEM1_ASEM1_CLR1_CADS0_DTVA0_DTVB0_EPS0_FDSI0_GRPM1_GRVWA16_GRVWB8_GSUn1_GSUAMBSK_GSUC1_GSUWGMRR1_GLS0_ISA942_IU1_K1_LBSPPA2048_LBSPPB512_LBSPPM0_LPA64_LPB16_LPM0_LRVW8_LWPMn1_MIAV0_MIWT4_8_MO40_NTn1_NTA0_NTB0_NTC0_NTD4_NTM0_NEPBS8_NLCA1_NLCB1_ONLL1_PGR2_PLR1_PKA1_SIA3_SS1_SU0_SUM1_SUS0_SPO0_SRVW0_SSO0_SVW4_SK0_SKXCCM0_TLDS1_ULSGRO0_USL1_UIOFGRO0_USFGROn1_VSn1_VWA4_VWB8_WSGRA0_WSGRB0_WS64_WG64_4_1_WGM1_WGMXCC4_WGMXCCGn1
    SolutionIndex: 182
    SolutionNameMin: Cijk_Ailk_Bljk_I8II_BH_UserArgs_MT384x112x64_MI16x16x1_SN_LDSB1_AFC0_AFEM1_AFEM1_ASEM1_CLR1_CADS0_DTVA0_DTVB0_EPS0_FDSI0_GRPM1_GRVWA16_GRVWB4_GSUn1_GSUAMBSK_GSUC1_GSUWGMRR1_GLS0_ISA942_IU1_K1_LBSPPA3072_LBSPPB128_LBSPPM0_LPA32_LPB8_LPM0_LRVW8_LWPMn1_MIAV0_MIWT6_7_MO40_NTn1_NTA0_NTB0_NTC0_NTD4_NTM0_NEPBS6_NLCA1_NLCB1_ONLL1_PGR2_PLR1_PKA1_SIA3_SS1_SU0_SUM1_SUS0_SPO0_SRVW0_SSO0_SVW2_SK0_SKXCCM0_TLDS1_ULSGRO0_USL1_UIOFGRO0_USFGROn1_VSn1_VWA2_VWB1_WSGRA0_WSGRB0_WS64_WG64_4_1_WGM1_WGMXCC4_WGMXCCGn1
    SolutionIndex: 183
    SolutionNameMin: Cijk_Ailk_Bljk_I8II_BH_UserArgs_MT32x112x256_MI16x16x1_SN_LDSB1_AFC0_AFEM1_AFEM1_ASEM1_CLR1_CADS0_DTVA0_DTVB0_EPS0_FDSI0_GRPM1_GRVWA16_GRVWB16_GSUn1_GSUAMBSK_GSUC1_GSUWGMRR1_GLS0_ISA942_IU1_K1_LBSPPA512_LBSPPB256_LBSPPM0_LPA32_LPB32_LPM0_LRVW16_LWPMn1_MIAV0_MIWT2_7_MO40_NTn1_NTA0_NTB0_NTC0_NTD4_NTM0_NEPBS8_NLCA1_NLCB1_ONLL1_PGR2_PLR1_PKA1_SIA3_SS1_SU0_SUM1_SUS0_SPO0_SRVW0_SSO0_SVW2_SK0_SKXCCM0_TLDS1_ULSGRO0_USL1_UIOFGRO0_USFGROn1_VSn1_VWA2_VWB1_WSGRA0_WSGRB0_WS64_WG16_4_4_WGM1_WGMXCC4_WGMXCCGn1
    SolutionIndex: 184
    SolutionNameMin: Cijk_Ailk_Bljk_I8II_BH_UserArgs_MT32x64x128_MI32x32x1_SN_LDSB1_AFC0_AFEM1_AFEM1_ASEM1_CLR1_CADS0_DTVA0_DTVB0_EPS0_FDSI0_GRPM1_GRVWA16_GRVWB16_GSUn1_GSUAMBSK_GSUC1_GSUWGMRR1_GLS0_ISA942_IU1_K1_LBSPPA0_LBSPPB256_LBSPPM0_LPA0_LPB16_LPM0_LRVW16_LWPMn1_MIAV0_MIWT1_2_MO40_NTn1_NTA0_NTB0_NTC0_NTD4_NTM0_NEPBS8_NLCA1_NLCB1_ONLL1_PGR2_PLR1_PKA1_SIA3_SS1_SU0_SUM1_SUS0_SPO0_SRVW0_SSO0_SVW1_SK0_SKXCCM0_TLDS1_ULSGRO0_USL1_UIOFGRO0_USFGROn1_VSn1_VWA1_VWB2_WSGRA0_WSGRB0_WS64_WG32_2_4_WGM1_WGMXCC4_WGMXCCGn1
    SolutionIndex: 185
    SolutionNameMin: Cijk_Ailk_Bljk_I8II_BH_UserArgs_MT32x128x128_MI32x32x1_SN_LDSB0_AFC0_AFEM1_AFEM1_ASEM1_CLR1_CADS0_DTVA0_DTVB0_EPS0_FDSI0_GRPM1_GRVWA16_GRVWB16_GSUn1_GSUAMBSK_GSUC1_GSUWGMRR1_GLS0_ISA942_IU1_K1_LBSPPA0_LBSPPB512_LBSPPM0_LPA0_LPB16_LPM0_LRVW16_LWPMn1_MIAV0_MIWT1_4_MO40_NTn1_NTA0_NTB0_NTC0_NTD4_NTM0_NEPBS8_NLCA1_NLCB1_ONLL1_PGR2_PLR1_PKA1_SIA3_SS1_SU0_SUM1_SUS0_SPO0_SRVW0_SSO0_SVW1_SK0_SKXCCM0_TLDS1_ULSGRO0_USL1_UIOFGRO0_USFGROn1_VSn1_VWA1_VWB4_WSGRA0_WSGRB0_WS64_WG32_2_4_WGM1_WGMXCC4_WGMXCCGn1
    SolutionIndex: 186
    SolutionNameMin: Cijk_Ailk_Bljk_I8II_BH_UserArgs_MT16x112x256_MI16x16x1_SN_LDSB1_AFC0_AFEM1_AFEM1_ASEM1_CLR1_CADS0_DTVA0_DTVB0_EPS0_FDSI0_GRPM1_GRVWA16_GRVWB16_GSUn1_GSUAMBSK_GSUC1_GSUWGMRR1_GLS0_ISA942_IU1_K1_LBSPPA256_LBSPPB256_LBSPPM0_LPA16_LPB32_LPM0_LRVW16_LWPMn1_MIAV0_MIWT1_7_MO40_NTn1_NTA0_NTB0_NTC0_NTD4_NTM0_NEPBS8_NLCA1_NLCB1_ONLL1_PGR2_PLR1_PKA1_SIA3_SS1_SU0_SUM1_SUS0_SPO0_SRVW0_SSO0_SVW1_SK0_SKXCCM0_TLDS1_ULSGRO0_USL1_UIOFGRO0_USFGROn1_VSn1_VWA1_VWB1_WSGRA0_WSGRB0_WS64_WG16_4_4_WGM1_WGMXCC4_WGMXCCGn1
    SolutionIndex: 187
    SolutionNameMin: Cijk_Ailk_Bljk_I8II_BH_UserArgs_MT64x112x256_MI16x16x1_SN_LDSB1_AFC0_AFEM1_AFEM1_ASEM1_CLR1_CADS0_DTVA0_DTVB0_EPS0_FDSI0_GRPM1_GRVWA16_GRVWB16_GSUn1_GSUAMBSK_GSUC1_GSUWGMRR1_GLS0_ISA942_IU1_K1_LBSPPA1024_LBSPPB256_LBSPPM0_LPA64_LPB32_LPM0_LRVW16_LWPMn1_MIAV0_MIWT4_7_MO40_NTn1_NTA0_NTB0_NTC0_NTD4_NTM0_NEPBS8_NLCA1_NLCB1_ONLL1_PGR2_PLR1_PKA1_SIA3_SS1_SU0_SUM1_SUS0_SPO0_SRVW0_SSO0_SVW4_SK0_SKXCCM0_TLDS1_ULSGRO0_USL1_UIOFGRO0_USFGROn1_VSn1_VWA4_VWB1_WSGRA0_WSGRB0_WS64_WG16_4_4_WGM1_WGMXCC4_WGMXCCGn1
    SolutionIndex: 188
    SolutionNameMin: Cijk_Ailk_Bljk_I8II_BH_UserArgs_MT128x32x128_MI16x16x1_SN_LDSB0_AFC0_AFEM1_AFEM1_ASEM1_CLR1_CADS0_DTVA0_DTVB0_EPS0_FDSI0_GRPM1_GRVWA16_GRVWB16_GSUn1_GSUAMBSK_GSUC1_GSUWGMRR1_GLS0_ISA942_IU1_K1_LBSPPA2048_LBSPPB256_LBSPPM0_LPA32_LPB32_LPM0_LRVW16_LWPMn1_MIAV0_MIWT2_2_MO40_NTn1_NTA0_NTB0_NTC0_NTD4_NTM0_NEPBS8_NLCA1_NLCB1_ONLL1_PGR2_PLR1_PKA1_SIA3_SS1_SU0_SUM1_SUS0_SPO0_SRVW0_SSO0_SVW2_SK0_SKXCCM0_TLDS1_ULSGRO0_USL1_UIOFGRO0_USFGROn1_VSn1_VWA2_VWB2_WSGRA0_WSGRB0_WS64_WG64_4_1_WGM1_WGMXCC4_WGMXCCGn1
    SolutionIndex: 189
    SolutionNameMin: Cijk_Ailk_Bljk_I8II_BH_UserArgs_MT128x160x128_MI16x16x1_SN_LDSB1_AFC0_AFEM1_AFEM1_ASEM1_CLR1_CADS0_DTVA0_DTVB0_EPS0_FDSI0_GRPM1_GRVWA16_GRVWB16_GSUn1_GSUAMBSK_GSUC1_GSUWGMRR1_GLS0_ISA942_IU1_K1_LBSPPA2048_LBSPPB128_LBSPPM0_LPA64_LPB32_LPM0_LRVW16_LWPMn1_MIAV0_MIWT4_5_MO40_NTn1_NTA0_NTB0_NTC0_NTD4_NTM0_NEPBS8_NLCA1_NLCB1_ONLL1_PGR2_PLR1_PKA1_SIA3_SS1_SU0_SUM1_SUS0_SPO0_SRVW0_SSO0_SVW4_SK0_SKXCCM0_TLDS1_ULSGRO0_USL1_UIOFGRO0_USFGROn1_VSn1_VWA4_VWB1_WSGRA0_WSGRB0_WS64_WG32_8_1_WGM1_WGMXCC4_WGMXCCGn1
    SolutionIndex: 190
    SolutionNameMin: Cijk_Ailk_Bljk_I8II_BH_UserArgs_MT64x160x128_MI16x16x1_SN_LDSB1_AFC0_AFEM1_AFEM1_ASEM1_CLR1_CADS0_DTVA0_DTVB0_EPS0_FDSI0_GRPM1_GRVWA16_GRVWB16_GSUn1_GSUAMBSK_GSUC1_GSUWGMRR1_GLS0_ISA942_IU1_K1_LBSPPA1024_LBSPPB128_LBSPPM0_LPA32_LPB32_LPM0_LRVW16_LWPMn1_MIAV0_MIWT2_5_MO40_NTn1_NTA0_NTB0_NTC0_NTD4_NTM0_NEPBS8_NLCA1_NLCB1_ONLL1_PGR2_PLR1_PKA1_SIA3_SS1_SU0_SUM1_SUS0_SPO0_SRVW0_SSO0_SVW2_SK0_SKXCCM0_TLDS1_ULSGRO0_USL1_UIOFGRO0_USFGROn1_VSn1_VWA2_VWB1_WSGRA0_WSGRB0_WS64_WG32_8_1_WGM1_WGMXCC4_WGMXCCGn1
    SolutionIndex: 191
    SolutionNameMin: Cijk_Ailk_Bljk_I8II_BH_UserArgs_MT256x160x128_MI32x32x1_SN_LDSB1_AFC0_AFEM1_AFEM1_ASEM1_CLR1_CADS0_DTVA0_DTVB0_EPS0_FDSI0_GRPM1_GRVWA16_GRVWB16_GSUn1_GSUAMBSK_GSUC1_GSUWGMRR1_GLS0_ISA942_IU1_K1_LBSPPA0_LBSPPB128_LBSPPM0_LPA0_LPB16_LPM0_LRVW16_LWPMn1_MIAV0_MIWT2_5_MO40_NTn1_NTA0_NTB0_NTC0_NTD4_NTM0_NEPBS8_NLCA1_NLCB1_ONLL1_PGR2_PLR1_PKA1_SIA3_SS1_SU0_SUM1_SUS0_SPO0_SRVW0_SSO0_SVW2_SK0_SKXCCM0_TLDS1_ULSGRO0_USL1_UIOFGRO0_USFGROn1_VSn1_VWA2_VWB1_WSGRA0_WSGRB0_WS64_WG128_2_1_WGM1_WGMXCC4_WGMXCCGn1
    SolutionIndex: 192
    SolutionNameMin: Cijk_Ailk_Bljk_I8II_BH_UserArgs_MT256x160x128_MI16x16x1_SN_LDSB1_AFC0_AFEM1_AFEM1_ASEM1_CLR1_CADS0_DTVA0_DTVB0_EPS0_FDSI0_GRPM1_GRVWA16_GRVWB16_GSUn1_GSUAMBSK_GSUC1_GSUWGMRR1_GLS0_ISA942_IU1_K1_LBSPPA4096_LBSPPB256_LBSPPM0_LPA64_LPB32_LPM0_LRVW16_LWPMn1_MIAV0_MIWT4_10_MO40_NTn1_NTA0_NTB0_NTC0_NTD4_NTM0_NEPBS8_NLCA1_NLCB1_ONLL1_PGR2_PLR1_PKA1_SIA3_SS1_SU0_SUM1_SUS0_SPO0_SRVW0_SSO0_SVW4_SK0_SKXCCM0_TLDS1_ULSGRO0_USL1_UIOFGRO0_USFGROn1_VSn1_VWA4_VWB2_WSGRA0_WSGRB0_WS64_WG64_4_1_WGM1_WGMXCC4_WGMXCCGn1
    SolutionIndex: 193
    SolutionNameMin: Cijk_Ailk_Bljk_I8II_BH_UserArgs_MT256x128x128_MI16x16x1_SN_LDSB1_AFC0_AFEM1_AFEM1_ASEM1_CLR1_CADS0_DTVA0_DTVB0_EPS0_FDSI0_GRPM1_GRVWA16_GRVWB16_GSUn1_GSUAMBSK_GSUC1_GSUWGMRR1_GLS0_ISA942_IU1_K1_LBSPPA4096_LBSPPB1024_LBSPPM0_LPA64_LPB32_LPM0_LRVW16_LWPMn1_MIAV0_MIWT4_8_MO40_NTn1_NTA0_NTB0_NTC0_NTD4_NTM0_NEPBS8_NLCA1_NLCB1_ONLL1_PGR2_PLR1_PKA1_SIA3_SS1_SU0_SUM1_SUS0_SPO0_SRVW0_SSO4_SVW4_SK0_SKXCCM0_TLDS1_ULSGRO0_USL1_UIOFGRO0_USFGROn1_VSn1_VWA4_VWB8_WSGRA0_WSGRB0_WS64_WG64_4_1_WGM1_WGMXCC4_WGMXCCGn1
    SolutionIndex: 194
    SolutionNameMin: Cijk_Ailk_Bljk_I8II_BH_UserArgs_MT128x128x128_MI16x16x1_SN_LDSB1_AFC0_AFEM1_AFEM1_ASEM1_CLR1_CADS0_DTVA0_DTVB0_EPS0_FDSI0_GRPM1_GRVWA16_GRVWB16_GSUn1_GSUAMBSK_GSUC1_GSUWGMRR1_GLS0_ISA942_IU1_K1_LBSPPA2048_LBSPPB512_LBSPPM0_LPA64_LPB32_LPM0_LRVW16_LWPMn1_MIAV0_MIWT4_4_MO40_NTn1_NTA0_NTB0_NTC0_NTD4_NTM0_NEPBS8_NLCA1_NLCB1_ONLL1_PGR2_PLR1_PKA1_SIA3_SS1_SU0_SUM1_SUS0_SPO0_SRVW0_SSO4_SVW4_SK0_SKXCCM0_TLDS1_ULSGRO0_USL1_UIOFGRO0_USFGROn1_VSn1_VWA4_VWB4_WSGRA0_WSGRB0_WS64_WG32_8_1_WGM1_WGMXCC4_WGMXCCGn1
    SolutionIndex: 195
    SolutionNameMin: Cijk_Ailk_Bljk_I8II_BH_UserArgs_MT256x128x128_MI32x32x1_SN_LDSB1_AFC0_AFEM1_AFEM1_ASEM1_CLR1_CADS0_DTVA0_DTVB0_EPS0_FDSI0_GRPM1_GRVWA16_GRVWB16_GSUn1_GSUAMBSK_GSUC1_GSUWGMRR1_GLS0_ISA942_IU1_K1_LBSPPA0_LBSPPB512_LBSPPM0_LPA0_LPB16_LPM0_LRVW16_LWPMn1_MIAV0_MIWT2_4_MO40_NTn1_NTA0_NTB0_NTC0_NTD4_NTM0_NEPBS8_NLCA1_NLCB1_ONLL1_PGR2_PLR1_PKA1_SIA3_SS1_SU0_SUM1_SUS0_SPO0_SRVW0_SSO0_SVW2_SK0_SKXCCM0_TLDS1_ULSGRO0_USL1_UIOFGRO0_USFGROn1_VSn1_VWA2_VWB4_WSGRA0_WSGRB0_WS64_WG128_2_1_WGM1_WGMXCC4_WGMXCCGn1
    SolutionIndex: 196
    SolutionNameMin: Cijk_Ailk_Bljk_I8II_BH_UserArgs_MT256x128x64_MI32x32x1_SN_LDSB1_AFC0_AFEM1_AFEM1_ASEM1_CLR1_CADS0_DTVA0_DTVB0_EPS0_FDSI0_GRPM1_GRVWA16_GRVWB16_GSUn1_GSUAMBSK_GSUC1_GSUWGMRR1_GLS0_ISA942_IU1_K1_LBSPPA0_LBSPPB256_LBSPPM0_LPA0_LPB16_LPM0_LRVW16_LWPMn1_MIAV0_MIWT2_4_MO40_NTn1_NTA0_NTB0_NTC0_NTD4_NTM0_NEPBS8_NLCA1_NLCB1_ONLL1_PGR2_PLR1_PKA1_SIA3_SS1_SU0_SUM1_SUS0_SPO0_SRVW0_SSO0_SVW2_SK0_SKXCCM0_TLDS1_ULSGRO0_USL1_UIOFGRO0_USFGROn1_VSn1_VWA2_VWB4_WSGRA0_WSGRB0_WS64_WG128_2_1_WGM1_WGMXCC4_WGMXCCGn1
    SolutionIndex: 197
    SolutionNameMin: Cijk_Ailk_Bljk_I8II_BH_UserArgs_MT32x128x128_MI16x16x1_SN_LDSB1_AFC0_AFEM1_AFEM1_ASEM1_CLR1_CADS0_DTVA0_DTVB0_EPS0_FDSI0_GRPM1_GRVWA16_GRVWB16_GSUn1_GSUAMBSK_GSUC1_GSUWGMRR1_GLS0_ISA942_IU1_K1_LBSPPA512_LBSPPB512_LBSPPM0_LPA32_LPB32_LPM0_LRVW16_LWPMn1_MIAV0_MIWT2_4_MO40_NTn1_NTA0_NTB0_NTC0_NTD4_NTM0_NEPBS8_NLCA1_NLCB1_ONLL1_PGR2_PLR1_PKA1_SIA3_SS1_SU0_SUM1_SUS0_SPO0_SRVW0_SSO0_SVW2_SK0_SKXCCM0_TLDS1_ULSGRO0_USL1_UIOFGRO0_USFGROn1_VSn1_VWA2_VWB4_WSGRA0_WSGRB0_WS64_WG16_8_2_WGM1_WGMXCC4_WGMXCCGn1
    SolutionIndex: 198
    SolutionNameMin: Cijk_Ailk_Bljk_I8II_BH_UserArgs_MT32x128x256_MI32x32x1_SN_LDSB1_AFC0_AFEM1_AFEM1_ASEM1_CLR1_CADS0_DTVA0_DTVB0_EPS0_FDSI0_GRPM1_GRVWA16_GRVWB16_GSUn1_GSUAMBSK_GSUC1_GSUWGMRR1_GLS0_ISA942_IU1_K1_LBSPPA0_LBSPPB1024_LBSPPM0_LPA0_LPB16_LPM0_LRVW16_LWPMn1_MIAV0_MIWT1_4_MO40_NTn1_NTA0_NTB0_NTC0_NTD4_NTM0_NEPBS8_NLCA1_NLCB1_ONLL1_PGR2_PLR1_PKA1_SIA3_SS1_SU0_SUM1_SUS0_SPO0_SRVW0_SSO0_SVW1_SK0_SKXCCM0_TLDS1_ULSGRO0_USL1_UIOFGRO0_USFGROn1_VSn1_VWA1_VWB4_WSGRA0_WSGRB0_WS64_WG32_2_4_WGM1_WGMXCC4_WGMXCCGn1
    SolutionIndex: 199
    SolutionNameMin: Cijk_Ailk_Bljk_I8II_BH_UserArgs_MT32x128x128_MI32x32x1_SN_LDSB1_AFC0_AFEM1_AFEM1_ASEM1_CLR1_CADS0_DTVA0_DTVB0_EPS0_FDSI0_GRPM1_GRVWA16_GRVWB16_GSUn1_GSUAMBSK_GSUC1_GSUWGMRR1_GLS0_ISA942_IU1_K1_LBSPPA0_LBSPPB512_LBSPPM0_LPA0_LPB16_LPM0_LRVW16_LWPMn1_MIAV0_MIWT1_4_MO40_NTn1_NTA0_NTB0_NTC0_NTD4_NTM0_NEPBS8_NLCA1_NLCB1_ONLL1_PGR2_PLR1_PKA1_SIA3_SS1_SU0_SUM1_SUS0_SPO0_SRVW0_SSO0_SVW1_SK0_SKXCCM0_TLDS1_ULSGRO0_USL1_UIOFGRO0_USFGROn1_VSn1_VWA1_VWB4_WSGRA0_WSGRB0_WS64_WG32_2_4_WGM1_WGMXCC4_WGMXCCGn1
    SolutionIndex: 200
    SolutionNameMin: Cijk_Ailk_Bljk_I8II_BH_UserArgs_MT16x128x256_MI16x16x1_SN_LDSB1_AFC0_AFEM1_AFEM1_ASEM1_CLR1_CADS0_DTVA0_DTVB0_EPS0_FDSI0_GRPM1_GRVWA16_GRVWB16_GSUn1_GSUAMBSK_GSUC1_GSUWGMRR1_GLS0_ISA942_IU1_K1_LBSPPA256_LBSPPB2048_LBSPPM0_LPA16_LPB32_LPM0_LRVW16_LWPMn1_MIAV0_MIWT1_8_MO40_NTn1_NTA0_NTB0_NTC0_NTD4_NTM0_NEPBS8_NLCA1_NLCB1_ONLL1_PGR2_PLR1_PKA1_SIA3_SS1_SU0_SUM1_SUS0_SPO0_SRVW0_SSO0_SVW1_SK0_SKXCCM0_TLDS1_ULSGRO0_USL1_UIOFGRO0_USFGROn1_VSn1_VWA1_VWB8_WSGRA0_WSGRB0_WS64_WG16_4_4_WGM1_WGMXCC4_WGMXCCGn1
    SolutionIndex: 201
    SolutionNameMin: Cijk_Ailk_Bljk_I8II_BH_UserArgs_MT128x64x128_MI32x32x1_SN_LDSB0_AFC0_AFEM1_AFEM1_ASEM1_CLR1_CADS0_DTVA0_DTVB0_EPS0_FDSI0_GRPM1_GRVWA16_GRVWB16_GSUn1_GSUAMBSK_GSUC1_GSUWGMRR1_GLS0_ISA942_IU1_K1_LBSPPA0_LBSPPB256_LBSPPM0_LPA0_LPB16_LPM0_LRVW16_LWPMn1_MIAV0_MIWT1_2_MO40_NTn1_NTA0_NTB0_NTC0_NTD4_NTM0_NEPBS8_NLCA1_NLCB1_ONLL1_PGR2_PLR1_PKA1_SIA3_SS1_SU0_SUM1_SUS0_SPO0_SRVW0_SSO0_SVW1_SK0_SKXCCM0_TLDS1_ULSGRO0_USL1_UIOFGRO0_USFGROn1_VSn1_VWA1_VWB2_WSGRA0_WSGRB0_WS64_WG128_2_1_WGM1_WGMXCC4_WGMXCCGn1
    SolutionIndex: 202
    SolutionNameMin: Cijk_Ailk_Bljk_I8II_BH_UserArgs_MT256x192x64_MI32x32x1_SN_LDSB1_AFC0_AFEM1_AFEM1_ASEM1_CLR1_CADS0_DTVA0_DTVB0_EPS0_FDSI0_GRPM1_GRVWA16_GRVWB16_GSUn1_GSUAMBSK_GSUC1_GSUWGMRR1_GLS0_ISA942_IU1_K1_LBSPPA0_LBSPPB128_LBSPPM0_LPA0_LPB16_LPM0_LRVW16_LWPMn1_MIAV0_MIWT2_6_MO40_NTn1_NTA0_NTB0_NTC0_NTD4_NTM0_NEPBS8_NLCA1_NLCB1_ONLL1_PGR2_PLR1_PKA1_SIA3_SS1_SU0_SUM1_SUS0_SPO0_SRVW0_SSO0_SVW2_SK0_SKXCCM0_TLDS1_ULSGRO0_USL1_UIOFGRO0_USFGROn1_VSn1_VWA2_VWB2_WSGRA0_WSGRB0_WS64_WG128_2_1_WGM1_WGMXCC4_WGMXCCGn1
    SolutionIndex: 203
    SolutionNameMin: Cijk_Ailk_Bljk_I8II_BH_UserArgs_MT192x192x64_MI16x16x1_SN_LDSB1_AFC0_AFEM1_AFEM1_ASEM1_CLR1_CADS0_DTVA0_DTVB0_EPS0_FDSI0_GRPM1_GRVWA16_GRVWB8_GSUn1_GSUAMBSK_GSUC1_GSUWGMRR1_GLS0_ISA942_IU1_K1_LBSPPA1536_LBSPPB128_LBSPPM0_LPA32_LPB16_LPM0_LRVW8_LWPMn1_MIAV0_MIWT6_6_MO40_NTn1_NTA0_NTB0_NTC0_NTD4_NTM0_NEPBS6_NLCA1_NLCB1_ONLL1_PGR2_PLR1_PKA1_SIA3_SS1_SU0_SUM1_SUS0_SPO0_SRVW0_SSO0_SVW2_SK0_SKXCCM0_TLDS1_ULSGRO0_USL1_UIOFGRO0_USFGROn1_VSn1_VWA2_VWB2_WSGRA0_WSGRB0_WS64_WG32_8_1_WGM1_WGMXCC4_WGMXCCGn1
    SolutionIndex: 204
    SolutionNameMin: Cijk_Ailk_Bljk_I8II_BH_UserArgs_MT256x192x128_MI32x32x1_SN_LDSB1_AFC0_AFEM1_AFEM1_ASEM1_CLR1_CADS0_DTVA0_DTVB0_EPS0_FDSI0_GRPM1_GRVWA16_GRVWB16_GSUn1_GSUAMBSK_GSUC1_GSUWGMRR1_GLS0_ISA942_IU1_K1_LBSPPA0_LBSPPB256_LBSPPM0_LPA0_LPB16_LPM0_LRVW16_LWPMn1_MIAV0_MIWT2_6_MO40_NTn1_NTA0_NTB0_NTC0_NTD4_NTM0_NEPBS8_NLCA1_NLCB1_ONLL1_PGR2_PLR1_PKA1_SIA3_SS1_SU0_SUM1_SUS0_SPO0_SRVW0_SSO0_SVW2_SK0_SKXCCM0_TLDS1_ULSGRO0_USL1_UIOFGRO0_USFGROn1_VSn1_VWA2_VWB2_WSGRA0_WSGRB0_WS64_WG128_2_1_WGM1_WGMXCC4_WGMXCCGn1
    SolutionIndex: 205
    SolutionNameMin: Cijk_Ailk_Bljk_I8II_BH_UserArgs_MT512x96x64_MI16x16x1_SN_LDSB1_AFC0_AFEM1_AFEM1_ASEM1_CLR1_CADS0_DTVA0_DTVB0_EPS0_FDSI0_GRPM1_GRVWA16_GRVWB8_GSUn1_GSUAMBSK_GSUC1_GSUWGMRR1_GLS0_ISA942_IU1_K1_LBSPPA4096_LBSPPB128_LBSPPM0_LPA64_LPB8_LPM0_LRVW8_LWPMn1_MIAV0_MIWT8_6_MO40_NTn1_NTA0_NTB0_NTC0_NTD4_NTM0_NEPBS8_NLCA1_NLCB1_ONLL1_PGR2_PLR1_PKA1_SIA3_SS1_SU0_SUM1_SUS0_SPO0_SRVW0_SSO0_SVW8_SK0_SKXCCM0_TLDS1_ULSGRO0_USL1_UIOFGRO0_USFGROn1_VSn1_VWA8_VWB2_WSGRA0_WSGRB0_WS64_WG64_4_1_WGM1_WGMXCC4_WGMXCCGn1
    SolutionIndex: 206
    SolutionNameMin: Cijk_Ailk_Bljk_I8II_BH_UserArgs_MT64x160x128_MI16x16x1_SN_LDSB1_AFC0_AFEM1_AFEM1_ASEM1_CLR1_CADS0_DTVA0_DTVB0_EPS0_FDSI0_GRPM1_GRVWA16_GRVWB16_GSUn1_GSUAMBSK_GSUC1_GSUWGMRR1_GLS0_ISA942_IU1_K1_LBSPPA1024_LBSPPB128_LBSPPM0_LPA32_LPB32_LPM0_LRVW16_LWPMn1_MIAV0_MIWT2_5_MO40_NTn1_NTA0_NTB0_NTC0_NTD4_NTM0_NEPBS8_NLCA1_NLCB1_ONLL1_PGR2_PLR1_PKA1_SIA3_SS1_SU0_SUM1_SUS0_SPO0_SRVW0_SSO4_SVW2_SK0_SKXCCM0_TLDS1_ULSGRO0_USL1_UIOFGRO0_USFGROn1_VSn1_VWA2_VWB1_WSGRA0_WSGRB0_WS64_WG32_8_1_WGM1_WGMXCC4_WGMXCCGn1
    SolutionIndex: 207
    SolutionNameMin: Cijk_Ailk_Bljk_I8II_BH_UserArgs_MT256x192x64_MI32x32x1_SN_LDSB1_AFC0_AFEM1_AFEM1_ASEM1_CLR1_CADS0_DTVA0_DTVB0_EPS0_FDSI0_GRPM1_GRVWA16_GRVWB16_GSUn1_GSUAMBSK_GSUC1_GSUWGMRR1_GLS0_ISA942_IU1_K1_LBSPPA0_LBSPPB128_LBSPPM0_LPA0_LPB16_LPM0_LRVW16_LWPMn1_MIAV0_MIWT2_6_MO40_NTn1_NTA0_NTB0_NTC0_NTD4_NTM0_NEPBS8_NLCA1_NLCB1_ONLL1_PGR2_PLR1_PKA1_SIA3_SS1_SU0_SUM1_SUS0_SPO0_SRVW0_SSO4_SVW2_SK0_SKXCCM0_TLDS1_ULSGRO0_USL1_UIOFGRO0_USFGROn1_VSn1_VWA2_VWB2_WSGRA0_WSGRB0_WS64_WG128_2_1_WGM1_WGMXCC4_WGMXCCGn1
    SolutionIndex: 208
    SolutionNameMin: Cijk_Ailk_Bljk_I8II_BH_UserArgs_MT256x192x128_MI32x32x1_SN_LDSB1_AFC0_AFEM1_AFEM1_ASEM1_CLR1_CADS0_DTVA0_DTVB0_EPS0_FDSI0_GRPM1_GRVWA16_GRVWB16_GSUn1_GSUAMBSK_GSUC1_GSUWGMRR1_GLS0_ISA942_IU1_K1_LBSPPA0_LBSPPB256_LBSPPM0_LPA0_LPB16_LPM0_LRVW16_LWPMn1_MIAV0_MIWT2_6_MO40_NTn1_NTA0_NTB0_NTC0_NTD4_NTM0_NEPBS8_NLCA1_NLCB1_ONLL1_PGR2_PLR1_PKA1_SIA3_SS1_SU0_SUM1_SUS0_SPO0_SRVW0_SSO4_SVW2_SK0_SKXCCM0_TLDS1_ULSGRO0_USL1_UIOFGRO0_USFGROn1_VSn1_VWA2_VWB2_WSGRA0_WSGRB0_WS64_WG128_2_1_WGM1_WGMXCC4_WGMXCCGn1
    SolutionIndex: 209
    SolutionNameMin: Cijk_Ailk_Bljk_I8II_BH_UserArgs_MT256x160x128_MI32x32x1_SN_LDSB1_AFC0_AFEM1_AFEM1_ASEM1_CLR1_CADS0_DTVA0_DTVB0_EPS0_FDSI0_GRPM1_GRVWA16_GRVWB16_GSUn1_GSUAMBSK_GSUC1_GSUWGMRR1_GLS0_ISA942_IU1_K1_LBSPPA0_LBSPPB128_LBSPPM0_LPA0_LPB16_LPM0_LRVW16_LWPMn1_MIAV0_MIWT2_5_MO40_NTn1_NTA0_NTB0_NTC0_NTD4_NTM0_NEPBS8_NLCA1_NLCB1_ONLL1_PGR2_PLR1_PKA1_SIA3_SS1_SU0_SUM1_SUS0_SPO0_SRVW0_SSO4_SVW2_SK0_SKXCCM0_TLDS1_ULSGRO0_USL1_UIOFGRO0_USFGROn1_VSn1_VWA2_VWB1_WSGRA0_WSGRB0_WS64_WG128_2_1_WGM1_WGMXCC4_WGMXCCGn1
    SolutionIndex: 210
    SolutionNameMin: Cijk_Ailk_Bljk_I8II_BH_UserArgs_MT128x160x128_MI16x16x1_SN_LDSB1_AFC0_AFEM1_AFEM1_ASEM1_CLR1_CADS0_DTVA0_DTVB0_EPS0_FDSI0_GRPM1_GRVWA16_GRVWB16_GSUn1_GSUAMBSK_GSUC1_GSUWGMRR1_GLS0_ISA942_IU1_K1_LBSPPA2048_LBSPPB128_LBSPPM0_LPA64_LPB32_LPM0_LRVW16_LWPMn1_MIAV0_MIWT4_5_MO40_NTn1_NTA0_NTB0_NTC0_NTD4_NTM0_NEPBS8_NLCA1_NLCB1_ONLL1_PGR2_PLR1_PKA1_SIA3_SS1_SU0_SUM1_SUS0_SPO0_SRVW0_SSO4_SVW4_SK0_SKXCCM0_TLDS1_ULSGRO0_USL1_UIOFGRO0_USFGROn1_VSn1_VWA4_VWB1_WSGRA0_WSGRB0_WS64_WG32_8_1_WGM1_WGMXCC4_WGMXCCGn1
    SolutionIndex: 211
    SolutionNameMin: Cijk_Ailk_Bljk_I8II_BH_UserArgs_MT384x160x64_MI16x16x1_SN_LDSB1_AFC0_AFEM1_AFEM1_ASEM1_CLR1_CADS0_DTVA0_DTVB0_EPS0_FDSI0_GRPM1_GRVWA16_GRVWB8_GSUn1_GSUAMBSK_GSUC1_GSUWGMRR1_GLS0_ISA942_IU1_K1_LBSPPA3072_LBSPPB128_LBSPPM0_LPA32_LPB8_LPM0_LRVW8_LWPMn1_MIAV0_MIWT6_10_MO40_NTn1_NTA0_NTB0_NTC0_NTD4_NTM0_NEPBS6_NLCA1_NLCB1_ONLL1_PGR2_PLR1_PKA1_SIA3_SS1_SU0_SUM1_SUS0_SPO0_SRVW0_SSO0_SVW2_SK0_SKXCCM0_TLDS1_ULSGRO0_USL1_UIOFGRO0_USFGROn1_VSn1_VWA2_VWB2_WSGRA0_WSGRB0_WS64_WG64_4_1_WGM1_WGMXCC4_WGMXCCGn1
    SolutionIndex: 212
    SolutionNameMin: Cijk_Ailk_Bljk_I8II_BH_UserArgs_MT32x160x256_MI32x32x1_SN_LDSB1_AFC0_AFEM1_AFEM1_ASEM1_CLR1_CADS0_DTVA0_DTVB0_EPS0_FDSI0_GRPM1_GRVWA16_GRVWB16_GSUn1_GSUAMBSK_GSUC1_GSUWGMRR1_GLS0_ISA942_IU1_K1_LBSPPA0_LBSPPB256_LBSPPM0_LPA0_LPB16_LPM0_LRVW16_LWPMn1_MIAV0_MIWT1_5_MO40_NTn1_NTA0_NTB0_NTC0_NTD4_NTM0_NEPBS8_NLCA1_NLCB1_ONLL1_PGR2_PLR1_PKA1_SIA3_SS1_SU0_SUM1_SUS0_SPO0_SRVW0_SSO0_SVW1_SK0_SKXCCM0_TLDS1_ULSGRO0_USL1_UIOFGRO0_USFGROn1_VSn1_VWA1_VWB1_WSGRA0_WSGRB0_WS64_WG32_2_4_WGM1_WGMXCC4_WGMXCCGn1
    SolutionIndex: 213
    SolutionNameMin: Cijk_Ailk_Bljk_I8II_BH_UserArgs_MT32x160x256_MI16x16x1_SN_LDSB1_AFC0_AFEM1_AFEM1_ASEM1_CLR1_CADS0_DTVA0_DTVB0_EPS0_FDSI0_GRPM1_GRVWA16_GRVWB16_GSUn1_GSUAMBSK_GSUC1_GSUWGMRR1_GLS0_ISA942_IU1_K1_LBSPPA512_LBSPPB512_LBSPPM0_LPA32_LPB32_LPM0_LRVW16_LWPMn1_MIAV0_MIWT2_10_MO40_NTn1_NTA0_NTB0_NTC0_NTD4_NTM0_NEPBS8_NLCA1_NLCB1_ONLL1_PGR2_PLR1_PKA1_SIA3_SS1_SU0_SUM1_SUS0_SPO0_SRVW0_SSO0_SVW2_SK0_SKXCCM0_TLDS1_ULSGRO0_USL1_UIOFGRO0_USFGROn1_VSn1_VWA2_VWB2_WSGRA0_WSGRB0_WS64_WG16_4_4_WGM1_WGMXCC4_WGMXCCGn1
    SolutionIndex: 214
    SolutionNameMin: Cijk_Ailk_Bljk_I8II_BH_UserArgs_MT64x96x128_MI32x32x1_SN_LDSB0_AFC0_AFEM1_AFEM1_ASEM1_CLR1_CADS0_DTVA0_DTVB0_EPS0_FDSI0_GRPM1_GRVWA16_GRVWB16_GSUn1_GSUAMBSK_GSUC1_GSUWGMRR1_GLS0_ISA942_IU1_K1_LBSPPA0_LBSPPB128_LBSPPM0_LPA0_LPB16_LPM0_LRVW16_LWPMn1_MIAV0_MIWT2_3_MO40_NTn1_NTA0_NTB0_NTC0_NTD4_NTM0_NEPBS8_NLCA1_NLCB1_ONLL1_PGR2_PLR1_PKA1_SIA3_SS1_SU0_SUM1_SUS0_SPO0_SRVW0_SSO0_SVW2_SK0_SKXCCM0_TLDS1_ULSGRO0_USL1_UIOFGRO0_USFGROn1_VSn1_VWA2_VWB1_WSGRA0_WSGRB0_WS64_WG32_2_4_WGM1_WGMXCC4_WGMXCCGn1
    SolutionIndex: 215
    SolutionNameMin: Cijk_Ailk_Bljk_I8II_BH_UserArgs_MT64x32x256_MI16x16x1_SN_LDSB1_AFC0_AFEM1_AFEM1_ASEM1_CLR1_CADS0_DTVA0_DTVB0_EPS0_FDSI0_GRPM1_GRVWA16_GRVWB16_GSUn1_GSUAMBSK_GSUC1_GSUWGMRR1_GLS0_ISA942_IU1_K1_LBSPPA1024_LBSPPB512_LBSPPM0_LPA64_LPB32_LPM0_LRVW16_LWPMn1_MIAV0_MIWT4_2_MO40_NTn1_NTA0_NTB0_NTC0_NTD4_NTM0_NEPBS8_NLCA1_NLCB1_ONLL1_PGR2_PLR1_PKA1_SIA3_SS1_SU0_SUM1_SUS0_SPO0_SRVW0_SSO0_SVW4_SK0_SKXCCM0_TLDS1_ULSGRO0_USL1_UIOFGRO0_USFGROn1_VSn1_VWA4_VWB2_WSGRA0_WSGRB0_WS64_WG16_4_4_WGM1_WGMXCC4_WGMXCCGn1
    SolutionIndex: 216
    SolutionNameMin: Cijk_Ailk_Bljk_I8II_BH_UserArgs_MT64x160x128_MI16x16x1_SN_LDSB0_AFC0_AFEM1_AFEM1_ASEM1_CLR1_CADS0_DTVA0_DTVB0_EPS0_FDSI0_GRPM1_GRVWA16_GRVWB16_GSUn1_GSUAMBSK_GSUC1_GSUWGMRR1_GLS0_ISA942_IU1_K1_LBSPPA1024_LBSPPB256_LBSPPM0_LPA32_LPB32_LPM0_LRVW16_LWPMn1_MIAV0_MIWT2_10_MO40_NTn1_NTA0_NTB0_NTC0_NTD4_NTM0_NEPBS8_NLCA1_NLCB1_ONLL1_PGR2_PLR1_PKA1_SIA3_SS1_SU0_SUM1_SUS0_SPO0_SRVW0_SSO0_SVW2_SK0_SKXCCM0_TLDS1_ULSGRO0_USL1_UIOFGRO0_USFGROn1_VSn1_VWA2_VWB2_WSGRA0_WSGRB0_WS64_WG32_4_2_WGM1_WGMXCC4_WGMXCCGn1
    SolutionIndex: 217
    SolutionNameMin: Cijk_Ailk_Bljk_I8II_BH_UserArgs_MT64x64x128_MI32x32x1_SN_LDSB1_AFC0_AFEM1_AFEM1_ASEM1_CLR1_CADS0_DTVA0_DTVB0_EPS0_FDSI0_GRPM1_GRVWA16_GRVWB16_GSUn1_GSUAMBSK_GSUC1_GSUWGMRR1_GLS0_ISA942_IU1_K1_LBSPPA0_LBSPPB256_LBSPPM0_LPA0_LPB16_LPM0_LRVW16_LWPMn1_MIAV0_MIWT2_2_MO40_NTn1_NTA0_NTB0_NTC0_NTD4_NTM0_NEPBS8_NLCA1_NLCB1_ONLL1_PGR2_PLR1_PKA1_SIA3_SS1_SU0_SUM1_SUS0_SPO0_SRVW0_SSO0_SVW2_SK0_SKXCCM0_TLDS1_ULSGRO0_USL1_UIOFGRO0_USFGROn1_VSn1_VWA2_VWB2_WSGRA0_WSGRB0_WS64_WG32_2_4_WGM1_WGMXCC4_WGMXCCGn1
    SolutionIndex: 218
    SolutionNameMin: Cijk_Ailk_Bljk_I8II_BH_UserArgs_MT256x224x128_MI16x16x1_SN_LDSB1_AFC0_AFEM1_AFEM1_ASEM1_CLR1_CADS0_DTVA0_DTVB0_EPS0_FDSI0_GRPM1_GRVWA16_GRVWB16_GSUn1_GSUAMBSK_GSUC1_GSUWGMRR1_GLS0_ISA942_IU1_K1_LBSPPA4096_LBSPPB256_LBSPPM0_LPA64_LPB32_LPM0_LRVW16_LWPMn1_MIAV0_MIWT4_14_MO40_NTn1_NTA0_NTB0_NTC0_NTD4_NTM0_NEPBS8_NLCA1_NLCB1_ONLL1_PGR2_PLR1_PKA1_SIA3_SS1_SU0_SUM1_SUS0_SPO0_SRVW0_SSO0_SVW4_SK0_SKXCCM0_TLDS1_ULSGRO0_USL1_UIOFGRO0_USFGROn1_VSn1_VWA4_VWB2_WSGRA0_WSGRB0_WS64_WG64_4_1_WGM1_WGMXCC4_WGMXCCGn1
    SolutionIndex: 219
    SolutionNameMin: Cijk_Ailk_Bljk_I8II_BH_UserArgs_MT256x224x64_MI16x16x1_SN_LDSB1_AFC0_AFEM1_AFEM1_ASEM1_CLR1_CADS0_DTVA0_DTVB0_EPS0_FDSI0_GRPM1_GRVWA16_GRVWB8_GSUn1_GSUAMBSK_GSUC1_GSUWGMRR1_GLS0_ISA942_IU1_K1_LBSPPA2048_LBSPPB128_LBSPPM0_LPA64_LPB8_LPM0_LRVW8_LWPMn1_MIAV0_MIWT4_14_MO40_NTn1_NTA0_NTB0_NTC0_NTD4_NTM0_NEPBS8_NLCA1_NLCB1_ONLL1_PGR2_PLR1_PKA1_SIA3_SS1_SU0_SUM1_SUS0_SPO0_SRVW0_SSO0_SVW4_SK0_SKXCCM0_TLDS1_ULSGRO0_USL1_UIOFGRO0_USFGROn1_VSn1_VWA4_VWB2_WSGRA0_WSGRB0_WS64_WG64_4_1_WGM1_WGMXCC4_WGMXCCGn1
    SolutionIndex: 220
    SolutionNameMin: Cijk_Ailk_Bljk_I8II_BH_UserArgs_MT256x192x128_MI16x16x1_SN_LDSB1_AFC0_AFEM1_AFEM1_ASEM1_CLR1_CADS0_DTVA0_DTVB0_EPS0_FDSI0_GRPM1_GRVWA16_GRVWB16_GSUn1_GSUAMBSK_GSUC1_GSUWGMRR1_GLS0_ISA942_IU1_K1_LBSPPA4096_LBSPPB512_LBSPPM0_LPA64_LPB32_LPM0_LRVW16_LWPMn1_MIAV0_MIWT4_12_MO40_NTn1_NTA0_NTB0_NTC0_NTD4_NTM0_NEPBS8_NLCA1_NLCB1_ONLL1_PGR2_PLR1_PKA1_SIA3_SS1_SU0_SUM1_SUS0_SPO0_SRVW0_SSO4_SVW4_SK0_SKXCCM0_TLDS1_ULSGRO0_USL1_UIOFGRO0_USFGROn1_VSn1_VWA4_VWB4_WSGRA0_WSGRB0_WS64_WG64_4_1_WGM1_WGMXCC4_WGMXCCGn1
    SolutionIndex: 221
    SolutionNameMin: Cijk_Ailk_Bljk_I8II_BH_UserArgs_MT16x96x128_MI16x16x1_SN_LDSB1_AFC0_AFEM1_AFEM1_ASEM1_CLR1_CADS0_DTVA0_DTVB0_EPS0_FDSI0_GRPM1_GRVWA1_GRVWB16_GSUn1_GSUAMBSK_GSUC1_GSUWGMRR1_GLS0_ISA942_IU1_K1_LBSPPA256_LBSPPB128_LBSPPM0_LPA16_LPB32_LPM0_LRVW16_LWPMn1_MIAV0_MIWT1_3_MO40_NTn1_NTA0_NTB0_NTC0_NTD4_NTM0_NEPBS8_NLCA1_NLCB1_ONLL1_PGR2_PLR1_PKA1_SIA3_SS1_SU0_SUM1_SUS0_SPO0_SRVW0_SSO0_SVW1_SK0_SKXCCM0_TLDS1_ULSGRO0_USL1_UIOFGRO0_USFGROn1_VSn1_VWA1_VWB1_WSGRA0_WSGRB0_WS64_WG16_8_2_WGM1_WGMXCC4_WGMXCCGn1
    SolutionIndex: 222
    SolutionNameMin: Cijk_Ailk_Bljk_I8II_BH_UserArgs_MT32x192x256_MI16x16x1_SN_LDSB1_AFC0_AFEM1_AFEM1_ASEM1_CLR1_CADS0_DTVA0_DTVB0_EPS0_FDSI0_GRPM1_GRVWA16_GRVWB16_GSUn1_GSUAMBSK_GSUC1_GSUWGMRR1_GLS0_ISA942_IU1_K1_LBSPPA512_LBSPPB1024_LBSPPM0_LPA32_LPB32_LPM0_LRVW16_LWPMn1_MIAV0_MIWT2_12_MO40_NTn1_NTA0_NTB0_NTC0_NTD4_NTM0_NEPBS8_NLCA1_NLCB1_ONLL1_PGR2_PLR1_PKA1_SIA3_SS1_SU0_SUM1_SUS0_SPO0_SRVW0_SSO0_SVW2_SK0_SKXCCM0_TLDS1_ULSGRO0_USL1_UIOFGRO0_USFGROn1_VSn1_VWA2_VWB4_WSGRA0_WSGRB0_WS64_WG16_4_4_WGM1_WGMXCC4_WGMXCCGn1
    SolutionIndex: 223
    SolutionNameMin: Cijk_Ailk_Bljk_I8II_BH_UserArgs_MT32x64x256_MI32x32x1_SN_LDSB1_AFC0_AFEM1_AFEM1_ASEM1_CLR1_CADS0_DTVA0_DTVB0_EPS0_FDSI0_GRPM1_GRVWA16_GRVWB16_GSUn1_GSUAMBSK_GSUC1_GSUWGMRR1_GLS0_ISA942_IU1_K1_LBSPPA0_LBSPPB512_LBSPPM0_LPA0_LPB16_LPM0_LRVW16_LWPMn1_MIAV0_MIWT1_2_MO40_NTn1_NTA0_NTB0_NTC0_NTD4_NTM0_NEPBS8_NLCA1_NLCB1_ONLL1_PGR2_PLR1_PKA1_SIA3_SS1_SU0_SUM1_SUS0_SPO0_SRVW0_SSO0_SVW1_SK0_SKXCCM0_TLDS1_ULSGRO0_USL1_UIOFGRO0_USFGROn1_VSn1_VWA1_VWB2_WSGRA0_WSGRB0_WS64_WG32_2_4_WGM1_WGMXCC4_WGMXCCGn1
    SolutionIndex: 224
    SolutionNameMin: Cijk_Ailk_Bljk_I8II_BH_UserArgs_MT32x96x128_MI32x32x1_SN_LDSB0_AFC0_AFEM1_AFEM1_ASEM1_CLR1_CADS0_DTVA0_DTVB0_EPS0_FDSI0_GRPM1_GRVWA16_GRVWB16_GSUn1_GSUAMBSK_GSUC1_GSUWGMRR1_GLS0_ISA942_IU1_K1_LBSPPA0_LBSPPB128_LBSPPM0_LPA0_LPB16_LPM0_LRVW16_LWPMn1_MIAV0_MIWT1_3_MO40_NTn1_NTA0_NTB0_NTC0_NTD4_NTM0_NEPBS8_NLCA1_NLCB1_ONLL1_PGR2_PLR1_PKA1_SIA3_SS1_SU0_SUM1_SUS0_SPO0_SRVW0_SSO0_SVW1_SK0_SKXCCM0_TLDS1_ULSGRO0_USL1_UIOFGRO0_USFGROn1_VSn1_VWA1_VWB1_WSGRA0_WSGRB0_WS64_WG32_2_4_WGM1_WGMXCC4_WGMXCCGn1
    SolutionIndex: 225
    SolutionNameMin: Cijk_Ailk_Bljk_I8II_BH_UserArgs_MT32x96x128_MI16x16x1_SN_LDSB1_AFC0_AFEM1_AFEM1_ASEM1_CLR1_CADS0_DTVA0_DTVB0_EPS0_FDSI0_GRPM1_GRVWA16_GRVWB16_GSUn1_GSUAMBSK_GSUC1_GSUWGMRR1_GLS0_ISA942_IU1_K1_LBSPPA512_LBSPPB128_LBSPPM0_LPA32_LPB32_LPM0_LRVW16_LWPMn1_MIAV0_MIWT2_3_MO40_NTn1_NTA0_NTB0_NTC0_NTD4_NTM0_NEPBS8_NLCA1_NLCB1_ONLL1_PGR2_PLR1_PKA1_SIA3_SS1_SU0_SUM1_SUS0_SPO0_SRVW0_SSO0_SVW2_SK0_SKXCCM0_TLDS1_ULSGRO0_USL1_UIOFGRO0_USFGROn1_VSn1_VWA2_VWB1_WSGRA0_WSGRB0_WS64_WG16_8_2_WGM1_WGMXCC4_WGMXCCGn1
    SolutionIndex: 226
    SolutionNameMin: Cijk_Ailk_Bljk_I8II_BH_UserArgs_MT128x64x128_MI32x32x1_SN_LDSB0_AFC0_AFEM1_AFEM1_ASEM1_CLR1_CADS0_DTVA0_DTVB0_EPS0_FDSI0_GRPM1_GRVWA16_GRVWB16_GSUn1_GSUAMBSK_GSUC1_GSUWGMRR1_GLS0_ISA942_IU1_K1_LBSPPA0_LBSPPB256_LBSPPM0_LPA0_LPB16_LPM0_LRVW16_LWPMn1_MIAV0_MIWT2_2_MO40_NTn1_NTA0_NTB0_NTC0_NTD4_NTM0_NEPBS8_NLCA1_NLCB1_ONLL1_PGR2_PLR1_PKA1_SIA3_SS1_SU0_SUM1_SUS0_SPO0_SRVW0_SSO0_SVW2_SK0_SKXCCM0_TLDS1_ULSGRO0_USL1_UIOFGRO0_USFGROn1_VSn1_VWA2_VWB2_WSGRA0_WSGRB0_WS64_WG64_2_2_WGM1_WGMXCC4_WGMXCCGn1
    SolutionIndex: 227
    SolutionNameMin: Cijk_Ailk_Bljk_I8II_BH_UserArgs_MT32x32x256_MI16x16x1_SN_LDSB0_AFC0_AFEM1_AFEM1_ASEM1_CLR1_CADS0_DTVA0_DTVB0_EPS0_FDSI0_GRPM1_GRVWA16_GRVWB16_GSUn1_GSUAMBSK_GSUC1_GSUWGMRR1_GLS0_ISA942_IU1_K1_LBSPPA512_LBSPPB256_LBSPPM0_LPA32_LPB32_LPM0_LRVW16_LWPMn1_MIAV0_MIWT2_1_MO40_NTn1_NTA0_NTB0_NTC0_NTD4_NTM0_NEPBS8_NLCA1_NLCB1_ONLL1_PGR2_PLR1_PKA1_SIA3_SS1_SU0_SUM1_SUS0_SPO0_SRVW0_SSO0_SVW2_SK0_SKXCCM0_TLDS1_ULSGRO0_USL1_UIOFGRO0_USFGROn1_VSn1_VWA2_VWB1_WSGRA0_WSGRB0_WS64_WG16_8_2_WGM1_WGMXCC4_WGMXCCGn1
    SolutionIndex: 228
    SolutionNameMin: Cijk_Ailk_Bljk_I8II_BH_UserArgs_MT32x128x128_MI16x16x1_SN_LDSB0_AFC0_AFEM1_AFEM1_ASEM1_CLR1_CADS0_DTVA0_DTVB0_EPS0_FDSI0_GRPM1_GRVWA16_GRVWB16_GSUn1_GSUAMBSK_GSUC1_GSUWGMRR1_GLS0_ISA942_IU1_K1_LBSPPA512_LBSPPB512_LBSPPM0_LPA16_LPB32_LPM0_LRVW16_LWPMn1_MIAV0_MIWT1_4_MO40_NTn1_NTA0_NTB0_NTC0_NTD4_NTM0_NEPBS8_NLCA1_NLCB1_ONLL1_PGR2_PLR1_PKA1_SIA3_SS1_SU0_SUM1_SUS0_SPO0_SRVW0_SSO0_SVW1_SK0_SKXCCM0_TLDS1_ULSGRO0_USL1_UIOFGRO0_USFGROn1_VSn1_VWA1_VWB4_WSGRA0_WSGRB0_WS64_WG32_8_1_WGM1_WGMXCC4_WGMXCCGn1
    SolutionIndex: 229
    SolutionNameMin: Cijk_Ailk_Bljk_I8II_BH_UserArgs_MT64x128x128_MI16x16x1_SN_LDSB0_AFC0_AFEM1_AFEM1_ASEM1_CLR1_CADS0_DTVA0_DTVB0_EPS0_FDSI0_GRPM1_GRVWA16_GRVWB16_GSUn1_GSUAMBSK_GSUC1_GSUWGMRR1_GLS0_ISA942_IU1_K1_LBSPPA1024_LBSPPB512_LBSPPM0_LPA32_LPB32_LPM0_LRVW16_LWPMn1_MIAV0_MIWT2_4_MO40_NTn1_NTA0_NTB0_NTC0_NTD4_NTM0_NEPBS8_NLCA1_NLCB1_ONLL1_PGR2_PLR1_PKA1_SIA3_SS1_SU0_SUM1_SUS0_SPO0_SRVW0_SSO0_SVW2_SK0_SKXCCM0_TLDS1_ULSGRO0_USL1_UIOFGRO0_USFGROn1_VSn1_VWA2_VWB4_WSGRA0_WSGRB0_WS64_WG32_8_1_WGM1_WGMXCC4_WGMXCCGn1
    SolutionIndex: 230
    SolutionNameMin: Cijk_Ailk_Bljk_I8II_BH_UserArgs_MT32x64x256_MI32x32x1_SN_LDSB0_AFC0_AFEM1_AFEM1_ASEM1_CLR1_CADS0_DTVA0_DTVB0_EPS0_FDSI0_GRPM1_GRVWA16_GRVWB16_GSUn1_GSUAMBSK_GSUC1_GSUWGMRR1_GLS0_ISA942_IU1_K1_LBSPPA0_LBSPPB512_LBSPPM0_LPA0_LPB16_LPM0_LRVW16_LWPMn1_MIAV0_MIWT1_2_MO40_NTn1_NTA0_NTB0_NTC0_NTD4_NTM0_NEPBS8_NLCA1_NLCB1_ONLL1_PGR2_PLR1_PKA1_SIA3_SS1_SU0_SUM1_SUS0_SPO0_SRVW0_SSO0_SVW1_SK0_SKXCCM0_TLDS1_ULSGRO0_USL1_UIOFGRO0_USFGROn1_VSn1_VWA1_VWB2_WSGRA0_WSGRB0_WS64_WG32_2_4_WGM1_WGMXCC4_WGMXCCGn1
    SolutionIndex: 231
    SolutionNameMin: Cijk_Ailk_Bljk_I8II_BH_UserArgs_MT64x80x256_MI16x16x1_SN_LDSB1_AFC0_AFEM1_AFEM1_ASEM1_CLR1_CADS0_DTVA0_DTVB0_EPS0_FDSI0_GRPM1_GRVWA16_GRVWB16_GSUn1_GSUAMBSK_GSUC1_GSUWGMRR1_GLS0_ISA942_IU1_K1_LBSPPA1024_LBSPPB256_LBSPPM0_LPA32_LPB32_LPM0_LRVW16_LWPMn1_MIAV0_MIWT2_5_MO40_NTn1_NTA0_NTB0_NTC0_NTD4_NTM0_NEPBS8_NLCA1_NLCB1_ONLL1_PGR2_PLR1_PKA1_SIA3_SS1_SU0_SUM1_SUS0_SPO0_SRVW0_SSO0_SVW2_SK0_SKXCCM0_TLDS1_ULSGRO0_USL1_UIOFGRO0_USFGROn1_VSn1_VWA2_VWB1_WSGRA0_WSGRB0_WS64_WG32_4_2_WGM1_WGMXCC4_WGMXCCGn1
    SolutionIndex: 232
    SolutionNameMin: Cijk_Ailk_Bljk_I8II_BH_UserArgs_MT64x48x512_MI16x16x1_SN_LDSB1_AFC0_AFEM1_AFEM1_ASEM1_CLR1_CADS0_DTVA0_DTVB0_EPS0_FDSI0_GRPM1_GRVWA16_GRVWB16_GSUn1_GSUAMBSK_GSUC1_GSUWGMRR1_GLS0_ISA942_IU1_K1_LBSPPA1024_LBSPPB512_LBSPPM0_LPA32_LPB32_LPM0_LRVW16_LWPMn1_MIAV0_MIWT2_3_MO40_NTn1_NTA0_NTB0_NTC0_NTD4_NTM0_NEPBS8_NLCA1_NLCB1_ONLL1_PGR2_PLR1_PKA1_SIA3_SS1_SU0_SUM1_SUS0_SPO0_SRVW0_SSO0_SVW2_SK0_SKXCCM0_TLDS1_ULSGRO0_USL1_UIOFGRO0_USFGROn1_VSn1_VWA2_VWB1_WSGRA0_WSGRB0_WS64_WG32_4_2_WGM1_WGMXCC4_WGMXCCGn1
    SolutionIndex: 233
    SolutionNameMin: Cijk_Ailk_Bljk_I8II_BH_UserArgs_MT128x80x256_MI16x16x1_SN_LDSB1_AFC0_AFEM1_AFEM1_ASEM1_CLR1_CADS0_DTVA0_DTVB0_EPS0_FDSI0_GRPM1_GRVWA16_GRVWB16_GSUn1_GSUAMBSK_GSUC1_GSUWGMRR1_GLS0_ISA942_IU1_K1_LBSPPA2048_LBSPPB256_LBSPPM0_LPA64_LPB32_LPM0_LRVW16_LWPMn1_MIAV0_MIWT4_5_MO40_NTn1_NTA0_NTB0_NTC0_NTD4_NTM0_NEPBS8_NLCA1_NLCB1_ONLL1_PGR2_PLR1_PKA1_SIA3_SS1_SU0_SUM1_SUS0_SPO0_SRVW0_SSO0_SVW4_SK0_SKXCCM0_TLDS1_ULSGRO0_USL1_UIOFGRO0_USFGROn1_VSn1_VWA4_VWB1_WSGRA0_WSGRB0_WS64_WG32_4_2_WGM1_WGMXCC4_WGMXCCGn1
    SolutionIndex: 234
    SolutionNameMin: Cijk_Ailk_Bljk_I8II_BH_UserArgs_MT64x48x256_MI16x16x1_SN_LDSB0_AFC0_AFEM1_AFEM1_ASEM1_CLR1_CADS0_DTVA0_DTVB0_EPS0_FDSI0_GRPM1_GRVWA16_GRVWB16_GSUn1_GSUAMBSK_GSUC1_GSUWGMRR1_GLS0_ISA942_IU1_K1_LBSPPA1024_LBSPPB256_LBSPPM0_LPA32_LPB32_LPM0_LRVW16_LWPMn1_MIAV0_MIWT2_3_MO40_NTn1_NTA0_NTB0_NTC0_NTD4_NTM0_NEPBS8_NLCA1_NLCB1_ONLL1_PGR2_PLR1_PKA1_SIA3_SS1_SU0_SUM1_SUS0_SPO0_SRVW0_SSO0_SVW2_SK0_SKXCCM0_TLDS1_ULSGRO0_USL1_UIOFGRO0_USFGROn1_VSn1_VWA2_VWB1_WSGRA0_WSGRB0_WS64_WG32_4_2_WGM1_WGMXCC4_WGMXCCGn1
    SolutionIndex: 235
    SolutionNameMin: Cijk_Ailk_Bljk_I8II_BH_UserArgs_MT128x96x128_MI32x32x1_SN_LDSB0_AFC0_AFEM1_AFEM1_ASEM1_CLR1_CADS0_DTVA0_DTVB0_EPS0_FDSI0_GRPM1_GRVWA16_GRVWB16_GSUn1_GSUAMBSK_GSUC1_GSUWGMRR1_GLS0_ISA942_IU1_K1_LBSPPA0_LBSPPB128_LBSPPM0_LPA0_LPB16_LPM0_LRVW16_LWPMn1_MIAV0_MIWT2_3_MO40_NTn1_NTA0_NTB0_NTC0_NTD4_NTM0_NEPBS8_NLCA1_NLCB1_ONLL1_PGR2_PLR1_PKA1_SIA3_SS1_SU0_SUM1_SUS0_SPO0_SRVW0_SSO0_SVW2_SK0_SKXCCM0_TLDS1_ULSGRO0_USL1_UIOFGRO0_USFGROn1_VSn1_VWA2_VWB1_WSGRA0_WSGRB0_WS64_WG64_2_2_WGM1_WGMXCC4_WGMXCCGn1
    SolutionIndex: 236
    SolutionNameMin: Cijk_Ailk_Bljk_I8II_BH_UserArgs_MT192x256x128_MI16x16x1_SN_LDSB1_AFC0_AFEM1_AFEM1_ASEM1_CLR1_CADS0_DTVA0_DTVB0_EPS0_FDSI0_GRPM1_GRVWA16_GRVWB16_GSUn1_GSUAMBSK_GSUC1_GSUWGMRR1_GLS0_ISA942_IU1_K1_LBSPPA3072_LBSPPB1024_LBSPPM0_LPA32_LPB32_LPM0_LRVW16_LWPMn1_MIAV0_MIWT6_8_MO40_NTn1_NTA0_NTB0_NTC0_NTD4_NTM0_NEPBS6_NLCA1_NLCB1_ONLL1_PGR2_PLR1_PKA1_SIA3_SS1_SU0_SUM1_SUS0_SPO0_SRVW0_SSO0_SVW2_SK0_SKXCCM0_TLDS1_ULSGRO0_USL1_UIOFGRO0_USFGROn1_VSn1_VWA2_VWB8_WSGRA0_WSGRB0_WS64_WG32_8_1_WGM1_WGMXCC4_WGMXCCGn1
    SolutionIndex: 237
    SolutionNameMin: Cijk_Ailk_Bljk_I8II_BH_UserArgs_MT128x320x64_MI32x32x1_SN_LDSB1_AFC0_AFEM1_AFEM1_ASEM1_CLR1_CADS0_DTVA0_DTVB0_EPS0_FDSI0_GRPM1_GRVWA16_GRVWB16_GSUn1_GSUAMBSK_GSUC1_GSUWGMRR1_GLS0_ISA942_IU1_K1_LBSPPA0_LBSPPB128_LBSPPM0_LPA0_LPB16_LPM0_LRVW16_LWPMn1_MIAV0_MIWT2_5_MO40_NTn1_NTA0_NTB0_NTC0_NTD4_NTM0_NEPBS8_NLCA1_NLCB1_ONLL1_PGR2_PLR1_PKA1_SIA3_SS1_SU0_SUM1_SUS0_SPO0_SRVW0_SSO0_SVW2_SK0_SKXCCM0_TLDS1_ULSGRO0_USL1_UIOFGRO0_USFGROn1_VSn1_VWA2_VWB1_WSGRA0_WSGRB0_WS64_WG64_4_1_WGM1_WGMXCC4_WGMXCCGn1
    SolutionIndex: 238
    SolutionNameMin: Cijk_Ailk_Bljk_I8II_BH_UserArgs_MT192x320x64_MI32x32x1_SN_LDSB1_AFC0_AFEM1_AFEM1_ASEM1_CLR1_CADS0_DTVA0_DTVB0_EPS0_FDSI0_GRPM1_GRVWA16_GRVWB16_GSUn1_GSUAMBSK_GSUC1_GSUWGMRR1_GLS0_ISA942_IU1_K1_LBSPPA0_LBSPPB128_LBSPPM0_LPA0_LPB16_LPM0_LRVW16_LWPMn1_MIAV0_MIWT3_5_MO40_NTn1_NTA0_NTB0_NTC0_NTD4_NTM0_NEPBS6_NLCA1_NLCB1_ONLL1_PGR2_PLR1_PKA1_SIA3_SS1_SU0_SUM1_SUS0_SPO0_SRVW0_SSO0_SVW1_SK0_SKXCCM0_TLDS1_ULSGRO0_USL1_UIOFGRO0_USFGROn1_VSn1_VWA1_VWB1_WSGRA0_WSGRB0_WS64_WG64_4_1_WGM1_WGMXCC4_WGMXCCGn1
    SolutionIndex: 239
    SolutionNameMin: Cijk_Ailk_Bljk_I8II_BH_UserArgs_MT256x160x64_MI32x32x1_SN_LDSB1_AFC0_AFEM1_AFEM1_ASEM1_CLR1_CADS0_DTVA0_DTVB0_EPS0_FDSI0_GRPM1_GRVWA16_GRVWB8_GSUn1_GSUAMBSK_GSUC1_GSUWGMRR1_GLS0_ISA942_IU1_K1_LBSPPA0_LBSPPB128_LBSPPM0_LPA0_LPB16_LPM0_LRVW16_LWPMn1_MIAV0_MIWT2_5_MO40_NTn1_NTA0_NTB0_NTC0_NTD4_NTM0_NEPBS8_NLCA1_NLCB1_ONLL1_PGR2_PLR1_PKA1_SIA3_SS1_SU0_SUM1_SUS0_SPO0_SRVW0_SSO0_SVW2_SK0_SKXCCM0_TLDS1_ULSGRO0_USL1_UIOFGRO0_USFGROn1_VSn1_VWA2_VWB1_WSGRA0_WSGRB0_WS64_WG128_2_1_WGM1_WGMXCC4_WGMXCCGn1
    SolutionIndex: 240
    SolutionNameMin: Cijk_Ailk_Bljk_I8II_BH_UserArgs_MT256x128x128_MI16x16x1_SN_LDSB1_AFC0_AFEM1_AFEM1_ASEM1_CLR1_CADS0_DTVA0_DTVB0_EPS0_FDSI0_GRPM1_GRVWA16_GRVWB16_GSUn1_GSUAMBSK_GSUC1_GSUWGMRR1_GLS0_ISA942_IU1_K1_LBSPPA4096_LBSPPB1024_LBSPPM0_LPA32_LPB32_LPM0_LRVW16_LWPMn1_MIAV0_MIWT4_8_MO40_NTn1_NTA0_NTB0_NTC0_NTD4_NTM0_NEPBS8_NLCA1_NLCB1_ONLL1_PGR2_PLR1_PKA1_SIA3_SS1_SU0_SUM1_SUS0_SPO0_SRVW0_SSO0_SVW4_SK0_SKXCCM0_TLDS1_ULSGRO0_USL1_UIOFGRO0_USFGROn1_VSn1_VWA4_VWB8_WSGRA0_WSGRB0_WS64_WG64_4_1_WGM1_WGMXCC4_WGMXCCGn1
    SolutionIndex: 241
    SolutionNameMin: Cijk_Ailk_Bljk_I8II_BH_UserArgs_MT256x256x64_MI32x32x1_SN_LDSB1_AFC0_AFEM1_AFEM1_ASEM1_CLR1_CADS0_DTVA0_DTVB0_EPS0_FDSI0_GRPM1_GRVWA16_GRVWB16_GSUn1_GSUAMBSK_GSUC1_GSUWGMRR1_GLS0_ISA942_IU1_K1_LBSPPA0_LBSPPB512_LBSPPM0_LPA0_LPB16_LPM0_LRVW16_LWPMn1_MIAV0_MIWT2_8_MO40_NTn1_NTA0_NTB0_NTC0_NTD4_NTM0_NEPBS8_NLCA1_NLCB1_ONLL1_PGR2_PLR1_PKA1_SIA3_SS1_SU0_SUM1_SUS0_SPO0_SRVW0_SSO0_SVW2_SK0_SKXCCM0_TLDS1_ULSGRO0_USL1_UIOFGRO0_USFGROn1_VSn1_VWA2_VWB8_WSGRA0_WSGRB0_WS64_WG128_2_1_WGM1_WGMXCC4_WGMXCCGn1
    SolutionIndex: 242
    SolutionNameMin: Cijk_Ailk_Bljk_I8II_BH_UserArgs_MT64x64x128_MI16x16x1_SN_LDSB1_AFC0_AFEM1_AFEM1_ASEM1_CLR1_CADS0_DTVA0_DTVB0_EPS0_FDSI0_GRPM1_GRVWA16_GRVWB16_GSUn1_GSUAMBSK_GSUC1_GSUWGMRR1_GLS0_ISA942_IU1_K1_LBSPPA1024_LBSPPB512_LBSPPM0_LPA16_LPB32_LPM0_LRVW16_LWPMn1_MIAV0_MIWT1_4_MO40_NTn1_NTA0_NTB0_NTC0_NTD4_NTM0_NEPBS8_NLCA1_NLCB1_ONLL1_PGR2_PLR1_PKA1_SIA3_SS1_SU0_SUM1_SUS0_SPO0_SRVW0_SSO4_SVW1_SK0_SKXCCM0_TLDS1_ULSGRO0_USL1_UIOFGRO0_USFGROn1_VSn1_VWA1_VWB4_WSGRA0_WSGRB0_WS64_WG64_4_1_WGM1_WGMXCC4_WGMXCCGn1
    SolutionIndex: 243
    SolutionNameMin: Cijk_Ailk_Bljk_I8II_BH_UserArgs_MT128x80x128_MI16x16x1_SN_LDSB1_AFC0_AFEM1_AFEM1_ASEM1_CLR1_CADS0_DTVA0_DTVB0_EPS0_FDSI0_GRPM1_GRVWA16_GRVWB8_GSUn1_GSUAMBSK_GSUC1_GSUWGMRR1_GLS0_ISA942_IU1_K1_LBSPPA2048_LBSPPB128_LBSPPM0_LPA32_LPB32_LPM0_LRVW16_LWPMn1_MIAV0_MIWT2_5_MO40_NTn1_NTA0_NTB0_NTC0_NTD4_NTM0_NEPBS8_NLCA1_NLCB1_ONLL1_PGR2_PLR1_PKA1_SIA3_SS1_SU0_SUM1_SUS0_SPO0_SRVW0_SSO4_SVW2_SK0_SKXCCM0_TLDS1_ULSGRO0_USL1_UIOFGRO0_USFGROn1_VSn1_VWA2_VWB1_WSGRA0_WSGRB0_WS64_WG64_4_1_WGM1_WGMXCC4_WGMXCCGn1
    SolutionIndex: 244
    SolutionNameMin: Cijk_Ailk_Bljk_I8II_BH_UserArgs_MT192x128x128_MI16x16x1_SN_LDSB1_AFC0_AFEM1_AFEM1_ASEM1_CLR1_CADS0_DTVA0_DTVB0_EPS0_FDSI0_GRPM1_GRVWA16_GRVWB16_GSUn1_GSUAMBSK_GSUC1_GSUWGMRR1_GLS0_ISA942_IU1_K1_LBSPPA3072_LBSPPB1024_LBSPPM0_LPA16_LPB32_LPM0_LRVW16_LWPMn1_MIAV0_MIWT3_8_MO40_NTn1_NTA0_NTB0_NTC0_NTD4_NTM0_NEPBS6_NLCA1_NLCB1_ONLL1_PGR2_PLR1_PKA1_SIA3_SS1_SU0_SUM1_SUS0_SPO0_SRVW0_SSO4_SVW1_SK0_SKXCCM0_TLDS1_ULSGRO0_USL1_UIOFGRO0_USFGROn1_VSn1_VWA1_VWB8_WSGRA0_WSGRB0_WS64_WG64_4_1_WGM1_WGMXCC4_WGMXCCGn1
    SolutionIndex: 245
    SolutionNameMin: Cijk_Ailk_Bljk_I8II_BH_UserArgs_MT192x128x128_MI16x16x1_SN_LDSB1_AFC0_AFEM1_AFEM1_ASEM1_CLR1_CADS0_DTVA0_DTVB0_EPS0_FDSI0_GRPM1_GRVWA16_GRVWB16_GSUn1_GSUAMBSK_GSUC1_GSUWGMRR1_GLS0_ISA942_IU1_K1_LBSPPA3072_LBSPPB512_LBSPPM0_LPA32_LPB32_LPM0_LRVW16_LWPMn1_MIAV0_MIWT6_4_MO40_NTn1_NTA0_NTB0_NTC0_NTD4_NTM0_NEPBS6_NLCA1_NLCB1_ONLL1_PGR2_PLR1_PKA1_SIA3_SS1_SU0_SUM1_SUS0_SPO0_SRVW0_SSO4_SVW2_SK0_SKXCCM0_TLDS1_ULSGRO0_USL1_UIOFGRO0_USFGROn1_VSn1_VWA2_VWB4_WSGRA0_WSGRB0_WS64_WG32_8_1_WGM1_WGMXCC4_WGMXCCGn1
    SolutionIndex: 246
    SolutionNameMin: Cijk_Ailk_Bljk_I8II_BH_UserArgs_MT128x80x64_MI16x16x1_SN_LDSB1_AFC0_AFEM1_AFEM1_ASEM1_CLR1_CADS0_DTVA0_DTVB0_EPS0_FDSI0_GRPM1_GRVWA16_GRVWB4_GSUn1_GSUAMBSK_GSUC1_GSUWGMRR1_GLS0_ISA942_IU1_K1_LBSPPA1024_LBSPPB128_LBSPPM0_LPA32_LPB8_LPM0_LRVW8_LWPMn1_MIAV0_MIWT2_5_MO40_NTn1_NTA0_NTB0_NTC0_NTD4_NTM0_NEPBS8_NLCA1_NLCB1_ONLL1_PGR2_PLR1_PKA1_SIA3_SS1_SU0_SUM1_SUS0_SPO0_SRVW0_SSO4_SVW2_SK0_SKXCCM0_TLDS1_ULSGRO0_USL1_UIOFGRO0_USFGROn1_VSn1_VWA2_VWB1_WSGRA0_WSGRB0_WS64_WG64_4_1_WGM1_WGMXCC4_WGMXCCGn1
    SolutionIndex: 247
    SolutionNameMin: Cijk_Ailk_Bljk_I8II_BH_UserArgs_MT16x128x128_MI16x16x1_SN_LDSB1_AFC0_AFEM1_AFEM1_ASEM1_CLR1_CADS0_DTVA0_DTVB0_EPS0_FDSI0_GRPM1_GRVWA1_GRVWB16_GSUn1_GSUAMBSK_GSUC1_GSUWGMRR1_GLS0_ISA942_IU1_K1_LBSPPA256_LBSPPB512_LBSPPM0_LPA16_LPB32_LPM0_LRVW16_LWPMn1_MIAV0_MIWT1_4_MO40_NTn1_NTA0_NTB0_NTC0_NTD4_NTM0_NEPBS8_NLCA1_NLCB1_ONLL1_PGR2_PLR1_PKA1_SIA3_SS1_SU0_SUM1_SUS0_SPO0_SRVW0_SSO0_SVW1_SK0_SKXCCM0_TLDS1_ULSGRO0_USL1_UIOFGRO0_USFGROn1_VSn1_VWA1_VWB4_WSGRA0_WSGRB0_WS64_WG16_8_2_WGM1_WGMXCC4_WGMXCCGn1
    SolutionIndex: 248
    SolutionNameMin: Cijk_Ailk_Bljk_I8II_BH_UserArgs_MT32x160x128_MI16x16x1_SN_LDSB0_AFC0_AFEM1_AFEM1_ASEM1_CLR1_CADS0_DTVA0_DTVB0_EPS0_FDSI0_GRPM1_GRVWA16_GRVWB16_GSUn1_GSUAMBSK_GSUC1_GSUWGMRR1_GLS0_ISA942_IU1_K1_LBSPPA512_LBSPPB128_LBSPPM0_LPA32_LPB32_LPM0_LRVW16_LWPMn1_MIAV0_MIWT2_5_MO40_NTn1_NTA0_NTB0_NTC0_NTD4_NTM0_NEPBS8_NLCA1_NLCB1_ONLL1_PGR2_PLR1_PKA1_SIA3_SS1_SU0_SUM1_SUS0_SPO0_SRVW0_SSO0_SVW2_SK0_SKXCCM0_TLDS1_ULSGRO0_USL1_UIOFGRO0_USFGROn1_VSn1_VWA2_VWB1_WSGRA0_WSGRB0_WS64_WG16_8_2_WGM1_WGMXCC4_WGMXCCGn1
    SolutionIndex: 249
    SolutionNameMin: Cijk_Ailk_Bljk_I8II_BH_UserArgs_MT16x80x256_MI16x16x1_SN_LDSB1_AFC0_AFEM1_AFEM1_ASEM1_CLR1_CADS0_DTVA0_DTVB0_EPS0_FDSI0_GRPM1_GRVWA16_GRVWB16_GSUn1_GSUAMBSK_GSUC1_GSUWGMRR1_GLS0_ISA942_IU1_K1_LBSPPA256_LBSPPB256_LBSPPM0_LPA16_LPB32_LPM0_LRVW16_LWPMn1_MIAV0_MIWT1_5_MO40_NTn1_NTA0_NTB0_NTC0_NTD4_NTM0_NEPBS8_NLCA1_NLCB1_ONLL1_PGR2_PLR1_PKA1_SIA3_SS1_SU0_SUM1_SUS0_SPO0_SRVW0_SSO0_SVW1_SK0_SKXCCM0_TLDS1_ULSGRO0_USL1_UIOFGRO0_USFGROn1_VSn1_VWA1_VWB1_WSGRA0_WSGRB0_WS64_WG16_4_4_WGM1_WGMXCC4_WGMXCCGn1
    SolutionIndex: 250
    SolutionNameMin: Cijk_Ailk_Bljk_I8II_BH_UserArgs_MT32x64x128_MI32x32x1_SN_LDSB0_AFC0_AFEM1_AFEM1_ASEM1_CLR1_CADS0_DTVA0_DTVB0_EPS0_FDSI0_GRPM1_GRVWA16_GRVWB16_GSUn1_GSUAMBSK_GSUC1_GSUWGMRR1_GLS0_ISA942_IU1_K1_LBSPPA0_LBSPPB256_LBSPPM0_LPA0_LPB16_LPM0_LRVW16_LWPMn1_MIAV0_MIWT1_2_MO40_NTn1_NTA0_NTB0_NTC0_NTD4_NTM0_NEPBS8_NLCA1_NLCB1_ONLL1_PGR2_PLR1_PKA1_SIA3_SS1_SU0_SUM1_SUS0_SPO0_SRVW0_SSO0_SVW1_SK0_SKXCCM0_TLDS1_ULSGRO0_USL1_UIOFGRO0_USFGROn1_VSn1_VWA1_VWB2_WSGRA0_WSGRB0_WS64_WG32_2_4_WGM1_WGMXCC4_WGMXCCGn1
    SolutionIndex: 251
    SolutionNameMin: Cijk_Ailk_Bljk_I8II_BH_UserArgs_MT64x128x128_MI32x32x1_SN_LDSB0_AFC0_AFEM1_AFEM1_ASEM1_CLR1_CADS0_DTVA0_DTVB0_EPS0_FDSI0_GRPM1_GRVWA16_GRVWB16_GSUn1_GSUAMBSK_GSUC1_GSUWGMRR1_GLS0_ISA942_IU1_K1_LBSPPA0_LBSPPB512_LBSPPM0_LPA0_LPB16_LPM0_LRVW16_LWPMn1_MIAV0_MIWT1_4_MO40_NTn1_NTA0_NTB0_NTC0_NTD4_NTM0_NEPBS8_NLCA1_NLCB1_ONLL1_PGR2_PLR1_PKA1_SIA3_SS1_SU0_SUM1_SUS0_SPO0_SRVW0_SSO0_SVW1_SK0_SKXCCM0_TLDS1_ULSGRO0_USL1_UIOFGRO0_USFGROn1_VSn1_VWA1_VWB4_WSGRA0_WSGRB0_WS64_WG64_2_2_WGM1_WGMXCC4_WGMXCCGn1
    SolutionIndex: 252
    SolutionNameMin: Cijk_Ailk_Bljk_I8II_BH_UserArgs_MT64x128x128_MI32x32x1_SN_LDSB0_AFC0_AFEM1_AFEM1_ASEM1_CLR1_CADS0_DTVA0_DTVB0_EPS0_FDSI0_GRPM1_GRVWA16_GRVWB16_GSUn1_GSUAMBSK_GSUC1_GSUWGMRR1_GLS0_ISA942_IU1_K1_LBSPPA0_LBSPPB256_LBSPPM0_LPA0_LPB16_LPM0_LRVW16_LWPMn1_MIAV0_MIWT2_2_MO40_NTn1_NTA0_NTB0_NTC0_NTD4_NTM0_NEPBS8_NLCA1_NLCB1_ONLL1_PGR2_PLR1_PKA1_SIA3_SS1_SU0_SUM1_SUS0_SPO0_SRVW0_SSO0_SVW2_SK0_SKXCCM0_TLDS1_ULSGRO0_USL1_UIOFGRO0_USFGROn1_VSn1_VWA2_VWB2_WSGRA0_WSGRB0_WS64_WG32_4_2_WGM1_WGMXCC4_WGMXCCGn1
    SolutionIndex: 253
    SolutionNameMin: Cijk_Ailk_Bljk_I8II_BH_UserArgs_MT64x160x128_MI32x32x1_SN_LDSB0_AFC0_AFEM1_AFEM1_ASEM1_CLR1_CADS0_DTVA0_DTVB0_EPS0_FDSI0_GRPM1_GRVWA16_GRVWB16_GSUn1_GSUAMBSK_GSUC1_GSUWGMRR1_GLS0_ISA942_IU1_K1_LBSPPA0_LBSPPB128_LBSPPM0_LPA0_LPB16_LPM0_LRVW16_LWPMn1_MIAV0_MIWT1_5_MO40_NTn1_NTA0_NTB0_NTC0_NTD4_NTM0_NEPBS8_NLCA1_NLCB1_ONLL1_PGR2_PLR1_PKA1_SIA3_SS1_SU0_SUM1_SUS0_SPO0_SRVW0_SSO0_SVW1_SK0_SKXCCM0_TLDS1_ULSGRO0_USL1_UIOFGRO0_USFGROn1_VSn1_VWA1_VWB1_WSGRA0_WSGRB0_WS64_WG64_2_2_WGM1_WGMXCC4_WGMXCCGn1
    SolutionIndex: 254
    SolutionNameMin: Cijk_Ailk_Bljk_I8II_BH_UserArgs_MT64x64x256_MI16x16x1_SN_LDSB1_AFC0_AFEM1_AFEM1_ASEM1_CLR1_CADS0_DTVA0_DTVB0_EPS0_FDSI0_GRPM1_GRVWA16_GRVWB16_GSUn1_GSUAMBSK_GSUC1_GSUWGMRR1_GLS0_ISA942_IU1_K1_LBSPPA1024_LBSPPB1024_LBSPPM0_LPA64_LPB32_LPM0_LRVW16_LWPMn1_MIAV0_MIWT4_4_MO40_NTn1_NTA0_NTB0_NTC0_NTD4_NTM0_NEPBS8_NLCA1_NLCB1_ONLL1_PGR2_PLR1_PKA1_SIA3_SS1_SU0_SUM1_SUS0_SPO0_SRVW0_SSO0_SVW4_SK0_SKXCCM0_TLDS1_ULSGRO0_USL1_UIOFGRO0_USFGROn1_VSn1_VWA4_VWB4_WSGRA0_WSGRB0_WS64_WG16_4_4_WGM1_WGMXCC4_WGMXCCGn1
    SolutionIndex: 255
    SolutionNameMin: Cijk_Ailk_Bljk_I8II_BH_UserArgs_MT64x64x128_MI32x32x1_SN_LDSB0_AFC0_AFEM1_AFEM1_ASEM1_CLR1_CADS0_DTVA0_DTVB0_EPS0_FDSI0_GRPM1_GRVWA16_GRVWB16_GSUn1_GSUAMBSK_GSUC1_GSUWGMRR1_GLS0_ISA942_IU1_K1_LBSPPA0_LBSPPB256_LBSPPM0_LPA0_LPB16_LPM0_LRVW16_LWPMn1_MIAV0_MIWT2_2_MO40_NTn1_NTA0_NTB0_NTC0_NTD4_NTM0_NEPBS8_NLCA1_NLCB1_ONLL1_PGR2_PLR1_PKA1_SIA3_SS1_SU0_SUM1_SUS0_SPO0_SRVW0_SSO0_SVW2_SK0_SKXCCM0_TLDS1_ULSGRO0_USL1_UIOFGRO0_USFGROn1_VSn1_VWA2_VWB2_WSGRA0_WSGRB0_WS64_WG32_2_4_WGM1_WGMXCC4_WGMXCCGn1
    SolutionIndex: 256
    SolutionNameMin: Cijk_Ailk_Bljk_I8II_BH_UserArgs_MT64x128x128_MI16x16x1_SN_LDSB1_AFC0_AFEM1_AFEM1_ASEM1_CLR1_CADS0_DTVA0_DTVB0_EPS0_FDSI0_GRPM1_GRVWA16_GRVWB16_GSUn1_GSUAMBSK_GSUC1_GSUWGMRR1_GLS0_ISA942_IU1_K1_LBSPPA1024_LBSPPB512_LBSPPM0_LPA32_LPB32_LPM0_LRVW16_LWPMn1_MIAV0_MIWT2_4_MO40_NTn1_NTA0_NTB0_NTC0_NTD4_NTM0_NEPBS8_NLCA1_NLCB1_ONLL1_PGR2_PLR1_PKA1_SIA3_SS1_SU0_SUM1_SUS0_SPO0_SRVW0_SSO0_SVW2_SK0_SKXCCM0_TLDS1_ULSGRO0_USL1_UIOFGRO0_USFGROn1_VSn1_VWA2_VWB4_WSGRA0_WSGRB0_WS64_WG32_8_1_WGM1_WGMXCC4_WGMXCCGn1
    SolutionIndex: 257
    SolutionNameMin: Cijk_Ailk_Bljk_I8II_BH_UserArgs_MT128x64x64_MI16x16x1_SN_LDSB1_AFC0_AFEM1_AFEM1_ASEM1_CLR1_CADS0_DTVA0_DTVB0_EPS0_FDSI0_GRPM1_GRVWA16_GRVWB8_GSUn1_GSUAMBSK_GSUC1_GSUWGMRR1_GLS0_ISA942_IU1_K1_LBSPPA1024_LBSPPB256_LBSPPM0_LPA32_LPB8_LPM0_LRVW8_LWPMn1_MIAV0_MIWT2_4_MO40_NTn1_NTA0_NTB0_NTC0_NTD4_NTM0_NEPBS8_NLCA1_NLCB1_ONLL1_PGR2_PLR1_PKA1_SIA3_SS1_SU0_SUM1_SUS0_SPO0_SRVW0_SSO0_SVW2_SK0_SKXCCM0_TLDS1_ULSGRO0_USL1_UIOFGRO0_USFGROn1_VSn1_VWA2_VWB4_WSGRA0_WSGRB0_WS64_WG64_4_1_WGM1_WGMXCC4_WGMXCCGn1
    SolutionIndex: 258
    SolutionNameMin: Cijk_Ailk_Bljk_I8II_BH_UserArgs_MT128x64x64_MI16x16x1_SN_LDSB1_AFC0_AFEM1_AFEM1_ASEM1_CLR1_CADS0_DTVA0_DTVB0_EPS0_FDSI0_GRPM1_GRVWA16_GRVWB8_GSUn1_GSUAMBSK_GSUC1_GSUWGMRR1_GLS0_ISA942_IU1_K1_LBSPPA1024_LBSPPB128_LBSPPM0_LPA64_LPB16_LPM0_LRVW8_LWPMn1_MIAV0_MIWT4_2_MO40_NTn1_NTA0_NTB0_NTC0_NTD4_NTM0_NEPBS8_NLCA1_NLCB1_ONLL1_PGR2_PLR1_PKA1_SIA3_SS1_SU0_SUM1_SUS0_SPO0_SRVW0_SSO0_SVW4_SK0_SKXCCM0_TLDS1_ULSGRO0_USL1_UIOFGRO0_USFGROn1_VSn1_VWA4_VWB2_WSGRA0_WSGRB0_WS64_WG32_8_1_WGM1_WGMXCC4_WGMXCCGn1
    SolutionIndex: 259
    SolutionNameMin: Cijk_Ailk_Bljk_I8II_BH_UserArgs_MT128x64x64_MI16x16x1_SN_LDSB1_AFC0_AFEM1_AFEM1_ASEM1_CLR1_CADS0_DTVA0_DTVB0_EPS0_FDSI0_GRPM1_GRVWA16_GRVWB8_GSUn1_GSUAMBSK_GSUC1_GSUWGMRR1_GLS0_ISA942_IU1_K1_LBSPPA1024_LBSPPB256_LBSPPM0_LPA32_LPB16_LPM0_LRVW8_LWPMn1_MIAV0_MIWT2_4_MO40_NTn1_NTA0_NTB0_NTC0_NTD4_NTM0_NEPBS8_NLCA1_NLCB1_ONLL1_PGR2_PLR1_PKA1_SIA3_SS1_SU0_SUM1_SUS0_SPO0_SRVW0_SSO0_SVW2_SK0_SKXCCM0_TLDS1_ULSGRO0_USL1_UIOFGRO0_USFGROn1_VSn1_VWA2_VWB4_WSGRA0_WSGRB0_WS64_WG64_4_1_WGM1_WGMXCC4_WGMXCCGn1
    SolutionIndex: 260
    SolutionNameMin: Cijk_Ailk_Bljk_I8II_BH_UserArgs_MT128x32x64_MI16x16x1_SN_LDSB1_AFC0_AFEM1_AFEM1_ASEM1_CLR1_CADS0_DTVA0_DTVB0_EPS0_FDSI0_GRPM1_GRVWA16_GRVWB8_GSUn1_GSUAMBSK_GSUC1_GSUWGMRR1_GLS0_ISA942_IU1_K1_LBSPPA1024_LBSPPB128_LBSPPM0_LPA32_LPB8_LPM0_LRVW8_LWPMn1_MIAV0_MIWT2_2_MO40_NTn1_NTA0_NTB0_NTC0_NTD4_NTM0_NEPBS8_NLCA1_NLCB1_ONLL1_PGR2_PLR1_PKA1_SIA3_SS1_SU0_SUM1_SUS0_SPO0_SRVW0_SSO0_SVW2_SK0_SKXCCM0_TLDS1_ULSGRO0_USL1_UIOFGRO0_USFGROn1_VSn1_VWA2_VWB2_WSGRA0_WSGRB0_WS64_WG64_4_1_WGM1_WGMXCC4_WGMXCCGn1
    SolutionIndex: 261
    SolutionNameMin: Cijk_Ailk_Bljk_I8II_BH_UserArgs_MT128x80x64_MI16x16x1_SN_LDSB1_AFC0_AFEM1_AFEM1_ASEM1_CLR1_CADS0_DTVA0_DTVB0_EPS0_FDSI0_GRPM1_GRVWA16_GRVWB4_GSUn1_GSUAMBSK_GSUC1_GSUWGMRR1_GLS0_ISA942_IU1_K1_LBSPPA1024_LBSPPB128_LBSPPM0_LPA32_LPB8_LPM0_LRVW8_LWPMn1_MIAV0_MIWT2_5_MO40_NTn1_NTA0_NTB0_NTC0_NTD4_NTM0_NEPBS8_NLCA1_NLCB1_ONLL1_PGR2_PLR1_PKA1_SIA3_SS1_SU0_SUM1_SUS0_SPO0_SRVW0_SSO0_SVW2_SK0_SKXCCM0_TLDS1_ULSGRO0_USL1_UIOFGRO0_USFGROn1_VSn1_VWA2_VWB1_WSGRA0_WSGRB0_WS64_WG64_4_1_WGM1_WGMXCC4_WGMXCCGn1
    SolutionIndex: 262
    SolutionNameMin: Cijk_Ailk_Bljk_I8II_BH_UserArgs_MT128x32x64_MI16x16x1_SN_LDSB1_AFC0_AFEM1_AFEM1_ASEM1_CLR0_CADS0_DTVA0_DTVB0_EPS0_FDSI0_GRPM1_GRVWA16_GRVWB8_GSUn1_GSUAMBSK_GSUC1_GSUWGMRR1_GLS0_ISA942_IU1_K1_LBSPPA1024_LBSPPB128_LBSPPM0_LPA64_LPB8_LPM0_LRVW8_LWPMn1_MIAV0_MIWT4_2_MO40_NTn1_NTA0_NTB0_NTC0_NTD4_NTM0_NEPBS8_NLCA1_NLCB1_ONLL1_PGR2_PLR0_PKA1_SIA3_SS1_SU0_SUM1_SUS0_SPO0_SRVW0_SSO0_SVW4_SK0_SKXCCM0_TLDS1_ULSGRO0_USL1_UIOFGRO0_USFGROn1_VSn1_VWA4_VWB2_WSGRA0_WSGRB0_WS64_WG32_4_2_WGM1_WGMXCC4_WGMXCCGn1
    SolutionIndex: 263
    SolutionNameMin: Cijk_Ailk_Bljk_I8II_BH_UserArgs_MT64x64x64_MI16x16x1_SN_LDSB1_AFC0_AFEM1_AFEM1_ASEM1_CLR0_CADS0_DTVA0_DTVB0_EPS0_FDSI0_GRPM1_GRVWA16_GRVWB8_GSUn1_GSUAMBSK_GSUC1_GSUWGMRR1_GLS0_ISA942_IU1_K1_LBSPPA512_LBSPPB128_LBSPPM0_LPA64_LPB16_LPM0_LRVW8_LWPMn1_MIAV0_MIWT4_2_MO40_NTn1_NTA0_NTB0_NTC0_NTD4_NTM0_NEPBS8_NLCA1_NLCB1_ONLL1_PGR2_PLR0_PKA1_SIA3_SS1_SU0_SUM1_SUS0_SPO0_SRVW0_SSO0_SVW4_SK0_SKXCCM0_TLDS1_ULSGRO0_USL1_UIOFGRO0_USFGROn1_VSn1_VWA4_VWB2_WSGRA0_WSGRB0_WS64_WG16_8_2_WGM1_WGMXCC4_WGMXCCGn1
    SolutionIndex: 264
    SolutionNameMin: Cijk_Ailk_Bljk_I8II_BH_UserArgs_MT128x160x64_MI16x16x1_SN_LDSB1_AFC0_AFEM1_AFEM1_ASEM1_CLR1_CADS0_DTVA0_DTVB0_EPS0_FDSI0_GRPM1_GRVWA16_GRVWB8_GSUn1_GSUAMBSK_GSUC1_GSUWGMRR1_GLS0_ISA942_IU1_K1_LBSPPA1024_LBSPPB128_LBSPPM0_LPA64_LPB8_LPM0_LRVW8_LWPMn1_MIAV0_MIWT4_5_MO40_NTn1_NTA0_NTB0_NTC0_NTD4_NTM0_NEPBS8_NLCA1_NLCB1_ONLL1_PGR2_PLR1_PKA1_SIA3_SS1_SU0_SUM1_SUS0_SPO0_SRVW0_SSO0_SVW4_SK0_SKXCCM0_TLDS1_ULSGRO0_USL1_UIOFGRO0_USFGROn1_VSn1_VWA4_VWB1_WSGRA0_WSGRB0_WS64_WG32_8_1_WGM1_WGMXCC4_WGMXCCGn1
    SolutionIndex: 265
    SolutionNameMin: Cijk_Ailk_Bljk_I8II_BH_UserArgs_MT128x224x128_MI16x16x1_SN_LDSB1_AFC0_AFEM1_AFEM1_ASEM1_CLR1_CADS0_DTVA0_DTVB0_EPS0_FDSI0_GRPM1_GRVWA16_GRVWB16_GSUn1_GSUAMBSK_GSUC1_GSUWGMRR1_GLS0_ISA942_IU1_K1_LBSPPA2048_LBSPPB256_LBSPPM0_LPA32_LPB32_LPM0_LRVW16_LWPMn1_MIAV0_MIWT2_14_MO40_NTn1_NTA0_NTB0_NTC0_NTD4_NTM0_NEPBS8_NLCA1_NLCB1_ONLL1_PGR2_PLR1_PKA1_SIA3_SS1_SU0_SUM1_SUS0_SPO0_SRVW0_SSO0_SVW2_SK0_SKXCCM0_TLDS1_ULSGRO0_USL1_UIOFGRO0_USFGROn1_VSn1_VWA2_VWB2_WSGRA0_WSGRB0_WS64_WG64_4_1_WGM1_WGMXCC4_WGMXCCGn1
    SolutionIndex: 266
    SolutionNameMin: Cijk_Ailk_Bljk_I8II_BH_UserArgs_MT96x96x128_MI16x16x1_SN_LDSB1_AFC0_AFEM1_AFEM1_ASEM1_CLR1_CADS0_DTVA0_DTVB0_EPS0_FDSI0_GRPM1_GRVWA16_GRVWB16_GSUn1_GSUAMBSK_GSUC1_GSUWGMRR1_GLS0_ISA942_IU1_K1_LBSPPA1536_LBSPPB128_LBSPPM0_LPA16_LPB32_LPM0_LRVW16_LWPMn1_MIAV0_MIWT3_3_MO40_NTn1_NTA0_NTB0_NTC0_NTD4_NTM0_NEPBS6_NLCA1_NLCB1_ONLL1_PGR2_PLR1_PKA1_SIA3_SS1_SU0_SUM1_SUS0_SPO0_SRVW0_SSO4_SVW1_SK0_SKXCCM0_TLDS1_ULSGRO0_USL1_UIOFGRO0_USFGROn1_VSn1_VWA1_VWB1_WSGRA0_WSGRB0_WS64_WG32_8_1_WGM1_WGMXCC4_WGMXCCGn1
    SolutionIndex: 267
    SolutionNameMin: Cijk_Ailk_Bljk_I8II_BH_UserArgs_MT16x192x128_MI16x16x1_SN_LDSB1_AFC0_AFEM1_AFEM1_ASEM1_CLR1_CADS0_DTVA0_DTVB0_EPS0_FDSI0_GRPM1_GRVWA1_GRVWB16_GSUn1_GSUAMBSK_GSUC1_GSUWGMRR1_GLS0_ISA942_IU1_K1_LBSPPA256_LBSPPB256_LBSPPM0_LPA16_LPB32_LPM0_LRVW16_LWPMn1_MIAV0_MIWT1_6_MO40_NTn1_NTA0_NTB0_NTC0_NTD4_NTM0_NEPBS8_NLCA1_NLCB1_ONLL1_PGR2_PLR1_PKA1_SIA3_SS1_SU0_SUM1_SUS0_SPO0_SRVW0_SSO0_SVW1_SK0_SKXCCM0_TLDS1_ULSGRO0_USL1_UIOFGRO0_USFGROn1_VSn1_VWA1_VWB2_WSGRA0_WSGRB0_WS64_WG16_8_2_WGM1_WGMXCC4_WGMXCCGn1
    SolutionIndex: 268
    SolutionNameMin: Cijk_Ailk_Bljk_I8II_BH_UserArgs_MT32x80x512_MI16x16x1_SN_LDSB1_AFC0_AFEM1_AFEM1_ASEM1_CLR1_CADS0_DTVA0_DTVB0_EPS0_FDSI0_GRPM1_GRVWA16_GRVWB16_GSUn1_GSUAMBSK_GSUC1_GSUWGMRR1_GLS0_ISA942_IU1_K1_LBSPPA512_LBSPPB512_LBSPPM0_LPA32_LPB32_LPM0_LRVW16_LWPMn1_MIAV0_MIWT2_5_MO40_NTn1_NTA0_NTB0_NTC0_NTD4_NTM0_NEPBS8_NLCA1_NLCB1_ONLL1_PGR2_PLR1_PKA1_SIA3_SS1_SU0_SUM1_SUS0_SPO0_SRVW0_SSO0_SVW2_SK0_SKXCCM0_TLDS1_ULSGRO0_USL1_UIOFGRO0_USFGROn1_VSn1_VWA2_VWB1_WSGRA0_WSGRB0_WS64_WG16_4_4_WGM1_WGMXCC4_WGMXCCGn1
    SolutionIndex: 269
    SolutionNameMin: Cijk_Ailk_Bljk_I8II_BH_UserArgs_MT32x96x128_MI16x16x1_SN_LDSB1_AFC0_AFEM1_AFEM1_ASEM1_CLR1_CADS0_DTVA0_DTVB0_EPS0_FDSI0_GRPM1_GRVWA16_GRVWB16_GSUn1_GSUAMBSK_GSUC1_GSUWGMRR1_GLS0_ISA942_IU1_K1_LBSPPA512_LBSPPB128_LBSPPM0_LPA16_LPB32_LPM0_LRVW16_LWPMn1_MIAV0_MIWT1_3_MO40_NTn1_NTA0_NTB0_NTC0_NTD4_NTM0_NEPBS8_NLCA1_NLCB1_ONLL1_PGR2_PLR1_PKA1_SIA3_SS1_SU0_SUM1_SUS0_SPO0_SRVW0_SSO0_SVW1_SK0_SKXCCM0_TLDS1_ULSGRO0_USL1_UIOFGRO0_USFGROn1_VSn1_VWA1_VWB1_WSGRA0_WSGRB0_WS64_WG32_8_1_WGM1_WGMXCC4_WGMXCCGn1
    SolutionIndex: 270
    SolutionNameMin: Cijk_Ailk_Bljk_I8II_BH_UserArgs_MT32x224x128_MI16x16x1_SN_LDSB1_AFC0_AFEM1_AFEM1_ASEM1_CLR1_CADS0_DTVA0_DTVB0_EPS0_FDSI0_GRPM1_GRVWA16_GRVWB16_GSUn1_GSUAMBSK_GSUC1_GSUWGMRR1_GLS0_ISA942_IU1_K1_LBSPPA512_LBSPPB128_LBSPPM0_LPA32_LPB32_LPM0_LRVW16_LWPMn1_MIAV0_MIWT2_7_MO40_NTn1_NTA0_NTB0_NTC0_NTD4_NTM0_NEPBS8_NLCA1_NLCB1_ONLL1_PGR2_PLR1_PKA1_SIA3_SS1_SU0_SUM1_SUS0_SPO0_SRVW0_SSO0_SVW2_SK0_SKXCCM0_TLDS1_ULSGRO0_USL1_UIOFGRO0_USFGROn1_VSn1_VWA2_VWB1_WSGRA0_WSGRB0_WS64_WG16_8_2_WGM1_WGMXCC4_WGMXCCGn1
    SolutionIndex: 271
    SolutionNameMin: Cijk_Ailk_Bljk_I8II_BH_UserArgs_MT32x192x128_MI16x16x1_SN_LDSB1_AFC0_AFEM1_AFEM1_ASEM1_CLR1_CADS0_DTVA0_DTVB0_EPS0_FDSI0_GRPM1_GRVWA16_GRVWB16_GSUn1_GSUAMBSK_GSUC1_GSUWGMRR1_GLS0_ISA942_IU1_K1_LBSPPA512_LBSPPB256_LBSPPM0_LPA16_LPB32_LPM0_LRVW16_LWPMn1_MIAV0_MIWT1_6_MO40_NTn1_NTA0_NTB0_NTC0_NTD4_NTM0_NEPBS8_NLCA1_NLCB1_ONLL1_PGR2_PLR1_PKA1_SIA3_SS1_SU0_SUM1_SUS0_SPO0_SRVW0_SSO0_SVW1_SK0_SKXCCM0_TLDS1_ULSGRO0_USL1_UIOFGRO0_USFGROn1_VSn1_VWA1_VWB2_WSGRA0_WSGRB0_WS64_WG32_8_1_WGM1_WGMXCC4_WGMXCCGn1
    SolutionIndex: 272
    SolutionNameMin: Cijk_Ailk_Bljk_I8II_BH_UserArgs_MT32x192x128_MI32x32x1_SN_LDSB1_AFC0_AFEM1_AFEM1_ASEM1_CLR1_CADS0_DTVA0_DTVB0_EPS0_FDSI0_GRPM1_GRVWA16_GRVWB16_GSUn1_GSUAMBSK_GSUC1_GSUWGMRR1_GLS0_ISA942_IU1_K1_LBSPPA0_LBSPPB256_LBSPPM0_LPA0_LPB16_LPM0_LRVW16_LWPMn1_MIAV0_MIWT1_6_MO40_NTn1_NTA0_NTB0_NTC0_NTD4_NTM0_NEPBS8_NLCA1_NLCB1_ONLL1_PGR2_PLR1_PKA1_SIA3_SS1_SU0_SUM1_SUS0_SPO0_SRVW0_SSO0_SVW1_SK0_SKXCCM0_TLDS1_ULSGRO0_USL1_UIOFGRO0_USFGROn1_VSn1_VWA1_VWB2_WSGRA0_WSGRB0_WS64_WG32_2_4_WGM1_WGMXCC4_WGMXCCGn1
    SolutionIndex: 273
    SolutionNameMin: Cijk_Ailk_Bljk_I8II_BH_UserArgs_MT64x384x128_MI16x16x1_SN_LDSB1_AFC0_AFEM1_AFEM1_ASEM1_CLR1_CADS0_DTVA0_DTVB0_EPS0_FDSI0_GRPM1_GRVWA16_GRVWB16_GSUn1_GSUAMBSK_GSUC1_GSUWGMRR1_GLS0_ISA942_IU1_K1_LBSPPA1024_LBSPPB512_LBSPPM0_LPA64_LPB32_LPM0_LRVW16_LWPMn1_MIAV0_MIWT4_12_MO40_NTn1_NTA0_NTB0_NTC0_NTD4_NTM0_NEPBS8_NLCA1_NLCB1_ONLL1_PGR2_PLR1_PKA1_SIA3_SS1_SU0_SUM1_SUS0_SPO0_SRVW0_SSO0_SVW4_SK0_SKXCCM0_TLDS1_ULSGRO0_USL1_UIOFGRO0_USFGROn1_VSn1_VWA4_VWB4_WSGRA0_WSGRB0_WS64_WG16_8_2_WGM1_WGMXCC4_WGMXCCGn1
    SolutionIndex: 274
    SolutionNameMin: Cijk_Ailk_Bljk_I8II_BH_UserArgs_MT64x192x128_MI16x16x1_SN_LDSB1_AFC0_AFEM1_AFEM1_ASEM1_CLR1_CADS0_DTVA0_DTVB0_EPS0_FDSI0_GRPM1_GRVWA16_GRVWB16_GSUn1_GSUAMBSK_GSUC1_GSUWGMRR1_GLS0_ISA942_IU1_K1_LBSPPA1024_LBSPPB256_LBSPPM0_LPA64_LPB32_LPM0_LRVW16_LWPMn1_MIAV0_MIWT4_6_MO40_NTn1_NTA0_NTB0_NTC0_NTD4_NTM0_NEPBS8_NLCA1_NLCB1_ONLL1_PGR2_PLR1_PKA1_SIA3_SS1_SU0_SUM1_SUS0_SPO0_SRVW0_SSO0_SVW4_SK0_SKXCCM0_TLDS1_ULSGRO0_USL1_UIOFGRO0_USFGROn1_VSn1_VWA4_VWB2_WSGRA0_WSGRB0_WS64_WG16_8_2_WGM1_WGMXCC4_WGMXCCGn1
    SolutionIndex: 275
    SolutionNameMin: Cijk_Ailk_Bljk_I8II_BH_UserArgs_MT64x192x128_MI32x32x1_SN_LDSB1_AFC0_AFEM1_AFEM1_ASEM1_CLR1_CADS0_DTVA0_DTVB0_EPS0_FDSI0_GRPM1_GRVWA16_GRVWB16_GSUn1_GSUAMBSK_GSUC1_GSUWGMRR1_GLS0_ISA942_IU1_K1_LBSPPA0_LBSPPB128_LBSPPM0_LPA0_LPB16_LPM0_LRVW16_LWPMn1_MIAV0_MIWT2_3_MO40_NTn1_NTA0_NTB0_NTC0_NTD4_NTM0_NEPBS8_NLCA1_NLCB1_ONLL1_PGR2_PLR1_PKA1_SIA3_SS1_SU0_SUM1_SUS0_SPO0_SRVW0_SSO0_SVW2_SK0_SKXCCM0_TLDS1_ULSGRO0_USL1_UIOFGRO0_USFGROn1_VSn1_VWA2_VWB1_WSGRA0_WSGRB0_WS64_WG32_4_2_WGM1_WGMXCC4_WGMXCCGn1
    SolutionIndex: 276
    SolutionNameMin: Cijk_Ailk_Bljk_I8II_BH_UserArgs_MT64x224x128_MI16x16x1_SN_LDSB1_AFC0_AFEM1_AFEM1_ASEM1_CLR1_CADS0_DTVA0_DTVB0_EPS0_FDSI0_GRPM1_GRVWA16_GRVWB16_GSUn1_GSUAMBSK_GSUC1_GSUWGMRR1_GLS0_ISA942_IU1_K1_LBSPPA1024_LBSPPB256_LBSPPM0_LPA32_LPB32_LPM0_LRVW16_LWPMn1_MIAV0_MIWT2_14_MO40_NTn1_NTA0_NTB0_NTC0_NTD4_NTM0_NEPBS8_NLCA1_NLCB1_ONLL1_PGR2_PLR1_PKA1_SIA3_SS1_SU0_SUM1_SUS0_SPO0_SRVW0_SSO0_SVW2_SK0_SKXCCM0_TLDS1_ULSGRO0_USL1_UIOFGRO0_USFGROn1_VSn1_VWA2_VWB2_WSGRA0_WSGRB0_WS64_WG32_4_2_WGM1_WGMXCC4_WGMXCCGn1
    SolutionIndex: 277
    SolutionNameMin: Cijk_Ailk_Bljk_I8II_BH_UserArgs_MT64x224x128_MI32x32x1_SN_LDSB1_AFC0_AFEM1_AFEM1_ASEM1_CLR1_CADS0_DTVA0_DTVB0_EPS0_FDSI0_GRPM1_GRVWA16_GRVWB16_GSUn1_GSUAMBSK_GSUC1_GSUWGMRR1_GLS0_ISA942_IU1_K1_LBSPPA0_LBSPPB128_LBSPPM0_LPA0_LPB16_LPM0_LRVW16_LWPMn1_MIAV0_MIWT1_7_MO40_NTn1_NTA0_NTB0_NTC0_NTD4_NTM0_NEPBS8_NLCA1_NLCB1_ONLL1_PGR2_PLR1_PKA1_SIA3_SS1_SU0_SUM1_SUS0_SPO0_SRVW0_SSO0_SVW1_SK0_SKXCCM0_TLDS1_ULSGRO0_USL1_UIOFGRO0_USFGROn1_VSn1_VWA1_VWB1_WSGRA0_WSGRB0_WS64_WG64_2_2_WGM1_WGMXCC4_WGMXCCGn1
    SolutionIndex: 278
    SolutionNameMin: Cijk_Ailk_Bljk_I8II_BH_UserArgs_MT128x64x64_MI32x32x1_SN_LDSB1_AFC0_AFEM1_AFEM1_ASEM1_CLR1_CADS0_DTVA0_DTVB0_EPS0_FDSI0_GRPM1_GRVWA16_GRVWB16_GSUn1_GSUAMBSK_GSUC1_GSUWGMRR1_GLS0_ISA942_IU1_K1_LBSPPA0_LBSPPB128_LBSPPM0_LPA0_LPB16_LPM0_LRVW16_LWPMn1_MIAV0_MIWT1_2_MO40_NTn1_NTA0_NTB0_NTC0_NTD4_NTM0_NEPBS8_NLCA1_NLCB1_ONLL1_PGR2_PLR1_PKA1_SIA3_SS1_SU0_SUM1_SUS0_SPO0_SRVW0_SSO0_SVW1_SK0_SKXCCM0_TLDS1_ULSGRO0_USL1_UIOFGRO0_USFGROn1_VSn1_VWA1_VWB2_WSGRA0_WSGRB0_WS64_WG128_2_1_WGM1_WGMXCC4_WGMXCCGn1
    SolutionIndex: 279
    SolutionNameMin: Cijk_Ailk_Bljk_I8II_BH_UserArgs_MT128x96x64_MI16x16x1_SN_LDSB1_AFC0_AFEM1_AFEM1_ASEM1_CLR1_CADS0_DTVA0_DTVB0_EPS0_FDSI0_GRPM1_GRVWA16_GRVWB8_GSUn1_GSUAMBSK_GSUC1_GSUWGMRR1_GLS0_ISA942_IU1_K1_LBSPPA1024_LBSPPB128_LBSPPM0_LPA32_LPB8_LPM0_LRVW8_LWPMn1_MIAV0_MIWT2_6_MO40_NTn1_NTA0_NTB0_NTC0_NTD4_NTM0_NEPBS8_NLCA1_NLCB1_ONLL1_PGR2_PLR1_PKA1_SIA3_SS1_SU0_SUM1_SUS0_SPO0_SRVW0_SSO0_SVW2_SK0_SKXCCM0_TLDS1_ULSGRO0_USL1_UIOFGRO0_USFGROn1_VSn1_VWA2_VWB2_WSGRA0_WSGRB0_WS64_WG64_4_1_WGM1_WGMXCC4_WGMXCCGn1
    SolutionIndex: 280
    SolutionNameMin: Cijk_Ailk_Bljk_I8II_BH_UserArgs_MT128x32x128_MI16x16x1_SN_LDSB1_AFC0_AFEM1_AFEM1_ASEM1_CLR1_CADS0_DTVA0_DTVB0_EPS0_FDSI0_GRPM1_GRVWA16_GRVWB16_GSUn1_GSUAMBSK_GSUC1_GSUWGMRR1_GLS0_ISA942_IU1_K1_LBSPPA2048_LBSPPB256_LBSPPM0_LPA64_LPB32_LPM0_LRVW16_LWPMn1_MIAV0_MIWT4_2_MO40_NTn1_NTA0_NTB0_NTC0_NTD4_NTM0_NEPBS8_NLCA1_NLCB1_ONLL1_PGR2_PLR1_PKA1_SIA3_SS1_SU0_SUM1_SUS0_SPO0_SRVW0_SSO0_SVW4_SK0_SKXCCM0_TLDS1_ULSGRO0_USL1_UIOFGRO0_USFGROn1_VSn1_VWA4_VWB2_WSGRA0_WSGRB0_WS64_WG32_4_2_WGM1_WGMXCC4_WGMXCCGn1
    SolutionIndex: 281
    SolutionNameMin: Cijk_Ailk_Bljk_I8II_BH_UserArgs_MT128x128x64_MI32x32x1_SN_LDSB1_AFC0_AFEM1_AFEM1_ASEM1_CLR1_CADS0_DTVA0_DTVB0_EPS0_FDSI0_GRPM1_GRVWA16_GRVWB16_GSUn1_GSUAMBSK_GSUC1_GSUWGMRR1_GLS0_ISA942_IU1_K1_LBSPPA0_LBSPPB256_LBSPPM0_LPA0_LPB16_LPM0_LRVW16_LWPMn1_MIAV0_MIWT1_4_MO40_NTn1_NTA0_NTB0_NTC0_NTD4_NTM0_NEPBS8_NLCA1_NLCB1_ONLL1_PGR2_PLR1_PKA1_SIA3_SS1_SU0_SUM1_SUS0_SPO0_SRVW0_SSO0_SVW1_SK0_SKXCCM0_TLDS1_ULSGRO0_USL1_UIOFGRO0_USFGROn1_VSn1_VWA1_VWB4_WSGRA0_WSGRB0_WS64_WG128_2_1_WGM1_WGMXCC4_WGMXCCGn1
    SolutionIndex: 282
    SolutionNameMin: Cijk_Ailk_Bljk_I8II_BH_UserArgs_MT64x64x64_MI16x16x1_SN_LDSB1_AFC0_AFEM1_AFEM1_ASEM1_CLR0_CADS0_DTVA0_DTVB0_EPS0_FDSI0_GRPM1_GRVWA16_GRVWB8_GSUn1_GSUAMBSK_GSUC1_GSUWGMRR1_GLS0_ISA942_IU1_K1_LBSPPA512_LBSPPB256_LBSPPM0_LPA32_LPB16_LPM0_LRVW8_LWPMn1_MIAV0_MIWT2_4_MO40_NTn1_NTA0_NTB0_NTC0_NTD4_NTM0_NEPBS8_NLCA1_NLCB1_ONLL1_PGR2_PLR0_PKA1_SIA3_SS1_SU0_SUM1_SUS0_SPO0_SRVW0_SSO0_SVW2_SK0_SKXCCM0_TLDS1_ULSGRO0_USL1_UIOFGRO0_USFGROn1_VSn1_VWA2_VWB4_WSGRA0_WSGRB0_WS64_WG32_4_2_WGM1_WGMXCC4_WGMXCCGn1
    SolutionIndex: 283
    SolutionNameMin: Cijk_Ailk_Bljk_I8II_BH_UserArgs_MT128x128x64_MI16x16x1_SN_LDSB1_AFC0_AFEM1_AFEM1_ASEM1_CLR1_CADS0_DTVA0_DTVB0_EPS0_FDSI0_GRPM1_GRVWA16_GRVWB8_GSUn1_GSUAMBSK_GSUC1_GSUWGMRR1_GLS0_ISA942_IU1_K1_LBSPPA1024_LBSPPB256_LBSPPM0_LPA64_LPB16_LPM0_LRVW8_LWPMn1_MIAV0_MIWT4_4_MO40_NTn1_NTA0_NTB0_NTC0_NTD4_NTM0_NEPBS8_NLCA1_NLCB1_ONLL1_PGR2_PLR1_PKA1_SIA3_SS1_SU0_SUM1_SUS0_SPO0_SRVW0_SSO0_SVW4_SK0_SKXCCM0_TLDS1_ULSGRO0_USL1_UIOFGRO0_USFGROn1_VSn1_VWA4_VWB4_WSGRA0_WSGRB0_WS64_WG32_8_1_WGM1_WGMXCC4_WGMXCCGn1
    SolutionIndex: 284
    SolutionNameMin: Cijk_Ailk_Bljk_I8II_BH_UserArgs_MT256x112x128_MI16x16x1_SN_LDSB1_AFC0_AFEM1_AFEM1_ASEM1_CLR1_CADS0_DTVA0_DTVB0_EPS0_FDSI0_GRPM1_GRVWA16_GRVWB8_GSUn1_GSUAMBSK_GSUC1_GSUWGMRR1_GLS0_ISA942_IU1_K1_LBSPPA4096_LBSPPB128_LBSPPM0_LPA32_LPB32_LPM0_LRVW16_LWPMn1_MIAV0_MIWT4_7_MO40_NTn1_NTA0_NTB0_NTC0_NTD4_NTM0_NEPBS8_NLCA1_NLCB1_ONLL1_PGR2_PLR1_PKA1_SIA3_SS1_SU0_SUM1_SUS0_SPO0_SRVW0_SSO0_SVW4_SK0_SKXCCM0_TLDS1_ULSGRO0_USL1_UIOFGRO0_USFGROn1_VSn1_VWA4_VWB1_WSGRA0_WSGRB0_WS64_WG64_4_1_WGM1_WGMXCC4_WGMXCCGn1
    SolutionIndex: 285
    SolutionNameMin: Cijk_Ailk_Bljk_I8II_BH_UserArgs_MT64x128x128_MI16x16x1_SN_LDSB1_AFC0_AFEM1_AFEM1_ASEM1_CLR1_CADS0_DTVA0_DTVB0_EPS0_FDSI0_GRPM1_GRVWA16_GRVWB16_GSUn1_GSUAMBSK_GSUC1_GSUWGMRR1_GLS0_ISA942_IU1_K1_LBSPPA1024_LBSPPB512_LBSPPM0_LPA32_LPB32_LPM0_LRVW16_LWPMn1_MIAV0_MIWT2_4_MO40_NTn1_NTA0_NTB0_NTC0_NTD4_NTM0_NEPBS8_NLCA1_NLCB1_ONLL1_PGR2_PLR1_PKA1_SIA3_SS1_SU0_SUM1_SUS0_SPO0_SRVW0_SSO4_SVW2_SK0_SKXCCM0_TLDS1_ULSGRO0_USL1_UIOFGRO0_USFGROn1_VSn1_VWA2_VWB4_WSGRA0_WSGRB0_WS64_WG32_8_1_WGM1_WGMXCC4_WGMXCCGn1
    SolutionIndex: 286
    SolutionNameMin: Cijk_Ailk_Bljk_I8II_BH_UserArgs_MT128x96x128_MI16x16x1_SN_LDSB1_AFC0_AFEM1_AFEM1_ASEM1_CLR1_CADS0_DTVA0_DTVB0_EPS0_FDSI0_GRPM1_GRVWA16_GRVWB16_GSUn1_GSUAMBSK_GSUC1_GSUWGMRR1_GLS0_ISA942_IU1_K1_LBSPPA2048_LBSPPB128_LBSPPM0_LPA64_LPB32_LPM0_LRVW16_LWPMn1_MIAV0_MIWT4_3_MO40_NTn1_NTA0_NTB0_NTC0_NTD4_NTM0_NEPBS8_NLCA1_NLCB1_ONLL1_PGR2_PLR1_PKA1_SIA3_SS1_SU0_SUM1_SUS0_SPO0_SRVW0_SSO4_SVW4_SK0_SKXCCM0_TLDS1_ULSGRO0_USL1_UIOFGRO0_USFGROn1_VSn1_VWA4_VWB1_WSGRA0_WSGRB0_WS64_WG32_8_1_WGM1_WGMXCC4_WGMXCCGn1
    SolutionIndex: 287
    SolutionNameMin: Cijk_Ailk_Bljk_I8II_BH_UserArgs_MT16x160x128_MI16x16x1_SN_LDSB1_AFC0_AFEM1_AFEM1_ASEM1_CLR1_CADS0_DTVA0_DTVB0_EPS0_FDSI0_GRPM1_GRVWA1_GRVWB16_GSUn1_GSUAMBSK_GSUC1_GSUWGMRR1_GLS0_ISA942_IU1_K1_LBSPPA256_LBSPPB128_LBSPPM0_LPA16_LPB32_LPM0_LRVW16_LWPMn1_MIAV0_MIWT1_5_MO40_NTn1_NTA0_NTB0_NTC0_NTD4_NTM0_NEPBS8_NLCA1_NLCB1_ONLL1_PGR2_PLR1_PKA1_SIA3_SS1_SU0_SUM1_SUS0_SPO0_SRVW0_SSO0_SVW1_SK0_SKXCCM0_TLDS1_ULSGRO0_USL1_UIOFGRO0_USFGROn1_VSn1_VWA1_VWB1_WSGRA0_WSGRB0_WS64_WG16_8_2_WGM1_WGMXCC4_WGMXCCGn1
    SolutionIndex: 288
    SolutionNameMin: Cijk_Ailk_Bljk_I8II_BH_UserArgs_MT64x192x64_MI32x32x1_SN_LDSB1_AFC0_AFEM1_AFEM1_ASEM1_CLR1_CADS0_DTVA0_DTVB0_EPS0_FDSI0_GRPM1_GRVWA16_GRVWB16_GSUn1_GSUAMBSK_GSUC1_GSUWGMRR1_GLS0_ISA942_IU1_K1_LBSPPA0_LBSPPB128_LBSPPM0_LPA0_LPB16_LPM0_LRVW16_LWPMn1_MIAV0_MIWT1_3_MO40_NTn1_NTA0_NTB0_NTC0_NTD4_NTM0_NEPBS8_NLCA1_NLCB1_ONLL1_PGR2_PLR1_PKA1_SIA3_SS1_SU0_SUM1_SUS0_SPO0_SRVW0_SSO0_SVW1_SK0_SKXCCM0_TLDS1_ULSGRO0_USL1_UIOFGRO0_USFGROn1_VSn1_VWA1_VWB1_WSGRA0_WSGRB0_WS64_WG64_4_1_WGM1_WGMXCC4_WGMXCCGn1
    SolutionIndex: 289
    SolutionNameMin: Cijk_Ailk_Bljk_I8II_BH_UserArgs_MT64x192x64_MI16x16x1_SN_LDSB1_AFC0_AFEM1_AFEM1_ASEM1_CLR1_CADS0_DTVA0_DTVB0_EPS0_FDSI0_GRPM1_GRVWA16_GRVWB8_GSUn1_GSUAMBSK_GSUC1_GSUWGMRR1_GLS0_ISA942_IU1_K1_LBSPPA512_LBSPPB128_LBSPPM0_LPA64_LPB16_LPM0_LRVW8_LWPMn1_MIAV0_MIWT4_3_MO40_NTn1_NTA0_NTB0_NTC0_NTD4_NTM0_NEPBS8_NLCA1_NLCB1_ONLL1_PGR2_PLR1_PKA1_SIA3_SS1_SU0_SUM1_SUS0_SPO0_SRVW0_SSO0_SVW4_SK0_SKXCCM0_TLDS1_ULSGRO0_USL1_UIOFGRO0_USFGROn1_VSn1_VWA4_VWB1_WSGRA0_WSGRB0_WS64_WG16_16_1_WGM1_WGMXCC4_WGMXCCGn1
    SolutionIndex: 290
    SolutionNameMin: Cijk_Ailk_Bljk_I8II_BH_UserArgs_MT64x128x64_MI16x16x1_SN_LDSB1_AFC0_AFEM1_AFEM1_ASEM1_CLR1_CADS0_DTVA0_DTVB0_EPS0_FDSI0_GRPM1_GRVWA16_GRVWB8_GSUn1_GSUAMBSK_GSUC1_GSUWGMRR1_GLS0_ISA942_IU1_K1_LBSPPA512_LBSPPB128_LBSPPM0_LPA64_LPB16_LPM0_LRVW8_LWPMn1_MIAV0_MIWT4_2_MO40_NTn1_NTA0_NTB0_NTC0_NTD4_NTM0_NEPBS8_NLCA1_NLCB1_ONLL1_PGR2_PLR1_PKA1_SIA3_SS1_SU0_SUM1_SUS0_SPO0_SRVW0_SSO0_SVW4_SK0_SKXCCM0_TLDS1_ULSGRO0_USL1_UIOFGRO0_USFGROn1_VSn1_VWA4_VWB2_WSGRA0_WSGRB0_WS64_WG16_16_1_WGM1_WGMXCC4_WGMXCCGn1
    SolutionIndex: 291
    SolutionNameMin: Cijk_Ailk_Bljk_I8II_BH_UserArgs_MT96x128x128_MI16x16x1_SN_LDSB1_AFC0_AFEM1_AFEM1_ASEM1_CLR1_CADS0_DTVA0_DTVB0_EPS0_FDSI0_GRPM1_GRVWA16_GRVWB16_GSUn1_GSUAMBSK_GSUC1_GSUWGMRR1_GLS0_ISA942_IU1_K1_LBSPPA1536_LBSPPB512_LBSPPM0_LPA16_LPB32_LPM0_LRVW16_LWPMn1_MIAV0_MIWT3_4_MO40_NTn1_NTA0_NTB0_NTC0_NTD4_NTM0_NEPBS6_NLCA1_NLCB1_ONLL1_PGR2_PLR1_PKA1_SIA3_SS1_SU0_SUM1_SUS0_SPO0_SRVW0_SSO0_SVW1_SK0_SKXCCM0_TLDS1_ULSGRO0_USL1_UIOFGRO0_USFGROn1_VSn1_VWA1_VWB4_WSGRA0_WSGRB0_WS64_WG32_8_1_WGM1_WGMXCC4_WGMXCCGn1
    SolutionIndex: 292
    SolutionNameMin: Cijk_Ailk_Bljk_I8II_BH_UserArgs_MT64x160x64_MI16x16x1_SN_LDSB1_AFC0_AFEM1_AFEM1_ASEM1_CLR1_CADS0_DTVA0_DTVB0_EPS0_FDSI0_GRPM1_GRVWA16_GRVWB8_GSUn1_GSUAMBSK_GSUC1_GSUWGMRR1_GLS0_ISA942_IU1_K1_LBSPPA512_LBSPPB128_LBSPPM0_LPA32_LPB8_LPM0_LRVW8_LWPMn1_MIAV0_MIWT2_5_MO40_NTn1_NTA0_NTB0_NTC0_NTD4_NTM0_NEPBS8_NLCA1_NLCB1_ONLL1_PGR2_PLR1_PKA1_SIA3_SS1_SU0_SUM1_SUS0_SPO0_SRVW0_SSO0_SVW2_SK0_SKXCCM0_TLDS1_ULSGRO0_USL1_UIOFGRO0_USFGROn1_VSn1_VWA2_VWB1_WSGRA0_WSGRB0_WS64_WG32_8_1_WGM1_WGMXCC4_WGMXCCGn1
    SolutionIndex: 293
    SolutionNameMin: Cijk_Ailk_Bljk_I8II_BH_UserArgs_MT64x128x64_MI32x32x1_SN_LDSB1_AFC0_AFEM1_AFEM1_ASEM1_CLR1_CADS0_DTVA0_DTVB0_EPS0_FDSI0_GRPM1_GRVWA16_GRVWB16_GSUn1_GSUAMBSK_GSUC1_GSUWGMRR1_GLS0_ISA942_IU1_K1_LBSPPA0_LBSPPB128_LBSPPM0_LPA0_LPB16_LPM0_LRVW16_LWPMn1_MIAV0_MIWT1_2_MO40_NTn1_NTA0_NTB0_NTC0_NTD4_NTM0_NEPBS8_NLCA1_NLCB1_ONLL1_PGR2_PLR1_PKA1_SIA3_SS1_SU0_SUM1_SUS0_SPO0_SRVW0_SSO0_SVW1_SK0_SKXCCM0_TLDS1_ULSGRO0_USL1_UIOFGRO0_USFGROn1_VSn1_VWA1_VWB2_WSGRA0_WSGRB0_WS64_WG64_4_1_WGM1_WGMXCC4_WGMXCCGn1
    SolutionIndex: 294
    SolutionNameMin: Cijk_Ailk_Bljk_I8II_BH_UserArgs_MT64x48x64_MI16x16x1_SN_LDSB1_AFC0_AFEM1_AFEM1_ASEM1_CLR0_CADS0_DTVA0_DTVB0_EPS0_FDSI0_GRPM1_GRVWA16_GRVWB4_GSUn1_GSUAMBSK_GSUC1_GSUWGMRR1_GLS0_ISA942_IU1_K1_LBSPPA512_LBSPPB128_LBSPPM0_LPA32_LPB8_LPM0_LRVW8_LWPMn1_MIAV0_MIWT2_3_MO40_NTn1_NTA0_NTB0_NTC0_NTD4_NTM0_NEPBS8_NLCA1_NLCB1_ONLL1_PGR2_PLR0_PKA1_SIA3_SS1_SU0_SUM1_SUS0_SPO0_SRVW0_SSO0_SVW2_SK0_SKXCCM0_TLDS1_ULSGRO0_USL1_UIOFGRO0_USFGROn1_VSn1_VWA2_VWB1_WSGRA0_WSGRB0_WS64_WG32_4_2_WGM1_WGMXCC4_WGMXCCGn1
    SolutionIndex: 295
    SolutionNameMin: Cijk_Ailk_Bljk_I8II_BH_UserArgs_MT128x192x64_MI32x32x1_SN_LDSB1_AFC0_AFEM1_AFEM1_ASEM1_CLR1_CADS0_DTVA0_DTVB0_EPS0_FDSI0_GRPM1_GRVWA16_GRVWB16_GSUn1_GSUAMBSK_GSUC1_GSUWGMRR1_GLS0_ISA942_IU1_K1_LBSPPA0_LBSPPB128_LBSPPM0_LPA0_LPB16_LPM0_LRVW16_LWPMn1_MIAV0_MIWT2_3_MO40_NTn1_NTA0_NTB0_NTC0_NTD4_NTM0_NEPBS8_NLCA1_NLCB1_ONLL1_PGR2_PLR1_PKA1_SIA3_SS1_SU0_SUM1_SUS0_SPO0_SRVW0_SSO0_SVW2_SK0_SKXCCM0_TLDS1_ULSGRO0_USL1_UIOFGRO0_USFGROn1_VSn1_VWA2_VWB1_WSGRA0_WSGRB0_WS64_WG64_4_1_WGM1_WGMXCC4_WGMXCCGn1
    SolutionIndex: 296
    SolutionNameMin: Cijk_Ailk_Bljk_I8II_BH_UserArgs_MT128x96x64_MI16x16x1_SN_LDSB1_AFC0_AFEM1_AFEM1_ASEM1_CLR1_CADS0_DTVA0_DTVB0_EPS0_FDSI0_GRPM1_GRVWA16_GRVWB8_GSUn1_GSUAMBSK_GSUC1_GSUWGMRR1_GLS0_ISA942_IU1_K1_LBSPPA1024_LBSPPB128_LBSPPM0_LPA64_LPB8_LPM0_LRVW8_LWPMn1_MIAV0_MIWT4_3_MO40_NTn1_NTA0_NTB0_NTC0_NTD4_NTM0_NEPBS8_NLCA1_NLCB1_ONLL1_PGR2_PLR1_PKA1_SIA3_SS1_SU0_SUM1_SUS0_SPO0_SRVW0_SSO0_SVW4_SK0_SKXCCM0_TLDS1_ULSGRO0_USL1_UIOFGRO0_USFGROn1_VSn1_VWA4_VWB1_WSGRA0_WSGRB0_WS64_WG32_8_1_WGM1_WGMXCC4_WGMXCCGn1
    SolutionIndex: 297
    SolutionNameMin: Cijk_Ailk_Bljk_I8II_BH_UserArgs_MT128x192x64_MI16x16x1_SN_LDSB1_AFC0_AFEM1_AFEM1_ASEM1_CLR1_CADS0_DTVA0_DTVB0_EPS0_FDSI0_GRPM1_GRVWA16_GRVWB8_GSUn1_GSUAMBSK_GSUC1_GSUWGMRR1_GLS0_ISA942_IU1_K1_LBSPPA1024_LBSPPB128_LBSPPM0_LPA64_LPB16_LPM0_LRVW8_LWPMn1_MIAV0_MIWT4_6_MO40_NTn1_NTA0_NTB0_NTC0_NTD4_NTM0_NEPBS8_NLCA1_NLCB1_ONLL1_PGR2_PLR1_PKA1_SIA3_SS1_SU0_SUM1_SUS0_SPO0_SRVW0_SSO0_SVW4_SK0_SKXCCM0_TLDS1_ULSGRO0_USL1_UIOFGRO0_USFGROn1_VSn1_VWA4_VWB2_WSGRA0_WSGRB0_WS64_WG32_8_1_WGM1_WGMXCC4_WGMXCCGn1
    SolutionIndex: 298
    SolutionNameMin: Cijk_Ailk_Bljk_I8II_BH_UserArgs_MT128x48x64_MI16x16x1_SN_LDSB1_AFC0_AFEM1_AFEM1_ASEM1_CLR1_CADS0_DTVA0_DTVB0_EPS0_FDSI0_GRPM1_GRVWA16_GRVWB4_GSUn1_GSUAMBSK_GSUC1_GSUWGMRR1_GLS0_ISA942_IU1_K1_LBSPPA1024_LBSPPB128_LBSPPM0_LPA32_LPB8_LPM0_LRVW8_LWPMn1_MIAV0_MIWT2_3_MO40_NTn1_NTA0_NTB0_NTC0_NTD4_NTM0_NEPBS8_NLCA1_NLCB1_ONLL1_PGR2_PLR1_PKA1_SIA3_SS1_SU0_SUM1_SUS0_SPO0_SRVW0_SSO0_SVW2_SK0_SKXCCM0_TLDS1_ULSGRO0_USL1_UIOFGRO0_USFGROn1_VSn1_VWA2_VWB1_WSGRA0_WSGRB0_WS64_WG64_4_1_WGM1_WGMXCC4_WGMXCCGn1
    SolutionIndex: 299
    SolutionNameMin: Cijk_Ailk_Bljk_I8II_BH_UserArgs_MT256x96x64_MI16x16x1_SN_LDSB1_AFC0_AFEM1_AFEM1_ASEM1_CLR1_CADS0_DTVA0_DTVB0_EPS0_FDSI0_GRPM1_GRVWA16_GRVWB8_GSUn1_GSUAMBSK_GSUC1_GSUWGMRR1_GLS0_ISA942_IU1_K1_LBSPPA2048_LBSPPB128_LBSPPM0_LPA64_LPB8_LPM0_LRVW8_LWPMn1_MIAV0_MIWT4_6_MO40_NTn1_NTA0_NTB0_NTC0_NTD4_NTM0_NEPBS8_NLCA1_NLCB1_ONLL1_PGR2_PLR1_PKA1_SIA3_SS1_SU0_SUM1_SUS0_SPO0_SRVW0_SSO0_SVW4_SK0_SKXCCM0_TLDS1_ULSGRO0_USL1_UIOFGRO0_USFGROn1_VSn1_VWA4_VWB2_WSGRA0_WSGRB0_WS64_WG64_4_1_WGM1_WGMXCC4_WGMXCCGn1
- - - [7, 7, 1, 2048]
    - [0, 26.9461]
  - - [7, 7, 1, 8192]
    - [0, 90.7839]
  - - [7, 7, 1, 32768]
    - [0, 277.373]
  - - [16, 7, 1, 2048]
    - [1, 73.2173]
  - - [16, 7, 1, 8192]
    - [1, 216.538]
  - - [16, 7, 1, 32768]
    - [1, 714.173]
  - - [32, 7, 1, 2048]
    - [1, 141.912]
  - - [32, 7, 1, 8192]
    - [2, 435.114]
  - - [32, 7, 1, 32768]
    - [1, 1381.78]
  - - [48, 7, 1, 2048]
    - [1, 210.752]
  - - [48, 7, 1, 8192]
    - [2, 629.683]
  - - [48, 7, 1, 32768]
    - [1, 2026.17]
  - - [64, 7, 1, 2048]
    - [1, 276.086]
  - - [64, 7, 1, 8192]
    - [1, 793.784]
  - - [64, 7, 1, 32768]
    - [3, 2487.06]
  - - [80, 7, 1, 2048]
    - [1, 333.85]
  - - [80, 7, 1, 8192]
    - [4, 962.275]
  - - [80, 7, 1, 32768]
    - [3, 2941.59]
  - - [96, 7, 1, 2048]
    - [1, 393.075]
  - - [96, 7, 1, 8192]
    - [5, 1144.43]
  - - [96, 7, 1, 32768]
    - [3, 3483.34]
  - - [112, 7, 1, 2048]
    - [1, 451.022]
  - - [112, 7, 1, 8192]
    - [4, 1310.91]
  - - [112, 7, 1, 32768]
    - [3, 3899.79]
  - - [128, 7, 1, 2048]
    - [2, 498.661]
  - - [128, 7, 1, 8192]
    - [3, 1463.75]
  - - [128, 7, 1, 32768]
    - [6, 4287.05]
  - - [160, 7, 1, 2048]
    - [1, 622.953]
  - - [160, 7, 1, 8192]
    - [3, 1842.36]
  - - [160, 7, 1, 32768]
    - [3, 5175.66]
  - - [192, 7, 1, 2048]
    - [2, 743.778]
  - - [192, 7, 1, 8192]
    - [3, 2193.35]
  - - [192, 7, 1, 32768]
    - [6, 6262.13]
  - - [224, 7, 1, 2048]
    - [1, 867.834]
  - - [224, 7, 1, 8192]
    - [3, 2546.9]
  - - [224, 7, 1, 32768]
    - [3, 6763.86]
  - - [256, 7, 1, 2048]
    - [7, 863.292]
  - - [256, 7, 1, 8192]
    - [8, 2819.63]
  - - [256, 7, 1, 32768]
    - [8, 7396.74]
  - - [320, 7, 1, 2048]
    - [1, 1226.28]
  - - [320, 7, 1, 8192]
    - [6, 3305.14]
  - - [320, 7, 1, 32768]
    - [9, 7625.88]
  - - [384, 7, 1, 2048]
    - [1, 1441.11]
  - - [384, 7, 1, 8192]
    - [6, 3787.31]
  - - [384, 7, 1, 32768]
    - [6, 8858.46]
  - - [448, 7, 1, 2048]
    - [1, 1689.89]
  - - [448, 7, 1, 8192]
    - [6, 4386.62]
  - - [448, 7, 1, 32768]
    - [6, 10230.1]
  - - [512, 7, 1, 2048]
    - [10, 1567.45]
  - - [512, 7, 1, 8192]
    - [10, 3953.75]
  - - [512, 7, 1, 32768]
    - [11, 8049.4]
  - - [576, 7, 1, 2048]
    - [2, 2142.44]
  - - [576, 7, 1, 8192]
    - [12, 5501.71]
  - - [576, 7, 1, 32768]
    - [12, 12594.5]
  - - [640, 7, 1, 2048]
    - [2, 2343.79]
  - - [640, 7, 1, 8192]
    - [13, 5952.61]
  - - [640, 7, 1, 32768]
    - [12, 13741.3]
  - - [768, 7, 1, 2048]
    - [14, 2430.57]
  - - [768, 7, 1, 8192]
    - [15, 6261.77]
  - - [768, 7, 1, 32768]
    - [15, 12403.3]
  - - [896, 7, 1, 2048]
    - [2, 3235.42]
  - - [896, 7, 1, 8192]
    - [15, 7672.34]
  - - [896, 7, 1, 32768]
    - [15, 16103.4]
  - - [1024, 7, 1, 2048]
    - [11, 3021.97]
  - - [1024, 7, 1, 8192]
    - [16, 7302.51]
  - - [1024, 7, 1, 32768]
    - [17, 13595.8]
  - - [1280, 7, 1, 2048]
    - [11, 3789.35]
  - - [1280, 7, 1, 8192]
    - [16, 10072.0]
  - - [1280, 7, 1, 32768]
    - [16, 18663.6]
  - - [1536, 7, 1, 2048]
    - [11, 3912.35]
  - - [1536, 7, 1, 8192]
    - [18, 9716.26]
  - - [1536, 7, 1, 32768]
    - [17, 16396.2]
  - - [1792, 7, 1, 2048]
    - [17, 4674.29]
  - - [1792, 7, 1, 8192]
    - [17, 11840.2]
  - - [1792, 7, 1, 32768]
    - [15, 20282.3]
  - - [2048, 7, 1, 2048]
    - [17, 5073.18]
  - - [2048, 7, 1, 8192]
    - [17, 12202.9]
  - - [2048, 7, 1, 32768]
    - [17, 18712.9]
  - - [2304, 7, 1, 2048]
    - [19, 5914.23]
  - - [2304, 7, 1, 8192]
    - [17, 14917.1]
  - - [2304, 7, 1, 32768]
    - [17, 23983.2]
  - - [2560, 7, 1, 2048]
    - [17, 6168.62]
  - - [2560, 7, 1, 8192]
    - [17, 14923.5]
  - - [2560, 7, 1, 32768]
    - [17, 22968.8]
  - - [2816, 7, 1, 2048]
    - [17, 6691.02]
  - - [2816, 7, 1, 8192]
    - [17, 16466.6]
  - - [2816, 7, 1, 32768]
    - [17, 26016.6]
  - - [3072, 7, 1, 2048]
    - [17, 6989.28]
  - - [3072, 7, 1, 8192]
    - [17, 15299.0]
  - - [3072, 7, 1, 32768]
    - [17, 21847.2]
  - - [3584, 7, 1, 2048]
    - [17, 7433.14]
  - - [3584, 7, 1, 8192]
    - [17, 15986.1]
  - - [3584, 7, 1, 32768]
    - [17, 21646.4]
  - - [4096, 7, 1, 2048]
    - [20, 9142.51]
  - - [4096, 7, 1, 8192]
    - [17, 17876.3]
  - - [4096, 7, 1, 32768]
    - [20, 26699.4]
  - - [4608, 7, 1, 2048]
    - [20, 10043.9]
  - - [4608, 7, 1, 8192]
    - [21, 20310.7]
  - - [4608, 7, 1, 32768]
    - [20, 29060.1]
  - - [5120, 7, 1, 2048]
    - [20, 11017.2]
  - - [5120, 7, 1, 8192]
    - [20, 22376.1]
  - - [5120, 7, 1, 32768]
    - [20, 31881.3]
  - - [5632, 7, 1, 2048]
    - [20, 11761.5]
  - - [5632, 7, 1, 8192]
    - [20, 22860.4]
  - - [5632, 7, 1, 32768]
    - [20, 31719.1]
  - - [6144, 7, 1, 2048]
    - [20, 12244.4]
  - - [6144, 7, 1, 8192]
    - [20, 22798.7]
  - - [6144, 7, 1, 32768]
    - [20, 30488.6]
  - - [7168, 7, 1, 2048]
    - [20, 12629.2]
  - - [7168, 7, 1, 8192]
    - [20, 23517.4]
  - - [7168, 7, 1, 32768]
    - [20, 30141.4]
  - - [8192, 7, 1, 2048]
    - [20, 14890.1]
  - - [8192, 7, 1, 8192]
    - [20, 26699.4]
  - - [8192, 7, 1, 32768]
    - [20, 34025.2]
  - - [10240, 7, 1, 2048]
    - [20, 16738.6]
  - - [10240, 7, 1, 8192]
    - [20, 28424.2]
  - - [10240, 7, 1, 32768]
    - [20, 34576.7]
  - - [12288, 7, 1, 2048]
    - [20, 17166.9]
  - - [12288, 7, 1, 8192]
    - [20, 28034.5]
  - - [12288, 7, 1, 32768]
    - [20, 33020.8]
  - - [14336, 7, 1, 2048]
    - [20, 18365.2]
  - - [14336, 7, 1, 8192]
    - [20, 28382.3]
  - - [14336, 7, 1, 32768]
    - [20, 33333.0]
  - - [16384, 7, 1, 2048]
    - [17, 18703.8]
  - - [16384, 7, 1, 8192]
    - [20, 29253.3]
  - - [16384, 7, 1, 32768]
    - [20, 34595.7]
  - - [20480, 7, 1, 2048]
    - [17, 22790.4]
  - - [20480, 7, 1, 8192]
    - [20, 32104.9]
  - - [20480, 7, 1, 32768]
    - [20, 35912.6]
  - - [24576, 7, 1, 2048]
    - [20, 21667.4]
  - - [24576, 7, 1, 8192]
    - [20, 30843.7]
  - - [24576, 7, 1, 32768]
    - [20, 34525.7]
  - - [28672, 7, 1, 2048]
    - [20, 23399.3]
  - - [28672, 7, 1, 8192]
    - [20, 31254.3]
  - - [28672, 7, 1, 32768]
    - [20, 34537.7]
  - - [32768, 7, 1, 2048]
    - [20, 25655.9]
  - - [32768, 7, 1, 8192]
    - [20, 32484.7]
  - - [32768, 7, 1, 32768]
    - [20, 36405.9]
  - - [40960, 7, 1, 2048]
    - [20, 31507.5]
  - - [40960, 7, 1, 8192]
    - [20, 36016.4]
  - - [40960, 7, 1, 32768]
    - [20, 35810.0]
  - - [49152, 7, 1, 2048]
    - [20, 26909.9]
  - - [49152, 7, 1, 8192]
    - [20, 32493.1]
  - - [49152, 7, 1, 32768]
    - [20, 35078.1]
  - - [57344, 7, 1, 2048]
    - [20, 29684.8]
  - - [57344, 7, 1, 8192]
    - [20, 32376.4]
  - - [57344, 7, 1, 32768]
    - [22, 34112.3]
  - - [65536, 7, 1, 2048]
    - [20, 26893.9]
  - - [65536, 7, 1, 8192]
    - [20, 33238.0]
  - - [65536, 7, 1, 32768]
    - [22, 36016.7]
  - - [98304, 7, 1, 2048]
    - [20, 31599.3]
  - - [98304, 7, 1, 8192]
    - [20, 34372.1]
  - - [98304, 7, 1, 32768]
    - [23, 33534.5]
  - - [131072, 7, 1, 2048]
    - [22, 30366.8]
  - - [131072, 7, 1, 8192]
    - [20, 32833.4]
  - - [262144, 7, 1, 2048]
    - [24, 24674.6]
  - - [262144, 7, 1, 8192]
    - [24, 28573.2]
  - - [15360, 7, 1, 2048]
    - [20, 19622.6]
  - - [15360, 7, 1, 8192]
    - [20, 29628.3]
  - - [15360, 7, 1, 32768]
    - [20, 33649.6]
  - - [22528, 7, 1, 2048]
    - [20, 20258.9]
  - - [22528, 7, 1, 8192]
    - [20, 29643.6]
  - - [22528, 7, 1, 32768]
    - [20, 33446.1]
  - - [38016, 7, 1, 2048]
    - [20, 30674.9]
  - - [38016, 7, 1, 8192]
    - [20, 34826.3]
  - - [38016, 7, 1, 32768]
    - [25, 10156.4]
  - - [163840, 7, 1, 2048]
    - [0, 4770.21]
  - - [163840, 7, 1, 8192]
    - [25, 5226.99]
  - - [16, 16, 1, 2048]
    - [26, 168.204]
  - - [16, 16, 1, 8192]
    - [1, 499.29]
  - - [16, 16, 1, 32768]
    - [27, 1542.61]
  - - [32, 16, 1, 2048]
    - [2, 325.502]
  - - [32, 16, 1, 8192]
    - [1, 979.003]
  - - [32, 16, 1, 32768]
    - [27, 2976.81]
  - - [48, 16, 1, 2048]
    - [2, 481.215]
  - - [48, 16, 1, 8192]
    - [3, 1357.48]
  - - [48, 16, 1, 32768]
    - [7, 4071.33]
  - - [64, 16, 1, 2048]
    - [1, 626.633]
  - - [64, 16, 1, 8192]
    - [3, 1793.37]
  - - [64, 16, 1, 32768]
    - [7, 5340.8]
  - - [80, 16, 1, 2048]
    - [2, 763.177]
  - - [80, 16, 1, 8192]
    - [3, 2185.61]
  - - [80, 16, 1, 32768]
    - [7, 6387.41]
  - - [96, 16, 1, 2048]
    - [2, 896.711]
  - - [96, 16, 1, 8192]
    - [7, 2608.88]
  - - [96, 16, 1, 32768]
    - [7, 7569.92]
  - - [112, 16, 1, 2048]
    - [2, 1024.9]
  - - [112, 16, 1, 8192]
    - [8, 2897.04]
  - - [112, 16, 1, 32768]
    - [28, 7768.67]
  - - [128, 16, 1, 2048]
    - [26, 1112.41]
  - - [128, 16, 1, 8192]
    - [8, 3316.28]
  - - [128, 16, 1, 32768]
    - [8, 8804.7]
  - - [160, 16, 1, 2048]
    - [2, 1406.89]
  - - [160, 16, 1, 8192]
    - [29, 3901.99]
  - - [160, 16, 1, 32768]
    - [30, 8930.31]
  - - [192, 16, 1, 2048]
    - [2, 1694.01]
  - - [192, 16, 1, 8192]
    - [7, 4658.93]
  - - [192, 16, 1, 32768]
    - [30, 10686.0]
  - - [224, 16, 1, 2048]
    - [1, 1977.2]
  - - [224, 16, 1, 8192]
    - [8, 5204.6]
  - - [224, 16, 1, 32768]
    - [31, 10917.0]
  - - [256, 16, 1, 2048]
    - [32, 1898.66]
  - - [256, 16, 1, 8192]
    - [8, 5811.81]
  - - [256, 16, 1, 32768]
    - [8, 11638.2]
  - - [320, 16, 1, 2048]
    - [1, 2763.97]
  - - [320, 16, 1, 8192]
    - [8, 7295.92]
  - - [320, 16, 1, 32768]
    - [8, 15415.6]
  - - [384, 16, 1, 2048]
    - [1, 3283.97]
  - - [384, 16, 1, 8192]
    - [8, 8543.3]
  - - [384, 16, 1, 32768]
    - [8, 18476.0]
  - - [448, 16, 1, 2048]
    - [33, 3641.54]
  - - [448, 16, 1, 8192]
    - [34, 9737.57]
  - - [448, 16, 1, 32768]
    - [35, 20716.1]
  - - [512, 16, 1, 2048]
    - [34, 3485.46]
  - - [512, 16, 1, 8192]
    - [34, 9166.56]
  - - [512, 16, 1, 32768]
    - [36, 17734.2]
  - - [576, 16, 1, 2048]
    - [33, 4563.97]
  - - [576, 16, 1, 8192]
    - [34, 12360.3]
  - - [576, 16, 1, 32768]
    - [35, 26950.4]
  - - [640, 16, 1, 2048]
    - [33, 5100.49]
  - - [640, 16, 1, 8192]
    - [34, 13682.9]
  - - [640, 16, 1, 32768]
    - [35, 29484.4]
  - - [768, 16, 1, 2048]
    - [37, 5182.44]
  - - [768, 16, 1, 8192]
    - [16, 13837.4]
  - - [768, 16, 1, 32768]
    - [34, 26751.8]
  - - [896, 16, 1, 2048]
    - [19, 6804.31]
  - - [896, 16, 1, 8192]
    - [34, 15965.4]
  - - [896, 16, 1, 32768]
    - [34, 29343.5]
  - - [1024, 16, 1, 2048]
    - [11, 6382.93]
  - - [1024, 16, 1, 8192]
    - [38, 15883.3]
  - - [1024, 16, 1, 32768]
    - [39, 28083.1]
  - - [1280, 16, 1, 2048]
    - [34, 7922.77]
  - - [1280, 16, 1, 8192]
    - [36, 21133.0]
  - - [1280, 16, 1, 32768]
    - [36, 39416.9]
  - - [1536, 16, 1, 2048]
    - [11, 8532.27]
  - - [1536, 16, 1, 8192]
    - [11, 21801.7]
  - - [1536, 16, 1, 32768]
    - [17, 36348.1]
  - - [1792, 16, 1, 2048]
    - [12, 10696.6]
  - - [1792, 16, 1, 8192]
    - [17, 26026.2]
  - - [1792, 16, 1, 32768]
    - [17, 43242.2]
  - - [2048, 16, 1, 2048]
    - [11, 10918.8]
  - - [2048, 16, 1, 8192]
    - [11, 26095.4]
  - - [2048, 16, 1, 32768]
    - [17, 41602.7]
  - - [2304, 16, 1, 2048]
    - [12, 13695.3]
  - - [2304, 16, 1, 8192]
    - [17, 33211.4]
  - - [2304, 16, 1, 32768]
    - [17, 54243.3]
  - - [2560, 16, 1, 2048]
    - [34, 12879.8]
  - - [2560, 16, 1, 8192]
    - [17, 33350.5]
  - - [2560, 16, 1, 32768]
    - [17, 52163.4]
  - - [2816, 16, 1, 2048]
    - [12, 16495.7]
  - - [2816, 16, 1, 8192]
    - [17, 36891.3]
  - - [2816, 16, 1, 32768]
    - [17, 59208.8]
  - - [3072, 16, 1, 2048]
    - [34, 14648.7]
  - - [3072, 16, 1, 8192]
    - [24, 32153.5]
  - - [3072, 16, 1, 32768]
    - [21, 51688.9]
  - - [3584, 16, 1, 2048]
    - [37, 16134.7]
  - - [3584, 16, 1, 8192]
    - [17, 35668.2]
  - - [3584, 16, 1, 32768]
    - [21, 50209.5]
  - - [4096, 16, 1, 2048]
    - [34, 19418.4]
  - - [4096, 16, 1, 8192]
    - [17, 38287.0]
  - - [4096, 16, 1, 32768]
    - [21, 55820.0]
  - - [4608, 16, 1, 2048]
    - [34, 21915.6]
  - - [4608, 16, 1, 8192]
    - [21, 44692.5]
  - - [4608, 16, 1, 32768]
    - [21, 62876.2]
  - - [5120, 16, 1, 2048]
    - [34, 24112.0]
  - - [5120, 16, 1, 8192]
    - [21, 47344.4]
  - - [5120, 16, 1, 32768]
    - [21, 68915.0]
  - - [5632, 16, 1, 2048]
    - [18, 23195.3]
  - - [5632, 16, 1, 8192]
    - [21, 48652.3]
  - - [5632, 16, 1, 32768]
    - [21, 67900.4]
  - - [6144, 16, 1, 2048]
    - [15, 24009.5]
  - - [6144, 16, 1, 8192]
    - [21, 46533.8]
  - - [6144, 16, 1, 32768]
    - [21, 64403.7]
  - - [7168, 16, 1, 2048]
    - [21, 26858.4]
  - - [7168, 16, 1, 8192]
    - [21, 50444.6]
  - - [7168, 16, 1, 32768]
    - [21, 64822.2]
  - - [8192, 16, 1, 2048]
    - [20, 29202.7]
  - - [8192, 16, 1, 8192]
    - [21, 57064.5]
  - - [8192, 16, 1, 32768]
    - [21, 74022.4]
  - - [10240, 16, 1, 2048]
    - [20, 35172.5]
  - - [10240, 16, 1, 8192]
    - [21, 60751.7]
  - - [10240, 16, 1, 32768]
    - [21, 74592.7]
  - - [12288, 16, 1, 2048]
    - [20, 37527.0]
  - - [12288, 16, 1, 8192]
    - [20, 59260.4]
  - - [12288, 16, 1, 32768]
    - [21, 68988.8]
  - - [14336, 16, 1, 2048]
    - [24, 37717.7]
  - - [14336, 16, 1, 8192]
    - [24, 57687.3]
  - - [14336, 16, 1, 32768]
    - [24, 65055.0]
  - - [16384, 16, 1, 2048]
    - [17, 41984.3]
  - - [16384, 16, 1, 8192]
    - [21, 56100.6]
  - - [16384, 16, 1, 32768]
    - [40, 67978.9]
  - - [20480, 16, 1, 2048]
    - [17, 51794.3]
  - - [20480, 16, 1, 8192]
    - [21, 69463.8]
  - - [20480, 16, 1, 32768]
    - [21, 76202.0]
  - - [24576, 16, 1, 2048]
    - [24, 44685.9]
  - - [24576, 16, 1, 8192]
    - [21, 60691.8]
  - - [24576, 16, 1, 32768]
    - [21, 74178.3]
  - - [28672, 16, 1, 2048]
    - [24, 49355.5]
  - - [28672, 16, 1, 8192]
    - [20, 64934.5]
  - - [28672, 16, 1, 32768]
    - [20, 71678.8]
  - - [32768, 16, 1, 2048]
    - [20, 55789.5]
  - - [32768, 16, 1, 8192]
    - [20, 69308.7]
  - - [32768, 16, 1, 32768]
    - [20, 77700.8]
  - - [40960, 16, 1, 2048]
    - [21, 68481.4]
  - - [40960, 16, 1, 8192]
    - [21, 78384.9]
  - - [40960, 16, 1, 32768]
    - [41, 80736.0]
  - - [49152, 16, 1, 2048]
    - [24, 59736.3]
  - - [49152, 16, 1, 8192]
    - [20, 69691.2]
  - - [49152, 16, 1, 32768]
    - [22, 74349.4]
  - - [57344, 16, 1, 2048]
    - [23, 68236.2]
  - - [57344, 16, 1, 8192]
    - [23, 77268.3]
  - - [65536, 16, 1, 2048]
    - [22, 58010.0]
  - - [65536, 16, 1, 8192]
    - [20, 63799.3]
  - - [98304, 16, 1, 2048]
    - [20, 68086.3]
  - - [98304, 16, 1, 8192]
    - [20, 73606.6]
  - - [131072, 16, 1, 2048]
    - [20, 65995.3]
  - - [131072, 16, 1, 8192]
    - [20, 71109.2]
  - - [262144, 16, 1, 2048]
    - [24, 60980.2]
  - - [262144, 16, 1, 8192]
    - [24, 64233.1]
  - - [15360, 16, 1, 2048]
    - [17, 39699.4]
  - - [15360, 16, 1, 8192]
    - [23, 67155.9]
  - - [15360, 16, 1, 32768]
    - [23, 79961.5]
  - - [22528, 16, 1, 2048]
    - [0, 11023.4]
  - - [22528, 16, 1, 8192]
    - [0, 11099.0]
  - - [22528, 16, 1, 32768]
    - [25, 12121.2]
  - - [38016, 16, 1, 2048]
    - [42, 27985.4]
  - - [38016, 16, 1, 8192]
    - [42, 34877.9]
  - - [38016, 16, 1, 32768]
    - [43, 36013.3]
  - - [163840, 16, 1, 2048]
    - [44, 15040.7]
  - - [163840, 16, 1, 8192]
    - [45, 14014.8]
  - - [16, 32, 1, 2048]
    - [1, 277.688]
  - - [16, 32, 1, 8192]
    - [46, 908.641]
  - - [16, 32, 1, 32768]
    - [7, 2709.39]
  - - [32, 32, 1, 2048]
    - [1, 653.198]
  - - [32, 32, 1, 8192]
    - [7, 1811.85]
  - - [32, 32, 1, 32768]
    - [7, 5466.02]
  - - [48, 32, 1, 2048]
    - [26, 944.133]
  - - [48, 32, 1, 8192]
    - [46, 2627.78]
  - - [48, 32, 1, 32768]
    - [3, 7706.06]
  - - [64, 32, 1, 2048]
    - [2, 1236.89]
  - - [64, 32, 1, 8192]
    - [7, 3490.41]
  - - [64, 32, 1, 32768]
    - [6, 10054.1]
  - - [80, 32, 1, 2048]
    - [1, 1533.96]
  - - [80, 32, 1, 8192]
    - [7, 4011.67]
  - - [80, 32, 1, 32768]
    - [30, 9169.02]
  - - [96, 32, 1, 2048]
    - [1, 1789.64]
  - - [96, 32, 1, 8192]
    - [7, 4821.21]
  - - [96, 32, 1, 32768]
    - [30, 10952.2]
  - - [112, 32, 1, 2048]
    - [1, 2051.3]
  - - [112, 32, 1, 8192]
    - [7, 5497.85]
  - - [112, 32, 1, 32768]
    - [30, 12629.6]
  - - [128, 32, 1, 2048]
    - [1, 2270.44]
  - - [128, 32, 1, 8192]
    - [7, 6207.3]
  - - [128, 32, 1, 32768]
    - [30, 14294.3]
  - - [160, 32, 1, 2048]
    - [1, 2837.43]
  - - [160, 32, 1, 8192]
    - [31, 7474.19]
  - - [160, 32, 1, 32768]
    - [31, 15495.0]
  - - [192, 32, 1, 2048]
    - [47, 3223.09]
  - - [192, 32, 1, 8192]
    - [31, 8890.27]
  - - [192, 32, 1, 32768]
    - [31, 18536.7]
  - - [224, 32, 1, 2048]
    - [48, 3742.6]
  - - [224, 32, 1, 8192]
    - [31, 10386.0]
  - - [224, 32, 1, 32768]
    - [31, 21653.7]
  - - [256, 32, 1, 2048]
    - [49, 3735.3]
  - - [256, 32, 1, 8192]
    - [8, 11619.6]
  - - [256, 32, 1, 32768]
    - [8, 23332.3]
  - - [320, 32, 1, 2048]
    - [47, 5271.14]
  - - [320, 32, 1, 8192]
    - [50, 13345.6]
  - - [320, 32, 1, 32768]
    - [51, 28133.0]
  - - [384, 32, 1, 2048]
    - [19, 5843.66]
  - - [384, 32, 1, 8192]
    - [50, 15464.8]
  - - [384, 32, 1, 32768]
    - [51, 33498.9]
  - - [448, 32, 1, 2048]
    - [19, 6737.32]
  - - [448, 32, 1, 8192]
    - [50, 18291.8]
  - - [448, 32, 1, 32768]
    - [51, 38955.4]
  - - [512, 32, 1, 2048]
    - [52, 6876.7]
  - - [512, 32, 1, 8192]
    - [53, 17386.7]
  - - [512, 32, 1, 32768]
    - [50, 31282.7]
  - - [576, 32, 1, 2048]
    - [19, 8630.51]
  - - [576, 32, 1, 8192]
    - [50, 22949.1]
  - - [576, 32, 1, 32768]
    - [51, 49710.4]
  - - [640, 32, 1, 2048]
    - [19, 9677.72]
  - - [640, 32, 1, 8192]
    - [54, 21826.3]
  - - [640, 32, 1, 32768]
    - [55, 40920.7]
  - - [768, 32, 1, 2048]
    - [29, 9264.91]
  - - [768, 32, 1, 8192]
    - [50, 25042.1]
  - - [768, 32, 1, 32768]
    - [36, 47671.4]
  - - [896, 32, 1, 2048]
    - [56, 11833.0]
  - - [896, 32, 1, 8192]
    - [53, 29009.7]
  - - [896, 32, 1, 32768]
    - [36, 56610.8]
  - - [1024, 32, 1, 2048]
    - [11, 11577.8]
  - - [1024, 32, 1, 8192]
    - [38, 33059.8]
  - - [1024, 32, 1, 32768]
    - [36, 52244.4]
  - - [1280, 32, 1, 2048]
    - [57, 14958.6]
  - - [1280, 32, 1, 8192]
    - [50, 39730.8]
  - - [1280, 32, 1, 32768]
    - [58, 67115.4]
  - - [1536, 32, 1, 2048]
    - [52, 16125.8]
  - - [1536, 32, 1, 8192]
    - [36, 41462.0]
  - - [1536, 32, 1, 32768]
    - [39, 60371.4]
  - - [1792, 32, 1, 2048]
    - [59, 19913.3]
  - - [1792, 32, 1, 8192]
    - [60, 46602.3]
  - - [1792, 32, 1, 32768]
    - [39, 77050.8]
  - - [2048, 32, 1, 2048]
    - [34, 20607.7]
  - - [2048, 32, 1, 8192]
    - [38, 48360.0]
  - - [2048, 32, 1, 32768]
    - [39, 77695.8]
  - - [2304, 32, 1, 2048]
    - [59, 25276.4]
  - - [2304, 32, 1, 8192]
    - [60, 58350.7]
  - - [2304, 32, 1, 32768]
    - [39, 96820.9]
  - - [2560, 32, 1, 2048]
    - [34, 24956.9]
  - - [2560, 32, 1, 8192]
    - [39, 59251.6]
  - - [2560, 32, 1, 32768]
    - [39, 95315.5]
  - - [2816, 32, 1, 2048]
    - [35, 30479.1]
  - - [2816, 32, 1, 8192]
    - [61, 57498.5]
  - - [2816, 32, 1, 32768]
    - [61, 90713.0]
  - - [3072, 32, 1, 2048]
    - [50, 27235.6]
  - - [3072, 32, 1, 8192]
    - [39, 53047.2]
  - - [3072, 32, 1, 32768]
    - [62, 78629.2]
  - - [3584, 32, 1, 2048]
    - [50, 31909.2]
  - - [3584, 32, 1, 8192]
    - [39, 63429.6]
  - - [3584, 32, 1, 32768]
    - [39, 91474.5]
  - - [4096, 32, 1, 2048]
    - [50, 36084.3]
  - - [4096, 32, 1, 8192]
    - [63, 68012.8]
  - - [4096, 32, 1, 32768]
    - [39, 99939.0]
  - - [4608, 32, 1, 2048]
    - [50, 40600.4]
  - - [4608, 32, 1, 8192]
    - [40, 78426.5]
  - - [4608, 32, 1, 32768]
    - [40, 113301.0]
  - - [5120, 32, 1, 2048]
    - [50, 44588.7]
  - - [5120, 32, 1, 8192]
    - [40, 80814.0]
  - - [5120, 32, 1, 32768]
    - [40, 123282.0]
  - - [5632, 32, 1, 2048]
    - [36, 42191.6]
  - - [5632, 32, 1, 8192]
    - [40, 87955.8]
  - - [5632, 32, 1, 32768]
    - [40, 122604.0]
  - - [6144, 32, 1, 2048]
    - [64, 43770.6]
  - - [6144, 32, 1, 8192]
    - [63, 84565.1]
  - - [6144, 32, 1, 32768]
    - [40, 116868.0]
  - - [7168, 32, 1, 2048]
    - [40, 46621.1]
  - - [7168, 32, 1, 8192]
    - [40, 89975.2]
  - - [7168, 32, 1, 32768]
    - [40, 116964.0]
  - - [8192, 32, 1, 2048]
    - [36, 53968.3]
  - - [8192, 32, 1, 8192]
    - [40, 94422.4]
  - - [8192, 32, 1, 32768]
    - [40, 131551.0]
  - - [10240, 32, 1, 2048]
    - [36, 65641.6]
  - - [10240, 32, 1, 8192]
    - [40, 107359.0]
  - - [10240, 32, 1, 32768]
    - [40, 134639.0]
  - - [12288, 32, 1, 2048]
    - [64, 61794.5]
  - - [12288, 32, 1, 8192]
    - [40, 102599.0]
  - - [12288, 32, 1, 32768]
    - [40, 124680.0]
  - - [14336, 32, 1, 2048]
    - [39, 67348.9]
  - - [14336, 32, 1, 8192]
    - [64, 104099.0]
  - - [14336, 32, 1, 32768]
    - [64, 122832.0]
  - - [16384, 32, 1, 2048]
    - [39, 78160.8]
  - - [16384, 32, 1, 8192]
    - [64, 108897.0]
  - - [16384, 32, 1, 32768]
    - [40, 134409.0]
  - - [20480, 32, 1, 2048]
    - [39, 94089.8]
  - - [20480, 32, 1, 8192]
    - [40, 120982.0]
  - - [20480, 32, 1, 32768]
    - [40, 138070.0]
  - - [24576, 32, 1, 2048]
    - [63, 80377.5]
  - - [24576, 32, 1, 8192]
    - [64, 112406.0]
  - - [24576, 32, 1, 32768]
    - [64, 132821.0]
  - - [28672, 32, 1, 2048]
    - [63, 88522.2]
  - - [28672, 32, 1, 8192]
    - [65, 112762.0]
  - - [32768, 32, 1, 2048]
    - [66, 96763.6]
  - - [32768, 32, 1, 8192]
    - [67, 115782.0]
  - - [40960, 32, 1, 2048]
    - [66, 119647.0]
  - - [40960, 32, 1, 8192]
    - [66, 138396.0]
  - - [49152, 32, 1, 2048]
    - [65, 98522.6]
  - - [49152, 32, 1, 8192]
    - [67, 118040.0]
  - - [57344, 32, 1, 2048]
    - [64, 111398.0]
  - - [57344, 32, 1, 8192]
    - [64, 125178.0]
  - - [65536, 32, 1, 2048]
    - [64, 99750.5]
  - - [65536, 32, 1, 8192]
    - [64, 119214.0]
  - - [98304, 32, 1, 2048]
    - [64, 118064.0]
  - - [98304, 32, 1, 8192]
    - [64, 130616.0]
  - - [131072, 32, 1, 2048]
    - [64, 109495.0]
  - - [131072, 32, 1, 8192]
    - [67, 128243.0]
  - - [262144, 32, 1, 2048]
    - [67, 123757.0]
  - - [262144, 32, 1, 8192]
    - [68, 3738.5]
  - - [15360, 32, 1, 2048]
    - [69, 15983.1]
  - - [15360, 32, 1, 8192]
    - [69, 21798.8]
  - - [15360, 32, 1, 32768]
    - [70, 32516.3]
  - - [22528, 32, 1, 2048]
    - [71, 26664.5]
  - - [22528, 32, 1, 8192]
    - [72, 31271.2]
  - - [22528, 32, 1, 32768]
    - [73, 32407.6]
  - - [38016, 32, 1, 2048]
    - [74, 39730.6]
  - - [38016, 32, 1, 8192]
    - [74, 60376.8]
  - - [163840, 32, 1, 2048]
    - [75, 23427.1]
  - - [163840, 32, 1, 8192]
    - [73, 24313.1]
  - - [16, 48, 1, 2048]
    - [1, 493.442]
  - - [16, 48, 1, 8192]
    - [31, 1298.72]
  - - [16, 48, 1, 32768]
    - [31, 3506.29]
  - - [32, 48, 1, 2048]
    - [1, 976.808]
  - - [32, 48, 1, 8192]
    - [31, 2540.67]
  - - [32, 48, 1, 32768]
    - [31, 6980.62]
  - - [48, 48, 1, 2048]
    - [1, 1442.58]
  - - [48, 48, 1, 8192]
    - [7, 3622.58]
  - - [48, 48, 1, 32768]
    - [46, 8357.78]
  - - [64, 48, 1, 2048]
    - [1, 1876.75]
  - - [64, 48, 1, 8192]
    - [59, 4627.33]
  - - [64, 48, 1, 32768]
    - [76, 10230.6]
  - - [80, 48, 1, 2048]
    - [2, 2273.34]
  - - [80, 48, 1, 8192]
    - [31, 5664.52]
  - - [80, 48, 1, 32768]
    - [76, 12487.5]
  - - [96, 48, 1, 2048]
    - [1, 2664.4]
  - - [96, 48, 1, 8192]
    - [31, 6749.92]
  - - [96, 48, 1, 32768]
    - [76, 14988.6]
  - - [112, 48, 1, 2048]
    - [1, 3045.05]
  - - [112, 48, 1, 8192]
    - [31, 7803.58]
  - - [112, 48, 1, 32768]
    - [28, 14324.5]
  - - [128, 48, 1, 2048]
    - [52, 2807.49]
  - - [128, 48, 1, 8192]
    - [28, 8276.05]
  - - [128, 48, 1, 32768]
    - [28, 16493.1]
  - - [160, 48, 1, 2048]
    - [3, 3834.34]
  - - [160, 48, 1, 8192]
    - [28, 10219.8]
  - - [160, 48, 1, 32768]
    - [77, 20530.4]
  - - [192, 48, 1, 2048]
    - [3, 4589.77]
  - - [192, 48, 1, 8192]
    - [28, 12219.5]
  - - [192, 48, 1, 32768]
    - [77, 24572.2]
  - - [224, 48, 1, 2048]
    - [3, 5347.44]
  - - [224, 48, 1, 8192]
    - [28, 14067.2]
  - - [224, 48, 1, 32768]
    - [78, 22490.0]
  - - [256, 48, 1, 2048]
    - [79, 4937.06]
  - - [256, 48, 1, 8192]
    - [50, 15544.8]
  - - [256, 48, 1, 32768]
    - [50, 31157.0]
  - - [320, 48, 1, 2048]
    - [19, 7328.8]
  - - [320, 48, 1, 8192]
    - [50, 19431.6]
  - - [320, 48, 1, 32768]
    - [50, 40406.0]
  - - [384, 48, 1, 2048]
    - [19, 8762.24]
  - - [384, 48, 1, 8192]
    - [80, 20568.4]
  - - [384, 48, 1, 32768]
    - [81, 45399.0]
  - - [448, 48, 1, 2048]
    - [19, 10099.9]
  - - [448, 48, 1, 8192]
    - [81, 23868.1]
  - - [448, 48, 1, 32768]
    - [81, 52769.8]
  - - [512, 48, 1, 2048]
    - [11, 9250.23]
  - - [512, 48, 1, 8192]
    - [36, 23301.4]
  - - [512, 48, 1, 32768]
    - [82, 38152.4]
  - - [576, 48, 1, 2048]
    - [83, 9762.02]
  - - [576, 48, 1, 8192]
    - [84, 27104.6]
  - - [576, 48, 1, 32768]
    - [85, 46940.4]
  - - [640, 48, 1, 2048]
    - [86, 12075.8]
  - - [640, 48, 1, 8192]
    - [83, 29950.9]
  - - [640, 48, 1, 32768]
    - [87, 52193.9]
  - - [768, 48, 1, 2048]
    - [12, 13933.3]
  - - [768, 48, 1, 8192]
    - [83, 34973.3]
  - - [768, 48, 1, 32768]
    - [82, 62717.4]
  - - [896, 48, 1, 2048]
    - [88, 15768.5]
  - - [896, 48, 1, 8192]
    - [88, 39178.6]
  - - [896, 48, 1, 32768]
    - [89, 67082.1]
  - - [1024, 48, 1, 2048]
    - [88, 16421.2]
  - - [1024, 48, 1, 8192]
    - [85, 44044.1]
  - - [1024, 48, 1, 32768]
    - [85, 72311.4]
  - - [1280, 48, 1, 2048]
    - [35, 20933.7]
  - - [1280, 48, 1, 8192]
    - [88, 52842.0]
  - - [1280, 48, 1, 32768]
    - [85, 97204.4]
  - - [1536, 48, 1, 2048]
    - [34, 22749.5]
  - - [1536, 48, 1, 8192]
    - [85, 54646.7]
  - - [1536, 48, 1, 32768]
    - [90, 90509.5]
  - - [1792, 48, 1, 2048]
    - [35, 28633.9]
  - - [1792, 48, 1, 8192]
    - [82, 60324.5]
  - - [1792, 48, 1, 32768]
    - [82, 102747.0]
  - - [2048, 48, 1, 2048]
    - [35, 27243.0]
  - - [2048, 48, 1, 8192]
    - [85, 63715.5]
  - - [2048, 48, 1, 32768]
    - [82, 102152.0]
  - - [2304, 48, 1, 2048]
    - [50, 33383.2]
  - - [2304, 48, 1, 8192]
    - [58, 71391.3]
  - - [2304, 48, 1, 32768]
    - [82, 104759.0]
  - - [2560, 48, 1, 2048]
    - [50, 33998.6]
  - - [2560, 48, 1, 8192]
    - [82, 76566.0]
  - - [2560, 48, 1, 32768]
    - [82, 127731.0]
  - - [2816, 48, 1, 2048]
    - [91, 33962.9]
  - - [2816, 48, 1, 8192]
    - [82, 82321.0]
  - - [2816, 48, 1, 32768]
    - [82, 142488.0]
  - - [3072, 48, 1, 2048]
    - [92, 35173.3]
  - - [3072, 48, 1, 8192]
    - [85, 72093.0]
  - - [3072, 48, 1, 32768]
    - [90, 119719.0]
  - - [3584, 48, 1, 2048]
    - [93, 37764.3]
  - - [3584, 48, 1, 8192]
    - [90, 83917.8]
  - - [3584, 48, 1, 32768]
    - [90, 128532.0]
  - - [4096, 48, 1, 2048]
    - [94, 46512.1]
  - - [4096, 48, 1, 8192]
    - [82, 85976.7]
  - - [4096, 48, 1, 32768]
    - [82, 134508.0]
  - - [4608, 48, 1, 2048]
    - [83, 52013.1]
  - - [4608, 48, 1, 8192]
    - [82, 95482.3]
  - - [4608, 48, 1, 32768]
    - [82, 130487.0]
  - - [5120, 48, 1, 2048]
    - [36, 56289.3]
  - - [5120, 48, 1, 8192]
    - [82, 103410.0]
  - - [5120, 48, 1, 32768]
    - [82, 143674.0]
  - - [5632, 48, 1, 2048]
    - [82, 54175.4]
  - - [5632, 48, 1, 8192]
    - [90, 96729.5]
  - - [5632, 48, 1, 32768]
    - [90, 134783.0]
  - - [6144, 48, 1, 2048]
    - [95, 57084.8]
  - - [6144, 48, 1, 8192]
    - [90, 110944.0]
  - - [6144, 48, 1, 32768]
    - [90, 167310.0]
  - - [7168, 48, 1, 2048]
    - [90, 59376.9]
  - - [7168, 48, 1, 8192]
    - [90, 121619.0]
  - - [7168, 48, 1, 32768]
    - [90, 168960.0]
  - - [8192, 48, 1, 2048]
    - [85, 73241.0]
  - - [8192, 48, 1, 8192]
    - [90, 129558.0]
  - - [8192, 48, 1, 32768]
    - [90, 187569.0]
  - - [10240, 48, 1, 2048]
    - [85, 91053.1]
  - - [10240, 48, 1, 8192]
    - [90, 141813.0]
  - - [10240, 48, 1, 32768]
    - [90, 194578.0]
  - - [12288, 48, 1, 2048]
    - [82, 77324.5]
  - - [12288, 48, 1, 8192]
    - [90, 140759.0]
  - - [12288, 48, 1, 32768]
    - [90, 180941.0]
  - - [14336, 48, 1, 2048]
    - [82, 89602.5]
  - - [14336, 48, 1, 8192]
    - [96, 124993.0]
  - - [14336, 48, 1, 32768]
    - [90, 172067.0]
  - - [16384, 48, 1, 2048]
    - [82, 102494.0]
  - - [16384, 48, 1, 8192]
    - [90, 140274.0]
  - - [16384, 48, 1, 32768]
    - [90, 193729.0]
  - - [20480, 48, 1, 2048]
    - [82, 124404.0]
  - - [20480, 48, 1, 8192]
    - [97, 165292.0]
  - - [24576, 48, 1, 2048]
    - [97, 102151.0]
  - - [24576, 48, 1, 8192]
    - [97, 147108.0]
  - - [28672, 48, 1, 2048]
    - [97, 117956.0]
  - - [28672, 48, 1, 8192]
    - [98, 147392.0]
  - - [32768, 48, 1, 2048]
    - [97, 132956.0]
  - - [32768, 48, 1, 8192]
    - [97, 163320.0]
  - - [40960, 48, 1, 2048]
    - [99, 101585.0]
  - - [40960, 48, 1, 8192]
    - [90, 150614.0]
  - - [49152, 48, 1, 2048]
    - [99, 126488.0]
  - - [49152, 48, 1, 8192]
    - [90, 154016.0]
  - - [57344, 48, 1, 2048]
    - [100, 143393.0]
  - - [57344, 48, 1, 8192]
    - [90, 168439.0]
  - - [65536, 48, 1, 2048]
    - [97, 135176.0]
  - - [65536, 48, 1, 8192]
    - [97, 163991.0]
  - - [98304, 48, 1, 2048]
    - [101, 18931.1]
  - - [98304, 48, 1, 8192]
    - [101, 21246.2]
  - - [131072, 48, 1, 2048]
    - [102, 8189.82]
  - - [131072, 48, 1, 8192]
    - [103, 39227.9]
  - - [262144, 48, 1, 2048]
    - [42, 8488.89]
  - - [262144, 48, 1, 8192]
    - [104, 8642.77]
  - - [15360, 48, 1, 2048]
    - [105, 32283.4]
  - - [15360, 48, 1, 8192]
    - [103, 43907.7]
  - - [15360, 48, 1, 32768]
    - [105, 45884.0]
  - - [22528, 48, 1, 2048]
    - [105, 32497.3]
  - - [22528, 48, 1, 8192]
    - [103, 43820.9]
  - - [38016, 48, 1, 2048]
    - [105, 42598.1]
  - - [38016, 48, 1, 8192]
    - [51, 95519.1]
  - - [163840, 48, 1, 2048]
    - [106, 31841.4]
  - - [163840, 48, 1, 8192]
    - [107, 49008.4]
  - - [16, 64, 1, 2048]
    - [1, 654.506]
  - - [16, 64, 1, 8192]
    - [108, 1700.59]
  - - [16, 64, 1, 32768]
    - [28, 4607.12]
  - - [32, 64, 1, 2048]
    - [1, 1301.44]
  - - [32, 64, 1, 8192]
    - [7, 3343.97]
  - - [32, 64, 1, 32768]
    - [28, 8926.54]
  - - [48, 64, 1, 2048]
    - [47, 1760.23]
  - - [48, 64, 1, 8192]
    - [31, 4571.55]
  - - [48, 64, 1, 32768]
    - [109, 10505.8]
  - - [64, 64, 1, 2048]
    - [47, 2320.81]
  - - [64, 64, 1, 8192]
    - [31, 6147.12]
  - - [64, 64, 1, 32768]
    - [59, 13678.1]
  - - [80, 64, 1, 2048]
    - [47, 2849.33]
  - - [80, 64, 1, 8192]
    - [31, 7585.28]
  - - [80, 64, 1, 32768]
    - [59, 16860.3]
  - - [96, 64, 1, 2048]
    - [47, 3401.05]
  - - [96, 64, 1, 8192]
    - [110, 7680.59]
  - - [96, 64, 1, 32768]
    - [88, 15128.7]
  - - [112, 64, 1, 2048]
    - [3, 3593.65]
  - - [112, 64, 1, 8192]
    - [88, 8913.0]
  - - [112, 64, 1, 32768]
    - [88, 17385.1]
  - - [128, 64, 1, 2048]
    - [3, 4087.57]
  - - [128, 64, 1, 8192]
    - [16, 10385.4]
  - - [128, 64, 1, 32768]
    - [88, 19910.9]
  - - [160, 64, 1, 2048]
    - [3, 5099.01]
  - - [160, 64, 1, 8192]
    - [16, 12795.5]
  - - [160, 64, 1, 32768]
    - [88, 24799.0]
  - - [192, 64, 1, 2048]
    - [3, 6097.41]
  - - [192, 64, 1, 8192]
    - [111, 13004.2]
  - - [192, 64, 1, 32768]
    - [112, 24706.4]
  - - [224, 64, 1, 2048]
    - [113, 6155.96]
  - - [224, 64, 1, 8192]
    - [113, 15886.6]
  - - [224, 64, 1, 32768]
    - [114, 27875.1]
  - - [256, 64, 1, 2048]
    - [115, 6821.77]
  - - [256, 64, 1, 8192]
    - [113, 17135.7]
  - - [256, 64, 1, 32768]
    - [116, 29143.5]
  - - [320, 64, 1, 2048]
    - [9, 8590.24]
  - - [320, 64, 1, 8192]
    - [113, 21192.4]
  - - [320, 64, 1, 32768]
    - [114, 38339.4]
  - - [384, 64, 1, 2048]
    - [9, 10344.0]
  - - [384, 64, 1, 8192]
    - [50, 23581.0]
  - - [384, 64, 1, 32768]
    - [114, 45378.9]
  - - [448, 64, 1, 2048]
    - [9, 11816.7]
  - - [448, 64, 1, 8192]
    - [117, 27574.0]
  - - [448, 64, 1, 32768]
    - [111, 51840.1]
  - - [512, 64, 1, 2048]
    - [52, 12202.4]
  - - [512, 64, 1, 8192]
    - [36, 30642.7]
  - - [512, 64, 1, 32768]
    - [62, 48360.0]
  - - [576, 64, 1, 2048]
    - [59, 14282.1]
  - - [576, 64, 1, 8192]
    - [117, 36204.6]
  - - [576, 64, 1, 32768]
    - [118, 63671.7]
  - - [640, 64, 1, 2048]
    - [59, 15854.0]
  - - [640, 64, 1, 8192]
    - [111, 33750.6]
  - - [640, 64, 1, 32768]
    - [116, 61606.9]
  - - [768, 64, 1, 2048]
    - [113, 17071.5]
  - - [768, 64, 1, 8192]
    - [119, 39381.1]
  - - [768, 64, 1, 32768]
    - [116, 74618.3]
  - - [896, 64, 1, 2048]
    - [54, 20391.6]
  - - [896, 64, 1, 8192]
    - [111, 45226.3]
  - - [896, 64, 1, 32768]
    - [114, 81641.0]
  - - [1024, 64, 1, 2048]
    - [36, 19920.9]
  - - [1024, 64, 1, 8192]
    - [82, 48416.8]
  - - [1024, 64, 1, 32768]
    - [120, 78172.1]
  - - [1280, 64, 1, 2048]
    - [34, 27512.4]
  - - [1280, 64, 1, 8192]
    - [85, 58975.0]
  - - [1280, 64, 1, 32768]
    - [116, 105394.0]
  - - [1536, 64, 1, 2048]
    - [50, 28061.3]
  - - [1536, 64, 1, 8192]
    - [85, 66362.7]
  - - [1536, 64, 1, 32768]
    - [82, 105704.0]
  - - [1792, 64, 1, 2048]
    - [50, 35281.6]
  - - [1792, 64, 1, 8192]
    - [82, 80681.9]
  - - [1792, 64, 1, 32768]
    - [82, 136791.0]
  - - [2048, 64, 1, 2048]
    - [50, 36334.0]
  - - [2048, 64, 1, 8192]
    - [85, 85482.7]
  - - [2048, 64, 1, 32768]
    - [82, 131179.0]
  - - [2304, 64, 1, 2048]
    - [16, 40393.4]
  - - [2304, 64, 1, 8192]
    - [116, 89751.2]
  - - [2304, 64, 1, 32768]
    - [116, 149633.0]
  - - [2560, 64, 1, 2048]
    - [83, 40607.9]
  - - [2560, 64, 1, 8192]
    - [121, 90034.8]
  - - [2560, 64, 1, 32768]
    - [121, 146541.0]
  - - [2816, 64, 1, 2048]
    - [83, 45178.4]
  - - [2816, 64, 1, 8192]
    - [116, 98991.7]
  - - [2816, 64, 1, 32768]
    - [116, 161988.0]
  - - [3072, 64, 1, 2048]
    - [83, 48465.1]
  - - [3072, 64, 1, 8192]
    - [121, 88422.7]
  - - [3072, 64, 1, 32768]
    - [121, 136962.0]
  - - [3584, 64, 1, 2048]
    - [83, 56270.9]
  - - [3584, 64, 1, 8192]
    - [122, 104950.0]
  - - [3584, 64, 1, 32768]
    - [122, 157441.0]
  - - [4096, 64, 1, 2048]
    - [83, 63607.1]
  - - [4096, 64, 1, 8192]
    - [121, 101842.0]
  - - [4096, 64, 1, 32768]
    - [122, 165030.0]
  - - [4608, 64, 1, 2048]
    - [116, 58617.8]
  - - [4608, 64, 1, 8192]
    - [116, 107875.0]
  - - [4608, 64, 1, 32768]
    - [121, 148921.0]
  - - [5120, 64, 1, 2048]
    - [85, 62457.6]
  - - [5120, 64, 1, 8192]
    - [90, 118977.0]
  - - [5120, 64, 1, 32768]
    - [121, 162916.0]
  - - [5632, 64, 1, 2048]
    - [85, 68600.6]
  - - [5632, 64, 1, 8192]
    - [90, 125202.0]
  - - [5632, 64, 1, 32768]
    - [90, 177363.0]
  - - [6144, 64, 1, 2048]
    - [85, 74753.7]
  - - [6144, 64, 1, 8192]
    - [120, 130230.0]
  - - [6144, 64, 1, 32768]
    - [120, 184479.0]
  - - [7168, 64, 1, 2048]
    - [39, 73994.3]
  - - [7168, 64, 1, 8192]
    - [120, 133594.0]
  - - [7168, 64, 1, 32768]
    - [120, 182313.0]
  - - [8192, 64, 1, 2048]
    - [39, 82697.9]
  - - [8192, 64, 1, 8192]
    - [120, 144454.0]
  - - [8192, 64, 1, 32768]
    - [120, 206814.0]
  - - [14336, 64, 1, 2048]
    - [123, 115695.0]
  - - [14336, 64, 1, 8192]
    - [124, 165824.0]
  - - [16384, 64, 1, 2048]
    - [123, 131042.0]
  - - [16384, 64, 1, 8192]
    - [97, 170884.0]
  - - [20480, 64, 1, 2048]
    - [123, 158547.0]
  - - [20480, 64, 1, 8192]
    - [97, 212756.0]
  - - [24576, 64, 1, 2048]
    - [97, 134390.0]
  - - [24576, 64, 1, 8192]
    - [97, 193393.0]
  - - [28672, 64, 1, 2048]
    - [97, 153969.0]
  - - [28672, 64, 1, 8192]
    - [96, 181756.0]
  - - [32768, 64, 1, 2048]
    - [100, 152321.0]
  - - [32768, 64, 1, 8192]
    - [90, 217098.0]
  - - [40960, 64, 1, 2048]
    - [90, 218074.0]
  - - [40960, 64, 1, 8192]
    - [90, 269434.0]
  - - [49152, 64, 1, 2048]
    - [100, 160242.0]
  - - [49152, 64, 1, 8192]
    - [124, 182873.0]
  - - [57344, 64, 1, 2048]
    - [124, 181606.0]
  - - [57344, 64, 1, 8192]
    - [125, 33958.9]
  - - [65536, 64, 1, 2048]
    - [125, 24733.5]
  - - [65536, 64, 1, 8192]
    - [125, 33412.6]
  - - [98304, 64, 1, 2048]
    - [126, 35627.8]
  - - [98304, 64, 1, 8192]
    - [126, 49914.5]
  - - [131072, 64, 1, 2048]
    - [126, 34041.5]
  - - [131072, 64, 1, 8192]
    - [126, 46843.6]
  - - [262144, 64, 1, 2048]
    - [42, 8736.45]
  - - [15360, 64, 1, 2048]
    - [127, 38115.9]
  - - [15360, 64, 1, 8192]
    - [128, 54194.3]
  - - [22528, 64, 1, 2048]
    - [127, 39472.5]
  - - [22528, 64, 1, 8192]
    - [128, 54541.3]
  - - [38016, 64, 1, 2048]
    - [126, 63443.4]
  - - [38016, 64, 1, 8192]
    - [94, 97062.0]
  - - [163840, 64, 1, 2048]
    - [126, 38346.7]
  - - [163840, 64, 1, 8192]
    - [129, 48618.4]
  - - [16, 80, 1, 2048]
    - [1, 818.902]
  - - [16, 80, 1, 8192]
    - [7, 2091.32]
  - - [16, 80, 1, 32768]
    - [28, 5587.28]
  - - [32, 80, 1, 2048]
    - [1, 1619.25]
  - - [32, 80, 1, 8192]
    - [7, 4095.37]
  - - [32, 80, 1, 32768]
    - [130, 8203.1]
  - - [48, 80, 1, 2048]
    - [46, 1984.17]
  - - [48, 80, 1, 8192]
    - [131, 5605.44]
  - - [48, 80, 1, 32768]
    - [130, 12218.7]
  - - [64, 80, 1, 2048]
    - [3, 2622.49]
  - - [64, 80, 1, 8192]
    - [131, 7395.2]
  - - [64, 80, 1, 32768]
    - [130, 16257.7]
  - - [80, 80, 1, 2048]
    - [46, 3239.13]
  - - [80, 80, 1, 8192]
    - [131, 9199.46]
  - - [80, 80, 1, 32768]
    - [88, 15394.5]
  - - [96, 80, 1, 2048]
    - [79, 3336.97]
  - - [96, 80, 1, 8192]
    - [110, 9529.05]
  - - [96, 80, 1, 32768]
    - [88, 18587.4]
  - - [112, 80, 1, 2048]
    - [132, 3873.04]
  - - [112, 80, 1, 8192]
    - [110, 11019.5]
  - - [112, 80, 1, 32768]
    - [88, 21510.8]
  - - [128, 80, 1, 2048]
    - [30, 4413.07]
  - - [128, 80, 1, 8192]
    - [88, 12506.4]
  - - [128, 80, 1, 32768]
    - [88, 24644.2]
  - - [160, 80, 1, 2048]
    - [30, 5527.3]
  - - [160, 80, 1, 8192]
    - [110, 15512.9]
  - - [160, 80, 1, 32768]
    - [133, 24971.1]
  - - [192, 80, 1, 2048]
    - [76, 6039.27]
  - - [192, 80, 1, 8192]
    - [134, 16148.6]
  - - [192, 80, 1, 32768]
    - [135, 28624.4]
  - - [224, 80, 1, 2048]
    - [9, 7389.65]
  - - [224, 80, 1, 8192]
    - [136, 18381.4]
  - - [224, 80, 1, 32768]
    - [135, 33057.8]
  - - [256, 80, 1, 2048]
    - [9, 7951.06]
  - - [256, 80, 1, 8192]
    - [137, 19697.1]
  - - [256, 80, 1, 32768]
    - [136, 37774.0]
  - - [320, 80, 1, 2048]
    - [56, 10529.0]
  - - [320, 80, 1, 8192]
    - [136, 25257.5]
  - - [320, 80, 1, 32768]
    - [136, 47013.2]
  - - [384, 80, 1, 2048]
    - [56, 12589.2]
  - - [384, 80, 1, 8192]
    - [136, 30578.3]
  - - [384, 80, 1, 32768]
    - [36, 54299.1]
  - - [448, 80, 1, 2048]
    - [59, 13718.9]
  - - [448, 80, 1, 8192]
    - [88, 32356.7]
  - - [448, 80, 1, 32768]
    - [88, 60481.2]
  - - [512, 80, 1, 2048]
    - [52, 14221.4]
  - - [512, 80, 1, 8192]
    - [36, 37126.8]
  - - [512, 80, 1, 32768]
    - [138, 60474.5]
  - - [576, 80, 1, 2048]
    - [59, 17641.8]
  - - [576, 80, 1, 8192]
    - [88, 41336.8]
  - - [576, 80, 1, 32768]
    - [138, 68389.0]
  - - [640, 80, 1, 2048]
    - [59, 19565.4]
  - - [640, 80, 1, 8192]
    - [88, 45460.7]
  - - [640, 80, 1, 32768]
    - [135, 74839.5]
  - - [768, 80, 1, 2048]
    - [136, 18717.7]
  - - [768, 80, 1, 8192]
    - [136, 49043.6]
  - - [768, 80, 1, 32768]
    - [135, 85710.7]
  - - [896, 80, 1, 2048]
    - [51, 22686.3]
  - - [896, 80, 1, 8192]
    - [136, 57947.7]
  - - [896, 80, 1, 32768]
    - [135, 100000.0]
  - - [1024, 80, 1, 2048]
    - [136, 23977.4]
  - - [1024, 80, 1, 8192]
    - [136, 63409.9]
  - - [1024, 80, 1, 32768]
    - [138, 97925.9]
  - - [1280, 80, 1, 2048]
    - [50, 31168.3]
  - - [1280, 80, 1, 8192]
    - [136, 71179.6]
  - - [1280, 80, 1, 32768]
    - [135, 137371.0]
  - - [1536, 80, 1, 2048]
    - [50, 34328.5]
  - - [1536, 80, 1, 8192]
    - [135, 72977.5]
  - - [1536, 80, 1, 32768]
    - [139, 121820.0]
  - - [1792, 80, 1, 2048]
    - [51, 42141.4]
  - - [1792, 80, 1, 8192]
    - [140, 85707.0]
  - - [1792, 80, 1, 32768]
    - [139, 144860.0]
  - - [2048, 80, 1, 2048]
    - [51, 41757.7]
  - - [2048, 80, 1, 8192]
    - [135, 86964.9]
  - - [2048, 80, 1, 32768]
    - [138, 151845.0]
  - - [2304, 80, 1, 2048]
    - [83, 43264.7]
  - - [2304, 80, 1, 8192]
    - [138, 105673.0]
  - - [2304, 80, 1, 32768]
    - [138, 180963.0]
  - - [2560, 80, 1, 2048]
    - [83, 48954.7]
  - - [2560, 80, 1, 8192]
    - [138, 108954.0]
  - - [2560, 80, 1, 32768]
    - [138, 188742.0]
  - - [2816, 80, 1, 2048]
    - [141, 49342.0]
  - - [2816, 80, 1, 8192]
    - [138, 118775.0]
  - - [2816, 80, 1, 32768]
    - [138, 198021.0]
  - - [3072, 80, 1, 2048]
    - [55, 50281.2]
  - - [3072, 80, 1, 8192]
    - [138, 105840.0]
  - - [3072, 80, 1, 32768]
    - [138, 180734.0]
  - - [3584, 80, 1, 2048]
    - [136, 58649.6]
  - - [3584, 80, 1, 8192]
    - [138, 122397.0]
  - - [3584, 80, 1, 32768]
    - [138, 182768.0]
  - - [4096, 80, 1, 2048]
    - [136, 65564.5]
  - - [4096, 80, 1, 8192]
    - [138, 129744.0]
  - - [4096, 80, 1, 32768]
    - [138, 206562.0]
  - - [4608, 80, 1, 2048]
    - [136, 75278.8]
  - - [4608, 80, 1, 8192]
    - [138, 141666.0]
  - - [4608, 80, 1, 32768]
    - [138, 195983.0]
  - - [5120, 80, 1, 2048]
    - [136, 82651.3]
  - - [5120, 80, 1, 8192]
    - [138, 150311.0]
  - - [5120, 80, 1, 32768]
    - [138, 215433.0]
  - - [5632, 80, 1, 2048]
    - [135, 68245.0]
  - - [5632, 80, 1, 8192]
    - [142, 129574.0]
  - - [5632, 80, 1, 32768]
    - [142, 230271.0]
  - - [6144, 80, 1, 2048]
    - [140, 80474.0]
  - - [6144, 80, 1, 8192]
    - [138, 151984.0]
  - - [6144, 80, 1, 32768]
    - [142, 220244.0]
  - - [7168, 80, 1, 2048]
    - [135, 86129.1]
  - - [7168, 80, 1, 8192]
    - [142, 157075.0]
  - - [7168, 80, 1, 32768]
    - [142, 219317.0]
  - - [8192, 80, 1, 2048]
    - [135, 99221.0]
  - - [10240, 80, 1, 32768]
    - [143, 259856.0]
  - - [12288, 80, 1, 2048]
    - [144, 112895.0]
  - - [12288, 80, 1, 8192]
    - [143, 181760.0]
  - - [14336, 80, 1, 2048]
    - [145, 125584.0]
  - - [14336, 80, 1, 8192]
    - [143, 160987.0]
  - - [16384, 80, 1, 2048]
    - [145, 140986.0]
  - - [16384, 80, 1, 8192]
    - [145, 183625.0]
  - - [20480, 80, 1, 2048]
    - [145, 173493.0]
  - - [20480, 80, 1, 8192]
    - [145, 222499.0]
  - - [24576, 80, 1, 2048]
    - [143, 138316.0]
  - - [24576, 80, 1, 8192]
    - [146, 169737.0]
  - - [28672, 80, 1, 2048]
    - [147, 138442.0]
  - - [28672, 80, 1, 8192]
    - [142, 190505.0]
  - - [32768, 80, 1, 2048]
    - [120, 183098.0]
  - - [32768, 80, 1, 8192]
    - [120, 221382.0]
  - - [40960, 80, 1, 2048]
    - [120, 224800.0]
  - - [40960, 80, 1, 8192]
    - [120, 275001.0]
  - - [49152, 80, 1, 2048]
    - [146, 167595.0]
  - - [49152, 80, 1, 8192]
    - [148, 33900.9]
  - - [57344, 80, 1, 2048]
    - [148, 21608.6]
  - - [57344, 80, 1, 8192]
    - [148, 31904.5]
  - - [65536, 80, 1, 2048]
    - [105, 35062.0]
  - - [65536, 80, 1, 8192]
    - [149, 42685.1]
  - - [98304, 80, 1, 2048]
    - [106, 27322.5]
  - - [98304, 80, 1, 8192]
    - [149, 41858.9]
  - - [131072, 80, 1, 2048]
    - [106, 25673.4]
  - - [131072, 80, 1, 8192]
    - [103, 33184.5]
  - - [262144, 80, 1, 2048]
    - [104, 8759.29]
  - - [15360, 80, 1, 2048]
    - [150, 37797.2]
  - - [15360, 80, 1, 8192]
    - [150, 58780.0]
  - - [22528, 80, 1, 2048]
    - [151, 44876.4]
  - - [22528, 80, 1, 8192]
    - [152, 69425.8]
  - - [38016, 80, 1, 2048]
    - [10, 60553.6]
  - - [38016, 80, 1, 8192]
    - [152, 92985.7]
  - - [163840, 80, 1, 2048]
    - [153, 35328.0]
  - - [163840, 80, 1, 8192]
    - [154, 44772.2]
  - - [16, 96, 1, 2048]
    - [1, 979.431]
  - - [16, 96, 1, 8192]
    - [155, 2175.58]
  - - [16, 96, 1, 32768]
    - [155, 5383.34]
  - - [32, 96, 1, 2048]
    - [46, 1604.63]
  - - [32, 96, 1, 8192]
    - [117, 4203.42]
  - - [32, 96, 1, 32768]
    - [156, 8393.5]
  - - [48, 96, 1, 2048]
    - [46, 2380.17]
  - - [48, 96, 1, 8192]
    - [117, 6185.02]
  - - [48, 96, 1, 32768]
    - [77, 12341.7]
  - - [64, 96, 1, 2048]
    - [3, 3173.71]
  - - [64, 96, 1, 8192]
    - [28, 8362.89]
  - - [64, 96, 1, 32768]
    - [28, 16592.0]
  - - [80, 96, 1, 2048]
    - [3, 3893.13]
  - - [80, 96, 1, 8192]
    - [155, 9022.53]
  - - [80, 96, 1, 32768]
    - [87, 17016.5]
  - - [96, 96, 1, 2048]
    - [132, 4071.02]
  - - [96, 96, 1, 8192]
    - [155, 10839.8]
  - - [96, 96, 1, 32768]
    - [87, 20105.3]
  - - [112, 96, 1, 2048]
    - [132, 4677.93]
  - - [112, 96, 1, 8192]
    - [155, 12536.4]
  - - [112, 96, 1, 32768]
    - [87, 23382.9]
  - - [128, 96, 1, 2048]
    - [132, 5344.15]
  - - [128, 96, 1, 8192]
    - [155, 14286.1]
  - - [128, 96, 1, 32768]
    - [87, 26775.7]
  - - [160, 96, 1, 2048]
    - [155, 5804.92]
  - - [160, 96, 1, 8192]
    - [78, 14817.8]
  - - [160, 96, 1, 32768]
    - [78, 25537.2]
  - - [192, 96, 1, 2048]
    - [113, 7719.18]
  - - [192, 96, 1, 8192]
    - [54, 20371.5]
  - - [192, 96, 1, 32768]
    - [54, 34886.2]
  - - [224, 96, 1, 2048]
    - [9, 8849.68]
  - - [224, 96, 1, 8192]
    - [117, 21816.7]
  - - [224, 96, 1, 32768]
    - [85, 35311.7]
  - - [256, 96, 1, 2048]
    - [9, 9694.12]
  - - [256, 96, 1, 8192]
    - [50, 23824.4]
  - - [256, 96, 1, 32768]
    - [82, 40886.1]
  - - [320, 96, 1, 2048]
    - [59, 11967.5]
  - - [320, 96, 1, 8192]
    - [88, 28783.6]
  - - [320, 96, 1, 32768]
    - [85, 51678.3]
  - - [384, 96, 1, 2048]
    - [59, 14347.4]
  - - [384, 96, 1, 8192]
    - [83, 33994.7]
  - - [384, 96, 1, 32768]
    - [85, 61254.3]
  - - [448, 96, 1, 2048]
    - [54, 15446.9]
  - - [448, 96, 1, 8192]
    - [83, 38606.3]
  - - [448, 96, 1, 32768]
    - [85, 69447.9]
  - - [512, 96, 1, 2048]
    - [34, 15734.2]
  - - [512, 96, 1, 8192]
    - [85, 40172.6]
  - - [512, 96, 1, 32768]
    - [85, 74314.6]
  - - [576, 96, 1, 2048]
    - [54, 19735.5]
  - - [576, 96, 1, 8192]
    - [36, 47638.1]
  - - [576, 96, 1, 32768]
    - [85, 87768.5]
  - - [640, 96, 1, 2048]
    - [54, 21913.0]
  - - [640, 96, 1, 8192]
    - [157, 42773.2]
  - - [640, 96, 1, 32768]
    - [158, 74990.8]
  - - [768, 96, 1, 2048]
    - [50, 23162.3]
  - - [768, 96, 1, 8192]
    - [85, 53180.6]
  - - [768, 96, 1, 32768]
    - [82, 90812.9]
  - - [896, 96, 1, 2048]
    - [50, 27257.3]
  - - [896, 96, 1, 8192]
    - [85, 60615.8]
  - - [896, 96, 1, 32768]
    - [82, 101158.0]
  - - [1024, 96, 1, 2048]
    - [50, 27511.7]
  - - [1024, 96, 1, 8192]
    - [85, 67767.6]
  - - [1024, 96, 1, 32768]
    - [82, 103551.0]
  - - [1280, 96, 1, 2048]
    - [50, 37973.3]
  - - [1280, 96, 1, 8192]
    - [82, 81393.6]
  - - [1280, 96, 1, 32768]
    - [82, 145311.0]
  - - [1536, 96, 1, 2048]
    - [50, 41782.7]
  - - [1536, 96, 1, 8192]
    - [82, 81326.6]
  - - [1536, 96, 1, 32768]
    - [159, 130565.0]
  - - [1792, 96, 1, 2048]
    - [88, 46385.7]
  - - [1792, 96, 1, 8192]
    - [135, 93930.3]
  - - [1792, 96, 1, 32768]
    - [158, 149028.0]
  - - [2048, 96, 1, 2048]
    - [83, 47090.2]
  - - [2048, 96, 1, 8192]
    - [160, 92446.4]
  - - [2048, 96, 1, 32768]
    - [161, 162109.0]
  - - [2304, 96, 1, 2048]
    - [83, 53465.3]
  - - [2304, 96, 1, 8192]
    - [161, 112535.0]
  - - [2304, 96, 1, 32768]
    - [158, 187523.0]
  - - [2560, 96, 1, 2048]
    - [84, 57706.0]
  - - [2560, 96, 1, 8192]
    - [161, 118615.0]
  - - [2560, 96, 1, 32768]
    - [161, 199328.0]
  - - [2816, 96, 1, 2048]
    - [55, 62225.1]
  - - [2816, 96, 1, 8192]
    - [161, 125504.0]
  - - [2816, 96, 1, 32768]
    - [158, 203941.0]
  - - [3072, 96, 1, 2048]
    - [36, 59935.3]
  - - [3072, 96, 1, 8192]
    - [161, 115234.0]
  - - [3072, 96, 1, 32768]
    - [161, 190373.0]
  - - [3584, 96, 1, 2048]
    - [95, 66129.2]
  - - [3584, 96, 1, 8192]
    - [161, 129954.0]
  - - [3584, 96, 1, 32768]
    - [161, 189309.0]
  - - [4096, 96, 1, 2048]
    - [85, 73832.9]
  - - [4096, 96, 1, 8192]
    - [161, 144831.0]
  - - [4096, 96, 1, 32768]
    - [161, 216374.0]
  - - [4608, 96, 1, 2048]
    - [85, 82697.3]
  - - [4608, 96, 1, 8192]
    - [161, 149538.0]
  - - [4608, 96, 1, 32768]
    - [161, 202013.0]
  - - [5120, 96, 1, 2048]
    - [85, 91701.7]
  - - [5120, 96, 1, 8192]
    - [161, 158060.0]
  - - [5120, 96, 1, 32768]
    - [159, 240252.0]
  - - [5632, 96, 1, 2048]
    - [39, 86416.0]
  - - [5632, 96, 1, 8192]
    - [159, 158500.0]
  - - [5632, 96, 1, 32768]
    - [159, 235597.0]
  - - [6144, 96, 1, 2048]
    - [39, 94007.6]
  - - [6144, 96, 1, 8192]
    - [161, 157570.0]
  - - [6144, 96, 1, 32768]
    - [159, 225209.0]
  - - [7168, 96, 1, 2048]
    - [135, 101725.0]
  - - [8192, 96, 1, 2048]
    - [162, 116207.0]
  - - [8192, 96, 1, 8192]
    - [163, 173149.0]
  - - [8192, 96, 1, 32768]
    - [163, 244773.0]
  - - [10240, 96, 1, 2048]
    - [162, 142154.0]
  - - [10240, 96, 1, 8192]
    - [163, 207118.0]
  - - [12288, 96, 1, 2048]
    - [145, 135443.0]
  - - [12288, 96, 1, 8192]
    - [145, 164608.0]
  - - [14336, 96, 1, 2048]
    - [145, 148505.0]
  - - [14336, 96, 1, 8192]
    - [145, 191748.0]
  - - [16384, 96, 1, 2048]
    - [145, 167073.0]
  - - [16384, 96, 1, 8192]
    - [145, 219238.0]
  - - [20480, 96, 1, 2048]
    - [145, 206395.0]
  - - [20480, 96, 1, 8192]
    - [145, 266362.0]
  - - [24576, 96, 1, 2048]
    - [164, 158046.0]
  - - [24576, 96, 1, 8192]
    - [159, 198009.0]
  - - [28672, 96, 1, 2048]
    - [142, 183688.0]
  - - [28672, 96, 1, 8192]
    - [142, 224249.0]
  - - [32768, 96, 1, 2048]
    - [163, 203187.0]
  - - [32768, 96, 1, 8192]
    - [163, 253051.0]
  - - [40960, 96, 1, 2048]
    - [163, 249488.0]
  - - [40960, 96, 1, 8192]
    - [165, 39430.8]
  - - [49152, 96, 1, 2048]
    - [101, 25070.6]
  - - [49152, 96, 1, 8192]
    - [165, 37982.7]
  - - [57344, 96, 1, 2048]
    - [105, 39725.7]
  - - [57344, 96, 1, 8192]
    - [154, 48911.7]
  - - [65536, 96, 1, 2048]
    - [105, 41012.1]
  - - [65536, 96, 1, 8192]
    - [154, 50011.6]
  - - [98304, 96, 1, 2048]
    - [106, 32245.0]
  - - [98304, 96, 1, 8192]
    - [103, 41958.7]
  - - [131072, 96, 1, 2048]
    - [75, 26839.3]
  - - [131072, 96, 1, 8192]
    - [73, 29235.7]
  - - [262144, 96, 1, 2048]
    - [104, 8651.41]
  - - [15360, 96, 1, 2048]
    - [151, 50585.7]
  - - [15360, 96, 1, 8192]
    - [166, 80921.2]
  - - [22528, 96, 1, 2048]
    - [151, 51650.7]
  - - [22528, 96, 1, 8192]
    - [166, 79828.8]
  - - [38016, 96, 1, 2048]
    - [167, 69336.4]
  - - [38016, 96, 1, 8192]
    - [168, 103440.0]
  - - [163840, 96, 1, 2048]
    - [169, 41770.6]
  - - [16, 112, 1, 2048]
    - [46, 943.752]
  - - [16, 112, 1, 8192]
    - [155, 2521.57]
  - - [16, 112, 1, 32768]
    - [155, 6266.72]
  - - [32, 112, 1, 2048]
    - [46, 1868.34]
  - - [32, 112, 1, 8192]
    - [77, 4926.1]
  - - [32, 112, 1, 32768]
    - [156, 9822.62]
  - - [48, 112, 1, 2048]
    - [46, 2769.58]
  - - [48, 112, 1, 8192]
    - [77, 7213.25]
  - - [48, 112, 1, 32768]
    - [77, 14448.8]
  - - [64, 112, 1, 2048]
    - [3, 3698.36]
  - - [64, 112, 1, 8192]
    - [77, 9632.53]
  - - [64, 112, 1, 32768]
    - [87, 15670.1]
  - - [80, 112, 1, 2048]
    - [130, 3925.18]
  - - [80, 112, 1, 8192]
    - [155, 10498.5]
  - - [80, 112, 1, 32768]
    - [87, 19502.6]
  - - [96, 112, 1, 2048]
    - [132, 4713.04]
  - - [96, 112, 1, 8192]
    - [155, 12469.2]
  - - [96, 112, 1, 32768]
    - [87, 23435.6]
  - - [112, 112, 1, 2048]
    - [132, 5416.06]
  - - [112, 112, 1, 8192]
    - [155, 14500.0]
  - - [112, 112, 1, 32768]
    - [87, 27311.3]
  - - [128, 112, 1, 2048]
    - [170, 5677.73]
  - - [128, 112, 1, 8192]
    - [155, 14736.9]
  - - [128, 112, 1, 32768]
    - [171, 27052.9]
  - - [160, 112, 1, 2048]
    - [155, 6921.94]
  - - [160, 112, 1, 8192]
    - [155, 18308.7]
  - - [4608, 112, 1, 8192]
    - [172, 123424.0]
  - - [4608, 112, 1, 32768]
    - [173, 163865.0]
  - - [6144, 112, 1, 32768]
    - [174, 236932.0]
  - - [7168, 112, 1, 2048]
    - [123, 108448.0]
  - - [7168, 112, 1, 8192]
    - [175, 167198.0]
  - - [7168, 112, 1, 32768]
    - [176, 229669.0]
  - - [8192, 112, 1, 2048]
    - [123, 121216.0]
  - - [8192, 112, 1, 8192]
    - [177, 177061.0]
  - - [10240, 112, 1, 2048]
    - [123, 150508.0]
  - - [10240, 112, 1, 8192]
    - [178, 213551.0]
  - - [12288, 112, 1, 2048]
    - [179, 134331.0]
  - - [12288, 112, 1, 8192]
    - [176, 177106.0]
  - - [14336, 112, 1, 2048]
    - [180, 153925.0]
  - - [14336, 112, 1, 8192]
    - [176, 198054.0]
  - - [16384, 112, 1, 2048]
    - [180, 172182.0]
  - - [16384, 112, 1, 8192]
    - [180, 216069.0]
  - - [20480, 112, 1, 2048]
    - [100, 163817.0]
  - - [20480, 112, 1, 8192]
    - [181, 238078.0]
  - - [24576, 112, 1, 2048]
    - [182, 164047.0]
  - - [24576, 112, 1, 8192]
    - [173, 216306.0]
  - - [28672, 112, 1, 2048]
    - [178, 181428.0]
  - - [28672, 112, 1, 8192]
    - [176, 231868.0]
  - - [32768, 112, 1, 2048]
    - [180, 204989.0]
  - - [32768, 112, 1, 8192]
    - [125, 33601.7]
  - - [40960, 112, 1, 2048]
    - [125, 27614.9]
  - - [40960, 112, 1, 8192]
    - [125, 31376.4]
  - - [49152, 112, 1, 2048]
    - [127, 45315.9]
  - - [49152, 112, 1, 8192]
    - [183, 51212.6]
  - - [57344, 112, 1, 2048]
    - [128, 43873.7]
  - - [57344, 112, 1, 8192]
    - [183, 50074.6]
  - - [65536, 112, 1, 2048]
    - [126, 39080.1]
  - - [65536, 112, 1, 8192]
    - [183, 51239.9]
  - - [98304, 112, 1, 2048]
    - [126, 36077.2]
  - - [98304, 112, 1, 8192]
    - [184, 46430.8]
  - - [131072, 112, 1, 2048]
    - [106, 27757.5]
  - - [131072, 112, 1, 8192]
    - [185, 59646.8]
  - - [262144, 112, 1, 2048]
    - [186, 19772.1]
  - - [15360, 112, 1, 2048]
    - [151, 48677.6]
  - - [15360, 112, 1, 8192]
    - [187, 88494.8]
  - - [22528, 112, 1, 2048]
    - [151, 50300.3]
  - - [22528, 112, 1, 8192]
    - [187, 85768.2]
  - - [38016, 112, 1, 2048]
    - [167, 69613.5]
  - - [38016, 112, 1, 8192]
    - [187, 111352.0]
  - - [163840, 112, 1, 2048]
    - [103, 26967.4]
  - - [16, 128, 1, 2048]
    - [46, 1083.66]
  - - [16, 128, 1, 8192]
    - [50, 2830.24]
  - - [16, 128, 1, 32768]
    - [78, 6524.37]
  - - [32, 128, 1, 2048]
    - [3, 2134.7]
  - - [32, 128, 1, 8192]
    - [28, 5482.5]
  - - [32, 128, 1, 32768]
    - [28, 10921.9]
  - - [48, 128, 1, 2048]
    - [46, 3174.36]
  - - [48, 128, 1, 8192]
    - [50, 8187.8]
  - - [48, 128, 1, 32768]
    - [28, 16348.1]
  - - [64, 128, 1, 2048]
    - [130, 3706.68]
  - - [64, 128, 1, 8192]
    - [188, 9031.05]
  - - [64, 128, 1, 32768]
    - [55, 16488.2]
  - - [80, 128, 1, 2048]
    - [130, 4493.63]
  - - [80, 128, 1, 8192]
    - [188, 11349.4]
  - - [80, 128, 1, 32768]
    - [55, 20541.2]
  - - [96, 128, 1, 2048]
    - [132, 5425.21]
  - - [96, 128, 1, 8192]
    - [188, 13409.1]
  - - [96, 128, 1, 32768]
    - [55, 24630.7]
  - - [112, 128, 1, 2048]
    - [132, 6196.07]
  - - [112, 128, 1, 8192]
    - [188, 15592.7]
  - - [112, 128, 1, 32768]
    - [55, 28619.6]
  - - [128, 128, 1, 2048]
    - [132, 6928.22]
  - - [128, 128, 1, 8192]
    - [28, 16454.8]
  - - [128, 128, 1, 32768]
    - [189, 27014.1]
  - - [576, 128, 1, 2048]
    - [50, 23468.9]
  - - [576, 128, 1, 8192]
    - [190, 49082.8]
  - - [576, 128, 1, 32768]
    - [191, 81795.7]
  - - [1536, 128, 1, 2048]
    - [36, 45056.8]
  - - [1536, 128, 1, 8192]
    - [90, 89761.2]
  - - [1536, 128, 1, 32768]
    - [191, 142154.0]
  - - [2816, 128, 1, 32768]
    - [191, 175529.0]
  - - [3072, 128, 1, 2048]
    - [39, 64554.9]
  - - [3072, 128, 1, 8192]
    - [191, 129610.0]
  - - [3072, 128, 1, 32768]
    - [191, 190003.0]
  - - [3584, 128, 1, 2048]
    - [39, 74323.0]
  - - [3584, 128, 1, 8192]
    - [191, 150641.0]
  - - [3584, 128, 1, 32768]
    - [191, 218187.0]
  - - [4096, 128, 1, 2048]
    - [39, 83889.7]
  - - [4096, 128, 1, 8192]
    - [192, 159486.0]
  - - [4096, 128, 1, 32768]
    - [191, 245753.0]
  - - [5632, 128, 1, 2048]
    - [123, 98713.3]
  - - [5632, 128, 1, 8192]
    - [97, 170723.0]
  - - [5632, 128, 1, 32768]
    - [97, 219740.0]
  - - [6144, 128, 1, 2048]
    - [123, 107571.0]
  - - [6144, 128, 1, 8192]
    - [97, 171834.0]
  - - [6144, 128, 1, 32768]
    - [97, 237033.0]
  - - [7168, 128, 1, 2048]
    - [123, 124401.0]
  - - [7168, 128, 1, 8192]
    - [193, 177003.0]
  - - [8192, 128, 1, 2048]
    - [123, 130707.0]
  - - [8192, 128, 1, 8192]
    - [174, 194909.0]
  - - [10240, 128, 1, 2048]
    - [194, 172897.0]
  - - [10240, 128, 1, 8192]
    - [123, 208143.0]
  - - [12288, 128, 1, 2048]
    - [174, 148211.0]
  - - [12288, 128, 1, 8192]
    - [176, 204357.0]
  - - [14336, 128, 1, 2048]
    - [174, 167881.0]
  - - [14336, 128, 1, 8192]
    - [172, 231390.0]
  - - [16384, 128, 1, 2048]
    - [121, 141993.0]
  - - [16384, 128, 1, 8192]
    - [195, 251997.0]
  - - [20480, 128, 1, 2048]
    - [196, 241016.0]
  - - [20480, 128, 1, 8192]
    - [174, 303958.0]
  - - [24576, 128, 1, 2048]
    - [176, 191321.0]
  - - [24576, 128, 1, 8192]
    - [176, 236006.0]
  - - [28672, 128, 1, 2048]
    - [125, 30150.4]
  - - [28672, 128, 1, 8192]
    - [125, 36107.1]
  - - [32768, 128, 1, 2048]
    - [125, 30389.6]
  - - [32768, 128, 1, 8192]
    - [197, 80188.6]
  - - [40960, 128, 1, 2048]
    - [128, 49458.5]
  - - [40960, 128, 1, 8192]
    - [185, 57706.1]
  - - [49152, 128, 1, 2048]
    - [128, 50131.6]
  - - [49152, 128, 1, 8192]
    - [185, 58370.6]
  - - [57344, 128, 1, 2048]
    - [126, 44315.8]
  - - [57344, 128, 1, 8192]
    - [198, 55485.2]
  - - [65536, 128, 1, 2048]
    - [126, 44482.2]
  - - [65536, 128, 1, 8192]
    - [198, 56600.5]
  - - [98304, 128, 1, 2048]
    - [126, 47618.2]
  - - [98304, 128, 1, 8192]
    - [199, 68868.4]
  - - [131072, 128, 1, 2048]
    - [126, 42675.3]
  - - [262144, 128, 1, 2048]
    - [200, 22263.9]
  - - [15360, 128, 1, 2048]
    - [151, 54798.3]
  - - [15360, 128, 1, 8192]
    - [94, 94698.8]
  - - [22528, 128, 1, 2048]
    - [151, 56463.7]
  - - [22528, 128, 1, 8192]
    - [94, 94633.6]
  - - [38016, 128, 1, 2048]
    - [167, 78553.9]
  - - [38016, 128, 1, 8192]
    - [94, 107773.0]
  - - [163840, 128, 1, 2048]
    - [103, 30138.2]
  - - [16, 160, 1, 2048]
    - [130, 1151.55]
  - - [16, 160, 1, 8192]
    - [88, 3210.47]
  - - [16, 160, 1, 32768]
    - [88, 6222.9]
  - - [32, 160, 1, 2048]
    - [130, 2345.34]
  - - [32, 160, 1, 8192]
    - [110, 6434.56]
  - - [32, 160, 1, 32768]
    - [110, 12355.2]
  - - [48, 160, 1, 2048]
    - [130, 3421.66]
  - - [48, 160, 1, 8192]
    - [155, 7978.46]
  - - [48, 160, 1, 32768]
    - [133, 15075.5]
  - - [64, 160, 1, 2048]
    - [109, 4175.8]
  - - [64, 160, 1, 8192]
    - [134, 10964.1]
  - - [64, 160, 1, 32768]
    - [133, 19815.8]
  - - [80, 160, 1, 2048]
    - [132, 5593.49]
  - - [80, 160, 1, 8192]
    - [134, 13374.6]
  - - [80, 160, 1, 32768]
    - [133, 24258.8]
  - - [96, 160, 1, 2048]
    - [132, 6771.28]
  - - [96, 160, 1, 8192]
    - [134, 16098.9]
  - - [96, 160, 1, 32768]
    - [78, 25630.8]
  - - [112, 160, 1, 2048]
    - [110, 6780.69]
  - - [112, 160, 1, 8192]
    - [201, 16813.5]
  - - [112, 160, 1, 32768]
    - [78, 29710.0]
  - - [128, 160, 1, 2048]
    - [50, 7657.19]
  - - [512, 160, 1, 8192]
    - [82, 55683.9]
  - - [512, 160, 1, 32768]
    - [202, 85297.6]
  - - [576, 160, 1, 2048]
    - [88, 26403.4]
  - - [1024, 160, 1, 32768]
    - [138, 128907.0]
  - - [1280, 160, 1, 2048]
    - [83, 49704.8]
  - - [1280, 160, 1, 8192]
    - [138, 104238.0]
  - - [1280, 160, 1, 32768]
    - [138, 162200.0]
  - - [1536, 160, 1, 2048]
    - [83, 58718.2]
  - - [2304, 160, 1, 2048]
    - [203, 56060.9]
  - - [2304, 160, 1, 8192]
    - [202, 140372.0]
  - - [2304, 160, 1, 32768]
    - [204, 209145.0]
  - - [2560, 160, 1, 2048]
    - [205, 61747.7]
  - - [2560, 160, 1, 8192]
    - [202, 150082.0]
  - - [2560, 160, 1, 32768]
    - [204, 229863.0]
  - - [2816, 160, 1, 2048]
    - [135, 73461.8]
  - - [2816, 160, 1, 8192]
    - [202, 139732.0]
  - - [2816, 160, 1, 32768]
    - [202, 191792.0]
  - - [3072, 160, 1, 2048]
    - [135, 77148.2]
  - - [3072, 160, 1, 8192]
    - [204, 147672.0]
  - - [3072, 160, 1, 32768]
    - [202, 207198.0]
  - - [3584, 160, 1, 2048]
    - [135, 88283.5]
  - - [3584, 160, 1, 8192]
    - [202, 168602.0]
  - - [4608, 160, 1, 2048]
    - [206, 108629.0]
  - - [4608, 160, 1, 8192]
    - [207, 177170.0]
  - - [4608, 160, 1, 32768]
    - [208, 249086.0]
  - - [5120, 160, 1, 2048]
    - [206, 119784.0]
  - - [5120, 160, 1, 8192]
    - [145, 178869.0]
  - - [5120, 160, 1, 32768]
    - [145, 229626.0]
  - - [5632, 160, 1, 2048]
    - [123, 122002.0]
  - - [5632, 160, 1, 8192]
    - [209, 156309.0]
  - - [5632, 160, 1, 32768]
    - [209, 190329.0]
  - - [6144, 160, 1, 2048]
    - [123, 132234.0]
  - - [6144, 160, 1, 8192]
    - [209, 163091.0]
  - - [7168, 160, 1, 2048]
    - [210, 135771.0]
  - - [7168, 160, 1, 8192]
    - [145, 163133.0]
  - - [8192, 160, 1, 2048]
    - [144, 151138.0]
  - - [8192, 160, 1, 8192]
    - [145, 184880.0]
  - - [10240, 160, 1, 2048]
    - [145, 181763.0]
  - - [10240, 160, 1, 8192]
    - [145, 228622.0]
  - - [12288, 160, 1, 2048]
    - [90, 166982.0]
  - - [12288, 160, 1, 8192]
    - [211, 213327.0]
  - - [14336, 160, 1, 2048]
    - [209, 178341.0]
  - - [14336, 160, 1, 8192]
    - [209, 233349.0]
  - - [16384, 160, 1, 2048]
    - [209, 204754.0]
  - - [16384, 160, 1, 8192]
    - [209, 266174.0]
  - - [20480, 160, 1, 2048]
    - [209, 249867.0]
  - - [20480, 160, 1, 8192]
    - [148, 37827.9]
  - - [24576, 160, 1, 2048]
    - [125, 29362.5]
  - - [24576, 160, 1, 8192]
    - [148, 37730.2]
  - - [28672, 160, 1, 2048]
    - [150, 48168.7]
  - - [28672, 160, 1, 8192]
    - [212, 65258.9]
  - - [32768, 160, 1, 2048]
    - [126, 49522.5]
  - - [32768, 160, 1, 8192]
    - [212, 66783.3]
  - - [40960, 160, 1, 2048]
    - [150, 47502.3]
  - - [40960, 160, 1, 8192]
    - [213, 64067.4]
  - - [49152, 160, 1, 2048]
    - [126, 46158.2]
  - - [49152, 160, 1, 8192]
    - [212, 64679.2]
  - - [57344, 160, 1, 2048]
    - [126, 42793.1]
  - - [57344, 160, 1, 8192]
    - [214, 79869.3]
  - - [65536, 160, 1, 2048]
    - [215, 62521.6]
  - - [65536, 160, 1, 8192]
    - [214, 80727.1]
  - - [98304, 160, 1, 2048]
    - [215, 59286.4]
  - - [131072, 160, 1, 2048]
    - [215, 51591.7]
  - - [262144, 160, 1, 2048]
    - [215, 35520.3]
  - - [15360, 160, 1, 2048]
    - [215, 63244.1]
  - - [15360, 160, 1, 8192]
    - [216, 94986.9]
  - - [22528, 160, 1, 2048]
    - [215, 64377.0]
  - - [22528, 160, 1, 8192]
    - [216, 92845.6]
  - - [38016, 160, 1, 2048]
    - [167, 88901.4]
  - - [38016, 160, 1, 8192]
    - [215, 106737.0]
  - - [163840, 160, 1, 2048]
    - [217, 53594.7]
  - - [16, 192, 1, 2048]
    - [130, 1374.48]
  - - [16, 192, 1, 8192]
    - [110, 3871.8]
  - - [16, 192, 1, 32768]
    - [88, 7462.59]
  - - [32, 192, 1, 2048]
    - [130, 2806.98]
  - - [32, 192, 1, 8192]
    - [110, 7750.78]
  - - [32, 192, 1, 32768]
    - [118, 11358.3]
  - - [48, 192, 1, 2048]
    - [109, 3709.21]
  - - [48, 192, 1, 8192]
    - [118, 9386.13]
  - - [448, 192, 1, 32768]
    - [116, 77793.6]
  - - [512, 192, 1, 2048]
    - [83, 25079.7]
  - - [512, 192, 1, 8192]
    - [116, 57132.4]
  - - [1792, 192, 1, 32768]
    - [218, 170968.0]
  - - [2048, 192, 1, 2048]
    - [39, 64711.3]
  - - [2048, 192, 1, 8192]
    - [219, 129599.0]
  - - [2048, 192, 1, 32768]
    - [218, 193138.0]
  - - [2304, 192, 1, 2048]
    - [39, 72753.2]
  - - [2304, 192, 1, 8192]
    - [219, 144149.0]
  - - [2304, 192, 1, 32768]
    - [218, 162650.0]
  - - [2560, 192, 1, 2048]
    - [82, 72440.7]
  - - [2560, 192, 1, 8192]
    - [218, 130668.0]
  - - [2560, 192, 1, 32768]
    - [218, 179430.0]
  - - [2816, 192, 1, 2048]
    - [171, 81076.4]
  - - [2816, 192, 1, 8192]
    - [218, 141281.0]
  - - [2816, 192, 1, 32768]
    - [218, 196465.0]
  - - [3072, 192, 1, 2048]
    - [171, 84883.8]
  - - [3584, 192, 1, 2048]
    - [162, 101858.0]
  - - [3584, 192, 1, 8192]
    - [145, 158974.0]
  - - [3584, 192, 1, 32768]
    - [145, 197315.0]
  - - [4096, 192, 1, 2048]
    - [162, 114632.0]
  - - [4096, 192, 1, 8192]
    - [145, 175369.0]
  - - [4096, 192, 1, 32768]
    - [145, 221394.0]
  - - [4608, 192, 1, 2048]
    - [162, 129256.0]
  - - [4608, 192, 1, 8192]
    - [145, 198166.0]
  - - [4608, 192, 1, 32768]
    - [145, 249438.0]
  - - [5120, 192, 1, 2048]
    - [162, 142801.0]
  - - [5120, 192, 1, 8192]
    - [145, 214896.0]
  - - [5632, 192, 1, 2048]
    - [123, 145171.0]
  - - [5632, 192, 1, 8192]
    - [123, 176894.0]
  - - [6144, 192, 1, 2048]
    - [123, 157745.0]
  - - [6144, 192, 1, 8192]
    - [123, 190437.0]
  - - [7168, 192, 1, 2048]
    - [145, 154697.0]
  - - [7168, 192, 1, 8192]
    - [145, 194567.0]
  - - [8192, 192, 1, 2048]
    - [145, 173776.0]
  - - [8192, 192, 1, 8192]
    - [145, 221215.0]
  - - [10240, 192, 1, 2048]
    - [161, 190644.0]
  - - [10240, 192, 1, 8192]
    - [218, 247171.0]
  - - [12288, 192, 1, 2048]
    - [97, 194353.0]
  - - [12288, 192, 1, 8192]
    - [97, 241205.0]
  - - [14336, 192, 1, 2048]
    - [220, 187873.0]
  - - [14336, 192, 1, 8192]
    - [208, 243808.0]
  - - [16384, 192, 1, 2048]
    - [208, 212091.0]
  - - [16384, 192, 1, 8192]
    - [221, 49431.1]
  - - [20480, 192, 1, 2048]
    - [125, 34472.3]
  - - [20480, 192, 1, 8192]
    - [221, 47258.2]
  - - [24576, 192, 1, 2048]
    - [125, 34773.5]
  - - [24576, 192, 1, 8192]
    - [221, 47317.2]
  - - [28672, 192, 1, 2048]
    - [125, 34802.4]
  - - [28672, 192, 1, 8192]
    - [222, 71862.8]
  - - [32768, 192, 1, 2048]
    - [126, 58345.3]
  - - [32768, 192, 1, 8192]
    - [222, 73885.9]
  - - [40960, 192, 1, 2048]
    - [223, 54307.5]
  - - [40960, 192, 1, 8192]
    - [222, 71585.8]
  - - [49152, 192, 1, 2048]
    - [126, 53757.6]
  - - [49152, 192, 1, 8192]
    - [154, 57572.3]
  - - [57344, 192, 1, 2048]
    - [126, 49991.4]
  - - [57344, 192, 1, 8192]
    - [224, 56031.5]
  - - [65536, 192, 1, 2048]
    - [126, 51702.2]
  - - [65536, 192, 1, 8192]
    - [154, 59937.8]
  - - [98304, 192, 1, 2048]
    - [103, 44523.6]
  - - [131072, 192, 1, 2048]
    - [103, 39565.2]
  - - [262144, 192, 1, 2048]
    - [103, 23771.5]
  - - [15360, 192, 1, 2048]
    - [127, 52793.9]
  - - [15360, 192, 1, 8192]
    - [225, 75402.4]
  - - [22528, 192, 1, 2048]
    - [223, 55075.6]
  - - [22528, 192, 1, 8192]
    - [225, 72671.8]
  - - [38016, 192, 1, 2048]
    - [167, 88803.4]
  - - [38016, 192, 1, 8192]
    - [168, 114471.0]
  - - [163840, 192, 1, 2048]
    - [215, 48147.6]
  - - [16, 224, 1, 2048]
    - [46, 1874.08]
  - - [16, 224, 1, 8192]
    - [28, 4807.41]
  - - [16, 224, 1, 32768]
    - [77, 9614.04]
  - - [32, 224, 1, 2048]
    - [46, 3739.16]
  - - [32, 224, 1, 8192]
    - [77, 9631.9]
  - - [32, 224, 1, 32768]
    - [156, 19336.6]
  - - [48, 224, 1, 2048]
    - [46, 5542.79]
  - - [48, 224, 1, 8192]
    - [77, 14210.0]
  - - [48, 224, 1, 32768]
    - [77, 28529.4]
  - - [64, 224, 1, 2048]
    - [3, 7266.1]
  - - [64, 224, 1, 8192]
    - [155, 16796.2]
  - - [64, 224, 1, 32768]
    - [87, 31665.5]
  - - [80, 224, 1, 2048]
    - [132, 7648.97]
  - - [80, 224, 1, 8192]
    - [155, 20766.0]
  - - [80, 224, 1, 32768]
    - [87, 38986.5]
  - - [96, 224, 1, 2048]
    - [132, 9225.01]
  - - [96, 224, 1, 8192]
    - [155, 24824.2]
  - - [96, 224, 1, 32768]
    - [87, 47062.6]
  - - [112, 224, 1, 2048]
    - [132, 10563.0]
  - - [112, 224, 1, 8192]
    - [155, 28554.2]
  - - [112, 224, 1, 32768]
    - [87, 54249.1]
  - - [128, 224, 1, 2048]
    - [132, 12067.0]
  - - [128, 224, 1, 8192]
    - [155, 31345.7]
  - - [128, 224, 1, 32768]
    - [87, 62027.7]
  - - [160, 224, 1, 2048]
    - [132, 15052.7]
  - - [160, 224, 1, 8192]
    - [77, 35514.6]
  - - [160, 224, 1, 32768]
    - [89, 68392.6]
  - - [192, 224, 1, 2048]
    - [132, 18048.4]
  - - [192, 224, 1, 8192]
    - [110, 40283.2]
  - - [192, 224, 1, 32768]
    - [111, 80667.9]
  - - [224, 224, 1, 2048]
    - [132, 21026.2]
  - - [224, 224, 1, 8192]
    - [155, 44503.1]
  - - [224, 224, 1, 32768]
    - [226, 87533.8]
  - - [256, 224, 1, 2048]
    - [227, 22528.4]
  - - [256, 224, 1, 8192]
    - [228, 49960.7]
  - - [256, 224, 1, 32768]
    - [89, 101490.0]
  - - [320, 224, 1, 2048]
    - [132, 29732.7]
  - - [320, 224, 1, 8192]
    - [81, 62624.4]
  - - [320, 224, 1, 32768]
    - [229, 115775.0]
  - - [384, 224, 1, 2048]
    - [230, 31514.3]
  - - [384, 224, 1, 8192]
    - [231, 67898.4]
  - - [384, 224, 1, 32768]
    - [231, 110265.0]
  - - [896, 224, 1, 2048]
    - [232, 58593.4]
  - - [896, 224, 1, 8192]
    - [233, 109945.0]
  - - [896, 224, 1, 32768]
    - [233, 166676.0]
  - - [1024, 224, 1, 2048]
    - [234, 60203.1]
  - - [1024, 224, 1, 8192]
    - [235, 110839.0]
  - - [1024, 224, 1, 32768]
    - [235, 151695.0]
  - - [1280, 224, 1, 2048]
    - [81, 73971.3]
  - - [1280, 224, 1, 8192]
    - [89, 129857.0]
  - - [1280, 224, 1, 32768]
    - [82, 179009.0]
  - - [48, 320, 1, 32768]
    - [236, 6123.28]
  - - [64, 256, 1, 2048]
    - [85, 3067.36]
  - - [64, 256, 1, 8192]
    - [236, 4952.61]
  - - [64, 256, 1, 32768]
    - [236, 6552.43]
  - - [80, 256, 1, 2048]
    - [85, 3784.96]
  - - [80, 256, 1, 8192]
    - [237, 7598.44]
  - - [80, 256, 1, 32768]
    - [237, 10404.9]
  - - [96, 256, 1, 2048]
    - [85, 4537.84]
  - - [96, 256, 1, 8192]
    - [237, 9112.74]
  - - [96, 256, 1, 32768]
    - [237, 12483.9]
  - - [112, 256, 1, 2048]
    - [237, 4146.15]
  - - [112, 256, 1, 8192]
    - [238, 7613.15]
  - - [112, 256, 1, 32768]
    - [238, 9978.19]
  - - [64, 320, 1, 2048]
    - [239, 3001.9]
  - - [64, 320, 1, 8192]
    - [238, 5415.1]
  - - [64, 320, 1, 32768]
    - [238, 7122.73]
  - - [80, 320, 1, 2048]
    - [240, 3530.27]
  - - [80, 320, 1, 8192]
    - [241, 6731.63]
  - - [80, 320, 1, 32768]
    - [241, 8895.18]
  - - [96, 320, 1, 2048]
    - [240, 4233.76]
  - - [96, 320, 1, 8192]
    - [241, 8083.67]
  - - [96, 320, 1, 32768]
    - [241, 10676.0]
  - - [112, 320, 1, 2048]
    - [240, 4949.4]
  - - [112, 320, 1, 8192]
    - [241, 9447.07]
  - - [112, 320, 1, 32768]
    - [87, 13864.0]
  - - [128, 256, 1, 2048]
    - [87, 8578.41]
  - - [128, 256, 1, 8192]
    - [87, 11623.0]
  - - [128, 256, 1, 32768]
    - [87, 12748.8]
  - - [160, 256, 1, 32768]
    - [97, 16613.0]
  - - [192, 256, 1, 2048]
    - [242, 12109.0]
  - - [192, 256, 1, 8192]
    - [242, 16234.0]
  - - [192, 256, 1, 32768]
    - [209, 19926.7]
  - - [224, 256, 1, 2048]
    - [242, 14027.3]
  - - [224, 256, 1, 8192]
    - [242, 18806.7]
  - - [224, 256, 1, 32768]
    - [209, 23131.3]
  - - [128, 320, 1, 2048]
    - [242, 10092.0]
  - - [128, 320, 1, 8192]
    - [194, 13580.5]
  - - [128, 320, 1, 32768]
    - [209, 16693.7]
  - - [160, 320, 1, 2048]
    - [242, 12399.7]
  - - [160, 320, 1, 8192]
    - [243, 18520.2]
  - - [160, 320, 1, 32768]
    - [243, 22644.5]
  - - [192, 320, 1, 2048]
    - [243, 12363.5]
  - - [192, 320, 1, 8192]
    - [243, 21860.5]
  - - [192, 320, 1, 32768]
    - [243, 27098.2]
  - - [224, 320, 1, 2048]
    - [243, 14243.2]
  - - [224, 320, 1, 8192]
    - [243, 25466.2]
  - - [224, 320, 1, 32768]
    - [243, 31676.2]
  - - [256, 256, 1, 2048]
    - [243, 14077.9]
  - - [256, 256, 1, 8192]
    - [243, 23709.1]
  - - [256, 256, 1, 32768]
    - [162, 28315.0]
  - - [320, 256, 1, 2048]
    - [243, 16387.9]
  - - [320, 256, 1, 8192]
    - [243, 29303.0]
  - - [320, 256, 1, 32768]
    - [243, 36142.7]
  - - [384, 256, 1, 2048]
    - [243, 19425.8]
  - - [384, 256, 1, 8192]
    - [243, 35533.7]
  - - [384, 256, 1, 32768]
    - [243, 43711.6]
  - - [448, 256, 1, 2048]
    - [162, 21878.5]
  - - [448, 256, 1, 8192]
    - [243, 40854.3]
  - - [448, 256, 1, 32768]
    - [243, 50475.1]
  - - [256, 320, 1, 2048]
    - [243, 17638.1]
  - - [256, 320, 1, 8192]
    - [174, 10430.5]
  - - [256, 320, 1, 32768]
    - [174, 11221.0]
  - - [320, 320, 1, 2048]
    - [244, 9425.31]
  - - [320, 320, 1, 8192]
    - [174, 12521.4]
  - - [320, 320, 1, 32768]
    - [174, 13860.5]
  - - [384, 320, 1, 2048]
    - [245, 11425.7]
  - - [384, 320, 1, 8192]
    - [174, 14890.4]
  - - [384, 320, 1, 32768]
    - [174, 16587.4]
  - - [448, 320, 1, 32768]
    - [97, 56085.7]
  - - [512, 256, 1, 2048]
    - [242, 31294.4]
  - - [512, 256, 1, 8192]
    - [162, 44493.5]
  - - [512, 256, 1, 32768]
    - [246, 49812.0]
  - - [576, 256, 1, 2048]
    - [243, 28596.7]
  - - [576, 256, 1, 8192]
    - [243, 52364.9]
  - - [576, 256, 1, 32768]
    - [194, 56039.2]
  - - [640, 256, 1, 2048]
    - [194, 31115.5]
  - - [640, 256, 1, 8192]
    - [194, 53089.9]
  - - [640, 256, 1, 32768]
    - [194, 63295.9]
  - - [768, 256, 1, 2048]
    - [193, 19855.0]
  - - [768, 256, 1, 8192]
    - [174, 24961.6]
  - - [768, 256, 1, 32768]
    - [247, 63566.8]
  - - [896, 256, 1, 2048]
    - [125, 32475.0]
  - - [896, 256, 1, 8192]
    - [247, 57820.8]
  - - [896, 256, 1, 32768]
    - [247, 67206.4]
  - - [512, 320, 1, 2048]
    - [125, 27476.4]
  - - [512, 320, 1, 8192]
    - [247, 41716.1]
  - - [512, 320, 1, 32768]
    - [248, 83678.6]
  - - [576, 320, 1, 2048]
    - [103, 50122.1]
  - - [576, 320, 1, 8192]
    - [103, 76548.5]
  - - [576, 320, 1, 32768]
    - [126, 100757.0]
  - - [640, 320, 1, 2048]
    - [249, 47644.8]
  - - [640, 320, 1, 8192]
    - [103, 85918.3]
  - - [640, 320, 1, 32768]
    - [212, 109819.0]
  - - [768, 320, 1, 2048]
    - [126, 59469.2]
  - - [768, 320, 1, 8192]
    - [126, 87078.2]
  - - [768, 320, 1, 32768]
    - [212, 100366.0]
  - - [896, 320, 1, 2048]
    - [126, 69479.5]
  - - [896, 320, 1, 8192]
    - [126, 102377.0]
  - - [896, 320, 1, 32768]
    - [126, 109089.0]
  - - [1024, 256, 1, 2048]
    - [250, 59974.9]
  - - [1024, 256, 1, 8192]
    - [250, 85605.7]
  - - [1024, 256, 1, 32768]
    - [197, 89388.0]
  - - [1280, 256, 1, 2048]
    - [250, 74377.4]
  - - [1280, 256, 1, 8192]
    - [250, 105076.0]
  - - [1280, 256, 1, 32768]
    - [251, 161181.0]
  - - [1536, 256, 1, 2048]
    - [107, 56382.6]
  - - [1536, 256, 1, 8192]
    - [252, 110989.0]
  - - [1536, 256, 1, 32768]
    - [251, 151605.0]
  - - [1792, 256, 1, 2048]
    - [126, 67620.8]
  - - [1792, 256, 1, 8192]
    - [84, 116732.0]
  - - [1792, 256, 1, 32768]
    - [251, 151005.0]
  - - [1024, 320, 1, 2048]
    - [184, 65168.8]
  - - [1024, 320, 1, 8192]
    - [94, 107540.0]
  - - [1024, 320, 1, 32768]
    - [251, 135367.0]
  - - [1280, 320, 1, 2048]
    - [215, 66560.4]
  - - [1280, 320, 1, 8192]
    - [94, 117431.0]
  - - [1280, 320, 1, 32768]
    - [253, 179267.0]
  - - [1536, 320, 1, 2048]
    - [215, 68892.5]
  - - [1536, 320, 1, 8192]
    - [253, 104182.0]
  - - [1536, 320, 1, 32768]
    - [253, 144285.0]
  - - [1792, 320, 1, 2048]
    - [167, 81857.2]
  - - [1792, 320, 1, 8192]
    - [84, 124848.0]
  - - [1792, 320, 1, 32768]
    - [253, 157972.0]
  - - [2048, 256, 1, 2048]
    - [167, 67155.9]
  - - [2048, 256, 1, 8192]
    - [252, 113374.0]
  - - [2048, 256, 1, 32768]
    - [251, 156590.0]
  - - [2304, 256, 1, 2048]
    - [167, 84278.2]
  - - [2304, 256, 1, 8192]
    - [254, 122902.0]
  - - [2304, 256, 1, 32768]
    - [89, 175028.0]
  - - [2560, 256, 1, 2048]
    - [255, 83380.1]
  - - [2560, 256, 1, 8192]
    - [226, 135139.0]
  - - [2560, 256, 1, 32768]
    - [226, 174571.0]
  - - [2816, 256, 1, 2048]
    - [167, 84762.1]
  - - [2816, 256, 1, 8192]
    - [256, 128382.0]
  - - [2816, 256, 1, 32768]
    - [235, 178840.0]
  - - [3072, 256, 1, 2048]
    - [257, 81091.2]
  - - [3072, 256, 1, 8192]
    - [258, 136421.0]
  - - [3072, 256, 1, 32768]
    - [235, 170401.0]
  - - [3584, 256, 1, 2048]
    - [259, 84568.9]
  - - [3584, 256, 1, 8192]
    - [258, 138448.0]
  - - [2048, 320, 1, 2048]
    - [260, 76127.7]
  - - [2048, 320, 1, 8192]
    - [258, 141815.0]
  - - [2048, 320, 1, 32768]
    - [258, 171486.0]
  - - [2304, 320, 1, 2048]
    - [152, 82773.2]
  - - [2304, 320, 1, 8192]
    - [233, 145476.0]
  - - [2304, 320, 1, 32768]
    - [233, 193528.0]
  - - [2560, 320, 1, 2048]
    - [214, 91788.9]
  - - [2560, 320, 1, 8192]
    - [261, 147607.0]
  - - [2560, 320, 1, 32768]
    - [261, 185726.0]
  - - [2816, 320, 1, 2048]
    - [51, 98472.8]
  - - [2816, 320, 1, 8192]
    - [257, 156183.0]
  - - [2816, 320, 1, 32768]
    - [261, 198253.0]
  - - [4608, 256, 1, 2048]
    - [262, 105931.0]
  - - [4608, 256, 1, 8192]
    - [100, 168057.0]
  - - [5120, 256, 1, 2048]
    - [263, 117846.0]
  - - [5120, 256, 1, 8192]
    - [100, 180653.0]
  - - [5632, 256, 1, 2048]
    - [257, 105842.0]
  - - [5632, 256, 1, 8192]
    - [100, 176942.0]
  - - [4608, 320, 1, 2048]
    - [261, 107983.0]
  - - [4608, 320, 1, 8192]
    - [100, 180017.0]
  - - [5120, 320, 1, 2048]
    - [261, 113221.0]
  - - [5120, 320, 1, 8192]
    - [264, 180135.0]
  - - [5632, 320, 1, 2048]
    - [261, 110632.0]
  - - [5632, 320, 1, 8192]
    - [100, 187925.0]
  - - [16, 384, 1, 2048]
    - [82, 1202.55]
  - - [16, 384, 1, 8192]
    - [219, 2106.95]
  - - [48, 448, 1, 8192]
    - [219, 5293.04]
  - - [48, 448, 1, 32768]
    - [219, 6674.4]
  - - [64, 384, 1, 2048]
    - [265, 3612.65]
  - - [64, 384, 1, 8192]
    - [219, 6021.8]
  - - [64, 384, 1, 32768]
    - [219, 7630.27]
  - - [80, 384, 1, 2048]
    - [265, 4518.73]
  - - [80, 384, 1, 8192]
    - [219, 7469.92]
  - - [80, 384, 1, 32768]
    - [218, 9515.97]
  - - [96, 384, 1, 2048]
    - [265, 5389.12]
  - - [96, 384, 1, 8192]
    - [218, 8956.98]
  - - [96, 448, 1, 2048]
    - [242, 10272.1]
  - - [96, 448, 1, 8192]
    - [243, 15370.0]
  - - [96, 448, 1, 32768]
    - [243, 19015.0]
  - - [112, 448, 1, 2048]
    - [242, 11951.9]
  - - [112, 448, 1, 8192]
    - [243, 17844.2]
  - - [112, 448, 1, 32768]
    - [243, 22081.1]
  - - [128, 384, 1, 2048]
    - [162, 10628.8]
  - - [128, 384, 1, 8192]
    - [243, 18155.5]
  - - [128, 384, 1, 32768]
    - [243, 21961.0]
  - - [160, 384, 1, 2048]
    - [243, 12577.8]
  - - [160, 384, 1, 8192]
    - [243, 22078.7]
  - - [160, 384, 1, 32768]
    - [243, 27172.7]
  - - [192, 384, 1, 2048]
    - [266, 15326.8]
  - - [192, 384, 1, 8192]
    - [243, 26238.3]
  - - [192, 384, 1, 32768]
    - [243, 32521.4]
  - - [224, 384, 1, 2048]
    - [243, 16687.7]
  - - [224, 384, 1, 8192]
    - [243, 30173.8]
  - - [224, 384, 1, 32768]
    - [243, 37762.8]
  - - [128, 448, 1, 2048]
    - [243, 12429.2]
  - - [128, 448, 1, 8192]
    - [243, 21175.7]
  - - [128, 448, 1, 32768]
    - [243, 25583.4]
  - - [160, 448, 1, 2048]
    - [243, 14746.5]
  - - [160, 448, 1, 8192]
    - [174, 8647.25]
  - - [160, 448, 1, 32768]
    - [174, 9667.67]
  - - [192, 448, 1, 2048]
    - [245, 8047.04]
  - - [192, 448, 1, 8192]
    - [244, 10395.3]
  - - [192, 448, 1, 32768]
    - [174, 11338.0]
  - - [224, 448, 1, 2048]
    - [244, 9203.22]
  - - [224, 448, 1, 8192]
    - [244, 12036.3]
  - - [224, 448, 1, 32768]
    - [174, 13185.5]
  - - [256, 384, 1, 2048]
    - [193, 9950.62]
  - - [256, 384, 1, 8192]
    - [174, 12493.8]
  - - [256, 384, 1, 32768]
    - [174, 13524.7]
  - - [320, 384, 1, 2048]
    - [244, 11255.6]
  - - [320, 384, 1, 8192]
    - [174, 15041.2]
  - - [320, 384, 1, 32768]
    - [174, 16727.7]
  - - [384, 384, 1, 2048]
    - [244, 14324.2]
  - - [384, 384, 1, 8192]
    - [244, 18096.9]
  - - [384, 384, 1, 32768]
    - [174, 20017.5]
  - - [448, 384, 1, 2048]
    - [244, 15841.7]
  - - [448, 384, 1, 8192]
    - [243, 60339.9]
  - - [448, 384, 1, 32768]
    - [243, 74855.1]
  - - [256, 448, 1, 2048]
    - [243, 23832.1]
  - - [256, 448, 1, 8192]
    - [243, 40758.4]
  - - [256, 448, 1, 32768]
    - [162, 49343.2]
  - - [320, 448, 1, 2048]
    - [243, 27768.0]
  - - [320, 448, 1, 8192]
    - [243, 50800.0]
  - - [320, 448, 1, 32768]
    - [243, 62889.9]
  - - [384, 448, 1, 2048]
    - [245, 15907.6]
  - - [384, 448, 1, 8192]
    - [174, 20907.4]
  - - [384, 448, 1, 32768]
    - [174, 23297.5]
  - - [448, 448, 1, 2048]
    - [244, 18315.2]
  - - [448, 448, 1, 8192]
    - [174, 24174.8]
  - - [448, 448, 1, 32768]
    - [165, 62824.6]
  - - [512, 384, 1, 2048]
    - [125, 29224.9]
  - - [512, 384, 1, 8192]
    - [267, 50493.5]
  - - [512, 384, 1, 32768]
    - [267, 56213.5]
  - - [576, 384, 1, 2048]
    - [101, 34462.5]
  - - [576, 384, 1, 8192]
    - [247, 56737.4]
  - - [576, 384, 1, 32768]
    - [165, 66451.7]
  - - [640, 384, 1, 2048]
    - [101, 37918.8]
  - - [640, 384, 1, 8192]
    - [247, 59502.6]
  - - [640, 384, 1, 32768]
    - [198, 115673.0]
  - - [768, 384, 1, 2048]
    - [184, 69128.0]
  - - [768, 384, 1, 8192]
    - [184, 98542.8]
  - - [768, 384, 1, 32768]
    - [197, 107986.0]
  - - [896, 384, 1, 2048]
    - [268, 58751.6]
  - - [896, 384, 1, 8192]
    - [269, 87825.4]
  - - [896, 384, 1, 32768]
    - [197, 111845.0]
  - - [512, 448, 1, 2048]
    - [184, 48387.3]
  - - [512, 448, 1, 8192]
    - [225, 73202.7]
  - - [512, 448, 1, 32768]
    - [270, 84294.1]
  - - [576, 448, 1, 2048]
    - [184, 55390.8]
  - - [576, 448, 1, 8192]
    - [126, 93511.7]
  - - [576, 448, 1, 32768]
    - [126, 106211.0]
  - - [640, 448, 1, 2048]
    - [126, 69927.5]
  - - [640, 448, 1, 8192]
    - [126, 104598.0]
  - - [640, 448, 1, 32768]
    - [126, 112998.0]
  - - [768, 448, 1, 2048]
    - [105, 59356.9]
  - - [768, 448, 1, 8192]
    - [225, 92199.4]
  - - [768, 448, 1, 32768]
    - [197, 101525.0]
  - - [896, 448, 1, 2048]
    - [126, 66326.5]
  - - [896, 448, 1, 8192]
    - [126, 98717.2]
  - - [896, 448, 1, 32768]
    - [126, 115030.0]
  - - [1024, 384, 1, 2048]
    - [126, 52280.9]
  - - [1024, 384, 1, 8192]
    - [271, 83070.0]
  - - [1024, 384, 1, 32768]
    - [271, 96915.4]
  - - [1280, 384, 1, 2048]
    - [126, 74393.7]
  - - [1280, 384, 1, 8192]
    - [272, 104107.0]
  - - [1280, 384, 1, 32768]
    - [273, 183156.0]
  - - [1536, 384, 1, 2048]
    - [217, 77176.1]
  - - [1536, 384, 1, 8192]
    - [274, 123646.0]
  - - [1536, 384, 1, 32768]
    - [275, 154228.0]
  - - [1792, 384, 1, 2048]
    - [152, 84335.6]
  - - [1792, 384, 1, 8192]
    - [136, 131961.0]
  - - [1792, 384, 1, 32768]
    - [273, 172251.0]
  - - [1024, 448, 1, 2048]
    - [167, 72607.3]
  - - [1024, 448, 1, 8192]
    - [276, 116660.0]
  - - [1024, 448, 1, 32768]
    - [277, 149798.0]
  - - [1280, 448, 1, 2048]
    - [167, 82132.6]
  - - [1280, 448, 1, 8192]
    - [187, 142352.0]
  - - [1280, 448, 1, 32768]
    - [187, 176328.0]
  - - [1536, 448, 1, 2048]
    - [152, 72821.7]
  - - [1536, 448, 1, 8192]
    - [276, 120794.0]
  - - [1536, 448, 1, 32768]
    - [277, 150026.0]
  - - [1792, 448, 1, 2048]
    - [167, 95028.4]
  - - [1792, 448, 1, 8192]
    - [187, 136664.0]
  - - [1792, 448, 1, 32768]
    - [187, 168365.0]
  - - [2048, 384, 1, 2048]
    - [152, 80919.9]
  - - [2048, 384, 1, 8192]
    - [275, 124354.0]
  - - [2048, 384, 1, 32768]
    - [275, 157611.0]
  - - [2304, 384, 1, 2048]
    - [168, 100993.0]
  - - [2304, 384, 1, 8192]
    - [168, 141641.0]
  - - [2304, 384, 1, 32768]
    - [256, 178898.0]
  - - [2560, 384, 1, 2048]
    - [166, 106367.0]
  - - [2560, 384, 1, 8192]
    - [166, 129794.0]
  - - [2816, 384, 1, 2048]
    - [167, 98655.9]
  - - [2816, 384, 1, 8192]
    - [256, 141110.0]
  - - [3072, 384, 1, 2048]
    - [166, 88104.4]
  - - [3072, 384, 1, 8192]
    - [256, 130079.0]
  - - [3584, 384, 1, 2048]
    - [167, 79603.8]
  - - [3584, 384, 1, 8192]
    - [256, 127962.0]
  - - [2048, 448, 1, 2048]
    - [167, 83514.0]
  - - [2048, 448, 1, 8192]
    - [136, 115520.0]
  - - [2304, 448, 1, 2048]
    - [167, 94289.3]
  - - [2304, 448, 1, 8192]
    - [257, 160513.0]
  - - [2560, 448, 1, 2048]
    - [257, 93125.3]
  - - [2560, 448, 1, 8192]
    - [160, 162539.0]
  - - [2816, 448, 1, 2048]
    - [167, 102601.0]
  - - [2816, 448, 1, 8192]
    - [160, 169745.0]
  - - [3072, 448, 1, 2048]
    - [166, 102265.0]
  - - [3072, 448, 1, 8192]
    - [160, 163280.0]
  - - [3584, 448, 1, 2048]
    - [187, 102897.0]
  - - [3584, 448, 1, 8192]
    - [160, 169676.0]
  - - [4096, 384, 1, 2048]
    - [278, 99566.5]
  - - [4096, 384, 1, 8192]
    - [279, 164857.0]
  - - [4608, 384, 1, 2048]
    - [259, 99832.5]
  - - [4608, 384, 1, 8192]
    - [279, 169791.0]
  - - [5120, 384, 1, 2048]
    - [262, 115180.0]
  - - [5120, 384, 1, 8192]
    - [279, 173158.0]
  - - [5632, 384, 1, 2048]
    - [280, 107471.0]
  - - [5632, 384, 1, 8192]
    - [279, 167405.0]
  - - [6144, 384, 1, 2048]
    - [259, 107605.0]
  - - [6144, 384, 1, 8192]
    - [281, 187624.0]
  - - [7168, 384, 1, 2048]
    - [259, 109899.0]
  - - [7168, 384, 1, 8192]
    - [281, 190947.0]
  - - [4096, 448, 1, 2048]
    - [282, 117178.0]
  - - [4096, 448, 1, 8192]
    - [160, 173261.0]
  - - [4608, 448, 1, 2048]
    - [282, 107803.0]
  - - [4608, 448, 1, 8192]
    - [258, 162017.0]
  - - [5120, 448, 1, 2048]
    - [280, 114940.0]
  - - [5120, 448, 1, 8192]
    - [281, 169621.0]
  - - [5632, 448, 1, 2048]
    - [262, 114125.0]
  - - [5632, 448, 1, 8192]
    - [283, 168381.0]
  - - [6144, 448, 1, 2048]
    - [259, 109860.0]
  - - [6144, 448, 1, 8192]
    - [160, 176822.0]
  - - [7168, 448, 1, 2048]
    - [262, 111171.0]
  - - [7168, 448, 1, 8192]
    - [160, 180559.0]
  - - [8192, 384, 1, 2048]
    - [262, 109533.0]
  - - [8192, 384, 1, 8192]
    - [281, 187739.0]
  - - [10240, 384, 1, 2048]
    - [259, 113175.0]
  - - [160, 576, 1, 32768]
    - [241, 31529.1]
  - - [192, 576, 1, 2048]
    - [284, 15013.7]
  - - [192, 576, 1, 8192]
    - [241, 28120.7]
  - - [192, 576, 1, 32768]
    - [241, 37692.9]
  - - [224, 576, 1, 2048]
    - [284, 17424.5]
  - - [224, 576, 1, 8192]
    - [241, 32948.0]
  - - [224, 576, 1, 32768]
    - [241, 43980.5]
  - - [128, 640, 1, 2048]
    - [171, 12891.7]
  - - [128, 640, 1, 8192]
    - [241, 21093.3]
  - - [128, 640, 1, 32768]
    - [241, 28067.2]
  - - [160, 640, 1, 2048]
    - [195, 14309.4]
  - - [160, 640, 1, 8192]
    - [202, 23117.7]
  - - [160, 640, 1, 32768]
    - [204, 28383.5]
  - - [192, 640, 1, 2048]
    - [195, 17245.6]
  - - [192, 640, 1, 8192]
    - [202, 27634.3]
  - - [192, 640, 1, 32768]
    - [204, 33989.0]
  - - [320, 576, 1, 2048]
    - [285, 34859.2]
  - - [320, 576, 1, 8192]
    - [285, 45519.6]
  - - [320, 576, 1, 32768]
    - [243, 80183.8]
  - - [384, 576, 1, 2048]
    - [242, 52374.8]
  - - [384, 576, 1, 8192]
    - [243, 78921.2]
  - - [384, 576, 1, 32768]
    - [243, 96872.8]
  - - [448, 576, 1, 2048]
    - [242, 61104.0]
  - - [448, 576, 1, 8192]
    - [243, 88971.2]
  - - [448, 576, 1, 32768]
    - [243, 111152.0]
  - - [256, 640, 1, 2048]
    - [242, 39283.3]
  - - [256, 640, 1, 8192]
    - [243, 58279.5]
  - - [256, 640, 1, 32768]
    - [162, 69927.1]
  - - [320, 640, 1, 2048]
    - [242, 49335.6]
  - - [320, 640, 1, 8192]
    - [243, 71413.5]
  - - [320, 640, 1, 32768]
    - [243, 88908.5]
  - - [384, 640, 1, 2048]
    - [242, 57706.0]
  - - [384, 640, 1, 8192]
    - [243, 88552.2]
  - - [384, 640, 1, 32768]
    - [243, 107752.0]
  - - [448, 640, 1, 2048]
    - [242, 67370.3]
  - - [448, 640, 1, 8192]
    - [243, 98731.9]
  - - [448, 640, 1, 32768]
    - [243, 123342.0]
  - - [512, 512, 1, 2048]
    - [242, 62023.5]
  - - [512, 512, 1, 8192]
    - [162, 87198.0]
  - - [512, 512, 1, 32768]
    - [162, 98986.6]
  - - [576, 512, 1, 2048]
    - [242, 69639.5]
  - - [576, 512, 1, 8192]
    - [243, 101025.0]
  - - [576, 512, 1, 32768]
    - [243, 126279.0]
  - - [640, 512, 1, 2048]
    - [243, 56856.5]
  - - [640, 512, 1, 8192]
    - [243, 114413.0]
  - - [640, 512, 1, 32768]
    - [243, 141620.0]
  - - [768, 512, 1, 2048]
    - [162, 62730.5]
  - - [768, 512, 1, 8192]
    - [162, 132212.0]
  - - [768, 512, 1, 32768]
    - [162, 164486.0]
  - - [896, 512, 1, 2048]
    - [243, 73831.2]
  - - [896, 512, 1, 8192]
    - [194, 139219.0]
  - - [896, 512, 1, 32768]
    - [194, 171784.0]
  - - [512, 576, 1, 2048]
    - [162, 53147.8]
  - - [512, 576, 1, 8192]
    - [162, 97886.6]
  - - [512, 576, 1, 32768]
    - [162, 111192.0]
  - - [576, 576, 1, 2048]
    - [243, 56929.1]
  - - [576, 576, 1, 8192]
    - [243, 112181.0]
  - - [576, 576, 1, 32768]
    - [243, 141675.0]
  - - [640, 576, 1, 2048]
    - [243, 62292.2]
  - - [640, 576, 1, 8192]
    - [243, 126968.0]
  - - [640, 576, 1, 32768]
    - [243, 158543.0]
  - - [768, 576, 1, 2048]
    - [286, 70112.0]
  - - [768, 576, 1, 8192]
    - [162, 148787.0]
  - - [768, 576, 1, 32768]
    - [174, 60159.7]
  - - [896, 576, 1, 2048]
    - [244, 46598.9]
  - - [896, 576, 1, 8192]
    - [174, 61796.8]
  - - [896, 576, 1, 32768]
    - [174, 69098.1]
  - - [512, 640, 1, 2048]
    - [193, 32307.7]
  - - [512, 640, 1, 8192]
    - [174, 41342.6]
  - - [512, 640, 1, 32768]
    - [174, 44044.2]
  - - [576, 640, 1, 2048]
    - [244, 35820.7]
  - - [576, 640, 1, 8192]
    - [244, 44966.7]
  - - [576, 640, 1, 32768]
    - [174, 49633.4]
  - - [640, 640, 1, 2048]
    - [244, 36999.5]
  - - [640, 640, 1, 8192]
    - [174, 48993.4]
  - - [640, 640, 1, 32768]
    - [174, 55288.0]
  - - [768, 640, 1, 2048]
    - [193, 48251.9]
  - - [768, 640, 1, 8192]
    - [174, 62098.3]
  - - [768, 640, 1, 32768]
    - [174, 67178.9]
  - - [896, 640, 1, 2048]
    - [244, 51785.6]
  - - [896, 640, 1, 8192]
    - [174, 68828.5]
  - - [896, 640, 1, 32768]
    - [174, 77107.2]
  - - [1024, 512, 1, 2048]
    - [193, 51183.6]
  - - [1024, 512, 1, 8192]
    - [174, 66291.5]
  - - [1024, 512, 1, 32768]
    - [174, 70357.4]
  - - [1280, 512, 1, 2048]
    - [193, 63906.1]
  - - [1280, 512, 1, 8192]
    - [174, 82486.6]
  - - [1280, 512, 1, 32768]
    - [194, 241158.0]
  - - [1536, 512, 1, 2048]
    - [162, 117602.0]
  - - [1536, 512, 1, 8192]
    - [145, 184840.0]
  - - [1536, 512, 1, 32768]
    - [145, 224793.0]
  - - [1792, 512, 1, 2048]
    - [194, 129631.0]
  - - [1792, 512, 1, 8192]
    - [179, 188358.0]
  - - [1024, 576, 1, 2048]
    - [193, 57313.1]
  - - [1024, 576, 1, 8192]
    - [174, 73781.2]
  - - [1024, 576, 1, 32768]
    - [174, 78977.0]
  - - [1280, 576, 1, 2048]
    - [193, 71498.6]
  - - [1280, 576, 1, 8192]
    - [174, 91886.2]
  - - [1280, 576, 1, 32768]
    - [174, 99870.7]
  - - [1536, 576, 1, 2048]
    - [193, 85007.5]
  - - [1536, 576, 1, 8192]
    - [174, 109343.0]
  - - [1536, 576, 1, 32768]
    - [174, 117677.0]
  - - [1792, 576, 1, 2048]
    - [193, 98628.0]
  - - [1792, 576, 1, 8192]
    - [174, 127332.0]
  - - [1024, 640, 1, 2048]
    - [193, 63415.8]
  - - [1024, 640, 1, 8192]
    - [247, 58849.4]
  - - [1024, 640, 1, 32768]
    - [287, 62315.4]
  - - [1280, 640, 1, 2048]
    - [125, 51864.0]
  - - [1280, 640, 1, 8192]
    - [247, 67049.6]
  - - [1280, 640, 1, 32768]
    - [247, 72570.2]
  - - [1536, 640, 1, 2048]
    - [125, 46118.2]
  - - [1536, 640, 1, 8192]
    - [197, 92661.9]
  - - [1792, 640, 1, 2048]
    - [126, 83938.7]
  - - [1792, 640, 1, 8192]
    - [197, 107889.0]
  - - [2048, 512, 1, 2048]
    - [184, 60698.7]
  - - [2048, 512, 1, 8192]
    - [197, 87377.5]
  - - [2304, 512, 1, 2048]
    - [126, 74698.2]
  - - [2304, 512, 1, 8192]
    - [197, 109046.0]
  - - [2560, 512, 1, 2048]
    - [184, 67270.6]
  - - [2560, 512, 1, 8192]
    - [197, 90431.6]
  - - [2816, 512, 1, 2048]
    - [126, 77952.8]
  - - [2816, 512, 1, 8192]
    - [197, 107985.0]
  - - [3072, 512, 1, 2048]
    - [197, 63713.0]
  - - [3072, 512, 1, 8192]
    - [197, 90838.3]
  - - [3584, 512, 1, 2048]
    - [197, 70714.9]
  - - [3584, 512, 1, 8192]
    - [197, 89639.6]
  - - [2048, 576, 1, 2048]
    - [127, 71878.1]
  - - [2048, 576, 1, 8192]
    - [271, 91511.2]
  - - [2304, 576, 1, 2048]
    - [127, 86336.4]
  - - [2304, 576, 1, 8192]
    - [288, 146181.0]
  - - [2560, 576, 1, 2048]
    - [166, 110437.0]
  - - [2560, 576, 1, 8192]
    - [288, 146036.0]
  - - [2816, 576, 1, 2048]
    - [167, 109431.0]
  - - [2816, 576, 1, 8192]
    - [288, 149972.0]
  - - [3072, 576, 1, 2048]
    - [166, 101338.0]
  - - [3072, 576, 1, 8192]
    - [289, 146881.0]
  - - [3584, 576, 1, 2048]
    - [166, 96054.3]
  - - [3584, 576, 1, 8192]
    - [289, 149364.0]
  - - [2048, 640, 1, 2048]
    - [166, 97197.2]
  - - [2048, 640, 1, 8192]
    - [290, 135717.0]
  - - [2304, 640, 1, 2048]
    - [167, 109007.0]
  - - [2304, 640, 1, 8192]
    - [291, 145761.0]
  - - [2560, 640, 1, 2048]
    - [167, 95753.0]
  - - [2560, 640, 1, 8192]
    - [292, 138846.0]
  - - [2816, 640, 1, 2048]
    - [51, 107361.0]
  - - [2816, 640, 1, 8192]
    - [256, 152677.0]
  - - [3072, 640, 1, 2048]
    - [293, 94072.2]
  - - [3072, 640, 1, 8192]
    - [290, 143072.0]
  - - [3584, 640, 1, 2048]
    - [166, 105331.0]
  - - [3584, 640, 1, 8192]
    - [292, 143308.0]
  - - [4096, 512, 1, 2048]
    - [166, 92546.3]
  - - [4096, 512, 1, 8192]
    - [290, 141782.0]
  - - [4608, 512, 1, 2048]
    - [294, 93952.7]
  - - [4608, 512, 1, 8192]
    - [283, 192041.0]
  - - [5120, 512, 1, 2048]
    - [282, 118924.0]
  - - [5120, 512, 1, 8192]
    - [283, 194699.0]
  - - [5632, 512, 1, 2048]
    - [257, 114421.0]
  - - [5632, 512, 1, 8192]
    - [283, 190325.0]
  - - [6144, 512, 1, 2048]
    - [258, 114607.0]
  - - [6144, 512, 1, 8192]
    - [283, 190197.0]
  - - [7168, 512, 1, 2048]
    - [258, 116805.0]
  - - [7168, 512, 1, 8192]
    - [283, 197750.0]
  - - [4096, 576, 1, 2048]
    - [279, 116832.0]
  - - [4096, 576, 1, 8192]
    - [295, 191215.0]
  - - [4608, 576, 1, 2048]
    - [279, 116300.0]
  - - [4608, 576, 1, 8192]
    - [295, 194262.0]
  - - [5120, 576, 1, 2048]
    - [279, 116808.0]
  - - [5120, 576, 1, 8192]
    - [295, 198560.0]
  - - [5632, 576, 1, 2048]
    - [259, 116966.0]
  - - [5632, 576, 1, 8192]
    - [295, 199796.0]
  - - [6144, 576, 1, 2048]
    - [279, 117259.0]
  - - [6144, 576, 1, 8192]
    - [295, 201213.0]
  - - [7168, 576, 1, 2048]
    - [296, 119089.0]
  - - [7168, 576, 1, 8192]
    - [295, 203554.0]
  - - [4096, 640, 1, 2048]
    - [282, 123158.0]
  - - [4096, 640, 1, 8192]
    - [281, 203166.0]
  - - [4608, 640, 1, 2048]
    - [261, 119245.0]
  - - [12288, 576, 1, 8192]
    - [297, 225127.0]
  - - [14336, 576, 1, 2048]
    - [298, 155264.0]
  - - [98304, 512, 1, 2048]
    - [299, 205052.0]
  - - [131072, 512, 1, 2048]
    - [297, 197871.0]
  - - [262144, 512, 1, 2048]
    - [96, 180748.0]
  - - [65536, 576, 1, 2048]
    - [299, 236028.0]
