projects/hipblaslt/library/src/amd_detail/rocblaslt/src/Tensile/Logic/asm_full/aquavanjaram/gfx942_80cu/GridBased/aquavanjaram_Cijk_Ailk_Bjlk_I8_II_BH_UserArgs.yaml
- {MinimumRequiredVersion: 5.0.0}
- aquavanjaram
- {Architecture: gfx942, CUCount: 80}
- [Device 0049, Device 0050]
    SolutionIndex: 0
    SolutionNameMin: Cijk_Ailk_Bjlk_I8II_BH_UserArgs_MT16x16x128_MI16x16x1_SN_LDSB1_AFC0_AFEM1_AFEM1_ASEM1_CLR0_CADS0_DTVA0_DTVB0_EPS0_FDSI0_GRPM1_GRVWA1_GRVWB1_GSUn1_GSUAMBSK_GSUC1_GSUWGMRR1_GLS0_ISA942_IU1_K1_LBSPPA128_LBSPPB128_LBSPPM0_LPA16_LPB16_LPM0_LRVW8_LWPMn1_MIAV0_MIWT1_1_MO40_NTn1_NTA0_NTB0_NTC0_NTD4_NTM0_NEPBS8_NLCA1_NLCB1_ONLL1_PGR2_PLR0_PKA1_SIA3_SS1_SU0_SUM1_SUS0_SPO0_SRVW0_SSO0_SVW1_SK0_SKXCCM0_TLDS0_ULSGRO0_USL1_UIOFGRO0_USFGROn1_VSn1_VWA1_VWB1_WSGRA0_WSGRB0_WS64_WG16_4_4_WGM1_WGMXCC4_WGMXCCGn1
    SolutionIndex: 1
    SolutionNameMin: Cijk_Ailk_Bjlk_I8II_BH_UserArgs_MT16x16x256_MI16x16x1_SN_LDSB0_AFC0_AFEM1_AFEM1_ASEM1_CLR1_CADS0_DTVA0_DTVB0_EPS0_FDSI0_GRPM1_GRVWA1_GRVWB1_GSUn1_GSUAMBSK_GSUC1_GSUWGMRR1_GLS0_ISA942_IU1_K1_LBSPPA128_LBSPPB128_LBSPPM0_LPA16_LPB16_LPM0_LRVW8_LWPMn1_MIAV0_MIWT1_1_MO40_NTn1_NTA0_NTB0_NTC0_NTD4_NTM0_NEPBS8_NLCA1_NLCB1_ONLL1_PGR2_PLR1_PKA1_SIA3_SS1_SU0_SUM1_SUS0_SPO0_SRVW0_SSO0_SVW1_SK0_SKXCCM0_TLDS0_ULSGRO0_USL1_UIOFGRO0_USFGROn1_VSn1_VWA1_VWB1_WSGRA0_WSGRB0_WS64_WG16_4_4_WGM1_WGMXCC4_WGMXCCGn1
    SolutionIndex: 2
    SolutionNameMin: Cijk_Ailk_Bjlk_I8II_BH_UserArgs_MT16x16x256_MI16x16x1_SN_LDSB0_AFC0_AFEM1_AFEM1_ASEM1_CLR1_CADS0_DTVA0_DTVB0_EPS0_FDSI0_GRPM1_GRVWA16_GRVWB1_GSUn1_GSUAMBSK_GSUC1_GSUWGMRR1_GLS0_ISA942_IU1_K1_LBSPPA128_LBSPPB128_LBSPPM0_LPA16_LPB16_LPM0_LRVW8_LWPMn1_MIAV0_MIWT1_1_MO40_NTn1_NTA0_NTB0_NTC0_NTD4_NTM0_NEPBS8_NLCA1_NLCB1_ONLL1_PGR2_PLR1_PKA1_SIA3_SS1_SU0_SUM1_SUS0_SPO0_SRVW0_SSO0_SVW1_SK0_SKXCCM0_TLDS0_ULSGRO0_USL1_UIOFGRO0_USFGROn1_VSn1_VWA1_VWB1_WSGRA0_WSGRB0_WS64_WG16_4_4_WGM1_WGMXCC4_WGMXCCGn1
    SolutionIndex: 3
    SolutionNameMin: Cijk_Ailk_Bjlk_I8II_BH_UserArgs_MT16x16x256_MI16x16x1_SN_LDSB1_AFC0_AFEM1_AFEM1_ASEM1_CLR1_CADS0_DTVA0_DTVB0_EPS0_FDSI0_GRPM1_GRVWA16_GRVWB1_GSUn1_GSUAMBSK_GSUC1_GSUWGMRR1_GLS0_ISA942_IU1_K1_LBSPPA128_LBSPPB128_LBSPPM0_LPA16_LPB16_LPM0_LRVW8_LWPMn1_MIAV0_MIWT1_1_MO40_NTn1_NTA0_NTB0_NTC0_NTD4_NTM0_NEPBS8_NLCA1_NLCB1_ONLL1_PGR2_PLR1_PKA1_SIA3_SS1_SU0_SUM1_SUS0_SPO0_SRVW0_SSO0_SVW1_SK0_SKXCCM0_TLDS0_ULSGRO0_USL1_UIOFGRO0_USFGROn1_VSn1_VWA1_VWB1_WSGRA0_WSGRB0_WS64_WG16_4_4_WGM1_WGMXCC4_WGMXCCGn1
    SolutionIndex: 4
    SolutionNameMin: Cijk_Ailk_Bjlk_I8II_BH_UserArgs_MT32x16x128_MI16x16x1_SN_LDSB1_AFC0_AFEM1_AFEM1_ASEM1_CLR0_CADS0_DTVA0_DTVB0_EPS0_FDSI0_GRPM1_GRVWA16_GRVWB1_GSUn1_GSUAMBSK_GSUC1_GSUWGMRR1_GLS0_ISA942_IU1_K1_LBSPPA256_LBSPPB128_LBSPPM0_LPA32_LPB16_LPM0_LRVW8_LWPMn1_MIAV0_MIWT2_1_MO40_NTn1_NTA0_NTB0_NTC0_NTD4_NTM0_NEPBS8_NLCA1_NLCB1_ONLL1_PGR2_PLR0_PKA1_SIA3_SS1_SU0_SUM1_SUS0_SPO0_SRVW0_SSO0_SVW2_SK0_SKXCCM0_TLDS0_ULSGRO0_USL1_UIOFGRO0_USFGROn1_VSn1_VWA2_VWB1_WSGRA0_WSGRB0_WS64_WG16_4_4_WGM1_WGMXCC4_WGMXCCGn1
    SolutionIndex: 5
    SolutionNameMin: Cijk_Ailk_Bjlk_I8II_BH_UserArgs_MT32x16x128_MI16x16x1_SN_LDSB0_AFC0_AFEM1_AFEM1_ASEM1_CLR1_CADS0_DTVA0_DTVB0_EPS0_FDSI0_GRPM1_GRVWA16_GRVWB1_GSUn1_GSUAMBSK_GSUC1_GSUWGMRR1_GLS0_ISA942_IU1_K1_LBSPPA256_LBSPPB128_LBSPPM0_LPA16_LPB16_LPM0_LRVW8_LWPMn1_MIAV0_MIWT1_1_MO40_NTn1_NTA0_NTB0_NTC0_NTD4_NTM0_NEPBS8_NLCA1_NLCB1_ONLL1_PGR2_PLR1_PKA1_SIA3_SS1_SU0_SUM1_SUS0_SPO0_SRVW0_SSO0_SVW1_SK0_SKXCCM0_TLDS0_ULSGRO0_USL1_UIOFGRO0_USFGROn1_VSn1_VWA1_VWB1_WSGRA0_WSGRB0_WS64_WG32_4_2_WGM1_WGMXCC4_WGMXCCGn1
    SolutionIndex: 6
    SolutionNameMin: Cijk_Ailk_Bjlk_I8II_BH_UserArgs_MT32x16x256_MI16x16x1_SN_LDSB0_AFC0_AFEM1_AFEM1_ASEM1_CLR1_CADS0_DTVA0_DTVB0_EPS0_FDSI0_GRPM1_GRVWA16_GRVWB1_GSUn1_GSUAMBSK_GSUC1_GSUWGMRR1_GLS0_ISA942_IU1_K1_LBSPPA256_LBSPPB128_LBSPPM0_LPA16_LPB16_LPM0_LRVW8_LWPMn1_MIAV0_MIWT1_1_MO40_NTn1_NTA0_NTB0_NTC0_NTD4_NTM0_NEPBS8_NLCA1_NLCB1_ONLL1_PGR2_PLR1_PKA1_SIA3_SS1_SU0_SUM1_SUS0_SPO0_SRVW0_SSO0_SVW1_SK0_SKXCCM0_TLDS0_ULSGRO0_USL1_UIOFGRO0_USFGROn1_VSn1_VWA1_VWB1_WSGRA0_WSGRB0_WS64_WG32_4_2_WGM1_WGMXCC4_WGMXCCGn1
    SolutionIndex: 7
    SolutionNameMin: Cijk_Ailk_Bjlk_I8II_BH_UserArgs_MT32x16x256_MI16x16x1_SN_LDSB0_AFC0_AFEM1_AFEM1_ASEM1_CLR1_CADS0_DTVA0_DTVB0_EPS0_FDSI0_GRPM1_GRVWA16_GRVWB1_GSUn1_GSUAMBSK_GSUC1_GSUWGMRR1_GLS0_ISA942_IU1_K1_LBSPPA256_LBSPPB128_LBSPPM0_LPA32_LPB16_LPM0_LRVW8_LWPMn1_MIAV0_MIWT2_1_MO40_NTn1_NTA0_NTB0_NTC0_NTD4_NTM0_NEPBS8_NLCA1_NLCB1_ONLL1_PGR2_PLR1_PKA1_SIA3_SS1_SU0_SUM1_SUS0_SPO0_SRVW0_SSO0_SVW2_SK0_SKXCCM0_TLDS0_ULSGRO0_USL1_UIOFGRO0_USFGROn1_VSn1_VWA2_VWB1_WSGRA0_WSGRB0_WS64_WG16_4_4_WGM1_WGMXCC4_WGMXCCGn1
    SolutionIndex: 8
    SolutionNameMin: Cijk_Ailk_Bjlk_I8II_BH_UserArgs_MT64x16x256_MI16x16x1_SN_LDSB1_AFC0_AFEM1_AFEM1_ASEM1_CLR1_CADS0_DTVA0_DTVB0_EPS0_FDSI0_GRPM1_GRVWA16_GRVWB1_GSUn1_GSUAMBSK_GSUC1_GSUWGMRR1_GLS0_ISA942_IU1_K1_LBSPPA512_LBSPPB128_LBSPPM0_LPA64_LPB16_LPM0_LRVW8_LWPMn1_MIAV0_MIWT4_1_MO40_NTn1_NTA0_NTB0_NTC0_NTD4_NTM0_NEPBS8_NLCA1_NLCB1_ONLL1_PGR2_PLR1_PKA1_SIA3_SS1_SU0_SUM1_SUS0_SPO0_SRVW0_SSO0_SVW4_SK0_SKXCCM0_TLDS0_ULSGRO0_USL1_UIOFGRO0_USFGROn1_VSn1_VWA4_VWB1_WSGRA0_WSGRB0_WS64_WG16_4_4_WGM1_WGMXCC4_WGMXCCGn1
    SolutionIndex: 9
    SolutionNameMin: Cijk_Ailk_Bjlk_I8II_BH_UserArgs_MT32x16x128_MI16x16x1_SN_LDSB0_AFC0_AFEM1_AFEM1_ASEM1_CLR0_CADS0_DTVA0_DTVB0_EPS0_FDSI0_GRPM1_GRVWA16_GRVWB1_GSUn1_GSUAMBSK_GSUC1_GSUWGMRR1_GLS0_ISA942_IU1_K1_LBSPPA256_LBSPPB128_LBSPPM0_LPA32_LPB16_LPM0_LRVW8_LWPMn1_MIAV0_MIWT2_1_MO40_NTn1_NTA0_NTB0_NTC0_NTD4_NTM0_NEPBS8_NLCA1_NLCB1_ONLL1_PGR2_PLR0_PKA1_SIA3_SS1_SU0_SUM1_SUS0_SPO0_SRVW0_SSO0_SVW2_SK0_SKXCCM0_TLDS0_ULSGRO0_USL1_UIOFGRO0_USFGROn1_VSn1_VWA2_VWB1_WSGRA0_WSGRB0_WS64_WG16_4_4_WGM1_WGMXCC4_WGMXCCGn1
    SolutionIndex: 10
    SolutionNameMin: Cijk_Ailk_Bjlk_I8II_BH_UserArgs_MT64x16x128_MI16x16x1_SN_LDSB0_AFC0_AFEM1_AFEM1_ASEM1_CLR0_CADS0_DTVA0_DTVB0_EPS0_FDSI0_GRPM1_GRVWA16_GRVWB1_GSUn1_GSUAMBSK_GSUC1_GSUWGMRR1_GLS0_ISA942_IU1_K1_LBSPPA512_LBSPPB128_LBSPPM0_LPA64_LPB16_LPM0_LRVW8_LWPMn1_MIAV0_MIWT4_1_MO40_NTn1_NTA0_NTB0_NTC0_NTD4_NTM0_NEPBS8_NLCA1_NLCB1_ONLL1_PGR2_PLR0_PKA1_SIA3_SS1_SU0_SUM1_SUS0_SPO0_SRVW0_SSO0_SVW4_SK0_SKXCCM0_TLDS0_ULSGRO0_USL1_UIOFGRO0_USFGROn1_VSn1_VWA4_VWB1_WSGRA0_WSGRB0_WS64_WG16_4_4_WGM1_WGMXCC4_WGMXCCGn1
    SolutionIndex: 11
    SolutionNameMin: Cijk_Ailk_Bjlk_I8II_BH_UserArgs_MT64x16x128_MI16x16x1_SN_LDSB1_AFC0_AFEM1_AFEM1_ASEM1_CLR1_CADS0_DTVA0_DTVB0_EPS0_FDSI0_GRPM1_GRVWA16_GRVWB1_GSUn1_GSUAMBSK_GSUC1_GSUWGMRR1_GLS0_ISA942_IU1_K1_LBSPPA512_LBSPPB128_LBSPPM0_LPA32_LPB16_LPM0_LRVW8_LWPMn1_MIAV0_MIWT2_1_MO40_NTn1_NTA0_NTB0_NTC0_NTD4_NTM0_NEPBS8_NLCA1_NLCB1_ONLL1_PGR2_PLR1_PKA1_SIA3_SS1_SU0_SUM1_SUS0_SPO0_SRVW0_SSO0_SVW2_SK0_SKXCCM0_TLDS0_ULSGRO0_USL1_UIOFGRO0_USFGROn1_VSn1_VWA2_VWB1_WSGRA0_WSGRB0_WS64_WG32_4_2_WGM1_WGMXCC4_WGMXCCGn1
    SolutionIndex: 12
    SolutionNameMin: Cijk_Ailk_Bjlk_I8II_BH_UserArgs_MT64x16x128_MI16x16x1_SN_LDSB0_AFC0_AFEM1_AFEM1_ASEM1_CLR1_CADS0_DTVA0_DTVB0_EPS0_FDSI0_GRPM1_GRVWA16_GRVWB1_GSUn1_GSUAMBSK_GSUC1_GSUWGMRR1_GLS0_ISA942_IU1_K1_LBSPPA512_LBSPPB128_LBSPPM0_LPA32_LPB16_LPM0_LRVW8_LWPMn1_MIAV0_MIWT2_1_MO40_NTn1_NTA0_NTB0_NTC0_NTD4_NTM0_NEPBS8_NLCA1_NLCB1_ONLL1_PGR2_PLR1_PKA1_SIA3_SS1_SU0_SUM1_SUS0_SPO0_SRVW0_SSO0_SVW2_SK0_SKXCCM0_TLDS0_ULSGRO0_USL1_UIOFGRO0_USFGROn1_VSn1_VWA2_VWB1_WSGRA0_WSGRB0_WS64_WG32_4_2_WGM1_WGMXCC4_WGMXCCGn1
    SolutionIndex: 13
    SolutionNameMin: Cijk_Ailk_Bjlk_I8II_BH_UserArgs_MT64x16x128_MI16x16x1_SN_LDSB1_AFC0_AFEM1_AFEM1_ASEM1_CLR0_CADS0_DTVA0_DTVB0_EPS0_FDSI0_GRPM1_GRVWA16_GRVWB1_GSUn1_GSUAMBSK_GSUC1_GSUWGMRR1_GLS0_ISA942_IU1_K1_LBSPPA512_LBSPPB128_LBSPPM0_LPA64_LPB16_LPM0_LRVW8_LWPMn1_MIAV0_MIWT4_1_MO40_NTn1_NTA0_NTB0_NTC0_NTD4_NTM0_NEPBS8_NLCA1_NLCB1_ONLL1_PGR2_PLR0_PKA1_SIA3_SS1_SU0_SUM1_SUS0_SPO0_SRVW0_SSO0_SVW4_SK0_SKXCCM0_TLDS0_ULSGRO0_USL1_UIOFGRO0_USFGROn1_VSn1_VWA4_VWB1_WSGRA0_WSGRB0_WS64_WG16_4_4_WGM1_WGMXCC4_WGMXCCGn1
    SolutionIndex: 14
    SolutionNameMin: Cijk_Ailk_Bjlk_I8II_BH_UserArgs_MT32x16x128_MI16x16x1_SN_LDSB1_AFC0_AFEM1_AFEM1_ASEM1_CLR1_CADS0_DTVA0_DTVB0_EPS0_FDSI0_GRPM1_GRVWA16_GRVWB1_GSUn1_GSUAMBSK_GSUC1_GSUWGMRR1_GLS0_ISA942_IU1_K1_LBSPPA256_LBSPPB128_LBSPPM0_LPA16_LPB16_LPM0_LRVW8_LWPMn1_MIAV0_MIWT1_1_MO40_NTn1_NTA0_NTB0_NTC0_NTD4_NTM0_NEPBS8_NLCA1_NLCB1_ONLL1_PGR2_PLR1_PKA1_SIA3_SS1_SU0_SUM1_SUS0_SPO0_SRVW0_SSO0_SVW1_SK0_SKXCCM0_TLDS0_ULSGRO0_USL1_UIOFGRO0_USFGROn1_VSn1_VWA1_VWB1_WSGRA0_WSGRB0_WS64_WG32_4_2_WGM1_WGMXCC4_WGMXCCGn1
    SolutionIndex: 15
    SolutionNameMin: Cijk_Ailk_Bjlk_I8II_BH_UserArgs_MT64x16x256_MI16x16x1_SN_LDSB0_AFC0_AFEM1_AFEM1_ASEM1_CLR1_CADS0_DTVA0_DTVB0_EPS0_FDSI0_GRPM1_GRVWA16_GRVWB1_GSUn1_GSUAMBSK_GSUC1_GSUWGMRR1_GLS0_ISA942_IU1_K1_LBSPPA512_LBSPPB128_LBSPPM0_LPA64_LPB16_LPM0_LRVW8_LWPMn1_MIAV0_MIWT4_1_MO40_NTn1_NTA0_NTB0_NTC0_NTD4_NTM0_NEPBS8_NLCA1_NLCB1_ONLL1_PGR2_PLR1_PKA1_SIA3_SS1_SU0_SUM1_SUS0_SPO0_SRVW0_SSO0_SVW4_SK0_SKXCCM0_TLDS0_ULSGRO0_USL1_UIOFGRO0_USFGROn1_VSn1_VWA4_VWB1_WSGRA0_WSGRB0_WS64_WG16_4_4_WGM1_WGMXCC4_WGMXCCGn1
    SolutionIndex: 16
    SolutionNameMin: Cijk_Ailk_Bjlk_I8II_BH_UserArgs_MT256x16x128_MI16x16x1_SN_LDSB1_AFC0_AFEM1_AFEM1_ASEM1_CLR1_CADS0_DTVA0_DTVB0_EPS0_FDSI0_GRPM1_GRVWA16_GRVWB1_GSUn1_GSUAMBSK_GSUC1_GSUWGMRR1_GLS0_ISA942_IU1_K1_LBSPPA2048_LBSPPB128_LBSPPM0_LPA64_LPB16_LPM0_LRVW8_LWPMn1_MIAV0_MIWT8_1_MO40_NTn1_NTA0_NTB0_NTC0_NTD4_NTM0_NEPBS8_NLCA1_NLCB1_ONLL1_PGR2_PLR1_PKA1_SIA3_SS1_SU0_SUM1_SUS0_SPO0_SRVW0_SSO0_SVW8_SK0_SKXCCM0_TLDS0_ULSGRO0_USL1_UIOFGRO0_USFGROn1_VSn1_VWA8_VWB1_WSGRA0_WSGRB0_WS64_WG32_4_2_WGM1_WGMXCC4_WGMXCCGn1
    SolutionIndex: 17
    SolutionNameMin: Cijk_Ailk_Bjlk_I8II_BH_UserArgs_MT128x16x256_MI16x16x1_SN_LDSB1_AFC0_AFEM1_AFEM1_ASEM1_CLR1_CADS0_DTVA0_DTVB0_EPS0_FDSI0_GRPM1_GRVWA16_GRVWB1_GSUn1_GSUAMBSK_GSUC1_GSUWGMRR1_GLS0_ISA942_IU1_K1_LBSPPA1024_LBSPPB128_LBSPPM0_LPA64_LPB16_LPM0_LRVW8_LWPMn1_MIAV0_MIWT4_1_MO40_NTn1_NTA0_NTB0_NTC0_NTD4_NTM0_NEPBS8_NLCA1_NLCB1_ONLL1_PGR2_PLR1_PKA1_SIA3_SS1_SU0_SUM1_SUS0_SPO0_SRVW0_SSO0_SVW4_SK0_SKXCCM0_TLDS0_ULSGRO0_USL1_UIOFGRO0_USFGROn1_VSn1_VWA4_VWB1_WSGRA0_WSGRB0_WS64_WG32_4_2_WGM1_WGMXCC4_WGMXCCGn1
    SolutionIndex: 18
    SolutionNameMin: Cijk_Ailk_Bjlk_I8II_BH_UserArgs_MT128x16x256_MI16x16x1_SN_LDSB1_AFC0_AFEM1_AFEM1_ASEM1_CLR1_CADS0_DTVA0_DTVB0_EPS0_FDSI0_GRPM1_GRVWA16_GRVWB1_GSUn1_GSUAMBSK_GSUC1_GSUWGMRR1_GLS0_ISA942_IU1_K1_LBSPPA1024_LBSPPB128_LBSPPM0_LPA64_LPB16_LPM0_LRVW8_LWPMn1_MIAV0_MIWT8_1_MO40_NTn1_NTA0_NTB0_NTC0_NTD4_NTM0_NEPBS8_NLCA1_NLCB1_ONLL1_PGR2_PLR1_PKA1_SIA3_SS1_SU0_SUM1_SUS0_SPO0_SRVW0_SSO0_SVW8_SK0_SKXCCM0_TLDS0_ULSGRO0_USL1_UIOFGRO0_USFGROn1_VSn1_VWA8_VWB1_WSGRA0_WSGRB0_WS64_WG16_4_4_WGM1_WGMXCC4_WGMXCCGn1
    SolutionIndex: 19
    SolutionNameMin: Cijk_Ailk_Bjlk_I8II_BH_UserArgs_MT128x16x128_MI16x16x1_SN_LDSB1_AFC0_AFEM1_AFEM1_ASEM1_CLR1_CADS0_DTVA0_DTVB0_EPS0_FDSI0_GRPM1_GRVWA16_GRVWB1_GSUn1_GSUAMBSK_GSUC1_GSUWGMRR1_GLS0_ISA942_IU1_K1_LBSPPA1024_LBSPPB128_LBSPPM0_LPA64_LPB16_LPM0_LRVW8_LWPMn1_MIAV0_MIWT4_1_MO40_NTn1_NTA0_NTB0_NTC0_NTD4_NTM0_NEPBS8_NLCA1_NLCB1_ONLL1_PGR2_PLR1_PKA1_SIA3_SS1_SU0_SUM1_SUS0_SPO0_SRVW0_SSO0_SVW4_SK0_SKXCCM0_TLDS0_ULSGRO0_USL1_UIOFGRO0_USFGROn1_VSn1_VWA4_VWB1_WSGRA0_WSGRB0_WS64_WG32_4_2_WGM1_WGMXCC4_WGMXCCGn1
    SolutionIndex: 20
    SolutionNameMin: Cijk_Ailk_Bjlk_I8II_BH_UserArgs_MT256x16x128_MI16x16x1_SN_LDSB1_AFC0_AFEM1_AFEM1_ASEM1_CLR1_CADS0_DTVA0_DTVB0_EPS0_FDSI0_GRPM1_GRVWA16_GRVWB1_GSUn1_GSUAMBSK_GSUC1_GSUWGMRR1_GLS0_ISA942_IU1_K1_LBSPPA2048_LBSPPB128_LBSPPM0_LPA64_LPB16_LPM0_LRVW8_LWPMn1_MIAV0_MIWT4_1_MO40_NTn1_NTA0_NTB0_NTC0_NTD4_NTM0_NEPBS8_NLCA1_NLCB1_ONLL1_PGR2_PLR1_PKA1_SIA3_SS1_SU0_SUM1_SUS0_SPO0_SRVW0_SSO0_SVW4_SK0_SKXCCM0_TLDS0_ULSGRO0_USL1_UIOFGRO0_USFGROn1_VSn1_VWA4_VWB1_WSGRA0_WSGRB0_WS64_WG64_4_1_WGM1_WGMXCC4_WGMXCCGn1
    SolutionIndex: 21
    SolutionNameMin: Cijk_Ailk_Bjlk_I8II_BH_UserArgs_MT384x16x128_MI16x16x1_SN_LDSB1_AFC0_AFEM1_AFEM1_ASEM1_CLR1_CADS0_DTVA0_DTVB0_EPS0_FDSI0_GRPM1_GRVWA16_GRVWB1_GSUn1_GSUAMBSK_GSUC1_GSUWGMRR1_GLS0_ISA942_IU1_K1_LBSPPA3072_LBSPPB128_LBSPPM0_LPA32_LPB16_LPM0_LRVW8_LWPMn1_MIAV0_MIWT6_1_MO40_NTn1_NTA0_NTB0_NTC0_NTD4_NTM0_NEPBS6_NLCA1_NLCB1_ONLL1_PGR2_PLR1_PKA1_SIA3_SS1_SU0_SUM1_SUS0_SPO0_SRVW0_SSO0_SVW2_SK0_SKXCCM0_TLDS0_ULSGRO0_USL1_UIOFGRO0_USFGROn1_VSn1_VWA2_VWB1_WSGRA0_WSGRB0_WS64_WG64_4_1_WGM1_WGMXCC4_WGMXCCGn1
    SolutionIndex: 22
    SolutionNameMin: Cijk_Ailk_Bjlk_I8II_BH_UserArgs_MT256x16x64_MI16x16x1_SN_LDSB1_AFC0_AFEM1_AFEM1_ASEM1_CLR1_CADS0_DTVA0_DTVB0_EPS0_FDSI0_GRPM1_GRVWA16_GRVWB1_GSUn1_GSUAMBSK_GSUC1_GSUWGMRR1_GLS0_ISA942_IU1_K1_LBSPPA2048_LBSPPB128_LBSPPM0_LPA64_LPB16_LPM0_LRVW8_LWPMn1_MIAV0_MIWT4_1_MO40_NTn1_NTA0_NTB0_NTC0_NTD4_NTM0_NEPBS8_NLCA1_NLCB1_ONLL1_PGR2_PLR1_PKA1_SIA3_SS1_SU0_SUM1_SUS0_SPO0_SRVW0_SSO0_SVW4_SK0_SKXCCM0_TLDS0_ULSGRO0_USL1_UIOFGRO0_USFGROn1_VSn1_VWA4_VWB1_WSGRA0_WSGRB0_WS64_WG64_4_1_WGM1_WGMXCC4_WGMXCCGn1
    SolutionIndex: 23
    SolutionNameMin: Cijk_Ailk_Bjlk_I8II_BH_UserArgs_MT512x16x64_MI16x16x1_SN_LDSB1_AFC0_AFEM1_AFEM1_ASEM1_CLR1_CADS0_DTVA0_DTVB0_EPS0_FDSI0_GRPM1_GRVWA16_GRVWB1_GSUn1_GSUAMBSK_GSUC1_GSUWGMRR1_GLS0_ISA942_IU1_K1_LBSPPA4096_LBSPPB128_LBSPPM0_LPA64_LPB16_LPM0_LRVW8_LWPMn1_MIAV0_MIWT8_1_MO40_NTn1_NTA0_NTB0_NTC0_NTD4_NTM0_NEPBS8_NLCA1_NLCB1_ONLL1_PGR2_PLR1_PKA1_SIA3_SS1_SU0_SUM1_SUS0_SPO0_SRVW0_SSO0_SVW8_SK0_SKXCCM0_TLDS0_ULSGRO0_USL1_UIOFGRO0_USFGROn1_VSn1_VWA8_VWB1_WSGRA0_WSGRB0_WS64_WG64_4_1_WGM1_WGMXCC4_WGMXCCGn1
    SolutionIndex: 24
    SolutionNameMin: Cijk_Ailk_Bjlk_I8II_BH_UserArgs_MT16x16x256_MI16x16x1_SN_LDSB1_AFC0_AFEM1_AFEM1_ASEM1_CLR1_CADS0_DTVA0_DTVB0_EPS0_FDSI0_GRPM1_GRVWA1_GRVWB16_GSUn1_GSUAMBSK_GSUC1_GSUWGMRR1_GLS0_ISA942_IU1_K1_LBSPPA128_LBSPPB128_LBSPPM0_LPA16_LPB16_LPM0_LRVW8_LWPMn1_MIAV0_MIWT1_1_MO40_NTn1_NTA0_NTB0_NTC0_NTD4_NTM0_NEPBS8_NLCA1_NLCB1_ONLL1_PGR2_PLR1_PKA1_SIA3_SS1_SU0_SUM1_SUS0_SPO0_SRVW0_SSO0_SVW1_SK0_SKXCCM0_TLDS0_ULSGRO0_USL1_UIOFGRO0_USFGROn1_VSn1_VWA1_VWB1_WSGRA0_WSGRB0_WS64_WG16_4_4_WGM1_WGMXCC4_WGMXCCGn1
    SolutionIndex: 25
    SolutionNameMin: Cijk_Ailk_Bjlk_I8II_BH_UserArgs_MT16x16x256_MI16x16x1_SN_LDSB0_AFC0_AFEM1_AFEM1_ASEM1_CLR1_CADS0_DTVA0_DTVB0_EPS0_FDSI0_GRPM1_GRVWA1_GRVWB16_GSUn1_GSUAMBSK_GSUC1_GSUWGMRR1_GLS0_ISA942_IU1_K1_LBSPPA128_LBSPPB128_LBSPPM0_LPA16_LPB16_LPM0_LRVW8_LWPMn1_MIAV0_MIWT1_1_MO40_NTn1_NTA0_NTB0_NTC0_NTD4_NTM0_NEPBS8_NLCA1_NLCB1_ONLL1_PGR2_PLR1_PKA1_SIA3_SS1_SU0_SUM1_SUS0_SPO0_SRVW0_SSO0_SVW1_SK0_SKXCCM0_TLDS0_ULSGRO0_USL1_UIOFGRO0_USFGROn1_VSn1_VWA1_VWB1_WSGRA0_WSGRB0_WS64_WG16_4_4_WGM1_WGMXCC4_WGMXCCGn1
    SolutionIndex: 26
    SolutionNameMin: Cijk_Ailk_Bjlk_I8II_BH_UserArgs_MT16x16x512_MI16x16x1_SN_LDSB0_AFC0_AFEM1_AFEM1_ASEM1_CLR1_CADS0_DTVA0_DTVB0_EPS0_FDSI0_GRPM1_GRVWA16_GRVWB16_GSUn1_GSUAMBSK_GSUC1_GSUWGMRR1_GLS0_ISA942_IU1_K1_LBSPPA128_LBSPPB128_LBSPPM0_LPA16_LPB16_LPM0_LRVW8_LWPMn1_MIAV0_MIWT1_1_MO40_NTn1_NTA0_NTB0_NTC0_NTD4_NTM0_NEPBS8_NLCA1_NLCB1_ONLL1_PGR2_PLR1_PKA1_SIA3_SS1_SU0_SUM1_SUS0_SPO0_SRVW0_SSO0_SVW1_SK0_SKXCCM0_TLDS0_ULSGRO0_USL1_UIOFGRO0_USFGROn1_VSn1_VWA1_VWB1_WSGRA0_WSGRB0_WS64_WG16_4_4_WGM1_WGMXCC4_WGMXCCGn1
    SolutionIndex: 27
    SolutionNameMin: Cijk_Ailk_Bjlk_I8II_BH_UserArgs_MT16x16x256_MI16x16x1_SN_LDSB1_AFC0_AFEM1_AFEM1_ASEM1_CLR1_CADS0_DTVA0_DTVB0_EPS0_FDSI0_GRPM1_GRVWA16_GRVWB16_GSUn1_GSUAMBSK_GSUC1_GSUWGMRR1_GLS0_ISA942_IU1_K1_LBSPPA128_LBSPPB128_LBSPPM0_LPA16_LPB16_LPM0_LRVW8_LWPMn1_MIAV0_MIWT1_1_MO40_NTn1_NTA0_NTB0_NTC0_NTD4_NTM0_NEPBS8_NLCA1_NLCB1_ONLL1_PGR2_PLR1_PKA1_SIA3_SS1_SU0_SUM1_SUS0_SPO0_SRVW0_SSO0_SVW1_SK0_SKXCCM0_TLDS0_ULSGRO0_USL1_UIOFGRO0_USFGROn1_VSn1_VWA1_VWB1_WSGRA0_WSGRB0_WS64_WG16_4_4_WGM1_WGMXCC4_WGMXCCGn1
    SolutionIndex: 28
    SolutionNameMin: Cijk_Ailk_Bjlk_I8II_BH_UserArgs_MT16x16x1024_MI16x16x1_SN_LDSB1_AFC0_AFEM1_AFEM1_ASEM1_CLR1_CADS0_DTVA0_DTVB0_EPS0_FDSI0_GRPM1_GRVWA16_GRVWB16_GSUn1_GSUAMBSK_GSUC1_GSUWGMRR1_GLS0_ISA942_IU1_K1_LBSPPA128_LBSPPB128_LBSPPM0_LPA16_LPB16_LPM0_LRVW8_LWPMn1_MIAV0_MIWT1_1_MO40_NTn1_NTA0_NTB0_NTC0_NTD4_NTM0_NEPBS8_NLCA1_NLCB1_ONLL1_PGR2_PLR1_PKA1_SIA3_SS1_SU0_SUM1_SUS0_SPO0_SRVW0_SSO0_SVW1_SK0_SKXCCM0_TLDS0_ULSGRO0_USL1_UIOFGRO0_USFGROn1_VSn1_VWA1_VWB1_WSGRA0_WSGRB0_WS64_WG16_4_4_WGM1_WGMXCC4_WGMXCCGn1
    SolutionIndex: 29
    SolutionNameMin: Cijk_Ailk_Bjlk_I8II_BH_UserArgs_MT16x16x256_MI16x16x1_SN_LDSB0_AFC0_AFEM1_AFEM1_ASEM1_CLR1_CADS0_DTVA0_DTVB0_EPS0_FDSI0_GRPM1_GRVWA16_GRVWB16_GSUn1_GSUAMBSK_GSUC1_GSUWGMRR1_GLS0_ISA942_IU1_K1_LBSPPA128_LBSPPB128_LBSPPM0_LPA16_LPB16_LPM0_LRVW8_LWPMn1_MIAV0_MIWT1_1_MO40_NTn1_NTA0_NTB0_NTC0_NTD4_NTM0_NEPBS8_NLCA1_NLCB1_ONLL1_PGR2_PLR1_PKA1_SIA3_SS1_SU0_SUM1_SUS0_SPO0_SRVW0_SSO0_SVW1_SK0_SKXCCM0_TLDS0_ULSGRO0_USL1_UIOFGRO0_USFGROn1_VSn1_VWA1_VWB1_WSGRA0_WSGRB0_WS64_WG16_4_4_WGM1_WGMXCC4_WGMXCCGn1
    SolutionIndex: 30
    SolutionNameMin: Cijk_Ailk_Bjlk_I8II_BH_UserArgs_MT32x16x512_MI16x16x1_SN_LDSB0_AFC0_AFEM1_AFEM1_ASEM1_CLR1_CADS0_DTVA0_DTVB0_EPS0_FDSI0_GRPM1_GRVWA16_GRVWB16_GSUn1_GSUAMBSK_GSUC1_GSUWGMRR1_GLS0_ISA942_IU1_K1_LBSPPA256_LBSPPB128_LBSPPM0_LPA32_LPB16_LPM0_LRVW8_LWPMn1_MIAV0_MIWT2_1_MO40_NTn1_NTA0_NTB0_NTC0_NTD4_NTM0_NEPBS8_NLCA1_NLCB1_ONLL1_PGR2_PLR1_PKA1_SIA3_SS1_SU0_SUM1_SUS0_SPO0_SRVW0_SSO0_SVW2_SK0_SKXCCM0_TLDS0_ULSGRO0_USL1_UIOFGRO0_USFGROn1_VSn1_VWA2_VWB1_WSGRA0_WSGRB0_WS64_WG16_4_4_WGM1_WGMXCC4_WGMXCCGn1
    SolutionIndex: 31
    SolutionNameMin: Cijk_Ailk_Bjlk_I8II_BH_UserArgs_MT32x16x256_MI16x16x1_SN_LDSB0_AFC0_AFEM1_AFEM1_ASEM1_CLR1_CADS0_DTVA0_DTVB0_EPS0_FDSI0_GRPM1_GRVWA16_GRVWB16_GSUn1_GSUAMBSK_GSUC1_GSUWGMRR1_GLS0_ISA942_IU1_K1_LBSPPA256_LBSPPB128_LBSPPM0_LPA16_LPB16_LPM0_LRVW8_LWPMn1_MIAV0_MIWT1_1_MO40_NTn1_NTA0_NTB0_NTC0_NTD4_NTM0_NEPBS8_NLCA1_NLCB1_ONLL1_PGR2_PLR1_PKA1_SIA3_SS1_SU0_SUM1_SUS0_SPO0_SRVW0_SSO0_SVW1_SK0_SKXCCM0_TLDS0_ULSGRO0_USL1_UIOFGRO0_USFGROn1_VSn1_VWA1_VWB1_WSGRA0_WSGRB0_WS64_WG32_4_2_WGM1_WGMXCC4_WGMXCCGn1
    SolutionIndex: 32
    SolutionNameMin: Cijk_Ailk_Bjlk_I8II_BH_UserArgs_MT16x16x512_MI16x16x1_SN_LDSB1_AFC0_AFEM1_AFEM1_ASEM1_CLR1_CADS0_DTVA0_DTVB0_EPS0_FDSI0_GRPM1_GRVWA16_GRVWB16_GSUn1_GSUAMBSK_GSUC1_GSUWGMRR1_GLS0_ISA942_IU1_K1_LBSPPA128_LBSPPB128_LBSPPM0_LPA16_LPB16_LPM0_LRVW8_LWPMn1_MIAV0_MIWT1_1_MO40_NTn1_NTA0_NTB0_NTC0_NTD4_NTM0_NEPBS8_NLCA1_NLCB1_ONLL1_PGR2_PLR1_PKA1_SIA3_SS1_SU0_SUM1_SUS0_SPO0_SRVW0_SSO0_SVW1_SK0_SKXCCM0_TLDS0_ULSGRO0_USL1_UIOFGRO0_USFGROn1_VSn1_VWA1_VWB1_WSGRA0_WSGRB0_WS64_WG16_4_4_WGM1_WGMXCC4_WGMXCCGn1
    SolutionIndex: 33
    SolutionNameMin: Cijk_Ailk_Bjlk_I8II_BH_UserArgs_MT32x16x256_MI16x16x1_SN_LDSB0_AFC0_AFEM1_AFEM1_ASEM1_CLR1_CADS0_DTVA0_DTVB0_EPS0_FDSI0_GRPM1_GRVWA16_GRVWB16_GSUn1_GSUAMBSK_GSUC1_GSUWGMRR1_GLS0_ISA942_IU1_K1_LBSPPA256_LBSPPB128_LBSPPM0_LPA32_LPB16_LPM0_LRVW8_LWPMn1_MIAV0_MIWT2_1_MO40_NTn1_NTA0_NTB0_NTC0_NTD4_NTM0_NEPBS8_NLCA1_NLCB1_ONLL1_PGR2_PLR1_PKA1_SIA3_SS1_SU0_SUM1_SUS0_SPO0_SRVW0_SSO0_SVW2_SK0_SKXCCM0_TLDS0_ULSGRO0_USL1_UIOFGRO0_USFGROn1_VSn1_VWA2_VWB1_WSGRA0_WSGRB0_WS64_WG16_4_4_WGM1_WGMXCC4_WGMXCCGn1
    SolutionIndex: 34
    SolutionNameMin: Cijk_Ailk_Bjlk_I8II_BH_UserArgs_MT64x16x256_MI16x16x1_SN_LDSB0_AFC0_AFEM1_AFEM1_ASEM1_CLR1_CADS0_DTVA0_DTVB0_EPS0_FDSI0_GRPM1_GRVWA16_GRVWB16_GSUn1_GSUAMBSK_GSUC1_GSUWGMRR1_GLS0_ISA942_IU1_K1_LBSPPA512_LBSPPB128_LBSPPM0_LPA32_LPB16_LPM0_LRVW8_LWPMn1_MIAV0_MIWT2_1_MO40_NTn1_NTA0_NTB0_NTC0_NTD4_NTM0_NEPBS8_NLCA1_NLCB1_ONLL1_PGR2_PLR1_PKA1_SIA3_SS1_SU0_SUM1_SUS0_SPO0_SRVW0_SSO0_SVW2_SK0_SKXCCM0_TLDS0_ULSGRO0_USL1_UIOFGRO0_USFGROn1_VSn1_VWA2_VWB1_WSGRA0_WSGRB0_WS64_WG32_4_2_WGM1_WGMXCC4_WGMXCCGn1
    SolutionIndex: 35
    SolutionNameMin: Cijk_Ailk_Bjlk_I8II_BH_UserArgs_MT32x16x512_MI16x16x1_SN_LDSB0_AFC0_AFEM1_AFEM1_ASEM1_CLR1_CADS0_DTVA0_DTVB0_EPS0_FDSI0_GRPM1_GRVWA16_GRVWB16_GSUn1_GSUAMBSK_GSUC1_GSUWGMRR1_GLS0_ISA942_IU1_K1_LBSPPA256_LBSPPB128_LBSPPM0_LPA16_LPB16_LPM0_LRVW8_LWPMn1_MIAV0_MIWT1_1_MO40_NTn1_NTA0_NTB0_NTC0_NTD4_NTM0_NEPBS8_NLCA1_NLCB1_ONLL1_PGR2_PLR1_PKA1_SIA3_SS1_SU0_SUM1_SUS0_SPO0_SRVW0_SSO0_SVW1_SK0_SKXCCM0_TLDS0_ULSGRO0_USL1_UIOFGRO0_USFGROn1_VSn1_VWA1_VWB1_WSGRA0_WSGRB0_WS64_WG32_4_2_WGM1_WGMXCC4_WGMXCCGn1
    SolutionIndex: 36
    SolutionNameMin: Cijk_Ailk_Bjlk_I8II_BH_UserArgs_MT32x16x128_MI16x16x1_SN_LDSB0_AFC0_AFEM1_AFEM1_ASEM1_CLR1_CADS0_DTVA0_DTVB0_EPS0_FDSI0_GRPM1_GRVWA16_GRVWB16_GSUn1_GSUAMBSK_GSUC1_GSUWGMRR1_GLS0_ISA942_IU1_K1_LBSPPA256_LBSPPB128_LBSPPM0_LPA16_LPB16_LPM0_LRVW8_LWPMn1_MIAV0_MIWT1_1_MO40_NTn1_NTA0_NTB0_NTC0_NTD4_NTM0_NEPBS8_NLCA1_NLCB1_ONLL1_PGR2_PLR1_PKA1_SIA3_SS1_SU0_SUM1_SUS0_SPO0_SRVW0_SSO0_SVW1_SK0_SKXCCM0_TLDS0_ULSGRO0_USL1_UIOFGRO0_USFGROn1_VSn1_VWA1_VWB1_WSGRA0_WSGRB0_WS64_WG32_4_1_WGM1_WGMXCC4_WGMXCCGn1
    SolutionIndex: 37
    SolutionNameMin: Cijk_Ailk_Bjlk_I8II_BH_UserArgs_MT64x16x512_MI16x16x1_SN_LDSB1_AFC0_AFEM1_AFEM1_ASEM1_CLR1_CADS0_DTVA0_DTVB0_EPS0_FDSI0_GRPM1_GRVWA16_GRVWB16_GSUn1_GSUAMBSK_GSUC1_GSUWGMRR1_GLS0_ISA942_IU1_K1_LBSPPA512_LBSPPB128_LBSPPM0_LPA32_LPB16_LPM0_LRVW8_LWPMn1_MIAV0_MIWT2_1_MO40_NTn1_NTA0_NTB0_NTC0_NTD4_NTM0_NEPBS8_NLCA1_NLCB1_ONLL1_PGR2_PLR1_PKA1_SIA3_SS1_SU0_SUM1_SUS0_SPO0_SRVW0_SSO0_SVW2_SK0_SKXCCM0_TLDS0_ULSGRO0_USL1_UIOFGRO0_USFGROn1_VSn1_VWA2_VWB1_WSGRA0_WSGRB0_WS64_WG32_4_2_WGM1_WGMXCC4_WGMXCCGn1
    SolutionIndex: 38
    SolutionNameMin: Cijk_Ailk_Bjlk_I8II_BH_UserArgs_MT64x16x256_MI16x16x1_SN_LDSB1_AFC0_AFEM1_AFEM1_ASEM1_CLR1_CADS0_DTVA0_DTVB0_EPS0_FDSI0_GRPM1_GRVWA16_GRVWB16_GSUn1_GSUAMBSK_GSUC1_GSUWGMRR1_GLS0_ISA942_IU1_K1_LBSPPA512_LBSPPB128_LBSPPM0_LPA32_LPB16_LPM0_LRVW8_LWPMn1_MIAV0_MIWT2_1_MO40_NTn1_NTA0_NTB0_NTC0_NTD4_NTM0_NEPBS8_NLCA1_NLCB1_ONLL1_PGR2_PLR1_PKA1_SIA3_SS1_SU0_SUM1_SUS0_SPO0_SRVW0_SSO0_SVW2_SK0_SKXCCM0_TLDS0_ULSGRO0_USL1_UIOFGRO0_USFGROn1_VSn1_VWA2_VWB1_WSGRA0_WSGRB0_WS64_WG32_4_2_WGM1_WGMXCC4_WGMXCCGn1
    SolutionIndex: 39
    SolutionNameMin: Cijk_Ailk_Bjlk_I8II_BH_UserArgs_MT64x16x256_MI16x16x1_SN_LDSB1_AFC0_AFEM1_AFEM1_ASEM1_CLR1_CADS0_DTVA0_DTVB0_EPS0_FDSI0_GRPM1_GRVWA16_GRVWB16_GSUn1_GSUAMBSK_GSUC1_GSUWGMRR1_GLS0_ISA942_IU1_K1_LBSPPA512_LBSPPB128_LBSPPM0_LPA16_LPB16_LPM0_LRVW8_LWPMn1_MIAV0_MIWT2_1_MO40_NTn1_NTA0_NTB0_NTC0_NTD4_NTM0_NEPBS8_NLCA1_NLCB1_ONLL1_PGR2_PLR1_PKA1_SIA3_SS1_SU0_SUM1_SUS0_SPO0_SRVW0_SSO0_SVW2_SK0_SKXCCM0_TLDS0_ULSGRO0_USL1_UIOFGRO0_USFGROn1_VSn1_VWA2_VWB1_WSGRA0_WSGRB0_WS64_WG32_4_2_WGM1_WGMXCC4_WGMXCCGn1
    SolutionIndex: 40
    SolutionNameMin: Cijk_Ailk_Bjlk_I8II_BH_UserArgs_MT128x16x256_MI16x16x1_SN_LDSB1_AFC0_AFEM1_AFEM1_ASEM1_CLR1_CADS0_DTVA0_DTVB0_EPS0_FDSI0_GRPM1_GRVWA16_GRVWB16_GSUn1_GSUAMBSK_GSUC1_GSUWGMRR1_GLS0_ISA942_IU1_K1_LBSPPA1024_LBSPPB128_LBSPPM0_LPA32_LPB16_LPM0_LRVW8_LWPMn1_MIAV0_MIWT2_1_MO40_NTn1_NTA0_NTB0_NTC0_NTD4_NTM0_NEPBS8_NLCA1_NLCB1_ONLL1_PGR2_PLR1_PKA1_SIA3_SS1_SU0_SUM1_SUS0_SPO0_SRVW0_SSO0_SVW2_SK0_SKXCCM0_TLDS0_ULSGRO0_USL1_UIOFGRO0_USFGROn1_VSn1_VWA2_VWB1_WSGRA0_WSGRB0_WS64_WG64_4_1_WGM1_WGMXCC4_WGMXCCGn1
    SolutionIndex: 41
    SolutionNameMin: Cijk_Ailk_Bjlk_I8II_BH_UserArgs_MT128x16x256_MI16x16x1_SN_LDSB1_AFC0_AFEM1_AFEM1_ASEM1_CLR1_CADS0_DTVA0_DTVB0_EPS0_FDSI0_GRPM1_GRVWA16_GRVWB16_GSUn1_GSUAMBSK_GSUC1_GSUWGMRR1_GLS0_ISA942_IU1_K1_LBSPPA1024_LBSPPB128_LBSPPM0_LPA64_LPB16_LPM0_LRVW8_LWPMn1_MIAV0_MIWT4_1_MO40_NTn1_NTA0_NTB0_NTC0_NTD4_NTM0_NEPBS8_NLCA1_NLCB1_ONLL1_PGR2_PLR1_PKA1_SIA3_SS1_SU0_SUM1_SUS0_SPO0_SRVW0_SSO0_SVW4_SK0_SKXCCM0_TLDS0_ULSGRO0_USL1_UIOFGRO0_USFGROn1_VSn1_VWA4_VWB1_WSGRA0_WSGRB0_WS64_WG32_4_2_WGM1_WGMXCC4_WGMXCCGn1
    SolutionIndex: 42
    SolutionNameMin: Cijk_Ailk_Bjlk_I8II_BH_UserArgs_MT128x16x256_MI16x16x1_SN_LDSB1_AFC0_AFEM1_AFEM1_ASEM1_CLR1_CADS0_DTVA0_DTVB0_EPS0_FDSI0_GRPM1_GRVWA16_GRVWB16_GSUn1_GSUAMBSK_GSUC1_GSUWGMRR1_GLS0_ISA942_IU1_K1_LBSPPA1024_LBSPPB128_LBSPPM0_LPA16_LPB16_LPM0_LRVW8_LWPMn1_MIAV0_MIWT2_1_MO40_NTn1_NTA0_NTB0_NTC0_NTD4_NTM0_NEPBS8_NLCA1_NLCB1_ONLL1_PGR2_PLR1_PKA1_SIA3_SS1_SU0_SUM1_SUS0_SPO0_SRVW0_SSO0_SVW2_SK0_SKXCCM0_TLDS0_ULSGRO0_USL1_UIOFGRO0_USFGROn1_VSn1_VWA2_VWB1_WSGRA0_WSGRB0_WS64_WG64_4_1_WGM1_WGMXCC4_WGMXCCGn1
    SolutionIndex: 43
    SolutionNameMin: Cijk_Ailk_Bjlk_I8II_BH_UserArgs_MT32x16x512_MI16x16x1_SN_LDSB1_AFC0_AFEM1_AFEM1_ASEM1_CLR1_CADS0_DTVA0_DTVB0_EPS0_FDSI0_GRPM1_GRVWA16_GRVWB16_GSUn1_GSUAMBSK_GSUC1_GSUWGMRR1_GLS0_ISA942_IU1_K1_LBSPPA256_LBSPPB128_LBSPPM0_LPA32_LPB16_LPM0_LRVW8_LWPMn1_MIAV0_MIWT2_1_MO40_NTn1_NTA0_NTB0_NTC0_NTD4_NTM0_NEPBS8_NLCA1_NLCB1_ONLL1_PGR2_PLR1_PKA1_SIA3_SS1_SU0_SUM1_SUS0_SPO0_SRVW0_SSO0_SVW2_SK0_SKXCCM0_TLDS0_ULSGRO0_USL1_UIOFGRO0_USFGROn1_VSn1_VWA2_VWB1_WSGRA0_WSGRB0_WS64_WG16_4_4_WGM1_WGMXCC4_WGMXCCGn1
    SolutionIndex: 44
    SolutionNameMin: Cijk_Ailk_Bjlk_I8II_BH_UserArgs_MT128x16x256_MI16x16x1_SN_LDSB1_AFC0_AFEM1_AFEM1_ASEM1_CLR1_CADS0_DTVA0_DTVB0_EPS0_FDSI0_GRPM1_GRVWA16_GRVWB16_GSUn1_GSUAMBSK_GSUC1_GSUWGMRR1_GLS0_ISA942_IU1_K1_LBSPPA1024_LBSPPB128_LBSPPM0_LPA64_LPB16_LPM0_LRVW8_LWPMn1_MIAV0_MIWT8_1_MO40_NTn1_NTA0_NTB0_NTC0_NTD4_NTM0_NEPBS8_NLCA1_NLCB1_ONLL1_PGR2_PLR1_PKA1_SIA3_SS1_SU0_SUM1_SUS0_SPO0_SRVW0_SSO0_SVW8_SK0_SKXCCM0_TLDS0_ULSGRO0_USL1_UIOFGRO0_USFGROn1_VSn1_VWA8_VWB1_WSGRA0_WSGRB0_WS64_WG16_4_4_WGM1_WGMXCC4_WGMXCCGn1
    SolutionIndex: 45
    SolutionNameMin: Cijk_Ailk_Bjlk_I8II_BH_UserArgs_MT32x16x512_MI16x16x1_SN_LDSB1_AFC0_AFEM1_AFEM1_ASEM1_CLR1_CADS0_DTVA0_DTVB0_EPS0_FDSI0_GRPM1_GRVWA16_GRVWB16_GSUn1_GSUAMBSK_GSUC1_GSUWGMRR1_GLS0_ISA942_IU1_K1_LBSPPA256_LBSPPB128_LBSPPM0_LPA16_LPB16_LPM0_LRVW8_LWPMn1_MIAV0_MIWT1_1_MO40_NTn1_NTA0_NTB0_NTC0_NTD4_NTM0_NEPBS8_NLCA1_NLCB1_ONLL1_PGR2_PLR1_PKA1_SIA3_SS1_SU0_SUM1_SUS0_SPO0_SRVW0_SSO0_SVW1_SK0_SKXCCM0_TLDS0_ULSGRO0_USL1_UIOFGRO0_USFGROn1_VSn1_VWA1_VWB1_WSGRA0_WSGRB0_WS64_WG32_4_2_WGM1_WGMXCC4_WGMXCCGn1
    SolutionIndex: 46
    SolutionNameMin: Cijk_Ailk_Bjlk_I8II_BH_UserArgs_MT128x16x256_MI16x16x1_SN_LDSB1_AFC0_AFEM1_AFEM1_ASEM1_CLR1_CADS0_DTVA0_DTVB0_EPS0_FDSI0_GRPM1_GRVWA16_GRVWB16_GSUn1_GSUAMBSK_GSUC1_GSUWGMRR1_GLS0_ISA942_IU1_K1_LBSPPA1024_LBSPPB128_LBSPPM0_LPA32_LPB16_LPM0_LRVW8_LWPMn1_MIAV0_MIWT4_1_MO40_NTn1_NTA0_NTB0_NTC0_NTD4_NTM0_NEPBS8_NLCA1_NLCB1_ONLL1_PGR2_PLR1_PKA1_SIA3_SS1_SU0_SUM1_SUS0_SPO0_SRVW0_SSO0_SVW4_SK0_SKXCCM0_TLDS0_ULSGRO0_USL1_UIOFGRO0_USFGROn1_VSn1_VWA4_VWB1_WSGRA0_WSGRB0_WS64_WG32_4_2_WGM1_WGMXCC4_WGMXCCGn1
    SolutionIndex: 47
    SolutionNameMin: Cijk_Ailk_Bjlk_I8II_BH_UserArgs_MT64x16x256_MI16x16x1_SN_LDSB1_AFC0_AFEM1_AFEM1_ASEM1_CLR1_CADS0_DTVA0_DTVB0_EPS0_FDSI0_GRPM1_GRVWA16_GRVWB16_GSUn1_GSUAMBSK_GSUC1_GSUWGMRR1_GLS0_ISA942_IU1_K1_LBSPPA512_LBSPPB128_LBSPPM0_LPA16_LPB16_LPM0_LRVW8_LWPMn1_MIAV0_MIWT1_1_MO40_NTn1_NTA0_NTB0_NTC0_NTD4_NTM0_NEPBS8_NLCA1_NLCB1_ONLL1_PGR2_PLR1_PKA1_SIA3_SS1_SU0_SUM1_SUS0_SPO0_SRVW0_SSO0_SVW1_SK0_SKXCCM0_TLDS0_ULSGRO0_USL1_UIOFGRO0_USFGROn1_VSn1_VWA1_VWB1_WSGRA0_WSGRB0_WS64_WG64_4_1_WGM1_WGMXCC4_WGMXCCGn1
    SolutionIndex: 48
    SolutionNameMin: Cijk_Ailk_Bjlk_I8II_BH_UserArgs_MT64x16x512_MI16x16x1_SN_LDSB1_AFC0_AFEM1_AFEM1_ASEM1_CLR1_CADS0_DTVA0_DTVB0_EPS0_FDSI0_GRPM1_GRVWA16_GRVWB16_GSUn1_GSUAMBSK_GSUC1_GSUWGMRR1_GLS0_ISA942_IU1_K1_LBSPPA512_LBSPPB128_LBSPPM0_LPA64_LPB16_LPM0_LRVW8_LWPMn1_MIAV0_MIWT4_1_MO40_NTn1_NTA0_NTB0_NTC0_NTD4_NTM0_NEPBS8_NLCA1_NLCB1_ONLL1_PGR2_PLR1_PKA1_SIA3_SS1_SU0_SUM1_SUS0_SPO0_SRVW0_SSO0_SVW4_SK0_SKXCCM0_TLDS0_ULSGRO0_USL1_UIOFGRO0_USFGROn1_VSn1_VWA4_VWB1_WSGRA0_WSGRB0_WS64_WG16_4_4_WGM1_WGMXCC4_WGMXCCGn1
    SolutionIndex: 49
    SolutionNameMin: Cijk_Ailk_Bjlk_I8II_BH_UserArgs_MT128x16x256_MI16x16x1_SN_LDSB1_AFC0_AFEM1_AFEM1_ASEM1_CLR1_CADS0_DTVA0_DTVB0_EPS0_FDSI0_GRPM1_GRVWA16_GRVWB16_GSUn1_GSUAMBSK_GSUC1_GSUWGMRR1_GLS0_ISA942_IU1_K1_LBSPPA1024_LBSPPB128_LBSPPM0_LPA32_LPB16_LPM0_LRVW8_LWPMn1_MIAV0_MIWT8_1_MO40_NTn1_NTA0_NTB0_NTC0_NTD4_NTM0_NEPBS8_NLCA1_NLCB1_ONLL1_PGR2_PLR1_PKA1_SIA3_SS1_SU0_SUM1_SUS0_SPO0_SRVW0_SSO0_SVW8_SK0_SKXCCM0_TLDS0_ULSGRO0_USL1_UIOFGRO0_USFGROn1_VSn1_VWA8_VWB1_WSGRA0_WSGRB0_WS64_WG16_4_4_WGM1_WGMXCC4_WGMXCCGn1
    SolutionIndex: 50
    SolutionNameMin: Cijk_Ailk_Bjlk_I8II_BH_UserArgs_MT16x32x512_MI16x16x1_SN_LDSB0_AFC0_AFEM1_AFEM1_ASEM1_CLR1_CADS0_DTVA0_DTVB0_EPS0_FDSI0_GRPM1_GRVWA16_GRVWB16_GSUn1_GSUAMBSK_GSUC1_GSUWGMRR1_GLS0_ISA942_IU1_K1_LBSPPA128_LBSPPB256_LBSPPM0_LPA16_LPB32_LPM0_LRVW8_LWPMn1_MIAV0_MIWT1_2_MO40_NTn1_NTA0_NTB0_NTC0_NTD4_NTM0_NEPBS8_NLCA1_NLCB1_ONLL1_PGR2_PLR1_PKA1_SIA3_SS1_SU0_SUM1_SUS0_SPO0_SRVW0_SSO0_SVW1_SK0_SKXCCM0_TLDS0_ULSGRO0_USL1_UIOFGRO0_USFGROn1_VSn1_VWA1_VWB2_WSGRA0_WSGRB0_WS64_WG16_4_4_WGM1_WGMXCC4_WGMXCCGn1
    SolutionIndex: 51
    SolutionNameMin: Cijk_Ailk_Bjlk_I8II_BH_UserArgs_MT16x32x256_MI16x16x1_SN_LDSB1_AFC0_AFEM1_AFEM1_ASEM1_CLR1_CADS0_DTVA0_DTVB0_EPS0_FDSI0_GRPM1_GRVWA16_GRVWB16_GSUn1_GSUAMBSK_GSUC1_GSUWGMRR1_GLS0_ISA942_IU1_K1_LBSPPA128_LBSPPB256_LBSPPM0_LPA16_LPB16_LPM0_LRVW8_LWPMn1_MIAV0_MIWT1_1_MO40_NTn1_NTA0_NTB0_NTC0_NTD4_NTM0_NEPBS8_NLCA1_NLCB1_ONLL1_PGR2_PLR1_PKA1_SIA3_SS1_SU0_SUM1_SUS0_SPO0_SRVW0_SSO0_SVW1_SK0_SKXCCM0_TLDS0_ULSGRO0_USL1_UIOFGRO0_USFGROn1_VSn1_VWA1_VWB1_WSGRA0_WSGRB0_WS64_WG16_8_2_WGM1_WGMXCC4_WGMXCCGn1
    SolutionIndex: 52
    SolutionNameMin: Cijk_Ailk_Bjlk_I8II_BH_UserArgs_MT16x32x256_MI16x16x1_SN_LDSB0_AFC0_AFEM1_AFEM1_ASEM1_CLR1_CADS0_DTVA0_DTVB0_EPS0_FDSI0_GRPM1_GRVWA16_GRVWB16_GSUn1_GSUAMBSK_GSUC1_GSUWGMRR1_GLS0_ISA942_IU1_K1_LBSPPA128_LBSPPB256_LBSPPM0_LPA16_LPB16_LPM0_LRVW8_LWPMn1_MIAV0_MIWT1_1_MO40_NTn1_NTA0_NTB0_NTC0_NTD4_NTM0_NEPBS8_NLCA1_NLCB1_ONLL1_PGR2_PLR1_PKA1_SIA3_SS1_SU0_SUM1_SUS0_SPO0_SRVW0_SSO0_SVW1_SK0_SKXCCM0_TLDS0_ULSGRO0_USL1_UIOFGRO0_USFGROn1_VSn1_VWA1_VWB1_WSGRA0_WSGRB0_WS64_WG16_8_2_WGM1_WGMXCC4_WGMXCCGn1
    SolutionIndex: 53
    SolutionNameMin: Cijk_Ailk_Bjlk_I8II_BH_UserArgs_MT32x16x256_MI16x16x1_SN_LDSB0_AFC0_AFEM1_AFEM1_ASEM1_CLR1_CADS0_DTVA0_DTVB0_EPS0_FDSI0_GRPM1_GRVWA16_GRVWB16_GSUn1_GSUAMBSK_GSUC1_GSUWGMRR1_GLS0_ISA942_IU1_K1_LBSPPA256_LBSPPB128_LBSPPM0_LPA16_LPB16_LPM0_LRVW8_LWPMn1_MIAV0_MIWT1_1_MO40_NTn1_NTA0_NTB0_NTC0_NTD4_NTM0_NEPBS8_NLCA1_NLCB1_ONLL1_PGR2_PLR1_PKA1_SIA3_SS1_SU0_SUM1_SUS0_SPO0_SRVW0_SSO0_SVW1_SK0_SKXCCM0_TLDS0_ULSGRO0_USL1_UIOFGRO0_USFGROn1_VSn1_VWA1_VWB1_WSGRA0_WSGRB0_WS64_WG32_4_1_WGM1_WGMXCC4_WGMXCCGn1
    SolutionIndex: 54
    SolutionNameMin: Cijk_Ailk_Bjlk_I8II_BH_UserArgs_MT32x32x256_MI16x16x1_SN_LDSB0_AFC0_AFEM1_AFEM1_ASEM1_CLR1_CADS0_DTVA0_DTVB0_EPS0_FDSI0_GRPM1_GRVWA16_GRVWB16_GSUn1_GSUAMBSK_GSUC1_GSUWGMRR1_GLS0_ISA942_IU1_K1_LBSPPA256_LBSPPB256_LBSPPM0_LPA32_LPB16_LPM0_LRVW8_LWPMn1_MIAV0_MIWT2_1_MO40_NTn1_NTA0_NTB0_NTC0_NTD4_NTM0_NEPBS8_NLCA1_NLCB1_ONLL1_PGR2_PLR1_PKA1_SIA3_SS1_SU0_SUM1_SUS0_SPO0_SRVW0_SSO0_SVW2_SK0_SKXCCM0_TLDS0_ULSGRO0_USL1_UIOFGRO0_USFGROn1_VSn1_VWA2_VWB1_WSGRA0_WSGRB0_WS64_WG16_8_2_WGM1_WGMXCC4_WGMXCCGn1
    SolutionIndex: 55
    SolutionNameMin: Cijk_Ailk_Bjlk_I8II_BH_UserArgs_MT32x32x256_MI16x16x1_SN_LDSB0_AFC0_AFEM1_AFEM1_ASEM1_CLR1_CADS0_DTVA0_DTVB0_EPS0_FDSI0_GRPM1_GRVWA16_GRVWB16_GSUn1_GSUAMBSK_GSUC1_GSUWGMRR1_GLS0_ISA942_IU1_K1_LBSPPA256_LBSPPB256_LBSPPM0_LPA32_LPB32_LPM0_LRVW8_LWPMn1_MIAV0_MIWT2_2_MO40_NTn1_NTA0_NTB0_NTC0_NTD4_NTM0_NEPBS8_NLCA1_NLCB1_ONLL1_PGR2_PLR1_PKA1_SIA3_SS1_SU0_SUM1_SUS0_SPO0_SRVW0_SSO0_SVW2_SK0_SKXCCM0_TLDS0_ULSGRO0_USL1_UIOFGRO0_USFGROn1_VSn1_VWA2_VWB2_WSGRA0_WSGRB0_WS64_WG16_4_4_WGM1_WGMXCC4_WGMXCCGn1
    SolutionIndex: 56
    SolutionNameMin: Cijk_Ailk_Bjlk_I8II_BH_UserArgs_MT64x32x256_MI16x16x1_SN_LDSB0_AFC0_AFEM1_AFEM1_ASEM1_CLR1_CADS0_DTVA0_DTVB0_EPS0_FDSI0_GRPM1_GRVWA16_GRVWB16_GSUn1_GSUAMBSK_GSUC1_GSUWGMRR1_GLS0_ISA942_IU1_K1_LBSPPA512_LBSPPB256_LBSPPM0_LPA64_LPB32_LPM0_LRVW8_LWPMn1_MIAV0_MIWT4_2_MO40_NTn1_NTA0_NTB0_NTC0_NTD4_NTM0_NEPBS8_NLCA1_NLCB1_ONLL1_PGR2_PLR1_PKA1_SIA3_SS1_SU0_SUM1_SUS0_SPO0_SRVW0_SSO0_SVW4_SK0_SKXCCM0_TLDS0_ULSGRO0_USL1_UIOFGRO0_USFGROn1_VSn1_VWA4_VWB2_WSGRA0_WSGRB0_WS64_WG16_4_4_WGM1_WGMXCC4_WGMXCCGn1
    SolutionIndex: 57
    SolutionNameMin: Cijk_Ailk_Bjlk_I8II_BH_UserArgs_MT64x32x128_MI16x16x1_SN_LDSB0_AFC0_AFEM1_AFEM1_ASEM1_CLR1_CADS0_DTVA0_DTVB0_EPS0_FDSI0_GRPM1_GRVWA16_GRVWB16_GSUn1_GSUAMBSK_GSUC1_GSUWGMRR1_GLS0_ISA942_IU1_K1_LBSPPA512_LBSPPB256_LBSPPM0_LPA16_LPB32_LPM0_LRVW8_LWPMn1_MIAV0_MIWT1_2_MO40_NTn1_NTA0_NTB0_NTC0_NTD4_NTM0_NEPBS8_NLCA1_NLCB1_ONLL1_PGR2_PLR1_PKA1_SIA3_SS1_SU0_SUM1_SUS0_SPO0_SRVW0_SSO0_SVW1_SK0_SKXCCM0_TLDS0_ULSGRO0_USL1_UIOFGRO0_USFGROn1_VSn1_VWA1_VWB2_WSGRA0_WSGRB0_WS64_WG64_4_1_WGM1_WGMXCC4_WGMXCCGn1
    SolutionIndex: 58
    SolutionNameMin: Cijk_Ailk_Bjlk_I8II_BH_UserArgs_MT64x32x256_MI16x16x1_SN_LDSB0_AFC0_AFEM1_AFEM1_ASEM1_CLR1_CADS0_DTVA0_DTVB0_EPS0_FDSI0_GRPM1_GRVWA16_GRVWB16_GSUn1_GSUAMBSK_GSUC1_GSUWGMRR1_GLS0_ISA942_IU1_K1_LBSPPA512_LBSPPB256_LBSPPM0_LPA32_LPB32_LPM0_LRVW8_LWPMn1_MIAV0_MIWT2_2_MO40_NTn1_NTA0_NTB0_NTC0_NTD4_NTM0_NEPBS8_NLCA1_NLCB1_ONLL1_PGR2_PLR1_PKA1_SIA3_SS1_SU0_SUM1_SUS0_SPO0_SRVW0_SSO0_SVW2_SK0_SKXCCM0_TLDS0_ULSGRO0_USL1_UIOFGRO0_USFGROn1_VSn1_VWA2_VWB2_WSGRA0_WSGRB0_WS64_WG32_4_2_WGM1_WGMXCC4_WGMXCCGn1
    SolutionIndex: 59
    SolutionNameMin: Cijk_Ailk_Bjlk_I8II_BH_UserArgs_MT64x32x256_MI16x16x1_SN_LDSB1_AFC0_AFEM1_AFEM1_ASEM1_CLR1_CADS0_DTVA0_DTVB0_EPS0_FDSI0_GRPM1_GRVWA16_GRVWB16_GSUn1_GSUAMBSK_GSUC1_GSUWGMRR1_GLS0_ISA942_IU1_K1_LBSPPA512_LBSPPB256_LBSPPM0_LPA32_LPB32_LPM0_LRVW8_LWPMn1_MIAV0_MIWT2_2_MO40_NTn1_NTA0_NTB0_NTC0_NTD4_NTM0_NEPBS8_NLCA1_NLCB1_ONLL1_PGR2_PLR1_PKA1_SIA3_SS1_SU0_SUM1_SUS0_SPO0_SRVW0_SSO0_SVW2_SK0_SKXCCM0_TLDS0_ULSGRO0_USL1_UIOFGRO0_USFGROn1_VSn1_VWA2_VWB2_WSGRA0_WSGRB0_WS64_WG32_4_2_WGM1_WGMXCC4_WGMXCCGn1
    SolutionIndex: 60
    SolutionNameMin: Cijk_Ailk_Bjlk_I8II_BH_UserArgs_MT64x16x256_MI16x16x1_SN_LDSB1_AFC0_AFEM1_AFEM1_ASEM1_CLR1_CADS0_DTVA0_DTVB0_EPS0_FDSI0_GRPM1_GRVWA16_GRVWB16_GSUn1_GSUAMBSK_GSUC1_GSUWGMRR1_GLS0_ISA942_IU1_K1_LBSPPA512_LBSPPB128_LBSPPM0_LPA64_LPB16_LPM0_LRVW8_LWPMn1_MIAV0_MIWT4_1_MO40_NTn1_NTA0_NTB0_NTC0_NTD4_NTM0_NEPBS8_NLCA1_NLCB1_ONLL1_PGR2_PLR1_PKA1_SIA3_SS1_SU0_SUM1_SUS0_SPO0_SRVW0_SSO0_SVW4_SK0_SKXCCM0_TLDS0_ULSGRO0_USL1_UIOFGRO0_USFGROn1_VSn1_VWA4_VWB1_WSGRA0_WSGRB0_WS64_WG16_4_4_WGM1_WGMXCC4_WGMXCCGn1
    SolutionIndex: 61
    SolutionNameMin: Cijk_Ailk_Bjlk_I8II_BH_UserArgs_MT128x32x128_MI16x16x1_SN_LDSB1_AFC0_AFEM1_AFEM1_ASEM1_CLR1_CADS0_DTVA0_DTVB0_EPS0_FDSI0_GRPM1_GRVWA16_GRVWB16_GSUn1_GSUAMBSK_GSUC1_GSUWGMRR1_GLS0_ISA942_IU1_K1_LBSPPA1024_LBSPPB256_LBSPPM0_LPA32_LPB32_LPM0_LRVW8_LWPMn1_MIAV0_MIWT2_2_MO40_NTn1_NTA0_NTB0_NTC0_NTD4_NTM0_NEPBS8_NLCA1_NLCB1_ONLL1_PGR2_PLR1_PKA1_SIA3_SS1_SU0_SUM1_SUS0_SPO0_SRVW0_SSO0_SVW2_SK0_SKXCCM0_TLDS0_ULSGRO0_USL1_UIOFGRO0_USFGROn1_VSn1_VWA2_VWB2_WSGRA0_WSGRB0_WS64_WG64_4_1_WGM1_WGMXCC4_WGMXCCGn1
    SolutionIndex: 62
    SolutionNameMin: Cijk_Ailk_Bjlk_I8II_BH_UserArgs_MT64x32x128_MI16x16x1_SN_LDSB1_AFC0_AFEM1_AFEM1_ASEM1_CLR1_CADS0_DTVA0_DTVB0_EPS0_FDSI0_GRPM1_GRVWA16_GRVWB16_GSUn1_GSUAMBSK_GSUC1_GSUWGMRR1_GLS0_ISA942_IU1_K1_LBSPPA512_LBSPPB256_LBSPPM0_LPA32_LPB16_LPM0_LRVW8_LWPMn1_MIAV0_MIWT2_1_MO40_NTn1_NTA0_NTB0_NTC0_NTD4_NTM0_NEPBS8_NLCA1_NLCB1_ONLL1_PGR2_PLR1_PKA1_SIA3_SS1_SU0_SUM1_SUS0_SPO0_SRVW0_SSO0_SVW2_SK0_SKXCCM0_TLDS0_ULSGRO0_USL1_UIOFGRO0_USFGROn1_VSn1_VWA2_VWB1_WSGRA0_WSGRB0_WS64_WG32_8_1_WGM1_WGMXCC4_WGMXCCGn1
    SolutionIndex: 63
    SolutionNameMin: Cijk_Ailk_Bjlk_I8II_BH_UserArgs_MT64x32x256_MI16x16x1_SN_LDSB1_AFC0_AFEM1_AFEM1_ASEM1_CLR1_CADS0_DTVA0_DTVB0_EPS0_FDSI0_GRPM1_GRVWA16_GRVWB16_GSUn1_GSUAMBSK_GSUC1_GSUWGMRR1_GLS0_ISA942_IU1_K1_LBSPPA512_LBSPPB256_LBSPPM0_LPA64_LPB32_LPM0_LRVW8_LWPMn1_MIAV0_MIWT4_2_MO40_NTn1_NTA0_NTB0_NTC0_NTD4_NTM0_NEPBS8_NLCA1_NLCB1_ONLL1_PGR2_PLR1_PKA1_SIA3_SS1_SU0_SUM1_SUS0_SPO0_SRVW0_SSO0_SVW4_SK0_SKXCCM0_TLDS0_ULSGRO0_USL1_UIOFGRO0_USFGROn1_VSn1_VWA4_VWB2_WSGRA0_WSGRB0_WS64_WG16_4_4_WGM1_WGMXCC4_WGMXCCGn1
    SolutionIndex: 64
    SolutionNameMin: Cijk_Ailk_Bjlk_I8II_BH_UserArgs_MT64x32x256_MI16x16x1_SN_LDSB1_AFC0_AFEM1_AFEM1_ASEM1_CLR1_CADS0_DTVA0_DTVB0_EPS0_FDSI0_GRPM1_GRVWA16_GRVWB16_GSUn1_GSUAMBSK_GSUC1_GSUWGMRR1_GLS0_ISA942_IU1_K1_LBSPPA512_LBSPPB256_LBSPPM0_LPA32_LPB16_LPM0_LRVW8_LWPMn1_MIAV0_MIWT2_1_MO40_NTn1_NTA0_NTB0_NTC0_NTD4_NTM0_NEPBS8_NLCA1_NLCB1_ONLL1_PGR2_PLR1_PKA1_SIA3_SS1_SU0_SUM1_SUS0_SPO0_SRVW0_SSO0_SVW2_SK0_SKXCCM0_TLDS0_ULSGRO0_USL1_UIOFGRO0_USFGROn1_VSn1_VWA2_VWB1_WSGRA0_WSGRB0_WS64_WG32_8_1_WGM1_WGMXCC4_WGMXCCGn1
    SolutionIndex: 65
    SolutionNameMin: Cijk_Ailk_Bjlk_I8II_BH_UserArgs_MT128x32x256_MI16x16x1_SN_LDSB1_AFC0_AFEM1_AFEM1_ASEM1_CLR1_CADS0_DTVA0_DTVB0_EPS0_FDSI0_GRPM1_GRVWA16_GRVWB16_GSUn1_GSUAMBSK_GSUC1_GSUWGMRR1_GLS0_ISA942_IU1_K1_LBSPPA1024_LBSPPB256_LBSPPM0_LPA32_LPB32_LPM0_LRVW8_LWPMn1_MIAV0_MIWT2_2_MO40_NTn1_NTA0_NTB0_NTC0_NTD4_NTM0_NEPBS8_NLCA1_NLCB1_ONLL1_PGR2_PLR1_PKA1_SIA3_SS1_SU0_SUM1_SUS0_SPO0_SRVW0_SSO0_SVW2_SK0_SKXCCM0_TLDS0_ULSGRO0_USL1_UIOFGRO0_USFGROn1_VSn1_VWA2_VWB2_WSGRA0_WSGRB0_WS64_WG64_4_1_WGM1_WGMXCC4_WGMXCCGn1
    SolutionIndex: 66
    SolutionNameMin: Cijk_Ailk_Bjlk_I8II_BH_UserArgs_MT128x32x256_MI16x16x1_SN_LDSB1_AFC0_AFEM1_AFEM1_ASEM1_CLR1_CADS0_DTVA0_DTVB0_EPS0_FDSI0_GRPM1_GRVWA16_GRVWB16_GSUn1_GSUAMBSK_GSUC1_GSUWGMRR1_GLS0_ISA942_IU1_K1_LBSPPA1024_LBSPPB256_LBSPPM0_LPA64_LPB16_LPM0_LRVW8_LWPMn1_MIAV0_MIWT4_1_MO40_NTn1_NTA0_NTB0_NTC0_NTD4_NTM0_NEPBS8_NLCA1_NLCB1_ONLL1_PGR2_PLR1_PKA1_SIA3_SS1_SU0_SUM1_SUS0_SPO0_SRVW0_SSO0_SVW4_SK0_SKXCCM0_TLDS0_ULSGRO0_USL1_UIOFGRO0_USFGROn1_VSn1_VWA4_VWB1_WSGRA0_WSGRB0_WS64_WG32_8_1_WGM1_WGMXCC4_WGMXCCGn1
    SolutionIndex: 67
    SolutionNameMin: Cijk_Ailk_Bjlk_I8II_BH_UserArgs_MT128x32x128_MI16x16x1_SN_LDSB1_AFC0_AFEM1_AFEM1_ASEM1_CLR1_CADS0_DTVA0_DTVB0_EPS0_FDSI0_GRPM1_GRVWA16_GRVWB16_GSUn1_GSUAMBSK_GSUC1_GSUWGMRR1_GLS0_ISA942_IU1_K1_LBSPPA1024_LBSPPB256_LBSPPM0_LPA64_LPB16_LPM0_LRVW8_LWPMn1_MIAV0_MIWT4_2_MO40_NTn1_NTA0_NTB0_NTC0_NTD4_NTM0_NEPBS8_NLCA1_NLCB1_ONLL1_PGR2_PLR1_PKA1_SIA3_SS1_SU0_SUM1_SUS0_SPO0_SRVW0_SSO0_SVW4_SK0_SKXCCM0_TLDS0_ULSGRO0_USL1_UIOFGRO0_USFGROn1_VSn1_VWA4_VWB1_WSGRA0_WSGRB0_WS64_WG32_4_2_WGM1_WGMXCC4_WGMXCCGn1
    SolutionIndex: 68
    SolutionNameMin: Cijk_Ailk_Bjlk_I8II_BH_UserArgs_MT128x32x128_MI16x16x1_SN_LDSB1_AFC0_AFEM1_AFEM1_ASEM1_CLR1_CADS0_DTVA0_DTVB0_EPS0_FDSI0_GRPM1_GRVWA16_GRVWB16_GSUn1_GSUAMBSK_GSUC1_GSUWGMRR1_GLS0_ISA942_IU1_K1_LBSPPA1024_LBSPPB256_LBSPPM0_LPA64_LPB32_LPM0_LRVW8_LWPMn1_MIAV0_MIWT4_2_MO40_NTn1_NTA0_NTB0_NTC0_NTD4_NTM0_NEPBS8_NLCA1_NLCB1_ONLL1_PGR2_PLR1_PKA1_SIA3_SS1_SU0_SUM1_SUS0_SPO0_SRVW0_SSO0_SVW4_SK0_SKXCCM0_TLDS0_ULSGRO0_USL1_UIOFGRO0_USFGROn1_VSn1_VWA4_VWB2_WSGRA0_WSGRB0_WS64_WG32_4_2_WGM1_WGMXCC4_WGMXCCGn1
    SolutionIndex: 69
    SolutionNameMin: Cijk_Ailk_Bjlk_I8II_BH_UserArgs_MT128x32x128_MI16x16x1_SN_LDSB1_AFC0_AFEM1_AFEM1_ASEM1_CLR1_CADS0_DTVA0_DTVB0_EPS0_FDSI0_GRPM1_GRVWA16_GRVWB16_GSUn1_GSUAMBSK_GSUC1_GSUWGMRR1_GLS0_ISA942_IU1_K1_LBSPPA1024_LBSPPB256_LBSPPM0_LPA32_LPB32_LPM0_LRVW8_LWPMn1_MIAV0_MIWT4_2_MO40_NTn1_NTA0_NTB0_NTC0_NTD4_NTM0_NEPBS8_NLCA1_NLCB1_ONLL1_PGR2_PLR1_PKA1_SIA3_SS1_SU0_SUM1_SUS0_SPO0_SRVW0_SSO0_SVW4_SK0_SKXCCM0_TLDS0_ULSGRO0_USL1_UIOFGRO0_USFGROn1_VSn1_VWA4_VWB2_WSGRA0_WSGRB0_WS64_WG32_4_2_WGM1_WGMXCC4_WGMXCCGn1
    SolutionIndex: 70
    SolutionNameMin: Cijk_Ailk_Bjlk_I8II_BH_UserArgs_MT256x32x128_MI16x16x1_SN_LDSB1_AFC0_AFEM1_AFEM1_ASEM1_CLR1_CADS0_DTVA0_DTVB0_EPS0_FDSI0_GRPM1_GRVWA16_GRVWB16_GSUn1_GSUAMBSK_GSUC1_GSUWGMRR1_GLS0_ISA942_IU1_K1_LBSPPA2048_LBSPPB256_LBSPPM0_LPA64_LPB32_LPM0_LRVW8_LWPMn1_MIAV0_MIWT8_2_MO40_NTn1_NTA0_NTB0_NTC0_NTD4_NTM0_NEPBS8_NLCA1_NLCB1_ONLL1_PGR2_PLR1_PKA1_SIA3_SS1_SU0_SUM1_SUS0_SPO0_SRVW0_SSO0_SVW8_SK0_SKXCCM0_TLDS0_ULSGRO0_USL1_UIOFGRO0_USFGROn1_VSn1_VWA8_VWB2_WSGRA0_WSGRB0_WS64_WG32_4_2_WGM1_WGMXCC4_WGMXCCGn1
    SolutionIndex: 71
    SolutionNameMin: Cijk_Ailk_Bjlk_I8II_BH_UserArgs_MT256x32x128_MI16x16x1_SN_LDSB1_AFC0_AFEM1_AFEM1_ASEM1_CLR1_CADS0_DTVA0_DTVB0_EPS0_FDSI0_GRPM1_GRVWA16_GRVWB16_GSUn1_GSUAMBSK_GSUC1_GSUWGMRR1_GLS0_ISA942_IU1_K1_LBSPPA2048_LBSPPB256_LBSPPM0_LPA64_LPB32_LPM0_LRVW8_LWPMn1_MIAV0_MIWT4_2_MO40_NTn1_NTA0_NTB0_NTC0_NTD4_NTM0_NEPBS8_NLCA1_NLCB1_ONLL1_PGR2_PLR1_PKA1_SIA3_SS1_SU0_SUM1_SUS0_SPO0_SRVW0_SSO0_SVW4_SK0_SKXCCM0_TLDS0_ULSGRO0_USL1_UIOFGRO0_USFGROn1_VSn1_VWA4_VWB2_WSGRA0_WSGRB0_WS64_WG64_4_1_WGM1_WGMXCC4_WGMXCCGn1
    SolutionIndex: 72
    SolutionNameMin: Cijk_Ailk_Bjlk_I8II_BH_UserArgs_MT128x32x128_MI16x16x1_SN_LDSB1_AFC0_AFEM1_AFEM1_ASEM1_CLR1_CADS0_DTVA0_DTVB0_EPS0_FDSI0_GRPM1_GRVWA16_GRVWB16_GSUn1_GSUAMBSK_GSUC1_GSUWGMRR1_GLS0_ISA942_IU1_K1_LBSPPA1024_LBSPPB256_LBSPPM0_LPA32_LPB16_LPM0_LRVW8_LWPMn1_MIAV0_MIWT4_2_MO40_NTn1_NTA0_NTB0_NTC0_NTD4_NTM0_NEPBS8_NLCA1_NLCB1_ONLL1_PGR2_PLR1_PKA1_SIA3_SS1_SU0_SUM1_SUS0_SPO0_SRVW0_SSO0_SVW4_SK0_SKXCCM0_TLDS0_ULSGRO0_USL1_UIOFGRO0_USFGROn1_VSn1_VWA4_VWB1_WSGRA0_WSGRB0_WS64_WG32_4_2_WGM1_WGMXCC4_WGMXCCGn1
    SolutionIndex: 73
    SolutionNameMin: Cijk_Ailk_Bjlk_I8II_BH_UserArgs_MT64x32x128_MI16x16x1_SN_LDSB1_AFC0_AFEM1_AFEM1_ASEM1_CLR1_CADS0_DTVA0_DTVB0_EPS0_FDSI0_GRPM1_GRVWA16_GRVWB16_GSUn1_GSUAMBSK_GSUC1_GSUWGMRR1_GLS0_ISA942_IU1_K1_LBSPPA512_LBSPPB256_LBSPPM0_LPA64_LPB16_LPM0_LRVW8_LWPMn1_MIAV0_MIWT4_1_MO40_NTn1_NTA0_NTB0_NTC0_NTD4_NTM0_NEPBS8_NLCA1_NLCB1_ONLL1_PGR2_PLR1_PKA1_SIA3_SS1_SU0_SUM1_SUS0_SPO0_SRVW0_SSO0_SVW4_SK0_SKXCCM0_TLDS0_ULSGRO0_USL1_UIOFGRO0_USFGROn1_VSn1_VWA4_VWB1_WSGRA0_WSGRB0_WS64_WG16_8_2_WGM1_WGMXCC4_WGMXCCGn1
    SolutionIndex: 74
    SolutionNameMin: Cijk_Ailk_Bjlk_I8II_BH_UserArgs_MT128x32x128_MI32x32x1_SN_LDSB1_AFC0_AFEM1_AFEM1_ASEM1_CLR1_CADS0_DTVA0_DTVB0_EPS0_FDSI0_GRPM1_GRVWA16_GRVWB16_GSUn1_GSUAMBSK_GSUC1_GSUWGMRR1_GLS0_ISA942_IU1_K1_LBSPPA0_LBSPPB0_LBSPPM0_LPA0_LPB0_LPM0_LRVW8_LWPMn1_MIAV0_MIWT4_1_MO40_NTn1_NTA0_NTB0_NTC0_NTD4_NTM0_NEPBS8_NLCA1_NLCB1_ONLL1_PGR2_PLR1_PKA1_SIA3_SS1_SU0_SUM1_SUS0_SPO0_SRVW0_SSO0_SVW4_SK0_SKXCCM0_TLDS0_ULSGRO0_USL1_UIOFGRO0_USFGROn1_VSn1_VWA4_VWB1_WSGRA0_WSGRB0_WS64_WG32_2_4_WGM1_WGMXCC4_WGMXCCGn1
    SolutionIndex: 75
    SolutionNameMin: Cijk_Ailk_Bjlk_I8II_BH_UserArgs_MT192x32x128_MI16x16x1_SN_LDSB1_AFC0_AFEM1_AFEM1_ASEM1_CLR1_CADS0_DTVA0_DTVB0_EPS0_FDSI0_GRPM1_GRVWA16_GRVWB16_GSUn1_GSUAMBSK_GSUC1_GSUWGMRR1_GLS0_ISA942_IU1_K1_LBSPPA1536_LBSPPB256_LBSPPM0_LPA16_LPB32_LPM0_LRVW8_LWPMn1_MIAV0_MIWT3_2_MO40_NTn1_NTA0_NTB0_NTC0_NTD4_NTM0_NEPBS6_NLCA1_NLCB1_ONLL1_PGR2_PLR1_PKA1_SIA3_SS1_SU0_SUM1_SUS0_SPO0_SRVW0_SSO0_SVW1_SK0_SKXCCM0_TLDS0_ULSGRO0_USL1_UIOFGRO0_USFGROn1_VSn1_VWA1_VWB2_WSGRA0_WSGRB0_WS64_WG64_4_1_WGM1_WGMXCC4_WGMXCCGn1
    SolutionIndex: 76
    SolutionNameMin: Cijk_Ailk_Bjlk_I8II_BH_UserArgs_MT160x32x128_MI16x16x1_SN_LDSB1_AFC0_AFEM1_AFEM1_ASEM1_CLR1_CADS0_DTVA0_DTVB0_EPS0_FDSI0_GRPM1_GRVWA16_GRVWB16_GSUn1_GSUAMBSK_GSUC1_GSUWGMRR1_GLS0_ISA942_IU1_K1_LBSPPA1280_LBSPPB256_LBSPPM0_LPA16_LPB16_LPM0_LRVW8_LWPMn1_MIAV0_MIWT5_1_MO40_NTn1_NTA0_NTB0_NTC0_NTD4_NTM0_NEPBS5_NLCA1_NLCB1_ONLL1_PGR2_PLR1_PKA1_SIA3_SS1_SU0_SUM1_SUS0_SPO0_SRVW0_SSO0_SVW1_SK0_SKXCCM0_TLDS0_ULSGRO0_USL1_UIOFGRO0_USFGROn1_VSn1_VWA1_VWB1_WSGRA0_WSGRB0_WS64_WG32_8_1_WGM1_WGMXCC4_WGMXCCGn1
    SolutionIndex: 77
    SolutionNameMin: Cijk_Ailk_Bjlk_I8II_BH_UserArgs_MT192x32x128_MI16x16x1_SN_LDSB1_AFC0_AFEM1_AFEM1_ASEM1_CLR1_CADS0_DTVA0_DTVB0_EPS0_FDSI0_GRPM1_GRVWA16_GRVWB16_GSUn1_GSUAMBSK_GSUC1_GSUWGMRR1_GLS0_ISA942_IU1_K1_LBSPPA1536_LBSPPB256_LBSPPM0_LPA32_LPB16_LPM0_LRVW8_LWPMn1_MIAV0_MIWT6_1_MO40_NTn1_NTA0_NTB0_NTC0_NTD4_NTM0_NEPBS6_NLCA1_NLCB1_ONLL1_PGR2_PLR1_PKA1_SIA3_SS1_SU0_SUM1_SUS0_SPO0_SRVW0_SSO0_SVW2_SK0_SKXCCM0_TLDS0_ULSGRO0_USL1_UIOFGRO0_USFGROn1_VSn1_VWA2_VWB1_WSGRA0_WSGRB0_WS64_WG32_8_1_WGM1_WGMXCC4_WGMXCCGn1
    SolutionIndex: 78
    SolutionNameMin: Cijk_Ailk_Bjlk_I8II_BH_UserArgs_MT128x32x128_MI16x16x1_SN_LDSB1_AFC0_AFEM1_AFEM1_ASEM1_CLR1_CADS0_DTVA0_DTVB0_EPS0_FDSI0_GRPM1_GRVWA16_GRVWB16_GSUn1_GSUAMBSK_GSUC1_GSUWGMRR1_GLS0_ISA942_IU1_K1_LBSPPA1024_LBSPPB256_LBSPPM0_LPA32_LPB32_LPM0_LRVW8_LWPMn1_MIAV0_MIWT2_2_MO40_NTn1_NTA0_NTB0_NTC0_NTD4_NTM0_NEPBS8_NLCA1_NLCB1_ONLL1_PGR2_PLR1_PKA1_SIA3_SS1_SU0_SUM1_SUS0_SPO0_SRVW0_SSO4_SVW2_SK0_SKXCCM0_TLDS0_ULSGRO0_USL1_UIOFGRO0_USFGROn1_VSn1_VWA2_VWB2_WSGRA0_WSGRB0_WS64_WG64_4_1_WGM1_WGMXCC4_WGMXCCGn1
    SolutionIndex: 79
    SolutionNameMin: Cijk_Ailk_Bjlk_I8II_BH_UserArgs_MT256x32x128_MI16x16x1_SN_LDSB1_AFC0_AFEM1_AFEM1_ASEM1_CLR1_CADS0_DTVA0_DTVB0_EPS0_FDSI0_GRPM1_GRVWA16_GRVWB16_GSUn1_GSUAMBSK_GSUC1_GSUWGMRR1_GLS0_ISA942_IU1_K1_LBSPPA2048_LBSPPB256_LBSPPM0_LPA64_LPB32_LPM0_LRVW8_LWPMn1_MIAV0_MIWT4_2_MO40_NTn1_NTA0_NTB0_NTC0_NTD4_NTM0_NEPBS8_NLCA1_NLCB1_ONLL1_PGR2_PLR1_PKA1_SIA3_SS1_SU0_SUM1_SUS0_SPO0_SRVW0_SSO4_SVW4_SK0_SKXCCM0_TLDS0_ULSGRO0_USL1_UIOFGRO0_USFGROn1_VSn1_VWA4_VWB2_WSGRA0_WSGRB0_WS64_WG64_4_1_WGM1_WGMXCC4_WGMXCCGn1
    SolutionIndex: 80
    SolutionNameMin: Cijk_Ailk_Bjlk_I8II_BH_UserArgs_MT16x16x256_MI16x16x1_SN_LDSB0_AFC0_AFEM1_AFEM1_ASEM1_CLR1_CADS0_DTVA0_DTVB0_EPS0_FDSI0_GRPM1_GRVWA1_GRVWB16_GSUn1_GSUAMBSK_GSUC1_GSUWGMRR1_GLS0_ISA942_IU1_K1_LBSPPA128_LBSPPB128_LBSPPM0_LPA16_LPB16_LPM0_LRVW8_LWPMn1_MIAV0_MIWT1_1_MO40_NTn1_NTA0_NTB0_NTC0_NTD4_NTM0_NEPBS8_NLCA1_NLCB1_ONLL1_PGR2_PLR1_PKA1_SIA3_SS1_SU0_SUM1_SUS0_SPO0_SRVW0_SSO0_SVW1_SK0_SKXCCM0_TLDS0_ULSGRO0_USL1_UIOFGRO0_USFGROn1_VSn1_VWA1_VWB1_WSGRA0_WSGRB0_WS64_WG16_4_2_WGM1_WGMXCC4_WGMXCCGn1
    SolutionIndex: 81
    SolutionNameMin: Cijk_Ailk_Bjlk_I8II_BH_UserArgs_MT16x16x256_MI16x16x1_SN_LDSB1_AFC0_AFEM1_AFEM1_ASEM1_CLR1_CADS0_DTVA0_DTVB0_EPS0_FDSI0_GRPM1_GRVWA16_GRVWB16_GSUn1_GSUAMBSK_GSUC1_GSUWGMRR1_GLS0_ISA942_IU1_K1_LBSPPA128_LBSPPB128_LBSPPM0_LPA16_LPB16_LPM0_LRVW8_LWPMn1_MIAV0_MIWT1_1_MO40_NTn1_NTA0_NTB0_NTC0_NTD4_NTM0_NEPBS8_NLCA1_NLCB1_ONLL1_PGR2_PLR1_PKA1_SIA3_SS1_SU0_SUM1_SUS0_SPO0_SRVW0_SSO0_SVW1_SK0_SKXCCM0_TLDS0_ULSGRO0_USL1_UIOFGRO0_USFGROn1_VSn1_VWA1_VWB1_WSGRA0_WSGRB0_WS64_WG16_4_2_WGM1_WGMXCC4_WGMXCCGn1
    SolutionIndex: 82
    SolutionNameMin: Cijk_Ailk_Bjlk_I8II_BH_UserArgs_MT16x16x128_MI16x16x1_SN_LDSB1_AFC0_AFEM1_AFEM1_ASEM1_CLR1_CADS0_DTVA0_DTVB0_EPS0_FDSI0_GRPM1_GRVWA16_GRVWB16_GSUn1_GSUAMBSK_GSUC1_GSUWGMRR1_GLS0_ISA942_IU1_K1_LBSPPA128_LBSPPB128_LBSPPM0_LPA16_LPB16_LPM0_LRVW8_LWPMn1_MIAV0_MIWT1_1_MO40_NTn1_NTA0_NTB0_NTC0_NTD4_NTM0_NEPBS8_NLCA1_NLCB1_ONLL1_PGR2_PLR1_PKA1_SIA3_SS1_SU0_SUM1_SUS0_SPO0_SRVW0_SSO0_SVW1_SK0_SKXCCM0_TLDS0_ULSGRO0_USL1_UIOFGRO0_USFGROn1_VSn1_VWA1_VWB1_WSGRA0_WSGRB0_WS64_WG16_4_2_WGM1_WGMXCC4_WGMXCCGn1
    SolutionIndex: 83
    SolutionNameMin: Cijk_Ailk_Bjlk_I8II_BH_UserArgs_MT16x16x512_MI16x16x1_SN_LDSB1_AFC0_AFEM1_AFEM1_ASEM1_CLR1_CADS0_DTVA0_DTVB0_EPS0_FDSI0_GRPM1_GRVWA16_GRVWB16_GSUn1_GSUAMBSK_GSUC1_GSUWGMRR1_GLS0_ISA942_IU1_K1_LBSPPA128_LBSPPB128_LBSPPM0_LPA16_LPB16_LPM0_LRVW8_LWPMn1_MIAV0_MIWT1_1_MO40_NTn1_NTA0_NTB0_NTC0_NTD4_NTM0_NEPBS8_NLCA1_NLCB1_ONLL1_PGR2_PLR1_PKA1_SIA3_SS1_SU0_SUM1_SUS0_SPO0_SRVW0_SSO0_SVW1_SK0_SKXCCM0_TLDS0_ULSGRO0_USL1_UIOFGRO0_USFGROn1_VSn1_VWA1_VWB1_WSGRA0_WSGRB0_WS64_WG16_4_2_WGM1_WGMXCC4_WGMXCCGn1
    SolutionIndex: 84
    SolutionNameMin: Cijk_Ailk_Bjlk_I8II_BH_UserArgs_MT64x48x256_MI16x16x1_SN_LDSB1_AFC0_AFEM1_AFEM1_ASEM1_CLR1_CADS0_DTVA0_DTVB0_EPS0_FDSI0_GRPM1_GRVWA16_GRVWB16_GSUn1_GSUAMBSK_GSUC1_GSUWGMRR1_GLS0_ISA942_IU1_K1_LBSPPA512_LBSPPB384_LBSPPM0_LPA32_LPB16_LPM0_LRVW8_LWPMn1_MIAV0_MIWT2_3_MO40_NTn1_NTA0_NTB0_NTC0_NTD4_NTM0_NEPBS8_NLCA1_NLCB1_ONLL1_PGR2_PLR1_PKA1_SIA3_SS1_SU0_SUM1_SUS0_SPO0_SRVW0_SSO0_SVW2_SK0_SKXCCM0_TLDS0_ULSGRO0_USL1_UIOFGRO0_USFGROn1_VSn1_VWA2_VWB1_WSGRA0_WSGRB0_WS64_WG32_4_2_WGM1_WGMXCC4_WGMXCCGn1
    SolutionIndex: 85
    SolutionNameMin: Cijk_Ailk_Bjlk_I8II_BH_UserArgs_MT64x32x128_MI16x16x1_SN_LDSB0_AFC0_AFEM1_AFEM1_ASEM1_CLR1_CADS0_DTVA0_DTVB0_EPS0_FDSI0_GRPM1_GRVWA16_GRVWB16_GSUn1_GSUAMBSK_GSUC1_GSUWGMRR1_GLS0_ISA942_IU1_K1_LBSPPA512_LBSPPB256_LBSPPM0_LPA32_LPB16_LPM0_LRVW8_LWPMn1_MIAV0_MIWT2_1_MO40_NTn1_NTA0_NTB0_NTC0_NTD4_NTM0_NEPBS8_NLCA1_NLCB1_ONLL1_PGR2_PLR1_PKA1_SIA3_SS1_SU0_SUM1_SUS0_SPO0_SRVW0_SSO0_SVW2_SK0_SKXCCM0_TLDS0_ULSGRO0_USL1_UIOFGRO0_USFGROn1_VSn1_VWA2_VWB1_WSGRA0_WSGRB0_WS64_WG32_8_1_WGM1_WGMXCC4_WGMXCCGn1
    SolutionIndex: 86
    SolutionNameMin: Cijk_Ailk_Bjlk_I8II_BH_UserArgs_MT64x32x256_MI16x16x1_SN_LDSB0_AFC0_AFEM1_AFEM1_ASEM1_CLR1_CADS0_DTVA0_DTVB0_EPS0_FDSI0_GRPM1_GRVWA16_GRVWB16_GSUn1_GSUAMBSK_GSUC1_GSUWGMRR1_GLS0_ISA942_IU1_K1_LBSPPA512_LBSPPB256_LBSPPM0_LPA16_LPB32_LPM0_LRVW8_LWPMn1_MIAV0_MIWT1_2_MO40_NTn1_NTA0_NTB0_NTC0_NTD4_NTM0_NEPBS8_NLCA1_NLCB1_ONLL1_PGR2_PLR1_PKA1_SIA3_SS1_SU0_SUM1_SUS0_SPO0_SRVW0_SSO0_SVW1_SK0_SKXCCM0_TLDS0_ULSGRO0_USL1_UIOFGRO0_USFGROn1_VSn1_VWA1_VWB2_WSGRA0_WSGRB0_WS64_WG64_4_1_WGM1_WGMXCC4_WGMXCCGn1
    SolutionIndex: 87
    SolutionNameMin: Cijk_Ailk_Bjlk_I8II_BH_UserArgs_MT128x48x256_MI16x16x1_SN_LDSB1_AFC0_AFEM1_AFEM1_ASEM1_CLR1_CADS0_DTVA0_DTVB0_EPS0_FDSI0_GRPM1_GRVWA16_GRVWB16_GSUn1_GSUAMBSK_GSUC1_GSUWGMRR1_GLS0_ISA942_IU1_K1_LBSPPA1024_LBSPPB384_LBSPPM0_LPA64_LPB16_LPM0_LRVW8_LWPMn1_MIAV0_MIWT4_3_MO40_NTn1_NTA0_NTB0_NTC0_NTD4_NTM0_NEPBS8_NLCA1_NLCB1_ONLL1_PGR2_PLR1_PKA1_SIA3_SS1_SU0_SUM1_SUS0_SPO0_SRVW0_SSO0_SVW4_SK0_SKXCCM0_TLDS0_ULSGRO0_USL1_UIOFGRO0_USFGROn1_VSn1_VWA4_VWB1_WSGRA0_WSGRB0_WS64_WG32_4_2_WGM1_WGMXCC4_WGMXCCGn1
    SolutionIndex: 88
    SolutionNameMin: Cijk_Ailk_Bjlk_I8II_BH_UserArgs_MT128x32x128_MI16x16x1_SN_LDSB1_AFC0_AFEM1_AFEM1_ASEM1_CLR1_CADS0_DTVA0_DTVB0_EPS0_FDSI0_GRPM1_GRVWA16_GRVWB16_GSUn1_GSUAMBSK_GSUC1_GSUWGMRR1_GLS0_ISA942_IU1_K1_LBSPPA1024_LBSPPB256_LBSPPM0_LPA64_LPB16_LPM0_LRVW8_LWPMn1_MIAV0_MIWT4_1_MO40_NTn1_NTA0_NTB0_NTC0_NTD4_NTM0_NEPBS8_NLCA1_NLCB1_ONLL1_PGR2_PLR1_PKA1_SIA3_SS1_SU0_SUM1_SUS0_SPO0_SRVW0_SSO0_SVW4_SK0_SKXCCM0_TLDS0_ULSGRO0_USL1_UIOFGRO0_USFGROn1_VSn1_VWA4_VWB1_WSGRA0_WSGRB0_WS64_WG32_8_1_WGM1_WGMXCC4_WGMXCCGn1
    SolutionIndex: 89
    SolutionNameMin: Cijk_Ailk_Bjlk_I8II_BH_UserArgs_MT32x48x256_MI16x16x1_SN_LDSB1_AFC0_AFEM1_AFEM1_ASEM1_CLR1_CADS0_DTVA0_DTVB0_EPS0_FDSI0_GRPM1_GRVWA16_GRVWB16_GSUn1_GSUAMBSK_GSUC1_GSUWGMRR1_GLS0_ISA942_IU1_K1_LBSPPA256_LBSPPB384_LBSPPM0_LPA32_LPB16_LPM0_LRVW8_LWPMn1_MIAV0_MIWT2_3_MO40_NTn1_NTA0_NTB0_NTC0_NTD4_NTM0_NEPBS8_NLCA1_NLCB1_ONLL1_PGR2_PLR1_PKA1_SIA3_SS1_SU0_SUM1_SUS0_SPO0_SRVW0_SSO0_SVW2_SK0_SKXCCM0_TLDS0_ULSGRO0_USL1_UIOFGRO0_USFGROn1_VSn1_VWA2_VWB1_WSGRA0_WSGRB0_WS64_WG16_4_4_WGM1_WGMXCC4_WGMXCCGn1
    SolutionIndex: 90
    SolutionNameMin: Cijk_Ailk_Bjlk_I8II_BH_UserArgs_MT128x48x256_MI16x16x1_SN_LDSB1_AFC0_AFEM1_AFEM1_ASEM1_CLR1_CADS0_DTVA0_DTVB0_EPS0_FDSI0_GRPM1_GRVWA16_GRVWB16_GSUn1_GSUAMBSK_GSUC1_GSUWGMRR1_GLS0_ISA942_IU1_K1_LBSPPA1024_LBSPPB384_LBSPPM0_LPA64_LPB16_LPM0_LRVW8_LWPMn1_MIAV0_MIWT8_3_MO40_NTn1_NTA0_NTB0_NTC0_NTD4_NTM0_NEPBS8_NLCA1_NLCB1_ONLL1_PGR2_PLR1_PKA1_SIA3_SS1_SU0_SUM1_SUS0_SPO0_SRVW0_SSO0_SVW8_SK0_SKXCCM0_TLDS0_ULSGRO0_USL1_UIOFGRO0_USFGROn1_VSn1_VWA8_VWB1_WSGRA0_WSGRB0_WS64_WG16_4_4_WGM1_WGMXCC4_WGMXCCGn1
    SolutionIndex: 91
    SolutionNameMin: Cijk_Ailk_Bjlk_I8II_BH_UserArgs_MT64x48x256_MI16x16x1_SN_LDSB1_AFC0_AFEM1_AFEM1_ASEM1_CLR1_CADS0_DTVA0_DTVB0_EPS0_FDSI0_GRPM1_GRVWA16_GRVWB16_GSUn1_GSUAMBSK_GSUC1_GSUWGMRR1_GLS0_ISA942_IU1_K1_LBSPPA512_LBSPPB384_LBSPPM0_LPA64_LPB16_LPM0_LRVW8_LWPMn1_MIAV0_MIWT4_3_MO40_NTn1_NTA0_NTB0_NTC0_NTD4_NTM0_NEPBS8_NLCA1_NLCB1_ONLL1_PGR2_PLR1_PKA1_SIA3_SS1_SU0_SUM1_SUS0_SPO0_SRVW0_SSO0_SVW4_SK0_SKXCCM0_TLDS0_ULSGRO0_USL1_UIOFGRO0_USFGROn1_VSn1_VWA4_VWB1_WSGRA0_WSGRB0_WS64_WG16_4_4_WGM1_WGMXCC4_WGMXCCGn1
    SolutionIndex: 92
    SolutionNameMin: Cijk_Ailk_Bjlk_I8II_BH_UserArgs_MT16x32x128_MI16x16x1_SN_LDSB1_AFC0_AFEM1_AFEM1_ASEM1_CLR0_CADS0_DTVA0_DTVB0_EPS0_FDSI0_GRPM1_GRVWA1_GRVWB16_GSUn1_GSUAMBSK_GSUC1_GSUWGMRR1_GLS0_ISA942_IU1_K1_LBSPPA128_LBSPPB256_LBSPPM0_LPA16_LPB32_LPM0_LRVW8_LWPMn1_MIAV0_MIWT1_2_MO40_NTn1_NTA0_NTB0_NTC0_NTD4_NTM0_NEPBS8_NLCA1_NLCB1_ONLL1_PGR2_PLR0_PKA1_SIA3_SS1_SU0_SUM1_SUS0_SPO0_SRVW0_SSO0_SVW1_SK0_SKXCCM0_TLDS0_ULSGRO0_USL1_UIOFGRO0_USFGROn1_VSn1_VWA1_VWB2_WSGRA0_WSGRB0_WS64_WG16_4_4_WGM1_WGMXCC4_WGMXCCGn1
    SolutionIndex: 93
    SolutionNameMin: Cijk_Ailk_Bjlk_I8II_BH_UserArgs_MT16x32x256_MI16x16x1_SN_LDSB1_AFC0_AFEM1_AFEM1_ASEM1_CLR1_CADS0_DTVA0_DTVB0_EPS0_FDSI0_GRPM1_GRVWA1_GRVWB16_GSUn1_GSUAMBSK_GSUC1_GSUWGMRR1_GLS0_ISA942_IU1_K1_LBSPPA128_LBSPPB256_LBSPPM0_LPA16_LPB32_LPM0_LRVW8_LWPMn1_MIAV0_MIWT1_2_MO40_NTn1_NTA0_NTB0_NTC0_NTD4_NTM0_NEPBS8_NLCA1_NLCB1_ONLL1_PGR2_PLR1_PKA1_SIA3_SS1_SU0_SUM1_SUS0_SPO0_SRVW0_SSO0_SVW1_SK0_SKXCCM0_TLDS0_ULSGRO0_USL1_UIOFGRO0_USFGROn1_VSn1_VWA1_VWB2_WSGRA0_WSGRB0_WS64_WG16_4_4_WGM1_WGMXCC4_WGMXCCGn1
    SolutionIndex: 94
    SolutionNameMin: Cijk_Ailk_Bjlk_I8II_BH_UserArgs_MT16x64x128_MI16x16x1_SN_LDSB0_AFC0_AFEM1_AFEM1_ASEM1_CLR1_CADS0_DTVA0_DTVB0_EPS0_FDSI0_GRPM1_GRVWA1_GRVWB16_GSUn1_GSUAMBSK_GSUC1_GSUWGMRR1_GLS0_ISA942_IU1_K1_LBSPPA128_LBSPPB512_LBSPPM0_LPA16_LPB32_LPM0_LRVW8_LWPMn1_MIAV0_MIWT1_2_MO40_NTn1_NTA0_NTB0_NTC0_NTD4_NTM0_NEPBS8_NLCA1_NLCB1_ONLL1_PGR2_PLR1_PKA1_SIA3_SS1_SU0_SUM1_SUS0_SPO0_SRVW0_SSO0_SVW1_SK0_SKXCCM0_TLDS0_ULSGRO0_USL1_UIOFGRO0_USFGROn1_VSn1_VWA1_VWB2_WSGRA0_WSGRB0_WS64_WG16_8_2_WGM1_WGMXCC4_WGMXCCGn1
    SolutionIndex: 95
    SolutionNameMin: Cijk_Ailk_Bjlk_I8II_BH_UserArgs_MT16x64x256_MI16x16x1_SN_LDSB0_AFC0_AFEM1_AFEM1_ASEM1_CLR1_CADS0_DTVA0_DTVB0_EPS0_FDSI0_GRPM1_GRVWA16_GRVWB16_GSUn1_GSUAMBSK_GSUC1_GSUWGMRR1_GLS0_ISA942_IU1_K1_LBSPPA128_LBSPPB512_LBSPPM0_LPA16_LPB32_LPM0_LRVW8_LWPMn1_MIAV0_MIWT1_2_MO40_NTn1_NTA0_NTB0_NTC0_NTD4_NTM0_NEPBS8_NLCA1_NLCB1_ONLL1_PGR2_PLR1_PKA1_SIA3_SS1_SU0_SUM1_SUS0_SPO0_SRVW0_SSO0_SVW1_SK0_SKXCCM0_TLDS0_ULSGRO0_USL1_UIOFGRO0_USFGROn1_VSn1_VWA1_VWB2_WSGRA0_WSGRB0_WS64_WG16_8_2_WGM1_WGMXCC4_WGMXCCGn1
    SolutionIndex: 96
    SolutionNameMin: Cijk_Ailk_Bjlk_I8II_BH_UserArgs_MT32x32x256_MI16x16x1_SN_LDSB0_AFC0_AFEM1_AFEM1_ASEM1_CLR1_CADS0_DTVA0_DTVB0_EPS0_FDSI0_GRPM1_GRVWA16_GRVWB16_GSUn1_GSUAMBSK_GSUC1_GSUWGMRR1_GLS0_ISA942_IU1_K1_LBSPPA256_LBSPPB256_LBSPPM0_LPA16_LPB32_LPM0_LRVW8_LWPMn1_MIAV0_MIWT1_2_MO40_NTn1_NTA0_NTB0_NTC0_NTD4_NTM0_NEPBS8_NLCA1_NLCB1_ONLL1_PGR2_PLR1_PKA1_SIA3_SS1_SU0_SUM1_SUS0_SPO0_SRVW0_SSO0_SVW1_SK0_SKXCCM0_TLDS0_ULSGRO0_USL1_UIOFGRO0_USFGROn1_VSn1_VWA1_VWB2_WSGRA0_WSGRB0_WS64_WG32_4_2_WGM1_WGMXCC4_WGMXCCGn1
    SolutionIndex: 97
    SolutionNameMin: Cijk_Ailk_Bjlk_I8II_BH_UserArgs_MT32x32x512_MI16x16x1_SN_LDSB1_AFC0_AFEM1_AFEM1_ASEM1_CLR1_CADS0_DTVA0_DTVB0_EPS0_FDSI0_GRPM1_GRVWA16_GRVWB16_GSUn1_GSUAMBSK_GSUC1_GSUWGMRR1_GLS0_ISA942_IU1_K1_LBSPPA256_LBSPPB256_LBSPPM0_LPA32_LPB32_LPM0_LRVW8_LWPMn1_MIAV0_MIWT2_2_MO40_NTn1_NTA0_NTB0_NTC0_NTD4_NTM0_NEPBS8_NLCA1_NLCB1_ONLL1_PGR2_PLR1_PKA1_SIA3_SS1_SU0_SUM1_SUS0_SPO0_SRVW0_SSO0_SVW2_SK0_SKXCCM0_TLDS0_ULSGRO0_USL1_UIOFGRO0_USFGROn1_VSn1_VWA2_VWB2_WSGRA0_WSGRB0_WS64_WG16_4_4_WGM1_WGMXCC4_WGMXCCGn1
    SolutionIndex: 98
    SolutionNameMin: Cijk_Ailk_Bjlk_I8II_BH_UserArgs_MT32x64x256_MI16x16x1_SN_LDSB0_AFC0_AFEM1_AFEM1_ASEM1_CLR1_CADS0_DTVA0_DTVB0_EPS0_FDSI0_GRPM1_GRVWA16_GRVWB16_GSUn1_GSUAMBSK_GSUC1_GSUWGMRR1_GLS0_ISA942_IU1_K1_LBSPPA256_LBSPPB512_LBSPPM0_LPA32_LPB64_LPM0_LRVW8_LWPMn1_MIAV0_MIWT2_4_MO40_NTn1_NTA0_NTB0_NTC0_NTD4_NTM0_NEPBS8_NLCA1_NLCB1_ONLL1_PGR2_PLR1_PKA1_SIA3_SS1_SU0_SUM1_SUS0_SPO0_SRVW0_SSO0_SVW2_SK0_SKXCCM0_TLDS0_ULSGRO0_USL1_UIOFGRO0_USFGROn1_VSn1_VWA2_VWB4_WSGRA0_WSGRB0_WS64_WG16_4_4_WGM1_WGMXCC4_WGMXCCGn1
    SolutionIndex: 99
    SolutionNameMin: Cijk_Ailk_Bjlk_I8II_BH_UserArgs_MT32x64x256_MI16x16x1_SN_LDSB0_AFC0_AFEM1_AFEM1_ASEM1_CLR1_CADS0_DTVA0_DTVB0_EPS0_FDSI0_GRPM1_GRVWA16_GRVWB16_GSUn1_GSUAMBSK_GSUC1_GSUWGMRR1_GLS0_ISA942_IU1_K1_LBSPPA256_LBSPPB512_LBSPPM0_LPA32_LPB32_LPM0_LRVW8_LWPMn1_MIAV0_MIWT2_2_MO40_NTn1_NTA0_NTB0_NTC0_NTD4_NTM0_NEPBS8_NLCA1_NLCB1_ONLL1_PGR2_PLR1_PKA1_SIA3_SS1_SU0_SUM1_SUS0_SPO0_SRVW0_SSO0_SVW2_SK0_SKXCCM0_TLDS0_ULSGRO0_USL1_UIOFGRO0_USFGROn1_VSn1_VWA2_VWB2_WSGRA0_WSGRB0_WS64_WG16_8_2_WGM1_WGMXCC4_WGMXCCGn1
    SolutionIndex: 100
    SolutionNameMin: Cijk_Ailk_Bjlk_I8II_BH_UserArgs_MT32x64x128_MI16x16x1_SN_LDSB0_AFC0_AFEM1_AFEM1_ASEM1_CLR1_CADS0_DTVA0_DTVB0_EPS0_FDSI0_GRPM1_GRVWA16_GRVWB16_GSUn1_GSUAMBSK_GSUC1_GSUWGMRR1_GLS0_ISA942_IU1_K1_LBSPPA256_LBSPPB512_LBSPPM0_LPA32_LPB16_LPM0_LRVW8_LWPMn1_MIAV0_MIWT2_1_MO40_NTn1_NTA0_NTB0_NTC0_NTD4_NTM0_NEPBS8_NLCA1_NLCB1_ONLL1_PGR2_PLR1_PKA1_SIA3_SS1_SU0_SUM1_SUS0_SPO0_SRVW0_SSO0_SVW2_SK0_SKXCCM0_TLDS0_ULSGRO0_USL1_UIOFGRO0_USFGROn1_VSn1_VWA2_VWB1_WSGRA0_WSGRB0_WS64_WG16_16_1_WGM1_WGMXCC4_WGMXCCGn1
    SolutionIndex: 101
    SolutionNameMin: Cijk_Ailk_Bjlk_I8II_BH_UserArgs_MT32x64x256_MI16x16x1_SN_LDSB0_AFC0_AFEM1_AFEM1_ASEM1_CLR1_CADS0_DTVA0_DTVB0_EPS0_FDSI0_GRPM1_GRVWA16_GRVWB16_GSUn1_GSUAMBSK_GSUC1_GSUWGMRR1_GLS0_ISA942_IU1_K1_LBSPPA256_LBSPPB512_LBSPPM0_LPA32_LPB16_LPM0_LRVW8_LWPMn1_MIAV0_MIWT2_1_MO40_NTn1_NTA0_NTB0_NTC0_NTD4_NTM0_NEPBS8_NLCA1_NLCB1_ONLL1_PGR2_PLR1_PKA1_SIA3_SS1_SU0_SUM1_SUS0_SPO0_SRVW0_SSO0_SVW2_SK0_SKXCCM0_TLDS0_ULSGRO0_USL1_UIOFGRO0_USFGROn1_VSn1_VWA2_VWB1_WSGRA0_WSGRB0_WS64_WG16_16_1_WGM1_WGMXCC4_WGMXCCGn1
    SolutionIndex: 102
    SolutionNameMin: Cijk_Ailk_Bjlk_I8II_BH_UserArgs_MT64x64x128_MI16x16x1_SN_LDSB1_AFC0_AFEM1_AFEM1_ASEM1_CLR1_CADS0_DTVA0_DTVB0_EPS0_FDSI0_GRPM1_GRVWA16_GRVWB16_GSUn1_GSUAMBSK_GSUC1_GSUWGMRR1_GLS0_ISA942_IU1_K1_LBSPPA512_LBSPPB512_LBSPPM0_LPA32_LPB32_LPM0_LRVW8_LWPMn1_MIAV0_MIWT2_2_MO40_NTn1_NTA0_NTB0_NTC0_NTD4_NTM0_NEPBS8_NLCA1_NLCB1_ONLL1_PGR2_PLR1_PKA1_SIA3_SS1_SU0_SUM1_SUS0_SPO0_SRVW0_SSO0_SVW2_SK0_SKXCCM0_TLDS0_ULSGRO0_USL1_UIOFGRO0_USFGROn1_VSn1_VWA2_VWB2_WSGRA0_WSGRB0_WS64_WG32_8_1_WGM1_WGMXCC4_WGMXCCGn1
    SolutionIndex: 103
    SolutionNameMin: Cijk_Ailk_Bjlk_I8II_BH_UserArgs_MT64x64x128_MI16x16x1_SN_LDSB0_AFC0_AFEM1_AFEM1_ASEM1_CLR1_CADS0_DTVA0_DTVB0_EPS0_FDSI0_GRPM1_GRVWA16_GRVWB16_GSUn1_GSUAMBSK_GSUC1_GSUWGMRR1_GLS0_ISA942_IU1_K1_LBSPPA512_LBSPPB512_LBSPPM0_LPA64_LPB32_LPM0_LRVW8_LWPMn1_MIAV0_MIWT4_2_MO40_NTn1_NTA0_NTB0_NTC0_NTD4_NTM0_NEPBS8_NLCA1_NLCB1_ONLL1_PGR2_PLR1_PKA1_SIA3_SS1_SU0_SUM1_SUS0_SPO0_SRVW0_SSO0_SVW4_SK0_SKXCCM0_TLDS0_ULSGRO0_USL1_UIOFGRO0_USFGROn1_VSn1_VWA4_VWB2_WSGRA0_WSGRB0_WS64_WG16_8_2_WGM1_WGMXCC4_WGMXCCGn1
    SolutionIndex: 104
    SolutionNameMin: Cijk_Ailk_Bjlk_I8II_BH_UserArgs_MT64x64x256_MI16x16x1_SN_LDSB1_AFC0_AFEM1_AFEM1_ASEM1_CLR1_CADS0_DTVA0_DTVB0_EPS0_FDSI0_GRPM1_GRVWA16_GRVWB16_GSUn1_GSUAMBSK_GSUC1_GSUWGMRR1_GLS0_ISA942_IU1_K1_LBSPPA512_LBSPPB512_LBSPPM0_LPA64_LPB32_LPM0_LRVW8_LWPMn1_MIAV0_MIWT4_2_MO40_NTn1_NTA0_NTB0_NTC0_NTD4_NTM0_NEPBS8_NLCA1_NLCB1_ONLL1_PGR2_PLR1_PKA1_SIA3_SS1_SU0_SUM1_SUS0_SPO0_SRVW0_SSO0_SVW4_SK0_SKXCCM0_TLDS0_ULSGRO0_USL1_UIOFGRO0_USFGROn1_VSn1_VWA4_VWB2_WSGRA0_WSGRB0_WS64_WG16_8_2_WGM1_WGMXCC4_WGMXCCGn1
    SolutionIndex: 105
    SolutionNameMin: Cijk_Ailk_Bjlk_I8II_BH_UserArgs_MT128x64x128_MI16x16x1_SN_LDSB0_AFC0_AFEM1_AFEM1_ASEM1_CLR1_CADS0_DTVA0_DTVB0_EPS0_FDSI0_GRPM1_GRVWA16_GRVWB16_GSUn1_GSUAMBSK_GSUC1_GSUWGMRR1_GLS0_ISA942_IU1_K1_LBSPPA1024_LBSPPB512_LBSPPM0_LPA32_LPB64_LPM0_LRVW8_LWPMn1_MIAV0_MIWT2_4_MO40_NTn1_NTA0_NTB0_NTC0_NTD4_NTM0_NEPBS8_NLCA1_NLCB1_ONLL1_PGR2_PLR1_PKA1_SIA3_SS1_SU0_SUM1_SUS0_SPO0_SRVW0_SSO0_SVW2_SK0_SKXCCM0_TLDS0_ULSGRO0_USL1_UIOFGRO0_USFGROn1_VSn1_VWA2_VWB4_WSGRA0_WSGRB0_WS64_WG64_4_1_WGM1_WGMXCC4_WGMXCCGn1
    SolutionIndex: 106
    SolutionNameMin: Cijk_Ailk_Bjlk_I8II_BH_UserArgs_MT64x64x256_MI16x16x1_SN_LDSB1_AFC0_AFEM1_AFEM1_ASEM1_CLR1_CADS0_DTVA0_DTVB0_EPS0_FDSI0_GRPM1_GRVWA16_GRVWB16_GSUn1_GSUAMBSK_GSUC1_GSUWGMRR1_GLS0_ISA942_IU1_K1_LBSPPA512_LBSPPB512_LBSPPM0_LPA32_LPB32_LPM0_LRVW8_LWPMn1_MIAV0_MIWT2_2_MO40_NTn1_NTA0_NTB0_NTC0_NTD4_NTM0_NEPBS8_NLCA1_NLCB1_ONLL1_PGR2_PLR1_PKA1_SIA3_SS1_SU0_SUM1_SUS0_SPO0_SRVW0_SSO0_SVW2_SK0_SKXCCM0_TLDS0_ULSGRO0_USL1_UIOFGRO0_USFGROn1_VSn1_VWA2_VWB2_WSGRA0_WSGRB0_WS64_WG32_8_1_WGM1_WGMXCC4_WGMXCCGn1
    SolutionIndex: 107
    SolutionNameMin: Cijk_Ailk_Bjlk_I8II_BH_UserArgs_MT64x64x128_MI16x16x1_SN_LDSB1_AFC0_AFEM1_AFEM1_ASEM1_CLR1_CADS0_DTVA0_DTVB0_EPS0_FDSI0_GRPM1_GRVWA16_GRVWB16_GSUn1_GSUAMBSK_GSUC1_GSUWGMRR1_GLS0_ISA942_IU1_K1_LBSPPA512_LBSPPB512_LBSPPM0_LPA64_LPB16_LPM0_LRVW8_LWPMn1_MIAV0_MIWT4_1_MO40_NTn1_NTA0_NTB0_NTC0_NTD4_NTM0_NEPBS8_NLCA1_NLCB1_ONLL1_PGR2_PLR1_PKA1_SIA3_SS1_SU0_SUM1_SUS0_SPO0_SRVW0_SSO0_SVW4_SK0_SKXCCM0_TLDS0_ULSGRO0_USL1_UIOFGRO0_USFGROn1_VSn1_VWA4_VWB1_WSGRA0_WSGRB0_WS64_WG16_16_1_WGM1_WGMXCC4_WGMXCCGn1
    SolutionIndex: 108
    SolutionNameMin: Cijk_Ailk_Bjlk_I8II_BH_UserArgs_MT128x64x128_MI16x16x1_SN_LDSB1_AFC0_AFEM1_AFEM1_ASEM1_CLR1_CADS0_DTVA0_DTVB0_EPS0_FDSI0_GRPM1_GRVWA16_GRVWB16_GSUn1_GSUAMBSK_GSUC1_GSUWGMRR1_GLS0_ISA942_IU1_K1_LBSPPA1024_LBSPPB512_LBSPPM0_LPA32_LPB64_LPM0_LRVW8_LWPMn1_MIAV0_MIWT2_4_MO40_NTn1_NTA0_NTB0_NTC0_NTD4_NTM0_NEPBS8_NLCA1_NLCB1_ONLL1_PGR2_PLR1_PKA1_SIA3_SS1_SU0_SUM1_SUS0_SPO0_SRVW0_SSO0_SVW2_SK0_SKXCCM0_TLDS0_ULSGRO0_USL1_UIOFGRO0_USFGROn1_VSn1_VWA2_VWB4_WSGRA0_WSGRB0_WS64_WG64_4_1_WGM1_WGMXCC4_WGMXCCGn1
    SolutionIndex: 109
    SolutionNameMin: Cijk_Ailk_Bjlk_I8II_BH_UserArgs_MT128x64x128_MI16x16x1_SN_LDSB1_AFC0_AFEM1_AFEM1_ASEM1_CLR1_CADS0_DTVA0_DTVB0_EPS0_FDSI0_GRPM1_GRVWA16_GRVWB16_GSUn1_GSUAMBSK_GSUC1_GSUWGMRR1_GLS0_ISA942_IU1_K1_LBSPPA1024_LBSPPB512_LBSPPM0_LPA64_LPB64_LPM0_LRVW8_LWPMn1_MIAV0_MIWT4_4_MO40_NTn1_NTA0_NTB0_NTC0_NTD4_NTM0_NEPBS8_NLCA1_NLCB1_ONLL1_PGR2_PLR1_PKA1_SIA3_SS1_SU0_SUM1_SUS0_SPO0_SRVW0_SSO0_SVW4_SK0_SKXCCM0_TLDS0_ULSGRO0_USL1_UIOFGRO0_USFGROn1_VSn1_VWA4_VWB4_WSGRA0_WSGRB0_WS64_WG32_4_2_WGM1_WGMXCC4_WGMXCCGn1
    SolutionIndex: 110
    SolutionNameMin: Cijk_Ailk_Bjlk_I8II_BH_UserArgs_MT128x64x128_MI16x16x1_SN_LDSB1_AFC0_AFEM1_AFEM1_ASEM1_CLR1_CADS0_DTVA0_DTVB0_EPS0_FDSI0_GRPM1_GRVWA16_GRVWB16_GSUn1_GSUAMBSK_GSUC1_GSUWGMRR1_GLS0_ISA942_IU1_K1_LBSPPA1024_LBSPPB512_LBSPPM0_LPA64_LPB32_LPM0_LRVW8_LWPMn1_MIAV0_MIWT4_2_MO40_NTn1_NTA0_NTB0_NTC0_NTD4_NTM0_NEPBS8_NLCA1_NLCB1_ONLL1_PGR2_PLR1_PKA1_SIA3_SS1_SU0_SUM1_SUS0_SPO0_SRVW0_SSO0_SVW4_SK0_SKXCCM0_TLDS0_ULSGRO0_USL1_UIOFGRO0_USFGROn1_VSn1_VWA4_VWB2_WSGRA0_WSGRB0_WS64_WG32_8_1_WGM1_WGMXCC4_WGMXCCGn1
    SolutionIndex: 111
    SolutionNameMin: Cijk_Ailk_Bjlk_I8II_BH_UserArgs_MT96x64x128_MI16x16x1_SN_LDSB1_AFC0_AFEM1_AFEM1_ASEM1_CLR1_CADS0_DTVA0_DTVB0_EPS0_FDSI0_GRPM1_GRVWA16_GRVWB16_GSUn1_GSUAMBSK_GSUC1_GSUWGMRR1_GLS0_ISA942_IU1_K1_LBSPPA768_LBSPPB512_LBSPPM0_LPA16_LPB32_LPM0_LRVW8_LWPMn1_MIAV0_MIWT3_2_MO40_NTn1_NTA0_NTB0_NTC0_NTD4_NTM0_NEPBS6_NLCA1_NLCB1_ONLL1_PGR2_PLR1_PKA1_SIA3_SS1_SU0_SUM1_SUS0_SPO0_SRVW0_SSO0_SVW1_SK0_SKXCCM0_TLDS0_ULSGRO0_USL1_UIOFGRO0_USFGROn1_VSn1_VWA1_VWB2_WSGRA0_WSGRB0_WS64_WG32_8_1_WGM1_WGMXCC4_WGMXCCGn1
    SolutionIndex: 112
    SolutionNameMin: Cijk_Ailk_Bjlk_I8II_BH_UserArgs_MT32x32x256_MI16x16x1_SN_LDSB1_AFC0_AFEM1_AFEM1_ASEM1_CLR1_CADS0_DTVA0_DTVB0_EPS0_FDSI0_GRPM1_GRVWA16_GRVWB16_GSUn1_GSUAMBSK_GSUC1_GSUWGMRR1_GLS0_ISA942_IU1_K1_LBSPPA256_LBSPPB256_LBSPPM0_LPA32_LPB16_LPM0_LRVW8_LWPMn1_MIAV0_MIWT2_1_MO40_NTn1_NTA0_NTB0_NTC0_NTD4_NTM0_NEPBS8_NLCA1_NLCB1_ONLL1_PGR2_PLR1_PKA1_SIA3_SS1_SU0_SUM1_SUS0_SPO0_SRVW0_SSO0_SVW2_SK0_SKXCCM0_TLDS0_ULSGRO0_USL1_UIOFGRO0_USFGROn1_VSn1_VWA2_VWB1_WSGRA0_WSGRB0_WS64_WG16_8_2_WGM1_WGMXCC4_WGMXCCGn1
    SolutionIndex: 113
    SolutionNameMin: Cijk_Ailk_Bjlk_I8II_BH_UserArgs_MT128x64x128_MI16x16x1_SN_LDSB1_AFC0_AFEM1_AFEM1_ASEM1_CLR1_CADS0_DTVA0_DTVB0_EPS0_FDSI0_GRPM1_GRVWA16_GRVWB16_GSUn1_GSUAMBSK_GSUC1_GSUWGMRR1_GLS0_ISA942_IU1_K1_LBSPPA1024_LBSPPB512_LBSPPM0_LPA16_LPB64_LPM0_LRVW8_LWPMn1_MIAV0_MIWT2_4_MO40_NTn1_NTA0_NTB0_NTC0_NTD4_NTM0_NEPBS8_NLCA1_NLCB1_ONLL1_PGR2_PLR1_PKA1_SIA3_SS1_SU0_SUM1_SUS0_SPO0_SRVW0_SSO0_SVW2_SK0_SKXCCM0_TLDS0_ULSGRO0_USL1_UIOFGRO0_USFGROn1_VSn1_VWA2_VWB4_WSGRA0_WSGRB0_WS64_WG64_4_1_WGM1_WGMXCC4_WGMXCCGn1
    SolutionIndex: 114
    SolutionNameMin: Cijk_Ailk_Bjlk_I8II_BH_UserArgs_MT64x64x128_MI16x16x1_SN_LDSB1_AFC0_AFEM1_AFEM1_ASEM1_CLR1_CADS0_DTVA0_DTVB0_EPS0_FDSI0_GRPM1_GRVWA16_GRVWB16_GSUn1_GSUAMBSK_GSUC1_GSUWGMRR1_GLS0_ISA942_IU1_K1_LBSPPA512_LBSPPB512_LBSPPM0_LPA32_LPB64_LPM0_LRVW8_LWPMn1_MIAV0_MIWT2_4_MO40_NTn1_NTA0_NTB0_NTC0_NTD4_NTM0_NEPBS8_NLCA1_NLCB1_ONLL1_PGR2_PLR1_PKA1_SIA3_SS1_SU0_SUM1_SUS0_SPO0_SRVW0_SSO0_SVW2_SK0_SKXCCM0_TLDS0_ULSGRO0_USL1_UIOFGRO0_USFGROn1_VSn1_VWA2_VWB4_WSGRA0_WSGRB0_WS64_WG32_4_2_WGM1_WGMXCC4_WGMXCCGn1
    SolutionIndex: 115
    SolutionNameMin: Cijk_Ailk_Bjlk_I8II_BH_UserArgs_MT512x64x64_MI32x32x1_SN_LDSB1_AFC0_AFEM1_AFEM1_ASEM1_CLR1_CADS0_DTVA0_DTVB0_EPS0_FDSI0_GRPM1_GRVWA16_GRVWB16_GSUn1_GSUAMBSK_GSUC1_GSUWGMRR1_GLS0_ISA942_IU1_K1_LBSPPA0_LBSPPB0_LBSPPM0_LPA0_LPB0_LPM0_LRVW8_LWPMn1_MIAV0_MIWT4_2_MO40_NTn1_NTA0_NTB0_NTC0_NTD4_NTM0_NEPBS8_NLCA1_NLCB1_ONLL1_PGR2_PLR1_PKA1_SIA3_SS1_SU0_SUM1_SUS0_SPO0_SRVW0_SSO0_SVW4_SK0_SKXCCM0_TLDS0_ULSGRO0_USL1_UIOFGRO0_USFGROn1_VSn1_VWA4_VWB2_WSGRA0_WSGRB0_WS64_WG128_2_1_WGM1_WGMXCC4_WGMXCCGn1
    SolutionIndex: 116
    SolutionNameMin: Cijk_Ailk_Bjlk_I8II_BH_UserArgs_MT64x32x128_MI16x16x1_SN_LDSB1_AFC0_AFEM1_AFEM1_ASEM1_CLR1_CADS0_DTVA0_DTVB0_EPS0_FDSI0_GRPM1_GRVWA16_GRVWB16_GSUn1_GSUAMBSK_GSUC1_GSUWGMRR1_GLS0_ISA942_IU1_K1_LBSPPA512_LBSPPB256_LBSPPM0_LPA32_LPB32_LPM0_LRVW8_LWPMn1_MIAV0_MIWT2_2_MO40_NTn1_NTA0_NTB0_NTC0_NTD4_NTM0_NEPBS8_NLCA1_NLCB1_ONLL1_PGR2_PLR1_PKA1_SIA3_SS1_SU0_SUM1_SUS0_SPO0_SRVW0_SSO0_SVW2_SK0_SKXCCM0_TLDS0_ULSGRO0_USL1_UIOFGRO0_USFGROn1_VSn1_VWA2_VWB2_WSGRA0_WSGRB0_WS64_WG32_4_2_WGM1_WGMXCC4_WGMXCCGn1
    SolutionIndex: 117
    SolutionNameMin: Cijk_Ailk_Bjlk_I8II_BH_UserArgs_MT192x64x128_MI16x16x1_SN_LDSB1_AFC0_AFEM1_AFEM1_ASEM1_CLR1_CADS0_DTVA0_DTVB0_EPS0_FDSI0_GRPM1_GRVWA16_GRVWB16_GSUn1_GSUAMBSK_GSUC1_GSUWGMRR1_GLS0_ISA942_IU1_K1_LBSPPA1536_LBSPPB512_LBSPPM0_LPA16_LPB64_LPM0_LRVW8_LWPMn1_MIAV0_MIWT3_4_MO40_NTn1_NTA0_NTB0_NTC0_NTD4_NTM0_NEPBS6_NLCA1_NLCB1_ONLL1_PGR2_PLR1_PKA1_SIA3_SS1_SU0_SUM1_SUS0_SPO0_SRVW0_SSO0_SVW1_SK0_SKXCCM0_TLDS0_ULSGRO0_USL1_UIOFGRO0_USFGROn1_VSn1_VWA1_VWB4_WSGRA0_WSGRB0_WS64_WG64_4_1_WGM1_WGMXCC4_WGMXCCGn1
    SolutionIndex: 118
    SolutionNameMin: Cijk_Ailk_Bjlk_I8II_BH_UserArgs_MT512x64x64_MI16x16x1_SN_LDSB1_AFC0_AFEM1_AFEM1_ASEM1_CLR1_CADS0_DTVA0_DTVB0_EPS0_FDSI0_GRPM1_GRVWA16_GRVWB16_GSUn1_GSUAMBSK_GSUC1_GSUWGMRR1_GLS0_ISA942_IU1_K1_LBSPPA4096_LBSPPB512_LBSPPM0_LPA64_LPB64_LPM0_LRVW8_LWPMn1_MIAV0_MIWT8_4_MO40_NTn1_NTA0_NTB0_NTC0_NTD4_NTM0_NEPBS8_NLCA1_NLCB1_ONLL1_PGR2_PLR1_PKA1_SIA3_SS1_SU0_SUM1_SUS0_SPO0_SRVW0_SSO0_SVW8_SK0_SKXCCM0_TLDS0_ULSGRO0_USL1_UIOFGRO0_USFGROn1_VSn1_VWA8_VWB4_WSGRA0_WSGRB0_WS64_WG64_4_1_WGM1_WGMXCC4_WGMXCCGn1
    SolutionIndex: 119
    SolutionNameMin: Cijk_Ailk_Bjlk_I8II_BH_UserArgs_MT256x64x64_MI16x16x1_SN_LDSB1_AFC0_AFEM1_AFEM1_ASEM1_CLR1_CADS0_DTVA0_DTVB0_EPS0_FDSI0_GRPM1_GRVWA16_GRVWB16_GSUn1_GSUAMBSK_GSUC1_GSUWGMRR1_GLS0_ISA942_IU1_K1_LBSPPA2048_LBSPPB512_LBSPPM0_LPA64_LPB64_LPM0_LRVW8_LWPMn1_MIAV0_MIWT4_4_MO40_NTn1_NTA0_NTB0_NTC0_NTD4_NTM0_NEPBS8_NLCA1_NLCB1_ONLL1_PGR2_PLR1_PKA1_SIA3_SS1_SU0_SUM1_SUS0_SPO0_SRVW0_SSO0_SVW4_SK0_SKXCCM0_TLDS0_ULSGRO0_USL1_UIOFGRO0_USFGROn1_VSn1_VWA4_VWB4_WSGRA0_WSGRB0_WS64_WG64_4_1_WGM1_WGMXCC4_WGMXCCGn1
    SolutionIndex: 120
    SolutionNameMin: Cijk_Ailk_Bjlk_I8II_BH_UserArgs_MT256x64x128_MI16x16x1_SN_LDSB1_AFC0_AFEM1_AFEM1_ASEM1_CLR1_CADS0_DTVA0_DTVB0_EPS0_FDSI0_GRPM1_GRVWA16_GRVWB16_GSUn1_GSUAMBSK_GSUC1_GSUWGMRR1_GLS0_ISA942_IU1_K1_LBSPPA2048_LBSPPB512_LBSPPM0_LPA64_LPB64_LPM0_LRVW8_LWPMn1_MIAV0_MIWT4_4_MO40_NTn1_NTA0_NTB0_NTC0_NTD4_NTM0_NEPBS8_NLCA1_NLCB1_ONLL1_PGR2_PLR1_PKA1_SIA3_SS1_SU0_SUM1_SUS0_SPO0_SRVW0_SSO0_SVW4_SK0_SKXCCM0_TLDS0_ULSGRO0_USL1_UIOFGRO0_USFGROn1_VSn1_VWA4_VWB4_WSGRA0_WSGRB0_WS64_WG64_4_1_WGM1_WGMXCC4_WGMXCCGn1
    SolutionIndex: 121
    SolutionNameMin: Cijk_Ailk_Bjlk_I8II_BH_UserArgs_MT128x64x128_MI16x16x1_SN_LDSB1_AFC0_AFEM1_AFEM1_ASEM1_CLR1_CADS0_DTVA0_DTVB0_EPS0_FDSI0_GRPM1_GRVWA16_GRVWB16_GSUn1_GSUAMBSK_GSUC1_GSUWGMRR1_GLS0_ISA942_IU1_K1_LBSPPA1024_LBSPPB512_LBSPPM0_LPA32_LPB64_LPM0_LRVW8_LWPMn1_MIAV0_MIWT4_4_MO40_NTn1_NTA0_NTB0_NTC0_NTD4_NTM0_NEPBS8_NLCA1_NLCB1_ONLL1_PGR2_PLR1_PKA1_SIA3_SS1_SU0_SUM1_SUS0_SPO0_SRVW0_SSO0_SVW4_SK0_SKXCCM0_TLDS0_ULSGRO0_USL1_UIOFGRO0_USFGROn1_VSn1_VWA4_VWB4_WSGRA0_WSGRB0_WS64_WG32_4_2_WGM1_WGMXCC4_WGMXCCGn1
    SolutionIndex: 122
    SolutionNameMin: Cijk_Ailk_Bjlk_I8II_BH_UserArgs_MT64x64x256_MI16x16x1_SN_LDSB1_AFC0_AFEM1_AFEM1_ASEM1_CLR1_CADS0_DTVA0_DTVB0_EPS0_FDSI0_GRPM1_GRVWA16_GRVWB16_GSUn1_GSUAMBSK_GSUC1_GSUWGMRR1_GLS0_ISA942_IU1_K1_LBSPPA512_LBSPPB512_LBSPPM0_LPA64_LPB64_LPM0_LRVW8_LWPMn1_MIAV0_MIWT4_4_MO40_NTn1_NTA0_NTB0_NTC0_NTD4_NTM0_NEPBS8_NLCA1_NLCB1_ONLL1_PGR2_PLR1_PKA1_SIA3_SS1_SU0_SUM1_SUS0_SPO0_SRVW0_SSO0_SVW4_SK0_SKXCCM0_TLDS0_ULSGRO0_USL1_UIOFGRO0_USFGROn1_VSn1_VWA4_VWB4_WSGRA0_WSGRB0_WS64_WG16_4_4_WGM1_WGMXCC4_WGMXCCGn1
    SolutionIndex: 123
    SolutionNameMin: Cijk_Ailk_Bjlk_I8II_BH_UserArgs_MT384x64x64_MI16x16x1_SN_LDSB1_AFC0_AFEM1_AFEM1_ASEM1_CLR1_CADS0_DTVA0_DTVB0_EPS0_FDSI0_GRPM1_GRVWA16_GRVWB16_GSUn1_GSUAMBSK_GSUC1_GSUWGMRR1_GLS0_ISA942_IU1_K1_LBSPPA3072_LBSPPB512_LBSPPM0_LPA32_LPB32_LPM0_LRVW8_LWPMn1_MIAV0_MIWT6_4_MO40_NTn1_NTA0_NTB0_NTC0_NTD4_NTM0_NEPBS6_NLCA1_NLCB1_ONLL1_PGR2_PLR1_PKA1_SIA3_SS1_SU0_SUM1_SUS0_SPO0_SRVW0_SSO0_SVW2_SK0_SKXCCM0_TLDS0_ULSGRO0_USL1_UIOFGRO0_USFGROn1_VSn1_VWA2_VWB2_WSGRA0_WSGRB0_WS64_WG64_4_1_WGM1_WGMXCC4_WGMXCCGn1
    SolutionIndex: 124
    SolutionNameMin: Cijk_Ailk_Bjlk_I8II_BH_UserArgs_MT64x64x128_MI16x16x1_SN_LDSB1_AFC0_AFEM1_AFEM1_ASEM1_CLR1_CADS0_DTVA0_DTVB0_EPS0_FDSI0_GRPM1_GRVWA16_GRVWB16_GSUn1_GSUAMBSK_GSUC1_GSUWGMRR1_GLS0_ISA942_IU1_K1_LBSPPA512_LBSPPB512_LBSPPM0_LPA64_LPB32_LPM0_LRVW8_LWPMn1_MIAV0_MIWT4_2_MO40_NTn1_NTA0_NTB0_NTC0_NTD4_NTM0_NEPBS8_NLCA1_NLCB1_ONLL1_PGR2_PLR1_PKA1_SIA3_SS1_SU0_SUM1_SUS0_SPO0_SRVW0_SSO0_SVW4_SK0_SKXCCM0_TLDS0_ULSGRO0_USL1_UIOFGRO0_USFGROn1_VSn1_VWA4_VWB2_WSGRA0_WSGRB0_WS64_WG16_8_2_WGM1_WGMXCC4_WGMXCCGn1
    SolutionIndex: 125
    SolutionNameMin: Cijk_Ailk_Bjlk_I8II_BH_UserArgs_MT384x64x64_MI16x16x1_SN_LDSB1_AFC0_AFEM1_AFEM1_ASEM1_CLR1_CADS0_DTVA0_DTVB0_EPS0_FDSI0_GRPM1_GRVWA16_GRVWB16_GSUn1_GSUAMBSK_GSUC1_GSUWGMRR1_GLS0_ISA942_IU1_K1_LBSPPA3072_LBSPPB512_LBSPPM0_LPA32_LPB64_LPM0_LRVW8_LWPMn1_MIAV0_MIWT6_4_MO40_NTn1_NTA0_NTB0_NTC0_NTD4_NTM0_NEPBS6_NLCA1_NLCB1_ONLL1_PGR2_PLR1_PKA1_SIA3_SS1_SU0_SUM1_SUS0_SPO0_SRVW0_SSO0_SVW2_SK0_SKXCCM0_TLDS0_ULSGRO0_USL1_UIOFGRO0_USFGROn1_VSn1_VWA2_VWB4_WSGRA0_WSGRB0_WS64_WG64_4_1_WGM1_WGMXCC4_WGMXCCGn1
    SolutionIndex: 126
    SolutionNameMin: Cijk_Ailk_Bjlk_I8II_BH_UserArgs_MT192x64x64_MI16x16x1_SN_LDSB1_AFC0_AFEM1_AFEM1_ASEM1_CLR1_CADS0_DTVA0_DTVB0_EPS0_FDSI0_GRPM1_GRVWA16_GRVWB16_GSUn1_GSUAMBSK_GSUC1_GSUWGMRR1_GLS0_ISA942_IU1_K1_LBSPPA1536_LBSPPB512_LBSPPM0_LPA16_LPB64_LPM0_LRVW8_LWPMn1_MIAV0_MIWT3_4_MO40_NTn1_NTA0_NTB0_NTC0_NTD4_NTM0_NEPBS6_NLCA1_NLCB1_ONLL1_PGR2_PLR1_PKA1_SIA3_SS1_SU0_SUM1_SUS0_SPO0_SRVW0_SSO0_SVW1_SK0_SKXCCM0_TLDS0_ULSGRO0_USL1_UIOFGRO0_USFGROn1_VSn1_VWA1_VWB4_WSGRA0_WSGRB0_WS64_WG64_4_1_WGM1_WGMXCC4_WGMXCCGn1
    SolutionIndex: 127
    SolutionNameMin: Cijk_Ailk_Bjlk_I8II_BH_UserArgs_MT320x64x64_MI16x16x1_SN_LDSB1_AFC0_AFEM1_AFEM1_ASEM1_CLR1_CADS0_DTVA0_DTVB0_EPS0_FDSI0_GRPM1_GRVWA16_GRVWB16_GSUn1_GSUAMBSK_GSUC1_GSUWGMRR1_GLS0_ISA942_IU1_K1_LBSPPA2560_LBSPPB512_LBSPPM0_LPA16_LPB64_LPM0_LRVW8_LWPMn1_MIAV0_MIWT5_4_MO40_NTn1_NTA0_NTB0_NTC0_NTD4_NTM0_NEPBS5_NLCA1_NLCB1_ONLL1_PGR2_PLR1_PKA1_SIA3_SS1_SU0_SUM1_SUS0_SPO0_SRVW0_SSO0_SVW1_SK0_SKXCCM0_TLDS0_ULSGRO0_USL1_UIOFGRO0_USFGROn1_VSn1_VWA1_VWB4_WSGRA0_WSGRB0_WS64_WG64_4_1_WGM1_WGMXCC4_WGMXCCGn1
    SolutionIndex: 128
    SolutionNameMin: Cijk_Ailk_Bjlk_I8II_BH_UserArgs_MT256x64x64_MI16x16x1_SN_LDSB1_AFC0_AFEM1_AFEM1_ASEM1_CLR1_CADS0_DTVA0_DTVB0_EPS0_FDSI0_GRPM1_GRVWA16_GRVWB16_GSUn1_GSUAMBSK_GSUC1_GSUWGMRR1_GLS0_ISA942_IU1_K1_LBSPPA2048_LBSPPB512_LBSPPM0_LPA64_LPB64_LPM0_LRVW8_LWPMn1_MIAV0_MIWT4_4_MO40_NTn1_NTA0_NTB0_NTC0_NTD4_NTM0_NEPBS8_NLCA1_NLCB1_ONLL1_PGR2_PLR1_PKA1_SIA3_SS1_SU0_SUM1_SUS0_SPO0_SRVW0_SSO4_SVW4_SK0_SKXCCM0_TLDS0_ULSGRO0_USL1_UIOFGRO0_USFGROn1_VSn1_VWA4_VWB4_WSGRA0_WSGRB0_WS64_WG64_4_1_WGM1_WGMXCC4_WGMXCCGn1
    SolutionIndex: 129
    SolutionNameMin: Cijk_Ailk_Bjlk_I8II_BH_UserArgs_MT512x64x64_MI16x16x1_SN_LDSB1_AFC0_AFEM1_AFEM1_ASEM1_CLR1_CADS0_DTVA0_DTVB0_EPS0_FDSI0_GRPM1_GRVWA16_GRVWB16_GSUn1_GSUAMBSK_GSUC1_GSUWGMRR1_GLS0_ISA942_IU1_K1_LBSPPA4096_LBSPPB512_LBSPPM0_LPA64_LPB64_LPM0_LRVW8_LWPMn1_MIAV0_MIWT8_4_MO40_NTn1_NTA0_NTB0_NTC0_NTD4_NTM0_NEPBS8_NLCA1_NLCB1_ONLL1_PGR2_PLR1_PKA1_SIA3_SS1_SU0_SUM1_SUS0_SPO0_SRVW0_SSO4_SVW8_SK0_SKXCCM0_TLDS0_ULSGRO0_USL1_UIOFGRO0_USFGROn1_VSn1_VWA8_VWB4_WSGRA0_WSGRB0_WS64_WG64_4_1_WGM1_WGMXCC4_WGMXCCGn1
    SolutionIndex: 130
    SolutionNameMin: Cijk_Ailk_Bjlk_I8II_BH_UserArgs_MT16x32x128_MI16x16x1_SN_LDSB0_AFC0_AFEM1_AFEM1_ASEM1_CLR0_CADS0_DTVA0_DTVB0_EPS0_FDSI0_GRPM1_GRVWA1_GRVWB16_GSUn1_GSUAMBSK_GSUC1_GSUWGMRR1_GLS0_ISA942_IU1_K1_LBSPPA128_LBSPPB256_LBSPPM0_LPA16_LPB32_LPM0_LRVW8_LWPMn1_MIAV0_MIWT1_2_MO40_NTn1_NTA0_NTB0_NTC0_NTD4_NTM0_NEPBS8_NLCA1_NLCB1_ONLL1_PGR2_PLR0_PKA1_SIA3_SS1_SU0_SUM1_SUS0_SPO0_SRVW0_SSO0_SVW1_SK0_SKXCCM0_TLDS0_ULSGRO0_USL1_UIOFGRO0_USFGROn1_VSn1_VWA1_VWB2_WSGRA0_WSGRB0_WS64_WG16_4_4_WGM1_WGMXCC4_WGMXCCGn1
    SolutionIndex: 131
    SolutionNameMin: Cijk_Ailk_Bjlk_I8II_BH_UserArgs_MT16x32x128_MI16x16x1_SN_LDSB1_AFC0_AFEM1_AFEM1_ASEM1_CLR1_CADS0_DTVA0_DTVB0_EPS0_FDSI0_GRPM1_GRVWA1_GRVWB16_GSUn1_GSUAMBSK_GSUC1_GSUWGMRR1_GLS0_ISA942_IU1_K1_LBSPPA128_LBSPPB256_LBSPPM0_LPA16_LPB16_LPM0_LRVW8_LWPMn1_MIAV0_MIWT1_1_MO40_NTn1_NTA0_NTB0_NTC0_NTD4_NTM0_NEPBS8_NLCA1_NLCB1_ONLL1_PGR2_PLR1_PKA1_SIA3_SS1_SU0_SUM1_SUS0_SPO0_SRVW0_SSO0_SVW1_SK0_SKXCCM0_TLDS0_ULSGRO0_USL1_UIOFGRO0_USFGROn1_VSn1_VWA1_VWB1_WSGRA0_WSGRB0_WS64_WG16_8_1_WGM1_WGMXCC4_WGMXCCGn1
    SolutionIndex: 132
    SolutionNameMin: Cijk_Ailk_Bjlk_I8II_BH_UserArgs_MT16x32x256_MI16x16x1_SN_LDSB1_AFC0_AFEM1_AFEM1_ASEM1_CLR1_CADS0_DTVA0_DTVB0_EPS0_FDSI0_GRPM1_GRVWA1_GRVWB16_GSUn1_GSUAMBSK_GSUC1_GSUWGMRR1_GLS0_ISA942_IU1_K1_LBSPPA128_LBSPPB256_LBSPPM0_LPA16_LPB16_LPM0_LRVW8_LWPMn1_MIAV0_MIWT1_1_MO40_NTn1_NTA0_NTB0_NTC0_NTD4_NTM0_NEPBS8_NLCA1_NLCB1_ONLL1_PGR2_PLR1_PKA1_SIA3_SS1_SU0_SUM1_SUS0_SPO0_SRVW0_SSO0_SVW1_SK0_SKXCCM0_TLDS0_ULSGRO0_USL1_UIOFGRO0_USFGROn1_VSn1_VWA1_VWB1_WSGRA0_WSGRB0_WS64_WG16_8_1_WGM1_WGMXCC4_WGMXCCGn1
    SolutionIndex: 133
    SolutionNameMin: Cijk_Ailk_Bjlk_I8II_BH_UserArgs_MT16x32x256_MI16x16x1_SN_LDSB0_AFC0_AFEM1_AFEM1_ASEM1_CLR1_CADS0_DTVA0_DTVB0_EPS0_FDSI0_GRPM1_GRVWA16_GRVWB16_GSUn1_GSUAMBSK_GSUC1_GSUWGMRR1_GLS0_ISA942_IU1_K1_LBSPPA128_LBSPPB256_LBSPPM0_LPA16_LPB32_LPM0_LRVW8_LWPMn1_MIAV0_MIWT1_2_MO40_NTn1_NTA0_NTB0_NTC0_NTD4_NTM0_NEPBS8_NLCA1_NLCB1_ONLL1_PGR2_PLR1_PKA1_SIA3_SS1_SU0_SUM1_SUS0_SPO0_SRVW0_SSO0_SVW1_SK0_SKXCCM0_TLDS0_ULSGRO0_USL1_UIOFGRO0_USFGROn1_VSn1_VWA1_VWB2_WSGRA0_WSGRB0_WS64_WG16_4_4_WGM1_WGMXCC4_WGMXCCGn1
    SolutionIndex: 134
    SolutionNameMin: Cijk_Ailk_Bjlk_I8II_BH_UserArgs_MT64x16x256_MI16x16x1_SN_LDSB0_AFC0_AFEM1_AFEM1_ASEM1_CLR1_CADS0_DTVA0_DTVB0_EPS0_FDSI0_GRPM1_GRVWA16_GRVWB16_GSUn1_GSUAMBSK_GSUC1_GSUWGMRR1_GLS0_ISA942_IU1_K1_LBSPPA512_LBSPPB128_LBSPPM0_LPA16_LPB16_LPM0_LRVW8_LWPMn1_MIAV0_MIWT1_1_MO40_NTn1_NTA0_NTB0_NTC0_NTD4_NTM0_NEPBS8_NLCA1_NLCB1_ONLL1_PGR2_PLR1_PKA1_SIA3_SS1_SU0_SUM1_SUS0_SPO0_SRVW0_SSO0_SVW1_SK0_SKXCCM0_TLDS0_ULSGRO0_USL1_UIOFGRO0_USFGROn1_VSn1_VWA1_VWB1_WSGRA0_WSGRB0_WS64_WG64_4_1_WGM1_WGMXCC4_WGMXCCGn1
    SolutionIndex: 135
    SolutionNameMin: Cijk_Ailk_Bjlk_I8II_BH_UserArgs_MT64x16x256_MI16x16x1_SN_LDSB0_AFC0_AFEM1_AFEM1_ASEM1_CLR1_CADS0_DTVA0_DTVB0_EPS0_FDSI0_GRPM1_GRVWA16_GRVWB16_GSUn1_GSUAMBSK_GSUC1_GSUWGMRR1_GLS0_ISA942_IU1_K1_LBSPPA512_LBSPPB128_LBSPPM0_LPA64_LPB16_LPM0_LRVW8_LWPMn1_MIAV0_MIWT4_1_MO40_NTn1_NTA0_NTB0_NTC0_NTD4_NTM0_NEPBS8_NLCA1_NLCB1_ONLL1_PGR2_PLR1_PKA1_SIA3_SS1_SU0_SUM1_SUS0_SPO0_SRVW0_SSO0_SVW4_SK0_SKXCCM0_TLDS0_ULSGRO0_USL1_UIOFGRO0_USFGROn1_VSn1_VWA4_VWB1_WSGRA0_WSGRB0_WS64_WG16_4_4_WGM1_WGMXCC4_WGMXCCGn1
    SolutionIndex: 136
    SolutionNameMin: Cijk_Ailk_Bjlk_I8II_BH_UserArgs_MT128x32x128_MI16x16x1_SN_LDSB0_AFC0_AFEM1_AFEM1_ASEM1_CLR1_CADS0_DTVA0_DTVB0_EPS0_FDSI0_GRPM1_GRVWA16_GRVWB16_GSUn1_GSUAMBSK_GSUC1_GSUWGMRR1_GLS0_ISA942_IU1_K1_LBSPPA1024_LBSPPB256_LBSPPM0_LPA32_LPB32_LPM0_LRVW8_LWPMn1_MIAV0_MIWT2_2_MO40_NTn1_NTA0_NTB0_NTC0_NTD4_NTM0_NEPBS8_NLCA1_NLCB1_ONLL1_PGR2_PLR1_PKA1_SIA3_SS1_SU0_SUM1_SUS0_SPO0_SRVW0_SSO0_SVW2_SK0_SKXCCM0_TLDS0_ULSGRO0_USL1_UIOFGRO0_USFGROn1_VSn1_VWA2_VWB2_WSGRA0_WSGRB0_WS64_WG64_4_1_WGM1_WGMXCC4_WGMXCCGn1
    SolutionIndex: 137
    SolutionNameMin: Cijk_Ailk_Bjlk_I8II_BH_UserArgs_MT64x32x512_MI16x16x1_SN_LDSB1_AFC0_AFEM1_AFEM1_ASEM1_CLR1_CADS0_DTVA0_DTVB0_EPS0_FDSI0_GRPM1_GRVWA16_GRVWB16_GSUn1_GSUAMBSK_GSUC1_GSUWGMRR1_GLS0_ISA942_IU1_K1_LBSPPA512_LBSPPB256_LBSPPM0_LPA32_LPB32_LPM0_LRVW8_LWPMn1_MIAV0_MIWT2_2_MO40_NTn1_NTA0_NTB0_NTC0_NTD4_NTM0_NEPBS8_NLCA1_NLCB1_ONLL1_PGR2_PLR1_PKA1_SIA3_SS1_SU0_SUM1_SUS0_SPO0_SRVW0_SSO0_SVW2_SK0_SKXCCM0_TLDS0_ULSGRO0_USL1_UIOFGRO0_USFGROn1_VSn1_VWA2_VWB2_WSGRA0_WSGRB0_WS64_WG32_4_2_WGM1_WGMXCC4_WGMXCCGn1
    SolutionIndex: 138
    SolutionNameMin: Cijk_Ailk_Bjlk_I8II_BH_UserArgs_MT128x64x128_MI32x32x1_SN_LDSB1_AFC0_AFEM1_AFEM1_ASEM1_CLR1_CADS0_DTVA0_DTVB0_EPS0_FDSI0_GRPM1_GRVWA16_GRVWB16_GSUn1_GSUAMBSK_GSUC1_GSUWGMRR1_GLS0_ISA942_IU1_K1_LBSPPA0_LBSPPB0_LBSPPM0_LPA0_LPB0_LPM0_LRVW8_LWPMn1_MIAV0_MIWT2_1_MO40_NTn1_NTA0_NTB0_NTC0_NTD4_NTM0_NEPBS8_NLCA1_NLCB1_ONLL1_PGR2_PLR1_PKA1_SIA3_SS1_SU0_SUM1_SUS0_SPO0_SRVW0_SSO0_SVW2_SK0_SKXCCM0_TLDS0_ULSGRO0_USL1_UIOFGRO0_USFGROn1_VSn1_VWA2_VWB1_WSGRA0_WSGRB0_WS64_WG64_4_1_WGM1_WGMXCC4_WGMXCCGn1
    SolutionIndex: 139
    SolutionNameMin: Cijk_Ailk_Bjlk_I8II_BH_UserArgs_MT128x64x256_MI16x16x1_SN_LDSB1_AFC0_AFEM1_AFEM1_ASEM1_CLR1_CADS0_DTVA0_DTVB0_EPS0_FDSI0_GRPM1_GRVWA16_GRVWB16_GSUn1_GSUAMBSK_GSUC1_GSUWGMRR1_GLS0_ISA942_IU1_K1_LBSPPA1024_LBSPPB512_LBSPPM0_LPA64_LPB64_LPM0_LRVW8_LWPMn1_MIAV0_MIWT4_4_MO40_NTn1_NTA0_NTB0_NTC0_NTD4_NTM0_NEPBS8_NLCA1_NLCB1_ONLL1_PGR2_PLR1_PKA1_SIA3_SS1_SU0_SUM1_SUS0_SPO0_SRVW0_SSO0_SVW4_SK0_SKXCCM0_TLDS0_ULSGRO0_USL1_UIOFGRO0_USFGROn1_VSn1_VWA4_VWB4_WSGRA0_WSGRB0_WS64_WG32_4_2_WGM1_WGMXCC4_WGMXCCGn1
    SolutionIndex: 140
    SolutionNameMin: Cijk_Ailk_Bjlk_I8II_BH_UserArgs_MT128x32x256_MI16x16x1_SN_LDSB1_AFC0_AFEM1_AFEM1_ASEM1_CLR1_CADS0_DTVA0_DTVB0_EPS0_FDSI0_GRPM1_GRVWA16_GRVWB16_GSUn1_GSUAMBSK_GSUC1_GSUWGMRR1_GLS0_ISA942_IU1_K1_LBSPPA1024_LBSPPB256_LBSPPM0_LPA64_LPB32_LPM0_LRVW8_LWPMn1_MIAV0_MIWT4_2_MO40_NTn1_NTA0_NTB0_NTC0_NTD4_NTM0_NEPBS8_NLCA1_NLCB1_ONLL1_PGR2_PLR1_PKA1_SIA3_SS1_SU0_SUM1_SUS0_SPO0_SRVW0_SSO0_SVW4_SK0_SKXCCM0_TLDS0_ULSGRO0_USL1_UIOFGRO0_USFGROn1_VSn1_VWA4_VWB2_WSGRA0_WSGRB0_WS64_WG32_4_2_WGM1_WGMXCC4_WGMXCCGn1
    SolutionIndex: 141
    SolutionNameMin: Cijk_Ailk_Bjlk_I8II_BH_UserArgs_MT64x64x64_MI16x16x1_SN_LDSB1_AFC0_AFEM1_AFEM1_ASEM1_CLR0_CADS0_DTVA0_DTVB0_EPS0_FDSI0_GRPM1_GRVWA16_GRVWB16_GSUn1_GSUAMBSK_GSUC1_GSUWGMRR1_GLS0_ISA942_IU1_K1_LBSPPA512_LBSPPB512_LBSPPM0_LPA64_LPB32_LPM0_LRVW8_LWPMn1_MIAV0_MIWT4_2_MO40_NTn1_NTA0_NTB0_NTC0_NTD4_NTM0_NEPBS8_NLCA1_NLCB1_ONLL1_PGR2_PLR0_PKA1_SIA3_SS1_SU0_SUM1_SUS0_SPO0_SRVW0_SSO0_SVW4_SK0_SKXCCM0_TLDS0_ULSGRO0_USL1_UIOFGRO0_USFGROn1_VSn1_VWA4_VWB2_WSGRA0_WSGRB0_WS64_WG16_8_2_WGM1_WGMXCC4_WGMXCCGn1
    SolutionIndex: 142
    SolutionNameMin: Cijk_Ailk_Bjlk_I8II_BH_UserArgs_MT16x32x128_MI16x16x1_SN_LDSB0_AFC0_AFEM1_AFEM1_ASEM1_CLR1_CADS0_DTVA0_DTVB0_EPS0_FDSI0_GRPM1_GRVWA1_GRVWB16_GSUn1_GSUAMBSK_GSUC1_GSUWGMRR1_GLS0_ISA942_IU1_K1_LBSPPA128_LBSPPB256_LBSPPM0_LPA16_LPB16_LPM0_LRVW8_LWPMn1_MIAV0_MIWT1_1_MO40_NTn1_NTA0_NTB0_NTC0_NTD4_NTM0_NEPBS8_NLCA1_NLCB1_ONLL1_PGR2_PLR1_PKA1_SIA3_SS1_SU0_SUM1_SUS0_SPO0_SRVW0_SSO0_SVW1_SK0_SKXCCM0_TLDS0_ULSGRO0_USL1_UIOFGRO0_USFGROn1_VSn1_VWA1_VWB1_WSGRA0_WSGRB0_WS64_WG16_8_2_WGM1_WGMXCC4_WGMXCCGn1
    SolutionIndex: 143
    SolutionNameMin: Cijk_Ailk_Bjlk_I8II_BH_UserArgs_MT16x64x256_MI16x16x1_SN_LDSB0_AFC0_AFEM1_AFEM1_ASEM1_CLR1_CADS0_DTVA0_DTVB0_EPS0_FDSI0_GRPM1_GRVWA1_GRVWB16_GSUn1_GSUAMBSK_GSUC1_GSUWGMRR1_GLS0_ISA942_IU1_K1_LBSPPA128_LBSPPB512_LBSPPM0_LPA16_LPB32_LPM0_LRVW8_LWPMn1_MIAV0_MIWT1_2_MO40_NTn1_NTA0_NTB0_NTC0_NTD4_NTM0_NEPBS8_NLCA1_NLCB1_ONLL1_PGR2_PLR1_PKA1_SIA3_SS1_SU0_SUM1_SUS0_SPO0_SRVW0_SSO0_SVW1_SK0_SKXCCM0_TLDS0_ULSGRO0_USL1_UIOFGRO0_USFGROn1_VSn1_VWA1_VWB2_WSGRA0_WSGRB0_WS64_WG16_8_2_WGM1_WGMXCC4_WGMXCCGn1
    SolutionIndex: 144
    SolutionNameMin: Cijk_Ailk_Bjlk_I8II_BH_UserArgs_MT16x32x256_MI16x16x1_SN_LDSB1_AFC0_AFEM1_AFEM1_ASEM1_CLR1_CADS0_DTVA0_DTVB0_EPS0_FDSI0_GRPM1_GRVWA16_GRVWB16_GSUn1_GSUAMBSK_GSUC1_GSUWGMRR1_GLS0_ISA942_IU1_K1_LBSPPA128_LBSPPB256_LBSPPM0_LPA16_LPB32_LPM0_LRVW8_LWPMn1_MIAV0_MIWT1_2_MO40_NTn1_NTA0_NTB0_NTC0_NTD4_NTM0_NEPBS8_NLCA1_NLCB1_ONLL1_PGR2_PLR1_PKA1_SIA3_SS1_SU0_SUM1_SUS0_SPO0_SRVW0_SSO0_SVW1_SK0_SKXCCM0_TLDS0_ULSGRO0_USL1_UIOFGRO0_USFGROn1_VSn1_VWA1_VWB2_WSGRA0_WSGRB0_WS64_WG16_4_4_WGM1_WGMXCC4_WGMXCCGn1
    SolutionIndex: 145
    SolutionNameMin: Cijk_Ailk_Bjlk_I8II_BH_UserArgs_MT16x32x512_MI16x16x1_SN_LDSB1_AFC0_AFEM1_AFEM1_ASEM1_CLR1_CADS0_DTVA0_DTVB0_EPS0_FDSI0_GRPM1_GRVWA16_GRVWB16_GSUn1_GSUAMBSK_GSUC1_GSUWGMRR1_GLS0_ISA942_IU1_K1_LBSPPA128_LBSPPB256_LBSPPM0_LPA16_LPB32_LPM0_LRVW8_LWPMn1_MIAV0_MIWT1_2_MO40_NTn1_NTA0_NTB0_NTC0_NTD4_NTM0_NEPBS8_NLCA1_NLCB1_ONLL1_PGR2_PLR1_PKA1_SIA3_SS1_SU0_SUM1_SUS0_SPO0_SRVW0_SSO0_SVW1_SK0_SKXCCM0_TLDS0_ULSGRO0_USL1_UIOFGRO0_USFGROn1_VSn1_VWA1_VWB2_WSGRA0_WSGRB0_WS64_WG16_4_4_WGM1_WGMXCC4_WGMXCCGn1
    SolutionIndex: 146
    SolutionNameMin: Cijk_Ailk_Bjlk_I8II_BH_UserArgs_MT32x32x512_MI16x16x1_SN_LDSB1_AFC0_AFEM1_AFEM1_ASEM1_CLR1_CADS0_DTVA0_DTVB0_EPS0_FDSI0_GRPM1_GRVWA16_GRVWB16_GSUn1_GSUAMBSK_GSUC1_GSUWGMRR1_GLS0_ISA942_IU1_K1_LBSPPA256_LBSPPB256_LBSPPM0_LPA32_LPB16_LPM0_LRVW8_LWPMn1_MIAV0_MIWT2_1_MO40_NTn1_NTA0_NTB0_NTC0_NTD4_NTM0_NEPBS8_NLCA1_NLCB1_ONLL1_PGR2_PLR1_PKA1_SIA3_SS1_SU0_SUM1_SUS0_SPO0_SRVW0_SSO0_SVW2_SK0_SKXCCM0_TLDS0_ULSGRO0_USL1_UIOFGRO0_USFGROn1_VSn1_VWA2_VWB1_WSGRA0_WSGRB0_WS64_WG16_8_2_WGM1_WGMXCC4_WGMXCCGn1
    SolutionIndex: 147
    SolutionNameMin: Cijk_Ailk_Bjlk_I8II_BH_UserArgs_MT32x48x256_MI16x16x1_SN_LDSB0_AFC0_AFEM1_AFEM1_ASEM1_CLR1_CADS0_DTVA0_DTVB0_EPS0_FDSI0_GRPM1_GRVWA16_GRVWB16_GSUn1_GSUAMBSK_GSUC1_GSUWGMRR1_GLS0_ISA942_IU1_K1_LBSPPA256_LBSPPB384_LBSPPM0_LPA32_LPB16_LPM0_LRVW8_LWPMn1_MIAV0_MIWT2_3_MO40_NTn1_NTA0_NTB0_NTC0_NTD4_NTM0_NEPBS8_NLCA1_NLCB1_ONLL1_PGR2_PLR1_PKA1_SIA3_SS1_SU0_SUM1_SUS0_SPO0_SRVW0_SSO0_SVW2_SK0_SKXCCM0_TLDS0_ULSGRO0_USL1_UIOFGRO0_USFGROn1_VSn1_VWA2_VWB1_WSGRA0_WSGRB0_WS64_WG16_4_4_WGM1_WGMXCC4_WGMXCCGn1
    SolutionIndex: 148
    SolutionNameMin: Cijk_Ailk_Bjlk_I8II_BH_UserArgs_MT64x64x256_MI16x16x1_SN_LDSB1_AFC0_AFEM1_AFEM1_ASEM1_CLR1_CADS0_DTVA0_DTVB0_EPS0_FDSI0_GRPM1_GRVWA16_GRVWB16_GSUn1_GSUAMBSK_GSUC1_GSUWGMRR1_GLS0_ISA942_IU1_K1_LBSPPA512_LBSPPB512_LBSPPM0_LPA64_LPB16_LPM0_LRVW8_LWPMn1_MIAV0_MIWT4_1_MO40_NTn1_NTA0_NTB0_NTC0_NTD4_NTM0_NEPBS8_NLCA1_NLCB1_ONLL1_PGR2_PLR1_PKA1_SIA3_SS1_SU0_SUM1_SUS0_SPO0_SRVW0_SSO0_SVW4_SK0_SKXCCM0_TLDS0_ULSGRO0_USL1_UIOFGRO0_USFGROn1_VSn1_VWA4_VWB1_WSGRA0_WSGRB0_WS64_WG16_16_1_WGM1_WGMXCC4_WGMXCCGn1
    SolutionIndex: 149
    SolutionNameMin: Cijk_Ailk_Bjlk_I8II_BH_UserArgs_MT128x96x128_MI16x16x1_SN_LDSB0_AFC0_AFEM1_AFEM1_ASEM1_CLR1_CADS0_DTVA0_DTVB0_EPS0_FDSI0_GRPM1_GRVWA16_GRVWB16_GSUn1_GSUAMBSK_GSUC1_GSUWGMRR1_GLS0_ISA942_IU1_K1_LBSPPA1024_LBSPPB768_LBSPPM0_LPA64_LPB16_LPM0_LRVW8_LWPMn1_MIAV0_MIWT4_3_MO40_NTn1_NTA0_NTB0_NTC0_NTD4_NTM0_NEPBS8_NLCA1_NLCB1_ONLL1_PGR2_PLR1_PKA1_SIA3_SS1_SU0_SUM1_SUS0_SPO0_SRVW0_SSO0_SVW4_SK0_SKXCCM0_TLDS0_ULSGRO0_USL1_UIOFGRO0_USFGROn1_VSn1_VWA4_VWB1_WSGRA0_WSGRB0_WS64_WG32_8_1_WGM1_WGMXCC4_WGMXCCGn1
    SolutionIndex: 150
    SolutionNameMin: Cijk_Ailk_Bjlk_I8II_BH_UserArgs_MT64x32x256_MI16x16x1_SN_LDSB1_AFC0_AFEM1_AFEM1_ASEM1_CLR1_CADS0_DTVA0_DTVB0_EPS0_FDSI0_GRPM1_GRVWA16_GRVWB16_GSUn1_GSUAMBSK_GSUC1_GSUWGMRR1_GLS0_ISA942_IU1_K1_LBSPPA512_LBSPPB256_LBSPPM0_LPA16_LPB32_LPM0_LRVW8_LWPMn1_MIAV0_MIWT1_2_MO40_NTn1_NTA0_NTB0_NTC0_NTD4_NTM0_NEPBS8_NLCA1_NLCB1_ONLL1_PGR2_PLR1_PKA1_SIA3_SS1_SU0_SUM1_SUS0_SPO0_SRVW0_SSO0_SVW1_SK0_SKXCCM0_TLDS0_ULSGRO0_USL1_UIOFGRO0_USFGROn1_VSn1_VWA1_VWB2_WSGRA0_WSGRB0_WS64_WG64_4_1_WGM1_WGMXCC4_WGMXCCGn1
    SolutionIndex: 151
    SolutionNameMin: Cijk_Ailk_Bjlk_I8II_BH_UserArgs_MT128x96x128_MI16x16x1_SN_LDSB1_AFC0_AFEM1_AFEM1_ASEM1_CLR1_CADS0_DTVA0_DTVB0_EPS0_FDSI0_GRPM1_GRVWA16_GRVWB16_GSUn1_GSUAMBSK_GSUC1_GSUWGMRR1_GLS0_ISA942_IU1_K1_LBSPPA1024_LBSPPB768_LBSPPM0_LPA64_LPB16_LPM0_LRVW8_LWPMn1_MIAV0_MIWT4_3_MO40_NTn1_NTA0_NTB0_NTC0_NTD4_NTM0_NEPBS8_NLCA1_NLCB1_ONLL1_PGR2_PLR1_PKA1_SIA3_SS1_SU0_SUM1_SUS0_SPO0_SRVW0_SSO0_SVW4_SK0_SKXCCM0_TLDS0_ULSGRO0_USL1_UIOFGRO0_USFGROn1_VSn1_VWA4_VWB1_WSGRA0_WSGRB0_WS64_WG32_8_1_WGM1_WGMXCC4_WGMXCCGn1
    SolutionIndex: 152
    SolutionNameMin: Cijk_Ailk_Bjlk_I8II_BH_UserArgs_MT128x64x256_MI16x16x1_SN_LDSB1_AFC0_AFEM1_AFEM1_ASEM1_CLR1_CADS0_DTVA0_DTVB0_EPS0_FDSI0_GRPM1_GRVWA16_GRVWB16_GSUn1_GSUAMBSK_GSUC1_GSUWGMRR1_GLS0_ISA942_IU1_K1_LBSPPA1024_LBSPPB512_LBSPPM0_LPA64_LPB32_LPM0_LRVW8_LWPMn1_MIAV0_MIWT4_2_MO40_NTn1_NTA0_NTB0_NTC0_NTD4_NTM0_NEPBS8_NLCA1_NLCB1_ONLL1_PGR2_PLR1_PKA1_SIA3_SS1_SU0_SUM1_SUS0_SPO0_SRVW0_SSO0_SVW4_SK0_SKXCCM0_TLDS0_ULSGRO0_USL1_UIOFGRO0_USFGROn1_VSn1_VWA4_VWB2_WSGRA0_WSGRB0_WS64_WG32_8_1_WGM1_WGMXCC4_WGMXCCGn1
    SolutionIndex: 153
    SolutionNameMin: Cijk_Ailk_Bjlk_I8II_BH_UserArgs_MT64x96x128_MI16x16x1_SN_LDSB1_AFC0_AFEM1_AFEM1_ASEM1_CLR1_CADS0_DTVA0_DTVB0_EPS0_FDSI0_GRPM1_GRVWA16_GRVWB16_GSUn1_GSUAMBSK_GSUC1_GSUWGMRR1_GLS0_ISA942_IU1_K1_LBSPPA512_LBSPPB768_LBSPPM0_LPA64_LPB16_LPM0_LRVW8_LWPMn1_MIAV0_MIWT4_3_MO40_NTn1_NTA0_NTB0_NTC0_NTD4_NTM0_NEPBS8_NLCA1_NLCB1_ONLL1_PGR2_PLR1_PKA1_SIA3_SS1_SU0_SUM1_SUS0_SPO0_SRVW0_SSO0_SVW4_SK0_SKXCCM0_TLDS0_ULSGRO0_USL1_UIOFGRO0_USFGROn1_VSn1_VWA4_VWB1_WSGRA0_WSGRB0_WS64_WG16_8_2_WGM1_WGMXCC4_WGMXCCGn1
    SolutionIndex: 154
    SolutionNameMin: Cijk_Ailk_Bjlk_I8II_BH_UserArgs_MT256x96x128_MI16x16x1_SN_LDSB1_AFC0_AFEM1_AFEM1_ASEM1_CLR1_CADS0_DTVA0_DTVB0_EPS0_FDSI0_GRPM1_GRVWA16_GRVWB16_GSUn1_GSUAMBSK_GSUC1_GSUWGMRR1_GLS0_ISA942_IU1_K1_LBSPPA2048_LBSPPB768_LBSPPM0_LPA32_LPB32_LPM0_LRVW8_LWPMn1_MIAV0_MIWT4_6_MO40_NTn1_NTA0_NTB0_NTC0_NTD4_NTM0_NEPBS8_NLCA1_NLCB1_ONLL1_PGR2_PLR1_PKA1_SIA3_SS1_SU0_SUM1_SUS0_SPO0_SRVW0_SSO0_SVW4_SK0_SKXCCM0_TLDS0_ULSGRO0_USL1_UIOFGRO0_USFGROn1_VSn1_VWA4_VWB2_WSGRA0_WSGRB0_WS64_WG64_4_1_WGM1_WGMXCC4_WGMXCCGn1
    SolutionIndex: 155
    SolutionNameMin: Cijk_Ailk_Bjlk_I8II_BH_UserArgs_MT64x32x256_MI16x16x1_SN_LDSB1_AFC0_AFEM1_AFEM1_ASEM1_CLR1_CADS0_DTVA0_DTVB0_EPS0_FDSI0_GRPM1_GRVWA16_GRVWB16_GSUn1_GSUAMBSK_GSUC1_GSUWGMRR1_GLS0_ISA942_IU1_K1_LBSPPA512_LBSPPB256_LBSPPM0_LPA32_LPB16_LPM0_LRVW8_LWPMn1_MIAV0_MIWT2_2_MO40_NTn1_NTA0_NTB0_NTC0_NTD4_NTM0_NEPBS8_NLCA1_NLCB1_ONLL1_PGR2_PLR1_PKA1_SIA3_SS1_SU0_SUM1_SUS0_SPO0_SRVW0_SSO0_SVW2_SK0_SKXCCM0_TLDS0_ULSGRO0_USL1_UIOFGRO0_USFGROn1_VSn1_VWA2_VWB1_WSGRA0_WSGRB0_WS64_WG32_4_2_WGM1_WGMXCC4_WGMXCCGn1
    SolutionIndex: 156
    SolutionNameMin: Cijk_Ailk_Bjlk_I8II_BH_UserArgs_MT256x96x128_MI16x16x1_SN_LDSB1_AFC0_AFEM1_AFEM1_ASEM1_CLR1_CADS0_DTVA0_DTVB0_EPS0_FDSI0_GRPM1_GRVWA16_GRVWB16_GSUn1_GSUAMBSK_GSUC1_GSUWGMRR1_GLS0_ISA942_IU1_K1_LBSPPA2048_LBSPPB768_LBSPPM0_LPA64_LPB32_LPM0_LRVW8_LWPMn1_MIAV0_MIWT4_6_MO40_NTn1_NTA0_NTB0_NTC0_NTD4_NTM0_NEPBS8_NLCA1_NLCB1_ONLL1_PGR2_PLR1_PKA1_SIA3_SS1_SU0_SUM1_SUS0_SPO0_SRVW0_SSO0_SVW4_SK0_SKXCCM0_TLDS0_ULSGRO0_USL1_UIOFGRO0_USFGROn1_VSn1_VWA4_VWB2_WSGRA0_WSGRB0_WS64_WG64_4_1_WGM1_WGMXCC4_WGMXCCGn1
    SolutionIndex: 157
    SolutionNameMin: Cijk_Ailk_Bjlk_I8II_BH_UserArgs_MT256x96x128_MI16x16x1_SN_LDSB1_AFC0_AFEM1_AFEM1_ASEM1_CLR1_CADS0_DTVA0_DTVB0_EPS0_FDSI0_GRPM1_GRVWA16_GRVWB16_GSUn1_GSUAMBSK_GSUC1_GSUWGMRR1_GLS0_ISA942_IU1_K1_LBSPPA2048_LBSPPB768_LBSPPM0_LPA64_LPB32_LPM0_LRVW8_LWPMn1_MIAV0_MIWT8_6_MO40_NTn1_NTA0_NTB0_NTC0_NTD4_NTM0_NEPBS8_NLCA1_NLCB1_ONLL1_PGR2_PLR1_PKA1_SIA3_SS1_SU0_SUM1_SUS0_SPO0_SRVW0_SSO0_SVW8_SK0_SKXCCM0_TLDS0_ULSGRO0_USL1_UIOFGRO0_USFGROn1_VSn1_VWA8_VWB2_WSGRA0_WSGRB0_WS64_WG32_4_2_WGM1_WGMXCC4_WGMXCCGn1
    SolutionIndex: 158
    SolutionNameMin: Cijk_Ailk_Bjlk_I8II_BH_UserArgs_MT256x32x128_MI16x16x1_SN_LDSB1_AFC0_AFEM1_AFEM1_ASEM1_CLR1_CADS0_DTVA0_DTVB0_EPS0_FDSI0_GRPM1_GRVWA16_GRVWB16_GSUn1_GSUAMBSK_GSUC1_GSUWGMRR1_GLS0_ISA942_IU1_K1_LBSPPA2048_LBSPPB256_LBSPPM0_LPA64_LPB16_LPM0_LRVW8_LWPMn1_MIAV0_MIWT8_2_MO40_NTn1_NTA0_NTB0_NTC0_NTD4_NTM0_NEPBS8_NLCA1_NLCB1_ONLL1_PGR2_PLR1_PKA1_SIA3_SS1_SU0_SUM1_SUS0_SPO0_SRVW0_SSO0_SVW8_SK0_SKXCCM0_TLDS0_ULSGRO0_USL1_UIOFGRO0_USFGROn1_VSn1_VWA8_VWB1_WSGRA0_WSGRB0_WS64_WG32_4_2_WGM1_WGMXCC4_WGMXCCGn1
    SolutionIndex: 159
    SolutionNameMin: Cijk_Ailk_Bjlk_I8II_BH_UserArgs_MT128x96x128_MI16x16x1_SN_LDSB1_AFC0_AFEM1_AFEM1_ASEM1_CLR1_CADS0_DTVA0_DTVB0_EPS0_FDSI0_GRPM1_GRVWA16_GRVWB16_GSUn1_GSUAMBSK_GSUC1_GSUWGMRR1_GLS0_ISA942_IU1_K1_LBSPPA1024_LBSPPB768_LBSPPM0_LPA64_LPB32_LPM0_LRVW8_LWPMn1_MIAV0_MIWT4_6_MO40_NTn1_NTA0_NTB0_NTC0_NTD4_NTM0_NEPBS8_NLCA1_NLCB1_ONLL1_PGR2_PLR1_PKA1_SIA3_SS1_SU0_SUM1_SUS0_SPO0_SRVW0_SSO0_SVW4_SK0_SKXCCM0_TLDS0_ULSGRO0_USL1_UIOFGRO0_USFGROn1_VSn1_VWA4_VWB2_WSGRA0_WSGRB0_WS64_WG32_4_2_WGM1_WGMXCC4_WGMXCCGn1
    SolutionIndex: 160
    SolutionNameMin: Cijk_Ailk_Bjlk_I8II_BH_UserArgs_MT128x96x128_MI16x16x1_SN_LDSB1_AFC0_AFEM1_AFEM1_ASEM1_CLR1_CADS0_DTVA0_DTVB0_EPS0_FDSI0_GRPM1_GRVWA16_GRVWB16_GSUn1_GSUAMBSK_GSUC1_GSUWGMRR1_GLS0_ISA942_IU1_K1_LBSPPA1024_LBSPPB768_LBSPPM0_LPA64_LPB16_LPM0_LRVW8_LWPMn1_MIAV0_MIWT4_3_MO40_NTn1_NTA0_NTB0_NTC0_NTD4_NTM0_NEPBS8_NLCA1_NLCB1_ONLL1_PGR2_PLR1_PKA1_SIA3_SS1_SU0_SUM1_SUS0_SPO0_SRVW0_SSO4_SVW4_SK0_SKXCCM0_TLDS0_ULSGRO0_USL1_UIOFGRO0_USFGROn1_VSn1_VWA4_VWB1_WSGRA0_WSGRB0_WS64_WG32_8_1_WGM1_WGMXCC4_WGMXCCGn1
    SolutionIndex: 161
    SolutionNameMin: Cijk_Ailk_Bjlk_I8II_BH_UserArgs_MT256x96x128_MI16x16x1_SN_LDSB1_AFC0_AFEM1_AFEM1_ASEM1_CLR1_CADS0_DTVA0_DTVB0_EPS0_FDSI0_GRPM1_GRVWA16_GRVWB16_GSUn1_GSUAMBSK_GSUC1_GSUWGMRR1_GLS0_ISA942_IU1_K1_LBSPPA2048_LBSPPB768_LBSPPM0_LPA64_LPB32_LPM0_LRVW8_LWPMn1_MIAV0_MIWT4_6_MO40_NTn1_NTA0_NTB0_NTC0_NTD4_NTM0_NEPBS8_NLCA1_NLCB1_ONLL1_PGR2_PLR1_PKA1_SIA3_SS1_SU0_SUM1_SUS0_SPO0_SRVW0_SSO4_SVW4_SK0_SKXCCM0_TLDS0_ULSGRO0_USL1_UIOFGRO0_USFGROn1_VSn1_VWA4_VWB2_WSGRA0_WSGRB0_WS64_WG64_4_1_WGM1_WGMXCC4_WGMXCCGn1
    SolutionIndex: 162
    SolutionNameMin: Cijk_Ailk_Bjlk_I8II_BH_UserArgs_MT16x64x128_MI16x16x1_SN_LDSB0_AFC0_AFEM1_AFEM1_ASEM1_CLR1_CADS0_DTVA0_DTVB0_EPS0_FDSI0_GRPM1_GRVWA1_GRVWB16_GSUn1_GSUAMBSK_GSUC1_GSUWGMRR1_GLS0_ISA942_IU1_K1_LBSPPA128_LBSPPB512_LBSPPM0_LPA16_LPB16_LPM0_LRVW8_LWPMn1_MIAV0_MIWT1_1_MO40_NTn1_NTA0_NTB0_NTC0_NTD4_NTM0_NEPBS8_NLCA1_NLCB1_ONLL1_PGR2_PLR1_PKA1_SIA3_SS1_SU0_SUM1_SUS0_SPO0_SRVW0_SSO0_SVW1_SK0_SKXCCM0_TLDS0_ULSGRO0_USL1_UIOFGRO0_USFGROn1_VSn1_VWA1_VWB1_WSGRA0_WSGRB0_WS64_WG16_16_1_WGM1_WGMXCC4_WGMXCCGn1
    SolutionIndex: 163
    SolutionNameMin: Cijk_Ailk_Bjlk_I8II_BH_UserArgs_MT32x32x256_MI16x16x1_SN_LDSB1_AFC0_AFEM1_AFEM1_ASEM1_CLR1_CADS0_DTVA0_DTVB0_EPS0_FDSI0_GRPM1_GRVWA16_GRVWB16_GSUn1_GSUAMBSK_GSUC1_GSUWGMRR1_GLS0_ISA942_IU1_K1_LBSPPA256_LBSPPB256_LBSPPM0_LPA32_LPB32_LPM0_LRVW8_LWPMn1_MIAV0_MIWT2_2_MO40_NTn1_NTA0_NTB0_NTC0_NTD4_NTM0_NEPBS8_NLCA1_NLCB1_ONLL1_PGR2_PLR1_PKA1_SIA3_SS1_SU0_SUM1_SUS0_SPO0_SRVW0_SSO0_SVW2_SK0_SKXCCM0_TLDS0_ULSGRO0_USL1_UIOFGRO0_USFGROn1_VSn1_VWA2_VWB2_WSGRA0_WSGRB0_WS64_WG16_4_4_WGM1_WGMXCC4_WGMXCCGn1
    SolutionIndex: 164
    SolutionNameMin: Cijk_Ailk_Bjlk_I8II_BH_UserArgs_MT64x32x512_MI16x16x1_SN_LDSB1_AFC0_AFEM1_AFEM1_ASEM1_CLR1_CADS0_DTVA0_DTVB0_EPS0_FDSI0_GRPM1_GRVWA16_GRVWB16_GSUn1_GSUAMBSK_GSUC1_GSUWGMRR1_GLS0_ISA942_IU1_K1_LBSPPA512_LBSPPB256_LBSPPM0_LPA64_LPB32_LPM0_LRVW8_LWPMn1_MIAV0_MIWT4_2_MO40_NTn1_NTA0_NTB0_NTC0_NTD4_NTM0_NEPBS8_NLCA1_NLCB1_ONLL1_PGR2_PLR1_PKA1_SIA3_SS1_SU0_SUM1_SUS0_SPO0_SRVW0_SSO0_SVW4_SK0_SKXCCM0_TLDS0_ULSGRO0_USL1_UIOFGRO0_USFGROn1_VSn1_VWA4_VWB2_WSGRA0_WSGRB0_WS64_WG16_4_4_WGM1_WGMXCC4_WGMXCCGn1
    SolutionIndex: 165
    SolutionNameMin: Cijk_Ailk_Bjlk_I8II_BH_UserArgs_MT32x64x128_MI16x16x1_SN_LDSB0_AFC0_AFEM1_AFEM1_ASEM1_CLR1_CADS0_DTVA0_DTVB0_EPS0_FDSI0_GRPM1_GRVWA16_GRVWB16_GSUn1_GSUAMBSK_GSUC1_GSUWGMRR1_GLS0_ISA942_IU1_K1_LBSPPA256_LBSPPB512_LBSPPM0_LPA16_LPB32_LPM0_LRVW8_LWPMn1_MIAV0_MIWT1_2_MO40_NTn1_NTA0_NTB0_NTC0_NTD4_NTM0_NEPBS8_NLCA1_NLCB1_ONLL1_PGR2_PLR1_PKA1_SIA3_SS1_SU0_SUM1_SUS0_SPO0_SRVW0_SSO0_SVW1_SK0_SKXCCM0_TLDS0_ULSGRO0_USL1_UIOFGRO0_USFGROn1_VSn1_VWA1_VWB2_WSGRA0_WSGRB0_WS64_WG32_8_1_WGM1_WGMXCC4_WGMXCCGn1
    SolutionIndex: 166
    SolutionNameMin: Cijk_Ailk_Bjlk_I8II_BH_UserArgs_MT64x64x128_MI16x16x1_SN_LDSB0_AFC0_AFEM1_AFEM1_ASEM1_CLR1_CADS0_DTVA0_DTVB0_EPS0_FDSI0_GRPM1_GRVWA16_GRVWB16_GSUn1_GSUAMBSK_GSUC1_GSUWGMRR1_GLS0_ISA942_IU1_K1_LBSPPA512_LBSPPB512_LBSPPM0_LPA32_LPB64_LPM0_LRVW8_LWPMn1_MIAV0_MIWT2_4_MO40_NTn1_NTA0_NTB0_NTC0_NTD4_NTM0_NEPBS8_NLCA1_NLCB1_ONLL1_PGR2_PLR1_PKA1_SIA3_SS1_SU0_SUM1_SUS0_SPO0_SRVW0_SSO0_SVW2_SK0_SKXCCM0_TLDS0_ULSGRO0_USL1_UIOFGRO0_USFGROn1_VSn1_VWA2_VWB4_WSGRA0_WSGRB0_WS64_WG32_4_2_WGM1_WGMXCC4_WGMXCCGn1
    SolutionIndex: 167
    SolutionNameMin: Cijk_Ailk_Bjlk_I8II_BH_UserArgs_MT64x64x128_MI16x16x1_SN_LDSB0_AFC0_AFEM1_AFEM1_ASEM1_CLR1_CADS0_DTVA0_DTVB0_EPS0_FDSI0_GRPM1_GRVWA16_GRVWB16_GSUn1_GSUAMBSK_GSUC1_GSUWGMRR1_GLS0_ISA942_IU1_K1_LBSPPA512_LBSPPB512_LBSPPM0_LPA32_LPB32_LPM0_LRVW8_LWPMn1_MIAV0_MIWT2_2_MO40_NTn1_NTA0_NTB0_NTC0_NTD4_NTM0_NEPBS8_NLCA1_NLCB1_ONLL1_PGR2_PLR1_PKA1_SIA3_SS1_SU0_SUM1_SUS0_SPO0_SRVW0_SSO0_SVW2_SK0_SKXCCM0_TLDS0_ULSGRO0_USL1_UIOFGRO0_USFGROn1_VSn1_VWA2_VWB2_WSGRA0_WSGRB0_WS64_WG32_8_1_WGM1_WGMXCC4_WGMXCCGn1
    SolutionIndex: 168
    SolutionNameMin: Cijk_Ailk_Bjlk_I8II_BH_UserArgs_MT64x64x128_MI16x16x1_SN_LDSB0_AFC0_AFEM1_AFEM1_ASEM1_CLR1_CADS0_DTVA0_DTVB0_EPS0_FDSI0_GRPM1_GRVWA16_GRVWB16_GSUn1_GSUAMBSK_GSUC1_GSUWGMRR1_GLS0_ISA942_IU1_K1_LBSPPA512_LBSPPB512_LBSPPM0_LPA64_LPB16_LPM0_LRVW8_LWPMn1_MIAV0_MIWT4_1_MO40_NTn1_NTA0_NTB0_NTC0_NTD4_NTM0_NEPBS8_NLCA1_NLCB1_ONLL1_PGR2_PLR1_PKA1_SIA3_SS1_SU0_SUM1_SUS0_SPO0_SRVW0_SSO0_SVW4_SK0_SKXCCM0_TLDS0_ULSGRO0_USL1_UIOFGRO0_USFGROn1_VSn1_VWA4_VWB1_WSGRA0_WSGRB0_WS64_WG16_16_1_WGM1_WGMXCC4_WGMXCCGn1
    SolutionIndex: 169
    SolutionNameMin: Cijk_Ailk_Bjlk_I8II_BH_UserArgs_MT128x64x128_MI16x16x1_SN_LDSB0_AFC0_AFEM1_AFEM1_ASEM1_CLR1_CADS0_DTVA0_DTVB0_EPS0_FDSI0_GRPM1_GRVWA16_GRVWB16_GSUn1_GSUAMBSK_GSUC1_GSUWGMRR1_GLS0_ISA942_IU1_K1_LBSPPA1024_LBSPPB512_LBSPPM0_LPA64_LPB32_LPM0_LRVW8_LWPMn1_MIAV0_MIWT4_2_MO40_NTn1_NTA0_NTB0_NTC0_NTD4_NTM0_NEPBS8_NLCA1_NLCB1_ONLL1_PGR2_PLR1_PKA1_SIA3_SS1_SU0_SUM1_SUS0_SPO0_SRVW0_SSO0_SVW4_SK0_SKXCCM0_TLDS0_ULSGRO0_USL1_UIOFGRO0_USFGROn1_VSn1_VWA4_VWB2_WSGRA0_WSGRB0_WS64_WG32_8_1_WGM1_WGMXCC4_WGMXCCGn1
    SolutionIndex: 170
    SolutionNameMin: Cijk_Ailk_Bjlk_I8II_BH_UserArgs_MT128x64x64_MI16x16x1_SN_LDSB1_AFC0_AFEM1_AFEM1_ASEM1_CLR1_CADS0_DTVA0_DTVB0_EPS0_FDSI0_GRPM1_GRVWA16_GRVWB16_GSUn1_GSUAMBSK_GSUC1_GSUWGMRR1_GLS0_ISA942_IU1_K1_LBSPPA1024_LBSPPB512_LBSPPM0_LPA64_LPB32_LPM0_LRVW8_LWPMn1_MIAV0_MIWT4_2_MO40_NTn1_NTA0_NTB0_NTC0_NTD4_NTM0_NEPBS8_NLCA1_NLCB1_ONLL1_PGR2_PLR1_PKA1_SIA3_SS1_SU0_SUM1_SUS0_SPO0_SRVW0_SSO0_SVW4_SK0_SKXCCM0_TLDS0_ULSGRO0_USL1_UIOFGRO0_USFGROn1_VSn1_VWA4_VWB2_WSGRA0_WSGRB0_WS64_WG32_8_1_WGM1_WGMXCC4_WGMXCCGn1
    SolutionIndex: 171
    SolutionNameMin: Cijk_Ailk_Bjlk_I8II_BH_UserArgs_MT32x64x256_MI16x16x1_SN_LDSB1_AFC0_AFEM1_AFEM1_ASEM1_CLR1_CADS0_DTVA0_DTVB0_EPS0_FDSI0_GRPM1_GRVWA16_GRVWB16_GSUn1_GSUAMBSK_GSUC1_GSUWGMRR1_GLS0_ISA942_IU1_K1_LBSPPA256_LBSPPB512_LBSPPM0_LPA32_LPB32_LPM0_LRVW8_LWPMn1_MIAV0_MIWT2_2_MO40_NTn1_NTA0_NTB0_NTC0_NTD4_NTM0_NEPBS8_NLCA1_NLCB1_ONLL1_PGR2_PLR1_PKA1_SIA3_SS1_SU0_SUM1_SUS0_SPO0_SRVW0_SSO0_SVW2_SK0_SKXCCM0_TLDS0_ULSGRO0_USL1_UIOFGRO0_USFGROn1_VSn1_VWA2_VWB2_WSGRA0_WSGRB0_WS64_WG16_8_2_WGM1_WGMXCC4_WGMXCCGn1
    SolutionIndex: 172
    SolutionNameMin: Cijk_Ailk_Bjlk_I8II_BH_UserArgs_MT64x32x256_MI16x16x1_SN_LDSB1_AFC0_AFEM1_AFEM1_ASEM1_CLR1_CADS0_DTVA0_DTVB0_EPS0_FDSI0_GRPM1_GRVWA16_GRVWB16_GSUn1_GSUAMBSK_GSUC1_GSUWGMRR1_GLS0_ISA942_IU1_K1_LBSPPA512_LBSPPB256_LBSPPM0_LPA64_LPB16_LPM0_LRVW8_LWPMn1_MIAV0_MIWT4_1_MO40_NTn1_NTA0_NTB0_NTC0_NTD4_NTM0_NEPBS8_NLCA1_NLCB1_ONLL1_PGR2_PLR1_PKA1_SIA3_SS1_SU0_SUM1_SUS0_SPO0_SRVW0_SSO0_SVW4_SK0_SKXCCM0_TLDS0_ULSGRO0_USL1_UIOFGRO0_USFGROn1_VSn1_VWA4_VWB1_WSGRA0_WSGRB0_WS64_WG16_8_2_WGM1_WGMXCC4_WGMXCCGn1
    SolutionIndex: 173
    SolutionNameMin: Cijk_Ailk_Bjlk_I8II_BH_UserArgs_MT64x64x128_MI16x16x1_SN_LDSB1_AFC0_AFEM1_AFEM1_ASEM1_CLR0_CADS0_DTVA0_DTVB0_EPS0_FDSI0_GRPM1_GRVWA16_GRVWB16_GSUn1_GSUAMBSK_GSUC1_GSUWGMRR1_GLS0_ISA942_IU1_K1_LBSPPA512_LBSPPB512_LBSPPM0_LPA64_LPB64_LPM0_LRVW8_LWPMn1_MIAV0_MIWT4_4_MO40_NTn1_NTA0_NTB0_NTC0_NTD4_NTM0_NEPBS8_NLCA1_NLCB1_ONLL1_PGR2_PLR0_PKA1_SIA3_SS1_SU0_SUM1_SUS0_SPO0_SRVW0_SSO0_SVW4_SK0_SKXCCM0_TLDS0_ULSGRO0_USL1_UIOFGRO0_USFGROn1_VSn1_VWA4_VWB4_WSGRA0_WSGRB0_WS64_WG16_4_4_WGM1_WGMXCC4_WGMXCCGn1
    SolutionIndex: 174
    SolutionNameMin: Cijk_Ailk_Bjlk_I8II_BH_UserArgs_MT16x32x256_MI16x16x1_SN_LDSB0_AFC0_AFEM1_AFEM1_ASEM1_CLR1_CADS0_DTVA0_DTVB0_EPS0_FDSI0_GRPM1_GRVWA1_GRVWB16_GSUn1_GSUAMBSK_GSUC1_GSUWGMRR1_GLS0_ISA942_IU1_K1_LBSPPA128_LBSPPB256_LBSPPM0_LPA16_LPB32_LPM0_LRVW8_LWPMn1_MIAV0_MIWT1_2_MO40_NTn1_NTA0_NTB0_NTC0_NTD4_NTM0_NEPBS8_NLCA1_NLCB1_ONLL1_PGR2_PLR1_PKA1_SIA3_SS1_SU0_SUM1_SUS0_SPO0_SRVW0_SSO0_SVW1_SK0_SKXCCM0_TLDS0_ULSGRO0_USL1_UIOFGRO0_USFGROn1_VSn1_VWA1_VWB2_WSGRA0_WSGRB0_WS64_WG16_4_4_WGM1_WGMXCC4_WGMXCCGn1
    SolutionIndex: 175
    SolutionNameMin: Cijk_Ailk_Bjlk_I8II_BH_UserArgs_MT16x32x256_MI16x16x1_SN_LDSB0_AFC0_AFEM1_AFEM1_ASEM1_CLR1_CADS0_DTVA0_DTVB0_EPS0_FDSI0_GRPM1_GRVWA16_GRVWB16_GSUn1_GSUAMBSK_GSUC1_GSUWGMRR1_GLS0_ISA942_IU1_K1_LBSPPA128_LBSPPB256_LBSPPM0_LPA16_LPB16_LPM0_LRVW8_LWPMn1_MIAV0_MIWT1_1_MO40_NTn1_NTA0_NTB0_NTC0_NTD4_NTM0_NEPBS8_NLCA1_NLCB1_ONLL1_PGR2_PLR1_PKA1_SIA3_SS1_SU0_SUM1_SUS0_SPO0_SRVW0_SSO0_SVW1_SK0_SKXCCM0_TLDS0_ULSGRO0_USL1_UIOFGRO0_USFGROn1_VSn1_VWA1_VWB1_WSGRA0_WSGRB0_WS64_WG16_8_1_WGM1_WGMXCC4_WGMXCCGn1
    SolutionIndex: 176
    SolutionNameMin: Cijk_Ailk_Bjlk_I8II_BH_UserArgs_MT16x32x512_MI16x16x1_SN_LDSB0_AFC0_AFEM1_AFEM1_ASEM1_CLR1_CADS0_DTVA0_DTVB0_EPS0_FDSI0_GRPM1_GRVWA16_GRVWB16_GSUn1_GSUAMBSK_GSUC1_GSUWGMRR1_GLS0_ISA942_IU1_K1_LBSPPA128_LBSPPB256_LBSPPM0_LPA16_LPB16_LPM0_LRVW8_LWPMn1_MIAV0_MIWT1_1_MO40_NTn1_NTA0_NTB0_NTC0_NTD4_NTM0_NEPBS8_NLCA1_NLCB1_ONLL1_PGR2_PLR1_PKA1_SIA3_SS1_SU0_SUM1_SUS0_SPO0_SRVW0_SSO0_SVW1_SK0_SKXCCM0_TLDS0_ULSGRO0_USL1_UIOFGRO0_USFGROn1_VSn1_VWA1_VWB1_WSGRA0_WSGRB0_WS64_WG16_8_2_WGM1_WGMXCC4_WGMXCCGn1
    SolutionIndex: 177
    SolutionNameMin: Cijk_Ailk_Bjlk_I8II_BH_UserArgs_MT16x64x256_MI16x16x1_SN_LDSB0_AFC0_AFEM1_AFEM1_ASEM1_CLR1_CADS0_DTVA0_DTVB0_EPS0_FDSI0_GRPM1_GRVWA16_GRVWB16_GSUn1_GSUAMBSK_GSUC1_GSUWGMRR1_GLS0_ISA942_IU1_K1_LBSPPA128_LBSPPB512_LBSPPM0_LPA16_LPB64_LPM0_LRVW8_LWPMn1_MIAV0_MIWT1_4_MO40_NTn1_NTA0_NTB0_NTC0_NTD4_NTM0_NEPBS8_NLCA1_NLCB1_ONLL1_PGR2_PLR1_PKA1_SIA3_SS1_SU0_SUM1_SUS0_SPO0_SRVW0_SSO0_SVW1_SK0_SKXCCM0_TLDS0_ULSGRO0_USL1_UIOFGRO0_USFGROn1_VSn1_VWA1_VWB4_WSGRA0_WSGRB0_WS64_WG16_4_4_WGM1_WGMXCC4_WGMXCCGn1
    SolutionIndex: 178
    SolutionNameMin: Cijk_Ailk_Bjlk_I8II_BH_UserArgs_MT32x64x256_MI16x16x1_SN_LDSB0_AFC0_AFEM1_AFEM1_ASEM1_CLR1_CADS0_DTVA0_DTVB0_EPS0_FDSI0_GRPM1_GRVWA16_GRVWB16_GSUn1_GSUAMBSK_GSUC1_GSUWGMRR1_GLS0_ISA942_IU1_K1_LBSPPA256_LBSPPB512_LBSPPM0_LPA16_LPB32_LPM0_LRVW8_LWPMn1_MIAV0_MIWT1_2_MO40_NTn1_NTA0_NTB0_NTC0_NTD4_NTM0_NEPBS8_NLCA1_NLCB1_ONLL1_PGR2_PLR1_PKA1_SIA3_SS1_SU0_SUM1_SUS0_SPO0_SRVW0_SSO0_SVW1_SK0_SKXCCM0_TLDS0_ULSGRO0_USL1_UIOFGRO0_USFGROn1_VSn1_VWA1_VWB2_WSGRA0_WSGRB0_WS64_WG32_8_1_WGM1_WGMXCC4_WGMXCCGn1
    SolutionIndex: 179
    SolutionNameMin: Cijk_Ailk_Bjlk_I8II_BH_UserArgs_MT64x64x256_MI16x16x1_SN_LDSB1_AFC0_AFEM1_AFEM1_ASEM1_CLR1_CADS0_DTVA0_DTVB0_EPS0_FDSI0_GRPM1_GRVWA16_GRVWB16_GSUn1_GSUAMBSK_GSUC1_GSUWGMRR1_GLS0_ISA942_IU1_K1_LBSPPA512_LBSPPB512_LBSPPM0_LPA32_LPB64_LPM0_LRVW8_LWPMn1_MIAV0_MIWT2_4_MO40_NTn1_NTA0_NTB0_NTC0_NTD4_NTM0_NEPBS8_NLCA1_NLCB1_ONLL1_PGR2_PLR1_PKA1_SIA3_SS1_SU0_SUM1_SUS0_SPO0_SRVW0_SSO0_SVW2_SK0_SKXCCM0_TLDS0_ULSGRO0_USL1_UIOFGRO0_USFGROn1_VSn1_VWA2_VWB4_WSGRA0_WSGRB0_WS64_WG32_4_2_WGM1_WGMXCC4_WGMXCCGn1
    SolutionIndex: 180
    SolutionNameMin: Cijk_Ailk_Bjlk_I8II_BH_UserArgs_MT64x128x128_MI16x16x1_SN_LDSB0_AFC0_AFEM1_AFEM1_ASEM1_CLR1_CADS0_DTVA0_DTVB0_EPS0_FDSI0_GRPM1_GRVWA16_GRVWB16_GSUn1_GSUAMBSK_GSUC1_GSUWGMRR1_GLS0_ISA942_IU1_K1_LBSPPA512_LBSPPB1024_LBSPPM0_LPA64_LPB32_LPM0_LRVW8_LWPMn1_MIAV0_MIWT4_2_MO40_NTn1_NTA0_NTB0_NTC0_NTD4_NTM0_NEPBS8_NLCA1_NLCB1_ONLL1_PGR2_PLR1_PKA1_SIA3_SS1_SU0_SUM1_SUS0_SPO0_SRVW0_SSO0_SVW4_SK0_SKXCCM0_TLDS0_ULSGRO0_USL1_UIOFGRO0_USFGROn1_VSn1_VWA4_VWB2_WSGRA0_WSGRB0_WS64_WG16_16_1_WGM1_WGMXCC4_WGMXCCGn1
    SolutionIndex: 181
    SolutionNameMin: Cijk_Ailk_Bjlk_I8II_BH_UserArgs_MT32x128x128_MI16x16x1_SN_LDSB0_AFC0_AFEM1_AFEM1_ASEM1_CLR1_CADS0_DTVA0_DTVB0_EPS0_FDSI0_GRPM1_GRVWA16_GRVWB16_GSUn1_GSUAMBSK_GSUC1_GSUWGMRR1_GLS0_ISA942_IU1_K1_LBSPPA256_LBSPPB1024_LBSPPM0_LPA32_LPB32_LPM0_LRVW8_LWPMn1_MIAV0_MIWT2_2_MO40_NTn1_NTA0_NTB0_NTC0_NTD4_NTM0_NEPBS8_NLCA1_NLCB1_ONLL1_PGR2_PLR1_PKA1_SIA3_SS1_SU0_SUM1_SUS0_SPO0_SRVW0_SSO0_SVW2_SK0_SKXCCM0_TLDS0_ULSGRO0_USL1_UIOFGRO0_USFGROn1_VSn1_VWA2_VWB2_WSGRA0_WSGRB0_WS64_WG16_16_1_WGM1_WGMXCC4_WGMXCCGn1
    SolutionIndex: 182
    SolutionNameMin: Cijk_Ailk_Bjlk_I8II_BH_UserArgs_MT128x128x128_MI32x32x1_SN_LDSB0_AFC0_AFEM1_AFEM1_ASEM1_CLR1_CADS0_DTVA0_DTVB0_EPS0_FDSI0_GRPM1_GRVWA16_GRVWB16_GSUn1_GSUAMBSK_GSUC1_GSUWGMRR1_GLS0_ISA942_IU1_K1_LBSPPA0_LBSPPB0_LBSPPM0_LPA0_LPB0_LPM0_LRVW8_LWPMn1_MIAV0_MIWT2_2_MO40_NTn1_NTA0_NTB0_NTC0_NTD4_NTM0_NEPBS8_NLCA1_NLCB1_ONLL1_PGR2_PLR1_PKA1_SIA3_SS1_SU0_SUM1_SUS0_SPO0_SRVW0_SSO0_SVW2_SK0_SKXCCM0_TLDS0_ULSGRO0_USL1_UIOFGRO0_USFGROn1_VSn1_VWA2_VWB2_WSGRA0_WSGRB0_WS64_WG64_4_1_WGM1_WGMXCC4_WGMXCCGn1
    SolutionIndex: 183
    SolutionNameMin: Cijk_Ailk_Bjlk_I8II_BH_UserArgs_MT128x128x64_MI16x16x1_SN_LDSB1_AFC0_AFEM1_AFEM1_ASEM1_CLR1_CADS0_DTVA0_DTVB0_EPS0_FDSI0_GRPM1_GRVWA16_GRVWB16_GSUn1_GSUAMBSK_GSUC1_GSUWGMRR1_GLS0_ISA942_IU1_K1_LBSPPA1024_LBSPPB1024_LBSPPM0_LPA64_LPB64_LPM0_LRVW8_LWPMn1_MIAV0_MIWT4_4_MO40_NTn1_NTA0_NTB0_NTC0_NTD4_NTM0_NEPBS8_NLCA1_NLCB1_ONLL1_PGR2_PLR1_PKA1_SIA3_SS1_SU0_SUM1_SUS0_SPO0_SRVW0_SSO0_SVW4_SK0_SKXCCM0_TLDS0_ULSGRO0_USL1_UIOFGRO0_USFGROn1_VSn1_VWA4_VWB4_WSGRA0_WSGRB0_WS64_WG32_8_1_WGM1_WGMXCC4_WGMXCCGn1
    SolutionIndex: 184
    SolutionNameMin: Cijk_Ailk_Bjlk_I8II_BH_UserArgs_MT64x128x128_MI16x16x1_SN_LDSB1_AFC0_AFEM1_AFEM1_ASEM1_CLR1_CADS0_DTVA0_DTVB0_EPS0_FDSI0_GRPM1_GRVWA16_GRVWB16_GSUn1_GSUAMBSK_GSUC1_GSUWGMRR1_GLS0_ISA942_IU1_K1_LBSPPA512_LBSPPB1024_LBSPPM0_LPA32_LPB64_LPM0_LRVW8_LWPMn1_MIAV0_MIWT2_4_MO40_NTn1_NTA0_NTB0_NTC0_NTD4_NTM0_NEPBS8_NLCA1_NLCB1_ONLL1_PGR2_PLR1_PKA1_SIA3_SS1_SU0_SUM1_SUS0_SPO0_SRVW0_SSO0_SVW2_SK0_SKXCCM0_TLDS0_ULSGRO0_USL1_UIOFGRO0_USFGROn1_VSn1_VWA2_VWB4_WSGRA0_WSGRB0_WS64_WG32_8_1_WGM1_WGMXCC4_WGMXCCGn1
    SolutionIndex: 185
    SolutionNameMin: Cijk_Ailk_Bjlk_I8II_BH_UserArgs_MT128x64x256_MI16x16x1_SN_LDSB1_AFC0_AFEM1_AFEM1_ASEM1_CLR1_CADS0_DTVA0_DTVB0_EPS0_FDSI0_GRPM1_GRVWA16_GRVWB16_GSUn1_GSUAMBSK_GSUC1_GSUWGMRR1_GLS0_ISA942_IU1_K1_LBSPPA1024_LBSPPB512_LBSPPM0_LPA32_LPB64_LPM0_LRVW8_LWPMn1_MIAV0_MIWT2_4_MO40_NTn1_NTA0_NTB0_NTC0_NTD4_NTM0_NEPBS8_NLCA1_NLCB1_ONLL1_PGR2_PLR1_PKA1_SIA3_SS1_SU0_SUM1_SUS0_SPO0_SRVW0_SSO0_SVW2_SK0_SKXCCM0_TLDS0_ULSGRO0_USL1_UIOFGRO0_USFGROn1_VSn1_VWA2_VWB4_WSGRA0_WSGRB0_WS64_WG64_4_1_WGM1_WGMXCC4_WGMXCCGn1
    SolutionIndex: 186
    SolutionNameMin: Cijk_Ailk_Bjlk_I8II_BH_UserArgs_MT256x128x128_MI32x32x1_SN_LDSB1_AFC0_AFEM1_AFEM1_ASEM1_CLR1_CADS0_DTVA0_DTVB0_EPS0_FDSI0_GRPM1_GRVWA16_GRVWB16_GSUn1_GSUAMBSK_GSUC1_GSUWGMRR1_GLS0_ISA942_IU1_K1_LBSPPA0_LBSPPB0_LBSPPM0_LPA0_LPB0_LPM0_LRVW8_LWPMn1_MIAV0_MIWT2_4_MO40_NTn1_NTA0_NTB0_NTC0_NTD4_NTM0_NEPBS8_NLCA1_NLCB1_ONLL1_PGR2_PLR1_PKA1_SIA3_SS1_SU0_SUM1_SUS0_SPO0_SRVW0_SSO0_SVW2_SK0_SKXCCM0_TLDS0_ULSGRO0_USL1_UIOFGRO0_USFGROn1_VSn1_VWA2_VWB4_WSGRA0_WSGRB0_WS64_WG128_2_1_WGM1_WGMXCC4_WGMXCCGn1
    SolutionIndex: 187
    SolutionNameMin: Cijk_Ailk_Bjlk_I8II_BH_UserArgs_MT96x128x128_MI16x16x1_SN_LDSB1_AFC0_AFEM1_AFEM1_ASEM1_CLR1_CADS0_DTVA0_DTVB0_EPS0_FDSI0_GRPM1_GRVWA16_GRVWB16_GSUn1_GSUAMBSK_GSUC1_GSUWGMRR1_GLS0_ISA942_IU1_K1_LBSPPA768_LBSPPB1024_LBSPPM0_LPA16_LPB64_LPM0_LRVW8_LWPMn1_MIAV0_MIWT3_4_MO40_NTn1_NTA0_NTB0_NTC0_NTD4_NTM0_NEPBS6_NLCA1_NLCB1_ONLL1_PGR2_PLR1_PKA1_SIA3_SS1_SU0_SUM1_SUS0_SPO0_SRVW0_SSO0_SVW1_SK0_SKXCCM0_TLDS0_ULSGRO0_USL1_UIOFGRO0_USFGROn1_VSn1_VWA1_VWB4_WSGRA0_WSGRB0_WS64_WG32_8_1_WGM1_WGMXCC4_WGMXCCGn1
    SolutionIndex: 188
    SolutionNameMin: Cijk_Ailk_Bjlk_I8II_BH_UserArgs_MT256x128x64_MI16x16x1_SN_LDSB1_AFC0_AFEM1_AFEM1_ASEM1_CLR1_CADS0_DTVA0_DTVB0_EPS0_FDSI0_GRPM1_GRVWA16_GRVWB16_GSUn1_GSUAMBSK_GSUC1_GSUWGMRR1_GLS0_ISA942_IU1_K1_LBSPPA2048_LBSPPB1024_LBSPPM0_LPA64_LPB64_LPM0_LRVW8_LWPMn1_MIAV0_MIWT8_4_MO40_NTn1_NTA0_NTB0_NTC0_NTD4_NTM0_NEPBS8_NLCA1_NLCB1_ONLL1_PGR2_PLR1_PKA1_SIA3_SS1_SU0_SUM1_SUS0_SPO0_SRVW0_SSO0_SVW8_SK0_SKXCCM0_TLDS0_ULSGRO0_USL1_UIOFGRO0_USFGROn1_VSn1_VWA8_VWB4_WSGRA0_WSGRB0_WS64_WG32_8_1_WGM1_WGMXCC4_WGMXCCGn1
    SolutionIndex: 189
    SolutionNameMin: Cijk_Ailk_Bjlk_I8II_BH_UserArgs_MT128x128x128_MI16x16x1_SN_LDSB1_AFC0_AFEM1_AFEM1_ASEM1_CLR1_CADS0_DTVA0_DTVB0_EPS0_FDSI0_GRPM1_GRVWA16_GRVWB16_GSUn1_GSUAMBSK_GSUC1_GSUWGMRR1_GLS0_ISA942_IU1_K1_LBSPPA1024_LBSPPB1024_LBSPPM0_LPA64_LPB64_LPM0_LRVW8_LWPMn1_MIAV0_MIWT4_4_MO40_NTn1_NTA0_NTB0_NTC0_NTD4_NTM0_NEPBS8_NLCA1_NLCB1_ONLL1_PGR2_PLR1_PKA1_SIA3_SS1_SU0_SUM1_SUS0_SPO0_SRVW0_SSO0_SVW4_SK0_SKXCCM0_TLDS0_ULSGRO0_USL1_UIOFGRO0_USFGROn1_VSn1_VWA4_VWB4_WSGRA0_WSGRB0_WS64_WG32_8_1_WGM1_WGMXCC4_WGMXCCGn1
    SolutionIndex: 190
    SolutionNameMin: Cijk_Ailk_Bjlk_I8II_BH_UserArgs_MT512x128x64_MI32x32x1_SN_LDSB1_AFC0_AFEM1_AFEM1_ASEM1_CLR1_CADS0_DTVA0_DTVB0_EPS0_FDSI0_GRPM1_GRVWA16_GRVWB16_GSUn1_GSUAMBSK_GSUC1_GSUWGMRR1_GLS0_ISA942_IU1_K1_LBSPPA0_LBSPPB0_LBSPPM0_LPA0_LPB0_LPM0_LRVW8_LWPMn1_MIAV0_MIWT4_4_MO40_NTn1_NTA0_NTB0_NTC0_NTD4_NTM0_NEPBS8_NLCA1_NLCB1_ONLL1_PGR2_PLR1_PKA1_SIA3_SS1_SU0_SUM1_SUS0_SPO0_SRVW0_SSO0_SVW4_SK0_SKXCCM0_TLDS0_ULSGRO0_USL1_UIOFGRO0_USFGROn1_VSn1_VWA4_VWB4_WSGRA0_WSGRB0_WS64_WG128_2_1_WGM1_WGMXCC4_WGMXCCGn1
    SolutionIndex: 191
    SolutionNameMin: Cijk_Ailk_Bjlk_I8II_BH_UserArgs_MT192x128x64_MI16x16x1_SN_LDSB1_AFC0_AFEM1_AFEM1_ASEM1_CLR1_CADS0_DTVA0_DTVB0_EPS0_FDSI0_GRPM1_GRVWA16_GRVWB16_GSUn1_GSUAMBSK_GSUC1_GSUWGMRR1_GLS0_ISA942_IU1_K1_LBSPPA1536_LBSPPB1024_LBSPPM0_LPA32_LPB64_LPM0_LRVW8_LWPMn1_MIAV0_MIWT6_4_MO40_NTn1_NTA0_NTB0_NTC0_NTD4_NTM0_NEPBS6_NLCA1_NLCB1_ONLL1_PGR2_PLR1_PKA1_SIA3_SS1_SU0_SUM1_SUS0_SPO0_SRVW0_SSO0_SVW2_SK0_SKXCCM0_TLDS0_ULSGRO0_USL1_UIOFGRO0_USFGROn1_VSn1_VWA2_VWB4_WSGRA0_WSGRB0_WS64_WG32_8_1_WGM1_WGMXCC4_WGMXCCGn1
    SolutionIndex: 192
    SolutionNameMin: Cijk_Ailk_Bjlk_I8II_BH_UserArgs_MT256x128x64_MI16x16x1_SN_LDSB1_AFC0_AFEM1_AFEM1_ASEM1_CLR1_CADS0_DTVA0_DTVB0_EPS0_FDSI0_GRPM1_GRVWA16_GRVWB16_GSUn1_GSUAMBSK_GSUC1_GSUWGMRR1_GLS0_ISA942_IU1_K1_LBSPPA2048_LBSPPB1024_LBSPPM0_LPA64_LPB64_LPM0_LRVW8_LWPMn1_MIAV0_MIWT4_8_MO40_NTn1_NTA0_NTB0_NTC0_NTD4_NTM0_NEPBS8_NLCA1_NLCB1_ONLL1_PGR2_PLR1_PKA1_SIA3_SS1_SU0_SUM1_SUS0_SPO0_SRVW0_SSO0_SVW4_SK0_SKXCCM0_TLDS0_ULSGRO0_USL1_UIOFGRO0_USFGROn1_VSn1_VWA4_VWB4_WSGRA0_WSGRB0_WS64_WG64_4_1_WGM1_WGMXCC4_WGMXCCGn1
    SolutionIndex: 193
    SolutionNameMin: Cijk_Ailk_Bjlk_I8II_BH_UserArgs_MT128x128x128_MI16x16x1_SN_LDSB1_AFC0_AFEM1_AFEM1_ASEM1_CLR1_CADS0_DTVA0_DTVB0_EPS0_FDSI0_GRPM1_GRVWA16_GRVWB16_GSUn1_GSUAMBSK_GSUC1_GSUWGMRR1_GLS0_ISA942_IU1_K1_LBSPPA1024_LBSPPB1024_LBSPPM0_LPA64_LPB32_LPM0_LRVW8_LWPMn1_MIAV0_MIWT4_4_MO40_NTn1_NTA0_NTB0_NTC0_NTD4_NTM0_NEPBS8_NLCA1_NLCB1_ONLL1_PGR2_PLR1_PKA1_SIA3_SS1_SU0_SUM1_SUS0_SPO0_SRVW0_SSO0_SVW4_SK0_SKXCCM0_TLDS0_ULSGRO0_USL1_UIOFGRO0_USFGROn1_VSn1_VWA4_VWB2_WSGRA0_WSGRB0_WS64_WG32_8_1_WGM1_WGMXCC4_WGMXCCGn1
    SolutionIndex: 194
    SolutionNameMin: Cijk_Ailk_Bjlk_I8II_BH_UserArgs_MT256x128x64_MI32x32x1_SN_LDSB1_AFC0_AFEM1_AFEM1_ASEM1_CLR1_CADS0_DTVA0_DTVB0_EPS0_FDSI0_GRPM1_GRVWA16_GRVWB16_GSUn1_GSUAMBSK_GSUC1_GSUWGMRR1_GLS0_ISA942_IU1_K1_LBSPPA0_LBSPPB0_LBSPPM0_LPA0_LPB0_LPM0_LRVW8_LWPMn1_MIAV0_MIWT4_2_MO40_NTn1_NTA0_NTB0_NTC0_NTD4_NTM0_NEPBS8_NLCA1_NLCB1_ONLL1_PGR2_PLR1_PKA1_SIA3_SS1_SU0_SUM1_SUS0_SPO0_SRVW0_SSO0_SVW4_SK0_SKXCCM0_TLDS0_ULSGRO0_USL1_UIOFGRO0_USFGROn1_VSn1_VWA4_VWB2_WSGRA0_WSGRB0_WS64_WG64_4_1_WGM1_WGMXCC4_WGMXCCGn1
    SolutionIndex: 195
    SolutionNameMin: Cijk_Ailk_Bjlk_I8II_BH_UserArgs_MT384x128x64_MI16x16x1_SN_LDSB1_AFC0_AFEM1_AFEM1_ASEM1_CLR1_CADS0_DTVA0_DTVB0_EPS0_FDSI0_GRPM1_GRVWA16_GRVWB16_GSUn1_GSUAMBSK_GSUC1_GSUWGMRR1_GLS0_ISA942_IU1_K1_LBSPPA3072_LBSPPB1024_LBSPPM0_LPA32_LPB64_LPM0_LRVW8_LWPMn1_MIAV0_MIWT6_8_MO40_NTn1_NTA0_NTB0_NTC0_NTD4_NTM0_NEPBS6_NLCA1_NLCB1_ONLL1_PGR2_PLR1_PKA1_SIA3_SS1_SU0_SUM1_SUS0_SPO0_SRVW0_SSO0_SVW2_SK0_SKXCCM0_TLDS0_ULSGRO0_USL1_UIOFGRO0_USFGROn1_VSn1_VWA2_VWB4_WSGRA0_WSGRB0_WS64_WG64_4_1_WGM1_WGMXCC4_WGMXCCGn1
    SolutionIndex: 196
    SolutionNameMin: Cijk_Ailk_Bjlk_I8II_BH_UserArgs_MT384x128x64_MI16x16x1_SN_LDSB1_AFC0_AFEM1_AFEM1_ASEM1_CLR1_CADS0_DTVA0_DTVB0_EPS0_FDSI0_GRPM1_GRVWA16_GRVWB16_GSUn1_GSUAMBSK_GSUC1_GSUWGMRR1_GLS0_ISA942_IU1_K1_LBSPPA3072_LBSPPB1024_LBSPPM0_LPA64_LPB64_LPM0_LRVW8_LWPMn1_MIAV0_MIWT12_4_MO40_NTn1_NTA0_NTB0_NTC0_NTD4_NTM0_NEPBS8_NLCA1_NLCB1_ONLL1_PGR2_PLR1_PKA1_SIA3_SS1_SU0_SUM1_SUS0_SPO0_SRVW0_SSO0_SVW4_SK0_SKXCCM0_TLDS0_ULSGRO0_USL1_UIOFGRO0_USFGROn1_VSn1_VWA4_VWB4_WSGRA0_WSGRB0_WS64_WG32_8_1_WGM1_WGMXCC4_WGMXCCGn1
    SolutionIndex: 197
    SolutionNameMin: Cijk_Ailk_Bjlk_I8II_BH_UserArgs_MT512x128x64_MI32x32x1_SN_LDSB1_AFC0_AFEM1_AFEM1_ASEM1_CLR1_CADS0_DTVA0_DTVB0_EPS0_FDSI0_GRPM1_GRVWA16_GRVWB16_GSUn1_GSUAMBSK_GSUC1_GSUWGMRR1_GLS0_ISA942_IU1_K1_LBSPPA0_LBSPPB0_LBSPPM0_LPA0_LPB0_LPM0_LRVW8_LWPMn1_MIAV0_MIWT4_4_MO40_NTn1_NTA0_NTB0_NTC0_NTD4_NTM0_NEPBS8_NLCA1_NLCB1_ONLL1_PGR2_PLR1_PKA1_SIA3_SS1_SU0_SUM1_SUS0_SPO0_SRVW0_SSO0_SVW4_SK0_SKXCCM0_TLDS0_ULSGRO0_USL1_UIOFGRO0_USFGROn1_VSn1_VWA4_VWB2_WSGRA0_WSGRB0_WS64_WG128_2_1_WGM1_WGMXCC4_WGMXCCGn1
    SolutionIndex: 198
    SolutionNameMin: Cijk_Ailk_Bjlk_I8II_BH_UserArgs_MT512x128x64_MI32x32x1_SN_LDSB1_AFC0_AFEM1_AFEM1_ASEM1_CLR1_CADS0_DTVA0_DTVB0_EPS0_FDSI0_GRPM1_GRVWA16_GRVWB16_GSUn1_GSUAMBSK_GSUC1_GSUWGMRR1_GLS0_ISA942_IU1_K1_LBSPPA0_LBSPPB0_LBSPPM0_LPA0_LPB0_LPM0_LRVW8_LWPMn1_MIAV0_MIWT8_2_MO40_NTn1_NTA0_NTB0_NTC0_NTD4_NTM0_NEPBS8_NLCA1_NLCB1_ONLL1_PGR2_PLR1_PKA1_SIA3_SS1_SU0_SUM1_SUS0_SPO0_SRVW0_SSO0_SVW8_SK0_SKXCCM0_TLDS0_ULSGRO0_USL1_UIOFGRO0_USFGROn1_VSn1_VWA8_VWB2_WSGRA0_WSGRB0_WS64_WG64_4_1_WGM1_WGMXCC4_WGMXCCGn1
    SolutionIndex: 199
    SolutionNameMin: Cijk_Ailk_Bjlk_I8II_BH_UserArgs_MT128x128x64_MI16x16x1_SN_LDSB1_AFC0_AFEM1_AFEM1_ASEM1_CLR1_CADS0_DTVA0_DTVB0_EPS0_FDSI0_GRPM1_GRVWA16_GRVWB16_GSUn1_GSUAMBSK_GSUC1_GSUWGMRR1_GLS0_ISA942_IU1_K1_LBSPPA1024_LBSPPB1024_LBSPPM0_LPA64_LPB32_LPM0_LRVW8_LWPMn1_MIAV0_MIWT4_4_MO40_NTn1_NTA0_NTB0_NTC0_NTD4_NTM0_NEPBS8_NLCA1_NLCB1_ONLL1_PGR2_PLR1_PKA1_SIA3_SS1_SU0_SUM1_SUS0_SPO0_SRVW0_SSO0_SVW4_SK0_SKXCCM0_TLDS0_ULSGRO0_USL1_UIOFGRO0_USFGROn1_VSn1_VWA4_VWB2_WSGRA0_WSGRB0_WS64_WG32_8_1_WGM1_WGMXCC4_WGMXCCGn1
    SolutionIndex: 200
    SolutionNameMin: Cijk_Ailk_Bjlk_I8II_BH_UserArgs_MT192x128x64_MI16x16x1_SN_LDSB1_AFC0_AFEM1_AFEM1_ASEM1_CLR1_CADS0_DTVA0_DTVB0_EPS0_FDSI0_GRPM1_GRVWA16_GRVWB16_GSUn1_GSUAMBSK_GSUC1_GSUWGMRR1_GLS0_ISA942_IU1_K1_LBSPPA1536_LBSPPB1024_LBSPPM0_LPA16_LPB64_LPM0_LRVW8_LWPMn1_MIAV0_MIWT3_8_MO40_NTn1_NTA0_NTB0_NTC0_NTD4_NTM0_NEPBS6_NLCA1_NLCB1_ONLL1_PGR2_PLR1_PKA1_SIA3_SS1_SU0_SUM1_SUS0_SPO0_SRVW0_SSO0_SVW1_SK0_SKXCCM0_TLDS0_ULSGRO0_USL1_UIOFGRO0_USFGROn1_VSn1_VWA1_VWB4_WSGRA0_WSGRB0_WS64_WG64_4_1_WGM1_WGMXCC4_WGMXCCGn1
    SolutionIndex: 201
    SolutionNameMin: Cijk_Ailk_Bjlk_I8II_BH_UserArgs_MT256x128x64_MI32x32x1_SN_LDSB1_AFC0_AFEM1_AFEM1_ASEM1_CLR1_CADS0_DTVA0_DTVB0_EPS0_FDSI0_GRPM1_GRVWA16_GRVWB16_GSUn1_GSUAMBSK_GSUC1_GSUWGMRR1_GLS0_ISA942_IU1_K1_LBSPPA0_LBSPPB0_LBSPPM0_LPA0_LPB0_LPM0_LRVW8_LWPMn1_MIAV0_MIWT2_4_MO40_NTn1_NTA0_NTB0_NTC0_NTD4_NTM0_NEPBS8_NLCA1_NLCB1_ONLL1_PGR2_PLR1_PKA1_SIA3_SS1_SU0_SUM1_SUS0_SPO0_SRVW0_SSO0_SVW2_SK0_SKXCCM0_TLDS0_ULSGRO0_USL1_UIOFGRO0_USFGROn1_VSn1_VWA2_VWB4_WSGRA0_WSGRB0_WS64_WG128_2_1_WGM1_WGMXCC4_WGMXCCGn1
    SolutionIndex: 202
    SolutionNameMin: Cijk_Ailk_Bjlk_I8II_BH_UserArgs_MT512x128x64_MI32x32x1_SN_LDSB1_AFC0_AFEM1_AFEM1_ASEM1_CLR1_CADS0_DTVA0_DTVB0_EPS0_FDSI0_GRPM1_GRVWA16_GRVWB16_GSUn1_GSUAMBSK_GSUC1_GSUWGMRR1_GLS0_ISA942_IU1_K1_LBSPPA0_LBSPPB0_LBSPPM0_LPA0_LPB0_LPM0_LRVW8_LWPMn1_MIAV0_MIWT4_4_MO40_NTn1_NTA0_NTB0_NTC0_NTD4_NTM0_NEPBS8_NLCA1_NLCB1_ONLL1_PGR2_PLR1_PKA1_SIA3_SS1_SU0_SUM1_SUS0_SPO0_SRVW0_SSO4_SVW4_SK0_SKXCCM0_TLDS0_ULSGRO0_USL1_UIOFGRO0_USFGROn1_VSn1_VWA4_VWB4_WSGRA0_WSGRB0_WS64_WG128_2_1_WGM1_WGMXCC4_WGMXCCGn1
    SolutionIndex: 203
    SolutionNameMin: Cijk_Ailk_Bjlk_I8II_BH_UserArgs_MT128x128x64_MI16x16x1_SN_LDSB1_AFC0_AFEM1_AFEM1_ASEM1_CLR1_CADS0_DTVA0_DTVB0_EPS0_FDSI0_GRPM1_GRVWA16_GRVWB16_GSUn1_GSUAMBSK_GSUC1_GSUWGMRR1_GLS0_ISA942_IU1_K1_LBSPPA1024_LBSPPB1024_LBSPPM0_LPA64_LPB64_LPM0_LRVW8_LWPMn1_MIAV0_MIWT4_4_MO40_NTn1_NTA0_NTB0_NTC0_NTD4_NTM0_NEPBS8_NLCA1_NLCB1_ONLL1_PGR2_PLR1_PKA1_SIA3_SS1_SU0_SUM1_SUS0_SPO0_SRVW0_SSO4_SVW4_SK0_SKXCCM0_TLDS0_ULSGRO0_USL1_UIOFGRO0_USFGROn1_VSn1_VWA4_VWB4_WSGRA0_WSGRB0_WS64_WG32_8_1_WGM1_WGMXCC4_WGMXCCGn1
    SolutionIndex: 204
    SolutionNameMin: Cijk_Ailk_Bjlk_I8II_BH_UserArgs_MT256x128x64_MI16x16x1_SN_LDSB1_AFC0_AFEM1_AFEM1_ASEM1_CLR1_CADS0_DTVA0_DTVB0_EPS0_FDSI0_GRPM1_GRVWA16_GRVWB16_GSUn1_GSUAMBSK_GSUC1_GSUWGMRR1_GLS0_ISA942_IU1_K1_LBSPPA2048_LBSPPB1024_LBSPPM0_LPA64_LPB64_LPM0_LRVW8_LWPMn1_MIAV0_MIWT4_8_MO40_NTn1_NTA0_NTB0_NTC0_NTD4_NTM0_NEPBS8_NLCA1_NLCB1_ONLL1_PGR2_PLR1_PKA1_SIA3_SS1_SU0_SUM1_SUS0_SPO0_SRVW0_SSO4_SVW4_SK0_SKXCCM0_TLDS0_ULSGRO0_USL1_UIOFGRO0_USFGROn1_VSn1_VWA4_VWB4_WSGRA0_WSGRB0_WS64_WG64_4_1_WGM1_WGMXCC4_WGMXCCGn1
    SolutionIndex: 205
    SolutionNameMin: Cijk_Ailk_Bjlk_I8II_BH_UserArgs_MT256x128x64_MI16x16x1_SN_LDSB1_AFC0_AFEM1_AFEM1_ASEM1_CLR1_CADS0_DTVA0_DTVB0_EPS0_FDSI0_GRPM1_GRVWA16_GRVWB16_GSUn1_GSUAMBSK_GSUC1_GSUWGMRR1_GLS0_ISA942_IU1_K1_LBSPPA2048_LBSPPB1024_LBSPPM0_LPA64_LPB64_LPM0_LRVW8_LWPMn1_MIAV0_MIWT8_4_MO40_NTn1_NTA0_NTB0_NTC0_NTD4_NTM0_NEPBS8_NLCA1_NLCB1_ONLL1_PGR2_PLR1_PKA1_SIA3_SS1_SU0_SUM1_SUS0_SPO0_SRVW0_SSO4_SVW8_SK0_SKXCCM0_TLDS0_ULSGRO0_USL1_UIOFGRO0_USFGROn1_VSn1_VWA8_VWB4_WSGRA0_WSGRB0_WS64_WG32_8_1_WGM1_WGMXCC4_WGMXCCGn1
    SolutionIndex: 206
    SolutionNameMin: Cijk_Ailk_Bjlk_I8II_BH_UserArgs_MT320x128x64_MI16x16x1_SN_LDSB1_AFC0_AFEM1_AFEM1_ASEM1_CLR1_CADS0_DTVA0_DTVB0_EPS0_FDSI0_GRPM1_GRVWA16_GRVWB16_GSUn1_GSUAMBSK_GSUC1_GSUWGMRR1_GLS0_ISA942_IU1_K1_LBSPPA2560_LBSPPB1024_LBSPPM0_LPA16_LPB64_LPM0_LRVW8_LWPMn1_MIAV0_MIWT5_8_MO40_NTn1_NTA0_NTB0_NTC0_NTD4_NTM0_NEPBS5_NLCA1_NLCB1_ONLL1_PGR2_PLR1_PKA1_SIA3_SS1_SU0_SUM1_SUS0_SPO0_SRVW0_SSO0_SVW1_SK0_SKXCCM0_TLDS0_ULSGRO0_USL1_UIOFGRO0_USFGROn1_VSn1_VWA1_VWB4_WSGRA0_WSGRB0_WS64_WG64_4_1_WGM1_WGMXCC4_WGMXCCGn1
    SolutionIndex: 207
    SolutionNameMin: Cijk_Ailk_Bjlk_I8II_BH_UserArgs_MT16x64x128_MI16x16x1_SN_LDSB1_AFC0_AFEM1_AFEM1_ASEM1_CLR1_CADS0_DTVA0_DTVB0_EPS0_FDSI0_GRPM1_GRVWA1_GRVWB16_GSUn1_GSUAMBSK_GSUC1_GSUWGMRR1_GLS0_ISA942_IU1_K1_LBSPPA128_LBSPPB512_LBSPPM0_LPA16_LPB16_LPM0_LRVW8_LWPMn1_MIAV0_MIWT1_1_MO40_NTn1_NTA0_NTB0_NTC0_NTD4_NTM0_NEPBS8_NLCA1_NLCB1_ONLL1_PGR2_PLR1_PKA1_SIA3_SS1_SU0_SUM1_SUS0_SPO0_SRVW0_SSO0_SVW1_SK0_SKXCCM0_TLDS0_ULSGRO0_USL1_UIOFGRO0_USFGROn1_VSn1_VWA1_VWB1_WSGRA0_WSGRB0_WS64_WG16_16_1_WGM1_WGMXCC4_WGMXCCGn1
    SolutionIndex: 208
    SolutionNameMin: Cijk_Ailk_Bjlk_I8II_BH_UserArgs_MT16x64x256_MI16x16x1_SN_LDSB1_AFC0_AFEM1_AFEM1_ASEM1_CLR1_CADS0_DTVA0_DTVB0_EPS0_FDSI0_GRPM1_GRVWA16_GRVWB16_GSUn1_GSUAMBSK_GSUC1_GSUWGMRR1_GLS0_ISA942_IU1_K1_LBSPPA128_LBSPPB512_LBSPPM0_LPA16_LPB64_LPM0_LRVW8_LWPMn1_MIAV0_MIWT1_4_MO40_NTn1_NTA0_NTB0_NTC0_NTD4_NTM0_NEPBS8_NLCA1_NLCB1_ONLL1_PGR2_PLR1_PKA1_SIA3_SS1_SU0_SUM1_SUS0_SPO0_SRVW0_SSO0_SVW1_SK0_SKXCCM0_TLDS0_ULSGRO0_USL1_UIOFGRO0_USFGROn1_VSn1_VWA1_VWB4_WSGRA0_WSGRB0_WS64_WG16_4_4_WGM1_WGMXCC4_WGMXCCGn1
    SolutionIndex: 209
    SolutionNameMin: Cijk_Ailk_Bjlk_I8II_BH_UserArgs_MT128x32x128_MI16x16x1_SN_LDSB0_AFC0_AFEM1_AFEM1_ASEM1_CLR1_CADS0_DTVA0_DTVB0_EPS0_FDSI0_GRPM1_GRVWA16_GRVWB16_GSUn1_GSUAMBSK_GSUC1_GSUWGMRR1_GLS0_ISA942_IU1_K1_LBSPPA1024_LBSPPB256_LBSPPM0_LPA64_LPB16_LPM0_LRVW8_LWPMn1_MIAV0_MIWT4_1_MO40_NTn1_NTA0_NTB0_NTC0_NTD4_NTM0_NEPBS8_NLCA1_NLCB1_ONLL1_PGR2_PLR1_PKA1_SIA3_SS1_SU0_SUM1_SUS0_SPO0_SRVW0_SSO0_SVW4_SK0_SKXCCM0_TLDS0_ULSGRO0_USL1_UIOFGRO0_USFGROn1_VSn1_VWA4_VWB1_WSGRA0_WSGRB0_WS64_WG32_8_1_WGM1_WGMXCC4_WGMXCCGn1
    SolutionIndex: 210
    SolutionNameMin: Cijk_Ailk_Bjlk_I8II_BH_UserArgs_MT256x32x128_MI16x16x1_SN_LDSB1_AFC0_AFEM1_AFEM1_ASEM1_CLR1_CADS0_DTVA0_DTVB0_EPS0_FDSI0_GRPM1_GRVWA16_GRVWB16_GSUn1_GSUAMBSK_GSUC1_GSUWGMRR1_GLS0_ISA942_IU1_K1_LBSPPA2048_LBSPPB256_LBSPPM0_LPA32_LPB32_LPM0_LRVW8_LWPMn1_MIAV0_MIWT4_2_MO40_NTn1_NTA0_NTB0_NTC0_NTD4_NTM0_NEPBS8_NLCA1_NLCB1_ONLL1_PGR2_PLR1_PKA1_SIA3_SS1_SU0_SUM1_SUS0_SPO0_SRVW0_SSO0_SVW4_SK0_SKXCCM0_TLDS0_ULSGRO0_USL1_UIOFGRO0_USFGROn1_VSn1_VWA4_VWB2_WSGRA0_WSGRB0_WS64_WG64_4_1_WGM1_WGMXCC4_WGMXCCGn1
    SolutionIndex: 211
    SolutionNameMin: Cijk_Ailk_Bjlk_I8II_BH_UserArgs_MT64x96x256_MI16x16x1_SN_LDSB1_AFC0_AFEM1_AFEM1_ASEM1_CLR1_CADS0_DTVA0_DTVB0_EPS0_FDSI0_GRPM1_GRVWA16_GRVWB16_GSUn1_GSUAMBSK_GSUC1_GSUWGMRR1_GLS0_ISA942_IU1_K1_LBSPPA512_LBSPPB768_LBSPPM0_LPA64_LPB16_LPM0_LRVW8_LWPMn1_MIAV0_MIWT4_3_MO40_NTn1_NTA0_NTB0_NTC0_NTD4_NTM0_NEPBS8_NLCA1_NLCB1_ONLL1_PGR2_PLR1_PKA1_SIA3_SS1_SU0_SUM1_SUS0_SPO0_SRVW0_SSO0_SVW4_SK0_SKXCCM0_TLDS0_ULSGRO0_USL1_UIOFGRO0_USFGROn1_VSn1_VWA4_VWB1_WSGRA0_WSGRB0_WS64_WG16_8_2_WGM1_WGMXCC4_WGMXCCGn1
    SolutionIndex: 212
    SolutionNameMin: Cijk_Ailk_Bjlk_I8II_BH_UserArgs_MT32x64x256_MI16x16x1_SN_LDSB1_AFC0_AFEM1_AFEM1_ASEM1_CLR1_CADS0_DTVA0_DTVB0_EPS0_FDSI0_GRPM1_GRVWA16_GRVWB16_GSUn1_GSUAMBSK_GSUC1_GSUWGMRR1_GLS0_ISA942_IU1_K1_LBSPPA256_LBSPPB512_LBSPPM0_LPA16_LPB64_LPM0_LRVW8_LWPMn1_MIAV0_MIWT1_4_MO40_NTn1_NTA0_NTB0_NTC0_NTD4_NTM0_NEPBS8_NLCA1_NLCB1_ONLL1_PGR2_PLR1_PKA1_SIA3_SS1_SU0_SUM1_SUS0_SPO0_SRVW0_SSO0_SVW1_SK0_SKXCCM0_TLDS0_ULSGRO0_USL1_UIOFGRO0_USFGROn1_VSn1_VWA1_VWB4_WSGRA0_WSGRB0_WS64_WG32_4_2_WGM1_WGMXCC4_WGMXCCGn1
    SolutionIndex: 213
    SolutionNameMin: Cijk_Ailk_Bjlk_I8II_BH_UserArgs_MT64x160x128_MI16x16x1_SN_LDSB1_AFC0_AFEM1_AFEM1_ASEM1_CLR1_CADS0_DTVA0_DTVB0_EPS0_FDSI0_GRPM1_GRVWA16_GRVWB16_GSUn1_GSUAMBSK_GSUC1_GSUWGMRR1_GLS0_ISA942_IU1_K1_LBSPPA512_LBSPPB1280_LBSPPM0_LPA64_LPB16_LPM0_LRVW8_LWPMn1_MIAV0_MIWT4_5_MO40_NTn1_NTA0_NTB0_NTC0_NTD4_NTM0_NEPBS8_NLCA1_NLCB1_ONLL1_PGR2_PLR1_PKA1_SIA3_SS1_SU0_SUM1_SUS0_SPO0_SRVW0_SSO0_SVW4_SK0_SKXCCM0_TLDS0_ULSGRO0_USL1_UIOFGRO0_USFGROn1_VSn1_VWA4_VWB1_WSGRA0_WSGRB0_WS64_WG16_8_2_WGM1_WGMXCC4_WGMXCCGn1
    SolutionIndex: 214
    SolutionNameMin: Cijk_Ailk_Bjlk_I8II_BH_UserArgs_MT64x160x128_MI16x16x1_SN_LDSB1_AFC0_AFEM1_AFEM1_ASEM1_CLR1_CADS0_DTVA0_DTVB0_EPS0_FDSI0_GRPM1_GRVWA16_GRVWB16_GSUn1_GSUAMBSK_GSUC1_GSUWGMRR1_GLS0_ISA942_IU1_K1_LBSPPA512_LBSPPB1280_LBSPPM0_LPA32_LPB16_LPM0_LRVW8_LWPMn1_MIAV0_MIWT4_5_MO40_NTn1_NTA0_NTB0_NTC0_NTD4_NTM0_NEPBS8_NLCA1_NLCB1_ONLL1_PGR2_PLR1_PKA1_SIA3_SS1_SU0_SUM1_SUS0_SPO0_SRVW0_SSO0_SVW4_SK0_SKXCCM0_TLDS0_ULSGRO0_USL1_UIOFGRO0_USFGROn1_VSn1_VWA4_VWB1_WSGRA0_WSGRB0_WS64_WG16_8_2_WGM1_WGMXCC4_WGMXCCGn1
    SolutionIndex: 215
    SolutionNameMin: Cijk_Ailk_Bjlk_I8II_BH_UserArgs_MT384x64x64_MI16x16x1_SN_LDSB1_AFC0_AFEM1_AFEM1_ASEM1_CLR1_CADS0_DTVA0_DTVB0_EPS0_FDSI0_GRPM1_GRVWA16_GRVWB16_GSUn1_GSUAMBSK_GSUC1_GSUWGMRR1_GLS0_ISA942_IU1_K1_LBSPPA3072_LBSPPB512_LBSPPM0_LPA32_LPB32_LPM0_LRVW8_LWPMn1_MIAV0_MIWT6_4_MO40_NTn1_NTA0_NTB0_NTC0_NTD4_NTM0_NEPBS6_NLCA1_NLCB1_ONLL1_PGR2_PLR1_PKA1_SIA3_SS1_SU0_SUM1_SUS0_SPO0_SRVW0_SSO4_SVW2_SK0_SKXCCM0_TLDS0_ULSGRO0_USL1_UIOFGRO0_USFGROn1_VSn1_VWA2_VWB2_WSGRA0_WSGRB0_WS64_WG64_4_1_WGM1_WGMXCC4_WGMXCCGn1
    SolutionIndex: 216
    SolutionNameMin: Cijk_Ailk_Bjlk_I8II_BH_UserArgs_MT384x64x64_MI16x16x1_SN_LDSB1_AFC0_AFEM1_AFEM1_ASEM1_CLR1_CADS0_DTVA0_DTVB0_EPS0_FDSI0_GRPM1_GRVWA16_GRVWB16_GSUn1_GSUAMBSK_GSUC1_GSUWGMRR1_GLS0_ISA942_IU1_K1_LBSPPA3072_LBSPPB512_LBSPPM0_LPA32_LPB64_LPM0_LRVW8_LWPMn1_MIAV0_MIWT6_4_MO40_NTn1_NTA0_NTB0_NTC0_NTD4_NTM0_NEPBS6_NLCA1_NLCB1_ONLL1_PGR2_PLR1_PKA1_SIA3_SS1_SU0_SUM1_SUS0_SPO0_SRVW0_SSO4_SVW2_SK0_SKXCCM0_TLDS0_ULSGRO0_USL1_UIOFGRO0_USFGROn1_VSn1_VWA2_VWB4_WSGRA0_WSGRB0_WS64_WG64_4_1_WGM1_WGMXCC4_WGMXCCGn1
    SolutionIndex: 217
    SolutionNameMin: Cijk_Ailk_Bjlk_I8II_BH_UserArgs_MT512x64x64_MI32x32x1_SN_LDSB1_AFC0_AFEM1_AFEM1_ASEM1_CLR1_CADS0_DTVA0_DTVB0_EPS0_FDSI0_GRPM1_GRVWA16_GRVWB16_GSUn1_GSUAMBSK_GSUC1_GSUWGMRR1_GLS0_ISA942_IU1_K1_LBSPPA0_LBSPPB0_LBSPPM0_LPA0_LPB0_LPM0_LRVW8_LWPMn1_MIAV0_MIWT4_2_MO40_NTn1_NTA0_NTB0_NTC0_NTD4_NTM0_NEPBS8_NLCA1_NLCB1_ONLL1_PGR2_PLR1_PKA1_SIA3_SS1_SU0_SUM1_SUS0_SPO0_SRVW0_SSO4_SVW4_SK0_SKXCCM0_TLDS0_ULSGRO0_USL1_UIOFGRO0_USFGROn1_VSn1_VWA4_VWB2_WSGRA0_WSGRB0_WS64_WG128_2_1_WGM1_WGMXCC4_WGMXCCGn1
    SolutionIndex: 218
    SolutionNameMin: Cijk_Ailk_Bjlk_I8II_BH_UserArgs_MT16x32x128_MI16x16x1_SN_LDSB1_AFC0_AFEM1_AFEM1_ASEM1_CLR1_CADS0_DTVA0_DTVB0_EPS0_FDSI0_GRPM1_GRVWA1_GRVWB16_GSUn1_GSUAMBSK_GSUC1_GSUWGMRR1_GLS0_ISA942_IU1_K1_LBSPPA128_LBSPPB256_LBSPPM0_LPA16_LPB16_LPM0_LRVW8_LWPMn1_MIAV0_MIWT1_1_MO40_NTn1_NTA0_NTB0_NTC0_NTD4_NTM0_NEPBS8_NLCA1_NLCB1_ONLL1_PGR2_PLR1_PKA1_SIA3_SS1_SU0_SUM1_SUS0_SPO0_SRVW0_SSO0_SVW1_SK0_SKXCCM0_TLDS0_ULSGRO0_USL1_UIOFGRO0_USFGROn1_VSn1_VWA1_VWB1_WSGRA0_WSGRB0_WS64_WG16_8_2_WGM1_WGMXCC4_WGMXCCGn1
    SolutionIndex: 219
    SolutionNameMin: Cijk_Ailk_Bjlk_I8II_BH_UserArgs_MT16x64x256_MI16x16x1_SN_LDSB0_AFC0_AFEM1_AFEM1_ASEM1_CLR1_CADS0_DTVA0_DTVB0_EPS0_FDSI0_GRPM1_GRVWA1_GRVWB16_GSUn1_GSUAMBSK_GSUC1_GSUWGMRR1_GLS0_ISA942_IU1_K1_LBSPPA128_LBSPPB512_LBSPPM0_LPA16_LPB16_LPM0_LRVW8_LWPMn1_MIAV0_MIWT1_1_MO40_NTn1_NTA0_NTB0_NTC0_NTD4_NTM0_NEPBS8_NLCA1_NLCB1_ONLL1_PGR2_PLR1_PKA1_SIA3_SS1_SU0_SUM1_SUS0_SPO0_SRVW0_SSO0_SVW1_SK0_SKXCCM0_TLDS0_ULSGRO0_USL1_UIOFGRO0_USFGROn1_VSn1_VWA1_VWB1_WSGRA0_WSGRB0_WS64_WG16_16_1_WGM1_WGMXCC4_WGMXCCGn1
    SolutionIndex: 220
    SolutionNameMin: Cijk_Ailk_Bjlk_I8II_BH_UserArgs_MT16x64x256_MI16x16x1_SN_LDSB0_AFC0_AFEM1_AFEM1_ASEM1_CLR1_CADS0_DTVA0_DTVB0_EPS0_FDSI0_GRPM1_GRVWA16_GRVWB16_GSUn1_GSUAMBSK_GSUC1_GSUWGMRR1_GLS0_ISA942_IU1_K1_LBSPPA128_LBSPPB512_LBSPPM0_LPA16_LPB16_LPM0_LRVW8_LWPMn1_MIAV0_MIWT1_1_MO40_NTn1_NTA0_NTB0_NTC0_NTD4_NTM0_NEPBS8_NLCA1_NLCB1_ONLL1_PGR2_PLR1_PKA1_SIA3_SS1_SU0_SUM1_SUS0_SPO0_SRVW0_SSO0_SVW1_SK0_SKXCCM0_TLDS0_ULSGRO0_USL1_UIOFGRO0_USFGROn1_VSn1_VWA1_VWB1_WSGRA0_WSGRB0_WS64_WG16_16_1_WGM1_WGMXCC4_WGMXCCGn1
    SolutionIndex: 221
    SolutionNameMin: Cijk_Ailk_Bjlk_I8II_BH_UserArgs_MT32x64x256_MI16x16x1_SN_LDSB1_AFC0_AFEM1_AFEM1_ASEM1_CLR1_CADS0_DTVA0_DTVB0_EPS0_FDSI0_GRPM1_GRVWA16_GRVWB16_GSUn1_GSUAMBSK_GSUC1_GSUWGMRR1_GLS0_ISA942_IU1_K1_LBSPPA256_LBSPPB512_LBSPPM0_LPA16_LPB32_LPM0_LRVW8_LWPMn1_MIAV0_MIWT1_2_MO40_NTn1_NTA0_NTB0_NTC0_NTD4_NTM0_NEPBS8_NLCA1_NLCB1_ONLL1_PGR2_PLR1_PKA1_SIA3_SS1_SU0_SUM1_SUS0_SPO0_SRVW0_SSO0_SVW1_SK0_SKXCCM0_TLDS0_ULSGRO0_USL1_UIOFGRO0_USFGROn1_VSn1_VWA1_VWB2_WSGRA0_WSGRB0_WS64_WG32_8_1_WGM1_WGMXCC4_WGMXCCGn1
    SolutionIndex: 222
    SolutionNameMin: Cijk_Ailk_Bjlk_I8II_BH_UserArgs_MT32x128x128_MI16x16x1_SN_LDSB1_AFC0_AFEM1_AFEM1_ASEM1_CLR1_CADS0_DTVA0_DTVB0_EPS0_FDSI0_GRPM1_GRVWA16_GRVWB16_GSUn1_GSUAMBSK_GSUC1_GSUWGMRR1_GLS0_ISA942_IU1_K1_LBSPPA256_LBSPPB1024_LBSPPM0_LPA32_LPB32_LPM0_LRVW8_LWPMn1_MIAV0_MIWT2_2_MO40_NTn1_NTA0_NTB0_NTC0_NTD4_NTM0_NEPBS8_NLCA1_NLCB1_ONLL1_PGR2_PLR1_PKA1_SIA3_SS1_SU0_SUM1_SUS0_SPO0_SRVW0_SSO0_SVW2_SK0_SKXCCM0_TLDS0_ULSGRO0_USL1_UIOFGRO0_USFGROn1_VSn1_VWA2_VWB2_WSGRA0_WSGRB0_WS64_WG16_16_1_WGM1_WGMXCC4_WGMXCCGn1
    SolutionIndex: 223
    SolutionNameMin: Cijk_Ailk_Bjlk_I8II_BH_UserArgs_MT256x64x128_MI16x16x1_SN_LDSB1_AFC0_AFEM1_AFEM1_ASEM1_CLR1_CADS0_DTVA0_DTVB0_EPS0_FDSI0_GRPM1_GRVWA16_GRVWB16_GSUn1_GSUAMBSK_GSUC1_GSUWGMRR1_GLS0_ISA942_IU1_K1_LBSPPA2048_LBSPPB512_LBSPPM0_LPA32_LPB64_LPM0_LRVW8_LWPMn1_MIAV0_MIWT4_4_MO40_NTn1_NTA0_NTB0_NTC0_NTD4_NTM0_NEPBS8_NLCA1_NLCB1_ONLL1_PGR2_PLR1_PKA1_SIA3_SS1_SU0_SUM1_SUS0_SPO0_SRVW0_SSO0_SVW4_SK0_SKXCCM0_TLDS0_ULSGRO0_USL1_UIOFGRO0_USFGROn1_VSn1_VWA4_VWB4_WSGRA0_WSGRB0_WS64_WG64_4_1_WGM1_WGMXCC4_WGMXCCGn1
    SolutionIndex: 224
    SolutionNameMin: Cijk_Ailk_Bjlk_I8II_BH_UserArgs_MT128x64x128_MI16x16x1_SN_LDSB0_AFC0_AFEM1_AFEM1_ASEM1_CLR1_CADS0_DTVA0_DTVB0_EPS0_FDSI0_GRPM1_GRVWA16_GRVWB16_GSUn1_GSUAMBSK_GSUC1_GSUWGMRR1_GLS0_ISA942_IU1_K1_LBSPPA1024_LBSPPB512_LBSPPM0_LPA64_LPB64_LPM0_LRVW8_LWPMn1_MIAV0_MIWT4_4_MO40_NTn1_NTA0_NTB0_NTC0_NTD4_NTM0_NEPBS8_NLCA1_NLCB1_ONLL1_PGR2_PLR1_PKA1_SIA3_SS1_SU0_SUM1_SUS0_SPO0_SRVW0_SSO0_SVW4_SK0_SKXCCM0_TLDS0_ULSGRO0_USL1_UIOFGRO0_USFGROn1_VSn1_VWA4_VWB4_WSGRA0_WSGRB0_WS64_WG32_4_2_WGM1_WGMXCC4_WGMXCCGn1
    SolutionIndex: 225
    SolutionNameMin: Cijk_Ailk_Bjlk_I8II_BH_UserArgs_MT448x64x64_MI16x16x1_SN_LDSB1_AFC0_AFEM1_AFEM1_ASEM1_CLR1_CADS0_DTVA0_DTVB0_EPS0_FDSI0_GRPM1_GRVWA16_GRVWB16_GSUn1_GSUAMBSK_GSUC1_GSUWGMRR1_GLS0_ISA942_IU1_K1_LBSPPA3584_LBSPPB512_LBSPPM0_LPA16_LPB64_LPM0_LRVW8_LWPMn1_MIAV0_MIWT7_4_MO40_NTn1_NTA0_NTB0_NTC0_NTD4_NTM0_NEPBS7_NLCA1_NLCB1_ONLL1_PGR2_PLR1_PKA1_SIA3_SS1_SU0_SUM1_SUS0_SPO0_SRVW0_SSO0_SVW1_SK0_SKXCCM0_TLDS0_ULSGRO0_USL1_UIOFGRO0_USFGROn1_VSn1_VWA1_VWB4_WSGRA0_WSGRB0_WS64_WG64_4_1_WGM1_WGMXCC4_WGMXCCGn1
    SolutionIndex: 226
    SolutionNameMin: Cijk_Ailk_Bjlk_I8II_BH_UserArgs_MT64x192x128_MI16x16x1_SN_LDSB1_AFC0_AFEM1_AFEM1_ASEM1_CLR1_CADS0_DTVA0_DTVB0_EPS0_FDSI0_GRPM1_GRVWA16_GRVWB16_GSUn1_GSUAMBSK_GSUC1_GSUWGMRR1_GLS0_ISA942_IU1_K1_LBSPPA512_LBSPPB1536_LBSPPM0_LPA64_LPB16_LPM0_LRVW8_LWPMn1_MIAV0_MIWT4_3_MO40_NTn1_NTA0_NTB0_NTC0_NTD4_NTM0_NEPBS8_NLCA1_NLCB1_ONLL1_PGR2_PLR1_PKA1_SIA3_SS1_SU0_SUM1_SUS0_SPO0_SRVW0_SSO0_SVW4_SK0_SKXCCM0_TLDS0_ULSGRO0_USL1_UIOFGRO0_USFGROn1_VSn1_VWA4_VWB1_WSGRA0_WSGRB0_WS64_WG16_16_1_WGM1_WGMXCC4_WGMXCCGn1
    SolutionIndex: 227
    SolutionNameMin: Cijk_Ailk_Bjlk_I8II_BH_UserArgs_MT256x192x64_MI16x16x1_SN_LDSB1_AFC0_AFEM1_AFEM1_ASEM1_CLR1_CADS0_DTVA0_DTVB0_EPS0_FDSI0_GRPM1_GRVWA16_GRVWB16_GSUn1_GSUAMBSK_GSUC1_GSUWGMRR1_GLS0_ISA942_IU1_K1_LBSPPA2048_LBSPPB1536_LBSPPM0_LPA64_LPB64_LPM0_LRVW8_LWPMn1_MIAV0_MIWT4_12_MO40_NTn1_NTA0_NTB0_NTC0_NTD4_NTM0_NEPBS8_NLCA1_NLCB1_ONLL1_PGR2_PLR1_PKA1_SIA3_SS1_SU0_SUM1_SUS0_SPO0_SRVW0_SSO0_SVW4_SK0_SKXCCM0_TLDS0_ULSGRO0_USL1_UIOFGRO0_USFGROn1_VSn1_VWA4_VWB4_WSGRA0_WSGRB0_WS64_WG64_4_1_WGM1_WGMXCC4_WGMXCCGn1
    SolutionIndex: 228
    SolutionNameMin: Cijk_Ailk_Bjlk_I8II_BH_UserArgs_MT128x192x64_MI16x16x1_SN_LDSB1_AFC0_AFEM1_AFEM1_ASEM1_CLR1_CADS0_DTVA0_DTVB0_EPS0_FDSI0_GRPM1_GRVWA16_GRVWB16_GSUn1_GSUAMBSK_GSUC1_GSUWGMRR1_GLS0_ISA942_IU1_K1_LBSPPA1024_LBSPPB1536_LBSPPM0_LPA32_LPB32_LPM0_LRVW8_LWPMn1_MIAV0_MIWT4_6_MO40_NTn1_NTA0_NTB0_NTC0_NTD4_NTM0_NEPBS8_NLCA1_NLCB1_ONLL1_PGR2_PLR1_PKA1_SIA3_SS1_SU0_SUM1_SUS0_SPO0_SRVW0_SSO0_SVW4_SK0_SKXCCM0_TLDS0_ULSGRO0_USL1_UIOFGRO0_USFGROn1_VSn1_VWA4_VWB2_WSGRA0_WSGRB0_WS64_WG32_8_1_WGM1_WGMXCC4_WGMXCCGn1
    SolutionIndex: 229
    SolutionNameMin: Cijk_Ailk_Bjlk_I8II_BH_UserArgs_MT192x192x64_MI16x16x1_SN_LDSB1_AFC0_AFEM1_AFEM1_ASEM1_CLR1_CADS0_DTVA0_DTVB0_EPS0_FDSI0_GRPM1_GRVWA16_GRVWB16_GSUn1_GSUAMBSK_GSUC1_GSUWGMRR1_GLS0_ISA942_IU1_K1_LBSPPA1536_LBSPPB1536_LBSPPM0_LPA32_LPB32_LPM0_LRVW8_LWPMn1_MIAV0_MIWT6_6_MO40_NTn1_NTA0_NTB0_NTC0_NTD4_NTM0_NEPBS6_NLCA1_NLCB1_ONLL1_PGR2_PLR1_PKA1_SIA3_SS1_SU0_SUM1_SUS0_SPO0_SRVW0_SSO0_SVW2_SK0_SKXCCM0_TLDS0_ULSGRO0_USL1_UIOFGRO0_USFGROn1_VSn1_VWA2_VWB2_WSGRA0_WSGRB0_WS64_WG32_8_1_WGM1_WGMXCC4_WGMXCCGn1
    SolutionIndex: 230
    SolutionNameMin: Cijk_Ailk_Bjlk_I8II_BH_UserArgs_MT128x192x64_MI16x16x1_SN_LDSB1_AFC0_AFEM1_AFEM1_ASEM1_CLR1_CADS0_DTVA0_DTVB0_EPS0_FDSI0_GRPM1_GRVWA16_GRVWB16_GSUn1_GSUAMBSK_GSUC1_GSUWGMRR1_GLS0_ISA942_IU1_K1_LBSPPA1024_LBSPPB1536_LBSPPM0_LPA64_LPB32_LPM0_LRVW8_LWPMn1_MIAV0_MIWT4_6_MO40_NTn1_NTA0_NTB0_NTC0_NTD4_NTM0_NEPBS8_NLCA1_NLCB1_ONLL1_PGR2_PLR1_PKA1_SIA3_SS1_SU0_SUM1_SUS0_SPO0_SRVW0_SSO0_SVW4_SK0_SKXCCM0_TLDS0_ULSGRO0_USL1_UIOFGRO0_USFGROn1_VSn1_VWA4_VWB2_WSGRA0_WSGRB0_WS64_WG32_8_1_WGM1_WGMXCC4_WGMXCCGn1
    SolutionIndex: 231
    SolutionNameMin: Cijk_Ailk_Bjlk_I8II_BH_UserArgs_MT256x192x128_MI16x16x1_SN_LDSB1_AFC0_AFEM1_AFEM1_ASEM1_CLR1_CADS0_DTVA0_DTVB0_EPS0_FDSI0_GRPM1_GRVWA16_GRVWB16_GSUn1_GSUAMBSK_GSUC1_GSUWGMRR1_GLS0_ISA942_IU1_K1_LBSPPA2048_LBSPPB1536_LBSPPM0_LPA64_LPB64_LPM0_LRVW8_LWPMn1_MIAV0_MIWT4_12_MO40_NTn1_NTA0_NTB0_NTC0_NTD4_NTM0_NEPBS8_NLCA1_NLCB1_ONLL1_PGR2_PLR1_PKA1_SIA3_SS1_SU0_SUM1_SUS0_SPO0_SRVW0_SSO0_SVW4_SK0_SKXCCM0_TLDS0_ULSGRO0_USL1_UIOFGRO0_USFGROn1_VSn1_VWA4_VWB4_WSGRA0_WSGRB0_WS64_WG64_4_1_WGM1_WGMXCC4_WGMXCCGn1
    SolutionIndex: 232
    SolutionNameMin: Cijk_Ailk_Bjlk_I8II_BH_UserArgs_MT256x192x64_MI16x16x1_SN_LDSB1_AFC0_AFEM1_AFEM1_ASEM1_CLR1_CADS0_DTVA0_DTVB0_EPS0_FDSI0_GRPM1_GRVWA16_GRVWB16_GSUn1_GSUAMBSK_GSUC1_GSUWGMRR1_GLS0_ISA942_IU1_K1_LBSPPA2048_LBSPPB1536_LBSPPM0_LPA64_LPB32_LPM0_LRVW8_LWPMn1_MIAV0_MIWT8_6_MO40_NTn1_NTA0_NTB0_NTC0_NTD4_NTM0_NEPBS8_NLCA1_NLCB1_ONLL1_PGR2_PLR1_PKA1_SIA3_SS1_SU0_SUM1_SUS0_SPO0_SRVW0_SSO0_SVW8_SK0_SKXCCM0_TLDS0_ULSGRO0_USL1_UIOFGRO0_USFGROn1_VSn1_VWA8_VWB2_WSGRA0_WSGRB0_WS64_WG32_8_1_WGM1_WGMXCC4_WGMXCCGn1
    SolutionIndex: 233
    SolutionNameMin: Cijk_Ailk_Bjlk_I8II_BH_UserArgs_MT128x192x64_MI16x16x1_SN_LDSB1_AFC0_AFEM1_AFEM1_ASEM1_CLR1_CADS0_DTVA0_DTVB0_EPS0_FDSI0_GRPM1_GRVWA16_GRVWB16_GSUn1_GSUAMBSK_GSUC1_GSUWGMRR1_GLS0_ISA942_IU1_K1_LBSPPA1024_LBSPPB1536_LBSPPM0_LPA64_LPB16_LPM0_LRVW8_LWPMn1_MIAV0_MIWT4_6_MO40_NTn1_NTA0_NTB0_NTC0_NTD4_NTM0_NEPBS8_NLCA1_NLCB1_ONLL1_PGR2_PLR1_PKA1_SIA3_SS1_SU0_SUM1_SUS0_SPO0_SRVW0_SSO0_SVW4_SK0_SKXCCM0_TLDS0_ULSGRO0_USL1_UIOFGRO0_USFGROn1_VSn1_VWA4_VWB1_WSGRA0_WSGRB0_WS64_WG32_8_1_WGM1_WGMXCC4_WGMXCCGn1
    SolutionIndex: 234
    SolutionNameMin: Cijk_Ailk_Bjlk_I8II_BH_UserArgs_MT192x192x64_MI16x16x1_SN_LDSB1_AFC0_AFEM1_AFEM1_ASEM1_CLR1_CADS0_DTVA0_DTVB0_EPS0_FDSI0_GRPM1_GRVWA16_GRVWB16_GSUn1_GSUAMBSK_GSUC1_GSUWGMRR1_GLS0_ISA942_IU1_K1_LBSPPA1536_LBSPPB1536_LBSPPM0_LPA16_LPB32_LPM0_LRVW8_LWPMn1_MIAV0_MIWT6_6_MO40_NTn1_NTA0_NTB0_NTC0_NTD4_NTM0_NEPBS6_NLCA1_NLCB1_ONLL1_PGR2_PLR1_PKA1_SIA3_SS1_SU0_SUM1_SUS0_SPO0_SRVW0_SSO0_SVW2_SK0_SKXCCM0_TLDS0_ULSGRO0_USL1_UIOFGRO0_USFGROn1_VSn1_VWA2_VWB2_WSGRA0_WSGRB0_WS64_WG32_8_1_WGM1_WGMXCC4_WGMXCCGn1
    SolutionIndex: 235
    SolutionNameMin: Cijk_Ailk_Bjlk_I8II_BH_UserArgs_MT128x192x64_MI16x16x1_SN_LDSB1_AFC0_AFEM1_AFEM1_ASEM1_CLR1_CADS0_DTVA0_DTVB0_EPS0_FDSI0_GRPM1_GRVWA16_GRVWB16_GSUn1_GSUAMBSK_GSUC1_GSUWGMRR1_GLS0_ISA942_IU1_K1_LBSPPA1024_LBSPPB1536_LBSPPM0_LPA64_LPB32_LPM0_LRVW8_LWPMn1_MIAV0_MIWT4_6_MO40_NTn1_NTA0_NTB0_NTC0_NTD4_NTM0_NEPBS8_NLCA1_NLCB1_ONLL1_PGR2_PLR1_PKA1_SIA3_SS1_SU0_SUM1_SUS0_SPO0_SRVW0_SSO4_SVW4_SK0_SKXCCM0_TLDS0_ULSGRO0_USL1_UIOFGRO0_USFGROn1_VSn1_VWA4_VWB2_WSGRA0_WSGRB0_WS64_WG32_8_1_WGM1_WGMXCC4_WGMXCCGn1
    SolutionIndex: 236
    SolutionNameMin: Cijk_Ailk_Bjlk_I8II_BH_UserArgs_MT256x192x64_MI16x16x1_SN_LDSB1_AFC0_AFEM1_AFEM1_ASEM1_CLR1_CADS0_DTVA0_DTVB0_EPS0_FDSI0_GRPM1_GRVWA16_GRVWB16_GSUn1_GSUAMBSK_GSUC1_GSUWGMRR1_GLS0_ISA942_IU1_K1_LBSPPA2048_LBSPPB1536_LBSPPM0_LPA64_LPB32_LPM0_LRVW8_LWPMn1_MIAV0_MIWT8_6_MO40_NTn1_NTA0_NTB0_NTC0_NTD4_NTM0_NEPBS8_NLCA1_NLCB1_ONLL1_PGR2_PLR1_PKA1_SIA3_SS1_SU0_SUM1_SUS0_SPO0_SRVW0_SSO4_SVW8_SK0_SKXCCM0_TLDS0_ULSGRO0_USL1_UIOFGRO0_USFGROn1_VSn1_VWA8_VWB2_WSGRA0_WSGRB0_WS64_WG32_8_1_WGM1_WGMXCC4_WGMXCCGn1
    SolutionIndex: 237
    SolutionNameMin: Cijk_Ailk_Bjlk_I8II_BH_UserArgs_MT256x192x64_MI16x16x1_SN_LDSB1_AFC0_AFEM1_AFEM1_ASEM1_CLR1_CADS0_DTVA0_DTVB0_EPS0_FDSI0_GRPM1_GRVWA16_GRVWB16_GSUn1_GSUAMBSK_GSUC1_GSUWGMRR1_GLS0_ISA942_IU1_K1_LBSPPA2048_LBSPPB1536_LBSPPM0_LPA64_LPB64_LPM0_LRVW8_LWPMn1_MIAV0_MIWT4_12_MO40_NTn1_NTA0_NTB0_NTC0_NTD4_NTM0_NEPBS8_NLCA1_NLCB1_ONLL1_PGR2_PLR1_PKA1_SIA3_SS1_SU0_SUM1_SUS0_SPO0_SRVW0_SSO4_SVW4_SK0_SKXCCM0_TLDS0_ULSGRO0_USL1_UIOFGRO0_USFGROn1_VSn1_VWA4_VWB4_WSGRA0_WSGRB0_WS64_WG64_4_1_WGM1_WGMXCC4_WGMXCCGn1
    SolutionIndex: 238
    SolutionNameMin: Cijk_Ailk_Bjlk_I8II_BH_UserArgs_MT256x192x128_MI16x16x1_SN_LDSB1_AFC0_AFEM1_AFEM1_ASEM1_CLR1_CADS0_DTVA0_DTVB0_EPS0_FDSI0_GRPM1_GRVWA16_GRVWB16_GSUn1_GSUAMBSK_GSUC1_GSUWGMRR1_GLS0_ISA942_IU1_K1_LBSPPA2048_LBSPPB1536_LBSPPM0_LPA64_LPB64_LPM0_LRVW8_LWPMn1_MIAV0_MIWT4_12_MO40_NTn1_NTA0_NTB0_NTC0_NTD4_NTM0_NEPBS8_NLCA1_NLCB1_ONLL1_PGR2_PLR1_PKA1_SIA3_SS1_SU0_SUM1_SUS0_SPO0_SRVW0_SSO4_SVW4_SK0_SKXCCM0_TLDS0_ULSGRO0_USL1_UIOFGRO0_USFGROn1_VSn1_VWA4_VWB4_WSGRA0_WSGRB0_WS64_WG64_4_1_WGM1_WGMXCC4_WGMXCCGn1
    SolutionIndex: 239
    SolutionNameMin: Cijk_Ailk_Bjlk_I8II_BH_UserArgs_MT16x32x256_MI16x16x1_SN_LDSB0_AFC0_AFEM1_AFEM1_ASEM1_CLR1_CADS0_DTVA0_DTVB0_EPS0_FDSI0_GRPM1_GRVWA1_GRVWB16_GSUn1_GSUAMBSK_GSUC1_GSUWGMRR1_GLS0_ISA942_IU1_K1_LBSPPA128_LBSPPB256_LBSPPM0_LPA16_LPB16_LPM0_LRVW8_LWPMn1_MIAV0_MIWT1_1_MO40_NTn1_NTA0_NTB0_NTC0_NTD4_NTM0_NEPBS8_NLCA1_NLCB1_ONLL1_PGR2_PLR1_PKA1_SIA3_SS1_SU0_SUM1_SUS0_SPO0_SRVW0_SSO0_SVW1_SK0_SKXCCM0_TLDS0_ULSGRO0_USL1_UIOFGRO0_USFGROn1_VSn1_VWA1_VWB1_WSGRA0_WSGRB0_WS64_WG16_8_2_WGM1_WGMXCC4_WGMXCCGn1
    SolutionIndex: 240
    SolutionNameMin: Cijk_Ailk_Bjlk_I8II_BH_UserArgs_MT16x128x128_MI16x16x1_SN_LDSB0_AFC0_AFEM1_AFEM1_ASEM1_CLR1_CADS0_DTVA0_DTVB0_EPS0_FDSI0_GRPM1_GRVWA1_GRVWB16_GSUn1_GSUAMBSK_GSUC1_GSUWGMRR1_GLS0_ISA942_IU1_K1_LBSPPA128_LBSPPB1024_LBSPPM0_LPA16_LPB32_LPM0_LRVW8_LWPMn1_MIAV0_MIWT1_2_MO40_NTn1_NTA0_NTB0_NTC0_NTD4_NTM0_NEPBS8_NLCA1_NLCB1_ONLL1_PGR2_PLR1_PKA1_SIA3_SS1_SU0_SUM1_SUS0_SPO0_SRVW0_SSO0_SVW1_SK0_SKXCCM0_TLDS0_ULSGRO0_USL1_UIOFGRO0_USFGROn1_VSn1_VWA1_VWB2_WSGRA0_WSGRB0_WS64_WG16_16_1_WGM1_WGMXCC4_WGMXCCGn1
    SolutionIndex: 241
    SolutionNameMin: Cijk_Ailk_Bjlk_I8II_BH_UserArgs_MT16x64x512_MI16x16x1_SN_LDSB1_AFC0_AFEM1_AFEM1_ASEM1_CLR1_CADS0_DTVA0_DTVB0_EPS0_FDSI0_GRPM1_GRVWA16_GRVWB16_GSUn1_GSUAMBSK_GSUC1_GSUWGMRR1_GLS0_ISA942_IU1_K1_LBSPPA128_LBSPPB512_LBSPPM0_LPA16_LPB64_LPM0_LRVW8_LWPMn1_MIAV0_MIWT1_4_MO40_NTn1_NTA0_NTB0_NTC0_NTD4_NTM0_NEPBS8_NLCA1_NLCB1_ONLL1_PGR2_PLR1_PKA1_SIA3_SS1_SU0_SUM1_SUS0_SPO0_SRVW0_SSO0_SVW1_SK0_SKXCCM0_TLDS0_ULSGRO0_USL1_UIOFGRO0_USFGROn1_VSn1_VWA1_VWB4_WSGRA0_WSGRB0_WS64_WG16_4_4_WGM1_WGMXCC4_WGMXCCGn1
    SolutionIndex: 242
    SolutionNameMin: Cijk_Ailk_Bjlk_I8II_BH_UserArgs_MT64x64x128_MI16x16x1_SN_LDSB0_AFC0_AFEM1_AFEM1_ASEM1_CLR1_CADS0_DTVA0_DTVB0_EPS0_FDSI0_GRPM1_GRVWA16_GRVWB16_GSUn1_GSUAMBSK_GSUC1_GSUWGMRR1_GLS0_ISA942_IU1_K1_LBSPPA512_LBSPPB512_LBSPPM0_LPA16_LPB64_LPM0_LRVW8_LWPMn1_MIAV0_MIWT1_4_MO40_NTn1_NTA0_NTB0_NTC0_NTD4_NTM0_NEPBS8_NLCA1_NLCB1_ONLL1_PGR2_PLR1_PKA1_SIA3_SS1_SU0_SUM1_SUS0_SPO0_SRVW0_SSO0_SVW1_SK0_SKXCCM0_TLDS0_ULSGRO0_USL1_UIOFGRO0_USFGROn1_VSn1_VWA1_VWB4_WSGRA0_WSGRB0_WS64_WG64_4_1_WGM1_WGMXCC4_WGMXCCGn1
    SolutionIndex: 243
    SolutionNameMin: Cijk_Ailk_Bjlk_I8II_BH_UserArgs_MT64x128x128_MI16x16x1_SN_LDSB1_AFC0_AFEM1_AFEM1_ASEM1_CLR1_CADS0_DTVA0_DTVB0_EPS0_FDSI0_GRPM1_GRVWA16_GRVWB16_GSUn1_GSUAMBSK_GSUC1_GSUWGMRR1_GLS0_ISA942_IU1_K1_LBSPPA512_LBSPPB1024_LBSPPM0_LPA64_LPB32_LPM0_LRVW8_LWPMn1_MIAV0_MIWT4_2_MO40_NTn1_NTA0_NTB0_NTC0_NTD4_NTM0_NEPBS8_NLCA1_NLCB1_ONLL1_PGR2_PLR1_PKA1_SIA3_SS1_SU0_SUM1_SUS0_SPO0_SRVW0_SSO0_SVW4_SK0_SKXCCM0_TLDS0_ULSGRO0_USL1_UIOFGRO0_USFGROn1_VSn1_VWA4_VWB2_WSGRA0_WSGRB0_WS64_WG16_16_1_WGM1_WGMXCC4_WGMXCCGn1
    SolutionIndex: 244
    SolutionNameMin: Cijk_Ailk_Bjlk_I8II_BH_UserArgs_MT128x128x128_MI16x16x1_SN_LDSB1_AFC0_AFEM1_AFEM1_ASEM1_CLR1_CADS0_DTVA0_DTVB0_EPS0_FDSI0_GRPM1_GRVWA16_GRVWB16_GSUn1_GSUAMBSK_GSUC1_GSUWGMRR1_GLS0_ISA942_IU1_K1_LBSPPA1024_LBSPPB1024_LBSPPM0_LPA32_LPB64_LPM0_LRVW8_LWPMn1_MIAV0_MIWT4_4_MO40_NTn1_NTA0_NTB0_NTC0_NTD4_NTM0_NEPBS8_NLCA1_NLCB1_ONLL1_PGR2_PLR1_PKA1_SIA3_SS1_SU0_SUM1_SUS0_SPO0_SRVW0_SSO0_SVW4_SK0_SKXCCM0_TLDS0_ULSGRO0_USL1_UIOFGRO0_USFGROn1_VSn1_VWA4_VWB4_WSGRA0_WSGRB0_WS64_WG32_8_1_WGM1_WGMXCC4_WGMXCCGn1
    SolutionIndex: 245
    SolutionNameMin: Cijk_Ailk_Bjlk_I8II_BH_UserArgs_MT64x48x256_MI16x16x1_SN_LDSB0_AFC0_AFEM1_AFEM1_ASEM1_CLR1_CADS0_DTVA0_DTVB0_EPS0_FDSI0_GRPM1_GRVWA16_GRVWB16_GSUn1_GSUAMBSK_GSUC1_GSUWGMRR1_GLS0_ISA942_IU1_K1_LBSPPA512_LBSPPB384_LBSPPM0_LPA64_LPB16_LPM0_LRVW8_LWPMn1_MIAV0_MIWT4_3_MO40_NTn1_NTA0_NTB0_NTC0_NTD4_NTM0_NEPBS8_NLCA1_NLCB1_ONLL1_PGR2_PLR1_PKA1_SIA3_SS1_SU0_SUM1_SUS0_SPO0_SRVW0_SSO0_SVW4_SK0_SKXCCM0_TLDS0_ULSGRO0_USL1_UIOFGRO0_USFGROn1_VSn1_VWA4_VWB1_WSGRA0_WSGRB0_WS64_WG16_4_4_WGM1_WGMXCC4_WGMXCCGn1
    SolutionIndex: 246
    SolutionNameMin: Cijk_Ailk_Bjlk_I8II_BH_UserArgs_MT64x48x256_MI16x16x1_SN_LDSB0_AFC0_AFEM1_AFEM1_ASEM1_CLR1_CADS0_DTVA0_DTVB0_EPS0_FDSI0_GRPM1_GRVWA16_GRVWB16_GSUn1_GSUAMBSK_GSUC1_GSUWGMRR1_GLS0_ISA942_IU1_K1_LBSPPA512_LBSPPB384_LBSPPM0_LPA32_LPB16_LPM0_LRVW8_LWPMn1_MIAV0_MIWT4_3_MO40_NTn1_NTA0_NTB0_NTC0_NTD4_NTM0_NEPBS8_NLCA1_NLCB1_ONLL1_PGR2_PLR1_PKA1_SIA3_SS1_SU0_SUM1_SUS0_SPO0_SRVW0_SSO0_SVW4_SK0_SKXCCM0_TLDS0_ULSGRO0_USL1_UIOFGRO0_USFGROn1_VSn1_VWA4_VWB1_WSGRA0_WSGRB0_WS64_WG16_4_4_WGM1_WGMXCC4_WGMXCCGn1
    SolutionIndex: 247
    SolutionNameMin: Cijk_Ailk_Bjlk_I8II_BH_UserArgs_MT96x128x128_MI16x16x1_SN_LDSB0_AFC0_AFEM1_AFEM1_ASEM1_CLR1_CADS0_DTVA0_DTVB0_EPS0_FDSI0_GRPM1_GRVWA16_GRVWB16_GSUn1_GSUAMBSK_GSUC1_GSUWGMRR1_GLS0_ISA942_IU1_K1_LBSPPA768_LBSPPB1024_LBSPPM0_LPA16_LPB64_LPM0_LRVW8_LWPMn1_MIAV0_MIWT3_4_MO40_NTn1_NTA0_NTB0_NTC0_NTD4_NTM0_NEPBS6_NLCA1_NLCB1_ONLL1_PGR2_PLR1_PKA1_SIA3_SS1_SU0_SUM1_SUS0_SPO0_SRVW0_SSO0_SVW1_SK0_SKXCCM0_TLDS0_ULSGRO0_USL1_UIOFGRO0_USFGROn1_VSn1_VWA1_VWB4_WSGRA0_WSGRB0_WS64_WG32_8_1_WGM1_WGMXCC4_WGMXCCGn1
    SolutionIndex: 248
    SolutionNameMin: Cijk_Ailk_Bjlk_I8II_BH_UserArgs_MT64x128x128_MI16x16x1_SN_LDSB1_AFC0_AFEM1_AFEM1_ASEM1_CLR1_CADS0_DTVA0_DTVB0_EPS0_FDSI0_GRPM1_GRVWA16_GRVWB16_GSUn1_GSUAMBSK_GSUC1_GSUWGMRR1_GLS0_ISA942_IU1_K1_LBSPPA512_LBSPPB1024_LBSPPM0_LPA64_LPB64_LPM0_LRVW8_LWPMn1_MIAV0_MIWT4_4_MO40_NTn1_NTA0_NTB0_NTC0_NTD4_NTM0_NEPBS8_NLCA1_NLCB1_ONLL1_PGR2_PLR1_PKA1_SIA3_SS1_SU0_SUM1_SUS0_SPO0_SRVW0_SSO0_SVW4_SK0_SKXCCM0_TLDS0_ULSGRO0_USL1_UIOFGRO0_USFGROn1_VSn1_VWA4_VWB4_WSGRA0_WSGRB0_WS64_WG16_8_2_WGM1_WGMXCC4_WGMXCCGn1
    SolutionIndex: 249
    SolutionNameMin: Cijk_Ailk_Bjlk_I8II_BH_UserArgs_MT64x48x256_MI16x16x1_SN_LDSB1_AFC0_AFEM1_AFEM1_ASEM1_CLR1_CADS0_DTVA0_DTVB0_EPS0_FDSI0_GRPM1_GRVWA16_GRVWB16_GSUn1_GSUAMBSK_GSUC1_GSUWGMRR1_GLS0_ISA942_IU1_K1_LBSPPA512_LBSPPB384_LBSPPM0_LPA16_LPB16_LPM0_LRVW8_LWPMn1_MIAV0_MIWT2_3_MO40_NTn1_NTA0_NTB0_NTC0_NTD4_NTM0_NEPBS8_NLCA1_NLCB1_ONLL1_PGR2_PLR1_PKA1_SIA3_SS1_SU0_SUM1_SUS0_SPO0_SRVW0_SSO0_SVW2_SK0_SKXCCM0_TLDS0_ULSGRO0_USL1_UIOFGRO0_USFGROn1_VSn1_VWA2_VWB1_WSGRA0_WSGRB0_WS64_WG32_4_2_WGM1_WGMXCC4_WGMXCCGn1
    SolutionIndex: 250
    SolutionNameMin: Cijk_Ailk_Bjlk_I8II_BH_UserArgs_MT192x128x128_MI16x16x1_SN_LDSB1_AFC0_AFEM1_AFEM1_ASEM1_CLR1_CADS0_DTVA0_DTVB0_EPS0_FDSI0_GRPM1_GRVWA16_GRVWB16_GSUn1_GSUAMBSK_GSUC1_GSUWGMRR1_GLS0_ISA942_IU1_K1_LBSPPA1536_LBSPPB1024_LBSPPM0_LPA32_LPB64_LPM0_LRVW8_LWPMn1_MIAV0_MIWT6_4_MO40_NTn1_NTA0_NTB0_NTC0_NTD4_NTM0_NEPBS6_NLCA1_NLCB1_ONLL1_PGR2_PLR1_PKA1_SIA3_SS1_SU0_SUM1_SUS0_SPO0_SRVW0_SSO0_SVW2_SK0_SKXCCM0_TLDS0_ULSGRO0_USL1_UIOFGRO0_USFGROn1_VSn1_VWA2_VWB4_WSGRA0_WSGRB0_WS64_WG32_8_1_WGM1_WGMXCC4_WGMXCCGn1
    SolutionIndex: 251
    SolutionNameMin: Cijk_Ailk_Bjlk_I8II_BH_UserArgs_MT256x128x128_MI32x32x1_SN_LDSB1_AFC0_AFEM1_AFEM1_ASEM1_CLR1_CADS0_DTVA0_DTVB0_EPS0_FDSI0_GRPM1_GRVWA16_GRVWB16_GSUn1_GSUAMBSK_GSUC1_GSUWGMRR1_GLS0_ISA942_IU1_K1_LBSPPA0_LBSPPB0_LBSPPM0_LPA0_LPB0_LPM0_LRVW8_LWPMn1_MIAV0_MIWT4_2_MO40_NTn1_NTA0_NTB0_NTC0_NTD4_NTM0_NEPBS8_NLCA1_NLCB1_ONLL1_PGR2_PLR1_PKA1_SIA3_SS1_SU0_SUM1_SUS0_SPO0_SRVW0_SSO0_SVW4_SK0_SKXCCM0_TLDS0_ULSGRO0_USL1_UIOFGRO0_USFGROn1_VSn1_VWA4_VWB2_WSGRA0_WSGRB0_WS64_WG64_4_1_WGM1_WGMXCC4_WGMXCCGn1
    SolutionIndex: 252
    SolutionNameMin: Cijk_Ailk_Bjlk_I8II_BH_UserArgs_MT256x128x128_MI16x16x1_SN_LDSB1_AFC0_AFEM1_AFEM1_ASEM1_CLR1_CADS0_DTVA0_DTVB0_EPS0_FDSI0_GRPM1_GRVWA16_GRVWB16_GSUn1_GSUAMBSK_GSUC1_GSUWGMRR1_GLS0_ISA942_IU1_K1_LBSPPA2048_LBSPPB1024_LBSPPM0_LPA64_LPB64_LPM0_LRVW8_LWPMn1_MIAV0_MIWT8_4_MO40_NTn1_NTA0_NTB0_NTC0_NTD4_NTM0_NEPBS8_NLCA1_NLCB1_ONLL1_PGR2_PLR1_PKA1_SIA3_SS1_SU0_SUM1_SUS0_SPO0_SRVW0_SSO0_SVW8_SK0_SKXCCM0_TLDS0_ULSGRO0_USL1_UIOFGRO0_USFGROn1_VSn1_VWA8_VWB4_WSGRA0_WSGRB0_WS64_WG32_8_1_WGM1_WGMXCC4_WGMXCCGn1
    SolutionIndex: 253
    SolutionNameMin: Cijk_Ailk_Bjlk_I8II_BH_UserArgs_MT192x128x64_MI16x16x1_SN_LDSB1_AFC0_AFEM1_AFEM1_ASEM1_CLR1_CADS0_DTVA0_DTVB0_EPS0_FDSI0_GRPM1_GRVWA16_GRVWB16_GSUn1_GSUAMBSK_GSUC1_GSUWGMRR1_GLS0_ISA942_IU1_K1_LBSPPA1536_LBSPPB1024_LBSPPM0_LPA32_LPB64_LPM0_LRVW8_LWPMn1_MIAV0_MIWT6_4_MO40_NTn1_NTA0_NTB0_NTC0_NTD4_NTM0_NEPBS6_NLCA1_NLCB1_ONLL1_PGR2_PLR1_PKA1_SIA3_SS1_SU0_SUM1_SUS0_SPO0_SRVW0_SSO4_SVW2_SK0_SKXCCM0_TLDS0_ULSGRO0_USL1_UIOFGRO0_USFGROn1_VSn1_VWA2_VWB4_WSGRA0_WSGRB0_WS64_WG32_8_1_WGM1_WGMXCC4_WGMXCCGn1
    SolutionIndex: 254
    SolutionNameMin: Cijk_Ailk_Bjlk_I8II_BH_UserArgs_MT384x128x64_MI16x16x1_SN_LDSB1_AFC0_AFEM1_AFEM1_ASEM1_CLR1_CADS0_DTVA0_DTVB0_EPS0_FDSI0_GRPM1_GRVWA16_GRVWB16_GSUn1_GSUAMBSK_GSUC1_GSUWGMRR1_GLS0_ISA942_IU1_K1_LBSPPA3072_LBSPPB1024_LBSPPM0_LPA64_LPB64_LPM0_LRVW8_LWPMn1_MIAV0_MIWT12_4_MO40_NTn1_NTA0_NTB0_NTC0_NTD4_NTM0_NEPBS8_NLCA1_NLCB1_ONLL1_PGR2_PLR1_PKA1_SIA3_SS1_SU0_SUM1_SUS0_SPO0_SRVW0_SSO4_SVW4_SK0_SKXCCM0_TLDS0_ULSGRO0_USL1_UIOFGRO0_USFGROn1_VSn1_VWA4_VWB4_WSGRA0_WSGRB0_WS64_WG32_8_1_WGM1_WGMXCC4_WGMXCCGn1
    SolutionIndex: 255
    SolutionNameMin: Cijk_Ailk_Bjlk_I8II_BH_UserArgs_MT16x32x128_MI16x16x1_SN_LDSB1_AFC0_AFEM1_AFEM1_ASEM1_CLR1_CADS0_DTVA0_DTVB0_EPS0_FDSI0_GRPM1_GRVWA16_GRVWB16_GSUn1_GSUAMBSK_GSUC1_GSUWGMRR1_GLS0_ISA942_IU1_K1_LBSPPA128_LBSPPB256_LBSPPM0_LPA16_LPB16_LPM0_LRVW8_LWPMn1_MIAV0_MIWT1_1_MO40_NTn1_NTA0_NTB0_NTC0_NTD4_NTM0_NEPBS8_NLCA1_NLCB1_ONLL1_PGR2_PLR1_PKA1_SIA3_SS1_SU0_SUM1_SUS0_SPO0_SRVW0_SSO0_SVW1_SK0_SKXCCM0_TLDS0_ULSGRO0_USL1_UIOFGRO0_USFGROn1_VSn1_VWA1_VWB1_WSGRA0_WSGRB0_WS64_WG16_8_1_WGM1_WGMXCC4_WGMXCCGn1
    SolutionIndex: 256
    SolutionNameMin: Cijk_Ailk_Bjlk_I8II_BH_UserArgs_MT16x64x512_MI16x16x1_SN_LDSB1_AFC0_AFEM1_AFEM1_ASEM1_CLR1_CADS0_DTVA0_DTVB0_EPS0_FDSI0_GRPM1_GRVWA16_GRVWB16_GSUn1_GSUAMBSK_GSUC1_GSUWGMRR1_GLS0_ISA942_IU1_K1_LBSPPA128_LBSPPB512_LBSPPM0_LPA16_LPB32_LPM0_LRVW8_LWPMn1_MIAV0_MIWT1_2_MO40_NTn1_NTA0_NTB0_NTC0_NTD4_NTM0_NEPBS8_NLCA1_NLCB1_ONLL1_PGR2_PLR1_PKA1_SIA3_SS1_SU0_SUM1_SUS0_SPO0_SRVW0_SSO0_SVW1_SK0_SKXCCM0_TLDS0_ULSGRO0_USL1_UIOFGRO0_USFGROn1_VSn1_VWA1_VWB2_WSGRA0_WSGRB0_WS64_WG16_8_2_WGM1_WGMXCC4_WGMXCCGn1
    SolutionIndex: 257
    SolutionNameMin: Cijk_Ailk_Bjlk_I8II_BH_UserArgs_MT32x64x256_MI16x16x1_SN_LDSB1_AFC0_AFEM1_AFEM1_ASEM1_CLR1_CADS0_DTVA0_DTVB0_EPS0_FDSI0_GRPM1_GRVWA16_GRVWB16_GSUn1_GSUAMBSK_GSUC1_GSUWGMRR1_GLS0_ISA942_IU1_K1_LBSPPA256_LBSPPB512_LBSPPM0_LPA32_LPB16_LPM0_LRVW8_LWPMn1_MIAV0_MIWT2_1_MO40_NTn1_NTA0_NTB0_NTC0_NTD4_NTM0_NEPBS8_NLCA1_NLCB1_ONLL1_PGR2_PLR1_PKA1_SIA3_SS1_SU0_SUM1_SUS0_SPO0_SRVW0_SSO0_SVW2_SK0_SKXCCM0_TLDS0_ULSGRO0_USL1_UIOFGRO0_USFGROn1_VSn1_VWA2_VWB1_WSGRA0_WSGRB0_WS64_WG16_16_1_WGM1_WGMXCC4_WGMXCCGn1
    SolutionIndex: 258
    SolutionNameMin: Cijk_Ailk_Bjlk_I8II_BH_UserArgs_MT64x32x256_MI16x16x1_SN_LDSB0_AFC0_AFEM1_AFEM1_ASEM1_CLR1_CADS0_DTVA0_DTVB0_EPS0_FDSI0_GRPM1_GRVWA16_GRVWB16_GSUn1_GSUAMBSK_GSUC1_GSUWGMRR1_GLS0_ISA942_IU1_K1_LBSPPA512_LBSPPB256_LBSPPM0_LPA32_LPB16_LPM0_LRVW8_LWPMn1_MIAV0_MIWT2_1_MO40_NTn1_NTA0_NTB0_NTC0_NTD4_NTM0_NEPBS8_NLCA1_NLCB1_ONLL1_PGR2_PLR1_PKA1_SIA3_SS1_SU0_SUM1_SUS0_SPO0_SRVW0_SSO0_SVW2_SK0_SKXCCM0_TLDS0_ULSGRO0_USL1_UIOFGRO0_USFGROn1_VSn1_VWA2_VWB1_WSGRA0_WSGRB0_WS64_WG32_8_1_WGM1_WGMXCC4_WGMXCCGn1
    SolutionIndex: 259
    SolutionNameMin: Cijk_Ailk_Bjlk_I8II_BH_UserArgs_MT128x64x128_MI16x16x1_SN_LDSB0_AFC0_AFEM1_AFEM1_ASEM1_CLR1_CADS0_DTVA0_DTVB0_EPS0_FDSI0_GRPM1_GRVWA16_GRVWB16_GSUn1_GSUAMBSK_GSUC1_GSUWGMRR1_GLS0_ISA942_IU1_K1_LBSPPA1024_LBSPPB512_LBSPPM0_LPA32_LPB64_LPM0_LRVW8_LWPMn1_MIAV0_MIWT4_4_MO40_NTn1_NTA0_NTB0_NTC0_NTD4_NTM0_NEPBS8_NLCA1_NLCB1_ONLL1_PGR2_PLR1_PKA1_SIA3_SS1_SU0_SUM1_SUS0_SPO0_SRVW0_SSO0_SVW4_SK0_SKXCCM0_TLDS0_ULSGRO0_USL1_UIOFGRO0_USFGROn1_VSn1_VWA4_VWB4_WSGRA0_WSGRB0_WS64_WG32_4_2_WGM1_WGMXCC4_WGMXCCGn1
    SolutionIndex: 260
    SolutionNameMin: Cijk_Ailk_Bjlk_I8II_BH_UserArgs_MT32x256x128_MI16x16x1_SN_LDSB1_AFC0_AFEM1_AFEM1_ASEM1_CLR1_CADS0_DTVA0_DTVB0_EPS0_FDSI0_GRPM1_GRVWA16_GRVWB16_GSUn1_GSUAMBSK_GSUC1_GSUWGMRR1_GLS0_ISA942_IU1_K1_LBSPPA256_LBSPPB2048_LBSPPM0_LPA32_LPB64_LPM0_LRVW8_LWPMn1_MIAV0_MIWT2_4_MO40_NTn1_NTA0_NTB0_NTC0_NTD4_NTM0_NEPBS8_NLCA1_NLCB1_ONLL1_PGR2_PLR1_PKA1_SIA3_SS1_SU0_SUM1_SUS0_SPO0_SRVW0_SSO0_SVW2_SK0_SKXCCM0_TLDS0_ULSGRO0_USL1_UIOFGRO0_USFGROn1_VSn1_VWA2_VWB4_WSGRA0_WSGRB0_WS64_WG16_16_1_WGM1_WGMXCC4_WGMXCCGn1
    SolutionIndex: 261
    SolutionNameMin: Cijk_Ailk_Bjlk_I8II_BH_UserArgs_MT64x128x64_MI16x16x1_SN_LDSB0_AFC0_AFEM1_AFEM1_ASEM1_CLR1_CADS0_DTVA0_DTVB0_EPS0_FDSI0_GRPM1_GRVWA16_GRVWB16_GSUn1_GSUAMBSK_GSUC1_GSUWGMRR1_GLS0_ISA942_IU1_K1_LBSPPA512_LBSPPB1024_LBSPPM0_LPA32_LPB64_LPM0_LRVW8_LWPMn1_MIAV0_MIWT2_4_MO40_NTn1_NTA0_NTB0_NTC0_NTD4_NTM0_NEPBS8_NLCA1_NLCB1_ONLL1_PGR2_PLR1_PKA1_SIA3_SS1_SU0_SUM1_SUS0_SPO0_SRVW0_SSO0_SVW2_SK0_SKXCCM0_TLDS0_ULSGRO0_USL1_UIOFGRO0_USFGROn1_VSn1_VWA2_VWB4_WSGRA0_WSGRB0_WS64_WG32_8_1_WGM1_WGMXCC4_WGMXCCGn1
    SolutionIndex: 262
    SolutionNameMin: Cijk_Ailk_Bjlk_I8II_BH_UserArgs_MT128x256x64_MI32x32x1_SN_LDSB0_AFC0_AFEM1_AFEM1_ASEM1_CLR1_CADS0_DTVA0_DTVB0_EPS0_FDSI0_GRPM1_GRVWA16_GRVWB16_GSUn1_GSUAMBSK_GSUC1_GSUWGMRR1_GLS0_ISA942_IU1_K1_LBSPPA0_LBSPPB0_LBSPPM0_LPA0_LPB0_LPM0_LRVW8_LWPMn1_MIAV0_MIWT2_4_MO40_NTn1_NTA0_NTB0_NTC0_NTD4_NTM0_NEPBS8_NLCA1_NLCB1_ONLL1_PGR2_PLR1_PKA1_SIA3_SS1_SU0_SUM1_SUS0_SPO0_SRVW0_SSO0_SVW2_SK0_SKXCCM0_TLDS0_ULSGRO0_USL1_UIOFGRO0_USFGROn1_VSn1_VWA2_VWB4_WSGRA0_WSGRB0_WS64_WG64_4_1_WGM1_WGMXCC4_WGMXCCGn1
    SolutionIndex: 263
    SolutionNameMin: Cijk_Ailk_Bjlk_I8II_BH_UserArgs_MT64x128x64_MI16x16x1_SN_LDSB0_AFC0_AFEM1_AFEM1_ASEM1_CLR1_CADS0_DTVA0_DTVB0_EPS0_FDSI0_GRPM1_GRVWA16_GRVWB16_GSUn1_GSUAMBSK_GSUC1_GSUWGMRR1_GLS0_ISA942_IU1_K1_LBSPPA512_LBSPPB1024_LBSPPM0_LPA64_LPB32_LPM0_LRVW8_LWPMn1_MIAV0_MIWT4_2_MO40_NTn1_NTA0_NTB0_NTC0_NTD4_NTM0_NEPBS8_NLCA1_NLCB1_ONLL1_PGR2_PLR1_PKA1_SIA3_SS1_SU0_SUM1_SUS0_SPO0_SRVW0_SSO0_SVW4_SK0_SKXCCM0_TLDS0_ULSGRO0_USL1_UIOFGRO0_USFGROn1_VSn1_VWA4_VWB2_WSGRA0_WSGRB0_WS64_WG16_16_1_WGM1_WGMXCC4_WGMXCCGn1
    SolutionIndex: 264
    SolutionNameMin: Cijk_Ailk_Bjlk_I8II_BH_UserArgs_MT64x256x64_MI16x16x1_SN_LDSB1_AFC0_AFEM1_AFEM1_ASEM1_CLR1_CADS0_DTVA0_DTVB0_EPS0_FDSI0_GRPM1_GRVWA16_GRVWB16_GSUn1_GSUAMBSK_GSUC1_GSUWGMRR1_GLS0_ISA942_IU1_K1_LBSPPA512_LBSPPB2048_LBSPPM0_LPA64_LPB64_LPM0_LRVW8_LWPMn1_MIAV0_MIWT4_4_MO40_NTn1_NTA0_NTB0_NTC0_NTD4_NTM0_NEPBS8_NLCA1_NLCB1_ONLL1_PGR2_PLR1_PKA1_SIA3_SS1_SU0_SUM1_SUS0_SPO0_SRVW0_SSO0_SVW4_SK0_SKXCCM0_TLDS0_ULSGRO0_USL1_UIOFGRO0_USFGROn1_VSn1_VWA4_VWB4_WSGRA0_WSGRB0_WS64_WG16_16_1_WGM1_WGMXCC4_WGMXCCGn1
    SolutionIndex: 265
    SolutionNameMin: Cijk_Ailk_Bjlk_I8II_BH_UserArgs_MT128x64x128_MI16x16x1_SN_LDSB1_AFC0_AFEM1_AFEM1_ASEM1_CLR1_CADS0_DTVA0_DTVB0_EPS0_FDSI0_GRPM1_GRVWA16_GRVWB16_GSUn1_GSUAMBSK_GSUC1_GSUWGMRR1_GLS0_ISA942_IU1_K1_LBSPPA1024_LBSPPB512_LBSPPM0_LPA64_LPB16_LPM0_LRVW8_LWPMn1_MIAV0_MIWT4_2_MO40_NTn1_NTA0_NTB0_NTC0_NTD4_NTM0_NEPBS8_NLCA1_NLCB1_ONLL1_PGR2_PLR1_PKA1_SIA3_SS1_SU0_SUM1_SUS0_SPO0_SRVW0_SSO0_SVW4_SK0_SKXCCM0_TLDS0_ULSGRO0_USL1_UIOFGRO0_USFGROn1_VSn1_VWA4_VWB1_WSGRA0_WSGRB0_WS64_WG32_8_1_WGM1_WGMXCC4_WGMXCCGn1
    SolutionIndex: 266
    SolutionNameMin: Cijk_Ailk_Bjlk_I8II_BH_UserArgs_MT128x192x128_MI16x16x1_SN_LDSB1_AFC0_AFEM1_AFEM1_ASEM1_CLR1_CADS0_DTVA0_DTVB0_EPS0_FDSI0_GRPM1_GRVWA16_GRVWB16_GSUn1_GSUAMBSK_GSUC1_GSUWGMRR1_GLS0_ISA942_IU1_K1_LBSPPA1024_LBSPPB1536_LBSPPM0_LPA64_LPB32_LPM0_LRVW8_LWPMn1_MIAV0_MIWT4_6_MO40_NTn1_NTA0_NTB0_NTC0_NTD4_NTM0_NEPBS8_NLCA1_NLCB1_ONLL1_PGR2_PLR1_PKA1_SIA3_SS1_SU0_SUM1_SUS0_SPO0_SRVW0_SSO0_SVW4_SK0_SKXCCM0_TLDS0_ULSGRO0_USL1_UIOFGRO0_USFGROn1_VSn1_VWA4_VWB2_WSGRA0_WSGRB0_WS64_WG32_8_1_WGM1_WGMXCC4_WGMXCCGn1
    SolutionIndex: 267
    SolutionNameMin: Cijk_Ailk_Bjlk_I8II_BH_UserArgs_MT128x256x64_MI16x16x1_SN_LDSB1_AFC0_AFEM1_AFEM1_ASEM1_CLR1_CADS0_DTVA0_DTVB0_EPS0_FDSI0_GRPM1_GRVWA16_GRVWB16_GSUn1_GSUAMBSK_GSUC1_GSUWGMRR1_GLS0_ISA942_IU1_K1_LBSPPA1024_LBSPPB2048_LBSPPM0_LPA64_LPB64_LPM0_LRVW8_LWPMn1_MIAV0_MIWT8_4_MO40_NTn1_NTA0_NTB0_NTC0_NTD4_NTM0_NEPBS8_NLCA1_NLCB1_ONLL1_PGR2_PLR1_PKA1_SIA3_SS1_SU0_SUM1_SUS0_SPO0_SRVW0_SSO0_SVW8_SK0_SKXCCM0_TLDS0_ULSGRO0_USL1_UIOFGRO0_USFGROn1_VSn1_VWA8_VWB4_WSGRA0_WSGRB0_WS64_WG16_16_1_WGM1_WGMXCC4_WGMXCCGn1
    SolutionIndex: 268
    SolutionNameMin: Cijk_Ailk_Bjlk_I8II_BH_UserArgs_MT128x256x64_MI16x16x1_SN_LDSB1_AFC0_AFEM1_AFEM1_ASEM1_CLR1_CADS0_DTVA0_DTVB0_EPS0_FDSI0_GRPM1_GRVWA16_GRVWB16_GSUn1_GSUAMBSK_GSUC1_GSUWGMRR1_GLS0_ISA942_IU1_K1_LBSPPA1024_LBSPPB2048_LBSPPM0_LPA64_LPB64_LPM0_LRVW8_LWPMn1_MIAV0_MIWT4_8_MO40_NTn1_NTA0_NTB0_NTC0_NTD4_NTM0_NEPBS8_NLCA1_NLCB1_ONLL1_PGR2_PLR1_PKA1_SIA3_SS1_SU0_SUM1_SUS0_SPO0_SRVW0_SSO0_SVW4_SK0_SKXCCM0_TLDS0_ULSGRO0_USL1_UIOFGRO0_USFGROn1_VSn1_VWA4_VWB4_WSGRA0_WSGRB0_WS64_WG32_8_1_WGM1_WGMXCC4_WGMXCCGn1
    SolutionIndex: 269
    SolutionNameMin: Cijk_Ailk_Bjlk_I8II_BH_UserArgs_MT192x256x64_MI16x16x1_SN_LDSB1_AFC0_AFEM1_AFEM1_ASEM1_CLR1_CADS0_DTVA0_DTVB0_EPS0_FDSI0_GRPM1_GRVWA16_GRVWB16_GSUn1_GSUAMBSK_GSUC1_GSUWGMRR1_GLS0_ISA942_IU1_K1_LBSPPA1536_LBSPPB2048_LBSPPM0_LPA32_LPB64_LPM0_LRVW8_LWPMn1_MIAV0_MIWT6_8_MO40_NTn1_NTA0_NTB0_NTC0_NTD4_NTM0_NEPBS6_NLCA1_NLCB1_ONLL1_PGR2_PLR1_PKA1_SIA3_SS1_SU0_SUM1_SUS0_SPO0_SRVW0_SSO0_SVW2_SK0_SKXCCM0_TLDS0_ULSGRO0_USL1_UIOFGRO0_USFGROn1_VSn1_VWA2_VWB4_WSGRA0_WSGRB0_WS64_WG32_8_1_WGM1_WGMXCC4_WGMXCCGn1
    SolutionIndex: 270
    SolutionNameMin: Cijk_Ailk_Bjlk_I8II_BH_UserArgs_MT128x320x64_MI16x16x1_SN_LDSB1_AFC0_AFEM1_AFEM1_ASEM1_CLR1_CADS0_DTVA0_DTVB0_EPS0_FDSI0_GRPM1_GRVWA16_GRVWB16_GSUn1_GSUAMBSK_GSUC1_GSUWGMRR1_GLS0_ISA942_IU1_K1_LBSPPA1024_LBSPPB2560_LBSPPM0_LPA32_LPB32_LPM0_LRVW8_LWPMn1_MIAV0_MIWT4_10_MO40_NTn1_NTA0_NTB0_NTC0_NTD4_NTM0_NEPBS8_NLCA1_NLCB1_ONLL1_PGR2_PLR1_PKA1_SIA3_SS1_SU0_SUM1_SUS0_SPO0_SRVW0_SSO0_SVW4_SK0_SKXCCM0_TLDS0_ULSGRO0_USL1_UIOFGRO0_USFGROn1_VSn1_VWA4_VWB2_WSGRA0_WSGRB0_WS64_WG32_8_1_WGM1_WGMXCC4_WGMXCCGn1
    SolutionIndex: 271
    SolutionNameMin: Cijk_Ailk_Bjlk_I8II_BH_UserArgs_MT128x320x64_MI16x16x1_SN_LDSB1_AFC0_AFEM1_AFEM1_ASEM1_CLR1_CADS0_DTVA0_DTVB0_EPS0_FDSI0_GRPM1_GRVWA16_GRVWB16_GSUn1_GSUAMBSK_GSUC1_GSUWGMRR1_GLS0_ISA942_IU1_K1_LBSPPA1024_LBSPPB2560_LBSPPM0_LPA64_LPB16_LPM0_LRVW8_LWPMn1_MIAV0_MIWT8_5_MO40_NTn1_NTA0_NTB0_NTC0_NTD4_NTM0_NEPBS8_NLCA1_NLCB1_ONLL1_PGR2_PLR1_PKA1_SIA3_SS1_SU0_SUM1_SUS0_SPO0_SRVW0_SSO0_SVW8_SK0_SKXCCM0_TLDS0_ULSGRO0_USL1_UIOFGRO0_USFGROn1_VSn1_VWA8_VWB1_WSGRA0_WSGRB0_WS64_WG16_16_1_WGM1_WGMXCC4_WGMXCCGn1
    SolutionIndex: 272
    SolutionNameMin: Cijk_Ailk_Bjlk_I8II_BH_UserArgs_MT192x320x64_MI16x16x1_SN_LDSB1_AFC0_AFEM1_AFEM1_ASEM1_CLR1_CADS0_DTVA0_DTVB0_EPS0_FDSI0_GRPM1_GRVWA16_GRVWB16_GSUn1_GSUAMBSK_GSUC1_GSUWGMRR1_GLS0_ISA942_IU1_K1_LBSPPA1536_LBSPPB2560_LBSPPM0_LPA16_LPB32_LPM0_LRVW8_LWPMn1_MIAV0_MIWT6_10_MO40_NTn1_NTA0_NTB0_NTC0_NTD4_NTM0_NEPBS6_NLCA1_NLCB1_ONLL1_PGR2_PLR1_PKA1_SIA3_SS1_SU0_SUM1_SUS0_SPO0_SRVW0_SSO0_SVW2_SK0_SKXCCM0_TLDS0_ULSGRO0_USL1_UIOFGRO0_USFGROn1_VSn1_VWA2_VWB2_WSGRA0_WSGRB0_WS64_WG32_8_1_WGM1_WGMXCC4_WGMXCCGn1
    SolutionIndex: 273
    SolutionNameMin: Cijk_Ailk_Bjlk_I8II_BH_UserArgs_MT192x320x64_MI16x16x1_SN_LDSB1_AFC0_AFEM1_AFEM1_ASEM1_CLR1_CADS0_DTVA0_DTVB0_EPS0_FDSI0_GRPM1_GRVWA16_GRVWB16_GSUn1_GSUAMBSK_GSUC1_GSUWGMRR1_GLS0_ISA942_IU1_K1_LBSPPA1536_LBSPPB2560_LBSPPM0_LPA32_LPB32_LPM0_LRVW8_LWPMn1_MIAV0_MIWT6_10_MO40_NTn1_NTA0_NTB0_NTC0_NTD4_NTM0_NEPBS6_NLCA1_NLCB1_ONLL1_PGR2_PLR1_PKA1_SIA3_SS1_SU0_SUM1_SUS0_SPO0_SRVW0_SSO0_SVW2_SK0_SKXCCM0_TLDS0_ULSGRO0_USL1_UIOFGRO0_USFGROn1_VSn1_VWA2_VWB2_WSGRA0_WSGRB0_WS64_WG32_8_1_WGM1_WGMXCC4_WGMXCCGn1
    SolutionIndex: 274
    SolutionNameMin: Cijk_Ailk_Bjlk_I8II_BH_UserArgs_MT256x256x64_MI32x32x1_SN_LDSB1_AFC0_AFEM1_AFEM1_ASEM1_CLR1_CADS0_DTVA0_DTVB0_EPS0_FDSI0_GRPM1_GRVWA16_GRVWB16_GSUn1_GSUAMBSK_GSUC1_GSUWGMRR1_GLS0_ISA942_IU1_K1_LBSPPA0_LBSPPB0_LBSPPM0_LPA0_LPB0_LPM0_LRVW8_LWPMn1_MIAV0_MIWT4_4_MO40_NTn1_NTA0_NTB0_NTC0_NTD4_NTM0_NEPBS8_NLCA1_NLCB1_ONLL1_PGR2_PLR1_PKA1_SIA3_SS1_SU0_SUM1_SUS0_SPO0_SRVW0_SSO0_SVW4_SK0_SKXCCM0_TLDS0_ULSGRO0_USL1_UIOFGRO0_USFGROn1_VSn1_VWA4_VWB4_WSGRA0_WSGRB0_WS64_WG64_4_1_WGM1_WGMXCC4_WGMXCCGn1
    SolutionIndex: 275
    SolutionNameMin: Cijk_Ailk_Bjlk_I8II_BH_UserArgs_MT256x256x64_MI32x32x1_SN_LDSB1_AFC0_AFEM1_AFEM1_ASEM1_CLR1_CADS0_DTVA0_DTVB0_EPS0_FDSI0_GRPM1_GRVWA16_GRVWB16_GSUn1_GSUAMBSK_GSUC1_GSUWGMRR1_GLS0_ISA942_IU1_K1_LBSPPA0_LBSPPB0_LBSPPM0_LPA0_LPB0_LPM0_LRVW8_LWPMn1_MIAV0_MIWT4_4_MO40_NTn1_NTA0_NTB0_NTC0_NTD4_NTM0_NEPBS8_NLCA1_NLCB1_ONLL1_PGR2_PLR1_PKA1_SIA3_SS1_SU0_SUM1_SUS0_SPO0_SRVW0_SSO0_SVW4_SK0_SKXCCM0_TLDS0_ULSGRO0_USL1_UIOFGRO0_USFGROn1_VSn1_VWA4_VWB2_WSGRA0_WSGRB0_WS64_WG64_4_1_WGM1_WGMXCC4_WGMXCCGn1
    SolutionIndex: 276
    SolutionNameMin: Cijk_Ailk_Bjlk_I8II_BH_UserArgs_MT192x256x64_MI16x16x1_SN_LDSB1_AFC0_AFEM1_AFEM1_ASEM1_CLR1_CADS0_DTVA0_DTVB0_EPS0_FDSI0_GRPM1_GRVWA16_GRVWB16_GSUn1_GSUAMBSK_GSUC1_GSUWGMRR1_GLS0_ISA942_IU1_K1_LBSPPA1536_LBSPPB2048_LBSPPM0_LPA64_LPB64_LPM0_LRVW8_LWPMn1_MIAV0_MIWT12_4_MO40_NTn1_NTA0_NTB0_NTC0_NTD4_NTM0_NEPBS8_NLCA1_NLCB1_ONLL1_PGR2_PLR1_PKA1_SIA3_SS1_SU0_SUM1_SUS0_SPO0_SRVW0_SSO0_SVW4_SK0_SKXCCM0_TLDS0_ULSGRO0_USL1_UIOFGRO0_USFGROn1_VSn1_VWA4_VWB4_WSGRA0_WSGRB0_WS64_WG16_16_1_WGM1_WGMXCC4_WGMXCCGn1
    SolutionIndex: 277
    SolutionNameMin: Cijk_Ailk_Bjlk_I8II_BH_UserArgs_MT256x64x128_MI16x16x1_SN_LDSB1_AFC0_AFEM1_AFEM1_ASEM1_CLR1_CADS0_DTVA0_DTVB0_EPS0_FDSI0_GRPM1_GRVWA16_GRVWB16_GSUn1_GSUAMBSK_GSUC1_GSUWGMRR1_GLS0_ISA942_IU1_K1_LBSPPA2048_LBSPPB512_LBSPPM0_LPA64_LPB32_LPM0_LRVW8_LWPMn1_MIAV0_MIWT4_4_MO40_NTn1_NTA0_NTB0_NTC0_NTD4_NTM0_NEPBS8_NLCA1_NLCB1_ONLL1_PGR2_PLR1_PKA1_SIA3_SS1_SU0_SUM1_SUS0_SPO0_SRVW0_SSO0_SVW4_SK0_SKXCCM0_TLDS0_ULSGRO0_USL1_UIOFGRO0_USFGROn1_VSn1_VWA4_VWB2_WSGRA0_WSGRB0_WS64_WG64_4_1_WGM1_WGMXCC4_WGMXCCGn1
    SolutionIndex: 278
    SolutionNameMin: Cijk_Ailk_Bjlk_I8II_BH_UserArgs_MT192x320x64_MI16x16x1_SN_LDSB1_AFC0_AFEM1_AFEM1_ASEM1_CLR1_CADS0_DTVA0_DTVB0_EPS0_FDSI0_GRPM1_GRVWA16_GRVWB16_GSUn1_GSUAMBSK_GSUC1_GSUWGMRR1_GLS0_ISA942_IU1_K1_LBSPPA1536_LBSPPB2560_LBSPPM0_LPA32_LPB32_LPM0_LRVW8_LWPMn1_MIAV0_MIWT6_10_MO40_NTn1_NTA0_NTB0_NTC0_NTD4_NTM0_NEPBS6_NLCA1_NLCB1_ONLL1_PGR2_PLR1_PKA1_SIA3_SS1_SU0_SUM1_SUS0_SPO0_SRVW0_SSO4_SVW2_SK0_SKXCCM0_TLDS0_ULSGRO0_USL1_UIOFGRO0_USFGROn1_VSn1_VWA2_VWB2_WSGRA0_WSGRB0_WS64_WG32_8_1_WGM1_WGMXCC4_WGMXCCGn1
    SolutionIndex: 279
    SolutionNameMin: Cijk_Ailk_Bjlk_I8II_BH_UserArgs_MT256x256x64_MI32x32x1_SN_LDSB1_AFC0_AFEM1_AFEM1_ASEM1_CLR1_CADS0_DTVA0_DTVB0_EPS0_FDSI0_GRPM1_GRVWA16_GRVWB16_GSUn1_GSUAMBSK_GSUC1_GSUWGMRR1_GLS0_ISA942_IU1_K1_LBSPPA0_LBSPPB0_LBSPPM0_LPA0_LPB0_LPM0_LRVW8_LWPMn1_MIAV0_MIWT4_4_MO40_NTn1_NTA0_NTB0_NTC0_NTD4_NTM0_NEPBS8_NLCA1_NLCB1_ONLL1_PGR2_PLR1_PKA1_SIA3_SS1_SU0_SUM1_SUS0_SPO0_SRVW0_SSO4_SVW4_SK0_SKXCCM0_TLDS0_ULSGRO0_USL1_UIOFGRO0_USFGROn1_VSn1_VWA4_VWB4_WSGRA0_WSGRB0_WS64_WG64_4_1_WGM1_WGMXCC4_WGMXCCGn1
    SolutionIndex: 280
    SolutionNameMin: Cijk_Ailk_Bjlk_I8II_BH_UserArgs_MT192x320x64_MI16x16x1_SN_LDSB1_AFC0_AFEM1_AFEM1_ASEM1_CLR1_CADS0_DTVA0_DTVB0_EPS0_FDSI0_GRPM1_GRVWA16_GRVWB16_GSUn1_GSUAMBSK_GSUC1_GSUWGMRR1_GLS0_ISA942_IU1_K1_LBSPPA1536_LBSPPB2560_LBSPPM0_LPA64_LPB16_LPM0_LRVW8_LWPMn1_MIAV0_MIWT12_5_MO40_NTn1_NTA0_NTB0_NTC0_NTD4_NTM0_NEPBS8_NLCA1_NLCB1_ONLL1_PGR2_PLR1_PKA1_SIA3_SS1_SU0_SUM1_SUS0_SPO0_SRVW0_SSO4_SVW4_SK0_SKXCCM0_TLDS0_ULSGRO0_USL1_UIOFGRO0_USFGROn1_VSn1_VWA4_VWB1_WSGRA0_WSGRB0_WS64_WG16_16_1_WGM1_WGMXCC4_WGMXCCGn1
    SolutionIndex: 281
    SolutionNameMin: Cijk_Ailk_Bjlk_I8II_BH_UserArgs_MT192x256x64_MI16x16x1_SN_LDSB1_AFC0_AFEM1_AFEM1_ASEM1_CLR1_CADS0_DTVA0_DTVB0_EPS0_FDSI0_GRPM1_GRVWA16_GRVWB16_GSUn1_GSUAMBSK_GSUC1_GSUWGMRR1_GLS0_ISA942_IU1_K1_LBSPPA1536_LBSPPB2048_LBSPPM0_LPA64_LPB64_LPM0_LRVW8_LWPMn1_MIAV0_MIWT12_4_MO40_NTn1_NTA0_NTB0_NTC0_NTD4_NTM0_NEPBS8_NLCA1_NLCB1_ONLL1_PGR2_PLR1_PKA1_SIA3_SS1_SU0_SUM1_SUS0_SPO0_SRVW0_SSO4_SVW4_SK0_SKXCCM0_TLDS0_ULSGRO0_USL1_UIOFGRO0_USFGROn1_VSn1_VWA4_VWB4_WSGRA0_WSGRB0_WS64_WG16_16_1_WGM1_WGMXCC4_WGMXCCGn1
    SolutionIndex: 282
    SolutionNameMin: Cijk_Ailk_Bjlk_I8II_BH_UserArgs_MT128x256x64_MI16x16x1_SN_LDSB1_AFC0_AFEM1_AFEM1_ASEM1_CLR1_CADS0_DTVA0_DTVB0_EPS0_FDSI0_GRPM1_GRVWA16_GRVWB16_GSUn1_GSUAMBSK_GSUC1_GSUWGMRR1_GLS0_ISA942_IU1_K1_LBSPPA1024_LBSPPB2048_LBSPPM0_LPA64_LPB64_LPM0_LRVW8_LWPMn1_MIAV0_MIWT4_8_MO40_NTn1_NTA0_NTB0_NTC0_NTD4_NTM0_NEPBS8_NLCA1_NLCB1_ONLL1_PGR2_PLR1_PKA1_SIA3_SS1_SU0_SUM1_SUS0_SPO0_SRVW0_SSO4_SVW4_SK0_SKXCCM0_TLDS0_ULSGRO0_USL1_UIOFGRO0_USFGROn1_VSn1_VWA4_VWB4_WSGRA0_WSGRB0_WS64_WG32_8_1_WGM1_WGMXCC4_WGMXCCGn1
    SolutionIndex: 283
    SolutionNameMin: Cijk_Ailk_Bjlk_I8II_BH_UserArgs_MT16x128x256_MI16x16x1_SN_LDSB1_AFC0_AFEM1_AFEM1_ASEM1_CLR1_CADS0_DTVA0_DTVB0_EPS0_FDSI0_GRPM1_GRVWA16_GRVWB16_GSUn1_GSUAMBSK_GSUC1_GSUWGMRR1_GLS0_ISA942_IU1_K1_LBSPPA128_LBSPPB1024_LBSPPM0_LPA16_LPB64_LPM0_LRVW8_LWPMn1_MIAV0_MIWT1_8_MO40_NTn1_NTA0_NTB0_NTC0_NTD4_NTM0_NEPBS8_NLCA1_NLCB1_ONLL1_PGR2_PLR1_PKA1_SIA3_SS1_SU0_SUM1_SUS0_SPO0_SRVW0_SSO0_SVW1_SK0_SKXCCM0_TLDS0_ULSGRO0_USL1_UIOFGRO0_USFGROn1_VSn1_VWA1_VWB4_WSGRA0_WSGRB0_WS64_WG16_4_4_WGM1_WGMXCC4_WGMXCCGn1
    SolutionIndex: 284
    SolutionNameMin: Cijk_Ailk_Bjlk_I8II_BH_UserArgs_MT32x64x128_MI16x16x1_SN_LDSB0_AFC0_AFEM1_AFEM1_ASEM1_CLR1_CADS0_DTVA0_DTVB0_EPS0_FDSI0_GRPM1_GRVWA16_GRVWB16_GSUn1_GSUAMBSK_GSUC1_GSUWGMRR1_GLS0_ISA942_IU1_K1_LBSPPA256_LBSPPB512_LBSPPM0_LPA32_LPB32_LPM0_LRVW8_LWPMn1_MIAV0_MIWT2_2_MO40_NTn1_NTA0_NTB0_NTC0_NTD4_NTM0_NEPBS8_NLCA1_NLCB1_ONLL1_PGR2_PLR1_PKA1_SIA3_SS1_SU0_SUM1_SUS0_SPO0_SRVW0_SSO0_SVW2_SK0_SKXCCM0_TLDS0_ULSGRO0_USL1_UIOFGRO0_USFGROn1_VSn1_VWA2_VWB2_WSGRA0_WSGRB0_WS64_WG16_8_2_WGM1_WGMXCC4_WGMXCCGn1
    SolutionIndex: 285
    SolutionNameMin: Cijk_Ailk_Bjlk_I8II_BH_UserArgs_MT32x96x256_MI16x16x1_SN_LDSB1_AFC0_AFEM1_AFEM1_ASEM1_CLR1_CADS0_DTVA0_DTVB0_EPS0_FDSI0_GRPM1_GRVWA16_GRVWB16_GSUn1_GSUAMBSK_GSUC1_GSUWGMRR1_GLS0_ISA942_IU1_K1_LBSPPA256_LBSPPB768_LBSPPM0_LPA32_LPB16_LPM0_LRVW8_LWPMn1_MIAV0_MIWT2_3_MO40_NTn1_NTA0_NTB0_NTC0_NTD4_NTM0_NEPBS8_NLCA1_NLCB1_ONLL1_PGR2_PLR1_PKA1_SIA3_SS1_SU0_SUM1_SUS0_SPO0_SRVW0_SSO0_SVW2_SK0_SKXCCM0_TLDS0_ULSGRO0_USL1_UIOFGRO0_USFGROn1_VSn1_VWA2_VWB1_WSGRA0_WSGRB0_WS64_WG16_8_2_WGM1_WGMXCC4_WGMXCCGn1
    SolutionIndex: 286
    SolutionNameMin: Cijk_Ailk_Bjlk_I8II_BH_UserArgs_MT64x128x256_MI16x16x1_SN_LDSB1_AFC0_AFEM1_AFEM1_ASEM1_CLR1_CADS0_DTVA0_DTVB0_EPS0_FDSI0_GRPM1_GRVWA16_GRVWB16_GSUn1_GSUAMBSK_GSUC1_GSUWGMRR1_GLS0_ISA942_IU1_K1_LBSPPA512_LBSPPB1024_LBSPPM0_LPA32_LPB64_LPM0_LRVW8_LWPMn1_MIAV0_MIWT2_4_MO40_NTn1_NTA0_NTB0_NTC0_NTD4_NTM0_NEPBS8_NLCA1_NLCB1_ONLL1_PGR2_PLR1_PKA1_SIA3_SS1_SU0_SUM1_SUS0_SPO0_SRVW0_SSO0_SVW2_SK0_SKXCCM0_TLDS0_ULSGRO0_USL1_UIOFGRO0_USFGROn1_VSn1_VWA2_VWB4_WSGRA0_WSGRB0_WS64_WG32_8_1_WGM1_WGMXCC4_WGMXCCGn1
- - - [7, 7, 1, 2048]
    - [0, 25.5828]
  - - [7, 7, 1, 8192]
    - [1, 82.272]
  - - [7, 7, 1, 32768]
    - [0, 234.03]
  - - [16, 7, 1, 2048]
    - [2, 57.0579]
  - - [16, 7, 1, 8192]
    - [3, 191.552]
  - - [16, 7, 1, 32768]
    - [2, 592.62]
  - - [32, 7, 1, 2048]
    - [2, 114.378]
  - - [32, 7, 1, 8192]
    - [3, 382.034]
  - - [32, 7, 1, 32768]
    - [3, 1179.13]
  - - [48, 7, 1, 2048]
    - [2, 167.294]
  - - [48, 7, 1, 8192]
    - [3, 559.006]
  - - [48, 7, 1, 32768]
    - [3, 1734.35]
  - - [64, 7, 1, 2048]
    - [3, 219.529]
  - - [64, 7, 1, 8192]
    - [4, 727.945]
  - - [64, 7, 1, 32768]
    - [5, 2063.26]
  - - [80, 7, 1, 2048]
    - [2, 271.739]
  - - [80, 7, 1, 8192]
    - [4, 888.349]
  - - [80, 7, 1, 32768]
    - [6, 2497.04]
  - - [96, 7, 1, 2048]
    - [2, 324.699]
  - - [96, 7, 1, 8192]
    - [4, 1070.67]
  - - [96, 7, 1, 32768]
    - [7, 2974.06]
  - - [112, 7, 1, 2048]
    - [3, 374.809]
  - - [112, 7, 1, 8192]
    - [4, 1220.06]
  - - [112, 7, 1, 32768]
    - [8, 3382.73]
  - - [128, 7, 1, 2048]
    - [9, 422.462]
  - - [128, 7, 1, 8192]
    - [10, 1356.14]
  - - [128, 7, 1, 32768]
    - [11, 3693.7]
  - - [160, 7, 1, 2048]
    - [9, 529.079]
  - - [160, 7, 1, 8192]
    - [5, 1708.97]
  - - [160, 7, 1, 32768]
    - [12, 4465.32]
  - - [192, 7, 1, 2048]
    - [9, 634.748]
  - - [192, 7, 1, 8192]
    - [10, 2026.1]
  - - [192, 7, 1, 32768]
    - [12, 5369.92]
  - - [224, 7, 1, 2048]
    - [9, 740.095]
  - - [224, 7, 1, 8192]
    - [10, 2332.29]
  - - [224, 7, 1, 32768]
    - [13, 5846.88]
  - - [256, 7, 1, 2048]
    - [10, 819.142]
  - - [256, 7, 1, 8192]
    - [11, 2579.02]
  - - [256, 7, 1, 32768]
    - [12, 6282.31]
  - - [320, 7, 1, 2048]
    - [5, 998.42]
  - - [320, 7, 1, 8192]
    - [14, 2959.75]
  - - [320, 7, 1, 32768]
    - [15, 5785.84]
  - - [384, 7, 1, 2048]
    - [10, 1190.21]
  - - [384, 7, 1, 8192]
    - [15, 3392.54]
  - - [384, 7, 1, 32768]
    - [15, 6974.41]
  - - [448, 7, 1, 2048]
    - [10, 1378.54]
  - - [448, 7, 1, 8192]
    - [15, 3917.79]
  - - [448, 7, 1, 32768]
    - [15, 8033.65]
  - - [512, 7, 1, 2048]
    - [11, 1470.69]
  - - [512, 7, 1, 8192]
    - [11, 3604.61]
  - - [512, 7, 1, 32768]
    - [16, 7186.94]
  - - [576, 7, 1, 2048]
    - [11, 1713.65]
  - - [576, 7, 1, 8192]
    - [11, 4669.84]
  - - [576, 7, 1, 32768]
    - [11, 9020.24]
  - - [640, 7, 1, 2048]
    - [11, 1902.55]
  - - [640, 7, 1, 8192]
    - [11, 5260.42]
  - - [640, 7, 1, 32768]
    - [11, 10045.2]
  - - [768, 7, 1, 2048]
    - [13, 2149.73]
  - - [768, 7, 1, 8192]
    - [11, 5500.33]
  - - [768, 7, 1, 32768]
    - [16, 11173.2]
  - - [896, 7, 1, 2048]
    - [17, 2461.96]
  - - [896, 7, 1, 8192]
    - [18, 6668.3]
  - - [896, 7, 1, 32768]
    - [18, 12866.0]
  - - [1024, 7, 1, 2048]
    - [19, 2792.85]
  - - [1024, 7, 1, 8192]
    - [19, 6513.07]
  - - [1024, 7, 1, 32768]
    - [20, 11727.6]
  - - [1280, 7, 1, 2048]
    - [19, 3461.49]
  - - [1280, 7, 1, 8192]
    - [19, 9068.67]
  - - [1280, 7, 1, 32768]
    - [19, 16177.3]
  - - [1536, 7, 1, 2048]
    - [19, 3614.46]
  - - [1536, 7, 1, 8192]
    - [19, 8363.4]
  - - [1536, 7, 1, 32768]
    - [16, 14085.4]
  - - [1792, 7, 1, 2048]
    - [20, 4224.93]
  - - [1792, 7, 1, 8192]
    - [16, 10360.8]
  - - [1792, 7, 1, 32768]
    - [16, 16911.2]
  - - [2048, 7, 1, 2048]
    - [20, 4764.25]
  - - [2048, 7, 1, 8192]
    - [16, 10493.9]
  - - [2048, 7, 1, 32768]
    - [16, 15430.8]
  - - [2304, 7, 1, 2048]
    - [16, 5347.61]
  - - [2304, 7, 1, 8192]
    - [16, 13175.6]
  - - [2304, 7, 1, 32768]
    - [16, 20544.6]
  - - [2560, 7, 1, 2048]
    - [16, 5662.8]
  - - [2560, 7, 1, 8192]
    - [16, 12817.2]
  - - [2560, 7, 1, 32768]
    - [16, 18900.1]
  - - [2816, 7, 1, 2048]
    - [20, 6110.57]
  - - [2816, 7, 1, 8192]
    - [16, 14341.2]
  - - [2816, 7, 1, 32768]
    - [16, 22280.3]
  - - [3072, 7, 1, 2048]
    - [20, 6304.35]
  - - [3072, 7, 1, 8192]
    - [16, 12829.2]
  - - [3072, 7, 1, 32768]
    - [16, 17742.6]
  - - [3584, 7, 1, 2048]
    - [21, 6881.35]
  - - [3584, 7, 1, 8192]
    - [21, 13413.7]
  - - [3584, 7, 1, 32768]
    - [16, 17450.1]
  - - [4096, 7, 1, 2048]
    - [20, 7943.73]
  - - [4096, 7, 1, 8192]
    - [20, 14578.8]
  - - [4096, 7, 1, 32768]
    - [20, 18707.9]
  - - [4608, 7, 1, 2048]
    - [20, 9016.16]
  - - [4608, 7, 1, 8192]
    - [16, 14696.1]
  - - [4608, 7, 1, 32768]
    - [16, 18649.7]
  - - [5120, 7, 1, 2048]
    - [20, 9896.13]
  - - [5120, 7, 1, 8192]
    - [16, 16384.7]
  - - [5120, 7, 1, 32768]
    - [16, 20508.7]
  - - [5632, 7, 1, 2048]
    - [20, 9223.09]
  - - [5632, 7, 1, 8192]
    - [21, 14921.6]
  - - [5632, 7, 1, 32768]
    - [20, 18350.1]
  - - [6144, 7, 1, 2048]
    - [20, 10100.8]
  - - [6144, 7, 1, 8192]
    - [21, 16421.1]
  - - [6144, 7, 1, 32768]
    - [21, 19897.8]
  - - [7168, 7, 1, 2048]
    - [21, 10340.3]
  - - [7168, 7, 1, 8192]
    - [21, 16201.6]
  - - [7168, 7, 1, 32768]
    - [21, 18571.3]
  - - [8192, 7, 1, 2048]
    - [22, 13247.0]
  - - [8192, 7, 1, 8192]
    - [23, 22404.5]
  - - [8192, 7, 1, 32768]
    - [23, 27068.7]
  - - [10240, 7, 1, 2048]
    - [23, 15239.1]
  - - [10240, 7, 1, 8192]
    - [22, 24403.3]
  - - [10240, 7, 1, 32768]
    - [22, 28976.3]
  - - [12288, 7, 1, 2048]
    - [22, 15305.7]
  - - [12288, 7, 1, 8192]
    - [22, 24866.3]
  - - [12288, 7, 1, 32768]
    - [22, 29155.0]
  - - [14336, 7, 1, 2048]
    - [22, 16330.6]
  - - [14336, 7, 1, 8192]
    - [22, 24674.1]
  - - [14336, 7, 1, 32768]
    - [22, 29068.5]
  - - [16384, 7, 1, 2048]
    - [22, 17014.5]
  - - [16384, 7, 1, 8192]
    - [22, 25530.0]
  - - [16384, 7, 1, 32768]
    - [22, 29752.5]
  - - [20480, 7, 1, 2048]
    - [22, 19589.7]
  - - [20480, 7, 1, 8192]
    - [22, 26914.0]
  - - [20480, 7, 1, 32768]
    - [22, 30772.7]
  - - [24576, 7, 1, 2048]
    - [22, 19238.7]
  - - [24576, 7, 1, 8192]
    - [22, 27146.8]
  - - [24576, 7, 1, 32768]
    - [22, 30568.8]
  - - [28672, 7, 1, 2048]
    - [22, 20730.7]
  - - [28672, 7, 1, 8192]
    - [22, 27365.7]
  - - [28672, 7, 1, 32768]
    - [22, 30626.0]
  - - [32768, 7, 1, 2048]
    - [22, 21689.1]
  - - [32768, 7, 1, 8192]
    - [22, 28273.8]
  - - [32768, 7, 1, 32768]
    - [22, 32158.0]
  - - [40960, 7, 1, 2048]
    - [23, 25595.3]
  - - [40960, 7, 1, 8192]
    - [22, 28409.4]
  - - [40960, 7, 1, 32768]
    - [22, 31009.0]
  - - [49152, 7, 1, 2048]
    - [22, 23498.2]
  - - [49152, 7, 1, 8192]
    - [22, 28323.3]
  - - [49152, 7, 1, 32768]
    - [22, 31243.8]
  - - [57344, 7, 1, 2048]
    - [22, 25688.0]
  - - [57344, 7, 1, 8192]
    - [22, 28202.9]
  - - [57344, 7, 1, 32768]
    - [22, 30491.6]
  - - [65536, 7, 1, 2048]
    - [22, 24058.3]
  - - [65536, 7, 1, 8192]
    - [22, 28651.9]
  - - [65536, 7, 1, 32768]
    - [22, 30018.0]
  - - [98304, 7, 1, 2048]
    - [22, 26847.2]
  - - [98304, 7, 1, 8192]
    - [22, 29182.2]
  - - [98304, 7, 1, 32768]
    - [22, 29805.1]
  - - [131072, 7, 1, 2048]
    - [22, 27021.1]
  - - [131072, 7, 1, 8192]
    - [22, 30951.8]
  - - [262144, 7, 1, 2048]
    - [22, 29881.3]
  - - [262144, 7, 1, 8192]
    - [22, 30520.4]
  - - [15360, 7, 1, 2048]
    - [22, 17350.7]
  - - [15360, 7, 1, 8192]
    - [22, 26158.7]
  - - [15360, 7, 1, 32768]
    - [22, 29501.3]
  - - [22528, 7, 1, 2048]
    - [22, 18216.7]
  - - [22528, 7, 1, 8192]
    - [22, 26164.6]
  - - [22528, 7, 1, 32768]
    - [22, 30122.4]
  - - [38016, 7, 1, 2048]
    - [22, 23829.6]
  - - [38016, 7, 1, 8192]
    - [22, 28367.2]
  - - [38016, 7, 1, 32768]
    - [22, 31338.5]
  - - [163840, 7, 1, 2048]
    - [22, 28676.7]
  - - [163840, 7, 1, 8192]
    - [22, 30863.5]
  - - [7, 16, 1, 2048]
    - [24, 57.2263]
  - - [7, 16, 1, 8192]
    - [25, 193.015]
  - - [7, 16, 1, 32768]
    - [25, 597.631]
  - - [16, 16, 1, 2048]
    - [26, 141.381]
  - - [16, 16, 1, 8192]
    - [27, 454.162]
  - - [16, 16, 1, 32768]
    - [26, 1454.72]
  - - [32, 16, 1, 2048]
    - [28, 267.137]
  - - [32, 16, 1, 8192]
    - [27, 889.783]
  - - [32, 16, 1, 32768]
    - [26, 2820.98]
  - - [48, 16, 1, 2048]
    - [27, 389.797]
  - - [48, 16, 1, 8192]
    - [27, 1322.97]
  - - [48, 16, 1, 32768]
    - [29, 4086.83]
  - - [64, 16, 1, 2048]
    - [26, 530.4]
  - - [64, 16, 1, 8192]
    - [30, 1660.05]
  - - [64, 16, 1, 32768]
    - [31, 4954.73]
  - - [80, 16, 1, 2048]
    - [32, 653.133]
  - - [80, 16, 1, 8192]
    - [30, 2033.36]
  - - [80, 16, 1, 32768]
    - [31, 5979.77]
  - - [96, 16, 1, 2048]
    - [32, 777.237]
  - - [96, 16, 1, 8192]
    - [30, 2432.27]
  - - [96, 16, 1, 32768]
    - [31, 7130.69]
  - - [112, 16, 1, 2048]
    - [32, 893.151]
  - - [112, 16, 1, 8192]
    - [33, 2774.96]
  - - [112, 16, 1, 32768]
    - [30, 8103.05]
  - - [128, 16, 1, 2048]
    - [32, 1012.5]
  - - [128, 16, 1, 8192]
    - [34, 3066.01]
  - - [128, 16, 1, 32768]
    - [34, 8894.75]
  - - [160, 16, 1, 2048]
    - [32, 1257.23]
  - - [160, 16, 1, 8192]
    - [31, 3671.0]
  - - [160, 16, 1, 32768]
    - [30, 8411.86]
  - - [192, 16, 1, 2048]
    - [32, 1505.92]
  - - [192, 16, 1, 8192]
    - [31, 4422.27]
  - - [192, 16, 1, 32768]
    - [30, 10054.6]
  - - [224, 16, 1, 2048]
    - [32, 1751.95]
  - - [224, 16, 1, 8192]
    - [31, 5090.28]
  - - [224, 16, 1, 32768]
    - [35, 11721.9]
  - - [256, 16, 1, 2048]
    - [36, 1777.82]
  - - [256, 16, 1, 8192]
    - [34, 5423.16]
  - - [256, 16, 1, 32768]
    - [34, 11093.8]
  - - [320, 16, 1, 2048]
    - [32, 2446.47]
  - - [320, 16, 1, 8192]
    - [34, 6735.73]
  - - [320, 16, 1, 32768]
    - [34, 14402.0]
  - - [384, 16, 1, 2048]
    - [32, 2899.02]
  - - [384, 16, 1, 8192]
    - [34, 7963.16]
  - - [384, 16, 1, 32768]
    - [34, 17321.7]
  - - [448, 16, 1, 2048]
    - [32, 3397.25]
  - - [448, 16, 1, 8192]
    - [37, 8814.28]
  - - [448, 16, 1, 32768]
    - [34, 20136.4]
  - - [512, 16, 1, 2048]
    - [38, 3213.15]
  - - [512, 16, 1, 8192]
    - [39, 8563.03]
  - - [512, 16, 1, 32768]
    - [40, 16274.7]
  - - [576, 16, 1, 2048]
    - [32, 4355.38]
  - - [576, 16, 1, 8192]
    - [38, 11547.7]
  - - [576, 16, 1, 32768]
    - [38, 24609.9]
  - - [640, 16, 1, 2048]
    - [32, 4765.46]
  - - [640, 16, 1, 8192]
    - [38, 12790.4]
  - - [640, 16, 1, 32768]
    - [38, 27233.1]
  - - [768, 16, 1, 2048]
    - [27, 5142.74]
  - - [768, 16, 1, 8192]
    - [38, 12975.0]
  - - [768, 16, 1, 32768]
    - [38, 25729.2]
  - - [896, 16, 1, 2048]
    - [32, 6569.89]
  - - [896, 16, 1, 8192]
    - [41, 15916.8]
  - - [896, 16, 1, 32768]
    - [41, 31990.9]
  - - [1024, 16, 1, 2048]
    - [42, 5771.91]
  - - [1024, 16, 1, 8192]
    - [40, 16031.2]
  - - [1024, 16, 1, 32768]
    - [40, 23977.6]
  - - [1280, 16, 1, 2048]
    - [43, 7891.08]
  - - [1280, 16, 1, 8192]
    - [40, 20510.4]
  - - [1280, 16, 1, 32768]
    - [40, 34202.2]
  - - [1536, 16, 1, 2048]
    - [38, 8126.86]
  - - [1536, 16, 1, 8192]
    - [41, 21600.5]
  - - [1536, 16, 1, 32768]
    - [41, 32424.7]
  - - [1792, 16, 1, 2048]
    - [43, 10891.5]
  - - [1792, 16, 1, 8192]
    - [44, 22760.3]
  - - [1792, 16, 1, 32768]
    - [41, 40006.8]
  - - [2048, 16, 1, 2048]
    - [40, 10026.1]
  - - [2048, 16, 1, 8192]
    - [40, 19626.1]
  - - [2048, 16, 1, 32768]
    - [40, 32172.2]
  - - [2304, 16, 1, 2048]
    - [45, 12293.7]
  - - [2304, 16, 1, 8192]
    - [46, 26422.4]
  - - [2304, 16, 1, 32768]
    - [41, 43074.3]
  - - [2560, 16, 1, 2048]
    - [47, 10395.3]
  - - [2560, 16, 1, 8192]
    - [41, 27019.5]
  - - [2560, 16, 1, 32768]
    - [40, 31538.3]
  - - [2816, 16, 1, 2048]
    - [48, 15055.1]
  - - [2816, 16, 1, 8192]
    - [41, 28923.1]
  - - [2816, 16, 1, 32768]
    - [41, 41625.3]
  - - [3072, 16, 1, 2048]
    - [46, 10497.7]
  - - [3072, 16, 1, 8192]
    - [41, 27099.7]
  - - [3072, 16, 1, 32768]
    - [41, 36914.0]
  - - [3584, 16, 1, 2048]
    - [38, 16046.3]
  - - [3584, 16, 1, 8192]
    - [44, 25218.2]
  - - [3584, 16, 1, 32768]
    - [44, 31733.5]
  - - [4096, 16, 1, 2048]
    - [38, 18169.4]
  - - [4096, 16, 1, 8192]
    - [41, 27672.8]
  - - [4096, 16, 1, 32768]
    - [41, 34169.1]
  - - [4608, 16, 1, 2048]
    - [41, 19134.7]
  - - [4608, 16, 1, 8192]
    - [46, 29199.5]
  - - [4608, 16, 1, 32768]
    - [41, 38879.9]
  - - [5120, 16, 1, 2048]
    - [39, 20795.9]
  - - [5120, 16, 1, 8192]
    - [41, 34339.1]
  - - [5120, 16, 1, 32768]
    - [41, 42771.4]
  - - [5632, 16, 1, 2048]
    - [44, 19604.4]
  - - [5632, 16, 1, 8192]
    - [44, 24713.9]
  - - [5632, 16, 1, 32768]
    - [40, 31920.7]
  - - [6144, 16, 1, 2048]
    - [49, 18495.7]
  - - [6144, 16, 1, 8192]
    - [44, 26803.2]
  - - [6144, 16, 1, 32768]
    - [40, 33722.0]
  - - [7168, 16, 1, 2048]
    - [44, 23176.8]
  - - [7168, 16, 1, 8192]
    - [44, 31670.8]
  - - [7168, 16, 1, 32768]
    - [44, 34230.9]
  - - [8192, 16, 1, 2048]
    - [41, 26524.4]
  - - [8192, 16, 1, 8192]
    - [41, 35040.8]
  - - [8192, 16, 1, 32768]
    - [41, 37861.0]
  - - [10240, 16, 1, 2048]
    - [41, 32606.6]
  - - [10240, 16, 1, 8192]
    - [41, 42667.8]
  - - [10240, 16, 1, 32768]
    - [41, 46049.9]
  - - [12288, 16, 1, 2048]
    - [41, 20765.3]
  - - [12288, 16, 1, 8192]
    - [40, 28163.1]
  - - [12288, 16, 1, 32768]
    - [40, 34454.4]
  - - [14336, 16, 1, 2048]
    - [41, 24000.4]
  - - [14336, 16, 1, 8192]
    - [41, 30898.2]
  - - [14336, 16, 1, 32768]
    - [40, 34410.0]
  - - [16384, 16, 1, 2048]
    - [40, 24690.4]
  - - [16384, 16, 1, 8192]
    - [40, 30648.8]
  - - [16384, 16, 1, 32768]
    - [40, 35732.2]
  - - [20480, 16, 1, 2048]
    - [40, 29778.6]
  - - [20480, 16, 1, 8192]
    - [40, 35745.2]
  - - [20480, 16, 1, 32768]
    - [40, 37667.7]
  - - [24576, 16, 1, 2048]
    - [40, 24510.4]
  - - [24576, 16, 1, 8192]
    - [40, 31254.8]
  - - [24576, 16, 1, 32768]
    - [40, 34651.7]
  - - [28672, 16, 1, 2048]
    - [40, 28111.8]
  - - [28672, 16, 1, 8192]
    - [40, 33419.3]
  - - [28672, 16, 1, 32768]
    - [40, 35062.3]
  - - [32768, 16, 1, 2048]
    - [47, 24676.8]
  - - [32768, 16, 1, 8192]
    - [40, 30752.7]
  - - [32768, 16, 1, 32768]
    - [40, 35948.5]
  - - [40960, 16, 1, 2048]
    - [40, 29681.0]
  - - [40960, 16, 1, 8192]
    - [40, 35653.4]
  - - [40960, 16, 1, 32768]
    - [40, 37464.8]
  - - [49152, 16, 1, 2048]
    - [40, 28505.4]
  - - [49152, 16, 1, 8192]
    - [40, 34204.4]
  - - [49152, 16, 1, 32768]
    - [40, 35650.6]
  - - [57344, 16, 1, 2048]
    - [40, 27876.1]
  - - [57344, 16, 1, 8192]
    - [40, 33307.4]
  - - [65536, 16, 1, 2048]
    - [40, 27984.4]
  - - [65536, 16, 1, 8192]
    - [40, 33094.0]
  - - [98304, 16, 1, 2048]
    - [40, 28677.8]
  - - [98304, 16, 1, 8192]
    - [40, 34172.7]
  - - [131072, 16, 1, 2048]
    - [40, 30023.5]
  - - [131072, 16, 1, 8192]
    - [40, 35950.9]
  - - [15360, 16, 1, 2048]
    - [40, 22644.2]
  - - [15360, 16, 1, 8192]
    - [40, 32114.9]
  - - [15360, 16, 1, 32768]
    - [40, 35849.7]
  - - [22528, 16, 1, 2048]
    - [40, 22307.3]
  - - [22528, 16, 1, 8192]
    - [40, 28981.7]
  - - [22528, 16, 1, 32768]
    - [40, 34099.8]
  - - [38016, 16, 1, 2048]
    - [47, 33805.9]
  - - [38016, 16, 1, 8192]
    - [40, 39657.9]
  - - [38016, 16, 1, 32768]
    - [40, 42143.4]
  - - [163840, 16, 1, 2048]
    - [40, 29799.2]
  - - [163840, 16, 1, 8192]
    - [40, 35361.5]
  - - [7, 32, 1, 2048]
    - [25, 117.472]
  - - [7, 32, 1, 8192]
    - [24, 386.046]
  - - [7, 32, 1, 32768]
    - [25, 1137.87]
  - - [16, 32, 1, 2048]
    - [26, 276.105]
  - - [16, 32, 1, 8192]
    - [29, 891.565]
  - - [16, 32, 1, 32768]
    - [50, 2689.45]
  - - [32, 32, 1, 2048]
    - [26, 547.815]
  - - [32, 32, 1, 8192]
    - [30, 1681.46]
  - - [32, 32, 1, 32768]
    - [51, 4964.29]
  - - [48, 32, 1, 2048]
    - [29, 742.134]
  - - [48, 32, 1, 8192]
    - [30, 2450.22]
  - - [48, 32, 1, 32768]
    - [52, 7369.71]
  - - [64, 32, 1, 2048]
    - [26, 1064.14]
  - - [64, 32, 1, 8192]
    - [53, 3116.59]
  - - [64, 32, 1, 32768]
    - [54, 9118.37]
  - - [80, 32, 1, 2048]
    - [26, 1306.01]
  - - [80, 32, 1, 8192]
    - [50, 3693.16]
  - - [80, 32, 1, 32768]
    - [55, 8751.38]
  - - [96, 32, 1, 2048]
    - [32, 1543.77]
  - - [96, 32, 1, 8192]
    - [55, 4462.83]
  - - [96, 32, 1, 32768]
    - [55, 10494.2]
  - - [112, 32, 1, 2048]
    - [32, 1781.18]
  - - [112, 32, 1, 8192]
    - [31, 5103.76]
  - - [112, 32, 1, 32768]
    - [30, 11819.1]
  - - [128, 32, 1, 2048]
    - [26, 1991.46]
  - - [128, 32, 1, 8192]
    - [56, 5525.93]
  - - [128, 32, 1, 32768]
    - [56, 12121.7]
  - - [160, 32, 1, 2048]
    - [26, 2477.53]
  - - [160, 32, 1, 8192]
    - [54, 6898.53]
  - - [160, 32, 1, 32768]
    - [56, 14687.1]
  - - [192, 32, 1, 2048]
    - [26, 2952.9]
  - - [192, 32, 1, 8192]
    - [54, 8191.01]
  - - [192, 32, 1, 32768]
    - [56, 18016.9]
  - - [224, 32, 1, 2048]
    - [26, 3428.11]
  - - [224, 32, 1, 8192]
    - [54, 9622.09]
  - - [224, 32, 1, 32768]
    - [56, 20524.1]
  - - [256, 32, 1, 2048]
    - [57, 3360.49]
  - - [256, 32, 1, 8192]
    - [58, 9466.99]
  - - [256, 32, 1, 32768]
    - [58, 20527.4]
  - - [320, 32, 1, 2048]
    - [32, 4819.47]
  - - [320, 32, 1, 8192]
    - [59, 12295.8]
  - - [320, 32, 1, 32768]
    - [58, 26185.6]
  - - [384, 32, 1, 2048]
    - [30, 5482.55]
  - - [384, 32, 1, 8192]
    - [58, 14481.4]
  - - [384, 32, 1, 32768]
    - [58, 31310.0]
  - - [448, 32, 1, 2048]
    - [60, 5761.48]
  - - [448, 32, 1, 8192]
    - [58, 14465.4]
  - - [448, 32, 1, 32768]
    - [61, 29168.5]
  - - [512, 32, 1, 2048]
    - [62, 5965.29]
  - - [512, 32, 1, 8192]
    - [59, 17902.3]
  - - [512, 32, 1, 32768]
    - [61, 31602.8]
  - - [576, 32, 1, 2048]
    - [43, 7792.64]
  - - [576, 32, 1, 8192]
    - [59, 21823.5]
  - - [576, 32, 1, 32768]
    - [59, 45208.8]
  - - [640, 32, 1, 2048]
    - [43, 8723.5]
  - - [640, 32, 1, 8192]
    - [59, 22126.3]
  - - [640, 32, 1, 32768]
    - [59, 50288.7]
  - - [768, 32, 1, 2048]
    - [43, 9523.18]
  - - [768, 32, 1, 8192]
    - [63, 24418.0]
  - - [768, 32, 1, 32768]
    - [59, 48134.0]
  - - [896, 32, 1, 2048]
    - [43, 12106.8]
  - - [896, 32, 1, 8192]
    - [64, 23895.2]
  - - [896, 32, 1, 32768]
    - [65, 44640.5]
  - - [1024, 32, 1, 2048]
    - [61, 11052.2]
  - - [1024, 32, 1, 8192]
    - [66, 28382.5]
  - - [1024, 32, 1, 32768]
    - [61, 49708.6]
  - - [1280, 32, 1, 2048]
    - [60, 14781.5]
  - - [1280, 32, 1, 8192]
    - [65, 36755.8]
  - - [1280, 32, 1, 32768]
    - [61, 64212.5]
  - - [1536, 32, 1, 2048]
    - [61, 15302.7]
  - - [1536, 32, 1, 8192]
    - [67, 41059.4]
  - - [1536, 32, 1, 32768]
    - [68, 62877.8]
  - - [1792, 32, 1, 2048]
    - [60, 20409.4]
  - - [1792, 32, 1, 8192]
    - [69, 43472.8]
  - - [1792, 32, 1, 32768]
    - [70, 73535.8]
  - - [2048, 32, 1, 2048]
    - [61, 18841.8]
  - - [2048, 32, 1, 8192]
    - [61, 45003.7]
  - - [2048, 32, 1, 32768]
    - [70, 73723.0]
  - - [2304, 32, 1, 2048]
    - [63, 23631.0]
  - - [2304, 32, 1, 8192]
    - [70, 53793.0]
  - - [2304, 32, 1, 32768]
    - [70, 91215.0]
  - - [2560, 32, 1, 2048]
    - [67, 23078.1]
  - - [2560, 32, 1, 8192]
    - [70, 54302.0]
  - - [2560, 32, 1, 32768]
    - [70, 90650.4]
  - - [2816, 32, 1, 2048]
    - [63, 28568.7]
  - - [2816, 32, 1, 8192]
    - [71, 58308.7]
  - - [2816, 32, 1, 32768]
    - [70, 98380.1]
  - - [3072, 32, 1, 2048]
    - [63, 26208.7]
  - - [3072, 32, 1, 8192]
    - [70, 51812.3]
  - - [3072, 32, 1, 32768]
    - [70, 85690.1]
  - - [3584, 32, 1, 2048]
    - [72, 25916.8]
  - - [3584, 32, 1, 8192]
    - [70, 59009.2]
  - - [3584, 32, 1, 32768]
    - [70, 87324.3]
  - - [4096, 32, 1, 2048]
    - [59, 33935.3]
  - - [4096, 32, 1, 8192]
    - [71, 61783.9]
  - - [4096, 32, 1, 32768]
    - [71, 89779.4]
  - - [4608, 32, 1, 2048]
    - [59, 38191.8]
  - - [4608, 32, 1, 8192]
    - [70, 66809.6]
  - - [4608, 32, 1, 32768]
    - [70, 92237.8]
  - - [5120, 32, 1, 2048]
    - [73, 39320.3]
  - - [5120, 32, 1, 8192]
    - [70, 71300.1]
  - - [5120, 32, 1, 32768]
    - [70, 101629.0]
  - - [5632, 32, 1, 2048]
    - [74, 39427.1]
  - - [5632, 32, 1, 8192]
    - [70, 67232.5]
  - - [5632, 32, 1, 32768]
    - [70, 87899.4]
  - - [6144, 32, 1, 2048]
    - [68, 37724.3]
  - - [6144, 32, 1, 8192]
    - [70, 71481.5]
  - - [6144, 32, 1, 32768]
    - [70, 94625.4]
  - - [7168, 32, 1, 2048]
    - [74, 42638.3]
  - - [7168, 32, 1, 8192]
    - [75, 26485.1]
  - - [7168, 32, 1, 32768]
    - [76, 36905.4]
  - - [8192, 32, 1, 2048]
    - [68, 54423.4]
  - - [8192, 32, 1, 8192]
    - [70, 73896.0]
  - - [8192, 32, 1, 32768]
    - [71, 94892.9]
  - - [10240, 32, 1, 2048]
    - [68, 67494.3]
  - - [10240, 32, 1, 8192]
    - [70, 90816.4]
  - - [10240, 32, 1, 32768]
    - [70, 110342.0]
  - - [12288, 32, 1, 2048]
    - [70, 53542.0]
  - - [12288, 32, 1, 8192]
    - [71, 75064.4]
  - - [12288, 32, 1, 32768]
    - [71, 94797.0]
  - - [14336, 32, 1, 2048]
    - [75, 52478.0]
  - - [14336, 32, 1, 8192]
    - [75, 66690.0]
  - - [14336, 32, 1, 32768]
    - [77, 72536.4]
  - - [16384, 32, 1, 2048]
    - [70, 72158.9]
  - - [16384, 32, 1, 8192]
    - [70, 91051.8]
  - - [16384, 32, 1, 32768]
    - [70, 94483.9]
  - - [20480, 32, 1, 2048]
    - [70, 87774.5]
  - - [20480, 32, 1, 8192]
    - [70, 110541.0]
  - - [20480, 32, 1, 32768]
    - [70, 118028.0]
  - - [24576, 32, 1, 2048]
    - [61, 61271.4]
  - - [24576, 32, 1, 8192]
    - [71, 72418.9]
  - - [24576, 32, 1, 32768]
    - [71, 81219.3]
  - - [28672, 32, 1, 2048]
    - [61, 70277.4]
  - - [28672, 32, 1, 8192]
    - [71, 83040.5]
  - - [32768, 32, 1, 2048]
    - [71, 71642.5]
  - - [32768, 32, 1, 8192]
    - [71, 84234.2]
  - - [40960, 32, 1, 2048]
    - [71, 85303.0]
  - - [40960, 32, 1, 8192]
    - [71, 101801.0]
  - - [49152, 32, 1, 2048]
    - [61, 76760.5]
  - - [49152, 32, 1, 8192]
    - [61, 87299.7]
  - - [57344, 32, 1, 2048]
    - [71, 80633.2]
  - - [57344, 32, 1, 8192]
    - [71, 94281.7]
  - - [65536, 32, 1, 2048]
    - [61, 76027.8]
  - - [65536, 32, 1, 8192]
    - [61, 84348.6]
  - - [98304, 32, 1, 2048]
    - [71, 82228.2]
  - - [98304, 32, 1, 8192]
    - [71, 95776.6]
  - - [131072, 32, 1, 2048]
    - [78, 80942.2]
  - - [131072, 32, 1, 8192]
    - [79, 93634.8]
  - - [262144, 32, 1, 2048]
    - [79, 84861.4]
  - - [262144, 32, 1, 8192]
    - [79, 99145.7]
  - - [15360, 32, 1, 2048]
    - [75, 56232.7]
  - - [15360, 32, 1, 8192]
    - [71, 68269.7]
  - - [15360, 32, 1, 32768]
    - [71, 76218.7]
  - - [22528, 32, 1, 2048]
    - [75, 18633.3]
  - - [22528, 32, 1, 8192]
    - [75, 34029.8]
  - - [22528, 32, 1, 32768]
    - [71, 52549.5]
  - - [38016, 32, 1, 2048]
    - [61, 88698.3]
  - - [38016, 32, 1, 8192]
    - [61, 101766.0]
  - - [163840, 32, 1, 2048]
    - [79, 83621.0]
  - - [163840, 32, 1, 8192]
    - [79, 98164.6]
  - - [7, 48, 1, 2048]
    - [25, 171.208]
  - - [7, 48, 1, 8192]
    - [25, 549.785]
  - - [7, 48, 1, 32768]
    - [80, 1583.68]
  - - [16, 48, 1, 2048]
    - [29, 387.123]
  - - [16, 48, 1, 8192]
    - [26, 1337.69]
  - - [16, 48, 1, 32768]
    - [81, 4046.92]
  - - [32, 48, 1, 2048]
    - [29, 752.418]
  - - [32, 48, 1, 8192]
    - [26, 2593.47]
  - - [32, 48, 1, 32768]
    - [26, 7772.86]
  - - [48, 48, 1, 2048]
    - [29, 1085.43]
  - - [48, 48, 1, 8192]
    - [82, 3397.49]
  - - [48, 48, 1, 32768]
    - [83, 8642.59]
  - - [64, 48, 1, 2048]
    - [26, 1576.81]
  - - [64, 48, 1, 8192]
    - [55, 4489.64]
  - - [64, 48, 1, 32768]
    - [55, 10548.0]
  - - [80, 48, 1, 2048]
    - [26, 1938.1]
  - - [80, 48, 1, 8192]
    - [31, 5552.68]
  - - [80, 48, 1, 32768]
    - [55, 13038.2]
  - - [96, 48, 1, 2048]
    - [32, 2294.89]
  - - [96, 48, 1, 8192]
    - [55, 6646.04]
  - - [96, 48, 1, 32768]
    - [30, 15358.4]
  - - [112, 48, 1, 2048]
    - [26, 2642.08]
  - - [112, 48, 1, 8192]
    - [55, 7560.28]
  - - [112, 48, 1, 32768]
    - [30, 17337.7]
  - - [128, 48, 1, 2048]
    - [32, 2940.72]
  - - [128, 48, 1, 8192]
    - [34, 8259.99]
  - - [128, 48, 1, 32768]
    - [56, 17901.6]
  - - [160, 48, 1, 2048]
    - [32, 3652.63]
  - - [160, 48, 1, 8192]
    - [54, 10159.2]
  - - [160, 48, 1, 32768]
    - [56, 22017.5]
  - - [192, 48, 1, 2048]
    - [32, 4357.6]
  - - [192, 48, 1, 8192]
    - [34, 12141.5]
  - - [192, 48, 1, 32768]
    - [63, 26213.2]
  - - [224, 48, 1, 2048]
    - [26, 4991.91]
  - - [224, 48, 1, 8192]
    - [84, 11243.3]
  - - [224, 48, 1, 32768]
    - [61, 22117.3]
  - - [256, 48, 1, 2048]
    - [85, 4891.08]
  - - [256, 48, 1, 8192]
    - [86, 13280.0]
  - - [256, 48, 1, 32768]
    - [61, 24790.6]
  - - [320, 48, 1, 2048]
    - [57, 6141.13]
  - - [320, 48, 1, 8192]
    - [86, 16475.4]
  - - [320, 48, 1, 32768]
    - [84, 30852.6]
  - - [384, 48, 1, 2048]
    - [55, 7178.88]
  - - [384, 48, 1, 8192]
    - [84, 18914.1]
  - - [384, 48, 1, 32768]
    - [84, 36734.3]
  - - [448, 48, 1, 2048]
    - [55, 8410.95]
  - - [448, 48, 1, 8192]
    - [87, 18608.3]
  - - [448, 48, 1, 32768]
    - [87, 33362.8]
  - - [512, 48, 1, 2048]
    - [88, 8690.87]
  - - [512, 48, 1, 8192]
    - [84, 22966.3]
  - - [512, 48, 1, 32768]
    - [71, 38422.5]
  - - [576, 48, 1, 2048]
    - [48, 10249.0]
  - - [576, 48, 1, 8192]
    - [84, 28105.9]
  - - [576, 48, 1, 32768]
    - [84, 53799.5]
  - - [640, 48, 1, 2048]
    - [48, 11322.1]
  - - [640, 48, 1, 8192]
    - [84, 31306.6]
  - - [640, 48, 1, 32768]
    - [84, 60167.4]
  - - [768, 48, 1, 2048]
    - [60, 13308.1]
  - - [768, 48, 1, 8192]
    - [84, 31388.1]
  - - [768, 48, 1, 32768]
    - [87, 54022.0]
  - - [896, 48, 1, 2048]
    - [48, 15737.4]
  - - [896, 48, 1, 8192]
    - [87, 35901.4]
  - - [896, 48, 1, 32768]
    - [87, 67921.4]
  - - [1024, 48, 1, 2048]
    - [38, 13712.7]
  - - [1024, 48, 1, 8192]
    - [61, 35591.9]
  - - [1024, 48, 1, 32768]
    - [71, 53823.6]
  - - [1280, 48, 1, 2048]
    - [89, 19038.4]
  - - [1280, 48, 1, 8192]
    - [84, 45198.8]
  - - [1280, 48, 1, 32768]
    - [71, 72863.6]
  - - [1536, 48, 1, 2048]
    - [38, 20730.3]
  - - [1536, 48, 1, 8192]
    - [87, 46734.0]
  - - [1536, 48, 1, 32768]
    - [87, 67347.2]
  - - [1792, 48, 1, 2048]
    - [89, 26346.1]
  - - [1792, 48, 1, 8192]
    - [90, 52597.7]
  - - [1792, 48, 1, 32768]
    - [87, 84376.0]
  - - [2048, 48, 1, 2048]
    - [59, 25145.6]
  - - [2048, 48, 1, 8192]
    - [71, 48964.2]
  - - [2048, 48, 1, 32768]
    - [71, 70333.3]
  - - [2304, 48, 1, 2048]
    - [59, 30971.9]
  - - [2304, 48, 1, 8192]
    - [87, 61736.5]
  - - [2304, 48, 1, 32768]
    - [87, 89713.3]
  - - [2560, 48, 1, 2048]
    - [59, 31754.0]
  - - [2560, 48, 1, 8192]
    - [87, 58137.0]
  - - [2560, 48, 1, 32768]
    - [87, 79367.4]
  - - [2816, 48, 1, 2048]
    - [91, 34797.4]
  - - [2816, 48, 1, 8192]
    - [87, 62489.2]
  - - [2816, 48, 1, 32768]
    - [87, 85646.0]
  - - [3072, 48, 1, 2048]
    - [91, 33503.2]
  - - [3072, 48, 1, 8192]
    - [87, 57098.5]
  - - [3072, 48, 1, 32768]
    - [70, 73964.6]
  - - [3584, 48, 1, 2048]
    - [91, 38991.7]
  - - [3584, 48, 1, 8192]
    - [90, 54778.0]
  - - [3584, 48, 1, 32768]
    - [90, 68824.9]
  - - [4096, 48, 1, 2048]
    - [68, 41278.9]
  - - [4096, 48, 1, 8192]
    - [87, 57839.7]
  - - [4096, 48, 1, 32768]
    - [71, 73342.8]
  - - [4608, 48, 1, 2048]
    - [68, 46229.8]
  - - [4608, 48, 1, 8192]
    - [87, 65144.8]
  - - [4608, 48, 1, 32768]
    - [87, 77933.6]
  - - [5120, 48, 1, 2048]
    - [68, 51198.8]
  - - [5120, 48, 1, 8192]
    - [87, 71481.5]
  - - [5120, 48, 1, 32768]
    - [87, 85968.4]
  - - [5632, 48, 1, 2048]
    - [90, 42454.3]
  - - [5632, 48, 1, 8192]
    - [71, 55466.1]
  - - [5632, 48, 1, 32768]
    - [71, 68275.9]
  - - [6144, 48, 1, 2048]
    - [90, 44399.4]
  - - [6144, 48, 1, 8192]
    - [71, 59665.2]
  - - [6144, 48, 1, 32768]
    - [71, 74127.2]
  - - [7168, 48, 1, 2048]
    - [90, 51624.4]
  - - [7168, 48, 1, 8192]
    - [90, 68350.7]
  - - [7168, 48, 1, 32768]
    - [90, 72950.2]
  - - [8192, 48, 1, 2048]
    - [87, 62283.2]
  - - [8192, 48, 1, 8192]
    - [87, 69382.7]
  - - [8192, 48, 1, 32768]
    - [87, 73923.2]
  - - [10240, 48, 1, 2048]
    - [70, 70816.3]
  - - [10240, 48, 1, 8192]
    - [87, 85480.9]
  - - [10240, 48, 1, 32768]
    - [87, 90693.4]
  - - [12288, 48, 1, 2048]
    - [61, 48828.2]
  - - [12288, 48, 1, 8192]
    - [71, 57446.9]
  - - [12288, 48, 1, 32768]
    - [71, 61520.1]
  - - [14336, 48, 1, 2048]
    - [61, 54400.7]
  - - [14336, 48, 1, 8192]
    - [71, 65298.6]
  - - [14336, 48, 1, 32768]
    - [71, 70295.5]
  - - [16384, 48, 1, 2048]
    - [71, 55019.7]
  - - [16384, 48, 1, 8192]
    - [71, 64365.0]
  - - [16384, 48, 1, 32768]
    - [71, 64738.4]
  - - [20480, 48, 1, 2048]
    - [71, 67313.4]
  - - [20480, 48, 1, 8192]
    - [71, 78286.3]
  - - [24576, 48, 1, 2048]
    - [61, 60331.3]
  - - [24576, 48, 1, 8192]
    - [71, 67339.7]
  - - [28672, 48, 1, 2048]
    - [71, 62851.1]
  - - [28672, 48, 1, 8192]
    - [61, 67521.9]
  - - [32768, 48, 1, 2048]
    - [61, 61827.8]
  - - [32768, 48, 1, 8192]
    - [61, 67557.4]
  - - [40960, 48, 1, 2048]
    - [71, 66409.8]
  - - [40960, 48, 1, 8192]
    - [71, 76474.1]
  - - [49152, 48, 1, 2048]
    - [61, 64393.0]
  - - [49152, 48, 1, 8192]
    - [71, 71381.5]
  - - [57344, 48, 1, 2048]
    - [61, 63623.2]
  - - [57344, 48, 1, 8192]
    - [71, 71084.0]
  - - [65536, 48, 1, 2048]
    - [78, 66100.6]
  - - [65536, 48, 1, 8192]
    - [71, 69923.6]
  - - [98304, 48, 1, 2048]
    - [78, 63061.2]
  - - [98304, 48, 1, 8192]
    - [79, 71647.5]
  - - [131072, 48, 1, 2048]
    - [78, 67421.4]
  - - [131072, 48, 1, 8192]
    - [79, 74846.4]
  - - [262144, 48, 1, 2048]
    - [78, 63726.5]
  - - [262144, 48, 1, 8192]
    - [79, 74396.4]
  - - [15360, 48, 1, 2048]
    - [75, 55125.7]
  - - [15360, 48, 1, 8192]
    - [75, 63810.6]
  - - [15360, 48, 1, 32768]
    - [75, 65639.4]
  - - [22528, 48, 1, 2048]
    - [71, 51465.0]
  - - [22528, 48, 1, 8192]
    - [71, 58491.7]
  - - [38016, 48, 1, 2048]
    - [61, 72737.4]
  - - [38016, 48, 1, 8192]
    - [61, 81553.0]
  - - [163840, 48, 1, 2048]
    - [79, 62710.9]
  - - [163840, 48, 1, 8192]
    - [79, 73081.8]
  - - [7, 64, 1, 2048]
    - [92, 202.028]
  - - [7, 64, 1, 8192]
    - [93, 650.251]
  - - [7, 64, 1, 32768]
    - [94, 1928.56]
  - - [16, 64, 1, 2048]
    - [26, 539.231]
  - - [16, 64, 1, 8192]
    - [50, 1685.93]
  - - [16, 64, 1, 32768]
    - [52, 4682.78]
  - - [32, 64, 1, 2048]
    - [26, 1070.3]
  - - [32, 64, 1, 8192]
    - [50, 3292.66]
  - - [32, 64, 1, 32768]
    - [95, 9038.12]
  - - [48, 64, 1, 2048]
    - [26, 1569.87]
  - - [48, 64, 1, 8192]
    - [50, 4742.7]
  - - [48, 64, 1, 32768]
    - [50, 12139.4]
  - - [64, 64, 1, 2048]
    - [26, 2075.92]
  - - [64, 64, 1, 8192]
    - [96, 5579.35]
  - - [64, 64, 1, 32768]
    - [97, 12407.9]
  - - [80, 64, 1, 2048]
    - [26, 2545.03]
  - - [80, 64, 1, 8192]
    - [95, 6883.77]
  - - [80, 64, 1, 32768]
    - [56, 14901.3]
  - - [96, 64, 1, 2048]
    - [32, 3004.77]
  - - [96, 64, 1, 8192]
    - [96, 8297.93]
  - - [96, 64, 1, 32768]
    - [98, 17993.6]
  - - [112, 64, 1, 2048]
    - [32, 3430.2]
  - - [112, 64, 1, 8192]
    - [96, 9543.41]
  - - [112, 64, 1, 32768]
    - [98, 20470.3]
  - - [128, 64, 1, 2048]
    - [32, 3834.73]
  - - [128, 64, 1, 8192]
    - [99, 10190.6]
  - - [128, 64, 1, 32768]
    - [99, 20981.9]
  - - [160, 64, 1, 2048]
    - [32, 4749.45]
  - - [160, 64, 1, 8192]
    - [99, 12596.0]
  - - [160, 64, 1, 32768]
    - [99, 26156.1]
  - - [192, 64, 1, 2048]
    - [32, 5656.96]
  - - [192, 64, 1, 8192]
    - [58, 15156.7]
  - - [192, 64, 1, 32768]
    - [99, 31425.1]
  - - [224, 64, 1, 2048]
    - [100, 5859.91]
  - - [224, 64, 1, 8192]
    - [101, 15990.2]
  - - [224, 64, 1, 32768]
    - [102, 29680.6]
  - - [256, 64, 1, 2048]
    - [57, 6220.21]
  - - [256, 64, 1, 8192]
    - [103, 17426.9]
  - - [256, 64, 1, 32768]
    - [103, 34269.7]
  - - [320, 64, 1, 2048]
    - [55, 7982.92]
  - - [320, 64, 1, 8192]
    - [58, 20388.0]
  - - [320, 64, 1, 32768]
    - [104, 43071.3]
  - - [384, 64, 1, 2048]
    - [55, 9506.99]
  - - [384, 64, 1, 8192]
    - [103, 23277.6]
  - - [384, 64, 1, 32768]
    - [105, 46316.5]
  - - [448, 64, 1, 2048]
    - [57, 9744.69]
  - - [448, 64, 1, 8192]
    - [103, 26250.7]
  - - [448, 64, 1, 32768]
    - [106, 49340.0]
  - - [512, 64, 1, 2048]
    - [61, 11081.5]
  - - [512, 64, 1, 8192]
    - [107, 27822.3]
  - - [512, 64, 1, 32768]
    - [108, 53286.4]
  - - [576, 64, 1, 2048]
    - [102, 12506.0]
  - - [576, 64, 1, 8192]
    - [107, 32667.7]
  - - [576, 64, 1, 32768]
    - [106, 62786.1]
  - - [640, 64, 1, 2048]
    - [61, 13794.8]
  - - [640, 64, 1, 8192]
    - [102, 38107.2]
  - - [640, 64, 1, 32768]
    - [106, 68925.7]
  - - [768, 64, 1, 2048]
    - [63, 16020.3]
  - - [768, 64, 1, 8192]
    - [102, 40398.9]
  - - [768, 64, 1, 32768]
    - [109, 73691.0]
  - - [896, 64, 1, 2048]
    - [110, 10984.4]
  - - [896, 64, 1, 8192]
    - [111, 43667.2]
  - - [896, 64, 1, 32768]
    - [108, 33528.1]
  - - [1024, 64, 1, 2048]
    - [112, 18221.4]
  - - [1024, 64, 1, 8192]
    - [113, 48818.3]
  - - [1024, 64, 1, 32768]
    - [108, 82861.1]
  - - [1280, 64, 1, 2048]
    - [112, 25388.5]
  - - [1280, 64, 1, 8192]
    - [114, 61516.3]
  - - [1280, 64, 1, 32768]
    - [110, 103329.0]
  - - [1536, 64, 1, 2048]
    - [114, 25620.3]
  - - [1536, 64, 1, 8192]
    - [110, 61827.9]
  - - [1536, 64, 1, 32768]
    - [115, 97928.3]
  - - [1792, 64, 1, 2048]
    - [116, 30136.3]
  - - [1792, 64, 1, 8192]
    - [117, 69480.4]
  - - [1792, 64, 1, 32768]
    - [117, 109034.0]
  - - [2048, 64, 1, 2048]
    - [59, 33666.6]
  - - [2048, 64, 1, 8192]
    - [110, 73758.7]
  - - [2048, 64, 1, 32768]
    - [118, 113859.0]
  - - [2304, 64, 1, 2048]
    - [59, 41626.8]
  - - [2304, 64, 1, 8192]
    - [119, 84823.9]
  - - [2304, 64, 1, 32768]
    - [120, 130233.0]
  - - [2560, 64, 1, 2048]
    - [59, 42591.8]
  - - [2560, 64, 1, 8192]
    - [121, 87653.8]
  - - [2560, 64, 1, 32768]
    - [119, 140723.0]
  - - [2816, 64, 1, 2048]
    - [122, 44101.6]
  - - [2816, 64, 1, 8192]
    - [120, 91838.3]
  - - [2816, 64, 1, 32768]
    - [120, 140617.0]
  - - [3072, 64, 1, 2048]
    - [114, 42956.2]
  - - [3072, 64, 1, 8192]
    - [123, 88847.9]
  - - [3072, 64, 1, 32768]
    - [119, 130917.0]
  - - [3584, 64, 1, 2048]
    - [124, 50147.7]
  - - [3584, 64, 1, 8192]
    - [123, 99666.3]
  - - [3584, 64, 1, 32768]
    - [125, 147712.0]
  - - [4096, 64, 1, 2048]
    - [114, 55911.8]
  - - [4096, 64, 1, 8192]
    - [123, 100863.0]
  - - [4096, 64, 1, 32768]
    - [125, 148813.0]
  - - [4608, 64, 1, 2048]
    - [114, 62574.3]
  - - [4608, 64, 1, 8192]
    - [115, 109135.0]
  - - [4608, 64, 1, 32768]
    - [115, 171678.0]
  - - [5120, 64, 1, 2048]
    - [124, 68982.4]
  - - [5120, 64, 1, 8192]
    - [115, 119904.0]
  - - [5120, 64, 1, 32768]
    - [115, 187797.0]
  - - [5632, 64, 1, 2048]
    - [109, 60647.2]
  - - [5632, 64, 1, 8192]
    - [115, 128321.0]
  - - [5632, 64, 1, 32768]
    - [115, 184713.0]
  - - [6144, 64, 1, 2048]
    - [125, 61052.5]
  - - [6144, 64, 1, 8192]
    - [123, 126329.0]
  - - [6144, 64, 1, 32768]
    - [115, 173940.0]
  - - [7168, 64, 1, 2048]
    - [126, 66545.6]
  - - [7168, 64, 1, 8192]
    - [115, 126278.0]
  - - [7168, 64, 1, 32768]
    - [115, 175997.0]
  - - [8192, 64, 1, 2048]
    - [108, 78389.3]
  - - [8192, 64, 1, 8192]
    - [118, 140855.0]
  - - [8192, 64, 1, 32768]
    - [115, 201400.0]
  - - [10240, 64, 1, 2048]
    - [110, 97714.9]
  - - [10240, 64, 1, 8192]
    - [115, 154335.0]
  - - [10240, 64, 1, 32768]
    - [115, 204258.0]
  - - [12288, 64, 1, 2048]
    - [118, 81271.6]
  - - [12288, 64, 1, 8192]
    - [118, 137003.0]
  - - [12288, 64, 1, 32768]
    - [127, 132530.0]
  - - [14336, 64, 1, 2048]
    - [125, 47089.4]
  - - [14336, 64, 1, 8192]
    - [123, 124653.0]
  - - [16384, 64, 1, 2048]
    - [119, 107980.0]
  - - [16384, 64, 1, 8192]
    - [115, 151427.0]
  - - [20480, 64, 1, 2048]
    - [119, 133828.0]
  - - [20480, 64, 1, 8192]
    - [118, 178772.0]
  - - [24576, 64, 1, 2048]
    - [125, 121680.0]
  - - [24576, 64, 1, 8192]
    - [115, 158707.0]
  - - [28672, 64, 1, 2048]
    - [125, 131633.0]
  - - [28672, 64, 1, 8192]
    - [125, 166831.0]
  - - [32768, 64, 1, 2048]
    - [115, 145051.0]
  - - [32768, 64, 1, 8192]
    - [115, 170747.0]
  - - [40960, 64, 1, 2048]
    - [115, 179286.0]
  - - [40960, 64, 1, 8192]
    - [115, 210461.0]
  - - [49152, 64, 1, 2048]
    - [119, 142380.0]
  - - [49152, 64, 1, 8192]
    - [119, 176750.0]
  - - [57344, 64, 1, 2048]
    - [119, 164825.0]
  - - [57344, 64, 1, 8192]
    - [119, 185384.0]
  - - [65536, 64, 1, 2048]
    - [128, 146749.0]
  - - [65536, 64, 1, 8192]
    - [129, 171626.0]
  - - [98304, 64, 1, 2048]
    - [128, 176462.0]
  - - [98304, 64, 1, 8192]
    - [128, 198039.0]
  - - [131072, 64, 1, 2048]
    - [128, 174883.0]
  - - [131072, 64, 1, 8192]
    - [128, 192696.0]
  - - [262144, 64, 1, 2048]
    - [128, 194644.0]
  - - [15360, 64, 1, 2048]
    - [126, 100967.0]
  - - [15360, 64, 1, 8192]
    - [125, 154178.0]
  - - [22528, 64, 1, 2048]
    - [127, 96704.0]
  - - [22528, 64, 1, 8192]
    - [115, 145888.0]
  - - [38016, 64, 1, 2048]
    - [115, 152449.0]
  - - [38016, 64, 1, 8192]
    - [115, 193070.0]
  - - [163840, 64, 1, 2048]
    - [128, 189504.0]
  - - [163840, 64, 1, 8192]
    - [128, 208125.0]
  - - [7, 80, 1, 2048]
    - [130, 269.766]
  - - [7, 80, 1, 8192]
    - [131, 818.366]
  - - [7, 80, 1, 32768]
    - [132, 2043.83]
  - - [16, 80, 1, 2048]
    - [26, 670.582]
  - - [16, 80, 1, 8192]
    - [50, 2050.97]
  - - [16, 80, 1, 32768]
    - [51, 6031.14]
  - - [32, 80, 1, 2048]
    - [26, 1322.38]
  - - [32, 80, 1, 8192]
    - [50, 3969.65]
  - - [32, 80, 1, 32768]
    - [50, 10071.4]
  - - [48, 80, 1, 2048]
    - [26, 1945.31]
  - - [48, 80, 1, 8192]
    - [133, 5805.35]
  - - [48, 80, 1, 32768]
    - [50, 14823.4]
  - - [64, 80, 1, 2048]
    - [26, 2560.61]
  - - [64, 80, 1, 8192]
    - [54, 6959.1]
  - - [64, 80, 1, 32768]
    - [97, 15448.3]
  - - [80, 80, 1, 2048]
    - [26, 3152.76]
  - - [80, 80, 1, 8192]
    - [96, 8497.36]
  - - [80, 80, 1, 32768]
    - [96, 18201.7]
  - - [96, 80, 1, 2048]
    - [32, 3701.22]
  - - [96, 80, 1, 8192]
    - [54, 10284.7]
  - - [96, 80, 1, 32768]
    - [54, 21967.0]
  - - [112, 80, 1, 2048]
    - [32, 4224.82]
  - - [112, 80, 1, 8192]
    - [38, 10651.5]
  - - [112, 80, 1, 32768]
    - [34, 22373.3]
  - - [128, 80, 1, 2048]
    - [30, 4594.88]
  - - [128, 80, 1, 8192]
    - [134, 12240.5]
  - - [128, 80, 1, 32768]
    - [41, 23392.3]
  - - [160, 80, 1, 2048]
    - [30, 5680.72]
  - - [160, 80, 1, 8192]
    - [41, 14556.3]
  - - [160, 80, 1, 32768]
    - [41, 28585.6]
  - - [192, 80, 1, 2048]
    - [33, 6529.81]
  - - [192, 80, 1, 8192]
    - [41, 17148.8]
  - - [192, 80, 1, 32768]
    - [41, 34040.4]
  - - [224, 80, 1, 2048]
    - [30, 7830.89]
  - - [224, 80, 1, 8192]
    - [40, 18326.2]
  - - [224, 80, 1, 32768]
    - [40, 33013.1]
  - - [256, 80, 1, 2048]
    - [40, 7463.27]
  - - [256, 80, 1, 8192]
    - [40, 20878.9]
  - - [256, 80, 1, 32768]
    - [71, 38373.6]
  - - [320, 80, 1, 2048]
    - [135, 9469.24]
  - - [320, 80, 1, 8192]
    - [106, 24497.4]
  - - [320, 80, 1, 32768]
    - [106, 44002.6]
  - - [384, 80, 1, 2048]
    - [135, 11336.4]
  - - [384, 80, 1, 8192]
    - [65, 28675.1]
  - - [384, 80, 1, 32768]
    - [65, 50818.0]
  - - [448, 80, 1, 2048]
    - [40, 11815.3]
  - - [448, 80, 1, 8192]
    - [136, 28214.7]
  - - [448, 80, 1, 32768]
    - [71, 46726.0]
  - - [512, 80, 1, 2048]
    - [88, 12875.8]
  - - [512, 80, 1, 8192]
    - [110, 32304.6]
  - - [512, 80, 1, 32768]
    - [61, 49529.8]
  - - [576, 80, 1, 2048]
    - [37, 14734.7]
  - - [576, 80, 1, 8192]
    - [87, 30357.8]
  - - [576, 80, 1, 32768]
    - [110, 48461.5]
  - - [640, 80, 1, 2048]
    - [137, 14678.8]
  - - [640, 80, 1, 8192]
    - [138, 34790.9]
  - - [640, 80, 1, 32768]
    - [110, 51312.3]
  - - [768, 80, 1, 2048]
    - [59, 17834.8]
  - - [768, 80, 1, 8192]
    - [110, 34272.3]
  - - [768, 80, 1, 32768]
    - [108, 48900.4]
  - - [896, 80, 1, 2048]
    - [38, 18131.1]
  - - [896, 80, 1, 8192]
    - [110, 35742.2]
  - - [896, 80, 1, 32768]
    - [139, 75372.4]
  - - [1024, 80, 1, 2048]
    - [68, 21564.8]
  - - [1024, 80, 1, 8192]
    - [110, 49939.8]
  - - [1024, 80, 1, 32768]
    - [115, 79473.4]
  - - [1280, 80, 1, 2048]
    - [59, 28796.2]
  - - [1280, 80, 1, 8192]
    - [87, 57899.0]
  - - [1280, 80, 1, 32768]
    - [120, 92486.1]
  - - [1536, 80, 1, 2048]
    - [59, 31259.9]
  - - [1536, 80, 1, 8192]
    - [119, 57330.5]
  - - [1536, 80, 1, 32768]
    - [115, 88279.8]
  - - [1792, 80, 1, 2048]
    - [41, 36248.6]
  - - [1792, 80, 1, 8192]
    - [125, 64010.0]
  - - [1792, 80, 1, 32768]
    - [125, 93918.3]
  - - [2048, 80, 1, 2048]
    - [124, 35838.9]
  - - [2048, 80, 1, 8192]
    - [115, 67115.5]
  - - [2048, 80, 1, 32768]
    - [115, 98611.0]
  - - [2304, 80, 1, 2048]
    - [124, 41610.6]
  - - [2304, 80, 1, 8192]
    - [120, 71150.7]
  - - [2304, 80, 1, 32768]
    - [115, 107659.0]
  - - [2560, 80, 1, 2048]
    - [124, 44779.5]
  - - [2560, 80, 1, 8192]
    - [115, 86135.0]
  - - [2560, 80, 1, 32768]
    - [115, 123398.0]
  - - [2816, 80, 1, 2048]
    - [140, 49639.9]
  - - [2816, 80, 1, 8192]
    - [125, 74160.1]
  - - [2816, 80, 1, 32768]
    - [115, 103593.0]
  - - [3072, 80, 1, 2048]
    - [68, 51471.7]
  - - [3072, 80, 1, 8192]
    - [115, 83888.7]
  - - [3072, 80, 1, 32768]
    - [115, 115546.0]
  - - [3584, 80, 1, 2048]
    - [141, 49906.3]
  - - [3584, 80, 1, 8192]
    - [115, 88330.3]
  - - [3584, 80, 1, 32768]
    - [115, 114008.0]
  - - [4096, 80, 1, 2048]
    - [87, 50854.1]
  - - [4096, 80, 1, 8192]
    - [115, 89547.1]
  - - [4096, 80, 1, 32768]
    - [115, 128792.0]
  - - [4608, 80, 1, 2048]
    - [87, 57341.5]
  - - [4608, 80, 1, 8192]
    - [115, 97632.8]
  - - [4608, 80, 1, 32768]
    - [115, 120318.0]
  - - [5120, 80, 1, 2048]
    - [87, 62271.6]
  - - [5120, 80, 1, 8192]
    - [115, 103210.0]
  - - [5120, 80, 1, 32768]
    - [115, 132378.0]
  - - [5632, 80, 1, 2048]
    - [70, 65348.0]
  - - [5632, 80, 1, 8192]
    - [115, 94787.4]
  - - [5632, 80, 1, 32768]
    - [115, 112930.0]
  - - [6144, 80, 1, 2048]
    - [70, 71268.3]
  - - [6144, 80, 1, 8192]
    - [115, 96452.9]
  - - [6144, 80, 1, 32768]
    - [115, 121783.0]
  - - [7168, 80, 1, 2048]
    - [125, 61687.9]
  - - [7168, 80, 1, 8192]
    - [125, 98120.1]
  - - [7168, 80, 1, 32768]
    - [123, 115447.0]
  - - [8192, 80, 1, 2048]
    - [120, 69758.6]
  - - [8192, 80, 1, 8192]
    - [115, 103050.0]
  - - [8192, 80, 1, 32768]
    - [115, 130046.0]
  - - [10240, 80, 1, 2048]
    - [119, 85724.7]
  - - [10240, 80, 1, 8192]
    - [115, 116548.0]
  - - [10240, 80, 1, 32768]
    - [115, 136950.0]
  - - [12288, 80, 1, 2048]
    - [123, 76246.2]
  - - [12288, 80, 1, 8192]
    - [115, 105026.0]
  - - [14336, 80, 1, 2048]
    - [125, 81897.2]
  - - [14336, 80, 1, 8192]
    - [123, 106666.0]
  - - [16384, 80, 1, 2048]
    - [115, 94149.4]
  - - [16384, 80, 1, 8192]
    - [115, 110023.0]
  - - [20480, 80, 1, 2048]
    - [115, 116007.0]
  - - [20480, 80, 1, 8192]
    - [115, 135245.0]
  - - [24576, 80, 1, 2048]
    - [119, 90519.7]
  - - [24576, 80, 1, 8192]
    - [118, 103942.0]
  - - [28672, 80, 1, 2048]
    - [119, 105001.0]
  - - [28672, 80, 1, 8192]
    - [123, 117265.0]
  - - [32768, 80, 1, 2048]
    - [115, 94471.6]
  - - [32768, 80, 1, 8192]
    - [128, 111770.0]
  - - [40960, 80, 1, 2048]
    - [128, 116365.0]
  - - [40960, 80, 1, 8192]
    - [118, 134329.0]
  - - [49152, 80, 1, 2048]
    - [119, 113855.0]
  - - [49152, 80, 1, 8192]
    - [119, 123568.0]
  - - [57344, 80, 1, 2048]
    - [129, 105725.0]
  - - [57344, 80, 1, 8192]
    - [129, 124484.0]
  - - [65536, 80, 1, 2048]
    - [128, 110588.0]
  - - [65536, 80, 1, 8192]
    - [128, 120239.0]
  - - [98304, 80, 1, 2048]
    - [128, 117378.0]
  - - [98304, 80, 1, 8192]
    - [128, 128193.0]
  - - [131072, 80, 1, 2048]
    - [128, 122333.0]
  - - [131072, 80, 1, 8192]
    - [128, 132335.0]
  - - [262144, 80, 1, 2048]
    - [128, 124573.0]
  - - [15360, 80, 1, 2048]
    - [123, 94882.8]
  - - [15360, 80, 1, 8192]
    - [123, 113752.0]
  - - [22528, 80, 1, 2048]
    - [123, 83269.0]
  - - [22528, 80, 1, 8192]
    - [125, 113295.0]
  - - [38016, 80, 1, 2048]
    - [119, 106773.0]
  - - [38016, 80, 1, 8192]
    - [115, 123646.0]
  - - [163840, 80, 1, 2048]
    - [128, 123692.0]
  - - [163840, 80, 1, 8192]
    - [128, 133750.0]
  - - [7, 96, 1, 2048]
    - [92, 325.67]
  - - [7, 96, 1, 8192]
    - [142, 1012.12]
  - - [7, 96, 1, 32768]
    - [143, 2684.63]
  - - [16, 96, 1, 2048]
    - [26, 796.772]
  - - [16, 96, 1, 8192]
    - [144, 2444.87]
  - - [16, 96, 1, 32768]
    - [52, 7197.12]
  - - [32, 96, 1, 2048]
    - [26, 1572.54]
  - - [32, 96, 1, 8192]
    - [144, 4764.85]
  - - [32, 96, 1, 32768]
    - [145, 11651.8]
  - - [48, 96, 1, 2048]
    - [26, 2311.34]
  - - [48, 96, 1, 8192]
    - [144, 6927.71]
  - - [48, 96, 1, 32768]
    - [50, 17405.0]
  - - [64, 96, 1, 2048]
    - [32, 3036.9]
  - - [64, 96, 1, 8192]
    - [54, 8338.44]
  - - [64, 96, 1, 32768]
    - [146, 18064.2]
  - - [80, 96, 1, 2048]
    - [50, 3510.92]
  - - [80, 96, 1, 8192]
    - [95, 9405.11]
  - - [80, 96, 1, 32768]
    - [98, 22058.9]
  - - [96, 96, 1, 2048]
    - [32, 4325.37]
  - - [96, 96, 1, 8192]
    - [96, 12246.5]
  - - [96, 96, 1, 32768]
    - [54, 26249.3]
  - - [112, 96, 1, 2048]
    - [32, 4899.51]
  - - [112, 96, 1, 8192]
    - [55, 12525.0]
  - - [112, 96, 1, 32768]
    - [147, 24364.8]
  - - [128, 96, 1, 2048]
    - [85, 5004.17]
  - - [128, 96, 1, 8192]
    - [86, 13578.1]
  - - [128, 96, 1, 32768]
    - [65, 27773.8]
  - - [160, 96, 1, 2048]
    - [100, 6120.05]
  - - [160, 96, 1, 8192]
    - [101, 16846.0]
  - - [160, 96, 1, 32768]
    - [58, 31385.3]
  - - [192, 96, 1, 2048]
    - [85, 7376.28]
  - - [192, 96, 1, 8192]
    - [86, 20142.2]
  - - [192, 96, 1, 32768]
    - [104, 38549.4]
  - - [224, 96, 1, 2048]
    - [57, 7977.28]
  - - [224, 96, 1, 8192]
    - [85, 19940.4]
  - - [224, 96, 1, 32768]
    - [65, 37265.9]
  - - [256, 96, 1, 2048]
    - [57, 8911.41]
  - - [256, 96, 1, 8192]
    - [148, 22556.2]
  - - [256, 96, 1, 32768]
    - [71, 44953.5]
  - - [320, 96, 1, 2048]
    - [86, 10748.2]
  - - [320, 96, 1, 8192]
    - [106, 28166.8]
  - - [320, 96, 1, 32768]
    - [106, 52692.3]
  - - [384, 96, 1, 2048]
    - [136, 12508.1]
  - - [384, 96, 1, 8192]
    - [65, 33596.6]
  - - [384, 96, 1, 32768]
    - [65, 61354.1]
  - - [448, 96, 1, 2048]
    - [88, 13486.5]
  - - [448, 96, 1, 8192]
    - [61, 33688.9]
  - - [448, 96, 1, 32768]
    - [149, 60028.2]
  - - [512, 96, 1, 2048]
    - [150, 14333.0]
  - - [512, 96, 1, 8192]
    - [108, 36162.3]
  - - [512, 96, 1, 32768]
    - [151, 62973.8]
  - - [576, 96, 1, 2048]
    - [63, 18176.6]
  - - [576, 96, 1, 8192]
    - [140, 40112.0]
  - - [576, 96, 1, 32768]
    - [108, 70475.5]
  - - [640, 96, 1, 2048]
    - [63, 20095.9]
  - - [640, 96, 1, 8192]
    - [61, 45280.2]
  - - [640, 96, 1, 32768]
    - [152, 80044.2]
  - - [768, 96, 1, 2048]
    - [63, 23720.3]
  - - [768, 96, 1, 8192]
    - [153, 51332.3]
  - - [768, 96, 1, 32768]
    - [154, 88821.8]
  - - [896, 96, 1, 2048]
    - [91, 23540.8]
  - - [896, 96, 1, 8192]
    - [140, 53933.3]
  - - [896, 96, 1, 32768]
    - [117, 82152.6]
  - - [1024, 96, 1, 2048]
    - [155, 23946.4]
  - - [1024, 96, 1, 8192]
    - [153, 59914.4]
  - - [1024, 96, 1, 32768]
    - [154, 88735.2]
  - - [1280, 96, 1, 2048]
    - [59, 34852.7]
  - - [1280, 96, 1, 8192]
    - [153, 73939.1]
  - - [1280, 96, 1, 32768]
    - [151, 117643.0]
  - - [1536, 96, 1, 2048]
    - [59, 37999.1]
  - - [1536, 96, 1, 8192]
    - [151, 70540.2]
  - - [1536, 96, 1, 32768]
    - [156, 109452.0]
  - - [1792, 96, 1, 2048]
    - [140, 38299.3]
  - - [1792, 96, 1, 8192]
    - [151, 80066.1]
  - - [1792, 96, 1, 32768]
    - [157, 120406.0]
  - - [2048, 96, 1, 2048]
    - [124, 42628.1]
  - - [2048, 96, 1, 8192]
    - [151, 82161.0]
  - - [2048, 96, 1, 32768]
    - [157, 128388.0]
  - - [2304, 96, 1, 2048]
    - [104, 48964.5]
  - - [2304, 96, 1, 8192]
    - [154, 101304.0]
  - - [2304, 96, 1, 32768]
    - [157, 154814.0]
  - - [2560, 96, 1, 2048]
    - [124, 52942.2]
  - - [2560, 96, 1, 8192]
    - [154, 103176.0]
  - - [2560, 96, 1, 32768]
    - [157, 158188.0]
  - - [2816, 96, 1, 2048]
    - [140, 59172.3]
  - - [2816, 96, 1, 8192]
    - [157, 112049.0]
  - - [2816, 96, 1, 32768]
    - [157, 185411.0]
  - - [3072, 96, 1, 2048]
    - [68, 60440.3]
  - - [3072, 96, 1, 8192]
    - [157, 100658.0]
  - - [3072, 96, 1, 32768]
    - [157, 165524.0]
  - - [3584, 96, 1, 2048]
    - [153, 60459.5]
  - - [3584, 96, 1, 8192]
    - [157, 113008.0]
  - - [3584, 96, 1, 32768]
    - [157, 166983.0]
  - - [4096, 96, 1, 2048]
    - [153, 68788.7]
  - - [4096, 96, 1, 8192]
    - [156, 115083.0]
  - - [4096, 96, 1, 32768]
    - [156, 162848.0]
  - - [4608, 96, 1, 2048]
    - [153, 77004.8]
  - - [4608, 96, 1, 8192]
    - [157, 127370.0]
  - - [4608, 96, 1, 32768]
    - [157, 177124.0]
  - - [5120, 96, 1, 2048]
    - [153, 84723.8]
  - - [5120, 96, 1, 8192]
    - [157, 136317.0]
  - - [5120, 96, 1, 32768]
    - [157, 195288.0]
  - - [5632, 96, 1, 2048]
    - [158, 76516.7]
  - - [5632, 96, 1, 8192]
    - [157, 127092.0]
  - - [5632, 96, 1, 32768]
    - [157, 167994.0]
  - - [6144, 96, 1, 2048]
    - [70, 85135.6]
  - - [6144, 96, 1, 8192]
    - [157, 132729.0]
  - - [6144, 96, 1, 32768]
    - [157, 181070.0]
  - - [7168, 96, 1, 2048]
    - [126, 71409.0]
  - - [7168, 96, 1, 8192]
    - [156, 113997.0]
  - - [7168, 96, 1, 32768]
    - [156, 147769.0]
  - - [8192, 96, 1, 2048]
    - [159, 100206.0]
  - - [8192, 96, 1, 8192]
    - [157, 137207.0]
  - - [8192, 96, 1, 32768]
    - [157, 169989.0]
  - - [10240, 96, 1, 2048]
    - [159, 116483.0]
  - - [10240, 96, 1, 8192]
    - [157, 165900.0]
  - - [12288, 96, 1, 2048]
    - [157, 99683.9]
  - - [12288, 96, 1, 8192]
    - [156, 132150.0]
  - - [14336, 96, 1, 2048]
    - [157, 114760.0]
  - - [14336, 96, 1, 8192]
    - [157, 147550.0]
  - - [16384, 96, 1, 2048]
    - [157, 130813.0]
  - - [16384, 96, 1, 8192]
    - [157, 168060.0]
  - - [20480, 96, 1, 2048]
    - [157, 160845.0]
  - - [20480, 96, 1, 8192]
    - [157, 206209.0]
  - - [24576, 96, 1, 2048]
    - [151, 109472.0]
  - - [24576, 96, 1, 8192]
    - [156, 127090.0]
  - - [28672, 96, 1, 2048]
    - [119, 125467.0]
  - - [28672, 96, 1, 8192]
    - [157, 146903.0]
  - - [32768, 96, 1, 2048]
    - [156, 122576.0]
  - - [32768, 96, 1, 8192]
    - [156, 142933.0]
  - - [40960, 96, 1, 2048]
    - [156, 148948.0]
  - - [40960, 96, 1, 8192]
    - [156, 174107.0]
  - - [49152, 96, 1, 2048]
    - [160, 138268.0]
  - - [49152, 96, 1, 8192]
    - [160, 148587.0]
  - - [57344, 96, 1, 2048]
    - [161, 140833.0]
  - - [57344, 96, 1, 8192]
    - [161, 161446.0]
  - - [65536, 96, 1, 2048]
    - [161, 126903.0]
  - - [65536, 96, 1, 8192]
    - [161, 142836.0]
  - - [98304, 96, 1, 2048]
    - [161, 143239.0]
  - - [98304, 96, 1, 8192]
    - [161, 166422.0]
  - - [131072, 96, 1, 2048]
    - [161, 139390.0]
  - - [131072, 96, 1, 8192]
    - [161, 163795.0]
  - - [262144, 96, 1, 2048]
    - [161, 147914.0]
  - - [15360, 96, 1, 2048]
    - [157, 123532.0]
  - - [15360, 96, 1, 8192]
    - [157, 157870.0]
  - - [22528, 96, 1, 2048]
    - [123, 94872.9]
  - - [22528, 96, 1, 8192]
    - [123, 111002.0]
  - - [38016, 96, 1, 2048]
    - [154, 139457.0]
  - - [38016, 96, 1, 8192]
    - [154, 169361.0]
  - - [163840, 96, 1, 2048]
    - [161, 149459.0]
  - - [7, 112, 1, 2048]
    - [92, 373.046]
  - - [7, 112, 1, 8192]
    - [93, 1159.77]
  - - [7, 112, 1, 32768]
    - [162, 2987.92]
  - - [16, 112, 1, 2048]
    - [26, 921.66]
  - - [16, 112, 1, 8192]
    - [50, 2822.45]
  - - [16, 112, 1, 32768]
    - [95, 7815.72]
  - - [32, 112, 1, 2048]
    - [26, 1811.4]
  - - [32, 112, 1, 8192]
    - [133, 5443.3]
  - - [32, 112, 1, 32768]
    - [50, 13749.5]
  - - [48, 112, 1, 2048]
    - [26, 2661.54]
  - - [48, 112, 1, 8192]
    - [163, 7542.62]
  - - [48, 112, 1, 32768]
    - [97, 18420.3]
  - - [64, 112, 1, 2048]
    - [32, 3479.58]
  - - [64, 112, 1, 8192]
    - [54, 9625.88]
  - - [64, 112, 1, 32768]
    - [164, 21108.7]
  - - [80, 112, 1, 2048]
    - [32, 4236.55]
  - - [80, 112, 1, 8192]
    - [95, 11573.3]
  - - [80, 112, 1, 32768]
    - [98, 25333.9]
  - - [96, 112, 1, 2048]
    - [32, 4906.95]
  - - [96, 112, 1, 8192]
    - [98, 13850.8]
  - - [96, 112, 1, 32768]
    - [98, 30669.6]
  - - [112, 112, 1, 2048]
    - [57, 5064.81]
  - - [112, 112, 1, 8192]
    - [86, 13837.8]
  - - [112, 112, 1, 32768]
    - [102, 25976.1]
  - - [128, 112, 1, 2048]
    - [85, 5817.09]
  - - [128, 112, 1, 8192]
    - [103, 15840.7]
  - - [128, 112, 1, 32768]
    - [104, 30004.8]
  - - [160, 112, 1, 2048]
    - [165, 7027.42]
  - - [160, 112, 1, 8192]
    - [101, 19436.1]
  - - [160, 112, 1, 32768]
    - [166, 36345.3]
  - - [192, 112, 1, 2048]
    - [55, 8259.49]
  - - [192, 112, 1, 8192]
    - [103, 22863.9]
  - - [192, 112, 1, 32768]
    - [104, 44990.5]
  - - [224, 112, 1, 2048]
    - [167, 8740.29]
  - - [224, 112, 1, 8192]
    - [106, 23604.0]
  - - [224, 112, 1, 32768]
    - [105, 42457.3]
  - - [256, 112, 1, 2048]
    - [168, 9894.48]
  - - [256, 112, 1, 8192]
    - [167, 26386.7]
  - - [256, 112, 1, 32768]
    - [169, 48765.0]
  - - [320, 112, 1, 2048]
    - [85, 12475.5]
  - - [320, 112, 1, 8192]
    - [103, 31382.6]
  - - [320, 112, 1, 32768]
    - [106, 60972.1]
  - - [384, 112, 1, 2048]
    - [56, 14347.4]
  - - [384, 112, 1, 8192]
    - [168, 34384.2]
  - - [384, 112, 1, 32768]
    - [169, 60783.4]
  - - [448, 112, 1, 2048]
    - [103, 14824.2]
  - - [448, 112, 1, 8192]
    - [167, 37257.7]
  - - [448, 112, 1, 32768]
    - [105, 65058.4]
  - - [512, 112, 1, 2048]
    - [170, 17120.1]
  - - [512, 112, 1, 8192]
    - [110, 44073.7]
  - - [512, 112, 1, 32768]
    - [110, 72649.5]
  - - [576, 112, 1, 2048]
    - [37, 20130.7]
  - - [576, 112, 1, 8192]
    - [108, 45015.4]
  - - [576, 112, 1, 32768]
    - [108, 81737.0]
  - - [640, 112, 1, 2048]
    - [37, 22070.9]
  - - [640, 112, 1, 8192]
    - [152, 49817.2]
  - - [640, 112, 1, 32768]
    - [152, 93232.6]
  - - [768, 112, 1, 2048]
    - [59, 24258.8]
  - - [768, 112, 1, 8192]
    - [110, 54212.0]
  - - [768, 112, 1, 32768]
    - [110, 85716.0]
  - - [896, 112, 1, 2048]
    - [171, 28486.8]
  - - [896, 112, 1, 8192]
    - [110, 60206.4]
  - - [896, 112, 1, 32768]
    - [117, 96139.7]
  - - [1024, 112, 1, 2048]
    - [172, 28557.1]
  - - [1024, 112, 1, 8192]
    - [110, 66099.8]
  - - [1024, 112, 1, 32768]
    - [119, 100689.0]
  - - [1280, 112, 1, 2048]
    - [172, 38563.1]
  - - [1280, 112, 1, 8192]
    - [109, 80237.0]
  - - [1280, 112, 1, 32768]
    - [120, 127117.0]
  - - [1536, 112, 1, 2048]
    - [173, 38236.7]
  - - [1536, 112, 1, 8192]
    - [119, 79513.8]
  - - [1536, 112, 1, 32768]
    - [119, 116730.0]
  - - [1792, 112, 1, 2048]
    - [124, 44833.9]
  - - [1792, 112, 1, 8192]
    - [125, 86751.4]
  - - [1792, 112, 1, 32768]
    - [125, 129552.0]
  - - [2048, 112, 1, 2048]
    - [124, 49329.6]
  - - [2048, 112, 1, 8192]
    - [119, 90391.5]
  - - [2048, 112, 1, 32768]
    - [115, 138753.0]
  - - [2304, 112, 1, 2048]
    - [124, 57960.3]
  - - [2304, 112, 1, 8192]
    - [119, 98310.9]
  - - [2304, 112, 1, 32768]
    - [115, 148801.0]
  - - [2560, 112, 1, 2048]
    - [114, 60540.6]
  - - [2560, 112, 1, 8192]
    - [115, 116033.0]
  - - [2560, 112, 1, 32768]
    - [115, 170432.0]
  - - [2816, 112, 1, 2048]
    - [141, 56883.7]
  - - [2816, 112, 1, 8192]
    - [119, 108018.0]
  - - [2816, 112, 1, 32768]
    - [119, 146740.0]
  - - [3072, 112, 1, 2048]
    - [141, 59351.7]
  - - [3072, 112, 1, 8192]
    - [125, 110460.0]
  - - [3072, 112, 1, 32768]
    - [115, 158803.0]
  - - [3584, 112, 1, 2048]
    - [109, 66455.2]
  - - [3584, 112, 1, 8192]
    - [115, 118439.0]
  - - [3584, 112, 1, 32768]
    - [115, 157976.0]
  - - [4096, 112, 1, 2048]
    - [109, 75350.6]
  - - [4096, 112, 1, 8192]
    - [119, 115946.0]
  - - [4096, 112, 1, 32768]
    - [115, 177910.0]
  - - [4608, 112, 1, 2048]
    - [109, 84322.1]
  - - [4608, 112, 1, 8192]
    - [115, 131496.0]
  - - [4608, 112, 1, 32768]
    - [115, 166209.0]
  - - [5120, 112, 1, 2048]
    - [109, 93110.3]
  - - [5120, 112, 1, 8192]
    - [115, 137387.0]
  - - [5120, 112, 1, 32768]
    - [115, 182352.0]
  - - [5632, 112, 1, 2048]
    - [115, 75407.8]
  - - [5632, 112, 1, 8192]
    - [115, 127972.0]
  - - [5632, 112, 1, 32768]
    - [115, 168331.0]
  - - [6144, 112, 1, 2048]
    - [119, 71314.9]
  - - [6144, 112, 1, 8192]
    - [125, 131572.0]
  - - [6144, 112, 1, 32768]
    - [115, 167833.0]
  - - [7168, 112, 1, 2048]
    - [117, 80982.7]
  - - [7168, 112, 1, 8192]
    - [125, 131441.0]
  - - [7168, 112, 1, 32768]
    - [123, 159286.0]
  - - [8192, 112, 1, 2048]
    - [120, 95874.0]
  - - [8192, 112, 1, 8192]
    - [115, 134620.0]
  - - [10240, 112, 1, 2048]
    - [119, 119063.0]
  - - [10240, 112, 1, 8192]
    - [115, 159790.0]
  - - [12288, 112, 1, 2048]
    - [125, 105829.0]
  - - [12288, 112, 1, 8192]
    - [115, 141881.0]
  - - [14336, 112, 1, 2048]
    - [125, 114440.0]
  - - [14336, 112, 1, 8192]
    - [123, 145938.0]
  - - [16384, 112, 1, 2048]
    - [115, 130081.0]
  - - [16384, 112, 1, 8192]
    - [115, 152820.0]
  - - [20480, 112, 1, 2048]
    - [115, 161048.0]
  - - [20480, 112, 1, 8192]
    - [115, 189079.0]
  - - [24576, 112, 1, 2048]
    - [119, 125455.0]
  - - [24576, 112, 1, 8192]
    - [115, 143824.0]
  - - [28672, 112, 1, 2048]
    - [119, 144584.0]
  - - [28672, 112, 1, 8192]
    - [123, 163541.0]
  - - [32768, 112, 1, 2048]
    - [119, 131958.0]
  - - [32768, 112, 1, 8192]
    - [118, 152372.0]
  - - [40960, 112, 1, 2048]
    - [128, 158983.0]
  - - [40960, 112, 1, 8192]
    - [129, 186549.0]
  - - [49152, 112, 1, 2048]
    - [128, 156640.0]
  - - [49152, 112, 1, 8192]
    - [128, 172719.0]
  - - [57344, 112, 1, 2048]
    - [128, 155782.0]
  - - [57344, 112, 1, 8192]
    - [129, 173902.0]
  - - [65536, 112, 1, 2048]
    - [128, 153618.0]
  - - [65536, 112, 1, 8192]
    - [128, 168212.0]
  - - [98304, 112, 1, 2048]
    - [128, 162607.0]
  - - [98304, 112, 1, 8192]
    - [128, 178744.0]
  - - [131072, 112, 1, 2048]
    - [128, 170004.0]
  - - [131072, 112, 1, 8192]
    - [128, 183266.0]
  - - [262144, 112, 1, 2048]
    - [128, 172592.0]
  - - [15360, 112, 1, 2048]
    - [123, 131612.0]
  - - [15360, 112, 1, 8192]
    - [125, 156481.0]
  - - [22528, 112, 1, 2048]
    - [127, 110282.0]
  - - [22528, 112, 1, 8192]
    - [125, 155253.0]
  - - [38016, 112, 1, 2048]
    - [128, 143610.0]
  - - [38016, 112, 1, 8192]
    - [129, 170385.0]
  - - [163840, 112, 1, 2048]
    - [128, 171780.0]
  - - [7, 128, 1, 2048]
    - [92, 433.362]
  - - [7, 128, 1, 8192]
    - [174, 1336.44]
  - - [7, 128, 1, 32768]
    - [162, 3414.21]
  - - [16, 128, 1, 2048]
    - [26, 1034.83]
  - - [16, 128, 1, 8192]
    - [175, 3096.99]
  - - [16, 128, 1, 32768]
    - [95, 8287.25]
  - - [32, 128, 1, 2048]
    - [26, 2028.52]
  - - [32, 128, 1, 8192]
    - [52, 5870.1]
  - - [32, 128, 1, 32768]
    - [176, 13202.6]
  - - [48, 128, 1, 2048]
    - [26, 2977.69]
  - - [48, 128, 1, 8192]
    - [177, 8611.86]
  - - [48, 128, 1, 32768]
    - [177, 19236.4]
  - - [64, 128, 1, 2048]
    - [32, 3889.25]
  - - [64, 128, 1, 8192]
    - [58, 10278.2]
  - - [64, 128, 1, 32768]
    - [137, 21082.0]
  - - [80, 128, 1, 2048]
    - [32, 4699.09]
  - - [80, 128, 1, 8192]
    - [58, 12455.8]
  - - [80, 128, 1, 32768]
    - [99, 25707.7]
  - - [96, 128, 1, 2048]
    - [32, 5421.45]
  - - [96, 128, 1, 8192]
    - [58, 14975.0]
  - - [96, 128, 1, 32768]
    - [99, 31230.1]
  - - [112, 128, 1, 2048]
    - [165, 5776.26]
  - - [112, 128, 1, 8192]
    - [178, 15767.3]
  - - [112, 128, 1, 32768]
    - [167, 29225.7]
  - - [128, 128, 1, 2048]
    - [86, 6337.96]
  - - [128, 128, 1, 8192]
    - [103, 17621.9]
  - - [128, 128, 1, 32768]
    - [104, 34655.5]
  - - [160, 128, 1, 2048]
    - [55, 7737.89]
  - - [160, 128, 1, 8192]
    - [178, 20957.3]
  - - [160, 128, 1, 32768]
    - [179, 42091.1]
  - - [192, 128, 1, 2048]
    - [55, 9244.45]
  - - [192, 128, 1, 8192]
    - [103, 23087.7]
  - - [192, 128, 1, 32768]
    - [180, 46130.3]
  - - [224, 128, 1, 2048]
    - [57, 9790.26]
  - - [224, 128, 1, 8192]
    - [166, 26368.8]
  - - [224, 128, 1, 32768]
    - [106, 48577.9]
  - - [256, 128, 1, 2048]
    - [167, 11313.7]
  - - [256, 128, 1, 8192]
    - [167, 30409.5]
  - - [256, 128, 1, 32768]
    - [105, 55174.5]
  - - [320, 128, 1, 2048]
    - [167, 14049.5]
  - - [320, 128, 1, 8192]
    - [181, 37801.6]
  - - [320, 128, 1, 32768]
    - [106, 69762.3]
  - - [384, 128, 1, 2048]
    - [56, 16364.9]
  - - [384, 128, 1, 8192]
    - [181, 40052.4]
  - - [384, 128, 1, 32768]
    - [182, 74569.8]
  - - [448, 128, 1, 2048]
    - [40, 14865.5]
  - - [448, 128, 1, 8192]
    - [167, 43014.0]
  - - [448, 128, 1, 32768]
    - [105, 74494.2]
  - - [512, 128, 1, 2048]
    - [114, 19686.7]
  - - [512, 128, 1, 8192]
    - [110, 49158.8]
  - - [512, 128, 1, 32768]
    - [183, 83738.6]
  - - [576, 128, 1, 2048]
    - [63, 23821.5]
  - - [576, 128, 1, 8192]
    - [179, 56143.6]
  - - [576, 128, 1, 32768]
    - [184, 95592.0]
  - - [640, 128, 1, 2048]
    - [63, 26368.3]
  - - [640, 128, 1, 8192]
    - [179, 62364.3]
  - - [640, 128, 1, 32768]
    - [185, 105861.0]
  - - [768, 128, 1, 2048]
    - [59, 28088.8]
  - - [768, 128, 1, 8192]
    - [184, 64946.4]
  - - [768, 128, 1, 32768]
    - [186, 102743.0]
  - - [896, 128, 1, 2048]
    - [171, 32996.3]
  - - [896, 128, 1, 8192]
    - [187, 71619.8]
  - - [896, 128, 1, 32768]
    - [117, 109441.0]
  - - [1024, 128, 1, 2048]
    - [59, 32486.3]
  - - [1024, 128, 1, 8192]
    - [108, 77180.7]
  - - [1024, 128, 1, 32768]
    - [188, 120523.0]
  - - [1280, 128, 1, 2048]
    - [59, 45846.6]
  - - [1280, 128, 1, 8192]
    - [189, 95567.1]
  - - [1280, 128, 1, 32768]
    - [189, 151476.0]
  - - [1536, 128, 1, 2048]
    - [124, 42933.3]
  - - [1536, 128, 1, 8192]
    - [183, 92976.1]
  - - [1536, 128, 1, 32768]
    - [190, 140002.0]
  - - [1792, 128, 1, 2048]
    - [114, 51520.4]
  - - [1792, 128, 1, 8192]
    - [191, 103587.0]
  - - [1792, 128, 1, 32768]
    - [191, 155540.0]
  - - [2048, 128, 1, 2048]
    - [124, 55586.8]
  - - [2048, 128, 1, 8192]
    - [183, 109459.0]
  - - [2048, 128, 1, 32768]
    - [188, 165167.0]
  - - [2304, 128, 1, 2048]
    - [114, 64766.8]
  - - [2304, 128, 1, 8192]
    - [186, 126541.0]
  - - [2304, 128, 1, 32768]
    - [186, 191207.0]
  - - [2560, 128, 1, 2048]
    - [114, 68615.0]
  - - [2560, 128, 1, 8192]
    - [186, 128548.0]
  - - [2560, 128, 1, 32768]
    - [188, 203710.0]
  - - [2816, 128, 1, 2048]
    - [141, 64356.7]
  - - [2816, 128, 1, 8192]
    - [192, 134581.0]
  - - [2816, 128, 1, 32768]
    - [186, 205317.0]
  - - [3072, 128, 1, 2048]
    - [193, 63025.6]
  - - [3072, 128, 1, 8192]
    - [191, 130802.0]
  - - [3072, 128, 1, 32768]
    - [192, 190448.0]
  - - [3584, 128, 1, 2048]
    - [194, 67252.3]
  - - [3584, 128, 1, 8192]
    - [195, 137999.0]
  - - [3584, 128, 1, 32768]
    - [196, 207352.0]
  - - [4096, 128, 1, 2048]
    - [110, 77325.5]
  - - [4096, 128, 1, 8192]
    - [188, 149171.0]
  - - [4096, 128, 1, 32768]
    - [190, 215104.0]
  - - [4608, 128, 1, 2048]
    - [110, 87016.6]
  - - [4608, 128, 1, 8192]
    - [190, 159162.0]
  - - [4608, 128, 1, 32768]
    - [197, 239123.0]
  - - [5120, 128, 1, 2048]
    - [110, 96088.1]
  - - [5120, 128, 1, 8192]
    - [198, 165944.0]
  - - [5120, 128, 1, 32768]
    - [190, 263652.0]
  - - [5632, 128, 1, 2048]
    - [194, 81309.1]
  - - [5632, 128, 1, 8192]
    - [197, 174268.0]
  - - [5632, 128, 1, 32768]
    - [197, 257861.0]
  - - [6144, 128, 1, 2048]
    - [199, 86550.9]
  - - [6144, 128, 1, 8192]
    - [196, 174049.0]
  - - [6144, 128, 1, 32768]
    - [190, 246694.0]
  - - [7168, 128, 1, 2048]
    - [126, 94692.7]
  - - [7168, 128, 1, 8192]
    - [197, 175585.0]
  - - [8192, 128, 1, 2048]
    - [183, 111047.0]
  - - [8192, 128, 1, 8192]
    - [197, 199761.0]
  - - [10240, 128, 1, 2048]
    - [183, 137795.0]
  - - [10240, 128, 1, 8192]
    - [197, 214666.0]
  - - [12288, 128, 1, 2048]
    - [191, 125746.0]
  - - [12288, 128, 1, 8192]
    - [190, 212364.0]
  - - [14336, 128, 1, 2048]
    - [200, 137624.0]
  - - [14336, 128, 1, 8192]
    - [196, 200784.0]
  - - [16384, 128, 1, 2048]
    - [201, 154206.0]
  - - [16384, 128, 1, 8192]
    - [197, 207535.0]
  - - [20480, 128, 1, 2048]
    - [192, 190063.0]
  - - [20480, 128, 1, 8192]
    - [190, 249952.0]
  - - [24576, 128, 1, 2048]
    - [196, 171504.0]
  - - [24576, 128, 1, 8192]
    - [197, 218976.0]
  - - [28672, 128, 1, 2048]
    - [195, 171458.0]
  - - [28672, 128, 1, 8192]
    - [196, 225168.0]
  - - [32768, 128, 1, 2048]
    - [202, 191041.0]
  - - [32768, 128, 1, 8192]
    - [202, 235638.0]
  - - [40960, 128, 1, 2048]
    - [202, 234311.0]
  - - [40960, 128, 1, 8192]
    - [202, 290770.0]
  - - [49152, 128, 1, 2048]
    - [203, 184941.0]
  - - [49152, 128, 1, 8192]
    - [204, 219289.0]
  - - [57344, 128, 1, 2048]
    - [204, 210200.0]
  - - [57344, 128, 1, 8192]
    - [205, 238135.0]
  - - [65536, 128, 1, 2048]
    - [202, 196834.0]
  - - [65536, 128, 1, 8192]
    - [202, 237903.0]
  - - [98304, 128, 1, 2048]
    - [204, 223026.0]
  - - [98304, 128, 1, 8192]
    - [204, 249253.0]
  - - [131072, 128, 1, 2048]
    - [205, 217324.0]
  - - [262144, 128, 1, 2048]
    - [204, 237961.0]
  - - [15360, 128, 1, 2048]
    - [191, 155491.0]
  - - [15360, 128, 1, 8192]
    - [196, 217820.0]
  - - [22528, 128, 1, 2048]
    - [206, 134018.0]
  - - [22528, 128, 1, 8192]
    - [197, 201815.0]
  - - [38016, 128, 1, 2048]
    - [202, 195338.0]
  - - [38016, 128, 1, 8192]
    - [202, 261393.0]
  - - [163840, 128, 1, 2048]
    - [202, 244122.0]
  - - [7, 160, 1, 2048]
    - [142, 526.886]
  - - [7, 160, 1, 8192]
    - [207, 1594.43]
  - - [7, 160, 1, 32768]
    - [162, 3982.12]
  - - [16, 160, 1, 2048]
    - [26, 1290.79]
  - - [16, 160, 1, 8192]
    - [52, 3706.25]
  - - [16, 160, 1, 32768]
    - [176, 8344.93]
  - - [32, 160, 1, 2048]
    - [26, 2544.17]
  - - [32, 160, 1, 8192]
    - [52, 7329.66]
  - - [32, 160, 1, 32768]
    - [176, 16525.4]
  - - [48, 160, 1, 2048]
    - [32, 3723.17]
  - - [48, 160, 1, 8192]
    - [208, 10512.4]
  - - [48, 160, 1, 32768]
    - [177, 23365.7]
  - - [64, 160, 1, 2048]
    - [50, 4609.25]
  - - [64, 160, 1, 8192]
    - [58, 12844.6]
  - - [64, 160, 1, 32768]
    - [137, 26207.7]
  - - [80, 160, 1, 2048]
    - [50, 5666.45]
  - - [80, 160, 1, 8192]
    - [59, 15281.4]
  - - [80, 160, 1, 32768]
    - [58, 31868.0]
  - - [96, 160, 1, 2048]
    - [50, 6625.19]
  - - [96, 160, 1, 8192]
    - [58, 18431.3]
  - - [96, 160, 1, 32768]
    - [58, 38126.6]
  - - [112, 160, 1, 2048]
    - [57, 6978.41]
  - - [112, 160, 1, 8192]
    - [86, 19378.5]
  - - [112, 160, 1, 32768]
    - [86, 34651.3]
  - - [128, 160, 1, 2048]
    - [55, 7765.14]
  - - [128, 160, 1, 8192]
    - [140, 19931.6]
  - - [128, 160, 1, 32768]
    - [140, 40706.6]
  - - [160, 160, 1, 2048]
    - [136, 9160.79]
  - - [160, 160, 1, 8192]
    - [65, 24236.3]
  - - [160, 160, 1, 32768]
    - [106, 43319.4]
  - - [192, 160, 1, 2048]
    - [168, 10912.7]
  - - [192, 160, 1, 8192]
    - [167, 28912.8]
  - - [192, 160, 1, 32768]
    - [106, 52761.5]
  - - [224, 160, 1, 2048]
    - [85, 12334.7]
  - - [224, 160, 1, 8192]
    - [65, 32378.2]
  - - [224, 160, 1, 32768]
    - [65, 58468.2]
  - - [256, 160, 1, 2048]
    - [56, 13664.1]
  - - [256, 160, 1, 8192]
    - [209, 29770.7]
  - - [256, 160, 1, 32768]
    - [65, 64809.1]
  - - [320, 160, 1, 2048]
    - [54, 17127.7]
  - - [320, 160, 1, 8192]
    - [167, 38205.4]
  - - [320, 160, 1, 32768]
    - [105, 65461.7]
  - - [384, 160, 1, 2048]
    - [56, 20436.2]
  - - [384, 160, 1, 8192]
    - [136, 45219.1]
  - - [384, 160, 1, 32768]
    - [185, 80082.5]
  - - [448, 160, 1, 2048]
    - [59, 21025.4]
  - - [448, 160, 1, 8192]
    - [210, 48574.0]
  - - [448, 160, 1, 32768]
    - [71, 81888.4]
  - - [512, 160, 1, 2048]
    - [59, 21336.6]
  - - [512, 160, 1, 8192]
    - [71, 57094.2]
  - - [512, 160, 1, 32768]
    - [71, 91589.7]
  - - [576, 160, 1, 2048]
    - [171, 25863.1]
  - - [576, 160, 1, 8192]
    - [211, 54511.2]
  - - [576, 160, 1, 32768]
    - [117, 89330.7]
  - - [640, 160, 1, 2048]
    - [212, 27654.2]
  - - [640, 160, 1, 8192]
    - [140, 63804.9]
  - - [640, 160, 1, 32768]
    - [151, 99176.9]
  - - [768, 160, 1, 2048]
    - [59, 35052.2]
  - - [768, 160, 1, 8192]
    - [71, 69025.1]
  - - [768, 160, 1, 32768]
    - [120, 111359.0]
  - - [896, 160, 1, 2048]
    - [59, 40605.2]
  - - [896, 160, 1, 8192]
    - [213, 70750.6]
  - - [896, 160, 1, 32768]
    - [70, 102619.0]
  - - [1024, 160, 1, 2048]
    - [61, 35686.0]
  - - [1024, 160, 1, 8192]
    - [109, 77749.8]
  - - [1024, 160, 1, 32768]
    - [115, 116417.0]
  - - [1280, 160, 1, 2048]
    - [124, 45934.6]
  - - [1280, 160, 1, 8192]
    - [156, 93271.8]
  - - [1280, 160, 1, 32768]
    - [156, 140891.0]
  - - [1536, 160, 1, 2048]
    - [124, 52565.4]
  - - [1536, 160, 1, 8192]
    - [115, 101436.0]
  - - [1536, 160, 1, 32768]
    - [115, 147731.0]
  - - [1792, 160, 1, 2048]
    - [140, 62337.7]
  - - [1792, 160, 1, 8192]
    - [156, 99145.4]
  - - [1792, 160, 1, 32768]
    - [156, 131287.0]
  - - [2048, 160, 1, 2048]
    - [61, 59335.6]
  - - [2048, 160, 1, 8192]
    - [192, 103229.0]
  - - [2048, 160, 1, 32768]
    - [115, 153394.0]
  - - [2304, 160, 1, 2048]
    - [109, 62623.4]
  - - [2304, 160, 1, 8192]
    - [157, 116061.0]
  - - [2304, 160, 1, 32768]
    - [157, 161578.0]
  - - [2560, 160, 1, 2048]
    - [153, 70224.0]
  - - [2560, 160, 1, 8192]
    - [157, 124293.0]
  - - [2560, 160, 1, 32768]
    - [190, 169196.0]
  - - [2816, 160, 1, 2048]
    - [109, 75263.3]
  - - [2816, 160, 1, 8192]
    - [157, 115388.0]
  - - [2816, 160, 1, 32768]
    - [157, 152674.0]
  - - [3072, 160, 1, 2048]
    - [109, 81071.5]
  - - [3072, 160, 1, 8192]
    - [115, 120726.0]
  - - [3072, 160, 1, 32768]
    - [115, 159542.0]
  - - [3584, 160, 1, 2048]
    - [70, 82677.2]
  - - [3584, 160, 1, 8192]
    - [190, 120094.0]
  - - [3584, 160, 1, 32768]
    - [197, 156097.0]
  - - [4096, 160, 1, 2048]
    - [71, 90736.1]
  - - [4096, 160, 1, 8192]
    - [190, 135549.0]
  - - [4096, 160, 1, 32768]
    - [197, 178358.0]
  - - [4608, 160, 1, 2048]
    - [213, 86648.5]
  - - [4608, 160, 1, 8192]
    - [190, 134494.0]
  - - [4608, 160, 1, 32768]
    - [197, 164944.0]
  - - [5120, 160, 1, 2048]
    - [214, 91617.9]
  - - [5120, 160, 1, 8192]
    - [190, 147379.0]
  - - [5120, 160, 1, 32768]
    - [190, 182003.0]
  - - [5632, 160, 1, 2048]
    - [119, 94978.0]
  - - [5632, 160, 1, 8192]
    - [115, 133806.0]
  - - [5632, 160, 1, 32768]
    - [197, 153807.0]
  - - [6144, 160, 1, 2048]
    - [120, 104714.0]
  - - [6144, 160, 1, 8192]
    - [115, 139950.0]
  - - [7168, 160, 1, 2048]
    - [191, 87827.0]
  - - [7168, 160, 1, 8192]
    - [195, 128195.0]
  - - [8192, 160, 1, 2048]
    - [156, 103958.0]
  - - [8192, 160, 1, 8192]
    - [197, 134328.0]
  - - [10240, 160, 1, 2048]
    - [156, 127154.0]
  - - [10240, 160, 1, 8192]
    - [197, 164539.0]
  - - [12288, 160, 1, 2048]
    - [115, 139585.0]
  - - [12288, 160, 1, 8192]
    - [115, 164524.0]
  - - [14336, 160, 1, 2048]
    - [195, 110857.0]
  - - [14336, 160, 1, 8192]
    - [196, 143622.0]
  - - [28672, 160, 1, 2048]
    - [215, 138111.0]
  - - [28672, 160, 1, 8192]
    - [216, 157420.0]
  - - [32768, 160, 1, 2048]
    - [128, 149348.0]
  - - [32768, 160, 1, 8192]
    - [128, 163384.0]
  - - [40960, 160, 1, 2048]
    - [128, 157521.0]
  - - [40960, 160, 1, 8192]
    - [202, 183531.0]
  - - [49152, 160, 1, 2048]
    - [216, 148430.0]
  - - [49152, 160, 1, 8192]
    - [216, 163536.0]
  - - [57344, 160, 1, 2048]
    - [128, 153263.0]
  - - [57344, 160, 1, 8192]
    - [202, 172686.0]
  - - [65536, 160, 1, 2048]
    - [217, 145672.0]
  - - [65536, 160, 1, 8192]
    - [217, 169905.0]
  - - [98304, 160, 1, 2048]
    - [202, 151366.0]
  - - [131072, 160, 1, 2048]
    - [129, 144708.0]
  - - [262144, 160, 1, 2048]
    - [202, 155516.0]
  - - [15360, 160, 1, 2048]
    - [196, 137789.0]
  - - [15360, 160, 1, 8192]
    - [196, 160788.0]
  - - [22528, 160, 1, 2048]
    - [115, 130252.0]
  - - [22528, 160, 1, 8192]
    - [115, 150049.0]
  - - [38016, 160, 1, 2048]
    - [202, 134827.0]
  - - [38016, 160, 1, 8192]
    - [202, 167623.0]
  - - [163840, 160, 1, 2048]
    - [202, 157762.0]
  - - [7, 192, 1, 2048]
    - [218, 628.76]
  - - [7, 192, 1, 8192]
    - [162, 1894.96]
  - - [7, 192, 1, 32768]
    - [219, 4665.71]
  - - [16, 192, 1, 2048]
    - [26, 1546.66]
  - - [16, 192, 1, 8192]
    - [52, 4445.13]
  - - [16, 192, 1, 32768]
    - [50, 10146.6]
  - - [32, 192, 1, 2048]
    - [26, 3035.14]
  - - [32, 192, 1, 8192]
    - [177, 8612.75]
  - - [32, 192, 1, 32768]
    - [50, 19696.7]
  - - [48, 192, 1, 2048]
    - [26, 4397.28]
  - - [48, 192, 1, 8192]
    - [220, 10847.3]
  - - [48, 192, 1, 32768]
    - [220, 20230.6]
  - - [64, 192, 1, 2048]
    - [100, 5005.96]
  - - [64, 192, 1, 8192]
    - [101, 13599.0]
  - - [64, 192, 1, 32768]
    - [106, 28318.1]
  - - [80, 192, 1, 2048]
    - [165, 6103.87]
  - - [80, 192, 1, 8192]
    - [221, 16636.5]
  - - [80, 192, 1, 32768]
    - [99, 31270.3]
  - - [96, 192, 1, 2048]
    - [100, 7344.93]
  - - [96, 192, 1, 8192]
    - [101, 19987.2]
  - - [96, 192, 1, 32768]
    - [99, 37967.9]
  - - [112, 192, 1, 2048]
    - [57, 7840.59]
  - - [112, 192, 1, 8192]
    - [222, 19872.8]
  - - [112, 192, 1, 32768]
    - [106, 38232.5]
  - - [128, 192, 1, 2048]
    - [57, 8819.09]
  - - [128, 192, 1, 8192]
    - [106, 23711.8]
  - - [128, 192, 1, 32768]
    - [105, 46982.7]
  - - [160, 192, 1, 2048]
    - [181, 10704.3]
  - - [160, 192, 1, 8192]
    - [181, 28341.6]
  - - [160, 192, 1, 32768]
    - [106, 52321.7]
  - - [192, 192, 1, 2048]
    - [85, 12539.3]
  - - [192, 192, 1, 8192]
    - [106, 34114.0]
  - - [192, 192, 1, 32768]
    - [106, 63520.7]
  - - [224, 192, 1, 2048]
    - [98, 14319.3]
  - - [224, 192, 1, 8192]
    - [167, 34875.6]
  - - [224, 192, 1, 32768]
    - [105, 59880.0]
  - - [256, 192, 1, 2048]
    - [167, 15808.5]
  - - [256, 192, 1, 8192]
    - [102, 39139.3]
  - - [256, 192, 1, 32768]
    - [223, 72171.8]
  - - [320, 192, 1, 2048]
    - [102, 18144.1]
  - - [320, 192, 1, 8192]
    - [102, 46738.4]
  - - [320, 192, 1, 32768]
    - [105, 79229.7]
  - - [384, 192, 1, 2048]
    - [167, 21691.5]
  - - [384, 192, 1, 8192]
    - [106, 49465.6]
  - - [384, 192, 1, 32768]
    - [185, 96321.8]
  - - [448, 192, 1, 2048]
    - [58, 24437.6]
  - - [448, 192, 1, 8192]
    - [224, 50165.7]
  - - [448, 192, 1, 32768]
    - [225, 82727.8]
  - - [512, 192, 1, 2048]
    - [59, 25393.6]
  - - [512, 192, 1, 8192]
    - [108, 61628.7]
  - - [512, 192, 1, 32768]
    - [115, 100225.0]
  - - [576, 192, 1, 2048]
    - [59, 31666.4]
  - - [576, 192, 1, 8192]
    - [226, 68736.4]
  - - [576, 192, 1, 32768]
    - [117, 106675.0]
  - - [640, 192, 1, 2048]
    - [171, 35283.8]
  - - [640, 192, 1, 8192]
    - [226, 74598.1]
  - - [640, 192, 1, 32768]
    - [151, 118717.0]
  - - [768, 192, 1, 2048]
    - [59, 41495.0]
  - - [768, 192, 1, 8192]
    - [109, 79966.7]
  - - [768, 192, 1, 32768]
    - [120, 132208.0]
  - - [896, 192, 1, 2048]
    - [122, 44869.9]
  - - [896, 192, 1, 8192]
    - [139, 84053.2]
  - - [896, 192, 1, 32768]
    - [120, 119536.0]
  - - [1024, 192, 1, 2048]
    - [124, 43099.0]
  - - [1024, 192, 1, 8192]
    - [109, 93658.9]
  - - [1024, 192, 1, 32768]
    - [227, 135735.0]
  - - [1280, 192, 1, 2048]
    - [124, 55018.8]
  - - [1280, 192, 1, 8192]
    - [228, 112026.0]
  - - [1280, 192, 1, 32768]
    - [154, 168676.0]
  - - [1536, 192, 1, 2048]
    - [124, 62691.5]
  - - [1536, 192, 1, 8192]
    - [115, 119835.0]
  - - [1536, 192, 1, 32768]
    - [115, 175471.0]
  - - [1792, 192, 1, 2048]
    - [141, 61260.3]
  - - [1792, 192, 1, 8192]
    - [229, 122265.0]
  - - [1792, 192, 1, 32768]
    - [229, 180129.0]
  - - [2048, 192, 1, 2048]
    - [153, 68659.1]
  - - [2048, 192, 1, 8192]
    - [230, 130707.0]
  - - [2048, 192, 1, 32768]
    - [227, 187290.0]
  - - [2304, 192, 1, 2048]
    - [87, 76769.6]
  - - [2304, 192, 1, 8192]
    - [227, 141353.0]
  - - [2304, 192, 1, 32768]
    - [231, 208406.0]
  - - [2560, 192, 1, 2048]
    - [153, 84524.2]
  - - [2560, 192, 1, 8192]
    - [232, 153506.0]
  - - [2560, 192, 1, 32768]
    - [227, 229492.0]
  - - [2816, 192, 1, 2048]
    - [109, 90212.9]
  - - [2816, 192, 1, 8192]
    - [227, 152874.0]
  - - [2816, 192, 1, 32768]
    - [231, 225476.0]
  - - [3072, 192, 1, 2048]
    - [109, 97317.2]
  - - [3072, 192, 1, 8192]
    - [232, 151186.0]
  - - [3072, 192, 1, 32768]
    - [227, 214430.0]
  - - [3584, 192, 1, 2048]
    - [233, 79716.6]
  - - [3584, 192, 1, 8192]
    - [227, 156924.0]
  - - [3584, 192, 1, 32768]
    - [227, 212449.0]
  - - [4096, 192, 1, 2048]
    - [151, 89124.0]
  - - [4096, 192, 1, 8192]
    - [227, 175618.0]
  - - [4096, 192, 1, 32768]
    - [227, 240411.0]
  - - [4608, 192, 1, 2048]
    - [151, 100187.0]
  - - [4608, 192, 1, 8192]
    - [227, 175265.0]
  - - [4608, 192, 1, 32768]
    - [227, 223357.0]
  - - [5120, 192, 1, 2048]
    - [189, 105340.0]
  - - [5120, 192, 1, 8192]
    - [227, 190853.0]
  - - [5632, 192, 1, 2048]
    - [120, 114875.0]
  - - [5632, 192, 1, 8192]
    - [227, 173002.0]
  - - [6144, 192, 1, 2048]
    - [120, 124708.0]
  - - [6144, 192, 1, 8192]
    - [227, 183933.0]
  - - [7168, 192, 1, 2048]
    - [229, 106124.0]
  - - [7168, 192, 1, 8192]
    - [229, 155059.0]
  - - [8192, 192, 1, 2048]
    - [230, 126419.0]
  - - [8192, 192, 1, 8192]
    - [232, 181946.0]
  - - [10240, 192, 1, 2048]
    - [230, 158384.0]
  - - [10240, 192, 1, 8192]
    - [227, 216968.0]
  - - [12288, 192, 1, 2048]
    - [115, 165399.0]
  - - [12288, 192, 1, 8192]
    - [115, 195634.0]
  - - [14336, 192, 1, 2048]
    - [234, 143247.0]
  - - [14336, 192, 1, 8192]
    - [229, 173674.0]
  - - [24576, 192, 1, 2048]
    - [128, 164613.0]
  - - [24576, 192, 1, 8192]
    - [217, 192453.0]
  - - [28672, 192, 1, 2048]
    - [235, 177531.0]
  - - [28672, 192, 1, 8192]
    - [236, 206363.0]
  - - [32768, 192, 1, 2048]
    - [128, 179642.0]
  - - [32768, 192, 1, 8192]
    - [236, 204612.0]
  - - [40960, 192, 1, 2048]
    - [236, 208283.0]
  - - [40960, 192, 1, 8192]
    - [236, 253705.0]
  - - [49152, 192, 1, 2048]
    - [235, 191052.0]
  - - [49152, 192, 1, 8192]
    - [237, 213064.0]
  - - [57344, 192, 1, 2048]
    - [238, 198963.0]
  - - [57344, 192, 1, 8192]
    - [236, 238041.0]
  - - [65536, 192, 1, 2048]
    - [236, 175163.0]
  - - [65536, 192, 1, 8192]
    - [236, 206726.0]
  - - [98304, 192, 1, 2048]
    - [237, 205487.0]
  - - [131072, 192, 1, 2048]
    - [236, 198659.0]
  - - [262144, 192, 1, 2048]
    - [237, 214962.0]
  - - [15360, 192, 1, 2048]
    - [196, 165292.0]
  - - [15360, 192, 1, 8192]
    - [196, 193252.0]
  - - [22528, 192, 1, 2048]
    - [128, 151542.0]
  - - [22528, 192, 1, 8192]
    - [217, 177737.0]
  - - [38016, 192, 1, 2048]
    - [235, 185314.0]
  - - [38016, 192, 1, 8192]
    - [238, 233306.0]
  - - [163840, 192, 1, 2048]
    - [237, 215786.0]
  - - [7, 224, 1, 2048]
    - [218, 732.715]
  - - [7, 224, 1, 8192]
    - [239, 2174.25]
  - - [7, 224, 1, 32768]
    - [240, 5390.66]
  - - [16, 224, 1, 2048]
    - [26, 1791.02]
  - - [16, 224, 1, 8192]
    - [51, 5099.85]
  - - [16, 224, 1, 32768]
    - [176, 11602.8]
  - - [32, 224, 1, 2048]
    - [32, 3507.75]
  - - [32, 224, 1, 8192]
    - [241, 9686.36]
  - - [32, 224, 1, 32768]
    - [241, 21934.6]
  - - [48, 224, 1, 2048]
    - [32, 5097.78]
  - - [48, 224, 1, 8192]
    - [220, 10667.3]
  - - [48, 224, 1, 32768]
    - [181, 22082.6]
  - - [64, 224, 1, 2048]
    - [57, 5891.5]
  - - [64, 224, 1, 8192]
    - [86, 16079.8]
  - - [64, 224, 1, 32768]
    - [103, 29760.1]
  - - [80, 224, 1, 2048]
    - [55, 6947.42]
  - - [80, 224, 1, 8192]
    - [166, 18639.1]
  - - [80, 224, 1, 32768]
    - [179, 36326.4]
  - - [96, 224, 1, 2048]
    - [55, 8453.34]
  - - [96, 224, 1, 8192]
    - [166, 22043.2]
  - - [96, 224, 1, 32768]
    - [179, 43901.5]
  - - [112, 224, 1, 2048]
    - [242, 8876.53]
  - - [112, 224, 1, 8192]
    - [106, 23828.9]
  - - [112, 224, 1, 32768]
    - [106, 42749.4]
  - - [128, 224, 1, 2048]
    - [57, 9887.77]
  - - [128, 224, 1, 8192]
    - [103, 24861.1]
  - - [128, 224, 1, 32768]
    - [106, 49187.2]
  - - [160, 224, 1, 2048]
    - [100, 12266.6]
  - - [160, 224, 1, 8192]
    - [181, 32703.5]
  - - [160, 224, 1, 32768]
    - [87, 56713.5]
  - - [192, 224, 1, 2048]
    - [56, 14394.3]
  - - [192, 224, 1, 8192]
    - [167, 32019.6]
  - - [192, 224, 1, 32768]
    - [243, 61063.2]
  - - [224, 224, 1, 2048]
    - [136, 15092.6]
  - - [224, 224, 1, 8192]
    - [102, 36221.1]
  - - [224, 224, 1, 32768]
    - [244, 65084.2]
  - - [256, 224, 1, 2048]
    - [180, 17157.7]
  - - [256, 224, 1, 8192]
    - [169, 44661.7]
  - - [256, 224, 1, 32768]
    - [182, 76726.0]
  - - [320, 224, 1, 2048]
    - [99, 20751.3]
  - - [320, 224, 1, 8192]
    - [243, 51210.7]
  - - [320, 224, 1, 32768]
    - [180, 92668.6]
  - - [384, 224, 1, 2048]
    - [245, 23773.2]
  - - [384, 224, 1, 8192]
    - [103, 56129.4]
  - - [384, 224, 1, 32768]
    - [169, 87069.5]
  - - [448, 224, 1, 2048]
    - [246, 25042.5]
  - - [448, 224, 1, 8192]
    - [180, 60772.9]
  - - [448, 224, 1, 32768]
    - [247, 100529.0]
  - - [512, 224, 1, 2048]
    - [59, 29648.3]
  - - [512, 224, 1, 8192]
    - [109, 66095.1]
  - - [512, 224, 1, 32768]
    - [188, 102245.0]
  - - [576, 224, 1, 2048]
    - [59, 36810.0]
  - - [576, 224, 1, 8192]
    - [248, 75707.6]
  - - [576, 224, 1, 32768]
    - [244, 117362.0]
  - - [640, 224, 1, 2048]
    - [59, 40588.3]
  - - [640, 224, 1, 8192]
    - [248, 82566.5]
  - - [640, 224, 1, 32768]
    - [189, 133087.0]
  - - [768, 224, 1, 2048]
    - [84, 37723.8]
  - - [768, 224, 1, 8192]
    - [120, 84477.4]
  - - [768, 224, 1, 32768]
    - [189, 125257.0]
  - - [896, 224, 1, 2048]
    - [249, 41398.6]
  - - [896, 224, 1, 8192]
    - [250, 92078.7]
  - - [896, 224, 1, 32768]
    - [250, 138992.0]
  - - [1024, 224, 1, 2048]
    - [124, 49272.4]
  - - [1024, 224, 1, 8192]
    - [183, 98076.0]
  - - [1024, 224, 1, 32768]
    - [188, 146457.0]
  - - [1280, 224, 1, 2048]
    - [124, 63506.8]
  - - [1280, 224, 1, 8192]
    - [251, 121893.0]
  - - [1280, 224, 1, 32768]
    - [251, 186358.0]
  - - [1536, 224, 1, 2048]
    - [153, 61041.9]
  - - [1536, 224, 1, 8192]
    - [252, 119257.0]
  - - [1536, 224, 1, 32768]
    - [194, 167142.0]
  - - [1792, 224, 1, 2048]
    - [87, 69994.3]
  - - [1792, 224, 1, 8192]
    - [251, 129083.0]
  - - [1792, 224, 1, 32768]
    - [195, 181644.0]
  - - [2048, 224, 1, 2048]
    - [109, 76357.4]
  - - [2048, 224, 1, 8192]
    - [188, 136007.0]
  - - [2048, 224, 1, 32768]
    - [188, 188713.0]
  - - [2304, 224, 1, 2048]
    - [248, 85818.0]
  - - [2304, 224, 1, 8192]
    - [186, 143249.0]
  - - [2304, 224, 1, 32768]
    - [190, 206230.0]
  - - [2560, 224, 1, 2048]
    - [109, 93811.3]
  - - [2560, 224, 1, 8192]
    - [197, 156949.0]
  - - [2560, 224, 1, 32768]
    - [197, 232590.0]
  - - [2816, 224, 1, 2048]
    - [70, 91112.4]
  - - [2816, 224, 1, 8192]
    - [188, 145258.0]
  - - [2816, 224, 1, 32768]
    - [190, 197113.0]
  - - [3072, 224, 1, 2048]
    - [159, 85588.2]
  - - [3072, 224, 1, 8192]
    - [196, 156427.0]
  - - [3072, 224, 1, 32768]
    - [197, 215754.0]
  - - [3584, 224, 1, 2048]
    - [191, 83040.4]
  - - [3584, 224, 1, 8192]
    - [197, 159772.0]
  - - [3584, 224, 1, 32768]
    - [197, 213884.0]
  - - [4096, 224, 1, 2048]
    - [183, 97135.8]
  - - [4096, 224, 1, 8192]
    - [190, 181343.0]
  - - [4608, 224, 1, 2048]
    - [183, 110607.0]
  - - [4608, 224, 1, 8192]
    - [197, 177807.0]
  - - [5120, 224, 1, 2048]
    - [183, 122422.0]
  - - [5120, 224, 1, 8192]
    - [190, 195048.0]
  - - [5632, 224, 1, 2048]
    - [197, 104897.0]
  - - [5632, 224, 1, 8192]
    - [197, 176509.0]
  - - [6144, 224, 1, 2048]
    - [156, 113035.0]
  - - [6144, 224, 1, 8192]
    - [197, 189826.0]
  - - [7168, 224, 1, 2048]
    - [191, 119657.0]
  - - [7168, 224, 1, 8192]
    - [195, 174974.0]
  - - [8192, 224, 1, 2048]
    - [194, 136264.0]
  - - [8192, 224, 1, 8192]
    - [197, 190076.0]
  - - [10240, 224, 1, 2048]
    - [188, 168457.0]
  - - [10240, 224, 1, 8192]
    - [197, 221405.0]
  - - [12288, 224, 1, 2048]
    - [196, 152350.0]
  - - [12288, 224, 1, 8192]
    - [197, 194996.0]
  - - [14336, 224, 1, 2048]
    - [195, 153709.0]
  - - [14336, 224, 1, 8192]
    - [196, 200098.0]
  - - [20480, 224, 1, 2048]
    - [202, 208257.0]
  - - [20480, 224, 1, 8192]
    - [202, 257588.0]
  - - [24576, 224, 1, 2048]
    - [203, 162831.0]
  - - [24576, 224, 1, 8192]
    - [202, 195462.0]
  - - [28672, 224, 1, 2048]
    - [204, 185774.0]
  - - [28672, 224, 1, 8192]
    - [202, 210339.0]
  - - [32768, 224, 1, 2048]
    - [202, 172190.0]
  - - [32768, 224, 1, 8192]
    - [202, 207467.0]
  - - [40960, 224, 1, 2048]
    - [202, 210241.0]
  - - [40960, 224, 1, 8192]
    - [202, 256750.0]
  - - [49152, 224, 1, 2048]
    - [205, 197547.0]
  - - [49152, 224, 1, 8192]
    - [205, 218557.0]
  - - [57344, 224, 1, 2048]
    - [202, 200582.0]
  - - [57344, 224, 1, 8192]
    - [202, 241283.0]
  - - [65536, 224, 1, 2048]
    - [202, 176144.0]
  - - [65536, 224, 1, 8192]
    - [202, 209550.0]
  - - [98304, 224, 1, 2048]
    - [202, 208129.0]
  - - [131072, 224, 1, 2048]
    - [202, 200297.0]
  - - [262144, 224, 1, 2048]
    - [202, 214979.0]
  - - [15360, 224, 1, 2048]
    - [196, 186478.0]
  - - [15360, 224, 1, 8192]
    - [196, 222979.0]
  - - [22528, 224, 1, 2048]
    - [253, 157156.0]
  - - [22528, 224, 1, 8192]
    - [254, 184553.0]
  - - [38016, 224, 1, 2048]
    - [202, 183774.0]
  - - [38016, 224, 1, 8192]
    - [202, 233045.0]
  - - [163840, 224, 1, 2048]
    - [202, 216737.0]
  - - [7, 256, 1, 2048]
    - [142, 832.704]
  - - [7, 256, 1, 8192]
    - [162, 2503.04]
  - - [7, 256, 1, 32768]
    - [240, 6187.95]
  - - [7, 320, 1, 2048]
    - [142, 1023.38]
  - - [7, 320, 1, 8192]
    - [162, 3093.38]
  - - [7, 320, 1, 32768]
    - [219, 6893.92]
  - - [16, 256, 1, 2048]
    - [255, 1845.49]
  - - [16, 256, 1, 8192]
    - [95, 5525.02]
  - - [16, 256, 1, 32768]
    - [95, 11004.8]
  - - [32, 256, 1, 2048]
    - [32, 3558.07]
  - - [32, 256, 1, 8192]
    - [95, 10805.0]
  - - [32, 256, 1, 32768]
    - [95, 21720.5]
  - - [48, 256, 1, 2048]
    - [27, 5191.66]
  - - [48, 256, 1, 8192]
    - [99, 14590.0]
  - - [48, 256, 1, 32768]
    - [99, 29383.1]
  - - [16, 320, 1, 2048]
    - [26, 2511.55]
  - - [16, 320, 1, 8192]
    - [95, 6724.05]
  - - [16, 320, 1, 32768]
    - [256, 14075.0]
  - - [32, 320, 1, 2048]
    - [32, 4922.42]
  - - [32, 320, 1, 8192]
    - [95, 13018.8]
  - - [32, 320, 1, 32768]
    - [256, 27395.4]
  - - [48, 320, 1, 2048]
    - [178, 6135.61]
  - - [48, 320, 1, 8192]
    - [178, 16600.0]
  - - [48, 320, 1, 32768]
    - [257, 29790.0]
  - - [64, 256, 1, 2048]
    - [85, 6403.43]
  - - [64, 256, 1, 8192]
    - [258, 17497.6]
  - - [64, 256, 1, 32768]
    - [179, 34337.8]
  - - [80, 256, 1, 2048]
    - [55, 7432.79]
  - - [80, 256, 1, 8192]
    - [166, 21031.1]
  - - [80, 256, 1, 32768]
    - [179, 41737.0]
  - - [96, 256, 1, 2048]
    - [55, 9017.02]
  - - [96, 256, 1, 8192]
    - [99, 23714.7]
  - - [96, 256, 1, 32768]
    - [179, 50006.4]
  - - [112, 256, 1, 2048]
    - [55, 10358.1]
  - - [112, 256, 1, 8192]
    - [166, 28592.1]
  - - [112, 256, 1, 32768]
    - [179, 57637.7]
  - - [64, 320, 1, 2048]
    - [55, 8052.07]
  - - [64, 320, 1, 8192]
    - [166, 21820.6]
  - - [64, 320, 1, 32768]
    - [179, 42678.8]
  - - [80, 320, 1, 2048]
    - [97, 9576.78]
  - - [80, 320, 1, 8192]
    - [106, 24465.9]
  - - [80, 320, 1, 32768]
    - [106, 43303.6]
  - - [96, 320, 1, 2048]
    - [242, 10882.4]
  - - [96, 320, 1, 8192]
    - [106, 29063.5]
  - - [96, 320, 1, 32768]
    - [106, 51945.5]
  - - [112, 320, 1, 2048]
    - [167, 12260.4]
  - - [112, 320, 1, 8192]
    - [167, 32909.2]
  - - [112, 320, 1, 32768]
    - [106, 59927.5]
  - - [128, 256, 1, 2048]
    - [57, 10938.5]
  - - [128, 256, 1, 8192]
    - [103, 27976.4]
  - - [128, 256, 1, 32768]
    - [106, 56326.3]
  - - [160, 256, 1, 2048]
    - [98, 13356.7]
  - - [160, 256, 1, 8192]
    - [181, 34254.9]
  - - [160, 256, 1, 32768]
    - [222, 64441.2]
  - - [192, 256, 1, 2048]
    - [56, 16105.1]
  - - [192, 256, 1, 8192]
    - [167, 40176.6]
  - - [192, 256, 1, 32768]
    - [224, 72849.1]
  - - [224, 256, 1, 2048]
    - [98, 18744.2]
  - - [224, 256, 1, 8192]
    - [259, 45774.1]
  - - [224, 256, 1, 32768]
    - [259, 83391.5]
  - - [128, 320, 1, 2048]
    - [167, 13962.8]
  - - [128, 320, 1, 8192]
    - [106, 37657.1]
  - - [128, 320, 1, 32768]
    - [106, 69570.3]
  - - [160, 320, 1, 2048]
    - [96, 16898.1]
  - - [160, 320, 1, 8192]
    - [224, 41118.7]
  - - [160, 320, 1, 32768]
    - [224, 76736.8]
  - - [192, 320, 1, 2048]
    - [56, 20549.9]
  - - [192, 320, 1, 8192]
    - [109, 47084.7]
  - - [192, 320, 1, 32768]
    - [224, 90356.8]
  - - [224, 320, 1, 2048]
    - [167, 21782.0]
  - - [224, 320, 1, 8192]
    - [105, 54685.9]
  - - [224, 320, 1, 32768]
    - [105, 91507.0]
  - - [256, 256, 1, 2048]
    - [58, 19026.6]
  - - [256, 256, 1, 8192]
    - [181, 48325.1]
  - - [256, 256, 1, 32768]
    - [182, 89343.2]
  - - [320, 256, 1, 2048]
    - [99, 23885.0]
  - - [320, 256, 1, 8192]
    - [260, 60696.6]
  - - [320, 256, 1, 32768]
    - [184, 105777.0]
  - - [384, 256, 1, 2048]
    - [261, 25587.7]
  - - [384, 256, 1, 8192]
    - [105, 65004.2]
  - - [384, 256, 1, 32768]
    - [262, 104314.0]
  - - [448, 256, 1, 2048]
    - [263, 29190.4]
  - - [448, 256, 1, 8192]
    - [247, 71652.8]
  - - [448, 256, 1, 32768]
    - [247, 114704.0]
  - - [256, 320, 1, 2048]
    - [167, 24015.2]
  - - [256, 320, 1, 8192]
    - [169, 56818.0]
  - - [256, 320, 1, 32768]
    - [105, 105146.0]
  - - [320, 320, 1, 2048]
    - [103, 24749.5]
  - - [320, 320, 1, 8192]
    - [108, 59742.3]
  - - [320, 320, 1, 32768]
    - [117, 98537.7]
  - - [384, 320, 1, 2048]
    - [103, 29639.8]
  - - [384, 320, 1, 8192]
    - [169, 73511.6]
  - - [384, 320, 1, 32768]
    - [117, 118675.0]
  - - [448, 320, 1, 2048]
    - [103, 34880.4]
  - - [448, 320, 1, 8192]
    - [185, 74821.2]
  - - [448, 320, 1, 32768]
    - [223, 125423.0]
  - - [512, 256, 1, 2048]
    - [59, 33956.9]
  - - [512, 256, 1, 8192]
    - [264, 77020.2]
  - - [512, 256, 1, 32768]
    - [194, 121075.0]
  - - [576, 256, 1, 2048]
    - [172, 40334.2]
  - - [576, 256, 1, 8192]
    - [248, 87054.5]
  - - [576, 256, 1, 32768]
    - [244, 134237.0]
  - - [640, 256, 1, 2048]
    - [171, 46464.0]
  - - [640, 256, 1, 8192]
    - [248, 96386.0]
  - - [640, 256, 1, 32768]
    - [189, 151906.0]
  - - [768, 256, 1, 2048]
    - [104, 45102.3]
  - - [768, 256, 1, 8192]
    - [189, 96859.9]
  - - [768, 256, 1, 32768]
    - [189, 142700.0]
  - - [896, 256, 1, 2048]
    - [104, 53036.3]
  - - [896, 256, 1, 8192]
    - [250, 104903.0]
  - - [896, 256, 1, 32768]
    - [250, 158191.0]
  - - [512, 320, 1, 2048]
    - [265, 36467.6]
  - - [512, 320, 1, 8192]
    - [119, 84972.9]
  - - [512, 320, 1, 32768]
    - [119, 142206.0]
  - - [576, 320, 1, 2048]
    - [104, 44095.3]
  - - [576, 320, 1, 8192]
    - [213, 89214.3]
  - - [576, 320, 1, 32768]
    - [250, 130535.0]
  - - [640, 320, 1, 2048]
    - [104, 48528.9]
  - - [640, 320, 1, 8192]
    - [213, 97623.8]
  - - [640, 320, 1, 32768]
    - [266, 143842.0]
  - - [768, 320, 1, 2048]
    - [124, 55151.9]
  - - [768, 320, 1, 8192]
    - [120, 105896.0]
  - - [768, 320, 1, 32768]
    - [125, 160159.0]
  - - [896, 320, 1, 2048]
    - [104, 65531.2]
  - - [896, 320, 1, 8192]
    - [225, 110236.0]
  - - [896, 320, 1, 32768]
    - [225, 158568.0]
  - - [1024, 256, 1, 2048]
    - [124, 57311.8]
  - - [1024, 256, 1, 8192]
    - [267, 111486.0]
  - - [1024, 256, 1, 32768]
    - [194, 165441.0]
  - - [1280, 256, 1, 2048]
    - [104, 71994.0]
  - - [1280, 256, 1, 8192]
    - [186, 139300.0]
  - - [1280, 256, 1, 32768]
    - [186, 211521.0]
  - - [1536, 256, 1, 2048]
    - [153, 68343.9]
  - - [1536, 256, 1, 8192]
    - [268, 136213.0]
  - - [1536, 256, 1, 32768]
    - [194, 191418.0]
  - - [1792, 256, 1, 2048]
    - [109, 77931.6]
  - - [1792, 256, 1, 8192]
    - [186, 145238.0]
  - - [1792, 256, 1, 32768]
    - [269, 210071.0]
  - - [1024, 320, 1, 2048]
    - [102, 61223.7]
  - - [1024, 320, 1, 8192]
    - [115, 120195.0]
  - - [1024, 320, 1, 32768]
    - [115, 194106.0]
  - - [1280, 320, 1, 2048]
    - [109, 70059.2]
  - - [1280, 320, 1, 8192]
    - [270, 136075.0]
  - - [1280, 320, 1, 32768]
    - [271, 196318.0]
  - - [1536, 320, 1, 2048]
    - [109, 82025.1]
  - - [1536, 320, 1, 8192]
    - [115, 143895.0]
  - - [1536, 320, 1, 32768]
    - [190, 200949.0]
  - - [1792, 320, 1, 2048]
    - [109, 95648.8]
  - - [1792, 320, 1, 8192]
    - [272, 142864.0]
  - - [1792, 320, 1, 32768]
    - [273, 205139.0]
  - - [2048, 256, 1, 2048]
    - [109, 86742.8]
  - - [2048, 256, 1, 8192]
    - [252, 156641.0]
  - - [2048, 256, 1, 32768]
    - [274, 214667.0]
  - - [2304, 256, 1, 2048]
    - [248, 98446.2]
  - - [2304, 256, 1, 8192]
    - [274, 161813.0]
  - - [2304, 256, 1, 32768]
    - [274, 239153.0]
  - - [2560, 256, 1, 2048]
    - [109, 107436.0]
  - - [2560, 256, 1, 8192]
    - [275, 175941.0]
  - - [2560, 256, 1, 32768]
    - [275, 263795.0]
  - - [2816, 256, 1, 2048]
    - [159, 93571.2]
  - - [2816, 256, 1, 8192]
    - [274, 174961.0]
  - - [2816, 256, 1, 32768]
    - [274, 256888.0]
  - - [3072, 256, 1, 2048]
    - [159, 96708.2]
  - - [3072, 256, 1, 8192]
    - [276, 175407.0]
  - - [3072, 256, 1, 32768]
    - [275, 245667.0]
  - - [3584, 256, 1, 2048]
    - [264, 95619.8]
  - - [3584, 256, 1, 8192]
    - [275, 178732.0]
  - - [2048, 320, 1, 2048]
    - [110, 95881.8]
  - - [2048, 320, 1, 8192]
    - [115, 159843.0]
  - - [2048, 320, 1, 32768]
    - [115, 210437.0]
  - - [2304, 320, 1, 2048]
    - [159, 95491.5]
  - - [2304, 320, 1, 8192]
    - [272, 152069.0]
  - - [2304, 320, 1, 32768]
    - [273, 205729.0]
  - - [2560, 320, 1, 2048]
    - [115, 96643.2]
  - - [2560, 320, 1, 8192]
    - [197, 167336.0]
  - - [2560, 320, 1, 32768]
    - [197, 221158.0]
  - - [2816, 320, 1, 2048]
    - [189, 100901.0]
  - - [2816, 320, 1, 8192]
    - [272, 162010.0]
  - - [2816, 320, 1, 32768]
    - [273, 212140.0]
  - - [3072, 320, 1, 2048]
    - [183, 106333.0]
  - - [3072, 320, 1, 8192]
    - [190, 170447.0]
  - - [3584, 320, 1, 2048]
    - [120, 121735.0]
  - - [3584, 320, 1, 8192]
    - [115, 166583.0]
  - - [4096, 256, 1, 2048]
    - [199, 110565.0]
  - - [4096, 256, 1, 8192]
    - [190, 201641.0]
  - - [4608, 256, 1, 2048]
    - [183, 127316.0]
  - - [4608, 256, 1, 8192]
    - [197, 203097.0]
  - - [5120, 256, 1, 2048]
    - [183, 140277.0]
  - - [5120, 256, 1, 8192]
    - [275, 222264.0]
  - - [5632, 256, 1, 2048]
    - [156, 118075.0]
  - - [5632, 256, 1, 8192]
    - [190, 198999.0]
  - - [6144, 256, 1, 2048]
    - [156, 127857.0]
  - - [6144, 256, 1, 8192]
    - [190, 214197.0]
  - - [7168, 256, 1, 2048]
    - [191, 137534.0]
  - - [7168, 256, 1, 8192]
    - [276, 199195.0]
  - - [4096, 320, 1, 2048]
    - [277, 135645.0]
  - - [4096, 320, 1, 8192]
    - [115, 185643.0]
  - - [4608, 320, 1, 2048]
    - [156, 120983.0]
  - - [4608, 320, 1, 8192]
    - [196, 167581.0]
  - - [5120, 320, 1, 2048]
    - [230, 133738.0]
  - - [5120, 320, 1, 8192]
    - [227, 184249.0]
  - - [5632, 320, 1, 2048]
    - [251, 137694.0]
  - - [5632, 320, 1, 8192]
    - [197, 179432.0]
  - - [6144, 320, 1, 2048]
    - [125, 149020.0]
  - - [6144, 320, 1, 8192]
    - [197, 192805.0]
  - - [7168, 320, 1, 2048]
    - [115, 161115.0]
  - - [7168, 320, 1, 8192]
    - [115, 192197.0]
  - - [8192, 256, 1, 2048]
    - [194, 156082.0]
  - - [8192, 256, 1, 8192]
    - [197, 210605.0]
  - - [10240, 256, 1, 2048]
    - [188, 192411.0]
  - - [10240, 256, 1, 8192]
    - [197, 250472.0]
  - - [12288, 256, 1, 2048]
    - [196, 172488.0]
  - - [12288, 256, 1, 8192]
    - [190, 217642.0]
  - - [14336, 256, 1, 2048]
    - [195, 175503.0]
  - - [14336, 256, 1, 8192]
    - [196, 227335.0]
  - - [8192, 320, 1, 2048]
    - [115, 181190.0]
  - - [8192, 320, 1, 8192]
    - [115, 218288.0]
  - - [10240, 320, 1, 2048]
    - [227, 177985.0]
  - - [10240, 320, 1, 8192]
    - [227, 213227.0]
  - - [12288, 320, 1, 2048]
    - [190, 185478.0]
  - - [12288, 320, 1, 8192]
    - [197, 222467.0]
  - - [14336, 320, 1, 2048]
    - [128, 159578.0]
  - - [14336, 320, 1, 8192]
    - [278, 202377.0]
  - - [16384, 256, 1, 2048]
    - [202, 191812.0]
  - - [16384, 256, 1, 8192]
    - [202, 234895.0]
  - - [20480, 256, 1, 2048]
    - [202, 234825.0]
  - - [20480, 256, 1, 8192]
    - [279, 291244.0]
  - - [24576, 256, 1, 2048]
    - [203, 185635.0]
  - - [24576, 256, 1, 8192]
    - [205, 218255.0]
  - - [28672, 256, 1, 2048]
    - [204, 210910.0]
  - - [28672, 256, 1, 8192]
    - [204, 238192.0]
  - - [16384, 320, 1, 2048]
    - [128, 181142.0]
  - - [16384, 320, 1, 8192]
    - [217, 213666.0]
  - - [20480, 320, 1, 2048]
    - [204, 187363.0]
  - - [20480, 320, 1, 8192]
    - [202, 212410.0]
  - - [24576, 320, 1, 2048]
    - [128, 188825.0]
  - - [24576, 320, 1, 8192]
    - [202, 221489.0]
  - - [28672, 320, 1, 2048]
    - [128, 190811.0]
  - - [28672, 320, 1, 8192]
    - [128, 208604.0]
  - - [32768, 256, 1, 2048]
    - [202, 196114.0]
  - - [32768, 256, 1, 8192]
    - [202, 237303.0]
  - - [40960, 256, 1, 2048]
    - [202, 240492.0]
  - - [40960, 256, 1, 8192]
    - [202, 293318.0]
  - - [49152, 256, 1, 2048]
    - [205, 225116.0]
  - - [49152, 256, 1, 8192]
    - [204, 249393.0]
  - - [57344, 256, 1, 2048]
    - [202, 228800.0]
  - - [57344, 256, 1, 8192]
    - [202, 275455.0]
  - - [32768, 320, 1, 2048]
    - [204, 188887.0]
  - - [32768, 320, 1, 8192]
    - [204, 208617.0]
  - - [40960, 320, 1, 2048]
    - [202, 205240.0]
  - - [40960, 320, 1, 8192]
    - [202, 245868.0]
  - - [49152, 320, 1, 2048]
    - [202, 187789.0]
  - - [57344, 320, 1, 2048]
    - [204, 188851.0]
  - - [65536, 256, 1, 2048]
    - [205, 220341.0]
  - - [98304, 256, 1, 2048]
    - [202, 236277.0]
  - - [131072, 256, 1, 2048]
    - [204, 238765.0]
  - - [262144, 256, 1, 2048]
    - [202, 245419.0]
  - - [65536, 320, 1, 2048]
    - [202, 199613.0]
  - - [98304, 320, 1, 2048]
    - [204, 194836.0]
  - - [131072, 320, 1, 2048]
    - [202, 200491.0]
  - - [262144, 320, 1, 2048]
    - [202, 203215.0]
  - - [15360, 320, 1, 2048]
    - [280, 181122.0]
  - - [15360, 320, 1, 8192]
    - [278, 214254.0]
  - - [22528, 256, 1, 2048]
    - [253, 179991.0]
  - - [22528, 256, 1, 8192]
    - [281, 209326.0]
  - - [22528, 320, 1, 2048]
    - [202, 170704.0]
  - - [22528, 320, 1, 8192]
    - [202, 204711.0]
  - - [38016, 256, 1, 2048]
    - [282, 217422.0]
  - - [38016, 256, 1, 8192]
    - [202, 264109.0]
  - - [38016, 320, 1, 2048]
    - [204, 184535.0]
  - - [38016, 320, 1, 8192]
    - [202, 226192.0]
  - - [163840, 256, 1, 2048]
    - [202, 246333.0]
  - - [163840, 320, 1, 2048]
    - [202, 208845.0]
  - - [7, 384, 1, 2048]
    - [162, 1172.08]
  - - [7, 384, 1, 8192]
    - [143, 3309.84]
  - - [7, 384, 1, 32768]
    - [240, 7931.62]
  - - [7, 448, 1, 2048]
    - [162, 1355.05]
  - - [7, 448, 1, 8192]
    - [143, 3865.56]
  - - [7, 448, 1, 32768]
    - [240, 9172.43]
  - - [16, 384, 1, 2048]
    - [26, 2967.84]
  - - [16, 384, 1, 8192]
    - [95, 7938.76]
  - - [16, 384, 1, 32768]
    - [95, 17161.6]
  - - [32, 384, 1, 2048]
    - [32, 5779.91]
  - - [32, 384, 1, 8192]
    - [208, 14604.8]
  - - [32, 384, 1, 32768]
    - [177, 32348.3]
  - - [48, 384, 1, 2048]
    - [50, 8189.15]
  - - [48, 384, 1, 8192]
    - [283, 20513.6]
  - - [48, 384, 1, 32768]
    - [283, 43479.4]
  - - [16, 448, 1, 2048]
    - [26, 3480.74]
  - - [16, 448, 1, 8192]
    - [95, 9254.57]
  - - [16, 448, 1, 32768]
    - [95, 20105.7]
  - - [32, 448, 1, 2048]
    - [32, 6810.64]
  - - [32, 448, 1, 8192]
    - [284, 14629.8]
  - - [32, 448, 1, 32768]
    - [181, 29045.7]
  - - [48, 448, 1, 2048]
    - [171, 7584.8]
  - - [48, 448, 1, 8192]
    - [285, 21081.3]
  - - [48, 448, 1, 32768]
    - [285, 39336.5]
  - - [64, 384, 1, 2048]
    - [165, 8916.15]
  - - [64, 384, 1, 8192]
    - [103, 23534.0]
  - - [64, 384, 1, 32768]
    - [286, 45788.6]
