projects/hipblaslt/library/src/amd_detail/rocblaslt/src/Tensile/Logic/asm_full/aquavanjaram/gfx942_80cu/GridBased/aquavanjaram_Cijk_Alik_Bljk_F8NBS_STA_BH_BiasSB_HAS_SAB_SAV_UserArgs.yaml
- {MinimumRequiredVersion: 4.33.0}
- aquavanjaram
- {Architecture: gfx942, CUCount: 80}
- [Device 0049, Device 0050]
    SolutionIndex: 0
    SolutionNameMin: Cijk_Alik_Bljk_F8NBS_STA_BH_BiasSH_HAS_SAB_SAV_UserArgs_MT32x16x256_MI16x16x1_SN_LDSB0_GRVWB16_GSU1_GSUAMB_GSUC0_GSUWGMRR0_K1_LBSPPB256_MIWT1_1_NTD0_NLCA4_SU0_SUM0_SUS256_SVW1_VWA1_VWB1_WG32_4_1_WGM1_WGMXCC1_WGMXCCGn1
    SolutionIndex: 1
    SolutionNameMin: Cijk_Alik_Bljk_F8NBS_STA_BH_BiasSH_HAS_SAB_SAV_UserArgs_MT32x16x256_MI16x16x1_SN_LDSB0_GRVWB16_GSU1_GSUAMB_GSUC0_GSUWGMRR0_K1_LBSPPB256_MIWT1_1_NTD0_NLCA4_SU16_SUM0_SUS256_SVW1_VWA1_VWB1_WG32_4_1_WGM6_WGMXCC1_WGMXCCGn1
    SolutionIndex: 2
    SolutionNameMin: Cijk_Alik_Bljk_F8NBS_STA_BH_BiasSH_HAS_SAB_SAV_UserArgs_MT64x32x256_MI16x16x1_SN_LDSB0_GRVWB16_GSU1_GSUAMB_GSUC0_GSUWGMRR0_K1_LBSPPB512_MIWT1_2_NTD0_NLCA4_SU8_SUM0_SUS256_SVW1_VWA1_VWB2_WG64_4_1_WGM1_WGMXCC1_WGMXCCGn1
    SolutionIndex: 3
    SolutionNameMin: Cijk_Alik_Bljk_F8NBS_STA_BH_BiasSH_HAS_SAB_SAV_UserArgs_MT64x48x256_MI16x16x1_SN_LDSB0_GRVWB16_GSU1_GSUAMB_GSUC0_GSUWGMRR0_K1_LBSPPB256_MIWT1_3_NTD4_NLCA4_SU16_SUM0_SUS256_SVW1_VWA1_VWB1_WG64_4_1_WGM1_WGMXCC1_WGMXCCGn1
    SolutionIndex: 4
    SolutionNameMin: Cijk_Alik_Bljk_F8NBS_STA_BH_BiasSH_HAS_SAB_SAV_UserArgs_MT64x48x256_MI16x16x1_SN_LDSB0_GRVWB16_GSU1_GSUAMB_GSUC0_GSUWGMRR0_K1_LBSPPB256_MIWT1_3_NTD4_NLCA4_SU8_SUM0_SUS256_SVW1_VWA1_VWB1_WG64_4_1_WGM1_WGMXCC1_WGMXCCGn1
    SolutionIndex: 5
    SolutionNameMin: Cijk_Alik_Bljk_F8NBS_STA_BH_BiasSH_HAS_SAB_SAV_UserArgs_MT64x32x256_MI16x16x1_SN_LDSB0_GRVWB16_GSU1_GSUAMB_GSUC0_GSUWGMRR0_K1_LBSPPB512_MIWT1_2_NTD0_NLCA4_SU16_SUM0_SUS256_SVW1_VWA1_VWB2_WG64_4_1_WGM6_WGMXCC1_WGMXCCGn1
    SolutionIndex: 6
    SolutionNameMin: Cijk_Alik_Bljk_F8NBS_STA_BH_BiasSH_HAS_SAB_SAV_UserArgs_MT128x32x256_MI16x16x1_SN_LDSB0_GRVWB16_GSU1_GSUAMB_GSUC0_GSUWGMRR0_K1_LBSPPB512_MIWT2_2_NTD4_NLCA4_SU8_SUM0_SUS256_SVW1_VWA1_VWB2_WG64_4_1_WGM1_WGMXCC1_WGMXCCGn1
    SolutionIndex: 7
    SolutionNameMin: Cijk_Alik_Bljk_F8NBS_STA_BH_BiasSH_HAS_SAB_SAV_UserArgs_MT320x80x128_MI16x16x1_SN_LDSB0_GRVWB8_GSU1_GSUAMB_GSUC0_GSUWGMRR0_K1_LBSPPB128_MIWT5_5_NTD4_NLCA2_SU8_SUM0_SUS128_SVW1_VWA1_VWB1_WG64_4_1_WGM6_WGMXCC1_WGMXCCGn1
    SolutionIndex: 8
    SolutionNameMin: Cijk_Alik_Bljk_F8NBS_STA_BH_BiasSH_HAS_SAB_SAV_UserArgs_MT256x112x128_MI16x16x1_SN_LDSB1_GRVWB8_GSU1_GSUAMBSK_GSUC0_GSUWGMRR0_K1_LBSPPB128_MIWT4_7_NTD4_NLCA2_SU16_SUM0_SUS128_SVW1_VWA1_VWB1_WG64_4_1_WGM8_WGMXCC1_WGMXCCGn1
    SolutionIndex: 9
    SolutionNameMin: Cijk_Alik_Bljk_F8NBS_STA_BH_BiasSH_HAS_SAB_SAV_UserArgs_MT256x112x128_MI16x16x1_SN_LDSB1_GRVWB8_GSU1_GSUAMB_GSUC0_GSUWGMRR0_K1_LBSPPB128_MIWT4_7_NTD0_NLCA2_SU16_SUM0_SUS128_SVW1_VWA1_VWB1_WG64_4_1_WGM8_WGMXCC1_WGMXCCGn1
    SolutionIndex: 10
    SolutionNameMin: Cijk_Alik_Bljk_F8NBS_STA_BH_BiasSH_HAS_SAB_SAV_UserArgs_MT128x80x256_MI16x16x1_SN_LDSB1_GRVWB16_GSU1_GSUAMB_GSUC0_GSUWGMRR0_K1_LBSPPB256_MIWT2_5_NTD0_NLCA4_SU0_SUM0_SUS256_SVW1_VWA1_VWB1_WG64_4_1_WGM8_WGMXCC1_WGMXCCGn1
    SolutionIndex: 11
    SolutionNameMin: Cijk_Alik_Bljk_F8NBS_STA_BH_BiasSH_HAS_SAB_SAV_UserArgs_MT320x96x128_MI16x16x1_SN_LDSB0_GRVWB16_GSU1_GSUAMB_GSUC0_GSUWGMRR0_K1_LBSPPB256_MIWT5_6_NTD4_NLCA2_SU8_SUM0_SUS128_SVW1_VWA1_VWB2_WG64_4_1_WGM1_WGMXCC1_WGMXCCGn1
    SolutionIndex: 12
    SolutionNameMin: Cijk_Alik_Bljk_F8NBS_STA_BH_BiasSH_HAS_SAB_SAV_UserArgs_MT256x128x128_MI16x16x1_SN_LDSB1_GRVWB16_GSU1_GSUAMB_GSUC0_GSUWGMRR0_K1_LBSPPB1024_MIWT4_8_NTD4_NLCA2_SU0_SUM0_SUS128_SVW4_VWA4_VWB8_WG64_4_1_WGM8_WGMXCC1_WGMXCCGn1
    SolutionIndex: 13
    SolutionNameMin: Cijk_Alik_Bljk_F8NBS_STA_BH_BiasSH_HAS_SAB_SAV_UserArgs_MT320x160x128_MI16x16x1_SN_LDSB0_GRVWB16_GSU1_GSUAMB_GSUC0_GSUWGMRR0_K1_LBSPPB256_MIWT5_10_NTD4_SU0_SUM0_SUS128_SVW1_VWA1_VWB2_WGM1_WGMXCC1_WGMXCCGn1
    SolutionIndex: 14
    SolutionNameMin: Cijk_Alik_Bljk_F8NBS_STA_BH_BiasSH_HAS_SAB_SAV_UserArgs_MT256x208x128_MI16x16x1_SN_LDSB1_GRVWB8_GSU1_GSUAMB_GSUC0_GSUWGMRR0_K1_LBSPPB128_MIWT4_13_NTD4_SU0_SUM0_SUS128_SVW4_VWA4_VWB1_WGM8_WGMXCC1_WGMXCCGn1
    SolutionIndex: 15
    SolutionNameMin: Cijk_Alik_Bljk_F8NBS_STA_BH_BiasSH_HAS_SAB_SAV_UserArgs_MT256x224x128_MI16x16x1_SN_LDSB0_GRVWB16_GSU1_GSUAMBSK_GSUC0_GSUWGMRR0_K1_LBSPPB256_MIWT4_14_NTD4_SU16_SUM0_SUS128_SVW4_VWA4_VWB2_WGM8_WGMXCC1_WGMXCCGn1
    SolutionIndex: 16
    SolutionNameMin: Cijk_Alik_Bljk_F8NBS_STA_BH_BiasSH_HAS_SAB_SAV_UserArgs_MT256x224x128_MI16x16x1_SN_LDSB0_GRVWB16_GSU1_GSUAMBSK_GSUC0_GSUWGMRR0_K1_LBSPPB256_MIWT4_14_NTD4_SU8_SUM0_SUS256_SVW4_VWA4_VWB2_WGM8_WGMXCC1_WGMXCCGn1
    SolutionIndex: 17
    SolutionNameMin: Cijk_Alik_Bljk_F8NBS_STA_BH_BiasSH_HAS_SAB_SAV_UserArgs_MT256x240x128_MI16x16x1_SN_LDSB1_GRVWB8_GSU1_GSUAMBSK_GSUC0_GSUWGMRR0_K1_LBSPPB128_MIWT4_15_NTD4_SU0_SUM0_SUS128_SVW4_VWA4_VWB1_WGM8_WGMXCC1_WGMXCCGn1
    SolutionIndex: 18
    SolutionNameMin: Cijk_Alik_Bljk_F8NBS_STA_BH_BiasSH_HAS_SAB_SAV_UserArgs_MT256x240x128_MI16x16x1_SN_LDSB1_GRVWB8_GSU1_GSUAMB_GSUC0_GSUWGMRR0_K1_LBSPPB128_MIWT4_15_NTD4_SU0_SUM0_SUS128_SVW4_VWA4_VWB1_WGM8_WGMXCC1_WGMXCCGn1
    SolutionIndex: 19
    SolutionNameMin: Cijk_Alik_Bljk_F8NBS_STA_BH_BiasSH_HAS_SAB_SAV_UserArgs_MT512x128x128_MI16x16x1_SN_LDSB0_GRVWB16_GSU1_GSUAMBSK_GSUC0_GSUWGMRR0_K1_LBSPPB1024_MIWT8_8_NTD0_SU0_SUM0_SUS128_SVW4_VWA4_VWB8_WGM8_WGMXCC1_WGMXCCGn1
    SolutionIndex: 20
    SolutionNameMin: Cijk_Alik_Bljk_F8NBS_STA_BH_BiasSH_HAS_SAB_SAV_UserArgs_MT512x128x128_MI16x16x1_SN_LDSB0_GRVWB16_GSU1_GSUAMB_GSUC0_GSUWGMRR0_K1_LBSPPB1024_MIWT8_8_NTD4_SU0_SUM0_SUS128_SVW4_VWA4_VWB8_WGM8_WGMXCC1_WGMXCCGn1
    SolutionIndex: 21
    SolutionNameMin: Cijk_Alik_Bljk_F8NBS_STA_BH_BiasSH_HAS_SAB_SAV_UserArgs_MT256x208x128_MI16x16x1_SN_LDSB1_GRVWB8_GSU1_GSUAMBSK_GSUC0_GSUWGMRR0_K1_LBSPPB128_MIWT4_13_NTD4_SU16_SUM0_SUS128_SVW4_VWA4_VWB1_WGM8_WGMXCC1_WGMXCCGn1
    SolutionIndex: 22
    SolutionNameMin: Cijk_Alik_Bljk_F8NBS_STA_BH_BiasSH_HAS_SAB_SAV_UserArgs_MT256x208x128_MI16x16x1_SN_LDSB1_GRVWB8_GSU1_GSUAMB_GSUC0_GSUWGMRR0_K1_LBSPPB128_MIWT4_13_NTD4_SU16_SUM0_SUS128_SVW4_VWA4_VWB1_WGM8_WGMXCC1_WGMXCCGn1
    SolutionIndex: 23
    SolutionNameMin: Cijk_Alik_Bljk_F8NBS_STA_BH_BiasSH_HAS_SAB_SAV_UserArgs_MT256x208x128_MI16x16x1_SN_LDSB1_GRVWB8_GSU1_GSUAMB_GSUC0_GSUWGMRR0_K1_LBSPPB128_MIWT4_13_NTD4_SU8_SUM0_SUS128_SVW4_VWA4_VWB1_WGM8_WGMXCC1_WGMXCCGn1
    SolutionIndex: 24
    SolutionNameMin: Cijk_Alik_Bljk_F8NBS_STA_BH_BiasSH_HAS_SAB_SAV_UserArgs_MT512x112x128_MI16x16x1_SN_LDSB0_GRVWB8_GSU1_GSUAMB_GSUC0_GSUWGMRR0_K1_LBSPPB128_MIWT8_7_NTD4_SU0_SUM0_SUS128_SVW4_VWA4_VWB1_WGM8_WGMXCC1_WGMXCCGn1
    SolutionIndex: 25
    SolutionNameMin: Cijk_Alik_Bljk_F8NBS_STA_BH_BiasSH_HAS_SAB_SAV_UserArgs_MT256x224x128_MI16x16x1_SN_LDSB0_GRVWB16_GSU1_GSUAMB_GSUC0_GSUWGMRR0_K1_LBSPPB256_MIWT4_14_NTD4_SU16_SUM0_SUS256_SVW4_VWA4_VWB2_WGM8_WGMXCC1_WGMXCCGn1
    SolutionIndex: 26
    SolutionNameMin: Cijk_Alik_Bljk_F8NBS_STA_BH_BiasSH_HAS_SAB_SAV_UserArgs_MT256x160x128_MI16x16x1_SN_LDSB0_GRVWB16_GSU1_GSUAMB_GSUC0_GSUWGMRR0_K1_LBSPPB256_MIWT4_10_NTD4_SU8_SUM0_SUS256_SVW4_VWA4_VWB2_WGM1_WGMXCC1_WGMXCCGn1
    SolutionIndex: 27
    SolutionNameMin: Cijk_Alik_Bljk_F8NBS_STA_BH_BiasSH_HAS_SAB_SAV_UserArgs_MT256x192x128_MI16x16x1_SN_LDSB0_GRVWB16_GSU1_GSUAMB_GSUC0_GSUWGMRR0_K1_LBSPPB512_MIWT4_12_NTD4_SU8_SUM0_SUS128_SVW4_VWA4_VWB4_WGM8_WGMXCC1_WGMXCCGn1
    SolutionIndex: 28
    SolutionNameMin: Cijk_Alik_Bljk_F8NBS_STA_BH_BiasSH_HAS_SAB_SAV_UserArgs_MT512x128x128_MI16x16x1_SN_LDSB0_GRVWB16_GSU1_GSUAMB_GSUC0_GSUWGMRR0_K1_LBSPPB1024_MIWT8_8_NTD4_SU8_SUM0_SUS128_SVW4_VWA4_VWB8_WGM6_WGMXCC1_WGMXCCGn1
    SolutionIndex: 29
    SolutionNameMin: Cijk_Alik_Bljk_F8NBS_STA_BH_BiasSH_HAS_SAB_SAV_UserArgs_MT256x160x128_MI16x16x1_SN_LDSB0_GRVWB16_GSU1_GSUAMB_GSUC0_GSUWGMRR0_K1_LBSPPB256_MIWT4_10_NTD4_SU16_SUM0_SUS128_SVW4_VWA4_VWB2_WGM8_WGMXCC1_WGMXCCGn1
    SolutionIndex: 30
    SolutionNameMin: Cijk_Alik_Bljk_F8NBS_STA_BH_BiasSH_HAS_SAB_SAV_UserArgs_MT256x192x128_MI16x16x1_SN_LDSB0_GRVWB16_GSU1_GSUAMB_GSUC0_GSUWGMRR0_K1_LBSPPB512_MIWT4_12_NTD4_SU8_SUM0_SUS256_SVW4_VWA4_VWB4_WGM8_WGMXCC1_WGMXCCGn1
    SolutionIndex: 31
    SolutionNameMin: Cijk_Alik_Bljk_F8NBS_STA_BH_BiasSH_HAS_SAB_SAV_UserArgs_MT512x128x128_MI16x16x1_SN_LDSB0_GRVWB16_GSU1_GSUAMB_GSUC0_GSUWGMRR0_K1_LBSPPB1024_MIWT8_8_NTD4_SU8_SUM0_SUS256_SVW4_VWA4_VWB8_WGM8_WGMXCC1_WGMXCCGn1
    SolutionIndex: 32
    SolutionNameMin: Cijk_Alik_Bljk_F8NBS_STA_BH_BiasSH_HAS_SAB_SAV_UserArgs_MT192x16x256_MI16x16x1_SN_LDSB0_GRVWB16_GSU1_GSUAMB_GSUC0_GSUWGMRR0_K1_LBSPPB256_MIWT3_1_NLCA4_SU0_SUM0_SUS256_SVW1_VWA1_VWB1_WG64_4_1_WGM6_WGMXCC1_WGMXCCGn1
    SolutionIndex: 33
    SolutionNameMin: Cijk_Alik_Bljk_F8NBS_STA_BH_BiasSH_HAS_SAB_SAV_UserArgs_MT192x32x256_MI16x16x1_SN_LDSB0_GRVWB16_GSU1_GSUAMB_GSUC0_GSUWGMRR0_K1_LBSPPB512_MIWT3_2_NLCA4_SU0_SUM0_SUS256_SVW1_VWA1_VWB2_WG64_4_1_WGM8_WGMXCC1_WGMXCCGn1
    SolutionIndex: 34
    SolutionNameMin: Cijk_Alik_Bljk_F8NBS_STA_BH_BiasSH_HAS_SAB_SAV_UserArgs_MT192x48x256_MI16x16x1_SN_LDSB0_GRVWB16_GSU1_GSUAMB_GSUC0_GSUWGMRR0_K1_LBSPPB256_MIWT3_3_NLCA4_SU0_SUM0_SUS256_SVW1_VWA1_VWB1_WG64_4_1_WGM8_WGMXCC1_WGMXCCGn1
    SolutionIndex: 35
    SolutionNameMin: Cijk_Alik_Bljk_F8NBS_STA_BH_BiasSH_HAS_SAB_SAV_UserArgs_MT192x64x256_MI16x16x1_SN_LDSB1_GRVWB16_GSU1_GSUAMBSK_GSUC0_GSUWGMRR0_K1_LBSPPB1024_MIWT3_4_NLCA4_SU8_SUM0_SUS256_SVW1_VWA1_VWB4_WG64_4_1_WGM6_WGMXCC1_WGMXCCGn1
    SolutionIndex: 36
    SolutionNameMin: Cijk_Alik_Bljk_F8NBS_STA_BH_BiasSH_HAS_SAB_SAV_UserArgs_MT192x80x256_MI16x16x1_SN_LDSB1_GRVWB16_GSU1_GSUAMB_GSUC0_GSUWGMRR0_K1_LBSPPB256_MIWT3_5_NLCA4_SU16_SUM0_SUS256_SVW1_VWA1_VWB1_WG64_4_1_WGM8_WGMXCC1_WGMXCCGn1
    SolutionIndex: 37
    SolutionNameMin: Cijk_Alik_Bljk_F8NBS_STA_BH_BiasSH_HAS_SAB_SAV_UserArgs_MT192x96x256_MI16x16x1_SN_LDSB1_GRVWB16_GSU1_GSUAMB_GSUC0_GSUWGMRR0_K1_LBSPPB512_MIWT3_6_NLCA4_SU0_SUM0_SUS256_SVW1_VWA1_VWB2_WG64_4_1_WGM6_WGMXCC1_WGMXCCGn1
    SolutionIndex: 38
    SolutionNameMin: Cijk_Alik_Bljk_F8NBS_STA_BH_BiasSH_HAS_SAB_SAV_UserArgs_MT192x112x128_MI16x16x1_SN_LDSB1_GRVWB8_GSU1_GSUAMB_GSUC0_GSUWGMRR0_K1_LBSPPB128_MIWT3_7_NLCA2_SU16_SUM0_SUS256_SVW1_VWA1_VWB1_WG64_4_1_WGM6_WGMXCC1_WGMXCCGn1
    SolutionIndex: 39
    SolutionNameMin: Cijk_Alik_Bljk_F8NBS_STA_BH_BiasSH_HAS_SAB_SAV_UserArgs_MT192x64x256_MI16x16x1_SN_LDSB1_GRVWB16_GSU1_GSUAMB_GSUC0_GSUWGMRR0_K1_LBSPPB1024_MIWT3_4_NLCA4_SU16_SUM0_SUS256_SVW1_VWA1_VWB4_WG64_4_1_WGM8_WGMXCC1_WGMXCCGn1
    SolutionIndex: 40
    SolutionNameMin: Cijk_Alik_Bljk_F8NBS_STA_BH_BiasSH_HAS_SAB_SAV_UserArgs_MT320x80x128_MI16x16x1_SN_LDSB0_GRVWB8_GSU1_GSUAMB_GSUC0_GSUWGMRR0_K1_LBSPPB128_MIWT5_5_NLCA2_SU0_SUM0_SUS128_SVW1_VWA1_VWB1_WG64_4_1_WGM8_WGMXCC1_WGMXCCGn1
    SolutionIndex: 41
    SolutionNameMin: Cijk_Alik_Bljk_F8NBS_STA_BH_BiasSH_HAS_SAB_SAV_UserArgs_MT256x96x128_MI16x16x1_SN_LDSB0_GRVWB16_GSU1_GSUAMB_GSUC0_GSUWGMRR0_K1_LBSPPB256_MIWT4_6_NLCA2_SU0_SUM0_SUS128_SVW1_VWA1_VWB2_WG64_4_1_WGM8_WGMXCC1_WGMXCCGn1
    SolutionIndex: 42
    SolutionNameMin: Cijk_Alik_Bljk_F8NBS_STA_BH_BiasSH_HAS_SAB_SAV_UserArgs_MT384x64x128_MI16x16x1_SN_LDSB0_GRVWB16_GSU1_GSUAMB_GSUC0_GSUWGMRR0_K1_LBSPPB512_MIWT6_4_NLCA2_SU0_SUM0_SUS128_SVW1_VWA1_VWB4_WG64_4_1_WGM8_WGMXCC1_WGMXCCGn1
    SolutionIndex: 43
    SolutionNameMin: Cijk_Alik_Bljk_F8NBS_STA_BH_BiasSH_HAS_SAB_SAV_UserArgs_MT256x80x128_MI16x16x1_SN_LDSB0_GRVWB8_GSU1_GSUAMB_GSUC0_GSUWGMRR0_K1_LBSPPB128_MIWT4_5_NLCA2_SU0_SUM0_SUS128_SVW1_VWA1_VWB1_WG64_4_1_WGM8_WGMXCC1_WGMXCCGn1
    SolutionIndex: 44
    SolutionNameMin: Cijk_Alik_Bljk_F8NBS_STA_BH_BiasSH_HAS_SAB_SAV_UserArgs_MT192x128x128_MI16x16x1_SN_LDSB1_GRVWB16_GSU1_GSUAMB_GSUC0_GSUWGMRR0_K1_LBSPPB1024_MIWT3_8_SU0_SUM0_SUS128_SVW1_VWA1_VWB8_WGM8_WGMXCC1_WGMXCCGn1
    SolutionIndex: 45
    SolutionNameMin: Cijk_Alik_Bljk_F8NBS_STA_BH_BiasSH_HAS_SAB_SAV_UserArgs_MT256x160x128_MI16x16x1_SN_LDSB0_GRVWB16_GSU1_GSUAMB_GSUC0_GSUWGMRR0_K1_LBSPPB256_MIWT4_10_SU0_SUM0_SUS128_SVW4_VWA4_VWB2_WGM8_WGMXCC1_WGMXCCGn1
    SolutionIndex: 46
    SolutionNameMin: Cijk_Alik_Bljk_F8NBS_STA_BH_BiasSH_HAS_SAB_SAV_UserArgs_MT256x208x128_MI16x16x1_SN_LDSB1_GRVWB8_GSU1_GSUAMB_GSUC0_GSUWGMRR0_K1_LBSPPB128_MIWT4_13_SU16_SUM0_SUS256_SVW4_VWA4_VWB1_WGM8_WGMXCC1_WGMXCCGn1
    SolutionIndex: 47
    SolutionNameMin: Cijk_Alik_Bljk_F8NBS_STA_BH_BiasSH_HAS_SAB_SAV_UserArgs_MT256x224x128_MI16x16x1_SN_LDSB0_GRVWB16_GSU1_GSUAMB_GSUC0_GSUWGMRR0_K1_LBSPPB256_MIWT4_14_SU0_SUM0_SUS128_SVW4_VWA4_VWB2_WGM8_WGMXCC1_WGMXCCGn1
    SolutionIndex: 48
    SolutionNameMin: Cijk_Alik_Bljk_F8NBS_STA_BH_BiasSH_HAS_SAB_SAV_UserArgs_MT256x192x128_MI16x16x1_SN_LDSB0_GRVWB16_GSU1_GSUAMB_GSUC0_GSUWGMRR0_K1_LBSPPB512_MIWT4_12_SU8_SUM0_SUS256_SVW4_VWA4_VWB4_WGM6_WGMXCC1_WGMXCCGn1
    SolutionIndex: 49
    SolutionNameMin: Cijk_Alik_Bljk_F8NBS_STA_BH_BiasSH_HAS_SAB_SAV_UserArgs_MT192x128x128_MI16x16x1_SN_LDSB1_GRVWB16_GSU1_GSUAMB_GSUC0_GSUWGMRR0_K1_LBSPPB1024_MIWT3_8_NTD0_SU8_SUM0_SUS256_SVW1_VWA1_VWB8_WGM8_WGMXCC1_WGMXCCGn1
    SolutionIndex: 50
    SolutionNameMin: Cijk_Alik_Bljk_F8NBS_STA_BH_BiasSH_HAS_SAB_SAV_UserArgs_MT192x128x128_MI16x16x1_SN_LDSB1_GRVWB16_GSU1_GSUAMB_GSUC0_GSUWGMRR0_K1_LBSPPB1024_MIWT3_8_NTD0_SU16_SUM0_SUS256_SVW1_VWA1_VWB8_WGM8_WGMXCC1_WGMXCCGn1
    SolutionIndex: 51
    SolutionNameMin: Cijk_Alik_Bljk_F8NBS_STA_BH_BiasSH_HAS_SAB_SAV_UserArgs_MT64x16x256_MI16x16x1_SN_LDSB0_GRVWB16_GSU1_GSUAMB_GSUC0_GSUWGMRR0_K1_LBSPPB256_MIWT1_1_NLCA4_SU0_SUM0_SUS256_SVW1_VWA1_VWB1_WG64_4_1_WGM1_WGMXCC1_WGMXCCGn1
    SolutionIndex: 52
    SolutionNameMin: Cijk_Alik_Bljk_F8NBS_STA_BH_BiasSH_HAS_SAB_SAV_UserArgs_MT64x32x256_MI16x16x1_SN_LDSB0_GRVWB16_GSU1_GSUAMB_GSUC0_GSUWGMRR0_K1_LBSPPB512_MIWT1_2_NLCA4_SU8_SUM0_SUS256_SVW1_VWA1_VWB2_WG64_4_1_WGM1_WGMXCC1_WGMXCCGn1
    SolutionIndex: 53
    SolutionNameMin: Cijk_Alik_Bljk_F8NBS_STA_BH_BiasSH_HAS_SAB_SAV_UserArgs_MT64x48x256_MI16x16x1_SN_LDSB0_GRVWB16_GSU1_GSUAMB_GSUC0_GSUWGMRR0_K1_LBSPPB256_MIWT1_3_NLCA4_SU0_SUM0_SUS256_SVW1_VWA1_VWB1_WG64_4_1_WGM1_WGMXCC1_WGMXCCGn1
    SolutionIndex: 54
    SolutionNameMin: Cijk_Alik_Bljk_F8NBS_STA_BH_BiasSH_HAS_SAB_SAV_UserArgs_MT128x32x256_MI16x16x1_SN_LDSB0_GRVWB16_GSU1_GSUAMB_GSUC0_GSUWGMRR0_K1_LBSPPB512_MIWT2_2_NLCA4_SU0_SUM0_SUS256_SVW1_VWA1_VWB2_WG64_4_1_WGM1_WGMXCC1_WGMXCCGn1
    SolutionIndex: 55
    SolutionNameMin: Cijk_Alik_Bljk_F8NBS_STA_BH_BiasSH_HAS_SAB_SAV_UserArgs_MT128x80x256_MI16x16x1_SN_LDSB1_GRVWB16_GSU1_GSUAMB_GSUC0_GSUWGMRR0_K1_LBSPPB256_MIWT2_5_NLCA4_SU8_SUM0_SUS256_SVW1_VWA1_VWB1_WG64_4_1_WGM1_WGMXCC1_WGMXCCGn1
    SolutionIndex: 56
    SolutionNameMin: Cijk_Alik_Bljk_F8NBS_STA_BH_BiasSH_HAS_SAB_SAV_UserArgs_MT128x48x256_MI16x16x1_SN_LDSB0_GRVWB16_GSU1_GSUAMB_GSUC0_GSUWGMRR0_K1_LBSPPB256_MIWT2_3_NLCA4_SU0_SUM0_SUS256_SVW1_VWA1_VWB1_WG64_4_1_WGM1_WGMXCC1_WGMXCCGn1
    SolutionIndex: 57
    SolutionNameMin: Cijk_Alik_Bljk_F8NBS_STA_BH_BiasSH_HAS_SAB_SAV_UserArgs_MT128x112x256_MI16x16x1_SN_LDSB1_GRVWB16_GSU1_GSUAMB_GSUC0_GSUWGMRR0_K1_LBSPPB256_MIWT2_7_NLCA4_SU8_SUM0_SUS256_SVW1_VWA1_VWB1_WG64_4_1_WGM1_WGMXCC1_WGMXCCGn1
    SolutionIndex: 58
    SolutionNameMin: Cijk_Alik_Bljk_F8NBS_STA_BH_BiasSH_HAS_SAB_SAV_UserArgs_MT128x64x256_MI16x16x1_SN_LDSB1_GRVWB16_GSU1_GSUAMB_GSUC0_GSUWGMRR0_K1_LBSPPB1024_MIWT2_4_NLCA4_SU0_SUM0_SUS256_SVW1_VWA1_VWB4_WG64_4_1_WGM1_WGMXCC1_WGMXCCGn1
    SolutionIndex: 59
    SolutionNameMin: Cijk_Alik_Bljk_F8NBS_STA_BH_BiasSH_HAS_SAB_SAV_UserArgs_MT256x160x128_MI16x16x1_SN_LDSB0_GRVWB16_GSU1_GSUAMBSK_GSUC0_GSUWGMRR0_K1_LBSPPB256_MIWT4_10_NLCA2_SU0_SUM0_SUS128_SVW4_VWA4_VWB2_WG64_4_1_WGM1_WGMXCC1_WGMXCCGn1
    SolutionIndex: 60
    SolutionNameMin: Cijk_Alik_Bljk_F8NBS_STA_BH_BiasSH_HAS_SAB_SAV_UserArgs_MT256x176x128_MI16x16x1_SN_LDSB0_GRVWB8_GSU1_GSUAMB_GSUC0_GSUWGMRR0_K1_LBSPPB128_MIWT4_11_NLCA2_SU8_SUM0_SUS128_SVW4_VWA4_VWB1_WG64_4_1_WGM1_WGMXCC1_WGMXCCGn1
    SolutionIndex: 61
    SolutionNameMin: Cijk_Alik_Bljk_F8NBS_STA_BH_BiasSH_HAS_SAB_SAV_UserArgs_MT256x192x128_MI16x16x1_SN_LDSB0_GRVWB16_GSU1_GSUAMB_GSUC0_GSUWGMRR0_K1_LBSPPB512_MIWT4_12_NLCA2_SU8_SUM0_SUS256_SVW4_VWA4_VWB4_WG64_4_1_WGM1_WGMXCC1_WGMXCCGn1
    SolutionIndex: 62
    SolutionNameMin: Cijk_Alik_Bljk_F8NBS_STA_BH_BiasSH_HAS_SAB_SAV_UserArgs_MT256x192x128_MI16x16x1_SN_LDSB0_GRVWB16_GSU1_GSUAMB_GSUC0_GSUWGMRR0_K1_LBSPPB512_MIWT4_12_NLCA2_SU0_SUM0_SUS128_SVW4_VWA4_VWB4_WG64_4_1_WGM1_WGMXCC1_WGMXCCGn1
    SolutionIndex: 63
    SolutionNameMin: Cijk_Alik_Bljk_F8NBS_STA_BH_BiasSH_HAS_SAB_SAV_UserArgs_MT256x96x128_MI16x16x1_SN_LDSB0_GRVWB16_GSU1_GSUAMB_GSUC0_GSUWGMRR0_K1_LBSPPB256_MIWT4_6_NLCA2_SU0_SUM0_SUS128_SVW1_VWA1_VWB2_WG64_4_1_WGM1_WGMXCC1_WGMXCCGn1
    SolutionIndex: 64
    SolutionNameMin: Cijk_Alik_Bljk_F8NBS_STA_BH_BiasSH_HAS_SAB_SAV_UserArgs_MT256x208x128_MI16x16x1_SN_LDSB1_GRVWB8_GSU1_GSUAMB_GSUC0_GSUWGMRR0_K1_LBSPPB128_MIWT4_13_NLCA2_SU8_SUM0_SUS256_SVW4_VWA4_VWB1_WG64_4_1_WGM1_WGMXCC1_WGMXCCGn1
    SolutionIndex: 65
    SolutionNameMin: Cijk_Alik_Bljk_F8NBS_STA_BH_BiasSH_HAS_SAB_SAV_UserArgs_MT256x160x128_MI16x16x1_SN_LDSB0_GRVWB16_GSU1_GSUAMB_GSUC0_GSUWGMRR0_K1_LBSPPB256_MIWT4_10_SU16_SUM0_SUS256_SVW4_VWA4_VWB2_WGM1_WGMXCC1_WGMXCCGn1
    SolutionIndex: 66
    SolutionNameMin: Cijk_Alik_Bljk_F8NBS_STA_BH_BiasSH_HAS_SAB_SAV_UserArgs_MT512x112x128_MI16x16x1_SN_LDSB0_GRVWB8_GSU1_GSUAMB_GSUC0_GSUWGMRR0_K1_LBSPPB128_MIWT8_7_SU8_SUM0_SUS128_SVW4_VWA4_VWB1_WGM1_WGMXCC1_WGMXCCGn1
    SolutionIndex: 67
    SolutionNameMin: Cijk_Alik_Bljk_F8NBS_STA_BH_BiasSH_HAS_SAB_SAV_UserArgs_MT256x176x128_MI16x16x1_SN_LDSB0_GRVWB8_GSU1_GSUAMB_GSUC0_GSUWGMRR0_K1_LBSPPB128_MIWT4_11_SU8_SUM0_SUS128_SVW4_VWA4_VWB1_WGM8_WGMXCC1_WGMXCCGn1
    SolutionIndex: 68
    SolutionNameMin: Cijk_Alik_Bljk_F8NBS_STA_BH_BiasSH_HAS_SAB_SAV_UserArgs_MT512x128x128_MI16x16x1_SN_LDSB0_GRVWB16_GSU1_GSUAMB_GSUC0_GSUWGMRR0_K1_LBSPPB1024_MIWT8_8_SU0_SUM0_SUS128_SVW4_VWA4_VWB8_WGM8_WGMXCC1_WGMXCCGn1
    SolutionIndex: 69
    SolutionNameMin: Cijk_Alik_Bljk_F8NBS_STA_BH_BiasSH_HAS_SAB_SAV_UserArgs_MT512x128x128_MI16x16x1_SN_LDSB0_GRVWB16_GSU1_GSUAMB_GSUC0_GSUWGMRR0_K1_LBSPPB1024_MIWT8_8_SU8_SUM0_SUS256_SVW4_VWA4_VWB8_WGM6_WGMXCC1_WGMXCCGn1
    SolutionIndex: 70
    SolutionNameMin: Cijk_Alik_Bljk_F8NBS_STA_BH_BiasSH_HAS_SAB_SAV_UserArgs_MT512x128x128_MI16x16x1_SN_LDSB0_GRVWB16_GSU1_GSUAMB_GSUC0_GSUWGMRR0_K1_LBSPPB1024_MIWT8_8_SU8_SUM0_SUS128_SVW4_VWA4_VWB8_WGM6_WGMXCC1_WGMXCCGn1
    SolutionIndex: 71
    SolutionNameMin: Cijk_Alik_Bljk_F8NBS_STA_BH_BiasSH_HAS_SAB_SAV_UserArgs_MT256x208x128_MI16x16x1_SN_LDSB1_GRVWB8_GSU1_GSUAMB_GSUC0_GSUWGMRR0_K1_LBSPPB128_MIWT4_13_SU8_SUM0_SUS128_SVW4_VWA4_VWB1_WGM8_WGMXCC1_WGMXCCGn1
    SolutionIndex: 72
    SolutionNameMin: Cijk_Alik_Bljk_F8NBS_STA_BH_BiasSH_HAS_SAB_SAV_UserArgs_MT256x208x128_MI16x16x1_SN_LDSB1_GRVWB8_GSU1_GSUAMB_GSUC0_GSUWGMRR0_K1_LBSPPB128_MIWT4_13_SU8_SUM0_SUS256_SVW4_VWA4_VWB1_WGM1_WGMXCC1_WGMXCCGn1
    SolutionIndex: 73
    SolutionNameMin: Cijk_Alik_Bljk_F8NBS_STA_BH_BiasSH_HAS_SAB_SAV_UserArgs_MT512x128x128_MI16x16x1_SN_LDSB0_GRVWB16_GSU1_GSUAMB_GSUC0_GSUWGMRR0_K1_LBSPPB1024_MIWT8_8_SU8_SUM0_SUS128_SVW4_VWA4_VWB8_WGM8_WGMXCC1_WGMXCCGn1
    SolutionIndex: 74
    SolutionNameMin: Cijk_Alik_Bljk_F8NBS_STA_BH_BiasSH_HAS_SAB_SAV_UserArgs_MT512x128x128_MI16x16x1_SN_LDSB0_GRVWB16_GSU1_GSUAMB_GSUC0_GSUWGMRR0_K1_LBSPPB1024_MIWT8_8_SU8_SUM0_SUS256_SVW4_VWA4_VWB8_WGM8_WGMXCC1_WGMXCCGn1
    SolutionIndex: 75
    SolutionNameMin: Cijk_Alik_Bljk_F8NBS_STA_BH_BiasSH_HAS_SAB_SAV_UserArgs_MT512x112x128_MI16x16x1_SN_LDSB0_GRVWB8_GSU1_GSUAMB_GSUC0_GSUWGMRR0_K1_LBSPPB128_MIWT8_7_SU8_SUM0_SUS256_SVW4_VWA4_VWB1_WGM1_WGMXCC1_WGMXCCGn1
    SolutionIndex: 76
    SolutionNameMin: Cijk_Alik_Bljk_F8NBS_STA_BH_BiasSH_HAS_SAB_SAV_UserArgs_MT256x176x128_MI16x16x1_SN_LDSB0_GRVWB8_GSU1_GSUAMB_GSUC0_GSUWGMRR0_K1_LBSPPB128_MIWT4_11_SU8_SUM0_SUS256_SVW4_VWA4_VWB1_WGM1_WGMXCC1_WGMXCCGn1
    SolutionIndex: 77
    SolutionNameMin: Cijk_Alik_Bljk_F8NBS_STA_BH_BiasSH_HAS_SAB_SAV_UserArgs_MT256x176x128_MI16x16x1_SN_LDSB0_GRVWB8_GSU1_GSUAMB_GSUC0_GSUWGMRR0_K1_LBSPPB128_MIWT4_11_SU8_SUM0_SUS128_SVW4_VWA4_VWB1_WGM1_WGMXCC1_WGMXCCGn1
    SolutionIndex: 78
    SolutionNameMin: Cijk_Alik_Bljk_F8NBS_STA_BH_BiasSH_HAS_SAB_SAV_UserArgs_MT256x240x128_MI16x16x1_SN_LDSB1_GRVWB8_GSU1_GSUAMB_GSUC0_GSUWGMRR0_K1_LBSPPB128_MIWT4_15_SU8_SUM0_SUS256_SVW4_VWA4_VWB1_WGM1_WGMXCC1_WGMXCCGn1
    SolutionIndex: 79
    SolutionNameMin: Cijk_Alik_Bljk_F8NBS_STA_BH_BiasSH_HAS_SAB_SAV_UserArgs_MT512x128x128_MI16x16x1_SN_LDSB0_GRVWB16_GSU1_GSUAMB_GSUC0_GSUWGMRR0_K1_LBSPPB1024_MIWT8_8_SU0_SUM0_SUS128_SVW4_VWA4_VWB8_WGM1_WGMXCC1_WGMXCCGn1
    SolutionIndex: 80
    SolutionNameMin: Cijk_Alik_Bljk_F8NBS_STA_BH_BiasSH_HAS_SAB_SAV_UserArgs_MT512x128x128_MI16x16x1_SN_LDSB0_GRVWB16_GSU1_GSUAMB_GSUC0_GSUWGMRR0_K1_LBSPPB1024_MIWT8_8_NTD0_SU0_SUM0_SUS128_SVW4_VWA4_VWB8_WGM8_WGMXCC1_WGMXCCGn1
    SolutionIndex: 81
    SolutionNameMin: Cijk_Alik_Bljk_F8NBS_STA_BH_BiasSH_HAS_SAB_SAV_UserArgs_MT512x112x128_MI16x16x1_SN_LDSB0_GRVWB8_GSU1_GSUAMB_GSUC0_GSUWGMRR0_K1_LBSPPB128_MIWT8_7_NTD0_SU0_SUM0_SUS128_SVW4_VWA4_VWB1_WGM8_WGMXCC1_WGMXCCGn1
    SolutionIndex: 82
    SolutionNameMin: Cijk_Alik_Bljk_F8NBS_STA_BH_BiasSH_HAS_SAB_SAV_UserArgs_MT64x16x256_MI16x16x1_SN_LDSB0_GRVWB16_GSU1_GSUAMB_GSUC0_GSUWGMRR0_K1_LBSPPB256_MIWT1_1_NLCA4_SU16_SUM0_SUS256_SVW1_VWA1_VWB1_WG64_4_1_WGM6_WGMXCC1_WGMXCCGn1
    SolutionIndex: 83
    SolutionNameMin: Cijk_Alik_Bljk_F8NBS_STA_BH_BiasSH_HAS_SAB_SAV_UserArgs_MT64x32x256_MI16x16x1_SN_LDSB0_GRVWB16_GSU1_GSUAMB_GSUC0_GSUWGMRR0_K1_LBSPPB512_MIWT1_2_NLCA4_SU8_SUM0_SUS256_SVW1_VWA1_VWB2_WG64_4_1_WGM6_WGMXCC1_WGMXCCGn1
    SolutionIndex: 84
    SolutionNameMin: Cijk_Alik_Bljk_F8NBS_STA_BH_BiasSH_HAS_SAB_SAV_UserArgs_MT128x48x256_MI16x16x1_SN_LDSB0_GRVWB16_GSU1_GSUAMB_GSUC0_GSUWGMRR0_K1_LBSPPB256_MIWT2_3_NLCA4_SU16_SUM0_SUS256_SVW1_VWA1_VWB1_WG64_4_1_WGM6_WGMXCC1_WGMXCCGn1
    SolutionIndex: 85
    SolutionNameMin: Cijk_Alik_Bljk_F8NBS_STA_BH_BiasSH_HAS_SAB_SAV_UserArgs_MT128x64x256_MI16x16x1_SN_LDSB1_GRVWB16_GSU1_GSUAMB_GSUC0_GSUWGMRR0_K1_LBSPPB1024_MIWT2_4_NLCA4_SU8_SUM0_SUS256_SVW1_VWA1_VWB4_WG64_4_1_WGM6_WGMXCC1_WGMXCCGn1
    SolutionIndex: 86
    SolutionNameMin: Cijk_Alik_Bljk_F8NBS_STA_BH_BiasSH_HAS_SAB_SAV_UserArgs_MT128x80x256_MI16x16x1_SN_LDSB1_GRVWB16_GSU1_GSUAMBSK_GSUC0_GSUWGMRR0_K1_LBSPPB256_MIWT2_5_NLCA4_SU16_SUM0_SUS256_SVW1_VWA1_VWB1_WG64_4_1_WGM8_WGMXCC1_WGMXCCGn1
    SolutionIndex: 87
    SolutionNameMin: Cijk_Alik_Bljk_F8NBS_STA_BH_BiasSH_HAS_SAB_SAV_UserArgs_MT128x96x256_MI16x16x1_SN_LDSB1_GRVWB16_GSU1_GSUAMB_GSUC0_GSUWGMRR0_K1_LBSPPB512_MIWT2_6_NLCA4_SU16_SUM0_SUS256_SVW1_VWA1_VWB2_WG64_4_1_WGM6_WGMXCC1_WGMXCCGn1
    SolutionIndex: 88
    SolutionNameMin: Cijk_Alik_Bljk_F8NBS_STA_BH_BiasSH_HAS_SAB_SAV_UserArgs_MT128x112x256_MI16x16x1_SN_LDSB1_GRVWB16_GSU1_GSUAMB_GSUC0_GSUWGMRR0_K1_LBSPPB256_MIWT2_7_NLCA4_SU16_SUM0_SUS256_SVW1_VWA1_VWB1_WG64_4_1_WGM8_WGMXCC1_WGMXCCGn1
    SolutionIndex: 89
    SolutionNameMin: Cijk_Alik_Bljk_F8NBS_STA_BH_BiasSH_HAS_SAB_SAV_UserArgs_MT128x128x128_MI16x16x1_SN_LDSB1_GRVWB16_GSU1_GSUAMB_GSUC0_GSUWGMRR0_K1_LBSPPB1024_MIWT2_8_NLCA2_SU8_SUM0_SUS256_SVW1_VWA1_VWB8_WG64_4_1_WGM8_WGMXCC1_WGMXCCGn1
    SolutionIndex: 90
    SolutionNameMin: Cijk_Alik_Bljk_F8NBS_STA_BH_BiasSH_HAS_SAB_SAV_UserArgs_MT256x80x128_MI16x16x1_SN_LDSB0_GRVWB8_GSU1_GSUAMB_GSUC0_GSUWGMRR0_K1_LBSPPB128_MIWT4_5_NLCA2_SU8_SUM0_SUS256_SVW1_VWA1_VWB1_WG64_4_1_WGM6_WGMXCC1_WGMXCCGn1
    SolutionIndex: 91
    SolutionNameMin: Cijk_Alik_Bljk_F8NBS_STA_BH_BiasSH_HAS_SAB_SAV_UserArgs_MT192x96x128_MI16x16x1_SN_LDSB0_GRVWB16_GSU1_GSUAMB_GSUC0_GSUWGMRR0_K1_LBSPPB256_MIWT3_6_NLCA2_SU8_SUM0_SUS256_SVW1_VWA1_VWB2_WG64_4_1_WGM8_WGMXCC1_WGMXCCGn1
    SolutionIndex: 92
    SolutionNameMin: Cijk_Alik_Bljk_F8NBS_STA_BH_BiasSH_HAS_SAB_SAV_UserArgs_MT256x96x128_MI16x16x1_SN_LDSB0_GRVWB16_GSU1_GSUAMB_GSUC0_GSUWGMRR0_K1_LBSPPB256_MIWT4_6_NLCA2_SU8_SUM0_SUS256_SVW1_VWA1_VWB2_WG64_4_1_WGM6_WGMXCC1_WGMXCCGn1
    SolutionIndex: 93
    SolutionNameMin: Cijk_Alik_Bljk_F8NBS_STA_BH_BiasSH_HAS_SAB_SAV_UserArgs_MT256x96x128_MI16x16x1_SN_LDSB0_GRVWB16_GSU1_GSUAMB_GSUC0_GSUWGMRR0_K1_LBSPPB256_MIWT4_6_NLCA2_SU8_SUM0_SUS256_SVW1_VWA1_VWB2_WG64_4_1_WGM8_WGMXCC1_WGMXCCGn1
    SolutionIndex: 94
    SolutionNameMin: Cijk_Alik_Bljk_F8NBS_STA_BH_BiasSH_HAS_SAB_SAV_UserArgs_MT192x96x128_MI16x16x1_SN_LDSB0_GRVWB16_GSU1_GSUAMB_GSUC0_GSUWGMRR0_K1_LBSPPB256_MIWT3_6_NLCA2_SU16_SUM0_SUS256_SVW1_VWA1_VWB2_WG64_4_1_WGM8_WGMXCC1_WGMXCCGn1
    SolutionIndex: 95
    SolutionNameMin: Cijk_Alik_Bljk_F8NBS_STA_BH_BiasSH_HAS_SAB_SAV_UserArgs_MT256x160x128_MI16x16x1_SN_LDSB0_GRVWB16_GSU1_GSUAMB_GSUC0_GSUWGMRR0_K1_LBSPPB256_MIWT4_10_SU0_SUM0_SUS128_SVW4_VWA4_VWB2_WGM1_WGMXCC1_WGMXCCGn1
    SolutionIndex: 96
    SolutionNameMin: Cijk_Alik_Bljk_F8NBS_STA_BH_BiasSH_HAS_SAB_SAV_UserArgs_MT192x128x128_MI16x16x1_SN_LDSB1_GRVWB16_GSU1_GSUAMB_GSUC0_GSUWGMRR0_K1_LBSPPB1024_MIWT3_8_SU0_SUM0_SUS128_SVW1_VWA1_VWB8_WGM6_WGMXCC1_WGMXCCGn1
    SolutionIndex: 97
    SolutionNameMin: Cijk_Alik_Bljk_F8NBS_STA_BH_BiasSH_HAS_SAB_SAV_UserArgs_MT256x176x128_MI16x16x1_SN_LDSB0_GRVWB8_GSU1_GSUAMB_GSUC0_GSUWGMRR0_K1_LBSPPB128_MIWT4_11_SU16_SUM0_SUS256_SVW4_VWA4_VWB1_WGM1_WGMXCC1_WGMXCCGn1
    SolutionIndex: 98
    SolutionNameMin: Cijk_Alik_Bljk_F8NBS_STA_BH_BiasSH_HAS_SAB_SAV_UserArgs_MT192x128x128_MI16x16x1_SN_LDSB1_GRVWB16_GSU1_GSUAMB_GSUC0_GSUWGMRR0_K1_LBSPPB1024_MIWT3_8_SU0_SUM0_SUS128_SVW1_VWA1_VWB8_WGM1_WGMXCC1_WGMXCCGn1
    SolutionIndex: 99
    SolutionNameMin: Cijk_Alik_Bljk_F8NBS_STA_BH_BiasSH_HAS_SAB_SAV_UserArgs_MT512x128x128_MI16x16x1_SN_LDSB0_GRVWB16_GSU1_GSUAMB_GSUC0_GSUWGMRR0_K1_LBSPPB1024_MIWT8_8_SU16_SUM0_SUS256_SVW4_VWA4_VWB8_WGM6_WGMXCC1_WGMXCCGn1
    SolutionIndex: 100
    SolutionNameMin: Cijk_Alik_Bljk_F8NBS_STA_BH_BiasSH_HAS_SAB_SAV_UserArgs_MT192x128x128_MI16x16x1_SN_LDSB1_GRVWB16_GSU1_GSUAMB_GSUC0_GSUWGMRR0_K1_LBSPPB1024_MIWT3_8_SU16_SUM0_SUS256_SVW1_VWA1_VWB8_WGM8_WGMXCC1_WGMXCCGn1
    SolutionIndex: 101
    SolutionNameMin: Cijk_Alik_Bljk_F8NBS_STA_BH_BiasSH_HAS_SAB_SAV_UserArgs_MT256x224x128_MI16x16x1_SN_LDSB0_GRVWB16_GSU1_GSUAMB_GSUC0_GSUWGMRR0_K1_LBSPPB256_MIWT4_14_SU0_SUM0_SUS128_SVW4_VWA4_VWB2_WGM1_WGMXCC1_WGMXCCGn1
    SolutionIndex: 102
    SolutionNameMin: Cijk_Alik_Bljk_F8NBS_STA_BH_BiasSH_HAS_SAB_SAV_UserArgs_MT192x128x128_MI16x16x1_SN_LDSB1_GRVWB16_GSU1_GSUAMB_GSUC0_GSUWGMRR0_K1_LBSPPB1024_MIWT3_8_SU16_SUM0_SUS256_SVW1_VWA1_VWB8_WGM1_WGMXCC1_WGMXCCGn1
    SolutionIndex: 103
    SolutionNameMin: Cijk_Alik_Bljk_F8NBS_STA_BH_BiasSH_HAS_SAB_SAV_UserArgs_MT192x128x128_MI16x16x1_SN_LDSB1_GRVWB16_GSU1_GSUAMB_GSUC0_GSUWGMRR0_K1_LBSPPB1024_MIWT3_8_NTD4_SU0_SUM0_SUS128_SVW1_VWA1_VWB8_WGM6_WGMXCC1_WGMXCCGn1
    SolutionIndex: 104
    SolutionNameMin: Cijk_Alik_Bljk_F8NBS_STA_BH_BiasSH_HAS_SAB_SAV_UserArgs_MT192x128x128_MI16x16x1_SN_LDSB1_GRVWB16_GSU1_GSUAMB_GSUC0_GSUWGMRR0_K1_LBSPPB1024_MIWT3_8_NTD4_SU16_SUM0_SUS256_SVW1_VWA1_VWB8_WGM8_WGMXCC1_WGMXCCGn1
    SolutionIndex: 105
    SolutionNameMin: Cijk_Alik_Bljk_F8NBS_STA_BH_BiasSH_HAS_SAB_SAV_UserArgs_MT192x128x128_MI16x16x1_SN_LDSB1_GRVWB16_GSU1_GSUAMB_GSUC0_GSUWGMRR0_K1_LBSPPB1024_MIWT3_8_NTD4_SU8_SUM0_SUS256_SVW1_VWA1_VWB8_WGM8_WGMXCC1_WGMXCCGn1
    SolutionIndex: 106
    SolutionNameMin: Cijk_Alik_Bljk_F8NBS_STA_BH_BiasSH_HAS_SAB_SAV_UserArgs_MT192x128x128_MI16x16x1_SN_LDSB1_GRVWB16_GSU1_GSUAMB_GSUC0_GSUWGMRR0_K1_LBSPPB1024_MIWT3_8_NTD4_SU0_SUM0_SUS128_SVW1_VWA1_VWB8_WGM8_WGMXCC1_WGMXCCGn1
    SolutionIndex: 107
    SolutionNameMin: Cijk_Alik_Bljk_F8NBS_STA_BH_BiasSH_HAS_SAB_SAV_UserArgs_MT192x128x128_MI16x16x1_SN_LDSB1_GRVWB16_GSU1_GSUAMB_GSUC0_GSUWGMRR0_K1_LBSPPB1024_MIWT3_8_NTD4_SU16_SUM0_SUS128_SVW1_VWA1_VWB8_WGM8_WGMXCC1_WGMXCCGn1
- - - [8192, 16, 1, 7392]
    - [82, 45.86]
  - - [8192, 32, 1, 7392]
    - [83, 77.66]
  - - [8192, 48, 1, 7392]
    - [84, 96.48]
  - - [8192, 64, 1, 7392]
    - [85, 119.55]
  - - [8192, 80, 1, 7392]
    - [86, 132.75]
  - - [8192, 96, 1, 7392]
    - [87, 141.02]
  - - [8192, 112, 1, 7392]
    - [88, 145.11]
  - - [8192, 128, 1, 7392]
    - [89, 155.3]
  - - [8192, 800, 1, 7392]
    - [90, 254.64]
  - - [8192, 832, 1, 7392]
    - [91, 237.29]
  - - [8192, 864, 1, 7392]
    - [91, 246.2]
  - - [8192, 896, 1, 7392]
    - [92, 245.51]
  - - [8192, 928, 1, 7392]
    - [92, 253.65]
  - - [8192, 960, 1, 7392]
    - [93, 263.56]
  - - [8192, 992, 1, 7392]
    - [38, 239.52]
  - - [8192, 1024, 1, 7392]
    - [94, 245.48]
  - - [8192, 1600, 1, 7392]
    - [95, 256.78]
  - - [8192, 1664, 1, 7392]
    - [96, 262.1]
  - - [8192, 1728, 1, 7392]
    - [97, 245.47]
  - - [8192, 1792, 1, 7392]
    - [98, 249.54]
  - - [8192, 1856, 1, 7392]
    - [79, 251.51]
  - - [8192, 1920, 1, 7392]
    - [79, 260.9]
  - - [8192, 1984, 1, 7392]
    - [96, 245.64]
  - - [8192, 2048, 1, 7392]
    - [44, 254.44]
  - - [8192, 3096, 1, 7392]
    - [99, 252.89]
  - - [8192, 3160, 1, 7392]
    - [74, 257.51]
  - - [8192, 3224, 1, 7392]
    - [100, 257.91]
  - - [8192, 3288, 1, 7392]
    - [44, 262.72]
  - - [8192, 3352, 1, 7392]
    - [101, 260.02]
  - - [8192, 3416, 1, 7392]
    - [44, 257.07]
  - - [8192, 3480, 1, 7392]
    - [76, 250.44]
  - - [8192, 3544, 1, 7392]
    - [102, 249.55]
  - - [8192, 3608, 1, 7392]
    - [98, 253.8]
  - - [8192, 16384, 1, 7392]
    - [103, 269.97]
  - - [8192, 16896, 1, 7392]
    - [103, 270.43]
  - - [8192, 17408, 1, 7392]
    - [104, 267.66]
  - - [8192, 17920, 1, 7392]
    - [105, 268.46]
  - - [8192, 18432, 1, 7392]
    - [105, 269.13]
  - - [8192, 18944, 1, 7392]
    - [106, 269.58]
  - - [8192, 19456, 1, 7392]
    - [103, 269.88]
  - - [8192, 19968, 1, 7392]
    - [103, 269.89]
  - - [8192, 20480, 1, 7392]
    - [107, 270.25]
  - - [8192, 16, 1, 2048]
    - [51, 31.7]
  - - [8192, 32, 1, 2048]
    - [52, 53.48]
  - - [8192, 48, 1, 2048]
    - [53, 68.14]
  - - [8192, 64, 1, 2048]
    - [54, 78.35]
  - - [8192, 80, 1, 2048]
    - [55, 86.06]
  - - [8192, 96, 1, 2048]
    - [56, 98.78]
  - - [8192, 112, 1, 2048]
    - [57, 97.0]
  - - [8192, 128, 1, 2048]
    - [58, 114.29]
  - - [8192, 800, 1, 2048]
    - [59, 198.63]
  - - [8192, 832, 1, 2048]
    - [60, 185.1]
  - - [8192, 864, 1, 2048]
    - [60, 191.43]
  - - [8192, 896, 1, 2048]
    - [61, 187.36]
  - - [8192, 928, 1, 2048]
    - [62, 192.96]
  - - [8192, 960, 1, 2048]
    - [63, 202.3]
  - - [8192, 992, 1, 2048]
    - [64, 188.44]
  - - [8192, 1024, 1, 2048]
    - [64, 194.1]
  - - [8192, 1600, 1, 2048]
    - [65, 203.8]
  - - [8192, 1664, 1, 2048]
    - [66, 202.93]
  - - [8192, 1728, 1, 2048]
    - [67, 200.82]
  - - [8192, 1792, 1, 2048]
    - [68, 199.85]
  - - [8192, 1856, 1, 2048]
    - [69, 204.03]
  - - [8192, 1920, 1, 2048]
    - [70, 212.53]
  - - [8192, 1984, 1, 2048]
    - [71, 196.74]
  - - [8192, 2048, 1, 2048]
    - [72, 202.31]
  - - [8192, 3096, 1, 2048]
    - [73, 207.11]
  - - [8192, 3160, 1, 2048]
    - [74, 210.65]
  - - [8192, 3224, 1, 2048]
    - [75, 204.85]
  - - [8192, 3288, 1, 2048]
    - [66, 207.66]
  - - [8192, 3352, 1, 2048]
    - [66, 210.95]
  - - [8192, 3416, 1, 2048]
    - [76, 202.41]
  - - [8192, 3480, 1, 2048]
    - [77, 206.07]
  - - [8192, 3544, 1, 2048]
    - [78, 206.0]
  - - [8192, 3608, 1, 2048]
    - [79, 202.9]
  - - [8192, 16384, 1, 2048]
    - [20, 218.68]
  - - [8192, 16896, 1, 2048]
    - [80, 217.17]
  - - [8192, 17408, 1, 2048]
    - [80, 216.04]
  - - [8192, 17920, 1, 2048]
    - [20, 221.74]
  - - [8192, 18432, 1, 2048]
    - [20, 220.32]
  - - [8192, 18944, 1, 2048]
    - [80, 219.03]
  - - [8192, 19456, 1, 2048]
    - [80, 217.94]
  - - [8192, 19968, 1, 2048]
    - [81, 216.91]
  - - [8192, 20480, 1, 2048]
    - [20, 221.99]
  - - [2560, 16, 1, 8192]
    - [0, 19.85]
  - - [2560, 32, 1, 8192]
    - [1, 38.92]
  - - [2560, 48, 1, 8192]
    - [0, 53.14]
  - - [2560, 64, 1, 8192]
    - [2, 69.72]
  - - [2560, 80, 1, 8192]
    - [3, 75.42]
  - - [2560, 96, 1, 8192]
    - [4, 90.77]
  - - [2560, 112, 1, 8192]
    - [5, 99.6]
  - - [2560, 128, 1, 8192]
    - [6, 111.47]
  - - [2560, 800, 1, 8192]
    - [7, 236.67]
  - - [2560, 832, 1, 8192]
    - [8, 216.47]
  - - [2560, 864, 1, 8192]
    - [8, 223.49]
  - - [2560, 896, 1, 8192]
    - [9, 240.71]
  - - [2560, 928, 1, 8192]
    - [10, 229.48]
  - - [2560, 960, 1, 8192]
    - [11, 240.67]
  - - [2560, 992, 1, 8192]
    - [12, 241.1]
  - - [2560, 1024, 1, 8192]
    - [12, 246.45]
  - - [2560, 1600, 1, 8192]
    - [13, 253.29]
  - - [2560, 1664, 1, 8192]
    - [14, 259.77]
  - - [2560, 1728, 1, 8192]
    - [15, 259.07]
  - - [2560, 1792, 1, 8192]
    - [16, 270.12]
  - - [2560, 1856, 1, 8192]
    - [17, 255.49]
  - - [2560, 1920, 1, 8192]
    - [18, 265.56]
  - - [2560, 1984, 1, 8192]
    - [19, 263.48]
  - - [2560, 2048, 1, 8192]
    - [20, 274.08]
  - - [2560, 3096, 1, 8192]
    - [21, 249.72]
  - - [2560, 3160, 1, 8192]
    - [22, 255.73]
  - - [2560, 3224, 1, 8192]
    - [22, 260.73]
  - - [2560, 3288, 1, 8192]
    - [23, 265.32]
  - - [2560, 3352, 1, 8192]
    - [24, 254.92]
  - - [2560, 3416, 1, 8192]
    - [25, 259.71]
  - - [2560, 3480, 1, 8192]
    - [24, 264.73]
  - - [2560, 3544, 1, 8192]
    - [24, 269.55]
  - - [2560, 3608, 1, 8192]
    - [26, 254.74]
  - - [2560, 16384, 1, 8192]
    - [20, 281.17]
  - - [2560, 16896, 1, 8192]
    - [27, 274.42]
  - - [2560, 17408, 1, 8192]
    - [24, 270.66]
  - - [2560, 17920, 1, 8192]
    - [24, 278.24]
  - - [2560, 18432, 1, 8192]
    - [28, 281.47]
  - - [2560, 18944, 1, 8192]
    - [29, 270.85]
  - - [2560, 19456, 1, 8192]
    - [24, 274.64]
  - - [2560, 19968, 1, 8192]
    - [30, 274.6]
  - - [2560, 20480, 1, 8192]
    - [31, 281.2]
  - - [14784, 16, 1, 8192]
    - [32, 64.94]
  - - [14784, 32, 1, 8192]
    - [33, 112.49]
  - - [14784, 48, 1, 8192]
    - [34, 146.61]
  - - [14784, 64, 1, 8192]
    - [35, 177.8]
  - - [14784, 80, 1, 8192]
    - [36, 198.81]
  - - [14784, 96, 1, 8192]
    - [37, 206.14]
  - - [14784, 112, 1, 8192]
    - [38, 195.03]
  - - [14784, 128, 1, 8192]
    - [39, 211.95]
  - - [14784, 800, 1, 8192]
    - [40, 262.44]
  - - [14784, 832, 1, 8192]
    - [41, 247.97]
  - - [14784, 864, 1, 8192]
    - [41, 257.78]
  - - [14784, 896, 1, 8192]
    - [42, 259.9]
  - - [14784, 928, 1, 8192]
    - [43, 246.64]
  - - [14784, 960, 1, 8192]
    - [43, 254.63]
  - - [14784, 992, 1, 8192]
    - [41, 257.2]
  - - [14784, 1024, 1, 8192]
    - [41, 265.19]
  - - [14784, 1600, 1, 8192]
    - [44, 249.69]
  - - [14784, 1664, 1, 8192]
    - [44, 260.76]
  - - [14784, 1728, 1, 8192]
    - [45, 259.37]
  - - [14784, 1792, 1, 8192]
    - [44, 262.94]
  - - [14784, 1856, 1, 8192]
    - [45, 252.89]
  - - [14784, 1920, 1, 8192]
    - [45, 261.45]
  - - [14784, 1984, 1, 8192]
    - [44, 256.3]
  - - [14784, 2048, 1, 8192]
    - [44, 264.5]
  - - [14784, 3096, 1, 8192]
    - [46, 262.42]
  - - [14784, 3160, 1, 8192]
    - [44, 263.85]
  - - [14784, 3224, 1, 8192]
    - [44, 259.63]
  - - [14784, 3288, 1, 8192]
    - [44, 264.62]
  - - [14784, 3352, 1, 8192]
    - [47, 268.04]
  - - [14784, 3416, 1, 8192]
    - [44, 268.16]
  - - [14784, 3480, 1, 8192]
    - [45, 265.85]
  - - [14784, 3544, 1, 8192]
    - [44, 269.36]
  - - [14784, 3608, 1, 8192]
    - [48, 264.63]
  - - [14784, 16384, 1, 8192]
    - [49, 282.71]
  - - [14784, 16896, 1, 8192]
    - [49, 282.67]
  - - [14784, 17408, 1, 8192]
    - [50, 283.28]
  - - [14784, 17920, 1, 8192]
    - [49, 283.42]
  - - [14784, 18432, 1, 8192]
    - [50, 283.32]
  - - [14784, 18944, 1, 8192]
    - [49, 283.23]
  - - [14784, 19456, 1, 8192]
    - [49, 283.25]
  - - [14784, 19968, 1, 8192]
    - [49, 283.01]
  - - [14784, 20480, 1, 8192]
    - [49, 283.26]
- null
- null
- DeviceEfficiency
- GridBased
