projects/hipblaslt/library/src/amd_detail/rocblaslt/src/Tensile/Logic/asm_full/aquavanjaram/gfx942_80cu/GridBased/aquavanjaram_Cijk_Ailk_Bjlk_S_MX_B_Bias_HA_SAV_UserArgs.yaml
- {MinimumRequiredVersion: 5.0.0}
- aquavanjaram
- {Architecture: gfx942, CUCount: 80}
- [Device 0049, Device 0050]
    SolutionIndex: 0
    SolutionNameMin: Cijk_Ailk_Bjlk_S_MX_B_Bias_HA_S_SAV_UserArgs_MT16x16x64_MI16x16x1_SN_LDSB1_AFC1_AFEM1_AFEM1_ASEM1_CLR1_CADS0_DTVA0_DTVB0_EPS0_FDSI0_GRPM1_GRVWA1_GRVWB1_GSUn1_GSUAMBSK_GSUC1_GSUWGMRR1_GLS0_ISA942_IU1_K1_LBSPPA128_LBSPPB128_LBSPPM0_LPA16_LPB16_LPM0_LRVW2_LWPMn1_MIAV0_MIWT1_1_MO40_NTn1_NTA0_NTB0_NTC0_NTD4_NTM0_NEPBS8_NLCA1_NLCB1_ONLL1_PGR2_PLR1_PKA1_SIA3_SS1_SU0_SUM1_SUS0_SPO0_SRVW0_SSO0_SVW1_SK0_SKXCCM0_TLDS0_ULSGRO0_USL1_UIOFGRO0_USFGROn1_VSn1_VWA1_VWB1_WSGRA0_WSGRB0_WS64_WG16_4_4_WGM1_WGMXCC4_WGMXCCGn1
    SolutionIndex: 1
    SolutionNameMin: Cijk_Ailk_Bjlk_S_MX_B_Bias_HA_S_SAV_UserArgs_MT16x16x128_MI16x16x1_SN_LDSB0_AFC1_AFEM1_AFEM1_ASEM1_CLR1_CADS0_DTVA0_DTVB0_EPS0_FDSI0_GRPM1_GRVWA1_GRVWB1_GSUn1_GSUAMBSK_GSUC1_GSUWGMRR1_GLS0_ISA942_IU1_K1_LBSPPA128_LBSPPB128_LBSPPM0_LPA16_LPB16_LPM0_LRVW2_LWPMn1_MIAV0_MIWT1_1_MO40_NTn1_NTA0_NTB0_NTC0_NTD4_NTM0_NEPBS8_NLCA1_NLCB1_ONLL1_PGR2_PLR1_PKA1_SIA3_SS1_SU0_SUM1_SUS0_SPO0_SRVW0_SSO0_SVW1_SK0_SKXCCM0_TLDS0_ULSGRO0_USL1_UIOFGRO0_USFGROn1_VSn1_VWA1_VWB1_WSGRA0_WSGRB0_WS64_WG16_4_4_WGM1_WGMXCC4_WGMXCCGn1
    SolutionIndex: 2
    SolutionNameMin: Cijk_Ailk_Bjlk_S_MX_B_Bias_HA_S_SAV_UserArgs_MT16x16x64_MI16x16x1_SN_LDSB1_AFC1_AFEM1_AFEM1_ASEM1_CLR1_CADS0_DTVA0_DTVB0_EPS0_FDSI0_GRPM1_GRVWA4_GRVWB1_GSUn1_GSUAMBSK_GSUC1_GSUWGMRR1_GLS0_ISA942_IU1_K1_LBSPPA128_LBSPPB128_LBSPPM0_LPA16_LPB16_LPM0_LRVW2_LWPMn1_MIAV0_MIWT1_1_MO40_NTn1_NTA0_NTB0_NTC0_NTD4_NTM0_NEPBS8_NLCA1_NLCB1_ONLL1_PGR2_PLR1_PKA1_SIA3_SS1_SU0_SUM1_SUS0_SPO0_SRVW0_SSO0_SVW1_SK0_SKXCCM0_TLDS0_ULSGRO0_USL1_UIOFGRO0_USFGROn1_VSn1_VWA1_VWB1_WSGRA0_WSGRB0_WS64_WG16_4_4_WGM1_WGMXCC4_WGMXCCGn1
    SolutionIndex: 3
    SolutionNameMin: Cijk_Ailk_Bjlk_S_MX_B_Bias_HA_S_SAV_UserArgs_MT16x16x128_MI16x16x1_SN_LDSB1_AFC1_AFEM1_AFEM1_ASEM1_CLR1_CADS0_DTVA0_DTVB0_EPS0_FDSI0_GRPM1_GRVWA4_GRVWB1_GSUn1_GSUAMBSK_GSUC1_GSUWGMRR1_GLS0_ISA942_IU1_K1_LBSPPA128_LBSPPB128_LBSPPM0_LPA16_LPB16_LPM0_LRVW2_LWPMn1_MIAV0_MIWT1_1_MO40_NTn1_NTA0_NTB0_NTC0_NTD4_NTM0_NEPBS8_NLCA1_NLCB1_ONLL1_PGR2_PLR1_PKA1_SIA3_SS1_SU0_SUM1_SUS0_SPO0_SRVW0_SSO0_SVW1_SK0_SKXCCM0_TLDS0_ULSGRO0_USL1_UIOFGRO0_USFGROn1_VSn1_VWA1_VWB1_WSGRA0_WSGRB0_WS64_WG16_4_4_WGM1_WGMXCC4_WGMXCCGn1
    SolutionIndex: 4
    SolutionNameMin: Cijk_Ailk_Bjlk_S_MX_B_Bias_HA_S_SAV_UserArgs_MT16x16x128_MI16x16x1_SN_LDSB0_AFC1_AFEM1_AFEM1_ASEM1_CLR1_CADS0_DTVA0_DTVB0_EPS0_FDSI0_GRPM1_GRVWA4_GRVWB1_GSUn1_GSUAMBSK_GSUC1_GSUWGMRR1_GLS0_ISA942_IU1_K1_LBSPPA128_LBSPPB128_LBSPPM0_LPA16_LPB16_LPM0_LRVW2_LWPMn1_MIAV0_MIWT1_1_MO40_NTn1_NTA0_NTB0_NTC0_NTD4_NTM0_NEPBS8_NLCA1_NLCB1_ONLL1_PGR2_PLR1_PKA1_SIA3_SS1_SU0_SUM1_SUS0_SPO0_SRVW0_SSO0_SVW1_SK0_SKXCCM0_TLDS0_ULSGRO0_USL1_UIOFGRO0_USFGROn1_VSn1_VWA1_VWB1_WSGRA0_WSGRB0_WS64_WG16_4_4_WGM1_WGMXCC4_WGMXCCGn1
    SolutionIndex: 5
    SolutionNameMin: Cijk_Ailk_Bjlk_S_MX_B_Bias_HA_S_SAV_UserArgs_MT32x16x64_MI16x16x1_SN_LDSB0_AFC1_AFEM1_AFEM1_ASEM1_CLR1_CADS0_DTVA0_DTVB0_EPS0_FDSI0_GRPM1_GRVWA4_GRVWB1_GSUn1_GSUAMBSK_GSUC1_GSUWGMRR1_GLS0_ISA942_IU1_K1_LBSPPA256_LBSPPB128_LBSPPM0_LPA0_LPB16_LPM0_LRVW2_LWPMn1_MIAV0_MIWT2_1_MO40_NTn1_NTA0_NTB0_NTC0_NTD4_NTM0_NEPBS8_NLCA1_NLCB1_ONLL1_PGR2_PLR1_PKA1_SIA3_SS1_SU0_SUM1_SUS0_SPO0_SRVW0_SSO0_SVW2_SK0_SKXCCM0_TLDS0_ULSGRO0_USL1_UIOFGRO0_USFGROn1_VSn1_VWA2_VWB1_WSGRA0_WSGRB0_WS64_WG16_4_4_WGM1_WGMXCC4_WGMXCCGn1
    SolutionIndex: 6
    SolutionNameMin: Cijk_Ailk_Bjlk_S_MX_B_Bias_HA_S_SAV_UserArgs_MT32x16x128_MI16x16x1_SN_LDSB0_AFC1_AFEM1_AFEM1_ASEM1_CLR1_CADS0_DTVA0_DTVB0_EPS0_FDSI0_GRPM1_GRVWA4_GRVWB1_GSUn1_GSUAMBSK_GSUC1_GSUWGMRR1_GLS0_ISA942_IU1_K1_LBSPPA256_LBSPPB128_LBSPPM0_LPA16_LPB16_LPM0_LRVW2_LWPMn1_MIAV0_MIWT1_1_MO40_NTn1_NTA0_NTB0_NTC0_NTD4_NTM0_NEPBS8_NLCA1_NLCB1_ONLL1_PGR2_PLR1_PKA1_SIA3_SS1_SU0_SUM1_SUS0_SPO0_SRVW0_SSO0_SVW1_SK0_SKXCCM0_TLDS0_ULSGRO0_USL1_UIOFGRO0_USFGROn1_VSn1_VWA1_VWB1_WSGRA0_WSGRB0_WS64_WG32_4_2_WGM1_WGMXCC4_WGMXCCGn1
    SolutionIndex: 7
    SolutionNameMin: Cijk_Ailk_Bjlk_S_MX_B_Bias_HA_S_SAV_UserArgs_MT16x16x64_MI16x16x1_SN_LDSB1_AFC1_AFEM1_AFEM1_ASEM1_CLR1_CADS0_DTVA0_DTVB0_EPS0_FDSI0_GRPM1_GRVWA4_GRVWB1_GSUn1_GSUAMBSK_GSUC1_GSUWGMRR1_GLS0_ISA942_IU1_K1_LBSPPA128_LBSPPB128_LBSPPM0_LPA16_LPB16_LPM0_LRVW2_LWPMn1_MIAV0_MIWT1_1_MO40_NTn1_NTA0_NTB0_NTC0_NTD4_NTM0_NEPBS8_NLCA1_NLCB1_ONLL1_PGR2_PLR1_PKA1_SIA3_SS1_SU0_SUM1_SUS0_SPO0_SRVW0_SSO0_SVW1_SK0_SKXCCM0_TLDS0_ULSGRO0_USL1_UIOFGRO0_USFGROn1_VSn1_VWA1_VWB1_WSGRA0_WSGRB0_WS64_WG16_4_2_WGM1_WGMXCC4_WGMXCCGn1
    SolutionIndex: 8
    SolutionNameMin: Cijk_Ailk_Bjlk_S_MX_B_Bias_HA_S_SAV_UserArgs_MT32x16x64_MI16x16x1_SN_LDSB0_AFC1_AFEM1_AFEM1_ASEM1_CLR1_CADS0_DTVA0_DTVB0_EPS0_FDSI0_GRPM1_GRVWA4_GRVWB1_GSUn1_GSUAMBSK_GSUC1_GSUWGMRR1_GLS0_ISA942_IU1_K1_LBSPPA256_LBSPPB128_LBSPPM0_LPA16_LPB16_LPM0_LRVW2_LWPMn1_MIAV0_MIWT1_1_MO40_NTn1_NTA0_NTB0_NTC0_NTD4_NTM0_NEPBS8_NLCA1_NLCB1_ONLL1_PGR2_PLR1_PKA1_SIA3_SS1_SU0_SUM1_SUS0_SPO0_SRVW0_SSO0_SVW1_SK0_SKXCCM0_TLDS0_ULSGRO0_USL1_UIOFGRO0_USFGROn1_VSn1_VWA1_VWB1_WSGRA0_WSGRB0_WS64_WG32_4_2_WGM1_WGMXCC4_WGMXCCGn1
    SolutionIndex: 9
    SolutionNameMin: Cijk_Ailk_Bjlk_S_MX_B_Bias_HA_S_SAV_UserArgs_MT64x16x64_MI16x16x1_SN_LDSB0_AFC1_AFEM1_AFEM1_ASEM1_CLR1_CADS0_DTVA0_DTVB0_EPS0_FDSI0_GRPM1_GRVWA4_GRVWB1_GSUn1_GSUAMBSK_GSUC1_GSUWGMRR1_GLS0_ISA942_IU1_K1_LBSPPA512_LBSPPB128_LBSPPM0_LPA16_LPB16_LPM0_LRVW2_LWPMn1_MIAV0_MIWT1_1_MO40_NTn1_NTA0_NTB0_NTC0_NTD4_NTM0_NEPBS8_NLCA1_NLCB1_ONLL1_PGR2_PLR1_PKA1_SIA3_SS1_SU0_SUM1_SUS0_SPO0_SRVW0_SSO0_SVW1_SK0_SKXCCM0_TLDS0_ULSGRO0_USL1_UIOFGRO0_USFGROn1_VSn1_VWA1_VWB1_WSGRA0_WSGRB0_WS64_WG64_4_1_WGM1_WGMXCC4_WGMXCCGn1
    SolutionIndex: 10
    SolutionNameMin: Cijk_Ailk_Bjlk_S_MX_B_Bias_HA_S_SAV_UserArgs_MT32x16x64_MI16x16x1_SN_LDSB0_AFC1_AFEM1_AFEM1_ASEM1_CLR1_CADS0_DTVA0_DTVB0_EPS0_FDSI0_GRPM1_GRVWA4_GRVWB1_GSUn1_GSUAMBSK_GSUC1_GSUWGMRR1_GLS0_ISA942_IU1_K1_LBSPPA256_LBSPPB128_LBSPPM0_LPA16_LPB16_LPM0_LRVW2_LWPMn1_MIAV0_MIWT1_1_MO40_NTn1_NTA0_NTB0_NTC0_NTD4_NTM0_NEPBS8_NLCA1_NLCB1_ONLL1_PGR2_PLR1_PKA1_SIA3_SS1_SU0_SUM1_SUS0_SPO0_SRVW0_SSO0_SVW1_SK0_SKXCCM0_TLDS0_ULSGRO0_USL1_UIOFGRO0_USFGROn1_VSn1_VWA1_VWB1_WSGRA0_WSGRB0_WS64_WG32_4_1_WGM1_WGMXCC4_WGMXCCGn1
    SolutionIndex: 11
    SolutionNameMin: Cijk_Ailk_Bjlk_S_MX_B_Bias_HA_S_SAV_UserArgs_MT32x16x64_MI16x16x1_SN_LDSB1_AFC1_AFEM1_AFEM1_ASEM1_CLR1_CADS0_DTVA0_DTVB0_EPS0_FDSI0_GRPM1_GRVWA4_GRVWB1_GSUn1_GSUAMBSK_GSUC1_GSUWGMRR1_GLS0_ISA942_IU1_K1_LBSPPA256_LBSPPB128_LBSPPM0_LPA16_LPB16_LPM0_LRVW2_LWPMn1_MIAV0_MIWT1_1_MO40_NTn1_NTA0_NTB0_NTC0_NTD4_NTM0_NEPBS8_NLCA1_NLCB1_ONLL1_PGR2_PLR1_PKA1_SIA3_SS1_SU0_SUM1_SUS0_SPO0_SRVW0_SSO0_SVW1_SK0_SKXCCM0_TLDS0_ULSGRO0_USL1_UIOFGRO0_USFGROn1_VSn1_VWA1_VWB1_WSGRA0_WSGRB0_WS64_WG32_4_1_WGM1_WGMXCC4_WGMXCCGn1
    SolutionIndex: 12
    SolutionNameMin: Cijk_Ailk_Bjlk_S_MX_B_Bias_HA_S_SAV_UserArgs_MT64x16x128_MI16x16x1_SN_LDSB1_AFC1_AFEM1_AFEM1_ASEM1_CLR1_CADS0_DTVA0_DTVB0_EPS0_FDSI0_GRPM1_GRVWA4_GRVWB1_GSUn1_GSUAMBSK_GSUC1_GSUWGMRR1_GLS0_ISA942_IU1_K1_LBSPPA512_LBSPPB128_LBSPPM0_LPA16_LPB16_LPM0_LRVW2_LWPMn1_MIAV0_MIWT1_1_MO40_NTn1_NTA0_NTB0_NTC0_NTD4_NTM0_NEPBS8_NLCA1_NLCB1_ONLL1_PGR2_PLR1_PKA1_SIA3_SS1_SU0_SUM1_SUS0_SPO0_SRVW0_SSO0_SVW1_SK0_SKXCCM0_TLDS0_ULSGRO0_USL1_UIOFGRO0_USFGROn1_VSn1_VWA1_VWB1_WSGRA0_WSGRB0_WS64_WG64_4_1_WGM1_WGMXCC4_WGMXCCGn1
    SolutionIndex: 13
    SolutionNameMin: Cijk_Ailk_Bjlk_S_MX_B_Bias_HA_S_SAV_UserArgs_MT32x16x32_MI16x16x1_SN_LDSB0_AFC1_AFEM1_AFEM1_ASEM1_CLR1_CADS0_DTVA0_DTVB0_EPS0_FDSI0_GRPM1_GRVWA4_GRVWB1_GSUn1_GSUAMBSK_GSUC1_GSUWGMRR1_GLS0_ISA942_IU1_K1_LBSPPA256_LBSPPB128_LBSPPM0_LPA16_LPB16_LPM0_LRVW2_LWPMn1_MIAV0_MIWT1_1_MO40_NTn1_NTA0_NTB0_NTC0_NTD4_NTM0_NEPBS8_NLCA1_NLCB1_ONLL1_PGR2_PLR1_PKA1_SIA3_SS1_SU0_SUM1_SUS0_SPO0_SRVW0_SSO0_SVW1_SK0_SKXCCM0_TLDS0_ULSGRO0_USL1_UIOFGRO0_USFGROn1_VSn1_VWA1_VWB1_WSGRA0_WSGRB0_WS64_WG32_4_1_WGM1_WGMXCC4_WGMXCCGn1
    SolutionIndex: 14
    SolutionNameMin: Cijk_Ailk_Bjlk_S_MX_B_Bias_HA_S_SAV_UserArgs_MT128x16x64_MI16x16x1_SN_LDSB1_AFC1_AFEM1_AFEM1_ASEM1_CLR1_CADS0_DTVA0_DTVB0_EPS0_FDSI0_GRPM1_GRVWA4_GRVWB1_GSUn1_GSUAMBSK_GSUC1_GSUWGMRR1_GLS0_ISA942_IU1_K1_LBSPPA1024_LBSPPB128_LBSPPM0_LPA0_LPB16_LPM0_LRVW2_LWPMn1_MIAV0_MIWT2_1_MO40_NTn1_NTA0_NTB0_NTC0_NTD4_NTM0_NEPBS8_NLCA1_NLCB1_ONLL1_PGR2_PLR1_PKA1_SIA3_SS1_SU0_SUM1_SUS0_SPO0_SRVW0_SSO0_SVW2_SK0_SKXCCM0_TLDS0_ULSGRO0_USL1_UIOFGRO0_USFGROn1_VSn1_VWA2_VWB1_WSGRA0_WSGRB0_WS64_WG64_4_1_WGM1_WGMXCC4_WGMXCCGn1
    SolutionIndex: 15
    SolutionNameMin: Cijk_Ailk_Bjlk_S_MX_B_Bias_HA_S_SAV_UserArgs_MT64x16x64_MI16x16x1_SN_LDSB1_AFC1_AFEM1_AFEM1_ASEM1_CLR1_CADS0_DTVA0_DTVB0_EPS0_FDSI0_GRPM1_GRVWA4_GRVWB1_GSUn1_GSUAMBSK_GSUC1_GSUWGMRR1_GLS0_ISA942_IU1_K1_LBSPPA512_LBSPPB128_LBSPPM0_LPA16_LPB16_LPM0_LRVW2_LWPMn1_MIAV0_MIWT1_1_MO40_NTn1_NTA0_NTB0_NTC0_NTD4_NTM0_NEPBS8_NLCA1_NLCB1_ONLL1_PGR2_PLR1_PKA1_SIA3_SS1_SU0_SUM1_SUS0_SPO0_SRVW0_SSO0_SVW1_SK0_SKXCCM0_TLDS0_ULSGRO0_USL1_UIOFGRO0_USFGROn1_VSn1_VWA1_VWB1_WSGRA0_WSGRB0_WS64_WG64_4_1_WGM1_WGMXCC4_WGMXCCGn1
    SolutionIndex: 16
    SolutionNameMin: Cijk_Ailk_Bjlk_S_MX_B_Bias_HA_S_SAV_UserArgs_MT64x16x32_MI16x16x1_SN_LDSB1_AFC1_AFEM1_AFEM1_ASEM1_CLR1_CADS0_DTVA0_DTVB0_EPS0_FDSI0_GRPM1_GRVWA4_GRVWB1_GSUn1_GSUAMBSK_GSUC1_GSUWGMRR1_GLS0_ISA942_IU1_K1_LBSPPA512_LBSPPB128_LBSPPM0_LPA16_LPB16_LPM0_LRVW2_LWPMn1_MIAV0_MIWT1_1_MO40_NTn1_NTA0_NTB0_NTC0_NTD4_NTM0_NEPBS8_NLCA1_NLCB1_ONLL1_PGR2_PLR1_PKA1_SIA3_SS1_SU0_SUM1_SUS0_SPO0_SRVW0_SSO0_SVW1_SK0_SKXCCM0_TLDS0_ULSGRO0_USL1_UIOFGRO0_USFGROn1_VSn1_VWA1_VWB1_WSGRA0_WSGRB0_WS64_WG64_4_1_WGM1_WGMXCC4_WGMXCCGn1
    SolutionIndex: 17
    SolutionNameMin: Cijk_Ailk_Bjlk_S_MX_B_Bias_HA_S_SAV_UserArgs_MT128x16x32_MI16x16x1_SN_LDSB1_AFC1_AFEM1_AFEM1_ASEM1_CLR1_CADS0_DTVA0_DTVB0_EPS0_FDSI0_GRPM1_GRVWA4_GRVWB1_GSUn1_GSUAMBSK_GSUC1_GSUWGMRR1_GLS0_ISA942_IU1_K1_LBSPPA1024_LBSPPB128_LBSPPM0_LPA0_LPB16_LPM0_LRVW2_LWPMn1_MIAV0_MIWT2_1_MO40_NTn1_NTA0_NTB0_NTC0_NTD4_NTM0_NEPBS8_NLCA1_NLCB1_ONLL1_PGR2_PLR1_PKA1_SIA3_SS1_SU0_SUM1_SUS0_SPO0_SRVW0_SSO0_SVW2_SK0_SKXCCM0_TLDS0_ULSGRO0_USL1_UIOFGRO0_USFGROn1_VSn1_VWA2_VWB1_WSGRA0_WSGRB0_WS64_WG64_4_1_WGM1_WGMXCC4_WGMXCCGn1
    SolutionIndex: 18
    SolutionNameMin: Cijk_Ailk_Bjlk_S_MX_B_Bias_HA_S_SAV_UserArgs_MT192x16x32_MI16x16x1_SN_LDSB1_AFC1_AFEM1_AFEM1_ASEM1_CLR1_CADS0_DTVA0_DTVB0_EPS0_FDSI0_GRPM1_GRVWA4_GRVWB1_GSUn1_GSUAMBSK_GSUC1_GSUWGMRR1_GLS0_ISA942_IU1_K1_LBSPPA1536_LBSPPB128_LBSPPM0_LPA16_LPB16_LPM0_LRVW2_LWPMn1_MIAV0_MIWT3_1_MO40_NTn1_NTA0_NTB0_NTC0_NTD4_NTM0_NEPBS6_NLCA1_NLCB1_ONLL1_PGR2_PLR1_PKA1_SIA3_SS1_SU0_SUM1_SUS0_SPO0_SRVW0_SSO0_SVW1_SK0_SKXCCM0_TLDS0_ULSGRO0_USL1_UIOFGRO0_USFGROn1_VSn1_VWA1_VWB1_WSGRA0_WSGRB0_WS64_WG64_4_1_WGM1_WGMXCC4_WGMXCCGn1
    SolutionIndex: 19
    SolutionNameMin: Cijk_Ailk_Bjlk_S_MX_B_Bias_HA_S_SAV_UserArgs_MT320x16x32_MI16x16x1_SN_LDSB1_AFC1_AFEM1_AFEM1_ASEM1_CLR1_CADS0_DTVA0_DTVB0_EPS0_FDSI0_GRPM1_GRVWA4_GRVWB1_GSUn1_GSUAMBSK_GSUC1_GSUWGMRR1_GLS0_ISA942_IU1_K1_LBSPPA2560_LBSPPB128_LBSPPM0_LPA16_LPB16_LPM0_LRVW2_LWPMn1_MIAV0_MIWT5_1_MO40_NTn1_NTA0_NTB0_NTC0_NTD4_NTM0_NEPBS5_NLCA1_NLCB1_ONLL1_PGR2_PLR1_PKA1_SIA3_SS1_SU0_SUM1_SUS0_SPO0_SRVW0_SSO0_SVW1_SK0_SKXCCM0_TLDS0_ULSGRO0_USL1_UIOFGRO0_USFGROn1_VSn1_VWA1_VWB1_WSGRA0_WSGRB0_WS64_WG64_4_1_WGM1_WGMXCC4_WGMXCCGn1
    SolutionIndex: 20
    SolutionNameMin: Cijk_Ailk_Bjlk_S_MX_B_Bias_HA_S_SAV_UserArgs_MT448x16x32_MI16x16x1_SN_LDSB1_AFC1_AFEM1_AFEM1_ASEM1_CLR1_CADS0_DTVA0_DTVB0_EPS0_FDSI0_GRPM1_GRVWA4_GRVWB1_GSUn1_GSUAMBSK_GSUC1_GSUWGMRR1_GLS0_ISA942_IU1_K1_LBSPPA3584_LBSPPB128_LBSPPM0_LPA16_LPB16_LPM0_LRVW2_LWPMn1_MIAV0_MIWT7_1_MO40_NTn1_NTA0_NTB0_NTC0_NTD4_NTM0_NEPBS7_NLCA1_NLCB1_ONLL1_PGR2_PLR1_PKA1_SIA3_SS1_SU0_SUM1_SUS0_SPO0_SRVW0_SSO0_SVW1_SK0_SKXCCM0_TLDS0_ULSGRO0_USL1_UIOFGRO0_USFGROn1_VSn1_VWA1_VWB1_WSGRA0_WSGRB0_WS64_WG64_4_1_WGM1_WGMXCC4_WGMXCCGn1
    SolutionIndex: 21
    SolutionNameMin: Cijk_Ailk_Bjlk_S_MX_B_Bias_HA_S_SAV_UserArgs_MT16x16x64_MI16x16x1_SN_LDSB0_AFC1_AFEM1_AFEM1_ASEM1_CLR1_CADS0_DTVA0_DTVB0_EPS0_FDSI0_GRPM1_GRVWA1_GRVWB4_GSUn1_GSUAMBSK_GSUC1_GSUWGMRR1_GLS0_ISA942_IU1_K1_LBSPPA128_LBSPPB128_LBSPPM0_LPA16_LPB16_LPM0_LRVW2_LWPMn1_MIAV0_MIWT1_1_MO40_NTn1_NTA0_NTB0_NTC0_NTD4_NTM0_NEPBS8_NLCA1_NLCB1_ONLL1_PGR2_PLR1_PKA1_SIA3_SS1_SU0_SUM1_SUS0_SPO0_SRVW0_SSO0_SVW1_SK0_SKXCCM0_TLDS0_ULSGRO0_USL1_UIOFGRO0_USFGROn1_VSn1_VWA1_VWB1_WSGRA0_WSGRB0_WS64_WG16_4_4_WGM1_WGMXCC4_WGMXCCGn1
    SolutionIndex: 22
    SolutionNameMin: Cijk_Ailk_Bjlk_S_MX_B_Bias_HA_S_SAV_UserArgs_MT16x16x128_MI16x16x1_SN_LDSB0_AFC1_AFEM1_AFEM1_ASEM1_CLR1_CADS0_DTVA0_DTVB0_EPS0_FDSI0_GRPM1_GRVWA1_GRVWB4_GSUn1_GSUAMBSK_GSUC1_GSUWGMRR1_GLS0_ISA942_IU1_K1_LBSPPA128_LBSPPB128_LBSPPM0_LPA16_LPB16_LPM0_LRVW2_LWPMn1_MIAV0_MIWT1_1_MO40_NTn1_NTA0_NTB0_NTC0_NTD4_NTM0_NEPBS8_NLCA1_NLCB1_ONLL1_PGR2_PLR1_PKA1_SIA3_SS1_SU0_SUM1_SUS0_SPO0_SRVW0_SSO0_SVW1_SK0_SKXCCM0_TLDS0_ULSGRO0_USL1_UIOFGRO0_USFGROn1_VSn1_VWA1_VWB1_WSGRA0_WSGRB0_WS64_WG16_4_4_WGM1_WGMXCC4_WGMXCCGn1
    SolutionIndex: 23
    SolutionNameMin: Cijk_Ailk_Bjlk_S_MX_B_Bias_HA_S_SAV_UserArgs_MT16x16x256_MI16x16x1_SN_LDSB1_AFC1_AFEM1_AFEM1_ASEM1_CLR1_CADS0_DTVA0_DTVB0_EPS0_FDSI0_GRPM1_GRVWA4_GRVWB4_GSUn1_GSUAMBSK_GSUC1_GSUWGMRR1_GLS0_ISA942_IU1_K1_LBSPPA128_LBSPPB128_LBSPPM0_LPA16_LPB16_LPM0_LRVW2_LWPMn1_MIAV0_MIWT1_1_MO40_NTn1_NTA0_NTB0_NTC0_NTD4_NTM0_NEPBS8_NLCA1_NLCB1_ONLL1_PGR2_PLR1_PKA1_SIA3_SS1_SU0_SUM1_SUS0_SPO0_SRVW0_SSO0_SVW1_SK0_SKXCCM0_TLDS0_ULSGRO0_USL1_UIOFGRO0_USFGROn1_VSn1_VWA1_VWB1_WSGRA0_WSGRB0_WS64_WG16_4_4_WGM1_WGMXCC4_WGMXCCGn1
    SolutionIndex: 24
    SolutionNameMin: Cijk_Ailk_Bjlk_S_MX_B_Bias_HA_S_SAV_UserArgs_MT16x16x128_MI16x16x1_SN_LDSB1_AFC1_AFEM1_AFEM1_ASEM1_CLR1_CADS0_DTVA0_DTVB0_EPS0_FDSI0_GRPM1_GRVWA4_GRVWB4_GSUn1_GSUAMBSK_GSUC1_GSUWGMRR1_GLS0_ISA942_IU1_K1_LBSPPA128_LBSPPB128_LBSPPM0_LPA16_LPB16_LPM0_LRVW2_LWPMn1_MIAV0_MIWT1_1_MO40_NTn1_NTA0_NTB0_NTC0_NTD4_NTM0_NEPBS8_NLCA1_NLCB1_ONLL1_PGR2_PLR1_PKA1_SIA3_SS1_SU0_SUM1_SUS0_SPO0_SRVW0_SSO0_SVW1_SK0_SKXCCM0_TLDS0_ULSGRO0_USL1_UIOFGRO0_USFGROn1_VSn1_VWA1_VWB1_WSGRA0_WSGRB0_WS64_WG16_4_4_WGM1_WGMXCC4_WGMXCCGn1
    SolutionIndex: 25
    SolutionNameMin: Cijk_Ailk_Bjlk_S_MX_B_Bias_HA_S_SAV_UserArgs_MT16x16x128_MI16x16x1_SN_LDSB0_AFC1_AFEM1_AFEM1_ASEM1_CLR1_CADS0_DTVA0_DTVB0_EPS0_FDSI0_GRPM1_GRVWA4_GRVWB4_GSUn1_GSUAMBSK_GSUC1_GSUWGMRR1_GLS0_ISA942_IU1_K1_LBSPPA128_LBSPPB128_LBSPPM0_LPA16_LPB16_LPM0_LRVW2_LWPMn1_MIAV0_MIWT1_1_MO40_NTn1_NTA0_NTB0_NTC0_NTD4_NTM0_NEPBS8_NLCA1_NLCB1_ONLL1_PGR2_PLR1_PKA1_SIA3_SS1_SU0_SUM1_SUS0_SPO0_SRVW0_SSO0_SVW1_SK0_SKXCCM0_TLDS0_ULSGRO0_USL1_UIOFGRO0_USFGROn1_VSn1_VWA1_VWB1_WSGRA0_WSGRB0_WS64_WG16_4_2_WGM1_WGMXCC4_WGMXCCGn1
    SolutionIndex: 26
    SolutionNameMin: Cijk_Ailk_Bjlk_S_MX_B_Bias_HA_S_SAV_UserArgs_MT32x16x128_MI16x16x1_SN_LDSB0_AFC1_AFEM1_AFEM1_ASEM1_CLR1_CADS0_DTVA0_DTVB0_EPS0_FDSI0_GRPM1_GRVWA4_GRVWB4_GSUn1_GSUAMBSK_GSUC1_GSUWGMRR1_GLS0_ISA942_IU1_K1_LBSPPA256_LBSPPB128_LBSPPM0_LPA16_LPB16_LPM0_LRVW2_LWPMn1_MIAV0_MIWT1_1_MO40_NTn1_NTA0_NTB0_NTC0_NTD4_NTM0_NEPBS8_NLCA1_NLCB1_ONLL1_PGR2_PLR1_PKA1_SIA3_SS1_SU0_SUM1_SUS0_SPO0_SRVW0_SSO0_SVW1_SK0_SKXCCM0_TLDS0_ULSGRO0_USL1_UIOFGRO0_USFGROn1_VSn1_VWA1_VWB1_WSGRA0_WSGRB0_WS64_WG32_4_2_WGM1_WGMXCC4_WGMXCCGn1
    SolutionIndex: 27
    SolutionNameMin: Cijk_Ailk_Bjlk_S_MX_B_Bias_HA_S_SAV_UserArgs_MT32x16x128_MI16x16x1_SN_LDSB1_AFC1_AFEM1_AFEM1_ASEM1_CLR1_CADS0_DTVA0_DTVB0_EPS0_FDSI0_GRPM1_GRVWA4_GRVWB4_GSUn1_GSUAMBSK_GSUC1_GSUWGMRR1_GLS0_ISA942_IU1_K1_LBSPPA256_LBSPPB128_LBSPPM0_LPA16_LPB16_LPM0_LRVW2_LWPMn1_MIAV0_MIWT1_1_MO40_NTn1_NTA0_NTB0_NTC0_NTD4_NTM0_NEPBS8_NLCA1_NLCB1_ONLL1_PGR2_PLR1_PKA1_SIA3_SS1_SU0_SUM1_SUS0_SPO0_SRVW0_SSO0_SVW1_SK0_SKXCCM0_TLDS0_ULSGRO0_USL1_UIOFGRO0_USFGROn1_VSn1_VWA1_VWB1_WSGRA0_WSGRB0_WS64_WG32_4_2_WGM1_WGMXCC4_WGMXCCGn1
    SolutionIndex: 28
    SolutionNameMin: Cijk_Ailk_Bjlk_S_MX_B_Bias_HA_S_SAV_UserArgs_MT32x16x32_MI16x16x1_SN_LDSB1_AFC1_AFEM1_AFEM1_ASEM1_CLR1_CADS0_DTVA0_DTVB0_EPS0_FDSI0_GRPM1_GRVWA4_GRVWB4_GSUn1_GSUAMBSK_GSUC1_GSUWGMRR1_GLS0_ISA942_IU1_K1_LBSPPA256_LBSPPB128_LBSPPM0_LPA16_LPB16_LPM0_LRVW2_LWPMn1_MIAV0_MIWT1_1_MO40_NTn1_NTA0_NTB0_NTC0_NTD4_NTM0_NEPBS8_NLCA1_NLCB1_ONLL1_PGR2_PLR1_PKA1_SIA3_SS1_SU0_SUM1_SUS0_SPO0_SRVW0_SSO0_SVW1_SK0_SKXCCM0_TLDS0_ULSGRO0_USL1_UIOFGRO0_USFGROn1_VSn1_VWA1_VWB1_WSGRA0_WSGRB0_WS64_WG32_4_1_WGM1_WGMXCC4_WGMXCCGn1
    SolutionIndex: 29
    SolutionNameMin: Cijk_Ailk_Bjlk_S_MX_B_Bias_HA_S_SAV_UserArgs_MT32x16x64_MI16x16x1_SN_LDSB1_AFC1_AFEM1_AFEM1_ASEM1_CLR1_CADS0_DTVA0_DTVB0_EPS0_FDSI0_GRPM1_GRVWA4_GRVWB4_GSUn1_GSUAMBSK_GSUC1_GSUWGMRR1_GLS0_ISA942_IU1_K1_LBSPPA256_LBSPPB128_LBSPPM0_LPA16_LPB16_LPM0_LRVW2_LWPMn1_MIAV0_MIWT1_1_MO40_NTn1_NTA0_NTB0_NTC0_NTD4_NTM0_NEPBS8_NLCA1_NLCB1_ONLL1_PGR2_PLR1_PKA1_SIA3_SS1_SU0_SUM1_SUS0_SPO0_SRVW0_SSO0_SVW1_SK0_SKXCCM0_TLDS0_ULSGRO0_USL1_UIOFGRO0_USFGROn1_VSn1_VWA1_VWB1_WSGRA0_WSGRB0_WS64_WG32_4_1_WGM1_WGMXCC4_WGMXCCGn1
    SolutionIndex: 30
    SolutionNameMin: Cijk_Ailk_Bjlk_S_MX_B_Bias_HA_S_SAV_UserArgs_MT64x16x64_MI16x16x1_SN_LDSB0_AFC1_AFEM1_AFEM1_ASEM1_CLR1_CADS0_DTVA0_DTVB0_EPS0_FDSI0_GRPM1_GRVWA4_GRVWB4_GSUn1_GSUAMBSK_GSUC1_GSUWGMRR1_GLS0_ISA942_IU1_K1_LBSPPA512_LBSPPB128_LBSPPM0_LPA16_LPB16_LPM0_LRVW2_LWPMn1_MIAV0_MIWT1_1_MO40_NTn1_NTA0_NTB0_NTC0_NTD4_NTM0_NEPBS8_NLCA1_NLCB1_ONLL1_PGR2_PLR1_PKA1_SIA3_SS1_SU0_SUM1_SUS0_SPO0_SRVW0_SSO0_SVW1_SK0_SKXCCM0_TLDS0_ULSGRO0_USL1_UIOFGRO0_USFGROn1_VSn1_VWA1_VWB1_WSGRA0_WSGRB0_WS64_WG64_4_1_WGM1_WGMXCC4_WGMXCCGn1
    SolutionIndex: 31
    SolutionNameMin: Cijk_Ailk_Bjlk_S_MX_B_Bias_HA_S_SAV_UserArgs_MT64x16x128_MI16x16x1_SN_LDSB1_AFC1_AFEM1_AFEM1_ASEM1_CLR1_CADS0_DTVA0_DTVB0_EPS0_FDSI0_GRPM1_GRVWA4_GRVWB4_GSUn1_GSUAMBSK_GSUC1_GSUWGMRR1_GLS0_ISA942_IU1_K1_LBSPPA512_LBSPPB128_LBSPPM0_LPA16_LPB16_LPM0_LRVW2_LWPMn1_MIAV0_MIWT1_1_MO40_NTn1_NTA0_NTB0_NTC0_NTD4_NTM0_NEPBS8_NLCA1_NLCB1_ONLL1_PGR2_PLR1_PKA1_SIA3_SS1_SU0_SUM1_SUS0_SPO0_SRVW0_SSO0_SVW1_SK0_SKXCCM0_TLDS0_ULSGRO0_USL1_UIOFGRO0_USFGROn1_VSn1_VWA1_VWB1_WSGRA0_WSGRB0_WS64_WG64_4_1_WGM1_WGMXCC4_WGMXCCGn1
    SolutionIndex: 32
    SolutionNameMin: Cijk_Ailk_Bjlk_S_MX_B_Bias_HA_S_SAV_UserArgs_MT32x16x32_MI16x16x1_SN_LDSB0_AFC1_AFEM1_AFEM1_ASEM1_CLR1_CADS0_DTVA0_DTVB0_EPS0_FDSI0_GRPM1_GRVWA4_GRVWB4_GSUn1_GSUAMBSK_GSUC1_GSUWGMRR1_GLS0_ISA942_IU1_K1_LBSPPA256_LBSPPB128_LBSPPM0_LPA16_LPB16_LPM0_LRVW2_LWPMn1_MIAV0_MIWT1_1_MO40_NTn1_NTA0_NTB0_NTC0_NTD4_NTM0_NEPBS8_NLCA1_NLCB1_ONLL1_PGR2_PLR1_PKA1_SIA3_SS1_SU0_SUM1_SUS0_SPO0_SRVW0_SSO0_SVW1_SK0_SKXCCM0_TLDS0_ULSGRO0_USL1_UIOFGRO0_USFGROn1_VSn1_VWA1_VWB1_WSGRA0_WSGRB0_WS64_WG32_4_1_WGM1_WGMXCC4_WGMXCCGn1
    SolutionIndex: 33
    SolutionNameMin: Cijk_Ailk_Bjlk_S_MX_B_Bias_HA_S_SAV_UserArgs_MT128x16x64_MI16x16x1_SN_LDSB1_AFC1_AFEM1_AFEM1_ASEM1_CLR1_CADS0_DTVA0_DTVB0_EPS0_FDSI0_GRPM1_GRVWA4_GRVWB4_GSUn1_GSUAMBSK_GSUC1_GSUWGMRR1_GLS0_ISA942_IU1_K1_LBSPPA1024_LBSPPB128_LBSPPM0_LPA0_LPB16_LPM0_LRVW2_LWPMn1_MIAV0_MIWT2_1_MO40_NTn1_NTA0_NTB0_NTC0_NTD4_NTM0_NEPBS8_NLCA1_NLCB1_ONLL1_PGR2_PLR1_PKA1_SIA3_SS1_SU0_SUM1_SUS0_SPO0_SRVW0_SSO0_SVW2_SK0_SKXCCM0_TLDS0_ULSGRO0_USL1_UIOFGRO0_USFGROn1_VSn1_VWA2_VWB1_WSGRA0_WSGRB0_WS64_WG64_4_1_WGM1_WGMXCC4_WGMXCCGn1
    SolutionIndex: 34
    SolutionNameMin: Cijk_Ailk_Bjlk_S_MX_B_Bias_HA_S_SAV_UserArgs_MT64x16x64_MI16x16x1_SN_LDSB1_AFC1_AFEM1_AFEM1_ASEM1_CLR1_CADS0_DTVA0_DTVB0_EPS0_FDSI0_GRPM1_GRVWA4_GRVWB4_GSUn1_GSUAMBSK_GSUC1_GSUWGMRR1_GLS0_ISA942_IU1_K1_LBSPPA512_LBSPPB128_LBSPPM0_LPA16_LPB16_LPM0_LRVW2_LWPMn1_MIAV0_MIWT1_1_MO40_NTn1_NTA0_NTB0_NTC0_NTD4_NTM0_NEPBS8_NLCA1_NLCB1_ONLL1_PGR2_PLR1_PKA1_SIA3_SS1_SU0_SUM1_SUS0_SPO0_SRVW0_SSO0_SVW1_SK0_SKXCCM0_TLDS0_ULSGRO0_USL1_UIOFGRO0_USFGROn1_VSn1_VWA1_VWB1_WSGRA0_WSGRB0_WS64_WG64_4_1_WGM1_WGMXCC4_WGMXCCGn1
    SolutionIndex: 35
    SolutionNameMin: Cijk_Ailk_Bjlk_S_MX_B_Bias_HA_S_SAV_UserArgs_MT192x16x64_MI16x16x1_SN_LDSB1_AFC1_AFEM1_AFEM1_ASEM1_CLR1_CADS0_DTVA0_DTVB0_EPS0_FDSI0_GRPM1_GRVWA4_GRVWB4_GSUn1_GSUAMBSK_GSUC1_GSUWGMRR1_GLS0_ISA942_IU1_K1_LBSPPA1536_LBSPPB128_LBSPPM0_LPA16_LPB16_LPM0_LRVW2_LWPMn1_MIAV0_MIWT3_1_MO40_NTn1_NTA0_NTB0_NTC0_NTD4_NTM0_NEPBS6_NLCA1_NLCB1_ONLL1_PGR2_PLR1_PKA1_SIA3_SS1_SU0_SUM1_SUS0_SPO0_SRVW0_SSO0_SVW1_SK0_SKXCCM0_TLDS0_ULSGRO0_USL1_UIOFGRO0_USFGROn1_VSn1_VWA1_VWB1_WSGRA0_WSGRB0_WS64_WG64_4_1_WGM1_WGMXCC4_WGMXCCGn1
    SolutionIndex: 36
    SolutionNameMin: Cijk_Ailk_Bjlk_S_MX_B_Bias_HA_S_SAV_UserArgs_MT16x16x128_MI16x16x1_SN_LDSB1_AFC1_AFEM1_AFEM1_ASEM1_CLR1_CADS0_DTVA0_DTVB0_EPS0_FDSI0_GRPM1_GRVWA4_GRVWB4_GSUn1_GSUAMBSK_GSUC1_GSUWGMRR1_GLS0_ISA942_IU1_K1_LBSPPA128_LBSPPB128_LBSPPM0_LPA16_LPB16_LPM0_LRVW2_LWPMn1_MIAV0_MIWT1_1_MO40_NTn1_NTA0_NTB0_NTC0_NTD4_NTM0_NEPBS8_NLCA1_NLCB1_ONLL1_PGR2_PLR1_PKA1_SIA3_SS1_SU0_SUM1_SUS0_SPO0_SRVW0_SSO0_SVW1_SK0_SKXCCM0_TLDS0_ULSGRO0_USL1_UIOFGRO0_USFGROn1_VSn1_VWA1_VWB1_WSGRA0_WSGRB0_WS64_WG16_4_2_WGM1_WGMXCC4_WGMXCCGn1
    SolutionIndex: 37
    SolutionNameMin: Cijk_Ailk_Bjlk_S_MX_B_Bias_HA_S_SAV_UserArgs_MT16x16x64_MI16x16x1_SN_LDSB1_AFC1_AFEM1_AFEM1_ASEM1_CLR1_CADS0_DTVA0_DTVB0_EPS0_FDSI0_GRPM1_GRVWA1_GRVWB4_GSUn1_GSUAMBSK_GSUC1_GSUWGMRR1_GLS0_ISA942_IU1_K1_LBSPPA128_LBSPPB128_LBSPPM0_LPA16_LPB16_LPM0_LRVW2_LWPMn1_MIAV0_MIWT1_1_MO40_NTn1_NTA0_NTB0_NTC0_NTD4_NTM0_NEPBS8_NLCA1_NLCB1_ONLL1_PGR2_PLR1_PKA1_SIA3_SS1_SU0_SUM1_SUS0_SPO0_SRVW0_SSO0_SVW1_SK0_SKXCCM0_TLDS0_ULSGRO0_USL1_UIOFGRO0_USFGROn1_VSn1_VWA1_VWB1_WSGRA0_WSGRB0_WS64_WG16_4_4_WGM1_WGMXCC4_WGMXCCGn1
    SolutionIndex: 38
    SolutionNameMin: Cijk_Ailk_Bjlk_S_MX_B_Bias_HA_S_SAV_UserArgs_MT16x32x128_MI16x16x1_SN_LDSB0_AFC1_AFEM1_AFEM1_ASEM1_CLR1_CADS0_DTVA0_DTVB0_EPS0_FDSI0_GRPM1_GRVWA4_GRVWB4_GSUn1_GSUAMBSK_GSUC1_GSUWGMRR1_GLS0_ISA942_IU1_K1_LBSPPA128_LBSPPB256_LBSPPM0_LPA16_LPB16_LPM0_LRVW2_LWPMn1_MIAV0_MIWT1_1_MO40_NTn1_NTA0_NTB0_NTC0_NTD4_NTM0_NEPBS8_NLCA1_NLCB1_ONLL1_PGR2_PLR1_PKA1_SIA3_SS1_SU0_SUM1_SUS0_SPO0_SRVW0_SSO0_SVW1_SK0_SKXCCM0_TLDS0_ULSGRO0_USL1_UIOFGRO0_USFGROn1_VSn1_VWA1_VWB1_WSGRA0_WSGRB0_WS64_WG16_8_2_WGM1_WGMXCC4_WGMXCCGn1
    SolutionIndex: 39
    SolutionNameMin: Cijk_Ailk_Bjlk_S_MX_B_Bias_HA_S_SAV_UserArgs_MT16x32x64_MI16x16x1_SN_LDSB0_AFC1_AFEM1_AFEM1_ASEM1_CLR1_CADS0_DTVA0_DTVB0_EPS0_FDSI0_GRPM1_GRVWA4_GRVWB4_GSUn1_GSUAMBSK_GSUC1_GSUWGMRR1_GLS0_ISA942_IU1_K1_LBSPPA128_LBSPPB256_LBSPPM0_LPA16_LPB16_LPM0_LRVW2_LWPMn1_MIAV0_MIWT1_1_MO40_NTn1_NTA0_NTB0_NTC0_NTD4_NTM0_NEPBS8_NLCA1_NLCB1_ONLL1_PGR2_PLR1_PKA1_SIA3_SS1_SU0_SUM1_SUS0_SPO0_SRVW0_SSO0_SVW1_SK0_SKXCCM0_TLDS0_ULSGRO0_USL1_UIOFGRO0_USFGROn1_VSn1_VWA1_VWB1_WSGRA0_WSGRB0_WS64_WG16_8_1_WGM1_WGMXCC4_WGMXCCGn1
    SolutionIndex: 40
    SolutionNameMin: Cijk_Ailk_Bjlk_S_MX_B_Bias_HA_S_SAV_UserArgs_MT32x32x64_MI16x16x1_SN_LDSB0_AFC1_AFEM1_AFEM1_ASEM1_CLR1_CADS0_DTVA0_DTVB0_EPS0_FDSI0_GRPM1_GRVWA4_GRVWB4_GSUn1_GSUAMBSK_GSUC1_GSUWGMRR1_GLS0_ISA942_IU1_K1_LBSPPA256_LBSPPB256_LBSPPM0_LPA16_LPB16_LPM0_LRVW2_LWPMn1_MIAV0_MIWT1_1_MO40_NTn1_NTA0_NTB0_NTC0_NTD4_NTM0_NEPBS8_NLCA1_NLCB1_ONLL1_PGR2_PLR1_PKA1_SIA3_SS1_SU0_SUM1_SUS0_SPO0_SRVW0_SSO0_SVW1_SK0_SKXCCM0_TLDS0_ULSGRO0_USL1_UIOFGRO0_USFGROn1_VSn1_VWA1_VWB1_WSGRA0_WSGRB0_WS64_WG32_8_1_WGM1_WGMXCC4_WGMXCCGn1
    SolutionIndex: 41
    SolutionNameMin: Cijk_Ailk_Bjlk_S_MX_B_Bias_HA_S_SAV_UserArgs_MT32x32x128_MI16x16x1_SN_LDSB1_AFC1_AFEM1_AFEM1_ASEM1_CLR1_CADS0_DTVA0_DTVB0_EPS0_FDSI0_GRPM1_GRVWA4_GRVWB4_GSUn1_GSUAMBSK_GSUC1_GSUWGMRR1_GLS0_ISA942_IU1_K1_LBSPPA256_LBSPPB256_LBSPPM0_LPA16_LPB16_LPM0_LRVW2_LWPMn1_MIAV0_MIWT1_1_MO40_NTn1_NTA0_NTB0_NTC0_NTD4_NTM0_NEPBS8_NLCA1_NLCB1_ONLL1_PGR2_PLR1_PKA1_SIA3_SS1_SU0_SUM1_SUS0_SPO0_SRVW0_SSO0_SVW1_SK0_SKXCCM0_TLDS0_ULSGRO0_USL1_UIOFGRO0_USFGROn1_VSn1_VWA1_VWB1_WSGRA0_WSGRB0_WS64_WG32_8_1_WGM1_WGMXCC4_WGMXCCGn1
    SolutionIndex: 42
    SolutionNameMin: Cijk_Ailk_Bjlk_S_MX_B_Bias_HA_S_SAV_UserArgs_MT32x32x64_MI16x16x1_SN_LDSB1_AFC1_AFEM1_AFEM1_ASEM1_CLR1_CADS0_DTVA0_DTVB0_EPS0_FDSI0_GRPM1_GRVWA4_GRVWB4_GSUn1_GSUAMBSK_GSUC1_GSUWGMRR1_GLS0_ISA942_IU1_K1_LBSPPA256_LBSPPB256_LBSPPM0_LPA16_LPB16_LPM0_LRVW2_LWPMn1_MIAV0_MIWT1_1_MO40_NTn1_NTA0_NTB0_NTC0_NTD4_NTM0_NEPBS8_NLCA1_NLCB1_ONLL1_PGR2_PLR1_PKA1_SIA3_SS1_SU0_SUM1_SUS0_SPO0_SRVW0_SSO0_SVW1_SK0_SKXCCM0_TLDS0_ULSGRO0_USL1_UIOFGRO0_USFGROn1_VSn1_VWA1_VWB1_WSGRA0_WSGRB0_WS64_WG32_8_1_WGM1_WGMXCC4_WGMXCCGn1
    SolutionIndex: 43
    SolutionNameMin: Cijk_Ailk_Bjlk_S_MX_B_Bias_HA_S_SAV_UserArgs_MT64x32x128_MI32x32x1_SN_LDSB1_AFC1_AFEM1_AFEM1_ASEM1_CLR1_CADS0_DTVA0_DTVB0_EPS0_FDSI0_GRPM1_GRVWA4_GRVWB4_GSUn1_GSUAMBSK_GSUC1_GSUWGMRR1_GLS0_ISA942_IU1_K1_LBSPPA0_LBSPPB0_LBSPPM0_LPA0_LPB0_LPM0_LRVW2_LWPMn1_MIAV0_MIWT1_1_MO40_NTn1_NTA0_NTB0_NTC0_NTD4_NTM0_NEPBS8_NLCA1_NLCB1_ONLL1_PGR2_PLR1_PKA1_SIA3_SS1_SU0_SUM1_SUS0_SPO0_SRVW0_SSO0_SVW1_SK0_SKXCCM0_TLDS0_ULSGRO0_USL1_UIOFGRO0_USFGROn1_VSn1_VWA1_VWB1_WSGRA0_WSGRB0_WS64_WG64_2_2_WGM1_WGMXCC4_WGMXCCGn1
    SolutionIndex: 44
    SolutionNameMin: Cijk_Ailk_Bjlk_S_MX_B_Bias_HA_S_SAV_UserArgs_MT64x32x64_MI32x32x1_SN_LDSB0_AFC1_AFEM1_AFEM1_ASEM1_CLR1_CADS0_DTVA0_DTVB0_EPS0_FDSI0_GRPM1_GRVWA4_GRVWB4_GSUn1_GSUAMBSK_GSUC1_GSUWGMRR1_GLS0_ISA942_IU1_K1_LBSPPA0_LBSPPB0_LBSPPM0_LPA0_LPB0_LPM0_LRVW2_LWPMn1_MIAV0_MIWT1_1_MO40_NTn1_NTA0_NTB0_NTC0_NTD4_NTM0_NEPBS8_NLCA1_NLCB1_ONLL1_PGR2_PLR1_PKA1_SIA3_SS1_SU0_SUM1_SUS0_SPO0_SRVW0_SSO0_SVW1_SK0_SKXCCM0_TLDS0_ULSGRO0_USL1_UIOFGRO0_USFGROn1_VSn1_VWA1_VWB1_WSGRA0_WSGRB0_WS64_WG64_2_1_WGM1_WGMXCC4_WGMXCCGn1
    SolutionIndex: 45
    SolutionNameMin: Cijk_Ailk_Bjlk_S_MX_B_Bias_HA_S_SAV_UserArgs_MT128x32x64_MI32x32x1_SN_LDSB1_AFC1_AFEM1_AFEM1_ASEM1_CLR1_CADS0_DTVA0_DTVB0_EPS0_FDSI0_GRPM1_GRVWA4_GRVWB4_GSUn1_GSUAMBSK_GSUC1_GSUWGMRR1_GLS0_ISA942_IU1_K1_LBSPPA0_LBSPPB0_LBSPPM0_LPA0_LPB0_LPM0_LRVW2_LWPMn1_MIAV0_MIWT1_1_MO40_NTn1_NTA0_NTB0_NTC0_NTD4_NTM0_NEPBS8_NLCA1_NLCB1_ONLL1_PGR2_PLR1_PKA1_SIA3_SS1_SU0_SUM1_SUS0_SPO0_SRVW0_SSO0_SVW1_SK0_SKXCCM0_TLDS0_ULSGRO0_USL1_UIOFGRO0_USFGROn1_VSn1_VWA1_VWB1_WSGRA0_WSGRB0_WS64_WG128_2_1_WGM1_WGMXCC4_WGMXCCGn1
    SolutionIndex: 46
    SolutionNameMin: Cijk_Ailk_Bjlk_S_MX_B_Bias_HA_S_SAV_UserArgs_MT128x32x32_MI32x32x1_SN_LDSB1_AFC1_AFEM1_AFEM1_ASEM1_CLR1_CADS0_DTVA0_DTVB0_EPS0_FDSI0_GRPM1_GRVWA4_GRVWB4_GSUn1_GSUAMBSK_GSUC1_GSUWGMRR1_GLS0_ISA942_IU1_K1_LBSPPA0_LBSPPB0_LBSPPM0_LPA0_LPB0_LPM0_LRVW2_LWPMn1_MIAV0_MIWT1_1_MO40_NTn1_NTA0_NTB0_NTC0_NTD4_NTM0_NEPBS8_NLCA1_NLCB1_ONLL1_PGR2_PLR1_PKA1_SIA3_SS1_SU0_SUM1_SUS0_SPO0_SRVW0_SSO0_SVW1_SK0_SKXCCM0_TLDS0_ULSGRO0_USL1_UIOFGRO0_USFGROn1_VSn1_VWA1_VWB1_WSGRA0_WSGRB0_WS64_WG128_2_1_WGM1_WGMXCC4_WGMXCCGn1
    SolutionIndex: 47
    SolutionNameMin: Cijk_Ailk_Bjlk_S_MX_B_Bias_HA_S_SAV_UserArgs_MT32x32x128_MI32x32x1_SN_LDSB1_AFC1_AFEM1_AFEM1_ASEM1_CLR1_CADS0_DTVA0_DTVB0_EPS0_FDSI0_GRPM1_GRVWA4_GRVWB4_GSUn1_GSUAMBSK_GSUC1_GSUWGMRR1_GLS0_ISA942_IU1_K1_LBSPPA0_LBSPPB0_LBSPPM0_LPA0_LPB0_LPM0_LRVW2_LWPMn1_MIAV0_MIWT1_1_MO40_NTn1_NTA0_NTB0_NTC0_NTD4_NTM0_NEPBS8_NLCA1_NLCB1_ONLL1_PGR2_PLR1_PKA1_SIA3_SS1_SU0_SUM1_SUS0_SPO0_SRVW0_SSO0_SVW1_SK0_SKXCCM0_TLDS0_ULSGRO0_USL1_UIOFGRO0_USFGROn1_VSn1_VWA1_VWB1_WSGRA0_WSGRB0_WS64_WG32_2_4_WGM1_WGMXCC4_WGMXCCGn1
    SolutionIndex: 48
    SolutionNameMin: Cijk_Ailk_Bjlk_S_MX_B_Bias_HA_S_SAV_UserArgs_MT384x32x32_MI32x32x1_SN_LDSB1_AFC1_AFEM1_AFEM1_ASEM1_CLR1_CADS0_DTVA0_DTVB0_EPS0_FDSI0_GRPM1_GRVWA4_GRVWB4_GSUn1_GSUAMBSK_GSUC1_GSUWGMRR1_GLS0_ISA942_IU1_K1_LBSPPA0_LBSPPB0_LBSPPM0_LPA0_LPB0_LPM0_LRVW2_LWPMn1_MIAV0_MIWT3_1_MO40_NTn1_NTA0_NTB0_NTC0_NTD4_NTM0_NEPBS6_NLCA1_NLCB1_ONLL1_PGR2_PLR1_PKA1_SIA3_SS1_SU0_SUM1_SUS0_SPO0_SRVW0_SSO0_SVW1_SK0_SKXCCM0_TLDS0_ULSGRO0_USL1_UIOFGRO0_USFGROn1_VSn1_VWA1_VWB1_WSGRA0_WSGRB0_WS64_WG128_2_1_WGM1_WGMXCC4_WGMXCCGn1
    SolutionIndex: 49
    SolutionNameMin: Cijk_Ailk_Bjlk_S_MX_B_Bias_HA_S_SAV_UserArgs_MT160x32x32_MI16x16x1_SN_LDSB1_AFC1_AFEM1_AFEM1_ASEM1_CLR1_CADS0_DTVA0_DTVB0_EPS0_FDSI0_GRPM1_GRVWA4_GRVWB4_GSUn1_GSUAMBSK_GSUC1_GSUWGMRR1_GLS0_ISA942_IU1_K1_LBSPPA1280_LBSPPB256_LBSPPM0_LPA16_LPB16_LPM0_LRVW2_LWPMn1_MIAV0_MIWT5_1_MO40_NTn1_NTA0_NTB0_NTC0_NTD4_NTM0_NEPBS5_NLCA1_NLCB1_ONLL1_PGR2_PLR1_PKA1_SIA3_SS1_SU0_SUM1_SUS0_SPO0_SRVW0_SSO0_SVW1_SK0_SKXCCM0_TLDS0_ULSGRO0_USL1_UIOFGRO0_USFGROn1_VSn1_VWA1_VWB1_WSGRA0_WSGRB0_WS64_WG32_8_1_WGM1_WGMXCC4_WGMXCCGn1
    SolutionIndex: 50
    SolutionNameMin: Cijk_Ailk_Bjlk_S_MX_B_Bias_HA_S_SAV_UserArgs_MT256x32x32_MI32x32x1_SN_LDSB1_AFC1_AFEM1_AFEM1_ASEM1_CLR1_CADS0_DTVA0_DTVB0_EPS0_FDSI0_GRPM1_GRVWA4_GRVWB4_GSUn1_GSUAMBSK_GSUC1_GSUWGMRR1_GLS0_ISA942_IU1_K1_LBSPPA0_LBSPPB0_LBSPPM0_LPA0_LPB0_LPM0_LRVW2_LWPMn1_MIAV0_MIWT2_1_MO40_NTn1_NTA0_NTB0_NTC0_NTD4_NTM0_NEPBS8_NLCA1_NLCB1_ONLL1_PGR2_PLR1_PKA1_SIA3_SS1_SU0_SUM1_SUS0_SPO0_SRVW0_SSO0_SVW2_SK0_SKXCCM0_TLDS0_ULSGRO0_USL1_UIOFGRO0_USFGROn1_VSn1_VWA2_VWB1_WSGRA0_WSGRB0_WS64_WG128_2_1_WGM1_WGMXCC4_WGMXCCGn1
    SolutionIndex: 51
    SolutionNameMin: Cijk_Ailk_Bjlk_S_MX_B_Bias_HA_S_SAV_UserArgs_MT320x32x32_MI16x16x1_SN_LDSB1_AFC1_AFEM1_AFEM1_ASEM1_CLR1_CADS0_DTVA0_DTVB0_EPS0_FDSI0_GRPM1_GRVWA4_GRVWB4_GSUn1_GSUAMBSK_GSUC1_GSUWGMRR1_GLS0_ISA942_IU1_K1_LBSPPA2560_LBSPPB256_LBSPPM0_LPA16_LPB0_LPM0_LRVW2_LWPMn1_MIAV0_MIWT5_2_MO40_NTn1_NTA0_NTB0_NTC0_NTD4_NTM0_NEPBS5_NLCA1_NLCB1_ONLL1_PGR2_PLR1_PKA1_SIA3_SS1_SU0_SUM1_SUS0_SPO0_SRVW0_SSO0_SVW1_SK0_SKXCCM0_TLDS0_ULSGRO0_USL1_UIOFGRO0_USFGROn1_VSn1_VWA1_VWB2_WSGRA0_WSGRB0_WS64_WG64_4_1_WGM1_WGMXCC4_WGMXCCGn1
    SolutionIndex: 52
    SolutionNameMin: Cijk_Ailk_Bjlk_S_MX_B_Bias_HA_S_SAV_UserArgs_MT448x32x32_MI16x16x1_SN_LDSB1_AFC1_AFEM1_AFEM1_ASEM1_CLR1_CADS0_DTVA0_DTVB0_EPS0_FDSI0_GRPM1_GRVWA4_GRVWB4_GSUn1_GSUAMBSK_GSUC1_GSUWGMRR1_GLS0_ISA942_IU1_K1_LBSPPA3584_LBSPPB256_LBSPPM0_LPA16_LPB0_LPM0_LRVW2_LWPMn1_MIAV0_MIWT7_2_MO40_NTn1_NTA0_NTB0_NTC0_NTD4_NTM0_NEPBS7_NLCA1_NLCB1_ONLL1_PGR2_PLR1_PKA1_SIA3_SS1_SU0_SUM1_SUS0_SPO0_SRVW0_SSO0_SVW1_SK0_SKXCCM0_TLDS0_ULSGRO0_USL1_UIOFGRO0_USFGROn1_VSn1_VWA1_VWB2_WSGRA0_WSGRB0_WS64_WG64_4_1_WGM1_WGMXCC4_WGMXCCGn1
    SolutionIndex: 53
    SolutionNameMin: Cijk_Ailk_Bjlk_S_MX_B_Bias_HA_S_SAV_UserArgs_MT16x16x64_MI16x16x1_SN_LDSB0_AFC1_AFEM1_AFEM1_ASEM1_CLR1_CADS0_DTVA0_DTVB0_EPS0_FDSI0_GRPM1_GRVWA1_GRVWB4_GSUn1_GSUAMBSK_GSUC1_GSUWGMRR1_GLS0_ISA942_IU1_K1_LBSPPA128_LBSPPB128_LBSPPM0_LPA16_LPB16_LPM0_LRVW2_LWPMn1_MIAV0_MIWT1_1_MO40_NTn1_NTA0_NTB0_NTC0_NTD4_NTM0_NEPBS8_NLCA1_NLCB1_ONLL1_PGR2_PLR1_PKA1_SIA3_SS1_SU0_SUM1_SUS0_SPO0_SRVW0_SSO0_SVW1_SK0_SKXCCM0_TLDS0_ULSGRO0_USL1_UIOFGRO0_USFGROn1_VSn1_VWA1_VWB1_WSGRA0_WSGRB0_WS64_WG16_4_2_WGM1_WGMXCC4_WGMXCCGn1
    SolutionIndex: 54
    SolutionNameMin: Cijk_Ailk_Bjlk_S_MX_B_Bias_HA_S_SAV_UserArgs_MT16x16x128_MI16x16x1_SN_LDSB1_AFC1_AFEM1_AFEM1_ASEM1_CLR1_CADS0_DTVA0_DTVB0_EPS0_FDSI0_GRPM1_GRVWA1_GRVWB4_GSUn1_GSUAMBSK_GSUC1_GSUWGMRR1_GLS0_ISA942_IU1_K1_LBSPPA128_LBSPPB128_LBSPPM0_LPA16_LPB16_LPM0_LRVW2_LWPMn1_MIAV0_MIWT1_1_MO40_NTn1_NTA0_NTB0_NTC0_NTD4_NTM0_NEPBS8_NLCA1_NLCB1_ONLL1_PGR2_PLR1_PKA1_SIA3_SS1_SU0_SUM1_SUS0_SPO0_SRVW0_SSO0_SVW1_SK0_SKXCCM0_TLDS0_ULSGRO0_USL1_UIOFGRO0_USFGROn1_VSn1_VWA1_VWB1_WSGRA0_WSGRB0_WS64_WG16_4_2_WGM1_WGMXCC4_WGMXCCGn1
    SolutionIndex: 55
    SolutionNameMin: Cijk_Ailk_Bjlk_S_MX_B_Bias_HA_S_SAV_UserArgs_MT16x32x128_MI16x16x1_SN_LDSB0_AFC1_AFEM1_AFEM1_ASEM1_CLR1_CADS0_DTVA0_DTVB0_EPS0_FDSI0_GRPM1_GRVWA1_GRVWB4_GSUn1_GSUAMBSK_GSUC1_GSUWGMRR1_GLS0_ISA942_IU1_K1_LBSPPA128_LBSPPB256_LBSPPM0_LPA16_LPB16_LPM0_LRVW2_LWPMn1_MIAV0_MIWT1_1_MO40_NTn1_NTA0_NTB0_NTC0_NTD4_NTM0_NEPBS8_NLCA1_NLCB1_ONLL1_PGR2_PLR1_PKA1_SIA3_SS1_SU0_SUM1_SUS0_SPO0_SRVW0_SSO0_SVW1_SK0_SKXCCM0_TLDS0_ULSGRO0_USL1_UIOFGRO0_USFGROn1_VSn1_VWA1_VWB1_WSGRA0_WSGRB0_WS64_WG16_8_2_WGM1_WGMXCC4_WGMXCCGn1
    SolutionIndex: 56
    SolutionNameMin: Cijk_Ailk_Bjlk_S_MX_B_Bias_HA_S_SAV_UserArgs_MT16x32x128_MI16x16x1_SN_LDSB0_AFC1_AFEM1_AFEM1_ASEM1_CLR1_CADS0_DTVA0_DTVB0_EPS0_FDSI0_GRPM1_GRVWA4_GRVWB4_GSUn1_GSUAMBSK_GSUC1_GSUWGMRR1_GLS0_ISA942_IU1_K1_LBSPPA128_LBSPPB256_LBSPPM0_LPA16_LPB16_LPM0_LRVW2_LWPMn1_MIAV0_MIWT1_1_MO40_NTn1_NTA0_NTB0_NTC0_NTD4_NTM0_NEPBS8_NLCA1_NLCB1_ONLL1_PGR2_PLR1_PKA1_SIA3_SS1_SU0_SUM1_SUS0_SPO0_SRVW0_SSO0_SVW1_SK0_SKXCCM0_TLDS0_ULSGRO0_USL1_UIOFGRO0_USFGROn1_VSn1_VWA1_VWB1_WSGRA0_WSGRB0_WS64_WG16_8_1_WGM1_WGMXCC4_WGMXCCGn1
    SolutionIndex: 57
    SolutionNameMin: Cijk_Ailk_Bjlk_S_MX_B_Bias_HA_S_SAV_UserArgs_MT16x32x128_MI16x16x1_SN_LDSB1_AFC1_AFEM1_AFEM1_ASEM1_CLR1_CADS0_DTVA0_DTVB0_EPS0_FDSI0_GRPM1_GRVWA4_GRVWB4_GSUn1_GSUAMBSK_GSUC1_GSUWGMRR1_GLS0_ISA942_IU1_K1_LBSPPA128_LBSPPB256_LBSPPM0_LPA16_LPB16_LPM0_LRVW2_LWPMn1_MIAV0_MIWT1_1_MO40_NTn1_NTA0_NTB0_NTC0_NTD4_NTM0_NEPBS8_NLCA1_NLCB1_ONLL1_PGR2_PLR1_PKA1_SIA3_SS1_SU0_SUM1_SUS0_SPO0_SRVW0_SSO0_SVW1_SK0_SKXCCM0_TLDS0_ULSGRO0_USL1_UIOFGRO0_USFGROn1_VSn1_VWA1_VWB1_WSGRA0_WSGRB0_WS64_WG16_8_2_WGM1_WGMXCC4_WGMXCCGn1
    SolutionIndex: 58
    SolutionNameMin: Cijk_Ailk_Bjlk_S_MX_B_Bias_HA_S_SAV_UserArgs_MT32x64x128_MI32x32x1_SN_LDSB1_AFC1_AFEM1_AFEM1_ASEM1_CLR1_CADS0_DTVA0_DTVB0_EPS0_FDSI0_GRPM1_GRVWA4_GRVWB4_GSUn1_GSUAMBSK_GSUC1_GSUWGMRR1_GLS0_ISA942_IU1_K1_LBSPPA0_LBSPPB0_LBSPPM0_LPA0_LPB0_LPM0_LRVW2_LWPMn1_MIAV0_MIWT1_1_MO40_NTn1_NTA0_NTB0_NTC0_NTD4_NTM0_NEPBS8_NLCA1_NLCB1_ONLL1_PGR2_PLR1_PKA1_SIA3_SS1_SU0_SUM1_SUS0_SPO0_SRVW0_SSO0_SVW1_SK0_SKXCCM0_TLDS0_ULSGRO0_USL1_UIOFGRO0_USFGROn1_VSn1_VWA1_VWB1_WSGRA0_WSGRB0_WS64_WG32_4_2_WGM1_WGMXCC4_WGMXCCGn1
    SolutionIndex: 59
    SolutionNameMin: Cijk_Ailk_Bjlk_S_MX_B_Bias_HA_S_SAV_UserArgs_MT16x16x128_MI16x16x1_SN_LDSB0_AFC1_AFEM1_AFEM1_ASEM1_CLR1_CADS0_DTVA0_DTVB0_EPS0_FDSI0_GRPM1_GRVWA4_GRVWB4_GSUn1_GSUAMBSK_GSUC1_GSUWGMRR1_GLS0_ISA942_IU1_K1_LBSPPA128_LBSPPB128_LBSPPM0_LPA16_LPB16_LPM0_LRVW2_LWPMn1_MIAV0_MIWT1_1_MO40_NTn1_NTA0_NTB0_NTC0_NTD4_NTM0_NEPBS8_NLCA1_NLCB1_ONLL1_PGR2_PLR1_PKA1_SIA3_SS1_SU0_SUM1_SUS0_SPO0_SRVW0_SSO0_SVW1_SK0_SKXCCM0_TLDS0_ULSGRO0_USL1_UIOFGRO0_USFGROn1_VSn1_VWA1_VWB1_WSGRA0_WSGRB0_WS64_WG16_4_4_WGM1_WGMXCC4_WGMXCCGn1
    SolutionIndex: 60
    SolutionNameMin: Cijk_Ailk_Bjlk_S_MX_B_Bias_HA_S_SAV_UserArgs_MT32x64x64_MI32x32x1_SN_LDSB0_AFC1_AFEM1_AFEM1_ASEM1_CLR1_CADS0_DTVA0_DTVB0_EPS0_FDSI0_GRPM1_GRVWA4_GRVWB4_GSUn1_GSUAMBSK_GSUC1_GSUWGMRR1_GLS0_ISA942_IU1_K1_LBSPPA0_LBSPPB0_LBSPPM0_LPA0_LPB0_LPM0_LRVW2_LWPMn1_MIAV0_MIWT1_1_MO40_NTn1_NTA0_NTB0_NTC0_NTD4_NTM0_NEPBS8_NLCA1_NLCB1_ONLL1_PGR2_PLR1_PKA1_SIA3_SS1_SU0_SUM1_SUS0_SPO0_SRVW0_SSO0_SVW1_SK0_SKXCCM0_TLDS0_ULSGRO0_USL1_UIOFGRO0_USFGROn1_VSn1_VWA1_VWB1_WSGRA0_WSGRB0_WS64_WG32_4_2_WGM1_WGMXCC4_WGMXCCGn1
    SolutionIndex: 61
    SolutionNameMin: Cijk_Ailk_Bjlk_S_MX_B_Bias_HA_S_SAV_UserArgs_MT64x64x64_MI32x32x1_SN_LDSB1_AFC1_AFEM1_AFEM1_ASEM1_CLR1_CADS0_DTVA0_DTVB0_EPS0_FDSI0_GRPM1_GRVWA4_GRVWB4_GSUn1_GSUAMBSK_GSUC1_GSUWGMRR1_GLS0_ISA942_IU1_K1_LBSPPA0_LBSPPB0_LBSPPM0_LPA0_LPB0_LPM0_LRVW2_LWPMn1_MIAV0_MIWT1_1_MO40_NTn1_NTA0_NTB0_NTC0_NTD4_NTM0_NEPBS8_NLCA1_NLCB1_ONLL1_PGR2_PLR1_PKA1_SIA3_SS1_SU0_SUM1_SUS0_SPO0_SRVW0_SSO0_SVW1_SK0_SKXCCM0_TLDS0_ULSGRO0_USL1_UIOFGRO0_USFGROn1_VSn1_VWA1_VWB1_WSGRA0_WSGRB0_WS64_WG64_4_1_WGM1_WGMXCC4_WGMXCCGn1
    SolutionIndex: 62
    SolutionNameMin: Cijk_Ailk_Bjlk_S_MX_B_Bias_HA_S_SAV_UserArgs_MT128x32x32_MI32x32x1_SN_LDSB0_AFC1_AFEM1_AFEM1_ASEM1_CLR1_CADS0_DTVA0_DTVB0_EPS0_FDSI0_GRPM1_GRVWA4_GRVWB4_GSUn1_GSUAMBSK_GSUC1_GSUWGMRR1_GLS0_ISA942_IU1_K1_LBSPPA0_LBSPPB0_LBSPPM0_LPA0_LPB0_LPM0_LRVW2_LWPMn1_MIAV0_MIWT1_1_MO40_NTn1_NTA0_NTB0_NTC0_NTD4_NTM0_NEPBS8_NLCA1_NLCB1_ONLL1_PGR2_PLR1_PKA1_SIA3_SS1_SU0_SUM1_SUS0_SPO0_SRVW0_SSO0_SVW1_SK0_SKXCCM0_TLDS0_ULSGRO0_USL1_UIOFGRO0_USFGROn1_VSn1_VWA1_VWB1_WSGRA0_WSGRB0_WS64_WG128_2_1_WGM1_WGMXCC4_WGMXCCGn1
    SolutionIndex: 63
    SolutionNameMin: Cijk_Ailk_Bjlk_S_MX_B_Bias_HA_S_SAV_UserArgs_MT64x64x64_MI32x32x1_SN_LDSB0_AFC1_AFEM1_AFEM1_ASEM1_CLR1_CADS0_DTVA0_DTVB0_EPS0_FDSI0_GRPM1_GRVWA4_GRVWB4_GSUn1_GSUAMBSK_GSUC1_GSUWGMRR1_GLS0_ISA942_IU1_K1_LBSPPA0_LBSPPB0_LBSPPM0_LPA0_LPB0_LPM0_LRVW2_LWPMn1_MIAV0_MIWT1_1_MO40_NTn1_NTA0_NTB0_NTC0_NTD4_NTM0_NEPBS8_NLCA1_NLCB1_ONLL1_PGR2_PLR1_PKA1_SIA3_SS1_SU0_SUM1_SUS0_SPO0_SRVW0_SSO0_SVW1_SK0_SKXCCM0_TLDS0_ULSGRO0_USL1_UIOFGRO0_USFGROn1_VSn1_VWA1_VWB1_WSGRA0_WSGRB0_WS64_WG64_4_1_WGM1_WGMXCC4_WGMXCCGn1
    SolutionIndex: 64
    SolutionNameMin: Cijk_Ailk_Bjlk_S_MX_B_Bias_HA_S_SAV_UserArgs_MT128x64x32_MI32x32x1_SN_LDSB0_AFC1_AFEM1_AFEM1_ASEM1_CLR1_CADS0_DTVA0_DTVB0_EPS0_FDSI0_GRPM1_GRVWA4_GRVWB4_GSUn1_GSUAMBSK_GSUC1_GSUWGMRR1_GLS0_ISA942_IU1_K1_LBSPPA0_LBSPPB0_LBSPPM0_LPA0_LPB0_LPM0_LRVW2_LWPMn1_MIAV0_MIWT2_1_MO40_NTn1_NTA0_NTB0_NTC0_NTD4_NTM0_NEPBS8_NLCA1_NLCB1_ONLL1_PGR2_PLR1_PKA1_SIA3_SS1_SU0_SUM1_SUS0_SPO0_SRVW0_SSO0_SVW2_SK0_SKXCCM0_TLDS0_ULSGRO0_USL1_UIOFGRO0_USFGROn1_VSn1_VWA2_VWB1_WSGRA0_WSGRB0_WS64_WG64_4_1_WGM1_WGMXCC4_WGMXCCGn1
    SolutionIndex: 65
    SolutionNameMin: Cijk_Ailk_Bjlk_S_MX_B_Bias_HA_S_SAV_UserArgs_MT128x64x64_MI32x32x1_SN_LDSB1_AFC1_AFEM1_AFEM1_ASEM1_CLR1_CADS0_DTVA0_DTVB0_EPS0_FDSI0_GRPM1_GRVWA4_GRVWB4_GSUn1_GSUAMBSK_GSUC1_GSUWGMRR1_GLS0_ISA942_IU1_K1_LBSPPA0_LBSPPB0_LBSPPM0_LPA0_LPB0_LPM0_LRVW2_LWPMn1_MIAV0_MIWT2_1_MO40_NTn1_NTA0_NTB0_NTC0_NTD4_NTM0_NEPBS8_NLCA1_NLCB1_ONLL1_PGR2_PLR1_PKA1_SIA3_SS1_SU0_SUM1_SUS0_SPO0_SRVW0_SSO0_SVW2_SK0_SKXCCM0_TLDS0_ULSGRO0_USL1_UIOFGRO0_USFGROn1_VSn1_VWA2_VWB1_WSGRA0_WSGRB0_WS64_WG64_4_1_WGM1_WGMXCC4_WGMXCCGn1
    SolutionIndex: 66
    SolutionNameMin: Cijk_Ailk_Bjlk_S_MX_B_Bias_HA_S_SAV_UserArgs_MT160x64x32_MI16x16x1_SN_LDSB1_AFC1_AFEM1_AFEM1_ASEM1_CLR1_CADS0_DTVA0_DTVB0_EPS0_FDSI0_GRPM1_GRVWA4_GRVWB4_GSUn1_GSUAMBSK_GSUC1_GSUWGMRR1_GLS0_ISA942_IU1_K1_LBSPPA1280_LBSPPB512_LBSPPM0_LPA16_LPB0_LPM0_LRVW2_LWPMn1_MIAV0_MIWT5_2_MO40_NTn1_NTA0_NTB0_NTC0_NTD4_NTM0_NEPBS5_NLCA1_NLCB1_ONLL1_PGR2_PLR1_PKA1_SIA3_SS1_SU0_SUM1_SUS0_SPO0_SRVW0_SSO0_SVW1_SK0_SKXCCM0_TLDS0_ULSGRO0_USL1_UIOFGRO0_USFGROn1_VSn1_VWA1_VWB2_WSGRA0_WSGRB0_WS64_WG32_8_1_WGM1_WGMXCC4_WGMXCCGn1
    SolutionIndex: 67
    SolutionNameMin: Cijk_Ailk_Bjlk_S_MX_B_Bias_HA_S_SAV_UserArgs_MT192x64x32_MI32x32x1_SN_LDSB1_AFC1_AFEM1_AFEM1_ASEM1_CLR1_CADS0_DTVA0_DTVB0_EPS0_FDSI0_GRPM1_GRVWA4_GRVWB4_GSUn1_GSUAMBSK_GSUC1_GSUWGMRR1_GLS0_ISA942_IU1_K1_LBSPPA0_LBSPPB0_LBSPPM0_LPA0_LPB0_LPM0_LRVW2_LWPMn1_MIAV0_MIWT3_1_MO40_NTn1_NTA0_NTB0_NTC0_NTD4_NTM0_NEPBS6_NLCA1_NLCB1_ONLL1_PGR2_PLR1_PKA1_SIA3_SS1_SU0_SUM1_SUS0_SPO0_SRVW0_SSO0_SVW1_SK0_SKXCCM0_TLDS0_ULSGRO0_USL1_UIOFGRO0_USFGROn1_VSn1_VWA1_VWB1_WSGRA0_WSGRB0_WS64_WG64_4_1_WGM1_WGMXCC4_WGMXCCGn1
    SolutionIndex: 68
    SolutionNameMin: Cijk_Ailk_Bjlk_S_MX_B_Bias_HA_S_SAV_UserArgs_MT256x64x32_MI32x32x1_SN_LDSB1_AFC1_AFEM1_AFEM1_ASEM1_CLR1_CADS0_DTVA0_DTVB0_EPS0_FDSI0_GRPM1_GRVWA4_GRVWB4_GSUn1_GSUAMBSK_GSUC1_GSUWGMRR1_GLS0_ISA942_IU1_K1_LBSPPA0_LBSPPB0_LBSPPM0_LPA0_LPB0_LPM0_LRVW2_LWPMn1_MIAV0_MIWT2_2_MO40_NTn1_NTA0_NTB0_NTC0_NTD4_NTM0_NEPBS8_NLCA1_NLCB1_ONLL1_PGR2_PLR1_PKA1_SIA3_SS1_SU0_SUM1_SUS0_SPO0_SRVW0_SSO0_SVW2_SK0_SKXCCM0_TLDS0_ULSGRO0_USL1_UIOFGRO0_USFGROn1_VSn1_VWA2_VWB2_WSGRA0_WSGRB0_WS64_WG128_2_1_WGM1_WGMXCC4_WGMXCCGn1
    SolutionIndex: 69
    SolutionNameMin: Cijk_Ailk_Bjlk_S_MX_B_Bias_HA_S_SAV_UserArgs_MT384x64x32_MI32x32x1_SN_LDSB1_AFC1_AFEM1_AFEM1_ASEM1_CLR1_CADS0_DTVA0_DTVB0_EPS0_FDSI0_GRPM1_GRVWA4_GRVWB4_GSUn1_GSUAMBSK_GSUC1_GSUWGMRR1_GLS0_ISA942_IU1_K1_LBSPPA0_LBSPPB0_LBSPPM0_LPA0_LPB0_LPM0_LRVW2_LWPMn1_MIAV0_MIWT3_2_MO40_NTn1_NTA0_NTB0_NTC0_NTD4_NTM0_NEPBS6_NLCA1_NLCB1_ONLL1_PGR2_PLR1_PKA1_SIA3_SS1_SU0_SUM1_SUS0_SPO0_SRVW0_SSO0_SVW1_SK0_SKXCCM0_TLDS0_ULSGRO0_USL1_UIOFGRO0_USFGROn1_VSn1_VWA1_VWB2_WSGRA0_WSGRB0_WS64_WG128_2_1_WGM1_WGMXCC4_WGMXCCGn1
    SolutionIndex: 70
    SolutionNameMin: Cijk_Ailk_Bjlk_S_MX_B_Bias_HA_S_SAV_UserArgs_MT192x64x16_MI32x32x1_SN_LDSB1_AFC1_AFEM1_AFEM1_ASEM1_CLR1_CADS0_DTVA0_DTVB0_EPS0_FDSI0_GRPM1_GRVWA4_GRVWB4_GSUn1_GSUAMBSK_GSUC1_GSUWGMRR1_GLS0_ISA942_IU1_K1_LBSPPA0_LBSPPB0_LBSPPM0_LPA0_LPB0_LPM0_LRVW2_LWPMn1_MIAV0_MIWT3_1_MO40_NTn1_NTA0_NTB0_NTC0_NTD4_NTM0_NEPBS6_NLCA1_NLCB1_ONLL1_PGR2_PLR1_PKA1_SIA3_SS1_SU0_SUM1_SUS0_SPO0_SRVW0_SSO0_SVW1_SK0_SKXCCM0_TLDS0_ULSGRO0_USL1_UIOFGRO0_USFGROn1_VSn1_VWA1_VWB1_WSGRA0_WSGRB0_WS64_WG64_4_1_WGM1_WGMXCC4_WGMXCCGn1
    SolutionIndex: 71
    SolutionNameMin: Cijk_Ailk_Bjlk_S_MX_B_Bias_HA_S_SAV_UserArgs_MT384x64x16_MI32x32x1_SN_LDSB1_AFC1_AFEM1_AFEM1_ASEM1_CLR1_CADS0_DTVA0_DTVB0_EPS0_FDSI0_GRPM1_GRVWA4_GRVWB4_GSUn1_GSUAMBSK_GSUC1_GSUWGMRR1_GLS0_ISA942_IU1_K1_LBSPPA0_LBSPPB0_LBSPPM0_LPA0_LPB0_LPM0_LRVW2_LWPMn1_MIAV0_MIWT3_2_MO40_NTn1_NTA0_NTB0_NTC0_NTD4_NTM0_NEPBS6_NLCA1_NLCB1_ONLL1_PGR2_PLR1_PKA1_SIA3_SS1_SU0_SUM1_SUS0_SPO0_SRVW0_SSO0_SVW1_SK0_SKXCCM0_TLDS0_ULSGRO0_USL1_UIOFGRO0_USFGROn1_VSn1_VWA1_VWB2_WSGRA0_WSGRB0_WS64_WG128_2_1_WGM1_WGMXCC4_WGMXCCGn1
    SolutionIndex: 72
    SolutionNameMin: Cijk_Ailk_Bjlk_S_MX_B_Bias_HA_S_SAV_UserArgs_MT320x64x16_MI32x32x1_SN_LDSB1_AFC1_AFEM1_AFEM1_ASEM1_CLR1_CADS0_DTVA0_DTVB0_EPS0_FDSI0_GRPM1_GRVWA4_GRVWB4_GSUn1_GSUAMBSK_GSUC1_GSUWGMRR1_GLS0_ISA942_IU1_K1_LBSPPA0_LBSPPB0_LBSPPM0_LPA0_LPB0_LPM0_LRVW2_LWPMn1_MIAV0_MIWT5_1_MO40_NTn1_NTA0_NTB0_NTC0_NTD4_NTM0_NEPBS5_NLCA1_NLCB1_ONLL1_PGR2_PLR1_PKA1_SIA3_SS1_SU0_SUM1_SUS0_SPO0_SRVW0_SSO0_SVW1_SK0_SKXCCM0_TLDS0_ULSGRO0_USL1_UIOFGRO0_USFGROn1_VSn1_VWA1_VWB1_WSGRA0_WSGRB0_WS64_WG64_4_1_WGM1_WGMXCC4_WGMXCCGn1
    SolutionIndex: 73
    SolutionNameMin: Cijk_Ailk_Bjlk_S_MX_B_Bias_HA_S_SAV_UserArgs_MT224x64x32_MI16x16x1_SN_LDSB1_AFC1_AFEM1_AFEM1_ASEM1_CLR1_CADS0_DTVA0_DTVB0_EPS0_FDSI0_GRPM1_GRVWA4_GRVWB4_GSUn1_GSUAMBSK_GSUC1_GSUWGMRR1_GLS0_ISA942_IU1_K1_LBSPPA1792_LBSPPB512_LBSPPM0_LPA16_LPB0_LPM0_LRVW2_LWPMn1_MIAV0_MIWT7_2_MO40_NTn1_NTA0_NTB0_NTC0_NTD4_NTM0_NEPBS7_NLCA1_NLCB1_ONLL1_PGR2_PLR1_PKA1_SIA3_SS1_SU0_SUM1_SUS0_SPO0_SRVW0_SSO0_SVW1_SK0_SKXCCM0_TLDS0_ULSGRO0_USL1_UIOFGRO0_USFGROn1_VSn1_VWA1_VWB2_WSGRA0_WSGRB0_WS64_WG32_8_1_WGM1_WGMXCC4_WGMXCCGn1
    SolutionIndex: 74
    SolutionNameMin: Cijk_Ailk_Bjlk_S_MX_B_Bias_HA_S_SAV_UserArgs_MT64x64x32_MI32x32x1_SN_LDSB1_AFC1_AFEM1_AFEM1_ASEM1_CLR1_CADS0_DTVA0_DTVB0_EPS0_FDSI0_GRPM1_GRVWA4_GRVWB4_GSUn1_GSUAMBSK_GSUC1_GSUWGMRR1_GLS0_ISA942_IU1_K1_LBSPPA0_LBSPPB0_LBSPPM0_LPA0_LPB0_LPM0_LRVW2_LWPMn1_MIAV0_MIWT1_1_MO40_NTn1_NTA0_NTB0_NTC0_NTD4_NTM0_NEPBS8_NLCA1_NLCB1_ONLL1_PGR2_PLR1_PKA1_SIA3_SS1_SU0_SUM1_SUS0_SPO0_SRVW0_SSO0_SVW1_SK0_SKXCCM0_TLDS0_ULSGRO0_USL1_UIOFGRO0_USFGROn1_VSn1_VWA1_VWB1_WSGRA0_WSGRB0_WS64_WG64_4_1_WGM1_WGMXCC4_WGMXCCGn1
    SolutionIndex: 75
    SolutionNameMin: Cijk_Ailk_Bjlk_S_MX_B_Bias_HA_S_SAV_UserArgs_MT448x64x16_MI32x32x1_SN_LDSB1_AFC1_AFEM1_AFEM1_ASEM1_CLR1_CADS0_DTVA0_DTVB0_EPS0_FDSI0_GRPM1_GRVWA4_GRVWB4_GSUn1_GSUAMBSK_GSUC1_GSUWGMRR1_GLS0_ISA942_IU1_K1_LBSPPA0_LBSPPB0_LBSPPM0_LPA0_LPB0_LPM0_LRVW2_LWPMn1_MIAV0_MIWT7_1_MO40_NTn1_NTA0_NTB0_NTC0_NTD4_NTM0_NEPBS7_NLCA1_NLCB1_ONLL1_PGR2_PLR1_PKA1_SIA3_SS1_SU0_SUM1_SUS0_SPO0_SRVW0_SSO0_SVW1_SK0_SKXCCM0_TLDS0_ULSGRO0_USL1_UIOFGRO0_USFGROn1_VSn1_VWA1_VWB1_WSGRA0_WSGRB0_WS64_WG64_4_1_WGM1_WGMXCC4_WGMXCCGn1
    SolutionIndex: 76
    SolutionNameMin: Cijk_Ailk_Bjlk_S_MX_B_Bias_HA_S_SAV_UserArgs_MT16x32x64_MI16x16x1_SN_LDSB0_AFC1_AFEM1_AFEM1_ASEM1_CLR1_CADS0_DTVA0_DTVB0_EPS0_FDSI0_GRPM1_GRVWA1_GRVWB4_GSUn1_GSUAMBSK_GSUC1_GSUWGMRR1_GLS0_ISA942_IU1_K1_LBSPPA128_LBSPPB256_LBSPPM0_LPA16_LPB16_LPM0_LRVW2_LWPMn1_MIAV0_MIWT1_1_MO40_NTn1_NTA0_NTB0_NTC0_NTD4_NTM0_NEPBS8_NLCA1_NLCB1_ONLL1_PGR2_PLR1_PKA1_SIA3_SS1_SU0_SUM1_SUS0_SPO0_SRVW0_SSO0_SVW1_SK0_SKXCCM0_TLDS0_ULSGRO0_USL1_UIOFGRO0_USFGROn1_VSn1_VWA1_VWB1_WSGRA0_WSGRB0_WS64_WG16_8_2_WGM1_WGMXCC4_WGMXCCGn1
    SolutionIndex: 77
    SolutionNameMin: Cijk_Ailk_Bjlk_S_MX_B_Bias_HA_S_SAV_UserArgs_MT16x32x64_MI16x16x1_SN_LDSB1_AFC1_AFEM1_AFEM1_ASEM1_CLR1_CADS0_DTVA0_DTVB0_EPS0_FDSI0_GRPM1_GRVWA1_GRVWB4_GSUn1_GSUAMBSK_GSUC1_GSUWGMRR1_GLS0_ISA942_IU1_K1_LBSPPA128_LBSPPB256_LBSPPM0_LPA16_LPB16_LPM0_LRVW2_LWPMn1_MIAV0_MIWT1_1_MO40_NTn1_NTA0_NTB0_NTC0_NTD4_NTM0_NEPBS8_NLCA1_NLCB1_ONLL1_PGR2_PLR1_PKA1_SIA3_SS1_SU0_SUM1_SUS0_SPO0_SRVW0_SSO0_SVW1_SK0_SKXCCM0_TLDS0_ULSGRO0_USL1_UIOFGRO0_USFGROn1_VSn1_VWA1_VWB1_WSGRA0_WSGRB0_WS64_WG16_8_2_WGM1_WGMXCC4_WGMXCCGn1
    SolutionIndex: 78
    SolutionNameMin: Cijk_Ailk_Bjlk_S_MX_B_Bias_HA_S_SAV_UserArgs_MT16x32x256_MI16x16x1_SN_LDSB1_AFC1_AFEM1_AFEM1_ASEM1_CLR1_CADS0_DTVA0_DTVB0_EPS0_FDSI0_GRPM1_GRVWA4_GRVWB4_GSUn1_GSUAMBSK_GSUC1_GSUWGMRR1_GLS0_ISA942_IU1_K1_LBSPPA128_LBSPPB256_LBSPPM0_LPA16_LPB16_LPM0_LRVW2_LWPMn1_MIAV0_MIWT1_1_MO40_NTn1_NTA0_NTB0_NTC0_NTD4_NTM0_NEPBS8_NLCA1_NLCB1_ONLL1_PGR2_PLR1_PKA1_SIA3_SS1_SU0_SUM1_SUS0_SPO0_SRVW0_SSO0_SVW1_SK0_SKXCCM0_TLDS0_ULSGRO0_USL1_UIOFGRO0_USFGROn1_VSn1_VWA1_VWB1_WSGRA0_WSGRB0_WS64_WG16_8_2_WGM1_WGMXCC4_WGMXCCGn1
    SolutionIndex: 79
    SolutionNameMin: Cijk_Ailk_Bjlk_S_MX_B_Bias_HA_S_SAV_UserArgs_MT32x48x64_MI16x16x1_SN_LDSB0_AFC1_AFEM1_AFEM1_ASEM1_CLR1_CADS0_DTVA0_DTVB0_EPS0_FDSI0_GRPM1_GRVWA4_GRVWB4_GSUn1_GSUAMBSK_GSUC1_GSUWGMRR1_GLS0_ISA942_IU1_K1_LBSPPA256_LBSPPB384_LBSPPM0_LPA16_LPB16_LPM0_LRVW2_LWPMn1_MIAV0_MIWT1_3_MO40_NTn1_NTA0_NTB0_NTC0_NTD4_NTM0_NEPBS8_NLCA1_NLCB1_ONLL1_PGR2_PLR1_PKA1_SIA3_SS1_SU0_SUM1_SUS0_SPO0_SRVW0_SSO0_SVW1_SK0_SKXCCM0_TLDS0_ULSGRO0_USL1_UIOFGRO0_USFGROn1_VSn1_VWA1_VWB1_WSGRA0_WSGRB0_WS64_WG32_4_2_WGM1_WGMXCC4_WGMXCCGn1
    SolutionIndex: 80
    SolutionNameMin: Cijk_Ailk_Bjlk_S_MX_B_Bias_HA_S_SAV_UserArgs_MT96x32x64_MI16x16x1_SN_LDSB1_AFC1_AFEM1_AFEM1_ASEM1_CLR1_CADS0_DTVA0_DTVB0_EPS0_FDSI0_GRPM1_GRVWA4_GRVWB4_GSUn1_GSUAMBSK_GSUC1_GSUWGMRR1_GLS0_ISA942_IU1_K1_LBSPPA768_LBSPPB256_LBSPPM0_LPA16_LPB16_LPM0_LRVW2_LWPMn1_MIAV0_MIWT3_1_MO40_NTn1_NTA0_NTB0_NTC0_NTD4_NTM0_NEPBS6_NLCA1_NLCB1_ONLL1_PGR2_PLR1_PKA1_SIA3_SS1_SU0_SUM1_SUS0_SPO0_SRVW0_SSO0_SVW1_SK0_SKXCCM0_TLDS0_ULSGRO0_USL1_UIOFGRO0_USFGROn1_VSn1_VWA1_VWB1_WSGRA0_WSGRB0_WS64_WG32_8_1_WGM1_WGMXCC4_WGMXCCGn1
    SolutionIndex: 81
    SolutionNameMin: Cijk_Ailk_Bjlk_S_MX_B_Bias_HA_S_SAV_UserArgs_MT64x32x64_MI32x32x1_SN_LDSB0_AFC1_AFEM1_AFEM1_ASEM1_CLR1_CADS0_DTVA0_DTVB0_EPS0_FDSI0_GRPM1_GRVWA4_GRVWB4_GSUn1_GSUAMBSK_GSUC1_GSUWGMRR1_GLS0_ISA942_IU1_K1_LBSPPA0_LBSPPB0_LBSPPM0_LPA0_LPB0_LPM0_LRVW2_LWPMn1_MIAV0_MIWT1_1_MO40_NTn1_NTA0_NTB0_NTC0_NTD4_NTM0_NEPBS8_NLCA1_NLCB1_ONLL1_PGR2_PLR1_PKA1_SIA3_SS1_SU0_SUM1_SUS0_SPO0_SRVW0_SSO0_SVW1_SK0_SKXCCM0_TLDS0_ULSGRO0_USL1_UIOFGRO0_USFGROn1_VSn1_VWA1_VWB1_WSGRA0_WSGRB0_WS64_WG64_2_2_WGM1_WGMXCC4_WGMXCCGn1
    SolutionIndex: 82
    SolutionNameMin: Cijk_Ailk_Bjlk_S_MX_B_Bias_HA_S_SAV_UserArgs_MT16x16x256_MI16x16x1_SN_LDSB1_AFC1_AFEM1_AFEM1_ASEM1_CLR1_CADS0_DTVA0_DTVB0_EPS0_FDSI0_GRPM1_GRVWA4_GRVWB4_GSUn1_GSUAMBSK_GSUC1_GSUWGMRR1_GLS0_ISA942_IU1_K1_LBSPPA128_LBSPPB128_LBSPPM0_LPA16_LPB16_LPM0_LRVW2_LWPMn1_MIAV0_MIWT1_1_MO40_NTn1_NTA0_NTB0_NTC0_NTD4_NTM0_NEPBS8_NLCA1_NLCB1_ONLL1_PGR2_PLR1_PKA1_SIA3_SS1_SU0_SUM1_SUS0_SPO0_SRVW0_SSO0_SVW1_SK0_SKXCCM0_TLDS0_ULSGRO0_USL1_UIOFGRO0_USFGROn1_VSn1_VWA1_VWB1_WSGRA0_WSGRB0_WS64_WG16_4_2_WGM1_WGMXCC4_WGMXCCGn1
    SolutionIndex: 83
    SolutionNameMin: Cijk_Ailk_Bjlk_S_MX_B_Bias_HA_S_SAV_UserArgs_MT64x96x32_MI16x16x1_SN_LDSB0_AFC1_AFEM1_AFEM1_ASEM1_CLR1_CADS0_DTVA0_DTVB0_EPS0_FDSI0_GRPM1_GRVWA4_GRVWB4_GSUn1_GSUAMBSK_GSUC1_GSUWGMRR1_GLS0_ISA942_IU1_K1_LBSPPA512_LBSPPB768_LBSPPM0_LPA0_LPB16_LPM0_LRVW2_LWPMn1_MIAV0_MIWT2_3_MO40_NTn1_NTA0_NTB0_NTC0_NTD4_NTM0_NEPBS8_NLCA1_NLCB1_ONLL1_PGR2_PLR1_PKA1_SIA3_SS1_SU0_SUM1_SUS0_SPO0_SRVW0_SSO0_SVW2_SK0_SKXCCM0_TLDS0_ULSGRO0_USL1_UIOFGRO0_USFGROn1_VSn1_VWA2_VWB1_WSGRA0_WSGRB0_WS64_WG32_8_1_WGM1_WGMXCC4_WGMXCCGn1
    SolutionIndex: 84
    SolutionNameMin: Cijk_Ailk_Bjlk_S_MX_B_Bias_HA_S_SAV_UserArgs_MT128x48x64_MI16x16x1_SN_LDSB1_AFC1_AFEM1_AFEM1_ASEM1_CLR1_CADS0_DTVA0_DTVB0_EPS0_FDSI0_GRPM1_GRVWA4_GRVWB4_GSUn1_GSUAMBSK_GSUC1_GSUWGMRR1_GLS0_ISA942_IU1_K1_LBSPPA1024_LBSPPB384_LBSPPM0_LPA0_LPB16_LPM0_LRVW2_LWPMn1_MIAV0_MIWT2_3_MO40_NTn1_NTA0_NTB0_NTC0_NTD4_NTM0_NEPBS8_NLCA1_NLCB1_ONLL1_PGR2_PLR1_PKA1_SIA3_SS1_SU0_SUM1_SUS0_SPO0_SRVW0_SSO0_SVW2_SK0_SKXCCM0_TLDS0_ULSGRO0_USL1_UIOFGRO0_USFGROn1_VSn1_VWA2_VWB1_WSGRA0_WSGRB0_WS64_WG64_4_1_WGM1_WGMXCC4_WGMXCCGn1
    SolutionIndex: 85
    SolutionNameMin: Cijk_Ailk_Bjlk_S_MX_B_Bias_HA_S_SAV_UserArgs_MT128x96x32_MI32x32x1_SN_LDSB0_AFC1_AFEM1_AFEM1_ASEM1_CLR1_CADS0_DTVA0_DTVB0_EPS0_FDSI0_GRPM1_GRVWA4_GRVWB4_GSUn1_GSUAMBSK_GSUC1_GSUWGMRR1_GLS0_ISA942_IU1_K1_LBSPPA0_LBSPPB0_LBSPPM0_LPA0_LPB0_LPM0_LRVW2_LWPMn1_MIAV0_MIWT1_3_MO40_NTn1_NTA0_NTB0_NTC0_NTD4_NTM0_NEPBS8_NLCA1_NLCB1_ONLL1_PGR2_PLR1_PKA1_SIA3_SS1_SU0_SUM1_SUS0_SPO0_SRVW0_SSO0_SVW1_SK0_SKXCCM0_TLDS0_ULSGRO0_USL1_UIOFGRO0_USFGROn1_VSn1_VWA1_VWB1_WSGRA0_WSGRB0_WS64_WG128_2_1_WGM1_WGMXCC4_WGMXCCGn1
    SolutionIndex: 86
    SolutionNameMin: Cijk_Ailk_Bjlk_S_MX_B_Bias_HA_S_SAV_UserArgs_MT128x96x32_MI32x32x1_SN_LDSB1_AFC1_AFEM1_AFEM1_ASEM1_CLR1_CADS0_DTVA0_DTVB0_EPS0_FDSI0_GRPM1_GRVWA4_GRVWB4_GSUn1_GSUAMBSK_GSUC1_GSUWGMRR1_GLS0_ISA942_IU1_K1_LBSPPA0_LBSPPB0_LBSPPM0_LPA0_LPB0_LPM0_LRVW2_LWPMn1_MIAV0_MIWT1_3_MO40_NTn1_NTA0_NTB0_NTC0_NTD4_NTM0_NEPBS8_NLCA1_NLCB1_ONLL1_PGR2_PLR1_PKA1_SIA3_SS1_SU0_SUM1_SUS0_SPO0_SRVW0_SSO0_SVW1_SK0_SKXCCM0_TLDS0_ULSGRO0_USL1_UIOFGRO0_USFGROn1_VSn1_VWA1_VWB1_WSGRA0_WSGRB0_WS64_WG128_2_1_WGM1_WGMXCC4_WGMXCCGn1
    SolutionIndex: 87
    SolutionNameMin: Cijk_Ailk_Bjlk_S_MX_B_Bias_HA_S_SAV_UserArgs_MT96x96x32_MI16x16x1_SN_LDSB1_AFC1_AFEM1_AFEM1_ASEM1_CLR1_CADS0_DTVA0_DTVB0_EPS0_FDSI0_GRPM1_GRVWA4_GRVWB4_GSUn1_GSUAMBSK_GSUC1_GSUWGMRR1_GLS0_ISA942_IU1_K1_LBSPPA768_LBSPPB768_LBSPPM0_LPA16_LPB16_LPM0_LRVW2_LWPMn1_MIAV0_MIWT3_3_MO40_NTn1_NTA0_NTB0_NTC0_NTD4_NTM0_NEPBS6_NLCA1_NLCB1_ONLL1_PGR2_PLR1_PKA1_SIA3_SS1_SU0_SUM1_SUS0_SPO0_SRVW0_SSO0_SVW1_SK0_SKXCCM0_TLDS0_ULSGRO0_USL1_UIOFGRO0_USFGROn1_VSn1_VWA1_VWB1_WSGRA0_WSGRB0_WS64_WG32_8_1_WGM1_WGMXCC4_WGMXCCGn1
    SolutionIndex: 88
    SolutionNameMin: Cijk_Ailk_Bjlk_S_MX_B_Bias_HA_S_SAV_UserArgs_MT256x96x32_MI32x32x1_SN_LDSB1_AFC1_AFEM1_AFEM1_ASEM1_CLR1_CADS0_DTVA0_DTVB0_EPS0_FDSI0_GRPM1_GRVWA4_GRVWB4_GSUn1_GSUAMBSK_GSUC1_GSUWGMRR1_GLS0_ISA942_IU1_K1_LBSPPA0_LBSPPB0_LBSPPM0_LPA0_LPB0_LPM0_LRVW2_LWPMn1_MIAV0_MIWT2_3_MO40_NTn1_NTA0_NTB0_NTC0_NTD4_NTM0_NEPBS8_NLCA1_NLCB1_ONLL1_PGR2_PLR1_PKA1_SIA3_SS1_SU0_SUM1_SUS0_SPO0_SRVW0_SSO0_SVW2_SK0_SKXCCM0_TLDS0_ULSGRO0_USL1_UIOFGRO0_USFGROn1_VSn1_VWA2_VWB1_WSGRA0_WSGRB0_WS64_WG128_2_1_WGM1_WGMXCC4_WGMXCCGn1
    SolutionIndex: 89
    SolutionNameMin: Cijk_Ailk_Bjlk_S_MX_B_Bias_HA_S_SAV_UserArgs_MT32x48x64_MI16x16x1_SN_LDSB1_AFC1_AFEM1_AFEM1_ASEM1_CLR1_CADS0_DTVA0_DTVB0_EPS0_FDSI0_GRPM1_GRVWA4_GRVWB4_GSUn1_GSUAMBSK_GSUC1_GSUWGMRR1_GLS0_ISA942_IU1_K1_LBSPPA256_LBSPPB384_LBSPPM0_LPA16_LPB16_LPM0_LRVW2_LWPMn1_MIAV0_MIWT1_3_MO40_NTn1_NTA0_NTB0_NTC0_NTD4_NTM0_NEPBS8_NLCA1_NLCB1_ONLL1_PGR2_PLR1_PKA1_SIA3_SS1_SU0_SUM1_SUS0_SPO0_SRVW0_SSO0_SVW1_SK0_SKXCCM0_TLDS0_ULSGRO0_USL1_UIOFGRO0_USFGROn1_VSn1_VWA1_VWB1_WSGRA0_WSGRB0_WS64_WG32_4_2_WGM1_WGMXCC4_WGMXCCGn1
    SolutionIndex: 90
    SolutionNameMin: Cijk_Ailk_Bjlk_S_MX_B_Bias_HA_S_SAV_UserArgs_MT384x96x32_MI32x32x1_SN_LDSB1_AFC1_AFEM1_AFEM1_ASEM1_CLR1_CADS0_DTVA0_DTVB0_EPS0_FDSI0_GRPM1_GRVWA4_GRVWB4_GSUn1_GSUAMBSK_GSUC1_GSUWGMRR1_GLS0_ISA942_IU1_K1_LBSPPA0_LBSPPB0_LBSPPM0_LPA0_LPB0_LPM0_LRVW2_LWPMn1_MIAV0_MIWT3_3_MO40_NTn1_NTA0_NTB0_NTC0_NTD4_NTM0_NEPBS6_NLCA1_NLCB1_ONLL1_PGR2_PLR1_PKA1_SIA3_SS1_SU0_SUM1_SUS0_SPO0_SRVW0_SSO0_SVW1_SK0_SKXCCM0_TLDS0_ULSGRO0_USL1_UIOFGRO0_USFGROn1_VSn1_VWA1_VWB1_WSGRA0_WSGRB0_WS64_WG128_2_1_WGM1_WGMXCC4_WGMXCCGn1
    SolutionIndex: 91
    SolutionNameMin: Cijk_Ailk_Bjlk_S_MX_B_Bias_HA_S_SAV_UserArgs_MT64x48x64_MI16x16x1_SN_LDSB1_AFC1_AFEM1_AFEM1_ASEM1_CLR1_CADS0_DTVA0_DTVB0_EPS0_FDSI0_GRPM1_GRVWA4_GRVWB4_GSUn1_GSUAMBSK_GSUC1_GSUWGMRR1_GLS0_ISA942_IU1_K1_LBSPPA512_LBSPPB384_LBSPPM0_LPA0_LPB16_LPM0_LRVW2_LWPMn1_MIAV0_MIWT2_3_MO40_NTn1_NTA0_NTB0_NTC0_NTD4_NTM0_NEPBS8_NLCA1_NLCB1_ONLL1_PGR2_PLR1_PKA1_SIA3_SS1_SU0_SUM1_SUS0_SPO0_SRVW0_SSO0_SVW2_SK0_SKXCCM0_TLDS0_ULSGRO0_USL1_UIOFGRO0_USFGROn1_VSn1_VWA2_VWB1_WSGRA0_WSGRB0_WS64_WG32_4_2_WGM1_WGMXCC4_WGMXCCGn1
    SolutionIndex: 92
    SolutionNameMin: Cijk_Ailk_Bjlk_S_MX_B_Bias_HA_S_SAV_UserArgs_MT64x96x64_MI32x32x1_SN_LDSB1_AFC1_AFEM1_AFEM1_ASEM1_CLR1_CADS0_DTVA0_DTVB0_EPS0_FDSI0_GRPM1_GRVWA4_GRVWB4_GSUn1_GSUAMBSK_GSUC1_GSUWGMRR1_GLS0_ISA942_IU1_K1_LBSPPA0_LBSPPB0_LBSPPM0_LPA0_LPB0_LPM0_LRVW2_LWPMn1_MIAV0_MIWT1_3_MO40_NTn1_NTA0_NTB0_NTC0_NTD4_NTM0_NEPBS8_NLCA1_NLCB1_ONLL1_PGR2_PLR1_PKA1_SIA3_SS1_SU0_SUM1_SUS0_SPO0_SRVW0_SSO0_SVW1_SK0_SKXCCM0_TLDS0_ULSGRO0_USL1_UIOFGRO0_USFGROn1_VSn1_VWA1_VWB1_WSGRA0_WSGRB0_WS64_WG64_2_2_WGM1_WGMXCC4_WGMXCCGn1
    SolutionIndex: 93
    SolutionNameMin: Cijk_Ailk_Bjlk_S_MX_B_Bias_HA_S_SAV_UserArgs_MT160x96x32_MI16x16x1_SN_LDSB1_AFC1_AFEM1_AFEM1_ASEM1_CLR1_CADS0_DTVA0_DTVB0_EPS0_FDSI0_GRPM1_GRVWA4_GRVWB4_GSUn1_GSUAMBSK_GSUC1_GSUWGMRR1_GLS0_ISA942_IU1_K1_LBSPPA1280_LBSPPB768_LBSPPM0_LPA16_LPB16_LPM0_LRVW2_LWPMn1_MIAV0_MIWT5_3_MO40_NTn1_NTA0_NTB0_NTC0_NTD4_NTM0_NEPBS5_NLCA1_NLCB1_ONLL1_PGR2_PLR1_PKA1_SIA3_SS1_SU0_SUM1_SUS0_SPO0_SRVW0_SSO0_SVW1_SK0_SKXCCM0_TLDS0_ULSGRO0_USL1_UIOFGRO0_USFGROn1_VSn1_VWA1_VWB1_WSGRA0_WSGRB0_WS64_WG32_8_1_WGM1_WGMXCC4_WGMXCCGn1
    SolutionIndex: 94
    SolutionNameMin: Cijk_Ailk_Bjlk_S_MX_B_Bias_HA_S_SAV_UserArgs_MT16x32x64_MI16x16x1_SN_LDSB0_AFC1_AFEM1_AFEM1_ASEM1_CLR1_CADS0_DTVA0_DTVB0_EPS0_FDSI0_GRPM1_GRVWA1_GRVWB4_GSUn1_GSUAMBSK_GSUC1_GSUWGMRR1_GLS0_ISA942_IU1_K1_LBSPPA128_LBSPPB256_LBSPPM0_LPA16_LPB16_LPM0_LRVW2_LWPMn1_MIAV0_MIWT1_1_MO40_NTn1_NTA0_NTB0_NTC0_NTD4_NTM0_NEPBS8_NLCA1_NLCB1_ONLL1_PGR2_PLR1_PKA1_SIA3_SS1_SU0_SUM1_SUS0_SPO0_SRVW0_SSO0_SVW1_SK0_SKXCCM0_TLDS0_ULSGRO0_USL1_UIOFGRO0_USFGROn1_VSn1_VWA1_VWB1_WSGRA0_WSGRB0_WS64_WG16_8_1_WGM1_WGMXCC4_WGMXCCGn1
    SolutionIndex: 95
    SolutionNameMin: Cijk_Ailk_Bjlk_S_MX_B_Bias_HA_S_SAV_UserArgs_MT16x64x128_MI16x16x1_SN_LDSB1_AFC1_AFEM1_AFEM1_ASEM1_CLR1_CADS0_DTVA0_DTVB0_EPS0_FDSI0_GRPM1_GRVWA1_GRVWB4_GSUn1_GSUAMBSK_GSUC1_GSUWGMRR1_GLS0_ISA942_IU1_K1_LBSPPA128_LBSPPB512_LBSPPM0_LPA16_LPB16_LPM0_LRVW2_LWPMn1_MIAV0_MIWT1_1_MO40_NTn1_NTA0_NTB0_NTC0_NTD4_NTM0_NEPBS8_NLCA1_NLCB1_ONLL1_PGR2_PLR1_PKA1_SIA3_SS1_SU0_SUM1_SUS0_SPO0_SRVW0_SSO0_SVW1_SK0_SKXCCM0_TLDS0_ULSGRO0_USL1_UIOFGRO0_USFGROn1_VSn1_VWA1_VWB1_WSGRA0_WSGRB0_WS64_WG16_16_1_WGM1_WGMXCC4_WGMXCCGn1
    SolutionIndex: 96
    SolutionNameMin: Cijk_Ailk_Bjlk_S_MX_B_Bias_HA_S_SAV_UserArgs_MT16x64x128_MI16x16x1_SN_LDSB1_AFC1_AFEM1_AFEM1_ASEM1_CLR1_CADS0_DTVA0_DTVB0_EPS0_FDSI0_GRPM1_GRVWA4_GRVWB4_GSUn1_GSUAMBSK_GSUC1_GSUWGMRR1_GLS0_ISA942_IU1_K1_LBSPPA128_LBSPPB512_LBSPPM0_LPA16_LPB16_LPM0_LRVW2_LWPMn1_MIAV0_MIWT1_1_MO40_NTn1_NTA0_NTB0_NTC0_NTD4_NTM0_NEPBS8_NLCA1_NLCB1_ONLL1_PGR2_PLR1_PKA1_SIA3_SS1_SU0_SUM1_SUS0_SPO0_SRVW0_SSO0_SVW1_SK0_SKXCCM0_TLDS0_ULSGRO0_USL1_UIOFGRO0_USFGROn1_VSn1_VWA1_VWB1_WSGRA0_WSGRB0_WS64_WG16_16_1_WGM1_WGMXCC4_WGMXCCGn1
    SolutionIndex: 97
    SolutionNameMin: Cijk_Ailk_Bjlk_S_MX_B_Bias_HA_S_SAV_UserArgs_MT32x64x64_MI32x32x1_SN_LDSB0_AFC1_AFEM1_AFEM1_ASEM1_CLR1_CADS0_DTVA0_DTVB0_EPS0_FDSI0_GRPM1_GRVWA4_GRVWB4_GSUn1_GSUAMBSK_GSUC1_GSUWGMRR1_GLS0_ISA942_IU1_K1_LBSPPA0_LBSPPB0_LBSPPM0_LPA0_LPB0_LPM0_LRVW2_LWPMn1_MIAV0_MIWT1_1_MO40_NTn1_NTA0_NTB0_NTC0_NTD4_NTM0_NEPBS8_NLCA1_NLCB1_ONLL1_PGR2_PLR1_PKA1_SIA3_SS1_SU0_SUM1_SUS0_SPO0_SRVW0_SSO0_SVW1_SK0_SKXCCM0_TLDS0_ULSGRO0_USL1_UIOFGRO0_USFGROn1_VSn1_VWA1_VWB1_WSGRA0_WSGRB0_WS64_WG32_4_1_WGM1_WGMXCC4_WGMXCCGn1
    SolutionIndex: 98
    SolutionNameMin: Cijk_Ailk_Bjlk_S_MX_B_Bias_HA_S_SAV_UserArgs_MT32x128x64_MI32x32x1_SN_LDSB1_AFC1_AFEM1_AFEM1_ASEM1_CLR1_CADS0_DTVA0_DTVB0_EPS0_FDSI0_GRPM1_GRVWA4_GRVWB4_GSUn1_GSUAMBSK_GSUC1_GSUWGMRR1_GLS0_ISA942_IU1_K1_LBSPPA0_LBSPPB0_LBSPPM0_LPA0_LPB0_LPM0_LRVW2_LWPMn1_MIAV0_MIWT1_1_MO40_NTn1_NTA0_NTB0_NTC0_NTD4_NTM0_NEPBS8_NLCA1_NLCB1_ONLL1_PGR2_PLR1_PKA1_SIA3_SS1_SU0_SUM1_SUS0_SPO0_SRVW0_SSO0_SVW1_SK0_SKXCCM0_TLDS0_ULSGRO0_USL1_UIOFGRO0_USFGROn1_VSn1_VWA1_VWB1_WSGRA0_WSGRB0_WS64_WG32_8_1_WGM1_WGMXCC4_WGMXCCGn1
    SolutionIndex: 99
    SolutionNameMin: Cijk_Ailk_Bjlk_S_MX_B_Bias_HA_S_SAV_UserArgs_MT64x64x32_MI32x32x1_SN_LDSB0_AFC1_AFEM1_AFEM1_ASEM1_CLR1_CADS0_DTVA0_DTVB0_EPS0_FDSI0_GRPM1_GRVWA4_GRVWB4_GSUn1_GSUAMBSK_GSUC1_GSUWGMRR1_GLS0_ISA942_IU1_K1_LBSPPA0_LBSPPB0_LBSPPM0_LPA0_LPB0_LPM0_LRVW2_LWPMn1_MIAV0_MIWT1_1_MO40_NTn1_NTA0_NTB0_NTC0_NTD4_NTM0_NEPBS8_NLCA1_NLCB1_ONLL1_PGR2_PLR1_PKA1_SIA3_SS1_SU0_SUM1_SUS0_SPO0_SRVW0_SSO0_SVW1_SK0_SKXCCM0_TLDS0_ULSGRO0_USL1_UIOFGRO0_USFGROn1_VSn1_VWA1_VWB1_WSGRA0_WSGRB0_WS64_WG64_4_1_WGM1_WGMXCC4_WGMXCCGn1
    SolutionIndex: 100
    SolutionNameMin: Cijk_Ailk_Bjlk_S_MX_B_Bias_HA_S_SAV_UserArgs_MT192x32x32_MI16x16x1_SN_LDSB0_AFC1_AFEM1_AFEM1_ASEM1_CLR1_CADS0_DTVA0_DTVB0_EPS0_FDSI0_GRPM1_GRVWA4_GRVWB4_GSUn1_GSUAMBSK_GSUC1_GSUWGMRR1_GLS0_ISA942_IU1_K1_LBSPPA1536_LBSPPB256_LBSPPM0_LPA16_LPB0_LPM0_LRVW2_LWPMn1_MIAV0_MIWT3_2_MO40_NTn1_NTA0_NTB0_NTC0_NTD4_NTM0_NEPBS6_NLCA1_NLCB1_ONLL1_PGR2_PLR1_PKA1_SIA3_SS1_SU0_SUM1_SUS0_SPO0_SRVW0_SSO0_SVW1_SK0_SKXCCM0_TLDS0_ULSGRO0_USL1_UIOFGRO0_USFGROn1_VSn1_VWA1_VWB2_WSGRA0_WSGRB0_WS64_WG64_4_1_WGM1_WGMXCC4_WGMXCCGn1
    SolutionIndex: 101
    SolutionNameMin: Cijk_Ailk_Bjlk_S_MX_B_Bias_HA_S_SAV_UserArgs_MT64x128x32_MI32x32x1_SN_LDSB0_AFC1_AFEM1_AFEM1_ASEM1_CLR1_CADS0_DTVA0_DTVB0_EPS0_FDSI0_GRPM1_GRVWA4_GRVWB4_GSUn1_GSUAMBSK_GSUC1_GSUWGMRR1_GLS0_ISA942_IU1_K1_LBSPPA0_LBSPPB0_LBSPPM0_LPA0_LPB0_LPM0_LRVW2_LWPMn1_MIAV0_MIWT1_2_MO40_NTn1_NTA0_NTB0_NTC0_NTD4_NTM0_NEPBS8_NLCA1_NLCB1_ONLL1_PGR2_PLR1_PKA1_SIA3_SS1_SU0_SUM1_SUS0_SPO0_SRVW0_SSO0_SVW1_SK0_SKXCCM0_TLDS0_ULSGRO0_USL1_UIOFGRO0_USFGROn1_VSn1_VWA1_VWB2_WSGRA0_WSGRB0_WS64_WG64_4_1_WGM1_WGMXCC4_WGMXCCGn1
    SolutionIndex: 102
    SolutionNameMin: Cijk_Ailk_Bjlk_S_MX_B_Bias_HA_S_SAV_UserArgs_MT96x128x32_MI32x32x1_SN_LDSB0_AFC1_AFEM1_AFEM1_ASEM1_CLR1_CADS0_DTVA0_DTVB0_EPS0_FDSI0_GRPM1_GRVWA4_GRVWB4_GSUn1_GSUAMBSK_GSUC1_GSUWGMRR1_GLS0_ISA942_IU1_K1_LBSPPA0_LBSPPB0_LBSPPM0_LPA0_LPB0_LPM0_LRVW2_LWPMn1_MIAV0_MIWT3_1_MO40_NTn1_NTA0_NTB0_NTC0_NTD4_NTM0_NEPBS6_NLCA1_NLCB1_ONLL1_PGR2_PLR1_PKA1_SIA3_SS1_SU0_SUM1_SUS0_SPO0_SRVW0_SSO0_SVW1_SK0_SKXCCM0_TLDS0_ULSGRO0_USL1_UIOFGRO0_USFGROn1_VSn1_VWA1_VWB1_WSGRA0_WSGRB0_WS64_WG32_8_1_WGM1_WGMXCC4_WGMXCCGn1
    SolutionIndex: 103
    SolutionNameMin: Cijk_Ailk_Bjlk_S_MX_B_Bias_HA_S_SAV_UserArgs_MT32x32x128_MI32x32x1_SN_LDSB0_AFC1_AFEM1_AFEM1_ASEM1_CLR1_CADS0_DTVA0_DTVB0_EPS0_FDSI0_GRPM1_GRVWA4_GRVWB4_GSUn1_GSUAMBSK_GSUC1_GSUWGMRR1_GLS0_ISA942_IU1_K1_LBSPPA0_LBSPPB0_LBSPPM0_LPA0_LPB0_LPM0_LRVW2_LWPMn1_MIAV0_MIWT1_1_MO40_NTn1_NTA0_NTB0_NTC0_NTD4_NTM0_NEPBS8_NLCA1_NLCB1_ONLL1_PGR2_PLR1_PKA1_SIA3_SS1_SU0_SUM1_SUS0_SPO0_SRVW0_SSO0_SVW1_SK0_SKXCCM0_TLDS0_ULSGRO0_USL1_UIOFGRO0_USFGROn1_VSn1_VWA1_VWB1_WSGRA0_WSGRB0_WS64_WG32_2_4_WGM1_WGMXCC4_WGMXCCGn1
    SolutionIndex: 104
    SolutionNameMin: Cijk_Ailk_Bjlk_S_MX_B_Bias_HA_S_SAV_UserArgs_MT128x64x32_MI32x32x1_SN_LDSB0_AFC1_AFEM1_AFEM1_ASEM1_CLR1_CADS0_DTVA0_DTVB0_EPS0_FDSI0_GRPM1_GRVWA4_GRVWB4_GSUn1_GSUAMBSK_GSUC1_GSUWGMRR1_GLS0_ISA942_IU1_K1_LBSPPA0_LBSPPB0_LBSPPM0_LPA0_LPB0_LPM0_LRVW2_LWPMn1_MIAV0_MIWT1_2_MO40_NTn1_NTA0_NTB0_NTC0_NTD4_NTM0_NEPBS8_NLCA1_NLCB1_ONLL1_PGR2_PLR1_PKA1_SIA3_SS1_SU0_SUM1_SUS0_SPO0_SRVW0_SSO0_SVW1_SK0_SKXCCM0_TLDS0_ULSGRO0_USL1_UIOFGRO0_USFGROn1_VSn1_VWA1_VWB2_WSGRA0_WSGRB0_WS64_WG128_2_1_WGM1_WGMXCC4_WGMXCCGn1
    SolutionIndex: 105
    SolutionNameMin: Cijk_Ailk_Bjlk_S_MX_B_Bias_HA_S_SAV_UserArgs_MT128x128x32_MI32x32x1_SN_LDSB1_AFC1_AFEM1_AFEM1_ASEM1_CLR1_CADS0_DTVA0_DTVB0_EPS0_FDSI0_GRPM1_GRVWA4_GRVWB4_GSUn1_GSUAMBSK_GSUC1_GSUWGMRR1_GLS0_ISA942_IU1_K1_LBSPPA0_LBSPPB0_LBSPPM0_LPA0_LPB0_LPM0_LRVW2_LWPMn1_MIAV0_MIWT2_2_MO40_NTn1_NTA0_NTB0_NTC0_NTD4_NTM0_NEPBS8_NLCA1_NLCB1_ONLL1_PGR2_PLR1_PKA1_SIA3_SS1_SU0_SUM1_SUS0_SPO0_SRVW0_SSO0_SVW2_SK0_SKXCCM0_TLDS0_ULSGRO0_USL1_UIOFGRO0_USFGROn1_VSn1_VWA2_VWB2_WSGRA0_WSGRB0_WS64_WG64_4_1_WGM1_WGMXCC4_WGMXCCGn1
    SolutionIndex: 106
    SolutionNameMin: Cijk_Ailk_Bjlk_S_MX_B_Bias_HA_S_SAV_UserArgs_MT96x128x32_MI32x32x1_SN_LDSB1_AFC1_AFEM1_AFEM1_ASEM1_CLR1_CADS0_DTVA0_DTVB0_EPS0_FDSI0_GRPM1_GRVWA4_GRVWB4_GSUn1_GSUAMBSK_GSUC1_GSUWGMRR1_GLS0_ISA942_IU1_K1_LBSPPA0_LBSPPB0_LBSPPM0_LPA0_LPB0_LPM0_LRVW2_LWPMn1_MIAV0_MIWT3_1_MO40_NTn1_NTA0_NTB0_NTC0_NTD4_NTM0_NEPBS6_NLCA1_NLCB1_ONLL1_PGR2_PLR1_PKA1_SIA3_SS1_SU0_SUM1_SUS0_SPO0_SRVW0_SSO0_SVW1_SK0_SKXCCM0_TLDS0_ULSGRO0_USL1_UIOFGRO0_USFGROn1_VSn1_VWA1_VWB1_WSGRA0_WSGRB0_WS64_WG32_8_1_WGM1_WGMXCC4_WGMXCCGn1
    SolutionIndex: 107
    SolutionNameMin: Cijk_Ailk_Bjlk_S_MX_B_Bias_HA_S_SAV_UserArgs_MT192x128x32_MI32x32x1_SN_LDSB1_AFC1_AFEM1_AFEM1_ASEM1_CLR1_CADS0_DTVA0_DTVB0_EPS0_FDSI0_GRPM1_GRVWA4_GRVWB4_GSUn1_GSUAMBSK_GSUC1_GSUWGMRR1_GLS0_ISA942_IU1_K1_LBSPPA0_LBSPPB0_LBSPPM0_LPA0_LPB0_LPM0_LRVW2_LWPMn1_MIAV0_MIWT3_2_MO40_NTn1_NTA0_NTB0_NTC0_NTD4_NTM0_NEPBS6_NLCA1_NLCB1_ONLL1_PGR2_PLR1_PKA1_SIA3_SS1_SU0_SUM1_SUS0_SPO0_SRVW0_SSO0_SVW1_SK0_SKXCCM0_TLDS0_ULSGRO0_USL1_UIOFGRO0_USFGROn1_VSn1_VWA1_VWB2_WSGRA0_WSGRB0_WS64_WG64_4_1_WGM1_WGMXCC4_WGMXCCGn1
    SolutionIndex: 108
    SolutionNameMin: Cijk_Ailk_Bjlk_S_MX_B_Bias_HA_S_SAV_UserArgs_MT32x64x64_MI32x32x1_SN_LDSB1_AFC1_AFEM1_AFEM1_ASEM1_CLR1_CADS0_DTVA0_DTVB0_EPS0_FDSI0_GRPM1_GRVWA4_GRVWB4_GSUn1_GSUAMBSK_GSUC1_GSUWGMRR1_GLS0_ISA942_IU1_K1_LBSPPA0_LBSPPB0_LBSPPM0_LPA0_LPB0_LPM0_LRVW2_LWPMn1_MIAV0_MIWT1_1_MO40_NTn1_NTA0_NTB0_NTC0_NTD4_NTM0_NEPBS8_NLCA1_NLCB1_ONLL1_PGR2_PLR1_PKA1_SIA3_SS1_SU0_SUM1_SUS0_SPO0_SRVW0_SSO0_SVW1_SK0_SKXCCM0_TLDS0_ULSGRO0_USL1_UIOFGRO0_USFGROn1_VSn1_VWA1_VWB1_WSGRA0_WSGRB0_WS64_WG32_4_2_WGM1_WGMXCC4_WGMXCCGn1
    SolutionIndex: 109
    SolutionNameMin: Cijk_Ailk_Bjlk_S_MX_B_Bias_HA_S_SAV_UserArgs_MT384x128x32_MI32x32x1_SN_LDSB1_AFC1_AFEM1_AFEM1_ASEM1_CLR1_CADS0_DTVA0_DTVB0_EPS0_FDSI0_GRPM1_GRVWA4_GRVWB4_GSUn1_GSUAMBSK_GSUC1_GSUWGMRR1_GLS0_ISA942_IU1_K1_LBSPPA0_LBSPPB0_LBSPPM0_LPA0_LPB0_LPM0_LRVW2_LWPMn1_MIAV0_MIWT6_2_MO40_NTn1_NTA0_NTB0_NTC0_NTD4_NTM0_NEPBS6_NLCA1_NLCB1_ONLL1_PGR2_PLR1_PKA1_SIA3_SS1_SU0_SUM1_SUS0_SPO0_SRVW0_SSO0_SVW2_SK0_SKXCCM0_TLDS0_ULSGRO0_USL1_UIOFGRO0_USFGROn1_VSn1_VWA2_VWB2_WSGRA0_WSGRB0_WS64_WG64_4_1_WGM1_WGMXCC4_WGMXCCGn1
    SolutionIndex: 110
    SolutionNameMin: Cijk_Ailk_Bjlk_S_MX_B_Bias_HA_S_SAV_UserArgs_MT384x128x16_MI32x32x1_SN_LDSB1_AFC1_AFEM1_AFEM1_ASEM1_CLR1_CADS0_DTVA0_DTVB0_EPS0_FDSI0_GRPM1_GRVWA4_GRVWB4_GSUn1_GSUAMBSK_GSUC1_GSUWGMRR1_GLS0_ISA942_IU1_K1_LBSPPA0_LBSPPB0_LBSPPM0_LPA0_LPB0_LPM0_LRVW2_LWPMn1_MIAV0_MIWT6_2_MO40_NTn1_NTA0_NTB0_NTC0_NTD4_NTM0_NEPBS6_NLCA1_NLCB1_ONLL1_PGR2_PLR1_PKA1_SIA3_SS1_SU0_SUM1_SUS0_SPO0_SRVW0_SSO0_SVW2_SK0_SKXCCM0_TLDS0_ULSGRO0_USL1_UIOFGRO0_USFGROn1_VSn1_VWA2_VWB2_WSGRA0_WSGRB0_WS64_WG64_4_1_WGM1_WGMXCC4_WGMXCCGn1
    SolutionIndex: 111
    SolutionNameMin: Cijk_Ailk_Bjlk_S_MX_B_Bias_HA_S_SAV_UserArgs_MT448x128x16_MI32x32x1_SN_LDSB1_AFC1_AFEM1_AFEM1_ASEM1_CLR1_CADS0_DTVA0_DTVB0_EPS0_FDSI0_GRPM1_GRVWA4_GRVWB4_GSUn1_GSUAMBSK_GSUC1_GSUWGMRR1_GLS0_ISA942_IU1_K1_LBSPPA0_LBSPPB0_LBSPPM0_LPA0_LPB0_LPM0_LRVW2_LWPMn1_MIAV0_MIWT7_2_MO40_NTn1_NTA0_NTB0_NTC0_NTD4_NTM0_NEPBS7_NLCA1_NLCB1_ONLL1_PGR2_PLR1_PKA1_SIA3_SS1_SU0_SUM1_SUS0_SPO0_SRVW0_SSO0_SVW1_SK0_SKXCCM0_TLDS0_ULSGRO0_USL1_UIOFGRO0_USFGROn1_VSn1_VWA1_VWB2_WSGRA0_WSGRB0_WS64_WG64_4_1_WGM1_WGMXCC4_WGMXCCGn1
    SolutionIndex: 112
    SolutionNameMin: Cijk_Ailk_Bjlk_S_MX_B_Bias_HA_S_SAV_UserArgs_MT192x128x16_MI32x32x1_SN_LDSB1_AFC1_AFEM1_AFEM1_ASEM1_CLR1_CADS0_DTVA0_DTVB0_EPS0_FDSI0_GRPM1_GRVWA4_GRVWB4_GSUn1_GSUAMBSK_GSUC1_GSUWGMRR1_GLS0_ISA942_IU1_K1_LBSPPA0_LBSPPB0_LBSPPM0_LPA0_LPB0_LPM0_LRVW2_LWPMn1_MIAV0_MIWT3_2_MO40_NTn1_NTA0_NTB0_NTC0_NTD4_NTM0_NEPBS6_NLCA1_NLCB1_ONLL1_PGR2_PLR1_PKA1_SIA3_SS1_SU0_SUM1_SUS0_SPO0_SRVW0_SSO0_SVW1_SK0_SKXCCM0_TLDS0_ULSGRO0_USL1_UIOFGRO0_USFGROn1_VSn1_VWA1_VWB2_WSGRA0_WSGRB0_WS64_WG64_4_1_WGM1_WGMXCC4_WGMXCCGn1
    SolutionIndex: 113
    SolutionNameMin: Cijk_Ailk_Bjlk_S_MX_B_Bias_HA_S_SAV_UserArgs_MT320x128x16_MI32x32x1_SN_LDSB1_AFC1_AFEM1_AFEM1_ASEM1_CLR1_CADS0_DTVA0_DTVB0_EPS0_FDSI0_GRPM1_GRVWA4_GRVWB4_GSUn1_GSUAMBSK_GSUC1_GSUWGMRR1_GLS0_ISA942_IU1_K1_LBSPPA0_LBSPPB0_LBSPPM0_LPA0_LPB0_LPM0_LRVW2_LWPMn1_MIAV0_MIWT5_2_MO40_NTn1_NTA0_NTB0_NTC0_NTD4_NTM0_NEPBS5_NLCA1_NLCB1_ONLL1_PGR2_PLR1_PKA1_SIA3_SS1_SU0_SUM1_SUS0_SPO0_SRVW0_SSO0_SVW1_SK0_SKXCCM0_TLDS0_ULSGRO0_USL1_UIOFGRO0_USFGROn1_VSn1_VWA1_VWB2_WSGRA0_WSGRB0_WS64_WG64_4_1_WGM1_WGMXCC4_WGMXCCGn1
    SolutionIndex: 114
    SolutionNameMin: Cijk_Ailk_Bjlk_S_MX_B_Bias_HA_S_SAV_UserArgs_MT160x128x32_MI32x32x1_SN_LDSB1_AFC1_AFEM1_AFEM1_ASEM1_CLR1_CADS0_DTVA0_DTVB0_EPS0_FDSI0_GRPM1_GRVWA4_GRVWB4_GSUn1_GSUAMBSK_GSUC1_GSUWGMRR1_GLS0_ISA942_IU1_K1_LBSPPA0_LBSPPB0_LBSPPM0_LPA0_LPB0_LPM0_LRVW2_LWPMn1_MIAV0_MIWT5_1_MO40_NTn1_NTA0_NTB0_NTC0_NTD4_NTM0_NEPBS5_NLCA1_NLCB1_ONLL1_PGR2_PLR1_PKA1_SIA3_SS1_SU0_SUM1_SUS0_SPO0_SRVW0_SSO0_SVW1_SK0_SKXCCM0_TLDS0_ULSGRO0_USL1_UIOFGRO0_USFGROn1_VSn1_VWA1_VWB1_WSGRA0_WSGRB0_WS64_WG32_8_1_WGM1_WGMXCC4_WGMXCCGn1
    SolutionIndex: 115
    SolutionNameMin: Cijk_Ailk_Bjlk_S_MX_B_Bias_HA_S_SAV_UserArgs_MT16x64x64_MI16x16x1_SN_LDSB0_AFC1_AFEM1_AFEM1_ASEM1_CLR1_CADS0_DTVA0_DTVB0_EPS0_FDSI0_GRPM1_GRVWA1_GRVWB4_GSUn1_GSUAMBSK_GSUC1_GSUWGMRR1_GLS0_ISA942_IU1_K1_LBSPPA128_LBSPPB512_LBSPPM0_LPA16_LPB16_LPM0_LRVW2_LWPMn1_MIAV0_MIWT1_1_MO40_NTn1_NTA0_NTB0_NTC0_NTD4_NTM0_NEPBS8_NLCA1_NLCB1_ONLL1_PGR2_PLR1_PKA1_SIA3_SS1_SU0_SUM1_SUS0_SPO0_SRVW0_SSO0_SVW1_SK0_SKXCCM0_TLDS0_ULSGRO0_USL1_UIOFGRO0_USFGROn1_VSn1_VWA1_VWB1_WSGRA0_WSGRB0_WS64_WG16_16_1_WGM1_WGMXCC4_WGMXCCGn1
    SolutionIndex: 116
    SolutionNameMin: Cijk_Ailk_Bjlk_S_MX_B_Bias_HA_S_SAV_UserArgs_MT96x64x32_MI16x16x1_SN_LDSB0_AFC1_AFEM1_AFEM1_ASEM1_CLR1_CADS0_DTVA0_DTVB0_EPS0_FDSI0_GRPM1_GRVWA4_GRVWB4_GSUn1_GSUAMBSK_GSUC1_GSUWGMRR1_GLS0_ISA942_IU1_K1_LBSPPA768_LBSPPB512_LBSPPM0_LPA16_LPB0_LPM0_LRVW2_LWPMn1_MIAV0_MIWT3_2_MO40_NTn1_NTA0_NTB0_NTC0_NTD4_NTM0_NEPBS6_NLCA1_NLCB1_ONLL1_PGR2_PLR1_PKA1_SIA3_SS1_SU0_SUM1_SUS0_SPO0_SRVW0_SSO0_SVW1_SK0_SKXCCM0_TLDS0_ULSGRO0_USL1_UIOFGRO0_USFGROn1_VSn1_VWA1_VWB2_WSGRA0_WSGRB0_WS64_WG32_8_1_WGM1_WGMXCC4_WGMXCCGn1
    SolutionIndex: 117
    SolutionNameMin: Cijk_Ailk_Bjlk_S_MX_B_Bias_HA_S_SAV_UserArgs_MT192x64x32_MI32x32x1_SN_LDSB0_AFC1_AFEM1_AFEM1_ASEM1_CLR1_CADS0_DTVA0_DTVB0_EPS0_FDSI0_GRPM1_GRVWA4_GRVWB4_GSUn1_GSUAMBSK_GSUC1_GSUWGMRR1_GLS0_ISA942_IU1_K1_LBSPPA0_LBSPPB0_LBSPPM0_LPA0_LPB0_LPM0_LRVW2_LWPMn1_MIAV0_MIWT3_1_MO40_NTn1_NTA0_NTB0_NTC0_NTD4_NTM0_NEPBS6_NLCA1_NLCB1_ONLL1_PGR2_PLR1_PKA1_SIA3_SS1_SU0_SUM1_SUS0_SPO0_SRVW0_SSO0_SVW1_SK0_SKXCCM0_TLDS0_ULSGRO0_USL1_UIOFGRO0_USFGROn1_VSn1_VWA1_VWB1_WSGRA0_WSGRB0_WS64_WG64_4_1_WGM1_WGMXCC4_WGMXCCGn1
    SolutionIndex: 118
    SolutionNameMin: Cijk_Ailk_Bjlk_S_MX_B_Bias_HA_S_SAV_UserArgs_MT32x32x128_MI32x32x1_SN_LDSB0_AFC1_AFEM1_AFEM1_ASEM1_CLR1_CADS0_DTVA0_DTVB0_EPS0_FDSI0_GRPM1_GRVWA4_GRVWB4_GSUn1_GSUAMBSK_GSUC1_GSUWGMRR1_GLS0_ISA942_IU1_K1_LBSPPA0_LBSPPB0_LBSPPM0_LPA0_LPB0_LPM0_LRVW2_LWPMn1_MIAV0_MIWT1_1_MO40_NTn1_NTA0_NTB0_NTC0_NTD4_NTM0_NEPBS8_NLCA1_NLCB1_ONLL1_PGR2_PLR1_PKA1_SIA3_SS1_SU0_SUM1_SUS0_SPO0_SRVW0_SSO0_SVW1_SK0_SKXCCM0_TLDS0_ULSGRO0_USL1_UIOFGRO0_USFGROn1_VSn1_VWA1_VWB1_WSGRA0_WSGRB0_WS64_WG32_2_2_WGM1_WGMXCC4_WGMXCCGn1
    SolutionIndex: 119
    SolutionNameMin: Cijk_Ailk_Bjlk_S_MX_B_Bias_HA_S_SAV_UserArgs_MT128x192x16_MI32x32x1_SN_LDSB1_AFC1_AFEM1_AFEM1_ASEM1_CLR1_CADS0_DTVA0_DTVB0_EPS0_FDSI0_GRPM1_GRVWA4_GRVWB4_GSUn1_GSUAMBSK_GSUC1_GSUWGMRR1_GLS0_ISA942_IU1_K1_LBSPPA0_LBSPPB0_LBSPPM0_LPA0_LPB0_LPM0_LRVW2_LWPMn1_MIAV0_MIWT2_3_MO40_NTn1_NTA0_NTB0_NTC0_NTD4_NTM0_NEPBS8_NLCA1_NLCB1_ONLL1_PGR2_PLR1_PKA1_SIA3_SS1_SU0_SUM1_SUS0_SPO0_SRVW0_SSO0_SVW2_SK0_SKXCCM0_TLDS0_ULSGRO0_USL1_UIOFGRO0_USFGROn1_VSn1_VWA2_VWB1_WSGRA0_WSGRB0_WS64_WG64_4_1_WGM1_WGMXCC4_WGMXCCGn1
    SolutionIndex: 120
    SolutionNameMin: Cijk_Ailk_Bjlk_S_MX_B_Bias_HA_S_SAV_UserArgs_MT128x192x32_MI32x32x1_SN_LDSB1_AFC1_AFEM1_AFEM1_ASEM1_CLR1_CADS0_DTVA0_DTVB0_EPS0_FDSI0_GRPM1_GRVWA4_GRVWB4_GSUn1_GSUAMBSK_GSUC1_GSUWGMRR1_GLS0_ISA942_IU1_K1_LBSPPA0_LBSPPB0_LBSPPM0_LPA0_LPB0_LPM0_LRVW2_LWPMn1_MIAV0_MIWT2_3_MO40_NTn1_NTA0_NTB0_NTC0_NTD4_NTM0_NEPBS8_NLCA1_NLCB1_ONLL1_PGR2_PLR1_PKA1_SIA3_SS1_SU0_SUM1_SUS0_SPO0_SRVW0_SSO0_SVW2_SK0_SKXCCM0_TLDS0_ULSGRO0_USL1_UIOFGRO0_USFGROn1_VSn1_VWA2_VWB1_WSGRA0_WSGRB0_WS64_WG64_4_1_WGM1_WGMXCC4_WGMXCCGn1
    SolutionIndex: 121
    SolutionNameMin: Cijk_Ailk_Bjlk_S_MX_B_Bias_HA_S_SAV_UserArgs_MT192x192x16_MI32x32x1_SN_LDSB1_AFC1_AFEM1_AFEM1_ASEM1_CLR1_CADS0_DTVA0_DTVB0_EPS0_FDSI0_GRPM1_GRVWA4_GRVWB4_GSUn1_GSUAMBSK_GSUC1_GSUWGMRR1_GLS0_ISA942_IU1_K1_LBSPPA0_LBSPPB0_LBSPPM0_LPA0_LPB0_LPM0_LRVW2_LWPMn1_MIAV0_MIWT3_3_MO40_NTn1_NTA0_NTB0_NTC0_NTD4_NTM0_NEPBS6_NLCA1_NLCB1_ONLL1_PGR2_PLR1_PKA1_SIA3_SS1_SU0_SUM1_SUS0_SPO0_SRVW0_SSO0_SVW1_SK0_SKXCCM0_TLDS0_ULSGRO0_USL1_UIOFGRO0_USFGROn1_VSn1_VWA1_VWB1_WSGRA0_WSGRB0_WS64_WG64_4_1_WGM1_WGMXCC4_WGMXCCGn1
    SolutionIndex: 122
    SolutionNameMin: Cijk_Ailk_Bjlk_S_MX_B_Bias_HA_S_SAV_UserArgs_MT256x192x32_MI32x32x1_SN_LDSB1_AFC1_AFEM1_AFEM1_ASEM1_CLR1_CADS0_DTVA0_DTVB0_EPS0_FDSI0_GRPM1_GRVWA4_GRVWB4_GSUn1_GSUAMBSK_GSUC1_GSUWGMRR1_GLS0_ISA942_IU1_K1_LBSPPA0_LBSPPB0_LBSPPM0_LPA0_LPB0_LPM0_LRVW2_LWPMn1_MIAV0_MIWT2_6_MO40_NTn1_NTA0_NTB0_NTC0_NTD4_NTM0_NEPBS8_NLCA1_NLCB1_ONLL1_PGR2_PLR1_PKA1_SIA3_SS1_SU0_SUM1_SUS0_SPO0_SRVW0_SSO0_SVW2_SK0_SKXCCM0_TLDS0_ULSGRO0_USL1_UIOFGRO0_USFGROn1_VSn1_VWA2_VWB2_WSGRA0_WSGRB0_WS64_WG128_2_1_WGM1_WGMXCC4_WGMXCCGn1
    SolutionIndex: 123
    SolutionNameMin: Cijk_Ailk_Bjlk_S_MX_B_Bias_HA_S_SAV_UserArgs_MT192x192x32_MI32x32x1_SN_LDSB1_AFC1_AFEM1_AFEM1_ASEM1_CLR1_CADS0_DTVA0_DTVB0_EPS0_FDSI0_GRPM1_GRVWA4_GRVWB4_GSUn1_GSUAMBSK_GSUC1_GSUWGMRR1_GLS0_ISA942_IU1_K1_LBSPPA0_LBSPPB0_LBSPPM0_LPA0_LPB0_LPM0_LRVW2_LWPMn1_MIAV0_MIWT3_3_MO40_NTn1_NTA0_NTB0_NTC0_NTD4_NTM0_NEPBS6_NLCA1_NLCB1_ONLL1_PGR2_PLR1_PKA1_SIA3_SS1_SU0_SUM1_SUS0_SPO0_SRVW0_SSO0_SVW1_SK0_SKXCCM0_TLDS0_ULSGRO0_USL1_UIOFGRO0_USFGROn1_VSn1_VWA1_VWB1_WSGRA0_WSGRB0_WS64_WG64_4_1_WGM1_WGMXCC4_WGMXCCGn1
    SolutionIndex: 124
    SolutionNameMin: Cijk_Ailk_Bjlk_S_MX_B_Bias_HA_S_SAV_UserArgs_MT320x192x32_MI32x32x1_SN_LDSB1_AFC1_AFEM1_AFEM1_ASEM1_CLR1_CADS0_DTVA0_DTVB0_EPS0_FDSI0_GRPM1_GRVWA4_GRVWB4_GSUn1_GSUAMBSK_GSUC1_GSUWGMRR1_GLS0_ISA942_IU1_K1_LBSPPA0_LBSPPB0_LBSPPM0_LPA0_LPB0_LPM0_LRVW2_LWPMn1_MIAV0_MIWT5_3_MO40_NTn1_NTA0_NTB0_NTC0_NTD4_NTM0_NEPBS5_NLCA1_NLCB1_ONLL1_PGR2_PLR1_PKA1_SIA3_SS1_SU0_SUM1_SUS0_SPO0_SRVW0_SSO0_SVW1_SK0_SKXCCM0_TLDS0_ULSGRO0_USL1_UIOFGRO0_USFGROn1_VSn1_VWA1_VWB1_WSGRA0_WSGRB0_WS64_WG64_4_1_WGM1_WGMXCC4_WGMXCCGn1
    SolutionIndex: 125
    SolutionNameMin: Cijk_Ailk_Bjlk_S_MX_B_Bias_HA_S_SAV_UserArgs_MT320x192x16_MI32x32x1_SN_LDSB1_AFC1_AFEM1_AFEM1_ASEM1_CLR1_CADS0_DTVA0_DTVB0_EPS0_FDSI0_GRPM1_GRVWA4_GRVWB4_GSUn1_GSUAMBSK_GSUC1_GSUWGMRR1_GLS0_ISA942_IU1_K1_LBSPPA0_LBSPPB0_LBSPPM0_LPA0_LPB0_LPM0_LRVW2_LWPMn1_MIAV0_MIWT5_3_MO40_NTn1_NTA0_NTB0_NTC0_NTD4_NTM0_NEPBS5_NLCA1_NLCB1_ONLL1_PGR2_PLR1_PKA1_SIA3_SS1_SU0_SUM1_SUS0_SPO0_SRVW0_SSO0_SVW1_SK0_SKXCCM0_TLDS0_ULSGRO0_USL1_UIOFGRO0_USFGROn1_VSn1_VWA1_VWB1_WSGRA0_WSGRB0_WS64_WG64_4_1_WGM1_WGMXCC4_WGMXCCGn1
    SolutionIndex: 126
    SolutionNameMin: Cijk_Ailk_Bjlk_S_MX_B_Bias_HA_S_SAV_UserArgs_MT192x192x16_MI16x16x1_SN_LDSB1_AFC1_AFEM1_AFEM1_ASEM1_CLR1_CADS0_DTVA0_DTVB0_EPS0_FDSI0_GRPM1_GRVWA4_GRVWB4_GSUn1_GSUAMBSK_GSUC1_GSUWGMRR1_GLS0_ISA942_IU1_K1_LBSPPA1536_LBSPPB1536_LBSPPM0_LPA0_LPB0_LPM0_LRVW2_LWPMn1_MIAV0_MIWT6_6_MO40_NTn1_NTA0_NTB0_NTC0_NTD4_NTM0_NEPBS6_NLCA1_NLCB1_ONLL1_PGR2_PLR1_PKA1_SIA3_SS1_SU0_SUM1_SUS0_SPO0_SRVW0_SSO0_SVW2_SK0_SKXCCM0_TLDS0_ULSGRO0_USL1_UIOFGRO0_USFGROn1_VSn1_VWA2_VWB2_WSGRA0_WSGRB0_WS64_WG32_8_1_WGM1_WGMXCC4_WGMXCCGn1
    SolutionIndex: 127
    SolutionNameMin: Cijk_Ailk_Bjlk_S_MX_B_Bias_HA_S_SAV_UserArgs_MT256x192x16_MI32x32x1_SN_LDSB1_AFC1_AFEM1_AFEM1_ASEM1_CLR1_CADS0_DTVA0_DTVB0_EPS0_FDSI0_GRPM1_GRVWA4_GRVWB4_GSUn1_GSUAMBSK_GSUC1_GSUWGMRR1_GLS0_ISA942_IU1_K1_LBSPPA0_LBSPPB0_LBSPPM0_LPA0_LPB0_LPM0_LRVW2_LWPMn1_MIAV0_MIWT4_3_MO40_NTn1_NTA0_NTB0_NTC0_NTD4_NTM0_NEPBS8_NLCA1_NLCB1_ONLL1_PGR2_PLR1_PKA1_SIA3_SS1_SU0_SUM1_SUS0_SPO0_SRVW0_SSO0_SVW4_SK0_SKXCCM0_TLDS0_ULSGRO0_USL1_UIOFGRO0_USFGROn1_VSn1_VWA4_VWB1_WSGRA0_WSGRB0_WS64_WG64_4_1_WGM1_WGMXCC4_WGMXCCGn1
    SolutionIndex: 128
    SolutionNameMin: Cijk_Ailk_Bjlk_S_MX_B_Bias_HA_S_SAV_UserArgs_MT16x64x32_MI16x16x1_SN_LDSB1_AFC1_AFEM1_AFEM1_ASEM1_CLR1_CADS0_DTVA0_DTVB0_EPS0_FDSI0_GRPM1_GRVWA1_GRVWB4_GSUn1_GSUAMBSK_GSUC1_GSUWGMRR1_GLS0_ISA942_IU1_K1_LBSPPA128_LBSPPB512_LBSPPM0_LPA16_LPB16_LPM0_LRVW2_LWPMn1_MIAV0_MIWT1_1_MO40_NTn1_NTA0_NTB0_NTC0_NTD4_NTM0_NEPBS8_NLCA1_NLCB1_ONLL1_PGR2_PLR1_PKA1_SIA3_SS1_SU0_SUM1_SUS0_SPO0_SRVW0_SSO0_SVW1_SK0_SKXCCM0_TLDS0_ULSGRO0_USL1_UIOFGRO0_USFGROn1_VSn1_VWA1_VWB1_WSGRA0_WSGRB0_WS64_WG16_16_1_WGM1_WGMXCC4_WGMXCCGn1
    SolutionIndex: 129
    SolutionNameMin: Cijk_Ailk_Bjlk_S_MX_B_Bias_HA_S_SAV_UserArgs_MT16x32x32_MI16x16x1_SN_LDSB1_AFC1_AFEM1_AFEM1_ASEM1_CLR1_CADS0_DTVA0_DTVB0_EPS0_FDSI0_GRPM1_GRVWA1_GRVWB4_GSUn1_GSUAMBSK_GSUC1_GSUWGMRR1_GLS0_ISA942_IU1_K1_LBSPPA128_LBSPPB256_LBSPPM0_LPA16_LPB16_LPM0_LRVW2_LWPMn1_MIAV0_MIWT1_1_MO40_NTn1_NTA0_NTB0_NTC0_NTD4_NTM0_NEPBS8_NLCA1_NLCB1_ONLL1_PGR2_PLR1_PKA1_SIA3_SS1_SU0_SUM1_SUS0_SPO0_SRVW0_SSO0_SVW1_SK0_SKXCCM0_TLDS0_ULSGRO0_USL1_UIOFGRO0_USFGROn1_VSn1_VWA1_VWB1_WSGRA0_WSGRB0_WS64_WG16_8_1_WGM1_WGMXCC4_WGMXCCGn1
    SolutionIndex: 130
    SolutionNameMin: Cijk_Ailk_Bjlk_S_MX_B_Bias_HA_S_SAV_UserArgs_MT16x64x64_MI16x16x1_SN_LDSB1_AFC1_AFEM1_AFEM1_ASEM1_CLR1_CADS0_DTVA0_DTVB0_EPS0_FDSI0_GRPM1_GRVWA1_GRVWB4_GSUn1_GSUAMBSK_GSUC1_GSUWGMRR1_GLS0_ISA942_IU1_K1_LBSPPA128_LBSPPB512_LBSPPM0_LPA16_LPB16_LPM0_LRVW2_LWPMn1_MIAV0_MIWT1_1_MO40_NTn1_NTA0_NTB0_NTC0_NTD4_NTM0_NEPBS8_NLCA1_NLCB1_ONLL1_PGR2_PLR1_PKA1_SIA3_SS1_SU0_SUM1_SUS0_SPO0_SRVW0_SSO0_SVW1_SK0_SKXCCM0_TLDS0_ULSGRO0_USL1_UIOFGRO0_USFGROn1_VSn1_VWA1_VWB1_WSGRA0_WSGRB0_WS64_WG16_16_1_WGM1_WGMXCC4_WGMXCCGn1
    SolutionIndex: 131
    SolutionNameMin: Cijk_Ailk_Bjlk_S_MX_B_Bias_HA_S_SAV_UserArgs_MT16x64x64_MI16x16x1_SN_LDSB0_AFC1_AFEM1_AFEM1_ASEM1_CLR1_CADS0_DTVA0_DTVB0_EPS0_FDSI0_GRPM1_GRVWA4_GRVWB4_GSUn1_GSUAMBSK_GSUC1_GSUWGMRR1_GLS0_ISA942_IU1_K1_LBSPPA128_LBSPPB512_LBSPPM0_LPA16_LPB16_LPM0_LRVW2_LWPMn1_MIAV0_MIWT1_1_MO40_NTn1_NTA0_NTB0_NTC0_NTD4_NTM0_NEPBS8_NLCA1_NLCB1_ONLL1_PGR2_PLR1_PKA1_SIA3_SS1_SU0_SUM1_SUS0_SPO0_SRVW0_SSO0_SVW1_SK0_SKXCCM0_TLDS0_ULSGRO0_USL1_UIOFGRO0_USFGROn1_VSn1_VWA1_VWB1_WSGRA0_WSGRB0_WS64_WG16_16_1_WGM1_WGMXCC4_WGMXCCGn1
    SolutionIndex: 132
    SolutionNameMin: Cijk_Ailk_Bjlk_S_MX_B_Bias_HA_S_SAV_UserArgs_MT16x32x32_MI16x16x1_SN_LDSB1_AFC1_AFEM1_AFEM1_ASEM1_CLR1_CADS0_DTVA0_DTVB0_EPS0_FDSI0_GRPM1_GRVWA4_GRVWB4_GSUn1_GSUAMBSK_GSUC1_GSUWGMRR1_GLS0_ISA942_IU1_K1_LBSPPA128_LBSPPB256_LBSPPM0_LPA16_LPB16_LPM0_LRVW2_LWPMn1_MIAV0_MIWT1_1_MO40_NTn1_NTA0_NTB0_NTC0_NTD4_NTM0_NEPBS8_NLCA1_NLCB1_ONLL1_PGR2_PLR1_PKA1_SIA3_SS1_SU0_SUM1_SUS0_SPO0_SRVW0_SSO0_SVW1_SK0_SKXCCM0_TLDS0_ULSGRO0_USL1_UIOFGRO0_USFGROn1_VSn1_VWA1_VWB1_WSGRA0_WSGRB0_WS64_WG16_8_1_WGM1_WGMXCC4_WGMXCCGn1
    SolutionIndex: 133
    SolutionNameMin: Cijk_Ailk_Bjlk_S_MX_B_Bias_HA_S_SAV_UserArgs_MT16x96x64_MI16x16x1_SN_LDSB0_AFC1_AFEM1_AFEM1_ASEM1_CLR1_CADS0_DTVA0_DTVB0_EPS0_FDSI0_GRPM1_GRVWA4_GRVWB4_GSUn1_GSUAMBSK_GSUC1_GSUWGMRR1_GLS0_ISA942_IU1_K1_LBSPPA128_LBSPPB768_LBSPPM0_LPA16_LPB16_LPM0_LRVW2_LWPMn1_MIAV0_MIWT1_3_MO40_NTn1_NTA0_NTB0_NTC0_NTD4_NTM0_NEPBS8_NLCA1_NLCB1_ONLL1_PGR2_PLR1_PKA1_SIA3_SS1_SU0_SUM1_SUS0_SPO0_SRVW0_SSO0_SVW1_SK0_SKXCCM0_TLDS0_ULSGRO0_USL1_UIOFGRO0_USFGROn1_VSn1_VWA1_VWB1_WSGRA0_WSGRB0_WS64_WG16_8_2_WGM1_WGMXCC4_WGMXCCGn1
    SolutionIndex: 134
    SolutionNameMin: Cijk_Ailk_Bjlk_S_MX_B_Bias_HA_S_SAV_UserArgs_MT48x128x64_MI16x16x1_SN_LDSB1_AFC1_AFEM1_AFEM1_ASEM1_CLR1_CADS0_DTVA0_DTVB0_EPS0_FDSI0_GRPM1_GRVWA4_GRVWB4_GSUn1_GSUAMBSK_GSUC1_GSUWGMRR1_GLS0_ISA942_IU1_K1_LBSPPA384_LBSPPB1024_LBSPPM0_LPA16_LPB0_LPM0_LRVW2_LWPMn1_MIAV0_MIWT3_2_MO40_NTn1_NTA0_NTB0_NTC0_NTD4_NTM0_NEPBS6_NLCA1_NLCB1_ONLL1_PGR2_PLR1_PKA1_SIA3_SS1_SU0_SUM1_SUS0_SPO0_SRVW0_SSO0_SVW1_SK0_SKXCCM0_TLDS0_ULSGRO0_USL1_UIOFGRO0_USFGROn1_VSn1_VWA1_VWB2_WSGRA0_WSGRB0_WS64_WG16_16_1_WGM1_WGMXCC4_WGMXCCGn1
    SolutionIndex: 135
    SolutionNameMin: Cijk_Ailk_Bjlk_S_MX_B_Bias_HA_S_SAV_UserArgs_MT96x96x32_MI16x16x1_SN_LDSB0_AFC1_AFEM1_AFEM1_ASEM1_CLR1_CADS0_DTVA0_DTVB0_EPS0_FDSI0_GRPM1_GRVWA4_GRVWB4_GSUn1_GSUAMBSK_GSUC1_GSUWGMRR1_GLS0_ISA942_IU1_K1_LBSPPA768_LBSPPB768_LBSPPM0_LPA16_LPB16_LPM0_LRVW2_LWPMn1_MIAV0_MIWT3_3_MO40_NTn1_NTA0_NTB0_NTC0_NTD4_NTM0_NEPBS6_NLCA1_NLCB1_ONLL1_PGR2_PLR1_PKA1_SIA3_SS1_SU0_SUM1_SUS0_SPO0_SRVW0_SSO0_SVW1_SK0_SKXCCM0_TLDS0_ULSGRO0_USL1_UIOFGRO0_USFGROn1_VSn1_VWA1_VWB1_WSGRA0_WSGRB0_WS64_WG32_8_1_WGM1_WGMXCC4_WGMXCCGn1
    SolutionIndex: 136
    SolutionNameMin: Cijk_Ailk_Bjlk_S_MX_B_Bias_HA_S_SAV_UserArgs_MT32x32x64_MI32x32x1_SN_LDSB1_AFC1_AFEM1_AFEM1_ASEM1_CLR1_CADS0_DTVA0_DTVB0_EPS0_FDSI0_GRPM1_GRVWA4_GRVWB4_GSUn1_GSUAMBSK_GSUC1_GSUWGMRR1_GLS0_ISA942_IU1_K1_LBSPPA0_LBSPPB0_LBSPPM0_LPA0_LPB0_LPM0_LRVW2_LWPMn1_MIAV0_MIWT1_1_MO40_NTn1_NTA0_NTB0_NTC0_NTD4_NTM0_NEPBS8_NLCA1_NLCB1_ONLL1_PGR2_PLR1_PKA1_SIA3_SS1_SU0_SUM1_SUS0_SPO0_SRVW0_SSO0_SVW1_SK0_SKXCCM0_TLDS0_ULSGRO0_USL1_UIOFGRO0_USFGROn1_VSn1_VWA1_VWB1_WSGRA0_WSGRB0_WS64_WG32_2_4_WGM1_WGMXCC4_WGMXCCGn1
    SolutionIndex: 137
    SolutionNameMin: Cijk_Ailk_Bjlk_S_MX_B_Bias_HA_S_SAV_UserArgs_MT192x96x32_MI16x16x1_SN_LDSB1_AFC1_AFEM1_AFEM1_ASEM1_CLR1_CADS0_DTVA0_DTVB0_EPS0_FDSI0_GRPM1_GRVWA4_GRVWB4_GSUn1_GSUAMBSK_GSUC1_GSUWGMRR1_GLS0_ISA942_IU1_K1_LBSPPA1536_LBSPPB768_LBSPPM0_LPA0_LPB16_LPM0_LRVW2_LWPMn1_MIAV0_MIWT6_3_MO40_NTn1_NTA0_NTB0_NTC0_NTD4_NTM0_NEPBS6_NLCA1_NLCB1_ONLL1_PGR2_PLR1_PKA1_SIA3_SS1_SU0_SUM1_SUS0_SPO0_SRVW0_SSO0_SVW2_SK0_SKXCCM0_TLDS0_ULSGRO0_USL1_UIOFGRO0_USFGROn1_VSn1_VWA2_VWB1_WSGRA0_WSGRB0_WS64_WG32_8_1_WGM1_WGMXCC4_WGMXCCGn1
    SolutionIndex: 138
    SolutionNameMin: Cijk_Ailk_Bjlk_S_MX_B_Bias_HA_S_SAV_UserArgs_MT128x128x32_MI32x32x1_SN_LDSB0_AFC1_AFEM1_AFEM1_ASEM1_CLR1_CADS0_DTVA0_DTVB0_EPS0_FDSI0_GRPM1_GRVWA4_GRVWB4_GSUn1_GSUAMBSK_GSUC1_GSUWGMRR1_GLS0_ISA942_IU1_K1_LBSPPA0_LBSPPB0_LBSPPM0_LPA0_LPB0_LPM0_LRVW2_LWPMn1_MIAV0_MIWT2_2_MO40_NTn1_NTA0_NTB0_NTC0_NTD4_NTM0_NEPBS8_NLCA1_NLCB1_ONLL1_PGR2_PLR1_PKA1_SIA3_SS1_SU0_SUM1_SUS0_SPO0_SRVW0_SSO0_SVW2_SK0_SKXCCM0_TLDS0_ULSGRO0_USL1_UIOFGRO0_USFGROn1_VSn1_VWA2_VWB2_WSGRA0_WSGRB0_WS64_WG64_4_1_WGM1_WGMXCC4_WGMXCCGn1
    SolutionIndex: 139
    SolutionNameMin: Cijk_Ailk_Bjlk_S_MX_B_Bias_HA_S_SAV_UserArgs_MT96x256x32_MI32x32x1_SN_LDSB1_AFC1_AFEM1_AFEM1_ASEM1_CLR1_CADS0_DTVA0_DTVB0_EPS0_FDSI0_GRPM1_GRVWA4_GRVWB4_GSUn1_GSUAMBSK_GSUC1_GSUWGMRR1_GLS0_ISA942_IU1_K1_LBSPPA0_LBSPPB0_LBSPPM0_LPA0_LPB0_LPM0_LRVW2_LWPMn1_MIAV0_MIWT3_2_MO40_NTn1_NTA0_NTB0_NTC0_NTD4_NTM0_NEPBS6_NLCA1_NLCB1_ONLL1_PGR2_PLR1_PKA1_SIA3_SS1_SU0_SUM1_SUS0_SPO0_SRVW0_SSO0_SVW1_SK0_SKXCCM0_TLDS0_ULSGRO0_USL1_UIOFGRO0_USFGROn1_VSn1_VWA1_VWB2_WSGRA0_WSGRB0_WS64_WG32_8_1_WGM1_WGMXCC4_WGMXCCGn1
    SolutionIndex: 140
    SolutionNameMin: Cijk_Ailk_Bjlk_S_MX_B_Bias_HA_S_SAV_UserArgs_MT192x256x32_MI32x32x1_SN_LDSB1_AFC1_AFEM1_AFEM1_ASEM1_CLR1_CADS0_DTVA0_DTVB0_EPS0_FDSI0_GRPM1_GRVWA4_GRVWB4_GSUn1_GSUAMBSK_GSUC1_GSUWGMRR1_GLS0_ISA942_IU1_K1_LBSPPA0_LBSPPB0_LBSPPM0_LPA0_LPB0_LPM0_LRVW2_LWPMn1_MIAV0_MIWT6_2_MO40_NTn1_NTA0_NTB0_NTC0_NTD4_NTM0_NEPBS6_NLCA1_NLCB1_ONLL1_PGR2_PLR1_PKA1_SIA3_SS1_SU0_SUM1_SUS0_SPO0_SRVW0_SSO0_SVW2_SK0_SKXCCM0_TLDS0_ULSGRO0_USL1_UIOFGRO0_USFGROn1_VSn1_VWA2_VWB2_WSGRA0_WSGRB0_WS64_WG32_8_1_WGM1_WGMXCC4_WGMXCCGn1
    SolutionIndex: 141
    SolutionNameMin: Cijk_Ailk_Bjlk_S_MX_B_Bias_HA_S_SAV_UserArgs_MT192x256x16_MI32x32x1_SN_LDSB1_AFC1_AFEM1_AFEM1_ASEM1_CLR1_CADS0_DTVA0_DTVB0_EPS0_FDSI0_GRPM1_GRVWA4_GRVWB4_GSUn1_GSUAMBSK_GSUC1_GSUWGMRR1_GLS0_ISA942_IU1_K1_LBSPPA0_LBSPPB0_LBSPPM0_LPA0_LPB0_LPM0_LRVW2_LWPMn1_MIAV0_MIWT6_2_MO40_NTn1_NTA0_NTB0_NTC0_NTD4_NTM0_NEPBS6_NLCA1_NLCB1_ONLL1_PGR2_PLR1_PKA1_SIA3_SS1_SU0_SUM1_SUS0_SPO0_SRVW0_SSO0_SVW2_SK0_SKXCCM0_TLDS0_ULSGRO0_USL1_UIOFGRO0_USFGROn1_VSn1_VWA2_VWB2_WSGRA0_WSGRB0_WS64_WG32_8_1_WGM1_WGMXCC4_WGMXCCGn1
    SolutionIndex: 142
    SolutionNameMin: Cijk_Ailk_Bjlk_S_MX_B_Bias_HA_S_SAV_UserArgs_MT96x384x32_MI32x32x1_SN_LDSB1_AFC1_AFEM1_AFEM1_ASEM1_CLR1_CADS0_DTVA0_DTVB0_EPS0_FDSI0_GRPM1_GRVWA4_GRVWB4_GSUn1_GSUAMBSK_GSUC1_GSUWGMRR1_GLS0_ISA942_IU1_K1_LBSPPA0_LBSPPB0_LBSPPM0_LPA0_LPB0_LPM0_LRVW2_LWPMn1_MIAV0_MIWT3_3_MO40_NTn1_NTA0_NTB0_NTC0_NTD4_NTM0_NEPBS6_NLCA1_NLCB1_ONLL1_PGR2_PLR1_PKA1_SIA3_SS1_SU0_SUM1_SUS0_SPO0_SRVW0_SSO0_SVW1_SK0_SKXCCM0_TLDS0_ULSGRO0_USL1_UIOFGRO0_USFGROn1_VSn1_VWA1_VWB1_WSGRA0_WSGRB0_WS64_WG32_8_1_WGM1_WGMXCC4_WGMXCCGn1
    SolutionIndex: 143
    SolutionNameMin: Cijk_Ailk_Bjlk_S_MX_B_Bias_HA_S_SAV_UserArgs_MT224x256x32_MI32x32x1_SN_LDSB1_AFC1_AFEM1_AFEM1_ASEM1_CLR1_CADS0_DTVA0_DTVB0_EPS0_FDSI0_GRPM1_GRVWA4_GRVWB4_GSUn1_GSUAMBSK_GSUC1_GSUWGMRR1_GLS0_ISA942_IU1_K1_LBSPPA0_LBSPPB0_LBSPPM0_LPA0_LPB0_LPM0_LRVW2_LWPMn1_MIAV0_MIWT7_2_MO40_NTn1_NTA0_NTB0_NTC0_NTD4_NTM0_NEPBS7_NLCA1_NLCB1_ONLL1_PGR2_PLR1_PKA1_SIA3_SS1_SU0_SUM1_SUS0_SPO0_SRVW0_SSO0_SVW1_SK0_SKXCCM0_TLDS0_ULSGRO0_USL1_UIOFGRO0_USFGROn1_VSn1_VWA1_VWB2_WSGRA0_WSGRB0_WS64_WG32_8_1_WGM1_WGMXCC4_WGMXCCGn1
    SolutionIndex: 144
    SolutionNameMin: Cijk_Ailk_Bjlk_S_MX_B_Bias_HA_S_SAV_UserArgs_MT64x80x64_MI16x16x1_SN_LDSB1_AFC1_AFEM1_AFEM1_ASEM1_CLR1_CADS0_DTVA0_DTVB0_EPS0_FDSI0_GRPM1_GRVWA4_GRVWB4_GSUn1_GSUAMBSK_GSUC1_GSUWGMRR1_GLS0_ISA942_IU1_K1_LBSPPA512_LBSPPB640_LBSPPM0_LPA0_LPB16_LPM0_LRVW2_LWPMn1_MIAV0_MIWT2_5_MO40_NTn1_NTA0_NTB0_NTC0_NTD4_NTM0_NEPBS8_NLCA1_NLCB1_ONLL1_PGR2_PLR1_PKA1_SIA3_SS1_SU0_SUM1_SUS0_SPO0_SRVW0_SSO0_SVW2_SK0_SKXCCM0_TLDS0_ULSGRO0_USL1_UIOFGRO0_USFGROn1_VSn1_VWA2_VWB1_WSGRA0_WSGRB0_WS64_WG32_4_2_WGM1_WGMXCC4_WGMXCCGn1
    SolutionIndex: 145
    SolutionNameMin: Cijk_Ailk_Bjlk_S_MX_B_Bias_HA_S_SAV_UserArgs_MT256x192x16_MI32x32x1_SN_LDSB1_AFC1_AFEM1_AFEM1_ASEM1_CLR1_CADS0_DTVA0_DTVB0_EPS0_FDSI0_GRPM1_GRVWA4_GRVWB4_GSUn1_GSUAMBSK_GSUC1_GSUWGMRR1_GLS0_ISA942_IU1_K1_LBSPPA0_LBSPPB0_LBSPPM0_LPA0_LPB0_LPM0_LRVW2_LWPMn1_MIAV0_MIWT2_6_MO40_NTn1_NTA0_NTB0_NTC0_NTD4_NTM0_NEPBS8_NLCA1_NLCB1_ONLL1_PGR2_PLR1_PKA1_SIA3_SS1_SU0_SUM1_SUS0_SPO0_SRVW0_SSO0_SVW2_SK0_SKXCCM0_TLDS0_ULSGRO0_USL1_UIOFGRO0_USFGROn1_VSn1_VWA2_VWB2_WSGRA0_WSGRB0_WS64_WG128_2_1_WGM1_WGMXCC4_WGMXCCGn1
    SolutionIndex: 146
    SolutionNameMin: Cijk_Ailk_Bjlk_S_MX_B_Bias_HA_S_SAV_UserArgs_MT160x256x32_MI32x32x1_SN_LDSB1_AFC1_AFEM1_AFEM1_ASEM1_CLR1_CADS0_DTVA0_DTVB0_EPS0_FDSI0_GRPM1_GRVWA4_GRVWB4_GSUn1_GSUAMBSK_GSUC1_GSUWGMRR1_GLS0_ISA942_IU1_K1_LBSPPA0_LBSPPB0_LBSPPM0_LPA0_LPB0_LPM0_LRVW2_LWPMn1_MIAV0_MIWT5_2_MO40_NTn1_NTA0_NTB0_NTC0_NTD4_NTM0_NEPBS5_NLCA1_NLCB1_ONLL1_PGR2_PLR1_PKA1_SIA3_SS1_SU0_SUM1_SUS0_SPO0_SRVW0_SSO0_SVW1_SK0_SKXCCM0_TLDS0_ULSGRO0_USL1_UIOFGRO0_USFGROn1_VSn1_VWA1_VWB2_WSGRA0_WSGRB0_WS64_WG32_8_1_WGM1_WGMXCC4_WGMXCCGn1
    SolutionIndex: 147
    SolutionNameMin: Cijk_Ailk_Bjlk_S_MX_B_Bias_HA_S_SAV_UserArgs_MT128x80x64_MI16x16x1_SN_LDSB1_AFC1_AFEM1_AFEM1_ASEM1_CLR1_CADS0_DTVA0_DTVB0_EPS0_FDSI0_GRPM1_GRVWA4_GRVWB4_GSUn1_GSUAMBSK_GSUC1_GSUWGMRR1_GLS0_ISA942_IU1_K1_LBSPPA1024_LBSPPB640_LBSPPM0_LPA0_LPB16_LPM0_LRVW2_LWPMn1_MIAV0_MIWT2_5_MO40_NTn1_NTA0_NTB0_NTC0_NTD4_NTM0_NEPBS8_NLCA1_NLCB1_ONLL1_PGR2_PLR1_PKA1_SIA3_SS1_SU0_SUM1_SUS0_SPO0_SRVW0_SSO0_SVW2_SK0_SKXCCM0_TLDS0_ULSGRO0_USL1_UIOFGRO0_USFGROn1_VSn1_VWA2_VWB1_WSGRA0_WSGRB0_WS64_WG64_4_1_WGM1_WGMXCC4_WGMXCCGn1
    SolutionIndex: 148
    SolutionNameMin: Cijk_Ailk_Bjlk_S_MX_B_Bias_HA_S_SAV_UserArgs_MT160x192x32_MI16x16x1_SN_LDSB1_AFC1_AFEM1_AFEM1_ASEM1_CLR1_CADS0_DTVA0_DTVB0_EPS0_FDSI0_GRPM1_GRVWA4_GRVWB4_GSUn1_GSUAMBSK_GSUC1_GSUWGMRR1_GLS0_ISA942_IU1_K1_LBSPPA1280_LBSPPB1536_LBSPPM0_LPA16_LPB0_LPM0_LRVW2_LWPMn1_MIAV0_MIWT5_6_MO40_NTn1_NTA0_NTB0_NTC0_NTD4_NTM0_NEPBS5_NLCA1_NLCB1_ONLL1_PGR2_PLR1_PKA1_SIA3_SS1_SU0_SUM1_SUS0_SPO0_SRVW0_SSO0_SVW1_SK0_SKXCCM0_TLDS0_ULSGRO0_USL1_UIOFGRO0_USFGROn1_VSn1_VWA1_VWB2_WSGRA0_WSGRB0_WS64_WG32_8_1_WGM1_WGMXCC4_WGMXCCGn1
    SolutionIndex: 149
    SolutionNameMin: Cijk_Ailk_Bjlk_S_MX_B_Bias_HA_S_SAV_UserArgs_MT224x128x32_MI32x32x1_SN_LDSB1_AFC1_AFEM1_AFEM1_ASEM1_CLR1_CADS0_DTVA0_DTVB0_EPS0_FDSI0_GRPM1_GRVWA4_GRVWB4_GSUn1_GSUAMBSK_GSUC1_GSUWGMRR1_GLS0_ISA942_IU1_K1_LBSPPA0_LBSPPB0_LBSPPM0_LPA0_LPB0_LPM0_LRVW2_LWPMn1_MIAV0_MIWT7_1_MO40_NTn1_NTA0_NTB0_NTC0_NTD4_NTM0_NEPBS7_NLCA1_NLCB1_ONLL1_PGR2_PLR1_PKA1_SIA3_SS1_SU0_SUM1_SUS0_SPO0_SRVW0_SSO0_SVW1_SK0_SKXCCM0_TLDS0_ULSGRO0_USL1_UIOFGRO0_USFGROn1_VSn1_VWA1_VWB1_WSGRA0_WSGRB0_WS64_WG32_8_1_WGM1_WGMXCC4_WGMXCCGn1
    SolutionIndex: 150
    SolutionNameMin: Cijk_Ailk_Bjlk_S_MX_B_Bias_HA_S_SAV_UserArgs_MT320x128x32_MI32x32x1_SN_LDSB1_AFC1_AFEM1_AFEM1_ASEM1_CLR1_CADS0_DTVA0_DTVB0_EPS0_FDSI0_GRPM1_GRVWA4_GRVWB4_GSUn1_GSUAMBSK_GSUC1_GSUWGMRR1_GLS0_ISA942_IU1_K1_LBSPPA0_LBSPPB0_LBSPPM0_LPA0_LPB0_LPM0_LRVW2_LWPMn1_MIAV0_MIWT5_2_MO40_NTn1_NTA0_NTB0_NTC0_NTD4_NTM0_NEPBS5_NLCA1_NLCB1_ONLL1_PGR2_PLR1_PKA1_SIA3_SS1_SU0_SUM1_SUS0_SPO0_SRVW0_SSO0_SVW1_SK0_SKXCCM0_TLDS0_ULSGRO0_USL1_UIOFGRO0_USFGROn1_VSn1_VWA1_VWB2_WSGRA0_WSGRB0_WS64_WG64_4_1_WGM1_WGMXCC4_WGMXCCGn1
    SolutionIndex: 151
    SolutionNameMin: Cijk_Ailk_Bjlk_S_MX_B_Bias_HA_S_SAV_UserArgs_MT320x128x16_MI16x16x1_SN_LDSB1_AFC1_AFEM1_AFEM1_ASEM1_CLR1_CADS0_DTVA0_DTVB0_EPS0_FDSI0_GRPM1_GRVWA4_GRVWB4_GSUn1_GSUAMBSK_GSUC1_GSUWGMRR1_GLS0_ISA942_IU1_K1_LBSPPA2560_LBSPPB1024_LBSPPM0_LPA16_LPB0_LPM0_LRVW2_LWPMn1_MIAV0_MIWT5_8_MO40_NTn1_NTA0_NTB0_NTC0_NTD4_NTM0_NEPBS5_NLCA1_NLCB1_ONLL1_PGR2_PLR1_PKA1_SIA3_SS1_SU0_SUM1_SUS0_SPO0_SRVW0_SSO0_SVW1_SK0_SKXCCM0_TLDS0_ULSGRO0_USL1_UIOFGRO0_USFGROn1_VSn1_VWA1_VWB4_WSGRA0_WSGRB0_WS64_WG64_4_1_WGM1_WGMXCC4_WGMXCCGn1
    SolutionIndex: 152
    SolutionNameMin: Cijk_Ailk_Bjlk_S_MX_B_Bias_HA_S_SAV_UserArgs_MT16x128x64_MI16x16x1_SN_LDSB1_AFC1_AFEM1_AFEM1_ASEM1_CLR1_CADS0_DTVA0_DTVB0_EPS0_FDSI0_GRPM1_GRVWA1_GRVWB4_GSUn1_GSUAMBSK_GSUC1_GSUWGMRR1_GLS0_ISA942_IU1_K1_LBSPPA128_LBSPPB1024_LBSPPM0_LPA16_LPB0_LPM0_LRVW2_LWPMn1_MIAV0_MIWT1_2_MO40_NTn1_NTA0_NTB0_NTC0_NTD4_NTM0_NEPBS8_NLCA1_NLCB1_ONLL1_PGR2_PLR1_PKA1_SIA3_SS1_SU0_SUM1_SUS0_SPO0_SRVW0_SSO0_SVW1_SK0_SKXCCM0_TLDS0_ULSGRO0_USL1_UIOFGRO0_USFGROn1_VSn1_VWA1_VWB2_WSGRA0_WSGRB0_WS64_WG16_16_1_WGM1_WGMXCC4_WGMXCCGn1
    SolutionIndex: 153
    SolutionNameMin: Cijk_Ailk_Bjlk_S_MX_B_Bias_HA_S_SAV_UserArgs_MT16x16x128_MI16x16x1_SN_LDSB1_AFC1_AFEM1_AFEM1_ASEM1_CLR1_CADS0_DTVA0_DTVB0_EPS0_FDSI0_GRPM1_GRVWA1_GRVWB4_GSUn1_GSUAMBSK_GSUC1_GSUWGMRR1_GLS0_ISA942_IU1_K1_LBSPPA128_LBSPPB128_LBSPPM0_LPA16_LPB16_LPM0_LRVW2_LWPMn1_MIAV0_MIWT1_1_MO40_NTn1_NTA0_NTB0_NTC0_NTD4_NTM0_NEPBS8_NLCA1_NLCB1_ONLL1_PGR2_PLR1_PKA1_SIA3_SS1_SU0_SUM1_SUS0_SPO0_SRVW0_SSO0_SVW1_SK0_SKXCCM0_TLDS0_ULSGRO0_USL1_UIOFGRO0_USFGROn1_VSn1_VWA1_VWB1_WSGRA0_WSGRB0_WS64_WG16_4_4_WGM1_WGMXCC4_WGMXCCGn1
    SolutionIndex: 154
    SolutionNameMin: Cijk_Ailk_Bjlk_S_MX_B_Bias_HA_S_SAV_UserArgs_MT16x192x64_MI16x16x1_SN_LDSB1_AFC1_AFEM1_AFEM1_ASEM1_CLR1_CADS0_DTVA0_DTVB0_EPS0_FDSI0_GRPM1_GRVWA1_GRVWB4_GSUn1_GSUAMBSK_GSUC1_GSUWGMRR1_GLS0_ISA942_IU1_K1_LBSPPA128_LBSPPB1536_LBSPPM0_LPA16_LPB16_LPM0_LRVW2_LWPMn1_MIAV0_MIWT1_3_MO40_NTn1_NTA0_NTB0_NTC0_NTD4_NTM0_NEPBS8_NLCA1_NLCB1_ONLL1_PGR2_PLR1_PKA1_SIA3_SS1_SU0_SUM1_SUS0_SPO0_SRVW0_SSO0_SVW1_SK0_SKXCCM0_TLDS0_ULSGRO0_USL1_UIOFGRO0_USFGROn1_VSn1_VWA1_VWB1_WSGRA0_WSGRB0_WS64_WG16_16_1_WGM1_WGMXCC4_WGMXCCGn1
    SolutionIndex: 155
    SolutionNameMin: Cijk_Ailk_Bjlk_S_MX_B_Bias_HA_S_SAV_UserArgs_MT16x64x64_MI16x16x1_SN_LDSB1_AFC1_AFEM1_AFEM1_ASEM1_CLR1_CADS0_DTVA0_DTVB0_EPS0_FDSI0_GRPM1_GRVWA4_GRVWB4_GSUn1_GSUAMBSK_GSUC1_GSUWGMRR1_GLS0_ISA942_IU1_K1_LBSPPA128_LBSPPB512_LBSPPM0_LPA16_LPB16_LPM0_LRVW2_LWPMn1_MIAV0_MIWT1_1_MO40_NTn1_NTA0_NTB0_NTC0_NTD4_NTM0_NEPBS8_NLCA1_NLCB1_ONLL1_PGR2_PLR1_PKA1_SIA3_SS1_SU0_SUM1_SUS0_SPO0_SRVW0_SSO0_SVW1_SK0_SKXCCM0_TLDS0_ULSGRO0_USL1_UIOFGRO0_USFGROn1_VSn1_VWA1_VWB1_WSGRA0_WSGRB0_WS64_WG16_16_1_WGM1_WGMXCC4_WGMXCCGn1
    SolutionIndex: 156
    SolutionNameMin: Cijk_Ailk_Bjlk_S_MX_B_Bias_HA_S_SAV_UserArgs_MT16x128x64_MI16x16x1_SN_LDSB1_AFC1_AFEM1_AFEM1_ASEM1_CLR1_CADS0_DTVA0_DTVB0_EPS0_FDSI0_GRPM1_GRVWA4_GRVWB4_GSUn1_GSUAMBSK_GSUC1_GSUWGMRR1_GLS0_ISA942_IU1_K1_LBSPPA128_LBSPPB1024_LBSPPM0_LPA16_LPB0_LPM0_LRVW2_LWPMn1_MIAV0_MIWT1_2_MO40_NTn1_NTA0_NTB0_NTC0_NTD4_NTM0_NEPBS8_NLCA1_NLCB1_ONLL1_PGR2_PLR1_PKA1_SIA3_SS1_SU0_SUM1_SUS0_SPO0_SRVW0_SSO0_SVW1_SK0_SKXCCM0_TLDS0_ULSGRO0_USL1_UIOFGRO0_USFGROn1_VSn1_VWA1_VWB2_WSGRA0_WSGRB0_WS64_WG16_16_1_WGM1_WGMXCC4_WGMXCCGn1
    SolutionIndex: 157
    SolutionNameMin: Cijk_Ailk_Bjlk_S_MX_B_Bias_HA_S_SAV_UserArgs_MT32x128x32_MI32x32x1_SN_LDSB1_AFC1_AFEM1_AFEM1_ASEM1_CLR1_CADS0_DTVA0_DTVB0_EPS0_FDSI0_GRPM1_GRVWA4_GRVWB4_GSUn1_GSUAMBSK_GSUC1_GSUWGMRR1_GLS0_ISA942_IU1_K1_LBSPPA0_LBSPPB0_LBSPPM0_LPA0_LPB0_LPM0_LRVW2_LWPMn1_MIAV0_MIWT1_1_MO40_NTn1_NTA0_NTB0_NTC0_NTD4_NTM0_NEPBS8_NLCA1_NLCB1_ONLL1_PGR2_PLR1_PKA1_SIA3_SS1_SU0_SUM1_SUS0_SPO0_SRVW0_SSO0_SVW1_SK0_SKXCCM0_TLDS0_ULSGRO0_USL1_UIOFGRO0_USFGROn1_VSn1_VWA1_VWB1_WSGRA0_WSGRB0_WS64_WG32_8_1_WGM1_WGMXCC4_WGMXCCGn1
    SolutionIndex: 158
    SolutionNameMin: Cijk_Ailk_Bjlk_S_MX_B_Bias_HA_S_SAV_UserArgs_MT16x192x64_MI16x16x1_SN_LDSB1_AFC1_AFEM1_AFEM1_ASEM1_CLR1_CADS0_DTVA0_DTVB0_EPS0_FDSI0_GRPM1_GRVWA4_GRVWB4_GSUn1_GSUAMBSK_GSUC1_GSUWGMRR1_GLS0_ISA942_IU1_K1_LBSPPA128_LBSPPB1536_LBSPPM0_LPA16_LPB16_LPM0_LRVW2_LWPMn1_MIAV0_MIWT1_3_MO40_NTn1_NTA0_NTB0_NTC0_NTD4_NTM0_NEPBS8_NLCA1_NLCB1_ONLL1_PGR2_PLR1_PKA1_SIA3_SS1_SU0_SUM1_SUS0_SPO0_SRVW0_SSO0_SVW1_SK0_SKXCCM0_TLDS0_ULSGRO0_USL1_UIOFGRO0_USFGROn1_VSn1_VWA1_VWB1_WSGRA0_WSGRB0_WS64_WG16_16_1_WGM1_WGMXCC4_WGMXCCGn1
    SolutionIndex: 159
    SolutionNameMin: Cijk_Ailk_Bjlk_S_MX_B_Bias_HA_S_SAV_UserArgs_MT64x128x64_MI32x32x1_SN_LDSB1_AFC1_AFEM1_AFEM1_ASEM1_CLR1_CADS0_DTVA0_DTVB0_EPS0_FDSI0_GRPM1_GRVWA4_GRVWB4_GSUn1_GSUAMBSK_GSUC1_GSUWGMRR1_GLS0_ISA942_IU1_K1_LBSPPA0_LBSPPB0_LBSPPM0_LPA0_LPB0_LPM0_LRVW2_LWPMn1_MIAV0_MIWT1_2_MO40_NTn1_NTA0_NTB0_NTC0_NTD4_NTM0_NEPBS8_NLCA1_NLCB1_ONLL1_PGR2_PLR1_PKA1_SIA3_SS1_SU0_SUM1_SUS0_SPO0_SRVW0_SSO0_SVW1_SK0_SKXCCM0_TLDS0_ULSGRO0_USL1_UIOFGRO0_USFGROn1_VSn1_VWA1_VWB2_WSGRA0_WSGRB0_WS64_WG64_4_1_WGM1_WGMXCC4_WGMXCCGn1
    SolutionIndex: 160
    SolutionNameMin: Cijk_Ailk_Bjlk_S_MX_B_Bias_HA_S_SAV_UserArgs_MT64x128x32_MI32x32x1_SN_LDSB1_AFC1_AFEM1_AFEM1_ASEM1_CLR1_CADS0_DTVA0_DTVB0_EPS0_FDSI0_GRPM1_GRVWA4_GRVWB4_GSUn1_GSUAMBSK_GSUC1_GSUWGMRR1_GLS0_ISA942_IU1_K1_LBSPPA0_LBSPPB0_LBSPPM0_LPA0_LPB0_LPM0_LRVW2_LWPMn1_MIAV0_MIWT1_2_MO40_NTn1_NTA0_NTB0_NTC0_NTD4_NTM0_NEPBS8_NLCA1_NLCB1_ONLL1_PGR2_PLR1_PKA1_SIA3_SS1_SU0_SUM1_SUS0_SPO0_SRVW0_SSO0_SVW1_SK0_SKXCCM0_TLDS0_ULSGRO0_USL1_UIOFGRO0_USFGROn1_VSn1_VWA1_VWB2_WSGRA0_WSGRB0_WS64_WG64_4_1_WGM1_WGMXCC4_WGMXCCGn1
    SolutionIndex: 161
    SolutionNameMin: Cijk_Ailk_Bjlk_S_MX_B_Bias_HA_S_SAV_UserArgs_MT64x192x32_MI32x32x1_SN_LDSB1_AFC1_AFEM1_AFEM1_ASEM1_CLR1_CADS0_DTVA0_DTVB0_EPS0_FDSI0_GRPM1_GRVWA4_GRVWB4_GSUn1_GSUAMBSK_GSUC1_GSUWGMRR1_GLS0_ISA942_IU1_K1_LBSPPA0_LBSPPB0_LBSPPM0_LPA0_LPB0_LPM0_LRVW2_LWPMn1_MIAV0_MIWT1_3_MO40_NTn1_NTA0_NTB0_NTC0_NTD4_NTM0_NEPBS8_NLCA1_NLCB1_ONLL1_PGR2_PLR1_PKA1_SIA3_SS1_SU0_SUM1_SUS0_SPO0_SRVW0_SSO0_SVW1_SK0_SKXCCM0_TLDS0_ULSGRO0_USL1_UIOFGRO0_USFGROn1_VSn1_VWA1_VWB1_WSGRA0_WSGRB0_WS64_WG64_4_1_WGM1_WGMXCC4_WGMXCCGn1
    SolutionIndex: 162
    SolutionNameMin: Cijk_Ailk_Bjlk_S_MX_B_Bias_HA_S_SAV_UserArgs_MT96x192x32_MI16x16x1_SN_LDSB1_AFC1_AFEM1_AFEM1_ASEM1_CLR1_CADS0_DTVA0_DTVB0_EPS0_FDSI0_GRPM1_GRVWA4_GRVWB4_GSUn1_GSUAMBSK_GSUC1_GSUWGMRR1_GLS0_ISA942_IU1_K1_LBSPPA768_LBSPPB1536_LBSPPM0_LPA0_LPB16_LPM0_LRVW2_LWPMn1_MIAV0_MIWT6_3_MO40_NTn1_NTA0_NTB0_NTC0_NTD4_NTM0_NEPBS6_NLCA1_NLCB1_ONLL1_PGR2_PLR1_PKA1_SIA3_SS1_SU0_SUM1_SUS0_SPO0_SRVW0_SSO0_SVW2_SK0_SKXCCM0_TLDS0_ULSGRO0_USL1_UIOFGRO0_USFGROn1_VSn1_VWA2_VWB1_WSGRA0_WSGRB0_WS64_WG16_16_1_WGM1_WGMXCC4_WGMXCCGn1
    SolutionIndex: 163
    SolutionNameMin: Cijk_Ailk_Bjlk_S_MX_B_Bias_HA_S_SAV_UserArgs_MT96x128x64_MI32x32x1_SN_LDSB1_AFC1_AFEM1_AFEM1_ASEM1_CLR1_CADS0_DTVA0_DTVB0_EPS0_FDSI0_GRPM1_GRVWA4_GRVWB4_GSUn1_GSUAMBSK_GSUC1_GSUWGMRR1_GLS0_ISA942_IU1_K1_LBSPPA0_LBSPPB0_LBSPPM0_LPA0_LPB0_LPM0_LRVW2_LWPMn1_MIAV0_MIWT3_1_MO40_NTn1_NTA0_NTB0_NTC0_NTD4_NTM0_NEPBS6_NLCA1_NLCB1_ONLL1_PGR2_PLR1_PKA1_SIA3_SS1_SU0_SUM1_SUS0_SPO0_SRVW0_SSO0_SVW1_SK0_SKXCCM0_TLDS0_ULSGRO0_USL1_UIOFGRO0_USFGROn1_VSn1_VWA1_VWB1_WSGRA0_WSGRB0_WS64_WG32_8_1_WGM1_WGMXCC4_WGMXCCGn1
    SolutionIndex: 164
    SolutionNameMin: Cijk_Ailk_Bjlk_S_MX_B_Bias_HA_S_SAV_UserArgs_MT256x160x32_MI32x32x1_SN_LDSB1_AFC1_AFEM1_AFEM1_ASEM1_CLR1_CADS0_DTVA0_DTVB0_EPS0_FDSI0_GRPM1_GRVWA4_GRVWB4_GSUn1_GSUAMBSK_GSUC1_GSUWGMRR1_GLS0_ISA942_IU1_K1_LBSPPA0_LBSPPB0_LBSPPM0_LPA0_LPB0_LPM0_LRVW2_LWPMn1_MIAV0_MIWT2_5_MO40_NTn1_NTA0_NTB0_NTC0_NTD4_NTM0_NEPBS8_NLCA1_NLCB1_ONLL1_PGR2_PLR1_PKA1_SIA3_SS1_SU0_SUM1_SUS0_SPO0_SRVW0_SSO0_SVW2_SK0_SKXCCM0_TLDS0_ULSGRO0_USL1_UIOFGRO0_USFGROn1_VSn1_VWA2_VWB1_WSGRA0_WSGRB0_WS64_WG128_2_1_WGM1_WGMXCC4_WGMXCCGn1
    SolutionIndex: 165
    SolutionNameMin: Cijk_Ailk_Bjlk_S_MX_B_Bias_HA_S_SAV_UserArgs_MT192x320x16_MI32x32x1_SN_LDSB1_AFC1_AFEM1_AFEM1_ASEM1_CLR1_CADS0_DTVA0_DTVB0_EPS0_FDSI0_GRPM1_GRVWA4_GRVWB4_GSUn1_GSUAMBSK_GSUC1_GSUWGMRR1_GLS0_ISA942_IU1_K1_LBSPPA0_LBSPPB0_LBSPPM0_LPA0_LPB0_LPM0_LRVW2_LWPMn1_MIAV0_MIWT3_5_MO40_NTn1_NTA0_NTB0_NTC0_NTD4_NTM0_NEPBS6_NLCA1_NLCB1_ONLL1_PGR2_PLR1_PKA1_SIA3_SS1_SU0_SUM1_SUS0_SPO0_SRVW0_SSO0_SVW1_SK0_SKXCCM0_TLDS0_ULSGRO0_USL1_UIOFGRO0_USFGROn1_VSn1_VWA1_VWB1_WSGRA0_WSGRB0_WS64_WG64_4_1_WGM1_WGMXCC4_WGMXCCGn1
    SolutionIndex: 166
    SolutionNameMin: Cijk_Ailk_Bjlk_S_MX_B_Bias_HA_S_SAV_UserArgs_MT160x160x32_MI16x16x1_SN_LDSB1_AFC1_AFEM1_AFEM1_ASEM1_CLR1_CADS0_DTVA0_DTVB0_EPS0_FDSI0_GRPM1_GRVWA4_GRVWB4_GSUn1_GSUAMBSK_GSUC1_GSUWGMRR1_GLS0_ISA942_IU1_K1_LBSPPA1280_LBSPPB1280_LBSPPM0_LPA16_LPB16_LPM0_LRVW2_LWPMn1_MIAV0_MIWT5_5_MO40_NTn1_NTA0_NTB0_NTC0_NTD4_NTM0_NEPBS5_NLCA1_NLCB1_ONLL1_PGR2_PLR1_PKA1_SIA3_SS1_SU0_SUM1_SUS0_SPO0_SRVW0_SSO0_SVW1_SK0_SKXCCM0_TLDS0_ULSGRO0_USL1_UIOFGRO0_USFGROn1_VSn1_VWA1_VWB1_WSGRA0_WSGRB0_WS64_WG32_8_1_WGM1_WGMXCC4_WGMXCCGn1
    SolutionIndex: 167
    SolutionNameMin: Cijk_Ailk_Bjlk_S_MX_B_Bias_HA_S_SAV_UserArgs_MT128x320x32_MI32x32x1_SN_LDSB1_AFC1_AFEM1_AFEM1_ASEM1_CLR1_CADS0_DTVA0_DTVB0_EPS0_FDSI0_GRPM1_GRVWA4_GRVWB4_GSUn1_GSUAMBSK_GSUC1_GSUWGMRR1_GLS0_ISA942_IU1_K1_LBSPPA0_LBSPPB0_LBSPPM0_LPA0_LPB0_LPM0_LRVW2_LWPMn1_MIAV0_MIWT2_5_MO40_NTn1_NTA0_NTB0_NTC0_NTD4_NTM0_NEPBS8_NLCA1_NLCB1_ONLL1_PGR2_PLR1_PKA1_SIA3_SS1_SU0_SUM1_SUS0_SPO0_SRVW0_SSO0_SVW2_SK0_SKXCCM0_TLDS0_ULSGRO0_USL1_UIOFGRO0_USFGROn1_VSn1_VWA2_VWB1_WSGRA0_WSGRB0_WS64_WG64_4_1_WGM1_WGMXCC4_WGMXCCGn1
    SolutionIndex: 168
    SolutionNameMin: Cijk_Ailk_Bjlk_S_MX_B_Bias_HA_S_SAV_UserArgs_MT96x64x64_MI16x16x1_SN_LDSB1_AFC1_AFEM1_AFEM1_ASEM1_CLR1_CADS0_DTVA0_DTVB0_EPS0_FDSI0_GRPM1_GRVWA4_GRVWB4_GSUn1_GSUAMBSK_GSUC1_GSUWGMRR1_GLS0_ISA942_IU1_K1_LBSPPA768_LBSPPB512_LBSPPM0_LPA16_LPB0_LPM0_LRVW2_LWPMn1_MIAV0_MIWT3_2_MO40_NTn1_NTA0_NTB0_NTC0_NTD4_NTM0_NEPBS6_NLCA1_NLCB1_ONLL1_PGR2_PLR1_PKA1_SIA3_SS1_SU0_SUM1_SUS0_SPO0_SRVW0_SSO0_SVW1_SK0_SKXCCM0_TLDS0_ULSGRO0_USL1_UIOFGRO0_USFGROn1_VSn1_VWA1_VWB2_WSGRA0_WSGRB0_WS64_WG32_8_1_WGM1_WGMXCC4_WGMXCCGn1
    SolutionIndex: 169
    SolutionNameMin: Cijk_Ailk_Bjlk_S_MX_B_Bias_HA_S_SAV_UserArgs_MT256x224x32_MI32x32x1_SN_LDSB1_AFC1_AFEM1_AFEM1_ASEM1_CLR1_CADS0_DTVA0_DTVB0_EPS0_FDSI0_GRPM1_GRVWA4_GRVWB4_GSUn1_GSUAMBSK_GSUC1_GSUWGMRR1_GLS0_ISA942_IU1_K1_LBSPPA0_LBSPPB0_LBSPPM0_LPA0_LPB0_LPM0_LRVW2_LWPMn1_MIAV0_MIWT2_7_MO40_NTn1_NTA0_NTB0_NTC0_NTD4_NTM0_NEPBS8_NLCA1_NLCB1_ONLL1_PGR2_PLR1_PKA1_SIA3_SS1_SU0_SUM1_SUS0_SPO0_SRVW0_SSO0_SVW2_SK0_SKXCCM0_TLDS0_ULSGRO0_USL1_UIOFGRO0_USFGROn1_VSn1_VWA2_VWB1_WSGRA0_WSGRB0_WS64_WG128_2_1_WGM1_WGMXCC4_WGMXCCGn1
    SolutionIndex: 170
    SolutionNameMin: Cijk_Ailk_Bjlk_S_MX_B_Bias_HA_S_SAV_UserArgs_MT128x160x32_MI16x16x1_SN_LDSB1_AFC1_AFEM1_AFEM1_ASEM1_CLR1_CADS0_DTVA0_DTVB0_EPS0_FDSI0_GRPM1_GRVWA4_GRVWB4_GSUn1_GSUAMBSK_GSUC1_GSUWGMRR1_GLS0_ISA942_IU1_K1_LBSPPA1024_LBSPPB1280_LBSPPM0_LPA0_LPB16_LPM0_LRVW2_LWPMn1_MIAV0_MIWT4_5_MO40_NTn1_NTA0_NTB0_NTC0_NTD4_NTM0_NEPBS8_NLCA1_NLCB1_ONLL1_PGR2_PLR1_PKA1_SIA3_SS1_SU0_SUM1_SUS0_SPO0_SRVW0_SSO0_SVW4_SK0_SKXCCM0_TLDS0_ULSGRO0_USL1_UIOFGRO0_USFGROn1_VSn1_VWA4_VWB1_WSGRA0_WSGRB0_WS64_WG32_8_1_WGM1_WGMXCC4_WGMXCCGn1
    SolutionIndex: 171
    SolutionNameMin: Cijk_Ailk_Bjlk_S_MX_B_Bias_HA_S_SAV_UserArgs_MT192x160x32_MI16x16x1_SN_LDSB1_AFC1_AFEM1_AFEM1_ASEM1_CLR1_CADS0_DTVA0_DTVB0_EPS0_FDSI0_GRPM1_GRVWA4_GRVWB4_GSUn1_GSUAMBSK_GSUC1_GSUWGMRR1_GLS0_ISA942_IU1_K1_LBSPPA1536_LBSPPB1280_LBSPPM0_LPA0_LPB16_LPM0_LRVW2_LWPMn1_MIAV0_MIWT6_5_MO40_NTn1_NTA0_NTB0_NTC0_NTD4_NTM0_NEPBS6_NLCA1_NLCB1_ONLL1_PGR2_PLR1_PKA1_SIA3_SS1_SU0_SUM1_SUS0_SPO0_SRVW0_SSO0_SVW2_SK0_SKXCCM0_TLDS0_ULSGRO0_USL1_UIOFGRO0_USFGROn1_VSn1_VWA2_VWB1_WSGRA0_WSGRB0_WS64_WG32_8_1_WGM1_WGMXCC4_WGMXCCGn1
    SolutionIndex: 172
    SolutionNameMin: Cijk_Ailk_Bjlk_S_MX_B_Bias_HA_S_SAV_UserArgs_MT128x128x16_MI32x32x1_SN_LDSB1_AFC1_AFEM1_AFEM1_ASEM1_CLR1_CADS0_DTVA0_DTVB0_EPS0_FDSI0_GRPM1_GRVWA4_GRVWB4_GSUn1_GSUAMBSK_GSUC1_GSUWGMRR1_GLS0_ISA942_IU1_K1_LBSPPA0_LBSPPB0_LBSPPM0_LPA0_LPB0_LPM0_LRVW2_LWPMn1_MIAV0_MIWT2_2_MO40_NTn1_NTA0_NTB0_NTC0_NTD4_NTM0_NEPBS8_NLCA1_NLCB1_ONLL1_PGR2_PLR1_PKA1_SIA3_SS1_SU0_SUM1_SUS0_SPO0_SRVW0_SSO0_SVW2_SK0_SKXCCM0_TLDS0_ULSGRO0_USL1_UIOFGRO0_USFGROn1_VSn1_VWA2_VWB2_WSGRA0_WSGRB0_WS64_WG64_4_1_WGM1_WGMXCC4_WGMXCCGn1
    SolutionIndex: 173
    SolutionNameMin: Cijk_Ailk_Bjlk_S_MX_B_Bias_HA_S_SAV_UserArgs_MT128x128x16_MI32x32x1_SN_LDSB1_AFC1_AFEM1_AFEM1_ASEM1_CLR1_CADS0_DTVA0_DTVB0_EPS0_FDSI0_GRPM1_GRVWA4_GRVWB4_GSUn1_GSUAMBSK_GSUC1_GSUWGMRR1_GLS0_ISA942_IU1_K1_LBSPPA0_LBSPPB0_LBSPPM0_LPA0_LPB0_LPM0_LRVW2_LWPMn1_MIAV0_MIWT2_2_MO40_NTn1_NTA0_NTB0_NTC0_NTD4_NTM0_NEPBS8_NLCA1_NLCB1_ONLL1_PGR2_PLR1_PKA1_SIA3_SS1_SU0_SUM1_SUS0_SPO0_SRVW0_SSO4_SVW2_SK0_SKXCCM0_TLDS0_ULSGRO0_USL1_UIOFGRO0_USFGROn1_VSn1_VWA2_VWB2_WSGRA0_WSGRB0_WS64_WG64_4_1_WGM1_WGMXCC4_WGMXCCGn1
    SolutionIndex: 174
    SolutionNameMin: Cijk_Ailk_Bjlk_S_MX_B_Bias_HA_S_SAV_UserArgs_MT224x256x32_MI32x32x1_SN_LDSB1_AFC1_AFEM1_AFEM1_ASEM1_CLR1_CADS0_DTVA0_DTVB0_EPS0_FDSI0_GRPM1_GRVWA4_GRVWB4_GSUn1_GSUAMBSK_GSUC1_GSUWGMRR1_GLS0_ISA942_IU1_K1_LBSPPA0_LBSPPB0_LBSPPM0_LPA0_LPB0_LPM0_LRVW2_LWPMn1_MIAV0_MIWT7_2_MO40_NTn1_NTA0_NTB0_NTC0_NTD4_NTM0_NEPBS7_NLCA1_NLCB1_ONLL1_PGR2_PLR1_PKA1_SIA3_SS1_SU0_SUM1_SUS0_SPO0_SRVW0_SSO4_SVW1_SK0_SKXCCM0_TLDS0_ULSGRO0_USL1_UIOFGRO0_USFGROn1_VSn1_VWA1_VWB2_WSGRA0_WSGRB0_WS64_WG32_8_1_WGM1_WGMXCC4_WGMXCCGn1
    SolutionIndex: 175
    SolutionNameMin: Cijk_Ailk_Bjlk_S_MX_B_Bias_HA_S_SAV_UserArgs_MT320x128x16_MI16x16x1_SN_LDSB1_AFC1_AFEM1_AFEM1_ASEM1_CLR1_CADS0_DTVA0_DTVB0_EPS0_FDSI0_GRPM1_GRVWA4_GRVWB4_GSUn1_GSUAMBSK_GSUC1_GSUWGMRR1_GLS0_ISA942_IU1_K1_LBSPPA2560_LBSPPB1024_LBSPPM0_LPA16_LPB0_LPM0_LRVW2_LWPMn1_MIAV0_MIWT5_8_MO40_NTn1_NTA0_NTB0_NTC0_NTD4_NTM0_NEPBS5_NLCA1_NLCB1_ONLL1_PGR2_PLR1_PKA1_SIA3_SS1_SU0_SUM1_SUS0_SPO0_SRVW0_SSO4_SVW1_SK0_SKXCCM0_TLDS0_ULSGRO0_USL1_UIOFGRO0_USFGROn1_VSn1_VWA1_VWB4_WSGRA0_WSGRB0_WS64_WG64_4_1_WGM1_WGMXCC4_WGMXCCGn1
    SolutionIndex: 176
    SolutionNameMin: Cijk_Ailk_Bjlk_S_MX_B_Bias_HA_S_SAV_UserArgs_MT160x256x32_MI32x32x1_SN_LDSB1_AFC1_AFEM1_AFEM1_ASEM1_CLR1_CADS0_DTVA0_DTVB0_EPS0_FDSI0_GRPM1_GRVWA4_GRVWB4_GSUn1_GSUAMBSK_GSUC1_GSUWGMRR1_GLS0_ISA942_IU1_K1_LBSPPA0_LBSPPB0_LBSPPM0_LPA0_LPB0_LPM0_LRVW2_LWPMn1_MIAV0_MIWT5_2_MO40_NTn1_NTA0_NTB0_NTC0_NTD4_NTM0_NEPBS5_NLCA1_NLCB1_ONLL1_PGR2_PLR1_PKA1_SIA3_SS1_SU0_SUM1_SUS0_SPO0_SRVW0_SSO4_SVW1_SK0_SKXCCM0_TLDS0_ULSGRO0_USL1_UIOFGRO0_USFGROn1_VSn1_VWA1_VWB2_WSGRA0_WSGRB0_WS64_WG32_8_1_WGM1_WGMXCC4_WGMXCCGn1
    SolutionIndex: 177
    SolutionNameMin: Cijk_Ailk_Bjlk_S_MX_B_Bias_HA_S_SAV_UserArgs_MT256x192x32_MI32x32x1_SN_LDSB1_AFC1_AFEM1_AFEM1_ASEM1_CLR1_CADS0_DTVA0_DTVB0_EPS0_FDSI0_GRPM1_GRVWA4_GRVWB4_GSUn1_GSUAMBSK_GSUC1_GSUWGMRR1_GLS0_ISA942_IU1_K1_LBSPPA0_LBSPPB0_LBSPPM0_LPA0_LPB0_LPM0_LRVW2_LWPMn1_MIAV0_MIWT2_6_MO40_NTn1_NTA0_NTB0_NTC0_NTD4_NTM0_NEPBS8_NLCA1_NLCB1_ONLL1_PGR2_PLR1_PKA1_SIA3_SS1_SU0_SUM1_SUS0_SPO0_SRVW0_SSO4_SVW2_SK0_SKXCCM0_TLDS0_ULSGRO0_USL1_UIOFGRO0_USFGROn1_VSn1_VWA2_VWB2_WSGRA0_WSGRB0_WS64_WG128_2_1_WGM1_WGMXCC4_WGMXCCGn1
    SolutionIndex: 178
    SolutionNameMin: Cijk_Ailk_Bjlk_S_MX_B_Bias_HA_S_SAV_UserArgs_MT192x128x16_MI32x32x1_SN_LDSB1_AFC1_AFEM1_AFEM1_ASEM1_CLR1_CADS0_DTVA0_DTVB0_EPS0_FDSI0_GRPM1_GRVWA4_GRVWB4_GSUn1_GSUAMBSK_GSUC1_GSUWGMRR1_GLS0_ISA942_IU1_K1_LBSPPA0_LBSPPB0_LBSPPM0_LPA0_LPB0_LPM0_LRVW2_LWPMn1_MIAV0_MIWT3_2_MO40_NTn1_NTA0_NTB0_NTC0_NTD4_NTM0_NEPBS6_NLCA1_NLCB1_ONLL1_PGR2_PLR1_PKA1_SIA3_SS1_SU0_SUM1_SUS0_SPO0_SRVW0_SSO4_SVW1_SK0_SKXCCM0_TLDS0_ULSGRO0_USL1_UIOFGRO0_USFGROn1_VSn1_VWA1_VWB2_WSGRA0_WSGRB0_WS64_WG64_4_1_WGM1_WGMXCC4_WGMXCCGn1
    SolutionIndex: 179
    SolutionNameMin: Cijk_Ailk_Bjlk_S_MX_B_Bias_HA_S_SAV_UserArgs_MT384x96x32_MI32x32x1_SN_LDSB1_AFC1_AFEM1_AFEM1_ASEM1_CLR1_CADS0_DTVA0_DTVB0_EPS0_FDSI0_GRPM1_GRVWA4_GRVWB4_GSUn1_GSUAMBSK_GSUC1_GSUWGMRR1_GLS0_ISA942_IU1_K1_LBSPPA0_LBSPPB0_LBSPPM0_LPA0_LPB0_LPM0_LRVW2_LWPMn1_MIAV0_MIWT3_3_MO40_NTn1_NTA0_NTB0_NTC0_NTD4_NTM0_NEPBS6_NLCA1_NLCB1_ONLL1_PGR2_PLR1_PKA1_SIA3_SS1_SU0_SUM1_SUS0_SPO0_SRVW0_SSO4_SVW1_SK0_SKXCCM0_TLDS0_ULSGRO0_USL1_UIOFGRO0_USFGROn1_VSn1_VWA1_VWB1_WSGRA0_WSGRB0_WS64_WG128_2_1_WGM1_WGMXCC4_WGMXCCGn1
    SolutionIndex: 180
    SolutionNameMin: Cijk_Ailk_Bjlk_S_MX_B_Bias_HA_S_SAV_UserArgs_MT384x128x32_MI32x32x1_SN_LDSB1_AFC1_AFEM1_AFEM1_ASEM1_CLR1_CADS0_DTVA0_DTVB0_EPS0_FDSI0_GRPM1_GRVWA4_GRVWB4_GSUn1_GSUAMBSK_GSUC1_GSUWGMRR1_GLS0_ISA942_IU1_K1_LBSPPA0_LBSPPB0_LBSPPM0_LPA0_LPB0_LPM0_LRVW2_LWPMn1_MIAV0_MIWT6_2_MO40_NTn1_NTA0_NTB0_NTC0_NTD4_NTM0_NEPBS6_NLCA1_NLCB1_ONLL1_PGR2_PLR1_PKA1_SIA3_SS1_SU0_SUM1_SUS0_SPO0_SRVW0_SSO4_SVW2_SK0_SKXCCM0_TLDS0_ULSGRO0_USL1_UIOFGRO0_USFGROn1_VSn1_VWA2_VWB2_WSGRA0_WSGRB0_WS64_WG64_4_1_WGM1_WGMXCC4_WGMXCCGn1
    SolutionIndex: 181
    SolutionNameMin: Cijk_Ailk_Bjlk_S_MX_B_Bias_HA_S_SAV_UserArgs_MT128x320x16_MI16x16x1_SN_LDSB1_AFC1_AFEM1_AFEM1_ASEM1_CLR1_CADS0_DTVA0_DTVB0_EPS0_FDSI0_GRPM1_GRVWA4_GRVWB4_GSUn1_GSUAMBSK_GSUC1_GSUWGMRR1_GLS0_ISA942_IU1_K1_LBSPPA1024_LBSPPB2560_LBSPPM0_LPA0_LPB16_LPM0_LRVW2_LWPMn1_MIAV0_MIWT8_5_MO40_NTn1_NTA0_NTB0_NTC0_NTD4_NTM0_NEPBS8_NLCA1_NLCB1_ONLL1_PGR2_PLR1_PKA1_SIA3_SS1_SU0_SUM1_SUS0_SPO0_SRVW0_SSO4_SVW4_SK0_SKXCCM0_TLDS0_ULSGRO0_USL1_UIOFGRO0_USFGROn1_VSn1_VWA4_VWB1_WSGRA0_WSGRB0_WS64_WG16_16_1_WGM1_WGMXCC4_WGMXCCGn1
    SolutionIndex: 182
    SolutionNameMin: Cijk_Ailk_Bjlk_S_MX_B_Bias_HA_S_SAV_UserArgs_MT256x224x32_MI32x32x1_SN_LDSB1_AFC1_AFEM1_AFEM1_ASEM1_CLR1_CADS0_DTVA0_DTVB0_EPS0_FDSI0_GRPM1_GRVWA4_GRVWB4_GSUn1_GSUAMBSK_GSUC1_GSUWGMRR1_GLS0_ISA942_IU1_K1_LBSPPA0_LBSPPB0_LBSPPM0_LPA0_LPB0_LPM0_LRVW2_LWPMn1_MIAV0_MIWT2_7_MO40_NTn1_NTA0_NTB0_NTC0_NTD4_NTM0_NEPBS8_NLCA1_NLCB1_ONLL1_PGR2_PLR1_PKA1_SIA3_SS1_SU0_SUM1_SUS0_SPO0_SRVW0_SSO4_SVW2_SK0_SKXCCM0_TLDS0_ULSGRO0_USL1_UIOFGRO0_USFGROn1_VSn1_VWA2_VWB1_WSGRA0_WSGRB0_WS64_WG128_2_1_WGM1_WGMXCC4_WGMXCCGn1
    SolutionIndex: 183
    SolutionNameMin: Cijk_Ailk_Bjlk_S_MX_B_Bias_HA_S_SAV_UserArgs_MT256x160x32_MI32x32x1_SN_LDSB1_AFC1_AFEM1_AFEM1_ASEM1_CLR1_CADS0_DTVA0_DTVB0_EPS0_FDSI0_GRPM1_GRVWA4_GRVWB4_GSUn1_GSUAMBSK_GSUC1_GSUWGMRR1_GLS0_ISA942_IU1_K1_LBSPPA0_LBSPPB0_LBSPPM0_LPA0_LPB0_LPM0_LRVW2_LWPMn1_MIAV0_MIWT2_5_MO40_NTn1_NTA0_NTB0_NTC0_NTD4_NTM0_NEPBS8_NLCA1_NLCB1_ONLL1_PGR2_PLR1_PKA1_SIA3_SS1_SU0_SUM1_SUS0_SPO0_SRVW0_SSO4_SVW2_SK0_SKXCCM0_TLDS0_ULSGRO0_USL1_UIOFGRO0_USFGROn1_VSn1_VWA2_VWB1_WSGRA0_WSGRB0_WS64_WG128_2_1_WGM1_WGMXCC4_WGMXCCGn1
    SolutionIndex: 184
    SolutionNameMin: Cijk_Ailk_Bjlk_S_MX_B_Bias_HA_S_SAV_UserArgs_MT128x192x16_MI32x32x1_SN_LDSB1_AFC1_AFEM1_AFEM1_ASEM1_CLR1_CADS0_DTVA0_DTVB0_EPS0_FDSI0_GRPM1_GRVWA4_GRVWB4_GSUn1_GSUAMBSK_GSUC1_GSUWGMRR1_GLS0_ISA942_IU1_K1_LBSPPA0_LBSPPB0_LBSPPM0_LPA0_LPB0_LPM0_LRVW2_LWPMn1_MIAV0_MIWT2_3_MO40_NTn1_NTA0_NTB0_NTC0_NTD4_NTM0_NEPBS8_NLCA1_NLCB1_ONLL1_PGR2_PLR1_PKA1_SIA3_SS1_SU0_SUM1_SUS0_SPO0_SRVW0_SSO4_SVW2_SK0_SKXCCM0_TLDS0_ULSGRO0_USL1_UIOFGRO0_USFGROn1_VSn1_VWA2_VWB1_WSGRA0_WSGRB0_WS64_WG64_4_1_WGM1_WGMXCC4_WGMXCCGn1
    SolutionIndex: 185
    SolutionNameMin: Cijk_Ailk_Bjlk_S_MX_B_Bias_HA_S_SAV_UserArgs_MT320x192x32_MI32x32x1_SN_LDSB1_AFC1_AFEM1_AFEM1_ASEM1_CLR1_CADS0_DTVA0_DTVB0_EPS0_FDSI0_GRPM1_GRVWA4_GRVWB4_GSUn1_GSUAMBSK_GSUC1_GSUWGMRR1_GLS0_ISA942_IU1_K1_LBSPPA0_LBSPPB0_LBSPPM0_LPA0_LPB0_LPM0_LRVW2_LWPMn1_MIAV0_MIWT5_3_MO40_NTn1_NTA0_NTB0_NTC0_NTD4_NTM0_NEPBS5_NLCA1_NLCB1_ONLL1_PGR2_PLR1_PKA1_SIA3_SS1_SU0_SUM1_SUS0_SPO0_SRVW0_SSO4_SVW1_SK0_SKXCCM0_TLDS0_ULSGRO0_USL1_UIOFGRO0_USFGROn1_VSn1_VWA1_VWB1_WSGRA0_WSGRB0_WS64_WG64_4_1_WGM1_WGMXCC4_WGMXCCGn1
    SolutionIndex: 186
    SolutionNameMin: Cijk_Ailk_Bjlk_S_MX_B_Bias_HA_S_SAV_UserArgs_MT192x192x16_MI32x32x1_SN_LDSB1_AFC1_AFEM1_AFEM1_ASEM1_CLR1_CADS0_DTVA0_DTVB0_EPS0_FDSI0_GRPM1_GRVWA4_GRVWB4_GSUn1_GSUAMBSK_GSUC1_GSUWGMRR1_GLS0_ISA942_IU1_K1_LBSPPA0_LBSPPB0_LBSPPM0_LPA0_LPB0_LPM0_LRVW2_LWPMn1_MIAV0_MIWT3_3_MO40_NTn1_NTA0_NTB0_NTC0_NTD4_NTM0_NEPBS6_NLCA1_NLCB1_ONLL1_PGR2_PLR1_PKA1_SIA3_SS1_SU0_SUM1_SUS0_SPO0_SRVW0_SSO4_SVW1_SK0_SKXCCM0_TLDS0_ULSGRO0_USL1_UIOFGRO0_USFGROn1_VSn1_VWA1_VWB1_WSGRA0_WSGRB0_WS64_WG64_4_1_WGM1_WGMXCC4_WGMXCCGn1
    SolutionIndex: 187
    SolutionNameMin: Cijk_Ailk_Bjlk_S_MX_B_Bias_HA_S_SAV_UserArgs_MT16x192x32_MI16x16x1_SN_LDSB1_AFC1_AFEM1_AFEM1_ASEM1_CLR1_CADS0_DTVA0_DTVB0_EPS0_FDSI0_GRPM1_GRVWA1_GRVWB4_GSUn1_GSUAMBSK_GSUC1_GSUWGMRR1_GLS0_ISA942_IU1_K1_LBSPPA128_LBSPPB1536_LBSPPM0_LPA16_LPB16_LPM0_LRVW2_LWPMn1_MIAV0_MIWT1_3_MO40_NTn1_NTA0_NTB0_NTC0_NTD4_NTM0_NEPBS8_NLCA1_NLCB1_ONLL1_PGR2_PLR1_PKA1_SIA3_SS1_SU0_SUM1_SUS0_SPO0_SRVW0_SSO0_SVW1_SK0_SKXCCM0_TLDS0_ULSGRO0_USL1_UIOFGRO0_USFGROn1_VSn1_VWA1_VWB1_WSGRA0_WSGRB0_WS64_WG16_16_1_WGM1_WGMXCC4_WGMXCCGn1
    SolutionIndex: 188
    SolutionNameMin: Cijk_Ailk_Bjlk_S_MX_B_Bias_HA_S_SAV_UserArgs_MT16x320x32_MI16x16x1_SN_LDSB1_AFC1_AFEM1_AFEM1_ASEM1_CLR1_CADS0_DTVA0_DTVB0_EPS0_FDSI0_GRPM1_GRVWA1_GRVWB4_GSUn1_GSUAMBSK_GSUC1_GSUWGMRR1_GLS0_ISA942_IU1_K1_LBSPPA128_LBSPPB2560_LBSPPM0_LPA16_LPB16_LPM0_LRVW2_LWPMn1_MIAV0_MIWT1_5_MO40_NTn1_NTA0_NTB0_NTC0_NTD4_NTM0_NEPBS8_NLCA1_NLCB1_ONLL1_PGR2_PLR1_PKA1_SIA3_SS1_SU0_SUM1_SUS0_SPO0_SRVW0_SSO0_SVW1_SK0_SKXCCM0_TLDS0_ULSGRO0_USL1_UIOFGRO0_USFGROn1_VSn1_VWA1_VWB1_WSGRA0_WSGRB0_WS64_WG16_16_1_WGM1_WGMXCC4_WGMXCCGn1
    SolutionIndex: 189
    SolutionNameMin: Cijk_Ailk_Bjlk_S_MX_B_Bias_HA_S_SAV_UserArgs_MT32x384x32_MI32x32x1_SN_LDSB1_AFC1_AFEM1_AFEM1_ASEM1_CLR1_CADS0_DTVA0_DTVB0_EPS0_FDSI0_GRPM1_GRVWA4_GRVWB4_GSUn1_GSUAMBSK_GSUC1_GSUWGMRR1_GLS0_ISA942_IU1_K1_LBSPPA0_LBSPPB0_LBSPPM0_LPA0_LPB0_LPM0_LRVW2_LWPMn1_MIAV0_MIWT1_3_MO40_NTn1_NTA0_NTB0_NTC0_NTD4_NTM0_NEPBS8_NLCA1_NLCB1_ONLL1_PGR2_PLR1_PKA1_SIA3_SS1_SU0_SUM1_SUS0_SPO0_SRVW0_SSO0_SVW1_SK0_SKXCCM0_TLDS0_ULSGRO0_USL1_UIOFGRO0_USFGROn1_VSn1_VWA1_VWB1_WSGRA0_WSGRB0_WS64_WG32_8_1_WGM1_WGMXCC4_WGMXCCGn1
    SolutionIndex: 190
    SolutionNameMin: Cijk_Ailk_Bjlk_S_MX_B_Bias_HA_S_SAV_UserArgs_MT64x256x32_MI32x32x1_SN_LDSB1_AFC1_AFEM1_AFEM1_ASEM1_CLR1_CADS0_DTVA0_DTVB0_EPS0_FDSI0_GRPM1_GRVWA4_GRVWB4_GSUn1_GSUAMBSK_GSUC1_GSUWGMRR1_GLS0_ISA942_IU1_K1_LBSPPA0_LBSPPB0_LBSPPM0_LPA0_LPB0_LPM0_LRVW2_LWPMn1_MIAV0_MIWT2_2_MO40_NTn1_NTA0_NTB0_NTC0_NTD4_NTM0_NEPBS8_NLCA1_NLCB1_ONLL1_PGR2_PLR1_PKA1_SIA3_SS1_SU0_SUM1_SUS0_SPO0_SRVW0_SSO0_SVW2_SK0_SKXCCM0_TLDS0_ULSGRO0_USL1_UIOFGRO0_USFGROn1_VSn1_VWA2_VWB2_WSGRA0_WSGRB0_WS64_WG32_8_1_WGM1_WGMXCC4_WGMXCCGn1
    SolutionIndex: 191
    SolutionNameMin: Cijk_Ailk_Bjlk_S_MX_B_Bias_HA_S_SAV_UserArgs_MT64x384x32_MI32x32x1_SN_LDSB1_AFC1_AFEM1_AFEM1_ASEM1_CLR1_CADS0_DTVA0_DTVB0_EPS0_FDSI0_GRPM1_GRVWA4_GRVWB4_GSUn1_GSUAMBSK_GSUC1_GSUWGMRR1_GLS0_ISA942_IU1_K1_LBSPPA0_LBSPPB0_LBSPPM0_LPA0_LPB0_LPM0_LRVW2_LWPMn1_MIAV0_MIWT2_3_MO40_NTn1_NTA0_NTB0_NTC0_NTD4_NTM0_NEPBS8_NLCA1_NLCB1_ONLL1_PGR2_PLR1_PKA1_SIA3_SS1_SU0_SUM1_SUS0_SPO0_SRVW0_SSO0_SVW2_SK0_SKXCCM0_TLDS0_ULSGRO0_USL1_UIOFGRO0_USFGROn1_VSn1_VWA2_VWB1_WSGRA0_WSGRB0_WS64_WG32_8_1_WGM1_WGMXCC4_WGMXCCGn1
    SolutionIndex: 192
    SolutionNameMin: Cijk_Ailk_Bjlk_S_MX_B_Bias_HA_S_SAV_UserArgs_MT128x384x16_MI32x32x1_SN_LDSB1_AFC1_AFEM1_AFEM1_ASEM1_CLR1_CADS0_DTVA0_DTVB0_EPS0_FDSI0_GRPM1_GRVWA4_GRVWB4_GSUn1_GSUAMBSK_GSUC1_GSUWGMRR1_GLS0_ISA942_IU1_K1_LBSPPA0_LBSPPB0_LBSPPM0_LPA0_LPB0_LPM0_LRVW2_LWPMn1_MIAV0_MIWT2_6_MO40_NTn1_NTA0_NTB0_NTC0_NTD4_NTM0_NEPBS8_NLCA1_NLCB1_ONLL1_PGR2_PLR1_PKA1_SIA3_SS1_SU0_SUM1_SUS0_SPO0_SRVW0_SSO0_SVW2_SK0_SKXCCM0_TLDS0_ULSGRO0_USL1_UIOFGRO0_USFGROn1_VSn1_VWA2_VWB2_WSGRA0_WSGRB0_WS64_WG64_4_1_WGM1_WGMXCC4_WGMXCCGn1
    SolutionIndex: 193
    SolutionNameMin: Cijk_Ailk_Bjlk_S_MX_B_Bias_HA_S_SAV_UserArgs_MT128x384x32_MI32x32x1_SN_LDSB1_AFC1_AFEM1_AFEM1_ASEM1_CLR1_CADS0_DTVA0_DTVB0_EPS0_FDSI0_GRPM1_GRVWA4_GRVWB4_GSUn1_GSUAMBSK_GSUC1_GSUWGMRR1_GLS0_ISA942_IU1_K1_LBSPPA0_LBSPPB0_LBSPPM0_LPA0_LPB0_LPM0_LRVW2_LWPMn1_MIAV0_MIWT2_6_MO40_NTn1_NTA0_NTB0_NTC0_NTD4_NTM0_NEPBS8_NLCA1_NLCB1_ONLL1_PGR2_PLR1_PKA1_SIA3_SS1_SU0_SUM1_SUS0_SPO0_SRVW0_SSO0_SVW2_SK0_SKXCCM0_TLDS0_ULSGRO0_USL1_UIOFGRO0_USFGROn1_VSn1_VWA2_VWB2_WSGRA0_WSGRB0_WS64_WG64_4_1_WGM1_WGMXCC4_WGMXCCGn1
    SolutionIndex: 194
    SolutionNameMin: Cijk_Ailk_Bjlk_S_MX_B_Bias_HA_S_SAV_UserArgs_MT64x224x32_MI16x16x1_SN_LDSB1_AFC1_AFEM1_AFEM1_ASEM1_CLR1_CADS0_DTVA0_DTVB0_EPS0_FDSI0_GRPM1_GRVWA4_GRVWB4_GSUn1_GSUAMBSK_GSUC1_GSUWGMRR1_GLS0_ISA942_IU1_K1_LBSPPA512_LBSPPB1792_LBSPPM0_LPA0_LPB16_LPM0_LRVW2_LWPMn1_MIAV0_MIWT2_7_MO40_NTn1_NTA0_NTB0_NTC0_NTD4_NTM0_NEPBS8_NLCA1_NLCB1_ONLL1_PGR2_PLR1_PKA1_SIA3_SS1_SU0_SUM1_SUS0_SPO0_SRVW0_SSO0_SVW2_SK0_SKXCCM0_TLDS0_ULSGRO0_USL1_UIOFGRO0_USFGROn1_VSn1_VWA2_VWB1_WSGRA0_WSGRB0_WS64_WG32_8_1_WGM1_WGMXCC4_WGMXCCGn1
    SolutionIndex: 195
    SolutionNameMin: Cijk_Ailk_Bjlk_S_MX_B_Bias_HA_S_SAV_UserArgs_MT128x160x32_MI32x32x1_SN_LDSB1_AFC1_AFEM1_AFEM1_ASEM1_CLR1_CADS0_DTVA0_DTVB0_EPS0_FDSI0_GRPM1_GRVWA4_GRVWB4_GSUn1_GSUAMBSK_GSUC1_GSUWGMRR1_GLS0_ISA942_IU1_K1_LBSPPA0_LBSPPB0_LBSPPM0_LPA0_LPB0_LPM0_LRVW2_LWPMn1_MIAV0_MIWT1_5_MO40_NTn1_NTA0_NTB0_NTC0_NTD4_NTM0_NEPBS8_NLCA1_NLCB1_ONLL1_PGR2_PLR1_PKA1_SIA3_SS1_SU0_SUM1_SUS0_SPO0_SRVW0_SSO0_SVW1_SK0_SKXCCM0_TLDS0_ULSGRO0_USL1_UIOFGRO0_USFGROn1_VSn1_VWA1_VWB1_WSGRA0_WSGRB0_WS64_WG128_2_1_WGM1_WGMXCC4_WGMXCCGn1
    SolutionIndex: 196
    SolutionNameMin: Cijk_Ailk_Bjlk_S_MX_B_Bias_HA_S_SAV_UserArgs_MT128x224x32_MI16x16x1_SN_LDSB1_AFC1_AFEM1_AFEM1_ASEM1_CLR1_CADS0_DTVA0_DTVB0_EPS0_FDSI0_GRPM1_GRVWA4_GRVWB4_GSUn1_GSUAMBSK_GSUC1_GSUWGMRR1_GLS0_ISA942_IU1_K1_LBSPPA1024_LBSPPB1792_LBSPPM0_LPA0_LPB16_LPM0_LRVW2_LWPMn1_MIAV0_MIWT4_7_MO40_NTn1_NTA0_NTB0_NTC0_NTD4_NTM0_NEPBS8_NLCA1_NLCB1_ONLL1_PGR2_PLR1_PKA1_SIA3_SS1_SU0_SUM1_SUS0_SPO0_SRVW0_SSO0_SVW4_SK0_SKXCCM0_TLDS0_ULSGRO0_USL1_UIOFGRO0_USFGROn1_VSn1_VWA4_VWB1_WSGRA0_WSGRB0_WS64_WG32_8_1_WGM1_WGMXCC4_WGMXCCGn1
    SolutionIndex: 197
    SolutionNameMin: Cijk_Ailk_Bjlk_S_MX_B_Bias_HA_S_SAV_UserArgs_MT192x320x16_MI16x16x1_SN_LDSB1_AFC1_AFEM1_AFEM1_ASEM1_CLR1_CADS0_DTVA0_DTVB0_EPS0_FDSI0_GRPM1_GRVWA4_GRVWB4_GSUn1_GSUAMBSK_GSUC1_GSUWGMRR1_GLS0_ISA942_IU1_K1_LBSPPA1536_LBSPPB2560_LBSPPM0_LPA0_LPB0_LPM0_LRVW2_LWPMn1_MIAV0_MIWT6_10_MO40_NTn1_NTA0_NTB0_NTC0_NTD4_NTM0_NEPBS6_NLCA1_NLCB1_ONLL1_PGR2_PLR1_PKA1_SIA3_SS1_SU0_SUM1_SUS0_SPO0_SRVW0_SSO0_SVW2_SK0_SKXCCM0_TLDS0_ULSGRO0_USL1_UIOFGRO0_USFGROn1_VSn1_VWA2_VWB2_WSGRA0_WSGRB0_WS64_WG32_8_1_WGM1_WGMXCC4_WGMXCCGn1
    SolutionIndex: 198
    SolutionNameMin: Cijk_Ailk_Bjlk_S_MX_B_Bias_HA_S_SAV_UserArgs_MT192x320x32_MI32x32x1_SN_LDSB1_AFC1_AFEM1_AFEM1_ASEM1_CLR1_CADS0_DTVA0_DTVB0_EPS0_FDSI0_GRPM1_GRVWA4_GRVWB4_GSUn1_GSUAMBSK_GSUC1_GSUWGMRR1_GLS0_ISA942_IU1_K1_LBSPPA0_LBSPPB0_LBSPPM0_LPA0_LPB0_LPM0_LRVW2_LWPMn1_MIAV0_MIWT3_5_MO40_NTn1_NTA0_NTB0_NTC0_NTD4_NTM0_NEPBS6_NLCA1_NLCB1_ONLL1_PGR2_PLR1_PKA1_SIA3_SS1_SU0_SUM1_SUS0_SPO0_SRVW0_SSO0_SVW1_SK0_SKXCCM0_TLDS0_ULSGRO0_USL1_UIOFGRO0_USFGROn1_VSn1_VWA1_VWB1_WSGRA0_WSGRB0_WS64_WG64_4_1_WGM1_WGMXCC4_WGMXCCGn1
    SolutionIndex: 199
    SolutionNameMin: Cijk_Ailk_Bjlk_S_MX_B_Bias_HA_S_SAV_UserArgs_MT256x224x32_MI16x16x1_SN_LDSB1_AFC1_AFEM1_AFEM1_ASEM1_CLR1_CADS0_DTVA0_DTVB0_EPS0_FDSI0_GRPM1_GRVWA4_GRVWB4_GSUn1_GSUAMBSK_GSUC1_GSUWGMRR1_GLS0_ISA942_IU1_K1_LBSPPA2048_LBSPPB1792_LBSPPM0_LPA0_LPB0_LPM0_LRVW2_LWPMn1_MIAV0_MIWT4_14_MO40_NTn1_NTA0_NTB0_NTC0_NTD4_NTM0_NEPBS8_NLCA1_NLCB1_ONLL1_PGR2_PLR1_PKA1_SIA3_SS1_SU0_SUM1_SUS0_SPO0_SRVW0_SSO4_SVW4_SK0_SKXCCM0_TLDS0_ULSGRO0_USL1_UIOFGRO0_USFGROn1_VSn1_VWA4_VWB2_WSGRA0_WSGRB0_WS64_WG64_4_1_WGM1_WGMXCC4_WGMXCCGn1
    SolutionIndex: 200
    SolutionNameMin: Cijk_Ailk_Bjlk_S_MX_B_Bias_HA_S_SAV_UserArgs_MT192x192x16_MI16x16x1_SN_LDSB1_AFC1_AFEM1_AFEM1_ASEM1_CLR1_CADS0_DTVA0_DTVB0_EPS0_FDSI0_GRPM1_GRVWA4_GRVWB4_GSUn1_GSUAMBSK_GSUC1_GSUWGMRR1_GLS0_ISA942_IU1_K1_LBSPPA1536_LBSPPB1536_LBSPPM0_LPA0_LPB0_LPM0_LRVW2_LWPMn1_MIAV0_MIWT6_6_MO40_NTn1_NTA0_NTB0_NTC0_NTD4_NTM0_NEPBS6_NLCA1_NLCB1_ONLL1_PGR2_PLR1_PKA1_SIA3_SS1_SU0_SUM1_SUS0_SPO0_SRVW0_SSO4_SVW2_SK0_SKXCCM0_TLDS0_ULSGRO0_USL1_UIOFGRO0_USFGROn1_VSn1_VWA2_VWB2_WSGRA0_WSGRB0_WS64_WG32_8_1_WGM1_WGMXCC4_WGMXCCGn1
    SolutionIndex: 201
    SolutionNameMin: Cijk_Ailk_Bjlk_S_MX_B_Bias_HA_S_SAV_UserArgs_MT32x96x64_MI16x16x1_SN_LDSB1_AFC1_AFEM1_AFEM1_ASEM1_CLR1_CADS0_DTVA0_DTVB0_EPS0_FDSI0_GRPM1_GRVWA4_GRVWB4_GSUn1_GSUAMBSK_GSUC1_GSUWGMRR1_GLS0_ISA942_IU1_K1_LBSPPA256_LBSPPB768_LBSPPM0_LPA0_LPB16_LPM0_LRVW2_LWPMn1_MIAV0_MIWT2_3_MO40_NTn1_NTA0_NTB0_NTC0_NTD4_NTM0_NEPBS8_NLCA1_NLCB1_ONLL1_PGR2_PLR1_PKA1_SIA3_SS1_SU0_SUM1_SUS0_SPO0_SRVW0_SSO0_SVW2_SK0_SKXCCM0_TLDS0_ULSGRO0_USL1_UIOFGRO0_USFGROn1_VSn1_VWA2_VWB1_WSGRA0_WSGRB0_WS64_WG16_8_2_WGM1_WGMXCC4_WGMXCCGn1
    SolutionIndex: 202
    SolutionNameMin: Cijk_Ailk_Bjlk_S_MX_B_Bias_HA_S_SAV_UserArgs_MT128x448x16_MI32x32x1_SN_LDSB1_AFC1_AFEM1_AFEM1_ASEM1_CLR1_CADS0_DTVA0_DTVB0_EPS0_FDSI0_GRPM1_GRVWA4_GRVWB4_GSUn1_GSUAMBSK_GSUC1_GSUWGMRR1_GLS0_ISA942_IU1_K1_LBSPPA0_LBSPPB0_LBSPPM0_LPA0_LPB0_LPM0_LRVW2_LWPMn1_MIAV0_MIWT2_7_MO40_NTn1_NTA0_NTB0_NTC0_NTD4_NTM0_NEPBS8_NLCA1_NLCB1_ONLL1_PGR2_PLR1_PKA1_SIA3_SS1_SU0_SUM1_SUS0_SPO0_SRVW0_SSO0_SVW2_SK0_SKXCCM0_TLDS0_ULSGRO0_USL1_UIOFGRO0_USFGROn1_VSn1_VWA2_VWB1_WSGRA0_WSGRB0_WS64_WG64_4_1_WGM1_WGMXCC4_WGMXCCGn1
    SolutionIndex: 203
    SolutionNameMin: Cijk_Ailk_Bjlk_S_MX_B_Bias_HA_S_SAV_UserArgs_MT96x160x32_MI16x16x1_SN_LDSB1_AFC1_AFEM1_AFEM1_ASEM1_CLR1_CADS0_DTVA0_DTVB0_EPS0_FDSI0_GRPM1_GRVWA4_GRVWB4_GSUn1_GSUAMBSK_GSUC1_GSUWGMRR1_GLS0_ISA942_IU1_K1_LBSPPA768_LBSPPB1280_LBSPPM0_LPA16_LPB16_LPM0_LRVW2_LWPMn1_MIAV0_MIWT3_5_MO40_NTn1_NTA0_NTB0_NTC0_NTD4_NTM0_NEPBS6_NLCA1_NLCB1_ONLL1_PGR2_PLR1_PKA1_SIA3_SS1_SU0_SUM1_SUS0_SPO0_SRVW0_SSO0_SVW1_SK0_SKXCCM0_TLDS0_ULSGRO0_USL1_UIOFGRO0_USFGROn1_VSn1_VWA1_VWB1_WSGRA0_WSGRB0_WS64_WG32_8_1_WGM1_WGMXCC4_WGMXCCGn1
    SolutionIndex: 204
    SolutionNameMin: Cijk_Ailk_Bjlk_S_MX_B_Bias_HA_S_SAV_UserArgs_MT128x128x32_MI32x32x1_SN_LDSB1_AFC1_AFEM1_AFEM1_ASEM1_CLR1_CADS0_DTVA0_DTVB0_EPS0_FDSI0_GRPM1_GRVWA4_GRVWB4_GSUn1_GSUAMBSK_GSUC1_GSUWGMRR1_GLS0_ISA942_IU1_K1_LBSPPA0_LBSPPB0_LBSPPM0_LPA0_LPB0_LPM0_LRVW2_LWPMn1_MIAV0_MIWT2_2_MO40_NTn1_NTA0_NTB0_NTC0_NTD4_NTM0_NEPBS8_NLCA1_NLCB1_ONLL1_PGR2_PLR1_PKA1_SIA3_SS1_SU0_SUM1_SUS0_SPO0_SRVW0_SSO0_SVW2_SK0_SKXCCM0_TLDS0_ULSGRO0_USL1_UIOFGRO0_USFGROn1_VSn1_VWA2_VWB2_WSGRA0_WSGRB0_WS64_WG64_4_1_WGM8_WGMXCC4_WGMXCCGn1
    SolutionIndex: 205
    SolutionNameMin: Cijk_Ailk_Bjlk_S_MX_B_Bias_HA_S_SAV_UserArgs_MT256x160x32_MI32x32x1_SN_LDSB1_AFC1_AFEM1_AFEM1_ASEM1_CLR1_CADS0_DTVA0_DTVB0_EPS0_FDSI0_GRPM1_GRVWA4_GRVWB4_GSUn1_GSUAMBSK_GSUC1_GSUWGMRR1_GLS0_ISA942_IU1_K1_LBSPPA0_LBSPPB0_LBSPPM0_LPA0_LPB0_LPM0_LRVW2_LWPMn1_MIAV0_MIWT2_5_MO40_NTn1_NTA0_NTB0_NTC0_NTD4_NTM0_NEPBS8_NLCA1_NLCB1_ONLL1_PGR2_PLR1_PKA1_SIA3_SS1_SU0_SUM1_SUS0_SPO0_SRVW0_SSO0_SVW2_SK0_SKXCCM0_TLDS0_ULSGRO0_USL1_UIOFGRO0_USFGROn1_VSn1_VWA2_VWB1_WSGRA0_WSGRB0_WS64_WG128_2_1_WGM8_WGMXCC4_WGMXCCGn1
    SolutionIndex: 206
    SolutionNameMin: Cijk_Ailk_Bjlk_S_MX_B_Bias_HA_S_SAV_UserArgs_MT128x160x32_MI32x32x1_SN_LDSB1_AFC1_AFEM1_AFEM1_ASEM1_CLR1_CADS0_DTVA0_DTVB0_EPS0_FDSI0_GRPM1_GRVWA4_GRVWB4_GSUn1_GSUAMBSK_GSUC1_GSUWGMRR1_GLS0_ISA942_IU1_K1_LBSPPA0_LBSPPB0_LBSPPM0_LPA0_LPB0_LPM0_LRVW2_LWPMn1_MIAV0_MIWT1_5_MO40_NTn1_NTA0_NTB0_NTC0_NTD4_NTM0_NEPBS8_NLCA1_NLCB1_ONLL1_PGR2_PLR1_PKA1_SIA3_SS1_SU0_SUM1_SUS0_SPO0_SRVW0_SSO0_SVW1_SK0_SKXCCM0_TLDS0_ULSGRO0_USL1_UIOFGRO0_USFGROn1_VSn1_VWA1_VWB1_WSGRA0_WSGRB0_WS64_WG128_2_1_WGM8_WGMXCC4_WGMXCCGn1
    SolutionIndex: 207
    SolutionNameMin: Cijk_Ailk_Bjlk_S_MX_B_Bias_HA_S_SAV_UserArgs_MT128x192x32_MI32x32x1_SN_LDSB1_AFC1_AFEM1_AFEM1_ASEM1_CLR1_CADS0_DTVA0_DTVB0_EPS0_FDSI0_GRPM1_GRVWA4_GRVWB4_GSUn1_GSUAMBSK_GSUC1_GSUWGMRR1_GLS0_ISA942_IU1_K1_LBSPPA0_LBSPPB0_LBSPPM0_LPA0_LPB0_LPM0_LRVW2_LWPMn1_MIAV0_MIWT2_3_MO40_NTn1_NTA0_NTB0_NTC0_NTD4_NTM0_NEPBS8_NLCA1_NLCB1_ONLL1_PGR2_PLR1_PKA1_SIA3_SS1_SU0_SUM1_SUS0_SPO0_SRVW0_SSO0_SVW2_SK0_SKXCCM0_TLDS0_ULSGRO0_USL1_UIOFGRO0_USFGROn1_VSn1_VWA2_VWB1_WSGRA0_WSGRB0_WS64_WG64_4_1_WGM8_WGMXCC4_WGMXCCGn1
    SolutionIndex: 208
    SolutionNameMin: Cijk_Ailk_Bjlk_S_MX_B_Bias_HA_S_SAV_UserArgs_MT128x384x32_MI32x32x1_SN_LDSB1_AFC1_AFEM1_AFEM1_ASEM1_CLR1_CADS0_DTVA0_DTVB0_EPS0_FDSI0_GRPM1_GRVWA4_GRVWB4_GSUn1_GSUAMBSK_GSUC1_GSUWGMRR1_GLS0_ISA942_IU1_K1_LBSPPA0_LBSPPB0_LBSPPM0_LPA0_LPB0_LPM0_LRVW2_LWPMn1_MIAV0_MIWT2_6_MO40_NTn1_NTA0_NTB0_NTC0_NTD4_NTM0_NEPBS8_NLCA1_NLCB1_ONLL1_PGR2_PLR1_PKA1_SIA3_SS1_SU0_SUM1_SUS0_SPO0_SRVW0_SSO0_SVW2_SK0_SKXCCM0_TLDS0_ULSGRO0_USL1_UIOFGRO0_USFGROn1_VSn1_VWA2_VWB2_WSGRA0_WSGRB0_WS64_WG64_4_1_WGM8_WGMXCC4_WGMXCCGn1
    SolutionIndex: 209
    SolutionNameMin: Cijk_Ailk_Bjlk_S_MX_B_Bias_HA_S_SAV_UserArgs_MT192x160x32_MI16x16x1_SN_LDSB1_AFC1_AFEM1_AFEM1_ASEM1_CLR1_CADS0_DTVA0_DTVB0_EPS0_FDSI0_GRPM1_GRVWA4_GRVWB4_GSUn1_GSUAMBSK_GSUC1_GSUWGMRR1_GLS0_ISA942_IU1_K1_LBSPPA1536_LBSPPB1280_LBSPPM0_LPA0_LPB16_LPM0_LRVW2_LWPMn1_MIAV0_MIWT6_5_MO40_NTn1_NTA0_NTB0_NTC0_NTD4_NTM0_NEPBS6_NLCA1_NLCB1_ONLL1_PGR2_PLR1_PKA1_SIA3_SS1_SU0_SUM1_SUS0_SPO0_SRVW0_SSO0_SVW2_SK0_SKXCCM0_TLDS0_ULSGRO0_USL1_UIOFGRO0_USFGROn1_VSn1_VWA2_VWB1_WSGRA0_WSGRB0_WS64_WG32_8_1_WGM8_WGMXCC4_WGMXCCGn1
    SolutionIndex: 210
    SolutionNameMin: Cijk_Ailk_Bjlk_S_MX_B_Bias_HA_S_SAV_UserArgs_MT192x320x32_MI32x32x1_SN_LDSB1_AFC1_AFEM1_AFEM1_ASEM1_CLR1_CADS0_DTVA0_DTVB0_EPS0_FDSI0_GRPM1_GRVWA4_GRVWB4_GSUn1_GSUAMBSK_GSUC1_GSUWGMRR1_GLS0_ISA942_IU1_K1_LBSPPA0_LBSPPB0_LBSPPM0_LPA0_LPB0_LPM0_LRVW2_LWPMn1_MIAV0_MIWT3_5_MO40_NTn1_NTA0_NTB0_NTC0_NTD4_NTM0_NEPBS6_NLCA1_NLCB1_ONLL1_PGR2_PLR1_PKA1_SIA3_SS1_SU0_SUM1_SUS0_SPO0_SRVW0_SSO0_SVW1_SK0_SKXCCM0_TLDS0_ULSGRO0_USL1_UIOFGRO0_USFGROn1_VSn1_VWA1_VWB1_WSGRA0_WSGRB0_WS64_WG64_4_1_WGM8_WGMXCC4_WGMXCCGn1
    SolutionIndex: 211
    SolutionNameMin: Cijk_Ailk_Bjlk_S_MX_B_Bias_HA_S_SAV_UserArgs_MT256x224x32_MI32x32x1_SN_LDSB1_AFC1_AFEM1_AFEM1_ASEM1_CLR1_CADS0_DTVA0_DTVB0_EPS0_FDSI0_GRPM1_GRVWA4_GRVWB4_GSUn1_GSUAMBSK_GSUC1_GSUWGMRR1_GLS0_ISA942_IU1_K1_LBSPPA0_LBSPPB0_LBSPPM0_LPA0_LPB0_LPM0_LRVW2_LWPMn1_MIAV0_MIWT2_7_MO40_NTn1_NTA0_NTB0_NTC0_NTD4_NTM0_NEPBS8_NLCA1_NLCB1_ONLL1_PGR2_PLR1_PKA1_SIA3_SS1_SU0_SUM1_SUS0_SPO0_SRVW0_SSO0_SVW2_SK0_SKXCCM0_TLDS0_ULSGRO0_USL1_UIOFGRO0_USFGROn1_VSn1_VWA2_VWB1_WSGRA0_WSGRB0_WS64_WG128_2_1_WGM8_WGMXCC4_WGMXCCGn1
    SolutionIndex: 212
    SolutionNameMin: Cijk_Ailk_Bjlk_S_MX_B_Bias_HA_S_SAV_UserArgs_MT192x320x16_MI32x32x1_SN_LDSB1_AFC1_AFEM1_AFEM1_ASEM1_CLR1_CADS0_DTVA0_DTVB0_EPS0_FDSI0_GRPM1_GRVWA4_GRVWB4_GSUn1_GSUAMBSK_GSUC1_GSUWGMRR1_GLS0_ISA942_IU1_K1_LBSPPA0_LBSPPB0_LBSPPM0_LPA0_LPB0_LPM0_LRVW2_LWPMn1_MIAV0_MIWT3_5_MO40_NTn1_NTA0_NTB0_NTC0_NTD4_NTM0_NEPBS6_NLCA1_NLCB1_ONLL1_PGR2_PLR1_PKA1_SIA3_SS1_SU0_SUM1_SUS0_SPO0_SRVW0_SSO0_SVW1_SK0_SKXCCM0_TLDS0_ULSGRO0_USL1_UIOFGRO0_USFGROn1_VSn1_VWA1_VWB1_WSGRA0_WSGRB0_WS64_WG64_4_1_WGM8_WGMXCC4_WGMXCCGn1
    SolutionIndex: 213
    SolutionNameMin: Cijk_Ailk_Bjlk_S_MX_B_Bias_HA_S_SAV_UserArgs_MT128x448x16_MI16x16x1_SN_LDSB1_AFC1_AFEM1_AFEM1_ASEM1_CLR1_CADS0_DTVA0_DTVB0_EPS0_FDSI0_GRPM1_GRVWA4_GRVWB4_GSUn1_GSUAMBSK_GSUC1_GSUWGMRR1_GLS0_ISA942_IU1_K1_LBSPPA1024_LBSPPB3584_LBSPPM0_LPA0_LPB0_LPM0_LRVW2_LWPMn1_MIAV0_MIWT4_14_MO40_NTn1_NTA0_NTB0_NTC0_NTD4_NTM0_NEPBS8_NLCA1_NLCB1_ONLL1_PGR2_PLR1_PKA1_SIA3_SS1_SU0_SUM1_SUS0_SPO0_SRVW0_SSO4_SVW4_SK0_SKXCCM0_TLDS0_ULSGRO0_USL1_UIOFGRO0_USFGROn1_VSn1_VWA4_VWB2_WSGRA0_WSGRB0_WS64_WG32_8_1_WGM8_WGMXCC4_WGMXCCGn1
    SolutionIndex: 214
    SolutionNameMin: Cijk_Ailk_Bjlk_S_MX_B_Bias_HA_S_SAV_UserArgs_MT256x224x32_MI32x32x1_SN_LDSB1_AFC1_AFEM1_AFEM1_ASEM1_CLR1_CADS0_DTVA0_DTVB0_EPS0_FDSI0_GRPM1_GRVWA4_GRVWB4_GSUn1_GSUAMBSK_GSUC1_GSUWGMRR1_GLS0_ISA942_IU1_K1_LBSPPA0_LBSPPB0_LBSPPM0_LPA0_LPB0_LPM0_LRVW2_LWPMn1_MIAV0_MIWT2_7_MO40_NTn1_NTA0_NTB0_NTC0_NTD4_NTM0_NEPBS8_NLCA1_NLCB1_ONLL1_PGR2_PLR1_PKA1_SIA3_SS1_SU0_SUM1_SUS0_SPO0_SRVW0_SSO4_SVW2_SK0_SKXCCM0_TLDS0_ULSGRO0_USL1_UIOFGRO0_USFGROn1_VSn1_VWA2_VWB1_WSGRA0_WSGRB0_WS64_WG128_2_1_WGM8_WGMXCC4_WGMXCCGn1
    SolutionIndex: 215
    SolutionNameMin: Cijk_Ailk_Bjlk_S_MX_B_Bias_HA_S_SAV_UserArgs_MT128x128x16_MI32x32x1_SN_LDSB1_AFC1_AFEM1_AFEM1_ASEM1_CLR1_CADS0_DTVA0_DTVB0_EPS0_FDSI0_GRPM1_GRVWA4_GRVWB4_GSUn1_GSUAMBSK_GSUC1_GSUWGMRR1_GLS0_ISA942_IU1_K1_LBSPPA0_LBSPPB0_LBSPPM0_LPA0_LPB0_LPM0_LRVW2_LWPMn1_MIAV0_MIWT2_2_MO40_NTn1_NTA0_NTB0_NTC0_NTD4_NTM0_NEPBS8_NLCA1_NLCB1_ONLL1_PGR2_PLR1_PKA1_SIA3_SS1_SU0_SUM1_SUS0_SPO0_SRVW0_SSO4_SVW2_SK0_SKXCCM0_TLDS0_ULSGRO0_USL1_UIOFGRO0_USFGROn1_VSn1_VWA2_VWB2_WSGRA0_WSGRB0_WS64_WG64_4_1_WGM8_WGMXCC4_WGMXCCGn1
    SolutionIndex: 216
    SolutionNameMin: Cijk_Ailk_Bjlk_S_MX_B_Bias_HA_S_SAV_UserArgs_MT256x160x32_MI32x32x1_SN_LDSB1_AFC1_AFEM1_AFEM1_ASEM1_CLR1_CADS0_DTVA0_DTVB0_EPS0_FDSI0_GRPM1_GRVWA4_GRVWB4_GSUn1_GSUAMBSK_GSUC1_GSUWGMRR1_GLS0_ISA942_IU1_K1_LBSPPA0_LBSPPB0_LBSPPM0_LPA0_LPB0_LPM0_LRVW2_LWPMn1_MIAV0_MIWT2_5_MO40_NTn1_NTA0_NTB0_NTC0_NTD4_NTM0_NEPBS8_NLCA1_NLCB1_ONLL1_PGR2_PLR1_PKA1_SIA3_SS1_SU0_SUM1_SUS0_SPO0_SRVW0_SSO4_SVW2_SK0_SKXCCM0_TLDS0_ULSGRO0_USL1_UIOFGRO0_USFGROn1_VSn1_VWA2_VWB1_WSGRA0_WSGRB0_WS64_WG128_2_1_WGM8_WGMXCC4_WGMXCCGn1
    SolutionIndex: 217
    SolutionNameMin: Cijk_Ailk_Bjlk_S_MX_B_Bias_HA_S_SAV_UserArgs_MT128x320x16_MI16x16x1_SN_LDSB1_AFC1_AFEM1_AFEM1_ASEM1_CLR1_CADS0_DTVA0_DTVB0_EPS0_FDSI0_GRPM1_GRVWA4_GRVWB4_GSUn1_GSUAMBSK_GSUC1_GSUWGMRR1_GLS0_ISA942_IU1_K1_LBSPPA1024_LBSPPB2560_LBSPPM0_LPA0_LPB16_LPM0_LRVW2_LWPMn1_MIAV0_MIWT8_5_MO40_NTn1_NTA0_NTB0_NTC0_NTD4_NTM0_NEPBS8_NLCA1_NLCB1_ONLL1_PGR2_PLR1_PKA1_SIA3_SS1_SU0_SUM1_SUS0_SPO0_SRVW0_SSO4_SVW4_SK0_SKXCCM0_TLDS0_ULSGRO0_USL1_UIOFGRO0_USFGROn1_VSn1_VWA4_VWB1_WSGRA0_WSGRB0_WS64_WG16_16_1_WGM8_WGMXCC4_WGMXCCGn1
    SolutionIndex: 218
    SolutionNameMin: Cijk_Ailk_Bjlk_S_MX_B_Bias_HA_S_SAV_UserArgs_MT128x192x16_MI32x32x1_SN_LDSB1_AFC1_AFEM1_AFEM1_ASEM1_CLR1_CADS0_DTVA0_DTVB0_EPS0_FDSI0_GRPM1_GRVWA4_GRVWB4_GSUn1_GSUAMBSK_GSUC1_GSUWGMRR1_GLS0_ISA942_IU1_K1_LBSPPA0_LBSPPB0_LBSPPM0_LPA0_LPB0_LPM0_LRVW2_LWPMn1_MIAV0_MIWT2_3_MO40_NTn1_NTA0_NTB0_NTC0_NTD4_NTM0_NEPBS8_NLCA1_NLCB1_ONLL1_PGR2_PLR1_PKA1_SIA3_SS1_SU0_SUM1_SUS0_SPO0_SRVW0_SSO4_SVW2_SK0_SKXCCM0_TLDS0_ULSGRO0_USL1_UIOFGRO0_USFGROn1_VSn1_VWA2_VWB1_WSGRA0_WSGRB0_WS64_WG64_4_1_WGM8_WGMXCC4_WGMXCCGn1
    SolutionIndex: 219
    SolutionNameMin: Cijk_Ailk_Bjlk_S_MX_B_Bias_HA_S_SAV_UserArgs_MT192x320x32_MI32x32x1_SN_LDSB1_AFC1_AFEM1_AFEM1_ASEM1_CLR1_CADS0_DTVA0_DTVB0_EPS0_FDSI0_GRPM1_GRVWA4_GRVWB4_GSUn1_GSUAMBSK_GSUC1_GSUWGMRR1_GLS0_ISA942_IU1_K1_LBSPPA0_LBSPPB0_LBSPPM0_LPA0_LPB0_LPM0_LRVW2_LWPMn1_MIAV0_MIWT3_5_MO40_NTn1_NTA0_NTB0_NTC0_NTD4_NTM0_NEPBS6_NLCA1_NLCB1_ONLL1_PGR2_PLR1_PKA1_SIA3_SS1_SU0_SUM1_SUS0_SPO0_SRVW0_SSO4_SVW1_SK0_SKXCCM0_TLDS0_ULSGRO0_USL1_UIOFGRO0_USFGROn1_VSn1_VWA1_VWB1_WSGRA0_WSGRB0_WS64_WG64_4_1_WGM8_WGMXCC4_WGMXCCGn1
    SolutionIndex: 220
    SolutionNameMin: Cijk_Ailk_Bjlk_S_MX_B_Bias_HA_S_SAV_UserArgs_MT16x96x64_MI16x16x1_SN_LDSB1_AFC1_AFEM1_AFEM1_ASEM1_CLR1_CADS0_DTVA0_DTVB0_EPS0_FDSI0_GRPM1_GRVWA4_GRVWB4_GSUn1_GSUAMBSK_GSUC1_GSUWGMRR1_GLS0_ISA942_IU1_K1_LBSPPA128_LBSPPB768_LBSPPM0_LPA16_LPB16_LPM0_LRVW2_LWPMn1_MIAV0_MIWT1_3_MO40_NTn1_NTA0_NTB0_NTC0_NTD4_NTM0_NEPBS8_NLCA1_NLCB1_ONLL1_PGR2_PLR1_PKA1_SIA3_SS1_SU0_SUM1_SUS0_SPO0_SRVW0_SSO0_SVW1_SK0_SKXCCM0_TLDS0_ULSGRO0_USL1_UIOFGRO0_USFGROn1_VSn1_VWA1_VWB1_WSGRA0_WSGRB0_WS64_WG16_8_2_WGM1_WGMXCC4_WGMXCCGn1
    SolutionIndex: 221
    SolutionNameMin: Cijk_Ailk_Bjlk_S_MX_B_Bias_HA_S_SAV_UserArgs_MT32x160x64_MI16x16x1_SN_LDSB1_AFC1_AFEM1_AFEM1_ASEM1_CLR1_CADS0_DTVA0_DTVB0_EPS0_FDSI0_GRPM1_GRVWA4_GRVWB4_GSUn1_GSUAMBSK_GSUC1_GSUWGMRR1_GLS0_ISA942_IU1_K1_LBSPPA256_LBSPPB1280_LBSPPM0_LPA0_LPB16_LPM0_LRVW2_LWPMn1_MIAV0_MIWT2_5_MO40_NTn1_NTA0_NTB0_NTC0_NTD4_NTM0_NEPBS8_NLCA1_NLCB1_ONLL1_PGR2_PLR1_PKA1_SIA3_SS1_SU0_SUM1_SUS0_SPO0_SRVW0_SSO0_SVW2_SK0_SKXCCM0_TLDS0_ULSGRO0_USL1_UIOFGRO0_USFGROn1_VSn1_VWA2_VWB1_WSGRA0_WSGRB0_WS64_WG16_8_2_WGM1_WGMXCC4_WGMXCCGn1
    SolutionIndex: 222
    SolutionNameMin: Cijk_Ailk_Bjlk_S_MX_B_Bias_HA_S_SAV_UserArgs_MT64x112x64_MI16x16x1_SN_LDSB1_AFC1_AFEM1_AFEM1_ASEM1_CLR1_CADS0_DTVA0_DTVB0_EPS0_FDSI0_GRPM1_GRVWA4_GRVWB4_GSUn1_GSUAMBSK_GSUC1_GSUWGMRR1_GLS0_ISA942_IU1_K1_LBSPPA512_LBSPPB896_LBSPPM0_LPA0_LPB16_LPM0_LRVW2_LWPMn1_MIAV0_MIWT2_7_MO40_NTn1_NTA0_NTB0_NTC0_NTD4_NTM0_NEPBS8_NLCA1_NLCB1_ONLL1_PGR2_PLR1_PKA1_SIA3_SS1_SU0_SUM1_SUS0_SPO0_SRVW0_SSO0_SVW2_SK0_SKXCCM0_TLDS0_ULSGRO0_USL1_UIOFGRO0_USFGROn1_VSn1_VWA2_VWB1_WSGRA0_WSGRB0_WS64_WG32_4_2_WGM1_WGMXCC4_WGMXCCGn1
    SolutionIndex: 223
    SolutionNameMin: Cijk_Ailk_Bjlk_S_MX_B_Bias_HA_S_SAV_UserArgs_MT64x160x64_MI16x16x1_SN_LDSB1_AFC1_AFEM1_AFEM1_ASEM1_CLR1_CADS0_DTVA0_DTVB0_EPS0_FDSI0_GRPM1_GRVWA4_GRVWB4_GSUn1_GSUAMBSK_GSUC1_GSUWGMRR1_GLS0_ISA942_IU1_K1_LBSPPA512_LBSPPB1280_LBSPPM0_LPA0_LPB16_LPM0_LRVW2_LWPMn1_MIAV0_MIWT2_5_MO40_NTn1_NTA0_NTB0_NTC0_NTD4_NTM0_NEPBS8_NLCA1_NLCB1_ONLL1_PGR2_PLR1_PKA1_SIA3_SS1_SU0_SUM1_SUS0_SPO0_SRVW0_SSO0_SVW2_SK0_SKXCCM0_TLDS0_ULSGRO0_USL1_UIOFGRO0_USFGROn1_VSn1_VWA2_VWB1_WSGRA0_WSGRB0_WS64_WG32_8_1_WGM1_WGMXCC4_WGMXCCGn1
    SolutionIndex: 224
    SolutionNameMin: Cijk_Ailk_Bjlk_S_MX_B_Bias_HA_S_SAV_UserArgs_MT128x224x32_MI16x16x1_SN_LDSB1_AFC1_AFEM1_AFEM1_ASEM1_CLR1_CADS0_DTVA0_DTVB0_EPS0_FDSI0_GRPM1_GRVWA4_GRVWB4_GSUn1_GSUAMBSK_GSUC1_GSUWGMRR1_GLS0_ISA942_IU1_K1_LBSPPA1024_LBSPPB1792_LBSPPM0_LPA0_LPB16_LPM0_LRVW2_LWPMn1_MIAV0_MIWT4_7_MO40_NTn1_NTA0_NTB0_NTC0_NTD4_NTM0_NEPBS8_NLCA1_NLCB1_ONLL1_PGR2_PLR1_PKA1_SIA3_SS1_SU0_SUM1_SUS0_SPO0_SRVW0_SSO0_SVW4_SK0_SKXCCM0_TLDS0_ULSGRO0_USL1_UIOFGRO0_USFGROn1_VSn1_VWA4_VWB1_WSGRA0_WSGRB0_WS64_WG32_8_1_WGM8_WGMXCC4_WGMXCCGn1
    SolutionIndex: 225
    SolutionNameMin: Cijk_Ailk_Bjlk_S_MX_B_Bias_HA_S_SAV_UserArgs_MT128x128x16_MI32x32x1_SN_LDSB1_AFC1_AFEM1_AFEM1_ASEM1_CLR1_CADS0_DTVA0_DTVB0_EPS0_FDSI0_GRPM1_GRVWA4_GRVWB4_GSUn1_GSUAMBSK_GSUC1_GSUWGMRR1_GLS0_ISA942_IU1_K1_LBSPPA0_LBSPPB0_LBSPPM0_LPA0_LPB0_LPM0_LRVW2_LWPMn1_MIAV0_MIWT2_2_MO40_NTn1_NTA0_NTB0_NTC0_NTD4_NTM0_NEPBS8_NLCA1_NLCB1_ONLL1_PGR2_PLR1_PKA1_SIA3_SS1_SU0_SUM1_SUS0_SPO0_SRVW0_SSO0_SVW2_SK0_SKXCCM0_TLDS0_ULSGRO0_USL1_UIOFGRO0_USFGROn1_VSn1_VWA2_VWB2_WSGRA0_WSGRB0_WS64_WG64_4_1_WGM8_WGMXCC4_WGMXCCGn1
    SolutionIndex: 226
    SolutionNameMin: Cijk_Ailk_Bjlk_S_MX_B_Bias_HA_S_SAV_UserArgs_MT160x224x32_MI16x16x1_SN_LDSB1_AFC1_AFEM1_AFEM1_ASEM1_CLR1_CADS0_DTVA0_DTVB0_EPS0_FDSI0_GRPM1_GRVWA4_GRVWB4_GSUn1_GSUAMBSK_GSUC1_GSUWGMRR1_GLS0_ISA942_IU1_K1_LBSPPA1280_LBSPPB1792_LBSPPM0_LPA16_LPB16_LPM0_LRVW2_LWPMn1_MIAV0_MIWT5_7_MO40_NTn1_NTA0_NTB0_NTC0_NTD4_NTM0_NEPBS5_NLCA1_NLCB1_ONLL1_PGR2_PLR1_PKA1_SIA3_SS1_SU0_SUM1_SUS0_SPO0_SRVW0_SSO0_SVW1_SK0_SKXCCM0_TLDS0_ULSGRO0_USL1_UIOFGRO0_USFGROn1_VSn1_VWA1_VWB1_WSGRA0_WSGRB0_WS64_WG32_8_1_WGM8_WGMXCC4_WGMXCCGn1
    SolutionIndex: 227
    SolutionNameMin: Cijk_Ailk_Bjlk_S_MX_B_Bias_HA_S_SAV_UserArgs_MT224x160x32_MI16x16x1_SN_LDSB1_AFC1_AFEM1_AFEM1_ASEM1_CLR1_CADS0_DTVA0_DTVB0_EPS0_FDSI0_GRPM1_GRVWA4_GRVWB4_GSUn1_GSUAMBSK_GSUC1_GSUWGMRR1_GLS0_ISA942_IU1_K1_LBSPPA1792_LBSPPB1280_LBSPPM0_LPA16_LPB16_LPM0_LRVW2_LWPMn1_MIAV0_MIWT7_5_MO40_NTn1_NTA0_NTB0_NTC0_NTD4_NTM0_NEPBS7_NLCA1_NLCB1_ONLL1_PGR2_PLR1_PKA1_SIA3_SS1_SU0_SUM1_SUS0_SPO0_SRVW0_SSO0_SVW1_SK0_SKXCCM0_TLDS0_ULSGRO0_USL1_UIOFGRO0_USFGROn1_VSn1_VWA1_VWB1_WSGRA0_WSGRB0_WS64_WG32_8_1_WGM8_WGMXCC4_WGMXCCGn1
    SolutionIndex: 228
    SolutionNameMin: Cijk_Ailk_Bjlk_S_MX_B_Bias_HA_S_SAV_UserArgs_MT256x192x16_MI32x32x1_SN_LDSB1_AFC1_AFEM1_AFEM1_ASEM1_CLR1_CADS0_DTVA0_DTVB0_EPS0_FDSI0_GRPM1_GRVWA4_GRVWB4_GSUn1_GSUAMBSK_GSUC1_GSUWGMRR1_GLS0_ISA942_IU1_K1_LBSPPA0_LBSPPB0_LBSPPM0_LPA0_LPB0_LPM0_LRVW2_LWPMn1_MIAV0_MIWT4_3_MO40_NTn1_NTA0_NTB0_NTC0_NTD4_NTM0_NEPBS8_NLCA1_NLCB1_ONLL1_PGR2_PLR1_PKA1_SIA3_SS1_SU0_SUM1_SUS0_SPO0_SRVW0_SSO0_SVW4_SK0_SKXCCM0_TLDS0_ULSGRO0_USL1_UIOFGRO0_USFGROn1_VSn1_VWA4_VWB1_WSGRA0_WSGRB0_WS64_WG64_4_1_WGM8_WGMXCC4_WGMXCCGn1
    SolutionIndex: 229
    SolutionNameMin: Cijk_Ailk_Bjlk_S_MX_B_Bias_HA_S_SAV_UserArgs_MT128x320x32_MI32x32x1_SN_LDSB1_AFC1_AFEM1_AFEM1_ASEM1_CLR1_CADS0_DTVA0_DTVB0_EPS0_FDSI0_GRPM1_GRVWA4_GRVWB4_GSUn1_GSUAMBSK_GSUC1_GSUWGMRR1_GLS0_ISA942_IU1_K1_LBSPPA0_LBSPPB0_LBSPPM0_LPA0_LPB0_LPM0_LRVW2_LWPMn1_MIAV0_MIWT2_5_MO40_NTn1_NTA0_NTB0_NTC0_NTD4_NTM0_NEPBS8_NLCA1_NLCB1_ONLL1_PGR2_PLR1_PKA1_SIA3_SS1_SU0_SUM1_SUS0_SPO0_SRVW0_SSO0_SVW2_SK0_SKXCCM0_TLDS0_ULSGRO0_USL1_UIOFGRO0_USFGROn1_VSn1_VWA2_VWB1_WSGRA0_WSGRB0_WS64_WG64_4_1_WGM8_WGMXCC4_WGMXCCGn1
    SolutionIndex: 230
    SolutionNameMin: Cijk_Ailk_Bjlk_S_MX_B_Bias_HA_S_SAV_UserArgs_MT128x384x16_MI32x32x1_SN_LDSB1_AFC1_AFEM1_AFEM1_ASEM1_CLR1_CADS0_DTVA0_DTVB0_EPS0_FDSI0_GRPM1_GRVWA4_GRVWB4_GSUn1_GSUAMBSK_GSUC1_GSUWGMRR1_GLS0_ISA942_IU1_K1_LBSPPA0_LBSPPB0_LBSPPM0_LPA0_LPB0_LPM0_LRVW2_LWPMn1_MIAV0_MIWT2_6_MO40_NTn1_NTA0_NTB0_NTC0_NTD4_NTM0_NEPBS8_NLCA1_NLCB1_ONLL1_PGR2_PLR1_PKA1_SIA3_SS1_SU0_SUM1_SUS0_SPO0_SRVW0_SSO0_SVW2_SK0_SKXCCM0_TLDS0_ULSGRO0_USL1_UIOFGRO0_USFGROn1_VSn1_VWA2_VWB2_WSGRA0_WSGRB0_WS64_WG64_4_1_WGM8_WGMXCC4_WGMXCCGn1
    SolutionIndex: 231
    SolutionNameMin: Cijk_Ailk_Bjlk_S_MX_B_Bias_HA_S_SAV_UserArgs_MT192x320x16_MI16x16x1_SN_LDSB1_AFC1_AFEM1_AFEM1_ASEM1_CLR1_CADS0_DTVA0_DTVB0_EPS0_FDSI0_GRPM1_GRVWA4_GRVWB4_GSUn1_GSUAMBSK_GSUC1_GSUWGMRR1_GLS0_ISA942_IU1_K1_LBSPPA1536_LBSPPB2560_LBSPPM0_LPA0_LPB0_LPM0_LRVW2_LWPMn1_MIAV0_MIWT6_10_MO40_NTn1_NTA0_NTB0_NTC0_NTD4_NTM0_NEPBS6_NLCA1_NLCB1_ONLL1_PGR2_PLR1_PKA1_SIA3_SS1_SU0_SUM1_SUS0_SPO0_SRVW0_SSO0_SVW2_SK0_SKXCCM0_TLDS0_ULSGRO0_USL1_UIOFGRO0_USFGROn1_VSn1_VWA2_VWB2_WSGRA0_WSGRB0_WS64_WG32_8_1_WGM8_WGMXCC4_WGMXCCGn1
    SolutionIndex: 232
    SolutionNameMin: Cijk_Ailk_Bjlk_S_MX_B_Bias_HA_S_SAV_UserArgs_MT192x192x16_MI32x32x1_SN_LDSB1_AFC1_AFEM1_AFEM1_ASEM1_CLR1_CADS0_DTVA0_DTVB0_EPS0_FDSI0_GRPM1_GRVWA4_GRVWB4_GSUn1_GSUAMBSK_GSUC1_GSUWGMRR1_GLS0_ISA942_IU1_K1_LBSPPA0_LBSPPB0_LBSPPM0_LPA0_LPB0_LPM0_LRVW2_LWPMn1_MIAV0_MIWT3_3_MO40_NTn1_NTA0_NTB0_NTC0_NTD4_NTM0_NEPBS6_NLCA1_NLCB1_ONLL1_PGR2_PLR1_PKA1_SIA3_SS1_SU0_SUM1_SUS0_SPO0_SRVW0_SSO4_SVW1_SK0_SKXCCM0_TLDS0_ULSGRO0_USL1_UIOFGRO0_USFGROn1_VSn1_VWA1_VWB1_WSGRA0_WSGRB0_WS64_WG64_4_1_WGM8_WGMXCC4_WGMXCCGn1
    SolutionIndex: 233
    SolutionNameMin: Cijk_Ailk_Bjlk_S_MX_B_Bias_HA_S_SAV_UserArgs_MT16x224x64_MI16x16x1_SN_LDSB1_AFC1_AFEM1_AFEM1_ASEM1_CLR1_CADS0_DTVA0_DTVB0_EPS0_FDSI0_GRPM1_GRVWA1_GRVWB4_GSUn1_GSUAMBSK_GSUC1_GSUWGMRR1_GLS0_ISA942_IU1_K1_LBSPPA128_LBSPPB1792_LBSPPM0_LPA16_LPB16_LPM0_LRVW2_LWPMn1_MIAV0_MIWT1_7_MO40_NTn1_NTA0_NTB0_NTC0_NTD4_NTM0_NEPBS8_NLCA1_NLCB1_ONLL1_PGR2_PLR1_PKA1_SIA3_SS1_SU0_SUM1_SUS0_SPO0_SRVW0_SSO0_SVW1_SK0_SKXCCM0_TLDS0_ULSGRO0_USL1_UIOFGRO0_USFGROn1_VSn1_VWA1_VWB1_WSGRA0_WSGRB0_WS64_WG16_8_2_WGM1_WGMXCC4_WGMXCCGn1
    SolutionIndex: 234
    SolutionNameMin: Cijk_Ailk_Bjlk_S_MX_B_Bias_HA_S_SAV_UserArgs_MT16x128x32_MI16x16x1_SN_LDSB1_AFC1_AFEM1_AFEM1_ASEM1_CLR1_CADS0_DTVA0_DTVB0_EPS0_FDSI0_GRPM1_GRVWA1_GRVWB4_GSUn1_GSUAMBSK_GSUC1_GSUWGMRR1_GLS0_ISA942_IU1_K1_LBSPPA128_LBSPPB1024_LBSPPM0_LPA16_LPB0_LPM0_LRVW2_LWPMn1_MIAV0_MIWT1_2_MO40_NTn1_NTA0_NTB0_NTC0_NTD4_NTM0_NEPBS8_NLCA1_NLCB1_ONLL1_PGR2_PLR1_PKA1_SIA3_SS1_SU0_SUM1_SUS0_SPO0_SRVW0_SSO0_SVW1_SK0_SKXCCM0_TLDS0_ULSGRO0_USL1_UIOFGRO0_USFGROn1_VSn1_VWA1_VWB2_WSGRA0_WSGRB0_WS64_WG16_16_1_WGM1_WGMXCC4_WGMXCCGn1
    SolutionIndex: 235
    SolutionNameMin: Cijk_Ailk_Bjlk_S_MX_B_Bias_HA_S_SAV_UserArgs_MT16x448x32_MI16x16x1_SN_LDSB1_AFC1_AFEM1_AFEM1_ASEM1_CLR1_CADS0_DTVA0_DTVB0_EPS0_FDSI0_GRPM1_GRVWA1_GRVWB4_GSUn1_GSUAMBSK_GSUC1_GSUWGMRR1_GLS0_ISA942_IU1_K1_LBSPPA128_LBSPPB3584_LBSPPM0_LPA16_LPB16_LPM0_LRVW2_LWPMn1_MIAV0_MIWT1_7_MO40_NTn1_NTA0_NTB0_NTC0_NTD4_NTM0_NEPBS8_NLCA1_NLCB1_ONLL1_PGR2_PLR1_PKA1_SIA3_SS1_SU0_SUM1_SUS0_SPO0_SRVW0_SSO0_SVW1_SK0_SKXCCM0_TLDS0_ULSGRO0_USL1_UIOFGRO0_USFGROn1_VSn1_VWA1_VWB1_WSGRA0_WSGRB0_WS64_WG16_16_1_WGM1_WGMXCC4_WGMXCCGn1
    SolutionIndex: 236
    SolutionNameMin: Cijk_Ailk_Bjlk_S_MX_B_Bias_HA_S_SAV_UserArgs_MT32x320x32_MI16x16x1_SN_LDSB1_AFC1_AFEM1_AFEM1_ASEM1_CLR1_CADS0_DTVA0_DTVB0_EPS0_FDSI0_GRPM1_GRVWA4_GRVWB4_GSUn1_GSUAMBSK_GSUC1_GSUWGMRR1_GLS0_ISA942_IU1_K1_LBSPPA256_LBSPPB2560_LBSPPM0_LPA0_LPB16_LPM0_LRVW2_LWPMn1_MIAV0_MIWT2_5_MO40_NTn1_NTA0_NTB0_NTC0_NTD4_NTM0_NEPBS8_NLCA1_NLCB1_ONLL1_PGR2_PLR1_PKA1_SIA3_SS1_SU0_SUM1_SUS0_SPO0_SRVW0_SSO0_SVW2_SK0_SKXCCM0_TLDS0_ULSGRO0_USL1_UIOFGRO0_USFGROn1_VSn1_VWA2_VWB1_WSGRA0_WSGRB0_WS64_WG16_16_1_WGM1_WGMXCC4_WGMXCCGn1
    SolutionIndex: 237
    SolutionNameMin: Cijk_Ailk_Bjlk_S_MX_B_Bias_HA_S_SAV_UserArgs_MT16x160x64_MI16x16x1_SN_LDSB1_AFC1_AFEM1_AFEM1_ASEM1_CLR1_CADS0_DTVA0_DTVB0_EPS0_FDSI0_GRPM1_GRVWA4_GRVWB4_GSUn1_GSUAMBSK_GSUC1_GSUWGMRR1_GLS0_ISA942_IU1_K1_LBSPPA128_LBSPPB1280_LBSPPM0_LPA16_LPB16_LPM0_LRVW2_LWPMn1_MIAV0_MIWT1_5_MO40_NTn1_NTA0_NTB0_NTC0_NTD4_NTM0_NEPBS8_NLCA1_NLCB1_ONLL1_PGR2_PLR1_PKA1_SIA3_SS1_SU0_SUM1_SUS0_SPO0_SRVW0_SSO0_SVW1_SK0_SKXCCM0_TLDS0_ULSGRO0_USL1_UIOFGRO0_USFGROn1_VSn1_VWA1_VWB1_WSGRA0_WSGRB0_WS64_WG16_8_2_WGM1_WGMXCC4_WGMXCCGn1
    SolutionIndex: 238
    SolutionNameMin: Cijk_Ailk_Bjlk_S_MX_B_Bias_HA_S_SAV_UserArgs_MT16x224x64_MI16x16x1_SN_LDSB1_AFC1_AFEM1_AFEM1_ASEM1_CLR1_CADS0_DTVA0_DTVB0_EPS0_FDSI0_GRPM1_GRVWA4_GRVWB4_GSUn1_GSUAMBSK_GSUC1_GSUWGMRR1_GLS0_ISA942_IU1_K1_LBSPPA128_LBSPPB1792_LBSPPM0_LPA16_LPB16_LPM0_LRVW2_LWPMn1_MIAV0_MIWT1_7_MO40_NTn1_NTA0_NTB0_NTC0_NTD4_NTM0_NEPBS8_NLCA1_NLCB1_ONLL1_PGR2_PLR1_PKA1_SIA3_SS1_SU0_SUM1_SUS0_SPO0_SRVW0_SSO0_SVW1_SK0_SKXCCM0_TLDS0_ULSGRO0_USL1_UIOFGRO0_USFGROn1_VSn1_VWA1_VWB1_WSGRA0_WSGRB0_WS64_WG16_8_2_WGM1_WGMXCC4_WGMXCCGn1
    SolutionIndex: 239
    SolutionNameMin: Cijk_Ailk_Bjlk_S_MX_B_Bias_HA_S_SAV_UserArgs_MT32x192x32_MI16x16x1_SN_LDSB1_AFC1_AFEM1_AFEM1_ASEM1_CLR1_CADS0_DTVA0_DTVB0_EPS0_FDSI0_GRPM1_GRVWA4_GRVWB4_GSUn1_GSUAMBSK_GSUC1_GSUWGMRR1_GLS0_ISA942_IU1_K1_LBSPPA256_LBSPPB1536_LBSPPM0_LPA0_LPB16_LPM0_LRVW2_LWPMn1_MIAV0_MIWT2_3_MO40_NTn1_NTA0_NTB0_NTC0_NTD4_NTM0_NEPBS8_NLCA1_NLCB1_ONLL1_PGR2_PLR1_PKA1_SIA3_SS1_SU0_SUM1_SUS0_SPO0_SRVW0_SSO0_SVW2_SK0_SKXCCM0_TLDS0_ULSGRO0_USL1_UIOFGRO0_USFGROn1_VSn1_VWA2_VWB1_WSGRA0_WSGRB0_WS64_WG16_16_1_WGM1_WGMXCC4_WGMXCCGn1
    SolutionIndex: 240
    SolutionNameMin: Cijk_Ailk_Bjlk_S_MX_B_Bias_HA_S_SAV_UserArgs_MT32x448x32_MI16x16x1_SN_LDSB1_AFC1_AFEM1_AFEM1_ASEM1_CLR1_CADS0_DTVA0_DTVB0_EPS0_FDSI0_GRPM1_GRVWA4_GRVWB4_GSUn1_GSUAMBSK_GSUC1_GSUWGMRR1_GLS0_ISA942_IU1_K1_LBSPPA256_LBSPPB3584_LBSPPM0_LPA0_LPB16_LPM0_LRVW2_LWPMn1_MIAV0_MIWT2_7_MO40_NTn1_NTA0_NTB0_NTC0_NTD4_NTM0_NEPBS8_NLCA1_NLCB1_ONLL1_PGR2_PLR1_PKA1_SIA3_SS1_SU0_SUM1_SUS0_SPO0_SRVW0_SSO0_SVW2_SK0_SKXCCM0_TLDS0_ULSGRO0_USL1_UIOFGRO0_USFGROn1_VSn1_VWA2_VWB1_WSGRA0_WSGRB0_WS64_WG16_16_1_WGM1_WGMXCC4_WGMXCCGn1
    SolutionIndex: 241
    SolutionNameMin: Cijk_Ailk_Bjlk_S_MX_B_Bias_HA_S_SAV_UserArgs_MT64x320x16_MI32x32x1_SN_LDSB1_AFC1_AFEM1_AFEM1_ASEM1_CLR1_CADS0_DTVA0_DTVB0_EPS0_FDSI0_GRPM1_GRVWA4_GRVWB4_GSUn1_GSUAMBSK_GSUC1_GSUWGMRR1_GLS0_ISA942_IU1_K1_LBSPPA0_LBSPPB0_LBSPPM0_LPA0_LPB0_LPM0_LRVW2_LWPMn1_MIAV0_MIWT1_5_MO40_NTn1_NTA0_NTB0_NTC0_NTD4_NTM0_NEPBS8_NLCA1_NLCB1_ONLL1_PGR2_PLR1_PKA1_SIA3_SS1_SU0_SUM1_SUS0_SPO0_SRVW0_SSO0_SVW1_SK0_SKXCCM0_TLDS0_ULSGRO0_USL1_UIOFGRO0_USFGROn1_VSn1_VWA1_VWB1_WSGRA0_WSGRB0_WS64_WG64_4_1_WGM1_WGMXCC4_WGMXCCGn1
    SolutionIndex: 242
    SolutionNameMin: Cijk_Ailk_Bjlk_S_MX_B_Bias_HA_S_SAV_UserArgs_MT96x320x32_MI16x16x1_SN_LDSB1_AFC1_AFEM1_AFEM1_ASEM1_CLR1_CADS0_DTVA0_DTVB0_EPS0_FDSI0_GRPM1_GRVWA4_GRVWB4_GSUn1_GSUAMBSK_GSUC1_GSUWGMRR1_GLS0_ISA942_IU1_K1_LBSPPA768_LBSPPB2560_LBSPPM0_LPA0_LPB16_LPM0_LRVW2_LWPMn1_MIAV0_MIWT6_5_MO40_NTn1_NTA0_NTB0_NTC0_NTD4_NTM0_NEPBS6_NLCA1_NLCB1_ONLL1_PGR2_PLR1_PKA1_SIA3_SS1_SU0_SUM1_SUS0_SPO0_SRVW0_SSO0_SVW2_SK0_SKXCCM0_TLDS0_ULSGRO0_USL1_UIOFGRO0_USFGROn1_VSn1_VWA2_VWB1_WSGRA0_WSGRB0_WS64_WG16_16_1_WGM1_WGMXCC4_WGMXCCGn1
    SolutionIndex: 243
    SolutionNameMin: Cijk_Ailk_Bjlk_S_MX_B_Bias_HA_S_SAV_UserArgs_MT64x160x32_MI16x16x1_SN_LDSB1_AFC1_AFEM1_AFEM1_ASEM1_CLR1_CADS0_DTVA0_DTVB0_EPS0_FDSI0_GRPM1_GRVWA4_GRVWB4_GSUn1_GSUAMBSK_GSUC1_GSUWGMRR1_GLS0_ISA942_IU1_K1_LBSPPA512_LBSPPB1280_LBSPPM0_LPA0_LPB16_LPM0_LRVW2_LWPMn1_MIAV0_MIWT2_5_MO40_NTn1_NTA0_NTB0_NTC0_NTD4_NTM0_NEPBS8_NLCA1_NLCB1_ONLL1_PGR2_PLR1_PKA1_SIA3_SS1_SU0_SUM1_SUS0_SPO0_SRVW0_SSO0_SVW2_SK0_SKXCCM0_TLDS0_ULSGRO0_USL1_UIOFGRO0_USFGROn1_VSn1_VWA2_VWB1_WSGRA0_WSGRB0_WS64_WG32_8_1_WGM1_WGMXCC4_WGMXCCGn1
    SolutionIndex: 244
    SolutionNameMin: Cijk_Ailk_Bjlk_S_MX_B_Bias_HA_S_SAV_UserArgs_MT64x384x16_MI32x32x1_SN_LDSB1_AFC1_AFEM1_AFEM1_ASEM1_CLR1_CADS0_DTVA0_DTVB0_EPS0_FDSI0_GRPM1_GRVWA4_GRVWB4_GSUn1_GSUAMBSK_GSUC1_GSUWGMRR1_GLS0_ISA942_IU1_K1_LBSPPA0_LBSPPB0_LBSPPM0_LPA0_LPB0_LPM0_LRVW2_LWPMn1_MIAV0_MIWT2_3_MO40_NTn1_NTA0_NTB0_NTC0_NTD4_NTM0_NEPBS8_NLCA1_NLCB1_ONLL1_PGR2_PLR1_PKA1_SIA3_SS1_SU0_SUM1_SUS0_SPO0_SRVW0_SSO0_SVW2_SK0_SKXCCM0_TLDS0_ULSGRO0_USL1_UIOFGRO0_USFGROn1_VSn1_VWA2_VWB1_WSGRA0_WSGRB0_WS64_WG32_8_1_WGM1_WGMXCC4_WGMXCCGn1
    SolutionIndex: 245
    SolutionNameMin: Cijk_Ailk_Bjlk_S_MX_B_Bias_HA_S_SAV_UserArgs_MT64x448x16_MI16x16x1_SN_LDSB1_AFC1_AFEM1_AFEM1_ASEM1_CLR1_CADS0_DTVA0_DTVB0_EPS0_FDSI0_GRPM1_GRVWA4_GRVWB4_GSUn1_GSUAMBSK_GSUC1_GSUWGMRR1_GLS0_ISA942_IU1_K1_LBSPPA512_LBSPPB3584_LBSPPM0_LPA0_LPB16_LPM0_LRVW2_LWPMn1_MIAV0_MIWT4_7_MO40_NTn1_NTA0_NTB0_NTC0_NTD4_NTM0_NEPBS8_NLCA1_NLCB1_ONLL1_PGR2_PLR1_PKA1_SIA3_SS1_SU0_SUM1_SUS0_SPO0_SRVW0_SSO0_SVW4_SK0_SKXCCM0_TLDS0_ULSGRO0_USL1_UIOFGRO0_USFGROn1_VSn1_VWA4_VWB1_WSGRA0_WSGRB0_WS64_WG16_16_1_WGM1_WGMXCC4_WGMXCCGn1
    SolutionIndex: 246
    SolutionNameMin: Cijk_Ailk_Bjlk_S_MX_B_Bias_HA_S_SAV_UserArgs_MT64x448x16_MI32x32x1_SN_LDSB1_AFC1_AFEM1_AFEM1_ASEM1_CLR1_CADS0_DTVA0_DTVB0_EPS0_FDSI0_GRPM1_GRVWA4_GRVWB4_GSUn1_GSUAMBSK_GSUC1_GSUWGMRR1_GLS0_ISA942_IU1_K1_LBSPPA0_LBSPPB0_LBSPPM0_LPA0_LPB0_LPM0_LRVW2_LWPMn1_MIAV0_MIWT1_7_MO40_NTn1_NTA0_NTB0_NTC0_NTD4_NTM0_NEPBS8_NLCA1_NLCB1_ONLL1_PGR2_PLR1_PKA1_SIA3_SS1_SU0_SUM1_SUS0_SPO0_SRVW0_SSO0_SVW1_SK0_SKXCCM0_TLDS0_ULSGRO0_USL1_UIOFGRO0_USFGROn1_VSn1_VWA1_VWB1_WSGRA0_WSGRB0_WS64_WG64_4_1_WGM1_WGMXCC4_WGMXCCGn1
    SolutionIndex: 247
    SolutionNameMin: Cijk_Ailk_Bjlk_S_MX_B_Bias_HA_S_SAV_UserArgs_MT64x256x16_MI32x32x1_SN_LDSB1_AFC1_AFEM1_AFEM1_ASEM1_CLR1_CADS0_DTVA0_DTVB0_EPS0_FDSI0_GRPM1_GRVWA4_GRVWB4_GSUn1_GSUAMBSK_GSUC1_GSUWGMRR1_GLS0_ISA942_IU1_K1_LBSPPA0_LBSPPB0_LBSPPM0_LPA0_LPB0_LPM0_LRVW2_LWPMn1_MIAV0_MIWT2_2_MO40_NTn1_NTA0_NTB0_NTC0_NTD4_NTM0_NEPBS8_NLCA1_NLCB1_ONLL1_PGR2_PLR1_PKA1_SIA3_SS1_SU0_SUM1_SUS0_SPO0_SRVW0_SSO0_SVW2_SK0_SKXCCM0_TLDS0_ULSGRO0_USL1_UIOFGRO0_USFGROn1_VSn1_VWA2_VWB2_WSGRA0_WSGRB0_WS64_WG32_8_1_WGM1_WGMXCC4_WGMXCCGn1
    SolutionIndex: 248
    SolutionNameMin: Cijk_Ailk_Bjlk_S_MX_B_Bias_HA_S_SAV_UserArgs_MT128x320x16_MI32x32x1_SN_LDSB1_AFC1_AFEM1_AFEM1_ASEM1_CLR1_CADS0_DTVA0_DTVB0_EPS0_FDSI0_GRPM1_GRVWA4_GRVWB4_GSUn1_GSUAMBSK_GSUC1_GSUWGMRR1_GLS0_ISA942_IU1_K1_LBSPPA0_LBSPPB0_LBSPPM0_LPA0_LPB0_LPM0_LRVW2_LWPMn1_MIAV0_MIWT2_5_MO40_NTn1_NTA0_NTB0_NTC0_NTD4_NTM0_NEPBS8_NLCA1_NLCB1_ONLL1_PGR2_PLR1_PKA1_SIA3_SS1_SU0_SUM1_SUS0_SPO0_SRVW0_SSO0_SVW2_SK0_SKXCCM0_TLDS0_ULSGRO0_USL1_UIOFGRO0_USFGROn1_VSn1_VWA2_VWB1_WSGRA0_WSGRB0_WS64_WG64_4_1_WGM1_WGMXCC4_WGMXCCGn1
    SolutionIndex: 249
    SolutionNameMin: Cijk_Ailk_Bjlk_S_MX_B_Bias_HA_S_SAV_UserArgs_MT64x192x16_MI32x32x1_SN_LDSB1_AFC1_AFEM1_AFEM1_ASEM1_CLR1_CADS0_DTVA0_DTVB0_EPS0_FDSI0_GRPM1_GRVWA4_GRVWB4_GSUn1_GSUAMBSK_GSUC1_GSUWGMRR1_GLS0_ISA942_IU1_K1_LBSPPA0_LBSPPB0_LBSPPM0_LPA0_LPB0_LPM0_LRVW2_LWPMn1_MIAV0_MIWT1_3_MO40_NTn1_NTA0_NTB0_NTC0_NTD4_NTM0_NEPBS8_NLCA1_NLCB1_ONLL1_PGR2_PLR1_PKA1_SIA3_SS1_SU0_SUM1_SUS0_SPO0_SRVW0_SSO0_SVW1_SK0_SKXCCM0_TLDS0_ULSGRO0_USL1_UIOFGRO0_USFGROn1_VSn1_VWA1_VWB1_WSGRA0_WSGRB0_WS64_WG64_4_1_WGM1_WGMXCC4_WGMXCCGn1
    SolutionIndex: 250
    SolutionNameMin: Cijk_Ailk_Bjlk_S_MX_B_Bias_HA_S_SAV_UserArgs_MT128x448x16_MI16x16x1_SN_LDSB1_AFC1_AFEM1_AFEM1_ASEM1_CLR1_CADS0_DTVA0_DTVB0_EPS0_FDSI0_GRPM1_GRVWA4_GRVWB4_GSUn1_GSUAMBSK_GSUC1_GSUWGMRR1_GLS0_ISA942_IU1_K1_LBSPPA1024_LBSPPB3584_LBSPPM0_LPA0_LPB0_LPM0_LRVW2_LWPMn1_MIAV0_MIWT4_14_MO40_NTn1_NTA0_NTB0_NTC0_NTD4_NTM0_NEPBS8_NLCA1_NLCB1_ONLL1_PGR2_PLR1_PKA1_SIA3_SS1_SU0_SUM1_SUS0_SPO0_SRVW0_SSO0_SVW4_SK0_SKXCCM0_TLDS0_ULSGRO0_USL1_UIOFGRO0_USFGROn1_VSn1_VWA4_VWB2_WSGRA0_WSGRB0_WS64_WG32_8_1_WGM1_WGMXCC4_WGMXCCGn1
    SolutionIndex: 251
    SolutionNameMin: Cijk_Ailk_Bjlk_S_MX_B_Bias_HA_S_SAV_UserArgs_MT128x320x16_MI16x16x1_SN_LDSB1_AFC1_AFEM1_AFEM1_ASEM1_CLR1_CADS0_DTVA0_DTVB0_EPS0_FDSI0_GRPM1_GRVWA4_GRVWB4_GSUn1_GSUAMBSK_GSUC1_GSUWGMRR1_GLS0_ISA942_IU1_K1_LBSPPA1024_LBSPPB2560_LBSPPM0_LPA0_LPB16_LPM0_LRVW2_LWPMn1_MIAV0_MIWT8_5_MO40_NTn1_NTA0_NTB0_NTC0_NTD4_NTM0_NEPBS8_NLCA1_NLCB1_ONLL1_PGR2_PLR1_PKA1_SIA3_SS1_SU0_SUM1_SUS0_SPO0_SRVW0_SSO0_SVW4_SK0_SKXCCM0_TLDS0_ULSGRO0_USL1_UIOFGRO0_USFGROn1_VSn1_VWA4_VWB1_WSGRA0_WSGRB0_WS64_WG16_16_1_WGM1_WGMXCC4_WGMXCCGn1
    SolutionIndex: 252
    SolutionNameMin: Cijk_Ailk_Bjlk_S_MX_B_Bias_HA_S_SAV_UserArgs_MT96x384x32_MI32x32x1_SN_LDSB1_AFC1_AFEM1_AFEM1_ASEM1_CLR1_CADS0_DTVA0_DTVB0_EPS0_FDSI0_GRPM1_GRVWA4_GRVWB4_GSUn1_GSUAMBSK_GSUC1_GSUWGMRR1_GLS0_ISA942_IU1_K1_LBSPPA0_LBSPPB0_LBSPPM0_LPA0_LPB0_LPM0_LRVW2_LWPMn1_MIAV0_MIWT3_3_MO40_NTn1_NTA0_NTB0_NTC0_NTD4_NTM0_NEPBS6_NLCA1_NLCB1_ONLL1_PGR2_PLR1_PKA1_SIA3_SS1_SU0_SUM1_SUS0_SPO0_SRVW0_SSO4_SVW1_SK0_SKXCCM0_TLDS0_ULSGRO0_USL1_UIOFGRO0_USFGROn1_VSn1_VWA1_VWB1_WSGRA0_WSGRB0_WS64_WG32_8_1_WGM8_WGMXCC4_WGMXCCGn1
    SolutionIndex: 253
    SolutionNameMin: Cijk_Ailk_Bjlk_S_MX_B_Bias_HA_S_SAV_UserArgs_MT128x384x32_MI32x32x1_SN_LDSB1_AFC1_AFEM1_AFEM1_ASEM1_CLR1_CADS0_DTVA0_DTVB0_EPS0_FDSI0_GRPM1_GRVWA4_GRVWB4_GSUn1_GSUAMBSK_GSUC1_GSUWGMRR1_GLS0_ISA942_IU1_K1_LBSPPA0_LBSPPB0_LBSPPM0_LPA0_LPB0_LPM0_LRVW2_LWPMn1_MIAV0_MIWT2_6_MO40_NTn1_NTA0_NTB0_NTC0_NTD4_NTM0_NEPBS8_NLCA1_NLCB1_ONLL1_PGR2_PLR1_PKA1_SIA3_SS1_SU0_SUM1_SUS0_SPO0_SRVW0_SSO4_SVW2_SK0_SKXCCM0_TLDS0_ULSGRO0_USL1_UIOFGRO0_USFGROn1_VSn1_VWA2_VWB2_WSGRA0_WSGRB0_WS64_WG64_4_1_WGM8_WGMXCC4_WGMXCCGn1
    SolutionIndex: 254
    SolutionNameMin: Cijk_Ailk_Bjlk_S_MX_B_Bias_HA_S_SAV_UserArgs_MT256x192x32_MI32x32x1_SN_LDSB1_AFC1_AFEM1_AFEM1_ASEM1_CLR1_CADS0_DTVA0_DTVB0_EPS0_FDSI0_GRPM1_GRVWA4_GRVWB4_GSUn1_GSUAMBSK_GSUC1_GSUWGMRR1_GLS0_ISA942_IU1_K1_LBSPPA0_LBSPPB0_LBSPPM0_LPA0_LPB0_LPM0_LRVW2_LWPMn1_MIAV0_MIWT2_6_MO40_NTn1_NTA0_NTB0_NTC0_NTD4_NTM0_NEPBS8_NLCA1_NLCB1_ONLL1_PGR2_PLR1_PKA1_SIA3_SS1_SU0_SUM1_SUS0_SPO0_SRVW0_SSO4_SVW2_SK0_SKXCCM0_TLDS0_ULSGRO0_USL1_UIOFGRO0_USFGROn1_VSn1_VWA2_VWB2_WSGRA0_WSGRB0_WS64_WG128_2_1_WGM8_WGMXCC4_WGMXCCGn1
    SolutionIndex: 255
    SolutionNameMin: Cijk_Ailk_Bjlk_S_MX_B_Bias_HA_S_SAV_UserArgs_MT224x256x32_MI32x32x1_SN_LDSB1_AFC1_AFEM1_AFEM1_ASEM1_CLR1_CADS0_DTVA0_DTVB0_EPS0_FDSI0_GRPM1_GRVWA4_GRVWB4_GSUn1_GSUAMBSK_GSUC1_GSUWGMRR1_GLS0_ISA942_IU1_K1_LBSPPA0_LBSPPB0_LBSPPM0_LPA0_LPB0_LPM0_LRVW2_LWPMn1_MIAV0_MIWT7_2_MO40_NTn1_NTA0_NTB0_NTC0_NTD4_NTM0_NEPBS7_NLCA1_NLCB1_ONLL1_PGR2_PLR1_PKA1_SIA3_SS1_SU0_SUM1_SUS0_SPO0_SRVW0_SSO4_SVW1_SK0_SKXCCM0_TLDS0_ULSGRO0_USL1_UIOFGRO0_USFGROn1_VSn1_VWA1_VWB2_WSGRA0_WSGRB0_WS64_WG32_8_1_WGM8_WGMXCC4_WGMXCCGn1
    SolutionIndex: 256
    SolutionNameMin: Cijk_Ailk_Bjlk_S_MX_B_Bias_HA_S_SAV_UserArgs_MT192x128x16_MI32x32x1_SN_LDSB1_AFC1_AFEM1_AFEM1_ASEM1_CLR1_CADS0_DTVA0_DTVB0_EPS0_FDSI0_GRPM1_GRVWA4_GRVWB4_GSUn1_GSUAMBSK_GSUC1_GSUWGMRR1_GLS0_ISA942_IU1_K1_LBSPPA0_LBSPPB0_LBSPPM0_LPA0_LPB0_LPM0_LRVW2_LWPMn1_MIAV0_MIWT3_2_MO40_NTn1_NTA0_NTB0_NTC0_NTD4_NTM0_NEPBS6_NLCA1_NLCB1_ONLL1_PGR2_PLR1_PKA1_SIA3_SS1_SU0_SUM1_SUS0_SPO0_SRVW0_SSO4_SVW1_SK0_SKXCCM0_TLDS0_ULSGRO0_USL1_UIOFGRO0_USFGROn1_VSn1_VWA1_VWB2_WSGRA0_WSGRB0_WS64_WG64_4_1_WGM8_WGMXCC4_WGMXCCGn1
    SolutionIndex: 257
    SolutionNameMin: Cijk_Ailk_Bjlk_S_MX_B_Bias_HA_S_SAV_UserArgs_MT192x192x16_MI16x16x1_SN_LDSB1_AFC1_AFEM1_AFEM1_ASEM1_CLR1_CADS0_DTVA0_DTVB0_EPS0_FDSI0_GRPM1_GRVWA4_GRVWB4_GSUn1_GSUAMBSK_GSUC1_GSUWGMRR1_GLS0_ISA942_IU1_K1_LBSPPA1536_LBSPPB1536_LBSPPM0_LPA0_LPB0_LPM0_LRVW2_LWPMn1_MIAV0_MIWT6_6_MO40_NTn1_NTA0_NTB0_NTC0_NTD4_NTM0_NEPBS6_NLCA1_NLCB1_ONLL1_PGR2_PLR1_PKA1_SIA3_SS1_SU0_SUM1_SUS0_SPO0_SRVW0_SSO4_SVW2_SK0_SKXCCM0_TLDS0_ULSGRO0_USL1_UIOFGRO0_USFGROn1_VSn1_VWA2_VWB2_WSGRA0_WSGRB0_WS64_WG32_8_1_WGM8_WGMXCC4_WGMXCCGn1
- - - [3, 3, 1, 1024]
    - [0, 2.64005]
  - - [3, 3, 1, 4096]
    - [1, 9.61094]
  - - [3, 3, 1, 16384]
    - [1, 30.2584]
  - - [16, 3, 1, 1024]
    - [2, 13.82]
  - - [16, 3, 1, 4096]
    - [3, 48.7366]
  - - [16, 3, 1, 16384]
    - [4, 161.166]
  - - [32, 3, 1, 1024]
    - [2, 27.5066]
  - - [32, 3, 1, 4096]
    - [3, 96.0981]
  - - [32, 3, 1, 16384]
    - [4, 307.237]
  - - [64, 3, 1, 1024]
    - [5, 53.3438]
  - - [64, 3, 1, 4096]
    - [6, 182.419]
  - - [64, 3, 1, 16384]
    - [6, 571.008]
  - - [96, 3, 1, 1024]
    - [7, 77.6751]
  - - [96, 3, 1, 4096]
    - [6, 265.41]
  - - [96, 3, 1, 16384]
    - [6, 768.733]
  - - [128, 3, 1, 1024]
    - [8, 101.572]
  - - [128, 3, 1, 4096]
    - [6, 338.258]
  - - [128, 3, 1, 16384]
    - [9, 861.276]
  - - [192, 3, 1, 1024]
    - [10, 148.198]
  - - [192, 3, 1, 4096]
    - [11, 499.463]
  - - [192, 3, 1, 16384]
    - [12, 1337.35]
  - - [256, 3, 1, 1024]
    - [9, 196.844]
  - - [256, 3, 1, 4096]
    - [9, 637.592]
  - - [256, 3, 1, 16384]
    - [9, 1470.77]
  - - [384, 3, 1, 1024]
    - [13, 280.649]
  - - [384, 3, 1, 4096]
    - [9, 805.952]
  - - [384, 3, 1, 16384]
    - [14, 1968.36]
  - - [512, 3, 1, 1024]
    - [15, 358.603]
  - - [512, 3, 1, 4096]
    - [14, 1003.1]
  - - [512, 3, 1, 16384]
    - [14, 2242.82]
  - - [640, 3, 1, 1024]
    - [16, 440.719]
  - - [640, 3, 1, 4096]
    - [14, 1238.04]
  - - [640, 3, 1, 16384]
    - [17, 2479.45]
  - - [768, 3, 1, 1024]
    - [3, 501.89]
  - - [768, 3, 1, 4096]
    - [14, 1343.45]
  - - [768, 3, 1, 16384]
    - [18, 2747.67]
  - - [1024, 3, 1, 1024]
    - [16, 627.999]
  - - [1024, 3, 1, 4096]
    - [17, 1624.56]
  - - [1024, 3, 1, 16384]
    - [17, 2956.65]
  - - [1536, 3, 1, 1024]
    - [17, 820.619]
  - - [1536, 3, 1, 4096]
    - [18, 2138.22]
  - - [1536, 3, 1, 16384]
    - [18, 3654.0]
  - - [2048, 3, 1, 1024]
    - [17, 1023.91]
  - - [2048, 3, 1, 4096]
    - [18, 2445.45]
  - - [2048, 3, 1, 16384]
    - [18, 3790.73]
  - - [3072, 3, 1, 1024]
    - [19, 1383.73]
  - - [3072, 3, 1, 4096]
    - [18, 2971.58]
  - - [3072, 3, 1, 16384]
    - [18, 4106.67]
  - - [4096, 3, 1, 1024]
    - [17, 1682.57]
  - - [4096, 3, 1, 4096]
    - [18, 3231.97]
  - - [4096, 3, 1, 16384]
    - [18, 4156.6]
  - - [6144, 3, 1, 1024]
    - [18, 2205.75]
  - - [6144, 3, 1, 4096]
    - [18, 3784.2]
  - - [6144, 3, 1, 16384]
    - [18, 4497.15]
  - - [8192, 3, 1, 1024]
    - [19, 2466.98]
  - - [8192, 3, 1, 4096]
    - [19, 3786.73]
  - - [8192, 3, 1, 16384]
    - [18, 4604.51]
  - - [12288, 3, 1, 1024]
    - [19, 2959.81]
  - - [12288, 3, 1, 4096]
    - [18, 4146.23]
  - - [12288, 3, 1, 16384]
    - [18, 4660.86]
  - - [16384, 3, 1, 1024]
    - [20, 3078.99]
  - - [16384, 3, 1, 4096]
    - [18, 3987.38]
  - - [16384, 3, 1, 16384]
    - [18, 4671.09]
  - - [20480, 3, 1, 1024]
    - [17, 3501.76]
  - - [20480, 3, 1, 4096]
    - [18, 4157.9]
  - - [20480, 3, 1, 16384]
    - [18, 4686.64]
  - - [24576, 3, 1, 1024]
    - [19, 3872.05]
  - - [24576, 3, 1, 4096]
    - [19, 4339.62]
  - - [24576, 3, 1, 16384]
    - [18, 4706.0]
  - - [32768, 3, 1, 1024]
    - [20, 3817.53]
  - - [32768, 3, 1, 4096]
    - [20, 4323.41]
  - - [32768, 3, 1, 16384]
    - [18, 4726.69]
  - - [3, 16, 1, 1024]
    - [21, 14.1063]
  - - [3, 16, 1, 4096]
    - [22, 49.8666]
  - - [3, 16, 1, 16384]
    - [22, 164.229]
  - - [16, 16, 1, 1024]
    - [23, 75.7388]
  - - [16, 16, 1, 4096]
    - [24, 263.517]
  - - [16, 16, 1, 16384]
    - [25, 823.881]
  - - [32, 16, 1, 1024]
    - [23, 148.198]
  - - [32, 16, 1, 4096]
    - [24, 500.364]
  - - [32, 16, 1, 16384]
    - [23, 1578.99]
  - - [64, 16, 1, 1024]
    - [23, 278.561]
  - - [64, 16, 1, 4096]
    - [26, 948.472]
  - - [64, 16, 1, 16384]
    - [26, 3052.93]
  - - [96, 16, 1, 1024]
    - [23, 438.043]
  - - [96, 16, 1, 4096]
    - [27, 1405.63]
  - - [96, 16, 1, 16384]
    - [26, 4092.7]
  - - [128, 16, 1, 1024]
    - [28, 527.353]
  - - [128, 16, 1, 4096]
    - [29, 1782.37]
  - - [128, 16, 1, 16384]
    - [30, 4647.54]
  - - [192, 16, 1, 1024]
    - [29, 740.419]
  - - [192, 16, 1, 4096]
    - [30, 2534.72]
  - - [192, 16, 1, 16384]
    - [31, 6718.01]
  - - [256, 16, 1, 1024]
    - [30, 986.204]
  - - [256, 16, 1, 4096]
    - [30, 3313.26]
  - - [256, 16, 1, 16384]
    - [30, 7813.74]
  - - [384, 16, 1, 1024]
    - [32, 1405.63]
  - - [384, 16, 1, 4096]
    - [30, 4225.78]
  - - [384, 16, 1, 16384]
    - [33, 10238.5]
  - - [512, 16, 1, 1024]
    - [34, 1852.76]
  - - [512, 16, 1, 4096]
    - [33, 5106.96]
  - - [512, 16, 1, 16384]
    - [33, 12115.4]
  - - [640, 16, 1, 1024]
    - [34, 2312.88]
  - - [640, 16, 1, 4096]
    - [33, 6274.59]
  - - [640, 16, 1, 16384]
    - [33, 13745.4]
  - - [768, 16, 1, 1024]
    - [24, 2646.28]
  - - [768, 16, 1, 4096]
    - [33, 7150.79]
  - - [768, 16, 1, 16384]
    - [35, 15005.9]
  - - [1024, 16, 1, 1024]
    - [36, 3420.51]
  - - [1024, 16, 1, 4096]
    - [33, 8238.71]
  - - [1024, 16, 1, 16384]
    - [33, 15475.8]
  - - [1536, 16, 1, 1024]
    - [31, 4221.24]
  - - [1536, 16, 1, 4096]
    - [35, 10935.5]
  - - [1536, 16, 1, 16384]
    - [35, 18277.6]
  - - [2048, 16, 1, 1024]
    - [27, 6410.8]
  - - [2048, 16, 1, 4096]
    - [33, 12055.1]
  - - [2048, 16, 1, 16384]
    - [35, 18507.2]
  - - [3072, 16, 1, 1024]
    - [34, 7309.43]
  - - [3072, 16, 1, 4096]
    - [35, 14756.3]
  - - [3072, 16, 1, 16384]
    - [35, 20393.2]
  - - [4096, 16, 1, 1024]
    - [29, 9573.1]
  - - [4096, 16, 1, 4096]
    - [35, 14132.9]
  - - [4096, 16, 1, 16384]
    - [35, 19535.9]
  - - [6144, 16, 1, 1024]
    - [35, 10668.3]
  - - [6144, 16, 1, 4096]
    - [35, 16382.3]
  - - [6144, 16, 1, 16384]
    - [35, 21065.3]
  - - [8192, 16, 1, 1024]
    - [33, 12816.7]
  - - [8192, 16, 1, 4096]
    - [33, 16242.2]
  - - [8192, 16, 1, 16384]
    - [35, 20409.0]
  - - [12288, 16, 1, 1024]
    - [35, 14994.2]
  - - [12288, 16, 1, 4096]
    - [35, 18032.4]
  - - [12288, 16, 1, 16384]
    - [35, 21367.3]
  - - [16384, 16, 1, 1024]
    - [34, 13037.6]
  - - [16384, 16, 1, 4096]
    - [35, 16316.4]
  - - [16384, 16, 1, 16384]
    - [35, 20369.8]
  - - [20480, 16, 1, 1024]
    - [33, 15794.1]
  - - [20480, 16, 1, 4096]
    - [33, 19219.9]
  - - [20480, 16, 1, 16384]
    - [35, 20358.0]
  - - [24576, 16, 1, 1024]
    - [35, 15234.2]
  - - [24576, 16, 1, 4096]
    - [35, 18552.5]
  - - [24576, 16, 1, 16384]
    - [35, 21736.7]
  - - [32768, 16, 1, 1024]
    - [34, 14314.2]
  - - [32768, 16, 1, 4096]
    - [35, 17666.9]
  - - [32768, 16, 1, 16384]
    - [35, 20694.1]
  - - [3, 32, 1, 1024]
    - [37, 27.9614]
  - - [3, 32, 1, 4096]
    - [22, 96.9915]
  - - [3, 32, 1, 16384]
    - [22, 296.957]
  - - [16, 32, 1, 1024]
    - [23, 148.789]
  - - [16, 32, 1, 4096]
    - [36, 493.893]
  - - [16, 32, 1, 16384]
    - [38, 1562.02]
  - - [32, 32, 1, 1024]
    - [23, 294.296]
  - - [32, 32, 1, 4096]
    - [26, 963.585]
  - - [32, 32, 1, 16384]
    - [38, 3052.71]
  - - [64, 32, 1, 1024]
    - [29, 538.648]
  - - [64, 32, 1, 4096]
    - [29, 1817.36]
  - - [64, 32, 1, 16384]
    - [31, 4990.04]
  - - [96, 32, 1, 1024]
    - [39, 741.607]
  - - [96, 32, 1, 4096]
    - [40, 2569.37]
  - - [96, 32, 1, 16384]
    - [41, 6916.01]
  - - [128, 32, 1, 1024]
    - [30, 990.402]
  - - [128, 32, 1, 4096]
    - [40, 3377.72]
  - - [128, 32, 1, 16384]
    - [30, 7929.23]
  - - [192, 32, 1, 1024]
    - [23, 1610.47]
  - - [192, 32, 1, 4096]
    - [42, 4725.21]
  - - [192, 32, 1, 16384]
    - [43, 12404.5]
  - - [256, 32, 1, 1024]
    - [40, 1861.0]
  - - [256, 32, 1, 4096]
    - [44, 5801.13]
  - - [256, 32, 1, 16384]
    - [44, 13982.0]
  - - [384, 32, 1, 1024]
    - [40, 2656.36]
  - - [384, 32, 1, 4096]
    - [44, 7668.4]
  - - [384, 32, 1, 16384]
    - [45, 19961.7]
  - - [512, 32, 1, 1024]
    - [42, 3406.03]
  - - [512, 32, 1, 4096]
    - [45, 9532.78]
  - - [512, 32, 1, 16384]
    - [45, 23224.7]
  - - [640, 32, 1, 1024]
    - [42, 4228.62]
  - - [640, 32, 1, 4096]
    - [45, 11310.5]
  - - [640, 32, 1, 16384]
    - [45, 26857.4]
  - - [768, 32, 1, 1024]
    - [27, 5039.73]
  - - [768, 32, 1, 4096]
    - [45, 13629.3]
  - - [768, 32, 1, 16384]
    - [45, 27913.9]
  - - [1024, 32, 1, 1024]
    - [27, 6262.14]
  - - [1024, 32, 1, 4096]
    - [46, 15892.3]
  - - [1024, 32, 1, 16384]
    - [45, 30241.4]
  - - [1536, 32, 1, 1024]
    - [47, 8651.91]
  - - [1536, 32, 1, 4096]
    - [46, 19950.7]
  - - [1536, 32, 1, 16384]
    - [48, 35862.1]
  - - [2048, 32, 1, 1024]
    - [41, 10481.3]
  - - [2048, 32, 1, 4096]
    - [45, 23187.7]
  - - [2048, 32, 1, 16384]
    - [46, 36069.7]
  - - [3072, 32, 1, 1024]
    - [43, 13750.2]
  - - [3072, 32, 1, 4096]
    - [48, 26857.0]
  - - [3072, 32, 1, 16384]
    - [48, 41768.2]
  - - [4096, 32, 1, 1024]
    - [43, 18243.7]
  - - [4096, 32, 1, 4096]
    - [48, 29917.1]
  - - [4096, 32, 1, 16384]
    - [48, 41936.6]
  - - [6144, 32, 1, 1024]
    - [46, 19148.1]
  - - [6144, 32, 1, 4096]
    - [48, 34860.0]
  - - [6144, 32, 1, 16384]
    - [48, 44834.3]
  - - [8192, 32, 1, 1024]
    - [45, 25081.2]
  - - [8192, 32, 1, 4096]
    - [46, 35552.6]
  - - [8192, 32, 1, 16384]
    - [48, 42621.5]
  - - [12288, 32, 1, 1024]
    - [49, 26721.2]
  - - [12288, 32, 1, 4096]
    - [48, 37854.1]
  - - [12288, 32, 1, 16384]
    - [48, 43704.5]
  - - [16384, 32, 1, 1024]
    - [46, 29797.2]
  - - [16384, 32, 1, 4096]
    - [46, 37986.9]
  - - [16384, 32, 1, 16384]
    - [46, 42045.2]
  - - [20480, 32, 1, 1024]
    - [46, 36495.4]
  - - [20480, 32, 1, 4096]
    - [46, 41892.3]
  - - [20480, 32, 1, 16384]
    - [50, 41219.8]
  - - [24576, 32, 1, 1024]
    - [51, 35642.5]
  - - [24576, 32, 1, 4096]
    - [51, 40271.3]
  - - [24576, 32, 1, 16384]
    - [48, 42100.6]
  - - [32768, 32, 1, 256]
    - [46, 22715.7]
  - - [32768, 32, 1, 1024]
    - [52, 33963.3]
  - - [32768, 32, 1, 4096]
    - [52, 38924.1]
  - - [3, 64, 1, 1024]
    - [53, 54.0612]
  - - [3, 64, 1, 4096]
    - [54, 186.124]
  - - [3, 64, 1, 16384]
    - [55, 578.417]
  - - [16, 64, 1, 1024]
    - [23, 278.828]
  - - [16, 64, 1, 4096]
    - [38, 952.182]
  - - [16, 64, 1, 16384]
    - [56, 2849.02]
  - - [32, 64, 1, 1024]
    - [29, 544.309]
  - - [32, 64, 1, 4096]
    - [57, 1843.78]
  - - [32, 64, 1, 16384]
    - [41, 4998.98]
  - - [64, 64, 1, 1024]
    - [23, 1070.24]
  - - [64, 64, 1, 4096]
    - [40, 3382.9]
  - - [64, 64, 1, 16384]
    - [41, 8722.11]
  - - [96, 64, 1, 1024]
    - [23, 1649.23]
  - - [96, 64, 1, 4096]
    - [40, 4830.66]
  - - [96, 64, 1, 16384]
    - [58, 12407.5]
  - - [128, 64, 1, 1024]
    - [59, 1939.31]
  - - [128, 64, 1, 4096]
    - [40, 5832.26]
  - - [128, 64, 1, 16384]
    - [44, 14170.2]
  - - [192, 64, 1, 1024]
    - [23, 3209.08]
  - - [192, 64, 1, 4096]
    - [60, 7807.17]
  - - [192, 64, 1, 16384]
    - [61, 21288.7]
  - - [256, 64, 1, 1024]
    - [26, 3596.92]
  - - [256, 64, 1, 4096]
    - [62, 10124.4]
  - - [256, 64, 1, 16384]
    - [63, 25555.1]
  - - [384, 64, 1, 1024]
    - [26, 5348.02]
  - - [384, 64, 1, 4096]
    - [45, 13887.9]
  - - [384, 64, 1, 16384]
    - [64, 31368.2]
  - - [512, 64, 1, 1024]
    - [27, 6515.61]
  - - [512, 64, 1, 4096]
    - [61, 16310.4]
  - - [512, 64, 1, 16384]
    - [65, 33721.7]
  - - [640, 64, 1, 1024]
    - [27, 8227.76]
  - - [640, 64, 1, 4096]
    - [61, 19762.2]
  - - [640, 64, 1, 16384]
    - [66, 38029.2]
  - - [768, 64, 1, 1024]
    - [47, 8831.51]
  - - [768, 64, 1, 4096]
    - [67, 21413.9]
  - - [768, 64, 1, 16384]
    - [67, 43020.5]
  - - [1024, 64, 1, 1024]
    - [41, 10604.1]
  - - [1024, 64, 1, 4096]
    - [61, 25227.8]
  - - [1024, 64, 1, 16384]
    - [68, 46585.1]
  - - [1536, 64, 1, 1024]
    - [43, 14229.4]
  - - [1536, 64, 1, 4096]
    - [67, 31228.7]
  - - [1536, 64, 1, 16384]
    - [69, 52848.3]
  - - [2048, 64, 1, 1024]
    - [43, 18353.7]
  - - [2048, 64, 1, 4096]
    - [67, 34813.1]
  - - [2048, 64, 1, 16384]
    - [67, 54192.1]
  - - [3072, 64, 1, 1024]
    - [70, 20571.8]
  - - [3072, 64, 1, 4096]
    - [67, 41829.1]
  - - [3072, 64, 1, 16384]
    - [71, 61360.3]
  - - [4096, 64, 1, 1024]
    - [61, 27468.5]
  - - [4096, 64, 1, 4096]
    - [67, 45109.9]
  - - [4096, 64, 1, 16384]
    - [72, 61903.4]
  - - [6144, 64, 1, 1024]
    - [66, 29757.5]
  - - [6144, 64, 1, 4096]
    - [71, 51802.2]
  - - [6144, 64, 1, 16384]
    - [71, 65944.5]
  - - [8192, 64, 1, 1024]
    - [61, 33866.6]
  - - [8192, 64, 1, 4096]
    - [72, 52277.4]
  - - [8192, 64, 1, 16384]
    - [72, 62557.7]
  - - [12288, 64, 1, 1024]
    - [66, 41304.3]
  - - [12288, 64, 1, 4096]
    - [71, 59825.2]
  - - [12288, 64, 1, 16384]
    - [71, 68646.2]
  - - [16384, 64, 1, 256]
    - [68, 26976.0]
  - - [16384, 64, 1, 1024]
    - [73, 43329.1]
  - - [16384, 64, 1, 4096]
    - [72, 59978.1]
  - - [20480, 64, 1, 256]
    - [68, 32950.1]
  - - [20480, 64, 1, 1024]
    - [68, 52612.3]
  - - [20480, 64, 1, 4096]
    - [68, 61785.9]
  - - [24576, 64, 1, 256]
    - [74, 34137.0]
  - - [24576, 64, 1, 1024]
    - [72, 51582.7]
  - - [24576, 64, 1, 4096]
    - [71, 63637.3]
  - - [32768, 64, 1, 256]
    - [74, 34700.4]
  - - [32768, 64, 1, 1024]
    - [75, 53617.0]
  - - [32768, 64, 1, 4096]
    - [72, 62744.6]
  - - [3, 96, 1, 1024]
    - [76, 76.767]
  - - [3, 96, 1, 4096]
    - [77, 263.037]
  - - [3, 96, 1, 16384]
    - [55, 763.1]
  - - [16, 96, 1, 1024]
    - [39, 404.361]
  - - [16, 96, 1, 4096]
    - [57, 1407.52]
  - - [16, 96, 1, 16384]
    - [78, 4140.76]
  - - [32, 96, 1, 1024]
    - [24, 747.685]
  - - [32, 96, 1, 4096]
    - [40, 2577.82]
  - - [32, 96, 1, 16384]
    - [41, 7011.42]
  - - [64, 96, 1, 1024]
    - [23, 1639.92]
  - - [64, 96, 1, 4096]
    - [40, 4797.44]
  - - [64, 96, 1, 16384]
    - [43, 12499.6]
  - - [96, 96, 1, 1024]
    - [23, 2539.77]
  - - [96, 96, 1, 4096]
    - [79, 6550.34]
  - - [96, 96, 1, 16384]
    - [80, 15773.2]
  - - [128, 96, 1, 1024]
    - [40, 2730.31]
  - - [128, 96, 1, 4096]
    - [81, 7930.98]
  - - [128, 96, 1, 16384]
    - [45, 20378.1]
  - - [192, 96, 1, 1024]
    - [82, 4398.52]
  - - [192, 96, 1, 4096]
    - [81, 11169.7]
  - - [192, 96, 1, 16384]
    - [83, 25607.2]
  - - [256, 96, 1, 1024]
    - [26, 5234.3]
  - - [256, 96, 1, 4096]
    - [45, 13894.8]
  - - [256, 96, 1, 16384]
    - [84, 29721.4]
  - - [384, 96, 1, 1024]
    - [26, 7936.14]
  - - [384, 96, 1, 4096]
    - [84, 18179.2]
  - - [384, 96, 1, 16384]
    - [85, 41089.7]
  - - [512, 96, 1, 1024]
    - [41, 7985.98]
  - - [512, 96, 1, 4096]
    - [86, 21156.9]
  - - [512, 96, 1, 16384]
    - [86, 44636.3]
  - - [640, 96, 1, 1024]
    - [41, 10027.1]
  - - [640, 96, 1, 4096]
    - [86, 26346.3]
  - - [640, 96, 1, 16384]
    - [86, 48705.8]
  - - [768, 96, 1, 1024]
    - [41, 11824.7]
  - - [768, 96, 1, 4096]
    - [87, 28032.6]
  - - [768, 96, 1, 16384]
    - [88, 51759.9]
  - - [1024, 96, 1, 1024]
    - [89, 13976.1]
  - - [1024, 96, 1, 4096]
    - [87, 31316.4]
  - - [1024, 96, 1, 16384]
    - [88, 58006.8]
  - - [1536, 96, 1, 1024]
    - [43, 20699.0]
  - - [1536, 96, 1, 4096]
    - [88, 38726.8]
  - - [1536, 96, 1, 16384]
    - [90, 69195.5]
  - - [2048, 96, 1, 1024]
    - [91, 22170.3]
  - - [2048, 96, 1, 4096]
    - [86, 43062.1]
  - - [2048, 96, 1, 16384]
    - [88, 67781.8]
  - - [3072, 96, 1, 1024]
    - [45, 28804.6]
  - - [3072, 96, 1, 4096]
    - [90, 52001.2]
  - - [3072, 96, 1, 16384]
    - [90, 78842.0]
  - - [4096, 96, 1, 1024]
    - [92, 32418.3]
  - - [4096, 96, 1, 4096]
    - [88, 55671.6]
  - - [4096, 96, 1, 16384]
    - [90, 77848.2]
  - - [6144, 96, 1, 1024]
    - [93, 35404.7]
  - - [6144, 96, 1, 4096]
    - [90, 65555.8]
  - - [6144, 96, 1, 16384]
    - [90, 85319.4]
  - - [8192, 96, 1, 1024]
    - [86, 42646.0]
  - - [8192, 96, 1, 4096]
    - [90, 60619.7]
  - - [8192, 96, 1, 16384]
    - [90, 79120.8]
  - - [12288, 96, 1, 256]
    - [87, 28716.6]
  - - [12288, 96, 1, 1024]
    - [93, 49612.3]
  - - [12288, 96, 1, 4096]
    - [90, 69346.8]
  - - [16384, 96, 1, 256]
    - [86, 34044.7]
  - - [16384, 96, 1, 1024]
    - [88, 53742.6]
  - - [16384, 96, 1, 4096]
    - [90, 63849.7]
  - - [20480, 96, 1, 256]
    - [86, 42127.3]
  - - [20480, 96, 1, 1024]
    - [88, 66186.7]
  - - [20480, 96, 1, 4096]
    - [88, 77448.6]
  - - [24576, 96, 1, 256]
    - [90, 38090.4]
  - - [24576, 96, 1, 1024]
    - [90, 61052.6]
  - - [24576, 96, 1, 4096]
    - [90, 72468.0]
  - - [32768, 96, 1, 256]
    - [86, 37671.3]
  - - [32768, 96, 1, 1024]
    - [88, 53843.4]
  - - [32768, 96, 1, 4096]
    - [88, 62190.3]
  - - [3, 128, 1, 1024]
    - [94, 101.174]
  - - [3, 128, 1, 4096]
    - [55, 342.659]
  - - [3, 128, 1, 16384]
    - [95, 858.778]
  - - [16, 128, 1, 1024]
    - [39, 533.049]
  - - [16, 128, 1, 4096]
    - [39, 1792.76]
  - - [16, 128, 1, 16384]
    - [96, 4645.74]
  - - [32, 128, 1, 1024]
    - [42, 995.586]
  - - [32, 128, 1, 4096]
    - [42, 3374.45]
  - - [32, 128, 1, 16384]
    - [41, 8080.03]
  - - [64, 128, 1, 1024]
    - [40, 1909.57]
  - - [64, 128, 1, 4096]
    - [40, 5847.75]
  - - [64, 128, 1, 16384]
    - [97, 14377.1]
  - - [96, 128, 1, 1024]
    - [23, 2773.74]
  - - [96, 128, 1, 4096]
    - [81, 7855.05]
  - - [96, 128, 1, 16384]
    - [98, 19917.4]
  - - [128, 128, 1, 1024]
    - [40, 3515.63]
  - - [128, 128, 1, 4096]
    - [99, 9707.48]
  - - [128, 128, 1, 16384]
    - [63, 25691.4]
  - - [192, 128, 1, 1024]
    - [57, 5194.87]
  - - [192, 128, 1, 4096]
    - [100, 13109.8]
  - - [192, 128, 1, 16384]
    - [101, 31078.9]
  - - [256, 128, 1, 1024]
    - [26, 6273.85]
  - - [256, 128, 1, 4096]
    - [64, 16890.7]
  - - [256, 128, 1, 16384]
    - [102, 36265.0]
  - - [384, 128, 1, 1024]
    - [103, 8616.29]
  - - [384, 128, 1, 4096]
    - [104, 22716.9]
  - - [384, 128, 1, 16384]
    - [102, 46096.0]
  - - [512, 128, 1, 1024]
    - [41, 10671.8]
  - - [512, 128, 1, 4096]
    - [61, 25308.8]
  - - [512, 128, 1, 16384]
    - [105, 45308.3]
  - - [640, 128, 1, 1024]
    - [41, 13369.5]
  - - [640, 128, 1, 4096]
    - [105, 30505.8]
  - - [640, 128, 1, 16384]
    - [105, 52949.3]
  - - [768, 128, 1, 1024]
    - [43, 14249.6]
  - - [768, 128, 1, 4096]
    - [106, 33107.5]
  - - [768, 128, 1, 16384]
    - [107, 59295.5]
  - - [1024, 128, 1, 1024]
    - [108, 18318.6]
  - - [1024, 128, 1, 4096]
    - [106, 36859.0]
  - - [1024, 128, 1, 16384]
    - [109, 58728.7]
  - - [1536, 128, 1, 1024]
    - [91, 21505.7]
  - - [1536, 128, 1, 4096]
    - [107, 44895.6]
  - - [1536, 128, 1, 16384]
    - [110, 76413.7]
  - - [2048, 128, 1, 1024]
    - [61, 27695.7]
  - - [2048, 128, 1, 4096]
    - [107, 47875.8]
  - - [2048, 128, 1, 16384]
    - [111, 75449.5]
  - - [3072, 128, 1, 1024]
    - [112, 30351.1]
  - - [3072, 128, 1, 4096]
    - [110, 58458.4]
  - - [3072, 128, 1, 16384]
    - [110, 86258.2]
  - - [4096, 128, 1, 1024]
    - [61, 33815.4]
  - - [4096, 128, 1, 4096]
    - [113, 61595.7]
  - - [4096, 128, 1, 16384]
    - [109, 85681.0]
  - - [6144, 128, 1, 1024]
    - [66, 42171.5]
  - - [6144, 128, 1, 4096]
    - [110, 73034.4]
  - - [6144, 128, 1, 16384]
    - [110, 93623.3]
  - - [8192, 128, 1, 256]
    - [105, 29717.9]
  - - [8192, 128, 1, 1024]
    - [105, 46597.2]
  - - [8192, 128, 1, 4096]
    - [111, 74572.4]
  - - [12288, 128, 1, 256]
    - [66, 34914.5]
  - - [12288, 128, 1, 1024]
    - [114, 57323.9]
  - - [12288, 128, 1, 4096]
    - [113, 79210.5]
  - - [16384, 128, 1, 256]
    - [105, 37326.5]
  - - [16384, 128, 1, 1024]
    - [111, 56534.3]
  - - [16384, 128, 1, 4096]
    - [111, 82947.7]
  - - [20480, 128, 1, 256]
    - [105, 46086.3]
  - - [20480, 128, 1, 1024]
    - [105, 65506.7]
  - - [20480, 128, 1, 4096]
    - [111, 75087.2]
  - - [24576, 128, 1, 256]
    - [110, 44537.2]
  - - [24576, 128, 1, 1024]
    - [113, 72010.1]
  - - [24576, 128, 1, 4096]
    - [113, 87419.7]
  - - [32768, 128, 1, 256]
    - [70, 44451.1]
  - - [32768, 128, 1, 1024]
    - [111, 72461.4]
  - - [32768, 128, 1, 4096]
    - [111, 90108.8]
  - - [3, 192, 1, 1024]
    - [94, 148.198]
  - - [3, 192, 1, 4096]
    - [115, 494.509]
  - - [3, 192, 1, 16384]
    - [95, 1364.32]
  - - [16, 192, 1, 1024]
    - [23, 826.614]
  - - [16, 192, 1, 4096]
    - [38, 2530.01]
  - - [16, 192, 1, 16384]
    - [96, 6658.15]
  - - [32, 192, 1, 1024]
    - [23, 1603.56]
  - - [32, 192, 1, 4096]
    - [40, 4784.28]
  - - [32, 192, 1, 16384]
    - [58, 12338.6]
  - - [64, 192, 1, 1024]
    - [82, 2966.44]
  - - [64, 192, 1, 4096]
    - [60, 8401.78]
  - - [64, 192, 1, 16384]
    - [61, 21344.8]
  - - [96, 192, 1, 1024]
    - [82, 4454.7]
  - - [96, 192, 1, 4096]
    - [58, 11301.0]
  - - [96, 192, 1, 16384]
    - [116, 25517.0]
  - - [128, 192, 1, 1024]
    - [26, 5209.97]
  - - [128, 192, 1, 4096]
    - [61, 14090.5]
  - - [128, 192, 1, 16384]
    - [104, 31381.9]
  - - [192, 192, 1, 1024]
    - [26, 8279.5]
  - - [192, 192, 1, 4096]
    - [83, 18529.8]
  - - [192, 192, 1, 16384]
    - [117, 40538.0]
  - - [256, 192, 1, 1024]
    - [118, 8468.07]
  - - [256, 192, 1, 4096]
    - [104, 21724.4]
  - - [256, 192, 1, 16384]
    - [85, 44379.8]
  - - [384, 192, 1, 1024]
    - [118, 12533.0]
  - - [384, 192, 1, 4096]
    - [117, 28954.0]
  - - [384, 192, 1, 16384]
    - [117, 51293.0]
  - - [512, 192, 1, 1024]
    - [43, 14278.1]
  - - [512, 192, 1, 4096]
    - [119, 32215.3]
  - - [512, 192, 1, 16384]
    - [120, 59843.0]
  - - [640, 192, 1, 1024]
    - [43, 17686.5]
  - - [640, 192, 1, 4096]
    - [86, 38609.6]
  - - [640, 192, 1, 16384]
    - [120, 64251.5]
  - - [768, 192, 1, 1024]
    - [43, 21075.4]
  - - [768, 192, 1, 4096]
    - [121, 41076.3]
  - - [768, 192, 1, 16384]
    - [121, 72719.4]
  - - [1024, 192, 1, 1024]
    - [91, 22092.2]
  - - [1024, 192, 1, 4096]
    - [88, 46011.5]
  - - [1024, 192, 1, 16384]
    - [122, 78423.9]
  - - [1536, 192, 1, 1024]
    - [61, 30902.0]
  - - [1536, 192, 1, 4096]
    - [121, 55116.6]
  - - [1536, 192, 1, 16384]
    - [122, 84284.1]
  - - [2048, 192, 1, 1024]
    - [92, 32277.5]
  - - [2048, 192, 1, 4096]
    - [123, 58633.3]
  - - [2048, 192, 1, 16384]
    - [122, 89158.5]
  - - [3072, 192, 1, 1024]
    - [61, 38851.6]
  - - [3072, 192, 1, 4096]
    - [121, 69362.8]
  - - [3072, 192, 1, 16384]
    - [124, 91532.0]
  - - [4096, 192, 1, 1024]
    - [86, 42619.0]
  - - [4096, 192, 1, 4096]
    - [122, 75476.9]
  - - [4096, 192, 1, 16384]
    - [122, 97841.8]
  - - [6144, 192, 1, 256]
    - [68, 30226.2]
  - - [6144, 192, 1, 1024]
    - [93, 50392.3]
  - - [6144, 192, 1, 4096]
    - [125, 78590.0]
  - - [8192, 192, 1, 256]
    - [120, 36467.6]
  - - [8192, 192, 1, 1024]
    - [120, 56430.1]
  - - [8192, 192, 1, 4096]
    - [125, 84857.5]
  - - [12288, 192, 1, 256]
    - [126, 41951.3]
  - - [12288, 192, 1, 1024]
    - [121, 64857.3]
  - - [12288, 192, 1, 4096]
    - [125, 89236.1]
  - - [16384, 192, 1, 256]
    - [127, 46069.6]
  - - [16384, 192, 1, 1024]
    - [122, 71383.1]
  - - [16384, 192, 1, 4096]
    - [122, 83072.1]
  - - [20480, 192, 1, 256]
    - [127, 53821.9]
  - - [20480, 192, 1, 1024]
    - [122, 86174.0]
  - - [20480, 192, 1, 4096]
    - [122, 102556.0]
  - - [24576, 192, 1, 256]
    - [70, 49550.9]
  - - [24576, 192, 1, 1024]
    - [125, 77109.2]
  - - [24576, 192, 1, 4096]
    - [125, 98238.6]
  - - [32768, 192, 1, 256]
    - [70, 51483.5]
  - - [32768, 192, 1, 1024]
    - [122, 71020.3]
  - - [32768, 192, 1, 4096]
    - [122, 82800.8]
  - - [3, 256, 1, 1024]
    - [128, 194.464]
  - - [3, 256, 1, 4096]
    - [115, 630.471]
  - - [3, 256, 1, 16384]
    - [95, 1531.12]
  - - [3, 384, 1, 1024]
    - [129, 277.342]
  - - [3, 384, 1, 4096]
    - [115, 797.434]
  - - [3, 384, 1, 16384]
    - [130, 2013.57]
  - - [16, 256, 1, 1024]
    - [131, 988.905]
  - - [16, 256, 1, 4096]
    - [131, 3311.43]
  - - [16, 256, 1, 16384]
    - [96, 8098.8]
  - - [32, 256, 1, 1024]
    - [40, 1884.47]
  - - [32, 256, 1, 4096]
    - [97, 5915.11]
  - - [32, 256, 1, 16384]
    - [97, 14388.3]
  - - [16, 384, 1, 1024]
    - [132, 1403.62]
  - - [16, 384, 1, 4096]
    - [131, 4224.35]
  - - [16, 384, 1, 16384]
    - [133, 10780.5]
  - - [32, 384, 1, 1024]
    - [42, 2688.44]
  - - [32, 384, 1, 4096]
    - [97, 7459.27]
  - - [32, 384, 1, 16384]
    - [98, 20185.6]
  - - [64, 256, 1, 1024]
    - [40, 3475.05]
  - - [64, 256, 1, 4096]
    - [63, 9857.83]
  - - [64, 256, 1, 16384]
    - [63, 23689.8]
  - - [96, 256, 1, 1024]
    - [38, 5055.55]
  - - [96, 256, 1, 4096]
    - [98, 13514.9]
  - - [96, 256, 1, 16384]
    - [98, 28342.5]
  - - [64, 384, 1, 1024]
    - [78, 4785.74]
  - - [64, 384, 1, 4096]
    - [98, 13485.8]
  - - [64, 384, 1, 16384]
    - [63, 30319.9]
  - - [96, 384, 1, 1024]
    - [38, 7502.36]
  - - [96, 384, 1, 4096]
    - [134, 17924.8]
  - - [96, 384, 1, 16384]
    - [135, 39767.5]
  - - [128, 256, 1, 1024]
    - [38, 6269.16]
  - - [128, 256, 1, 4096]
    - [63, 16564.7]
  - - [128, 256, 1, 16384]
    - [85, 32844.9]
  - - [192, 256, 1, 1024]
    - [47, 8572.12]
  - - [192, 256, 1, 4096]
    - [101, 21446.0]
  - - [192, 256, 1, 16384]
    - [102, 42092.0]
  - - [128, 384, 1, 1024]
    - [136, 8133.42]
  - - [128, 384, 1, 4096]
    - [85, 22503.1]
  - - [128, 384, 1, 16384]
    - [85, 47796.1]
  - - [192, 384, 1, 1024]
    - [47, 12702.1]
  - - [192, 384, 1, 4096]
    - [87, 28826.4]
  - - [192, 384, 1, 16384]
    - [137, 51459.4]
  - - [256, 256, 1, 1024]
    - [41, 10747.0]
  - - [256, 256, 1, 4096]
    - [63, 26537.6]
  - - [256, 256, 1, 16384]
    - [138, 44362.7]
  - - [384, 256, 1, 1024]
    - [43, 14213.3]
  - - [384, 256, 1, 4096]
    - [102, 34166.1]
  - - [384, 256, 1, 16384]
    - [139, 58212.8]
  - - [256, 384, 1, 1024]
    - [43, 14165.3]
  - - [256, 384, 1, 4096]
    - [85, 33538.6]
  - - [256, 384, 1, 16384]
    - [88, 60219.7]
  - - [384, 384, 1, 1024]
    - [43, 21122.8]
  - - [384, 384, 1, 4096]
    - [138, 41143.6]
  - - [384, 384, 1, 16384]
    - [90, 70511.3]
  - - [512, 256, 1, 1024]
    - [43, 18624.3]
  - - [512, 256, 1, 4096]
    - [105, 35332.1]
  - - [512, 256, 1, 16384]
    - [140, 58828.6]
  - - [640, 256, 1, 1024]
    - [43, 23209.3]
  - - [640, 256, 1, 4096]
    - [105, 42662.3]
  - - [640, 256, 1, 16384]
    - [113, 68432.5]
  - - [768, 256, 1, 1024]
    - [91, 22194.9]
  - - [768, 256, 1, 4096]
    - [139, 45796.4]
  - - [768, 256, 1, 16384]
    - [141, 72621.8]
  - - [512, 384, 1, 1024]
    - [91, 22194.9]
  - - [512, 384, 1, 4096]
    - [86, 44875.5]
  - - [512, 384, 1, 16384]
    - [122, 73418.2]
  - - [640, 384, 1, 1024]
    - [91, 27585.0]
  - - [640, 384, 1, 4096]
    - [120, 51972.4]
  - - [640, 384, 1, 16384]
    - [125, 80242.6]
  - - [768, 384, 1, 1024]
    - [61, 31157.7]
  - - [768, 384, 1, 4096]
    - [142, 55258.0]
  - - [768, 384, 1, 16384]
    - [122, 79416.1]
  - - [1024, 256, 1, 1024]
    - [61, 27689.9]
  - - [1024, 256, 1, 4096]
    - [139, 48099.4]
  - - [1024, 256, 1, 16384]
    - [143, 75971.2]
  - - [1536, 256, 1, 1024]
    - [92, 31414.3]
  - - [1536, 256, 1, 4096]
    - [141, 59550.2]
  - - [1536, 256, 1, 16384]
    - [141, 88274.5]
  - - [1024, 384, 1, 1024]
    - [144, 34382.5]
  - - [1024, 384, 1, 4096]
    - [145, 59909.9]
  - - [1024, 384, 1, 16384]
    - [122, 88850.5]
  - - [1536, 384, 1, 1024]
    - [61, 38716.9]
  - - [1536, 384, 1, 4096]
    - [123, 69922.2]
  - - [1536, 384, 1, 16384]
    - [124, 91453.8]
  - - [2048, 256, 1, 1024]
    - [61, 33772.7]
  - - [2048, 256, 1, 4096]
    - [146, 63849.7]
  - - [2048, 256, 1, 16384]
    - [140, 85729.0]
  - - [3072, 256, 1, 1024]
    - [66, 42673.4]
  - - [3072, 256, 1, 4096]
    - [141, 73542.6]
  - - [3072, 256, 1, 16384]
    - [141, 95334.1]
  - - [2048, 384, 1, 1024]
    - [147, 44935.7]
  - - [2048, 384, 1, 4096]
    - [122, 75526.6]
  - - [2048, 384, 1, 16384]
    - [122, 97070.5]
  - - [3072, 384, 1, 256]
    - [105, 31048.5]
  - - [3072, 384, 1, 1024]
    - [93, 51424.2]
  - - [3072, 384, 1, 4096]
    - [125, 78370.4]
  - - [4096, 256, 1, 256]
    - [105, 30091.8]
  - - [4096, 256, 1, 1024]
    - [105, 46944.4]
  - - [4096, 256, 1, 4096]
    - [146, 75670.7]
  - - [6144, 256, 1, 256]
    - [66, 36930.2]
  - - [6144, 256, 1, 1024]
    - [114, 55939.0]
  - - [6144, 256, 1, 4096]
    - [113, 79646.4]
  - - [4096, 384, 1, 256]
    - [120, 36654.0]
  - - [4096, 384, 1, 1024]
    - [120, 56693.0]
  - - [4096, 384, 1, 4096]
    - [125, 84089.3]
  - - [6144, 384, 1, 256]
    - [105, 41922.1]
  - - [6144, 384, 1, 1024]
    - [148, 61173.4]
  - - [6144, 384, 1, 4096]
    - [125, 89046.6]
  - - [8192, 256, 1, 256]
    - [149, 35313.5]
  - - [8192, 256, 1, 1024]
    - [149, 57558.0]
  - - [8192, 256, 1, 4096]
    - [143, 82615.1]
  - - [12288, 256, 1, 256]
    - [140, 45661.1]
  - - [12288, 256, 1, 1024]
    - [113, 72000.4]
  - - [12288, 256, 1, 4096]
    - [150, 87998.9]
  - - [16384, 256, 1, 256]
    - [143, 45231.7]
  - - [16384, 256, 1, 1024]
    - [111, 74663.3]
  - - [16384, 256, 1, 4096]
    - [143, 91200.9]
  - - [20480, 256, 1, 256]
    - [112, 51487.5]
  - - [20480, 256, 1, 1024]
    - [112, 70370.8]
  - - [20480, 256, 1, 4096]
    - [112, 77281.0]
  - - [24576, 256, 1, 256]
    - [151, 49424.9]
  - - [24576, 256, 1, 1024]
    - [113, 74139.7]
  - - [24576, 256, 1, 4096]
    - [113, 87544.6]
  - - [32768, 256, 1, 256]
    - [112, 52528.6]
  - - [32768, 256, 1, 1024]
    - [111, 74616.5]
  - - [32768, 256, 1, 4096]
    - [111, 90914.6]
  - - [8192, 384, 1, 256]
    - [145, 45911.5]
  - - [8192, 384, 1, 1024]
    - [113, 72638.1]
  - - [8192, 384, 1, 4096]
    - [150, 89062.1]
  - - [12288, 384, 1, 256]
    - [121, 49694.1]
  - - [12288, 384, 1, 1024]
    - [125, 79786.6]
  - - [12288, 384, 1, 4096]
    - [125, 97926.2]
  - - [16384, 384, 1, 256]
    - [151, 51064.6]
  - - [16384, 384, 1, 1024]
    - [113, 73989.5]
  - - [16384, 384, 1, 4096]
    - [113, 88450.6]
  - - [20480, 384, 1, 256]
    - [127, 55566.7]
  - - [20480, 384, 1, 1024]
    - [122, 86470.7]
  - - [20480, 384, 1, 4096]
    - [122, 102026.0]
  - - [24576, 384, 1, 256]
    - [112, 59019.4]
  - - [24576, 384, 1, 1024]
    - [125, 79129.2]
  - - [24576, 384, 1, 4096]
    - [125, 99620.0]
  - - [32768, 384, 1, 256]
    - [112, 58082.2]
  - - [32768, 384, 1, 1024]
    - [112, 77279.1]
  - - [32768, 384, 1, 4096]
    - [111, 91259.2]
  - - [3, 512, 1, 1024]
    - [130, 358.209]
  - - [3, 512, 1, 4096]
    - [130, 1005.28]
  - - [3, 512, 1, 16384]
    - [152, 2317.16]
  - - [3, 640, 1, 1024]
    - [128, 439.653]
  - - [3, 640, 1, 4096]
    - [130, 1238.2]
  - - [3, 640, 1, 16384]
    - [152, 2588.14]
  - - [3, 768, 1, 1024]
    - [153, 512.378]
  - - [3, 768, 1, 4096]
    - [152, 1365.43]
  - - [3, 768, 1, 16384]
    - [154, 2844.2]
  - - [16, 512, 1, 1024]
    - [155, 1809.34]
  - - [16, 512, 1, 4096]
    - [156, 5100.74]
  - - [16, 512, 1, 16384]
    - [156, 12362.8]
  - - [32, 512, 1, 1024]
    - [24, 3441.89]
  - - [32, 512, 1, 4096]
    - [157, 9457.36]
  - - [32, 512, 1, 16384]
    - [98, 24031.6]
  - - [16, 640, 1, 1024]
    - [155, 2276.44]
  - - [16, 640, 1, 4096]
    - [156, 6299.52]
  - - [16, 640, 1, 16384]
    - [156, 13729.2]
  - - [32, 640, 1, 1024]
    - [24, 4293.18]
  - - [32, 640, 1, 4096]
    - [98, 10981.6]
  - - [32, 640, 1, 16384]
    - [98, 26952.5]
  - - [16, 768, 1, 1024]
    - [24, 2701.17]
  - - [16, 768, 1, 4096]
    - [156, 7014.55]
  - - [16, 768, 1, 16384]
    - [158, 15115.2]
  - - [32, 768, 1, 1024]
    - [57, 4969.89]
  - - [32, 768, 1, 4096]
    - [98, 13572.6]
  - - [32, 768, 1, 16384]
    - [98, 28181.0]
  - - [64, 512, 1, 1024]
    - [78, 6016.74]
  - - [64, 512, 1, 4096]
    - [157, 16721.8]
  - - [64, 512, 1, 16384]
    - [61, 33125.3]
  - - [96, 512, 1, 1024]
    - [47, 8806.71]
  - - [96, 512, 1, 4096]
    - [134, 20910.1]
  - - [96, 512, 1, 16384]
    - [106, 41080.6]
  - - [64, 640, 1, 1024]
    - [78, 7534.43]
  - - [64, 640, 1, 4096]
    - [98, 19856.0]
  - - [64, 640, 1, 16384]
    - [159, 37438.2]
  - - [96, 640, 1, 1024]
    - [47, 10992.9]
  - - [96, 640, 1, 4096]
    - [106, 26384.8]
  - - [96, 640, 1, 16384]
    - [106, 49260.1]
  - - [64, 768, 1, 1024]
    - [47, 8557.55]
  - - [64, 768, 1, 4096]
    - [160, 22019.6]
  - - [64, 768, 1, 16384]
    - [161, 43823.1]
  - - [96, 768, 1, 1024]
    - [47, 13104.4]
  - - [96, 768, 1, 4096]
    - [106, 29492.5]
  - - [96, 768, 1, 16384]
    - [162, 50667.5]
  - - [128, 512, 1, 1024]
    - [41, 10726.4]
  - - [128, 512, 1, 4096]
    - [61, 26401.6]
  - - [128, 512, 1, 16384]
    - [120, 41505.9]
  - - [192, 512, 1, 1024]
    - [43, 14525.8]
  - - [192, 512, 1, 4096]
    - [163, 31016.5]
  - - [192, 512, 1, 16384]
    - [107, 49997.0]
  - - [128, 640, 1, 1024]
    - [41, 13360.8]
  - - [128, 640, 1, 4096]
    - [61, 29542.2]
  - - [128, 640, 1, 16384]
    - [120, 50939.1]
  - - [192, 640, 1, 1024]
    - [43, 18011.5]
  - - [192, 640, 1, 4096]
    - [106, 38580.1]
  - - [192, 640, 1, 16384]
    - [107, 61429.7]
  - - [128, 768, 1, 1024]
    - [43, 14298.4]
  - - [128, 768, 1, 4096]
    - [86, 34365.0]
  - - [128, 768, 1, 16384]
    - [120, 59936.7]
  - - [192, 768, 1, 1024]
    - [43, 21551.8]
  - - [192, 768, 1, 4096]
    - [137, 40333.9]
  - - [192, 768, 1, 16384]
    - [123, 74855.8]
  - - [256, 512, 1, 1024]
    - [43, 18368.8]
  - - [256, 512, 1, 4096]
    - [105, 35814.0]
  - - [256, 512, 1, 16384]
    - [145, 60978.5]
  - - [384, 512, 1, 1024]
    - [91, 21852.0]
  - - [384, 512, 1, 4096]
    - [106, 44760.6]
  - - [384, 512, 1, 16384]
    - [141, 73047.8]
  - - [256, 640, 1, 1024]
    - [108, 22504.0]
  - - [256, 640, 1, 4096]
    - [105, 42532.2]
  - - [256, 640, 1, 16384]
    - [164, 69926.2]
  - - [384, 640, 1, 1024]
    - [61, 26285.6]
  - - [384, 640, 1, 4096]
    - [107, 51790.2]
  - - [384, 640, 1, 16384]
    - [165, 80448.3]
  - - [256, 768, 1, 1024]
    - [91, 22160.5]
  - - [256, 768, 1, 4096]
    - [88, 46739.4]
  - - [256, 768, 1, 16384]
    - [122, 73287.6]
  - - [384, 768, 1, 1024]
    - [61, 31228.8]
  - - [384, 768, 1, 4096]
    - [90, 55492.2]
  - - [384, 768, 1, 16384]
    - [90, 81414.5]
  - - [512, 512, 1, 1024]
    - [61, 27857.0]
  - - [512, 512, 1, 4096]
    - [105, 48421.2]
  - - [512, 512, 1, 16384]
    - [122, 71022.6]
  - - [640, 512, 1, 1024]
    - [61, 34363.7]
  - - [640, 512, 1, 4096]
    - [146, 54527.5]
  - - [640, 512, 1, 16384]
    - [146, 76685.8]
  - - [768, 512, 1, 1024]
    - [92, 32010.0]
  - - [768, 512, 1, 4096]
    - [107, 59449.0]
  - - [768, 512, 1, 16384]
    - [140, 82068.7]
  - - [512, 640, 1, 1024]
    - [61, 34118.8]
  - - [512, 640, 1, 4096]
    - [164, 54898.6]
  - - [512, 640, 1, 16384]
    - [164, 79374.5]
  - - [640, 640, 1, 1024]
    - [144, 36274.7]
  - - [640, 640, 1, 4096]
    - [166, 58555.1]
  - - [640, 640, 1, 16384]
    - [167, 76921.9]
  - - [768, 640, 1, 1024]
    - [168, 37048.7]
  - - [768, 640, 1, 4096]
    - [107, 64087.5]
  - - [768, 640, 1, 16384]
    - [165, 85511.8]
  - - [512, 768, 1, 1024]
    - [144, 34697.3]
  - - [512, 768, 1, 4096]
    - [120, 60003.9]
  - - [512, 768, 1, 16384]
    - [122, 83209.7]
  - - [640, 768, 1, 1024]
    - [92, 40549.0]
  - - [640, 768, 1, 4096]
    - [120, 64050.8]
  - - [640, 768, 1, 16384]
    - [125, 85561.0]
  - - [768, 768, 1, 1024]
    - [61, 38518.9]
  - - [768, 768, 1, 4096]
    - [90, 67943.2]
  - - [768, 768, 1, 16384]
    - [90, 87990.1]
  - - [1024, 512, 1, 1024]
    - [61, 33696.2]
  - - [1024, 512, 1, 4096]
    - [143, 61397.9]
  - - [1024, 512, 1, 16384]
    - [143, 86038.8]
  - - [1536, 512, 1, 1024]
    - [66, 42846.2]
  - - [1536, 512, 1, 4096]
    - [140, 76468.3]
  - - [1536, 512, 1, 16384]
    - [140, 96296.8]
  - - [1024, 640, 1, 1024]
    - [61, 41919.7]
  - - [1024, 640, 1, 4096]
    - [164, 72705.4]
  - - [1024, 640, 1, 16384]
    - [164, 92590.3]
  - - [1536, 640, 1, 256]
    - [106, 30515.1]
  - - [1536, 640, 1, 1024]
    - [106, 52581.9]
  - - [1536, 640, 1, 4096]
    - [109, 79808.8]
  - - [1024, 768, 1, 1024]
    - [147, 45168.3]
  - - [1024, 768, 1, 4096]
    - [122, 76723.8]
  - - [1024, 768, 1, 16384]
    - [122, 96947.5]
  - - [1536, 768, 1, 256]
    - [105, 31306.6]
  - - [1536, 768, 1, 1024]
    - [105, 51249.4]
  - - [1536, 768, 1, 4096]
    - [124, 78497.8]
  - - [2048, 512, 1, 256]
    - [105, 29527.8]
  - - [2048, 512, 1, 1024]
    - [146, 47155.1]
  - - [2048, 512, 1, 4096]
    - [146, 76290.4]
  - - [3072, 512, 1, 256]
    - [66, 37005.0]
  - - [3072, 512, 1, 1024]
    - [114, 57488.0]
  - - [3072, 512, 1, 4096]
    - [146, 80518.4]
  - - [2048, 640, 1, 256]
    - [105, 36675.1]
  - - [2048, 640, 1, 1024]
    - [105, 57999.2]
  - - [2048, 640, 1, 4096]
    - [169, 75274.0]
  - - [3072, 640, 1, 256]
    - [106, 44588.6]
  - - [3072, 640, 1, 1024]
    - [107, 65410.6]
  - - [3072, 640, 1, 4096]
    - [109, 89125.9]
  - - [2048, 768, 1, 256]
    - [170, 38006.2]
  - - [2048, 768, 1, 1024]
    - [114, 58607.7]
  - - [2048, 768, 1, 4096]
    - [164, 83046.3]
  - - [3072, 768, 1, 256]
    - [171, 44702.5]
  - - [3072, 768, 1, 1024]
    - [171, 66813.2]
  - - [3072, 768, 1, 4096]
    - [124, 88210.7]
  - - [4096, 512, 1, 256]
    - [172, 36940.2]
  - - [4096, 512, 1, 1024]
    - [149, 59534.9]
  - - [4096, 512, 1, 4096]
    - [143, 83412.7]
  - - [6144, 512, 1, 256]
    - [140, 45713.2]
  - - [6144, 512, 1, 1024]
    - [146, 73254.3]
  - - [6144, 512, 1, 4096]
    - [146, 89079.4]
  - - [4096, 640, 1, 256]
    - [172, 45522.5]
  - - [4096, 640, 1, 1024]
    - [164, 68334.8]
  - - [4096, 640, 1, 4096]
    - [90, 81002.1]
  - - [6144, 640, 1, 256]
    - [109, 56132.1]
  - - [6144, 640, 1, 1024]
    - [109, 83637.1]
  - - [6144, 640, 1, 4096]
    - [109, 100444.0]
  - - [4096, 768, 1, 256]
    - [164, 49062.8]
  - - [4096, 768, 1, 1024]
    - [164, 79921.4]
  - - [4096, 768, 1, 4096]
    - [164, 93699.7]
  - - [6144, 768, 1, 256]
    - [121, 51032.3]
  - - [6144, 768, 1, 1024]
    - [125, 77032.7]
  - - [6144, 768, 1, 4096]
    - [124, 96665.6]
  - - [8192, 512, 1, 256]
    - [173, 43597.0]
  - - [8192, 512, 1, 1024]
    - [174, 69261.6]
  - - [8192, 512, 1, 4096]
    - [174, 90454.0]
  - - [12288, 512, 1, 256]
    - [173, 51808.8]
  - - [12288, 512, 1, 1024]
    - [175, 70602.1]
  - - [12288, 512, 1, 4096]
    - [176, 87621.0]
  - - [16384, 512, 1, 256]
    - [173, 54093.6]
  - - [16384, 512, 1, 1024]
    - [174, 71668.8]
  - - [16384, 512, 1, 4096]
    - [174, 90475.0]
  - - [20480, 512, 1, 256]
    - [173, 59194.0]
  - - [20480, 512, 1, 1024]
    - [173, 74876.2]
  - - [20480, 512, 1, 4096]
    - [177, 88955.2]
  - - [24576, 512, 1, 256]
    - [173, 59865.3]
  - - [24576, 512, 1, 1024]
    - [178, 77301.5]
  - - [24576, 512, 1, 4096]
    - [174, 89425.9]
  - - [32768, 512, 1, 1024]
    - [178, 80686.1]
  - - [8192, 640, 1, 256]
    - [173, 53640.7]
  - - [8192, 640, 1, 1024]
    - [173, 70858.7]
  - - [8192, 640, 1, 4096]
    - [179, 79820.4]
  - - [12288, 640, 1, 256]
    - [173, 57076.4]
  - - [12288, 640, 1, 1024]
    - [180, 81605.2]
  - - [12288, 640, 1, 4096]
    - [180, 98992.4]
  - - [16384, 640, 1, 256]
    - [173, 61050.8]
  - - [16384, 640, 1, 1024]
    - [173, 75320.6]
  - - [16384, 640, 1, 4096]
    - [180, 87672.4]
  - - [20480, 640, 1, 256]
    - [181, 63164.5]
  - - [20480, 640, 1, 1024]
    - [178, 80023.8]
  - - [20480, 640, 1, 4096]
    - [182, 96067.0]
  - - [24576, 640, 1, 1024]
    - [178, 84424.6]
  - - [32768, 640, 1, 1024]
    - [178, 83037.7]
  - - [8192, 768, 1, 256]
    - [173, 52733.8]
  - - [8192, 768, 1, 1024]
    - [183, 76243.3]
  - - [8192, 768, 1, 4096]
    - [183, 92451.8]
  - - [12288, 768, 1, 256]
    - [184, 58086.4]
  - - [12288, 768, 1, 1024]
    - [184, 80011.8]
  - - [12288, 768, 1, 4096]
    - [185, 96323.7]
  - - [16384, 768, 1, 256]
    - [173, 61365.1]
  - - [16384, 768, 1, 1024]
    - [186, 79185.2]
  - - [16384, 768, 1, 4096]
    - [183, 92190.6]
  - - [20480, 768, 1, 1024]
    - [184, 85332.0]
  - - [24576, 768, 1, 1024]
    - [186, 86028.8]
  - - [32768, 768, 1, 1024]
    - [186, 89273.7]
  - - [3, 1024, 1, 1024]
    - [54, 646.898]
  - - [3, 1024, 1, 4096]
    - [187, 1635.65]
  - - [3, 1024, 1, 16384]
    - [187, 3102.34]
  - - [3, 1536, 1, 1024]
    - [187, 822.8]
  - - [3, 1536, 1, 4096]
    - [188, 2202.14]
  - - [3, 1536, 1, 16384]
    - [187, 3846.02]
  - - [16, 1024, 1, 1024]
    - [36, 3442.74]
  - - [16, 1024, 1, 4096]
    - [156, 8422.78]
  - - [16, 1024, 1, 16384]
    - [156, 15657.8]
  - - [32, 1024, 1, 1024]
    - [57, 6552.85]
  - - [32, 1024, 1, 4096]
    - [98, 16454.7]
  - - [32, 1024, 1, 16384]
    - [98, 31328.8]
  - - [16, 1536, 1, 1024]
    - [96, 4239.19]
  - - [16, 1536, 1, 4096]
    - [158, 11057.8]
  - - [16, 1536, 1, 16384]
    - [189, 18607.4]
  - - [32, 1536, 1, 1024]
    - [58, 7558.97]
  - - [32, 1536, 1, 4096]
    - [157, 20953.8]
  - - [32, 1536, 1, 16384]
    - [189, 37517.1]
  - - [64, 1024, 1, 1024]
    - [41, 11166.5]
  - - [64, 1024, 1, 4096]
    - [61, 26443.2]
  - - [64, 1024, 1, 16384]
    - [190, 46858.1]
  - - [96, 1024, 1, 1024]
    - [58, 14454.7]
  - - [96, 1024, 1, 4096]
    - [163, 32586.5]
  - - [96, 1024, 1, 16384]
    - [139, 57906.4]
  - - [64, 1536, 1, 1024]
    - [43, 14589.1]
  - - [64, 1536, 1, 4096]
    - [161, 32293.1]
  - - [64, 1536, 1, 16384]
    - [191, 54353.5]
  - - [96, 1536, 1, 1024]
    - [58, 21194.1]
  - - [96, 1536, 1, 4096]
    - [139, 39633.7]
  - - [96, 1536, 1, 16384]
    - [142, 69901.9]
  - - [128, 1024, 1, 1024]
    - [43, 18929.8]
  - - [128, 1024, 1, 4096]
    - [105, 37800.6]
  - - [128, 1024, 1, 16384]
    - [192, 61292.4]
  - - [192, 1024, 1, 1024]
    - [61, 21345.6]
  - - [192, 1024, 1, 4096]
    - [107, 46022.0]
  - - [192, 1024, 1, 16384]
    - [140, 78924.6]
  - - [128, 1536, 1, 1024]
    - [91, 21327.5]
  - - [128, 1536, 1, 4096]
    - [120, 45697.5]
  - - [128, 1536, 1, 16384]
    - [193, 76610.4]
  - - [192, 1536, 1, 1024]
    - [61, 31378.3]
  - - [192, 1536, 1, 4096]
    - [123, 56044.4]
  - - [192, 1536, 1, 16384]
    - [123, 85240.9]
  - - [256, 1024, 1, 1024]
    - [61, 27955.9]
  - - [256, 1024, 1, 4096]
    - [88, 50200.1]
  - - [256, 1024, 1, 16384]
    - [169, 77788.9]
  - - [384, 1024, 1, 1024]
    - [144, 34400.2]
  - - [384, 1024, 1, 4096]
    - [141, 60228.7]
  - - [384, 1024, 1, 16384]
    - [140, 88818.5]
  - - [256, 1536, 1, 1024]
    - [144, 34465.2]
  - - [256, 1536, 1, 4096]
    - [164, 60555.6]
  - - [256, 1536, 1, 16384]
    - [122, 89896.8]
  - - [384, 1536, 1, 1024]
    - [65, 38781.7]
  - - [384, 1536, 1, 4096]
    - [123, 70968.0]
  - - [384, 1536, 1, 16384]
    - [123, 93015.4]
  - - [512, 1024, 1, 1024]
    - [61, 33620.0]
  - - [512, 1024, 1, 4096]
    - [169, 63910.5]
  - - [512, 1024, 1, 16384]
    - [169, 86809.3]
  - - [640, 1024, 1, 1024]
    - [65, 41993.4]
  - - [640, 1024, 1, 4096]
    - [146, 72383.2]
  - - [640, 1024, 1, 16384]
    - [146, 90690.3]
  - - [768, 1024, 1, 1024]
    - [147, 45567.8]
  - - [768, 1024, 1, 4096]
    - [140, 76563.0]
  - - [768, 1024, 1, 16384]
    - [140, 96490.5]
  - - [512, 1536, 1, 1024]
    - [147, 45208.9]
  - - [512, 1536, 1, 4096]
    - [122, 76453.7]
  - - [512, 1536, 1, 16384]
    - [122, 97586.3]
  - - [640, 1536, 1, 256]
    - [86, 30619.5]
  - - [640, 1536, 1, 1024]
    - [86, 52769.9]
  - - [640, 1536, 1, 4096]
    - [193, 79505.6]
  - - [768, 1536, 1, 256]
    - [105, 31319.6]
  - - [768, 1536, 1, 1024]
    - [105, 51257.9]
  - - [768, 1536, 1, 4096]
    - [165, 78472.4]
  - - [1024, 1024, 1, 256]
    - [194, 30017.6]
  - - [1024, 1024, 1, 1024]
    - [194, 47603.6]
  - - [1024, 1024, 1, 4096]
    - [143, 74611.3]
  - - [1536, 1024, 1, 256]
    - [66, 37155.6]
  - - [1536, 1024, 1, 1024]
    - [114, 58624.7]
  - - [1536, 1024, 1, 4096]
    - [146, 80903.4]
  - - [1024, 1536, 1, 256]
    - [170, 38006.4]
  - - [1024, 1536, 1, 1024]
    - [195, 59103.4]
  - - [1024, 1536, 1, 4096]
    - [164, 82496.3]
  - - [1536, 1536, 1, 256]
    - [171, 45403.1]
  - - [1536, 1536, 1, 1024]
    - [171, 67189.5]
  - - [1536, 1536, 1, 4096]
    - [165, 88283.4]
  - - [2048, 1024, 1, 256]
    - [196, 41151.8]
  - - [2048, 1024, 1, 1024]
    - [196, 60633.2]
  - - [2048, 1024, 1, 4096]
    - [169, 83728.9]
  - - [3072, 1024, 1, 256]
    - [140, 46593.1]
  - - [3072, 1024, 1, 1024]
    - [146, 76753.2]
  - - [3072, 1024, 1, 4096]
    - [146, 90148.9]
  - - [2048, 1536, 1, 256]
    - [164, 49966.0]
  - - [2048, 1536, 1, 1024]
    - [164, 80401.4]
  - - [2048, 1536, 1, 4096]
    - [164, 93795.5]
  - - [3072, 1536, 1, 256]
    - [197, 52609.4]
  - - [3072, 1536, 1, 1024]
    - [197, 78713.2]
  - - [3072, 1536, 1, 4096]
    - [198, 96539.8]
  - - [4096, 1024, 1, 256]
    - [199, 44216.2]
  - - [4096, 1024, 1, 1024]
    - [182, 76475.6]
  - - [4096, 1024, 1, 4096]
    - [182, 93342.6]
  - - [6144, 1024, 1, 256]
    - [173, 50096.8]
  - - [6144, 1024, 1, 1024]
    - [175, 71067.4]
  - - [6144, 1024, 1, 4096]
    - [176, 88686.1]
  - - [4096, 1536, 1, 256]
    - [181, 55958.4]
  - - [4096, 1536, 1, 1024]
    - [183, 76753.2]
  - - [4096, 1536, 1, 4096]
    - [183, 92961.2]
  - - [6144, 1536, 1, 256]
    - [181, 58024.9]
  - - [6144, 1536, 1, 1024]
    - [184, 79712.8]
  - - [6144, 1536, 1, 4096]
    - [185, 96239.1]
  - - [8192, 1024, 1, 256]
    - [173, 53382.0]
  - - [8192, 1024, 1, 1024]
    - [182, 77543.9]
  - - [8192, 1024, 1, 4096]
    - [182, 93648.6]
  - - [12288, 1024, 1, 256]
    - [173, 57262.7]
  - - [12288, 1024, 1, 1024]
    - [200, 78033.5]
  - - [12288, 1024, 1, 4096]
    - [182, 93742.1]
  - - [16384, 1024, 1, 1024]
    - [178, 80674.0]
  - - [20480, 1024, 1, 1024]
    - [178, 83112.5]
  - - [24576, 1024, 1, 1024]
    - [178, 84916.9]
  - - [32768, 1024, 1, 1024]
    - [178, 83004.8]
  - - [8192, 1536, 1, 256]
    - [181, 61257.4]
  - - [8192, 1536, 1, 1024]
    - [186, 78785.3]
  - - [8192, 1536, 1, 4096]
    - [183, 93086.4]
  - - [12288, 1536, 1, 1024]
    - [186, 86795.6]
  - - [16384, 1536, 1, 1024]
    - [186, 90222.3]
  - - [20480, 1536, 1, 1024]
    - [186, 91828.3]
  - - [24576, 1536, 1, 1024]
    - [186, 93601.6]
  - - [32768, 1536, 1, 1024]
    - [186, 91212.6]
  - - [3, 2048, 1, 1024]
    - [187, 1005.34]
  - - [3, 2048, 1, 4096]
    - [187, 2465.91]
  - - [3, 2048, 1, 16384]
    - [187, 3940.28]
  - - [3, 3072, 1, 1024]
    - [188, 1363.37]
  - - [3, 3072, 1, 4096]
    - [187, 3087.34]
  - - [3, 3072, 1, 16384]
    - [187, 4360.57]
  - - [16, 2048, 1, 1024]
    - [57, 6482.82]
  - - [16, 2048, 1, 4096]
    - [156, 12260.5]
  - - [16, 2048, 1, 16384]
    - [158, 18499.5]
  - - [32, 2048, 1, 1024]
    - [41, 11110.9]
  - - [32, 2048, 1, 4096]
    - [98, 23818.7]
  - - [32, 2048, 1, 16384]
    - [157, 36408.0]
  - - [16, 3072, 1, 1024]
    - [96, 7888.11]
  - - [16, 3072, 1, 4096]
    - [158, 14925.2]
  - - [16, 3072, 1, 16384]
    - [189, 21620.3]
  - - [32, 3072, 1, 1024]
    - [58, 14290.2]
  - - [32, 3072, 1, 4096]
    - [189, 28092.7]
  - - [32, 3072, 1, 16384]
    - [189, 42919.5]
  - - [64, 2048, 1, 1024]
    - [43, 19026.5]
  - - [64, 2048, 1, 4096]
    - [190, 35987.3]
  - - [64, 2048, 1, 16384]
    - [190, 53954.6]
  - - [96, 2048, 1, 1024]
    - [201, 21427.8]
  - - [96, 2048, 1, 4096]
    - [106, 44805.5]
  - - [96, 2048, 1, 16384]
    - [139, 67624.9]
  - - [64, 3072, 1, 1024]
    - [201, 21446.0]
  - - [64, 3072, 1, 4096]
    - [161, 42777.8]
  - - [64, 3072, 1, 16384]
    - [191, 62706.0]
  - - [96, 3072, 1, 1024]
    - [98, 28937.2]
  - - [96, 3072, 1, 4096]
    - [142, 53016.8]
  - - [96, 3072, 1, 16384]
    - [142, 79594.3]
  - - [128, 2048, 1, 1024]
    - [61, 27764.6]
  - - [128, 2048, 1, 4096]
    - [120, 49358.1]
  - - [128, 2048, 1, 16384]
    - [202, 76645.1]
  - - [192, 2048, 1, 1024]
    - [92, 32303.5]
  - - [192, 2048, 1, 4096]
    - [140, 60183.6]
  - - [192, 2048, 1, 16384]
    - [140, 90121.0]
  - - [128, 3072, 1, 1024]
    - [92, 33096.6]
  - - [128, 3072, 1, 4096]
    - [167, 59834.0]
  - - [128, 3072, 1, 16384]
    - [193, 87407.7]
  - - [192, 3072, 1, 1024]
    - [61, 38831.5]
  - - [192, 3072, 1, 4096]
    - [123, 70705.6]
  - - [192, 3072, 1, 16384]
    - [123, 93733.4]
  - - [256, 2048, 1, 1024]
    - [65, 33653.7]
  - - [256, 2048, 1, 4096]
    - [164, 66078.7]
  - - [256, 2048, 1, 16384]
    - [122, 89086.9]
  - - [384, 2048, 1, 1024]
    - [147, 45536.9]
  - - [384, 2048, 1, 4096]
    - [140, 76724.0]
  - - [384, 2048, 1, 16384]
    - [140, 97134.9]
  - - [256, 3072, 1, 1024]
    - [147, 45536.9]
  - - [256, 3072, 1, 4096]
    - [122, 75328.5]
  - - [256, 3072, 1, 16384]
    - [122, 98540.7]
  - - [384, 3072, 1, 256]
    - [105, 31189.9]
  - - [384, 3072, 1, 1024]
    - [203, 51804.4]
  - - [384, 3072, 1, 4096]
    - [165, 78329.5]
  - - [512, 2048, 1, 256]
    - [204, 30139.3]
  - - [512, 2048, 1, 1024]
    - [205, 48164.3]
  - - [512, 2048, 1, 4096]
    - [164, 78063.8]
  - - [640, 2048, 1, 256]
    - [105, 37446.6]
  - - [640, 2048, 1, 1024]
    - [105, 58680.4]
  - - [640, 2048, 1, 4096]
    - [202, 74586.4]
  - - [768, 2048, 1, 256]
    - [170, 38274.3]
  - - [768, 2048, 1, 1024]
    - [114, 58535.1]
  - - [768, 2048, 1, 4096]
    - [205, 83423.6]
  - - [512, 3072, 1, 256]
    - [170, 38049.5]
  - - [512, 3072, 1, 1024]
    - [206, 57283.0]
  - - [512, 3072, 1, 4096]
    - [205, 83046.3]
  - - [640, 3072, 1, 256]
    - [120, 45792.1]
  - - [640, 3072, 1, 1024]
    - [207, 68241.8]
  - - [640, 3072, 1, 4096]
    - [208, 89106.1]
  - - [768, 3072, 1, 256]
    - [171, 46360.1]
  - - [768, 3072, 1, 1024]
    - [209, 67905.0]
  - - [768, 3072, 1, 4096]
    - [210, 88890.6]
  - - [1024, 2048, 1, 256]
    - [196, 41266.3]
  - - [1024, 2048, 1, 1024]
    - [196, 60647.1]
  - - [1024, 2048, 1, 4096]
    - [211, 84252.4]
  - - [1536, 2048, 1, 256]
    - [164, 48967.3]
  - - [1536, 2048, 1, 1024]
    - [164, 79589.1]
  - - [1536, 2048, 1, 4096]
    - [205, 93601.5]
  - - [1024, 3072, 1, 256]
    - [205, 51702.1]
  - - [1024, 3072, 1, 1024]
    - [164, 81263.6]
  - - [1024, 3072, 1, 4096]
    - [205, 93905.1]
  - - [1536, 3072, 1, 256]
    - [197, 54111.8]
  - - [1536, 3072, 1, 1024]
    - [212, 79126.7]
  - - [1536, 3072, 1, 4096]
    - [210, 97447.2]
  - - [2048, 2048, 1, 256]
    - [213, 46837.8]
  - - [2048, 2048, 1, 1024]
    - [182, 76014.4]
  - - [2048, 2048, 1, 4096]
    - [214, 93617.9]
  - - [3072, 2048, 1, 256]
    - [215, 52575.1]
  - - [3072, 2048, 1, 1024]
    - [183, 76486.5]
  - - [3072, 2048, 1, 4096]
    - [216, 92506.3]
  - - [2048, 3072, 1, 256]
    - [217, 56422.1]
  - - [2048, 3072, 1, 1024]
    - [183, 76687.3]
  - - [2048, 3072, 1, 4096]
    - [183, 92841.7]
  - - [3072, 3072, 1, 256]
    - [184, 59668.1]
  - - [3072, 3072, 1, 1024]
    - [218, 80412.2]
  - - [3072, 3072, 1, 4096]
    - [219, 96398.9]
  - - [4096, 2048, 1, 256]
    - [173, 54534.1]
  - - [4096, 2048, 1, 1024]
    - [182, 77752.2]
  - - [4096, 2048, 1, 4096]
    - [182, 94024.6]
  - - [6144, 2048, 1, 256]
    - [173, 58684.7]
  - - [6144, 2048, 1, 1024]
    - [200, 79337.6]
  - - [6144, 2048, 1, 4096]
    - [182, 94176.8]
  - - [4096, 3072, 1, 256]
    - [181, 61813.5]
  - - [4096, 3072, 1, 1024]
    - [182, 78617.6]
  - - [4096, 3072, 1, 4096]
    - [182, 94467.5]
  - - [6144, 3072, 1, 1024]
    - [186, 87579.3]
  - - [8192, 2048, 1, 1024]
    - [186, 84601.6]
  - - [12288, 2048, 1, 1024]
    - [200, 86812.8]
  - - [16384, 2048, 1, 1024]
    - [200, 87499.7]
  - - [20480, 2048, 1, 1024]
    - [200, 87590.0]
  - - [24576, 2048, 1, 1024]
    - [200, 86613.9]
  - - [32768, 2048, 1, 1024]
    - [200, 88054.8]
  - - [8192, 3072, 1, 1024]
    - [186, 89758.7]
  - - [12288, 3072, 1, 1024]
    - [186, 94081.1]
  - - [16384, 3072, 1, 1024]
    - [186, 91359.9]
  - - [20480, 3072, 1, 1024]
    - [186, 92932.9]
  - - [24576, 3072, 1, 1024]
    - [186, 94454.3]
  - - [32768, 3072, 1, 1024]
    - [186, 93024.1]
  - - [3, 4096, 1, 1024]
    - [95, 1863.93]
  - - [3, 4096, 1, 4096]
    - [188, 3339.17]
  - - [3, 4096, 1, 16384]
    - [188, 4436.06]
  - - [3, 6144, 1, 1024]
    - [188, 2188.42]
  - - [3, 6144, 1, 4096]
    - [187, 3884.67]
  - - [3, 6144, 1, 16384]
    - [187, 4671.99]
  - - [16, 4096, 1, 1024]
    - [155, 9872.36]
  - - [16, 4096, 1, 4096]
    - [157, 15500.5]
  - - [16, 4096, 1, 16384]
    - [189, 21343.4]
  - - [32, 4096, 1, 1024]
    - [58, 18718.0]
  - - [32, 4096, 1, 4096]
    - [189, 30364.7]
  - - [32, 4096, 1, 16384]
    - [189, 42736.2]
  - - [16, 6144, 1, 1024]
    - [220, 12748.3]
  - - [16, 6144, 1, 4096]
    - [189, 18242.0]
  - - [16, 6144, 1, 16384]
    - [189, 22852.0]
  - - [32, 6144, 1, 1024]
    - [201, 20252.4]
  - - [32, 6144, 1, 4096]
    - [189, 36587.0]
  - - [32, 6144, 1, 16384]
    - [189, 46671.6]
  - - [64, 4096, 1, 1024]
    - [61, 27921.0]
  - - [64, 4096, 1, 4096]
    - [190, 45667.5]
  - - [64, 4096, 1, 16384]
    - [191, 61061.9]
  - - [96, 4096, 1, 1024]
    - [221, 31777.2]
  - - [96, 4096, 1, 4096]
    - [139, 56917.8]
  - - [96, 4096, 1, 16384]
    - [142, 79085.8]
  - - [64, 6144, 1, 1024]
    - [92, 32194.7]
  - - [64, 6144, 1, 4096]
    - [191, 53549.2]
  - - [64, 6144, 1, 16384]
    - [191, 67254.2]
  - - [96, 6144, 1, 1024]
    - [203, 35551.0]
  - - [96, 6144, 1, 4096]
    - [142, 66247.7]
  - - [96, 6144, 1, 16384]
    - [142, 83668.3]
  - - [128, 4096, 1, 1024]
    - [222, 34073.6]
  - - [128, 4096, 1, 4096]
    - [167, 64155.5]
  - - [128, 4096, 1, 16384]
    - [193, 87038.5]
  - - [192, 4096, 1, 1024]
    - [223, 44243.0]
  - - [192, 4096, 1, 4096]
    - [140, 76062.9]
  - - [192, 4096, 1, 16384]
    - [140, 98519.7]
  - - [128, 6144, 1, 1024]
    - [147, 45148.1]
  - - [128, 6144, 1, 4096]
    - [193, 74228.6]
  - - [128, 6144, 1, 16384]
    - [193, 95159.1]
  - - [192, 6144, 1, 256]
    - [74, 30397.2]
  - - [192, 6144, 1, 1024]
    - [203, 51397.9]
  - - [192, 6144, 1, 4096]
    - [121, 77874.0]
  - - [256, 4096, 1, 256]
    - [105, 30302.9]
  - - [256, 4096, 1, 1024]
    - [164, 48246.8]
  - - [256, 4096, 1, 4096]
    - [164, 78894.5]
  - - [384, 4096, 1, 256]
    - [170, 38339.9]
  - - [384, 4096, 1, 1024]
    - [195, 58394.7]
  - - [384, 4096, 1, 4096]
    - [165, 84076.1]
  - - [256, 6144, 1, 256]
    - [170, 37905.9]
  - - [256, 6144, 1, 1024]
    - [195, 58774.8]
  - - [256, 6144, 1, 4096]
    - [164, 84137.7]
  - - [384, 6144, 1, 256]
    - [171, 44775.6]
  - - [384, 6144, 1, 1024]
    - [171, 70433.0]
  - - [384, 6144, 1, 4096]
    - [165, 88952.9]
  - - [512, 4096, 1, 256]
    - [224, 40261.2]
  - - [512, 4096, 1, 1024]
    - [224, 60116.1]
  - - [512, 4096, 1, 4096]
    - [211, 84279.0]
  - - [640, 4096, 1, 256]
    - [225, 46239.2]
  - - [640, 4096, 1, 1024]
    - [226, 68029.3]
  - - [640, 4096, 1, 4096]
    - [227, 77810.9]
  - - [768, 4096, 1, 256]
    - [228, 45848.5]
  - - [768, 4096, 1, 1024]
    - [205, 80716.5]
  - - [768, 4096, 1, 4096]
    - [205, 94017.8]
  - - [512, 6144, 1, 256]
    - [229, 51293.1]
  - - [512, 6144, 1, 1024]
    - [205, 78646.5]
  - - [512, 6144, 1, 4096]
    - [205, 93850.3]
  - - [640, 6144, 1, 256]
    - [230, 54772.9]
  - - [640, 6144, 1, 1024]
    - [208, 84403.2]
  - - [640, 6144, 1, 4096]
    - [208, 100376.0]
  - - [768, 6144, 1, 256]
    - [231, 55031.1]
  - - [768, 6144, 1, 1024]
    - [212, 79612.8]
  - - [768, 6144, 1, 4096]
    - [210, 97725.7]
  - - [1024, 4096, 1, 256]
    - [213, 47384.5]
  - - [1024, 4096, 1, 1024]
    - [214, 76214.5]
  - - [1024, 4096, 1, 4096]
    - [214, 93769.5]
  - - [1536, 4096, 1, 256]
    - [217, 55896.3]
  - - [1536, 4096, 1, 1024]
    - [216, 76632.4]
  - - [1536, 4096, 1, 4096]
    - [216, 93051.4]
  - - [1024, 6144, 1, 256]
    - [217, 56114.8]
  - - [1024, 6144, 1, 1024]
    - [216, 76530.2]
  - - [1024, 6144, 1, 4096]
    - [216, 92883.3]
  - - [1536, 6144, 1, 256]
    - [218, 59503.2]
  - - [1536, 6144, 1, 1024]
    - [218, 80527.8]
  - - [1536, 6144, 1, 4096]
    - [219, 96862.7]
  - - [2048, 4096, 1, 256]
    - [215, 54852.6]
  - - [2048, 4096, 1, 1024]
    - [214, 77356.3]
  - - [2048, 4096, 1, 4096]
    - [214, 94134.1]
  - - [3072, 4096, 1, 256]
    - [217, 61299.5]
  - - [3072, 4096, 1, 1024]
    - [232, 80305.1]
  - - [3072, 4096, 1, 4096]
    - [214, 94233.5]
  - - [2048, 6144, 1, 256]
    - [217, 62162.7]
  - - [2048, 6144, 1, 1024]
    - [232, 79530.1]
  - - [2048, 6144, 1, 4096]
    - [214, 94486.3]
  - - [3072, 6144, 1, 1024]
    - [232, 87596.8]
  - - [4096, 4096, 1, 1024]
    - [214, 78813.2]
  - - [6144, 4096, 1, 1024]
    - [232, 91133.1]
  - - [4096, 6144, 1, 1024]
    - [232, 90695.8]
  - - [6144, 6144, 1, 1024]
    - [232, 95739.2]
  - - [8192, 4096, 1, 1024]
    - [186, 88393.1]
  - - [12288, 4096, 1, 1024]
    - [200, 89777.5]
  - - [16384, 4096, 1, 1024]
    - [200, 90015.5]
  - - [20480, 4096, 1, 1024]
    - [186, 89779.3]
  - - [24576, 4096, 1, 1024]
    - [200, 89560.1]
  - - [32768, 4096, 1, 1024]
    - [200, 90137.4]
  - - [8192, 6144, 1, 1024]
    - [186, 92360.7]
  - - [12288, 6144, 1, 1024]
    - [186, 95400.6]
  - - [16384, 6144, 1, 1024]
    - [186, 94371.1]
  - - [20480, 6144, 1, 1024]
    - [186, 96260.7]
  - - [24576, 6144, 1, 1024]
    - [186, 95218.1]
  - - [32768, 6144, 1, 1024]
    - [186, 95127.9]
  - - [3, 8192, 1, 1024]
    - [188, 2464.16]
  - - [3, 8192, 1, 4096]
    - [188, 3985.63]
  - - [3, 8192, 1, 16384]
    - [187, 4766.0]
  - - [3, 12288, 1, 1024]
    - [188, 3008.13]
  - - [3, 12288, 1, 4096]
    - [187, 4229.81]
  - - [3, 12288, 1, 16384]
    - [187, 4829.51]
  - - [3, 16384, 1, 1024]
    - [233, 3130.81]
  - - [3, 16384, 1, 4096]
    - [188, 4100.65]
  - - [3, 16384, 1, 16384]
    - [187, 4757.54]
  - - [3, 20480, 1, 1024]
    - [234, 3592.67]
  - - [3, 20480, 1, 4096]
    - [187, 4223.28]
  - - [3, 20480, 1, 16384]
    - [187, 4734.95]
  - - [3, 24576, 1, 1024]
    - [188, 4079.93]
  - - [3, 24576, 1, 4096]
    - [188, 4693.15]
  - - [3, 24576, 1, 16384]
    - [188, 4815.7]
  - - [3, 32768, 1, 1024]
    - [235, 3893.24]
  - - [3, 32768, 1, 4096]
    - [235, 4410.29]
  - - [3, 32768, 1, 16384]
    - [187, 4762.06]
  - - [16, 8192, 1, 1024]
    - [156, 13013.5]
  - - [16, 8192, 1, 4096]
    - [236, 17873.6]
  - - [16, 8192, 1, 16384]
    - [189, 21719.0]
  - - [32, 8192, 1, 1024]
    - [98, 25496.7]
  - - [32, 8192, 1, 4096]
    - [236, 35857.2]
  - - [32, 8192, 1, 16384]
    - [189, 42546.2]
  - - [16, 12288, 1, 1024]
    - [237, 15150.3]
  - - [16, 12288, 1, 4096]
    - [189, 19228.7]
  - - [16, 12288, 1, 16384]
    - [189, 21954.9]
  - - [32, 12288, 1, 1024]
    - [221, 27674.7]
  - - [32, 12288, 1, 4096]
    - [189, 38536.7]
  - - [32, 12288, 1, 16384]
    - [189, 43918.9]
  - - [16, 16384, 1, 1024]
    - [238, 16788.9]
  - - [16, 16384, 1, 4096]
    - [238, 20467.5]
  - - [16, 16384, 1, 16384]
    - [238, 21651.4]
  - - [32, 16384, 1, 1024]
    - [157, 30197.0]
  - - [32, 16384, 1, 4096]
    - [236, 37088.7]
  - - [32, 16384, 1, 16384]
    - [189, 42907.4]
  - - [16, 20480, 1, 1024]
    - [157, 18546.9]
  - - [16, 20480, 1, 4096]
    - [157, 21372.0]
  - - [16, 20480, 1, 16384]
    - [157, 21309.8]
  - - [32, 20480, 1, 1024]
    - [157, 37387.9]
  - - [32, 20480, 1, 4096]
    - [157, 42901.6]
  - - [32, 20480, 1, 16384]
    - [189, 41333.0]
  - - [16, 24576, 1, 1024]
    - [236, 17547.2]
  - - [16, 24576, 1, 4096]
    - [236, 20535.5]
  - - [16, 24576, 1, 16384]
    - [189, 21866.8]
  - - [32, 24576, 1, 1024]
    - [236, 36815.1]
  - - [32, 24576, 1, 4096]
    - [236, 41637.2]
  - - [32, 24576, 1, 16384]
    - [189, 42494.1]
  - - [16, 32768, 1, 1024]
    - [238, 17047.6]
  - - [16, 32768, 1, 4096]
    - [238, 19954.0]
  - - [16, 32768, 1, 16384]
    - [239, 21549.1]
  - - [32, 32768, 1, 256]
    - [240, 23600.4]
  - - [32, 32768, 1, 1024]
    - [240, 34711.6]
  - - [32, 32768, 1, 4096]
    - [240, 39310.5]
  - - [64, 8192, 1, 1024]
    - [61, 33875.2]
  - - [64, 8192, 1, 4096]
    - [241, 52621.5]
  - - [64, 8192, 1, 16384]
    - [241, 62435.6]
  - - [96, 8192, 1, 1024]
    - [106, 42965.3]
  - - [96, 8192, 1, 4096]
    - [242, 62657.2]
  - - [96, 8192, 1, 16384]
    - [242, 74769.3]
  - - [64, 12288, 1, 1024]
    - [243, 43224.2]
  - - [64, 12288, 1, 4096]
    - [244, 59598.9]
  - - [64, 12288, 1, 16384]
    - [244, 72322.8]
  - - [96, 12288, 1, 256]
    - [87, 29760.3]
  - - [96, 12288, 1, 1024]
    - [203, 50308.0]
  - - [96, 12288, 1, 4096]
    - [142, 69918.0]
  - - [64, 16384, 1, 256]
    - [194, 28503.3]
  - - [64, 16384, 1, 1024]
    - [194, 44868.1]
  - - [64, 16384, 1, 4096]
    - [241, 60380.4]
  - - [96, 16384, 1, 256]
    - [106, 34667.3]
  - - [96, 16384, 1, 1024]
    - [139, 53180.6]
  - - [96, 16384, 1, 4096]
    - [142, 64901.8]
  - - [64, 20480, 1, 256]
    - [74, 33317.2]
  - - [64, 20480, 1, 1024]
    - [190, 52703.2]
  - - [64, 20480, 1, 4096]
    - [190, 62069.4]
  - - [96, 20480, 1, 256]
    - [106, 42397.8]
  - - [96, 20480, 1, 1024]
    - [139, 65951.8]
  - - [96, 20480, 1, 4096]
    - [139, 77371.1]
  - - [64, 24576, 1, 256]
    - [243, 34715.4]
  - - [64, 24576, 1, 1024]
    - [241, 52458.3]
  - - [64, 24576, 1, 4096]
    - [244, 63720.6]
  - - [96, 24576, 1, 256]
    - [242, 40573.1]
  - - [96, 24576, 1, 1024]
    - [242, 64303.6]
  - - [96, 24576, 1, 4096]
    - [242, 75185.0]
  - - [64, 32768, 1, 256]
    - [245, 36919.9]
  - - [64, 32768, 1, 1024]
    - [246, 53435.3]
  - - [64, 32768, 1, 4096]
    - [241, 61638.1]
  - - [96, 32768, 1, 256]
    - [106, 38538.6]
  - - [96, 32768, 1, 1024]
    - [139, 54302.1]
  - - [96, 32768, 1, 4096]
    - [106, 63840.8]
  - - [128, 8192, 1, 256]
    - [105, 30316.6]
  - - [128, 8192, 1, 1024]
    - [105, 47150.9]
  - - [128, 8192, 1, 4096]
    - [167, 76181.9]
  - - [192, 8192, 1, 256]
    - [243, 37335.2]
  - - [192, 8192, 1, 1024]
    - [139, 54638.1]
  - - [192, 8192, 1, 4096]
    - [165, 84162.0]
  - - [128, 12288, 1, 256]
    - [170, 37777.5]
  - - [128, 12288, 1, 1024]
    - [195, 57973.3]
  - - [128, 12288, 1, 4096]
    - [167, 80506.2]
  - - [192, 12288, 1, 256]
    - [171, 43869.3]
  - - [192, 12288, 1, 1024]
    - [171, 69873.5]
  - - [192, 12288, 1, 4096]
    - [165, 88892.2]
  - - [128, 16384, 1, 256]
    - [196, 40782.3]
  - - [128, 16384, 1, 1024]
    - [196, 58686.8]
  - - [128, 16384, 1, 4096]
    - [202, 83567.2]
  - - [192, 16384, 1, 256]
    - [141, 45021.4]
  - - [192, 16384, 1, 1024]
    - [140, 71092.5]
  - - [192, 16384, 1, 4096]
    - [140, 83958.6]
  - - [128, 20480, 1, 256]
    - [105, 46632.0]
  - - [128, 20480, 1, 1024]
    - [167, 66874.1]
  - - [128, 20480, 1, 4096]
    - [167, 76934.7]
  - - [192, 20480, 1, 256]
    - [247, 46790.6]
  - - [192, 20480, 1, 1024]
    - [140, 87480.1]
  - - [192, 20480, 1, 4096]
    - [140, 103821.0]
  - - [128, 24576, 1, 256]
    - [248, 48093.6]
  - - [128, 24576, 1, 1024]
    - [167, 77895.3]
  - - [128, 24576, 1, 4096]
    - [167, 90174.2]
  - - [192, 24576, 1, 256]
    - [249, 50885.8]
  - - [192, 24576, 1, 1024]
    - [197, 79781.4]
  - - [192, 24576, 1, 4096]
    - [198, 98595.2]
  - - [128, 32768, 1, 256]
    - [202, 49858.9]
  - - [128, 32768, 1, 1024]
    - [202, 81077.0]
  - - [128, 32768, 1, 4096]
    - [202, 93376.1]
  - - [192, 32768, 1, 256]
    - [249, 51828.9]
  - - [192, 32768, 1, 1024]
    - [140, 72998.0]
  - - [192, 32768, 1, 4096]
    - [140, 84198.3]
  - - [256, 8192, 1, 256]
    - [196, 40566.3]
  - - [256, 8192, 1, 1024]
    - [196, 59680.8]
  - - [256, 8192, 1, 4096]
    - [169, 85622.8]
  - - [384, 8192, 1, 256]
    - [248, 49583.6]
  - - [384, 8192, 1, 1024]
    - [248, 77456.2]
  - - [384, 8192, 1, 4096]
    - [167, 91768.1]
  - - [256, 12288, 1, 256]
    - [167, 50316.2]
  - - [256, 12288, 1, 1024]
    - [164, 79660.2]
  - - [256, 12288, 1, 4096]
    - [164, 94296.4]
  - - [384, 12288, 1, 256]
    - [197, 54612.1]
  - - [384, 12288, 1, 1024]
    - [165, 82591.7]
  - - [384, 12288, 1, 4096]
    - [165, 98315.7]
  - - [256, 16384, 1, 256]
    - [250, 51983.1]
  - - [256, 16384, 1, 1024]
    - [202, 80275.0]
  - - [256, 16384, 1, 4096]
    - [169, 95025.5]
  - - [384, 16384, 1, 256]
    - [251, 55594.5]
  - - [384, 16384, 1, 1024]
    - [167, 78240.5]
  - - [384, 16384, 1, 4096]
    - [167, 91942.6]
  - - [256, 20480, 1, 256]
    - [119, 52529.8]
  - - [256, 20480, 1, 1024]
    - [119, 70993.9]
  - - [256, 20480, 1, 4096]
    - [164, 79281.7]
  - - [384, 20480, 1, 256]
    - [141, 54446.3]
  - - [384, 20480, 1, 1024]
    - [140, 87743.8]
  - - [384, 20480, 1, 4096]
    - [140, 104270.0]
  - - [256, 24576, 1, 256]
    - [251, 54104.6]
  - - [256, 24576, 1, 1024]
    - [164, 80433.7]
  - - [256, 24576, 1, 4096]
    - [164, 93230.9]
  - - [384, 24576, 1, 256]
    - [119, 59567.9]
  - - [384, 24576, 1, 1024]
    - [119, 79589.2]
  - - [384, 24576, 1, 4096]
    - [198, 99335.7]
  - - [256, 32768, 1, 256]
    - [119, 53563.5]
  - - [256, 32768, 1, 1024]
    - [169, 81381.8]
  - - [256, 32768, 1, 4096]
    - [169, 96123.3]
  - - [384, 32768, 1, 256]
    - [119, 59387.4]
  - - [384, 32768, 1, 1024]
    - [202, 80112.9]
  - - [384, 32768, 1, 4096]
    - [202, 93633.6]
  - - [512, 8192, 1, 256]
    - [213, 47284.1]
  - - [512, 8192, 1, 1024]
    - [214, 76628.7]
  - - [512, 8192, 1, 4096]
    - [214, 93718.2]
  - - [640, 8192, 1, 256]
    - [215, 53299.1]
  - - [640, 8192, 1, 1024]
    - [218, 71091.9]
  - - [640, 8192, 1, 4096]
    - [252, 79368.6]
  - - [768, 8192, 1, 256]
    - [217, 56549.2]
  - - [768, 8192, 1, 1024]
    - [216, 76661.6]
  - - [768, 8192, 1, 4096]
    - [216, 92685.0]
  - - [512, 12288, 1, 256]
    - [215, 52403.6]
  - - [512, 12288, 1, 1024]
    - [216, 76885.4]
  - - [512, 12288, 1, 4096]
    - [216, 92385.3]
  - - [640, 12288, 1, 256]
    - [218, 58718.2]
  - - [640, 12288, 1, 1024]
    - [253, 82435.7]
  - - [640, 12288, 1, 4096]
    - [253, 99351.0]
  - - [768, 12288, 1, 256]
    - [218, 59715.4]
  - - [768, 12288, 1, 1024]
    - [218, 80533.0]
  - - [768, 12288, 1, 4096]
    - [219, 96705.3]
  - - [512, 16384, 1, 256]
    - [215, 54936.9]
  - - [512, 16384, 1, 1024]
    - [214, 77978.5]
  - - [512, 16384, 1, 4096]
    - [214, 94104.1]
  - - [640, 16384, 1, 256]
    - [215, 60889.7]
  - - [640, 16384, 1, 1024]
    - [218, 75985.2]
  - - [640, 16384, 1, 4096]
    - [253, 89102.4]
  - - [768, 16384, 1, 256]
    - [217, 61827.7]
  - - [768, 16384, 1, 1024]
    - [232, 80045.0]
  - - [768, 16384, 1, 4096]
    - [214, 94562.0]
  - - [512, 20480, 1, 256]
    - [215, 60922.9]
  - - [512, 20480, 1, 1024]
    - [218, 75791.6]
  - - [512, 20480, 1, 4096]
    - [254, 90942.7]
  - - [640, 20480, 1, 256]
    - [217, 64285.2]
  - - [640, 20480, 1, 1024]
    - [218, 81665.5]
  - - [640, 20480, 1, 4096]
    - [255, 94973.4]
  - - [768, 20480, 1, 1024]
    - [256, 85408.2]
  - - [512, 24576, 1, 256]
    - [217, 61638.0]
  - - [512, 24576, 1, 1024]
    - [218, 78485.1]
  - - [512, 24576, 1, 4096]
    - [214, 94355.2]
  - - [640, 24576, 1, 1024]
    - [218, 86009.8]
  - - [768, 24576, 1, 1024]
    - [232, 86366.4]
  - - [512, 32768, 1, 1024]
    - [218, 82324.6]
  - - [640, 32768, 1, 1024]
    - [218, 84566.3]
  - - [768, 32768, 1, 1024]
    - [257, 89081.9]
  - - [1024, 8192, 1, 256]
    - [215, 55016.0]
  - - [1024, 8192, 1, 1024]
    - [214, 77389.9]
  - - [1024, 8192, 1, 4096]
    - [214, 94267.7]
  - - [1536, 8192, 1, 256]
    - [217, 61567.3]
  - - [1536, 8192, 1, 1024]
    - [232, 80287.0]
  - - [1536, 8192, 1, 4096]
    - [214, 94539.8]
  - - [1024, 12288, 1, 256]
    - [217, 61605.0]
  - - [1024, 12288, 1, 1024]
    - [218, 78802.6]
  - - [1024, 12288, 1, 4096]
    - [214, 94437.0]
  - - [1536, 12288, 1, 1024]
    - [232, 87574.5]
  - - [1024, 16384, 1, 1024]
    - [218, 82760.3]
  - - [1536, 16384, 1, 1024]
    - [232, 90957.7]
  - - [1024, 20480, 1, 1024]
    - [218, 85106.5]
  - - [1536, 20480, 1, 1024]
    - [232, 92924.4]
  - - [1024, 24576, 1, 1024]
    - [218, 86716.7]
  - - [1536, 24576, 1, 1024]
    - [232, 94498.8]
  - - [1024, 32768, 1, 1024]
    - [218, 84522.5]
  - - [1536, 32768, 1, 1024]
    - [232, 91943.3]
  - - [2048, 8192, 1, 1024]
    - [232, 85916.3]
  - - [3072, 8192, 1, 1024]
    - [232, 90161.6]
  - - [2048, 12288, 1, 1024]
    - [232, 88412.9]
  - - [3072, 12288, 1, 1024]
    - [232, 94839.9]
  - - [2048, 16384, 1, 1024]
    - [232, 88420.4]
  - - [3072, 16384, 1, 1024]
    - [232, 91905.2]
  - - [2048, 20480, 1, 1024]
    - [232, 89470.1]
  - - [3072, 20480, 1, 1024]
    - [232, 93658.8]
  - - [2048, 24576, 1, 1024]
    - [232, 89802.5]
  - - [3072, 24576, 1, 1024]
    - [232, 95080.7]
  - - [2048, 32768, 1, 1024]
    - [232, 89451.8]
  - - [3072, 32768, 1, 1024]
    - [232, 93531.7]
  - - [4096, 8192, 1, 1024]
    - [232, 90393.0]
  - - [6144, 8192, 1, 1024]
    - [232, 91855.9]
  - - [4096, 12288, 1, 1024]
    - [232, 91168.6]
  - - [6144, 12288, 1, 1024]
    - [232, 96181.0]
  - - [4096, 16384, 1, 1024]
    - [232, 91910.1]
  - - [6144, 16384, 1, 1024]
    - [232, 95395.3]
  - - [4096, 20480, 1, 1024]
    - [232, 91665.3]
  - - [6144, 20480, 1, 1024]
    - [232, 95986.1]
  - - [4096, 24576, 1, 1024]
    - [232, 92091.2]
  - - [6144, 24576, 1, 1024]
    - [232, 96151.0]
  - - [4096, 32768, 1, 1024]
    - [232, 91771.1]
  - - [6144, 32768, 1, 1024]
    - [232, 94922.5]
  - - [8192, 8192, 1, 1024]
    - [232, 91853.4]
  - - [12288, 8192, 1, 1024]
    - [232, 93993.3]
  - - [16384, 8192, 1, 1024]
    - [232, 93368.2]
  - - [20480, 8192, 1, 1024]
    - [232, 93402.6]
  - - [24576, 8192, 1, 1024]
    - [232, 94300.2]
  - - [32768, 8192, 1, 1024]
    - [257, 93301.5]
  - - [8192, 12288, 1, 1024]
    - [232, 94300.2]
  - - [12288, 12288, 1, 1024]
    - [232, 95716.7]
  - - [16384, 12288, 1, 1024]
    - [232, 95385.6]
  - - [20480, 12288, 1, 1024]
    - [232, 95295.2]
  - - [8192, 16384, 1, 1024]
    - [232, 93495.5]
  - - [12288, 16384, 1, 1024]
    - [232, 95484.7]
  - - [16384, 16384, 1, 1024]
    - [232, 93810.9]
  - - [8192, 20480, 1, 1024]
    - [232, 94439.0]
  - - [12288, 20480, 1, 1024]
    - [232, 95513.3]
  - - [8192, 24576, 1, 1024]
    - [232, 95031.2]
  - - [8192, 32768, 1, 1024]
    - [257, 93311.0]
- null
- null
- DeviceEfficiency
- GridBased
