projects/hipblaslt/library/src/amd_detail/rocblaslt/src/Tensile/Logic/asm_full/aquavanjaram/gfx942_80cu/GridBased/aquavanjaram_Cijk_Alik_Bljk_S_MX_B_Bias_HA_SAV_UserArgs.yaml
- {MinimumRequiredVersion: 5.0.0}
- aquavanjaram
- {Architecture: gfx942, CUCount: 80}
- [Device 0049, Device 0050]
    SolutionIndex: 0
    SolutionNameMin: Cijk_Alik_Bljk_S_MX_B_Bias_HA_SAV_UserArgs_MT16x16x256_MI16x16x1_SN_LDSB1_GRVWA4_GRVWB4_GSU1_LBSPPA1024_LBSPPB1024_MIWT1_1_NLCA1_NLCB1_SU0_SUM0_SUS0_SVW1_VWA1_WG16_4_4_WGM1
    SolutionIndex: 1
    SolutionNameMin: Cijk_Alik_Bljk_S_MX_B_Bias_HA_SAV_UserArgs_MT16x16x256_MI16x16x1_SN_LDSB1_GRVWA4_GRVWB4_GSU16_LBSPPA1024_LBSPPB1024_MIWT1_1_NLCA1_NLCB1_SU0_SUM0_SUS0_SVW1_VWA1_WG16_4_4_WGM1
    SolutionIndex: 2
    SolutionNameMin: Cijk_Alik_Bljk_S_MX_B_Bias_HA_SAV_UserArgs_MT16x16x128_MI16x16x1_SN_LDSB0_GRVWA4_GRVWB4_GSU29_LBSPPA512_LBSPPB512_MIWT1_1_NLCA1_NLCB1_SU0_SUM0_SUS0_SVW1_VWA1_WG16_4_2_WGM1
    SolutionIndex: 3
    SolutionNameMin: Cijk_Alik_Bljk_S_MX_B_Bias_HA_SAV_UserArgs_MT16x16x256_MI16x16x1_SN_LDSB1_GRVWA4_GRVWB4_GSU22_LBSPPA1024_LBSPPB1024_MIWT1_1_NLCA1_NLCB1_SU0_SUM0_SUS0_SVW1_VWA1_WG16_4_2_WGM1
    SolutionIndex: 4
    SolutionNameMin: Cijk_Alik_Bljk_S_MX_B_Bias_HA_SAV_UserArgs_MT32x16x128_MI16x16x1_SN_LDSB0_GRVWA4_GRVWB4_GSU16_LBSPPA512_LBSPPB512_MIWT1_1_NLCA1_NLCB1_SU0_SUM0_SUS0_SVW1_VWA1_WG32_4_2_WGM1
    SolutionIndex: 5
    SolutionNameMin: Cijk_Alik_Bljk_S_MX_B_Bias_HA_SAV_UserArgs_MT32x16x128_MI16x16x1_SN_LDSB0_GRVWA4_GRVWB4_GSU26_LBSPPA512_LBSPPB512_MIWT1_1_NLCA1_NLCB1_SU0_SUM0_SUS0_SVW1_VWA1_WG32_4_2_WGM1
    SolutionIndex: 6
    SolutionNameMin: Cijk_Alik_Bljk_S_MX_B_Bias_HA_SAV_UserArgs_MT32x16x256_MI16x16x1_SN_LDSB1_GRVWA4_GRVWB4_GSU22_LBSPPA1024_LBSPPB1024_MIWT1_1_NLCA1_NLCB1_SU0_SUM0_SUS0_SVW1_VWA1_WG32_4_2_WGM1
    SolutionIndex: 7
    SolutionNameMin: Cijk_Alik_Bljk_S_MX_B_Bias_HA_SAV_UserArgs_MT32x16x64_MI16x16x1_SN_LDSB0_GRVWA4_GRVWB4_GSU16_LBSPPA256_LBSPPB256_MIWT1_1_NLCA1_NLCB1_SU0_SUM0_SUS0_SVW1_VWA1_WG32_4_1_WGM1
    SolutionIndex: 8
    SolutionNameMin: Cijk_Alik_Bljk_S_MX_B_Bias_HA_SAV_UserArgs_MT32x16x128_MI16x16x1_SN_LDSB0_GRVWA4_GRVWB4_GSU16_LBSPPA512_LBSPPB512_MIWT1_1_NLCA1_NLCB1_SU0_SUM0_SUS0_SVW1_VWA1_WG32_4_1_WGM1
    SolutionIndex: 9
    SolutionNameMin: Cijk_Alik_Bljk_S_MX_B_Bias_HA_SAV_UserArgs_MT32x16x256_MI16x16x1_SN_LDSB1_GRVWA4_GRVWB4_GSU16_LBSPPA1024_LBSPPB1024_MIWT1_1_NLCA1_NLCB1_SU0_SUM0_SUS0_SVW1_VWA1_WG32_4_1_WGM1
    SolutionIndex: 10
    SolutionNameMin: Cijk_Alik_Bljk_S_MX_B_Bias_HA_SAV_UserArgs_MT16x16x128_MI16x16x1_SN_LDSB1_GRVWA4_GRVWB4_GSU4_LBSPPA512_LBSPPB512_MIWT1_1_NLCA1_NLCB1_SU0_SUM0_SUS0_SVW1_VWA1_WG16_4_4_WGM1
    SolutionIndex: 11
    SolutionNameMin: Cijk_Alik_Bljk_S_MX_B_Bias_HA_SAV_UserArgs_MT32x16x64_MI16x16x1_SN_LDSB0_GRVWA4_GRVWB4_GSU18_LBSPPA256_LBSPPB256_MIWT1_1_NLCA1_NLCB1_SU0_SUM0_SUS0_SVW1_VWA1_WG32_4_1_WGM1
    SolutionIndex: 12
    SolutionNameMin: Cijk_Alik_Bljk_S_MX_B_Bias_HA_SAV_UserArgs_MT32x16x256_MI16x16x1_SN_LDSB1_GRVWA4_GRVWB4_GSU13_LBSPPA1024_LBSPPB1024_MIWT1_1_NLCA1_NLCB1_SU0_SUM0_SUS0_SVW1_VWA1_WG32_4_2_WGM1
    SolutionIndex: 13
    SolutionNameMin: Cijk_Alik_Bljk_S_MX_B_Bias_HA_SAV_UserArgs_MT64x16x64_MI16x16x1_SN_LDSB0_GRVWA4_GRVWB4_GSU17_LBSPPA256_LBSPPB256_MIWT1_1_NLCA1_NLCB1_SU0_SUM0_SUS0_SVW1_VWA1_WG64_4_1_WGM1
    SolutionIndex: 14
    SolutionNameMin: Cijk_Alik_Bljk_S_MX_B_Bias_HA_SAV_UserArgs_MT64x16x128_MI16x16x1_SN_LDSB1_GRVWA4_GRVWB4_GSU20_LBSPPA512_LBSPPB512_MIWT1_1_NLCA1_NLCB1_SU0_SUM0_SUS0_SVW1_VWA1_WG64_4_1_WGM1
    SolutionIndex: 15
    SolutionNameMin: Cijk_Alik_Bljk_S_MX_B_Bias_HA_SAV_UserArgs_MT64x16x128_MI16x16x1_SN_LDSB1_GRVWA4_GRVWB4_GSU12_LBSPPA512_LBSPPB512_MIWT1_1_NLCA1_NLCB1_SU0_SUM0_SUS0_SVW1_VWA1_WG64_4_1_WGM1
    SolutionIndex: 16
    SolutionNameMin: Cijk_Alik_Bljk_S_MX_B_Bias_HA_SAV_UserArgs_MT64x16x128_MI16x16x1_SN_LDSB1_GRVWA4_GRVWB4_GSU13_LBSPPA512_LBSPPB512_MIWT1_1_NLCA1_NLCB1_SU0_SUM0_SUS0_SVW1_VWA1_WG64_4_1_WGM1
    SolutionIndex: 17
    SolutionNameMin: Cijk_Alik_Bljk_S_MX_B_Bias_HA_SAV_UserArgs_MT16x16x256_MI16x16x1_SN_GRVWA4_GRVWB4_GSU1_LBSPPA1024_LBSPPB1024_LPA8_LPB8_LRVW4_MIWT1_1_NLCA1_NLCB1_SU0_SUM0_SUS0_SVW1_VWA1_WG16_4_4_WGM1
    SolutionIndex: 18
    SolutionNameMin: Cijk_Alik_Bljk_S_MX_B_Bias_HA_SAV_UserArgs_MT32x16x256_MI16x16x1_SN_GRVWA4_GRVWB4_GSU4_LBSPPA1024_LBSPPB1024_LPA8_LPB8_LRVW4_MIWT1_1_NLCA1_NLCB1_SU0_SUM0_SUS0_SVW1_VWA1_WG32_4_2_WGM1
    SolutionIndex: 19
    SolutionNameMin: Cijk_Alik_Bljk_S_MX_B_Bias_HA_SAV_UserArgs_MT64x16x128_MI16x16x1_SN_GRVWA4_GRVWB4_GSU10_LBSPPA512_LBSPPB512_LPA8_LPB8_LRVW4_MIWT1_1_NLCA1_NLCB1_SU0_SUM0_SUS0_SVW1_VWA1_WG64_4_1_WGM1
    SolutionIndex: 20
    SolutionNameMin: Cijk_Alik_Bljk_S_MX_B_Bias_HA_SAV_UserArgs_MT64x16x128_MI16x16x1_SN_GRVWA4_GRVWB4_GSU8_LBSPPA512_LBSPPB512_LPA8_LPB8_LRVW4_MIWT1_1_NLCA1_NLCB1_SU0_SUM0_SUS0_SVW1_VWA1_WG64_4_1_WGM1
    SolutionIndex: 21
    SolutionNameMin: Cijk_Alik_Bljk_S_MX_B_Bias_HA_SAV_UserArgs_MT32x16x128_MI16x16x1_SN_GRVWA4_GRVWB4_GSU6_LBSPPA512_LBSPPB512_LPA8_LPB8_LRVW4_MIWT1_1_NLCA1_NLCB1_SU0_SUM0_SUS0_SVW1_VWA1_WG32_4_1_WGM1
    SolutionIndex: 22
    SolutionNameMin: Cijk_Alik_Bljk_S_MX_B_Bias_HA_SAV_UserArgs_MT16x16x256_MI16x16x1_SN_GRVWA4_GRVWB4_GSU1_LBSPPA1024_LBSPPB1024_LPA8_LPB8_LRVW4_MIWT1_1_NLCA1_NLCB1_SU0_SUM0_SUS0_SVW1_VWA1_WG16_4_2_WGM1
    SolutionIndex: 23
    SolutionNameMin: Cijk_Alik_Bljk_S_MX_B_Bias_HA_SAV_UserArgs_MT32x16x128_MI16x16x1_SN_GRVWA4_GRVWB4_GSU4_LBSPPA512_LBSPPB512_LPA8_LPB8_LRVW4_MIWT1_1_NLCA1_NLCB1_SU0_SUM0_SUS0_SVW1_VWA1_WG32_4_1_WGM1
    SolutionIndex: 24
    SolutionNameMin: Cijk_Alik_Bljk_S_MX_B_Bias_HA_SAV_UserArgs_MT64x16x128_MI16x16x1_SN_GRVWA4_GRVWB4_GSU5_LBSPPA512_LBSPPB512_LPA8_LPB8_LRVW4_MIWT1_1_NLCA1_NLCB1_SU0_SUM0_SUS0_SVW1_VWA1_WG64_4_1_WGM1
    SolutionIndex: 25
    SolutionNameMin: Cijk_Alik_Bljk_S_MX_B_Bias_HA_SAV_UserArgs_MT32x16x256_MI16x16x1_SN_GRVWA4_GRVWB4_GSU1_LBSPPA2048_LBSPPB1024_LPA8_LPB8_LRVW4_MIWT2_1_NLCA1_NLCB1_SU0_SUM0_SUS0_SVW2_VWA2_WG16_4_4_WGM1
    SolutionIndex: 26
    SolutionNameMin: Cijk_Alik_Bljk_S_MX_B_Bias_HA_SAV_UserArgs_MT32x16x128_MI16x16x1_SN_GRVWA4_GRVWB4_GSU3_LBSPPA512_LBSPPB512_LPA8_LPB8_LRVW4_MIWT1_1_NLCA1_NLCB1_SU0_SUM0_SUS0_SVW1_VWA1_WG32_4_1_WGM1
    SolutionIndex: 27
    SolutionNameMin: Cijk_Alik_Bljk_S_MX_B_Bias_HA_SAV_UserArgs_MT64x16x128_MI16x16x1_SN_GRVWA4_GRVWB4_GSU3_LBSPPA1024_LBSPPB512_LPA8_LPB8_LRVW4_MIWT2_1_NLCA1_NLCB1_SU0_SUM0_SUS0_SVW2_VWA2_WG32_4_2_WGM1
    SolutionIndex: 28
    SolutionNameMin: Cijk_Alik_Bljk_S_MX_B_Bias_HA_SAV_UserArgs_MT32x16x256_MI16x16x1_SN_GRVWA4_GRVWB4_GSU1_LBSPPA1024_LBSPPB1024_LPA8_LPB8_LRVW4_MIWT1_1_NLCA1_NLCB1_SU0_SUM0_SUS0_SVW1_VWA1_WG32_4_2_WGM1
    SolutionIndex: 29
    SolutionNameMin: Cijk_Alik_Bljk_S_MX_B_Bias_HA_SAV_UserArgs_MT64x16x128_MI16x16x1_SN_GRVWA4_GRVWB4_GSU1_LBSPPA2048_LBSPPB512_LPA8_LPB8_LRVW4_MIWT4_1_NLCA1_NLCB1_SU0_SUM0_SUS0_SVW4_VWA4_WG16_4_4_WGM1
    SolutionIndex: 30
    SolutionNameMin: Cijk_Alik_Bljk_S_MX_B_Bias_HA_SAV_UserArgs_MT192x16x64_MI16x16x1_SN_GRVWA4_GRVWB4_GSU5_LBSPPA256_LBSPPB256_LPA8_LPB8_LRVW4_MIWT3_1_NLCA1_NLCB1_SU0_SUM0_SUS0_SVW1_VWA1_WG64_4_1_WGM1
    SolutionIndex: 31
    SolutionNameMin: Cijk_Alik_Bljk_S_MX_B_Bias_HA_SAV_UserArgs_MT64x16x128_MI16x16x1_SN_GRVWA4_GRVWB4_GSU1_LBSPPA512_LBSPPB512_LPA8_LPB8_LRVW4_MIWT1_1_NTA0_SU0_SUM0_SUS0_SVW1_VWA1_WG64_4_1_WGM1
    SolutionIndex: 32
    SolutionNameMin: Cijk_Alik_Bljk_S_MX_B_Bias_HA_SAV_UserArgs_MT32x16x128_MI16x16x1_SN_GRVWA4_GRVWB4_GSU1_LBSPPA512_LBSPPB512_LPA8_LPB8_LRVW4_MIWT1_1_NTA0_SU0_SUM0_SUS0_SVW1_VWA1_WG32_4_1_WGM1
    SolutionIndex: 33
    SolutionNameMin: Cijk_Alik_Bljk_S_MX_B_Bias_HA_SAV_UserArgs_MT128x16x64_MI16x16x1_SN_GRVWA4_GRVWB4_GSU1_LBSPPA1024_LBSPPB256_LPA8_LPB8_LRVW4_MIWT4_1_NTA0_SU0_SUM0_SUS0_SVW4_VWA4_WG32_4_2_WGM1
    SolutionIndex: 34
    SolutionNameMin: Cijk_Alik_Bljk_S_MX_B_Bias_HA_SAV_UserArgs_MT192x16x64_MI16x16x1_SN_GRVWA4_GRVWB4_GSU5_LBSPPA256_LBSPPB256_LPA8_LPB8_LRVW4_MIWT3_1_NTA4_SU0_SUM0_SUS0_SVW1_VWA1_WG64_4_1_WGM1
    SolutionIndex: 35
    SolutionNameMin: Cijk_Alik_Bljk_S_MX_B_Bias_HA_SAV_UserArgs_MT64x16x64_MI16x16x1_SN_CLR1_GRVWA4_GRVWB4_GSU1_LBSPPA256_LBSPPB256_LPA8_LPB8_LRVW4_MIWT1_1_NTA4_PLR1_SU0_SUM0_SUS0_SVW1_VWA1_WG64_4_1_WGM1
    SolutionIndex: 36
    SolutionNameMin: Cijk_Alik_Bljk_S_MX_B_Bias_HA_SAV_UserArgs_MT64x16x128_MI16x16x1_SN_CLR1_GRVWA4_GRVWB4_GSU1_LBSPPA512_LBSPPB512_LPA8_LPB8_LRVW4_MIWT1_1_NTA0_PLR1_SU0_SUM0_SUS0_SVW1_VWA1_WG64_4_1_WGM1
    SolutionIndex: 37
    SolutionNameMin: Cijk_Alik_Bljk_S_MX_B_Bias_HA_SAV_UserArgs_MT64x16x128_MI16x16x1_SN_CLR1_GRVWA4_GRVWB4_GSU3_LBSPPA512_LBSPPB512_LPA8_LPB8_LRVW4_MIWT1_1_NTA0_PLR1_SU0_SUM0_SUS0_SVW1_VWA1_WG64_4_1_WGM1
    SolutionIndex: 38
    SolutionNameMin: Cijk_Alik_Bljk_S_MX_B_Bias_HA_SAV_UserArgs_MT192x16x64_MI16x16x1_SN_CLR1_GRVWA4_GRVWB4_GSU1_LBSPPA256_LBSPPB256_LPA8_LPB8_LRVW4_MIWT3_1_NTA4_PLR1_SU0_SUM0_SUS0_SVW1_VWA1_WG64_4_1_WGM1
    SolutionIndex: 39
    SolutionNameMin: Cijk_Alik_Bljk_S_MX_B_Bias_HA_SAV_UserArgs_MT64x16x128_MI16x16x1_SN_CLR1_GRVWA4_GRVWB4_GSU2_LBSPPA512_LBSPPB512_LPA8_LPB8_LRVW4_MIWT1_1_NTA4_PLR1_SU0_SUM0_SUS0_SVW1_VWA1_WG64_4_1_WGM1
    SolutionIndex: 40
    SolutionNameMin: Cijk_Alik_Bljk_S_MX_B_Bias_HA_SAV_UserArgs_MT64x16x64_MI16x16x1_SN_CLR1_GRVWA1_GRVWB4_GSU1_LBSPPA256_LBSPPB256_LPA8_LPB8_LRVW4_MIWT1_1_NTA4_PLR1_SU0_SUM0_SUS0_SVW1_VWA1_WG64_4_1_WGM1
    SolutionIndex: 41
    SolutionNameMin: Cijk_Alik_Bljk_S_MX_B_Bias_HA_SAV_UserArgs_MT64x16x128_MI16x16x1_SN_CLR1_GRVWA4_GRVWB4_GSU1_LBSPPA512_LBSPPB512_LPA8_LPB8_LRVW4_MIWT1_1_NTA4_PLR1_SU0_SUM0_SUS0_SVW1_VWA1_WG64_4_1_WGM1
    SolutionIndex: 42
    SolutionNameMin: Cijk_Alik_Bljk_S_MX_B_Bias_HA_SAV_UserArgs_MT64x16x64_MI16x16x1_SN_CLR1_GRVWA1_GRVWB4_GSU1_LBSPPA256_LBSPPB256_LPA8_LPB8_LRVW4_MIWT1_1_NTA0_PLR1_SU0_SUM0_SUS0_SVW1_VWA1_WG64_4_1_WGM1
    SolutionIndex: 43
    SolutionNameMin: Cijk_Alik_Bljk_S_MX_B_Bias_HA_SAV_UserArgs_MT16x16x256_MI16x16x1_SN_LDSB1_GRVWA4_GRVWB4_GSU1_LBSPPA1024_LBSPPB1024_LPA8_LPB8_MIWT1_1_NLCA1_NLCB1_SU0_SUM0_SUS0_SVW1_VWA1_WG16_4_4_WGM1
    SolutionIndex: 44
    SolutionNameMin: Cijk_Alik_Bljk_S_MX_B_Bias_HA_SAV_UserArgs_MT16x16x256_MI16x16x1_SN_LDSB1_GRVWA4_GRVWB4_GSU16_LBSPPA1024_LBSPPB1024_LPA8_LPB8_MIWT1_1_NLCA1_NLCB1_SU0_SUM0_SUS0_SVW1_VWA1_WG16_4_2_WGM1
    SolutionIndex: 45
    SolutionNameMin: Cijk_Alik_Bljk_S_MX_B_Bias_HA_SAV_UserArgs_MT16x32x128_MI16x16x1_SN_LDSB0_GRVWA4_GRVWB4_GSU28_LBSPPA512_LBSPPB512_LPA8_LPB8_MIWT1_1_NLCA1_NLCB1_SU0_SUM0_SUS0_SVW1_VWA1_WG16_8_2_WGM1
    SolutionIndex: 46
    SolutionNameMin: Cijk_Alik_Bljk_S_MX_B_Bias_HA_SAV_UserArgs_MT16x16x128_MI16x16x1_SN_LDSB1_GRVWA4_GRVWB4_GSU16_LBSPPA512_LBSPPB512_LPA8_LPB8_MIWT1_1_NLCA1_NLCB1_SU0_SUM0_SUS0_SVW1_VWA1_WG16_4_2_WGM1
    SolutionIndex: 47
    SolutionNameMin: Cijk_Alik_Bljk_S_MX_B_Bias_HA_SAV_UserArgs_MT16x32x128_MI16x16x1_SN_LDSB0_GRVWA4_GRVWB4_GSU26_LBSPPA512_LBSPPB512_LPA8_LPB8_MIWT1_1_NLCA1_NLCB1_SU0_SUM0_SUS0_SVW1_VWA1_WG16_8_2_WGM1
    SolutionIndex: 48
    SolutionNameMin: Cijk_Alik_Bljk_S_MX_B_Bias_HA_SAV_UserArgs_MT32x16x64_MI16x16x1_SN_LDSB0_GRVWA4_GRVWB4_GSU16_LBSPPA256_LBSPPB256_LPA8_LPB8_MIWT1_1_NLCA1_NLCB1_SU0_SUM0_SUS0_SVW1_VWA1_WG32_4_1_WGM1
    SolutionIndex: 49
    SolutionNameMin: Cijk_Alik_Bljk_S_MX_B_Bias_HA_SAV_UserArgs_MT32x16x128_MI16x16x1_SN_LDSB0_GRVWA4_GRVWB4_GSU16_LBSPPA512_LBSPPB512_LPA8_LPB8_MIWT1_1_NLCA1_NLCB1_SU0_SUM0_SUS0_SVW1_VWA1_WG32_4_1_WGM1
    SolutionIndex: 50
    SolutionNameMin: Cijk_Alik_Bljk_S_MX_B_Bias_HA_SAV_UserArgs_MT32x32x128_MI16x16x1_SN_LDSB1_GRVWA4_GRVWB4_GSU26_LBSPPA512_LBSPPB512_LPA8_LPB8_MIWT1_1_NLCA1_NLCB1_SU0_SUM0_SUS0_SVW1_VWA1_WG32_8_1_WGM1
    SolutionIndex: 51
    SolutionNameMin: Cijk_Alik_Bljk_S_MX_B_Bias_HA_SAV_UserArgs_MT16x16x256_MI16x16x1_SN_LDSB1_GRVWA4_GRVWB4_GSU4_LBSPPA1024_LBSPPB1024_LPA8_LPB8_MIWT1_1_NLCA1_NLCB1_SU0_SUM0_SUS0_SVW1_VWA1_WG16_4_4_WGM1
    SolutionIndex: 52
    SolutionNameMin: Cijk_Alik_Bljk_S_MX_B_Bias_HA_SAV_UserArgs_MT32x32x64_MI16x16x1_SN_LDSB0_GRVWA4_GRVWB4_GSU22_LBSPPA256_LBSPPB256_LPA8_LPB8_MIWT1_1_NLCA1_NLCB1_SU0_SUM0_SUS0_SVW1_VWA1_WG32_8_1_WGM1
    SolutionIndex: 53
    SolutionNameMin: Cijk_Alik_Bljk_S_MX_B_Bias_HA_SAV_UserArgs_MT32x32x128_MI16x16x1_SN_LDSB1_GRVWA4_GRVWB4_GSU22_LBSPPA512_LBSPPB512_LPA8_LPB8_MIWT1_1_NLCA1_NLCB1_SU0_SUM0_SUS0_SVW1_VWA1_WG32_8_1_WGM1
    SolutionIndex: 54
    SolutionNameMin: Cijk_Alik_Bljk_S_MX_B_Bias_HA_SAV_UserArgs_MT64x16x64_MI16x16x1_SN_LDSB0_GRVWA4_GRVWB4_GSU16_LBSPPA256_LBSPPB256_LPA8_LPB8_MIWT1_1_NLCA1_NLCB1_SU0_SUM0_SUS0_SVW1_VWA1_WG64_4_1_WGM1
    SolutionIndex: 55
    SolutionNameMin: Cijk_Alik_Bljk_S_MX_B_Bias_HA_SAV_UserArgs_MT32x32x128_MI16x16x1_SN_LDSB1_GRVWA4_GRVWB4_GSU17_LBSPPA512_LBSPPB512_LPA8_LPB8_MIWT1_1_NLCA1_NLCB1_SU0_SUM0_SUS0_SVW1_VWA1_WG32_8_1_WGM1
    SolutionIndex: 56
    SolutionNameMin: Cijk_Alik_Bljk_S_MX_B_Bias_HA_SAV_UserArgs_MT32x32x64_MI16x16x1_SN_LDSB0_GRVWA4_GRVWB4_GSU13_LBSPPA256_LBSPPB256_LPA8_LPB8_MIWT1_1_NLCA1_NLCB1_SU0_SUM0_SUS0_SVW1_VWA1_WG32_8_1_WGM1
    SolutionIndex: 57
    SolutionNameMin: Cijk_Alik_Bljk_S_MX_B_Bias_HA_SAV_UserArgs_MT32x32x128_MI16x16x1_SN_LDSB1_GRVWA4_GRVWB4_GSU13_LBSPPA512_LBSPPB512_LPA8_LPB8_MIWT1_1_NLCA1_NLCB1_SU0_SUM0_SUS0_SVW1_VWA1_WG32_8_1_WGM1
    SolutionIndex: 58
    SolutionNameMin: Cijk_Alik_Bljk_S_MX_B_Bias_HA_SAV_UserArgs_MT32x32x64_MI16x16x1_SN_LDSB0_GRVWA4_GRVWB4_GSU8_LBSPPA256_LBSPPB256_LPA8_LPB8_MIWT1_1_NLCA1_NLCB1_SU0_SUM0_SUS0_SVW1_VWA1_WG32_8_1_WGM1
    SolutionIndex: 59
    SolutionNameMin: Cijk_Alik_Bljk_S_MX_B_Bias_HA_SAV_UserArgs_MT64x32x128_MI16x16x1_SN_LDSB1_GRVWA4_GRVWB4_GSU16_LBSPPA512_LBSPPB512_LPA8_LPB8_MIWT1_2_NLCA1_NLCB1_SU0_SUM0_SUS0_SVW1_VWA1_WG64_4_1_WGM1
    SolutionIndex: 60
    SolutionNameMin: Cijk_Alik_Bljk_S_MX_B_Bias_HA_SAV_UserArgs_MT32x32x128_MI16x16x1_SN_LDSB1_GRVWA4_GRVWB4_GSU6_LBSPPA512_LBSPPB512_LPA8_LPB8_MIWT1_1_NLCA1_NLCB1_SU0_SUM0_SUS0_SVW1_VWA1_WG32_8_1_WGM1
    SolutionIndex: 61
    SolutionNameMin: Cijk_Alik_Bljk_S_MX_B_Bias_HA_SAV_UserArgs_MT96x32x64_MI16x16x1_SN_LDSB1_GRVWA4_GRVWB4_GSU20_LBSPPA256_LBSPPB256_LPA8_LPB8_MIWT3_1_NLCA1_NLCB1_SU0_SUM0_SUS0_SVW1_VWA1_WG32_8_1_WGM1
    SolutionIndex: 62
    SolutionNameMin: Cijk_Alik_Bljk_S_MX_B_Bias_HA_SAV_UserArgs_MT64x32x128_MI16x16x1_SN_GRVWA4_GRVWB4_GSU8_LBSPPA1024_LBSPPB512_LPA8_LPB8_LRVW4_MIWT2_1_NLCA1_NLCB1_SU0_SUM0_SUS0_SVW2_VWA2_WG32_8_1_WGM1
    SolutionIndex: 63
    SolutionNameMin: Cijk_Alik_Bljk_S_MX_B_Bias_HA_SAV_UserArgs_MT64x32x128_MI16x16x1_SN_GRVWA4_GRVWB4_GSU10_LBSPPA512_LBSPPB512_LPA8_LPB8_LRVW4_MIWT1_2_NLCA1_NLCB1_SU0_SUM0_SUS0_SVW1_VWA1_WG64_4_1_WGM1
    SolutionIndex: 64
    SolutionNameMin: Cijk_Alik_Bljk_S_MX_B_Bias_HA_SAV_UserArgs_MT64x32x128_MI16x16x1_SN_GRVWA4_GRVWB4_GSU8_LBSPPA512_LBSPPB512_LPA8_LPB8_LRVW4_MIWT1_2_NLCA1_NLCB1_SU0_SUM0_SUS0_SVW1_VWA1_WG64_4_1_WGM1
    SolutionIndex: 65
    SolutionNameMin: Cijk_Alik_Bljk_S_MX_B_Bias_HA_SAV_UserArgs_MT16x32x256_MI16x16x1_SN_GRVWA4_GRVWB4_GSU1_LBSPPA1024_LBSPPB1024_LPA8_LPB8_LRVW4_MIWT1_2_NLCA1_NLCB1_SU0_SUM0_SUS0_SVW1_VWA1_WG16_4_4_WGM1
    SolutionIndex: 66
    SolutionNameMin: Cijk_Alik_Bljk_S_MX_B_Bias_HA_SAV_UserArgs_MT128x32x64_MI32x32x1_SN_GRVWA4_GRVWB4_GSU13_LBSPPA256_LBSPPB256_LPA4_LPB4_LRVW4_MIWT1_1_NLCA1_NLCB1_SU0_SUM0_SUS0_SVW1_VWA1_WG128_2_1_WGM1
    SolutionIndex: 67
    SolutionNameMin: Cijk_Alik_Bljk_S_MX_B_Bias_HA_SAV_UserArgs_MT16x32x256_MI16x16x1_SN_GRVWA4_GRVWB4_GSU1_LBSPPA1024_LBSPPB1024_LPA8_LPB8_LRVW4_MIWT1_1_NLCA1_NLCB1_SU0_SUM0_SUS0_SVW1_VWA1_WG16_8_2_WGM1
    SolutionIndex: 68
    SolutionNameMin: Cijk_Alik_Bljk_S_MX_B_Bias_HA_SAV_UserArgs_MT128x32x64_MI32x32x1_SN_GRVWA4_GRVWB4_GSU10_LBSPPA256_LBSPPB256_LPA4_LPB4_LRVW4_MIWT1_1_NLCA1_NLCB1_SU0_SUM0_SUS0_SVW1_VWA1_WG128_2_1_WGM1
    SolutionIndex: 69
    SolutionNameMin: Cijk_Alik_Bljk_S_MX_B_Bias_HA_SAV_UserArgs_MT64x32x128_MI16x16x1_SN_GRVWA4_GRVWB4_GSU5_LBSPPA512_LBSPPB512_LPA8_LPB8_LRVW4_MIWT1_2_NLCA1_NLCB1_SU0_SUM0_SUS0_SVW1_VWA1_WG64_4_1_WGM1
    SolutionIndex: 70
    SolutionNameMin: Cijk_Alik_Bljk_S_MX_B_Bias_HA_SAV_UserArgs_MT32x32x128_MI32x32x1_SN_GRVWA4_GRVWB4_GSU1_LBSPPA512_LBSPPB512_LPA4_LPB4_LRVW4_MIWT1_1_NLCA1_NLCB1_SU0_SUM0_SUS0_SVW1_VWA1_WG32_2_4_WGM1
    SolutionIndex: 71
    SolutionNameMin: Cijk_Alik_Bljk_S_MX_B_Bias_HA_SAV_UserArgs_MT64x32x128_MI32x32x1_SN_GRVWA4_GRVWB4_GSU3_LBSPPA512_LBSPPB512_LPA4_LPB4_LRVW4_MIWT1_1_NLCA1_NLCB1_SU0_SUM0_SUS0_SVW1_VWA1_WG64_2_2_WGM1
    SolutionIndex: 72
    SolutionNameMin: Cijk_Alik_Bljk_S_MX_B_Bias_HA_SAV_UserArgs_MT64x16x128_MI16x16x1_SN_GRVWA4_GRVWB4_GSU1_LBSPPA1024_LBSPPB512_LPA8_LPB8_LRVW4_MIWT2_1_SU0_SUM0_SUS0_SVW2_VWA2_WG32_4_2_WGM1
    SolutionIndex: 73
    SolutionNameMin: Cijk_Alik_Bljk_S_MX_B_Bias_HA_SAV_UserArgs_MT128x32x64_MI32x32x1_SN_GRVWA4_GRVWB4_GSU5_LBSPPA256_LBSPPB256_LPA4_LPB4_LRVW4_MIWT1_1_SU0_SUM0_SUS0_SVW1_VWA1_WG128_2_1_WGM1
    SolutionIndex: 74
    SolutionNameMin: Cijk_Alik_Bljk_S_MX_B_Bias_HA_SAV_UserArgs_MT64x32x128_MI16x16x1_SN_GRVWA4_GRVWB4_GSU1_LBSPPA2048_LBSPPB512_LPA8_LPB8_LRVW4_MIWT4_2_SU0_SUM0_SUS0_SVW4_VWA4_WG16_4_4_WGM1
    SolutionIndex: 75
    SolutionNameMin: Cijk_Alik_Bljk_S_MX_B_Bias_HA_SAV_UserArgs_MT192x32x64_MI16x16x1_SN_GRVWA4_GRVWB4_GSU5_LBSPPA256_LBSPPB256_LPA8_LPB8_LRVW4_MIWT3_2_SU0_SUM0_SUS0_SVW1_VWA1_WG64_4_1_WGM1
    SolutionIndex: 76
    SolutionNameMin: Cijk_Alik_Bljk_S_MX_B_Bias_HA_SAV_UserArgs_MT64x32x128_MI32x32x1_SN_CLR1_GRVWA4_GRVWB4_GSU1_LBSPPA512_LBSPPB512_LPA4_LPB4_LRVW4_MIWT1_1_NTA0_PLR1_SU0_SUM0_SUS0_SVW1_VWA1_WG64_2_2_WGM1
    SolutionIndex: 77
    SolutionNameMin: Cijk_Alik_Bljk_S_MX_B_Bias_HA_SAV_UserArgs_MT64x32x128_MI32x32x1_SN_CLR1_GRVWA4_GRVWB4_GSU1_LBSPPA512_LBSPPB512_LPA4_LPB4_LRVW4_MIWT1_1_NTA4_PLR1_SU0_SUM0_SUS0_SVW1_VWA1_WG64_2_2_WGM1
    SolutionIndex: 78
    SolutionNameMin: Cijk_Alik_Bljk_S_MX_B_Bias_HA_SAV_UserArgs_MT64x32x64_MI32x32x1_SN_CLR1_GRVWA4_GRVWB4_GSU1_LBSPPA256_LBSPPB256_LPA4_LPB4_LRVW4_MIWT1_1_NTA0_PLR1_SU0_SUM0_SUS0_SVW1_VWA1_WG64_2_1_WGM1
    SolutionIndex: 79
    SolutionNameMin: Cijk_Alik_Bljk_S_MX_B_Bias_HA_SAV_UserArgs_MT160x32x64_MI16x16x1_SN_CLR1_GRVWA4_GRVWB4_GSU2_LBSPPA256_LBSPPB256_LPA8_LPB8_LRVW4_MIWT5_1_NTA0_PLR1_SU0_SUM0_SUS0_SVW1_VWA1_WG32_8_1_WGM1
    SolutionIndex: 80
    SolutionNameMin: Cijk_Alik_Bljk_S_MX_B_Bias_HA_SAV_UserArgs_MT192x32x64_MI16x16x1_SN_CLR1_GRVWA4_GRVWB4_GSU5_LBSPPA256_LBSPPB256_LPA8_LPB8_LRVW4_MIWT3_2_NTA4_PLR1_SU0_SUM0_SUS0_SVW1_VWA1_WG64_4_1_WGM1
    SolutionIndex: 81
    SolutionNameMin: Cijk_Alik_Bljk_S_MX_B_Bias_HA_SAV_UserArgs_MT128x32x64_MI32x32x1_SN_CLR1_GRVWA4_GRVWB4_GSU1_LBSPPA256_LBSPPB256_LPA4_LPB4_LRVW4_MIWT1_1_NTA4_PLR1_SU0_SUM0_SUS0_SVW1_VWA1_WG128_2_1_WGM1
    SolutionIndex: 82
    SolutionNameMin: Cijk_Alik_Bljk_S_MX_B_Bias_HA_SAV_UserArgs_MT128x32x64_MI16x16x1_SN_CLR1_GRVWA4_GRVWB4_GSU1_LBSPPA1024_LBSPPB256_LPA8_LPB8_LRVW4_MIWT4_2_NTA4_PLR1_SU0_SUM0_SUS0_SVW4_VWA4_WG32_4_2_WGM1
    SolutionIndex: 83
    SolutionNameMin: Cijk_Alik_Bljk_S_MX_B_Bias_HA_SAV_UserArgs_MT160x32x64_MI16x16x1_SN_CLR1_GRVWA4_GRVWB4_GSU1_LBSPPA256_LBSPPB256_LPA8_LPB8_LRVW4_MIWT5_1_NTA4_PLR1_SU0_SUM0_SUS0_SVW1_VWA1_WG32_8_1_WGM1
    SolutionIndex: 84
    SolutionNameMin: Cijk_Alik_Bljk_S_MX_B_Bias_HA_SAV_UserArgs_MT64x32x64_MI16x16x1_SN_CLR1_GRVWA4_GRVWB4_GSU1_LBSPPA256_LBSPPB256_LPA8_LPB8_LRVW4_MIWT1_2_NTA4_PLR1_SU0_SUM0_SUS0_SVW1_VWA1_WG64_4_1_WGM1
    SolutionIndex: 85
    SolutionNameMin: Cijk_Alik_Bljk_S_MX_B_Bias_HA_SAV_UserArgs_MT128x32x64_MI32x32x1_SN_CLR1_GRVWA4_GRVWB4_GSU1_LBSPPA512_LBSPPB256_LPA4_LPB4_LRVW4_MIWT2_1_NTA4_PLR1_SU0_SUM0_SUS0_SVW2_VWA2_WG64_2_2_WGM1
    SolutionIndex: 86
    SolutionNameMin: Cijk_Alik_Bljk_S_MX_B_Bias_HA_SAV_UserArgs_MT64x32x64_MI16x16x1_SN_CLR1_GRVWA4_GRVWB4_GSU1_LBSPPA512_LBSPPB256_LPA8_LPB8_LRVW4_MIWT2_1_NTA4_PLR1_SU0_SUM0_SUS0_SVW2_VWA2_WG32_8_1_WGM1
    SolutionIndex: 87
    SolutionNameMin: Cijk_Alik_Bljk_S_MX_B_Bias_HA_SAV_UserArgs_MT16x32x128_MI16x16x1_SN_LDSB0_GRVWA4_GRVWB4_GSU16_LBSPPA512_LBSPPB512_LPA8_LPB8_MIWT1_1_NLCA1_NLCB1_SU0_SUM0_SUS0_SVW1_VWA1_WG16_8_2_WGM1
    SolutionIndex: 88
    SolutionNameMin: Cijk_Alik_Bljk_S_MX_B_Bias_HA_SAV_UserArgs_MT16x32x128_MI16x16x1_SN_LDSB0_GRVWA4_GRVWB4_GSU30_LBSPPA512_LBSPPB512_LPA8_LPB8_MIWT1_1_NLCA1_NLCB1_SU0_SUM0_SUS0_SVW1_VWA1_WG16_8_1_WGM1
    SolutionIndex: 89
    SolutionNameMin: Cijk_Alik_Bljk_S_MX_B_Bias_HA_SAV_UserArgs_MT16x32x256_MI16x16x1_SN_LDSB1_GRVWA4_GRVWB4_GSU16_LBSPPA1024_LBSPPB1024_LPA8_LPB8_MIWT1_1_NLCA1_NLCB1_SU0_SUM0_SUS0_SVW1_VWA1_WG16_8_2_WGM1
    SolutionIndex: 90
    SolutionNameMin: Cijk_Alik_Bljk_S_MX_B_Bias_HA_SAV_UserArgs_MT32x32x64_MI16x16x1_SN_LDSB0_GRVWA4_GRVWB4_GSU16_LBSPPA256_LBSPPB256_LPA8_LPB8_MIWT1_1_NLCA1_NLCB1_SU0_SUM0_SUS0_SVW1_VWA1_WG32_8_1_WGM1
    SolutionIndex: 91
    SolutionNameMin: Cijk_Alik_Bljk_S_MX_B_Bias_HA_SAV_UserArgs_MT32x32x128_MI16x16x1_SN_LDSB1_GRVWA4_GRVWB4_GSU16_LBSPPA512_LBSPPB512_LPA8_LPB8_MIWT1_1_NLCA1_NLCB1_SU0_SUM0_SUS0_SVW1_VWA1_WG32_8_1_WGM1
    SolutionIndex: 92
    SolutionNameMin: Cijk_Alik_Bljk_S_MX_B_Bias_HA_SAV_UserArgs_MT16x16x256_MI16x16x1_SN_LDSB1_GRVWA4_GRVWB4_GSU1_LBSPPA1024_LBSPPB1024_LPA8_LPB8_LRVW4_MIWT1_1_NLCA1_NLCB1_SU0_SUM0_SUS0_SVW1_VWA1_WG16_4_4_WGM1
    SolutionIndex: 93
    SolutionNameMin: Cijk_Alik_Bljk_S_MX_B_Bias_HA_SAV_UserArgs_MT64x32x64_MI16x16x1_SN_LDSB0_GRVWA4_GRVWB4_GSU16_LBSPPA256_LBSPPB256_LPA8_LPB8_LRVW4_MIWT1_2_NLCA1_NLCB1_SU0_SUM0_SUS0_SVW1_VWA1_WG64_4_1_WGM1
    SolutionIndex: 94
    SolutionNameMin: Cijk_Alik_Bljk_S_MX_B_Bias_HA_SAV_UserArgs_MT32x64x128_MI16x16x1_SN_LDSB1_GRVWA4_GRVWB4_GSU16_LBSPPA512_LBSPPB512_LPA8_LPB8_LRVW4_MIWT1_2_NLCA1_NLCB1_SU0_SUM0_SUS0_SVW1_VWA1_WG32_8_1_WGM1
    SolutionIndex: 95
    SolutionNameMin: Cijk_Alik_Bljk_S_MX_B_Bias_HA_SAV_UserArgs_MT32x64x64_MI16x16x1_SN_LDSB0_GRVWA4_GRVWB4_GSU11_LBSPPA256_LBSPPB256_LPA8_LPB8_LRVW4_MIWT1_2_NLCA1_NLCB1_SU0_SUM0_SUS0_SVW1_VWA1_WG32_8_1_WGM1
    SolutionIndex: 96
    SolutionNameMin: Cijk_Alik_Bljk_S_MX_B_Bias_HA_SAV_UserArgs_MT48x64x64_MI16x16x1_SN_LDSB1_GRVWA4_GRVWB4_GSU20_LBSPPA256_LBSPPB256_LPA8_LPB8_LRVW4_MIWT3_1_NLCA1_NLCB1_SU0_SUM0_SUS0_SVW1_VWA1_WG16_16_1_WGM1
    SolutionIndex: 97
    SolutionNameMin: Cijk_Alik_Bljk_S_MX_B_Bias_HA_SAV_UserArgs_MT16x16x256_MI16x16x1_SN_LDSB1_GRVWA4_GRVWB4_GSU1_LBSPPA1024_LBSPPB1024_LPA8_LPB8_LRVW4_MIAV1_MIWT1_1_NLCA1_NLCB1_SU0_SUM0_SUS0_SVW1_VWA1_WG16_4_2_WGM1
    SolutionIndex: 98
    SolutionNameMin: Cijk_Alik_Bljk_S_MX_B_Bias_HA_SAV_UserArgs_MT64x32x64_MI16x16x1_SN_LDSB0_GRVWA4_GRVWB4_GSU8_LBSPPA256_LBSPPB256_LPA8_LPB8_LRVW4_MIAV1_MIWT1_2_NLCA1_NLCB1_SU0_SUM0_SUS0_SVW1_VWA1_WG64_4_1_WGM1
    SolutionIndex: 99
    SolutionNameMin: Cijk_Alik_Bljk_S_MX_B_Bias_HA_SAV_UserArgs_MT64x64x64_MI32x32x1_SN_LDSB1_GRVWA4_GRVWB4_GSU16_LBSPPA256_LBSPPB256_LPA4_LPB4_LRVW4_MIAV1_MIWT1_1_NLCA1_NLCB1_SU0_SUM0_SUS0_SVW1_VWA1_WG64_4_1_WGM1
    SolutionIndex: 100
    SolutionNameMin: Cijk_Alik_Bljk_S_MX_B_Bias_HA_SAV_UserArgs_MT16x32x128_MI16x16x1_SN_LDSB0_GRVWA4_GRVWB4_GSU1_LBSPPA512_LBSPPB512_LPA8_LPB8_LRVW4_MIAV1_MIWT1_1_NLCA1_NLCB1_SU0_SUM0_SUS0_SVW1_VWA1_WG16_8_2_WGM1
    SolutionIndex: 101
    SolutionNameMin: Cijk_Alik_Bljk_S_MX_B_Bias_HA_SAV_UserArgs_MT48x64x128_MI16x16x1_SN_LDSB1_GRVWA4_GRVWB4_GSU8_LBSPPA512_LBSPPB512_LPA8_LPB8_LRVW4_MIAV1_MIWT3_1_NLCA1_NLCB1_SU0_SUM0_SUS0_SVW1_VWA1_WG16_16_1_WGM1
    SolutionIndex: 102
    SolutionNameMin: Cijk_Alik_Bljk_S_MX_B_Bias_HA_SAV_UserArgs_MT96x64x64_MI16x16x1_SN_LDSB1_GRVWA4_GRVWB4_GSU20_LBSPPA256_LBSPPB256_LPA8_LPB8_LRVW4_MIAV1_MIWT3_2_NLCA1_NLCB1_SU0_SUM0_SUS0_SVW1_VWA1_WG32_8_1_WGM1
    SolutionIndex: 103
    SolutionNameMin: Cijk_Alik_Bljk_S_MX_B_Bias_HA_SAV_UserArgs_MT16x32x256_MI16x16x1_SN_GRVWA4_GRVWB4_GSU1_LBSPPA1024_LBSPPB1024_LPA8_LPB8_LRVW4_MIAV1_MIWT1_1_NLCA1_NLCB1_SU0_SUM0_SUS0_SVW1_VWA1_WG16_8_2_WGM1
    SolutionIndex: 104
    SolutionNameMin: Cijk_Alik_Bljk_S_MX_B_Bias_HA_SAV_UserArgs_MT64x64x64_MI32x32x1_SN_GRVWA4_GRVWB4_GSU8_LBSPPA256_LBSPPB256_LPA4_LPB4_LRVW4_MIAV1_MIWT1_1_NLCA1_NLCB1_SU0_SUM0_SUS0_SVW1_VWA1_WG64_4_1_WGM1
    SolutionIndex: 105
    SolutionNameMin: Cijk_Alik_Bljk_S_MX_B_Bias_HA_SAV_UserArgs_MT128x64x64_MI16x16x1_SN_GRVWA4_GRVWB4_GSU16_LBSPPA512_LBSPPB256_LPA8_LPB8_LRVW4_MIAV1_MIWT2_4_NLCA1_NLCB1_SU0_SUM0_SUS0_SVW2_VWA2_WG64_4_1_WGM1
    SolutionIndex: 106
    SolutionNameMin: Cijk_Alik_Bljk_S_MX_B_Bias_HA_SAV_UserArgs_MT128x64x64_MI16x16x1_SN_GRVWA4_GRVWB4_GSU16_LBSPPA1024_LBSPPB256_LPA8_LPB8_LRVW4_MIAV1_MIWT4_2_NLCA1_NLCB1_SU0_SUM0_SUS0_SVW4_VWA4_WG32_8_1_WGM1
    SolutionIndex: 107
    SolutionNameMin: Cijk_Alik_Bljk_S_MX_B_Bias_HA_SAV_UserArgs_MT32x32x128_MI32x32x1_SN_GRVWA4_GRVWB4_GSU1_LBSPPA512_LBSPPB512_LPA4_LPB4_LRVW4_MIAV1_MIWT1_1_NLCA1_NLCB1_SU0_SUM0_SUS0_SVW1_VWA1_WG32_2_4_WGM1
    SolutionIndex: 108
    SolutionNameMin: Cijk_Alik_Bljk_S_MX_B_Bias_HA_SAV_UserArgs_MT96x64x64_MI16x16x1_SN_GRVWA4_GRVWB4_GSU8_LBSPPA256_LBSPPB256_LPA8_LPB8_LRVW4_MIAV1_MIWT3_2_NLCA1_NLCB1_SU0_SUM0_SUS0_SVW1_VWA1_WG32_8_1_WGM1
    SolutionIndex: 109
    SolutionNameMin: Cijk_Alik_Bljk_S_MX_B_Bias_HA_SAV_UserArgs_MT160x64x64_MI16x16x1_SN_GRVWA4_GRVWB4_GSU16_LBSPPA256_LBSPPB256_LPA8_LPB8_LRVW4_MIAV1_MIWT5_2_NLCA1_NLCB1_SU0_SUM0_SUS0_SVW1_VWA1_WG32_8_1_WGM1
    SolutionIndex: 110
    SolutionNameMin: Cijk_Alik_Bljk_S_MX_B_Bias_HA_SAV_UserArgs_MT32x32x128_MI16x16x1_SN_GRVWA4_GRVWB4_GSU1_LBSPPA1024_LBSPPB512_LPA8_LPB8_LRVW4_MIAV1_MIWT2_1_SU0_SUM0_SUS0_SVW2_VWA2_WG16_8_2_WGM1
    SolutionIndex: 111
    SolutionNameMin: Cijk_Alik_Bljk_S_MX_B_Bias_HA_SAV_UserArgs_MT64x64x64_MI32x32x1_SN_GRVWA4_GRVWB4_GSU5_LBSPPA256_LBSPPB256_LPA4_LPB4_LRVW4_MIAV1_MIWT1_1_SU0_SUM0_SUS0_SVW1_VWA1_WG64_4_1_WGM1
    SolutionIndex: 112
    SolutionNameMin: Cijk_Alik_Bljk_S_MX_B_Bias_HA_SAV_UserArgs_MT96x64x64_MI16x16x1_SN_GRVWA4_GRVWB4_GSU7_LBSPPA256_LBSPPB256_LPA8_LPB8_LRVW4_MIAV1_MIWT3_2_SU0_SUM0_SUS0_SVW1_VWA1_WG32_8_1_WGM1
    SolutionIndex: 113
    SolutionNameMin: Cijk_Alik_Bljk_S_MX_B_Bias_HA_SAV_UserArgs_MT64x32x128_MI16x16x1_SN_GRVWA4_GRVWB4_GSU1_LBSPPA2048_LBSPPB512_LPA8_LPB8_LRVW4_MIAV1_MIWT4_2_SU0_SUM0_SUS0_SVW4_VWA4_WG16_4_4_WGM1
    SolutionIndex: 114
    SolutionNameMin: Cijk_Alik_Bljk_S_MX_B_Bias_HA_SAV_UserArgs_MT96x64x64_MI16x16x1_SN_GRVWA4_GRVWB4_GSU5_LBSPPA256_LBSPPB256_LPA8_LPB8_LRVW4_MIAV1_MIWT3_2_SU0_SUM0_SUS0_SVW1_VWA1_WG32_8_1_WGM1
    SolutionIndex: 115
    SolutionNameMin: Cijk_Alik_Bljk_S_MX_B_Bias_HA_SAV_UserArgs_MT160x64x64_MI16x16x1_SN_GRVWA4_GRVWB4_GSU8_LBSPPA256_LBSPPB256_LPA8_LPB8_LRVW4_MIAV1_MIWT5_2_SU0_SUM0_SUS0_SVW1_VWA1_WG32_8_1_WGM1
    SolutionIndex: 116
    SolutionNameMin: Cijk_Alik_Bljk_S_MX_B_Bias_HA_SAV_UserArgs_MT64x32x128_MI32x32x1_SN_CLR1_GRVWA4_GRVWB4_GSU1_LBSPPA512_LBSPPB512_LPA4_LPB4_LRVW4_MIAV1_MIWT1_1_PLR1_SU0_SUM0_SUS0_SVW1_VWA1_WG64_2_2_WGM1
    SolutionIndex: 117
    SolutionNameMin: Cijk_Alik_Bljk_S_MX_B_Bias_HA_SAV_UserArgs_MT128x64x64_MI16x16x1_SN_CLR1_GRVWA4_GRVWB4_GSU5_LBSPPA512_LBSPPB256_LPA8_LPB8_LRVW4_MIAV1_MIWT2_4_PLR1_SU0_SUM0_SUS0_SVW2_VWA2_WG64_4_1_WGM1
    SolutionIndex: 118
    SolutionNameMin: Cijk_Alik_Bljk_S_MX_B_Bias_HA_SAV_UserArgs_MT128x64x64_MI16x16x1_SN_CLR1_GRVWA4_GRVWB4_GSU5_LBSPPA1024_LBSPPB256_LPA8_LPB8_LRVW4_MIAV1_MIWT4_2_PLR1_SU0_SUM0_SUS0_SVW4_VWA4_WG32_8_1_WGM1
    SolutionIndex: 119
    SolutionNameMin: Cijk_Alik_Bljk_S_MX_B_Bias_HA_SAV_UserArgs_MT64x64x64_MI32x32x1_SN_CLR1_GRVWA4_GRVWB4_GSU1_LBSPPA512_LBSPPB256_LPA4_LPB4_LRVW4_MIAV1_MIWT2_2_PLR1_SU0_SUM0_SUS0_SVW2_VWA2_WG32_2_4_WGM1
    SolutionIndex: 120
    SolutionNameMin: Cijk_Alik_Bljk_S_MX_B_Bias_HA_SAV_UserArgs_MT128x64x64_MI16x16x1_SN_CLR1_GRVWA4_GRVWB4_GSU3_LBSPPA1024_LBSPPB256_LPA8_LPB8_LRVW4_MIAV1_MIWT4_4_PLR1_SU0_SUM0_SUS0_SVW4_VWA4_WG32_4_2_WGM1
    SolutionIndex: 121
    SolutionNameMin: Cijk_Alik_Bljk_S_MX_B_Bias_HA_SAV_UserArgs_MT64x64x64_MI16x16x1_SN_CLR1_GRVWA4_GRVWB4_GSU1_LBSPPA1024_LBSPPB256_LPA8_LPB8_LRVW4_MIAV1_MIWT4_2_NTA0_PLR1_SU0_SUM0_SUS0_SVW4_VWA4_WG16_8_2_WGM1
    SolutionIndex: 122
    SolutionNameMin: Cijk_Alik_Bljk_S_MX_B_Bias_HA_SAV_UserArgs_MT160x64x64_MI16x16x1_SN_CLR1_GRVWA4_GRVWB4_GSU3_LBSPPA256_LBSPPB256_LPA8_LPB8_LRVW4_MIAV1_MIWT5_2_NTA0_PLR1_SU0_SUM0_SUS0_SVW1_VWA1_WG32_8_1_WGM1
    SolutionIndex: 123
    SolutionNameMin: Cijk_Alik_Bljk_S_MX_B_Bias_HA_SAV_UserArgs_MT160x64x64_MI16x16x1_SN_CLR1_GRVWA4_GRVWB4_GSU3_LBSPPA256_LBSPPB256_LPA8_LPB8_LRVW4_MIAV1_MIWT5_2_NTA4_PLR1_SU0_SUM0_SUS0_SVW1_VWA1_WG32_8_1_WGM1
    SolutionIndex: 124
    SolutionNameMin: Cijk_Alik_Bljk_S_MX_B_Bias_HA_SAV_UserArgs_MT80x64x64_MI16x16x1_SN_CLR1_GRVWA4_GRVWB4_GSU1_LBSPPA256_LBSPPB256_LPA8_LPB8_LRVW4_MIAV1_MIWT5_1_NTA4_PLR1_SU0_SUM0_SUS0_SVW1_VWA1_WG16_16_1_WGM1
    SolutionIndex: 125
    SolutionNameMin: Cijk_Alik_Bljk_S_MX_B_Bias_HA_SAV_UserArgs_MT160x64x64_MI16x16x1_SN_CLR1_GRVWA4_GRVWB4_GSU2_LBSPPA256_LBSPPB256_LPA8_LPB8_LRVW4_MIAV1_MIWT5_2_NTA0_PLR1_SU0_SUM0_SUS0_SVW1_VWA1_WG32_8_1_WGM1
    SolutionIndex: 126
    SolutionNameMin: Cijk_Alik_Bljk_S_MX_B_Bias_HA_SAV_UserArgs_MT160x64x64_MI16x16x1_SN_CLR1_GRVWA4_GRVWB4_GSU2_LBSPPA256_LBSPPB256_LPA8_LPB8_LRVW4_MIAV1_MIWT5_2_NTA4_PLR1_SU0_SUM0_SUS0_SVW1_VWA1_WG32_8_1_WGM1
    SolutionIndex: 127
    SolutionNameMin: Cijk_Alik_Bljk_S_MX_B_Bias_HA_SAV_UserArgs_MT128x64x64_MI16x16x1_SN_CLR1_GRVWA4_GRVWB4_GSU1_LBSPPA1024_LBSPPB256_LPA8_LPB8_LRVW4_MIAV1_MIWT4_4_NTA0_PLR1_SU0_SUM0_SUS0_SVW4_VWA4_WG32_4_2_WGM1
    SolutionIndex: 128
    SolutionNameMin: Cijk_Alik_Bljk_S_MX_B_Bias_HA_SAV_UserArgs_MT128x64x64_MI16x16x1_SN_CLR1_GRVWA4_GRVWB4_GSU1_LBSPPA1024_LBSPPB256_LPA8_LPB8_LRVW4_MIAV1_MIWT4_4_NTA4_PLR1_SU0_SUM0_SUS0_SVW4_VWA4_WG32_4_2_WGM1
    SolutionIndex: 129
    SolutionNameMin: Cijk_Alik_Bljk_S_MX_B_Bias_HA_SAV_UserArgs_MT160x64x64_MI16x16x1_SN_CLR1_GRVWA4_GRVWB4_GSU1_LBSPPA256_LBSPPB256_LPA8_LPB8_LRVW4_MIAV1_MIWT5_2_NTA0_PLR1_SU0_SUM0_SUS0_SVW1_VWA1_WG32_8_1_WGM1
    SolutionIndex: 130
    SolutionNameMin: Cijk_Alik_Bljk_S_MX_B_Bias_HA_SAV_UserArgs_MT160x64x64_MI16x16x1_SN_CLR1_GRVWA4_GRVWB4_GSU1_LBSPPA256_LBSPPB256_LPA8_LPB8_LRVW4_MIAV1_MIWT5_2_NTA4_PLR1_SU0_SUM0_SUS0_SVW1_VWA1_WG32_8_1_WGM1
    SolutionIndex: 131
    SolutionNameMin: Cijk_Alik_Bljk_S_MX_B_Bias_HA_SAV_UserArgs_MT256x64x32_MI16x16x1_SN_CLR1_GRVWA4_GRVWB4_GSU1_LBSPPA512_LBSPPB128_LPA8_LPB8_LRVW4_MIAV1_MIWT4_4_NTA0_PLR1_SU0_SUM0_SUS0_SVW4_VWA4_WG64_4_1_WGM1
    SolutionIndex: 132
    SolutionNameMin: Cijk_Alik_Bljk_S_MX_B_Bias_HA_SAV_UserArgs_MT128x64x64_MI16x16x1_SN_CLR1_GRVWA4_GRVWB4_GSU1_LBSPPA1024_LBSPPB256_LPA8_LPB8_LRVW4_MIAV1_MIWT4_2_NTA4_PLR1_SU0_SUM0_SUS0_SVW4_VWA4_WG32_8_1_WGM1
    SolutionIndex: 133
    SolutionNameMin: Cijk_Alik_Bljk_S_MX_B_Bias_HA_SAV_UserArgs_MT320x64x32_MI16x16x1_SN_CLR1_GRVWA4_GRVWB4_GSU1_LBSPPA128_LBSPPB128_LPA8_LPB8_LRVW4_MIAV1_MIWT5_4_NTA0_PLR1_SU0_SUM0_SUS0_SVW1_VWA1_WG64_4_1_WGM1
    SolutionIndex: 134
    SolutionNameMin: Cijk_Alik_Bljk_S_MX_B_Bias_HA_SAV_UserArgs_MT128x64x32_MI16x16x1_SN_CLR1_GRVWA4_GRVWB4_GSU1_LBSPPA512_LBSPPB128_LPA8_LPB8_LRVW4_MIAV1_MIWT4_2_NTA0_PLR1_SU0_SUM0_SUS0_SVW4_VWA4_WG32_8_1_WGM1
    SolutionIndex: 135
    SolutionNameMin: Cijk_Alik_Bljk_S_MX_B_Bias_HA_SAV_UserArgs_MT16x32x64_MI16x16x1_SN_LDSB0_GRVWA4_GRVWB4_GSU16_LBSPPA256_LBSPPB256_LPA8_LPB8_MIWT1_1_NLCA1_NLCB1_SU0_SUM0_SUS0_SVW1_VWA1_WG16_8_1_WGM1
    SolutionIndex: 136
    SolutionNameMin: Cijk_Alik_Bljk_S_MX_B_Bias_HA_SAV_UserArgs_MT16x32x128_MI16x16x1_SN_LDSB0_GRVWA4_GRVWB4_GSU16_LBSPPA512_LBSPPB512_LPA8_LPB8_MIWT1_1_NLCA1_NLCB1_SU0_SUM0_SUS0_SVW1_VWA1_WG16_8_1_WGM1
    SolutionIndex: 137
    SolutionNameMin: Cijk_Alik_Bljk_S_MX_B_Bias_HA_SAV_UserArgs_MT16x32x256_MI16x16x1_SN_LDSB1_GRVWA4_GRVWB4_GSU24_LBSPPA1024_LBSPPB1024_LPA8_LPB8_MIWT1_1_NLCA1_NLCB1_SU0_SUM0_SUS0_SVW1_VWA1_WG16_8_2_WGM1
    SolutionIndex: 138
    SolutionNameMin: Cijk_Alik_Bljk_S_MX_B_Bias_HA_SAV_UserArgs_MT16x32x256_MI16x16x1_SN_LDSB1_GRVWA4_GRVWB4_GSU13_LBSPPA1024_LBSPPB1024_LPA8_LPB8_MIWT1_2_NLCA1_NLCB1_SU0_SUM0_SUS0_SVW1_VWA1_WG16_4_4_WGM1
    SolutionIndex: 139
    SolutionNameMin: Cijk_Alik_Bljk_S_MX_B_Bias_HA_SAV_UserArgs_MT64x32x128_MI32x32x1_SN_LDSB1_GRVWA4_GRVWB4_GSU13_LBSPPA512_LBSPPB512_LPA4_LPB4_MIWT1_1_NLCA1_NLCB1_SU0_SUM0_SUS0_SVW1_VWA1_WG64_2_2_WGM1
    SolutionIndex: 140
    SolutionNameMin: Cijk_Alik_Bljk_S_MX_B_Bias_HA_SAV_UserArgs_MT16x16x256_MI16x16x1_SN_LDSB1_GRVWA4_GRVWB4_GSU1_LBSPPA1024_LBSPPB1024_LPA8_LPB8_LRVW4_MIWT1_1_NLCA1_NLCB1_SU0_SUM0_SUS0_SVW1_VWA1_WG16_4_2_WGM1
    SolutionIndex: 141
    SolutionNameMin: Cijk_Alik_Bljk_S_MX_B_Bias_HA_SAV_UserArgs_MT64x32x64_MI16x16x1_SN_LDSB0_GRVWA4_GRVWB4_GSU10_LBSPPA256_LBSPPB256_LPA8_LPB8_LRVW4_MIWT1_2_NLCA1_NLCB1_SU0_SUM0_SUS0_SVW1_VWA1_WG64_4_1_WGM1
    SolutionIndex: 142
    SolutionNameMin: Cijk_Alik_Bljk_S_MX_B_Bias_HA_SAV_UserArgs_MT64x48x128_MI16x16x1_SN_LDSB1_GRVWA4_GRVWB4_GSU16_LBSPPA512_LBSPPB512_LPA8_LPB8_LRVW4_MIWT1_3_NLCA1_NLCB1_SU0_SUM0_SUS0_SVW1_VWA1_WG64_4_1_WGM1
    SolutionIndex: 143
    SolutionNameMin: Cijk_Alik_Bljk_S_MX_B_Bias_HA_SAV_UserArgs_MT64x48x64_MI16x16x1_SN_LDSB0_GRVWA4_GRVWB4_GSU11_LBSPPA256_LBSPPB256_LPA8_LPB8_LRVW4_MIWT1_3_NLCA1_NLCB1_SU0_SUM0_SUS0_SVW1_VWA1_WG64_4_1_WGM1
    SolutionIndex: 144
    SolutionNameMin: Cijk_Alik_Bljk_S_MX_B_Bias_HA_SAV_UserArgs_MT64x96x64_MI16x16x1_SN_LDSB1_GRVWA4_GRVWB4_GSU21_LBSPPA512_LBSPPB256_LPA8_LPB8_LRVW4_MIWT2_3_NLCA1_NLCB1_SU0_SUM0_SUS0_SVW2_VWA2_WG32_8_1_WGM1
    SolutionIndex: 145
    SolutionNameMin: Cijk_Alik_Bljk_S_MX_B_Bias_HA_SAV_UserArgs_MT128x48x64_MI16x16x1_SN_LDSB1_GRVWA4_GRVWB4_GSU16_LBSPPA512_LBSPPB256_LPA8_LPB8_LRVW4_MIAV1_MIWT2_3_NLCA1_NLCB1_SU0_SUM0_SUS0_SVW2_VWA2_WG64_4_1_WGM1
    SolutionIndex: 146
    SolutionNameMin: Cijk_Alik_Bljk_S_MX_B_Bias_HA_SAV_UserArgs_MT96x96x64_MI16x16x1_SN_LDSB1_GRVWA4_GRVWB4_GSU20_LBSPPA256_LBSPPB256_LPA8_LPB8_LRVW4_MIAV1_MIWT3_3_NLCA1_NLCB1_SU0_SUM0_SUS0_SVW1_VWA1_WG32_8_1_WGM1
    SolutionIndex: 147
    SolutionNameMin: Cijk_Alik_Bljk_S_MX_B_Bias_HA_SAV_UserArgs_MT64x32x128_MI32x32x1_SN_LDSB1_GRVWA4_GRVWB4_GSU4_LBSPPA512_LBSPPB512_LPA4_LPB4_LRVW4_MIAV1_MIWT1_1_NLCA1_NLCB1_SU0_SUM0_SUS0_SVW1_VWA1_WG64_2_2_WGM1
    SolutionIndex: 148
    SolutionNameMin: Cijk_Alik_Bljk_S_MX_B_Bias_HA_SAV_UserArgs_MT64x96x64_MI16x16x1_SN_GRVWA4_GRVWB4_GSU8_LBSPPA512_LBSPPB256_LPA8_LPB8_LRVW4_MIAV1_MIWT2_3_SU0_SUM0_SUS0_SVW2_VWA2_WG32_8_1_WGM1
    SolutionIndex: 149
    SolutionNameMin: Cijk_Alik_Bljk_S_MX_B_Bias_HA_SAV_UserArgs_MT128x96x64_MI16x16x1_SN_GRVWA4_GRVWB4_GSU16_LBSPPA1024_LBSPPB256_LPA8_LPB8_LRVW4_MIAV1_MIWT4_3_SU0_SUM0_SUS0_SVW4_VWA4_WG32_8_1_WGM1
    SolutionIndex: 150
    SolutionNameMin: Cijk_Alik_Bljk_S_MX_B_Bias_HA_SAV_UserArgs_MT32x32x128_MI16x16x1_SN_GRVWA4_GRVWB4_GSU1_LBSPPA512_LBSPPB512_LPA8_LPB8_LRVW4_MIAV1_MIWT1_2_SU0_SUM0_SUS0_SVW1_VWA1_WG32_4_2_WGM1
    SolutionIndex: 151
    SolutionNameMin: Cijk_Alik_Bljk_S_MX_B_Bias_HA_SAV_UserArgs_MT96x96x64_MI16x16x1_SN_GRVWA4_GRVWB4_GSU10_LBSPPA256_LBSPPB256_LPA8_LPB8_LRVW4_MIAV1_MIWT3_3_SU0_SUM0_SUS0_SVW1_VWA1_WG32_8_1_WGM1
    SolutionIndex: 152
    SolutionNameMin: Cijk_Alik_Bljk_S_MX_B_Bias_HA_SAV_UserArgs_MT32x48x128_MI16x16x1_SN_CLR1_GRVWA4_GRVWB4_GSU1_LBSPPA512_LBSPPB512_LPA8_LPB8_LRVW4_MIAV1_MIWT1_3_PLR1_SU0_SUM0_SUS0_SVW1_VWA1_WG32_4_2_WGM1
    SolutionIndex: 153
    SolutionNameMin: Cijk_Alik_Bljk_S_MX_B_Bias_HA_SAV_UserArgs_MT96x96x64_MI16x16x1_SN_CLR1_GRVWA4_GRVWB4_GSU7_LBSPPA256_LBSPPB256_LPA8_LPB8_LRVW4_MIAV1_MIWT3_3_PLR1_SU0_SUM0_SUS0_SVW1_VWA1_WG32_8_1_WGM1
    SolutionIndex: 154
    SolutionNameMin: Cijk_Alik_Bljk_S_MX_B_Bias_HA_SAV_UserArgs_MT128x96x64_MI16x16x1_SN_CLR1_GRVWA4_GRVWB4_GSU10_LBSPPA1024_LBSPPB256_LPA8_LPB8_LRVW4_MIAV1_MIWT4_3_PLR1_SU0_SUM0_SUS0_SVW4_VWA4_WG32_8_1_WGM1
    SolutionIndex: 155
    SolutionNameMin: Cijk_Alik_Bljk_S_MX_B_Bias_HA_SAV_UserArgs_MT96x96x64_MI16x16x1_SN_CLR1_GRVWA4_GRVWB4_GSU5_LBSPPA256_LBSPPB256_LPA8_LPB8_LRVW4_MIAV1_MIWT3_3_PLR1_SU0_SUM0_SUS0_SVW1_VWA1_WG32_8_1_WGM1
    SolutionIndex: 156
    SolutionNameMin: Cijk_Alik_Bljk_S_MX_B_Bias_HA_SAV_UserArgs_MT64x48x128_MI16x16x1_SN_CLR1_GRVWA4_GRVWB4_GSU1_LBSPPA1024_LBSPPB512_LPA8_LPB8_LRVW4_MIAV1_MIWT2_3_PLR1_SU0_SUM0_SUS0_SVW2_VWA2_WG32_4_2_WGM1
    SolutionIndex: 157
    SolutionNameMin: Cijk_Alik_Bljk_S_MX_B_Bias_HA_SAV_UserArgs_MT128x96x64_MI16x16x1_SN_CLR1_GRVWA4_GRVWB4_GSU5_LBSPPA1024_LBSPPB256_LPA8_LPB8_LRVW4_MIAV1_MIWT4_3_PLR1_SU0_SUM0_SUS0_SVW4_VWA4_WG32_8_1_WGM1
    SolutionIndex: 158
    SolutionNameMin: Cijk_Alik_Bljk_S_MX_B_Bias_HA_SAV_UserArgs_MT64x32x64_MI32x32x1_SN_CLR1_GRVWA4_GRVWB4_GSU1_LBSPPA256_LBSPPB256_LPA4_LPB4_LRVW4_MIAV1_MIWT1_1_PLR1_SU0_SUM0_SUS0_SVW1_VWA1_WG64_2_1_WGM1
    SolutionIndex: 159
    SolutionNameMin: Cijk_Alik_Bljk_S_MX_B_Bias_HA_SAV_UserArgs_MT128x96x64_MI16x16x1_SN_CLR1_GRVWA4_GRVWB4_GSU3_LBSPPA1024_LBSPPB256_LPA8_LPB8_LRVW4_MIAV1_MIWT4_3_PLR1_SU0_SUM0_SUS0_SVW4_VWA4_WG32_8_1_WGM1
    SolutionIndex: 160
    SolutionNameMin: Cijk_Alik_Bljk_S_MX_B_Bias_HA_SAV_UserArgs_MT64x96x64_MI16x16x1_SN_CLR1_GRVWA4_GRVWB4_GSU1_LBSPPA1024_LBSPPB256_LPA8_LPB8_LRVW4_MIAV1_MIWT4_3_NTA0_PLR1_SU0_SUM0_SUS0_SVW4_VWA4_WG16_8_2_WGM1
    SolutionIndex: 161
    SolutionNameMin: Cijk_Alik_Bljk_S_MX_B_Bias_HA_SAV_UserArgs_MT256x96x32_MI32x32x1_SN_CLR1_GRVWA4_GRVWB4_GSU5_LBSPPA256_LBSPPB128_LPA4_LPB4_LRVW4_MIAV0_MIWT2_3_NTA4_PLR1_SU0_SUM0_SUS0_SVW2_VWA2_WG128_2_1_WGM1
    SolutionIndex: 162
    SolutionNameMin: Cijk_Alik_Bljk_S_MX_B_Bias_HA_SAV_UserArgs_MT128x96x64_MI16x16x1_SN_CLR1_GRVWA4_GRVWB4_GSU3_LBSPPA1024_LBSPPB256_LPA8_LPB8_LRVW4_MIAV1_MIWT4_3_NTA4_PLR1_SU0_SUM0_SUS0_SVW4_VWA4_WG32_8_1_WGM1
    SolutionIndex: 163
    SolutionNameMin: Cijk_Alik_Bljk_S_MX_B_Bias_HA_SAV_UserArgs_MT128x96x64_MI16x16x1_SN_GRVWA4_GRVWB4_GSU1_LBSPPA1024_LBSPPB256_LPA8_LPB8_LRVW4_MIAV1_MIWT4_3_NTA0_SU0_SUM0_SUS0_SVW4_VWA4_WG32_8_1_WGM1
    SolutionIndex: 164
    SolutionNameMin: Cijk_Alik_Bljk_S_MX_B_Bias_HA_SAV_UserArgs_MT128x96x64_MI16x16x1_SN_GRVWA4_GRVWB4_GSU1_LBSPPA1024_LBSPPB256_LPA8_LPB8_LRVW4_MIAV1_MIWT4_3_NTA4_SU0_SUM0_SUS0_SVW4_VWA4_WG32_8_1_WGM1
    SolutionIndex: 165
    SolutionNameMin: Cijk_Alik_Bljk_S_MX_B_Bias_HA_SAV_UserArgs_MT320x96x32_MI16x16x1_SN_GRVWA4_GRVWB4_GSU3_LBSPPA256_LBSPPB128_LPA8_LPB8_LRVW4_MIAV0_MIWT10_3_NTA4_SU0_SUM0_SUS0_SVW2_VWA2_WG32_8_1_WGM1
    SolutionIndex: 166
    SolutionNameMin: Cijk_Alik_Bljk_S_MX_B_Bias_HA_SAV_UserArgs_MT192x96x32_MI16x16x1_SN_GRVWA4_GRVWB4_GSU1_LBSPPA256_LBSPPB128_LPA8_LPB8_LRVW4_MIAV1_MIWT6_3_NTA0_SU0_SUM0_SUS0_SVW2_VWA2_WG32_8_1_WGM1
    SolutionIndex: 167
    SolutionNameMin: Cijk_Alik_Bljk_S_MX_B_Bias_HA_SAV_UserArgs_MT160x96x32_MI16x16x1_SN_GRVWA1_GRVWB4_GSU1_LBSPPA128_LBSPPB128_LPA8_LPB8_LRVW4_MIAV1_MIWT5_3_NTA4_SU0_SUM0_SUS0_SVW1_VWA1_WG32_8_1_WGM1
    SolutionIndex: 168
    SolutionNameMin: Cijk_Alik_Bljk_S_MX_B_Bias_HA_SAV_UserArgs_MT320x96x32_MI16x16x1_SN_GRVWA4_GRVWB4_GSU2_LBSPPA256_LBSPPB128_LPA8_LPB8_LRVW4_MIAV0_MIWT10_3_NTA4_SU0_SUM0_SUS0_SVW2_VWA2_WG32_8_1_WGM1
    SolutionIndex: 169
    SolutionNameMin: Cijk_Alik_Bljk_S_MX_B_Bias_HA_SAV_UserArgs_MT256x96x32_MI16x16x1_SN_GRVWA4_GRVWB4_GSU1_LBSPPA512_LBSPPB128_LPA8_LPB8_LRVW4_MIAV0_MIWT4_6_NTA0_SU0_SUM0_SUS0_SVW4_VWA4_WG64_4_1_WGM1
    SolutionIndex: 170
    SolutionNameMin: Cijk_Alik_Bljk_S_MX_B_Bias_HA_SAV_UserArgs_MT224x96x32_MI16x16x1_SN_GRVWA1_GRVWB4_GSU1_LBSPPA128_LBSPPB128_LPA8_LPB8_LRVW4_MIAV1_MIWT7_3_NTA4_SU0_SUM0_SUS0_SVW1_VWA1_WG32_8_1_WGM1
    SolutionIndex: 171
    SolutionNameMin: Cijk_Alik_Bljk_S_MX_B_Bias_HA_SAV_UserArgs_MT128x96x32_MI16x16x1_SN_GRVWA4_GRVWB4_GSU1_LBSPPA512_LBSPPB128_LPA8_LPB8_LRVW4_MIAV1_MIWT4_3_NTA0_SU0_SUM0_SUS0_SVW4_VWA4_WG32_8_1_WGM1
    SolutionIndex: 172
    SolutionNameMin: Cijk_Alik_Bljk_S_MX_B_Bias_HA_SAV_UserArgs_MT320x96x32_MI16x16x1_SN_GRVWA4_GRVWB4_GSU1_LBSPPA256_LBSPPB128_LPA8_LPB8_LRVW4_MIAV0_MIWT10_3_NTA4_SU0_SUM0_SUS0_SVW2_VWA2_WG32_8_1_WGM1
    SolutionIndex: 173
    SolutionNameMin: Cijk_Alik_Bljk_S_MX_B_Bias_HA_SAV_UserArgs_MT224x96x32_MI16x16x1_SN_GRVWA4_GRVWB4_GSU1_LBSPPA128_LBSPPB128_LPA8_LPB8_LRVW4_MIAV1_MIWT7_3_NTA4_SU0_SUM0_SUS0_SVW1_VWA1_WG32_8_1_WGM1
    SolutionIndex: 174
    SolutionNameMin: Cijk_Alik_Bljk_S_MX_B_Bias_HA_SAV_UserArgs_MT96x96x64_MI16x16x1_SN_GRVWA4_GRVWB4_GSU1_LBSPPA256_LBSPPB256_LPA8_LPB8_LRVW4_MIAV1_MIWT3_3_NTA4_SU0_SUM0_SUS0_SVW1_VWA1_WG32_8_1_WGM1
    SolutionIndex: 175
    SolutionNameMin: Cijk_Alik_Bljk_S_MX_B_Bias_HA_SAV_UserArgs_MT16x32x256_MI16x16x1_SN_LDSB1_GRVWA4_GRVWB4_GSU16_LBSPPA1024_LBSPPB1024_LPA8_LPB8_MIWT1_1_NLCA1_NLCB1_SU0_SUM0_SUS0_SVW1_VWA1_WG16_8_1_WGM1
    SolutionIndex: 176
    SolutionNameMin: Cijk_Alik_Bljk_S_MX_B_Bias_HA_SAV_UserArgs_MT16x32x128_MI16x16x1_SN_LDSB1_GRVWA4_GRVWB4_GSU19_LBSPPA512_LBSPPB512_LPA8_LPB8_MIWT1_1_NLCA1_NLCB1_SU0_SUM0_SUS0_SVW1_VWA1_WG16_8_1_WGM1
    SolutionIndex: 177
    SolutionNameMin: Cijk_Alik_Bljk_S_MX_B_Bias_HA_SAV_UserArgs_MT64x32x64_MI16x16x1_SN_LDSB0_GRVWA4_GRVWB4_GSU16_LBSPPA256_LBSPPB256_LPA8_LPB8_MIWT1_2_NLCA1_NLCB1_SU0_SUM0_SUS0_SVW1_VWA1_WG64_4_1_WGM1
    SolutionIndex: 178
    SolutionNameMin: Cijk_Alik_Bljk_S_MX_B_Bias_HA_SAV_UserArgs_MT32x64x128_MI16x16x1_SN_LDSB1_GRVWA4_GRVWB4_GSU16_LBSPPA512_LBSPPB512_LPA8_LPB8_MIWT1_2_NLCA1_NLCB1_SU0_SUM0_SUS0_SVW1_VWA1_WG32_8_1_WGM1
    SolutionIndex: 179
    SolutionNameMin: Cijk_Alik_Bljk_S_MX_B_Bias_HA_SAV_UserArgs_MT32x64x64_MI32x32x1_SN_LDSB0_GRVWA4_GRVWB4_GSU8_LBSPPA256_LBSPPB256_LPA4_LPB4_MIWT1_1_NLCA1_NLCB1_SU0_SUM0_SUS0_SVW1_VWA1_WG32_4_2_WGM1
    SolutionIndex: 180
    SolutionNameMin: Cijk_Alik_Bljk_S_MX_B_Bias_HA_SAV_UserArgs_MT48x64x128_MI16x16x1_SN_LDSB1_GRVWA4_GRVWB4_GSU16_LBSPPA512_LBSPPB512_LPA8_LPB8_MIWT3_1_NLCA1_NLCB1_SU0_SUM0_SUS0_SVW1_VWA1_WG16_16_1_WGM1
    SolutionIndex: 181
    SolutionNameMin: Cijk_Alik_Bljk_S_MX_B_Bias_HA_SAV_UserArgs_MT128x32x64_MI16x16x1_SN_LDSB1_GRVWA4_GRVWB4_GSU16_LBSPPA512_LBSPPB256_LPA8_LPB8_LRVW4_MIAV1_MIWT2_2_NLCA1_NLCB1_SU0_SUM0_SUS0_SVW2_VWA2_WG64_4_1_WGM1
    SolutionIndex: 182
    SolutionNameMin: Cijk_Alik_Bljk_S_MX_B_Bias_HA_SAV_UserArgs_MT64x64x64_MI16x16x1_SN_LDSB1_GRVWA4_GRVWB4_GSU16_LBSPPA512_LBSPPB256_LPA8_LPB8_LRVW4_MIAV1_MIWT2_2_NLCA1_NLCB1_SU0_SUM0_SUS0_SVW2_VWA2_WG32_8_1_WGM1
    SolutionIndex: 183
    SolutionNameMin: Cijk_Alik_Bljk_S_MX_B_Bias_HA_SAV_UserArgs_MT96x64x64_MI16x16x1_SN_LDSB1_GRVWA4_GRVWB4_GSU16_LBSPPA256_LBSPPB256_LPA8_LPB8_LRVW4_MIAV1_MIWT3_2_NLCA1_NLCB1_SU0_SUM0_SUS0_SVW1_VWA1_WG32_8_1_WGM1
    SolutionIndex: 184
    SolutionNameMin: Cijk_Alik_Bljk_S_MX_B_Bias_HA_SAV_UserArgs_MT48x128x64_MI16x16x1_SN_LDSB1_GRVWA4_GRVWB4_GSU20_LBSPPA256_LBSPPB256_LPA8_LPB8_LRVW4_MIAV1_MIWT3_2_NLCA1_NLCB1_SU0_SUM0_SUS0_SVW1_VWA1_WG16_16_1_WGM1
    SolutionIndex: 185
    SolutionNameMin: Cijk_Alik_Bljk_S_MX_B_Bias_HA_SAV_UserArgs_MT16x32x128_MI16x16x1_SN_LDSB0_GRVWA4_GRVWB4_GSU1_LBSPPA512_LBSPPB512_LPA8_LPB8_LRVW4_MIAV1_MIWT1_1_SU0_SUM0_SUS0_SVW1_VWA1_WG16_8_1_WGM1
    SolutionIndex: 186
    SolutionNameMin: Cijk_Alik_Bljk_S_MX_B_Bias_HA_SAV_UserArgs_MT128x64x64_MI16x16x1_SN_LDSB1_GRVWA4_GRVWB4_GSU16_LBSPPA512_LBSPPB256_LPA8_LPB8_LRVW4_MIAV1_MIWT2_4_SU0_SUM0_SUS0_SVW2_VWA2_WG64_4_1_WGM1
    SolutionIndex: 187
    SolutionNameMin: Cijk_Alik_Bljk_S_MX_B_Bias_HA_SAV_UserArgs_MT32x32x128_MI16x16x1_SN_LDSB1_GRVWA4_GRVWB4_GSU1_LBSPPA512_LBSPPB512_LPA8_LPB8_LRVW4_MIAV1_MIWT1_2_SU0_SUM0_SUS0_SVW1_VWA1_WG32_4_2_WGM1
    SolutionIndex: 188
    SolutionNameMin: Cijk_Alik_Bljk_S_MX_B_Bias_HA_SAV_UserArgs_MT96x64x64_MI16x16x1_SN_LDSB1_GRVWA4_GRVWB4_GSU10_LBSPPA256_LBSPPB256_LPA8_LPB8_LRVW4_MIAV1_MIWT3_2_SU0_SUM0_SUS0_SVW1_VWA1_WG32_8_1_WGM1
    SolutionIndex: 189
    SolutionNameMin: Cijk_Alik_Bljk_S_MX_B_Bias_HA_SAV_UserArgs_MT96x128x64_MI16x16x1_SN_LDSB1_GRVWA4_GRVWB4_GSU19_LBSPPA256_LBSPPB256_LPA8_LPB8_LRVW4_MIAV1_MIWT3_4_SU0_SUM0_SUS0_SVW1_VWA1_WG32_8_1_WGM1
    SolutionIndex: 190
    SolutionNameMin: Cijk_Alik_Bljk_S_MX_B_Bias_HA_SAV_UserArgs_MT128x64x64_MI16x16x1_SN_GRVWA4_GRVWB4_GSU8_LBSPPA512_LBSPPB256_LPA8_LPB8_LRVW4_MIAV1_MIWT2_4_SU0_SUM0_SUS0_SVW2_VWA2_WG64_4_1_WGM1
    SolutionIndex: 191
    SolutionNameMin: Cijk_Alik_Bljk_S_MX_B_Bias_HA_SAV_UserArgs_MT64x128x64_MI16x16x1_SN_GRVWA4_GRVWB4_GSU8_LBSPPA1024_LBSPPB256_LPA8_LPB8_LRVW4_MIAV1_MIWT4_2_SU0_SUM0_SUS0_SVW4_VWA4_WG16_16_1_WGM1
    SolutionIndex: 192
    SolutionNameMin: Cijk_Alik_Bljk_S_MX_B_Bias_HA_SAV_UserArgs_MT32x48x128_MI16x16x1_SN_GRVWA4_GRVWB4_GSU1_LBSPPA512_LBSPPB512_LPA8_LPB8_LRVW4_MIAV1_MIWT1_3_SU0_SUM0_SUS0_SVW1_VWA1_WG32_4_2_WGM1
    SolutionIndex: 193
    SolutionNameMin: Cijk_Alik_Bljk_S_MX_B_Bias_HA_SAV_UserArgs_MT80x128x64_MI16x16x1_SN_GRVWA4_GRVWB4_GSU8_LBSPPA256_LBSPPB256_LPA8_LPB8_LRVW4_MIAV1_MIWT5_2_SU0_SUM0_SUS0_SVW1_VWA1_WG16_16_1_WGM1
    SolutionIndex: 194
    SolutionNameMin: Cijk_Alik_Bljk_S_MX_B_Bias_HA_SAV_UserArgs_MT192x128x32_MI32x32x1_SN_GRVWA1_GRVWB4_GSU19_LBSPPA128_LBSPPB128_LPA4_LPB4_LRVW4_MIAV0_MIWT3_2_SU0_SUM0_SUS0_SVW1_VWA1_WG64_4_1_WGM1
    SolutionIndex: 195
    SolutionNameMin: Cijk_Alik_Bljk_S_MX_B_Bias_HA_SAV_UserArgs_MT32x64x128_MI32x32x1_SN_CLR1_GRVWA4_GRVWB4_GSU1_LBSPPA512_LBSPPB512_LPA4_LPB4_LRVW4_MIAV1_MIWT1_1_PLR1_SU0_SUM0_SUS0_SVW1_VWA1_WG32_4_2_WGM1
    SolutionIndex: 196
    SolutionNameMin: Cijk_Alik_Bljk_S_MX_B_Bias_HA_SAV_UserArgs_MT80x128x64_MI16x16x1_SN_CLR1_GRVWA4_GRVWB4_GSU6_LBSPPA256_LBSPPB256_LPA8_LPB8_LRVW4_MIAV1_MIWT5_2_PLR1_SU0_SUM0_SUS0_SVW1_VWA1_WG16_16_1_WGM1
    SolutionIndex: 197
    SolutionNameMin: Cijk_Alik_Bljk_S_MX_B_Bias_HA_SAV_UserArgs_MT96x128x64_MI16x16x1_SN_CLR1_GRVWA1_GRVWB4_GSU7_LBSPPA256_LBSPPB256_LPA8_LPB8_LRVW4_MIAV1_MIWT3_4_PLR1_SU0_SUM0_SUS0_SVW1_VWA1_WG32_8_1_WGM1
    SolutionIndex: 198
    SolutionNameMin: Cijk_Alik_Bljk_S_MX_B_Bias_HA_SAV_UserArgs_MT96x128x64_MI16x16x1_SN_CLR1_GRVWA4_GRVWB4_GSU5_LBSPPA256_LBSPPB256_LPA8_LPB8_LRVW4_MIAV1_MIWT3_4_PLR1_SU0_SUM0_SUS0_SVW1_VWA1_WG32_8_1_WGM1
    SolutionIndex: 199
    SolutionNameMin: Cijk_Alik_Bljk_S_MX_B_Bias_HA_SAV_UserArgs_MT96x128x64_MI16x16x1_SN_CLR1_GRVWA1_GRVWB4_GSU5_LBSPPA256_LBSPPB256_LPA8_LPB8_LRVW4_MIAV1_MIWT3_4_PLR1_SU0_SUM0_SUS0_SVW1_VWA1_WG32_8_1_WGM1
    SolutionIndex: 200
    SolutionNameMin: Cijk_Alik_Bljk_S_MX_B_Bias_HA_SAV_UserArgs_MT64x64x64_MI16x16x1_SN_CLR1_GRVWA4_GRVWB4_GSU1_LBSPPA1024_LBSPPB256_LPA8_LPB8_LRVW4_MIAV1_MIWT4_2_PLR1_SU0_SUM0_SUS0_SVW4_VWA4_WG16_8_2_WGM1
    SolutionIndex: 201
    SolutionNameMin: Cijk_Alik_Bljk_S_MX_B_Bias_HA_SAV_UserArgs_MT192x128x32_MI32x32x1_SN_CLR1_GRVWA1_GRVWB4_GSU7_LBSPPA128_LBSPPB128_LPA4_LPB4_LRVW4_MIAV0_MIWT3_2_PLR1_SU0_SUM0_SUS0_SVW1_VWA1_WG64_4_1_WGM1
    SolutionIndex: 202
    SolutionNameMin: Cijk_Alik_Bljk_S_MX_B_Bias_HA_SAV_UserArgs_MT256x128x32_MI32x32x1_SN_CLR1_GRVWA1_GRVWB4_GSU10_LBSPPA512_LBSPPB128_LPA4_LPB4_LRVW4_MIAV0_MIWT4_2_PLR1_SU0_SUM0_SUS0_SVW4_VWA4_WG64_4_1_WGM1
    SolutionIndex: 203
    SolutionNameMin: Cijk_Alik_Bljk_S_MX_B_Bias_HA_SAV_UserArgs_MT128x48x64_MI16x16x1_SN_CLR1_GRVWA4_GRVWB4_GSU1_LBSPPA1024_LBSPPB256_LPA8_LPB8_LRVW4_MIAV1_MIWT4_3_PLR1_SU0_SUM0_SUS0_SVW4_VWA4_WG32_4_2_WGM1
    SolutionIndex: 204
    SolutionNameMin: Cijk_Alik_Bljk_S_MX_B_Bias_HA_SAV_UserArgs_MT192x128x32_MI32x32x1_SN_CLR1_GRVWA1_GRVWB4_GSU5_LBSPPA128_LBSPPB128_LPA4_LPB4_LRVW4_MIAV0_MIWT3_2_PLR1_SU0_SUM0_SUS0_SVW1_VWA1_WG64_4_1_WGM1
    SolutionIndex: 205
    SolutionNameMin: Cijk_Alik_Bljk_S_MX_B_Bias_HA_SAV_UserArgs_MT320x128x32_MI32x32x1_SN_CLR1_GRVWA1_GRVWB4_GSU8_LBSPPA128_LBSPPB128_LPA4_LPB4_LRVW4_MIAV0_MIWT5_2_PLR1_SU0_SUM0_SUS0_SVW1_VWA1_WG64_4_1_WGM1
    SolutionIndex: 206
    SolutionNameMin: Cijk_Alik_Bljk_S_MX_B_Bias_HA_SAV_UserArgs_MT256x128x32_MI16x16x1_SN_CLR1_GRVWA1_GRVWB4_GSU5_LBSPPA512_LBSPPB128_LPA8_LPB8_LRVW4_MIAV0_MIWT8_4_NTA4_PLR1_SU0_SUM0_SUS0_SVW4_VWA4_WG32_8_1_WGM1
    SolutionIndex: 207
    SolutionNameMin: Cijk_Alik_Bljk_S_MX_B_Bias_HA_SAV_UserArgs_MT80x128x64_MI16x16x1_SN_CLR1_GRVWA4_GRVWB4_GSU1_LBSPPA256_LBSPPB256_LPA8_LPB8_LRVW4_MIAV1_MIWT5_2_NTA0_PLR1_SU0_SUM0_SUS0_SVW1_VWA1_WG16_16_1_WGM1
    SolutionIndex: 208
    SolutionNameMin: Cijk_Alik_Bljk_S_MX_B_Bias_HA_SAV_UserArgs_MT320x128x32_MI32x32x1_SN_CLR1_GRVWA1_GRVWB4_GSU4_LBSPPA128_LBSPPB128_LPA4_LPB4_LRVW4_MIAV0_MIWT5_2_NTA4_PLR1_SU0_SUM0_SUS0_SVW1_VWA1_WG64_4_1_WGM1
    SolutionIndex: 209
    SolutionNameMin: Cijk_Alik_Bljk_S_MX_B_Bias_HA_SAV_UserArgs_MT128x128x32_MI16x16x1_SN_GRVWA4_GRVWB4_GSU1_LBSPPA256_LBSPPB128_LPA8_LPB8_LRVW4_MIAV1_MIWT2_8_NTA0_NTC3_NTD3_SU0_SUM0_SUS0_SVW2_VWA2_WG64_4_1_WGM1
    SolutionIndex: 210
    SolutionNameMin: Cijk_Alik_Bljk_S_MX_B_Bias_HA_SAV_UserArgs_MT112x128x32_MI16x16x1_SN_GRVWA1_GRVWB4_GSU1_LBSPPA128_LBSPPB128_LPA8_LPB8_LRVW4_MIAV1_MIWT7_2_NTA4_NTC3_NTD3_SU0_SUM0_SUS0_SVW1_VWA1_WG16_16_1_WGM1
    SolutionIndex: 211
    SolutionNameMin: Cijk_Alik_Bljk_S_MX_B_Bias_HA_SAV_UserArgs_MT224x128x32_MI16x16x1_SN_GRVWA1_GRVWB4_GSU2_LBSPPA128_LBSPPB128_LPA8_LPB8_LRVW4_MIAV0_MIWT7_4_NTA4_NTC0_NTD0_SU0_SUM0_SUS0_SVW1_VWA1_WG32_8_1_WGM1
    SolutionIndex: 212
    SolutionNameMin: Cijk_Alik_Bljk_S_MX_B_Bias_HA_SAV_UserArgs_MT160x128x32_MI16x16x1_SN_GRVWA1_GRVWB4_GSU1_LBSPPA128_LBSPPB128_LPA8_LPB8_LRVW4_MIAV1_MIWT5_4_NTA0_NTC3_NTD3_SU0_SUM0_SUS0_SVW1_VWA1_WG32_8_1_WGM1
    SolutionIndex: 213
    SolutionNameMin: Cijk_Alik_Bljk_S_MX_B_Bias_HA_SAV_UserArgs_MT160x128x32_MI16x16x1_SN_GRVWA1_GRVWB4_GSU1_LBSPPA128_LBSPPB128_LPA8_LPB8_LRVW4_MIAV1_MIWT5_4_NTA4_NTC3_NTD3_SU0_SUM0_SUS0_SVW1_VWA1_WG32_8_1_WGM1
    SolutionIndex: 214
    SolutionNameMin: Cijk_Alik_Bljk_S_MX_B_Bias_HA_SAV_UserArgs_MT320x128x32_MI32x32x1_SN_GRVWA1_GRVWB4_GSU2_LBSPPA128_LBSPPB128_LPA4_LPB4_LRVW4_MIAV0_MIWT5_2_NTA4_NTC3_NTD3_SU0_SUM0_SUS0_SVW1_VWA1_WG64_4_1_WGM1
    SolutionIndex: 215
    SolutionNameMin: Cijk_Alik_Bljk_S_MX_B_Bias_HA_SAV_UserArgs_MT256x128x32_MI32x32x1_SN_GRVWA4_GRVWB4_GSU1_LBSPPA512_LBSPPB128_LPA4_LPB4_LRVW4_MIAV0_MIWT4_2_NTA4_NTC3_NTD3_SU0_SUM0_SUS0_SVW4_VWA4_WG64_4_1_WGM1
    SolutionIndex: 216
    SolutionNameMin: Cijk_Alik_Bljk_S_MX_B_Bias_HA_SAV_UserArgs_MT208x128x32_MI16x16x1_SN_GRVWA1_GRVWB4_GSU1_LBSPPA128_LBSPPB128_LPA8_LPB8_LRVW4_MIAV0_MIWT13_2_NTA4_NTC3_NTD3_SU0_SUM0_SUS0_SVW1_VWA1_WG16_16_1_WGM1
    SolutionIndex: 217
    SolutionNameMin: Cijk_Alik_Bljk_S_MX_B_Bias_HA_SAV_UserArgs_MT224x128x32_MI16x16x1_SN_GRVWA1_GRVWB4_GSU1_LBSPPA128_LBSPPB128_LPA8_LPB8_LRVW4_MIAV0_MIWT7_4_NTA4_NTC0_NTD0_SU0_SUM0_SUS0_SVW1_VWA1_WG32_8_1_WGM1
    SolutionIndex: 218
    SolutionNameMin: Cijk_Alik_Bljk_S_MX_B_Bias_HA_SAV_UserArgs_MT256x128x32_MI32x32x1_SN_GRVWA1_GRVWB4_GSU1_LBSPPA512_LBSPPB128_LPA4_LPB4_LRVW4_MIAV0_MIWT4_2_NTA4_NTC3_NTD3_SU0_SUM0_SUS0_SVW4_VWA4_WG64_4_1_WGM1
    SolutionIndex: 219
    SolutionNameMin: Cijk_Alik_Bljk_S_MX_B_Bias_HA_SAV_UserArgs_MT256x128x32_MI16x16x1_SN_GRVWA1_GRVWB4_GSU1_LBSPPA512_LBSPPB128_LPA8_LPB8_LRVW4_MIAV0_MIWT8_4_NTA4_NTC3_NTD3_SU0_SUM0_SUS0_SVW4_VWA4_WG32_8_1_WGM1
    SolutionIndex: 220
    SolutionNameMin: Cijk_Alik_Bljk_S_MX_B_Bias_HA_SAV_UserArgs_MT320x128x32_MI32x32x1_SN_GRVWA4_GRVWB4_GSU1_LBSPPA128_LBSPPB128_LPA4_LPB4_LRVW4_MIAV0_MIWT5_2_NTA4_NTC3_NTD3_SU0_SUM0_SUS0_SVW1_VWA1_WG64_4_1_WGM1
    SolutionIndex: 221
    SolutionNameMin: Cijk_Alik_Bljk_S_MX_B_Bias_HA_SAV_UserArgs_MT320x128x32_MI32x32x1_SN_GRVWA1_GRVWB4_GSU1_LBSPPA128_LBSPPB128_LPA4_LPB4_LRVW4_MIAV0_MIWT5_2_NTA4_NTC3_NTD3_SU0_SUM0_SUS0_SVW1_VWA1_WG64_4_1_WGM1
    SolutionIndex: 222
    SolutionNameMin: Cijk_Alik_Bljk_S_MX_B_Bias_HA_SAV_UserArgs_MT320x128x32_MI32x32x1_SN_GRVWA1_GRVWB4_GSU1_LBSPPA128_LBSPPB128_LPA4_LPB4_LRVW4_MIAV0_MIWT5_2_NTA4_NTC0_NTD0_SU0_SUM0_SUS0_SVW1_VWA1_WG64_4_1_WGM1
    SolutionIndex: 223
    SolutionNameMin: Cijk_Alik_Bljk_S_MX_B_Bias_HA_SAV_UserArgs_MT16x32x128_MI16x16x1_SN_LDSB0_GRVWA4_GRVWB4_GSU11_LBSPPA512_LBSPPB512_LPA8_LPB8_MIWT1_1_NLCA1_NLCB1_SU0_SUM0_SUS0_SVW1_VWA1_WG16_8_2_WGM1
    SolutionIndex: 224
    SolutionNameMin: Cijk_Alik_Bljk_S_MX_B_Bias_HA_SAV_UserArgs_MT16x32x256_MI16x16x1_SN_LDSB1_GRVWA4_GRVWB4_GSU13_LBSPPA1024_LBSPPB1024_LPA8_LPB8_MIWT1_1_NLCA1_NLCB1_SU0_SUM0_SUS0_SVW1_VWA1_WG16_8_2_WGM1
    SolutionIndex: 225
    SolutionNameMin: Cijk_Alik_Bljk_S_MX_B_Bias_HA_SAV_UserArgs_MT64x48x64_MI16x16x1_SN_LDSB0_GRVWA4_GRVWB4_GSU16_LBSPPA256_LBSPPB256_LPA8_LPB8_LRVW4_MIWT1_3_NLCA1_NLCB1_SU0_SUM0_SUS0_SVW1_VWA1_WG64_4_1_WGM1
    SolutionIndex: 226
    SolutionNameMin: Cijk_Alik_Bljk_S_MX_B_Bias_HA_SAV_UserArgs_MT64x64x64_MI16x16x1_SN_LDSB1_GRVWA4_GRVWB4_GSU21_LBSPPA512_LBSPPB256_LPA8_LPB8_LRVW4_MIWT2_2_NLCA1_NLCB1_SU0_SUM0_SUS0_SVW2_VWA2_WG32_8_1_WGM1
    SolutionIndex: 227
    SolutionNameMin: Cijk_Alik_Bljk_S_MX_B_Bias_HA_SAV_UserArgs_MT48x64x64_MI16x16x1_SN_LDSB0_GRVWA4_GRVWB4_GSU11_LBSPPA256_LBSPPB256_LPA8_LPB8_LRVW4_MIWT3_1_NLCA1_NLCB1_SU0_SUM0_SUS0_SVW1_VWA1_WG16_16_1_WGM1
    SolutionIndex: 228
    SolutionNameMin: Cijk_Alik_Bljk_S_MX_B_Bias_HA_SAV_UserArgs_MT96x64x64_MI16x16x1_SN_LDSB1_GRVWA4_GRVWB4_GSU21_LBSPPA256_LBSPPB256_LPA8_LPB8_LRVW4_MIWT3_2_NLCA1_NLCB1_SU0_SUM0_SUS0_SVW1_VWA1_WG32_8_1_WGM1
    SolutionIndex: 229
    SolutionNameMin: Cijk_Alik_Bljk_S_MX_B_Bias_HA_SAV_UserArgs_MT64x96x64_MI16x16x1_SN_LDSB1_GRVWA4_GRVWB4_GSU16_LBSPPA512_LBSPPB256_LPA8_LPB8_LRVW4_MIAV1_MIWT2_3_NLCA1_NLCB1_SU0_SUM0_SUS0_SVW2_VWA2_WG32_8_1_WGM1
    SolutionIndex: 230
    SolutionNameMin: Cijk_Alik_Bljk_S_MX_B_Bias_HA_SAV_UserArgs_MT96x96x64_MI16x16x1_SN_LDSB1_GRVWA4_GRVWB4_GSU16_LBSPPA256_LBSPPB256_LPA8_LPB8_LRVW4_MIAV1_MIWT3_3_NLCA1_NLCB1_SU0_SUM0_SUS0_SVW1_VWA1_WG32_8_1_WGM1
    SolutionIndex: 231
    SolutionNameMin: Cijk_Alik_Bljk_S_MX_B_Bias_HA_SAV_UserArgs_MT32x32x128_MI16x16x1_SN_LDSB1_GRVWA4_GRVWB4_GSU1_LBSPPA1024_LBSPPB512_LPA8_LPB8_LRVW4_MIAV1_MIWT2_1_SU0_SUM0_SUS0_SVW2_VWA2_WG16_8_2_WGM1
    SolutionIndex: 232
    SolutionNameMin: Cijk_Alik_Bljk_S_MX_B_Bias_HA_SAV_UserArgs_MT128x64x64_MI16x16x1_SN_LDSB1_GRVWA4_GRVWB4_GSU10_LBSPPA512_LBSPPB256_LPA8_LPB8_LRVW4_MIAV1_MIWT2_4_SU0_SUM0_SUS0_SVW2_VWA2_WG64_4_1_WGM1
    SolutionIndex: 233
    SolutionNameMin: Cijk_Alik_Bljk_S_MX_B_Bias_HA_SAV_UserArgs_MT128x96x64_MI16x16x1_SN_LDSB1_GRVWA4_GRVWB4_GSU15_LBSPPA1024_LBSPPB256_LPA8_LPB8_LRVW4_MIAV1_MIWT4_3_SU0_SUM0_SUS0_SVW4_VWA4_WG32_8_1_WGM1
    SolutionIndex: 234
    SolutionNameMin: Cijk_Alik_Bljk_S_MX_B_Bias_HA_SAV_UserArgs_MT96x96x64_MI16x16x1_SN_LDSB1_GRVWA4_GRVWB4_GSU10_LBSPPA256_LBSPPB256_LPA8_LPB8_LRVW4_MIAV1_MIWT3_3_SU0_SUM0_SUS0_SVW1_VWA1_WG32_8_1_WGM1
    SolutionIndex: 235
    SolutionNameMin: Cijk_Alik_Bljk_S_MX_B_Bias_HA_SAV_UserArgs_MT128x64x64_MI16x16x1_SN_CLR1_GRVWA4_GRVWB4_GSU6_LBSPPA512_LBSPPB256_LPA8_LPB8_LRVW4_MIAV1_MIWT2_4_PLR1_SU0_SUM0_SUS0_SVW2_VWA2_WG64_4_1_WGM1
    SolutionIndex: 236
    SolutionNameMin: Cijk_Alik_Bljk_S_MX_B_Bias_HA_SAV_UserArgs_MT128x96x64_MI16x16x1_SN_CLR1_GRVWA4_GRVWB4_GSU9_LBSPPA1024_LBSPPB256_LPA8_LPB8_LRVW4_MIAV1_MIWT4_3_PLR1_SU0_SUM0_SUS0_SVW4_VWA4_WG32_8_1_WGM1
    SolutionIndex: 237
    SolutionNameMin: Cijk_Alik_Bljk_S_MX_B_Bias_HA_SAV_UserArgs_MT128x96x64_MI16x16x1_SN_CLR1_GRVWA4_GRVWB4_GSU8_LBSPPA1024_LBSPPB256_LPA8_LPB8_LRVW4_MIAV1_MIWT4_3_PLR1_SU0_SUM0_SUS0_SVW4_VWA4_WG32_8_1_WGM1
    SolutionIndex: 238
    SolutionNameMin: Cijk_Alik_Bljk_S_MX_B_Bias_HA_SAV_UserArgs_MT256x192x32_MI16x16x1_SN_CLR1_GRVWA1_GRVWB4_GSU19_LBSPPA512_LBSPPB128_LPA8_LPB8_LRVW4_MIAV0_MIWT8_6_PLR1_SU0_SUM0_SUS0_SVW4_VWA4_WG32_8_1_WGM1
    SolutionIndex: 239
    SolutionNameMin: Cijk_Alik_Bljk_S_MX_B_Bias_HA_SAV_UserArgs_MT192x192x32_MI32x32x1_SN_CLR1_GRVWA4_GRVWB4_GSU10_LBSPPA128_LBSPPB128_LPA4_LPB4_LRVW4_MIAV0_MIWT3_3_PLR1_SU0_SUM0_SUS0_SVW1_VWA1_WG64_4_1_WGM1
    SolutionIndex: 240
    SolutionNameMin: Cijk_Alik_Bljk_S_MX_B_Bias_HA_SAV_UserArgs_MT256x192x32_MI16x16x1_SN_CLR1_GRVWA1_GRVWB4_GSU13_LBSPPA512_LBSPPB128_LPA8_LPB8_LRVW4_MIAV0_MIWT8_6_PLR1_SU0_SUM0_SUS0_SVW4_VWA4_WG32_8_1_WGM1
    SolutionIndex: 241
    SolutionNameMin: Cijk_Alik_Bljk_S_MX_B_Bias_HA_SAV_UserArgs_MT64x96x64_MI16x16x1_SN_CLR1_GRVWA4_GRVWB4_GSU1_LBSPPA1024_LBSPPB256_LPA8_LPB8_LRVW4_MIAV1_MIWT4_3_PLR1_SU0_SUM0_SUS0_SVW4_VWA4_WG16_8_2_WGM1
    SolutionIndex: 242
    SolutionNameMin: Cijk_Alik_Bljk_S_MX_B_Bias_HA_SAV_UserArgs_MT192x192x32_MI16x16x1_SN_CLR1_GRVWA1_GRVWB4_GSU7_LBSPPA256_LBSPPB128_LPA8_LPB8_LRVW4_MIAV0_MIWT6_6_PLR1_SU0_SUM0_SUS0_SVW2_VWA2_WG32_8_1_WGM1
    SolutionIndex: 243
    SolutionNameMin: Cijk_Alik_Bljk_S_MX_B_Bias_HA_SAV_UserArgs_MT256x192x32_MI16x16x1_SN_CLR1_GRVWA1_GRVWB4_GSU10_LBSPPA512_LBSPPB128_LPA8_LPB8_LRVW4_MIAV0_MIWT8_6_PLR1_SU0_SUM0_SUS0_SVW4_VWA4_WG32_8_1_WGM1
    SolutionIndex: 244
    SolutionNameMin: Cijk_Alik_Bljk_S_MX_B_Bias_HA_SAV_UserArgs_MT128x64x64_MI16x16x1_SN_CLR1_GRVWA4_GRVWB4_GSU1_LBSPPA1024_LBSPPB256_LPA8_LPB8_LRVW4_MIAV1_MIWT4_4_PLR1_SU0_SUM0_SUS0_SVW4_VWA4_WG32_4_2_WGM1
    SolutionIndex: 245
    SolutionNameMin: Cijk_Alik_Bljk_S_MX_B_Bias_HA_SAV_UserArgs_MT192x192x32_MI16x16x1_SN_CLR1_GRVWA1_GRVWB4_GSU5_LBSPPA256_LBSPPB128_LPA8_LPB8_LRVW4_MIAV0_MIWT6_6_PLR1_SU0_SUM0_SUS0_SVW2_VWA2_WG32_8_1_WGM1
    SolutionIndex: 246
    SolutionNameMin: Cijk_Alik_Bljk_S_MX_B_Bias_HA_SAV_UserArgs_MT256x192x32_MI16x16x1_SN_GRVWA4_GRVWB4_GSU5_LBSPPA512_LBSPPB128_LPA8_LPB8_LRVW4_MIAV0_MIWT8_6_NTA4_SU0_SUM0_SUS0_SVW4_VWA4_WG32_8_1_WGM1
    SolutionIndex: 247
    SolutionNameMin: Cijk_Alik_Bljk_S_MX_B_Bias_HA_SAV_UserArgs_MT256x192x32_MI16x16x1_SN_GRVWA1_GRVWB4_GSU5_LBSPPA512_LBSPPB128_LPA8_LPB8_LRVW4_MIAV0_MIWT8_6_NTA4_SU0_SUM0_SUS0_SVW4_VWA4_WG32_8_1_WGM1
    SolutionIndex: 248
    SolutionNameMin: Cijk_Alik_Bljk_S_MX_B_Bias_HA_SAV_UserArgs_MT256x64x32_MI16x16x1_SN_GRVWA4_GRVWB4_GSU1_LBSPPA512_LBSPPB128_LPA8_LPB8_LRVW4_MIAV1_MIWT4_4_NTA0_SU0_SUM0_SUS0_SVW4_VWA4_WG64_4_1_WGM1
    SolutionIndex: 249
    SolutionNameMin: Cijk_Alik_Bljk_S_MX_B_Bias_HA_SAV_UserArgs_MT160x96x32_MI16x16x1_SN_GRVWA4_GRVWB4_GSU1_LBSPPA128_LBSPPB128_LPA8_LPB8_LRVW4_MIAV1_MIWT5_3_NTA0_SU0_SUM0_SUS0_SVW1_VWA1_WG32_8_1_WGM1
    SolutionIndex: 250
    SolutionNameMin: Cijk_Alik_Bljk_S_MX_B_Bias_HA_SAV_UserArgs_MT256x192x32_MI16x16x1_SN_GRVWA1_GRVWB4_GSU3_LBSPPA512_LBSPPB128_LPA8_LPB8_LRVW4_MIAV0_MIWT8_6_NTA4_SU0_SUM0_SUS0_SVW4_VWA4_WG32_8_1_WGM1
    SolutionIndex: 251
    SolutionNameMin: Cijk_Alik_Bljk_S_MX_B_Bias_HA_SAV_UserArgs_MT112x192x32_MI16x16x1_SN_GRVWA1_GRVWB4_GSU1_LBSPPA128_LPA8_LPB8_LRVW4_MIAV1_MIWT7_3_NTA0_NTC3_NTD3_SU0_SUM0_SUS0_SVW1_VWA1_WG16_16_1_WGM1
    SolutionIndex: 252
    SolutionNameMin: Cijk_Alik_Bljk_S_MX_B_Bias_HA_SAV_UserArgs_MT112x192x32_MI16x16x1_SN_GRVWA1_GRVWB4_GSU1_LBSPPA128_LPA8_LPB8_LRVW4_MIAV1_MIWT7_3_NTA4_NTC3_NTD3_SU0_SUM0_SUS0_SVW1_VWA1_WG16_16_1_WGM1
    SolutionIndex: 253
    SolutionNameMin: Cijk_Alik_Bljk_S_MX_B_Bias_HA_SAV_UserArgs_MT224x192x32_MI16x16x1_SN_GRVWA1_GRVWB4_GSU2_LBSPPA256_LPA8_LPB8_LRVW4_MIAV0_MIWT14_3_NTA4_NTC3_NTD3_SU0_SUM0_SUS0_SVW2_VWA2_WG16_16_1_WGM1
    SolutionIndex: 254
    SolutionNameMin: Cijk_Alik_Bljk_S_MX_B_Bias_HA_SAV_UserArgs_MT192x192x32_MI16x16x1_SN_GRVWA4_GRVWB4_GSU1_LBSPPA512_LPA8_LPB8_LRVW4_MIAV0_MIWT12_3_NTA4_NTC3_NTD3_SU0_SUM0_SUS0_SVW4_VWA4_WG16_16_1_WGM1
    SolutionIndex: 255
    SolutionNameMin: Cijk_Alik_Bljk_S_MX_B_Bias_HA_SAV_UserArgs_MT160x192x32_MI16x16x1_SN_GRVWA1_GRVWB4_GSU1_LBSPPA128_LPA8_LPB8_LRVW4_MIAV0_MIWT5_6_NTA4_NTC3_NTD3_SU0_SUM0_SUS0_SVW1_VWA1_WG32_8_1_WGM1
    SolutionIndex: 256
    SolutionNameMin: Cijk_Alik_Bljk_S_MX_B_Bias_HA_SAV_UserArgs_MT256x192x32_MI32x32x1_SN_GRVWA4_GRVWB4_GSU1_LBSPPA512_LPA4_LPB4_LRVW4_MIAV0_MIWT4_3_NTA4_NTC3_NTD3_SU0_SUM0_SUS0_SVW4_VWA4_WG64_4_1_WGM1
    SolutionIndex: 257
    SolutionNameMin: Cijk_Alik_Bljk_S_MX_B_Bias_HA_SAV_UserArgs_MT208x192x32_MI16x16x1_SN_GRVWA1_GRVWB4_GSU1_LBSPPA128_LPA8_LPB8_LRVW4_MIAV0_MIWT13_3_NTA4_NTC3_NTD3_SU0_SUM0_SUS0_SVW1_VWA1_WG16_16_1_WGM1
    SolutionIndex: 258
    SolutionNameMin: Cijk_Alik_Bljk_S_MX_B_Bias_HA_SAV_UserArgs_MT208x192x32_MI16x16x1_SN_GRVWA1_GRVWB4_GSU1_LBSPPA128_LPA8_LPB8_LRVW4_MIAV0_MIWT13_3_NTA4_NTC0_NTD0_SU0_SUM0_SUS0_SVW1_VWA1_WG16_16_1_WGM1
    SolutionIndex: 259
    SolutionNameMin: Cijk_Alik_Bljk_S_MX_B_Bias_HA_SAV_UserArgs_MT256x192x32_MI16x16x1_SN_GRVWA1_GRVWB4_GSU1_LBSPPA512_LPA8_LPB8_LRVW4_MIAV0_MIWT8_6_NTA4_NTC3_NTD3_SU0_SUM0_SUS0_SVW4_VWA4_WG32_8_1_WGM1
    SolutionIndex: 260
    SolutionNameMin: Cijk_Alik_Bljk_S_MX_B_Bias_HA_SAV_UserArgs_MT192x192x16_MI16x16x1_SN_GRVWA1_GRVWB4_GSU1_LBSPPA256_LPA2_LPB4_LRVW2_MIAV0_MIWT12_3_NTA0_NTC3_NTD3_SU0_SUM0_SUS0_SVW4_VWA4_WG16_16_1_WGM1
    SolutionIndex: 261
    SolutionNameMin: Cijk_Alik_Bljk_S_MX_B_Bias_HA_SAV_UserArgs_MT160x192x32_MI16x16x1_SN_GRVWA1_GRVWB4_GSU1_LBSPPA128_LPA8_LPB8_LRVW4_MIAV0_MIWT5_6_NTA4_NTC0_NTD0_SU0_SUM0_SUS0_SVW1_VWA1_WG32_8_1_WGM1
    SolutionIndex: 262
    SolutionNameMin: Cijk_Alik_Bljk_S_MX_B_Bias_HA_SAV_UserArgs_MT256x192x32_MI32x32x1_SN_GRVWA4_GRVWB4_GSU1_LBSPPA512_LPA4_LPB4_LRVW4_MIAV0_MIWT4_3_NTA0_NTC3_NTD3_SU0_SUM0_SUS0_SVW4_VWA4_WG64_4_1_WGM1
    SolutionIndex: 263
    SolutionNameMin: Cijk_Alik_Bljk_S_MX_B_Bias_HA_SAV_UserArgs_MT16x64x64_MI16x16x1_SN_LDSB0_GRVWA4_GRVWB4_GSU16_LBSPPA256_LBSPPB256_LPA8_LPB8_LRVW4_MIWT1_1_NLCA1_NLCB1_SU0_SUM0_SUS0_SVW1_VWA1_WG16_16_1_WGM1
    SolutionIndex: 264
    SolutionNameMin: Cijk_Alik_Bljk_S_MX_B_Bias_HA_SAV_UserArgs_MT16x64x128_MI16x16x1_SN_LDSB1_GRVWA4_GRVWB4_GSU16_LBSPPA512_LBSPPB512_LPA8_LPB8_LRVW4_MIWT1_1_NLCA1_NLCB1_SU0_SUM0_SUS0_SVW1_VWA1_WG16_16_1_WGM1
    SolutionIndex: 265
    SolutionNameMin: Cijk_Alik_Bljk_S_MX_B_Bias_HA_SAV_UserArgs_MT32x64x64_MI16x16x1_SN_LDSB0_GRVWA4_GRVWB4_GSU16_LBSPPA256_LBSPPB256_LPA8_LPB8_LRVW4_MIWT1_2_NLCA1_NLCB1_SU0_SUM0_SUS0_SVW1_VWA1_WG32_8_1_WGM1
    SolutionIndex: 266
    SolutionNameMin: Cijk_Alik_Bljk_S_MX_B_Bias_HA_SAV_UserArgs_MT16x64x128_MI16x16x1_SN_LDSB1_GRVWA4_GRVWB4_GSU11_LBSPPA512_LBSPPB512_LPA8_LPB8_LRVW4_MIWT1_1_NLCA1_NLCB1_SU0_SUM0_SUS0_SVW1_VWA1_WG16_16_1_WGM1
    SolutionIndex: 267
    SolutionNameMin: Cijk_Alik_Bljk_S_MX_B_Bias_HA_SAV_UserArgs_MT16x64x128_MI16x16x1_SN_LDSB1_GRVWA4_GRVWB4_GSU13_LBSPPA512_LBSPPB512_LPA8_LPB8_LRVW4_MIWT1_1_NLCA1_NLCB1_SU0_SUM0_SUS0_SVW1_VWA1_WG16_16_1_WGM1
    SolutionIndex: 268
    SolutionNameMin: Cijk_Alik_Bljk_S_MX_B_Bias_HA_SAV_UserArgs_MT32x96x64_MI16x16x1_SN_LDSB1_GRVWA4_GRVWB4_GSU16_LBSPPA256_LBSPPB256_LPA8_LPB8_LRVW4_MIWT1_3_NLCA1_NLCB1_SU0_SUM0_SUS0_SVW1_VWA1_WG32_8_1_WGM1
    SolutionIndex: 269
    SolutionNameMin: Cijk_Alik_Bljk_S_MX_B_Bias_HA_SAV_UserArgs_MT32x96x64_MI16x16x1_SN_LDSB1_GRVWA4_GRVWB4_GSU19_LBSPPA256_LBSPPB256_LPA8_LPB8_LRVW4_MIWT1_3_NLCA1_NLCB1_SU0_SUM0_SUS0_SVW1_VWA1_WG32_8_1_WGM1
    SolutionIndex: 270
    SolutionNameMin: Cijk_Alik_Bljk_S_MX_B_Bias_HA_SAV_UserArgs_MT32x16x128_MI16x16x1_SN_LDSB0_GRVWA4_GRVWB4_GSU1_LBSPPA512_LBSPPB512_LPA8_LPB8_LRVW4_MIAV1_MIWT1_1_NLCA1_NLCB1_SU0_SUM0_SUS0_SVW1_VWA1_WG32_4_2_WGM1
    SolutionIndex: 271
    SolutionNameMin: Cijk_Alik_Bljk_S_MX_B_Bias_HA_SAV_UserArgs_MT64x64x64_MI32x32x1_SN_LDSB1_GRVWA4_GRVWB4_GSU14_LBSPPA256_LBSPPB256_LPA4_LPB4_LRVW4_MIAV1_MIWT1_1_NLCA1_NLCB1_SU0_SUM0_SUS0_SVW1_VWA1_WG64_4_1_WGM1
    SolutionIndex: 272
    SolutionNameMin: Cijk_Alik_Bljk_S_MX_B_Bias_HA_SAV_UserArgs_MT64x64x64_MI32x32x1_SN_LDSB1_GRVWA4_GRVWB4_GSU15_LBSPPA256_LBSPPB256_LPA4_LPB4_LRVW4_MIAV1_MIWT1_1_NLCA1_NLCB1_SU0_SUM0_SUS0_SVW1_VWA1_WG64_4_1_WGM1
    SolutionIndex: 273
    SolutionNameMin: Cijk_Alik_Bljk_S_MX_B_Bias_HA_SAV_UserArgs_MT64x64x64_MI32x32x1_SN_LDSB1_GRVWA4_GRVWB4_GSU10_LBSPPA256_LBSPPB256_LPA4_LPB4_LRVW4_MIAV1_MIWT1_1_NLCA1_NLCB1_SU0_SUM0_SUS0_SVW1_VWA1_WG64_4_1_WGM1
    SolutionIndex: 274
    SolutionNameMin: Cijk_Alik_Bljk_S_MX_B_Bias_HA_SAV_UserArgs_MT64x128x64_MI16x16x1_SN_LDSB1_GRVWA4_GRVWB4_GSU19_LBSPPA1024_LBSPPB256_LPA8_LPB8_LRVW4_MIAV1_MIWT4_2_NLCA1_NLCB1_SU0_SUM0_SUS0_SVW4_VWA4_WG16_16_1_WGM1
    SolutionIndex: 275
    SolutionNameMin: Cijk_Alik_Bljk_S_MX_B_Bias_HA_SAV_UserArgs_MT16x32x256_MI16x16x1_SN_LDSB1_GRVWA4_GRVWB4_GSU1_LBSPPA1024_LBSPPB1024_LPA8_LPB8_LRVW4_MIAV1_MIWT1_1_NLCA1_NLCB1_SU0_SUM0_SUS0_SVW1_VWA1_WG16_8_2_WGM1
    SolutionIndex: 276
    SolutionNameMin: Cijk_Alik_Bljk_S_MX_B_Bias_HA_SAV_UserArgs_MT64x48x64_MI16x16x1_SN_LDSB0_GRVWA4_GRVWB4_GSU10_LBSPPA256_LBSPPB256_LPA8_LPB8_LRVW4_MIAV1_MIWT1_3_NLCA1_NLCB1_SU0_SUM0_SUS0_SVW1_VWA1_WG64_4_1_WGM1
    SolutionIndex: 277
    SolutionNameMin: Cijk_Alik_Bljk_S_MX_B_Bias_HA_SAV_UserArgs_MT64x48x128_MI16x16x1_SN_LDSB1_GRVWA4_GRVWB4_GSU10_LBSPPA512_LBSPPB512_LPA8_LPB8_LRVW4_MIAV1_MIWT1_3_NLCA1_NLCB1_SU0_SUM0_SUS0_SVW1_VWA1_WG64_4_1_WGM1
    SolutionIndex: 278
    SolutionNameMin: Cijk_Alik_Bljk_S_MX_B_Bias_HA_SAV_UserArgs_MT32x64x128_MI32x32x1_SN_LDSB1_GRVWA4_GRVWB4_GSU4_LBSPPA512_LBSPPB512_LPA4_LPB4_LRVW4_MIAV1_MIWT1_1_NLCA1_NLCB1_SU0_SUM0_SUS0_SVW1_VWA1_WG32_4_2_WGM1
    SolutionIndex: 279
    SolutionNameMin: Cijk_Alik_Bljk_S_MX_B_Bias_HA_SAV_UserArgs_MT96x96x64_MI16x16x1_SN_LDSB1_GRVWA4_GRVWB4_GSU19_LBSPPA256_LBSPPB256_LPA8_LPB8_LRVW4_MIAV1_MIWT3_3_NLCA1_NLCB1_SU0_SUM0_SUS0_SVW1_VWA1_WG32_8_1_WGM1
    SolutionIndex: 280
    SolutionNameMin: Cijk_Alik_Bljk_S_MX_B_Bias_HA_SAV_UserArgs_MT64x128x64_MI16x16x1_SN_LDSB1_GRVWA4_GRVWB4_GSU14_LBSPPA1024_LBSPPB256_LPA8_LPB8_LRVW4_MIAV1_MIWT4_2_SU0_SUM0_SUS0_SVW4_VWA4_WG16_16_1_WGM1
    SolutionIndex: 281
    SolutionNameMin: Cijk_Alik_Bljk_S_MX_B_Bias_HA_SAV_UserArgs_MT128x64x64_MI16x16x1_SN_LDSB1_GRVWA4_GRVWB4_GSU14_LBSPPA1024_LBSPPB256_LPA8_LPB8_LRVW4_MIAV1_MIWT4_2_SU0_SUM0_SUS0_SVW4_VWA4_WG32_8_1_WGM1
    SolutionIndex: 282
    SolutionNameMin: Cijk_Alik_Bljk_S_MX_B_Bias_HA_SAV_UserArgs_MT96x128x64_MI16x16x1_SN_LDSB1_GRVWA4_GRVWB4_GSU14_LBSPPA256_LBSPPB256_LPA8_LPB8_LRVW4_MIAV1_MIWT3_4_SU0_SUM0_SUS0_SVW1_VWA1_WG32_8_1_WGM1
    SolutionIndex: 283
    SolutionNameMin: Cijk_Alik_Bljk_S_MX_B_Bias_HA_SAV_UserArgs_MT128x80x64_MI16x16x1_SN_LDSB1_GRVWA4_GRVWB4_GSU14_LBSPPA512_LBSPPB256_LPA8_LPB8_LRVW4_MIAV1_MIWT2_5_SU0_SUM0_SUS0_SVW2_VWA2_WG64_4_1_WGM1
    SolutionIndex: 284
    SolutionNameMin: Cijk_Alik_Bljk_S_MX_B_Bias_HA_SAV_UserArgs_MT64x128x64_MI16x16x1_SN_LDSB1_GRVWA4_GRVWB4_GSU7_LBSPPA1024_LBSPPB256_LPA8_LPB8_LRVW4_MIAV1_MIWT4_4_SU0_SUM0_SUS0_SVW4_VWA4_WG16_8_2_WGM1
    SolutionIndex: 285
    SolutionNameMin: Cijk_Alik_Bljk_S_MX_B_Bias_HA_SAV_UserArgs_MT32x32x128_MI16x16x1_SN_LDSB1_GRVWA4_GRVWB4_GSU1_LBSPPA512_LBSPPB512_LPA8_LPB8_LRVW4_MIAV1_MIWT1_1_SU0_SUM0_SUS0_SVW1_VWA1_WG32_8_1_WGM1
    SolutionIndex: 286
    SolutionNameMin: Cijk_Alik_Bljk_S_MX_B_Bias_HA_SAV_UserArgs_MT128x64x64_MI16x16x1_SN_LDSB1_GRVWA4_GRVWB4_GSU8_LBSPPA512_LBSPPB256_LPA8_LPB8_LRVW4_MIAV1_MIWT2_4_SU0_SUM0_SUS0_SVW2_VWA2_WG64_4_1_WGM1
    SolutionIndex: 287
    SolutionNameMin: Cijk_Alik_Bljk_S_MX_B_Bias_HA_SAV_UserArgs_MT32x64x128_MI32x32x1_SN_LDSB1_GRVWA4_GRVWB4_GSU1_LBSPPA512_LBSPPB512_LPA4_LPB4_LRVW4_MIAV1_MIWT1_1_SU0_SUM0_SUS0_SVW1_VWA1_WG32_4_2_WGM1
    SolutionIndex: 288
    SolutionNameMin: Cijk_Alik_Bljk_S_MX_B_Bias_HA_SAV_UserArgs_MT96x64x64_MI16x16x1_SN_LDSB1_GRVWA4_GRVWB4_GSU5_LBSPPA256_LBSPPB256_LPA8_LPB8_LRVW4_MIAV1_MIWT3_2_SU0_SUM0_SUS0_SVW1_VWA1_WG32_8_1_WGM1
    SolutionIndex: 289
    SolutionNameMin: Cijk_Alik_Bljk_S_MX_B_Bias_HA_SAV_UserArgs_MT64x96x64_MI16x16x1_SN_LDSB1_GRVWA4_GRVWB4_GSU5_LBSPPA512_LBSPPB256_LPA8_LPB8_LRVW4_MIAV1_MIWT2_3_SU0_SUM0_SUS0_SVW2_VWA2_WG32_8_1_WGM1
    SolutionIndex: 290
    SolutionNameMin: Cijk_Alik_Bljk_S_MX_B_Bias_HA_SAV_UserArgs_MT96x96x64_MI16x16x1_SN_LDSB1_GRVWA4_GRVWB4_GSU5_LBSPPA256_LBSPPB256_LPA8_LPB8_LRVW4_MIAV1_MIWT3_3_SU0_SUM0_SUS0_SVW1_VWA1_WG32_8_1_WGM1
    SolutionIndex: 291
    SolutionNameMin: Cijk_Alik_Bljk_S_MX_B_Bias_HA_SAV_UserArgs_MT64x128x64_MI16x16x1_SN_CLR1_GRVWA4_GRVWB4_GSU5_LBSPPA512_LBSPPB256_LPA8_LPB8_LRVW4_MIAV1_MIWT2_4_PLR1_SU0_SUM0_SUS0_SVW2_VWA2_WG32_8_1_WGM1
    SolutionIndex: 292
    SolutionNameMin: Cijk_Alik_Bljk_S_MX_B_Bias_HA_SAV_UserArgs_MT128x128x32_MI16x16x1_SN_CLR1_GRVWA4_GRVWB4_GSU8_LBSPPA256_LBSPPB128_LPA8_LPB8_LRVW4_MIAV1_MIWT2_8_PLR1_SU0_SUM0_SUS0_SVW2_VWA2_WG64_4_1_WGM1
    SolutionIndex: 293
    SolutionNameMin: Cijk_Alik_Bljk_S_MX_B_Bias_HA_SAV_UserArgs_MT160x256x32_MI32x32x1_SN_CLR1_GRVWA4_GRVWB4_GSU17_LBSPPA128_LBSPPB128_LPA4_LPB4_LRVW4_MIAV0_MIWT5_2_PLR1_SU0_SUM0_SUS0_SVW1_VWA1_WG32_8_1_WGM1
    SolutionIndex: 294
    SolutionNameMin: Cijk_Alik_Bljk_S_MX_B_Bias_HA_SAV_UserArgs_MT256x192x32_MI16x16x1_SN_CLR1_GRVWA1_GRVWB4_GSU18_LBSPPA512_LBSPPB128_LPA8_LPB8_LRVW4_MIAV0_MIWT8_6_PLR1_SU0_SUM0_SUS0_SVW4_VWA4_WG32_8_1_WGM1
    SolutionIndex: 295
    SolutionNameMin: Cijk_Alik_Bljk_S_MX_B_Bias_HA_SAV_UserArgs_MT128x96x64_MI16x16x1_SN_CLR1_GRVWA4_GRVWB4_GSU4_LBSPPA1024_LBSPPB256_LPA8_LPB8_LRVW4_MIAV1_MIWT4_3_PLR1_SU0_SUM0_SUS0_SVW4_VWA4_WG32_8_1_WGM1
    SolutionIndex: 296
    SolutionNameMin: Cijk_Alik_Bljk_S_MX_B_Bias_HA_SAV_UserArgs_MT96x192x32_MI16x16x1_SN_CLR1_GRVWA4_GRVWB4_GSU5_LBSPPA128_LBSPPB128_LPA8_LPB8_LRVW4_MIAV1_MIWT3_6_PLR1_SU0_SUM0_SUS0_SVW1_VWA1_WG32_8_1_WGM1
    SolutionIndex: 297
    SolutionNameMin: Cijk_Alik_Bljk_S_MX_B_Bias_HA_SAV_UserArgs_MT256x192x32_MI16x16x1_SN_CLR1_GRVWA1_GRVWB4_GSU12_LBSPPA512_LBSPPB128_LPA8_LPB8_LRVW4_MIAV0_MIWT8_6_PLR1_SU0_SUM0_SUS0_SVW4_VWA4_WG32_8_1_WGM1
    SolutionIndex: 298
    SolutionNameMin: Cijk_Alik_Bljk_S_MX_B_Bias_HA_SAV_UserArgs_MT128x128x32_MI32x32x1_SN_CLR1_GRVWA4_GRVWB4_GSU5_LBSPPA256_LBSPPB128_LPA4_LPB4_LRVW4_MIAV1_MIWT2_2_PLR1_SU0_SUM0_SUS0_SVW2_VWA2_WG64_4_1_WGM1
    SolutionIndex: 299
    SolutionNameMin: Cijk_Alik_Bljk_S_MX_B_Bias_HA_SAV_UserArgs_MT192x256x32_MI32x32x1_SN_CLR1_GRVWA4_GRVWB4_GSU12_LBSPPA128_LBSPPB128_LPA4_LPB4_LRVW4_MIAV0_MIWT3_4_PLR1_SU0_SUM0_SUS0_SVW1_VWA1_WG64_4_1_WGM1
    SolutionIndex: 300
    SolutionNameMin: Cijk_Alik_Bljk_S_MX_B_Bias_HA_SAV_UserArgs_MT128x256x32_MI32x32x1_SN_CLR1_GRVWA4_GRVWB4_GSU6_LBSPPA512_LBSPPB128_LPA4_LPB4_LRVW4_MIAV0_MIWT4_2_PLR1_SU0_SUM0_SUS0_SVW4_VWA4_WG32_8_1_WGM1
    SolutionIndex: 301
    SolutionNameMin: Cijk_Alik_Bljk_S_MX_B_Bias_HA_SAV_UserArgs_MT192x256x32_MI32x32x1_SN_CLR1_GRVWA4_GRVWB4_GSU9_LBSPPA128_LBSPPB128_LPA4_LPB4_LRVW4_MIAV0_MIWT3_4_PLR1_SU0_SUM0_SUS0_SVW1_VWA1_WG64_4_1_WGM1
    SolutionIndex: 302
    SolutionNameMin: Cijk_Alik_Bljk_S_MX_B_Bias_HA_SAV_UserArgs_MT64x80x64_MI16x16x1_SN_CLR1_GRVWA4_GRVWB4_GSU1_LBSPPA512_LBSPPB256_LPA8_LPB8_LRVW4_MIAV1_MIWT2_5_PLR1_SU0_SUM0_SUS0_SVW2_VWA2_WG32_4_2_WGM1
    SolutionIndex: 303
    SolutionNameMin: Cijk_Alik_Bljk_S_MX_B_Bias_HA_SAV_UserArgs_MT256x192x32_MI32x32x1_SN_CLR1_GRVWA1_GRVWB4_GSU9_LBSPPA512_LBSPPB128_LPA4_LPB4_LRVW4_MIAV0_MIWT4_3_PLR1_SU0_SUM0_SUS0_SVW4_VWA4_WG64_4_1_WGM1
    SolutionIndex: 304
    SolutionNameMin: Cijk_Alik_Bljk_S_MX_B_Bias_HA_SAV_UserArgs_MT64x128x64_MI16x16x1_SN_CLR1_GRVWA4_GRVWB4_GSU1_LBSPPA1024_LBSPPB256_LPA8_LPB8_LRVW4_MIAV1_MIWT4_4_PLR1_SU0_SUM0_SUS0_SVW4_VWA4_WG16_8_2_WGM1
    SolutionIndex: 305
    SolutionNameMin: Cijk_Alik_Bljk_S_MX_B_Bias_HA_SAV_UserArgs_MT256x192x32_MI16x16x1_SN_CLR1_GRVWA1_GRVWB4_GSU6_LBSPPA512_LBSPPB128_LPA8_LPB8_LRVW4_MIAV0_MIWT8_6_PLR1_SU0_SUM0_SUS0_SVW4_VWA4_WG32_8_1_WGM1
    SolutionIndex: 306
    SolutionNameMin: Cijk_Alik_Bljk_S_MX_B_Bias_HA_SAV_UserArgs_MT128x256x32_MI32x32x1_SN_CLR1_GRVWA4_GRVWB4_GSU5_LBSPPA256_LBSPPB128_LPA4_LPB4_LRVW4_MIAV0_MIWT2_4_PLR1_SU0_SUM0_SUS0_SVW2_VWA2_WG64_4_1_WGM1
    SolutionIndex: 307
    SolutionNameMin: Cijk_Alik_Bljk_S_MX_B_Bias_HA_SAV_UserArgs_MT192x256x32_MI32x32x1_SN_CLR1_GRVWA4_GRVWB4_GSU7_LBSPPA128_LBSPPB128_LPA4_LPB4_LRVW4_MIAV0_MIWT3_4_PLR1_SU0_SUM0_SUS0_SVW1_VWA1_WG64_4_1_WGM1
    SolutionIndex: 308
    SolutionNameMin: Cijk_Alik_Bljk_S_MX_B_Bias_HA_SAV_UserArgs_MT80x128x64_MI16x16x1_SN_CLR1_GRVWA4_GRVWB4_GSU1_LBSPPA256_LBSPPB256_LPA8_LPB8_LRVW4_MIAV1_MIWT5_2_PLR1_SU0_SUM0_SUS0_SVW1_VWA1_WG16_16_1_WGM1
    SolutionIndex: 309
    SolutionNameMin: Cijk_Alik_Bljk_S_MX_B_Bias_HA_SAV_UserArgs_MT192x256x32_MI32x32x1_SN_CLR1_GRVWA4_GRVWB4_GSU5_LBSPPA128_LBSPPB128_LPA4_LPB4_LRVW4_MIAV0_MIWT3_4_PLR1_SU0_SUM0_SUS0_SVW1_VWA1_WG64_4_1_WGM1
    SolutionIndex: 310
    SolutionNameMin: Cijk_Alik_Bljk_S_MX_B_Bias_HA_SAV_UserArgs_MT192x256x32_MI32x32x1_SN_CLR1_GRVWA1_GRVWB4_GSU5_LBSPPA128_LBSPPB128_LPA4_LPB4_LRVW4_MIAV0_MIWT3_4_PLR1_SU0_SUM0_SUS0_SVW1_VWA1_WG64_4_1_WGM1
    SolutionIndex: 311
    SolutionNameMin: Cijk_Alik_Bljk_S_MX_B_Bias_HA_SAV_UserArgs_MT256x192x32_MI32x32x1_SN_CLR1_GRVWA4_GRVWB4_GSU5_LBSPPA256_LBSPPB128_LPA4_LPB4_LRVW4_MIAV0_MIWT2_6_PLR1_SU0_SUM0_SUS0_SVW2_VWA2_WG128_2_1_WGM1
    SolutionIndex: 312
    SolutionNameMin: Cijk_Alik_Bljk_S_MX_B_Bias_HA_SAV_UserArgs_MT256x192x32_MI16x16x1_SN_CLR1_GRVWA1_GRVWB4_GSU5_LBSPPA512_LBSPPB128_LPA8_LPB8_LRVW4_MIAV0_MIWT8_6_PLR1_SU0_SUM0_SUS0_SVW4_VWA4_WG32_8_1_WGM1
    SolutionIndex: 313
    SolutionNameMin: Cijk_Alik_Bljk_S_MX_B_Bias_HA_SAV_UserArgs_MT128x128x32_MI16x16x1_SN_CLR1_GRVWA4_GRVWB4_GSU1_LBSPPA512_LBSPPB128_LPA8_LPB8_LRVW4_MIAV1_MIWT4_4_PLR1_SU0_SUM0_SUS0_SVW4_VWA4_WG32_8_1_WGM1
    SolutionIndex: 314
    SolutionNameMin: Cijk_Alik_Bljk_S_MX_B_Bias_HA_SAV_UserArgs_MT160x96x32_MI16x16x1_SN_CLR1_GRVWA4_GRVWB4_GSU1_LBSPPA128_LBSPPB128_LPA8_LPB8_LRVW4_MIAV1_MIWT5_3_PLR1_SU0_SUM0_SUS0_SVW1_VWA1_WG32_8_1_WGM1
    SolutionIndex: 315
    SolutionNameMin: Cijk_Alik_Bljk_S_MX_B_Bias_HA_SAV_UserArgs_MT256x192x32_MI16x16x1_SN_CLR1_GRVWA1_GRVWB4_GSU3_LBSPPA512_LBSPPB128_LPA8_LPB8_LRVW4_MIAV0_MIWT8_6_PLR1_SU0_SUM0_SUS0_SVW4_VWA4_WG32_8_1_WGM1
    SolutionIndex: 316
    SolutionNameMin: Cijk_Alik_Bljk_S_MX_B_Bias_HA_SAV_UserArgs_MT128x128x32_MI16x16x1_SN_GRVWA4_GRVWB4_GSU1_LBSPPA512_LBSPPB128_LPA8_LPB8_LRVW4_MIAV1_MIWT4_4_NTA0_NTC3_NTD3_SU0_SUM0_SUS0_SVW4_VWA4_WG32_8_1_WGM1
    SolutionIndex: 317
    SolutionNameMin: Cijk_Alik_Bljk_S_MX_B_Bias_HA_SAV_UserArgs_MT112x128x32_MI16x16x1_SN_GRVWA1_GRVWB4_GSU1_LBSPPA128_LBSPPB128_LPA8_LPB8_LRVW4_MIAV1_MIWT7_2_NTA0_NTC3_NTD3_SU0_SUM0_SUS0_SVW1_VWA1_WG16_16_1_WGM1
    SolutionIndex: 318
    SolutionNameMin: Cijk_Alik_Bljk_S_MX_B_Bias_HA_SAV_UserArgs_MT112x256x32_MI16x16x1_SN_GRVWA1_GRVWB4_GSU2_LBSPPA128_LBSPPB128_LPA8_LPB8_LRVW4_MIAV0_MIWT7_4_NTA4_NTC3_NTD3_SU0_SUM0_SUS0_SVW1_VWA1_WG16_16_1_WGM1
    SolutionIndex: 319
    SolutionNameMin: Cijk_Alik_Bljk_S_MX_B_Bias_HA_SAV_UserArgs_MT128x96x32_MI16x16x1_SN_GRVWA4_GRVWB4_GSU1_LBSPPA512_LBSPPB128_LPA8_LPB8_LRVW4_MIAV1_MIWT4_3_NTA0_NTC3_NTD3_SU0_SUM0_SUS0_SVW4_VWA4_WG32_8_1_WGM1
    SolutionIndex: 320
    SolutionNameMin: Cijk_Alik_Bljk_S_MX_B_Bias_HA_SAV_UserArgs_MT160x128x32_MI16x16x1_SN_GRVWA1_GRVWB4_GSU1_LBSPPA256_LBSPPB128_LPA8_LPB8_LRVW4_MIAV1_MIWT10_2_NTA0_NTC3_NTD3_SU0_SUM0_SUS0_SVW2_VWA2_WG16_16_1_WGM1
    SolutionIndex: 321
    SolutionNameMin: Cijk_Alik_Bljk_S_MX_B_Bias_HA_SAV_UserArgs_MT160x256x32_MI32x32x1_SN_GRVWA1_GRVWB4_GSU2_LBSPPA128_LBSPPB128_LPA4_LPB4_LRVW4_MIAV0_MIWT5_2_NTA4_NTC3_NTD3_SU0_SUM0_SUS0_SVW1_VWA1_WG32_8_1_WGM1
    SolutionIndex: 322
    SolutionNameMin: Cijk_Alik_Bljk_S_MX_B_Bias_HA_SAV_UserArgs_MT208x192x32_MI16x16x1_SN_GRVWA1_GRVWB4_GSU2_LBSPPA128_LBSPPB128_LPA8_LPB8_LRVW4_MIAV0_MIWT13_3_NTA4_NTC3_NTD3_SU0_SUM0_SUS0_SVW1_VWA1_WG16_16_1_WGM1
    SolutionIndex: 323
    SolutionNameMin: Cijk_Alik_Bljk_S_MX_B_Bias_HA_SAV_UserArgs_MT256x128x32_MI32x32x1_SN_GRVWA4_GRVWB4_GSU1_LBSPPA512_LBSPPB128_LPA4_LPB4_LRVW4_MIAV0_MIWT4_2_NTA0_NTC3_NTD3_SU0_SUM0_SUS0_SVW4_VWA4_WG64_4_1_WGM1
    SolutionIndex: 324
    SolutionNameMin: Cijk_Alik_Bljk_S_MX_B_Bias_HA_SAV_UserArgs_MT160x192x32_MI16x16x1_SN_GRVWA1_GRVWB4_GSU1_LBSPPA256_LBSPPB128_LPA8_LPB8_LRVW4_MIAV0_MIWT10_3_NTA0_NTC3_NTD3_SU0_SUM0_SUS0_SVW2_VWA2_WG16_16_1_WGM1
    SolutionIndex: 325
    SolutionNameMin: Cijk_Alik_Bljk_S_MX_B_Bias_HA_SAV_UserArgs_MT160x192x32_MI16x16x1_SN_GRVWA1_GRVWB4_GSU1_LBSPPA128_LBSPPB128_LPA8_LPB8_LRVW4_MIAV0_MIWT5_6_NTA0_NTC0_NTD0_SU0_SUM0_SUS0_SVW1_VWA1_WG32_8_1_WGM1
    SolutionIndex: 326
    SolutionNameMin: Cijk_Alik_Bljk_S_MX_B_Bias_HA_SAV_UserArgs_MT224x128x32_MI16x16x1_SN_GRVWA1_GRVWB4_GSU1_LBSPPA128_LPA8_LPB8_LRVW4_MIWT7_4_NTA0_NTC3_NTD3_SU0_SUM0_SUS0_SVW1_VWA1_WG32_8_1_WGM1
    SolutionIndex: 327
    SolutionNameMin: Cijk_Alik_Bljk_S_MX_B_Bias_HA_SAV_UserArgs_MT112x256x32_MI16x16x1_SN_GRVWA1_GRVWB4_GSU1_LBSPPA128_LPA8_LPB8_LRVW4_MIWT7_4_NTA4_NTC3_NTD3_SU0_SUM0_SUS0_SVW1_VWA1_WG16_16_1_WGM1
    SolutionIndex: 328
    SolutionNameMin: Cijk_Alik_Bljk_S_MX_B_Bias_HA_SAV_UserArgs_MT160x256x32_MI32x32x1_SN_GRVWA4_GRVWB4_GSU1_LBSPPA128_LPA4_LPB4_LRVW4_MIWT5_2_NTA0_NTC3_NTD3_SU0_SUM0_SUS0_SVW1_VWA1_WG32_8_1_WGM1
    SolutionIndex: 329
    SolutionNameMin: Cijk_Alik_Bljk_S_MX_B_Bias_HA_SAV_UserArgs_MT160x256x32_MI32x32x1_SN_GRVWA1_GRVWB4_GSU1_LBSPPA128_LPA4_LPB4_LRVW4_MIWT5_2_NTA4_NTC3_NTD3_SU0_SUM0_SUS0_SVW1_VWA1_WG32_8_1_WGM1
    SolutionIndex: 330
    SolutionNameMin: Cijk_Alik_Bljk_S_MX_B_Bias_HA_SAV_UserArgs_MT256x256x16_MI16x16x1_SN_GRVWA1_GRVWB4_GSU1_LBSPPA256_LPA2_LPB4_LRVW2_MIWT16_4_NTA0_NTC0_NTD0_SU0_SUM0_SUS0_SVW4_VWA4_WG16_16_1_WGM1
    SolutionIndex: 331
    SolutionNameMin: Cijk_Alik_Bljk_S_MX_B_Bias_HA_SAV_UserArgs_MT208x256x32_MI16x16x1_SN_GRVWA1_GRVWB4_GSU1_LBSPPA128_LPA2_LPB4_LRVW2_MIWT13_4_NTA4_NTC0_NTD0_SU0_SUM0_SUS0_SVW1_VWA1_WG16_16_1_WGM1
    SolutionIndex: 332
    SolutionNameMin: Cijk_Alik_Bljk_S_MX_B_Bias_HA_SAV_UserArgs_MT208x256x32_MI16x16x1_SN_GRVWA1_GRVWB4_GSU1_LBSPPA128_LPA2_LPB4_LRVW2_MIWT13_4_NTA4_NTC3_NTD3_SU0_SUM0_SUS0_SVW1_VWA1_WG16_16_1_WGM1
    SolutionIndex: 333
    SolutionNameMin: Cijk_Alik_Bljk_S_MX_B_Bias_HA_SAV_UserArgs_MT256x256x16_MI32x32x1_SN_GRVWA1_GRVWB4_GSU1_LBSPPA256_LPA4_LPB4_LRVW4_MIWT4_4_NTA0_NTC3_NTD3_SU0_SUM0_SUS0_SVW4_VWA4_WG64_4_1_WGM1
    SolutionIndex: 334
    SolutionNameMin: Cijk_Alik_Bljk_S_MX_B_Bias_HA_SAV_UserArgs_MT256x256x16_MI16x16x1_SN_GRVWA1_GRVWB4_GSU1_LBSPPA256_LPA2_LPB4_LRVW2_MIWT8_8_NTA4_NTC0_NTD0_SU0_SUM0_SUS0_SVW4_VWA4_WG32_8_1_WGM1
    SolutionIndex: 335
    SolutionNameMin: Cijk_Alik_Bljk_S_MX_B_Bias_HA_SAV_UserArgs_MT256x256x16_MI16x16x1_SN_GRVWA1_GRVWB4_GSU1_LBSPPA256_LPA2_LPB4_LRVW2_MIWT8_8_NTA0_NTC0_NTD0_SU0_SUM0_SUS0_SVW4_VWA4_WG32_8_1_WGM1
    SolutionIndex: 336
    SolutionNameMin: Cijk_Alik_Bljk_S_MX_B_Bias_HA_SAV_UserArgs_MT160x256x16_MI32x32x1_SN_GRVWA1_GRVWB4_GSU1_LBSPPA128_LPA4_LPB4_LRVW4_MIWT5_2_NTA0_NTC3_NTD3_SU0_SUM0_SUS0_SVW1_VWA1_WG32_8_1_WGM1
    SolutionIndex: 337
    SolutionNameMin: Cijk_Alik_Bljk_S_MX_B_Bias_HA_SAV_UserArgs_MT160x256x32_MI16x16x1_SN_GRVWA1_GRVWB4_GSU1_LBSPPA256_LPA8_LPB8_LRVW4_MIWT10_4_NTA4_NTC3_NTD3_SU0_SUM0_SUS0_SVW2_VWA2_WG16_16_1_WGM1
    SolutionIndex: 338
    SolutionNameMin: Cijk_Alik_Bljk_S_MX_B_Bias_HA_SAV_UserArgs_MT160x256x32_MI32x32x1_SN_GRVWA1_GRVWB4_GSU1_LBSPPA128_LPA4_LPB4_LRVW4_MIWT5_2_NTA4_NTC0_NTD0_SU0_SUM0_SUS0_SVW1_VWA1_WG32_8_1_WGM1
    SolutionIndex: 339
    SolutionNameMin: Cijk_Alik_Bljk_S_MX_B_Bias_HA_SAV_UserArgs_MT256x256x16_MI32x32x1_SN_GRVWA4_GRVWB4_GSU1_LBSPPA256_LPA4_LPB4_LRVW4_MIWT4_4_NTA0_NTC3_NTD3_SU0_SUM0_SUS0_SVW4_VWA4_WG64_4_1_WGM1
    SolutionIndex: 340
    SolutionNameMin: Cijk_Alik_Bljk_S_MX_B_Bias_HA_SAV_UserArgs_MT224x192x16_MI16x16x1_SN_GRVWA1_GRVWB4_GSU1_LBSPPA128_LPA2_LPB4_LRVW2_MIWT7_6_NTA0_NTC3_NTD3_SU0_SUM0_SUS0_SVW1_VWA1_WG32_8_1_WGM1
    SolutionIndex: 341
    SolutionNameMin: Cijk_Alik_Bljk_S_MX_B_Bias_HA_SAV_UserArgs_MT224x192x32_MI16x16x1_SN_GRVWA1_GRVWB4_GSU1_LBSPPA256_LPA8_LPB8_LRVW4_MIWT14_3_NTA0_NTC0_NTD0_SU0_SUM0_SUS0_SVW2_VWA2_WG16_16_1_WGM1
    SolutionIndex: 342
    SolutionNameMin: Cijk_Alik_Bljk_S_MX_B_Bias_HA_SAV_UserArgs_MT224x192x32_MI16x16x1_SN_GRVWA1_GRVWB4_GSU1_LBSPPA256_LPA8_LPB8_LRVW4_MIWT14_3_NTA0_NTC3_NTD3_SU0_SUM0_SUS0_SVW2_VWA2_WG16_16_1_WGM1
    SolutionIndex: 343
    SolutionNameMin: Cijk_Alik_Bljk_S_MX_B_Bias_HA_SAV_UserArgs_MT320x192x16_MI32x32x1_SN_GRVWA4_GRVWB4_GSU1_LBSPPA128_LPA4_LPB4_LRVW4_MIWT5_3_NTA0_NTC3_NTD3_SU0_SUM0_SUS0_SVW1_VWA1_WG64_4_1_WGM1
    SolutionIndex: 344
    SolutionNameMin: Cijk_Alik_Bljk_S_MX_B_Bias_HA_SAV_UserArgs_MT320x192x16_MI16x16x1_SN_GRVWA1_GRVWB4_GSU1_LBSPPA256_LPA2_LPB4_LRVW2_MIWT20_3_NTA0_NTC3_NTD3_SU0_SUM0_SUS0_SVW4_VWA4_WG16_16_1_WGM1
    SolutionIndex: 345
    SolutionNameMin: Cijk_Alik_Bljk_S_MX_B_Bias_HA_SAV_UserArgs_MT224x192x16_MI16x16x1_SN_GRVWA1_GRVWB4_GSU1_LBSPPA128_LPA2_LPB4_LRVW2_MIWT7_6_NTA0_NTC0_NTD0_SU0_SUM0_SUS0_SVW1_VWA1_WG32_8_1_WGM1
    SolutionIndex: 346
    SolutionNameMin: Cijk_Alik_Bljk_S_MX_B_Bias_HA_SAV_UserArgs_MT224x128x32_MI16x16x1_SN_GRVWA1_GRVWB4_GSU1_LBSPPA128_LPA8_LPB8_LRVW4_MIWT7_4_NTA0_NTC0_NTD0_SU0_SUM0_SUS0_SVW1_VWA1_WG32_8_1_WGM1
    SolutionIndex: 347
    SolutionNameMin: Cijk_Alik_Bljk_S_MX_B_Bias_HA_SAV_UserArgs_MT224x128x32_MI16x16x1_SN_GRVWA1_GRVWB4_GSU1_LBSPPA128_LPA8_LPB8_LRVW4_MIWT7_4_NTA4_NTC0_NTD0_SU0_SUM0_SUS0_SVW1_VWA1_WG32_8_1_WGM1
    SolutionIndex: 348
    SolutionNameMin: Cijk_Alik_Bljk_S_MX_B_Bias_HA_SAV_UserArgs_MT512x128x16_MI32x32x1_SN_GRVWA4_GRVWB4_GSU1_LBSPPA256_LPA4_LPB4_LRVW4_MIWT4_4_NTA0_NTC0_NTD0_SU0_SUM0_SUS0_SVW4_VWA4_WG128_2_1_WGM1
    SolutionIndex: 349
    SolutionNameMin: Cijk_Alik_Bljk_S_MX_B_Bias_HA_SAV_UserArgs_MT224x192x32_MI16x16x1_SN_GRVWA1_GRVWB4_GSU1_LBSPPA256_LPA8_LPB8_LRVW4_MIWT14_3_NTA4_NTC3_NTD3_SU0_SUM0_SUS0_SVW2_VWA2_WG16_16_1_WGM1
    SolutionIndex: 350
    SolutionNameMin: Cijk_Alik_Bljk_S_MX_B_Bias_HA_SAV_UserArgs_MT16x64x128_MI16x16x1_SN_GRVWA4_GRVWB4_GSU8_LBSPPA512_LBSPPB512_LPA8_LPB8_LRVW4_MIWT1_1_NLCA1_NLCB1_SU0_SUM0_SUS0_SVW1_VWA1_WG16_16_1_WGM1
    SolutionIndex: 351
    SolutionNameMin: Cijk_Alik_Bljk_S_MX_B_Bias_HA_SAV_UserArgs_MT16x64x128_MI16x16x1_SN_GRVWA4_GRVWB4_GSU10_LBSPPA512_LBSPPB512_LPA8_LPB8_LRVW4_MIWT1_1_NLCA1_NLCB1_SU0_SUM0_SUS0_SVW1_VWA1_WG16_16_1_WGM1
    SolutionIndex: 352
    SolutionNameMin: Cijk_Alik_Bljk_S_MX_B_Bias_HA_SAV_UserArgs_MT32x64x128_MI16x16x1_SN_GRVWA4_GRVWB4_GSU8_LBSPPA512_LBSPPB512_LPA8_LPB8_LRVW4_MIWT1_2_NLCA1_NLCB1_SU0_SUM0_SUS0_SVW1_VWA1_WG32_8_1_WGM1
    SolutionIndex: 353
    SolutionNameMin: Cijk_Alik_Bljk_S_MX_B_Bias_HA_SAV_UserArgs_MT16x64x128_MI16x16x1_SN_GRVWA4_GRVWB4_GSU6_LBSPPA512_LBSPPB512_LPA8_LPB8_LRVW4_MIWT1_1_NLCA1_NLCB1_SU0_SUM0_SUS0_SVW1_VWA1_WG16_16_1_WGM1
    SolutionIndex: 354
    SolutionNameMin: Cijk_Alik_Bljk_S_MX_B_Bias_HA_SAV_UserArgs_MT32x64x128_MI16x16x1_SN_GRVWA4_GRVWB4_GSU6_LBSPPA512_LBSPPB512_LPA8_LPB8_LRVW4_MIWT1_2_NLCA1_NLCB1_SU0_SUM0_SUS0_SVW1_VWA1_WG32_8_1_WGM1
    SolutionIndex: 355
    SolutionNameMin: Cijk_Alik_Bljk_S_MX_B_Bias_HA_SAV_UserArgs_MT32x192x64_MI16x16x1_SN_GRVWA4_GRVWB4_GSU20_LBSPPA512_LBSPPB256_LPA8_LPB8_LRVW4_MIWT2_3_NLCA1_NLCB1_SU0_SUM0_SUS0_SVW2_VWA2_WG16_16_1_WGM1
    SolutionIndex: 356
    SolutionNameMin: Cijk_Alik_Bljk_S_MX_B_Bias_HA_SAV_UserArgs_MT16x32x256_MI16x16x1_SN_GRVWA4_GRVWB4_GSU1_LBSPPA1024_LBSPPB1024_LPA8_LPB8_LRVW4_MIAV1_MIWT1_1_SU0_SUM0_SUS0_SVW1_VWA1_WG16_8_1_WGM1
    SolutionIndex: 357
    SolutionNameMin: Cijk_Alik_Bljk_S_MX_B_Bias_HA_SAV_UserArgs_MT64x128x64_MI16x16x1_SN_GRVWA4_GRVWB4_GSU14_LBSPPA1024_LBSPPB256_LPA8_LPB8_LRVW4_MIAV1_MIWT4_2_SU0_SUM0_SUS0_SVW4_VWA4_WG16_16_1_WGM1
    SolutionIndex: 358
    SolutionNameMin: Cijk_Alik_Bljk_S_MX_B_Bias_HA_SAV_UserArgs_MT64x128x64_MI16x16x1_SN_GRVWA4_GRVWB4_GSU15_LBSPPA1024_LBSPPB256_LPA8_LPB8_LRVW4_MIAV1_MIWT4_2_SU0_SUM0_SUS0_SVW4_VWA4_WG16_16_1_WGM1
    SolutionIndex: 359
    SolutionNameMin: Cijk_Alik_Bljk_S_MX_B_Bias_HA_SAV_UserArgs_MT96x128x32_MI16x16x1_SN_GRVWA4_GRVWB4_GSU15_LBSPPA128_LBSPPB128_LPA8_LPB8_LRVW4_MIAV1_MIWT3_4_SU0_SUM0_SUS0_SVW1_VWA1_WG32_8_1_WGM1
    SolutionIndex: 360
    SolutionNameMin: Cijk_Alik_Bljk_S_MX_B_Bias_HA_SAV_UserArgs_MT96x128x64_MI16x16x1_SN_GRVWA4_GRVWB4_GSU15_LBSPPA256_LBSPPB256_LPA8_LPB8_LRVW4_MIAV1_MIWT3_4_SU0_SUM0_SUS0_SVW1_VWA1_WG32_8_1_WGM1
    SolutionIndex: 361
    SolutionNameMin: Cijk_Alik_Bljk_S_MX_B_Bias_HA_SAV_UserArgs_MT64x96x64_MI16x16x1_SN_GRVWA4_GRVWB4_GSU10_LBSPPA512_LBSPPB256_LPA8_LPB8_LRVW4_MIAV1_MIWT2_3_SU0_SUM0_SUS0_SVW2_VWA2_WG32_8_1_WGM1
    SolutionIndex: 362
    SolutionNameMin: Cijk_Alik_Bljk_S_MX_B_Bias_HA_SAV_UserArgs_MT96x96x32_MI16x16x1_SN_GRVWA4_GRVWB4_GSU10_LBSPPA128_LBSPPB128_LPA8_LPB8_LRVW4_MIAV1_MIWT3_3_SU0_SUM0_SUS0_SVW1_VWA1_WG32_8_1_WGM1
    SolutionIndex: 363
    SolutionNameMin: Cijk_Alik_Bljk_S_MX_B_Bias_HA_SAV_UserArgs_MT32x32x128_MI16x16x1_SN_GRVWA4_GRVWB4_GSU1_LBSPPA512_LBSPPB512_LPA8_LPB8_LRVW4_MIAV1_MIWT1_1_SU0_SUM0_SUS0_SVW1_VWA1_WG32_8_1_WGM1
    SolutionIndex: 364
    SolutionNameMin: Cijk_Alik_Bljk_S_MX_B_Bias_HA_SAV_UserArgs_MT64x128x64_MI16x16x1_SN_GRVWA4_GRVWB4_GSU8_LBSPPA512_LBSPPB256_LPA8_LPB8_LRVW4_MIAV1_MIWT2_4_SU0_SUM0_SUS0_SVW2_VWA2_WG32_8_1_WGM1
    SolutionIndex: 365
    SolutionNameMin: Cijk_Alik_Bljk_S_MX_B_Bias_HA_SAV_UserArgs_MT64x128x64_MI16x16x1_SN_GRVWA4_GRVWB4_GSU6_LBSPPA512_LBSPPB256_LPA8_LPB8_LRVW4_MIAV1_MIWT2_4_SU0_SUM0_SUS0_SVW2_VWA2_WG32_8_1_WGM1
    SolutionIndex: 366
    SolutionNameMin: Cijk_Alik_Bljk_S_MX_B_Bias_HA_SAV_UserArgs_MT64x128x64_MI16x16x1_SN_GRVWA4_GRVWB4_GSU6_LBSPPA1024_LBSPPB256_LPA8_LPB8_LRVW4_MIAV1_MIWT4_2_SU0_SUM0_SUS0_SVW4_VWA4_WG16_16_1_WGM1
    SolutionIndex: 367
    SolutionNameMin: Cijk_Alik_Bljk_S_MX_B_Bias_HA_SAV_UserArgs_MT32x64x128_MI32x32x1_SN_GRVWA4_GRVWB4_GSU1_LBSPPA512_LBSPPB512_LPA4_LPB4_LRVW4_MIAV1_MIWT1_1_SU0_SUM0_SUS0_SVW1_VWA1_WG32_4_2_WGM1
    SolutionIndex: 368
    SolutionNameMin: Cijk_Alik_Bljk_S_MX_B_Bias_HA_SAV_UserArgs_MT96x128x32_MI16x16x1_SN_GRVWA4_GRVWB4_GSU8_LBSPPA128_LBSPPB128_LPA8_LPB8_LRVW4_MIAV1_MIWT3_4_SU0_SUM0_SUS0_SVW1_VWA1_WG32_8_1_WGM1
    SolutionIndex: 369
    SolutionNameMin: Cijk_Alik_Bljk_S_MX_B_Bias_HA_SAV_UserArgs_MT96x128x64_MI16x16x1_SN_GRVWA4_GRVWB4_GSU8_LBSPPA256_LBSPPB256_LPA8_LPB8_LRVW4_MIAV1_MIWT3_4_SU0_SUM0_SUS0_SVW1_VWA1_WG32_8_1_WGM1
    SolutionIndex: 370
    SolutionNameMin: Cijk_Alik_Bljk_S_MX_B_Bias_HA_SAV_UserArgs_MT64x96x64_MI16x16x1_SN_GRVWA4_GRVWB4_GSU5_LBSPPA512_LBSPPB256_LPA8_LPB8_LRVW4_MIAV1_MIWT2_3_SU0_SUM0_SUS0_SVW2_VWA2_WG32_8_1_WGM1
    SolutionIndex: 371
    SolutionNameMin: Cijk_Alik_Bljk_S_MX_B_Bias_HA_SAV_UserArgs_MT128x80x64_MI16x16x1_SN_GRVWA4_GRVWB4_GSU8_LBSPPA512_LBSPPB256_LPA8_LPB8_LRVW4_MIAV1_MIWT2_5_SU0_SUM0_SUS0_SVW2_VWA2_WG64_4_1_WGM1
    SolutionIndex: 372
    SolutionNameMin: Cijk_Alik_Bljk_S_MX_B_Bias_HA_SAV_UserArgs_MT64x32x128_MI32x32x1_SN_GRVWA4_GRVWB4_GSU1_LBSPPA512_LBSPPB512_LPA4_LPB4_LRVW4_MIAV1_MIWT1_1_SU0_SUM0_SUS0_SVW1_VWA1_WG64_2_2_WGM1
    SolutionIndex: 373
    SolutionNameMin: Cijk_Alik_Bljk_S_MX_B_Bias_HA_SAV_UserArgs_MT96x96x64_MI16x16x1_SN_GRVWA4_GRVWB4_GSU5_LBSPPA256_LBSPPB256_LPA8_LPB8_LRVW4_MIAV1_MIWT3_3_SU0_SUM0_SUS0_SVW1_VWA1_WG32_8_1_WGM1
    SolutionIndex: 374
    SolutionNameMin: Cijk_Alik_Bljk_S_MX_B_Bias_HA_SAV_UserArgs_MT128x80x64_MI16x16x1_SN_CLR1_GRVWA4_GRVWB4_GSU5_LBSPPA512_LBSPPB256_LPA8_LPB8_LRVW4_MIAV1_MIWT2_5_PLR1_SU0_SUM0_SUS0_SVW2_VWA2_WG64_4_1_WGM1
    SolutionIndex: 375
    SolutionNameMin: Cijk_Alik_Bljk_S_MX_B_Bias_HA_SAV_UserArgs_MT256x160x32_MI16x16x1_SN_CLR1_GRVWA1_GRVWB4_GSU17_LBSPPA512_LBSPPB128_LPA8_LPB8_LRVW4_MIAV0_MIWT8_5_PLR1_SU0_SUM0_SUS0_SVW4_VWA4_WG32_8_1_WGM1
    SolutionIndex: 376
    SolutionNameMin: Cijk_Alik_Bljk_S_MX_B_Bias_HA_SAV_UserArgs_MT48x64x64_MI16x16x1_SN_CLR1_GRVWA4_GRVWB4_GSU1_LBSPPA256_LBSPPB256_LPA8_LPB8_LRVW4_MIAV1_MIWT3_1_PLR1_SU0_SUM0_SUS0_SVW1_VWA1_WG16_16_1_WGM1
    SolutionIndex: 377
    SolutionNameMin: Cijk_Alik_Bljk_S_MX_B_Bias_HA_SAV_UserArgs_MT96x128x64_MI16x16x1_SN_CLR1_GRVWA4_GRVWB4_GSU4_LBSPPA256_LBSPPB256_LPA8_LPB8_LRVW4_MIAV1_MIWT3_4_PLR1_SU0_SUM0_SUS0_SVW1_VWA1_WG32_8_1_WGM1
    SolutionIndex: 378
    SolutionNameMin: Cijk_Alik_Bljk_S_MX_B_Bias_HA_SAV_UserArgs_MT192x96x32_MI16x16x1_SN_CLR1_GRVWA4_GRVWB4_GSU5_LBSPPA128_LBSPPB128_LPA8_LPB8_LRVW4_MIAV1_MIWT3_6_PLR1_SU0_SUM0_SUS0_SVW1_VWA1_WG64_4_1_WGM1
    SolutionIndex: 379
    SolutionNameMin: Cijk_Alik_Bljk_S_MX_B_Bias_HA_SAV_UserArgs_MT192x192x32_MI16x16x1_SN_CLR1_GRVWA1_GRVWB4_GSU9_LBSPPA256_LBSPPB128_LPA8_LPB8_LRVW4_MIAV0_MIWT6_6_PLR1_SU0_SUM0_SUS0_SVW2_VWA2_WG32_8_1_WGM1
    SolutionIndex: 380
    SolutionNameMin: Cijk_Alik_Bljk_S_MX_B_Bias_HA_SAV_UserArgs_MT64x64x64_MI32x32x1_SN_CLR1_GRVWA4_GRVWB4_GSU1_LBSPPA256_LBSPPB256_LPA4_LPB4_LRVW4_MIAV1_MIWT1_1_PLR1_SU0_SUM0_SUS0_SVW1_VWA1_WG64_4_1_WGM1
    SolutionIndex: 381
    SolutionNameMin: Cijk_Alik_Bljk_S_MX_B_Bias_HA_SAV_UserArgs_MT128x192x32_MI32x32x1_SN_CLR1_GRVWA4_GRVWB4_GSU6_LBSPPA256_LBSPPB128_LPA4_LPB4_LRVW4_MIAV0_MIWT2_3_PLR1_SU0_SUM0_SUS0_SVW2_VWA2_WG64_4_1_WGM1
    SolutionIndex: 382
    SolutionNameMin: Cijk_Alik_Bljk_S_MX_B_Bias_HA_SAV_UserArgs_MT256x128x32_MI16x16x1_SN_CLR1_GRVWA1_GRVWB4_GSU9_LBSPPA512_LBSPPB128_LPA8_LPB8_LRVW4_MIAV0_MIWT4_8_PLR1_SU0_SUM0_SUS0_SVW4_VWA4_WG64_4_1_WGM1
    SolutionIndex: 383
    SolutionNameMin: Cijk_Alik_Bljk_S_MX_B_Bias_HA_SAV_UserArgs_MT80x256x32_MI16x16x1_SN_CLR1_GRVWA1_GRVWB4_GSU5_LBSPPA128_LBSPPB128_LPA8_LPB8_LRVW4_MIAV1_MIWT5_4_PLR1_SU0_SUM0_SUS0_SVW1_VWA1_WG16_16_1_WGM1
    SolutionIndex: 384
    SolutionNameMin: Cijk_Alik_Bljk_S_MX_B_Bias_HA_SAV_UserArgs_MT144x256x32_MI16x16x1_SN_CLR1_GRVWA1_GRVWB4_GSU7_LBSPPA128_LBSPPB128_LPA8_LPB8_LRVW4_MIAV0_MIWT9_4_PLR1_SU0_SUM0_SUS0_SVW1_VWA1_WG16_16_1_WGM1
    SolutionIndex: 385
    SolutionNameMin: Cijk_Alik_Bljk_S_MX_B_Bias_HA_SAV_UserArgs_MT96x256x32_MI32x32x1_SN_CLR1_GRVWA4_GRVWB4_GSU5_LBSPPA128_LBSPPB128_LPA4_LPB4_LRVW4_MIAV0_MIWT3_2_PLR1_SU0_SUM0_SUS0_SVW1_VWA1_WG32_8_1_WGM1
    SolutionIndex: 386
    SolutionNameMin: Cijk_Alik_Bljk_S_MX_B_Bias_HA_SAV_UserArgs_MT160x256x32_MI32x32x1_SN_CLR1_GRVWA4_GRVWB4_GSU7_LBSPPA128_LBSPPB128_LPA4_LPB4_LRVW4_MIAV0_MIWT5_2_PLR1_SU0_SUM0_SUS0_SVW1_VWA1_WG32_8_1_WGM1
    SolutionIndex: 387
    SolutionNameMin: Cijk_Alik_Bljk_S_MX_B_Bias_HA_SAV_UserArgs_MT256x128x32_MI32x32x1_SN_CLR1_GRVWA4_GRVWB4_GSU7_LBSPPA256_LBSPPB128_LPA4_LPB4_LRVW4_MIAV0_MIWT2_4_PLR1_SU0_SUM0_SUS0_SVW2_VWA2_WG128_2_1_WGM1
    SolutionIndex: 388
    SolutionNameMin: Cijk_Alik_Bljk_S_MX_B_Bias_HA_SAV_UserArgs_MT256x192x32_MI16x16x1_SN_CLR1_GRVWA1_GRVWB4_GSU9_LBSPPA512_LBSPPB128_LPA8_LPB8_LRVW4_MIAV0_MIWT8_6_PLR1_SU0_SUM0_SUS0_SVW4_VWA4_WG32_8_1_WGM1
    SolutionIndex: 389
    SolutionNameMin: Cijk_Alik_Bljk_S_MX_B_Bias_HA_SAV_UserArgs_MT128x80x64_MI16x16x1_SN_CLR1_GRVWA4_GRVWB4_GSU2_LBSPPA512_LBSPPB256_LPA8_LPB8_LRVW4_MIAV1_MIWT2_5_PLR1_SU0_SUM0_SUS0_SVW2_VWA2_WG64_4_1_WGM1
    SolutionIndex: 390
    SolutionNameMin: Cijk_Alik_Bljk_S_MX_B_Bias_HA_SAV_UserArgs_MT320x128x32_MI32x32x1_SN_CLR1_GRVWA1_GRVWB4_GSU7_LBSPPA128_LBSPPB128_LPA4_LPB4_LRVW4_MIAV0_MIWT5_2_PLR1_SU0_SUM0_SUS0_SVW1_VWA1_WG64_4_1_WGM1
    SolutionIndex: 391
    SolutionNameMin: Cijk_Alik_Bljk_S_MX_B_Bias_HA_SAV_UserArgs_MT96x64x64_MI16x16x1_SN_CLR1_GRVWA4_GRVWB4_GSU1_LBSPPA256_LBSPPB256_LPA8_LPB8_LRVW4_MIAV1_MIWT3_2_PLR1_SU0_SUM0_SUS0_SVW1_VWA1_WG32_8_1_WGM1
    SolutionIndex: 392
    SolutionNameMin: Cijk_Alik_Bljk_S_MX_B_Bias_HA_SAV_UserArgs_MT96x128x64_MI16x16x1_SN_CLR1_GRVWA4_GRVWB4_GSU2_LBSPPA256_LBSPPB256_LPA8_LPB8_LRVW4_MIAV1_MIWT3_4_PLR1_SU0_SUM0_SUS0_SVW1_VWA1_WG32_8_1_WGM1
    SolutionIndex: 393
    SolutionNameMin: Cijk_Alik_Bljk_S_MX_B_Bias_HA_SAV_UserArgs_MT256x160x32_MI16x16x1_SN_CLR1_GRVWA1_GRVWB4_GSU6_LBSPPA512_LBSPPB128_LPA8_LPB8_LRVW4_MIAV0_MIWT4_10_PLR1_SU0_SUM0_SUS0_SVW4_VWA4_WG64_4_1_WGM1
    SolutionIndex: 394
    SolutionNameMin: Cijk_Alik_Bljk_S_MX_B_Bias_HA_SAV_UserArgs_MT256x96x32_MI32x32x1_SN_CLR1_GRVWA4_GRVWB4_GSU5_LBSPPA256_LBSPPB128_LPA4_LPB4_LRVW4_MIAV0_MIWT2_3_PLR1_SU0_SUM0_SUS0_SVW2_VWA2_WG128_2_1_WGM1
    SolutionIndex: 395
    SolutionNameMin: Cijk_Alik_Bljk_S_MX_B_Bias_HA_SAV_UserArgs_MT128x96x64_MI16x16x1_SN_CLR1_GRVWA4_GRVWB4_GSU2_LBSPPA1024_LBSPPB256_LPA8_LPB8_LRVW4_MIAV1_MIWT4_3_PLR1_SU0_SUM0_SUS0_SVW4_VWA4_WG32_8_1_WGM1
    SolutionIndex: 396
    SolutionNameMin: Cijk_Alik_Bljk_S_MX_B_Bias_HA_SAV_UserArgs_MT128x64x64_MI16x16x1_SN_CLR1_GRVWA4_GRVWB4_GSU1_LBSPPA1024_LBSPPB256_LPA8_LPB8_LRVW4_MIAV1_MIWT4_2_PLR1_SU0_SUM0_SUS0_SVW4_VWA4_WG32_8_1_WGM1
    SolutionIndex: 397
    SolutionNameMin: Cijk_Alik_Bljk_S_MX_B_Bias_HA_SAV_UserArgs_MT192x128x32_MI32x32x1_SN_CLR1_GRVWA4_GRVWB4_GSU3_LBSPPA128_LBSPPB128_LPA4_LPB4_LRVW4_MIAV0_MIWT3_2_PLR1_SU0_SUM0_SUS0_SVW1_VWA1_WG64_4_1_WGM1
    SolutionIndex: 398
    SolutionNameMin: Cijk_Alik_Bljk_S_MX_B_Bias_HA_SAV_UserArgs_MT192x256x32_MI32x32x1_SN_CLR1_GRVWA4_GRVWB4_GSU6_LBSPPA128_LBSPPB128_LPA4_LPB4_LRVW4_MIAV0_MIWT3_4_PLR1_SU0_SUM0_SUS0_SVW1_VWA1_WG64_4_1_WGM1
    SolutionIndex: 399
    SolutionNameMin: Cijk_Alik_Bljk_S_MX_B_Bias_HA_SAV_UserArgs_MT128x256x32_MI32x32x1_SN_CLR1_GRVWA4_GRVWB4_GSU3_LBSPPA512_LBSPPB128_LPA4_LPB4_LRVW4_MIAV0_MIWT4_2_PLR1_SU0_SUM0_SUS0_SVW4_VWA4_WG32_8_1_WGM1
    SolutionIndex: 400
    SolutionNameMin: Cijk_Alik_Bljk_S_MX_B_Bias_HA_SAV_UserArgs_MT256x192x32_MI16x16x1_SN_CLR1_GRVWA1_GRVWB4_GSU4_LBSPPA512_LBSPPB128_LPA8_LPB8_LRVW4_MIAV0_MIWT8_6_PLR1_SU0_SUM0_SUS0_SVW4_VWA4_WG32_8_1_WGM1
    SolutionIndex: 401
    SolutionNameMin: Cijk_Alik_Bljk_S_MX_B_Bias_HA_SAV_UserArgs_MT128x128x32_MI16x16x1_SN_CLR1_GRVWA4_GRVWB4_GSU2_LBSPPA512_LBSPPB128_LPA8_LPB8_LRVW4_MIAV1_MIWT4_4_PLR1_SU0_SUM0_SUS0_SVW4_VWA4_WG32_8_1_WGM1
    SolutionIndex: 402
    SolutionNameMin: Cijk_Alik_Bljk_S_MX_B_Bias_HA_SAV_UserArgs_MT192x224x32_MI16x16x1_SN_CLR1_GRVWA1_GRVWB4_GSU4_LBSPPA256_LBSPPB128_LPA8_LPB8_LRVW4_MIAV0_MIWT6_7_PLR1_SU0_SUM0_SUS0_SVW2_VWA2_WG32_8_1_WGM1
    SolutionIndex: 403
    SolutionNameMin: Cijk_Alik_Bljk_S_MX_B_Bias_HA_SAV_UserArgs_MT96x128x64_MI16x16x1_SN_CLR1_GRVWA4_GRVWB4_GSU1_LBSPPA512_LBSPPB256_LPA8_LPB8_LRVW4_MIAV1_MIWT6_2_PLR1_SU0_SUM0_SUS0_SVW2_VWA2_WG16_16_1_WGM1
    SolutionIndex: 404
    SolutionNameMin: Cijk_Alik_Bljk_S_MX_B_Bias_HA_SAV_UserArgs_MT96x128x64_MI16x16x1_SN_CLR1_GRVWA4_GRVWB4_GSU1_LBSPPA256_LBSPPB256_LPA8_LPB8_LRVW4_MIAV1_MIWT3_4_PLR1_SU0_SUM0_SUS0_SVW1_VWA1_WG32_8_1_WGM1
    SolutionIndex: 405
    SolutionNameMin: Cijk_Alik_Bljk_S_MX_B_Bias_HA_SAV_UserArgs_MT192x128x32_MI32x32x1_SN_CLR1_GRVWA4_GRVWB4_GSU2_LBSPPA128_LBSPPB128_LPA4_LPB4_LRVW4_MIAV0_MIWT3_2_PLR1_SU0_SUM0_SUS0_SVW1_VWA1_WG64_4_1_WGM1
    SolutionIndex: 406
    SolutionNameMin: Cijk_Alik_Bljk_S_MX_B_Bias_HA_SAV_UserArgs_MT128x256x32_MI32x32x1_SN_CLR1_GRVWA4_GRVWB4_GSU3_LBSPPA256_LBSPPB128_LPA4_LPB4_LRVW4_MIAV0_MIWT2_4_PLR1_SU0_SUM0_SUS0_SVW2_VWA2_WG64_4_1_WGM1
    SolutionIndex: 407
    SolutionNameMin: Cijk_Alik_Bljk_S_MX_B_Bias_HA_SAV_UserArgs_MT192x256x32_MI32x32x1_SN_CLR1_GRVWA4_GRVWB4_GSU4_LBSPPA128_LBSPPB128_LPA4_LPB4_LRVW4_MIAV0_MIWT3_4_PLR1_SU0_SUM0_SUS0_SVW1_VWA1_WG64_4_1_WGM1
    SolutionIndex: 408
    SolutionNameMin: Cijk_Alik_Bljk_S_MX_B_Bias_HA_SAV_UserArgs_MT128x128x32_MI16x16x1_SN_CLR1_GRVWA4_GRVWB4_GSU1_LBSPPA512_LBSPPB128_LPA8_LPB8_LRVW4_MIAV1_MIWT8_2_PLR1_SU0_SUM0_SUS0_SVW4_VWA4_WG16_16_1_WGM1
    SolutionIndex: 409
    SolutionNameMin: Cijk_Alik_Bljk_S_MX_B_Bias_HA_SAV_UserArgs_MT128x256x32_MI32x32x1_SN_CLR1_GRVWA4_GRVWB4_GSU2_LBSPPA512_LBSPPB128_LPA4_LPB4_LRVW4_MIAV0_MIWT4_2_PLR1_SU0_SUM0_SUS0_SVW4_VWA4_WG32_8_1_WGM1
    SolutionIndex: 410
    SolutionNameMin: Cijk_Alik_Bljk_S_MX_B_Bias_HA_SAV_UserArgs_MT128x128x32_MI16x16x1_SN_GRVWA4_GRVWB4_GSU1_LBSPPA512_LBSPPB128_LPA8_LPB8_LRVW4_MIAV1_MIWT4_4_NTC3_NTD3_SU0_SUM0_SUS0_SVW4_VWA4_WG32_8_1_WGM1
    SolutionIndex: 411
    SolutionNameMin: Cijk_Alik_Bljk_S_MX_B_Bias_HA_SAV_UserArgs_MT112x256x32_MI16x16x1_SN_GRVWA1_GRVWB4_GSU2_LBSPPA128_LBSPPB128_LPA8_LPB8_LRVW4_MIAV0_MIWT7_4_NTC3_NTD3_SU0_SUM0_SUS0_SVW1_VWA1_WG16_16_1_WGM1
    SolutionIndex: 412
    SolutionNameMin: Cijk_Alik_Bljk_S_MX_B_Bias_HA_SAV_UserArgs_MT128x192x32_MI16x16x1_SN_GRVWA4_GRVWB4_GSU1_LBSPPA512_LBSPPB128_LPA8_LPB8_LRVW4_MIAV0_MIWT4_6_NTC3_NTD3_SU0_SUM0_SUS0_SVW4_VWA4_WG32_8_1_WGM1
    SolutionIndex: 413
    SolutionNameMin: Cijk_Alik_Bljk_S_MX_B_Bias_HA_SAV_UserArgs_MT160x128x32_MI16x16x1_SN_GRVWA4_GRVWB4_GSU1_LBSPPA128_LBSPPB128_LPA8_LPB8_LRVW4_MIAV1_MIWT5_4_NTC0_NTD0_SU0_SUM0_SUS0_SVW1_VWA1_WG32_8_1_WGMn8
    SolutionIndex: 414
    SolutionNameMin: Cijk_Alik_Bljk_S_MX_B_Bias_HA_SAV_UserArgs_MT160x128x32_MI16x16x1_SN_GRVWA1_GRVWB4_GSU1_LBSPPA128_LBSPPB128_LPA8_LPB8_LRVW4_MIAV1_MIWT5_4_NTC0_NTD0_SU0_SUM0_SUS0_SVW1_VWA1_WG32_8_1_WGMn8
    SolutionIndex: 415
    SolutionNameMin: Cijk_Alik_Bljk_S_MX_B_Bias_HA_SAV_UserArgs_MT128x128x32_MI16x16x1_SN_GRVWA4_GRVWB4_GSU1_LBSPPA512_LBSPPB128_LPA8_LPB8_LRVW4_MIAV1_MIWT4_4_NTC3_NTD3_SU0_SUM0_SUS0_SVW4_VWA4_WG32_8_1_WGMn8
    SolutionIndex: 416
    SolutionNameMin: Cijk_Alik_Bljk_S_MX_B_Bias_HA_SAV_UserArgs_MT160x224x32_MI16x16x1_SN_GRVWA1_GRVWB4_GSU2_LBSPPA128_LBSPPB128_LPA8_LPB8_LRVW4_MIAV0_MIWT5_7_NTC3_NTD3_SU0_SUM0_SUS0_SVW1_VWA1_WG32_8_1_WGM1
    SolutionIndex: 417
    SolutionNameMin: Cijk_Alik_Bljk_S_MX_B_Bias_HA_SAV_UserArgs_MT128x224x32_MI16x16x1_SN_GRVWA4_GRVWB4_GSU1_LBSPPA512_LBSPPB128_LPA8_LPB8_LRVW4_MIAV0_MIWT4_7_NTC3_NTD3_SU0_SUM0_SUS0_SVW4_VWA4_WG32_8_1_WGM1
    SolutionIndex: 418
    SolutionNameMin: Cijk_Alik_Bljk_S_MX_B_Bias_HA_SAV_UserArgs_MT128x224x32_MI16x16x1_SN_GRVWA1_GRVWB4_GSU1_LBSPPA512_LBSPPB128_LPA8_LPB8_LRVW4_MIAV0_MIWT4_7_NTC3_NTD3_SU0_SUM0_SUS0_SVW4_VWA4_WG32_8_1_WGMn8
    SolutionIndex: 419
    SolutionNameMin: Cijk_Alik_Bljk_S_MX_B_Bias_HA_SAV_UserArgs_MT96x128x64_MI16x16x1_SN_GRVWA4_GRVWB4_GSU1_LBSPPA256_LBSPPB256_LPA8_LPB8_LRVW4_MIAV1_MIWT3_4_NTC3_NTD3_SU0_SUM0_SUS0_SVW1_VWA1_WG32_8_1_WGMn8
    SolutionIndex: 420
    SolutionNameMin: Cijk_Alik_Bljk_S_MX_B_Bias_HA_SAV_UserArgs_MT128x160x32_MI16x16x1_SN_GRVWA4_GRVWB4_GSU1_LBSPPA512_LBSPPB128_LPA8_LPB8_LRVW4_MIAV1_MIWT4_5_NTC3_NTD3_SU0_SUM0_SUS0_SVW4_VWA4_WG32_8_1_WGM1
    SolutionIndex: 421
    SolutionNameMin: Cijk_Alik_Bljk_S_MX_B_Bias_HA_SAV_UserArgs_MT128x160x32_MI16x16x1_SN_GRVWA1_GRVWB4_GSU1_LBSPPA512_LBSPPB128_LPA8_LPB8_LRVW4_MIAV1_MIWT4_5_NTC3_NTD3_SU0_SUM0_SUS0_SVW4_VWA4_WG32_8_1_WGM1
    SolutionIndex: 422
    SolutionNameMin: Cijk_Alik_Bljk_S_MX_B_Bias_HA_SAV_UserArgs_MT128x160x32_MI16x16x1_SN_GRVWA1_GRVWB4_GSU1_LBSPPA512_LBSPPB128_LPA8_LPB8_LRVW4_MIAV1_MIWT4_5_NTC0_NTD0_SU0_SUM0_SUS0_SVW4_VWA4_WG32_8_1_WGMn8
    SolutionIndex: 423
    SolutionNameMin: Cijk_Alik_Bljk_S_MX_B_Bias_HA_SAV_UserArgs_MT128x256x32_MI32x32x1_SN_GRVWA4_GRVWB4_GSU1_LBSPPA512_LBSPPB128_LPA4_LPB4_LRVW4_MIAV0_MIWT4_2_NTC3_NTD3_SU0_SUM0_SUS0_SVW4_VWA4_WG32_8_1_WGM1
    SolutionIndex: 424
    SolutionNameMin: Cijk_Alik_Bljk_S_MX_B_Bias_HA_SAV_UserArgs_MT256x192x32_MI32x32x1_SN_GRVWA4_GRVWB4_GSU3_LBSPPA512_LBSPPB128_LPA4_LPB4_LRVW4_MIAV0_MIWT4_3_NTC3_NTD3_SU0_SUM0_SUS0_SVW4_VWA4_WG64_4_1_WGM1
    SolutionIndex: 425
    SolutionNameMin: Cijk_Alik_Bljk_S_MX_B_Bias_HA_SAV_UserArgs_MT256x112x32_MI16x16x1_SN_GRVWA4_GRVWB1_GSU1_LBSPPA512_LPA8_LPB8_LRVW4_MIWT4_7_NTC3_NTD3_SU0_SUM0_SUS0_SVW4_VWA4_WG64_4_1_WGMn8
    SolutionIndex: 426
    SolutionNameMin: Cijk_Alik_Bljk_S_MX_B_Bias_HA_SAV_UserArgs_MT224x128x32_MI16x16x1_SN_GRVWA1_GRVWB4_GSU1_LBSPPA128_LPA8_LPB8_LRVW4_MIWT7_4_NTC3_NTD3_SU0_SUM0_SUS0_SVW1_VWA1_WG32_8_1_WGMn16
    SolutionIndex: 427
    SolutionNameMin: Cijk_Alik_Bljk_S_MX_B_Bias_HA_SAV_UserArgs_MT224x128x32_MI16x16x1_SN_GRVWA1_GRVWB4_GSU1_LBSPPA128_LPA8_LPB8_LRVW4_MIWT7_4_NTC0_NTD0_SU0_SUM0_SUS0_SVW1_VWA1_WG32_8_1_WGMn8
    SolutionIndex: 428
    SolutionNameMin: Cijk_Alik_Bljk_S_MX_B_Bias_HA_SAV_UserArgs_MT256x192x32_MI32x32x1_SN_GRVWA4_GRVWB4_GSU1_LBSPPA512_LPA4_LPB4_LRVW4_MIWT4_3_NTC3_NTD3_SU0_SUM0_SUS0_SVW4_VWA4_WG64_4_1_WGMn8
    SolutionIndex: 429
    SolutionNameMin: Cijk_Alik_Bljk_S_MX_B_Bias_HA_SAV_UserArgs_MT160x256x32_MI32x32x1_SN_GRVWA1_GRVWB4_GSU1_LBSPPA128_LPA4_LPB4_LRVW4_MIWT5_2_NTC3_NTD3_SU0_SUM0_SUS0_SVW1_VWA1_WG32_8_1_WGMn16
    SolutionIndex: 430
    SolutionNameMin: Cijk_Alik_Bljk_S_MX_B_Bias_HA_SAV_UserArgs_MT256x128x32_MI16x16x1_SN_GRVWA4_GRVWB4_GSU1_LBSPPA512_LPA8_LPB8_LRVW4_MIWT8_4_NTC3_NTD3_SU0_SUM0_SUS0_SVW4_VWA4_WG32_8_1_WGMn16
    SolutionIndex: 431
    SolutionNameMin: Cijk_Alik_Bljk_S_MX_B_Bias_HA_SAV_UserArgs_MT256x128x32_MI16x16x1_SN_GRVWA1_GRVWB4_GSU1_LBSPPA512_LPA8_LPB8_LRVW4_MIWT8_4_NTC3_NTD3_SU0_SUM0_SUS0_SVW4_VWA4_WG32_8_1_WGMn8
    SolutionIndex: 432
    SolutionNameMin: Cijk_Alik_Bljk_S_MX_B_Bias_HA_SAV_UserArgs_MT224x160x32_MI16x16x1_SN_GRVWA1_GRVWB4_GSU1_LBSPPA128_LPA8_LPB8_LRVW4_MIWT7_5_NTC3_NTD3_SU0_SUM0_SUS0_SVW1_VWA1_WG32_8_1_WGMn8
    SolutionIndex: 433
    SolutionNameMin: Cijk_Alik_Bljk_S_MX_B_Bias_HA_SAV_UserArgs_MT256x256x16_MI32x32x1_SN_GRVWA4_GRVWB4_GSU1_LBSPPA256_LPA4_LPB4_LRVW4_MIWT4_4_NTC3_NTD3_SU0_SUM0_SUS0_SVW4_VWA4_WG64_4_1_WGMn8
    SolutionIndex: 434
    SolutionNameMin: Cijk_Alik_Bljk_S_MX_B_Bias_HA_SAV_UserArgs_MT256x224x32_MI16x16x1_SN_GRVWA1_GRVWB1_GSU1_LBSPPA512_LPA2_LPB2_LRVW2_MIWT8_7_NTC3_NTD3_SU0_SUM0_SUS0_SVW4_VWA4_WG32_8_1_WGMn16
    SolutionIndex: 435
    SolutionNameMin: Cijk_Alik_Bljk_S_MX_B_Bias_HA_SAV_UserArgs_MT160x320x32_MI16x16x1_SN_GRVWA1_GRVWB1_GSU1_LBSPPA128_LPA2_LPB2_LRVW2_MIWT5_10_NTC0_NTD0_SU0_SUM0_SUS0_SVW1_VWA1_WG32_8_1_WGMn16
    SolutionIndex: 436
    SolutionNameMin: Cijk_Alik_Bljk_S_MX_B_Bias_HA_SAV_UserArgs_MT256x192x32_MI32x32x1_SN_GRVWA4_GRVWB4_GSU1_LBSPPA512_LPA4_LPB4_LRVW4_MIWT4_3_NTC3_NTD3_SU0_SUM0_SUS0_SVW4_VWA4_WG64_4_1_WGMn16
    SolutionIndex: 437
    SolutionNameMin: Cijk_Alik_Bljk_S_MX_B_Bias_HA_SAV_UserArgs_MT160x256x32_MI32x32x1_SN_GRVWA4_GRVWB4_GSU1_LBSPPA128_LPA4_LPB4_LRVW4_MIWT5_2_NTC3_NTD3_SU0_SUM0_SUS0_SVW1_VWA1_WG32_8_1_WGMn8
    SolutionIndex: 438
    SolutionNameMin: Cijk_Alik_Bljk_S_MX_B_Bias_HA_SAV_UserArgs_MT160x256x32_MI32x32x1_SN_GRVWA1_GRVWB4_GSU1_LBSPPA128_LPA4_LPB4_LRVW4_MIWT5_2_NTC3_NTD3_SU0_SUM0_SUS0_SVW1_VWA1_WG32_8_1_WGMn8
    SolutionIndex: 439
    SolutionNameMin: Cijk_Alik_Bljk_S_MX_B_Bias_HA_SAV_UserArgs_MT256x256x16_MI32x32x1_SN_GRVWA4_GRVWB4_GSU1_LBSPPA256_LPA4_LPB4_LRVW4_MIWT4_4_NTC0_NTD0_SU0_SUM0_SUS0_SVW4_VWA4_WG64_4_1_WGMn8
    SolutionIndex: 440
    SolutionNameMin: Cijk_Alik_Bljk_S_MX_B_Bias_HA_SAV_UserArgs_MT320x192x16_MI16x16x1_SN_GRVWA1_GRVWB4_GSU1_LBSPPA256_LPA2_LPB4_LRVW2_MIWT20_3_NTC3_NTD3_SU0_SUM0_SUS0_SVW4_VWA4_WG16_16_1_WGMn16
    SolutionIndex: 441
    SolutionNameMin: Cijk_Alik_Bljk_S_MX_B_Bias_HA_SAV_UserArgs_MT320x192x16_MI16x16x1_SN_GRVWA1_GRVWB4_GSU1_LBSPPA256_LPA2_LPB4_LRVW2_MIWT20_3_NTC0_NTD0_SU0_SUM0_SUS0_SVW4_VWA4_WG16_16_1_WGMn16
    SolutionIndex: 442
    SolutionNameMin: Cijk_Alik_Bljk_S_MX_B_Bias_HA_SAV_UserArgs_MT256x256x16_MI32x32x1_SN_GRVWA4_GRVWB4_GSU1_LBSPPA256_LPA4_LPB4_LRVW4_MIWT4_4_SU8_SUM0_SUS256_SVW4_VWA4_WG64_4_1_WGMn16
    SolutionIndex: 443
    SolutionNameMin: Cijk_Alik_Bljk_S_MX_B_Bias_HA_SAV_UserArgs_MT208x256x32_MI16x16x1_SN_GRVWA1_GRVWB4_GSU1_LBSPPA128_LPA2_LPB4_LRVW2_MIWT13_4_SU8_SUM0_SUS256_SVW1_VWA1_WG16_16_1_WGMn16
    SolutionIndex: 444
    SolutionNameMin: Cijk_Alik_Bljk_S_MX_B_Bias_HA_SAV_UserArgs_MT208x256x16_MI16x16x1_SN_GRVWA1_GRVWB4_GSU1_LBSPPA128_LPA2_LPB4_LRVW2_MIWT13_4_SU8_SUM0_SUS256_SVW1_VWA1_WG16_16_1_WGMn16
    SolutionIndex: 445
    SolutionNameMin: Cijk_Alik_Bljk_S_MX_B_Bias_HA_SAV_UserArgs_MT256x192x32_MI32x32x1_SN_GRVWA4_GRVWB4_GSU1_LBSPPA512_LPA4_LPB4_LRVW4_MIWT4_3_SU8_SUM0_SUS256_SVW4_VWA4_WG64_4_1_WGMn16
    SolutionIndex: 446
    SolutionNameMin: Cijk_Alik_Bljk_S_MX_B_Bias_HA_SAV_UserArgs_MT256x192x32_MI32x32x1_SN_GRVWA1_GRVWB4_GSU1_LBSPPA512_LPA4_LPB4_LRVW4_MIWT4_3_SU8_SUM0_SUS256_SVW4_VWA4_WG64_4_1_WGMn16
    SolutionIndex: 447
    SolutionNameMin: Cijk_Alik_Bljk_S_MX_B_Bias_HA_SAV_UserArgs_MT192x256x32_MI32x32x1_SN_GRVWA4_GRVWB4_GSU1_LBSPPA128_LPA4_LPB4_LRVW4_MIWT3_4_SU8_SUM0_SUS256_SVW1_VWA1_WG64_4_1_WGMn16
    SolutionIndex: 448
    SolutionNameMin: Cijk_Alik_Bljk_S_MX_B_Bias_HA_SAV_UserArgs_MT512x128x16_MI32x32x1_SN_GRVWA4_GRVWB4_GSU1_LBSPPA256_LPA4_LPB4_LRVW4_MIWT4_4_SU8_SUM0_SUS256_SVW4_VWA4_WG128_2_1_WGMn16
    SolutionIndex: 449
    SolutionNameMin: Cijk_Alik_Bljk_S_MX_B_Bias_HA_SAV_UserArgs_MT192x256x32_MI32x32x1_SN_GRVWA1_GRVWB4_GSU1_LBSPPA256_LPA4_LPB4_LRVW4_MIWT6_2_SU8_SUM0_SUS256_SVW2_VWA2_WG32_8_1_WGMn16
    SolutionIndex: 450
    SolutionNameMin: Cijk_Alik_Bljk_S_MX_B_Bias_HA_SAV_UserArgs_MT384x128x16_MI16x16x1_SN_GRVWA1_GRVWB4_GSU1_LBSPPA256_LPA2_LPB4_LRVW2_MIWT12_4_SU8_SUM0_SUS256_SVW4_VWA4_WG32_8_1_WGMn16
    SolutionIndex: 451
    SolutionNameMin: Cijk_Alik_Bljk_S_MX_B_Bias_HA_SAV_UserArgs_MT256x224x32_MI16x16x1_SN_GRVWA1_GRVWB1_GSU1_LBSPPA512_LPA2_LPB2_LRVW2_MIWT8_7_SU8_SUM0_SUS256_SVW4_VWA4_WG32_8_1_WGMn16
    SolutionIndex: 452
    SolutionNameMin: Cijk_Alik_Bljk_S_MX_B_Bias_HA_SAV_UserArgs_MT160x320x32_MI16x16x1_SN_GRVWA1_GRVWB1_GSU1_LBSPPA256_LPA2_LPB2_LRVW2_MIWT10_5_SU8_SUM0_SUS256_SVW2_VWA2_WG16_16_1_WGMn16
    SolutionIndex: 453
    SolutionNameMin: Cijk_Alik_Bljk_S_MX_B_Bias_HA_SAV_UserArgs_MT512x128x16_MI32x32x1_SN_GRVWA1_GRVWB1_GSU1_LBSPPA256_LPA4_LPB4_LRVW4_MIWT4_4_SU8_SUM0_SUS256_SVW4_VWA4_WG128_2_1_WGMn16
    SolutionIndex: 454
    SolutionNameMin: Cijk_Alik_Bljk_S_MX_B_Bias_HA_SAV_UserArgs_MT288x160x32_MI16x16x1_SN_GRVWA1_GRVWB4_GSU1_LBSPPA128_LPA2_LPB4_LRVW2_MIWT9_5_SU8_SUM0_SUS256_SVW1_VWA1_WG32_8_1_WGMn16
    SolutionIndex: 455
    SolutionNameMin: Cijk_Alik_Bljk_S_MX_B_Bias_HA_SAV_UserArgs_MT256x224x16_MI16x16x1_SN_GRVWA1_GRVWB1_GSU1_LBSPPA256_LPA2_LPB2_LRVW2_MIWT8_7_SU8_SUM0_SUS256_SVW4_VWA4_WG32_8_1_WGMn16
    SolutionIndex: 456
    SolutionNameMin: Cijk_Alik_Bljk_S_MX_B_Bias_HA_SAV_UserArgs_MT320x192x16_MI16x16x1_SN_GRVWA1_GRVWB4_GSU1_LBSPPA256_LPA2_LPB4_LRVW2_MIWT20_3_SU8_SUM0_SUS256_SVW4_VWA4_WG16_16_1_WGMn16
    SolutionIndex: 457
    SolutionNameMin: Cijk_Alik_Bljk_S_MX_B_Bias_HA_SAV_UserArgs_MT240x256x16_MI16x16x1_SN_GRVWA1_GRVWB4_GSU1_LBSPPA128_LPA2_LPB4_LRVW2_MIWT15_4_SU8_SUM0_SUS256_SVW1_VWA1_WG16_16_1_WGMn16
    SolutionIndex: 458
    SolutionNameMin: Cijk_Alik_Bljk_S_MX_B_Bias_HA_SAV_UserArgs_MT256x176x32_MI16x16x1_SN_GRVWA1_GRVWB1_GSU1_LBSPPA512_LPA8_LPB8_LRVW4_MIWT4_11_SU8_SUM0_SUS256_SVW4_VWA4_WG64_4_1_WGMn16
    SolutionIndex: 459
    SolutionNameMin: Cijk_Alik_Bljk_S_MX_B_Bias_HA_SAV_UserArgs_MT192x256x32_MI32x32x1_SN_GRVWA4_GRVWB4_GSU1_LBSPPA256_LPA4_LPB4_LRVW4_MIWT6_2_SU8_SUM0_SUS256_SVW2_VWA2_WG32_8_1_WGMn16
    SolutionIndex: 460
    SolutionNameMin: Cijk_Alik_Bljk_S_MX_B_Bias_HA_SAV_UserArgs_MT16x64x128_MI16x16x1_SN_GRVWA4_GRVWB4_GSU5_LBSPPA512_LBSPPB512_LPA8_LPB8_LRVW4_MIWT1_1_NLCA1_NLCB1_SU0_SUM0_SUS0_SVW1_VWA1_WG16_16_1_WGM1
    SolutionIndex: 461
    SolutionNameMin: Cijk_Alik_Bljk_S_MX_B_Bias_HA_SAV_UserArgs_MT32x64x128_MI16x16x1_SN_GRVWA4_GRVWB4_GSU4_LBSPPA1024_LBSPPB512_LPA8_LPB8_LRVW4_MIWT2_2_NLCA1_NLCB1_SU0_SUM0_SUS0_SVW2_VWA2_WG16_8_2_WGM1
    SolutionIndex: 462
    SolutionNameMin: Cijk_Alik_Bljk_S_MX_B_Bias_HA_SAV_UserArgs_MT32x64x128_MI32x32x1_SN_GRVWA4_GRVWB4_GSU4_LBSPPA512_LBSPPB512_LPA4_LPB4_LRVW4_MIWT1_1_NLCA1_NLCB1_SU0_SUM0_SUS0_SVW1_VWA1_WG32_4_2_WGM1
    SolutionIndex: 463
    SolutionNameMin: Cijk_Alik_Bljk_S_MX_B_Bias_HA_SAV_UserArgs_MT16x96x128_MI16x16x1_SN_GRVWA4_GRVWB4_GSU5_LBSPPA512_LBSPPB512_LPA8_LPB8_LRVW4_MIWT1_3_NLCA1_NLCB1_SU0_SUM0_SUS0_SVW1_VWA1_WG16_8_2_WGM1
    SolutionIndex: 464
    SolutionNameMin: Cijk_Alik_Bljk_S_MX_B_Bias_HA_SAV_UserArgs_MT16x48x128_MI16x16x1_SN_GRVWA4_GRVWB4_GSU1_LBSPPA512_LBSPPB512_LPA8_LPB8_LRVW4_MIWT1_3_NLCA1_NLCB1_SU0_SUM0_SUS0_SVW1_VWA1_WG16_4_4_WGM1
    SolutionIndex: 465
    SolutionNameMin: Cijk_Alik_Bljk_S_MX_B_Bias_HA_SAV_UserArgs_MT32x64x128_MI32x32x1_SN_GRVWA4_GRVWB4_GSU3_LBSPPA512_LBSPPB512_LPA4_LPB4_LRVW4_MIWT1_1_NLCA1_NLCB1_SU0_SUM0_SUS0_SVW1_VWA1_WG32_4_2_WGM1
    SolutionIndex: 466
    SolutionNameMin: Cijk_Alik_Bljk_S_MX_B_Bias_HA_SAV_UserArgs_MT32x80x128_MI16x16x1_SN_GRVWA4_GRVWB4_GSU4_LBSPPA512_LBSPPB512_LPA8_LPB8_LRVW4_MIWT1_5_NLCA1_NLCB1_SU0_SUM0_SUS0_SVW1_VWA1_WG32_4_2_WGM1
    SolutionIndex: 467
    SolutionNameMin: Cijk_Alik_Bljk_S_MX_B_Bias_HA_SAV_UserArgs_MT64x96x64_MI16x16x1_SN_GRVWA4_GRVWB4_GSU7_LBSPPA512_LBSPPB256_LPA8_LPB8_LRVW4_MIAV1_MIWT2_3_SU0_SUM0_SUS0_SVW2_VWA2_WG32_8_1_WGM1
    SolutionIndex: 468
    SolutionNameMin: Cijk_Alik_Bljk_S_MX_B_Bias_HA_SAV_UserArgs_MT96x96x64_MI16x16x1_SN_GRVWA4_GRVWB4_GSU6_LBSPPA256_LBSPPB256_LPA8_LPB8_LRVW4_MIAV1_MIWT3_3_SU0_SUM0_SUS0_SVW1_VWA1_WG32_8_1_WGM1
    SolutionIndex: 469
    SolutionNameMin: Cijk_Alik_Bljk_S_MX_B_Bias_HA_SAV_UserArgs_MT64x160x64_MI16x16x1_SN_GRVWA4_GRVWB4_GSU8_LBSPPA512_LBSPPB256_LPA8_LPB8_LRVW4_MIAV1_MIWT2_5_SU0_SUM0_SUS0_SVW2_VWA2_WG32_8_1_WGM1
    SolutionIndex: 470
    SolutionNameMin: Cijk_Alik_Bljk_S_MX_B_Bias_HA_SAV_UserArgs_MT32x64x128_MI32x32x1_SN_GRVWA4_GRVWB4_GSU1_LBSPPA512_LBSPPB512_LPA4_LPB4_LRVW4_MIAV1_MIWT1_2_SU0_SUM0_SUS0_SVW1_VWA1_WG32_2_4_WGM1
    SolutionIndex: 471
    SolutionNameMin: Cijk_Alik_Bljk_S_MX_B_Bias_HA_SAV_UserArgs_MT96x128x64_MI16x16x1_SN_GRVWA4_GRVWB4_GSU5_LBSPPA256_LBSPPB256_LPA8_LPB8_LRVW4_MIAV1_MIWT3_4_SU0_SUM0_SUS0_SVW1_VWA1_WG32_8_1_WGM1
    SolutionIndex: 472
    SolutionNameMin: Cijk_Alik_Bljk_S_MX_B_Bias_HA_SAV_UserArgs_MT128x96x64_MI16x16x1_SN_CLR1_GRVWA4_GRVWB4_GSU7_LBSPPA1024_LBSPPB256_LPA8_LPB8_LRVW4_MIAV1_MIWT4_3_PLR1_SU0_SUM0_SUS0_SVW4_VWA4_WG32_8_1_WGM1
    SolutionIndex: 473
    SolutionNameMin: Cijk_Alik_Bljk_S_MX_B_Bias_HA_SAV_UserArgs_MT192x128x32_MI32x32x1_SN_CLR1_GRVWA4_GRVWB4_GSU6_LBSPPA128_LBSPPB128_LPA4_LPB4_LRVW4_MIAV0_MIWT3_2_PLR1_SU0_SUM0_SUS0_SVW1_VWA1_WG64_4_1_WGM1
    SolutionIndex: 474
    SolutionNameMin: Cijk_Alik_Bljk_S_MX_B_Bias_HA_SAV_UserArgs_MT64x64x64_MI32x32x1_SN_CLR1_GRVWA4_GRVWB4_GSU1_LBSPPA512_LBSPPB256_LPA4_LPB4_LRVW4_MIAV1_MIWT2_1_PLR1_SU0_SUM0_SUS0_SVW2_VWA2_WG32_4_2_WGM1
    SolutionIndex: 475
    SolutionNameMin: Cijk_Alik_Bljk_S_MX_B_Bias_HA_SAV_UserArgs_MT128x128x32_MI16x16x1_SN_CLR1_GRVWA4_GRVWB4_GSU3_LBSPPA512_LBSPPB128_LPA8_LPB8_LRVW4_MIAV1_MIWT4_4_PLR1_SU0_SUM0_SUS0_SVW4_VWA4_WG32_8_1_WGM1
    SolutionIndex: 476
    SolutionNameMin: Cijk_Alik_Bljk_S_MX_B_Bias_HA_SAV_UserArgs_MT256x128x32_MI32x32x1_SN_CLR1_GRVWA4_GRVWB4_GSU6_LBSPPA256_LBSPPB128_LPA4_LPB4_LRVW4_MIAV0_MIWT2_4_PLR1_SU0_SUM0_SUS0_SVW2_VWA2_WG128_2_1_WGM1
    SolutionIndex: 477
    SolutionNameMin: Cijk_Alik_Bljk_S_MX_B_Bias_HA_SAV_UserArgs_MT64x128x64_MI16x16x1_SN_CLR1_GRVWA4_GRVWB4_GSU1_LBSPPA1024_LBSPPB256_LPA8_LPB8_LRVW4_MIAV1_MIWT4_2_PLR1_SU0_SUM0_SUS0_SVW4_VWA4_WG16_16_1_WGM1
    SolutionIndex: 478
    SolutionNameMin: Cijk_Alik_Bljk_S_MX_B_Bias_HA_SAV_UserArgs_MT128x192x32_MI32x32x1_SN_CLR1_GRVWA4_GRVWB4_GSU3_LBSPPA256_LBSPPB128_LPA4_LPB4_LRVW4_MIAV0_MIWT2_3_PLR1_SU0_SUM0_SUS0_SVW2_VWA2_WG64_4_1_WGM1
    SolutionIndex: 479
    SolutionNameMin: Cijk_Alik_Bljk_S_MX_B_Bias_HA_SAV_UserArgs_MT128x128x32_MI32x32x1_SN_CLR1_GRVWA4_GRVWB4_GSU2_LBSPPA256_LBSPPB128_LPA4_LPB4_LRVW4_MIAV1_MIWT2_2_PLR1_SU0_SUM0_SUS0_SVW2_VWA2_WG64_4_1_WGM1
    SolutionIndex: 480
    SolutionNameMin: Cijk_Alik_Bljk_S_MX_B_Bias_HA_SAV_UserArgs_MT128x64x64_MI16x16x1_SN_CLR1_GRVWA4_GRVWB4_GSU2_LBSPPA512_LBSPPB256_LPA8_LPB8_LRVW4_MIAV1_MIWT2_4_PLR1_SU0_SUM0_SUS0_SVW2_VWA2_WG64_4_1_WGM1
    SolutionIndex: 481
    SolutionNameMin: Cijk_Alik_Bljk_S_MX_B_Bias_HA_SAV_UserArgs_MT256x128x32_MI32x32x1_SN_CLR1_GRVWA4_GRVWB4_GSU3_LBSPPA256_LBSPPB128_LPA4_LPB4_LRVW4_MIAV0_MIWT2_4_PLR1_SU0_SUM0_SUS0_SVW2_VWA2_WG128_2_1_WGM1
    SolutionIndex: 482
    SolutionNameMin: Cijk_Alik_Bljk_S_MX_B_Bias_HA_SAV_UserArgs_MT128x96x64_MI16x16x1_SN_CLR1_GRVWA4_GRVWB4_GSU1_LBSPPA1024_LBSPPB256_LPA8_LPB8_LRVW4_MIAV1_MIWT4_3_PLR1_SU0_SUM0_SUS0_SVW4_VWA4_WG32_8_1_WGM1
    SolutionIndex: 483
    SolutionNameMin: Cijk_Alik_Bljk_S_MX_B_Bias_HA_SAV_UserArgs_MT128x192x32_MI32x32x1_SN_CLR1_GRVWA4_GRVWB4_GSU2_LBSPPA256_LBSPPB128_LPA4_LPB4_LRVW4_MIAV0_MIWT2_3_PLR1_SU0_SUM0_SUS0_SVW2_VWA2_WG64_4_1_WGM1
    SolutionIndex: 484
    SolutionNameMin: Cijk_Alik_Bljk_S_MX_B_Bias_HA_SAV_UserArgs_MT256x128x32_MI32x32x1_SN_CLR1_GRVWA4_GRVWB4_GSU2_LBSPPA512_LBSPPB128_LPA4_LPB4_LRVW4_MIAV0_MIWT4_2_PLR1_SU0_SUM0_SUS0_SVW4_VWA4_WG64_4_1_WGM1
    SolutionIndex: 485
    SolutionNameMin: Cijk_Alik_Bljk_S_MX_B_Bias_HA_SAV_UserArgs_MT192x256x32_MI32x32x1_SN_GRVWA4_GRVWB4_GSU3_LBSPPA128_LBSPPB128_LPA4_LPB4_LRVW4_MIAV0_MIWT3_4_NTC3_NTD3_SU0_SUM0_SUS0_SVW1_VWA1_WG64_4_1_WGM1
    SolutionIndex: 486
    SolutionNameMin: Cijk_Alik_Bljk_S_MX_B_Bias_HA_SAV_UserArgs_MT128x192x32_MI16x16x1_SN_GRVWA4_GRVWB4_GSU1_LBSPPA512_LBSPPB128_LPA8_LPB8_LRVW4_MIAV0_MIWT8_3_NTC3_NTD3_SU0_SUM0_SUS0_SVW4_VWA4_WG16_16_1_WGM1
    SolutionIndex: 487
    SolutionNameMin: Cijk_Alik_Bljk_S_MX_B_Bias_HA_SAV_UserArgs_MT160x128x32_MI16x16x1_SN_GRVWA4_GRVWB4_GSU1_LBSPPA128_LBSPPB128_LPA8_LPB8_LRVW4_MIAV1_MIWT5_4_NTC3_NTD3_SU0_SUM0_SUS0_SVW1_VWA1_WG32_8_1_WGM1
    SolutionIndex: 488
    SolutionNameMin: Cijk_Alik_Bljk_S_MX_B_Bias_HA_SAV_UserArgs_MT256x128x32_MI32x32x1_SN_GRVWA1_GRVWB4_GSU1_LBSPPA512_LBSPPB128_LPA4_LPB4_LRVW4_MIAV0_MIWT4_2_NTC3_NTD3_SU0_SUM0_SUS0_SVW4_VWA4_WG64_4_1_WGM1
    SolutionIndex: 489
    SolutionNameMin: Cijk_Alik_Bljk_S_MX_B_Bias_HA_SAV_UserArgs_MT160x192x32_MI16x16x1_SN_GRVWA1_GRVWB4_GSU1_LBSPPA128_LBSPPB128_LPA8_LPB8_LRVW4_MIAV0_MIWT5_6_NTC0_NTD0_SU0_SUM0_SUS0_SVW1_VWA1_WG32_8_1_WGM1
    SolutionIndex: 490
    SolutionNameMin: Cijk_Alik_Bljk_S_MX_B_Bias_HA_SAV_UserArgs_MT128x224x32_MI16x16x1_SN_GRVWA4_GRVWB4_GSU1_LBSPPA512_LPA8_LPB8_LRVW4_MIWT4_7_NTC3_NTD3_SU0_SUM0_SUS0_SVW4_VWA4_WG32_8_1_WGM1
    SolutionIndex: 491
    SolutionNameMin: Cijk_Alik_Bljk_S_MX_B_Bias_HA_SAV_UserArgs_MT128x224x32_MI16x16x1_SN_GRVWA4_GRVWB4_GSU1_LBSPPA512_LPA8_LPB8_LRVW4_MIWT4_7_NTC3_NTD3_SU0_SUM0_SUS0_SVW4_VWA4_WG32_8_1_WGMn8
    SolutionIndex: 492
    SolutionNameMin: Cijk_Alik_Bljk_S_MX_B_Bias_HA_SAV_UserArgs_MT256x192x32_MI32x32x1_SN_GRVWA4_GRVWB4_GSU1_LBSPPA512_LPA4_LPB4_LRVW4_MIWT4_3_NTC0_NTD0_SU0_SUM0_SUS0_SVW4_VWA4_WG64_4_1_WGM1
    SolutionIndex: 493
    SolutionNameMin: Cijk_Alik_Bljk_S_MX_B_Bias_HA_SAV_UserArgs_MT160x256x32_MI32x32x1_SN_GRVWA4_GRVWB4_GSU1_LBSPPA128_LPA4_LPB4_LRVW4_MIWT5_2_NTC3_NTD3_SU0_SUM0_SUS0_SVW1_VWA1_WG32_8_1_WGM1
    SolutionIndex: 494
    SolutionNameMin: Cijk_Alik_Bljk_S_MX_B_Bias_HA_SAV_UserArgs_MT256x160x32_MI16x16x1_SN_GRVWA4_GRVWB4_GSU1_LBSPPA512_LPA8_LPB8_LRVW4_MIWT8_5_NTC3_NTD3_SU0_SUM0_SUS0_SVW4_VWA4_WG32_8_1_WGMn8
    SolutionIndex: 495
    SolutionNameMin: Cijk_Alik_Bljk_S_MX_B_Bias_HA_SAV_UserArgs_MT256x160x32_MI32x32x1_SN_GRVWA1_GRVWB4_GSU1_LBSPPA256_LPA4_LPB4_LRVW4_MIWT2_5_NTC0_NTD0_SU0_SUM0_SUS0_SVW2_VWA2_WG128_2_1_WGMn8
    SolutionIndex: 496
    SolutionNameMin: Cijk_Alik_Bljk_S_MX_B_Bias_HA_SAV_UserArgs_MT192x320x16_MI16x16x1_SN_GRVWA1_GRVWB4_GSU1_LBSPPA256_LPA2_LPB4_LRVW2_MIWT12_5_NTC3_NTD3_SU0_SUM0_SUS0_SVW4_VWA4_WG16_16_1_WGM1
    SolutionIndex: 497
    SolutionNameMin: Cijk_Alik_Bljk_S_MX_B_Bias_HA_SAV_UserArgs_MT192x160x32_MI16x16x1_SN_GRVWA1_GRVWB4_GSU1_LBSPPA256_LPA8_LPB8_LRVW4_MIWT6_5_NTC3_NTD3_SU0_SUM0_SUS0_SVW2_VWA2_WG32_8_1_WGMn8
    SolutionIndex: 498
    SolutionNameMin: Cijk_Alik_Bljk_S_MX_B_Bias_HA_SAV_UserArgs_MT256x208x16_MI16x16x1_SN_GRVWA1_GRVWB1_GSU1_LBSPPA256_LPA2_LPB2_LRVW2_MIWT4_13_SU8_SUM0_SUS256_SVW4_VWA4_WG64_4_1_WGMn8
    SolutionIndex: 499
    SolutionNameMin: Cijk_Alik_Bljk_S_MX_B_Bias_HA_SAV_UserArgs_MT256x224x32_MI16x16x1_SN_GRVWA1_GRVWB1_GSU1_LBSPPA512_LPA2_LPB2_LRVW2_MIWT8_7_SU8_SUM0_SUS256_SVW4_VWA4_WG32_8_1_WGMn8
    SolutionIndex: 500
    SolutionNameMin: Cijk_Alik_Bljk_S_MX_B_Bias_HA_SAV_UserArgs_MT208x256x32_MI16x16x1_SN_GRVWA1_GRVWB4_GSU1_LBSPPA128_LPA2_LPB4_LRVW2_MIWT13_4_SU8_SUM0_SUS256_SVW1_VWA1_WG16_16_1_WGMn8
    SolutionIndex: 501
    SolutionNameMin: Cijk_Alik_Bljk_S_MX_B_Bias_HA_SAV_UserArgs_MT160x256x16_MI32x32x1_SN_GRVWA1_GRVWB4_GSU1_LBSPPA128_LPA4_LPB4_LRVW4_MIWT5_2_SU8_SUM0_SUS256_SVW1_VWA1_WG32_8_1_WGMn8
    SolutionIndex: 502
    SolutionNameMin: Cijk_Alik_Bljk_S_MX_B_Bias_HA_SAV_UserArgs_MT160x256x16_MI32x32x1_SN_GRVWA1_GRVWB4_GSU1_LBSPPA128_LPA4_LPB4_LRVW4_MIWT5_2_SU8_SUM0_SUS256_SVW1_VWA1_WG32_8_1_WGMn16
    SolutionIndex: 503
    SolutionNameMin: Cijk_Alik_Bljk_S_MX_B_Bias_HA_SAV_UserArgs_MT160x256x16_MI16x16x1_SN_GRVWA1_GRVWB4_GSU1_LBSPPA128_LPA2_LPB4_LRVW2_MIWT10_4_SU8_SUM0_SUS256_SVW2_VWA2_WG16_16_1_WGMn8
    SolutionIndex: 504
    SolutionNameMin: Cijk_Alik_Bljk_S_MX_B_Bias_HA_SAV_UserArgs_MT160x256x32_MI32x32x1_SN_GRVWA4_GRVWB4_GSU1_LBSPPA128_LPA4_LPB4_LRVW4_MIWT5_2_SU8_SUM0_SUS256_SVW1_VWA1_WG32_8_1_WGMn8
    SolutionIndex: 505
    SolutionNameMin: Cijk_Alik_Bljk_S_MX_B_Bias_HA_SAV_UserArgs_MT256x256x16_MI32x32x1_SN_GRVWA4_GRVWB4_GSU1_LBSPPA256_LPA4_LPB4_LRVW4_MIWT4_4_SU8_SUM0_SUS256_SVW4_VWA4_WG64_4_1_WGMn8
    SolutionIndex: 506
    SolutionNameMin: Cijk_Alik_Bljk_S_MX_B_Bias_HA_SAV_UserArgs_MT192x320x16_MI16x16x1_SN_GRVWA1_GRVWB4_GSU1_LBSPPA256_LPA2_LPB4_LRVW2_MIWT12_5_SU8_SUM0_SUS256_SVW4_VWA4_WG16_16_1_WGMn16
    SolutionIndex: 507
    SolutionNameMin: Cijk_Alik_Bljk_S_MX_B_Bias_HA_SAV_UserArgs_MT160x256x32_MI32x32x1_SN_GRVWA4_GRVWB4_GSU1_LBSPPA128_LPA4_LPB4_LRVW4_MIWT5_2_SU8_SUM0_SUS256_SVW1_VWA1_WG32_8_1_WGMn16
    SolutionIndex: 508
    SolutionNameMin: Cijk_Alik_Bljk_S_MX_B_Bias_HA_SAV_UserArgs_MT256x208x16_MI16x16x1_SN_GRVWA1_GRVWB1_GSU1_LBSPPA256_LPA2_LPB2_LRVW2_MIWT4_13_SU8_SUM0_SUS256_SVW4_VWA4_WG64_4_1_WGMn16
    SolutionIndex: 509
    SolutionNameMin: Cijk_Alik_Bljk_S_MX_B_Bias_HA_SAV_UserArgs_MT256x160x32_MI32x32x1_SN_GRVWA4_GRVWB4_GSU1_LBSPPA256_LPA4_LPB4_LRVW4_MIWT2_5_SU8_SUM0_SUS256_SVW2_VWA2_WG128_2_1_WGMn16
    SolutionIndex: 510
    SolutionNameMin: Cijk_Alik_Bljk_S_MX_B_Bias_HA_SAV_UserArgs_MT128x256x16_MI16x16x1_SN_GRVWA1_GRVWB1_GSU1_LBSPPA256_LPA2_LPB2_LRVW2_MIWT4_8_SU8_SUM0_SUS256_SVW4_VWA4_WG32_8_1_WGMn16
    SolutionIndex: 511
    SolutionNameMin: Cijk_Alik_Bljk_S_MX_B_Bias_HA_SAV_UserArgs_MT160x256x16_MI16x16x1_SN_GRVWA1_GRVWB4_GSU1_LBSPPA128_LPA2_LPB4_LRVW2_MIWT5_8_SU8_SUM0_SUS256_SVW1_VWA1_WG32_8_1_WGMn16
    SolutionIndex: 512
    SolutionNameMin: Cijk_Alik_Bljk_S_MX_B_Bias_HA_SAV_UserArgs_MT160x256x16_MI16x16x1_SN_GRVWA1_GRVWB4_GSU1_LBSPPA128_LPA2_LPB4_LRVW2_MIWT10_4_SU8_SUM0_SUS256_SVW2_VWA2_WG16_16_1_WGMn16
    SolutionIndex: 513
    SolutionNameMin: Cijk_Alik_Bljk_S_MX_B_Bias_HA_SAV_UserArgs_MT128x320x16_MI16x16x1_SN_GRVWA1_GRVWB4_GSU1_LBSPPA256_LPA2_LPB4_LRVW2_MIWT8_5_SU8_SUM0_SUS256_SVW4_VWA4_WG16_16_1_WGMn16
    SolutionIndex: 514
    SolutionNameMin: Cijk_Alik_Bljk_S_MX_B_Bias_HA_SAV_UserArgs_MT256x160x32_MI16x16x1_SN_GRVWA1_GRVWB4_GSU1_LBSPPA512_LPA8_LPB8_LRVW4_MIWT8_5_SU8_SUM0_SUS256_SVW4_VWA4_WG32_8_1_WGMn16
    SolutionIndex: 515
    SolutionNameMin: Cijk_Alik_Bljk_S_MX_B_Bias_HA_SAV_UserArgs_MT16x96x128_MI16x16x1_SN_GRVWA4_GRVWB4_GSU3_LBSPPA512_LBSPPB512_LPA8_LPB8_LRVW4_MIWT1_3_NLCA1_NLCB1_SU0_SUM0_SUS0_SVW1_VWA1_WG16_8_2_WGM1
    SolutionIndex: 516
    SolutionNameMin: Cijk_Alik_Bljk_S_MX_B_Bias_HA_SAV_UserArgs_MT32x32x128_MI16x16x1_SN_GRVWA4_GRVWB4_GSU1_LBSPPA512_LBSPPB512_LPA8_LPB8_LRVW4_MIWT1_2_NLCA1_NLCB1_SU0_SUM0_SUS0_SVW1_VWA1_WG32_4_2_WGM1
    SolutionIndex: 517
    SolutionNameMin: Cijk_Alik_Bljk_S_MX_B_Bias_HA_SAV_UserArgs_MT32x80x128_MI16x16x1_SN_GRVWA4_GRVWB4_GSU3_LBSPPA512_LBSPPB512_LPA8_LPB8_LRVW4_MIWT1_5_NLCA1_NLCB1_SU0_SUM0_SUS0_SVW1_VWA1_WG32_4_2_WGM1
    SolutionIndex: 518
    SolutionNameMin: Cijk_Alik_Bljk_S_MX_B_Bias_HA_SAV_UserArgs_MT16x64x128_MI16x16x1_SN_GRVWA4_GRVWB4_GSU1_LBSPPA512_LBSPPB512_LPA8_LPB8_LRVW4_MIWT1_2_NLCA1_NLCB1_SU0_SUM0_SUS0_SVW1_VWA1_WG16_8_2_WGM1
    SolutionIndex: 519
    SolutionNameMin: Cijk_Alik_Bljk_S_MX_B_Bias_HA_SAV_UserArgs_MT16x96x128_MI16x16x1_SN_GRVWA4_GRVWB4_GSU2_LBSPPA512_LBSPPB512_LPA8_LPB8_LRVW4_MIWT1_3_NLCA1_NLCB1_SU0_SUM0_SUS0_SVW1_VWA1_WG16_8_2_WGM1
    SolutionIndex: 520
    SolutionNameMin: Cijk_Alik_Bljk_S_MX_B_Bias_HA_SAV_UserArgs_MT32x48x128_MI16x16x1_SN_GRVWA4_GRVWB4_GSU1_LBSPPA512_LBSPPB512_LPA8_LPB8_LRVW4_MIWT1_3_NLCA1_NLCB1_SU0_SUM0_SUS0_SVW1_VWA1_WG32_4_2_WGM1
    SolutionIndex: 521
    SolutionNameMin: Cijk_Alik_Bljk_S_MX_B_Bias_HA_SAV_UserArgs_MT32x80x128_MI16x16x1_SN_GRVWA4_GRVWB4_GSU2_LBSPPA512_LBSPPB512_LPA8_LPB8_LRVW4_MIWT1_5_NLCA1_NLCB1_SU0_SUM0_SUS0_SVW1_VWA1_WG32_4_2_WGM1
    SolutionIndex: 522
    SolutionNameMin: Cijk_Alik_Bljk_S_MX_B_Bias_HA_SAV_UserArgs_MT64x128x64_MI16x16x1_SN_CLR1_GRVWA4_GRVWB4_GSU5_LBSPPA1024_LBSPPB256_LPA8_LPB8_LRVW4_MIAV1_MIWT4_2_PLR1_SU0_SUM0_SUS0_SVW4_VWA4_WG16_16_1_WGM1
    SolutionIndex: 523
    SolutionNameMin: Cijk_Alik_Bljk_S_MX_B_Bias_HA_SAV_UserArgs_MT32x80x128_MI16x16x1_SN_CLR1_GRVWA4_GRVWB4_GSU1_LBSPPA512_LBSPPB512_LPA8_LPB8_LRVW4_MIAV1_MIWT1_5_PLR1_SU0_SUM0_SUS0_SVW1_VWA1_WG32_4_2_WGM1
    SolutionIndex: 524
    SolutionNameMin: Cijk_Alik_Bljk_S_MX_B_Bias_HA_SAV_UserArgs_MT64x128x64_MI16x16x1_SN_CLR1_GRVWA4_GRVWB4_GSU3_LBSPPA1024_LBSPPB256_LPA8_LPB8_LRVW4_MIAV1_MIWT4_4_PLR1_SU0_SUM0_SUS0_SVW4_VWA4_WG16_8_2_WGM1
    SolutionIndex: 525
    SolutionNameMin: Cijk_Alik_Bljk_S_MX_B_Bias_HA_SAV_UserArgs_MT64x160x64_MI16x16x1_SN_CLR1_GRVWA4_GRVWB4_GSU4_LBSPPA512_LBSPPB256_LPA8_LPB8_LRVW4_MIAV1_MIWT2_5_PLR1_SU0_SUM0_SUS0_SVW2_VWA2_WG32_8_1_WGM1
    SolutionIndex: 526
    SolutionNameMin: Cijk_Alik_Bljk_S_MX_B_Bias_HA_SAV_UserArgs_MT32x64x64_MI32x32x1_SN_CLR1_GRVWA4_GRVWB4_GSU1_LBSPPA256_LBSPPB256_LPA4_LPB4_LRVW4_MIAV1_MIWT1_1_PLR1_SU0_SUM0_SUS0_SVW1_VWA1_WG32_4_1_WGM1
    SolutionIndex: 527
    SolutionNameMin: Cijk_Alik_Bljk_S_MX_B_Bias_HA_SAV_UserArgs_MT96x128x64_MI16x16x1_SN_CLR1_GRVWA4_GRVWB4_GSU3_LBSPPA256_LBSPPB256_LPA8_LPB8_LRVW4_MIAV1_MIWT3_4_PLR1_SU0_SUM0_SUS0_SVW1_VWA1_WG32_8_1_WGM1
    SolutionIndex: 528
    SolutionNameMin: Cijk_Alik_Bljk_S_MX_B_Bias_HA_SAV_UserArgs_MT96x128x64_MI16x16x1_SN_CLR1_GRVWA1_GRVWB4_GSU3_LBSPPA256_LBSPPB256_LPA8_LPB8_LRVW4_MIAV1_MIWT3_4_PLR1_SU0_SUM0_SUS0_SVW1_VWA1_WG32_8_1_WGM1
    SolutionIndex: 529
    SolutionNameMin: Cijk_Alik_Bljk_S_MX_B_Bias_HA_SAV_UserArgs_MT64x64x64_MI16x16x1_SN_CLR1_GRVWA4_GRVWB4_GSU1_LBSPPA512_LBSPPB256_LPA8_LPB8_LRVW4_MIAV1_MIWT2_2_PLR1_SU0_SUM0_SUS0_SVW2_VWA2_WG32_8_1_WGM1
    SolutionIndex: 530
    SolutionNameMin: Cijk_Alik_Bljk_S_MX_B_Bias_HA_SAV_UserArgs_MT128x80x64_MI16x16x1_SN_CLR1_GRVWA4_GRVWB4_GSU3_LBSPPA512_LBSPPB256_LPA8_LPB8_LRVW4_MIAV1_MIWT2_5_PLR1_SU0_SUM0_SUS0_SVW2_VWA2_WG64_4_1_WGM1
    SolutionIndex: 531
    SolutionNameMin: Cijk_Alik_Bljk_S_MX_B_Bias_HA_SAV_UserArgs_MT128x224x32_MI16x16x1_SN_CLR1_GRVWA4_GRVWB4_GSU8_LBSPPA512_LBSPPB128_LPA8_LPB8_LRVW4_MIAV0_MIWT4_7_PLR1_SU0_SUM0_SUS0_SVW4_VWA4_WG32_8_1_WGM1
    SolutionIndex: 532
    SolutionNameMin: Cijk_Alik_Bljk_S_MX_B_Bias_HA_SAV_UserArgs_MT192x160x32_MI16x16x1_SN_CLR1_GRVWA1_GRVWB4_GSU6_LBSPPA256_LBSPPB128_LPA8_LPB8_LRVW4_MIAV0_MIWT6_5_PLR1_SU0_SUM0_SUS0_SVW2_VWA2_WG32_8_1_WGM1
    SolutionIndex: 533
    SolutionNameMin: Cijk_Alik_Bljk_S_MX_B_Bias_HA_SAV_UserArgs_MT128x192x32_MI32x32x1_SN_CLR1_GRVWA4_GRVWB4_GSU5_LBSPPA256_LBSPPB128_LPA4_LPB4_LRVW4_MIAV0_MIWT2_3_PLR1_SU0_SUM0_SUS0_SVW2_VWA2_WG64_4_1_WGM1
    SolutionIndex: 534
    SolutionNameMin: Cijk_Alik_Bljk_S_MX_B_Bias_HA_SAV_UserArgs_MT128x288x32_MI16x16x1_SN_CLR1_GRVWA4_GRVWB4_GSU7_LBSPPA512_LBSPPB128_LPA8_LPB8_LRVW4_MIAV0_MIWT4_9_PLR1_SU0_SUM0_SUS0_SVW4_VWA4_WG32_8_1_WGM1
    SolutionIndex: 535
    SolutionNameMin: Cijk_Alik_Bljk_S_MX_B_Bias_HA_SAV_UserArgs_MT96x160x32_MI16x16x1_SN_CLR1_GRVWA4_GRVWB4_GSU2_LBSPPA128_LBSPPB128_LPA8_LPB8_LRVW4_MIAV1_MIWT3_5_PLR1_SU0_SUM0_SUS0_SVW1_VWA1_WG32_8_1_WGM1
    SolutionIndex: 536
    SolutionNameMin: Cijk_Alik_Bljk_S_MX_B_Bias_HA_SAV_UserArgs_MT128x256x32_MI32x32x1_SN_CLR1_GRVWA1_GRVWB4_GSU5_LBSPPA256_LBSPPB128_LPA4_LPB4_LRVW4_MIAV0_MIWT2_4_PLR1_SU0_SUM0_SUS0_SVW2_VWA2_WG64_4_1_WGM1
    SolutionIndex: 537
    SolutionNameMin: Cijk_Alik_Bljk_S_MX_B_Bias_HA_SAV_UserArgs_MT256x192x32_MI32x32x1_SN_CLR1_GRVWA1_GRVWB4_GSU7_LBSPPA512_LBSPPB128_LPA4_LPB4_LRVW4_MIAV0_MIWT4_3_PLR1_SU0_SUM0_SUS0_SVW4_VWA4_WG64_4_1_WGM1
    SolutionIndex: 538
    SolutionNameMin: Cijk_Alik_Bljk_S_MX_B_Bias_HA_SAV_UserArgs_MT128x80x64_MI16x16x1_SN_CLR1_GRVWA4_GRVWB4_GSU1_LBSPPA512_LBSPPB256_LPA8_LPB8_LRVW4_MIAV1_MIWT2_5_PLR1_SU0_SUM0_SUS0_SVW2_VWA2_WG64_4_1_WGM1
    SolutionIndex: 539
    SolutionNameMin: Cijk_Alik_Bljk_S_MX_B_Bias_HA_SAV_UserArgs_MT192x256x32_MI32x32x1_SN_CLR1_GRVWA4_GRVWB4_GSU5_LBSPPA256_LBSPPB128_LPA4_LPB4_LRVW4_MIAV0_MIWT6_2_PLR1_SU0_SUM0_SUS0_SVW2_VWA2_WG32_8_1_WGM1
    SolutionIndex: 540
    SolutionNameMin: Cijk_Alik_Bljk_S_MX_B_Bias_HA_SAV_UserArgs_MT256x192x32_MI32x32x1_SN_CLR1_GRVWA4_GRVWB4_GSU5_LBSPPA512_LBSPPB128_LPA4_LPB4_LRVW4_MIAV0_MIWT4_3_PLR1_SU0_SUM0_SUS0_SVW4_VWA4_WG64_4_1_WGM1
    SolutionIndex: 541
    SolutionNameMin: Cijk_Alik_Bljk_S_MX_B_Bias_HA_SAV_UserArgs_MT256x192x32_MI32x32x1_SN_CLR1_GRVWA1_GRVWB4_GSU5_LBSPPA512_LBSPPB128_LPA4_LPB4_LRVW4_MIAV0_MIWT4_3_PLR1_SU0_SUM0_SUS0_SVW4_VWA4_WG64_4_1_WGM1
    SolutionIndex: 542
    SolutionNameMin: Cijk_Alik_Bljk_S_MX_B_Bias_HA_SAV_UserArgs_MT128x128x32_MI32x32x1_SN_CLR1_GRVWA4_GRVWB4_GSU1_LBSPPA128_LBSPPB128_LPA4_LPB4_LRVW4_MIAV1_MIWT1_4_PLR1_SU0_SUM0_SUS0_SVW1_VWA1_WG128_2_1_WGM1
    SolutionIndex: 543
    SolutionNameMin: Cijk_Alik_Bljk_S_MX_B_Bias_HA_SAV_UserArgs_MT192x256x32_MI32x32x1_SN_CLR1_GRVWA4_GRVWB4_GSU3_LBSPPA128_LBSPPB128_LPA4_LPB4_LRVW4_MIAV0_MIWT3_4_PLR1_SU0_SUM0_SUS0_SVW1_VWA1_WG64_4_1_WGM1
    SolutionIndex: 544
    SolutionNameMin: Cijk_Alik_Bljk_S_MX_B_Bias_HA_SAV_UserArgs_MT128x128x32_MI16x16x1_SN_GRVWA4_GRVWB4_GSU1_LBSPPA512_LBSPPB128_LPA8_LPB8_LRVW4_MIAV1_MIWT4_4_NTC3_NTD3_SU0_SUM0_SUS0_SVW4_VWA4_WG32_8_1_WGM8
    SolutionIndex: 545
    SolutionNameMin: Cijk_Alik_Bljk_S_MX_B_Bias_HA_SAV_UserArgs_MT192x256x32_MI32x32x1_SN_GRVWA4_GRVWB4_GSU3_LBSPPA128_LBSPPB128_LPA4_LPB4_LRVW4_MIAV0_MIWT3_4_NTC3_NTD3_SU0_SUM0_SUS0_SVW1_VWA1_WG64_4_1_WGM8
    SolutionIndex: 546
    SolutionNameMin: Cijk_Alik_Bljk_S_MX_B_Bias_HA_SAV_UserArgs_MT224x160x32_MI16x16x1_SN_GRVWA1_GRVWB4_GSU2_LBSPPA128_LBSPPB128_LPA8_LPB8_LRVW4_MIAV0_MIWT7_5_NTC3_NTD3_SU0_SUM0_SUS0_SVW1_VWA1_WG32_8_1_WGM1
    SolutionIndex: 547
    SolutionNameMin: Cijk_Alik_Bljk_S_MX_B_Bias_HA_SAV_UserArgs_MT160x128x32_MI16x16x1_SN_GRVWA1_GRVWB4_GSU1_LBSPPA128_LBSPPB128_LPA8_LPB8_LRVW4_MIAV1_MIWT5_4_NTC0_NTD0_SU0_SUM0_SUS0_SVW1_VWA1_WG32_8_1_WGM8
    SolutionIndex: 548
    SolutionNameMin: Cijk_Alik_Bljk_S_MX_B_Bias_HA_SAV_UserArgs_MT128x160x32_MI16x16x1_SN_GRVWA4_GRVWB4_GSU1_LBSPPA512_LBSPPB128_LPA8_LPB8_LRVW4_MIAV1_MIWT4_5_NTC3_NTD3_SU0_SUM0_SUS0_SVW4_VWA4_WG32_8_1_WGM8
    SolutionIndex: 549
    SolutionNameMin: Cijk_Alik_Bljk_S_MX_B_Bias_HA_SAV_UserArgs_MT128x96x32_MI16x16x1_SN_GRVWA4_GRVWB4_GSU1_LBSPPA512_LBSPPB128_LPA8_LPB8_LRVW4_MIAV1_MIWT4_3_NTC3_NTD3_SU0_SUM0_SUS0_SVW4_VWA4_WG32_8_1_WGM8
    SolutionIndex: 550
    SolutionNameMin: Cijk_Alik_Bljk_S_MX_B_Bias_HA_SAV_UserArgs_MT128x96x64_MI16x16x1_SN_GRVWA4_GRVWB4_GSU1_LBSPPA1024_LBSPPB256_LPA8_LPB8_LRVW4_MIAV1_MIWT4_3_NTC3_NTD3_SU0_SUM0_SUS0_SVW4_VWA4_WG32_8_1_WGM1
    SolutionIndex: 551
    SolutionNameMin: Cijk_Alik_Bljk_S_MX_B_Bias_HA_SAV_UserArgs_MT128x96x64_MI16x16x1_SN_GRVWA4_GRVWB4_GSU1_LBSPPA1024_LBSPPB256_LPA8_LPB8_LRVW4_MIAV1_MIWT4_3_NTC3_NTD3_SU0_SUM0_SUS0_SVW4_VWA4_WG32_8_1_WGM8
    SolutionIndex: 552
    SolutionNameMin: Cijk_Alik_Bljk_S_MX_B_Bias_HA_SAV_UserArgs_MT256x128x32_MI32x32x1_SN_GRVWA1_GRVWB4_GSU1_LBSPPA512_LBSPPB128_LPA4_LPB4_LRVW4_MIAV0_MIWT4_2_NTC3_NTD3_SU0_SUM0_SUS0_SVW4_VWA4_WG64_4_1_WGM8
    SolutionIndex: 553
    SolutionNameMin: Cijk_Alik_Bljk_S_MX_B_Bias_HA_SAV_UserArgs_MT128x224x32_MI16x16x1_SN_GRVWA1_GRVWB4_GSU1_LBSPPA512_LPA8_LPB8_LRVW4_MIWT4_7_NTC3_NTD3_SU0_SUM0_SUS0_SVW4_VWA4_WG32_8_1_WGM1
    SolutionIndex: 554
    SolutionNameMin: Cijk_Alik_Bljk_S_MX_B_Bias_HA_SAV_UserArgs_MT256x160x32_MI16x16x1_SN_GRVWA4_GRVWB4_GSU1_LBSPPA512_LPA8_LPB8_LRVW4_MIWT8_5_NTC3_NTD3_SU0_SUM0_SUS0_SVW4_VWA4_WG32_8_1_WGM1
    SolutionIndex: 555
    SolutionNameMin: Cijk_Alik_Bljk_S_MX_B_Bias_HA_SAV_UserArgs_MT256x160x32_MI32x32x1_SN_GRVWA1_GRVWB4_GSU1_LBSPPA256_LPA4_LPB4_LRVW4_MIWT2_5_NTC3_NTD3_SU0_SUM0_SUS0_SVW2_VWA2_WG128_2_1_WGM1
    SolutionIndex: 556
    SolutionNameMin: Cijk_Alik_Bljk_S_MX_B_Bias_HA_SAV_UserArgs_MT160x256x32_MI32x32x1_SN_GRVWA1_GRVWB4_GSU1_LBSPPA128_LPA4_LPB4_LRVW4_MIWT5_2_NTC3_NTD3_SU0_SUM0_SUS0_SVW1_VWA1_WG32_8_1_WGM1
    SolutionIndex: 557
    SolutionNameMin: Cijk_Alik_Bljk_S_MX_B_Bias_HA_SAV_UserArgs_MT256x160x32_MI32x32x1_SN_GRVWA4_GRVWB4_GSU1_LBSPPA256_LPA4_LPB4_LRVW4_MIWT2_5_NTC3_NTD3_SU0_SUM0_SUS0_SVW2_VWA2_WG128_2_1_WGM1
    SolutionIndex: 558
    SolutionNameMin: Cijk_Alik_Bljk_S_MX_B_Bias_HA_SAV_UserArgs_MT256x160x32_MI16x16x1_SN_GRVWA1_GRVWB4_GSU1_LBSPPA512_LPA8_LPB8_LRVW4_MIWT8_5_NTC3_NTD3_SU0_SUM0_SUS0_SVW4_VWA4_WG32_8_1_WGM8
    SolutionIndex: 559
    SolutionNameMin: Cijk_Alik_Bljk_S_MX_B_Bias_HA_SAV_UserArgs_MT192x320x16_MI16x16x1_SN_GRVWA1_GRVWB4_GSU1_LBSPPA256_LPA2_LPB4_LRVW2_MIWT12_5_NTC0_NTD0_SU0_SUM0_SUS0_SVW4_VWA4_WG16_16_1_WGM8
    SolutionIndex: 560
    SolutionNameMin: Cijk_Alik_Bljk_S_MX_B_Bias_HA_SAV_UserArgs_MT192x160x32_MI16x16x1_SN_GRVWA1_GRVWB4_GSU1_LBSPPA256_LPA8_LPB8_LRVW4_MIWT6_5_NTC3_NTD3_SU0_SUM0_SUS0_SVW2_VWA2_WG32_8_1_WGM8
    SolutionIndex: 561
    SolutionNameMin: Cijk_Alik_Bljk_S_MX_B_Bias_HA_SAV_UserArgs_MT256x208x16_MI16x16x1_SN_GRVWA1_GRVWB1_GSU1_LBSPPA256_LPA2_LPB2_LRVW2_MIWT4_13_SU8_SUM0_SUS256_SVW4_VWA4_WG64_4_1_WGM1
    SolutionIndex: 562
    SolutionNameMin: Cijk_Alik_Bljk_S_MX_B_Bias_HA_SAV_UserArgs_MT208x256x32_MI16x16x1_SN_GRVWA1_GRVWB4_GSU1_LBSPPA128_LPA2_LPB4_LRVW2_MIWT13_4_SU8_SUM0_SUS256_SVW1_VWA1_WG16_16_1_WGM8
    SolutionIndex: 563
    SolutionNameMin: Cijk_Alik_Bljk_S_MX_B_Bias_HA_SAV_UserArgs_MT256x160x16_MI16x16x1_SN_GRVWA1_GRVWB1_GSU1_LBSPPA256_LPA2_LPB2_LRVW2_MIWT4_10_SU8_SUM0_SUS256_SVW4_VWA4_WG64_4_1_WGM1
    SolutionIndex: 564
    SolutionNameMin: Cijk_Alik_Bljk_S_MX_B_Bias_HA_SAV_UserArgs_MT256x160x16_MI16x16x1_SN_GRVWA1_GRVWB1_GSU1_LBSPPA256_LPA2_LPB2_LRVW2_MIWT8_5_SU8_SUM0_SUS256_SVW4_VWA4_WG32_8_1_WGM1
    SolutionIndex: 565
    SolutionNameMin: Cijk_Alik_Bljk_S_MX_B_Bias_HA_SAV_UserArgs_MT256x160x32_MI32x32x1_SN_GRVWA4_GRVWB4_GSU1_LBSPPA256_LPA4_LPB4_LRVW4_MIWT2_5_SU8_SUM0_SUS256_SVW2_VWA2_WG128_2_1_WGM1
    SolutionIndex: 566
    SolutionNameMin: Cijk_Alik_Bljk_S_MX_B_Bias_HA_SAV_UserArgs_MT256x160x32_MI32x32x1_SN_GRVWA4_GRVWB4_GSU1_LBSPPA256_LPA4_LPB4_LRVW4_MIWT2_5_SU8_SUM0_SUS256_SVW2_VWA2_WG128_2_1_WGM8
    SolutionIndex: 567
    SolutionNameMin: Cijk_Alik_Bljk_S_MX_B_Bias_HA_SAV_UserArgs_MT256x256x16_MI32x32x1_SN_GRVWA4_GRVWB4_GSU1_LBSPPA256_LPA4_LPB4_LRVW4_MIWT4_4_SU8_SUM0_SUS256_SVW4_VWA4_WG64_4_1_WGM1
    SolutionIndex: 568
    SolutionNameMin: Cijk_Alik_Bljk_S_MX_B_Bias_HA_SAV_UserArgs_MT256x160x32_MI32x32x1_SN_GRVWA4_GRVWB4_GSU1_LBSPPA256_LPA4_LPB4_LRVW4_MIWT2_5_SU8_SUM0_SUS256_SVW2_VWA2_WG128_2_1_WGMn8
    SolutionIndex: 569
    SolutionNameMin: Cijk_Alik_Bljk_S_MX_B_Bias_HA_SAV_UserArgs_MT256x160x16_MI16x16x1_SN_GRVWA1_GRVWB1_GSU1_LBSPPA256_LPA2_LPB2_LRVW2_MIWT8_5_SU8_SUM0_SUS256_SVW4_VWA4_WG32_8_1_WGMn16
    SolutionIndex: 570
    SolutionNameMin: Cijk_Alik_Bljk_S_MX_B_Bias_HA_SAV_UserArgs_MT256x160x32_MI16x16x1_SN_GRVWA1_GRVWB4_GSU1_LBSPPA512_LPA8_LPB8_LRVW4_MIWT8_5_SU8_SUM0_SUS256_SVW4_VWA4_WG32_8_1_WGMn8
    SolutionIndex: 571
    SolutionNameMin: Cijk_Alik_Bljk_S_MX_B_Bias_HA_SAV_UserArgs_MT256x192x32_MI32x32x1_SN_GRVWA4_GRVWB4_GSU1_LBSPPA512_LPA4_LPB4_LRVW4_MIWT4_3_SU8_SUM0_SUS256_SVW4_VWA4_WG64_4_1_WGMn8
    SolutionIndex: 572
    SolutionNameMin: Cijk_Alik_Bljk_S_MX_B_Bias_HA_SAV_UserArgs_MT16x64x128_MI16x16x1_SN_GRVWA4_GRVWB4_GSU1_LBSPPA512_LBSPPB512_LPA8_LPB8_LRVW4_MIWT1_1_NTB0_SU0_SUM0_SUS0_SVW1_VWA1_WG16_16_1_WGM1
    SolutionIndex: 573
    SolutionNameMin: Cijk_Alik_Bljk_S_MX_B_Bias_HA_SAV_UserArgs_MT16x32x128_MI16x16x1_SN_GRVWA4_GRVWB4_GSU1_LBSPPA512_LBSPPB512_LPA8_LPB8_LRVW4_MIWT1_1_NTB0_SU0_SUM0_SUS0_SVW1_VWA1_WG16_8_1_WGM1
    SolutionIndex: 574
    SolutionNameMin: Cijk_Alik_Bljk_S_MX_B_Bias_HA_SAV_UserArgs_MT16x64x128_MI16x16x1_SN_GRVWA4_GRVWB4_GSU1_LBSPPA512_LBSPPB512_LPA8_LPB8_LRVW4_MIWT1_2_NTB4_SU0_SUM0_SUS0_SVW1_VWA1_WG16_8_2_WGM1
    SolutionIndex: 575
    SolutionNameMin: Cijk_Alik_Bljk_S_MX_B_Bias_HA_SAV_UserArgs_MT32x64x128_MI32x32x1_SN_GRVWA4_GRVWB4_GSU1_LBSPPA512_LBSPPB512_LPA4_LPB4_LRVW4_MIWT1_1_NTB0_SU0_SUM0_SUS0_SVW1_VWA1_WG32_4_2_WGM1
    SolutionIndex: 576
    SolutionNameMin: Cijk_Alik_Bljk_S_MX_B_Bias_HA_SAV_UserArgs_MT32x64x128_MI32x32x1_SN_GRVWA4_GRVWB4_GSU1_LBSPPA512_LBSPPB512_LPA4_LPB4_LRVW4_MIWT1_1_NTB4_SU0_SUM0_SUS0_SVW1_VWA1_WG32_4_2_WGM1
    SolutionIndex: 577
    SolutionNameMin: Cijk_Alik_Bljk_S_MX_B_Bias_HA_SAV_UserArgs_MT32x80x128_MI16x16x1_SN_GRVWA4_GRVWB4_GSU1_LBSPPA512_LBSPPB512_LPA8_LPB8_LRVW4_MIWT1_5_NTB0_SU0_SUM0_SUS0_SVW1_VWA1_WG32_4_2_WGM1
    SolutionIndex: 578
    SolutionNameMin: Cijk_Alik_Bljk_S_MX_B_Bias_HA_SAV_UserArgs_MT16x96x128_MI16x16x1_SN_GRVWA4_GRVWB4_GSU1_LBSPPA512_LBSPPB512_LPA8_LPB8_LRVW4_MIWT1_3_NTB4_SU0_SUM0_SUS0_SVW1_VWA1_WG16_8_2_WGM1
    SolutionIndex: 579
    SolutionNameMin: Cijk_Alik_Bljk_S_MX_B_Bias_HA_SAV_UserArgs_MT32x80x128_MI16x16x1_SN_GRVWA4_GRVWB4_GSU1_LBSPPA512_LBSPPB512_LPA8_LPB8_LRVW4_MIWT1_5_NTB4_SU0_SUM0_SUS0_SVW1_VWA1_WG32_4_2_WGM1
    SolutionIndex: 580
    SolutionNameMin: Cijk_Alik_Bljk_S_MX_B_Bias_HA_SAV_UserArgs_MT64x64x64_MI32x32x1_SN_CLR1_GRVWA4_GRVWB4_GSU1_LBSPPA512_LBSPPB256_LPA4_LPB4_LRVW4_MIAV1_MIWT2_1_NTB0_PLR1_SU0_SUM0_SUS0_SVW2_VWA2_WG32_4_2_WGM1
    SolutionIndex: 581
    SolutionNameMin: Cijk_Alik_Bljk_S_MX_B_Bias_HA_SAV_UserArgs_MT64x160x64_MI16x16x1_SN_CLR1_GRVWA4_GRVWB4_GSU3_LBSPPA512_LBSPPB256_LPA8_LPB8_LRVW4_MIAV1_MIWT2_5_NTB0_PLR1_SU0_SUM0_SUS0_SVW2_VWA2_WG32_8_1_WGM1
    SolutionIndex: 582
    SolutionNameMin: Cijk_Alik_Bljk_S_MX_B_Bias_HA_SAV_UserArgs_MT64x160x64_MI16x16x1_SN_CLR1_GRVWA4_GRVWB4_GSU3_LBSPPA512_LBSPPB256_LPA8_LPB8_LRVW4_MIAV1_MIWT2_5_NTB4_PLR1_SU0_SUM0_SUS0_SVW2_VWA2_WG32_8_1_WGM1
    SolutionIndex: 583
    SolutionNameMin: Cijk_Alik_Bljk_S_MX_B_Bias_HA_SAV_UserArgs_MT96x160x32_MI16x16x1_SN_CLR1_GRVWA4_GRVWB4_GSU3_LBSPPA128_LBSPPB128_LPA8_LPB8_LRVW4_MIAV1_MIWT3_5_NTB0_PLR1_SU0_SUM0_SUS0_SVW1_VWA1_WG32_8_1_WGM1
    SolutionIndex: 584
    SolutionNameMin: Cijk_Alik_Bljk_S_MX_B_Bias_HA_SAV_UserArgs_MT96x128x64_MI16x16x1_SN_CLR1_GRVWA4_GRVWB4_GSU2_LBSPPA256_LBSPPB256_LPA8_LPB8_LRVW4_MIAV1_MIWT3_4_NTB4_PLR1_SU0_SUM0_SUS0_SVW1_VWA1_WG32_8_1_WGM1
    SolutionIndex: 585
    SolutionNameMin: Cijk_Alik_Bljk_S_MX_B_Bias_HA_SAV_UserArgs_MT64x80x64_MI16x16x1_SN_CLR1_GRVWA4_GRVWB4_GSU1_LBSPPA512_LBSPPB256_LPA8_LPB8_LRVW4_MIAV1_MIWT2_5_NTB0_PLR1_SU0_SUM0_SUS0_SVW2_VWA2_WG32_4_2_WGM1
    SolutionIndex: 586
    SolutionNameMin: Cijk_Alik_Bljk_S_MX_B_Bias_HA_SAV_UserArgs_MT64x160x64_MI16x16x1_SN_CLR1_GRVWA4_GRVWB4_GSU2_LBSPPA512_LBSPPB256_LPA8_LPB8_LRVW4_MIAV1_MIWT2_5_NTB4_PLR1_SU0_SUM0_SUS0_SVW2_VWA2_WG32_8_1_WGM1
    SolutionIndex: 587
    SolutionNameMin: Cijk_Alik_Bljk_S_MX_B_Bias_HA_SAV_UserArgs_MT64x160x64_MI16x16x1_SN_CLR1_GRVWA4_GRVWB4_GSU1_LBSPPA512_LBSPPB256_LPA8_LPB8_LRVW4_MIAV1_MIWT2_5_NTB0_PLR1_SU0_SUM0_SUS0_SVW2_VWA2_WG32_8_1_WGM1
    SolutionIndex: 588
    SolutionNameMin: Cijk_Alik_Bljk_S_MX_B_Bias_HA_SAV_UserArgs_MT96x96x64_MI16x16x1_SN_CLR1_GRVWA4_GRVWB4_GSU2_LBSPPA256_LBSPPB256_LPA8_LPB8_LRVW4_MIAV1_MIWT3_3_NTB4_PLR1_SU0_SUM0_SUS0_SVW1_VWA1_WG32_8_1_WGM1
    SolutionIndex: 589
    SolutionNameMin: Cijk_Alik_Bljk_S_MX_B_Bias_HA_SAV_UserArgs_MT96x320x32_MI16x16x1_SN_CLR1_GRVWA4_GRVWB4_GSU4_LBSPPA256_LBSPPB128_LPA8_LPB8_LRVW4_MIAV0_MIWT6_5_NTB4_PLR1_SU0_SUM0_SUS0_SVW2_VWA2_WG16_16_1_WGM1
    SolutionIndex: 590
    SolutionNameMin: Cijk_Alik_Bljk_S_MX_B_Bias_HA_SAV_UserArgs_MT128x64x64_MI16x16x1_SN_CLR1_GRVWA4_GRVWB4_GSU1_LBSPPA1024_LBSPPB256_LPA8_LPB8_LRVW4_MIAV1_MIWT4_2_NTB0_PLR1_SU0_SUM0_SUS0_SVW4_VWA4_WG32_8_1_WGM1
    SolutionIndex: 591
    SolutionNameMin: Cijk_Alik_Bljk_S_MX_B_Bias_HA_SAV_UserArgs_MT128x256x32_MI32x32x1_SN_CLR1_GRVWA4_GRVWB4_GSU5_LBSPPA256_LBSPPB128_LPA4_LPB4_LRVW4_MIAV0_MIWT2_4_NTB4_PLR1_SU0_SUM0_SUS0_SVW2_VWA2_WG64_4_1_WGM1
    SolutionIndex: 592
    SolutionNameMin: Cijk_Alik_Bljk_S_MX_B_Bias_HA_SAV_UserArgs_MT128x320x32_MI32x32x1_SN_CLR1_GRVWA4_GRVWB4_GSU6_LBSPPA256_LBSPPB128_LPA4_LPB4_LRVW4_MIAV0_MIWT2_5_NTB4_PLR1_SU0_SUM0_SUS0_SVW2_VWA2_WG64_4_1_WGM1
    SolutionIndex: 593
    SolutionNameMin: Cijk_Alik_Bljk_S_MX_B_Bias_HA_SAV_UserArgs_MT192x256x32_MI32x32x1_SN_CLR1_GRVWA4_GRVWB4_GSU5_LBSPPA128_LBSPPB128_LPA4_LPB4_LRVW4_MIAV0_MIWT3_4_NTB4_PLR1_SU0_SUM0_SUS0_SVW1_VWA1_WG64_4_1_WGM1
    SolutionIndex: 594
    SolutionNameMin: Cijk_Alik_Bljk_S_MX_B_Bias_HA_SAV_UserArgs_MT128x80x64_MI16x16x1_SN_CLR1_GRVWA4_GRVWB4_GSU1_LBSPPA512_LBSPPB256_LPA8_LPB8_LRVW4_MIAV1_MIWT2_5_NTB0_PLR1_SU0_SUM0_SUS0_SVW2_VWA2_WG64_4_1_WGM1
    SolutionIndex: 595
    SolutionNameMin: Cijk_Alik_Bljk_S_MX_B_Bias_HA_SAV_UserArgs_MT128x80x64_MI16x16x1_SN_CLR1_GRVWA4_GRVWB4_GSU1_LBSPPA512_LBSPPB256_LPA8_LPB8_LRVW4_MIAV1_MIWT2_5_NTB4_PLR1_SU0_SUM0_SUS0_SVW2_VWA2_WG64_4_1_WGM1
    SolutionIndex: 596
    SolutionNameMin: Cijk_Alik_Bljk_S_MX_B_Bias_HA_SAV_UserArgs_MT128x320x32_MI32x32x1_SN_CLR1_GRVWA4_GRVWB4_GSU4_LBSPPA256_LBSPPB128_LPA4_LPB4_LRVW4_MIAV0_MIWT2_5_NTB4_PLR1_SU0_SUM0_SUS0_SVW2_VWA2_WG64_4_1_WGM1
    SolutionIndex: 597
    SolutionNameMin: Cijk_Alik_Bljk_S_MX_B_Bias_HA_SAV_UserArgs_MT96x160x32_MI16x16x1_SN_CLR1_GRVWA4_GRVWB4_GSU1_LBSPPA128_LBSPPB128_LPA8_LPB8_LRVW4_MIAV1_MIWT3_5_NTB0_PLR1_SU0_SUM0_SUS0_SVW1_VWA1_WG32_8_1_WGM1
    SolutionIndex: 598
    SolutionNameMin: Cijk_Alik_Bljk_S_MX_B_Bias_HA_SAV_UserArgs_MT96x160x32_MI16x16x1_SN_CLR1_GRVWA1_GRVWB4_GSU1_LBSPPA128_LBSPPB128_LPA8_LPB8_LRVW4_MIAV1_MIWT3_5_NTB0_PLR1_SU0_SUM0_SUS0_SVW1_VWA1_WG32_8_1_WGM1
    SolutionIndex: 599
    SolutionNameMin: Cijk_Alik_Bljk_S_MX_B_Bias_HA_SAV_UserArgs_MT192x256x32_MI32x32x1_SN_CLR1_GRVWA4_GRVWB4_GSU3_LBSPPA128_LBSPPB128_LPA4_LPB4_LRVW4_MIAV0_MIWT3_4_NTB4_PLR1_SU0_SUM0_SUS0_SVW1_VWA1_WG64_4_1_WGM1
    SolutionIndex: 600
    SolutionNameMin: Cijk_Alik_Bljk_S_MX_B_Bias_HA_SAV_UserArgs_MT128x128x32_MI16x16x1_SN_GRVWA4_GRVWB4_GSU1_LBSPPA512_LBSPPB128_LPA8_LPB8_LRVW4_MIAV1_MIWT4_4_NTB0_NTC3_NTD3_SU0_SUM0_SUS0_SVW4_VWA4_WG32_8_1_WGM1
    SolutionIndex: 601
    SolutionNameMin: Cijk_Alik_Bljk_S_MX_B_Bias_HA_SAV_UserArgs_MT128x128x32_MI16x16x1_SN_GRVWA1_GRVWB4_GSU1_LBSPPA512_LBSPPB128_LPA8_LPB8_LRVW4_MIAV1_MIWT4_4_NTB0_NTC3_NTD3_SU0_SUM0_SUS0_SVW4_VWA4_WG32_8_1_WGM1
    SolutionIndex: 602
    SolutionNameMin: Cijk_Alik_Bljk_S_MX_B_Bias_HA_SAV_UserArgs_MT256x224x32_MI32x32x1_SN_GRVWA4_GRVWB1_GSU4_LBSPPA256_LBSPPB128_LPA4_LPB2_LRVW2_MIAV0_MIWT2_7_NTB4_NTC3_NTD3_SU0_SUM0_SUS0_SVW2_VWA2_WG128_2_1_WGM1
    SolutionIndex: 603
    SolutionNameMin: Cijk_Alik_Bljk_S_MX_B_Bias_HA_SAV_UserArgs_MT128x160x32_MI16x16x1_SN_GRVWA4_GRVWB4_GSU1_LBSPPA512_LBSPPB128_LPA8_LPB8_LRVW4_MIAV1_MIWT4_5_NTB0_NTC3_NTD3_SU0_SUM0_SUS0_SVW4_VWA4_WG32_8_1_WGM1
    SolutionIndex: 604
    SolutionNameMin: Cijk_Alik_Bljk_S_MX_B_Bias_HA_SAV_UserArgs_MT192x224x32_MI16x16x1_SN_GRVWA4_GRVWB4_GSU2_LBSPPA256_LBSPPB128_LPA8_LPB8_LRVW4_MIAV0_MIWT6_7_NTB4_NTC3_NTD3_SU0_SUM0_SUS0_SVW2_VWA2_WG32_8_1_WGM1
    SolutionIndex: 605
    SolutionNameMin: Cijk_Alik_Bljk_S_MX_B_Bias_HA_SAV_UserArgs_MT256x160x32_MI32x32x1_SN_GRVWA1_GRVWB4_GSU2_LBSPPA256_LBSPPB128_LPA4_LPB4_LRVW4_MIAV0_MIWT2_5_NTB4_NTC3_NTD3_SU0_SUM0_SUS0_SVW2_VWA2_WG128_2_1_WGM1
    SolutionIndex: 606
    SolutionNameMin: Cijk_Alik_Bljk_S_MX_B_Bias_HA_SAV_UserArgs_MT256x160x32_MI32x32x1_SN_GRVWA4_GRVWB4_GSU2_LBSPPA256_LBSPPB128_LPA4_LPB4_LRVW4_MIAV0_MIWT2_5_NTB4_NTC3_NTD3_SU0_SUM0_SUS0_SVW2_VWA2_WG128_2_1_WGM1
    SolutionIndex: 607
    SolutionNameMin: Cijk_Alik_Bljk_S_MX_B_Bias_HA_SAV_UserArgs_MT128x256x32_MI32x32x1_SN_GRVWA4_GRVWB4_GSU1_LBSPPA512_LBSPPB128_LPA4_LPB4_LRVW4_MIAV0_MIWT4_2_NTB0_NTC3_NTD3_SU0_SUM0_SUS0_SVW4_VWA4_WG32_8_1_WGM1
    SolutionIndex: 608
    SolutionNameMin: Cijk_Alik_Bljk_S_MX_B_Bias_HA_SAV_UserArgs_MT192x160x32_MI16x16x1_SN_GRVWA1_GRVWB4_GSU1_LBSPPA256_LBSPPB128_LPA8_LPB8_LRVW4_MIAV0_MIWT6_5_NTB4_NTC3_NTD3_SU0_SUM0_SUS0_SVW2_VWA2_WG32_8_1_WGM1
    SolutionIndex: 609
    SolutionNameMin: Cijk_Alik_Bljk_S_MX_B_Bias_HA_SAV_UserArgs_MT192x160x32_MI16x16x1_SN_GRVWA4_GRVWB4_GSU1_LBSPPA256_LBSPPB128_LPA8_LPB8_LRVW4_MIAV0_MIWT6_5_NTB4_NTC3_NTD3_SU0_SUM0_SUS0_SVW2_VWA2_WG32_8_1_WGM1
    SolutionIndex: 610
    SolutionNameMin: Cijk_Alik_Bljk_S_MX_B_Bias_HA_SAV_UserArgs_MT128x256x32_MI16x16x1_SN_GRVWA4_GRVWB4_GSU1_LBSPPA512_LPA8_LPB8_LRVW4_MIWT4_8_NTC3_NTD3_SU0_SUM0_SUS0_SVW4_VWA4_WG32_8_1_WGM8
    SolutionIndex: 611
    SolutionNameMin: Cijk_Alik_Bljk_S_MX_B_Bias_HA_SAV_UserArgs_MT128x224x32_MI16x16x1_SN_GRVWA4_GRVWB4_GSU1_LBSPPA512_LPA8_LPB8_LRVW4_MIWT4_7_NTC3_NTD3_SU0_SUM0_SUS0_SVW4_VWA4_WG32_8_1_WGM8
    SolutionIndex: 612
    SolutionNameMin: Cijk_Alik_Bljk_S_MX_B_Bias_HA_SAV_UserArgs_MT224x160x32_MI16x16x1_SN_GRVWA1_GRVWB4_GSU1_LBSPPA128_LPA8_LPB8_LRVW4_MIWT7_5_NTC3_NTD3_SU0_SUM0_SUS0_SVW1_VWA1_WG32_8_1_WGM16
    SolutionIndex: 613
    SolutionNameMin: Cijk_Alik_Bljk_S_MX_B_Bias_HA_SAV_UserArgs_MT256x160x32_MI16x16x1_SN_GRVWA1_GRVWB1_GSU1_LBSPPA512_LPA8_LPB8_LRVW4_MIWT4_10_NTC0_NTD0_SU0_SUM0_SUS0_SVW4_VWA4_WG64_4_1_WGM8
    SolutionIndex: 614
    SolutionNameMin: Cijk_Alik_Bljk_S_MX_B_Bias_HA_SAV_UserArgs_MT256x160x32_MI32x32x1_SN_GRVWA1_GRVWB4_GSU1_LBSPPA256_LPA4_LPB4_LRVW4_MIWT2_5_NTC3_NTD3_SU0_SUM0_SUS0_SVW2_VWA2_WG128_2_1_WGM8
    SolutionIndex: 615
    SolutionNameMin: Cijk_Alik_Bljk_S_MX_B_Bias_HA_SAV_UserArgs_MT256x160x32_MI16x16x1_SN_GRVWA1_GRVWB4_GSU1_LBSPPA512_LPA8_LPB8_LRVW4_MIWT8_5_NTC0_NTD0_SU0_SUM0_SUS0_SVW4_VWA4_WG32_8_1_WGM8
    SolutionIndex: 616
    SolutionNameMin: Cijk_Alik_Bljk_S_MX_B_Bias_HA_SAV_UserArgs_MT256x160x32_MI16x16x1_SN_GRVWA1_GRVWB4_GSU1_LBSPPA512_LPA8_LPB8_LRVW4_MIWT8_5_NTC0_NTD0_SU0_SUM0_SUS0_SVW4_VWA4_WG32_8_1_WGM16
    SolutionIndex: 617
    SolutionNameMin: Cijk_Alik_Bljk_S_MX_B_Bias_HA_SAV_UserArgs_MT256x160x32_MI32x32x1_SN_GRVWA1_GRVWB4_GSU1_LBSPPA256_LPA4_LPB4_LRVW4_MIWT2_5_NTC3_NTD3_SU0_SUM0_SUS0_SVW2_VWA2_WG128_2_1_WGM16
    SolutionIndex: 618
    SolutionNameMin: Cijk_Alik_Bljk_S_MX_B_Bias_HA_SAV_UserArgs_MT128x320x32_MI32x32x1_SN_GRVWA4_GRVWB4_GSU1_LBSPPA256_LPA4_LPB4_LRVW4_MIWT2_5_NTC3_NTD3_SU0_SUM0_SUS0_SVW2_VWA2_WG64_4_1_WGM8
    SolutionIndex: 619
    SolutionNameMin: Cijk_Alik_Bljk_S_MX_B_Bias_HA_SAV_UserArgs_MT128x448x16_MI16x16x1_SN_GRVWA1_GRVWB4_GSU1_LBSPPA256_LPA2_LPB4_LRVW2_MIWT8_7_NTC3_NTD3_SU0_SUM0_SUS0_SVW4_VWA4_WG16_16_1_WGM8
    SolutionIndex: 620
    SolutionNameMin: Cijk_Alik_Bljk_S_MX_B_Bias_HA_SAV_UserArgs_MT320x160x32_MI16x16x1_SN_GRVWA1_GRVWB4_GSU1_LBSPPA256_LPA2_LPB4_LRVW2_MIWT10_5_NTC3_NTD3_SU0_SUM0_SUS0_SVW2_VWA2_WG32_8_1_WGM16
    SolutionIndex: 621
    SolutionNameMin: Cijk_Alik_Bljk_S_MX_B_Bias_HA_SAV_UserArgs_MT320x160x32_MI16x16x1_SN_GRVWA1_GRVWB4_GSU1_LBSPPA256_LPA2_LPB4_LRVW2_MIWT10_5_NTC0_NTD0_SU0_SUM0_SUS0_SVW2_VWA2_WG32_8_1_WGM16
    SolutionIndex: 622
    SolutionNameMin: Cijk_Alik_Bljk_S_MX_B_Bias_HA_SAV_UserArgs_MT192x320x16_MI16x16x1_SN_GRVWA1_GRVWB4_GSU1_LBSPPA256_LPA2_LPB4_LRVW2_MIWT12_5_NTC0_NTD0_SU0_SUM0_SUS0_SVW4_VWA4_WG16_16_1_WGM16
    SolutionIndex: 623
    SolutionNameMin: Cijk_Alik_Bljk_S_MX_B_Bias_HA_SAV_UserArgs_MT192x160x32_MI16x16x1_SN_GRVWA1_GRVWB4_GSU1_LBSPPA256_LPA8_LPB8_LRVW4_MIWT6_5_NTC3_NTD3_SU0_SUM0_SUS0_SVW2_VWA2_WG32_8_1_WGM16
    SolutionIndex: 624
    SolutionNameMin: Cijk_Alik_Bljk_S_MX_B_Bias_HA_SAV_UserArgs_MT256x208x16_MI16x16x1_SN_GRVWA4_GRVWB1_GSU1_LBSPPA256_LPA4_LPB2_LRVW2_MIWT4_13_SU8_SUM0_SUS256_SVW4_VWA4_WG64_4_1_WGM16
    SolutionIndex: 625
    SolutionNameMin: Cijk_Alik_Bljk_S_MX_B_Bias_HA_SAV_UserArgs_MT256x208x16_MI16x16x1_SN_GRVWA1_GRVWB1_GSU1_LBSPPA256_LPA2_LPB2_LRVW2_MIWT4_13_SU8_SUM0_SUS256_SVW4_VWA4_WG64_4_1_WGM16
    SolutionIndex: 626
    SolutionNameMin: Cijk_Alik_Bljk_S_MX_B_Bias_HA_SAV_UserArgs_MT208x256x32_MI16x16x1_SN_GRVWA1_GRVWB4_GSU1_LBSPPA128_LPA2_LPB4_LRVW2_MIWT13_4_SU8_SUM0_SUS256_SVW1_VWA1_WG16_16_1_WGM16
    SolutionIndex: 627
    SolutionNameMin: Cijk_Alik_Bljk_S_MX_B_Bias_HA_SAV_UserArgs_MT256x160x16_MI16x16x1_SN_GRVWA1_GRVWB1_GSU1_LBSPPA256_LPA2_LPB2_LRVW2_MIWT4_10_SU8_SUM0_SUS256_SVW4_VWA4_WG64_4_1_WGM8
    SolutionIndex: 628
    SolutionNameMin: Cijk_Alik_Bljk_S_MX_B_Bias_HA_SAV_UserArgs_MT128x320x16_MI16x16x1_SN_GRVWA1_GRVWB4_GSU1_LBSPPA256_LPA2_LPB4_LRVW2_MIWT8_5_SU8_SUM0_SUS256_SVW4_VWA4_WG16_16_1_WGM8
    SolutionIndex: 629
    SolutionNameMin: Cijk_Alik_Bljk_S_MX_B_Bias_HA_SAV_UserArgs_MT256x208x16_MI16x16x1_SN_GRVWA1_GRVWB1_GSU1_LBSPPA256_LPA2_LPB2_LRVW2_MIWT4_13_SU8_SUM0_SUS256_SVW4_VWA4_WG64_4_1_WGM8
    SolutionIndex: 630
    SolutionNameMin: Cijk_Alik_Bljk_S_MX_B_Bias_HA_SAV_UserArgs_MT256x224x32_MI16x16x1_SN_GRVWA1_GRVWB1_GSU1_LBSPPA512_LPA2_LPB2_LRVW2_MIWT8_7_SU8_SUM0_SUS256_SVW4_VWA4_WG32_8_1_WGM16
    SolutionIndex: 631
    SolutionNameMin: Cijk_Alik_Bljk_S_MX_B_Bias_HA_SAV_UserArgs_MT256x160x16_MI16x16x1_SN_GRVWA1_GRVWB1_GSU1_LBSPPA256_LPA2_LPB2_LRVW2_MIWT8_5_SU8_SUM0_SUS256_SVW4_VWA4_WG32_8_1_WGM8
    SolutionIndex: 632
    SolutionNameMin: Cijk_Alik_Bljk_S_MX_B_Bias_HA_SAV_UserArgs_MT160x256x16_MI16x16x1_SN_GRVWA1_GRVWB4_GSU1_LBSPPA128_LPA2_LPB4_LRVW2_MIWT10_4_SU8_SUM0_SUS256_SVW2_VWA2_WG16_16_1_WGM16
    SolutionIndex: 633
    SolutionNameMin: Cijk_Alik_Bljk_S_MX_B_Bias_HA_SAV_UserArgs_MT160x256x16_MI32x32x1_SN_GRVWA1_GRVWB4_GSU1_LBSPPA128_LPA4_LPB4_LRVW4_MIWT5_2_SU8_SUM0_SUS256_SVW1_VWA1_WG32_8_1_WGM16
    SolutionIndex: 634
    SolutionNameMin: Cijk_Alik_Bljk_S_MX_B_Bias_HA_SAV_UserArgs_MT128x320x16_MI16x16x1_SN_GRVWA1_GRVWB4_GSU1_LBSPPA256_LPA2_LPB4_LRVW2_MIWT8_5_SU8_SUM0_SUS256_SVW4_VWA4_WG16_16_1_WGM16
    SolutionIndex: 635
    SolutionNameMin: Cijk_Alik_Bljk_S_MX_B_Bias_HA_SAV_UserArgs_MT256x192x32_MI32x32x1_SN_GRVWA4_GRVWB4_GSU1_LBSPPA512_LPA4_LPB4_LRVW4_MIWT4_3_SU8_SUM0_SUS256_SVW4_VWA4_WG64_4_1_WGM16
    SolutionIndex: 636
    SolutionNameMin: Cijk_Alik_Bljk_S_MX_B_Bias_HA_SAV_UserArgs_MT256x256x16_MI32x32x1_SN_GRVWA4_GRVWB4_GSU1_LBSPPA256_LPA4_LPB4_LRVW4_MIWT4_4_SU8_SUM0_SUS256_SVW4_VWA4_WG64_4_1_WGM16
    SolutionIndex: 637
    SolutionNameMin: Cijk_Alik_Bljk_S_MX_B_Bias_HA_SAV_UserArgs_MT256x192x32_MI32x32x1_SN_GRVWA4_GRVWB4_GSU1_LBSPPA512_LPA4_LPB4_LRVW4_MIWT4_3_SU8_SUM0_SUS256_SVW4_VWA4_WG64_4_1_WGM8
    SolutionIndex: 638
    SolutionNameMin: Cijk_Alik_Bljk_S_MX_B_Bias_HA_SAV_UserArgs_MT256x256x16_MI32x32x1_SN_GRVWA4_GRVWB4_GSU1_LBSPPA256_LPA4_LPB4_LRVW4_MIWT8_2_SU8_SUM0_SUS256_SVW4_VWA4_WG32_8_1_WGMn16
    SolutionIndex: 639
    SolutionNameMin: Cijk_Alik_Bljk_S_MX_B_Bias_HA_SAV_UserArgs_MT16x128x64_MI16x16x1_SN_CLR1_GRVWA1_GRVWB4_GSU1_LBSPPA256_LBSPPB256_LPA8_LPB8_LRVW4_MIWT1_2_NTB4_PLR1_SU0_SUM0_SUS0_SVW1_VWA1_WG16_16_1_WGM1
    SolutionIndex: 640
    SolutionNameMin: Cijk_Alik_Bljk_S_MX_B_Bias_HA_SAV_UserArgs_MT16x64x128_MI16x16x1_SN_CLR1_GRVWA4_GRVWB4_GSU1_LBSPPA512_LBSPPB512_LPA8_LPB8_LRVW4_MIWT1_1_NTB4_PLR1_SU0_SUM0_SUS0_SVW1_VWA1_WG16_16_1_WGM1
    SolutionIndex: 641
    SolutionNameMin: Cijk_Alik_Bljk_S_MX_B_Bias_HA_SAV_UserArgs_MT32x128x64_MI16x16x1_SN_CLR1_GRVWA1_GRVWB4_GSU1_LBSPPA512_LBSPPB256_LPA8_LPB8_LRVW4_MIWT2_2_NTB4_PLR1_SU0_SUM0_SUS0_SVW2_VWA2_WG16_16_1_WGM1
    SolutionIndex: 642
    SolutionNameMin: Cijk_Alik_Bljk_S_MX_B_Bias_HA_SAV_UserArgs_MT32x128x64_MI16x16x1_SN_CLR1_GRVWA4_GRVWB4_GSU1_LBSPPA512_LBSPPB256_LPA8_LPB8_LRVW4_MIWT2_2_NTB4_PLR1_SU0_SUM0_SUS0_SVW2_VWA2_WG16_16_1_WGM1
    SolutionIndex: 643
    SolutionNameMin: Cijk_Alik_Bljk_S_MX_B_Bias_HA_SAV_UserArgs_MT32x128x64_MI32x32x1_SN_CLR1_GRVWA4_GRVWB4_GSU1_LBSPPA256_LBSPPB256_LPA4_LPB4_LRVW4_MIWT1_1_NTB4_PLR1_SU0_SUM0_SUS0_SVW1_VWA1_WG32_8_1_WGM1
    SolutionIndex: 644
    SolutionNameMin: Cijk_Alik_Bljk_S_MX_B_Bias_HA_SAV_UserArgs_MT16x160x64_MI16x16x1_SN_CLR1_GRVWA1_GRVWB4_GSU1_LBSPPA256_LBSPPB256_LPA8_LPB8_LRVW4_MIWT1_5_NTB4_PLR1_SU0_SUM0_SUS0_SVW1_VWA1_WG16_8_2_WGM1
    SolutionIndex: 645
    SolutionNameMin: Cijk_Alik_Bljk_S_MX_B_Bias_HA_SAV_UserArgs_MT16x160x64_MI16x16x1_SN_CLR1_GRVWA4_GRVWB4_GSU1_LBSPPA256_LBSPPB256_LPA8_LPB8_LRVW4_MIWT1_5_NTB4_PLR1_SU0_SUM0_SUS0_SVW1_VWA1_WG16_8_2_WGM1
    SolutionIndex: 646
    SolutionNameMin: Cijk_Alik_Bljk_S_MX_B_Bias_HA_SAV_UserArgs_MT32x160x64_MI16x16x1_SN_CLR1_GRVWA4_GRVWB4_GSU1_LBSPPA256_LBSPPB256_LPA8_LPB8_LRVW4_MIWT1_5_NTB4_PLR1_SU0_SUM0_SUS0_SVW1_VWA1_WG32_8_1_WGM1
    SolutionIndex: 647
    SolutionNameMin: Cijk_Alik_Bljk_S_MX_B_Bias_HA_SAV_UserArgs_MT32x160x64_MI16x16x1_SN_CLR1_GRVWA4_GRVWB4_GSU1_LBSPPA512_LBSPPB256_LPA8_LPB8_LRVW4_MIWT2_5_NTB4_PLR1_SU0_SUM0_SUS0_SVW2_VWA2_WG16_8_2_WGM1
    SolutionIndex: 648
    SolutionNameMin: Cijk_Alik_Bljk_S_MX_B_Bias_HA_SAV_UserArgs_MT16x224x64_MI16x16x1_SN_CLR1_GRVWA1_GRVWB1_GSU1_LBSPPA256_LBSPPB256_LPA2_LPB2_LRVW2_MIWT1_7_NTB4_PLR1_SU0_SUM0_SUS0_SVW1_VWA1_WG16_8_2_WGM1
    SolutionIndex: 649
    SolutionNameMin: Cijk_Alik_Bljk_S_MX_B_Bias_HA_SAV_UserArgs_MT16x64x128_MI16x16x1_SN_CLR1_GRVWA4_GRVWB4_GSU2_LBSPPA512_LBSPPB512_LPA8_LPB8_LRVW4_MIWT1_1_NTB4_PLR1_SU0_SUM0_SUS0_SVW1_VWA1_WG16_16_1_WGM1
    SolutionIndex: 650
    SolutionNameMin: Cijk_Alik_Bljk_S_MX_B_Bias_HA_SAV_UserArgs_MT16x64x64_MI16x16x1_SN_CLR1_GRVWA4_GRVWB1_GSU1_LBSPPA256_LBSPPB256_LPA8_LPB8_LRVW4_MIWT1_1_NTB4_PLR1_SU0_SUM0_SUS0_SVW1_VWA1_WG16_16_1_WGM1
    SolutionIndex: 651
    SolutionNameMin: Cijk_Alik_Bljk_S_MX_B_Bias_HA_SAV_UserArgs_MT32x160x64_MI16x16x1_SN_CLR1_GRVWA4_GRVWB4_GSU1_LBSPPA512_LBSPPB256_LPA8_LPB8_LRVW4_MIWT2_5_NTB0_PLR1_SU0_SUM0_SUS0_SVW2_VWA2_WG16_8_2_WGM1
    SolutionIndex: 652
    SolutionNameMin: Cijk_Alik_Bljk_S_MX_B_Bias_HA_SAV_UserArgs_MT32x96x32_MI16x16x1_SN_CLR1_GRVWA1_GRVWB4_GSU1_LBSPPA128_LBSPPB128_LPA8_LPB8_LRVW4_MIWT1_3_NTB4_PLR1_SU0_SUM0_SUS0_SVW1_VWA1_WG32_8_1_WGM1
    SolutionIndex: 653
    SolutionNameMin: Cijk_Alik_Bljk_S_MX_B_Bias_HA_SAV_UserArgs_MT32x144x64_MI16x16x1_SN_CLR1_GRVWA4_GRVWB4_GSU1_LBSPPA256_LBSPPB256_LPA8_LPB8_LRVW4_MIWT1_9_NTB4_PLR1_SU0_SUM0_SUS0_SVW1_VWA1_WG32_4_2_WGM1
    SolutionIndex: 654
    SolutionNameMin: Cijk_Alik_Bljk_S_MX_B_Bias_HA_SAV_UserArgs_MT32x144x64_MI16x16x1_SN_CLR1_GRVWA4_GRVWB4_GSU1_LBSPPA256_LBSPPB256_LPA8_LPB8_LRVW4_MIWT1_9_NTB0_PLR1_SU0_SUM0_SUS0_SVW1_VWA1_WG32_4_2_WGM1
    SolutionIndex: 655
    SolutionNameMin: Cijk_Alik_Bljk_S_MX_B_Bias_HA_SAV_UserArgs_MT64x128x64_MI16x16x1_SN_GRVWA4_GRVWB4_GSU1_LBSPPA512_LBSPPB256_LPA8_LPB8_LRVW4_MIAV1_MIWT2_4_NTB0_SU0_SUM0_SUS0_SVW2_VWA2_WG32_8_1_WGM1
    SolutionIndex: 656
    SolutionNameMin: Cijk_Alik_Bljk_S_MX_B_Bias_HA_SAV_UserArgs_MT64x128x64_MI16x16x1_SN_GRVWA4_GRVWB4_GSU1_LBSPPA512_LBSPPB256_LPA8_LPB8_LRVW4_MIAV1_MIWT2_4_NTB4_SU0_SUM0_SUS0_SVW2_VWA2_WG32_8_1_WGM1
    SolutionIndex: 657
    SolutionNameMin: Cijk_Alik_Bljk_S_MX_B_Bias_HA_SAV_UserArgs_MT96x128x64_MI16x16x1_SN_GRVWA4_GRVWB4_GSU1_LBSPPA256_LBSPPB256_LPA8_LPB8_LRVW4_MIAV1_MIWT3_4_NTB0_SU0_SUM0_SUS0_SVW1_VWA1_WG32_8_1_WGM1
    SolutionIndex: 658
    SolutionNameMin: Cijk_Alik_Bljk_S_MX_B_Bias_HA_SAV_UserArgs_MT96x128x64_MI16x16x1_SN_GRVWA4_GRVWB4_GSU1_LBSPPA256_LBSPPB256_LPA8_LPB8_LRVW4_MIAV1_MIWT3_4_NTB4_SU0_SUM0_SUS0_SVW1_VWA1_WG32_8_1_WGM1
    SolutionIndex: 659
    SolutionNameMin: Cijk_Alik_Bljk_S_MX_B_Bias_HA_SAV_UserArgs_MT64x160x64_MI16x16x1_SN_GRVWA4_GRVWB4_GSU1_LBSPPA512_LBSPPB256_LPA8_LPB8_LRVW4_MIAV1_MIWT2_5_NTB0_SU0_SUM0_SUS0_SVW2_VWA2_WG32_8_1_WGM1
    SolutionIndex: 660
    SolutionNameMin: Cijk_Alik_Bljk_S_MX_B_Bias_HA_SAV_UserArgs_MT64x160x64_MI16x16x1_SN_GRVWA4_GRVWB4_GSU1_LBSPPA512_LBSPPB256_LPA8_LPB8_LRVW4_MIAV1_MIWT2_5_NTB4_SU0_SUM0_SUS0_SVW2_VWA2_WG32_8_1_WGM1
    SolutionIndex: 661
    SolutionNameMin: Cijk_Alik_Bljk_S_MX_B_Bias_HA_SAV_UserArgs_MT96x160x32_MI16x16x1_SN_GRVWA4_GRVWB4_GSU1_LBSPPA128_LBSPPB128_LPA8_LPB8_LRVW4_MIAV1_MIWT3_5_NTB0_SU0_SUM0_SUS0_SVW1_VWA1_WG32_8_1_WGM1
    SolutionIndex: 662
    SolutionNameMin: Cijk_Alik_Bljk_S_MX_B_Bias_HA_SAV_UserArgs_MT96x96x64_MI16x16x1_SN_GRVWA4_GRVWB4_GSU1_LBSPPA256_LBSPPB256_LPA8_LPB8_LRVW4_MIAV1_MIWT3_3_NTB4_SU0_SUM0_SUS0_SVW1_VWA1_WG32_8_1_WGM1
    SolutionIndex: 663
    SolutionNameMin: Cijk_Alik_Bljk_S_MX_B_Bias_HA_SAV_UserArgs_MT64x224x32_MI16x16x1_SN_GRVWA4_GRVWB4_GSU1_LBSPPA256_LBSPPB128_LPA8_LPB8_LRVW4_MIAV1_MIWT2_7_NTB0_SU0_SUM0_SUS0_SVW2_VWA2_WG32_8_1_WGM1
    SolutionIndex: 664
    SolutionNameMin: Cijk_Alik_Bljk_S_MX_B_Bias_HA_SAV_UserArgs_MT96x224x32_MI16x16x1_SN_GRVWA4_GRVWB4_GSU1_LBSPPA128_LBSPPB128_LPA8_LPB8_LRVW4_MIAV1_MIWT3_7_NTB0_SU0_SUM0_SUS0_SVW1_VWA1_WG32_8_1_WGM1
    SolutionIndex: 665
    SolutionNameMin: Cijk_Alik_Bljk_S_MX_B_Bias_HA_SAV_UserArgs_MT64x256x32_MI16x16x1_SN_GRVWA4_GRVWB4_GSU1_LBSPPA512_LBSPPB128_LPA8_LPB8_LRVW4_MIAV1_MIWT4_4_NTB0_SU0_SUM0_SUS0_SVW4_VWA4_WG16_16_1_WGM1
    SolutionIndex: 666
    SolutionNameMin: Cijk_Alik_Bljk_S_MX_B_Bias_HA_SAV_UserArgs_MT96x256x32_MI16x16x1_SN_GRVWA4_GRVWB4_GSU1_LBSPPA256_LBSPPB128_LPA8_LPB8_LRVW4_MIAV0_MIWT6_4_NTB0_SU0_SUM0_SUS0_SVW2_VWA2_WG16_16_1_WGM1
    SolutionIndex: 667
    SolutionNameMin: Cijk_Alik_Bljk_S_MX_B_Bias_HA_SAV_UserArgs_MT64x320x32_MI16x16x1_SN_GRVWA4_GRVWB4_GSU1_LBSPPA512_LBSPPB128_LPA8_LPB8_LRVW4_MIAV1_MIWT4_5_NTB0_SU0_SUM0_SUS0_SVW4_VWA4_WG16_16_1_WGM1
    SolutionIndex: 668
    SolutionNameMin: Cijk_Alik_Bljk_S_MX_B_Bias_HA_SAV_UserArgs_MT96x320x32_MI16x16x1_SN_GRVWA4_GRVWB4_GSU1_LBSPPA256_LBSPPB128_LPA8_LPB8_LRVW4_MIAV0_MIWT6_5_NTB0_SU0_SUM0_SUS0_SVW2_VWA2_WG16_16_1_WGM1
    SolutionIndex: 669
    SolutionNameMin: Cijk_Alik_Bljk_S_MX_B_Bias_HA_SAV_UserArgs_MT96x320x32_MI16x16x1_SN_GRVWA1_GRVWB4_GSU1_LBSPPA256_LBSPPB128_LPA8_LPB8_LRVW4_MIAV0_MIWT6_5_NTB4_SU0_SUM0_SUS0_SVW2_VWA2_WG16_16_1_WGM1
    SolutionIndex: 670
    SolutionNameMin: Cijk_Alik_Bljk_S_MX_B_Bias_HA_SAV_UserArgs_MT64x128x32_MI16x16x1_SN_GRVWA1_GRVWB4_GSU1_LBSPPA256_LBSPPB128_LPA8_LPB8_LRVW4_MIAV1_MIWT2_4_NTB0_SU0_SUM0_SUS0_SVW2_VWA2_WG32_8_1_WGM1
    SolutionIndex: 671
    SolutionNameMin: Cijk_Alik_Bljk_S_MX_B_Bias_HA_SAV_UserArgs_MT96x224x32_MI16x16x1_SN_GRVWA1_GRVWB4_GSU1_LBSPPA128_LBSPPB128_LPA8_LPB8_LRVW4_MIAV1_MIWT3_7_NTB4_SU0_SUM0_SUS0_SVW1_VWA1_WG32_8_1_WGM1
    SolutionIndex: 672
    SolutionNameMin: Cijk_Alik_Bljk_S_MX_B_Bias_HA_SAV_UserArgs_MT128x112x32_MI16x16x1_SN_GRVWA4_GRVWB1_GSU1_LBSPPA256_LBSPPB128_LPA8_LPB8_LRVW4_MIAV1_MIWT2_7_NTB0_NTC3_NTD3_SU0_SUM0_SUS0_SVW2_VWA2_WG64_4_1_WGM1
    SolutionIndex: 673
    SolutionNameMin: Cijk_Alik_Bljk_S_MX_B_Bias_HA_SAV_UserArgs_MT128x112x32_MI16x16x1_SN_GRVWA1_GRVWB1_GSU1_LBSPPA256_LBSPPB128_LPA8_LPB8_LRVW4_MIAV1_MIWT2_7_NTB4_NTC3_NTD3_SU0_SUM0_SUS0_SVW2_VWA2_WG64_4_1_WGM1
    SolutionIndex: 674
    SolutionNameMin: Cijk_Alik_Bljk_S_MX_B_Bias_HA_SAV_UserArgs_MT128x224x32_MI16x16x1_SN_GRVWA4_GRVWB4_GSU2_LBSPPA512_LBSPPB128_LPA8_LPB8_LRVW4_MIAV0_MIWT4_7_NTB4_NTC0_NTD0_SU0_SUM0_SUS0_SVW4_VWA4_WG32_8_1_WGM1
    SolutionIndex: 675
    SolutionNameMin: Cijk_Alik_Bljk_S_MX_B_Bias_HA_SAV_UserArgs_MT64x320x32_MI16x16x1_SN_GRVWA4_GRVWB4_GSU1_LBSPPA512_LBSPPB128_LPA8_LPB8_LRVW4_MIAV1_MIWT4_5_NTB0_NTC3_NTD3_SU0_SUM0_SUS0_SVW4_VWA4_WG16_16_1_WGM1
    SolutionIndex: 676
    SolutionNameMin: Cijk_Alik_Bljk_S_MX_B_Bias_HA_SAV_UserArgs_MT192x112x32_MI16x16x1_SN_GRVWA1_GRVWB1_GSU1_LBSPPA128_LBSPPB128_LPA8_LPB8_LRVW4_MIAV1_MIWT3_7_NTB4_NTC0_NTD0_SU0_SUM0_SUS0_SVW1_VWA1_WG64_4_1_WGM1
    SolutionIndex: 677
    SolutionNameMin: Cijk_Alik_Bljk_S_MX_B_Bias_HA_SAV_UserArgs_MT192x112x32_MI16x16x1_SN_GRVWA1_GRVWB1_GSU1_LBSPPA128_LBSPPB128_LPA8_LPB8_LRVW4_MIAV1_MIWT3_7_NTB4_NTC3_NTD3_SU0_SUM0_SUS0_SVW1_VWA1_WG64_4_1_WGM1
    SolutionIndex: 678
    SolutionNameMin: Cijk_Alik_Bljk_S_MX_B_Bias_HA_SAV_UserArgs_MT128x160x32_MI16x16x1_SN_GRVWA1_GRVWB1_GSU1_LBSPPA512_LBSPPB128_LPA8_LPB8_LRVW4_MIAV1_MIWT4_5_NTB4_NTC3_NTD3_SU0_SUM0_SUS0_SVW4_VWA4_WG32_8_1_WGM1
    SolutionIndex: 679
    SolutionNameMin: Cijk_Alik_Bljk_S_MX_B_Bias_HA_SAV_UserArgs_MT128x160x32_MI16x16x1_SN_GRVWA1_GRVWB4_GSU1_LBSPPA512_LBSPPB128_LPA8_LPB8_LRVW4_MIAV1_MIWT4_5_NTB4_NTC3_NTD3_SU0_SUM0_SUS0_SVW4_VWA4_WG32_8_1_WGM1
    SolutionIndex: 680
    SolutionNameMin: Cijk_Alik_Bljk_S_MX_B_Bias_HA_SAV_UserArgs_MT128x160x32_MI16x16x1_SN_GRVWA1_GRVWB4_GSU1_LBSPPA512_LBSPPB128_LPA8_LPB8_LRVW4_MIAV1_MIWT4_5_NTB4_NTC0_NTD0_SU0_SUM0_SUS0_SVW4_VWA4_WG32_8_1_WGM1
    SolutionIndex: 681
    SolutionNameMin: Cijk_Alik_Bljk_S_MX_B_Bias_HA_SAV_UserArgs_MT192x224x32_MI16x16x1_SN_GRVWA4_GRVWB4_GSU1_LBSPPA256_LBSPPB128_LPA8_LPB8_LRVW4_MIAV0_MIWT6_7_NTB4_NTC3_NTD3_SU0_SUM0_SUS0_SVW2_VWA2_WG32_8_1_WGM1
    SolutionIndex: 682
    SolutionNameMin: Cijk_Alik_Bljk_S_MX_B_Bias_HA_SAV_UserArgs_MT192x176x32_MI16x16x1_SN_GRVWA1_GRVWB1_GSU1_LBSPPA128_LBSPPB128_LPA8_LPB8_LRVW4_MIAV0_MIWT3_11_NTB4_NTC3_NTD3_SU0_SUM0_SUS0_SVW1_VWA1_WG64_4_1_WGM1
    SolutionIndex: 683
    SolutionNameMin: Cijk_Alik_Bljk_S_MX_B_Bias_HA_SAV_UserArgs_MT128x224x32_MI16x16x1_SN_GRVWA4_GRVWB4_GSU1_LBSPPA512_LBSPPB128_LPA8_LPB8_LRVW4_MIAV0_MIWT4_7_NTB4_NTC3_NTD3_SU0_SUM0_SUS0_SVW4_VWA4_WG32_8_1_WGM1
    SolutionIndex: 684
    SolutionNameMin: Cijk_Alik_Bljk_S_MX_B_Bias_HA_SAV_UserArgs_MT128x224x32_MI16x16x1_SN_GRVWA4_GRVWB4_GSU1_LBSPPA512_LBSPPB128_LPA8_LPB8_LRVW4_MIAV0_MIWT4_7_NTB4_NTC0_NTD0_SU0_SUM0_SUS0_SVW4_VWA4_WG32_8_1_WGM1
    SolutionIndex: 685
    SolutionNameMin: Cijk_Alik_Bljk_S_MX_B_Bias_HA_SAV_UserArgs_MT128x256x32_MI16x16x1_SN_GRVWA4_GRVWB4_GSU1_LBSPPA512_LBSPPB128_LPA8_LPB8_LRVW4_MIAV0_MIWT8_4_NTB4_NTC3_NTD3_SU0_SUM0_SUS0_SVW4_VWA4_WG16_16_1_WGM1
    SolutionIndex: 686
    SolutionNameMin: Cijk_Alik_Bljk_S_MX_B_Bias_HA_SAV_UserArgs_MT128x256x32_MI16x16x1_SN_GRVWA1_GRVWB4_GSU1_LBSPPA512_LBSPPB128_LPA8_LPB8_LRVW4_MIAV0_MIWT8_4_NTB4_NTC3_NTD3_SU0_SUM0_SUS0_SVW4_VWA4_WG16_16_1_WGM1
    SolutionIndex: 687
    SolutionNameMin: Cijk_Alik_Bljk_S_MX_B_Bias_HA_SAV_UserArgs_MT128x256x32_MI16x16x1_SN_GRVWA4_GRVWB4_GSU1_LBSPPA512_LBSPPB128_LPA8_LPB8_LRVW4_MIAV0_MIWT8_4_NTB4_NTC0_NTD0_SU0_SUM0_SUS0_SVW4_VWA4_WG16_16_1_WGM1
    SolutionIndex: 688
    SolutionNameMin: Cijk_Alik_Bljk_S_MX_B_Bias_HA_SAV_UserArgs_MT192x256x32_MI32x32x1_SN_GRVWA4_GRVWB4_GSU1_LBSPPA256_LBSPPB128_LPA4_LPB4_LRVW4_MIAV0_MIWT6_2_NTB4_NTC3_NTD3_SU0_SUM0_SUS0_SVW2_VWA2_WG32_8_1_WGM1
    SolutionIndex: 689
    SolutionNameMin: Cijk_Alik_Bljk_S_MX_B_Bias_HA_SAV_UserArgs_MT192x256x32_MI32x32x1_SN_GRVWA1_GRVWB4_GSU1_LBSPPA256_LBSPPB128_LPA4_LPB4_LRVW4_MIAV0_MIWT6_2_NTB4_NTC3_NTD3_SU0_SUM0_SUS0_SVW2_VWA2_WG32_8_1_WGM1
    SolutionIndex: 690
    SolutionNameMin: Cijk_Alik_Bljk_S_MX_B_Bias_HA_SAV_UserArgs_MT192x256x32_MI32x32x1_SN_GRVWA4_GRVWB4_GSU1_LBSPPA128_LBSPPB128_LPA4_LPB4_LRVW4_MIAV0_MIWT3_4_NTB4_NTC3_NTD3_SU0_SUM0_SUS0_SVW1_VWA1_WG64_4_1_WGM1
    SolutionIndex: 691
    SolutionNameMin: Cijk_Alik_Bljk_S_MX_B_Bias_HA_SAV_UserArgs_MT128x320x32_MI32x32x1_SN_GRVWA1_GRVWB4_GSU1_LBSPPA256_LBSPPB128_LPA4_LPB4_LRVW4_MIAV0_MIWT2_5_NTB4_NTC3_NTD3_SU0_SUM0_SUS0_SVW2_VWA2_WG64_4_1_WGM1
    SolutionIndex: 692
    SolutionNameMin: Cijk_Alik_Bljk_S_MX_B_Bias_HA_SAV_UserArgs_MT128x320x32_MI32x32x1_SN_GRVWA4_GRVWB4_GSU1_LBSPPA256_LBSPPB128_LPA4_LPB4_LRVW4_MIAV0_MIWT2_5_NTB4_NTC3_NTD3_SU0_SUM0_SUS0_SVW2_VWA2_WG64_4_1_WGM1
    SolutionIndex: 693
    SolutionNameMin: Cijk_Alik_Bljk_S_MX_B_Bias_HA_SAV_UserArgs_MT192x320x16_MI16x16x1_SN_GRVWA1_GRVWB4_GSU1_LBSPPA256_LBSPPB128_LPA2_LPB4_LRVW2_MIAV0_MIWT12_5_NTB0_NTC3_NTD3_SU0_SUM0_SUS0_SVW4_VWA4_WG16_16_1_WGM1
    SolutionIndex: 694
    SolutionNameMin: Cijk_Alik_Bljk_S_MX_B_Bias_HA_SAV_UserArgs_MT192x320x16_MI16x16x1_SN_GRVWA4_GRVWB4_GSU1_LBSPPA256_LBSPPB128_LPA4_LPB4_LRVW2_MIAV0_MIWT12_5_NTB0_NTC3_NTD3_SU0_SUM0_SUS0_SVW4_VWA4_WG16_16_1_WGM1
    SolutionIndex: 695
    SolutionNameMin: Cijk_Alik_Bljk_S_MX_B_Bias_HA_SAV_UserArgs_MT192x176x32_MI16x16x1_SN_GRVWA1_GRVWB1_GSU1_LBSPPA128_LBSPPB128_LPA8_LPB8_LRVW4_MIAV0_MIWT3_11_NTB4_NTC0_NTD0_SU0_SUM0_SUS0_SVW1_VWA1_WG64_4_1_WGM1
    SolutionIndex: 696
    SolutionNameMin: Cijk_Alik_Bljk_S_MX_B_Bias_HA_SAV_UserArgs_MT128x224x32_MI16x16x1_SN_GRVWA1_GRVWB4_GSU1_LBSPPA512_LBSPPB128_LPA8_LPB8_LRVW4_MIAV0_MIWT4_7_NTB4_NTC3_NTD3_SU0_SUM0_SUS0_SVW4_VWA4_WG32_8_1_WGM1
    SolutionIndex: 697
    SolutionNameMin: Cijk_Alik_Bljk_S_MX_B_Bias_HA_SAV_UserArgs_MT192x224x32_MI16x16x1_SN_GRVWA4_GRVWB4_GSU1_LBSPPA256_LBSPPB128_LPA8_LPB8_LRVW4_MIAV0_MIWT6_7_NTB0_NTC3_NTD3_SU0_SUM0_SUS0_SVW2_VWA2_WG32_8_1_WGM1
    SolutionIndex: 698
    SolutionNameMin: Cijk_Alik_Bljk_S_MX_B_Bias_HA_SAV_UserArgs_MT128x224x32_MI16x16x1_SN_GRVWA4_GRVWB4_GSU1_LBSPPA512_LPA8_LPB8_LRVW4_MIWT4_7_NTB0_NTC3_NTD3_SU0_SUM0_SUS0_SVW4_VWA4_WG32_8_1_WGM1
    SolutionIndex: 699
    SolutionNameMin: Cijk_Alik_Bljk_S_MX_B_Bias_HA_SAV_UserArgs_MT256x112x32_MI16x16x1_SN_GRVWA1_GRVWB1_GSU1_LBSPPA512_LPA8_LPB8_LRVW4_MIWT4_7_NTB4_NTC3_NTD3_SU0_SUM0_SUS0_SVW4_VWA4_WG64_4_1_WGM1
    SolutionIndex: 700
    SolutionNameMin: Cijk_Alik_Bljk_S_MX_B_Bias_HA_SAV_UserArgs_MT128x320x16_MI16x16x1_SN_GRVWA1_GRVWB4_GSU1_LBSPPA256_LPA2_LPB4_LRVW2_MIWT8_5_NTB0_NTC3_NTD3_SU0_SUM0_SUS0_SVW4_VWA4_WG16_16_1_WGM1
    SolutionIndex: 701
    SolutionNameMin: Cijk_Alik_Bljk_S_MX_B_Bias_HA_SAV_UserArgs_MT192x224x32_MI16x16x1_SN_GRVWA4_GRVWB4_GSU1_LBSPPA256_LPA8_LPB8_LRVW4_MIWT6_7_NTB4_NTC3_NTD3_SU0_SUM0_SUS0_SVW2_VWA2_WG32_8_1_WGM1
    SolutionIndex: 702
    SolutionNameMin: Cijk_Alik_Bljk_S_MX_B_Bias_HA_SAV_UserArgs_MT256x160x32_MI16x16x1_SN_GRVWA4_GRVWB4_GSU1_LBSPPA512_LPA8_LPB8_LRVW4_MIWT8_5_NTB0_NTC3_NTD3_SU0_SUM0_SUS0_SVW4_VWA4_WG32_8_1_WGM1
    SolutionIndex: 703
    SolutionNameMin: Cijk_Alik_Bljk_S_MX_B_Bias_HA_SAV_UserArgs_MT256x160x32_MI32x32x1_SN_GRVWA1_GRVWB4_GSU1_LBSPPA256_LPA4_LPB4_LRVW4_MIWT2_5_NTB4_NTC3_NTD3_SU0_SUM0_SUS0_SVW2_VWA2_WG128_2_1_WGM1
    SolutionIndex: 704
    SolutionNameMin: Cijk_Alik_Bljk_S_MX_B_Bias_HA_SAV_UserArgs_MT256x160x32_MI32x32x1_SN_GRVWA4_GRVWB4_GSU1_LBSPPA256_LPA4_LPB4_LRVW4_MIWT2_5_NTB4_NTC3_NTD3_SU0_SUM0_SUS0_SVW2_VWA2_WG128_2_1_WGM1
    SolutionIndex: 705
    SolutionNameMin: Cijk_Alik_Bljk_S_MX_B_Bias_HA_SAV_UserArgs_MT192x320x16_MI16x16x1_SN_GRVWA1_GRVWB4_GSU1_LBSPPA256_LPA2_LPB4_LRVW2_MIWT12_5_NTB0_NTC0_NTD0_SU0_SUM0_SUS0_SVW4_VWA4_WG16_16_1_WGM1
    SolutionIndex: 706
    SolutionNameMin: Cijk_Alik_Bljk_S_MX_B_Bias_HA_SAV_UserArgs_MT384x160x16_MI16x16x1_SN_GRVWA4_GRVWB1_GSU1_LBSPPA128_LPA4_LPB2_LRVW2_MIWT6_10_NTB4_NTC3_NTD3_SU0_SUM0_SUS0_SVW2_VWA2_WG64_4_1_WGM1
    SolutionIndex: 707
    SolutionNameMin: Cijk_Alik_Bljk_S_MX_B_Bias_HA_SAV_UserArgs_MT192x320x16_MI16x16x1_SN_GRVWA1_GRVWB4_GSU1_LBSPPA256_LPA2_LPB4_LRVW2_MIWT12_5_NTB0_NTC3_NTD3_SU0_SUM0_SUS0_SVW4_VWA4_WG16_16_1_WGM1
    SolutionIndex: 708
    SolutionNameMin: Cijk_Alik_Bljk_S_MX_B_Bias_HA_SAV_UserArgs_MT256x208x16_MI16x16x1_SN_GRVWA1_GRVWB1_GSU1_LBSPPA256_LPA2_LPB2_LRVW2_MIWT4_13_NTB0_NTC3_NTD3_SU0_SUM0_SUS0_SVW4_VWA4_WG64_4_1_WGM1
    SolutionIndex: 709
    SolutionNameMin: Cijk_Alik_Bljk_S_MX_B_Bias_HA_SAV_UserArgs_MT256x224x32_MI16x16x1_SN_GRVWA1_GRVWB1_GSU1_LBSPPA512_LPA2_LPB2_LRVW2_MIWT8_7_NTB4_NTC0_NTD0_SU0_SUM0_SUS0_SVW4_VWA4_WG32_8_1_WGM1
    SolutionIndex: 710
    SolutionNameMin: Cijk_Alik_Bljk_S_MX_B_Bias_HA_SAV_UserArgs_MT256x224x32_MI32x32x1_SN_GRVWA4_GRVWB1_GSU1_LBSPPA256_LPA4_LPB2_LRVW2_MIWT2_7_NTB4_NTC3_NTD3_SU0_SUM0_SUS0_SVW2_VWA2_WG128_2_1_WGM1
    SolutionIndex: 711
    SolutionNameMin: Cijk_Alik_Bljk_S_MX_B_Bias_HA_SAV_UserArgs_MT256x256x16_MI32x32x1_SN_GRVWA1_GRVWB4_GSU1_LBSPPA256_LPA4_LPB4_LRVW4_MIWT4_4_NTB0_NTC3_NTD3_SU0_SUM0_SUS0_SVW4_VWA4_WG64_4_1_WGM1
    SolutionIndex: 712
    SolutionNameMin: Cijk_Alik_Bljk_S_MX_B_Bias_HA_SAV_UserArgs_MT128x224x32_MI16x16x1_SN_GRVWA4_GRVWB4_GSU1_LBSPPA512_LPA8_LPB8_LRVW4_MIWT4_7_NTB0_NTC0_NTD0_SU0_SUM0_SUS0_SVW4_VWA4_WG32_8_1_WGM1
    SolutionIndex: 713
    SolutionNameMin: Cijk_Alik_Bljk_S_MX_B_Bias_HA_SAV_UserArgs_MT256x160x32_MI16x16x1_SN_GRVWA1_GRVWB4_GSU1_LBSPPA512_LPA8_LPB8_LRVW4_MIWT4_10_NTB4_NTC0_NTD0_SU0_SUM0_SUS0_SVW4_VWA4_WG64_4_1_WGM1
    SolutionIndex: 714
    SolutionNameMin: Cijk_Alik_Bljk_S_MX_B_Bias_HA_SAV_UserArgs_MT256x208x32_MI16x16x1_SN_GRVWA4_GRVWB1_GSU1_LBSPPA512_LPA4_LPB2_LRVW2_MIWT4_13_NTB4_NTC0_NTD0_SU0_SUM0_SUS0_SVW4_VWA4_WG64_4_1_WGM1
    SolutionIndex: 715
    SolutionNameMin: Cijk_Alik_Bljk_S_MX_B_Bias_HA_SAV_UserArgs_MT128x320x16_MI16x16x1_SN_GRVWA1_GRVWB4_GSU1_LBSPPA256_LPA2_LPB4_LRVW2_MIWT8_5_NTB0_NTC0_NTD0_SU0_SUM0_SUS0_SVW4_VWA4_WG16_16_1_WGM1
    SolutionIndex: 716
    SolutionNameMin: Cijk_Alik_Bljk_S_MX_B_Bias_HA_SAV_UserArgs_MT192x224x32_MI16x16x1_SN_GRVWA4_GRVWB4_GSU1_LBSPPA256_LPA8_LPB8_LRVW4_MIWT6_7_NTB0_NTC0_NTD0_SU0_SUM0_SUS0_SVW2_VWA2_WG32_8_1_WGM1
    SolutionIndex: 717
    SolutionNameMin: Cijk_Alik_Bljk_S_MX_B_Bias_HA_SAV_UserArgs_MT192x224x32_MI16x16x1_SN_GRVWA4_GRVWB4_GSU1_LBSPPA256_LPA8_LPB8_LRVW4_MIWT6_7_NTB4_NTC0_NTD0_SU0_SUM0_SUS0_SVW2_VWA2_WG32_8_1_WGM1
    SolutionIndex: 718
    SolutionNameMin: Cijk_Alik_Bljk_S_MX_B_Bias_HA_SAV_UserArgs_MT256x224x16_MI16x16x1_SN_GRVWA1_GRVWB1_GSU1_LBSPPA256_LPA2_LPB2_LRVW2_MIWT8_7_SU8_SUM0_SUS256_SVW4_VWA4_WG32_8_1_WGM16
    SolutionIndex: 719
    SolutionNameMin: Cijk_Alik_Bljk_S_MX_B_Bias_HA_SAV_UserArgs_MT256x224x32_MI16x16x1_SN_GRVWA1_GRVWB4_GSU1_LBSPPA512_LPA2_LPB4_LRVW2_MIWT8_7_SU8_SUM0_SUS256_SVW4_VWA4_WG32_8_1_WGM16
    SolutionIndex: 720
    SolutionNameMin: Cijk_Alik_Bljk_S_MX_B_Bias_HA_SAV_UserArgs_MT128x512x16_MI32x32x1_SN_GRVWA1_GRVWB4_GSU1_LBSPPA256_LPA4_LPB4_LRVW4_MIWT4_4_SU8_SUM0_SUS256_SVW4_VWA4_WG32_8_1_WGM16
    SolutionIndex: 721
    SolutionNameMin: Cijk_Alik_Bljk_S_MX_B_Bias_HA_SAV_UserArgs_MT128x512x16_MI32x32x1_SN_GRVWA4_GRVWB4_GSU1_LBSPPA256_LPA4_LPB4_LRVW4_MIWT4_4_SU8_SUM0_SUS256_SVW4_VWA4_WG32_8_1_WGM16
    SolutionIndex: 722
    SolutionNameMin: Cijk_Alik_Bljk_S_MX_B_Bias_HA_SAV_UserArgs_MT128x384x16_MI32x32x1_SN_GRVWA4_GRVWB4_GSU1_LBSPPA256_LPA4_LPB4_LRVW4_MIWT4_3_SU8_SUM0_SUS256_SVW4_VWA4_WG32_8_1_WGM16
    SolutionIndex: 723
    SolutionNameMin: Cijk_Alik_Bljk_S_MX_B_Bias_HA_SAV_UserArgs_MT320x160x32_MI16x16x1_SN_GRVWA1_GRVWB4_GSU1_LBSPPA256_LPA2_LPB4_LRVW2_MIWT10_5_SU8_SUM0_SUS256_SVW2_VWA2_WG32_8_1_WGM16
    SolutionIndex: 724
    SolutionNameMin: Cijk_Alik_Bljk_S_MX_B_Bias_HA_SAV_UserArgs_MT256x256x16_MI32x32x1_SN_GRVWA4_GRVWB4_GSU1_LBSPPA256_LPA4_LPB4_LRVW4_MIWT8_2_SU8_SUM0_SUS256_SVW4_VWA4_WG32_8_1_WGM16
    SolutionIndex: 725
    SolutionNameMin: Cijk_Alik_Bljk_S_MX_B_Bias_HA_SAV_UserArgs_MT256x224x32_MI32x32x1_SN_GRVWA4_GRVWB1_GSU1_LBSPPA256_LPA4_LPB2_LRVW2_MIWT2_7_SU8_SUM0_SUS256_SVW2_VWA2_WG128_2_1_WGM16
    SolutionIndex: 726
    SolutionNameMin: Cijk_Alik_Bljk_S_MX_B_Bias_HA_SAV_UserArgs_MT320x144x32_MI16x16x1_SN_GRVWA1_GRVWB1_GSU1_LBSPPA128_LPA2_LPB2_LRVW2_MIWT5_9_SU8_SUM0_SUS256_SVW1_VWA1_WG64_4_1_WGM16
    SolutionIndex: 727
    SolutionNameMin: Cijk_Alik_Bljk_S_MX_B_Bias_HA_SAV_UserArgs_MT320x192x16_MI16x16x1_SN_GRVWA1_GRVWB4_GSU1_LBSPPA256_LPA2_LPB4_LRVW2_MIWT20_3_SU8_SUM0_SUS256_SVW4_VWA4_WG16_16_1_WGM16
    SolutionIndex: 728
    SolutionNameMin: Cijk_Alik_Bljk_S_MX_B_Bias_HA_SAV_UserArgs_MT192x256x32_MI32x32x1_SN_GRVWA4_GRVWB4_GSU1_LBSPPA256_LPA4_LPB4_LRVW4_MIWT6_2_SU8_SUM0_SUS256_SVW2_VWA2_WG32_8_1_WGM16
    SolutionIndex: 729
    SolutionNameMin: Cijk_Alik_Bljk_S_MX_B_Bias_HA_SAV_UserArgs_MT192x256x32_MI32x32x1_SN_GRVWA4_GRVWB4_GSU1_LBSPPA128_LPA4_LPB4_LRVW4_MIWT3_4_SU8_SUM0_SUS256_SVW1_VWA1_WG64_4_1_WGM16
    SolutionIndex: 730
    SolutionNameMin: Cijk_Alik_Bljk_S_MX_B_Bias_HA_SAV_UserArgs_MT256x144x16_MI16x16x1_SN_GRVWA1_GRVWB1_GSU1_LBSPPA256_LPA2_LPB2_LRVW2_MIWT4_9_SU8_SUM0_SUS256_SVW4_VWA4_WG64_4_1_WGM16
    SolutionIndex: 731
    SolutionNameMin: Cijk_Alik_Bljk_S_MX_B_Bias_HA_SAV_UserArgs_MT256x160x32_MI32x32x1_SN_GRVWA4_GRVWB4_GSU1_LBSPPA256_LPA4_LPB4_LRVW4_MIWT2_5_SU8_SUM0_SUS256_SVW2_VWA2_WG128_2_1_WGM16
    SolutionIndex: 732
    SolutionNameMin: Cijk_Alik_Bljk_S_MX_B_Bias_HA_SAV_UserArgs_MT256x160x16_MI16x16x1_SN_GRVWA1_GRVWB1_GSU1_LBSPPA256_LPA2_LPB2_LRVW2_MIWT8_5_SU8_SUM0_SUS256_SVW4_VWA4_WG32_8_1_WGM16
    SolutionIndex: 733
    SolutionNameMin: Cijk_Alik_Bljk_S_MX_B_Bias_HA_SAV_UserArgs_MT256x160x32_MI16x16x1_SN_GRVWA1_GRVWB4_GSU1_LBSPPA512_LPA8_LPB8_LRVW4_MIWT8_5_SU8_SUM0_SUS256_SVW4_VWA4_WG32_8_1_WGM16
- - - [16, 16, 1, 1024]
    - [0, 83.9239]
  - - [16, 16, 1, 4096]
    - [1, 281.559]
  - - [16, 16, 1, 16384]
    - [3, 909.784]
  - - [32, 16, 1, 1024]
    - [0, 165.031]
  - - [32, 16, 1, 4096]
    - [1, 542.334]
  - - [32, 16, 1, 16384]
    - [2, 1724.06]
  - - [64, 16, 1, 1024]
    - [0, 328.033]
  - - [64, 16, 1, 4096]
    - [4, 1009.32]
  - - [64, 16, 1, 16384]
    - [5, 3189.52]
  - - [96, 16, 1, 1024]
    - [0, 489.409]
  - - [96, 16, 1, 4096]
    - [4, 1484.48]
  - - [96, 16, 1, 16384]
    - [6, 4396.87]
  - - [128, 16, 1, 1024]
    - [7, 568.69]
  - - [128, 16, 1, 4096]
    - [8, 1934.65]
  - - [128, 16, 1, 16384]
    - [9, 5333.47]
  - - [192, 16, 1, 1024]
    - [10, 792.706]
  - - [192, 16, 1, 4096]
    - [11, 2698.61]
  - - [192, 16, 1, 16384]
    - [12, 7418.26]
  - - [256, 16, 1, 1024]
    - [0, 1291.24]
  - - [256, 16, 1, 4096]
    - [13, 3426.95]
  - - [256, 16, 1, 16384]
    - [14, 8984.26]
  - - [384, 16, 1, 1024]
    - [0, 1929.72]
  - - [384, 16, 1, 4096]
    - [15, 4563.41]
  - - [384, 16, 1, 16384]
    - [16, 11625.6]
  - - [512, 16, 1, 1024]
    - [17, 2495.02]
  - - [512, 16, 1, 4096]
    - [18, 5524.66]
  - - [512, 16, 1, 16384]
    - [19, 13260.4]
  - - [640, 16, 1, 1024]
    - [17, 3102.5]
  - - [640, 16, 1, 4096]
    - [20, 7053.9]
  - - [640, 16, 1, 16384]
    - [20, 14761.2]
  - - [768, 16, 1, 1024]
    - [17, 3693.65]
  - - [768, 16, 1, 4096]
    - [21, 7722.2]
  - - [768, 16, 1, 16384]
    - [21, 15324.7]
  - - [1024, 16, 1, 1024]
    - [22, 4654.79]
  - - [1024, 16, 1, 4096]
    - [23, 9089.65]
  - - [1024, 16, 1, 16384]
    - [24, 17100.3]
  - - [1536, 16, 1, 1024]
    - [25, 5548.46]
  - - [1536, 16, 1, 4096]
    - [26, 11492.1]
  - - [1536, 16, 1, 16384]
    - [27, 18114.7]
  - - [2048, 16, 1, 1024]
    - [28, 6865.71]
  - - [2048, 16, 1, 4096]
    - [28, 12775.1]
  - - [2048, 16, 1, 16384]
    - [24, 18262.4]
  - - [3072, 16, 1, 1024]
    - [29, 8772.86]
  - - [3072, 16, 1, 4096]
    - [29, 13034.6]
  - - [3072, 16, 1, 16384]
    - [30, 18624.3]
  - - [4096, 16, 1, 1024]
    - [31, 11147.9]
  - - [4096, 16, 1, 4096]
    - [32, 17067.1]
  - - [4096, 16, 1, 16384]
    - [32, 19977.4]
  - - [6144, 16, 1, 1024]
    - [33, 11857.3]
  - - [6144, 16, 1, 4096]
    - [34, 14611.4]
  - - [6144, 16, 1, 16384]
    - [34, 19279.9]
  - - [8192, 16, 1, 1024]
    - [35, 11917.9]
  - - [8192, 16, 1, 4096]
    - [36, 16149.1]
  - - [8192, 16, 1, 16384]
    - [37, 19836.5]
  - - [12288, 16, 1, 1024]
    - [38, 12203.1]
  - - [12288, 16, 1, 4096]
    - [39, 16964.1]
  - - [12288, 16, 1, 16384]
    - [39, 20742.3]
  - - [16384, 16, 1, 1024]
    - [35, 12357.8]
  - - [16384, 16, 1, 4096]
    - [39, 16745.4]
  - - [16384, 16, 1, 16384]
    - [39, 20338.3]
  - - [20480, 16, 1, 1024]
    - [40, 14745.1]
  - - [20480, 16, 1, 4096]
    - [41, 19422.3]
  - - [20480, 16, 1, 16384]
    - [41, 21491.4]
  - - [24576, 16, 1, 1024]
    - [40, 14613.5]
  - - [24576, 16, 1, 4096]
    - [41, 19594.5]
  - - [24576, 16, 1, 16384]
    - [41, 21369.3]
  - - [32768, 16, 1, 1024]
    - [42, 14589.4]
  - - [32768, 16, 1, 4096]
    - [41, 18723.6]
  - - [32768, 16, 1, 16384]
    - [39, 21894.6]
  - - [16, 32, 1, 1024]
    - [43, 166.948]
  - - [16, 32, 1, 4096]
    - [44, 541.156]
  - - [16, 32, 1, 16384]
    - [45, 1674.53]
  - - [32, 32, 1, 1024]
    - [43, 328.568]
  - - [32, 32, 1, 4096]
    - [46, 1047.84]
  - - [32, 32, 1, 16384]
    - [47, 3271.04]
  - - [64, 32, 1, 1024]
    - [48, 575.005]
  - - [64, 32, 1, 4096]
    - [49, 2001.65]
  - - [64, 32, 1, 16384]
    - [50, 5497.8]
  - - [96, 32, 1, 1024]
    - [51, 800.226]
  - - [96, 32, 1, 4096]
    - [52, 2725.56]
  - - [96, 32, 1, 16384]
    - [53, 7478.38]
  - - [128, 32, 1, 1024]
    - [43, 1297.32]
  - - [128, 32, 1, 4096]
    - [54, 3584.28]
  - - [128, 32, 1, 16384]
    - [55, 9170.32]
  - - [192, 32, 1, 1024]
    - [43, 1935.43]
  - - [192, 32, 1, 4096]
    - [56, 5099.91]
  - - [192, 32, 1, 16384]
    - [57, 12352.0]
  - - [256, 32, 1, 1024]
    - [43, 2547.27]
  - - [256, 32, 1, 4096]
    - [58, 6162.96]
  - - [256, 32, 1, 16384]
    - [59, 14701.0]
  - - [384, 32, 1, 1024]
    - [43, 3719.9]
  - - [384, 32, 1, 4096]
    - [60, 7766.61]
  - - [384, 32, 1, 16384]
    - [61, 18948.7]
  - - [512, 32, 1, 1024]
    - [22, 4710.32]
  - - [512, 32, 1, 4096]
    - [62, 9542.01]
  - - [512, 32, 1, 16384]
    - [63, 22160.8]
  - - [640, 32, 1, 1024]
    - [22, 5816.52]
  - - [640, 32, 1, 4096]
    - [64, 12015.2]
  - - [640, 32, 1, 16384]
    - [64, 24202.0]
  - - [768, 32, 1, 1024]
    - [65, 6175.09]
  - - [768, 32, 1, 4096]
    - [66, 13302.9]
  - - [768, 32, 1, 16384]
    - [66, 25174.6]
  - - [1024, 32, 1, 1024]
    - [67, 7543.29]
  - - [1024, 32, 1, 4096]
    - [68, 16916.2]
  - - [1024, 32, 1, 16384]
    - [69, 26878.6]
  - - [1536, 32, 1, 1024]
    - [70, 9442.55]
  - - [1536, 32, 1, 4096]
    - [71, 20042.3]
  - - [1536, 32, 1, 16384]
    - [71, 31752.0]
  - - [2048, 32, 1, 1024]
    - [72, 11771.2]
  - - [2048, 32, 1, 4096]
    - [73, 21823.5]
  - - [2048, 32, 1, 16384]
    - [73, 32066.3]
  - - [3072, 32, 1, 1024]
    - [74, 15455.7]
  - - [3072, 32, 1, 4096]
    - [75, 24247.2]
  - - [3072, 32, 1, 16384]
    - [75, 33160.8]
  - - [4096, 32, 1, 1024]
    - [76, 19932.8]
  - - [4096, 32, 1, 4096]
    - [77, 28533.7]
  - - [4096, 32, 1, 16384]
    - [77, 33852.8]
  - - [6144, 32, 1, 1024]
    - [78, 18213.9]
  - - [6144, 32, 1, 4096]
    - [79, 26625.5]
  - - [6144, 32, 1, 16384]
    - [80, 34527.4]
  - - [8192, 32, 1, 1024]
    - [81, 20942.9]
  - - [8192, 32, 1, 4096]
    - [82, 27622.9]
  - - [8192, 32, 1, 16384]
    - [82, 31416.0]
  - - [12288, 32, 1, 1024]
    - [83, 24486.6]
  - - [12288, 32, 1, 4096]
    - [83, 30904.4]
  - - [12288, 32, 1, 16384]
    - [83, 34285.8]
  - - [16384, 32, 1, 1024]
    - [81, 21715.5]
  - - [16384, 32, 1, 4096]
    - [82, 28227.7]
  - - [16384, 32, 1, 16384]
    - [82, 31962.7]
  - - [20480, 32, 1, 1024]
    - [84, 25995.7]
  - - [20480, 32, 1, 4096]
    - [85, 34271.4]
  - - [20480, 32, 1, 16384]
    - [82, 38345.7]
  - - [24576, 32, 1, 1024]
    - [84, 25441.8]
  - - [24576, 32, 1, 4096]
    - [83, 31093.4]
  - - [24576, 32, 1, 16384]
    - [83, 34770.0]
  - - [32768, 32, 1, 256]
    - [84, 16911.9]
  - - [32768, 32, 1, 1024]
    - [86, 25344.7]
  - - [32768, 32, 1, 4096]
    - [86, 30108.8]
  - - [16, 64, 1, 1024]
    - [43, 327.869]
  - - [16, 64, 1, 4096]
    - [87, 1017.17]
  - - [16, 64, 1, 16384]
    - [88, 3119.15]
  - - [32, 64, 1, 1024]
    - [43, 652.79]
  - - [32, 64, 1, 4096]
    - [49, 2012.43]
  - - [32, 64, 1, 16384]
    - [89, 5585.12]
  - - [64, 64, 1, 1024]
    - [43, 1296.52]
  - - [64, 64, 1, 4096]
    - [90, 3659.82]
  - - [64, 64, 1, 16384]
    - [91, 9251.43]
  - - [96, 64, 1, 1024]
    - [43, 1935.9]
  - - [96, 64, 1, 4096]
    - [56, 5099.08]
  - - [96, 64, 1, 16384]
    - [57, 12486.5]
  - - [128, 64, 1, 1024]
    - [92, 2555.98]
  - - [128, 64, 1, 4096]
    - [93, 6316.45]
  - - [128, 64, 1, 16384]
    - [94, 14780.9]
  - - [192, 64, 1, 1024]
    - [92, 3811.62]
  - - [192, 64, 1, 4096]
    - [95, 8596.24]
  - - [192, 64, 1, 16384]
    - [96, 20390.5]
  - - [256, 64, 1, 1024]
    - [97, 4784.65]
  - - [256, 64, 1, 4096]
    - [98, 9900.97]
  - - [256, 64, 1, 16384]
    - [99, 22883.3]
  - - [384, 64, 1, 1024]
    - [100, 6235.8]
  - - [384, 64, 1, 4096]
    - [101, 12617.0]
  - - [384, 64, 1, 16384]
    - [102, 31401.5]
  - - [512, 64, 1, 1024]
    - [103, 7598.12]
  - - [512, 64, 1, 4096]
    - [104, 16326.3]
  - - [512, 64, 1, 16384]
    - [105, 31686.8]
  - - [640, 64, 1, 1024]
    - [103, 9463.26]
  - - [640, 64, 1, 4096]
    - [104, 21279.7]
  - - [640, 64, 1, 16384]
    - [106, 39044.9]
  - - [768, 64, 1, 1024]
    - [107, 10047.2]
  - - [768, 64, 1, 4096]
    - [108, 22846.1]
  - - [768, 64, 1, 16384]
    - [109, 38885.5]
  - - [1024, 64, 1, 1024]
    - [110, 12449.6]
  - - [1024, 64, 1, 4096]
    - [111, 27627.0]
  - - [1024, 64, 1, 16384]
    - [112, 40134.5]
  - - [1536, 64, 1, 1024]
    - [113, 15643.5]
  - - [1536, 64, 1, 4096]
    - [114, 31223.8]
  - - [1536, 64, 1, 16384]
    - [115, 45606.7]
  - - [2048, 64, 1, 1024]
    - [116, 20289.1]
  - - [2048, 64, 1, 4096]
    - [117, 35132.8]
  - - [2048, 64, 1, 16384]
    - [118, 51078.4]
  - - [3072, 64, 1, 1024]
    - [119, 22747.9]
  - - [3072, 64, 1, 4096]
    - [120, 38597.8]
  - - [3072, 64, 1, 16384]
    - [120, 51949.6]
  - - [4096, 64, 1, 1024]
    - [121, 29436.9]
  - - [4096, 64, 1, 4096]
    - [122, 40841.4]
  - - [4096, 64, 1, 16384]
    - [123, 51861.1]
  - - [6144, 64, 1, 1024]
    - [124, 29254.7]
  - - [6144, 64, 1, 4096]
    - [125, 44500.2]
  - - [6144, 64, 1, 16384]
    - [126, 53290.8]
  - - [8192, 64, 1, 1024]
    - [127, 41076.3]
  - - [8192, 64, 1, 4096]
    - [128, 46520.3]
  - - [8192, 64, 1, 16384]
    - [128, 51372.4]
  - - [12288, 64, 1, 1024]
    - [129, 39063.1]
  - - [12288, 64, 1, 4096]
    - [130, 50379.5]
  - - [12288, 64, 1, 16384]
    - [130, 55172.7]
  - - [16384, 64, 1, 256]
    - [131, 28946.8]
  - - [16384, 64, 1, 1024]
    - [132, 36157.4]
  - - [16384, 64, 1, 4096]
    - [127, 48157.7]
  - - [20480, 64, 1, 256]
    - [131, 34698.4]
  - - [20480, 64, 1, 1024]
    - [132, 43715.3]
  - - [20480, 64, 1, 4096]
    - [128, 57976.7]
  - - [24576, 64, 1, 256]
    - [133, 30105.4]
  - - [24576, 64, 1, 1024]
    - [130, 40366.3]
  - - [24576, 64, 1, 4096]
    - [130, 51288.0]
  - - [32768, 64, 1, 256]
    - [134, 31228.7]
  - - [32768, 64, 1, 1024]
    - [132, 37457.0]
  - - [32768, 64, 1, 4096]
    - [128, 49207.4]
  - - [16, 96, 1, 1024]
    - [135, 429.788]
  - - [16, 96, 1, 4096]
    - [136, 1506.28]
  - - [16, 96, 1, 16384]
    - [137, 4487.72]
  - - [32, 96, 1, 1024]
    - [51, 793.75]
  - - [32, 96, 1, 4096]
    - [52, 2727.46]
  - - [32, 96, 1, 16384]
    - [138, 7534.48]
  - - [64, 96, 1, 1024]
    - [43, 1882.72]
  - - [64, 96, 1, 4096]
    - [56, 5117.38]
  - - [64, 96, 1, 16384]
    - [57, 12391.6]
  - - [96, 96, 1, 1024]
    - [43, 2800.88]
  - - [96, 96, 1, 4096]
    - [58, 6888.18]
  - - [96, 96, 1, 16384]
    - [139, 15885.7]
  - - [128, 96, 1, 1024]
    - [140, 3663.03]
  - - [128, 96, 1, 4096]
    - [141, 8181.67]
  - - [128, 96, 1, 16384]
    - [142, 18700.2]
  - - [192, 96, 1, 1024]
    - [140, 5357.61]
  - - [192, 96, 1, 4096]
    - [143, 11662.9]
  - - [192, 96, 1, 16384]
    - [144, 24201.2]
  - - [256, 96, 1, 1024]
    - [100, 6185.44]
  - - [256, 96, 1, 4096]
    - [145, 13057.3]
  - - [256, 96, 1, 16384]
    - [146, 28272.3]
  - - [384, 96, 1, 1024]
    - [100, 9190.31]
  - - [384, 96, 1, 4096]
    - [147, 17842.4]
  - - [384, 96, 1, 16384]
    - [146, 40448.8]
  - - [512, 96, 1, 1024]
    - [110, 9510.62]
  - - [512, 96, 1, 4096]
    - [148, 22681.0]
  - - [512, 96, 1, 16384]
    - [149, 38472.1]
  - - [640, 96, 1, 1024]
    - [150, 11684.6]
  - - [640, 96, 1, 4096]
    - [148, 27842.0]
  - - [640, 96, 1, 16384]
    - [149, 47557.4]
  - - [768, 96, 1, 1024]
    - [110, 14005.8]
  - - [768, 96, 1, 4096]
    - [151, 30889.4]
  - - [768, 96, 1, 16384]
    - [151, 49730.9]
  - - [1024, 96, 1, 1024]
    - [152, 16188.2]
  - - [1024, 96, 1, 4096]
    - [153, 35067.0]
  - - [1024, 96, 1, 16384]
    - [154, 52578.6]
  - - [1536, 96, 1, 1024]
    - [116, 22525.0]
  - - [1536, 96, 1, 4096]
    - [155, 40474.8]
  - - [1536, 96, 1, 16384]
    - [155, 57280.4]
  - - [2048, 96, 1, 1024]
    - [156, 26380.8]
  - - [2048, 96, 1, 4096]
    - [157, 42555.8]
  - - [2048, 96, 1, 16384]
    - [157, 59814.0]
  - - [3072, 96, 1, 1024]
    - [158, 30650.5]
  - - [3072, 96, 1, 4096]
    - [159, 45348.3]
  - - [3072, 96, 1, 16384]
    - [155, 60378.2]
  - - [4096, 96, 1, 1024]
    - [160, 36815.0]
  - - [4096, 96, 1, 4096]
    - [161, 45562.7]
  - - [4096, 96, 1, 16384]
    - [161, 57668.5]
  - - [6144, 96, 1, 1024]
    - [129, 30955.9]
  - - [6144, 96, 1, 4096]
    - [162, 49062.8]
  - - [6144, 96, 1, 16384]
    - [162, 59275.7]
  - - [8192, 96, 1, 1024]
    - [163, 48812.4]
  - - [8192, 96, 1, 4096]
    - [164, 51765.6]
  - - [8192, 96, 1, 16384]
    - [165, 57887.7]
  - - [12288, 96, 1, 256]
    - [166, 29854.8]
  - - [12288, 96, 1, 1024]
    - [167, 41363.9]
  - - [12288, 96, 1, 4096]
    - [168, 52510.9]
  - - [16384, 96, 1, 256]
    - [169, 35301.3]
  - - [16384, 96, 1, 1024]
    - [170, 43025.2]
  - - [16384, 96, 1, 4096]
    - [164, 52857.0]
  - - [20480, 96, 1, 256]
    - [169, 43066.7]
  - - [20480, 96, 1, 1024]
    - [164, 51487.5]
  - - [20480, 96, 1, 4096]
    - [164, 64974.8]
  - - [24576, 96, 1, 256]
    - [171, 37577.3]
  - - [24576, 96, 1, 1024]
    - [172, 47221.1]
  - - [24576, 96, 1, 4096]
    - [172, 58659.0]
  - - [32768, 96, 1, 256]
    - [173, 31572.3]
  - - [32768, 96, 1, 1024]
    - [164, 44063.4]
  - - [32768, 96, 1, 4096]
    - [174, 54961.3]
  - - [16, 128, 1, 1024]
    - [43, 650.356]
  - - [16, 128, 1, 4096]
    - [136, 2010.89]
  - - [16, 128, 1, 16384]
    - [175, 5480.15]
  - - [32, 128, 1, 1024]
    - [43, 1289.81]
  - - [32, 128, 1, 4096]
    - [91, 3599.08]
  - - [32, 128, 1, 16384]
    - [176, 9263.7]
  - - [64, 128, 1, 1024]
    - [43, 2535.53]
  - - [64, 128, 1, 4096]
    - [177, 6210.52]
  - - [64, 128, 1, 16384]
    - [178, 14747.0]
  - - [96, 128, 1, 1024]
    - [43, 3777.21]
  - - [96, 128, 1, 4096]
    - [179, 8139.75]
  - - [96, 128, 1, 16384]
    - [180, 18747.0]
  - - [128, 128, 1, 1024]
    - [97, 4811.04]
  - - [128, 128, 1, 4096]
    - [181, 10390.8]
  - - [128, 128, 1, 16384]
    - [182, 22756.6]
  - - [192, 128, 1, 1024]
    - [100, 6232.71]
  - - [192, 128, 1, 4096]
    - [183, 13961.2]
  - - [192, 128, 1, 16384]
    - [184, 30254.1]
  - - [256, 128, 1, 1024]
    - [185, 7406.42]
  - - [256, 128, 1, 4096]
    - [186, 17887.9]
  - - [256, 128, 1, 16384]
    - [186, 34709.4]
  - - [384, 128, 1, 1024]
    - [187, 9463.95]
  - - [384, 128, 1, 4096]
    - [188, 23547.8]
  - - [384, 128, 1, 16384]
    - [189, 42349.4]
  - - [512, 128, 1, 1024]
    - [110, 12417.4]
  - - [512, 128, 1, 4096]
    - [190, 27173.0]
  - - [512, 128, 1, 16384]
    - [191, 38671.2]
  - - [640, 128, 1, 1024]
    - [150, 15351.0]
  - - [640, 128, 1, 4096]
    - [190, 33524.1]
  - - [640, 128, 1, 16384]
    - [190, 48217.1]
  - - [768, 128, 1, 1024]
    - [192, 16105.1]
  - - [768, 128, 1, 4096]
    - [193, 35463.2]
  - - [768, 128, 1, 16384]
    - [194, 48976.1]
  - - [1024, 128, 1, 1024]
    - [195, 20544.4]
  - - [1024, 128, 1, 4096]
    - [196, 40242.9]
  - - [1024, 128, 1, 16384]
    - [197, 54058.1]
  - - [1536, 128, 1, 1024]
    - [156, 25837.9]
  - - [1536, 128, 1, 4096]
    - [198, 43967.0]
  - - [1536, 128, 1, 16384]
    - [199, 59927.8]
  - - [2048, 128, 1, 1024]
    - [200, 29737.6]
  - - [2048, 128, 1, 4096]
    - [201, 45170.7]
  - - [2048, 128, 1, 16384]
    - [202, 62261.4]
  - - [3072, 128, 1, 1024]
    - [203, 35595.1]
  - - [3072, 128, 1, 4096]
    - [204, 51430.8]
  - - [3072, 128, 1, 16384]
    - [205, 64958.2]
  - - [4096, 128, 1, 1024]
    - [127, 41690.3]
  - - [4096, 128, 1, 4096]
    - [206, 55351.2]
  - - [4096, 128, 1, 16384]
    - [206, 69746.4]
  - - [6144, 128, 1, 1024]
    - [207, 50190.5]
  - - [6144, 128, 1, 4096]
    - [208, 58471.2]
  - - [6144, 128, 1, 16384]
    - [208, 69025.1]
  - - [8192, 128, 1, 256]
    - [209, 32120.1]
  - - [8192, 128, 1, 1024]
    - [210, 43607.8]
  - - [8192, 128, 1, 4096]
    - [211, 58893.3]
  - - [12288, 128, 1, 256]
    - [212, 32460.0]
  - - [12288, 128, 1, 1024]
    - [213, 51338.8]
  - - [12288, 128, 1, 4096]
    - [214, 64349.5]
  - - [16384, 128, 1, 256]
    - [215, 36783.1]
  - - [16384, 128, 1, 1024]
    - [216, 53687.0]
  - - [16384, 128, 1, 4096]
    - [217, 64712.7]
  - - [20480, 128, 1, 256]
    - [215, 45160.1]
  - - [20480, 128, 1, 1024]
    - [218, 62095.4]
  - - [20480, 128, 1, 4096]
    - [219, 73583.3]
  - - [24576, 128, 1, 256]
    - [220, 36513.9]
  - - [24576, 128, 1, 1024]
    - [221, 57775.3]
  - - [24576, 128, 1, 4096]
    - [222, 71076.0]
  - - [32768, 128, 1, 256]
    - [215, 37509.4]
  - - [32768, 128, 1, 1024]
    - [216, 55000.4]
  - - [32768, 128, 1, 4096]
    - [217, 65437.0]
  - - [16, 192, 1, 1024]
    - [43, 958.026]
  - - [16, 192, 1, 4096]
    - [223, 2695.37]
  - - [16, 192, 1, 16384]
    - [224, 7476.59]
  - - [32, 192, 1, 1024]
    - [43, 1944.78]
  - - [32, 192, 1, 4096]
    - [56, 5182.01]
  - - [32, 192, 1, 16384]
    - [57, 12492.7]
  - - [64, 192, 1, 1024]
    - [140, 3612.44]
  - - [64, 192, 1, 4096]
    - [225, 8469.22]
  - - [64, 192, 1, 16384]
    - [226, 19311.5]
  - - [96, 192, 1, 1024]
    - [140, 5320.68]
  - - [96, 192, 1, 4096]
    - [227, 11616.1]
  - - [96, 192, 1, 16384]
    - [228, 24648.6]
  - - [128, 192, 1, 1024]
    - [100, 6250.1]
  - - [128, 192, 1, 4096]
    - [229, 14125.4]
  - - [128, 192, 1, 16384]
    - [229, 28085.7]
  - - [192, 192, 1, 1024]
    - [100, 9230.85]
  - - [192, 192, 1, 4096]
    - [147, 18414.7]
  - - [192, 192, 1, 16384]
    - [230, 36815.1]
  - - [256, 192, 1, 1024]
    - [231, 9407.26]
  - - [256, 192, 1, 4096]
    - [232, 21957.1]
  - - [256, 192, 1, 16384]
    - [233, 38483.2]
  - - [384, 192, 1, 1024]
    - [187, 13897.4]
  - - [384, 192, 1, 4096]
    - [234, 30725.5]
  - - [384, 192, 1, 16384]
    - [234, 50654.8]
  - - [512, 192, 1, 1024]
    - [152, 16367.6]
  - - [512, 192, 1, 4096]
    - [235, 33583.5]
  - - [512, 192, 1, 16384]
    - [236, 49972.2]
  - - [640, 192, 1, 1024]
    - [152, 20235.1]
  - - [640, 192, 1, 4096]
    - [237, 41425.4]
  - - [640, 192, 1, 16384]
    - [237, 57474.8]
  - - [768, 192, 1, 1024]
    - [195, 22825.3]
  - - [768, 192, 1, 4096]
    - [155, 44230.1]
  - - [768, 192, 1, 16384]
    - [155, 58280.3]
  - - [1024, 192, 1, 1024]
    - [156, 26106.5]
  - - [1024, 192, 1, 4096]
    - [157, 48412.4]
  - - [1024, 192, 1, 16384]
    - [238, 63969.0]
  - - [1536, 192, 1, 1024]
    - [200, 33145.8]
  - - [1536, 192, 1, 4096]
    - [239, 49215.0]
  - - [1536, 192, 1, 16384]
    - [240, 72000.4]
  - - [2048, 192, 1, 1024]
    - [241, 37314.3]
  - - [2048, 192, 1, 4096]
    - [242, 52482.4]
  - - [2048, 192, 1, 16384]
    - [243, 76517.4]
  - - [3072, 192, 1, 1024]
    - [244, 47276.6]
  - - [3072, 192, 1, 4096]
    - [245, 60546.5]
  - - [3072, 192, 1, 16384]
    - [245, 76358.0]
  - - [4096, 192, 1, 1024]
    - [163, 49026.9]
  - - [4096, 192, 1, 4096]
    - [246, 65475.8]
  - - [4096, 192, 1, 16384]
    - [247, 83571.1]
  - - [6144, 192, 1, 256]
    - [248, 32735.0]
  - - [6144, 192, 1, 1024]
    - [249, 57466.1]
  - - [6144, 192, 1, 4096]
    - [250, 67223.2]
  - - [8192, 192, 1, 256]
    - [251, 36447.8]
  - - [8192, 192, 1, 1024]
    - [252, 49546.9]
  - - [8192, 192, 1, 4096]
    - [253, 66922.2]
  - - [12288, 192, 1, 256]
    - [254, 38435.3]
  - - [12288, 192, 1, 1024]
    - [255, 59935.3]
  - - [12288, 192, 1, 4096]
    - [255, 72847.9]
  - - [16384, 192, 1, 256]
    - [256, 43066.7]
  - - [16384, 192, 1, 1024]
    - [257, 62061.8]
  - - [16384, 192, 1, 4096]
    - [258, 77073.4]
  - - [20480, 192, 1, 256]
    - [256, 50600.3]
  - - [20480, 192, 1, 1024]
    - [259, 72663.2]
  - - [20480, 192, 1, 4096]
    - [259, 88531.7]
  - - [24576, 192, 1, 256]
    - [260, 37806.0]
  - - [24576, 192, 1, 1024]
    - [261, 59242.9]
  - - [24576, 192, 1, 4096]
    - [261, 73422.1]
  - - [32768, 192, 1, 256]
    - [262, 42805.1]
  - - [32768, 192, 1, 1024]
    - [257, 63295.1]
  - - [32768, 192, 1, 4096]
    - [258, 77706.1]
  - - [16, 256, 1, 1024]
    - [92, 1289.81]
  - - [16, 256, 1, 4096]
    - [263, 3508.55]
  - - [16, 256, 1, 16384]
    - [264, 8567.63]
  - - [32, 256, 1, 1024]
    - [92, 2559.73]
  - - [32, 256, 1, 4096]
    - [265, 6268.66]
  - - [32, 256, 1, 16384]
    - [94, 14465.4]
  - - [16, 384, 1, 1024]
    - [92, 1929.47]
  - - [16, 384, 1, 4096]
    - [266, 4492.85]
  - - [16, 384, 1, 16384]
    - [267, 11628.3]
  - - [32, 384, 1, 1024]
    - [92, 3732.73]
  - - [32, 384, 1, 4096]
    - [268, 7790.23]
  - - [32, 384, 1, 16384]
    - [269, 18540.8]
  - - [64, 256, 1, 1024]
    - [270, 4269.61]
  - - [64, 256, 1, 4096]
    - [271, 9820.81]
  - - [64, 256, 1, 16384]
    - [272, 21796.4]
  - - [96, 256, 1, 1024]
    - [270, 6249.47]
  - - [96, 256, 1, 4096]
    - [273, 13488.0]
  - - [96, 256, 1, 16384]
    - [274, 27812.6]
  - - [64, 384, 1, 1024]
    - [275, 6112.54]
  - - [64, 384, 1, 4096]
    - [276, 13785.7]
  - - [64, 384, 1, 16384]
    - [277, 27673.2]
  - - [96, 384, 1, 1024]
    - [100, 9248.97]
  - - [96, 384, 1, 4096]
    - [278, 18234.7]
  - - [96, 384, 1, 16384]
    - [279, 40325.3]
  - - [128, 256, 1, 1024]
    - [185, 7347.87]
  - - [128, 256, 1, 4096]
    - [280, 16597.5]
  - - [128, 256, 1, 16384]
    - [281, 33047.6]
  - - [192, 256, 1, 1024]
    - [231, 9471.07]
  - - [192, 256, 1, 4096]
    - [232, 21282.4]
  - - [192, 256, 1, 16384]
    - [282, 35775.7]
  - - [128, 384, 1, 1024]
    - [187, 9389.62]
  - - [128, 384, 1, 4096]
    - [283, 21450.5]
  - - [128, 384, 1, 16384]
    - [283, 39696.3]
  - - [192, 384, 1, 1024]
    - [231, 14058.2]
  - - [192, 384, 1, 4096]
    - [284, 28338.6]
  - - [192, 384, 1, 16384]
    - [284, 42180.4]
  - - [256, 256, 1, 1024]
    - [285, 12307.8]
  - - [256, 256, 1, 4096]
    - [286, 27378.5]
  - - [256, 256, 1, 16384]
    - [286, 39898.3]
  - - [384, 256, 1, 1024]
    - [287, 15503.5]
  - - [384, 256, 1, 4096]
    - [288, 34236.2]
  - - [384, 256, 1, 16384]
    - [288, 46024.6]
  - - [256, 384, 1, 1024]
    - [287, 15498.7]
  - - [256, 384, 1, 4096]
    - [289, 34201.1]
  - - [256, 384, 1, 16384]
    - [289, 45914.2]
  - - [384, 384, 1, 1024]
    - [287, 22790.8]
  - - [384, 384, 1, 4096]
    - [290, 44029.5]
  - - [384, 384, 1, 16384]
    - [290, 58875.3]
  - - [512, 256, 1, 1024]
    - [195, 20419.2]
  - - [512, 256, 1, 4096]
    - [291, 39788.6]
  - - [512, 256, 1, 16384]
    - [118, 52464.3]
  - - [640, 256, 1, 1024]
    - [195, 24930.9]
  - - [640, 256, 1, 4096]
    - [292, 46067.5]
  - - [640, 256, 1, 16384]
    - [293, 56193.3]
  - - [768, 256, 1, 1024]
    - [156, 26018.6]
  - - [768, 256, 1, 4096]
    - [198, 49201.1]
  - - [768, 256, 1, 16384]
    - [198, 61325.2]
  - - [512, 384, 1, 1024]
    - [156, 26127.0]
  - - [512, 384, 1, 4096]
    - [157, 49008.9]
  - - [512, 384, 1, 16384]
    - [294, 63293.8]
  - - [640, 384, 1, 1024]
    - [156, 32009.0]
  - - [640, 384, 1, 4096]
    - [295, 55109.5]
  - - [640, 384, 1, 16384]
    - [295, 64032.3]
  - - [768, 384, 1, 1024]
    - [119, 33716.8]
  - - [768, 384, 1, 4096]
    - [296, 56086.1]
  - - [768, 384, 1, 16384]
    - [297, 67500.0]
  - - [1024, 256, 1, 1024]
    - [200, 30037.9]
  - - [1024, 256, 1, 4096]
    - [298, 56370.8]
  - - [1024, 256, 1, 16384]
    - [299, 62607.1]
  - - [1536, 256, 1, 1024]
    - [241, 37059.7]
  - - [1536, 256, 1, 4096]
    - [300, 52640.5]
  - - [1536, 256, 1, 16384]
    - [301, 72419.0]
  - - [1024, 384, 1, 1024]
    - [302, 38281.6]
  - - [1024, 384, 1, 4096]
    - [302, 54064.6]
  - - [1024, 384, 1, 16384]
    - [303, 70304.0]
  - - [1536, 384, 1, 1024]
    - [304, 47210.1]
  - - [1536, 384, 1, 4096]
    - [305, 58654.7]
  - - [1536, 384, 1, 16384]
    - [305, 75572.8]
  - - [2048, 256, 1, 1024]
    - [244, 41291.7]
  - - [2048, 256, 1, 4096]
    - [306, 69346.8]
  - - [2048, 256, 1, 16384]
    - [307, 77676.1]
  - - [3072, 256, 1, 1024]
    - [308, 49903.7]
  - - [3072, 256, 1, 4096]
    - [309, 67933.7]
  - - [3072, 256, 1, 16384]
    - [310, 84005.8]
  - - [2048, 384, 1, 1024]
    - [308, 50557.3]
  - - [2048, 384, 1, 4096]
    - [311, 75576.2]
  - - [2048, 384, 1, 16384]
    - [312, 84605.1]
  - - [3072, 384, 1, 256]
    - [313, 36317.8]
  - - [3072, 384, 1, 1024]
    - [314, 59147.0]
  - - [3072, 384, 1, 4096]
    - [315, 67951.0]
  - - [4096, 256, 1, 256]
    - [316, 35091.4]
  - - [4096, 256, 1, 1024]
    - [317, 49678.6]
  - - [4096, 256, 1, 4096]
    - [318, 62245.1]
  - - [6144, 256, 1, 256]
    - [319, 38332.8]
  - - [6144, 256, 1, 1024]
    - [320, 51735.5]
  - - [6144, 256, 1, 4096]
    - [321, 73680.8]
  - - [4096, 384, 1, 256]
    - [319, 39400.3]
  - - [4096, 384, 1, 1024]
    - [212, 54228.7]
  - - [4096, 384, 1, 4096]
    - [322, 71692.0]
  - - [6144, 384, 1, 256]
    - [323, 45314.2]
  - - [6144, 384, 1, 1024]
    - [324, 59632.8]
  - - [6144, 384, 1, 4096]
    - [325, 74508.7]
  - - [8192, 256, 1, 256]
    - [326, 36687.3]
  - - [8192, 256, 1, 1024]
    - [326, 62647.2]
  - - [8192, 256, 1, 4096]
    - [327, 67924.4]
  - - [12288, 256, 1, 256]
    - [328, 43243.0]
  - - [12288, 256, 1, 1024]
    - [329, 66149.6]
  - - [12288, 256, 1, 4096]
    - [329, 80536.5]
  - - [16384, 256, 1, 256]
    - [330, 48818.4]
  - - [16384, 256, 1, 1024]
    - [331, 65810.8]
  - - [16384, 256, 1, 4096]
    - [332, 78257.7]
  - - [20480, 256, 1, 256]
    - [333, 54621.1]
  - - [20480, 256, 1, 1024]
    - [334, 62393.4]
  - - [20480, 256, 1, 4096]
    - [335, 73680.4]
  - - [24576, 256, 1, 256]
    - [336, 42353.9]
  - - [24576, 256, 1, 1024]
    - [337, 67719.0]
  - - [24576, 256, 1, 4096]
    - [338, 81443.7]
  - - [32768, 256, 1, 256]
    - [339, 43800.5]
  - - [32768, 256, 1, 1024]
    - [331, 63556.1]
  - - [32768, 256, 1, 4096]
    - [331, 78853.2]
  - - [8192, 384, 1, 256]
    - [340, 41219.8]
  - - [8192, 384, 1, 1024]
    - [341, 61642.7]
  - - [8192, 384, 1, 4096]
    - [342, 73628.5]
  - - [12288, 384, 1, 256]
    - [343, 45355.2]
  - - [12288, 384, 1, 1024]
    - [344, 58066.9]
  - - [12288, 384, 1, 4096]
    - [344, 73362.3]
  - - [16384, 384, 1, 256]
    - [345, 43627.9]
  - - [16384, 384, 1, 1024]
    - [341, 63872.5]
  - - [16384, 384, 1, 4096]
    - [342, 73665.6]
  - - [20480, 384, 1, 256]
    - [339, 43255.9]
  - - [20480, 384, 1, 1024]
    - [346, 56676.9]
  - - [20480, 384, 1, 4096]
    - [347, 62453.1]
  - - [24576, 384, 1, 256]
    - [348, 45451.0]
  - - [24576, 384, 1, 1024]
    - [342, 62042.7]
  - - [24576, 384, 1, 4096]
    - [349, 74305.4]
  - - [32768, 384, 1, 256]
    - [345, 42748.2]
  - - [32768, 384, 1, 1024]
    - [341, 63686.4]
  - - [32768, 384, 1, 4096]
    - [349, 74351.6]
  - - [16, 512, 1, 1024]
    - [17, 2505.48]
  - - [16, 512, 1, 4096]
    - [350, 5659.9]
  - - [16, 512, 1, 16384]
    - [351, 13380.2]
  - - [32, 512, 1, 1024]
    - [17, 4951.08]
  - - [32, 512, 1, 4096]
    - [352, 9826.0]
  - - [32, 512, 1, 16384]
    - [352, 19451.6]
  - - [16, 640, 1, 1024]
    - [17, 3116.92]
  - - [16, 640, 1, 4096]
    - [350, 7038.23]
  - - [16, 640, 1, 16384]
    - [350, 14689.7]
  - - [32, 640, 1, 1024]
    - [17, 6076.68]
  - - [32, 640, 1, 4096]
    - [352, 11810.4]
  - - [32, 640, 1, 16384]
    - [352, 23819.7]
  - - [16, 768, 1, 1024]
    - [17, 3712.86]
  - - [16, 768, 1, 4096]
    - [353, 7511.48]
  - - [16, 768, 1, 16384]
    - [353, 14667.1]
  - - [32, 768, 1, 1024]
    - [25, 6215.44]
  - - [32, 768, 1, 4096]
    - [354, 12881.1]
  - - [32, 768, 1, 16384]
    - [355, 24601.1]
  - - [64, 512, 1, 1024]
    - [356, 7180.87]
  - - [64, 512, 1, 4096]
    - [357, 16487.1]
  - - [64, 512, 1, 16384]
    - [358, 31276.1]
  - - [96, 512, 1, 1024]
    - [110, 9456.84]
  - - [96, 512, 1, 4096]
    - [359, 21733.7]
  - - [96, 512, 1, 16384]
    - [360, 38402.2]
  - - [64, 640, 1, 1024]
    - [356, 8907.28]
  - - [64, 640, 1, 4096]
    - [358, 19998.2]
  - - [64, 640, 1, 16384]
    - [358, 38581.5]
  - - [96, 640, 1, 1024]
    - [150, 11680.3]
  - - [96, 640, 1, 4096]
    - [359, 26899.4]
  - - [96, 640, 1, 16384]
    - [360, 47906.6]
  - - [64, 768, 1, 1024]
    - [110, 9496.18]
  - - [64, 768, 1, 4096]
    - [361, 23581.0]
  - - [64, 768, 1, 16384]
    - [361, 40140.5]
  - - [96, 768, 1, 1024]
    - [150, 14037.2]
  - - [96, 768, 1, 4096]
    - [362, 31010.2]
  - - [96, 768, 1, 16384]
    - [151, 51036.6]
  - - [128, 512, 1, 1024]
    - [363, 12357.8]
  - - [128, 512, 1, 4096]
    - [364, 26622.1]
  - - [128, 512, 1, 16384]
    - [190, 38432.6]
  - - [192, 512, 1, 1024]
    - [192, 16219.5]
  - - [192, 512, 1, 4096]
    - [365, 33679.2]
  - - [192, 512, 1, 16384]
    - [366, 46045.7]
  - - [128, 640, 1, 1024]
    - [363, 15139.8]
  - - [128, 640, 1, 4096]
    - [364, 31528.7]
  - - [128, 640, 1, 16384]
    - [364, 47374.4]
  - - [192, 640, 1, 1024]
    - [367, 19178.1]
  - - [192, 640, 1, 4096]
    - [368, 41066.1]
  - - [192, 640, 1, 16384]
    - [369, 56875.9]
  - - [128, 768, 1, 1024]
    - [192, 16383.6]
  - - [128, 768, 1, 4096]
    - [370, 34400.2]
  - - [128, 768, 1, 16384]
    - [371, 49089.8]
  - - [192, 768, 1, 1024]
    - [372, 22929.6]
  - - [192, 768, 1, 4096]
    - [373, 44465.0]
  - - [192, 768, 1, 16384]
    - [373, 60452.3]
  - - [256, 512, 1, 1024]
    - [195, 20369.5]
  - - [256, 512, 1, 4096]
    - [117, 40455.8]
  - - [256, 512, 1, 16384]
    - [118, 53846.1]
  - - [384, 512, 1, 1024]
    - [156, 25844.4]
  - - [384, 512, 1, 4096]
    - [198, 48800.5]
  - - [384, 512, 1, 16384]
    - [198, 61619.1]
  - - [256, 640, 1, 1024]
    - [195, 24834.7]
  - - [256, 640, 1, 4096]
    - [374, 45050.7]
  - - [256, 640, 1, 16384]
    - [375, 57414.9]
  - - [384, 640, 1, 1024]
    - [376, 28583.7]
  - - [384, 640, 1, 4096]
    - [377, 54187.8]
  - - [384, 640, 1, 16384]
    - [377, 62756.0]
  - - [256, 768, 1, 1024]
    - [156, 26045.5]
  - - [256, 768, 1, 4096]
    - [157, 49842.0]
  - - [256, 768, 1, 16384]
    - [157, 64168.4]
  - - [384, 768, 1, 1024]
    - [119, 33447.6]
  - - [384, 768, 1, 4096]
    - [378, 56222.2]
  - - [384, 768, 1, 16384]
    - [379, 67191.4]
  - - [512, 512, 1, 1024]
    - [380, 29333.8]
  - - [512, 512, 1, 4096]
    - [381, 50157.7]
  - - [512, 512, 1, 16384]
    - [382, 59909.3]
  - - [640, 512, 1, 1024]
    - [380, 36254.3]
  - - [640, 512, 1, 4096]
    - [383, 56406.3]
  - - [640, 512, 1, 16384]
    - [384, 59731.3]
  - - [768, 512, 1, 1024]
    - [241, 36700.8]
  - - [768, 512, 1, 4096]
    - [385, 56505.6]
  - - [768, 512, 1, 16384]
    - [386, 65268.2]
  - - [512, 640, 1, 1024]
    - [380, 35973.7]
  - - [512, 640, 1, 4096]
    - [387, 57104.0]
  - - [512, 640, 1, 16384]
    - [388, 62432.7]
  - - [640, 640, 1, 1024]
    - [302, 40175.1]
  - - [640, 640, 1, 4096]
    - [389, 58184.8]
  - - [640, 640, 1, 16384]
    - [390, 64040.5]
  - - [768, 640, 1, 1024]
    - [391, 42063.8]
  - - [768, 640, 1, 4096]
    - [392, 58866.1]
  - - [768, 640, 1, 16384]
    - [393, 71105.7]
  - - [512, 768, 1, 1024]
    - [302, 38398.6]
  - - [512, 768, 1, 4096]
    - [394, 61515.3]
  - - [512, 768, 1, 16384]
    - [388, 73294.3]
  - - [640, 768, 1, 1024]
    - [241, 45543.0]
  - - [640, 768, 1, 4096]
    - [395, 63069.3]
  - - [640, 768, 1, 16384]
    - [395, 70174.2]
  - - [768, 768, 1, 1024]
    - [244, 47485.3]
  - - [768, 768, 1, 4096]
    - [305, 58858.1]
  - - [768, 768, 1, 16384]
    - [305, 77169.7]
  - - [1024, 512, 1, 1024]
    - [396, 39384.9]
  - - [1024, 512, 1, 4096]
    - [397, 61702.0]
  - - [1024, 512, 1, 16384]
    - [398, 69107.5]
  - - [1536, 512, 1, 1024]
    - [308, 50506.2]
  - - [1536, 512, 1, 4096]
    - [399, 72487.6]
  - - [1536, 512, 1, 16384]
    - [400, 70224.2]
  - - [1024, 640, 1, 1024]
    - [396, 48002.8]
  - - [1024, 640, 1, 4096]
    - [401, 71250.9]
  - - [1024, 640, 1, 16384]
    - [402, 65712.4]
  - - [1536, 640, 1, 256]
    - [403, 31878.9]
  - - [1536, 640, 1, 1024]
    - [404, 57442.1]
  - - [1536, 640, 1, 4096]
    - [405, 79161.0]
  - - [1024, 768, 1, 1024]
    - [308, 50620.8]
  - - [1024, 768, 1, 4096]
    - [406, 72428.8]
  - - [1024, 768, 1, 16384]
    - [407, 71644.0]
  - - [1536, 768, 1, 256]
    - [408, 34759.4]
  - - [1536, 768, 1, 1024]
    - [314, 58447.0]
  - - [1536, 768, 1, 4096]
    - [409, 78126.4]
  - - [2048, 512, 1, 256]
    - [410, 35128.2]
  - - [2048, 512, 1, 1024]
    - [410, 54285.5]
  - - [2048, 512, 1, 4096]
    - [411, 62845.8]
  - - [3072, 512, 1, 256]
    - [412, 39192.8]
  - - [3072, 512, 1, 1024]
    - [413, 60396.3]
  - - [3072, 512, 1, 4096]
    - [414, 68403.7]
  - - [2048, 640, 1, 256]
    - [410, 42711.3]
  - - [2048, 640, 1, 1024]
    - [415, 67290.9]
  - - [2048, 640, 1, 4096]
    - [416, 68913.2]
  - - [3072, 640, 1, 256]
    - [417, 43567.4]
  - - [3072, 640, 1, 1024]
    - [418, 57696.0]
  - - [3072, 640, 1, 4096]
    - [419, 71147.3]
  - - [2048, 768, 1, 256]
    - [420, 43205.7]
  - - [2048, 768, 1, 1024]
    - [421, 67842.0]
  - - [2048, 768, 1, 4096]
    - [422, 67697.6]
  - - [3072, 768, 1, 256]
    - [423, 48650.8]
  - - [3072, 768, 1, 1024]
    - [423, 62900.7]
  - - [3072, 768, 1, 4096]
    - [424, 74821.0]
  - - [4096, 512, 1, 256]
    - [425, 39373.3]
  - - [4096, 512, 1, 1024]
    - [426, 66431.1]
  - - [4096, 512, 1, 4096]
    - [427, 67976.1]
  - - [6144, 512, 1, 256]
    - [428, 47733.7]
  - - [6144, 512, 1, 1024]
    - [428, 70090.9]
  - - [6144, 512, 1, 4096]
    - [429, 80665.9]
  - - [4096, 640, 1, 256]
    - [430, 49610.7]
  - - [4096, 640, 1, 1024]
    - [431, 77592.4]
  - - [4096, 640, 1, 4096]
    - [432, 75603.4]
  - - [6144, 640, 1, 256]
    - [433, 48219.4]
  - - [6144, 640, 1, 1024]
    - [434, 64523.9]
  - - [6144, 640, 1, 4096]
    - [435, 72057.2]
  - - [4096, 768, 1, 256]
    - [436, 49842.0]
  - - [4096, 768, 1, 1024]
    - [437, 77366.5]
  - - [4096, 768, 1, 4096]
    - [438, 81964.0]
  - - [6144, 768, 1, 256]
    - [439, 57063.5]
  - - [6144, 768, 1, 1024]
    - [440, 66783.7]
  - - [6144, 768, 1, 4096]
    - [441, 75876.1]
  - - [8192, 512, 1, 256]
    - [442, 46985.5]
  - - [8192, 512, 1, 1024]
    - [443, 66107.3]
  - - [8192, 512, 1, 4096]
    - [444, 73643.2]
  - - [12288, 512, 1, 256]
    - [445, 46159.5]
  - - [12288, 512, 1, 1024]
    - [446, 67122.1]
  - - [12288, 512, 1, 4096]
    - [445, 75404.3]
  - - [16384, 512, 1, 256]
    - [442, 48720.6]
  - - [16384, 512, 1, 1024]
    - [443, 62748.3]
  - - [16384, 512, 1, 4096]
    - [443, 78073.8]
  - - [20480, 512, 1, 256]
    - [442, 58634.2]
  - - [20480, 512, 1, 1024]
    - [445, 73624.7]
  - - [20480, 512, 1, 4096]
    - [447, 81272.5]
  - - [24576, 512, 1, 256]
    - [442, 49449.3]
  - - [24576, 512, 1, 1024]
    - [445, 68597.9]
  - - [24576, 512, 1, 4096]
    - [443, 77744.2]
  - - [32768, 512, 1, 1024]
    - [445, 72330.6]
  - - [8192, 640, 1, 256]
    - [448, 51726.3]
  - - [8192, 640, 1, 1024]
    - [445, 60652.6]
  - - [8192, 640, 1, 4096]
    - [449, 62250.5]
  - - [12288, 640, 1, 256]
    - [450, 47915.9]
  - - [12288, 640, 1, 1024]
    - [451, 65843.8]
  - - [12288, 640, 1, 4096]
    - [452, 73958.2]
  - - [16384, 640, 1, 256]
    - [448, 53008.0]
  - - [16384, 640, 1, 1024]
    - [453, 58635.4]
  - - [16384, 640, 1, 4096]
    - [454, 70379.6]
  - - [20480, 640, 1, 256]
    - [455, 51269.9]
  - - [20480, 640, 1, 1024]
    - [451, 69975.9]
  - - [20480, 640, 1, 4096]
    - [446, 76214.4]
  - - [24576, 640, 1, 1024]
    - [451, 65144.4]
  - - [32768, 640, 1, 1024]
    - [451, 68938.0]
  - - [8192, 768, 1, 256]
    - [445, 46404.8]
  - - [8192, 768, 1, 1024]
    - [445, 72360.3]
  - - [8192, 768, 1, 4096]
    - [447, 74886.0]
  - - [12288, 768, 1, 256]
    - [442, 53487.4]
  - - [12288, 768, 1, 1024]
    - [456, 71158.6]
  - - [12288, 768, 1, 4096]
    - [457, 82940.6]
  - - [16384, 768, 1, 256]
    - [442, 49300.6]
  - - [16384, 768, 1, 1024]
    - [458, 66582.6]
  - - [16384, 768, 1, 4096]
    - [443, 78012.6]
  - - [20480, 768, 1, 1024]
    - [446, 77117.1]
  - - [24576, 768, 1, 1024]
    - [459, 75767.6]
  - - [32768, 768, 1, 1024]
    - [445, 73557.7]
  - - [16, 1024, 1, 1024]
    - [22, 4514.68]
  - - [16, 1024, 1, 4096]
    - [460, 9293.54]
  - - [16, 1024, 1, 16384]
    - [460, 17220.8]
  - - [32, 1024, 1, 1024]
    - [65, 8070.66]
  - - [32, 1024, 1, 4096]
    - [461, 16034.7]
  - - [32, 1024, 1, 16384]
    - [462, 26983.0]
  - - [16, 1536, 1, 1024]
    - [65, 5501.77]
  - - [16, 1536, 1, 4096]
    - [463, 12196.6]
  - - [16, 1536, 1, 16384]
    - [463, 21348.9]
  - - [32, 1536, 1, 1024]
    - [464, 9510.57]
  - - [32, 1536, 1, 4096]
    - [465, 20642.8]
  - - [32, 1536, 1, 16384]
    - [466, 31959.6]
  - - [64, 1024, 1, 1024]
    - [150, 12371.4]
  - - [64, 1024, 1, 4096]
    - [467, 27350.6]
  - - [64, 1024, 1, 16384]
    - [467, 41158.3]
  - - [96, 1024, 1, 1024]
    - [192, 16383.7]
  - - [96, 1024, 1, 4096]
    - [468, 31787.1]
  - - [96, 1024, 1, 16384]
    - [468, 46372.6]
  - - [64, 1536, 1, 1024]
    - [192, 16415.8]
  - - [64, 1536, 1, 4096]
    - [370, 33321.7]
  - - [64, 1536, 1, 16384]
    - [469, 47117.8]
  - - [96, 1536, 1, 1024]
    - [470, 22859.8]
  - - [96, 1536, 1, 4096]
    - [471, 37685.4]
  - - [96, 1536, 1, 16384]
    - [471, 48367.7]
  - - [128, 1024, 1, 1024]
    - [195, 20320.0]
  - - [128, 1024, 1, 4096]
    - [117, 40695.5]
  - - [128, 1024, 1, 16384]
    - [472, 57247.4]
  - - [192, 1024, 1, 1024]
    - [156, 26065.9]
  - - [192, 1024, 1, 4096]
    - [198, 49730.8]
  - - [192, 1024, 1, 16384]
    - [198, 63154.5]
  - - [128, 1536, 1, 1024]
    - [156, 26113.2]
  - - [128, 1536, 1, 4096]
    - [157, 48582.2]
  - - [128, 1536, 1, 16384]
    - [157, 64518.8]
  - - [192, 1536, 1, 1024]
    - [119, 33717.0]
  - - [192, 1536, 1, 4096]
    - [473, 50003.3]
  - - [192, 1536, 1, 16384]
    - [379, 65164.1]
  - - [256, 1024, 1, 1024]
    - [474, 29744.4]
  - - [256, 1024, 1, 4096]
    - [298, 56591.2]
  - - [256, 1024, 1, 16384]
    - [297, 61454.2]
  - - [384, 1024, 1, 1024]
    - [302, 38501.6]
  - - [384, 1024, 1, 4096]
    - [475, 56917.8]
  - - [384, 1024, 1, 16384]
    - [301, 71503.7]
  - - [256, 1536, 1, 1024]
    - [302, 37841.6]
  - - [256, 1536, 1, 4096]
    - [476, 55456.3]
  - - [256, 1536, 1, 16384]
    - [303, 73873.9]
  - - [384, 1536, 1, 1024]
    - [244, 47462.9]
  - - [384, 1536, 1, 4096]
    - [398, 58674.7]
  - - [384, 1536, 1, 16384]
    - [398, 73562.7]
  - - [512, 1024, 1, 1024]
    - [477, 38995.0]
  - - [512, 1024, 1, 4096]
    - [478, 61327.6]
  - - [512, 1024, 1, 16384]
    - [398, 71088.6]
  - - [640, 1024, 1, 1024]
    - [396, 49391.2]
  - - [640, 1024, 1, 4096]
    - [479, 72087.0]
  - - [640, 1024, 1, 16384]
    - [480, 63554.2]
  - - [768, 1024, 1, 1024]
    - [308, 50556.9]
  - - [768, 1024, 1, 4096]
    - [399, 72246.5]
  - - [768, 1024, 1, 16384]
    - [400, 70636.3]
  - - [512, 1536, 1, 1024]
    - [404, 46550.0]
  - - [512, 1536, 1, 4096]
    - [481, 72546.5]
  - - [512, 1536, 1, 16384]
    - [407, 71869.9]
  - - [640, 1536, 1, 256]
    - [482, 33892.9]
  - - [640, 1536, 1, 1024]
    - [482, 60095.7]
  - - [640, 1536, 1, 4096]
    - [483, 80680.9]
  - - [768, 1536, 1, 256]
    - [313, 35346.9]
  - - [768, 1536, 1, 1024]
    - [313, 58594.7]
  - - [768, 1536, 1, 4096]
    - [484, 78227.9]
  - - [1024, 1024, 1, 256]
    - [410, 34890.3]
  - - [1024, 1024, 1, 1024]
    - [410, 53805.6]
  - - [1024, 1024, 1, 4096]
    - [485, 64703.8]
  - - [1536, 1024, 1, 256]
    - [486, 40148.5]
  - - [1536, 1024, 1, 1024]
    - [487, 64353.3]
  - - [1536, 1024, 1, 4096]
    - [487, 67784.7]
  - - [1024, 1536, 1, 256]
    - [420, 44039.3]
  - - [1024, 1536, 1, 1024]
    - [421, 68152.6]
  - - [1024, 1536, 1, 4096]
    - [421, 68037.3]
  - - [1536, 1536, 1, 256]
    - [423, 48494.3]
  - - [1536, 1536, 1, 1024]
    - [488, 66610.1]
  - - [1536, 1536, 1, 4096]
    - [489, 76381.0]
  - - [2048, 1024, 1, 256]
    - [490, 45546.9]
  - - [2048, 1024, 1, 1024]
    - [491, 69553.9]
  - - [2048, 1024, 1, 4096]
    - [490, 72944.9]
  - - [3072, 1024, 1, 256]
    - [492, 49182.9]
  - - [3072, 1024, 1, 1024]
    - [493, 78785.2]
  - - [3072, 1024, 1, 4096]
    - [438, 82422.2]
  - - [2048, 1536, 1, 256]
    - [494, 51136.1]
  - - [2048, 1536, 1, 1024]
    - [495, 78955.5]
  - - [2048, 1536, 1, 4096]
    - [437, 82295.6]
  - - [3072, 1536, 1, 256]
    - [496, 57952.4]
  - - [3072, 1536, 1, 1024]
    - [496, 72658.0]
  - - [3072, 1536, 1, 4096]
    - [497, 80923.8]
  - - [4096, 1024, 1, 256]
    - [498, 48907.4]
  - - [4096, 1024, 1, 1024]
    - [499, 72290.3]
  - - [4096, 1024, 1, 4096]
    - [500, 78157.7]
  - - [6144, 1024, 1, 256]
    - [501, 48836.2]
  - - [6144, 1024, 1, 1024]
    - [502, 75416.7]
  - - [6144, 1024, 1, 4096]
    - [503, 83469.0]
  - - [4096, 1536, 1, 256]
    - [502, 47864.4]
  - - [4096, 1536, 1, 1024]
    - [503, 72520.2]
  - - [4096, 1536, 1, 4096]
    - [504, 87538.7]
  - - [6144, 1536, 1, 256]
    - [505, 54375.5]
  - - [6144, 1536, 1, 1024]
    - [506, 79165.6]
  - - [6144, 1536, 1, 4096]
    - [507, 89844.0]
  - - [8192, 1024, 1, 256]
    - [508, 50120.2]
  - - [8192, 1024, 1, 1024]
    - [451, 72806.2]
  - - [8192, 1024, 1, 4096]
    - [509, 80106.1]
  - - [12288, 1024, 1, 256]
    - [510, 53850.7]
  - - [12288, 1024, 1, 1024]
    - [511, 75376.0]
  - - [12288, 1024, 1, 4096]
    - [507, 83778.0]
  - - [16384, 1024, 1, 1024]
    - [445, 73453.9]
  - - [20480, 1024, 1, 1024]
    - [445, 76186.2]
  - - [24576, 1024, 1, 1024]
    - [512, 75661.7]
  - - [32768, 1024, 1, 1024]
    - [445, 75318.2]
  - - [8192, 1536, 1, 256]
    - [513, 55970.2]
  - - [8192, 1536, 1, 1024]
    - [514, 77227.1]
  - - [8192, 1536, 1, 4096]
    - [509, 88885.4]
  - - [12288, 1536, 1, 1024]
    - [445, 81077.6]
  - - [16384, 1536, 1, 1024]
    - [442, 82612.9]
  - - [20480, 1536, 1, 1024]
    - [442, 84609.5]
  - - [24576, 1536, 1, 1024]
    - [445, 83224.8]
  - - [32768, 1536, 1, 1024]
    - [445, 85333.5]
  - - [16, 2048, 1, 1024]
    - [67, 6874.15]
  - - [16, 2048, 1, 4096]
    - [67, 12858.5]
  - - [16, 2048, 1, 16384]
    - [515, 19819.2]
  - - [32, 2048, 1, 1024]
    - [516, 11833.5]
  - - [32, 2048, 1, 4096]
    - [517, 22266.2]
  - - [32, 2048, 1, 16384]
    - [517, 32589.1]
  - - [16, 3072, 1, 1024]
    - [518, 8797.47]
  - - [16, 3072, 1, 4096]
    - [519, 14461.0]
  - - [16, 3072, 1, 16384]
    - [519, 20344.7]
  - - [32, 3072, 1, 1024]
    - [520, 16421.2]
  - - [32, 3072, 1, 4096]
    - [521, 25249.9]
  - - [32, 3072, 1, 16384]
    - [521, 34410.5]
  - - [64, 2048, 1, 1024]
    - [116, 19709.9]
  - - [64, 2048, 1, 4096]
    - [522, 37284.9]
  - - [64, 2048, 1, 16384]
    - [522, 52954.5]
  - - [96, 2048, 1, 1024]
    - [523, 24119.1]
  - - [96, 2048, 1, 4096]
    - [198, 47429.3]
  - - [96, 2048, 1, 16384]
    - [198, 64229.8]
  - - [64, 3072, 1, 1024]
    - [156, 26092.9]
  - - [64, 3072, 1, 4096]
    - [524, 39540.0]
  - - [64, 3072, 1, 16384]
    - [525, 55399.0]
  - - [96, 3072, 1, 1024]
    - [526, 29979.5]
  - - [96, 3072, 1, 4096]
    - [527, 48686.2]
  - - [96, 3072, 1, 16384]
    - [528, 59607.7]
  - - [128, 2048, 1, 1024]
    - [529, 28760.4]
  - - [128, 2048, 1, 4096]
    - [530, 48903.0]
  - - [128, 2048, 1, 16384]
    - [531, 61246.9]
  - - [192, 2048, 1, 1024]
    - [302, 39162.1]
  - - [192, 2048, 1, 4096]
    - [532, 54906.8]
  - - [192, 2048, 1, 16384]
    - [242, 73374.6]
  - - [128, 3072, 1, 1024]
    - [302, 38006.2]
  - - [128, 3072, 1, 4096]
    - [533, 51279.8]
  - - [128, 3072, 1, 16384]
    - [534, 65467.7]
  - - [192, 3072, 1, 1024]
    - [304, 47128.9]
  - - [192, 3072, 1, 4096]
    - [245, 61940.5]
  - - [192, 3072, 1, 16384]
    - [245, 77835.0]
  - - [256, 2048, 1, 1024]
    - [535, 35632.9]
  - - [256, 2048, 1, 4096]
    - [536, 67029.7]
  - - [256, 2048, 1, 16384]
    - [537, 79323.9]
  - - [384, 2048, 1, 1024]
    - [538, 49978.4]
  - - [384, 2048, 1, 4096]
    - [539, 76294.0]
  - - [384, 2048, 1, 16384]
    - [309, 83063.5]
  - - [256, 3072, 1, 1024]
    - [481, 41068.0]
  - - [256, 3072, 1, 4096]
    - [540, 73562.8]
  - - [256, 3072, 1, 16384]
    - [541, 87121.0]
  - - [384, 3072, 1, 256]
    - [313, 35148.6]
  - - [384, 3072, 1, 1024]
    - [542, 53026.0]
  - - [384, 3072, 1, 4096]
    - [543, 68934.3]
  - - [512, 2048, 1, 256]
    - [544, 35137.4]
  - - [512, 2048, 1, 1024]
    - [544, 54028.1]
  - - [512, 2048, 1, 4096]
    - [545, 64831.1]
  - - [640, 2048, 1, 256]
    - [544, 42624.5]
  - - [640, 2048, 1, 1024]
    - [544, 66029.9]
  - - [640, 2048, 1, 4096]
    - [546, 69807.7]
  - - [768, 2048, 1, 256]
    - [420, 43505.1]
  - - [768, 2048, 1, 1024]
    - [421, 67985.5]
  - - [768, 2048, 1, 4096]
    - [547, 68333.8]
  - - [512, 3072, 1, 256]
    - [420, 43684.7]
  - - [512, 3072, 1, 1024]
    - [421, 58684.7]
  - - [512, 3072, 1, 4096]
    - [548, 69915.5]
  - - [640, 3072, 1, 256]
    - [549, 46018.8]
  - - [640, 3072, 1, 1024]
    - [550, 62966.5]
  - - [640, 3072, 1, 4096]
    - [551, 74855.3]
  - - [768, 3072, 1, 256]
    - [423, 48690.0]
  - - [768, 3072, 1, 1024]
    - [552, 64777.2]
  - - [768, 3072, 1, 4096]
    - [485, 75986.1]
  - - [1024, 2048, 1, 256]
    - [490, 45102.3]
  - - [1024, 2048, 1, 1024]
    - [490, 69871.4]
  - - [1024, 2048, 1, 4096]
    - [553, 74192.8]
  - - [1536, 2048, 1, 256]
    - [554, 51345.1]
  - - [1536, 2048, 1, 1024]
    - [555, 79770.8]
  - - [1536, 2048, 1, 4096]
    - [556, 82804.4]
  - - [1024, 3072, 1, 256]
    - [557, 51983.1]
  - - [1024, 3072, 1, 1024]
    - [555, 80449.8]
  - - [1024, 3072, 1, 4096]
    - [558, 81467.4]
  - - [1536, 3072, 1, 256]
    - [559, 58401.5]
  - - [1536, 3072, 1, 1024]
    - [496, 72754.4]
  - - [1536, 3072, 1, 4096]
    - [560, 80860.0]
  - - [2048, 2048, 1, 256]
    - [561, 52287.6]
  - - [2048, 2048, 1, 1024]
    - [561, 73692.6]
  - - [2048, 2048, 1, 4096]
    - [562, 78465.5]
  - - [3072, 2048, 1, 256]
    - [563, 57340.2]
  - - [3072, 2048, 1, 1024]
    - [564, 79134.4]
  - - [3072, 2048, 1, 4096]
    - [565, 88195.7]
  - - [2048, 3072, 1, 256]
    - [563, 57217.8]
  - - [2048, 3072, 1, 1024]
    - [565, 77978.5]
  - - [2048, 3072, 1, 4096]
    - [566, 88401.9]
  - - [3072, 3072, 1, 256]
    - [564, 57487.9]
  - - [3072, 3072, 1, 1024]
    - [567, 81096.7]
  - - [3072, 3072, 1, 4096]
    - [565, 91019.5]
  - - [4096, 2048, 1, 256]
    - [498, 52528.7]
  - - [4096, 2048, 1, 1024]
    - [451, 73074.3]
  - - [4096, 2048, 1, 4096]
    - [568, 81477.0]
  - - [6144, 2048, 1, 256]
    - [569, 54287.3]
  - - [6144, 2048, 1, 1024]
    - [514, 77349.8]
  - - [6144, 2048, 1, 4096]
    - [509, 92281.2]
  - - [4096, 3072, 1, 256]
    - [569, 58612.0]
  - - [4096, 3072, 1, 1024]
    - [570, 77534.6]
  - - [4096, 3072, 1, 4096]
    - [568, 92792.1]
  - - [6144, 3072, 1, 1024]
    - [571, 87347.6]
  - - [8192, 2048, 1, 1024]
    - [445, 77473.9]
  - - [12288, 2048, 1, 1024]
    - [442, 85536.2]
  - - [16384, 2048, 1, 1024]
    - [445, 86541.1]
  - - [20480, 2048, 1, 1024]
    - [442, 88677.5]
  - - [24576, 2048, 1, 1024]
    - [442, 86149.5]
  - - [32768, 2048, 1, 1024]
    - [445, 86856.7]
  - - [8192, 3072, 1, 1024]
    - [442, 85976.6]
  - - [12288, 3072, 1, 1024]
    - [445, 87542.0]
  - - [16384, 3072, 1, 1024]
    - [445, 90266.0]
  - - [20480, 3072, 1, 1024]
    - [445, 90857.4]
  - - [24576, 3072, 1, 1024]
    - [445, 88291.4]
  - - [32768, 3072, 1, 1024]
    - [445, 90663.9]
  - - [16, 4096, 1, 1024]
    - [572, 11207.7]
  - - [16, 4096, 1, 4096]
    - [573, 16961.2]
  - - [16, 4096, 1, 16384]
    - [574, 19794.3]
  - - [32, 4096, 1, 1024]
    - [575, 19565.8]
  - - [32, 4096, 1, 4096]
    - [576, 28987.7]
  - - [32, 4096, 1, 16384]
    - [576, 33771.6]
  - - [16, 6144, 1, 1024]
    - [577, 11865.7]
  - - [16, 6144, 1, 4096]
    - [578, 19336.1]
  - - [16, 6144, 1, 16384]
    - [578, 22610.2]
  - - [32, 6144, 1, 1024]
    - [577, 23686.6]
  - - [32, 6144, 1, 4096]
    - [579, 33452.1]
  - - [32, 6144, 1, 16384]
    - [579, 37403.8]
  - - [64, 4096, 1, 1024]
    - [580, 29443.4]
  - - [64, 4096, 1, 4096]
    - [581, 43632.6]
  - - [64, 4096, 1, 16384]
    - [582, 57978.6]
  - - [96, 4096, 1, 1024]
    - [583, 33388.0]
  - - [96, 4096, 1, 4096]
    - [584, 51533.1]
  - - [96, 4096, 1, 16384]
    - [584, 63463.9]
  - - [64, 6144, 1, 1024]
    - [585, 33471.6]
  - - [64, 6144, 1, 4096]
    - [586, 48365.8]
  - - [64, 6144, 1, 16384]
    - [586, 59897.7]
  - - [96, 6144, 1, 1024]
    - [587, 33414.1]
  - - [96, 6144, 1, 4096]
    - [588, 50674.0]
  - - [96, 6144, 1, 16384]
    - [589, 59454.1]
  - - [128, 4096, 1, 1024]
    - [590, 38512.7]
  - - [128, 4096, 1, 4096]
    - [591, 58151.7]
  - - [128, 4096, 1, 16384]
    - [592, 72309.9]
  - - [192, 4096, 1, 1024]
    - [587, 48812.4]
  - - [192, 4096, 1, 4096]
    - [593, 72994.7]
  - - [192, 4096, 1, 16384]
    - [593, 93806.5]
  - - [128, 6144, 1, 1024]
    - [594, 48931.3]
  - - [128, 6144, 1, 4096]
    - [595, 66987.9]
  - - [128, 6144, 1, 16384]
    - [596, 76929.6]
  - - [192, 6144, 1, 256]
    - [597, 32607.7]
  - - [192, 6144, 1, 1024]
    - [598, 56966.3]
  - - [192, 6144, 1, 4096]
    - [599, 74679.5]
  - - [256, 4096, 1, 256]
    - [600, 34265.2]
  - - [256, 4096, 1, 1024]
    - [601, 51076.1]
  - - [256, 4096, 1, 4096]
    - [602, 68843.3]
  - - [384, 4096, 1, 256]
    - [603, 43770.5]
  - - [384, 4096, 1, 1024]
    - [603, 57169.0]
  - - [384, 4096, 1, 4096]
    - [604, 75025.9]
  - - [256, 6144, 1, 256]
    - [603, 43713.4]
  - - [256, 6144, 1, 1024]
    - [605, 54327.7]
  - - [256, 6144, 1, 4096]
    - [606, 86625.6]
  - - [384, 6144, 1, 256]
    - [607, 46267.6]
  - - [384, 6144, 1, 1024]
    - [608, 66606.5]
  - - [384, 6144, 1, 4096]
    - [609, 84988.4]
  - - [512, 4096, 1, 256]
    - [610, 40738.7]
  - - [512, 4096, 1, 1024]
    - [611, 69400.8]
  - - [512, 4096, 1, 4096]
    - [611, 71906.9]
  - - [640, 4096, 1, 256]
    - [610, 50145.6]
  - - [640, 4096, 1, 1024]
    - [610, 77074.2]
  - - [640, 4096, 1, 4096]
    - [612, 76000.3]
  - - [768, 4096, 1, 256]
    - [613, 48541.1]
  - - [768, 4096, 1, 1024]
    - [614, 80514.3]
  - - [768, 4096, 1, 4096]
    - [615, 81269.7]
  - - [512, 6144, 1, 256]
    - [616, 49792.6]
  - - [512, 6144, 1, 1024]
    - [617, 79095.4]
  - - [512, 6144, 1, 4096]
    - [618, 81899.2]
  - - [640, 6144, 1, 256]
    - [619, 48200.9]
  - - [640, 6144, 1, 1024]
    - [620, 69550.9]
  - - [640, 6144, 1, 4096]
    - [621, 73815.5]
  - - [768, 6144, 1, 256]
    - [622, 58064.1]
  - - [768, 6144, 1, 1024]
    - [560, 69219.4]
  - - [768, 6144, 1, 4096]
    - [623, 80662.5]
  - - [1024, 4096, 1, 256]
    - [624, 47628.9]
  - - [1024, 4096, 1, 1024]
    - [625, 73149.2]
  - - [1024, 4096, 1, 4096]
    - [626, 77445.8]
  - - [1536, 4096, 1, 256]
    - [627, 56067.9]
  - - [1536, 4096, 1, 1024]
    - [628, 77658.3]
  - - [1536, 4096, 1, 4096]
    - [566, 88524.9]
  - - [1024, 6144, 1, 256]
    - [628, 56201.2]
  - - [1024, 6144, 1, 1024]
    - [628, 79589.1]
  - - [1024, 6144, 1, 4096]
    - [566, 88462.8]
  - - [1536, 6144, 1, 256]
    - [628, 56917.9]
  - - [1536, 6144, 1, 1024]
    - [628, 78248.1]
  - - [1536, 6144, 1, 4096]
    - [566, 91596.3]
  - - [2048, 4096, 1, 256]
    - [629, 53488.6]
  - - [2048, 4096, 1, 1024]
    - [630, 73462.6]
  - - [2048, 4096, 1, 4096]
    - [566, 82105.3]
  - - [3072, 4096, 1, 256]
    - [631, 59155.7]
  - - [3072, 4096, 1, 1024]
    - [632, 78267.2]
  - - [3072, 4096, 1, 4096]
    - [633, 89263.2]
  - - [2048, 6144, 1, 256]
    - [631, 60743.3]
  - - [2048, 6144, 1, 1024]
    - [634, 79559.6]
  - - [2048, 6144, 1, 4096]
    - [566, 93333.8]
  - - [3072, 6144, 1, 1024]
    - [635, 86958.4]
  - - [4096, 4096, 1, 1024]
    - [635, 77656.3]
  - - [6144, 4096, 1, 1024]
    - [636, 85971.0]
  - - [4096, 6144, 1, 1024]
    - [637, 83361.8]
  - - [6144, 6144, 1, 1024]
    - [635, 87877.1]
  - - [8192, 4096, 1, 1024]
    - [445, 86611.1]
  - - [12288, 4096, 1, 1024]
    - [442, 86523.5]
  - - [16384, 4096, 1, 1024]
    - [442, 88941.3]
  - - [20480, 4096, 1, 1024]
    - [442, 89773.7]
  - - [24576, 4096, 1, 1024]
    - [445, 86955.2]
  - - [32768, 4096, 1, 1024]
    - [638, 87036.5]
  - - [8192, 6144, 1, 1024]
    - [445, 90095.2]
  - - [12288, 6144, 1, 1024]
    - [445, 87979.2]
  - - [16384, 6144, 1, 1024]
    - [445, 90646.3]
  - - [20480, 6144, 1, 1024]
    - [445, 91526.3]
  - - [24576, 6144, 1, 1024]
    - [445, 90413.1]
  - - [32768, 6144, 1, 1024]
    - [446, 89180.3]
  - - [16, 8192, 1, 1024]
    - [639, 11565.8]
  - - [16, 8192, 1, 4096]
    - [640, 16187.2]
  - - [16, 8192, 1, 16384]
    - [640, 19099.1]
  - - [32, 8192, 1, 1024]
    - [641, 21268.9]
  - - [32, 8192, 1, 4096]
    - [642, 28076.0]
  - - [32, 8192, 1, 16384]
    - [643, 31697.2]
  - - [16, 12288, 1, 1024]
    - [644, 13518.8]
  - - [16, 12288, 1, 4096]
    - [644, 17822.0]
  - - [16, 12288, 1, 16384]
    - [645, 21492.2]
  - - [32, 12288, 1, 1024]
    - [646, 24955.0]
  - - [32, 12288, 1, 4096]
    - [647, 32920.3]
  - - [32, 12288, 1, 16384]
    - [647, 38624.3]
  - - [16, 16384, 1, 1024]
    - [648, 12949.3]
  - - [16, 16384, 1, 4096]
    - [649, 17423.5]
  - - [16, 16384, 1, 16384]
    - [649, 20624.7]
  - - [32, 16384, 1, 1024]
    - [642, 22264.3]
  - - [32, 16384, 1, 4096]
    - [642, 28511.7]
  - - [32, 16384, 1, 16384]
    - [642, 32316.3]
  - - [16, 20480, 1, 1024]
    - [650, 14551.5]
  - - [16, 20480, 1, 4096]
    - [640, 19921.0]
  - - [16, 20480, 1, 16384]
    - [640, 21670.9]
  - - [32, 20480, 1, 1024]
    - [641, 25419.3]
  - - [32, 20480, 1, 4096]
    - [643, 34347.9]
  - - [32, 20480, 1, 16384]
    - [642, 38862.0]
  - - [16, 24576, 1, 1024]
    - [650, 14712.0]
  - - [16, 24576, 1, 4096]
    - [640, 19779.7]
  - - [16, 24576, 1, 16384]
    - [645, 21580.8]
  - - [32, 24576, 1, 1024]
    - [646, 25087.5]
  - - [32, 24576, 1, 4096]
    - [651, 33399.9]
  - - [32, 24576, 1, 16384]
    - [651, 38931.9]
  - - [16, 32768, 1, 1024]
    - [650, 14628.4]
  - - [16, 32768, 1, 4096]
    - [640, 19182.6]
  - - [16, 32768, 1, 16384]
    - [649, 21725.3]
  - - [32, 32768, 1, 256]
    - [652, 16424.4]
  - - [32, 32768, 1, 1024]
    - [653, 24401.4]
  - - [32, 32768, 1, 4096]
    - [654, 32166.4]
  - - [64, 8192, 1, 1024]
    - [655, 37763.1]
  - - [64, 8192, 1, 4096]
    - [656, 47760.5]
  - - [64, 8192, 1, 16384]
    - [656, 53062.1]
  - - [96, 8192, 1, 1024]
    - [657, 46292.4]
  - - [96, 8192, 1, 4096]
    - [658, 60839.9]
  - - [96, 8192, 1, 16384]
    - [658, 65956.8]
  - - [64, 12288, 1, 1024]
    - [659, 43827.9]
  - - [64, 12288, 1, 4096]
    - [660, 56577.1]
  - - [64, 12288, 1, 16384]
    - [660, 61863.5]
  - - [96, 12288, 1, 256]
    - [661, 31516.4]
  - - [96, 12288, 1, 1024]
    - [662, 43208.7]
  - - [96, 12288, 1, 4096]
    - [662, 57343.0]
  - - [64, 16384, 1, 256]
    - [663, 29022.2]
  - - [64, 16384, 1, 1024]
    - [656, 36838.7]
  - - [64, 16384, 1, 4096]
    - [656, 48718.4]
  - - [96, 16384, 1, 256]
    - [664, 35817.2]
  - - [96, 16384, 1, 1024]
    - [658, 47688.2]
  - - [96, 16384, 1, 4096]
    - [658, 61827.7]
  - - [64, 20480, 1, 256]
    - [665, 34413.4]
  - - [64, 20480, 1, 1024]
    - [656, 43527.7]
  - - [64, 20480, 1, 4096]
    - [656, 58925.7]
  - - [96, 20480, 1, 256]
    - [666, 42584.6]
  - - [96, 20480, 1, 1024]
    - [658, 57095.8]
  - - [96, 20480, 1, 4096]
    - [658, 75515.2]
  - - [64, 24576, 1, 256]
    - [667, 36087.5]
  - - [64, 24576, 1, 1024]
    - [660, 43590.0]
  - - [64, 24576, 1, 4096]
    - [660, 56889.6]
  - - [96, 24576, 1, 256]
    - [668, 41205.6]
  - - [96, 24576, 1, 1024]
    - [669, 49534.7]
  - - [96, 24576, 1, 4096]
    - [658, 62020.2]
  - - [64, 32768, 1, 256]
    - [670, 29016.0]
  - - [64, 32768, 1, 1024]
    - [660, 40510.8]
  - - [64, 32768, 1, 4096]
    - [660, 51901.3]
  - - [96, 32768, 1, 256]
    - [671, 32138.1]
  - - [96, 32768, 1, 1024]
    - [658, 48623.3]
  - - [96, 32768, 1, 4096]
    - [658, 62255.3]
  - - [128, 8192, 1, 256]
    - [672, 30572.8]
  - - [128, 8192, 1, 1024]
    - [673, 42751.6]
  - - [128, 8192, 1, 4096]
    - [674, 61498.3]
  - - [192, 8192, 1, 256]
    - [675, 37678.3]
  - - [192, 8192, 1, 1024]
    - [676, 49727.8]
  - - [192, 8192, 1, 4096]
    - [677, 66243.6]
  - - [128, 12288, 1, 256]
    - [678, 33952.5]
  - - [128, 12288, 1, 1024]
    - [679, 53592.1]
  - - [128, 12288, 1, 4096]
    - [680, 66515.1]
  - - [192, 12288, 1, 256]
    - [681, 33849.5]
  - - [192, 12288, 1, 1024]
    - [682, 53944.6]
  - - [192, 12288, 1, 4096]
    - [682, 71329.2]
  - - [128, 16384, 1, 256]
    - [683, 40413.2]
  - - [128, 16384, 1, 1024]
    - [683, 56421.2]
  - - [128, 16384, 1, 4096]
    - [684, 69086.3]
  - - [192, 16384, 1, 256]
    - [681, 43847.0]
  - - [192, 16384, 1, 1024]
    - [681, 69176.7]
  - - [192, 16384, 1, 4096]
    - [681, 84154.3]
  - - [128, 20480, 1, 256]
    - [685, 46303.2]
  - - [128, 20480, 1, 1024]
    - [686, 64837.4]
  - - [128, 20480, 1, 4096]
    - [687, 79262.9]
  - - [192, 20480, 1, 256]
    - [688, 49571.3]
  - - [192, 20480, 1, 1024]
    - [689, 75609.1]
  - - [192, 20480, 1, 4096]
    - [690, 99639.4]
  - - [128, 24576, 1, 256]
    - [691, 41522.1]
  - - [128, 24576, 1, 1024]
    - [692, 63804.0]
  - - [128, 24576, 1, 4096]
    - [692, 80170.8]
  - - [192, 24576, 1, 256]
    - [693, 46288.9]
  - - [192, 24576, 1, 1024]
    - [694, 56492.3]
  - - [192, 24576, 1, 4096]
    - [695, 72269.7]
  - - [128, 32768, 1, 256]
    - [683, 40062.5]
  - - [128, 32768, 1, 1024]
    - [696, 57859.5]
  - - [128, 32768, 1, 4096]
    - [683, 70611.8]
  - - [192, 32768, 1, 256]
    - [697, 44027.2]
  - - [192, 32768, 1, 1024]
    - [681, 71014.0]
  - - [192, 32768, 1, 4096]
    - [681, 84517.7]
  - - [256, 8192, 1, 256]
    - [698, 44473.1]
  - - [256, 8192, 1, 1024]
    - [698, 65924.3]
  - - [256, 8192, 1, 4096]
    - [699, 75319.5]
  - - [384, 8192, 1, 256]
    - [700, 47801.7]
  - - [384, 8192, 1, 1024]
    - [701, 70262.6]
  - - [384, 8192, 1, 4096]
    - [701, 83671.1]
  - - [256, 12288, 1, 256]
    - [702, 50646.0]
  - - [256, 12288, 1, 1024]
    - [703, 76745.7]
  - - [256, 12288, 1, 4096]
    - [704, 97459.0]
  - - [384, 12288, 1, 256]
    - [705, 51214.5]
  - - [384, 12288, 1, 1024]
    - [706, 58339.5]
  - - [384, 12288, 1, 4096]
    - [707, 73755.2]
  - - [256, 16384, 1, 256]
    - [708, 49632.4]
  - - [256, 16384, 1, 1024]
    - [709, 69785.0]
  - - [256, 16384, 1, 4096]
    - [710, 84222.6]
  - - [384, 16384, 1, 256]
    - [701, 47643.1]
  - - [384, 16384, 1, 1024]
    - [701, 70558.7]
  - - [384, 16384, 1, 4096]
    - [701, 84103.6]
  - - [256, 20480, 1, 256]
    - [711, 53529.3]
  - - [256, 20480, 1, 1024]
    - [703, 65503.5]
  - - [256, 20480, 1, 4096]
    - [704, 82919.5]
  - - [384, 20480, 1, 256]
    - [712, 40486.8]
  - - [384, 20480, 1, 1024]
    - [701, 58654.7]
  - - [384, 20480, 1, 4096]
    - [701, 70657.4]
  - - [256, 24576, 1, 256]
    - [713, 50838.4]
  - - [256, 24576, 1, 1024]
    - [703, 78012.7]
  - - [256, 24576, 1, 4096]
    - [704, 98506.0]
  - - [384, 24576, 1, 256]
    - [707, 46618.4]
  - - [384, 24576, 1, 1024]
    - [701, 68485.8]
  - - [384, 24576, 1, 4096]
    - [701, 84153.9]
  - - [256, 32768, 1, 256]
    - [714, 47401.3]
  - - [256, 32768, 1, 1024]
    - [709, 68541.5]
  - - [256, 32768, 1, 4096]
    - [704, 88447.0]
  - - [384, 32768, 1, 256]
    - [715, 46231.2]
  - - [384, 32768, 1, 1024]
    - [716, 68655.0]
  - - [384, 32768, 1, 4096]
    - [717, 84437.8]
  - - [512, 8192, 1, 256]
    - [718, 48491.3]
  - - [512, 8192, 1, 1024]
    - [625, 72979.7]
  - - [512, 8192, 1, 4096]
    - [719, 75203.2]
  - - [640, 8192, 1, 256]
    - [720, 51313.9]
  - - [640, 8192, 1, 1024]
    - [721, 74918.1]
  - - [640, 8192, 1, 4096]
    - [720, 67318.7]
  - - [768, 8192, 1, 256]
    - [635, 46963.6]
  - - [768, 8192, 1, 1024]
    - [635, 72503.9]
  - - [768, 8192, 1, 4096]
    - [635, 79684.8]
  - - [512, 12288, 1, 256]
    - [635, 47756.2]
  - - [512, 12288, 1, 1024]
    - [635, 72809.5]
  - - [512, 12288, 1, 4096]
    - [635, 79711.5]
  - - [640, 12288, 1, 256]
    - [722, 51094.6]
  - - [640, 12288, 1, 1024]
    - [723, 69020.3]
  - - [640, 12288, 1, 4096]
    - [723, 79121.2]
  - - [768, 12288, 1, 256]
    - [724, 54855.6]
  - - [768, 12288, 1, 1024]
    - [636, 79152.6]
  - - [768, 12288, 1, 4096]
    - [635, 82075.6]
  - - [512, 16384, 1, 256]
    - [625, 52466.8]
  - - [512, 16384, 1, 1024]
    - [630, 69958.1]
  - - [512, 16384, 1, 4096]
    - [725, 79173.7]
  - - [640, 16384, 1, 256]
    - [721, 54091.4]
  - - [640, 16384, 1, 1024]
    - [723, 61623.8]
  - - [640, 16384, 1, 4096]
    - [726, 74952.7]
  - - [768, 16384, 1, 256]
    - [625, 54817.0]
  - - [768, 16384, 1, 1024]
    - [635, 73371.3]
  - - [768, 16384, 1, 4096]
    - [635, 82540.7]
  - - [512, 20480, 1, 256]
    - [636, 59604.9]
  - - [512, 20480, 1, 1024]
    - [635, 79372.1]
  - - [512, 20480, 1, 4096]
    - [635, 90153.7]
  - - [640, 20480, 1, 256]
    - [727, 51421.0]
  - - [640, 20480, 1, 1024]
    - [728, 66495.5]
  - - [640, 20480, 1, 4096]
    - [729, 82829.9]
  - - [768, 20480, 1, 1024]
    - [728, 81926.3]
  - - [512, 24576, 1, 256]
    - [625, 54705.0]
  - - [512, 24576, 1, 1024]
    - [635, 71927.8]
  - - [512, 24576, 1, 4096]
    - [635, 82305.6]
  - - [640, 24576, 1, 1024]
    - [723, 68932.6]
  - - [768, 24576, 1, 1024]
    - [635, 85906.1]
  - - [512, 32768, 1, 1024]
    - [635, 77482.2]
  - - [640, 32768, 1, 1024]
    - [727, 65504.2]
  - - [768, 32768, 1, 1024]
    - [635, 83264.6]
  - - [1024, 8192, 1, 256]
    - [730, 53897.6]
  - - [1024, 8192, 1, 1024]
    - [630, 73119.3]
  - - [1024, 8192, 1, 4096]
    - [731, 82214.9]
  - - [1536, 8192, 1, 256]
    - [732, 59625.5]
  - - [1536, 8192, 1, 1024]
    - [634, 78613.7]
  - - [1536, 8192, 1, 4096]
    - [731, 89462.0]
  - - [1024, 12288, 1, 256]
    - [732, 59669.7]
  - - [1024, 12288, 1, 1024]
    - [733, 77452.4]
  - - [1024, 12288, 1, 4096]
    - [731, 94187.2]
  - - [1536, 12288, 1, 1024]
    - [635, 86571.2]
  - - [1024, 16384, 1, 1024]
    - [635, 77753.6]
  - - [1536, 16384, 1, 1024]
    - [635, 83180.7]
  - - [1024, 20480, 1, 1024]
    - [636, 82613.8]
  - - [1536, 20480, 1, 1024]
    - [728, 82714.2]
  - - [1024, 24576, 1, 1024]
    - [635, 83225.9]
  - - [1536, 24576, 1, 1024]
    - [635, 87469.6]
  - - [1024, 32768, 1, 1024]
    - [635, 86546.3]
  - - [1536, 32768, 1, 1024]
    - [635, 89818.9]
  - - [2048, 8192, 1, 1024]
    - [635, 77910.6]
  - - [3072, 8192, 1, 1024]
    - [636, 84208.3]
  - - [2048, 12288, 1, 1024]
    - [636, 85764.4]
  - - [3072, 12288, 1, 1024]
    - [635, 87677.2]
  - - [2048, 16384, 1, 1024]
    - [635, 87210.2]
  - - [3072, 16384, 1, 1024]
    - [635, 90218.5]
  - - [2048, 20480, 1, 1024]
    - [635, 89179.6]
  - - [3072, 20480, 1, 1024]
    - [636, 87281.9]
  - - [2048, 24576, 1, 1024]
    - [635, 90827.2]
  - - [3072, 24576, 1, 1024]
    - [635, 88431.1]
  - - [2048, 32768, 1, 1024]
    - [635, 87773.0]
  - - [3072, 32768, 1, 1024]
    - [635, 90710.2]
  - - [4096, 8192, 1, 1024]
    - [635, 86694.2]
  - - [6144, 8192, 1, 1024]
    - [635, 90088.9]
  - - [4096, 12288, 1, 1024]
    - [635, 90054.1]
  - - [6144, 12288, 1, 1024]
    - [635, 88285.4]
  - - [4096, 16384, 1, 1024]
    - [636, 87466.2]
  - - [6144, 16384, 1, 1024]
    - [635, 90518.7]
  - - [4096, 20480, 1, 1024]
    - [636, 90164.7]
  - - [6144, 20480, 1, 1024]
    - [635, 89267.5]
  - - [4096, 24576, 1, 1024]
    - [635, 90777.5]
  - - [6144, 24576, 1, 1024]
    - [635, 90629.8]
  - - [4096, 32768, 1, 1024]
    - [635, 90013.2]
  - - [6144, 32768, 1, 1024]
    - [635, 90512.3]
  - - [8192, 8192, 1, 1024]
    - [636, 88152.2]
  - - [12288, 8192, 1, 1024]
    - [635, 90771.1]
  - - [16384, 8192, 1, 1024]
    - [635, 89955.3]
  - - [20480, 8192, 1, 1024]
    - [635, 91149.6]
  - - [24576, 8192, 1, 1024]
    - [635, 90921.2]
  - - [32768, 8192, 1, 1024]
    - [635, 91361.4]
  - - [8192, 12288, 1, 1024]
    - [635, 90584.0]
  - - [12288, 12288, 1, 1024]
    - [635, 90754.6]
  - - [16384, 12288, 1, 1024]
    - [635, 91116.1]
  - - [20480, 12288, 1, 1024]
    - [635, 92187.9]
  - - [8192, 16384, 1, 1024]
    - [635, 89756.3]
  - - [12288, 16384, 1, 1024]
    - [635, 90854.5]
  - - [16384, 16384, 1, 1024]
    - [635, 91488.2]
  - - [8192, 20480, 1, 1024]
    - [635, 91670.2]
  - - [12288, 20480, 1, 1024]
    - [635, 90864.5]
  - - [8192, 24576, 1, 1024]
    - [635, 90729.5]
  - - [8192, 32768, 1, 1024]
    - [635, 91335.2]
- null
- null
- DeviceEfficiency
- GridBased
