projects/hipblaslt/library/src/amd_detail/rocblaslt/src/Tensile/Logic/asm_full/gfx1201/GridBased/gfx1201_Cijk_Ailk_Bljk_BSS_BH_Bias_S_HA_S_SAV_UserArgs.yaml
- {MinimumRequiredVersion: 4.33.0}
- gfx1201
- gfx1201
- [Device 73f0]
    SolutionIndex: 0
    SolutionNameMin: Cijk_Ailk_Bljk_BSS_BH_Bias_S_HA_S_SAV_UserArgs_MT64x64x32_MI16x16x1_SN_LDSB0_AFC1_AFEM1_AFEM1_ASEM32_CLR0_CADS0_DTVA0_DTVB1_EPS0_FDSI0_GRPM1_GRVWA8_GRVWB8_GSU1_GSUAMB_GSUC0_GSUWGMRR0_GLS0_ISA1201_IU1_K1_LBSPPA1024_LBSPPB0_LBSPPM0_LPA16_LPB0_LPM0_LRVW8_LWPMn1_MIAV1_MIWT2_2_MO40_NTn1_NTA0_NTB0_NTC0_NTD0_NTM0_NEPBS0_NLCA1_NLCB2_ONLL1_PGR2_PLR1_PKA0_SIA3_SS0_SU32_SUM0_SUS256_SPO0_SRVW0_SSO0_SVW8_SK0_SKXCCM0_TLDS1_ULSGRO0_USL1_UIOFGRO0_USFGROn1_VSn1_VWA1_VWB1_WSGRA0_WSGRB0_WS32_WG32_4_1_WGM8_WGMXCC1_WGMXCCGn1
    SolutionIndex: 1
    SolutionNameMin: Cijk_Ailk_Bljk_BSS_BH_Bias_S_HA_S_SAV_UserArgs_MT128x128x32_MI16x16x1_SN_LDSB0_AFC1_AFEM1_AFEM1_ASEM1_CLR0_CADS0_DTVA0_DTVB0_EPS0_FDSI0_GRPM1_GRVWA8_GRVWB4_GSU1_GSUAMB_GSUC0_GSUWGMRR0_GLS0_ISA1201_IU1_K1_LBSPPA2048_LBSPPB128_LBSPPM0_LPA0_LPB16_LPM0_LRVW8_LWPMn1_MIAV1_MIWT4_4_MO40_NTn1_NTA0_NTB0_NTC0_NTD0_NTM0_NEPBS0_NLCA1_NLCB1_ONLL1_PGR2_PLR0_PKA0_SIA1_SS1_SU32_SUM0_SUS256_SPO0_SRVW0_SSO0_SVW4_SK0_SKXCCM0_TLDS1_ULSGRO0_USL1_UIOFGRO0_USFGROn1_VSn1_VWA4_VWB1_WSGRA0_WSGRB0_WS32_WG32_4_1_WGM8_WGMXCC1_WGMXCCGn1
    SolutionIndex: 2
    SolutionNameMin: Cijk_Ailk_Bljk_BSS_BH_Bias_S_HA_S_SAV_UserArgs_MT128x128x32_MI16x16x1_SN_LDSB0_AFC1_AFEM1_AFEM1_ASEM1_CLR0_CADS0_DTVA0_DTVB0_EPS0_FDSI0_GRPM1_GRVWA8_GRVWB4_GSU1_GSUAMB_GSUC0_GSUWGMRR0_GLS0_ISA1201_IU1_K1_LBSPPA2048_LBSPPB256_LBSPPM0_LPA0_LPB16_LPM0_LRVW8_LWPMn1_MIAV1_MIWT4_4_MO40_NTn1_NTA0_NTB0_NTC0_NTD0_NTM0_NEPBS0_NLCA1_NLCB1_ONLL1_PGR2_PLR0_PKA0_SIA1_SS1_SU32_SUM0_SUS256_SPO0_SRVW0_SSO0_SVW4_SK0_SKXCCM0_TLDS1_ULSGRO0_USL1_UIOFGRO0_USFGROn1_VSn1_VWA4_VWB4_WSGRA0_WSGRB0_WS32_WG32_4_1_WGM8_WGMXCC1_WGMXCCGn1
    SolutionIndex: 3
    SolutionNameMin: Cijk_Ailk_Bljk_BSS_BH_Bias_S_HA_S_SAV_UserArgs_MT128x128x32_MI16x16x1_SN_LDSB0_AFC1_AFEM1_AFEM1_ASEM1_CLR0_CADS0_DTVA0_DTVB0_EPS0_FDSI0_GRPM1_GRVWA4_GRVWB8_GSU1_GSUAMB_GSUC0_GSUWGMRR0_GLS0_ISA1201_IU1_K1_LBSPPA2048_LBSPPB128_LBSPPM0_LPA0_LPB16_LPM0_LRVW8_LWPMn1_MIAV1_MIWT4_4_MO40_NTn1_NTA0_NTB0_NTC0_NTD0_NTM0_NEPBS0_NLCA1_NLCB1_ONLL1_PGR2_PLR0_PKA0_SIA1_SS1_SU32_SUM0_SUS256_SPO0_SRVW0_SSO0_SVW4_SK0_SKXCCM0_TLDS1_ULSGRO0_USL1_UIOFGRO0_USFGROn1_VSn1_VWA4_VWB1_WSGRA0_WSGRB0_WS32_WG32_4_1_WGM8_WGMXCC1_WGMXCCGn1
    SolutionIndex: 4
    SolutionNameMin: Cijk_Ailk_Bljk_BSS_BH_Bias_S_HA_S_SAV_UserArgs_MT128x128x32_MI16x16x1_SN_LDSB0_AFC1_AFEM1_AFEM1_ASEM1_CLR0_CADS0_DTVA0_DTVB0_EPS0_FDSI0_GRPM1_GRVWA8_GRVWB8_GSU1_GSUAMB_GSUC0_GSUWGMRR0_GLS0_ISA1201_IU1_K1_LBSPPA2048_LBSPPB256_LBSPPM0_LPA0_LPB16_LPM0_LRVW8_LWPMn1_MIAV1_MIWT4_4_MO40_NTn1_NTA0_NTB0_NTC0_NTD0_NTM0_NEPBS0_NLCA1_NLCB1_ONLL1_PGR2_PLR0_PKA0_SIA1_SS1_SU32_SUM0_SUS256_SPO0_SRVW0_SSO0_SVW4_SK0_SKXCCM0_TLDS1_ULSGRO0_USL1_UIOFGRO0_USFGROn1_VSn1_VWA4_VWB4_WSGRA0_WSGRB0_WS32_WG32_4_1_WGM8_WGMXCC1_WGMXCCGn1
    SolutionIndex: 5
    SolutionNameMin: Cijk_Ailk_Bljk_BSS_BH_Bias_S_HA_S_SAV_UserArgs_MT64x64x32_MI16x16x1_SN_LDSB1_AFC1_AFEM1_AFEM1_ASEM32_CLR0_CADS0_DTVA0_DTVB1_EPS0_FDSI0_GRPM1_GRVWA1_GRVWB8_GSU1_GSUAMB_GSUC0_GSUWGMRR0_GLS0_ISA1201_IU1_K1_LBSPPA1024_LBSPPB0_LBSPPM0_LPA16_LPB0_LPM0_LRVW8_LWPMn1_MIAV1_MIWT2_2_MO40_NTn1_NTA0_NTB0_NTC0_NTD0_NTM0_NEPBS0_NLCA1_NLCB2_ONLL1_PGR2_PLR1_PKA0_SIA3_SS0_SU32_SUM0_SUS256_SPO0_SRVW0_SSO0_SVW8_SK0_SKXCCM0_TLDS1_ULSGRO0_USL1_UIOFGRO0_USFGROn1_VSn1_VWA1_VWB1_WSGRA0_WSGRB0_WS32_WG32_4_1_WGM8_WGMXCC1_WGMXCCGn1
    SolutionIndex: 6
    SolutionNameMin: Cijk_Ailk_Bljk_BSS_BH_Bias_S_HA_S_SAV_UserArgs_MT64x64x32_MI16x16x1_SN_LDSB1_AFC1_AFEM1_AFEM1_ASEM32_CLR0_CADS0_DTVA0_DTVB1_EPS0_FDSI0_GRPM1_GRVWA8_GRVWB8_GSU1_GSUAMB_GSUC0_GSUWGMRR0_GLS0_ISA1201_IU1_K1_LBSPPA1024_LBSPPB0_LBSPPM0_LPA16_LPB0_LPM0_LRVW8_LWPMn1_MIAV1_MIWT2_2_MO40_NTn1_NTA0_NTB0_NTC0_NTD0_NTM0_NEPBS0_NLCA1_NLCB2_ONLL1_PGR1_PLR1_PKA0_SIA3_SS0_SU32_SUM0_SUS256_SPO0_SRVW0_SSO0_SVW8_SK0_SKXCCM0_TLDS1_ULSGRO0_USL1_UIOFGRO0_USFGROn1_VSn1_VWA1_VWB1_WSGRA0_WSGRB0_WS32_WG32_4_1_WGM8_WGMXCC1_WGMXCCGn1
    SolutionIndex: 7
    SolutionNameMin: Cijk_Ailk_Bljk_BSS_BH_Bias_S_HA_S_SAV_UserArgs_MT64x64x32_MI16x16x1_SN_LDSB0_AFC1_AFEM1_AFEM1_ASEM1_CLR1_CADS0_DTVA0_DTVB0_EPS0_FDSI0_GRPM1_GRVWA8_GRVWB8_GSU1_GSUAMB_GSUC0_GSUWGMRR0_GLS0_ISA1201_IU1_K1_LBSPPA1024_LBSPPB128_LBSPPM0_LPA16_LPB16_LPM0_LRVW8_LWPMn1_MIAV1_MIWT2_2_MO40_NTn1_NTA0_NTB0_NTC0_NTD0_NTM0_NEPBS0_NLCA1_NLCB1_ONLL1_PGR2_PLR1_PKA0_SIA1_SS0_SU32_SUM0_SUS256_SPO0_SRVW0_SSO0_SVW8_SK0_SKXCCM0_TLDS1_ULSGRO0_USL1_UIOFGRO0_USFGROn1_VSn1_VWA1_VWB1_WSGRA0_WSGRB0_WS32_WG32_4_1_WGM8_WGMXCC1_WGMXCCGn1
    SolutionIndex: 8
    SolutionNameMin: Cijk_Ailk_Bljk_BSS_BH_Bias_S_HA_S_SAV_UserArgs_MT64x64x32_MI16x16x1_SN_LDSB0_AFC1_AFEM1_AFEM1_ASEM1_CLR0_CADS0_DTVA0_DTVB0_EPS0_FDSI0_GRPM1_GRVWA8_GRVWB8_GSU1_GSUAMB_GSUC0_GSUWGMRR0_GLS0_ISA1201_IU1_K1_LBSPPA1024_LBSPPB1024_LBSPPM0_LPA16_LPB16_LPM0_LRVW8_LWPMn1_MIAV1_MIWT2_2_MO40_NTn1_NTA0_NTB0_NTC0_NTD0_NTM0_NEPBS0_NLCA1_NLCB1_ONLL1_PGR2_PLR1_PKA0_SIA1_SS0_SU32_SUM0_SUS256_SPO0_SRVW0_SSO0_SVW8_SK0_SKXCCM0_TLDS0_ULSGRO0_USL1_UIOFGRO0_USFGROn1_VSn1_VWA1_VWB1_WSGRA0_WSGRB0_WS32_WG32_4_1_WGM8_WGMXCC1_WGMXCCGn1
    SolutionIndex: 9
    SolutionNameMin: Cijk_Ailk_Bljk_BSS_BH_Bias_S_HA_S_SAV_UserArgs_MT64x64x32_MI16x16x1_SN_LDSB1_AFC1_AFEM1_AFEM1_ASEM32_CLR1_CADS0_DTVA0_DTVB1_EPS1_FDSI0_GRPM1_GRVWA8_GRVWB8_GSU1_GSUAMB_GSUC0_GSUWGMRR0_GLS0_ISA1201_IU1_K1_LBSPPA1024_LBSPPB0_LBSPPM0_LPA16_LPB0_LPM0_LRVW8_LWPMn1_MIAV1_MIWT2_2_MO40_NTn1_NTA0_NTB0_NTC0_NTD0_NTM0_NEPBS0_NLCA1_NLCB2_ONLL1_PGR1_PLR1_PKA0_SIA3_SS0_SU32_SUM0_SUS256_SPO0_SRVW0_SSO0_SVW8_SK0_SKXCCM0_TLDS1_ULSGRO0_USL1_UIOFGRO0_USFGROn1_VSn1_VWA1_VWB1_WSGRA0_WSGRB0_WS32_WG32_4_1_WGM8_WGMXCC1_WGMXCCGn1
    SolutionIndex: 10
    SolutionNameMin: Cijk_Ailk_Bljk_BSS_BH_Bias_S_HA_S_SAV_UserArgs_MT64x64x32_MI16x16x1_SN_LDSB0_AFC1_AFEM1_AFEM1_ASEM1_CLR0_CADS0_DTVA0_DTVB0_EPS0_FDSI0_GRPM1_GRVWA8_GRVWB8_GSU1_GSUAMB_GSUC0_GSUWGMRR0_GLS0_ISA1201_IU1_K1_LBSPPA1024_LBSPPB1024_LBSPPM0_LPA16_LPB16_LPM0_LRVW8_LWPMn1_MIAV1_MIWT2_2_MO40_NTn1_NTA0_NTB0_NTC0_NTD0_NTM0_NEPBS0_NLCA1_NLCB1_ONLL1_PGR1_PLR1_PKA0_SIA1_SS0_SU32_SUM0_SUS256_SPO0_SRVW0_SSO0_SVW8_SK0_SKXCCM0_TLDS0_ULSGRO0_USL1_UIOFGRO0_USFGROn1_VSn1_VWA1_VWB1_WSGRA0_WSGRB0_WS32_WG32_4_1_WGM8_WGMXCC1_WGMXCCGn1
    SolutionIndex: 11
    SolutionNameMin: Cijk_Ailk_Bljk_BSS_BH_Bias_S_HA_S_SAV_UserArgs_MT64x64x32_MI16x16x1_SN_LDSB0_AFC1_AFEM1_AFEM1_ASEM32_CLR0_CADS0_DTVA0_DTVB1_EPS1_FDSI0_GRPM1_GRVWA8_GRVWB8_GSU1_GSUAMB_GSUC0_GSUWGMRR0_GLS0_ISA1201_IU1_K1_LBSPPA1024_LBSPPB0_LBSPPM0_LPA16_LPB0_LPM0_LRVW8_LWPMn1_MIAV1_MIWT2_2_MO40_NTn1_NTA0_NTB0_NTC0_NTD0_NTM0_NEPBS0_NLCA1_NLCB2_ONLL1_PGR1_PLR1_PKA0_SIA3_SS0_SU32_SUM0_SUS256_SPO0_SRVW0_SSO0_SVW8_SK0_SKXCCM0_TLDS1_ULSGRO0_USL1_UIOFGRO0_USFGROn1_VSn1_VWA1_VWB1_WSGRA0_WSGRB0_WS32_WG32_4_1_WGM8_WGMXCC1_WGMXCCGn1
    SolutionIndex: 12
    SolutionNameMin: Cijk_Ailk_Bljk_BSS_BH_Bias_S_HA_S_SAV_UserArgs_MT64x64x32_MI16x16x1_SN_LDSB0_AFC1_AFEM1_AFEM1_ASEM1_CLR1_CADS0_DTVA0_DTVB0_EPS0_FDSI0_GRPM1_GRVWA8_GRVWB8_GSU1_GSUAMB_GSUC0_GSUWGMRR0_GLS0_ISA1201_IU1_K1_LBSPPA1024_LBSPPB128_LBSPPM0_LPA16_LPB16_LPM0_LRVW8_LWPMn1_MIAV1_MIWT2_2_MO40_NTn1_NTA0_NTB0_NTC0_NTD0_NTM0_NEPBS0_NLCA1_NLCB1_ONLL1_PGR1_PLR1_PKA0_SIA1_SS0_SU32_SUM0_SUS256_SPO0_SRVW0_SSO0_SVW8_SK0_SKXCCM0_TLDS1_ULSGRO0_USL1_UIOFGRO0_USFGROn1_VSn1_VWA1_VWB1_WSGRA0_WSGRB0_WS32_WG32_4_1_WGM8_WGMXCC1_WGMXCCGn1
    SolutionIndex: 13
    SolutionNameMin: Cijk_Ailk_Bljk_BSS_BH_Bias_S_HA_S_SAV_UserArgs_MT64x64x32_MI16x16x1_SN_LDSB0_AFC1_AFEM1_AFEM1_ASEM32_CLR1_CADS0_DTVA0_DTVB1_EPS0_FDSI0_GRPM1_GRVWA8_GRVWB8_GSU1_GSUAMB_GSUC0_GSUWGMRR0_GLS0_ISA1201_IU1_K1_LBSPPA1024_LBSPPB0_LBSPPM0_LPA16_LPB0_LPM0_LRVW8_LWPMn1_MIAV1_MIWT2_2_MO40_NTn1_NTA0_NTB0_NTC0_NTD0_NTM0_NEPBS0_NLCA1_NLCB2_ONLL1_PGR1_PLR1_PKA0_SIA3_SS0_SU32_SUM0_SUS256_SPO0_SRVW0_SSO0_SVW8_SK0_SKXCCM0_TLDS1_ULSGRO0_USL1_UIOFGRO0_USFGROn1_VSn1_VWA1_VWB1_WSGRA0_WSGRB0_WS32_WG32_4_1_WGM8_WGMXCC1_WGMXCCGn1
    SolutionIndex: 14
    SolutionNameMin: Cijk_Ailk_Bljk_BSS_BH_Bias_S_HA_S_SAV_UserArgs_MT64x64x32_MI16x16x1_SN_LDSB0_AFC1_AFEM1_AFEM1_ASEM32_CLR0_CADS0_DTVA0_DTVB1_EPS1_FDSI0_GRPM1_GRVWA1_GRVWB8_GSU1_GSUAMB_GSUC0_GSUWGMRR0_GLS0_ISA1201_IU1_K1_LBSPPA1024_LBSPPB0_LBSPPM0_LPA16_LPB0_LPM0_LRVW8_LWPMn1_MIAV1_MIWT2_2_MO40_NTn1_NTA0_NTB0_NTC0_NTD0_NTM0_NEPBS0_NLCA1_NLCB2_ONLL1_PGR1_PLR1_PKA0_SIA3_SS0_SU32_SUM0_SUS256_SPO0_SRVW0_SSO0_SVW8_SK0_SKXCCM0_TLDS1_ULSGRO0_USL1_UIOFGRO0_USFGROn1_VSn1_VWA1_VWB1_WSGRA0_WSGRB0_WS32_WG32_4_1_WGM8_WGMXCC1_WGMXCCGn1
    SolutionIndex: 15
    SolutionNameMin: Cijk_Ailk_Bljk_BSS_BH_Bias_S_HA_S_SAV_UserArgs_MT64x64x32_MI16x16x1_SN_LDSB1_AFC1_AFEM1_AFEM1_ASEM32_CLR1_CADS0_DTVA0_DTVB1_EPS1_FDSI0_GRPM1_GRVWA1_GRVWB8_GSU1_GSUAMB_GSUC0_GSUWGMRR0_GLS0_ISA1201_IU1_K1_LBSPPA1024_LBSPPB0_LBSPPM0_LPA16_LPB0_LPM0_LRVW8_LWPMn1_MIAV1_MIWT2_2_MO40_NTn1_NTA0_NTB0_NTC0_NTD0_NTM0_NEPBS0_NLCA1_NLCB2_ONLL1_PGR1_PLR1_PKA0_SIA3_SS0_SU32_SUM0_SUS256_SPO0_SRVW0_SSO0_SVW8_SK0_SKXCCM0_TLDS1_ULSGRO0_USL1_UIOFGRO0_USFGROn1_VSn1_VWA1_VWB1_WSGRA0_WSGRB0_WS32_WG32_4_1_WGM8_WGMXCC1_WGMXCCGn1
    SolutionIndex: 16
    SolutionNameMin: Cijk_Ailk_Bljk_BSS_BH_Bias_S_HA_S_SAV_UserArgs_MT64x64x32_MI16x16x1_SN_LDSB1_AFC1_AFEM1_AFEM1_ASEM32_CLR1_CADS0_DTVA0_DTVB1_EPS0_FDSI0_GRPM1_GRVWA8_GRVWB8_GSU1_GSUAMB_GSUC0_GSUWGMRR0_GLS0_ISA1201_IU1_K1_LBSPPA1024_LBSPPB0_LBSPPM0_LPA16_LPB0_LPM0_LRVW8_LWPMn1_MIAV1_MIWT2_2_MO40_NTn1_NTA0_NTB0_NTC0_NTD0_NTM0_NEPBS0_NLCA1_NLCB2_ONLL1_PGR2_PLR1_PKA0_SIA3_SS0_SU32_SUM0_SUS256_SPO0_SRVW0_SSO0_SVW8_SK0_SKXCCM0_TLDS1_ULSGRO0_USL1_UIOFGRO0_USFGROn1_VSn1_VWA1_VWB1_WSGRA0_WSGRB0_WS32_WG32_4_1_WGM8_WGMXCC1_WGMXCCGn1
    SolutionIndex: 17
    SolutionNameMin: Cijk_Ailk_Bljk_BSS_BH_Bias_S_HA_S_SAV_UserArgs_MT64x64x32_MI16x16x1_SN_LDSB0_AFC1_AFEM1_AFEM1_ASEM32_CLR1_CADS0_DTVA0_DTVB1_EPS0_FDSI0_GRPM1_GRVWA1_GRVWB8_GSU1_GSUAMB_GSUC0_GSUWGMRR0_GLS0_ISA1201_IU1_K1_LBSPPA1024_LBSPPB0_LBSPPM0_LPA16_LPB0_LPM0_LRVW8_LWPMn1_MIAV1_MIWT2_2_MO40_NTn1_NTA0_NTB0_NTC0_NTD0_NTM0_NEPBS0_NLCA1_NLCB2_ONLL1_PGR2_PLR1_PKA0_SIA3_SS0_SU32_SUM0_SUS256_SPO0_SRVW0_SSO0_SVW8_SK0_SKXCCM0_TLDS1_ULSGRO0_USL1_UIOFGRO0_USFGROn1_VSn1_VWA1_VWB1_WSGRA0_WSGRB0_WS32_WG32_4_1_WGM8_WGMXCC1_WGMXCCGn1
    SolutionIndex: 18
    SolutionNameMin: Cijk_Ailk_Bljk_BSS_BH_Bias_S_HA_S_SAV_UserArgs_MT64x64x32_MI16x16x1_SN_LDSB0_AFC1_AFEM1_AFEM1_ASEM32_CLR1_CADS0_DTVA0_DTVB1_EPS0_FDSI0_GRPM1_GRVWA1_GRVWB8_GSU1_GSUAMB_GSUC0_GSUWGMRR0_GLS0_ISA1201_IU1_K1_LBSPPA1024_LBSPPB0_LBSPPM0_LPA16_LPB0_LPM0_LRVW8_LWPMn1_MIAV1_MIWT2_2_MO40_NTn1_NTA0_NTB0_NTC0_NTD0_NTM0_NEPBS0_NLCA1_NLCB2_ONLL1_PGR1_PLR1_PKA0_SIA3_SS0_SU32_SUM0_SUS256_SPO0_SRVW0_SSO0_SVW8_SK0_SKXCCM0_TLDS1_ULSGRO0_USL1_UIOFGRO0_USFGROn1_VSn1_VWA1_VWB1_WSGRA0_WSGRB0_WS32_WG32_4_1_WGM8_WGMXCC1_WGMXCCGn1
    SolutionIndex: 19
    SolutionNameMin: Cijk_Ailk_Bljk_BSS_BH_Bias_S_HA_S_SAV_UserArgs_MT64x64x32_MI16x16x1_SN_LDSB1_AFC1_AFEM1_AFEM1_ASEM32_CLR1_CADS0_DTVA0_DTVB1_EPS0_FDSI0_GRPM1_GRVWA1_GRVWB8_GSU1_GSUAMB_GSUC0_GSUWGMRR0_GLS0_ISA1201_IU1_K1_LBSPPA1024_LBSPPB0_LBSPPM0_LPA16_LPB0_LPM0_LRVW8_LWPMn1_MIAV1_MIWT2_2_MO40_NTn1_NTA0_NTB0_NTC0_NTD0_NTM0_NEPBS0_NLCA1_NLCB2_ONLL1_PGR1_PLR1_PKA0_SIA3_SS0_SU32_SUM0_SUS256_SPO0_SRVW0_SSO0_SVW8_SK0_SKXCCM0_TLDS1_ULSGRO0_USL1_UIOFGRO0_USFGROn1_VSn1_VWA1_VWB1_WSGRA0_WSGRB0_WS32_WG32_4_1_WGM8_WGMXCC1_WGMXCCGn1
    SolutionIndex: 20
    SolutionNameMin: Cijk_Ailk_Bljk_BSS_BH_Bias_S_HA_S_SAV_UserArgs_MT64x64x32_MI16x16x1_SN_LDSB0_AFC1_AFEM1_AFEM1_ASEM32_CLR0_CADS0_DTVA0_DTVB1_EPS0_FDSI0_GRPM1_GRVWA1_GRVWB8_GSU1_GSUAMB_GSUC0_GSUWGMRR0_GLS0_ISA1201_IU1_K1_LBSPPA1024_LBSPPB0_LBSPPM0_LPA16_LPB0_LPM0_LRVW8_LWPMn1_MIAV1_MIWT2_2_MO40_NTn1_NTA0_NTB0_NTC0_NTD0_NTM0_NEPBS0_NLCA1_NLCB2_ONLL1_PGR2_PLR1_PKA0_SIA3_SS0_SU32_SUM0_SUS256_SPO0_SRVW0_SSO0_SVW8_SK0_SKXCCM0_TLDS1_ULSGRO0_USL1_UIOFGRO0_USFGROn1_VSn1_VWA1_VWB1_WSGRA0_WSGRB0_WS32_WG32_4_1_WGM8_WGMXCC1_WGMXCCGn1
    SolutionIndex: 21
    SolutionNameMin: Cijk_Ailk_Bljk_BSS_BH_Bias_S_HA_S_SAV_UserArgs_MT64x64x32_MI16x16x1_SN_LDSB0_AFC1_AFEM1_AFEM1_ASEM32_CLR1_CADS0_DTVA0_DTVB1_EPS1_FDSI0_GRPM1_GRVWA1_GRVWB8_GSU1_GSUAMB_GSUC0_GSUWGMRR0_GLS0_ISA1201_IU1_K1_LBSPPA1024_LBSPPB0_LBSPPM0_LPA16_LPB0_LPM0_LRVW8_LWPMn1_MIAV1_MIWT2_2_MO40_NTn1_NTA0_NTB0_NTC0_NTD0_NTM0_NEPBS0_NLCA1_NLCB2_ONLL1_PGR1_PLR1_PKA0_SIA3_SS0_SU32_SUM0_SUS256_SPO0_SRVW0_SSO0_SVW8_SK0_SKXCCM0_TLDS1_ULSGRO0_USL1_UIOFGRO0_USFGROn1_VSn1_VWA1_VWB1_WSGRA0_WSGRB0_WS32_WG32_4_1_WGM8_WGMXCC1_WGMXCCGn1
    SolutionIndex: 22
    SolutionNameMin: Cijk_Ailk_Bljk_BSS_BH_Bias_S_HA_S_SAV_UserArgs_MT64x64x32_MI16x16x1_SN_LDSB1_AFC1_AFEM1_AFEM1_ASEM32_CLR0_CADS0_DTVA0_DTVB1_EPS0_FDSI0_GRPM1_GRVWA1_GRVWB8_GSU1_GSUAMB_GSUC0_GSUWGMRR0_GLS0_ISA1201_IU1_K1_LBSPPA1024_LBSPPB0_LBSPPM0_LPA16_LPB0_LPM0_LRVW8_LWPMn1_MIAV1_MIWT2_2_MO40_NTn1_NTA0_NTB0_NTC0_NTD0_NTM0_NEPBS0_NLCA1_NLCB2_ONLL1_PGR1_PLR1_PKA0_SIA3_SS0_SU32_SUM0_SUS256_SPO0_SRVW0_SSO0_SVW8_SK0_SKXCCM0_TLDS1_ULSGRO0_USL1_UIOFGRO0_USFGROn1_VSn1_VWA1_VWB1_WSGRA0_WSGRB0_WS32_WG32_4_1_WGM8_WGMXCC1_WGMXCCGn1
    SolutionIndex: 23
    SolutionNameMin: Cijk_Ailk_Bljk_BSS_BH_Bias_S_HA_S_SAV_UserArgs_MT16x16x32_MI16x16x1_SN_LDSB1_AFC1_AFEM1_AFEM1_ASEM32_CLR1_CADS0_DTVA0_DTVB1_EPS0_FDSI0_GRPM1_GRVWA8_GRVWB8_GSU1_GSUAMB_GSUC0_GSUWGMRR0_GLS0_ISA1201_IU1_K1_LBSPPA256_LBSPPB0_LBSPPM0_LPA16_LPB0_LPM0_LRVW8_LWPMn1_MIAV1_MIWT1_1_MO40_NTn1_NTA0_NTB0_NTC0_NTD0_NTM0_NEPBS0_NLCA1_NLCB2_ONLL1_PGR2_PLR1_PKA0_SIA3_SS0_SU32_SUM0_SUS256_SPO0_SRVW0_SSO0_SVW8_SK0_SKXCCM0_TLDS1_ULSGRO0_USL1_UIOFGRO0_USFGROn1_VSn1_VWA1_VWB1_WSGRA0_WSGRB0_WS32_WG16_2_1_WGM8_WGMXCC1_WGMXCCGn1
    SolutionIndex: 24
    SolutionNameMin: Cijk_Ailk_Bljk_BSS_BH_Bias_S_HA_S_SAV_UserArgs_MT64x64x32_MI16x16x1_SN_LDSB1_AFC1_AFEM1_AFEM1_ASEM32_CLR0_CADS0_DTVA0_DTVB1_EPS1_FDSI0_GRPM1_GRVWA8_GRVWB8_GSU1_GSUAMB_GSUC0_GSUWGMRR0_GLS0_ISA1201_IU1_K1_LBSPPA1024_LBSPPB0_LBSPPM0_LPA16_LPB0_LPM0_LRVW8_LWPMn1_MIAV1_MIWT2_2_MO40_NTn1_NTA0_NTB0_NTC0_NTD0_NTM0_NEPBS0_NLCA1_NLCB2_ONLL1_PGR1_PLR1_PKA0_SIA3_SS0_SU32_SUM0_SUS256_SPO0_SRVW0_SSO0_SVW8_SK0_SKXCCM0_TLDS1_ULSGRO0_USL1_UIOFGRO0_USFGROn1_VSn1_VWA1_VWB1_WSGRA0_WSGRB0_WS32_WG32_4_1_WGM8_WGMXCC1_WGMXCCGn1
    SolutionIndex: 25
    SolutionNameMin: Cijk_Ailk_Bljk_BSS_BH_Bias_S_HA_S_SAV_UserArgs_MT64x64x32_MI16x16x1_SN_LDSB0_AFC1_AFEM1_AFEM1_ASEM32_CLR0_CADS0_DTVA0_DTVB1_EPS0_FDSI0_GRPM1_GRVWA1_GRVWB8_GSU1_GSUAMB_GSUC0_GSUWGMRR0_GLS0_ISA1201_IU1_K1_LBSPPA1024_LBSPPB0_LBSPPM0_LPA16_LPB0_LPM0_LRVW8_LWPMn1_MIAV1_MIWT2_2_MO40_NTn1_NTA0_NTB0_NTC0_NTD0_NTM0_NEPBS0_NLCA1_NLCB2_ONLL1_PGR1_PLR1_PKA0_SIA3_SS0_SU32_SUM0_SUS256_SPO0_SRVW0_SSO0_SVW8_SK0_SKXCCM0_TLDS1_ULSGRO0_USL1_UIOFGRO0_USFGROn1_VSn1_VWA1_VWB1_WSGRA0_WSGRB0_WS32_WG32_4_1_WGM8_WGMXCC1_WGMXCCGn1
    SolutionIndex: 26
    SolutionNameMin: Cijk_Ailk_Bljk_BSS_BH_Bias_S_HA_S_SAV_UserArgs_MT64x64x32_MI16x16x1_SN_LDSB1_AFC1_AFEM1_AFEM1_ASEM32_CLR1_CADS0_DTVA0_DTVB1_EPS0_FDSI0_GRPM1_GRVWA1_GRVWB8_GSU1_GSUAMB_GSUC0_GSUWGMRR0_GLS0_ISA1201_IU1_K1_LBSPPA1024_LBSPPB0_LBSPPM0_LPA16_LPB0_LPM0_LRVW8_LWPMn1_MIAV1_MIWT2_2_MO40_NTn1_NTA0_NTB0_NTC0_NTD0_NTM0_NEPBS0_NLCA1_NLCB2_ONLL1_PGR2_PLR1_PKA0_SIA3_SS0_SU32_SUM0_SUS256_SPO0_SRVW0_SSO0_SVW8_SK0_SKXCCM0_TLDS1_ULSGRO0_USL1_UIOFGRO0_USFGROn1_VSn1_VWA1_VWB1_WSGRA0_WSGRB0_WS32_WG32_4_1_WGM8_WGMXCC1_WGMXCCGn1
    SolutionIndex: 27
    SolutionNameMin: Cijk_Ailk_Bljk_BSS_BH_Bias_S_HA_S_SAV_UserArgs_MT16x16x32_MI16x16x1_SN_LDSB0_AFC1_AFEM1_AFEM1_ASEM32_CLR1_CADS0_DTVA0_DTVB1_EPS0_FDSI0_GRPM1_GRVWA8_GRVWB8_GSU1_GSUAMB_GSUC0_GSUWGMRR0_GLS0_ISA1201_IU1_K1_LBSPPA128_LBSPPB0_LBSPPM0_LPA16_LPB0_LPM0_LRVW8_LWPMn1_MIAV1_MIWT1_1_MO40_NTn1_NTA0_NTB0_NTC0_NTD0_NTM0_NEPBS0_NLCA1_NLCB2_ONLL1_PGR2_PLR1_PKA0_SIA3_SS0_SU32_SUM0_SUS256_SPO0_SRVW0_SSO0_SVW8_SK0_SKXCCM0_TLDS2_ULSGRO0_USL1_UIOFGRO0_USFGROn1_VSn1_VWA1_VWB1_WSGRA0_WSGRB0_WS32_WG16_2_1_WGM8_WGMXCC1_WGMXCCGn1
    SolutionIndex: 28
    SolutionNameMin: Cijk_Ailk_Bljk_BSS_BH_Bias_S_HA_S_SAV_UserArgs_MT64x64x32_MI16x16x1_SN_LDSB1_AFC1_AFEM1_AFEM1_ASEM32_CLR0_CADS0_DTVA0_DTVB1_EPS0_FDSI0_GRPM1_GRVWA8_GRVWB8_GSU1_GSUAMB_GSUC0_GSUWGMRR0_GLS0_ISA1201_IU1_K1_LBSPPA1024_LBSPPB0_LBSPPM0_LPA16_LPB0_LPM0_LRVW8_LWPMn1_MIAV1_MIWT2_2_MO40_NTn1_NTA0_NTB0_NTC0_NTD0_NTM0_NEPBS0_NLCA1_NLCB2_ONLL1_PGR2_PLR1_PKA0_SIA3_SS0_SU32_SUM0_SUS256_SPO0_SRVW0_SSO0_SVW8_SK0_SKXCCM0_TLDS1_ULSGRO0_USL1_UIOFGRO0_USFGROn1_VSn1_VWA1_VWB1_WSGRA0_WSGRB0_WS32_WG32_4_1_WGM8_WGMXCC1_WGMXCCGn1
    SolutionIndex: 29
    SolutionNameMin: Cijk_Ailk_Bljk_BSS_BH_Bias_S_HA_S_SAV_UserArgs_MT64x64x32_MI16x16x1_SN_LDSB0_AFC1_AFEM1_AFEM1_ASEM32_CLR0_CADS0_DTVA0_DTVB1_EPS0_FDSI0_GRPM1_GRVWA8_GRVWB8_GSU1_GSUAMB_GSUC0_GSUWGMRR0_GLS0_ISA1201_IU1_K1_LBSPPA1024_LBSPPB0_LBSPPM0_LPA16_LPB0_LPM0_LRVW8_LWPMn1_MIAV1_MIWT2_2_MO40_NTn1_NTA0_NTB0_NTC0_NTD0_NTM0_NEPBS0_NLCA1_NLCB2_ONLL1_PGR1_PLR1_PKA0_SIA3_SS0_SU32_SUM0_SUS256_SPO0_SRVW0_SSO0_SVW8_SK0_SKXCCM0_TLDS1_ULSGRO0_USL1_UIOFGRO0_USFGROn1_VSn1_VWA1_VWB1_WSGRA0_WSGRB0_WS32_WG32_4_1_WGM8_WGMXCC1_WGMXCCGn1
    SolutionIndex: 30
    SolutionNameMin: Cijk_Ailk_Bljk_BSS_BH_Bias_S_HA_S_SAV_UserArgs_MT64x64x32_MI16x16x1_SN_LDSB0_AFC1_AFEM1_AFEM1_ASEM1_CLR1_CADS0_DTVA0_DTVB0_EPS0_FDSI0_GRPM1_GRVWA8_GRVWB8_GSU1_GSUAMB_GSUC0_GSUWGMRR0_GLS0_ISA1201_IU1_K1_LBSPPA1024_LBSPPB128_LBSPPM0_LPA16_LPB16_LPM0_LRVW8_LWPMn1_MIAV1_MIWT2_2_MO40_NTn1_NTA0_NTB0_NTC0_NTD0_NTM0_NEPBS0_NLCA1_NLCB1_ONLL1_PGR2_PLR0_PKA0_SIA1_SS0_SU32_SUM0_SUS256_SPO0_SRVW0_SSO0_SVW8_SK0_SKXCCM0_TLDS1_ULSGRO0_USL1_UIOFGRO0_USFGROn1_VSn1_VWA1_VWB1_WSGRA0_WSGRB0_WS32_WG32_4_1_WGM8_WGMXCC1_WGMXCCGn1
    SolutionIndex: 31
    SolutionNameMin: Cijk_Ailk_Bljk_BSS_BH_Bias_S_HA_S_SAV_UserArgs_MT64x64x32_MI16x16x1_SN_LDSB0_AFC1_AFEM1_AFEM1_ASEM32_CLR1_CADS0_DTVA0_DTVB1_EPS1_FDSI0_GRPM1_GRVWA8_GRVWB8_GSU1_GSUAMB_GSUC0_GSUWGMRR0_GLS0_ISA1201_IU1_K1_LBSPPA1024_LBSPPB0_LBSPPM0_LPA16_LPB0_LPM0_LRVW8_LWPMn1_MIAV1_MIWT2_2_MO40_NTn1_NTA0_NTB0_NTC0_NTD0_NTM0_NEPBS0_NLCA1_NLCB2_ONLL1_PGR1_PLR1_PKA0_SIA3_SS0_SU32_SUM0_SUS256_SPO0_SRVW0_SSO0_SVW8_SK0_SKXCCM0_TLDS1_ULSGRO0_USL1_UIOFGRO0_USFGROn1_VSn1_VWA1_VWB1_WSGRA0_WSGRB0_WS32_WG32_4_1_WGM8_WGMXCC1_WGMXCCGn1
    SolutionIndex: 32
    SolutionNameMin: Cijk_Ailk_Bljk_BSS_BH_Bias_S_HA_S_SAV_UserArgs_MT16x128x32_MI16x16x1_SN_LDSB0_AFC1_AFEM1_AFEM1_ASEM32_CLR0_CADS0_DTVA0_DTVB1_EPS0_FDSI0_GRPM1_GRVWA1_GRVWB8_GSU1_GSUAMB_GSUC0_GSUWGMRR0_GLS0_ISA1201_IU1_K1_LBSPPA256_LBSPPB0_LBSPPM0_LPA16_LPB0_LPM0_LRVW8_LWPMn1_MIAV1_MIWT1_8_MO40_NTn1_NTA0_NTB0_NTC0_NTD0_NTM0_NEPBS0_NLCA1_NLCB2_ONLL1_PGR2_PLR1_PKA0_SIA3_SS0_SU32_SUM0_SUS256_SPO0_SRVW0_SSO0_SVW8_SK0_SKXCCM0_TLDS1_ULSGRO0_USL1_UIOFGRO0_USFGROn1_VSn1_VWA1_VWB1_WSGRA0_WSGRB0_WS32_WG16_2_1_WGM8_WGMXCC1_WGMXCCGn1
    SolutionIndex: 33
    SolutionNameMin: Cijk_Ailk_Bljk_BSS_BH_Bias_S_HA_S_SAV_UserArgs_MT16x128x32_MI16x16x1_SN_LDSB0_AFC1_AFEM1_AFEM1_ASEM32_CLR1_CADS0_DTVA0_DTVB1_EPS0_FDSI0_GRPM1_GRVWA1_GRVWB8_GSU1_GSUAMB_GSUC0_GSUWGMRR0_GLS0_ISA1201_IU1_K1_LBSPPA128_LBSPPB0_LBSPPM0_LPA16_LPB0_LPM0_LRVW8_LWPMn1_MIAV1_MIWT1_8_MO40_NTn1_NTA0_NTB0_NTC0_NTD0_NTM0_NEPBS0_NLCA1_NLCB2_ONLL1_PGR2_PLR1_PKA0_SIA3_SS0_SU32_SUM0_SUS256_SPO0_SRVW0_SSO0_SVW8_SK0_SKXCCM0_TLDS2_ULSGRO0_USL1_UIOFGRO0_USFGROn1_VSn1_VWA1_VWB1_WSGRA0_WSGRB0_WS32_WG16_2_1_WGM8_WGMXCC1_WGMXCCGn1
    SolutionIndex: 34
    SolutionNameMin: Cijk_Ailk_Bljk_BSS_BH_Bias_S_HA_S_SAV_UserArgs_MT16x128x32_MI16x16x1_SN_LDSB0_AFC1_AFEM1_AFEM1_ASEM32_CLR0_CADS0_DTVA0_DTVB1_EPS0_FDSI0_GRPM1_GRVWA1_GRVWB8_GSU1_GSUAMB_GSUC0_GSUWGMRR0_GLS0_ISA1201_IU1_K1_LBSPPA128_LBSPPB0_LBSPPM0_LPA16_LPB0_LPM0_LRVW8_LWPMn1_MIAV1_MIWT1_8_MO40_NTn1_NTA0_NTB0_NTC0_NTD0_NTM0_NEPBS0_NLCA1_NLCB2_ONLL1_PGR1_PLR1_PKA0_SIA3_SS0_SU32_SUM0_SUS256_SPO0_SRVW0_SSO0_SVW8_SK0_SKXCCM0_TLDS2_ULSGRO0_USL1_UIOFGRO0_USFGROn1_VSn1_VWA1_VWB1_WSGRA0_WSGRB0_WS32_WG16_2_1_WGM8_WGMXCC1_WGMXCCGn1
    SolutionIndex: 35
    SolutionNameMin: Cijk_Ailk_Bljk_BSS_BH_Bias_S_HA_S_SAV_UserArgs_MT16x128x32_MI16x16x1_SN_LDSB1_AFC1_AFEM1_AFEM1_ASEM32_CLR1_CADS0_DTVA0_DTVB1_EPS0_FDSI0_GRPM1_GRVWA1_GRVWB8_GSU1_GSUAMB_GSUC0_GSUWGMRR0_GLS0_ISA1201_IU1_K1_LBSPPA128_LBSPPB0_LBSPPM0_LPA16_LPB0_LPM0_LRVW8_LWPMn1_MIAV1_MIWT1_8_MO40_NTn1_NTA0_NTB0_NTC0_NTD0_NTM0_NEPBS0_NLCA1_NLCB2_ONLL1_PGR2_PLR1_PKA0_SIA3_SS0_SU32_SUM0_SUS256_SPO0_SRVW0_SSO0_SVW8_SK0_SKXCCM0_TLDS2_ULSGRO0_USL1_UIOFGRO0_USFGROn1_VSn1_VWA1_VWB1_WSGRA0_WSGRB0_WS32_WG16_2_1_WGM8_WGMXCC1_WGMXCCGn1
    SolutionIndex: 36
    SolutionNameMin: Cijk_Ailk_Bljk_BSS_BH_Bias_S_HA_S_SAV_UserArgs_MT16x128x32_MI16x16x1_SN_LDSB0_AFC1_AFEM1_AFEM1_ASEM32_CLR1_CADS0_DTVA0_DTVB1_EPS1_FDSI0_GRPM1_GRVWA1_GRVWB8_GSU1_GSUAMB_GSUC0_GSUWGMRR0_GLS0_ISA1201_IU1_K1_LBSPPA128_LBSPPB0_LBSPPM0_LPA16_LPB0_LPM0_LRVW8_LWPMn1_MIAV1_MIWT1_8_MO40_NTn1_NTA0_NTB0_NTC0_NTD0_NTM0_NEPBS0_NLCA1_NLCB2_ONLL1_PGR1_PLR1_PKA0_SIA3_SS0_SU32_SUM0_SUS256_SPO0_SRVW0_SSO0_SVW8_SK0_SKXCCM0_TLDS2_ULSGRO0_USL1_UIOFGRO0_USFGROn1_VSn1_VWA1_VWB1_WSGRA0_WSGRB0_WS32_WG16_2_1_WGM8_WGMXCC1_WGMXCCGn1
    SolutionIndex: 37
    SolutionNameMin: Cijk_Ailk_Bljk_BSS_BH_Bias_S_HA_S_SAV_UserArgs_MT64x64x32_MI16x16x1_SN_LDSB1_AFC1_AFEM1_AFEM1_ASEM32_CLR0_CADS0_DTVA0_DTVB1_EPS1_FDSI0_GRPM1_GRVWA1_GRVWB8_GSU1_GSUAMB_GSUC0_GSUWGMRR0_GLS0_ISA1201_IU1_K1_LBSPPA1024_LBSPPB0_LBSPPM0_LPA16_LPB0_LPM0_LRVW8_LWPMn1_MIAV1_MIWT2_2_MO40_NTn1_NTA0_NTB0_NTC0_NTD0_NTM0_NEPBS0_NLCA1_NLCB2_ONLL1_PGR1_PLR1_PKA0_SIA3_SS0_SU32_SUM0_SUS256_SPO0_SRVW0_SSO0_SVW8_SK0_SKXCCM0_TLDS1_ULSGRO0_USL1_UIOFGRO0_USFGROn1_VSn1_VWA1_VWB1_WSGRA0_WSGRB0_WS32_WG32_4_1_WGM8_WGMXCC1_WGMXCCGn1
    SolutionIndex: 38
    SolutionNameMin: Cijk_Ailk_Bljk_BSS_BH_Bias_S_HA_S_SAV_UserArgs_MT16x128x32_MI16x16x1_SN_LDSB1_AFC1_AFEM1_AFEM1_ASEM32_CLR1_CADS0_DTVA0_DTVB1_EPS0_FDSI0_GRPM1_GRVWA1_GRVWB8_GSU1_GSUAMB_GSUC0_GSUWGMRR0_GLS0_ISA1201_IU1_K1_LBSPPA128_LBSPPB0_LBSPPM0_LPA16_LPB0_LPM0_LRVW8_LWPMn1_MIAV1_MIWT1_8_MO40_NTn1_NTA0_NTB0_NTC0_NTD0_NTM0_NEPBS0_NLCA1_NLCB2_ONLL1_PGR1_PLR1_PKA0_SIA3_SS0_SU32_SUM0_SUS256_SPO0_SRVW0_SSO0_SVW8_SK0_SKXCCM0_TLDS2_ULSGRO0_USL1_UIOFGRO0_USFGROn1_VSn1_VWA1_VWB1_WSGRA0_WSGRB0_WS32_WG16_2_1_WGM8_WGMXCC1_WGMXCCGn1
    SolutionIndex: 39
    SolutionNameMin: Cijk_Ailk_Bljk_BSS_BH_Bias_S_HA_S_SAV_UserArgs_MT16x128x32_MI16x16x1_SN_LDSB0_AFC1_AFEM1_AFEM1_ASEM32_CLR0_CADS0_DTVA0_DTVB1_EPS1_FDSI0_GRPM1_GRVWA1_GRVWB8_GSU1_GSUAMB_GSUC0_GSUWGMRR0_GLS0_ISA1201_IU1_K1_LBSPPA128_LBSPPB0_LBSPPM0_LPA16_LPB0_LPM0_LRVW8_LWPMn1_MIAV1_MIWT1_8_MO40_NTn1_NTA0_NTB0_NTC0_NTD0_NTM0_NEPBS0_NLCA1_NLCB2_ONLL1_PGR1_PLR1_PKA0_SIA3_SS0_SU32_SUM0_SUS256_SPO0_SRVW0_SSO0_SVW8_SK0_SKXCCM0_TLDS2_ULSGRO0_USL1_UIOFGRO0_USFGROn1_VSn1_VWA1_VWB1_WSGRA0_WSGRB0_WS32_WG16_2_1_WGM8_WGMXCC1_WGMXCCGn1
    SolutionIndex: 40
    SolutionNameMin: Cijk_Ailk_Bljk_BSS_BH_Bias_S_HA_S_SAV_UserArgs_MT16x128x32_MI16x16x1_SN_LDSB1_AFC1_AFEM1_AFEM1_ASEM32_CLR0_CADS0_DTVA0_DTVB1_EPS1_FDSI0_GRPM1_GRVWA1_GRVWB8_GSU1_GSUAMB_GSUC0_GSUWGMRR0_GLS0_ISA1201_IU1_K1_LBSPPA128_LBSPPB0_LBSPPM0_LPA16_LPB0_LPM0_LRVW8_LWPMn1_MIAV1_MIWT1_8_MO40_NTn1_NTA0_NTB0_NTC0_NTD0_NTM0_NEPBS0_NLCA1_NLCB2_ONLL1_PGR1_PLR1_PKA0_SIA3_SS0_SU32_SUM0_SUS256_SPO0_SRVW0_SSO0_SVW8_SK0_SKXCCM0_TLDS2_ULSGRO0_USL1_UIOFGRO0_USFGROn1_VSn1_VWA1_VWB1_WSGRA0_WSGRB0_WS32_WG16_2_1_WGM8_WGMXCC1_WGMXCCGn1
    SolutionIndex: 41
    SolutionNameMin: Cijk_Ailk_Bljk_BSS_BH_Bias_S_HA_S_SAV_UserArgs_MT16x128x32_MI16x16x1_SN_LDSB0_AFC1_AFEM1_AFEM1_ASEM32_CLR0_CADS0_DTVA0_DTVB1_EPS0_FDSI0_GRPM1_GRVWA1_GRVWB8_GSU1_GSUAMB_GSUC0_GSUWGMRR0_GLS0_ISA1201_IU1_K1_LBSPPA256_LBSPPB0_LBSPPM0_LPA16_LPB0_LPM0_LRVW8_LWPMn1_MIAV1_MIWT1_8_MO40_NTn1_NTA0_NTB0_NTC0_NTD0_NTM0_NEPBS0_NLCA1_NLCB2_ONLL1_PGR1_PLR1_PKA0_SIA3_SS0_SU32_SUM0_SUS256_SPO0_SRVW0_SSO0_SVW8_SK0_SKXCCM0_TLDS1_ULSGRO0_USL1_UIOFGRO0_USFGROn1_VSn1_VWA1_VWB1_WSGRA0_WSGRB0_WS32_WG16_2_1_WGM8_WGMXCC1_WGMXCCGn1
    SolutionIndex: 42
    SolutionNameMin: Cijk_Ailk_Bljk_BSS_BH_Bias_S_HA_S_SAV_UserArgs_MT64x64x32_MI16x16x1_SN_LDSB0_AFC1_AFEM1_AFEM1_ASEM1_CLR1_CADS0_DTVA0_DTVB0_EPS0_FDSI0_GRPM1_GRVWA8_GRVWB8_GSU1_GSUAMB_GSUC0_GSUWGMRR0_GLS0_ISA1201_IU1_K1_LBSPPA1024_LBSPPB1024_LBSPPM0_LPA16_LPB16_LPM0_LRVW8_LWPMn1_MIAV1_MIWT2_2_MO40_NTn1_NTA0_NTB0_NTC0_NTD0_NTM0_NEPBS0_NLCA1_NLCB1_ONLL1_PGR2_PLR1_PKA0_SIA1_SS0_SU32_SUM0_SUS256_SPO0_SRVW0_SSO0_SVW8_SK0_SKXCCM0_TLDS0_ULSGRO0_USL1_UIOFGRO0_USFGROn1_VSn1_VWA1_VWB1_WSGRA0_WSGRB0_WS32_WG32_4_1_WGM8_WGMXCC1_WGMXCCGn1
    SolutionIndex: 43
    SolutionNameMin: Cijk_Ailk_Bljk_BSS_BH_Bias_S_HA_S_SAV_UserArgs_MT16x128x32_MI16x16x1_SN_LDSB1_AFC1_AFEM1_AFEM1_ASEM32_CLR1_CADS0_DTVA0_DTVB1_EPS1_FDSI0_GRPM1_GRVWA1_GRVWB8_GSU1_GSUAMB_GSUC0_GSUWGMRR0_GLS0_ISA1201_IU1_K1_LBSPPA128_LBSPPB0_LBSPPM0_LPA16_LPB0_LPM0_LRVW8_LWPMn1_MIAV1_MIWT1_8_MO40_NTn1_NTA0_NTB0_NTC0_NTD0_NTM0_NEPBS0_NLCA1_NLCB2_ONLL1_PGR1_PLR1_PKA0_SIA3_SS0_SU32_SUM0_SUS256_SPO0_SRVW0_SSO0_SVW8_SK0_SKXCCM0_TLDS2_ULSGRO0_USL1_UIOFGRO0_USFGROn1_VSn1_VWA1_VWB1_WSGRA0_WSGRB0_WS32_WG16_2_1_WGM8_WGMXCC1_WGMXCCGn1
    SolutionIndex: 44
    SolutionNameMin: Cijk_Ailk_Bljk_BSS_BH_Bias_S_HA_S_SAV_UserArgs_MT16x128x32_MI16x16x1_SN_LDSB1_AFC1_AFEM1_AFEM1_ASEM32_CLR0_CADS0_DTVA0_DTVB1_EPS0_FDSI0_GRPM1_GRVWA1_GRVWB8_GSU1_GSUAMB_GSUC0_GSUWGMRR0_GLS0_ISA1201_IU1_K1_LBSPPA256_LBSPPB0_LBSPPM0_LPA16_LPB0_LPM0_LRVW8_LWPMn1_MIAV1_MIWT1_8_MO40_NTn1_NTA0_NTB0_NTC0_NTD0_NTM0_NEPBS0_NLCA1_NLCB2_ONLL1_PGR2_PLR1_PKA0_SIA3_SS0_SU32_SUM0_SUS256_SPO0_SRVW0_SSO0_SVW8_SK0_SKXCCM0_TLDS1_ULSGRO0_USL1_UIOFGRO0_USFGROn1_VSn1_VWA1_VWB1_WSGRA0_WSGRB0_WS32_WG16_2_1_WGM8_WGMXCC1_WGMXCCGn1
    SolutionIndex: 45
    SolutionNameMin: Cijk_Ailk_Bljk_BSS_BH_Bias_S_HA_S_SAV_UserArgs_MT16x128x32_MI16x16x1_SN_LDSB1_AFC1_AFEM1_AFEM1_ASEM32_CLR0_CADS0_DTVA0_DTVB1_EPS0_FDSI0_GRPM1_GRVWA1_GRVWB8_GSU1_GSUAMB_GSUC0_GSUWGMRR0_GLS0_ISA1201_IU1_K1_LBSPPA128_LBSPPB0_LBSPPM0_LPA16_LPB0_LPM0_LRVW8_LWPMn1_MIAV1_MIWT1_8_MO40_NTn1_NTA0_NTB0_NTC0_NTD0_NTM0_NEPBS0_NLCA1_NLCB2_ONLL1_PGR1_PLR1_PKA0_SIA3_SS0_SU32_SUM0_SUS256_SPO0_SRVW0_SSO0_SVW8_SK0_SKXCCM0_TLDS2_ULSGRO0_USL1_UIOFGRO0_USFGROn1_VSn1_VWA1_VWB1_WSGRA0_WSGRB0_WS32_WG16_2_1_WGM8_WGMXCC1_WGMXCCGn1
    SolutionIndex: 46
    SolutionNameMin: Cijk_Ailk_Bljk_BSS_BH_Bias_S_HA_S_SAV_UserArgs_MT16x128x32_MI16x16x1_SN_LDSB1_AFC1_AFEM1_AFEM1_ASEM32_CLR0_CADS0_DTVA0_DTVB1_EPS0_FDSI0_GRPM1_GRVWA1_GRVWB8_GSU1_GSUAMB_GSUC0_GSUWGMRR0_GLS0_ISA1201_IU1_K1_LBSPPA128_LBSPPB0_LBSPPM0_LPA16_LPB0_LPM0_LRVW8_LWPMn1_MIAV1_MIWT1_8_MO40_NTn1_NTA0_NTB0_NTC0_NTD0_NTM0_NEPBS0_NLCA1_NLCB2_ONLL1_PGR2_PLR1_PKA0_SIA3_SS0_SU32_SUM0_SUS256_SPO0_SRVW0_SSO0_SVW8_SK0_SKXCCM0_TLDS2_ULSGRO0_USL1_UIOFGRO0_USFGROn1_VSn1_VWA1_VWB1_WSGRA0_WSGRB0_WS32_WG16_2_1_WGM8_WGMXCC1_WGMXCCGn1
    SolutionIndex: 47
    SolutionNameMin: Cijk_Ailk_Bljk_BSS_BH_Bias_S_HA_S_SAV_UserArgs_MT64x64x32_MI16x16x1_SN_LDSB0_AFC1_AFEM1_AFEM1_ASEM1_CLR1_CADS0_DTVA0_DTVB0_EPS1_FDSI0_GRPM1_GRVWA8_GRVWB8_GSU1_GSUAMB_GSUC0_GSUWGMRR0_GLS0_ISA1201_IU1_K1_LBSPPA1024_LBSPPB128_LBSPPM0_LPA16_LPB16_LPM0_LRVW8_LWPMn1_MIAV1_MIWT2_2_MO40_NTn1_NTA0_NTB0_NTC0_NTD0_NTM0_NEPBS0_NLCA1_NLCB1_ONLL1_PGR1_PLR1_PKA0_SIA3_SS0_SU32_SUM0_SUS256_SPO0_SRVW0_SSO0_SVW8_SK0_SKXCCM0_TLDS1_ULSGRO0_USL1_UIOFGRO0_USFGROn1_VSn1_VWA1_VWB1_WSGRA0_WSGRB0_WS32_WG32_4_1_WGM8_WGMXCC1_WGMXCCGn1
    SolutionIndex: 48
    SolutionNameMin: Cijk_Ailk_Bljk_BSS_BH_Bias_S_HA_S_SAV_UserArgs_MT16x128x32_MI16x16x1_SN_LDSB1_AFC1_AFEM1_AFEM1_ASEM32_CLR0_CADS0_DTVA0_DTVB1_EPS0_FDSI0_GRPM1_GRVWA1_GRVWB8_GSU1_GSUAMB_GSUC0_GSUWGMRR0_GLS0_ISA1201_IU1_K1_LBSPPA256_LBSPPB0_LBSPPM0_LPA16_LPB0_LPM0_LRVW8_LWPMn1_MIAV1_MIWT1_8_MO40_NTn1_NTA0_NTB0_NTC0_NTD0_NTM0_NEPBS0_NLCA1_NLCB2_ONLL1_PGR1_PLR1_PKA0_SIA3_SS0_SU32_SUM0_SUS256_SPO0_SRVW0_SSO0_SVW8_SK0_SKXCCM0_TLDS1_ULSGRO0_USL1_UIOFGRO0_USFGROn1_VSn1_VWA1_VWB1_WSGRA0_WSGRB0_WS32_WG16_2_1_WGM8_WGMXCC1_WGMXCCGn1
    SolutionIndex: 49
    SolutionNameMin: Cijk_Ailk_Bljk_BSS_BH_Bias_S_HA_S_SAV_UserArgs_MT128x128x32_MI16x16x1_SN_LDSB1_AFC1_AFEM1_AFEM1_ASEM1_CLR0_CADS0_DTVA0_DTVB0_EPS1_FDSI0_GRPM1_GRVWA8_GRVWB8_GSU1_GSUAMB_GSUC0_GSUWGMRR0_GLS0_ISA1201_IU1_K1_LBSPPA2048_LBSPPB128_LBSPPM0_LPA0_LPB16_LPM0_LRVW8_LWPMn1_MIAV1_MIWT4_4_MO40_NTn1_NTA0_NTB0_NTC0_NTD0_NTM0_NEPBS0_NLCA1_NLCB1_ONLL1_PGR1_PLR1_PKA0_SIA3_SS1_SU32_SUM0_SUS256_SPO0_SRVW0_SSO0_SVW4_SK0_SKXCCM0_TLDS1_ULSGRO0_USL1_UIOFGRO0_USFGROn1_VSn1_VWA4_VWB1_WSGRA0_WSGRB0_WS32_WG32_4_1_WGM8_WGMXCC1_WGMXCCGn1
    SolutionIndex: 50
    SolutionNameMin: Cijk_Ailk_Bljk_BSS_BH_Bias_S_HA_S_SAV_UserArgs_MT128x128x32_MI16x16x1_SN_LDSB1_AFC1_AFEM1_AFEM1_ASEM1_CLR0_CADS0_DTVA0_DTVB0_EPS0_FDSI0_GRPM1_GRVWA8_GRVWB8_GSU1_GSUAMB_GSUC0_GSUWGMRR0_GLS0_ISA1201_IU1_K1_LBSPPA2048_LBSPPB128_LBSPPM0_LPA0_LPB16_LPM0_LRVW8_LWPMn1_MIAV1_MIWT4_4_MO40_NTn1_NTA0_NTB0_NTC0_NTD0_NTM0_NEPBS0_NLCA1_NLCB1_ONLL1_PGR1_PLR1_PKA0_SIA3_SS1_SU32_SUM0_SUS256_SPO0_SRVW0_SSO0_SVW4_SK0_SKXCCM0_TLDS1_ULSGRO0_USL1_UIOFGRO0_USFGROn1_VSn1_VWA4_VWB1_WSGRA0_WSGRB0_WS32_WG32_4_1_WGM8_WGMXCC1_WGMXCCGn1
    SolutionIndex: 51
    SolutionNameMin: Cijk_Ailk_Bljk_BSS_BH_Bias_S_HA_S_SAV_UserArgs_MT128x128x32_MI16x16x1_SN_LDSB1_AFC1_AFEM1_AFEM1_ASEM1_CLR1_CADS0_DTVA0_DTVB0_EPS0_FDSI0_GRPM1_GRVWA8_GRVWB8_GSU1_GSUAMB_GSUC0_GSUWGMRR0_GLS0_ISA1201_IU1_K1_LBSPPA2048_LBSPPB128_LBSPPM0_LPA0_LPB16_LPM0_LRVW8_LWPMn1_MIAV1_MIWT4_4_MO40_NTn1_NTA0_NTB0_NTC0_NTD0_NTM0_NEPBS0_NLCA1_NLCB1_ONLL1_PGR1_PLR1_PKA0_SIA3_SS1_SU32_SUM0_SUS256_SPO0_SRVW0_SSO0_SVW4_SK0_SKXCCM0_TLDS1_ULSGRO0_USL1_UIOFGRO0_USFGROn1_VSn1_VWA4_VWB1_WSGRA0_WSGRB0_WS32_WG32_4_1_WGM8_WGMXCC1_WGMXCCGn1
    SolutionIndex: 52
    SolutionNameMin: Cijk_Ailk_Bljk_BSS_BH_Bias_S_HA_S_SAV_UserArgs_MT128x128x32_MI16x16x1_SN_LDSB1_AFC1_AFEM1_AFEM1_ASEM1_CLR1_CADS0_DTVA0_DTVB0_EPS1_FDSI0_GRPM1_GRVWA8_GRVWB8_GSU1_GSUAMB_GSUC0_GSUWGMRR0_GLS0_ISA1201_IU1_K1_LBSPPA2048_LBSPPB128_LBSPPM0_LPA0_LPB16_LPM0_LRVW8_LWPMn1_MIAV1_MIWT4_4_MO40_NTn1_NTA0_NTB0_NTC0_NTD0_NTM0_NEPBS0_NLCA1_NLCB1_ONLL1_PGR1_PLR1_PKA0_SIA3_SS1_SU32_SUM0_SUS256_SPO0_SRVW0_SSO0_SVW4_SK0_SKXCCM0_TLDS1_ULSGRO0_USL1_UIOFGRO0_USFGROn1_VSn1_VWA4_VWB1_WSGRA0_WSGRB0_WS32_WG32_4_1_WGM8_WGMXCC1_WGMXCCGn1
    SolutionIndex: 53
    SolutionNameMin: Cijk_Ailk_Bljk_BSS_BH_Bias_S_HA_S_SAV_UserArgs_MT16x128x32_MI16x16x1_SN_LDSB0_AFC1_AFEM1_AFEM1_ASEM32_CLR0_CADS0_DTVA0_DTVB1_EPS1_FDSI0_GRPM1_GRVWA1_GRVWB8_GSU1_GSUAMB_GSUC0_GSUWGMRR0_GLS0_ISA1201_IU1_K1_LBSPPA256_LBSPPB0_LBSPPM0_LPA16_LPB0_LPM0_LRVW8_LWPMn1_MIAV1_MIWT1_8_MO40_NTn1_NTA0_NTB0_NTC0_NTD0_NTM0_NEPBS0_NLCA1_NLCB2_ONLL1_PGR1_PLR1_PKA0_SIA3_SS0_SU32_SUM0_SUS256_SPO0_SRVW0_SSO0_SVW8_SK0_SKXCCM0_TLDS1_ULSGRO0_USL1_UIOFGRO0_USFGROn1_VSn1_VWA1_VWB1_WSGRA0_WSGRB0_WS32_WG16_2_1_WGM8_WGMXCC1_WGMXCCGn1
    SolutionIndex: 54
    SolutionNameMin: Cijk_Ailk_Bljk_BSS_BH_Bias_S_HA_S_SAV_UserArgs_MT128x128x32_MI16x16x1_SN_LDSB1_AFC1_AFEM1_AFEM1_ASEM1_CLR1_CADS0_DTVA0_DTVB0_EPS0_FDSI0_GRPM1_GRVWA8_GRVWB8_GSU1_GSUAMB_GSUC0_GSUWGMRR0_GLS0_ISA1201_IU1_K1_LBSPPA2048_LBSPPB128_LBSPPM0_LPA0_LPB16_LPM0_LRVW8_LWPMn1_MIAV1_MIWT4_4_MO40_NTn1_NTA0_NTB0_NTC0_NTD0_NTM0_NEPBS0_NLCA1_NLCB1_ONLL1_PGR1_PLR0_PKA0_SIA3_SS1_SU32_SUM0_SUS256_SPO0_SRVW0_SSO0_SVW4_SK0_SKXCCM0_TLDS1_ULSGRO0_USL1_UIOFGRO0_USFGROn1_VSn1_VWA4_VWB1_WSGRA0_WSGRB0_WS32_WG32_4_1_WGM8_WGMXCC1_WGMXCCGn1
    SolutionIndex: 55
    SolutionNameMin: Cijk_Ailk_Bljk_BSS_BH_Bias_S_HA_S_SAV_UserArgs_MT128x128x32_MI16x16x1_SN_LDSB1_AFC1_AFEM1_AFEM1_ASEM1_CLR1_CADS0_DTVA0_DTVB0_EPS1_FDSI0_GRPM1_GRVWA8_GRVWB8_GSU1_GSUAMB_GSUC0_GSUWGMRR0_GLS0_ISA1201_IU1_K1_LBSPPA2048_LBSPPB256_LBSPPM0_LPA0_LPB16_LPM0_LRVW8_LWPMn1_MIAV1_MIWT4_4_MO40_NTn1_NTA0_NTB0_NTC0_NTD0_NTM0_NEPBS0_NLCA1_NLCB1_ONLL1_PGR1_PLR1_PKA0_SIA3_SS1_SU32_SUM0_SUS256_SPO0_SRVW0_SSO0_SVW4_SK0_SKXCCM0_TLDS1_ULSGRO0_USL1_UIOFGRO0_USFGROn1_VSn1_VWA4_VWB4_WSGRA0_WSGRB0_WS32_WG32_4_1_WGM8_WGMXCC1_WGMXCCGn1
    SolutionIndex: 56
    SolutionNameMin: Cijk_Ailk_Bljk_BSS_BH_Bias_S_HA_S_SAV_UserArgs_MT128x128x32_MI16x16x1_SN_LDSB1_AFC1_AFEM1_AFEM1_ASEM1_CLR0_CADS0_DTVA0_DTVB0_EPS0_FDSI0_GRPM1_GRVWA8_GRVWB8_GSU1_GSUAMB_GSUC0_GSUWGMRR0_GLS0_ISA1201_IU1_K1_LBSPPA2048_LBSPPB256_LBSPPM0_LPA0_LPB16_LPM0_LRVW8_LWPMn1_MIAV1_MIWT4_4_MO40_NTn1_NTA0_NTB0_NTC0_NTD0_NTM0_NEPBS0_NLCA1_NLCB1_ONLL1_PGR1_PLR1_PKA0_SIA3_SS1_SU32_SUM0_SUS256_SPO0_SRVW0_SSO0_SVW4_SK0_SKXCCM0_TLDS1_ULSGRO0_USL1_UIOFGRO0_USFGROn1_VSn1_VWA4_VWB4_WSGRA0_WSGRB0_WS32_WG32_4_1_WGM8_WGMXCC1_WGMXCCGn1
    SolutionIndex: 57
    SolutionNameMin: Cijk_Ailk_Bljk_BSS_BH_Bias_S_HA_S_SAV_UserArgs_MT64x64x32_MI16x16x1_SN_LDSB1_AFC1_AFEM1_AFEM1_ASEM32_CLR1_CADS0_DTVA0_DTVB1_EPS0_FDSI0_GRPM1_GRVWA8_GRVWB8_GSU1_GSUAMB_GSUC0_GSUWGMRR0_GLS0_ISA1201_IU1_K1_LBSPPA1024_LBSPPB0_LBSPPM0_LPA16_LPB0_LPM0_LRVW8_LWPMn1_MIAV1_MIWT2_2_MO40_NTn1_NTA0_NTB0_NTC0_NTD0_NTM0_NEPBS0_NLCA1_NLCB2_ONLL1_PGR1_PLR1_PKA0_SIA3_SS0_SU32_SUM0_SUS256_SPO0_SRVW0_SSO0_SVW8_SK0_SKXCCM0_TLDS1_ULSGRO0_USL1_UIOFGRO0_USFGROn1_VSn1_VWA1_VWB1_WSGRA0_WSGRB0_WS32_WG32_4_1_WGM8_WGMXCC1_WGMXCCGn1
    SolutionIndex: 58
    SolutionNameMin: Cijk_Ailk_Bljk_BSS_BH_Bias_S_HA_S_SAV_UserArgs_MT16x128x32_MI16x16x1_SN_LDSB0_AFC1_AFEM1_AFEM1_ASEM32_CLR1_CADS0_DTVA0_DTVB1_EPS0_FDSI0_GRPM1_GRVWA1_GRVWB8_GSU1_GSUAMB_GSUC0_GSUWGMRR0_GLS0_ISA1201_IU1_K1_LBSPPA256_LBSPPB0_LBSPPM0_LPA16_LPB0_LPM0_LRVW8_LWPMn1_MIAV1_MIWT1_8_MO40_NTn1_NTA0_NTB0_NTC0_NTD0_NTM0_NEPBS0_NLCA1_NLCB2_ONLL1_PGR1_PLR1_PKA0_SIA3_SS0_SU32_SUM0_SUS256_SPO0_SRVW0_SSO0_SVW8_SK0_SKXCCM0_TLDS1_ULSGRO0_USL1_UIOFGRO0_USFGROn1_VSn1_VWA1_VWB1_WSGRA0_WSGRB0_WS32_WG16_2_1_WGM8_WGMXCC1_WGMXCCGn1
    SolutionIndex: 59
    SolutionNameMin: Cijk_Ailk_Bljk_BSS_BH_Bias_S_HA_S_SAV_UserArgs_MT128x128x32_MI16x16x1_SN_LDSB1_AFC1_AFEM1_AFEM1_ASEM1_CLR1_CADS0_DTVA0_DTVB0_EPS1_FDSI0_GRPM1_GRVWA8_GRVWB8_GSU1_GSUAMB_GSUC0_GSUWGMRR0_GLS0_ISA1201_IU1_K1_LBSPPA2048_LBSPPB256_LBSPPM0_LPA0_LPB16_LPM0_LRVW8_LWPMn1_MIAV1_MIWT4_4_MO40_NTn1_NTA0_NTB0_NTC0_NTD0_NTM0_NEPBS0_NLCA1_NLCB1_ONLL1_PGR1_PLR0_PKA0_SIA3_SS1_SU32_SUM0_SUS256_SPO0_SRVW0_SSO0_SVW4_SK0_SKXCCM0_TLDS1_ULSGRO0_USL1_UIOFGRO0_USFGROn1_VSn1_VWA4_VWB4_WSGRA0_WSGRB0_WS32_WG32_4_1_WGM8_WGMXCC1_WGMXCCGn1
    SolutionIndex: 60
    SolutionNameMin: Cijk_Ailk_Bljk_BSS_BH_Bias_S_HA_S_SAV_UserArgs_MT128x128x32_MI16x16x1_SN_LDSB1_AFC1_AFEM1_AFEM1_ASEM1_CLR1_CADS0_DTVA0_DTVB0_EPS0_FDSI0_GRPM1_GRVWA8_GRVWB8_GSU1_GSUAMB_GSUC0_GSUWGMRR0_GLS0_ISA1201_IU1_K1_LBSPPA2048_LBSPPB256_LBSPPM0_LPA0_LPB16_LPM0_LRVW8_LWPMn1_MIAV1_MIWT4_4_MO40_NTn1_NTA0_NTB0_NTC0_NTD0_NTM0_NEPBS0_NLCA1_NLCB1_ONLL1_PGR1_PLR1_PKA0_SIA3_SS1_SU32_SUM0_SUS256_SPO0_SRVW0_SSO0_SVW4_SK0_SKXCCM0_TLDS1_ULSGRO0_USL1_UIOFGRO0_USFGROn1_VSn1_VWA4_VWB4_WSGRA0_WSGRB0_WS32_WG32_4_1_WGM8_WGMXCC1_WGMXCCGn1
    SolutionIndex: 61
    SolutionNameMin: Cijk_Ailk_Bljk_BSS_BH_Bias_S_HA_S_SAV_UserArgs_MT128x128x32_MI16x16x1_SN_LDSB1_AFC1_AFEM1_AFEM1_ASEM1_CLR1_CADS0_DTVA0_DTVB0_EPS1_FDSI0_GRPM1_GRVWA8_GRVWB8_GSU1_GSUAMB_GSUC0_GSUWGMRR0_GLS0_ISA1201_IU1_K1_LBSPPA2048_LBSPPB128_LBSPPM0_LPA0_LPB16_LPM0_LRVW8_LWPMn1_MIAV1_MIWT4_4_MO40_NTn1_NTA0_NTB0_NTC0_NTD0_NTM0_NEPBS0_NLCA1_NLCB1_ONLL1_PGR1_PLR0_PKA0_SIA3_SS1_SU32_SUM0_SUS256_SPO0_SRVW0_SSO0_SVW4_SK0_SKXCCM0_TLDS1_ULSGRO0_USL1_UIOFGRO0_USFGROn1_VSn1_VWA4_VWB1_WSGRA0_WSGRB0_WS32_WG32_4_1_WGM8_WGMXCC1_WGMXCCGn1
    SolutionIndex: 62
    SolutionNameMin: Cijk_Ailk_Bljk_BSS_BH_Bias_S_HA_S_SAV_UserArgs_MT64x64x32_MI16x16x1_SN_LDSB0_AFC1_AFEM1_AFEM1_ASEM1_CLR0_CADS0_DTVA0_DTVB0_EPS0_FDSI0_GRPM1_GRVWA8_GRVWB8_GSU1_GSUAMB_GSUC0_GSUWGMRR0_GLS0_ISA1201_IU1_K1_LBSPPA1024_LBSPPB128_LBSPPM0_LPA16_LPB16_LPM0_LRVW8_LWPMn1_MIAV1_MIWT2_2_MO40_NTn1_NTA0_NTB0_NTC0_NTD0_NTM0_NEPBS0_NLCA1_NLCB1_ONLL1_PGR1_PLR0_PKA0_SIA1_SS0_SU32_SUM0_SUS256_SPO0_SRVW0_SSO0_SVW8_SK0_SKXCCM0_TLDS1_ULSGRO0_USL1_UIOFGRO0_USFGROn1_VSn1_VWA1_VWB1_WSGRA0_WSGRB0_WS32_WG32_4_1_WGM8_WGMXCC1_WGMXCCGn1
    SolutionIndex: 63
    SolutionNameMin: Cijk_Ailk_Bljk_BSS_BH_Bias_S_HA_S_SAV_UserArgs_MT128x128x32_MI16x16x1_SN_LDSB1_AFC1_AFEM1_AFEM1_ASEM1_CLR1_CADS0_DTVA0_DTVB0_EPS0_FDSI0_GRPM1_GRVWA8_GRVWB8_GSU1_GSUAMB_GSUC0_GSUWGMRR0_GLS0_ISA1201_IU1_K1_LBSPPA2048_LBSPPB256_LBSPPM0_LPA0_LPB16_LPM0_LRVW8_LWPMn1_MIAV1_MIWT4_4_MO40_NTn1_NTA0_NTB0_NTC0_NTD0_NTM0_NEPBS0_NLCA1_NLCB1_ONLL1_PGR2_PLR1_PKA0_SIA3_SS1_SU32_SUM0_SUS256_SPO0_SRVW0_SSO0_SVW4_SK0_SKXCCM0_TLDS1_ULSGRO0_USL1_UIOFGRO0_USFGROn1_VSn1_VWA4_VWB4_WSGRA0_WSGRB0_WS32_WG32_4_1_WGM8_WGMXCC1_WGMXCCGn1
    SolutionIndex: 64
    SolutionNameMin: Cijk_Ailk_Bljk_BSS_BH_Bias_S_HA_S_SAV_UserArgs_MT64x64x32_MI16x16x1_SN_LDSB0_AFC1_AFEM1_AFEM1_ASEM1_CLR0_CADS0_DTVA0_DTVB0_EPS0_FDSI0_GRPM1_GRVWA8_GRVWB8_GSU1_GSUAMB_GSUC0_GSUWGMRR0_GLS0_ISA1201_IU1_K1_LBSPPA1024_LBSPPB128_LBSPPM0_LPA16_LPB16_LPM0_LRVW8_LWPMn1_MIAV1_MIWT2_2_MO40_NTn1_NTA0_NTB0_NTC0_NTD0_NTM0_NEPBS0_NLCA1_NLCB1_ONLL1_PGR1_PLR1_PKA0_SIA1_SS0_SU32_SUM0_SUS256_SPO0_SRVW0_SSO0_SVW8_SK0_SKXCCM0_TLDS1_ULSGRO0_USL1_UIOFGRO0_USFGROn1_VSn1_VWA1_VWB1_WSGRA0_WSGRB0_WS32_WG32_4_1_WGM8_WGMXCC1_WGMXCCGn1
    SolutionIndex: 65
    SolutionNameMin: Cijk_Ailk_Bljk_BSS_BH_Bias_S_HA_S_SAV_UserArgs_MT128x128x32_MI16x16x1_SN_LDSB1_AFC1_AFEM1_AFEM1_ASEM1_CLR0_CADS0_DTVA0_DTVB0_EPS1_FDSI0_GRPM1_GRVWA8_GRVWB8_GSU1_GSUAMB_GSUC0_GSUWGMRR0_GLS0_ISA1201_IU1_K1_LBSPPA2048_LBSPPB256_LBSPPM0_LPA0_LPB16_LPM0_LRVW8_LWPMn1_MIAV1_MIWT4_4_MO40_NTn1_NTA0_NTB0_NTC0_NTD0_NTM0_NEPBS0_NLCA1_NLCB1_ONLL1_PGR1_PLR1_PKA0_SIA3_SS1_SU32_SUM0_SUS256_SPO0_SRVW0_SSO0_SVW4_SK0_SKXCCM0_TLDS1_ULSGRO0_USL1_UIOFGRO0_USFGROn1_VSn1_VWA4_VWB4_WSGRA0_WSGRB0_WS32_WG32_4_1_WGM8_WGMXCC1_WGMXCCGn1
    SolutionIndex: 66
    SolutionNameMin: Cijk_Ailk_Bljk_BSS_BH_Bias_S_HA_S_SAV_UserArgs_MT16x128x32_MI16x16x1_SN_LDSB0_AFC1_AFEM1_AFEM1_ASEM32_CLR1_CADS0_DTVA0_DTVB1_EPS1_FDSI0_GRPM1_GRVWA8_GRVWB8_GSU1_GSUAMB_GSUC0_GSUWGMRR0_GLS0_ISA1201_IU1_K1_LBSPPA128_LBSPPB0_LBSPPM0_LPA16_LPB0_LPM0_LRVW8_LWPMn1_MIAV1_MIWT1_8_MO40_NTn1_NTA0_NTB0_NTC0_NTD0_NTM0_NEPBS0_NLCA1_NLCB2_ONLL1_PGR1_PLR1_PKA0_SIA3_SS0_SU32_SUM0_SUS256_SPO0_SRVW0_SSO0_SVW8_SK0_SKXCCM0_TLDS2_ULSGRO0_USL1_UIOFGRO0_USFGROn1_VSn1_VWA1_VWB1_WSGRA0_WSGRB0_WS32_WG16_2_1_WGM8_WGMXCC1_WGMXCCGn1
    SolutionIndex: 67
    SolutionNameMin: Cijk_Ailk_Bljk_BSS_BH_Bias_S_HA_S_SAV_UserArgs_MT16x16x32_MI16x16x1_SN_LDSB0_AFC1_AFEM1_AFEM1_ASEM32_CLR1_CADS0_DTVA0_DTVB1_EPS0_FDSI0_GRPM1_GRVWA8_GRVWB8_GSU1_GSUAMB_GSUC0_GSUWGMRR0_GLS0_ISA1201_IU1_K1_LBSPPA256_LBSPPB0_LBSPPM0_LPA16_LPB0_LPM0_LRVW8_LWPMn1_MIAV1_MIWT1_1_MO40_NTn1_NTA0_NTB0_NTC0_NTD0_NTM0_NEPBS0_NLCA1_NLCB2_ONLL1_PGR2_PLR1_PKA0_SIA3_SS0_SU32_SUM0_SUS256_SPO0_SRVW0_SSO0_SVW8_SK0_SKXCCM0_TLDS1_ULSGRO0_USL1_UIOFGRO0_USFGROn1_VSn1_VWA1_VWB1_WSGRA0_WSGRB0_WS32_WG16_2_1_WGM8_WGMXCC1_WGMXCCGn1
    SolutionIndex: 68
    SolutionNameMin: Cijk_Ailk_Bljk_BSS_BH_Bias_S_HA_S_SAV_UserArgs_MT64x64x32_MI16x16x1_SN_LDSB0_AFC1_AFEM1_AFEM1_ASEM1_CLR0_CADS0_DTVA0_DTVB0_EPS0_FDSI0_GRPM1_GRVWA8_GRVWB8_GSU1_GSUAMB_GSUC0_GSUWGMRR0_GLS0_ISA1201_IU1_K1_LBSPPA1024_LBSPPB128_LBSPPM0_LPA16_LPB16_LPM0_LRVW8_LWPMn1_MIAV1_MIWT2_2_MO40_NTn1_NTA0_NTB0_NTC0_NTD0_NTM0_NEPBS0_NLCA1_NLCB1_ONLL1_PGR2_PLR1_PKA0_SIA1_SS0_SU32_SUM0_SUS256_SPO0_SRVW0_SSO0_SVW8_SK0_SKXCCM0_TLDS1_ULSGRO0_USL1_UIOFGRO0_USFGROn1_VSn1_VWA1_VWB1_WSGRA0_WSGRB0_WS32_WG32_4_1_WGM8_WGMXCC1_WGMXCCGn1
    SolutionIndex: 69
    SolutionNameMin: Cijk_Ailk_Bljk_BSS_BH_Bias_S_HA_S_SAV_UserArgs_MT64x64x32_MI16x16x1_SN_LDSB0_AFC1_AFEM1_AFEM1_ASEM1_CLR1_CADS0_DTVA0_DTVB0_EPS0_FDSI0_GRPM1_GRVWA8_GRVWB8_GSU1_GSUAMB_GSUC0_GSUWGMRR0_GLS0_ISA1201_IU1_K1_LBSPPA1024_LBSPPB128_LBSPPM0_LPA16_LPB16_LPM0_LRVW8_LWPMn1_MIAV1_MIWT2_2_MO40_NTn1_NTA0_NTB0_NTC0_NTD0_NTM0_NEPBS0_NLCA1_NLCB1_ONLL1_PGR2_PLR1_PKA0_SIA3_SS0_SU32_SUM0_SUS256_SPO0_SRVW0_SSO0_SVW8_SK0_SKXCCM0_TLDS1_ULSGRO0_USL1_UIOFGRO0_USFGROn1_VSn1_VWA1_VWB1_WSGRA0_WSGRB0_WS32_WG32_4_1_WGM8_WGMXCC1_WGMXCCGn1
    SolutionIndex: 70
    SolutionNameMin: Cijk_Ailk_Bljk_BSS_BH_Bias_S_HA_S_SAV_UserArgs_MT64x64x32_MI16x16x1_SN_LDSB0_AFC1_AFEM1_AFEM1_ASEM32_CLR1_CADS0_DTVA0_DTVB1_EPS0_FDSI0_GRPM1_GRVWA8_GRVWB8_GSU1_GSUAMB_GSUC0_GSUWGMRR0_GLS0_ISA1201_IU1_K1_LBSPPA1024_LBSPPB0_LBSPPM0_LPA16_LPB0_LPM0_LRVW8_LWPMn1_MIAV1_MIWT2_2_MO40_NTn1_NTA0_NTB0_NTC0_NTD0_NTM0_NEPBS0_NLCA1_NLCB2_ONLL1_PGR2_PLR1_PKA0_SIA3_SS0_SU32_SUM0_SUS256_SPO0_SRVW0_SSO0_SVW8_SK0_SKXCCM0_TLDS1_ULSGRO0_USL1_UIOFGRO0_USFGROn1_VSn1_VWA1_VWB1_WSGRA0_WSGRB0_WS32_WG32_4_1_WGM8_WGMXCC1_WGMXCCGn1
    SolutionIndex: 71
    SolutionNameMin: Cijk_Ailk_Bljk_BSS_BH_Bias_S_HA_S_SAV_UserArgs_MT16x16x32_MI16x16x1_SN_LDSB1_AFC1_AFEM1_AFEM1_ASEM32_CLR0_CADS0_DTVA0_DTVB1_EPS0_FDSI0_GRPM1_GRVWA8_GRVWB8_GSU1_GSUAMB_GSUC0_GSUWGMRR0_GLS0_ISA1201_IU1_K1_LBSPPA256_LBSPPB0_LBSPPM0_LPA16_LPB0_LPM0_LRVW8_LWPMn1_MIAV1_MIWT1_1_MO40_NTn1_NTA0_NTB0_NTC0_NTD0_NTM0_NEPBS0_NLCA1_NLCB2_ONLL1_PGR2_PLR1_PKA0_SIA3_SS1_SU32_SUM0_SUS256_SPO0_SRVW0_SSO0_SVW1_SK0_SKXCCM0_TLDS1_ULSGRO0_USL1_UIOFGRO0_USFGROn1_VSn1_VWA1_VWB1_WSGRA0_WSGRB0_WS32_WG16_2_1_WGM8_WGMXCC1_WGMXCCGn1
    SolutionIndex: 72
    SolutionNameMin: Cijk_Ailk_Bljk_BSS_BH_Bias_S_HA_S_SAV_UserArgs_MT64x64x32_MI16x16x1_SN_LDSB0_AFC1_AFEM1_AFEM1_ASEM32_CLR0_CADS0_DTVA0_DTVB1_EPS0_FDSI0_GRPM1_GRVWA8_GRVWB8_GSU1_GSUAMB_GSUC0_GSUWGMRR0_GLS0_ISA1201_IU1_K1_LBSPPA1024_LBSPPB0_LBSPPM0_LPA16_LPB0_LPM0_LRVW8_LWPMn1_MIAV1_MIWT2_2_MO40_NTn1_NTA0_NTB0_NTC0_NTD0_NTM0_NEPBS0_NLCA1_NLCB2_ONLL1_PGR2_PLR1_PKA0_SIA3_SS1_SU32_SUM0_SUS256_SPO0_SRVW0_SSO0_SVW1_SK0_SKXCCM0_TLDS1_ULSGRO0_USL1_UIOFGRO0_USFGROn1_VSn1_VWA1_VWB1_WSGRA0_WSGRB0_WS32_WG32_4_1_WGM8_WGMXCC1_WGMXCCGn1
    SolutionIndex: 73
    SolutionNameMin: Cijk_Ailk_Bljk_BSS_BH_Bias_S_HA_S_SAV_UserArgs_MT128x128x32_MI16x16x1_SN_LDSB1_AFC1_AFEM1_AFEM1_ASEM1_CLR0_CADS0_DTVA0_DTVB0_EPS0_FDSI0_GRPM1_GRVWA8_GRVWB8_GSU1_GSUAMB_GSUC0_GSUWGMRR0_GLS0_ISA1201_IU1_K1_LBSPPA2048_LBSPPB128_LBSPPM0_LPA0_LPB16_LPM0_LRVW8_LWPMn1_MIAV1_MIWT4_4_MO40_NTn1_NTA0_NTB0_NTC0_NTD0_NTM0_NEPBS0_NLCA1_NLCB1_ONLL1_PGR2_PLR1_PKA0_SIA3_SS1_SU32_SUM0_SUS256_SPO0_SRVW0_SSO0_SVW4_SK0_SKXCCM0_TLDS1_ULSGRO0_USL1_UIOFGRO0_USFGROn1_VSn1_VWA4_VWB1_WSGRA0_WSGRB0_WS32_WG32_4_1_WGM8_WGMXCC1_WGMXCCGn1
    SolutionIndex: 74
    SolutionNameMin: Cijk_Ailk_Bljk_BSS_BH_Bias_S_HA_S_SAV_UserArgs_MT128x128x32_MI16x16x1_SN_LDSB1_AFC1_AFEM1_AFEM1_ASEM1_CLR0_CADS0_DTVA0_DTVB0_EPS0_FDSI0_GRPM1_GRVWA8_GRVWB8_GSU1_GSUAMB_GSUC0_GSUWGMRR0_GLS0_ISA1201_IU1_K1_LBSPPA2048_LBSPPB256_LBSPPM0_LPA0_LPB16_LPM0_LRVW8_LWPMn1_MIAV1_MIWT4_4_MO40_NTn1_NTA0_NTB0_NTC0_NTD0_NTM0_NEPBS0_NLCA1_NLCB1_ONLL1_PGR2_PLR1_PKA0_SIA3_SS1_SU32_SUM0_SUS256_SPO0_SRVW0_SSO0_SVW4_SK0_SKXCCM0_TLDS1_ULSGRO0_USL1_UIOFGRO0_USFGROn1_VSn1_VWA4_VWB4_WSGRA0_WSGRB0_WS32_WG32_4_1_WGM8_WGMXCC1_WGMXCCGn1
    SolutionIndex: 75
    SolutionNameMin: Cijk_Ailk_Bljk_BSS_BH_Bias_S_HA_S_SAV_UserArgs_MT128x128x32_MI16x16x1_SN_LDSB1_AFC1_AFEM1_AFEM1_ASEM1_CLR1_CADS0_DTVA0_DTVB0_EPS0_FDSI0_GRPM1_GRVWA8_GRVWB8_GSU1_GSUAMB_GSUC0_GSUWGMRR0_GLS0_ISA1201_IU1_K1_LBSPPA2048_LBSPPB256_LBSPPM0_LPA0_LPB16_LPM0_LRVW8_LWPMn1_MIAV1_MIWT4_4_MO40_NTn1_NTA0_NTB0_NTC0_NTD0_NTM0_NEPBS0_NLCA1_NLCB1_ONLL1_PGR2_PLR0_PKA0_SIA3_SS1_SU32_SUM0_SUS256_SPO0_SRVW0_SSO0_SVW4_SK0_SKXCCM0_TLDS1_ULSGRO0_USL1_UIOFGRO0_USFGROn1_VSn1_VWA4_VWB4_WSGRA0_WSGRB0_WS32_WG32_4_1_WGM8_WGMXCC1_WGMXCCGn1
    SolutionIndex: 76
    SolutionNameMin: Cijk_Ailk_Bljk_BSS_BH_Bias_S_HA_S_SAV_UserArgs_MT128x128x32_MI16x16x1_SN_LDSB1_AFC1_AFEM1_AFEM1_ASEM1_CLR1_CADS0_DTVA0_DTVB0_EPS0_FDSI0_GRPM1_GRVWA8_GRVWB8_GSU1_GSUAMB_GSUC0_GSUWGMRR0_GLS0_ISA1201_IU1_K1_LBSPPA2048_LBSPPB128_LBSPPM0_LPA0_LPB16_LPM0_LRVW8_LWPMn1_MIAV1_MIWT4_4_MO40_NTn1_NTA0_NTB0_NTC0_NTD0_NTM0_NEPBS0_NLCA1_NLCB1_ONLL1_PGR2_PLR0_PKA0_SIA3_SS1_SU32_SUM0_SUS256_SPO0_SRVW0_SSO0_SVW4_SK0_SKXCCM0_TLDS1_ULSGRO0_USL1_UIOFGRO0_USFGROn1_VSn1_VWA4_VWB1_WSGRA0_WSGRB0_WS32_WG32_4_1_WGM8_WGMXCC1_WGMXCCGn1
    SolutionIndex: 77
    SolutionNameMin: Cijk_Ailk_Bljk_BSS_BH_Bias_S_HA_S_SAV_UserArgs_MT128x128x32_MI16x16x1_SN_LDSB1_AFC1_AFEM1_AFEM1_ASEM1_CLR1_CADS0_DTVA0_DTVB0_EPS0_FDSI0_GRPM1_GRVWA8_GRVWB8_GSU1_GSUAMB_GSUC0_GSUWGMRR0_GLS0_ISA1201_IU1_K1_LBSPPA2048_LBSPPB128_LBSPPM0_LPA0_LPB16_LPM0_LRVW8_LWPMn1_MIAV1_MIWT4_4_MO40_NTn1_NTA0_NTB0_NTC0_NTD0_NTM0_NEPBS0_NLCA1_NLCB1_ONLL1_PGR2_PLR1_PKA0_SIA3_SS1_SU32_SUM0_SUS256_SPO0_SRVW0_SSO0_SVW4_SK0_SKXCCM0_TLDS1_ULSGRO0_USL1_UIOFGRO0_USFGROn1_VSn1_VWA4_VWB1_WSGRA0_WSGRB0_WS32_WG32_4_1_WGM8_WGMXCC1_WGMXCCGn1
    SolutionIndex: 78
    SolutionNameMin: Cijk_Ailk_Bljk_BSS_BH_Bias_S_HA_S_SAV_UserArgs_MT16x16x32_MI16x16x1_SN_LDSB0_AFC1_AFEM1_AFEM1_ASEM1_CLR0_CADS0_DTVA0_DTVB0_EPS0_FDSI0_GRPM1_GRVWA8_GRVWB8_GSU1_GSUAMB_GSUC0_GSUWGMRR0_GLS0_ISA1201_IU1_K1_LBSPPA256_LBSPPB128_LBSPPM0_LPA16_LPB16_LPM0_LRVW8_LWPMn1_MIAV1_MIWT1_1_MO40_NTn1_NTA0_NTB0_NTC0_NTD0_NTM0_NEPBS0_NLCA1_NLCB1_ONLL1_PGR2_PLR1_PKA0_SIA1_SS0_SU32_SUM0_SUS256_SPO0_SRVW0_SSO0_SVW8_SK0_SKXCCM0_TLDS1_ULSGRO0_USL1_UIOFGRO0_USFGROn1_VSn1_VWA1_VWB1_WSGRA0_WSGRB0_WS32_WG16_2_1_WGM8_WGMXCC1_WGMXCCGn1
    SolutionIndex: 79
    SolutionNameMin: Cijk_Ailk_Bljk_BSS_BH_Bias_S_HA_S_SAV_UserArgs_MT16x16x32_MI16x16x1_SN_LDSB1_AFC1_AFEM1_AFEM1_ASEM1_CLR1_CADS0_DTVA0_DTVB0_EPS0_FDSI0_GRPM1_GRVWA8_GRVWB8_GSU1_GSUAMB_GSUC0_GSUWGMRR0_GLS0_ISA1201_IU1_K1_LBSPPA256_LBSPPB128_LBSPPM0_LPA16_LPB16_LPM0_LRVW8_LWPMn1_MIAV1_MIWT1_1_MO40_NTn1_NTA0_NTB0_NTC0_NTD0_NTM0_NEPBS0_NLCA1_NLCB1_ONLL1_PGR2_PLR0_PKA0_SIA3_SS0_SU32_SUM0_SUS256_SPO0_SRVW0_SSO0_SVW8_SK0_SKXCCM0_TLDS1_ULSGRO0_USL1_UIOFGRO0_USFGROn1_VSn1_VWA1_VWB1_WSGRA0_WSGRB0_WS32_WG16_2_1_WGM8_WGMXCC1_WGMXCCGn1
    SolutionIndex: 80
    SolutionNameMin: Cijk_Ailk_Bljk_BSS_BH_Bias_S_HA_S_SAV_UserArgs_MT16x16x32_MI16x16x1_SN_LDSB1_AFC1_AFEM1_AFEM1_ASEM32_CLR1_CADS0_DTVA0_DTVB1_EPS0_FDSI0_GRPM1_GRVWA8_GRVWB8_GSU1_GSUAMB_GSUC0_GSUWGMRR0_GLS0_ISA1201_IU1_K1_LBSPPA256_LBSPPB0_LBSPPM0_LPA16_LPB0_LPM0_LRVW8_LWPMn1_MIAV1_MIWT1_1_MO40_NTn1_NTA0_NTB0_NTC0_NTD0_NTM0_NEPBS0_NLCA1_NLCB2_ONLL1_PGR2_PLR1_PKA0_SIA3_SS1_SU32_SUM0_SUS256_SPO0_SRVW0_SSO0_SVW1_SK0_SKXCCM0_TLDS1_ULSGRO0_USL1_UIOFGRO0_USFGROn1_VSn1_VWA1_VWB1_WSGRA0_WSGRB0_WS32_WG16_2_1_WGM8_WGMXCC1_WGMXCCGn1
    SolutionIndex: 81
    SolutionNameMin: Cijk_Ailk_Bljk_BSS_BH_Bias_S_HA_S_SAV_UserArgs_MT16x16x32_MI16x16x1_SN_LDSB0_AFC1_AFEM1_AFEM1_ASEM32_CLR0_CADS0_DTVA0_DTVB1_EPS0_FDSI0_GRPM1_GRVWA8_GRVWB8_GSU1_GSUAMB_GSUC0_GSUWGMRR0_GLS0_ISA1201_IU1_K1_LBSPPA256_LBSPPB0_LBSPPM0_LPA16_LPB0_LPM0_LRVW8_LWPMn1_MIAV1_MIWT1_1_MO40_NTn1_NTA0_NTB0_NTC0_NTD0_NTM0_NEPBS0_NLCA1_NLCB2_ONLL1_PGR2_PLR1_PKA0_SIA3_SS0_SU32_SUM0_SUS256_SPO0_SRVW0_SSO0_SVW8_SK0_SKXCCM0_TLDS1_ULSGRO0_USL1_UIOFGRO0_USFGROn1_VSn1_VWA1_VWB1_WSGRA0_WSGRB0_WS32_WG16_2_1_WGM8_WGMXCC1_WGMXCCGn1
    SolutionIndex: 82
    SolutionNameMin: Cijk_Ailk_Bljk_BSS_BH_Bias_S_HA_S_SAV_UserArgs_MT16x16x32_MI16x16x1_SN_LDSB1_AFC1_AFEM1_AFEM1_ASEM32_CLR0_CADS0_DTVA0_DTVB1_EPS0_FDSI0_GRPM1_GRVWA8_GRVWB8_GSU1_GSUAMB_GSUC0_GSUWGMRR0_GLS0_ISA1201_IU1_K1_LBSPPA256_LBSPPB0_LBSPPM0_LPA16_LPB0_LPM0_LRVW8_LWPMn1_MIAV1_MIWT1_1_MO40_NTn1_NTA0_NTB0_NTC0_NTD0_NTM0_NEPBS0_NLCA1_NLCB2_ONLL1_PGR2_PLR1_PKA0_SIA3_SS0_SU32_SUM0_SUS256_SPO0_SRVW0_SSO0_SVW8_SK0_SKXCCM0_TLDS1_ULSGRO0_USL1_UIOFGRO0_USFGROn1_VSn1_VWA1_VWB1_WSGRA0_WSGRB0_WS32_WG16_2_1_WGM8_WGMXCC1_WGMXCCGn1
    SolutionIndex: 83
    SolutionNameMin: Cijk_Ailk_Bljk_BSS_BH_Bias_S_HA_S_SAV_UserArgs_MT128x128x32_MI16x16x1_SN_LDSB1_AFC1_AFEM1_AFEM1_ASEM1_CLR0_CADS0_DTVA0_DTVB0_EPS0_FDSI0_GRPM1_GRVWA8_GRVWB8_GSU1_GSUAMB_GSUC0_GSUWGMRR0_GLS0_ISA1201_IU1_K1_LBSPPA2048_LBSPPB256_LBSPPM0_LPA0_LPB16_LPM0_LRVW8_LWPMn1_MIAV1_MIWT4_4_MO40_NTn1_NTA0_NTB0_NTC0_NTD0_NTM0_NEPBS0_NLCA1_NLCB1_ONLL1_PGR2_PLR1_PKA0_SIA3_SS0_SU32_SUM0_SUS256_SPO0_SRVW0_SSO0_SVW8_SK0_SKXCCM0_TLDS1_ULSGRO0_USL1_UIOFGRO0_USFGROn1_VSn1_VWA4_VWB4_WSGRA0_WSGRB0_WS32_WG32_4_1_WGM8_WGMXCC1_WGMXCCGn1
    SolutionIndex: 84
    SolutionNameMin: Cijk_Ailk_Bljk_BSS_BH_Bias_S_HA_S_SAV_UserArgs_MT128x128x32_MI16x16x1_SN_LDSB1_AFC1_AFEM1_AFEM1_ASEM1_CLR1_CADS0_DTVA0_DTVB0_EPS0_FDSI0_GRPM1_GRVWA8_GRVWB8_GSU1_GSUAMB_GSUC0_GSUWGMRR0_GLS0_ISA1201_IU1_K1_LBSPPA2048_LBSPPB128_LBSPPM0_LPA0_LPB16_LPM0_LRVW8_LWPMn1_MIAV1_MIWT4_4_MO40_NTn1_NTA0_NTB0_NTC0_NTD0_NTM0_NEPBS0_NLCA1_NLCB1_ONLL1_PGR2_PLR1_PKA0_SIA3_SS0_SU32_SUM0_SUS256_SPO0_SRVW0_SSO0_SVW8_SK0_SKXCCM0_TLDS1_ULSGRO0_USL1_UIOFGRO0_USFGROn1_VSn1_VWA4_VWB1_WSGRA0_WSGRB0_WS32_WG32_4_1_WGM8_WGMXCC1_WGMXCCGn1
    SolutionIndex: 85
    SolutionNameMin: Cijk_Ailk_Bljk_BSS_BH_Bias_S_HA_S_SAV_UserArgs_MT128x128x32_MI16x16x1_SN_LDSB1_AFC1_AFEM1_AFEM1_ASEM1_CLR0_CADS0_DTVA0_DTVB0_EPS0_FDSI0_GRPM1_GRVWA8_GRVWB8_GSU1_GSUAMB_GSUC0_GSUWGMRR0_GLS0_ISA1201_IU1_K1_LBSPPA2048_LBSPPB128_LBSPPM0_LPA0_LPB16_LPM0_LRVW8_LWPMn1_MIAV1_MIWT4_4_MO40_NTn1_NTA0_NTB0_NTC0_NTD0_NTM0_NEPBS0_NLCA1_NLCB1_ONLL1_PGR2_PLR1_PKA0_SIA3_SS0_SU32_SUM0_SUS256_SPO0_SRVW0_SSO0_SVW8_SK0_SKXCCM0_TLDS1_ULSGRO0_USL1_UIOFGRO0_USFGROn1_VSn1_VWA4_VWB1_WSGRA0_WSGRB0_WS32_WG32_4_1_WGM8_WGMXCC1_WGMXCCGn1
    SolutionIndex: 86
    SolutionNameMin: Cijk_Ailk_Bljk_BSS_BH_Bias_S_HA_S_SAV_UserArgs_MT64x64x32_MI16x16x1_SN_LDSB0_AFC1_AFEM1_AFEM1_ASEM32_CLR1_CADS0_DTVA0_DTVB1_EPS0_FDSI0_GRPM1_GRVWA8_GRVWB8_GSU1_GSUAMB_GSUC0_GSUWGMRR0_GLS0_ISA1201_IU1_K1_LBSPPA1024_LBSPPB0_LBSPPM0_LPA16_LPB0_LPM0_LRVW8_LWPMn1_MIAV1_MIWT2_2_MO40_NTn1_NTA0_NTB0_NTC0_NTD0_NTM0_NEPBS0_NLCA1_NLCB2_ONLL1_PGR2_PLR1_PKA0_SIA3_SS1_SU32_SUM0_SUS256_SPO0_SRVW0_SSO0_SVW1_SK0_SKXCCM0_TLDS1_ULSGRO0_USL1_UIOFGRO0_USFGROn1_VSn1_VWA1_VWB1_WSGRA0_WSGRB0_WS32_WG32_4_1_WGM8_WGMXCC1_WGMXCCGn1
    SolutionIndex: 87
    SolutionNameMin: Cijk_Ailk_Bljk_BSS_BH_Bias_S_HA_S_SAV_UserArgs_MT128x128x32_MI16x16x1_SN_LDSB1_AFC1_AFEM1_AFEM1_ASEM1_CLR1_CADS0_DTVA0_DTVB0_EPS0_FDSI0_GRPM1_GRVWA8_GRVWB8_GSU1_GSUAMB_GSUC0_GSUWGMRR0_GLS0_ISA1201_IU1_K1_LBSPPA2048_LBSPPB256_LBSPPM0_LPA0_LPB16_LPM0_LRVW8_LWPMn1_MIAV1_MIWT4_4_MO40_NTn1_NTA0_NTB0_NTC0_NTD0_NTM0_NEPBS0_NLCA1_NLCB1_ONLL1_PGR2_PLR1_PKA0_SIA3_SS0_SU32_SUM0_SUS256_SPO0_SRVW0_SSO0_SVW8_SK0_SKXCCM0_TLDS1_ULSGRO0_USL1_UIOFGRO0_USFGROn1_VSn1_VWA4_VWB4_WSGRA0_WSGRB0_WS32_WG32_4_1_WGM8_WGMXCC1_WGMXCCGn1
    SolutionIndex: 88
    SolutionNameMin: Cijk_Ailk_Bljk_BSS_BH_Bias_S_HA_S_SAV_UserArgs_MT128x128x32_MI16x16x1_SN_LDSB1_AFC1_AFEM1_AFEM1_ASEM1_CLR1_CADS0_DTVA0_DTVB0_EPS1_FDSI0_GRPM1_GRVWA8_GRVWB8_GSU1_GSUAMB_GSUC0_GSUWGMRR0_GLS0_ISA1201_IU1_K1_LBSPPA2048_LBSPPB128_LBSPPM0_LPA0_LPB16_LPM0_LRVW8_LWPMn1_MIAV1_MIWT4_4_MO40_NTn1_NTA0_NTB0_NTC0_NTD0_NTM0_NEPBS0_NLCA1_NLCB1_ONLL1_PGR1_PLR0_PKA0_SIA3_SS0_SU32_SUM0_SUS256_SPO0_SRVW0_SSO0_SVW8_SK0_SKXCCM0_TLDS1_ULSGRO0_USL1_UIOFGRO0_USFGROn1_VSn1_VWA4_VWB1_WSGRA0_WSGRB0_WS32_WG32_4_1_WGM8_WGMXCC1_WGMXCCGn1
    SolutionIndex: 89
    SolutionNameMin: Cijk_Ailk_Bljk_BSS_BH_Bias_S_HA_S_SAV_UserArgs_MT16x16x32_MI16x16x1_SN_LDSB1_AFC1_AFEM1_AFEM1_ASEM1_CLR0_CADS0_DTVA0_DTVB0_EPS0_FDSI0_GRPM1_GRVWA8_GRVWB8_GSU1_GSUAMB_GSUC0_GSUWGMRR0_GLS0_ISA1201_IU1_K1_LBSPPA256_LBSPPB128_LBSPPM0_LPA16_LPB16_LPM0_LRVW8_LWPMn1_MIAV1_MIWT1_1_MO40_NTn1_NTA0_NTB0_NTC0_NTD0_NTM0_NEPBS0_NLCA1_NLCB1_ONLL1_PGR2_PLR1_PKA0_SIA3_SS0_SU32_SUM0_SUS256_SPO0_SRVW0_SSO0_SVW8_SK0_SKXCCM0_TLDS1_ULSGRO0_USL1_UIOFGRO0_USFGROn1_VSn1_VWA1_VWB1_WSGRA0_WSGRB0_WS32_WG16_2_1_WGM8_WGMXCC1_WGMXCCGn1
    SolutionIndex: 90
    SolutionNameMin: Cijk_Ailk_Bljk_BSS_BH_Bias_S_HA_S_SAV_UserArgs_MT16x16x32_MI16x16x1_SN_LDSB0_AFC1_AFEM1_AFEM1_ASEM1_CLR1_CADS0_DTVA0_DTVB0_EPS0_FDSI0_GRPM1_GRVWA8_GRVWB8_GSU1_GSUAMB_GSUC0_GSUWGMRR0_GLS0_ISA1201_IU1_K1_LBSPPA256_LBSPPB128_LBSPPM0_LPA16_LPB16_LPM0_LRVW8_LWPMn1_MIAV1_MIWT1_1_MO40_NTn1_NTA0_NTB0_NTC0_NTD0_NTM0_NEPBS0_NLCA1_NLCB1_ONLL1_PGR2_PLR1_PKA0_SIA1_SS0_SU32_SUM0_SUS256_SPO0_SRVW0_SSO0_SVW8_SK0_SKXCCM0_TLDS1_ULSGRO0_USL1_UIOFGRO0_USFGROn1_VSn1_VWA1_VWB1_WSGRA0_WSGRB0_WS32_WG16_2_1_WGM8_WGMXCC1_WGMXCCGn1
    SolutionIndex: 91
    SolutionNameMin: Cijk_Ailk_Bljk_BSS_BH_Bias_S_HA_S_SAV_UserArgs_MT128x128x32_MI16x16x1_SN_LDSB0_AFC1_AFEM1_AFEM1_ASEM1_CLR0_CADS0_DTVA0_DTVB0_EPS0_FDSI0_GRPM1_GRVWA8_GRVWB8_GSU1_GSUAMB_GSUC0_GSUWGMRR0_GLS0_ISA1201_IU1_K1_LBSPPA2048_LBSPPB128_LBSPPM0_LPA0_LPB16_LPM0_LRVW8_LWPMn1_MIAV1_MIWT4_4_MO40_NTn1_NTA0_NTB0_NTC0_NTD0_NTM0_NEPBS0_NLCA1_NLCB1_ONLL1_PGR2_PLR0_PKA0_SIA1_SS1_SU32_SUM0_SUS256_SPO0_SRVW0_SSO0_SVW4_SK0_SKXCCM0_TLDS1_ULSGRO0_USL1_UIOFGRO0_USFGROn1_VSn1_VWA4_VWB1_WSGRA0_WSGRB0_WS32_WG32_4_1_WGM8_WGMXCC1_WGMXCCGn1
    SolutionIndex: 92
    SolutionNameMin: Cijk_Ailk_Bljk_BSS_BH_Bias_S_HA_S_SAV_UserArgs_MT128x128x32_MI16x16x1_SN_LDSB0_AFC1_AFEM1_AFEM1_ASEM1_CLR1_CADS0_DTVA0_DTVB0_EPS0_FDSI0_GRPM1_GRVWA8_GRVWB8_GSU1_GSUAMB_GSUC0_GSUWGMRR0_GLS0_ISA1201_IU1_K1_LBSPPA2048_LBSPPB256_LBSPPM0_LPA0_LPB16_LPM0_LRVW8_LWPMn1_MIAV1_MIWT4_4_MO40_NTn1_NTA0_NTB0_NTC0_NTD0_NTM0_NEPBS0_NLCA1_NLCB1_ONLL1_PGR2_PLR0_PKA0_SIA1_SS1_SU32_SUM0_SUS256_SPO0_SRVW0_SSO0_SVW4_SK0_SKXCCM0_TLDS1_ULSGRO0_USL1_UIOFGRO0_USFGROn1_VSn1_VWA4_VWB4_WSGRA0_WSGRB0_WS32_WG32_4_1_WGM8_WGMXCC1_WGMXCCGn1
    SolutionIndex: 93
    SolutionNameMin: Cijk_Ailk_Bljk_BSS_BH_Bias_S_HA_S_SAV_UserArgs_MT128x128x32_MI16x16x1_SN_LDSB0_AFC1_AFEM1_AFEM1_ASEM1_CLR1_CADS0_DTVA0_DTVB0_EPS0_FDSI0_GRPM1_GRVWA8_GRVWB8_GSU1_GSUAMB_GSUC0_GSUWGMRR0_GLS0_ISA1201_IU1_K1_LBSPPA2048_LBSPPB256_LBSPPM0_LPA0_LPB16_LPM0_LRVW8_LWPMn1_MIAV1_MIWT4_4_MO40_NTn1_NTA0_NTB0_NTC0_NTD0_NTM0_NEPBS0_NLCA1_NLCB1_ONLL1_PGR2_PLR1_PKA0_SIA3_SS1_SU32_SUM0_SUS256_SPO0_SRVW0_SSO0_SVW4_SK0_SKXCCM0_TLDS1_ULSGRO0_USL1_UIOFGRO0_USFGROn1_VSn1_VWA4_VWB4_WSGRA0_WSGRB0_WS32_WG32_4_1_WGM8_WGMXCC1_WGMXCCGn1
    SolutionIndex: 94
    SolutionNameMin: Cijk_Ailk_Bljk_BSS_BH_Bias_S_HA_S_SAV_UserArgs_MT128x128x32_MI16x16x1_SN_LDSB0_AFC1_AFEM1_AFEM1_ASEM1_CLR0_CADS0_DTVA0_DTVB0_EPS0_FDSI0_GRPM1_GRVWA8_GRVWB8_GSU1_GSUAMB_GSUC0_GSUWGMRR0_GLS0_ISA1201_IU1_K1_LBSPPA2048_LBSPPB128_LBSPPM0_LPA0_LPB16_LPM0_LRVW8_LWPMn1_MIAV1_MIWT4_4_MO40_NTn1_NTA0_NTB0_NTC0_NTD0_NTM0_NEPBS0_NLCA1_NLCB1_ONLL1_PGR2_PLR0_PKA0_SIA1_SS0_SU32_SUM0_SUS256_SPO0_SRVW0_SSO0_SVW8_SK0_SKXCCM0_TLDS1_ULSGRO0_USL1_UIOFGRO0_USFGROn1_VSn1_VWA4_VWB1_WSGRA0_WSGRB0_WS32_WG32_4_1_WGM8_WGMXCC1_WGMXCCGn1
    SolutionIndex: 95
    SolutionNameMin: Cijk_Ailk_Bljk_BSS_BH_Bias_S_HA_S_SAV_UserArgs_MT128x128x32_MI16x16x1_SN_LDSB0_AFC1_AFEM1_AFEM1_ASEM1_CLR0_CADS0_DTVA0_DTVB0_EPS0_FDSI0_GRPM1_GRVWA8_GRVWB8_GSU1_GSUAMB_GSUC0_GSUWGMRR0_GLS0_ISA1201_IU1_K1_LBSPPA2048_LBSPPB256_LBSPPM0_LPA0_LPB16_LPM0_LRVW8_LWPMn1_MIAV1_MIWT4_4_MO40_NTn1_NTA0_NTB0_NTC0_NTD0_NTM0_NEPBS0_NLCA1_NLCB1_ONLL1_PGR2_PLR1_PKA0_SIA3_SS0_SU32_SUM0_SUS256_SPO0_SRVW0_SSO0_SVW8_SK0_SKXCCM0_TLDS1_ULSGRO0_USL1_UIOFGRO0_USFGROn1_VSn1_VWA4_VWB4_WSGRA0_WSGRB0_WS32_WG32_4_1_WGM8_WGMXCC1_WGMXCCGn1
    SolutionIndex: 97
    SolutionNameMin: Cijk_Ailk_Bljk_BSS_BH_Bias_S_HA_S_SAV_UserArgs_MT64x64x32_MI16x16x1_SN_LDSB0_AFC1_AFEM1_AFEM1_ASEM32_CLR1_CADS0_DTVA0_DTVB1_EPS1_FDSI0_GRPM1_GRVWA8_GRVWB8_GSU1_GSUAMB_GSUC0_GSUWGMRR0_GLS0_ISA1201_IU1_K1_LBSPPA1024_LBSPPB0_LBSPPM0_LPA16_LPB0_LPM0_LRVW8_LWPMn1_MIAV1_MIWT2_2_MO40_NTn1_NTA0_NTB0_NTC0_NTD0_NTM0_NEPBS0_NLCA1_NLCB2_ONLL1_PGR1_PLR1_PKA0_SIA3_SS1_SU32_SUM0_SUS256_SPO0_SRVW0_SSO0_SVW1_SK0_SKXCCM0_TLDS1_ULSGRO0_USL1_UIOFGRO0_USFGROn1_VSn1_VWA1_VWB1_WSGRA0_WSGRB0_WS32_WG32_4_1_WGM8_WGMXCC1_WGMXCCGn1
    SolutionIndex: 98
    SolutionNameMin: Cijk_Ailk_Bljk_BSS_BH_Bias_S_HA_S_SAV_UserArgs_MT64x64x32_MI16x16x1_SN_LDSB1_AFC1_AFEM1_AFEM1_ASEM32_CLR0_CADS0_DTVA0_DTVB1_EPS0_FDSI0_GRPM1_GRVWA8_GRVWB8_GSU1_GSUAMB_GSUC0_GSUWGMRR0_GLS0_ISA1201_IU1_K1_LBSPPA1024_LBSPPB0_LBSPPM0_LPA16_LPB0_LPM0_LRVW8_LWPMn1_MIAV1_MIWT2_2_MO40_NTn1_NTA0_NTB0_NTC0_NTD0_NTM0_NEPBS0_NLCA1_NLCB2_ONLL1_PGR2_PLR1_PKA0_SIA3_SS1_SU32_SUM0_SUS256_SPO0_SRVW0_SSO0_SVW1_SK0_SKXCCM0_TLDS1_ULSGRO0_USL1_UIOFGRO0_USFGROn1_VSn1_VWA1_VWB1_WSGRA0_WSGRB0_WS32_WG32_4_1_WGM8_WGMXCC1_WGMXCCGn1
    SolutionIndex: 99
    SolutionNameMin: Cijk_Ailk_Bljk_BSS_BH_Bias_S_HA_S_SAV_UserArgs_MT64x64x32_MI16x16x1_SN_LDSB1_AFC1_AFEM1_AFEM1_ASEM32_CLR1_CADS0_DTVA0_DTVB1_EPS0_FDSI0_GRPM1_GRVWA8_GRVWB8_GSU1_GSUAMB_GSUC0_GSUWGMRR0_GLS0_ISA1201_IU1_K1_LBSPPA1024_LBSPPB0_LBSPPM0_LPA16_LPB0_LPM0_LRVW8_LWPMn1_MIAV1_MIWT2_2_MO40_NTn1_NTA0_NTB0_NTC0_NTD0_NTM0_NEPBS0_NLCA1_NLCB2_ONLL1_PGR2_PLR1_PKA0_SIA3_SS1_SU32_SUM0_SUS256_SPO0_SRVW0_SSO0_SVW1_SK0_SKXCCM0_TLDS1_ULSGRO0_USL1_UIOFGRO0_USFGROn1_VSn1_VWA1_VWB1_WSGRA0_WSGRB0_WS32_WG32_4_1_WGM8_WGMXCC1_WGMXCCGn1
    SolutionIndex: 100
    SolutionNameMin: Cijk_Ailk_Bljk_BSS_BH_Bias_S_HA_S_SAV_UserArgs_MT128x128x32_MI16x16x1_SN_LDSB0_AFC1_AFEM1_AFEM1_ASEM1_CLR0_CADS0_DTVA0_DTVB0_EPS0_FDSI0_GRPM1_GRVWA8_GRVWB8_GSU1_GSUAMB_GSUC0_GSUWGMRR0_GLS0_ISA1201_IU1_K1_LBSPPA2048_LBSPPB256_LBSPPM0_LPA0_LPB16_LPM0_LRVW8_LWPMn1_MIAV1_MIWT4_4_MO40_NTn1_NTA0_NTB0_NTC0_NTD0_NTM0_NEPBS0_NLCA1_NLCB1_ONLL1_PGR2_PLR0_PKA0_SIA1_SS0_SU32_SUM0_SUS256_SPO0_SRVW0_SSO0_SVW8_SK0_SKXCCM0_TLDS1_ULSGRO0_USL1_UIOFGRO0_USFGROn1_VSn1_VWA4_VWB4_WSGRA0_WSGRB0_WS32_WG32_4_1_WGM8_WGMXCC1_WGMXCCGn1
    SolutionIndex: 101
    SolutionNameMin: Cijk_Ailk_Bljk_BSS_BH_Bias_S_HA_S_SAV_UserArgs_MT128x128x32_MI16x16x1_SN_LDSB0_AFC1_AFEM1_AFEM1_ASEM1_CLR1_CADS0_DTVA0_DTVB0_EPS0_FDSI0_GRPM1_GRVWA8_GRVWB8_GSU1_GSUAMB_GSUC0_GSUWGMRR0_GLS0_ISA1201_IU1_K1_LBSPPA2048_LBSPPB256_LBSPPM0_LPA0_LPB16_LPM0_LRVW8_LWPMn1_MIAV1_MIWT4_4_MO40_NTn1_NTA0_NTB0_NTC0_NTD0_NTM0_NEPBS0_NLCA1_NLCB1_ONLL1_PGR2_PLR1_PKA0_SIA3_SS0_SU32_SUM0_SUS256_SPO0_SRVW0_SSO0_SVW8_SK0_SKXCCM0_TLDS1_ULSGRO0_USL1_UIOFGRO0_USFGROn1_VSn1_VWA4_VWB4_WSGRA0_WSGRB0_WS32_WG32_4_1_WGM8_WGMXCC1_WGMXCCGn1
    SolutionIndex: 102
    SolutionNameMin: Cijk_Ailk_Bljk_BSS_BH_Bias_S_HA_S_SAV_UserArgs_MT16x16x32_MI16x16x1_SN_LDSB1_AFC1_AFEM1_AFEM1_ASEM1_CLR1_CADS0_DTVA0_DTVB0_EPS0_FDSI0_GRPM1_GRVWA8_GRVWB8_GSU1_GSUAMB_GSUC0_GSUWGMRR0_GLS0_ISA1201_IU1_K1_LBSPPA128_LBSPPB128_LBSPPM0_LPA16_LPB16_LPM0_LRVW8_LWPMn1_MIAV1_MIWT1_1_MO40_NTn1_NTA0_NTB0_NTC0_NTD0_NTM0_NEPBS0_NLCA1_NLCB1_ONLL1_PGR2_PLR1_PKA0_SIA3_SS0_SU32_SUM0_SUS256_SPO0_SRVW0_SSO0_SVW8_SK0_SKXCCM0_TLDS2_ULSGRO0_USL1_UIOFGRO0_USFGROn1_VSn1_VWA1_VWB1_WSGRA0_WSGRB0_WS32_WG16_2_1_WGM8_WGMXCC1_WGMXCCGn1
    SolutionIndex: 103
    SolutionNameMin: Cijk_Ailk_Bljk_BSS_BH_Bias_S_HA_S_SAV_UserArgs_MT16x16x32_MI16x16x1_SN_LDSB0_AFC1_AFEM1_AFEM1_ASEM32_CLR0_CADS0_DTVA0_DTVB1_EPS0_FDSI0_GRPM1_GRVWA8_GRVWB8_GSU1_GSUAMB_GSUC0_GSUWGMRR0_GLS0_ISA1201_IU1_K1_LBSPPA128_LBSPPB0_LBSPPM0_LPA16_LPB0_LPM0_LRVW8_LWPMn1_MIAV1_MIWT1_1_MO40_NTn1_NTA0_NTB0_NTC0_NTD0_NTM0_NEPBS0_NLCA1_NLCB2_ONLL1_PGR1_PLR1_PKA0_SIA3_SS0_SU32_SUM0_SUS256_SPO0_SRVW0_SSO0_SVW8_SK0_SKXCCM0_TLDS2_ULSGRO0_USL1_UIOFGRO0_USFGROn1_VSn1_VWA1_VWB1_WSGRA0_WSGRB0_WS32_WG16_2_1_WGM8_WGMXCC1_WGMXCCGn1
    SolutionIndex: 104
    SolutionNameMin: Cijk_Ailk_Bljk_BSS_BH_Bias_S_HA_S_SAV_UserArgs_MT64x64x32_MI16x16x1_SN_LDSB0_AFC1_AFEM1_AFEM1_ASEM1_CLR0_CADS0_DTVA0_DTVB0_EPS0_FDSI0_GRPM1_GRVWA1_GRVWB8_GSU1_GSUAMB_GSUC0_GSUWGMRR0_GLS0_ISA1201_IU1_K1_LBSPPA1024_LBSPPB128_LBSPPM0_LPA16_LPB16_LPM0_LRVW8_LWPMn1_MIAV1_MIWT2_2_MO40_NTn1_NTA0_NTB0_NTC0_NTD0_NTM0_NEPBS0_NLCA1_NLCB1_ONLL1_PGR1_PLR1_PKA0_SIA1_SS0_SU32_SUM0_SUS256_SPO0_SRVW0_SSO0_SVW8_SK0_SKXCCM0_TLDS1_ULSGRO0_USL1_UIOFGRO0_USFGROn1_VSn1_VWA1_VWB1_WSGRA0_WSGRB0_WS32_WG32_4_1_WGM8_WGMXCC1_WGMXCCGn1
    SolutionIndex: 105
    SolutionNameMin: Cijk_Ailk_Bljk_BSS_BH_Bias_S_HA_S_SAV_UserArgs_MT64x64x32_MI16x16x1_SN_LDSB0_AFC1_AFEM1_AFEM1_ASEM1_CLR0_CADS0_DTVA0_DTVB0_EPS1_FDSI0_GRPM1_GRVWA8_GRVWB8_GSU1_GSUAMB_GSUC0_GSUWGMRR0_GLS0_ISA1201_IU1_K1_LBSPPA1024_LBSPPB128_LBSPPM0_LPA16_LPB16_LPM0_LRVW8_LWPMn1_MIAV1_MIWT2_2_MO40_NTn1_NTA0_NTB0_NTC0_NTD0_NTM0_NEPBS0_NLCA1_NLCB1_ONLL1_PGR1_PLR1_PKA0_SIA1_SS0_SU32_SUM0_SUS256_SPO0_SRVW0_SSO0_SVW8_SK0_SKXCCM0_TLDS1_ULSGRO0_USL1_UIOFGRO0_USFGROn1_VSn1_VWA1_VWB1_WSGRA0_WSGRB0_WS32_WG32_4_1_WGM8_WGMXCC1_WGMXCCGn1
    SolutionIndex: 106
    SolutionNameMin: Cijk_Ailk_Bljk_BSS_BH_Bias_S_HA_S_SAV_UserArgs_MT64x64x32_MI16x16x1_SN_LDSB0_AFC1_AFEM1_AFEM1_ASEM1_CLR0_CADS0_DTVA0_DTVB0_EPS1_FDSI0_GRPM1_GRVWA1_GRVWB8_GSU1_GSUAMB_GSUC0_GSUWGMRR0_GLS0_ISA1201_IU1_K1_LBSPPA1024_LBSPPB128_LBSPPM0_LPA16_LPB16_LPM0_LRVW8_LWPMn1_MIAV1_MIWT2_2_MO40_NTn1_NTA0_NTB0_NTC0_NTD0_NTM0_NEPBS0_NLCA1_NLCB1_ONLL1_PGR1_PLR1_PKA0_SIA1_SS0_SU32_SUM0_SUS256_SPO0_SRVW0_SSO0_SVW8_SK0_SKXCCM0_TLDS1_ULSGRO0_USL1_UIOFGRO0_USFGROn1_VSn1_VWA1_VWB1_WSGRA0_WSGRB0_WS32_WG32_4_1_WGM8_WGMXCC1_WGMXCCGn1
    SolutionIndex: 107
    SolutionNameMin: Cijk_Ailk_Bljk_BSS_BH_Bias_S_HA_S_SAV_UserArgs_MT64x64x32_MI16x16x1_SN_LDSB0_AFC1_AFEM1_AFEM1_ASEM1_CLR1_CADS0_DTVA0_DTVB0_EPS0_FDSI0_GRPM1_GRVWA1_GRVWB8_GSU1_GSUAMB_GSUC0_GSUWGMRR0_GLS0_ISA1201_IU1_K1_LBSPPA1024_LBSPPB128_LBSPPM0_LPA16_LPB16_LPM0_LRVW8_LWPMn1_MIAV1_MIWT2_2_MO40_NTn1_NTA0_NTB0_NTC0_NTD0_NTM0_NEPBS0_NLCA1_NLCB1_ONLL1_PGR2_PLR1_PKA0_SIA1_SS0_SU32_SUM0_SUS256_SPO0_SRVW0_SSO0_SVW8_SK0_SKXCCM0_TLDS1_ULSGRO0_USL1_UIOFGRO0_USFGROn1_VSn1_VWA1_VWB1_WSGRA0_WSGRB0_WS32_WG32_4_1_WGM8_WGMXCC1_WGMXCCGn1
    SolutionIndex: 108
    SolutionNameMin: Cijk_Ailk_Bljk_BSS_BH_Bias_S_HA_S_SAV_UserArgs_MT64x64x32_MI16x16x1_SN_LDSB0_AFC1_AFEM1_AFEM1_ASEM1_CLR1_CADS0_DTVA0_DTVB0_EPS1_FDSI0_GRPM1_GRVWA8_GRVWB8_GSU1_GSUAMB_GSUC0_GSUWGMRR0_GLS0_ISA1201_IU1_K1_LBSPPA1024_LBSPPB128_LBSPPM0_LPA16_LPB16_LPM0_LRVW8_LWPMn1_MIAV1_MIWT2_2_MO40_NTn1_NTA0_NTB0_NTC0_NTD0_NTM0_NEPBS0_NLCA1_NLCB1_ONLL1_PGR1_PLR1_PKA0_SIA1_SS0_SU32_SUM0_SUS256_SPO0_SRVW0_SSO0_SVW8_SK0_SKXCCM0_TLDS1_ULSGRO0_USL1_UIOFGRO0_USFGROn1_VSn1_VWA1_VWB1_WSGRA0_WSGRB0_WS32_WG32_4_1_WGM8_WGMXCC1_WGMXCCGn1
    SolutionIndex: 109
    SolutionNameMin: Cijk_Ailk_Bljk_BSS_BH_Bias_S_HA_S_SAV_UserArgs_MT64x64x32_MI16x16x1_SN_LDSB0_AFC1_AFEM1_AFEM1_ASEM1_CLR1_CADS0_DTVA0_DTVB0_EPS0_FDSI0_GRPM1_GRVWA1_GRVWB1_GSU1_GSUAMB_GSUC0_GSUWGMRR0_GLS0_ISA1201_IU1_K1_LBSPPA1024_LBSPPB128_LBSPPM0_LPA16_LPB16_LPM0_LRVW8_LWPMn1_MIAV1_MIWT2_2_MO40_NTn1_NTA0_NTB0_NTC0_NTD0_NTM0_NEPBS0_NLCA1_NLCB1_ONLL1_PGR2_PLR1_PKA0_SIA1_SS0_SU32_SUM0_SUS256_SPO0_SRVW0_SSO0_SVW8_SK0_SKXCCM0_TLDS1_ULSGRO0_USL1_UIOFGRO0_USFGROn1_VSn1_VWA1_VWB1_WSGRA0_WSGRB0_WS32_WG32_4_1_WGM8_WGMXCC1_WGMXCCGn1
    SolutionIndex: 110
    SolutionNameMin: Cijk_Ailk_Bljk_BSS_BH_Bias_S_HA_S_SAV_UserArgs_MT64x64x32_MI16x16x1_SN_LDSB0_AFC1_AFEM1_AFEM1_ASEM1_CLR1_CADS0_DTVA0_DTVB0_EPS0_FDSI0_GRPM1_GRVWA8_GRVWB8_GSU1_GSUAMB_GSUC0_GSUWGMRR0_GLS0_ISA1201_IU1_K1_LBSPPA1024_LBSPPB128_LBSPPM0_LPA16_LPB16_LPM0_LRVW8_LWPMn1_MIAV1_MIWT2_2_MO40_NTn1_NTA0_NTB0_NTC0_NTD0_NTM0_NEPBS0_NLCA1_NLCB1_ONLL1_PGR1_PLR0_PKA0_SIA1_SS0_SU32_SUM0_SUS256_SPO0_SRVW0_SSO0_SVW8_SK0_SKXCCM0_TLDS1_ULSGRO0_USL1_UIOFGRO0_USFGROn1_VSn1_VWA1_VWB1_WSGRA0_WSGRB0_WS32_WG32_4_1_WGM8_WGMXCC1_WGMXCCGn1
    SolutionIndex: 111
    SolutionNameMin: Cijk_Ailk_Bljk_BSS_BH_Bias_S_HA_S_SAV_UserArgs_MT16x16x32_MI16x16x1_SN_LDSB0_AFC1_AFEM1_AFEM1_ASEM1_CLR1_CADS0_DTVA0_DTVB0_EPS0_FDSI0_GRPM1_GRVWA8_GRVWB8_GSU1_GSUAMB_GSUC0_GSUWGMRR0_GLS0_ISA1201_IU1_K1_LBSPPA128_LBSPPB128_LBSPPM0_LPA16_LPB16_LPM0_LRVW8_LWPMn1_MIAV1_MIWT1_1_MO40_NTn1_NTA0_NTB0_NTC0_NTD0_NTM0_NEPBS0_NLCA1_NLCB1_ONLL1_PGR2_PLR0_PKA0_SIA3_SS0_SU32_SUM0_SUS256_SPO0_SRVW0_SSO0_SVW8_SK0_SKXCCM0_TLDS2_ULSGRO0_USL1_UIOFGRO0_USFGROn1_VSn1_VWA1_VWB1_WSGRA0_WSGRB0_WS32_WG16_2_1_WGM8_WGMXCC1_WGMXCCGn1
    SolutionIndex: 112
    SolutionNameMin: Cijk_Ailk_Bljk_BSS_BH_Bias_S_HA_S_SAV_UserArgs_MT64x64x32_MI16x16x1_SN_LDSB0_AFC1_AFEM1_AFEM1_ASEM1_CLR0_CADS0_DTVA0_DTVB0_EPS0_FDSI0_GRPM1_GRVWA8_GRVWB8_GSU1_GSUAMB_GSUC0_GSUWGMRR0_GLS0_ISA1201_IU1_K1_LBSPPA1024_LBSPPB128_LBSPPM0_LPA16_LPB16_LPM0_LRVW8_LWPMn1_MIAV1_MIWT2_2_MO40_NTn1_NTA0_NTB0_NTC0_NTD0_NTM0_NEPBS0_NLCA1_NLCB1_ONLL1_PGR1_PLR1_PKA0_SIA3_SS0_SU32_SUM0_SUS256_SPO0_SRVW0_SSO0_SVW8_SK0_SKXCCM0_TLDS1_ULSGRO0_USL1_UIOFGRO0_USFGROn1_VSn1_VWA1_VWB1_WSGRA0_WSGRB0_WS32_WG32_4_1_WGM8_WGMXCC1_WGMXCCGn1
    SolutionIndex: 113
    SolutionNameMin: Cijk_Ailk_Bljk_BSS_BH_Bias_S_HA_S_SAV_UserArgs_MT16x16x32_MI16x16x1_SN_LDSB0_AFC1_AFEM1_AFEM1_ASEM1_CLR1_CADS0_DTVA0_DTVB0_EPS0_FDSI0_GRPM1_GRVWA8_GRVWB8_GSU1_GSUAMB_GSUC0_GSUWGMRR0_GLS0_ISA1201_IU1_K1_LBSPPA128_LBSPPB128_LBSPPM0_LPA16_LPB16_LPM0_LRVW8_LWPMn1_MIAV1_MIWT1_1_MO40_NTn1_NTA0_NTB0_NTC0_NTD0_NTM0_NEPBS0_NLCA1_NLCB1_ONLL1_PGR2_PLR1_PKA0_SIA1_SS0_SU32_SUM0_SUS256_SPO0_SRVW0_SSO0_SVW8_SK0_SKXCCM0_TLDS2_ULSGRO0_USL1_UIOFGRO0_USFGROn1_VSn1_VWA1_VWB1_WSGRA0_WSGRB0_WS32_WG16_2_1_WGM8_WGMXCC1_WGMXCCGn1
    SolutionIndex: 114
    SolutionNameMin: Cijk_Ailk_Bljk_BSS_BH_Bias_S_HA_S_SAV_UserArgs_MT16x16x32_MI16x16x1_SN_LDSB0_AFC1_AFEM1_AFEM1_ASEM32_CLR1_CADS0_DTVA0_DTVB1_EPS1_FDSI0_GRPM1_GRVWA8_GRVWB8_GSU1_GSUAMB_GSUC0_GSUWGMRR0_GLS0_ISA1201_IU1_K1_LBSPPA128_LBSPPB0_LBSPPM0_LPA16_LPB0_LPM0_LRVW8_LWPMn1_MIAV1_MIWT1_1_MO40_NTn1_NTA0_NTB0_NTC0_NTD0_NTM0_NEPBS0_NLCA1_NLCB2_ONLL1_PGR1_PLR1_PKA0_SIA3_SS0_SU32_SUM0_SUS256_SPO0_SRVW0_SSO0_SVW8_SK0_SKXCCM0_TLDS2_ULSGRO0_USL1_UIOFGRO0_USFGROn1_VSn1_VWA1_VWB1_WSGRA0_WSGRB0_WS32_WG16_2_1_WGM8_WGMXCC1_WGMXCCGn1
    SolutionIndex: 115
    SolutionNameMin: Cijk_Ailk_Bljk_BSS_BH_Bias_S_HA_S_SAV_UserArgs_MT16x128x32_MI16x16x1_SN_LDSB0_AFC1_AFEM1_AFEM1_ASEM32_CLR1_CADS0_DTVA0_DTVB1_EPS0_FDSI0_GRPM1_GRVWA1_GRVWB8_GSU1_GSUAMB_GSUC0_GSUWGMRR0_GLS0_ISA1201_IU1_K1_LBSPPA128_LBSPPB0_LBSPPM0_LPA16_LPB0_LPM0_LRVW8_LWPMn1_MIAV1_MIWT1_8_MO40_NTn1_NTA0_NTB0_NTC0_NTD0_NTM0_NEPBS0_NLCA1_NLCB2_ONLL1_PGR1_PLR1_PKA0_SIA3_SS0_SU32_SUM0_SUS256_SPO0_SRVW0_SSO0_SVW8_SK0_SKXCCM0_TLDS2_ULSGRO0_USL1_UIOFGRO0_USFGROn1_VSn1_VWA1_VWB1_WSGRA0_WSGRB0_WS32_WG16_2_1_WGM8_WGMXCC1_WGMXCCGn1
    SolutionIndex: 116
    SolutionNameMin: Cijk_Ailk_Bljk_BSS_BH_Bias_S_HA_S_SAV_UserArgs_MT16x128x32_MI16x16x1_SN_LDSB0_AFC1_AFEM1_AFEM1_ASEM32_CLR1_CADS0_DTVA0_DTVB1_EPS1_FDSI0_GRPM1_GRVWA1_GRVWB8_GSU1_GSUAMB_GSUC0_GSUWGMRR0_GLS0_ISA1201_IU1_K1_LBSPPA256_LBSPPB0_LBSPPM0_LPA16_LPB0_LPM0_LRVW8_LWPMn1_MIAV1_MIWT1_8_MO40_NTn1_NTA0_NTB0_NTC0_NTD0_NTM0_NEPBS0_NLCA1_NLCB2_ONLL1_PGR1_PLR1_PKA0_SIA3_SS0_SU32_SUM0_SUS256_SPO0_SRVW0_SSO0_SVW8_SK0_SKXCCM0_TLDS1_ULSGRO0_USL1_UIOFGRO0_USFGROn1_VSn1_VWA1_VWB1_WSGRA0_WSGRB0_WS32_WG16_2_1_WGM8_WGMXCC1_WGMXCCGn1
    SolutionIndex: 117
    SolutionNameMin: Cijk_Ailk_Bljk_BSS_BH_Bias_S_HA_S_SAV_UserArgs_MT16x16x32_MI16x16x1_SN_LDSB0_AFC1_AFEM1_AFEM1_ASEM32_CLR0_CADS0_DTVA0_DTVB1_EPS0_FDSI0_GRPM1_GRVWA8_GRVWB8_GSU1_GSUAMB_GSUC0_GSUWGMRR0_GLS0_ISA1201_IU1_K1_LBSPPA256_LBSPPB0_LBSPPM0_LPA16_LPB0_LPM0_LRVW8_LWPMn1_MIAV1_MIWT1_1_MO40_NTn1_NTA0_NTB0_NTC0_NTD0_NTM0_NEPBS0_NLCA1_NLCB2_ONLL1_PGR1_PLR1_PKA0_SIA3_SS0_SU32_SUM0_SUS256_SPO0_SRVW0_SSO0_SVW8_SK0_SKXCCM0_TLDS1_ULSGRO0_USL1_UIOFGRO0_USFGROn1_VSn1_VWA1_VWB1_WSGRA0_WSGRB0_WS32_WG16_2_1_WGM8_WGMXCC1_WGMXCCGn1
    SolutionIndex: 118
    SolutionNameMin: Cijk_Ailk_Bljk_BSS_BH_Bias_S_HA_S_SAV_UserArgs_MT16x128x32_MI16x16x1_SN_LDSB0_AFC1_AFEM1_AFEM1_ASEM32_CLR1_CADS0_DTVA0_DTVB1_EPS0_FDSI0_GRPM1_GRVWA1_GRVWB8_GSU1_GSUAMB_GSUC0_GSUWGMRR0_GLS0_ISA1201_IU1_K1_LBSPPA256_LBSPPB0_LBSPPM0_LPA16_LPB0_LPM0_LRVW8_LWPMn1_MIAV1_MIWT1_8_MO40_NTn1_NTA0_NTB0_NTC0_NTD0_NTM0_NEPBS0_NLCA1_NLCB2_ONLL1_PGR2_PLR1_PKA0_SIA3_SS0_SU32_SUM0_SUS256_SPO0_SRVW0_SSO0_SVW8_SK0_SKXCCM0_TLDS1_ULSGRO0_USL1_UIOFGRO0_USFGROn1_VSn1_VWA1_VWB1_WSGRA0_WSGRB0_WS32_WG16_2_1_WGM8_WGMXCC1_WGMXCCGn1
    SolutionIndex: 119
    SolutionNameMin: Cijk_Ailk_Bljk_BSS_BH_Bias_S_HA_S_SAV_UserArgs_MT16x128x32_MI16x16x1_SN_LDSB0_AFC1_AFEM1_AFEM1_ASEM32_CLR0_CADS0_DTVA0_DTVB1_EPS0_FDSI0_GRPM1_GRVWA1_GRVWB8_GSU1_GSUAMB_GSUC0_GSUWGMRR0_GLS0_ISA1201_IU1_K1_LBSPPA128_LBSPPB0_LBSPPM0_LPA16_LPB0_LPM0_LRVW8_LWPMn1_MIAV1_MIWT1_8_MO40_NTn1_NTA0_NTB0_NTC0_NTD0_NTM0_NEPBS0_NLCA1_NLCB2_ONLL1_PGR2_PLR1_PKA0_SIA3_SS0_SU32_SUM0_SUS256_SPO0_SRVW0_SSO0_SVW8_SK0_SKXCCM0_TLDS2_ULSGRO0_USL1_UIOFGRO0_USFGROn1_VSn1_VWA1_VWB1_WSGRA0_WSGRB0_WS32_WG16_2_1_WGM8_WGMXCC1_WGMXCCGn1
    SolutionIndex: 120
    SolutionNameMin: Cijk_Ailk_Bljk_BSS_BH_Bias_S_HA_S_SAV_UserArgs_MT16x128x32_MI16x16x1_SN_LDSB1_AFC1_AFEM1_AFEM1_ASEM32_CLR1_CADS0_DTVA0_DTVB1_EPS0_FDSI0_GRPM1_GRVWA1_GRVWB8_GSU1_GSUAMB_GSUC0_GSUWGMRR0_GLS0_ISA1201_IU1_K1_LBSPPA256_LBSPPB0_LBSPPM0_LPA16_LPB0_LPM0_LRVW8_LWPMn1_MIAV1_MIWT1_8_MO40_NTn1_NTA0_NTB0_NTC0_NTD0_NTM0_NEPBS0_NLCA1_NLCB2_ONLL1_PGR1_PLR1_PKA0_SIA3_SS0_SU32_SUM0_SUS256_SPO0_SRVW0_SSO0_SVW8_SK0_SKXCCM0_TLDS1_ULSGRO0_USL1_UIOFGRO0_USFGROn1_VSn1_VWA1_VWB1_WSGRA0_WSGRB0_WS32_WG16_2_1_WGM8_WGMXCC1_WGMXCCGn1
    SolutionIndex: 121
    SolutionNameMin: Cijk_Ailk_Bljk_BSS_BH_Bias_S_HA_S_SAV_UserArgs_MT16x128x32_MI16x16x1_SN_LDSB1_AFC1_AFEM1_AFEM1_ASEM32_CLR0_CADS0_DTVA0_DTVB1_EPS1_FDSI0_GRPM1_GRVWA1_GRVWB8_GSU1_GSUAMB_GSUC0_GSUWGMRR0_GLS0_ISA1201_IU1_K1_LBSPPA256_LBSPPB0_LBSPPM0_LPA16_LPB0_LPM0_LRVW8_LWPMn1_MIAV1_MIWT1_8_MO40_NTn1_NTA0_NTB0_NTC0_NTD0_NTM0_NEPBS0_NLCA1_NLCB2_ONLL1_PGR1_PLR1_PKA0_SIA3_SS0_SU32_SUM0_SUS256_SPO0_SRVW0_SSO0_SVW8_SK0_SKXCCM0_TLDS1_ULSGRO0_USL1_UIOFGRO0_USFGROn1_VSn1_VWA1_VWB1_WSGRA0_WSGRB0_WS32_WG16_2_1_WGM8_WGMXCC1_WGMXCCGn1
    SolutionIndex: 122
    SolutionNameMin: Cijk_Ailk_Bljk_BSS_BH_Bias_S_HA_S_SAV_UserArgs_MT16x128x32_MI16x16x1_SN_LDSB0_AFC1_AFEM1_AFEM1_ASEM32_CLR0_CADS0_DTVA0_DTVB1_EPS0_FDSI0_GRPM1_GRVWA8_GRVWB8_GSU1_GSUAMB_GSUC0_GSUWGMRR0_GLS0_ISA1201_IU1_K1_LBSPPA128_LBSPPB0_LBSPPM0_LPA16_LPB0_LPM0_LRVW8_LWPMn1_MIAV1_MIWT1_8_MO40_NTn1_NTA0_NTB0_NTC0_NTD0_NTM0_NEPBS0_NLCA1_NLCB2_ONLL1_PGR1_PLR1_PKA0_SIA3_SS0_SU32_SUM0_SUS256_SPO0_SRVW0_SSO0_SVW8_SK0_SKXCCM0_TLDS2_ULSGRO0_USL1_UIOFGRO0_USFGROn1_VSn1_VWA1_VWB1_WSGRA0_WSGRB0_WS32_WG16_2_1_WGM8_WGMXCC1_WGMXCCGn1
    SolutionIndex: 123
    SolutionNameMin: Cijk_Ailk_Bljk_BSS_BH_Bias_S_HA_S_SAV_UserArgs_MT16x16x32_MI16x16x1_SN_LDSB1_AFC1_AFEM1_AFEM1_ASEM1_CLR0_CADS0_DTVA0_DTVB0_EPS0_FDSI0_GRPM1_GRVWA8_GRVWB8_GSU1_GSUAMB_GSUC0_GSUWGMRR0_GLS0_ISA1201_IU1_K1_LBSPPA128_LBSPPB128_LBSPPM0_LPA16_LPB16_LPM0_LRVW8_LWPMn1_MIAV1_MIWT1_1_MO40_NTn1_NTA0_NTB0_NTC0_NTD0_NTM0_NEPBS0_NLCA1_NLCB1_ONLL1_PGR2_PLR1_PKA0_SIA3_SS0_SU32_SUM0_SUS256_SPO0_SRVW0_SSO0_SVW8_SK0_SKXCCM0_TLDS2_ULSGRO0_USL1_UIOFGRO0_USFGROn1_VSn1_VWA1_VWB1_WSGRA0_WSGRB0_WS32_WG16_2_1_WGM8_WGMXCC1_WGMXCCGn1
    SolutionIndex: 124
    SolutionNameMin: Cijk_Ailk_Bljk_BSS_BH_Bias_S_HA_S_SAV_UserArgs_MT16x16x32_MI16x16x1_SN_LDSB0_AFC1_AFEM1_AFEM1_ASEM1_CLR0_CADS0_DTVA0_DTVB0_EPS0_FDSI0_GRPM1_GRVWA8_GRVWB8_GSU1_GSUAMB_GSUC0_GSUWGMRR0_GLS0_ISA1201_IU1_K1_LBSPPA128_LBSPPB128_LBSPPM0_LPA16_LPB16_LPM0_LRVW8_LWPMn1_MIAV1_MIWT1_1_MO40_NTn1_NTA0_NTB0_NTC0_NTD0_NTM0_NEPBS0_NLCA1_NLCB1_ONLL1_PGR2_PLR1_PKA0_SIA3_SS0_SU32_SUM0_SUS256_SPO0_SRVW0_SSO0_SVW8_SK0_SKXCCM0_TLDS2_ULSGRO0_USL1_UIOFGRO0_USFGROn1_VSn1_VWA1_VWB1_WSGRA0_WSGRB0_WS32_WG16_2_1_WGM8_WGMXCC1_WGMXCCGn1
    SolutionIndex: 125
    SolutionNameMin: Cijk_Ailk_Bljk_BSS_BH_Bias_S_HA_S_SAV_UserArgs_MT16x16x32_MI16x16x1_SN_LDSB1_AFC1_AFEM1_AFEM1_ASEM32_CLR1_CADS0_DTVA0_DTVB1_EPS0_FDSI0_GRPM1_GRVWA8_GRVWB8_GSU1_GSUAMB_GSUC0_GSUWGMRR0_GLS0_ISA1201_IU1_K1_LBSPPA128_LBSPPB0_LBSPPM0_LPA16_LPB0_LPM0_LRVW8_LWPMn1_MIAV1_MIWT1_1_MO40_NTn1_NTA0_NTB0_NTC0_NTD0_NTM0_NEPBS0_NLCA1_NLCB2_ONLL1_PGR2_PLR1_PKA0_SIA3_SS0_SU32_SUM0_SUS256_SPO0_SRVW0_SSO0_SVW8_SK0_SKXCCM0_TLDS2_ULSGRO0_USL1_UIOFGRO0_USFGROn1_VSn1_VWA1_VWB1_WSGRA0_WSGRB0_WS32_WG16_2_1_WGM8_WGMXCC1_WGMXCCGn1
    SolutionIndex: 128
    SolutionNameMin: Cijk_Ailk_Bljk_BSS_BH_Bias_S_HA_S_SAV_UserArgs_MT64x64x32_MI16x16x1_SN_LDSB0_AFC1_AFEM1_AFEM1_ASEM1_CLR0_CADS0_DTVA0_DTVB0_EPS0_FDSI0_GRPM1_GRVWA8_GRVWB8_GSU1_GSUAMB_GSUC0_GSUWGMRR0_GLS0_ISA1201_IU1_K1_LBSPPA1024_LBSPPB128_LBSPPM0_LPA16_LPB16_LPM0_LRVW8_LWPMn1_MIAV1_MIWT2_2_MO40_NTn1_NTA0_NTB0_NTC0_NTD0_NTM0_NEPBS0_NLCA1_NLCB1_ONLL1_PGR2_PLR1_PKA0_SIA1_SS1_SU32_SUM0_SUS256_SPO0_SRVW0_SSO0_SVW1_SK0_SKXCCM0_TLDS1_ULSGRO0_USL1_UIOFGRO0_USFGROn1_VSn1_VWA1_VWB1_WSGRA0_WSGRB0_WS32_WG32_4_1_WGM8_WGMXCC1_WGMXCCGn1
    SolutionIndex: 129
    SolutionNameMin: Cijk_Ailk_Bljk_BSS_BH_Bias_S_HA_S_SAV_UserArgs_MT16x16x32_MI16x16x1_SN_LDSB1_AFC1_AFEM1_AFEM1_ASEM32_CLR0_CADS0_DTVA0_DTVB1_EPS0_FDSI0_GRPM1_GRVWA8_GRVWB8_GSU1_GSUAMB_GSUC0_GSUWGMRR0_GLS0_ISA1201_IU1_K1_LBSPPA128_LBSPPB0_LBSPPM0_LPA16_LPB0_LPM0_LRVW8_LWPMn1_MIAV1_MIWT1_1_MO40_NTn1_NTA0_NTB0_NTC0_NTD0_NTM0_NEPBS0_NLCA1_NLCB2_ONLL1_PGR2_PLR1_PKA0_SIA3_SS0_SU32_SUM0_SUS256_SPO0_SRVW0_SSO0_SVW8_SK0_SKXCCM0_TLDS2_ULSGRO0_USL1_UIOFGRO0_USFGROn1_VSn1_VWA1_VWB1_WSGRA0_WSGRB0_WS32_WG16_2_1_WGM8_WGMXCC1_WGMXCCGn1
    SolutionIndex: 130
    SolutionNameMin: Cijk_Ailk_Bljk_BSS_BH_Bias_S_HA_S_SAV_UserArgs_MT64x64x32_MI16x16x1_SN_LDSB1_AFC1_AFEM1_AFEM1_ASEM32_CLR1_CADS0_DTVA0_DTVB1_EPS1_FDSI0_GRPM1_GRVWA8_GRVWB8_GSU1_GSUAMB_GSUC0_GSUWGMRR0_GLS0_ISA1201_IU1_K1_LBSPPA1024_LBSPPB0_LBSPPM0_LPA16_LPB0_LPM0_LRVW8_LWPMn1_MIAV1_MIWT2_2_MO40_NTn1_NTA0_NTB0_NTC0_NTD0_NTM0_NEPBS0_NLCA1_NLCB2_ONLL1_PGR1_PLR1_PKA0_SIA3_SS1_SU32_SUM0_SUS256_SPO0_SRVW0_SSO0_SVW1_SK0_SKXCCM0_TLDS1_ULSGRO0_USL1_UIOFGRO0_USFGROn1_VSn1_VWA1_VWB1_WSGRA0_WSGRB0_WS32_WG32_4_1_WGM8_WGMXCC1_WGMXCCGn1
    SolutionIndex: 132
    SolutionNameMin: Cijk_Ailk_Bljk_BSS_BH_Bias_S_HA_S_SAV_UserArgs_MT16x16x32_MI16x16x1_SN_LDSB0_AFC1_AFEM1_AFEM1_ASEM1_CLR0_CADS0_DTVA0_DTVB0_EPS0_FDSI0_GRPM1_GRVWA8_GRVWB8_GSU1_GSUAMB_GSUC0_GSUWGMRR0_GLS0_ISA1201_IU1_K1_LBSPPA128_LBSPPB128_LBSPPM0_LPA16_LPB16_LPM0_LRVW8_LWPMn1_MIAV1_MIWT1_1_MO40_NTn1_NTA0_NTB0_NTC0_NTD0_NTM0_NEPBS0_NLCA1_NLCB1_ONLL1_PGR2_PLR1_PKA0_SIA1_SS0_SU32_SUM0_SUS256_SPO0_SRVW0_SSO0_SVW8_SK0_SKXCCM0_TLDS2_ULSGRO0_USL1_UIOFGRO0_USFGROn1_VSn1_VWA1_VWB1_WSGRA0_WSGRB0_WS32_WG16_2_1_WGM8_WGMXCC1_WGMXCCGn1
    SolutionIndex: 133
    SolutionNameMin: Cijk_Ailk_Bljk_BSS_BH_Bias_S_HA_S_SAV_UserArgs_MT16x16x32_MI16x16x1_SN_LDSB0_AFC1_AFEM1_AFEM1_ASEM1_CLR1_CADS0_DTVA0_DTVB0_EPS0_FDSI0_GRPM1_GRVWA8_GRVWB8_GSU1_GSUAMB_GSUC0_GSUWGMRR0_GLS0_ISA1201_IU1_K1_LBSPPA128_LBSPPB128_LBSPPM0_LPA16_LPB16_LPM0_LRVW8_LWPMn1_MIAV1_MIWT1_1_MO40_NTn1_NTA0_NTB0_NTC0_NTD0_NTM0_NEPBS0_NLCA1_NLCB1_ONLL1_PGR2_PLR0_PKA0_SIA1_SS0_SU32_SUM0_SUS256_SPO0_SRVW0_SSO0_SVW8_SK0_SKXCCM0_TLDS2_ULSGRO0_USL1_UIOFGRO0_USFGROn1_VSn1_VWA1_VWB1_WSGRA0_WSGRB0_WS32_WG16_2_1_WGM8_WGMXCC1_WGMXCCGn1
    SolutionIndex: 134
    SolutionNameMin: Cijk_Ailk_Bljk_BSS_BH_Bias_S_HA_S_SAV_UserArgs_MT128x128x32_MI16x16x1_SN_LDSB0_AFC1_AFEM1_AFEM1_ASEM1_CLR1_CADS0_DTVA0_DTVB0_EPS0_FDSI0_GRPM1_GRVWA8_GRVWB8_GSU1_GSUAMB_GSUC0_GSUWGMRR0_GLS0_ISA1201_IU1_K1_LBSPPA2048_LBSPPB128_LBSPPM0_LPA0_LPB16_LPM0_LRVW8_LWPMn1_MIAV1_MIWT4_4_MO40_NTn1_NTA0_NTB0_NTC0_NTD0_NTM0_NEPBS0_NLCA1_NLCB1_ONLL1_PGR2_PLR1_PKA0_SIA3_SS1_SU32_SUM0_SUS256_SPO0_SRVW0_SSO0_SVW4_SK0_SKXCCM0_TLDS1_ULSGRO0_USL1_UIOFGRO0_USFGROn1_VSn1_VWA4_VWB1_WSGRA0_WSGRB0_WS32_WG32_4_1_WGM8_WGMXCC1_WGMXCCGn1
    SolutionIndex: 135
    SolutionNameMin: Cijk_Ailk_Bljk_BSS_BH_Bias_S_HA_S_SAV_UserArgs_MT16x16x32_MI16x16x1_SN_LDSB0_AFC1_AFEM1_AFEM1_ASEM1_CLR1_CADS0_DTVA0_DTVB0_EPS0_FDSI0_GRPM1_GRVWA8_GRVWB8_GSU1_GSUAMB_GSUC0_GSUWGMRR0_GLS0_ISA1201_IU1_K1_LBSPPA256_LBSPPB128_LBSPPM0_LPA16_LPB16_LPM0_LRVW8_LWPMn1_MIAV1_MIWT1_1_MO40_NTn1_NTA0_NTB0_NTC0_NTD0_NTM0_NEPBS0_NLCA1_NLCB1_ONLL1_PGR1_PLR1_PKA0_SIA1_SS1_SU32_SUM0_SUS256_SPO0_SRVW0_SSO0_SVW1_SK0_SKXCCM0_TLDS1_ULSGRO0_USL1_UIOFGRO0_USFGROn1_VSn1_VWA1_VWB1_WSGRA0_WSGRB0_WS32_WG16_2_1_WGM8_WGMXCC1_WGMXCCGn1
    SolutionIndex: 136
    SolutionNameMin: Cijk_Ailk_Bljk_BSS_BH_Bias_S_HA_S_SAV_UserArgs_MT16x16x32_MI16x16x1_SN_LDSB0_AFC1_AFEM1_AFEM1_ASEM1_CLR1_CADS0_DTVA0_DTVB0_EPS0_FDSI0_GRPM1_GRVWA1_GRVWB8_GSU1_GSUAMB_GSUC0_GSUWGMRR0_GLS0_ISA1201_IU1_K1_LBSPPA128_LBSPPB128_LBSPPM0_LPA16_LPB16_LPM0_LRVW8_LWPMn1_MIAV1_MIWT1_1_MO40_NTn1_NTA0_NTB0_NTC0_NTD0_NTM0_NEPBS0_NLCA1_NLCB1_ONLL1_PGR2_PLR1_PKA0_SIA3_SS0_SU32_SUM0_SUS256_SPO0_SRVW0_SSO0_SVW8_SK0_SKXCCM0_TLDS2_ULSGRO0_USL1_UIOFGRO0_USFGROn1_VSn1_VWA1_VWB1_WSGRA0_WSGRB0_WS32_WG16_2_1_WGM8_WGMXCC1_WGMXCCGn1
    SolutionIndex: 137
    SolutionNameMin: Cijk_Ailk_Bljk_BSS_BH_Bias_S_HA_S_SAV_UserArgs_MT16x16x32_MI16x16x1_SN_LDSB0_AFC1_AFEM1_AFEM1_ASEM1_CLR0_CADS0_DTVA0_DTVB0_EPS1_FDSI0_GRPM1_GRVWA8_GRVWB8_GSU1_GSUAMB_GSUC0_GSUWGMRR0_GLS0_ISA1201_IU1_K1_LBSPPA128_LBSPPB128_LBSPPM0_LPA16_LPB16_LPM0_LRVW8_LWPMn1_MIAV1_MIWT1_1_MO40_NTn1_NTA0_NTB0_NTC0_NTD0_NTM0_NEPBS0_NLCA1_NLCB1_ONLL1_PGR1_PLR1_PKA0_SIA1_SS0_SU32_SUM0_SUS256_SPO0_SRVW0_SSO0_SVW8_SK0_SKXCCM0_TLDS2_ULSGRO0_USL1_UIOFGRO0_USFGROn1_VSn1_VWA1_VWB1_WSGRA0_WSGRB0_WS32_WG16_2_1_WGM8_WGMXCC1_WGMXCCGn1
    SolutionIndex: 138
    SolutionNameMin: Cijk_Ailk_Bljk_BSS_BH_Bias_S_HA_S_SAV_UserArgs_MT16x16x32_MI16x16x1_SN_LDSB0_AFC1_AFEM1_AFEM1_ASEM32_CLR0_CADS0_DTVA0_DTVB1_EPS0_FDSI0_GRPM1_GRVWA1_GRVWB8_GSU1_GSUAMB_GSUC0_GSUWGMRR0_GLS0_ISA1201_IU1_K1_LBSPPA256_LBSPPB0_LBSPPM0_LPA16_LPB0_LPM0_LRVW8_LWPMn1_MIAV1_MIWT1_1_MO40_NTn1_NTA0_NTB0_NTC0_NTD0_NTM0_NEPBS0_NLCA1_NLCB2_ONLL1_PGR2_PLR1_PKA0_SIA3_SS1_SU32_SUM0_SUS256_SPO0_SRVW0_SSO0_SVW1_SK0_SKXCCM0_TLDS1_ULSGRO0_USL1_UIOFGRO0_USFGROn1_VSn1_VWA1_VWB1_WSGRA0_WSGRB0_WS32_WG16_2_1_WGM8_WGMXCC1_WGMXCCGn1
    SolutionIndex: 139
    SolutionNameMin: Cijk_Ailk_Bljk_BSS_BH_Bias_S_HA_S_SAV_UserArgs_MT16x16x32_MI16x16x1_SN_LDSB0_AFC1_AFEM1_AFEM1_ASEM1_CLR1_CADS0_DTVA0_DTVB0_EPS1_FDSI0_GRPM1_GRVWA8_GRVWB8_GSU1_GSUAMB_GSUC0_GSUWGMRR0_GLS0_ISA1201_IU1_K1_LBSPPA256_LBSPPB256_LBSPPM0_LPA16_LPB16_LPM0_LRVW8_LWPMn1_MIAV1_MIWT1_1_MO40_NTn1_NTA0_NTB0_NTC0_NTD0_NTM0_NEPBS0_NLCA1_NLCB1_ONLL1_PGR1_PLR0_PKA0_SIA1_SS0_SU32_SUM0_SUS256_SPO0_SRVW0_SSO0_SVW8_SK0_SKXCCM0_TLDS0_ULSGRO0_USL1_UIOFGRO0_USFGROn1_VSn1_VWA1_VWB1_WSGRA0_WSGRB0_WS32_WG16_2_1_WGM8_WGMXCC1_WGMXCCGn1
    SolutionIndex: 140
    SolutionNameMin: Cijk_Ailk_Bljk_BSS_BH_Bias_S_HA_S_SAV_UserArgs_MT16x16x32_MI16x16x1_SN_LDSB0_AFC1_AFEM1_AFEM1_ASEM32_CLR0_CADS0_DTVA0_DTVB1_EPS0_FDSI0_GRPM1_GRVWA1_GRVWB8_GSU1_GSUAMB_GSUC0_GSUWGMRR0_GLS0_ISA1201_IU1_K1_LBSPPA256_LBSPPB0_LBSPPM0_LPA16_LPB0_LPM0_LRVW8_LWPMn1_MIAV1_MIWT1_1_MO40_NTn1_NTA0_NTB0_NTC0_NTD0_NTM0_NEPBS0_NLCA1_NLCB2_ONLL1_PGR1_PLR1_PKA0_SIA3_SS0_SU32_SUM0_SUS256_SPO0_SRVW0_SSO0_SVW8_SK0_SKXCCM0_TLDS1_ULSGRO0_USL1_UIOFGRO0_USFGROn1_VSn1_VWA1_VWB1_WSGRA0_WSGRB0_WS32_WG16_2_1_WGM8_WGMXCC1_WGMXCCGn1
    SolutionIndex: 141
    SolutionNameMin: Cijk_Ailk_Bljk_BSS_BH_Bias_S_HA_S_SAV_UserArgs_MT16x16x32_MI16x16x1_SN_LDSB1_AFC1_AFEM1_AFEM1_ASEM1_CLR1_CADS0_DTVA0_DTVB0_EPS0_FDSI0_GRPM1_GRVWA8_GRVWB8_GSU1_GSUAMB_GSUC0_GSUWGMRR0_GLS0_ISA1201_IU1_K1_LBSPPA128_LBSPPB128_LBSPPM0_LPA16_LPB16_LPM0_LRVW8_LWPMn1_MIAV1_MIWT1_1_MO40_NTn1_NTA0_NTB0_NTC0_NTD0_NTM0_NEPBS0_NLCA1_NLCB1_ONLL1_PGR2_PLR0_PKA0_SIA3_SS0_SU32_SUM0_SUS256_SPO0_SRVW0_SSO0_SVW8_SK0_SKXCCM0_TLDS2_ULSGRO0_USL1_UIOFGRO0_USFGROn1_VSn1_VWA1_VWB1_WSGRA0_WSGRB0_WS32_WG16_2_1_WGM8_WGMXCC1_WGMXCCGn1
    SolutionIndex: 142
    SolutionNameMin: Cijk_Ailk_Bljk_BSS_BH_Bias_S_HA_S_SAV_UserArgs_MT16x16x32_MI16x16x1_SN_LDSB0_AFC1_AFEM1_AFEM1_ASEM32_CLR0_CADS0_DTVA0_DTVB1_EPS0_FDSI0_GRPM1_GRVWA1_GRVWB8_GSU1_GSUAMB_GSUC0_GSUWGMRR0_GLS0_ISA1201_IU1_K1_LBSPPA128_LBSPPB0_LBSPPM0_LPA16_LPB0_LPM0_LRVW8_LWPMn1_MIAV1_MIWT1_1_MO40_NTn1_NTA0_NTB0_NTC0_NTD0_NTM0_NEPBS0_NLCA1_NLCB2_ONLL1_PGR2_PLR1_PKA0_SIA3_SS0_SU32_SUM0_SUS256_SPO0_SRVW0_SSO0_SVW8_SK0_SKXCCM0_TLDS2_ULSGRO0_USL1_UIOFGRO0_USFGROn1_VSn1_VWA1_VWB1_WSGRA0_WSGRB0_WS32_WG16_2_1_WGM8_WGMXCC1_WGMXCCGn1
    SolutionIndex: 143
    SolutionNameMin: Cijk_Ailk_Bljk_BSS_BH_Bias_S_HA_S_SAV_UserArgs_MT16x16x32_MI16x16x1_SN_LDSB1_AFC1_AFEM1_AFEM1_ASEM32_CLR0_CADS0_DTVA0_DTVB1_EPS0_FDSI0_GRPM1_GRVWA8_GRVWB8_GSU1_GSUAMB_GSUC0_GSUWGMRR0_GLS0_ISA1201_IU1_K1_LBSPPA256_LBSPPB0_LBSPPM0_LPA16_LPB0_LPM0_LRVW8_LWPMn1_MIAV1_MIWT1_1_MO40_NTn1_NTA0_NTB0_NTC0_NTD0_NTM0_NEPBS0_NLCA1_NLCB2_ONLL1_PGR1_PLR1_PKA0_SIA3_SS0_SU32_SUM0_SUS256_SPO0_SRVW0_SSO0_SVW8_SK0_SKXCCM0_TLDS1_ULSGRO0_USL1_UIOFGRO0_USFGROn1_VSn1_VWA1_VWB1_WSGRA0_WSGRB0_WS32_WG16_2_1_WGM8_WGMXCC1_WGMXCCGn1
    SolutionIndex: 144
    SolutionNameMin: Cijk_Ailk_Bljk_BSS_BH_Bias_S_HA_S_SAV_UserArgs_MT16x16x32_MI16x16x1_SN_LDSB0_AFC1_AFEM1_AFEM1_ASEM1_CLR1_CADS0_DTVA0_DTVB0_EPS0_FDSI0_GRPM1_GRVWA1_GRVWB8_GSU1_GSUAMB_GSUC0_GSUWGMRR0_GLS0_ISA1201_IU1_K1_LBSPPA128_LBSPPB128_LBSPPM0_LPA16_LPB16_LPM0_LRVW8_LWPMn1_MIAV1_MIWT1_1_MO40_NTn1_NTA0_NTB0_NTC0_NTD0_NTM0_NEPBS0_NLCA1_NLCB1_ONLL1_PGR1_PLR1_PKA0_SIA1_SS0_SU32_SUM0_SUS256_SPO0_SRVW0_SSO0_SVW8_SK0_SKXCCM0_TLDS2_ULSGRO0_USL1_UIOFGRO0_USFGROn1_VSn1_VWA1_VWB1_WSGRA0_WSGRB0_WS32_WG16_2_1_WGM8_WGMXCC1_WGMXCCGn1
    SolutionIndex: 145
    SolutionNameMin: Cijk_Ailk_Bljk_BSS_BH_Bias_S_HA_S_SAV_UserArgs_MT16x16x32_MI16x16x1_SN_LDSB0_AFC1_AFEM1_AFEM1_ASEM1_CLR0_CADS0_DTVA0_DTVB0_EPS0_FDSI0_GRPM1_GRVWA1_GRVWB8_GSU1_GSUAMB_GSUC0_GSUWGMRR0_GLS0_ISA1201_IU1_K1_LBSPPA128_LBSPPB128_LBSPPM0_LPA16_LPB16_LPM0_LRVW8_LWPMn1_MIAV1_MIWT1_1_MO40_NTn1_NTA0_NTB0_NTC0_NTD0_NTM0_NEPBS0_NLCA1_NLCB1_ONLL1_PGR2_PLR1_PKA0_SIA1_SS0_SU32_SUM0_SUS256_SPO0_SRVW0_SSO0_SVW8_SK0_SKXCCM0_TLDS2_ULSGRO0_USL1_UIOFGRO0_USFGROn1_VSn1_VWA1_VWB1_WSGRA0_WSGRB0_WS32_WG16_2_1_WGM8_WGMXCC1_WGMXCCGn1
    SolutionIndex: 146
    SolutionNameMin: Cijk_Ailk_Bljk_BSS_BH_Bias_S_HA_S_SAV_UserArgs_MT16x16x32_MI16x16x1_SN_LDSB1_AFC1_AFEM1_AFEM1_ASEM32_CLR0_CADS0_DTVA0_DTVB1_EPS1_FDSI0_GRPM1_GRVWA8_GRVWB8_GSU1_GSUAMB_GSUC0_GSUWGMRR0_GLS0_ISA1201_IU1_K1_LBSPPA256_LBSPPB0_LBSPPM0_LPA16_LPB0_LPM0_LRVW8_LWPMn1_MIAV1_MIWT1_1_MO40_NTn1_NTA0_NTB0_NTC0_NTD0_NTM0_NEPBS0_NLCA1_NLCB2_ONLL1_PGR1_PLR1_PKA0_SIA3_SS0_SU32_SUM0_SUS256_SPO0_SRVW0_SSO0_SVW8_SK0_SKXCCM0_TLDS1_ULSGRO0_USL1_UIOFGRO0_USFGROn1_VSn1_VWA1_VWB1_WSGRA0_WSGRB0_WS32_WG16_2_1_WGM8_WGMXCC1_WGMXCCGn1
    SolutionIndex: 147
    SolutionNameMin: Cijk_Ailk_Bljk_BSS_BH_Bias_S_HA_S_SAV_UserArgs_MT16x16x32_MI16x16x1_SN_LDSB0_AFC1_AFEM1_AFEM1_ASEM32_CLR1_CADS0_DTVA0_DTVB1_EPS0_FDSI0_GRPM1_GRVWA8_GRVWB8_GSU1_GSUAMB_GSUC0_GSUWGMRR0_GLS0_ISA1201_IU1_K1_LBSPPA128_LBSPPB0_LBSPPM0_LPA16_LPB0_LPM0_LRVW8_LWPMn1_MIAV1_MIWT1_1_MO40_NTn1_NTA0_NTB0_NTC0_NTD0_NTM0_NEPBS0_NLCA1_NLCB2_ONLL1_PGR1_PLR1_PKA0_SIA3_SS0_SU32_SUM0_SUS256_SPO0_SRVW0_SSO0_SVW8_SK0_SKXCCM0_TLDS2_ULSGRO0_USL1_UIOFGRO0_USFGROn1_VSn1_VWA1_VWB1_WSGRA0_WSGRB0_WS32_WG16_2_1_WGM8_WGMXCC1_WGMXCCGn1
    SolutionIndex: 148
    SolutionNameMin: Cijk_Ailk_Bljk_BSS_BH_Bias_S_HA_S_SAV_UserArgs_MT64x64x32_MI16x16x1_SN_LDSB1_AFC1_AFEM1_AFEM1_ASEM1_CLR1_CADS0_DTVA0_DTVB0_EPS1_FDSI0_GRPM1_GRVWA8_GRVWB8_GSU1_GSUAMB_GSUC0_GSUWGMRR0_GLS0_ISA1201_IU1_K1_LBSPPA1024_LBSPPB128_LBSPPM0_LPA16_LPB16_LPM0_LRVW8_LWPMn1_MIAV1_MIWT2_2_MO40_NTn1_NTA0_NTB0_NTC0_NTD0_NTM0_NEPBS0_NLCA1_NLCB1_ONLL1_PGR1_PLR0_PKA0_SIA3_SS0_SU32_SUM0_SUS256_SPO0_SRVW0_SSO0_SVW8_SK0_SKXCCM0_TLDS1_ULSGRO0_USL1_UIOFGRO0_USFGROn1_VSn1_VWA1_VWB1_WSGRA0_WSGRB0_WS32_WG32_4_1_WGM8_WGMXCC1_WGMXCCGn1
    SolutionIndex: 149
    SolutionNameMin: Cijk_Ailk_Bljk_BSS_BH_Bias_S_HA_S_SAV_UserArgs_MT16x16x32_MI16x16x1_SN_LDSB1_AFC1_AFEM1_AFEM1_ASEM1_CLR1_CADS0_DTVA0_DTVB0_EPS0_FDSI0_GRPM1_GRVWA8_GRVWB8_GSU1_GSUAMB_GSUC0_GSUWGMRR0_GLS0_ISA1201_IU1_K1_LBSPPA128_LBSPPB128_LBSPPM0_LPA16_LPB16_LPM0_LRVW8_LWPMn1_MIAV1_MIWT1_1_MO40_NTn1_NTA0_NTB0_NTC0_NTD0_NTM0_NEPBS0_NLCA1_NLCB1_ONLL1_PGR1_PLR1_PKA0_SIA3_SS1_SU32_SUM0_SUS256_SPO0_SRVW0_SSO0_SVW1_SK0_SKXCCM0_TLDS2_ULSGRO0_USL1_UIOFGRO0_USFGROn1_VSn1_VWA1_VWB1_WSGRA0_WSGRB0_WS32_WG16_2_1_WGM8_WGMXCC1_WGMXCCGn1
    SolutionIndex: 150
    SolutionNameMin: Cijk_Ailk_Bljk_BSS_BH_Bias_S_HA_S_SAV_UserArgs_MT16x16x32_MI16x16x1_SN_LDSB1_AFC1_AFEM1_AFEM1_ASEM32_CLR1_CADS0_DTVA0_DTVB1_EPS1_FDSI0_GRPM1_GRVWA8_GRVWB8_GSU1_GSUAMB_GSUC0_GSUWGMRR0_GLS0_ISA1201_IU1_K1_LBSPPA128_LBSPPB0_LBSPPM0_LPA16_LPB0_LPM0_LRVW8_LWPMn1_MIAV1_MIWT1_1_MO40_NTn1_NTA0_NTB0_NTC0_NTD0_NTM0_NEPBS0_NLCA1_NLCB2_ONLL1_PGR1_PLR1_PKA0_SIA3_SS0_SU32_SUM0_SUS256_SPO0_SRVW0_SSO0_SVW8_SK0_SKXCCM0_TLDS2_ULSGRO0_USL1_UIOFGRO0_USFGROn1_VSn1_VWA1_VWB1_WSGRA0_WSGRB0_WS32_WG16_2_1_WGM8_WGMXCC1_WGMXCCGn1
    SolutionIndex: 151
    SolutionNameMin: Cijk_Ailk_Bljk_BSS_BH_Bias_S_HA_S_SAV_UserArgs_MT64x64x32_MI16x16x1_SN_LDSB0_AFC1_AFEM1_AFEM1_ASEM1_CLR1_CADS0_DTVA0_DTVB0_EPS0_FDSI0_GRPM1_GRVWA1_GRVWB8_GSU1_GSUAMB_GSUC0_GSUWGMRR0_GLS0_ISA1201_IU1_K1_LBSPPA1024_LBSPPB128_LBSPPM0_LPA16_LPB16_LPM0_LRVW8_LWPMn1_MIAV1_MIWT2_2_MO40_NTn1_NTA0_NTB0_NTC0_NTD0_NTM0_NEPBS0_NLCA1_NLCB1_ONLL1_PGR1_PLR0_PKA0_SIA3_SS0_SU32_SUM0_SUS256_SPO0_SRVW0_SSO0_SVW8_SK0_SKXCCM0_TLDS1_ULSGRO0_USL1_UIOFGRO0_USFGROn1_VSn1_VWA1_VWB1_WSGRA0_WSGRB0_WS32_WG32_4_1_WGM8_WGMXCC1_WGMXCCGn1
    SolutionIndex: 152
    SolutionNameMin: Cijk_Ailk_Bljk_BSS_BH_Bias_S_HA_S_SAV_UserArgs_MT64x64x32_MI16x16x1_SN_LDSB0_AFC1_AFEM1_AFEM1_ASEM1_CLR1_CADS0_DTVA0_DTVB0_EPS0_FDSI0_GRPM1_GRVWA8_GRVWB8_GSU1_GSUAMB_GSUC0_GSUWGMRR0_GLS0_ISA1201_IU1_K1_LBSPPA1024_LBSPPB1024_LBSPPM0_LPA16_LPB16_LPM0_LRVW8_LWPMn1_MIAV1_MIWT2_2_MO40_NTn1_NTA0_NTB0_NTC0_NTD0_NTM0_NEPBS0_NLCA1_NLCB1_ONLL1_PGR2_PLR0_PKA0_SIA1_SS0_SU32_SUM0_SUS256_SPO0_SRVW0_SSO0_SVW8_SK0_SKXCCM0_TLDS0_ULSGRO0_USL1_UIOFGRO0_USFGROn1_VSn1_VWA1_VWB1_WSGRA0_WSGRB0_WS32_WG32_4_1_WGM8_WGMXCC1_WGMXCCGn1
    SolutionIndex: 153
    SolutionNameMin: Cijk_Ailk_Bljk_BSS_BH_Bias_S_HA_S_SAV_UserArgs_MT64x64x32_MI16x16x1_SN_LDSB1_AFC1_AFEM1_AFEM1_ASEM1_CLR1_CADS0_DTVA0_DTVB0_EPS0_FDSI0_GRPM1_GRVWA8_GRVWB8_GSU1_GSUAMB_GSUC0_GSUWGMRR0_GLS0_ISA1201_IU1_K1_LBSPPA1024_LBSPPB128_LBSPPM0_LPA16_LPB16_LPM0_LRVW8_LWPMn1_MIAV1_MIWT2_2_MO40_NTn1_NTA0_NTB0_NTC0_NTD0_NTM0_NEPBS0_NLCA1_NLCB1_ONLL1_PGR2_PLR0_PKA0_SIA3_SS0_SU32_SUM0_SUS256_SPO0_SRVW0_SSO0_SVW8_SK0_SKXCCM0_TLDS1_ULSGRO0_USL1_UIOFGRO0_USFGROn1_VSn1_VWA1_VWB1_WSGRA0_WSGRB0_WS32_WG32_4_1_WGM8_WGMXCC1_WGMXCCGn1
    SolutionIndex: 154
    SolutionNameMin: Cijk_Ailk_Bljk_BSS_BH_Bias_S_HA_S_SAV_UserArgs_MT64x64x32_MI16x16x1_SN_LDSB0_AFC1_AFEM1_AFEM1_ASEM1_CLR1_CADS0_DTVA0_DTVB0_EPS0_FDSI0_GRPM1_GRVWA8_GRVWB8_GSU1_GSUAMB_GSUC0_GSUWGMRR0_GLS0_ISA1201_IU1_K1_LBSPPA1024_LBSPPB128_LBSPPM0_LPA16_LPB16_LPM0_LRVW8_LWPMn1_MIAV1_MIWT2_2_MO40_NTn1_NTA0_NTB0_NTC0_NTD0_NTM0_NEPBS0_NLCA1_NLCB1_ONLL1_PGR1_PLR0_PKA0_SIA3_SS0_SU32_SUM0_SUS256_SPO0_SRVW0_SSO0_SVW8_SK0_SKXCCM0_TLDS1_ULSGRO0_USL1_UIOFGRO0_USFGROn1_VSn1_VWA1_VWB1_WSGRA0_WSGRB0_WS32_WG32_4_1_WGM8_WGMXCC1_WGMXCCGn1
    SolutionIndex: 155
    SolutionNameMin: Cijk_Ailk_Bljk_BSS_BH_Bias_S_HA_S_SAV_UserArgs_MT16x16x32_MI16x16x1_SN_LDSB0_AFC1_AFEM1_AFEM1_ASEM1_CLR1_CADS0_DTVA0_DTVB0_EPS1_FDSI0_GRPM1_GRVWA1_GRVWB1_GSU1_GSUAMB_GSUC0_GSUWGMRR0_GLS0_ISA1201_IU1_K1_LBSPPA256_LBSPPB128_LBSPPM0_LPA16_LPB16_LPM0_LRVW8_LWPMn1_MIAV1_MIWT1_1_MO40_NTn1_NTA0_NTB0_NTC0_NTD0_NTM0_NEPBS0_NLCA1_NLCB1_ONLL1_PGR1_PLR1_PKA0_SIA1_SS0_SU32_SUM0_SUS256_SPO0_SRVW0_SSO0_SVW8_SK0_SKXCCM0_TLDS1_ULSGRO0_USL1_UIOFGRO0_USFGROn1_VSn1_VWA1_VWB1_WSGRA0_WSGRB0_WS32_WG16_2_1_WGM8_WGMXCC1_WGMXCCGn1
    SolutionIndex: 156
    SolutionNameMin: Cijk_Ailk_Bljk_BSS_BH_Bias_S_HA_S_SAV_UserArgs_MT16x16x32_MI16x16x1_SN_LDSB1_AFC1_AFEM1_AFEM1_ASEM1_CLR1_CADS0_DTVA0_DTVB0_EPS0_FDSI0_GRPM1_GRVWA1_GRVWB8_GSU1_GSUAMB_GSUC0_GSUWGMRR0_GLS0_ISA1201_IU1_K1_LBSPPA256_LBSPPB128_LBSPPM0_LPA16_LPB16_LPM0_LRVW8_LWPMn1_MIAV1_MIWT1_1_MO40_NTn1_NTA0_NTB0_NTC0_NTD0_NTM0_NEPBS0_NLCA1_NLCB1_ONLL1_PGR2_PLR0_PKA0_SIA3_SS0_SU32_SUM0_SUS256_SPO0_SRVW0_SSO0_SVW8_SK0_SKXCCM0_TLDS1_ULSGRO0_USL1_UIOFGRO0_USFGROn1_VSn1_VWA1_VWB1_WSGRA0_WSGRB0_WS32_WG16_2_1_WGM8_WGMXCC1_WGMXCCGn1
    SolutionIndex: 157
    SolutionNameMin: Cijk_Ailk_Bljk_BSS_BH_Bias_S_HA_S_SAV_UserArgs_MT64x64x32_MI16x16x1_SN_LDSB0_AFC1_AFEM1_AFEM1_ASEM1_CLR0_CADS0_DTVA0_DTVB0_EPS0_FDSI0_GRPM1_GRVWA8_GRVWB8_GSU1_GSUAMB_GSUC0_GSUWGMRR0_GLS0_ISA1201_IU1_K1_LBSPPA128_LBSPPB128_LBSPPM0_LPA16_LPB16_LPM0_LRVW8_LWPMn1_MIAV1_MIWT2_2_MO40_NTn1_NTA0_NTB0_NTC0_NTD0_NTM0_NEPBS0_NLCA1_NLCB1_ONLL1_PGR1_PLR1_PKA0_SIA1_SS0_SU32_SUM0_SUS256_SPO0_SRVW0_SSO0_SVW8_SK0_SKXCCM0_TLDS2_ULSGRO0_USL1_UIOFGRO0_USFGROn1_VSn1_VWA1_VWB1_WSGRA0_WSGRB0_WS32_WG32_4_1_WGM8_WGMXCC1_WGMXCCGn1
    SolutionIndex: 158
    SolutionNameMin: Cijk_Ailk_Bljk_BSS_BH_Bias_S_HA_S_SAV_UserArgs_MT16x16x32_MI16x16x1_SN_LDSB1_AFC1_AFEM1_AFEM1_ASEM1_CLR1_CADS0_DTVA0_DTVB0_EPS0_FDSI0_GRPM1_GRVWA8_GRVWB8_GSU1_GSUAMB_GSUC0_GSUWGMRR0_GLS0_ISA1201_IU1_K1_LBSPPA256_LBSPPB128_LBSPPM0_LPA16_LPB16_LPM0_LRVW8_LWPMn1_MIAV1_MIWT1_1_MO40_NTn1_NTA0_NTB0_NTC0_NTD0_NTM0_NEPBS0_NLCA1_NLCB1_ONLL1_PGR2_PLR0_PKA0_SIA3_SS1_SU32_SUM0_SUS256_SPO0_SRVW0_SSO0_SVW1_SK0_SKXCCM0_TLDS1_ULSGRO0_USL1_UIOFGRO0_USFGROn1_VSn1_VWA1_VWB1_WSGRA0_WSGRB0_WS32_WG16_2_1_WGM8_WGMXCC1_WGMXCCGn1
    SolutionIndex: 159
    SolutionNameMin: Cijk_Ailk_Bljk_BSS_BH_Bias_S_HA_S_SAV_UserArgs_MT64x64x32_MI16x16x1_SN_LDSB0_AFC1_AFEM1_AFEM1_ASEM1_CLR0_CADS0_DTVA0_DTVB0_EPS0_FDSI0_GRPM1_GRVWA1_GRVWB8_GSU1_GSUAMB_GSUC0_GSUWGMRR0_GLS0_ISA1201_IU1_K1_LBSPPA1024_LBSPPB128_LBSPPM0_LPA16_LPB16_LPM0_LRVW8_LWPMn1_MIAV1_MIWT2_2_MO40_NTn1_NTA0_NTB0_NTC0_NTD0_NTM0_NEPBS0_NLCA1_NLCB1_ONLL1_PGR1_PLR0_PKA0_SIA1_SS0_SU32_SUM0_SUS256_SPO0_SRVW0_SSO0_SVW8_SK0_SKXCCM0_TLDS1_ULSGRO0_USL1_UIOFGRO0_USFGROn1_VSn1_VWA1_VWB1_WSGRA0_WSGRB0_WS32_WG32_4_1_WGM8_WGMXCC1_WGMXCCGn1
    SolutionIndex: 160
    SolutionNameMin: Cijk_Ailk_Bljk_BSS_BH_Bias_S_HA_S_SAV_UserArgs_MT64x64x32_MI16x16x1_SN_LDSB0_AFC1_AFEM1_AFEM1_ASEM1_CLR1_CADS0_DTVA0_DTVB0_EPS1_FDSI0_GRPM1_GRVWA8_GRVWB8_GSU1_GSUAMB_GSUC0_GSUWGMRR0_GLS0_ISA1201_IU1_K1_LBSPPA1024_LBSPPB128_LBSPPM0_LPA16_LPB16_LPM0_LRVW8_LWPMn1_MIAV1_MIWT2_2_MO40_NTn1_NTA0_NTB0_NTC0_NTD0_NTM0_NEPBS0_NLCA1_NLCB1_ONLL1_PGR1_PLR0_PKA0_SIA1_SS0_SU32_SUM0_SUS256_SPO0_SRVW0_SSO0_SVW8_SK0_SKXCCM0_TLDS1_ULSGRO0_USL1_UIOFGRO0_USFGROn1_VSn1_VWA1_VWB1_WSGRA0_WSGRB0_WS32_WG32_4_1_WGM8_WGMXCC1_WGMXCCGn1
    SolutionIndex: 161
    SolutionNameMin: Cijk_Ailk_Bljk_BSS_BH_Bias_S_HA_S_SAV_UserArgs_MT16x16x32_MI16x16x1_SN_LDSB0_AFC1_AFEM1_AFEM1_ASEM1_CLR0_CADS0_DTVA0_DTVB0_EPS0_FDSI0_GRPM1_GRVWA8_GRVWB8_GSU1_GSUAMB_GSUC0_GSUWGMRR0_GLS0_ISA1201_IU1_K1_LBSPPA128_LBSPPB128_LBSPPM0_LPA16_LPB16_LPM0_LRVW8_LWPMn1_MIAV1_MIWT1_1_MO40_NTn1_NTA0_NTB0_NTC0_NTD0_NTM0_NEPBS0_NLCA1_NLCB1_ONLL1_PGR2_PLR1_PKA0_SIA1_SS1_SU32_SUM0_SUS256_SPO0_SRVW0_SSO0_SVW1_SK0_SKXCCM0_TLDS2_ULSGRO0_USL1_UIOFGRO0_USFGROn1_VSn1_VWA1_VWB1_WSGRA0_WSGRB0_WS32_WG16_2_1_WGM8_WGMXCC1_WGMXCCGn1
    SolutionIndex: 162
    SolutionNameMin: Cijk_Ailk_Bljk_BSS_BH_Bias_S_HA_S_SAV_UserArgs_MT16x16x32_MI16x16x1_SN_LDSB0_AFC1_AFEM1_AFEM1_ASEM1_CLR1_CADS0_DTVA0_DTVB0_EPS1_FDSI0_GRPM1_GRVWA8_GRVWB8_GSU1_GSUAMB_GSUC0_GSUWGMRR0_GLS0_ISA1201_IU1_K1_LBSPPA128_LBSPPB128_LBSPPM0_LPA16_LPB16_LPM0_LRVW8_LWPMn1_MIAV1_MIWT1_1_MO40_NTn1_NTA0_NTB0_NTC0_NTD0_NTM0_NEPBS0_NLCA1_NLCB1_ONLL1_PGR1_PLR0_PKA0_SIA1_SS0_SU32_SUM0_SUS256_SPO0_SRVW0_SSO0_SVW8_SK0_SKXCCM0_TLDS2_ULSGRO0_USL1_UIOFGRO0_USFGROn1_VSn1_VWA1_VWB1_WSGRA0_WSGRB0_WS32_WG16_2_1_WGM8_WGMXCC1_WGMXCCGn1
    SolutionIndex: 163
    SolutionNameMin: Cijk_Ailk_Bljk_BSS_BH_Bias_S_HA_S_SAV_UserArgs_MT64x64x32_MI16x16x1_SN_LDSB0_AFC1_AFEM1_AFEM1_ASEM1_CLR0_CADS0_DTVA0_DTVB0_EPS0_FDSI0_GRPM1_GRVWA1_GRVWB8_GSU1_GSUAMB_GSUC0_GSUWGMRR0_GLS0_ISA1201_IU1_K1_LBSPPA1024_LBSPPB128_LBSPPM0_LPA16_LPB16_LPM0_LRVW8_LWPMn1_MIAV1_MIWT2_2_MO40_NTn1_NTA0_NTB0_NTC0_NTD0_NTM0_NEPBS0_NLCA1_NLCB1_ONLL1_PGR2_PLR0_PKA0_SIA1_SS0_SU32_SUM0_SUS256_SPO0_SRVW0_SSO0_SVW8_SK0_SKXCCM0_TLDS1_ULSGRO0_USL1_UIOFGRO0_USFGROn1_VSn1_VWA1_VWB1_WSGRA0_WSGRB0_WS32_WG32_4_1_WGM8_WGMXCC1_WGMXCCGn1
    SolutionIndex: 164
    SolutionNameMin: Cijk_Ailk_Bljk_BSS_BH_Bias_S_HA_S_SAV_UserArgs_MT64x64x32_MI16x16x1_SN_LDSB0_AFC1_AFEM1_AFEM1_ASEM1_CLR1_CADS0_DTVA0_DTVB0_EPS0_FDSI0_GRPM1_GRVWA8_GRVWB1_GSU1_GSUAMB_GSUC0_GSUWGMRR0_GLS0_ISA1201_IU1_K1_LBSPPA1024_LBSPPB128_LBSPPM0_LPA16_LPB16_LPM0_LRVW8_LWPMn1_MIAV1_MIWT2_2_MO40_NTn1_NTA0_NTB0_NTC0_NTD0_NTM0_NEPBS0_NLCA1_NLCB1_ONLL1_PGR1_PLR1_PKA0_SIA1_SS0_SU32_SUM0_SUS256_SPO0_SRVW0_SSO0_SVW8_SK0_SKXCCM0_TLDS1_ULSGRO0_USL1_UIOFGRO0_USFGROn1_VSn1_VWA1_VWB1_WSGRA0_WSGRB0_WS32_WG32_4_1_WGM8_WGMXCC1_WGMXCCGn1
    SolutionIndex: 165
    SolutionNameMin: Cijk_Ailk_Bljk_BSS_BH_Bias_S_HA_S_SAV_UserArgs_MT64x64x32_MI16x16x1_SN_LDSB0_AFC1_AFEM1_AFEM1_ASEM1_CLR0_CADS0_DTVA0_DTVB0_EPS0_FDSI0_GRPM1_GRVWA1_GRVWB8_GSU1_GSUAMB_GSUC0_GSUWGMRR0_GLS0_ISA1201_IU1_K1_LBSPPA1024_LBSPPB128_LBSPPM0_LPA16_LPB16_LPM0_LRVW8_LWPMn1_MIAV1_MIWT2_2_MO40_NTn1_NTA0_NTB0_NTC0_NTD0_NTM0_NEPBS0_NLCA1_NLCB1_ONLL1_PGR2_PLR1_PKA0_SIA1_SS0_SU32_SUM0_SUS256_SPO0_SRVW0_SSO0_SVW8_SK0_SKXCCM0_TLDS1_ULSGRO0_USL1_UIOFGRO0_USFGROn1_VSn1_VWA1_VWB1_WSGRA0_WSGRB0_WS32_WG32_4_1_WGM8_WGMXCC1_WGMXCCGn1
    SolutionIndex: 166
    SolutionNameMin: Cijk_Ailk_Bljk_BSS_BH_Bias_S_HA_S_SAV_UserArgs_MT16x16x32_MI16x16x1_SN_LDSB1_AFC1_AFEM1_AFEM1_ASEM32_CLR0_CADS0_DTVA0_DTVB1_EPS0_FDSI0_GRPM1_GRVWA8_GRVWB8_GSU1_GSUAMB_GSUC0_GSUWGMRR0_GLS0_ISA1201_IU1_K1_LBSPPA128_LBSPPB0_LBSPPM0_LPA16_LPB0_LPM0_LRVW8_LWPMn1_MIAV1_MIWT1_1_MO40_NTn1_NTA0_NTB0_NTC0_NTD0_NTM0_NEPBS0_NLCA1_NLCB2_ONLL1_PGR1_PLR1_PKA0_SIA3_SS0_SU32_SUM0_SUS256_SPO0_SRVW0_SSO0_SVW8_SK0_SKXCCM0_TLDS2_ULSGRO0_USL1_UIOFGRO0_USFGROn1_VSn1_VWA1_VWB1_WSGRA0_WSGRB0_WS32_WG16_2_1_WGM8_WGMXCC1_WGMXCCGn1
    SolutionIndex: 167
    SolutionNameMin: Cijk_Ailk_Bljk_BSS_BH_Bias_S_HA_S_SAV_UserArgs_MT64x64x32_MI16x16x1_SN_LDSB0_AFC1_AFEM1_AFEM1_ASEM1_CLR1_CADS0_DTVA0_DTVB0_EPS0_FDSI0_GRPM1_GRVWA1_GRVWB8_GSU1_GSUAMB_GSUC0_GSUWGMRR0_GLS0_ISA1201_IU1_K1_LBSPPA1024_LBSPPB128_LBSPPM0_LPA16_LPB16_LPM0_LRVW8_LWPMn1_MIAV1_MIWT2_2_MO40_NTn1_NTA0_NTB0_NTC0_NTD0_NTM0_NEPBS0_NLCA1_NLCB1_ONLL1_PGR1_PLR0_PKA0_SIA1_SS0_SU32_SUM0_SUS256_SPO0_SRVW0_SSO0_SVW8_SK0_SKXCCM0_TLDS1_ULSGRO0_USL1_UIOFGRO0_USFGROn1_VSn1_VWA1_VWB1_WSGRA0_WSGRB0_WS32_WG32_4_1_WGM8_WGMXCC1_WGMXCCGn1
    SolutionIndex: 168
    SolutionNameMin: Cijk_Ailk_Bljk_BSS_BH_Bias_S_HA_S_SAV_UserArgs_MT64x64x32_MI16x16x1_SN_LDSB0_AFC1_AFEM1_AFEM1_ASEM1_CLR1_CADS0_DTVA0_DTVB0_EPS0_FDSI0_GRPM1_GRVWA1_GRVWB8_GSU1_GSUAMB_GSUC0_GSUWGMRR0_GLS0_ISA1201_IU1_K1_LBSPPA1024_LBSPPB128_LBSPPM0_LPA16_LPB16_LPM0_LRVW8_LWPMn1_MIAV1_MIWT2_2_MO40_NTn1_NTA0_NTB0_NTC0_NTD0_NTM0_NEPBS0_NLCA1_NLCB1_ONLL1_PGR1_PLR1_PKA0_SIA1_SS0_SU32_SUM0_SUS256_SPO0_SRVW0_SSO0_SVW8_SK0_SKXCCM0_TLDS1_ULSGRO0_USL1_UIOFGRO0_USFGROn1_VSn1_VWA1_VWB1_WSGRA0_WSGRB0_WS32_WG32_4_1_WGM8_WGMXCC1_WGMXCCGn1
    SolutionIndex: 169
    SolutionNameMin: Cijk_Ailk_Bljk_BSS_BH_Bias_S_HA_S_SAV_UserArgs_MT64x64x32_MI16x16x1_SN_LDSB0_AFC1_AFEM1_AFEM1_ASEM1_CLR0_CADS0_DTVA0_DTVB0_EPS1_FDSI0_GRPM1_GRVWA8_GRVWB8_GSU1_GSUAMB_GSUC0_GSUWGMRR0_GLS0_ISA1201_IU1_K1_LBSPPA1024_LBSPPB128_LBSPPM0_LPA16_LPB16_LPM0_LRVW8_LWPMn1_MIAV1_MIWT2_2_MO40_NTn1_NTA0_NTB0_NTC0_NTD0_NTM0_NEPBS0_NLCA1_NLCB1_ONLL1_PGR1_PLR0_PKA0_SIA3_SS0_SU32_SUM0_SUS256_SPO0_SRVW0_SSO0_SVW8_SK0_SKXCCM0_TLDS1_ULSGRO0_USL1_UIOFGRO0_USFGROn1_VSn1_VWA1_VWB1_WSGRA0_WSGRB0_WS32_WG32_4_1_WGM8_WGMXCC1_WGMXCCGn1
    SolutionIndex: 170
    SolutionNameMin: Cijk_Ailk_Bljk_BSS_BH_Bias_S_HA_S_SAV_UserArgs_MT64x64x32_MI16x16x1_SN_LDSB1_AFC1_AFEM1_AFEM1_ASEM1_CLR1_CADS0_DTVA0_DTVB0_EPS1_FDSI0_GRPM1_GRVWA1_GRVWB8_GSU1_GSUAMB_GSUC0_GSUWGMRR0_GLS0_ISA1201_IU1_K1_LBSPPA1024_LBSPPB128_LBSPPM0_LPA16_LPB16_LPM0_LRVW8_LWPMn1_MIAV1_MIWT2_2_MO40_NTn1_NTA0_NTB0_NTC0_NTD0_NTM0_NEPBS0_NLCA1_NLCB1_ONLL1_PGR1_PLR0_PKA0_SIA3_SS0_SU32_SUM0_SUS256_SPO0_SRVW0_SSO0_SVW8_SK0_SKXCCM0_TLDS1_ULSGRO0_USL1_UIOFGRO0_USFGROn1_VSn1_VWA1_VWB1_WSGRA0_WSGRB0_WS32_WG32_4_1_WGM8_WGMXCC1_WGMXCCGn1
    SolutionIndex: 171
    SolutionNameMin: Cijk_Ailk_Bljk_BSS_BH_Bias_S_HA_S_SAV_UserArgs_MT64x64x32_MI16x16x1_SN_LDSB0_AFC1_AFEM1_AFEM1_ASEM1_CLR0_CADS0_DTVA0_DTVB0_EPS0_FDSI0_GRPM1_GRVWA1_GRVWB8_GSU1_GSUAMB_GSUC0_GSUWGMRR0_GLS0_ISA1201_IU1_K1_LBSPPA1024_LBSPPB1024_LBSPPM0_LPA16_LPB16_LPM0_LRVW8_LWPMn1_MIAV1_MIWT2_2_MO40_NTn1_NTA0_NTB0_NTC0_NTD0_NTM0_NEPBS0_NLCA1_NLCB1_ONLL1_PGR2_PLR1_PKA0_SIA1_SS0_SU32_SUM0_SUS256_SPO0_SRVW0_SSO0_SVW8_SK0_SKXCCM0_TLDS0_ULSGRO0_USL1_UIOFGRO0_USFGROn1_VSn1_VWA1_VWB1_WSGRA0_WSGRB0_WS32_WG32_4_1_WGM8_WGMXCC1_WGMXCCGn1
    SolutionIndex: 172
    SolutionNameMin: Cijk_Ailk_Bljk_BSS_BH_Bias_S_HA_S_SAV_UserArgs_MT64x64x32_MI16x16x1_SN_LDSB1_AFC1_AFEM1_AFEM1_ASEM1_CLR1_CADS0_DTVA0_DTVB0_EPS0_FDSI0_GRPM1_GRVWA8_GRVWB8_GSU1_GSUAMB_GSUC0_GSUWGMRR0_GLS0_ISA1201_IU1_K1_LBSPPA1024_LBSPPB128_LBSPPM0_LPA16_LPB16_LPM0_LRVW8_LWPMn1_MIAV1_MIWT2_2_MO40_NTn1_NTA0_NTB0_NTC0_NTD0_NTM0_NEPBS0_NLCA1_NLCB1_ONLL1_PGR1_PLR0_PKA0_SIA3_SS0_SU32_SUM0_SUS256_SPO0_SRVW0_SSO0_SVW8_SK0_SKXCCM0_TLDS1_ULSGRO0_USL1_UIOFGRO0_USFGROn1_VSn1_VWA1_VWB1_WSGRA0_WSGRB0_WS32_WG32_4_1_WGM8_WGMXCC1_WGMXCCGn1
    SolutionIndex: 173
    SolutionNameMin: Cijk_Ailk_Bljk_BSS_BH_Bias_S_HA_S_SAV_UserArgs_MT64x64x32_MI16x16x1_SN_LDSB0_AFC1_AFEM1_AFEM1_ASEM1_CLR1_CADS0_DTVA0_DTVB0_EPS0_FDSI0_GRPM1_GRVWA1_GRVWB8_GSU1_GSUAMB_GSUC0_GSUWGMRR0_GLS0_ISA1201_IU1_K1_LBSPPA1024_LBSPPB128_LBSPPM0_LPA16_LPB16_LPM0_LRVW8_LWPMn1_MIAV1_MIWT2_2_MO40_NTn1_NTA0_NTB0_NTC0_NTD0_NTM0_NEPBS0_NLCA1_NLCB1_ONLL1_PGR1_PLR1_PKA0_SIA3_SS0_SU32_SUM0_SUS256_SPO0_SRVW0_SSO0_SVW8_SK0_SKXCCM0_TLDS1_ULSGRO0_USL1_UIOFGRO0_USFGROn1_VSn1_VWA1_VWB1_WSGRA0_WSGRB0_WS32_WG32_4_1_WGM8_WGMXCC1_WGMXCCGn1
    SolutionIndex: 174
    SolutionNameMin: Cijk_Ailk_Bljk_BSS_BH_Bias_S_HA_S_SAV_UserArgs_MT128x128x32_MI16x16x1_SN_LDSB0_AFC1_AFEM1_AFEM1_ASEM1_CLR1_CADS0_DTVA0_DTVB0_EPS1_FDSI0_GRPM1_GRVWA8_GRVWB8_GSU1_GSUAMB_GSUC0_GSUWGMRR0_GLS0_ISA1201_IU1_K1_LBSPPA2048_LBSPPB256_LBSPPM0_LPA0_LPB16_LPM0_LRVW8_LWPMn1_MIAV1_MIWT4_4_MO40_NTn1_NTA0_NTB0_NTC0_NTD0_NTM0_NEPBS0_NLCA1_NLCB1_ONLL1_PGR1_PLR1_PKA0_SIA1_SS0_SU32_SUM0_SUS256_SPO0_SRVW0_SSO0_SVW8_SK0_SKXCCM0_TLDS1_ULSGRO0_USL1_UIOFGRO0_USFGROn1_VSn1_VWA4_VWB4_WSGRA0_WSGRB0_WS32_WG32_4_1_WGM8_WGMXCC1_WGMXCCGn1
    SolutionIndex: 175
    SolutionNameMin: Cijk_Ailk_Bljk_BSS_BH_Bias_S_HA_S_SAV_UserArgs_MT16x16x32_MI16x16x1_SN_LDSB0_AFC1_AFEM1_AFEM1_ASEM32_CLR0_CADS0_DTVA0_DTVB1_EPS1_FDSI0_GRPM1_GRVWA8_GRVWB8_GSU1_GSUAMB_GSUC0_GSUWGMRR0_GLS0_ISA1201_IU1_K1_LBSPPA128_LBSPPB0_LBSPPM0_LPA16_LPB0_LPM0_LRVW8_LWPMn1_MIAV1_MIWT1_1_MO40_NTn1_NTA0_NTB0_NTC0_NTD0_NTM0_NEPBS0_NLCA1_NLCB2_ONLL1_PGR1_PLR1_PKA0_SIA3_SS0_SU32_SUM0_SUS256_SPO0_SRVW0_SSO0_SVW8_SK0_SKXCCM0_TLDS2_ULSGRO0_USL1_UIOFGRO0_USFGROn1_VSn1_VWA1_VWB1_WSGRA0_WSGRB0_WS32_WG16_2_1_WGM8_WGMXCC1_WGMXCCGn1
    SolutionIndex: 176
    SolutionNameMin: Cijk_Ailk_Bljk_BSS_BH_Bias_S_HA_S_SAV_UserArgs_MT128x128x32_MI16x16x1_SN_LDSB0_AFC1_AFEM1_AFEM1_ASEM1_CLR0_CADS0_DTVA0_DTVB0_EPS0_FDSI0_GRPM1_GRVWA8_GRVWB8_GSU1_GSUAMB_GSUC0_GSUWGMRR0_GLS0_ISA1201_IU1_K1_LBSPPA2048_LBSPPB128_LBSPPM0_LPA0_LPB16_LPM0_LRVW8_LWPMn1_MIAV1_MIWT4_4_MO40_NTn1_NTA0_NTB0_NTC0_NTD0_NTM0_NEPBS0_NLCA1_NLCB1_ONLL1_PGR1_PLR1_PKA0_SIA1_SS0_SU32_SUM0_SUS256_SPO0_SRVW0_SSO0_SVW8_SK0_SKXCCM0_TLDS1_ULSGRO0_USL1_UIOFGRO0_USFGROn1_VSn1_VWA4_VWB1_WSGRA0_WSGRB0_WS32_WG32_4_1_WGM8_WGMXCC1_WGMXCCGn1
    SolutionIndex: 177
    SolutionNameMin: Cijk_Ailk_Bljk_BSS_BH_Bias_S_HA_S_SAV_UserArgs_MT64x64x32_MI16x16x1_SN_LDSB0_AFC1_AFEM1_AFEM1_ASEM1_CLR0_CADS0_DTVA0_DTVB0_EPS1_FDSI0_GRPM1_GRVWA1_GRVWB1_GSU1_GSUAMB_GSUC0_GSUWGMRR0_GLS0_ISA1201_IU1_K1_LBSPPA1024_LBSPPB128_LBSPPM0_LPA16_LPB16_LPM0_LRVW8_LWPMn1_MIAV1_MIWT2_2_MO40_NTn1_NTA0_NTB0_NTC0_NTD0_NTM0_NEPBS0_NLCA1_NLCB1_ONLL1_PGR1_PLR1_PKA0_SIA1_SS0_SU32_SUM0_SUS256_SPO0_SRVW0_SSO0_SVW8_SK0_SKXCCM0_TLDS1_ULSGRO0_USL1_UIOFGRO0_USFGROn1_VSn1_VWA1_VWB1_WSGRA0_WSGRB0_WS32_WG32_4_1_WGM8_WGMXCC1_WGMXCCGn1
    SolutionIndex: 178
    SolutionNameMin: Cijk_Ailk_Bljk_BSS_BH_Bias_S_HA_S_SAV_UserArgs_MT16x16x32_MI16x16x1_SN_LDSB0_AFC1_AFEM1_AFEM1_ASEM1_CLR0_CADS0_DTVA0_DTVB0_EPS0_FDSI0_GRPM1_GRVWA8_GRVWB8_GSU1_GSUAMB_GSUC0_GSUWGMRR0_GLS0_ISA1201_IU1_K1_LBSPPA128_LBSPPB128_LBSPPM0_LPA16_LPB16_LPM0_LRVW8_LWPMn1_MIAV1_MIWT1_1_MO40_NTn1_NTA0_NTB0_NTC0_NTD0_NTM0_NEPBS0_NLCA1_NLCB1_ONLL1_PGR2_PLR0_PKA0_SIA1_SS0_SU32_SUM0_SUS256_SPO0_SRVW0_SSO0_SVW8_SK0_SKXCCM0_TLDS2_ULSGRO0_USL1_UIOFGRO0_USFGROn1_VSn1_VWA1_VWB1_WSGRA0_WSGRB0_WS32_WG16_2_1_WGM8_WGMXCC1_WGMXCCGn1
    SolutionIndex: 179
    SolutionNameMin: Cijk_Ailk_Bljk_BSS_BH_Bias_S_HA_S_SAV_UserArgs_MT64x64x32_MI16x16x1_SN_LDSB0_AFC1_AFEM1_AFEM1_ASEM1_CLR1_CADS0_DTVA0_DTVB0_EPS0_FDSI0_GRPM1_GRVWA8_GRVWB8_GSU1_GSUAMB_GSUC0_GSUWGMRR0_GLS0_ISA1201_IU1_K1_LBSPPA1024_LBSPPB128_LBSPPM0_LPA16_LPB16_LPM0_LRVW8_LWPMn1_MIAV1_MIWT2_2_MO40_NTn1_NTA0_NTB0_NTC0_NTD0_NTM0_NEPBS0_NLCA1_NLCB1_ONLL1_PGR1_PLR1_PKA0_SIA3_SS0_SU32_SUM0_SUS256_SPO0_SRVW0_SSO0_SVW8_SK0_SKXCCM0_TLDS1_ULSGRO0_USL1_UIOFGRO0_USFGROn1_VSn1_VWA1_VWB1_WSGRA0_WSGRB0_WS32_WG32_4_1_WGM8_WGMXCC1_WGMXCCGn1
    SolutionIndex: 180
    SolutionNameMin: Cijk_Ailk_Bljk_BSS_BH_Bias_S_HA_S_SAV_UserArgs_MT64x64x32_MI16x16x1_SN_LDSB0_AFC1_AFEM1_AFEM1_ASEM1_CLR1_CADS0_DTVA0_DTVB0_EPS1_FDSI0_GRPM1_GRVWA1_GRVWB8_GSU1_GSUAMB_GSUC0_GSUWGMRR0_GLS0_ISA1201_IU1_K1_LBSPPA1024_LBSPPB128_LBSPPM0_LPA16_LPB16_LPM0_LRVW8_LWPMn1_MIAV1_MIWT2_2_MO40_NTn1_NTA0_NTB0_NTC0_NTD0_NTM0_NEPBS0_NLCA1_NLCB1_ONLL1_PGR1_PLR1_PKA0_SIA1_SS0_SU32_SUM0_SUS256_SPO0_SRVW0_SSO0_SVW8_SK0_SKXCCM0_TLDS1_ULSGRO0_USL1_UIOFGRO0_USFGROn1_VSn1_VWA1_VWB1_WSGRA0_WSGRB0_WS32_WG32_4_1_WGM8_WGMXCC1_WGMXCCGn1
    SolutionIndex: 181
    SolutionNameMin: Cijk_Ailk_Bljk_BSS_BH_Bias_S_HA_S_SAV_UserArgs_MT64x64x32_MI16x16x1_SN_LDSB0_AFC1_AFEM1_AFEM1_ASEM1_CLR0_CADS0_DTVA0_DTVB0_EPS0_FDSI0_GRPM1_GRVWA8_GRVWB8_GSU1_GSUAMB_GSUC0_GSUWGMRR0_GLS0_ISA1201_IU1_K1_LBSPPA1024_LBSPPB128_LBSPPM0_LPA16_LPB16_LPM0_LRVW8_LWPMn1_MIAV1_MIWT2_2_MO40_NTn1_NTA0_NTB0_NTC0_NTD0_NTM0_NEPBS0_NLCA1_NLCB1_ONLL1_PGR2_PLR0_PKA0_SIA1_SS0_SU32_SUM0_SUS256_SPO0_SRVW0_SSO0_SVW8_SK0_SKXCCM0_TLDS1_ULSGRO0_USL1_UIOFGRO0_USFGROn1_VSn1_VWA1_VWB1_WSGRA0_WSGRB0_WS32_WG32_4_1_WGM8_WGMXCC1_WGMXCCGn1
    SolutionIndex: 182
    SolutionNameMin: Cijk_Ailk_Bljk_BSS_BH_Bias_S_HA_S_SAV_UserArgs_MT64x64x32_MI16x16x1_SN_LDSB0_AFC1_AFEM1_AFEM1_ASEM1_CLR0_CADS0_DTVA0_DTVB0_EPS0_FDSI0_GRPM1_GRVWA8_GRVWB8_GSU1_GSUAMB_GSUC0_GSUWGMRR0_GLS0_ISA1201_IU1_K1_LBSPPA1024_LBSPPB128_LBSPPM0_LPA16_LPB16_LPM0_LRVW8_LWPMn1_MIAV1_MIWT2_2_MO40_NTn1_NTA0_NTB0_NTC0_NTD0_NTM0_NEPBS0_NLCA1_NLCB1_ONLL1_PGR1_PLR0_PKA0_SIA3_SS0_SU32_SUM0_SUS256_SPO0_SRVW0_SSO0_SVW8_SK0_SKXCCM0_TLDS1_ULSGRO0_USL1_UIOFGRO0_USFGROn1_VSn1_VWA1_VWB1_WSGRA0_WSGRB0_WS32_WG32_4_1_WGM8_WGMXCC1_WGMXCCGn1
    SolutionIndex: 183
    SolutionNameMin: Cijk_Ailk_Bljk_BSS_BH_Bias_S_HA_S_SAV_UserArgs_MT16x16x32_MI16x16x1_SN_LDSB0_AFC1_AFEM1_AFEM1_ASEM32_CLR1_CADS0_DTVA0_DTVB1_EPS0_FDSI0_GRPM1_GRVWA8_GRVWB8_GSU1_GSUAMB_GSUC0_GSUWGMRR0_GLS0_ISA1201_IU1_K1_LBSPPA128_LBSPPB0_LBSPPM0_LPA16_LPB0_LPM0_LRVW8_LWPMn1_MIAV1_MIWT1_1_MO40_NTn1_NTA0_NTB0_NTC0_NTD0_NTM0_NEPBS0_NLCA1_NLCB2_ONLL1_PGR2_PLR1_PKA0_SIA3_SS1_SU32_SUM0_SUS256_SPO0_SRVW0_SSO0_SVW1_SK0_SKXCCM0_TLDS2_ULSGRO0_USL1_UIOFGRO0_USFGROn1_VSn1_VWA1_VWB1_WSGRA0_WSGRB0_WS32_WG16_2_1_WGM8_WGMXCC1_WGMXCCGn1
    SolutionIndex: 184
    SolutionNameMin: Cijk_Ailk_Bljk_BSS_BH_Bias_S_HA_S_SAV_UserArgs_MT64x64x32_MI16x16x1_SN_LDSB0_AFC1_AFEM1_AFEM1_ASEM1_CLR0_CADS0_DTVA0_DTVB0_EPS0_FDSI0_GRPM1_GRVWA1_GRVWB8_GSU1_GSUAMB_GSUC0_GSUWGMRR0_GLS0_ISA1201_IU1_K1_LBSPPA1024_LBSPPB128_LBSPPM0_LPA16_LPB16_LPM0_LRVW8_LWPMn1_MIAV1_MIWT2_2_MO40_NTn1_NTA0_NTB0_NTC0_NTD0_NTM0_NEPBS0_NLCA1_NLCB1_ONLL1_PGR1_PLR0_PKA0_SIA3_SS0_SU32_SUM0_SUS256_SPO0_SRVW0_SSO0_SVW8_SK0_SKXCCM0_TLDS1_ULSGRO0_USL1_UIOFGRO0_USFGROn1_VSn1_VWA1_VWB1_WSGRA0_WSGRB0_WS32_WG32_4_1_WGM8_WGMXCC1_WGMXCCGn1
    SolutionIndex: 185
    SolutionNameMin: Cijk_Ailk_Bljk_BSS_BH_Bias_S_HA_S_SAV_UserArgs_MT128x128x32_MI16x16x1_SN_LDSB0_AFC1_AFEM1_AFEM1_ASEM1_CLR1_CADS0_DTVA0_DTVB0_EPS0_FDSI0_GRPM1_GRVWA8_GRVWB8_GSU1_GSUAMB_GSUC0_GSUWGMRR0_GLS0_ISA1201_IU1_K1_LBSPPA2048_LBSPPB128_LBSPPM0_LPA0_LPB16_LPM0_LRVW8_LWPMn1_MIAV1_MIWT4_4_MO40_NTn1_NTA0_NTB0_NTC0_NTD0_NTM0_NEPBS0_NLCA1_NLCB1_ONLL1_PGR1_PLR1_PKA0_SIA1_SS0_SU32_SUM0_SUS256_SPO0_SRVW0_SSO0_SVW8_SK0_SKXCCM0_TLDS1_ULSGRO0_USL1_UIOFGRO0_USFGROn1_VSn1_VWA4_VWB1_WSGRA0_WSGRB0_WS32_WG32_4_1_WGM8_WGMXCC1_WGMXCCGn1
    SolutionIndex: 186
    SolutionNameMin: Cijk_Ailk_Bljk_BSS_BH_Bias_S_HA_S_SAV_UserArgs_MT64x64x32_MI16x16x1_SN_LDSB0_AFC1_AFEM1_AFEM1_ASEM1_CLR1_CADS0_DTVA0_DTVB0_EPS1_FDSI0_GRPM1_GRVWA1_GRVWB8_GSU1_GSUAMB_GSUC0_GSUWGMRR0_GLS0_ISA1201_IU1_K1_LBSPPA1024_LBSPPB128_LBSPPM0_LPA16_LPB16_LPM0_LRVW8_LWPMn1_MIAV1_MIWT2_2_MO40_NTn1_NTA0_NTB0_NTC0_NTD0_NTM0_NEPBS0_NLCA1_NLCB1_ONLL1_PGR1_PLR1_PKA0_SIA3_SS0_SU32_SUM0_SUS256_SPO0_SRVW0_SSO0_SVW8_SK0_SKXCCM0_TLDS1_ULSGRO0_USL1_UIOFGRO0_USFGROn1_VSn1_VWA1_VWB1_WSGRA0_WSGRB0_WS32_WG32_4_1_WGM8_WGMXCC1_WGMXCCGn1
    SolutionIndex: 187
    SolutionNameMin: Cijk_Ailk_Bljk_BSS_BH_Bias_S_HA_S_SAV_UserArgs_MT64x64x32_MI16x16x1_SN_LDSB0_AFC1_AFEM1_AFEM1_ASEM1_CLR0_CADS0_DTVA0_DTVB0_EPS0_FDSI0_GRPM1_GRVWA1_GRVWB8_GSU1_GSUAMB_GSUC0_GSUWGMRR0_GLS0_ISA1201_IU1_K1_LBSPPA1024_LBSPPB1024_LBSPPM0_LPA16_LPB16_LPM0_LRVW8_LWPMn1_MIAV1_MIWT2_2_MO40_NTn1_NTA0_NTB0_NTC0_NTD0_NTM0_NEPBS0_NLCA1_NLCB1_ONLL1_PGR2_PLR1_PKA0_SIA3_SS0_SU32_SUM0_SUS256_SPO0_SRVW0_SSO0_SVW8_SK0_SKXCCM0_TLDS0_ULSGRO0_USL1_UIOFGRO0_USFGROn1_VSn1_VWA1_VWB1_WSGRA0_WSGRB0_WS32_WG32_4_1_WGM8_WGMXCC1_WGMXCCGn1
    SolutionIndex: 188
    SolutionNameMin: Cijk_Ailk_Bljk_BSS_BH_Bias_S_HA_S_SAV_UserArgs_MT16x16x32_MI16x16x1_SN_LDSB0_AFC1_AFEM1_AFEM1_ASEM1_CLR0_CADS0_DTVA0_DTVB0_EPS0_FDSI0_GRPM1_GRVWA8_GRVWB8_GSU1_GSUAMB_GSUC0_GSUWGMRR0_GLS0_ISA1201_IU1_K1_LBSPPA128_LBSPPB128_LBSPPM0_LPA16_LPB16_LPM0_LRVW8_LWPMn1_MIAV1_MIWT1_1_MO40_NTn1_NTA0_NTB0_NTC0_NTD0_NTM0_NEPBS0_NLCA1_NLCB1_ONLL1_PGR1_PLR1_PKA0_SIA1_SS0_SU32_SUM0_SUS256_SPO0_SRVW0_SSO0_SVW8_SK0_SKXCCM0_TLDS2_ULSGRO0_USL1_UIOFGRO0_USFGROn1_VSn1_VWA1_VWB1_WSGRA0_WSGRB0_WS32_WG16_2_1_WGM8_WGMXCC1_WGMXCCGn1
    SolutionIndex: 189
    SolutionNameMin: Cijk_Ailk_Bljk_BSS_BH_Bias_S_HA_S_SAV_UserArgs_MT64x64x32_MI16x16x1_SN_LDSB1_AFC1_AFEM1_AFEM1_ASEM1_CLR1_CADS0_DTVA0_DTVB0_EPS0_FDSI0_GRPM1_GRVWA1_GRVWB8_GSU1_GSUAMB_GSUC0_GSUWGMRR0_GLS0_ISA1201_IU1_K1_LBSPPA1024_LBSPPB128_LBSPPM0_LPA16_LPB16_LPM0_LRVW8_LWPMn1_MIAV1_MIWT2_2_MO40_NTn1_NTA0_NTB0_NTC0_NTD0_NTM0_NEPBS0_NLCA1_NLCB1_ONLL1_PGR1_PLR1_PKA0_SIA3_SS0_SU32_SUM0_SUS256_SPO0_SRVW0_SSO0_SVW8_SK0_SKXCCM0_TLDS1_ULSGRO0_USL1_UIOFGRO0_USFGROn1_VSn1_VWA1_VWB1_WSGRA0_WSGRB0_WS32_WG32_4_1_WGM8_WGMXCC1_WGMXCCGn1
    SolutionIndex: 190
    SolutionNameMin: Cijk_Ailk_Bljk_BSS_BH_Bias_S_HA_S_SAV_UserArgs_MT64x64x32_MI16x16x1_SN_LDSB0_AFC1_AFEM1_AFEM1_ASEM1_CLR0_CADS0_DTVA0_DTVB0_EPS1_FDSI0_GRPM1_GRVWA8_GRVWB8_GSU1_GSUAMB_GSUC0_GSUWGMRR0_GLS0_ISA1201_IU1_K1_LBSPPA1024_LBSPPB128_LBSPPM0_LPA16_LPB16_LPM0_LRVW8_LWPMn1_MIAV1_MIWT2_2_MO40_NTn1_NTA0_NTB0_NTC0_NTD0_NTM0_NEPBS0_NLCA1_NLCB1_ONLL1_PGR1_PLR0_PKA0_SIA1_SS0_SU32_SUM0_SUS256_SPO0_SRVW0_SSO0_SVW8_SK0_SKXCCM0_TLDS1_ULSGRO0_USL1_UIOFGRO0_USFGROn1_VSn1_VWA1_VWB1_WSGRA0_WSGRB0_WS32_WG32_4_1_WGM8_WGMXCC1_WGMXCCGn1
    SolutionIndex: 191
    SolutionNameMin: Cijk_Ailk_Bljk_BSS_BH_Bias_S_HA_S_SAV_UserArgs_MT64x64x32_MI16x16x1_SN_LDSB0_AFC1_AFEM1_AFEM1_ASEM1_CLR0_CADS0_DTVA0_DTVB0_EPS1_FDSI0_GRPM1_GRVWA8_GRVWB8_GSU1_GSUAMB_GSUC0_GSUWGMRR0_GLS0_ISA1201_IU1_K1_LBSPPA1024_LBSPPB1024_LBSPPM0_LPA16_LPB16_LPM0_LRVW8_LWPMn1_MIAV1_MIWT2_2_MO40_NTn1_NTA0_NTB0_NTC0_NTD0_NTM0_NEPBS0_NLCA1_NLCB1_ONLL1_PGR1_PLR1_PKA0_SIA3_SS0_SU32_SUM0_SUS256_SPO0_SRVW0_SSO0_SVW8_SK0_SKXCCM0_TLDS0_ULSGRO0_USL1_UIOFGRO0_USFGROn1_VSn1_VWA1_VWB1_WSGRA0_WSGRB0_WS32_WG32_4_1_WGM8_WGMXCC1_WGMXCCGn1
    SolutionIndex: 192
    SolutionNameMin: Cijk_Ailk_Bljk_BSS_BH_Bias_S_HA_S_SAV_UserArgs_MT128x128x32_MI16x16x1_SN_LDSB0_AFC1_AFEM1_AFEM1_ASEM1_CLR0_CADS0_DTVA0_DTVB0_EPS0_FDSI0_GRPM1_GRVWA8_GRVWB8_GSU1_GSUAMB_GSUC0_GSUWGMRR0_GLS0_ISA1201_IU1_K1_LBSPPA2048_LBSPPB256_LBSPPM0_LPA0_LPB16_LPM0_LRVW8_LWPMn1_MIAV1_MIWT4_4_MO40_NTn1_NTA0_NTB0_NTC0_NTD0_NTM0_NEPBS0_NLCA1_NLCB1_ONLL1_PGR1_PLR1_PKA0_SIA1_SS1_SU32_SUM0_SUS256_SPO0_SRVW0_SSO0_SVW4_SK0_SKXCCM0_TLDS1_ULSGRO0_USL1_UIOFGRO0_USFGROn1_VSn1_VWA4_VWB4_WSGRA0_WSGRB0_WS32_WG32_4_1_WGM8_WGMXCC1_WGMXCCGn1
    SolutionIndex: 193
    SolutionNameMin: Cijk_Ailk_Bljk_BSS_BH_Bias_S_HA_S_SAV_UserArgs_MT64x64x32_MI16x16x1_SN_LDSB0_AFC1_AFEM1_AFEM1_ASEM1_CLR0_CADS0_DTVA0_DTVB0_EPS0_FDSI0_GRPM1_GRVWA8_GRVWB8_GSU1_GSUAMB_GSUC0_GSUWGMRR0_GLS0_ISA1201_IU1_K1_LBSPPA1024_LBSPPB128_LBSPPM0_LPA16_LPB16_LPM0_LRVW8_LWPMn1_MIAV1_MIWT2_2_MO40_NTn1_NTA0_NTB0_NTC0_NTD0_NTM0_NEPBS0_NLCA1_NLCB1_ONLL1_PGR2_PLR0_PKA0_SIA3_SS0_SU32_SUM0_SUS256_SPO0_SRVW0_SSO0_SVW8_SK0_SKXCCM0_TLDS1_ULSGRO0_USL1_UIOFGRO0_USFGROn1_VSn1_VWA1_VWB1_WSGRA0_WSGRB0_WS32_WG32_4_1_WGM8_WGMXCC1_WGMXCCGn1
    SolutionIndex: 194
    SolutionNameMin: Cijk_Ailk_Bljk_BSS_BH_Bias_S_HA_S_SAV_UserArgs_MT64x64x32_MI16x16x1_SN_LDSB0_AFC1_AFEM1_AFEM1_ASEM1_CLR0_CADS0_DTVA0_DTVB0_EPS0_FDSI0_GRPM1_GRVWA8_GRVWB8_GSU1_GSUAMB_GSUC0_GSUWGMRR0_GLS0_ISA1201_IU1_K1_LBSPPA1024_LBSPPB1024_LBSPPM0_LPA16_LPB16_LPM0_LRVW8_LWPMn1_MIAV1_MIWT2_2_MO40_NTn1_NTA0_NTB0_NTC0_NTD0_NTM0_NEPBS0_NLCA1_NLCB1_ONLL1_PGR2_PLR1_PKA0_SIA3_SS0_SU32_SUM0_SUS256_SPO0_SRVW0_SSO0_SVW8_SK0_SKXCCM0_TLDS0_ULSGRO0_USL1_UIOFGRO0_USFGROn1_VSn1_VWA1_VWB1_WSGRA0_WSGRB0_WS32_WG32_4_1_WGM8_WGMXCC1_WGMXCCGn1
    SolutionIndex: 195
    SolutionNameMin: Cijk_Ailk_Bljk_BSS_BH_Bias_S_HA_S_SAV_UserArgs_MT128x128x32_MI16x16x1_SN_LDSB0_AFC1_AFEM1_AFEM1_ASEM1_CLR0_CADS0_DTVA0_DTVB0_EPS1_FDSI0_GRPM1_GRVWA8_GRVWB8_GSU1_GSUAMB_GSUC0_GSUWGMRR0_GLS0_ISA1201_IU1_K1_LBSPPA2048_LBSPPB128_LBSPPM0_LPA0_LPB16_LPM0_LRVW8_LWPMn1_MIAV1_MIWT4_4_MO40_NTn1_NTA0_NTB0_NTC0_NTD0_NTM0_NEPBS0_NLCA1_NLCB1_ONLL1_PGR1_PLR1_PKA0_SIA1_SS1_SU32_SUM0_SUS256_SPO0_SRVW0_SSO0_SVW4_SK0_SKXCCM0_TLDS1_ULSGRO0_USL1_UIOFGRO0_USFGROn1_VSn1_VWA4_VWB1_WSGRA0_WSGRB0_WS32_WG32_4_1_WGM8_WGMXCC1_WGMXCCGn1
    SolutionIndex: 196
    SolutionNameMin: Cijk_Ailk_Bljk_BSS_BH_Bias_S_HA_S_SAV_UserArgs_MT16x16x32_MI16x16x1_SN_LDSB1_AFC1_AFEM1_AFEM1_ASEM32_CLR0_CADS0_DTVA0_DTVB1_EPS0_FDSI0_GRPM1_GRVWA8_GRVWB8_GSU1_GSUAMB_GSUC0_GSUWGMRR0_GLS0_ISA1201_IU1_K1_LBSPPA128_LBSPPB0_LBSPPM0_LPA16_LPB0_LPM0_LRVW8_LWPMn1_MIAV1_MIWT1_1_MO40_NTn1_NTA0_NTB0_NTC0_NTD0_NTM0_NEPBS0_NLCA1_NLCB2_ONLL1_PGR2_PLR1_PKA0_SIA3_SS1_SU32_SUM0_SUS256_SPO0_SRVW0_SSO0_SVW1_SK0_SKXCCM0_TLDS2_ULSGRO0_USL1_UIOFGRO0_USFGROn1_VSn1_VWA1_VWB1_WSGRA0_WSGRB0_WS32_WG16_2_1_WGM8_WGMXCC1_WGMXCCGn1
    SolutionIndex: 197
    SolutionNameMin: Cijk_Ailk_Bljk_BSS_BH_Bias_S_HA_S_SAV_UserArgs_MT64x64x32_MI16x16x1_SN_LDSB0_AFC1_AFEM1_AFEM1_ASEM1_CLR1_CADS0_DTVA0_DTVB0_EPS0_FDSI0_GRPM1_GRVWA1_GRVWB1_GSU1_GSUAMB_GSUC0_GSUWGMRR0_GLS0_ISA1201_IU1_K1_LBSPPA1024_LBSPPB128_LBSPPM0_LPA16_LPB16_LPM0_LRVW8_LWPMn1_MIAV1_MIWT2_2_MO40_NTn1_NTA0_NTB0_NTC0_NTD0_NTM0_NEPBS0_NLCA1_NLCB1_ONLL1_PGR1_PLR0_PKA0_SIA3_SS0_SU32_SUM0_SUS256_SPO0_SRVW0_SSO0_SVW8_SK0_SKXCCM0_TLDS1_ULSGRO0_USL1_UIOFGRO0_USFGROn1_VSn1_VWA1_VWB1_WSGRA0_WSGRB0_WS32_WG32_4_1_WGM8_WGMXCC1_WGMXCCGn1
    SolutionIndex: 198
    SolutionNameMin: Cijk_Ailk_Bljk_BSS_BH_Bias_S_HA_S_SAV_UserArgs_MT64x64x32_MI16x16x1_SN_LDSB0_AFC1_AFEM1_AFEM1_ASEM1_CLR0_CADS0_DTVA0_DTVB0_EPS1_FDSI0_GRPM1_GRVWA1_GRVWB8_GSU1_GSUAMB_GSUC0_GSUWGMRR0_GLS0_ISA1201_IU1_K1_LBSPPA1024_LBSPPB128_LBSPPM0_LPA16_LPB16_LPM0_LRVW8_LWPMn1_MIAV1_MIWT2_2_MO40_NTn1_NTA0_NTB0_NTC0_NTD0_NTM0_NEPBS0_NLCA1_NLCB1_ONLL1_PGR1_PLR0_PKA0_SIA1_SS0_SU32_SUM0_SUS256_SPO0_SRVW0_SSO0_SVW8_SK0_SKXCCM0_TLDS1_ULSGRO0_USL1_UIOFGRO0_USFGROn1_VSn1_VWA1_VWB1_WSGRA0_WSGRB0_WS32_WG32_4_1_WGM8_WGMXCC1_WGMXCCGn1
    SolutionIndex: 199
    SolutionNameMin: Cijk_Ailk_Bljk_BSS_BH_Bias_S_HA_S_SAV_UserArgs_MT128x128x32_MI16x16x1_SN_LDSB1_AFC1_AFEM1_AFEM1_ASEM1_CLR1_CADS0_DTVA0_DTVB0_EPS0_FDSI0_GRPM1_GRVWA8_GRVWB8_GSU1_GSUAMB_GSUC0_GSUWGMRR0_GLS0_ISA1201_IU1_K1_LBSPPA2048_LBSPPB128_LBSPPM0_LPA0_LPB16_LPM0_LRVW8_LWPMn1_MIAV1_MIWT4_4_MO40_NTn1_NTA0_NTB0_NTC0_NTD0_NTM0_NEPBS0_NLCA1_NLCB1_ONLL1_PGR1_PLR1_PKA0_SIA3_SS0_SU32_SUM0_SUS256_SPO0_SRVW0_SSO0_SVW8_SK0_SKXCCM0_TLDS1_ULSGRO0_USL1_UIOFGRO0_USFGROn1_VSn1_VWA4_VWB1_WSGRA0_WSGRB0_WS32_WG32_4_1_WGM8_WGMXCC1_WGMXCCGn1
    SolutionIndex: 200
    SolutionNameMin: Cijk_Ailk_Bljk_BSS_BH_Bias_S_HA_S_SAV_UserArgs_MT64x64x32_MI16x16x1_SN_LDSB0_AFC1_AFEM1_AFEM1_ASEM1_CLR0_CADS0_DTVA0_DTVB0_EPS0_FDSI0_GRPM1_GRVWA8_GRVWB8_GSU1_GSUAMB_GSUC0_GSUWGMRR0_GLS0_ISA1201_IU1_K1_LBSPPA1024_LBSPPB1024_LBSPPM0_LPA16_LPB16_LPM0_LRVW8_LWPMn1_MIAV1_MIWT2_2_MO40_NTn1_NTA0_NTB0_NTC0_NTD0_NTM0_NEPBS0_NLCA1_NLCB1_ONLL1_PGR2_PLR0_PKA0_SIA3_SS0_SU32_SUM0_SUS256_SPO0_SRVW0_SSO0_SVW8_SK0_SKXCCM0_TLDS0_ULSGRO0_USL1_UIOFGRO0_USFGROn1_VSn1_VWA1_VWB1_WSGRA0_WSGRB0_WS32_WG32_4_1_WGM8_WGMXCC1_WGMXCCGn1
    SolutionIndex: 201
    SolutionNameMin: Cijk_Ailk_Bljk_BSS_BH_Bias_S_HA_S_SAV_UserArgs_MT16x128x32_MI16x16x1_SN_LDSB1_AFC1_AFEM1_AFEM1_ASEM1_CLR1_CADS0_DTVA0_DTVB0_EPS1_FDSI0_GRPM1_GRVWA8_GRVWB8_GSU1_GSUAMB_GSUC0_GSUWGMRR0_GLS0_ISA1201_IU1_K1_LBSPPA256_LBSPPB128_LBSPPM0_LPA16_LPB16_LPM0_LRVW8_LWPMn1_MIAV1_MIWT1_8_MO40_NTn1_NTA0_NTB0_NTC0_NTD0_NTM0_NEPBS0_NLCA1_NLCB1_ONLL1_PGR1_PLR0_PKA0_SIA3_SS0_SU32_SUM0_SUS256_SPO0_SRVW0_SSO0_SVW8_SK0_SKXCCM0_TLDS1_ULSGRO0_USL1_UIOFGRO0_USFGROn1_VSn1_VWA1_VWB1_WSGRA0_WSGRB0_WS32_WG16_2_1_WGM8_WGMXCC1_WGMXCCGn1
    SolutionIndex: 202
    SolutionNameMin: Cijk_Ailk_Bljk_BSS_BH_Bias_S_HA_S_SAV_UserArgs_MT128x128x32_MI16x16x1_SN_LDSB0_AFC1_AFEM1_AFEM1_ASEM1_CLR0_CADS0_DTVA0_DTVB0_EPS1_FDSI0_GRPM1_GRVWA8_GRVWB8_GSU1_GSUAMB_GSUC0_GSUWGMRR0_GLS0_ISA1201_IU1_K1_LBSPPA2048_LBSPPB128_LBSPPM0_LPA0_LPB16_LPM0_LRVW8_LWPMn1_MIAV1_MIWT4_4_MO40_NTn1_NTA0_NTB0_NTC0_NTD0_NTM0_NEPBS0_NLCA1_NLCB1_ONLL1_PGR1_PLR1_PKA0_SIA3_SS1_SU32_SUM0_SUS256_SPO0_SRVW0_SSO0_SVW4_SK0_SKXCCM0_TLDS1_ULSGRO0_USL1_UIOFGRO0_USFGROn1_VSn1_VWA4_VWB1_WSGRA0_WSGRB0_WS32_WG32_4_1_WGM8_WGMXCC1_WGMXCCGn1
    SolutionIndex: 203
    SolutionNameMin: Cijk_Ailk_Bljk_BSS_BH_Bias_S_HA_S_SAV_UserArgs_MT16x16x32_MI16x16x1_SN_LDSB0_AFC1_AFEM1_AFEM1_ASEM32_CLR0_CADS0_DTVA0_DTVB1_EPS0_FDSI0_GRPM1_GRVWA8_GRVWB8_GSU1_GSUAMB_GSUC0_GSUWGMRR0_GLS0_ISA1201_IU1_K1_LBSPPA128_LBSPPB0_LBSPPM0_LPA16_LPB0_LPM0_LRVW8_LWPMn1_MIAV1_MIWT1_1_MO40_NTn1_NTA0_NTB0_NTC0_NTD0_NTM0_NEPBS0_NLCA1_NLCB2_ONLL1_PGR2_PLR1_PKA0_SIA3_SS0_SU32_SUM0_SUS256_SPO0_SRVW0_SSO0_SVW8_SK0_SKXCCM0_TLDS2_ULSGRO0_USL1_UIOFGRO0_USFGROn1_VSn1_VWA1_VWB1_WSGRA0_WSGRB0_WS32_WG16_2_1_WGM8_WGMXCC1_WGMXCCGn1
    SolutionIndex: 204
    SolutionNameMin: Cijk_Ailk_Bljk_BSS_BH_Bias_S_HA_S_SAV_UserArgs_MT64x64x32_MI16x16x1_SN_LDSB0_AFC1_AFEM1_AFEM1_ASEM1_CLR0_CADS0_DTVA0_DTVB0_EPS0_FDSI0_GRPM1_GRVWA8_GRVWB8_GSU1_GSUAMB_GSUC0_GSUWGMRR0_GLS0_ISA1201_IU1_K1_LBSPPA1024_LBSPPB128_LBSPPM0_LPA16_LPB16_LPM0_LRVW8_LWPMn1_MIAV1_MIWT2_2_MO40_NTn1_NTA0_NTB0_NTC0_NTD0_NTM0_NEPBS0_NLCA1_NLCB1_ONLL1_PGR2_PLR1_PKA0_SIA3_SS0_SU32_SUM0_SUS256_SPO0_SRVW0_SSO0_SVW8_SK0_SKXCCM0_TLDS1_ULSGRO0_USL1_UIOFGRO0_USFGROn1_VSn1_VWA1_VWB1_WSGRA0_WSGRB0_WS32_WG32_4_1_WGM8_WGMXCC1_WGMXCCGn1
    SolutionIndex: 205
    SolutionNameMin: Cijk_Ailk_Bljk_BSS_BH_Bias_S_HA_S_SAV_UserArgs_MT16x16x32_MI16x16x1_SN_LDSB1_AFC1_AFEM1_AFEM1_ASEM1_CLR0_CADS0_DTVA0_DTVB0_EPS0_FDSI0_GRPM1_GRVWA8_GRVWB8_GSU1_GSUAMB_GSUC0_GSUWGMRR0_GLS0_ISA1201_IU1_K1_LBSPPA256_LBSPPB128_LBSPPM0_LPA16_LPB16_LPM0_LRVW8_LWPMn1_MIAV1_MIWT1_1_MO40_NTn1_NTA0_NTB0_NTC0_NTD0_NTM0_NEPBS0_NLCA1_NLCB1_ONLL1_PGR2_PLR1_PKA0_SIA3_SS1_SU32_SUM0_SUS256_SPO0_SRVW0_SSO0_SVW1_SK0_SKXCCM0_TLDS1_ULSGRO0_USL1_UIOFGRO0_USFGROn1_VSn1_VWA1_VWB1_WSGRA0_WSGRB0_WS32_WG16_2_1_WGM8_WGMXCC1_WGMXCCGn1
    SolutionIndex: 206
    SolutionNameMin: Cijk_Ailk_Bljk_BSS_BH_Bias_S_HA_S_SAV_UserArgs_MT16x16x32_MI16x16x1_SN_LDSB1_AFC1_AFEM1_AFEM1_ASEM32_CLR1_CADS0_DTVA0_DTVB1_EPS0_FDSI0_GRPM1_GRVWA8_GRVWB8_GSU1_GSUAMB_GSUC0_GSUWGMRR0_GLS0_ISA1201_IU1_K1_LBSPPA128_LBSPPB0_LBSPPM0_LPA16_LPB0_LPM0_LRVW8_LWPMn1_MIAV1_MIWT1_1_MO40_NTn1_NTA0_NTB0_NTC0_NTD0_NTM0_NEPBS0_NLCA1_NLCB2_ONLL1_PGR2_PLR1_PKA0_SIA3_SS1_SU32_SUM0_SUS256_SPO0_SRVW0_SSO0_SVW1_SK0_SKXCCM0_TLDS2_ULSGRO0_USL1_UIOFGRO0_USFGROn1_VSn1_VWA1_VWB1_WSGRA0_WSGRB0_WS32_WG16_2_1_WGM8_WGMXCC1_WGMXCCGn1
    SolutionIndex: 207
    SolutionNameMin: Cijk_Ailk_Bljk_BSS_BH_Bias_S_HA_S_SAV_UserArgs_MT64x64x32_MI16x16x1_SN_LDSB1_AFC1_AFEM1_AFEM1_ASEM1_CLR1_CADS0_DTVA0_DTVB0_EPS0_FDSI0_GRPM1_GRVWA1_GRVWB8_GSU1_GSUAMB_GSUC0_GSUWGMRR0_GLS0_ISA1201_IU1_K1_LBSPPA1024_LBSPPB128_LBSPPM0_LPA16_LPB16_LPM0_LRVW8_LWPMn1_MIAV1_MIWT2_2_MO40_NTn1_NTA0_NTB0_NTC0_NTD0_NTM0_NEPBS0_NLCA1_NLCB1_ONLL1_PGR1_PLR0_PKA0_SIA3_SS0_SU32_SUM0_SUS256_SPO0_SRVW0_SSO0_SVW8_SK0_SKXCCM0_TLDS1_ULSGRO0_USL1_UIOFGRO0_USFGROn1_VSn1_VWA1_VWB1_WSGRA0_WSGRB0_WS32_WG32_4_1_WGM8_WGMXCC1_WGMXCCGn1
    SolutionIndex: 208
    SolutionNameMin: Cijk_Ailk_Bljk_BSS_BH_Bias_S_HA_S_SAV_UserArgs_MT64x64x32_MI16x16x1_SN_LDSB1_AFC1_AFEM1_AFEM1_ASEM1_CLR1_CADS0_DTVA0_DTVB0_EPS0_FDSI0_GRPM1_GRVWA1_GRVWB8_GSU1_GSUAMB_GSUC0_GSUWGMRR0_GLS0_ISA1201_IU1_K1_LBSPPA1024_LBSPPB128_LBSPPM0_LPA16_LPB16_LPM0_LRVW8_LWPMn1_MIAV1_MIWT2_2_MO40_NTn1_NTA0_NTB0_NTC0_NTD0_NTM0_NEPBS0_NLCA1_NLCB1_ONLL1_PGR2_PLR0_PKA0_SIA3_SS0_SU32_SUM0_SUS256_SPO0_SRVW0_SSO0_SVW8_SK0_SKXCCM0_TLDS1_ULSGRO0_USL1_UIOFGRO0_USFGROn1_VSn1_VWA1_VWB1_WSGRA0_WSGRB0_WS32_WG32_4_1_WGM8_WGMXCC1_WGMXCCGn1
    SolutionIndex: 209
    SolutionNameMin: Cijk_Ailk_Bljk_BSS_BH_Bias_S_HA_S_SAV_UserArgs_MT64x64x32_MI16x16x1_SN_LDSB0_AFC1_AFEM1_AFEM1_ASEM1_CLR1_CADS0_DTVA0_DTVB0_EPS0_FDSI0_GRPM1_GRVWA8_GRVWB8_GSU1_GSUAMB_GSUC0_GSUWGMRR0_GLS0_ISA1201_IU1_K1_LBSPPA1024_LBSPPB1024_LBSPPM0_LPA16_LPB16_LPM0_LRVW8_LWPMn1_MIAV1_MIWT2_2_MO40_NTn1_NTA0_NTB0_NTC0_NTD0_NTM0_NEPBS0_NLCA1_NLCB1_ONLL1_PGR2_PLR1_PKA0_SIA3_SS0_SU32_SUM0_SUS256_SPO0_SRVW0_SSO0_SVW8_SK0_SKXCCM0_TLDS0_ULSGRO0_USL1_UIOFGRO0_USFGROn1_VSn1_VWA1_VWB1_WSGRA0_WSGRB0_WS32_WG32_4_1_WGM8_WGMXCC1_WGMXCCGn1
    SolutionIndex: 210
    SolutionNameMin: Cijk_Ailk_Bljk_BSS_BH_Bias_S_HA_S_SAV_UserArgs_MT128x128x32_MI16x16x1_SN_LDSB1_AFC1_AFEM1_AFEM1_ASEM1_CLR0_CADS0_DTVA0_DTVB0_EPS0_FDSI0_GRPM1_GRVWA8_GRVWB8_GSU1_GSUAMB_GSUC0_GSUWGMRR0_GLS0_ISA1201_IU1_K1_LBSPPA2048_LBSPPB128_LBSPPM0_LPA0_LPB16_LPM0_LRVW8_LWPMn1_MIAV1_MIWT4_4_MO40_NTn1_NTA0_NTB0_NTC0_NTD0_NTM0_NEPBS0_NLCA1_NLCB1_ONLL1_PGR1_PLR1_PKA0_SIA3_SS0_SU32_SUM0_SUS256_SPO0_SRVW0_SSO0_SVW8_SK0_SKXCCM0_TLDS1_ULSGRO0_USL1_UIOFGRO0_USFGROn1_VSn1_VWA4_VWB1_WSGRA0_WSGRB0_WS32_WG32_4_1_WGM8_WGMXCC1_WGMXCCGn1
    SolutionIndex: 211
    SolutionNameMin: Cijk_Ailk_Bljk_BSS_BH_Bias_S_HA_S_SAV_UserArgs_MT128x128x32_MI16x16x1_SN_LDSB0_AFC1_AFEM1_AFEM1_ASEM1_CLR1_CADS0_DTVA0_DTVB0_EPS1_FDSI0_GRPM1_GRVWA8_GRVWB8_GSU1_GSUAMB_GSUC0_GSUWGMRR0_GLS0_ISA1201_IU1_K1_LBSPPA2048_LBSPPB128_LBSPPM0_LPA0_LPB16_LPM0_LRVW8_LWPMn1_MIAV1_MIWT4_4_MO40_NTn1_NTA0_NTB0_NTC0_NTD0_NTM0_NEPBS0_NLCA1_NLCB1_ONLL1_PGR1_PLR1_PKA0_SIA3_SS0_SU32_SUM0_SUS256_SPO0_SRVW0_SSO0_SVW8_SK0_SKXCCM0_TLDS1_ULSGRO0_USL1_UIOFGRO0_USFGROn1_VSn1_VWA4_VWB1_WSGRA0_WSGRB0_WS32_WG32_4_1_WGM8_WGMXCC1_WGMXCCGn1
    SolutionIndex: 212
    SolutionNameMin: Cijk_Ailk_Bljk_BSS_BH_Bias_S_HA_S_SAV_UserArgs_MT64x64x32_MI16x16x1_SN_LDSB0_AFC1_AFEM1_AFEM1_ASEM1_CLR0_CADS0_DTVA0_DTVB0_EPS1_FDSI0_GRPM1_GRVWA8_GRVWB8_GSU1_GSUAMB_GSUC0_GSUWGMRR0_GLS0_ISA1201_IU1_K1_LBSPPA1024_LBSPPB128_LBSPPM0_LPA16_LPB16_LPM0_LRVW8_LWPMn1_MIAV1_MIWT2_2_MO40_NTn1_NTA0_NTB0_NTC0_NTD0_NTM0_NEPBS0_NLCA1_NLCB1_ONLL1_PGR1_PLR1_PKA0_SIA3_SS0_SU32_SUM0_SUS256_SPO0_SRVW0_SSO0_SVW8_SK0_SKXCCM0_TLDS1_ULSGRO0_USL1_UIOFGRO0_USFGROn1_VSn1_VWA1_VWB1_WSGRA0_WSGRB0_WS32_WG32_4_1_WGM8_WGMXCC1_WGMXCCGn1
    SolutionIndex: 213
    SolutionNameMin: Cijk_Ailk_Bljk_BSS_BH_Bias_S_HA_S_SAV_UserArgs_MT64x64x32_MI16x16x1_SN_LDSB0_AFC1_AFEM1_AFEM1_ASEM1_CLR0_CADS0_DTVA0_DTVB0_EPS1_FDSI0_GRPM1_GRVWA1_GRVWB8_GSU1_GSUAMB_GSUC0_GSUWGMRR0_GLS0_ISA1201_IU1_K1_LBSPPA1024_LBSPPB128_LBSPPM0_LPA16_LPB16_LPM0_LRVW8_LWPMn1_MIAV1_MIWT2_2_MO40_NTn1_NTA0_NTB0_NTC0_NTD0_NTM0_NEPBS0_NLCA1_NLCB1_ONLL1_PGR1_PLR1_PKA0_SIA3_SS0_SU32_SUM0_SUS256_SPO0_SRVW0_SSO0_SVW8_SK0_SKXCCM0_TLDS1_ULSGRO0_USL1_UIOFGRO0_USFGROn1_VSn1_VWA1_VWB1_WSGRA0_WSGRB0_WS32_WG32_4_1_WGM8_WGMXCC1_WGMXCCGn1
    SolutionIndex: 214
    SolutionNameMin: Cijk_Ailk_Bljk_BSS_BH_Bias_S_HA_S_SAV_UserArgs_MT16x128x32_MI16x16x1_SN_LDSB0_AFC1_AFEM1_AFEM1_ASEM32_CLR1_CADS0_DTVA0_DTVB1_EPS0_FDSI0_GRPM1_GRVWA8_GRVWB8_GSU1_GSUAMB_GSUC0_GSUWGMRR0_GLS0_ISA1201_IU1_K1_LBSPPA128_LBSPPB0_LBSPPM0_LPA16_LPB0_LPM0_LRVW8_LWPMn1_MIAV1_MIWT1_8_MO40_NTn1_NTA0_NTB0_NTC0_NTD0_NTM0_NEPBS0_NLCA1_NLCB2_ONLL1_PGR2_PLR1_PKA0_SIA3_SS0_SU32_SUM0_SUS256_SPO0_SRVW0_SSO0_SVW8_SK0_SKXCCM0_TLDS2_ULSGRO0_USL1_UIOFGRO0_USFGROn1_VSn1_VWA1_VWB4_WSGRA0_WSGRB0_WS32_WG16_2_1_WGM8_WGMXCC1_WGMXCCGn1
    SolutionIndex: 215
    SolutionNameMin: Cijk_Ailk_Bljk_BSS_BH_Bias_S_HA_S_SAV_UserArgs_MT16x128x32_MI16x16x1_SN_LDSB0_AFC1_AFEM1_AFEM1_ASEM32_CLR0_CADS0_DTVA0_DTVB1_EPS0_FDSI0_GRPM1_GRVWA8_GRVWB8_GSU1_GSUAMB_GSUC0_GSUWGMRR0_GLS0_ISA1201_IU1_K1_LBSPPA256_LBSPPB0_LBSPPM0_LPA16_LPB0_LPM0_LRVW8_LWPMn1_MIAV1_MIWT1_8_MO40_NTn1_NTA0_NTB0_NTC0_NTD0_NTM0_NEPBS0_NLCA1_NLCB2_ONLL1_PGR1_PLR1_PKA0_SIA3_SS0_SU32_SUM0_SUS256_SPO0_SRVW0_SSO0_SVW8_SK0_SKXCCM0_TLDS1_ULSGRO0_USL1_UIOFGRO0_USFGROn1_VSn1_VWA1_VWB4_WSGRA0_WSGRB0_WS32_WG16_2_1_WGM8_WGMXCC1_WGMXCCGn1
    SolutionIndex: 218
    SolutionNameMin: Cijk_Ailk_Bljk_BSS_BH_Bias_S_HA_S_SAV_UserArgs_MT64x64x32_MI16x16x1_SN_LDSB0_AFC1_AFEM1_AFEM1_ASEM1_CLR1_CADS0_DTVA0_DTVB0_EPS1_FDSI0_GRPM1_GRVWA8_GRVWB8_GSU1_GSUAMB_GSUC0_GSUWGMRR0_GLS0_ISA1201_IU1_K1_LBSPPA1024_LBSPPB128_LBSPPM0_LPA16_LPB16_LPM0_LRVW8_LWPMn1_MIAV1_MIWT2_2_MO40_NTn1_NTA0_NTB0_NTC0_NTD0_NTM0_NEPBS0_NLCA1_NLCB1_ONLL1_PGR1_PLR0_PKA0_SIA3_SS0_SU32_SUM0_SUS256_SPO0_SRVW0_SSO0_SVW8_SK0_SKXCCM0_TLDS1_ULSGRO0_USL1_UIOFGRO0_USFGROn1_VSn1_VWA1_VWB1_WSGRA0_WSGRB0_WS32_WG32_4_1_WGM8_WGMXCC1_WGMXCCGn1
    SolutionIndex: 221
    SolutionNameMin: Cijk_Ailk_Bljk_BSS_BH_Bias_S_HA_S_SAV_UserArgs_MT16x128x32_MI16x16x1_SN_LDSB0_AFC1_AFEM1_AFEM1_ASEM32_CLR1_CADS0_DTVA0_DTVB1_EPS0_FDSI0_GRPM1_GRVWA1_GRVWB8_GSU1_GSUAMB_GSUC0_GSUWGMRR0_GLS0_ISA1201_IU1_K1_LBSPPA128_LBSPPB0_LBSPPM0_LPA16_LPB0_LPM0_LRVW8_LWPMn1_MIAV1_MIWT1_8_MO40_NTn1_NTA0_NTB0_NTC0_NTD0_NTM0_NEPBS0_NLCA1_NLCB2_ONLL1_PGR2_PLR1_PKA0_SIA3_SS0_SU32_SUM0_SUS256_SPO0_SRVW0_SSO0_SVW8_SK0_SKXCCM0_TLDS2_ULSGRO0_USL1_UIOFGRO0_USFGROn1_VSn1_VWA1_VWB4_WSGRA0_WSGRB0_WS32_WG16_2_1_WGM8_WGMXCC1_WGMXCCGn1
    SolutionIndex: 224
    SolutionNameMin: Cijk_Ailk_Bljk_BSS_BH_Bias_S_HA_S_SAV_UserArgs_MT64x64x32_MI16x16x1_SN_LDSB0_AFC1_AFEM1_AFEM1_ASEM1_CLR1_CADS0_DTVA0_DTVB0_EPS0_FDSI0_GRPM1_GRVWA8_GRVWB8_GSU1_GSUAMB_GSUC0_GSUWGMRR0_GLS0_ISA1201_IU1_K1_LBSPPA1024_LBSPPB128_LBSPPM0_LPA16_LPB16_LPM0_LRVW8_LWPMn1_MIAV1_MIWT2_2_MO40_NTn1_NTA0_NTB0_NTC0_NTD0_NTM0_NEPBS0_NLCA1_NLCB1_ONLL1_PGR2_PLR1_PKA0_SIA1_SS1_SU32_SUM0_SUS256_SPO0_SRVW0_SSO0_SVW1_SK0_SKXCCM0_TLDS1_ULSGRO0_USL1_UIOFGRO0_USFGROn1_VSn1_VWA1_VWB1_WSGRA0_WSGRB0_WS32_WG32_4_1_WGM8_WGMXCC1_WGMXCCGn1
    SolutionIndex: 225
    SolutionNameMin: Cijk_Ailk_Bljk_BSS_BH_Bias_S_HA_S_SAV_UserArgs_MT64x64x32_MI16x16x1_SN_LDSB0_AFC1_AFEM1_AFEM1_ASEM1_CLR0_CADS0_DTVA0_DTVB0_EPS0_FDSI0_GRPM1_GRVWA8_GRVWB8_GSU1_GSUAMB_GSUC0_GSUWGMRR0_GLS0_ISA1201_IU1_K1_LBSPPA1024_LBSPPB1024_LBSPPM0_LPA16_LPB16_LPM0_LRVW8_LWPMn1_MIAV1_MIWT2_2_MO40_NTn1_NTA0_NTB0_NTC0_NTD0_NTM0_NEPBS0_NLCA1_NLCB1_ONLL1_PGR2_PLR1_PKA0_SIA3_SS1_SU32_SUM0_SUS256_SPO0_SRVW0_SSO0_SVW1_SK0_SKXCCM0_TLDS0_ULSGRO0_USL1_UIOFGRO0_USFGROn1_VSn1_VWA1_VWB1_WSGRA0_WSGRB0_WS32_WG32_4_1_WGM8_WGMXCC1_WGMXCCGn1
    SolutionIndex: 235
    SolutionNameMin: Cijk_Ailk_Bljk_BSS_BH_Bias_S_HA_S_SAV_UserArgs_MT128x128x32_MI16x16x1_SN_LDSB0_AFC1_AFEM1_AFEM1_ASEM1_CLR0_CADS0_DTVA0_DTVB0_EPS1_FDSI0_GRPM1_GRVWA8_GRVWB8_GSU1_GSUAMB_GSUC0_GSUWGMRR0_GLS0_ISA1201_IU1_K1_LBSPPA2048_LBSPPB256_LBSPPM0_LPA0_LPB16_LPM0_LRVW8_LWPMn1_MIAV1_MIWT4_4_MO40_NTn1_NTA0_NTB0_NTC0_NTD0_NTM0_NEPBS0_NLCA1_NLCB1_ONLL1_PGR1_PLR1_PKA0_SIA3_SS1_SU32_SUM0_SUS256_SPO0_SRVW0_SSO0_SVW4_SK0_SKXCCM0_TLDS1_ULSGRO0_USL1_UIOFGRO0_USFGROn1_VSn1_VWA4_VWB4_WSGRA0_WSGRB0_WS32_WG32_4_1_WGM8_WGMXCC1_WGMXCCGn1
    SolutionIndex: 236
    SolutionNameMin: Cijk_Ailk_Bljk_BSS_BH_Bias_S_HA_S_SAV_UserArgs_MT64x64x32_MI16x16x1_SN_LDSB0_AFC1_AFEM1_AFEM1_ASEM1_CLR1_CADS0_DTVA0_DTVB0_EPS0_FDSI0_GRPM1_GRVWA8_GRVWB8_GSU1_GSUAMB_GSUC0_GSUWGMRR0_GLS0_ISA1201_IU1_K1_LBSPPA1024_LBSPPB128_LBSPPM0_LPA16_LPB16_LPM0_LRVW8_LWPMn1_MIAV1_MIWT2_2_MO40_NTn1_NTA0_NTB0_NTC0_NTD0_NTM0_NEPBS0_NLCA1_NLCB1_ONLL1_PGR2_PLR1_PKA0_SIA3_SS1_SU32_SUM0_SUS256_SPO0_SRVW0_SSO0_SVW1_SK0_SKXCCM0_TLDS1_ULSGRO0_USL1_UIOFGRO0_USFGROn1_VSn1_VWA1_VWB1_WSGRA0_WSGRB0_WS32_WG32_4_1_WGM8_WGMXCC1_WGMXCCGn1
    SolutionIndex: 241
    SolutionNameMin: Cijk_Ailk_Bljk_BSS_BH_Bias_S_HA_S_SAV_UserArgs_MT16x16x32_MI16x16x1_SN_LDSB0_AFC1_AFEM1_AFEM1_ASEM1_CLR1_CADS0_DTVA0_DTVB0_EPS0_FDSI0_GRPM1_GRVWA8_GRVWB8_GSU1_GSUAMB_GSUC0_GSUWGMRR0_GLS0_ISA1201_IU1_K1_LBSPPA128_LBSPPB128_LBSPPM0_LPA16_LPB16_LPM0_LRVW8_LWPMn1_MIAV1_MIWT1_1_MO40_NTn1_NTA0_NTB0_NTC0_NTD0_NTM0_NEPBS0_NLCA1_NLCB1_ONLL1_PGR2_PLR1_PKA0_SIA1_SS1_SU32_SUM0_SUS256_SPO0_SRVW0_SSO0_SVW1_SK0_SKXCCM0_TLDS2_ULSGRO0_USL1_UIOFGRO0_USFGROn1_VSn1_VWA1_VWB1_WSGRA0_WSGRB0_WS32_WG16_2_1_WGM8_WGMXCC1_WGMXCCGn1
    SolutionIndex: 242
    SolutionNameMin: Cijk_Ailk_Bljk_BSS_BH_Bias_S_HA_S_SAV_UserArgs_MT16x16x32_MI16x16x1_SN_LDSB1_AFC1_AFEM1_AFEM1_ASEM1_CLR0_CADS0_DTVA0_DTVB0_EPS0_FDSI0_GRPM1_GRVWA8_GRVWB8_GSU1_GSUAMB_GSUC0_GSUWGMRR0_GLS0_ISA1201_IU1_K1_LBSPPA128_LBSPPB128_LBSPPM0_LPA16_LPB16_LPM0_LRVW8_LWPMn1_MIAV1_MIWT1_1_MO40_NTn1_NTA0_NTB0_NTC0_NTD0_NTM0_NEPBS0_NLCA1_NLCB1_ONLL1_PGR2_PLR1_PKA0_SIA3_SS1_SU32_SUM0_SUS256_SPO0_SRVW0_SSO0_SVW1_SK0_SKXCCM0_TLDS2_ULSGRO0_USL1_UIOFGRO0_USFGROn1_VSn1_VWA1_VWB1_WSGRA0_WSGRB0_WS32_WG16_2_1_WGM8_WGMXCC1_WGMXCCGn1
    SolutionIndex: 243
    SolutionNameMin: Cijk_Ailk_Bljk_BSS_BH_Bias_S_HA_S_SAV_UserArgs_MT16x16x32_MI16x16x1_SN_LDSB1_AFC1_AFEM1_AFEM1_ASEM1_CLR1_CADS0_DTVA0_DTVB0_EPS0_FDSI0_GRPM1_GRVWA8_GRVWB8_GSU1_GSUAMB_GSUC0_GSUWGMRR0_GLS0_ISA1201_IU1_K1_LBSPPA128_LBSPPB128_LBSPPM0_LPA16_LPB16_LPM0_LRVW8_LWPMn1_MIAV1_MIWT1_1_MO40_NTn1_NTA0_NTB0_NTC0_NTD0_NTM0_NEPBS0_NLCA1_NLCB1_ONLL1_PGR2_PLR1_PKA0_SIA3_SS1_SU32_SUM0_SUS256_SPO0_SRVW0_SSO0_SVW1_SK0_SKXCCM0_TLDS2_ULSGRO0_USL1_UIOFGRO0_USFGROn1_VSn1_VWA1_VWB1_WSGRA0_WSGRB0_WS32_WG16_2_1_WGM8_WGMXCC1_WGMXCCGn1
    SolutionIndex: 247
    SolutionNameMin: Cijk_Ailk_Bljk_BSS_BH_Bias_S_HA_S_SAV_UserArgs_MT64x64x32_MI16x16x1_SN_LDSB1_AFC1_AFEM1_AFEM1_ASEM32_CLR1_CADS0_DTVA0_DTVB1_EPS0_FDSI0_GRPM1_GRVWA8_GRVWB8_GSU1_GSUAMB_GSUC0_GSUWGMRR0_GLS0_ISA1201_IU1_K1_LBSPPA1024_LBSPPB0_LBSPPM0_LPA16_LPB0_LPM0_LRVW8_LWPMn1_MIAV1_MIWT2_2_MO40_NTn1_NTA0_NTB0_NTC0_NTD0_NTM0_NEPBS0_NLCA1_NLCB2_ONLL1_PGR1_PLR1_PKA0_SIA3_SS1_SU32_SUM0_SUS256_SPO0_SRVW0_SSO0_SVW1_SK0_SKXCCM0_TLDS1_ULSGRO0_USL1_UIOFGRO0_USFGROn1_VSn1_VWA1_VWB1_WSGRA0_WSGRB0_WS32_WG32_4_1_WGM8_WGMXCC1_WGMXCCGn1
    SolutionIndex: 253
    SolutionNameMin: Cijk_Ailk_Bljk_BSS_BH_Bias_S_HA_S_SAV_UserArgs_MT64x64x32_MI16x16x1_SN_LDSB0_AFC1_AFEM1_AFEM1_ASEM1_CLR0_CADS0_DTVA0_DTVB0_EPS0_FDSI0_GRPM1_GRVWA8_GRVWB8_GSU1_GSUAMB_GSUC0_GSUWGMRR0_GLS0_ISA1201_IU1_K1_LBSPPA1024_LBSPPB128_LBSPPM0_LPA16_LPB16_LPM0_LRVW8_LWPMn1_MIAV1_MIWT2_2_MO40_NTn1_NTA0_NTB0_NTC0_NTD0_NTM0_NEPBS0_NLCA1_NLCB1_ONLL1_PGR2_PLR1_PKA0_SIA3_SS1_SU32_SUM0_SUS256_SPO0_SRVW0_SSO0_SVW1_SK0_SKXCCM0_TLDS1_ULSGRO0_USL1_UIOFGRO0_USFGROn1_VSn1_VWA1_VWB1_WSGRA0_WSGRB0_WS32_WG32_4_1_WGM8_WGMXCC1_WGMXCCGn1
    SolutionIndex: 256
    SolutionNameMin: Cijk_Ailk_Bljk_BSS_BH_Bias_S_HA_S_SAV_UserArgs_MT16x16x32_MI16x16x1_SN_LDSB0_AFC1_AFEM1_AFEM1_ASEM1_CLR0_CADS0_DTVA0_DTVB0_EPS0_FDSI0_GRPM1_GRVWA8_GRVWB8_GSU1_GSUAMB_GSUC0_GSUWGMRR0_GLS0_ISA1201_IU1_K1_LBSPPA128_LBSPPB128_LBSPPM0_LPA16_LPB16_LPM0_LRVW8_LWPMn1_MIAV1_MIWT1_1_MO40_NTn1_NTA0_NTB0_NTC0_NTD0_NTM0_NEPBS0_NLCA1_NLCB1_ONLL1_PGR2_PLR0_PKA0_SIA1_SS1_SU32_SUM0_SUS256_SPO0_SRVW0_SSO0_SVW1_SK0_SKXCCM0_TLDS2_ULSGRO0_USL1_UIOFGRO0_USFGROn1_VSn1_VWA1_VWB1_WSGRA0_WSGRB0_WS32_WG16_2_1_WGM8_WGMXCC1_WGMXCCGn1
    SolutionIndex: 258
    SolutionNameMin: Cijk_Ailk_Bljk_BSS_BH_Bias_S_HA_S_SAV_UserArgs_MT64x64x32_MI16x16x1_SN_LDSB1_AFC1_AFEM1_AFEM1_ASEM1_CLR1_CADS0_DTVA0_DTVB0_EPS1_FDSI0_GRPM1_GRVWA1_GRVWB8_GSU1_GSUAMB_GSUC0_GSUWGMRR0_GLS0_ISA1201_IU1_K1_LBSPPA1024_LBSPPB128_LBSPPM0_LPA16_LPB16_LPM0_LRVW8_LWPMn1_MIAV1_MIWT2_2_MO40_NTn1_NTA0_NTB0_NTC0_NTD0_NTM0_NEPBS0_NLCA1_NLCB1_ONLL1_PGR1_PLR0_PKA0_SIA3_SS1_SU32_SUM0_SUS256_SPO0_SRVW0_SSO0_SVW1_SK0_SKXCCM0_TLDS1_ULSGRO0_USL1_UIOFGRO0_USFGROn1_VSn1_VWA1_VWB1_WSGRA0_WSGRB0_WS32_WG32_4_1_WGM8_WGMXCC1_WGMXCCGn1
    SolutionIndex: 262
    SolutionNameMin: Cijk_Ailk_Bljk_BSS_BH_Bias_S_HA_S_SAV_UserArgs_MT64x64x32_MI16x16x1_SN_LDSB0_AFC1_AFEM1_AFEM1_ASEM1_CLR0_CADS0_DTVA0_DTVB0_EPS1_FDSI0_GRPM1_GRVWA8_GRVWB8_GSU1_GSUAMB_GSUC0_GSUWGMRR0_GLS0_ISA1201_IU1_K1_LBSPPA1024_LBSPPB128_LBSPPM0_LPA16_LPB16_LPM0_LRVW8_LWPMn1_MIAV1_MIWT2_2_MO40_NTn1_NTA0_NTB0_NTC0_NTD0_NTM0_NEPBS0_NLCA1_NLCB1_ONLL1_PGR1_PLR1_PKA0_SIA3_SS1_SU32_SUM0_SUS256_SPO0_SRVW0_SSO0_SVW1_SK0_SKXCCM0_TLDS1_ULSGRO0_USL1_UIOFGRO0_USFGROn1_VSn1_VWA1_VWB1_WSGRA0_WSGRB0_WS32_WG32_4_1_WGM8_WGMXCC1_WGMXCCGn1
    SolutionIndex: 265
    SolutionNameMin: Cijk_Ailk_Bljk_BSS_BH_Bias_S_HA_S_SAV_UserArgs_MT64x64x32_MI16x16x1_SN_LDSB0_AFC1_AFEM1_AFEM1_ASEM1_CLR1_CADS0_DTVA0_DTVB0_EPS0_FDSI0_GRPM1_GRVWA8_GRVWB1_GSU1_GSUAMB_GSUC0_GSUWGMRR0_GLS0_ISA1201_IU1_K1_LBSPPA1024_LBSPPB128_LBSPPM0_LPA16_LPB16_LPM0_LRVW8_LWPMn1_MIAV1_MIWT2_2_MO40_NTn1_NTA0_NTB0_NTC0_NTD0_NTM0_NEPBS0_NLCA1_NLCB1_ONLL1_PGR2_PLR1_PKA0_SIA3_SS1_SU32_SUM0_SUS256_SPO0_SRVW0_SSO0_SVW1_SK0_SKXCCM0_TLDS1_ULSGRO0_USL1_UIOFGRO0_USFGROn1_VSn1_VWA1_VWB1_WSGRA0_WSGRB0_WS32_WG32_4_1_WGM8_WGMXCC1_WGMXCCGn1
    SolutionIndex: 266
    SolutionNameMin: Cijk_Ailk_Bljk_BSS_BH_Bias_S_HA_S_SAV_UserArgs_MT64x64x32_MI16x16x1_SN_LDSB1_AFC1_AFEM1_AFEM1_ASEM32_CLR1_CADS0_DTVA0_DTVB1_EPS0_FDSI0_GRPM1_GRVWA1_GRVWB8_GSU1_GSUAMB_GSUC0_GSUWGMRR0_GLS0_ISA1201_IU1_K1_LBSPPA1024_LBSPPB0_LBSPPM0_LPA16_LPB0_LPM0_LRVW8_LWPMn1_MIAV1_MIWT2_2_MO40_NTn1_NTA0_NTB0_NTC0_NTD0_NTM0_NEPBS0_NLCA1_NLCB2_ONLL1_PGR2_PLR1_PKA0_SIA3_SS1_SU32_SUM0_SUS256_SPO0_SRVW0_SSO0_SVW1_SK0_SKXCCM0_TLDS1_ULSGRO0_USL1_UIOFGRO0_USFGROn1_VSn1_VWA1_VWB1_WSGRA0_WSGRB0_WS32_WG32_4_1_WGM8_WGMXCC1_WGMXCCGn1
    SolutionIndex: 267
    SolutionNameMin: Cijk_Ailk_Bljk_BSS_BH_Bias_S_HA_S_SAV_UserArgs_MT64x64x32_MI16x16x1_SN_LDSB1_AFC1_AFEM1_AFEM1_ASEM32_CLR0_CADS0_DTVA0_DTVB1_EPS0_FDSI0_GRPM1_GRVWA1_GRVWB8_GSU1_GSUAMB_GSUC0_GSUWGMRR0_GLS0_ISA1201_IU1_K1_LBSPPA1024_LBSPPB0_LBSPPM0_LPA16_LPB0_LPM0_LRVW8_LWPMn1_MIAV1_MIWT2_2_MO40_NTn1_NTA0_NTB0_NTC0_NTD0_NTM0_NEPBS0_NLCA1_NLCB2_ONLL1_PGR2_PLR1_PKA0_SIA3_SS1_SU32_SUM0_SUS256_SPO0_SRVW0_SSO0_SVW1_SK0_SKXCCM0_TLDS1_ULSGRO0_USL1_UIOFGRO0_USFGROn1_VSn1_VWA1_VWB1_WSGRA0_WSGRB0_WS32_WG32_4_1_WGM8_WGMXCC1_WGMXCCGn1
    SolutionIndex: 269
    SolutionNameMin: Cijk_Ailk_Bljk_BSS_BH_Bias_S_HA_S_SAV_UserArgs_MT64x64x32_MI16x16x1_SN_LDSB0_AFC1_AFEM1_AFEM1_ASEM1_CLR1_CADS0_DTVA0_DTVB0_EPS1_FDSI0_GRPM1_GRVWA1_GRVWB1_GSU1_GSUAMB_GSUC0_GSUWGMRR0_GLS0_ISA1201_IU1_K1_LBSPPA1024_LBSPPB128_LBSPPM0_LPA16_LPB16_LPM0_LRVW8_LWPMn1_MIAV1_MIWT2_2_MO40_NTn1_NTA0_NTB0_NTC0_NTD0_NTM0_NEPBS0_NLCA1_NLCB1_ONLL1_PGR1_PLR0_PKA0_SIA3_SS1_SU32_SUM0_SUS256_SPO0_SRVW0_SSO0_SVW1_SK0_SKXCCM0_TLDS1_ULSGRO0_USL1_UIOFGRO0_USFGROn1_VSn1_VWA1_VWB1_WSGRA0_WSGRB0_WS32_WG32_4_1_WGM8_WGMXCC1_WGMXCCGn1
    SolutionIndex: 270
    SolutionNameMin: Cijk_Ailk_Bljk_BSS_BH_Bias_S_HA_S_SAV_UserArgs_MT128x128x32_MI16x16x1_SN_LDSB0_AFC1_AFEM1_AFEM1_ASEM1_CLR0_CADS0_DTVA0_DTVB0_EPS0_FDSI0_GRPM1_GRVWA8_GRVWB8_GSU1_GSUAMB_GSUC0_GSUWGMRR0_GLS0_ISA1201_IU1_K1_LBSPPA2048_LBSPPB256_LBSPPM0_LPA0_LPB16_LPM0_LRVW8_LWPMn1_MIAV1_MIWT4_4_MO40_NTn1_NTA0_NTB0_NTC0_NTD0_NTM0_NEPBS0_NLCA1_NLCB1_ONLL1_PGR2_PLR1_PKA0_SIA3_SS1_SU32_SUM0_SUS256_SPO0_SRVW0_SSO0_SVW4_SK0_SKXCCM0_TLDS1_ULSGRO0_USL1_UIOFGRO0_USFGROn1_VSn1_VWA4_VWB4_WSGRA0_WSGRB0_WS32_WG32_4_1_WGM8_WGMXCC1_WGMXCCGn1
    SolutionIndex: 272
    SolutionNameMin: Cijk_Ailk_Bljk_BSS_BH_Bias_S_HA_S_SAV_UserArgs_MT64x64x32_MI16x16x1_SN_LDSB1_AFC1_AFEM1_AFEM1_ASEM1_CLR1_CADS0_DTVA0_DTVB0_EPS0_FDSI0_GRPM1_GRVWA8_GRVWB8_GSU1_GSUAMB_GSUC0_GSUWGMRR0_GLS0_ISA1201_IU1_K1_LBSPPA1024_LBSPPB128_LBSPPM0_LPA16_LPB16_LPM0_LRVW8_LWPMn1_MIAV1_MIWT2_2_MO40_NTn1_NTA0_NTB0_NTC0_NTD0_NTM0_NEPBS0_NLCA1_NLCB1_ONLL1_PGR1_PLR1_PKA0_SIA3_SS1_SU32_SUM0_SUS256_SPO0_SRVW0_SSO0_SVW1_SK0_SKXCCM0_TLDS1_ULSGRO0_USL1_UIOFGRO0_USFGROn1_VSn1_VWA1_VWB1_WSGRA0_WSGRB0_WS32_WG32_4_1_WGM8_WGMXCC1_WGMXCCGn1
    SolutionIndex: 273
    SolutionNameMin: Cijk_Ailk_Bljk_BSS_BH_Bias_S_HA_S_SAV_UserArgs_MT64x64x32_MI16x16x1_SN_LDSB0_AFC1_AFEM1_AFEM1_ASEM1_CLR1_CADS0_DTVA0_DTVB0_EPS1_FDSI0_GRPM1_GRVWA8_GRVWB8_GSU1_GSUAMB_GSUC0_GSUWGMRR0_GLS0_ISA1201_IU1_K1_LBSPPA1024_LBSPPB128_LBSPPM0_LPA16_LPB16_LPM0_LRVW8_LWPMn1_MIAV1_MIWT2_2_MO40_NTn1_NTA0_NTB0_NTC0_NTD0_NTM0_NEPBS0_NLCA1_NLCB1_ONLL1_PGR1_PLR0_PKA0_SIA3_SS1_SU32_SUM0_SUS256_SPO0_SRVW0_SSO0_SVW1_SK0_SKXCCM0_TLDS1_ULSGRO0_USL1_UIOFGRO0_USFGROn1_VSn1_VWA1_VWB1_WSGRA0_WSGRB0_WS32_WG32_4_1_WGM8_WGMXCC1_WGMXCCGn1
- - - [64, 64, 1, 64]
    - [135, 0.0]
  - - [256, 256, 1, 256]
    - [129, 0.0]
  - - [512, 512, 1, 512]
    - [70, 0.0]
  - - [1024, 1024, 1, 1024]
    - [85, 0.0]
  - - [2048, 2048, 1, 2048]
    - [2, 48.64]
  - - [3072, 3072, 1, 3072]
    - [3, 52.71]
  - - [4096, 4096, 1, 4096]
    - [1, 55.25]
  - - [320, 64, 1, 64]
    - [135, 0.0]
  - - [576, 64, 1, 64]
    - [132, 0.0]
  - - [832, 64, 1, 64]
    - [7, 0.0]
  - - [1088, 64, 1, 64]
    - [7, 0.0]
  - - [1344, 64, 1, 64]
    - [107, 0.0]
  - - [1600, 64, 1, 64]
    - [108, 0.0]
  - - [1856, 64, 1, 64]
    - [109, 0.0]
  - - [2112, 64, 1, 64]
    - [6, 0.0]
  - - [2368, 64, 1, 64]
    - [8, 0.0]
  - - [2624, 64, 1, 64]
    - [9, 0.0]
  - - [2880, 64, 1, 64]
    - [10, 0.0]
  - - [3136, 64, 1, 64]
    - [11, 0.0]
  - - [3392, 64, 1, 64]
    - [7, 0.0]
  - - [3648, 64, 1, 64]
    - [7, 0.0]
  - - [3904, 64, 1, 64]
    - [12, 0.0]
  - - [64, 320, 1, 64]
    - [161, 0.0]
  - - [320, 320, 1, 64]
    - [164, 0.0]
  - - [576, 320, 1, 64]
    - [7, 0.0]
  - - [832, 320, 1, 64]
    - [159, 0.0]
  - - [1088, 320, 1, 64]
    - [19, 0.0]
  - - [1344, 320, 1, 64]
    - [11, 0.0]
  - - [1600, 320, 1, 64]
    - [25, 0.0]
  - - [1856, 320, 1, 64]
    - [31, 0.0]
  - - [2112, 320, 1, 64]
    - [11, 0.0]
  - - [2368, 320, 1, 64]
    - [17, 0.0]
  - - [2624, 320, 1, 64]
    - [18, 0.0]
  - - [2880, 320, 1, 64]
    - [19, 0.0]
  - - [3136, 320, 1, 64]
    - [20, 0.0]
  - - [3392, 320, 1, 64]
    - [21, 0.0]
  - - [3648, 320, 1, 64]
    - [5, 0.0]
  - - [3904, 320, 1, 64]
    - [22, 0.0]
  - - [64, 576, 1, 64]
    - [175, 0.0]
  - - [320, 576, 1, 64]
    - [16, 0.0]
  - - [576, 576, 1, 64]
    - [108, 0.0]
  - - [832, 576, 1, 64]
    - [167, 0.0]
  - - [1088, 576, 1, 64]
    - [11, 0.0]
  - - [1344, 576, 1, 64]
    - [11, 0.0]
  - - [1600, 576, 1, 64]
    - [20, 0.0]
  - - [1856, 576, 1, 64]
    - [14, 0.0]
  - - [2112, 576, 1, 64]
    - [19, 0.0]
  - - [2368, 576, 1, 64]
    - [25, 0.0]
  - - [2624, 576, 1, 64]
    - [26, 0.0]
  - - [2880, 576, 1, 64]
    - [14, 0.0]
  - - [3136, 576, 1, 64]
    - [15, 0.0]
  - - [3392, 576, 1, 64]
    - [14, 0.0]
  - - [3648, 576, 1, 64]
    - [5, 0.0]
  - - [3904, 576, 1, 64]
    - [20, 0.0]
  - - [64, 832, 1, 64]
    - [188, 0.0]
  - - [320, 832, 1, 64]
    - [179, 0.0]
  - - [576, 832, 1, 64]
    - [29, 0.0]
  - - [832, 832, 1, 64]
    - [190, 0.0]
  - - [1088, 832, 1, 64]
    - [22, 0.0]
  - - [1344, 832, 1, 64]
    - [5, 0.0]
  - - [1600, 832, 1, 64]
    - [21, 0.0]
  - - [1856, 832, 1, 64]
    - [5, 0.0]
  - - [2112, 832, 1, 64]
    - [25, 0.0]
  - - [2368, 832, 1, 64]
    - [5, 0.0]
  - - [2624, 832, 1, 64]
    - [25, 0.0]
  - - [2880, 832, 1, 64]
    - [25, 0.0]
  - - [3136, 832, 1, 64]
    - [22, 0.0]
  - - [3392, 832, 1, 64]
    - [5, 0.0]
  - - [3648, 832, 1, 64]
    - [5, 0.0]
  - - [3904, 832, 1, 64]
    - [19, 0.0]
  - - [64, 1088, 1, 64]
    - [117, 0.0]
  - - [320, 1088, 1, 64]
    - [5, 0.0]
  - - [576, 1088, 1, 64]
    - [31, 0.0]
  - - [832, 1088, 1, 64]
    - [14, 0.0]
  - - [1088, 1088, 1, 64]
    - [118, 0.0]
  - - [1344, 1088, 1, 64]
    - [11, 0.0]
  - - [1600, 1088, 1, 64]
    - [38, 0.0]
  - - [1856, 1088, 1, 64]
    - [35, 0.0]
  - - [2112, 1088, 1, 64]
    - [36, 0.0]
  - - [2368, 1088, 1, 64]
    - [22, 0.0]
  - - [2624, 1088, 1, 64]
    - [25, 0.0]
  - - [2880, 1088, 1, 64]
    - [17, 0.0]
  - - [3136, 1088, 1, 64]
    - [37, 0.0]
  - - [3392, 1088, 1, 64]
    - [34, 0.0]
  - - [3648, 1088, 1, 64]
    - [19, 0.0]
  - - [3904, 1088, 1, 64]
    - [26, 0.0]
  - - [64, 1344, 1, 64]
    - [28, 0.0]
  - - [320, 1344, 1, 64]
    - [18, 0.0]
  - - [576, 1344, 1, 64]
    - [21, 0.0]
  - - [832, 1344, 1, 64]
    - [48, 0.0]
  - - [1088, 1344, 1, 64]
    - [33, 0.0]
  - - [1344, 1344, 1, 64]
    - [119, 0.0]
  - - [1600, 1344, 1, 64]
    - [35, 0.0]
  - - [1856, 1344, 1, 64]
    - [36, 0.0]
  - - [2112, 1344, 1, 64]
    - [14, 0.0]
  - - [2368, 1344, 1, 64]
    - [39, 0.0]
  - - [2624, 1344, 1, 64]
    - [21, 0.0]
  - - [2880, 1344, 1, 64]
    - [17, 0.0]
  - - [3136, 1344, 1, 64]
    - [22, 0.0]
  - - [3392, 1344, 1, 64]
    - [26, 0.0]
  - - [3648, 1344, 1, 64]
    - [5, 0.0]
  - - [3904, 1344, 1, 64]
    - [17, 0.0]
  - - [64, 1600, 1, 64]
    - [106, 0.0]
  - - [320, 1600, 1, 64]
    - [29, 0.0]
  - - [576, 1600, 1, 64]
    - [115, 0.0]
  - - [832, 1600, 1, 64]
    - [26, 0.0]
  - - [1088, 1600, 1, 64]
    - [38, 0.0]
  - - [1344, 1600, 1, 64]
    - [35, 0.0]
  - - [1600, 1600, 1, 64]
    - [19, 0.0]
  - - [1856, 1600, 1, 64]
    - [5, 0.0]
  - - [2112, 1600, 1, 64]
    - [46, 0.0]
  - - [2368, 1600, 1, 64]
    - [25, 0.0]
  - - [2624, 1600, 1, 64]
    - [5, 0.0]
  - - [2880, 1600, 1, 64]
    - [21, 0.0]
  - - [3136, 1600, 1, 64]
    - [37, 0.0]
  - - [3392, 1600, 1, 64]
    - [15, 0.0]
  - - [3648, 1600, 1, 64]
    - [26, 0.0]
  - - [3904, 1600, 1, 64]
    - [19, 0.0]
  - - [64, 1856, 1, 64]
    - [57, 0.0]
  - - [320, 1856, 1, 64]
    - [0, 0.0]
  - - [576, 1856, 1, 64]
    - [115, 0.0]
  - - [832, 1856, 1, 64]
    - [17, 0.0]
  - - [1088, 1856, 1, 64]
    - [35, 0.0]
  - - [1344, 1856, 1, 64]
    - [121, 0.0]
  - - [1600, 1856, 1, 64]
    - [15, 0.0]
  - - [1856, 1856, 1, 64]
    - [43, 0.0]
  - - [2112, 1856, 1, 64]
    - [17, 0.0]
  - - [2368, 1856, 1, 64]
    - [19, 0.0]
  - - [2624, 1856, 1, 64]
    - [21, 0.0]
  - - [2880, 1856, 1, 64]
    - [5, 0.0]
  - - [3136, 1856, 1, 64]
    - [25, 0.0]
  - - [3392, 1856, 1, 64]
    - [37, 0.0]
  - - [3648, 1856, 1, 64]
    - [21, 0.0]
  - - [3904, 1856, 1, 64]
    - [25, 0.0]
  - - [64, 2112, 1, 64]
    - [47, 0.0]
  - - [320, 2112, 1, 64]
    - [38, 0.0]
  - - [576, 2112, 1, 64]
    - [48, 0.0]
  - - [832, 2112, 1, 64]
    - [25, 0.0]
  - - [1088, 2112, 1, 64]
    - [41, 0.0]
  - - [1344, 2112, 1, 64]
    - [18, 0.0]
  - - [1600, 2112, 1, 64]
    - [37, 0.0]
  - - [1856, 2112, 1, 64]
    - [26, 0.0]
  - - [2112, 2112, 1, 64]
    - [26, 0.0]
  - - [2368, 2112, 1, 64]
    - [14, 0.0]
  - - [2624, 2112, 1, 64]
    - [22, 0.0]
  - - [2880, 2112, 1, 64]
    - [15, 0.0]
  - - [3136, 2112, 1, 64]
    - [49, 0.0]
  - - [3392, 2112, 1, 64]
    - [50, 0.0]
  - - [3648, 2112, 1, 64]
    - [51, 0.0]
  - - [3904, 2112, 1, 64]
    - [52, 0.0]
  - - [64, 2368, 1, 64]
    - [24, 0.0]
  - - [320, 2368, 1, 64]
    - [0, 0.0]
  - - [576, 2368, 1, 64]
    - [14, 0.0]
  - - [832, 2368, 1, 64]
    - [53, 0.0]
  - - [1088, 2368, 1, 64]
    - [25, 0.0]
  - - [1344, 2368, 1, 64]
    - [45, 0.0]
  - - [1600, 2368, 1, 64]
    - [33, 0.0]
  - - [1856, 2368, 1, 64]
    - [37, 0.0]
  - - [2112, 2368, 1, 64]
    - [21, 0.0]
  - - [2368, 2368, 1, 64]
    - [5, 0.0]
  - - [2624, 2368, 1, 64]
    - [54, 0.0]
  - - [2880, 2368, 1, 64]
    - [50, 0.0]
  - - [3136, 2368, 1, 64]
    - [21, 0.0]
  - - [3392, 2368, 1, 64]
    - [55, 0.0]
  - - [3648, 2368, 1, 64]
    - [56, 0.0]
  - - [3904, 2368, 1, 64]
    - [55, 0.0]
  - - [64, 2624, 1, 64]
    - [57, 0.0]
  - - [320, 2624, 1, 64]
    - [19, 0.0]
  - - [576, 2624, 1, 64]
    - [58, 0.0]
  - - [832, 2624, 1, 64]
    - [38, 0.0]
  - - [1088, 2624, 1, 64]
    - [22, 0.0]
  - - [1344, 2624, 1, 64]
    - [19, 0.0]
  - - [1600, 2624, 1, 64]
    - [17, 0.0]
  - - [1856, 2624, 1, 64]
    - [25, 0.0]
  - - [2112, 2624, 1, 64]
    - [22, 0.0]
  - - [2368, 2624, 1, 64]
    - [21, 0.0]
  - - [2624, 2624, 1, 64]
    - [21, 0.0]
  - - [2880, 2624, 1, 64]
    - [49, 0.0]
  - - [3136, 2624, 1, 64]
    - [59, 0.0]
  - - [3392, 2624, 1, 64]
    - [55, 0.0]
  - - [3648, 2624, 1, 64]
    - [60, 0.0]
  - - [3904, 2624, 1, 64]
    - [56, 0.0]
  - - [64, 2880, 1, 64]
    - [25, 0.0]
  - - [320, 2880, 1, 64]
    - [5, 0.0]
  - - [576, 2880, 1, 64]
    - [26, 0.0]
  - - [832, 2880, 1, 64]
    - [53, 0.0]
  - - [1088, 2880, 1, 64]
    - [14, 0.0]
  - - [1344, 2880, 1, 64]
    - [14, 0.0]
  - - [1600, 2880, 1, 64]
    - [25, 0.0]
  - - [1856, 2880, 1, 64]
    - [37, 0.0]
  - - [2112, 2880, 1, 64]
    - [14, 0.0]
  - - [2368, 2880, 1, 64]
    - [49, 0.0]
  - - [2624, 2880, 1, 64]
    - [26, 0.0]
  - - [2880, 2880, 1, 64]
    - [49, 0.0]
  - - [3136, 2880, 1, 64]
    - [49, 0.0]
  - - [3392, 2880, 1, 64]
    - [52, 0.0]
  - - [3648, 2880, 1, 64]
    - [50, 0.0]
  - - [3904, 2880, 1, 64]
    - [61, 0.0]
  - - [64, 3136, 1, 64]
    - [62, 0.0]
  - - [320, 3136, 1, 64]
    - [17, 0.0]
  - - [576, 3136, 1, 64]
    - [37, 0.0]
  - - [832, 3136, 1, 64]
    - [25, 0.0]
  - - [1088, 3136, 1, 64]
    - [19, 0.0]
  - - [1344, 3136, 1, 64]
    - [15, 0.0]
  - - [1600, 3136, 1, 64]
    - [25, 0.0]
  - - [1856, 3136, 1, 64]
    - [37, 0.0]
  - - [2112, 3136, 1, 64]
    - [49, 0.0]
  - - [2368, 3136, 1, 64]
    - [56, 0.0]
  - - [2624, 3136, 1, 64]
    - [50, 0.0]
  - - [2880, 3136, 1, 64]
    - [52, 0.0]
  - - [3136, 3136, 1, 64]
    - [51, 0.0]
  - - [3392, 3136, 1, 64]
    - [52, 0.0]
  - - [3648, 3136, 1, 64]
    - [50, 0.0]
  - - [3904, 3136, 1, 64]
    - [63, 0.0]
  - - [64, 3392, 1, 64]
    - [64, 0.0]
  - - [320, 3392, 1, 64]
    - [22, 0.0]
  - - [576, 3392, 1, 64]
    - [19, 0.0]
  - - [832, 3392, 1, 64]
    - [14, 0.0]
  - - [1088, 3392, 1, 64]
    - [38, 0.0]
  - - [1344, 3392, 1, 64]
    - [37, 0.0]
  - - [1600, 3392, 1, 64]
    - [37, 0.0]
  - - [1856, 3392, 1, 64]
    - [5, 0.0]
  - - [2112, 3392, 1, 64]
    - [59, 0.0]
  - - [2368, 3392, 1, 64]
    - [49, 0.0]
  - - [2624, 3392, 1, 64]
    - [56, 0.0]
  - - [2880, 3392, 1, 64]
    - [56, 0.0]
  - - [3136, 3392, 1, 64]
    - [52, 0.0]
  - - [3392, 3392, 1, 64]
    - [65, 0.0]
  - - [3648, 3392, 1, 64]
    - [49, 0.0]
  - - [3904, 3392, 1, 64]
    - [50, 0.0]
  - - [64, 3648, 1, 64]
    - [12, 0.0]
  - - [320, 3648, 1, 64]
    - [20, 0.0]
  - - [576, 3648, 1, 64]
    - [40, 0.0]
  - - [832, 3648, 1, 64]
    - [15, 0.0]
  - - [1088, 3648, 1, 64]
    - [17, 0.0]
  - - [1344, 3648, 1, 64]
    - [19, 0.0]
  - - [1600, 3648, 1, 64]
    - [15, 0.0]
  - - [1856, 3648, 1, 64]
    - [19, 0.0]
  - - [2112, 3648, 1, 64]
    - [52, 0.0]
  - - [2368, 3648, 1, 64]
    - [51, 0.0]
  - - [2624, 3648, 1, 64]
    - [50, 0.0]
  - - [2880, 3648, 1, 64]
    - [65, 0.0]
  - - [3136, 3648, 1, 64]
    - [52, 0.0]
  - - [3392, 3648, 1, 64]
    - [59, 0.0]
  - - [3648, 3648, 1, 64]
    - [52, 0.0]
  - - [3904, 3648, 1, 64]
    - [55, 0.0]
  - - [64, 3904, 1, 64]
    - [64, 0.0]
  - - [320, 3904, 1, 64]
    - [19, 0.0]
  - - [576, 3904, 1, 64]
    - [66, 0.0]
  - - [832, 3904, 1, 64]
    - [41, 0.0]
  - - [1088, 3904, 1, 64]
    - [5, 0.0]
  - - [1344, 3904, 1, 64]
    - [14, 0.0]
  - - [1600, 3904, 1, 64]
    - [26, 0.0]
  - - [1856, 3904, 1, 64]
    - [22, 0.0]
  - - [2112, 3904, 1, 64]
    - [56, 0.0]
  - - [2368, 3904, 1, 64]
    - [49, 0.0]
  - - [2624, 3904, 1, 64]
    - [51, 0.0]
  - - [2880, 3904, 1, 64]
    - [56, 0.0]
  - - [3136, 3904, 1, 64]
    - [60, 0.0]
  - - [3392, 3904, 1, 64]
    - [51, 0.0]
  - - [3648, 3904, 1, 64]
    - [50, 0.0]
  - - [3904, 3904, 1, 64]
    - [52, 0.0]
  - - [64, 64, 1, 256]
    - [129, 0.0]
  - - [320, 64, 1, 256]
    - [90, 0.0]
  - - [576, 64, 1, 256]
    - [129, 0.0]
  - - [832, 64, 1, 256]
    - [125, 0.0]
  - - [1088, 64, 1, 256]
    - [68, 0.0]
  - - [1344, 64, 1, 256]
    - [7, 0.0]
  - - [1600, 64, 1, 256]
    - [28, 0.0]
  - - [1856, 64, 1, 256]
    - [68, 0.0]
  - - [2112, 64, 1, 256]
    - [0, 0.0]
  - - [2368, 64, 1, 256]
    - [70, 0.0]
  - - [2624, 64, 1, 256]
    - [70, 0.0]
  - - [2880, 64, 1, 256]
    - [70, 0.0]
  - - [3136, 64, 1, 256]
    - [70, 0.0]
  - - [3392, 64, 1, 256]
    - [0, 0.0]
  - - [3648, 64, 1, 256]
    - [28, 0.0]
  - - [3904, 64, 1, 256]
    - [0, 0.0]
  - - [64, 320, 1, 256]
    - [113, 0.0]
  - - [320, 320, 1, 256]
    - [68, 0.0]
  - - [576, 320, 1, 256]
    - [68, 0.0]
  - - [832, 320, 1, 256]
    - [7, 0.0]
  - - [1088, 320, 1, 256]
    - [0, 0.0]
  - - [1344, 320, 1, 256]
    - [70, 0.0]
  - - [1600, 320, 1, 256]
    - [16, 0.0]
  - - [1856, 320, 1, 256]
    - [28, 0.0]
  - - [2112, 320, 1, 256]
    - [0, 0.0]
  - - [2368, 320, 1, 256]
    - [0, 0.0]
  - - [2624, 320, 1, 256]
    - [0, 0.0]
  - - [2880, 320, 1, 256]
    - [70, 0.0]
  - - [3136, 320, 1, 256]
    - [0, 0.0]
  - - [3392, 320, 1, 256]
    - [16, 0.0]
  - - [3648, 320, 1, 256]
    - [28, 0.0]
  - - [3904, 320, 1, 256]
    - [24, 0.0]
  - - [64, 576, 1, 256]
    - [129, 0.0]
  - - [320, 576, 1, 256]
    - [0, 0.0]
  - - [576, 576, 1, 256]
    - [0, 0.0]
  - - [832, 576, 1, 256]
    - [70, 0.0]
  - - [1088, 576, 1, 256]
    - [11, 0.0]
  - - [1344, 576, 1, 256]
    - [13, 0.0]
  - - [1600, 576, 1, 256]
    - [70, 0.0]
  - - [1856, 576, 1, 256]
    - [29, 0.0]
  - - [2112, 576, 1, 256]
    - [16, 0.0]
  - - [2368, 576, 1, 256]
    - [11, 0.0]
  - - [2624, 576, 1, 256]
    - [0, 0.0]
  - - [2880, 576, 1, 256]
    - [0, 0.0]
  - - [3136, 576, 1, 256]
    - [70, 0.0]
  - - [3392, 576, 1, 256]
    - [70, 0.0]
  - - [3648, 576, 1, 256]
    - [11, 0.0]
  - - [3904, 576, 1, 256]
    - [16, 0.0]
  - - [64, 832, 1, 256]
    - [23, 0.0]
  - - [320, 832, 1, 256]
    - [28, 0.0]
  - - [576, 832, 1, 256]
    - [221, 0.0]
  - - [832, 832, 1, 256]
    - [212, 0.0]
  - - [1088, 832, 1, 256]
    - [0, 0.0]
  - - [1344, 832, 1, 256]
    - [0, 0.0]
  - - [1600, 832, 1, 256]
    - [0, 0.0]
  - - [1856, 832, 1, 256]
    - [0, 0.0]
  - - [2112, 832, 1, 256]
    - [28, 0.0]
  - - [2368, 832, 1, 256]
    - [0, 0.0]
  - - [2624, 832, 1, 256]
    - [31, 0.0]
  - - [2880, 832, 1, 256]
    - [0, 0.0]
  - - [3136, 832, 1, 256]
    - [0, 0.0]
  - - [3392, 832, 1, 256]
    - [57, 0.0]
  - - [3648, 832, 1, 256]
    - [70, 0.0]
  - - [3904, 832, 1, 256]
    - [28, 0.0]
  - - [64, 1088, 1, 256]
    - [7, 0.0]
  - - [320, 1088, 1, 256]
    - [70, 0.0]
  - - [576, 1088, 1, 256]
    - [70, 0.0]
  - - [832, 1088, 1, 256]
    - [11, 0.0]
  - - [1088, 1088, 1, 256]
    - [0, 0.0]
  - - [1344, 1088, 1, 256]
    - [16, 0.0]
  - - [1600, 1088, 1, 256]
    - [70, 0.0]
  - - [1856, 1088, 1, 256]
    - [28, 0.0]
  - - [2112, 1088, 1, 256]
    - [70, 0.0]
  - - [2368, 1088, 1, 256]
    - [11, 0.0]
  - - [2624, 1088, 1, 256]
    - [6, 0.0]
  - - [2880, 1088, 1, 256]
    - [16, 0.0]
  - - [3136, 1088, 1, 256]
    - [16, 0.0]
  - - [3392, 1088, 1, 256]
    - [16, 0.0]
  - - [3648, 1088, 1, 256]
    - [70, 0.0]
  - - [3904, 1088, 1, 256]
    - [0, 0.0]
  - - [64, 1344, 1, 256]
    - [71, 0.0]
  - - [320, 1344, 1, 256]
    - [0, 0.0]
  - - [576, 1344, 1, 256]
    - [28, 0.0]
  - - [832, 1344, 1, 256]
    - [28, 0.0]
  - - [1088, 1344, 1, 256]
    - [28, 0.0]
  - - [1344, 1344, 1, 256]
    - [70, 0.0]
  - - [1600, 1344, 1, 256]
    - [24, 0.0]
  - - [1856, 1344, 1, 256]
    - [0, 0.0]
  - - [2112, 1344, 1, 256]
    - [28, 0.0]
  - - [2368, 1344, 1, 256]
    - [0, 0.0]
  - - [2624, 1344, 1, 256]
    - [16, 0.0]
  - - [2880, 1344, 1, 256]
    - [16, 0.0]
  - - [3136, 1344, 1, 256]
    - [0, 0.0]
  - - [3392, 1344, 1, 256]
    - [70, 0.0]
  - - [3648, 1344, 1, 256]
    - [63, 0.0]
  - - [3904, 1344, 1, 256]
    - [28, 0.0]
  - - [64, 1600, 1, 256]
    - [7, 0.0]
  - - [320, 1600, 1, 256]
    - [0, 0.0]
  - - [576, 1600, 1, 256]
    - [0, 0.0]
  - - [832, 1600, 1, 256]
    - [0, 0.0]
  - - [1088, 1600, 1, 256]
    - [70, 0.0]
  - - [1344, 1600, 1, 256]
    - [16, 0.0]
  - - [1600, 1600, 1, 256]
    - [24, 0.0]
  - - [1856, 1600, 1, 256]
    - [0, 0.0]
  - - [2112, 1600, 1, 256]
    - [70, 0.0]
  - - [2368, 1600, 1, 256]
    - [70, 0.0]
  - - [2624, 1600, 1, 256]
    - [70, 0.0]
  - - [2880, 1600, 1, 256]
    - [11, 0.0]
  - - [3136, 1600, 1, 256]
    - [28, 0.0]
  - - [3392, 1600, 1, 256]
    - [6, 0.0]
  - - [3648, 1600, 1, 256]
    - [0, 0.0]
  - - [3904, 1600, 1, 256]
    - [28, 0.0]
  - - [64, 1856, 1, 256]
    - [68, 0.0]
  - - [320, 1856, 1, 256]
    - [11, 0.0]
  - - [576, 1856, 1, 256]
    - [11, 0.0]
  - - [832, 1856, 1, 256]
    - [0, 0.0]
  - - [1088, 1856, 1, 256]
    - [11, 0.0]
  - - [1344, 1856, 1, 256]
    - [0, 0.0]
  - - [1600, 1856, 1, 256]
    - [31, 0.0]
  - - [1856, 1856, 1, 256]
    - [28, 0.0]
  - - [2112, 1856, 1, 256]
    - [16, 0.0]
  - - [2368, 1856, 1, 256]
    - [0, 0.0]
  - - [2624, 1856, 1, 256]
    - [28, 0.0]
  - - [2880, 1856, 1, 256]
    - [28, 0.0]
  - - [3136, 1856, 1, 256]
    - [28, 0.0]
  - - [3392, 1856, 1, 256]
    - [57, 0.0]
  - - [3648, 1856, 1, 256]
    - [16, 0.0]
  - - [3904, 1856, 1, 256]
    - [50, 0.0]
  - - [64, 2112, 1, 256]
    - [0, 0.0]
  - - [320, 2112, 1, 256]
    - [0, 0.0]
  - - [576, 2112, 1, 256]
    - [70, 0.0]
  - - [832, 2112, 1, 256]
    - [70, 0.0]
  - - [1088, 2112, 1, 256]
    - [0, 0.0]
  - - [1344, 2112, 1, 256]
    - [16, 0.0]
  - - [1600, 2112, 1, 256]
    - [16, 0.0]
  - - [1856, 2112, 1, 256]
    - [28, 0.0]
  - - [2112, 2112, 1, 256]
    - [70, 0.0]
  - - [2368, 2112, 1, 256]
    - [70, 0.0]
  - - [2624, 2112, 1, 256]
    - [60, 0.0]
  - - [2880, 2112, 1, 256]
    - [28, 0.0]
  - - [3136, 2112, 1, 256]
    - [65, 0.0]
  - - [3392, 2112, 1, 256]
    - [49, 0.0]
  - - [3648, 2112, 1, 256]
    - [56, 0.0]
  - - [3904, 2112, 1, 256]
    - [60, 0.0]
  - - [64, 2368, 1, 256]
    - [0, 0.0]
  - - [320, 2368, 1, 256]
    - [70, 0.0]
  - - [576, 2368, 1, 256]
    - [0, 0.0]
  - - [832, 2368, 1, 256]
    - [28, 0.0]
  - - [1088, 2368, 1, 256]
    - [28, 0.0]
  - - [1344, 2368, 1, 256]
    - [16, 0.0]
  - - [1600, 2368, 1, 256]
    - [0, 0.0]
  - - [1856, 2368, 1, 256]
    - [70, 0.0]
  - - [2112, 2368, 1, 256]
    - [16, 0.0]
  - - [2368, 2368, 1, 256]
    - [70, 0.0]
  - - [2624, 2368, 1, 256]
    - [50, 0.0]
  - - [2880, 2368, 1, 256]
    - [56, 0.0]
  - - [3136, 2368, 1, 256]
    - [56, 0.0]
  - - [3392, 2368, 1, 256]
    - [73, 0.0]
  - - [3648, 2368, 1, 256]
    - [49, 0.0]
  - - [3904, 2368, 1, 256]
    - [51, 0.0]
  - - [64, 2624, 1, 256]
    - [0, 0.0]
  - - [320, 2624, 1, 256]
    - [0, 0.0]
  - - [576, 2624, 1, 256]
    - [70, 0.0]
  - - [832, 2624, 1, 256]
    - [16, 0.0]
  - - [1088, 2624, 1, 256]
    - [70, 0.0]
  - - [1344, 2624, 1, 256]
    - [70, 0.0]
  - - [1600, 2624, 1, 256]
    - [0, 0.0]
  - - [1856, 2624, 1, 256]
    - [0, 0.0]
  - - [2112, 2624, 1, 256]
    - [70, 0.0]
  - - [2368, 2624, 1, 256]
    - [28, 0.0]
  - - [2624, 2624, 1, 256]
    - [50, 0.0]
  - - [2880, 2624, 1, 256]
    - [70, 0.0]
  - - [3136, 2624, 1, 256]
    - [74, 0.0]
  - - [3392, 2624, 1, 256]
    - [63, 0.0]
  - - [3648, 2624, 1, 256]
    - [52, 0.0]
  - - [3904, 2624, 1, 256]
    - [55, 0.0]
  - - [64, 2880, 1, 256]
    - [17, 0.0]
  - - [320, 2880, 1, 256]
    - [11, 0.0]
  - - [576, 2880, 1, 256]
    - [16, 0.0]
  - - [832, 2880, 1, 256]
    - [0, 0.0]
  - - [1088, 2880, 1, 256]
    - [0, 0.0]
  - - [1344, 2880, 1, 256]
    - [9, 0.0]
  - - [1600, 2880, 1, 256]
    - [28, 0.0]
  - - [1856, 2880, 1, 256]
    - [16, 0.0]
  - - [2112, 2880, 1, 256]
    - [28, 0.0]
  - - [2368, 2880, 1, 256]
    - [54, 0.0]
  - - [2624, 2880, 1, 256]
    - [49, 0.0]
  - - [2880, 2880, 1, 256]
    - [60, 0.0]
  - - [3136, 2880, 1, 256]
    - [55, 0.0]
  - - [3392, 2880, 1, 256]
    - [60, 0.0]
  - - [3648, 2880, 1, 256]
    - [74, 0.0]
  - - [3904, 2880, 1, 256]
    - [52, 0.0]
  - - [64, 3136, 1, 256]
    - [70, 0.0]
  - - [320, 3136, 1, 256]
    - [0, 0.0]
  - - [576, 3136, 1, 256]
    - [70, 0.0]
  - - [832, 3136, 1, 256]
    - [16, 0.0]
  - - [1088, 3136, 1, 256]
    - [70, 0.0]
  - - [1344, 3136, 1, 256]
    - [0, 0.0]
  - - [1600, 3136, 1, 256]
    - [28, 0.0]
  - - [1856, 3136, 1, 256]
    - [28, 0.0]
  - - [2112, 3136, 1, 256]
    - [73, 0.0]
  - - [2368, 3136, 1, 256]
    - [75, 0.0]
  - - [2624, 3136, 1, 256]
    - [74, 0.0]
  - - [2880, 3136, 1, 256]
    - [74, 0.0]
  - - [3136, 3136, 1, 256]
    - [56, 0.0]
  - - [3392, 3136, 1, 256]
    - [56, 0.0]
  - - [3648, 3136, 1, 256]
    - [74, 0.0]
  - - [3904, 3136, 1, 256]
    - [74, 0.0]
  - - [64, 3392, 1, 256]
    - [28, 0.0]
  - - [320, 3392, 1, 256]
    - [28, 0.0]
  - - [576, 3392, 1, 256]
    - [16, 0.0]
  - - [832, 3392, 1, 256]
    - [16, 0.0]
  - - [1088, 3392, 1, 256]
    - [16, 0.0]
  - - [1344, 3392, 1, 256]
    - [16, 0.0]
  - - [1600, 3392, 1, 256]
    - [0, 0.0]
  - - [1856, 3392, 1, 256]
    - [0, 0.0]
  - - [2112, 3392, 1, 256]
    - [56, 0.0]
  - - [2368, 3392, 1, 256]
    - [51, 0.0]
  - - [2624, 3392, 1, 256]
    - [76, 0.0]
  - - [2880, 3392, 1, 256]
    - [60, 0.0]
  - - [3136, 3392, 1, 256]
    - [55, 0.0]
  - - [3392, 3392, 1, 256]
    - [74, 0.0]
  - - [3648, 3392, 1, 256]
    - [74, 0.0]
  - - [3904, 3392, 1, 256]
    - [60, 0.0]
  - - [64, 3648, 1, 256]
    - [28, 0.0]
  - - [320, 3648, 1, 256]
    - [70, 0.0]
  - - [576, 3648, 1, 256]
    - [28, 0.0]
  - - [832, 3648, 1, 256]
    - [70, 0.0]
  - - [1088, 3648, 1, 256]
    - [70, 0.0]
  - - [1344, 3648, 1, 256]
    - [0, 0.0]
  - - [1600, 3648, 1, 256]
    - [70, 0.0]
  - - [1856, 3648, 1, 256]
    - [16, 0.0]
  - - [2112, 3648, 1, 256]
    - [73, 0.0]
  - - [2368, 3648, 1, 256]
    - [52, 0.0]
  - - [2624, 3648, 1, 256]
    - [77, 0.0]
  - - [2880, 3648, 1, 256]
    - [51, 0.0]
  - - [3136, 3648, 1, 256]
    - [52, 0.0]
  - - [3392, 3648, 1, 256]
    - [60, 0.0]
  - - [3648, 3648, 1, 256]
    - [50, 0.0]
  - - [3904, 3648, 1, 256]
    - [65, 0.0]
  - - [64, 3904, 1, 256]
    - [28, 0.0]
  - - [320, 3904, 1, 256]
    - [16, 0.0]
  - - [576, 3904, 1, 256]
    - [28, 0.0]
  - - [832, 3904, 1, 256]
    - [70, 0.0]
  - - [1088, 3904, 1, 256]
    - [70, 0.0]
  - - [1344, 3904, 1, 256]
    - [0, 0.0]
  - - [1600, 3904, 1, 256]
    - [16, 0.0]
  - - [1856, 3904, 1, 256]
    - [51, 0.0]
  - - [2112, 3904, 1, 256]
    - [50, 0.0]
  - - [2368, 3904, 1, 256]
    - [65, 0.0]
  - - [2624, 3904, 1, 256]
    - [49, 0.0]
  - - [2880, 3904, 1, 256]
    - [63, 0.0]
  - - [3136, 3904, 1, 256]
    - [52, 0.0]
  - - [3392, 3904, 1, 256]
    - [51, 0.0]
  - - [3648, 3904, 1, 256]
    - [74, 0.0]
  - - [3904, 3904, 1, 256]
    - [51, 0.0]
  - - [64, 64, 1, 512]
    - [133, 0.0]
  - - [320, 64, 1, 512]
    - [102, 0.0]
  - - [576, 64, 1, 512]
    - [129, 0.0]
  - - [832, 64, 1, 512]
    - [81, 0.0]
  - - [1088, 64, 1, 512]
    - [7, 0.0]
  - - [1344, 64, 1, 512]
    - [68, 0.0]
  - - [1600, 64, 1, 512]
    - [68, 0.0]
  - - [1856, 64, 1, 512]
    - [7, 0.0]
  - - [2112, 64, 1, 512]
    - [70, 0.0]
  - - [2368, 64, 1, 512]
    - [0, 0.0]
  - - [2624, 64, 1, 512]
    - [17, 0.0]
  - - [2880, 64, 1, 512]
    - [70, 0.0]
  - - [3136, 64, 1, 512]
    - [0, 0.0]
  - - [3392, 64, 1, 512]
    - [0, 0.0]
  - - [3648, 64, 1, 512]
    - [70, 0.0]
  - - [3904, 64, 1, 512]
    - [0, 0.0]
  - - [64, 320, 1, 512]
    - [129, 0.0]
  - - [320, 320, 1, 512]
    - [0, 0.0]
  - - [576, 320, 1, 512]
    - [204, 0.0]
  - - [832, 320, 1, 512]
    - [128, 0.0]
  - - [1088, 320, 1, 512]
    - [0, 0.0]
  - - [1344, 320, 1, 512]
    - [0, 0.0]
  - - [1600, 320, 1, 512]
    - [0, 0.0]
  - - [1856, 320, 1, 512]
    - [31, 0.0]
  - - [2112, 320, 1, 512]
    - [11, 0.0]
  - - [2368, 320, 1, 512]
    - [29, 0.0]
  - - [2624, 320, 1, 512]
    - [70, 0.0]
  - - [2880, 320, 1, 512]
    - [0, 0.0]
  - - [3136, 320, 1, 512]
    - [0, 0.0]
  - - [3392, 320, 1, 512]
    - [70, 0.0]
  - - [3648, 320, 1, 512]
    - [70, 0.0]
  - - [3904, 320, 1, 512]
    - [70, 0.0]
  - - [64, 576, 1, 512]
    - [206, 0.0]
  - - [320, 576, 1, 512]
    - [7, 0.0]
  - - [576, 576, 1, 512]
    - [6, 0.0]
  - - [832, 576, 1, 512]
    - [70, 0.0]
  - - [1088, 576, 1, 512]
    - [31, 0.0]
  - - [1344, 576, 1, 512]
    - [11, 0.0]
  - - [1600, 576, 1, 512]
    - [70, 0.0]
  - - [1856, 576, 1, 512]
    - [70, 0.0]
  - - [2112, 576, 1, 512]
    - [70, 0.0]
  - - [2368, 576, 1, 512]
    - [29, 0.0]
  - - [2624, 576, 1, 512]
    - [70, 0.0]
  - - [2880, 576, 1, 512]
    - [70, 0.0]
  - - [3136, 576, 1, 512]
    - [0, 0.0]
  - - [3392, 576, 1, 512]
    - [70, 0.0]
  - - [3648, 576, 1, 512]
    - [31, 0.0]
  - - [3904, 576, 1, 512]
    - [0, 0.0]
  - - [64, 832, 1, 512]
    - [89, 0.0]
  - - [320, 832, 1, 512]
    - [128, 0.0]
  - - [576, 832, 1, 512]
    - [31, 0.0]
  - - [832, 832, 1, 512]
    - [68, 0.0]
  - - [1088, 832, 1, 512]
    - [70, 0.0]
  - - [1344, 832, 1, 512]
    - [0, 0.0]
  - - [1600, 832, 1, 512]
    - [70, 0.0]
  - - [1856, 832, 1, 512]
    - [13, 0.0]
  - - [2112, 832, 1, 512]
    - [0, 0.0]
  - - [2368, 832, 1, 512]
    - [70, 0.0]
  - - [2624, 832, 1, 512]
    - [16, 0.0]
  - - [2880, 832, 1, 512]
    - [0, 0.0]
  - - [3136, 832, 1, 512]
    - [28, 0.0]
  - - [3392, 832, 1, 512]
    - [70, 0.0]
  - - [3648, 832, 1, 512]
    - [0, 0.0]
  - - [3904, 832, 1, 512]
    - [70, 0.0]
  - - [64, 1088, 1, 512]
    - [23, 0.0]
  - - [320, 1088, 1, 512]
    - [0, 0.0]
  - - [576, 1088, 1, 512]
    - [31, 0.0]
  - - [832, 1088, 1, 512]
    - [0, 0.0]
  - - [1088, 1088, 1, 512]
    - [28, 0.0]
  - - [1344, 1088, 1, 512]
    - [70, 0.0]
  - - [1600, 1088, 1, 512]
    - [0, 0.0]
  - - [1856, 1088, 1, 512]
    - [0, 0.0]
  - - [2112, 1088, 1, 512]
    - [28, 0.0]
  - - [2368, 1088, 1, 512]
    - [0, 0.0]
  - - [2624, 1088, 1, 512]
    - [70, 0.0]
  - - [2880, 1088, 1, 512]
    - [70, 0.0]
  - - [3136, 1088, 1, 512]
    - [0, 0.0]
  - - [3392, 1088, 1, 512]
    - [70, 0.0]
  - - [3648, 1088, 1, 512]
    - [28, 0.0]
  - - [3904, 1088, 1, 512]
    - [28, 0.0]
  - - [64, 1344, 1, 512]
    - [7, 0.0]
  - - [320, 1344, 1, 512]
    - [16, 0.0]
  - - [576, 1344, 1, 512]
    - [70, 0.0]
  - - [832, 1344, 1, 512]
    - [70, 0.0]
  - - [1088, 1344, 1, 512]
    - [0, 0.0]
  - - [1344, 1344, 1, 512]
    - [70, 0.0]
  - - [1600, 1344, 1, 512]
    - [16, 0.0]
  - - [1856, 1344, 1, 512]
    - [16, 0.0]
  - - [2112, 1344, 1, 512]
    - [0, 0.0]
  - - [2368, 1344, 1, 512]
    - [70, 0.0]
  - - [2624, 1344, 1, 512]
    - [16, 0.0]
  - - [2880, 1344, 1, 512]
    - [70, 0.0]
  - - [3136, 1344, 1, 512]
    - [16, 0.0]
  - - [3392, 1344, 1, 512]
    - [11, 0.0]
  - - [3648, 1344, 1, 512]
    - [16, 0.0]
  - - [3904, 1344, 1, 512]
    - [11, 0.0]
  - - [64, 1600, 1, 512]
    - [7, 0.0]
  - - [320, 1600, 1, 512]
    - [0, 0.0]
  - - [576, 1600, 1, 512]
    - [70, 0.0]
  - - [832, 1600, 1, 512]
    - [70, 0.0]
  - - [1088, 1600, 1, 512]
    - [16, 0.0]
  - - [1344, 1600, 1, 512]
    - [28, 0.0]
  - - [1600, 1600, 1, 512]
    - [28, 0.0]
  - - [1856, 1600, 1, 512]
    - [70, 0.0]
  - - [2112, 1600, 1, 512]
    - [31, 0.0]
  - - [2368, 1600, 1, 512]
    - [0, 0.0]
  - - [2624, 1600, 1, 512]
    - [28, 0.0]
  - - [2880, 1600, 1, 512]
    - [28, 0.0]
  - - [3136, 1600, 1, 512]
    - [70, 0.0]
  - - [3392, 1600, 1, 512]
    - [11, 0.0]
  - - [3648, 1600, 1, 512]
    - [11, 0.0]
  - - [3904, 1600, 1, 512]
    - [28, 0.0]
  - - [64, 1856, 1, 512]
    - [68, 0.0]
  - - [320, 1856, 1, 512]
    - [29, 0.0]
  - - [576, 1856, 1, 512]
    - [57, 0.0]
  - - [832, 1856, 1, 512]
    - [70, 0.0]
  - - [1088, 1856, 1, 512]
    - [11, 0.0]
  - - [1344, 1856, 1, 512]
    - [0, 0.0]
  - - [1600, 1856, 1, 512]
    - [16, 0.0]
  - - [1856, 1856, 1, 512]
    - [70, 0.0]
  - - [2112, 1856, 1, 512]
    - [70, 0.0]
  - - [2368, 1856, 1, 512]
    - [28, 0.0]
  - - [2624, 1856, 1, 512]
    - [0, 0.0]
  - - [2880, 1856, 1, 512]
    - [16, 0.0]
  - - [3136, 1856, 1, 512]
    - [31, 0.0]
  - - [3392, 1856, 1, 512]
    - [28, 0.0]
  - - [3648, 1856, 1, 512]
    - [70, 0.0]
  - - [3904, 1856, 1, 512]
    - [28, 0.0]
  - - [64, 2112, 1, 512]
    - [0, 0.0]
  - - [320, 2112, 1, 512]
    - [24, 0.0]
  - - [576, 2112, 1, 512]
    - [31, 0.0]
  - - [832, 2112, 1, 512]
    - [0, 0.0]
  - - [1088, 2112, 1, 512]
    - [16, 0.0]
  - - [1344, 2112, 1, 512]
    - [11, 0.0]
  - - [1600, 2112, 1, 512]
    - [16, 0.0]
  - - [1856, 2112, 1, 512]
    - [31, 0.0]
  - - [2112, 2112, 1, 512]
    - [28, 0.0]
  - - [2368, 2112, 1, 512]
    - [0, 0.0]
  - - [2624, 2112, 1, 512]
    - [57, 0.0]
  - - [2880, 2112, 1, 512]
    - [28, 0.0]
  - - [3136, 2112, 1, 512]
    - [31, 0.0]
  - - [3392, 2112, 1, 512]
    - [0, 0.0]
  - - [3648, 2112, 1, 512]
    - [0, 0.0]
  - - [3904, 2112, 1, 512]
    - [0, 0.0]
  - - [64, 2368, 1, 512]
    - [70, 0.0]
  - - [320, 2368, 1, 512]
    - [31, 0.0]
  - - [576, 2368, 1, 512]
    - [70, 0.0]
  - - [832, 2368, 1, 512]
    - [70, 0.0]
  - - [1088, 2368, 1, 512]
    - [0, 0.0]
  - - [1344, 2368, 1, 512]
    - [0, 0.0]
  - - [1600, 2368, 1, 512]
    - [11, 0.0]
  - - [1856, 2368, 1, 512]
    - [31, 0.0]
  - - [2112, 2368, 1, 512]
    - [16, 0.0]
  - - [2368, 2368, 1, 512]
    - [70, 0.0]
  - - [2624, 2368, 1, 512]
    - [11, 0.0]
  - - [2880, 2368, 1, 512]
    - [83, 0.0]
  - - [3136, 2368, 1, 512]
    - [77, 0.0]
  - - [3392, 2368, 1, 512]
    - [28, 0.0]
  - - [3648, 2368, 1, 512]
    - [70, 0.0]
  - - [3904, 2368, 1, 512]
    - [60, 0.0]
  - - [64, 2624, 1, 512]
    - [0, 0.0]
  - - [320, 2624, 1, 512]
    - [31, 0.0]
  - - [576, 2624, 1, 512]
    - [70, 0.0]
  - - [832, 2624, 1, 512]
    - [70, 0.0]
  - - [1088, 2624, 1, 512]
    - [0, 0.0]
  - - [1344, 2624, 1, 512]
    - [29, 0.0]
  - - [1600, 2624, 1, 512]
    - [70, 0.0]
  - - [1856, 2624, 1, 512]
    - [16, 0.0]
  - - [2112, 2624, 1, 512]
    - [28, 0.0]
  - - [2368, 2624, 1, 512]
    - [28, 0.0]
  - - [2624, 2624, 1, 512]
    - [63, 0.0]
  - - [2880, 2624, 1, 512]
    - [0, 0.0]
  - - [3136, 2624, 1, 512]
    - [16, 0.0]
  - - [3392, 2624, 1, 512]
    - [65, 0.0]
  - - [3648, 2624, 1, 512]
    - [70, 0.0]
  - - [3904, 2624, 1, 512]
    - [84, 0.0]
  - - [64, 2880, 1, 512]
    - [0, 0.0]
  - - [320, 2880, 1, 512]
    - [0, 0.0]
  - - [576, 2880, 1, 512]
    - [16, 0.0]
  - - [832, 2880, 1, 512]
    - [0, 0.0]
  - - [1088, 2880, 1, 512]
    - [11, 0.0]
  - - [1344, 2880, 1, 512]
    - [0, 0.0]
  - - [1600, 2880, 1, 512]
    - [0, 0.0]
  - - [1856, 2880, 1, 512]
    - [16, 0.0]
  - - [2112, 2880, 1, 512]
    - [28, 0.0]
  - - [2368, 2880, 1, 512]
    - [11, 0.0]
  - - [2624, 2880, 1, 512]
    - [16, 0.0]
  - - [2880, 2880, 1, 512]
    - [16, 0.0]
  - - [3136, 2880, 1, 512]
    - [77, 0.0]
  - - [3392, 2880, 1, 512]
    - [31, 0.0]
  - - [3648, 2880, 1, 512]
    - [77, 0.0]
  - - [3904, 2880, 1, 512]
    - [73, 0.0]
  - - [64, 3136, 1, 512]
    - [0, 0.0]
  - - [320, 3136, 1, 512]
    - [70, 0.0]
  - - [576, 3136, 1, 512]
    - [29, 0.0]
  - - [832, 3136, 1, 512]
    - [70, 0.0]
  - - [1088, 3136, 1, 512]
    - [16, 0.0]
  - - [1344, 3136, 1, 512]
    - [16, 0.0]
  - - [1600, 3136, 1, 512]
    - [28, 0.0]
  - - [1856, 3136, 1, 512]
    - [0, 0.0]
  - - [2112, 3136, 1, 512]
    - [28, 0.0]
  - - [2368, 3136, 1, 512]
    - [28, 0.0]
  - - [2624, 3136, 1, 512]
    - [65, 0.0]
  - - [2880, 3136, 1, 512]
    - [74, 0.0]
  - - [3136, 3136, 1, 512]
    - [56, 0.0]
  - - [3392, 3136, 1, 512]
    - [84, 0.0]
  - - [3648, 3136, 1, 512]
    - [63, 0.0]
  - - [3904, 3136, 1, 512]
    - [56, 0.0]
  - - [64, 3392, 1, 512]
    - [0, 0.0]
  - - [320, 3392, 1, 512]
    - [28, 0.0]
  - - [576, 3392, 1, 512]
    - [70, 0.0]
  - - [832, 3392, 1, 512]
    - [28, 0.0]
  - - [1088, 3392, 1, 512]
    - [0, 0.0]
  - - [1344, 3392, 1, 512]
    - [70, 0.0]
  - - [1600, 3392, 1, 512]
    - [28, 0.0]
  - - [1856, 3392, 1, 512]
    - [31, 0.0]
  - - [2112, 3392, 1, 512]
    - [70, 0.0]
  - - [2368, 3392, 1, 512]
    - [77, 0.0]
  - - [2624, 3392, 1, 512]
    - [60, 0.0]
  - - [2880, 3392, 1, 512]
    - [73, 0.0]
  - - [3136, 3392, 1, 512]
    - [63, 0.0]
  - - [3392, 3392, 1, 512]
    - [73, 0.0]
  - - [3648, 3392, 1, 512]
    - [85, 0.0]
  - - [3904, 3392, 1, 512]
    - [56, 0.0]
  - - [64, 3648, 1, 512]
    - [70, 0.0]
  - - [320, 3648, 1, 512]
    - [70, 0.0]
  - - [576, 3648, 1, 512]
    - [0, 0.0]
  - - [832, 3648, 1, 512]
    - [28, 0.0]
  - - [1088, 3648, 1, 512]
    - [28, 0.0]
  - - [1344, 3648, 1, 512]
    - [70, 0.0]
  - - [1600, 3648, 1, 512]
    - [0, 0.0]
  - - [1856, 3648, 1, 512]
    - [28, 0.0]
  - - [2112, 3648, 1, 512]
    - [28, 0.0]
  - - [2368, 3648, 1, 512]
    - [16, 0.0]
  - - [2624, 3648, 1, 512]
    - [73, 0.0]
  - - [2880, 3648, 1, 512]
    - [74, 0.0]
  - - [3136, 3648, 1, 512]
    - [73, 0.0]
  - - [3392, 3648, 1, 512]
    - [73, 0.0]
  - - [3648, 3648, 1, 512]
    - [73, 0.0]
  - - [3904, 3648, 1, 512]
    - [52, 0.0]
  - - [64, 3904, 1, 512]
    - [0, 0.0]
  - - [320, 3904, 1, 512]
    - [16, 0.0]
  - - [576, 3904, 1, 512]
    - [11, 0.0]
  - - [832, 3904, 1, 512]
    - [28, 0.0]
  - - [1088, 3904, 1, 512]
    - [16, 0.0]
  - - [1344, 3904, 1, 512]
    - [0, 0.0]
  - - [1600, 3904, 1, 512]
    - [16, 0.0]
  - - [1856, 3904, 1, 512]
    - [28, 0.0]
  - - [2112, 3904, 1, 512]
    - [28, 0.0]
  - - [2368, 3904, 1, 512]
    - [16, 0.0]
  - - [2624, 3904, 1, 512]
    - [85, 0.0]
  - - [2880, 3904, 1, 512]
    - [73, 0.0]
  - - [3136, 3904, 1, 512]
    - [75, 0.0]
  - - [3392, 3904, 1, 512]
    - [49, 0.0]
  - - [3648, 3904, 1, 512]
    - [63, 0.0]
  - - [3904, 3904, 1, 512]
    - [74, 0.0]
  - - [64, 64, 1, 1024]
    - [113, 0.0]
  - - [320, 64, 1, 1024]
    - [203, 0.0]
  - - [576, 64, 1, 1024]
    - [203, 0.0]
  - - [832, 64, 1, 1024]
    - [196, 0.0]
  - - [1088, 64, 1, 1024]
    - [7, 0.0]
  - - [1344, 64, 1, 1024]
    - [68, 0.0]
  - - [1600, 64, 1, 1024]
    - [70, 0.0]
  - - [1856, 64, 1, 1024]
    - [0, 0.0]
  - - [2112, 64, 1, 1024]
    - [70, 0.0]
  - - [2368, 64, 1, 1024]
    - [0, 0.0]
  - - [2624, 64, 1, 1024]
    - [70, 0.0]
  - - [2880, 64, 1, 1024]
    - [86, 0.0]
  - - [3136, 64, 1, 1024]
    - [0, 0.0]
  - - [3392, 64, 1, 1024]
    - [70, 0.0]
  - - [3648, 64, 1, 1024]
    - [70, 0.0]
  - - [3904, 64, 1, 1024]
    - [70, 0.0]
  - - [64, 320, 1, 1024]
    - [241, 0.0]
  - - [320, 320, 1, 1024]
    - [204, 0.0]
  - - [576, 320, 1, 1024]
    - [30, 0.0]
  - - [832, 320, 1, 1024]
    - [7, 0.0]
  - - [1088, 320, 1, 1024]
    - [0, 0.0]
  - - [1344, 320, 1, 1024]
    - [72, 0.0]
  - - [1600, 320, 1, 1024]
    - [70, 0.0]
  - - [1856, 320, 1, 1024]
    - [0, 0.0]
  - - [2112, 320, 1, 1024]
    - [0, 0.0]
  - - [2368, 320, 1, 1024]
    - [11, 0.0]
  - - [2624, 320, 1, 1024]
    - [0, 0.0]
  - - [2880, 320, 1, 1024]
    - [0, 0.0]
  - - [3136, 320, 1, 1024]
    - [70, 0.0]
  - - [3392, 320, 1, 1024]
    - [16, 0.0]
  - - [3648, 320, 1, 1024]
    - [70, 0.0]
  - - [3904, 320, 1, 1024]
    - [0, 0.0]
  - - [64, 576, 1, 1024]
    - [27, 0.0]
  - - [320, 576, 1, 1024]
    - [181, 0.0]
  - - [576, 576, 1, 1024]
    - [28, 0.0]
  - - [832, 576, 1, 1024]
    - [11, 0.0]
  - - [1088, 576, 1, 1024]
    - [70, 0.0]
  - - [1344, 576, 1, 1024]
    - [11, 0.0]
  - - [1600, 576, 1, 1024]
    - [0, 0.0]
  - - [1856, 576, 1, 1024]
    - [0, 0.0]
  - - [2112, 576, 1, 1024]
    - [28, 0.0]
  - - [2368, 576, 1, 1024]
    - [0, 0.0]
  - - [2624, 576, 1, 1024]
    - [11, 0.0]
  - - [2880, 576, 1, 1024]
    - [28, 0.0]
  - - [3136, 576, 1, 1024]
    - [28, 0.0]
  - - [3392, 576, 1, 1024]
    - [0, 0.0]
  - - [3648, 576, 1, 1024]
    - [0, 0.0]
  - - [3904, 576, 1, 1024]
    - [0, 0.0]
  - - [64, 832, 1, 1024]
    - [27, 0.0]
  - - [320, 832, 1, 1024]
    - [30, 0.0]
  - - [576, 832, 1, 1024]
    - [11, 0.0]
  - - [832, 832, 1, 1024]
    - [47, 0.0]
  - - [1088, 832, 1, 1024]
    - [70, 0.0]
  - - [1344, 832, 1, 1024]
    - [70, 0.0]
  - - [1600, 832, 1, 1024]
    - [70, 0.0]
  - - [1856, 832, 1, 1024]
    - [0, 0.0]
  - - [2112, 832, 1, 1024]
    - [16, 0.0]
  - - [2368, 832, 1, 1024]
    - [0, 0.0]
  - - [2624, 832, 1, 1024]
    - [11, 0.0]
  - - [2880, 832, 1, 1024]
    - [70, 0.0]
  - - [3136, 832, 1, 1024]
    - [0, 0.0]
  - - [3392, 832, 1, 1024]
    - [28, 0.0]
  - - [3648, 832, 1, 1024]
    - [28, 0.0]
  - - [3904, 832, 1, 1024]
    - [28, 0.0]
  - - [64, 1088, 1, 1024]
    - [81, 0.0]
  - - [320, 1088, 1, 1024]
    - [70, 0.0]
  - - [576, 1088, 1, 1024]
    - [31, 0.0]
  - - [832, 1088, 1, 1024]
    - [0, 0.0]
  - - [1088, 1088, 1, 1024]
    - [70, 0.0]
  - - [1344, 1088, 1, 1024]
    - [0, 0.0]
  - - [1600, 1088, 1, 1024]
    - [28, 0.0]
  - - [1856, 1088, 1, 1024]
    - [70, 0.0]
  - - [2112, 1088, 1, 1024]
    - [16, 0.0]
  - - [2368, 1088, 1, 1024]
    - [28, 0.0]
  - - [2624, 1088, 1, 1024]
    - [16, 0.0]
  - - [2880, 1088, 1, 1024]
    - [28, 0.0]
  - - [3136, 1088, 1, 1024]
    - [0, 0.0]
  - - [3392, 1088, 1, 1024]
    - [11, 0.0]
  - - [3648, 1088, 1, 1024]
    - [16, 0.0]
  - - [3904, 1088, 1, 1024]
    - [11, 0.0]
  - - [64, 1344, 1, 1024]
    - [70, 0.0]
  - - [320, 1344, 1, 1024]
    - [0, 0.0]
  - - [576, 1344, 1, 1024]
    - [70, 0.0]
  - - [832, 1344, 1, 1024]
    - [70, 0.0]
  - - [1088, 1344, 1, 1024]
    - [70, 0.0]
  - - [1344, 1344, 1, 1024]
    - [0, 0.0]
  - - [1600, 1344, 1, 1024]
    - [0, 0.0]
  - - [1856, 1344, 1, 1024]
    - [70, 0.0]
  - - [2112, 1344, 1, 1024]
    - [0, 0.0]
  - - [2368, 1344, 1, 1024]
    - [16, 0.0]
  - - [2624, 1344, 1, 1024]
    - [0, 0.0]
  - - [2880, 1344, 1, 1024]
    - [16, 0.0]
  - - [3136, 1344, 1, 1024]
    - [0, 0.0]
  - - [3392, 1344, 1, 1024]
    - [28, 0.0]
  - - [3648, 1344, 1, 1024]
    - [28, 0.0]
  - - [3904, 1344, 1, 1024]
    - [28, 0.0]
  - - [64, 1600, 1, 1024]
    - [68, 0.0]
  - - [320, 1600, 1, 1024]
    - [0, 0.0]
  - - [576, 1600, 1, 1024]
    - [70, 0.0]
  - - [832, 1600, 1, 1024]
    - [70, 0.0]
  - - [1088, 1600, 1, 1024]
    - [11, 0.0]
  - - [1344, 1600, 1, 1024]
    - [70, 0.0]
  - - [1600, 1600, 1, 1024]
    - [0, 0.0]
  - - [1856, 1600, 1, 1024]
    - [0, 0.0]
  - - [2112, 1600, 1, 1024]
    - [28, 0.0]
  - - [2368, 1600, 1, 1024]
    - [28, 0.0]
  - - [2624, 1600, 1, 1024]
    - [16, 0.0]
  - - [2880, 1600, 1, 1024]
    - [0, 0.0]
  - - [3136, 1600, 1, 1024]
    - [28, 0.0]
  - - [3392, 1600, 1, 1024]
    - [0, 0.0]
  - - [3648, 1600, 1, 1024]
    - [16, 0.0]
  - - [3904, 1600, 1, 1024]
    - [28, 0.0]
  - - [64, 1856, 1, 1024]
    - [7, 0.0]
  - - [320, 1856, 1, 1024]
    - [31, 0.0]
  - - [576, 1856, 1, 1024]
    - [0, 0.0]
  - - [832, 1856, 1, 1024]
    - [0, 0.0]
  - - [1088, 1856, 1, 1024]
    - [70, 0.0]
  - - [1344, 1856, 1, 1024]
    - [0, 0.0]
  - - [1600, 1856, 1, 1024]
    - [16, 0.0]
  - - [1856, 1856, 1, 1024]
    - [28, 0.0]
  - - [2112, 1856, 1, 1024]
    - [16, 0.0]
  - - [2368, 1856, 1, 1024]
    - [70, 0.0]
  - - [2624, 1856, 1, 1024]
    - [16, 0.0]
  - - [2880, 1856, 1, 1024]
    - [16, 0.0]
  - - [3136, 1856, 1, 1024]
    - [70, 0.0]
  - - [3392, 1856, 1, 1024]
    - [16, 0.0]
  - - [3648, 1856, 1, 1024]
    - [0, 0.0]
  - - [3904, 1856, 1, 1024]
    - [0, 0.0]
  - - [64, 2112, 1, 1024]
    - [0, 0.0]
  - - [320, 2112, 1, 1024]
    - [0, 0.0]
  - - [576, 2112, 1, 1024]
    - [0, 0.0]
  - - [832, 2112, 1, 1024]
    - [28, 0.0]
  - - [1088, 2112, 1, 1024]
    - [11, 0.0]
  - - [1344, 2112, 1, 1024]
    - [28, 0.0]
  - - [1600, 2112, 1, 1024]
    - [70, 0.0]
  - - [1856, 2112, 1, 1024]
    - [28, 0.0]
  - - [2112, 2112, 1, 1024]
    - [31, 0.0]
  - - [2368, 2112, 1, 1024]
    - [0, 0.0]
  - - [2624, 2112, 1, 1024]
    - [16, 0.0]
  - - [2880, 2112, 1, 1024]
    - [28, 0.0]
  - - [3136, 2112, 1, 1024]
    - [28, 0.0]
  - - [3392, 2112, 1, 1024]
    - [28, 0.0]
  - - [3648, 2112, 1, 1024]
    - [16, 0.0]
  - - [3904, 2112, 1, 1024]
    - [16, 0.0]
  - - [64, 2368, 1, 1024]
    - [0, 0.0]
  - - [320, 2368, 1, 1024]
    - [24, 0.0]
  - - [576, 2368, 1, 1024]
    - [0, 0.0]
  - - [832, 2368, 1, 1024]
    - [0, 0.0]
  - - [1088, 2368, 1, 1024]
    - [28, 0.0]
  - - [1344, 2368, 1, 1024]
    - [70, 0.0]
  - - [1600, 2368, 1, 1024]
    - [28, 0.0]
  - - [1856, 2368, 1, 1024]
    - [16, 0.0]
  - - [2112, 2368, 1, 1024]
    - [16, 0.0]
  - - [2368, 2368, 1, 1024]
    - [28, 0.0]
  - - [2624, 2368, 1, 1024]
    - [28, 0.0]
  - - [2880, 2368, 1, 1024]
    - [0, 0.0]
  - - [3136, 2368, 1, 1024]
    - [31, 0.0]
  - - [3392, 2368, 1, 1024]
    - [28, 0.0]
  - - [3648, 2368, 1, 1024]
    - [28, 0.0]
  - - [3904, 2368, 1, 1024]
    - [16, 0.0]
  - - [64, 2624, 1, 1024]
    - [0, 0.0]
  - - [320, 2624, 1, 1024]
    - [0, 0.0]
  - - [576, 2624, 1, 1024]
    - [0, 0.0]
  - - [832, 2624, 1, 1024]
    - [28, 0.0]
  - - [1088, 2624, 1, 1024]
    - [16, 0.0]
  - - [1344, 2624, 1, 1024]
    - [16, 0.0]
  - - [1600, 2624, 1, 1024]
    - [31, 0.0]
  - - [1856, 2624, 1, 1024]
    - [0, 0.0]
  - - [2112, 2624, 1, 1024]
    - [16, 0.0]
  - - [2368, 2624, 1, 1024]
    - [16, 0.0]
  - - [2624, 2624, 1, 1024]
    - [16, 0.0]
  - - [2880, 2624, 1, 1024]
    - [28, 0.0]
  - - [3136, 2624, 1, 1024]
    - [28, 0.0]
  - - [3392, 2624, 1, 1024]
    - [28, 0.0]
  - - [3648, 2624, 1, 1024]
    - [0, 0.0]
  - - [3904, 2624, 1, 1024]
    - [0, 0.0]
  - - [64, 2880, 1, 1024]
    - [70, 0.0]
  - - [320, 2880, 1, 1024]
    - [70, 0.0]
  - - [576, 2880, 1, 1024]
    - [70, 0.0]
  - - [832, 2880, 1, 1024]
    - [16, 0.0]
  - - [1088, 2880, 1, 1024]
    - [16, 0.0]
  - - [1344, 2880, 1, 1024]
    - [70, 0.0]
  - - [1600, 2880, 1, 1024]
    - [70, 0.0]
  - - [1856, 2880, 1, 1024]
    - [0, 0.0]
  - - [2112, 2880, 1, 1024]
    - [16, 0.0]
  - - [2368, 2880, 1, 1024]
    - [16, 0.0]
  - - [2624, 2880, 1, 1024]
    - [11, 0.0]
  - - [2880, 2880, 1, 1024]
    - [0, 0.0]
  - - [3136, 2880, 1, 1024]
    - [0, 0.0]
  - - [3392, 2880, 1, 1024]
    - [11, 0.0]
  - - [3648, 2880, 1, 1024]
    - [63, 0.0]
  - - [3904, 2880, 1, 1024]
    - [70, 0.0]
  - - [64, 3136, 1, 1024]
    - [70, 0.0]
  - - [320, 3136, 1, 1024]
    - [70, 0.0]
  - - [576, 3136, 1, 1024]
    - [0, 0.0]
  - - [832, 3136, 1, 1024]
    - [31, 0.0]
  - - [1088, 3136, 1, 1024]
    - [31, 0.0]
  - - [1344, 3136, 1, 1024]
    - [11, 0.0]
  - - [1600, 3136, 1, 1024]
    - [0, 0.0]
  - - [1856, 3136, 1, 1024]
    - [0, 0.0]
  - - [2112, 3136, 1, 1024]
    - [0, 0.0]
  - - [2368, 3136, 1, 1024]
    - [28, 0.0]
  - - [2624, 3136, 1, 1024]
    - [16, 0.0]
  - - [2880, 3136, 1, 1024]
    - [70, 0.0]
  - - [3136, 3136, 1, 1024]
    - [87, 0.0]
  - - [3392, 3136, 1, 1024]
    - [0, 0.0]
  - - [3648, 3136, 1, 1024]
    - [73, 0.0]
  - - [3904, 3136, 1, 1024]
    - [73, 0.0]
  - - [64, 3392, 1, 1024]
    - [70, 0.0]
  - - [320, 3392, 1, 1024]
    - [0, 0.0]
  - - [576, 3392, 1, 1024]
    - [0, 0.0]
  - - [832, 3392, 1, 1024]
    - [0, 0.0]
  - - [1088, 3392, 1, 1024]
    - [0, 0.0]
  - - [1344, 3392, 1, 1024]
    - [70, 0.0]
  - - [1600, 3392, 1, 1024]
    - [31, 0.0]
  - - [1856, 3392, 1, 1024]
    - [16, 0.0]
  - - [2112, 3392, 1, 1024]
    - [16, 0.0]
  - - [2368, 3392, 1, 1024]
    - [11, 0.0]
  - - [2624, 3392, 1, 1024]
    - [0, 0.0]
  - - [2880, 3392, 1, 1024]
    - [0, 0.0]
  - - [3136, 3392, 1, 1024]
    - [77, 0.0]
  - - [3392, 3392, 1, 1024]
    - [83, 0.0]
  - - [3648, 3392, 1, 1024]
    - [87, 0.0]
  - - [3904, 3392, 1, 1024]
    - [74, 0.0]
  - - [64, 3648, 1, 1024]
    - [70, 0.0]
  - - [320, 3648, 1, 1024]
    - [0, 0.0]
  - - [576, 3648, 1, 1024]
    - [70, 0.0]
  - - [832, 3648, 1, 1024]
    - [70, 0.0]
  - - [1088, 3648, 1, 1024]
    - [28, 0.0]
  - - [1344, 3648, 1, 1024]
    - [31, 0.0]
  - - [1600, 3648, 1, 1024]
    - [28, 0.0]
  - - [1856, 3648, 1, 1024]
    - [28, 0.0]
  - - [2112, 3648, 1, 1024]
    - [16, 0.0]
  - - [2368, 3648, 1, 1024]
    - [16, 0.0]
  - - [2624, 3648, 1, 1024]
    - [11, 0.0]
  - - [2880, 3648, 1, 1024]
    - [73, 0.0]
  - - [3136, 3648, 1, 1024]
    - [28, 0.0]
  - - [3392, 3648, 1, 1024]
    - [83, 0.0]
  - - [3648, 3648, 1, 1024]
    - [77, 0.0]
  - - [3904, 3648, 1, 1024]
    - [88, 0.0]
  - - [64, 3904, 1, 1024]
    - [0, 0.0]
  - - [320, 3904, 1, 1024]
    - [70, 0.0]
  - - [576, 3904, 1, 1024]
    - [70, 0.0]
  - - [832, 3904, 1, 1024]
    - [11, 0.0]
  - - [1088, 3904, 1, 1024]
    - [28, 0.0]
  - - [1344, 3904, 1, 1024]
    - [70, 0.0]
  - - [1600, 3904, 1, 1024]
    - [16, 0.0]
  - - [1856, 3904, 1, 1024]
    - [28, 0.0]
  - - [2112, 3904, 1, 1024]
    - [28, 0.0]
  - - [2368, 3904, 1, 1024]
    - [16, 0.0]
  - - [2624, 3904, 1, 1024]
    - [16, 0.0]
  - - [2880, 3904, 1, 1024]
    - [28, 0.0]
  - - [3136, 3904, 1, 1024]
    - [84, 0.0]
  - - [3392, 3904, 1, 1024]
    - [50, 0.0]
  - - [3648, 3904, 1, 1024]
    - [85, 0.0]
  - - [3904, 3904, 1, 1024]
    - [51, 0.0]
  - - [64, 64, 1, 2048]
    - [113, 0.0]
  - - [320, 64, 1, 2048]
    - [256, 0.0]
  - - [576, 64, 1, 2048]
    - [129, 0.0]
  - - [832, 64, 1, 2048]
    - [71, 0.0]
  - - [1088, 64, 1, 2048]
    - [7, 0.0]
  - - [1344, 64, 1, 2048]
    - [68, 0.0]
  - - [1600, 64, 1, 2048]
    - [68, 0.0]
  - - [1856, 64, 1, 2048]
    - [0, 0.0]
  - - [2112, 64, 1, 2048]
    - [0, 0.0]
  - - [2368, 64, 1, 2048]
    - [70, 0.0]
  - - [2624, 64, 1, 2048]
    - [70, 0.0]
  - - [2880, 64, 1, 2048]
    - [0, 0.0]
  - - [3136, 64, 1, 2048]
    - [0, 0.0]
  - - [3392, 64, 1, 2048]
    - [86, 0.0]
  - - [3648, 64, 1, 2048]
    - [0, 0.0]
  - - [3904, 64, 1, 2048]
    - [0, 0.0]
  - - [64, 320, 1, 2048]
    - [123, 0.0]
  - - [320, 320, 1, 2048]
    - [70, 0.0]
  - - [576, 320, 1, 2048]
    - [169, 0.0]
  - - [832, 320, 1, 2048]
    - [173, 0.0]
  - - [1088, 320, 1, 2048]
    - [70, 0.0]
  - - [1344, 320, 1, 2048]
    - [0, 0.0]
  - - [1600, 320, 1, 2048]
    - [72, 0.0]
  - - [1856, 320, 1, 2048]
    - [0, 0.0]
  - - [2112, 320, 1, 2048]
    - [70, 0.0]
  - - [2368, 320, 1, 2048]
    - [16, 0.0]
  - - [2624, 320, 1, 2048]
    - [0, 0.0]
  - - [2880, 320, 1, 2048]
    - [0, 0.0]
  - - [3136, 320, 1, 2048]
    - [70, 0.0]
  - - [3392, 320, 1, 2048]
    - [70, 0.0]
  - - [3648, 320, 1, 2048]
    - [70, 0.0]
  - - [3904, 320, 1, 2048]
    - [86, 0.0]
  - - [64, 576, 1, 2048]
    - [196, 0.0]
  - - [320, 576, 1, 2048]
    - [224, 0.0]
  - - [576, 576, 1, 2048]
    - [70, 0.0]
  - - [832, 576, 1, 2048]
    - [84, 0.0]
  - - [1088, 576, 1, 2048]
    - [0, 0.0]
  - - [1344, 576, 1, 2048]
    - [11, 0.0]
  - - [1600, 576, 1, 2048]
    - [11, 0.0]
  - - [1856, 576, 1, 2048]
    - [0, 0.0]
  - - [2112, 576, 1, 2048]
    - [28, 0.0]
  - - [2368, 576, 1, 2048]
    - [0, 0.0]
  - - [2624, 576, 1, 2048]
    - [0, 0.0]
  - - [2880, 576, 1, 2048]
    - [70, 0.0]
  - - [3136, 576, 1, 2048]
    - [0, 0.0]
  - - [3392, 576, 1, 2048]
    - [0, 0.0]
  - - [3648, 576, 1, 2048]
    - [70, 0.0]
  - - [3904, 576, 1, 2048]
    - [0, 0.0]
  - - [64, 832, 1, 2048]
    - [125, 0.0]
  - - [320, 832, 1, 2048]
    - [198, 0.0]
  - - [576, 832, 1, 2048]
    - [70, 0.0]
  - - [832, 832, 1, 2048]
    - [212, 0.0]
  - - [1088, 832, 1, 2048]
    - [72, 0.0]
  - - [1344, 832, 1, 2048]
    - [28, 0.0]
  - - [1600, 832, 1, 2048]
    - [0, 0.0]
  - - [1856, 832, 1, 2048]
    - [70, 0.0]
  - - [2112, 832, 1, 2048]
    - [70, 0.0]
  - - [2368, 832, 1, 2048]
    - [70, 0.0]
  - - [2624, 832, 1, 2048]
    - [0, 0.0]
  - - [2880, 832, 1, 2048]
    - [70, 0.0]
  - - [3136, 832, 1, 2048]
    - [0, 0.0]
  - - [3392, 832, 1, 2048]
    - [70, 0.0]
  - - [3648, 832, 1, 2048]
    - [0, 0.0]
  - - [3904, 832, 1, 2048]
    - [0, 0.0]
  - - [64, 1088, 1, 2048]
    - [67, 0.0]
  - - [320, 1088, 1, 2048]
    - [0, 0.0]
  - - [576, 1088, 1, 2048]
    - [0, 0.0]
  - - [832, 1088, 1, 2048]
    - [0, 0.0]
  - - [1088, 1088, 1, 2048]
    - [0, 0.0]
  - - [1344, 1088, 1, 2048]
    - [0, 0.0]
  - - [1600, 1088, 1, 2048]
    - [70, 0.0]
  - - [1856, 1088, 1, 2048]
    - [0, 0.0]
  - - [2112, 1088, 1, 2048]
    - [0, 0.0]
  - - [2368, 1088, 1, 2048]
    - [0, 0.0]
  - - [2624, 1088, 1, 2048]
    - [91, 0.0]
  - - [2880, 1088, 1, 2048]
    - [70, 0.0]
  - - [3136, 1088, 1, 2048]
    - [70, 0.0]
  - - [3392, 1088, 1, 2048]
    - [0, 0.0]
  - - [3648, 1088, 1, 2048]
    - [70, 0.0]
  - - [3904, 1088, 1, 2048]
    - [0, 0.0]
  - - [64, 1344, 1, 2048]
    - [23, 0.0]
  - - [320, 1344, 1, 2048]
    - [0, 0.0]
  - - [576, 1344, 1, 2048]
    - [0, 0.0]
  - - [832, 1344, 1, 2048]
    - [16, 0.0]
  - - [1088, 1344, 1, 2048]
    - [0, 0.0]
  - - [1344, 1344, 1, 2048]
    - [0, 0.0]
  - - [1600, 1344, 1, 2048]
    - [0, 0.0]
  - - [1856, 1344, 1, 2048]
    - [0, 0.0]
  - - [2112, 1344, 1, 2048]
    - [70, 0.0]
  - - [2368, 1344, 1, 2048]
    - [0, 0.0]
  - - [2624, 1344, 1, 2048]
    - [70, 0.0]
  - - [2880, 1344, 1, 2048]
    - [70, 0.0]
  - - [3136, 1344, 1, 2048]
    - [70, 0.0]
  - - [3392, 1344, 1, 2048]
    - [72, 0.0]
  - - [3648, 1344, 1, 2048]
    - [73, 0.0]
  - - [3904, 1344, 1, 2048]
    - [72, 0.0]
  - - [64, 1600, 1, 2048]
    - [7, 0.0]
  - - [320, 1600, 1, 2048]
    - [0, 0.0]
  - - [576, 1600, 1, 2048]
    - [70, 0.0]
  - - [832, 1600, 1, 2048]
    - [70, 0.0]
  - - [1088, 1600, 1, 2048]
    - [0, 0.0]
  - - [1344, 1600, 1, 2048]
    - [0, 0.0]
  - - [1600, 1600, 1, 2048]
    - [0, 0.0]
  - - [1856, 1600, 1, 2048]
    - [70, 0.0]
  - - [2112, 1600, 1, 2048]
    - [70, 0.0]
  - - [2368, 1600, 1, 2048]
    - [70, 0.0]
  - - [2624, 1600, 1, 2048]
    - [0, 0.0]
  - - [2880, 1600, 1, 2048]
    - [70, 0.0]
  - - [3136, 1600, 1, 2048]
    - [70, 0.0]
  - - [3392, 1600, 1, 2048]
    - [50, 0.0]
  - - [3648, 1600, 1, 2048]
    - [92, 0.0]
  - - [3904, 1600, 1, 2048]
    - [73, 0.0]
  - - [64, 1856, 1, 2048]
    - [70, 0.0]
  - - [320, 1856, 1, 2048]
    - [70, 0.0]
  - - [576, 1856, 1, 2048]
    - [70, 0.0]
  - - [832, 1856, 1, 2048]
    - [70, 0.0]
  - - [1088, 1856, 1, 2048]
    - [0, 0.0]
  - - [1344, 1856, 1, 2048]
    - [0, 0.0]
  - - [1600, 1856, 1, 2048]
    - [70, 0.0]
  - - [1856, 1856, 1, 2048]
    - [0, 0.0]
  - - [2112, 1856, 1, 2048]
    - [70, 0.0]
  - - [2368, 1856, 1, 2048]
    - [70, 0.0]
  - - [2624, 1856, 1, 2048]
    - [92, 0.0]
  - - [2880, 1856, 1, 2048]
    - [86, 0.0]
  - - [3136, 1856, 1, 2048]
    - [4, 0.0]
  - - [3392, 1856, 1, 2048]
    - [84, 0.0]
  - - [3648, 1856, 1, 2048]
    - [91, 0.0]
  - - [3904, 1856, 1, 2048]
    - [85, 0.0]
  - - [64, 2112, 1, 2048]
    - [0, 0.0]
  - - [320, 2112, 1, 2048]
    - [0, 0.0]
  - - [576, 2112, 1, 2048]
    - [0, 0.0]
  - - [832, 2112, 1, 2048]
    - [0, 0.0]
  - - [1088, 2112, 1, 2048]
    - [0, 0.0]
  - - [1344, 2112, 1, 2048]
    - [0, 0.0]
  - - [1600, 2112, 1, 2048]
    - [72, 0.0]
  - - [1856, 2112, 1, 2048]
    - [0, 0.0]
  - - [2112, 2112, 1, 2048]
    - [70, 0.0]
  - - [2368, 2112, 1, 2048]
    - [0, 0.0]
  - - [2624, 2112, 1, 2048]
    - [0, 0.0]
  - - [2880, 2112, 1, 2048]
    - [0, 0.0]
  - - [3136, 2112, 1, 2048]
    - [4, 0.0]
  - - [3392, 2112, 1, 2048]
    - [70, 0.0]
  - - [3648, 2112, 1, 2048]
    - [91, 0.0]
  - - [3904, 2112, 1, 2048]
    - [4, 0.0]
  - - [64, 2368, 1, 2048]
    - [0, 0.0]
  - - [320, 2368, 1, 2048]
    - [70, 0.0]
  - - [576, 2368, 1, 2048]
    - [70, 0.0]
  - - [832, 2368, 1, 2048]
    - [86, 0.0]
  - - [1088, 2368, 1, 2048]
    - [72, 0.0]
  - - [1344, 2368, 1, 2048]
    - [70, 0.0]
  - - [1600, 2368, 1, 2048]
    - [72, 0.0]
  - - [1856, 2368, 1, 2048]
    - [70, 0.0]
  - - [2112, 2368, 1, 2048]
    - [0, 0.0]
  - - [2368, 2368, 1, 2048]
    - [91, 0.0]
  - - [2624, 2368, 1, 2048]
    - [70, 0.0]
  - - [2880, 2368, 1, 2048]
    - [91, 0.0]
  - - [3136, 2368, 1, 2048]
    - [77, 0.0]
  - - [3392, 2368, 1, 2048]
    - [70, 0.0]
  - - [3648, 2368, 1, 2048]
    - [4, 0.0]
  - - [3904, 2368, 1, 2048]
    - [77, 0.0]
  - - [64, 2624, 1, 2048]
    - [70, 0.0]
  - - [320, 2624, 1, 2048]
    - [0, 0.0]
  - - [576, 2624, 1, 2048]
    - [70, 0.0]
  - - [832, 2624, 1, 2048]
    - [0, 0.0]
  - - [1088, 2624, 1, 2048]
    - [70, 0.0]
  - - [1344, 2624, 1, 2048]
    - [0, 0.0]
  - - [1600, 2624, 1, 2048]
    - [70, 0.0]
  - - [1856, 2624, 1, 2048]
    - [70, 0.0]
  - - [2112, 2624, 1, 2048]
    - [70, 0.0]
  - - [2368, 2624, 1, 2048]
    - [86, 0.0]
  - - [2624, 2624, 1, 2048]
    - [83, 0.0]
  - - [2880, 2624, 1, 2048]
    - [4, 0.0]
  - - [3136, 2624, 1, 2048]
    - [74, 0.0]
  - - [3392, 2624, 1, 2048]
    - [91, 0.0]
  - - [3648, 2624, 1, 2048]
    - [4, 0.0]
  - - [3904, 2624, 1, 2048]
    - [4, 0.0]
  - - [64, 2880, 1, 2048]
    - [72, 0.0]
  - - [320, 2880, 1, 2048]
    - [0, 0.0]
  - - [576, 2880, 1, 2048]
    - [0, 0.0]
  - - [832, 2880, 1, 2048]
    - [70, 0.0]
  - - [1088, 2880, 1, 2048]
    - [0, 0.0]
  - - [1344, 2880, 1, 2048]
    - [72, 0.0]
  - - [1600, 2880, 1, 2048]
    - [70, 0.0]
  - - [1856, 2880, 1, 2048]
    - [0, 0.0]
  - - [2112, 2880, 1, 2048]
    - [70, 0.0]
  - - [2368, 2880, 1, 2048]
    - [4, 0.0]
  - - [2624, 2880, 1, 2048]
    - [72, 0.0]
  - - [2880, 2880, 1, 2048]
    - [91, 0.0]
  - - [3136, 2880, 1, 2048]
    - [91, 0.0]
  - - [3392, 2880, 1, 2048]
    - [91, 0.0]
  - - [3648, 2880, 1, 2048]
    - [91, 0.0]
  - - [3904, 2880, 1, 2048]
    - [70, 0.0]
  - - [64, 3136, 1, 2048]
    - [70, 0.0]
  - - [320, 3136, 1, 2048]
    - [72, 0.0]
  - - [576, 3136, 1, 2048]
    - [86, 0.0]
  - - [832, 3136, 1, 2048]
    - [70, 0.0]
  - - [1088, 3136, 1, 2048]
    - [0, 0.0]
  - - [1344, 3136, 1, 2048]
    - [70, 0.0]
  - - [1600, 3136, 1, 2048]
    - [0, 0.0]
  - - [1856, 3136, 1, 2048]
    - [70, 0.0]
  - - [2112, 3136, 1, 2048]
    - [4, 0.0]
  - - [2368, 3136, 1, 2048]
    - [93, 0.0]
  - - [2624, 3136, 1, 2048]
    - [91, 0.0]
  - - [2880, 3136, 1, 2048]
    - [4, 0.0]
  - - [3136, 3136, 1, 2048]
    - [4, 0.0]
  - - [3392, 3136, 1, 2048]
    - [4, 0.0]
  - - [3648, 3136, 1, 2048]
    - [4, 0.0]
  - - [3904, 3136, 1, 2048]
    - [4, 0.0]
  - - [64, 3392, 1, 2048]
    - [0, 0.0]
  - - [320, 3392, 1, 2048]
    - [0, 0.0]
  - - [576, 3392, 1, 2048]
    - [70, 0.0]
  - - [832, 3392, 1, 2048]
    - [70, 0.0]
  - - [1088, 3392, 1, 2048]
    - [0, 0.0]
  - - [1344, 3392, 1, 2048]
    - [0, 0.0]
  - - [1600, 3392, 1, 2048]
    - [70, 0.0]
  - - [1856, 3392, 1, 2048]
    - [72, 0.0]
  - - [2112, 3392, 1, 2048]
    - [84, 0.0]
  - - [2368, 3392, 1, 2048]
    - [0, 0.0]
  - - [2624, 3392, 1, 2048]
    - [91, 0.0]
  - - [2880, 3392, 1, 2048]
    - [91, 0.0]
  - - [3136, 3392, 1, 2048]
    - [91, 0.0]
  - - [3392, 3392, 1, 2048]
    - [63, 0.0]
  - - [3648, 3392, 1, 2048]
    - [94, 0.0]
  - - [3904, 3392, 1, 2048]
    - [91, 0.0]
  - - [64, 3648, 1, 2048]
    - [70, 0.0]
  - - [320, 3648, 1, 2048]
    - [70, 0.0]
  - - [576, 3648, 1, 2048]
    - [70, 0.0]
  - - [832, 3648, 1, 2048]
    - [0, 0.0]
  - - [1088, 3648, 1, 2048]
    - [86, 0.0]
  - - [1344, 3648, 1, 2048]
    - [77, 0.0]
  - - [1600, 3648, 1, 2048]
    - [4, 0.0]
  - - [1856, 3648, 1, 2048]
    - [91, 0.0]
  - - [2112, 3648, 1, 2048]
    - [91, 0.0]
  - - [2368, 3648, 1, 2048]
    - [91, 0.0]
  - - [2624, 3648, 1, 2048]
    - [4, 0.0]
  - - [2880, 3648, 1, 2048]
    - [91, 0.0]
  - - [3136, 3648, 1, 2048]
    - [91, 0.0]
  - - [3392, 3648, 1, 2048]
    - [91, 0.0]
  - - [3648, 3648, 1, 2048]
    - [4, 0.0]
  - - [3904, 3648, 1, 2048]
    - [94, 0.0]
  - - [64, 3904, 1, 2048]
    - [0, 0.0]
  - - [320, 3904, 1, 2048]
    - [72, 0.0]
  - - [576, 3904, 1, 2048]
    - [0, 0.0]
  - - [832, 3904, 1, 2048]
    - [0, 0.0]
  - - [1088, 3904, 1, 2048]
    - [70, 0.0]
  - - [1344, 3904, 1, 2048]
    - [0, 0.0]
  - - [1600, 3904, 1, 2048]
    - [86, 0.0]
  - - [1856, 3904, 1, 2048]
    - [95, 0.0]
  - - [2112, 3904, 1, 2048]
    - [84, 0.0]
  - - [2368, 3904, 1, 2048]
    - [91, 0.0]
  - - [2624, 3904, 1, 2048]
    - [94, 0.0]
  - - [2880, 3904, 1, 2048]
    - [91, 0.0]
  - - [3136, 3904, 1, 2048]
    - [91, 0.0]
  - - [3392, 3904, 1, 2048]
    - [91, 0.0]
  - - [3648, 3904, 1, 2048]
    - [4, 0.0]
  - - [3904, 3904, 1, 2048]
    - [4, 0.0]
  - - [64, 64, 1, 4096]
    - [129, 0.0]
  - - [320, 64, 1, 4096]
    - [113, 0.0]
  - - [576, 64, 1, 4096]
    - [27, 0.0]
  - - [832, 64, 1, 4096]
    - [129, 0.0]
  - - [1088, 64, 1, 4096]
    - [68, 0.0]
  - - [1344, 64, 1, 4096]
    - [68, 0.0]
  - - [1600, 64, 1, 4096]
    - [7, 0.0]
  - - [1856, 64, 1, 4096]
    - [68, 0.0]
  - - [2112, 64, 1, 4096]
    - [70, 0.0]
  - - [2368, 64, 1, 4096]
    - [70, 0.0]
  - - [2624, 64, 1, 4096]
    - [72, 0.0]
  - - [2880, 64, 1, 4096]
    - [0, 0.0]
  - - [3136, 64, 1, 4096]
    - [70, 0.0]
  - - [3392, 64, 1, 4096]
    - [70, 0.0]
  - - [3648, 64, 1, 4096]
    - [0, 0.0]
  - - [3904, 64, 1, 4096]
    - [0, 0.0]
  - - [64, 320, 1, 4096]
    - [124, 0.0]
  - - [320, 320, 1, 4096]
    - [69, 0.0]
  - - [576, 320, 1, 4096]
    - [169, 0.0]
  - - [832, 320, 1, 4096]
    - [265, 0.0]
  - - [1088, 320, 1, 4096]
    - [70, 0.0]
  - - [1344, 320, 1, 4096]
    - [86, 0.0]
  - - [1600, 320, 1, 4096]
    - [0, 0.0]
  - - [1856, 320, 1, 4096]
    - [70, 0.0]
  - - [2112, 320, 1, 4096]
    - [70, 0.0]
  - - [2368, 320, 1, 4096]
    - [70, 0.0]
  - - [2624, 320, 1, 4096]
    - [70, 0.0]
  - - [2880, 320, 1, 4096]
    - [70, 0.0]
  - - [3136, 320, 1, 4096]
    - [70, 0.0]
  - - [3392, 320, 1, 4096]
    - [70, 0.0]
  - - [3648, 320, 1, 4096]
    - [72, 0.0]
  - - [3904, 320, 1, 4096]
    - [0, 0.0]
  - - [64, 576, 1, 4096]
    - [196, 0.0]
  - - [320, 576, 1, 4096]
    - [181, 0.0]
  - - [576, 576, 1, 4096]
    - [28, 0.0]
  - - [832, 576, 1, 4096]
    - [270, 0.0]
  - - [1088, 576, 1, 4096]
    - [11, 0.0]
  - - [1344, 576, 1, 4096]
    - [70, 0.0]
  - - [1600, 576, 1, 4096]
    - [0, 0.0]
  - - [1856, 576, 1, 4096]
    - [70, 0.0]
  - - [2112, 576, 1, 4096]
    - [98, 0.0]
  - - [2368, 576, 1, 4096]
    - [74, 0.0]
  - - [2624, 576, 1, 4096]
    - [70, 0.0]
  - - [2880, 576, 1, 4096]
    - [86, 0.0]
  - - [3136, 576, 1, 4096]
    - [72, 0.0]
  - - [3392, 576, 1, 4096]
    - [72, 0.0]
  - - [3648, 576, 1, 4096]
    - [0, 0.0]
  - - [3904, 576, 1, 4096]
    - [70, 0.0]
  - - [64, 832, 1, 4096]
    - [125, 0.0]
  - - [320, 832, 1, 4096]
    - [224, 0.0]
  - - [576, 832, 1, 4096]
    - [235, 0.0]
  - - [832, 832, 1, 4096]
    - [236, 0.0]
  - - [1088, 832, 1, 4096]
    - [70, 0.0]
  - - [1344, 832, 1, 4096]
    - [16, 0.0]
  - - [1600, 832, 1, 4096]
    - [70, 0.0]
  - - [1856, 832, 1, 4096]
    - [72, 0.0]
  - - [2112, 832, 1, 4096]
    - [70, 0.0]
  - - [2368, 832, 1, 4096]
    - [0, 0.0]
  - - [2624, 832, 1, 4096]
    - [70, 0.0]
  - - [2880, 832, 1, 4096]
    - [70, 0.0]
  - - [3136, 832, 1, 4096]
    - [70, 0.0]
  - - [3392, 832, 1, 4096]
    - [4, 0.0]
  - - [3648, 832, 1, 4096]
    - [0, 0.0]
  - - [3904, 832, 1, 4096]
    - [70, 0.0]
  - - [64, 1088, 1, 4096]
    - [68, 0.0]
  - - [320, 1088, 1, 4096]
    - [0, 0.0]
  - - [576, 1088, 1, 4096]
    - [0, 0.0]
  - - [832, 1088, 1, 4096]
    - [28, 0.0]
  - - [1088, 1088, 1, 4096]
    - [0, 0.0]
  - - [1344, 1088, 1, 4096]
    - [70, 0.0]
  - - [1600, 1088, 1, 4096]
    - [72, 0.0]
  - - [1856, 1088, 1, 4096]
    - [28, 0.0]
  - - [2112, 1088, 1, 4096]
    - [70, 0.0]
  - - [2368, 1088, 1, 4096]
    - [0, 0.0]
  - - [2624, 1088, 1, 4096]
    - [4, 0.0]
  - - [2880, 1088, 1, 4096]
    - [0, 0.0]
  - - [3136, 1088, 1, 4096]
    - [70, 0.0]
  - - [3392, 1088, 1, 4096]
    - [94, 0.0]
  - - [3648, 1088, 1, 4096]
    - [99, 0.0]
  - - [3904, 1088, 1, 4096]
    - [91, 0.0]
  - - [64, 1344, 1, 4096]
    - [7, 0.0]
  - - [320, 1344, 1, 4096]
    - [70, 0.0]
  - - [576, 1344, 1, 4096]
    - [70, 0.0]
  - - [832, 1344, 1, 4096]
    - [0, 0.0]
  - - [1088, 1344, 1, 4096]
    - [72, 0.0]
  - - [1344, 1344, 1, 4096]
    - [4, 0.0]
  - - [1600, 1344, 1, 4096]
    - [70, 0.0]
  - - [1856, 1344, 1, 4096]
    - [72, 0.0]
  - - [2112, 1344, 1, 4096]
    - [91, 0.0]
  - - [2368, 1344, 1, 4096]
    - [70, 0.0]
  - - [2624, 1344, 1, 4096]
    - [91, 0.0]
  - - [2880, 1344, 1, 4096]
    - [91, 0.0]
  - - [3136, 1344, 1, 4096]
    - [72, 0.0]
  - - [3392, 1344, 1, 4096]
    - [4, 0.0]
  - - [3648, 1344, 1, 4096]
    - [4, 0.0]
  - - [3904, 1344, 1, 4096]
    - [74, 0.0]
  - - [64, 1600, 1, 4096]
    - [7, 0.0]
  - - [320, 1600, 1, 4096]
    - [0, 0.0]
  - - [576, 1600, 1, 4096]
    - [70, 0.0]
  - - [832, 1600, 1, 4096]
    - [72, 0.0]
  - - [1088, 1600, 1, 4096]
    - [16, 0.0]
  - - [1344, 1600, 1, 4096]
    - [0, 0.0]
  - - [1600, 1600, 1, 4096]
    - [70, 0.0]
  - - [1856, 1600, 1, 4096]
    - [0, 0.0]
  - - [2112, 1600, 1, 4096]
    - [0, 0.0]
  - - [2368, 1600, 1, 4096]
    - [91, 0.0]
  - - [2624, 1600, 1, 4096]
    - [77, 0.0]
  - - [2880, 1600, 1, 4096]
    - [91, 0.0]
  - - [3136, 1600, 1, 4096]
    - [0, 0.0]
  - - [3392, 1600, 1, 4096]
    - [95, 0.0]
  - - [3648, 1600, 1, 4096]
    - [4, 0.0]
  - - [3904, 1600, 1, 4096]
    - [4, 0.0]
  - - [64, 1856, 1, 4096]
    - [7, 0.0]
  - - [320, 1856, 1, 4096]
    - [0, 0.0]
  - - [576, 1856, 1, 4096]
    - [0, 0.0]
  - - [832, 1856, 1, 4096]
    - [70, 0.0]
  - - [1088, 1856, 1, 4096]
    - [0, 0.0]
  - - [1344, 1856, 1, 4096]
    - [0, 0.0]
  - - [1600, 1856, 1, 4096]
    - [0, 0.0]
  - - [1856, 1856, 1, 4096]
    - [72, 0.0]
  - - [2112, 1856, 1, 4096]
    - [4, 0.0]
  - - [2368, 1856, 1, 4096]
    - [83, 0.0]
  - - [2624, 1856, 1, 4096]
    - [4, 0.0]
  - - [2880, 1856, 1, 4096]
    - [95, 0.0]
  - - [3136, 1856, 1, 4096]
    - [100, 0.0]
  - - [3392, 1856, 1, 4096]
    - [84, 0.0]
  - - [3648, 1856, 1, 4096]
    - [100, 0.0]
  - - [3904, 1856, 1, 4096]
    - [94, 0.0]
  - - [64, 2112, 1, 4096]
    - [70, 0.0]
  - - [320, 2112, 1, 4096]
    - [97, 0.0]
  - - [576, 2112, 1, 4096]
    - [16, 0.0]
  - - [832, 2112, 1, 4096]
    - [70, 0.0]
  - - [1088, 2112, 1, 4096]
    - [70, 0.0]
  - - [1344, 2112, 1, 4096]
    - [94, 0.0]
  - - [1600, 2112, 1, 4096]
    - [77, 0.0]
  - - [1856, 2112, 1, 4096]
    - [4, 0.0]
  - - [2112, 2112, 1, 4096]
    - [4, 0.0]
  - - [2368, 2112, 1, 4096]
    - [70, 0.0]
  - - [2624, 2112, 1, 4096]
    - [4, 0.0]
  - - [2880, 2112, 1, 4096]
    - [91, 0.0]
  - - [3136, 2112, 1, 4096]
    - [4, 0.0]
  - - [3392, 2112, 1, 4096]
    - [72, 0.0]
  - - [3648, 2112, 1, 4096]
    - [91, 0.0]
  - - [3904, 2112, 1, 4096]
    - [91, 0.0]
  - - [64, 2368, 1, 4096]
    - [70, 0.0]
  - - [320, 2368, 1, 4096]
    - [11, 0.0]
  - - [576, 2368, 1, 4096]
    - [73, 0.0]
  - - [832, 2368, 1, 4096]
    - [0, 0.0]
  - - [1088, 2368, 1, 4096]
    - [0, 0.0]
  - - [1344, 2368, 1, 4096]
    - [0, 0.0]
  - - [1600, 2368, 1, 4096]
    - [100, 0.0]
  - - [1856, 2368, 1, 4096]
    - [73, 0.0]
  - - [2112, 2368, 1, 4096]
    - [70, 0.0]
  - - [2368, 2368, 1, 4096]
    - [4, 0.0]
  - - [2624, 2368, 1, 4096]
    - [91, 0.0]
  - - [2880, 2368, 1, 4096]
    - [91, 0.0]
  - - [3136, 2368, 1, 4096]
    - [4, 0.0]
  - - [3392, 2368, 1, 4096]
    - [4, 0.0]
  - - [3648, 2368, 1, 4096]
    - [91, 0.0]
  - - [3904, 2368, 1, 4096]
    - [94, 0.0]
  - - [64, 2624, 1, 4096]
    - [70, 0.0]
  - - [320, 2624, 1, 4096]
    - [70, 0.0]
  - - [576, 2624, 1, 4096]
    - [0, 0.0]
  - - [832, 2624, 1, 4096]
    - [0, 0.0]
  - - [1088, 2624, 1, 4096]
    - [100, 0.0]
  - - [1344, 2624, 1, 4096]
    - [70, 0.0]
  - - [1600, 2624, 1, 4096]
    - [70, 0.0]
  - - [1856, 2624, 1, 4096]
    - [91, 0.0]
  - - [2112, 2624, 1, 4096]
    - [91, 0.0]
  - - [2368, 2624, 1, 4096]
    - [70, 0.0]
  - - [2624, 2624, 1, 4096]
    - [91, 0.0]
  - - [2880, 2624, 1, 4096]
    - [4, 0.0]
  - - [3136, 2624, 1, 4096]
    - [94, 0.0]
  - - [3392, 2624, 1, 4096]
    - [91, 0.0]
  - - [3648, 2624, 1, 4096]
    - [4, 0.0]
  - - [3904, 2624, 1, 4096]
    - [100, 0.0]
  - - [64, 2880, 1, 4096]
    - [70, 0.0]
  - - [320, 2880, 1, 4096]
    - [72, 0.0]
  - - [576, 2880, 1, 4096]
    - [0, 0.0]
  - - [832, 2880, 1, 4096]
    - [70, 0.0]
  - - [1088, 2880, 1, 4096]
    - [0, 0.0]
  - - [1344, 2880, 1, 4096]
    - [4, 0.0]
  - - [1600, 2880, 1, 4096]
    - [4, 0.0]
  - - [1856, 2880, 1, 4096]
    - [70, 0.0]
  - - [2112, 2880, 1, 4096]
    - [86, 0.0]
  - - [2368, 2880, 1, 4096]
    - [4, 0.0]
  - - [2624, 2880, 1, 4096]
    - [100, 0.0]
  - - [2880, 2880, 1, 4096]
    - [94, 0.0]
  - - [3136, 2880, 1, 4096]
    - [91, 0.0]
  - - [3392, 2880, 1, 4096]
    - [4, 0.0]
  - - [3648, 2880, 1, 4096]
    - [100, 0.0]
  - - [3904, 2880, 1, 4096]
    - [4, 0.0]
  - - [64, 3136, 1, 4096]
    - [70, 0.0]
  - - [320, 3136, 1, 4096]
    - [86, 0.0]
  - - [576, 3136, 1, 4096]
    - [70, 0.0]
  - - [832, 3136, 1, 4096]
    - [70, 0.0]
  - - [1088, 3136, 1, 4096]
    - [72, 0.0]
  - - [1344, 3136, 1, 4096]
    - [70, 0.0]
  - - [1600, 3136, 1, 4096]
    - [70, 0.0]
  - - [1856, 3136, 1, 4096]
    - [100, 0.0]
  - - [2112, 3136, 1, 4096]
    - [4, 0.0]
  - - [2368, 3136, 1, 4096]
    - [91, 0.0]
  - - [2624, 3136, 1, 4096]
    - [91, 0.0]
  - - [2880, 3136, 1, 4096]
    - [91, 0.0]
  - - [3136, 3136, 1, 4096]
    - [94, 0.0]
  - - [3392, 3136, 1, 4096]
    - [4, 0.0]
  - - [3648, 3136, 1, 4096]
    - [94, 0.0]
  - - [3904, 3136, 1, 4096]
    - [94, 0.0]
  - - [64, 3392, 1, 4096]
    - [0, 0.0]
  - - [320, 3392, 1, 4096]
    - [70, 0.0]
  - - [576, 3392, 1, 4096]
    - [0, 0.0]
  - - [832, 3392, 1, 4096]
    - [4, 0.0]
  - - [1088, 3392, 1, 4096]
    - [91, 0.0]
  - - [1344, 3392, 1, 4096]
    - [91, 0.0]
  - - [1600, 3392, 1, 4096]
    - [101, 0.0]
  - - [1856, 3392, 1, 4096]
    - [91, 0.0]
  - - [2112, 3392, 1, 4096]
    - [70, 0.0]
  - - [2368, 3392, 1, 4096]
    - [4, 0.0]
  - - [2624, 3392, 1, 4096]
    - [4, 0.0]
  - - [2880, 3392, 1, 4096]
    - [4, 0.0]
  - - [3136, 3392, 1, 4096]
    - [91, 0.0]
  - - [3392, 3392, 1, 4096]
    - [91, 0.0]
  - - [3648, 3392, 1, 4096]
    - [4, 0.0]
  - - [3904, 3392, 1, 4096]
    - [91, 0.0]
  - - [64, 3648, 1, 4096]
    - [86, 0.0]
  - - [320, 3648, 1, 4096]
    - [0, 0.0]
  - - [576, 3648, 1, 4096]
    - [0, 0.0]
  - - [832, 3648, 1, 4096]
    - [70, 0.0]
  - - [1088, 3648, 1, 4096]
    - [0, 0.0]
  - - [1344, 3648, 1, 4096]
    - [91, 0.0]
  - - [1600, 3648, 1, 4096]
    - [4, 0.0]
  - - [1856, 3648, 1, 4096]
    - [4, 0.0]
  - - [2112, 3648, 1, 4096]
    - [94, 0.0]
  - - [2368, 3648, 1, 4096]
    - [91, 0.0]
  - - [2624, 3648, 1, 4096]
    - [4, 0.0]
  - - [2880, 3648, 1, 4096]
    - [94, 0.0]
  - - [3136, 3648, 1, 4096]
    - [4, 0.0]
  - - [3392, 3648, 1, 4096]
    - [91, 0.0]
  - - [3648, 3648, 1, 4096]
    - [100, 0.0]
  - - [3904, 3648, 1, 4096]
    - [4, 0.0]
  - - [64, 3904, 1, 4096]
    - [70, 0.0]
  - - [320, 3904, 1, 4096]
    - [99, 0.0]
  - - [576, 3904, 1, 4096]
    - [0, 0.0]
  - - [832, 3904, 1, 4096]
    - [86, 0.0]
  - - [1088, 3904, 1, 4096]
    - [70, 0.0]
  - - [1344, 3904, 1, 4096]
    - [0, 0.0]
  - - [1600, 3904, 1, 4096]
    - [83, 0.0]
  - - [1856, 3904, 1, 4096]
    - [91, 0.0]
  - - [2112, 3904, 1, 4096]
    - [70, 0.0]
  - - [2368, 3904, 1, 4096]
    - [4, 0.0]
  - - [2624, 3904, 1, 4096]
    - [100, 0.0]
  - - [2880, 3904, 1, 4096]
    - [100, 0.0]
  - - [3136, 3904, 1, 4096]
    - [94, 0.0]
  - - [3392, 3904, 1, 4096]
    - [100, 0.0]
  - - [3648, 3904, 1, 4096]
    - [94, 0.0]
  - - [3904, 3904, 1, 4096]
    - [4, 0.0]
  - - [192, 64, 1, 64]
    - [136, 0.0]
  - - [448, 64, 1, 64]
    - [139, 0.0]
  - - [704, 64, 1, 64]
    - [142, 0.0]
  - - [960, 64, 1, 64]
    - [108, 0.0]
  - - [1216, 64, 1, 64]
    - [106, 0.0]
  - - [1472, 64, 1, 64]
    - [107, 0.0]
  - - [1728, 64, 1, 64]
    - [21, 0.0]
  - - [1984, 64, 1, 64]
    - [42, 0.0]
  - - [64, 192, 1, 64]
    - [149, 0.0]
  - - [192, 192, 1, 64]
    - [78, 0.0]
  - - [320, 192, 1, 64]
    - [7, 0.0]
  - - [448, 192, 1, 64]
    - [19, 0.0]
  - - [576, 192, 1, 64]
    - [108, 0.0]
  - - [704, 192, 1, 64]
    - [8, 0.0]
  - - [832, 192, 1, 64]
    - [152, 0.0]
  - - [960, 192, 1, 64]
    - [153, 0.0]
  - - [1088, 192, 1, 64]
    - [21, 0.0]
  - - [1216, 192, 1, 64]
    - [110, 0.0]
  - - [1344, 192, 1, 64]
    - [5, 0.0]
  - - [1472, 192, 1, 64]
    - [6, 0.0]
  - - [1600, 192, 1, 64]
    - [9, 0.0]
  - - [1728, 192, 1, 64]
    - [6, 0.0]
  - - [1856, 192, 1, 64]
    - [14, 0.0]
  - - [1984, 192, 1, 64]
    - [28, 0.0]
  - - [192, 320, 1, 64]
    - [163, 0.0]
  - - [448, 320, 1, 64]
    - [22, 0.0]
  - - [704, 320, 1, 64]
    - [7, 0.0]
  - - [960, 320, 1, 64]
    - [165, 0.0]
  - - [1216, 320, 1, 64]
    - [57, 0.0]
  - - [1472, 320, 1, 64]
    - [29, 0.0]
  - - [1728, 320, 1, 64]
    - [57, 0.0]
  - - [1984, 320, 1, 64]
    - [70, 0.0]
  - - [64, 448, 1, 64]
    - [129, 0.0]
  - - [192, 448, 1, 64]
    - [105, 0.0]
  - - [320, 448, 1, 64]
    - [168, 0.0]
  - - [448, 448, 1, 64]
    - [9, 0.0]
  - - [576, 448, 1, 64]
    - [6, 0.0]
  - - [704, 448, 1, 64]
    - [64, 0.0]
  - - [832, 448, 1, 64]
    - [169, 0.0]
  - - [960, 448, 1, 64]
    - [5, 0.0]
  - - [1088, 448, 1, 64]
    - [29, 0.0]
  - - [1216, 448, 1, 64]
    - [58, 0.0]
  - - [1344, 448, 1, 64]
    - [29, 0.0]
  - - [1472, 448, 1, 64]
    - [35, 0.0]
  - - [1600, 448, 1, 64]
    - [40, 0.0]
  - - [1728, 448, 1, 64]
    - [33, 0.0]
  - - [1856, 448, 1, 64]
    - [48, 0.0]
  - - [1984, 448, 1, 64]
    - [11, 0.0]
  - - [192, 576, 1, 64]
    - [12, 0.0]
  - - [448, 576, 1, 64]
    - [29, 0.0]
  - - [704, 576, 1, 64]
    - [68, 0.0]
  - - [960, 576, 1, 64]
    - [108, 0.0]
  - - [1216, 576, 1, 64]
    - [18, 0.0]
  - - [1472, 576, 1, 64]
    - [14, 0.0]
  - - [1728, 576, 1, 64]
    - [14, 0.0]
  - - [1984, 576, 1, 64]
    - [21, 0.0]
  - - [64, 704, 1, 64]
    - [178, 0.0]
  - - [192, 704, 1, 64]
    - [68, 0.0]
  - - [320, 704, 1, 64]
    - [31, 0.0]
  - - [448, 704, 1, 64]
    - [105, 0.0]
  - - [576, 704, 1, 64]
    - [168, 0.0]
  - - [704, 704, 1, 64]
    - [7, 0.0]
  - - [832, 704, 1, 64]
    - [180, 0.0]
  - - [960, 704, 1, 64]
    - [181, 0.0]
  - - [1088, 704, 1, 64]
    - [14, 0.0]
  - - [1216, 704, 1, 64]
    - [15, 0.0]
  - - [1344, 704, 1, 64]
    - [14, 0.0]
  - - [1472, 704, 1, 64]
    - [19, 0.0]
  - - [1600, 704, 1, 64]
    - [14, 0.0]
  - - [1728, 704, 1, 64]
    - [15, 0.0]
  - - [1856, 704, 1, 64]
    - [15, 0.0]
  - - [1984, 704, 1, 64]
    - [5, 0.0]
  - - [192, 832, 1, 64]
    - [189, 0.0]
  - - [448, 832, 1, 64]
    - [17, 0.0]
  - - [704, 832, 1, 64]
    - [108, 0.0]
  - - [960, 832, 1, 64]
    - [110, 0.0]
  - - [1216, 832, 1, 64]
    - [25, 0.0]
  - - [1472, 832, 1, 64]
    - [22, 0.0]
  - - [1728, 832, 1, 64]
    - [37, 0.0]
  - - [1984, 832, 1, 64]
    - [21, 0.0]
  - - [64, 960, 1, 64]
    - [196, 0.0]
  - - [192, 960, 1, 64]
    - [12, 0.0]
  - - [320, 960, 1, 64]
    - [16, 0.0]
  - - [448, 960, 1, 64]
    - [110, 0.0]
  - - [576, 960, 1, 64]
    - [165, 0.0]
  - - [704, 960, 1, 64]
    - [154, 0.0]
  - - [832, 960, 1, 64]
    - [68, 0.0]
  - - [960, 960, 1, 64]
    - [110, 0.0]
  - - [1088, 960, 1, 64]
    - [38, 0.0]
  - - [1216, 960, 1, 64]
    - [115, 0.0]
  - - [1344, 960, 1, 64]
    - [25, 0.0]
  - - [1472, 960, 1, 64]
    - [25, 0.0]
  - - [1600, 960, 1, 64]
    - [33, 0.0]
  - - [1728, 960, 1, 64]
    - [58, 0.0]
  - - [1856, 960, 1, 64]
    - [33, 0.0]
  - - [1984, 960, 1, 64]
    - [32, 0.0]
  - - [192, 1088, 1, 64]
    - [0, 0.0]
  - - [448, 1088, 1, 64]
    - [29, 0.0]
  - - [704, 1088, 1, 64]
    - [38, 0.0]
  - - [960, 1088, 1, 64]
    - [38, 0.0]
  - - [1216, 1088, 1, 64]
    - [35, 0.0]
  - - [1472, 1088, 1, 64]
    - [34, 0.0]
  - - [1728, 1088, 1, 64]
    - [38, 0.0]
  - - [1984, 1088, 1, 64]
    - [46, 0.0]
  - - [64, 1216, 1, 64]
    - [108, 0.0]
  - - [192, 1216, 1, 64]
    - [105, 0.0]
  - - [320, 1216, 1, 64]
    - [9, 0.0]
  - - [448, 1216, 1, 64]
    - [115, 0.0]
  - - [576, 1216, 1, 64]
    - [119, 0.0]
  - - [704, 1216, 1, 64]
    - [48, 0.0]
  - - [832, 1216, 1, 64]
    - [48, 0.0]
  - - [960, 1216, 1, 64]
    - [118, 0.0]
  - - [1088, 1216, 1, 64]
    - [38, 0.0]
  - - [1216, 1216, 1, 64]
    - [46, 0.0]
  - - [1344, 1216, 1, 64]
    - [44, 0.0]
  - - [1472, 1216, 1, 64]
    - [34, 0.0]
  - - [1600, 1216, 1, 64]
    - [36, 0.0]
  - - [1728, 1216, 1, 64]
    - [48, 0.0]
  - - [1856, 1216, 1, 64]
    - [34, 0.0]
  - - [1984, 1216, 1, 64]
    - [48, 0.0]
  - - [192, 1344, 1, 64]
    - [10, 0.0]
  - - [448, 1344, 1, 64]
    - [38, 0.0]
  - - [704, 1344, 1, 64]
    - [115, 0.0]
  - - [960, 1344, 1, 64]
    - [15, 0.0]
  - - [1216, 1344, 1, 64]
    - [119, 0.0]
  - - [1472, 1344, 1, 64]
    - [41, 0.0]
  - - [1728, 1344, 1, 64]
    - [46, 0.0]
  - - [1984, 1344, 1, 64]
    - [22, 0.0]
  - - [64, 1472, 1, 64]
    - [8, 0.0]
  - - [192, 1472, 1, 64]
    - [11, 0.0]
  - - [320, 1472, 1, 64]
    - [9, 0.0]
  - - [448, 1472, 1, 64]
    - [31, 0.0]
  - - [576, 1472, 1, 64]
    - [48, 0.0]
  - - [704, 1472, 1, 64]
    - [41, 0.0]
  - - [832, 1472, 1, 64]
    - [120, 0.0]
  - - [960, 1472, 1, 64]
    - [41, 0.0]
  - - [1088, 1472, 1, 64]
    - [32, 0.0]
  - - [1216, 1472, 1, 64]
    - [45, 0.0]
  - - [1344, 1472, 1, 64]
    - [46, 0.0]
  - - [1472, 1472, 1, 64]
    - [34, 0.0]
  - - [1600, 1472, 1, 64]
    - [39, 0.0]
  - - [1728, 1472, 1, 64]
    - [26, 0.0]
  - - [1856, 1472, 1, 64]
    - [25, 0.0]
  - - [1984, 1472, 1, 64]
    - [22, 0.0]
  - - [192, 1600, 1, 64]
    - [29, 0.0]
  - - [448, 1600, 1, 64]
    - [14, 0.0]
  - - [704, 1600, 1, 64]
    - [15, 0.0]
  - - [960, 1600, 1, 64]
    - [36, 0.0]
  - - [1216, 1600, 1, 64]
    - [115, 0.0]
  - - [1472, 1600, 1, 64]
    - [25, 0.0]
  - - [1728, 1600, 1, 64]
    - [5, 0.0]
  - - [1984, 1600, 1, 64]
    - [38, 0.0]
  - - [64, 1728, 1, 64]
    - [12, 0.0]
  - - [192, 1728, 1, 64]
    - [70, 0.0]
  - - [320, 1728, 1, 64]
    - [115, 0.0]
  - - [448, 1728, 1, 64]
    - [14, 0.0]
  - - [576, 1728, 1, 64]
    - [41, 0.0]
  - - [704, 1728, 1, 64]
    - [115, 0.0]
  - - [832, 1728, 1, 64]
    - [20, 0.0]
  - - [960, 1728, 1, 64]
    - [115, 0.0]
  - - [1088, 1728, 1, 64]
    - [115, 0.0]
  - - [1216, 1728, 1, 64]
    - [39, 0.0]
  - - [1344, 1728, 1, 64]
    - [40, 0.0]
  - - [1472, 1728, 1, 64]
    - [14, 0.0]
  - - [1600, 1728, 1, 64]
    - [22, 0.0]
  - - [1728, 1728, 1, 64]
    - [14, 0.0]
  - - [1856, 1728, 1, 64]
    - [40, 0.0]
  - - [1984, 1728, 1, 64]
    - [5, 0.0]
  - - [192, 1856, 1, 64]
    - [29, 0.0]
  - - [448, 1856, 1, 64]
    - [116, 0.0]
  - - [704, 1856, 1, 64]
    - [26, 0.0]
  - - [960, 1856, 1, 64]
    - [36, 0.0]
  - - [1216, 1856, 1, 64]
    - [40, 0.0]
  - - [1472, 1856, 1, 64]
    - [5, 0.0]
  - - [1728, 1856, 1, 64]
    - [19, 0.0]
  - - [1984, 1856, 1, 64]
    - [22, 0.0]
  - - [64, 1984, 1, 64]
    - [24, 0.0]
  - - [192, 1984, 1, 64]
    - [16, 0.0]
  - - [320, 1984, 1, 64]
    - [122, 0.0]
  - - [448, 1984, 1, 64]
    - [17, 0.0]
  - - [576, 1984, 1, 64]
    - [48, 0.0]
  - - [704, 1984, 1, 64]
    - [19, 0.0]
  - - [832, 1984, 1, 64]
    - [53, 0.0]
  - - [960, 1984, 1, 64]
    - [121, 0.0]
  - - [1088, 1984, 1, 64]
    - [115, 0.0]
  - - [1216, 1984, 1, 64]
    - [22, 0.0]
  - - [1344, 1984, 1, 64]
    - [19, 0.0]
  - - [1472, 1984, 1, 64]
    - [21, 0.0]
  - - [1600, 1984, 1, 64]
    - [43, 0.0]
  - - [1728, 1984, 1, 64]
    - [21, 0.0]
  - - [1856, 1984, 1, 64]
    - [45, 0.0]
  - - [1984, 1984, 1, 64]
    - [26, 0.0]
  - - [192, 64, 1, 256]
    - [178, 0.0]
  - - [448, 64, 1, 256]
    - [129, 0.0]
  - - [704, 64, 1, 256]
    - [27, 0.0]
  - - [960, 64, 1, 256]
    - [203, 0.0]
  - - [1216, 64, 1, 256]
    - [68, 0.0]
  - - [1472, 64, 1, 256]
    - [68, 0.0]
  - - [1728, 64, 1, 256]
    - [7, 0.0]
  - - [1984, 64, 1, 256]
    - [70, 0.0]
  - - [64, 192, 1, 256]
    - [27, 0.0]
  - - [192, 192, 1, 256]
    - [205, 0.0]
  - - [320, 192, 1, 256]
    - [27, 0.0]
  - - [448, 192, 1, 256]
    - [69, 0.0]
  - - [576, 192, 1, 256]
    - [70, 0.0]
  - - [704, 192, 1, 256]
    - [68, 0.0]
  - - [832, 192, 1, 256]
    - [181, 0.0]
  - - [960, 192, 1, 256]
    - [181, 0.0]
  - - [1088, 192, 1, 256]
    - [70, 0.0]
  - - [1216, 192, 1, 256]
    - [0, 0.0]
  - - [1344, 192, 1, 256]
    - [17, 0.0]
  - - [1472, 192, 1, 256]
    - [0, 0.0]
  - - [1600, 192, 1, 256]
    - [70, 0.0]
  - - [1728, 192, 1, 256]
    - [0, 0.0]
  - - [1856, 192, 1, 256]
    - [29, 0.0]
  - - [1984, 192, 1, 256]
    - [11, 0.0]
  - - [192, 320, 1, 256]
    - [125, 0.0]
  - - [448, 320, 1, 256]
    - [7, 0.0]
  - - [704, 320, 1, 256]
    - [169, 0.0]
  - - [960, 320, 1, 256]
    - [5, 0.0]
  - - [1216, 320, 1, 256]
    - [13, 0.0]
  - - [1472, 320, 1, 256]
    - [70, 0.0]
  - - [1728, 320, 1, 256]
    - [70, 0.0]
  - - [1984, 320, 1, 256]
    - [16, 0.0]
  - - [64, 448, 1, 256]
    - [27, 0.0]
  - - [192, 448, 1, 256]
    - [0, 0.0]
  - - [320, 448, 1, 256]
    - [209, 0.0]
  - - [448, 448, 1, 256]
    - [69, 0.0]
  - - [576, 448, 1, 256]
    - [169, 0.0]
  - - [704, 448, 1, 256]
    - [70, 0.0]
  - - [832, 448, 1, 256]
    - [0, 0.0]
  - - [960, 448, 1, 256]
    - [28, 0.0]
  - - [1088, 448, 1, 256]
    - [16, 0.0]
  - - [1216, 448, 1, 256]
    - [70, 0.0]
  - - [1344, 448, 1, 256]
    - [16, 0.0]
  - - [1472, 448, 1, 256]
    - [57, 0.0]
  - - [1600, 448, 1, 256]
    - [16, 0.0]
  - - [1728, 448, 1, 256]
    - [29, 0.0]
  - - [1856, 448, 1, 256]
    - [70, 0.0]
  - - [1984, 448, 1, 256]
    - [11, 0.0]
  - - [192, 576, 1, 256]
    - [70, 0.0]
  - - [448, 576, 1, 256]
    - [0, 0.0]
  - - [704, 576, 1, 256]
    - [186, 0.0]
  - - [960, 576, 1, 256]
    - [212, 0.0]
  - - [1216, 576, 1, 256]
    - [70, 0.0]
  - - [1472, 576, 1, 256]
    - [70, 0.0]
  - - [1728, 576, 1, 256]
    - [0, 0.0]
  - - [1984, 576, 1, 256]
    - [70, 0.0]
  - - [64, 704, 1, 256]
    - [196, 0.0]
  - - [192, 704, 1, 256]
    - [194, 0.0]
  - - [320, 704, 1, 256]
    - [30, 0.0]
  - - [448, 704, 1, 256]
    - [208, 0.0]
  - - [576, 704, 1, 256]
    - [0, 0.0]
  - - [704, 704, 1, 256]
    - [14, 0.0]
  - - [832, 704, 1, 256]
    - [69, 0.0]
  - - [960, 704, 1, 256]
    - [204, 0.0]
  - - [1088, 704, 1, 256]
    - [29, 0.0]
  - - [1216, 704, 1, 256]
    - [70, 0.0]
  - - [1344, 704, 1, 256]
    - [70, 0.0]
  - - [1472, 704, 1, 256]
    - [11, 0.0]
  - - [1600, 704, 1, 256]
    - [0, 0.0]
  - - [1728, 704, 1, 256]
    - [70, 0.0]
  - - [1856, 704, 1, 256]
    - [57, 0.0]
  - - [1984, 704, 1, 256]
    - [70, 0.0]
  - - [192, 832, 1, 256]
    - [204, 0.0]
  - - [448, 832, 1, 256]
    - [31, 0.0]
  - - [704, 832, 1, 256]
    - [204, 0.0]
  - - [960, 832, 1, 256]
    - [212, 0.0]
  - - [1216, 832, 1, 256]
    - [28, 0.0]
  - - [1472, 832, 1, 256]
    - [6, 0.0]
  - - [1728, 832, 1, 256]
    - [70, 0.0]
  - - [1984, 832, 1, 256]
    - [0, 0.0]
  - - [64, 960, 1, 256]
    - [27, 0.0]
  - - [192, 960, 1, 256]
    - [70, 0.0]
  - - [320, 960, 1, 256]
    - [21, 0.0]
  - - [448, 960, 1, 256]
    - [25, 0.0]
  - - [576, 960, 1, 256]
    - [69, 0.0]
  - - [704, 960, 1, 256]
    - [212, 0.0]
  - - [832, 960, 1, 256]
    - [204, 0.0]
  - - [960, 960, 1, 256]
    - [225, 0.0]
  - - [1088, 960, 1, 256]
    - [11, 0.0]
  - - [1216, 960, 1, 256]
    - [0, 0.0]
  - - [1344, 960, 1, 256]
    - [57, 0.0]
  - - [1472, 960, 1, 256]
    - [70, 0.0]
  - - [1600, 960, 1, 256]
    - [16, 0.0]
  - - [1728, 960, 1, 256]
    - [16, 0.0]
  - - [1856, 960, 1, 256]
    - [28, 0.0]
  - - [1984, 960, 1, 256]
    - [0, 0.0]
  - - [192, 1088, 1, 256]
    - [70, 0.0]
  - - [448, 1088, 1, 256]
    - [70, 0.0]
  - - [704, 1088, 1, 256]
    - [11, 0.0]
  - - [960, 1088, 1, 256]
    - [28, 0.0]
  - - [1216, 1088, 1, 256]
    - [0, 0.0]
  - - [1472, 1088, 1, 256]
    - [70, 0.0]
  - - [1728, 1088, 1, 256]
    - [28, 0.0]
  - - [1984, 1088, 1, 256]
    - [16, 0.0]
  - - [64, 1216, 1, 256]
    - [20, 0.0]
  - - [192, 1216, 1, 256]
    - [0, 0.0]
  - - [320, 1216, 1, 256]
    - [0, 0.0]
  - - [448, 1216, 1, 256]
    - [13, 0.0]
  - - [576, 1216, 1, 256]
    - [70, 0.0]
  - - [704, 1216, 1, 256]
    - [70, 0.0]
  - - [832, 1216, 1, 256]
    - [70, 0.0]
  - - [960, 1216, 1, 256]
    - [0, 0.0]
  - - [1088, 1216, 1, 256]
    - [16, 0.0]
  - - [1216, 1216, 1, 256]
    - [6, 0.0]
  - - [1344, 1216, 1, 256]
    - [70, 0.0]
  - - [1472, 1216, 1, 256]
    - [16, 0.0]
  - - [1600, 1216, 1, 256]
    - [70, 0.0]
  - - [1728, 1216, 1, 256]
    - [24, 0.0]
  - - [1856, 1216, 1, 256]
    - [70, 0.0]
  - - [1984, 1216, 1, 256]
    - [70, 0.0]
  - - [192, 1344, 1, 256]
    - [20, 0.0]
  - - [448, 1344, 1, 256]
    - [0, 0.0]
  - - [704, 1344, 1, 256]
    - [29, 0.0]
  - - [960, 1344, 1, 256]
    - [16, 0.0]
  - - [1216, 1344, 1, 256]
    - [16, 0.0]
  - - [1472, 1344, 1, 256]
    - [31, 0.0]
  - - [1728, 1344, 1, 256]
    - [0, 0.0]
  - - [1984, 1344, 1, 256]
    - [28, 0.0]
  - - [64, 1472, 1, 256]
    - [7, 0.0]
  - - [192, 1472, 1, 256]
    - [70, 0.0]
  - - [320, 1472, 1, 256]
    - [70, 0.0]
  - - [448, 1472, 1, 256]
    - [0, 0.0]
  - - [576, 1472, 1, 256]
    - [28, 0.0]
  - - [704, 1472, 1, 256]
    - [28, 0.0]
  - - [832, 1472, 1, 256]
    - [6, 0.0]
  - - [960, 1472, 1, 256]
    - [0, 0.0]
  - - [1088, 1472, 1, 256]
    - [16, 0.0]
  - - [1216, 1472, 1, 256]
    - [6, 0.0]
  - - [1344, 1472, 1, 256]
    - [28, 0.0]
  - - [1472, 1472, 1, 256]
    - [16, 0.0]
  - - [1600, 1472, 1, 256]
    - [70, 0.0]
  - - [1728, 1472, 1, 256]
    - [16, 0.0]
  - - [1856, 1472, 1, 256]
    - [16, 0.0]
  - - [1984, 1472, 1, 256]
    - [28, 0.0]
  - - [192, 1600, 1, 256]
    - [70, 0.0]
  - - [448, 1600, 1, 256]
    - [16, 0.0]
  - - [704, 1600, 1, 256]
    - [16, 0.0]
  - - [960, 1600, 1, 256]
    - [0, 0.0]
  - - [1216, 1600, 1, 256]
    - [16, 0.0]
  - - [1472, 1600, 1, 256]
    - [0, 0.0]
  - - [1728, 1600, 1, 256]
    - [0, 0.0]
  - - [1984, 1600, 1, 256]
    - [28, 0.0]
  - - [64, 1728, 1, 256]
    - [68, 0.0]
  - - [192, 1728, 1, 256]
    - [70, 0.0]
  - - [320, 1728, 1, 256]
    - [16, 0.0]
  - - [448, 1728, 1, 256]
    - [0, 0.0]
  - - [576, 1728, 1, 256]
    - [31, 0.0]
  - - [704, 1728, 1, 256]
    - [0, 0.0]
  - - [832, 1728, 1, 256]
    - [0, 0.0]
  - - [960, 1728, 1, 256]
    - [0, 0.0]
  - - [1088, 1728, 1, 256]
    - [16, 0.0]
  - - [1216, 1728, 1, 256]
    - [0, 0.0]
  - - [1344, 1728, 1, 256]
    - [11, 0.0]
  - - [1472, 1728, 1, 256]
    - [57, 0.0]
  - - [1600, 1728, 1, 256]
    - [16, 0.0]
  - - [1728, 1728, 1, 256]
    - [16, 0.0]
  - - [1856, 1728, 1, 256]
    - [13, 0.0]
  - - [1984, 1728, 1, 256]
    - [0, 0.0]
  - - [192, 1856, 1, 256]
    - [0, 0.0]
  - - [448, 1856, 1, 256]
    - [31, 0.0]
  - - [704, 1856, 1, 256]
    - [16, 0.0]
  - - [960, 1856, 1, 256]
    - [0, 0.0]
  - - [1216, 1856, 1, 256]
    - [70, 0.0]
  - - [1472, 1856, 1, 256]
    - [16, 0.0]
  - - [1728, 1856, 1, 256]
    - [70, 0.0]
  - - [1984, 1856, 1, 256]
    - [0, 0.0]
  - - [64, 1984, 1, 256]
    - [68, 0.0]
  - - [192, 1984, 1, 256]
    - [0, 0.0]
  - - [320, 1984, 1, 256]
    - [0, 0.0]
  - - [448, 1984, 1, 256]
    - [70, 0.0]
  - - [576, 1984, 1, 256]
    - [0, 0.0]
  - - [704, 1984, 1, 256]
    - [0, 0.0]
  - - [832, 1984, 1, 256]
    - [70, 0.0]
  - - [960, 1984, 1, 256]
    - [13, 0.0]
  - - [1088, 1984, 1, 256]
    - [0, 0.0]
  - - [1216, 1984, 1, 256]
    - [16, 0.0]
  - - [1344, 1984, 1, 256]
    - [0, 0.0]
  - - [1472, 1984, 1, 256]
    - [0, 0.0]
  - - [1600, 1984, 1, 256]
    - [16, 0.0]
  - - [1728, 1984, 1, 256]
    - [0, 0.0]
  - - [1856, 1984, 1, 256]
    - [31, 0.0]
  - - [1984, 1984, 1, 256]
    - [16, 0.0]
  - - [192, 64, 1, 512]
    - [113, 0.0]
  - - [448, 64, 1, 512]
    - [203, 0.0]
  - - [704, 64, 1, 512]
    - [129, 0.0]
  - - [960, 64, 1, 512]
    - [129, 0.0]
  - - [1216, 64, 1, 512]
    - [68, 0.0]
  - - [1472, 64, 1, 512]
    - [68, 0.0]
  - - [1728, 64, 1, 512]
    - [7, 0.0]
  - - [1984, 64, 1, 512]
    - [128, 0.0]
  - - [64, 192, 1, 512]
    - [113, 0.0]
  - - [192, 192, 1, 512]
    - [27, 0.0]
  - - [320, 192, 1, 512]
    - [203, 0.0]
  - - [448, 192, 1, 512]
    - [125, 0.0]
  - - [576, 192, 1, 512]
    - [0, 0.0]
  - - [704, 192, 1, 512]
    - [204, 0.0]
  - - [832, 192, 1, 512]
    - [70, 0.0]
  - - [960, 192, 1, 512]
    - [181, 0.0]
  - - [1088, 192, 1, 512]
    - [0, 0.0]
  - - [1216, 192, 1, 512]
    - [70, 0.0]
  - - [1344, 192, 1, 512]
    - [70, 0.0]
  - - [1472, 192, 1, 512]
    - [11, 0.0]
  - - [1600, 192, 1, 512]
    - [70, 0.0]
  - - [1728, 192, 1, 512]
    - [70, 0.0]
  - - [1856, 192, 1, 512]
    - [0, 0.0]
  - - [1984, 192, 1, 512]
    - [70, 0.0]
  - - [192, 320, 1, 512]
    - [196, 0.0]
  - - [448, 320, 1, 512]
    - [69, 0.0]
  - - [704, 320, 1, 512]
    - [69, 0.0]
  - - [960, 320, 1, 512]
    - [28, 0.0]
  - - [1216, 320, 1, 512]
    - [70, 0.0]
  - - [1472, 320, 1, 512]
    - [31, 0.0]
  - - [1728, 320, 1, 512]
    - [13, 0.0]
  - - [1984, 320, 1, 512]
    - [11, 0.0]
  - - [64, 448, 1, 512]
    - [132, 0.0]
  - - [192, 448, 1, 512]
    - [70, 0.0]
  - - [320, 448, 1, 512]
    - [184, 0.0]
  - - [448, 448, 1, 512]
    - [7, 0.0]
  - - [576, 448, 1, 512]
    - [69, 0.0]
  - - [704, 448, 1, 512]
    - [24, 0.0]
  - - [832, 448, 1, 512]
    - [16, 0.0]
  - - [960, 448, 1, 512]
    - [24, 0.0]
  - - [1088, 448, 1, 512]
    - [0, 0.0]
  - - [1216, 448, 1, 512]
    - [13, 0.0]
  - - [1344, 448, 1, 512]
    - [0, 0.0]
  - - [1472, 448, 1, 512]
    - [31, 0.0]
  - - [1600, 448, 1, 512]
    - [11, 0.0]
  - - [1728, 448, 1, 512]
    - [11, 0.0]
  - - [1856, 448, 1, 512]
    - [31, 0.0]
  - - [1984, 448, 1, 512]
    - [6, 0.0]
  - - [192, 576, 1, 512]
    - [69, 0.0]
  - - [448, 576, 1, 512]
    - [169, 0.0]
  - - [704, 576, 1, 512]
    - [16, 0.0]
  - - [960, 576, 1, 512]
    - [204, 0.0]
  - - [1216, 576, 1, 512]
    - [31, 0.0]
  - - [1472, 576, 1, 512]
    - [70, 0.0]
  - - [1728, 576, 1, 512]
    - [13, 0.0]
  - - [1984, 576, 1, 512]
    - [70, 0.0]
  - - [64, 704, 1, 512]
    - [129, 0.0]
  - - [192, 704, 1, 512]
    - [0, 0.0]
  - - [320, 704, 1, 512]
    - [181, 0.0]
  - - [448, 704, 1, 512]
    - [16, 0.0]
  - - [576, 704, 1, 512]
    - [70, 0.0]
  - - [704, 704, 1, 512]
    - [16, 0.0]
  - - [832, 704, 1, 512]
    - [181, 0.0]
  - - [960, 704, 1, 512]
    - [212, 0.0]
  - - [1088, 704, 1, 512]
    - [11, 0.0]
  - - [1216, 704, 1, 512]
    - [98, 0.0]
  - - [1344, 704, 1, 512]
    - [0, 0.0]
  - - [1472, 704, 1, 512]
    - [0, 0.0]
  - - [1600, 704, 1, 512]
    - [31, 0.0]
  - - [1728, 704, 1, 512]
    - [11, 0.0]
  - - [1856, 704, 1, 512]
    - [16, 0.0]
  - - [1984, 704, 1, 512]
    - [70, 0.0]
  - - [192, 832, 1, 512]
    - [0, 0.0]
  - - [448, 832, 1, 512]
    - [0, 0.0]
  - - [704, 832, 1, 512]
    - [212, 0.0]
  - - [960, 832, 1, 512]
    - [204, 0.0]
  - - [1216, 832, 1, 512]
    - [9, 0.0]
  - - [1472, 832, 1, 512]
    - [16, 0.0]
  - - [1728, 832, 1, 512]
    - [70, 0.0]
  - - [1984, 832, 1, 512]
    - [31, 0.0]
  - - [64, 960, 1, 512]
    - [79, 0.0]
  - - [192, 960, 1, 512]
    - [7, 0.0]
  - - [320, 960, 1, 512]
    - [99, 0.0]
  - - [448, 960, 1, 512]
    - [14, 0.0]
  - - [576, 960, 1, 512]
    - [218, 0.0]
  - - [704, 960, 1, 512]
    - [180, 0.0]
  - - [832, 960, 1, 512]
    - [69, 0.0]
  - - [960, 960, 1, 512]
    - [225, 0.0]
  - - [1088, 960, 1, 512]
    - [28, 0.0]
  - - [1216, 960, 1, 512]
    - [70, 0.0]
  - - [1344, 960, 1, 512]
    - [0, 0.0]
  - - [1472, 960, 1, 512]
    - [70, 0.0]
  - - [1600, 960, 1, 512]
    - [11, 0.0]
  - - [1728, 960, 1, 512]
    - [70, 0.0]
  - - [1856, 960, 1, 512]
    - [0, 0.0]
  - - [1984, 960, 1, 512]
    - [70, 0.0]
  - - [192, 1088, 1, 512]
    - [70, 0.0]
  - - [448, 1088, 1, 512]
    - [72, 0.0]
  - - [704, 1088, 1, 512]
    - [130, 0.0]
  - - [960, 1088, 1, 512]
    - [13, 0.0]
  - - [1216, 1088, 1, 512]
    - [70, 0.0]
  - - [1472, 1088, 1, 512]
    - [70, 0.0]
  - - [1728, 1088, 1, 512]
    - [31, 0.0]
  - - [1984, 1088, 1, 512]
    - [28, 0.0]
  - - [64, 1216, 1, 512]
    - [80, 0.0]
  - - [192, 1216, 1, 512]
    - [70, 0.0]
  - - [320, 1216, 1, 512]
    - [0, 0.0]
  - - [448, 1216, 1, 512]
    - [11, 0.0]
  - - [576, 1216, 1, 512]
    - [11, 0.0]
  - - [704, 1216, 1, 512]
    - [24, 0.0]
  - - [832, 1216, 1, 512]
    - [70, 0.0]
  - - [960, 1216, 1, 512]
    - [11, 0.0]
  - - [1088, 1216, 1, 512]
    - [28, 0.0]
  - - [1216, 1216, 1, 512]
    - [70, 0.0]
  - - [1344, 1216, 1, 512]
    - [70, 0.0]
  - - [1472, 1216, 1, 512]
    - [0, 0.0]
  - - [1600, 1216, 1, 512]
    - [70, 0.0]
  - - [1728, 1216, 1, 512]
    - [11, 0.0]
  - - [1856, 1216, 1, 512]
    - [28, 0.0]
  - - [1984, 1216, 1, 512]
    - [0, 0.0]
  - - [192, 1344, 1, 512]
    - [70, 0.0]
  - - [448, 1344, 1, 512]
    - [11, 0.0]
  - - [704, 1344, 1, 512]
    - [11, 0.0]
  - - [960, 1344, 1, 512]
    - [16, 0.0]
  - - [1216, 1344, 1, 512]
    - [11, 0.0]
  - - [1472, 1344, 1, 512]
    - [0, 0.0]
  - - [1728, 1344, 1, 512]
    - [0, 0.0]
  - - [1984, 1344, 1, 512]
    - [0, 0.0]
  - - [64, 1472, 1, 512]
    - [7, 0.0]
  - - [192, 1472, 1, 512]
    - [70, 0.0]
  - - [320, 1472, 1, 512]
    - [11, 0.0]
  - - [448, 1472, 1, 512]
    - [9, 0.0]
  - - [576, 1472, 1, 512]
    - [0, 0.0]
  - - [704, 1472, 1, 512]
    - [70, 0.0]
  - - [832, 1472, 1, 512]
    - [0, 0.0]
  - - [960, 1472, 1, 512]
    - [70, 0.0]
  - - [1088, 1472, 1, 512]
    - [11, 0.0]
  - - [1216, 1472, 1, 512]
    - [28, 0.0]
  - - [1344, 1472, 1, 512]
    - [28, 0.0]
  - - [1472, 1472, 1, 512]
    - [0, 0.0]
  - - [1600, 1472, 1, 512]
    - [16, 0.0]
  - - [1728, 1472, 1, 512]
    - [70, 0.0]
  - - [1856, 1472, 1, 512]
    - [28, 0.0]
  - - [1984, 1472, 1, 512]
    - [28, 0.0]
  - - [192, 1600, 1, 512]
    - [0, 0.0]
  - - [448, 1600, 1, 512]
    - [70, 0.0]
  - - [704, 1600, 1, 512]
    - [11, 0.0]
  - - [960, 1600, 1, 512]
    - [16, 0.0]
  - - [1216, 1600, 1, 512]
    - [70, 0.0]
  - - [1472, 1600, 1, 512]
    - [16, 0.0]
  - - [1728, 1600, 1, 512]
    - [70, 0.0]
  - - [1984, 1600, 1, 512]
    - [0, 0.0]
  - - [64, 1728, 1, 512]
    - [7, 0.0]
  - - [192, 1728, 1, 512]
    - [29, 0.0]
  - - [320, 1728, 1, 512]
    - [11, 0.0]
  - - [448, 1728, 1, 512]
    - [11, 0.0]
  - - [576, 1728, 1, 512]
    - [70, 0.0]
  - - [704, 1728, 1, 512]
    - [28, 0.0]
  - - [832, 1728, 1, 512]
    - [0, 0.0]
  - - [960, 1728, 1, 512]
    - [31, 0.0]
  - - [1088, 1728, 1, 512]
    - [0, 0.0]
  - - [1216, 1728, 1, 512]
    - [70, 0.0]
  - - [1344, 1728, 1, 512]
    - [70, 0.0]
  - - [1472, 1728, 1, 512]
    - [0, 0.0]
  - - [1600, 1728, 1, 512]
    - [28, 0.0]
  - - [1728, 1728, 1, 512]
    - [28, 0.0]
  - - [1856, 1728, 1, 512]
    - [0, 0.0]
  - - [1984, 1728, 1, 512]
    - [70, 0.0]
  - - [192, 1856, 1, 512]
    - [70, 0.0]
  - - [448, 1856, 1, 512]
    - [11, 0.0]
  - - [704, 1856, 1, 512]
    - [16, 0.0]
  - - [960, 1856, 1, 512]
    - [28, 0.0]
  - - [1216, 1856, 1, 512]
    - [0, 0.0]
  - - [1472, 1856, 1, 512]
    - [0, 0.0]
  - - [1728, 1856, 1, 512]
    - [11, 0.0]
  - - [1984, 1856, 1, 512]
    - [11, 0.0]
  - - [64, 1984, 1, 512]
    - [69, 0.0]
  - - [192, 1984, 1, 512]
    - [70, 0.0]
  - - [320, 1984, 1, 512]
    - [31, 0.0]
  - - [448, 1984, 1, 512]
    - [11, 0.0]
  - - [576, 1984, 1, 512]
    - [0, 0.0]
  - - [704, 1984, 1, 512]
    - [0, 0.0]
  - - [832, 1984, 1, 512]
    - [13, 0.0]
  - - [960, 1984, 1, 512]
    - [24, 0.0]
  - - [1088, 1984, 1, 512]
    - [0, 0.0]
  - - [1216, 1984, 1, 512]
    - [28, 0.0]
  - - [1344, 1984, 1, 512]
    - [0, 0.0]
  - - [1472, 1984, 1, 512]
    - [0, 0.0]
  - - [1600, 1984, 1, 512]
    - [28, 0.0]
  - - [1728, 1984, 1, 512]
    - [11, 0.0]
  - - [1856, 1984, 1, 512]
    - [16, 0.0]
  - - [1984, 1984, 1, 512]
    - [11, 0.0]
  - - [192, 64, 1, 1024]
    - [178, 0.0]
  - - [448, 64, 1, 1024]
    - [196, 0.0]
  - - [704, 64, 1, 1024]
    - [203, 0.0]
  - - [960, 64, 1, 1024]
    - [129, 0.0]
  - - [1216, 64, 1, 1024]
    - [70, 0.0]
  - - [1472, 64, 1, 1024]
    - [70, 0.0]
  - - [1728, 64, 1, 1024]
    - [7, 0.0]
  - - [1984, 64, 1, 1024]
    - [68, 0.0]
  - - [64, 192, 1, 1024]
    - [242, 0.0]
  - - [192, 192, 1, 1024]
    - [27, 0.0]
  - - [320, 192, 1, 1024]
    - [183, 0.0]
  - - [448, 192, 1, 1024]
    - [129, 0.0]
  - - [576, 192, 1, 1024]
    - [204, 0.0]
  - - [704, 192, 1, 1024]
    - [0, 0.0]
  - - [832, 192, 1, 1024]
    - [72, 0.0]
  - - [960, 192, 1, 1024]
    - [181, 0.0]
  - - [1088, 192, 1, 1024]
    - [70, 0.0]
  - - [1216, 192, 1, 1024]
    - [70, 0.0]
  - - [1344, 192, 1, 1024]
    - [86, 0.0]
  - - [1472, 192, 1, 1024]
    - [16, 0.0]
  - - [1600, 192, 1, 1024]
    - [72, 0.0]
  - - [1728, 192, 1, 1024]
    - [70, 0.0]
  - - [1856, 192, 1, 1024]
    - [70, 0.0]
  - - [1984, 192, 1, 1024]
    - [70, 0.0]
  - - [192, 320, 1, 1024]
    - [129, 0.0]
  - - [448, 320, 1, 1024]
    - [0, 0.0]
  - - [704, 320, 1, 1024]
    - [30, 0.0]
  - - [960, 320, 1, 1024]
    - [173, 0.0]
  - - [1216, 320, 1, 1024]
    - [0, 0.0]
  - - [1472, 320, 1, 1024]
    - [16, 0.0]
  - - [1728, 320, 1, 1024]
    - [11, 0.0]
  - - [1984, 320, 1, 1024]
    - [11, 0.0]
  - - [64, 448, 1, 1024]
    - [27, 0.0]
  - - [192, 448, 1, 1024]
    - [70, 0.0]
  - - [320, 448, 1, 1024]
    - [70, 0.0]
  - - [448, 448, 1, 1024]
    - [7, 0.0]
  - - [576, 448, 1, 1024]
    - [70, 0.0]
  - - [704, 448, 1, 1024]
    - [148, 0.0]
  - - [832, 448, 1, 1024]
    - [28, 0.0]
  - - [960, 448, 1, 1024]
    - [247, 0.0]
  - - [1088, 448, 1, 1024]
    - [0, 0.0]
  - - [1216, 448, 1, 1024]
    - [31, 0.0]
  - - [1344, 448, 1, 1024]
    - [0, 0.0]
  - - [1472, 448, 1, 1024]
    - [31, 0.0]
  - - [1600, 448, 1, 1024]
    - [70, 0.0]
  - - [1728, 448, 1, 1024]
    - [70, 0.0]
  - - [1856, 448, 1, 1024]
    - [0, 0.0]
  - - [1984, 448, 1, 1024]
    - [0, 0.0]
  - - [192, 576, 1, 1024]
    - [204, 0.0]
  - - [448, 576, 1, 1024]
    - [7, 0.0]
  - - [704, 576, 1, 1024]
    - [6, 0.0]
  - - [960, 576, 1, 1024]
    - [68, 0.0]
  - - [1216, 576, 1, 1024]
    - [70, 0.0]
  - - [1472, 576, 1, 1024]
    - [70, 0.0]
  - - [1728, 576, 1, 1024]
    - [0, 0.0]
  - - [1984, 576, 1, 1024]
    - [70, 0.0]
  - - [64, 704, 1, 1024]
    - [206, 0.0]
  - - [192, 704, 1, 1024]
    - [70, 0.0]
  - - [320, 704, 1, 1024]
    - [169, 0.0]
  - - [448, 704, 1, 1024]
    - [6, 0.0]
  - - [576, 704, 1, 1024]
    - [57, 0.0]
  - - [704, 704, 1, 1024]
    - [57, 0.0]
  - - [832, 704, 1, 1024]
    - [169, 0.0]
  - - [960, 704, 1, 1024]
    - [212, 0.0]
  - - [1088, 704, 1, 1024]
    - [70, 0.0]
  - - [1216, 704, 1, 1024]
    - [0, 0.0]
  - - [1344, 704, 1, 1024]
    - [11, 0.0]
  - - [1472, 704, 1, 1024]
    - [70, 0.0]
  - - [1600, 704, 1, 1024]
    - [70, 0.0]
  - - [1728, 704, 1, 1024]
    - [16, 0.0]
  - - [1856, 704, 1, 1024]
    - [28, 0.0]
  - - [1984, 704, 1, 1024]
    - [0, 0.0]
  - - [192, 832, 1, 1024]
    - [169, 0.0]
  - - [448, 832, 1, 1024]
    - [11, 0.0]
  - - [704, 832, 1, 1024]
    - [47, 0.0]
  - - [960, 832, 1, 1024]
    - [236, 0.0]
  - - [1216, 832, 1, 1024]
    - [0, 0.0]
  - - [1472, 832, 1, 1024]
    - [0, 0.0]
  - - [1728, 832, 1, 1024]
    - [70, 0.0]
  - - [1984, 832, 1, 1024]
    - [0, 0.0]
  - - [64, 960, 1, 1024]
    - [183, 0.0]
  - - [192, 960, 1, 1024]
    - [169, 0.0]
  - - [320, 960, 1, 1024]
    - [0, 0.0]
  - - [448, 960, 1, 1024]
    - [247, 0.0]
  - - [576, 960, 1, 1024]
    - [68, 0.0]
  - - [704, 960, 1, 1024]
    - [69, 0.0]
  - - [832, 960, 1, 1024]
    - [253, 0.0]
  - - [960, 960, 1, 1024]
    - [169, 0.0]
  - - [1088, 960, 1, 1024]
    - [70, 0.0]
  - - [1216, 960, 1, 1024]
    - [70, 0.0]
  - - [1344, 960, 1, 1024]
    - [0, 0.0]
  - - [1472, 960, 1, 1024]
    - [0, 0.0]
  - - [1600, 960, 1, 1024]
    - [0, 0.0]
  - - [1728, 960, 1, 1024]
    - [11, 0.0]
  - - [1856, 960, 1, 1024]
    - [70, 0.0]
  - - [1984, 960, 1, 1024]
    - [0, 0.0]
  - - [192, 1088, 1, 1024]
    - [70, 0.0]
  - - [448, 1088, 1, 1024]
    - [70, 0.0]
  - - [704, 1088, 1, 1024]
    - [70, 0.0]
  - - [960, 1088, 1, 1024]
    - [0, 0.0]
  - - [1216, 1088, 1, 1024]
    - [0, 0.0]
  - - [1472, 1088, 1, 1024]
    - [11, 0.0]
  - - [1728, 1088, 1, 1024]
    - [0, 0.0]
  - - [1984, 1088, 1, 1024]
    - [0, 0.0]
  - - [64, 1216, 1, 1024]
    - [81, 0.0]
  - - [192, 1216, 1, 1024]
    - [70, 0.0]
  - - [320, 1216, 1, 1024]
    - [0, 0.0]
  - - [448, 1216, 1, 1024]
    - [11, 0.0]
  - - [576, 1216, 1, 1024]
    - [70, 0.0]
  - - [704, 1216, 1, 1024]
    - [70, 0.0]
  - - [832, 1216, 1, 1024]
    - [0, 0.0]
  - - [960, 1216, 1, 1024]
    - [0, 0.0]
  - - [1088, 1216, 1, 1024]
    - [28, 0.0]
  - - [1216, 1216, 1, 1024]
    - [70, 0.0]
  - - [1344, 1216, 1, 1024]
    - [28, 0.0]
  - - [1472, 1216, 1, 1024]
    - [70, 0.0]
  - - [1600, 1216, 1, 1024]
    - [16, 0.0]
  - - [1728, 1216, 1, 1024]
    - [70, 0.0]
  - - [1856, 1216, 1, 1024]
    - [0, 0.0]
  - - [1984, 1216, 1, 1024]
    - [16, 0.0]
  - - [192, 1344, 1, 1024]
    - [70, 0.0]
  - - [448, 1344, 1, 1024]
    - [31, 0.0]
  - - [704, 1344, 1, 1024]
    - [0, 0.0]
  - - [960, 1344, 1, 1024]
    - [28, 0.0]
  - - [1216, 1344, 1, 1024]
    - [0, 0.0]
  - - [1472, 1344, 1, 1024]
    - [28, 0.0]
  - - [1728, 1344, 1, 1024]
    - [28, 0.0]
  - - [1984, 1344, 1, 1024]
    - [28, 0.0]
  - - [64, 1472, 1, 1024]
    - [68, 0.0]
  - - [192, 1472, 1, 1024]
    - [0, 0.0]
  - - [320, 1472, 1, 1024]
    - [0, 0.0]
  - - [448, 1472, 1, 1024]
    - [0, 0.0]
  - - [576, 1472, 1, 1024]
    - [16, 0.0]
  - - [704, 1472, 1, 1024]
    - [0, 0.0]
  - - [832, 1472, 1, 1024]
    - [70, 0.0]
  - - [960, 1472, 1, 1024]
    - [70, 0.0]
  - - [1088, 1472, 1, 1024]
    - [0, 0.0]
  - - [1216, 1472, 1, 1024]
    - [16, 0.0]
  - - [1344, 1472, 1, 1024]
    - [0, 0.0]
  - - [1472, 1472, 1, 1024]
    - [70, 0.0]
  - - [1600, 1472, 1, 1024]
    - [99, 0.0]
  - - [1728, 1472, 1, 1024]
    - [0, 0.0]
  - - [1856, 1472, 1, 1024]
    - [0, 0.0]
  - - [1984, 1472, 1, 1024]
    - [0, 0.0]
  - - [192, 1600, 1, 1024]
    - [0, 0.0]
  - - [448, 1600, 1, 1024]
    - [11, 0.0]
  - - [704, 1600, 1, 1024]
    - [70, 0.0]
  - - [960, 1600, 1, 1024]
    - [70, 0.0]
  - - [1216, 1600, 1, 1024]
    - [0, 0.0]
  - - [1472, 1600, 1, 1024]
    - [0, 0.0]
  - - [1728, 1600, 1, 1024]
    - [0, 0.0]
  - - [1984, 1600, 1, 1024]
    - [0, 0.0]
  - - [64, 1728, 1, 1024]
    - [7, 0.0]
  - - [192, 1728, 1, 1024]
    - [70, 0.0]
  - - [320, 1728, 1, 1024]
    - [29, 0.0]
  - - [448, 1728, 1, 1024]
    - [70, 0.0]
  - - [576, 1728, 1, 1024]
    - [0, 0.0]
  - - [704, 1728, 1, 1024]
    - [0, 0.0]
  - - [832, 1728, 1, 1024]
    - [0, 0.0]
  - - [960, 1728, 1, 1024]
    - [0, 0.0]
  - - [1088, 1728, 1, 1024]
    - [0, 0.0]
  - - [1216, 1728, 1, 1024]
    - [70, 0.0]
  - - [1344, 1728, 1, 1024]
    - [70, 0.0]
  - - [1472, 1728, 1, 1024]
    - [70, 0.0]
  - - [1600, 1728, 1, 1024]
    - [28, 0.0]
  - - [1728, 1728, 1, 1024]
    - [11, 0.0]
  - - [1856, 1728, 1, 1024]
    - [0, 0.0]
  - - [1984, 1728, 1, 1024]
    - [28, 0.0]
  - - [192, 1856, 1, 1024]
    - [0, 0.0]
  - - [448, 1856, 1, 1024]
    - [11, 0.0]
  - - [704, 1856, 1, 1024]
    - [70, 0.0]
  - - [960, 1856, 1, 1024]
    - [28, 0.0]
  - - [1216, 1856, 1, 1024]
    - [28, 0.0]
  - - [1472, 1856, 1, 1024]
    - [0, 0.0]
  - - [1728, 1856, 1, 1024]
    - [70, 0.0]
  - - [1984, 1856, 1, 1024]
    - [28, 0.0]
  - - [64, 1984, 1, 1024]
    - [7, 0.0]
  - - [192, 1984, 1, 1024]
    - [0, 0.0]
  - - [320, 1984, 1, 1024]
    - [11, 0.0]
  - - [448, 1984, 1, 1024]
    - [0, 0.0]
  - - [576, 1984, 1, 1024]
    - [0, 0.0]
  - - [704, 1984, 1, 1024]
    - [0, 0.0]
  - - [832, 1984, 1, 1024]
    - [70, 0.0]
  - - [960, 1984, 1, 1024]
    - [70, 0.0]
  - - [1088, 1984, 1, 1024]
    - [28, 0.0]
  - - [1216, 1984, 1, 1024]
    - [0, 0.0]
  - - [1344, 1984, 1, 1024]
    - [28, 0.0]
  - - [1472, 1984, 1, 1024]
    - [11, 0.0]
  - - [1600, 1984, 1, 1024]
    - [70, 0.0]
  - - [1728, 1984, 1, 1024]
    - [28, 0.0]
  - - [1856, 1984, 1, 1024]
    - [11, 0.0]
  - - [1984, 1984, 1, 1024]
    - [28, 0.0]
  - - [192, 64, 1, 2048]
    - [102, 0.0]
  - - [448, 64, 1, 2048]
    - [203, 0.0]
  - - [704, 64, 1, 2048]
    - [27, 0.0]
  - - [960, 64, 1, 2048]
    - [129, 0.0]
  - - [1216, 64, 1, 2048]
    - [0, 0.0]
  - - [1472, 64, 1, 2048]
    - [0, 0.0]
  - - [1728, 64, 1, 2048]
    - [0, 0.0]
  - - [1984, 64, 1, 2048]
    - [7, 0.0]
  - - [64, 192, 1, 2048]
    - [113, 0.0]
  - - [192, 192, 1, 2048]
    - [196, 0.0]
  - - [320, 192, 1, 2048]
    - [129, 0.0]
  - - [448, 192, 1, 2048]
    - [253, 0.0]
  - - [576, 192, 1, 2048]
    - [0, 0.0]
  - - [704, 192, 1, 2048]
    - [253, 0.0]
  - - [832, 192, 1, 2048]
    - [69, 0.0]
  - - [960, 192, 1, 2048]
    - [7, 0.0]
  - - [1088, 192, 1, 2048]
    - [0, 0.0]
  - - [1216, 192, 1, 2048]
    - [0, 0.0]
  - - [1344, 192, 1, 2048]
    - [0, 0.0]
  - - [1472, 192, 1, 2048]
    - [70, 0.0]
  - - [1600, 192, 1, 2048]
    - [70, 0.0]
  - - [1728, 192, 1, 2048]
    - [0, 0.0]
  - - [1856, 192, 1, 2048]
    - [72, 0.0]
  - - [1984, 192, 1, 2048]
    - [0, 0.0]
  - - [192, 320, 1, 2048]
    - [158, 0.0]
  - - [448, 320, 1, 2048]
    - [0, 0.0]
  - - [704, 320, 1, 2048]
    - [169, 0.0]
  - - [960, 320, 1, 2048]
    - [28, 0.0]
  - - [1216, 320, 1, 2048]
    - [70, 0.0]
  - - [1472, 320, 1, 2048]
    - [0, 0.0]
  - - [1728, 320, 1, 2048]
    - [0, 0.0]
  - - [1984, 320, 1, 2048]
    - [70, 0.0]
  - - [64, 448, 1, 2048]
    - [129, 0.0]
  - - [192, 448, 1, 2048]
    - [69, 0.0]
  - - [320, 448, 1, 2048]
    - [204, 0.0]
  - - [448, 448, 1, 2048]
    - [68, 0.0]
  - - [576, 448, 1, 2048]
    - [0, 0.0]
  - - [704, 448, 1, 2048]
    - [16, 0.0]
  - - [832, 448, 1, 2048]
    - [0, 0.0]
  - - [960, 448, 1, 2048]
    - [210, 0.0]
  - - [1088, 448, 1, 2048]
    - [0, 0.0]
  - - [1216, 448, 1, 2048]
    - [70, 0.0]
  - - [1344, 448, 1, 2048]
    - [0, 0.0]
  - - [1472, 448, 1, 2048]
    - [70, 0.0]
  - - [1600, 448, 1, 2048]
    - [0, 0.0]
  - - [1728, 448, 1, 2048]
    - [0, 0.0]
  - - [1856, 448, 1, 2048]
    - [0, 0.0]
  - - [1984, 448, 1, 2048]
    - [70, 0.0]
  - - [192, 576, 1, 2048]
    - [204, 0.0]
  - - [448, 576, 1, 2048]
    - [68, 0.0]
  - - [704, 576, 1, 2048]
    - [98, 0.0]
  - - [960, 576, 1, 2048]
    - [47, 0.0]
  - - [1216, 576, 1, 2048]
    - [70, 0.0]
  - - [1472, 576, 1, 2048]
    - [11, 0.0]
  - - [1728, 576, 1, 2048]
    - [70, 0.0]
  - - [1984, 576, 1, 2048]
    - [70, 0.0]
  - - [64, 704, 1, 2048]
    - [196, 0.0]
  - - [192, 704, 1, 2048]
    - [204, 0.0]
  - - [320, 704, 1, 2048]
    - [169, 0.0]
  - - [448, 704, 1, 2048]
    - [258, 0.0]
  - - [576, 704, 1, 2048]
    - [99, 0.0]
  - - [704, 704, 1, 2048]
    - [28, 0.0]
  - - [832, 704, 1, 2048]
    - [47, 0.0]
  - - [960, 704, 1, 2048]
    - [262, 0.0]
  - - [1088, 704, 1, 2048]
    - [0, 0.0]
  - - [1216, 704, 1, 2048]
    - [0, 0.0]
  - - [1344, 704, 1, 2048]
    - [70, 0.0]
  - - [1472, 704, 1, 2048]
    - [70, 0.0]
  - - [1600, 704, 1, 2048]
    - [0, 0.0]
  - - [1728, 704, 1, 2048]
    - [0, 0.0]
  - - [1856, 704, 1, 2048]
    - [28, 0.0]
  - - [1984, 704, 1, 2048]
    - [0, 0.0]
  - - [192, 832, 1, 2048]
    - [68, 0.0]
  - - [448, 832, 1, 2048]
    - [0, 0.0]
  - - [704, 832, 1, 2048]
    - [47, 0.0]
  - - [960, 832, 1, 2048]
    - [212, 0.0]
  - - [1216, 832, 1, 2048]
    - [70, 0.0]
  - - [1472, 832, 1, 2048]
    - [86, 0.0]
  - - [1728, 832, 1, 2048]
    - [0, 0.0]
  - - [1984, 832, 1, 2048]
    - [0, 0.0]
  - - [64, 960, 1, 2048]
    - [129, 0.0]
  - - [192, 960, 1, 2048]
    - [68, 0.0]
  - - [320, 960, 1, 2048]
    - [208, 0.0]
  - - [448, 960, 1, 2048]
    - [14, 0.0]
  - - [576, 960, 1, 2048]
    - [30, 0.0]
  - - [704, 960, 1, 2048]
    - [212, 0.0]
  - - [832, 960, 1, 2048]
    - [112, 0.0]
  - - [960, 960, 1, 2048]
    - [169, 0.0]
  - - [1088, 960, 1, 2048]
    - [0, 0.0]
  - - [1216, 960, 1, 2048]
    - [0, 0.0]
  - - [1344, 960, 1, 2048]
    - [70, 0.0]
  - - [1472, 960, 1, 2048]
    - [0, 0.0]
  - - [1600, 960, 1, 2048]
    - [0, 0.0]
  - - [1728, 960, 1, 2048]
    - [0, 0.0]
  - - [1856, 960, 1, 2048]
    - [86, 0.0]
  - - [1984, 960, 1, 2048]
    - [0, 0.0]
  - - [192, 1088, 1, 2048]
    - [0, 0.0]
  - - [448, 1088, 1, 2048]
    - [0, 0.0]
  - - [704, 1088, 1, 2048]
    - [70, 0.0]
  - - [960, 1088, 1, 2048]
    - [28, 0.0]
  - - [1216, 1088, 1, 2048]
    - [72, 0.0]
  - - [1472, 1088, 1, 2048]
    - [0, 0.0]
  - - [1728, 1088, 1, 2048]
    - [0, 0.0]
  - - [1984, 1088, 1, 2048]
    - [0, 0.0]
  - - [64, 1216, 1, 2048]
    - [82, 0.0]
  - - [192, 1216, 1, 2048]
    - [70, 0.0]
  - - [320, 1216, 1, 2048]
    - [0, 0.0]
  - - [448, 1216, 1, 2048]
    - [0, 0.0]
  - - [576, 1216, 1, 2048]
    - [11, 0.0]
  - - [704, 1216, 1, 2048]
    - [0, 0.0]
  - - [832, 1216, 1, 2048]
    - [70, 0.0]
  - - [960, 1216, 1, 2048]
    - [99, 0.0]
  - - [1088, 1216, 1, 2048]
    - [70, 0.0]
  - - [1216, 1216, 1, 2048]
    - [70, 0.0]
  - - [1344, 1216, 1, 2048]
    - [0, 0.0]
  - - [1472, 1216, 1, 2048]
    - [70, 0.0]
  - - [1600, 1216, 1, 2048]
    - [86, 0.0]
  - - [1728, 1216, 1, 2048]
    - [0, 0.0]
  - - [1856, 1216, 1, 2048]
    - [70, 0.0]
  - - [1984, 1216, 1, 2048]
    - [70, 0.0]
  - - [192, 1344, 1, 2048]
    - [0, 0.0]
  - - [448, 1344, 1, 2048]
    - [0, 0.0]
  - - [704, 1344, 1, 2048]
    - [70, 0.0]
  - - [960, 1344, 1, 2048]
    - [28, 0.0]
  - - [1216, 1344, 1, 2048]
    - [0, 0.0]
  - - [1472, 1344, 1, 2048]
    - [70, 0.0]
  - - [1728, 1344, 1, 2048]
    - [0, 0.0]
  - - [1984, 1344, 1, 2048]
    - [86, 0.0]
  - - [64, 1472, 1, 2048]
    - [70, 0.0]
  - - [192, 1472, 1, 2048]
    - [0, 0.0]
  - - [320, 1472, 1, 2048]
    - [70, 0.0]
  - - [448, 1472, 1, 2048]
    - [0, 0.0]
  - - [576, 1472, 1, 2048]
    - [0, 0.0]
  - - [704, 1472, 1, 2048]
    - [70, 0.0]
  - - [832, 1472, 1, 2048]
    - [70, 0.0]
  - - [960, 1472, 1, 2048]
    - [0, 0.0]
  - - [1088, 1472, 1, 2048]
    - [70, 0.0]
  - - [1216, 1472, 1, 2048]
    - [0, 0.0]
  - - [1344, 1472, 1, 2048]
    - [0, 0.0]
  - - [1472, 1472, 1, 2048]
    - [70, 0.0]
  - - [1600, 1472, 1, 2048]
    - [72, 0.0]
  - - [1728, 1472, 1, 2048]
    - [70, 0.0]
  - - [1856, 1472, 1, 2048]
    - [0, 0.0]
  - - [1984, 1472, 1, 2048]
    - [0, 0.0]
  - - [192, 1600, 1, 2048]
    - [70, 0.0]
  - - [448, 1600, 1, 2048]
    - [11, 0.0]
  - - [704, 1600, 1, 2048]
    - [0, 0.0]
  - - [960, 1600, 1, 2048]
    - [70, 0.0]
  - - [1216, 1600, 1, 2048]
    - [70, 0.0]
  - - [1472, 1600, 1, 2048]
    - [70, 0.0]
  - - [1728, 1600, 1, 2048]
    - [0, 0.0]
  - - [1984, 1600, 1, 2048]
    - [70, 0.0]
  - - [64, 1728, 1, 2048]
    - [68, 0.0]
  - - [192, 1728, 1, 2048]
    - [70, 0.0]
  - - [320, 1728, 1, 2048]
    - [0, 0.0]
  - - [448, 1728, 1, 2048]
    - [70, 0.0]
  - - [576, 1728, 1, 2048]
    - [70, 0.0]
  - - [704, 1728, 1, 2048]
    - [0, 0.0]
  - - [832, 1728, 1, 2048]
    - [70, 0.0]
  - - [960, 1728, 1, 2048]
    - [70, 0.0]
  - - [1088, 1728, 1, 2048]
    - [92, 0.0]
  - - [1216, 1728, 1, 2048]
    - [0, 0.0]
  - - [1344, 1728, 1, 2048]
    - [70, 0.0]
  - - [1472, 1728, 1, 2048]
    - [0, 0.0]
  - - [1600, 1728, 1, 2048]
    - [70, 0.0]
  - - [1728, 1728, 1, 2048]
    - [70, 0.0]
  - - [1856, 1728, 1, 2048]
    - [70, 0.0]
  - - [1984, 1728, 1, 2048]
    - [70, 0.0]
  - - [192, 1856, 1, 2048]
    - [0, 0.0]
  - - [448, 1856, 1, 2048]
    - [70, 0.0]
  - - [704, 1856, 1, 2048]
    - [16, 0.0]
  - - [960, 1856, 1, 2048]
    - [0, 0.0]
  - - [1216, 1856, 1, 2048]
    - [0, 0.0]
  - - [1472, 1856, 1, 2048]
    - [72, 0.0]
  - - [1728, 1856, 1, 2048]
    - [70, 0.0]
  - - [1984, 1856, 1, 2048]
    - [0, 0.0]
  - - [64, 1984, 1, 2048]
    - [7, 0.0]
  - - [192, 1984, 1, 2048]
    - [72, 0.0]
  - - [320, 1984, 1, 2048]
    - [0, 0.0]
  - - [448, 1984, 1, 2048]
    - [70, 0.0]
  - - [576, 1984, 1, 2048]
    - [70, 0.0]
  - - [704, 1984, 1, 2048]
    - [86, 0.0]
  - - [832, 1984, 1, 2048]
    - [86, 0.0]
  - - [960, 1984, 1, 2048]
    - [70, 0.0]
  - - [1088, 1984, 1, 2048]
    - [70, 0.0]
  - - [1216, 1984, 1, 2048]
    - [0, 0.0]
  - - [1344, 1984, 1, 2048]
    - [70, 0.0]
  - - [1472, 1984, 1, 2048]
    - [0, 0.0]
  - - [1600, 1984, 1, 2048]
    - [70, 0.0]
  - - [1728, 1984, 1, 2048]
    - [0, 0.0]
  - - [1856, 1984, 1, 2048]
    - [0, 0.0]
  - - [1984, 1984, 1, 2048]
    - [0, 0.0]
  - - [192, 64, 1, 4096]
    - [178, 0.0]
  - - [448, 64, 1, 4096]
    - [113, 0.0]
  - - [704, 64, 1, 4096]
    - [27, 0.0]
  - - [960, 64, 1, 4096]
    - [206, 0.0]
  - - [1216, 64, 1, 4096]
    - [7, 0.0]
  - - [1472, 64, 1, 4096]
    - [68, 0.0]
  - - [1728, 64, 1, 4096]
    - [7, 0.0]
  - - [1984, 64, 1, 4096]
    - [7, 0.0]
  - - [64, 192, 1, 4096]
    - [243, 0.0]
  - - [192, 192, 1, 4096]
    - [129, 0.0]
  - - [320, 192, 1, 4096]
    - [125, 0.0]
  - - [448, 192, 1, 4096]
    - [70, 0.0]
  - - [576, 192, 1, 4096]
    - [0, 0.0]
  - - [704, 192, 1, 4096]
    - [69, 0.0]
  - - [832, 192, 1, 4096]
    - [0, 0.0]
  - - [960, 192, 1, 4096]
    - [7, 0.0]
  - - [1088, 192, 1, 4096]
    - [70, 0.0]
  - - [1216, 192, 1, 4096]
    - [0, 0.0]
  - - [1344, 192, 1, 4096]
    - [70, 0.0]
  - - [1472, 192, 1, 4096]
    - [70, 0.0]
  - - [1600, 192, 1, 4096]
    - [0, 0.0]
  - - [1728, 192, 1, 4096]
    - [0, 0.0]
  - - [1856, 192, 1, 4096]
    - [0, 0.0]
  - - [1984, 192, 1, 4096]
    - [0, 0.0]
  - - [192, 320, 1, 4096]
    - [203, 0.0]
  - - [448, 320, 1, 4096]
    - [194, 0.0]
  - - [704, 320, 1, 4096]
    - [7, 0.0]
  - - [960, 320, 1, 4096]
    - [266, 0.0]
  - - [1216, 320, 1, 4096]
    - [0, 0.0]
  - - [1472, 320, 1, 4096]
    - [70, 0.0]
  - - [1728, 320, 1, 4096]
    - [0, 0.0]
  - - [1984, 320, 1, 4096]
    - [0, 0.0]
  - - [64, 448, 1, 4096]
    - [242, 0.0]
  - - [192, 448, 1, 4096]
    - [0, 0.0]
  - - [320, 448, 1, 4096]
    - [0, 0.0]
  - - [448, 448, 1, 4096]
    - [169, 0.0]
  - - [576, 448, 1, 4096]
    - [7, 0.0]
  - - [704, 448, 1, 4096]
    - [267, 0.0]
  - - [832, 448, 1, 4096]
    - [70, 0.0]
  - - [960, 448, 1, 4096]
    - [28, 0.0]
  - - [1088, 448, 1, 4096]
    - [0, 0.0]
  - - [1216, 448, 1, 4096]
    - [70, 0.0]
  - - [1344, 448, 1, 4096]
    - [0, 0.0]
  - - [1472, 448, 1, 4096]
    - [70, 0.0]
  - - [1600, 448, 1, 4096]
    - [70, 0.0]
  - - [1728, 448, 1, 4096]
    - [70, 0.0]
  - - [1856, 448, 1, 4096]
    - [0, 0.0]
  - - [1984, 448, 1, 4096]
    - [70, 0.0]
  - - [192, 576, 1, 4096]
    - [0, 0.0]
  - - [448, 576, 1, 4096]
    - [68, 0.0]
  - - [704, 576, 1, 4096]
    - [269, 0.0]
  - - [960, 576, 1, 4096]
    - [212, 0.0]
  - - [1216, 576, 1, 4096]
    - [31, 0.0]
  - - [1472, 576, 1, 4096]
    - [70, 0.0]
  - - [1728, 576, 1, 4096]
    - [86, 0.0]
  - - [1984, 576, 1, 4096]
    - [16, 0.0]
  - - [64, 704, 1, 4096]
    - [27, 0.0]
  - - [192, 704, 1, 4096]
    - [69, 0.0]
  - - [320, 704, 1, 4096]
    - [68, 0.0]
  - - [448, 704, 1, 4096]
    - [272, 0.0]
  - - [576, 704, 1, 4096]
    - [72, 0.0]
  - - [704, 704, 1, 4096]
    - [86, 0.0]
  - - [832, 704, 1, 4096]
    - [212, 0.0]
  - - [960, 704, 1, 4096]
    - [47, 0.0]
  - - [1088, 704, 1, 4096]
    - [70, 0.0]
  - - [1216, 704, 1, 4096]
    - [0, 0.0]
  - - [1344, 704, 1, 4096]
    - [70, 0.0]
  - - [1472, 704, 1, 4096]
    - [0, 0.0]
  - - [1600, 704, 1, 4096]
    - [72, 0.0]
  - - [1728, 704, 1, 4096]
    - [99, 0.0]
  - - [1856, 704, 1, 4096]
    - [99, 0.0]
  - - [1984, 704, 1, 4096]
    - [77, 0.0]
  - - [192, 832, 1, 4096]
    - [224, 0.0]
  - - [448, 832, 1, 4096]
    - [172, 0.0]
  - - [704, 832, 1, 4096]
    - [30, 0.0]
  - - [960, 832, 1, 4096]
    - [128, 0.0]
  - - [1216, 832, 1, 4096]
    - [98, 0.0]
  - - [1472, 832, 1, 4096]
    - [28, 0.0]
  - - [1728, 832, 1, 4096]
    - [70, 0.0]
  - - [1984, 832, 1, 4096]
    - [70, 0.0]
  - - [64, 960, 1, 4096]
    - [125, 0.0]
  - - [192, 960, 1, 4096]
    - [169, 0.0]
  - - [320, 960, 1, 4096]
    - [16, 0.0]
  - - [448, 960, 1, 4096]
    - [70, 0.0]
  - - [576, 960, 1, 4096]
    - [68, 0.0]
  - - [704, 960, 1, 4096]
    - [273, 0.0]
  - - [832, 960, 1, 4096]
    - [68, 0.0]
  - - [960, 960, 1, 4096]
    - [108, 0.0]
  - - [1088, 960, 1, 4096]
    - [0, 0.0]
  - - [1216, 960, 1, 4096]
    - [28, 0.0]
  - - [1344, 960, 1, 4096]
    - [98, 0.0]
  - - [1472, 960, 1, 4096]
    - [73, 0.0]
  - - [1600, 960, 1, 4096]
    - [28, 0.0]
  - - [1728, 960, 1, 4096]
    - [70, 0.0]
  - - [1856, 960, 1, 4096]
    - [0, 0.0]
  - - [1984, 960, 1, 4096]
    - [91, 0.0]
  - - [192, 1088, 1, 4096]
    - [70, 0.0]
  - - [448, 1088, 1, 4096]
    - [70, 0.0]
  - - [704, 1088, 1, 4096]
    - [70, 0.0]
  - - [960, 1088, 1, 4096]
    - [28, 0.0]
  - - [1216, 1088, 1, 4096]
    - [16, 0.0]
  - - [1472, 1088, 1, 4096]
    - [70, 0.0]
  - - [1728, 1088, 1, 4096]
    - [91, 0.0]
  - - [1984, 1088, 1, 4096]
    - [0, 0.0]
  - - [64, 1216, 1, 4096]
    - [68, 0.0]
  - - [192, 1216, 1, 4096]
    - [70, 0.0]
  - - [320, 1216, 1, 4096]
    - [70, 0.0]
  - - [448, 1216, 1, 4096]
    - [0, 0.0]
  - - [576, 1216, 1, 4096]
    - [70, 0.0]
  - - [704, 1216, 1, 4096]
    - [72, 0.0]
  - - [832, 1216, 1, 4096]
    - [72, 0.0]
  - - [960, 1216, 1, 4096]
    - [72, 0.0]
  - - [1088, 1216, 1, 4096]
    - [99, 0.0]
  - - [1216, 1216, 1, 4096]
    - [0, 0.0]
  - - [1344, 1216, 1, 4096]
    - [70, 0.0]
  - - [1472, 1216, 1, 4096]
    - [4, 0.0]
  - - [1600, 1216, 1, 4096]
    - [0, 0.0]
  - - [1728, 1216, 1, 4096]
    - [70, 0.0]
  - - [1856, 1216, 1, 4096]
    - [0, 0.0]
  - - [1984, 1216, 1, 4096]
    - [74, 0.0]
  - - [192, 1344, 1, 4096]
    - [70, 0.0]
  - - [448, 1344, 1, 4096]
    - [70, 0.0]
  - - [704, 1344, 1, 4096]
    - [0, 0.0]
  - - [960, 1344, 1, 4096]
    - [99, 0.0]
  - - [1216, 1344, 1, 4096]
    - [70, 0.0]
  - - [1472, 1344, 1, 4096]
    - [86, 0.0]
  - - [1728, 1344, 1, 4096]
    - [0, 0.0]
  - - [1984, 1344, 1, 4096]
    - [91, 0.0]
  - - [64, 1472, 1, 4096]
    - [68, 0.0]
  - - [192, 1472, 1, 4096]
    - [0, 0.0]
  - - [320, 1472, 1, 4096]
    - [72, 0.0]
  - - [448, 1472, 1, 4096]
    - [0, 0.0]
  - - [576, 1472, 1, 4096]
    - [70, 0.0]
  - - [704, 1472, 1, 4096]
    - [0, 0.0]
  - - [832, 1472, 1, 4096]
    - [28, 0.0]
  - - [960, 1472, 1, 4096]
    - [84, 0.0]
  - - [1088, 1472, 1, 4096]
    - [86, 0.0]
  - - [1216, 1472, 1, 4096]
    - [0, 0.0]
  - - [1344, 1472, 1, 4096]
    - [70, 0.0]
  - - [1472, 1472, 1, 4096]
    - [70, 0.0]
  - - [1600, 1472, 1, 4096]
    - [70, 0.0]
  - - [1728, 1472, 1, 4096]
    - [0, 0.0]
  - - [1856, 1472, 1, 4096]
    - [91, 0.0]
  - - [1984, 1472, 1, 4096]
    - [91, 0.0]
  - - [192, 1600, 1, 4096]
    - [70, 0.0]
  - - [448, 1600, 1, 4096]
    - [0, 0.0]
  - - [704, 1600, 1, 4096]
    - [98, 0.0]
  - - [960, 1600, 1, 4096]
    - [70, 0.0]
  - - [1216, 1600, 1, 4096]
    - [86, 0.0]
  - - [1472, 1600, 1, 4096]
    - [0, 0.0]
  - - [1728, 1600, 1, 4096]
    - [91, 0.0]
  - - [1984, 1600, 1, 4096]
    - [86, 0.0]
  - - [64, 1728, 1, 4096]
    - [68, 0.0]
  - - [192, 1728, 1, 4096]
    - [0, 0.0]
  - - [320, 1728, 1, 4096]
    - [0, 0.0]
  - - [448, 1728, 1, 4096]
    - [70, 0.0]
  - - [576, 1728, 1, 4096]
    - [70, 0.0]
  - - [704, 1728, 1, 4096]
    - [28, 0.0]
  - - [832, 1728, 1, 4096]
    - [70, 0.0]
  - - [960, 1728, 1, 4096]
    - [0, 0.0]
  - - [1088, 1728, 1, 4096]
    - [91, 0.0]
  - - [1216, 1728, 1, 4096]
    - [0, 0.0]
  - - [1344, 1728, 1, 4096]
    - [70, 0.0]
  - - [1472, 1728, 1, 4096]
    - [70, 0.0]
  - - [1600, 1728, 1, 4096]
    - [4, 0.0]
  - - [1728, 1728, 1, 4096]
    - [0, 0.0]
  - - [1856, 1728, 1, 4096]
    - [0, 0.0]
  - - [1984, 1728, 1, 4096]
    - [134, 0.0]
  - - [192, 1856, 1, 4096]
    - [70, 0.0]
  - - [448, 1856, 1, 4096]
    - [70, 0.0]
  - - [704, 1856, 1, 4096]
    - [16, 0.0]
  - - [960, 1856, 1, 4096]
    - [72, 0.0]
  - - [1216, 1856, 1, 4096]
    - [86, 0.0]
  - - [1472, 1856, 1, 4096]
    - [70, 0.0]
  - - [1728, 1856, 1, 4096]
    - [70, 0.0]
  - - [1984, 1856, 1, 4096]
    - [4, 0.0]
  - - [64, 1984, 1, 4096]
    - [68, 0.0]
  - - [192, 1984, 1, 4096]
    - [86, 0.0]
  - - [320, 1984, 1, 4096]
    - [31, 0.0]
  - - [448, 1984, 1, 4096]
    - [70, 0.0]
  - - [576, 1984, 1, 4096]
    - [0, 0.0]
  - - [704, 1984, 1, 4096]
    - [73, 0.0]
  - - [832, 1984, 1, 4096]
    - [98, 0.0]
  - - [960, 1984, 1, 4096]
    - [91, 0.0]
  - - [1088, 1984, 1, 4096]
    - [0, 0.0]
  - - [1216, 1984, 1, 4096]
    - [0, 0.0]
  - - [1344, 1984, 1, 4096]
    - [91, 0.0]
  - - [1472, 1984, 1, 4096]
    - [91, 0.0]
  - - [1600, 1984, 1, 4096]
    - [0, 0.0]
  - - [1728, 1984, 1, 4096]
    - [77, 0.0]
  - - [1856, 1984, 1, 4096]
    - [91, 0.0]
  - - [1984, 1984, 1, 4096]
    - [4, 0.0]
  - - [128, 64, 1, 64]
    - [125, 0.0]
  - - [256, 64, 1, 64]
    - [137, 0.0]
  - - [384, 64, 1, 64]
    - [138, 0.0]
  - - [512, 64, 1, 64]
    - [140, 0.0]
  - - [640, 64, 1, 64]
    - [141, 0.0]
  - - [768, 64, 1, 64]
    - [143, 0.0]
  - - [896, 64, 1, 64]
    - [12, 0.0]
  - - [1024, 64, 1, 64]
    - [105, 0.0]
  - - [64, 128, 1, 64]
    - [144, 0.0]
  - - [128, 128, 1, 64]
    - [145, 0.0]
  - - [192, 128, 1, 64]
    - [103, 0.0]
  - - [256, 128, 1, 64]
    - [146, 0.0]
  - - [320, 128, 1, 64]
    - [132, 0.0]
  - - [384, 128, 1, 64]
    - [147, 0.0]
  - - [448, 128, 1, 64]
    - [8, 0.0]
  - - [512, 128, 1, 64]
    - [7, 0.0]
  - - [576, 128, 1, 64]
    - [68, 0.0]
  - - [640, 128, 1, 64]
    - [68, 0.0]
  - - [704, 128, 1, 64]
    - [7, 0.0]
  - - [768, 128, 1, 64]
    - [7, 0.0]
  - - [832, 128, 1, 64]
    - [105, 0.0]
  - - [896, 128, 1, 64]
    - [15, 0.0]
  - - [960, 128, 1, 64]
    - [68, 0.0]
  - - [1024, 128, 1, 64]
    - [148, 0.0]
  - - [128, 192, 1, 64]
    - [78, 0.0]
  - - [256, 192, 1, 64]
    - [150, 0.0]
  - - [384, 192, 1, 64]
    - [7, 0.0]
  - - [512, 192, 1, 64]
    - [7, 0.0]
  - - [640, 192, 1, 64]
    - [151, 0.0]
  - - [768, 192, 1, 64]
    - [7, 0.0]
  - - [896, 192, 1, 64]
    - [16, 0.0]
  - - [1024, 192, 1, 64]
    - [154, 0.0]
  - - [64, 256, 1, 64]
    - [155, 0.0]
  - - [128, 256, 1, 64]
    - [123, 0.0]
  - - [192, 256, 1, 64]
    - [156, 0.0]
  - - [256, 256, 1, 64]
    - [157, 0.0]
  - - [320, 256, 1, 64]
    - [158, 0.0]
  - - [384, 256, 1, 64]
    - [108, 0.0]
  - - [448, 256, 1, 64]
    - [68, 0.0]
  - - [512, 256, 1, 64]
    - [47, 0.0]
  - - [576, 256, 1, 64]
    - [112, 0.0]
  - - [640, 256, 1, 64]
    - [7, 0.0]
  - - [704, 256, 1, 64]
    - [112, 0.0]
  - - [768, 256, 1, 64]
    - [159, 0.0]
  - - [832, 256, 1, 64]
    - [160, 0.0]
  - - [896, 256, 1, 64]
    - [12, 0.0]
  - - [960, 256, 1, 64]
    - [0, 0.0]
  - - [1024, 256, 1, 64]
    - [15, 0.0]
  - - [128, 320, 1, 64]
    - [162, 0.0]
  - - [256, 320, 1, 64]
    - [110, 0.0]
  - - [384, 320, 1, 64]
    - [24, 0.0]
  - - [512, 320, 1, 64]
    - [9, 0.0]
  - - [640, 320, 1, 64]
    - [159, 0.0]
  - - [768, 320, 1, 64]
    - [68, 0.0]
  - - [896, 320, 1, 64]
    - [30, 0.0]
  - - [1024, 320, 1, 64]
    - [105, 0.0]
  - - [64, 384, 1, 64]
    - [114, 0.0]
  - - [128, 384, 1, 64]
    - [166, 0.0]
  - - [192, 384, 1, 64]
    - [7, 0.0]
  - - [256, 384, 1, 64]
    - [68, 0.0]
  - - [320, 384, 1, 64]
    - [7, 0.0]
  - - [384, 384, 1, 64]
    - [8, 0.0]
  - - [448, 384, 1, 64]
    - [34, 0.0]
  - - [512, 384, 1, 64]
    - [13, 0.0]
  - - [576, 384, 1, 64]
    - [167, 0.0]
  - - [640, 384, 1, 64]
    - [57, 0.0]
  - - [704, 384, 1, 64]
    - [16, 0.0]
  - - [768, 384, 1, 64]
    - [153, 0.0]
  - - [832, 384, 1, 64]
    - [153, 0.0]
  - - [896, 384, 1, 64]
    - [104, 0.0]
  - - [960, 384, 1, 64]
    - [108, 0.0]
  - - [1024, 384, 1, 64]
    - [28, 0.0]
  - - [128, 448, 1, 64]
    - [125, 0.0]
  - - [256, 448, 1, 64]
    - [107, 0.0]
  - - [384, 448, 1, 64]
    - [29, 0.0]
  - - [512, 448, 1, 64]
    - [68, 0.0]
  - - [640, 448, 1, 64]
    - [168, 0.0]
  - - [768, 448, 1, 64]
    - [29, 0.0]
  - - [896, 448, 1, 64]
    - [170, 0.0]
  - - [1024, 448, 1, 64]
    - [62, 0.0]
  - - [64, 512, 1, 64]
    - [117, 0.0]
  - - [128, 512, 1, 64]
    - [107, 0.0]
  - - [192, 512, 1, 64]
    - [171, 0.0]
  - - [256, 512, 1, 64]
    - [172, 0.0]
  - - [320, 512, 1, 64]
    - [173, 0.0]
  - - [384, 512, 1, 64]
    - [159, 0.0]
  - - [448, 512, 1, 64]
    - [28, 0.0]
  - - [512, 512, 1, 64]
    - [31, 0.0]
  - - [576, 512, 1, 64]
    - [24, 0.0]
  - - [640, 512, 1, 64]
    - [168, 0.0]
  - - [704, 512, 1, 64]
    - [159, 0.0]
  - - [768, 512, 1, 64]
    - [153, 0.0]
  - - [832, 512, 1, 64]
    - [38, 0.0]
  - - [896, 512, 1, 64]
    - [174, 0.0]
  - - [960, 512, 1, 64]
    - [13, 0.0]
  - - [1024, 512, 1, 64]
    - [30, 0.0]
  - - [128, 576, 1, 64]
    - [8, 0.0]
  - - [256, 576, 1, 64]
    - [105, 0.0]
  - - [384, 576, 1, 64]
    - [11, 0.0]
  - - [512, 576, 1, 64]
    - [168, 0.0]
  - - [640, 576, 1, 64]
    - [12, 0.0]
  - - [768, 576, 1, 64]
    - [165, 0.0]
  - - [896, 576, 1, 64]
    - [29, 0.0]
  - - [1024, 576, 1, 64]
    - [165, 0.0]
  - - [64, 640, 1, 64]
    - [125, 0.0]
  - - [128, 640, 1, 64]
    - [12, 0.0]
  - - [192, 640, 1, 64]
    - [64, 0.0]
  - - [256, 640, 1, 64]
    - [105, 0.0]
  - - [320, 640, 1, 64]
    - [13, 0.0]
  - - [384, 640, 1, 64]
    - [37, 0.0]
  - - [448, 640, 1, 64]
    - [7, 0.0]
  - - [512, 640, 1, 64]
    - [108, 0.0]
  - - [576, 640, 1, 64]
    - [11, 0.0]
  - - [640, 640, 1, 64]
    - [16, 0.0]
  - - [704, 640, 1, 64]
    - [165, 0.0]
  - - [768, 640, 1, 64]
    - [176, 0.0]
  - - [832, 640, 1, 64]
    - [30, 0.0]
  - - [896, 640, 1, 64]
    - [165, 0.0]
  - - [960, 640, 1, 64]
    - [69, 0.0]
  - - [1024, 640, 1, 64]
    - [177, 0.0]
  - - [128, 704, 1, 64]
    - [7, 0.0]
  - - [256, 704, 1, 64]
    - [0, 0.0]
  - - [384, 704, 1, 64]
    - [12, 0.0]
  - - [512, 704, 1, 64]
    - [165, 0.0]
  - - [640, 704, 1, 64]
    - [9, 0.0]
  - - [768, 704, 1, 64]
    - [179, 0.0]
  - - [896, 704, 1, 64]
    - [62, 0.0]
  - - [1024, 704, 1, 64]
    - [182, 0.0]
  - - [64, 768, 1, 64]
    - [183, 0.0]
  - - [128, 768, 1, 64]
    - [7, 0.0]
  - - [192, 768, 1, 64]
    - [68, 0.0]
  - - [256, 768, 1, 64]
    - [0, 0.0]
  - - [320, 768, 1, 64]
    - [106, 0.0]
  - - [384, 768, 1, 64]
    - [106, 0.0]
  - - [448, 768, 1, 64]
    - [68, 0.0]
  - - [512, 768, 1, 64]
    - [68, 0.0]
  - - [576, 768, 1, 64]
    - [184, 0.0]
  - - [640, 768, 1, 64]
    - [185, 0.0]
  - - [704, 768, 1, 64]
    - [186, 0.0]
  - - [768, 768, 1, 64]
    - [165, 0.0]
  - - [832, 768, 1, 64]
    - [69, 0.0]
  - - [896, 768, 1, 64]
    - [165, 0.0]
  - - [960, 768, 1, 64]
    - [165, 0.0]
  - - [1024, 768, 1, 64]
    - [187, 0.0]
  - - [128, 832, 1, 64]
    - [181, 0.0]
  - - [256, 832, 1, 64]
    - [64, 0.0]
  - - [384, 832, 1, 64]
    - [104, 0.0]
  - - [512, 832, 1, 64]
    - [6, 0.0]
  - - [640, 832, 1, 64]
    - [168, 0.0]
  - - [768, 832, 1, 64]
    - [30, 0.0]
  - - [896, 832, 1, 64]
    - [7, 0.0]
  - - [1024, 832, 1, 64]
    - [191, 0.0]
  - - [64, 896, 1, 64]
    - [7, 0.0]
  - - [128, 896, 1, 64]
    - [24, 0.0]
  - - [192, 896, 1, 64]
    - [12, 0.0]
  - - [256, 896, 1, 64]
    - [105, 0.0]
  - - [320, 896, 1, 64]
    - [106, 0.0]
  - - [384, 896, 1, 64]
    - [159, 0.0]
  - - [448, 896, 1, 64]
    - [153, 0.0]
  - - [512, 896, 1, 64]
    - [192, 0.0]
  - - [576, 896, 1, 64]
    - [31, 0.0]
  - - [640, 896, 1, 64]
    - [173, 0.0]
  - - [704, 896, 1, 64]
    - [181, 0.0]
  - - [768, 896, 1, 64]
    - [193, 0.0]
  - - [832, 896, 1, 64]
    - [108, 0.0]
  - - [896, 896, 1, 64]
    - [154, 0.0]
  - - [960, 896, 1, 64]
    - [194, 0.0]
  - - [1024, 896, 1, 64]
    - [195, 0.0]
  - - [128, 960, 1, 64]
    - [7, 0.0]
  - - [256, 960, 1, 64]
    - [22, 0.0]
  - - [384, 960, 1, 64]
    - [189, 0.0]
  - - [512, 960, 1, 64]
    - [14, 0.0]
  - - [640, 960, 1, 64]
    - [69, 0.0]
  - - [768, 960, 1, 64]
    - [168, 0.0]
  - - [896, 960, 1, 64]
    - [187, 0.0]
  - - [1024, 960, 1, 64]
    - [152, 0.0]
  - - [64, 1024, 1, 64]
    - [197, 0.0]
  - - [128, 1024, 1, 64]
    - [104, 0.0]
  - - [192, 1024, 1, 64]
    - [198, 0.0]
  - - [256, 1024, 1, 64]
    - [6, 0.0]
  - - [320, 1024, 1, 64]
    - [108, 0.0]
  - - [384, 1024, 1, 64]
    - [64, 0.0]
  - - [448, 1024, 1, 64]
    - [11, 0.0]
  - - [512, 1024, 1, 64]
    - [199, 0.0]
  - - [576, 1024, 1, 64]
    - [107, 0.0]
  - - [640, 1024, 1, 64]
    - [181, 0.0]
  - - [704, 1024, 1, 64]
    - [64, 0.0]
  - - [768, 1024, 1, 64]
    - [193, 0.0]
  - - [832, 1024, 1, 64]
    - [200, 0.0]
  - - [896, 1024, 1, 64]
    - [34, 0.0]
  - - [960, 1024, 1, 64]
    - [201, 0.0]
  - - [1024, 1024, 1, 64]
    - [202, 0.0]
  - - [128, 64, 1, 256]
    - [203, 0.0]
  - - [256, 64, 1, 256]
    - [123, 0.0]
  - - [384, 64, 1, 256]
    - [113, 0.0]
  - - [512, 64, 1, 256]
    - [132, 0.0]
  - - [640, 64, 1, 256]
    - [67, 0.0]
  - - [768, 64, 1, 256]
    - [89, 0.0]
  - - [896, 64, 1, 256]
    - [82, 0.0]
  - - [1024, 64, 1, 256]
    - [23, 0.0]
  - - [64, 128, 1, 256]
    - [132, 0.0]
  - - [128, 128, 1, 256]
    - [113, 0.0]
  - - [192, 128, 1, 256]
    - [78, 0.0]
  - - [256, 128, 1, 256]
    - [125, 0.0]
  - - [320, 128, 1, 256]
    - [129, 0.0]
  - - [384, 128, 1, 256]
    - [125, 0.0]
  - - [448, 128, 1, 256]
    - [129, 0.0]
  - - [512, 128, 1, 256]
    - [129, 0.0]
  - - [576, 128, 1, 256]
    - [129, 0.0]
  - - [640, 128, 1, 256]
    - [27, 0.0]
  - - [704, 128, 1, 256]
    - [204, 0.0]
  - - [768, 128, 1, 256]
    - [0, 0.0]
  - - [832, 128, 1, 256]
    - [69, 0.0]
  - - [896, 128, 1, 256]
    - [7, 0.0]
  - - [960, 128, 1, 256]
    - [69, 0.0]
  - - [1024, 128, 1, 256]
    - [7, 0.0]
  - - [128, 192, 1, 256]
    - [158, 0.0]
  - - [256, 192, 1, 256]
    - [206, 0.0]
  - - [384, 192, 1, 256]
    - [129, 0.0]
  - - [512, 192, 1, 256]
    - [70, 0.0]
  - - [640, 192, 1, 256]
    - [0, 0.0]
  - - [768, 192, 1, 256]
    - [28, 0.0]
  - - [896, 192, 1, 256]
    - [7, 0.0]
  - - [1024, 192, 1, 256]
    - [30, 0.0]
  - - [64, 256, 1, 256]
    - [111, 0.0]
  - - [128, 256, 1, 256]
    - [23, 0.0]
  - - [192, 256, 1, 256]
    - [129, 0.0]
  - - [320, 256, 1, 256]
    - [68, 0.0]
  - - [384, 256, 1, 256]
    - [204, 0.0]
  - - [448, 256, 1, 256]
    - [69, 0.0]
  - - [512, 256, 1, 256]
    - [0, 0.0]
  - - [576, 256, 1, 256]
    - [0, 0.0]
  - - [640, 256, 1, 256]
    - [30, 0.0]
  - - [704, 256, 1, 256]
    - [70, 0.0]
  - - [768, 256, 1, 256]
    - [30, 0.0]
  - - [832, 256, 1, 256]
    - [70, 0.0]
  - - [896, 256, 1, 256]
    - [16, 0.0]
  - - [960, 256, 1, 256]
    - [30, 0.0]
  - - [1024, 256, 1, 256]
    - [28, 0.0]
  - - [128, 320, 1, 256]
    - [129, 0.0]
  - - [256, 320, 1, 256]
    - [129, 0.0]
  - - [384, 320, 1, 256]
    - [0, 0.0]
  - - [512, 320, 1, 256]
    - [68, 0.0]
  - - [640, 320, 1, 256]
    - [0, 0.0]
  - - [768, 320, 1, 256]
    - [181, 0.0]
  - - [896, 320, 1, 256]
    - [207, 0.0]
  - - [1024, 320, 1, 256]
    - [0, 0.0]
  - - [64, 384, 1, 256]
    - [111, 0.0]
  - - [128, 384, 1, 256]
    - [203, 0.0]
  - - [192, 384, 1, 256]
    - [129, 0.0]
  - - [256, 384, 1, 256]
    - [7, 0.0]
  - - [320, 384, 1, 256]
    - [204, 0.0]
  - - [384, 384, 1, 256]
    - [204, 0.0]
  - - [448, 384, 1, 256]
    - [7, 0.0]
  - - [512, 384, 1, 256]
    - [181, 0.0]
  - - [576, 384, 1, 256]
    - [181, 0.0]
  - - [640, 384, 1, 256]
    - [69, 0.0]
  - - [704, 384, 1, 256]
    - [208, 0.0]
  - - [768, 384, 1, 256]
    - [99, 0.0]
  - - [832, 384, 1, 256]
    - [7, 0.0]
  - - [896, 384, 1, 256]
    - [16, 0.0]
  - - [960, 384, 1, 256]
    - [28, 0.0]
  - - [1024, 384, 1, 256]
    - [16, 0.0]
  - - [128, 448, 1, 256]
    - [129, 0.0]
  - - [256, 448, 1, 256]
    - [70, 0.0]
  - - [384, 448, 1, 256]
    - [7, 0.0]
  - - [512, 448, 1, 256]
    - [7, 0.0]
  - - [640, 448, 1, 256]
    - [47, 0.0]
  - - [768, 448, 1, 256]
    - [16, 0.0]
  - - [896, 448, 1, 256]
    - [115, 0.0]
  - - [1024, 448, 1, 256]
    - [210, 0.0]
  - - [64, 512, 1, 256]
    - [27, 0.0]
  - - [128, 512, 1, 256]
    - [196, 0.0]
  - - [192, 512, 1, 256]
    - [0, 0.0]
  - - [256, 512, 1, 256]
    - [0, 0.0]
  - - [320, 512, 1, 256]
    - [70, 0.0]
  - - [384, 512, 1, 256]
    - [181, 0.0]
  - - [448, 512, 1, 256]
    - [181, 0.0]
  - - [512, 512, 1, 256]
    - [0, 0.0]
  - - [576, 512, 1, 256]
    - [28, 0.0]
  - - [640, 512, 1, 256]
    - [30, 0.0]
  - - [704, 512, 1, 256]
    - [28, 0.0]
  - - [768, 512, 1, 256]
    - [69, 0.0]
  - - [832, 512, 1, 256]
    - [57, 0.0]
  - - [896, 512, 1, 256]
    - [211, 0.0]
  - - [960, 512, 1, 256]
    - [24, 0.0]
  - - [1024, 512, 1, 256]
    - [199, 0.0]
  - - [128, 576, 1, 256]
    - [125, 0.0]
  - - [256, 576, 1, 256]
    - [68, 0.0]
  - - [384, 576, 1, 256]
    - [169, 0.0]
  - - [512, 576, 1, 256]
    - [11, 0.0]
  - - [640, 576, 1, 256]
    - [11, 0.0]
  - - [768, 576, 1, 256]
    - [16, 0.0]
  - - [896, 576, 1, 256]
    - [28, 0.0]
  - - [1024, 576, 1, 256]
    - [213, 0.0]
  - - [64, 640, 1, 256]
    - [203, 0.0]
  - - [128, 640, 1, 256]
    - [206, 0.0]
  - - [192, 640, 1, 256]
    - [0, 0.0]
  - - [256, 640, 1, 256]
    - [30, 0.0]
  - - [320, 640, 1, 256]
    - [70, 0.0]
  - - [384, 640, 1, 256]
    - [70, 0.0]
  - - [448, 640, 1, 256]
    - [16, 0.0]
  - - [512, 640, 1, 256]
    - [11, 0.0]
  - - [576, 640, 1, 256]
    - [0, 0.0]
  - - [640, 640, 1, 256]
    - [214, 0.0]
  - - [704, 640, 1, 256]
    - [215, 0.0]
  - - [768, 640, 1, 256]
    - [211, 0.0]
  - - [832, 640, 1, 256]
    - [28, 0.0]
