projects/hipblaslt/library/src/amd_detail/rocblaslt/src/Tensile/Logic/asm_full/gfx1201/GridBased/gfx1201_Cijk_Ailk_Bljk_I8II_BH_SHB_HA_S_SCD_SAV_UserArgs.yaml
- {MinimumRequiredVersion: 5.0.0}
- gfx1201
- gfx1201
- [Device 73f0]
    SolutionIndex: 0
    SolutionNameMin: Cijk_Ailk_Bljk_I8II_BH_SHB_HA_S_SCD_SAV_UserArgs_MT128x128x16_MI16x16x1_SN_LDSB0_AFC1_AG0_AFEM1_AFEM1_ASEM16_CLR1_CADS0_DTLA0_DTLB0_DTVA1_DTVB1_EPS0_FDSI0_GRPM1_GRVWA8_GRVWB8_GSUn1_GSUAMB_GSUC0_GSUWGMRR0_GLS0_ISA1201_IU1_K1_LDSTI0_LBSPPA0_LBSPPB0_LBSPPM0_LPA0_LPB0_LPM0_LRVW8_LWPMn1_MIAV1_MIWT4_4_MO40_NTn1_NTA0_NTB0_NTC0_NTD0_NTM0_NEPBS0_NLCA1_NLCB1_ONLL0_PGR1_PLR0_PKA0_SIA3_SS0_SU32_SUM0_SUS256_SPO0_SRVW0_SSO0_SVW8_SK0_SKFTR0_SKXCCM0_TLDS1_ULSGRO0_USL1_UIOFGRO0_USFGROn1_VSn1_VWA1_VWB4_WSGRA0_WSGRB0_WS32_WG32_4_1_WGM8_WGMXCC1_WGMXCCGn1
    SolutionIndex: 1
    SolutionNameMin: Cijk_Ailk_Bljk_I8II_BH_SHB_HA_S_SCD_SAV_UserArgs_MT64x64x16_MI16x16x1_SN_LDSB1_AFC1_AG0_AFEM1_AFEM1_ASEM1_CLR1_CADS0_DTLA0_DTLB0_DTVA0_DTVB0_EPS1_FDSI0_GRPM1_GRVWA8_GRVWB8_GSUn1_GSUAMB_GSUC0_GSUWGMRR0_GLS0_ISA1201_IU1_K1_LDSTI0_LBSPPA512_LBSPPB128_LBSPPM0_LPA32_LPB8_LPM0_LRVW8_LWPMn1_MIAV1_MIWT2_2_MO40_NTn1_NTA0_NTB0_NTC0_NTD0_NTM0_NEPBS0_NLCA1_NLCB1_ONLL0_PGR1_PLR1_PKA0_SIA2_SS0_SU32_SUM0_SUS256_SPO0_SRVW0_SSO0_SVW16_SK0_SKFTR0_SKXCCM0_TLDS1_ULSGRO0_USL1_UIOFGRO0_USFGROn1_VSn1_VWA2_VWB2_WSGRA0_WSGRB0_WS32_WG32_4_1_WGM8_WGMXCC1_WGMXCCGn1
    SolutionIndex: 2
    SolutionNameMin: Cijk_Ailk_Bljk_I8II_BH_SHB_HA_S_SCD_SAV_UserArgs_MT64x64x16_MI16x16x1_SN_LDSB1_AFC1_AG0_AFEM1_AFEM1_ASEM1_CLR1_CADS0_DTLA0_DTLB0_DTVA0_DTVB0_EPS0_FDSI0_GRPM1_GRVWA8_GRVWB8_GSUn1_GSUAMB_GSUC0_GSUWGMRR0_GLS0_ISA1201_IU1_K1_LDSTI0_LBSPPA512_LBSPPB128_LBSPPM0_LPA32_LPB8_LPM0_LRVW8_LWPMn1_MIAV1_MIWT2_2_MO40_NTn1_NTA0_NTB0_NTC0_NTD0_NTM0_NEPBS0_NLCA1_NLCB1_ONLL0_PGR2_PLR1_PKA0_SIA2_SS0_SU32_SUM0_SUS256_SPO0_SRVW0_SSO0_SVW16_SK0_SKFTR0_SKXCCM0_TLDS1_ULSGRO1_USL1_UIOFGRO0_USFGROn1_VSn1_VWA2_VWB2_WSGRA0_WSGRB0_WS32_WG32_4_1_WGM8_WGMXCC1_WGMXCCGn1
    SolutionIndex: 3
    SolutionNameMin: Cijk_Ailk_Bljk_I8II_BH_SHB_HA_S_SCD_SAV_UserArgs_MT64x64x16_MI16x16x1_SN_LDSB0_AFC1_AG0_AFEM1_AFEM1_ASEM1_CLR0_CADS0_DTLA0_DTLB0_DTVA0_DTVB0_EPS0_FDSI0_GRPM1_GRVWA8_GRVWB8_GSUn1_GSUAMB_GSUC0_GSUWGMRR0_GLS0_ISA1201_IU1_K1_LDSTI0_LBSPPA512_LBSPPB128_LBSPPM0_LPA32_LPB8_LPM0_LRVW8_LWPMn1_MIAV1_MIWT2_2_MO40_NTn1_NTA0_NTB0_NTC0_NTD0_NTM0_NEPBS0_NLCA1_NLCB1_ONLL0_PGR2_PLR0_PKA0_SIA3_SS0_SU32_SUM0_SUS256_SPO0_SRVW0_SSO0_SVW16_SK0_SKFTR0_SKXCCM0_TLDS1_ULSGRO1_USL1_UIOFGRO0_USFGROn1_VSn1_VWA2_VWB2_WSGRA0_WSGRB0_WS32_WG32_4_1_WGM8_WGMXCC1_WGMXCCGn1
    SolutionIndex: 4
    SolutionNameMin: Cijk_Ailk_Bljk_I8II_BH_SHB_HA_S_SCD_SAV_UserArgs_MT64x64x16_MI16x16x1_SN_LDSB0_AFC1_AG0_AFEM1_AFEM1_ASEM16_CLR1_CADS0_DTLA0_DTLB0_DTVA1_DTVB1_EPS0_FDSI0_GRPM1_GRVWA8_GRVWB8_GSUn1_GSUAMB_GSUC0_GSUWGMRR0_GLS0_ISA1201_IU1_K1_LDSTI0_LBSPPA0_LBSPPB0_LBSPPM0_LPA0_LPB0_LPM0_LRVW8_LWPMn1_MIAV1_MIWT2_2_MO40_NTn1_NTA0_NTB0_NTC0_NTD0_NTM0_NEPBS0_NLCA1_NLCB1_ONLL0_PGR1_PLR0_PKA0_SIA3_SS0_SU32_SUM0_SUS256_SPO0_SRVW0_SSO0_SVW8_SK0_SKFTR0_SKXCCM0_TLDS1_ULSGRO0_USL1_UIOFGRO0_USFGROn1_VSn1_VWA1_VWB2_WSGRA0_WSGRB0_WS32_WG32_4_1_WGM8_WGMXCC1_WGMXCCGn1
    SolutionIndex: 5
    SolutionNameMin: Cijk_Ailk_Bljk_I8II_BH_SHB_HA_S_SCD_SAV_UserArgs_MT32x32x16_MI16x16x1_SN_LDSB0_AFC1_AG0_AFEM1_AFEM1_ASEM1_CLR0_CADS0_DTLA0_DTLB0_DTVA0_DTVB0_EPS0_FDSI0_GRPM1_GRVWA4_GRVWB4_GSUn1_GSUAMB_GSUC0_GSUWGMRR0_GLS0_ISA1201_IU1_K1_LDSTI0_LBSPPA256_LBSPPB128_LBSPPM0_LPA16_LPB8_LPM0_LRVW8_LWPMn1_MIAV1_MIWT1_1_MO40_NTn1_NTA0_NTB0_NTC0_NTD0_NTM0_NEPBS0_NLCA1_NLCB1_ONLL0_PGR2_PLR0_PKA0_SIA3_SS0_SU32_SUM0_SUS256_SPO0_SRVW0_SSO0_SVW8_SK0_SKFTR0_SKXCCM0_TLDS1_ULSGRO0_USL1_UIOFGRO0_USFGROn1_VSn1_VWA1_VWB1_WSGRA0_WSGRB0_WS32_WG32_4_1_WGM8_WGMXCC1_WGMXCCGn1
    SolutionIndex: 6
    SolutionNameMin: Cijk_Ailk_Bljk_I8II_BH_SHB_HA_S_SCD_SAV_UserArgs_MT128x64x16_MI16x16x1_SN_LDSB0_AFC1_AG0_AFEM1_AFEM1_ASEM16_CLR1_CADS0_DTLA0_DTLB0_DTVA1_DTVB1_EPS0_FDSI0_GRPM1_GRVWA8_GRVWB8_GSUn1_GSUAMB_GSUC0_GSUWGMRR0_GLS0_ISA1201_IU1_K1_LDSTI0_LBSPPA0_LBSPPB0_LBSPPM0_LPA0_LPB0_LPM0_LRVW8_LWPMn1_MIAV1_MIWT8_1_MO40_NTn1_NTA0_NTB0_NTC0_NTD0_NTM0_NEPBS0_NLCA1_NLCB1_ONLL0_PGR1_PLR0_PKA0_SIA3_SS0_SU32_SUM0_SUS256_SPO0_SRVW0_SSO0_SVW8_SK0_SKFTR0_SKXCCM0_TLDS1_ULSGRO0_USL1_UIOFGRO0_USFGROn1_VSn1_VWA1_VWB1_WSGRA0_WSGRB0_WS32_WG16_8_1_WGM8_WGMXCC1_WGMXCCGn1
    SolutionIndex: 7
    SolutionNameMin: Cijk_Ailk_Bljk_I8II_BH_SHB_HA_S_SCD_SAV_UserArgs_MT64x128x16_MI16x16x1_SN_LDSB1_AFC1_AG0_AFEM1_AFEM1_ASEM1_CLR1_CADS0_DTLA0_DTLB0_DTVA0_DTVB0_EPS1_FDSI0_GRPM1_GRVWA8_GRVWB8_GSUn1_GSUAMB_GSUC0_GSUWGMRR0_GLS0_ISA1201_IU1_K1_LDSTI0_LBSPPA512_LBSPPB128_LBSPPM0_LPA16_LPB8_LPM0_LRVW8_LWPMn1_MIAV1_MIWT1_8_MO40_NTn1_NTA0_NTB0_NTC0_NTD0_NTM0_NEPBS0_NLCA1_NLCB1_ONLL0_PGR1_PLR1_PKA0_SIA2_SS0_SU32_SUM0_SUS256_SPO0_SRVW0_SSO0_SVW8_SK0_SKFTR0_SKXCCM0_TLDS1_ULSGRO0_USL1_UIOFGRO0_USFGROn1_VSn1_VWA1_VWB8_WSGRA0_WSGRB0_WS32_WG64_2_1_WGM8_WGMXCC1_WGMXCCGn1
    SolutionIndex: 8
    SolutionNameMin: Cijk_Ailk_Bljk_I8II_BH_SHB_HA_S_SCD_SAV_UserArgs_MT64x128x16_MI16x16x1_SN_LDSB1_AFC1_AG0_AFEM1_AFEM1_ASEM1_CLR1_CADS0_DTLA0_DTLB0_DTVA0_DTVB0_EPS0_FDSI0_GRPM1_GRVWA8_GRVWB8_GSUn1_GSUAMB_GSUC0_GSUWGMRR0_GLS0_ISA1201_IU1_K1_LDSTI0_LBSPPA512_LBSPPB128_LBSPPM0_LPA16_LPB8_LPM0_LRVW8_LWPMn1_MIAV1_MIWT1_8_MO40_NTn1_NTA0_NTB0_NTC0_NTD0_NTM0_NEPBS0_NLCA1_NLCB1_ONLL0_PGR2_PLR1_PKA0_SIA2_SS0_SU32_SUM0_SUS256_SPO0_SRVW0_SSO0_SVW8_SK0_SKFTR0_SKXCCM0_TLDS1_ULSGRO0_USL1_UIOFGRO0_USFGROn1_VSn1_VWA1_VWB8_WSGRA0_WSGRB0_WS32_WG64_2_1_WGM8_WGMXCC1_WGMXCCGn1
    SolutionIndex: 9
    SolutionNameMin: Cijk_Ailk_Bljk_I8II_BH_SHB_HA_S_SCD_SAV_UserArgs_MT64x128x16_MI16x16x1_SN_LDSB1_AFC1_AG0_AFEM1_AFEM1_ASEM1_CLR1_CADS0_DTLA0_DTLB0_DTVA0_DTVB0_EPS0_FDSI0_GRPM1_GRVWA8_GRVWB8_GSUn1_GSUAMB_GSUC0_GSUWGMRR0_GLS0_ISA1201_IU1_K1_LDSTI0_LBSPPA512_LBSPPB128_LBSPPM0_LPA16_LPB8_LPM0_LRVW8_LWPMn1_MIAV1_MIWT1_8_MO40_NTn1_NTA0_NTB0_NTC0_NTD0_NTM0_NEPBS0_NLCA1_NLCB1_ONLL0_PGR2_PLR1_PKA0_SIA2_SS0_SU32_SUM0_SUS256_SPO0_SRVW0_SSO0_SVW8_SK0_SKFTR0_SKXCCM0_TLDS1_ULSGRO1_USL1_UIOFGRO0_USFGROn1_VSn1_VWA1_VWB8_WSGRA0_WSGRB0_WS32_WG64_2_1_WGM8_WGMXCC1_WGMXCCGn1
    SolutionIndex: 10
    SolutionNameMin: Cijk_Ailk_Bljk_I8II_BH_SHB_HA_S_SCD_SAV_UserArgs_MT64x128x16_MI16x16x1_SN_LDSB0_AFC1_AG0_AFEM1_AFEM1_ASEM1_CLR0_CADS0_DTLA0_DTLB0_DTVA0_DTVB0_EPS1_FDSI0_GRPM1_GRVWA8_GRVWB8_GSUn1_GSUAMB_GSUC0_GSUWGMRR0_GLS0_ISA1201_IU1_K1_LDSTI0_LBSPPA512_LBSPPB128_LBSPPM0_LPA16_LPB8_LPM0_LRVW8_LWPMn1_MIAV1_MIWT1_8_MO40_NTn1_NTA0_NTB0_NTC0_NTD0_NTM0_NEPBS0_NLCA1_NLCB1_ONLL0_PGR1_PLR0_PKA0_SIA3_SS0_SU32_SUM0_SUS256_SPO0_SRVW0_SSO0_SVW8_SK0_SKFTR0_SKXCCM0_TLDS1_ULSGRO0_USL1_UIOFGRO0_USFGROn1_VSn1_VWA1_VWB8_WSGRA0_WSGRB0_WS32_WG64_2_1_WGM8_WGMXCC1_WGMXCCGn1
    SolutionIndex: 11
    SolutionNameMin: Cijk_Ailk_Bljk_I8II_BH_SHB_HA_S_SCD_SAV_UserArgs_MT64x128x16_MI16x16x1_SN_LDSB0_AFC1_AG0_AFEM1_AFEM1_ASEM1_CLR0_CADS0_DTLA0_DTLB0_DTVA0_DTVB0_EPS0_FDSI0_GRPM1_GRVWA8_GRVWB8_GSUn1_GSUAMB_GSUC0_GSUWGMRR0_GLS0_ISA1201_IU1_K1_LDSTI0_LBSPPA512_LBSPPB128_LBSPPM0_LPA16_LPB8_LPM0_LRVW8_LWPMn1_MIAV1_MIWT1_8_MO40_NTn1_NTA0_NTB0_NTC0_NTD0_NTM0_NEPBS0_NLCA1_NLCB1_ONLL0_PGR2_PLR0_PKA0_SIA3_SS0_SU32_SUM0_SUS256_SPO0_SRVW0_SSO0_SVW8_SK0_SKFTR0_SKXCCM0_TLDS1_ULSGRO0_USL1_UIOFGRO0_USFGROn1_VSn1_VWA1_VWB8_WSGRA0_WSGRB0_WS32_WG64_2_1_WGM8_WGMXCC1_WGMXCCGn1
    SolutionIndex: 12
    SolutionNameMin: Cijk_Ailk_Bljk_I8II_BH_SHB_HA_S_SCD_SAV_UserArgs_MT64x128x16_MI16x16x1_SN_LDSB0_AFC1_AG0_AFEM1_AFEM1_ASEM1_CLR0_CADS0_DTLA0_DTLB0_DTVA0_DTVB0_EPS0_FDSI0_GRPM1_GRVWA8_GRVWB8_GSUn1_GSUAMB_GSUC0_GSUWGMRR0_GLS0_ISA1201_IU1_K1_LDSTI0_LBSPPA512_LBSPPB128_LBSPPM0_LPA16_LPB8_LPM0_LRVW8_LWPMn1_MIAV1_MIWT1_8_MO40_NTn1_NTA0_NTB0_NTC0_NTD0_NTM0_NEPBS0_NLCA1_NLCB1_ONLL0_PGR2_PLR0_PKA0_SIA3_SS0_SU32_SUM0_SUS256_SPO0_SRVW0_SSO0_SVW8_SK0_SKFTR0_SKXCCM0_TLDS1_ULSGRO1_USL1_UIOFGRO0_USFGROn1_VSn1_VWA1_VWB8_WSGRA0_WSGRB0_WS32_WG64_2_1_WGM8_WGMXCC1_WGMXCCGn1
    SolutionIndex: 13
    SolutionNameMin: Cijk_Ailk_Bljk_I8II_BH_SHB_HA_S_SCD_SAV_UserArgs_MT64x128x16_MI16x16x1_SN_LDSB0_AFC1_AG0_AFEM1_AFEM1_ASEM16_CLR1_CADS0_DTLA0_DTLB0_DTVA1_DTVB1_EPS0_FDSI0_GRPM1_GRVWA8_GRVWB8_GSUn1_GSUAMB_GSUC0_GSUWGMRR0_GLS0_ISA1201_IU1_K1_LDSTI0_LBSPPA0_LBSPPB0_LBSPPM0_LPA0_LPB0_LPM0_LRVW8_LWPMn1_MIAV1_MIWT1_8_MO40_NTn1_NTA0_NTB0_NTC0_NTD0_NTM0_NEPBS0_NLCA1_NLCB1_ONLL0_PGR1_PLR0_PKA0_SIA3_SS0_SU32_SUM0_SUS256_SPO0_SRVW0_SSO0_SVW8_SK0_SKFTR0_SKXCCM0_TLDS1_ULSGRO0_USL1_UIOFGRO0_USFGROn1_VSn1_VWA1_VWB8_WSGRA0_WSGRB0_WS32_WG64_2_1_WGM8_WGMXCC1_WGMXCCGn1
    SolutionIndex: 14
    SolutionNameMin: Cijk_Ailk_Bljk_I8II_BH_SHB_HA_S_SCD_SAV_UserArgs_MT128x16x16_MI16x16x1_SN_LDSB0_AFC1_AG0_AFEM1_AFEM1_ASEM16_CLR1_CADS0_DTLA0_DTLB0_DTVA1_DTVB1_EPS0_FDSI0_GRPM1_GRVWA8_GRVWB8_GSUn1_GSUAMB_GSUC0_GSUWGMRR0_GLS0_ISA1201_IU1_K1_LDSTI0_LBSPPA0_LBSPPB0_LBSPPM0_LPA0_LPB0_LPM0_LRVW8_LWPMn1_MIAV1_MIWT8_1_MO40_NTn1_NTA0_NTB0_NTC0_NTD0_NTM0_NEPBS0_NLCA1_NLCB1_ONLL0_PGR1_PLR0_PKA0_SIA3_SS0_SU32_SUM0_SUS256_SPO0_SRVW0_SSO0_SVW8_SK0_SKFTR0_SKXCCM0_TLDS1_ULSGRO0_USL1_UIOFGRO0_USFGROn1_VSn1_VWA1_VWB1_WSGRA0_WSGRB0_WS32_WG16_2_1_WGM8_WGMXCC1_WGMXCCGn1
    SolutionIndex: 15
    SolutionNameMin: Cijk_Ailk_Bljk_I8II_BH_SHB_HA_S_SCD_SAV_UserArgs_MT16x128x16_MI16x16x1_SN_LDSB0_AFC1_AG0_AFEM1_AFEM1_ASEM16_CLR1_CADS0_DTLA0_DTLB0_DTVA1_DTVB1_EPS0_FDSI0_GRPM1_GRVWA8_GRVWB8_GSUn1_GSUAMB_GSUC0_GSUWGMRR0_GLS0_ISA1201_IU1_K1_LDSTI0_LBSPPA0_LBSPPB0_LBSPPM0_LPA0_LPB0_LPM0_LRVW8_LWPMn1_MIAV1_MIWT1_8_MO40_NTn1_NTA0_NTB0_NTC0_NTD0_NTM0_NEPBS0_NLCA1_NLCB1_ONLL0_PGR1_PLR0_PKA0_SIA3_SS0_SU32_SUM0_SUS256_SPO0_SRVW0_SSO0_SVW8_SK0_SKFTR0_SKXCCM0_TLDS1_ULSGRO0_USL1_UIOFGRO0_USFGROn1_VSn1_VWA1_VWB8_WSGRA0_WSGRB0_WS32_WG16_2_1_WGM8_WGMXCC1_WGMXCCGn1
    SolutionIndex: 16
    SolutionNameMin: Cijk_Ailk_Bljk_I8II_BH_SHB_HA_S_SCD_SAV_UserArgs_MT128x128x32_MI16x16x1_SN_LDSB0_AFC1_AG0_AFEM1_AFEM1_ASEM1_CLR1_CADS0_DTLA0_DTLB0_DTVA1_DTVB0_EPS1_FDSI0_GRPM1_GRVWA8_GRVWB8_GSUn1_GSUAMB_GSUC0_GSUWGMRR0_GLS0_ISA1201_IU1_K1_LDSTI0_LBSPPA0_LBSPPB128_LBSPPM0_LPA0_LPB8_LPM0_LRVW8_LWPMn1_MIAV1_MIWT8_2_MO40_NTn1_NTA0_NTB0_NTC0_NTD0_NTM0_NEPBS0_NLCA2_NLCB1_ONLL0_PGR1_PLR1_PKA0_SIA3_SS0_SU32_SUM0_SUS256_SPO0_SRVW0_SSO0_SVW8_SK0_SKFTR0_SKXCCM0_TLDS1_ULSGRO0_USL1_UIOFGRO0_USFGROn1_VSn1_VWA1_VWB2_WSGRA0_WSGRB0_WS32_WG16_8_1_WGM8_WGMXCC1_WGMXCCGn1
    SolutionIndex: 17
    SolutionNameMin: Cijk_Ailk_Bljk_I8II_BH_SHB_HA_S_SCD_SAV_UserArgs_MT128x128x32_MI16x16x1_SN_LDSB0_AFC1_AG0_AFEM1_AFEM1_ASEM1_CLR1_CADS0_DTLA0_DTLB0_DTVA1_DTVB0_EPS0_FDSI0_GRPM1_GRVWA8_GRVWB8_GSUn1_GSUAMB_GSUC0_GSUWGMRR0_GLS0_ISA1201_IU1_K1_LDSTI0_LBSPPA0_LBSPPB128_LBSPPM0_LPA0_LPB8_LPM0_LRVW8_LWPMn1_MIAV1_MIWT8_2_MO40_NTn1_NTA0_NTB0_NTC0_NTD0_NTM0_NEPBS0_NLCA2_NLCB1_ONLL0_PGR2_PLR1_PKA0_SIA3_SS0_SU32_SUM0_SUS256_SPO0_SRVW0_SSO0_SVW8_SK0_SKFTR0_SKXCCM0_TLDS1_ULSGRO0_USL1_UIOFGRO0_USFGROn1_VSn1_VWA1_VWB2_WSGRA0_WSGRB0_WS32_WG16_8_1_WGM8_WGMXCC1_WGMXCCGn1
    SolutionIndex: 18
    SolutionNameMin: Cijk_Ailk_Bljk_I8II_BH_SHB_HA_S_SCD_SAV_UserArgs_MT128x128x32_MI16x16x1_SN_LDSB1_AFC1_AG0_AFEM1_AFEM1_ASEM1_CLR1_CADS0_DTLA0_DTLB0_DTVA0_DTVB0_EPS1_FDSI0_GRPM1_GRVWA16_GRVWB8_GSUn1_GSUAMB_GSUC0_GSUWGMRR0_GLS0_ISA1201_IU2_K1_LDSTI0_LBSPPA1024_LBSPPB128_LBSPPM0_LPA64_LPB8_LPM0_LRVW8_LWPMn1_MIAV1_MIWT4_4_MO40_NTn1_NTA0_NTB0_NTC0_NTD0_NTM0_NEPBS0_NLCA1_NLCB1_ONLL0_PGR1_PLR1_PKA0_SIA2_SS0_SU32_SUM0_SUS256_SPO0_SRVW0_SSO0_SVW8_SK0_SKFTR0_SKXCCM0_TLDS1_ULSGRO0_USL1_UIOFGRO0_USFGROn1_VSn1_VWA4_VWB4_WSGRA0_WSGRB0_WS32_WG32_4_1_WGM8_WGMXCC1_WGMXCCGn1
    SolutionIndex: 19
    SolutionNameMin: Cijk_Ailk_Bljk_I8II_BH_SHB_HA_S_SCD_SAV_UserArgs_MT128x128x32_MI16x16x1_SN_LDSB0_AFC1_AG0_AFEM1_AFEM1_ASEM1_CLR1_CADS0_DTLA0_DTLB0_DTVA1_DTVB0_EPS1_FDSI0_GRPM1_GRVWA8_GRVWB8_GSUn1_GSUAMB_GSUC0_GSUWGMRR0_GLS0_ISA1201_IU1_K1_LDSTI0_LBSPPA0_LBSPPB128_LBSPPM0_LPA0_LPB8_LPM0_LRVW8_LWPMn1_MIAV1_MIWT4_4_MO40_NTn1_NTA0_NTB0_NTC0_NTD0_NTM0_NEPBS0_NLCA2_NLCB1_ONLL0_PGR1_PLR1_PKA0_SIA3_SS0_SU32_SUM0_SUS256_SPO0_SRVW0_SSO0_SVW8_SK0_SKFTR0_SKXCCM0_TLDS1_ULSGRO0_USL1_UIOFGRO0_USFGROn1_VSn1_VWA1_VWB4_WSGRA0_WSGRB0_WS32_WG32_4_1_WGM8_WGMXCC1_WGMXCCGn1
    SolutionIndex: 20
    SolutionNameMin: Cijk_Ailk_Bljk_I8II_BH_SHB_HA_S_SCD_SAV_UserArgs_MT128x128x32_MI16x16x1_SN_LDSB0_AFC1_AG0_AFEM1_AFEM1_ASEM1_CLR1_CADS0_DTLA0_DTLB0_DTVA1_DTVB0_EPS0_FDSI0_GRPM1_GRVWA8_GRVWB8_GSUn1_GSUAMB_GSUC0_GSUWGMRR0_GLS0_ISA1201_IU1_K1_LDSTI0_LBSPPA0_LBSPPB128_LBSPPM0_LPA0_LPB8_LPM0_LRVW8_LWPMn1_MIAV1_MIWT4_4_MO40_NTn1_NTA0_NTB0_NTC0_NTD0_NTM0_NEPBS0_NLCA2_NLCB1_ONLL0_PGR2_PLR1_PKA0_SIA3_SS0_SU32_SUM0_SUS256_SPO0_SRVW0_SSO0_SVW8_SK0_SKFTR0_SKXCCM0_TLDS1_ULSGRO0_USL1_UIOFGRO0_USFGROn1_VSn1_VWA1_VWB4_WSGRA0_WSGRB0_WS32_WG32_4_1_WGM8_WGMXCC1_WGMXCCGn1
    SolutionIndex: 21
    SolutionNameMin: Cijk_Ailk_Bljk_I8II_BH_SHB_HA_S_SCD_SAV_UserArgs_MT128x128x32_MI16x16x1_SN_LDSB0_AFC1_AG0_AFEM1_AFEM1_ASEM32_CLR1_CADS0_DTLA0_DTLB0_DTVA0_DTVB1_EPS0_FDSI0_GRPM1_GRVWA16_GRVWB8_GSUn1_GSUAMB_GSUC0_GSUWGMRR0_GLS0_ISA1201_IU1_K1_LDSTI0_LBSPPA1024_LBSPPB0_LBSPPM0_LPA64_LPB0_LPM0_LRVW8_LWPMn1_MIAV1_MIWT4_4_MO40_NTn1_NTA0_NTB0_NTC0_NTD0_NTM0_NEPBS0_NLCA1_NLCB2_ONLL0_PGR2_PLR1_PKA0_SIA3_SS0_SU32_SUM0_SUS256_SPO0_SRVW0_SSO0_SVW8_SK0_SKFTR0_SKXCCM0_TLDS1_ULSGRO0_USL1_UIOFGRO0_USFGROn1_VSn1_VWA4_VWB4_WSGRA0_WSGRB0_WS32_WG32_4_1_WGM8_WGMXCC1_WGMXCCGn1
    SolutionIndex: 22
    SolutionNameMin: Cijk_Ailk_Bljk_I8II_BH_SHB_HA_S_SCD_SAV_UserArgs_MT128x128x32_MI16x16x1_SN_LDSB0_AFC1_AG0_AFEM1_AFEM1_ASEM32_CLR1_CADS0_DTLA0_DTLB0_DTVA1_DTVB1_EPS0_FDSI0_GRPM1_GRVWA8_GRVWB8_GSUn1_GSUAMB_GSUC0_GSUWGMRR0_GLS0_ISA1201_IU1_K1_LDSTI0_LBSPPA0_LBSPPB0_LBSPPM0_LPA0_LPB0_LPM0_LRVW8_LWPMn1_MIAV1_MIWT4_4_MO40_NTn1_NTA0_NTB0_NTC0_NTD0_NTM0_NEPBS0_NLCA2_NLCB2_ONLL0_PGR1_PLR0_PKA0_SIA3_SS0_SU32_SUM0_SUS256_SPO0_SRVW0_SSO0_SVW8_SK0_SKFTR0_SKXCCM0_TLDS1_ULSGRO0_USL1_UIOFGRO0_USFGROn1_VSn1_VWA1_VWB4_WSGRA0_WSGRB0_WS32_WG32_4_1_WGM8_WGMXCC1_WGMXCCGn1
    SolutionIndex: 23
    SolutionNameMin: Cijk_Ailk_Bljk_I8II_BH_SHB_HA_S_SCD_SAV_UserArgs_MT64x64x32_MI16x16x1_SN_LDSB1_AFC1_AG0_AFEM1_AFEM1_ASEM1_CLR1_CADS0_DTLA0_DTLB0_DTVA0_DTVB0_EPS1_FDSI0_GRPM1_GRVWA16_GRVWB8_GSUn1_GSUAMB_GSUC0_GSUWGMRR0_GLS0_ISA1201_IU2_K1_LDSTI0_LBSPPA512_LBSPPB128_LBSPPM0_LPA32_LPB8_LPM0_LRVW8_LWPMn1_MIAV1_MIWT2_2_MO40_NTn1_NTA0_NTB0_NTC0_NTD0_NTM0_NEPBS0_NLCA1_NLCB1_ONLL0_PGR1_PLR1_PKA0_SIA2_SS0_SU32_SUM0_SUS256_SPO0_SRVW0_SSO0_SVW16_SK0_SKFTR0_SKXCCM0_TLDS1_ULSGRO0_USL1_UIOFGRO0_USFGROn1_VSn1_VWA2_VWB2_WSGRA0_WSGRB0_WS32_WG32_4_1_WGM8_WGMXCC1_WGMXCCGn1
    SolutionIndex: 24
    SolutionNameMin: Cijk_Ailk_Bljk_I8II_BH_SHB_HA_S_SCD_SAV_UserArgs_MT64x64x32_MI16x16x1_SN_LDSB1_AFC1_AG0_AFEM1_AFEM1_ASEM1_CLR1_CADS0_DTLA0_DTLB0_DTVA0_DTVB0_EPS0_FDSI0_GRPM1_GRVWA16_GRVWB8_GSUn1_GSUAMB_GSUC0_GSUWGMRR0_GLS0_ISA1201_IU2_K1_LDSTI0_LBSPPA512_LBSPPB128_LBSPPM0_LPA32_LPB8_LPM0_LRVW8_LWPMn1_MIAV1_MIWT2_2_MO40_NTn1_NTA0_NTB0_NTC0_NTD0_NTM0_NEPBS0_NLCA1_NLCB1_ONLL0_PGR2_PLR1_PKA0_SIA2_SS0_SU32_SUM0_SUS256_SPO0_SRVW0_SSO0_SVW16_SK0_SKFTR0_SKXCCM0_TLDS1_ULSGRO0_USL1_UIOFGRO0_USFGROn1_VSn1_VWA2_VWB2_WSGRA0_WSGRB0_WS32_WG32_4_1_WGM8_WGMXCC1_WGMXCCGn1
    SolutionIndex: 25
    SolutionNameMin: Cijk_Ailk_Bljk_I8II_BH_SHB_HA_S_SCD_SAV_UserArgs_MT64x64x32_MI16x16x1_SN_LDSB1_AFC1_AG0_AFEM1_AFEM1_ASEM1_CLR1_CADS0_DTLA0_DTLB0_DTVA0_DTVB0_EPS0_FDSI0_GRPM1_GRVWA8_GRVWB8_GSUn1_GSUAMB_GSUC0_GSUWGMRR0_GLS0_ISA1201_IU2_K1_LDSTI0_LBSPPA512_LBSPPB128_LBSPPM0_LPA32_LPB8_LPM0_LRVW8_LWPMn1_MIAV1_MIWT2_2_MO40_NTn1_NTA0_NTB0_NTC0_NTD0_NTM0_NEPBS0_NLCA1_NLCB1_ONLL0_PGR2_PLR1_PKA0_SIA2_SS0_SU32_SUM0_SUS256_SPO0_SRVW0_SSO0_SVW16_SK0_SKFTR0_SKXCCM0_TLDS1_ULSGRO1_USL1_UIOFGRO0_USFGROn1_VSn1_VWA2_VWB2_WSGRA0_WSGRB0_WS32_WG32_4_1_WGM8_WGMXCC1_WGMXCCGn1
    SolutionIndex: 26
    SolutionNameMin: Cijk_Ailk_Bljk_I8II_BH_SHB_HA_S_SCD_SAV_UserArgs_MT64x64x32_MI16x16x1_SN_LDSB0_AFC1_AG0_AFEM1_AFEM1_ASEM1_CLR1_CADS0_DTLA0_DTLB0_DTVA0_DTVB0_EPS1_FDSI0_GRPM1_GRVWA16_GRVWB8_GSUn1_GSUAMB_GSUC0_GSUWGMRR0_GLS0_ISA1201_IU1_K1_LDSTI0_LBSPPA512_LBSPPB128_LBSPPM0_LPA32_LPB8_LPM0_LRVW8_LWPMn1_MIAV1_MIWT2_2_MO40_NTn1_NTA0_NTB0_NTC0_NTD0_NTM0_NEPBS0_NLCA1_NLCB1_ONLL0_PGR1_PLR1_PKA0_SIA3_SS0_SU32_SUM0_SUS256_SPO0_SRVW0_SSO0_SVW16_SK0_SKFTR0_SKXCCM0_TLDS1_ULSGRO0_USL1_UIOFGRO0_USFGROn1_VSn1_VWA2_VWB2_WSGRA0_WSGRB0_WS32_WG32_4_1_WGM8_WGMXCC1_WGMXCCGn1
    SolutionIndex: 27
    SolutionNameMin: Cijk_Ailk_Bljk_I8II_BH_SHB_HA_S_SCD_SAV_UserArgs_MT64x64x32_MI16x16x1_SN_LDSB0_AFC1_AG0_AFEM1_AFEM1_ASEM1_CLR1_CADS0_DTLA0_DTLB0_DTVA0_DTVB0_EPS0_FDSI0_GRPM1_GRVWA16_GRVWB8_GSUn1_GSUAMB_GSUC0_GSUWGMRR0_GLS0_ISA1201_IU1_K1_LDSTI0_LBSPPA512_LBSPPB128_LBSPPM0_LPA32_LPB8_LPM0_LRVW8_LWPMn1_MIAV1_MIWT2_2_MO40_NTn1_NTA0_NTB0_NTC0_NTD0_NTM0_NEPBS0_NLCA1_NLCB1_ONLL0_PGR2_PLR1_PKA0_SIA3_SS0_SU32_SUM0_SUS256_SPO0_SRVW0_SSO0_SVW16_SK0_SKFTR0_SKXCCM0_TLDS1_ULSGRO0_USL1_UIOFGRO0_USFGROn1_VSn1_VWA2_VWB2_WSGRA0_WSGRB0_WS32_WG32_4_1_WGM8_WGMXCC1_WGMXCCGn1
    SolutionIndex: 28
    SolutionNameMin: Cijk_Ailk_Bljk_I8II_BH_SHB_HA_S_SCD_SAV_UserArgs_MT64x64x32_MI16x16x1_SN_LDSB0_AFC1_AG0_AFEM1_AFEM1_ASEM1_CLR1_CADS0_DTLA0_DTLB0_DTVA1_DTVB0_EPS1_FDSI0_GRPM1_GRVWA8_GRVWB8_GSUn1_GSUAMB_GSUC0_GSUWGMRR0_GLS0_ISA1201_IU1_K1_LDSTI0_LBSPPA0_LBSPPB128_LBSPPM0_LPA0_LPB8_LPM0_LRVW8_LWPMn1_MIAV1_MIWT2_2_MO40_NTn1_NTA0_NTB0_NTC0_NTD0_NTM0_NEPBS0_NLCA2_NLCB1_ONLL0_PGR1_PLR1_PKA0_SIA3_SS0_SU32_SUM0_SUS256_SPO0_SRVW0_SSO0_SVW8_SK0_SKFTR0_SKXCCM0_TLDS1_ULSGRO0_USL1_UIOFGRO0_USFGROn1_VSn1_VWA1_VWB2_WSGRA0_WSGRB0_WS32_WG32_4_1_WGM8_WGMXCC1_WGMXCCGn1
    SolutionIndex: 29
    SolutionNameMin: Cijk_Ailk_Bljk_I8II_BH_SHB_HA_S_SCD_SAV_UserArgs_MT64x64x32_MI16x16x1_SN_LDSB0_AFC1_AG0_AFEM1_AFEM1_ASEM1_CLR1_CADS0_DTLA0_DTLB0_DTVA1_DTVB0_EPS0_FDSI0_GRPM1_GRVWA8_GRVWB8_GSUn1_GSUAMB_GSUC0_GSUWGMRR0_GLS0_ISA1201_IU1_K1_LDSTI0_LBSPPA0_LBSPPB128_LBSPPM0_LPA0_LPB8_LPM0_LRVW8_LWPMn1_MIAV1_MIWT2_2_MO40_NTn1_NTA0_NTB0_NTC0_NTD0_NTM0_NEPBS0_NLCA2_NLCB1_ONLL0_PGR2_PLR1_PKA0_SIA3_SS0_SU32_SUM0_SUS256_SPO0_SRVW0_SSO0_SVW8_SK0_SKFTR0_SKXCCM0_TLDS1_ULSGRO0_USL1_UIOFGRO0_USFGROn1_VSn1_VWA1_VWB2_WSGRA0_WSGRB0_WS32_WG32_4_1_WGM8_WGMXCC1_WGMXCCGn1
    SolutionIndex: 30
    SolutionNameMin: Cijk_Ailk_Bljk_I8II_BH_SHB_HA_S_SCD_SAV_UserArgs_MT64x64x32_MI16x16x1_SN_LDSB0_AFC1_AG0_AFEM1_AFEM1_ASEM32_CLR1_CADS0_DTLA0_DTLB0_DTVA0_DTVB1_EPS1_FDSI0_GRPM1_GRVWA16_GRVWB8_GSUn1_GSUAMB_GSUC0_GSUWGMRR0_GLS0_ISA1201_IU1_K1_LDSTI0_LBSPPA512_LBSPPB0_LBSPPM0_LPA32_LPB0_LPM0_LRVW8_LWPMn1_MIAV1_MIWT2_2_MO40_NTn1_NTA0_NTB0_NTC0_NTD0_NTM0_NEPBS0_NLCA1_NLCB2_ONLL0_PGR1_PLR1_PKA0_SIA3_SS0_SU32_SUM0_SUS256_SPO0_SRVW0_SSO0_SVW16_SK0_SKFTR0_SKXCCM0_TLDS1_ULSGRO0_USL1_UIOFGRO0_USFGROn1_VSn1_VWA2_VWB2_WSGRA0_WSGRB0_WS32_WG32_4_1_WGM8_WGMXCC1_WGMXCCGn1
    SolutionIndex: 31
    SolutionNameMin: Cijk_Ailk_Bljk_I8II_BH_SHB_HA_S_SCD_SAV_UserArgs_MT64x64x32_MI16x16x1_SN_LDSB0_AFC1_AG0_AFEM1_AFEM1_ASEM32_CLR1_CADS0_DTLA0_DTLB0_DTVA1_DTVB1_EPS0_FDSI0_GRPM1_GRVWA8_GRVWB8_GSUn1_GSUAMB_GSUC0_GSUWGMRR0_GLS0_ISA1201_IU1_K1_LDSTI0_LBSPPA0_LBSPPB0_LBSPPM0_LPA0_LPB0_LPM0_LRVW8_LWPMn1_MIAV1_MIWT2_2_MO40_NTn1_NTA0_NTB0_NTC0_NTD0_NTM0_NEPBS0_NLCA2_NLCB2_ONLL0_PGR1_PLR0_PKA0_SIA3_SS0_SU32_SUM0_SUS256_SPO0_SRVW0_SSO0_SVW8_SK0_SKFTR0_SKXCCM0_TLDS1_ULSGRO0_USL1_UIOFGRO0_USFGROn1_VSn1_VWA1_VWB2_WSGRA0_WSGRB0_WS32_WG32_4_1_WGM8_WGMXCC1_WGMXCCGn1
    SolutionIndex: 32
    SolutionNameMin: Cijk_Ailk_Bljk_I8II_BH_SHB_HA_S_SCD_SAV_UserArgs_MT32x32x32_MI16x16x1_SN_LDSB0_AFC1_AG0_AFEM1_AFEM1_ASEM1_CLR1_CADS0_DTLA0_DTLB0_DTVA1_DTVB0_EPS1_FDSI0_GRPM1_GRVWA8_GRVWB8_GSUn1_GSUAMB_GSUC0_GSUWGMRR0_GLS0_ISA1201_IU1_K1_LDSTI0_LBSPPA0_LBSPPB128_LBSPPM0_LPA0_LPB8_LPM0_LRVW8_LWPMn1_MIAV1_MIWT1_1_MO40_NTn1_NTA0_NTB0_NTC0_NTD0_NTM0_NEPBS0_NLCA1_NLCB1_ONLL0_PGR1_PLR1_PKA0_SIA3_SS0_SU32_SUM0_SUS256_SPO0_SRVW0_SSO0_SVW8_SK0_SKFTR0_SKXCCM0_TLDS1_ULSGRO0_USL1_UIOFGRO0_USFGROn1_VSn1_VWA1_VWB1_WSGRA0_WSGRB0_WS32_WG32_4_1_WGM8_WGMXCC1_WGMXCCGn1
    SolutionIndex: 33
    SolutionNameMin: Cijk_Ailk_Bljk_I8II_BH_SHB_HA_S_SCD_SAV_UserArgs_MT32x16x32_MI16x16x1_SN_LDSB0_AFC1_AG0_AFEM1_AFEM1_ASEM1_CLR1_CADS0_DTLA0_DTLB0_DTVA1_DTVB0_EPS1_FDSI0_GRPM1_GRVWA8_GRVWB8_GSUn1_GSUAMB_GSUC0_GSUWGMRR0_GLS0_ISA1201_IU1_K1_LDSTI0_LBSPPA0_LBSPPB128_LBSPPM0_LPA0_LPB8_LPM0_LRVW8_LWPMn1_MIAV1_MIWT1_1_MO40_NTn1_NTA0_NTB0_NTC0_NTD0_NTM0_NEPBS0_NLCA1_NLCB1_ONLL0_PGR1_PLR1_PKA0_SIA3_SS0_SU32_SUM0_SUS256_SPO0_SRVW0_SSO0_SVW8_SK0_SKFTR0_SKXCCM0_TLDS1_ULSGRO0_USL1_UIOFGRO0_USFGROn1_VSn1_VWA1_VWB1_WSGRA0_WSGRB0_WS32_WG32_2_1_WGM8_WGMXCC1_WGMXCCGn1
    SolutionIndex: 34
    SolutionNameMin: Cijk_Ailk_Bljk_I8II_BH_SHB_HA_S_SCD_SAV_UserArgs_MT32x16x32_MI16x16x1_SN_LDSB0_AFC1_AG0_AFEM1_AFEM1_ASEM1_CLR1_CADS0_DTLA0_DTLB0_DTVA1_DTVB0_EPS0_FDSI0_GRPM1_GRVWA8_GRVWB8_GSUn1_GSUAMB_GSUC0_GSUWGMRR0_GLS0_ISA1201_IU1_K1_LDSTI0_LBSPPA0_LBSPPB128_LBSPPM0_LPA0_LPB8_LPM0_LRVW8_LWPMn1_MIAV1_MIWT1_1_MO40_NTn1_NTA0_NTB0_NTC0_NTD0_NTM0_NEPBS0_NLCA1_NLCB1_ONLL0_PGR2_PLR1_PKA0_SIA3_SS0_SU32_SUM0_SUS256_SPO0_SRVW0_SSO0_SVW8_SK0_SKFTR0_SKXCCM0_TLDS1_ULSGRO0_USL1_UIOFGRO0_USFGROn1_VSn1_VWA1_VWB1_WSGRA0_WSGRB0_WS32_WG32_2_1_WGM8_WGMXCC1_WGMXCCGn1
    SolutionIndex: 35
    SolutionNameMin: Cijk_Ailk_Bljk_I8II_BH_SHB_HA_S_SCD_SAV_UserArgs_MT16x16x32_MI16x16x1_SN_LDSB0_AFC1_AG0_AFEM1_AFEM1_ASEM32_CLR1_CADS0_DTLA0_DTLB0_DTVA1_DTVB1_EPS0_FDSI0_GRPM1_GRVWA8_GRVWB8_GSUn1_GSUAMB_GSUC0_GSUWGMRR0_GLS0_ISA1201_IU1_K1_LDSTI0_LBSPPA0_LBSPPB0_LBSPPM0_LPA0_LPB0_LPM0_LRVW8_LWPMn1_MIAV1_MIWT1_1_MO40_NTn1_NTA0_NTB0_NTC0_NTD0_NTM0_NEPBS0_NLCA1_NLCB2_ONLL0_PGR1_PLR0_PKA0_SIA3_SS0_SU32_SUM0_SUS256_SPO0_SRVW0_SSO0_SVW8_SK0_SKFTR0_SKXCCM0_TLDS1_ULSGRO0_USL1_UIOFGRO0_USFGROn1_VSn1_VWA1_VWB1_WSGRA0_WSGRB0_WS32_WG16_2_1_WGM8_WGMXCC1_WGMXCCGn1
    SolutionIndex: 36
    SolutionNameMin: Cijk_Ailk_Bljk_I8II_BH_SHB_HA_S_SCD_SAV_UserArgs_MT128x64x32_MI16x16x1_SN_LDSB0_AFC1_AG0_AFEM1_AFEM1_ASEM1_CLR1_CADS0_DTLA0_DTLB0_DTVA1_DTVB0_EPS1_FDSI0_GRPM1_GRVWA8_GRVWB8_GSUn1_GSUAMB_GSUC0_GSUWGMRR0_GLS0_ISA1201_IU1_K1_LDSTI0_LBSPPA0_LBSPPB128_LBSPPM0_LPA0_LPB8_LPM0_LRVW8_LWPMn1_MIAV1_MIWT8_1_MO40_NTn1_NTA0_NTB0_NTC0_NTD0_NTM0_NEPBS0_NLCA2_NLCB1_ONLL0_PGR1_PLR1_PKA0_SIA3_SS0_SU32_SUM0_SUS256_SPO0_SRVW0_SSO0_SVW8_SK0_SKFTR0_SKXCCM0_TLDS1_ULSGRO0_USL1_UIOFGRO0_USFGROn1_VSn1_VWA1_VWB1_WSGRA0_WSGRB0_WS32_WG16_8_1_WGM8_WGMXCC1_WGMXCCGn1
    SolutionIndex: 37
    SolutionNameMin: Cijk_Ailk_Bljk_I8II_BH_SHB_HA_S_SCD_SAV_UserArgs_MT128x64x32_MI16x16x1_SN_LDSB0_AFC1_AG0_AFEM1_AFEM1_ASEM1_CLR1_CADS0_DTLA0_DTLB0_DTVA1_DTVB0_EPS0_FDSI0_GRPM1_GRVWA8_GRVWB8_GSUn1_GSUAMB_GSUC0_GSUWGMRR0_GLS0_ISA1201_IU1_K1_LDSTI0_LBSPPA0_LBSPPB128_LBSPPM0_LPA0_LPB8_LPM0_LRVW8_LWPMn1_MIAV1_MIWT8_1_MO40_NTn1_NTA0_NTB0_NTC0_NTD0_NTM0_NEPBS0_NLCA2_NLCB1_ONLL0_PGR2_PLR1_PKA0_SIA3_SS0_SU32_SUM0_SUS256_SPO0_SRVW0_SSO0_SVW8_SK0_SKFTR0_SKXCCM0_TLDS1_ULSGRO0_USL1_UIOFGRO0_USFGROn1_VSn1_VWA1_VWB1_WSGRA0_WSGRB0_WS32_WG16_8_1_WGM8_WGMXCC1_WGMXCCGn1
    SolutionIndex: 38
    SolutionNameMin: Cijk_Ailk_Bljk_I8II_BH_SHB_HA_S_SCD_SAV_UserArgs_MT128x64x32_MI16x16x1_SN_LDSB0_AFC1_AG0_AFEM1_AFEM1_ASEM32_CLR1_CADS0_DTLA0_DTLB0_DTVA1_DTVB1_EPS0_FDSI0_GRPM1_GRVWA8_GRVWB8_GSUn1_GSUAMB_GSUC0_GSUWGMRR0_GLS0_ISA1201_IU1_K1_LDSTI0_LBSPPA0_LBSPPB0_LBSPPM0_LPA0_LPB0_LPM0_LRVW8_LWPMn1_MIAV1_MIWT8_1_MO40_NTn1_NTA0_NTB0_NTC0_NTD0_NTM0_NEPBS0_NLCA2_NLCB2_ONLL0_PGR1_PLR0_PKA0_SIA3_SS0_SU32_SUM0_SUS256_SPO0_SRVW0_SSO0_SVW8_SK0_SKFTR0_SKXCCM0_TLDS1_ULSGRO0_USL1_UIOFGRO0_USFGROn1_VSn1_VWA1_VWB1_WSGRA0_WSGRB0_WS32_WG16_8_1_WGM8_WGMXCC1_WGMXCCGn1
    SolutionIndex: 39
    SolutionNameMin: Cijk_Ailk_Bljk_I8II_BH_SHB_HA_S_SCD_SAV_UserArgs_MT128x32x32_MI16x16x1_SN_LDSB1_AFC1_AG0_AFEM1_AFEM1_ASEM1_CLR1_CADS0_DTLA0_DTLB0_DTVA0_DTVB0_EPS0_FDSI0_GRPM1_GRVWA8_GRVWB8_GSUn1_GSUAMB_GSUC0_GSUWGMRR0_GLS0_ISA1201_IU2_K1_LDSTI0_LBSPPA1024_LBSPPB128_LBSPPM0_LPA64_LPB8_LPM0_LRVW8_LWPMn1_MIAV1_MIWT4_1_MO40_NTn1_NTA0_NTB0_NTC0_NTD0_NTM0_NEPBS0_NLCA1_NLCB1_ONLL0_PGR2_PLR1_PKA0_SIA2_SS0_SU32_SUM0_SUS256_SPO0_SRVW0_SSO0_SVW8_SK0_SKFTR0_SKXCCM0_TLDS1_ULSGRO1_USL1_UIOFGRO0_USFGROn1_VSn1_VWA4_VWB1_WSGRA0_WSGRB0_WS32_WG32_4_1_WGM8_WGMXCC1_WGMXCCGn1
    SolutionIndex: 40
    SolutionNameMin: Cijk_Ailk_Bljk_I8II_BH_SHB_HA_S_SCD_SAV_UserArgs_MT128x32x32_MI16x16x1_SN_LDSB0_AFC1_AG0_AFEM1_AFEM1_ASEM1_CLR1_CADS0_DTLA0_DTLB0_DTVA1_DTVB0_EPS1_FDSI0_GRPM1_GRVWA8_GRVWB8_GSUn1_GSUAMB_GSUC0_GSUWGMRR0_GLS0_ISA1201_IU1_K1_LDSTI0_LBSPPA0_LBSPPB128_LBSPPM0_LPA0_LPB8_LPM0_LRVW8_LWPMn1_MIAV1_MIWT4_1_MO40_NTn1_NTA0_NTB0_NTC0_NTD0_NTM0_NEPBS0_NLCA2_NLCB1_ONLL0_PGR1_PLR1_PKA0_SIA3_SS0_SU32_SUM0_SUS256_SPO0_SRVW0_SSO0_SVW8_SK0_SKFTR0_SKXCCM0_TLDS1_ULSGRO0_USL1_UIOFGRO0_USFGROn1_VSn1_VWA1_VWB1_WSGRA0_WSGRB0_WS32_WG32_4_1_WGM8_WGMXCC1_WGMXCCGn1
    SolutionIndex: 41
    SolutionNameMin: Cijk_Ailk_Bljk_I8II_BH_SHB_HA_S_SCD_SAV_UserArgs_MT128x32x32_MI16x16x1_SN_LDSB0_AFC1_AG0_AFEM1_AFEM1_ASEM1_CLR1_CADS0_DTLA0_DTLB0_DTVA1_DTVB0_EPS0_FDSI0_GRPM1_GRVWA8_GRVWB8_GSUn1_GSUAMB_GSUC0_GSUWGMRR0_GLS0_ISA1201_IU1_K1_LDSTI0_LBSPPA0_LBSPPB128_LBSPPM0_LPA0_LPB8_LPM0_LRVW8_LWPMn1_MIAV1_MIWT4_1_MO40_NTn1_NTA0_NTB0_NTC0_NTD0_NTM0_NEPBS0_NLCA2_NLCB1_ONLL0_PGR2_PLR1_PKA0_SIA3_SS0_SU32_SUM0_SUS256_SPO0_SRVW0_SSO0_SVW8_SK0_SKFTR0_SKXCCM0_TLDS1_ULSGRO0_USL1_UIOFGRO0_USFGROn1_VSn1_VWA1_VWB1_WSGRA0_WSGRB0_WS32_WG32_4_1_WGM8_WGMXCC1_WGMXCCGn1
    SolutionIndex: 42
    SolutionNameMin: Cijk_Ailk_Bljk_I8II_BH_SHB_HA_S_SCD_SAV_UserArgs_MT32x128x32_MI16x16x1_SN_LDSB1_AFC1_AG0_AFEM1_AFEM1_ASEM1_CLR1_CADS0_DTLA0_DTLB0_DTVA0_DTVB0_EPS0_FDSI0_GRPM1_GRVWA8_GRVWB8_GSUn1_GSUAMB_GSUC0_GSUWGMRR0_GLS0_ISA1201_IU2_K1_LDSTI0_LBSPPA256_LBSPPB128_LBSPPM0_LPA16_LPB8_LPM0_LRVW8_LWPMn1_MIAV1_MIWT1_4_MO40_NTn1_NTA0_NTB0_NTC0_NTD0_NTM0_NEPBS0_NLCA1_NLCB1_ONLL0_PGR2_PLR1_PKA0_SIA2_SS0_SU32_SUM0_SUS256_SPO0_SRVW0_SSO0_SVW8_SK0_SKFTR0_SKXCCM0_TLDS1_ULSGRO0_USL1_UIOFGRO0_USFGROn1_VSn1_VWA1_VWB4_WSGRA0_WSGRB0_WS32_WG32_4_1_WGM8_WGMXCC1_WGMXCCGn1
    SolutionIndex: 43
    SolutionNameMin: Cijk_Ailk_Bljk_I8II_BH_SHB_HA_S_SCD_SAV_UserArgs_MT32x128x32_MI16x16x1_SN_LDSB0_AFC1_AG0_AFEM1_AFEM1_ASEM1_CLR1_CADS0_DTLA0_DTLB0_DTVA0_DTVB0_EPS0_FDSI0_GRPM1_GRVWA8_GRVWB8_GSUn1_GSUAMB_GSUC0_GSUWGMRR0_GLS0_ISA1201_IU1_K1_LDSTI0_LBSPPA256_LBSPPB128_LBSPPM0_LPA16_LPB8_LPM0_LRVW8_LWPMn1_MIAV1_MIWT1_4_MO40_NTn1_NTA0_NTB0_NTC0_NTD0_NTM0_NEPBS0_NLCA1_NLCB1_ONLL0_PGR2_PLR1_PKA0_SIA3_SS0_SU32_SUM0_SUS256_SPO0_SRVW0_SSO0_SVW8_SK0_SKFTR0_SKXCCM0_TLDS1_ULSGRO0_USL1_UIOFGRO0_USFGROn1_VSn1_VWA1_VWB4_WSGRA0_WSGRB0_WS32_WG32_4_1_WGM8_WGMXCC1_WGMXCCGn1
    SolutionIndex: 44
    SolutionNameMin: Cijk_Ailk_Bljk_I8II_BH_SHB_HA_S_SCD_SAV_UserArgs_MT32x128x32_MI16x16x1_SN_LDSB0_AFC1_AG0_AFEM1_AFEM1_ASEM1_CLR1_CADS0_DTLA0_DTLB0_DTVA1_DTVB0_EPS1_FDSI0_GRPM1_GRVWA8_GRVWB8_GSUn1_GSUAMB_GSUC0_GSUWGMRR0_GLS0_ISA1201_IU1_K1_LDSTI0_LBSPPA0_LBSPPB128_LBSPPM0_LPA0_LPB8_LPM0_LRVW8_LWPMn1_MIAV1_MIWT1_4_MO40_NTn1_NTA0_NTB0_NTC0_NTD0_NTM0_NEPBS0_NLCA1_NLCB1_ONLL0_PGR1_PLR1_PKA0_SIA3_SS0_SU32_SUM0_SUS256_SPO0_SRVW0_SSO0_SVW8_SK0_SKFTR0_SKXCCM0_TLDS1_ULSGRO0_USL1_UIOFGRO0_USFGROn1_VSn1_VWA1_VWB4_WSGRA0_WSGRB0_WS32_WG32_4_1_WGM8_WGMXCC1_WGMXCCGn1
    SolutionIndex: 45
    SolutionNameMin: Cijk_Ailk_Bljk_I8II_BH_SHB_HA_S_SCD_SAV_UserArgs_MT32x128x32_MI16x16x1_SN_LDSB0_AFC1_AG0_AFEM1_AFEM1_ASEM1_CLR1_CADS0_DTLA0_DTLB0_DTVA1_DTVB0_EPS0_FDSI0_GRPM1_GRVWA8_GRVWB8_GSUn1_GSUAMB_GSUC0_GSUWGMRR0_GLS0_ISA1201_IU1_K1_LDSTI0_LBSPPA0_LBSPPB128_LBSPPM0_LPA0_LPB8_LPM0_LRVW8_LWPMn1_MIAV1_MIWT1_4_MO40_NTn1_NTA0_NTB0_NTC0_NTD0_NTM0_NEPBS0_NLCA1_NLCB1_ONLL0_PGR2_PLR1_PKA0_SIA3_SS0_SU32_SUM0_SUS256_SPO0_SRVW0_SSO0_SVW8_SK0_SKFTR0_SKXCCM0_TLDS1_ULSGRO0_USL1_UIOFGRO0_USFGROn1_VSn1_VWA1_VWB4_WSGRA0_WSGRB0_WS32_WG32_4_1_WGM8_WGMXCC1_WGMXCCGn1
    SolutionIndex: 46
    SolutionNameMin: Cijk_Ailk_Bljk_I8II_BH_SHB_HA_S_SCD_SAV_UserArgs_MT64x128x32_MI16x16x1_SN_LDSB1_AFC1_AG0_AFEM1_AFEM1_ASEM1_CLR1_CADS0_DTLA0_DTLB0_DTVA0_DTVB0_EPS1_FDSI0_GRPM1_GRVWA16_GRVWB8_GSUn1_GSUAMB_GSUC0_GSUWGMRR0_GLS0_ISA1201_IU2_K1_LDSTI0_LBSPPA512_LBSPPB256_LBSPPM0_LPA16_LPB8_LPM0_LRVW8_LWPMn1_MIAV1_MIWT1_8_MO40_NTn1_NTA0_NTB0_NTC0_NTD0_NTM0_NEPBS0_NLCA1_NLCB1_ONLL0_PGR1_PLR1_PKA0_SIA2_SS0_SU32_SUM0_SUS256_SPO0_SRVW0_SSO0_SVW8_SK0_SKFTR0_SKXCCM0_TLDS1_ULSGRO0_USL1_UIOFGRO0_USFGROn1_VSn1_VWA1_VWB8_WSGRA0_WSGRB0_WS32_WG64_2_1_WGM8_WGMXCC1_WGMXCCGn1
    SolutionIndex: 47
    SolutionNameMin: Cijk_Ailk_Bljk_I8II_BH_SHB_HA_S_SCD_SAV_UserArgs_MT64x128x32_MI16x16x1_SN_LDSB1_AFC1_AG0_AFEM1_AFEM1_ASEM1_CLR1_CADS0_DTLA0_DTLB0_DTVA0_DTVB0_EPS0_FDSI0_GRPM1_GRVWA16_GRVWB8_GSUn1_GSUAMB_GSUC0_GSUWGMRR0_GLS0_ISA1201_IU2_K1_LDSTI0_LBSPPA512_LBSPPB256_LBSPPM0_LPA16_LPB8_LPM0_LRVW8_LWPMn1_MIAV1_MIWT1_8_MO40_NTn1_NTA0_NTB0_NTC0_NTD0_NTM0_NEPBS0_NLCA1_NLCB1_ONLL0_PGR2_PLR1_PKA0_SIA2_SS0_SU32_SUM0_SUS256_SPO0_SRVW0_SSO0_SVW8_SK0_SKFTR0_SKXCCM0_TLDS1_ULSGRO0_USL1_UIOFGRO0_USFGROn1_VSn1_VWA1_VWB8_WSGRA0_WSGRB0_WS32_WG64_2_1_WGM8_WGMXCC1_WGMXCCGn1
    SolutionIndex: 48
    SolutionNameMin: Cijk_Ailk_Bljk_I8II_BH_SHB_HA_S_SCD_SAV_UserArgs_MT64x128x32_MI16x16x1_SN_LDSB1_AFC1_AG0_AFEM1_AFEM1_ASEM1_CLR1_CADS0_DTLA0_DTLB0_DTVA0_DTVB0_EPS0_FDSI0_GRPM1_GRVWA8_GRVWB8_GSUn1_GSUAMB_GSUC0_GSUWGMRR0_GLS0_ISA1201_IU2_K1_LDSTI0_LBSPPA512_LBSPPB256_LBSPPM0_LPA16_LPB8_LPM0_LRVW8_LWPMn1_MIAV1_MIWT1_8_MO40_NTn1_NTA0_NTB0_NTC0_NTD0_NTM0_NEPBS0_NLCA1_NLCB1_ONLL0_PGR2_PLR1_PKA0_SIA2_SS0_SU32_SUM0_SUS256_SPO0_SRVW0_SSO0_SVW8_SK0_SKFTR0_SKXCCM0_TLDS1_ULSGRO1_USL1_UIOFGRO0_USFGROn1_VSn1_VWA1_VWB8_WSGRA0_WSGRB0_WS32_WG64_2_1_WGM8_WGMXCC1_WGMXCCGn1
    SolutionIndex: 49
    SolutionNameMin: Cijk_Ailk_Bljk_I8II_BH_SHB_HA_S_SCD_SAV_UserArgs_MT64x128x32_MI16x16x1_SN_LDSB0_AFC1_AG0_AFEM1_AFEM1_ASEM1_CLR1_CADS0_DTLA0_DTLB0_DTVA0_DTVB0_EPS1_FDSI0_GRPM1_GRVWA16_GRVWB8_GSUn1_GSUAMB_GSUC0_GSUWGMRR0_GLS0_ISA1201_IU1_K1_LDSTI0_LBSPPA512_LBSPPB256_LBSPPM0_LPA16_LPB8_LPM0_LRVW8_LWPMn1_MIAV1_MIWT1_8_MO40_NTn1_NTA0_NTB0_NTC0_NTD0_NTM0_NEPBS0_NLCA1_NLCB1_ONLL0_PGR1_PLR1_PKA0_SIA3_SS0_SU32_SUM0_SUS256_SPO0_SRVW0_SSO0_SVW8_SK0_SKFTR0_SKXCCM0_TLDS1_ULSGRO0_USL1_UIOFGRO0_USFGROn1_VSn1_VWA1_VWB8_WSGRA0_WSGRB0_WS32_WG64_2_1_WGM8_WGMXCC1_WGMXCCGn1
    SolutionIndex: 50
    SolutionNameMin: Cijk_Ailk_Bljk_I8II_BH_SHB_HA_S_SCD_SAV_UserArgs_MT64x128x32_MI16x16x1_SN_LDSB0_AFC1_AG0_AFEM1_AFEM1_ASEM1_CLR1_CADS0_DTLA0_DTLB0_DTVA0_DTVB0_EPS0_FDSI0_GRPM1_GRVWA16_GRVWB8_GSUn1_GSUAMB_GSUC0_GSUWGMRR0_GLS0_ISA1201_IU1_K1_LDSTI0_LBSPPA512_LBSPPB256_LBSPPM0_LPA16_LPB8_LPM0_LRVW8_LWPMn1_MIAV1_MIWT1_8_MO40_NTn1_NTA0_NTB0_NTC0_NTD0_NTM0_NEPBS0_NLCA1_NLCB1_ONLL0_PGR2_PLR1_PKA0_SIA3_SS0_SU32_SUM0_SUS256_SPO0_SRVW0_SSO0_SVW8_SK0_SKFTR0_SKXCCM0_TLDS1_ULSGRO0_USL1_UIOFGRO0_USFGROn1_VSn1_VWA1_VWB8_WSGRA0_WSGRB0_WS32_WG64_2_1_WGM8_WGMXCC1_WGMXCCGn1
    SolutionIndex: 51
    SolutionNameMin: Cijk_Ailk_Bljk_I8II_BH_SHB_HA_S_SCD_SAV_UserArgs_MT64x128x32_MI16x16x1_SN_LDSB0_AFC1_AG0_AFEM1_AFEM1_ASEM1_CLR1_CADS0_DTLA0_DTLB0_DTVA0_DTVB0_EPS0_FDSI0_GRPM1_GRVWA8_GRVWB8_GSUn1_GSUAMB_GSUC0_GSUWGMRR0_GLS0_ISA1201_IU1_K1_LDSTI0_LBSPPA512_LBSPPB256_LBSPPM0_LPA16_LPB8_LPM0_LRVW8_LWPMn1_MIAV1_MIWT1_8_MO40_NTn1_NTA0_NTB0_NTC0_NTD0_NTM0_NEPBS0_NLCA1_NLCB1_ONLL0_PGR2_PLR1_PKA0_SIA3_SS0_SU32_SUM0_SUS256_SPO0_SRVW0_SSO0_SVW8_SK0_SKFTR0_SKXCCM0_TLDS1_ULSGRO1_USL1_UIOFGRO0_USFGROn1_VSn1_VWA1_VWB8_WSGRA0_WSGRB0_WS32_WG64_2_1_WGM8_WGMXCC1_WGMXCCGn1
    SolutionIndex: 52
    SolutionNameMin: Cijk_Ailk_Bljk_I8II_BH_SHB_HA_S_SCD_SAV_UserArgs_MT64x128x32_MI16x16x1_SN_LDSB0_AFC1_AG0_AFEM1_AFEM1_ASEM1_CLR1_CADS0_DTLA0_DTLB0_DTVA1_DTVB0_EPS1_FDSI0_GRPM1_GRVWA8_GRVWB8_GSUn1_GSUAMB_GSUC0_GSUWGMRR0_GLS0_ISA1201_IU1_K1_LDSTI0_LBSPPA0_LBSPPB256_LBSPPM0_LPA0_LPB8_LPM0_LRVW8_LWPMn1_MIAV1_MIWT1_8_MO40_NTn1_NTA0_NTB0_NTC0_NTD0_NTM0_NEPBS0_NLCA1_NLCB1_ONLL0_PGR1_PLR1_PKA0_SIA3_SS0_SU32_SUM0_SUS256_SPO0_SRVW0_SSO0_SVW8_SK0_SKFTR0_SKXCCM0_TLDS1_ULSGRO0_USL1_UIOFGRO0_USFGROn1_VSn1_VWA1_VWB8_WSGRA0_WSGRB0_WS32_WG64_2_1_WGM8_WGMXCC1_WGMXCCGn1
    SolutionIndex: 53
    SolutionNameMin: Cijk_Ailk_Bljk_I8II_BH_SHB_HA_S_SCD_SAV_UserArgs_MT64x128x32_MI16x16x1_SN_LDSB0_AFC1_AG0_AFEM1_AFEM1_ASEM1_CLR1_CADS0_DTLA0_DTLB0_DTVA1_DTVB0_EPS0_FDSI0_GRPM1_GRVWA8_GRVWB8_GSUn1_GSUAMB_GSUC0_GSUWGMRR0_GLS0_ISA1201_IU1_K1_LDSTI0_LBSPPA0_LBSPPB256_LBSPPM0_LPA0_LPB8_LPM0_LRVW8_LWPMn1_MIAV1_MIWT1_8_MO40_NTn1_NTA0_NTB0_NTC0_NTD0_NTM0_NEPBS0_NLCA1_NLCB1_ONLL0_PGR2_PLR1_PKA0_SIA3_SS0_SU32_SUM0_SUS256_SPO0_SRVW0_SSO0_SVW8_SK0_SKFTR0_SKXCCM0_TLDS1_ULSGRO0_USL1_UIOFGRO0_USFGROn1_VSn1_VWA1_VWB8_WSGRA0_WSGRB0_WS32_WG64_2_1_WGM8_WGMXCC1_WGMXCCGn1
    SolutionIndex: 54
    SolutionNameMin: Cijk_Ailk_Bljk_I8II_BH_SHB_HA_S_SCD_SAV_UserArgs_MT128x16x32_MI16x16x1_SN_LDSB0_AFC1_AG0_AFEM1_AFEM1_ASEM1_CLR1_CADS0_DTLA0_DTLB0_DTVA1_DTVB0_EPS1_FDSI0_GRPM1_GRVWA8_GRVWB8_GSUn1_GSUAMB_GSUC0_GSUWGMRR0_GLS0_ISA1201_IU1_K1_LDSTI0_LBSPPA0_LBSPPB128_LBSPPM0_LPA0_LPB8_LPM0_LRVW8_LWPMn1_MIAV1_MIWT8_1_MO40_NTn1_NTA0_NTB0_NTC0_NTD0_NTM0_NEPBS0_NLCA2_NLCB1_ONLL0_PGR1_PLR1_PKA0_SIA3_SS0_SU32_SUM0_SUS256_SPO0_SRVW0_SSO0_SVW8_SK0_SKFTR0_SKXCCM0_TLDS1_ULSGRO0_USL1_UIOFGRO0_USFGROn1_VSn1_VWA1_VWB1_WSGRA0_WSGRB0_WS32_WG16_2_1_WGM8_WGMXCC1_WGMXCCGn1
    SolutionIndex: 55
    SolutionNameMin: Cijk_Ailk_Bljk_I8II_BH_SHB_HA_S_SCD_SAV_UserArgs_MT128x16x32_MI16x16x1_SN_LDSB0_AFC1_AG0_AFEM1_AFEM1_ASEM1_CLR1_CADS0_DTLA0_DTLB0_DTVA1_DTVB0_EPS0_FDSI0_GRPM1_GRVWA8_GRVWB8_GSUn1_GSUAMB_GSUC0_GSUWGMRR0_GLS0_ISA1201_IU1_K1_LDSTI0_LBSPPA0_LBSPPB128_LBSPPM0_LPA0_LPB8_LPM0_LRVW8_LWPMn1_MIAV1_MIWT8_1_MO40_NTn1_NTA0_NTB0_NTC0_NTD0_NTM0_NEPBS0_NLCA2_NLCB1_ONLL0_PGR2_PLR1_PKA0_SIA3_SS0_SU32_SUM0_SUS256_SPO0_SRVW0_SSO0_SVW8_SK0_SKFTR0_SKXCCM0_TLDS1_ULSGRO0_USL1_UIOFGRO0_USFGROn1_VSn1_VWA1_VWB1_WSGRA0_WSGRB0_WS32_WG16_2_1_WGM8_WGMXCC1_WGMXCCGn1
    SolutionIndex: 56
    SolutionNameMin: Cijk_Ailk_Bljk_I8II_BH_SHB_HA_S_SCD_SAV_UserArgs_MT128x16x32_MI16x16x1_SN_LDSB0_AFC1_AG0_AFEM1_AFEM1_ASEM32_CLR1_CADS0_DTLA0_DTLB0_DTVA1_DTVB1_EPS0_FDSI0_GRPM1_GRVWA8_GRVWB8_GSUn1_GSUAMB_GSUC0_GSUWGMRR0_GLS0_ISA1201_IU1_K1_LDSTI0_LBSPPA0_LBSPPB0_LBSPPM0_LPA0_LPB0_LPM0_LRVW8_LWPMn1_MIAV1_MIWT8_1_MO40_NTn1_NTA0_NTB0_NTC0_NTD0_NTM0_NEPBS0_NLCA2_NLCB2_ONLL0_PGR1_PLR0_PKA0_SIA3_SS0_SU32_SUM0_SUS256_SPO0_SRVW0_SSO0_SVW8_SK0_SKFTR0_SKXCCM0_TLDS1_ULSGRO0_USL1_UIOFGRO0_USFGROn1_VSn1_VWA1_VWB1_WSGRA0_WSGRB0_WS32_WG16_2_1_WGM8_WGMXCC1_WGMXCCGn1
    SolutionIndex: 57
    SolutionNameMin: Cijk_Ailk_Bljk_I8II_BH_SHB_HA_S_SCD_SAV_UserArgs_MT256x16x32_MI16x16x1_SN_LDSB0_AFC1_AG0_AFEM1_AFEM1_ASEM1_CLR1_CADS0_DTLA0_DTLB0_DTVA1_DTVB0_EPS1_FDSI0_GRPM1_GRVWA8_GRVWB8_GSUn1_GSUAMB_GSUC0_GSUWGMRR0_GLS0_ISA1201_IU1_K1_LDSTI0_LBSPPA0_LBSPPB128_LBSPPM0_LPA0_LPB8_LPM0_LRVW8_LWPMn1_MIAV1_MIWT8_1_MO40_NTn1_NTA0_NTB0_NTC0_NTD0_NTM0_NEPBS0_NLCA2_NLCB1_ONLL0_PGR1_PLR1_PKA0_SIA3_SS0_SU32_SUM0_SUS256_SPO0_SRVW0_SSO0_SVW8_SK0_SKFTR0_SKXCCM0_TLDS1_ULSGRO0_USL1_UIOFGRO0_USFGROn1_VSn1_VWA1_VWB1_WSGRA0_WSGRB0_WS32_WG32_2_1_WGM8_WGMXCC1_WGMXCCGn1
    SolutionIndex: 58
    SolutionNameMin: Cijk_Ailk_Bljk_I8II_BH_SHB_HA_S_SCD_SAV_UserArgs_MT256x16x32_MI16x16x1_SN_LDSB0_AFC1_AG0_AFEM1_AFEM1_ASEM1_CLR1_CADS0_DTLA0_DTLB0_DTVA1_DTVB0_EPS0_FDSI0_GRPM1_GRVWA8_GRVWB8_GSUn1_GSUAMB_GSUC0_GSUWGMRR0_GLS0_ISA1201_IU1_K1_LDSTI0_LBSPPA0_LBSPPB128_LBSPPM0_LPA0_LPB8_LPM0_LRVW8_LWPMn1_MIAV1_MIWT8_1_MO40_NTn1_NTA0_NTB0_NTC0_NTD0_NTM0_NEPBS0_NLCA2_NLCB1_ONLL0_PGR2_PLR1_PKA0_SIA3_SS0_SU32_SUM0_SUS256_SPO0_SRVW0_SSO0_SVW8_SK0_SKFTR0_SKXCCM0_TLDS1_ULSGRO0_USL1_UIOFGRO0_USFGROn1_VSn1_VWA1_VWB1_WSGRA0_WSGRB0_WS32_WG32_2_1_WGM8_WGMXCC1_WGMXCCGn1
    SolutionIndex: 59
    SolutionNameMin: Cijk_Ailk_Bljk_I8II_BH_SHB_HA_S_SCD_SAV_UserArgs_MT64x64x64_MI16x16x1_SN_LDSB0_AFC1_AG0_AFEM1_AFEM1_ASEM1_CLR1_CADS0_DTLA0_DTLB0_DTVA0_DTVB0_EPS0_FDSI0_GRPM1_GRVWA16_GRVWB16_GSUn1_GSUAMB_GSUC0_GSUWGMRR0_GLS0_ISA1201_IU1_K1_LDSTI0_LBSPPA1024_LBSPPB128_LBSPPM0_LPA32_LPB32_LPM0_LRVW16_LWPMn1_MIAV1_MIWT2_2_MO40_NTn1_NTA0_NTB0_NTC0_NTD0_NTM0_NEPBS0_NLCA1_NLCB1_ONLL0_PGR2_PLR1_PKA0_SIA3_SS0_SU32_SUM0_SUS256_SPO0_SRVW0_SSO0_SVW16_SK0_SKFTR0_SKXCCM0_TLDS1_ULSGRO0_USL1_UIOFGRO0_USFGROn1_VSn1_VWA2_VWB2_WSGRA0_WSGRB0_WS32_WG32_4_1_WGM8_WGMXCC1_WGMXCCGn1
    SolutionIndex: 60
    SolutionNameMin: Cijk_Ailk_Bljk_I8II_BH_SHB_HA_S_SCD_SAV_UserArgs_MT64x64x64_MI16x16x1_SN_LDSB0_AFC1_AG0_AFEM1_AFEM1_ASEM1_CLR1_CADS0_DTLA0_DTLB0_DTVA1_DTVB0_EPS1_FDSI0_GRPM1_GRVWA8_GRVWB8_GSUn1_GSUAMB_GSUC0_GSUWGMRR0_GLS0_ISA1201_IU1_K1_LDSTI0_LBSPPA0_LBSPPB128_LBSPPM0_LPA0_LPB8_LPM0_LRVW8_LWPMn1_MIAV1_MIWT2_2_MO40_NTn1_NTA0_NTB0_NTC0_NTD0_NTM0_NEPBS0_NLCA4_NLCB1_ONLL0_PGR1_PLR1_PKA0_SIA3_SS0_SU32_SUM0_SUS256_SPO0_SRVW0_SSO0_SVW8_SK0_SKFTR0_SKXCCM0_TLDS1_ULSGRO0_USL1_UIOFGRO0_USFGROn1_VSn1_VWA1_VWB2_WSGRA0_WSGRB0_WS32_WG32_4_1_WGM8_WGMXCC1_WGMXCCGn1
    SolutionIndex: 61
    SolutionNameMin: Cijk_Ailk_Bljk_I8II_BH_SHB_HA_S_SCD_SAV_UserArgs_MT64x64x64_MI16x16x1_SN_LDSB0_AFC1_AG0_AFEM1_AFEM1_ASEM1_CLR1_CADS0_DTLA0_DTLB0_DTVA1_DTVB0_EPS0_FDSI0_GRPM1_GRVWA8_GRVWB8_GSUn1_GSUAMB_GSUC0_GSUWGMRR0_GLS0_ISA1201_IU1_K1_LDSTI0_LBSPPA0_LBSPPB128_LBSPPM0_LPA0_LPB8_LPM0_LRVW8_LWPMn1_MIAV1_MIWT2_2_MO40_NTn1_NTA0_NTB0_NTC0_NTD0_NTM0_NEPBS0_NLCA4_NLCB1_ONLL0_PGR2_PLR1_PKA0_SIA3_SS0_SU32_SUM0_SUS256_SPO0_SRVW0_SSO0_SVW8_SK0_SKFTR0_SKXCCM0_TLDS1_ULSGRO0_USL1_UIOFGRO0_USFGROn1_VSn1_VWA1_VWB2_WSGRA0_WSGRB0_WS32_WG32_4_1_WGM8_WGMXCC1_WGMXCCGn1
    SolutionIndex: 62
    SolutionNameMin: Cijk_Ailk_Bljk_I8II_BH_SHB_HA_S_SCD_SAV_UserArgs_MT64x64x64_MI16x16x1_SN_LDSB0_AFC1_AG0_AFEM1_AFEM1_ASEM64_CLR1_CADS0_DTLA0_DTLB0_DTVA0_DTVB1_EPS1_FDSI0_GRPM1_GRVWA16_GRVWB16_GSUn1_GSUAMB_GSUC0_GSUWGMRR0_GLS0_ISA1201_IU1_K1_LDSTI0_LBSPPA1024_LBSPPB0_LBSPPM0_LPA32_LPB0_LPM0_LRVW16_LWPMn1_MIAV1_MIWT2_2_MO40_NTn1_NTA0_NTB0_NTC0_NTD0_NTM0_NEPBS0_NLCA1_NLCB2_ONLL0_PGR1_PLR1_PKA0_SIA3_SS0_SU32_SUM0_SUS256_SPO0_SRVW0_SSO0_SVW16_SK0_SKFTR0_SKXCCM0_TLDS1_ULSGRO0_USL1_UIOFGRO0_USFGROn1_VSn1_VWA2_VWB2_WSGRA0_WSGRB0_WS32_WG32_4_1_WGM8_WGMXCC1_WGMXCCGn1
    SolutionIndex: 63
    SolutionNameMin: Cijk_Ailk_Bljk_I8II_BH_SHB_HA_S_SCD_SAV_UserArgs_MT64x64x64_MI16x16x1_SN_LDSB0_AFC1_AG0_AFEM1_AFEM1_ASEM64_CLR1_CADS0_DTLA0_DTLB0_DTVA0_DTVB1_EPS0_FDSI0_GRPM1_GRVWA16_GRVWB16_GSUn1_GSUAMB_GSUC0_GSUWGMRR0_GLS0_ISA1201_IU1_K1_LDSTI0_LBSPPA1024_LBSPPB0_LBSPPM0_LPA32_LPB0_LPM0_LRVW16_LWPMn1_MIAV1_MIWT2_2_MO40_NTn1_NTA0_NTB0_NTC0_NTD0_NTM0_NEPBS0_NLCA1_NLCB2_ONLL0_PGR2_PLR1_PKA0_SIA3_SS0_SU32_SUM0_SUS256_SPO0_SRVW0_SSO0_SVW16_SK0_SKFTR0_SKXCCM0_TLDS1_ULSGRO0_USL1_UIOFGRO0_USFGROn1_VSn1_VWA2_VWB2_WSGRA0_WSGRB0_WS32_WG32_4_1_WGM8_WGMXCC1_WGMXCCGn1
    SolutionIndex: 64
    SolutionNameMin: Cijk_Ailk_Bljk_I8II_BH_SHB_HA_S_SCD_SAV_UserArgs_MT64x64x64_MI16x16x1_SN_LDSB0_AFC1_AG0_AFEM1_AFEM1_ASEM64_CLR1_CADS0_DTLA0_DTLB0_DTVA1_DTVB1_EPS0_FDSI0_GRPM1_GRVWA8_GRVWB8_GSUn1_GSUAMB_GSUC0_GSUWGMRR0_GLS0_ISA1201_IU1_K1_LDSTI0_LBSPPA0_LBSPPB0_LBSPPM0_LPA0_LPB0_LPM0_LRVW8_LWPMn1_MIAV1_MIWT2_2_MO40_NTn1_NTA0_NTB0_NTC0_NTD0_NTM0_NEPBS0_NLCA4_NLCB4_ONLL0_PGR1_PLR0_PKA0_SIA3_SS0_SU32_SUM0_SUS256_SPO0_SRVW0_SSO0_SVW8_SK0_SKFTR0_SKXCCM0_TLDS1_ULSGRO0_USL1_UIOFGRO0_USFGROn1_VSn1_VWA1_VWB2_WSGRA0_WSGRB0_WS32_WG32_4_1_WGM8_WGMXCC1_WGMXCCGn1
    SolutionIndex: 65
    SolutionNameMin: Cijk_Ailk_Bljk_I8II_BH_SHB_HA_S_SCD_SAV_UserArgs_MT32x32x64_MI16x16x1_SN_LDSB0_AFC1_AG0_AFEM1_AFEM1_ASEM1_CLR1_CADS0_DTLA0_DTLB0_DTVA0_DTVB0_EPS0_FDSI0_GRPM1_GRVWA16_GRVWB16_GSUn1_GSUAMB_GSUC0_GSUWGMRR0_GLS0_ISA1201_IU1_K1_LDSTI0_LBSPPA512_LBSPPB128_LBSPPM0_LPA16_LPB32_LPM0_LRVW16_LWPMn1_MIAV1_MIWT1_1_MO40_NTn1_NTA0_NTB0_NTC0_NTD0_NTM0_NEPBS0_NLCA1_NLCB1_ONLL0_PGR2_PLR1_PKA0_SIA3_SS0_SU32_SUM0_SUS256_SPO0_SRVW0_SSO0_SVW8_SK0_SKFTR0_SKXCCM0_TLDS1_ULSGRO1_USL1_UIOFGRO0_USFGROn1_VSn1_VWA1_VWB1_WSGRA0_WSGRB0_WS32_WG32_4_1_WGM8_WGMXCC1_WGMXCCGn1
    SolutionIndex: 66
    SolutionNameMin: Cijk_Ailk_Bljk_I8II_BH_SHB_HA_S_SCD_SAV_UserArgs_MT32x32x64_MI16x16x1_SN_LDSB0_AFC1_AG0_AFEM1_AFEM1_ASEM1_CLR1_CADS0_DTLA0_DTLB0_DTVA1_DTVB0_EPS1_FDSI0_GRPM1_GRVWA8_GRVWB8_GSUn1_GSUAMB_GSUC0_GSUWGMRR0_GLS0_ISA1201_IU1_K1_LDSTI0_LBSPPA0_LBSPPB128_LBSPPM0_LPA0_LPB8_LPM0_LRVW8_LWPMn1_MIAV1_MIWT1_1_MO40_NTn1_NTA0_NTB0_NTC0_NTD0_NTM0_NEPBS0_NLCA1_NLCB1_ONLL0_PGR1_PLR1_PKA0_SIA3_SS0_SU32_SUM0_SUS256_SPO0_SRVW0_SSO0_SVW8_SK0_SKFTR0_SKXCCM0_TLDS1_ULSGRO0_USL1_UIOFGRO0_USFGROn1_VSn1_VWA1_VWB1_WSGRA0_WSGRB0_WS32_WG32_4_1_WGM8_WGMXCC1_WGMXCCGn1
    SolutionIndex: 67
    SolutionNameMin: Cijk_Ailk_Bljk_I8II_BH_SHB_HA_S_SCD_SAV_UserArgs_MT32x32x64_MI16x16x1_SN_LDSB0_AFC1_AG0_AFEM1_AFEM1_ASEM1_CLR1_CADS0_DTLA0_DTLB0_DTVA1_DTVB0_EPS0_FDSI0_GRPM1_GRVWA8_GRVWB8_GSUn1_GSUAMB_GSUC0_GSUWGMRR0_GLS0_ISA1201_IU1_K1_LDSTI0_LBSPPA0_LBSPPB128_LBSPPM0_LPA0_LPB8_LPM0_LRVW8_LWPMn1_MIAV1_MIWT1_1_MO40_NTn1_NTA0_NTB0_NTC0_NTD0_NTM0_NEPBS0_NLCA1_NLCB1_ONLL0_PGR2_PLR1_PKA0_SIA3_SS0_SU32_SUM0_SUS256_SPO0_SRVW0_SSO0_SVW8_SK0_SKFTR0_SKXCCM0_TLDS1_ULSGRO0_USL1_UIOFGRO0_USFGROn1_VSn1_VWA1_VWB1_WSGRA0_WSGRB0_WS32_WG32_4_1_WGM8_WGMXCC1_WGMXCCGn1
    SolutionIndex: 68
    SolutionNameMin: Cijk_Ailk_Bljk_I8II_BH_SHB_HA_S_SCD_SAV_UserArgs_MT32x32x64_MI16x16x1_SN_LDSB0_AFC1_AG0_AFEM1_AFEM1_ASEM64_CLR1_CADS0_DTLA0_DTLB0_DTVA1_DTVB1_EPS0_FDSI0_GRPM1_GRVWA8_GRVWB8_GSUn1_GSUAMB_GSUC0_GSUWGMRR0_GLS0_ISA1201_IU1_K1_LDSTI0_LBSPPA0_LBSPPB0_LBSPPM0_LPA0_LPB0_LPM0_LRVW8_LWPMn1_MIAV1_MIWT1_1_MO40_NTn1_NTA0_NTB0_NTC0_NTD0_NTM0_NEPBS0_NLCA1_NLCB4_ONLL0_PGR1_PLR0_PKA0_SIA3_SS0_SU32_SUM0_SUS256_SPO0_SRVW0_SSO0_SVW8_SK0_SKFTR0_SKXCCM0_TLDS1_ULSGRO0_USL1_UIOFGRO0_USFGROn1_VSn1_VWA1_VWB1_WSGRA0_WSGRB0_WS32_WG32_4_1_WGM8_WGMXCC1_WGMXCCGn1
    SolutionIndex: 69
    SolutionNameMin: Cijk_Ailk_Bljk_I8II_BH_SHB_HA_S_SCD_SAV_UserArgs_MT16x32x64_MI16x16x1_SN_LDSB0_AFC1_AG0_AFEM1_AFEM1_ASEM64_CLR1_CADS0_DTLA0_DTLB0_DTVA1_DTVB1_EPS0_FDSI0_GRPM1_GRVWA8_GRVWB8_GSUn1_GSUAMB_GSUC0_GSUWGMRR0_GLS0_ISA1201_IU1_K1_LDSTI0_LBSPPA0_LBSPPB0_LBSPPM0_LPA0_LPB0_LPM0_LRVW8_LWPMn1_MIAV1_MIWT1_1_MO40_NTn1_NTA0_NTB0_NTC0_NTD0_NTM0_NEPBS0_NLCA1_NLCB4_ONLL0_PGR1_PLR0_PKA0_SIA3_SS0_SU32_SUM0_SUS256_SPO0_SRVW0_SSO0_SVW8_SK0_SKFTR0_SKXCCM0_TLDS1_ULSGRO0_USL1_UIOFGRO0_USFGROn1_VSn1_VWA1_VWB1_WSGRA0_WSGRB0_WS32_WG16_4_1_WGM8_WGMXCC1_WGMXCCGn1
    SolutionIndex: 70
    SolutionNameMin: Cijk_Ailk_Bljk_I8II_BH_SHB_HA_S_SCD_SAV_UserArgs_MT32x16x64_MI16x16x1_SN_LDSB0_AFC1_AG0_AFEM1_AFEM1_ASEM1_CLR1_CADS0_DTLA0_DTLB0_DTVA1_DTVB0_EPS1_FDSI0_GRPM1_GRVWA8_GRVWB8_GSUn1_GSUAMB_GSUC0_GSUWGMRR0_GLS0_ISA1201_IU1_K1_LDSTI0_LBSPPA0_LBSPPB128_LBSPPM0_LPA0_LPB8_LPM0_LRVW8_LWPMn1_MIAV1_MIWT1_1_MO40_NTn1_NTA0_NTB0_NTC0_NTD0_NTM0_NEPBS0_NLCA1_NLCB1_ONLL0_PGR1_PLR1_PKA0_SIA3_SS0_SU32_SUM0_SUS256_SPO0_SRVW0_SSO0_SVW8_SK0_SKFTR0_SKXCCM0_TLDS1_ULSGRO0_USL1_UIOFGRO0_USFGROn1_VSn1_VWA1_VWB1_WSGRA0_WSGRB0_WS32_WG32_2_1_WGM8_WGMXCC1_WGMXCCGn1
    SolutionIndex: 71
    SolutionNameMin: Cijk_Ailk_Bljk_I8II_BH_SHB_HA_S_SCD_SAV_UserArgs_MT32x16x64_MI16x16x1_SN_LDSB0_AFC1_AG0_AFEM1_AFEM1_ASEM1_CLR1_CADS0_DTLA0_DTLB0_DTVA1_DTVB0_EPS0_FDSI0_GRPM1_GRVWA8_GRVWB8_GSUn1_GSUAMB_GSUC0_GSUWGMRR0_GLS0_ISA1201_IU1_K1_LDSTI0_LBSPPA0_LBSPPB128_LBSPPM0_LPA0_LPB8_LPM0_LRVW8_LWPMn1_MIAV1_MIWT1_1_MO40_NTn1_NTA0_NTB0_NTC0_NTD0_NTM0_NEPBS0_NLCA1_NLCB1_ONLL0_PGR2_PLR1_PKA0_SIA3_SS0_SU32_SUM0_SUS256_SPO0_SRVW0_SSO0_SVW8_SK0_SKFTR0_SKXCCM0_TLDS1_ULSGRO0_USL1_UIOFGRO0_USFGROn1_VSn1_VWA1_VWB1_WSGRA0_WSGRB0_WS32_WG32_2_1_WGM8_WGMXCC1_WGMXCCGn1
    SolutionIndex: 72
    SolutionNameMin: Cijk_Ailk_Bljk_I8II_BH_SHB_HA_S_SCD_SAV_UserArgs_MT32x16x64_MI16x16x1_SN_LDSB0_AFC1_AG0_AFEM1_AFEM1_ASEM64_CLR1_CADS0_DTLA0_DTLB0_DTVA1_DTVB1_EPS0_FDSI0_GRPM1_GRVWA8_GRVWB8_GSUn1_GSUAMB_GSUC0_GSUWGMRR0_GLS0_ISA1201_IU1_K1_LDSTI0_LBSPPA0_LBSPPB0_LBSPPM0_LPA0_LPB0_LPM0_LRVW8_LWPMn1_MIAV1_MIWT1_1_MO40_NTn1_NTA0_NTB0_NTC0_NTD0_NTM0_NEPBS0_NLCA1_NLCB4_ONLL0_PGR1_PLR0_PKA0_SIA3_SS0_SU32_SUM0_SUS256_SPO0_SRVW0_SSO0_SVW8_SK0_SKFTR0_SKXCCM0_TLDS1_ULSGRO0_USL1_UIOFGRO0_USFGROn1_VSn1_VWA1_VWB1_WSGRA0_WSGRB0_WS32_WG32_2_1_WGM8_WGMXCC1_WGMXCCGn1
    SolutionIndex: 73
    SolutionNameMin: Cijk_Ailk_Bljk_I8II_BH_SHB_HA_S_SCD_SAV_UserArgs_MT16x16x64_MI16x16x1_SN_LDSB0_AFC1_AG0_AFEM1_AFEM1_ASEM1_CLR1_CADS0_DTLA0_DTLB0_DTVA1_DTVB0_EPS1_FDSI0_GRPM1_GRVWA8_GRVWB8_GSUn1_GSUAMB_GSUC0_GSUWGMRR0_GLS0_ISA1201_IU1_K1_LDSTI0_LBSPPA0_LBSPPB128_LBSPPM0_LPA0_LPB8_LPM0_LRVW8_LWPMn1_MIAV1_MIWT1_1_MO40_NTn1_NTA0_NTB0_NTC0_NTD0_NTM0_NEPBS0_NLCA1_NLCB1_ONLL0_PGR1_PLR1_PKA0_SIA3_SS0_SU32_SUM0_SUS256_SPO0_SRVW0_SSO0_SVW8_SK0_SKFTR0_SKXCCM0_TLDS1_ULSGRO0_USL1_UIOFGRO0_USFGROn1_VSn1_VWA1_VWB1_WSGRA0_WSGRB0_WS32_WG16_2_1_WGM8_WGMXCC1_WGMXCCGn1
    SolutionIndex: 74
    SolutionNameMin: Cijk_Ailk_Bljk_I8II_BH_SHB_HA_S_SCD_SAV_UserArgs_MT16x16x64_MI16x16x1_SN_LDSB0_AFC1_AG0_AFEM1_AFEM1_ASEM1_CLR1_CADS0_DTLA0_DTLB0_DTVA1_DTVB0_EPS0_FDSI0_GRPM1_GRVWA8_GRVWB8_GSUn1_GSUAMB_GSUC0_GSUWGMRR0_GLS0_ISA1201_IU1_K1_LDSTI0_LBSPPA0_LBSPPB128_LBSPPM0_LPA0_LPB8_LPM0_LRVW8_LWPMn1_MIAV1_MIWT1_1_MO40_NTn1_NTA0_NTB0_NTC0_NTD0_NTM0_NEPBS0_NLCA1_NLCB1_ONLL0_PGR2_PLR1_PKA0_SIA3_SS0_SU32_SUM0_SUS256_SPO0_SRVW0_SSO0_SVW8_SK0_SKFTR0_SKXCCM0_TLDS1_ULSGRO0_USL1_UIOFGRO0_USFGROn1_VSn1_VWA1_VWB1_WSGRA0_WSGRB0_WS32_WG16_2_1_WGM8_WGMXCC1_WGMXCCGn1
    SolutionIndex: 75
    SolutionNameMin: Cijk_Ailk_Bljk_I8II_BH_SHB_HA_S_SCD_SAV_UserArgs_MT16x16x64_MI16x16x1_SN_LDSB0_AFC1_AG0_AFEM1_AFEM1_ASEM64_CLR1_CADS0_DTLA0_DTLB0_DTVA1_DTVB1_EPS0_FDSI0_GRPM1_GRVWA8_GRVWB8_GSUn1_GSUAMB_GSUC0_GSUWGMRR0_GLS0_ISA1201_IU1_K1_LDSTI0_LBSPPA0_LBSPPB0_LBSPPM0_LPA0_LPB0_LPM0_LRVW8_LWPMn1_MIAV1_MIWT1_1_MO40_NTn1_NTA0_NTB0_NTC0_NTD0_NTM0_NEPBS0_NLCA1_NLCB4_ONLL0_PGR1_PLR0_PKA0_SIA3_SS0_SU32_SUM0_SUS256_SPO0_SRVW0_SSO0_SVW8_SK0_SKFTR0_SKXCCM0_TLDS1_ULSGRO0_USL1_UIOFGRO0_USFGROn1_VSn1_VWA1_VWB1_WSGRA0_WSGRB0_WS32_WG16_2_1_WGM8_WGMXCC1_WGMXCCGn1
    SolutionIndex: 76
    SolutionNameMin: Cijk_Ailk_Bljk_I8II_BH_SHB_HA_S_SCD_SAV_UserArgs_MT128x64x64_MI16x16x1_SN_LDSB0_AFC1_AG0_AFEM1_AFEM1_ASEM1_CLR1_CADS0_DTLA0_DTLB0_DTVA1_DTVB0_EPS1_FDSI0_GRPM1_GRVWA8_GRVWB8_GSUn1_GSUAMB_GSUC0_GSUWGMRR0_GLS0_ISA1201_IU1_K1_LDSTI0_LBSPPA0_LBSPPB128_LBSPPM0_LPA0_LPB8_LPM0_LRVW8_LWPMn1_MIAV1_MIWT8_1_MO40_NTn1_NTA0_NTB0_NTC0_NTD0_NTM0_NEPBS0_NLCA4_NLCB1_ONLL0_PGR1_PLR1_PKA0_SIA3_SS0_SU32_SUM0_SUS256_SPO0_SRVW0_SSO0_SVW8_SK0_SKFTR0_SKXCCM0_TLDS1_ULSGRO0_USL1_UIOFGRO0_USFGROn1_VSn1_VWA1_VWB1_WSGRA0_WSGRB0_WS32_WG16_8_1_WGM8_WGMXCC1_WGMXCCGn1
    SolutionIndex: 77
    SolutionNameMin: Cijk_Ailk_Bljk_I8II_BH_SHB_HA_S_SCD_SAV_UserArgs_MT128x64x64_MI16x16x1_SN_LDSB0_AFC1_AG0_AFEM1_AFEM1_ASEM1_CLR1_CADS0_DTLA0_DTLB0_DTVA1_DTVB0_EPS0_FDSI0_GRPM1_GRVWA8_GRVWB8_GSUn1_GSUAMB_GSUC0_GSUWGMRR0_GLS0_ISA1201_IU1_K1_LDSTI0_LBSPPA0_LBSPPB128_LBSPPM0_LPA0_LPB8_LPM0_LRVW8_LWPMn1_MIAV1_MIWT8_1_MO40_NTn1_NTA0_NTB0_NTC0_NTD0_NTM0_NEPBS0_NLCA4_NLCB1_ONLL0_PGR2_PLR1_PKA0_SIA3_SS0_SU32_SUM0_SUS256_SPO0_SRVW0_SSO0_SVW8_SK0_SKFTR0_SKXCCM0_TLDS1_ULSGRO0_USL1_UIOFGRO0_USFGROn1_VSn1_VWA1_VWB1_WSGRA0_WSGRB0_WS32_WG16_8_1_WGM8_WGMXCC1_WGMXCCGn1
    SolutionIndex: 78
    SolutionNameMin: Cijk_Ailk_Bljk_I8II_BH_SHB_HA_S_SCD_SAV_UserArgs_MT128x32x64_MI16x16x1_SN_LDSB0_AFC1_AG0_AFEM1_AFEM1_ASEM1_CLR1_CADS0_DTLA0_DTLB0_DTVA1_DTVB0_EPS1_FDSI0_GRPM1_GRVWA8_GRVWB8_GSUn1_GSUAMB_GSUC0_GSUWGMRR0_GLS0_ISA1201_IU1_K1_LDSTI0_LBSPPA0_LBSPPB128_LBSPPM0_LPA0_LPB8_LPM0_LRVW8_LWPMn1_MIAV1_MIWT4_1_MO40_NTn1_NTA0_NTB0_NTC0_NTD0_NTM0_NEPBS0_NLCA4_NLCB1_ONLL0_PGR1_PLR1_PKA0_SIA3_SS0_SU32_SUM0_SUS256_SPO0_SRVW0_SSO0_SVW8_SK0_SKFTR0_SKXCCM0_TLDS1_ULSGRO0_USL1_UIOFGRO0_USFGROn1_VSn1_VWA1_VWB1_WSGRA0_WSGRB0_WS32_WG32_4_1_WGM8_WGMXCC1_WGMXCCGn1
    SolutionIndex: 79
    SolutionNameMin: Cijk_Ailk_Bljk_I8II_BH_SHB_HA_S_SCD_SAV_UserArgs_MT128x32x64_MI16x16x1_SN_LDSB0_AFC1_AG0_AFEM1_AFEM1_ASEM1_CLR1_CADS0_DTLA0_DTLB0_DTVA1_DTVB0_EPS0_FDSI0_GRPM1_GRVWA8_GRVWB8_GSUn1_GSUAMB_GSUC0_GSUWGMRR0_GLS0_ISA1201_IU1_K1_LDSTI0_LBSPPA0_LBSPPB128_LBSPPM0_LPA0_LPB8_LPM0_LRVW8_LWPMn1_MIAV1_MIWT4_1_MO40_NTn1_NTA0_NTB0_NTC0_NTD0_NTM0_NEPBS0_NLCA4_NLCB1_ONLL0_PGR2_PLR1_PKA0_SIA3_SS0_SU32_SUM0_SUS256_SPO0_SRVW0_SSO0_SVW8_SK0_SKFTR0_SKXCCM0_TLDS1_ULSGRO0_USL1_UIOFGRO0_USFGROn1_VSn1_VWA1_VWB1_WSGRA0_WSGRB0_WS32_WG32_4_1_WGM8_WGMXCC1_WGMXCCGn1
    SolutionIndex: 80
    SolutionNameMin: Cijk_Ailk_Bljk_I8II_BH_SHB_HA_S_SCD_SAV_UserArgs_MT128x32x64_MI16x16x1_SN_LDSB0_AFC1_AG0_AFEM1_AFEM1_ASEM64_CLR1_CADS0_DTLA0_DTLB0_DTVA1_DTVB1_EPS0_FDSI0_GRPM1_GRVWA8_GRVWB8_GSUn1_GSUAMB_GSUC0_GSUWGMRR0_GLS0_ISA1201_IU1_K1_LDSTI0_LBSPPA0_LBSPPB0_LBSPPM0_LPA0_LPB0_LPM0_LRVW8_LWPMn1_MIAV1_MIWT4_1_MO40_NTn1_NTA0_NTB0_NTC0_NTD0_NTM0_NEPBS0_NLCA4_NLCB4_ONLL0_PGR1_PLR0_PKA0_SIA3_SS0_SU32_SUM0_SUS256_SPO0_SRVW0_SSO0_SVW8_SK0_SKFTR0_SKXCCM0_TLDS1_ULSGRO0_USL1_UIOFGRO0_USFGROn1_VSn1_VWA1_VWB1_WSGRA0_WSGRB0_WS32_WG32_4_1_WGM8_WGMXCC1_WGMXCCGn1
    SolutionIndex: 81
    SolutionNameMin: Cijk_Ailk_Bljk_I8II_BH_SHB_HA_S_SCD_SAV_UserArgs_MT32x128x64_MI16x16x1_SN_LDSB0_AFC1_AG0_AFEM1_AFEM1_ASEM1_CLR1_CADS0_DTLA0_DTLB0_DTVA1_DTVB0_EPS1_FDSI0_GRPM1_GRVWA8_GRVWB8_GSUn1_GSUAMB_GSUC0_GSUWGMRR0_GLS0_ISA1201_IU1_K1_LDSTI0_LBSPPA0_LBSPPB256_LBSPPM0_LPA0_LPB8_LPM0_LRVW8_LWPMn1_MIAV1_MIWT1_4_MO40_NTn1_NTA0_NTB0_NTC0_NTD0_NTM0_NEPBS0_NLCA1_NLCB1_ONLL0_PGR1_PLR1_PKA0_SIA3_SS0_SU32_SUM0_SUS256_SPO0_SRVW0_SSO0_SVW8_SK0_SKFTR0_SKXCCM0_TLDS1_ULSGRO0_USL1_UIOFGRO0_USFGROn1_VSn1_VWA1_VWB4_WSGRA0_WSGRB0_WS32_WG32_4_1_WGM8_WGMXCC1_WGMXCCGn1
    SolutionIndex: 82
    SolutionNameMin: Cijk_Ailk_Bljk_I8II_BH_SHB_HA_S_SCD_SAV_UserArgs_MT32x128x64_MI16x16x1_SN_LDSB0_AFC1_AG0_AFEM1_AFEM1_ASEM1_CLR1_CADS0_DTLA0_DTLB0_DTVA1_DTVB0_EPS0_FDSI0_GRPM1_GRVWA8_GRVWB8_GSUn1_GSUAMB_GSUC0_GSUWGMRR0_GLS0_ISA1201_IU1_K1_LDSTI0_LBSPPA0_LBSPPB256_LBSPPM0_LPA0_LPB8_LPM0_LRVW8_LWPMn1_MIAV1_MIWT1_4_MO40_NTn1_NTA0_NTB0_NTC0_NTD0_NTM0_NEPBS0_NLCA1_NLCB1_ONLL0_PGR2_PLR1_PKA0_SIA3_SS0_SU32_SUM0_SUS256_SPO0_SRVW0_SSO0_SVW8_SK0_SKFTR0_SKXCCM0_TLDS1_ULSGRO0_USL1_UIOFGRO0_USFGROn1_VSn1_VWA1_VWB4_WSGRA0_WSGRB0_WS32_WG32_4_1_WGM8_WGMXCC1_WGMXCCGn1
    SolutionIndex: 83
    SolutionNameMin: Cijk_Ailk_Bljk_I8II_BH_SHB_HA_S_SCD_SAV_UserArgs_MT32x128x64_MI16x16x1_SN_LDSB0_AFC1_AG0_AFEM1_AFEM1_ASEM64_CLR1_CADS0_DTLA0_DTLB0_DTVA0_DTVB1_EPS1_FDSI0_GRPM1_GRVWA16_GRVWB16_GSUn1_GSUAMB_GSUC0_GSUWGMRR0_GLS0_ISA1201_IU1_K1_LDSTI0_LBSPPA512_LBSPPB0_LBSPPM0_LPA16_LPB0_LPM0_LRVW16_LWPMn1_MIAV1_MIWT1_4_MO40_NTn1_NTA0_NTB0_NTC0_NTD0_NTM0_NEPBS0_NLCA1_NLCB2_ONLL0_PGR1_PLR1_PKA0_SIA3_SS0_SU32_SUM0_SUS256_SPO0_SRVW0_SSO0_SVW8_SK0_SKFTR0_SKXCCM0_TLDS1_ULSGRO0_USL1_UIOFGRO0_USFGROn1_VSn1_VWA1_VWB4_WSGRA0_WSGRB0_WS32_WG32_4_1_WGM8_WGMXCC1_WGMXCCGn1
    SolutionIndex: 84
    SolutionNameMin: Cijk_Ailk_Bljk_I8II_BH_SHB_HA_S_SCD_SAV_UserArgs_MT32x128x64_MI16x16x1_SN_LDSB0_AFC1_AG0_AFEM1_AFEM1_ASEM64_CLR1_CADS0_DTLA0_DTLB0_DTVA0_DTVB1_EPS0_FDSI0_GRPM1_GRVWA16_GRVWB16_GSUn1_GSUAMB_GSUC0_GSUWGMRR0_GLS0_ISA1201_IU1_K1_LDSTI0_LBSPPA512_LBSPPB0_LBSPPM0_LPA16_LPB0_LPM0_LRVW16_LWPMn1_MIAV1_MIWT1_4_MO40_NTn1_NTA0_NTB0_NTC0_NTD0_NTM0_NEPBS0_NLCA1_NLCB2_ONLL0_PGR2_PLR1_PKA0_SIA3_SS0_SU32_SUM0_SUS256_SPO0_SRVW0_SSO0_SVW8_SK0_SKFTR0_SKXCCM0_TLDS1_ULSGRO0_USL1_UIOFGRO0_USFGROn1_VSn1_VWA1_VWB4_WSGRA0_WSGRB0_WS32_WG32_4_1_WGM8_WGMXCC1_WGMXCCGn1
    SolutionIndex: 85
    SolutionNameMin: Cijk_Ailk_Bljk_I8II_BH_SHB_HA_S_SCD_SAV_UserArgs_MT32x128x64_MI16x16x1_SN_LDSB0_AFC1_AG0_AFEM1_AFEM1_ASEM64_CLR1_CADS0_DTLA0_DTLB0_DTVA1_DTVB1_EPS0_FDSI0_GRPM1_GRVWA8_GRVWB8_GSUn1_GSUAMB_GSUC0_GSUWGMRR0_GLS0_ISA1201_IU1_K1_LDSTI0_LBSPPA0_LBSPPB0_LBSPPM0_LPA0_LPB0_LPM0_LRVW8_LWPMn1_MIAV1_MIWT1_4_MO40_NTn1_NTA0_NTB0_NTC0_NTD0_NTM0_NEPBS0_NLCA1_NLCB4_ONLL0_PGR1_PLR0_PKA0_SIA3_SS0_SU32_SUM0_SUS256_SPO0_SRVW0_SSO0_SVW8_SK0_SKFTR0_SKXCCM0_TLDS1_ULSGRO0_USL1_UIOFGRO0_USFGROn1_VSn1_VWA1_VWB4_WSGRA0_WSGRB0_WS32_WG32_4_1_WGM8_WGMXCC1_WGMXCCGn1
    SolutionIndex: 86
    SolutionNameMin: Cijk_Ailk_Bljk_I8II_BH_SHB_HA_S_SCD_SAV_UserArgs_MT64x128x64_MI16x16x1_SN_LDSB0_AFC1_AG0_AFEM1_AFEM1_ASEM1_CLR1_CADS0_DTLA0_DTLB0_DTVA1_DTVB0_EPS1_FDSI0_GRPM1_GRVWA8_GRVWB8_GSUn1_GSUAMB_GSUC0_GSUWGMRR0_GLS0_ISA1201_IU1_K1_LDSTI0_LBSPPA0_LBSPPB512_LBSPPM0_LPA0_LPB8_LPM0_LRVW8_LWPMn1_MIAV1_MIWT1_8_MO40_NTn1_NTA0_NTB0_NTC0_NTD0_NTM0_NEPBS0_NLCA1_NLCB1_ONLL0_PGR1_PLR1_PKA0_SIA3_SS0_SU32_SUM0_SUS256_SPO0_SRVW0_SSO0_SVW8_SK0_SKFTR0_SKXCCM0_TLDS1_ULSGRO0_USL1_UIOFGRO0_USFGROn1_VSn1_VWA1_VWB8_WSGRA0_WSGRB0_WS32_WG64_2_1_WGM8_WGMXCC1_WGMXCCGn1
    SolutionIndex: 87
    SolutionNameMin: Cijk_Ailk_Bljk_I8II_BH_SHB_HA_S_SCD_SAV_UserArgs_MT64x128x64_MI16x16x1_SN_LDSB0_AFC1_AG0_AFEM1_AFEM1_ASEM1_CLR1_CADS0_DTLA0_DTLB0_DTVA1_DTVB0_EPS0_FDSI0_GRPM1_GRVWA8_GRVWB8_GSUn1_GSUAMB_GSUC0_GSUWGMRR0_GLS0_ISA1201_IU1_K1_LDSTI0_LBSPPA0_LBSPPB512_LBSPPM0_LPA0_LPB8_LPM0_LRVW8_LWPMn1_MIAV1_MIWT1_8_MO40_NTn1_NTA0_NTB0_NTC0_NTD0_NTM0_NEPBS0_NLCA1_NLCB1_ONLL0_PGR2_PLR1_PKA0_SIA3_SS0_SU32_SUM0_SUS256_SPO0_SRVW0_SSO0_SVW8_SK0_SKFTR0_SKXCCM0_TLDS1_ULSGRO0_USL1_UIOFGRO0_USFGROn1_VSn1_VWA1_VWB8_WSGRA0_WSGRB0_WS32_WG64_2_1_WGM8_WGMXCC1_WGMXCCGn1
    SolutionIndex: 88
    SolutionNameMin: Cijk_Ailk_Bljk_I8II_BH_SHB_HA_S_SCD_SAV_UserArgs_MT128x16x64_MI16x16x1_SN_LDSB0_AFC1_AG0_AFEM1_AFEM1_ASEM64_CLR1_CADS0_DTLA0_DTLB0_DTVA1_DTVB1_EPS0_FDSI0_GRPM1_GRVWA8_GRVWB8_GSUn1_GSUAMB_GSUC0_GSUWGMRR0_GLS0_ISA1201_IU1_K1_LDSTI0_LBSPPA0_LBSPPB0_LBSPPM0_LPA0_LPB0_LPM0_LRVW8_LWPMn1_MIAV1_MIWT8_1_MO40_NTn1_NTA0_NTB0_NTC0_NTD0_NTM0_NEPBS0_NLCA4_NLCB4_ONLL0_PGR1_PLR0_PKA0_SIA3_SS0_SU32_SUM0_SUS256_SPO0_SRVW0_SSO0_SVW8_SK0_SKFTR0_SKXCCM0_TLDS1_ULSGRO0_USL1_UIOFGRO0_USFGROn1_VSn1_VWA1_VWB1_WSGRA0_WSGRB0_WS32_WG16_2_1_WGM8_WGMXCC1_WGMXCCGn1
    SolutionIndex: 89
    SolutionNameMin: Cijk_Ailk_Bljk_I8II_BH_SHB_HA_S_SCD_SAV_UserArgs_MT64x64x128_MI16x16x1_SN_LDSB0_AFC1_AG0_AFEM1_AFEM1_ASEM1_CLR1_CADS0_DTLA0_DTLB0_DTVA1_DTVB0_EPS1_FDSI0_GRPM1_GRVWA8_GRVWB8_GSUn1_GSUAMB_GSUC0_GSUWGMRR0_GLS0_ISA1201_IU1_K1_LDSTI0_LBSPPA0_LBSPPB256_LBSPPM0_LPA0_LPB8_LPM0_LRVW8_LWPMn1_MIAV1_MIWT2_2_MO40_NTn1_NTA0_NTB0_NTC0_NTD0_NTM0_NEPBS0_NLCA8_NLCB1_ONLL0_PGR1_PLR1_PKA0_SIA3_SS0_SU32_SUM0_SUS256_SPO0_SRVW0_SSO0_SVW8_SK0_SKFTR0_SKXCCM0_TLDS1_ULSGRO0_USL1_UIOFGRO0_USFGROn1_VSn1_VWA1_VWB2_WSGRA0_WSGRB0_WS32_WG32_4_1_WGM8_WGMXCC1_WGMXCCGn1
    SolutionIndex: 90
    SolutionNameMin: Cijk_Ailk_Bljk_I8II_BH_SHB_HA_S_SCD_SAV_UserArgs_MT64x64x128_MI16x16x1_SN_LDSB0_AFC1_AG0_AFEM1_AFEM1_ASEM1_CLR1_CADS0_DTLA0_DTLB0_DTVA1_DTVB0_EPS0_FDSI0_GRPM1_GRVWA8_GRVWB8_GSUn1_GSUAMB_GSUC0_GSUWGMRR0_GLS0_ISA1201_IU1_K1_LDSTI0_LBSPPA0_LBSPPB256_LBSPPM0_LPA0_LPB8_LPM0_LRVW8_LWPMn1_MIAV1_MIWT2_2_MO40_NTn1_NTA0_NTB0_NTC0_NTD0_NTM0_NEPBS0_NLCA8_NLCB1_ONLL0_PGR2_PLR1_PKA0_SIA3_SS0_SU32_SUM0_SUS256_SPO0_SRVW0_SSO0_SVW8_SK0_SKFTR0_SKXCCM0_TLDS1_ULSGRO0_USL1_UIOFGRO0_USFGROn1_VSn1_VWA1_VWB2_WSGRA0_WSGRB0_WS32_WG32_4_1_WGM8_WGMXCC1_WGMXCCGn1
    SolutionIndex: 91
    SolutionNameMin: Cijk_Ailk_Bljk_I8II_BH_SHB_HA_S_SCD_SAV_UserArgs_MT64x64x128_MI16x16x1_SN_LDSB0_AFC1_AG0_AFEM1_AFEM1_ASEM128_CLR1_CADS0_DTLA0_DTLB0_DTVA0_DTVB1_EPS1_FDSI0_GRPM1_GRVWA16_GRVWB16_GSUn1_GSUAMB_GSUC0_GSUWGMRR0_GLS0_ISA1201_IU1_K1_LDSTI0_LBSPPA1024_LBSPPB0_LBSPPM0_LPA32_LPB0_LPM0_LRVW16_LWPMn1_MIAV1_MIWT2_2_MO40_NTn1_NTA0_NTB0_NTC0_NTD0_NTM0_NEPBS0_NLCA1_NLCB4_ONLL0_PGR1_PLR1_PKA0_SIA3_SS0_SU32_SUM0_SUS256_SPO0_SRVW0_SSO0_SVW16_SK0_SKFTR0_SKXCCM0_TLDS1_ULSGRO0_USL1_UIOFGRO0_USFGROn1_VSn1_VWA2_VWB2_WSGRA0_WSGRB0_WS32_WG32_4_1_WGM8_WGMXCC1_WGMXCCGn1
    SolutionIndex: 92
    SolutionNameMin: Cijk_Ailk_Bljk_I8II_BH_SHB_HA_S_SCD_SAV_UserArgs_MT64x64x128_MI16x16x1_SN_LDSB0_AFC1_AG0_AFEM1_AFEM1_ASEM128_CLR1_CADS0_DTLA0_DTLB0_DTVA0_DTVB1_EPS0_FDSI0_GRPM1_GRVWA16_GRVWB16_GSUn1_GSUAMB_GSUC0_GSUWGMRR0_GLS0_ISA1201_IU1_K1_LDSTI0_LBSPPA1024_LBSPPB0_LBSPPM0_LPA32_LPB0_LPM0_LRVW16_LWPMn1_MIAV1_MIWT2_2_MO40_NTn1_NTA0_NTB0_NTC0_NTD0_NTM0_NEPBS0_NLCA1_NLCB4_ONLL0_PGR2_PLR1_PKA0_SIA3_SS0_SU32_SUM0_SUS256_SPO0_SRVW0_SSO0_SVW16_SK0_SKFTR0_SKXCCM0_TLDS1_ULSGRO0_USL1_UIOFGRO0_USFGROn1_VSn1_VWA2_VWB2_WSGRA0_WSGRB0_WS32_WG32_4_1_WGM8_WGMXCC1_WGMXCCGn1
    SolutionIndex: 93
    SolutionNameMin: Cijk_Ailk_Bljk_I8II_BH_SHB_HA_S_SCD_SAV_UserArgs_MT32x32x128_MI16x16x1_SN_LDSB0_AFC1_AG0_AFEM1_AFEM1_ASEM1_CLR1_CADS0_DTLA0_DTLB0_DTVA1_DTVB0_EPS1_FDSI0_GRPM1_GRVWA8_GRVWB8_GSUn1_GSUAMB_GSUC0_GSUWGMRR0_GLS0_ISA1201_IU1_K1_LDSTI0_LBSPPA0_LBSPPB128_LBSPPM0_LPA0_LPB8_LPM0_LRVW8_LWPMn1_MIAV1_MIWT1_1_MO40_NTn1_NTA0_NTB0_NTC0_NTD0_NTM0_NEPBS0_NLCA1_NLCB1_ONLL0_PGR1_PLR1_PKA0_SIA3_SS0_SU32_SUM0_SUS256_SPO0_SRVW0_SSO0_SVW8_SK0_SKFTR0_SKXCCM0_TLDS1_ULSGRO0_USL1_UIOFGRO0_USFGROn1_VSn1_VWA1_VWB1_WSGRA0_WSGRB0_WS32_WG32_4_1_WGM8_WGMXCC1_WGMXCCGn1
    SolutionIndex: 94
    SolutionNameMin: Cijk_Ailk_Bljk_I8II_BH_SHB_HA_S_SCD_SAV_UserArgs_MT32x32x128_MI16x16x1_SN_LDSB0_AFC1_AG0_AFEM1_AFEM1_ASEM1_CLR1_CADS0_DTLA0_DTLB0_DTVA1_DTVB0_EPS0_FDSI0_GRPM1_GRVWA8_GRVWB8_GSUn1_GSUAMB_GSUC0_GSUWGMRR0_GLS0_ISA1201_IU1_K1_LDSTI0_LBSPPA0_LBSPPB128_LBSPPM0_LPA0_LPB8_LPM0_LRVW8_LWPMn1_MIAV1_MIWT1_1_MO40_NTn1_NTA0_NTB0_NTC0_NTD0_NTM0_NEPBS0_NLCA1_NLCB1_ONLL0_PGR2_PLR1_PKA0_SIA3_SS0_SU32_SUM0_SUS256_SPO0_SRVW0_SSO0_SVW8_SK0_SKFTR0_SKXCCM0_TLDS1_ULSGRO0_USL1_UIOFGRO0_USFGROn1_VSn1_VWA1_VWB1_WSGRA0_WSGRB0_WS32_WG32_4_1_WGM8_WGMXCC1_WGMXCCGn1
    SolutionIndex: 95
    SolutionNameMin: Cijk_Ailk_Bljk_I8II_BH_SHB_HA_S_SCD_SAV_UserArgs_MT32x32x128_MI16x16x1_SN_LDSB0_AFC1_AG0_AFEM1_AFEM1_ASEM128_CLR1_CADS0_DTLA0_DTLB0_DTVA0_DTVB1_EPS1_FDSI0_GRPM1_GRVWA16_GRVWB16_GSUn1_GSUAMB_GSUC0_GSUWGMRR0_GLS0_ISA1201_IU1_K1_LDSTI0_LBSPPA512_LBSPPB0_LBSPPM0_LPA16_LPB0_LPM0_LRVW16_LWPMn1_MIAV1_MIWT1_1_MO40_NTn1_NTA0_NTB0_NTC0_NTD0_NTM0_NEPBS0_NLCA1_NLCB4_ONLL0_PGR1_PLR1_PKA0_SIA3_SS0_SU32_SUM0_SUS256_SPO0_SRVW0_SSO0_SVW8_SK0_SKFTR0_SKXCCM0_TLDS1_ULSGRO0_USL1_UIOFGRO0_USFGROn1_VSn1_VWA1_VWB1_WSGRA0_WSGRB0_WS32_WG32_4_1_WGM8_WGMXCC1_WGMXCCGn1
    SolutionIndex: 96
    SolutionNameMin: Cijk_Ailk_Bljk_I8II_BH_SHB_HA_S_SCD_SAV_UserArgs_MT32x32x128_MI16x16x1_SN_LDSB0_AFC1_AG0_AFEM1_AFEM1_ASEM128_CLR1_CADS0_DTLA0_DTLB0_DTVA0_DTVB1_EPS0_FDSI0_GRPM1_GRVWA16_GRVWB16_GSUn1_GSUAMB_GSUC0_GSUWGMRR0_GLS0_ISA1201_IU1_K1_LDSTI0_LBSPPA512_LBSPPB0_LBSPPM0_LPA16_LPB0_LPM0_LRVW16_LWPMn1_MIAV1_MIWT1_1_MO40_NTn1_NTA0_NTB0_NTC0_NTD0_NTM0_NEPBS0_NLCA1_NLCB4_ONLL0_PGR2_PLR1_PKA0_SIA3_SS0_SU32_SUM0_SUS256_SPO0_SRVW0_SSO0_SVW8_SK0_SKFTR0_SKXCCM0_TLDS1_ULSGRO0_USL1_UIOFGRO0_USFGROn1_VSn1_VWA1_VWB1_WSGRA0_WSGRB0_WS32_WG32_4_1_WGM8_WGMXCC1_WGMXCCGn1
    SolutionIndex: 97
    SolutionNameMin: Cijk_Ailk_Bljk_I8II_BH_SHB_HA_S_SCD_SAV_UserArgs_MT16x32x128_MI16x16x1_SN_LDSB0_AFC1_AG0_AFEM1_AFEM1_ASEM1_CLR1_CADS0_DTLA0_DTLB0_DTVA1_DTVB0_EPS1_FDSI0_GRPM1_GRVWA8_GRVWB8_GSUn1_GSUAMB_GSUC0_GSUWGMRR0_GLS0_ISA1201_IU1_K1_LDSTI0_LBSPPA0_LBSPPB128_LBSPPM0_LPA0_LPB8_LPM0_LRVW8_LWPMn1_MIAV1_MIWT1_1_MO40_NTn1_NTA0_NTB0_NTC0_NTD0_NTM0_NEPBS0_NLCA1_NLCB1_ONLL0_PGR1_PLR1_PKA0_SIA3_SS0_SU32_SUM0_SUS256_SPO0_SRVW0_SSO0_SVW8_SK0_SKFTR0_SKXCCM0_TLDS1_ULSGRO0_USL1_UIOFGRO0_USFGROn1_VSn1_VWA1_VWB1_WSGRA0_WSGRB0_WS32_WG16_4_1_WGM8_WGMXCC1_WGMXCCGn1
    SolutionIndex: 98
    SolutionNameMin: Cijk_Ailk_Bljk_I8II_BH_SHB_HA_S_SCD_SAV_UserArgs_MT16x32x128_MI16x16x1_SN_LDSB0_AFC1_AG0_AFEM1_AFEM1_ASEM1_CLR1_CADS0_DTLA0_DTLB0_DTVA1_DTVB0_EPS0_FDSI0_GRPM1_GRVWA8_GRVWB8_GSUn1_GSUAMB_GSUC0_GSUWGMRR0_GLS0_ISA1201_IU1_K1_LDSTI0_LBSPPA0_LBSPPB128_LBSPPM0_LPA0_LPB8_LPM0_LRVW8_LWPMn1_MIAV1_MIWT1_1_MO40_NTn1_NTA0_NTB0_NTC0_NTD0_NTM0_NEPBS0_NLCA1_NLCB1_ONLL0_PGR2_PLR1_PKA0_SIA3_SS0_SU32_SUM0_SUS256_SPO0_SRVW0_SSO0_SVW8_SK0_SKFTR0_SKXCCM0_TLDS1_ULSGRO0_USL1_UIOFGRO0_USFGROn1_VSn1_VWA1_VWB1_WSGRA0_WSGRB0_WS32_WG16_4_1_WGM8_WGMXCC1_WGMXCCGn1
    SolutionIndex: 99
    SolutionNameMin: Cijk_Ailk_Bljk_I8II_BH_SHB_HA_S_SCD_SAV_UserArgs_MT32x16x128_MI16x16x1_SN_LDSB0_AFC1_AG0_AFEM1_AFEM1_ASEM1_CLR1_CADS0_DTLA0_DTLB0_DTVA1_DTVB0_EPS1_FDSI0_GRPM1_GRVWA8_GRVWB8_GSUn1_GSUAMB_GSUC0_GSUWGMRR0_GLS0_ISA1201_IU1_K1_LDSTI0_LBSPPA0_LBSPPB128_LBSPPM0_LPA0_LPB8_LPM0_LRVW8_LWPMn1_MIAV1_MIWT1_1_MO40_NTn1_NTA0_NTB0_NTC0_NTD0_NTM0_NEPBS0_NLCA1_NLCB1_ONLL0_PGR1_PLR1_PKA0_SIA3_SS0_SU32_SUM0_SUS256_SPO0_SRVW0_SSO0_SVW8_SK0_SKFTR0_SKXCCM0_TLDS1_ULSGRO0_USL1_UIOFGRO0_USFGROn1_VSn1_VWA1_VWB1_WSGRA0_WSGRB0_WS32_WG32_2_1_WGM8_WGMXCC1_WGMXCCGn1
    SolutionIndex: 100
    SolutionNameMin: Cijk_Ailk_Bljk_I8II_BH_SHB_HA_S_SCD_SAV_UserArgs_MT32x16x128_MI16x16x1_SN_LDSB0_AFC1_AG0_AFEM1_AFEM1_ASEM1_CLR1_CADS0_DTLA0_DTLB0_DTVA1_DTVB0_EPS0_FDSI0_GRPM1_GRVWA8_GRVWB8_GSUn1_GSUAMB_GSUC0_GSUWGMRR0_GLS0_ISA1201_IU1_K1_LDSTI0_LBSPPA0_LBSPPB128_LBSPPM0_LPA0_LPB8_LPM0_LRVW8_LWPMn1_MIAV1_MIWT1_1_MO40_NTn1_NTA0_NTB0_NTC0_NTD0_NTM0_NEPBS0_NLCA1_NLCB1_ONLL0_PGR2_PLR1_PKA0_SIA3_SS0_SU32_SUM0_SUS256_SPO0_SRVW0_SSO0_SVW8_SK0_SKFTR0_SKXCCM0_TLDS1_ULSGRO0_USL1_UIOFGRO0_USFGROn1_VSn1_VWA1_VWB1_WSGRA0_WSGRB0_WS32_WG32_2_1_WGM8_WGMXCC1_WGMXCCGn1
    SolutionIndex: 101
    SolutionNameMin: Cijk_Ailk_Bljk_I8II_BH_SHB_HA_S_SCD_SAV_UserArgs_MT32x16x128_MI16x16x1_SN_LDSB0_AFC1_AG0_AFEM1_AFEM1_ASEM128_CLR1_CADS0_DTLA0_DTLB0_DTVA1_DTVB1_EPS0_FDSI0_GRPM1_GRVWA8_GRVWB8_GSUn1_GSUAMB_GSUC0_GSUWGMRR0_GLS0_ISA1201_IU1_K1_LDSTI0_LBSPPA0_LBSPPB0_LBSPPM0_LPA0_LPB0_LPM0_LRVW8_LWPMn1_MIAV1_MIWT1_1_MO40_NTn1_NTA0_NTB0_NTC0_NTD0_NTM0_NEPBS0_NLCA1_NLCB8_ONLL0_PGR1_PLR0_PKA0_SIA3_SS0_SU32_SUM0_SUS256_SPO0_SRVW0_SSO0_SVW8_SK0_SKFTR0_SKXCCM0_TLDS1_ULSGRO0_USL1_UIOFGRO0_USFGROn1_VSn1_VWA1_VWB1_WSGRA0_WSGRB0_WS32_WG32_2_1_WGM8_WGMXCC1_WGMXCCGn1
    SolutionIndex: 102
    SolutionNameMin: Cijk_Ailk_Bljk_I8II_BH_SHB_HA_S_SCD_SAV_UserArgs_MT16x16x128_MI16x16x1_SN_LDSB0_AFC1_AG0_AFEM1_AFEM1_ASEM1_CLR1_CADS0_DTLA0_DTLB0_DTVA1_DTVB0_EPS1_FDSI0_GRPM1_GRVWA8_GRVWB8_GSUn1_GSUAMB_GSUC0_GSUWGMRR0_GLS0_ISA1201_IU1_K1_LDSTI0_LBSPPA0_LBSPPB128_LBSPPM0_LPA0_LPB8_LPM0_LRVW8_LWPMn1_MIAV1_MIWT1_1_MO40_NTn1_NTA0_NTB0_NTC0_NTD0_NTM0_NEPBS0_NLCA1_NLCB1_ONLL0_PGR1_PLR1_PKA0_SIA3_SS0_SU32_SUM0_SUS256_SPO0_SRVW0_SSO0_SVW8_SK0_SKFTR0_SKXCCM0_TLDS1_ULSGRO0_USL1_UIOFGRO0_USFGROn1_VSn1_VWA1_VWB1_WSGRA0_WSGRB0_WS32_WG16_2_1_WGM8_WGMXCC1_WGMXCCGn1
    SolutionIndex: 103
    SolutionNameMin: Cijk_Ailk_Bljk_I8II_BH_SHB_HA_S_SCD_SAV_UserArgs_MT16x16x128_MI16x16x1_SN_LDSB0_AFC1_AG0_AFEM1_AFEM1_ASEM1_CLR1_CADS0_DTLA0_DTLB0_DTVA1_DTVB0_EPS0_FDSI0_GRPM1_GRVWA8_GRVWB8_GSUn1_GSUAMB_GSUC0_GSUWGMRR0_GLS0_ISA1201_IU1_K1_LDSTI0_LBSPPA0_LBSPPB128_LBSPPM0_LPA0_LPB8_LPM0_LRVW8_LWPMn1_MIAV1_MIWT1_1_MO40_NTn1_NTA0_NTB0_NTC0_NTD0_NTM0_NEPBS0_NLCA1_NLCB1_ONLL0_PGR2_PLR1_PKA0_SIA3_SS0_SU32_SUM0_SUS256_SPO0_SRVW0_SSO0_SVW8_SK0_SKFTR0_SKXCCM0_TLDS1_ULSGRO0_USL1_UIOFGRO0_USFGROn1_VSn1_VWA1_VWB1_WSGRA0_WSGRB0_WS32_WG16_2_1_WGM8_WGMXCC1_WGMXCCGn1
    SolutionIndex: 104
    SolutionNameMin: Cijk_Ailk_Bljk_I8II_BH_SHB_HA_S_SCD_SAV_UserArgs_MT128x32x128_MI16x16x1_SN_LDSB0_AFC1_AG0_AFEM1_AFEM1_ASEM1_CLR1_CADS0_DTLA0_DTLB0_DTVA1_DTVB0_EPS1_FDSI0_GRPM1_GRVWA8_GRVWB8_GSUn1_GSUAMB_GSUC0_GSUWGMRR0_GLS0_ISA1201_IU1_K1_LDSTI0_LBSPPA0_LBSPPB128_LBSPPM0_LPA0_LPB8_LPM0_LRVW8_LWPMn1_MIAV1_MIWT4_1_MO40_NTn1_NTA0_NTB0_NTC0_NTD0_NTM0_NEPBS0_NLCA8_NLCB1_ONLL0_PGR1_PLR1_PKA0_SIA3_SS0_SU32_SUM0_SUS256_SPO0_SRVW0_SSO0_SVW8_SK0_SKFTR0_SKXCCM0_TLDS1_ULSGRO0_USL1_UIOFGRO0_USFGROn1_VSn1_VWA1_VWB1_WSGRA0_WSGRB0_WS32_WG32_4_1_WGM8_WGMXCC1_WGMXCCGn1
    SolutionIndex: 105
    SolutionNameMin: Cijk_Ailk_Bljk_I8II_BH_SHB_HA_S_SCD_SAV_UserArgs_MT128x32x128_MI16x16x1_SN_LDSB0_AFC1_AG0_AFEM1_AFEM1_ASEM1_CLR1_CADS0_DTLA0_DTLB0_DTVA1_DTVB0_EPS0_FDSI0_GRPM1_GRVWA8_GRVWB8_GSUn1_GSUAMB_GSUC0_GSUWGMRR0_GLS0_ISA1201_IU1_K1_LDSTI0_LBSPPA0_LBSPPB128_LBSPPM0_LPA0_LPB8_LPM0_LRVW8_LWPMn1_MIAV1_MIWT4_1_MO40_NTn1_NTA0_NTB0_NTC0_NTD0_NTM0_NEPBS0_NLCA8_NLCB1_ONLL0_PGR2_PLR1_PKA0_SIA3_SS0_SU32_SUM0_SUS256_SPO0_SRVW0_SSO0_SVW8_SK0_SKFTR0_SKXCCM0_TLDS1_ULSGRO0_USL1_UIOFGRO0_USFGROn1_VSn1_VWA1_VWB1_WSGRA0_WSGRB0_WS32_WG32_4_1_WGM8_WGMXCC1_WGMXCCGn1
    SolutionIndex: 106
    SolutionNameMin: Cijk_Ailk_Bljk_I8II_BH_SHB_HA_S_SCD_SAV_UserArgs_MT32x128x128_MI16x16x1_SN_LDSB1_AFC1_AG0_AFEM1_AFEM1_ASEM1_CLR1_CADS0_DTLA0_DTLB0_DTVA1_DTVB0_EPS1_FDSI0_GRPM1_GRVWA8_GRVWB8_GSUn1_GSUAMB_GSUC0_GSUWGMRR0_GLS0_ISA1201_IU1_K1_LDSTI0_LBSPPA0_LBSPPB512_LBSPPM0_LPA0_LPB8_LPM0_LRVW8_LWPMn1_MIAV1_MIWT1_4_MO40_NTn1_NTA0_NTB0_NTC0_NTD0_NTM0_NEPBS0_NLCA1_NLCB1_ONLL0_PGR1_PLR1_PKA0_SIA3_SS0_SU32_SUM0_SUS256_SPO0_SRVW0_SSO0_SVW8_SK0_SKFTR0_SKXCCM0_TLDS1_ULSGRO0_USL1_UIOFGRO0_USFGROn1_VSn1_VWA1_VWB4_WSGRA0_WSGRB0_WS32_WG32_4_1_WGM8_WGMXCC1_WGMXCCGn1
    SolutionIndex: 107
    SolutionNameMin: Cijk_Ailk_Bljk_I8II_BH_SHB_HA_S_SCD_SAV_UserArgs_MT32x128x128_MI16x16x1_SN_LDSB0_AFC1_AG0_AFEM1_AFEM1_ASEM128_CLR1_CADS0_DTLA0_DTLB0_DTVA0_DTVB1_EPS1_FDSI0_GRPM1_GRVWA16_GRVWB16_GSUn1_GSUAMB_GSUC0_GSUWGMRR0_GLS0_ISA1201_IU1_K1_LDSTI0_LBSPPA512_LBSPPB0_LBSPPM0_LPA16_LPB0_LPM0_LRVW16_LWPMn1_MIAV1_MIWT1_4_MO40_NTn1_NTA0_NTB0_NTC0_NTD0_NTM0_NEPBS0_NLCA1_NLCB4_ONLL0_PGR1_PLR1_PKA0_SIA3_SS0_SU32_SUM0_SUS256_SPO0_SRVW0_SSO0_SVW8_SK0_SKFTR0_SKXCCM0_TLDS1_ULSGRO0_USL1_UIOFGRO0_USFGROn1_VSn1_VWA1_VWB4_WSGRA0_WSGRB0_WS32_WG32_4_1_WGM8_WGMXCC1_WGMXCCGn1
    SolutionIndex: 108
    SolutionNameMin: Cijk_Ailk_Bljk_I8II_BH_SHB_HA_S_SCD_SAV_UserArgs_MT32x32x256_MI16x16x1_SN_LDSB0_AFC1_AG0_AFEM1_AFEM1_ASEM1_CLR1_CADS0_DTLA0_DTLB0_DTVA1_DTVB0_EPS1_FDSI0_GRPM1_GRVWA8_GRVWB8_GSUn1_GSUAMB_GSUC0_GSUWGMRR0_GLS0_ISA1201_IU1_K1_LDSTI0_LBSPPA0_LBSPPB256_LBSPPM0_LPA0_LPB8_LPM0_LRVW8_LWPMn1_MIAV1_MIWT1_1_MO40_NTn1_NTA0_NTB0_NTC0_NTD0_NTM0_NEPBS0_NLCA1_NLCB1_ONLL0_PGR1_PLR1_PKA0_SIA3_SS0_SU32_SUM0_SUS256_SPO0_SRVW0_SSO0_SVW8_SK0_SKFTR0_SKXCCM0_TLDS1_ULSGRO0_USL1_UIOFGRO0_USFGROn1_VSn1_VWA1_VWB1_WSGRA0_WSGRB0_WS32_WG32_4_1_WGM8_WGMXCC1_WGMXCCGn1
    SolutionIndex: 109
    SolutionNameMin: Cijk_Ailk_Bljk_I8II_BH_SHB_HA_S_SCD_SAV_UserArgs_MT32x32x256_MI16x16x1_SN_LDSB0_AFC1_AG0_AFEM1_AFEM1_ASEM1_CLR1_CADS0_DTLA0_DTLB0_DTVA1_DTVB0_EPS0_FDSI0_GRPM1_GRVWA8_GRVWB8_GSUn1_GSUAMB_GSUC0_GSUWGMRR0_GLS0_ISA1201_IU1_K1_LDSTI0_LBSPPA0_LBSPPB256_LBSPPM0_LPA0_LPB8_LPM0_LRVW8_LWPMn1_MIAV1_MIWT1_1_MO40_NTn1_NTA0_NTB0_NTC0_NTD0_NTM0_NEPBS0_NLCA1_NLCB1_ONLL0_PGR2_PLR1_PKA0_SIA3_SS0_SU32_SUM0_SUS256_SPO0_SRVW0_SSO0_SVW8_SK0_SKFTR0_SKXCCM0_TLDS1_ULSGRO0_USL1_UIOFGRO0_USFGROn1_VSn1_VWA1_VWB1_WSGRA0_WSGRB0_WS32_WG32_4_1_WGM8_WGMXCC1_WGMXCCGn1
    SolutionIndex: 110
    SolutionNameMin: Cijk_Ailk_Bljk_I8II_BH_SHB_HA_S_SCD_SAV_UserArgs_MT32x32x256_MI16x16x1_SN_LDSB0_AFC1_AG0_AFEM1_AFEM1_ASEM256_CLR1_CADS0_DTLA0_DTLB0_DTVA0_DTVB1_EPS1_FDSI0_GRPM1_GRVWA16_GRVWB16_GSUn1_GSUAMB_GSUC0_GSUWGMRR0_GLS0_ISA1201_IU1_K1_LDSTI0_LBSPPA512_LBSPPB0_LBSPPM0_LPA16_LPB0_LPM0_LRVW16_LWPMn1_MIAV1_MIWT1_1_MO40_NTn1_NTA0_NTB0_NTC0_NTD0_NTM0_NEPBS0_NLCA1_NLCB8_ONLL0_PGR1_PLR1_PKA0_SIA3_SS0_SU32_SUM0_SUS256_SPO0_SRVW0_SSO0_SVW8_SK0_SKFTR0_SKXCCM0_TLDS1_ULSGRO0_USL1_UIOFGRO0_USFGROn1_VSn1_VWA1_VWB1_WSGRA0_WSGRB0_WS32_WG32_4_1_WGM8_WGMXCC1_WGMXCCGn1
    SolutionIndex: 111
    SolutionNameMin: Cijk_Ailk_Bljk_I8II_BH_SHB_HA_S_SCD_SAV_UserArgs_MT16x32x256_MI16x16x1_SN_LDSB0_AFC1_AG0_AFEM1_AFEM1_ASEM1_CLR1_CADS0_DTLA0_DTLB0_DTVA1_DTVB0_EPS1_FDSI0_GRPM1_GRVWA8_GRVWB8_GSUn1_GSUAMB_GSUC0_GSUWGMRR0_GLS0_ISA1201_IU1_K1_LDSTI0_LBSPPA0_LBSPPB256_LBSPPM0_LPA0_LPB8_LPM0_LRVW8_LWPMn1_MIAV1_MIWT1_1_MO40_NTn1_NTA0_NTB0_NTC0_NTD0_NTM0_NEPBS0_NLCA1_NLCB1_ONLL0_PGR1_PLR1_PKA0_SIA3_SS0_SU32_SUM0_SUS256_SPO0_SRVW0_SSO0_SVW8_SK0_SKFTR0_SKXCCM0_TLDS1_ULSGRO0_USL1_UIOFGRO0_USFGROn1_VSn1_VWA1_VWB1_WSGRA0_WSGRB0_WS32_WG16_4_1_WGM8_WGMXCC1_WGMXCCGn1
    SolutionIndex: 112
    SolutionNameMin: Cijk_Ailk_Bljk_I8II_BH_SHB_HA_S_SCD_SAV_UserArgs_MT32x16x256_MI16x16x1_SN_LDSB0_AFC1_AG0_AFEM1_AFEM1_ASEM1_CLR1_CADS0_DTLA0_DTLB0_DTVA1_DTVB0_EPS1_FDSI0_GRPM1_GRVWA8_GRVWB8_GSUn1_GSUAMB_GSUC0_GSUWGMRR0_GLS0_ISA1201_IU1_K1_LDSTI0_LBSPPA0_LBSPPB256_LBSPPM0_LPA0_LPB8_LPM0_LRVW8_LWPMn1_MIAV1_MIWT1_1_MO40_NTn1_NTA0_NTB0_NTC0_NTD0_NTM0_NEPBS0_NLCA1_NLCB1_ONLL0_PGR1_PLR1_PKA0_SIA3_SS0_SU32_SUM0_SUS256_SPO0_SRVW0_SSO0_SVW8_SK0_SKFTR0_SKXCCM0_TLDS1_ULSGRO0_USL1_UIOFGRO0_USFGROn1_VSn1_VWA1_VWB1_WSGRA0_WSGRB0_WS32_WG32_2_1_WGM8_WGMXCC1_WGMXCCGn1
    SolutionIndex: 113
    SolutionNameMin: Cijk_Ailk_Bljk_I8II_BH_SHB_HA_S_SCD_SAV_UserArgs_MT32x16x256_MI16x16x1_SN_LDSB0_AFC1_AG0_AFEM1_AFEM1_ASEM1_CLR1_CADS0_DTLA0_DTLB0_DTVA1_DTVB0_EPS0_FDSI0_GRPM1_GRVWA8_GRVWB8_GSUn1_GSUAMB_GSUC0_GSUWGMRR0_GLS0_ISA1201_IU1_K1_LDSTI0_LBSPPA0_LBSPPB256_LBSPPM0_LPA0_LPB8_LPM0_LRVW8_LWPMn1_MIAV1_MIWT1_1_MO40_NTn1_NTA0_NTB0_NTC0_NTD0_NTM0_NEPBS0_NLCA1_NLCB1_ONLL0_PGR2_PLR1_PKA0_SIA3_SS0_SU32_SUM0_SUS256_SPO0_SRVW0_SSO0_SVW8_SK0_SKFTR0_SKXCCM0_TLDS1_ULSGRO0_USL1_UIOFGRO0_USFGROn1_VSn1_VWA1_VWB1_WSGRA0_WSGRB0_WS32_WG32_2_1_WGM8_WGMXCC1_WGMXCCGn1
    SolutionIndex: 114
    SolutionNameMin: Cijk_Ailk_Bljk_I8II_BH_SHB_HA_S_SCD_SAV_UserArgs_MT16x16x256_MI16x16x1_SN_LDSB0_AFC1_AG0_AFEM1_AFEM1_ASEM1_CLR1_CADS0_DTLA0_DTLB0_DTVA1_DTVB0_EPS1_FDSI0_GRPM1_GRVWA8_GRVWB8_GSUn1_GSUAMB_GSUC0_GSUWGMRR0_GLS0_ISA1201_IU1_K1_LDSTI0_LBSPPA0_LBSPPB256_LBSPPM0_LPA0_LPB8_LPM0_LRVW8_LWPMn1_MIAV1_MIWT1_1_MO40_NTn1_NTA0_NTB0_NTC0_NTD0_NTM0_NEPBS0_NLCA1_NLCB1_ONLL0_PGR1_PLR1_PKA0_SIA3_SS0_SU32_SUM0_SUS256_SPO0_SRVW0_SSO0_SVW8_SK0_SKFTR0_SKXCCM0_TLDS1_ULSGRO0_USL1_UIOFGRO0_USFGROn1_VSn1_VWA1_VWB1_WSGRA0_WSGRB0_WS32_WG16_2_1_WGM8_WGMXCC1_WGMXCCGn1
    SolutionIndex: 115
    SolutionNameMin: Cijk_Ailk_Bljk_I8II_BH_SHB_HA_S_SCD_SAV_UserArgs_MT16x16x256_MI16x16x1_SN_LDSB0_AFC1_AG0_AFEM1_AFEM1_ASEM1_CLR1_CADS0_DTLA0_DTLB0_DTVA1_DTVB0_EPS0_FDSI0_GRPM1_GRVWA8_GRVWB8_GSUn1_GSUAMB_GSUC0_GSUWGMRR0_GLS0_ISA1201_IU1_K1_LDSTI0_LBSPPA0_LBSPPB256_LBSPPM0_LPA0_LPB8_LPM0_LRVW8_LWPMn1_MIAV1_MIWT1_1_MO40_NTn1_NTA0_NTB0_NTC0_NTD0_NTM0_NEPBS0_NLCA1_NLCB1_ONLL0_PGR2_PLR1_PKA0_SIA3_SS0_SU32_SUM0_SUS256_SPO0_SRVW0_SSO0_SVW8_SK0_SKFTR0_SKXCCM0_TLDS1_ULSGRO0_USL1_UIOFGRO0_USFGROn1_VSn1_VWA1_VWB1_WSGRA0_WSGRB0_WS32_WG16_2_1_WGM8_WGMXCC1_WGMXCCGn1
    SolutionIndex: 116
    SolutionNameMin: Cijk_Ailk_Bljk_I8II_BH_SHB_HA_S_SCD_SAV_UserArgs_MT128x128x16_MI16x16x1_SN_LDSB0_AFC1_AG0_AFEM1_AFEM1_ASEM16_CLR1_CADS0_DTLA0_DTLB0_DTVA1_DTVB1_EPS0_FDSI0_GRPM1_GRVWA8_GRVWB8_GSUn1_GSUAMB_GSUC0_GSUWGMRR0_GLS0_ISA1201_IU1_K1_LDSTI0_LBSPPA0_LBSPPB0_LBSPPM0_LPA0_LPB0_LPM0_LRVW8_LWPMn1_MIAV1_MIWT8_2_MO40_NTn1_NTA0_NTB0_NTC0_NTD0_NTM0_NEPBS0_NLCA1_NLCB1_ONLL0_PGR1_PLR0_PKA0_SIA3_SS1_SU32_SUM0_SUS256_SPO0_SRVW0_SSO0_SVW1_SK0_SKFTR0_SKXCCM0_TLDS1_ULSGRO0_USL1_UIOFGRO0_USFGROn1_VSn1_VWA1_VWB2_WSGRA0_WSGRB0_WS32_WG16_8_1_WGM8_WGMXCC1_WGMXCCGn1
    SolutionIndex: 117
    SolutionNameMin: Cijk_Ailk_Bljk_I8II_BH_SHB_HA_S_SCD_SAV_UserArgs_MT128x128x16_MI16x16x1_SN_LDSB1_AFC1_AG0_AFEM1_AFEM1_ASEM1_CLR1_CADS0_DTLA0_DTLB0_DTVA0_DTVB0_EPS1_FDSI0_GRPM1_GRVWA16_GRVWB8_GSUn1_GSUAMB_GSUC0_GSUWGMRR0_GLS0_ISA1201_IU1_K1_LDSTI0_LBSPPA1024_LBSPPB128_LBSPPM0_LPA64_LPB8_LPM0_LRVW8_LWPMn1_MIAV1_MIWT4_4_MO40_NTn1_NTA0_NTB0_NTC0_NTD0_NTM0_NEPBS0_NLCA1_NLCB1_ONLL0_PGR1_PLR1_PKA0_SIA2_SS1_SU32_SUM0_SUS256_SPO0_SRVW0_SSO0_SVW4_SK0_SKFTR0_SKXCCM0_TLDS1_ULSGRO0_USL1_UIOFGRO0_USFGROn1_VSn1_VWA4_VWB4_WSGRA0_WSGRB0_WS32_WG32_4_1_WGM8_WGMXCC1_WGMXCCGn1
    SolutionIndex: 118
    SolutionNameMin: Cijk_Ailk_Bljk_I8II_BH_SHB_HA_S_SCD_SAV_UserArgs_MT128x128x16_MI16x16x1_SN_LDSB1_AFC1_AG0_AFEM1_AFEM1_ASEM1_CLR1_CADS0_DTLA0_DTLB0_DTVA0_DTVB0_EPS0_FDSI0_GRPM1_GRVWA16_GRVWB8_GSUn1_GSUAMB_GSUC0_GSUWGMRR0_GLS0_ISA1201_IU1_K1_LDSTI0_LBSPPA1024_LBSPPB128_LBSPPM0_LPA64_LPB8_LPM0_LRVW8_LWPMn1_MIAV1_MIWT4_4_MO40_NTn1_NTA0_NTB0_NTC0_NTD0_NTM0_NEPBS0_NLCA1_NLCB1_ONLL0_PGR2_PLR1_PKA0_SIA2_SS1_SU32_SUM0_SUS256_SPO0_SRVW0_SSO0_SVW4_SK0_SKFTR0_SKXCCM0_TLDS1_ULSGRO0_USL1_UIOFGRO0_USFGROn1_VSn1_VWA4_VWB4_WSGRA0_WSGRB0_WS32_WG32_4_1_WGM8_WGMXCC1_WGMXCCGn1
    SolutionIndex: 119
    SolutionNameMin: Cijk_Ailk_Bljk_I8II_BH_SHB_HA_S_SCD_SAV_UserArgs_MT128x128x16_MI16x16x1_SN_LDSB1_AFC1_AG0_AFEM1_AFEM1_ASEM1_CLR1_CADS0_DTLA0_DTLB0_DTVA0_DTVB0_EPS0_FDSI0_GRPM1_GRVWA8_GRVWB8_GSUn1_GSUAMB_GSUC0_GSUWGMRR0_GLS0_ISA1201_IU1_K1_LDSTI0_LBSPPA1024_LBSPPB128_LBSPPM0_LPA64_LPB8_LPM0_LRVW8_LWPMn1_MIAV1_MIWT4_4_MO40_NTn1_NTA0_NTB0_NTC0_NTD0_NTM0_NEPBS0_NLCA1_NLCB1_ONLL0_PGR2_PLR1_PKA0_SIA2_SS1_SU32_SUM0_SUS256_SPO0_SRVW0_SSO0_SVW4_SK0_SKFTR0_SKXCCM0_TLDS1_ULSGRO1_USL1_UIOFGRO0_USFGROn1_VSn1_VWA4_VWB4_WSGRA0_WSGRB0_WS32_WG32_4_1_WGM8_WGMXCC1_WGMXCCGn1
    SolutionIndex: 120
    SolutionNameMin: Cijk_Ailk_Bljk_I8II_BH_SHB_HA_S_SCD_SAV_UserArgs_MT128x128x16_MI16x16x1_SN_LDSB0_AFC1_AG0_AFEM1_AFEM1_ASEM16_CLR1_CADS0_DTLA0_DTLB0_DTVA1_DTVB1_EPS0_FDSI0_GRPM1_GRVWA8_GRVWB8_GSUn1_GSUAMB_GSUC0_GSUWGMRR0_GLS0_ISA1201_IU1_K1_LDSTI0_LBSPPA0_LBSPPB0_LBSPPM0_LPA0_LPB0_LPM0_LRVW8_LWPMn1_MIAV1_MIWT4_4_MO40_NTn1_NTA0_NTB0_NTC0_NTD0_NTM0_NEPBS0_NLCA1_NLCB1_ONLL0_PGR1_PLR0_PKA0_SIA3_SS1_SU32_SUM0_SUS256_SPO0_SRVW0_SSO0_SVW1_SK0_SKFTR0_SKXCCM0_TLDS1_ULSGRO0_USL1_UIOFGRO0_USFGROn1_VSn1_VWA1_VWB4_WSGRA0_WSGRB0_WS32_WG32_4_1_WGM8_WGMXCC1_WGMXCCGn1
    SolutionIndex: 121
    SolutionNameMin: Cijk_Ailk_Bljk_I8II_BH_SHB_HA_S_SCD_SAV_UserArgs_MT128x128x32_MI16x16x1_SN_LDSB0_AFC1_AG0_AFEM1_AFEM1_ASEM1_CLR1_CADS0_DTLA0_DTLB0_DTVA1_DTVB0_EPS1_FDSI0_GRPM1_GRVWA8_GRVWB8_GSUn1_GSUAMB_GSUC0_GSUWGMRR0_GLS0_ISA1201_IU1_K1_LDSTI0_LBSPPA0_LBSPPB128_LBSPPM0_LPA0_LPB8_LPM0_LRVW8_LWPMn1_MIAV1_MIWT8_2_MO40_NTn1_NTA0_NTB0_NTC0_NTD0_NTM0_NEPBS0_NLCA2_NLCB1_ONLL0_PGR1_PLR1_PKA0_SIA3_SS1_SU32_SUM0_SUS256_SPO0_SRVW0_SSO0_SVW1_SK0_SKFTR0_SKXCCM0_TLDS1_ULSGRO0_USL1_UIOFGRO0_USFGROn1_VSn1_VWA1_VWB2_WSGRA0_WSGRB0_WS32_WG16_8_1_WGM8_WGMXCC1_WGMXCCGn1
    SolutionIndex: 122
    SolutionNameMin: Cijk_Ailk_Bljk_I8II_BH_SHB_HA_S_SCD_SAV_UserArgs_MT128x128x32_MI16x16x1_SN_LDSB0_AFC1_AG0_AFEM1_AFEM1_ASEM1_CLR1_CADS0_DTLA0_DTLB0_DTVA1_DTVB0_EPS0_FDSI0_GRPM1_GRVWA8_GRVWB8_GSUn1_GSUAMB_GSUC0_GSUWGMRR0_GLS0_ISA1201_IU1_K1_LDSTI0_LBSPPA0_LBSPPB128_LBSPPM0_LPA0_LPB8_LPM0_LRVW8_LWPMn1_MIAV1_MIWT8_2_MO40_NTn1_NTA0_NTB0_NTC0_NTD0_NTM0_NEPBS0_NLCA2_NLCB1_ONLL0_PGR2_PLR1_PKA0_SIA3_SS1_SU32_SUM0_SUS256_SPO0_SRVW0_SSO0_SVW1_SK0_SKFTR0_SKXCCM0_TLDS1_ULSGRO0_USL1_UIOFGRO0_USFGROn1_VSn1_VWA1_VWB2_WSGRA0_WSGRB0_WS32_WG16_8_1_WGM8_WGMXCC1_WGMXCCGn1
    SolutionIndex: 123
    SolutionNameMin: Cijk_Ailk_Bljk_I8II_BH_SHB_HA_S_SCD_SAV_UserArgs_MT128x128x32_MI16x16x1_SN_LDSB0_AFC1_AG0_AFEM1_AFEM1_ASEM32_CLR1_CADS0_DTLA0_DTLB0_DTVA0_DTVB1_EPS1_FDSI0_GRPM1_GRVWA16_GRVWB8_GSUn1_GSUAMB_GSUC0_GSUWGMRR0_GLS0_ISA1201_IU1_K1_LDSTI0_LBSPPA1024_LBSPPB0_LBSPPM0_LPA0_LPB0_LPM0_LRVW8_LWPMn1_MIAV1_MIWT8_2_MO40_NTn1_NTA0_NTB0_NTC0_NTD0_NTM0_NEPBS0_NLCA1_NLCB2_ONLL0_PGR1_PLR1_PKA0_SIA3_SS1_SU32_SUM0_SUS256_SPO0_SRVW0_SSO0_SVW8_SK0_SKFTR0_SKXCCM0_TLDS1_ULSGRO0_USL1_UIOFGRO0_USFGROn1_VSn1_VWA8_VWB2_WSGRA0_WSGRB0_WS32_WG16_8_1_WGM8_WGMXCC1_WGMXCCGn1
    SolutionIndex: 124
    SolutionNameMin: Cijk_Ailk_Bljk_I8II_BH_SHB_HA_S_SCD_SAV_UserArgs_MT128x128x32_MI16x16x1_SN_LDSB1_AFC1_AG0_AFEM1_AFEM1_ASEM1_CLR1_CADS0_DTLA0_DTLB0_DTVA0_DTVB0_EPS1_FDSI0_GRPM1_GRVWA16_GRVWB8_GSUn1_GSUAMB_GSUC0_GSUWGMRR0_GLS0_ISA1201_IU2_K1_LDSTI0_LBSPPA1024_LBSPPB128_LBSPPM0_LPA64_LPB8_LPM0_LRVW8_LWPMn1_MIAV1_MIWT4_4_MO40_NTn1_NTA0_NTB0_NTC0_NTD0_NTM0_NEPBS0_NLCA1_NLCB1_ONLL0_PGR1_PLR1_PKA0_SIA2_SS1_SU32_SUM0_SUS256_SPO0_SRVW0_SSO0_SVW4_SK0_SKFTR0_SKXCCM0_TLDS1_ULSGRO0_USL1_UIOFGRO0_USFGROn1_VSn1_VWA4_VWB4_WSGRA0_WSGRB0_WS32_WG32_4_1_WGM8_WGMXCC1_WGMXCCGn1
    SolutionIndex: 125
    SolutionNameMin: Cijk_Ailk_Bljk_I8II_BH_SHB_HA_S_SCD_SAV_UserArgs_MT128x128x32_MI16x16x1_SN_LDSB1_AFC1_AG0_AFEM1_AFEM1_ASEM1_CLR1_CADS0_DTLA0_DTLB0_DTVA0_DTVB0_EPS0_FDSI0_GRPM1_GRVWA16_GRVWB8_GSUn1_GSUAMB_GSUC0_GSUWGMRR0_GLS0_ISA1201_IU2_K1_LDSTI0_LBSPPA1024_LBSPPB128_LBSPPM0_LPA64_LPB8_LPM0_LRVW8_LWPMn1_MIAV1_MIWT4_4_MO40_NTn1_NTA0_NTB0_NTC0_NTD0_NTM0_NEPBS0_NLCA1_NLCB1_ONLL0_PGR2_PLR1_PKA0_SIA2_SS1_SU32_SUM0_SUS256_SPO0_SRVW0_SSO0_SVW4_SK0_SKFTR0_SKXCCM0_TLDS1_ULSGRO0_USL1_UIOFGRO0_USFGROn1_VSn1_VWA4_VWB4_WSGRA0_WSGRB0_WS32_WG32_4_1_WGM8_WGMXCC1_WGMXCCGn1
    SolutionIndex: 126
    SolutionNameMin: Cijk_Ailk_Bljk_I8II_BH_SHB_HA_S_SCD_SAV_UserArgs_MT128x128x32_MI16x16x1_SN_LDSB1_AFC1_AG0_AFEM1_AFEM1_ASEM1_CLR1_CADS0_DTLA0_DTLB0_DTVA0_DTVB0_EPS0_FDSI0_GRPM1_GRVWA8_GRVWB8_GSUn1_GSUAMB_GSUC0_GSUWGMRR0_GLS0_ISA1201_IU2_K1_LDSTI0_LBSPPA1024_LBSPPB128_LBSPPM0_LPA64_LPB8_LPM0_LRVW8_LWPMn1_MIAV1_MIWT4_4_MO40_NTn1_NTA0_NTB0_NTC0_NTD0_NTM0_NEPBS0_NLCA1_NLCB1_ONLL0_PGR2_PLR1_PKA0_SIA2_SS1_SU32_SUM0_SUS256_SPO0_SRVW0_SSO0_SVW4_SK0_SKFTR0_SKXCCM0_TLDS1_ULSGRO1_USL1_UIOFGRO0_USFGROn1_VSn1_VWA4_VWB4_WSGRA0_WSGRB0_WS32_WG32_4_1_WGM8_WGMXCC1_WGMXCCGn1
    SolutionIndex: 127
    SolutionNameMin: Cijk_Ailk_Bljk_I8II_BH_SHB_HA_S_SCD_SAV_UserArgs_MT128x128x32_MI16x16x1_SN_LDSB0_AFC1_AG0_AFEM1_AFEM1_ASEM1_CLR1_CADS0_DTLA0_DTLB0_DTVA1_DTVB0_EPS1_FDSI0_GRPM1_GRVWA8_GRVWB8_GSUn1_GSUAMB_GSUC0_GSUWGMRR0_GLS0_ISA1201_IU1_K1_LDSTI0_LBSPPA0_LBSPPB128_LBSPPM0_LPA0_LPB8_LPM0_LRVW8_LWPMn1_MIAV1_MIWT4_4_MO40_NTn1_NTA0_NTB0_NTC0_NTD0_NTM0_NEPBS0_NLCA2_NLCB1_ONLL0_PGR1_PLR1_PKA0_SIA3_SS1_SU32_SUM0_SUS256_SPO0_SRVW0_SSO0_SVW1_SK0_SKFTR0_SKXCCM0_TLDS1_ULSGRO0_USL1_UIOFGRO0_USFGROn1_VSn1_VWA1_VWB4_WSGRA0_WSGRB0_WS32_WG32_4_1_WGM8_WGMXCC1_WGMXCCGn1
    SolutionIndex: 128
    SolutionNameMin: Cijk_Ailk_Bljk_I8II_BH_SHB_HA_S_SCD_SAV_UserArgs_MT128x128x32_MI16x16x1_SN_LDSB0_AFC1_AG0_AFEM1_AFEM1_ASEM1_CLR1_CADS0_DTLA0_DTLB0_DTVA1_DTVB0_EPS0_FDSI0_GRPM1_GRVWA8_GRVWB8_GSUn1_GSUAMB_GSUC0_GSUWGMRR0_GLS0_ISA1201_IU1_K1_LDSTI0_LBSPPA0_LBSPPB128_LBSPPM0_LPA0_LPB8_LPM0_LRVW8_LWPMn1_MIAV1_MIWT4_4_MO40_NTn1_NTA0_NTB0_NTC0_NTD0_NTM0_NEPBS0_NLCA2_NLCB1_ONLL0_PGR2_PLR1_PKA0_SIA3_SS1_SU32_SUM0_SUS256_SPO0_SRVW0_SSO0_SVW1_SK0_SKFTR0_SKXCCM0_TLDS1_ULSGRO0_USL1_UIOFGRO0_USFGROn1_VSn1_VWA1_VWB4_WSGRA0_WSGRB0_WS32_WG32_4_1_WGM8_WGMXCC1_WGMXCCGn1
    SolutionIndex: 129
    SolutionNameMin: Cijk_Ailk_Bljk_I8II_BH_SHB_HA_S_SCD_SAV_UserArgs_MT128x128x32_MI16x16x1_SN_LDSB0_AFC1_AG0_AFEM1_AFEM1_ASEM32_CLR1_CADS0_DTLA0_DTLB0_DTVA0_DTVB1_EPS1_FDSI0_GRPM1_GRVWA16_GRVWB8_GSUn1_GSUAMB_GSUC0_GSUWGMRR0_GLS0_ISA1201_IU1_K1_LDSTI0_LBSPPA1024_LBSPPB0_LBSPPM0_LPA64_LPB0_LPM0_LRVW8_LWPMn1_MIAV1_MIWT4_4_MO40_NTn1_NTA0_NTB0_NTC0_NTD0_NTM0_NEPBS0_NLCA1_NLCB2_ONLL0_PGR1_PLR1_PKA0_SIA3_SS1_SU32_SUM0_SUS256_SPO0_SRVW0_SSO0_SVW4_SK0_SKFTR0_SKXCCM0_TLDS1_ULSGRO0_USL1_UIOFGRO0_USFGROn1_VSn1_VWA4_VWB4_WSGRA0_WSGRB0_WS32_WG32_4_1_WGM8_WGMXCC1_WGMXCCGn1
    SolutionIndex: 130
    SolutionNameMin: Cijk_Ailk_Bljk_I8II_BH_SHB_HA_S_SCD_SAV_UserArgs_MT128x128x32_MI16x16x1_SN_LDSB0_AFC1_AG0_AFEM1_AFEM1_ASEM32_CLR1_CADS0_DTLA0_DTLB0_DTVA0_DTVB1_EPS0_FDSI0_GRPM1_GRVWA16_GRVWB8_GSUn1_GSUAMB_GSUC0_GSUWGMRR0_GLS0_ISA1201_IU1_K1_LDSTI0_LBSPPA1024_LBSPPB0_LBSPPM0_LPA64_LPB0_LPM0_LRVW8_LWPMn1_MIAV1_MIWT4_4_MO40_NTn1_NTA0_NTB0_NTC0_NTD0_NTM0_NEPBS0_NLCA1_NLCB2_ONLL0_PGR2_PLR1_PKA0_SIA3_SS1_SU32_SUM0_SUS256_SPO0_SRVW0_SSO0_SVW4_SK0_SKFTR0_SKXCCM0_TLDS1_ULSGRO0_USL1_UIOFGRO0_USFGROn1_VSn1_VWA4_VWB4_WSGRA0_WSGRB0_WS32_WG32_4_1_WGM8_WGMXCC1_WGMXCCGn1
    SolutionIndex: 131
    SolutionNameMin: Cijk_Ailk_Bljk_I8II_BH_SHB_HA_S_SCD_SAV_UserArgs_MT128x128x32_MI16x16x1_SN_LDSB0_AFC1_AG0_AFEM1_AFEM1_ASEM32_CLR1_CADS0_DTLA0_DTLB0_DTVA1_DTVB1_EPS0_FDSI0_GRPM1_GRVWA8_GRVWB8_GSUn1_GSUAMB_GSUC0_GSUWGMRR0_GLS0_ISA1201_IU1_K1_LDSTI0_LBSPPA0_LBSPPB0_LBSPPM0_LPA0_LPB0_LPM0_LRVW8_LWPMn1_MIAV1_MIWT4_4_MO40_NTn1_NTA0_NTB0_NTC0_NTD0_NTM0_NEPBS0_NLCA2_NLCB2_ONLL0_PGR1_PLR0_PKA0_SIA3_SS1_SU32_SUM0_SUS256_SPO0_SRVW0_SSO0_SVW1_SK0_SKFTR0_SKXCCM0_TLDS1_ULSGRO0_USL1_UIOFGRO0_USFGROn1_VSn1_VWA1_VWB4_WSGRA0_WSGRB0_WS32_WG32_4_1_WGM8_WGMXCC1_WGMXCCGn1
    SolutionIndex: 132
    SolutionNameMin: Cijk_Ailk_Bljk_I8II_BH_SHB_HA_S_SCD_SAV_UserArgs_MT64x64x32_MI16x16x1_SN_LDSB1_AFC1_AG0_AFEM1_AFEM1_ASEM1_CLR1_CADS0_DTLA0_DTLB0_DTVA0_DTVB0_EPS1_FDSI0_GRPM1_GRVWA16_GRVWB8_GSUn1_GSUAMB_GSUC0_GSUWGMRR0_GLS0_ISA1201_IU2_K1_LDSTI0_LBSPPA512_LBSPPB128_LBSPPM0_LPA32_LPB8_LPM0_LRVW8_LWPMn1_MIAV1_MIWT2_2_MO40_NTn1_NTA0_NTB0_NTC0_NTD0_NTM0_NEPBS0_NLCA1_NLCB1_ONLL0_PGR1_PLR1_PKA0_SIA2_SS1_SU32_SUM0_SUS256_SPO0_SRVW0_SSO0_SVW2_SK0_SKFTR0_SKXCCM0_TLDS1_ULSGRO0_USL1_UIOFGRO0_USFGROn1_VSn1_VWA2_VWB2_WSGRA0_WSGRB0_WS32_WG32_4_1_WGM8_WGMXCC1_WGMXCCGn1
    SolutionIndex: 133
    SolutionNameMin: Cijk_Ailk_Bljk_I8II_BH_SHB_HA_S_SCD_SAV_UserArgs_MT64x64x32_MI16x16x1_SN_LDSB0_AFC1_AG0_AFEM1_AFEM1_ASEM1_CLR1_CADS0_DTLA0_DTLB0_DTVA1_DTVB0_EPS0_FDSI0_GRPM1_GRVWA8_GRVWB8_GSUn1_GSUAMB_GSUC0_GSUWGMRR0_GLS0_ISA1201_IU1_K1_LDSTI0_LBSPPA0_LBSPPB128_LBSPPM0_LPA0_LPB8_LPM0_LRVW8_LWPMn1_MIAV1_MIWT2_2_MO40_NTn1_NTA0_NTB0_NTC0_NTD0_NTM0_NEPBS0_NLCA2_NLCB1_ONLL0_PGR2_PLR1_PKA0_SIA3_SS1_SU32_SUM0_SUS256_SPO0_SRVW0_SSO0_SVW1_SK0_SKFTR0_SKXCCM0_TLDS1_ULSGRO0_USL1_UIOFGRO0_USFGROn1_VSn1_VWA1_VWB2_WSGRA0_WSGRB0_WS32_WG32_4_1_WGM8_WGMXCC1_WGMXCCGn1
    SolutionIndex: 134
    SolutionNameMin: Cijk_Ailk_Bljk_I8II_BH_SHB_HA_S_SCD_SAV_UserArgs_MT32x16x32_MI16x16x1_SN_LDSB0_AFC1_AG0_AFEM1_AFEM1_ASEM1_CLR1_CADS0_DTLA0_DTLB0_DTVA1_DTVB0_EPS0_FDSI0_GRPM1_GRVWA8_GRVWB8_GSUn1_GSUAMB_GSUC0_GSUWGMRR0_GLS0_ISA1201_IU1_K1_LDSTI0_LBSPPA0_LBSPPB128_LBSPPM0_LPA0_LPB8_LPM0_LRVW8_LWPMn1_MIAV1_MIWT1_1_MO40_NTn1_NTA0_NTB0_NTC0_NTD0_NTM0_NEPBS0_NLCA1_NLCB1_ONLL0_PGR2_PLR1_PKA0_SIA3_SS1_SU32_SUM0_SUS256_SPO0_SRVW0_SSO0_SVW1_SK0_SKFTR0_SKXCCM0_TLDS1_ULSGRO0_USL1_UIOFGRO0_USFGROn1_VSn1_VWA1_VWB1_WSGRA0_WSGRB0_WS32_WG32_2_1_WGM8_WGMXCC1_WGMXCCGn1
    SolutionIndex: 135
    SolutionNameMin: Cijk_Ailk_Bljk_I8II_BH_SHB_HA_S_SCD_SAV_UserArgs_MT128x64x32_MI16x16x1_SN_LDSB1_AFC1_AG0_AFEM1_AFEM1_ASEM1_CLR1_CADS0_DTLA0_DTLB0_DTVA0_DTVB0_EPS0_FDSI0_GRPM1_GRVWA16_GRVWB8_GSUn1_GSUAMB_GSUC0_GSUWGMRR0_GLS0_ISA1201_IU2_K1_LDSTI0_LBSPPA1024_LBSPPB128_LBSPPM0_LPA0_LPB8_LPM0_LRVW8_LWPMn1_MIAV1_MIWT8_1_MO40_NTn1_NTA0_NTB0_NTC0_NTD0_NTM0_NEPBS0_NLCA1_NLCB1_ONLL0_PGR2_PLR1_PKA0_SIA2_SS1_SU32_SUM0_SUS256_SPO0_SRVW0_SSO0_SVW8_SK0_SKFTR0_SKXCCM0_TLDS1_ULSGRO0_USL1_UIOFGRO0_USFGROn1_VSn1_VWA8_VWB1_WSGRA0_WSGRB0_WS32_WG16_8_1_WGM8_WGMXCC1_WGMXCCGn1
    SolutionIndex: 136
    SolutionNameMin: Cijk_Ailk_Bljk_I8II_BH_SHB_HA_S_SCD_SAV_UserArgs_MT128x64x32_MI16x16x1_SN_LDSB0_AFC1_AG0_AFEM1_AFEM1_ASEM1_CLR1_CADS0_DTLA0_DTLB0_DTVA1_DTVB0_EPS0_FDSI0_GRPM1_GRVWA8_GRVWB8_GSUn1_GSUAMB_GSUC0_GSUWGMRR0_GLS0_ISA1201_IU1_K1_LDSTI0_LBSPPA0_LBSPPB128_LBSPPM0_LPA0_LPB8_LPM0_LRVW8_LWPMn1_MIAV1_MIWT8_1_MO40_NTn1_NTA0_NTB0_NTC0_NTD0_NTM0_NEPBS0_NLCA2_NLCB1_ONLL0_PGR2_PLR1_PKA0_SIA3_SS1_SU32_SUM0_SUS256_SPO0_SRVW0_SSO0_SVW1_SK0_SKFTR0_SKXCCM0_TLDS1_ULSGRO0_USL1_UIOFGRO0_USFGROn1_VSn1_VWA1_VWB1_WSGRA0_WSGRB0_WS32_WG16_8_1_WGM8_WGMXCC1_WGMXCCGn1
    SolutionIndex: 137
    SolutionNameMin: Cijk_Ailk_Bljk_I8II_BH_SHB_HA_S_SCD_SAV_UserArgs_MT128x32x32_MI16x16x1_SN_LDSB1_AFC1_AG0_AFEM1_AFEM1_ASEM1_CLR1_CADS0_DTLA0_DTLB0_DTVA0_DTVB0_EPS0_FDSI0_GRPM1_GRVWA16_GRVWB8_GSUn1_GSUAMB_GSUC0_GSUWGMRR0_GLS0_ISA1201_IU2_K1_LDSTI0_LBSPPA1024_LBSPPB128_LBSPPM0_LPA64_LPB8_LPM0_LRVW8_LWPMn1_MIAV1_MIWT4_1_MO40_NTn1_NTA0_NTB0_NTC0_NTD0_NTM0_NEPBS0_NLCA1_NLCB1_ONLL0_PGR2_PLR1_PKA0_SIA2_SS1_SU32_SUM0_SUS256_SPO0_SRVW0_SSO0_SVW4_SK0_SKFTR0_SKXCCM0_TLDS1_ULSGRO0_USL1_UIOFGRO0_USFGROn1_VSn1_VWA4_VWB1_WSGRA0_WSGRB0_WS32_WG32_4_1_WGM8_WGMXCC1_WGMXCCGn1
    SolutionIndex: 138
    SolutionNameMin: Cijk_Ailk_Bljk_I8II_BH_SHB_HA_S_SCD_SAV_UserArgs_MT128x32x32_MI16x16x1_SN_LDSB1_AFC1_AG0_AFEM1_AFEM1_ASEM1_CLR1_CADS0_DTLA0_DTLB0_DTVA0_DTVB0_EPS0_FDSI0_GRPM1_GRVWA8_GRVWB8_GSUn1_GSUAMB_GSUC0_GSUWGMRR0_GLS0_ISA1201_IU2_K1_LDSTI0_LBSPPA1024_LBSPPB128_LBSPPM0_LPA64_LPB8_LPM0_LRVW8_LWPMn1_MIAV1_MIWT4_1_MO40_NTn1_NTA0_NTB0_NTC0_NTD0_NTM0_NEPBS0_NLCA1_NLCB1_ONLL0_PGR2_PLR1_PKA0_SIA2_SS1_SU32_SUM0_SUS256_SPO0_SRVW0_SSO0_SVW4_SK0_SKFTR0_SKXCCM0_TLDS1_ULSGRO1_USL1_UIOFGRO0_USFGROn1_VSn1_VWA4_VWB1_WSGRA0_WSGRB0_WS32_WG32_4_1_WGM8_WGMXCC1_WGMXCCGn1
    SolutionIndex: 139
    SolutionNameMin: Cijk_Ailk_Bljk_I8II_BH_SHB_HA_S_SCD_SAV_UserArgs_MT128x32x32_MI16x16x1_SN_LDSB0_AFC1_AG0_AFEM1_AFEM1_ASEM1_CLR1_CADS0_DTLA0_DTLB0_DTVA0_DTVB0_EPS0_FDSI0_GRPM1_GRVWA8_GRVWB8_GSUn1_GSUAMB_GSUC0_GSUWGMRR0_GLS0_ISA1201_IU1_K1_LDSTI0_LBSPPA1024_LBSPPB128_LBSPPM0_LPA64_LPB8_LPM0_LRVW8_LWPMn1_MIAV1_MIWT4_1_MO40_NTn1_NTA0_NTB0_NTC0_NTD0_NTM0_NEPBS0_NLCA1_NLCB1_ONLL0_PGR2_PLR1_PKA0_SIA3_SS1_SU32_SUM0_SUS256_SPO0_SRVW0_SSO0_SVW4_SK0_SKFTR0_SKXCCM0_TLDS1_ULSGRO1_USL1_UIOFGRO0_USFGROn1_VSn1_VWA4_VWB1_WSGRA0_WSGRB0_WS32_WG32_4_1_WGM8_WGMXCC1_WGMXCCGn1
    SolutionIndex: 140
    SolutionNameMin: Cijk_Ailk_Bljk_I8II_BH_SHB_HA_S_SCD_SAV_UserArgs_MT64x128x32_MI16x16x1_SN_LDSB0_AFC1_AG0_AFEM1_AFEM1_ASEM1_CLR1_CADS0_DTLA0_DTLB0_DTVA1_DTVB0_EPS1_FDSI0_GRPM1_GRVWA8_GRVWB8_GSUn1_GSUAMB_GSUC0_GSUWGMRR0_GLS0_ISA1201_IU1_K1_LDSTI0_LBSPPA0_LBSPPB256_LBSPPM0_LPA0_LPB8_LPM0_LRVW8_LWPMn1_MIAV1_MIWT1_8_MO40_NTn1_NTA0_NTB0_NTC0_NTD0_NTM0_NEPBS0_NLCA1_NLCB1_ONLL0_PGR1_PLR1_PKA0_SIA3_SS1_SU32_SUM0_SUS256_SPO0_SRVW0_SSO0_SVW1_SK0_SKFTR0_SKXCCM0_TLDS1_ULSGRO0_USL1_UIOFGRO0_USFGROn1_VSn1_VWA1_VWB8_WSGRA0_WSGRB0_WS32_WG64_2_1_WGM8_WGMXCC1_WGMXCCGn1
    SolutionIndex: 141
    SolutionNameMin: Cijk_Ailk_Bljk_I8II_BH_SHB_HA_S_SCD_SAV_UserArgs_MT128x16x32_MI16x16x1_SN_LDSB1_AFC1_AG0_AFEM1_AFEM1_ASEM1_CLR1_CADS0_DTLA0_DTLB0_DTVA0_DTVB0_EPS0_FDSI0_GRPM1_GRVWA16_GRVWB8_GSUn1_GSUAMB_GSUC0_GSUWGMRR0_GLS0_ISA1201_IU2_K1_LDSTI0_LBSPPA1024_LBSPPB128_LBSPPM0_LPA0_LPB8_LPM0_LRVW8_LWPMn1_MIAV1_MIWT8_1_MO40_NTn1_NTA0_NTB0_NTC0_NTD0_NTM0_NEPBS0_NLCA1_NLCB1_ONLL0_PGR2_PLR1_PKA0_SIA2_SS1_SU32_SUM0_SUS256_SPO0_SRVW0_SSO0_SVW8_SK0_SKFTR0_SKXCCM0_TLDS1_ULSGRO0_USL1_UIOFGRO0_USFGROn1_VSn1_VWA8_VWB1_WSGRA0_WSGRB0_WS32_WG16_2_1_WGM8_WGMXCC1_WGMXCCGn1
    SolutionIndex: 142
    SolutionNameMin: Cijk_Ailk_Bljk_I8II_BH_SHB_HA_S_SCD_SAV_UserArgs_MT256x16x32_MI16x16x1_SN_LDSB1_AFC1_AG0_AFEM1_AFEM1_ASEM1_CLR1_CADS0_DTLA0_DTLB0_DTVA0_DTVB0_EPS0_FDSI0_GRPM1_GRVWA8_GRVWB8_GSUn1_GSUAMB_GSUC0_GSUWGMRR0_GLS0_ISA1201_IU2_K1_LDSTI0_LBSPPA2048_LBSPPB128_LBSPPM0_LPA0_LPB8_LPM0_LRVW8_LWPMn1_MIAV1_MIWT8_1_MO40_NTn1_NTA0_NTB0_NTC0_NTD0_NTM0_NEPBS0_NLCA1_NLCB1_ONLL0_PGR2_PLR1_PKA0_SIA2_SS1_SU32_SUM0_SUS256_SPO0_SRVW0_SSO0_SVW8_SK0_SKFTR0_SKXCCM0_TLDS1_ULSGRO1_USL1_UIOFGRO0_USFGROn1_VSn1_VWA8_VWB1_WSGRA0_WSGRB0_WS32_WG32_2_1_WGM8_WGMXCC1_WGMXCCGn1
    SolutionIndex: 143
    SolutionNameMin: Cijk_Ailk_Bljk_I8II_BH_SHB_HA_S_SCD_SAV_UserArgs_MT128x128x64_MI16x16x1_SN_LDSB1_AFC1_AG0_AFEM1_AFEM1_ASEM1_CLR1_CADS0_DTLA0_DTLB0_DTVA0_DTVB0_EPS1_FDSI0_GRPM1_GRVWA16_GRVWB16_GSUn1_GSUAMB_GSUC0_GSUWGMRR0_GLS0_ISA1201_IU1_K1_LDSTI0_LBSPPA2048_LBSPPB256_LBSPPM0_LPA64_LPB32_LPM0_LRVW16_LWPMn1_MIAV1_MIWT4_4_MO40_NTn1_NTA0_NTB0_NTC0_NTD0_NTM0_NEPBS0_NLCA1_NLCB1_ONLL0_PGR1_PLR1_PKA0_SIA3_SS1_SU32_SUM0_SUS256_SPO0_SRVW0_SSO0_SVW4_SK0_SKFTR0_SKXCCM0_TLDS1_ULSGRO0_USL1_UIOFGRO0_USFGROn1_VSn1_VWA4_VWB4_WSGRA0_WSGRB0_WS32_WG32_4_1_WGM8_WGMXCC1_WGMXCCGn1
    SolutionIndex: 144
    SolutionNameMin: Cijk_Ailk_Bljk_I8II_BH_SHB_HA_S_SCD_SAV_UserArgs_MT64x64x64_MI16x16x1_SN_LDSB0_AFC1_AG0_AFEM1_AFEM1_ASEM64_CLR1_CADS0_DTLA0_DTLB0_DTVA0_DTVB1_EPS1_FDSI0_GRPM1_GRVWA16_GRVWB16_GSUn1_GSUAMB_GSUC0_GSUWGMRR0_GLS0_ISA1201_IU1_K1_LDSTI0_LBSPPA1024_LBSPPB0_LBSPPM0_LPA32_LPB0_LPM0_LRVW16_LWPMn1_MIAV1_MIWT2_2_MO40_NTn1_NTA0_NTB0_NTC0_NTD0_NTM0_NEPBS0_NLCA1_NLCB2_ONLL0_PGR1_PLR1_PKA0_SIA3_SS1_SU32_SUM0_SUS256_SPO0_SRVW0_SSO0_SVW2_SK0_SKFTR0_SKXCCM0_TLDS1_ULSGRO0_USL1_UIOFGRO0_USFGROn1_VSn1_VWA2_VWB2_WSGRA0_WSGRB0_WS32_WG32_4_1_WGM8_WGMXCC1_WGMXCCGn1
    SolutionIndex: 145
    SolutionNameMin: Cijk_Ailk_Bljk_I8II_BH_SHB_HA_S_SCD_SAV_UserArgs_MT32x32x64_MI16x16x1_SN_LDSB0_AFC1_AG0_AFEM1_AFEM1_ASEM64_CLR1_CADS0_DTLA0_DTLB0_DTVA1_DTVB1_EPS0_FDSI0_GRPM1_GRVWA8_GRVWB8_GSUn1_GSUAMB_GSUC0_GSUWGMRR0_GLS0_ISA1201_IU1_K1_LDSTI0_LBSPPA0_LBSPPB0_LBSPPM0_LPA0_LPB0_LPM0_LRVW8_LWPMn1_MIAV1_MIWT1_1_MO40_NTn1_NTA0_NTB0_NTC0_NTD0_NTM0_NEPBS0_NLCA1_NLCB4_ONLL0_PGR1_PLR0_PKA0_SIA3_SS1_SU32_SUM0_SUS256_SPO0_SRVW0_SSO0_SVW1_SK0_SKFTR0_SKXCCM0_TLDS1_ULSGRO0_USL1_UIOFGRO0_USFGROn1_VSn1_VWA1_VWB1_WSGRA0_WSGRB0_WS32_WG32_4_1_WGM8_WGMXCC1_WGMXCCGn1
    SolutionIndex: 146
    SolutionNameMin: Cijk_Ailk_Bljk_I8II_BH_SHB_HA_S_SCD_SAV_UserArgs_MT16x32x64_MI16x16x1_SN_LDSB0_AFC1_AG0_AFEM1_AFEM1_ASEM1_CLR1_CADS0_DTLA0_DTLB0_DTVA1_DTVB0_EPS0_FDSI0_GRPM1_GRVWA8_GRVWB8_GSUn1_GSUAMB_GSUC0_GSUWGMRR0_GLS0_ISA1201_IU1_K1_LDSTI0_LBSPPA0_LBSPPB128_LBSPPM0_LPA0_LPB8_LPM0_LRVW8_LWPMn1_MIAV1_MIWT1_1_MO40_NTn1_NTA0_NTB0_NTC0_NTD0_NTM0_NEPBS0_NLCA1_NLCB1_ONLL0_PGR2_PLR1_PKA0_SIA3_SS1_SU32_SUM0_SUS256_SPO0_SRVW0_SSO0_SVW1_SK0_SKFTR0_SKXCCM0_TLDS1_ULSGRO0_USL1_UIOFGRO0_USFGROn1_VSn1_VWA1_VWB1_WSGRA0_WSGRB0_WS32_WG16_4_1_WGM8_WGMXCC1_WGMXCCGn1
    SolutionIndex: 147
    SolutionNameMin: Cijk_Ailk_Bljk_I8II_BH_SHB_HA_S_SCD_SAV_UserArgs_MT32x16x64_MI16x16x1_SN_LDSB0_AFC1_AG0_AFEM1_AFEM1_ASEM64_CLR1_CADS0_DTLA0_DTLB0_DTVA1_DTVB1_EPS0_FDSI0_GRPM1_GRVWA8_GRVWB8_GSUn1_GSUAMB_GSUC0_GSUWGMRR0_GLS0_ISA1201_IU1_K1_LDSTI0_LBSPPA0_LBSPPB0_LBSPPM0_LPA0_LPB0_LPM0_LRVW8_LWPMn1_MIAV1_MIWT1_1_MO40_NTn1_NTA0_NTB0_NTC0_NTD0_NTM0_NEPBS0_NLCA1_NLCB4_ONLL0_PGR1_PLR0_PKA0_SIA3_SS1_SU32_SUM0_SUS256_SPO0_SRVW0_SSO0_SVW1_SK0_SKFTR0_SKXCCM0_TLDS1_ULSGRO0_USL1_UIOFGRO0_USFGROn1_VSn1_VWA1_VWB1_WSGRA0_WSGRB0_WS32_WG32_2_1_WGM8_WGMXCC1_WGMXCCGn1
    SolutionIndex: 148
    SolutionNameMin: Cijk_Ailk_Bljk_I8II_BH_SHB_HA_S_SCD_SAV_UserArgs_MT128x64x64_MI16x16x1_SN_LDSB0_AFC1_AG0_AFEM1_AFEM1_ASEM1_CLR1_CADS0_DTLA0_DTLB0_DTVA0_DTVB0_EPS0_FDSI0_GRPM1_GRVWA16_GRVWB16_GSUn1_GSUAMB_GSUC0_GSUWGMRR0_GLS0_ISA1201_IU1_K1_LDSTI0_LBSPPA2048_LBSPPB128_LBSPPM0_LPA0_LPB32_LPM0_LRVW16_LWPMn1_MIAV1_MIWT8_1_MO40_NTn1_NTA0_NTB0_NTC0_NTD0_NTM0_NEPBS0_NLCA1_NLCB1_ONLL0_PGR2_PLR1_PKA0_SIA3_SS1_SU32_SUM0_SUS256_SPO0_SRVW0_SSO0_SVW8_SK0_SKFTR0_SKXCCM0_TLDS1_ULSGRO0_USL1_UIOFGRO0_USFGROn1_VSn1_VWA8_VWB1_WSGRA0_WSGRB0_WS32_WG16_8_1_WGM8_WGMXCC1_WGMXCCGn1
    SolutionIndex: 149
    SolutionNameMin: Cijk_Ailk_Bljk_I8II_BH_SHB_HA_S_SCD_SAV_UserArgs_MT128x64x64_MI16x16x1_SN_LDSB0_AFC1_AG0_AFEM1_AFEM1_ASEM1_CLR1_CADS0_DTLA0_DTLB0_DTVA1_DTVB0_EPS1_FDSI0_GRPM1_GRVWA8_GRVWB8_GSUn1_GSUAMB_GSUC0_GSUWGMRR0_GLS0_ISA1201_IU1_K1_LDSTI0_LBSPPA0_LBSPPB128_LBSPPM0_LPA0_LPB8_LPM0_LRVW8_LWPMn1_MIAV1_MIWT8_1_MO40_NTn1_NTA0_NTB0_NTC0_NTD0_NTM0_NEPBS0_NLCA4_NLCB1_ONLL0_PGR1_PLR1_PKA0_SIA3_SS1_SU32_SUM0_SUS256_SPO0_SRVW0_SSO0_SVW1_SK0_SKFTR0_SKXCCM0_TLDS1_ULSGRO0_USL1_UIOFGRO0_USFGROn1_VSn1_VWA1_VWB1_WSGRA0_WSGRB0_WS32_WG16_8_1_WGM8_WGMXCC1_WGMXCCGn1
    SolutionIndex: 150
    SolutionNameMin: Cijk_Ailk_Bljk_I8II_BH_SHB_HA_S_SCD_SAV_UserArgs_MT128x32x64_MI16x16x1_SN_LDSB0_AFC1_AG0_AFEM1_AFEM1_ASEM1_CLR1_CADS0_DTLA0_DTLB0_DTVA1_DTVB0_EPS0_FDSI0_GRPM1_GRVWA8_GRVWB8_GSUn1_GSUAMB_GSUC0_GSUWGMRR0_GLS0_ISA1201_IU1_K1_LDSTI0_LBSPPA0_LBSPPB128_LBSPPM0_LPA0_LPB8_LPM0_LRVW8_LWPMn1_MIAV1_MIWT4_1_MO40_NTn1_NTA0_NTB0_NTC0_NTD0_NTM0_NEPBS0_NLCA4_NLCB1_ONLL0_PGR2_PLR1_PKA0_SIA3_SS1_SU32_SUM0_SUS256_SPO0_SRVW0_SSO0_SVW1_SK0_SKFTR0_SKXCCM0_TLDS1_ULSGRO0_USL1_UIOFGRO0_USFGROn1_VSn1_VWA1_VWB1_WSGRA0_WSGRB0_WS32_WG32_4_1_WGM8_WGMXCC1_WGMXCCGn1
    SolutionIndex: 151
    SolutionNameMin: Cijk_Ailk_Bljk_I8II_BH_SHB_HA_S_SCD_SAV_UserArgs_MT128x32x64_MI16x16x1_SN_LDSB0_AFC1_AG0_AFEM1_AFEM1_ASEM64_CLR1_CADS0_DTLA0_DTLB0_DTVA0_DTVB1_EPS1_FDSI0_GRPM1_GRVWA16_GRVWB16_GSUn1_GSUAMB_GSUC0_GSUWGMRR0_GLS0_ISA1201_IU1_K1_LDSTI0_LBSPPA2048_LBSPPB0_LBSPPM0_LPA64_LPB0_LPM0_LRVW16_LWPMn1_MIAV1_MIWT4_1_MO40_NTn1_NTA0_NTB0_NTC0_NTD0_NTM0_NEPBS0_NLCA1_NLCB2_ONLL0_PGR1_PLR1_PKA0_SIA3_SS1_SU32_SUM0_SUS256_SPO0_SRVW0_SSO0_SVW4_SK0_SKFTR0_SKXCCM0_TLDS1_ULSGRO0_USL1_UIOFGRO0_USFGROn1_VSn1_VWA4_VWB1_WSGRA0_WSGRB0_WS32_WG32_4_1_WGM8_WGMXCC1_WGMXCCGn1
    SolutionIndex: 152
    SolutionNameMin: Cijk_Ailk_Bljk_I8II_BH_SHB_HA_S_SCD_SAV_UserArgs_MT64x128x64_MI16x16x1_SN_LDSB0_AFC1_AG0_AFEM1_AFEM1_ASEM1_CLR1_CADS0_DTLA0_DTLB0_DTVA1_DTVB0_EPS0_FDSI0_GRPM1_GRVWA8_GRVWB8_GSUn1_GSUAMB_GSUC0_GSUWGMRR0_GLS0_ISA1201_IU1_K1_LDSTI0_LBSPPA0_LBSPPB512_LBSPPM0_LPA0_LPB8_LPM0_LRVW8_LWPMn1_MIAV1_MIWT1_8_MO40_NTn1_NTA0_NTB0_NTC0_NTD0_NTM0_NEPBS0_NLCA1_NLCB1_ONLL0_PGR2_PLR1_PKA0_SIA3_SS1_SU32_SUM0_SUS256_SPO0_SRVW0_SSO0_SVW1_SK0_SKFTR0_SKXCCM0_TLDS1_ULSGRO0_USL1_UIOFGRO0_USFGROn1_VSn1_VWA1_VWB8_WSGRA0_WSGRB0_WS32_WG64_2_1_WGM8_WGMXCC1_WGMXCCGn1
    SolutionIndex: 153
    SolutionNameMin: Cijk_Ailk_Bljk_I8II_BH_SHB_HA_S_SCD_SAV_UserArgs_MT64x64x128_MI16x16x1_SN_LDSB0_AFC1_AG0_AFEM1_AFEM1_ASEM1_CLR1_CADS0_DTLA0_DTLB0_DTVA1_DTVB0_EPS1_FDSI0_GRPM1_GRVWA8_GRVWB8_GSUn1_GSUAMB_GSUC0_GSUWGMRR0_GLS0_ISA1201_IU1_K1_LDSTI0_LBSPPA0_LBSPPB256_LBSPPM0_LPA0_LPB8_LPM0_LRVW8_LWPMn1_MIAV1_MIWT2_2_MO40_NTn1_NTA0_NTB0_NTC0_NTD0_NTM0_NEPBS0_NLCA8_NLCB1_ONLL0_PGR1_PLR1_PKA0_SIA3_SS1_SU32_SUM0_SUS256_SPO0_SRVW0_SSO0_SVW1_SK0_SKFTR0_SKXCCM0_TLDS1_ULSGRO0_USL1_UIOFGRO0_USFGROn1_VSn1_VWA1_VWB2_WSGRA0_WSGRB0_WS32_WG32_4_1_WGM8_WGMXCC1_WGMXCCGn1
    SolutionIndex: 154
    SolutionNameMin: Cijk_Ailk_Bljk_I8II_BH_SHB_HA_S_SCD_SAV_UserArgs_MT64x64x128_MI16x16x1_SN_LDSB0_AFC1_AG0_AFEM1_AFEM1_ASEM1_CLR1_CADS0_DTLA0_DTLB0_DTVA1_DTVB0_EPS0_FDSI0_GRPM1_GRVWA8_GRVWB8_GSUn1_GSUAMB_GSUC0_GSUWGMRR0_GLS0_ISA1201_IU1_K1_LDSTI0_LBSPPA0_LBSPPB256_LBSPPM0_LPA0_LPB8_LPM0_LRVW8_LWPMn1_MIAV1_MIWT2_2_MO40_NTn1_NTA0_NTB0_NTC0_NTD0_NTM0_NEPBS0_NLCA8_NLCB1_ONLL0_PGR2_PLR1_PKA0_SIA3_SS1_SU32_SUM0_SUS256_SPO0_SRVW0_SSO0_SVW1_SK0_SKFTR0_SKXCCM0_TLDS1_ULSGRO0_USL1_UIOFGRO0_USFGROn1_VSn1_VWA1_VWB2_WSGRA0_WSGRB0_WS32_WG32_4_1_WGM8_WGMXCC1_WGMXCCGn1
    SolutionIndex: 155
    SolutionNameMin: Cijk_Ailk_Bljk_I8II_BH_SHB_HA_S_SCD_SAV_UserArgs_MT64x64x128_MI16x16x1_SN_LDSB0_AFC1_AG0_AFEM1_AFEM1_ASEM128_CLR1_CADS0_DTLA0_DTLB0_DTVA0_DTVB1_EPS1_FDSI0_GRPM1_GRVWA16_GRVWB16_GSUn1_GSUAMB_GSUC0_GSUWGMRR0_GLS0_ISA1201_IU1_K1_LDSTI0_LBSPPA1024_LBSPPB0_LBSPPM0_LPA32_LPB0_LPM0_LRVW16_LWPMn1_MIAV1_MIWT2_2_MO40_NTn1_NTA0_NTB0_NTC0_NTD0_NTM0_NEPBS0_NLCA1_NLCB4_ONLL0_PGR1_PLR1_PKA0_SIA3_SS1_SU32_SUM0_SUS256_SPO0_SRVW0_SSO0_SVW2_SK0_SKFTR0_SKXCCM0_TLDS1_ULSGRO0_USL1_UIOFGRO0_USFGROn1_VSn1_VWA2_VWB2_WSGRA0_WSGRB0_WS32_WG32_4_1_WGM8_WGMXCC1_WGMXCCGn1
    SolutionIndex: 156
    SolutionNameMin: Cijk_Ailk_Bljk_I8II_BH_SHB_HA_S_SCD_SAV_UserArgs_MT64x64x128_MI16x16x1_SN_LDSB0_AFC1_AG0_AFEM1_AFEM1_ASEM128_CLR1_CADS0_DTLA0_DTLB0_DTVA0_DTVB1_EPS0_FDSI0_GRPM1_GRVWA16_GRVWB16_GSUn1_GSUAMB_GSUC0_GSUWGMRR0_GLS0_ISA1201_IU1_K1_LDSTI0_LBSPPA1024_LBSPPB0_LBSPPM0_LPA32_LPB0_LPM0_LRVW16_LWPMn1_MIAV1_MIWT2_2_MO40_NTn1_NTA0_NTB0_NTC0_NTD0_NTM0_NEPBS0_NLCA1_NLCB4_ONLL0_PGR2_PLR1_PKA0_SIA3_SS1_SU32_SUM0_SUS256_SPO0_SRVW0_SSO0_SVW2_SK0_SKFTR0_SKXCCM0_TLDS1_ULSGRO0_USL1_UIOFGRO0_USFGROn1_VSn1_VWA2_VWB2_WSGRA0_WSGRB0_WS32_WG32_4_1_WGM8_WGMXCC1_WGMXCCGn1
    SolutionIndex: 157
    SolutionNameMin: Cijk_Ailk_Bljk_I8II_BH_SHB_HA_S_SCD_SAV_UserArgs_MT32x32x128_MI16x16x1_SN_LDSB0_AFC1_AG0_AFEM1_AFEM1_ASEM1_CLR1_CADS0_DTLA0_DTLB0_DTVA1_DTVB0_EPS1_FDSI0_GRPM1_GRVWA8_GRVWB8_GSUn1_GSUAMB_GSUC0_GSUWGMRR0_GLS0_ISA1201_IU1_K1_LDSTI0_LBSPPA0_LBSPPB128_LBSPPM0_LPA0_LPB8_LPM0_LRVW8_LWPMn1_MIAV1_MIWT1_1_MO40_NTn1_NTA0_NTB0_NTC0_NTD0_NTM0_NEPBS0_NLCA1_NLCB1_ONLL0_PGR1_PLR1_PKA0_SIA3_SS1_SU32_SUM0_SUS256_SPO0_SRVW0_SSO0_SVW1_SK0_SKFTR0_SKXCCM0_TLDS1_ULSGRO0_USL1_UIOFGRO0_USFGROn1_VSn1_VWA1_VWB1_WSGRA0_WSGRB0_WS32_WG32_4_1_WGM8_WGMXCC1_WGMXCCGn1
    SolutionIndex: 158
    SolutionNameMin: Cijk_Ailk_Bljk_I8II_BH_SHB_HA_S_SCD_SAV_UserArgs_MT32x32x128_MI16x16x1_SN_LDSB0_AFC1_AG0_AFEM1_AFEM1_ASEM1_CLR1_CADS0_DTLA0_DTLB0_DTVA1_DTVB0_EPS0_FDSI0_GRPM1_GRVWA8_GRVWB8_GSUn1_GSUAMB_GSUC0_GSUWGMRR0_GLS0_ISA1201_IU1_K1_LDSTI0_LBSPPA0_LBSPPB128_LBSPPM0_LPA0_LPB8_LPM0_LRVW8_LWPMn1_MIAV1_MIWT1_1_MO40_NTn1_NTA0_NTB0_NTC0_NTD0_NTM0_NEPBS0_NLCA1_NLCB1_ONLL0_PGR2_PLR1_PKA0_SIA3_SS1_SU32_SUM0_SUS256_SPO0_SRVW0_SSO0_SVW1_SK0_SKFTR0_SKXCCM0_TLDS1_ULSGRO0_USL1_UIOFGRO0_USFGROn1_VSn1_VWA1_VWB1_WSGRA0_WSGRB0_WS32_WG32_4_1_WGM8_WGMXCC1_WGMXCCGn1
    SolutionIndex: 159
    SolutionNameMin: Cijk_Ailk_Bljk_I8II_BH_SHB_HA_S_SCD_SAV_UserArgs_MT16x32x128_MI16x16x1_SN_LDSB0_AFC1_AG0_AFEM1_AFEM1_ASEM1_CLR1_CADS0_DTLA0_DTLB0_DTVA1_DTVB0_EPS0_FDSI0_GRPM1_GRVWA8_GRVWB8_GSUn1_GSUAMB_GSUC0_GSUWGMRR0_GLS0_ISA1201_IU1_K1_LDSTI0_LBSPPA0_LBSPPB128_LBSPPM0_LPA0_LPB8_LPM0_LRVW8_LWPMn1_MIAV1_MIWT1_1_MO40_NTn1_NTA0_NTB0_NTC0_NTD0_NTM0_NEPBS0_NLCA1_NLCB1_ONLL0_PGR2_PLR1_PKA0_SIA3_SS1_SU32_SUM0_SUS256_SPO0_SRVW0_SSO0_SVW1_SK0_SKFTR0_SKXCCM0_TLDS1_ULSGRO0_USL1_UIOFGRO0_USFGROn1_VSn1_VWA1_VWB1_WSGRA0_WSGRB0_WS32_WG16_4_1_WGM8_WGMXCC1_WGMXCCGn1
    SolutionIndex: 160
    SolutionNameMin: Cijk_Ailk_Bljk_I8II_BH_SHB_HA_S_SCD_SAV_UserArgs_MT32x16x128_MI16x16x1_SN_LDSB0_AFC1_AG0_AFEM1_AFEM1_ASEM1_CLR1_CADS0_DTLA0_DTLB0_DTVA1_DTVB0_EPS1_FDSI0_GRPM1_GRVWA8_GRVWB8_GSUn1_GSUAMB_GSUC0_GSUWGMRR0_GLS0_ISA1201_IU1_K1_LDSTI0_LBSPPA0_LBSPPB128_LBSPPM0_LPA0_LPB8_LPM0_LRVW8_LWPMn1_MIAV1_MIWT1_1_MO40_NTn1_NTA0_NTB0_NTC0_NTD0_NTM0_NEPBS0_NLCA1_NLCB1_ONLL0_PGR1_PLR1_PKA0_SIA3_SS1_SU32_SUM0_SUS256_SPO0_SRVW0_SSO0_SVW1_SK0_SKFTR0_SKXCCM0_TLDS1_ULSGRO0_USL1_UIOFGRO0_USFGROn1_VSn1_VWA1_VWB1_WSGRA0_WSGRB0_WS32_WG32_2_1_WGM8_WGMXCC1_WGMXCCGn1
    SolutionIndex: 161
    SolutionNameMin: Cijk_Ailk_Bljk_I8II_BH_SHB_HA_S_SCD_SAV_UserArgs_MT32x16x128_MI16x16x1_SN_LDSB0_AFC1_AG0_AFEM1_AFEM1_ASEM1_CLR1_CADS0_DTLA0_DTLB0_DTVA1_DTVB0_EPS0_FDSI0_GRPM1_GRVWA8_GRVWB8_GSUn1_GSUAMB_GSUC0_GSUWGMRR0_GLS0_ISA1201_IU1_K1_LDSTI0_LBSPPA0_LBSPPB128_LBSPPM0_LPA0_LPB8_LPM0_LRVW8_LWPMn1_MIAV1_MIWT1_1_MO40_NTn1_NTA0_NTB0_NTC0_NTD0_NTM0_NEPBS0_NLCA1_NLCB1_ONLL0_PGR2_PLR1_PKA0_SIA3_SS1_SU32_SUM0_SUS256_SPO0_SRVW0_SSO0_SVW1_SK0_SKFTR0_SKXCCM0_TLDS1_ULSGRO0_USL1_UIOFGRO0_USFGROn1_VSn1_VWA1_VWB1_WSGRA0_WSGRB0_WS32_WG32_2_1_WGM8_WGMXCC1_WGMXCCGn1
    SolutionIndex: 162
    SolutionNameMin: Cijk_Ailk_Bljk_I8II_BH_SHB_HA_S_SCD_SAV_UserArgs_MT128x32x128_MI16x16x1_SN_LDSB0_AFC1_AG0_AFEM1_AFEM1_ASEM1_CLR1_CADS0_DTLA0_DTLB0_DTVA1_DTVB0_EPS1_FDSI0_GRPM1_GRVWA8_GRVWB8_GSUn1_GSUAMB_GSUC0_GSUWGMRR0_GLS0_ISA1201_IU1_K1_LDSTI0_LBSPPA0_LBSPPB128_LBSPPM0_LPA0_LPB8_LPM0_LRVW8_LWPMn1_MIAV1_MIWT4_1_MO40_NTn1_NTA0_NTB0_NTC0_NTD0_NTM0_NEPBS0_NLCA8_NLCB1_ONLL0_PGR1_PLR1_PKA0_SIA3_SS1_SU32_SUM0_SUS256_SPO0_SRVW0_SSO0_SVW1_SK0_SKFTR0_SKXCCM0_TLDS1_ULSGRO0_USL1_UIOFGRO0_USFGROn1_VSn1_VWA1_VWB1_WSGRA0_WSGRB0_WS32_WG32_4_1_WGM8_WGMXCC1_WGMXCCGn1
    SolutionIndex: 163
    SolutionNameMin: Cijk_Ailk_Bljk_I8II_BH_SHB_HA_S_SCD_SAV_UserArgs_MT32x32x256_MI16x16x1_SN_LDSB0_AFC1_AG0_AFEM1_AFEM1_ASEM1_CLR1_CADS0_DTLA0_DTLB0_DTVA1_DTVB0_EPS1_FDSI0_GRPM1_GRVWA8_GRVWB8_GSUn1_GSUAMB_GSUC0_GSUWGMRR0_GLS0_ISA1201_IU1_K1_LDSTI0_LBSPPA0_LBSPPB256_LBSPPM0_LPA0_LPB8_LPM0_LRVW8_LWPMn1_MIAV1_MIWT1_1_MO40_NTn1_NTA0_NTB0_NTC0_NTD0_NTM0_NEPBS0_NLCA1_NLCB1_ONLL0_PGR1_PLR1_PKA0_SIA3_SS1_SU32_SUM0_SUS256_SPO0_SRVW0_SSO0_SVW1_SK0_SKFTR0_SKXCCM0_TLDS1_ULSGRO0_USL1_UIOFGRO0_USFGROn1_VSn1_VWA1_VWB1_WSGRA0_WSGRB0_WS32_WG32_4_1_WGM8_WGMXCC1_WGMXCCGn1
    SolutionIndex: 164
    SolutionNameMin: Cijk_Ailk_Bljk_I8II_BH_SHB_HA_S_SCD_SAV_UserArgs_MT32x32x256_MI16x16x1_SN_LDSB0_AFC1_AG0_AFEM1_AFEM1_ASEM256_CLR1_CADS0_DTLA0_DTLB0_DTVA0_DTVB1_EPS1_FDSI0_GRPM1_GRVWA16_GRVWB16_GSUn1_GSUAMB_GSUC0_GSUWGMRR0_GLS0_ISA1201_IU1_K1_LDSTI0_LBSPPA512_LBSPPB0_LBSPPM0_LPA16_LPB0_LPM0_LRVW16_LWPMn1_MIAV1_MIWT1_1_MO40_NTn1_NTA0_NTB0_NTC0_NTD0_NTM0_NEPBS0_NLCA1_NLCB8_ONLL0_PGR1_PLR1_PKA0_SIA3_SS1_SU32_SUM0_SUS256_SPO0_SRVW0_SSO0_SVW1_SK0_SKFTR0_SKXCCM0_TLDS1_ULSGRO0_USL1_UIOFGRO0_USFGROn1_VSn1_VWA1_VWB1_WSGRA0_WSGRB0_WS32_WG32_4_1_WGM8_WGMXCC1_WGMXCCGn1
    SolutionIndex: 165
    SolutionNameMin: Cijk_Ailk_Bljk_I8II_BH_SHB_HA_S_SCD_SAV_UserArgs_MT32x32x256_MI16x16x1_SN_LDSB0_AFC1_AG0_AFEM1_AFEM1_ASEM256_CLR1_CADS0_DTLA0_DTLB0_DTVA0_DTVB1_EPS0_FDSI0_GRPM1_GRVWA16_GRVWB16_GSUn1_GSUAMB_GSUC0_GSUWGMRR0_GLS0_ISA1201_IU1_K1_LDSTI0_LBSPPA512_LBSPPB0_LBSPPM0_LPA16_LPB0_LPM0_LRVW16_LWPMn1_MIAV1_MIWT1_1_MO40_NTn1_NTA0_NTB0_NTC0_NTD0_NTM0_NEPBS0_NLCA1_NLCB8_ONLL0_PGR2_PLR1_PKA0_SIA3_SS1_SU32_SUM0_SUS256_SPO0_SRVW0_SSO0_SVW1_SK0_SKFTR0_SKXCCM0_TLDS1_ULSGRO0_USL1_UIOFGRO0_USFGROn1_VSn1_VWA1_VWB1_WSGRA0_WSGRB0_WS32_WG32_4_1_WGM8_WGMXCC1_WGMXCCGn1
    SolutionIndex: 166
    SolutionNameMin: Cijk_Ailk_Bljk_I8II_BH_SHB_HA_S_SCD_SAV_UserArgs_MT32x16x256_MI16x16x1_SN_LDSB0_AFC1_AG0_AFEM1_AFEM1_ASEM1_CLR1_CADS0_DTLA0_DTLB0_DTVA1_DTVB0_EPS1_FDSI0_GRPM1_GRVWA8_GRVWB8_GSUn1_GSUAMB_GSUC0_GSUWGMRR0_GLS0_ISA1201_IU1_K1_LDSTI0_LBSPPA0_LBSPPB256_LBSPPM0_LPA0_LPB8_LPM0_LRVW8_LWPMn1_MIAV1_MIWT1_1_MO40_NTn1_NTA0_NTB0_NTC0_NTD0_NTM0_NEPBS0_NLCA1_NLCB1_ONLL0_PGR1_PLR1_PKA0_SIA3_SS1_SU32_SUM0_SUS256_SPO0_SRVW0_SSO0_SVW1_SK0_SKFTR0_SKXCCM0_TLDS1_ULSGRO0_USL1_UIOFGRO0_USFGROn1_VSn1_VWA1_VWB1_WSGRA0_WSGRB0_WS32_WG32_2_1_WGM8_WGMXCC1_WGMXCCGn1
    SolutionIndex: 167
    SolutionNameMin: Cijk_Ailk_Bljk_I8II_BH_SHB_HA_S_SCD_SAV_UserArgs_MT32x16x256_MI16x16x1_SN_LDSB0_AFC1_AG0_AFEM1_AFEM1_ASEM1_CLR1_CADS0_DTLA0_DTLB0_DTVA1_DTVB0_EPS0_FDSI0_GRPM1_GRVWA8_GRVWB8_GSUn1_GSUAMB_GSUC0_GSUWGMRR0_GLS0_ISA1201_IU1_K1_LDSTI0_LBSPPA0_LBSPPB256_LBSPPM0_LPA0_LPB8_LPM0_LRVW8_LWPMn1_MIAV1_MIWT1_1_MO40_NTn1_NTA0_NTB0_NTC0_NTD0_NTM0_NEPBS0_NLCA1_NLCB1_ONLL0_PGR2_PLR1_PKA0_SIA3_SS1_SU32_SUM0_SUS256_SPO0_SRVW0_SSO0_SVW1_SK0_SKFTR0_SKXCCM0_TLDS1_ULSGRO0_USL1_UIOFGRO0_USFGROn1_VSn1_VWA1_VWB1_WSGRA0_WSGRB0_WS32_WG32_2_1_WGM8_WGMXCC1_WGMXCCGn1
    SolutionIndex: 168
    SolutionNameMin: Cijk_Ailk_Bljk_I8II_BH_SHB_HA_S_SCD_SAV_UserArgs_MT16x16x64_MI16x16x1_SN_LDSB0_AFC1_AG0_AFEM1_AFEM1_ASEM1_CLR1_CADS0_DTLA0_DTLB0_DTVA1_DTVB0_EPS1_FDSI0_GRPM1_GRVWA8_GRVWB8_GSUn1_GSUAMB_GSUC0_GSUWGMRR0_GLS0_ISA1201_IU1_K1_LDSTI0_LBSPPA0_LBSPPB128_LBSPPM0_LPA0_LPB8_LPM0_LRVW8_LWPMn1_MIAV1_MIWT1_1_MO40_NTn1_NTA0_NTB0_NTC0_NTD0_NTM0_NEPBS0_NLCA1_NLCB1_ONLL0_PGR1_PLR1_PKA0_SIA3_SS1_SU32_SUM0_SUS256_SPO0_SRVW0_SSO0_SVW1_SK0_SKFTR0_SKXCCM0_TLDS1_ULSGRO0_USL1_UIOFGRO0_USFGROn1_VSn1_VWA1_VWB1_WSGRA0_WSGRB0_WS32_WG16_2_1_WGM8_WGMXCC1_WGMXCCGn1
    SolutionIndex: 169
    SolutionNameMin: Cijk_Ailk_Bljk_I8II_BH_SHB_HA_S_SCD_SAV_UserArgs_MT64x64x32_MI16x16x1_SN_LDSB0_AFC1_AG0_AFEM1_AFEM1_ASEM1_CLR1_CADS0_DTLA0_DTLB0_DTVA0_DTVB0_EPS0_FDSI0_GRPM1_GRVWA8_GRVWB8_GSUn1_GSUAMB_GSUC0_GSUWGMRR0_GLS0_ISA1201_IU1_K1_LDSTI0_LBSPPA512_LBSPPB128_LBSPPM0_LPA32_LPB8_LPM0_LRVW8_LWPMn1_MIAV1_MIWT2_2_MO40_NTn1_NTA0_NTB0_NTC0_NTD0_NTM0_NEPBS0_NLCA1_NLCB1_ONLL0_PGR2_PLR1_PKA0_SIA3_SS0_SU32_SUM0_SUS256_SPO0_SRVW0_SSO0_SVW16_SK0_SKFTR0_SKXCCM0_TLDS1_ULSGRO1_USL1_UIOFGRO0_USFGROn1_VSn1_VWA2_VWB2_WSGRA0_WSGRB0_WS32_WG32_4_1_WGM8_WGMXCC1_WGMXCCGn1
    SolutionIndex: 170
    SolutionNameMin: Cijk_Ailk_Bljk_I8II_BH_SHB_HA_S_SCD_SAV_UserArgs_MT32x16x32_MI16x16x1_SN_LDSB0_AFC1_AG0_AFEM1_AFEM1_ASEM32_CLR1_CADS0_DTLA0_DTLB0_DTVA1_DTVB1_EPS0_FDSI0_GRPM1_GRVWA8_GRVWB8_GSUn1_GSUAMB_GSUC0_GSUWGMRR0_GLS0_ISA1201_IU1_K1_LDSTI0_LBSPPA0_LBSPPB0_LBSPPM0_LPA0_LPB0_LPM0_LRVW8_LWPMn1_MIAV1_MIWT1_1_MO40_NTn1_NTA0_NTB0_NTC0_NTD0_NTM0_NEPBS0_NLCA1_NLCB2_ONLL0_PGR1_PLR0_PKA0_SIA3_SS0_SU32_SUM0_SUS256_SPO0_SRVW0_SSO0_SVW8_SK0_SKFTR0_SKXCCM0_TLDS1_ULSGRO0_USL1_UIOFGRO0_USFGROn1_VSn1_VWA1_VWB1_WSGRA0_WSGRB0_WS32_WG32_2_1_WGM8_WGMXCC1_WGMXCCGn1
    SolutionIndex: 171
    SolutionNameMin: Cijk_Ailk_Bljk_I8II_BH_SHB_HA_S_SCD_SAV_UserArgs_MT64x64x16_MI16x16x1_SN_LDSB1_AFC1_AG0_AFEM1_AFEM1_ASEM1_CLR1_CADS0_DTLA0_DTLB0_DTVA0_DTVB0_EPS1_FDSI0_GRPM1_GRVWA8_GRVWB8_GSUn1_GSUAMB_GSUC0_GSUWGMRR0_GLS0_ISA1201_IU1_K1_LDSTI0_LBSPPA512_LBSPPB128_LBSPPM0_LPA32_LPB8_LPM0_LRVW8_LWPMn1_MIAV1_MIWT2_2_MO40_NTn1_NTA0_NTB0_NTC0_NTD0_NTM0_NEPBS0_NLCA1_NLCB1_ONLL0_PGR1_PLR1_PKA0_SIA2_SS1_SU32_SUM0_SUS256_SPO0_SRVW0_SSO0_SVW2_SK0_SKFTR0_SKXCCM0_TLDS1_ULSGRO0_USL1_UIOFGRO0_USFGROn1_VSn1_VWA2_VWB2_WSGRA0_WSGRB0_WS32_WG32_4_1_WGM8_WGMXCC1_WGMXCCGn1
    SolutionIndex: 172
    SolutionNameMin: Cijk_Ailk_Bljk_I8II_BH_SHB_HA_S_SCD_SAV_UserArgs_MT16x512x32_MI16x16x1_SN_LDSB1_AFC1_AG0_AFEM1_AFEM1_ASEM1_CLR1_CADS0_DTLA0_DTLB0_DTVA0_DTVB0_EPS1_FDSI0_GRPM1_GRVWA4_GRVWB8_GSUn1_GSUAMB_GSUC0_GSUWGMRR0_GLS0_ISA1201_IU2_K1_LDSTI0_LBSPPA128_LBSPPB256_LBSPPM0_LPA16_LPB8_LPM0_LRVW8_LWPMn1_MIAV1_MIWT1_8_MO40_NTn1_NTA0_NTB0_NTC0_NTD0_NTM0_NEPBS0_NLCA1_NLCB1_ONLL0_PGR1_PLR1_PKA0_SIA2_SS0_SU32_SUM0_SUS256_SPO0_SRVW0_SSO0_SVW8_SK0_SKFTR0_SKXCCM0_TLDS1_ULSGRO0_USL1_UIOFGRO0_USFGROn1_VSn1_VWA1_VWB8_WSGRA0_WSGRB0_WS32_WG16_8_1_WGM8_WGMXCC1_WGMXCCGn1
    SolutionIndex: 173
    SolutionNameMin: Cijk_Ailk_Bljk_I8II_BH_SHB_HA_S_SCD_SAV_UserArgs_MT64x128x64_MI16x16x1_SN_LDSB0_AFC1_AG0_AFEM1_AFEM1_ASEM64_CLR1_CADS0_DTLA0_DTLB0_DTVA0_DTVB1_EPS0_FDSI0_GRPM1_GRVWA16_GRVWB16_GSUn1_GSUAMB_GSUC0_GSUWGMRR0_GLS0_ISA1201_IU1_K1_LDSTI0_LBSPPA1024_LBSPPB0_LBSPPM0_LPA16_LPB0_LPM0_LRVW16_LWPMn1_MIAV1_MIWT1_8_MO40_NTn1_NTA0_NTB0_NTC0_NTD0_NTM0_NEPBS0_NLCA1_NLCB2_ONLL0_PGR2_PLR1_PKA0_SIA3_SS0_SU32_SUM0_SUS256_SPO0_SRVW0_SSO0_SVW8_SK0_SKFTR0_SKXCCM0_TLDS1_ULSGRO0_USL1_UIOFGRO0_USFGROn1_VSn1_VWA1_VWB8_WSGRA0_WSGRB0_WS32_WG64_2_1_WGM8_WGMXCC1_WGMXCCGn1
    SolutionIndex: 174
    SolutionNameMin: Cijk_Ailk_Bljk_I8II_BH_SHB_HA_S_SCD_SAV_UserArgs_MT16x512x32_MI16x16x1_SN_LDSB1_AFC1_AG0_AFEM1_AFEM1_ASEM1_CLR1_CADS0_DTLA0_DTLB0_DTVA1_DTVB0_EPS0_FDSI0_GRPM1_GRVWA8_GRVWB8_GSUn1_GSUAMB_GSUC0_GSUWGMRR0_GLS0_ISA1201_IU1_K1_LDSTI0_LBSPPA0_LBSPPB256_LBSPPM0_LPA0_LPB8_LPM0_LRVW8_LWPMn1_MIAV1_MIWT1_8_MO40_NTn1_NTA0_NTB0_NTC0_NTD0_NTM0_NEPBS0_NLCA1_NLCB1_ONLL0_PGR2_PLR1_PKA0_SIA3_SS0_SU32_SUM0_SUS256_SPO0_SRVW0_SSO0_SVW8_SK0_SKFTR0_SKXCCM0_TLDS1_ULSGRO0_USL1_UIOFGRO0_USFGROn1_VSn1_VWA1_VWB8_WSGRA0_WSGRB0_WS32_WG16_8_1_WGM8_WGMXCC1_WGMXCCGn1
    SolutionIndex: 175
    SolutionNameMin: Cijk_Ailk_Bljk_I8II_BH_SHB_HA_S_SCD_SAV_UserArgs_MT16x128x32_MI16x16x1_SN_LDSB0_AFC1_AG0_AFEM1_AFEM1_ASEM1_CLR1_CADS0_DTLA0_DTLB0_DTVA1_DTVB0_EPS0_FDSI0_GRPM1_GRVWA8_GRVWB8_GSUn1_GSUAMB_GSUC0_GSUWGMRR0_GLS0_ISA1201_IU1_K1_LDSTI0_LBSPPA0_LBSPPB256_LBSPPM0_LPA0_LPB8_LPM0_LRVW8_LWPMn1_MIAV1_MIWT1_8_MO40_NTn1_NTA0_NTB0_NTC0_NTD0_NTM0_NEPBS0_NLCA1_NLCB1_ONLL0_PGR2_PLR1_PKA0_SIA3_SS0_SU32_SUM0_SUS256_SPO0_SRVW0_SSO0_SVW8_SK0_SKFTR0_SKXCCM0_TLDS1_ULSGRO0_USL1_UIOFGRO0_USFGROn1_VSn1_VWA1_VWB8_WSGRA0_WSGRB0_WS32_WG16_2_1_WGM8_WGMXCC1_WGMXCCGn1
    SolutionIndex: 176
    SolutionNameMin: Cijk_Ailk_Bljk_I8II_BH_SHB_HA_S_SCD_SAV_UserArgs_MT16x128x32_MI16x16x1_SN_LDSB1_AFC1_AG0_AFEM1_AFEM1_ASEM1_CLR1_CADS0_DTLA0_DTLB0_DTVA0_DTVB0_EPS0_FDSI0_GRPM1_GRVWA8_GRVWB8_GSUn1_GSUAMB_GSUC0_GSUWGMRR0_GLS0_ISA1201_IU2_K1_LDSTI0_LBSPPA128_LBSPPB256_LBSPPM0_LPA16_LPB8_LPM0_LRVW8_LWPMn1_MIAV1_MIWT1_8_MO40_NTn1_NTA0_NTB0_NTC0_NTD0_NTM0_NEPBS0_NLCA1_NLCB1_ONLL0_PGR2_PLR1_PKA0_SIA2_SS0_SU32_SUM0_SUS256_SPO0_SRVW0_SSO0_SVW8_SK0_SKFTR0_SKXCCM0_TLDS1_ULSGRO1_USL1_UIOFGRO0_USFGROn1_VSn1_VWA1_VWB8_WSGRA0_WSGRB0_WS32_WG16_2_1_WGM8_WGMXCC1_WGMXCCGn1
    SolutionIndex: 177
    SolutionNameMin: Cijk_Ailk_Bljk_I8II_BH_SHB_HA_S_SCD_SAV_UserArgs_MT32x32x64_MI16x16x1_SN_LDSB0_AFC1_AG0_AFEM1_AFEM1_ASEM1_CLR1_CADS0_DTLA0_DTLB0_DTVA1_DTVB0_EPS0_FDSI0_GRPM1_GRVWA8_GRVWB8_GSUn1_GSUAMB_GSUC0_GSUWGMRR0_GLS0_ISA1201_IU1_K1_LDSTI0_LBSPPA0_LBSPPB128_LBSPPM0_LPA0_LPB8_LPM0_LRVW8_LWPMn1_MIAV1_MIWT1_1_MO40_NTn1_NTA0_NTB0_NTC0_NTD0_NTM0_NEPBS0_NLCA1_NLCB1_ONLL0_PGR2_PLR1_PKA0_SIA3_SS1_SU32_SUM0_SUS256_SPO0_SRVW0_SSO0_SVW1_SK0_SKFTR0_SKXCCM0_TLDS1_ULSGRO0_USL1_UIOFGRO0_USFGROn1_VSn1_VWA1_VWB1_WSGRA0_WSGRB0_WS32_WG32_4_1_WGM8_WGMXCC1_WGMXCCGn1
    SolutionIndex: 178
    SolutionNameMin: Cijk_Ailk_Bljk_I8II_BH_SHB_HA_S_SCD_SAV_UserArgs_MT64x64x64_MI16x16x1_SN_LDSB0_AFC1_AG0_AFEM1_AFEM1_ASEM64_CLR1_CADS0_DTLA0_DTLB0_DTVA0_DTVB1_EPS0_FDSI0_GRPM1_GRVWA16_GRVWB16_GSUn1_GSUAMB_GSUC0_GSUWGMRR0_GLS0_ISA1201_IU1_K1_LDSTI0_LBSPPA1024_LBSPPB0_LBSPPM0_LPA32_LPB0_LPM0_LRVW16_LWPMn1_MIAV1_MIWT2_2_MO40_NTn1_NTA0_NTB0_NTC0_NTD0_NTM0_NEPBS0_NLCA1_NLCB2_ONLL0_PGR2_PLR1_PKA0_SIA3_SS1_SU32_SUM0_SUS256_SPO0_SRVW0_SSO0_SVW2_SK0_SKFTR0_SKXCCM0_TLDS1_ULSGRO0_USL1_UIOFGRO0_USFGROn1_VSn1_VWA2_VWB2_WSGRA0_WSGRB0_WS32_WG32_4_1_WGM8_WGMXCC1_WGMXCCGn1
    SolutionIndex: 179
    SolutionNameMin: Cijk_Ailk_Bljk_I8II_BH_SHB_HA_S_SCD_SAV_UserArgs_MT16x32x128_MI16x16x1_SN_LDSB0_AFC1_AG0_AFEM1_AFEM1_ASEM128_CLR1_CADS0_DTLA0_DTLB0_DTVA0_DTVB1_EPS0_FDSI0_GRPM1_GRVWA16_GRVWB16_GSUn1_GSUAMB_GSUC0_GSUWGMRR0_GLS0_ISA1201_IU1_K1_LDSTI0_LBSPPA256_LBSPPB0_LBSPPM0_LPA16_LPB0_LPM0_LRVW16_LWPMn1_MIAV1_MIWT1_1_MO40_NTn1_NTA0_NTB0_NTC0_NTD0_NTM0_NEPBS0_NLCA1_NLCB4_ONLL0_PGR2_PLR1_PKA0_SIA3_SS0_SU32_SUM0_SUS256_SPO0_SRVW0_SSO0_SVW8_SK0_SKFTR0_SKXCCM0_TLDS1_ULSGRO0_USL1_UIOFGRO0_USFGROn1_VSn1_VWA1_VWB1_WSGRA0_WSGRB0_WS32_WG16_4_1_WGM8_WGMXCC1_WGMXCCGn1
    SolutionIndex: 180
    SolutionNameMin: Cijk_Ailk_Bljk_I8II_BH_SHB_HA_S_SCD_SAV_UserArgs_MT32x128x128_MI16x16x1_SN_LDSB0_AFC1_AG0_AFEM1_AFEM1_ASEM128_CLR1_CADS0_DTLA0_DTLB0_DTVA0_DTVB1_EPS0_FDSI0_GRPM1_GRVWA16_GRVWB16_GSUn1_GSUAMB_GSUC0_GSUWGMRR0_GLS0_ISA1201_IU1_K1_LDSTI0_LBSPPA512_LBSPPB0_LBSPPM0_LPA16_LPB0_LPM0_LRVW16_LWPMn1_MIAV1_MIWT1_4_MO40_NTn1_NTA0_NTB0_NTC0_NTD0_NTM0_NEPBS0_NLCA1_NLCB4_ONLL0_PGR2_PLR1_PKA0_SIA3_SS0_SU32_SUM0_SUS256_SPO0_SRVW0_SSO0_SVW8_SK0_SKFTR0_SKXCCM0_TLDS1_ULSGRO0_USL1_UIOFGRO0_USFGROn1_VSn1_VWA1_VWB4_WSGRA0_WSGRB0_WS32_WG32_4_1_WGM8_WGMXCC1_WGMXCCGn1
    SolutionIndex: 181
    SolutionNameMin: Cijk_Ailk_Bljk_I8II_BH_SHB_HA_S_SCD_SAV_UserArgs_MT128x128x32_MI16x16x1_SN_LDSB0_AFC1_AG0_AFEM1_AFEM1_ASEM32_CLR1_CADS0_DTLA0_DTLB0_DTVA1_DTVB1_EPS0_FDSI0_GRPM1_GRVWA8_GRVWB8_GSUn1_GSUAMB_GSUC0_GSUWGMRR0_GLS0_ISA1201_IU1_K1_LDSTI0_LBSPPA0_LBSPPB0_LBSPPM0_LPA0_LPB0_LPM0_LRVW8_LWPMn1_MIAV1_MIWT8_2_MO40_NTn1_NTA0_NTB0_NTC0_NTD0_NTM0_NEPBS0_NLCA2_NLCB2_ONLL0_PGR1_PLR0_PKA0_SIA3_SS0_SU32_SUM0_SUS256_SPO0_SRVW0_SSO0_SVW8_SK0_SKFTR0_SKXCCM0_TLDS1_ULSGRO0_USL1_UIOFGRO0_USFGROn1_VSn1_VWA1_VWB2_WSGRA0_WSGRB0_WS32_WG16_8_1_WGM8_WGMXCC1_WGMXCCGn1
    SolutionIndex: 182
    SolutionNameMin: Cijk_Ailk_Bljk_I8II_BH_SHB_HA_S_SCD_SAV_UserArgs_MT32x32x128_MI16x16x1_SN_LDSB0_AFC1_AG0_AFEM1_AFEM1_ASEM128_CLR1_CADS0_DTLA0_DTLB0_DTVA0_DTVB1_EPS0_FDSI0_GRPM1_GRVWA16_GRVWB16_GSUn1_GSUAMB_GSUC0_GSUWGMRR0_GLS0_ISA1201_IU1_K1_LDSTI0_LBSPPA512_LBSPPB0_LBSPPM0_LPA16_LPB0_LPM0_LRVW16_LWPMn1_MIAV1_MIWT1_1_MO40_NTn1_NTA0_NTB0_NTC0_NTD0_NTM0_NEPBS0_NLCA1_NLCB4_ONLL0_PGR2_PLR1_PKA0_SIA3_SS1_SU32_SUM0_SUS256_SPO0_SRVW0_SSO0_SVW1_SK0_SKFTR0_SKXCCM0_TLDS1_ULSGRO0_USL1_UIOFGRO0_USFGROn1_VSn1_VWA1_VWB1_WSGRA0_WSGRB0_WS32_WG32_4_1_WGM8_WGMXCC1_WGMXCCGn1
    SolutionIndex: 183
    SolutionNameMin: Cijk_Ailk_Bljk_I8II_BH_SHB_HA_S_SCD_SAV_UserArgs_MT128x128x16_MI16x16x1_SN_LDSB1_AFC1_AG0_AFEM1_AFEM1_ASEM1_CLR1_CADS0_DTLA0_DTLB0_DTVA0_DTVB0_EPS0_FDSI0_GRPM1_GRVWA8_GRVWB8_GSUn1_GSUAMB_GSUC0_GSUWGMRR0_GLS0_ISA1201_IU1_K1_LDSTI0_LBSPPA1024_LBSPPB128_LBSPPM0_LPA64_LPB8_LPM0_LRVW8_LWPMn1_MIAV1_MIWT4_4_MO40_NTn1_NTA0_NTB0_NTC0_NTD0_NTM0_NEPBS0_NLCA1_NLCB1_ONLL0_PGR2_PLR1_PKA0_SIA2_SS0_SU32_SUM0_SUS256_SPO0_SRVW0_SSO0_SVW8_SK0_SKFTR0_SKXCCM0_TLDS1_ULSGRO1_USL1_UIOFGRO0_USFGROn1_VSn1_VWA4_VWB4_WSGRA0_WSGRB0_WS32_WG32_4_1_WGM8_WGMXCC1_WGMXCCGn1
    SolutionIndex: 184
    SolutionNameMin: Cijk_Ailk_Bljk_I8II_BH_SHB_HA_S_SCD_SAV_UserArgs_MT64x64x64_MI16x16x1_SN_LDSB0_AFC1_AG0_AFEM1_AFEM1_ASEM1_CLR1_CADS0_DTLA0_DTLB0_DTVA1_DTVB0_EPS0_FDSI0_GRPM1_GRVWA8_GRVWB8_GSUn1_GSUAMB_GSUC0_GSUWGMRR0_GLS0_ISA1201_IU1_K1_LDSTI0_LBSPPA0_LBSPPB128_LBSPPM0_LPA0_LPB8_LPM0_LRVW8_LWPMn1_MIAV1_MIWT2_2_MO40_NTn1_NTA0_NTB0_NTC0_NTD0_NTM0_NEPBS0_NLCA4_NLCB1_ONLL0_PGR2_PLR1_PKA0_SIA3_SS1_SU32_SUM0_SUS256_SPO0_SRVW0_SSO0_SVW1_SK0_SKFTR0_SKXCCM0_TLDS1_ULSGRO0_USL1_UIOFGRO0_USFGROn1_VSn1_VWA1_VWB2_WSGRA0_WSGRB0_WS32_WG32_4_1_WGM8_WGMXCC1_WGMXCCGn1
    SolutionIndex: 185
    SolutionNameMin: Cijk_Ailk_Bljk_I8II_BH_SHB_HA_S_SCD_SAV_UserArgs_MT256x16x32_MI16x16x1_SN_LDSB0_AFC1_AG0_AFEM1_AFEM1_ASEM1_CLR1_CADS0_DTLA0_DTLB0_DTVA1_DTVB0_EPS0_FDSI0_GRPM1_GRVWA8_GRVWB8_GSUn1_GSUAMB_GSUC0_GSUWGMRR0_GLS0_ISA1201_IU1_K1_LDSTI0_LBSPPA0_LBSPPB128_LBSPPM0_LPA0_LPB8_LPM0_LRVW8_LWPMn1_MIAV1_MIWT8_1_MO40_NTn1_NTA0_NTB0_NTC0_NTD0_NTM0_NEPBS0_NLCA2_NLCB1_ONLL0_PGR2_PLR1_PKA0_SIA3_SS1_SU32_SUM0_SUS256_SPO0_SRVW0_SSO0_SVW1_SK0_SKFTR0_SKXCCM0_TLDS1_ULSGRO0_USL1_UIOFGRO0_USFGROn1_VSn1_VWA1_VWB1_WSGRA0_WSGRB0_WS32_WG32_2_1_WGM8_WGMXCC1_WGMXCCGn1
    SolutionIndex: 186
    SolutionNameMin: Cijk_Ailk_Bljk_I8II_BH_SHB_HA_S_SCD_SAV_UserArgs_MT128x128x16_MI16x16x1_SN_LDSB1_AFC1_AG0_AFEM1_AFEM1_ASEM1_CLR1_CADS0_DTLA0_DTLB0_DTVA0_DTVB0_EPS0_FDSI0_GRPM1_GRVWA16_GRVWB8_GSUn1_GSUAMB_GSUC0_GSUWGMRR0_GLS0_ISA1201_IU1_K1_LDSTI0_LBSPPA1024_LBSPPB128_LBSPPM0_LPA64_LPB8_LPM0_LRVW8_LWPMn1_MIAV1_MIWT4_4_MO40_NTn1_NTA0_NTB0_NTC0_NTD0_NTM0_NEPBS0_NLCA1_NLCB1_ONLL0_PGR2_PLR1_PKA0_SIA2_SS0_SU32_SUM0_SUS256_SPO0_SRVW0_SSO0_SVW8_SK0_SKFTR0_SKXCCM0_TLDS1_ULSGRO0_USL1_UIOFGRO0_USFGROn1_VSn1_VWA4_VWB4_WSGRA0_WSGRB0_WS32_WG32_4_1_WGM8_WGMXCC1_WGMXCCGn1
    SolutionIndex: 187
    SolutionNameMin: Cijk_Ailk_Bljk_I8II_BH_SHB_HA_S_SCD_SAV_UserArgs_MT128x64x16_MI16x16x1_SN_LDSB1_AFC1_AG0_AFEM1_AFEM1_ASEM1_CLR1_CADS0_DTLA0_DTLB0_DTVA0_DTVB0_EPS0_FDSI0_GRPM1_GRVWA8_GRVWB8_GSUn1_GSUAMB_GSUC0_GSUWGMRR0_GLS0_ISA1201_IU1_K1_LDSTI0_LBSPPA1024_LBSPPB128_LBSPPM0_LPA0_LPB8_LPM0_LRVW8_LWPMn1_MIAV1_MIWT8_1_MO40_NTn1_NTA0_NTB0_NTC0_NTD0_NTM0_NEPBS0_NLCA1_NLCB1_ONLL0_PGR2_PLR1_PKA0_SIA2_SS1_SU32_SUM0_SUS256_SPO0_SRVW0_SSO0_SVW8_SK0_SKFTR0_SKXCCM0_TLDS1_ULSGRO1_USL1_UIOFGRO0_USFGROn1_VSn1_VWA8_VWB1_WSGRA0_WSGRB0_WS32_WG16_8_1_WGM8_WGMXCC1_WGMXCCGn1
    SolutionIndex: 188
    SolutionNameMin: Cijk_Ailk_Bljk_I8II_BH_SHB_HA_S_SCD_SAV_UserArgs_MT128x128x16_MI16x16x1_SN_LDSB1_AFC1_AG0_AFEM1_AFEM1_ASEM1_CLR1_CADS0_DTLA0_DTLB0_DTVA0_DTVB0_EPS1_FDSI0_GRPM1_GRVWA16_GRVWB8_GSUn1_GSUAMB_GSUC0_GSUWGMRR0_GLS0_ISA1201_IU1_K1_LDSTI0_LBSPPA1024_LBSPPB128_LBSPPM0_LPA0_LPB8_LPM0_LRVW8_LWPMn1_MIAV1_MIWT8_2_MO40_NTn1_NTA0_NTB0_NTC0_NTD0_NTM0_NEPBS0_NLCA1_NLCB1_ONLL0_PGR1_PLR1_PKA0_SIA2_SS1_SU32_SUM0_SUS256_SPO0_SRVW0_SSO0_SVW8_SK0_SKFTR0_SKXCCM0_TLDS1_ULSGRO0_USL1_UIOFGRO0_USFGROn1_VSn1_VWA8_VWB2_WSGRA0_WSGRB0_WS32_WG16_8_1_WGM8_WGMXCC1_WGMXCCGn1
    SolutionIndex: 189
    SolutionNameMin: Cijk_Ailk_Bljk_I8II_BH_SHB_HA_S_SCD_SAV_UserArgs_MT128x128x32_MI16x16x1_SN_LDSB1_AFC1_AG0_AFEM1_AFEM1_ASEM1_CLR1_CADS0_DTLA0_DTLB0_DTVA0_DTVB0_EPS0_FDSI0_GRPM1_GRVWA8_GRVWB8_GSUn1_GSUAMB_GSUC0_GSUWGMRR0_GLS0_ISA1201_IU2_K1_LDSTI0_LBSPPA1024_LBSPPB128_LBSPPM0_LPA0_LPB8_LPM0_LRVW8_LWPMn1_MIAV1_MIWT8_2_MO40_NTn1_NTA0_NTB0_NTC0_NTD0_NTM0_NEPBS0_NLCA1_NLCB1_ONLL0_PGR2_PLR1_PKA0_SIA2_SS1_SU32_SUM0_SUS256_SPO0_SRVW0_SSO0_SVW8_SK0_SKFTR0_SKXCCM0_TLDS1_ULSGRO1_USL1_UIOFGRO0_USFGROn1_VSn1_VWA8_VWB2_WSGRA0_WSGRB0_WS32_WG16_8_1_WGM8_WGMXCC1_WGMXCCGn1
    SolutionIndex: 190
    SolutionNameMin: Cijk_Ailk_Bljk_I8II_BH_SHB_HA_S_SCD_SAV_UserArgs_MT128x128x16_MI16x16x1_SN_LDSB1_AFC1_AG0_AFEM1_AFEM1_ASEM1_CLR1_CADS0_DTLA0_DTLB0_DTVA0_DTVB0_EPS0_FDSI0_GRPM1_GRVWA16_GRVWB8_GSUn1_GSUAMB_GSUC0_GSUWGMRR0_GLS0_ISA1201_IU1_K1_LDSTI0_LBSPPA1024_LBSPPB128_LBSPPM0_LPA0_LPB8_LPM0_LRVW8_LWPMn1_MIAV1_MIWT8_2_MO40_NTn1_NTA0_NTB0_NTC0_NTD0_NTM0_NEPBS0_NLCA1_NLCB1_ONLL0_PGR2_PLR1_PKA0_SIA2_SS1_SU32_SUM0_SUS256_SPO0_SRVW0_SSO0_SVW8_SK0_SKFTR0_SKXCCM0_TLDS1_ULSGRO0_USL1_UIOFGRO0_USFGROn1_VSn1_VWA8_VWB2_WSGRA0_WSGRB0_WS32_WG16_8_1_WGM8_WGMXCC1_WGMXCCGn1
    SolutionIndex: 191
    SolutionNameMin: Cijk_Ailk_Bljk_I8II_BH_SHB_HA_S_SCD_SAV_UserArgs_MT128x32x64_MI16x16x1_SN_LDSB0_AFC1_AG0_AFEM1_AFEM1_ASEM1_CLR1_CADS0_DTLA0_DTLB0_DTVA1_DTVB0_EPS1_FDSI0_GRPM1_GRVWA8_GRVWB8_GSUn1_GSUAMB_GSUC0_GSUWGMRR0_GLS0_ISA1201_IU1_K1_LDSTI0_LBSPPA0_LBSPPB128_LBSPPM0_LPA0_LPB8_LPM0_LRVW8_LWPMn1_MIAV1_MIWT4_1_MO40_NTn1_NTA0_NTB0_NTC0_NTD0_NTM0_NEPBS0_NLCA4_NLCB1_ONLL0_PGR1_PLR1_PKA0_SIA3_SS1_SU32_SUM0_SUS256_SPO0_SRVW0_SSO0_SVW1_SK0_SKFTR0_SKXCCM0_TLDS1_ULSGRO0_USL1_UIOFGRO0_USFGROn1_VSn1_VWA1_VWB1_WSGRA0_WSGRB0_WS32_WG32_4_1_WGM8_WGMXCC1_WGMXCCGn1
    SolutionIndex: 192
    SolutionNameMin: Cijk_Ailk_Bljk_I8II_BH_SHB_HA_S_SCD_SAV_UserArgs_MT128x128x32_MI16x16x1_SN_LDSB1_AFC1_AG0_AFEM1_AFEM1_ASEM1_CLR1_CADS0_DTLA0_DTLB0_DTVA0_DTVB0_EPS0_FDSI0_GRPM1_GRVWA8_GRVWB8_GSUn1_GSUAMB_GSUC0_GSUWGMRR0_GLS0_ISA1201_IU2_K1_LDSTI0_LBSPPA1024_LBSPPB128_LBSPPM0_LPA64_LPB8_LPM0_LRVW8_LWPMn1_MIAV1_MIWT4_4_MO40_NTn1_NTA0_NTB0_NTC0_NTD0_NTM0_NEPBS0_NLCA1_NLCB1_ONLL0_PGR2_PLR1_PKA0_SIA2_SS0_SU32_SUM0_SUS256_SPO0_SRVW0_SSO0_SVW8_SK0_SKFTR0_SKXCCM0_TLDS1_ULSGRO1_USL1_UIOFGRO0_USFGROn1_VSn1_VWA4_VWB4_WSGRA0_WSGRB0_WS32_WG32_4_1_WGM8_WGMXCC1_WGMXCCGn1
    SolutionIndex: 193
    SolutionNameMin: Cijk_Ailk_Bljk_I8II_BH_SHB_HA_S_SCD_SAV_UserArgs_MT128x128x16_MI16x16x1_SN_LDSB0_AFC1_AG0_AFEM1_AFEM1_ASEM16_CLR1_CADS0_DTLA0_DTLB0_DTVA1_DTVB1_EPS0_FDSI0_GRPM1_GRVWA8_GRVWB8_GSUn1_GSUAMB_GSUC0_GSUWGMRR0_GLS0_ISA1201_IU1_K1_LDSTI0_LBSPPA0_LBSPPB0_LBSPPM0_LPA0_LPB0_LPM0_LRVW8_LWPMn1_MIAV1_MIWT8_2_MO40_NTn1_NTA0_NTB0_NTC0_NTD0_NTM0_NEPBS0_NLCA1_NLCB1_ONLL0_PGR1_PLR0_PKA0_SIA3_SS0_SU32_SUM0_SUS256_SPO0_SRVW0_SSO0_SVW8_SK0_SKFTR0_SKXCCM0_TLDS1_ULSGRO0_USL1_UIOFGRO0_USFGROn1_VSn1_VWA1_VWB2_WSGRA0_WSGRB0_WS32_WG16_8_1_WGM8_WGMXCC1_WGMXCCGn1
    SolutionIndex: 206
    SolutionNameMin: Cijk_Ailk_Bljk_I8II_BH_SHB_HA_S_SCD_SAV_UserArgs_MT128x128x32_MI16x16x1_SN_LDSB0_AFC1_AG0_AFEM1_AFEM1_ASEM32_CLR1_CADS0_DTLA0_DTLB0_DTVA1_DTVB1_EPS0_FDSI0_GRPM1_GRVWA8_GRVWB8_GSUn1_GSUAMB_GSUC0_GSUWGMRR0_GLS0_ISA1201_IU1_K1_LDSTI0_LBSPPA0_LBSPPB0_LBSPPM0_LPA0_LPB0_LPM0_LRVW8_LWPMn1_MIAV1_MIWT8_2_MO40_NTn1_NTA0_NTB0_NTC0_NTD0_NTM0_NEPBS0_NLCA2_NLCB2_ONLL0_PGR1_PLR0_PKA0_SIA3_SS1_SU32_SUM0_SUS256_SPO0_SRVW0_SSO0_SVW1_SK0_SKFTR0_SKXCCM0_TLDS1_ULSGRO0_USL1_UIOFGRO0_USFGROn1_VSn1_VWA1_VWB2_WSGRA0_WSGRB0_WS32_WG16_8_1_WGM8_WGMXCC1_WGMXCCGn1
    SolutionIndex: 208
    SolutionNameMin: Cijk_Ailk_Bljk_I8II_BH_SHB_HA_S_SCD_SAV_UserArgs_MT32x32x32_MI16x16x1_SN_LDSB0_AFC1_AG0_AFEM1_AFEM1_ASEM1_CLR1_CADS0_DTLA0_DTLB0_DTVA0_DTVB0_EPS0_FDSI0_GRPM1_GRVWA8_GRVWB8_GSUn1_GSUAMB_GSUC0_GSUWGMRR0_GLS0_ISA1201_IU1_K1_LDSTI0_LBSPPA256_LBSPPB128_LBSPPM0_LPA16_LPB8_LPM0_LRVW8_LWPMn1_MIAV1_MIWT1_1_MO40_NTn1_NTA0_NTB0_NTC0_NTD0_NTM0_NEPBS0_NLCA1_NLCB1_ONLL0_PGR2_PLR1_PKA0_SIA3_SS0_SU32_SUM0_SUS256_SPO0_SRVW0_SSO0_SVW8_SK0_SKFTR0_SKXCCM0_TLDS1_ULSGRO1_USL1_UIOFGRO0_USFGROn1_VSn1_VWA1_VWB1_WSGRA0_WSGRB0_WS32_WG32_4_1_WGM8_WGMXCC1_WGMXCCGn1
    SolutionIndex: 209
    SolutionNameMin: Cijk_Ailk_Bljk_I8II_BH_SHB_HA_S_SCD_SAV_UserArgs_MT64x64x64_MI16x16x1_SN_LDSB0_AFC1_AG0_AFEM1_AFEM1_ASEM1_CLR1_CADS0_DTLA0_DTLB0_DTVA0_DTVB0_EPS1_FDSI0_GRPM1_GRVWA16_GRVWB16_GSUn1_GSUAMB_GSUC0_GSUWGMRR0_GLS0_ISA1201_IU1_K1_LDSTI0_LBSPPA1024_LBSPPB128_LBSPPM0_LPA32_LPB32_LPM0_LRVW16_LWPMn1_MIAV1_MIWT2_2_MO40_NTn1_NTA0_NTB0_NTC0_NTD0_NTM0_NEPBS0_NLCA1_NLCB1_ONLL0_PGR1_PLR1_PKA0_SIA3_SS0_SU32_SUM0_SUS256_SPO0_SRVW0_SSO0_SVW16_SK0_SKFTR0_SKXCCM0_TLDS1_ULSGRO0_USL1_UIOFGRO0_USFGROn1_VSn1_VWA2_VWB2_WSGRA0_WSGRB0_WS32_WG32_4_1_WGM8_WGMXCC1_WGMXCCGn1
    SolutionIndex: 210
    SolutionNameMin: Cijk_Ailk_Bljk_I8II_BH_SHB_HA_S_SCD_SAV_UserArgs_MT64x64x16_MI16x16x1_SN_LDSB0_AFC1_AG0_AFEM1_AFEM1_ASEM1_CLR0_CADS0_DTLA0_DTLB0_DTVA0_DTVB0_EPS0_FDSI0_GRPM1_GRVWA8_GRVWB8_GSUn1_GSUAMB_GSUC0_GSUWGMRR0_GLS0_ISA1201_IU1_K1_LDSTI0_LBSPPA512_LBSPPB128_LBSPPM0_LPA32_LPB8_LPM0_LRVW8_LWPMn1_MIAV1_MIWT2_2_MO40_NTn1_NTA0_NTB0_NTC0_NTD0_NTM0_NEPBS0_NLCA1_NLCB1_ONLL0_PGR2_PLR0_PKA0_SIA3_SS0_SU32_SUM0_SUS256_SPO0_SRVW0_SSO0_SVW16_SK0_SKFTR0_SKXCCM0_TLDS1_ULSGRO0_USL1_UIOFGRO0_USFGROn1_VSn1_VWA2_VWB2_WSGRA0_WSGRB0_WS32_WG32_4_1_WGM8_WGMXCC1_WGMXCCGn1
    SolutionIndex: 211
    SolutionNameMin: Cijk_Ailk_Bljk_I8II_BH_SHB_HA_S_SCD_SAV_UserArgs_MT16x256x32_MI16x16x1_SN_LDSB1_AFC1_AG0_AFEM1_AFEM1_ASEM1_CLR1_CADS0_DTLA0_DTLB0_DTVA0_DTVB0_EPS0_FDSI0_GRPM1_GRVWA8_GRVWB8_GSUn1_GSUAMB_GSUC0_GSUWGMRR0_GLS0_ISA1201_IU2_K1_LDSTI0_LBSPPA128_LBSPPB256_LBSPPM0_LPA16_LPB8_LPM0_LRVW8_LWPMn1_MIAV1_MIWT1_8_MO40_NTn1_NTA0_NTB0_NTC0_NTD0_NTM0_NEPBS0_NLCA1_NLCB1_ONLL0_PGR2_PLR1_PKA0_SIA2_SS0_SU32_SUM0_SUS256_SPO0_SRVW0_SSO0_SVW8_SK0_SKFTR0_SKXCCM0_TLDS1_ULSGRO1_USL1_UIOFGRO0_USFGROn1_VSn1_VWA1_VWB8_WSGRA0_WSGRB0_WS32_WG16_4_1_WGM8_WGMXCC1_WGMXCCGn1
    SolutionIndex: 212
    SolutionNameMin: Cijk_Ailk_Bljk_I8II_BH_SHB_HA_S_SCD_SAV_UserArgs_MT64x64x64_MI16x16x1_SN_LDSB0_AFC1_AG0_AFEM1_AFEM1_ASEM1_CLR1_CADS0_DTLA0_DTLB0_DTVA0_DTVB0_EPS0_FDSI0_GRPM1_GRVWA16_GRVWB16_GSUn1_GSUAMB_GSUC0_GSUWGMRR0_GLS0_ISA1201_IU1_K1_LDSTI0_LBSPPA1024_LBSPPB128_LBSPPM0_LPA32_LPB32_LPM0_LRVW16_LWPMn1_MIAV1_MIWT2_2_MO40_NTn1_NTA0_NTB0_NTC0_NTD0_NTM0_NEPBS0_NLCA1_NLCB1_ONLL0_PGR2_PLR1_PKA0_SIA3_SS0_SU32_SUM0_SUS256_SPO0_SRVW0_SSO0_SVW16_SK0_SKFTR0_SKXCCM0_TLDS1_ULSGRO1_USL1_UIOFGRO0_USFGROn1_VSn1_VWA2_VWB2_WSGRA0_WSGRB0_WS32_WG32_4_1_WGM8_WGMXCC1_WGMXCCGn1
    SolutionIndex: 213
    SolutionNameMin: Cijk_Ailk_Bljk_I8II_BH_SHB_HA_S_SCD_SAV_UserArgs_MT16x128x64_MI16x16x1_SN_LDSB0_AFC1_AG0_AFEM1_AFEM1_ASEM64_CLR1_CADS0_DTLA0_DTLB0_DTVA0_DTVB1_EPS1_FDSI0_GRPM1_GRVWA16_GRVWB16_GSUn1_GSUAMB_GSUC0_GSUWGMRR0_GLS0_ISA1201_IU1_K1_LDSTI0_LBSPPA256_LBSPPB0_LBSPPM0_LPA16_LPB0_LPM0_LRVW16_LWPMn1_MIAV1_MIWT1_8_MO40_NTn1_NTA0_NTB0_NTC0_NTD0_NTM0_NEPBS0_NLCA1_NLCB2_ONLL0_PGR1_PLR1_PKA0_SIA3_SS0_SU32_SUM0_SUS256_SPO0_SRVW0_SSO0_SVW8_SK0_SKFTR0_SKXCCM0_TLDS1_ULSGRO0_USL1_UIOFGRO0_USFGROn1_VSn1_VWA1_VWB8_WSGRA0_WSGRB0_WS32_WG16_2_1_WGM8_WGMXCC1_WGMXCCGn1
    SolutionIndex: 216
    SolutionNameMin: Cijk_Ailk_Bljk_I8II_BH_SHB_HA_S_SCD_SAV_UserArgs_MT16x32x128_MI16x16x1_SN_LDSB0_AFC1_AG0_AFEM1_AFEM1_ASEM128_CLR1_CADS0_DTLA0_DTLB0_DTVA1_DTVB1_EPS0_FDSI0_GRPM1_GRVWA8_GRVWB8_GSUn1_GSUAMB_GSUC0_GSUWGMRR0_GLS0_ISA1201_IU1_K1_LDSTI0_LBSPPA0_LBSPPB0_LBSPPM0_LPA0_LPB0_LPM0_LRVW8_LWPMn1_MIAV1_MIWT1_1_MO40_NTn1_NTA0_NTB0_NTC0_NTD0_NTM0_NEPBS0_NLCA1_NLCB8_ONLL0_PGR1_PLR0_PKA0_SIA3_SS0_SU32_SUM0_SUS256_SPO0_SRVW0_SSO0_SVW8_SK0_SKFTR0_SKXCCM0_TLDS1_ULSGRO0_USL1_UIOFGRO0_USFGROn1_VSn1_VWA1_VWB1_WSGRA0_WSGRB0_WS32_WG16_4_1_WGM8_WGMXCC1_WGMXCCGn1
    SolutionIndex: 217
    SolutionNameMin: Cijk_Ailk_Bljk_I8II_BH_SHB_HA_S_SCD_SAV_UserArgs_MT64x64x32_MI16x16x1_SN_LDSB1_AFC1_AG0_AFEM1_AFEM1_ASEM1_CLR1_CADS0_DTLA0_DTLB0_DTVA0_DTVB0_EPS0_FDSI0_GRPM1_GRVWA16_GRVWB8_GSUn1_GSUAMB_GSUC0_GSUWGMRR0_GLS0_ISA1201_IU2_K1_LDSTI0_LBSPPA512_LBSPPB128_LBSPPM0_LPA32_LPB8_LPM0_LRVW8_LWPMn1_MIAV1_MIWT2_2_MO40_NTn1_NTA0_NTB0_NTC0_NTD0_NTM0_NEPBS0_NLCA1_NLCB1_ONLL0_PGR2_PLR1_PKA0_SIA2_SS1_SU32_SUM0_SUS256_SPO0_SRVW0_SSO0_SVW2_SK0_SKFTR0_SKXCCM0_TLDS1_ULSGRO0_USL1_UIOFGRO0_USFGROn1_VSn1_VWA2_VWB2_WSGRA0_WSGRB0_WS32_WG32_4_1_WGM8_WGMXCC1_WGMXCCGn1
    SolutionIndex: 224
    SolutionNameMin: Cijk_Ailk_Bljk_I8II_BH_SHB_HA_S_SCD_SAV_UserArgs_MT16x16x128_MI16x16x1_SN_LDSB0_AFC1_AFEM1_AFEM1_ASEM1_CLR1_CADS0_DTLA0_DTLB0_DTVA1_DTVB0_EPS1_FDSI0_GRPM1_GRVWA8_GRVWB16_GSU1_GSUAMB_GSUC0_GSUWGMRR0_GLS0_ISA1201_IU1_K1_LBSPPA0_LBSPPB128_LBSPPM0_LPA0_LPB32_LPM0_LRVW16_LWPMn1_MIAV1_MIWT1_1_MO40_NTn1_NTA0_NTB0_NTC0_NTD0_NTM0_NEPBS0_NLCA1_NLCB1_ONLL0_PGR1_PLR1_PKA0_SIA3_SS0_SU32_SUM0_SUS256_SPO0_SRVW0_SSO0_SVW8_SK0_SKXCCM0_TLDS1_ULSGRO0_USL1_UIOFGRO0_USFGROn1_VSn1_VWA1_VWB1_WSGRA0_WSGRB0_WS32_WG16_2_1_WGM8_WGMXCC1_WGMXCCGn1
    SolutionIndex: 225
    SolutionNameMin: Cijk_Ailk_Bljk_I8II_BH_SHB_HA_S_SCD_SAV_UserArgs_MT32x32x128_MI16x16x1_SN_LDSB0_AFC1_AFEM1_AFEM1_ASEM1_CLR1_CADS0_DTLA0_DTLB0_DTVA1_DTVB0_EPS0_FDSI0_GRPM1_GRVWA8_GRVWB16_GSU1_GSUAMB_GSUC0_GSUWGMRR0_GLS0_ISA1201_IU1_K1_LBSPPA0_LBSPPB128_LBSPPM0_LPA0_LPB32_LPM0_LRVW16_LWPMn1_MIAV1_MIWT1_1_MO40_NTn1_NTA0_NTB0_NTC0_NTD0_NTM0_NEPBS0_NLCA1_NLCB1_ONLL0_PGR2_PLR1_PKA0_SIA3_SS0_SU32_SUM0_SUS256_SPO0_SRVW0_SSO0_SVW8_SK0_SKXCCM0_TLDS1_ULSGRO0_USL1_UIOFGRO0_USFGROn1_VSn1_VWA1_VWB1_WSGRA0_WSGRB0_WS32_WG32_4_1_WGM8_WGMXCC1_WGMXCCGn1
    SolutionIndex: 226
    SolutionNameMin: Cijk_Ailk_Bljk_I8II_BH_SHB_HA_S_SCD_SAV_UserArgs_MT64x64x128_MI16x16x1_SN_LDSB0_AFC1_AFEM1_AFEM1_ASEM1_CLR1_CADS0_DTLA0_DTLB0_DTVA1_DTVB0_EPS1_FDSI0_GRPM1_GRVWA8_GRVWB8_GSU1_GSUAMB_GSUC0_GSUWGMRR0_GLS0_ISA1201_IU1_K1_LBSPPA0_LBSPPB256_LBSPPM0_LPA0_LPB32_LPM0_LRVW16_LWPMn1_MIAV1_MIWT2_2_MO40_NTn1_NTA0_NTB0_NTC0_NTD0_NTM0_NEPBS0_NLCA8_NLCB1_ONLL0_PGR1_PLR1_PKA0_SIA3_SS0_SU32_SUM0_SUS256_SPO0_SRVW0_SSO0_SVW8_SK0_SKXCCM0_TLDS1_ULSGRO0_USL1_UIOFGRO0_USFGROn1_VSn1_VWA1_VWB2_WSGRA0_WSGRB0_WS32_WG32_4_1_WGM8_WGMXCC1_WGMXCCGn1
    SolutionIndex: 228
    SolutionNameMin: Cijk_Ailk_Bljk_I8II_BH_SHB_HA_S_SCD_SAV_UserArgs_MT64x64x128_MI16x16x1_SN_LDSB0_AFC1_AFEM1_AFEM1_ASEM1_CLR1_CADS0_DTLA0_DTLB0_DTVA1_DTVB0_EPS1_FDSI0_GRPM1_GRVWA8_GRVWB16_GSU1_GSUAMB_GSUC0_GSUWGMRR0_GLS0_ISA1201_IU1_K1_LBSPPA0_LBSPPB256_LBSPPM0_LPA0_LPB32_LPM0_LRVW16_LWPMn1_MIAV1_MIWT2_2_MO40_NTn1_NTA0_NTB0_NTC0_NTD0_NTM0_NEPBS0_NLCA8_NLCB1_ONLL0_PGR1_PLR1_PKA0_SIA3_SS0_SU32_SUM0_SUS256_SPO0_SRVW0_SSO0_SVW8_SK0_SKXCCM0_TLDS1_ULSGRO0_USL1_UIOFGRO0_USFGROn1_VSn1_VWA1_VWB2_WSGRA0_WSGRB0_WS32_WG32_4_1_WGM8_WGMXCC1_WGMXCCGn1
    SolutionIndex: 229
    SolutionNameMin: Cijk_Ailk_Bljk_I8II_BH_SHB_HA_S_SCD_SAV_UserArgs_MT64x64x64_MI16x16x1_SN_LDSB0_AFC1_AFEM1_AFEM1_ASEM1_CLR1_CADS0_DTLA0_DTLB0_DTVA1_DTVB0_EPS1_FDSI0_GRPM1_GRVWA8_GRVWB16_GSU1_GSUAMB_GSUC0_GSUWGMRR0_GLS0_ISA1201_IU1_K1_LBSPPA0_LBSPPB128_LBSPPM0_LPA0_LPB32_LPM0_LRVW16_LWPMn1_MIAV1_MIWT2_2_MO40_NTn1_NTA0_NTB0_NTC0_NTD0_NTM0_NEPBS0_NLCA4_NLCB1_ONLL0_PGR1_PLR1_PKA0_SIA3_SS0_SU32_SUM0_SUS256_SPO0_SRVW0_SSO0_SVW8_SK0_SKXCCM0_TLDS1_ULSGRO0_USL1_UIOFGRO0_USFGROn1_VSn1_VWA1_VWB2_WSGRA0_WSGRB0_WS32_WG32_4_1_WGM8_WGMXCC1_WGMXCCGn1
    SolutionIndex: 231
    SolutionNameMin: Cijk_Ailk_Bljk_I8II_BH_SHB_HA_S_SCD_SAV_UserArgs_MT64x128x32_MI16x16x1_SN_LDSB0_AFC1_AFEM1_AFEM1_ASEM1_CLR1_CADS0_DTLA0_DTLB0_DTVA1_DTVB0_EPS0_FDSI0_GRPM1_GRVWA8_GRVWB4_GSU1_GSUAMB_GSUC0_GSUWGMRR0_GLS0_ISA1201_IU1_K1_LBSPPA0_LBSPPB256_LBSPPM0_LPA0_LPB8_LPM0_LRVW8_LWPMn1_MIAV1_MIWT1_8_MO40_NTn1_NTA0_NTB0_NTC0_NTD0_NTM0_NEPBS0_NLCA1_NLCB1_ONLL0_PGR2_PLR1_PKA0_SIA3_SS0_SU32_SUM0_SUS256_SPO0_SRVW0_SSO0_SVW8_SK0_SKXCCM0_TLDS1_ULSGRO0_USL1_UIOFGRO0_USFGROn1_VSn1_VWA1_VWB8_WSGRA0_WSGRB0_WS32_WG64_2_1_WGM8_WGMXCC1_WGMXCCGn1
    SolutionIndex: 236
    SolutionNameMin: Cijk_Ailk_Bljk_I8II_BH_SHB_HA_S_SCD_SAV_UserArgs_MT64x128x32_MI16x16x1_SN_LDSB1_AFC1_AFEM1_AFEM1_ASEM1_CLR1_CADS0_DTLA0_DTLB0_DTVA0_DTVB0_EPS1_FDSI0_GRPM1_GRVWA8_GRVWB4_GSU1_GSUAMB_GSUC0_GSUWGMRR0_GLS0_ISA1201_IU2_K1_LBSPPA512_LBSPPB256_LBSPPM0_LPA16_LPB8_LPM0_LRVW8_LWPMn1_MIAV1_MIWT1_8_MO40_NTn1_NTA0_NTB0_NTC0_NTD0_NTM0_NEPBS0_NLCA1_NLCB1_ONLL0_PGR1_PLR1_PKA0_SIA2_SS0_SU32_SUM0_SUS256_SPO0_SRVW0_SSO0_SVW8_SK0_SKXCCM0_TLDS1_ULSGRO0_USL1_UIOFGRO0_USFGROn1_VSn1_VWA1_VWB8_WSGRA0_WSGRB0_WS32_WG64_2_1_WGM8_WGMXCC1_WGMXCCGn1
    SolutionIndex: 237
    SolutionNameMin: Cijk_Ailk_Bljk_I8II_BH_SHB_HA_S_SCD_SAV_UserArgs_MT64x128x32_MI16x16x1_SN_LDSB1_AFC1_AFEM1_AFEM1_ASEM1_CLR1_CADS0_DTLA0_DTLB0_DTVA0_DTVB0_EPS1_FDSI0_GRPM1_GRVWA4_GRVWB8_GSU1_GSUAMB_GSUC0_GSUWGMRR0_GLS0_ISA1201_IU2_K1_LBSPPA512_LBSPPB256_LBSPPM0_LPA16_LPB8_LPM0_LRVW8_LWPMn1_MIAV1_MIWT1_8_MO40_NTn1_NTA0_NTB0_NTC0_NTD0_NTM0_NEPBS0_NLCA1_NLCB1_ONLL0_PGR1_PLR1_PKA0_SIA2_SS0_SU32_SUM0_SUS256_SPO0_SRVW0_SSO0_SVW8_SK0_SKXCCM0_TLDS1_ULSGRO0_USL1_UIOFGRO0_USFGROn1_VSn1_VWA1_VWB8_WSGRA0_WSGRB0_WS32_WG64_2_1_WGM8_WGMXCC1_WGMXCCGn1
    SolutionIndex: 240
    SolutionNameMin: Cijk_Ailk_Bljk_I8II_BH_SHB_HA_S_SCD_SAV_UserArgs_MT64x64x32_MI16x16x1_SN_LDSB0_AFC1_AFEM1_AFEM1_ASEM32_CLR1_CADS0_DTLA0_DTLB0_DTVA1_DTVB1_EPS0_FDSI0_GRPM1_GRVWA8_GRVWB8_GSU1_GSUAMB_GSUC0_GSUWGMRR0_GLS0_ISA1201_IU1_K1_LBSPPA0_LBSPPB0_LBSPPM0_LPA0_LPB0_LPM0_LRVW8_LWPMn1_MIAV1_MIWT2_2_MO40_NTn1_NTA0_NTB0_NTC0_NTD0_NTM0_NEPBS0_NLCA2_NLCB2_ONLL0_PGR1_PLR0_PKA0_SIA3_SS0_SU32_SUM0_SUS256_SPO0_SRVW0_SSO0_SVW8_SK0_SKXCCM0_TLDS1_ULSGRO0_USL1_UIOFGRO0_USFGROn1_VSn1_VWA1_VWB2_WSGRA0_WSGRB0_WS32_WG32_4_1_WGM8_WGMXCC1_WGMXCCGn1
    SolutionIndex: 244
    SolutionNameMin: Cijk_Ailk_Bljk_I8II_BH_SHB_HA_S_SCD_SAV_UserArgs_MT64x64x128_MI16x16x1_SN_LDSB0_AFC1_AFEM1_AFEM1_ASEM128_CLR1_CADS0_DTLA0_DTLB0_DTVA0_DTVB1_EPS1_FDSI0_GRPM1_GRVWA8_GRVWB16_GSU1_GSUAMB_GSUC0_GSUWGMRR0_GLS0_ISA1201_IU1_K1_LBSPPA1024_LBSPPB0_LBSPPM0_LPA32_LPB0_LPM0_LRVW16_LWPMn1_MIAV1_MIWT2_2_MO40_NTn1_NTA0_NTB0_NTC0_NTD0_NTM0_NEPBS0_NLCA1_NLCB4_ONLL0_PGR1_PLR1_PKA0_SIA3_SS0_SU32_SUM0_SUS256_SPO0_SRVW0_SSO0_SVW16_SK0_SKXCCM0_TLDS1_ULSGRO0_USL1_UIOFGRO0_USFGROn1_VSn1_VWA2_VWB2_WSGRA0_WSGRB0_WS32_WG32_4_1_WGM8_WGMXCC1_WGMXCCGn1
    SolutionIndex: 245
    SolutionNameMin: Cijk_Ailk_Bljk_I8II_BH_SHB_HA_S_SCD_SAV_UserArgs_MT64x64x32_MI16x16x1_SN_LDSB0_AFC1_AFEM1_AFEM1_ASEM1_CLR1_CADS0_DTLA0_DTLB0_DTVA1_DTVB0_EPS0_FDSI0_GRPM1_GRVWA8_GRVWB4_GSU1_GSUAMB_GSUC0_GSUWGMRR0_GLS0_ISA1201_IU1_K1_LBSPPA0_LBSPPB128_LBSPPM0_LPA0_LPB8_LPM0_LRVW8_LWPMn1_MIAV1_MIWT2_2_MO40_NTn1_NTA0_NTB0_NTC0_NTD0_NTM0_NEPBS0_NLCA2_NLCB1_ONLL0_PGR2_PLR1_PKA0_SIA3_SS0_SU32_SUM0_SUS256_SPO0_SRVW0_SSO0_SVW8_SK0_SKXCCM0_TLDS1_ULSGRO0_USL1_UIOFGRO0_USFGROn1_VSn1_VWA1_VWB2_WSGRA0_WSGRB0_WS32_WG32_4_1_WGM8_WGMXCC1_WGMXCCGn1
    SolutionIndex: 246
    SolutionNameMin: Cijk_Ailk_Bljk_I8II_BH_SHB_HA_S_SCD_SAV_UserArgs_MT64x128x32_MI16x16x1_SN_LDSB0_AFC1_AFEM1_AFEM1_ASEM1_CLR1_CADS0_DTLA0_DTLB0_DTVA1_DTVB0_EPS1_FDSI0_GRPM1_GRVWA8_GRVWB8_GSU1_GSUAMB_GSUC0_GSUWGMRR0_GLS0_ISA1201_IU1_K1_LBSPPA0_LBSPPB256_LBSPPM0_LPA0_LPB8_LPM0_LRVW8_LWPMn1_MIAV1_MIWT1_8_MO40_NTn1_NTA0_NTB0_NTC0_NTD0_NTM0_NEPBS0_NLCA1_NLCB1_ONLL0_PGR1_PLR1_PKA0_SIA3_SS0_SU32_SUM0_SUS256_SPO0_SRVW0_SSO0_SVW8_SK0_SKXCCM0_TLDS1_ULSGRO0_USL1_UIOFGRO0_USFGROn1_VSn1_VWA1_VWB8_WSGRA0_WSGRB0_WS32_WG64_2_1_WGM8_WGMXCC1_WGMXCCGn1
    SolutionIndex: 265
    SolutionNameMin: Cijk_Ailk_Bljk_I8II_BH_SHB_HA_S_SCD_SAV_UserArgs_MT32x16x256_MI16x16x1_SN_LDSB0_AFC1_AFEM1_AFEM1_ASEM1_CLR1_CADS0_DTLA0_DTLB0_DTVA1_DTVB0_EPS1_FDSI0_GRPM1_GRVWA8_GRVWB16_GSU1_GSUAMB_GSUC0_GSUWGMRR0_GLS0_ISA1201_IU1_K1_LBSPPA0_LBSPPB256_LBSPPM0_LPA0_LPB32_LPM0_LRVW16_LWPMn1_MIAV1_MIWT1_1_MO40_NTn1_NTA0_NTB0_NTC0_NTD0_NTM0_NEPBS0_NLCA1_NLCB1_ONLL0_PGR1_PLR1_PKA0_SIA3_SS0_SU32_SUM0_SUS256_SPO0_SRVW0_SSO0_SVW8_SK0_SKXCCM0_TLDS1_ULSGRO0_USL1_UIOFGRO0_USFGROn1_VSn1_VWA1_VWB1_WSGRA0_WSGRB0_WS32_WG32_2_1_WGM8_WGMXCC1_WGMXCCGn1
    SolutionIndex: 268
    SolutionNameMin: Cijk_Ailk_Bljk_I8II_BH_SHB_HA_S_SCD_SAV_UserArgs_MT32x16x128_MI16x16x1_SN_LDSB0_AFC1_AFEM1_AFEM1_ASEM1_CLR1_CADS0_DTLA0_DTLB0_DTVA1_DTVB0_EPS1_FDSI0_GRPM1_GRVWA8_GRVWB16_GSU1_GSUAMB_GSUC0_GSUWGMRR0_GLS0_ISA1201_IU1_K1_LBSPPA0_LBSPPB128_LBSPPM0_LPA0_LPB32_LPM0_LRVW16_LWPMn1_MIAV1_MIWT1_1_MO40_NTn1_NTA0_NTB0_NTC0_NTD0_NTM0_NEPBS0_NLCA1_NLCB1_ONLL0_PGR1_PLR1_PKA0_SIA3_SS0_SU32_SUM0_SUS256_SPO0_SRVW0_SSO0_SVW8_SK0_SKXCCM0_TLDS1_ULSGRO0_USL1_UIOFGRO0_USFGROn1_VSn1_VWA1_VWB1_WSGRA0_WSGRB0_WS32_WG32_2_1_WGM8_WGMXCC1_WGMXCCGn1
    SolutionIndex: 269
    SolutionNameMin: Cijk_Ailk_Bljk_I8II_BH_SHB_HA_S_SCD_SAV_UserArgs_MT64x128x32_MI16x16x1_SN_LDSB0_AFC1_AFEM1_AFEM1_ASEM1_CLR1_CADS0_DTLA0_DTLB0_DTVA1_DTVB0_EPS0_FDSI0_GRPM1_GRVWA8_GRVWB8_GSU1_GSUAMB_GSUC0_GSUWGMRR0_GLS0_ISA1201_IU1_K1_LBSPPA0_LBSPPB256_LBSPPM0_LPA0_LPB8_LPM0_LRVW8_LWPMn1_MIAV1_MIWT1_8_MO40_NTn1_NTA0_NTB0_NTC0_NTD0_NTM0_NEPBS0_NLCA1_NLCB1_ONLL0_PGR2_PLR1_PKA0_SIA3_SS0_SU32_SUM0_SUS256_SPO0_SRVW0_SSO0_SVW8_SK0_SKXCCM0_TLDS1_ULSGRO0_USL1_UIOFGRO0_USFGROn1_VSn1_VWA1_VWB8_WSGRA0_WSGRB0_WS32_WG64_2_1_WGM8_WGMXCC1_WGMXCCGn1
    SolutionIndex: 271
    SolutionNameMin: Cijk_Ailk_Bljk_I8II_BH_SHB_HA_S_SCD_SAV_UserArgs_MT128x128x16_MI16x16x1_SN_LDSB1_AFC1_AFEM1_AFEM1_ASEM1_CLR1_CADS0_DTLA0_DTLB0_DTVA0_DTVB0_EPS0_FDSI0_GRPM1_GRVWA16_GRVWB8_GSU1_GSUAMB_GSUC0_GSUWGMRR0_GLS0_ISA1201_IU1_K1_LBSPPA1024_LBSPPB128_LBSPPM0_LPA64_LPB8_LPM0_LRVW8_LWPMn1_MIAV1_MIWT4_4_MO40_NTn1_NTA0_NTB0_NTC0_NTD0_NTM0_NEPBS0_NLCA1_NLCB1_ONLL0_PGR2_PLR1_PKA0_SIA2_SS1_SU32_SUM0_SUS256_SPO0_SRVW0_SSO0_SVW4_SK0_SKXCCM0_TLDS1_ULSGRO0_USL1_UIOFGRO0_USFGROn1_VSn1_VWA4_VWB4_WSGRA0_WSGRB0_WS32_WG32_4_1_WGM8_WGMXCC1_WGMXCCGn1
    SolutionIndex: 273
    SolutionNameMin: Cijk_Ailk_Bljk_I8II_BH_SHB_HA_S_SCD_SAV_UserArgs_MT64x64x128_MI16x16x1_SN_LDSB0_AFC1_AFEM1_AFEM1_ASEM128_CLR1_CADS0_DTLA0_DTLB0_DTVA0_DTVB1_EPS1_FDSI0_GRPM1_GRVWA16_GRVWB16_GSU1_GSUAMB_GSUC0_GSUWGMRR0_GLS0_ISA1201_IU1_K1_LBSPPA1024_LBSPPB0_LBSPPM0_LPA32_LPB0_LPM0_LRVW16_LWPMn1_MIAV1_MIWT2_2_MO40_NTn1_NTA0_NTB0_NTC0_NTD0_NTM0_NEPBS0_NLCA1_NLCB4_ONLL0_PGR1_PLR1_PKA0_SIA3_SS0_SU32_SUM0_SUS256_SPO0_SRVW0_SSO0_SVW16_SK0_SKXCCM0_TLDS1_ULSGRO0_USL1_UIOFGRO0_USFGROn1_VSn1_VWA2_VWB2_WSGRA0_WSGRB0_WS32_WG32_4_1_WGM8_WGMXCC1_WGMXCCGn1
    SolutionIndex: 276
    SolutionNameMin: Cijk_Ailk_Bljk_I8II_BH_SHB_HA_S_SCD_SAV_UserArgs_MT128x128x16_MI16x16x1_SN_LDSB1_AFC1_AFEM1_AFEM1_ASEM1_CLR1_CADS0_DTLA0_DTLB0_DTVA0_DTVB0_EPS1_FDSI0_GRPM1_GRVWA8_GRVWB8_GSU1_GSUAMB_GSUC0_GSUWGMRR0_GLS0_ISA1201_IU1_K1_LBSPPA1024_LBSPPB128_LBSPPM0_LPA64_LPB8_LPM0_LRVW8_LWPMn1_MIAV1_MIWT4_4_MO40_NTn1_NTA0_NTB0_NTC0_NTD0_NTM0_NEPBS0_NLCA1_NLCB1_ONLL0_PGR1_PLR1_PKA0_SIA2_SS1_SU32_SUM0_SUS256_SPO0_SRVW0_SSO0_SVW4_SK0_SKXCCM0_TLDS1_ULSGRO0_USL1_UIOFGRO0_USFGROn1_VSn1_VWA4_VWB4_WSGRA0_WSGRB0_WS32_WG32_4_1_WGM8_WGMXCC1_WGMXCCGn1
    SolutionIndex: 282
    SolutionNameMin: Cijk_Ailk_Bljk_I8II_BH_SHB_HA_S_SCD_SAV_UserArgs_MT64x64x16_MI16x16x1_SN_LDSB0_AFC1_AFEM1_AFEM1_ASEM16_CLR1_CADS0_DTLA0_DTLB0_DTVA1_DTVB1_EPS0_FDSI0_GRPM1_GRVWA8_GRVWB8_GSU1_GSUAMB_GSUC0_GSUWGMRR0_GLS0_ISA1201_IU1_K1_LBSPPA0_LBSPPB0_LBSPPM0_LPA0_LPB0_LPM0_LRVW8_LWPMn1_MIAV1_MIWT2_2_MO40_NTn1_NTA0_NTB0_NTC0_NTD0_NTM0_NEPBS0_NLCA1_NLCB1_ONLL0_PGR1_PLR0_PKA0_SIA3_SS0_SU32_SUM0_SUS256_SPO0_SRVW0_SSO0_SVW8_SK0_SKXCCM0_TLDS1_ULSGRO0_USL1_UIOFGRO0_USFGROn1_VSn1_VWA1_VWB2_WSGRA0_WSGRB0_WS32_WG32_4_1_WGM8_WGMXCC1_WGMXCCGn1
    SolutionIndex: 366
    SolutionNameMin: Cijk_Ailk_Bljk_I8II_BH_SHB_HA_S_SCD_SAV_UserArgs_MT16x16x128_MI16x16x1_SN_LDSB0_AFC1_AFEM1_AFEM1_ASEM1_CLR1_CADS0_DTLA0_DTLB0_DTVA1_DTVB0_EPS1_FDSI0_GRPM1_GRVWA8_GRVWB8_GSUn1_GSUAMB_GSUC0_GSUWGMRR0_GLS0_ISA1201_IU1_K1_LBSPPA0_LBSPPB128_LBSPPM0_LPA0_LPB32_LPM0_LRVW16_LWPMn1_MIAV1_MIWT1_1_MO40_NTn1_NTA0_NTB0_NTC0_NTD0_NTM0_NEPBS0_NLCA1_NLCB1_ONLL0_PGR1_PLR1_PKA0_SIA3_SS0_SU32_SUM0_SUS256_SPO0_SRVW0_SSO0_SVW8_SK0_SKXCCM0_TLDS1_ULSGRO0_USL1_UIOFGRO0_USFGROn1_VSn1_VWA1_VWB1_WSGRA0_WSGRB0_WS32_WG16_2_1_WGM8_WGMXCC1_WGMXCCGn1
    SolutionIndex: 367
    SolutionNameMin: Cijk_Ailk_Bljk_I8II_BH_SHB_HA_S_SCD_SAV_UserArgs_MT64x64x32_MI16x16x1_SN_LDSB1_AFC1_AFEM1_AFEM1_ASEM1_CLR1_CADS0_DTLA0_DTLB0_DTVA0_DTVB0_EPS1_FDSI0_GRPM1_GRVWA8_GRVWB8_GSUn1_GSUAMB_GSUC0_GSUWGMRR0_GLS0_ISA1201_IU2_K1_LBSPPA512_LBSPPB128_LBSPPM0_LPA32_LPB8_LPM0_LRVW8_LWPMn1_MIAV1_MIWT2_2_MO40_NTn1_NTA0_NTB0_NTC0_NTD0_NTM0_NEPBS0_NLCA1_NLCB1_ONLL0_PGR1_PLR1_PKA0_SIA2_SS1_SU32_SUM0_SUS256_SPO0_SRVW0_SSO0_SVW2_SK0_SKXCCM0_TLDS1_ULSGRO0_USL1_UIOFGRO0_USFGROn1_VSn1_VWA2_VWB2_WSGRA0_WSGRB0_WS32_WG32_4_1_WGM8_WGMXCC1_WGMXCCGn1
    SolutionIndex: 371
    SolutionNameMin: Cijk_Ailk_Bljk_I8II_BH_SHB_HA_S_SCD_SAV_UserArgs_MT64x64x128_MI16x16x1_SN_LDSB0_AFC1_AFEM1_AFEM1_ASEM1_CLR1_CADS0_DTLA0_DTLB0_DTVA1_DTVB0_EPS1_FDSI0_GRPM1_GRVWA8_GRVWB16_GSUn1_GSUAMB_GSUC0_GSUWGMRR0_GLS0_ISA1201_IU1_K1_LBSPPA0_LBSPPB256_LBSPPM0_LPA0_LPB32_LPM0_LRVW16_LWPMn1_MIAV1_MIWT2_2_MO40_NTn1_NTA0_NTB0_NTC0_NTD0_NTM0_NEPBS0_NLCA8_NLCB1_ONLL0_PGR1_PLR1_PKA0_SIA3_SS0_SU32_SUM0_SUS256_SPO0_SRVW0_SSO0_SVW8_SK0_SKXCCM0_TLDS1_ULSGRO0_USL1_UIOFGRO0_USFGROn1_VSn1_VWA1_VWB2_WSGRA0_WSGRB0_WS32_WG32_4_1_WGM8_WGMXCC1_WGMXCCGn1
    SolutionIndex: 372
    SolutionNameMin: Cijk_Ailk_Bljk_I8II_BH_SHB_HA_S_SCD_SAV_UserArgs_MT32x16x128_MI16x16x1_SN_LDSB0_AFC1_AFEM1_AFEM1_ASEM1_CLR1_CADS0_DTLA0_DTLB0_DTVA1_DTVB0_EPS1_FDSI0_GRPM1_GRVWA8_GRVWB4_GSUn1_GSUAMB_GSUC0_GSUWGMRR0_GLS0_ISA1201_IU1_K1_LBSPPA0_LBSPPB128_LBSPPM0_LPA0_LPB32_LPM0_LRVW16_LWPMn1_MIAV1_MIWT1_1_MO40_NTn1_NTA0_NTB0_NTC0_NTD0_NTM0_NEPBS0_NLCA1_NLCB1_ONLL0_PGR1_PLR1_PKA0_SIA3_SS0_SU32_SUM0_SUS256_SPO0_SRVW0_SSO0_SVW8_SK0_SKXCCM0_TLDS1_ULSGRO0_USL1_UIOFGRO0_USFGROn1_VSn1_VWA1_VWB1_WSGRA0_WSGRB0_WS32_WG32_2_1_WGM8_WGMXCC1_WGMXCCGn1
    SolutionIndex: 373
    SolutionNameMin: Cijk_Ailk_Bljk_I8II_BH_SHB_HA_S_SCD_SAV_UserArgs_MT64x128x64_MI16x16x1_SN_LDSB0_AFC1_AG0_AFEM1_AFEM1_ASEM1_CLR1_CADS0_DTLA0_DTLB0_DTVA1_DTVB0_EPS0_FDSI0_GRPM1_GRVWA8_GRVWB8_GSUn1_GSUAMB_GSUC0_GSUWGMRR0_GLS0_ISA1201_IU1_K1_LDSTI0_LBSPPA0_LBSPPB512_LBSPPM0_LPA0_LPB8_LPM0_LRVW8_LWPMn1_MIAV1_MIWT1_8_MO40_NTn1_NTA0_NTB0_NTC0_NTD0_NTM0_NEPBS0_NLCA1_NLCB1_ONLL0_PGR2_PLR1_PKA0_SIA3_SS0_SU32_SUM0_SUS256_SPO0_SRVW0_SSO0_SVW8_SK0_SKFTR0_SKXCCM0_TLDS1_ULSGRO0_USL1_UIOFGRO0_USFGROn1_VSn1_VWA1_VWB8_WSGRA0_WSGRB0_WS32_WG64_2_1_WGM8_WGMXCC1_WGMXCCGn1
    SolutionIndex: 374
    SolutionNameMin: Cijk_Ailk_Bljk_I8II_BH_SHB_HA_S_SCD_SAV_UserArgs_MT32x16x256_MI16x16x1_SN_LDSB0_AFC1_AFEM1_AFEM1_ASEM1_CLR1_CADS0_DTLA0_DTLB0_DTVA1_DTVB0_EPS1_FDSI0_GRPM1_GRVWA8_GRVWB16_GSUn1_GSUAMB_GSUC0_GSUWGMRR0_GLS0_ISA1201_IU1_K1_LBSPPA0_LBSPPB256_LBSPPM0_LPA0_LPB32_LPM0_LRVW16_LWPMn1_MIAV1_MIWT1_1_MO40_NTn1_NTA0_NTB0_NTC0_NTD0_NTM0_NEPBS0_NLCA1_NLCB1_ONLL0_PGR1_PLR1_PKA0_SIA3_SS1_SU32_SUM0_SUS256_SPO0_SRVW0_SSO0_SVW1_SK0_SKXCCM0_TLDS1_ULSGRO0_USL1_UIOFGRO0_USFGROn1_VSn1_VWA1_VWB1_WSGRA0_WSGRB0_WS32_WG32_2_1_WGM8_WGMXCC1_WGMXCCGn1
    SolutionIndex: 375
    SolutionNameMin: Cijk_Ailk_Bljk_I8II_BH_SHB_HA_S_SCD_SAV_UserArgs_MT128x64x16_MI16x16x1_SN_LDSB0_AFC1_AFEM1_AFEM1_ASEM16_CLR1_CADS0_DTLA0_DTLB0_DTVA1_DTVB1_EPS0_FDSI0_GRPM1_GRVWA8_GRVWB8_GSUn1_GSUAMB_GSUC0_GSUWGMRR0_GLS0_ISA1201_IU1_K1_LBSPPA0_LBSPPB0_LBSPPM0_LPA0_LPB0_LPM0_LRVW8_LWPMn1_MIAV1_MIWT8_1_MO40_NTn1_NTA0_NTB0_NTC0_NTD0_NTM0_NEPBS0_NLCA1_NLCB1_ONLL0_PGR1_PLR0_PKA0_SIA3_SS0_SU32_SUM0_SUS256_SPO0_SRVW0_SSO0_SVW8_SK0_SKXCCM0_TLDS1_ULSGRO0_USL1_UIOFGRO0_USFGROn1_VSn1_VWA1_VWB1_WSGRA0_WSGRB0_WS32_WG16_8_1_WGM8_WGMXCC1_WGMXCCGn1
- - - [64, 64, 1, 64]
    - [208, 0.03]
  - - [128, 64, 1, 64]
    - [75, 0.05]
  - - [192, 64, 1, 64]
    - [168, 0.08]
  - - [256, 64, 1, 64]
    - [67, 0.11]
  - - [320, 64, 1, 64]
    - [66, 0.14]
  - - [384, 64, 1, 64]
    - [67, 0.16]
  - - [448, 64, 1, 64]
    - [70, 0.18]
  - - [512, 64, 1, 64]
    - [69, 0.21]
  - - [576, 64, 1, 64]
    - [70, 0.24]
  - - [640, 64, 1, 64]
    - [69, 0.24]
  - - [704, 64, 1, 64]
    - [75, 0.28]
  - - [768, 64, 1, 64]
    - [145, 0.3]
  - - [832, 64, 1, 64]
    - [69, 0.34]
  - - [896, 64, 1, 64]
    - [147, 0.35]
  - - [960, 64, 1, 64]
    - [34, 0.38]
  - - [1024, 64, 1, 64]
    - [5, 0.39]
  - - [64, 128, 1, 64]
    - [66, 0.05]
  - - [128, 128, 1, 64]
    - [75, 0.1]
  - - [192, 128, 1, 64]
    - [34, 0.15]
  - - [256, 128, 1, 64]
    - [134, 0.2]
  - - [320, 128, 1, 64]
    - [74, 0.26]
  - - [384, 128, 1, 64]
    - [69, 0.31]
  - - [448, 128, 1, 64]
    - [72, 0.35]
  - - [512, 128, 1, 64]
    - [72, 0.41]
  - - [576, 128, 1, 64]
    - [23, 0.45]
  - - [640, 128, 1, 64]
    - [40, 0.51]
  - - [704, 128, 1, 64]
    - [28, 0.56]
  - - [768, 128, 1, 64]
    - [28, 0.6]
  - - [832, 128, 1, 64]
    - [64, 0.65]
  - - [896, 128, 1, 64]
    - [44, 0.7]
  - - [960, 128, 1, 64]
    - [28, 0.76]
  - - [1024, 128, 1, 64]
    - [80, 0.81]
  - - [64, 192, 1, 64]
    - [74, 0.08]
  - - [128, 192, 1, 64]
    - [69, 0.16]
  - - [192, 192, 1, 64]
    - [170, 0.23]
  - - [256, 192, 1, 64]
    - [67, 0.31]
  - - [320, 192, 1, 64]
    - [69, 0.38]
  - - [384, 192, 1, 64]
    - [85, 0.43]
  - - [448, 192, 1, 64]
    - [64, 0.52]
  - - [512, 192, 1, 64]
    - [42, 0.57]
  - - [576, 192, 1, 64]
    - [61, 0.67]
  - - [640, 192, 1, 64]
    - [26, 0.72]
  - - [704, 192, 1, 64]
    - [171, 0.75]
  - - [768, 192, 1, 64]
    - [41, 0.87]
  - - [832, 192, 1, 64]
    - [64, 0.92]
  - - [896, 192, 1, 64]
    - [40, 1.01]
  - - [960, 192, 1, 64]
    - [29, 1.07]
  - - [1024, 192, 1, 64]
    - [41, 1.14]
  - - [64, 256, 1, 64]
    - [73, 0.11]
  - - [128, 256, 1, 64]
    - [67, 0.21]
  - - [192, 256, 1, 64]
    - [69, 0.31]
  - - [256, 256, 1, 64]
    - [66, 0.41]
  - - [320, 256, 1, 64]
    - [82, 0.5]
  - - [384, 256, 1, 64]
    - [84, 0.57]
  - - [448, 256, 1, 64]
    - [64, 0.67]
  - - [512, 256, 1, 64]
    - [45, 0.76]
  - - [576, 256, 1, 64]
    - [45, 0.84]
  - - [640, 256, 1, 64]
    - [78, 0.92]
  - - [704, 256, 1, 64]
    - [61, 1.05]
  - - [768, 256, 1, 64]
    - [31, 1.13]
  - - [832, 256, 1, 64]
    - [61, 1.25]
  - - [896, 256, 1, 64]
    - [81, 1.34]
  - - [960, 256, 1, 64]
    - [25, 1.43]
  - - [1024, 256, 1, 64]
    - [28, 1.54]
  - - [64, 320, 1, 64]
    - [69, 0.13]
  - - [128, 320, 1, 64]
    - [75, 0.26]
  - - [192, 320, 1, 64]
    - [70, 0.38]
  - - [256, 320, 1, 64]
    - [78, 0.5]
  - - [320, 320, 1, 64]
    - [59, 0.63]
  - - [384, 320, 1, 64]
    - [79, 0.76]
  - - [448, 320, 1, 64]
    - [64, 0.85]
  - - [512, 320, 1, 64]
    - [85, 0.96]
  - - [576, 320, 1, 64]
    - [209, 1.08]
  - - [640, 320, 1, 64]
    - [31, 1.2]
  - - [704, 320, 1, 64]
    - [31, 1.3]
  - - [768, 320, 1, 64]
    - [61, 1.42]
  - - [832, 320, 1, 64]
    - [28, 1.5]
  - - [896, 320, 1, 64]
    - [56, 1.52]
  - - [960, 320, 1, 64]
    - [64, 1.71]
  - - [1024, 320, 1, 64]
    - [31, 1.76]
  - - [64, 384, 1, 64]
    - [5, 0.15]
  - - [128, 384, 1, 64]
    - [80, 0.3]
  - - [192, 384, 1, 64]
    - [64, 0.45]
  - - [256, 384, 1, 64]
    - [78, 0.6]
  - - [320, 384, 1, 64]
    - [28, 0.76]
  - - [384, 384, 1, 64]
    - [64, 0.87]
  - - [448, 384, 1, 64]
    - [29, 1.01]
  - - [512, 384, 1, 64]
    - [64, 1.15]
  - - [576, 384, 1, 64]
    - [62, 1.29]
  - - [640, 384, 1, 64]
    - [40, 1.46]
  - - [704, 384, 1, 64]
    - [31, 1.51]
  - - [768, 384, 1, 64]
    - [28, 1.64]
  - - [832, 384, 1, 64]
    - [82, 1.78]
  - - [896, 384, 1, 64]
    - [81, 1.81]
  - - [960, 384, 1, 64]
    - [85, 1.97]
  - - [1024, 384, 1, 64]
    - [88, 2.07]
  - - [64, 448, 1, 64]
    - [68, 0.18]
  - - [128, 448, 1, 64]
    - [32, 0.34]
  - - [192, 448, 1, 64]
    - [64, 0.52]
  - - [256, 448, 1, 64]
    - [29, 0.67]
  - - [320, 448, 1, 64]
    - [64, 0.84]
  - - [384, 448, 1, 64]
    - [64, 0.97]
  - - [448, 448, 1, 64]
    - [28, 1.17]
  - - [512, 448, 1, 64]
    - [138, 1.32]
  - - [576, 448, 1, 64]
    - [61, 1.49]
  - - [640, 448, 1, 64]
    - [137, 1.57]
  - - [704, 448, 1, 64]
    - [85, 1.74]
  - - [768, 448, 1, 64]
    - [64, 1.9]
  - - [832, 448, 1, 64]
    - [64, 2.07]
  - - [896, 448, 1, 64]
    - [36, 2.19]
  - - [960, 448, 1, 64]
    - [86, 2.32]
  - - [1024, 448, 1, 64]
    - [86, 2.45]
  - - [64, 512, 1, 64]
    - [69, 0.21]
  - - [128, 512, 1, 64]
    - [69, 0.41]
  - - [192, 512, 1, 64]
    - [85, 0.61]
  - - [256, 512, 1, 64]
    - [25, 0.81]
  - - [320, 512, 1, 64]
    - [60, 0.96]
  - - [384, 512, 1, 64]
    - [64, 1.15]
  - - [448, 512, 1, 64]
    - [25, 1.33]
  - - [512, 512, 1, 64]
    - [39, 1.5]
  - - [576, 512, 1, 64]
    - [28, 1.63]
  - - [640, 512, 1, 64]
    - [29, 1.76]
  - - [704, 512, 1, 64]
    - [1, 1.93]
  - - [768, 512, 1, 64]
    - [28, 2.13]
  - - [832, 512, 1, 64]
    - [48, 2.21]
  - - [896, 512, 1, 64]
    - [52, 2.47]
  - - [960, 512, 1, 64]
    - [87, 2.57]
  - - [1024, 512, 1, 64]
    - [9, 2.73]
  - - [64, 576, 1, 64]
    - [69, 0.24]
  - - [128, 576, 1, 64]
    - [29, 0.43]
  - - [192, 576, 1, 64]
    - [64, 0.63]
  - - [256, 576, 1, 64]
    - [138, 0.86]
  - - [320, 576, 1, 64]
    - [1, 1.07]
  - - [384, 576, 1, 64]
    - [41, 1.3]
  - - [448, 576, 1, 64]
    - [29, 1.49]
  - - [512, 576, 1, 64]
    - [63, 1.64]
  - - [576, 576, 1, 64]
    - [28, 1.8]
  - - [640, 576, 1, 64]
    - [64, 2.06]
  - - [704, 576, 1, 64]
    - [87, 2.18]
  - - [768, 576, 1, 64]
    - [36, 2.41]
  - - [832, 576, 1, 64]
    - [29, 2.44]
  - - [896, 576, 1, 64]
    - [38, 2.81]
  - - [960, 576, 1, 64]
    - [87, 2.8]
  - - [1024, 576, 1, 64]
    - [57, 2.95]
  - - [64, 640, 1, 64]
    - [33, 0.25]
  - - [128, 640, 1, 64]
    - [60, 0.5]
  - - [192, 640, 1, 64]
    - [43, 0.73]
  - - [256, 640, 1, 64]
    - [31, 0.95]
  - - [320, 640, 1, 64]
    - [63, 1.19]
  - - [384, 640, 1, 64]
    - [60, 1.44]
  - - [448, 640, 1, 64]
    - [31, 1.59]
  - - [512, 640, 1, 64]
    - [28, 1.82]
  - - [576, 640, 1, 64]
    - [28, 2.05]
  - - [640, 640, 1, 64]
    - [48, 2.23]
  - - [704, 640, 1, 64]
    - [86, 2.44]
  - - [768, 640, 1, 64]
    - [38, 2.65]
  - - [832, 640, 1, 64]
    - [86, 2.76]
  - - [896, 640, 1, 64]
    - [87, 2.95]
  - - [960, 640, 1, 64]
    - [87, 3.12]
  - - [1024, 640, 1, 64]
    - [58, 3.29]
  - - [64, 704, 1, 64]
    - [75, 0.28]
  - - [128, 704, 1, 64]
    - [79, 0.54]
  - - [192, 704, 1, 64]
    - [81, 0.79]
  - - [256, 704, 1, 64]
    - [64, 1.05]
  - - [320, 704, 1, 64]
    - [64, 1.3]
  - - [384, 704, 1, 64]
    - [59, 1.49]
  - - [448, 704, 1, 64]
    - [28, 1.74]
  - - [512, 704, 1, 64]
    - [31, 1.94]
  - - [576, 704, 1, 64]
    - [87, 2.17]
  - - [640, 704, 1, 64]
    - [7, 2.41]
  - - [704, 704, 1, 64]
    - [4, 2.53]
  - - [768, 704, 1, 64]
    - [86, 2.77]
  - - [832, 704, 1, 64]
    - [86, 2.85]
  - - [896, 704, 1, 64]
    - [86, 3.22]
  - - [960, 704, 1, 64]
    - [87, 3.3]
  - - [1024, 704, 1, 64]
    - [36, 3.65]
  - - [64, 768, 1, 64]
    - [35, 0.3]
  - - [128, 768, 1, 64]
    - [80, 0.6]
  - - [192, 768, 1, 64]
    - [64, 0.87]
  - - [256, 768, 1, 64]
    - [40, 1.16]
  - - [320, 768, 1, 64]
    - [64, 1.42]
  - - [384, 768, 1, 64]
    - [28, 1.64]
  - - [448, 768, 1, 64]
    - [28, 1.91]
  - - [512, 768, 1, 64]
    - [31, 2.15]
  - - [576, 768, 1, 64]
    - [87, 2.41]
  - - [640, 768, 1, 64]
    - [8, 2.62]
  - - [704, 768, 1, 64]
    - [87, 2.69]
  - - [768, 768, 1, 64]
    - [57, 2.89]
  - - [832, 768, 1, 64]
    - [9, 3.08]
  - - [896, 768, 1, 64]
    - [36, 3.44]
  - - [960, 768, 1, 64]
    - [86, 3.57]
  - - [1024, 768, 1, 64]
    - [36, 3.95]
  - - [64, 832, 1, 64]
    - [67, 0.33]
  - - [128, 832, 1, 64]
    - [80, 0.66]
  - - [192, 832, 1, 64]
    - [63, 0.87]
  - - [256, 832, 1, 64]
    - [31, 1.25]
  - - [320, 832, 1, 64]
    - [210, 1.45]
  - - [384, 832, 1, 64]
    - [25, 1.78]
  - - [448, 832, 1, 64]
    - [64, 1.97]
  - - [512, 832, 1, 64]
    - [86, 2.26]
  - - [576, 832, 1, 64]
    - [86, 2.52]
  - - [640, 832, 1, 64]
    - [141, 2.68]
  - - [704, 832, 1, 64]
    - [86, 2.83]
  - - [768, 832, 1, 64]
    - [14, 3.25]
  - - [832, 832, 1, 64]
    - [7, 3.36]
  - - [896, 832, 1, 64]
    - [135, 3.76]
  - - [960, 832, 1, 64]
    - [86, 3.63]
  - - [1024, 832, 1, 64]
    - [19, 3.95]
  - - [64, 896, 1, 64]
    - [34, 0.35]
  - - [128, 896, 1, 64]
    - [78, 0.71]
  - - [192, 896, 1, 64]
    - [64, 1.0]
  - - [256, 896, 1, 64]
    - [41, 1.28]
  - - [320, 896, 1, 64]
    - [28, 1.54]
  - - [384, 896, 1, 64]
    - [138, 1.87]
  - - [448, 896, 1, 64]
    - [86, 2.11]
  - - [512, 896, 1, 64]
    - [148, 2.43]
  - - [576, 896, 1, 64]
    - [87, 2.78]
  - - [640, 896, 1, 64]
    - [53, 2.91]
  - - [704, 896, 1, 64]
    - [52, 3.22]
  - - [768, 896, 1, 64]
    - [87, 3.54]
  - - [832, 896, 1, 64]
    - [87, 3.79]
  - - [896, 896, 1, 64]
    - [0, 3.97]
  - - [960, 896, 1, 64]
    - [7, 4.12]
  - - [1024, 896, 1, 64]
    - [17, 4.43]
  - - [64, 960, 1, 64]
    - [170, 0.36]
  - - [128, 960, 1, 64]
    - [80, 0.75]
  - - [192, 960, 1, 64]
    - [61, 1.08]
  - - [256, 960, 1, 64]
    - [64, 1.44]
  - - [320, 960, 1, 64]
    - [4, 1.68]
  - - [384, 960, 1, 64]
    - [139, 1.99]
  - - [448, 960, 1, 64]
    - [86, 2.2]
  - - [512, 960, 1, 64]
    - [31, 2.58]
  - - [576, 960, 1, 64]
    - [172, 2.74]
  - - [640, 960, 1, 64]
    - [36, 2.98]
  - - [704, 960, 1, 64]
    - [86, 3.39]
  - - [768, 960, 1, 64]
    - [57, 3.59]
  - - [832, 960, 1, 64]
    - [86, 3.72]
  - - [896, 960, 1, 64]
    - [6, 4.06]
  - - [960, 960, 1, 64]
    - [53, 4.29]
  - - [1024, 960, 1, 64]
    - [123, 4.6]
  - - [64, 1024, 1, 64]
    - [72, 0.41]
  - - [128, 1024, 1, 64]
    - [64, 0.8]
  - - [192, 1024, 1, 64]
    - [64, 1.17]
  - - [256, 1024, 1, 64]
    - [61, 1.52]
  - - [320, 1024, 1, 64]
    - [44, 1.82]
  - - [384, 1024, 1, 64]
    - [44, 2.19]
  - - [448, 1024, 1, 64]
    - [46, 2.48]
  - - [512, 1024, 1, 64]
    - [142, 2.8]
  - - [576, 1024, 1, 64]
    - [48, 3.03]
  - - [640, 1024, 1, 64]
    - [48, 3.34]
  - - [704, 1024, 1, 64]
    - [87, 3.66]
  - - [768, 1024, 1, 64]
    - [7, 3.94]
  - - [832, 1024, 1, 64]
    - [53, 3.97]
  - - [896, 1024, 1, 64]
    - [19, 4.46]
  - - [960, 1024, 1, 64]
    - [49, 4.41]
  - - [1024, 1024, 1, 64]
    - [193, 5.02]
  - - [64, 64, 1, 256]
    - [216, 0.1]
  - - [128, 64, 1, 256]
    - [99, 0.21]
  - - [192, 64, 1, 256]
    - [103, 0.29]
  - - [256, 64, 1, 256]
    - [112, 0.4]
  - - [320, 64, 1, 256]
    - [97, 0.49]
  - - [384, 64, 1, 256]
    - [112, 0.58]
  - - [448, 64, 1, 256]
    - [71, 0.69]
  - - [512, 64, 1, 256]
    - [113, 0.77]
  - - [576, 64, 1, 256]
    - [100, 0.91]
  - - [640, 64, 1, 256]
    - [113, 0.93]
  - - [704, 64, 1, 256]
    - [100, 1.05]
  - - [768, 64, 1, 256]
    - [89, 1.11]
  - - [832, 64, 1, 256]
    - [71, 1.27]
  - - [896, 64, 1, 256]
    - [100, 1.27]
  - - [960, 64, 1, 256]
    - [177, 1.37]
  - - [1024, 64, 1, 256]
    - [104, 1.47]
  - - [64, 128, 1, 256]
    - [100, 0.19]
  - - [128, 128, 1, 256]
    - [103, 0.38]
  - - [192, 128, 1, 256]
    - [167, 0.59]
  - - [256, 128, 1, 256]
    - [100, 0.81]
  - - [320, 128, 1, 256]
    - [99, 0.94]
  - - [384, 128, 1, 256]
    - [99, 1.12]
  - - [448, 128, 1, 256]
    - [70, 1.29]
  - - [512, 128, 1, 256]
    - [101, 1.45]
  - - [576, 128, 1, 256]
    - [89, 1.7]
  - - [640, 128, 1, 256]
    - [104, 1.91]
  - - [704, 128, 1, 256]
    - [89, 2.08]
  - - [768, 128, 1, 256]
    - [104, 2.26]
  - - [832, 128, 1, 256]
    - [89, 2.47]
  - - [896, 128, 1, 256]
    - [89, 2.67]
  - - [960, 128, 1, 256]
    - [61, 2.78]
  - - [1024, 128, 1, 256]
    - [104, 3.04]
  - - [64, 192, 1, 256]
    - [103, 0.29]
  - - [128, 192, 1, 256]
    - [100, 0.61]
  - - [192, 192, 1, 256]
    - [99, 0.85]
  - - [256, 192, 1, 256]
    - [96, 1.14]
  - - [320, 192, 1, 256]
    - [100, 1.37]
  - - [384, 192, 1, 256]
    - [61, 1.6]
  - - [448, 192, 1, 256]
    - [89, 1.87]
  - - [512, 192, 1, 256]
    - [78, 2.16]
  - - [576, 192, 1, 256]
    - [60, 2.44]
  - - [640, 192, 1, 256]
    - [60, 2.78]
  - - [704, 192, 1, 256]
    - [61, 2.86]
  - - [768, 192, 1, 256]
    - [60, 3.18]
  - - [832, 192, 1, 256]
    - [81, 3.36]
  - - [896, 192, 1, 256]
    - [89, 3.73]
  - - [960, 192, 1, 256]
    - [60, 3.85]
  - - [1024, 192, 1, 256]
    - [89, 4.23]
  - - [64, 256, 1, 256]
    - [98, 0.41]
  - - [128, 256, 1, 256]
    - [100, 0.8]
  - - [192, 256, 1, 256]
    - [71, 1.16]
  - - [256, 256, 1, 256]
    - [67, 1.53]
  - - [320, 256, 1, 256]
    - [89, 1.87]
  - - [384, 256, 1, 256]
    - [78, 2.27]
  - - [448, 256, 1, 256]
    - [89, 2.61]
  - - [512, 256, 1, 256]
    - [60, 2.95]
  - - [576, 256, 1, 256]
    - [89, 3.3]
  - - [640, 256, 1, 256]
    - [61, 3.57]
  - - [704, 256, 1, 256]
    - [61, 3.83]
  - - [768, 256, 1, 256]
    - [78, 4.08]
  - - [832, 256, 1, 256]
    - [27, 4.28]
  - - [896, 256, 1, 256]
    - [61, 4.68]
  - - [960, 256, 1, 256]
    - [61, 5.18]
  - - [1024, 256, 1, 256]
    - [60, 5.32]
  - - [64, 320, 1, 256]
    - [99, 0.51]
  - - [128, 320, 1, 256]
    - [112, 0.97]
  - - [192, 320, 1, 256]
    - [99, 1.41]
  - - [256, 320, 1, 256]
    - [78, 1.88]
  - - [320, 320, 1, 256]
    - [89, 2.29]
  - - [384, 320, 1, 256]
    - [104, 2.83]
  - - [448, 320, 1, 256]
    - [89, 3.13]
  - - [512, 320, 1, 256]
    - [60, 3.57]
  - - [576, 320, 1, 256]
    - [60, 3.88]
  - - [640, 320, 1, 256]
    - [89, 4.5]
  - - [704, 320, 1, 256]
    - [89, 4.8]
  - - [768, 320, 1, 256]
    - [78, 5.35]
  - - [832, 320, 1, 256]
    - [29, 5.21]
  - - [896, 320, 1, 256]
    - [78, 5.81]
  - - [960, 320, 1, 256]
    - [60, 6.22]
  - - [1024, 320, 1, 256]
    - [89, 6.59]
  - - [64, 384, 1, 256]
    - [93, 0.6]
  - - [128, 384, 1, 256]
    - [94, 1.15]
  - - [192, 384, 1, 256]
    - [89, 1.71]
  - - [256, 384, 1, 256]
    - [78, 2.18]
  - - [320, 384, 1, 256]
    - [28, 2.68]
  - - [384, 384, 1, 256]
    - [106, 3.13]
  - - [448, 384, 1, 256]
    - [60, 3.7]
  - - [512, 384, 1, 256]
    - [60, 4.24]
  - - [576, 384, 1, 256]
    - [89, 4.77]
  - - [640, 384, 1, 256]
    - [78, 5.27]
  - - [704, 384, 1, 256]
    - [60, 5.5]
  - - [768, 384, 1, 256]
    - [60, 5.95]
  - - [832, 384, 1, 256]
    - [60, 6.43]
  - - [896, 384, 1, 256]
    - [78, 6.99]
  - - [960, 384, 1, 256]
    - [61, 7.31]
  - - [1024, 384, 1, 256]
    - [54, 7.75]
  - - [64, 448, 1, 256]
    - [94, 0.69]
  - - [128, 448, 1, 256]
    - [100, 1.36]
  - - [192, 448, 1, 256]
    - [106, 1.92]
  - - [256, 448, 1, 256]
    - [79, 2.67]
  - - [320, 448, 1, 256]
    - [82, 3.14]
  - - [384, 448, 1, 256]
    - [29, 3.64]
  - - [448, 448, 1, 256]
    - [60, 4.26]
  - - [512, 448, 1, 256]
    - [86, 4.73]
  - - [576, 448, 1, 256]
    - [61, 5.42]
  - - [640, 448, 1, 256]
    - [60, 5.68]
  - - [704, 448, 1, 256]
    - [45, 6.22]
  - - [768, 448, 1, 256]
    - [78, 6.6]
  - - [832, 448, 1, 256]
    - [29, 7.29]
  - - [896, 448, 1, 256]
    - [86, 7.7]
  - - [960, 448, 1, 256]
    - [86, 7.83]
  - - [1024, 448, 1, 256]
    - [86, 8.71]
  - - [64, 512, 1, 256]
    - [99, 0.76]
  - - [128, 512, 1, 256]
    - [100, 1.45]
  - - [192, 512, 1, 256]
    - [89, 2.12]
  - - [256, 512, 1, 256]
    - [78, 2.78]
  - - [320, 512, 1, 256]
    - [89, 3.3]
  - - [384, 512, 1, 256]
    - [104, 4.16]
  - - [448, 512, 1, 256]
    - [60, 4.71]
  - - [512, 512, 1, 256]
    - [60, 5.33]
  - - [576, 512, 1, 256]
    - [61, 5.9]
  - - [640, 512, 1, 256]
    - [78, 6.58]
  - - [704, 512, 1, 256]
    - [86, 7.15]
  - - [768, 512, 1, 256]
    - [61, 7.77]
  - - [832, 512, 1, 256]
    - [86, 8.37]
  - - [896, 512, 1, 256]
    - [76, 8.53]
  - - [960, 512, 1, 256]
    - [86, 8.98]
  - - [1024, 512, 1, 256]
    - [53, 9.83]
  - - [64, 576, 1, 256]
    - [100, 0.92]
  - - [128, 576, 1, 256]
    - [104, 1.64]
  - - [192, 576, 1, 256]
    - [89, 2.51]
  - - [256, 576, 1, 256]
    - [60, 3.14]
  - - [320, 576, 1, 256]
    - [89, 4.04]
  - - [384, 576, 1, 256]
    - [89, 4.66]
  - - [448, 576, 1, 256]
    - [63, 5.47]
  - - [512, 576, 1, 256]
    - [86, 5.74]
  - - [576, 576, 1, 256]
    - [61, 6.64]
  - - [640, 576, 1, 256]
    - [40, 7.18]
  - - [704, 576, 1, 256]
    - [29, 7.68]
  - - [768, 576, 1, 256]
    - [86, 8.59]
  - - [832, 576, 1, 256]
    - [29, 8.96]
  - - [896, 576, 1, 256]
    - [77, 9.5]
  - - [960, 576, 1, 256]
    - [60, 9.39]
  - - [1024, 576, 1, 256]
    - [87, 9.96]
  - - [64, 640, 1, 256]
    - [115, 0.95]
  - - [128, 640, 1, 256]
    - [70, 1.79]
  - - [192, 640, 1, 256]
    - [61, 2.7]
  - - [256, 640, 1, 256]
    - [79, 3.56]
  - - [320, 640, 1, 256]
    - [61, 4.45]
  - - [384, 640, 1, 256]
    - [89, 5.22]
  - - [448, 640, 1, 256]
    - [61, 5.85]
  - - [512, 640, 1, 256]
    - [86, 6.53]
  - - [576, 640, 1, 256]
    - [29, 7.45]
  - - [640, 640, 1, 256]
    - [86, 8.08]
  - - [704, 640, 1, 256]
    - [86, 8.86]
  - - [768, 640, 1, 256]
    - [20, 9.36]
  - - [832, 640, 1, 256]
    - [86, 9.41]
  - - [896, 640, 1, 256]
    - [86, 10.33]
  - - [960, 640, 1, 256]
    - [86, 10.89]
  - - [1024, 640, 1, 256]
    - [86, 11.77]
  - - [64, 704, 1, 256]
    - [146, 1.05]
  - - [128, 704, 1, 256]
    - [89, 2.07]
  - - [192, 704, 1, 256]
    - [61, 2.95]
  - - [256, 704, 1, 256]
    - [151, 3.79]
  - - [320, 704, 1, 256]
    - [89, 4.88]
  - - [384, 704, 1, 256]
    - [89, 5.22]
  - - [448, 704, 1, 256]
    - [89, 6.38]
  - - [512, 704, 1, 256]
    - [24, 6.78]
  - - [576, 704, 1, 256]
    - [86, 7.9]
  - - [640, 704, 1, 256]
    - [76, 8.54]
  - - [704, 704, 1, 256]
    - [89, 9.21]
  - - [768, 704, 1, 256]
    - [86, 9.4]
  - - [832, 704, 1, 256]
    - [86, 10.29]
  - - [896, 704, 1, 256]
    - [36, 10.82]
  - - [960, 704, 1, 256]
    - [86, 11.41]
  - - [1024, 704, 1, 256]
    - [86, 11.96]
  - - [64, 768, 1, 256]
    - [102, 1.13]
  - - [128, 768, 1, 256]
    - [161, 2.15]
  - - [192, 768, 1, 256]
    - [89, 3.21]
  - - [256, 768, 1, 256]
    - [79, 4.26]
  - - [320, 768, 1, 256]
    - [89, 5.31]
  - - [384, 768, 1, 256]
    - [28, 5.75]
  - - [448, 768, 1, 256]
    - [90, 6.65]
  - - [512, 768, 1, 256]
    - [144, 7.32]
  - - [576, 768, 1, 256]
    - [89, 8.0]
  - - [640, 768, 1, 256]
    - [76, 9.28]
  - - [704, 768, 1, 256]
    - [61, 9.42]
  - - [768, 768, 1, 256]
    - [86, 10.36]
  - - [832, 768, 1, 256]
    - [89, 11.09]
  - - [896, 768, 1, 256]
    - [86, 12.19]
  - - [960, 768, 1, 256]
    - [86, 12.75]
  - - [1024, 768, 1, 256]
    - [86, 13.33]
  - - [64, 832, 1, 256]
    - [98, 1.31]
  - - [128, 832, 1, 256]
    - [104, 2.47]
  - - [192, 832, 1, 256]
    - [89, 3.28]
  - - [256, 832, 1, 256]
    - [79, 4.69]
  - - [320, 832, 1, 256]
    - [61, 5.57]
  - - [384, 832, 1, 256]
    - [61, 6.53]
  - - [448, 832, 1, 256]
    - [132, 7.07]
  - - [512, 832, 1, 256]
    - [86, 8.36]
  - - [576, 832, 1, 256]
    - [86, 9.41]
  - - [640, 832, 1, 256]
    - [76, 9.46]
  - - [704, 832, 1, 256]
    - [29, 10.09]
  - - [768, 832, 1, 256]
    - [41, 11.1]
  - - [832, 832, 1, 256]
    - [86, 12.22]
  - - [896, 832, 1, 256]
    - [76, 12.59]
  - - [960, 832, 1, 256]
    - [50, 11.98]
  - - [1024, 832, 1, 256]
    - [19, 13.33]
  - - [64, 896, 1, 256]
    - [97, 1.29]
  - - [128, 896, 1, 256]
    - [78, 2.51]
  - - [192, 896, 1, 256]
    - [89, 3.78]
  - - [256, 896, 1, 256]
    - [79, 4.94]
  - - [320, 896, 1, 256]
    - [60, 5.87]
  - - [384, 896, 1, 256]
    - [61, 6.62]
  - - [448, 896, 1, 256]
    - [86, 7.62]
  - - [512, 896, 1, 256]
    - [86, 8.6]
  - - [576, 896, 1, 256]
    - [86, 9.96]
  - - [640, 896, 1, 256]
    - [37, 10.28]
  - - [704, 896, 1, 256]
    - [86, 11.26]
  - - [768, 896, 1, 256]
    - [19, 11.93]
  - - [832, 896, 1, 256]
    - [86, 12.78]
  - - [896, 896, 1, 256]
    - [19, 13.82]
  - - [960, 896, 1, 256]
    - [87, 13.55]
  - - [1024, 896, 1, 256]
    - [16, 15.19]
  - - [64, 960, 1, 256]
    - [94, 1.45]
  - - [128, 960, 1, 256]
    - [89, 2.75]
  - - [192, 960, 1, 256]
    - [89, 3.96]
  - - [256, 960, 1, 256]
    - [78, 5.31]
  - - [320, 960, 1, 256]
    - [29, 6.17]
  - - [384, 960, 1, 256]
    - [41, 7.23]
  - - [448, 960, 1, 256]
    - [87, 8.32]
  - - [512, 960, 1, 256]
    - [86, 9.52]
  - - [576, 960, 1, 256]
    - [86, 9.82]
  - - [640, 960, 1, 256]
    - [86, 10.97]
  - - [704, 960, 1, 256]
    - [53, 11.72]
  - - [768, 960, 1, 256]
    - [53, 12.85]
  - - [832, 960, 1, 256]
    - [87, 12.39]
  - - [896, 960, 1, 256]
    - [20, 14.28]
  - - [960, 960, 1, 256]
    - [53, 14.4]
  - - [1024, 960, 1, 256]
    - [16, 15.72]
  - - [64, 1024, 1, 256]
    - [94, 1.52]
  - - [128, 1024, 1, 256]
    - [104, 3.01]
  - - [192, 1024, 1, 256]
    - [89, 4.32]
  - - [256, 1024, 1, 256]
    - [78, 5.66]
  - - [320, 1024, 1, 256]
    - [53, 6.59]
  - - [384, 1024, 1, 256]
    - [86, 7.43]
  - - [448, 1024, 1, 256]
    - [53, 8.68]
  - - [512, 1024, 1, 256]
    - [86, 9.41]
  - - [576, 1024, 1, 256]
    - [86, 10.21]
  - - [640, 1024, 1, 256]
    - [61, 11.02]
  - - [704, 1024, 1, 256]
    - [53, 12.38]
  - - [768, 1024, 1, 256]
    - [86, 13.25]
  - - [832, 1024, 1, 256]
    - [53, 13.36]
  - - [896, 1024, 1, 256]
    - [19, 14.9]
  - - [960, 1024, 1, 256]
    - [86, 15.0]
  - - [1024, 1024, 1, 256]
    - [17, 17.05]
  - - [64, 64, 1, 512]
    - [366, 0.2]
  - - [128, 64, 1, 512]
    - [111, 0.37]
  - - [192, 64, 1, 512]
    - [100, 0.58]
  - - [256, 64, 1, 512]
    - [111, 0.73]
  - - [320, 64, 1, 512]
    - [98, 0.96]
  - - [384, 64, 1, 512]
    - [108, 1.09]
  - - [448, 64, 1, 512]
    - [98, 1.3]
  - - [512, 64, 1, 512]
    - [109, 1.49]
  - - [576, 64, 1, 512]
    - [225, 1.68]
  - - [640, 64, 1, 512]
    - [98, 1.71]
  - - [704, 64, 1, 512]
    - [100, 1.88]
  - - [768, 64, 1, 512]
    - [70, 2.12]
  - - [832, 64, 1, 512]
    - [158, 2.33]
  - - [896, 64, 1, 512]
    - [104, 2.48]
  - - [960, 64, 1, 512]
    - [158, 2.54]
  - - [1024, 64, 1, 512]
    - [104, 2.89]
  - - [64, 128, 1, 512]
    - [108, 0.39]
  - - [128, 128, 1, 512]
    - [113, 0.78]
  - - [192, 128, 1, 512]
    - [65, 1.11]
  - - [256, 128, 1, 512]
    - [167, 1.44]
  - - [320, 128, 1, 512]
    - [100, 1.79]
  - - [384, 128, 1, 512]
    - [104, 2.09]
  - - [448, 128, 1, 512]
    - [70, 2.37]
  - - [512, 128, 1, 512]
    - [89, 2.7]
  - - [576, 128, 1, 512]
    - [89, 3.06]
  - - [640, 128, 1, 512]
    - [104, 3.38]
  - - [704, 128, 1, 512]
    - [89, 3.7]
  - - [768, 128, 1, 512]
    - [104, 4.15]
  - - [832, 128, 1, 512]
    - [89, 4.42]
  - - [896, 128, 1, 512]
    - [104, 4.74]
  - - [960, 128, 1, 512]
    - [89, 5.07]
  - - [1024, 128, 1, 512]
    - [89, 5.45]
  - - [64, 192, 1, 512]
    - [99, 0.59]
  - - [128, 192, 1, 512]
    - [109, 1.15]
  - - [192, 192, 1, 512]
    - [94, 1.68]
  - - [256, 192, 1, 512]
    - [104, 2.16]
  - - [320, 192, 1, 512]
    - [89, 2.72]
  - - [384, 192, 1, 512]
    - [104, 3.22]
  - - [448, 192, 1, 512]
    - [89, 3.74]
  - - [512, 192, 1, 512]
    - [89, 4.33]
  - - [576, 192, 1, 512]
    - [89, 4.81]
  - - [640, 192, 1, 512]
    - [104, 5.39]
  - - [704, 192, 1, 512]
    - [61, 5.45]
  - - [768, 192, 1, 512]
    - [89, 6.12]
  - - [832, 192, 1, 512]
    - [89, 6.51]
  - - [896, 192, 1, 512]
    - [78, 6.99]
  - - [960, 192, 1, 512]
    - [89, 7.11]
  - - [1024, 192, 1, 512]
    - [61, 7.44]
  - - [64, 256, 1, 512]
    - [108, 0.74]
  - - [128, 256, 1, 512]
    - [108, 1.49]
  - - [192, 256, 1, 512]
    - [98, 2.09]
  - - [256, 256, 1, 512]
    - [89, 2.8]
  - - [320, 256, 1, 512]
    - [89, 3.54]
  - - [384, 256, 1, 512]
    - [90, 4.14]
  - - [448, 256, 1, 512]
    - [89, 4.76]
  - - [512, 256, 1, 512]
    - [89, 5.58]
  - - [576, 256, 1, 512]
    - [82, 5.88]
  - - [640, 256, 1, 512]
    - [104, 6.4]
  - - [704, 256, 1, 512]
    - [90, 7.1]
  - - [768, 256, 1, 512]
    - [89, 7.67]
  - - [832, 256, 1, 512]
    - [89, 8.46]
  - - [896, 256, 1, 512]
    - [78, 9.0]
  - - [960, 256, 1, 512]
    - [61, 9.46]
  - - [1024, 256, 1, 512]
    - [61, 10.5]
  - - [64, 320, 1, 512]
    - [67, 0.92]
  - - [128, 320, 1, 512]
    - [93, 1.86]
  - - [192, 320, 1, 512]
    - [99, 2.6]
  - - [256, 320, 1, 512]
    - [89, 3.62]
  - - [320, 320, 1, 512]
    - [90, 4.31]
  - - [384, 320, 1, 512]
    - [105, 5.24]
  - - [448, 320, 1, 512]
    - [90, 5.66]
  - - [512, 320, 1, 512]
    - [87, 6.33]
  - - [576, 320, 1, 512]
    - [90, 7.45]
  - - [640, 320, 1, 512]
    - [104, 8.27]
  - - [704, 320, 1, 512]
    - [60, 8.82]
  - - [768, 320, 1, 512]
    - [61, 9.54]
  - - [832, 320, 1, 512]
    - [60, 9.77]
  - - [896, 320, 1, 512]
    - [61, 10.12]
  - - [960, 320, 1, 512]
    - [62, 10.92]
  - - [1024, 320, 1, 512]
    - [61, 11.34]
  - - [64, 384, 1, 512]
    - [93, 1.1]
  - - [128, 384, 1, 512]
    - [113, 2.11]
  - - [192, 384, 1, 512]
    - [61, 3.04]
  - - [256, 384, 1, 512]
    - [89, 4.18]
  - - [320, 384, 1, 512]
    - [89, 5.09]
  - - [384, 384, 1, 512]
    - [104, 5.81]
  - - [448, 384, 1, 512]
    - [89, 6.73]
  - - [512, 384, 1, 512]
    - [86, 7.46]
  - - [576, 384, 1, 512]
    - [60, 8.28]
  - - [640, 384, 1, 512]
    - [79, 9.45]
  - - [704, 384, 1, 512]
    - [89, 9.5]
  - - [768, 384, 1, 512]
    - [107, 10.24]
  - - [832, 384, 1, 512]
    - [107, 11.0]
  - - [896, 384, 1, 512]
    - [79, 12.42]
  - - [960, 384, 1, 512]
    - [86, 12.99]
  - - [1024, 384, 1, 512]
    - [87, 13.58]
  - - [64, 448, 1, 512]
    - [100, 1.28]
  - - [128, 448, 1, 512]
    - [98, 2.57]
  - - [192, 448, 1, 512]
    - [89, 3.53]
  - - [256, 448, 1, 512]
    - [104, 5.04]
  - - [320, 448, 1, 512]
    - [106, 5.5]
  - - [384, 448, 1, 512]
    - [89, 7.01]
  - - [448, 448, 1, 512]
    - [86, 7.67]
  - - [512, 448, 1, 512]
    - [107, 8.98]
  - - [576, 448, 1, 512]
    - [155, 9.73]
  - - [640, 448, 1, 512]
    - [79, 10.8]
  - - [704, 448, 1, 512]
    - [83, 11.55]
  - - [768, 448, 1, 512]
    - [86, 12.42]
  - - [832, 448, 1, 512]
    - [86, 13.25]
  - - [896, 448, 1, 512]
    - [86, 13.71]
  - - [960, 448, 1, 512]
    - [86, 15.02]
  - - [1024, 448, 1, 512]
    - [86, 14.98]
  - - [64, 512, 1, 512]
    - [159, 1.46]
  - - [128, 512, 1, 512]
    - [161, 2.77]
  - - [192, 512, 1, 512]
    - [106, 4.16]
  - - [256, 512, 1, 512]
    - [104, 5.72]
  - - [320, 512, 1, 512]
    - [60, 6.5]
  - - [384, 512, 1, 512]
    - [89, 7.98]
  - - [448, 512, 1, 512]
    - [89, 9.19]
  - - [512, 512, 1, 512]
    - [107, 10.18]
  - - [576, 512, 1, 512]
    - [60, 10.76]
  - - [640, 512, 1, 512]
    - [61, 12.01]
  - - [704, 512, 1, 512]
    - [86, 13.04]
  - - [768, 512, 1, 512]
    - [83, 14.26]
  - - [832, 512, 1, 512]
    - [86, 14.99]
  - - [896, 512, 1, 512]
    - [86, 16.3]
  - - [960, 512, 1, 512]
    - [87, 17.08]
  - - [1024, 512, 1, 512]
    - [53, 17.96]
  - - [64, 576, 1, 512]
    - [224, 1.71]
  - - [128, 576, 1, 512]
    - [89, 3.13]
  - - [192, 576, 1, 512]
    - [89, 4.7]
  - - [256, 576, 1, 512]
    - [60, 5.9]
  - - [320, 576, 1, 512]
    - [61, 7.31]
  - - [384, 576, 1, 512]
    - [61, 8.8]
  - - [448, 576, 1, 512]
    - [89, 9.99]
  - - [512, 576, 1, 512]
    - [86, 10.51]
  - - [576, 576, 1, 512]
    - [229, 12.37]
  - - [640, 576, 1, 512]
    - [61, 13.1]
  - - [704, 576, 1, 512]
    - [86, 14.12]
  - - [768, 576, 1, 512]
    - [86, 15.46]
  - - [832, 576, 1, 512]
    - [63, 14.99]
  - - [896, 576, 1, 512]
    - [76, 17.84]
  - - [960, 576, 1, 512]
    - [86, 16.99]
  - - [1024, 576, 1, 512]
    - [86, 18.05]
  - - [64, 640, 1, 512]
    - [112, 1.91]
  - - [128, 640, 1, 512]
    - [104, 3.66]
  - - [192, 640, 1, 512]
    - [89, 5.26]
  - - [256, 640, 1, 512]
    - [89, 6.61]
  - - [320, 640, 1, 512]
    - [89, 8.43]
  - - [384, 640, 1, 512]
    - [86, 9.72]
  - - [448, 640, 1, 512]
    - [89, 10.55]
  - - [512, 640, 1, 512]
    - [62, 11.73]
  - - [576, 640, 1, 512]
    - [61, 12.69]
  - - [640, 640, 1, 512]
    - [86, 14.06]
  - - [704, 640, 1, 512]
    - [86, 15.35]
  - - [768, 640, 1, 512]
    - [86, 15.72]
  - - [832, 640, 1, 512]
    - [86, 16.12]
  - - [896, 640, 1, 512]
    - [86, 17.43]
  - - [960, 640, 1, 512]
    - [86, 18.38]
  - - [1024, 640, 1, 512]
    - [86, 20.2]
  - - [64, 704, 1, 512]
    - [100, 2.07]
  - - [128, 704, 1, 512]
    - [89, 3.96]
  - - [192, 704, 1, 512]
    - [89, 5.56]
  - - [256, 704, 1, 512]
    - [61, 7.25]
  - - [320, 704, 1, 512]
    - [89, 8.98]
  - - [384, 704, 1, 512]
    - [78, 10.11]
  - - [448, 704, 1, 512]
    - [89, 11.31]
  - - [512, 704, 1, 512]
    - [107, 12.76]
  - - [576, 704, 1, 512]
    - [86, 14.32]
  - - [640, 704, 1, 512]
    - [76, 15.79]
  - - [704, 704, 1, 512]
    - [60, 15.74]
  - - [768, 704, 1, 512]
    - [87, 15.72]
  - - [832, 704, 1, 512]
    - [86, 17.99]
  - - [896, 704, 1, 512]
    - [86, 18.38]
  - - [960, 704, 1, 512]
    - [86, 20.06]
  - - [1024, 704, 1, 512]
    - [86, 20.23]
  - - [64, 768, 1, 512]
    - [103, 2.23]
  - - [128, 768, 1, 512]
    - [107, 4.1]
  - - [192, 768, 1, 512]
    - [89, 5.93]
  - - [256, 768, 1, 512]
    - [89, 7.45]
  - - [320, 768, 1, 512]
    - [89, 9.45]
  - - [384, 768, 1, 512]
    - [78, 10.6]
  - - [448, 768, 1, 512]
    - [53, 12.21]
  - - [512, 768, 1, 512]
    - [91, 13.21]
  - - [576, 768, 1, 512]
    - [86, 14.93]
  - - [640, 768, 1, 512]
    - [86, 16.42]
  - - [704, 768, 1, 512]
    - [86, 16.2]
  - - [768, 768, 1, 512]
    - [86, 17.52]
  - - [832, 768, 1, 512]
    - [86, 19.35]
  - - [896, 768, 1, 512]
    - [76, 20.36]
  - - [960, 768, 1, 512]
    - [86, 21.9]
  - - [1024, 768, 1, 512]
    - [86, 23.07]
  - - [64, 832, 1, 512]
    - [159, 2.38]
  - - [128, 832, 1, 512]
    - [89, 4.38]
  - - [192, 832, 1, 512]
    - [89, 6.51]
  - - [256, 832, 1, 512]
    - [90, 8.1]
  - - [320, 832, 1, 512]
    - [61, 10.23]
  - - [384, 832, 1, 512]
    - [78, 11.66]
  - - [448, 832, 1, 512]
    - [62, 13.11]
  - - [512, 832, 1, 512]
    - [86, 14.23]
  - - [576, 832, 1, 512]
    - [86, 16.28]
  - - [640, 832, 1, 512]
    - [86, 16.77]
  - - [704, 832, 1, 512]
    - [86, 17.88]
  - - [768, 832, 1, 512]
    - [86, 19.23]
  - - [832, 832, 1, 512]
    - [86, 21.03]
  - - [896, 832, 1, 512]
    - [76, 22.06]
  - - [960, 832, 1, 512]
    - [86, 20.95]
  - - [1024, 832, 1, 512]
    - [19, 23.96]
  - - [64, 896, 1, 512]
    - [108, 2.63]
  - - [128, 896, 1, 512]
    - [104, 4.97]
  - - [192, 896, 1, 512]
    - [90, 6.99]
  - - [256, 896, 1, 512]
    - [61, 9.16]
  - - [320, 896, 1, 512]
    - [60, 10.67]
  - - [384, 896, 1, 512]
    - [78, 12.3]
  - - [448, 896, 1, 512]
    - [86, 14.03]
  - - [512, 896, 1, 512]
    - [86, 15.59]
  - - [576, 896, 1, 512]
    - [86, 16.43]
  - - [640, 896, 1, 512]
    - [86, 16.97]
  - - [704, 896, 1, 512]
    - [86, 17.87]
  - - [768, 896, 1, 512]
    - [87, 19.35]
  - - [832, 896, 1, 512]
    - [86, 20.4]
  - - [896, 896, 1, 512]
    - [19, 22.59]
  - - [960, 896, 1, 512]
    - [86, 22.57]
  - - [1024, 896, 1, 512]
    - [19, 25.33]
  - - [64, 960, 1, 512]
    - [100, 2.83]
  - - [128, 960, 1, 512]
    - [89, 5.31]
  - - [192, 960, 1, 512]
    - [89, 7.44]
  - - [256, 960, 1, 512]
    - [61, 9.72]
  - - [320, 960, 1, 512]
    - [60, 11.0]
  - - [384, 960, 1, 512]
    - [86, 13.22]
  - - [448, 960, 1, 512]
    - [86, 14.2]
  - - [512, 960, 1, 512]
    - [86, 17.27]
  - - [576, 960, 1, 512]
    - [87, 16.83]
  - - [640, 960, 1, 512]
    - [86, 17.92]
  - - [704, 960, 1, 512]
    - [86, 20.72]
  - - [768, 960, 1, 512]
    - [86, 21.7]
  - - [832, 960, 1, 512]
    - [86, 21.99]
  - - [896, 960, 1, 512]
    - [20, 23.76]
  - - [960, 960, 1, 512]
    - [86, 24.69]
  - - [1024, 960, 1, 512]
    - [87, 25.78]
  - - [64, 1024, 1, 512]
    - [108, 2.95]
  - - [128, 1024, 1, 512]
    - [104, 5.4]
  - - [192, 1024, 1, 512]
    - [89, 8.13]
  - - [256, 1024, 1, 512]
    - [78, 10.29]
  - - [320, 1024, 1, 512]
    - [83, 12.07]
  - - [384, 1024, 1, 512]
    - [86, 14.16]
  - - [448, 1024, 1, 512]
    - [86, 16.16]
  - - [512, 1024, 1, 512]
    - [86, 18.25]
  - - [576, 1024, 1, 512]
    - [86, 18.69]
  - - [640, 1024, 1, 512]
    - [86, 20.43]
  - - [704, 1024, 1, 512]
    - [86, 22.0]
  - - [768, 1024, 1, 512]
    - [86, 23.75]
  - - [832, 1024, 1, 512]
    - [87, 23.22]
  - - [896, 1024, 1, 512]
    - [22, 25.97]
  - - [960, 1024, 1, 512]
    - [52, 26.04]
  - - [1024, 1024, 1, 512]
    - [17, 27.4]
  - - [64, 64, 1, 1024]
    - [217, 0.29]
  - - [128, 64, 1, 1024]
    - [108, 0.71]
  - - [192, 64, 1, 1024]
    - [103, 1.06]
  - - [256, 64, 1, 1024]
    - [98, 1.41]
  - - [320, 64, 1, 1024]
    - [100, 1.79]
  - - [384, 64, 1, 1024]
    - [113, 2.11]
  - - [448, 64, 1, 1024]
    - [100, 2.47]
  - - [512, 64, 1, 1024]
    - [109, 2.78]
  - - [576, 64, 1, 1024]
    - [99, 3.05]
  - - [640, 64, 1, 1024]
    - [94, 3.3]
  - - [704, 64, 1, 1024]
    - [98, 3.29]
  - - [768, 64, 1, 1024]
    - [110, 3.79]
  - - [832, 64, 1, 1024]
    - [100, 4.05]
  - - [896, 64, 1, 1024]
    - [106, 4.47]
  - - [960, 64, 1, 1024]
    - [106, 4.48]
  - - [1024, 64, 1, 1024]
    - [106, 5.08]
  - - [64, 128, 1, 1024]
    - [112, 0.74]
  - - [128, 128, 1, 1024]
    - [112, 1.46]
  - - [192, 128, 1, 1024]
    - [108, 2.13]
  - - [256, 128, 1, 1024]
    - [112, 2.71]
  - - [320, 128, 1, 1024]
    - [100, 3.17]
  - - [384, 128, 1, 1024]
    - [110, 3.68]
  - - [448, 128, 1, 1024]
    - [110, 4.22]
  - - [512, 128, 1, 1024]
    - [95, 4.82]
  - - [576, 128, 1, 1024]
    - [89, 5.66]
  - - [640, 128, 1, 1024]
    - [104, 6.45]
  - - [704, 128, 1, 1024]
    - [90, 6.84]
  - - [768, 128, 1, 1024]
    - [89, 7.63]
  - - [832, 128, 1, 1024]
    - [89, 8.16]
  - - [896, 128, 1, 1024]
    - [104, 9.02]
  - - [960, 128, 1, 1024]
    - [89, 9.42]
  - - [1024, 128, 1, 1024]
    - [104, 10.05]
  - - [64, 192, 1, 1024]
    - [100, 1.08]
  - - [128, 192, 1, 1024]
    - [112, 2.08]
  - - [192, 192, 1, 1024]
    - [100, 2.85]
  - - [256, 192, 1, 1024]
    - [110, 3.7]
  - - [320, 192, 1, 1024]
    - [100, 4.45]
  - - [384, 192, 1, 1024]
    - [104, 5.93]
  - - [448, 192, 1, 1024]
    - [89, 6.42]
  - - [512, 192, 1, 1024]
    - [89, 7.21]
  - - [576, 192, 1, 1024]
    - [89, 8.12]
  - - [640, 192, 1, 1024]
    - [104, 9.81]
  - - [704, 192, 1, 1024]
    - [89, 9.92]
  - - [768, 192, 1, 1024]
    - [89, 10.76]
  - - [832, 192, 1, 1024]
    - [90, 11.46]
  - - [896, 192, 1, 1024]
    - [104, 11.9]
  - - [960, 192, 1, 1024]
    - [89, 12.42]
  - - [1024, 192, 1, 1024]
    - [90, 13.18]
  - - [64, 256, 1, 1024]
    - [114, 1.4]
  - - [128, 256, 1, 1024]
    - [109, 2.65]
  - - [192, 256, 1, 1024]
    - [98, 3.75]
  - - [256, 256, 1, 1024]
    - [165, 4.86]
  - - [320, 256, 1, 1024]
    - [89, 6.35]
  - - [384, 256, 1, 1024]
    - [104, 7.85]
  - - [448, 256, 1, 1024]
    - [89, 8.81]
  - - [512, 256, 1, 1024]
    - [89, 10.15]
  - - [576, 256, 1, 1024]
    - [89, 10.7]
  - - [640, 256, 1, 1024]
    - [104, 11.97]
  - - [704, 256, 1, 1024]
    - [89, 12.9]
  - - [768, 256, 1, 1024]
    - [89, 13.56]
  - - [832, 256, 1, 1024]
    - [89, 14.05]
  - - [896, 256, 1, 1024]
    - [104, 15.3]
  - - [960, 256, 1, 1024]
    - [89, 16.02]
  - - [1024, 256, 1, 1024]
    - [89, 18.0]
  - - [64, 320, 1, 1024]
    - [100, 1.82]
  - - [128, 320, 1, 1024]
    - [100, 3.33]
  - - [192, 320, 1, 1024]
    - [93, 4.55]
  - - [256, 320, 1, 1024]
    - [89, 6.28]
  - - [320, 320, 1, 1024]
    - [89, 8.1]
  - - [384, 320, 1, 1024]
    - [104, 9.62]
  - - [448, 320, 1, 1024]
    - [89, 10.05]
  - - [512, 320, 1, 1024]
    - [107, 11.17]
  - - [576, 320, 1, 1024]
    - [89, 13.1]
  - - [640, 320, 1, 1024]
    - [104, 14.41]
  - - [704, 320, 1, 1024]
    - [91, 14.47]
  - - [768, 320, 1, 1024]
    - [104, 16.26]
  - - [832, 320, 1, 1024]
    - [61, 16.15]
  - - [896, 320, 1, 1024]
    - [79, 17.46]
  - - [960, 320, 1, 1024]
    - [86, 17.73]
  - - [1024, 320, 1, 1024]
    - [89, 19.69]
  - - [64, 384, 1, 1024]
    - [112, 2.1]
  - - [128, 384, 1, 1024]
    - [100, 3.83]
  - - [192, 384, 1, 1024]
    - [90, 5.45]
  - - [256, 384, 1, 1024]
    - [89, 7.32]
  - - [320, 384, 1, 1024]
    - [89, 9.25]
  - - [384, 384, 1, 1024]
    - [89, 10.63]
  - - [448, 384, 1, 1024]
    - [89, 11.78]
  - - [512, 384, 1, 1024]
    - [87, 12.9]
  - - [576, 384, 1, 1024]
    - [87, 14.67]
  - - [640, 384, 1, 1024]
    - [104, 16.8]
  - - [704, 384, 1, 1024]
    - [86, 16.21]
  - - [768, 384, 1, 1024]
    - [86, 17.14]
  - - [832, 384, 1, 1024]
    - [86, 18.56]
  - - [896, 384, 1, 1024]
    - [79, 20.75]
  - - [960, 384, 1, 1024]
    - [91, 20.67]
  - - [1024, 384, 1, 1024]
    - [90, 22.0]
  - - [64, 448, 1, 1024]
    - [94, 2.38]
  - - [128, 448, 1, 1024]
    - [99, 4.42]
  - - [192, 448, 1, 1024]
    - [89, 6.62]
  - - [256, 448, 1, 1024]
    - [104, 8.95]
  - - [320, 448, 1, 1024]
    - [89, 10.58]
  - - [384, 448, 1, 1024]
    - [79, 11.92]
  - - [448, 448, 1, 1024]
    - [89, 13.59]
  - - [512, 448, 1, 1024]
    - [155, 14.78]
  - - [576, 448, 1, 1024]
    - [91, 16.84]
  - - [640, 448, 1, 1024]
    - [78, 17.01]
  - - [704, 448, 1, 1024]
    - [84, 18.65]
  - - [768, 448, 1, 1024]
    - [86, 19.87]
  - - [832, 448, 1, 1024]
    - [86, 22.03]
  - - [896, 448, 1, 1024]
    - [53, 22.93]
  - - [960, 448, 1, 1024]
    - [53, 24.27]
  - - [1024, 448, 1, 1024]
    - [86, 26.42]
  - - [64, 512, 1, 1024]
    - [108, 2.88]
  - - [128, 512, 1, 1024]
    - [100, 5.42]
  - - [192, 512, 1, 1024]
    - [89, 7.73]
  - - [256, 512, 1, 1024]
    - [104, 10.28]
  - - [320, 512, 1, 1024]
    - [89, 12.25]
  - - [384, 512, 1, 1024]
    - [104, 14.13]
  - - [448, 512, 1, 1024]
    - [87, 15.64]
  - - [512, 512, 1, 1024]
    - [91, 16.99]
  - - [576, 512, 1, 1024]
    - [60, 17.56]
  - - [640, 512, 1, 1024]
    - [78, 19.64]
  - - [704, 512, 1, 1024]
    - [83, 20.85]
  - - [768, 512, 1, 1024]
    - [83, 23.01]
  - - [832, 512, 1, 1024]
    - [86, 24.0]
  - - [896, 512, 1, 1024]
    - [20, 25.87]
  - - [960, 512, 1, 1024]
    - [86, 26.84]
  - - [1024, 512, 1, 1024]
    - [86, 29.42]
  - - [64, 576, 1, 1024]
    - [94, 3.17]
  - - [128, 576, 1, 1024]
    - [89, 5.88]
  - - [192, 576, 1, 1024]
    - [90, 8.35]
  - - [256, 576, 1, 1024]
    - [89, 10.46]
  - - [320, 576, 1, 1024]
    - [89, 13.45]
  - - [384, 576, 1, 1024]
    - [104, 15.4]
  - - [448, 576, 1, 1024]
    - [91, 17.02]
  - - [512, 576, 1, 1024]
    - [86, 17.44]
  - - [576, 576, 1, 1024]
    - [29, 19.42]
  - - [640, 576, 1, 1024]
    - [76, 21.41]
  - - [704, 576, 1, 1024]
    - [86, 22.93]
  - - [768, 576, 1, 1024]
    - [19, 23.55]
  - - [832, 576, 1, 1024]
    - [29, 24.01]
  - - [896, 576, 1, 1024]
    - [76, 29.41]
  - - [960, 576, 1, 1024]
    - [31, 25.78]
  - - [1024, 576, 1, 1024]
    - [86, 26.92]
  - - [64, 640, 1, 1024]
    - [166, 3.38]
  - - [128, 640, 1, 1024]
    - [90, 6.12]
  - - [192, 640, 1, 1024]
    - [89, 9.13]
  - - [256, 640, 1, 1024]
    - [89, 11.51]
  - - [320, 640, 1, 1024]
    - [89, 14.25]
  - - [384, 640, 1, 1024]
    - [89, 15.99]
  - - [448, 640, 1, 1024]
    - [60, 17.42]
  - - [512, 640, 1, 1024]
    - [86, 19.5]
  - - [576, 640, 1, 1024]
    - [86, 21.67]
  - - [640, 640, 1, 1024]
    - [20, 23.47]
  - - [704, 640, 1, 1024]
    - [53, 25.3]
  - - [768, 640, 1, 1024]
    - [20, 26.61]
  - - [832, 640, 1, 1024]
    - [29, 25.5]
  - - [896, 640, 1, 1024]
    - [76, 26.68]
  - - [960, 640, 1, 1024]
    - [86, 28.22]
  - - [1024, 640, 1, 1024]
    - [91, 28.68]
  - - [64, 704, 1, 1024]
    - [161, 3.51]
  - - [128, 704, 1, 1024]
    - [162, 6.69]
  - - [192, 704, 1, 1024]
    - [89, 9.55]
  - - [256, 704, 1, 1024]
    - [89, 11.92]
  - - [320, 704, 1, 1024]
    - [89, 14.56]
  - - [384, 704, 1, 1024]
    - [60, 15.94]
  - - [448, 704, 1, 1024]
    - [86, 17.81]
  - - [512, 704, 1, 1024]
    - [63, 20.0]
  - - [576, 704, 1, 1024]
    - [86, 21.88]
  - - [640, 704, 1, 1024]
    - [37, 23.91]
  - - [704, 704, 1, 1024]
    - [29, 24.2]
  - - [768, 704, 1, 1024]
    - [53, 25.5]
  - - [832, 704, 1, 1024]
    - [86, 25.7]
  - - [896, 704, 1, 1024]
    - [76, 29.11]
  - - [960, 704, 1, 1024]
    - [86, 28.34]
  - - [1024, 704, 1, 1024]
    - [86, 32.24]
  - - [64, 768, 1, 1024]
    - [112, 4.17]
  - - [128, 768, 1, 1024]
    - [104, 7.72]
  - - [192, 768, 1, 1024]
    - [89, 10.77]
  - - [256, 768, 1, 1024]
    - [87, 13.53]
  - - [320, 768, 1, 1024]
    - [89, 16.5]
  - - [384, 768, 1, 1024]
    - [60, 17.67]
  - - [448, 768, 1, 1024]
    - [53, 19.84]
  - - [512, 768, 1, 1024]
    - [144, 22.26]
  - - [576, 768, 1, 1024]
    - [53, 23.96]
  - - [640, 768, 1, 1024]
    - [20, 27.17]
  - - [704, 768, 1, 1024]
    - [53, 26.23]
  - - [768, 768, 1, 1024]
    - [86, 26.38]
  - - [832, 768, 1, 1024]
    - [86, 28.97]
  - - [896, 768, 1, 1024]
    - [37, 31.17]
  - - [960, 768, 1, 1024]
    - [86, 32.12]
  - - [1024, 768, 1, 1024]
    - [86, 34.05]
  - - [64, 832, 1, 1024]
    - [100, 4.45]
  - - [128, 832, 1, 1024]
    - [104, 8.02]
  - - [192, 832, 1, 1024]
    - [90, 11.31]
  - - [256, 832, 1, 1024]
    - [91, 14.0]
  - - [320, 832, 1, 1024]
    - [89, 17.24]
  - - [384, 832, 1, 1024]
    - [104, 19.1]
  - - [448, 832, 1, 1024]
    - [144, 20.94]
  - - [512, 832, 1, 1024]
    - [53, 23.76]
  - - [576, 832, 1, 1024]
    - [53, 25.71]
  - - [640, 832, 1, 1024]
    - [55, 25.58]
  - - [704, 832, 1, 1024]
    - [30, 25.92]
  - - [768, 832, 1, 1024]
    - [63, 27.95]
  - - [832, 832, 1, 1024]
    - [50, 29.17]
  - - [896, 832, 1, 1024]
    - [19, 32.92]
  - - [960, 832, 1, 1024]
    - [91, 28.41]
  - - [1024, 832, 1, 1024]
    - [19, 36.16]
  - - [64, 896, 1, 1024]
    - [112, 4.73]
  - - [128, 896, 1, 1024]
    - [104, 9.06]
  - - [192, 896, 1, 1024]
    - [89, 12.47]
  - - [256, 896, 1, 1024]
    - [87, 15.5]
  - - [320, 896, 1, 1024]
    - [89, 18.1]
  - - [384, 896, 1, 1024]
    - [76, 20.36]
  - - [448, 896, 1, 1024]
    - [86, 21.17]
  - - [512, 896, 1, 1024]
    - [86, 24.37]
  - - [576, 896, 1, 1024]
    - [53, 27.25]
  - - [640, 896, 1, 1024]
    - [76, 26.81]
  - - [704, 896, 1, 1024]
    - [91, 27.57]
  - - [768, 896, 1, 1024]
    - [19, 30.4]
  - - [832, 896, 1, 1024]
    - [87, 30.72]
  - - [896, 896, 1, 1024]
    - [20, 34.93]
  - - [960, 896, 1, 1024]
    - [87, 31.11]
  - - [1024, 896, 1, 1024]
    - [20, 37.57]
  - - [64, 960, 1, 1024]
    - [161, 4.95]
  - - [128, 960, 1, 1024]
    - [104, 9.32]
  - - [192, 960, 1, 1024]
    - [82, 12.42]
  - - [256, 960, 1, 1024]
    - [87, 16.45]
  - - [320, 960, 1, 1024]
    - [86, 17.9]
  - - [384, 960, 1, 1024]
    - [76, 21.99]
  - - [448, 960, 1, 1024]
    - [86, 23.69]
  - - [512, 960, 1, 1024]
    - [86, 28.46]
  - - [576, 960, 1, 1024]
    - [86, 27.03]
  - - [640, 960, 1, 1024]
    - [53, 30.27]
  - - [704, 960, 1, 1024]
    - [53, 31.44]
  - - [768, 960, 1, 1024]
    - [53, 33.65]
  - - [832, 960, 1, 1024]
    - [86, 32.26]
  - - [896, 960, 1, 1024]
    - [17, 36.2]
  - - [960, 960, 1, 1024]
    - [52, 37.43]
  - - [1024, 960, 1, 1024]
    - [19, 40.49]
  - - [64, 1024, 1, 1024]
    - [166, 5.38]
  - - [128, 1024, 1, 1024]
    - [104, 10.02]
  - - [192, 1024, 1, 1024]
    - [89, 13.83]
  - - [256, 1024, 1, 1024]
    - [61, 17.17]
  - - [320, 1024, 1, 1024]
    - [83, 19.68]
  - - [384, 1024, 1, 1024]
    - [83, 23.11]
  - - [448, 1024, 1, 1024]
    - [86, 27.07]
  - - [512, 1024, 1, 1024]
    - [86, 29.63]
  - - [576, 1024, 1, 1024]
    - [86, 28.97]
  - - [640, 1024, 1, 1024]
    - [53, 31.88]
  - - [704, 1024, 1, 1024]
    - [53, 34.72]
  - - [768, 1024, 1, 1024]
    - [52, 35.93]
  - - [832, 1024, 1, 1024]
    - [52, 34.95]
  - - [896, 1024, 1, 1024]
    - [20, 39.01]
  - - [960, 1024, 1, 1024]
    - [52, 38.91]
  - - [1024, 1024, 1, 1024]
    - [16, 42.51]
  - - [64, 64, 1, 2048]
    - [367, 0.57]
  - - [128, 64, 1, 2048]
    - [114, 1.27]
  - - [192, 64, 1, 2048]
    - [100, 1.84]
  - - [256, 64, 1, 2048]
    - [111, 2.51]
  - - [320, 64, 1, 2048]
    - [99, 3.04]
  - - [384, 64, 1, 2048]
    - [100, 3.57]
  - - [448, 64, 1, 2048]
    - [100, 4.16]
  - - [512, 64, 1, 2048]
    - [109, 4.84]
  - - [576, 64, 1, 2048]
    - [268, 5.17]
  - - [640, 64, 1, 2048]
    - [157, 5.51]
  - - [704, 64, 1, 2048]
    - [106, 5.9]
  - - [768, 64, 1, 2048]
    - [106, 6.42]
  - - [832, 64, 1, 2048]
    - [182, 6.86]
  - - [896, 64, 1, 2048]
    - [106, 7.48]
  - - [960, 64, 1, 2048]
    - [106, 7.96]
  - - [1024, 64, 1, 2048]
    - [110, 8.41]
  - - [64, 128, 1, 2048]
    - [114, 1.34]
  - - [128, 128, 1, 2048]
    - [112, 2.64]
  - - [192, 128, 1, 2048]
    - [108, 3.79]
  - - [256, 128, 1, 2048]
    - [163, 4.65]
  - - [320, 128, 1, 2048]
    - [157, 5.45]
  - - [384, 128, 1, 2048]
    - [110, 6.44]
  - - [448, 128, 1, 2048]
    - [164, 7.19]
  - - [512, 128, 1, 2048]
    - [164, 8.37]
  - - [576, 128, 1, 2048]
    - [89, 9.54]
  - - [640, 128, 1, 2048]
    - [104, 11.21]
  - - [704, 128, 1, 2048]
    - [89, 11.42]
  - - [768, 128, 1, 2048]
    - [104, 12.95]
  - - [832, 128, 1, 2048]
    - [89, 14.07]
  - - [896, 128, 1, 2048]
    - [104, 15.0]
  - - [960, 128, 1, 2048]
    - [89, 16.05]
  - - [1024, 128, 1, 2048]
    - [104, 17.27]
  - - [64, 192, 1, 2048]
    - [100, 1.81]
  - - [128, 192, 1, 2048]
    - [112, 3.89]
  - - [192, 192, 1, 2048]
    - [99, 4.98]
  - - [256, 192, 1, 2048]
    - [110, 6.51]
  - - [320, 192, 1, 2048]
    - [182, 7.38]
  - - [384, 192, 1, 2048]
    - [104, 10.19]
  - - [448, 192, 1, 2048]
    - [89, 10.82]
  - - [512, 192, 1, 2048]
    - [89, 12.83]
  - - [576, 192, 1, 2048]
    - [89, 13.96]
  - - [640, 192, 1, 2048]
    - [162, 15.64]
  - - [704, 192, 1, 2048]
    - [89, 16.25]
  - - [768, 192, 1, 2048]
    - [89, 17.67]
  - - [832, 192, 1, 2048]
    - [89, 18.73]
  - - [896, 192, 1, 2048]
    - [104, 19.45]
  - - [960, 192, 1, 2048]
    - [89, 20.89]
  - - [1024, 192, 1, 2048]
    - [89, 22.21]
  - - [64, 256, 1, 2048]
    - [112, 2.63]
  - - [128, 256, 1, 2048]
    - [113, 5.01]
  - - [192, 256, 1, 2048]
    - [158, 6.59]
  - - [256, 256, 1, 2048]
    - [110, 8.43]
  - - [320, 256, 1, 2048]
    - [89, 10.91]
  - - [384, 256, 1, 2048]
    - [104, 13.58]
  - - [448, 256, 1, 2048]
    - [89, 15.16]
  - - [512, 256, 1, 2048]
    - [89, 17.31]
  - - [576, 256, 1, 2048]
    - [89, 17.98]
  - - [640, 256, 1, 2048]
    - [153, 19.08]
  - - [704, 256, 1, 2048]
    - [89, 21.09]
  - - [768, 256, 1, 2048]
    - [89, 22.23]
  - - [832, 256, 1, 2048]
    - [89, 23.77]
  - - [896, 256, 1, 2048]
    - [104, 25.52]
  - - [960, 256, 1, 2048]
    - [89, 25.47]
  - - [1024, 256, 1, 2048]
    - [90, 27.87]
  - - [64, 320, 1, 2048]
    - [100, 3.02]
  - - [128, 320, 1, 2048]
    - [100, 5.64]
  - - [192, 320, 1, 2048]
    - [182, 7.71]
  - - [256, 320, 1, 2048]
    - [104, 10.71]
  - - [320, 320, 1, 2048]
    - [89, 13.09]
  - - [384, 320, 1, 2048]
    - [104, 15.81]
  - - [448, 320, 1, 2048]
    - [89, 17.38]
  - - [512, 320, 1, 2048]
    - [87, 17.83]
  - - [576, 320, 1, 2048]
    - [153, 19.65]
  - - [640, 320, 1, 2048]
    - [104, 22.6]
  - - [704, 320, 1, 2048]
    - [89, 22.89]
  - - [768, 320, 1, 2048]
    - [91, 25.26]
  - - [832, 320, 1, 2048]
    - [184, 23.84]
  - - [896, 320, 1, 2048]
    - [79, 27.45]
  - - [960, 320, 1, 2048]
    - [86, 26.74]
  - - [1024, 320, 1, 2048]
    - [89, 29.47]
  - - [64, 384, 1, 2048]
    - [112, 3.79]
  - - [128, 384, 1, 2048]
    - [100, 6.62]
  - - [192, 384, 1, 2048]
    - [89, 9.76]
  - - [256, 384, 1, 2048]
    - [104, 12.59]
  - - [320, 384, 1, 2048]
    - [89, 15.15]
  - - [384, 384, 1, 2048]
    - [104, 17.54]
  - - [448, 384, 1, 2048]
    - [89, 18.73]
  - - [512, 384, 1, 2048]
    - [87, 20.6]
  - - [576, 384, 1, 2048]
    - [87, 23.54]
  - - [640, 384, 1, 2048]
    - [104, 26.46]
  - - [704, 384, 1, 2048]
    - [60, 24.63]
  - - [768, 384, 1, 2048]
    - [86, 26.3]
  - - [832, 384, 1, 2048]
    - [86, 28.22]
  - - [896, 384, 1, 2048]
    - [79, 31.23]
  - - [960, 384, 1, 2048]
    - [86, 31.55]
  - - [1024, 384, 1, 2048]
    - [86, 32.84]
  - - [64, 448, 1, 2048]
    - [161, 4.25]
  - - [128, 448, 1, 2048]
    - [160, 7.58]
  - - [192, 448, 1, 2048]
    - [89, 11.23]
  - - [256, 448, 1, 2048]
    - [89, 14.81]
  - - [320, 448, 1, 2048]
    - [89, 17.32]
  - - [384, 448, 1, 2048]
    - [104, 20.49]
  - - [448, 448, 1, 2048]
    - [89, 21.61]
  - - [512, 448, 1, 2048]
    - [87, 23.62]
  - - [576, 448, 1, 2048]
    - [91, 26.16]
  - - [640, 448, 1, 2048]
    - [79, 27.11]
  - - [704, 448, 1, 2048]
    - [83, 28.41]
  - - [768, 448, 1, 2048]
    - [107, 30.34]
  - - [832, 448, 1, 2048]
    - [86, 31.58]
  - - [896, 448, 1, 2048]
    - [86, 35.8]
  - - [960, 448, 1, 2048]
    - [86, 37.06]
  - - [1024, 448, 1, 2048]
    - [86, 39.71]
  - - [64, 512, 1, 2048]
    - [113, 4.9]
  - - [128, 512, 1, 2048]
    - [161, 8.58]
  - - [192, 512, 1, 2048]
    - [89, 12.29]
  - - [256, 512, 1, 2048]
    - [104, 16.68]
  - - [320, 512, 1, 2048]
    - [89, 19.24]
  - - [384, 512, 1, 2048]
    - [104, 21.77]
  - - [448, 512, 1, 2048]
    - [87, 24.08]
  - - [512, 512, 1, 2048]
    - [107, 26.67]
  - - [576, 512, 1, 2048]
    - [86, 26.41]
  - - [640, 512, 1, 2048]
    - [79, 29.27]
  - - [704, 512, 1, 2048]
    - [83, 31.81]
  - - [768, 512, 1, 2048]
    - [107, 34.49]
  - - [832, 512, 1, 2048]
    - [86, 37.32]
  - - [896, 512, 1, 2048]
    - [86, 39.3]
  - - [960, 512, 1, 2048]
    - [86, 41.25]
  - - [1024, 512, 1, 2048]
    - [86, 45.52]
  - - [64, 576, 1, 2048]
    - [265, 5.73]
  - - [128, 576, 1, 2048]
    - [104, 10.21]
  - - [192, 576, 1, 2048]
    - [89, 14.46]
  - - [256, 576, 1, 2048]
    - [89, 17.46]
  - - [320, 576, 1, 2048]
    - [90, 21.2]
  - - [384, 576, 1, 2048]
    - [104, 24.6]
  - - [448, 576, 1, 2048]
    - [89, 26.32]
  - - [512, 576, 1, 2048]
    - [107, 26.65]
  - - [576, 576, 1, 2048]
    - [229, 29.46]
  - - [640, 576, 1, 2048]
    - [86, 32.31]
  - - [704, 576, 1, 2048]
    - [86, 35.27]
  - - [768, 576, 1, 2048]
    - [86, 36.93]
  - - [832, 576, 1, 2048]
    - [91, 34.35]
  - - [896, 576, 1, 2048]
    - [76, 41.4]
  - - [960, 576, 1, 2048]
    - [86, 37.23]
  - - [1024, 576, 1, 2048]
    - [86, 38.7]
  - - [64, 640, 1, 2048]
    - [112, 6.24]
  - - [128, 640, 1, 2048]
    - [104, 11.29]
  - - [192, 640, 1, 2048]
    - [89, 16.2]
  - - [256, 640, 1, 2048]
    - [89, 18.78]
  - - [320, 640, 1, 2048]
    - [89, 22.86]
  - - [384, 640, 1, 2048]
    - [87, 26.82]
  - - [448, 640, 1, 2048]
    - [89, 25.66]
  - - [512, 640, 1, 2048]
    - [86, 28.34]
  - - [576, 640, 1, 2048]
    - [86, 32.76]
  - - [640, 640, 1, 2048]
    - [86, 35.52]
  - - [704, 640, 1, 2048]
    - [86, 36.68]
  - - [768, 640, 1, 2048]
    - [87, 39.48]
  - - [832, 640, 1, 2048]
    - [86, 35.08]
  - - [896, 640, 1, 2048]
    - [37, 38.33]
  - - [960, 640, 1, 2048]
    - [86, 38.79]
  - - [1024, 640, 1, 2048]
    - [87, 41.1]
  - - [64, 704, 1, 2048]
    - [94, 6.61]
  - - [128, 704, 1, 2048]
    - [104, 12.23]
  - - [192, 704, 1, 2048]
    - [89, 16.51]
  - - [256, 704, 1, 2048]
    - [89, 19.78]
  - - [320, 704, 1, 2048]
    - [87, 24.65]
  - - [384, 704, 1, 2048]
    - [79, 25.88]
  - - [448, 704, 1, 2048]
    - [86, 27.41]
  - - [512, 704, 1, 2048]
    - [107, 30.86]
  - - [576, 704, 1, 2048]
    - [86, 33.12]
  - - [640, 704, 1, 2048]
    - [76, 36.91]
  - - [704, 704, 1, 2048]
    - [62, 35.21]
  - - [768, 704, 1, 2048]
    - [86, 35.91]
  - - [832, 704, 1, 2048]
    - [31, 36.83]
  - - [896, 704, 1, 2048]
    - [77, 40.2]
  - - [960, 704, 1, 2048]
    - [77, 38.98]
  - - [1024, 704, 1, 2048]
    - [19, 43.93]
  - - [64, 768, 1, 2048]
    - [108, 7.52]
  - - [128, 768, 1, 2048]
    - [104, 13.05]
  - - [192, 768, 1, 2048]
    - [89, 18.06]
  - - [256, 768, 1, 2048]
    - [87, 21.5]
  - - [320, 768, 1, 2048]
    - [89, 26.09]
  - - [384, 768, 1, 2048]
    - [79, 28.2]
  - - [448, 768, 1, 2048]
    - [86, 30.73]
  - - [512, 768, 1, 2048]
    - [86, 34.65]
  - - [576, 768, 1, 2048]
    - [86, 37.08]
  - - [640, 768, 1, 2048]
    - [77, 41.44]
  - - [704, 768, 1, 2048]
    - [86, 36.02]
  - - [768, 768, 1, 2048]
    - [86, 38.94]
  - - [832, 768, 1, 2048]
    - [86, 40.14]
  - - [896, 768, 1, 2048]
    - [37, 43.34]
  - - [960, 768, 1, 2048]
    - [86, 43.38]
  - - [1024, 768, 1, 2048]
    - [19, 47.96]
  - - [64, 832, 1, 2048]
    - [158, 7.64]
  - - [128, 832, 1, 2048]
    - [104, 14.01]
  - - [192, 832, 1, 2048]
    - [89, 17.76]
  - - [256, 832, 1, 2048]
    - [89, 21.79]
  - - [320, 832, 1, 2048]
    - [61, 25.75]
  - - [384, 832, 1, 2048]
    - [104, 28.36]
  - - [448, 832, 1, 2048]
    - [86, 31.66]
  - - [512, 832, 1, 2048]
    - [86, 35.33]
  - - [576, 832, 1, 2048]
    - [86, 39.22]
  - - [640, 832, 1, 2048]
    - [37, 36.35]
  - - [704, 832, 1, 2048]
    - [86, 36.44]
  - - [768, 832, 1, 2048]
    - [91, 39.36]
  - - [832, 832, 1, 2048]
    - [86, 41.2]
  - - [896, 832, 1, 2048]
    - [37, 47.66]
  - - [960, 832, 1, 2048]
    - [62, 39.24]
  - - [1024, 832, 1, 2048]
    - [19, 49.9]
  - - [64, 896, 1, 2048]
    - [108, 8.32]
  - - [128, 896, 1, 2048]
    - [104, 14.64]
  - - [192, 896, 1, 2048]
    - [90, 19.52]
  - - [256, 896, 1, 2048]
    - [87, 24.07]
  - - [320, 896, 1, 2048]
    - [60, 27.12]
  - - [384, 896, 1, 2048]
    - [76, 30.26]
  - - [448, 896, 1, 2048]
    - [86, 34.82]
  - - [512, 896, 1, 2048]
    - [20, 36.66]
  - - [576, 896, 1, 2048]
    - [86, 39.31]
  - - [640, 896, 1, 2048]
    - [37, 38.77]
  - - [704, 896, 1, 2048]
    - [91, 38.67]
  - - [768, 896, 1, 2048]
    - [19, 41.9]
  - - [832, 896, 1, 2048]
    - [86, 42.89]
  - - [896, 896, 1, 2048]
    - [16, 47.93]
  - - [960, 896, 1, 2048]
    - [62, 42.21]
  - - [1024, 896, 1, 2048]
    - [19, 53.52]
  - - [64, 960, 1, 2048]
    - [100, 8.95]
  - - [128, 960, 1, 2048]
    - [104, 15.74]
  - - [192, 960, 1, 2048]
    - [89, 21.09]
  - - [256, 960, 1, 2048]
    - [87, 26.58]
  - - [320, 960, 1, 2048]
    - [107, 27.04]
  - - [384, 960, 1, 2048]
    - [86, 33.32]
  - - [448, 960, 1, 2048]
    - [86, 37.48]
  - - [512, 960, 1, 2048]
    - [86, 40.44]
  - - [576, 960, 1, 2048]
    - [86, 38.08]
  - - [640, 960, 1, 2048]
    - [87, 41.28]
  - - [704, 960, 1, 2048]
    - [86, 43.97]
  - - [768, 960, 1, 2048]
    - [86, 46.34]
  - - [832, 960, 1, 2048]
    - [52, 45.25]
  - - [896, 960, 1, 2048]
    - [19, 51.74]
  - - [960, 960, 1, 2048]
    - [140, 47.88]
  - - [1024, 960, 1, 2048]
    - [17, 57.46]
  - - [64, 1024, 1, 2048]
    - [112, 9.5]
  - - [128, 1024, 1, 2048]
    - [104, 16.77]
  - - [192, 1024, 1, 2048]
    - [89, 22.56]
  - - [256, 1024, 1, 2048]
    - [87, 28.22]
  - - [320, 1024, 1, 2048]
    - [29, 29.19]
  - - [384, 1024, 1, 2048]
    - [83, 34.82]
  - - [448, 1024, 1, 2048]
    - [86, 39.38]
  - - [512, 1024, 1, 2048]
    - [86, 44.31]
  - - [576, 1024, 1, 2048]
    - [53, 40.41]
  - - [640, 1024, 1, 2048]
    - [86, 43.6]
  - - [704, 1024, 1, 2048]
    - [86, 46.43]
  - - [768, 1024, 1, 2048]
    - [87, 49.43]
  - - [832, 1024, 1, 2048]
    - [52, 46.97]
  - - [896, 1024, 1, 2048]
    - [19, 54.44]
  - - [960, 1024, 1, 2048]
    - [52, 51.07]
  - - [1024, 1024, 1, 2048]
    - [19, 59.8]
  - - [64, 64, 1, 4096]
    - [133, 1.1]
  - - [128, 64, 1, 4096]
    - [114, 2.14]
  - - [192, 64, 1, 4096]
    - [154, 3.09]
  - - [256, 64, 1, 4096]
    - [112, 4.02]
  - - [320, 64, 1, 4096]
    - [90, 4.92]
  - - [384, 64, 1, 4096]
    - [112, 6.01]
  - - [448, 64, 1, 4096]
    - [153, 6.55]
  - - [512, 64, 1, 4096]
    - [153, 7.56]
  - - [576, 64, 1, 4096]
    - [153, 8.02]
  - - [640, 64, 1, 4096]
    - [162, 9.25]
  - - [704, 64, 1, 4096]
    - [153, 9.06]
  - - [768, 64, 1, 4096]
    - [104, 10.25]
  - - [832, 64, 1, 4096]
    - [153, 10.79]
  - - [896, 64, 1, 4096]
    - [162, 12.1]
  - - [960, 64, 1, 4096]
    - [89, 12.0]
  - - [1024, 64, 1, 4096]
    - [104, 13.08]
  - - [64, 128, 1, 4096]
    - [114, 2.11]
  - - [128, 128, 1, 4096]
    - [166, 4.17]
  - - [192, 128, 1, 4096]
    - [108, 6.07]
  - - [256, 128, 1, 4096]
    - [162, 7.72]
  - - [320, 128, 1, 4096]
    - [153, 9.13]
  - - [384, 128, 1, 4096]
    - [162, 10.57]
  - - [448, 128, 1, 4096]
    - [153, 11.89]
  - - [512, 128, 1, 4096]
    - [89, 13.11]
  - - [576, 128, 1, 4096]
    - [89, 14.78]
  - - [640, 128, 1, 4096]
    - [104, 17.4]
  - - [704, 128, 1, 4096]
    - [90, 17.85]
  - - [768, 128, 1, 4096]
    - [104, 20.09]
  - - [832, 128, 1, 4096]
    - [90, 20.36]
  - - [896, 128, 1, 4096]
    - [162, 22.18]
  - - [960, 128, 1, 4096]
    - [90, 23.18]
  - - [1024, 128, 1, 4096]
    - [104, 25.8]
  - - [64, 192, 1, 4096]
    - [184, 3.08]
  - - [128, 192, 1, 4096]
    - [112, 6.25]
  - - [192, 192, 1, 4096]
    - [153, 8.01]
  - - [256, 192, 1, 4096]
    - [149, 10.19]
  - - [320, 192, 1, 4096]
    - [89, 12.26]
  - - [384, 192, 1, 4096]
    - [104, 15.18]
  - - [448, 192, 1, 4096]
    - [89, 17.04]
  - - [512, 192, 1, 4096]
    - [89, 19.46]
  - - [576, 192, 1, 4096]
    - [90, 21.32]
  - - [640, 192, 1, 4096]
    - [104, 25.37]
  - - [704, 192, 1, 4096]
    - [89, 23.71]
  - - [768, 192, 1, 4096]
    - [153, 25.22]
  - - [832, 192, 1, 4096]
    - [89, 26.41]
  - - [896, 192, 1, 4096]
    - [105, 29.38]
  - - [960, 192, 1, 4096]
    - [89, 29.1]
  - - [1024, 192, 1, 4096]
    - [89, 30.92]
  - - [64, 256, 1, 4096]
    - [112, 4.26]
  - - [128, 256, 1, 4096]
    - [112, 7.92]
  - - [192, 256, 1, 4096]
    - [152, 10.47]
  - - [256, 256, 1, 4096]
    - [162, 13.38]
  - - [320, 256, 1, 4096]
    - [89, 15.87]
  - - [384, 256, 1, 4096]
    - [104, 20.32]
  - - [448, 256, 1, 4096]
    - [90, 22.15]
  - - [512, 256, 1, 4096]
    - [90, 24.41]
  - - [576, 256, 1, 4096]
    - [89, 25.8]
  - - [640, 256, 1, 4096]
    - [104, 29.48]
  - - [704, 256, 1, 4096]
    - [89, 29.13]
  - - [768, 256, 1, 4096]
    - [89, 30.39]
  - - [832, 256, 1, 4096]
    - [90, 32.0]
  - - [896, 256, 1, 4096]
    - [104, 35.77]
  - - [960, 256, 1, 4096]
    - [89, 36.32]
  - - [1024, 256, 1, 4096]
    - [90, 40.25]
  - - [64, 320, 1, 4096]
    - [87, 4.93]
  - - [128, 320, 1, 4096]
    - [162, 9.13]
  - - [192, 320, 1, 4096]
    - [89, 12.21]
  - - [256, 320, 1, 4096]
    - [104, 16.4]
  - - [320, 320, 1, 4096]
    - [89, 20.84]
  - - [384, 320, 1, 4096]
    - [104, 25.19]
  - - [448, 320, 1, 4096]
    - [153, 25.06]
  - - [512, 320, 1, 4096]
    - [87, 24.54]
  - - [576, 320, 1, 4096]
    - [89, 28.01]
  - - [640, 320, 1, 4096]
    - [104, 31.86]
  - - [704, 320, 1, 4096]
    - [91, 32.16]
  - - [768, 320, 1, 4096]
    - [91, 34.91]
  - - [832, 320, 1, 4096]
    - [61, 32.92]
  - - [896, 320, 1, 4096]
    - [79, 37.34]
  - - [960, 320, 1, 4096]
    - [89, 35.6]
  - - [1024, 320, 1, 4096]
    - [89, 39.44]
  - - [64, 384, 1, 4096]
    - [166, 6.37]
  - - [128, 384, 1, 4096]
    - [143, 10.5]
  - - [192, 384, 1, 4096]
    - [90, 14.68]
  - - [256, 384, 1, 4096]
    - [104, 19.8]
  - - [320, 384, 1, 4096]
    - [89, 23.35]
  - - [384, 384, 1, 4096]
    - [104, 27.17]
  - - [448, 384, 1, 4096]
    - [89, 27.94]
  - - [512, 384, 1, 4096]
    - [87, 30.15]
  - - [576, 384, 1, 4096]
    - [87, 33.81]
  - - [640, 384, 1, 4096]
    - [87, 37.66]
  - - [704, 384, 1, 4096]
    - [60, 32.46]
  - - [768, 384, 1, 4096]
    - [86, 34.52]
  - - [832, 384, 1, 4096]
    - [86, 36.63]
  - - [896, 384, 1, 4096]
    - [79, 41.54]
  - - [960, 384, 1, 4096]
    - [62, 41.49]
  - - [1024, 384, 1, 4096]
    - [91, 43.68]
  - - [64, 448, 1, 4096]
    - [100, 6.66]
  - - [128, 448, 1, 4096]
    - [162, 11.76]
  - - [192, 448, 1, 4096]
    - [90, 16.59]
  - - [256, 448, 1, 4096]
    - [104, 22.75]
  - - [320, 448, 1, 4096]
    - [89, 25.42]
  - - [384, 448, 1, 4096]
    - [104, 29.17]
  - - [448, 448, 1, 4096]
    - [87, 29.52]
  - - [512, 448, 1, 4096]
    - [87, 33.0]
  - - [576, 448, 1, 4096]
    - [91, 35.62]
  - - [640, 448, 1, 4096]
    - [150, 37.37]
  - - [704, 448, 1, 4096]
    - [86, 36.39]
  - - [768, 448, 1, 4096]
    - [86, 39.87]
  - - [832, 448, 1, 4096]
    - [86, 42.34]
  - - [896, 448, 1, 4096]
    - [76, 45.37]
  - - [960, 448, 1, 4096]
    - [87, 47.68]
  - - [1024, 448, 1, 4096]
    - [86, 51.78]
  - - [64, 512, 1, 4096]
    - [112, 8.36]
  - - [128, 512, 1, 4096]
    - [162, 13.54]
  - - [192, 512, 1, 4096]
    - [90, 19.32]
  - - [256, 512, 1, 4096]
    - [104, 25.69]
  - - [320, 512, 1, 4096]
    - [89, 28.47]
  - - [384, 512, 1, 4096]
    - [105, 32.86]
  - - [448, 512, 1, 4096]
    - [87, 33.8]
  - - [512, 512, 1, 4096]
    - [87, 38.38]
  - - [576, 512, 1, 4096]
    - [61, 37.47]
  - - [640, 512, 1, 4096]
    - [78, 40.16]
  - - [704, 512, 1, 4096]
    - [61, 41.12]
  - - [768, 512, 1, 4096]
    - [87, 43.97]
  - - [832, 512, 1, 4096]
    - [86, 47.54]
  - - [896, 512, 1, 4096]
    - [87, 51.58]
  - - [960, 512, 1, 4096]
    - [86, 54.71]
  - - [1024, 512, 1, 4096]
    - [86, 57.35]
  - - [64, 576, 1, 4096]
    - [100, 8.45]
  - - [128, 576, 1, 4096]
    - [162, 14.72]
  - - [192, 576, 1, 4096]
    - [90, 21.28]
  - - [256, 576, 1, 4096]
    - [61, 23.4]
  - - [320, 576, 1, 4096]
    - [153, 28.3]
  - - [384, 576, 1, 4096]
    - [87, 33.88]
  - - [448, 576, 1, 4096]
    - [91, 36.03]
  - - [512, 576, 1, 4096]
    - [91, 34.06]
  - - [576, 576, 1, 4096]
    - [155, 38.27]
  - - [640, 576, 1, 4096]
    - [76, 42.24]
  - - [704, 576, 1, 4096]
    - [87, 44.42]
  - - [768, 576, 1, 4096]
    - [87, 46.34]
  - - [832, 576, 1, 4096]
    - [149, 47.71]
  - - [896, 576, 1, 4096]
    - [76, 52.91]
  - - [960, 576, 1, 4096]
    - [86, 45.1]
  - - [1024, 576, 1, 4096]
    - [87, 47.6]
  - - [64, 640, 1, 4096]
    - [112, 10.4]
  - - [128, 640, 1, 4096]
    - [104, 17.26]
  - - [192, 640, 1, 4096]
    - [89, 23.43]
  - - [256, 640, 1, 4096]
    - [87, 25.2]
  - - [320, 640, 1, 4096]
    - [87, 30.77]
  - - [384, 640, 1, 4096]
    - [87, 36.29]
  - - [448, 640, 1, 4096]
    - [61, 35.4]
  - - [512, 640, 1, 4096]
    - [87, 37.93]
  - - [576, 640, 1, 4096]
    - [87, 41.36]
  - - [640, 640, 1, 4096]
    - [76, 47.18]
  - - [704, 640, 1, 4096]
    - [86, 47.9]
  - - [768, 640, 1, 4096]
    - [20, 51.08]
  - - [832, 640, 1, 4096]
    - [53, 45.73]
  - - [896, 640, 1, 4096]
    - [77, 47.63]
  - - [960, 640, 1, 4096]
    - [86, 49.25]
  - - [1024, 640, 1, 4096]
    - [87, 50.61]
  - - [64, 704, 1, 4096]
    - [100, 9.98]
  - - [128, 704, 1, 4096]
    - [104, 18.36]
  - - [192, 704, 1, 4096]
    - [89, 24.23]
  - - [256, 704, 1, 4096]
    - [87, 27.52]
  - - [320, 704, 1, 4096]
    - [87, 33.92]
  - - [384, 704, 1, 4096]
    - [79, 36.29]
  - - [448, 704, 1, 4096]
    - [61, 36.68]
  - - [512, 704, 1, 4096]
    - [91, 40.63]
  - - [576, 704, 1, 4096]
    - [53, 41.79]
  - - [640, 704, 1, 4096]
    - [76, 51.21]
  - - [704, 704, 1, 4096]
    - [133, 44.49]
  - - [768, 704, 1, 4096]
    - [87, 42.55]
  - - [832, 704, 1, 4096]
    - [136, 46.3]
  - - [896, 704, 1, 4096]
    - [77, 51.15]
  - - [960, 704, 1, 4096]
    - [185, 48.68]
  - - [1024, 704, 1, 4096]
    - [17, 54.25]
  - - [64, 768, 1, 4096]
    - [112, 12.48]
  - - [128, 768, 1, 4096]
    - [104, 20.53]
  - - [192, 768, 1, 4096]
    - [89, 25.14]
  - - [256, 768, 1, 4096]
    - [87, 29.47]
  - - [320, 768, 1, 4096]
    - [87, 36.12]
  - - [384, 768, 1, 4096]
    - [79, 38.74]
  - - [448, 768, 1, 4096]
    - [144, 39.22]
  - - [512, 768, 1, 4096]
    - [144, 44.19]
  - - [576, 768, 1, 4096]
    - [87, 44.93]
  - - [640, 768, 1, 4096]
    - [76, 53.27]
  - - [704, 768, 1, 4096]
    - [53, 45.85]
  - - [768, 768, 1, 4096]
    - [86, 47.03]
  - - [832, 768, 1, 4096]
    - [136, 49.22]
  - - [896, 768, 1, 4096]
    - [37, 55.79]
  - - [960, 768, 1, 4096]
    - [136, 53.96]
  - - [1024, 768, 1, 4096]
    - [20, 59.55]
  - - [64, 832, 1, 4096]
    - [100, 12.48]
  - - [128, 832, 1, 4096]
    - [104, 22.5]
  - - [192, 832, 1, 4096]
    - [89, 27.7]
  - - [256, 832, 1, 4096]
    - [87, 32.2]
  - - [320, 832, 1, 4096]
    - [89, 34.07]
  - - [384, 832, 1, 4096]
    - [76, 38.68]
  - - [448, 832, 1, 4096]
    - [155, 41.37]
  - - [512, 832, 1, 4096]
    - [87, 44.54]
  - - [576, 832, 1, 4096]
    - [53, 47.83]
  - - [640, 832, 1, 4096]
    - [76, 46.44]
  - - [704, 832, 1, 4096]
    - [37, 45.54]
  - - [768, 832, 1, 4096]
    - [156, 49.57]
  - - [832, 832, 1, 4096]
    - [136, 52.19]
  - - [896, 832, 1, 4096]
    - [149, 59.8]
  - - [960, 832, 1, 4096]
    - [128, 51.3]
  - - [1024, 832, 1, 4096]
    - [16, 63.34]
  - - [64, 896, 1, 4096]
    - [166, 13.56]
  - - [128, 896, 1, 4096]
    - [104, 23.2]
  - - [192, 896, 1, 4096]
    - [89, 28.11]
  - - [256, 896, 1, 4096]
    - [87, 34.29]
  - - [320, 896, 1, 4096]
    - [61, 36.55]
  - - [384, 896, 1, 4096]
    - [76, 41.05]
  - - [448, 896, 1, 4096]
    - [87, 43.58]
  - - [512, 896, 1, 4096]
    - [86, 48.68]
  - - [576, 896, 1, 4096]
    - [53, 50.74]
  - - [640, 896, 1, 4096]
    - [37, 49.14]
  - - [704, 896, 1, 4096]
    - [86, 48.6]
  - - [768, 896, 1, 4096]
    - [20, 53.06]
  - - [832, 896, 1, 4096]
    - [86, 54.85]
  - - [896, 896, 1, 4096]
    - [16, 60.83]
  - - [960, 896, 1, 4096]
    - [122, 53.34]
  - - [1024, 896, 1, 4096]
    - [17, 68.53]
  - - [64, 960, 1, 4096]
    - [100, 14.24]
  - - [128, 960, 1, 4096]
    - [104, 25.74]
  - - [192, 960, 1, 4096]
    - [154, 28.06]
  - - [256, 960, 1, 4096]
    - [87, 36.62]
  - - [320, 960, 1, 4096]
    - [86, 36.2]
  - - [384, 960, 1, 4096]
    - [76, 43.21]
  - - [448, 960, 1, 4096]
    - [86, 48.31]
  - - [512, 960, 1, 4096]
    - [87, 53.91]
  - - [576, 960, 1, 4096]
    - [86, 48.1]
  - - [640, 960, 1, 4096]
    - [37, 51.91]
  - - [704, 960, 1, 4096]
    - [86, 53.19]
  - - [768, 960, 1, 4096]
    - [86, 57.47]
  - - [832, 960, 1, 4096]
    - [86, 53.45]
  - - [896, 960, 1, 4096]
    - [17, 65.19]
  - - [960, 960, 1, 4096]
    - [86, 57.39]
  - - [1024, 960, 1, 4096]
    - [19, 71.09]
  - - [64, 1024, 1, 4096]
    - [112, 15.38]
  - - [128, 1024, 1, 4096]
    - [104, 25.98]
  - - [192, 1024, 1, 4096]
    - [89, 31.05]
  - - [256, 1024, 1, 4096]
    - [87, 38.7]
  - - [320, 1024, 1, 4096]
    - [86, 39.0]
  - - [384, 1024, 1, 4096]
    - [76, 45.57]
  - - [448, 1024, 1, 4096]
    - [86, 51.96]
  - - [512, 1024, 1, 4096]
    - [87, 56.99]
  - - [576, 1024, 1, 4096]
    - [86, 51.65]
  - - [640, 1024, 1, 4096]
    - [76, 53.2]
  - - [704, 1024, 1, 4096]
    - [52, 56.97]
  - - [768, 1024, 1, 4096]
    - [87, 59.76]
  - - [832, 1024, 1, 4096]
    - [86, 57.46]
  - - [896, 1024, 1, 4096]
    - [20, 68.53]
  - - [960, 1024, 1, 4096]
    - [87, 59.55]
  - - [1024, 1024, 1, 4096]
    - [20, 75.53]
  - - [1088, 64, 1, 64]
    - [23, 0.44]
  - - [1216, 64, 1, 64]
    - [23, 0.48]
  - - [1344, 64, 1, 64]
    - [3, 0.52]
  - - [1472, 64, 1, 64]
    - [61, 0.58]
  - - [1600, 64, 1, 64]
    - [25, 0.63]
  - - [1728, 64, 1, 64]
    - [169, 0.67]
  - - [1856, 64, 1, 64]
    - [2, 0.72]
  - - [1984, 64, 1, 64]
    - [23, 0.77]
  - - [1088, 192, 1, 64]
    - [3, 1.19]
  - - [1216, 192, 1, 64]
    - [25, 1.35]
  - - [1344, 192, 1, 64]
    - [28, 1.5]
  - - [1472, 192, 1, 64]
    - [61, 1.51]
  - - [1600, 192, 1, 64]
    - [25, 1.65]
  - - [1728, 192, 1, 64]
    - [29, 1.78]
  - - [1856, 192, 1, 64]
    - [29, 1.97]
  - - [1984, 192, 1, 64]
    - [62, 2.09]
  - - [1088, 320, 1, 64]
    - [62, 1.92]
  - - [1216, 320, 1, 64]
    - [31, 2.12]
  - - [1344, 320, 1, 64]
    - [86, 2.32]
  - - [1472, 320, 1, 64]
    - [28, 2.43]
  - - [1600, 320, 1, 64]
    - [31, 2.69]
  - - [1728, 320, 1, 64]
    - [9, 2.67]
  - - [1856, 320, 1, 64]
    - [86, 3.03]
  - - [1984, 320, 1, 64]
    - [87, 3.18]
  - - [1088, 448, 1, 64]
    - [31, 2.56]
  - - [1216, 448, 1, 64]
    - [87, 2.72]
  - - [1344, 448, 1, 64]
    - [87, 3.02]
  - - [1472, 448, 1, 64]
    - [8, 3.31]
  - - [1600, 448, 1, 64]
    - [87, 3.35]
  - - [1728, 448, 1, 64]
    - [86, 3.61]
  - - [1856, 448, 1, 64]
    - [87, 3.87]
  - - [1984, 448, 1, 64]
    - [7, 3.89]
  - - [1088, 576, 1, 64]
    - [49, 3.09]
  - - [1216, 576, 1, 64]
    - [86, 3.5]
  - - [1344, 576, 1, 64]
    - [86, 3.58]
  - - [1472, 576, 1, 64]
    - [86, 3.99]
  - - [1600, 576, 1, 64]
    - [87, 4.34]
  - - [1728, 576, 1, 64]
    - [12, 4.11]
  - - [1856, 576, 1, 64]
    - [12, 4.55]
  - - [1984, 576, 1, 64]
    - [50, 4.84]
  - - [1088, 704, 1, 64]
    - [53, 3.43]
  - - [1216, 704, 1, 64]
    - [49, 3.8]
  - - [1344, 704, 1, 64]
    - [53, 4.28]
  - - [1472, 704, 1, 64]
    - [9, 4.36]
  - - [1600, 704, 1, 64]
    - [7, 4.71]
  - - [1728, 704, 1, 64]
    - [11, 4.71]
  - - [1856, 704, 1, 64]
    - [7, 4.9]
  - - [1984, 704, 1, 64]
    - [49, 5.3]
  - - [1088, 832, 1, 64]
    - [52, 4.14]
  - - [1216, 832, 1, 64]
    - [8, 4.23]
  - - [1344, 832, 1, 64]
    - [8, 4.8]
  - - [1472, 832, 1, 64]
    - [9, 4.82]
  - - [1600, 832, 1, 64]
    - [8, 5.33]
  - - [1728, 832, 1, 64]
    - [7, 5.52]
  - - [1856, 832, 1, 64]
    - [53, 5.65]
  - - [1984, 832, 1, 64]
    - [9, 5.89]
  - - [1088, 960, 1, 64]
    - [8, 4.56]
  - - [1216, 960, 1, 64]
    - [8, 5.0]
  - - [1344, 960, 1, 64]
    - [8, 5.18]
  - - [1472, 960, 1, 64]
    - [8, 5.66]
  - - [1600, 960, 1, 64]
    - [9, 5.72]
  - - [1728, 960, 1, 64]
    - [9, 6.17]
  - - [1856, 960, 1, 64]
    - [8, 6.13]
  - - [1984, 960, 1, 64]
    - [7, 6.58]
  - - [64, 1088, 1, 64]
    - [62, 0.42]
  - - [192, 1088, 1, 64]
    - [61, 1.21]
  - - [320, 1088, 1, 64]
    - [28, 1.95]
  - - [448, 1088, 1, 64]
    - [29, 2.51]
  - - [576, 1088, 1, 64]
    - [46, 3.17]
  - - [704, 1088, 1, 64]
    - [7, 3.57]
  - - [832, 1088, 1, 64]
    - [53, 4.29]
  - - [960, 1088, 1, 64]
    - [9, 4.4]
  - - [1088, 1088, 1, 64]
    - [9, 5.19]
  - - [1216, 1088, 1, 64]
    - [15, 5.39]
  - - [1344, 1088, 1, 64]
    - [7, 5.92]
  - - [1472, 1088, 1, 64]
    - [7, 5.95]
  - - [1600, 1088, 1, 64]
    - [8, 6.19]
  - - [1728, 1088, 1, 64]
    - [9, 6.69]
  - - [1856, 1088, 1, 64]
    - [8, 6.7]
  - - [1984, 1088, 1, 64]
    - [8, 7.23]
  - - [64, 1216, 1, 64]
    - [85, 0.48]
  - - [192, 1216, 1, 64]
    - [64, 1.36]
  - - [320, 1216, 1, 64]
    - [64, 2.14]
  - - [448, 1216, 1, 64]
    - [87, 2.76]
  - - [576, 1216, 1, 64]
    - [86, 3.55]
  - - [704, 1216, 1, 64]
    - [10, 3.98]
  - - [832, 1216, 1, 64]
    - [9, 4.44]
  - - [960, 1216, 1, 64]
    - [49, 5.02]
  - - [1088, 1216, 1, 64]
    - [8, 5.16]
  - - [1216, 1216, 1, 64]
    - [8, 6.01]
  - - [1344, 1216, 1, 64]
    - [53, 6.17]
  - - [1472, 1216, 1, 64]
    - [9, 6.37]
  - - [1600, 1216, 1, 64]
    - [7, 6.85]
  - - [1728, 1216, 1, 64]
    - [8, 6.81]
  - - [1856, 1216, 1, 64]
    - [8, 7.1]
  - - [1984, 1216, 1, 64]
    - [15, 7.3]
  - - [64, 1344, 1, 64]
    - [209, 0.51]
  - - [192, 1344, 1, 64]
    - [64, 1.5]
  - - [320, 1344, 1, 64]
    - [86, 2.25]
  - - [448, 1344, 1, 64]
    - [87, 2.98]
  - - [576, 1344, 1, 64]
    - [211, 3.58]
  - - [704, 1344, 1, 64]
    - [173, 4.37]
  - - [832, 1344, 1, 64]
    - [46, 4.92]
  - - [960, 1344, 1, 64]
    - [8, 5.25]
  - - [1088, 1344, 1, 64]
    - [8, 5.96]
  - - [1216, 1344, 1, 64]
    - [7, 5.96]
  - - [1344, 1344, 1, 64]
    - [7, 6.39]
  - - [1472, 1344, 1, 64]
    - [7, 6.97]
  - - [1600, 1344, 1, 64]
    - [7, 7.13]
  - - [1728, 1344, 1, 64]
    - [8, 7.38]
  - - [1856, 1344, 1, 64]
    - [7, 7.88]
  - - [1984, 1344, 1, 64]
    - [7, 7.97]
  - - [64, 1472, 1, 64]
    - [3, 0.56]
  - - [192, 1472, 1, 64]
    - [28, 1.54]
  - - [320, 1472, 1, 64]
    - [87, 2.55]
  - - [448, 1472, 1, 64]
    - [7, 3.28]
  - - [576, 1472, 1, 64]
    - [86, 3.92]
  - - [704, 1472, 1, 64]
    - [174, 4.38]
  - - [832, 1472, 1, 64]
    - [86, 5.12]
  - - [960, 1472, 1, 64]
    - [52, 5.41]
  - - [1088, 1472, 1, 64]
    - [9, 5.83]
  - - [1216, 1472, 1, 64]
    - [11, 6.17]
  - - [1344, 1472, 1, 64]
    - [11, 6.8]
  - - [1472, 1472, 1, 64]
    - [9, 7.0]
  - - [1600, 1472, 1, 64]
    - [86, 7.18]
  - - [1728, 1472, 1, 64]
    - [9, 7.67]
  - - [1856, 1472, 1, 64]
    - [7, 8.13]
  - - [1984, 1472, 1, 64]
    - [52, 8.19]
  - - [64, 1600, 1, 64]
    - [212, 0.64]
  - - [192, 1600, 1, 64]
    - [45, 1.65]
  - - [320, 1600, 1, 64]
    - [4, 2.64]
  - - [448, 1600, 1, 64]
    - [87, 3.49]
  - - [576, 1600, 1, 64]
    - [87, 4.23]
  - - [704, 1600, 1, 64]
    - [49, 4.84]
  - - [832, 1600, 1, 64]
    - [9, 5.32]
  - - [960, 1600, 1, 64]
    - [52, 5.52]
  - - [1088, 1600, 1, 64]
    - [13, 6.42]
  - - [1216, 1600, 1, 64]
    - [8, 6.75]
  - - [1344, 1600, 1, 64]
    - [9, 7.0]
  - - [1472, 1600, 1, 64]
    - [8, 7.35]
  - - [1600, 1600, 1, 64]
    - [7, 7.56]
  - - [1728, 1600, 1, 64]
    - [8, 8.08]
  - - [1856, 1600, 1, 64]
    - [7, 8.43]
  - - [1984, 1600, 1, 64]
    - [8, 8.5]
  - - [64, 1728, 1, 64]
    - [31, 0.67]
  - - [192, 1728, 1, 64]
    - [63, 1.84]
  - - [320, 1728, 1, 64]
    - [175, 2.76]
  - - [448, 1728, 1, 64]
    - [87, 3.63]
  - - [576, 1728, 1, 64]
    - [9, 4.65]
  - - [704, 1728, 1, 64]
    - [9, 5.29]
  - - [832, 1728, 1, 64]
    - [13, 5.79]
  - - [960, 1728, 1, 64]
    - [7, 6.25]
  - - [1088, 1728, 1, 64]
    - [7, 6.51]
  - - [1216, 1728, 1, 64]
    - [7, 6.81]
  - - [1344, 1728, 1, 64]
    - [7, 7.11]
  - - [1472, 1728, 1, 64]
    - [8, 7.49]
  - - [1600, 1728, 1, 64]
    - [8, 7.99]
  - - [1728, 1728, 1, 64]
    - [47, 8.4]
  - - [1856, 1728, 1, 64]
    - [8, 8.65]
  - - [1984, 1728, 1, 64]
    - [8, 8.82]
  - - [64, 1856, 1, 64]
    - [64, 0.75]
  - - [192, 1856, 1, 64]
    - [30, 1.88]
  - - [320, 1856, 1, 64]
    - [49, 3.07]
  - - [448, 1856, 1, 64]
    - [176, 3.82]
  - - [576, 1856, 1, 64]
    - [213, 4.48]
  - - [704, 1856, 1, 64]
    - [7, 5.28]
  - - [832, 1856, 1, 64]
    - [53, 5.74]
  - - [960, 1856, 1, 64]
    - [8, 6.32]
  - - [1088, 1856, 1, 64]
    - [48, 6.86]
  - - [1216, 1856, 1, 64]
    - [8, 7.58]
  - - [1344, 1856, 1, 64]
    - [9, 7.9]
  - - [1472, 1856, 1, 64]
    - [7, 8.02]
  - - [1600, 1856, 1, 64]
    - [9, 8.41]
  - - [1728, 1856, 1, 64]
    - [8, 8.4]
  - - [1856, 1856, 1, 64]
    - [52, 8.55]
  - - [1984, 1856, 1, 64]
    - [47, 8.96]
  - - [64, 1984, 1, 64]
    - [44, 0.73]
  - - [192, 1984, 1, 64]
    - [64, 2.03]
  - - [320, 1984, 1, 64]
    - [87, 3.02]
  - - [448, 1984, 1, 64]
    - [48, 3.98]
  - - [576, 1984, 1, 64]
    - [7, 4.7]
  - - [704, 1984, 1, 64]
    - [49, 5.38]
  - - [832, 1984, 1, 64]
    - [46, 5.98]
  - - [960, 1984, 1, 64]
    - [7, 6.49]
  - - [1088, 1984, 1, 64]
    - [46, 6.92]
  - - [1216, 1984, 1, 64]
    - [15, 7.21]
  - - [1344, 1984, 1, 64]
    - [13, 7.68]
  - - [1472, 1984, 1, 64]
    - [7, 8.24]
  - - [1600, 1984, 1, 64]
    - [8, 8.42]
  - - [1728, 1984, 1, 64]
    - [7, 8.69]
  - - [1856, 1984, 1, 64]
    - [9, 8.91]
  - - [1984, 1984, 1, 64]
    - [7, 9.1]
  - - [1088, 64, 1, 256]
    - [89, 1.65]
  - - [1216, 64, 1, 256]
    - [89, 1.65]
  - - [1344, 64, 1, 256]
    - [89, 2.03]
  - - [1472, 64, 1, 256]
    - [28, 2.06]
  - - [1600, 64, 1, 256]
    - [89, 2.44]
  - - [1728, 64, 1, 256]
    - [61, 2.42]
  - - [1856, 64, 1, 256]
    - [89, 2.8]
  - - [1984, 64, 1, 256]
    - [60, 2.74]
  - - [1088, 192, 1, 256]
    - [89, 4.26]
  - - [1216, 192, 1, 256]
    - [61, 4.8]
  - - [1344, 192, 1, 256]
    - [89, 5.47]
  - - [1472, 192, 1, 256]
    - [29, 5.71]
  - - [1600, 192, 1, 256]
    - [86, 5.86]
  - - [1728, 192, 1, 256]
    - [86, 6.24]
  - - [1856, 192, 1, 256]
    - [29, 6.6]
  - - [1984, 192, 1, 256]
    - [61, 7.11]
  - - [1088, 320, 1, 256]
    - [89, 6.83]
  - - [1216, 320, 1, 256]
    - [62, 7.6]
  - - [1344, 320, 1, 256]
    - [87, 8.09]
  - - [1472, 320, 1, 256]
    - [89, 8.71]
  - - [1600, 320, 1, 256]
    - [62, 9.18]
  - - [1728, 320, 1, 256]
    - [86, 9.91]
  - - [1856, 320, 1, 256]
    - [89, 10.39]
  - - [1984, 320, 1, 256]
    - [86, 11.02]
  - - [1088, 448, 1, 256]
    - [178, 8.6]
  - - [1216, 448, 1, 256]
    - [53, 9.49]
  - - [1344, 448, 1, 256]
    - [86, 10.77]
  - - [1472, 448, 1, 256]
    - [86, 11.04]
  - - [1600, 448, 1, 256]
    - [86, 11.77]
  - - [1728, 448, 1, 256]
    - [86, 12.61]
  - - [1856, 448, 1, 256]
    - [86, 13.3]
  - - [1984, 448, 1, 256]
    - [86, 14.44]
  - - [1088, 576, 1, 256]
    - [86, 11.2]
  - - [1216, 576, 1, 256]
    - [86, 11.53]
  - - [1344, 576, 1, 256]
    - [86, 12.59]
  - - [1472, 576, 1, 256]
    - [46, 12.52]
  - - [1600, 576, 1, 256]
    - [86, 14.06]
  - - [1728, 576, 1, 256]
    - [86, 14.47]
  - - [1856, 576, 1, 256]
    - [87, 14.96]
  - - [1984, 576, 1, 256]
    - [86, 15.94]
  - - [1088, 704, 1, 256]
    - [86, 12.09]
  - - [1216, 704, 1, 256]
    - [86, 13.43]
  - - [1344, 704, 1, 256]
    - [86, 14.8]
  - - [1472, 704, 1, 256]
    - [86, 14.8]
  - - [1600, 704, 1, 256]
    - [86, 16.22]
  - - [1728, 704, 1, 256]
    - [46, 15.14]
  - - [1856, 704, 1, 256]
    - [47, 16.17]
  - - [1984, 704, 1, 256]
    - [46, 17.07]
  - - [1088, 832, 1, 256]
    - [86, 14.51]
  - - [1216, 832, 1, 256]
    - [86, 14.72]
  - - [1344, 832, 1, 256]
    - [86, 15.93]
  - - [1472, 832, 1, 256]
    - [46, 15.92]
  - - [1600, 832, 1, 256]
    - [46, 17.29]
  - - [1728, 832, 1, 256]
    - [46, 18.67]
  - - [1856, 832, 1, 256]
    - [46, 18.69]
  - - [1984, 832, 1, 256]
    - [46, 19.81]
  - - [1088, 960, 1, 256]
    - [87, 14.6]
  - - [1216, 960, 1, 256]
    - [53, 16.63]
  - - [1344, 960, 1, 256]
    - [53, 17.14]
  - - [1472, 960, 1, 256]
    - [53, 18.19]
  - - [1600, 960, 1, 256]
    - [46, 18.87]
  - - [1728, 960, 1, 256]
    - [46, 20.05]
  - - [1856, 960, 1, 256]
    - [47, 19.39]
  - - [1984, 960, 1, 256]
    - [7, 21.12]
  - - [64, 1088, 1, 256]
    - [71, 1.61]
  - - [192, 1088, 1, 256]
    - [89, 4.49]
  - - [320, 1088, 1, 256]
    - [60, 7.13]
  - - [448, 1088, 1, 256]
    - [61, 9.0]
  - - [576, 1088, 1, 256]
    - [86, 11.57]
  - - [704, 1088, 1, 256]
    - [86, 12.46]
  - - [832, 1088, 1, 256]
    - [86, 15.03]
  - - [960, 1088, 1, 256]
    - [87, 15.25]
  - - [1088, 1088, 1, 256]
    - [86, 17.67]
  - - [1216, 1088, 1, 256]
    - [53, 17.9]
  - - [1344, 1088, 1, 256]
    - [53, 19.37]
  - - [1472, 1088, 1, 256]
    - [53, 19.8]
  - - [1600, 1088, 1, 256]
    - [53, 20.2]
  - - [1728, 1088, 1, 256]
    - [9, 21.06]
  - - [1856, 1088, 1, 256]
    - [9, 21.43]
  - - [1984, 1088, 1, 256]
    - [8, 22.58]
  - - [64, 1216, 1, 256]
    - [89, 1.78]
  - - [192, 1216, 1, 256]
    - [61, 5.03]
  - - [320, 1216, 1, 256]
    - [89, 7.68]
  - - [448, 1216, 1, 256]
    - [86, 9.83]
  - - [576, 1216, 1, 256]
    - [86, 12.47]
  - - [704, 1216, 1, 256]
    - [86, 13.96]
  - - [832, 1216, 1, 256]
    - [86, 14.99]
  - - [960, 1216, 1, 256]
    - [86, 17.12]
  - - [1088, 1216, 1, 256]
    - [53, 17.2]
  - - [1216, 1216, 1, 256]
    - [48, 19.09]
  - - [1344, 1216, 1, 256]
    - [53, 19.59]
  - - [1472, 1216, 1, 256]
    - [9, 20.21]
  - - [1600, 1216, 1, 256]
    - [53, 22.17]
  - - [1728, 1216, 1, 256]
    - [52, 22.23]
  - - [1856, 1216, 1, 256]
    - [53, 22.62]
  - - [1984, 1216, 1, 256]
    - [53, 24.2]
  - - [64, 1344, 1, 256]
    - [89, 2.03]
  - - [192, 1344, 1, 256]
    - [89, 5.62]
  - - [320, 1344, 1, 256]
    - [89, 8.11]
  - - [448, 1344, 1, 256]
    - [86, 10.03]
  - - [576, 1344, 1, 256]
    - [29, 12.5]
  - - [704, 1344, 1, 256]
    - [86, 15.26]
  - - [832, 1344, 1, 256]
    - [53, 16.26]
  - - [960, 1344, 1, 256]
    - [53, 17.17]
  - - [1088, 1344, 1, 256]
    - [46, 19.32]
  - - [1216, 1344, 1, 256]
    - [53, 19.55]
  - - [1344, 1344, 1, 256]
    - [86, 20.42]
  - - [1472, 1344, 1, 256]
    - [46, 21.68]
  - - [1600, 1344, 1, 256]
    - [46, 22.33]
  - - [1728, 1344, 1, 256]
    - [7, 22.76]
  - - [1856, 1344, 1, 256]
    - [7, 24.49]
  - - [1984, 1344, 1, 256]
    - [46, 24.23]
  - - [64, 1472, 1, 256]
    - [179, 2.02]
  - - [192, 1472, 1, 256]
    - [106, 5.43]
  - - [320, 1472, 1, 256]
    - [50, 8.51]
  - - [448, 1472, 1, 256]
    - [86, 11.4]
  - - [576, 1472, 1, 256]
    - [86, 13.5]
  - - [704, 1472, 1, 256]
    - [46, 14.64]
  - - [832, 1472, 1, 256]
    - [86, 17.36]
  - - [960, 1472, 1, 256]
    - [53, 18.67]
  - - [1088, 1472, 1, 256]
    - [53, 19.55]
  - - [1216, 1472, 1, 256]
    - [86, 20.29]
  - - [1344, 1472, 1, 256]
    - [46, 22.18]
  - - [1472, 1472, 1, 256]
    - [8, 22.14]
  - - [1600, 1472, 1, 256]
    - [46, 22.68]
  - - [1728, 1472, 1, 256]
    - [46, 23.72]
  - - [1856, 1472, 1, 256]
    - [53, 25.22]
  - - [1984, 1472, 1, 256]
    - [46, 25.02]
  - - [64, 1600, 1, 256]
    - [29, 2.29]
  - - [192, 1600, 1, 256]
    - [81, 5.93]
  - - [320, 1600, 1, 256]
    - [29, 9.71]
  - - [448, 1600, 1, 256]
    - [87, 11.97]
  - - [576, 1600, 1, 256]
    - [87, 14.15]
  - - [704, 1600, 1, 256]
    - [86, 15.75]
  - - [832, 1600, 1, 256]
    - [53, 17.92]
  - - [960, 1600, 1, 256]
    - [53, 18.23]
  - - [1088, 1600, 1, 256]
    - [53, 20.66]
  - - [1216, 1600, 1, 256]
    - [86, 21.86]
  - - [1344, 1600, 1, 256]
    - [46, 22.73]
  - - [1472, 1600, 1, 256]
    - [86, 23.41]
  - - [1600, 1600, 1, 256]
    - [46, 23.58]
  - - [1728, 1600, 1, 256]
    - [46, 24.85]
  - - [1856, 1600, 1, 256]
    - [52, 25.75]
  - - [1984, 1600, 1, 256]
    - [53, 26.09]
  - - [64, 1728, 1, 256]
    - [60, 2.53]
  - - [192, 1728, 1, 256]
    - [60, 6.69]
  - - [320, 1728, 1, 256]
    - [61, 9.68]
  - - [448, 1728, 1, 256]
    - [61, 12.56]
  - - [576, 1728, 1, 256]
    - [86, 15.8]
  - - [704, 1728, 1, 256]
    - [86, 17.77]
  - - [832, 1728, 1, 256]
    - [46, 18.85]
  - - [960, 1728, 1, 256]
    - [53, 20.28]
  - - [1088, 1728, 1, 256]
    - [47, 20.85]
  - - [1216, 1728, 1, 256]
    - [53, 21.83]
  - - [1344, 1728, 1, 256]
    - [86, 22.65]
  - - [1472, 1728, 1, 256]
    - [86, 23.4]
  - - [1600, 1728, 1, 256]
    - [46, 25.32]
  - - [1728, 1728, 1, 256]
    - [53, 26.18]
  - - [1856, 1728, 1, 256]
    - [53, 26.42]
  - - [1984, 1728, 1, 256]
    - [9, 26.9]
  - - [64, 1856, 1, 256]
    - [89, 2.81]
  - - [192, 1856, 1, 256]
    - [60, 7.18]
  - - [320, 1856, 1, 256]
    - [53, 10.67]
  - - [448, 1856, 1, 256]
    - [86, 13.38]
  - - [576, 1856, 1, 256]
    - [87, 14.96]
  - - [704, 1856, 1, 256]
    - [86, 16.94]
  - - [832, 1856, 1, 256]
    - [48, 19.02]
  - - [960, 1856, 1, 256]
    - [86, 20.4]
  - - [1088, 1856, 1, 256]
    - [53, 21.89]
  - - [1216, 1856, 1, 256]
    - [53, 22.92]
  - - [1344, 1856, 1, 256]
    - [53, 23.88]
  - - [1472, 1856, 1, 256]
    - [53, 24.72]
  - - [1600, 1856, 1, 256]
    - [47, 25.28]
  - - [1728, 1856, 1, 256]
    - [46, 25.98]
  - - [1856, 1856, 1, 256]
    - [47, 26.66]
  - - [1984, 1856, 1, 256]
    - [47, 27.13]
  - - [64, 1984, 1, 256]
    - [60, 2.84]
  - - [192, 1984, 1, 256]
    - [89, 7.28]
  - - [320, 1984, 1, 256]
    - [86, 10.94]
  - - [448, 1984, 1, 256]
    - [53, 14.06]
  - - [576, 1984, 1, 256]
    - [86, 16.73]
  - - [704, 1984, 1, 256]
    - [86, 17.48]
  - - [832, 1984, 1, 256]
    - [53, 20.06]
  - - [960, 1984, 1, 256]
    - [53, 21.59]
  - - [1088, 1984, 1, 256]
    - [46, 22.43]
  - - [1216, 1984, 1, 256]
    - [46, 23.11]
  - - [1344, 1984, 1, 256]
    - [47, 24.42]
  - - [1472, 1984, 1, 256]
    - [7, 25.13]
  - - [1600, 1984, 1, 256]
    - [7, 26.28]
  - - [1728, 1984, 1, 256]
    - [46, 26.7]
  - - [1856, 1984, 1, 256]
    - [47, 27.24]
  - - [1984, 1984, 1, 256]
    - [47, 28.19]
  - - [1088, 64, 1, 512]
    - [371, 3.17]
  - - [1216, 64, 1, 512]
    - [60, 3.25]
  - - [1344, 64, 1, 512]
    - [89, 3.82]
  - - [1472, 64, 1, 512]
    - [89, 3.82]
  - - [1600, 64, 1, 512]
    - [244, 4.25]
  - - [1728, 64, 1, 512]
    - [89, 4.78]
  - - [1856, 64, 1, 512]
    - [89, 5.25]
  - - [1984, 64, 1, 512]
    - [89, 5.5]
  - - [1088, 192, 1, 512]
    - [90, 8.05]
  - - [1216, 192, 1, 512]
    - [89, 8.92]
  - - [1344, 192, 1, 512]
    - [89, 9.68]
  - - [1472, 192, 1, 512]
    - [60, 9.84]
  - - [1600, 192, 1, 512]
    - [89, 10.55]
  - - [1728, 192, 1, 512]
    - [86, 11.61]
  - - [1856, 192, 1, 512]
    - [89, 12.16]
  - - [1984, 192, 1, 512]
    - [86, 12.75]
  - - [1088, 320, 1, 512]
    - [86, 12.37]
  - - [1216, 320, 1, 512]
    - [62, 13.8]
  - - [1344, 320, 1, 512]
    - [86, 13.92]
  - - [1472, 320, 1, 512]
    - [62, 15.03]
  - - [1600, 320, 1, 512]
    - [155, 15.57]
  - - [1728, 320, 1, 512]
    - [86, 16.53]
  - - [1856, 320, 1, 512]
    - [86, 17.0]
  - - [1984, 320, 1, 512]
    - [86, 18.18]
  - - [1088, 448, 1, 512]
    - [62, 15.45]
  - - [1216, 448, 1, 512]
    - [86, 17.02]
  - - [1344, 448, 1, 512]
    - [86, 18.5]
  - - [1472, 448, 1, 512]
    - [86, 20.16]
  - - [1600, 448, 1, 512]
    - [87, 19.7]
  - - [1728, 448, 1, 512]
    - [87, 21.12]
  - - [1856, 448, 1, 512]
    - [87, 22.33]
  - - [1984, 448, 1, 512]
    - [87, 23.95]
  - - [1088, 576, 1, 512]
    - [240, 19.34]
  - - [1216, 576, 1, 512]
    - [87, 19.88]
  - - [1344, 576, 1, 512]
    - [86, 19.97]
  - - [1472, 576, 1, 512]
    - [86, 22.2]
  - - [1600, 576, 1, 512]
    - [245, 22.57]
  - - [1728, 576, 1, 512]
    - [86, 23.41]
  - - [1856, 576, 1, 512]
    - [86, 24.06]
  - - [1984, 576, 1, 512]
    - [86, 26.51]
  - - [1088, 704, 1, 512]
    - [23, 19.91]
  - - [1216, 704, 1, 512]
    - [86, 21.7]
  - - [1344, 704, 1, 512]
    - [86, 23.34]
  - - [1472, 704, 1, 512]
    - [86, 23.5]
  - - [1600, 704, 1, 512]
    - [86, 26.22]
  - - [1728, 704, 1, 512]
    - [86, 24.5]
  - - [1856, 704, 1, 512]
    - [46, 26.22]
  - - [1984, 704, 1, 512]
    - [46, 27.81]
  - - [1088, 832, 1, 512]
    - [86, 23.91]
  - - [1216, 832, 1, 512]
    - [86, 23.6]
  - - [1344, 832, 1, 512]
    - [86, 25.2]
  - - [1472, 832, 1, 512]
    - [46, 24.64]
  - - [1600, 832, 1, 512]
    - [86, 26.51]
  - - [1728, 832, 1, 512]
    - [46, 27.43]
  - - [1856, 832, 1, 512]
    - [46, 27.83]
  - - [1984, 832, 1, 512]
    - [86, 28.98]
  - - [1088, 960, 1, 512]
    - [86, 25.25]
  - - [1216, 960, 1, 512]
    - [86, 27.3]
  - - [1344, 960, 1, 512]
    - [53, 27.31]
  - - [1472, 960, 1, 512]
    - [7, 27.94]
  - - [1600, 960, 1, 512]
    - [86, 28.46]
  - - [1728, 960, 1, 512]
    - [87, 30.47]
  - - [1856, 960, 1, 512]
    - [86, 30.07]
  - - [1984, 960, 1, 512]
    - [86, 32.73]
  - - [64, 1088, 1, 512]
    - [372, 3.16]
  - - [192, 1088, 1, 512]
    - [61, 8.41]
  - - [320, 1088, 1, 512]
    - [60, 12.84]
  - - [448, 1088, 1, 512]
    - [180, 15.0]
  - - [576, 1088, 1, 512]
    - [231, 19.83]
  - - [704, 1088, 1, 512]
    - [87, 20.14]
  - - [832, 1088, 1, 512]
    - [86, 25.01]
  - - [960, 1088, 1, 512]
    - [87, 23.93]
  - - [1088, 1088, 1, 512]
    - [373, 25.89]
  - - [1216, 1088, 1, 512]
    - [87, 26.88]
  - - [1344, 1088, 1, 512]
    - [87, 30.18]
  - - [1472, 1088, 1, 512]
    - [86, 30.83]
  - - [1600, 1088, 1, 512]
    - [246, 31.39]
  - - [1728, 1088, 1, 512]
    - [86, 32.85]
  - - [1856, 1088, 1, 512]
    - [86, 32.07]
  - - [1984, 1088, 1, 512]
    - [87, 34.61]
  - - [64, 1216, 1, 512]
    - [89, 3.3]
  - - [192, 1216, 1, 512]
    - [90, 8.8]
  - - [320, 1216, 1, 512]
    - [87, 12.93]
  - - [448, 1216, 1, 512]
    - [86, 16.15]
  - - [576, 1216, 1, 512]
    - [86, 20.83]
  - - [704, 1216, 1, 512]
    - [86, 22.32]
  - - [832, 1216, 1, 512]
    - [86, 24.16]
  - - [960, 1216, 1, 512]
    - [87, 26.74]
  - - [1088, 1216, 1, 512]
    - [86, 26.69]
  - - [1216, 1216, 1, 512]
    - [53, 28.55]
  - - [1344, 1216, 1, 512]
    - [87, 30.48]
  - - [1472, 1216, 1, 512]
    - [86, 30.7]
  - - [1600, 1216, 1, 512]
    - [87, 32.81]
  - - [1728, 1216, 1, 512]
    - [86, 34.52]
  - - [1856, 1216, 1, 512]
    - [86, 33.58]
  - - [1984, 1216, 1, 512]
    - [86, 35.62]
  - - [64, 1344, 1, 512]
    - [89, 3.71]
  - - [192, 1344, 1, 512]
    - [89, 9.61]
  - - [320, 1344, 1, 512]
    - [86, 14.99]
  - - [448, 1344, 1, 512]
    - [53, 17.41]
  - - [576, 1344, 1, 512]
    - [24, 20.24]
  - - [704, 1344, 1, 512]
    - [86, 24.48]
  - - [832, 1344, 1, 512]
    - [86, 27.28]
  - - [960, 1344, 1, 512]
    - [87, 26.04]
  - - [1088, 1344, 1, 512]
    - [50, 29.57]
  - - [1216, 1344, 1, 512]
    - [86, 30.43]
  - - [1344, 1344, 1, 512]
    - [86, 31.13]
  - - [1472, 1344, 1, 512]
    - [48, 33.26]
  - - [1600, 1344, 1, 512]
    - [86, 33.75]
  - - [1728, 1344, 1, 512]
    - [46, 34.83]
  - - [1856, 1344, 1, 512]
    - [46, 36.6]
  - - [1984, 1344, 1, 512]
    - [86, 36.81]
  - - [64, 1472, 1, 512]
    - [89, 4.0]
  - - [192, 1472, 1, 512]
    - [61, 10.2]
  - - [320, 1472, 1, 512]
    - [86, 16.65]
  - - [448, 1472, 1, 512]
    - [87, 20.16]
  - - [576, 1472, 1, 512]
    - [86, 22.37]
  - - [704, 1472, 1, 512]
    - [87, 23.77]
  - - [832, 1472, 1, 512]
    - [86, 27.94]
  - - [960, 1472, 1, 512]
    - [86, 28.07]
  - - [1088, 1472, 1, 512]
    - [86, 29.79]
  - - [1216, 1472, 1, 512]
    - [86, 30.39]
  - - [1344, 1472, 1, 512]
    - [86, 34.13]
  - - [1472, 1472, 1, 512]
    - [86, 35.0]
  - - [1600, 1472, 1, 512]
    - [86, 35.06]
  - - [1728, 1472, 1, 512]
    - [86, 36.37]
  - - [1856, 1472, 1, 512]
    - [46, 37.66]
  - - [1984, 1472, 1, 512]
    - [87, 38.42]
  - - [64, 1600, 1, 512]
    - [226, 4.53]
  - - [192, 1600, 1, 512]
    - [89, 11.42]
  - - [320, 1600, 1, 512]
    - [178, 16.28]
  - - [448, 1600, 1, 512]
    - [87, 21.6]
  - - [576, 1600, 1, 512]
    - [231, 24.05]
  - - [704, 1600, 1, 512]
    - [86, 25.95]
  - - [832, 1600, 1, 512]
    - [86, 27.11]
  - - [960, 1600, 1, 512]
    - [86, 29.38]
  - - [1088, 1600, 1, 512]
    - [236, 32.09]
  - - [1216, 1600, 1, 512]
    - [86, 33.35]
  - - [1344, 1600, 1, 512]
    - [86, 33.94]
  - - [1472, 1600, 1, 512]
    - [86, 34.63]
  - - [1600, 1600, 1, 512]
    - [237, 35.28]
  - - [1728, 1600, 1, 512]
    - [46, 36.68]
  - - [1856, 1600, 1, 512]
    - [86, 39.77]
  - - [1984, 1600, 1, 512]
    - [86, 38.93]
  - - [64, 1728, 1, 512]
    - [89, 4.82]
  - - [192, 1728, 1, 512]
    - [89, 12.3]
  - - [320, 1728, 1, 512]
    - [86, 16.8]
  - - [448, 1728, 1, 512]
    - [86, 21.23]
  - - [576, 1728, 1, 512]
    - [86, 26.23]
  - - [704, 1728, 1, 512]
    - [86, 28.71]
  - - [832, 1728, 1, 512]
    - [87, 28.27]
  - - [960, 1728, 1, 512]
    - [86, 31.33]
  - - [1088, 1728, 1, 512]
    - [86, 33.41]
  - - [1216, 1728, 1, 512]
    - [86, 32.82]
  - - [1344, 1728, 1, 512]
    - [86, 34.07]
  - - [1472, 1728, 1, 512]
    - [86, 36.25]
  - - [1600, 1728, 1, 512]
    - [46, 37.82]
  - - [1728, 1728, 1, 512]
    - [86, 38.77]
  - - [1856, 1728, 1, 512]
    - [87, 39.0]
  - - [1984, 1728, 1, 512]
    - [46, 39.61]
  - - [64, 1856, 1, 512]
    - [89, 5.09]
  - - [192, 1856, 1, 512]
    - [83, 12.82]
  - - [320, 1856, 1, 512]
    - [86, 17.84]
  - - [448, 1856, 1, 512]
    - [86, 22.13]
  - - [576, 1856, 1, 512]
    - [86, 23.07]
  - - [704, 1856, 1, 512]
    - [87, 27.27]
  - - [832, 1856, 1, 512]
    - [86, 30.54]
  - - [960, 1856, 1, 512]
    - [86, 31.82]
  - - [1088, 1856, 1, 512]
    - [87, 33.46]
  - - [1216, 1856, 1, 512]
    - [86, 35.58]
  - - [1344, 1856, 1, 512]
    - [86, 37.0]
  - - [1472, 1856, 1, 512]
    - [86, 37.23]
  - - [1600, 1856, 1, 512]
    - [86, 38.19]
  - - [1728, 1856, 1, 512]
    - [86, 38.92]
  - - [1856, 1856, 1, 512]
    - [48, 39.28]
  - - [1984, 1856, 1, 512]
    - [87, 40.55]
  - - [64, 1984, 1, 512]
    - [107, 5.24]
  - - [192, 1984, 1, 512]
    - [89, 12.97]
  - - [320, 1984, 1, 512]
    - [87, 19.43]
  - - [448, 1984, 1, 512]
    - [86, 24.08]
  - - [576, 1984, 1, 512]
    - [53, 25.73]
  - - [704, 1984, 1, 512]
    - [86, 28.55]
  - - [832, 1984, 1, 512]
    - [87, 30.25]
  - - [960, 1984, 1, 512]
    - [86, 32.73]
  - - [1088, 1984, 1, 512]
    - [87, 33.78]
  - - [1216, 1984, 1, 512]
    - [86, 36.21]
  - - [1344, 1984, 1, 512]
    - [87, 36.94]
  - - [1472, 1984, 1, 512]
    - [86, 38.45]
  - - [1600, 1984, 1, 512]
    - [46, 39.37]
  - - [1728, 1984, 1, 512]
    - [46, 39.69]
  - - [1856, 1984, 1, 512]
    - [46, 40.23]
  - - [1984, 1984, 1, 512]
    - [46, 42.04]
  - - [1088, 64, 1, 1024]
    - [89, 5.6]
  - - [1216, 64, 1, 1024]
    - [153, 5.71]
  - - [1344, 64, 1, 1024]
    - [89, 6.88]
  - - [1472, 64, 1, 1024]
    - [89, 7.28]
  - - [1600, 64, 1, 1024]
    - [89, 7.94]
  - - [1728, 64, 1, 1024]
    - [89, 8.27]
  - - [1856, 64, 1, 1024]
    - [89, 9.38]
  - - [1984, 64, 1, 1024]
    - [89, 9.5]
  - - [1088, 192, 1, 1024]
    - [89, 14.09]
  - - [1216, 192, 1, 1024]
    - [89, 15.56]
  - - [1344, 192, 1, 1024]
    - [89, 17.0]
  - - [1472, 192, 1, 1024]
    - [60, 17.0]
  - - [1600, 192, 1, 1024]
    - [89, 18.43]
  - - [1728, 192, 1, 1024]
    - [86, 19.53]
  - - [1856, 192, 1, 1024]
    - [86, 20.97]
  - - [1984, 192, 1, 1024]
    - [86, 21.13]
  - - [1088, 320, 1, 1024]
    - [62, 20.17]
  - - [1216, 320, 1, 1024]
    - [91, 21.68]
  - - [1344, 320, 1, 1024]
    - [86, 23.11]
  - - [1472, 320, 1, 1024]
    - [91, 23.11]
  - - [1600, 320, 1, 1024]
    - [178, 25.43]
  - - [1728, 320, 1, 1024]
    - [86, 25.23]
  - - [1856, 320, 1, 1024]
    - [91, 26.83]
  - - [1984, 320, 1, 1024]
    - [62, 28.13]
  - - [1088, 448, 1, 1024]
    - [62, 24.52]
  - - [1216, 448, 1, 1024]
    - [86, 26.12]
  - - [1344, 448, 1, 1024]
    - [86, 29.04]
  - - [1472, 448, 1, 1024]
    - [86, 30.16]
  - - [1600, 448, 1, 1024]
    - [86, 28.71]
  - - [1728, 448, 1, 1024]
    - [52, 30.88]
  - - [1856, 448, 1, 1024]
    - [52, 33.34]
  - - [1984, 448, 1, 1024]
    - [86, 34.2]
  - - [1088, 576, 1, 1024]
    - [86, 28.93]
  - - [1216, 576, 1, 1024]
    - [86, 31.05]
  - - [1344, 576, 1, 1024]
    - [4, 30.36]
  - - [1472, 576, 1, 1024]
    - [87, 31.12]
  - - [1600, 576, 1, 1024]
    - [86, 34.83]
  - - [1728, 576, 1, 1024]
    - [63, 32.46]
  - - [1856, 576, 1, 1024]
    - [86, 34.09]
  - - [1984, 576, 1, 1024]
    - [23, 34.86]
  - - [1088, 704, 1, 1024]
    - [178, 29.07]
  - - [1216, 704, 1, 1024]
    - [86, 31.51]
  - - [1344, 704, 1, 1024]
    - [86, 33.51]
  - - [1472, 704, 1, 1024]
    - [144, 33.88]
  - - [1600, 704, 1, 1024]
    - [62, 34.32]
  - - [1728, 704, 1, 1024]
    - [76, 34.79]
  - - [1856, 704, 1, 1024]
    - [62, 37.26]
  - - [1984, 704, 1, 1024]
    - [178, 36.58]
  - - [1088, 832, 1, 1024]
    - [23, 31.98]
  - - [1216, 832, 1, 1024]
    - [91, 33.74]
  - - [1344, 832, 1, 1024]
    - [62, 34.21]
  - - [1472, 832, 1, 1024]
    - [87, 35.92]
  - - [1600, 832, 1, 1024]
    - [62, 35.22]
  - - [1728, 832, 1, 1024]
    - [178, 37.94]
  - - [1856, 832, 1, 1024]
    - [62, 39.28]
  - - [1984, 832, 1, 1024]
    - [91, 38.77]
  - - [1088, 960, 1, 1024]
    - [52, 36.04]
  - - [1216, 960, 1, 1024]
    - [86, 38.62]
  - - [1344, 960, 1, 1024]
    - [144, 36.59]
  - - [1472, 960, 1, 1024]
    - [51, 38.51]
  - - [1600, 960, 1, 1024]
    - [86, 39.98]
  - - [1728, 960, 1, 1024]
    - [12, 39.78]
  - - [1856, 960, 1, 1024]
    - [86, 43.14]
  - - [1984, 960, 1, 1024]
    - [87, 44.17]
  - - [64, 1088, 1, 1024]
    - [89, 5.65]
  - - [192, 1088, 1, 1024]
    - [89, 14.09]
  - - [320, 1088, 1, 1024]
    - [83, 20.03]
  - - [448, 1088, 1, 1024]
    - [86, 25.73]
  - - [576, 1088, 1, 1024]
    - [53, 29.7]
  - - [704, 1088, 1, 1024]
    - [86, 30.65]
  - - [832, 1088, 1, 1024]
    - [52, 33.99]
  - - [960, 1088, 1, 1024]
    - [86, 34.85]
  - - [1088, 1088, 1, 1024]
    - [86, 38.32]
  - - [1216, 1088, 1, 1024]
    - [51, 36.39]
  - - [1344, 1088, 1, 1024]
    - [51, 39.67]
  - - [1472, 1088, 1, 1024]
    - [86, 40.2]
  - - [1600, 1088, 1, 1024]
    - [86, 41.17]
  - - [1728, 1088, 1, 1024]
    - [87, 42.26]
  - - [1856, 1088, 1, 1024]
    - [87, 42.77]
  - - [1984, 1088, 1, 1024]
    - [87, 45.19]
  - - [64, 1216, 1, 1024]
    - [100, 5.96]
  - - [192, 1216, 1, 1024]
    - [89, 16.05]
  - - [320, 1216, 1, 1024]
    - [86, 22.4]
  - - [448, 1216, 1, 1024]
    - [86, 26.13]
  - - [576, 1216, 1, 1024]
    - [53, 31.84]
  - - [704, 1216, 1, 1024]
    - [86, 32.08]
  - - [832, 1216, 1, 1024]
    - [86, 33.23]
  - - [960, 1216, 1, 1024]
    - [87, 36.5]
  - - [1088, 1216, 1, 1024]
    - [86, 36.48]
  - - [1216, 1216, 1, 1024]
    - [51, 40.13]
  - - [1344, 1216, 1, 1024]
    - [86, 41.37]
  - - [1472, 1216, 1, 1024]
    - [87, 42.21]
  - - [1600, 1216, 1, 1024]
    - [51, 43.83]
  - - [1728, 1216, 1, 1024]
    - [87, 43.92]
  - - [1856, 1216, 1, 1024]
    - [124, 45.11]
  - - [1984, 1216, 1, 1024]
    - [124, 46.58]
  - - [64, 1344, 1, 1024]
    - [158, 6.87]
  - - [192, 1344, 1, 1024]
    - [89, 16.64]
  - - [320, 1344, 1, 1024]
    - [86, 24.64]
  - - [448, 1344, 1, 1024]
    - [86, 28.6]
  - - [576, 1344, 1, 1024]
    - [52, 30.14]
  - - [704, 1344, 1, 1024]
    - [87, 35.82]
  - - [832, 1344, 1, 1024]
    - [87, 35.96]
  - - [960, 1344, 1, 1024]
    - [91, 36.11]
  - - [1088, 1344, 1, 1024]
    - [51, 39.22]
  - - [1216, 1344, 1, 1024]
    - [86, 41.19]
  - - [1344, 1344, 1, 1024]
    - [86, 42.46]
  - - [1472, 1344, 1, 1024]
    - [51, 44.1]
  - - [1600, 1344, 1, 1024]
    - [86, 44.82]
  - - [1728, 1344, 1, 1024]
    - [87, 45.09]
  - - [1856, 1344, 1, 1024]
    - [87, 47.56]
  - - [1984, 1344, 1, 1024]
    - [87, 45.91]
  - - [64, 1472, 1, 1024]
    - [100, 7.43]
  - - [192, 1472, 1, 1024]
    - [89, 17.66]
  - - [320, 1472, 1, 1024]
    - [53, 26.17]
  - - [448, 1472, 1, 1024]
    - [53, 30.94]
  - - [576, 1472, 1, 1024]
    - [86, 32.55]
  - - [704, 1472, 1, 1024]
    - [86, 34.02]
  - - [832, 1472, 1, 1024]
    - [87, 37.18]
  - - [960, 1472, 1, 1024]
    - [51, 38.8]
  - - [1088, 1472, 1, 1024]
    - [86, 40.17]
  - - [1216, 1472, 1, 1024]
    - [86, 41.77]
  - - [1344, 1472, 1, 1024]
    - [86, 46.41]
  - - [1472, 1472, 1, 1024]
    - [87, 45.45]
  - - [1600, 1472, 1, 1024]
    - [206, 45.52]
  - - [1728, 1472, 1, 1024]
    - [86, 46.98]
  - - [1856, 1472, 1, 1024]
    - [87, 46.61]
  - - [1984, 1472, 1, 1024]
    - [87, 48.41]
  - - [64, 1600, 1, 1024]
    - [89, 7.97]
  - - [192, 1600, 1, 1024]
    - [89, 19.19]
  - - [320, 1600, 1, 1024]
    - [62, 26.02]
  - - [448, 1600, 1, 1024]
    - [53, 32.73]
  - - [576, 1600, 1, 1024]
    - [86, 35.73]
  - - [704, 1600, 1, 1024]
    - [87, 35.77]
  - - [832, 1600, 1, 1024]
    - [86, 37.44]
  - - [960, 1600, 1, 1024]
    - [87, 40.98]
  - - [1088, 1600, 1, 1024]
    - [86, 42.7]
  - - [1216, 1600, 1, 1024]
    - [86, 44.79]
  - - [1344, 1600, 1, 1024]
    - [86, 44.96]
  - - [1472, 1600, 1, 1024]
    - [86, 46.02]
  - - [1600, 1600, 1, 1024]
    - [87, 46.73]
  - - [1728, 1600, 1, 1024]
    - [86, 47.92]
  - - [1856, 1600, 1, 1024]
    - [87, 49.15]
  - - [1984, 1600, 1, 1024]
    - [87, 48.9]
  - - [64, 1728, 1, 1024]
    - [90, 8.43]
  - - [192, 1728, 1, 1024]
    - [83, 18.77]
  - - [320, 1728, 1, 1024]
    - [53, 25.53]
  - - [448, 1728, 1, 1024]
    - [178, 29.7]
  - - [576, 1728, 1, 1024]
    - [87, 35.26]
  - - [704, 1728, 1, 1024]
    - [86, 37.8]
  - - [832, 1728, 1, 1024]
    - [51, 38.71]
  - - [960, 1728, 1, 1024]
    - [87, 41.7]
  - - [1088, 1728, 1, 1024]
    - [87, 43.93]
  - - [1216, 1728, 1, 1024]
    - [86, 44.74]
  - - [1344, 1728, 1, 1024]
    - [86, 46.36]
  - - [1472, 1728, 1, 1024]
    - [86, 46.25]
  - - [1600, 1728, 1, 1024]
    - [87, 47.1]
  - - [1728, 1728, 1, 1024]
    - [87, 48.18]
  - - [1856, 1728, 1, 1024]
    - [87, 50.58]
  - - [1984, 1728, 1, 1024]
    - [87, 50.77]
  - - [64, 1856, 1, 1024]
    - [89, 9.32]
  - - [192, 1856, 1, 1024]
    - [89, 20.97]
  - - [320, 1856, 1, 1024]
    - [53, 28.7]
  - - [448, 1856, 1, 1024]
    - [87, 32.2]
  - - [576, 1856, 1, 1024]
    - [86, 34.55]
  - - [704, 1856, 1, 1024]
    - [63, 36.54]
  - - [832, 1856, 1, 1024]
    - [86, 38.8]
  - - [960, 1856, 1, 1024]
    - [86, 41.96]
  - - [1088, 1856, 1, 1024]
    - [87, 42.76]
  - - [1216, 1856, 1, 1024]
    - [86, 44.71]
  - - [1344, 1856, 1, 1024]
    - [86, 47.82]
  - - [1472, 1856, 1, 1024]
    - [87, 48.58]
  - - [1600, 1856, 1, 1024]
    - [87, 48.92]
  - - [1728, 1856, 1, 1024]
    - [87, 50.4]
  - - [1856, 1856, 1, 1024]
    - [87, 50.68]
  - - [1984, 1856, 1, 1024]
    - [86, 51.38]
  - - [64, 1984, 1, 1024]
    - [90, 9.73]
  - - [192, 1984, 1, 1024]
    - [83, 22.22]
  - - [320, 1984, 1, 1024]
    - [53, 29.84]
  - - [448, 1984, 1, 1024]
    - [86, 33.44]
  - - [576, 1984, 1, 1024]
    - [86, 36.84]
  - - [704, 1984, 1, 1024]
    - [51, 38.34]
  - - [832, 1984, 1, 1024]
    - [87, 41.55]
  - - [960, 1984, 1, 1024]
    - [87, 43.86]
  - - [1088, 1984, 1, 1024]
    - [87, 44.2]
  - - [1216, 1984, 1, 1024]
    - [124, 45.99]
  - - [1344, 1984, 1, 1024]
    - [87, 46.8]
  - - [1472, 1984, 1, 1024]
    - [86, 48.76]
  - - [1600, 1984, 1, 1024]
    - [87, 50.1]
  - - [1728, 1984, 1, 1024]
    - [86, 51.11]
  - - [1856, 1984, 1, 1024]
    - [86, 51.82]
  - - [1984, 1984, 1, 1024]
    - [87, 53.24]
  - - [1088, 64, 1, 2048]
    - [371, 9.08]
  - - [1216, 64, 1, 2048]
    - [89, 10.28]
  - - [1344, 64, 1, 2048]
    - [89, 11.18]
  - - [1472, 64, 1, 2048]
    - [89, 12.11]
  - - [1600, 64, 1, 2048]
    - [228, 13.74]
  - - [1728, 64, 1, 2048]
    - [89, 14.05]
  - - [1856, 64, 1, 2048]
    - [89, 15.05]
  - - [1984, 64, 1, 2048]
    - [89, 16.54]
  - - [1088, 192, 1, 2048]
    - [90, 22.66]
  - - [1216, 192, 1, 2048]
    - [89, 24.53]
  - - [1344, 192, 1, 2048]
    - [90, 26.73]
  - - [1472, 192, 1, 2048]
    - [83, 24.81]
  - - [1600, 192, 1, 2048]
    - [86, 27.41]
  - - [1728, 192, 1, 2048]
    - [86, 28.85]
  - - [1856, 192, 1, 2048]
    - [86, 30.15]
  - - [1984, 192, 1, 2048]
    - [86, 32.41]
  - - [1088, 320, 1, 2048]
    - [155, 29.91]
  - - [1216, 320, 1, 2048]
    - [91, 33.02]
  - - [1344, 320, 1, 2048]
    - [87, 34.7]
  - - [1472, 320, 1, 2048]
    - [63, 33.18]
  - - [1600, 320, 1, 2048]
    - [91, 37.04]
  - - [1728, 320, 1, 2048]
    - [86, 35.72]
  - - [1856, 320, 1, 2048]
    - [91, 37.64]
  - - [1984, 320, 1, 2048]
    - [62, 39.28]
  - - [1088, 448, 1, 2048]
    - [149, 34.68]
  - - [1216, 448, 1, 2048]
    - [86, 36.74]
  - - [1344, 448, 1, 2048]
    - [86, 39.9]
  - - [1472, 448, 1, 2048]
    - [86, 41.65]
  - - [1600, 448, 1, 2048]
    - [52, 40.8]
  - - [1728, 448, 1, 2048]
    - [52, 43.04]
  - - [1856, 448, 1, 2048]
    - [52, 47.33]
  - - [1984, 448, 1, 2048]
    - [140, 47.02]
  - - [1088, 576, 1, 2048]
    - [240, 40.78]
  - - [1216, 576, 1, 2048]
    - [86, 42.75]
  - - [1344, 576, 1, 2048]
    - [91, 42.08]
  - - [1472, 576, 1, 2048]
    - [86, 42.12]
  - - [1600, 576, 1, 2048]
    - [282, 43.09]
  - - [1728, 576, 1, 2048]
    - [91, 45.03]
  - - [1856, 576, 1, 2048]
    - [87, 44.57]
  - - [1984, 576, 1, 2048]
    - [87, 46.89]
  - - [1088, 704, 1, 2048]
    - [144, 41.57]
  - - [1216, 704, 1, 2048]
    - [91, 42.29]
  - - [1344, 704, 1, 2048]
    - [136, 44.53]
  - - [1472, 704, 1, 2048]
    - [91, 45.21]
  - - [1600, 704, 1, 2048]
    - [91, 45.46]
  - - [1728, 704, 1, 2048]
    - [76, 46.13]
  - - [1856, 704, 1, 2048]
    - [155, 48.88]
  - - [1984, 704, 1, 2048]
    - [127, 50.65]
  - - [1088, 832, 1, 2048]
    - [91, 45.18]
  - - [1216, 832, 1, 2048]
    - [91, 45.03]
  - - [1344, 832, 1, 2048]
    - [91, 45.51]
  - - [1472, 832, 1, 2048]
    - [87, 46.04]
  - - [1600, 832, 1, 2048]
    - [128, 47.83]
  - - [1728, 832, 1, 2048]
    - [91, 49.84]
  - - [1856, 832, 1, 2048]
    - [62, 49.82]
  - - [1984, 832, 1, 2048]
    - [92, 49.88]
  - - [1088, 960, 1, 2048]
    - [52, 50.42]
  - - [1216, 960, 1, 2048]
    - [52, 49.54]
  - - [1344, 960, 1, 2048]
    - [52, 49.45]
  - - [1472, 960, 1, 2048]
    - [120, 53.78]
  - - [1600, 960, 1, 2048]
    - [155, 49.67]
  - - [1728, 960, 1, 2048]
    - [86, 51.7]
  - - [1856, 960, 1, 2048]
    - [119, 54.38]
  - - [1984, 960, 1, 2048]
    - [117, 57.11]
  - - [64, 1088, 1, 2048]
    - [374, 9.99]
  - - [192, 1088, 1, 2048]
    - [89, 22.92]
  - - [320, 1088, 1, 2048]
    - [83, 30.2]
  - - [448, 1088, 1, 2048]
    - [86, 38.55]
  - - [576, 1088, 1, 2048]
    - [231, 42.56]
  - - [704, 1088, 1, 2048]
    - [86, 43.16]
  - - [832, 1088, 1, 2048]
    - [52, 48.08]
  - - [960, 1088, 1, 2048]
    - [52, 48.62]
  - - [1088, 1088, 1, 2048]
    - [375, 48.45]
  - - [1216, 1088, 1, 2048]
    - [52, 50.38]
  - - [1344, 1088, 1, 2048]
    - [52, 50.91]
  - - [1472, 1088, 1, 2048]
    - [86, 50.45]
  - - [1600, 1088, 1, 2048]
    - [271, 52.16]
  - - [1728, 1088, 1, 2048]
    - [119, 56.23]
  - - [1856, 1088, 1, 2048]
    - [149, 53.52]
  - - [1984, 1088, 1, 2048]
    - [22, 55.09]
  - - [64, 1216, 1, 2048]
    - [94, 10.67]
  - - [192, 1216, 1, 2048]
    - [89, 26.31]
  - - [320, 1216, 1, 2048]
    - [86, 33.33]
  - - [448, 1216, 1, 2048]
    - [86, 37.37]
  - - [576, 1216, 1, 2048]
    - [86, 44.42]
  - - [704, 1216, 1, 2048]
    - [53, 44.64]
  - - [832, 1216, 1, 2048]
    - [63, 44.92]
  - - [960, 1216, 1, 2048]
    - [87, 46.91]
  - - [1088, 1216, 1, 2048]
    - [120, 49.19]
  - - [1216, 1216, 1, 2048]
    - [51, 50.96]
  - - [1344, 1216, 1, 2048]
    - [86, 50.91]
  - - [1472, 1216, 1, 2048]
    - [118, 54.7]
  - - [1600, 1216, 1, 2048]
    - [51, 53.88]
  - - [1728, 1216, 1, 2048]
    - [86, 54.82]
  - - [1856, 1216, 1, 2048]
    - [20, 58.21]
  - - [1984, 1216, 1, 2048]
    - [124, 59.59]
  - - [64, 1344, 1, 2048]
    - [161, 11.79]
  - - [192, 1344, 1, 2048]
    - [89, 28.11]
  - - [320, 1344, 1, 2048]
    - [86, 35.46]
  - - [448, 1344, 1, 2048]
    - [86, 39.23]
  - - [576, 1344, 1, 2048]
    - [52, 42.82]
  - - [704, 1344, 1, 2048]
    - [86, 46.98]
  - - [832, 1344, 1, 2048]
    - [52, 47.2]
  - - [960, 1344, 1, 2048]
    - [91, 48.22]
  - - [1088, 1344, 1, 2048]
    - [51, 50.72]
  - - [1216, 1344, 1, 2048]
    - [86, 51.7]
  - - [1344, 1344, 1, 2048]
    - [118, 54.92]
  - - [1472, 1344, 1, 2048]
    - [86, 54.69]
  - - [1600, 1344, 1, 2048]
    - [22, 55.42]
  - - [1728, 1344, 1, 2048]
    - [19, 58.18]
  - - [1856, 1344, 1, 2048]
    - [86, 56.72]
  - - [1984, 1344, 1, 2048]
    - [86, 56.33]
  - - [64, 1472, 1, 2048]
    - [99, 12.35]
  - - [192, 1472, 1, 2048]
    - [61, 26.93]
  - - [320, 1472, 1, 2048]
    - [86, 39.38]
  - - [448, 1472, 1, 2048]
    - [86, 41.31]
  - - [576, 1472, 1, 2048]
    - [87, 43.6]
  - - [704, 1472, 1, 2048]
    - [52, 46.11]
  - - [832, 1472, 1, 2048]
    - [86, 49.75]
  - - [960, 1472, 1, 2048]
    - [120, 52.85]
  - - [1088, 1472, 1, 2048]
    - [107, 49.99]
  - - [1216, 1472, 1, 2048]
    - [117, 54.71]
  - - [1344, 1472, 1, 2048]
    - [86, 54.73]
  - - [1472, 1472, 1, 2048]
    - [20, 55.16]
  - - [1600, 1472, 1, 2048]
    - [124, 58.88]
  - - [1728, 1472, 1, 2048]
    - [86, 56.38]
  - - [1856, 1472, 1, 2048]
    - [86, 57.33]
  - - [1984, 1472, 1, 2048]
    - [130, 59.49]
  - - [64, 1600, 1, 2048]
    - [228, 13.87]
  - - [192, 1600, 1, 2048]
    - [89, 29.09]
  - - [320, 1600, 1, 2048]
    - [155, 36.61]
  - - [448, 1600, 1, 2048]
    - [86, 45.05]
  - - [576, 1600, 1, 2048]
    - [269, 45.1]
  - - [704, 1600, 1, 2048]
    - [86, 47.71]
  - - [832, 1600, 1, 2048]
    - [0, 49.51]
  - - [960, 1600, 1, 2048]
    - [91, 50.28]
  - - [1088, 1600, 1, 2048]
    - [276, 50.5]
  - - [1216, 1600, 1, 2048]
    - [86, 53.46]
  - - [1344, 1600, 1, 2048]
    - [86, 55.04]
  - - [1472, 1600, 1, 2048]
    - [20, 59.57]
  - - [1600, 1600, 1, 2048]
    - [273, 52.4]
  - - [1728, 1600, 1, 2048]
    - [87, 57.33]
  - - [1856, 1600, 1, 2048]
    - [86, 58.39]
  - - [1984, 1600, 1, 2048]
    - [17, 60.57]
  - - [64, 1728, 1, 2048]
    - [89, 14.73]
  - - [192, 1728, 1, 2048]
    - [89, 30.14]
  - - [320, 1728, 1, 2048]
    - [86, 37.94]
  - - [448, 1728, 1, 2048]
    - [87, 40.59]
  - - [576, 1728, 1, 2048]
    - [87, 47.34]
  - - [704, 1728, 1, 2048]
    - [86, 48.47]
  - - [832, 1728, 1, 2048]
    - [51, 49.61]
  - - [960, 1728, 1, 2048]
    - [51, 50.68]
  - - [1088, 1728, 1, 2048]
    - [131, 56.97]
  - - [1216, 1728, 1, 2048]
    - [19, 53.9]
  - - [1344, 1728, 1, 2048]
    - [20, 58.68]
  - - [1472, 1728, 1, 2048]
    - [87, 57.23]
  - - [1600, 1728, 1, 2048]
    - [86, 59.01]
  - - [1728, 1728, 1, 2048]
    - [87, 58.56]
  - - [1856, 1728, 1, 2048]
    - [20, 60.91]
  - - [1984, 1728, 1, 2048]
    - [18, 62.92]
  - - [64, 1856, 1, 2048]
    - [89, 15.56]
  - - [192, 1856, 1, 2048]
    - [107, 31.02]
  - - [320, 1856, 1, 2048]
    - [86, 39.03]
  - - [448, 1856, 1, 2048]
    - [86, 41.8]
  - - [576, 1856, 1, 2048]
    - [87, 44.84]
  - - [704, 1856, 1, 2048]
    - [91, 48.37]
  - - [832, 1856, 1, 2048]
    - [91, 50.46]
  - - [960, 1856, 1, 2048]
    - [183, 53.92]
  - - [1088, 1856, 1, 2048]
    - [22, 52.89]
  - - [1216, 1856, 1, 2048]
    - [19, 56.79]
  - - [1344, 1856, 1, 2048]
    - [86, 58.03]
  - - [1472, 1856, 1, 2048]
    - [86, 56.88]
  - - [1600, 1856, 1, 2048]
    - [86, 58.92]
  - - [1728, 1856, 1, 2048]
    - [126, 60.28]
  - - [1856, 1856, 1, 2048]
    - [20, 59.88]
  - - [1984, 1856, 1, 2048]
    - [20, 63.93]
  - - [64, 1984, 1, 2048]
    - [153, 15.77]
  - - [192, 1984, 1, 2048]
    - [107, 33.62]
  - - [320, 1984, 1, 2048]
    - [86, 41.21]
  - - [448, 1984, 1, 2048]
    - [86, 44.89]
  - - [576, 1984, 1, 2048]
    - [52, 49.57]
  - - [704, 1984, 1, 2048]
    - [0, 50.71]
  - - [832, 1984, 1, 2048]
    - [51, 51.46]
  - - [960, 1984, 1, 2048]
    - [117, 57.48]
  - - [1088, 1984, 1, 2048]
    - [131, 54.27]
  - - [1216, 1984, 1, 2048]
    - [124, 59.65]
  - - [1344, 1984, 1, 2048]
    - [86, 57.07]
  - - [1472, 1984, 1, 2048]
    - [129, 59.47]
  - - [1600, 1984, 1, 2048]
    - [16, 60.84]
  - - [1728, 1984, 1, 2048]
    - [17, 63.34]
  - - [1856, 1984, 1, 2048]
    - [20, 63.99]
  - - [1984, 1984, 1, 2048]
    - [22, 65.53]
  - - [1088, 64, 1, 4096]
    - [89, 13.74]
  - - [1216, 64, 1, 4096]
    - [89, 15.1]
  - - [1344, 64, 1, 4096]
    - [89, 16.88]
  - - [1472, 64, 1, 4096]
    - [89, 17.87]
  - - [1600, 64, 1, 4096]
    - [89, 19.83]
  - - [1728, 64, 1, 4096]
    - [89, 21.39]
  - - [1856, 64, 1, 4096]
    - [89, 22.54]
  - - [1984, 64, 1, 4096]
    - [89, 22.79]
  - - [1088, 192, 1, 4096]
    - [90, 30.54]
  - - [1216, 192, 1, 4096]
    - [91, 33.19]
  - - [1344, 192, 1, 4096]
    - [91, 35.45]
  - - [1472, 192, 1, 4096]
    - [60, 33.42]
  - - [1600, 192, 1, 4096]
    - [89, 35.23]
  - - [1728, 192, 1, 4096]
    - [87, 37.26]
  - - [1856, 192, 1, 4096]
    - [91, 40.2]
  - - [1984, 192, 1, 4096]
    - [91, 42.4]
  - - [1088, 320, 1, 4096]
    - [91, 39.01]
  - - [1216, 320, 1, 4096]
    - [62, 42.87]
  - - [1344, 320, 1, 4096]
    - [149, 44.08]
  - - [1472, 320, 1, 4096]
    - [91, 43.29]
  - - [1600, 320, 1, 4096]
    - [91, 47.1]
  - - [1728, 320, 1, 4096]
    - [87, 43.84]
  - - [1856, 320, 1, 4096]
    - [87, 46.69]
  - - [1984, 320, 1, 4096]
    - [87, 47.92]
  - - [1088, 448, 1, 4096]
    - [149, 45.55]
  - - [1216, 448, 1, 4096]
    - [87, 46.18]
  - - [1344, 448, 1, 4096]
    - [152, 46.98]
  - - [1472, 448, 1, 4096]
    - [87, 52.5]
  - - [1600, 448, 1, 4096]
    - [86, 49.54]
  - - [1728, 448, 1, 4096]
    - [92, 50.59]
  - - [1856, 448, 1, 4096]
    - [121, 52.01]
  - - [1984, 448, 1, 4096]
    - [86, 55.37]
  - - [1088, 576, 1, 4096]
    - [91, 49.67]
  - - [1216, 576, 1, 4096]
    - [86, 52.01]
  - - [1344, 576, 1, 4096]
    - [91, 52.4]
  - - [1472, 576, 1, 4096]
    - [121, 54.51]
  - - [1600, 576, 1, 4096]
    - [86, 55.26]
  - - [1728, 576, 1, 4096]
    - [37, 55.68]
  - - [1856, 576, 1, 4096]
    - [86, 54.59]
  - - [1984, 576, 1, 4096]
    - [86, 57.81]
  - - [1088, 704, 1, 4096]
    - [91, 49.45]
  - - [1216, 704, 1, 4096]
    - [128, 54.21]
  - - [1344, 704, 1, 4096]
    - [136, 56.64]
  - - [1472, 704, 1, 4096]
    - [91, 56.2]
  - - [1600, 704, 1, 4096]
    - [91, 55.83]
  - - [1728, 704, 1, 4096]
    - [149, 56.86]
  - - [1856, 704, 1, 4096]
    - [91, 57.88]
  - - [1984, 704, 1, 4096]
    - [117, 60.14]
  - - [1088, 832, 1, 4096]
    - [128, 57.73]
  - - [1216, 832, 1, 4096]
    - [91, 55.15]
  - - [1344, 832, 1, 4096]
    - [91, 54.81]
  - - [1472, 832, 1, 4096]
    - [91, 56.04]
  - - [1600, 832, 1, 4096]
    - [20, 59.43]
  - - [1728, 832, 1, 4096]
    - [155, 57.95]
  - - [1856, 832, 1, 4096]
    - [91, 58.9]
  - - [1984, 832, 1, 4096]
    - [91, 59.69]
  - - [1088, 960, 1, 4096]
    - [86, 56.78]
  - - [1216, 960, 1, 4096]
    - [86, 56.92]
  - - [1344, 960, 1, 4096]
    - [120, 59.48]
  - - [1472, 960, 1, 4096]
    - [116, 64.07]
  - - [1600, 960, 1, 4096]
    - [155, 58.97]
  - - [1728, 960, 1, 4096]
    - [117, 61.36]
  - - [1856, 960, 1, 4096]
    - [119, 65.18]
  - - [1984, 960, 1, 4096]
    - [119, 69.65]
  - - [64, 1088, 1, 4096]
    - [161, 15.24]
  - - [192, 1088, 1, 4096]
    - [87, 31.11]
  - - [320, 1088, 1, 4096]
    - [91, 39.86]
  - - [448, 1088, 1, 4096]
    - [87, 50.99]
  - - [576, 1088, 1, 4096]
    - [86, 52.02]
  - - [704, 1088, 1, 4096]
    - [52, 52.53]
  - - [832, 1088, 1, 4096]
    - [86, 56.91]
  - - [960, 1088, 1, 4096]
    - [86, 58.21]
  - - [1088, 1088, 1, 4096]
    - [86, 58.59]
  - - [1216, 1088, 1, 4096]
    - [20, 58.66]
  - - [1344, 1088, 1, 4096]
    - [51, 59.38]
  - - [1472, 1088, 1, 4096]
    - [119, 60.18]
  - - [1600, 1088, 1, 4096]
    - [117, 62.48]
  - - [1728, 1088, 1, 4096]
    - [117, 68.34]
  - - [1856, 1088, 1, 4096]
    - [19, 61.34]
  - - [1984, 1088, 1, 4096]
    - [19, 65.43]
  - - [64, 1216, 1, 4096]
    - [100, 16.44]
  - - [192, 1216, 1, 4096]
    - [87, 34.02]
  - - [320, 1216, 1, 4096]
    - [62, 44.11]
  - - [448, 1216, 1, 4096]
    - [87, 46.56]
  - - [576, 1216, 1, 4096]
    - [87, 54.72]
  - - [704, 1216, 1, 4096]
    - [86, 54.04]
  - - [832, 1216, 1, 4096]
    - [86, 55.82]
  - - [960, 1216, 1, 4096]
    - [155, 56.82]
  - - [1088, 1216, 1, 4096]
    - [0, 58.92]
  - - [1216, 1216, 1, 4096]
    - [51, 59.56]
  - - [1344, 1216, 1, 4096]
    - [117, 61.31]
  - - [1472, 1216, 1, 4096]
    - [118, 66.01]
  - - [1600, 1216, 1, 4096]
    - [206, 59.17]
  - - [1728, 1216, 1, 4096]
    - [19, 63.71]
  - - [1856, 1216, 1, 4096]
    - [22, 67.81]
  - - [1984, 1216, 1, 4096]
    - [124, 70.47]
  - - [64, 1344, 1, 4096]
    - [94, 18.13]
  - - [192, 1344, 1, 4096]
    - [89, 36.18]
  - - [320, 1344, 1, 4096]
    - [87, 45.5]
  - - [448, 1344, 1, 4096]
    - [86, 49.83]
  - - [576, 1344, 1, 4096]
    - [91, 52.35]
  - - [704, 1344, 1, 4096]
    - [86, 58.45]
  - - [832, 1344, 1, 4096]
    - [86, 56.87]
  - - [960, 1344, 1, 4096]
    - [20, 59.27]
  - - [1088, 1344, 1, 4096]
    - [12, 56.38]
  - - [1216, 1344, 1, 4096]
    - [117, 61.25]
  - - [1344, 1344, 1, 4096]
    - [118, 66.25]
  - - [1472, 1344, 1, 4096]
    - [87, 59.93]
  - - [1600, 1344, 1, 4096]
    - [124, 63.78]
  - - [1728, 1344, 1, 4096]
    - [22, 68.37]
  - - [1856, 1344, 1, 4096]
    - [87, 64.75]
  - - [1984, 1344, 1, 4096]
    - [21, 62.46]
  - - [64, 1472, 1, 4096]
    - [100, 19.62]
  - - [192, 1472, 1, 4096]
    - [61, 35.2]
  - - [320, 1472, 1, 4096]
    - [53, 47.55]
  - - [448, 1472, 1, 4096]
    - [87, 51.75]
  - - [576, 1472, 1, 4096]
    - [86, 54.68]
  - - [704, 1472, 1, 4096]
    - [86, 58.03]
  - - [832, 1472, 1, 4096]
    - [22, 57.7]
  - - [960, 1472, 1, 4096]
    - [116, 63.17]
  - - [1088, 1472, 1, 4096]
    - [118, 59.17]
  - - [1216, 1472, 1, 4096]
    - [118, 66.31]
  - - [1344, 1472, 1, 4096]
    - [149, 61.06]
  - - [1472, 1472, 1, 4096]
    - [124, 64.12]
  - - [1600, 1472, 1, 4096]
    - [131, 69.05]
  - - [1728, 1472, 1, 4096]
    - [87, 63.32]
  - - [1856, 1472, 1, 4096]
    - [124, 63.09]
  - - [1984, 1472, 1, 4096]
    - [129, 67.24]
  - - [64, 1600, 1, 4096]
    - [89, 20.62]
  - - [192, 1600, 1, 4096]
    - [89, 37.7]
  - - [320, 1600, 1, 4096]
    - [62, 47.91]
  - - [448, 1600, 1, 4096]
    - [87, 56.61]
  - - [576, 1600, 1, 4096]
    - [86, 58.25]
  - - [704, 1600, 1, 4096]
    - [86, 58.92]
  - - [832, 1600, 1, 4096]
    - [20, 61.04]
  - - [960, 1600, 1, 4096]
    - [92, 58.79]
  - - [1088, 1600, 1, 4096]
    - [118, 64.22]
  - - [1216, 1600, 1, 4096]
    - [149, 60.11]
  - - [1344, 1600, 1, 4096]
    - [22, 65.18]
  - - [1472, 1600, 1, 4096]
    - [131, 69.36]
  - - [1600, 1600, 1, 4096]
    - [87, 62.87]
  - - [1728, 1600, 1, 4096]
    - [130, 64.55]
  - - [1856, 1600, 1, 4096]
    - [124, 64.57]
  - - [1984, 1600, 1, 4096]
    - [125, 67.7]
  - - [64, 1728, 1, 4096]
    - [90, 20.87]
  - - [192, 1728, 1, 4096]
    - [89, 38.08]
  - - [320, 1728, 1, 4096]
    - [53, 46.19]
  - - [448, 1728, 1, 4096]
    - [86, 52.52]
  - - [576, 1728, 1, 4096]
    - [86, 60.43]
  - - [704, 1728, 1, 4096]
    - [86, 60.9]
  - - [832, 1728, 1, 4096]
    - [92, 58.79]
  - - [960, 1728, 1, 4096]
    - [186, 62.0]
  - - [1088, 1728, 1, 4096]
    - [117, 67.85]
  - - [1216, 1728, 1, 4096]
    - [22, 61.76]
  - - [1344, 1728, 1, 4096]
    - [131, 68.48]
  - - [1472, 1728, 1, 4096]
    - [86, 63.33]
  - - [1600, 1728, 1, 4096]
    - [21, 63.78]
  - - [1728, 1728, 1, 4096]
    - [125, 64.52]
  - - [1856, 1728, 1, 4096]
    - [125, 68.8]
  - - [1984, 1728, 1, 4096]
    - [124, 72.19]
  - - [64, 1856, 1, 4096]
    - [89, 23.06]
  - - [192, 1856, 1, 4096]
    - [62, 40.13]
  - - [320, 1856, 1, 4096]
    - [86, 50.25]
  - - [448, 1856, 1, 4096]
    - [86, 53.6]
  - - [576, 1856, 1, 4096]
    - [86, 56.72]
  - - [704, 1856, 1, 4096]
    - [20, 59.33]
  - - [832, 1856, 1, 4096]
    - [92, 57.96]
  - - [960, 1856, 1, 4096]
    - [117, 66.16]
  - - [1088, 1856, 1, 4096]
    - [131, 61.03]
  - - [1216, 1856, 1, 4096]
    - [125, 65.28]
  - - [1344, 1856, 1, 4096]
    - [87, 66.13]
  - - [1472, 1856, 1, 4096]
    - [129, 62.98]
  - - [1600, 1856, 1, 4096]
    - [124, 64.45]
  - - [1728, 1856, 1, 4096]
    - [125, 68.15]
  - - [1856, 1856, 1, 4096]
    - [16, 66.81]
  - - [1984, 1856, 1, 4096]
    - [18, 68.77]
  - - [64, 1984, 1, 4096]
    - [90, 23.9]
  - - [192, 1984, 1, 4096]
    - [62, 42.63]
  - - [320, 1984, 1, 4096]
    - [86, 51.49]
  - - [448, 1984, 1, 4096]
    - [20, 57.05]
  - - [576, 1984, 1, 4096]
    - [86, 56.92]
  - - [704, 1984, 1, 4096]
    - [127, 61.0]
  - - [832, 1984, 1, 4096]
    - [117, 61.99]
  - - [960, 1984, 1, 4096]
    - [126, 69.71]
  - - [1088, 1984, 1, 4096]
    - [131, 64.77]
  - - [1216, 1984, 1, 4096]
    - [124, 70.48]
  - - [1344, 1984, 1, 4096]
    - [86, 63.07]
  - - [1472, 1984, 1, 4096]
    - [124, 66.51]
  - - [1600, 1984, 1, 4096]
    - [126, 67.45]
  - - [1728, 1984, 1, 4096]
    - [124, 72.49]
  - - [1856, 1984, 1, 4096]
    - [19, 69.37]
  - - [1984, 1984, 1, 4096]
    - [18, 72.23]
  - - [2048, 2048, 1, 2048]
    - [20, 78.97]
  - - [3072, 3072, 1, 3072]
    - [20, 86.61]
  - - [4096, 4096, 1, 4096]
    - [20, 89.92]
  - - [4096, 64, 1, 64]
    - [60, 1.45]
  - - [4096, 320, 1, 64]
    - [187, 5.37]
  - - [4096, 576, 1, 64]
    - [188, 8.15]
  - - [4096, 832, 1, 64]
    - [189, 9.45]
  - - [4096, 1088, 1, 64]
    - [190, 10.47]
  - - [4096, 1344, 1, 64]
    - [188, 11.3]
  - - [4096, 1600, 1, 64]
    - [188, 12.17]
  - - [4096, 1856, 1, 64]
    - [188, 12.86]
  - - [4096, 2112, 1, 64]
    - [188, 13.18]
  - - [4096, 2368, 1, 64]
    - [188, 13.83]
  - - [4096, 2624, 1, 64]
    - [188, 14.15]
  - - [4096, 2880, 1, 64]
    - [123, 14.41]
  - - [4096, 3136, 1, 64]
    - [188, 14.63]
  - - [4096, 3392, 1, 64]
    - [188, 14.94]
  - - [4096, 3648, 1, 64]
    - [188, 14.97]
  - - [4096, 3904, 1, 64]
    - [188, 15.21]
  - - [4096, 64, 1, 256]
    - [79, 5.25]
  - - [4096, 320, 1, 256]
    - [0, 17.82]
  - - [4096, 576, 1, 256]
    - [117, 23.99]
  - - [4096, 832, 1, 256]
    - [17, 27.34]
  - - [4096, 1088, 1, 256]
    - [119, 30.63]
  - - [4096, 1344, 1, 256]
    - [20, 32.39]
  - - [4096, 1600, 1, 256]
    - [117, 34.24]
  - - [4096, 1856, 1, 256]
    - [117, 35.36]
  - - [4096, 2112, 1, 256]
    - [117, 36.86]
  - - [4096, 2368, 1, 256]
    - [117, 37.82]
  - - [4096, 2624, 1, 256]
    - [117, 38.72]
  - - [4096, 2880, 1, 256]
    - [117, 38.95]
  - - [4096, 3136, 1, 256]
    - [119, 39.74]
  - - [4096, 3392, 1, 256]
    - [118, 40.38]
  - - [4096, 3648, 1, 256]
    - [124, 40.88]
  - - [4096, 3904, 1, 256]
    - [117, 41.44]
  - - [4096, 64, 1, 512]
    - [60, 10.16]
  - - [4096, 320, 1, 512]
    - [181, 28.55]
  - - [4096, 576, 1, 512]
    - [19, 37.23]
  - - [4096, 832, 1, 512]
    - [181, 42.39]
  - - [4096, 1088, 1, 512]
    - [117, 45.54]
  - - [4096, 1344, 1, 512]
    - [181, 47.36]
  - - [4096, 1600, 1, 512]
    - [117, 50.42]
  - - [4096, 1856, 1, 512]
    - [117, 52.1]
  - - [4096, 2112, 1, 512]
    - [124, 53.62]
  - - [4096, 2368, 1, 512]
    - [117, 54.55]
  - - [4096, 2624, 1, 512]
    - [117, 55.26]
  - - [4096, 2880, 1, 512]
    - [117, 56.48]
  - - [4096, 3136, 1, 512]
    - [118, 56.57]
  - - [4096, 3392, 1, 512]
    - [117, 58.21]
  - - [4096, 3648, 1, 512]
    - [125, 58.13]
  - - [4096, 3904, 1, 512]
    - [124, 58.45]
  - - [4096, 64, 1, 1024]
    - [191, 16.93]
  - - [4096, 320, 1, 1024]
    - [181, 43.04]
  - - [4096, 576, 1, 1024]
    - [20, 52.0]
  - - [4096, 832, 1, 1024]
    - [125, 55.53]
  - - [4096, 1088, 1, 1024]
    - [125, 60.78]
  - - [4096, 1344, 1, 1024]
    - [181, 62.37]
  - - [4096, 1600, 1, 1024]
    - [181, 66.58]
  - - [4096, 1856, 1, 1024]
    - [20, 67.59]
  - - [4096, 2112, 1, 1024]
    - [181, 69.41]
  - - [4096, 2368, 1, 1024]
    - [181, 70.44]
  - - [4096, 2624, 1, 1024]
    - [181, 72.6]
  - - [4096, 2880, 1, 1024]
    - [124, 71.7]
  - - [4096, 3136, 1, 1024]
    - [181, 72.21]
  - - [4096, 3392, 1, 1024]
    - [20, 73.47]
  - - [4096, 3648, 1, 1024]
    - [17, 72.98]
  - - [4096, 3904, 1, 1024]
    - [19, 75.31]
  - - [4096, 64, 1, 2048]
    - [78, 26.54]
  - - [4096, 320, 1, 2048]
    - [19, 55.83]
  - - [4096, 576, 1, 2048]
    - [19, 67.28]
  - - [4096, 832, 1, 2048]
    - [20, 69.32]
  - - [4096, 1088, 1, 2048]
    - [20, 73.52]
  - - [4096, 1344, 1, 2048]
    - [20, 76.81]
  - - [4096, 1600, 1, 2048]
    - [19, 78.59]
  - - [4096, 1856, 1, 2048]
    - [19, 79.27]
  - - [4096, 2112, 1, 2048]
    - [20, 80.66]
  - - [4096, 2368, 1, 2048]
    - [16, 80.89]
  - - [4096, 2624, 1, 2048]
    - [19, 81.82]
  - - [4096, 2880, 1, 2048]
    - [17, 82.01]
  - - [4096, 3136, 1, 2048]
    - [19, 82.44]
  - - [4096, 3392, 1, 2048]
    - [20, 83.52]
  - - [4096, 3648, 1, 2048]
    - [22, 81.5]
  - - [4096, 3904, 1, 2048]
    - [20, 84.31]
  - - [4096, 64, 1, 4096]
    - [79, 36.38]
  - - [4096, 320, 1, 4096]
    - [19, 68.5]
  - - [4096, 576, 1, 4096]
    - [17, 75.72]
  - - [4096, 832, 1, 4096]
    - [192, 75.85]
  - - [4096, 1088, 1, 4096]
    - [19, 79.97]
  - - [4096, 1344, 1, 4096]
    - [20, 84.79]
  - - [4096, 1600, 1, 4096]
    - [20, 84.64]
  - - [4096, 1856, 1, 4096]
    - [20, 83.46]
  - - [4096, 2112, 1, 4096]
    - [20, 86.5]
  - - [4096, 2368, 1, 4096]
    - [22, 83.37]
  - - [4096, 2624, 1, 4096]
    - [16, 82.83]
  - - [4096, 2880, 1, 4096]
    - [19, 88.83]
  - - [4096, 3136, 1, 4096]
    - [20, 88.65]
  - - [4096, 3392, 1, 4096]
    - [128, 87.61]
  - - [4096, 3648, 1, 4096]
    - [20, 86.93]
  - - [4096, 3904, 1, 4096]
    - [19, 86.63]
  - - [64, 4096, 1, 64]
    - [61, 1.53]
  - - [320, 4096, 1, 64]
    - [48, 5.67]
  - - [576, 4096, 1, 64]
    - [52, 7.52]
  - - [832, 4096, 1, 64]
    - [46, 8.87]
  - - [1088, 4096, 1, 64]
    - [53, 9.77]
  - - [1344, 4096, 1, 64]
    - [7, 10.64]
  - - [1600, 4096, 1, 64]
    - [48, 11.12]
  - - [1856, 4096, 1, 64]
    - [15, 11.46]
  - - [2112, 4096, 1, 64]
    - [52, 12.05]
  - - [2368, 4096, 1, 64]
    - [9, 12.24]
  - - [2624, 4096, 1, 64]
    - [9, 12.48]
  - - [2880, 4096, 1, 64]
    - [9, 12.66]
  - - [3136, 4096, 1, 64]
    - [7, 12.99]
  - - [3392, 4096, 1, 64]
    - [7, 13.11]
  - - [3648, 4096, 1, 64]
    - [52, 13.33]
