projects/hipblaslt/library/src/amd_detail/rocblaslt/src/Tensile/Logic/asm_full/gfx1201/GridBased/gfx1201_Cijk_Alik_Bjlk_I8II_BH_SHB_HA_S_SCD_SAV_UserArgs.yaml
- {MinimumRequiredVersion: 5.0.0}
- gfx1201
- gfx1201
- [Device 73f0]
    SolutionIndex: 0
    SolutionNameMin: Cijk_Alik_Bjlk_I8II_BH_HAI_SAV_UserArgs_MT64x16x32_MI16x16x1_SN_GSU1_GSUC0_GSUWGMRR0_K1_MIWT1_1_SU0_SUM1_SUS0_WGM8_WGMXCC1_WGMXCCGn1
    SolutionIndex: 1
    SolutionNameMin: Cijk_Alik_Bjlk_I8II_BH_HAI_SAV_UserArgs_MT256x16x64_MI16x16x1_SN_LDSB1_CLR1_GRVWA8_GRVWB8_GSU1_LBSPPA128_LBSPPB128_LPA8_MIWT4_1_PGR1_PLR1_SS1_SU32_SUM1_SUS256_SVW1_TLDS1_WG64_2_1_WGM8
    SolutionIndex: 2
    SolutionNameMin: Cijk_Alik_Bjlk_I8II_BH_HAI_SAV_UserArgs_MT32x64x64_MI16x16x1_SN_LDSB0_CLR1_GRVWA8_GRVWB16_GSU1_LBSPPA128_LBSPPB512_LPA8_MIWT2_1_PGR1_PLR1_SS1_SU32_SUM1_SUS256_SVW1_TLDS1_WG16_8_1_WGM8
    SolutionIndex: 3
    SolutionNameMin: Cijk_Alik_Bjlk_I8II_BH_HAI_SAV_UserArgs_MT256x16x64_MI16x16x1_SN_LDSB1_CLR1_GRVWA8_GRVWB8_GSU1_LBSPPA128_LBSPPB128_LPA8_MIWT4_1_PGR2_PLR1_SS1_SU32_SUM1_SUS256_SVW1_TLDS1_WG64_2_1_WGM8
    SolutionIndex: 4
    SolutionNameMin: Cijk_Alik_Bjlk_I8II_BH_HAI_SAV_UserArgs_MT256x16x64_MI16x16x1_SN_LDSB1_CLR1_GRVWA8_GRVWB8_GSU1_LBSPPA128_LBSPPB128_LPA8_MIWT4_1_PGR1_PLR1_SS0_SU32_SUM1_SUS256_SVW8_TLDS1_WG64_2_1_WGM8
    SolutionIndex: 5
    SolutionNameMin: Cijk_Alik_Bjlk_I8II_BH_HAI_SAV_UserArgs_MT256x16x64_MI16x16x1_SN_LDSB1_CLR1_GRVWA8_GRVWB8_GSU1_LBSPPA128_LBSPPB128_LPA8_MIWT4_1_PGR1_PLR3_SS1_SU32_SUM1_SUS256_SVW1_TLDS1_WG64_2_1_WGM8
    SolutionIndex: 6
    SolutionNameMin: Cijk_Alik_Bjlk_I8II_BH_HAI_SAV_UserArgs_MT64x32x64_MI16x16x1_SN_LDSB0_CLR1_GRVWA8_GRVWB16_GSU1_LBSPPA128_LBSPPB256_LPA8_MIWT2_1_PGR1_PLR3_SS1_SU32_SUM1_SUS256_SVW1_TLDS1_WG32_4_1_WGM8
    SolutionIndex: 7
    SolutionNameMin: Cijk_Alik_Bjlk_I8II_BH_HAI_SAV_UserArgs_MT256x16x64_MI16x16x1_SN_LDSB1_CLR1_GRVWA8_GRVWB8_GSU1_LBSPPA128_LBSPPB128_LPA8_MIWT4_1_PGR2_PLR3_SS1_SU32_SUM1_SUS256_SVW1_TLDS1_WG64_2_1_WGM8
    SolutionIndex: 8
    SolutionNameMin: Cijk_Alik_Bjlk_I8II_BH_HAI_SAV_UserArgs_MT256x16x64_MI16x16x1_SN_LDSB1_CLR1_GRVWA8_GRVWB8_GSU1_LBSPPA128_LBSPPB128_LPA8_MIWT4_1_PGR2_PLR3_SS0_SU32_SUM1_SUS256_SVW8_TLDS1_WG64_2_1_WGM8
    SolutionIndex: 9
    SolutionNameMin: Cijk_Alik_Bjlk_I8II_BH_HAI_SAV_UserArgs_MT256x16x64_MI16x16x1_SN_LDSB1_CLR1_GRVWA8_GRVWB8_GSU1_LBSPPA128_LBSPPB128_LPA8_MIWT4_1_PGR2_PLR1_SS0_SU32_SUM1_SUS256_SVW8_TLDS1_WG64_2_1_WGM8
    SolutionIndex: 10
    SolutionNameMin: Cijk_Alik_Bjlk_I8II_BH_HAI_SAV_UserArgs_MT256x16x64_MI16x16x1_SN_LDSB1_CLR1_GRVWA8_GRVWB8_GSU1_LBSPPA128_LBSPPB128_LPA8_MIWT4_1_PGR1_PLR3_SS0_SU32_SUM1_SUS256_SVW8_TLDS1_WG64_2_1_WGM8
    SolutionIndex: 11
    SolutionNameMin: Cijk_Alik_Bjlk_I8II_BH_HAI_SAV_UserArgs_MT32x64x64_MI16x16x1_SN_LDSB0_CLR1_GRVWA8_GRVWB16_GSU1_LBSPPA128_LBSPPB512_LPA8_MIWT2_1_PGR1_PLR3_SS1_SU32_SUM1_SUS256_SVW1_TLDS1_WG16_8_1_WGM8
    SolutionIndex: 12
    SolutionNameMin: Cijk_Alik_Bjlk_I8II_BH_HAI_SAV_UserArgs_MT32x64x64_MI16x16x1_SN_LDSB0_CLR0_GRVWA8_GRVWB16_GSU1_LBSPPA128_LBSPPB512_LPA8_MIWT2_1_PGR2_PLR0_SS1_SU32_SUM1_SUS256_SVW1_TLDS1_WG16_8_1_WGM8
    SolutionIndex: 13
    SolutionNameMin: Cijk_Alik_Bjlk_I8II_BH_HAI_SAV_UserArgs_MT32x64x32_MI16x16x1_SN_LDSB0_CLR1_GRVWA8_GRVWB16_GSU1_LBSPPA128_LBSPPB512_LPA8_MIWT2_1_PGR1_PLR1_SS1_SU32_SUM1_SUS256_SVW1_TLDS1_WG16_8_1_WGM8
    SolutionIndex: 14
    SolutionNameMin: Cijk_Alik_Bjlk_I8II_BH_HAI_SAV_UserArgs_MT32x64x32_MI16x16x1_SN_LDSB0_CLR0_GRVWA8_GRVWB16_GSU1_LBSPPA128_LBSPPB512_LPA8_MIWT2_1_PGR1_PLR0_SS1_SU32_SUM1_SUS256_SVW1_TLDS1_WG16_8_1_WGM8
    SolutionIndex: 15
    SolutionNameMin: Cijk_Alik_Bjlk_I8II_BH_HAI_SAV_UserArgs_MT64x32x64_MI16x16x1_SN_LDSB0_CLR1_GRVWA8_GRVWB16_GSU1_LBSPPA128_LBSPPB256_LPA8_MIWT2_1_PGR1_PLR1_SS1_SU32_SUM1_SUS256_SVW1_TLDS1_WG32_4_1_WGM8
    SolutionIndex: 16
    SolutionNameMin: Cijk_Alik_Bjlk_I8II_BH_HAI_SAV_UserArgs_MT32x64x32_MI16x16x1_SN_LDSB0_CLR0_GRVWA8_GRVWB16_GSU1_LBSPPA128_LBSPPB512_LPA8_MIWT2_1_PGR2_PLR0_SS1_SU32_SUM1_SUS256_SVW1_TLDS1_WG16_8_1_WGM8
    SolutionIndex: 17
    SolutionNameMin: Cijk_Alik_Bjlk_I8II_BH_HAI_SAV_UserArgs_MT64x32x32_MI16x16x1_SN_LDSB0_CLR0_GRVWA8_GRVWB8_GSU1_LBSPPA128_LBSPPB256_LPA8_MIWT2_1_PGR1_PLR0_SS1_SU32_SUM1_SUS256_SVW1_TLDS1_WG32_4_1_WGM8
    SolutionIndex: 18
    SolutionNameMin: Cijk_Alik_Bjlk_I8II_BH_HAI_SAV_UserArgs_MT32x64x64_MI16x16x1_SN_LDSB0_CLR1_GRVWA8_GRVWB16_GSU1_LBSPPA128_LBSPPB512_LPA8_MIWT2_1_PGR1_PLR1_SS0_SU32_SUM1_SUS256_SVW8_TLDS1_WG16_8_1_WGM8
    SolutionIndex: 19
    SolutionNameMin: Cijk_Alik_Bjlk_I8II_BH_HAI_SAV_UserArgs_MT32x64x64_MI16x16x1_SN_LDSB0_CLR1_GRVWA8_GRVWB16_GSU1_LBSPPA128_LBSPPB512_LPA8_MIWT2_1_PGR1_PLR3_SS0_SU32_SUM1_SUS256_SVW8_TLDS1_WG16_8_1_WGM8
    SolutionIndex: 20
    SolutionNameMin: Cijk_Alik_Bjlk_I8II_BH_HAI_SAV_UserArgs_MT32x64x64_MI16x16x1_SN_LDSB0_CLR0_GRVWA8_GRVWB16_GSU1_LBSPPA128_LBSPPB512_LPA8_MIWT2_1_PGR1_PLR0_SS1_SU32_SUM1_SUS256_SVW1_TLDS1_WG16_8_1_WGM8
    SolutionIndex: 21
    SolutionNameMin: Cijk_Alik_Bjlk_I8II_BH_HAI_SAV_UserArgs_MT32x64x32_MI16x16x1_SN_LDSB0_CLR1_GRVWA8_GRVWB16_GSU1_LBSPPA128_LBSPPB512_LPA8_MIWT2_1_PGR2_PLR1_SS1_SU32_SUM1_SUS256_SVW1_TLDS1_WG16_8_1_WGM8
    SolutionIndex: 22
    SolutionNameMin: Cijk_Alik_Bjlk_I8II_BH_HAI_SAV_UserArgs_MT32x64x32_MI16x16x1_SN_LDSB0_CLR0_GRVWA8_GRVWB16_GSU1_LBSPPA128_LBSPPB512_LPA8_MIWT2_1_PGR2_PLR0_SS0_SU32_SUM1_SUS256_SVW8_TLDS1_WG16_8_1_WGM8
    SolutionIndex: 23
    SolutionNameMin: Cijk_Alik_Bjlk_I8II_BH_HAI_SAV_UserArgs_MT64x32x64_MI16x16x1_SN_LDSB0_CLR1_GRVWA8_GRVWB16_GSU1_LBSPPA128_LBSPPB256_LPA8_MIWT2_1_PGR1_PLR3_SS0_SU32_SUM1_SUS256_SVW8_TLDS1_WG32_4_1_WGM8
    SolutionIndex: 24
    SolutionNameMin: Cijk_Alik_Bjlk_I8II_BH_HAI_SAV_UserArgs_MT32x64x64_MI16x16x1_SN_LDSB0_CLR0_GRVWA8_GRVWB16_GSU1_LBSPPA128_LBSPPB512_LPA8_MIWT2_1_PGR1_PLR0_SS0_SU32_SUM1_SUS256_SVW8_TLDS1_WG16_8_1_WGM8
    SolutionIndex: 25
    SolutionNameMin: Cijk_Alik_Bjlk_I8II_BH_HAI_SAV_UserArgs_MT32x64x32_MI16x16x1_SN_LDSB0_CLR1_GRVWA8_GRVWB16_GSU1_LBSPPA128_LBSPPB512_LPA8_MIWT2_1_PGR1_PLR1_SS0_SU32_SUM1_SUS256_SVW8_TLDS1_WG16_8_1_WGM8
    SolutionIndex: 26
    SolutionNameMin: Cijk_Alik_Bjlk_I8II_BH_HAI_SAV_UserArgs_MT64x32x64_MI16x16x1_SN_LDSB0_CLR0_GRVWA8_GRVWB16_GSU1_LBSPPA128_LBSPPB256_LPA8_MIWT2_1_PGR1_PLR0_SS1_SU32_SUM1_SUS256_SVW1_TLDS1_WG32_4_1_WGM8
    SolutionIndex: 27
    SolutionNameMin: Cijk_Alik_Bjlk_I8II_BH_HAI_SAV_UserArgs_MT32x32x32_MI16x16x1_SN_LDSB0_CLR0_GRVWA8_GRVWB8_GSU1_LBSPPA128_LBSPPB256_LPA8_MIWT1_1_PGR2_PLR0_SS1_SU32_SUM1_SUS256_SVW1_TLDS1_WG32_4_1_WGM8
    SolutionIndex: 28
    SolutionNameMin: Cijk_Alik_Bjlk_I8II_BH_HAI_SAV_UserArgs_MT32x32x64_MI16x16x1_SN_LDSB0_CLR1_GRVWA8_GRVWB16_GSU1_LBSPPA128_LBSPPB256_LPA8_MIWT1_1_PGR1_PLR1_SS1_SU32_SUM1_SUS256_SVW1_TLDS1_WG32_4_1_WGM8
    SolutionIndex: 29
    SolutionNameMin: Cijk_Alik_Bjlk_I8II_BH_HAI_SAV_UserArgs_MT32x32x32_MI16x16x1_SN_LDSB0_CLR0_GRVWA8_GRVWB8_GSU1_LBSPPA128_LBSPPB256_LPA8_MIWT1_1_PGR1_PLR0_SS1_SU32_SUM1_SUS256_SVW1_TLDS1_WG32_4_1_WGM8
    SolutionIndex: 30
    SolutionNameMin: Cijk_Alik_Bjlk_I8II_BH_SHB_HA_S_SCD_SAV_UserArgs_MT16x32x64_MI16x16x1_SN_LDSB0_AFC1_AG0_AFEM1_AFEM1_ASEM1_CLR1_CADS0_DTLA0_DTLB0_DTVA0_DTVB1_DTVSM0_DPLBn1_EPS0_ELFLR0_EMLLn1_FDSI0_GRPM1_GRVWA8_GRVWB8_GSUn1_GSUAMB_GSUC0_GSUWGMRR0_GLS0_ISA1201_IU1_K1_LDSTI0_LBSPPA128_LBSPPB0_LBSPPM0_LPA8_LPB0_LPM0_LRVW8_LWPMn1_MIAV1_MIWT1_1_MO40_MGRIPMn1_NTn1_NTA0_NTB0_NTC0_NTD0_NTM0_NEPBS0_NLCA1_NLCB1_ONLL0_PGR2_PLR1_PKA0_SGROBn1_SIA3_SS0_SU32_SUM0_SUS256_SPO0_SRVW0_SSO0_SVW8_SK0_SKFTR0_SKXCCM0_SGRO0_TIN0_TLDS1_TLDSM1_ULSGRO0_USL1_UIOFGRO0_USFGROn1_VSn1_VWA1_VWB1_WSGRA0_WSGRB0_WS32_WG16_4_1_WGM8_WGMXCC1_WGMXCCGn1
    SolutionIndex: 31
    SolutionNameMin: Cijk_Alik_Bjlk_I8II_BH_SHB_HA_S_SCD_SAV_UserArgs_MT16x16x64_MI16x16x1_SN_LDSB0_AFC1_AG0_AFEM1_AFEM1_ASEM1_CLR1_CADS0_DTLA0_DTLB0_DTVA0_DTVB1_DTVSM0_DPLBn1_EPS0_ELFLR0_EMLLn1_FDSI0_GRPM1_GRVWA8_GRVWB8_GSUn1_GSUAMB_GSUC0_GSUWGMRR0_GLS0_ISA1201_IU1_K1_LDSTI0_LBSPPA128_LBSPPB0_LBSPPM0_LPA8_LPB0_LPM0_LRVW8_LWPMn1_MIAV1_MIWT1_1_MO40_MGRIPMn1_NTn1_NTA0_NTB0_NTC0_NTD0_NTM0_NEPBS0_NLCA1_NLCB1_ONLL0_PGR2_PLR1_PKA0_SGROBn1_SIA3_SS0_SU32_SUM0_SUS256_SPO0_SRVW0_SSO0_SVW8_SK0_SKFTR0_SKXCCM0_SGRO0_TIN0_TLDS1_TLDSM1_ULSGRO0_USL1_UIOFGRO0_USFGROn1_VSn1_VWA1_VWB1_WSGRA0_WSGRB0_WS32_WG16_2_1_WGM8_WGMXCC1_WGMXCCGn1
    SolutionIndex: 32
    SolutionNameMin: Cijk_Alik_Bjlk_I8II_BH_SHB_HA_S_SCD_SAV_UserArgs_MT32x16x64_MI16x16x1_SN_LDSB0_AFC1_AG0_AFEM1_AFEM1_ASEM1_CLR1_CADS0_DTLA0_DTLB0_DTVA0_DTVB1_DTVSM0_DPLBn1_EPS1_ELFLR0_EMLLn1_FDSI0_GRPM1_GRVWA8_GRVWB8_GSUn1_GSUAMB_GSUC0_GSUWGMRR0_GLS0_ISA1201_IU1_K1_LDSTI0_LBSPPA128_LBSPPB0_LBSPPM0_LPA8_LPB0_LPM0_LRVW8_LWPMn1_MIAV1_MIWT1_1_MO40_MGRIPMn1_NTn1_NTA0_NTB0_NTC0_NTD0_NTM0_NEPBS0_NLCA1_NLCB1_ONLL0_PGR1_PLR1_PKA0_SGROBn1_SIA3_SS1_SU32_SUM0_SUS256_SPO0_SRVW0_SSO0_SVW1_SK0_SKFTR0_SKXCCM0_SGRO0_TIN0_TLDS1_TLDSM1_ULSGRO0_USL1_UIOFGRO0_USFGROn1_VSn1_VWA1_VWB1_WSGRA0_WSGRB0_WS32_WG32_2_1_WGM8_WGMXCC1_WGMXCCGn1
    SolutionIndex: 33
    SolutionNameMin: Cijk_Alik_Bjlk_I8II_BH_SHB_HA_S_SCD_SAV_UserArgs_MT32x16x64_MI16x16x1_SN_LDSB0_AFC1_AG0_AFEM1_AFEM1_ASEM64_CLR1_CADS0_DTLA0_DTLB0_DTVA1_DTVB1_DTVSM0_DPLBn1_EPS0_ELFLR0_EMLLn1_FDSI0_GRPM1_GRVWA8_GRVWB8_GSUn1_GSUAMB_GSUC0_GSUWGMRR0_GLS0_ISA1201_IU1_K1_LDSTI0_LBSPPA0_LBSPPB0_LBSPPM0_LPA0_LPB0_LPM0_LRVW8_LWPMn1_MIAV1_MIWT1_1_MO40_MGRIPMn1_NTn1_NTA0_NTB0_NTC0_NTD0_NTM0_NEPBS0_NLCA4_NLCB1_ONLL0_PGR1_PLR0_PKA0_SGROBn1_SIA3_SS0_SU32_SUM0_SUS256_SPO0_SRVW0_SSO0_SVW8_SK0_SKFTR0_SKXCCM0_SGRO0_TIN0_TLDS1_TLDSM1_ULSGRO0_USL1_UIOFGRO0_USFGROn1_VSn1_VWA1_VWB1_WSGRA0_WSGRB0_WS32_WG32_2_1_WGM8_WGMXCC1_WGMXCCGn1
    SolutionIndex: 34
    SolutionNameMin: Cijk_Alik_Bjlk_I8II_BH_SHB_HA_S_SCD_SAV_UserArgs_MT16x32x64_MI16x16x1_SN_LDSB0_AFC1_AG0_AFEM1_AFEM1_ASEM64_CLR1_CADS0_DTLA0_DTLB0_DTVA1_DTVB1_DTVSM0_DPLBn1_EPS0_ELFLR0_EMLLn1_FDSI0_GRPM1_GRVWA8_GRVWB8_GSUn1_GSUAMB_GSUC0_GSUWGMRR0_GLS0_ISA1201_IU1_K1_LDSTI0_LBSPPA0_LBSPPB0_LBSPPM0_LPA0_LPB0_LPM0_LRVW8_LWPMn1_MIAV1_MIWT1_1_MO40_MGRIPMn1_NTn1_NTA0_NTB0_NTC0_NTD0_NTM0_NEPBS0_NLCA4_NLCB1_ONLL0_PGR1_PLR0_PKA0_SGROBn1_SIA3_SS0_SU32_SUM0_SUS256_SPO0_SRVW0_SSO0_SVW8_SK0_SKFTR0_SKXCCM0_SGRO0_TIN0_TLDS1_TLDSM1_ULSGRO0_USL1_UIOFGRO0_USFGROn1_VSn1_VWA1_VWB1_WSGRA0_WSGRB0_WS32_WG16_4_1_WGM8_WGMXCC1_WGMXCCGn1
    SolutionIndex: 35
    SolutionNameMin: Cijk_Alik_Bjlk_I8II_BH_SHB_HA_S_SCD_SAV_UserArgs_MT32x32x64_MI16x16x1_SN_LDSB0_AFC1_AG0_AFEM1_AFEM1_ASEM64_CLR1_CADS0_DTLA0_DTLB0_DTVA1_DTVB1_DTVSM0_DPLBn1_EPS0_ELFLR0_EMLLn1_FDSI0_GRPM1_GRVWA8_GRVWB8_GSUn1_GSUAMB_GSUC0_GSUWGMRR0_GLS0_ISA1201_IU1_K1_LDSTI0_LBSPPA0_LBSPPB0_LBSPPM0_LPA0_LPB0_LPM0_LRVW8_LWPMn1_MIAV1_MIWT1_1_MO40_MGRIPMn1_NTn1_NTA0_NTB0_NTC0_NTD0_NTM0_NEPBS0_NLCA4_NLCB1_ONLL0_PGR1_PLR0_PKA0_SGROBn1_SIA3_SS1_SU32_SUM0_SUS256_SPO0_SRVW0_SSO0_SVW1_SK0_SKFTR0_SKXCCM0_SGRO0_TIN0_TLDS1_TLDSM1_ULSGRO0_USL1_UIOFGRO0_USFGROn1_VSn1_VWA1_VWB1_WSGRA0_WSGRB0_WS32_WG32_4_1_WGM8_WGMXCC1_WGMXCCGn1
    SolutionIndex: 36
    SolutionNameMin: Cijk_Alik_Bjlk_I8II_BH_SHB_HA_S_SCD_SAV_UserArgs_MT32x32x64_MI16x16x1_SN_LDSB0_AFC1_AG0_AFEM1_AFEM1_ASEM64_CLR1_CADS0_DTLA0_DTLB0_DTVA1_DTVB1_DTVSM0_DPLBn1_EPS0_ELFLR0_EMLLn1_FDSI0_GRPM1_GRVWA8_GRVWB8_GSUn1_GSUAMB_GSUC0_GSUWGMRR0_GLS0_ISA1201_IU1_K1_LDSTI0_LBSPPA0_LBSPPB0_LBSPPM0_LPA0_LPB0_LPM0_LRVW8_LWPMn1_MIAV1_MIWT1_1_MO40_MGRIPMn1_NTn1_NTA0_NTB0_NTC0_NTD0_NTM0_NEPBS0_NLCA4_NLCB1_ONLL0_PGR1_PLR0_PKA0_SGROBn1_SIA3_SS0_SU32_SUM0_SUS256_SPO0_SRVW0_SSO0_SVW8_SK0_SKFTR0_SKXCCM0_SGRO0_TIN0_TLDS1_TLDSM1_ULSGRO0_USL1_UIOFGRO0_USFGROn1_VSn1_VWA1_VWB1_WSGRA0_WSGRB0_WS32_WG32_4_1_WGM8_WGMXCC1_WGMXCCGn1
    SolutionIndex: 37
    SolutionNameMin: Cijk_Alik_Bjlk_I8II_BH_SHB_HA_S_SCD_SAV_UserArgs_MT16x16x32_MI16x16x1_SN_LDSB0_AFC1_AG0_AFEM1_AFEM1_ASEM32_CLR1_CADS0_DTLA0_DTLB0_DTVA1_DTVB1_DTVSM0_DPLBn1_EPS0_ELFLR0_EMLLn1_FDSI0_GRPM1_GRVWA8_GRVWB8_GSUn1_GSUAMB_GSUC0_GSUWGMRR0_GLS0_ISA1201_IU1_K1_LDSTI0_LBSPPA0_LBSPPB0_LBSPPM0_LPA0_LPB0_LPM0_LRVW8_LWPMn1_MIAV1_MIWT1_1_MO40_MGRIPMn1_NTn1_NTA0_NTB0_NTC0_NTD0_NTM0_NEPBS0_NLCA2_NLCB1_ONLL0_PGR1_PLR0_PKA0_SGROBn1_SIA3_SS0_SU32_SUM0_SUS256_SPO0_SRVW0_SSO0_SVW8_SK0_SKFTR0_SKXCCM0_SGRO0_TIN0_TLDS1_TLDSM1_ULSGRO0_USL1_UIOFGRO0_USFGROn1_VSn1_VWA1_VWB1_WSGRA0_WSGRB0_WS32_WG16_2_1_WGM8_WGMXCC1_WGMXCCGn1
    SolutionIndex: 38
    SolutionNameMin: Cijk_Alik_Bjlk_I8II_BH_SHB_HA_S_SCD_SAV_UserArgs_MT64x64x64_MI16x16x1_SN_LDSB0_AFC1_AG0_AFEM1_AFEM1_ASEM1_CLR1_CADS0_DTLA0_DTLB0_DTVA0_DTVB1_DTVSM0_DPLBn1_EPS0_ELFLR0_EMLLn1_FDSI0_GRPM1_GRVWA8_GRVWB8_GSUn1_GSUAMB_GSUC0_GSUWGMRR0_GLS0_ISA1201_IU1_K1_LDSTI0_LBSPPA128_LBSPPB0_LBSPPM0_LPA8_LPB0_LPM0_LRVW8_LWPMn1_MIAV1_MIWT2_2_MO40_MGRIPMn1_NTn1_NTA0_NTB0_NTC0_NTD0_NTM0_NEPBS0_NLCA1_NLCB4_ONLL0_PGR2_PLR1_PKA0_SGROBn1_SIA3_SS0_SU32_SUM0_SUS256_SPO0_SRVW0_SSO0_SVW16_SK0_SKFTR0_SKXCCM0_SGRO0_TIN0_TLDS1_TLDSM1_ULSGRO0_USL1_UIOFGRO0_USFGROn1_VSn1_VWA2_VWB1_WSGRA0_WSGRB0_WS32_WG32_4_1_WGM8_WGMXCC1_WGMXCCGn1
    SolutionIndex: 39
    SolutionNameMin: Cijk_Alik_Bjlk_I8II_BH_SHB_HA_S_SCD_SAV_UserArgs_MT64x64x64_MI16x16x1_SN_LDSB0_AFC1_AG0_AFEM1_AFEM1_ASEM64_CLR1_CADS0_DTLA0_DTLB0_DTVA1_DTVB1_DTVSM0_DPLBn1_EPS0_ELFLR0_EMLLn1_FDSI0_GRPM1_GRVWA8_GRVWB8_GSUn1_GSUAMB_GSUC0_GSUWGMRR0_GLS0_ISA1201_IU1_K1_LDSTI0_LBSPPA0_LBSPPB0_LBSPPM0_LPA0_LPB0_LPM0_LRVW8_LWPMn1_MIAV1_MIWT2_2_MO40_MGRIPMn1_NTn1_NTA0_NTB0_NTC0_NTD0_NTM0_NEPBS0_NLCA4_NLCB4_ONLL0_PGR1_PLR0_PKA0_SGROBn1_SIA3_SS0_SU32_SUM0_SUS256_SPO0_SRVW0_SSO0_SVW16_SK0_SKFTR0_SKXCCM0_SGRO0_TIN0_TLDS1_TLDSM1_ULSGRO0_USL1_UIOFGRO0_USFGROn1_VSn1_VWA2_VWB1_WSGRA0_WSGRB0_WS32_WG32_4_1_WGM8_WGMXCC1_WGMXCCGn1
    SolutionIndex: 40
    SolutionNameMin: Cijk_Alik_Bjlk_I8II_BH_SHB_HA_S_SCD_SAV_UserArgs_MT16x32x64_MI16x16x1_SN_LDSB0_AFC1_AG0_AFEM1_AFEM1_ASEM64_CLR1_CADS0_DTLA0_DTLB0_DTVA1_DTVB1_DTVSM0_DPLBn1_EPS0_ELFLR0_EMLLn1_FDSI0_GRPM1_GRVWA8_GRVWB8_GSUn1_GSUAMB_GSUC0_GSUWGMRR0_GLS0_ISA1201_IU1_K1_LDSTI0_LBSPPA0_LBSPPB0_LBSPPM0_LPA0_LPB0_LPM0_LRVW8_LWPMn1_MIAV1_MIWT1_1_MO40_MGRIPMn1_NTn1_NTA0_NTB0_NTC0_NTD0_NTM0_NEPBS0_NLCA4_NLCB1_ONLL0_PGR1_PLR0_PKA0_SGROBn1_SIA3_SS1_SU32_SUM0_SUS256_SPO0_SRVW0_SSO0_SVW1_SK0_SKFTR0_SKXCCM0_SGRO0_TIN0_TLDS1_TLDSM1_ULSGRO0_USL1_UIOFGRO0_USFGROn1_VSn1_VWA1_VWB1_WSGRA0_WSGRB0_WS32_WG16_4_1_WGM8_WGMXCC1_WGMXCCGn1
    SolutionIndex: 41
    SolutionNameMin: Cijk_Alik_Bjlk_I8II_BH_SHB_HA_S_SCD_SAV_UserArgs_MT32x32x64_MI16x16x1_SN_LDSB0_AFC1_AG0_AFEM1_AFEM1_ASEM1_CLR1_CADS0_DTLA0_DTLB0_DTVA0_DTVB1_DTVSM0_DPLBn1_EPS0_ELFLR0_EMLLn1_FDSI0_GRPM1_GRVWA8_GRVWB8_GSUn1_GSUAMB_GSUC0_GSUWGMRR0_GLS0_ISA1201_IU1_K1_LDSTI0_LBSPPA128_LBSPPB0_LBSPPM0_LPA8_LPB0_LPM0_LRVW8_LWPMn1_MIAV1_MIWT1_1_MO40_MGRIPMn1_NTn1_NTA0_NTB0_NTC0_NTD0_NTM0_NEPBS0_NLCA1_NLCB1_ONLL0_PGR2_PLR1_PKA0_SGROBn1_SIA3_SS0_SU32_SUM0_SUS256_SPO0_SRVW0_SSO0_SVW8_SK0_SKFTR0_SKXCCM0_SGRO0_TIN0_TLDS1_TLDSM1_ULSGRO0_USL1_UIOFGRO0_USFGROn1_VSn1_VWA1_VWB1_WSGRA0_WSGRB0_WS32_WG32_4_1_WGM8_WGMXCC1_WGMXCCGn1
    SolutionIndex: 42
    SolutionNameMin: Cijk_Alik_Bjlk_I8II_BH_SHB_HA_S_SCD_SAV_UserArgs_MT32x16x32_MI16x16x1_SN_LDSB0_AFC1_AG0_AFEM1_AFEM1_ASEM32_CLR1_CADS0_DTLA0_DTLB0_DTVA1_DTVB1_DTVSM0_DPLBn1_EPS0_ELFLR0_EMLLn1_FDSI0_GRPM1_GRVWA8_GRVWB8_GSUn1_GSUAMB_GSUC0_GSUWGMRR0_GLS0_ISA1201_IU1_K1_LDSTI0_LBSPPA0_LBSPPB0_LBSPPM0_LPA0_LPB0_LPM0_LRVW8_LWPMn1_MIAV1_MIWT1_1_MO40_MGRIPMn1_NTn1_NTA0_NTB0_NTC0_NTD0_NTM0_NEPBS0_NLCA2_NLCB1_ONLL0_PGR1_PLR0_PKA0_SGROBn1_SIA3_SS0_SU32_SUM0_SUS256_SPO0_SRVW0_SSO0_SVW8_SK0_SKFTR0_SKXCCM0_SGRO0_TIN0_TLDS1_TLDSM1_ULSGRO0_USL1_UIOFGRO0_USFGROn1_VSn1_VWA1_VWB1_WSGRA0_WSGRB0_WS32_WG32_2_1_WGM8_WGMXCC1_WGMXCCGn1
    SolutionIndex: 43
    SolutionNameMin: Cijk_Alik_Bjlk_I8II_BH_SHB_HA_S_SCD_SAV_UserArgs_MT32x128x64_MI16x16x1_SN_LDSB0_AFC1_AG0_AFEM1_AFEM1_ASEM1_CLR1_CADS0_DTLA0_DTLB0_DTVA0_DTVB1_DTVSM0_DPLBn1_EPS1_ELFLR0_EMLLn1_FDSI0_GRPM1_GRVWA8_GRVWB8_GSUn1_GSUAMB_GSUC0_GSUWGMRR0_GLS0_ISA1201_IU1_K1_LDSTI0_LBSPPA128_LBSPPB0_LBSPPM0_LPA8_LPB0_LPM0_LRVW8_LWPMn1_MIAV1_MIWT1_4_MO40_MGRIPMn1_NTn1_NTA0_NTB0_NTC0_NTD0_NTM0_NEPBS0_NLCA1_NLCB4_ONLL0_PGR1_PLR1_PKA0_SGROBn1_SIA3_SS0_SU32_SUM0_SUS256_SPO0_SRVW0_SSO0_SVW8_SK0_SKFTR0_SKXCCM0_SGRO0_TIN0_TLDS1_TLDSM1_ULSGRO0_USL1_UIOFGRO0_USFGROn1_VSn1_VWA1_VWB1_WSGRA0_WSGRB0_WS32_WG32_4_1_WGM8_WGMXCC1_WGMXCCGn1
    SolutionIndex: 44
    SolutionNameMin: Cijk_Alik_Bjlk_I8II_BH_SHB_HA_S_SCD_SAV_UserArgs_MT64x64x32_MI16x16x1_SN_LDSB0_AFC1_AG0_AFEM1_AFEM1_ASEM1_CLR1_CADS0_DTLA0_DTLB0_DTVA0_DTVB1_DTVSM0_DPLBn1_EPS1_ELFLR0_EMLLn1_FDSI0_GRPM1_GRVWA8_GRVWB8_GSUn1_GSUAMB_GSUC0_GSUWGMRR0_GLS0_ISA1201_IU1_K1_LDSTI0_LBSPPA128_LBSPPB0_LBSPPM0_LPA8_LPB0_LPM0_LRVW8_LWPMn1_MIAV1_MIWT2_2_MO40_MGRIPMn1_NTn1_NTA0_NTB0_NTC0_NTD0_NTM0_NEPBS0_NLCA1_NLCB2_ONLL0_PGR1_PLR1_PKA0_SGROBn1_SIA3_SS0_SU32_SUM0_SUS256_SPO0_SRVW0_SSO0_SVW16_SK0_SKFTR0_SKXCCM0_SGRO0_TIN0_TLDS1_TLDSM1_ULSGRO0_USL1_UIOFGRO0_USFGROn1_VSn1_VWA2_VWB1_WSGRA0_WSGRB0_WS32_WG32_4_1_WGM8_WGMXCC1_WGMXCCGn1
    SolutionIndex: 45
    SolutionNameMin: Cijk_Alik_Bjlk_I8II_BH_SHB_HA_S_SCD_SAV_UserArgs_MT32x128x64_MI16x16x1_SN_LDSB0_AFC1_AG0_AFEM1_AFEM1_ASEM1_CLR1_CADS0_DTLA0_DTLB0_DTVA0_DTVB1_DTVSM0_DPLBn1_EPS0_ELFLR0_EMLLn1_FDSI0_GRPM1_GRVWA8_GRVWB8_GSUn1_GSUAMB_GSUC0_GSUWGMRR0_GLS0_ISA1201_IU1_K1_LDSTI0_LBSPPA128_LBSPPB0_LBSPPM0_LPA8_LPB0_LPM0_LRVW8_LWPMn1_MIAV1_MIWT1_4_MO40_MGRIPMn1_NTn1_NTA0_NTB0_NTC0_NTD0_NTM0_NEPBS0_NLCA1_NLCB4_ONLL0_PGR2_PLR1_PKA0_SGROBn1_SIA3_SS0_SU32_SUM0_SUS256_SPO0_SRVW0_SSO0_SVW8_SK0_SKFTR0_SKXCCM0_SGRO0_TIN0_TLDS1_TLDSM1_ULSGRO0_USL1_UIOFGRO0_USFGROn1_VSn1_VWA1_VWB1_WSGRA0_WSGRB0_WS32_WG32_4_1_WGM8_WGMXCC1_WGMXCCGn1
    SolutionIndex: 46
    SolutionNameMin: Cijk_Alik_Bjlk_I8II_BH_SHB_HA_S_SCD_SAV_UserArgs_MT32x16x64_MI16x16x1_SN_LDSB0_AFC1_AG0_AFEM1_AFEM1_ASEM1_CLR1_CADS0_DTLA0_DTLB0_DTVA0_DTVB1_DTVSM0_DPLBn1_EPS0_ELFLR0_EMLLn1_FDSI0_GRPM1_GRVWA8_GRVWB8_GSUn1_GSUAMB_GSUC0_GSUWGMRR0_GLS0_ISA1201_IU1_K1_LDSTI0_LBSPPA128_LBSPPB0_LBSPPM0_LPA8_LPB0_LPM0_LRVW8_LWPMn1_MIAV1_MIWT1_1_MO40_MGRIPMn1_NTn1_NTA0_NTB0_NTC0_NTD0_NTM0_NEPBS0_NLCA1_NLCB1_ONLL0_PGR2_PLR1_PKA0_SGROBn1_SIA3_SS0_SU32_SUM0_SUS256_SPO0_SRVW0_SSO0_SVW8_SK0_SKFTR0_SKXCCM0_SGRO0_TIN0_TLDS1_TLDSM1_ULSGRO0_USL1_UIOFGRO0_USFGROn1_VSn1_VWA1_VWB1_WSGRA0_WSGRB0_WS32_WG32_2_1_WGM8_WGMXCC1_WGMXCCGn1
    SolutionIndex: 47
    SolutionNameMin: Cijk_Alik_Bjlk_I8II_BH_SHB_HA_S_SCD_SAV_UserArgs_MT16x16x64_MI16x16x1_SN_LDSB0_AFC1_AG0_AFEM1_AFEM1_ASEM64_CLR1_CADS0_DTLA0_DTLB0_DTVA1_DTVB1_DTVSM0_DPLBn1_EPS0_ELFLR0_EMLLn1_FDSI0_GRPM1_GRVWA8_GRVWB8_GSUn1_GSUAMB_GSUC0_GSUWGMRR0_GLS0_ISA1201_IU1_K1_LDSTI0_LBSPPA0_LBSPPB0_LBSPPM0_LPA0_LPB0_LPM0_LRVW8_LWPMn1_MIAV1_MIWT1_1_MO40_MGRIPMn1_NTn1_NTA0_NTB0_NTC0_NTD0_NTM0_NEPBS0_NLCA4_NLCB1_ONLL0_PGR1_PLR0_PKA0_SGROBn1_SIA3_SS1_SU32_SUM0_SUS256_SPO0_SRVW0_SSO0_SVW1_SK0_SKFTR0_SKXCCM0_SGRO0_TIN0_TLDS1_TLDSM1_ULSGRO0_USL1_UIOFGRO0_USFGROn1_VSn1_VWA1_VWB1_WSGRA0_WSGRB0_WS32_WG16_2_1_WGM8_WGMXCC1_WGMXCCGn1
    SolutionIndex: 48
    SolutionNameMin: Cijk_Alik_Bjlk_I8II_BH_SHB_HA_S_SCD_SAV_UserArgs_MT64x64x32_MI16x16x1_SN_LDSB0_AFC1_AG0_AFEM1_AFEM1_ASEM1_CLR1_CADS0_DTLA0_DTLB0_DTVA0_DTVB1_DTVSM0_DPLBn1_EPS0_ELFLR0_EMLLn1_FDSI0_GRPM1_GRVWA8_GRVWB8_GSUn1_GSUAMB_GSUC0_GSUWGMRR0_GLS0_ISA1201_IU1_K1_LDSTI0_LBSPPA128_LBSPPB0_LBSPPM0_LPA8_LPB0_LPM0_LRVW8_LWPMn1_MIAV1_MIWT2_2_MO40_MGRIPMn1_NTn1_NTA0_NTB0_NTC0_NTD0_NTM0_NEPBS0_NLCA1_NLCB2_ONLL0_PGR2_PLR1_PKA0_SGROBn1_SIA3_SS0_SU32_SUM0_SUS256_SPO0_SRVW0_SSO0_SVW16_SK0_SKFTR0_SKXCCM0_SGRO0_TIN0_TLDS1_TLDSM1_ULSGRO0_USL1_UIOFGRO0_USFGROn1_VSn1_VWA2_VWB1_WSGRA0_WSGRB0_WS32_WG32_4_1_WGM8_WGMXCC1_WGMXCCGn1
    SolutionIndex: 49
    SolutionNameMin: Cijk_Alik_Bjlk_I8II_BH_SHB_HA_S_SCD_SAV_UserArgs_MT64x64x32_MI16x16x1_SN_LDSB1_AFC1_AG0_AFEM1_AFEM1_ASEM1_CLR1_CADS0_DTLA0_DTLB0_DTVA0_DTVB0_DTVSM0_DPLBn1_EPS0_ELFLR0_EMLLn1_FDSI0_GRPM1_GRVWA8_GRVWB8_GSUn1_GSUAMB_GSUC0_GSUWGMRR0_GLS0_ISA1201_IU2_K1_LDSTI0_LBSPPA128_LBSPPB512_LBSPPM0_LPA8_LPB32_LPM0_LRVW8_LWPMn1_MIAV1_MIWT2_2_MO40_MGRIPMn1_NTn1_NTA0_NTB0_NTC0_NTD0_NTM0_NEPBS0_NLCA1_NLCB1_ONLL0_PGR2_PLR1_PKA0_SGROBn1_SIA2_SS0_SU32_SUM0_SUS256_SPO0_SRVW0_SSO0_SVW16_SK0_SKFTR0_SKXCCM0_SGRO0_TIN0_TLDS1_TLDSM1_ULSGRO1_USL1_UIOFGRO0_USFGROn1_VSn1_VWA2_VWB2_WSGRA0_WSGRB0_WS32_WG32_4_1_WGM8_WGMXCC1_WGMXCCGn1
    SolutionIndex: 50
    SolutionNameMin: Cijk_Alik_Bjlk_I8II_BH_SHB_HA_S_SCD_SAV_UserArgs_MT64x64x16_MI16x16x1_SN_LDSB0_AFC1_AG0_AFEM1_AFEM1_ASEM1_CLR0_CADS0_DTLA0_DTLB0_DTVA0_DTVB0_DTVSM0_DPLBn1_EPS0_ELFLR0_EMLLn1_FDSI0_GRPM1_GRVWA8_GRVWB8_GSUn1_GSUAMB_GSUC0_GSUWGMRR0_GLS0_ISA1201_IU1_K1_LDSTI0_LBSPPA128_LBSPPB512_LBSPPM0_LPA8_LPB32_LPM0_LRVW8_LWPMn1_MIAV1_MIWT2_2_MO40_MGRIPMn1_NTn1_NTA0_NTB0_NTC0_NTD0_NTM0_NEPBS0_NLCA1_NLCB1_ONLL0_PGR2_PLR0_PKA0_SGROBn1_SIA3_SS0_SU32_SUM0_SUS256_SPO0_SRVW0_SSO0_SVW16_SK0_SKFTR0_SKXCCM0_SGRO0_TIN0_TLDS1_TLDSM1_ULSGRO1_USL1_UIOFGRO0_USFGROn1_VSn1_VWA2_VWB2_WSGRA0_WSGRB0_WS32_WG32_4_1_WGM8_WGMXCC1_WGMXCCGn1
    SolutionIndex: 51
    SolutionNameMin: Cijk_Alik_Bjlk_I8II_BH_SHB_HA_S_SCD_SAV_UserArgs_MT64x64x32_MI16x16x1_SN_LDSB0_AFC1_AG0_AFEM1_AFEM1_ASEM32_CLR1_CADS0_DTLA0_DTLB0_DTVA1_DTVB1_DTVSM0_DPLBn1_EPS0_ELFLR0_EMLLn1_FDSI0_GRPM1_GRVWA8_GRVWB8_GSUn1_GSUAMB_GSUC0_GSUWGMRR0_GLS0_ISA1201_IU1_K1_LDSTI0_LBSPPA0_LBSPPB0_LBSPPM0_LPA0_LPB0_LPM0_LRVW8_LWPMn1_MIAV1_MIWT2_2_MO40_MGRIPMn1_NTn1_NTA0_NTB0_NTC0_NTD0_NTM0_NEPBS0_NLCA2_NLCB2_ONLL0_PGR1_PLR0_PKA0_SGROBn1_SIA3_SS0_SU32_SUM0_SUS256_SPO0_SRVW0_SSO0_SVW16_SK0_SKFTR0_SKXCCM0_SGRO0_TIN0_TLDS1_TLDSM1_ULSGRO0_USL1_UIOFGRO0_USFGROn1_VSn1_VWA2_VWB1_WSGRA0_WSGRB0_WS32_WG32_4_1_WGM8_WGMXCC1_WGMXCCGn1
    SolutionIndex: 52
    SolutionNameMin: Cijk_Alik_Bjlk_I8II_BH_SHB_HA_S_SCD_SAV_UserArgs_MT64x64x64_MI16x16x1_SN_LDSB0_AFC1_AG0_AFEM1_AFEM1_ASEM1_CLR1_CADS0_DTLA0_DTLB0_DTVA0_DTVB1_DTVSM0_DPLBn1_EPS1_ELFLR0_EMLLn1_FDSI0_GRPM1_GRVWA8_GRVWB8_GSUn1_GSUAMB_GSUC0_GSUWGMRR0_GLS0_ISA1201_IU1_K1_LDSTI0_LBSPPA128_LBSPPB0_LBSPPM0_LPA8_LPB0_LPM0_LRVW8_LWPMn1_MIAV1_MIWT2_2_MO40_MGRIPMn1_NTn1_NTA0_NTB0_NTC0_NTD0_NTM0_NEPBS0_NLCA1_NLCB4_ONLL0_PGR1_PLR1_PKA0_SGROBn1_SIA3_SS1_SU32_SUM0_SUS256_SPO0_SRVW0_SSO0_SVW2_SK0_SKFTR0_SKXCCM0_SGRO0_TIN0_TLDS1_TLDSM1_ULSGRO0_USL1_UIOFGRO0_USFGROn1_VSn1_VWA2_VWB1_WSGRA0_WSGRB0_WS32_WG32_4_1_WGM8_WGMXCC1_WGMXCCGn1
    SolutionIndex: 53
    SolutionNameMin: Cijk_Alik_Bjlk_I8II_BH_SHB_HA_S_SCD_SAV_UserArgs_MT128x64x16_MI16x16x1_SN_LDSB0_AFC1_AG0_AFEM1_AFEM1_ASEM1_CLR0_CADS0_DTLA0_DTLB0_DTVA0_DTVB0_DTVSM0_DPLBn1_EPS0_ELFLR0_EMLLn1_FDSI0_GRPM1_GRVWA8_GRVWB8_GSUn1_GSUAMB_GSUC0_GSUWGMRR0_GLS0_ISA1201_IU1_K1_LDSTI0_LBSPPA128_LBSPPB512_LBSPPM0_LPA8_LPB16_LPM0_LRVW8_LWPMn1_MIAV1_MIWT8_1_MO40_MGRIPMn1_NTn1_NTA0_NTB0_NTC0_NTD0_NTM0_NEPBS0_NLCA1_NLCB1_ONLL0_PGR2_PLR0_PKA0_SGROBn1_SIA3_SS1_SU32_SUM0_SUS256_SPO0_SRVW0_SSO0_SVW8_SK0_SKFTR0_SKXCCM0_SGRO0_TIN0_TLDS1_TLDSM1_ULSGRO0_USL1_UIOFGRO0_USFGROn1_VSn1_VWA8_VWB1_WSGRA0_WSGRB0_WS32_WG16_8_1_WGM8_WGMXCC1_WGMXCCGn1
    SolutionIndex: 54
    SolutionNameMin: Cijk_Alik_Bjlk_I8II_BH_SHB_HA_S_SCD_SAV_UserArgs_MT16x16x64_MI16x16x1_SN_LDSB0_AFC1_AG0_AFEM1_AFEM1_ASEM64_CLR1_CADS0_DTLA0_DTLB0_DTVA1_DTVB1_DTVSM0_DPLBn1_EPS0_ELFLR0_EMLLn1_FDSI0_GRPM1_GRVWA8_GRVWB8_GSUn1_GSUAMB_GSUC0_GSUWGMRR0_GLS0_ISA1201_IU1_K1_LDSTI0_LBSPPA0_LBSPPB0_LBSPPM0_LPA0_LPB0_LPM0_LRVW8_LWPMn1_MIAV1_MIWT1_1_MO40_MGRIPMn1_NTn1_NTA0_NTB0_NTC0_NTD0_NTM0_NEPBS0_NLCA4_NLCB1_ONLL0_PGR1_PLR0_PKA0_SGROBn1_SIA3_SS0_SU32_SUM0_SUS256_SPO0_SRVW0_SSO0_SVW8_SK0_SKFTR0_SKXCCM0_SGRO0_TIN0_TLDS1_TLDSM1_ULSGRO0_USL1_UIOFGRO0_USFGROn1_VSn1_VWA1_VWB1_WSGRA0_WSGRB0_WS32_WG16_2_1_WGM8_WGMXCC1_WGMXCCGn1
    SolutionIndex: 55
    SolutionNameMin: Cijk_Alik_Bjlk_I8II_BH_SHB_HA_S_SCD_SAV_UserArgs_MT16x32x32_MI16x16x1_SN_LDSB0_AFC1_AG0_AFEM1_AFEM1_ASEM32_CLR1_CADS0_DTLA0_DTLB0_DTVA1_DTVB1_DTVSM0_DPLBn1_EPS0_ELFLR0_EMLLn1_FDSI0_GRPM1_GRVWA8_GRVWB8_GSUn1_GSUAMB_GSUC0_GSUWGMRR0_GLS0_ISA1201_IU1_K1_LDSTI0_LBSPPA0_LBSPPB0_LBSPPM0_LPA0_LPB0_LPM0_LRVW8_LWPMn1_MIAV1_MIWT1_1_MO40_MGRIPMn1_NTn1_NTA0_NTB0_NTC0_NTD0_NTM0_NEPBS0_NLCA2_NLCB1_ONLL0_PGR1_PLR0_PKA0_SGROBn1_SIA3_SS0_SU32_SUM0_SUS256_SPO0_SRVW0_SSO0_SVW8_SK0_SKFTR0_SKXCCM0_SGRO0_TIN0_TLDS1_TLDSM1_ULSGRO0_USL1_UIOFGRO0_USFGROn1_VSn1_VWA1_VWB1_WSGRA0_WSGRB0_WS32_WG16_4_1_WGM8_WGMXCC1_WGMXCCGn1
    SolutionIndex: 56
    SolutionNameMin: Cijk_Alik_Bjlk_I8II_BH_SHB_HA_S_SCD_SAV_UserArgs_MT32x128x32_MI16x16x1_SN_LDSB0_AFC1_AG0_AFEM1_AFEM1_ASEM1_CLR1_CADS0_DTLA0_DTLB0_DTVA0_DTVB1_DTVSM0_DPLBn1_EPS1_ELFLR0_EMLLn1_FDSI0_GRPM1_GRVWA8_GRVWB8_GSUn1_GSUAMB_GSUC0_GSUWGMRR0_GLS0_ISA1201_IU1_K1_LDSTI0_LBSPPA128_LBSPPB0_LBSPPM0_LPA8_LPB0_LPM0_LRVW8_LWPMn1_MIAV1_MIWT1_4_MO40_MGRIPMn1_NTn1_NTA0_NTB0_NTC0_NTD0_NTM0_NEPBS0_NLCA1_NLCB2_ONLL0_PGR1_PLR1_PKA0_SGROBn1_SIA3_SS0_SU32_SUM0_SUS256_SPO0_SRVW0_SSO0_SVW8_SK0_SKFTR0_SKXCCM0_SGRO0_TIN0_TLDS1_TLDSM1_ULSGRO0_USL1_UIOFGRO0_USFGROn1_VSn1_VWA1_VWB1_WSGRA0_WSGRB0_WS32_WG32_4_1_WGM8_WGMXCC1_WGMXCCGn1
    SolutionIndex: 57
    SolutionNameMin: Cijk_Alik_Bjlk_I8II_BH_SHB_HA_S_SCD_SAV_UserArgs_MT16x256x64_MI16x16x1_SN_LDSB0_AFC1_AG0_AFEM1_AFEM1_ASEM64_CLR1_CADS0_DTLA0_DTLB0_DTVA1_DTVB1_DTVSM0_DPLBn1_EPS0_ELFLR0_EMLLn1_FDSI0_GRPM1_GRVWA8_GRVWB8_GSUn1_GSUAMB_GSUC0_GSUWGMRR0_GLS0_ISA1201_IU1_K1_LDSTI0_LBSPPA0_LBSPPB0_LBSPPM0_LPA0_LPB0_LPM0_LRVW8_LWPMn1_MIAV1_MIWT1_8_MO40_MGRIPMn1_NTn1_NTA0_NTB0_NTC0_NTD0_NTM0_NEPBS0_NLCA4_NLCB4_ONLL0_PGR1_PLR0_PKA0_SGROBn1_SIA3_SS0_SU32_SUM0_SUS256_SPO0_SRVW0_SSO0_SVW8_SK0_SKFTR0_SKXCCM0_SGRO0_TIN0_TLDS1_TLDSM1_ULSGRO0_USL1_UIOFGRO0_USFGROn1_VSn1_VWA1_VWB1_WSGRA0_WSGRB0_WS32_WG16_4_1_WGM8_WGMXCC1_WGMXCCGn1
    SolutionIndex: 58
    SolutionNameMin: Cijk_Alik_Bjlk_I8II_BH_SHB_HA_S_SCD_SAV_UserArgs_MT128x32x64_MI16x16x1_SN_LDSB0_AFC1_AG0_AFEM1_AFEM1_ASEM1_CLR1_CADS0_DTLA0_DTLB0_DTVA0_DTVB1_DTVSM0_DPLBn1_EPS0_ELFLR0_EMLLn1_FDSI0_GRPM1_GRVWA8_GRVWB8_GSUn1_GSUAMB_GSUC0_GSUWGMRR0_GLS0_ISA1201_IU1_K1_LDSTI0_LBSPPA256_LBSPPB0_LBSPPM0_LPA8_LPB0_LPM0_LRVW8_LWPMn1_MIAV1_MIWT4_1_MO40_MGRIPMn1_NTn1_NTA0_NTB0_NTC0_NTD0_NTM0_NEPBS0_NLCA1_NLCB1_ONLL0_PGR2_PLR1_PKA0_SGROBn1_SIA3_SS0_SU32_SUM0_SUS256_SPO0_SRVW0_SSO0_SVW8_SK0_SKFTR0_SKXCCM0_SGRO0_TIN0_TLDS1_TLDSM1_ULSGRO0_USL1_UIOFGRO0_USFGROn1_VSn1_VWA4_VWB1_WSGRA0_WSGRB0_WS32_WG32_4_1_WGM8_WGMXCC1_WGMXCCGn1
    SolutionIndex: 59
    SolutionNameMin: Cijk_Alik_Bjlk_I8II_BH_SHB_HA_S_SCD_SAV_UserArgs_MT16x256x32_MI16x16x1_SN_LDSB0_AFC1_AG0_AFEM1_AFEM1_ASEM1_CLR1_CADS0_DTLA0_DTLB0_DTVA0_DTVB1_DTVSM0_DPLBn1_EPS1_ELFLR0_EMLLn1_FDSI0_GRPM1_GRVWA8_GRVWB8_GSUn1_GSUAMB_GSUC0_GSUWGMRR0_GLS0_ISA1201_IU1_K1_LDSTI0_LBSPPA128_LBSPPB0_LBSPPM0_LPA8_LPB0_LPM0_LRVW8_LWPMn1_MIAV1_MIWT1_8_MO40_MGRIPMn1_NTn1_NTA0_NTB0_NTC0_NTD0_NTM0_NEPBS0_NLCA1_NLCB2_ONLL0_PGR1_PLR1_PKA0_SGROBn1_SIA3_SS0_SU32_SUM0_SUS256_SPO0_SRVW0_SSO0_SVW8_SK0_SKFTR0_SKXCCM0_SGRO0_TIN0_TLDS1_TLDSM1_ULSGRO0_USL1_UIOFGRO0_USFGROn1_VSn1_VWA1_VWB1_WSGRA0_WSGRB0_WS32_WG16_4_1_WGM8_WGMXCC1_WGMXCCGn1
    SolutionIndex: 60
    SolutionNameMin: Cijk_Alik_Bjlk_I8II_BH_SHB_HA_S_SCD_SAV_UserArgs_MT128x32x64_MI16x16x1_SN_LDSB0_AFC1_AG0_AFEM1_AFEM1_ASEM1_CLR1_CADS0_DTLA0_DTLB0_DTVA0_DTVB1_DTVSM0_DPLBn1_EPS1_ELFLR0_EMLLn1_FDSI0_GRPM1_GRVWA8_GRVWB8_GSUn1_GSUAMB_GSUC0_GSUWGMRR0_GLS0_ISA1201_IU1_K1_LDSTI0_LBSPPA256_LBSPPB0_LBSPPM0_LPA8_LPB0_LPM0_LRVW8_LWPMn1_MIAV1_MIWT4_1_MO40_MGRIPMn1_NTn1_NTA0_NTB0_NTC0_NTD0_NTM0_NEPBS0_NLCA1_NLCB1_ONLL0_PGR1_PLR1_PKA0_SGROBn1_SIA3_SS0_SU32_SUM0_SUS256_SPO0_SRVW0_SSO0_SVW8_SK0_SKFTR0_SKXCCM0_SGRO0_TIN0_TLDS1_TLDSM1_ULSGRO0_USL1_UIOFGRO0_USFGROn1_VSn1_VWA4_VWB1_WSGRA0_WSGRB0_WS32_WG32_4_1_WGM8_WGMXCC1_WGMXCCGn1
    SolutionIndex: 61
    SolutionNameMin: Cijk_Alik_Bjlk_I8II_BH_SHB_HA_S_SCD_SAV_UserArgs_MT16x256x32_MI16x16x1_SN_LDSB0_AFC1_AG0_AFEM1_AFEM1_ASEM1_CLR1_CADS0_DTLA0_DTLB0_DTVA0_DTVB1_DTVSM0_DPLBn1_EPS0_ELFLR0_EMLLn1_FDSI0_GRPM1_GRVWA8_GRVWB8_GSUn1_GSUAMB_GSUC0_GSUWGMRR0_GLS0_ISA1201_IU1_K1_LDSTI0_LBSPPA128_LBSPPB0_LBSPPM0_LPA8_LPB0_LPM0_LRVW8_LWPMn1_MIAV1_MIWT1_8_MO40_MGRIPMn1_NTn1_NTA0_NTB0_NTC0_NTD0_NTM0_NEPBS0_NLCA1_NLCB2_ONLL0_PGR2_PLR1_PKA0_SGROBn1_SIA3_SS0_SU32_SUM0_SUS256_SPO0_SRVW0_SSO0_SVW8_SK0_SKFTR0_SKXCCM0_SGRO0_TIN0_TLDS1_TLDSM1_ULSGRO0_USL1_UIOFGRO0_USFGROn1_VSn1_VWA1_VWB1_WSGRA0_WSGRB0_WS32_WG16_4_1_WGM8_WGMXCC1_WGMXCCGn1
    SolutionIndex: 62
    SolutionNameMin: Cijk_Alik_Bjlk_I8II_BH_SHB_HA_S_SCD_SAV_UserArgs_MT64x64x16_MI16x16x1_SN_LDSB0_AFC1_AG0_AFEM1_AFEM1_ASEM16_CLR1_CADS0_DTLA0_DTLB0_DTVA1_DTVB1_DTVSM0_DPLBn1_EPS0_ELFLR0_EMLLn1_FDSI0_GRPM1_GRVWA8_GRVWB8_GSUn1_GSUAMB_GSUC0_GSUWGMRR0_GLS0_ISA1201_IU1_K1_LDSTI0_LBSPPA0_LBSPPB0_LBSPPM0_LPA0_LPB0_LPM0_LRVW8_LWPMn1_MIAV1_MIWT2_2_MO40_MGRIPMn1_NTn1_NTA0_NTB0_NTC0_NTD0_NTM0_NEPBS0_NLCA1_NLCB1_ONLL0_PGR1_PLR0_PKA0_SGROBn1_SIA3_SS0_SU32_SUM0_SUS256_SPO0_SRVW0_SSO0_SVW16_SK0_SKFTR0_SKXCCM0_SGRO0_TIN0_TLDS1_TLDSM1_ULSGRO0_USL1_UIOFGRO0_USFGROn1_VSn1_VWA2_VWB1_WSGRA0_WSGRB0_WS32_WG32_4_1_WGM8_WGMXCC1_WGMXCCGn1
    SolutionIndex: 63
    SolutionNameMin: Cijk_Alik_Bjlk_I8II_BH_SHB_HA_S_SCD_SAV_UserArgs_MT32x16x64_MI16x16x1_SN_LDSB0_AFC1_AG0_AFEM1_AFEM1_ASEM1_CLR1_CADS0_DTLA0_DTLB0_DTVA0_DTVB0_DTVSM0_DPLBn1_EPS1_ELFLR0_EMLLn1_FDSI0_GRPM1_GRVWA16_GRVWB16_GSUn1_GSUAMB_GSUC0_GSUWGMRR0_GLS0_ISA1201_IU1_K1_LDSTI0_LBSPPA128_LBSPPB256_LBSPPM0_LPA32_LPB16_LPM0_LRVW16_LWPMn1_MIAV1_MIWT1_1_MO40_MGRIPMn1_NTn1_NTA0_NTB0_NTC0_NTD0_NTM0_NEPBS0_NLCA1_NLCB1_ONLL0_PGR1_PLR1_PKA0_SGROBn1_SIA3_SS0_SU32_SUM0_SUS256_SPO0_SRVW0_SSO0_SVW8_SK0_SKFTR0_SKXCCM0_SGRO0_TIN0_TLDS1_TLDSM1_ULSGRO0_USL1_UIOFGRO0_USFGROn1_VSn1_VWA1_VWB1_WSGRA0_WSGRB0_WS32_WG32_2_1_WGM8_WGMXCC1_WGMXCCGn1
    SolutionIndex: 64
    SolutionNameMin: Cijk_Alik_Bjlk_I8II_BH_SHB_HA_S_SCD_SAV_UserArgs_MT16x512x64_MI16x16x1_SN_LDSB0_AFC1_AG0_AFEM1_AFEM1_ASEM1_CLR1_CADS0_DTLA0_DTLB0_DTVA0_DTVB1_DTVSM0_DPLBn1_EPS1_ELFLR0_EMLLn1_FDSI0_GRPM1_GRVWA8_GRVWB8_GSUn1_GSUAMB_GSUC0_GSUWGMRR0_GLS0_ISA1201_IU1_K1_LDSTI0_LBSPPA128_LBSPPB0_LBSPPM0_LPA8_LPB0_LPM0_LRVW8_LWPMn1_MIAV1_MIWT1_8_MO40_MGRIPMn1_NTn1_NTA0_NTB0_NTC0_NTD0_NTM0_NEPBS0_NLCA1_NLCB4_ONLL0_PGR1_PLR1_PKA0_SGROBn1_SIA3_SS0_SU32_SUM0_SUS256_SPO0_SRVW0_SSO0_SVW8_SK0_SKFTR0_SKXCCM0_SGRO0_TIN0_TLDS1_TLDSM1_ULSGRO0_USL1_UIOFGRO0_USFGROn1_VSn1_VWA1_VWB1_WSGRA0_WSGRB0_WS32_WG16_8_1_WGM8_WGMXCC1_WGMXCCGn1
    SolutionIndex: 65
    SolutionNameMin: Cijk_Alik_Bjlk_I8II_BH_SHB_HA_S_SCD_SAV_UserArgs_MT64x64x64_MI16x16x1_SN_LDSB0_AFC1_AG0_AFEM1_AFEM1_ASEM64_CLR1_CADS0_DTLA0_DTLB0_DTVA1_DTVB1_DTVSM0_DPLBn1_EPS0_ELFLR0_EMLLn1_FDSI0_GRPM1_GRVWA8_GRVWB8_GSUn1_GSUAMB_GSUC0_GSUWGMRR0_GLS0_ISA1201_IU1_K1_LDSTI0_LBSPPA0_LBSPPB0_LBSPPM0_LPA0_LPB0_LPM0_LRVW8_LWPMn1_MIAV1_MIWT2_2_MO40_MGRIPMn1_NTn1_NTA0_NTB0_NTC0_NTD0_NTM0_NEPBS0_NLCA4_NLCB4_ONLL0_PGR1_PLR0_PKA0_SGROBn1_SIA3_SS1_SU32_SUM0_SUS256_SPO0_SRVW0_SSO0_SVW2_SK0_SKFTR0_SKXCCM0_SGRO0_TIN0_TLDS1_TLDSM1_ULSGRO0_USL1_UIOFGRO0_USFGROn1_VSn1_VWA2_VWB1_WSGRA0_WSGRB0_WS32_WG32_4_1_WGM8_WGMXCC1_WGMXCCGn1
    SolutionIndex: 66
    SolutionNameMin: Cijk_Alik_Bjlk_I8II_BH_SHB_HA_S_SCD_SAV_UserArgs_MT64x64x64_MI16x16x1_SN_LDSB0_AFC1_AG0_AFEM1_AFEM1_ASEM64_CLR1_CADS0_DTLA0_DTLB0_DTVA1_DTVB0_DTVSM0_DPLBn1_EPS1_ELFLR0_EMLLn1_FDSI0_GRPM1_GRVWA16_GRVWB16_GSUn1_GSUAMB_GSUC0_GSUWGMRR0_GLS0_ISA1201_IU1_K1_LDSTI0_LBSPPA0_LBSPPB1024_LBSPPM0_LPA0_LPB32_LPM0_LRVW16_LWPMn1_MIAV1_MIWT2_2_MO40_MGRIPMn1_NTn1_NTA0_NTB0_NTC0_NTD0_NTM0_NEPBS0_NLCA2_NLCB1_ONLL0_PGR1_PLR1_PKA0_SGROBn1_SIA3_SS0_SU32_SUM0_SUS256_SPO0_SRVW0_SSO0_SVW16_SK0_SKFTR0_SKXCCM0_SGRO0_TIN0_TLDS1_TLDSM1_ULSGRO0_USL1_UIOFGRO0_USFGROn1_VSn1_VWA2_VWB2_WSGRA0_WSGRB0_WS32_WG32_4_1_WGM8_WGMXCC1_WGMXCCGn1
    SolutionIndex: 67
    SolutionNameMin: Cijk_Alik_Bjlk_I8II_BH_SHB_HA_S_SCD_SAV_UserArgs_MT16x128x32_MI16x16x1_SN_LDSB0_AFC1_AG0_AFEM1_AFEM1_ASEM1_CLR1_CADS0_DTLA0_DTLB0_DTVA0_DTVB1_DTVSM0_DPLBn1_EPS1_ELFLR0_EMLLn1_FDSI0_GRPM1_GRVWA8_GRVWB8_GSUn1_GSUAMB_GSUC0_GSUWGMRR0_GLS0_ISA1201_IU1_K1_LDSTI0_LBSPPA128_LBSPPB0_LBSPPM0_LPA8_LPB0_LPM0_LRVW8_LWPMn1_MIAV1_MIWT1_8_MO40_MGRIPMn1_NTn1_NTA0_NTB0_NTC0_NTD0_NTM0_NEPBS0_NLCA1_NLCB2_ONLL0_PGR1_PLR1_PKA0_SGROBn1_SIA3_SS0_SU32_SUM0_SUS256_SPO0_SRVW0_SSO0_SVW8_SK0_SKFTR0_SKXCCM0_SGRO0_TIN0_TLDS1_TLDSM1_ULSGRO0_USL1_UIOFGRO0_USFGROn1_VSn1_VWA1_VWB1_WSGRA0_WSGRB0_WS32_WG16_2_1_WGM8_WGMXCC1_WGMXCCGn1
    SolutionIndex: 68
    SolutionNameMin: Cijk_Alik_Bjlk_I8II_BH_SHB_HA_S_SCD_SAV_UserArgs_MT128x64x32_MI16x16x1_SN_LDSB1_AFC1_AG0_AFEM1_AFEM1_ASEM1_CLR1_CADS0_DTLA0_DTLB0_DTVA0_DTVB0_DTVSM0_DPLBn1_EPS0_ELFLR0_EMLLn1_FDSI0_GRPM1_GRVWA8_GRVWB8_GSUn1_GSUAMB_GSUC0_GSUWGMRR0_GLS0_ISA1201_IU2_K1_LDSTI0_LBSPPA256_LBSPPB512_LBSPPM0_LPA8_LPB16_LPM0_LRVW8_LWPMn1_MIAV1_MIWT8_1_MO40_MGRIPMn1_NTn1_NTA0_NTB0_NTC0_NTD0_NTM0_NEPBS0_NLCA1_NLCB1_ONLL0_PGR2_PLR1_PKA0_SGROBn1_SIA2_SS1_SU32_SUM0_SUS256_SPO0_SRVW0_SSO0_SVW8_SK0_SKFTR0_SKXCCM0_SGRO0_TIN0_TLDS1_TLDSM1_ULSGRO1_USL1_UIOFGRO0_USFGROn1_VSn1_VWA8_VWB1_WSGRA0_WSGRB0_WS32_WG16_8_1_WGM8_WGMXCC1_WGMXCCGn1
    SolutionIndex: 69
    SolutionNameMin: Cijk_Alik_Bjlk_I8II_BH_SHB_HA_S_SCD_SAV_UserArgs_MT128x32x32_MI16x16x1_SN_LDSB0_AFC1_AG0_AFEM1_AFEM1_ASEM32_CLR1_CADS0_DTLA0_DTLB0_DTVA1_DTVB0_DTVSM0_DPLBn1_EPS0_ELFLR0_EMLLn1_FDSI0_GRPM1_GRVWA8_GRVWB8_GSUn1_GSUAMB_GSUC0_GSUWGMRR0_GLS0_ISA1201_IU1_K1_LDSTI0_LBSPPA0_LBSPPB256_LBSPPM0_LPA0_LPB16_LPM0_LRVW8_LWPMn1_MIAV1_MIWT4_1_MO40_MGRIPMn1_NTn1_NTA0_NTB0_NTC0_NTD0_NTM0_NEPBS0_NLCA2_NLCB1_ONLL0_PGR2_PLR1_PKA0_SGROBn1_SIA3_SS0_SU32_SUM0_SUS256_SPO0_SRVW0_SSO0_SVW8_SK0_SKFTR0_SKXCCM0_SGRO0_TIN0_TLDS1_TLDSM1_ULSGRO0_USL1_UIOFGRO0_USFGROn1_VSn1_VWA4_VWB1_WSGRA0_WSGRB0_WS32_WG32_4_1_WGM8_WGMXCC1_WGMXCCGn1
    SolutionIndex: 70
    SolutionNameMin: Cijk_Alik_Bjlk_I8II_BH_SHB_HA_S_SCD_SAV_UserArgs_MT32x128x64_MI16x16x1_SN_LDSB0_AFC1_AG0_AFEM1_AFEM1_ASEM64_CLR1_CADS0_DTLA0_DTLB0_DTVA1_DTVB1_DTVSM0_DPLBn1_EPS0_ELFLR0_EMLLn1_FDSI0_GRPM1_GRVWA8_GRVWB8_GSUn1_GSUAMB_GSUC0_GSUWGMRR0_GLS0_ISA1201_IU1_K1_LDSTI0_LBSPPA0_LBSPPB0_LBSPPM0_LPA0_LPB0_LPM0_LRVW8_LWPMn1_MIAV1_MIWT1_4_MO40_MGRIPMn1_NTn1_NTA0_NTB0_NTC0_NTD0_NTM0_NEPBS0_NLCA4_NLCB4_ONLL0_PGR1_PLR0_PKA0_SGROBn1_SIA3_SS0_SU32_SUM0_SUS256_SPO0_SRVW0_SSO0_SVW8_SK0_SKFTR0_SKXCCM0_SGRO0_TIN0_TLDS1_TLDSM1_ULSGRO0_USL1_UIOFGRO0_USFGROn1_VSn1_VWA1_VWB1_WSGRA0_WSGRB0_WS32_WG32_4_1_WGM8_WGMXCC1_WGMXCCGn1
    SolutionIndex: 71
    SolutionNameMin: Cijk_Alik_Bjlk_I8II_BH_SHB_HA_S_SCD_SAV_UserArgs_MT128x32x64_MI16x16x1_SN_LDSB0_AFC1_AG0_AFEM1_AFEM1_ASEM1_CLR1_CADS0_DTLA0_DTLB0_DTVA0_DTVB1_DTVSM0_DPLBn1_EPS0_ELFLR0_EMLLn1_FDSI0_GRPM1_GRVWA8_GRVWB8_GSUn1_GSUAMB_GSUC0_GSUWGMRR0_GLS0_ISA1201_IU1_K1_LDSTI0_LBSPPA256_LBSPPB0_LBSPPM0_LPA8_LPB0_LPM0_LRVW8_LWPMn1_MIAV1_MIWT4_1_MO40_MGRIPMn1_NTn1_NTA0_NTB0_NTC0_NTD0_NTM0_NEPBS0_NLCA1_NLCB1_ONLL0_PGR2_PLR1_PKA0_SGROBn1_SIA3_SS1_SU32_SUM0_SUS256_SPO0_SRVW0_SSO0_SVW4_SK0_SKFTR0_SKXCCM0_SGRO0_TIN0_TLDS1_TLDSM1_ULSGRO0_USL1_UIOFGRO0_USFGROn1_VSn1_VWA4_VWB1_WSGRA0_WSGRB0_WS32_WG32_4_1_WGM8_WGMXCC1_WGMXCCGn1
    SolutionIndex: 72
    SolutionNameMin: Cijk_Alik_Bjlk_I8II_BH_SHB_HA_S_SCD_SAV_UserArgs_MT128x64x64_MI16x16x1_SN_LDSB0_AFC1_AG0_AFEM1_AFEM1_ASEM1_CLR1_CADS0_DTLA0_DTLB0_DTVA0_DTVB1_DTVSM0_DPLBn1_EPS0_ELFLR0_EMLLn1_FDSI0_GRPM1_GRVWA8_GRVWB8_GSUn1_GSUAMB_GSUC0_GSUWGMRR0_GLS0_ISA1201_IU1_K1_LDSTI0_LBSPPA512_LBSPPB0_LBSPPM0_LPA8_LPB0_LPM0_LRVW8_LWPMn1_MIAV1_MIWT8_1_MO40_MGRIPMn1_NTn1_NTA0_NTB0_NTC0_NTD0_NTM0_NEPBS0_NLCA1_NLCB1_ONLL0_PGR2_PLR1_PKA0_SGROBn1_SIA3_SS1_SU32_SUM0_SUS256_SPO0_SRVW0_SSO0_SVW8_SK0_SKFTR0_SKXCCM0_SGRO0_TIN0_TLDS1_TLDSM1_ULSGRO0_USL1_UIOFGRO0_USFGROn1_VSn1_VWA8_VWB1_WSGRA0_WSGRB0_WS32_WG16_8_1_WGM8_WGMXCC1_WGMXCCGn1
    SolutionIndex: 73
    SolutionNameMin: Cijk_Alik_Bjlk_I8II_BH_SHB_HA_S_SCD_SAV_UserArgs_MT64x128x32_MI16x16x1_SN_LDSB0_AFC1_AG0_AFEM1_AFEM1_ASEM1_CLR1_CADS0_DTLA0_DTLB0_DTVA0_DTVB1_DTVSM0_DPLBn1_EPS1_ELFLR0_EMLLn1_FDSI0_GRPM1_GRVWA8_GRVWB8_GSUn1_GSUAMB_GSUC0_GSUWGMRR0_GLS0_ISA1201_IU1_K1_LDSTI0_LBSPPA128_LBSPPB0_LBSPPM0_LPA8_LPB0_LPM0_LRVW8_LWPMn1_MIAV1_MIWT1_8_MO40_MGRIPMn1_NTn1_NTA0_NTB0_NTC0_NTD0_NTM0_NEPBS0_NLCA1_NLCB2_ONLL0_PGR1_PLR1_PKA0_SGROBn1_SIA3_SS0_SU32_SUM0_SUS256_SPO0_SRVW0_SSO0_SVW8_SK0_SKFTR0_SKXCCM0_SGRO0_TIN0_TLDS1_TLDSM1_ULSGRO0_USL1_UIOFGRO0_USFGROn1_VSn1_VWA1_VWB1_WSGRA0_WSGRB0_WS32_WG64_2_1_WGM8_WGMXCC1_WGMXCCGn1
    SolutionIndex: 74
    SolutionNameMin: Cijk_Alik_Bjlk_I8II_BH_SHB_HA_S_SCD_SAV_UserArgs_MT64x128x64_MI16x16x1_SN_LDSB0_AFC1_AG0_AFEM1_AFEM1_ASEM1_CLR1_CADS0_DTLA0_DTLB0_DTVA0_DTVB1_DTVSM0_DPLBn1_EPS0_ELFLR0_EMLLn1_FDSI0_GRPM1_GRVWA8_GRVWB8_GSUn1_GSUAMB_GSUC0_GSUWGMRR0_GLS0_ISA1201_IU1_K1_LDSTI0_LBSPPA128_LBSPPB0_LBSPPM0_LPA8_LPB0_LPM0_LRVW8_LWPMn1_MIAV1_MIWT1_8_MO40_MGRIPMn1_NTn1_NTA0_NTB0_NTC0_NTD0_NTM0_NEPBS0_NLCA1_NLCB4_ONLL0_PGR2_PLR1_PKA0_SGROBn1_SIA3_SS0_SU32_SUM0_SUS256_SPO0_SRVW0_SSO0_SVW8_SK0_SKFTR0_SKXCCM0_SGRO0_TIN0_TLDS1_TLDSM1_ULSGRO0_USL1_UIOFGRO0_USFGROn1_VSn1_VWA1_VWB1_WSGRA0_WSGRB0_WS32_WG64_2_1_WGM8_WGMXCC1_WGMXCCGn1
    SolutionIndex: 75
    SolutionNameMin: Cijk_Alik_Bjlk_I8II_BH_SHB_HA_S_SCD_SAV_UserArgs_MT64x128x32_MI16x16x1_SN_LDSB0_AFC1_AG0_AFEM1_AFEM1_ASEM1_CLR1_CADS0_DTLA0_DTLB0_DTVA0_DTVB1_DTVSM0_DPLBn1_EPS0_ELFLR0_EMLLn1_FDSI0_GRPM1_GRVWA8_GRVWB8_GSUn1_GSUAMB_GSUC0_GSUWGMRR0_GLS0_ISA1201_IU1_K1_LDSTI0_LBSPPA128_LBSPPB0_LBSPPM0_LPA8_LPB0_LPM0_LRVW8_LWPMn1_MIAV1_MIWT1_8_MO40_MGRIPMn1_NTn1_NTA0_NTB0_NTC0_NTD0_NTM0_NEPBS0_NLCA1_NLCB2_ONLL0_PGR2_PLR1_PKA0_SGROBn1_SIA3_SS0_SU32_SUM0_SUS256_SPO0_SRVW0_SSO0_SVW8_SK0_SKFTR0_SKXCCM0_SGRO0_TIN0_TLDS1_TLDSM1_ULSGRO0_USL1_UIOFGRO0_USFGROn1_VSn1_VWA1_VWB1_WSGRA0_WSGRB0_WS32_WG64_2_1_WGM8_WGMXCC1_WGMXCCGn1
    SolutionIndex: 76
    SolutionNameMin: Cijk_Alik_Bjlk_I8II_BH_SHB_HA_S_SCD_SAV_UserArgs_MT32x128x32_MI16x16x1_SN_LDSB0_AFC1_AG0_AFEM1_AFEM1_ASEM32_CLR1_CADS0_DTLA0_DTLB0_DTVA1_DTVB1_DTVSM0_DPLBn1_EPS0_ELFLR0_EMLLn1_FDSI0_GRPM1_GRVWA8_GRVWB8_GSUn1_GSUAMB_GSUC0_GSUWGMRR0_GLS0_ISA1201_IU1_K1_LDSTI0_LBSPPA0_LBSPPB0_LBSPPM0_LPA0_LPB0_LPM0_LRVW8_LWPMn1_MIAV1_MIWT1_4_MO40_MGRIPMn1_NTn1_NTA0_NTB0_NTC0_NTD0_NTM0_NEPBS0_NLCA2_NLCB2_ONLL0_PGR1_PLR0_PKA0_SGROBn1_SIA3_SS0_SU32_SUM0_SUS256_SPO0_SRVW0_SSO0_SVW8_SK0_SKFTR0_SKXCCM0_SGRO0_TIN0_TLDS1_TLDSM1_ULSGRO0_USL1_UIOFGRO0_USFGROn1_VSn1_VWA1_VWB1_WSGRA0_WSGRB0_WS32_WG32_4_1_WGM8_WGMXCC1_WGMXCCGn1
    SolutionIndex: 77
    SolutionNameMin: Cijk_Alik_Bjlk_I8II_BH_SHB_HA_S_SCD_SAV_UserArgs_MT128x16x16_MI16x16x1_SN_LDSB1_AFC1_AG0_AFEM1_AFEM1_ASEM1_CLR1_CADS0_DTLA0_DTLB0_DTVA0_DTVB0_DTVSM0_DPLBn1_EPS1_ELFLR0_EMLLn1_FDSI0_GRPM1_GRVWA8_GRVWB8_GSUn1_GSUAMB_GSUC0_GSUWGMRR0_GLS0_ISA1201_IU1_K1_LDSTI0_LBSPPA128_LBSPPB128_LBSPPM0_LPA8_LPB16_LPM0_LRVW8_LWPMn1_MIAV1_MIWT8_1_MO40_MGRIPMn1_NTn1_NTA0_NTB0_NTC0_NTD0_NTM0_NEPBS0_NLCA1_NLCB1_ONLL0_PGR1_PLR1_PKA0_SGROBn1_SIA2_SS0_SU32_SUM0_SUS256_SPO0_SRVW0_SSO0_SVW8_SK0_SKFTR0_SKXCCM0_SGRO0_TIN0_TLDS1_TLDSM1_ULSGRO0_USL1_UIOFGRO0_USFGROn1_VSn1_VWA8_VWB1_WSGRA0_WSGRB0_WS32_WG16_2_1_WGM8_WGMXCC1_WGMXCCGn1
    SolutionIndex: 78
    SolutionNameMin: Cijk_Alik_Bjlk_I8II_BH_SHB_HA_S_SCD_SAV_UserArgs_MT128x32x64_MI16x16x1_SN_LDSB0_AFC1_AG0_AFEM1_AFEM1_ASEM1_CLR1_CADS0_DTLA0_DTLB0_DTVA0_DTVB1_DTVSM0_DPLBn1_EPS1_ELFLR0_EMLLn1_FDSI0_GRPM1_GRVWA8_GRVWB8_GSUn1_GSUAMB_GSUC0_GSUWGMRR0_GLS0_ISA1201_IU1_K1_LDSTI0_LBSPPA256_LBSPPB0_LBSPPM0_LPA8_LPB0_LPM0_LRVW8_LWPMn1_MIAV1_MIWT4_1_MO40_MGRIPMn1_NTn1_NTA0_NTB0_NTC0_NTD0_NTM0_NEPBS0_NLCA1_NLCB1_ONLL0_PGR1_PLR1_PKA0_SGROBn1_SIA3_SS1_SU32_SUM0_SUS256_SPO0_SRVW0_SSO0_SVW4_SK0_SKFTR0_SKXCCM0_SGRO0_TIN0_TLDS1_TLDSM1_ULSGRO0_USL1_UIOFGRO0_USFGROn1_VSn1_VWA4_VWB1_WSGRA0_WSGRB0_WS32_WG32_4_1_WGM8_WGMXCC1_WGMXCCGn1
    SolutionIndex: 79
    SolutionNameMin: Cijk_Alik_Bjlk_I8II_BH_SHB_HA_S_SCD_SAV_UserArgs_MT128x64x64_MI16x16x1_SN_LDSB0_AFC1_AG0_AFEM1_AFEM1_ASEM1_CLR1_CADS0_DTLA0_DTLB0_DTVA0_DTVB1_DTVSM0_DPLBn1_EPS1_ELFLR0_EMLLn1_FDSI0_GRPM1_GRVWA8_GRVWB8_GSUn1_GSUAMB_GSUC0_GSUWGMRR0_GLS0_ISA1201_IU1_K1_LDSTI0_LBSPPA512_LBSPPB0_LBSPPM0_LPA8_LPB0_LPM0_LRVW8_LWPMn1_MIAV1_MIWT8_1_MO40_MGRIPMn1_NTn1_NTA0_NTB0_NTC0_NTD0_NTM0_NEPBS0_NLCA1_NLCB1_ONLL0_PGR1_PLR1_PKA0_SGROBn1_SIA3_SS1_SU32_SUM0_SUS256_SPO0_SRVW0_SSO0_SVW8_SK0_SKFTR0_SKXCCM0_SGRO0_TIN0_TLDS1_TLDSM1_ULSGRO0_USL1_UIOFGRO0_USFGROn1_VSn1_VWA8_VWB1_WSGRA0_WSGRB0_WS32_WG16_8_1_WGM8_WGMXCC1_WGMXCCGn1
    SolutionIndex: 80
    SolutionNameMin: Cijk_Alik_Bjlk_I8II_BH_SHB_HA_S_SCD_SAV_UserArgs_MT128x64x32_MI16x16x1_SN_LDSB1_AFC1_AG0_AFEM1_AFEM1_ASEM1_CLR1_CADS0_DTLA0_DTLB0_DTVA0_DTVB0_DTVSM0_DPLBn1_EPS1_ELFLR0_EMLLn1_FDSI0_GRPM1_GRVWA8_GRVWB16_GSUn1_GSUAMB_GSUC0_GSUWGMRR0_GLS0_ISA1201_IU2_K1_LDSTI0_LBSPPA256_LBSPPB512_LBSPPM0_LPA8_LPB16_LPM0_LRVW8_LWPMn1_MIAV1_MIWT8_1_MO40_MGRIPMn1_NTn1_NTA0_NTB0_NTC0_NTD0_NTM0_NEPBS0_NLCA1_NLCB1_ONLL0_PGR1_PLR1_PKA0_SGROBn1_SIA2_SS0_SU32_SUM0_SUS256_SPO0_SRVW0_SSO0_SVW8_SK0_SKFTR0_SKXCCM0_SGRO0_TIN0_TLDS1_TLDSM1_ULSGRO0_USL1_UIOFGRO0_USFGROn1_VSn1_VWA8_VWB1_WSGRA0_WSGRB0_WS32_WG16_8_1_WGM8_WGMXCC1_WGMXCCGn1
    SolutionIndex: 81
    SolutionNameMin: Cijk_Alik_Bjlk_I8II_BH_SHB_HA_S_SCD_SAV_UserArgs_MT16x512x64_MI16x16x1_SN_LDSB0_AFC1_AG0_AFEM1_AFEM1_ASEM64_CLR1_CADS0_DTLA0_DTLB0_DTVA1_DTVB1_DTVSM0_DPLBn1_EPS0_ELFLR0_EMLLn1_FDSI0_GRPM1_GRVWA8_GRVWB8_GSUn1_GSUAMB_GSUC0_GSUWGMRR0_GLS0_ISA1201_IU1_K1_LDSTI0_LBSPPA0_LBSPPB0_LBSPPM0_LPA0_LPB0_LPM0_LRVW8_LWPMn1_MIAV1_MIWT1_8_MO40_MGRIPMn1_NTn1_NTA0_NTB0_NTC0_NTD0_NTM0_NEPBS0_NLCA4_NLCB4_ONLL0_PGR1_PLR0_PKA0_SGROBn1_SIA3_SS0_SU32_SUM0_SUS256_SPO0_SRVW0_SSO0_SVW8_SK0_SKFTR0_SKXCCM0_SGRO0_TIN0_TLDS1_TLDSM1_ULSGRO0_USL1_UIOFGRO0_USFGROn1_VSn1_VWA1_VWB1_WSGRA0_WSGRB0_WS32_WG16_8_1_WGM8_WGMXCC1_WGMXCCGn1
    SolutionIndex: 82
    SolutionNameMin: Cijk_Alik_Bjlk_I8II_BH_SHB_HA_S_SCD_SAV_UserArgs_MT128x64x64_MI16x16x1_SN_LDSB0_AFC1_AG0_AFEM1_AFEM1_ASEM1_CLR1_CADS0_DTLA0_DTLB0_DTVA0_DTVB1_DTVSM0_DPLBn1_EPS1_ELFLR0_EMLLn1_FDSI0_GRPM1_GRVWA8_GRVWB8_GSUn1_GSUAMB_GSUC0_GSUWGMRR0_GLS0_ISA1201_IU1_K1_LDSTI0_LBSPPA512_LBSPPB0_LBSPPM0_LPA8_LPB0_LPM0_LRVW8_LWPMn1_MIAV1_MIWT8_1_MO40_MGRIPMn1_NTn1_NTA0_NTB0_NTC0_NTD0_NTM0_NEPBS0_NLCA1_NLCB1_ONLL0_PGR1_PLR1_PKA0_SGROBn1_SIA3_SS0_SU32_SUM0_SUS256_SPO0_SRVW0_SSO0_SVW8_SK0_SKFTR0_SKXCCM0_SGRO0_TIN0_TLDS1_TLDSM1_ULSGRO0_USL1_UIOFGRO0_USFGROn1_VSn1_VWA8_VWB1_WSGRA0_WSGRB0_WS32_WG16_8_1_WGM8_WGMXCC1_WGMXCCGn1
    SolutionIndex: 83
    SolutionNameMin: Cijk_Alik_Bjlk_I8II_BH_SHB_HA_S_SCD_SAV_UserArgs_MT128x64x16_MI16x16x1_SN_LDSB1_AFC1_AG0_AFEM1_AFEM1_ASEM1_CLR1_CADS0_DTLA0_DTLB0_DTVA0_DTVB0_DTVSM0_DPLBn1_EPS0_ELFLR0_EMLLn1_FDSI0_GRPM1_GRVWA8_GRVWB8_GSUn1_GSUAMB_GSUC0_GSUWGMRR0_GLS0_ISA1201_IU1_K1_LDSTI0_LBSPPA128_LBSPPB512_LBSPPM0_LPA8_LPB16_LPM0_LRVW8_LWPMn1_MIAV1_MIWT8_1_MO40_MGRIPMn1_NTn1_NTA0_NTB0_NTC0_NTD0_NTM0_NEPBS0_NLCA1_NLCB1_ONLL0_PGR2_PLR1_PKA0_SGROBn1_SIA2_SS0_SU32_SUM0_SUS256_SPO0_SRVW0_SSO0_SVW8_SK0_SKFTR0_SKXCCM0_SGRO0_TIN0_TLDS1_TLDSM1_ULSGRO1_USL1_UIOFGRO0_USFGROn1_VSn1_VWA8_VWB1_WSGRA0_WSGRB0_WS32_WG16_8_1_WGM8_WGMXCC1_WGMXCCGn1
    SolutionIndex: 84
    SolutionNameMin: Cijk_Alik_Bjlk_I8II_BH_SHB_HA_S_SCD_SAV_UserArgs_MT32x32x64_MI16x16x1_SN_LDSB0_AFC1_AG0_AFEM1_AFEM1_ASEM1_CLR1_CADS0_DTLA0_DTLB0_DTVA0_DTVB1_DTVSM0_DPLBn1_EPS0_ELFLR0_EMLLn1_FDSI0_GRPM1_GRVWA8_GRVWB8_GSUn1_GSUAMB_GSUC0_GSUWGMRR0_GLS0_ISA1201_IU1_K1_LDSTI0_LBSPPA128_LBSPPB0_LBSPPM0_LPA8_LPB0_LPM0_LRVW8_LWPMn1_MIAV1_MIWT1_1_MO40_MGRIPMn1_NTn1_NTA0_NTB0_NTC0_NTD0_NTM0_NEPBS0_NLCA1_NLCB1_ONLL0_PGR2_PLR1_PKA0_SGROBn1_SIA3_SS1_SU32_SUM0_SUS256_SPO0_SRVW0_SSO0_SVW1_SK0_SKFTR0_SKXCCM0_SGRO0_TIN0_TLDS1_TLDSM1_ULSGRO0_USL1_UIOFGRO0_USFGROn1_VSn1_VWA1_VWB1_WSGRA0_WSGRB0_WS32_WG32_4_1_WGM8_WGMXCC1_WGMXCCGn1
    SolutionIndex: 85
    SolutionNameMin: Cijk_Alik_Bjlk_I8II_BH_SHB_HA_S_SCD_SAV_UserArgs_MT16x512x32_MI16x16x1_SN_LDSB0_AFC1_AG0_AFEM1_AFEM1_ASEM1_CLR1_CADS0_DTLA0_DTLB0_DTVA0_DTVB1_DTVSM0_DPLBn1_EPS1_ELFLR0_EMLLn1_FDSI0_GRPM1_GRVWA4_GRVWB8_GSUn1_GSUAMB_GSUC0_GSUWGMRR0_GLS0_ISA1201_IU1_K1_LDSTI0_LBSPPA128_LBSPPB0_LBSPPM0_LPA8_LPB0_LPM0_LRVW8_LWPMn1_MIAV1_MIWT1_8_MO40_MGRIPMn1_NTn1_NTA0_NTB0_NTC0_NTD0_NTM0_NEPBS0_NLCA1_NLCB2_ONLL0_PGR1_PLR1_PKA0_SGROBn1_SIA3_SS0_SU32_SUM0_SUS256_SPO0_SRVW0_SSO0_SVW8_SK0_SKFTR0_SKXCCM0_SGRO0_TIN0_TLDS1_TLDSM1_ULSGRO0_USL1_UIOFGRO0_USFGROn1_VSn1_VWA1_VWB1_WSGRA0_WSGRB0_WS32_WG16_8_1_WGM8_WGMXCC1_WGMXCCGn1
    SolutionIndex: 86
    SolutionNameMin: Cijk_Alik_Bjlk_I8II_BH_SHB_HA_S_SCD_SAV_UserArgs_MT128x64x16_MI16x16x1_SN_LDSB1_AFC1_AG0_AFEM1_AFEM1_ASEM1_CLR1_CADS0_DTLA0_DTLB0_DTVA0_DTVB0_DTVSM0_DPLBn1_EPS1_ELFLR0_EMLLn1_FDSI0_GRPM1_GRVWA8_GRVWB8_GSUn1_GSUAMB_GSUC0_GSUWGMRR0_GLS0_ISA1201_IU1_K1_LDSTI0_LBSPPA128_LBSPPB512_LBSPPM0_LPA8_LPB16_LPM0_LRVW8_LWPMn1_MIAV1_MIWT8_1_MO40_MGRIPMn1_NTn1_NTA0_NTB0_NTC0_NTD0_NTM0_NEPBS0_NLCA1_NLCB1_ONLL0_PGR1_PLR1_PKA0_SGROBn1_SIA2_SS1_SU32_SUM0_SUS256_SPO0_SRVW0_SSO0_SVW8_SK0_SKFTR0_SKXCCM0_SGRO0_TIN0_TLDS1_TLDSM1_ULSGRO0_USL1_UIOFGRO0_USFGROn1_VSn1_VWA8_VWB1_WSGRA0_WSGRB0_WS32_WG16_8_1_WGM8_WGMXCC1_WGMXCCGn1
    SolutionIndex: 87
    SolutionNameMin: Cijk_Alik_Bjlk_I8II_BH_SHB_HA_S_SCD_SAV_UserArgs_MT128x32x32_MI16x16x1_SN_LDSB1_AFC1_AG0_AFEM1_AFEM1_ASEM1_CLR1_CADS0_DTLA0_DTLB0_DTVA0_DTVB0_DTVSM0_DPLBn1_EPS0_ELFLR0_EMLLn1_FDSI0_GRPM1_GRVWA8_GRVWB8_GSUn1_GSUAMB_GSUC0_GSUWGMRR0_GLS0_ISA1201_IU2_K1_LDSTI0_LBSPPA128_LBSPPB256_LBSPPM0_LPA8_LPB16_LPM0_LRVW8_LWPMn1_MIAV1_MIWT4_1_MO40_MGRIPMn1_NTn1_NTA0_NTB0_NTC0_NTD0_NTM0_NEPBS0_NLCA1_NLCB1_ONLL0_PGR2_PLR1_PKA0_SGROBn1_SIA2_SS1_SU32_SUM0_SUS256_SPO0_SRVW0_SSO0_SVW4_SK0_SKFTR0_SKXCCM0_SGRO0_TIN0_TLDS1_TLDSM1_ULSGRO0_USL1_UIOFGRO0_USFGROn1_VSn1_VWA4_VWB1_WSGRA0_WSGRB0_WS32_WG32_4_1_WGM8_WGMXCC1_WGMXCCGn1
    SolutionIndex: 88
    SolutionNameMin: Cijk_Alik_Bjlk_I8II_BH_SHB_HA_S_SCD_SAV_UserArgs_MT16x512x32_MI16x16x1_SN_LDSB0_AFC1_AG0_AFEM1_AFEM1_ASEM1_CLR1_CADS0_DTLA0_DTLB0_DTVA0_DTVB1_DTVSM0_DPLBn1_EPS0_ELFLR0_EMLLn1_FDSI0_GRPM1_GRVWA4_GRVWB8_GSUn1_GSUAMB_GSUC0_GSUWGMRR0_GLS0_ISA1201_IU1_K1_LDSTI0_LBSPPA128_LBSPPB0_LBSPPM0_LPA8_LPB0_LPM0_LRVW8_LWPMn1_MIAV1_MIWT1_8_MO40_MGRIPMn1_NTn1_NTA0_NTB0_NTC0_NTD0_NTM0_NEPBS0_NLCA1_NLCB2_ONLL0_PGR2_PLR1_PKA0_SGROBn1_SIA3_SS0_SU32_SUM0_SUS256_SPO0_SRVW0_SSO0_SVW8_SK0_SKFTR0_SKXCCM0_SGRO0_TIN0_TLDS1_TLDSM1_ULSGRO0_USL1_UIOFGRO0_USFGROn1_VSn1_VWA1_VWB1_WSGRA0_WSGRB0_WS32_WG16_8_1_WGM8_WGMXCC1_WGMXCCGn1
    SolutionIndex: 89
    SolutionNameMin: Cijk_Alik_Bjlk_I8II_BH_SHB_HA_S_SCD_SAV_UserArgs_MT128x32x32_MI16x16x1_SN_LDSB0_AFC1_AG0_AFEM1_AFEM1_ASEM1_CLR1_CADS0_DTLA0_DTLB0_DTVA0_DTVB1_DTVSM0_DPLBn1_EPS1_ELFLR0_EMLLn1_FDSI0_GRPM1_GRVWA8_GRVWB8_GSUn1_GSUAMB_GSUC0_GSUWGMRR0_GLS0_ISA1201_IU1_K1_LDSTI0_LBSPPA128_LBSPPB0_LBSPPM0_LPA8_LPB0_LPM0_LRVW8_LWPMn1_MIAV1_MIWT4_1_MO40_MGRIPMn1_NTn1_NTA0_NTB0_NTC0_NTD0_NTM0_NEPBS0_NLCA1_NLCB1_ONLL0_PGR1_PLR1_PKA0_SGROBn1_SIA3_SS0_SU32_SUM0_SUS256_SPO0_SRVW0_SSO0_SVW8_SK0_SKFTR0_SKXCCM0_SGRO0_TIN0_TLDS1_TLDSM1_ULSGRO0_USL1_UIOFGRO0_USFGROn1_VSn1_VWA4_VWB1_WSGRA0_WSGRB0_WS32_WG32_4_1_WGM8_WGMXCC1_WGMXCCGn1
    SolutionIndex: 90
    SolutionNameMin: Cijk_Alik_Bjlk_I8II_BH_SHB_HA_S_SCD_SAV_UserArgs_MT128x64x16_MI16x16x1_SN_LDSB0_AFC1_AG0_AFEM1_AFEM1_ASEM1_CLR0_CADS0_DTLA0_DTLB0_DTVA0_DTVB0_DTVSM0_DPLBn1_EPS0_ELFLR0_EMLLn1_FDSI0_GRPM1_GRVWA8_GRVWB8_GSUn1_GSUAMB_GSUC0_GSUWGMRR0_GLS0_ISA1201_IU1_K1_LDSTI0_LBSPPA128_LBSPPB512_LBSPPM0_LPA8_LPB16_LPM0_LRVW8_LWPMn1_MIAV1_MIWT8_1_MO40_MGRIPMn1_NTn1_NTA0_NTB0_NTC0_NTD0_NTM0_NEPBS0_NLCA1_NLCB1_ONLL0_PGR2_PLR0_PKA0_SGROBn1_SIA3_SS0_SU32_SUM0_SUS256_SPO0_SRVW0_SSO0_SVW8_SK0_SKFTR0_SKXCCM0_SGRO0_TIN0_TLDS1_TLDSM1_ULSGRO0_USL1_UIOFGRO0_USFGROn1_VSn1_VWA8_VWB1_WSGRA0_WSGRB0_WS32_WG16_8_1_WGM8_WGMXCC1_WGMXCCGn1
    SolutionIndex: 91
    SolutionNameMin: Cijk_Alik_Bjlk_I8II_BH_SHB_HA_S_SCD_SAV_UserArgs_MT128x32x32_MI16x16x1_SN_LDSB0_AFC1_AG0_AFEM1_AFEM1_ASEM1_CLR1_CADS0_DTLA0_DTLB0_DTVA0_DTVB1_DTVSM0_DPLBn1_EPS0_ELFLR0_EMLLn1_FDSI0_GRPM1_GRVWA8_GRVWB8_GSUn1_GSUAMB_GSUC0_GSUWGMRR0_GLS0_ISA1201_IU1_K1_LDSTI0_LBSPPA128_LBSPPB0_LBSPPM0_LPA8_LPB0_LPM0_LRVW8_LWPMn1_MIAV1_MIWT4_1_MO40_MGRIPMn1_NTn1_NTA0_NTB0_NTC0_NTD0_NTM0_NEPBS0_NLCA1_NLCB1_ONLL0_PGR2_PLR1_PKA0_SGROBn1_SIA3_SS0_SU32_SUM0_SUS256_SPO0_SRVW0_SSO0_SVW8_SK0_SKFTR0_SKXCCM0_SGRO0_TIN0_TLDS1_TLDSM1_ULSGRO0_USL1_UIOFGRO0_USFGROn1_VSn1_VWA4_VWB1_WSGRA0_WSGRB0_WS32_WG32_4_1_WGM8_WGMXCC1_WGMXCCGn1
    SolutionIndex: 92
    SolutionNameMin: Cijk_Alik_Bjlk_I8II_BH_SHB_HA_S_SCD_SAV_UserArgs_MT128x64x32_MI16x16x1_SN_LDSB0_AFC1_AG0_AFEM1_AFEM1_ASEM1_CLR1_CADS0_DTLA0_DTLB0_DTVA0_DTVB1_DTVSM0_DPLBn1_EPS1_ELFLR0_EMLLn1_FDSI0_GRPM1_GRVWA8_GRVWB8_GSUn1_GSUAMB_GSUC0_GSUWGMRR0_GLS0_ISA1201_IU1_K1_LDSTI0_LBSPPA256_LBSPPB0_LBSPPM0_LPA8_LPB0_LPM0_LRVW8_LWPMn1_MIAV1_MIWT8_1_MO40_MGRIPMn1_NTn1_NTA0_NTB0_NTC0_NTD0_NTM0_NEPBS0_NLCA1_NLCB1_ONLL0_PGR1_PLR1_PKA0_SGROBn1_SIA3_SS0_SU32_SUM0_SUS256_SPO0_SRVW0_SSO0_SVW8_SK0_SKFTR0_SKXCCM0_SGRO0_TIN0_TLDS1_TLDSM1_ULSGRO0_USL1_UIOFGRO0_USFGROn1_VSn1_VWA8_VWB1_WSGRA0_WSGRB0_WS32_WG16_8_1_WGM8_WGMXCC1_WGMXCCGn1
    SolutionIndex: 93
    SolutionNameMin: Cijk_Alik_Bjlk_I8II_BH_SHB_HA_S_SCD_SAV_UserArgs_MT64x128x64_MI16x16x1_SN_LDSB0_AFC1_AG0_AFEM1_AFEM1_ASEM64_CLR1_CADS0_DTLA0_DTLB0_DTVA1_DTVB1_DTVSM0_DPLBn1_EPS0_ELFLR0_EMLLn1_FDSI0_GRPM1_GRVWA8_GRVWB8_GSUn1_GSUAMB_GSUC0_GSUWGMRR0_GLS0_ISA1201_IU1_K1_LDSTI0_LBSPPA0_LBSPPB0_LBSPPM0_LPA0_LPB0_LPM0_LRVW8_LWPMn1_MIAV1_MIWT1_8_MO40_MGRIPMn1_NTn1_NTA0_NTB0_NTC0_NTD0_NTM0_NEPBS0_NLCA4_NLCB4_ONLL0_PGR1_PLR0_PKA0_SGROBn1_SIA3_SS0_SU32_SUM0_SUS256_SPO0_SRVW0_SSO0_SVW8_SK0_SKFTR0_SKXCCM0_SGRO0_TIN0_TLDS1_TLDSM1_ULSGRO0_USL1_UIOFGRO0_USFGROn1_VSn1_VWA1_VWB1_WSGRA0_WSGRB0_WS32_WG64_2_1_WGM8_WGMXCC1_WGMXCCGn1
    SolutionIndex: 94
    SolutionNameMin: Cijk_Alik_Bjlk_I8II_BH_SHB_HA_S_SCD_SAV_UserArgs_MT64x128x32_MI16x16x1_SN_LDSB0_AFC1_AG0_AFEM1_AFEM1_ASEM32_CLR1_CADS0_DTLA0_DTLB0_DTVA1_DTVB1_DTVSM0_DPLBn1_EPS0_ELFLR0_EMLLn1_FDSI0_GRPM1_GRVWA8_GRVWB8_GSUn1_GSUAMB_GSUC0_GSUWGMRR0_GLS0_ISA1201_IU1_K1_LDSTI0_LBSPPA0_LBSPPB0_LBSPPM0_LPA0_LPB0_LPM0_LRVW8_LWPMn1_MIAV1_MIWT1_8_MO40_MGRIPMn1_NTn1_NTA0_NTB0_NTC0_NTD0_NTM0_NEPBS0_NLCA2_NLCB2_ONLL0_PGR1_PLR0_PKA0_SGROBn1_SIA3_SS0_SU32_SUM0_SUS256_SPO0_SRVW0_SSO0_SVW8_SK0_SKFTR0_SKXCCM0_SGRO0_TIN0_TLDS1_TLDSM1_ULSGRO0_USL1_UIOFGRO0_USFGROn1_VSn1_VWA1_VWB1_WSGRA0_WSGRB0_WS32_WG64_2_1_WGM8_WGMXCC1_WGMXCCGn1
    SolutionIndex: 95
    SolutionNameMin: Cijk_Alik_Bjlk_I8II_BH_SHB_HA_S_SCD_SAV_UserArgs_MT64x128x16_MI16x16x1_SN_LDSB0_AFC1_AG0_AFEM1_AFEM1_ASEM16_CLR1_CADS0_DTLA0_DTLB0_DTVA1_DTVB1_DTVSM0_DPLBn1_EPS0_ELFLR0_EMLLn1_FDSI0_GRPM1_GRVWA8_GRVWB8_GSUn1_GSUAMB_GSUC0_GSUWGMRR0_GLS0_ISA1201_IU1_K1_LDSTI0_LBSPPA0_LBSPPB0_LBSPPM0_LPA0_LPB0_LPM0_LRVW8_LWPMn1_MIAV1_MIWT1_8_MO40_MGRIPMn1_NTn1_NTA0_NTB0_NTC0_NTD0_NTM0_NEPBS0_NLCA1_NLCB1_ONLL0_PGR1_PLR0_PKA0_SGROBn1_SIA3_SS0_SU32_SUM0_SUS256_SPO0_SRVW0_SSO0_SVW8_SK0_SKFTR0_SKXCCM0_SGRO0_TIN0_TLDS1_TLDSM1_ULSGRO0_USL1_UIOFGRO0_USFGROn1_VSn1_VWA1_VWB1_WSGRA0_WSGRB0_WS32_WG64_2_1_WGM8_WGMXCC1_WGMXCCGn1
    SolutionIndex: 96
    SolutionNameMin: Cijk_Alik_Bjlk_I8II_BH_SHB_HA_S_SCD_SAV_UserArgs_MT16x128x16_MI16x16x1_SN_LDSB0_AFC1_AG0_AFEM1_AFEM1_ASEM16_CLR1_CADS0_DTLA0_DTLB0_DTVA1_DTVB1_DTVSM0_DPLBn1_EPS0_ELFLR0_EMLLn1_FDSI0_GRPM1_GRVWA8_GRVWB8_GSUn1_GSUAMB_GSUC0_GSUWGMRR0_GLS0_ISA1201_IU1_K1_LDSTI0_LBSPPA0_LBSPPB0_LBSPPM0_LPA0_LPB0_LPM0_LRVW8_LWPMn1_MIAV1_MIWT1_8_MO40_MGRIPMn1_NTn1_NTA0_NTB0_NTC0_NTD0_NTM0_NEPBS0_NLCA1_NLCB1_ONLL0_PGR1_PLR0_PKA0_SGROBn1_SIA3_SS0_SU32_SUM0_SUS256_SPO0_SRVW0_SSO0_SVW8_SK0_SKFTR0_SKXCCM0_SGRO0_TIN0_TLDS1_TLDSM1_ULSGRO0_USL1_UIOFGRO0_USFGROn1_VSn1_VWA1_VWB1_WSGRA0_WSGRB0_WS32_WG16_2_1_WGM8_WGMXCC1_WGMXCCGn1
    SolutionIndex: 97
    SolutionNameMin: Cijk_Alik_Bjlk_I8II_BH_SHB_HA_S_SCD_SAV_UserArgs_MT128x128x32_MI16x16x1_SN_LDSB0_AFC1_AG0_AFEM1_AFEM1_ASEM32_CLR1_CADS0_DTLA0_DTLB0_DTVA1_DTVB1_DTVSM0_DPLBn1_EPS0_ELFLR0_EMLLn1_FDSI0_GRPM1_GRVWA8_GRVWB8_GSUn1_GSUAMB_GSUC0_GSUWGMRR0_GLS0_ISA1201_IU1_K1_LDSTI0_LBSPPA0_LBSPPB0_LBSPPM0_LPA0_LPB0_LPM0_LRVW8_LWPMn1_MIAV1_MIWT4_4_MO40_MGRIPMn1_NTn1_NTA0_NTB0_NTC0_NTD0_NTM0_NEPBS0_NLCA2_NLCB2_ONLL0_PGR1_PLR0_PKA0_SGROBn1_SIA3_SS0_SU32_SUM0_SUS256_SPO0_SRVW0_SSO0_SVW8_SK0_SKFTR0_SKXCCM0_SGRO0_TIN0_TLDS1_TLDSM1_ULSGRO0_USL1_UIOFGRO0_USFGROn1_VSn1_VWA4_VWB1_WSGRA0_WSGRB0_WS32_WG32_4_1_WGM8_WGMXCC1_WGMXCCGn1
    SolutionIndex: 98
    SolutionNameMin: Cijk_Alik_Bjlk_I8II_BH_SHB_HA_S_SCD_SAV_UserArgs_MT16x16x32_MI16x16x1_SN_LDSB1_AFC1_AG0_AFEM1_AFEM1_ASEM1_CLR1_CADS0_DTLA0_DTLB0_DTVA0_DTVB0_DTVSM0_DPLBn1_EPS0_ELFLR0_EMLLn1_FDSI0_GRPM1_GRVWA8_GRVWB8_GSUn1_GSUAMB_GSUC0_GSUWGMRR0_GLS0_ISA1201_IU2_K1_LDSTI0_LBSPPA128_LBSPPB128_LBSPPM0_LPA8_LPB16_LPM0_LRVW8_LWPMn1_MIAV1_MIWT1_1_MO40_MGRIPMn1_NTn1_NTA0_NTB0_NTC0_NTD0_NTM0_NEPBS0_NLCA1_NLCB1_ONLL0_PGR2_PLR1_PKA0_SGROBn1_SIA2_SS0_SU32_SUM0_SUS256_SPO0_SRVW0_SSO0_SVW8_SK0_SKFTR0_SKXCCM0_SGRO0_TIN0_TLDS1_TLDSM1_ULSGRO1_USL1_UIOFGRO0_USFGROn1_VSn1_VWA1_VWB1_WSGRA0_WSGRB0_WS32_WG16_2_1_WGM8_WGMXCC1_WGMXCCGn1
    SolutionIndex: 99
    SolutionNameMin: Cijk_Alik_Bjlk_I8II_BH_SHB_HA_S_SCD_SAV_UserArgs_MT128x64x32_MI16x16x1_SN_LDSB1_AFC1_AG0_AFEM1_AFEM1_ASEM1_CLR1_CADS0_DTLA0_DTLB0_DTVA0_DTVB0_DTVSM0_DPLBn1_EPS0_ELFLR0_EMLLn1_FDSI0_GRPM1_GRVWA8_GRVWB8_GSUn1_GSUAMB_GSUC0_GSUWGMRR0_GLS0_ISA1201_IU2_K1_LDSTI0_LBSPPA256_LBSPPB512_LBSPPM0_LPA8_LPB16_LPM0_LRVW8_LWPMn1_MIAV1_MIWT8_1_MO40_MGRIPMn1_NTn1_NTA0_NTB0_NTC0_NTD0_NTM0_NEPBS0_NLCA1_NLCB1_ONLL0_PGR2_PLR1_PKA0_SGROBn1_SIA2_SS0_SU32_SUM0_SUS256_SPO0_SRVW0_SSO0_SVW8_SK0_SKFTR0_SKXCCM0_SGRO0_TIN0_TLDS1_TLDSM1_ULSGRO1_USL1_UIOFGRO0_USFGROn1_VSn1_VWA8_VWB1_WSGRA0_WSGRB0_WS32_WG16_8_1_WGM8_WGMXCC1_WGMXCCGn1
    SolutionIndex: 100
    SolutionNameMin: Cijk_Alik_Bjlk_I8II_BH_SHB_HA_S_SCD_SAV_UserArgs_MT128x32x32_MI16x16x1_SN_LDSB0_AFC1_AG0_AFEM1_AFEM1_ASEM32_CLR1_CADS0_DTLA0_DTLB0_DTVA1_DTVB1_DTVSM0_DPLBn1_EPS0_ELFLR0_EMLLn1_FDSI0_GRPM1_GRVWA8_GRVWB8_GSUn1_GSUAMB_GSUC0_GSUWGMRR0_GLS0_ISA1201_IU1_K1_LDSTI0_LBSPPA0_LBSPPB0_LBSPPM0_LPA0_LPB0_LPM0_LRVW8_LWPMn1_MIAV1_MIWT4_1_MO40_MGRIPMn1_NTn1_NTA0_NTB0_NTC0_NTD0_NTM0_NEPBS0_NLCA2_NLCB1_ONLL0_PGR1_PLR0_PKA0_SGROBn1_SIA3_SS0_SU32_SUM0_SUS256_SPO0_SRVW0_SSO0_SVW8_SK0_SKFTR0_SKXCCM0_SGRO0_TIN0_TLDS1_TLDSM1_ULSGRO0_USL1_UIOFGRO0_USFGROn1_VSn1_VWA4_VWB1_WSGRA0_WSGRB0_WS32_WG32_4_1_WGM8_WGMXCC1_WGMXCCGn1
    SolutionIndex: 101
    SolutionNameMin: Cijk_Alik_Bjlk_I8II_BH_SHB_HA_S_SCD_SAV_UserArgs_MT128x64x32_MI16x16x1_SN_LDSB0_AFC1_AG0_AFEM1_AFEM1_ASEM1_CLR1_CADS0_DTLA0_DTLB0_DTVA0_DTVB0_DTVSM0_DPLBn1_EPS0_ELFLR0_EMLLn1_FDSI0_GRPM1_GRVWA8_GRVWB8_GSUn1_GSUAMB_GSUC0_GSUWGMRR0_GLS0_ISA1201_IU1_K1_LDSTI0_LBSPPA256_LBSPPB512_LBSPPM0_LPA8_LPB16_LPM0_LRVW8_LWPMn1_MIAV1_MIWT8_1_MO40_MGRIPMn1_NTn1_NTA0_NTB0_NTC0_NTD0_NTM0_NEPBS0_NLCA1_NLCB1_ONLL0_PGR2_PLR1_PKA0_SGROBn1_SIA3_SS1_SU32_SUM0_SUS256_SPO0_SRVW0_SSO0_SVW8_SK0_SKFTR0_SKXCCM0_SGRO0_TIN0_TLDS1_TLDSM1_ULSGRO1_USL1_UIOFGRO0_USFGROn1_VSn1_VWA8_VWB1_WSGRA0_WSGRB0_WS32_WG16_8_1_WGM8_WGMXCC1_WGMXCCGn1
    SolutionIndex: 102
    SolutionNameMin: Cijk_Alik_Bjlk_I8II_BH_SHB_HA_S_SCD_SAV_UserArgs_MT16x256x64_MI16x16x1_SN_LDSB0_AFC1_AG0_AFEM1_AFEM1_ASEM1_CLR1_CADS0_DTLA0_DTLB0_DTVA0_DTVB1_DTVSM0_DPLBn1_EPS1_ELFLR0_EMLLn1_FDSI0_GRPM1_GRVWA8_GRVWB8_GSUn1_GSUAMB_GSUC0_GSUWGMRR0_GLS0_ISA1201_IU1_K1_LDSTI0_LBSPPA128_LBSPPB0_LBSPPM0_LPA8_LPB0_LPM0_LRVW8_LWPMn1_MIAV1_MIWT1_8_MO40_MGRIPMn1_NTn1_NTA0_NTB0_NTC0_NTD0_NTM0_NEPBS0_NLCA1_NLCB4_ONLL0_PGR1_PLR1_PKA0_SGROBn1_SIA3_SS0_SU32_SUM0_SUS256_SPO0_SRVW0_SSO0_SVW8_SK0_SKFTR0_SKXCCM0_SGRO0_TIN0_TLDS1_TLDSM1_ULSGRO0_USL1_UIOFGRO0_USFGROn1_VSn1_VWA1_VWB1_WSGRA0_WSGRB0_WS32_WG16_4_1_WGM8_WGMXCC1_WGMXCCGn1
    SolutionIndex: 103
    SolutionNameMin: Cijk_Alik_Bjlk_I8II_BH_SHB_HA_S_SCD_SAV_UserArgs_MT64x64x32_MI16x16x1_SN_LDSB0_AFC1_AG0_AFEM1_AFEM1_ASEM32_CLR1_CADS0_DTLA0_DTLB0_DTVA1_DTVB1_DTVSM0_DPLBn1_EPS0_ELFLR0_EMLLn1_FDSI0_GRPM1_GRVWA8_GRVWB8_GSUn1_GSUAMB_GSUC0_GSUWGMRR0_GLS0_ISA1201_IU1_K1_LDSTI0_LBSPPA0_LBSPPB0_LBSPPM0_LPA0_LPB0_LPM0_LRVW8_LWPMn1_MIAV1_MIWT2_2_MO40_MGRIPMn1_NTn1_NTA0_NTB0_NTC0_NTD0_NTM0_NEPBS0_NLCA2_NLCB2_ONLL0_PGR1_PLR0_PKA0_SGROBn1_SIA3_SS1_SU32_SUM0_SUS256_SPO0_SRVW0_SSO0_SVW2_SK0_SKFTR0_SKXCCM0_SGRO0_TIN0_TLDS1_TLDSM1_ULSGRO0_USL1_UIOFGRO0_USFGROn1_VSn1_VWA2_VWB1_WSGRA0_WSGRB0_WS32_WG32_4_1_WGM8_WGMXCC1_WGMXCCGn1
    SolutionIndex: 104
    SolutionNameMin: Cijk_Alik_Bjlk_I8II_BH_SHB_HA_S_SCD_SAV_UserArgs_MT128x32x32_MI16x16x1_SN_LDSB0_AFC1_AG0_AFEM1_AFEM1_ASEM32_CLR1_CADS0_DTLA0_DTLB0_DTVA1_DTVB1_DTVSM0_DPLBn1_EPS0_ELFLR0_EMLLn1_FDSI0_GRPM1_GRVWA8_GRVWB8_GSUn1_GSUAMB_GSUC0_GSUWGMRR0_GLS0_ISA1201_IU1_K1_LDSTI0_LBSPPA0_LBSPPB0_LBSPPM0_LPA0_LPB0_LPM0_LRVW8_LWPMn1_MIAV1_MIWT4_1_MO40_MGRIPMn1_NTn1_NTA0_NTB0_NTC0_NTD0_NTM0_NEPBS0_NLCA2_NLCB1_ONLL0_PGR1_PLR0_PKA0_SGROBn1_SIA3_SS1_SU32_SUM0_SUS256_SPO0_SRVW0_SSO0_SVW4_SK0_SKFTR0_SKXCCM0_SGRO0_TIN0_TLDS1_TLDSM1_ULSGRO0_USL1_UIOFGRO0_USFGROn1_VSn1_VWA4_VWB1_WSGRA0_WSGRB0_WS32_WG32_4_1_WGM8_WGMXCC1_WGMXCCGn1
    SolutionIndex: 105
    SolutionNameMin: Cijk_Alik_Bjlk_I8II_BH_SHB_HA_S_SCD_SAV_UserArgs_MT128x128x64_MI16x16x1_SN_LDSB1_AFC1_AG0_AFEM1_AFEM1_ASEM1_CLR1_CADS0_DTLA0_DTLB0_DTVA0_DTVB0_DTVSM0_DPLBn1_EPS1_ELFLR0_EMLLn1_FDSI0_GRPM1_GRVWA16_GRVWB16_GSUn1_GSUAMB_GSUC0_GSUWGMRR0_GLS0_ISA1201_IU1_K1_LDSTI0_LBSPPA256_LBSPPB2048_LBSPPM0_LPA32_LPB64_LPM0_LRVW16_LWPMn1_MIAV1_MIWT4_4_MO40_MGRIPMn1_NTn1_NTA0_NTB0_NTC0_NTD0_NTM0_NEPBS0_NLCA1_NLCB1_ONLL0_PGR1_PLR1_PKA0_SGROBn1_SIA3_SS0_SU32_SUM0_SUS256_SPO0_SRVW0_SSO0_SVW8_SK0_SKFTR0_SKXCCM0_SGRO0_TIN0_TLDS1_TLDSM1_ULSGRO0_USL1_UIOFGRO0_USFGROn1_VSn1_VWA4_VWB4_WSGRA0_WSGRB0_WS32_WG32_4_1_WGM8_WGMXCC1_WGMXCCGn1
    SolutionIndex: 106
    SolutionNameMin: Cijk_Alik_Bjlk_I8II_BH_SHB_HA_S_SCD_SAV_UserArgs_MT128x64x32_MI16x16x1_SN_LDSB0_AFC1_AG0_AFEM1_AFEM1_ASEM1_CLR1_CADS0_DTLA0_DTLB0_DTVA0_DTVB1_DTVSM0_DPLBn1_EPS0_ELFLR0_EMLLn1_FDSI0_GRPM1_GRVWA8_GRVWB8_GSUn1_GSUAMB_GSUC0_GSUWGMRR0_GLS0_ISA1201_IU1_K1_LDSTI0_LBSPPA256_LBSPPB0_LBSPPM0_LPA8_LPB0_LPM0_LRVW8_LWPMn1_MIAV1_MIWT8_1_MO40_MGRIPMn1_NTn1_NTA0_NTB0_NTC0_NTD0_NTM0_NEPBS0_NLCA1_NLCB1_ONLL0_PGR2_PLR1_PKA0_SGROBn1_SIA3_SS0_SU32_SUM0_SUS256_SPO0_SRVW0_SSO0_SVW8_SK0_SKFTR0_SKXCCM0_SGRO0_TIN0_TLDS1_TLDSM1_ULSGRO0_USL1_UIOFGRO0_USFGROn1_VSn1_VWA8_VWB1_WSGRA0_WSGRB0_WS32_WG16_8_1_WGM8_WGMXCC1_WGMXCCGn1
    SolutionIndex: 107
    SolutionNameMin: Cijk_Alik_Bjlk_I8II_BH_SHB_HA_S_SCD_SAV_UserArgs_MT128x64x16_MI16x16x1_SN_LDSB1_AFC1_AG0_AFEM1_AFEM1_ASEM1_CLR1_CADS0_DTLA0_DTLB0_DTVA0_DTVB0_DTVSM0_DPLBn1_EPS1_ELFLR0_EMLLn1_FDSI0_GRPM1_GRVWA8_GRVWB8_GSUn1_GSUAMB_GSUC0_GSUWGMRR0_GLS0_ISA1201_IU1_K1_LDSTI0_LBSPPA128_LBSPPB512_LBSPPM0_LPA8_LPB16_LPM0_LRVW8_LWPMn1_MIAV1_MIWT8_1_MO40_MGRIPMn1_NTn1_NTA0_NTB0_NTC0_NTD0_NTM0_NEPBS0_NLCA1_NLCB1_ONLL0_PGR1_PLR1_PKA0_SGROBn1_SIA2_SS0_SU32_SUM0_SUS256_SPO0_SRVW0_SSO0_SVW8_SK0_SKFTR0_SKXCCM0_SGRO0_TIN0_TLDS1_TLDSM1_ULSGRO0_USL1_UIOFGRO0_USFGROn1_VSn1_VWA8_VWB1_WSGRA0_WSGRB0_WS32_WG16_8_1_WGM8_WGMXCC1_WGMXCCGn1
    SolutionIndex: 108
    SolutionNameMin: Cijk_Alik_Bjlk_I8II_BH_SHB_HA_S_SCD_SAV_UserArgs_MT128x64x16_MI16x16x1_SN_LDSB0_AFC1_AG0_AFEM1_AFEM1_ASEM1_CLR0_CADS0_DTLA0_DTLB0_DTVA0_DTVB0_DTVSM0_DPLBn1_EPS1_ELFLR0_EMLLn1_FDSI0_GRPM1_GRVWA8_GRVWB8_GSUn1_GSUAMB_GSUC0_GSUWGMRR0_GLS0_ISA1201_IU1_K1_LDSTI0_LBSPPA128_LBSPPB512_LBSPPM0_LPA8_LPB16_LPM0_LRVW8_LWPMn1_MIAV1_MIWT8_1_MO40_MGRIPMn1_NTn1_NTA0_NTB0_NTC0_NTD0_NTM0_NEPBS0_NLCA1_NLCB1_ONLL0_PGR1_PLR0_PKA0_SGROBn1_SIA3_SS1_SU32_SUM0_SUS256_SPO0_SRVW0_SSO0_SVW8_SK0_SKFTR0_SKXCCM0_SGRO0_TIN0_TLDS1_TLDSM1_ULSGRO0_USL1_UIOFGRO0_USFGROn1_VSn1_VWA8_VWB1_WSGRA0_WSGRB0_WS32_WG16_8_1_WGM8_WGMXCC1_WGMXCCGn1
    SolutionIndex: 109
    SolutionNameMin: Cijk_Alik_Bjlk_I8II_BH_SHB_HA_S_SCD_SAV_UserArgs_MT16x128x32_MI16x16x1_SN_LDSB0_AFC1_AG0_AFEM1_AFEM1_ASEM1_CLR1_CADS0_DTLA0_DTLB0_DTVA0_DTVB1_DTVSM0_DPLBn1_EPS0_ELFLR0_EMLLn1_FDSI0_GRPM1_GRVWA8_GRVWB8_GSUn1_GSUAMB_GSUC0_GSUWGMRR0_GLS0_ISA1201_IU1_K1_LDSTI0_LBSPPA128_LBSPPB0_LBSPPM0_LPA8_LPB0_LPM0_LRVW8_LWPMn1_MIAV1_MIWT1_8_MO40_MGRIPMn1_NTn1_NTA0_NTB0_NTC0_NTD0_NTM0_NEPBS0_NLCA1_NLCB2_ONLL0_PGR2_PLR1_PKA0_SGROBn1_SIA3_SS0_SU32_SUM0_SUS256_SPO0_SRVW0_SSO0_SVW8_SK0_SKFTR0_SKXCCM0_SGRO0_TIN0_TLDS1_TLDSM1_ULSGRO0_USL1_UIOFGRO0_USFGROn1_VSn1_VWA1_VWB1_WSGRA0_WSGRB0_WS32_WG16_2_1_WGM8_WGMXCC1_WGMXCCGn1
    SolutionIndex: 110
    SolutionNameMin: Cijk_Alik_Bjlk_I8II_BH_SHB_HA_S_SCD_SAV_UserArgs_MT512x16x64_MI16x16x1_SN_LDSB1_AFC1_AG0_AFEM1_AFEM1_ASEM1_CLR1_CADS0_DTLA0_DTLB0_DTVA0_DTVB0_DTVSM0_DPLBn1_EPS1_ELFLR0_EMLLn1_FDSI0_GRPM1_GRVWA16_GRVWB8_GSUn1_GSUAMB_GSUC0_GSUWGMRR0_GLS0_ISA1201_IU1_K1_LDSTI0_LBSPPA512_LBSPPB256_LBSPPM0_LPA32_LPB16_LPM0_LRVW16_LWPMn1_MIAV1_MIWT8_1_MO40_MGRIPMn1_NTn1_NTA0_NTB0_NTC0_NTD0_NTM0_NEPBS0_NLCA1_NLCB1_ONLL0_PGR1_PLR1_PKA0_SGROBn1_SIA3_SS1_SU32_SUM0_SUS256_SPO0_SRVW0_SSO0_SVW8_SK0_SKFTR0_SKXCCM0_SGRO0_TIN0_TLDS1_TLDSM1_ULSGRO0_USL1_UIOFGRO0_USFGROn1_VSn1_VWA8_VWB1_WSGRA0_WSGRB0_WS32_WG64_2_1_WGM8_WGMXCC1_WGMXCCGn1
    SolutionIndex: 111
    SolutionNameMin: Cijk_Alik_Bjlk_I8II_BH_SHB_HA_S_SCD_SAV_UserArgs_MT128x128x16_MI16x16x1_SN_LDSB0_AFC1_AG0_AFEM1_AFEM1_ASEM1_CLR0_CADS0_DTLA0_DTLB0_DTVA0_DTVB0_DTVSM0_DPLBn1_EPS1_ELFLR0_EMLLn1_FDSI0_GRPM1_GRVWA8_GRVWB16_GSUn1_GSUAMB_GSUC0_GSUWGMRR0_GLS0_ISA1201_IU1_K1_LDSTI0_LBSPPA128_LBSPPB1024_LBSPPM0_LPA8_LPB32_LPM0_LRVW8_LWPMn1_MIAV1_MIWT8_2_MO40_MGRIPMn1_NTn1_NTA0_NTB0_NTC0_NTD0_NTM0_NEPBS0_NLCA1_NLCB1_ONLL0_PGR1_PLR0_PKA0_SGROBn1_SIA3_SS1_SU32_SUM0_SUS256_SPO0_SRVW0_SSO0_SVW8_SK0_SKFTR0_SKXCCM0_SGRO0_TIN0_TLDS1_TLDSM1_ULSGRO0_USL1_UIOFGRO0_USFGROn1_VSn1_VWA8_VWB2_WSGRA0_WSGRB0_WS32_WG16_8_1_WGM8_WGMXCC1_WGMXCCGn1
    SolutionIndex: 112
    SolutionNameMin: Cijk_Alik_Bjlk_I8II_BH_SHB_HA_S_SCD_SAV_UserArgs_MT512x16x64_MI16x16x1_SN_LDSB1_AFC1_AG0_AFEM1_AFEM1_ASEM1_CLR1_CADS0_DTLA0_DTLB0_DTVA0_DTVB1_DTVSM0_DPLBn1_EPS1_ELFLR0_EMLLn1_FDSI0_GRPM1_GRVWA8_GRVWB8_GSUn1_GSUAMB_GSUC0_GSUWGMRR0_GLS0_ISA1201_IU1_K1_LDSTI0_LBSPPA512_LBSPPB0_LBSPPM0_LPA8_LPB0_LPM0_LRVW8_LWPMn1_MIAV1_MIWT8_1_MO40_MGRIPMn1_NTn1_NTA0_NTB0_NTC0_NTD0_NTM0_NEPBS0_NLCA1_NLCB1_ONLL0_PGR1_PLR1_PKA0_SGROBn1_SIA3_SS1_SU32_SUM0_SUS256_SPO0_SRVW0_SSO0_SVW8_SK0_SKFTR0_SKXCCM0_SGRO0_TIN0_TLDS1_TLDSM1_ULSGRO0_USL1_UIOFGRO0_USFGROn1_VSn1_VWA8_VWB1_WSGRA0_WSGRB0_WS32_WG64_2_1_WGM8_WGMXCC1_WGMXCCGn1
    SolutionIndex: 113
    SolutionNameMin: Cijk_Alik_Bjlk_I8II_BH_SHB_HA_S_SCD_SAV_UserArgs_MT32x16x64_MI16x16x1_SN_LDSB0_AFC1_AG0_AFEM1_AFEM1_ASEM1_CLR1_CADS0_DTLA0_DTLB0_DTVA0_DTVB1_DTVSM0_DPLBn1_EPS0_ELFLR0_EMLLn1_FDSI0_GRPM1_GRVWA8_GRVWB8_GSUn1_GSUAMB_GSUC0_GSUWGMRR0_GLS0_ISA1201_IU1_K1_LDSTI0_LBSPPA128_LBSPPB0_LBSPPM0_LPA8_LPB0_LPM0_LRVW8_LWPMn1_MIAV1_MIWT1_1_MO40_MGRIPMn1_NTn1_NTA0_NTB0_NTC0_NTD0_NTM0_NEPBS0_NLCA1_NLCB1_ONLL0_PGR2_PLR1_PKA0_SGROBn1_SIA3_SS1_SU32_SUM0_SUS256_SPO0_SRVW0_SSO0_SVW1_SK0_SKFTR0_SKXCCM0_SGRO0_TIN0_TLDS1_TLDSM1_ULSGRO0_USL1_UIOFGRO0_USFGROn1_VSn1_VWA1_VWB1_WSGRA0_WSGRB0_WS32_WG32_2_1_WGM8_WGMXCC1_WGMXCCGn1
    SolutionIndex: 114
    SolutionNameMin: Cijk_Alik_Bjlk_I8II_BH_SHB_HA_S_SCD_SAV_UserArgs_MT128x32x32_MI16x16x1_SN_LDSB1_AFC1_AG0_AFEM1_AFEM1_ASEM1_CLR1_CADS0_DTLA0_DTLB0_DTVA0_DTVB0_DTVSM0_DPLBn1_EPS0_ELFLR0_EMLLn1_FDSI0_GRPM1_GRVWA8_GRVWB8_GSUn1_GSUAMB_GSUC0_GSUWGMRR0_GLS0_ISA1201_IU2_K1_LDSTI0_LBSPPA128_LBSPPB256_LBSPPM0_LPA8_LPB16_LPM0_LRVW8_LWPMn1_MIAV1_MIWT4_1_MO40_MGRIPMn1_NTn1_NTA0_NTB0_NTC0_NTD0_NTM0_NEPBS0_NLCA1_NLCB1_ONLL0_PGR2_PLR1_PKA0_SGROBn1_SIA2_SS0_SU32_SUM0_SUS256_SPO0_SRVW0_SSO0_SVW8_SK0_SKFTR0_SKXCCM0_SGRO0_TIN0_TLDS1_TLDSM1_ULSGRO1_USL1_UIOFGRO0_USFGROn1_VSn1_VWA4_VWB1_WSGRA0_WSGRB0_WS32_WG32_4_1_WGM8_WGMXCC1_WGMXCCGn1
    SolutionIndex: 115
    SolutionNameMin: Cijk_Alik_Bjlk_I8II_BH_SHB_HA_S_SCD_SAV_UserArgs_MT64x128x64_MI16x16x1_SN_LDSB0_AFC1_AG0_AFEM1_AFEM1_ASEM1_CLR1_CADS0_DTLA0_DTLB0_DTVA0_DTVB1_DTVSM0_DPLBn1_EPS1_ELFLR0_EMLLn1_FDSI0_GRPM1_GRVWA8_GRVWB8_GSUn1_GSUAMB_GSUC0_GSUWGMRR0_GLS0_ISA1201_IU1_K1_LDSTI0_LBSPPA128_LBSPPB0_LBSPPM0_LPA8_LPB0_LPM0_LRVW8_LWPMn1_MIAV1_MIWT1_8_MO40_MGRIPMn1_NTn1_NTA0_NTB0_NTC0_NTD0_NTM0_NEPBS0_NLCA1_NLCB4_ONLL0_PGR1_PLR1_PKA0_SGROBn1_SIA3_SS0_SU32_SUM0_SUS256_SPO0_SRVW0_SSO0_SVW8_SK0_SKFTR0_SKXCCM0_SGRO0_TIN0_TLDS1_TLDSM1_ULSGRO0_USL1_UIOFGRO0_USFGROn1_VSn1_VWA1_VWB1_WSGRA0_WSGRB0_WS32_WG64_2_1_WGM8_WGMXCC1_WGMXCCGn1
    SolutionIndex: 116
    SolutionNameMin: Cijk_Alik_Bjlk_I8II_BH_SHB_HA_S_SCD_SAV_UserArgs_MT128x32x64_MI16x16x1_SN_LDSB0_AFC1_AG0_AFEM1_AFEM1_ASEM1_CLR1_CADS0_DTLA0_DTLB0_DTVA0_DTVB0_DTVSM0_DPLBn1_EPS0_ELFLR0_EMLLn1_FDSI0_GRPM1_GRVWA16_GRVWB16_GSUn1_GSUAMB_GSUC0_GSUWGMRR0_GLS0_ISA1201_IU1_K1_LDSTI0_LBSPPA256_LBSPPB512_LBSPPM0_LPA32_LPB16_LPM0_LRVW16_LWPMn1_MIAV1_MIWT4_1_MO40_MGRIPMn1_NTn1_NTA0_NTB0_NTC0_NTD0_NTM0_NEPBS0_NLCA1_NLCB1_ONLL0_PGR2_PLR1_PKA0_SGROBn1_SIA3_SS1_SU32_SUM0_SUS256_SPO0_SRVW0_SSO0_SVW4_SK0_SKFTR0_SKXCCM0_SGRO0_TIN0_TLDS1_TLDSM1_ULSGRO1_USL1_UIOFGRO0_USFGROn1_VSn1_VWA4_VWB1_WSGRA0_WSGRB0_WS32_WG32_4_1_WGM8_WGMXCC1_WGMXCCGn1
    SolutionIndex: 117
    SolutionNameMin: Cijk_Alik_Bjlk_I8II_BH_SHB_HA_S_SCD_SAV_UserArgs_MT128x128x32_MI16x16x1_SN_LDSB0_AFC1_AG0_AFEM1_AFEM1_ASEM1_CLR1_CADS0_DTLA0_DTLB0_DTVA0_DTVB1_DTVSM0_DPLBn1_EPS0_ELFLR0_EMLLn1_FDSI0_GRPM1_GRVWA8_GRVWB8_GSUn1_GSUAMB_GSUC0_GSUWGMRR0_GLS0_ISA1201_IU1_K1_LDSTI0_LBSPPA256_LBSPPB0_LBSPPM0_LPA8_LPB0_LPM0_LRVW8_LWPMn1_MIAV1_MIWT8_2_MO40_MGRIPMn1_NTn1_NTA0_NTB0_NTC0_NTD0_NTM0_NEPBS0_NLCA1_NLCB2_ONLL0_PGR2_PLR1_PKA0_SGROBn1_SIA3_SS0_SU32_SUM0_SUS256_SPO0_SRVW0_SSO0_SVW8_SK0_SKFTR0_SKXCCM0_SGRO0_TIN0_TLDS1_TLDSM1_ULSGRO0_USL1_UIOFGRO0_USFGROn1_VSn1_VWA8_VWB1_WSGRA0_WSGRB0_WS32_WG16_8_1_WGM8_WGMXCC1_WGMXCCGn1
    SolutionIndex: 118
    SolutionNameMin: Cijk_Alik_Bjlk_I8II_BH_SHB_HA_S_SCD_SAV_UserArgs_MT16x256x32_MI16x16x1_SN_LDSB0_AFC1_AG0_AFEM1_AFEM1_ASEM32_CLR1_CADS0_DTLA0_DTLB0_DTVA1_DTVB1_DTVSM0_DPLBn1_EPS0_ELFLR0_EMLLn1_FDSI0_GRPM1_GRVWA8_GRVWB8_GSUn1_GSUAMB_GSUC0_GSUWGMRR0_GLS0_ISA1201_IU1_K1_LDSTI0_LBSPPA0_LBSPPB0_LBSPPM0_LPA0_LPB0_LPM0_LRVW8_LWPMn1_MIAV1_MIWT1_8_MO40_MGRIPMn1_NTn1_NTA0_NTB0_NTC0_NTD0_NTM0_NEPBS0_NLCA2_NLCB2_ONLL0_PGR1_PLR0_PKA0_SGROBn1_SIA3_SS0_SU32_SUM0_SUS256_SPO0_SRVW0_SSO0_SVW8_SK0_SKFTR0_SKXCCM0_SGRO0_TIN0_TLDS1_TLDSM1_ULSGRO0_USL1_UIOFGRO0_USFGROn1_VSn1_VWA1_VWB1_WSGRA0_WSGRB0_WS32_WG16_4_1_WGM8_WGMXCC1_WGMXCCGn1
    SolutionIndex: 119
    SolutionNameMin: Cijk_Alik_Bjlk_I8II_BH_SHB_HA_S_SCD_SAV_UserArgs_MT128x128x32_MI16x16x1_SN_LDSB0_AFC1_AG0_AFEM1_AFEM1_ASEM1_CLR1_CADS0_DTLA0_DTLB0_DTVA0_DTVB1_DTVSM0_DPLBn1_EPS1_ELFLR0_EMLLn1_FDSI0_GRPM1_GRVWA8_GRVWB8_GSUn1_GSUAMB_GSUC0_GSUWGMRR0_GLS0_ISA1201_IU1_K1_LDSTI0_LBSPPA256_LBSPPB0_LBSPPM0_LPA8_LPB0_LPM0_LRVW8_LWPMn1_MIAV1_MIWT8_2_MO40_MGRIPMn1_NTn1_NTA0_NTB0_NTC0_NTD0_NTM0_NEPBS0_NLCA1_NLCB2_ONLL0_PGR1_PLR1_PKA0_SGROBn1_SIA3_SS1_SU32_SUM0_SUS256_SPO0_SRVW0_SSO0_SVW8_SK0_SKFTR0_SKXCCM0_SGRO0_TIN0_TLDS1_TLDSM1_ULSGRO0_USL1_UIOFGRO0_USFGROn1_VSn1_VWA8_VWB1_WSGRA0_WSGRB0_WS32_WG16_8_1_WGM8_WGMXCC1_WGMXCCGn1
    SolutionIndex: 120
    SolutionNameMin: Cijk_Alik_Bjlk_I8II_BH_SHB_HA_S_SCD_SAV_UserArgs_MT128x128x32_MI16x16x1_SN_LDSB0_AFC1_AG0_AFEM1_AFEM1_ASEM1_CLR1_CADS0_DTLA0_DTLB0_DTVA0_DTVB1_DTVSM0_DPLBn1_EPS0_ELFLR0_EMLLn1_FDSI0_GRPM1_GRVWA8_GRVWB8_GSUn1_GSUAMB_GSUC0_GSUWGMRR0_GLS0_ISA1201_IU1_K1_LDSTI0_LBSPPA256_LBSPPB0_LBSPPM0_LPA8_LPB0_LPM0_LRVW8_LWPMn1_MIAV1_MIWT8_2_MO40_MGRIPMn1_NTn1_NTA0_NTB0_NTC0_NTD0_NTM0_NEPBS0_NLCA1_NLCB2_ONLL0_PGR2_PLR1_PKA0_SGROBn1_SIA3_SS1_SU32_SUM0_SUS256_SPO0_SRVW0_SSO0_SVW8_SK0_SKFTR0_SKXCCM0_SGRO0_TIN0_TLDS1_TLDSM1_ULSGRO0_USL1_UIOFGRO0_USFGROn1_VSn1_VWA8_VWB1_WSGRA0_WSGRB0_WS32_WG16_8_1_WGM8_WGMXCC1_WGMXCCGn1
    SolutionIndex: 121
    SolutionNameMin: Cijk_Alik_Bjlk_I8II_BH_SHB_HA_S_SCD_SAV_UserArgs_MT16x32x128_MI16x16x1_SN_LDSB0_AFC1_AG0_AFEM1_AFEM1_ASEM1_CLR1_CADS0_DTLA0_DTLB0_DTVA0_DTVB1_DTVSM0_DPLBn1_EPS0_ELFLR0_EMLLn1_FDSI0_GRPM1_GRVWA8_GRVWB8_GSUn1_GSUAMB_GSUC0_GSUWGMRR0_GLS0_ISA1201_IU1_K1_LDSTI0_LBSPPA128_LBSPPB0_LBSPPM0_LPA8_LPB0_LPM0_LRVW8_LWPMn1_MIAV1_MIWT1_1_MO40_MGRIPMn1_NTn1_NTA0_NTB0_NTC0_NTD0_NTM0_NEPBS0_NLCA1_NLCB1_ONLL0_PGR2_PLR1_PKA0_SGROBn1_SIA3_SS0_SU32_SUM0_SUS256_SPO0_SRVW0_SSO0_SVW8_SK0_SKFTR0_SKXCCM0_SGRO0_TIN0_TLDS1_TLDSM1_ULSGRO0_USL1_UIOFGRO0_USFGROn1_VSn1_VWA1_VWB1_WSGRA0_WSGRB0_WS32_WG16_4_1_WGM8_WGMXCC1_WGMXCCGn1
    SolutionIndex: 122
    SolutionNameMin: Cijk_Alik_Bjlk_I8II_BH_SHB_HA_S_SCD_SAV_UserArgs_MT16x16x256_MI16x16x1_SN_LDSB0_AFC1_AG0_AFEM1_AFEM1_ASEM256_CLR1_CADS0_DTLA0_DTLB0_DTVA1_DTVB1_DTVSM0_DPLBn1_EPS0_ELFLR0_EMLLn1_FDSI0_GRPM1_GRVWA8_GRVWB8_GSUn1_GSUAMB_GSUC0_GSUWGMRR0_GLS0_ISA1201_IU1_K1_LDSTI0_LBSPPA0_LBSPPB0_LBSPPM0_LPA0_LPB0_LPM0_LRVW8_LWPMn1_MIAV1_MIWT1_1_MO40_MGRIPMn1_NTn1_NTA0_NTB0_NTC0_NTD0_NTM0_NEPBS0_NLCA16_NLCB1_ONLL0_PGR1_PLR0_PKA0_SGROBn1_SIA3_SS0_SU32_SUM0_SUS256_SPO0_SRVW0_SSO0_SVW8_SK0_SKFTR0_SKXCCM0_SGRO0_TIN0_TLDS1_TLDSM1_ULSGRO0_USL1_UIOFGRO0_USFGROn1_VSn1_VWA1_VWB1_WSGRA0_WSGRB0_WS32_WG16_2_1_WGM8_WGMXCC1_WGMXCCGn1
    SolutionIndex: 123
    SolutionNameMin: Cijk_Alik_Bjlk_I8II_BH_SHB_HA_S_SCD_SAV_UserArgs_MT32x32x128_MI16x16x1_SN_LDSB0_AFC1_AG0_AFEM1_AFEM1_ASEM1_CLR1_CADS0_DTLA0_DTLB0_DTVA0_DTVB1_DTVSM0_DPLBn1_EPS1_ELFLR0_EMLLn1_FDSI0_GRPM1_GRVWA8_GRVWB8_GSUn1_GSUAMB_GSUC0_GSUWGMRR0_GLS0_ISA1201_IU1_K1_LDSTI0_LBSPPA128_LBSPPB0_LBSPPM0_LPA8_LPB0_LPM0_LRVW8_LWPMn1_MIAV1_MIWT1_1_MO40_MGRIPMn1_NTn1_NTA0_NTB0_NTC0_NTD0_NTM0_NEPBS0_NLCA1_NLCB1_ONLL0_PGR1_PLR1_PKA0_SGROBn1_SIA3_SS0_SU32_SUM0_SUS256_SPO0_SRVW0_SSO0_SVW8_SK0_SKFTR0_SKXCCM0_SGRO0_TIN0_TLDS1_TLDSM1_ULSGRO0_USL1_UIOFGRO0_USFGROn1_VSn1_VWA1_VWB1_WSGRA0_WSGRB0_WS32_WG32_4_1_WGM8_WGMXCC1_WGMXCCGn1
    SolutionIndex: 124
    SolutionNameMin: Cijk_Alik_Bjlk_I8II_BH_SHB_HA_S_SCD_SAV_UserArgs_MT16x32x256_MI16x16x1_SN_LDSB0_AFC1_AG0_AFEM1_AFEM1_ASEM1_CLR1_CADS0_DTLA0_DTLB0_DTVA0_DTVB1_DTVSM0_DPLBn1_EPS1_ELFLR0_EMLLn1_FDSI0_GRPM1_GRVWA8_GRVWB8_GSUn1_GSUAMB_GSUC0_GSUWGMRR0_GLS0_ISA1201_IU1_K1_LDSTI0_LBSPPA256_LBSPPB0_LBSPPM0_LPA8_LPB0_LPM0_LRVW8_LWPMn1_MIAV1_MIWT1_1_MO40_MGRIPMn1_NTn1_NTA0_NTB0_NTC0_NTD0_NTM0_NEPBS0_NLCA1_NLCB1_ONLL0_PGR1_PLR1_PKA0_SGROBn1_SIA3_SS0_SU32_SUM0_SUS256_SPO0_SRVW0_SSO0_SVW8_SK0_SKFTR0_SKXCCM0_SGRO0_TIN0_TLDS1_TLDSM1_ULSGRO0_USL1_UIOFGRO0_USFGROn1_VSn1_VWA1_VWB1_WSGRA0_WSGRB0_WS32_WG16_4_1_WGM8_WGMXCC1_WGMXCCGn1
    SolutionIndex: 125
    SolutionNameMin: Cijk_Alik_Bjlk_I8II_BH_SHB_HA_S_SCD_SAV_UserArgs_MT16x32x128_MI16x16x1_SN_LDSB0_AFC1_AG0_AFEM1_AFEM1_ASEM1_CLR1_CADS0_DTLA0_DTLB0_DTVA0_DTVB1_DTVSM0_DPLBn1_EPS1_ELFLR0_EMLLn1_FDSI0_GRPM1_GRVWA8_GRVWB8_GSUn1_GSUAMB_GSUC0_GSUWGMRR0_GLS0_ISA1201_IU1_K1_LDSTI0_LBSPPA128_LBSPPB0_LBSPPM0_LPA8_LPB0_LPM0_LRVW8_LWPMn1_MIAV1_MIWT1_1_MO40_MGRIPMn1_NTn1_NTA0_NTB0_NTC0_NTD0_NTM0_NEPBS0_NLCA1_NLCB1_ONLL0_PGR1_PLR1_PKA0_SGROBn1_SIA3_SS0_SU32_SUM0_SUS256_SPO0_SRVW0_SSO0_SVW8_SK0_SKFTR0_SKXCCM0_SGRO0_TIN0_TLDS1_TLDSM1_ULSGRO0_USL1_UIOFGRO0_USFGROn1_VSn1_VWA1_VWB1_WSGRA0_WSGRB0_WS32_WG16_4_1_WGM8_WGMXCC1_WGMXCCGn1
    SolutionIndex: 126
    SolutionNameMin: Cijk_Alik_Bjlk_I8II_BH_SHB_HA_S_SCD_SAV_UserArgs_MT16x32x128_MI16x16x1_SN_LDSB0_AFC1_AG0_AFEM1_AFEM1_ASEM128_CLR1_CADS0_DTLA0_DTLB0_DTVA1_DTVB1_DTVSM0_DPLBn1_EPS0_ELFLR0_EMLLn1_FDSI0_GRPM1_GRVWA8_GRVWB8_GSUn1_GSUAMB_GSUC0_GSUWGMRR0_GLS0_ISA1201_IU1_K1_LDSTI0_LBSPPA0_LBSPPB0_LBSPPM0_LPA0_LPB0_LPM0_LRVW8_LWPMn1_MIAV1_MIWT1_1_MO40_MGRIPMn1_NTn1_NTA0_NTB0_NTC0_NTD0_NTM0_NEPBS0_NLCA8_NLCB1_ONLL0_PGR1_PLR0_PKA0_SGROBn1_SIA3_SS0_SU32_SUM0_SUS256_SPO0_SRVW0_SSO0_SVW8_SK0_SKFTR0_SKXCCM0_SGRO0_TIN0_TLDS1_TLDSM1_ULSGRO0_USL1_UIOFGRO0_USFGROn1_VSn1_VWA1_VWB1_WSGRA0_WSGRB0_WS32_WG16_4_1_WGM8_WGMXCC1_WGMXCCGn1
    SolutionIndex: 127
    SolutionNameMin: Cijk_Alik_Bjlk_I8II_BH_SHB_HA_S_SCD_SAV_UserArgs_MT16x16x128_MI16x16x1_SN_LDSB0_AFC1_AG0_AFEM1_AFEM1_ASEM128_CLR1_CADS0_DTLA0_DTLB0_DTVA1_DTVB1_DTVSM0_DPLBn1_EPS0_ELFLR0_EMLLn1_FDSI0_GRPM1_GRVWA8_GRVWB8_GSUn1_GSUAMB_GSUC0_GSUWGMRR0_GLS0_ISA1201_IU1_K1_LDSTI0_LBSPPA0_LBSPPB0_LBSPPM0_LPA0_LPB0_LPM0_LRVW8_LWPMn1_MIAV1_MIWT1_1_MO40_MGRIPMn1_NTn1_NTA0_NTB0_NTC0_NTD0_NTM0_NEPBS0_NLCA8_NLCB1_ONLL0_PGR1_PLR0_PKA0_SGROBn1_SIA3_SS0_SU32_SUM0_SUS256_SPO0_SRVW0_SSO0_SVW8_SK0_SKFTR0_SKXCCM0_SGRO0_TIN0_TLDS1_TLDSM1_ULSGRO0_USL1_UIOFGRO0_USFGROn1_VSn1_VWA1_VWB1_WSGRA0_WSGRB0_WS32_WG16_2_1_WGM8_WGMXCC1_WGMXCCGn1
    SolutionIndex: 128
    SolutionNameMin: Cijk_Alik_Bjlk_I8II_BH_SHB_HA_S_SCD_SAV_UserArgs_MT16x32x128_MI16x16x1_SN_LDSB0_AFC1_AG0_AFEM1_AFEM1_ASEM1_CLR1_CADS0_DTLA0_DTLB0_DTVA0_DTVB1_DTVSM0_DPLBn1_EPS1_ELFLR0_EMLLn1_FDSI0_GRPM1_GRVWA8_GRVWB8_GSUn1_GSUAMB_GSUC0_GSUWGMRR0_GLS0_ISA1201_IU1_K1_LDSTI0_LBSPPA128_LBSPPB0_LBSPPM0_LPA8_LPB0_LPM0_LRVW8_LWPMn1_MIAV1_MIWT1_1_MO40_MGRIPMn1_NTn1_NTA0_NTB0_NTC0_NTD0_NTM0_NEPBS0_NLCA1_NLCB1_ONLL0_PGR1_PLR1_PKA0_SGROBn1_SIA3_SS1_SU32_SUM0_SUS256_SPO0_SRVW0_SSO0_SVW1_SK0_SKFTR0_SKXCCM0_SGRO0_TIN0_TLDS1_TLDSM1_ULSGRO0_USL1_UIOFGRO0_USFGROn1_VSn1_VWA1_VWB1_WSGRA0_WSGRB0_WS32_WG16_4_1_WGM8_WGMXCC1_WGMXCCGn1
    SolutionIndex: 129
    SolutionNameMin: Cijk_Alik_Bjlk_I8II_BH_SHB_HA_S_SCD_SAV_UserArgs_MT32x16x128_MI16x16x1_SN_LDSB0_AFC1_AG0_AFEM1_AFEM1_ASEM128_CLR1_CADS0_DTLA0_DTLB0_DTVA1_DTVB1_DTVSM0_DPLBn1_EPS0_ELFLR0_EMLLn1_FDSI0_GRPM1_GRVWA8_GRVWB8_GSUn1_GSUAMB_GSUC0_GSUWGMRR0_GLS0_ISA1201_IU1_K1_LDSTI0_LBSPPA0_LBSPPB0_LBSPPM0_LPA0_LPB0_LPM0_LRVW8_LWPMn1_MIAV1_MIWT1_1_MO40_MGRIPMn1_NTn1_NTA0_NTB0_NTC0_NTD0_NTM0_NEPBS0_NLCA8_NLCB1_ONLL0_PGR1_PLR0_PKA0_SGROBn1_SIA3_SS0_SU32_SUM0_SUS256_SPO0_SRVW0_SSO0_SVW8_SK0_SKFTR0_SKXCCM0_SGRO0_TIN0_TLDS1_TLDSM1_ULSGRO0_USL1_UIOFGRO0_USFGROn1_VSn1_VWA1_VWB1_WSGRA0_WSGRB0_WS32_WG32_2_1_WGM8_WGMXCC1_WGMXCCGn1
    SolutionIndex: 130
    SolutionNameMin: Cijk_Alik_Bjlk_I8II_BH_SHB_HA_S_SCD_SAV_UserArgs_MT16x32x256_MI16x16x1_SN_LDSB0_AFC1_AG0_AFEM1_AFEM1_ASEM1_CLR1_CADS0_DTLA0_DTLB0_DTVA0_DTVB1_DTVSM0_DPLBn1_EPS0_ELFLR0_EMLLn1_FDSI0_GRPM1_GRVWA8_GRVWB8_GSUn1_GSUAMB_GSUC0_GSUWGMRR0_GLS0_ISA1201_IU1_K1_LDSTI0_LBSPPA256_LBSPPB0_LBSPPM0_LPA8_LPB0_LPM0_LRVW8_LWPMn1_MIAV1_MIWT1_1_MO40_MGRIPMn1_NTn1_NTA0_NTB0_NTC0_NTD0_NTM0_NEPBS0_NLCA1_NLCB1_ONLL0_PGR2_PLR1_PKA0_SGROBn1_SIA3_SS0_SU32_SUM0_SUS256_SPO0_SRVW0_SSO0_SVW8_SK0_SKFTR0_SKXCCM0_SGRO0_TIN0_TLDS1_TLDSM1_ULSGRO0_USL1_UIOFGRO0_USFGROn1_VSn1_VWA1_VWB1_WSGRA0_WSGRB0_WS32_WG16_4_1_WGM8_WGMXCC1_WGMXCCGn1
    SolutionIndex: 131
    SolutionNameMin: Cijk_Alik_Bjlk_I8II_BH_SHB_HA_S_SCD_SAV_UserArgs_MT16x32x256_MI16x16x1_SN_LDSB0_AFC1_AG0_AFEM1_AFEM1_ASEM256_CLR1_CADS0_DTLA0_DTLB0_DTVA1_DTVB1_DTVSM0_DPLBn1_EPS0_ELFLR0_EMLLn1_FDSI0_GRPM1_GRVWA8_GRVWB8_GSUn1_GSUAMB_GSUC0_GSUWGMRR0_GLS0_ISA1201_IU1_K1_LDSTI0_LBSPPA0_LBSPPB0_LBSPPM0_LPA0_LPB0_LPM0_LRVW8_LWPMn1_MIAV1_MIWT1_1_MO40_MGRIPMn1_NTn1_NTA0_NTB0_NTC0_NTD0_NTM0_NEPBS0_NLCA16_NLCB1_ONLL0_PGR1_PLR0_PKA0_SGROBn1_SIA3_SS0_SU32_SUM0_SUS256_SPO0_SRVW0_SSO0_SVW8_SK0_SKFTR0_SKXCCM0_SGRO0_TIN0_TLDS1_TLDSM1_ULSGRO0_USL1_UIOFGRO0_USFGROn1_VSn1_VWA1_VWB1_WSGRA0_WSGRB0_WS32_WG16_4_1_WGM8_WGMXCC1_WGMXCCGn1
    SolutionIndex: 132
    SolutionNameMin: Cijk_Alik_Bjlk_I8II_BH_SHB_HA_S_SCD_SAV_UserArgs_MT32x32x128_MI16x16x1_SN_LDSB0_AFC1_AG0_AFEM1_AFEM1_ASEM1_CLR1_CADS0_DTLA0_DTLB0_DTVA0_DTVB1_DTVSM0_DPLBn1_EPS1_ELFLR0_EMLLn1_FDSI0_GRPM1_GRVWA8_GRVWB8_GSUn1_GSUAMB_GSUC0_GSUWGMRR0_GLS0_ISA1201_IU1_K1_LDSTI0_LBSPPA128_LBSPPB0_LBSPPM0_LPA8_LPB0_LPM0_LRVW8_LWPMn1_MIAV1_MIWT1_1_MO40_MGRIPMn1_NTn1_NTA0_NTB0_NTC0_NTD0_NTM0_NEPBS0_NLCA1_NLCB1_ONLL0_PGR1_PLR1_PKA0_SGROBn1_SIA3_SS1_SU32_SUM0_SUS256_SPO0_SRVW0_SSO0_SVW1_SK0_SKFTR0_SKXCCM0_SGRO0_TIN0_TLDS1_TLDSM1_ULSGRO0_USL1_UIOFGRO0_USFGROn1_VSn1_VWA1_VWB1_WSGRA0_WSGRB0_WS32_WG32_4_1_WGM8_WGMXCC1_WGMXCCGn1
    SolutionIndex: 133
    SolutionNameMin: Cijk_Alik_Bjlk_I8II_BH_SHB_HA_S_SCD_SAV_UserArgs_MT64x64x64_MI16x16x1_SN_LDSB0_AFC1_AG0_AFEM1_AFEM1_ASEM1_CLR1_CADS0_DTLA0_DTLB0_DTVA0_DTVB1_DTVSM0_DPLBn1_EPS1_ELFLR0_EMLLn1_FDSI0_GRPM1_GRVWA8_GRVWB8_GSUn1_GSUAMB_GSUC0_GSUWGMRR0_GLS0_ISA1201_IU1_K1_LDSTI0_LBSPPA128_LBSPPB0_LBSPPM0_LPA8_LPB0_LPM0_LRVW8_LWPMn1_MIAV1_MIWT2_2_MO40_MGRIPMn1_NTn1_NTA0_NTB0_NTC0_NTD0_NTM0_NEPBS0_NLCA1_NLCB4_ONLL0_PGR1_PLR1_PKA0_SGROBn1_SIA3_SS0_SU32_SUM0_SUS256_SPO0_SRVW0_SSO0_SVW16_SK0_SKFTR0_SKXCCM0_SGRO0_TIN0_TLDS1_TLDSM1_ULSGRO0_USL1_UIOFGRO0_USFGROn1_VSn1_VWA2_VWB1_WSGRA0_WSGRB0_WS32_WG32_4_1_WGM8_WGMXCC1_WGMXCCGn1
    SolutionIndex: 134
    SolutionNameMin: Cijk_Alik_Bjlk_I8II_BH_SHB_HA_S_SCD_SAV_UserArgs_MT64x64x128_MI16x16x1_SN_LDSB0_AFC1_AG0_AFEM1_AFEM1_ASEM1_CLR1_CADS0_DTLA0_DTLB0_DTVA0_DTVB1_DTVSM0_DPLBn1_EPS0_ELFLR0_EMLLn1_FDSI0_GRPM1_GRVWA8_GRVWB8_GSUn1_GSUAMB_GSUC0_GSUWGMRR0_GLS0_ISA1201_IU1_K1_LDSTI0_LBSPPA256_LBSPPB0_LBSPPM0_LPA8_LPB0_LPM0_LRVW8_LWPMn1_MIAV1_MIWT2_2_MO40_MGRIPMn1_NTn1_NTA0_NTB0_NTC0_NTD0_NTM0_NEPBS0_NLCA1_NLCB8_ONLL0_PGR2_PLR1_PKA0_SGROBn1_SIA3_SS0_SU32_SUM0_SUS256_SPO0_SRVW0_SSO0_SVW16_SK0_SKFTR0_SKXCCM0_SGRO0_TIN0_TLDS1_TLDSM1_ULSGRO0_USL1_UIOFGRO0_USFGROn1_VSn1_VWA2_VWB1_WSGRA0_WSGRB0_WS32_WG32_4_1_WGM8_WGMXCC1_WGMXCCGn1
    SolutionIndex: 135
    SolutionNameMin: Cijk_Alik_Bjlk_I8II_BH_SHB_HA_S_SCD_SAV_UserArgs_MT32x16x256_MI16x16x1_SN_LDSB0_AFC1_AG0_AFEM1_AFEM1_ASEM256_CLR1_CADS0_DTLA0_DTLB0_DTVA1_DTVB1_DTVSM0_DPLBn1_EPS0_ELFLR0_EMLLn1_FDSI0_GRPM1_GRVWA8_GRVWB8_GSUn1_GSUAMB_GSUC0_GSUWGMRR0_GLS0_ISA1201_IU1_K1_LDSTI0_LBSPPA0_LBSPPB0_LBSPPM0_LPA0_LPB0_LPM0_LRVW8_LWPMn1_MIAV1_MIWT1_1_MO40_MGRIPMn1_NTn1_NTA0_NTB0_NTC0_NTD0_NTM0_NEPBS0_NLCA16_NLCB1_ONLL0_PGR1_PLR0_PKA0_SGROBn1_SIA3_SS0_SU32_SUM0_SUS256_SPO0_SRVW0_SSO0_SVW8_SK0_SKFTR0_SKXCCM0_SGRO0_TIN0_TLDS1_TLDSM1_ULSGRO0_USL1_UIOFGRO0_USFGROn1_VSn1_VWA1_VWB1_WSGRA0_WSGRB0_WS32_WG32_2_1_WGM8_WGMXCC1_WGMXCCGn1
    SolutionIndex: 136
    SolutionNameMin: Cijk_Alik_Bjlk_I8II_BH_SHB_HA_S_SCD_SAV_UserArgs_MT16x16x128_MI16x16x1_SN_LDSB0_AFC1_AG0_AFEM1_AFEM1_ASEM1_CLR1_CADS0_DTLA0_DTLB0_DTVA0_DTVB1_DTVSM0_DPLBn1_EPS1_ELFLR0_EMLLn1_FDSI0_GRPM1_GRVWA8_GRVWB8_GSUn1_GSUAMB_GSUC0_GSUWGMRR0_GLS0_ISA1201_IU1_K1_LDSTI0_LBSPPA128_LBSPPB0_LBSPPM0_LPA8_LPB0_LPM0_LRVW8_LWPMn1_MIAV1_MIWT1_1_MO40_MGRIPMn1_NTn1_NTA0_NTB0_NTC0_NTD0_NTM0_NEPBS0_NLCA1_NLCB1_ONLL0_PGR1_PLR1_PKA0_SGROBn1_SIA3_SS0_SU32_SUM0_SUS256_SPO0_SRVW0_SSO0_SVW8_SK0_SKFTR0_SKXCCM0_SGRO0_TIN0_TLDS1_TLDSM1_ULSGRO0_USL1_UIOFGRO0_USFGROn1_VSn1_VWA1_VWB1_WSGRA0_WSGRB0_WS32_WG16_2_1_WGM8_WGMXCC1_WGMXCCGn1
    SolutionIndex: 137
    SolutionNameMin: Cijk_Alik_Bjlk_I8II_BH_SHB_HA_S_SCD_SAV_UserArgs_MT32x128x128_MI16x16x1_SN_LDSB0_AFC1_AG0_AFEM1_AFEM1_ASEM1_CLR1_CADS0_DTLA0_DTLB0_DTVA0_DTVB1_DTVSM0_DPLBn1_EPS0_ELFLR0_EMLLn1_FDSI0_GRPM1_GRVWA8_GRVWB8_GSUn1_GSUAMB_GSUC0_GSUWGMRR0_GLS0_ISA1201_IU1_K1_LDSTI0_LBSPPA128_LBSPPB0_LBSPPM0_LPA8_LPB0_LPM0_LRVW8_LWPMn1_MIAV1_MIWT1_4_MO40_MGRIPMn1_NTn1_NTA0_NTB0_NTC0_NTD0_NTM0_NEPBS0_NLCA1_NLCB8_ONLL0_PGR2_PLR1_PKA0_SGROBn1_SIA3_SS0_SU32_SUM0_SUS256_SPO0_SRVW0_SSO0_SVW8_SK0_SKFTR0_SKXCCM0_SGRO0_TIN0_TLDS1_TLDSM1_ULSGRO0_USL1_UIOFGRO0_USFGROn1_VSn1_VWA1_VWB1_WSGRA0_WSGRB0_WS32_WG32_4_1_WGM8_WGMXCC1_WGMXCCGn1
    SolutionIndex: 138
    SolutionNameMin: Cijk_Alik_Bjlk_I8II_BH_SHB_HA_S_SCD_SAV_UserArgs_MT32x128x128_MI16x16x1_SN_LDSB0_AFC1_AG0_AFEM1_AFEM1_ASEM1_CLR1_CADS0_DTLA0_DTLB0_DTVA0_DTVB1_DTVSM0_DPLBn1_EPS1_ELFLR0_EMLLn1_FDSI0_GRPM1_GRVWA8_GRVWB8_GSUn1_GSUAMB_GSUC0_GSUWGMRR0_GLS0_ISA1201_IU1_K1_LDSTI0_LBSPPA128_LBSPPB0_LBSPPM0_LPA8_LPB0_LPM0_LRVW8_LWPMn1_MIAV1_MIWT1_4_MO40_MGRIPMn1_NTn1_NTA0_NTB0_NTC0_NTD0_NTM0_NEPBS0_NLCA1_NLCB8_ONLL0_PGR1_PLR1_PKA0_SGROBn1_SIA3_SS0_SU32_SUM0_SUS256_SPO0_SRVW0_SSO0_SVW8_SK0_SKFTR0_SKXCCM0_SGRO0_TIN0_TLDS1_TLDSM1_ULSGRO0_USL1_UIOFGRO0_USFGROn1_VSn1_VWA1_VWB1_WSGRA0_WSGRB0_WS32_WG32_4_1_WGM8_WGMXCC1_WGMXCCGn1
    SolutionIndex: 139
    SolutionNameMin: Cijk_Alik_Bjlk_I8II_BH_SHB_HA_S_SCD_SAV_UserArgs_MT64x64x128_MI16x16x1_SN_LDSB0_AFC1_AG0_AFEM1_AFEM1_ASEM1_CLR1_CADS0_DTLA0_DTLB0_DTVA0_DTVB1_DTVSM0_DPLBn1_EPS1_ELFLR0_EMLLn1_FDSI0_GRPM1_GRVWA8_GRVWB8_GSUn1_GSUAMB_GSUC0_GSUWGMRR0_GLS0_ISA1201_IU1_K1_LDSTI0_LBSPPA256_LBSPPB0_LBSPPM0_LPA8_LPB0_LPM0_LRVW8_LWPMn1_MIAV1_MIWT2_2_MO40_MGRIPMn1_NTn1_NTA0_NTB0_NTC0_NTD0_NTM0_NEPBS0_NLCA1_NLCB8_ONLL0_PGR1_PLR1_PKA0_SGROBn1_SIA3_SS0_SU32_SUM0_SUS256_SPO0_SRVW0_SSO0_SVW16_SK0_SKFTR0_SKXCCM0_SGRO0_TIN0_TLDS1_TLDSM1_ULSGRO0_USL1_UIOFGRO0_USFGROn1_VSn1_VWA2_VWB1_WSGRA0_WSGRB0_WS32_WG32_4_1_WGM8_WGMXCC1_WGMXCCGn1
    SolutionIndex: 140
    SolutionNameMin: Cijk_Alik_Bjlk_I8II_BH_SHB_HA_S_SCD_SAV_UserArgs_MT64x64x64_MI16x16x1_SN_LDSB0_AFC1_AG0_AFEM1_AFEM1_ASEM1_CLR1_CADS0_DTLA0_DTLB0_DTVA0_DTVB1_DTVSM0_DPLBn1_EPS0_ELFLR0_EMLLn1_FDSI0_GRPM1_GRVWA8_GRVWB8_GSUn1_GSUAMB_GSUC0_GSUWGMRR0_GLS0_ISA1201_IU1_K1_LDSTI0_LBSPPA128_LBSPPB0_LBSPPM0_LPA8_LPB0_LPM0_LRVW8_LWPMn1_MIAV1_MIWT2_2_MO40_MGRIPMn1_NTn1_NTA0_NTB0_NTC0_NTD0_NTM0_NEPBS0_NLCA1_NLCB4_ONLL0_PGR2_PLR1_PKA0_SGROBn1_SIA3_SS1_SU32_SUM0_SUS256_SPO0_SRVW0_SSO0_SVW2_SK0_SKFTR0_SKXCCM0_SGRO0_TIN0_TLDS1_TLDSM1_ULSGRO0_USL1_UIOFGRO0_USFGROn1_VSn1_VWA2_VWB1_WSGRA0_WSGRB0_WS32_WG32_4_1_WGM8_WGMXCC1_WGMXCCGn1
    SolutionIndex: 141
    SolutionNameMin: Cijk_Alik_Bjlk_I8II_BH_SHB_HA_S_SCD_SAV_UserArgs_MT32x32x256_MI16x16x1_SN_LDSB0_AFC1_AG0_AFEM1_AFEM1_ASEM1_CLR1_CADS0_DTLA0_DTLB0_DTVA0_DTVB1_DTVSM0_DPLBn1_EPS0_ELFLR0_EMLLn1_FDSI0_GRPM1_GRVWA8_GRVWB8_GSUn1_GSUAMB_GSUC0_GSUWGMRR0_GLS0_ISA1201_IU1_K1_LDSTI0_LBSPPA256_LBSPPB0_LBSPPM0_LPA8_LPB0_LPM0_LRVW8_LWPMn1_MIAV1_MIWT1_1_MO40_MGRIPMn1_NTn1_NTA0_NTB0_NTC0_NTD0_NTM0_NEPBS0_NLCA1_NLCB1_ONLL0_PGR2_PLR1_PKA0_SGROBn1_SIA3_SS0_SU32_SUM0_SUS256_SPO0_SRVW0_SSO0_SVW8_SK0_SKFTR0_SKXCCM0_SGRO0_TIN0_TLDS1_TLDSM1_ULSGRO0_USL1_UIOFGRO0_USFGROn1_VSn1_VWA1_VWB1_WSGRA0_WSGRB0_WS32_WG32_4_1_WGM8_WGMXCC1_WGMXCCGn1
    SolutionIndex: 142
    SolutionNameMin: Cijk_Alik_Bjlk_I8II_BH_SHB_HA_S_SCD_SAV_UserArgs_MT64x64x128_MI16x16x1_SN_LDSB0_AFC1_AG0_AFEM1_AFEM1_ASEM1_CLR1_CADS0_DTLA0_DTLB0_DTVA0_DTVB1_DTVSM0_DPLBn1_EPS1_ELFLR0_EMLLn1_FDSI0_GRPM1_GRVWA8_GRVWB8_GSUn1_GSUAMB_GSUC0_GSUWGMRR0_GLS0_ISA1201_IU1_K1_LDSTI0_LBSPPA256_LBSPPB0_LBSPPM0_LPA8_LPB0_LPM0_LRVW8_LWPMn1_MIAV1_MIWT2_2_MO40_MGRIPMn1_NTn1_NTA0_NTB0_NTC0_NTD0_NTM0_NEPBS0_NLCA1_NLCB8_ONLL0_PGR1_PLR1_PKA0_SGROBn1_SIA3_SS1_SU32_SUM0_SUS256_SPO0_SRVW0_SSO0_SVW2_SK0_SKFTR0_SKXCCM0_SGRO0_TIN0_TLDS1_TLDSM1_ULSGRO0_USL1_UIOFGRO0_USFGROn1_VSn1_VWA2_VWB1_WSGRA0_WSGRB0_WS32_WG32_4_1_WGM8_WGMXCC1_WGMXCCGn1
    SolutionIndex: 143
    SolutionNameMin: Cijk_Alik_Bjlk_I8II_BH_SHB_HA_S_SCD_SAV_UserArgs_MT128x64x32_MI16x16x1_SN_LDSB0_AFC1_AG0_AFEM1_AFEM1_ASEM1_CLR1_CADS0_DTLA0_DTLB0_DTVA0_DTVB1_DTVSM0_DPLBn1_EPS0_ELFLR0_EMLLn1_FDSI0_GRPM1_GRVWA8_GRVWB8_GSUn1_GSUAMB_GSUC0_GSUWGMRR0_GLS0_ISA1201_IU1_K1_LDSTI0_LBSPPA256_LBSPPB0_LBSPPM0_LPA8_LPB0_LPM0_LRVW8_LWPMn1_MIAV1_MIWT8_1_MO40_MGRIPMn1_NTn1_NTA0_NTB0_NTC0_NTD0_NTM0_NEPBS0_NLCA1_NLCB1_ONLL0_PGR2_PLR1_PKA0_SGROBn1_SIA3_SS1_SU32_SUM0_SUS256_SPO0_SRVW0_SSO0_SVW8_SK0_SKFTR0_SKXCCM0_SGRO0_TIN0_TLDS1_TLDSM1_ULSGRO0_USL1_UIOFGRO0_USFGROn1_VSn1_VWA8_VWB1_WSGRA0_WSGRB0_WS32_WG16_8_1_WGM8_WGMXCC1_WGMXCCGn1
    SolutionIndex: 144
    SolutionNameMin: Cijk_Alik_Bjlk_I8II_BH_SHB_HA_S_SCD_SAV_UserArgs_MT128x64x32_MI16x16x1_SN_LDSB1_AFC1_AG0_AFEM1_AFEM1_ASEM1_CLR1_CADS0_DTLA0_DTLB0_DTVA0_DTVB0_DTVSM0_DPLBn1_EPS1_ELFLR0_EMLLn1_FDSI0_GRPM1_GRVWA8_GRVWB16_GSUn1_GSUAMB_GSUC0_GSUWGMRR0_GLS0_ISA1201_IU2_K1_LDSTI0_LBSPPA256_LBSPPB512_LBSPPM0_LPA8_LPB16_LPM0_LRVW8_LWPMn1_MIAV1_MIWT8_1_MO40_MGRIPMn1_NTn1_NTA0_NTB0_NTC0_NTD0_NTM0_NEPBS0_NLCA1_NLCB1_ONLL0_PGR1_PLR1_PKA0_SGROBn1_SIA2_SS1_SU32_SUM0_SUS256_SPO0_SRVW0_SSO0_SVW8_SK0_SKFTR0_SKXCCM0_SGRO0_TIN0_TLDS1_TLDSM1_ULSGRO0_USL1_UIOFGRO0_USFGROn1_VSn1_VWA8_VWB1_WSGRA0_WSGRB0_WS32_WG16_8_1_WGM8_WGMXCC1_WGMXCCGn1
    SolutionIndex: 145
    SolutionNameMin: Cijk_Alik_Bjlk_I8II_BH_SHB_HA_S_SCD_SAV_UserArgs_MT16x256x64_MI16x16x1_SN_LDSB0_AFC1_AG0_AFEM1_AFEM1_ASEM1_CLR1_CADS0_DTLA0_DTLB0_DTVA0_DTVB1_DTVSM0_DPLBn1_EPS0_ELFLR0_EMLLn1_FDSI0_GRPM1_GRVWA8_GRVWB8_GSUn1_GSUAMB_GSUC0_GSUWGMRR0_GLS0_ISA1201_IU1_K1_LDSTI0_LBSPPA128_LBSPPB0_LBSPPM0_LPA8_LPB0_LPM0_LRVW8_LWPMn1_MIAV1_MIWT1_8_MO40_MGRIPMn1_NTn1_NTA0_NTB0_NTC0_NTD0_NTM0_NEPBS0_NLCA1_NLCB4_ONLL0_PGR2_PLR1_PKA0_SGROBn1_SIA3_SS0_SU32_SUM0_SUS256_SPO0_SRVW0_SSO0_SVW8_SK0_SKFTR0_SKXCCM0_SGRO0_TIN0_TLDS1_TLDSM1_ULSGRO0_USL1_UIOFGRO0_USFGROn1_VSn1_VWA1_VWB1_WSGRA0_WSGRB0_WS32_WG16_4_1_WGM8_WGMXCC1_WGMXCCGn1
    SolutionIndex: 146
    SolutionNameMin: Cijk_Alik_Bjlk_I8II_BH_SHB_HA_S_SCD_SAV_UserArgs_MT32x32x128_MI16x16x1_SN_LDSB0_AFC1_AG0_AFEM1_AFEM1_ASEM1_CLR1_CADS0_DTLA0_DTLB0_DTVA0_DTVB1_DTVSM0_DPLBn1_EPS0_ELFLR0_EMLLn1_FDSI0_GRPM1_GRVWA8_GRVWB8_GSUn1_GSUAMB_GSUC0_GSUWGMRR0_GLS0_ISA1201_IU1_K1_LDSTI0_LBSPPA128_LBSPPB0_LBSPPM0_LPA8_LPB0_LPM0_LRVW8_LWPMn1_MIAV1_MIWT1_1_MO40_MGRIPMn1_NTn1_NTA0_NTB0_NTC0_NTD0_NTM0_NEPBS0_NLCA1_NLCB1_ONLL0_PGR2_PLR1_PKA0_SGROBn1_SIA3_SS0_SU32_SUM0_SUS256_SPO0_SRVW0_SSO0_SVW8_SK0_SKFTR0_SKXCCM0_SGRO0_TIN0_TLDS1_TLDSM1_ULSGRO0_USL1_UIOFGRO0_USFGROn1_VSn1_VWA1_VWB1_WSGRA0_WSGRB0_WS32_WG32_4_1_WGM8_WGMXCC1_WGMXCCGn1
    SolutionIndex: 147
    SolutionNameMin: Cijk_Alik_Bjlk_I8II_BH_SHB_HA_S_SCD_SAV_UserArgs_MT128x128x32_MI16x16x1_SN_LDSB0_AFC1_AG0_AFEM1_AFEM1_ASEM1_CLR1_CADS0_DTLA0_DTLB0_DTVA0_DTVB1_DTVSM0_DPLBn1_EPS0_ELFLR0_EMLLn1_FDSI0_GRPM1_GRVWA8_GRVWB8_GSUn1_GSUAMB_GSUC0_GSUWGMRR0_GLS0_ISA1201_IU1_K1_LDSTI0_LBSPPA128_LBSPPB0_LBSPPM0_LPA8_LPB0_LPM0_LRVW8_LWPMn1_MIAV1_MIWT4_4_MO40_MGRIPMn1_NTn1_NTA0_NTB0_NTC0_NTD0_NTM0_NEPBS0_NLCA1_NLCB2_ONLL0_PGR2_PLR1_PKA0_SGROBn1_SIA3_SS0_SU32_SUM0_SUS256_SPO0_SRVW0_SSO0_SVW8_SK0_SKFTR0_SKXCCM0_SGRO0_TIN0_TLDS1_TLDSM1_ULSGRO0_USL1_UIOFGRO0_USFGROn1_VSn1_VWA4_VWB1_WSGRA0_WSGRB0_WS32_WG32_4_1_WGM8_WGMXCC1_WGMXCCGn1
    SolutionIndex: 148
    SolutionNameMin: Cijk_Alik_Bjlk_I8II_BH_SHB_HA_S_SCD_SAV_UserArgs_MT128x128x32_MI16x16x1_SN_LDSB0_AFC1_AG0_AFEM1_AFEM1_ASEM1_CLR1_CADS0_DTLA0_DTLB0_DTVA0_DTVB1_DTVSM0_DPLBn1_EPS0_ELFLR0_EMLLn1_FDSI0_GRPM1_GRVWA8_GRVWB8_GSUn1_GSUAMB_GSUC0_GSUWGMRR0_GLS0_ISA1201_IU1_K1_LDSTI0_LBSPPA128_LBSPPB0_LBSPPM0_LPA8_LPB0_LPM0_LRVW8_LWPMn1_MIAV1_MIWT4_4_MO40_MGRIPMn1_NTn1_NTA0_NTB0_NTC0_NTD0_NTM0_NEPBS0_NLCA1_NLCB2_ONLL0_PGR2_PLR1_PKA0_SGROBn1_SIA3_SS1_SU32_SUM0_SUS256_SPO0_SRVW0_SSO0_SVW4_SK0_SKFTR0_SKXCCM0_SGRO0_TIN0_TLDS1_TLDSM1_ULSGRO0_USL1_UIOFGRO0_USFGROn1_VSn1_VWA4_VWB1_WSGRA0_WSGRB0_WS32_WG32_4_1_WGM8_WGMXCC1_WGMXCCGn1
    SolutionIndex: 149
    SolutionNameMin: Cijk_Alik_Bjlk_I8II_BH_SHB_HA_S_SCD_SAV_UserArgs_MT128x128x32_MI16x16x1_SN_LDSB1_AFC1_AG0_AFEM1_AFEM1_ASEM1_CLR1_CADS0_DTLA0_DTLB0_DTVA0_DTVB0_DTVSM0_DPLBn1_EPS1_ELFLR0_EMLLn1_FDSI0_GRPM1_GRVWA8_GRVWB16_GSUn1_GSUAMB_GSUC0_GSUWGMRR0_GLS0_ISA1201_IU2_K1_LDSTI0_LBSPPA256_LBSPPB1024_LBSPPM0_LPA8_LPB32_LPM0_LRVW8_LWPMn1_MIAV1_MIWT8_2_MO40_MGRIPMn1_NTn1_NTA0_NTB0_NTC0_NTD0_NTM0_NEPBS0_NLCA1_NLCB1_ONLL0_PGR1_PLR1_PKA0_SGROBn1_SIA2_SS1_SU32_SUM0_SUS256_SPO0_SRVW0_SSO0_SVW8_SK0_SKFTR0_SKXCCM0_SGRO0_TIN0_TLDS1_TLDSM1_ULSGRO0_USL1_UIOFGRO0_USFGROn1_VSn1_VWA8_VWB2_WSGRA0_WSGRB0_WS32_WG16_8_1_WGM8_WGMXCC1_WGMXCCGn1
    SolutionIndex: 150
    SolutionNameMin: Cijk_Alik_Bjlk_I8II_BH_SHB_HA_S_SCD_SAV_UserArgs_MT32x16x128_MI16x16x1_SN_LDSB0_AFC1_AG0_AFEM1_AFEM1_ASEM1_CLR1_CADS0_DTLA0_DTLB0_DTVA0_DTVB1_DTVSM0_DPLBn1_EPS1_ELFLR0_EMLLn1_FDSI0_GRPM1_GRVWA8_GRVWB8_GSUn1_GSUAMB_GSUC0_GSUWGMRR0_GLS0_ISA1201_IU1_K1_LDSTI0_LBSPPA128_LBSPPB0_LBSPPM0_LPA8_LPB0_LPM0_LRVW8_LWPMn1_MIAV1_MIWT1_1_MO40_MGRIPMn1_NTn1_NTA0_NTB0_NTC0_NTD0_NTM0_NEPBS0_NLCA1_NLCB1_ONLL0_PGR1_PLR1_PKA0_SGROBn1_SIA3_SS0_SU32_SUM0_SUS256_SPO0_SRVW0_SSO0_SVW8_SK0_SKFTR0_SKXCCM0_SGRO0_TIN0_TLDS1_TLDSM1_ULSGRO0_USL1_UIOFGRO0_USFGROn1_VSn1_VWA1_VWB1_WSGRA0_WSGRB0_WS32_WG32_2_1_WGM8_WGMXCC1_WGMXCCGn1
    SolutionIndex: 151
    SolutionNameMin: Cijk_Alik_Bjlk_I8II_BH_SHB_HA_S_SCD_SAV_UserArgs_MT16x32x128_MI16x16x1_SN_LDSB0_AFC1_AG0_AFEM1_AFEM1_ASEM1_CLR1_CADS0_DTLA0_DTLB0_DTVA0_DTVB1_DTVSM0_DPLBn1_EPS0_ELFLR0_EMLLn1_FDSI0_GRPM1_GRVWA8_GRVWB8_GSUn1_GSUAMB_GSUC0_GSUWGMRR0_GLS0_ISA1201_IU1_K1_LDSTI0_LBSPPA128_LBSPPB0_LBSPPM0_LPA8_LPB0_LPM0_LRVW8_LWPMn1_MIAV1_MIWT1_1_MO40_MGRIPMn1_NTn1_NTA0_NTB0_NTC0_NTD0_NTM0_NEPBS0_NLCA1_NLCB1_ONLL0_PGR2_PLR1_PKA0_SGROBn1_SIA3_SS1_SU32_SUM0_SUS256_SPO0_SRVW0_SSO0_SVW1_SK0_SKFTR0_SKXCCM0_SGRO0_TIN0_TLDS1_TLDSM1_ULSGRO0_USL1_UIOFGRO0_USFGROn1_VSn1_VWA1_VWB1_WSGRA0_WSGRB0_WS32_WG16_4_1_WGM8_WGMXCC1_WGMXCCGn1
    SolutionIndex: 152
    SolutionNameMin: Cijk_Alik_Bjlk_I8II_BH_SHB_HA_S_SCD_SAV_UserArgs_MT16x32x256_MI16x16x1_SN_LDSB0_AFC1_AG0_AFEM1_AFEM1_ASEM1_CLR1_CADS0_DTLA0_DTLB0_DTVA0_DTVB1_DTVSM0_DPLBn1_EPS1_ELFLR0_EMLLn1_FDSI0_GRPM1_GRVWA8_GRVWB8_GSUn1_GSUAMB_GSUC0_GSUWGMRR0_GLS0_ISA1201_IU1_K1_LDSTI0_LBSPPA256_LBSPPB0_LBSPPM0_LPA8_LPB0_LPM0_LRVW8_LWPMn1_MIAV1_MIWT1_1_MO40_MGRIPMn1_NTn1_NTA0_NTB0_NTC0_NTD0_NTM0_NEPBS0_NLCA1_NLCB1_ONLL0_PGR1_PLR1_PKA0_SGROBn1_SIA3_SS1_SU32_SUM0_SUS256_SPO0_SRVW0_SSO0_SVW1_SK0_SKFTR0_SKXCCM0_SGRO0_TIN0_TLDS1_TLDSM1_ULSGRO0_USL1_UIOFGRO0_USFGROn1_VSn1_VWA1_VWB1_WSGRA0_WSGRB0_WS32_WG16_4_1_WGM8_WGMXCC1_WGMXCCGn1
    SolutionIndex: 153
    SolutionNameMin: Cijk_Alik_Bjlk_I8II_BH_SHB_HA_S_SCD_SAV_UserArgs_MT32x32x128_MI16x16x1_SN_LDSB0_AFC1_AG0_AFEM1_AFEM1_ASEM1_CLR1_CADS0_DTLA0_DTLB0_DTVA0_DTVB1_DTVSM0_DPLBn1_EPS0_ELFLR0_EMLLn1_FDSI0_GRPM1_GRVWA8_GRVWB8_GSUn1_GSUAMB_GSUC0_GSUWGMRR0_GLS0_ISA1201_IU1_K1_LDSTI0_LBSPPA128_LBSPPB0_LBSPPM0_LPA8_LPB0_LPM0_LRVW8_LWPMn1_MIAV1_MIWT1_1_MO40_MGRIPMn1_NTn1_NTA0_NTB0_NTC0_NTD0_NTM0_NEPBS0_NLCA1_NLCB1_ONLL0_PGR2_PLR1_PKA0_SGROBn1_SIA3_SS1_SU32_SUM0_SUS256_SPO0_SRVW0_SSO0_SVW1_SK0_SKFTR0_SKXCCM0_SGRO0_TIN0_TLDS1_TLDSM1_ULSGRO0_USL1_UIOFGRO0_USFGROn1_VSn1_VWA1_VWB1_WSGRA0_WSGRB0_WS32_WG32_4_1_WGM8_WGMXCC1_WGMXCCGn1
    SolutionIndex: 154
    SolutionNameMin: Cijk_Alik_Bjlk_I8II_BH_SHB_HA_S_SCD_SAV_UserArgs_MT16x32x256_MI16x16x1_SN_LDSB0_AFC1_AG0_AFEM1_AFEM1_ASEM1_CLR1_CADS0_DTLA0_DTLB0_DTVA0_DTVB1_DTVSM0_DPLBn1_EPS0_ELFLR0_EMLLn1_FDSI0_GRPM1_GRVWA8_GRVWB8_GSUn1_GSUAMB_GSUC0_GSUWGMRR0_GLS0_ISA1201_IU1_K1_LDSTI0_LBSPPA256_LBSPPB0_LBSPPM0_LPA8_LPB0_LPM0_LRVW8_LWPMn1_MIAV1_MIWT1_1_MO40_MGRIPMn1_NTn1_NTA0_NTB0_NTC0_NTD0_NTM0_NEPBS0_NLCA1_NLCB1_ONLL0_PGR2_PLR1_PKA0_SGROBn1_SIA3_SS1_SU32_SUM0_SUS256_SPO0_SRVW0_SSO0_SVW1_SK0_SKFTR0_SKXCCM0_SGRO0_TIN0_TLDS1_TLDSM1_ULSGRO0_USL1_UIOFGRO0_USFGROn1_VSn1_VWA1_VWB1_WSGRA0_WSGRB0_WS32_WG16_4_1_WGM8_WGMXCC1_WGMXCCGn1
    SolutionIndex: 155
    SolutionNameMin: Cijk_Alik_Bjlk_I8II_BH_SHB_HA_S_SCD_SAV_UserArgs_MT32x32x256_MI16x16x1_SN_LDSB0_AFC1_AG0_AFEM1_AFEM1_ASEM1_CLR1_CADS0_DTLA0_DTLB0_DTVA0_DTVB1_DTVSM0_DPLBn1_EPS1_ELFLR0_EMLLn1_FDSI0_GRPM1_GRVWA8_GRVWB8_GSUn1_GSUAMB_GSUC0_GSUWGMRR0_GLS0_ISA1201_IU1_K1_LDSTI0_LBSPPA256_LBSPPB0_LBSPPM0_LPA8_LPB0_LPM0_LRVW8_LWPMn1_MIAV1_MIWT1_1_MO40_MGRIPMn1_NTn1_NTA0_NTB0_NTC0_NTD0_NTM0_NEPBS0_NLCA1_NLCB1_ONLL0_PGR1_PLR1_PKA0_SGROBn1_SIA3_SS0_SU32_SUM0_SUS256_SPO0_SRVW0_SSO0_SVW8_SK0_SKFTR0_SKXCCM0_SGRO0_TIN0_TLDS1_TLDSM1_ULSGRO0_USL1_UIOFGRO0_USFGROn1_VSn1_VWA1_VWB1_WSGRA0_WSGRB0_WS32_WG32_4_1_WGM8_WGMXCC1_WGMXCCGn1
    SolutionIndex: 156
    SolutionNameMin: Cijk_Alik_Bjlk_I8II_BH_SHB_HA_S_SCD_SAV_UserArgs_MT32x32x64_MI16x16x1_SN_LDSB0_AFC1_AG0_AFEM1_AFEM1_ASEM64_CLR1_CADS0_DTLA0_DTLB0_DTVA1_DTVB0_DTVSM0_DPLBn1_EPS0_ELFLR0_EMLLn1_FDSI0_GRPM1_GRVWA16_GRVWB16_GSUn1_GSUAMB_GSUC0_GSUWGMRR0_GLS0_ISA1201_IU1_K1_LDSTI0_LBSPPA0_LBSPPB512_LBSPPM0_LPA0_LPB16_LPM0_LRVW16_LWPMn1_MIAV1_MIWT1_1_MO40_MGRIPMn1_NTn1_NTA0_NTB0_NTC0_NTD0_NTM0_NEPBS0_NLCA2_NLCB1_ONLL0_PGR2_PLR1_PKA0_SGROBn1_SIA3_SS0_SU32_SUM0_SUS256_SPO0_SRVW0_SSO0_SVW8_SK0_SKFTR0_SKXCCM0_SGRO0_TIN0_TLDS1_TLDSM1_ULSGRO0_USL1_UIOFGRO0_USFGROn1_VSn1_VWA1_VWB1_WSGRA0_WSGRB0_WS32_WG32_4_1_WGM8_WGMXCC1_WGMXCCGn1
    SolutionIndex: 157
    SolutionNameMin: Cijk_Alik_Bjlk_I8II_BH_SHB_HA_S_SCD_SAV_UserArgs_MT32x32x256_MI16x16x1_SN_LDSB0_AFC1_AG0_AFEM1_AFEM1_ASEM256_CLR1_CADS0_DTLA0_DTLB0_DTVA1_DTVB0_DTVSM0_DPLBn1_EPS1_ELFLR0_EMLLn1_FDSI0_GRPM1_GRVWA16_GRVWB16_GSUn1_GSUAMB_GSUC0_GSUWGMRR0_GLS0_ISA1201_IU1_K1_LDSTI0_LBSPPA0_LBSPPB512_LBSPPM0_LPA0_LPB16_LPM0_LRVW16_LWPMn1_MIAV1_MIWT1_1_MO40_MGRIPMn1_NTn1_NTA0_NTB0_NTC0_NTD0_NTM0_NEPBS0_NLCA8_NLCB1_ONLL0_PGR1_PLR1_PKA0_SGROBn1_SIA3_SS0_SU32_SUM0_SUS256_SPO0_SRVW0_SSO0_SVW8_SK0_SKFTR0_SKXCCM0_SGRO0_TIN0_TLDS1_TLDSM1_ULSGRO0_USL1_UIOFGRO0_USFGROn1_VSn1_VWA1_VWB1_WSGRA0_WSGRB0_WS32_WG32_4_1_WGM8_WGMXCC1_WGMXCCGn1
    SolutionIndex: 158
    SolutionNameMin: Cijk_Alik_Bjlk_I8II_BH_SHB_HA_S_SCD_SAV_UserArgs_MT128x32x128_MI16x16x1_SN_LDSB1_AFC1_AG0_AFEM1_AFEM1_ASEM1_CLR1_CADS0_DTLA0_DTLB0_DTVA0_DTVB1_DTVSM0_DPLBn1_EPS0_ELFLR0_EMLLn1_FDSI0_GRPM1_GRVWA8_GRVWB8_GSUn1_GSUAMB_GSUC0_GSUWGMRR0_GLS0_ISA1201_IU1_K1_LDSTI0_LBSPPA512_LBSPPB0_LBSPPM0_LPA8_LPB0_LPM0_LRVW8_LWPMn1_MIAV1_MIWT4_1_MO40_MGRIPMn1_NTn1_NTA0_NTB0_NTC0_NTD0_NTM0_NEPBS0_NLCA1_NLCB1_ONLL0_PGR2_PLR1_PKA0_SGROBn1_SIA3_SS1_SU32_SUM0_SUS256_SPO0_SRVW0_SSO0_SVW4_SK0_SKFTR0_SKXCCM0_SGRO0_TIN0_TLDS1_TLDSM1_ULSGRO0_USL1_UIOFGRO0_USFGROn1_VSn1_VWA4_VWB1_WSGRA0_WSGRB0_WS32_WG32_4_1_WGM8_WGMXCC1_WGMXCCGn1
    SolutionIndex: 159
    SolutionNameMin: Cijk_Alik_Bjlk_I8II_BH_SHB_HA_S_SCD_SAV_UserArgs_MT32x16x256_MI16x16x1_SN_LDSB0_AFC1_AG0_AFEM1_AFEM1_ASEM1_CLR1_CADS0_DTLA0_DTLB0_DTVA0_DTVB1_DTVSM0_DPLBn1_EPS1_ELFLR0_EMLLn1_FDSI0_GRPM1_GRVWA8_GRVWB8_GSUn1_GSUAMB_GSUC0_GSUWGMRR0_GLS0_ISA1201_IU1_K1_LDSTI0_LBSPPA256_LBSPPB0_LBSPPM0_LPA8_LPB0_LPM0_LRVW8_LWPMn1_MIAV1_MIWT1_1_MO40_MGRIPMn1_NTn1_NTA0_NTB0_NTC0_NTD0_NTM0_NEPBS0_NLCA1_NLCB1_ONLL0_PGR1_PLR1_PKA0_SGROBn1_SIA3_SS0_SU32_SUM0_SUS256_SPO0_SRVW0_SSO0_SVW8_SK0_SKFTR0_SKXCCM0_SGRO0_TIN0_TLDS1_TLDSM1_ULSGRO0_USL1_UIOFGRO0_USFGROn1_VSn1_VWA1_VWB1_WSGRA0_WSGRB0_WS32_WG32_2_1_WGM8_WGMXCC1_WGMXCCGn1
    SolutionIndex: 160
    SolutionNameMin: Cijk_Alik_Bjlk_I8II_BH_SHB_HA_S_SCD_SAV_UserArgs_MT32x32x128_MI16x16x1_SN_LDSB0_AFC1_AG0_AFEM1_AFEM1_ASEM128_CLR1_CADS0_DTLA0_DTLB0_DTVA1_DTVB0_DTVSM0_DPLBn1_EPS0_ELFLR0_EMLLn1_FDSI0_GRPM1_GRVWA16_GRVWB16_GSUn1_GSUAMB_GSUC0_GSUWGMRR0_GLS0_ISA1201_IU1_K1_LDSTI0_LBSPPA0_LBSPPB512_LBSPPM0_LPA0_LPB16_LPM0_LRVW16_LWPMn1_MIAV1_MIWT1_1_MO40_MGRIPMn1_NTn1_NTA0_NTB0_NTC0_NTD0_NTM0_NEPBS0_NLCA4_NLCB1_ONLL0_PGR2_PLR1_PKA0_SGROBn1_SIA3_SS1_SU32_SUM0_SUS256_SPO0_SRVW0_SSO0_SVW1_SK0_SKFTR0_SKXCCM0_SGRO0_TIN0_TLDS1_TLDSM1_ULSGRO0_USL1_UIOFGRO0_USFGROn1_VSn1_VWA1_VWB1_WSGRA0_WSGRB0_WS32_WG32_4_1_WGM8_WGMXCC1_WGMXCCGn1
    SolutionIndex: 161
    SolutionNameMin: Cijk_Alik_Bjlk_I8II_BH_SHB_HA_S_SCD_SAV_UserArgs_MT64x64x128_MI16x16x1_SN_LDSB0_AFC1_AG0_AFEM1_AFEM1_ASEM1_CLR1_CADS0_DTLA0_DTLB0_DTVA0_DTVB1_DTVSM0_DPLBn1_EPS0_ELFLR0_EMLLn1_FDSI0_GRPM1_GRVWA8_GRVWB8_GSUn1_GSUAMB_GSUC0_GSUWGMRR0_GLS0_ISA1201_IU1_K1_LDSTI0_LBSPPA256_LBSPPB0_LBSPPM0_LPA8_LPB0_LPM0_LRVW8_LWPMn1_MIAV1_MIWT2_2_MO40_MGRIPMn1_NTn1_NTA0_NTB0_NTC0_NTD0_NTM0_NEPBS0_NLCA1_NLCB8_ONLL0_PGR2_PLR1_PKA0_SGROBn1_SIA3_SS1_SU32_SUM0_SUS256_SPO0_SRVW0_SSO0_SVW2_SK0_SKFTR0_SKXCCM0_SGRO0_TIN0_TLDS1_TLDSM1_ULSGRO0_USL1_UIOFGRO0_USFGROn1_VSn1_VWA2_VWB1_WSGRA0_WSGRB0_WS32_WG32_4_1_WGM8_WGMXCC1_WGMXCCGn1
    SolutionIndex: 162
    SolutionNameMin: Cijk_Alik_Bjlk_I8II_BH_SHB_HA_S_SCD_SAV_UserArgs_MT16x32x64_MI16x16x1_SN_LDSB0_AFC1_AG0_AFEM1_AFEM1_ASEM1_CLR1_CADS0_DTLA0_DTLB0_DTVA0_DTVB1_DTVSM0_DPLBn1_EPS1_ELFLR0_EMLLn1_FDSI0_GRPM1_GRVWA8_GRVWB8_GSUn1_GSUAMB_GSUC0_GSUWGMRR0_GLS0_ISA1201_IU1_K1_LDSTI0_LBSPPA128_LBSPPB0_LBSPPM0_LPA8_LPB0_LPM0_LRVW8_LWPMn1_MIAV1_MIWT1_1_MO40_MGRIPMn1_NTn1_NTA0_NTB0_NTC0_NTD0_NTM0_NEPBS0_NLCA1_NLCB1_ONLL0_PGR1_PLR1_PKA0_SGROBn1_SIA3_SS0_SU32_SUM0_SUS256_SPO0_SRVW0_SSO0_SVW8_SK0_SKFTR0_SKXCCM0_SGRO0_TIN0_TLDS1_TLDSM1_ULSGRO0_USL1_UIOFGRO0_USFGROn1_VSn1_VWA1_VWB1_WSGRA0_WSGRB0_WS32_WG16_4_1_WGM8_WGMXCC1_WGMXCCGn1
    SolutionIndex: 163
    SolutionNameMin: Cijk_Alik_Bjlk_I8II_BH_SHB_HA_S_SCD_SAV_UserArgs_MT128x128x32_MI16x16x1_SN_LDSB1_AFC1_AG0_AFEM1_AFEM1_ASEM1_CLR1_CADS0_DTLA0_DTLB0_DTVA0_DTVB0_DTVSM0_DPLBn1_EPS0_ELFLR0_EMLLn1_FDSI0_GRPM1_GRVWA8_GRVWB8_GSUn1_GSUAMB_GSUC0_GSUWGMRR0_GLS0_ISA1201_IU2_K1_LDSTI0_LBSPPA256_LBSPPB1024_LBSPPM0_LPA8_LPB32_LPM0_LRVW8_LWPMn1_MIAV1_MIWT8_2_MO40_MGRIPMn1_NTn1_NTA0_NTB0_NTC0_NTD0_NTM0_NEPBS0_NLCA1_NLCB1_ONLL0_PGR2_PLR1_PKA0_SGROBn1_SIA2_SS1_SU32_SUM0_SUS256_SPO0_SRVW0_SSO0_SVW8_SK0_SKFTR0_SKXCCM0_SGRO0_TIN0_TLDS1_TLDSM1_ULSGRO1_USL1_UIOFGRO0_USFGROn1_VSn1_VWA8_VWB2_WSGRA0_WSGRB0_WS32_WG16_8_1_WGM8_WGMXCC1_WGMXCCGn1
    SolutionIndex: 164
    SolutionNameMin: Cijk_Alik_Bjlk_I8II_BH_SHB_HA_S_SCD_SAV_UserArgs_MT16x16x128_MI16x16x1_SN_LDSB0_AFC1_AG0_AFEM1_AFEM1_ASEM1_CLR1_CADS0_DTLA0_DTLB0_DTVA0_DTVB1_DTVSM0_DPLBn1_EPS1_ELFLR0_EMLLn1_FDSI0_GRPM1_GRVWA8_GRVWB8_GSUn1_GSUAMB_GSUC0_GSUWGMRR0_GLS0_ISA1201_IU1_K1_LDSTI0_LBSPPA128_LBSPPB0_LBSPPM0_LPA8_LPB0_LPM0_LRVW8_LWPMn1_MIAV1_MIWT1_1_MO40_MGRIPMn1_NTn1_NTA0_NTB0_NTC0_NTD0_NTM0_NEPBS0_NLCA1_NLCB1_ONLL0_PGR1_PLR1_PKA0_SGROBn1_SIA3_SS1_SU32_SUM0_SUS256_SPO0_SRVW0_SSO0_SVW1_SK0_SKFTR0_SKXCCM0_SGRO0_TIN0_TLDS1_TLDSM1_ULSGRO0_USL1_UIOFGRO0_USFGROn1_VSn1_VWA1_VWB1_WSGRA0_WSGRB0_WS32_WG16_2_1_WGM8_WGMXCC1_WGMXCCGn1
    SolutionIndex: 165
    SolutionNameMin: Cijk_Alik_Bjlk_I8II_BH_SHB_HA_S_SCD_SAV_UserArgs_MT32x16x128_MI16x16x1_SN_LDSB0_AFC1_AG0_AFEM1_AFEM1_ASEM1_CLR1_CADS0_DTLA0_DTLB0_DTVA0_DTVB1_DTVSM0_DPLBn1_EPS0_ELFLR0_EMLLn1_FDSI0_GRPM1_GRVWA8_GRVWB8_GSUn1_GSUAMB_GSUC0_GSUWGMRR0_GLS0_ISA1201_IU1_K1_LDSTI0_LBSPPA128_LBSPPB0_LBSPPM0_LPA8_LPB0_LPM0_LRVW8_LWPMn1_MIAV1_MIWT1_1_MO40_MGRIPMn1_NTn1_NTA0_NTB0_NTC0_NTD0_NTM0_NEPBS0_NLCA1_NLCB1_ONLL0_PGR2_PLR1_PKA0_SGROBn1_SIA3_SS0_SU32_SUM0_SUS256_SPO0_SRVW0_SSO0_SVW8_SK0_SKFTR0_SKXCCM0_SGRO0_TIN0_TLDS1_TLDSM1_ULSGRO0_USL1_UIOFGRO0_USFGROn1_VSn1_VWA1_VWB1_WSGRA0_WSGRB0_WS32_WG32_2_1_WGM8_WGMXCC1_WGMXCCGn1
    SolutionIndex: 166
    SolutionNameMin: Cijk_Alik_Bjlk_I8II_BH_SHB_HA_S_SCD_SAV_UserArgs_MT32x16x256_MI16x16x1_SN_LDSB0_AFC1_AG0_AFEM1_AFEM1_ASEM1_CLR1_CADS0_DTLA0_DTLB0_DTVA0_DTVB1_DTVSM0_DPLBn1_EPS1_ELFLR0_EMLLn1_FDSI0_GRPM1_GRVWA8_GRVWB8_GSUn1_GSUAMB_GSUC0_GSUWGMRR0_GLS0_ISA1201_IU1_K1_LDSTI0_LBSPPA256_LBSPPB0_LBSPPM0_LPA8_LPB0_LPM0_LRVW8_LWPMn1_MIAV1_MIWT1_1_MO40_MGRIPMn1_NTn1_NTA0_NTB0_NTC0_NTD0_NTM0_NEPBS0_NLCA1_NLCB1_ONLL0_PGR1_PLR1_PKA0_SGROBn1_SIA3_SS1_SU32_SUM0_SUS256_SPO0_SRVW0_SSO0_SVW1_SK0_SKFTR0_SKXCCM0_SGRO0_TIN0_TLDS1_TLDSM1_ULSGRO0_USL1_UIOFGRO0_USFGROn1_VSn1_VWA1_VWB1_WSGRA0_WSGRB0_WS32_WG32_2_1_WGM8_WGMXCC1_WGMXCCGn1
    SolutionIndex: 167
    SolutionNameMin: Cijk_Alik_Bjlk_I8II_BH_SHB_HA_S_SCD_SAV_UserArgs_MT32x32x128_MI16x16x1_SN_LDSB0_AFC1_AG0_AFEM1_AFEM1_ASEM128_CLR1_CADS0_DTLA0_DTLB0_DTVA1_DTVB0_DTVSM0_DPLBn1_EPS1_ELFLR0_EMLLn1_FDSI0_GRPM1_GRVWA16_GRVWB16_GSUn1_GSUAMB_GSUC0_GSUWGMRR0_GLS0_ISA1201_IU1_K1_LDSTI0_LBSPPA0_LBSPPB512_LBSPPM0_LPA0_LPB16_LPM0_LRVW16_LWPMn1_MIAV1_MIWT1_1_MO40_MGRIPMn1_NTn1_NTA0_NTB0_NTC0_NTD0_NTM0_NEPBS0_NLCA4_NLCB1_ONLL0_PGR1_PLR1_PKA0_SGROBn1_SIA3_SS1_SU32_SUM0_SUS256_SPO0_SRVW0_SSO0_SVW1_SK0_SKFTR0_SKXCCM0_SGRO0_TIN0_TLDS1_TLDSM1_ULSGRO0_USL1_UIOFGRO0_USFGROn1_VSn1_VWA1_VWB1_WSGRA0_WSGRB0_WS32_WG32_4_1_WGM8_WGMXCC1_WGMXCCGn1
    SolutionIndex: 168
    SolutionNameMin: Cijk_Alik_Bjlk_I8II_BH_SHB_HA_S_SCD_SAV_UserArgs_MT32x32x128_MI16x16x1_SN_LDSB0_AFC1_AG0_AFEM1_AFEM1_ASEM128_CLR1_CADS0_DTLA0_DTLB0_DTVA1_DTVB0_DTVSM0_DPLBn1_EPS1_ELFLR0_EMLLn1_FDSI0_GRPM1_GRVWA16_GRVWB16_GSUn1_GSUAMB_GSUC0_GSUWGMRR0_GLS0_ISA1201_IU1_K1_LDSTI0_LBSPPA0_LBSPPB512_LBSPPM0_LPA0_LPB16_LPM0_LRVW16_LWPMn1_MIAV1_MIWT1_1_MO40_MGRIPMn1_NTn1_NTA0_NTB0_NTC0_NTD0_NTM0_NEPBS0_NLCA4_NLCB1_ONLL0_PGR1_PLR1_PKA0_SGROBn1_SIA3_SS0_SU32_SUM0_SUS256_SPO0_SRVW0_SSO0_SVW8_SK0_SKFTR0_SKXCCM0_SGRO0_TIN0_TLDS1_TLDSM1_ULSGRO0_USL1_UIOFGRO0_USFGROn1_VSn1_VWA1_VWB1_WSGRA0_WSGRB0_WS32_WG32_4_1_WGM8_WGMXCC1_WGMXCCGn1
    SolutionIndex: 169
    SolutionNameMin: Cijk_Alik_Bjlk_I8II_BH_SHB_HA_S_SCD_SAV_UserArgs_MT32x128x64_MI16x16x1_SN_LDSB0_AFC1_AG0_AFEM1_AFEM1_ASEM1_CLR1_CADS0_DTLA0_DTLB0_DTVA0_DTVB1_DTVSM0_DPLBn1_EPS1_ELFLR0_EMLLn1_FDSI0_GRPM1_GRVWA8_GRVWB8_GSUn1_GSUAMB_GSUC0_GSUWGMRR0_GLS0_ISA1201_IU1_K1_LDSTI0_LBSPPA128_LBSPPB0_LBSPPM0_LPA8_LPB0_LPM0_LRVW8_LWPMn1_MIAV1_MIWT1_4_MO40_MGRIPMn1_NTn1_NTA0_NTB0_NTC0_NTD0_NTM0_NEPBS0_NLCA1_NLCB4_ONLL0_PGR1_PLR1_PKA0_SGROBn1_SIA3_SS1_SU32_SUM0_SUS256_SPO0_SRVW0_SSO0_SVW1_SK0_SKFTR0_SKXCCM0_SGRO0_TIN0_TLDS1_TLDSM1_ULSGRO0_USL1_UIOFGRO0_USFGROn1_VSn1_VWA1_VWB1_WSGRA0_WSGRB0_WS32_WG32_4_1_WGM8_WGMXCC1_WGMXCCGn1
    SolutionIndex: 170
    SolutionNameMin: Cijk_Alik_Bjlk_I8II_BH_SHB_HA_S_SCD_SAV_UserArgs_MT32x32x128_MI16x16x1_SN_LDSB0_AFC1_AG0_AFEM1_AFEM1_ASEM128_CLR1_CADS0_DTLA0_DTLB0_DTVA1_DTVB0_DTVSM0_DPLBn1_EPS0_ELFLR0_EMLLn1_FDSI0_GRPM1_GRVWA16_GRVWB16_GSUn1_GSUAMB_GSUC0_GSUWGMRR0_GLS0_ISA1201_IU1_K1_LDSTI0_LBSPPA0_LBSPPB512_LBSPPM0_LPA0_LPB16_LPM0_LRVW16_LWPMn1_MIAV1_MIWT1_1_MO40_MGRIPMn1_NTn1_NTA0_NTB0_NTC0_NTD0_NTM0_NEPBS0_NLCA4_NLCB1_ONLL0_PGR2_PLR1_PKA0_SGROBn1_SIA3_SS0_SU32_SUM0_SUS256_SPO0_SRVW0_SSO0_SVW8_SK0_SKFTR0_SKXCCM0_SGRO0_TIN0_TLDS1_TLDSM1_ULSGRO0_USL1_UIOFGRO0_USFGROn1_VSn1_VWA1_VWB1_WSGRA0_WSGRB0_WS32_WG32_4_1_WGM8_WGMXCC1_WGMXCCGn1
    SolutionIndex: 171
    SolutionNameMin: Cijk_Alik_Bjlk_I8II_BH_SHB_HA_S_SCD_SAV_UserArgs_MT128x64x64_MI16x16x1_SN_LDSB0_AFC1_AG0_AFEM1_AFEM1_ASEM1_CLR1_CADS0_DTLA0_DTLB0_DTVA0_DTVB1_DTVSM0_DPLBn1_EPS0_ELFLR0_EMLLn1_FDSI0_GRPM1_GRVWA8_GRVWB8_GSUn1_GSUAMB_GSUC0_GSUWGMRR0_GLS0_ISA1201_IU1_K1_LDSTI0_LBSPPA512_LBSPPB0_LBSPPM0_LPA8_LPB0_LPM0_LRVW8_LWPMn1_MIAV1_MIWT8_1_MO40_MGRIPMn1_NTn1_NTA0_NTB0_NTC0_NTD0_NTM0_NEPBS0_NLCA1_NLCB1_ONLL0_PGR2_PLR1_PKA0_SGROBn1_SIA3_SS0_SU32_SUM0_SUS256_SPO0_SRVW0_SSO0_SVW8_SK0_SKFTR0_SKXCCM0_SGRO0_TIN0_TLDS1_TLDSM1_ULSGRO0_USL1_UIOFGRO0_USFGROn1_VSn1_VWA8_VWB1_WSGRA0_WSGRB0_WS32_WG16_8_1_WGM8_WGMXCC1_WGMXCCGn1
    SolutionIndex: 172
    SolutionNameMin: Cijk_Alik_Bjlk_I8II_BH_SHB_HA_S_SCD_SAV_UserArgs_MT16x16x256_MI16x16x1_SN_LDSB0_AFC1_AG0_AFEM1_AFEM1_ASEM1_CLR1_CADS0_DTLA0_DTLB0_DTVA0_DTVB1_DTVSM0_DPLBn1_EPS1_ELFLR0_EMLLn1_FDSI0_GRPM1_GRVWA8_GRVWB8_GSUn1_GSUAMB_GSUC0_GSUWGMRR0_GLS0_ISA1201_IU1_K1_LDSTI0_LBSPPA256_LBSPPB0_LBSPPM0_LPA8_LPB0_LPM0_LRVW8_LWPMn1_MIAV1_MIWT1_1_MO40_MGRIPMn1_NTn1_NTA0_NTB0_NTC0_NTD0_NTM0_NEPBS0_NLCA1_NLCB1_ONLL0_PGR1_PLR1_PKA0_SGROBn1_SIA3_SS1_SU32_SUM0_SUS256_SPO0_SRVW0_SSO0_SVW1_SK0_SKFTR0_SKXCCM0_SGRO0_TIN0_TLDS1_TLDSM1_ULSGRO0_USL1_UIOFGRO0_USFGROn1_VSn1_VWA1_VWB1_WSGRA0_WSGRB0_WS32_WG16_2_1_WGM8_WGMXCC1_WGMXCCGn1
    SolutionIndex: 173
    SolutionNameMin: Cijk_Alik_Bjlk_I8II_BH_SHB_HA_S_SCD_SAV_UserArgs_MT32x16x128_MI16x16x1_SN_LDSB0_AFC1_AG0_AFEM1_AFEM1_ASEM1_CLR1_CADS0_DTLA0_DTLB0_DTVA0_DTVB1_DTVSM0_DPLBn1_EPS0_ELFLR0_EMLLn1_FDSI0_GRPM1_GRVWA8_GRVWB8_GSUn1_GSUAMB_GSUC0_GSUWGMRR0_GLS0_ISA1201_IU1_K1_LDSTI0_LBSPPA128_LBSPPB0_LBSPPM0_LPA8_LPB0_LPM0_LRVW8_LWPMn1_MIAV1_MIWT1_1_MO40_MGRIPMn1_NTn1_NTA0_NTB0_NTC0_NTD0_NTM0_NEPBS0_NLCA1_NLCB1_ONLL0_PGR2_PLR1_PKA0_SGROBn1_SIA3_SS1_SU32_SUM0_SUS256_SPO0_SRVW0_SSO0_SVW1_SK0_SKFTR0_SKXCCM0_SGRO0_TIN0_TLDS1_TLDSM1_ULSGRO0_USL1_UIOFGRO0_USFGROn1_VSn1_VWA1_VWB1_WSGRA0_WSGRB0_WS32_WG32_2_1_WGM8_WGMXCC1_WGMXCCGn1
    SolutionIndex: 174
    SolutionNameMin: Cijk_Alik_Bjlk_I8II_BH_SHB_HA_S_SCD_SAV_UserArgs_MT16x16x256_MI16x16x1_SN_LDSB0_AFC1_AG0_AFEM1_AFEM1_ASEM1_CLR1_CADS0_DTLA0_DTLB0_DTVA0_DTVB1_DTVSM0_DPLBn1_EPS1_ELFLR0_EMLLn1_FDSI0_GRPM1_GRVWA8_GRVWB8_GSUn1_GSUAMB_GSUC0_GSUWGMRR0_GLS0_ISA1201_IU1_K1_LDSTI0_LBSPPA256_LBSPPB0_LBSPPM0_LPA8_LPB0_LPM0_LRVW8_LWPMn1_MIAV1_MIWT1_1_MO40_MGRIPMn1_NTn1_NTA0_NTB0_NTC0_NTD0_NTM0_NEPBS0_NLCA1_NLCB1_ONLL0_PGR1_PLR1_PKA0_SGROBn1_SIA3_SS0_SU32_SUM0_SUS256_SPO0_SRVW0_SSO0_SVW8_SK0_SKFTR0_SKXCCM0_SGRO0_TIN0_TLDS1_TLDSM1_ULSGRO0_USL1_UIOFGRO0_USFGROn1_VSn1_VWA1_VWB1_WSGRA0_WSGRB0_WS32_WG16_2_1_WGM8_WGMXCC1_WGMXCCGn1
    SolutionIndex: 175
    SolutionNameMin: Cijk_Alik_Bjlk_I8II_BH_SHB_HA_S_SCD_SAV_UserArgs_MT32x32x256_MI16x16x1_SN_LDSB0_AFC1_AG0_AFEM1_AFEM1_ASEM256_CLR1_CADS0_DTLA0_DTLB0_DTVA1_DTVB0_DTVSM0_DPLBn1_EPS0_ELFLR0_EMLLn1_FDSI0_GRPM1_GRVWA16_GRVWB16_GSUn1_GSUAMB_GSUC0_GSUWGMRR0_GLS0_ISA1201_IU1_K1_LDSTI0_LBSPPA0_LBSPPB512_LBSPPM0_LPA0_LPB16_LPM0_LRVW16_LWPMn1_MIAV1_MIWT1_1_MO40_MGRIPMn1_NTn1_NTA0_NTB0_NTC0_NTD0_NTM0_NEPBS0_NLCA8_NLCB1_ONLL0_PGR2_PLR1_PKA0_SGROBn1_SIA3_SS0_SU32_SUM0_SUS256_SPO0_SRVW0_SSO0_SVW8_SK0_SKFTR0_SKXCCM0_SGRO0_TIN0_TLDS1_TLDSM1_ULSGRO0_USL1_UIOFGRO0_USFGROn1_VSn1_VWA1_VWB1_WSGRA0_WSGRB0_WS32_WG32_4_1_WGM8_WGMXCC1_WGMXCCGn1
    SolutionIndex: 176
    SolutionNameMin: Cijk_Alik_Bjlk_I8II_BH_SHB_HA_S_SCD_SAV_UserArgs_MT32x32x256_MI16x16x1_SN_LDSB0_AFC1_AG0_AFEM1_AFEM1_ASEM256_CLR1_CADS0_DTLA0_DTLB0_DTVA1_DTVB0_DTVSM0_DPLBn1_EPS1_ELFLR0_EMLLn1_FDSI0_GRPM1_GRVWA16_GRVWB16_GSUn1_GSUAMB_GSUC0_GSUWGMRR0_GLS0_ISA1201_IU1_K1_LDSTI0_LBSPPA0_LBSPPB512_LBSPPM0_LPA0_LPB16_LPM0_LRVW16_LWPMn1_MIAV1_MIWT1_1_MO40_MGRIPMn1_NTn1_NTA0_NTB0_NTC0_NTD0_NTM0_NEPBS0_NLCA8_NLCB1_ONLL0_PGR1_PLR1_PKA0_SGROBn1_SIA3_SS1_SU32_SUM0_SUS256_SPO0_SRVW0_SSO0_SVW1_SK0_SKFTR0_SKXCCM0_SGRO0_TIN0_TLDS1_TLDSM1_ULSGRO0_USL1_UIOFGRO0_USFGROn1_VSn1_VWA1_VWB1_WSGRA0_WSGRB0_WS32_WG32_4_1_WGM8_WGMXCC1_WGMXCCGn1
    SolutionIndex: 177
    SolutionNameMin: Cijk_Alik_Bjlk_I8II_BH_SHB_HA_S_SCD_SAV_UserArgs_MT32x32x256_MI16x16x1_SN_LDSB0_AFC1_AG0_AFEM1_AFEM1_ASEM1_CLR1_CADS0_DTLA0_DTLB0_DTVA0_DTVB1_DTVSM0_DPLBn1_EPS1_ELFLR0_EMLLn1_FDSI0_GRPM1_GRVWA8_GRVWB8_GSUn1_GSUAMB_GSUC0_GSUWGMRR0_GLS0_ISA1201_IU1_K1_LDSTI0_LBSPPA256_LBSPPB0_LBSPPM0_LPA8_LPB0_LPM0_LRVW8_LWPMn1_MIAV1_MIWT1_1_MO40_MGRIPMn1_NTn1_NTA0_NTB0_NTC0_NTD0_NTM0_NEPBS0_NLCA1_NLCB1_ONLL0_PGR1_PLR1_PKA0_SGROBn1_SIA3_SS1_SU32_SUM0_SUS256_SPO0_SRVW0_SSO0_SVW1_SK0_SKFTR0_SKXCCM0_SGRO0_TIN0_TLDS1_TLDSM1_ULSGRO0_USL1_UIOFGRO0_USFGROn1_VSn1_VWA1_VWB1_WSGRA0_WSGRB0_WS32_WG32_4_1_WGM8_WGMXCC1_WGMXCCGn1
    SolutionIndex: 178
    SolutionNameMin: Cijk_Alik_Bjlk_I8II_BH_SHB_HA_S_SCD_SAV_UserArgs_MT32x128x32_MI16x16x1_SN_LDSB0_AFC1_AG0_AFEM1_AFEM1_ASEM1_CLR1_CADS0_DTLA0_DTLB0_DTVA0_DTVB1_DTVSM0_DPLBn1_EPS0_ELFLR0_EMLLn1_FDSI0_GRPM1_GRVWA8_GRVWB8_GSUn1_GSUAMB_GSUC0_GSUWGMRR0_GLS0_ISA1201_IU1_K1_LDSTI0_LBSPPA128_LBSPPB0_LBSPPM0_LPA8_LPB0_LPM0_LRVW8_LWPMn1_MIAV1_MIWT1_4_MO40_MGRIPMn1_NTn1_NTA0_NTB0_NTC0_NTD0_NTM0_NEPBS0_NLCA1_NLCB2_ONLL0_PGR2_PLR1_PKA0_SGROBn1_SIA3_SS0_SU32_SUM0_SUS256_SPO0_SRVW0_SSO0_SVW8_SK0_SKFTR0_SKXCCM0_SGRO0_TIN0_TLDS1_TLDSM1_ULSGRO0_USL1_UIOFGRO0_USFGROn1_VSn1_VWA1_VWB1_WSGRA0_WSGRB0_WS32_WG32_4_1_WGM8_WGMXCC1_WGMXCCGn1
    SolutionIndex: 179
    SolutionNameMin: Cijk_Alik_Bjlk_I8II_BH_SHB_HA_S_SCD_SAV_UserArgs_MT128x128x32_MI16x16x1_SN_LDSB1_AFC1_AG0_AFEM1_AFEM1_ASEM1_CLR1_CADS0_DTLA0_DTLB0_DTVA0_DTVB0_DTVSM0_DPLBn1_EPS0_ELFLR0_EMLLn1_FDSI0_GRPM1_GRVWA8_GRVWB16_GSUn1_GSUAMB_GSUC0_GSUWGMRR0_GLS0_ISA1201_IU2_K1_LDSTI0_LBSPPA256_LBSPPB1024_LBSPPM0_LPA8_LPB32_LPM0_LRVW8_LWPMn1_MIAV1_MIWT8_2_MO40_MGRIPMn1_NTn1_NTA0_NTB0_NTC0_NTD0_NTM0_NEPBS0_NLCA1_NLCB1_ONLL0_PGR2_PLR1_PKA0_SGROBn1_SIA2_SS0_SU32_SUM0_SUS256_SPO0_SRVW0_SSO0_SVW8_SK0_SKFTR0_SKXCCM0_SGRO0_TIN0_TLDS1_TLDSM1_ULSGRO0_USL1_UIOFGRO0_USFGROn1_VSn1_VWA8_VWB2_WSGRA0_WSGRB0_WS32_WG16_8_1_WGM8_WGMXCC1_WGMXCCGn1
    SolutionIndex: 180
    SolutionNameMin: Cijk_Alik_Bjlk_I8II_BH_SHB_HA_S_SCD_SAV_UserArgs_MT64x128x64_MI16x16x1_SN_LDSB0_AFC1_AG0_AFEM1_AFEM1_ASEM1_CLR1_CADS0_DTLA0_DTLB0_DTVA0_DTVB1_DTVSM0_DPLBn1_EPS0_ELFLR0_EMLLn1_FDSI0_GRPM1_GRVWA8_GRVWB8_GSUn1_GSUAMB_GSUC0_GSUWGMRR0_GLS0_ISA1201_IU1_K1_LDSTI0_LBSPPA128_LBSPPB0_LBSPPM0_LPA8_LPB0_LPM0_LRVW8_LWPMn1_MIAV1_MIWT1_8_MO40_MGRIPMn1_NTn1_NTA0_NTB0_NTC0_NTD0_NTM0_NEPBS0_NLCA1_NLCB4_ONLL0_PGR2_PLR1_PKA0_SGROBn1_SIA3_SS1_SU32_SUM0_SUS256_SPO0_SRVW0_SSO0_SVW1_SK0_SKFTR0_SKXCCM0_SGRO0_TIN0_TLDS1_TLDSM1_ULSGRO0_USL1_UIOFGRO0_USFGROn1_VSn1_VWA1_VWB1_WSGRA0_WSGRB0_WS32_WG64_2_1_WGM8_WGMXCC1_WGMXCCGn1
    SolutionIndex: 181
    SolutionNameMin: Cijk_Alik_Bjlk_I8II_BH_SHB_HA_S_SCD_SAV_UserArgs_MT16x32x64_MI16x16x1_SN_LDSB0_AFC1_AG0_AFEM1_AFEM1_ASEM1_CLR1_CADS0_DTLA0_DTLB0_DTVA0_DTVB1_DTVSM0_DPLBn1_EPS0_ELFLR0_EMLLn1_FDSI0_GRPM1_GRVWA8_GRVWB8_GSUn1_GSUAMB_GSUC0_GSUWGMRR0_GLS0_ISA1201_IU1_K1_LDSTI0_LBSPPA128_LBSPPB0_LBSPPM0_LPA8_LPB0_LPM0_LRVW8_LWPMn1_MIAV1_MIWT1_1_MO40_MGRIPMn1_NTn1_NTA0_NTB0_NTC0_NTD0_NTM0_NEPBS0_NLCA1_NLCB1_ONLL0_PGR2_PLR1_PKA0_SGROBn1_SIA3_SS1_SU32_SUM0_SUS256_SPO0_SRVW0_SSO0_SVW1_SK0_SKFTR0_SKXCCM0_SGRO0_TIN0_TLDS1_TLDSM1_ULSGRO0_USL1_UIOFGRO0_USFGROn1_VSn1_VWA1_VWB1_WSGRA0_WSGRB0_WS32_WG16_4_1_WGM8_WGMXCC1_WGMXCCGn1
    SolutionIndex: 182
    SolutionNameMin: Cijk_Alik_Bjlk_I8II_BH_SHB_HA_S_SCD_SAV_UserArgs_MT32x32x256_MI16x16x1_SN_LDSB0_AFC1_AG0_AFEM1_AFEM1_ASEM1_CLR1_CADS0_DTLA0_DTLB0_DTVA0_DTVB1_DTVSM0_DPLBn1_EPS0_ELFLR0_EMLLn1_FDSI0_GRPM1_GRVWA8_GRVWB8_GSUn1_GSUAMB_GSUC0_GSUWGMRR0_GLS0_ISA1201_IU1_K1_LDSTI0_LBSPPA256_LBSPPB0_LBSPPM0_LPA8_LPB0_LPM0_LRVW8_LWPMn1_MIAV1_MIWT1_1_MO40_MGRIPMn1_NTn1_NTA0_NTB0_NTC0_NTD0_NTM0_NEPBS0_NLCA1_NLCB1_ONLL0_PGR2_PLR1_PKA0_SGROBn1_SIA3_SS1_SU32_SUM0_SUS256_SPO0_SRVW0_SSO0_SVW1_SK0_SKFTR0_SKXCCM0_SGRO0_TIN0_TLDS1_TLDSM1_ULSGRO0_USL1_UIOFGRO0_USFGROn1_VSn1_VWA1_VWB1_WSGRA0_WSGRB0_WS32_WG32_4_1_WGM8_WGMXCC1_WGMXCCGn1
    SolutionIndex: 183
    SolutionNameMin: Cijk_Alik_Bjlk_I8II_BH_SHB_HA_S_SCD_SAV_UserArgs_MT32x128x128_MI16x16x1_SN_LDSB0_AFC1_AG0_AFEM1_AFEM1_ASEM1_CLR1_CADS0_DTLA0_DTLB0_DTVA0_DTVB1_DTVSM0_DPLBn1_EPS1_ELFLR0_EMLLn1_FDSI0_GRPM1_GRVWA8_GRVWB8_GSUn1_GSUAMB_GSUC0_GSUWGMRR0_GLS0_ISA1201_IU1_K1_LDSTI0_LBSPPA128_LBSPPB0_LBSPPM0_LPA8_LPB0_LPM0_LRVW8_LWPMn1_MIAV1_MIWT1_4_MO40_MGRIPMn1_NTn1_NTA0_NTB0_NTC0_NTD0_NTM0_NEPBS0_NLCA1_NLCB8_ONLL0_PGR1_PLR1_PKA0_SGROBn1_SIA3_SS1_SU32_SUM0_SUS256_SPO0_SRVW0_SSO0_SVW1_SK0_SKFTR0_SKXCCM0_SGRO0_TIN0_TLDS1_TLDSM1_ULSGRO0_USL1_UIOFGRO0_USFGROn1_VSn1_VWA1_VWB1_WSGRA0_WSGRB0_WS32_WG32_4_1_WGM8_WGMXCC1_WGMXCCGn1
    SolutionIndex: 184
    SolutionNameMin: Cijk_Alik_Bjlk_I8II_BH_SHB_HA_S_SCD_SAV_UserArgs_MT64x64x32_MI16x16x1_SN_LDSB1_AFC1_AG0_AFEM1_AFEM1_ASEM1_CLR1_CADS0_DTLA0_DTLB0_DTVA0_DTVB0_DTVSM0_DPLBn1_EPS1_ELFLR0_EMLLn1_FDSI0_GRPM1_GRVWA8_GRVWB16_GSUn1_GSUAMB_GSUC0_GSUWGMRR0_GLS0_ISA1201_IU2_K1_LDSTI0_LBSPPA128_LBSPPB512_LBSPPM0_LPA8_LPB32_LPM0_LRVW8_LWPMn1_MIAV1_MIWT2_2_MO40_MGRIPMn1_NTn1_NTA0_NTB0_NTC0_NTD0_NTM0_NEPBS0_NLCA1_NLCB1_ONLL0_PGR1_PLR1_PKA0_SGROBn1_SIA2_SS0_SU32_SUM0_SUS256_SPO0_SRVW0_SSO0_SVW16_SK0_SKFTR0_SKXCCM0_SGRO0_TIN0_TLDS1_TLDSM1_ULSGRO0_USL1_UIOFGRO0_USFGROn1_VSn1_VWA2_VWB2_WSGRA0_WSGRB0_WS32_WG32_4_1_WGM8_WGMXCC1_WGMXCCGn1
    SolutionIndex: 185
    SolutionNameMin: Cijk_Alik_Bjlk_I8II_BH_SHB_HA_S_SCD_SAV_UserArgs_MT128x128x32_MI16x16x1_SN_LDSB1_AFC1_AG0_AFEM1_AFEM1_ASEM1_CLR1_CADS0_DTLA0_DTLB0_DTVA0_DTVB0_DTVSM0_DPLBn1_EPS1_ELFLR0_EMLLn1_FDSI0_GRPM1_GRVWA8_GRVWB16_GSUn1_GSUAMB_GSUC0_GSUWGMRR0_GLS0_ISA1201_IU2_K1_LDSTI0_LBSPPA256_LBSPPB1024_LBSPPM0_LPA8_LPB32_LPM0_LRVW8_LWPMn1_MIAV1_MIWT8_2_MO40_MGRIPMn1_NTn1_NTA0_NTB0_NTC0_NTD0_NTM0_NEPBS0_NLCA1_NLCB1_ONLL0_PGR1_PLR1_PKA0_SGROBn1_SIA2_SS0_SU32_SUM0_SUS256_SPO0_SRVW0_SSO0_SVW8_SK0_SKFTR0_SKXCCM0_SGRO0_TIN0_TLDS1_TLDSM1_ULSGRO0_USL1_UIOFGRO0_USFGROn1_VSn1_VWA8_VWB2_WSGRA0_WSGRB0_WS32_WG16_8_1_WGM8_WGMXCC1_WGMXCCGn1
    SolutionIndex: 186
    SolutionNameMin: Cijk_Alik_Bjlk_I8II_BH_SHB_HA_S_SCD_SAV_UserArgs_MT128x128x32_MI16x16x1_SN_LDSB1_AFC1_AG0_AFEM1_AFEM1_ASEM1_CLR1_CADS0_DTLA0_DTLB0_DTVA0_DTVB0_DTVSM0_DPLBn1_EPS0_ELFLR0_EMLLn1_FDSI0_GRPM1_GRVWA8_GRVWB16_GSUn1_GSUAMB_GSUC0_GSUWGMRR0_GLS0_ISA1201_IU2_K1_LDSTI0_LBSPPA256_LBSPPB1024_LBSPPM0_LPA8_LPB32_LPM0_LRVW8_LWPMn1_MIAV1_MIWT8_2_MO40_MGRIPMn1_NTn1_NTA0_NTB0_NTC0_NTD0_NTM0_NEPBS0_NLCA1_NLCB1_ONLL0_PGR2_PLR1_PKA0_SGROBn1_SIA2_SS1_SU32_SUM0_SUS256_SPO0_SRVW0_SSO0_SVW8_SK0_SKFTR0_SKXCCM0_SGRO0_TIN0_TLDS1_TLDSM1_ULSGRO0_USL1_UIOFGRO0_USFGROn1_VSn1_VWA8_VWB2_WSGRA0_WSGRB0_WS32_WG16_8_1_WGM8_WGMXCC1_WGMXCCGn1
    SolutionIndex: 187
    SolutionNameMin: Cijk_Alik_Bjlk_I8II_BH_SHB_HA_S_SCD_SAV_UserArgs_MT64x128x64_MI16x16x1_SN_LDSB0_AFC1_AG0_AFEM1_AFEM1_ASEM1_CLR1_CADS0_DTLA0_DTLB0_DTVA0_DTVB0_DTVSM0_DPLBn1_EPS0_ELFLR0_EMLLn1_FDSI0_GRPM1_GRVWA16_GRVWB16_GSUn1_GSUAMB_GSUC0_GSUWGMRR0_GLS0_ISA1201_IU1_K1_LDSTI0_LBSPPA128_LBSPPB0_LBSPPM0_LPA32_LPB0_LPM0_LRVW16_LWPMn1_MIAV1_MIWT1_8_MO40_MGRIPMn1_NTn1_NTA0_NTB0_NTC0_NTD0_NTM0_NEPBS0_NLCA1_NLCB1_ONLL0_PGR2_PLR1_PKA0_SGROBn1_SIA3_SS0_SU32_SUM0_SUS256_SPO0_SRVW0_SSO0_SVW8_SK0_SKFTR0_SKXCCM0_SGRO0_TIN0_TLDS1_TLDSM1_ULSGRO1_USL1_UIOFGRO0_USFGROn1_VSn1_VWA1_VWB8_WSGRA0_WSGRB0_WS32_WG64_2_1_WGM8_WGMXCC1_WGMXCCGn1
    SolutionIndex: 188
    SolutionNameMin: Cijk_Alik_Bjlk_I8II_BH_SHB_HA_S_SCD_SAV_UserArgs_MT16x128x32_MI16x16x1_SN_LDSB0_AFC1_AG0_AFEM1_AFEM1_ASEM32_CLR1_CADS0_DTLA0_DTLB0_DTVA1_DTVB1_DTVSM0_DPLBn1_EPS0_ELFLR0_EMLLn1_FDSI0_GRPM1_GRVWA8_GRVWB8_GSUn1_GSUAMB_GSUC0_GSUWGMRR0_GLS0_ISA1201_IU1_K1_LDSTI0_LBSPPA0_LBSPPB0_LBSPPM0_LPA0_LPB0_LPM0_LRVW8_LWPMn1_MIAV1_MIWT1_8_MO40_MGRIPMn1_NTn1_NTA0_NTB0_NTC0_NTD0_NTM0_NEPBS0_NLCA2_NLCB2_ONLL0_PGR1_PLR0_PKA0_SGROBn1_SIA3_SS0_SU32_SUM0_SUS256_SPO0_SRVW0_SSO0_SVW8_SK0_SKFTR0_SKXCCM0_SGRO0_TIN0_TLDS1_TLDSM1_ULSGRO0_USL1_UIOFGRO0_USFGROn1_VSn1_VWA1_VWB1_WSGRA0_WSGRB0_WS32_WG16_2_1_WGM8_WGMXCC1_WGMXCCGn1
    SolutionIndex: 189
    SolutionNameMin: Cijk_Alik_Bjlk_I8II_BH_SHB_HA_S_SCD_SAV_UserArgs_MT16x512x64_MI16x16x1_SN_LDSB0_AFC1_AG0_AFEM1_AFEM1_ASEM1_CLR1_CADS0_DTLA0_DTLB0_DTVA0_DTVB1_DTVSM0_DPLBn1_EPS0_ELFLR0_EMLLn1_FDSI0_GRPM1_GRVWA8_GRVWB8_GSUn1_GSUAMB_GSUC0_GSUWGMRR0_GLS0_ISA1201_IU1_K1_LDSTI0_LBSPPA128_LBSPPB0_LBSPPM0_LPA8_LPB0_LPM0_LRVW8_LWPMn1_MIAV1_MIWT1_8_MO40_MGRIPMn1_NTn1_NTA0_NTB0_NTC0_NTD0_NTM0_NEPBS0_NLCA1_NLCB4_ONLL0_PGR2_PLR1_PKA0_SGROBn1_SIA3_SS0_SU32_SUM0_SUS256_SPO0_SRVW0_SSO0_SVW8_SK0_SKFTR0_SKXCCM0_SGRO0_TIN0_TLDS1_TLDSM1_ULSGRO0_USL1_UIOFGRO0_USFGROn1_VSn1_VWA1_VWB1_WSGRA0_WSGRB0_WS32_WG16_8_1_WGM8_WGMXCC1_WGMXCCGn1
    SolutionIndex: 190
    SolutionNameMin: Cijk_Alik_Bjlk_I8II_BH_SHB_HA_S_SCD_SAV_UserArgs_MT64x64x32_MI16x16x1_SN_LDSB0_AFC1_AG0_AFEM1_AFEM1_ASEM1_CLR1_CADS0_DTLA0_DTLB0_DTVA0_DTVB1_DTVSM0_DPLBn1_EPS0_ELFLR0_EMLLn1_FDSI0_GRPM1_GRVWA8_GRVWB8_GSUn1_GSUAMB_GSUC0_GSUWGMRR0_GLS0_ISA1201_IU1_K1_LDSTI0_LBSPPA128_LBSPPB0_LBSPPM0_LPA8_LPB0_LPM0_LRVW8_LWPMn1_MIAV1_MIWT2_2_MO40_MGRIPMn1_NTn1_NTA0_NTB0_NTC0_NTD0_NTM0_NEPBS0_NLCA1_NLCB2_ONLL0_PGR2_PLR1_PKA0_SGROBn1_SIA3_SS1_SU32_SUM0_SUS256_SPO0_SRVW0_SSO0_SVW2_SK0_SKFTR0_SKXCCM0_SGRO0_TIN0_TLDS1_TLDSM1_ULSGRO0_USL1_UIOFGRO0_USFGROn1_VSn1_VWA2_VWB1_WSGRA0_WSGRB0_WS32_WG32_4_1_WGM8_WGMXCC1_WGMXCCGn1
    SolutionIndex: 191
    SolutionNameMin: Cijk_Alik_Bjlk_I8II_BH_SHB_HA_S_SCD_SAV_UserArgs_MT16x128x64_MI16x16x1_SN_LDSB0_AFC1_AG0_AFEM1_AFEM1_ASEM1_CLR1_CADS0_DTLA0_DTLB0_DTVA0_DTVB1_DTVSM0_DPLBn1_EPS1_ELFLR0_EMLLn1_FDSI0_GRPM1_GRVWA8_GRVWB8_GSUn1_GSUAMB_GSUC0_GSUWGMRR0_GLS0_ISA1201_IU1_K1_LDSTI0_LBSPPA128_LBSPPB0_LBSPPM0_LPA8_LPB0_LPM0_LRVW8_LWPMn1_MIAV1_MIWT1_8_MO40_MGRIPMn1_NTn1_NTA0_NTB0_NTC0_NTD0_NTM0_NEPBS0_NLCA1_NLCB4_ONLL0_PGR1_PLR1_PKA0_SGROBn1_SIA3_SS0_SU32_SUM0_SUS256_SPO0_SRVW0_SSO0_SVW8_SK0_SKFTR0_SKXCCM0_SGRO0_TIN0_TLDS1_TLDSM1_ULSGRO0_USL1_UIOFGRO0_USFGROn1_VSn1_VWA1_VWB1_WSGRA0_WSGRB0_WS32_WG16_2_1_WGM8_WGMXCC1_WGMXCCGn1
    SolutionIndex: 192
    SolutionNameMin: Cijk_Alik_Bjlk_I8II_BH_SHB_HA_S_SCD_SAV_UserArgs_MT16x16x128_MI16x16x1_SN_LDSB0_AFC1_AG0_AFEM1_AFEM1_ASEM1_CLR1_CADS0_DTLA0_DTLB0_DTVA0_DTVB1_DTVSM0_DPLBn1_EPS0_ELFLR0_EMLLn1_FDSI0_GRPM1_GRVWA8_GRVWB8_GSUn1_GSUAMB_GSUC0_GSUWGMRR0_GLS0_ISA1201_IU1_K1_LDSTI0_LBSPPA128_LBSPPB0_LBSPPM0_LPA8_LPB0_LPM0_LRVW8_LWPMn1_MIAV1_MIWT1_1_MO40_MGRIPMn1_NTn1_NTA0_NTB0_NTC0_NTD0_NTM0_NEPBS0_NLCA1_NLCB1_ONLL0_PGR2_PLR1_PKA0_SGROBn1_SIA3_SS0_SU32_SUM0_SUS256_SPO0_SRVW0_SSO0_SVW8_SK0_SKFTR0_SKXCCM0_SGRO0_TIN0_TLDS1_TLDSM1_ULSGRO0_USL1_UIOFGRO0_USFGROn1_VSn1_VWA1_VWB1_WSGRA0_WSGRB0_WS32_WG16_2_1_WGM8_WGMXCC1_WGMXCCGn1
    SolutionIndex: 193
    SolutionNameMin: Cijk_Alik_Bjlk_I8II_BH_SHB_HA_S_SCD_SAV_UserArgs_MT64x64x32_MI16x16x1_SN_LDSB1_AFC1_AG0_AFEM1_AFEM1_ASEM1_CLR1_CADS0_DTLA0_DTLB0_DTVA0_DTVB0_DTVSM0_DPLBn1_EPS0_ELFLR0_EMLLn1_FDSI0_GRPM1_GRVWA8_GRVWB16_GSUn1_GSUAMB_GSUC0_GSUWGMRR0_GLS0_ISA1201_IU2_K1_LDSTI0_LBSPPA128_LBSPPB512_LBSPPM0_LPA8_LPB32_LPM0_LRVW8_LWPMn1_MIAV1_MIWT2_2_MO40_MGRIPMn1_NTn1_NTA0_NTB0_NTC0_NTD0_NTM0_NEPBS0_NLCA1_NLCB1_ONLL0_PGR2_PLR1_PKA0_SGROBn1_SIA2_SS0_SU32_SUM0_SUS256_SPO0_SRVW0_SSO0_SVW16_SK0_SKFTR0_SKXCCM0_SGRO0_TIN0_TLDS1_TLDSM1_ULSGRO0_USL1_UIOFGRO0_USFGROn1_VSn1_VWA2_VWB2_WSGRA0_WSGRB0_WS32_WG32_4_1_WGM8_WGMXCC1_WGMXCCGn1
    SolutionIndex: 194
    SolutionNameMin: Cijk_Alik_Bjlk_I8II_BH_SHB_HA_S_SCD_SAV_UserArgs_MT128x128x32_MI16x16x1_SN_LDSB0_AFC1_AG0_AFEM1_AFEM1_ASEM1_CLR1_CADS0_DTLA0_DTLB0_DTVA0_DTVB1_DTVSM0_DPLBn1_EPS1_ELFLR0_EMLLn1_FDSI0_GRPM1_GRVWA8_GRVWB8_GSUn1_GSUAMB_GSUC0_GSUWGMRR0_GLS0_ISA1201_IU1_K1_LDSTI0_LBSPPA128_LBSPPB0_LBSPPM0_LPA8_LPB0_LPM0_LRVW8_LWPMn1_MIAV1_MIWT4_4_MO40_MGRIPMn1_NTn1_NTA0_NTB0_NTC0_NTD0_NTM0_NEPBS0_NLCA1_NLCB2_ONLL0_PGR1_PLR1_PKA0_SGROBn1_SIA3_SS1_SU32_SUM0_SUS256_SPO0_SRVW0_SSO0_SVW4_SK0_SKFTR0_SKXCCM0_SGRO0_TIN0_TLDS1_TLDSM1_ULSGRO0_USL1_UIOFGRO0_USFGROn1_VSn1_VWA4_VWB1_WSGRA0_WSGRB0_WS32_WG32_4_1_WGM8_WGMXCC1_WGMXCCGn1
    SolutionIndex: 195
    SolutionNameMin: Cijk_Alik_Bjlk_I8II_BH_SHB_HA_S_SCD_SAV_UserArgs_MT128x128x16_MI16x16x1_SN_LDSB1_AFC1_AG0_AFEM1_AFEM1_ASEM1_CLR1_CADS0_DTLA0_DTLB0_DTVA0_DTVB0_DTVSM0_DPLBn1_EPS0_ELFLR0_EMLLn1_FDSI0_GRPM1_GRVWA8_GRVWB16_GSUn1_GSUAMB_GSUC0_GSUWGMRR0_GLS0_ISA1201_IU1_K1_LDSTI0_LBSPPA128_LBSPPB1024_LBSPPM0_LPA8_LPB32_LPM0_LRVW8_LWPMn1_MIAV1_MIWT8_2_MO40_MGRIPMn1_NTn1_NTA0_NTB0_NTC0_NTD0_NTM0_NEPBS0_NLCA1_NLCB1_ONLL0_PGR2_PLR1_PKA0_SGROBn1_SIA2_SS1_SU32_SUM0_SUS256_SPO0_SRVW0_SSO0_SVW8_SK0_SKFTR0_SKXCCM0_SGRO0_TIN0_TLDS1_TLDSM1_ULSGRO0_USL1_UIOFGRO0_USFGROn1_VSn1_VWA8_VWB2_WSGRA0_WSGRB0_WS32_WG16_8_1_WGM8_WGMXCC1_WGMXCCGn1
    SolutionIndex: 196
    SolutionNameMin: Cijk_Alik_Bjlk_I8II_BH_SHB_HA_S_SCD_SAV_UserArgs_MT128x128x16_MI16x16x1_SN_LDSB1_AFC1_AG0_AFEM1_AFEM1_ASEM1_CLR1_CADS0_DTLA0_DTLB0_DTVA0_DTVB0_DTVSM0_DPLBn1_EPS1_ELFLR0_EMLLn1_FDSI0_GRPM1_GRVWA8_GRVWB16_GSUn1_GSUAMB_GSUC0_GSUWGMRR0_GLS0_ISA1201_IU1_K1_LDSTI0_LBSPPA128_LBSPPB1024_LBSPPM0_LPA8_LPB32_LPM0_LRVW8_LWPMn1_MIAV1_MIWT8_2_MO40_MGRIPMn1_NTn1_NTA0_NTB0_NTC0_NTD0_NTM0_NEPBS0_NLCA1_NLCB1_ONLL0_PGR1_PLR1_PKA0_SGROBn1_SIA2_SS1_SU32_SUM0_SUS256_SPO0_SRVW0_SSO0_SVW8_SK0_SKFTR0_SKXCCM0_SGRO0_TIN0_TLDS1_TLDSM1_ULSGRO0_USL1_UIOFGRO0_USFGROn1_VSn1_VWA8_VWB2_WSGRA0_WSGRB0_WS32_WG16_8_1_WGM8_WGMXCC1_WGMXCCGn1
    SolutionIndex: 197
    SolutionNameMin: Cijk_Alik_Bjlk_I8II_BH_SHB_HA_S_SCD_SAV_UserArgs_MT128x64x32_MI16x16x1_SN_LDSB0_AFC1_AG0_AFEM1_AFEM1_ASEM1_CLR1_CADS0_DTLA0_DTLB0_DTVA0_DTVB1_DTVSM0_DPLBn1_EPS1_ELFLR0_EMLLn1_FDSI0_GRPM1_GRVWA8_GRVWB8_GSUn1_GSUAMB_GSUC0_GSUWGMRR0_GLS0_ISA1201_IU1_K1_LDSTI0_LBSPPA256_LBSPPB0_LBSPPM0_LPA8_LPB0_LPM0_LRVW8_LWPMn1_MIAV1_MIWT8_1_MO40_MGRIPMn1_NTn1_NTA0_NTB0_NTC0_NTD0_NTM0_NEPBS0_NLCA1_NLCB1_ONLL0_PGR1_PLR1_PKA0_SGROBn1_SIA3_SS1_SU32_SUM0_SUS256_SPO0_SRVW0_SSO0_SVW8_SK0_SKFTR0_SKXCCM0_SGRO0_TIN0_TLDS1_TLDSM1_ULSGRO0_USL1_UIOFGRO0_USFGROn1_VSn1_VWA8_VWB1_WSGRA0_WSGRB0_WS32_WG16_8_1_WGM8_WGMXCC1_WGMXCCGn1
    SolutionIndex: 198
    SolutionNameMin: Cijk_Alik_Bjlk_I8II_BH_SHB_HA_S_SCD_SAV_UserArgs_MT128x128x32_MI16x16x1_SN_LDSB0_AFC1_AG0_AFEM1_AFEM1_ASEM1_CLR1_CADS0_DTLA0_DTLB0_DTVA0_DTVB1_DTVSM0_DPLBn1_EPS1_ELFLR0_EMLLn1_FDSI0_GRPM1_GRVWA8_GRVWB8_GSUn1_GSUAMB_GSUC0_GSUWGMRR0_GLS0_ISA1201_IU1_K1_LDSTI0_LBSPPA128_LBSPPB0_LBSPPM0_LPA8_LPB0_LPM0_LRVW8_LWPMn1_MIAV1_MIWT4_4_MO40_MGRIPMn1_NTn1_NTA0_NTB0_NTC0_NTD0_NTM0_NEPBS0_NLCA1_NLCB2_ONLL0_PGR1_PLR1_PKA0_SGROBn1_SIA3_SS0_SU32_SUM0_SUS256_SPO0_SRVW0_SSO0_SVW8_SK0_SKFTR0_SKXCCM0_SGRO0_TIN0_TLDS1_TLDSM1_ULSGRO0_USL1_UIOFGRO0_USFGROn1_VSn1_VWA4_VWB1_WSGRA0_WSGRB0_WS32_WG32_4_1_WGM8_WGMXCC1_WGMXCCGn1
    SolutionIndex: 199
    SolutionNameMin: Cijk_Alik_Bjlk_I8II_BH_SHB_HA_S_SCD_SAV_UserArgs_MT128x128x32_MI16x16x1_SN_LDSB0_AFC1_AG0_AFEM1_AFEM1_ASEM1_CLR1_CADS0_DTLA0_DTLB0_DTVA0_DTVB1_DTVSM0_DPLBn1_EPS1_ELFLR0_EMLLn1_FDSI0_GRPM1_GRVWA8_GRVWB8_GSUn1_GSUAMB_GSUC0_GSUWGMRR0_GLS0_ISA1201_IU1_K1_LDSTI0_LBSPPA256_LBSPPB0_LBSPPM0_LPA8_LPB0_LPM0_LRVW8_LWPMn1_MIAV1_MIWT8_2_MO40_MGRIPMn1_NTn1_NTA0_NTB0_NTC0_NTD0_NTM0_NEPBS0_NLCA1_NLCB2_ONLL0_PGR1_PLR1_PKA0_SGROBn1_SIA3_SS0_SU32_SUM0_SUS256_SPO0_SRVW0_SSO0_SVW8_SK0_SKFTR0_SKXCCM0_SGRO0_TIN0_TLDS1_TLDSM1_ULSGRO0_USL1_UIOFGRO0_USFGROn1_VSn1_VWA8_VWB1_WSGRA0_WSGRB0_WS32_WG16_8_1_WGM8_WGMXCC1_WGMXCCGn1
    SolutionIndex: 200
    SolutionNameMin: Cijk_Alik_Bjlk_I8II_BH_SHB_HA_S_SCD_SAV_UserArgs_MT128x128x16_MI16x16x1_SN_LDSB1_AFC1_AG0_AFEM1_AFEM1_ASEM1_CLR1_CADS0_DTLA0_DTLB0_DTVA0_DTVB0_DTVSM0_DPLBn1_EPS0_ELFLR0_EMLLn1_FDSI0_GRPM1_GRVWA8_GRVWB8_GSUn1_GSUAMB_GSUC0_GSUWGMRR0_GLS0_ISA1201_IU1_K1_LDSTI0_LBSPPA128_LBSPPB1024_LBSPPM0_LPA8_LPB32_LPM0_LRVW8_LWPMn1_MIAV1_MIWT8_2_MO40_MGRIPMn1_NTn1_NTA0_NTB0_NTC0_NTD0_NTM0_NEPBS0_NLCA1_NLCB1_ONLL0_PGR2_PLR1_PKA0_SGROBn1_SIA2_SS1_SU32_SUM0_SUS256_SPO0_SRVW0_SSO0_SVW8_SK0_SKFTR0_SKXCCM0_SGRO0_TIN0_TLDS1_TLDSM1_ULSGRO1_USL1_UIOFGRO0_USFGROn1_VSn1_VWA8_VWB2_WSGRA0_WSGRB0_WS32_WG16_8_1_WGM8_WGMXCC1_WGMXCCGn1
    SolutionIndex: 201
    SolutionNameMin: Cijk_Alik_Bjlk_I8II_BH_SHB_HA_S_SCD_SAV_UserArgs_MT128x128x16_MI16x16x1_SN_LDSB1_AFC1_AG0_AFEM1_AFEM1_ASEM1_CLR1_CADS0_DTLA0_DTLB0_DTVA0_DTVB0_DTVSM0_DPLBn1_EPS0_ELFLR0_EMLLn1_FDSI0_GRPM1_GRVWA8_GRVWB16_GSUn1_GSUAMB_GSUC0_GSUWGMRR0_GLS0_ISA1201_IU1_K1_LDSTI0_LBSPPA128_LBSPPB1024_LBSPPM0_LPA8_LPB32_LPM0_LRVW8_LWPMn1_MIAV1_MIWT8_2_MO40_MGRIPMn1_NTn1_NTA0_NTB0_NTC0_NTD0_NTM0_NEPBS0_NLCA1_NLCB1_ONLL0_PGR2_PLR1_PKA0_SGROBn1_SIA2_SS0_SU32_SUM0_SUS256_SPO0_SRVW0_SSO0_SVW8_SK0_SKFTR0_SKXCCM0_SGRO0_TIN0_TLDS1_TLDSM1_ULSGRO0_USL1_UIOFGRO0_USFGROn1_VSn1_VWA8_VWB2_WSGRA0_WSGRB0_WS32_WG16_8_1_WGM8_WGMXCC1_WGMXCCGn1
    SolutionIndex: 202
    SolutionNameMin: Cijk_Alik_Bjlk_I8II_BH_SHB_HA_S_SCD_SAV_UserArgs_MT128x128x16_MI16x16x1_SN_LDSB1_AFC1_AG0_AFEM1_AFEM1_ASEM1_CLR1_CADS0_DTLA0_DTLB0_DTVA0_DTVB0_DTVSM0_DPLBn1_EPS0_ELFLR0_EMLLn1_FDSI0_GRPM1_GRVWA8_GRVWB8_GSUn1_GSUAMB_GSUC0_GSUWGMRR0_GLS0_ISA1201_IU1_K1_LDSTI0_LBSPPA128_LBSPPB1024_LBSPPM0_LPA8_LPB32_LPM0_LRVW8_LWPMn1_MIAV1_MIWT8_2_MO40_MGRIPMn1_NTn1_NTA0_NTB0_NTC0_NTD0_NTM0_NEPBS0_NLCA1_NLCB1_ONLL0_PGR2_PLR1_PKA0_SGROBn1_SIA2_SS0_SU32_SUM0_SUS256_SPO0_SRVW0_SSO0_SVW8_SK0_SKFTR0_SKXCCM0_SGRO0_TIN0_TLDS1_TLDSM1_ULSGRO1_USL1_UIOFGRO0_USFGROn1_VSn1_VWA8_VWB2_WSGRA0_WSGRB0_WS32_WG16_8_1_WGM8_WGMXCC1_WGMXCCGn1
    SolutionIndex: 203
    SolutionNameMin: Cijk_Alik_Bjlk_I8II_BH_SHB_HA_S_SCD_SAV_UserArgs_MT128x128x32_MI16x16x1_SN_LDSB1_AFC1_AG0_AFEM1_AFEM1_ASEM1_CLR1_CADS0_DTLA0_DTLB0_DTVA0_DTVB0_DTVSM0_DPLBn1_EPS1_ELFLR0_EMLLn1_FDSI0_GRPM1_GRVWA8_GRVWB16_GSUn1_GSUAMB_GSUC0_GSUWGMRR0_GLS0_ISA1201_IU2_K1_LDSTI0_LBSPPA128_LBSPPB1024_LBSPPM0_LPA8_LPB64_LPM0_LRVW8_LWPMn1_MIAV1_MIWT4_4_MO40_MGRIPMn1_NTn1_NTA0_NTB0_NTC0_NTD0_NTM0_NEPBS0_NLCA1_NLCB1_ONLL0_PGR1_PLR1_PKA0_SGROBn1_SIA2_SS0_SU32_SUM0_SUS256_SPO0_SRVW0_SSO0_SVW8_SK0_SKFTR0_SKXCCM0_SGRO0_TIN0_TLDS1_TLDSM1_ULSGRO0_USL1_UIOFGRO0_USFGROn1_VSn1_VWA4_VWB4_WSGRA0_WSGRB0_WS32_WG32_4_1_WGM8_WGMXCC1_WGMXCCGn1
    SolutionIndex: 204
    SolutionNameMin: Cijk_Alik_Bjlk_I8II_BH_SHB_HA_S_SCD_SAV_UserArgs_MT128x128x32_MI16x16x1_SN_LDSB1_AFC1_AG0_AFEM1_AFEM1_ASEM1_CLR1_CADS0_DTLA0_DTLB0_DTVA0_DTVB0_DTVSM0_DPLBn1_EPS1_ELFLR0_EMLLn1_FDSI0_GRPM1_GRVWA8_GRVWB16_GSUn1_GSUAMB_GSUC0_GSUWGMRR0_GLS0_ISA1201_IU2_K1_LDSTI0_LBSPPA128_LBSPPB1024_LBSPPM0_LPA8_LPB64_LPM0_LRVW8_LWPMn1_MIAV1_MIWT4_4_MO40_MGRIPMn1_NTn1_NTA0_NTB0_NTC0_NTD0_NTM0_NEPBS0_NLCA1_NLCB1_ONLL0_PGR1_PLR1_PKA0_SGROBn1_SIA2_SS1_SU32_SUM0_SUS256_SPO0_SRVW0_SSO0_SVW4_SK0_SKFTR0_SKXCCM0_SGRO0_TIN0_TLDS1_TLDSM1_ULSGRO0_USL1_UIOFGRO0_USFGROn1_VSn1_VWA4_VWB4_WSGRA0_WSGRB0_WS32_WG32_4_1_WGM8_WGMXCC1_WGMXCCGn1
    SolutionIndex: 205
    SolutionNameMin: Cijk_Alik_Bjlk_I8II_BH_SHB_HA_S_SCD_SAV_UserArgs_MT128x128x32_MI16x16x1_SN_LDSB1_AFC1_AG0_AFEM1_AFEM1_ASEM1_CLR1_CADS0_DTLA0_DTLB0_DTVA0_DTVB0_DTVSM0_DPLBn1_EPS0_ELFLR0_EMLLn1_FDSI0_GRPM1_GRVWA8_GRVWB8_GSUn1_GSUAMB_GSUC0_GSUWGMRR0_GLS0_ISA1201_IU2_K1_LDSTI0_LBSPPA256_LBSPPB1024_LBSPPM0_LPA8_LPB32_LPM0_LRVW8_LWPMn1_MIAV1_MIWT8_2_MO40_MGRIPMn1_NTn1_NTA0_NTB0_NTC0_NTD0_NTM0_NEPBS0_NLCA1_NLCB1_ONLL0_PGR2_PLR1_PKA0_SGROBn1_SIA2_SS0_SU32_SUM0_SUS256_SPO0_SRVW0_SSO0_SVW8_SK0_SKFTR0_SKXCCM0_SGRO0_TIN0_TLDS1_TLDSM1_ULSGRO1_USL1_UIOFGRO0_USFGROn1_VSn1_VWA8_VWB2_WSGRA0_WSGRB0_WS32_WG16_8_1_WGM8_WGMXCC1_WGMXCCGn1
    SolutionIndex: 206
    SolutionNameMin: Cijk_Alik_Bjlk_I8II_BH_SHB_HA_S_SCD_SAV_UserArgs_MT128x32x64_MI16x16x1_SN_LDSB0_AFC1_AG0_AFEM1_AFEM1_ASEM64_CLR1_CADS0_DTLA0_DTLB0_DTVA1_DTVB1_DTVSM0_DPLBn1_EPS0_ELFLR0_EMLLn1_FDSI0_GRPM1_GRVWA8_GRVWB8_GSUn1_GSUAMB_GSUC0_GSUWGMRR0_GLS0_ISA1201_IU1_K1_LDSTI0_LBSPPA0_LBSPPB0_LBSPPM0_LPA0_LPB0_LPM0_LRVW8_LWPMn1_MIAV1_MIWT4_1_MO40_MGRIPMn1_NTn1_NTA0_NTB0_NTC0_NTD0_NTM0_NEPBS0_NLCA4_NLCB1_ONLL0_PGR1_PLR0_PKA0_SGROBn1_SIA3_SS1_SU32_SUM0_SUS256_SPO0_SRVW0_SSO0_SVW4_SK0_SKFTR0_SKXCCM0_SGRO0_TIN0_TLDS1_TLDSM1_ULSGRO0_USL1_UIOFGRO0_USFGROn1_VSn1_VWA4_VWB1_WSGRA0_WSGRB0_WS32_WG32_4_1_WGM8_WGMXCC1_WGMXCCGn1
    SolutionIndex: 207
    SolutionNameMin: Cijk_Alik_Bjlk_I8II_BH_SHB_HA_S_SCD_SAV_UserArgs_MT128x128x16_MI16x16x1_SN_LDSB0_AFC1_AG0_AFEM1_AFEM1_ASEM16_CLR1_CADS0_DTLA0_DTLB0_DTVA1_DTVB1_DTVSM0_DPLBn1_EPS0_ELFLR0_EMLLn1_FDSI0_GRPM1_GRVWA8_GRVWB8_GSUn1_GSUAMB_GSUC0_GSUWGMRR0_GLS0_ISA1201_IU1_K1_LDSTI0_LBSPPA0_LBSPPB0_LBSPPM0_LPA0_LPB0_LPM0_LRVW8_LWPMn1_MIAV1_MIWT8_2_MO40_MGRIPMn1_NTn1_NTA0_NTB0_NTC0_NTD0_NTM0_NEPBS0_NLCA1_NLCB1_ONLL0_PGR1_PLR0_PKA0_SGROBn1_SIA3_SS1_SU32_SUM0_SUS256_SPO0_SRVW0_SSO0_SVW8_SK0_SKFTR0_SKXCCM0_SGRO0_TIN0_TLDS1_TLDSM1_ULSGRO0_USL1_UIOFGRO0_USFGROn1_VSn1_VWA8_VWB1_WSGRA0_WSGRB0_WS32_WG16_8_1_WGM8_WGMXCC1_WGMXCCGn1
    SolutionIndex: 208
    SolutionNameMin: Cijk_Alik_Bjlk_I8II_BH_SHB_HA_S_SCD_SAV_UserArgs_MT128x128x16_MI16x16x1_SN_LDSB0_AFC1_AG0_AFEM1_AFEM1_ASEM16_CLR1_CADS0_DTLA0_DTLB0_DTVA1_DTVB1_DTVSM0_DPLBn1_EPS0_ELFLR0_EMLLn1_FDSI0_GRPM1_GRVWA8_GRVWB8_GSUn1_GSUAMB_GSUC0_GSUWGMRR0_GLS0_ISA1201_IU1_K1_LDSTI0_LBSPPA0_LBSPPB0_LBSPPM0_LPA0_LPB0_LPM0_LRVW8_LWPMn1_MIAV1_MIWT4_4_MO40_MGRIPMn1_NTn1_NTA0_NTB0_NTC0_NTD0_NTM0_NEPBS0_NLCA1_NLCB1_ONLL0_PGR1_PLR0_PKA0_SGROBn1_SIA3_SS0_SU32_SUM0_SUS256_SPO0_SRVW0_SSO0_SVW8_SK0_SKFTR0_SKXCCM0_SGRO0_TIN0_TLDS1_TLDSM1_ULSGRO0_USL1_UIOFGRO0_USFGROn1_VSn1_VWA4_VWB1_WSGRA0_WSGRB0_WS32_WG32_4_1_WGM8_WGMXCC1_WGMXCCGn1
- - - [1, 1, 1, 1]
    - [0, 7.40499e-07]
  - - [512, 512, 1, 64]
    - [85, 1.41]
  - - [1024, 512, 1, 64]
    - [73, 2.45]
  - - [1536, 512, 1, 64]
    - [3, 0.0]
  - - [2048, 512, 1, 64]
    - [4, 0.0]
  - - [2560, 512, 1, 64]
    - [5, 0.0]
  - - [3072, 512, 1, 64]
    - [5, 0.0]
  - - [512, 1024, 1, 64]
    - [79, 2.45]
  - - [1024, 1024, 1, 64]
    - [120, 0.0]
  - - [1536, 1024, 1, 64]
    - [194, 0.0]
  - - [2048, 1024, 1, 64]
    - [119, 0.0]
  - - [2560, 1024, 1, 64]
    - [3, 0.0]
  - - [3072, 1024, 1, 64]
    - [5, 0.0]
  - - [512, 1536, 1, 64]
    - [1, 0.0]
  - - [1024, 1536, 1, 64]
    - [120, 0.0]
  - - [1536, 1536, 1, 64]
    - [208, 0.0]
  - - [2048, 1536, 1, 64]
    - [120, 0.0]
  - - [2560, 1536, 1, 64]
    - [1, 0.0]
  - - [3072, 1536, 1, 64]
    - [7, 0.0]
  - - [512, 2048, 1, 64]
    - [1, 0.0]
  - - [1024, 2048, 1, 64]
    - [120, 0.0]
  - - [1536, 2048, 1, 64]
    - [120, 0.0]
  - - [2048, 2048, 1, 64]
    - [119, 0.0]
  - - [2560, 2048, 1, 64]
    - [1, 0.0]
  - - [3072, 2048, 1, 64]
    - [9, 0.0]
  - - [512, 2560, 1, 64]
    - [5, 0.0]
  - - [1024, 2560, 1, 64]
    - [1, 0.0]
  - - [1536, 2560, 1, 64]
    - [3, 0.0]
  - - [2048, 2560, 1, 64]
    - [5, 0.0]
  - - [2560, 2560, 1, 64]
    - [10, 0.0]
  - - [3072, 2560, 1, 64]
    - [9, 0.0]
  - - [512, 3072, 1, 64]
    - [7, 0.0]
  - - [1024, 3072, 1, 64]
    - [8, 0.0]
  - - [1536, 3072, 1, 64]
    - [10, 0.0]
  - - [2048, 3072, 1, 64]
    - [8, 0.0]
  - - [2560, 3072, 1, 64]
    - [10, 0.0]
  - - [3072, 3072, 1, 64]
    - [10, 0.0]
  - - [512, 512, 1, 256]
    - [52, 4.85]
  - - [1024, 512, 1, 256]
    - [143, 8.09]
  - - [1536, 512, 1, 256]
    - [6, 0.0]
  - - [2048, 512, 1, 256]
    - [12, 0.0]
  - - [2560, 512, 1, 256]
    - [13, 0.0]
  - - [3072, 512, 1, 256]
    - [14, 0.0]
  - - [512, 1024, 1, 256]
    - [102, 9.29]
  - - [1024, 1024, 1, 256]
    - [119, 0.0]
  - - [1536, 1024, 1, 256]
    - [147, 0.0]
  - - [2048, 1024, 1, 256]
    - [119, 0.0]
  - - [2560, 1024, 1, 256]
    - [13, 0.0]
  - - [3072, 1024, 1, 256]
    - [13, 0.0]
  - - [512, 1536, 1, 256]
    - [17, 0.0]
  - - [1024, 1536, 1, 256]
    - [119, 0.0]
  - - [1536, 1536, 1, 256]
    - [196, 0.0]
  - - [2048, 1536, 1, 256]
    - [148, 0.0]
  - - [2560, 1536, 1, 256]
    - [13, 0.0]
  - - [3072, 1536, 1, 256]
    - [16, 0.0]
  - - [512, 2048, 1, 256]
    - [11, 0.0]
  - - [1024, 2048, 1, 256]
    - [148, 0.0]
  - - [1536, 2048, 1, 256]
    - [119, 0.0]
  - - [2048, 2048, 1, 256]
    - [196, 0.0]
  - - [2560, 2048, 1, 256]
    - [14, 0.0]
  - - [3072, 2048, 1, 256]
    - [13, 0.0]
  - - [512, 2560, 1, 256]
    - [11, 0.0]
  - - [1024, 2560, 1, 256]
    - [21, 0.0]
  - - [1536, 2560, 1, 256]
    - [13, 0.0]
  - - [2048, 2560, 1, 256]
    - [22, 0.0]
  - - [2560, 2560, 1, 256]
    - [13, 0.0]
  - - [3072, 2560, 1, 256]
    - [13, 0.0]
  - - [512, 3072, 1, 256]
    - [14, 0.0]
  - - [1024, 3072, 1, 256]
    - [14, 0.0]
  - - [1536, 3072, 1, 256]
    - [13, 0.0]
  - - [2048, 3072, 1, 256]
    - [14, 0.0]
  - - [2560, 3072, 1, 256]
    - [13, 0.0]
  - - [3072, 3072, 1, 256]
    - [14, 0.0]
  - - [512, 512, 1, 512]
    - [134, 9.63]
  - - [1024, 512, 1, 512]
    - [106, 16.08]
  - - [1536, 512, 1, 512]
    - [13, 0.0]
  - - [2048, 512, 1, 512]
    - [13, 0.0]
  - - [2560, 512, 1, 512]
    - [13, 0.0]
  - - [3072, 512, 1, 512]
    - [2, 0.0]
  - - [512, 1024, 1, 512]
    - [74, 16.13]
  - - [1024, 1024, 1, 512]
    - [119, 25.81]
  - - [1536, 1024, 1, 512]
    - [13, 0.0]
  - - [2048, 1024, 1, 512]
    - [23, 0.0]
  - - [2560, 1024, 1, 512]
    - [16, 0.0]
  - - [3072, 1024, 1, 512]
    - [13, 0.0]
  - - [512, 1536, 1, 512]
    - [5, 0.0]
  - - [1024, 1536, 1, 512]
    - [11, 0.0]
  - - [1536, 1536, 1, 512]
    - [13, 0.0]
  - - [2048, 1536, 1, 512]
    - [13, 0.0]
  - - [2560, 1536, 1, 512]
    - [16, 0.0]
  - - [3072, 1536, 1, 512]
    - [14, 0.0]
  - - [512, 2048, 1, 512]
    - [14, 0.0]
  - - [1024, 2048, 1, 512]
    - [20, 0.0]
  - - [1536, 2048, 1, 512]
    - [13, 0.0]
  - - [2048, 2048, 1, 512]
    - [13, 0.0]
  - - [2560, 2048, 1, 512]
    - [13, 0.0]
  - - [3072, 2048, 1, 512]
    - [21, 0.0]
  - - [512, 2560, 1, 512]
    - [21, 0.0]
  - - [1024, 2560, 1, 512]
    - [14, 0.0]
  - - [1536, 2560, 1, 512]
    - [16, 0.0]
  - - [2048, 2560, 1, 512]
    - [16, 0.0]
  - - [2560, 2560, 1, 512]
    - [21, 0.0]
  - - [3072, 2560, 1, 512]
    - [14, 0.0]
  - - [512, 3072, 1, 512]
    - [14, 0.0]
  - - [1024, 3072, 1, 512]
    - [13, 0.0]
  - - [1536, 3072, 1, 512]
    - [13, 0.0]
  - - [2048, 3072, 1, 512]
    - [20, 0.0]
  - - [2560, 3072, 1, 512]
    - [2, 0.0]
  - - [3072, 3072, 1, 512]
    - [2, 0.0]
  - - [512, 512, 1, 1024]
    - [134, 16.87]
  - - [1024, 512, 1, 1024]
    - [143, 24.74]
  - - [1536, 512, 1, 1024]
    - [13, 0.0]
  - - [2048, 512, 1, 1024]
    - [11, 0.0]
  - - [2560, 512, 1, 1024]
    - [14, 0.0]
  - - [3072, 512, 1, 1024]
    - [14, 0.0]
  - - [512, 1024, 1, 1024]
    - [143, 25.19]
  - - [1024, 1024, 1, 1024]
    - [149, 0.0]
  - - [1536, 1024, 1, 1024]
    - [148, 0.0]
  - - [2048, 1024, 1, 1024]
    - [194, 0.0]
  - - [2560, 1024, 1, 1024]
    - [6, 0.0]
  - - [3072, 1024, 1, 1024]
    - [6, 0.0]
  - - [512, 1536, 1, 1024]
    - [10, 0.0]
  - - [1024, 1536, 1, 1024]
    - [119, 0.0]
  - - [1536, 1536, 1, 1024]
    - [119, 0.0]
  - - [2048, 1536, 1, 1024]
    - [163, 0.0]
  - - [2560, 1536, 1, 1024]
    - [13, 0.0]
  - - [3072, 1536, 1, 1024]
    - [14, 0.0]
  - - [512, 2048, 1, 1024]
    - [11, 0.0]
  - - [1024, 2048, 1, 1024]
    - [198, 0.0]
  - - [1536, 2048, 1, 1024]
    - [186, 0.0]
  - - [2048, 2048, 1, 1024]
    - [163, 0.0]
  - - [2560, 2048, 1, 1024]
    - [20, 0.0]
  - - [3072, 2048, 1, 1024]
    - [11, 0.0]
  - - [512, 2560, 1, 1024]
    - [13, 0.0]
  - - [1024, 2560, 1, 1024]
    - [2, 0.0]
  - - [1536, 2560, 1, 1024]
    - [13, 0.0]
  - - [2048, 2560, 1, 1024]
    - [13, 0.0]
  - - [2560, 2560, 1, 1024]
    - [13, 0.0]
  - - [3072, 2560, 1, 1024]
    - [21, 0.0]
  - - [512, 3072, 1, 1024]
    - [13, 0.0]
  - - [1024, 3072, 1, 1024]
    - [21, 0.0]
  - - [1536, 3072, 1, 1024]
    - [11, 0.0]
  - - [2048, 3072, 1, 1024]
    - [20, 0.0]
  - - [2560, 3072, 1, 1024]
    - [11, 0.0]
  - - [3072, 3072, 1, 1024]
    - [11, 0.0]
  - - [512, 512, 1, 2048]
    - [134, 25.52]
  - - [1024, 512, 1, 2048]
    - [106, 33.98]
  - - [1536, 512, 1, 2048]
    - [11, 0.0]
  - - [2048, 512, 1, 2048]
    - [11, 0.0]
  - - [2560, 512, 1, 2048]
    - [24, 0.0]
  - - [3072, 512, 1, 2048]
    - [13, 0.0]
  - - [512, 1024, 1, 2048]
    - [139, 36.39]
  - - [1024, 1024, 1, 2048]
    - [149, 58.01]
  - - [1536, 1024, 1, 2048]
    - [2, 0.0]
  - - [2048, 1024, 1, 2048]
    - [15, 0.0]
  - - [2560, 1024, 1, 2048]
    - [13, 0.0]
  - - [3072, 1024, 1, 2048]
    - [6, 0.0]
  - - [512, 1536, 1, 2048]
    - [13, 0.0]
  - - [1024, 1536, 1, 2048]
    - [11, 0.0]
  - - [1536, 1536, 1, 2048]
    - [19, 0.0]
  - - [2048, 1536, 1, 2048]
    - [25, 0.0]
  - - [2560, 1536, 1, 2048]
    - [14, 0.0]
  - - [3072, 1536, 1, 2048]
    - [13, 0.0]
  - - [512, 2048, 1, 2048]
    - [23, 0.0]
  - - [1024, 2048, 1, 2048]
    - [18, 0.0]
  - - [1536, 2048, 1, 2048]
    - [21, 0.0]
  - - [2048, 2048, 1, 2048]
    - [148, 70.58]
  - - [2560, 2048, 1, 2048]
    - [2, 0.0]
  - - [3072, 2048, 1, 2048]
    - [11, 0.0]
  - - [512, 2560, 1, 2048]
    - [19, 0.0]
  - - [1024, 2560, 1, 2048]
    - [2, 0.0]
  - - [1536, 2560, 1, 2048]
    - [13, 0.0]
  - - [2048, 2560, 1, 2048]
    - [25, 0.0]
  - - [2560, 2560, 1, 2048]
    - [13, 0.0]
  - - [3072, 2560, 1, 2048]
    - [13, 0.0]
  - - [512, 3072, 1, 2048]
    - [11, 0.0]
  - - [1024, 3072, 1, 2048]
    - [21, 0.0]
  - - [1536, 3072, 1, 2048]
    - [14, 0.0]
  - - [2048, 3072, 1, 2048]
    - [14, 0.0]
  - - [2560, 3072, 1, 2048]
    - [25, 0.0]
  - - [3072, 3072, 1, 2048]
    - [13, 0.0]
  - - [512, 512, 1, 3072]
    - [20, 0.0]
  - - [1024, 512, 1, 3072]
    - [2, 0.0]
  - - [1536, 512, 1, 3072]
    - [19, 0.0]
  - - [2048, 512, 1, 3072]
    - [11, 0.0]
  - - [2560, 512, 1, 3072]
    - [11, 0.0]
  - - [3072, 512, 1, 3072]
    - [2, 0.0]
  - - [512, 1024, 1, 3072]
    - [2, 0.0]
  - - [1024, 1024, 1, 3072]
    - [19, 0.0]
  - - [1536, 1024, 1, 3072]
    - [2, 0.0]
  - - [2048, 1024, 1, 3072]
    - [15, 0.0]
  - - [2560, 1024, 1, 3072]
    - [15, 0.0]
  - - [3072, 1024, 1, 3072]
    - [26, 0.0]
  - - [512, 1536, 1, 3072]
    - [10, 0.0]
  - - [1024, 1536, 1, 3072]
    - [2, 0.0]
  - - [1536, 1536, 1, 3072]
    - [19, 0.0]
  - - [2048, 1536, 1, 3072]
    - [11, 0.0]
  - - [2560, 1536, 1, 3072]
    - [20, 0.0]
  - - [3072, 1536, 1, 3072]
    - [20, 0.0]
  - - [512, 2048, 1, 3072]
    - [11, 0.0]
  - - [1024, 2048, 1, 3072]
    - [11, 0.0]
  - - [1536, 2048, 1, 3072]
    - [13, 0.0]
  - - [2048, 2048, 1, 3072]
    - [19, 0.0]
  - - [2560, 2048, 1, 3072]
    - [11, 0.0]
  - - [3072, 2048, 1, 3072]
    - [2, 0.0]
  - - [512, 2560, 1, 3072]
    - [19, 0.0]
  - - [1024, 2560, 1, 3072]
    - [2, 0.0]
  - - [1536, 2560, 1, 3072]
    - [21, 0.0]
  - - [2048, 2560, 1, 3072]
    - [13, 0.0]
  - - [2560, 2560, 1, 3072]
    - [21, 0.0]
  - - [3072, 2560, 1, 3072]
    - [11, 0.0]
  - - [512, 3072, 1, 3072]
    - [11, 0.0]
  - - [1024, 3072, 1, 3072]
    - [13, 0.0]
  - - [1536, 3072, 1, 3072]
    - [2, 0.0]
  - - [2048, 3072, 1, 3072]
    - [11, 0.0]
  - - [2560, 3072, 1, 3072]
    - [19, 0.0]
  - - [3072, 3072, 1, 3072]
    - [185, 76.16]
  - - [1, 64, 1, 1]
    - [27, 0.0]
  - - [64, 64, 1, 1]
    - [28, 0.0]
  - - [1, 64, 1, 64]
    - [29, 0.0]
  - - [64, 64, 1, 64]
    - [30, 0.0]
  - - [64, 64, 1, 256]
    - [121, 0.0]
  - - [64, 64, 1, 512]
    - [150, 0.0]
  - - [64, 64, 1, 1024]
    - [125, 0.0]
  - - [64, 64, 1, 2048]
    - [125, 0.0]
  - - [64, 64, 1, 4096]
    - [132, 0.0]
  - - [128, 64, 1, 64]
    - [31, 0.05]
  - - [192, 64, 1, 64]
    - [31, 0.0]
  - - [256, 64, 1, 64]
    - [32, 0.1]
  - - [320, 64, 1, 64]
    - [33, 0.0]
  - - [384, 64, 1, 64]
    - [34, 0.15]
  - - [448, 64, 1, 64]
    - [35, 0.0]
  - - [512, 64, 1, 64]
    - [36, 0.2]
  - - [576, 64, 1, 64]
    - [33, 0.0]
  - - [640, 64, 1, 64]
    - [37, 0.24]
  - - [704, 64, 1, 64]
    - [38, 0.0]
  - - [768, 64, 1, 64]
    - [37, 0.28]
  - - [832, 64, 1, 64]
    - [36, 0.0]
  - - [896, 64, 1, 64]
    - [39, 0.32]
  - - [960, 64, 1, 64]
    - [30, 0.0]
  - - [1024, 64, 1, 64]
    - [40, 0.37]
  - - [64, 128, 1, 64]
    - [36, 0.05]
  - - [128, 128, 1, 64]
    - [34, 0.11]
  - - [192, 128, 1, 64]
    - [41, 0.16]
  - - [256, 128, 1, 64]
    - [33, 0.21]
  - - [320, 128, 1, 64]
    - [41, 0.24]
  - - [384, 128, 1, 64]
    - [42, 0.29]
  - - [448, 128, 1, 64]
    - [39, 0.34]
  - - [512, 128, 1, 64]
    - [39, 0.39]
  - - [576, 128, 1, 64]
    - [39, 0.44]
  - - [640, 128, 1, 64]
    - [43, 0.47]
  - - [704, 128, 1, 64]
    - [44, 0.52]
  - - [768, 128, 1, 64]
    - [43, 0.56]
  - - [832, 128, 1, 64]
    - [39, 0.62]
  - - [896, 128, 1, 64]
    - [44, 0.66]
  - - [960, 128, 1, 64]
    - [45, 0.71]
  - - [1024, 128, 1, 64]
    - [39, 0.76]
  - - [64, 192, 1, 64]
    - [46, 0.0]
  - - [128, 192, 1, 64]
    - [33, 0.15]
  - - [192, 192, 1, 64]
    - [47, 0.0]
  - - [256, 192, 1, 64]
    - [39, 0.29]
  - - [320, 192, 1, 64]
    - [39, 0.0]
  - - [384, 192, 1, 64]
    - [48, 0.44]
  - - [448, 192, 1, 64]
    - [39, 0.0]
  - - [512, 192, 1, 64]
    - [39, 0.58]
  - - [576, 192, 1, 64]
    - [38, 0.0]
  - - [640, 192, 1, 64]
    - [39, 0.72]
  - - [704, 192, 1, 64]
    - [39, 0.0]
  - - [768, 192, 1, 64]
    - [49, 0.81]
  - - [832, 192, 1, 64]
    - [50, 0.0]
  - - [896, 192, 1, 64]
    - [51, 0.9]
  - - [960, 192, 1, 64]
    - [52, 0.0]
  - - [1024, 192, 1, 64]
    - [53, 1.01]
  - - [64, 256, 1, 64]
    - [54, 0.1]
  - - [128, 256, 1, 64]
    - [33, 0.2]
  - - [192, 256, 1, 64]
    - [55, 0.29]
  - - [256, 256, 1, 64]
    - [38, 0.39]
  - - [320, 256, 1, 64]
    - [39, 0.48]
  - - [384, 256, 1, 64]
    - [39, 0.57]
  - - [448, 256, 1, 64]
    - [39, 0.67]
  - - [512, 256, 1, 64]
    - [39, 0.76]
  - - [576, 256, 1, 64]
    - [51, 0.8]
  - - [640, 256, 1, 64]
    - [56, 0.91]
  - - [704, 256, 1, 64]
    - [57, 0.96]
  - - [768, 256, 1, 64]
    - [58, 1.06]
  - - [832, 256, 1, 64]
    - [59, 1.14]
  - - [896, 256, 1, 64]
    - [60, 1.23]
  - - [960, 256, 1, 64]
    - [61, 1.31]
  - - [1024, 256, 1, 64]
    - [62, 1.36]
  - - [64, 320, 1, 64]
    - [63, 0.0]
  - - [128, 320, 1, 64]
    - [39, 0.24]
  - - [192, 320, 1, 64]
    - [33, 0.0]
  - - [256, 320, 1, 64]
    - [45, 0.46]
  - - [320, 320, 1, 64]
    - [43, 0.0]
  - - [384, 320, 1, 64]
    - [39, 0.73]
  - - [448, 320, 1, 64]
    - [64, 0.0]
  - - [512, 320, 1, 64]
    - [51, 0.91]
  - - [576, 320, 1, 64]
    - [65, 0.0]
  - - [640, 320, 1, 64]
    - [58, 1.09]
  - - [704, 320, 1, 64]
    - [66, 0.0]
  - - [768, 320, 1, 64]
    - [60, 1.31]
  - - [832, 320, 1, 64]
    - [67, 0.0]
  - - [896, 320, 1, 64]
    - [68, 1.4]
  - - [960, 320, 1, 64]
    - [67, 0.0]
  - - [1024, 320, 1, 64]
    - [69, 1.52]
  - - [64, 384, 1, 64]
    - [34, 0.15]
  - - [128, 384, 1, 64]
    - [69, 0.28]
  - - [192, 384, 1, 64]
    - [38, 0.42]
  - - [256, 384, 1, 64]
    - [39, 0.55]
  - - [320, 384, 1, 64]
    - [70, 0.67]
  - - [384, 384, 1, 64]
    - [71, 0.83]
  - - [448, 384, 1, 64]
    - [44, 0.94]
  - - [512, 384, 1, 64]
    - [72, 1.06]
  - - [576, 384, 1, 64]
    - [73, 1.19]
  - - [640, 384, 1, 64]
    - [60, 1.33]
  - - [704, 384, 1, 64]
    - [74, 1.47]
  - - [768, 384, 1, 64]
    - [71, 1.51]
  - - [832, 384, 1, 64]
    - [75, 1.55]
  - - [896, 384, 1, 64]
    - [72, 1.65]
  - - [960, 384, 1, 64]
    - [76, 1.74]
  - - [1024, 384, 1, 64]
    - [77, 1.81]
  - - [64, 448, 1, 64]
    - [36, 0.0]
  - - [128, 448, 1, 64]
    - [39, 0.32]
  - - [192, 448, 1, 64]
    - [65, 0.0]
  - - [256, 448, 1, 64]
    - [39, 0.65]
  - - [320, 448, 1, 64]
    - [39, 0.0]
  - - [384, 448, 1, 64]
    - [78, 0.89]
  - - [448, 448, 1, 64]
    - [39, 0.0]
  - - [512, 448, 1, 64]
    - [79, 1.18]
  - - [576, 448, 1, 64]
    - [48, 0.0]
  - - [640, 448, 1, 64]
    - [71, 1.41]
  - - [704, 448, 1, 64]
    - [57, 0.0]
  - - [768, 448, 1, 64]
    - [80, 1.61]
  - - [832, 448, 1, 64]
    - [81, 0.0]
  - - [896, 448, 1, 64]
    - [82, 1.82]
  - - [960, 448, 1, 64]
    - [75, 0.0]
  - - [1024, 448, 1, 64]
    - [83, 2.06]
  - - [64, 512, 1, 64]
    - [36, 0.2]
  - - [128, 512, 1, 64]
    - [84, 0.38]
  - - [192, 512, 1, 64]
    - [52, 0.56]
  - - [256, 512, 1, 64]
    - [39, 0.76]
  - - [320, 512, 1, 64]
    - [38, 0.87]
  - - [384, 512, 1, 64]
    - [72, 1.06]
  - - [448, 512, 1, 64]
    - [59, 1.23]
  - - [576, 512, 1, 64]
    - [76, 1.45]
  - - [640, 512, 1, 64]
    - [86, 1.6]
  - - [704, 512, 1, 64]
    - [56, 1.7]
  - - [768, 512, 1, 64]
    - [87, 1.86]
  - - [832, 512, 1, 64]
    - [61, 1.99]
  - - [896, 512, 1, 64]
    - [61, 2.13]
  - - [960, 512, 1, 64]
    - [88, 2.28]
  - - [64, 576, 1, 64]
    - [34, 0.0]
  - - [128, 576, 1, 64]
    - [52, 0.42]
  - - [192, 576, 1, 64]
    - [70, 0.0]
  - - [256, 576, 1, 64]
    - [89, 0.78]
  - - [320, 576, 1, 64]
    - [39, 0.0]
  - - [384, 576, 1, 64]
    - [79, 1.17]
  - - [448, 576, 1, 64]
    - [39, 0.0]
  - - [512, 576, 1, 64]
    - [90, 1.44]
  - - [576, 576, 1, 64]
    - [76, 0.0]
  - - [640, 576, 1, 64]
    - [91, 1.71]
  - - [704, 576, 1, 64]
    - [74, 0.0]
  - - [768, 576, 1, 64]
    - [92, 1.98]
  - - [832, 576, 1, 64]
    - [62, 0.0]
  - - [896, 576, 1, 64]
    - [92, 2.3]
  - - [960, 576, 1, 64]
    - [67, 0.0]
  - - [1024, 576, 1, 64]
    - [92, 2.57]
  - - [64, 640, 1, 64]
    - [84, 0.24]
  - - [128, 640, 1, 64]
    - [39, 0.48]
  - - [192, 640, 1, 64]
    - [44, 0.72]
  - - [256, 640, 1, 64]
    - [53, 0.87]
  - - [320, 640, 1, 64]
    - [93, 1.04]
  - - [384, 640, 1, 64]
    - [74, 1.31]
  - - [448, 640, 1, 64]
    - [94, 1.43]
  - - [512, 640, 1, 64]
    - [68, 1.6]
  - - [576, 640, 1, 64]
    - [48, 1.74]
  - - [640, 640, 1, 64]
    - [73, 1.93]
  - - [704, 640, 1, 64]
    - [73, 2.1]
  - - [768, 640, 1, 64]
    - [72, 2.3]
  - - [832, 640, 1, 64]
    - [95, 2.44]
  - - [896, 640, 1, 64]
    - [79, 2.44]
  - - [960, 640, 1, 64]
    - [96, 2.41]
  - - [1024, 640, 1, 64]
    - [97, 2.57]
  - - [64, 704, 1, 64]
    - [98, 0.0]
  - - [128, 704, 1, 64]
    - [91, 0.5]
  - - [192, 704, 1, 64]
    - [45, 0.0]
  - - [256, 704, 1, 64]
    - [99, 0.96]
  - - [320, 704, 1, 64]
    - [38, 0.0]
  - - [384, 704, 1, 64]
    - [80, 1.42]
  - - [448, 704, 1, 64]
    - [73, 0.0]
  - - [512, 704, 1, 64]
    - [100, 1.72]
  - - [576, 704, 1, 64]
    - [75, 0.0]
  - - [640, 704, 1, 64]
    - [72, 2.12]
  - - [704, 704, 1, 64]
    - [38, 0.0]
  - - [768, 704, 1, 64]
    - [79, 2.54]
  - - [832, 704, 1, 64]
    - [67, 0.0]
  - - [896, 704, 1, 64]
    - [101, 2.56]
  - - [960, 704, 1, 64]
    - [73, 0.0]
  - - [1024, 704, 1, 64]
    - [72, 2.9]
  - - [64, 768, 1, 64]
    - [43, 0.29]
  - - [128, 768, 1, 64]
    - [39, 0.57]
  - - [192, 768, 1, 64]
    - [76, 0.81]
  - - [256, 768, 1, 64]
    - [72, 1.05]
  - - [320, 768, 1, 64]
    - [102, 1.27]
  - - [384, 768, 1, 64]
    - [75, 1.5]
  - - [448, 768, 1, 64]
    - [103, 1.6]
  - - [512, 768, 1, 64]
    - [104, 1.85]
  - - [576, 768, 1, 64]
    - [73, 2.04]
  - - [640, 768, 1, 64]
    - [59, 2.32]
  - - [704, 768, 1, 64]
    - [73, 2.44]
  - - [768, 768, 1, 64]
    - [105, 2.55]
  - - [832, 768, 1, 64]
    - [67, 2.6]
  - - [896, 768, 1, 64]
    - [106, 2.82]
  - - [960, 768, 1, 64]
    - [59, 2.97]
  - - [1024, 768, 1, 64]
    - [73, 3.07]
  - - [64, 832, 1, 64]
    - [41, 0.0]
  - - [128, 832, 1, 64]
    - [39, 0.6]
  - - [192, 832, 1, 64]
    - [57, 0.0]
  - - [256, 832, 1, 64]
    - [78, 1.14]
  - - [320, 832, 1, 64]
    - [44, 0.0]
  - - [384, 832, 1, 64]
    - [90, 1.51]
  - - [448, 832, 1, 64]
    - [57, 0.0]
  - - [512, 832, 1, 64]
    - [79, 1.99]
  - - [576, 832, 1, 64]
    - [74, 0.0]
  - - [640, 832, 1, 64]
    - [107, 2.45]
  - - [704, 832, 1, 64]
    - [67, 0.0]
  - - [768, 832, 1, 64]
    - [108, 2.61]
  - - [832, 832, 1, 64]
    - [95, 0.0]
  - - [896, 832, 1, 64]
    - [107, 3.02]
  - - [960, 832, 1, 64]
    - [109, 0.0]
  - - [1024, 832, 1, 64]
    - [110, 3.25]
  - - [64, 896, 1, 64]
    - [39, 0.34]
  - - [128, 896, 1, 64]
    - [70, 0.68]
  - - [192, 896, 1, 64]
    - [75, 0.93]
  - - [256, 896, 1, 64]
    - [56, 1.18]
  - - [320, 896, 1, 64]
    - [75, 1.4]
  - - [384, 896, 1, 64]
    - [106, 1.59]
  - - [448, 896, 1, 64]
    - [61, 1.83]
  - - [512, 896, 1, 64]
    - [72, 2.16]
  - - [576, 896, 1, 64]
    - [73, 2.4]
  - - [640, 896, 1, 64]
    - [111, 2.45]
  - - [704, 896, 1, 64]
    - [95, 2.56]
  - - [768, 896, 1, 64]
    - [72, 2.78]
  - - [832, 896, 1, 64]
    - [73, 2.94]
  - - [896, 896, 1, 64]
    - [90, 3.15]
  - - [960, 896, 1, 64]
    - [94, 3.05]
  - - [1024, 896, 1, 64]
    - [112, 3.51]
  - - [64, 960, 1, 64]
    - [113, 0.0]
  - - [128, 960, 1, 64]
    - [44, 0.72]
  - - [192, 960, 1, 64]
    - [102, 0.0]
  - - [256, 960, 1, 64]
    - [60, 1.33]
  - - [320, 960, 1, 64]
    - [57, 0.0]
  - - [384, 960, 1, 64]
    - [114, 1.74]
  - - [448, 960, 1, 64]
    - [115, 0.0]
  - - [512, 960, 1, 64]
    - [72, 2.26]
  - - [576, 960, 1, 64]
    - [67, 0.0]
  - - [640, 960, 1, 64]
    - [116, 2.54]
  - - [704, 960, 1, 64]
    - [94, 0.0]
  - - [768, 960, 1, 64]
    - [72, 2.97]
  - - [832, 960, 1, 64]
    - [85, 0.0]
  - - [896, 960, 1, 64]
    - [117, 3.22]
  - - [960, 960, 1, 64]
    - [118, 0.0]
  - - [1024, 960, 1, 64]
    - [119, 3.64]
  - - [64, 1024, 1, 64]
    - [36, 0.39]
  - - [128, 1024, 1, 64]
    - [39, 0.78]
  - - [192, 1024, 1, 64]
    - [88, 1.06]
  - - [256, 1024, 1, 64]
    - [59, 1.41]
  - - [320, 1024, 1, 64]
    - [94, 1.61]
  - - [384, 1024, 1, 64]
    - [61, 1.86]
  - - [448, 1024, 1, 64]
    - [85, 2.13]
  - - [576, 1024, 1, 64]
    - [93, 2.49]
  - - [640, 1024, 1, 64]
    - [85, 2.61]
  - - [704, 1024, 1, 64]
    - [59, 2.88]
  - - [768, 1024, 1, 64]
    - [85, 3.17]
  - - [832, 1024, 1, 64]
    - [73, 3.17]
  - - [896, 1024, 1, 64]
    - [120, 3.5]
  - - [960, 1024, 1, 64]
    - [72, 3.49]
  - - [128, 64, 1, 256]
    - [122, 0.2]
  - - [192, 64, 1, 256]
    - [123, 0.0]
  - - [256, 64, 1, 256]
    - [124, 0.4]
  - - [320, 64, 1, 256]
    - [125, 0.0]
  - - [384, 64, 1, 256]
    - [123, 0.59]
  - - [448, 64, 1, 256]
    - [125, 0.0]
  - - [512, 64, 1, 256]
    - [121, 0.79]
  - - [576, 64, 1, 256]
    - [125, 0.0]
  - - [640, 64, 1, 256]
    - [35, 0.9]
  - - [704, 64, 1, 256]
    - [126, 0.0]
  - - [768, 64, 1, 256]
    - [127, 1.09]
  - - [832, 64, 1, 256]
    - [121, 0.0]
  - - [896, 64, 1, 256]
    - [128, 1.26]
  - - [960, 64, 1, 256]
    - [128, 0.0]
  - - [1024, 64, 1, 256]
    - [129, 1.46]
  - - [64, 128, 1, 256]
    - [121, 0.2]
  - - [128, 128, 1, 256]
    - [130, 0.4]
  - - [192, 128, 1, 256]
    - [131, 0.59]
  - - [256, 128, 1, 256]
    - [125, 0.79]
  - - [320, 128, 1, 256]
    - [132, 0.93]
  - - [384, 128, 1, 256]
    - [129, 1.1]
  - - [448, 128, 1, 256]
    - [121, 1.28]
  - - [512, 128, 1, 256]
    - [129, 1.46]
  - - [576, 128, 1, 256]
    - [133, 1.58]
  - - [640, 128, 1, 256]
    - [38, 1.66]
  - - [704, 128, 1, 256]
    - [45, 1.94]
  - - [768, 128, 1, 256]
    - [134, 2.07]
  - - [832, 128, 1, 256]
    - [43, 2.24]
  - - [896, 128, 1, 256]
    - [45, 2.35]
  - - [960, 128, 1, 256]
    - [45, 2.62]
  - - [1024, 128, 1, 256]
    - [38, 2.77]
  - - [64, 192, 1, 256]
    - [132, 0.0]
  - - [128, 192, 1, 256]
    - [135, 0.59]
  - - [192, 192, 1, 256]
    - [136, 0.0]
  - - [256, 192, 1, 256]
    - [121, 1.09]
  - - [320, 192, 1, 256]
    - [123, 0.0]
  - - [384, 192, 1, 256]
    - [123, 1.59]
  - - [448, 192, 1, 256]
    - [137, 0.0]
  - - [512, 192, 1, 256]
    - [138, 1.98]
  - - [576, 192, 1, 256]
    - [139, 0.0]
  - - [640, 192, 1, 256]
    - [48, 2.51]
  - - [704, 192, 1, 256]
    - [45, 0.0]
  - - [768, 192, 1, 256]
    - [38, 2.95]
  - - [832, 192, 1, 256]
    - [38, 0.0]
  - - [896, 192, 1, 256]
    - [140, 3.17]
  - - [960, 192, 1, 256]
    - [43, 0.0]
  - - [1024, 192, 1, 256]
    - [133, 3.59]
  - - [64, 256, 1, 256]
    - [130, 0.38]
  - - [128, 256, 1, 256]
    - [141, 0.76]
  - - [192, 256, 1, 256]
    - [128, 1.09]
  - - [256, 256, 1, 256]
    - [30, 1.46]
  - - [320, 256, 1, 256]
    - [45, 1.77]
  - - [384, 256, 1, 256]
    - [38, 2.07]
  - - [448, 256, 1, 256]
    - [139, 2.42]
  - - [512, 256, 1, 256]
    - [45, 2.8]
  - - [576, 256, 1, 256]
    - [48, 2.99]
  - - [640, 256, 1, 256]
    - [48, 3.23]
  - - [704, 256, 1, 256]
    - [133, 3.45]
  - - [768, 256, 1, 256]
    - [56, 3.67]
  - - [832, 256, 1, 256]
    - [75, 3.87]
  - - [896, 256, 1, 256]
    - [48, 4.17]
  - - [960, 256, 1, 256]
    - [61, 4.6]
  - - [1024, 256, 1, 256]
    - [133, 4.95]
  - - [64, 320, 1, 256]
    - [123, 0.0]
  - - [128, 320, 1, 256]
    - [123, 0.94]
  - - [192, 320, 1, 256]
    - [121, 0.0]
  - - [256, 320, 1, 256]
    - [45, 1.77]
  - - [320, 320, 1, 256]
    - [139, 0.0]
  - - [384, 320, 1, 256]
    - [142, 2.41]
  - - [448, 320, 1, 256]
    - [38, 0.0]
  - - [512, 320, 1, 256]
    - [78, 3.21]
  - - [576, 320, 1, 256]
    - [45, 0.0]
  - - [640, 320, 1, 256]
    - [45, 3.69]
  - - [704, 320, 1, 256]
    - [38, 0.0]
  - - [768, 320, 1, 256]
    - [133, 4.56]
  - - [832, 320, 1, 256]
    - [134, 0.0]
  - - [896, 320, 1, 256]
    - [38, 5.04]
  - - [960, 320, 1, 256]
    - [140, 0.0]
  - - [1024, 320, 1, 256]
    - [143, 5.27]
  - - [64, 384, 1, 256]
    - [121, 0.59]
  - - [128, 384, 1, 256]
    - [125, 1.12]
  - - [192, 384, 1, 256]
    - [45, 1.57]
  - - [256, 384, 1, 256]
    - [38, 2.11]
  - - [320, 384, 1, 256]
    - [134, 2.6]
  - - [384, 384, 1, 256]
    - [43, 3.0]
  - - [448, 384, 1, 256]
    - [133, 3.41]
  - - [512, 384, 1, 256]
    - [52, 3.63]
  - - [576, 384, 1, 256]
    - [45, 4.13]
  - - [640, 384, 1, 256]
    - [48, 4.54]
  - - [704, 384, 1, 256]
    - [56, 4.99]
  - - [768, 384, 1, 256]
    - [43, 5.16]
  - - [832, 384, 1, 256]
    - [140, 5.32]
  - - [896, 384, 1, 256]
    - [52, 5.65]
  - - [960, 384, 1, 256]
    - [43, 6.04]
  - - [1024, 384, 1, 256]
    - [78, 6.36]
  - - [64, 448, 1, 256]
    - [125, 0.0]
  - - [128, 448, 1, 256]
    - [123, 1.28]
  - - [192, 448, 1, 256]
    - [139, 0.0]
  - - [256, 448, 1, 256]
    - [45, 2.43]
  - - [320, 448, 1, 256]
    - [134, 0.0]
  - - [384, 448, 1, 256]
    - [48, 3.35]
  - - [448, 448, 1, 256]
    - [38, 0.0]
  - - [512, 448, 1, 256]
    - [52, 4.29]
  - - [576, 448, 1, 256]
    - [38, 0.0]
  - - [640, 448, 1, 256]
    - [133, 5.02]
  - - [704, 448, 1, 256]
    - [38, 0.0]
  - - [768, 448, 1, 256]
    - [78, 5.63]
  - - [832, 448, 1, 256]
    - [38, 0.0]
  - - [896, 448, 1, 256]
    - [52, 6.53]
  - - [960, 448, 1, 256]
    - [61, 0.0]
  - - [1024, 448, 1, 256]
    - [143, 7.14]
  - - [64, 512, 1, 256]
    - [125, 0.79]
  - - [128, 512, 1, 256]
    - [123, 1.47]
  - - [192, 512, 1, 256]
    - [133, 2.08]
  - - [256, 512, 1, 256]
    - [45, 2.79]
  - - [320, 512, 1, 256]
    - [52, 3.27]
  - - [384, 512, 1, 256]
    - [38, 3.67]
  - - [448, 512, 1, 256]
    - [56, 4.26]
  - - [576, 512, 1, 256]
    - [140, 5.3]
  - - [640, 512, 1, 256]
    - [48, 5.72]
  - - [704, 512, 1, 256]
    - [52, 6.11]
  - - [768, 512, 1, 256]
    - [79, 6.54]
  - - [832, 512, 1, 256]
    - [44, 6.6]
  - - [896, 512, 1, 256]
    - [38, 7.12]
  - - [960, 512, 1, 256]
    - [61, 7.37]
  - - [64, 576, 1, 256]
    - [125, 0.0]
  - - [128, 576, 1, 256]
    - [60, 1.61]
  - - [192, 576, 1, 256]
    - [138, 0.0]
  - - [256, 576, 1, 256]
    - [52, 3.04]
  - - [320, 576, 1, 256]
    - [38, 0.0]
  - - [384, 576, 1, 256]
    - [38, 4.78]
  - - [448, 576, 1, 256]
    - [134, 0.0]
  - - [512, 576, 1, 256]
    - [134, 5.66]
  - - [576, 576, 1, 256]
    - [38, 0.0]
  - - [640, 576, 1, 256]
    - [140, 7.06]
  - - [704, 576, 1, 256]
    - [74, 0.0]
  - - [768, 576, 1, 256]
    - [79, 8.19]
  - - [832, 576, 1, 256]
    - [38, 0.0]
  - - [896, 576, 1, 256]
    - [72, 9.5]
  - - [960, 576, 1, 256]
    - [48, 0.0]
  - - [1024, 576, 1, 256]
    - [75, 9.86]
  - - [64, 640, 1, 256]
    - [124, 0.98]
  - - [128, 640, 1, 256]
    - [139, 1.89]
  - - [192, 640, 1, 256]
    - [138, 2.83]
  - - [256, 640, 1, 256]
    - [45, 3.57]
  - - [320, 640, 1, 256]
    - [48, 4.27]
  - - [384, 640, 1, 256]
    - [45, 5.19]
  - - [448, 640, 1, 256]
    - [140, 5.53]
  - - [512, 640, 1, 256]
    - [142, 6.21]
  - - [576, 640, 1, 256]
    - [134, 7.03]
  - - [640, 640, 1, 256]
    - [144, 7.54]
  - - [704, 640, 1, 256]
    - [74, 8.0]
  - - [768, 640, 1, 256]
    - [75, 8.97]
  - - [832, 640, 1, 256]
    - [75, 9.19]
  - - [896, 640, 1, 256]
    - [109, 9.93]
  - - [960, 640, 1, 256]
    - [109, 10.42]
  - - [1024, 640, 1, 256]
    - [75, 11.2]
  - - [64, 704, 1, 256]
    - [121, 0.0]
  - - [128, 704, 1, 256]
    - [139, 2.07]
  - - [192, 704, 1, 256]
    - [45, 0.0]
  - - [256, 704, 1, 256]
    - [38, 3.94]
  - - [320, 704, 1, 256]
    - [133, 0.0]
  - - [384, 704, 1, 256]
    - [38, 5.3]
  - - [448, 704, 1, 256]
    - [140, 0.0]
  - - [512, 704, 1, 256]
    - [38, 6.7]
  - - [576, 704, 1, 256]
    - [145, 0.0]
  - - [640, 704, 1, 256]
    - [61, 8.09]
  - - [704, 704, 1, 256]
    - [38, 0.0]
  - - [768, 704, 1, 256]
    - [79, 8.84]
  - - [832, 704, 1, 256]
    - [75, 0.0]
  - - [896, 704, 1, 256]
    - [143, 10.13]
  - - [960, 704, 1, 256]
    - [73, 0.0]
  - - [1024, 704, 1, 256]
    - [79, 11.61]
  - - [64, 768, 1, 256]
    - [146, 1.13]
  - - [128, 768, 1, 256]
    - [138, 2.2]
  - - [192, 768, 1, 256]
    - [38, 3.06]
  - - [256, 768, 1, 256]
    - [60, 3.93]
  - - [320, 768, 1, 256]
    - [140, 5.0]
  - - [384, 768, 1, 256]
    - [133, 5.76]
  - - [448, 768, 1, 256]
    - [43, 6.36]
  - - [512, 768, 1, 256]
    - [71, 7.26]
  - - [576, 768, 1, 256]
    - [102, 7.95]
  - - [640, 768, 1, 256]
    - [72, 8.81]
  - - [704, 768, 1, 256]
    - [48, 9.09]
  - - [768, 768, 1, 256]
    - [109, 9.66]
  - - [832, 768, 1, 256]
    - [52, 10.47]
  - - [896, 768, 1, 256]
    - [143, 11.31]
  - - [960, 768, 1, 256]
    - [75, 11.78]
  - - [1024, 768, 1, 256]
    - [72, 12.74]
  - - [64, 832, 1, 256]
    - [121, 0.0]
  - - [128, 832, 1, 256]
    - [138, 2.4]
  - - [192, 832, 1, 256]
    - [133, 0.0]
  - - [256, 832, 1, 256]
    - [45, 4.45]
  - - [320, 832, 1, 256]
    - [52, 0.0]
  - - [384, 832, 1, 256]
    - [133, 6.29]
  - - [448, 832, 1, 256]
    - [48, 0.0]
  - - [512, 832, 1, 256]
    - [143, 7.87]
  - - [576, 832, 1, 256]
    - [74, 0.0]
  - - [640, 832, 1, 256]
    - [106, 8.93]
  - - [704, 832, 1, 256]
    - [75, 0.0]
  - - [768, 832, 1, 256]
    - [72, 10.69]
  - - [832, 832, 1, 256]
    - [75, 0.0]
  - - [896, 832, 1, 256]
    - [79, 12.1]
  - - [960, 832, 1, 256]
    - [59, 0.0]
  - - [1024, 832, 1, 256]
    - [79, 12.5]
  - - [64, 896, 1, 256]
    - [121, 1.29]
  - - [128, 896, 1, 256]
    - [138, 2.49]
  - - [192, 896, 1, 256]
    - [38, 3.48]
  - - [256, 896, 1, 256]
    - [45, 4.83]
  - - [320, 896, 1, 256]
    - [133, 5.35]
  - - [384, 896, 1, 256]
    - [38, 6.37]
  - - [448, 896, 1, 256]
    - [59, 7.35]
  - - [512, 896, 1, 256]
    - [73, 8.15]
  - - [576, 896, 1, 256]
    - [74, 8.82]
  - - [640, 896, 1, 256]
    - [79, 9.79]
  - - [704, 896, 1, 256]
    - [61, 10.65]
  - - [768, 896, 1, 256]
    - [75, 11.36]
  - - [832, 896, 1, 256]
    - [75, 12.25]
  - - [896, 896, 1, 256]
    - [147, 12.84]
  - - [960, 896, 1, 256]
    - [75, 13.13]
  - - [1024, 896, 1, 256]
    - [148, 13.95]
  - - [64, 960, 1, 256]
    - [146, 0.0]
  - - [128, 960, 1, 256]
    - [137, 2.73]
  - - [192, 960, 1, 256]
    - [38, 0.0]
  - - [256, 960, 1, 256]
    - [45, 5.08]
  - - [320, 960, 1, 256]
    - [38, 0.0]
  - - [384, 960, 1, 256]
    - [140, 6.84]
  - - [448, 960, 1, 256]
    - [74, 0.0]
  - - [512, 960, 1, 256]
    - [79, 8.9]
  - - [576, 960, 1, 256]
    - [109, 0.0]
  - - [640, 960, 1, 256]
    - [109, 10.09]
  - - [704, 960, 1, 256]
    - [74, 0.0]
  - - [768, 960, 1, 256]
    - [74, 11.91]
  - - [832, 960, 1, 256]
    - [109, 0.0]
  - - [896, 960, 1, 256]
    - [149, 13.3]
  - - [960, 960, 1, 256]
    - [75, 0.0]
  - - [1024, 960, 1, 256]
    - [149, 14.97]
  - - [64, 1024, 1, 256]
    - [38, 1.5]
  - - [128, 1024, 1, 256]
    - [43, 2.96]
  - - [192, 1024, 1, 256]
    - [133, 4.15]
  - - [256, 1024, 1, 256]
    - [38, 5.4]
  - - [320, 1024, 1, 256]
    - [45, 6.27]
  - - [384, 1024, 1, 256]
    - [133, 7.41]
  - - [448, 1024, 1, 256]
    - [102, 8.37]
  - - [576, 1024, 1, 256]
    - [38, 9.62]
  - - [640, 1024, 1, 256]
    - [79, 10.59]
  - - [704, 1024, 1, 256]
    - [61, 11.55]
  - - [768, 1024, 1, 256]
    - [79, 12.66]
  - - [832, 1024, 1, 256]
    - [109, 12.66]
  - - [896, 1024, 1, 256]
    - [149, 14.45]
  - - [960, 1024, 1, 256]
    - [75, 14.06]
  - - [128, 64, 1, 512]
    - [141, 0.38]
  - - [192, 64, 1, 512]
    - [125, 0.0]
  - - [256, 64, 1, 512]
    - [130, 0.73]
  - - [320, 64, 1, 512]
    - [151, 0.0]
  - - [384, 64, 1, 512]
    - [152, 1.13]
  - - [448, 64, 1, 512]
    - [128, 0.0]
  - - [512, 64, 1, 512]
    - [152, 1.51]
  - - [576, 64, 1, 512]
    - [123, 0.0]
  - - [640, 64, 1, 512]
    - [124, 1.79]
  - - [704, 64, 1, 512]
    - [146, 0.0]
  - - [768, 64, 1, 512]
    - [121, 2.16]
  - - [832, 64, 1, 512]
    - [153, 0.0]
  - - [896, 64, 1, 512]
    - [154, 2.46]
  - - [960, 64, 1, 512]
    - [146, 0.0]
  - - [1024, 64, 1, 512]
    - [121, 2.89]
  - - [64, 128, 1, 512]
    - [155, 0.39]
  - - [128, 128, 1, 512]
    - [130, 0.76]
  - - [192, 128, 1, 512]
    - [141, 1.12]
  - - [256, 128, 1, 512]
    - [125, 1.45]
  - - [320, 128, 1, 512]
    - [121, 1.78]
  - - [384, 128, 1, 512]
    - [128, 2.11]
  - - [448, 128, 1, 512]
    - [30, 2.45]
  - - [512, 128, 1, 512]
    - [132, 2.86]
  - - [576, 128, 1, 512]
    - [121, 3.1]
  - - [640, 128, 1, 512]
    - [138, 3.43]
  - - [704, 128, 1, 512]
    - [138, 3.61]
  - - [768, 128, 1, 512]
    - [43, 3.93]
  - - [832, 128, 1, 512]
    - [137, 4.23]
  - - [896, 128, 1, 512]
    - [137, 4.53]
  - - [960, 128, 1, 512]
    - [45, 5.04]
  - - [1024, 128, 1, 512]
    - [137, 5.32]
  - - [64, 192, 1, 512]
    - [136, 0.0]
  - - [128, 192, 1, 512]
    - [124, 1.17]
  - - [192, 192, 1, 512]
    - [132, 0.0]
  - - [256, 192, 1, 512]
    - [121, 2.18]
  - - [320, 192, 1, 512]
    - [156, 0.0]
  - - [384, 192, 1, 512]
    - [43, 3.08]
  - - [448, 192, 1, 512]
    - [138, 0.0]
  - - [512, 192, 1, 512]
    - [134, 4.06]
  - - [576, 192, 1, 512]
    - [38, 0.0]
  - - [640, 192, 1, 512]
    - [134, 5.07]
  - - [704, 192, 1, 512]
    - [140, 0.0]
  - - [768, 192, 1, 512]
    - [45, 5.59]
  - - [832, 192, 1, 512]
    - [140, 0.0]
  - - [896, 192, 1, 512]
    - [38, 6.59]
  - - [960, 192, 1, 512]
    - [45, 0.0]
  - - [1024, 192, 1, 512]
    - [38, 7.3]
  - - [64, 256, 1, 512]
    - [152, 0.77]
  - - [128, 256, 1, 512]
    - [155, 1.53]
  - - [192, 256, 1, 512]
    - [121, 2.14]
  - - [256, 256, 1, 512]
    - [157, 2.82]
  - - [320, 256, 1, 512]
    - [45, 3.47]
  - - [384, 256, 1, 512]
    - [38, 4.14]
  - - [448, 256, 1, 512]
    - [134, 4.81]
  - - [512, 256, 1, 512]
    - [45, 5.48]
  - - [576, 256, 1, 512]
    - [133, 5.81]
  - - [640, 256, 1, 512]
    - [38, 6.47]
  - - [704, 256, 1, 512]
    - [38, 7.14]
  - - [768, 256, 1, 512]
    - [38, 7.63]
  - - [832, 256, 1, 512]
    - [140, 8.07]
  - - [896, 256, 1, 512]
    - [45, 8.68]
  - - [960, 256, 1, 512]
    - [140, 9.29]
  - - [1024, 256, 1, 512]
    - [133, 9.47]
  - - [64, 320, 1, 512]
    - [125, 0.0]
  - - [128, 320, 1, 512]
    - [151, 1.8]
  - - [192, 320, 1, 512]
    - [121, 0.0]
  - - [256, 320, 1, 512]
    - [134, 3.45]
  - - [320, 320, 1, 512]
    - [134, 0.0]
  - - [384, 320, 1, 512]
    - [38, 5.09]
  - - [448, 320, 1, 512]
    - [38, 0.0]
  - - [512, 320, 1, 512]
    - [38, 6.45]
  - - [576, 320, 1, 512]
    - [38, 0.0]
  - - [640, 320, 1, 512]
    - [45, 7.45]
  - - [704, 320, 1, 512]
    - [134, 0.0]
  - - [768, 320, 1, 512]
    - [38, 9.35]
  - - [832, 320, 1, 512]
    - [140, 0.0]
  - - [896, 320, 1, 512]
    - [158, 9.68]
  - - [960, 320, 1, 512]
    - [38, 0.0]
  - - [1024, 320, 1, 512]
    - [140, 11.12]
  - - [64, 384, 1, 512]
    - [159, 1.12]
  - - [128, 384, 1, 512]
    - [121, 2.12]
  - - [192, 384, 1, 512]
    - [43, 3.1]
  - - [256, 384, 1, 512]
    - [138, 4.09]
  - - [320, 384, 1, 512]
    - [43, 5.14]
  - - [384, 384, 1, 512]
    - [43, 5.81]
  - - [448, 384, 1, 512]
    - [45, 6.83]
  - - [512, 384, 1, 512]
    - [45, 7.76]
  - - [576, 384, 1, 512]
    - [45, 8.72]
  - - [640, 384, 1, 512]
    - [45, 9.43]
  - - [704, 384, 1, 512]
    - [45, 9.58]
  - - [768, 384, 1, 512]
    - [43, 10.49]
  - - [832, 384, 1, 512]
    - [45, 10.76]
  - - [896, 384, 1, 512]
    - [138, 11.72]
  - - [960, 384, 1, 512]
    - [137, 12.1]
  - - [1024, 384, 1, 512]
    - [45, 13.32]
  - - [64, 448, 1, 512]
    - [123, 0.0]
  - - [128, 448, 1, 512]
    - [41, 2.42]
  - - [192, 448, 1, 512]
    - [134, 0.0]
  - - [256, 448, 1, 512]
    - [134, 4.79]
  - - [320, 448, 1, 512]
    - [45, 0.0]
  - - [384, 448, 1, 512]
    - [45, 6.68]
  - - [448, 448, 1, 512]
    - [38, 0.0]
  - - [512, 448, 1, 512]
    - [45, 8.86]
  - - [576, 448, 1, 512]
    - [38, 0.0]
  - - [640, 448, 1, 512]
    - [133, 10.08]
  - - [704, 448, 1, 512]
    - [139, 0.0]
  - - [768, 448, 1, 512]
    - [45, 11.81]
  - - [832, 448, 1, 512]
    - [134, 0.0]
  - - [896, 448, 1, 512]
    - [145, 12.83]
  - - [960, 448, 1, 512]
    - [74, 0.0]
  - - [1024, 448, 1, 512]
    - [74, 14.16]
  - - [64, 512, 1, 512]
    - [151, 1.49]
  - - [128, 512, 1, 512]
    - [160, 2.79]
  - - [192, 512, 1, 512]
    - [139, 4.09]
  - - [256, 512, 1, 512]
    - [38, 5.43]
  - - [320, 512, 1, 512]
    - [134, 6.32]
  - - [384, 512, 1, 512]
    - [134, 7.56]
  - - [448, 512, 1, 512]
    - [134, 8.87]
  - - [576, 512, 1, 512]
    - [38, 10.0]
  - - [640, 512, 1, 512]
    - [139, 11.18]
  - - [704, 512, 1, 512]
    - [134, 11.89]
  - - [768, 512, 1, 512]
    - [140, 12.67]
  - - [832, 512, 1, 512]
    - [134, 12.9]
  - - [896, 512, 1, 512]
    - [79, 13.99]
  - - [960, 512, 1, 512]
    - [134, 14.74]
  - - [64, 576, 1, 512]
    - [128, 0.0]
  - - [128, 576, 1, 512]
    - [45, 3.11]
  - - [192, 576, 1, 512]
    - [45, 0.0]
  - - [256, 576, 1, 512]
    - [133, 5.81]
  - - [320, 576, 1, 512]
    - [140, 0.0]
  - - [384, 576, 1, 512]
    - [38, 8.72]
  - - [448, 576, 1, 512]
    - [133, 0.0]
  - - [512, 576, 1, 512]
    - [140, 10.6]
  - - [576, 576, 1, 512]
    - [38, 0.0]
  - - [640, 576, 1, 512]
    - [133, 12.72]
  - - [704, 576, 1, 512]
    - [48, 0.0]
  - - [768, 576, 1, 512]
    - [74, 14.16]
  - - [832, 576, 1, 512]
    - [52, 0.0]
  - - [896, 576, 1, 512]
    - [72, 15.36]
  - - [960, 576, 1, 512]
    - [75, 0.0]
  - - [1024, 576, 1, 512]
    - [52, 16.42]
  - - [64, 640, 1, 512]
    - [146, 1.85]
  - - [128, 640, 1, 512]
    - [43, 3.43]
  - - [192, 640, 1, 512]
    - [137, 5.11]
  - - [256, 640, 1, 512]
    - [38, 6.46]
  - - [320, 640, 1, 512]
    - [38, 7.98]
  - - [384, 640, 1, 512]
    - [45, 9.52]
  - - [448, 640, 1, 512]
    - [43, 10.16]
  - - [512, 640, 1, 512]
    - [45, 11.54]
  - - [576, 640, 1, 512]
    - [52, 12.57]
  - - [640, 640, 1, 512]
    - [74, 13.45]
  - - [704, 640, 1, 512]
    - [74, 14.78]
  - - [768, 640, 1, 512]
    - [144, 15.3]
  - - [832, 640, 1, 512]
    - [109, 15.73]
  - - [896, 640, 1, 512]
    - [145, 16.18]
  - - [960, 640, 1, 512]
    - [61, 17.44]
  - - [1024, 640, 1, 512]
    - [61, 18.45]
  - - [64, 704, 1, 512]
    - [121, 0.0]
  - - [128, 704, 1, 512]
    - [38, 3.66]
  - - [192, 704, 1, 512]
    - [45, 0.0]
  - - [256, 704, 1, 512]
    - [45, 7.0]
  - - [320, 704, 1, 512]
    - [38, 0.0]
  - - [384, 704, 1, 512]
    - [133, 9.75]
  - - [448, 704, 1, 512]
    - [140, 0.0]
  - - [512, 704, 1, 512]
    - [161, 12.27]
  - - [576, 704, 1, 512]
    - [52, 0.0]
  - - [640, 704, 1, 512]
    - [61, 14.23]
  - - [704, 704, 1, 512]
    - [134, 0.0]
  - - [768, 704, 1, 512]
    - [79, 15.52]
  - - [832, 704, 1, 512]
    - [52, 0.0]
  - - [896, 704, 1, 512]
    - [75, 16.91]
  - - [960, 704, 1, 512]
    - [75, 0.0]
  - - [1024, 704, 1, 512]
    - [79, 19.65]
  - - [64, 768, 1, 512]
    - [162, 2.07]
  - - [128, 768, 1, 512]
    - [137, 3.95]
  - - [192, 768, 1, 512]
    - [38, 5.55]
  - - [256, 768, 1, 512]
    - [43, 7.33]
  - - [320, 768, 1, 512]
    - [45, 9.16]
  - - [384, 768, 1, 512]
    - [38, 10.16]
  - - [448, 768, 1, 512]
    - [133, 11.75]
  - - [512, 768, 1, 512]
    - [133, 13.15]
  - - [576, 768, 1, 512]
    - [145, 14.14]
  - - [640, 768, 1, 512]
    - [102, 15.03]
  - - [704, 768, 1, 512]
    - [45, 15.02]
  - - [768, 768, 1, 512]
    - [72, 16.92]
  - - [832, 768, 1, 512]
    - [45, 17.7]
  - - [896, 768, 1, 512]
    - [72, 19.15]
  - - [960, 768, 1, 512]
    - [74, 19.28]
  - - [1024, 768, 1, 512]
    - [72, 21.43]
  - - [64, 832, 1, 512]
    - [151, 0.0]
  - - [128, 832, 1, 512]
    - [137, 4.46]
  - - [192, 832, 1, 512]
    - [45, 0.0]
  - - [256, 832, 1, 512]
    - [38, 8.24]
  - - [320, 832, 1, 512]
    - [48, 0.0]
  - - [384, 832, 1, 512]
    - [133, 11.29]
  - - [448, 832, 1, 512]
    - [134, 0.0]
  - - [512, 832, 1, 512]
    - [74, 13.71]
  - - [576, 832, 1, 512]
    - [74, 0.0]
  - - [640, 832, 1, 512]
    - [79, 15.39]
  - - [704, 832, 1, 512]
    - [59, 0.0]
  - - [768, 832, 1, 512]
    - [61, 17.95]
  - - [832, 832, 1, 512]
    - [75, 0.0]
  - - [896, 832, 1, 512]
    - [80, 20.08]
  - - [960, 832, 1, 512]
    - [75, 0.0]
  - - [1024, 832, 1, 512]
    - [149, 21.98]
  - - [64, 896, 1, 512]
    - [151, 2.34]
  - - [128, 896, 1, 512]
    - [134, 4.61]
  - - [192, 896, 1, 512]
    - [43, 6.33]
  - - [256, 896, 1, 512]
    - [45, 9.03]
  - - [320, 896, 1, 512]
    - [38, 10.35]
  - - [384, 896, 1, 512]
    - [133, 11.87]
  - - [448, 896, 1, 512]
    - [74, 13.27]
  - - [512, 896, 1, 512]
    - [74, 14.89]
  - - [576, 896, 1, 512]
    - [74, 15.88]
  - - [640, 896, 1, 512]
    - [75, 15.82]
  - - [704, 896, 1, 512]
    - [75, 17.32]
  - - [768, 896, 1, 512]
    - [79, 19.48]
  - - [832, 896, 1, 512]
    - [115, 19.86]
  - - [896, 896, 1, 512]
    - [149, 21.17]
  - - [960, 896, 1, 512]
    - [61, 20.71]
  - - [1024, 896, 1, 512]
    - [149, 24.26]
  - - [64, 960, 1, 512]
    - [121, 0.0]
  - - [128, 960, 1, 512]
    - [137, 5.13]
  - - [192, 960, 1, 512]
    - [45, 0.0]
  - - [256, 960, 1, 512]
    - [38, 9.49]
  - - [320, 960, 1, 512]
    - [134, 0.0]
  - - [384, 960, 1, 512]
    - [45, 12.66]
  - - [448, 960, 1, 512]
    - [75, 0.0]
  - - [512, 960, 1, 512]
    - [74, 14.84]
  - - [576, 960, 1, 512]
    - [109, 0.0]
  - - [640, 960, 1, 512]
    - [72, 16.99]
  - - [704, 960, 1, 512]
    - [75, 0.0]
  - - [768, 960, 1, 512]
    - [72, 20.29]
  - - [832, 960, 1, 512]
    - [109, 0.0]
  - - [896, 960, 1, 512]
    - [149, 21.74]
  - - [960, 960, 1, 512]
    - [75, 0.0]
  - - [1024, 960, 1, 512]
    - [149, 24.71]
  - - [64, 1024, 1, 512]
    - [121, 2.82]
  - - [128, 1024, 1, 512]
    - [43, 5.43]
  - - [192, 1024, 1, 512]
    - [43, 7.59]
  - - [256, 1024, 1, 512]
    - [140, 9.93]
  - - [320, 1024, 1, 512]
    - [38, 11.46]
  - - [384, 1024, 1, 512]
    - [38, 13.53]
  - - [448, 1024, 1, 512]
    - [102, 14.59]
  - - [576, 1024, 1, 512]
    - [134, 16.22]
  - - [640, 1024, 1, 512]
    - [45, 17.68]
  - - [704, 1024, 1, 512]
    - [102, 18.27]
  - - [768, 1024, 1, 512]
    - [143, 20.81]
  - - [832, 1024, 1, 512]
    - [38, 20.24]
  - - [896, 1024, 1, 512]
    - [163, 23.53]
  - - [960, 1024, 1, 512]
    - [61, 21.79]
  - - [128, 64, 1, 1024]
    - [124, 0.72]
  - - [192, 64, 1, 1024]
    - [164, 0.0]
  - - [256, 64, 1, 1024]
    - [130, 1.47]
  - - [320, 64, 1, 1024]
    - [165, 0.0]
  - - [384, 64, 1, 1024]
    - [124, 2.12]
  - - [448, 64, 1, 1024]
    - [121, 0.0]
  - - [512, 64, 1, 1024]
    - [155, 2.92]
  - - [576, 64, 1, 1024]
    - [151, 0.0]
  - - [640, 64, 1, 1024]
    - [155, 3.3]
  - - [704, 64, 1, 1024]
    - [146, 0.0]
  - - [768, 64, 1, 1024]
    - [130, 4.15]
  - - [832, 64, 1, 1024]
    - [146, 0.0]
  - - [896, 64, 1, 1024]
    - [130, 4.88]
  - - [960, 64, 1, 1024]
    - [123, 0.0]
  - - [1024, 64, 1, 1024]
    - [124, 5.17]
  - - [64, 128, 1, 1024]
    - [166, 0.73]
  - - [128, 128, 1, 1024]
    - [124, 1.47]
  - - [192, 128, 1, 1024]
    - [124, 2.16]
  - - [256, 128, 1, 1024]
    - [130, 2.87]
  - - [320, 128, 1, 1024]
    - [124, 3.36]
  - - [384, 128, 1, 1024]
    - [130, 3.97]
  - - [448, 128, 1, 1024]
    - [125, 4.57]
  - - [512, 128, 1, 1024]
    - [123, 5.1]
  - - [576, 128, 1, 1024]
    - [125, 5.34]
  - - [640, 128, 1, 1024]
    - [121, 5.88]
  - - [704, 128, 1, 1024]
    - [160, 6.19]
  - - [768, 128, 1, 1024]
    - [137, 6.81]
  - - [832, 128, 1, 1024]
    - [137, 7.12]
  - - [896, 128, 1, 1024]
    - [38, 7.66]
  - - [960, 128, 1, 1024]
    - [140, 8.01]
  - - [1024, 128, 1, 1024]
    - [45, 9.15]
  - - [64, 192, 1, 1024]
    - [165, 0.0]
  - - [128, 192, 1, 1024]
    - [155, 2.18]
  - - [192, 192, 1, 1024]
    - [121, 0.0]
  - - [256, 192, 1, 1024]
    - [154, 3.87]
  - - [320, 192, 1, 1024]
    - [167, 0.0]
  - - [384, 192, 1, 1024]
    - [45, 5.22]
  - - [448, 192, 1, 1024]
    - [38, 0.0]
  - - [512, 192, 1, 1024]
    - [38, 7.01]
  - - [576, 192, 1, 1024]
    - [38, 0.0]
  - - [640, 192, 1, 1024]
    - [134, 8.39]
  - - [704, 192, 1, 1024]
    - [137, 0.0]
  - - [768, 192, 1, 1024]
    - [140, 9.26]
  - - [832, 192, 1, 1024]
    - [45, 0.0]
  - - [896, 192, 1, 1024]
    - [38, 11.14]
  - - [960, 192, 1, 1024]
    - [38, 0.0]
  - - [1024, 192, 1, 1024]
    - [45, 12.42]
  - - [64, 256, 1, 1024]
    - [124, 1.43]
  - - [128, 256, 1, 1024]
    - [141, 2.81]
  - - [192, 256, 1, 1024]
    - [157, 3.8]
  - - [256, 256, 1, 1024]
    - [157, 5.08]
  - - [320, 256, 1, 1024]
    - [38, 5.87]
  - - [384, 256, 1, 1024]
    - [45, 6.98]
  - - [448, 256, 1, 1024]
    - [45, 8.23]
  - - [512, 256, 1, 1024]
    - [38, 9.33]
  - - [576, 256, 1, 1024]
    - [38, 9.87]
  - - [640, 256, 1, 1024]
    - [38, 11.07]
  - - [704, 256, 1, 1024]
    - [38, 11.88]
  - - [768, 256, 1, 1024]
    - [38, 13.07]
  - - [832, 256, 1, 1024]
    - [38, 14.14]
  - - [896, 256, 1, 1024]
    - [38, 14.61]
  - - [960, 256, 1, 1024]
    - [45, 15.07]
  - - [1024, 256, 1, 1024]
    - [140, 16.28]
  - - [64, 320, 1, 1024]
    - [121, 0.0]
  - - [128, 320, 1, 1024]
    - [141, 3.25]
  - - [192, 320, 1, 1024]
    - [125, 0.0]
  - - [256, 320, 1, 1024]
    - [168, 5.85]
  - - [320, 320, 1, 1024]
    - [139, 0.0]
  - - [384, 320, 1, 1024]
    - [134, 8.72]
  - - [448, 320, 1, 1024]
    - [38, 0.0]
  - - [512, 320, 1, 1024]
    - [45, 10.89]
  - - [576, 320, 1, 1024]
    - [140, 0.0]
  - - [640, 320, 1, 1024]
    - [38, 13.62]
  - - [704, 320, 1, 1024]
    - [38, 0.0]
  - - [768, 320, 1, 1024]
    - [140, 15.76]
  - - [832, 320, 1, 1024]
    - [38, 0.0]
  - - [896, 320, 1, 1024]
    - [52, 16.28]
  - - [960, 320, 1, 1024]
    - [139, 0.0]
  - - [1024, 320, 1, 1024]
    - [139, 17.61]
  - - [64, 384, 1, 1024]
    - [141, 2.06]
  - - [128, 384, 1, 1024]
    - [130, 3.66]
  - - [192, 384, 1, 1024]
    - [45, 5.19]
  - - [256, 384, 1, 1024]
    - [45, 6.8]
  - - [320, 384, 1, 1024]
    - [45, 8.41]
  - - [384, 384, 1, 1024]
    - [45, 9.94]
  - - [448, 384, 1, 1024]
    - [45, 11.35]
  - - [512, 384, 1, 1024]
    - [45, 13.06]
  - - [576, 384, 1, 1024]
    - [45, 14.8]
  - - [640, 384, 1, 1024]
    - [43, 15.71]
  - - [704, 384, 1, 1024]
    - [43, 16.31]
  - - [768, 384, 1, 1024]
    - [137, 16.87]
  - - [832, 384, 1, 1024]
    - [169, 17.82]
  - - [896, 384, 1, 1024]
    - [137, 18.85]
  - - [960, 384, 1, 1024]
    - [137, 20.19]
  - - [1024, 384, 1, 1024]
    - [138, 21.18]
  - - [64, 448, 1, 1024]
    - [125, 0.0]
  - - [128, 448, 1, 1024]
    - [170, 4.36]
  - - [192, 448, 1, 1024]
    - [43, 0.0]
  - - [256, 448, 1, 1024]
    - [134, 8.12]
  - - [320, 448, 1, 1024]
    - [45, 0.0]
  - - [384, 448, 1, 1024]
    - [38, 11.6]
  - - [448, 448, 1, 1024]
    - [38, 0.0]
  - - [512, 448, 1, 1024]
    - [38, 14.82]
  - - [576, 448, 1, 1024]
    - [133, 0.0]
  - - [640, 448, 1, 1024]
    - [139, 16.46]
  - - [704, 448, 1, 1024]
    - [139, 0.0]
  - - [768, 448, 1, 1024]
    - [134, 18.52]
  - - [832, 448, 1, 1024]
    - [161, 0.0]
  - - [896, 448, 1, 1024]
    - [145, 20.72]
  - - [960, 448, 1, 1024]
    - [74, 0.0]
  - - [1024, 448, 1, 1024]
    - [74, 22.71]
  - - [64, 512, 1, 1024]
    - [155, 2.84]
  - - [128, 512, 1, 1024]
    - [157, 4.96]
  - - [192, 512, 1, 1024]
    - [38, 7.08]
  - - [256, 512, 1, 1024]
    - [38, 9.39]
  - - [320, 512, 1, 1024]
    - [134, 10.88]
  - - [384, 512, 1, 1024]
    - [134, 13.05]
  - - [448, 512, 1, 1024]
    - [134, 15.0]
  - - [576, 512, 1, 1024]
    - [139, 15.79]
  - - [640, 512, 1, 1024]
    - [139, 17.42]
  - - [704, 512, 1, 1024]
    - [161, 19.42]
  - - [768, 512, 1, 1024]
    - [161, 21.02]
  - - [832, 512, 1, 1024]
    - [161, 19.69]
  - - [896, 512, 1, 1024]
    - [82, 21.62]
  - - [960, 512, 1, 1024]
    - [161, 22.27]
  - - [64, 576, 1, 1024]
    - [146, 0.0]
  - - [128, 576, 1, 1024]
    - [43, 5.11]
  - - [192, 576, 1, 1024]
    - [45, 0.0]
  - - [256, 576, 1, 1024]
    - [38, 9.59]
  - - [320, 576, 1, 1024]
    - [140, 0.0]
  - - [384, 576, 1, 1024]
    - [134, 13.93]
  - - [448, 576, 1, 1024]
    - [161, 0.0]
  - - [512, 576, 1, 1024]
    - [139, 17.3]
  - - [576, 576, 1, 1024]
    - [134, 0.0]
  - - [640, 576, 1, 1024]
    - [161, 20.55]
  - - [704, 576, 1, 1024]
    - [74, 0.0]
  - - [768, 576, 1, 1024]
    - [74, 21.64]
  - - [832, 576, 1, 1024]
    - [134, 0.0]
  - - [896, 576, 1, 1024]
    - [143, 24.23]
  - - [960, 576, 1, 1024]
    - [75, 0.0]
  - - [1024, 576, 1, 1024]
    - [75, 25.43]
  - - [64, 640, 1, 1024]
    - [123, 3.15]
  - - [128, 640, 1, 1024]
    - [134, 5.67]
  - - [192, 640, 1, 1024]
    - [134, 8.44]
  - - [256, 640, 1, 1024]
    - [45, 10.83]
  - - [320, 640, 1, 1024]
    - [45, 13.46]
  - - [384, 640, 1, 1024]
    - [134, 15.33]
  - - [448, 640, 1, 1024]
    - [45, 16.49]
  - - [512, 640, 1, 1024]
    - [139, 18.89]
  - - [576, 640, 1, 1024]
    - [139, 20.78]
  - - [640, 640, 1, 1024]
    - [74, 21.51]
  - - [704, 640, 1, 1024]
    - [74, 23.29]
  - - [768, 640, 1, 1024]
    - [74, 25.22]
  - - [832, 640, 1, 1024]
    - [75, 24.56]
  - - [896, 640, 1, 1024]
    - [75, 25.9]
  - - [960, 640, 1, 1024]
    - [73, 26.21]
  - - [1024, 640, 1, 1024]
    - [73, 28.78]
  - - [64, 704, 1, 1024]
    - [121, 0.0]
  - - [128, 704, 1, 1024]
    - [134, 6.44]
  - - [192, 704, 1, 1024]
    - [38, 0.0]
  - - [256, 704, 1, 1024]
    - [38, 11.92]
  - - [320, 704, 1, 1024]
    - [38, 0.0]
  - - [384, 704, 1, 1024]
    - [38, 16.14]
  - - [448, 704, 1, 1024]
    - [161, 0.0]
  - - [512, 704, 1, 1024]
    - [161, 19.78]
  - - [576, 704, 1, 1024]
    - [74, 0.0]
  - - [640, 704, 1, 1024]
    - [74, 23.06]
  - - [704, 704, 1, 1024]
    - [134, 0.0]
  - - [768, 704, 1, 1024]
    - [143, 24.32]
  - - [832, 704, 1, 1024]
    - [139, 0.0]
  - - [896, 704, 1, 1024]
    - [143, 27.55]
  - - [960, 704, 1, 1024]
    - [75, 0.0]
  - - [1024, 704, 1, 1024]
    - [72, 30.37]
  - - [64, 768, 1, 1024]
    - [125, 3.6]
  - - [128, 768, 1, 1024]
    - [133, 6.67]
  - - [192, 768, 1, 1024]
    - [133, 9.46]
  - - [256, 768, 1, 1024]
    - [43, 12.45]
  - - [320, 768, 1, 1024]
    - [43, 15.29]
  - - [384, 768, 1, 1024]
    - [142, 16.48]
  - - [448, 768, 1, 1024]
    - [161, 19.0]
  - - [512, 768, 1, 1024]
    - [139, 21.56]
  - - [576, 768, 1, 1024]
    - [139, 21.75]
  - - [640, 768, 1, 1024]
    - [143, 24.16]
  - - [704, 768, 1, 1024]
    - [134, 24.05]
  - - [768, 768, 1, 1024]
    - [149, 25.39]
  - - [832, 768, 1, 1024]
    - [161, 26.15]
  - - [896, 768, 1, 1024]
    - [171, 28.54]
  - - [960, 768, 1, 1024]
    - [59, 28.8]
  - - [1024, 768, 1, 1024]
    - [149, 31.84]
  - - [64, 832, 1, 1024]
    - [121, 0.0]
  - - [128, 832, 1, 1024]
    - [140, 7.31]
  - - [192, 832, 1, 1024]
    - [140, 0.0]
  - - [256, 832, 1, 1024]
    - [38, 14.0]
  - - [320, 832, 1, 1024]
    - [134, 0.0]
  - - [384, 832, 1, 1024]
    - [134, 18.03]
  - - [448, 832, 1, 1024]
    - [134, 0.0]
  - - [512, 832, 1, 1024]
    - [48, 20.94]
  - - [576, 832, 1, 1024]
    - [74, 0.0]
  - - [640, 832, 1, 1024]
    - [143, 24.24]
  - - [704, 832, 1, 1024]
    - [142, 0.0]
  - - [768, 832, 1, 1024]
    - [79, 27.06]
  - - [832, 832, 1, 1024]
    - [75, 0.0]
  - - [896, 832, 1, 1024]
    - [79, 29.95]
  - - [960, 832, 1, 1024]
    - [73, 0.0]
  - - [1024, 832, 1, 1024]
    - [149, 34.07]
  - - [64, 896, 1, 1024]
    - [157, 4.35]
  - - [128, 896, 1, 1024]
    - [43, 8.09]
  - - [192, 896, 1, 1024]
    - [45, 11.63]
  - - [256, 896, 1, 1024]
    - [45, 15.34]
  - - [320, 896, 1, 1024]
    - [134, 16.98]
  - - [384, 896, 1, 1024]
    - [142, 18.75]
  - - [448, 896, 1, 1024]
    - [74, 20.72]
  - - [512, 896, 1, 1024]
    - [74, 22.54]
  - - [576, 896, 1, 1024]
    - [74, 25.01]
  - - [640, 896, 1, 1024]
    - [61, 25.81]
  - - [704, 896, 1, 1024]
    - [75, 27.89]
  - - [768, 896, 1, 1024]
    - [115, 28.89]
  - - [832, 896, 1, 1024]
    - [115, 31.24]
  - - [896, 896, 1, 1024]
    - [149, 33.4]
  - - [960, 896, 1, 1024]
    - [59, 29.69]
  - - [1024, 896, 1, 1024]
    - [149, 36.95]
  - - [64, 960, 1, 1024]
    - [170, 0.0]
  - - [128, 960, 1, 1024]
    - [38, 8.21]
  - - [192, 960, 1, 1024]
    - [38, 0.0]
  - - [256, 960, 1, 1024]
    - [45, 15.45]
  - - [320, 960, 1, 1024]
    - [134, 0.0]
  - - [384, 960, 1, 1024]
    - [134, 19.96]
  - - [448, 960, 1, 1024]
    - [74, 0.0]
  - - [512, 960, 1, 1024]
    - [145, 23.91]
  - - [576, 960, 1, 1024]
    - [75, 0.0]
  - - [640, 960, 1, 1024]
    - [59, 26.1]
  - - [704, 960, 1, 1024]
    - [75, 0.0]
  - - [768, 960, 1, 1024]
    - [149, 29.89]
  - - [832, 960, 1, 1024]
    - [73, 0.0]
  - - [896, 960, 1, 1024]
    - [149, 34.57]
  - - [960, 960, 1, 1024]
    - [74, 0.0]
  - - [1024, 960, 1, 1024]
    - [149, 38.57]
  - - [64, 1024, 1, 1024]
    - [151, 4.87]
  - - [128, 1024, 1, 1024]
    - [43, 9.25]
  - - [192, 1024, 1, 1024]
    - [140, 12.75]
  - - [256, 1024, 1, 1024]
    - [38, 16.85]
  - - [320, 1024, 1, 1024]
    - [133, 18.55]
  - - [384, 1024, 1, 1024]
    - [38, 21.09]
  - - [448, 1024, 1, 1024]
    - [161, 22.76]
  - - [576, 1024, 1, 1024]
    - [161, 25.63]
  - - [640, 1024, 1, 1024]
    - [142, 28.23]
  - - [704, 1024, 1, 1024]
    - [145, 27.01]
  - - [768, 1024, 1, 1024]
    - [149, 32.93]
  - - [832, 1024, 1, 1024]
    - [45, 28.54]
  - - [896, 1024, 1, 1024]
    - [149, 36.7]
  - - [960, 1024, 1, 1024]
    - [82, 32.8]
  - - [128, 64, 1, 2048]
    - [172, 1.34]
  - - [192, 64, 1, 2048]
    - [136, 0.0]
  - - [256, 64, 1, 2048]
    - [154, 2.55]
  - - [320, 64, 1, 2048]
    - [173, 0.0]
  - - [384, 64, 1, 2048]
    - [124, 4.05]
  - - [448, 64, 1, 2048]
    - [121, 0.0]
  - - [512, 64, 1, 2048]
    - [124, 5.24]
  - - [576, 64, 1, 2048]
    - [125, 0.0]
  - - [640, 64, 1, 2048]
    - [152, 6.2]
  - - [704, 64, 1, 2048]
    - [121, 0.0]
  - - [768, 64, 1, 2048]
    - [155, 7.49]
  - - [832, 64, 1, 2048]
    - [151, 0.0]
  - - [896, 64, 1, 2048]
    - [130, 8.55]
  - - [960, 64, 1, 2048]
    - [146, 0.0]
  - - [1024, 64, 1, 2048]
    - [130, 9.2]
  - - [64, 128, 1, 2048]
    - [174, 1.3]
  - - [128, 128, 1, 2048]
    - [130, 2.66]
  - - [192, 128, 1, 2048]
    - [130, 3.71]
  - - [256, 128, 1, 2048]
    - [130, 5.1]
  - - [320, 128, 1, 2048]
    - [121, 5.48]
  - - [384, 128, 1, 2048]
    - [128, 6.61]
  - - [448, 128, 1, 2048]
    - [125, 7.73]
  - - [512, 128, 1, 2048]
    - [123, 8.69]
  - - [576, 128, 1, 2048]
    - [125, 8.71]
  - - [640, 128, 1, 2048]
    - [170, 9.4]
  - - [704, 128, 1, 2048]
    - [170, 10.29]
  - - [768, 128, 1, 2048]
    - [175, 11.15]
  - - [832, 128, 1, 2048]
    - [161, 11.31]
  - - [896, 128, 1, 2048]
    - [161, 12.22]
  - - [960, 128, 1, 2048]
    - [137, 12.79]
  - - [1024, 128, 1, 2048]
    - [161, 13.65]
  - - [64, 192, 1, 2048]
    - [121, 0.0]
  - - [128, 192, 1, 2048]
    - [141, 3.66]
  - - [192, 192, 1, 2048]
    - [125, 0.0]
  - - [256, 192, 1, 2048]
    - [124, 6.12]
  - - [320, 192, 1, 2048]
    - [160, 0.0]
  - - [384, 192, 1, 2048]
    - [168, 8.21]
  - - [448, 192, 1, 2048]
    - [170, 0.0]
  - - [512, 192, 1, 2048]
    - [170, 10.5]
  - - [576, 192, 1, 2048]
    - [134, 0.0]
  - - [640, 192, 1, 2048]
    - [161, 12.72]
  - - [704, 192, 1, 2048]
    - [134, 0.0]
  - - [768, 192, 1, 2048]
    - [140, 14.56]
  - - [832, 192, 1, 2048]
    - [140, 0.0]
  - - [896, 192, 1, 2048]
    - [38, 17.16]
  - - [960, 192, 1, 2048]
    - [38, 0.0]
  - - [1024, 192, 1, 2048]
    - [140, 19.31]
  - - [64, 256, 1, 2048]
    - [166, 2.52]
  - - [128, 256, 1, 2048]
    - [152, 4.55]
  - - [192, 256, 1, 2048]
    - [157, 6.16]
  - - [256, 256, 1, 2048]
    - [176, 8.17]
  - - [320, 256, 1, 2048]
    - [167, 9.15]
  - - [384, 256, 1, 2048]
    - [157, 11.07]
  - - [448, 256, 1, 2048]
    - [134, 12.49]
  - - [512, 256, 1, 2048]
    - [134, 14.25]
  - - [576, 256, 1, 2048]
    - [38, 15.35]
  - - [640, 256, 1, 2048]
    - [38, 16.92]
  - - [704, 256, 1, 2048]
    - [38, 18.47]
  - - [768, 256, 1, 2048]
    - [38, 20.25]
  - - [832, 256, 1, 2048]
    - [38, 21.1]
  - - [896, 256, 1, 2048]
    - [38, 22.47]
  - - [960, 256, 1, 2048]
    - [38, 24.27]
  - - [1024, 256, 1, 2048]
    - [45, 24.86]
  - - [64, 320, 1, 2048]
    - [173, 0.0]
  - - [128, 320, 1, 2048]
    - [121, 5.42]
  - - [192, 320, 1, 2048]
    - [170, 0.0]
  - - [256, 320, 1, 2048]
    - [168, 9.04]
  - - [320, 320, 1, 2048]
    - [43, 0.0]
  - - [384, 320, 1, 2048]
    - [161, 13.03]
  - - [448, 320, 1, 2048]
    - [140, 0.0]
  - - [512, 320, 1, 2048]
    - [38, 17.12]
  - - [576, 320, 1, 2048]
    - [140, 0.0]
  - - [640, 320, 1, 2048]
    - [38, 20.95]
  - - [704, 320, 1, 2048]
    - [38, 0.0]
  - - [768, 320, 1, 2048]
    - [38, 23.98]
  - - [832, 320, 1, 2048]
    - [161, 0.0]
  - - [896, 320, 1, 2048]
    - [140, 24.81]
  - - [960, 320, 1, 2048]
    - [142, 0.0]
  - - [1024, 320, 1, 2048]
    - [52, 27.11]
  - - [64, 384, 1, 2048]
    - [124, 3.57]
  - - [128, 384, 1, 2048]
    - [157, 6.3]
  - - [192, 384, 1, 2048]
    - [170, 8.53]
  - - [256, 384, 1, 2048]
    - [175, 10.99]
  - - [320, 384, 1, 2048]
    - [140, 13.13]
  - - [384, 384, 1, 2048]
    - [38, 15.51]
  - - [448, 384, 1, 2048]
    - [45, 18.37]
  - - [512, 384, 1, 2048]
    - [45, 20.68]
  - - [576, 384, 1, 2048]
    - [45, 22.44]
  - - [640, 384, 1, 2048]
    - [140, 24.33]
  - - [704, 384, 1, 2048]
    - [45, 25.52]
  - - [768, 384, 1, 2048]
    - [45, 26.62]
  - - [832, 384, 1, 2048]
    - [137, 27.35]
  - - [896, 384, 1, 2048]
    - [134, 28.04]
  - - [960, 384, 1, 2048]
    - [43, 30.3]
  - - [1024, 384, 1, 2048]
    - [43, 32.63]
  - - [64, 448, 1, 2048]
    - [121, 0.0]
  - - [128, 448, 1, 2048]
    - [175, 6.87]
  - - [192, 448, 1, 2048]
    - [170, 0.0]
  - - [256, 448, 1, 2048]
    - [38, 12.38]
  - - [320, 448, 1, 2048]
    - [134, 0.0]
  - - [384, 448, 1, 2048]
    - [38, 17.7]
  - - [448, 448, 1, 2048]
    - [38, 0.0]
  - - [512, 448, 1, 2048]
    - [140, 22.58]
  - - [576, 448, 1, 2048]
    - [140, 0.0]
  - - [640, 448, 1, 2048]
    - [38, 23.96]
  - - [704, 448, 1, 2048]
    - [142, 0.0]
  - - [768, 448, 1, 2048]
    - [134, 27.58]
  - - [832, 448, 1, 2048]
    - [161, 0.0]
  - - [896, 448, 1, 2048]
    - [139, 28.16]
  - - [960, 448, 1, 2048]
    - [74, 0.0]
  - - [1024, 448, 1, 2048]
    - [145, 32.54]
  - - [64, 512, 1, 2048]
    - [177, 4.54]
  - - [128, 512, 1, 2048]
    - [176, 7.97]
  - - [192, 512, 1, 2048]
    - [168, 10.67]
  - - [256, 512, 1, 2048]
    - [161, 13.71]
  - - [320, 512, 1, 2048]
    - [134, 16.29]
  - - [384, 512, 1, 2048]
    - [134, 19.5]
  - - [448, 512, 1, 2048]
    - [161, 22.28]
  - - [576, 512, 1, 2048]
    - [134, 23.25]
  - - [640, 512, 1, 2048]
    - [134, 25.92]
  - - [704, 512, 1, 2048]
    - [161, 28.17]
  - - [768, 512, 1, 2048]
    - [134, 30.08]
  - - [832, 512, 1, 2048]
    - [134, 27.83]
  - - [896, 512, 1, 2048]
    - [82, 29.89]
  - - [960, 512, 1, 2048]
    - [161, 31.72]
  - - [64, 576, 1, 2048]
    - [153, 0.0]
  - - [128, 576, 1, 2048]
    - [168, 8.38]
  - - [192, 576, 1, 2048]
    - [137, 0.0]
  - - [256, 576, 1, 2048]
    - [45, 15.37]
  - - [320, 576, 1, 2048]
    - [140, 0.0]
  - - [384, 576, 1, 2048]
    - [38, 22.25]
  - - [448, 576, 1, 2048]
    - [38, 0.0]
  - - [512, 576, 1, 2048]
    - [134, 26.22]
  - - [576, 576, 1, 2048]
    - [134, 0.0]
  - - [640, 576, 1, 2048]
    - [134, 31.41]
  - - [704, 576, 1, 2048]
    - [161, 0.0]
  - - [768, 576, 1, 2048]
    - [142, 31.28]
  - - [832, 576, 1, 2048]
    - [142, 0.0]
  - - [896, 576, 1, 2048]
    - [134, 34.43]
  - - [960, 576, 1, 2048]
    - [161, 0.0]
  - - [1024, 576, 1, 2048]
    - [82, 35.99]
  - - [64, 640, 1, 2048]
    - [157, 5.09]
  - - [128, 640, 1, 2048]
    - [168, 8.88]
  - - [192, 640, 1, 2048]
    - [161, 13.17]
  - - [256, 640, 1, 2048]
    - [45, 17.04]
  - - [320, 640, 1, 2048]
    - [45, 21.14]
  - - [384, 640, 1, 2048]
    - [161, 24.01]
  - - [448, 640, 1, 2048]
    - [45, 25.88]
  - - [512, 640, 1, 2048]
    - [134, 29.14]
  - - [576, 640, 1, 2048]
    - [43, 30.3]
  - - [640, 640, 1, 2048]
    - [139, 30.36]
  - - [704, 640, 1, 2048]
    - [178, 31.88]
  - - [768, 640, 1, 2048]
    - [74, 34.78]
  - - [832, 640, 1, 2048]
    - [178, 35.24]
  - - [896, 640, 1, 2048]
    - [75, 36.61]
  - - [960, 640, 1, 2048]
    - [75, 39.47]
  - - [1024, 640, 1, 2048]
    - [61, 40.02]
  - - [64, 704, 1, 2048]
    - [146, 0.0]
  - - [128, 704, 1, 2048]
    - [168, 10.1]
  - - [192, 704, 1, 2048]
    - [140, 0.0]
  - - [256, 704, 1, 2048]
    - [161, 18.0]
  - - [320, 704, 1, 2048]
    - [140, 0.0]
  - - [384, 704, 1, 2048]
    - [52, 24.93]
  - - [448, 704, 1, 2048]
    - [139, 0.0]
  - - [512, 704, 1, 2048]
    - [161, 30.11]
  - - [576, 704, 1, 2048]
    - [134, 0.0]
  - - [640, 704, 1, 2048]
    - [134, 31.69]
  - - [704, 704, 1, 2048]
    - [142, 0.0]
  - - [768, 704, 1, 2048]
    - [74, 33.82]
  - - [832, 704, 1, 2048]
    - [142, 0.0]
  - - [896, 704, 1, 2048]
    - [72, 37.63]
  - - [960, 704, 1, 2048]
    - [79, 0.0]
  - - [1024, 704, 1, 2048]
    - [79, 42.15]
  - - [64, 768, 1, 2048]
    - [157, 6.15]
  - - [128, 768, 1, 2048]
    - [160, 10.65]
  - - [192, 768, 1, 2048]
    - [38, 14.88]
  - - [256, 768, 1, 2048]
    - [45, 19.79]
  - - [320, 768, 1, 2048]
    - [38, 24.72]
  - - [384, 768, 1, 2048]
    - [134, 26.75]
  - - [448, 768, 1, 2048]
    - [134, 28.83]
  - - [512, 768, 1, 2048]
    - [134, 32.55]
  - - [576, 768, 1, 2048]
    - [161, 31.74]
  - - [640, 768, 1, 2048]
    - [139, 32.59]
  - - [704, 768, 1, 2048]
    - [161, 32.75]
  - - [768, 768, 1, 2048]
    - [79, 35.46]
  - - [832, 768, 1, 2048]
    - [161, 37.08]
  - - [896, 768, 1, 2048]
    - [171, 40.66]
  - - [960, 768, 1, 2048]
    - [72, 38.97]
  - - [1024, 768, 1, 2048]
    - [149, 45.48]
  - - [64, 832, 1, 2048]
    - [170, 0.0]
  - - [128, 832, 1, 2048]
    - [43, 11.28]
  - - [192, 832, 1, 2048]
    - [38, 0.0]
  - - [256, 832, 1, 2048]
    - [134, 20.55]
  - - [320, 832, 1, 2048]
    - [38, 0.0]
  - - [384, 832, 1, 2048]
    - [134, 27.04]
  - - [448, 832, 1, 2048]
    - [161, 0.0]
  - - [512, 832, 1, 2048]
    - [142, 29.99]
  - - [576, 832, 1, 2048]
    - [74, 0.0]
  - - [640, 832, 1, 2048]
    - [75, 32.86]
  - - [704, 832, 1, 2048]
    - [115, 0.0]
  - - [768, 832, 1, 2048]
    - [171, 37.62]
  - - [832, 832, 1, 2048]
    - [73, 0.0]
  - - [896, 832, 1, 2048]
    - [82, 41.38]
  - - [960, 832, 1, 2048]
    - [74, 0.0]
  - - [1024, 832, 1, 2048]
    - [179, 44.33]
  - - [64, 896, 1, 2048]
    - [157, 7.4]
  - - [128, 896, 1, 2048]
    - [43, 12.66]
  - - [192, 896, 1, 2048]
    - [45, 17.46]
  - - [256, 896, 1, 2048]
    - [45, 23.1]
  - - [320, 896, 1, 2048]
    - [45, 26.44]
  - - [384, 896, 1, 2048]
    - [45, 28.49]
  - - [448, 896, 1, 2048]
    - [48, 29.61]
  - - [512, 896, 1, 2048]
    - [74, 32.51]
  - - [576, 896, 1, 2048]
    - [74, 36.31]
  - - [640, 896, 1, 2048]
    - [74, 36.51]
  - - [704, 896, 1, 2048]
    - [74, 38.13]
  - - [768, 896, 1, 2048]
    - [74, 42.16]
  - - [832, 896, 1, 2048]
    - [180, 42.58]
  - - [896, 896, 1, 2048]
    - [149, 45.18]
  - - [960, 896, 1, 2048]
    - [75, 43.64]
  - - [1024, 896, 1, 2048]
    - [149, 50.33]
  - - [64, 960, 1, 2048]
    - [160, 0.0]
  - - [128, 960, 1, 2048]
    - [43, 13.52]
  - - [192, 960, 1, 2048]
    - [161, 0.0]
  - - [256, 960, 1, 2048]
    - [43, 24.6]
  - - [320, 960, 1, 2048]
    - [139, 0.0]
  - - [384, 960, 1, 2048]
    - [139, 29.81]
  - - [448, 960, 1, 2048]
    - [161, 0.0]
  - - [512, 960, 1, 2048]
    - [74, 34.73]
  - - [576, 960, 1, 2048]
    - [109, 0.0]
  - - [640, 960, 1, 2048]
    - [115, 36.61]
  - - [704, 960, 1, 2048]
    - [73, 0.0]
  - - [768, 960, 1, 2048]
    - [74, 43.56]
  - - [832, 960, 1, 2048]
    - [73, 0.0]
  - - [896, 960, 1, 2048]
    - [149, 47.01]
  - - [960, 960, 1, 2048]
    - [115, 0.0]
  - - [1024, 960, 1, 2048]
    - [149, 53.3]
  - - [64, 1024, 1, 2048]
    - [157, 7.67]
  - - [128, 1024, 1, 2048]
    - [134, 13.76]
  - - [192, 1024, 1, 2048]
    - [43, 19.24]
  - - [256, 1024, 1, 2048]
    - [52, 25.83]
  - - [320, 1024, 1, 2048]
    - [142, 27.97]
  - - [384, 1024, 1, 2048]
    - [38, 30.7]
  - - [448, 1024, 1, 2048]
    - [139, 32.64]
  - - [576, 1024, 1, 2048]
    - [139, 36.33]
  - - [640, 1024, 1, 2048]
    - [142, 37.19]
  - - [704, 1024, 1, 2048]
    - [79, 38.25]
  - - [768, 1024, 1, 2048]
    - [171, 44.25]
  - - [832, 1024, 1, 2048]
    - [79, 40.44]
  - - [896, 1024, 1, 2048]
    - [149, 50.53]
  - - [960, 1024, 1, 2048]
    - [79, 47.48]
  - - [128, 64, 1, 4096]
    - [174, 2.27]
  - - [192, 64, 1, 4096]
    - [136, 0.0]
  - - [256, 64, 1, 4096]
    - [152, 4.49]
  - - [320, 64, 1, 4096]
    - [136, 0.0]
  - - [384, 64, 1, 4096]
    - [124, 6.56]
  - - [448, 64, 1, 4096]
    - [165, 0.0]
  - - [512, 64, 1, 4096]
    - [152, 8.46]
  - - [576, 64, 1, 4096]
    - [121, 0.0]
  - - [640, 64, 1, 4096]
    - [152, 10.21]
  - - [704, 64, 1, 4096]
    - [121, 0.0]
  - - [768, 64, 1, 4096]
    - [154, 12.0]
  - - [832, 64, 1, 4096]
    - [146, 0.0]
  - - [896, 64, 1, 4096]
    - [152, 13.67]
  - - [960, 64, 1, 4096]
    - [121, 0.0]
  - - [1024, 64, 1, 4096]
    - [154, 15.41]
  - - [64, 128, 1, 4096]
    - [174, 2.23]
  - - [128, 128, 1, 4096]
    - [124, 4.28]
  - - [192, 128, 1, 4096]
    - [141, 6.22]
  - - [256, 128, 1, 4096]
    - [130, 8.15]
  - - [320, 128, 1, 4096]
    - [141, 8.6]
  - - [384, 128, 1, 4096]
    - [130, 10.2]
  - - [448, 128, 1, 4096]
    - [125, 11.27]
  - - [512, 128, 1, 4096]
    - [128, 12.3]
  - - [576, 128, 1, 4096]
    - [123, 12.01]
  - - [640, 128, 1, 4096]
    - [181, 12.97]
  - - [704, 128, 1, 4096]
    - [181, 14.0]
  - - [768, 128, 1, 4096]
    - [160, 15.2]
  - - [832, 128, 1, 4096]
    - [161, 15.72]
  - - [896, 128, 1, 4096]
    - [134, 16.49]
  - - [960, 128, 1, 4096]
    - [137, 18.2]
  - - [1024, 128, 1, 4096]
    - [134, 19.12]
  - - [64, 192, 1, 4096]
    - [173, 0.0]
  - - [128, 192, 1, 4096]
    - [182, 6.13]
  - - [192, 192, 1, 4096]
    - [151, 0.0]
  - - [256, 192, 1, 4096]
    - [124, 9.22]
  - - [320, 192, 1, 4096]
    - [168, 0.0]
  - - [384, 192, 1, 4096]
    - [175, 11.9]
  - - [448, 192, 1, 4096]
    - [168, 0.0]
  - - [512, 192, 1, 4096]
    - [161, 14.59]
  - - [576, 192, 1, 4096]
    - [134, 0.0]
  - - [640, 192, 1, 4096]
    - [134, 17.72]
  - - [704, 192, 1, 4096]
    - [134, 0.0]
  - - [768, 192, 1, 4096]
    - [134, 20.71]
  - - [832, 192, 1, 4096]
    - [134, 0.0]
  - - [896, 192, 1, 4096]
    - [38, 24.23]
  - - [960, 192, 1, 4096]
    - [38, 0.0]
  - - [1024, 192, 1, 4096]
    - [38, 26.55]
  - - [64, 256, 1, 4096]
    - [130, 4.25]
  - - [128, 256, 1, 4096]
    - [124, 7.36]
  - - [192, 256, 1, 4096]
    - [175, 9.29]
  - - [256, 256, 1, 4096]
    - [157, 12.05]
  - - [320, 256, 1, 4096]
    - [180, 13.09]
  - - [384, 256, 1, 4096]
    - [168, 15.04]
  - - [448, 256, 1, 4096]
    - [137, 17.25]
  - - [512, 256, 1, 4096]
    - [137, 19.32]
  - - [576, 256, 1, 4096]
    - [38, 20.31]
  - - [640, 256, 1, 4096]
    - [38, 22.98]
  - - [704, 256, 1, 4096]
    - [140, 25.13]
  - - [768, 256, 1, 4096]
    - [161, 26.62]
  - - [832, 256, 1, 4096]
    - [134, 28.79]
  - - [896, 256, 1, 4096]
    - [38, 30.65]
  - - [960, 256, 1, 4096]
    - [137, 32.77]
  - - [1024, 256, 1, 4096]
    - [140, 33.9]
  - - [64, 320, 1, 4096]
    - [121, 0.0]
  - - [128, 320, 1, 4096]
    - [141, 7.91]
  - - [192, 320, 1, 4096]
    - [140, 0.0]
  - - [256, 320, 1, 4096]
    - [30, 12.98]
  - - [320, 320, 1, 4096]
    - [161, 0.0]
  - - [384, 320, 1, 4096]
    - [134, 17.62]
  - - [448, 320, 1, 4096]
    - [45, 0.0]
  - - [512, 320, 1, 4096]
    - [45, 22.73]
  - - [576, 320, 1, 4096]
    - [38, 0.0]
  - - [640, 320, 1, 4096]
    - [38, 27.89]
  - - [704, 320, 1, 4096]
    - [38, 0.0]
  - - [768, 320, 1, 4096]
    - [161, 32.28]
  - - [832, 320, 1, 4096]
    - [38, 0.0]
  - - [896, 320, 1, 4096]
    - [142, 33.41]
  - - [960, 320, 1, 4096]
    - [142, 0.0]
  - - [1024, 320, 1, 4096]
    - [139, 35.05]
  - - [64, 384, 1, 4096]
    - [124, 5.98]
  - - [128, 384, 1, 4096]
    - [180, 9.2]
  - - [192, 384, 1, 4096]
    - [180, 11.84]
  - - [256, 384, 1, 4096]
    - [161, 14.59]
  - - [320, 384, 1, 4096]
    - [137, 18.13]
  - - [384, 384, 1, 4096]
    - [45, 21.37]
  - - [448, 384, 1, 4096]
    - [45, 24.99]
  - - [512, 384, 1, 4096]
    - [45, 28.05]
  - - [576, 384, 1, 4096]
    - [45, 30.94]
  - - [640, 384, 1, 4096]
    - [45, 33.71]
  - - [704, 384, 1, 4096]
    - [45, 35.0]
  - - [768, 384, 1, 4096]
    - [138, 35.08]
  - - [832, 384, 1, 4096]
    - [138, 37.67]
  - - [896, 384, 1, 4096]
    - [138, 39.6]
  - - [960, 384, 1, 4096]
    - [45, 40.73]
  - - [1024, 384, 1, 4096]
    - [138, 42.89]
  - - [64, 448, 1, 4096]
    - [121, 0.0]
  - - [128, 448, 1, 4096]
    - [170, 10.36]
  - - [192, 448, 1, 4096]
    - [160, 0.0]
  - - [256, 448, 1, 4096]
    - [161, 16.78]
  - - [320, 448, 1, 4096]
    - [161, 0.0]
  - - [384, 448, 1, 4096]
    - [161, 23.96]
  - - [448, 448, 1, 4096]
    - [140, 0.0]
  - - [512, 448, 1, 4096]
    - [45, 30.65]
  - - [576, 448, 1, 4096]
    - [134, 0.0]
  - - [640, 448, 1, 4096]
    - [139, 33.55]
  - - [704, 448, 1, 4096]
    - [139, 0.0]
  - - [768, 448, 1, 4096]
    - [134, 36.68]
  - - [832, 448, 1, 4096]
    - [142, 0.0]
  - - [896, 448, 1, 4096]
    - [145, 36.53]
  - - [960, 448, 1, 4096]
    - [74, 0.0]
  - - [1024, 448, 1, 4096]
    - [74, 40.66]
  - - [64, 512, 1, 4096]
    - [141, 7.15]
  - - [128, 512, 1, 4096]
    - [183, 11.01]
  - - [192, 512, 1, 4096]
    - [161, 14.3]
  - - [256, 512, 1, 4096]
    - [137, 19.21]
  - - [320, 512, 1, 4096]
    - [161, 22.15]
  - - [384, 512, 1, 4096]
    - [134, 27.57]
  - - [448, 512, 1, 4096]
    - [134, 30.91]
  - - [512, 512, 1, 4096]
    - [134, 32.97]
  - - [576, 512, 1, 4096]
    - [134, 30.02]
  - - [640, 512, 1, 4096]
    - [134, 33.13]
  - - [704, 512, 1, 4096]
    - [133, 36.01]
  - - [768, 512, 1, 4096]
    - [134, 39.93]
  - - [832, 512, 1, 4096]
    - [134, 35.01]
  - - [896, 512, 1, 4096]
    - [80, 37.21]
  - - [960, 512, 1, 4096]
    - [161, 38.81]
  - - [1024, 512, 1, 4096]
    - [184, 42.13]
  - - [64, 576, 1, 4096]
    - [146, 0.0]
  - - [128, 576, 1, 4096]
    - [170, 11.67]
  - - [192, 576, 1, 4096]
    - [134, 0.0]
  - - [256, 576, 1, 4096]
    - [38, 20.5]
  - - [320, 576, 1, 4096]
    - [140, 0.0]
  - - [384, 576, 1, 4096]
    - [140, 29.87]
  - - [448, 576, 1, 4096]
    - [140, 0.0]
  - - [512, 576, 1, 4096]
    - [161, 35.49]
  - - [576, 576, 1, 4096]
    - [161, 0.0]
  - - [640, 576, 1, 4096]
    - [161, 39.02]
  - - [704, 576, 1, 4096]
    - [134, 0.0]
  - - [768, 576, 1, 4096]
    - [161, 39.8]
  - - [832, 576, 1, 4096]
    - [161, 0.0]
  - - [896, 576, 1, 4096]
    - [134, 44.24]
  - - [960, 576, 1, 4096]
    - [134, 0.0]
  - - [1024, 576, 1, 4096]
    - [74, 44.6]
  - - [64, 640, 1, 4096]
    - [169, 8.07]
  - - [128, 640, 1, 4096]
    - [180, 13.15]
  - - [192, 640, 1, 4096]
    - [134, 18.16]
  - - [256, 640, 1, 4096]
    - [45, 22.63]
  - - [320, 640, 1, 4096]
    - [45, 28.4]
  - - [384, 640, 1, 4096]
    - [134, 33.12]
  - - [448, 640, 1, 4096]
    - [161, 34.4]
  - - [512, 640, 1, 4096]
    - [134, 35.22]
  - - [576, 640, 1, 4096]
    - [161, 41.29]
  - - [640, 640, 1, 4096]
    - [133, 39.57]
  - - [704, 640, 1, 4096]
    - [74, 41.82]
  - - [768, 640, 1, 4096]
    - [74, 45.56]
  - - [832, 640, 1, 4096]
    - [74, 44.93]
  - - [896, 640, 1, 4096]
    - [75, 45.7]
  - - [960, 640, 1, 4096]
    - [75, 48.53]
  - - [1024, 640, 1, 4096]
    - [75, 51.77]
  - - [64, 704, 1, 4096]
    - [170, 0.0]
  - - [128, 704, 1, 4096]
    - [168, 13.16]
  - - [192, 704, 1, 4096]
    - [45, 0.0]
  - - [256, 704, 1, 4096]
    - [161, 24.74]
  - - [320, 704, 1, 4096]
    - [140, 0.0]
  - - [384, 704, 1, 4096]
    - [161, 33.02]
  - - [448, 704, 1, 4096]
    - [161, 0.0]
  - - [512, 704, 1, 4096]
    - [161, 37.93]
  - - [576, 704, 1, 4096]
    - [133, 0.0]
  - - [640, 704, 1, 4096]
    - [74, 40.86]
  - - [704, 704, 1, 4096]
    - [134, 0.0]
  - - [768, 704, 1, 4096]
    - [74, 42.05]
  - - [832, 704, 1, 4096]
    - [74, 0.0]
  - - [896, 704, 1, 4096]
    - [79, 46.25]
  - - [960, 704, 1, 4096]
    - [74, 0.0]
  - - [1024, 704, 1, 4096]
    - [185, 50.85]
  - - [64, 768, 1, 4096]
    - [157, 9.58]
  - - [128, 768, 1, 4096]
    - [148, 14.65]
  - - [192, 768, 1, 4096]
    - [134, 20.38]
  - - [256, 768, 1, 4096]
    - [45, 27.08]
  - - [320, 768, 1, 4096]
    - [161, 31.99]
  - - [384, 768, 1, 4096]
    - [140, 33.86]
  - - [448, 768, 1, 4096]
    - [142, 35.94]
  - - [512, 768, 1, 4096]
    - [134, 40.48]
  - - [576, 768, 1, 4096]
    - [161, 40.12]
  - - [640, 768, 1, 4096]
    - [74, 42.43]
  - - [704, 768, 1, 4096]
    - [139, 41.15]
  - - [768, 768, 1, 4096]
    - [79, 44.53]
  - - [832, 768, 1, 4096]
    - [134, 44.33]
  - - [896, 768, 1, 4096]
    - [185, 48.34]
  - - [960, 768, 1, 4096]
    - [72, 48.84]
  - - [1024, 768, 1, 4096]
    - [185, 54.83]
  - - [64, 832, 1, 4096]
    - [170, 0.0]
  - - [128, 832, 1, 4096]
    - [161, 15.57]
  - - [192, 832, 1, 4096]
    - [45, 0.0]
  - - [256, 832, 1, 4096]
    - [140, 28.92]
  - - [320, 832, 1, 4096]
    - [134, 0.0]
  - - [384, 832, 1, 4096]
    - [139, 34.11]
  - - [448, 832, 1, 4096]
    - [139, 0.0]
  - - [512, 832, 1, 4096]
    - [161, 40.27]
  - - [576, 832, 1, 4096]
    - [180, 0.0]
  - - [640, 832, 1, 4096]
    - [74, 41.83]
  - - [704, 832, 1, 4096]
    - [180, 0.0]
  - - [768, 832, 1, 4096]
    - [74, 47.2]
  - - [832, 832, 1, 4096]
    - [115, 0.0]
  - - [896, 832, 1, 4096]
    - [149, 51.82]
  - - [960, 832, 1, 4096]
    - [72, 0.0]
  - - [1024, 832, 1, 4096]
    - [179, 56.33]
  - - [64, 896, 1, 4096]
    - [176, 11.11]
  - - [128, 896, 1, 4096]
    - [137, 17.32]
  - - [192, 896, 1, 4096]
    - [45, 24.25]
  - - [256, 896, 1, 4096]
    - [45, 30.29]
  - - [320, 896, 1, 4096]
    - [45, 35.51]
  - - [384, 896, 1, 4096]
    - [138, 38.4]
  - - [448, 896, 1, 4096]
    - [169, 38.13]
  - - [512, 896, 1, 4096]
    - [169, 40.56]
  - - [576, 896, 1, 4096]
    - [74, 45.56]
  - - [640, 896, 1, 4096]
    - [74, 45.81]
  - - [704, 896, 1, 4096]
    - [74, 51.27]
  - - [768, 896, 1, 4096]
    - [180, 52.7]
  - - [832, 896, 1, 4096]
    - [75, 55.97]
  - - [896, 896, 1, 4096]
    - [149, 56.94]
  - - [960, 896, 1, 4096]
    - [75, 53.93]
  - - [1024, 896, 1, 4096]
    - [185, 63.1]
  - - [64, 960, 1, 4096]
    - [170, 0.0]
  - - [128, 960, 1, 4096]
    - [38, 17.81]
  - - [192, 960, 1, 4096]
    - [38, 0.0]
  - - [256, 960, 1, 4096]
    - [134, 32.96]
  - - [320, 960, 1, 4096]
    - [134, 0.0]
  - - [384, 960, 1, 4096]
    - [142, 37.94]
  - - [448, 960, 1, 4096]
    - [74, 0.0]
  - - [512, 960, 1, 4096]
    - [145, 43.04]
  - - [576, 960, 1, 4096]
    - [74, 0.0]
  - - [640, 960, 1, 4096]
    - [74, 47.27]
  - - [704, 960, 1, 4096]
    - [61, 0.0]
  - - [768, 960, 1, 4096]
    - [149, 52.43]
  - - [832, 960, 1, 4096]
    - [149, 0.0]
  - - [896, 960, 1, 4096]
    - [185, 59.5]
  - - [960, 960, 1, 4096]
    - [185, 0.0]
  - - [1024, 960, 1, 4096]
    - [186, 62.48]
  - - [64, 1024, 1, 4096]
    - [175, 12.1]
  - - [128, 1024, 1, 4096]
    - [137, 19.04]
  - - [192, 1024, 1, 4096]
    - [137, 26.96]
  - - [256, 1024, 1, 4096]
    - [134, 34.36]
  - - [320, 1024, 1, 4096]
    - [38, 35.56]
  - - [384, 1024, 1, 4096]
    - [139, 40.69]
  - - [448, 1024, 1, 4096]
    - [139, 42.01]
  - - [512, 1024, 1, 4096]
    - [161, 45.18]
  - - [576, 1024, 1, 4096]
    - [139, 45.47]
  - - [640, 1024, 1, 4096]
    - [161, 49.08]
  - - [704, 1024, 1, 4096]
    - [72, 47.39]
  - - [768, 1024, 1, 4096]
    - [149, 54.51]
  - - [832, 1024, 1, 4096]
    - [149, 51.54]
  - - [896, 1024, 1, 4096]
    - [185, 62.3]
  - - [960, 1024, 1, 4096]
    - [185, 56.79]
  - - [1024, 1024, 1, 4096]
    - [179, 0.0]
  - - [1088, 64, 1, 64]
    - [39, 0.0]
  - - [1216, 64, 1, 64]
    - [48, 0.0]
  - - [1344, 64, 1, 64]
    - [39, 0.0]
  - - [1472, 64, 1, 64]
    - [39, 0.0]
  - - [1600, 64, 1, 64]
    - [39, 0.0]
  - - [1728, 64, 1, 64]
    - [39, 0.0]
  - - [1856, 64, 1, 64]
    - [39, 0.0]
  - - [1984, 64, 1, 64]
    - [39, 0.0]
  - - [1088, 192, 1, 64]
    - [39, 0.0]
  - - [1216, 192, 1, 64]
    - [39, 0.0]
  - - [1344, 192, 1, 64]
    - [39, 0.0]
  - - [1472, 192, 1, 64]
    - [102, 0.0]
  - - [1600, 192, 1, 64]
    - [62, 0.0]
  - - [1728, 192, 1, 64]
    - [52, 0.0]
  - - [1856, 192, 1, 64]
    - [49, 0.0]
  - - [1984, 192, 1, 64]
    - [48, 0.0]
  - - [1088, 320, 1, 64]
    - [39, 0.0]
  - - [1216, 320, 1, 64]
    - [51, 0.0]
  - - [1344, 320, 1, 64]
    - [115, 0.0]
  - - [1472, 320, 1, 64]
    - [75, 0.0]
  - - [1600, 320, 1, 64]
    - [39, 0.0]
  - - [1728, 320, 1, 64]
    - [74, 0.0]
  - - [1856, 320, 1, 64]
    - [73, 0.0]
  - - [1984, 320, 1, 64]
    - [94, 0.0]
  - - [1088, 448, 1, 64]
    - [51, 0.0]
  - - [1216, 448, 1, 64]
    - [118, 0.0]
  - - [1344, 448, 1, 64]
    - [73, 0.0]
  - - [1472, 448, 1, 64]
    - [85, 0.0]
  - - [1600, 448, 1, 64]
    - [59, 0.0]
  - - [1728, 448, 1, 64]
    - [94, 0.0]
  - - [1856, 448, 1, 64]
    - [73, 0.0]
  - - [1984, 448, 1, 64]
    - [94, 0.0]
  - - [1088, 576, 1, 64]
    - [187, 0.0]
  - - [1216, 576, 1, 64]
    - [94, 0.0]
  - - [1344, 576, 1, 64]
    - [75, 0.0]
  - - [1472, 576, 1, 64]
    - [94, 0.0]
  - - [1600, 576, 1, 64]
    - [94, 0.0]
  - - [1728, 576, 1, 64]
    - [67, 0.0]
  - - [1856, 576, 1, 64]
    - [95, 0.0]
  - - [1984, 576, 1, 64]
    - [73, 0.0]
  - - [1088, 704, 1, 64]
    - [75, 0.0]
  - - [1216, 704, 1, 64]
    - [94, 0.0]
  - - [1344, 704, 1, 64]
    - [61, 0.0]
  - - [1472, 704, 1, 64]
    - [59, 0.0]
  - - [1600, 704, 1, 64]
    - [59, 0.0]
  - - [1728, 704, 1, 64]
    - [94, 0.0]
  - - [1856, 704, 1, 64]
    - [188, 0.0]
  - - [1984, 704, 1, 64]
    - [118, 0.0]
  - - [1088, 832, 1, 64]
    - [94, 0.0]
  - - [1216, 832, 1, 64]
    - [96, 0.0]
  - - [1344, 832, 1, 64]
    - [93, 0.0]
  - - [1472, 832, 1, 64]
    - [94, 0.0]
  - - [1600, 832, 1, 64]
    - [94, 0.0]
  - - [1728, 832, 1, 64]
    - [95, 0.0]
  - - [1856, 832, 1, 64]
    - [96, 0.0]
  - - [1984, 832, 1, 64]
    - [94, 0.0]
  - - [1088, 960, 1, 64]
    - [188, 0.0]
  - - [1216, 960, 1, 64]
    - [95, 0.0]
  - - [1344, 960, 1, 64]
    - [188, 0.0]
  - - [1472, 960, 1, 64]
    - [59, 0.0]
  - - [1600, 960, 1, 64]
    - [109, 0.0]
  - - [1728, 960, 1, 64]
    - [85, 0.0]
  - - [1856, 960, 1, 64]
    - [95, 0.0]
  - - [1984, 960, 1, 64]
    - [85, 0.0]
  - - [64, 1088, 1, 64]
    - [39, 0.0]
  - - [192, 1088, 1, 64]
    - [57, 0.0]
  - - [320, 1088, 1, 64]
    - [67, 0.0]
  - - [448, 1088, 1, 64]
    - [133, 0.0]
  - - [576, 1088, 1, 64]
    - [118, 0.0]
  - - [704, 1088, 1, 64]
    - [188, 0.0]
  - - [832, 1088, 1, 64]
    - [94, 0.0]
  - - [960, 1088, 1, 64]
    - [96, 0.0]
  - - [1088, 1088, 1, 64]
    - [95, 0.0]
  - - [1216, 1088, 1, 64]
    - [96, 0.0]
  - - [1344, 1088, 1, 64]
    - [94, 0.0]
  - - [1472, 1088, 1, 64]
    - [94, 0.0]
  - - [1600, 1088, 1, 64]
    - [95, 0.0]
  - - [1728, 1088, 1, 64]
    - [94, 0.0]
  - - [1856, 1088, 1, 64]
    - [95, 0.0]
  - - [1984, 1088, 1, 64]
    - [73, 0.0]
  - - [64, 1216, 1, 64]
    - [133, 0.0]
  - - [192, 1216, 1, 64]
    - [39, 0.0]
  - - [320, 1216, 1, 64]
    - [52, 0.0]
  - - [448, 1216, 1, 64]
    - [93, 0.0]
  - - [576, 1216, 1, 64]
    - [118, 0.0]
  - - [704, 1216, 1, 64]
    - [73, 0.0]
  - - [832, 1216, 1, 64]
    - [59, 0.0]
  - - [960, 1216, 1, 64]
    - [94, 0.0]
  - - [1088, 1216, 1, 64]
    - [94, 0.0]
  - - [1216, 1216, 1, 64]
    - [59, 0.0]
  - - [1344, 1216, 1, 64]
    - [94, 0.0]
  - - [1472, 1216, 1, 64]
    - [96, 0.0]
  - - [1600, 1216, 1, 64]
    - [95, 0.0]
  - - [1728, 1216, 1, 64]
    - [96, 0.0]
  - - [1856, 1216, 1, 64]
    - [96, 0.0]
  - - [1984, 1216, 1, 64]
    - [94, 0.0]
  - - [64, 1344, 1, 64]
    - [49, 0.0]
  - - [192, 1344, 1, 64]
    - [133, 0.0]
  - - [320, 1344, 1, 64]
    - [61, 0.0]
  - - [448, 1344, 1, 64]
    - [188, 0.0]
  - - [576, 1344, 1, 64]
    - [85, 0.0]
  - - [704, 1344, 1, 64]
    - [73, 0.0]
  - - [832, 1344, 1, 64]
    - [118, 0.0]
  - - [960, 1344, 1, 64]
    - [95, 0.0]
  - - [1088, 1344, 1, 64]
    - [73, 0.0]
  - - [1216, 1344, 1, 64]
    - [94, 0.0]
  - - [1344, 1344, 1, 64]
    - [109, 0.0]
  - - [1472, 1344, 1, 64]
    - [188, 0.0]
  - - [1600, 1344, 1, 64]
    - [188, 0.0]
  - - [1728, 1344, 1, 64]
    - [96, 0.0]
  - - [1856, 1344, 1, 64]
    - [96, 0.0]
  - - [1984, 1344, 1, 64]
    - [96, 0.0]
  - - [64, 1472, 1, 64]
    - [39, 0.0]
  - - [192, 1472, 1, 64]
    - [74, 0.0]
  - - [320, 1472, 1, 64]
    - [145, 0.0]
  - - [448, 1472, 1, 64]
    - [118, 0.0]
  - - [576, 1472, 1, 64]
    - [88, 0.0]
  - - [704, 1472, 1, 64]
    - [88, 0.0]
  - - [832, 1472, 1, 64]
    - [73, 0.0]
  - - [960, 1472, 1, 64]
    - [59, 0.0]
  - - [1088, 1472, 1, 64]
    - [94, 0.0]
  - - [1216, 1472, 1, 64]
    - [96, 0.0]
  - - [1344, 1472, 1, 64]
    - [109, 0.0]
  - - [1472, 1472, 1, 64]
    - [109, 0.0]
  - - [1600, 1472, 1, 64]
    - [118, 0.0]
  - - [1728, 1472, 1, 64]
    - [94, 0.0]
  - - [1856, 1472, 1, 64]
    - [96, 0.0]
  - - [1984, 1472, 1, 64]
    - [95, 0.0]
  - - [64, 1600, 1, 64]
    - [65, 0.0]
  - - [192, 1600, 1, 64]
    - [109, 0.0]
  - - [320, 1600, 1, 64]
    - [48, 0.0]
  - - [448, 1600, 1, 64]
    - [115, 0.0]
  - - [576, 1600, 1, 64]
    - [94, 0.0]
  - - [704, 1600, 1, 64]
    - [188, 0.0]
  - - [832, 1600, 1, 64]
    - [94, 0.0]
  - - [960, 1600, 1, 64]
    - [75, 0.0]
  - - [1088, 1600, 1, 64]
    - [73, 0.0]
  - - [1216, 1600, 1, 64]
    - [95, 0.0]
  - - [1344, 1600, 1, 64]
    - [95, 0.0]
  - - [1472, 1600, 1, 64]
    - [67, 0.0]
  - - [1600, 1600, 1, 64]
    - [96, 0.0]
  - - [1728, 1600, 1, 64]
    - [96, 0.0]
  - - [1856, 1600, 1, 64]
    - [188, 0.0]
  - - [1984, 1600, 1, 64]
    - [95, 0.0]
  - - [64, 1728, 1, 64]
    - [39, 0.0]
  - - [192, 1728, 1, 64]
    - [189, 0.0]
  - - [320, 1728, 1, 64]
    - [67, 0.0]
  - - [448, 1728, 1, 64]
    - [118, 0.0]
  - - [576, 1728, 1, 64]
    - [94, 0.0]
  - - [704, 1728, 1, 64]
    - [75, 0.0]
  - - [832, 1728, 1, 64]
    - [94, 0.0]
  - - [960, 1728, 1, 64]
    - [94, 0.0]
  - - [1088, 1728, 1, 64]
    - [95, 0.0]
  - - [1216, 1728, 1, 64]
    - [95, 0.0]
  - - [1344, 1728, 1, 64]
    - [96, 0.0]
  - - [1472, 1728, 1, 64]
    - [96, 0.0]
  - - [1600, 1728, 1, 64]
    - [95, 0.0]
  - - [1728, 1728, 1, 64]
    - [96, 0.0]
  - - [1856, 1728, 1, 64]
    - [96, 0.0]
  - - [1984, 1728, 1, 64]
    - [95, 0.0]
  - - [64, 1856, 1, 64]
    - [51, 0.0]
  - - [192, 1856, 1, 64]
    - [109, 0.0]
  - - [320, 1856, 1, 64]
    - [67, 0.0]
  - - [448, 1856, 1, 64]
    - [109, 0.0]
  - - [576, 1856, 1, 64]
    - [109, 0.0]
  - - [704, 1856, 1, 64]
    - [188, 0.0]
  - - [832, 1856, 1, 64]
    - [94, 0.0]
  - - [960, 1856, 1, 64]
    - [96, 0.0]
  - - [1088, 1856, 1, 64]
    - [95, 0.0]
  - - [1216, 1856, 1, 64]
    - [109, 0.0]
  - - [1344, 1856, 1, 64]
    - [67, 0.0]
  - - [1472, 1856, 1, 64]
    - [96, 0.0]
  - - [1600, 1856, 1, 64]
    - [96, 0.0]
  - - [1728, 1856, 1, 64]
    - [95, 0.0]
  - - [1856, 1856, 1, 64]
    - [96, 0.0]
  - - [1984, 1856, 1, 64]
    - [96, 0.0]
  - - [64, 1984, 1, 64]
    - [133, 0.0]
  - - [192, 1984, 1, 64]
    - [94, 0.0]
  - - [320, 1984, 1, 64]
    - [59, 0.0]
  - - [448, 1984, 1, 64]
    - [188, 0.0]
  - - [576, 1984, 1, 64]
    - [188, 0.0]
  - - [704, 1984, 1, 64]
    - [94, 0.0]
  - - [832, 1984, 1, 64]
    - [94, 0.0]
  - - [960, 1984, 1, 64]
    - [95, 0.0]
  - - [1088, 1984, 1, 64]
    - [67, 0.0]
  - - [1216, 1984, 1, 64]
    - [96, 0.0]
  - - [1344, 1984, 1, 64]
    - [67, 0.0]
  - - [1472, 1984, 1, 64]
    - [94, 0.0]
  - - [1600, 1984, 1, 64]
    - [95, 0.0]
  - - [1728, 1984, 1, 64]
    - [95, 0.0]
  - - [1856, 1984, 1, 64]
    - [96, 0.0]
  - - [1984, 1984, 1, 64]
    - [94, 0.0]
  - - [1088, 64, 1, 256]
    - [38, 0.0]
  - - [1216, 64, 1, 256]
    - [134, 0.0]
  - - [1344, 64, 1, 256]
    - [139, 0.0]
  - - [1472, 64, 1, 256]
    - [134, 0.0]
  - - [1600, 64, 1, 256]
    - [134, 0.0]
  - - [1728, 64, 1, 256]
    - [38, 0.0]
  - - [1856, 64, 1, 256]
    - [134, 0.0]
  - - [1984, 64, 1, 256]
    - [139, 0.0]
  - - [1088, 192, 1, 256]
    - [38, 0.0]
  - - [1216, 192, 1, 256]
    - [38, 0.0]
  - - [1344, 192, 1, 256]
    - [38, 0.0]
  - - [1472, 192, 1, 256]
    - [140, 0.0]
  - - [1600, 192, 1, 256]
    - [139, 0.0]
  - - [1728, 192, 1, 256]
    - [140, 0.0]
  - - [1856, 192, 1, 256]
    - [140, 0.0]
  - - [1984, 192, 1, 256]
    - [140, 0.0]
  - - [1088, 320, 1, 256]
    - [38, 0.0]
  - - [1216, 320, 1, 256]
    - [38, 0.0]
  - - [1344, 320, 1, 256]
    - [74, 0.0]
  - - [1472, 320, 1, 256]
    - [134, 0.0]
  - - [1600, 320, 1, 256]
    - [38, 0.0]
  - - [1728, 320, 1, 256]
    - [75, 0.0]
  - - [1856, 320, 1, 256]
    - [75, 0.0]
  - - [1984, 320, 1, 256]
    - [52, 0.0]
  - - [1088, 448, 1, 256]
    - [139, 0.0]
  - - [1216, 448, 1, 256]
    - [109, 0.0]
  - - [1344, 448, 1, 256]
    - [75, 0.0]
  - - [1472, 448, 1, 256]
    - [73, 0.0]
  - - [1600, 448, 1, 256]
    - [48, 0.0]
  - - [1728, 448, 1, 256]
    - [109, 0.0]
  - - [1856, 448, 1, 256]
    - [59, 0.0]
  - - [1984, 448, 1, 256]
    - [75, 0.0]
  - - [1088, 576, 1, 256]
    - [38, 0.0]
  - - [1216, 576, 1, 256]
    - [74, 0.0]
  - - [1344, 576, 1, 256]
    - [75, 0.0]
  - - [1472, 576, 1, 256]
    - [74, 0.0]
  - - [1600, 576, 1, 256]
    - [75, 0.0]
  - - [1728, 576, 1, 256]
    - [75, 0.0]
  - - [1856, 576, 1, 256]
    - [73, 0.0]
  - - [1984, 576, 1, 256]
    - [73, 0.0]
  - - [1088, 704, 1, 256]
    - [190, 0.0]
  - - [1216, 704, 1, 256]
    - [75, 0.0]
  - - [1344, 704, 1, 256]
    - [75, 0.0]
  - - [1472, 704, 1, 256]
    - [73, 0.0]
  - - [1600, 704, 1, 256]
    - [73, 0.0]
  - - [1728, 704, 1, 256]
    - [75, 0.0]
  - - [1856, 704, 1, 256]
    - [61, 0.0]
  - - [1984, 704, 1, 256]
    - [75, 0.0]
  - - [1088, 832, 1, 256]
    - [75, 0.0]
  - - [1216, 832, 1, 256]
    - [61, 0.0]
  - - [1344, 832, 1, 256]
    - [74, 0.0]
  - - [1472, 832, 1, 256]
    - [73, 0.0]
  - - [1600, 832, 1, 256]
    - [73, 0.0]
  - - [1728, 832, 1, 256]
    - [73, 0.0]
  - - [1856, 832, 1, 256]
    - [94, 0.0]
  - - [1984, 832, 1, 256]
    - [75, 0.0]
  - - [1088, 960, 1, 256]
    - [48, 0.0]
  - - [1216, 960, 1, 256]
    - [191, 0.0]
  - - [1344, 960, 1, 256]
    - [109, 0.0]
  - - [1472, 960, 1, 256]
    - [73, 0.0]
  - - [1600, 960, 1, 256]
    - [109, 0.0]
  - - [1728, 960, 1, 256]
    - [61, 0.0]
  - - [1856, 960, 1, 256]
    - [73, 0.0]
  - - [1984, 960, 1, 256]
    - [109, 0.0]
  - - [64, 1088, 1, 256]
    - [139, 0.0]
  - - [192, 1088, 1, 256]
    - [45, 0.0]
  - - [320, 1088, 1, 256]
    - [134, 0.0]
  - - [448, 1088, 1, 256]
    - [38, 0.0]
  - - [576, 1088, 1, 256]
    - [38, 0.0]
  - - [704, 1088, 1, 256]
    - [73, 0.0]
  - - [832, 1088, 1, 256]
    - [75, 0.0]
  - - [960, 1088, 1, 256]
    - [75, 0.0]
  - - [1088, 1088, 1, 256]
    - [75, 0.0]
  - - [1216, 1088, 1, 256]
    - [109, 0.0]
  - - [1344, 1088, 1, 256]
    - [75, 0.0]
  - - [1472, 1088, 1, 256]
    - [73, 0.0]
  - - [1600, 1088, 1, 256]
    - [75, 0.0]
  - - [1728, 1088, 1, 256]
    - [109, 0.0]
  - - [1856, 1088, 1, 256]
    - [67, 0.0]
  - - [1984, 1088, 1, 256]
    - [75, 0.0]
  - - [64, 1216, 1, 256]
    - [139, 0.0]
  - - [192, 1216, 1, 256]
    - [133, 0.0]
  - - [320, 1216, 1, 256]
    - [134, 0.0]
  - - [448, 1216, 1, 256]
    - [73, 0.0]
  - - [576, 1216, 1, 256]
    - [75, 0.0]
  - - [704, 1216, 1, 256]
    - [109, 0.0]
  - - [832, 1216, 1, 256]
    - [75, 0.0]
  - - [960, 1216, 1, 256]
    - [74, 0.0]
  - - [1088, 1216, 1, 256]
    - [109, 0.0]
  - - [1216, 1216, 1, 256]
    - [73, 0.0]
  - - [1344, 1216, 1, 256]
    - [73, 0.0]
  - - [1472, 1216, 1, 256]
    - [109, 0.0]
  - - [1600, 1216, 1, 256]
    - [109, 0.0]
  - - [1728, 1216, 1, 256]
    - [75, 0.0]
  - - [1856, 1216, 1, 256]
    - [75, 0.0]
  - - [1984, 1216, 1, 256]
    - [109, 0.0]
  - - [64, 1344, 1, 256]
    - [140, 0.0]
  - - [192, 1344, 1, 256]
    - [38, 0.0]
  - - [320, 1344, 1, 256]
    - [74, 0.0]
  - - [448, 1344, 1, 256]
    - [109, 0.0]
  - - [576, 1344, 1, 256]
    - [38, 0.0]
  - - [704, 1344, 1, 256]
    - [75, 0.0]
  - - [832, 1344, 1, 256]
    - [74, 0.0]
  - - [960, 1344, 1, 256]
    - [73, 0.0]
  - - [1088, 1344, 1, 256]
    - [75, 0.0]
  - - [1216, 1344, 1, 256]
    - [94, 0.0]
  - - [1344, 1344, 1, 256]
    - [75, 0.0]
  - - [1472, 1344, 1, 256]
    - [75, 0.0]
  - - [1600, 1344, 1, 256]
    - [75, 0.0]
  - - [1728, 1344, 1, 256]
    - [75, 0.0]
  - - [1856, 1344, 1, 256]
    - [109, 0.0]
  - - [1984, 1344, 1, 256]
    - [75, 0.0]
  - - [64, 1472, 1, 256]
    - [45, 0.0]
  - - [192, 1472, 1, 256]
    - [45, 0.0]
  - - [320, 1472, 1, 256]
    - [74, 0.0]
  - - [448, 1472, 1, 256]
    - [74, 0.0]
  - - [576, 1472, 1, 256]
    - [75, 0.0]
  - - [704, 1472, 1, 256]
    - [67, 0.0]
  - - [832, 1472, 1, 256]
    - [75, 0.0]
  - - [960, 1472, 1, 256]
    - [75, 0.0]
  - - [1088, 1472, 1, 256]
    - [73, 0.0]
  - - [1216, 1472, 1, 256]
    - [73, 0.0]
  - - [1344, 1472, 1, 256]
    - [109, 0.0]
  - - [1472, 1472, 1, 256]
    - [75, 0.0]
  - - [1600, 1472, 1, 256]
    - [75, 0.0]
  - - [1728, 1472, 1, 256]
    - [67, 0.0]
  - - [1856, 1472, 1, 256]
    - [75, 0.0]
  - - [1984, 1472, 1, 256]
    - [75, 0.0]
  - - [64, 1600, 1, 256]
    - [139, 0.0]
  - - [192, 1600, 1, 256]
    - [139, 0.0]
  - - [320, 1600, 1, 256]
    - [161, 0.0]
  - - [448, 1600, 1, 256]
    - [74, 0.0]
  - - [576, 1600, 1, 256]
    - [75, 0.0]
  - - [704, 1600, 1, 256]
    - [75, 0.0]
  - - [832, 1600, 1, 256]
    - [73, 0.0]
  - - [960, 1600, 1, 256]
    - [75, 0.0]
  - - [1088, 1600, 1, 256]
    - [75, 0.0]
  - - [1216, 1600, 1, 256]
    - [75, 0.0]
  - - [1344, 1600, 1, 256]
    - [115, 0.0]
  - - [1472, 1600, 1, 256]
    - [75, 0.0]
  - - [1600, 1600, 1, 256]
    - [75, 0.0]
  - - [1728, 1600, 1, 256]
    - [73, 0.0]
  - - [1856, 1600, 1, 256]
    - [75, 0.0]
  - - [1984, 1600, 1, 256]
    - [73, 0.0]
  - - [64, 1728, 1, 256]
    - [134, 0.0]
  - - [192, 1728, 1, 256]
    - [52, 0.0]
  - - [320, 1728, 1, 256]
    - [109, 0.0]
  - - [448, 1728, 1, 256]
    - [133, 0.0]
  - - [576, 1728, 1, 256]
    - [75, 0.0]
  - - [704, 1728, 1, 256]
    - [74, 0.0]
  - - [832, 1728, 1, 256]
    - [75, 0.0]
  - - [960, 1728, 1, 256]
    - [75, 0.0]
  - - [1088, 1728, 1, 256]
    - [75, 0.0]
  - - [1216, 1728, 1, 256]
    - [75, 0.0]
  - - [1344, 1728, 1, 256]
    - [73, 0.0]
  - - [1472, 1728, 1, 256]
    - [61, 0.0]
  - - [1600, 1728, 1, 256]
    - [73, 0.0]
  - - [1728, 1728, 1, 256]
    - [75, 0.0]
  - - [1856, 1728, 1, 256]
    - [75, 0.0]
  - - [1984, 1728, 1, 256]
    - [75, 0.0]
  - - [64, 1856, 1, 256]
    - [134, 0.0]
  - - [192, 1856, 1, 256]
    - [45, 0.0]
  - - [320, 1856, 1, 256]
    - [109, 0.0]
  - - [448, 1856, 1, 256]
    - [73, 0.0]
  - - [576, 1856, 1, 256]
    - [67, 0.0]
  - - [704, 1856, 1, 256]
    - [73, 0.0]
  - - [832, 1856, 1, 256]
    - [75, 0.0]
  - - [960, 1856, 1, 256]
    - [75, 0.0]
  - - [1088, 1856, 1, 256]
    - [75, 0.0]
  - - [1216, 1856, 1, 256]
    - [75, 0.0]
  - - [1344, 1856, 1, 256]
    - [75, 0.0]
  - - [1472, 1856, 1, 256]
    - [75, 0.0]
  - - [1600, 1856, 1, 256]
    - [75, 0.0]
  - - [1728, 1856, 1, 256]
    - [75, 0.0]
  - - [1856, 1856, 1, 256]
    - [75, 0.0]
  - - [1984, 1856, 1, 256]
    - [75, 0.0]
  - - [64, 1984, 1, 256]
    - [134, 0.0]
  - - [192, 1984, 1, 256]
    - [38, 0.0]
  - - [320, 1984, 1, 256]
    - [109, 0.0]
  - - [448, 1984, 1, 256]
    - [75, 0.0]
  - - [576, 1984, 1, 256]
    - [61, 0.0]
  - - [704, 1984, 1, 256]
    - [61, 0.0]
  - - [832, 1984, 1, 256]
    - [75, 0.0]
  - - [960, 1984, 1, 256]
    - [75, 0.0]
  - - [1088, 1984, 1, 256]
    - [75, 0.0]
  - - [1216, 1984, 1, 256]
    - [109, 0.0]
  - - [1344, 1984, 1, 256]
    - [61, 0.0]
  - - [1472, 1984, 1, 256]
    - [73, 0.0]
  - - [1600, 1984, 1, 256]
    - [109, 0.0]
  - - [1728, 1984, 1, 256]
    - [75, 0.0]
  - - [1856, 1984, 1, 256]
    - [75, 0.0]
  - - [1984, 1984, 1, 256]
    - [61, 0.0]
  - - [1088, 64, 1, 512]
    - [192, 0.0]
  - - [1216, 64, 1, 512]
    - [146, 0.0]
  - - [1344, 64, 1, 512]
    - [121, 0.0]
  - - [1472, 64, 1, 512]
    - [128, 0.0]
  - - [1600, 64, 1, 512]
    - [139, 0.0]
  - - [1728, 64, 1, 512]
    - [134, 0.0]
  - - [1856, 64, 1, 512]
    - [139, 0.0]
  - - [1984, 64, 1, 512]
    - [134, 0.0]
  - - [1088, 192, 1, 512]
    - [38, 0.0]
  - - [1216, 192, 1, 512]
    - [139, 0.0]
  - - [1344, 192, 1, 512]
    - [38, 0.0]
  - - [1472, 192, 1, 512]
    - [140, 0.0]
  - - [1600, 192, 1, 512]
    - [38, 0.0]
  - - [1728, 192, 1, 512]
    - [134, 0.0]
  - - [1856, 192, 1, 512]
    - [139, 0.0]
  - - [1984, 192, 1, 512]
    - [134, 0.0]
  - - [1088, 320, 1, 512]
    - [139, 0.0]
  - - [1216, 320, 1, 512]
    - [134, 0.0]
  - - [1344, 320, 1, 512]
    - [75, 0.0]
  - - [1472, 320, 1, 512]
    - [161, 0.0]
  - - [1600, 320, 1, 512]
    - [139, 0.0]
  - - [1728, 320, 1, 512]
    - [134, 0.0]
  - - [1856, 320, 1, 512]
    - [52, 0.0]
  - - [1984, 320, 1, 512]
    - [142, 0.0]
  - - [1088, 448, 1, 512]
    - [134, 0.0]
  - - [1216, 448, 1, 512]
    - [67, 0.0]
  - - [1344, 448, 1, 512]
    - [59, 0.0]
  - - [1472, 448, 1, 512]
    - [75, 0.0]
  - - [1600, 448, 1, 512]
    - [59, 0.0]
  - - [1728, 448, 1, 512]
    - [38, 0.0]
  - - [1856, 448, 1, 512]
    - [74, 0.0]
  - - [1984, 448, 1, 512]
    - [73, 0.0]
  - - [1088, 576, 1, 512]
    - [134, 0.0]
  - - [1216, 576, 1, 512]
    - [74, 0.0]
  - - [1344, 576, 1, 512]
    - [133, 0.0]
  - - [1472, 576, 1, 512]
    - [140, 0.0]
  - - [1600, 576, 1, 512]
    - [115, 0.0]
  - - [1728, 576, 1, 512]
    - [133, 0.0]
  - - [1856, 576, 1, 512]
    - [74, 0.0]
  - - [1984, 576, 1, 512]
    - [74, 0.0]
  - - [1088, 704, 1, 512]
    - [133, 0.0]
  - - [1216, 704, 1, 512]
    - [74, 0.0]
  - - [1344, 704, 1, 512]
    - [74, 0.0]
  - - [1472, 704, 1, 512]
    - [133, 0.0]
  - - [1600, 704, 1, 512]
    - [75, 0.0]
  - - [1728, 704, 1, 512]
    - [72, 0.0]
  - - [1856, 704, 1, 512]
    - [38, 0.0]
  - - [1984, 704, 1, 512]
    - [75, 0.0]
  - - [1088, 832, 1, 512]
    - [74, 0.0]
  - - [1216, 832, 1, 512]
    - [133, 0.0]
  - - [1344, 832, 1, 512]
    - [74, 0.0]
  - - [1472, 832, 1, 512]
    - [133, 0.0]
  - - [1600, 832, 1, 512]
    - [74, 0.0]
  - - [1728, 832, 1, 512]
    - [75, 0.0]
  - - [1856, 832, 1, 512]
    - [74, 0.0]
  - - [1984, 832, 1, 512]
    - [75, 0.0]
  - - [1088, 960, 1, 512]
    - [133, 0.0]
  - - [1216, 960, 1, 512]
    - [75, 0.0]
  - - [1344, 960, 1, 512]
    - [38, 0.0]
  - - [1472, 960, 1, 512]
    - [38, 0.0]
  - - [1600, 960, 1, 512]
    - [74, 0.0]
  - - [1728, 960, 1, 512]
    - [75, 0.0]
  - - [1856, 960, 1, 512]
    - [38, 0.0]
  - - [1984, 960, 1, 512]
    - [74, 0.0]
  - - [64, 1088, 1, 512]
    - [134, 0.0]
  - - [192, 1088, 1, 512]
    - [45, 0.0]
  - - [320, 1088, 1, 512]
    - [142, 0.0]
  - - [448, 1088, 1, 512]
    - [139, 0.0]
  - - [576, 1088, 1, 512]
    - [52, 0.0]
  - - [704, 1088, 1, 512]
    - [38, 0.0]
  - - [832, 1088, 1, 512]
    - [115, 0.0]
  - - [960, 1088, 1, 512]
    - [52, 0.0]
  - - [1088, 1088, 1, 512]
    - [73, 0.0]
  - - [1216, 1088, 1, 512]
    - [73, 0.0]
  - - [1344, 1088, 1, 512]
    - [75, 0.0]
  - - [1472, 1088, 1, 512]
    - [38, 0.0]
  - - [1600, 1088, 1, 512]
    - [75, 0.0]
  - - [1728, 1088, 1, 512]
    - [75, 0.0]
  - - [1856, 1088, 1, 512]
    - [75, 0.0]
  - - [1984, 1088, 1, 512]
    - [75, 0.0]
  - - [64, 1216, 1, 512]
    - [137, 0.0]
  - - [192, 1216, 1, 512]
    - [38, 0.0]
  - - [320, 1216, 1, 512]
    - [134, 0.0]
  - - [448, 1216, 1, 512]
    - [109, 0.0]
  - - [576, 1216, 1, 512]
    - [75, 0.0]
  - - [704, 1216, 1, 512]
    - [74, 0.0]
  - - [832, 1216, 1, 512]
    - [133, 0.0]
  - - [960, 1216, 1, 512]
    - [75, 0.0]
  - - [1088, 1216, 1, 512]
    - [38, 0.0]
  - - [1216, 1216, 1, 512]
    - [74, 0.0]
  - - [1344, 1216, 1, 512]
    - [74, 0.0]
  - - [1472, 1216, 1, 512]
    - [38, 0.0]
  - - [1600, 1216, 1, 512]
    - [74, 0.0]
  - - [1728, 1216, 1, 512]
    - [75, 0.0]
  - - [1856, 1216, 1, 512]
    - [75, 0.0]
  - - [1984, 1216, 1, 512]
    - [75, 0.0]
  - - [64, 1344, 1, 512]
    - [134, 0.0]
  - - [192, 1344, 1, 512]
    - [38, 0.0]
  - - [320, 1344, 1, 512]
    - [74, 0.0]
  - - [448, 1344, 1, 512]
    - [134, 0.0]
  - - [576, 1344, 1, 512]
    - [133, 0.0]
  - - [704, 1344, 1, 512]
    - [75, 0.0]
  - - [832, 1344, 1, 512]
    - [140, 0.0]
  - - [960, 1344, 1, 512]
    - [75, 0.0]
  - - [1088, 1344, 1, 512]
    - [74, 0.0]
  - - [1216, 1344, 1, 512]
    - [74, 0.0]
  - - [1344, 1344, 1, 512]
    - [38, 0.0]
  - - [1472, 1344, 1, 512]
    - [115, 0.0]
  - - [1600, 1344, 1, 512]
    - [115, 0.0]
  - - [1728, 1344, 1, 512]
    - [74, 0.0]
  - - [1856, 1344, 1, 512]
    - [115, 0.0]
  - - [1984, 1344, 1, 512]
    - [75, 0.0]
  - - [64, 1472, 1, 512]
    - [138, 0.0]
  - - [192, 1472, 1, 512]
    - [38, 0.0]
  - - [320, 1472, 1, 512]
    - [74, 0.0]
  - - [448, 1472, 1, 512]
    - [75, 0.0]
  - - [576, 1472, 1, 512]
    - [133, 0.0]
  - - [704, 1472, 1, 512]
    - [52, 0.0]
  - - [832, 1472, 1, 512]
    - [115, 0.0]
  - - [960, 1472, 1, 512]
    - [73, 0.0]
  - - [1088, 1472, 1, 512]
    - [75, 0.0]
  - - [1216, 1472, 1, 512]
    - [133, 0.0]
  - - [1344, 1472, 1, 512]
    - [115, 0.0]
  - - [1472, 1472, 1, 512]
    - [75, 0.0]
  - - [1600, 1472, 1, 512]
    - [75, 0.0]
  - - [1728, 1472, 1, 512]
    - [75, 0.0]
  - - [1856, 1472, 1, 512]
    - [75, 0.0]
  - - [1984, 1472, 1, 512]
    - [75, 0.0]
  - - [64, 1600, 1, 512]
    - [134, 0.0]
  - - [192, 1600, 1, 512]
    - [38, 0.0]
  - - [320, 1600, 1, 512]
    - [134, 0.0]
  - - [448, 1600, 1, 512]
    - [115, 0.0]
  - - [576, 1600, 1, 512]
    - [74, 0.0]
  - - [704, 1600, 1, 512]
    - [74, 0.0]
  - - [832, 1600, 1, 512]
    - [133, 0.0]
  - - [960, 1600, 1, 512]
    - [133, 0.0]
  - - [1088, 1600, 1, 512]
    - [75, 0.0]
  - - [1216, 1600, 1, 512]
    - [75, 0.0]
  - - [1344, 1600, 1, 512]
    - [75, 0.0]
  - - [1472, 1600, 1, 512]
    - [75, 0.0]
  - - [1600, 1600, 1, 512]
    - [38, 0.0]
  - - [1728, 1600, 1, 512]
    - [75, 0.0]
  - - [1856, 1600, 1, 512]
    - [74, 0.0]
  - - [1984, 1600, 1, 512]
    - [74, 0.0]
  - - [64, 1728, 1, 512]
    - [38, 0.0]
  - - [192, 1728, 1, 512]
    - [134, 0.0]
  - - [320, 1728, 1, 512]
    - [134, 0.0]
  - - [448, 1728, 1, 512]
    - [38, 0.0]
  - - [576, 1728, 1, 512]
    - [73, 0.0]
  - - [704, 1728, 1, 512]
    - [73, 0.0]
  - - [832, 1728, 1, 512]
    - [133, 0.0]
  - - [960, 1728, 1, 512]
    - [74, 0.0]
  - - [1088, 1728, 1, 512]
    - [74, 0.0]
  - - [1216, 1728, 1, 512]
    - [75, 0.0]
  - - [1344, 1728, 1, 512]
    - [74, 0.0]
  - - [1472, 1728, 1, 512]
    - [38, 0.0]
  - - [1600, 1728, 1, 512]
    - [74, 0.0]
  - - [1728, 1728, 1, 512]
    - [74, 0.0]
  - - [1856, 1728, 1, 512]
    - [74, 0.0]
  - - [1984, 1728, 1, 512]
    - [74, 0.0]
  - - [64, 1856, 1, 512]
    - [52, 0.0]
  - - [192, 1856, 1, 512]
    - [142, 0.0]
  - - [320, 1856, 1, 512]
    - [75, 0.0]
  - - [448, 1856, 1, 512]
    - [74, 0.0]
  - - [576, 1856, 1, 512]
    - [140, 0.0]
  - - [704, 1856, 1, 512]
    - [75, 0.0]
  - - [832, 1856, 1, 512]
    - [75, 0.0]
  - - [960, 1856, 1, 512]
    - [75, 0.0]
  - - [1088, 1856, 1, 512]
    - [75, 0.0]
  - - [1216, 1856, 1, 512]
    - [74, 0.0]
  - - [1344, 1856, 1, 512]
    - [74, 0.0]
  - - [1472, 1856, 1, 512]
    - [74, 0.0]
  - - [1600, 1856, 1, 512]
    - [75, 0.0]
  - - [1728, 1856, 1, 512]
    - [75, 0.0]
  - - [1856, 1856, 1, 512]
    - [74, 0.0]
  - - [1984, 1856, 1, 512]
    - [75, 0.0]
  - - [64, 1984, 1, 512]
    - [138, 0.0]
  - - [192, 1984, 1, 512]
    - [142, 0.0]
  - - [320, 1984, 1, 512]
    - [161, 0.0]
  - - [448, 1984, 1, 512]
    - [133, 0.0]
  - - [576, 1984, 1, 512]
    - [74, 0.0]
  - - [704, 1984, 1, 512]
    - [61, 0.0]
  - - [832, 1984, 1, 512]
    - [75, 0.0]
  - - [960, 1984, 1, 512]
    - [75, 0.0]
  - - [1088, 1984, 1, 512]
    - [75, 0.0]
  - - [1216, 1984, 1, 512]
    - [133, 0.0]
  - - [1344, 1984, 1, 512]
    - [75, 0.0]
  - - [1472, 1984, 1, 512]
    - [133, 0.0]
  - - [1600, 1984, 1, 512]
    - [72, 0.0]
  - - [1728, 1984, 1, 512]
    - [144, 0.0]
  - - [1856, 1984, 1, 512]
    - [144, 0.0]
  - - [1984, 1984, 1, 512]
    - [147, 0.0]
  - - [1088, 64, 1, 1024]
    - [121, 0.0]
  - - [1216, 64, 1, 1024]
    - [121, 0.0]
  - - [1344, 64, 1, 1024]
    - [121, 0.0]
  - - [1472, 64, 1, 1024]
    - [121, 0.0]
  - - [1600, 64, 1, 1024]
    - [151, 0.0]
  - - [1728, 64, 1, 1024]
    - [121, 0.0]
  - - [1856, 64, 1, 1024]
    - [125, 0.0]
  - - [1984, 64, 1, 1024]
    - [121, 0.0]
  - - [1088, 192, 1, 1024]
    - [38, 0.0]
  - - [1216, 192, 1, 1024]
    - [38, 0.0]
  - - [1344, 192, 1, 1024]
    - [38, 0.0]
  - - [1472, 192, 1, 1024]
    - [134, 0.0]
  - - [1600, 192, 1, 1024]
    - [161, 0.0]
  - - [1728, 192, 1, 1024]
    - [161, 0.0]
  - - [1856, 192, 1, 1024]
    - [134, 0.0]
  - - [1984, 192, 1, 1024]
    - [142, 0.0]
  - - [1088, 320, 1, 1024]
    - [139, 0.0]
  - - [1216, 320, 1, 1024]
    - [193, 0.0]
  - - [1344, 320, 1, 1024]
    - [74, 0.0]
  - - [1472, 320, 1, 1024]
    - [134, 0.0]
  - - [1600, 320, 1, 1024]
    - [134, 0.0]
  - - [1728, 320, 1, 1024]
    - [142, 0.0]
  - - [1856, 320, 1, 1024]
    - [139, 0.0]
  - - [1984, 320, 1, 1024]
    - [74, 0.0]
  - - [1088, 448, 1, 1024]
    - [142, 0.0]
  - - [1216, 448, 1, 1024]
    - [109, 0.0]
  - - [1344, 448, 1, 1024]
    - [139, 0.0]
  - - [1472, 448, 1, 1024]
    - [75, 0.0]
  - - [1600, 448, 1, 1024]
    - [74, 0.0]
  - - [1728, 448, 1, 1024]
    - [74, 0.0]
  - - [1856, 448, 1, 1024]
    - [115, 0.0]
  - - [1984, 448, 1, 1024]
    - [74, 0.0]
  - - [1088, 576, 1, 1024]
    - [75, 0.0]
  - - [1216, 576, 1, 1024]
    - [73, 0.0]
  - - [1344, 576, 1, 1024]
    - [115, 0.0]
  - - [1472, 576, 1, 1024]
    - [74, 0.0]
  - - [1600, 576, 1, 1024]
    - [74, 0.0]
  - - [1728, 576, 1, 1024]
    - [139, 0.0]
  - - [1856, 576, 1, 1024]
    - [74, 0.0]
  - - [1984, 576, 1, 1024]
    - [74, 0.0]
  - - [1088, 704, 1, 1024]
    - [74, 0.0]
  - - [1216, 704, 1, 1024]
    - [115, 0.0]
  - - [1344, 704, 1, 1024]
    - [74, 0.0]
  - - [1472, 704, 1, 1024]
    - [139, 0.0]
  - - [1600, 704, 1, 1024]
    - [93, 0.0]
  - - [1728, 704, 1, 1024]
    - [72, 0.0]
  - - [1856, 704, 1, 1024]
    - [139, 0.0]
  - - [1984, 704, 1, 1024]
    - [186, 0.0]
  - - [1088, 832, 1, 1024]
    - [74, 0.0]
  - - [1216, 832, 1, 1024]
    - [139, 0.0]
  - - [1344, 832, 1, 1024]
    - [74, 0.0]
  - - [1472, 832, 1, 1024]
    - [72, 0.0]
  - - [1600, 832, 1, 1024]
    - [74, 0.0]
  - - [1728, 832, 1, 1024]
    - [74, 0.0]
  - - [1856, 832, 1, 1024]
    - [74, 0.0]
  - - [1984, 832, 1, 1024]
    - [139, 0.0]
  - - [1088, 960, 1, 1024]
    - [139, 0.0]
  - - [1216, 960, 1, 1024]
    - [93, 0.0]
  - - [1344, 960, 1, 1024]
    - [161, 0.0]
  - - [1472, 960, 1, 1024]
    - [148, 0.0]
  - - [1600, 960, 1, 1024]
    - [139, 0.0]
  - - [1728, 960, 1, 1024]
    - [74, 0.0]
  - - [1856, 960, 1, 1024]
    - [194, 0.0]
  - - [1984, 960, 1, 1024]
    - [148, 0.0]
  - - [64, 1088, 1, 1024]
    - [168, 0.0]
  - - [192, 1088, 1, 1024]
    - [38, 0.0]
  - - [320, 1088, 1, 1024]
    - [48, 0.0]
  - - [448, 1088, 1, 1024]
    - [134, 0.0]
  - - [576, 1088, 1, 1024]
    - [115, 0.0]
  - - [704, 1088, 1, 1024]
    - [73, 0.0]
  - - [832, 1088, 1, 1024]
    - [142, 0.0]
  - - [960, 1088, 1, 1024]
    - [74, 0.0]
  - - [1088, 1088, 1, 1024]
    - [115, 0.0]
  - - [1216, 1088, 1, 1024]
    - [195, 0.0]
  - - [1344, 1088, 1, 1024]
    - [74, 0.0]
  - - [1472, 1088, 1, 1024]
    - [74, 0.0]
  - - [1600, 1088, 1, 1024]
    - [74, 0.0]
  - - [1728, 1088, 1, 1024]
    - [74, 0.0]
  - - [1856, 1088, 1, 1024]
    - [119, 0.0]
  - - [1984, 1088, 1, 1024]
    - [119, 0.0]
  - - [64, 1216, 1, 1024]
    - [160, 0.0]
  - - [192, 1216, 1, 1024]
    - [140, 0.0]
  - - [320, 1216, 1, 1024]
    - [134, 0.0]
  - - [448, 1216, 1, 1024]
    - [67, 0.0]
  - - [576, 1216, 1, 1024]
    - [75, 0.0]
  - - [704, 1216, 1, 1024]
    - [73, 0.0]
  - - [832, 1216, 1, 1024]
    - [134, 0.0]
  - - [960, 1216, 1, 1024]
    - [115, 0.0]
  - - [1088, 1216, 1, 1024]
    - [75, 0.0]
  - - [1216, 1216, 1, 1024]
    - [75, 0.0]
  - - [1344, 1216, 1, 1024]
    - [74, 0.0]
  - - [1472, 1216, 1, 1024]
    - [119, 0.0]
  - - [1600, 1216, 1, 1024]
    - [74, 0.0]
  - - [1728, 1216, 1, 1024]
    - [74, 0.0]
  - - [1856, 1216, 1, 1024]
    - [186, 0.0]
  - - [1984, 1216, 1, 1024]
    - [149, 0.0]
  - - [64, 1344, 1, 1024]
    - [168, 0.0]
  - - [192, 1344, 1, 1024]
    - [134, 0.0]
  - - [320, 1344, 1, 1024]
    - [74, 0.0]
  - - [448, 1344, 1, 1024]
    - [75, 0.0]
  - - [576, 1344, 1, 1024]
    - [73, 0.0]
  - - [704, 1344, 1, 1024]
    - [74, 0.0]
  - - [832, 1344, 1, 1024]
    - [115, 0.0]
  - - [960, 1344, 1, 1024]
    - [139, 0.0]
  - - [1088, 1344, 1, 1024]
    - [75, 0.0]
  - - [1216, 1344, 1, 1024]
    - [74, 0.0]
  - - [1344, 1344, 1, 1024]
    - [74, 0.0]
  - - [1472, 1344, 1, 1024]
    - [115, 0.0]
  - - [1600, 1344, 1, 1024]
    - [74, 0.0]
  - - [1728, 1344, 1, 1024]
    - [74, 0.0]
  - - [1856, 1344, 1, 1024]
    - [179, 0.0]
  - - [1984, 1344, 1, 1024]
    - [74, 0.0]
  - - [64, 1472, 1, 1024]
    - [170, 0.0]
  - - [192, 1472, 1, 1024]
    - [52, 0.0]
  - - [320, 1472, 1, 1024]
    - [115, 0.0]
  - - [448, 1472, 1, 1024]
    - [75, 0.0]
  - - [576, 1472, 1, 1024]
    - [74, 0.0]
  - - [704, 1472, 1, 1024]
    - [139, 0.0]
  - - [832, 1472, 1, 1024]
    - [75, 0.0]
  - - [960, 1472, 1, 1024]
    - [75, 0.0]
  - - [1088, 1472, 1, 1024]
    - [74, 0.0]
  - - [1216, 1472, 1, 1024]
    - [74, 0.0]
  - - [1344, 1472, 1, 1024]
    - [74, 0.0]
  - - [1472, 1472, 1, 1024]
    - [74, 0.0]
  - - [1600, 1472, 1, 1024]
    - [186, 0.0]
  - - [1728, 1472, 1, 1024]
    - [74, 0.0]
  - - [1856, 1472, 1, 1024]
    - [74, 0.0]
  - - [1984, 1472, 1, 1024]
    - [74, 0.0]
  - - [64, 1600, 1, 1024]
    - [38, 0.0]
  - - [192, 1600, 1, 1024]
    - [134, 0.0]
  - - [320, 1600, 1, 1024]
    - [139, 0.0]
  - - [448, 1600, 1, 1024]
    - [115, 0.0]
  - - [576, 1600, 1, 1024]
    - [74, 0.0]
  - - [704, 1600, 1, 1024]
    - [134, 0.0]
  - - [832, 1600, 1, 1024]
    - [74, 0.0]
  - - [960, 1600, 1, 1024]
    - [139, 0.0]
  - - [1088, 1600, 1, 1024]
    - [74, 0.0]
  - - [1216, 1600, 1, 1024]
    - [74, 0.0]
  - - [1344, 1600, 1, 1024]
    - [72, 0.0]
  - - [1472, 1600, 1, 1024]
    - [194, 0.0]
  - - [1600, 1600, 1, 1024]
    - [149, 0.0]
  - - [1728, 1600, 1, 1024]
    - [74, 0.0]
  - - [1856, 1600, 1, 1024]
    - [74, 0.0]
  - - [1984, 1600, 1, 1024]
    - [74, 0.0]
  - - [64, 1728, 1, 1024]
    - [161, 0.0]
  - - [192, 1728, 1, 1024]
    - [134, 0.0]
  - - [320, 1728, 1, 1024]
    - [61, 0.0]
  - - [448, 1728, 1, 1024]
    - [115, 0.0]
  - - [576, 1728, 1, 1024]
    - [75, 0.0]
  - - [704, 1728, 1, 1024]
    - [73, 0.0]
  - - [832, 1728, 1, 1024]
    - [75, 0.0]
  - - [960, 1728, 1, 1024]
    - [74, 0.0]
  - - [1088, 1728, 1, 1024]
    - [74, 0.0]
  - - [1216, 1728, 1, 1024]
    - [74, 0.0]
  - - [1344, 1728, 1, 1024]
    - [74, 0.0]
  - - [1472, 1728, 1, 1024]
    - [74, 0.0]
  - - [1600, 1728, 1, 1024]
    - [75, 0.0]
  - - [1728, 1728, 1, 1024]
    - [74, 0.0]
  - - [1856, 1728, 1, 1024]
    - [72, 0.0]
  - - [1984, 1728, 1, 1024]
    - [74, 0.0]
  - - [64, 1856, 1, 1024]
    - [134, 0.0]
  - - [192, 1856, 1, 1024]
    - [134, 0.0]
  - - [320, 1856, 1, 1024]
    - [59, 0.0]
  - - [448, 1856, 1, 1024]
    - [73, 0.0]
  - - [576, 1856, 1, 1024]
    - [142, 0.0]
  - - [704, 1856, 1, 1024]
    - [49, 0.0]
  - - [832, 1856, 1, 1024]
    - [75, 0.0]
  - - [960, 1856, 1, 1024]
    - [148, 0.0]
  - - [1088, 1856, 1, 1024]
    - [74, 0.0]
  - - [1216, 1856, 1, 1024]
    - [74, 0.0]
  - - [1344, 1856, 1, 1024]
    - [74, 0.0]
  - - [1472, 1856, 1, 1024]
    - [74, 0.0]
  - - [1600, 1856, 1, 1024]
    - [74, 0.0]
  - - [1728, 1856, 1, 1024]
    - [74, 0.0]
  - - [1856, 1856, 1, 1024]
    - [74, 0.0]
  - - [1984, 1856, 1, 1024]
    - [149, 0.0]
  - - [64, 1984, 1, 1024]
    - [140, 0.0]
  - - [192, 1984, 1, 1024]
    - [161, 0.0]
  - - [320, 1984, 1, 1024]
    - [134, 0.0]
  - - [448, 1984, 1, 1024]
    - [79, 0.0]
  - - [576, 1984, 1, 1024]
    - [75, 0.0]
  - - [704, 1984, 1, 1024]
    - [148, 0.0]
  - - [832, 1984, 1, 1024]
    - [139, 0.0]
  - - [960, 1984, 1, 1024]
    - [148, 0.0]
  - - [1088, 1984, 1, 1024]
    - [72, 0.0]
  - - [1216, 1984, 1, 1024]
    - [186, 0.0]
  - - [1344, 1984, 1, 1024]
    - [186, 0.0]
  - - [1472, 1984, 1, 1024]
    - [72, 0.0]
  - - [1600, 1984, 1, 1024]
    - [72, 0.0]
  - - [1728, 1984, 1, 1024]
    - [72, 0.0]
  - - [1856, 1984, 1, 1024]
    - [186, 0.0]
  - - [1984, 1984, 1, 1024]
    - [149, 0.0]
  - - [1088, 64, 1, 2048]
    - [121, 0.0]
  - - [1216, 64, 1, 2048]
    - [121, 0.0]
  - - [1344, 64, 1, 2048]
    - [128, 0.0]
  - - [1472, 64, 1, 2048]
    - [151, 0.0]
  - - [1600, 64, 1, 2048]
    - [146, 0.0]
  - - [1728, 64, 1, 2048]
    - [121, 0.0]
  - - [1856, 64, 1, 2048]
    - [125, 0.0]
  - - [1984, 64, 1, 2048]
    - [146, 0.0]
  - - [1088, 192, 1, 2048]
    - [38, 0.0]
  - - [1216, 192, 1, 2048]
    - [38, 0.0]
  - - [1344, 192, 1, 2048]
    - [140, 0.0]
  - - [1472, 192, 1, 2048]
    - [134, 0.0]
  - - [1600, 192, 1, 2048]
    - [139, 0.0]
  - - [1728, 192, 1, 2048]
    - [134, 0.0]
  - - [1856, 192, 1, 2048]
    - [134, 0.0]
  - - [1984, 192, 1, 2048]
    - [142, 0.0]
  - - [1088, 320, 1, 2048]
    - [134, 0.0]
  - - [1216, 320, 1, 2048]
    - [134, 0.0]
  - - [1344, 320, 1, 2048]
    - [74, 0.0]
  - - [1472, 320, 1, 2048]
    - [161, 0.0]
  - - [1600, 320, 1, 2048]
    - [139, 0.0]
  - - [1728, 320, 1, 2048]
    - [142, 0.0]
  - - [1856, 320, 1, 2048]
    - [161, 0.0]
  - - [1984, 320, 1, 2048]
    - [142, 0.0]
  - - [1088, 448, 1, 2048]
    - [134, 0.0]
  - - [1216, 448, 1, 2048]
    - [61, 0.0]
  - - [1344, 448, 1, 2048]
    - [74, 0.0]
  - - [1472, 448, 1, 2048]
    - [79, 0.0]
  - - [1600, 448, 1, 2048]
    - [73, 0.0]
  - - [1728, 448, 1, 2048]
    - [59, 0.0]
  - - [1856, 448, 1, 2048]
    - [149, 0.0]
  - - [1984, 448, 1, 2048]
    - [115, 0.0]
  - - [1088, 576, 1, 2048]
    - [115, 0.0]
  - - [1216, 576, 1, 2048]
    - [75, 0.0]
  - - [1344, 576, 1, 2048]
    - [79, 0.0]
  - - [1472, 576, 1, 2048]
    - [72, 0.0]
  - - [1600, 576, 1, 2048]
    - [74, 0.0]
  - - [1728, 576, 1, 2048]
    - [72, 0.0]
  - - [1856, 576, 1, 2048]
    - [82, 0.0]
  - - [1984, 576, 1, 2048]
    - [72, 0.0]
  - - [1088, 704, 1, 2048]
    - [72, 0.0]
  - - [1216, 704, 1, 2048]
    - [115, 0.0]
  - - [1344, 704, 1, 2048]
    - [72, 0.0]
  - - [1472, 704, 1, 2048]
    - [82, 0.0]
  - - [1600, 704, 1, 2048]
    - [72, 0.0]
  - - [1728, 704, 1, 2048]
    - [72, 0.0]
  - - [1856, 704, 1, 2048]
    - [148, 0.0]
  - - [1984, 704, 1, 2048]
    - [196, 0.0]
  - - [1088, 832, 1, 2048]
    - [74, 0.0]
  - - [1216, 832, 1, 2048]
    - [72, 0.0]
  - - [1344, 832, 1, 2048]
    - [72, 0.0]
  - - [1472, 832, 1, 2048]
    - [72, 0.0]
  - - [1600, 832, 1, 2048]
    - [148, 0.0]
  - - [1728, 832, 1, 2048]
    - [74, 0.0]
  - - [1856, 832, 1, 2048]
    - [74, 0.0]
  - - [1984, 832, 1, 2048]
    - [119, 0.0]
  - - [1088, 960, 1, 2048]
    - [72, 0.0]
  - - [1216, 960, 1, 2048]
    - [79, 0.0]
  - - [1344, 960, 1, 2048]
    - [186, 0.0]
  - - [1472, 960, 1, 2048]
    - [196, 0.0]
  - - [1600, 960, 1, 2048]
    - [120, 0.0]
  - - [1728, 960, 1, 2048]
    - [194, 0.0]
  - - [1856, 960, 1, 2048]
    - [119, 0.0]
  - - [1984, 960, 1, 2048]
    - [119, 0.0]
  - - [64, 1088, 1, 2048]
    - [168, 0.0]
  - - [192, 1088, 1, 2048]
    - [140, 0.0]
  - - [320, 1088, 1, 2048]
    - [134, 0.0]
  - - [448, 1088, 1, 2048]
    - [139, 0.0]
  - - [576, 1088, 1, 2048]
    - [161, 0.0]
  - - [704, 1088, 1, 2048]
    - [73, 0.0]
  - - [832, 1088, 1, 2048]
    - [115, 0.0]
  - - [960, 1088, 1, 2048]
    - [197, 0.0]
  - - [1088, 1088, 1, 2048]
    - [74, 0.0]
  - - [1216, 1088, 1, 2048]
    - [195, 0.0]
  - - [1344, 1088, 1, 2048]
    - [75, 0.0]
  - - [1472, 1088, 1, 2048]
    - [194, 0.0]
  - - [1600, 1088, 1, 2048]
    - [148, 0.0]
  - - [1728, 1088, 1, 2048]
    - [148, 0.0]
  - - [1856, 1088, 1, 2048]
    - [198, 0.0]
  - - [1984, 1088, 1, 2048]
    - [199, 0.0]
  - - [64, 1216, 1, 2048]
    - [170, 0.0]
  - - [192, 1216, 1, 2048]
    - [38, 0.0]
  - - [320, 1216, 1, 2048]
    - [142, 0.0]
  - - [448, 1216, 1, 2048]
    - [109, 0.0]
  - - [576, 1216, 1, 2048]
    - [73, 0.0]
  - - [704, 1216, 1, 2048]
    - [115, 0.0]
  - - [832, 1216, 1, 2048]
    - [72, 0.0]
  - - [960, 1216, 1, 2048]
    - [195, 0.0]
  - - [1088, 1216, 1, 2048]
    - [148, 0.0]
  - - [1216, 1216, 1, 2048]
    - [75, 0.0]
  - - [1344, 1216, 1, 2048]
    - [198, 0.0]
  - - [1472, 1216, 1, 2048]
    - [120, 0.0]
  - - [1600, 1216, 1, 2048]
    - [198, 0.0]
  - - [1728, 1216, 1, 2048]
    - [148, 0.0]
  - - [1856, 1216, 1, 2048]
    - [120, 0.0]
  - - [1984, 1216, 1, 2048]
    - [120, 0.0]
  - - [64, 1344, 1, 2048]
    - [168, 0.0]
  - - [192, 1344, 1, 2048]
    - [140, 0.0]
  - - [320, 1344, 1, 2048]
    - [74, 0.0]
  - - [448, 1344, 1, 2048]
    - [161, 0.0]
  - - [576, 1344, 1, 2048]
    - [73, 0.0]
  - - [704, 1344, 1, 2048]
    - [73, 0.0]
  - - [832, 1344, 1, 2048]
    - [115, 0.0]
  - - [960, 1344, 1, 2048]
    - [148, 0.0]
  - - [1088, 1344, 1, 2048]
    - [94, 0.0]
  - - [1216, 1344, 1, 2048]
    - [119, 0.0]
  - - [1344, 1344, 1, 2048]
    - [148, 0.0]
  - - [1472, 1344, 1, 2048]
    - [198, 0.0]
  - - [1600, 1344, 1, 2048]
    - [72, 0.0]
  - - [1728, 1344, 1, 2048]
    - [117, 0.0]
  - - [1856, 1344, 1, 2048]
    - [186, 0.0]
  - - [1984, 1344, 1, 2048]
    - [163, 0.0]
  - - [64, 1472, 1, 2048]
    - [168, 0.0]
  - - [192, 1472, 1, 2048]
    - [140, 0.0]
  - - [320, 1472, 1, 2048]
    - [74, 0.0]
  - - [448, 1472, 1, 2048]
    - [75, 0.0]
  - - [576, 1472, 1, 2048]
    - [115, 0.0]
  - - [704, 1472, 1, 2048]
    - [161, 0.0]
  - - [832, 1472, 1, 2048]
    - [148, 0.0]
  - - [960, 1472, 1, 2048]
    - [195, 0.0]
  - - [1088, 1472, 1, 2048]
    - [148, 0.0]
  - - [1216, 1472, 1, 2048]
    - [199, 0.0]
  - - [1344, 1472, 1, 2048]
    - [74, 0.0]
  - - [1472, 1472, 1, 2048]
    - [119, 0.0]
  - - [1600, 1472, 1, 2048]
    - [119, 0.0]
  - - [1728, 1472, 1, 2048]
    - [185, 0.0]
  - - [1856, 1472, 1, 2048]
    - [75, 0.0]
  - - [1984, 1472, 1, 2048]
    - [74, 0.0]
  - - [64, 1600, 1, 2048]
    - [140, 0.0]
  - - [192, 1600, 1, 2048]
    - [134, 0.0]
  - - [320, 1600, 1, 2048]
    - [161, 0.0]
  - - [448, 1600, 1, 2048]
    - [115, 0.0]
  - - [576, 1600, 1, 2048]
    - [75, 0.0]
  - - [704, 1600, 1, 2048]
    - [75, 0.0]
  - - [832, 1600, 1, 2048]
    - [195, 0.0]
  - - [960, 1600, 1, 2048]
    - [134, 0.0]
  - - [1088, 1600, 1, 2048]
    - [120, 0.0]
  - - [1216, 1600, 1, 2048]
    - [194, 0.0]
  - - [1344, 1600, 1, 2048]
    - [119, 0.0]
  - - [1472, 1600, 1, 2048]
    - [194, 0.0]
  - - [1600, 1600, 1, 2048]
    - [186, 0.0]
  - - [1728, 1600, 1, 2048]
    - [74, 0.0]
  - - [1856, 1600, 1, 2048]
    - [194, 0.0]
  - - [1984, 1600, 1, 2048]
    - [148, 0.0]
  - - [64, 1728, 1, 2048]
    - [43, 0.0]
  - - [192, 1728, 1, 2048]
    - [161, 0.0]
  - - [320, 1728, 1, 2048]
    - [134, 0.0]
  - - [448, 1728, 1, 2048]
    - [72, 0.0]
  - - [576, 1728, 1, 2048]
    - [74, 0.0]
  - - [704, 1728, 1, 2048]
    - [115, 0.0]
  - - [832, 1728, 1, 2048]
    - [75, 0.0]
  - - [960, 1728, 1, 2048]
    - [117, 0.0]
  - - [1088, 1728, 1, 2048]
    - [120, 0.0]
  - - [1216, 1728, 1, 2048]
    - [198, 0.0]
  - - [1344, 1728, 1, 2048]
    - [147, 0.0]
  - - [1472, 1728, 1, 2048]
    - [134, 0.0]
  - - [1600, 1728, 1, 2048]
    - [74, 0.0]
  - - [1728, 1728, 1, 2048]
    - [115, 0.0]
  - - [1856, 1728, 1, 2048]
    - [72, 0.0]
  - - [1984, 1728, 1, 2048]
    - [186, 0.0]
  - - [64, 1856, 1, 2048]
    - [134, 0.0]
  - - [192, 1856, 1, 2048]
    - [134, 0.0]
  - - [320, 1856, 1, 2048]
    - [75, 0.0]
  - - [448, 1856, 1, 2048]
    - [171, 0.0]
  - - [576, 1856, 1, 2048]
    - [73, 0.0]
  - - [704, 1856, 1, 2048]
    - [200, 0.0]
  - - [832, 1856, 1, 2048]
    - [194, 0.0]
  - - [960, 1856, 1, 2048]
    - [199, 0.0]
  - - [1088, 1856, 1, 2048]
    - [75, 0.0]
  - - [1216, 1856, 1, 2048]
    - [199, 0.0]
  - - [1344, 1856, 1, 2048]
    - [72, 0.0]
  - - [1472, 1856, 1, 2048]
    - [74, 0.0]
  - - [1600, 1856, 1, 2048]
    - [148, 0.0]
  - - [1728, 1856, 1, 2048]
    - [119, 0.0]
  - - [1856, 1856, 1, 2048]
    - [186, 0.0]
  - - [1984, 1856, 1, 2048]
    - [186, 0.0]
  - - [64, 1984, 1, 2048]
    - [161, 0.0]
  - - [192, 1984, 1, 2048]
    - [161, 0.0]
  - - [320, 1984, 1, 2048]
    - [142, 0.0]
  - - [448, 1984, 1, 2048]
    - [143, 0.0]
  - - [576, 1984, 1, 2048]
    - [134, 0.0]
  - - [704, 1984, 1, 2048]
    - [147, 0.0]
  - - [832, 1984, 1, 2048]
    - [119, 0.0]
  - - [960, 1984, 1, 2048]
    - [200, 0.0]
  - - [1088, 1984, 1, 2048]
    - [185, 0.0]
  - - [1216, 1984, 1, 2048]
    - [148, 0.0]
  - - [1344, 1984, 1, 2048]
    - [163, 0.0]
  - - [1472, 1984, 1, 2048]
    - [163, 0.0]
  - - [1600, 1984, 1, 2048]
    - [72, 0.0]
  - - [1728, 1984, 1, 2048]
    - [186, 0.0]
  - - [1856, 1984, 1, 2048]
    - [119, 0.0]
  - - [1984, 1984, 1, 2048]
    - [119, 0.0]
  - - [1088, 64, 1, 4096]
    - [121, 0.0]
  - - [1216, 64, 1, 4096]
    - [153, 0.0]
  - - [1344, 64, 1, 4096]
    - [151, 0.0]
  - - [1472, 64, 1, 4096]
    - [128, 0.0]
  - - [1600, 64, 1, 4096]
    - [121, 0.0]
  - - [1728, 64, 1, 4096]
    - [125, 0.0]
  - - [1856, 64, 1, 4096]
    - [121, 0.0]
  - - [1984, 64, 1, 4096]
    - [151, 0.0]
  - - [1088, 192, 1, 4096]
    - [134, 0.0]
  - - [1216, 192, 1, 4096]
    - [134, 0.0]
  - - [1344, 192, 1, 4096]
    - [134, 0.0]
  - - [1472, 192, 1, 4096]
    - [134, 0.0]
  - - [1600, 192, 1, 4096]
    - [38, 0.0]
  - - [1728, 192, 1, 4096]
    - [139, 0.0]
  - - [1856, 192, 1, 4096]
    - [142, 0.0]
  - - [1984, 192, 1, 4096]
    - [139, 0.0]
  - - [1088, 320, 1, 4096]
    - [134, 0.0]
  - - [1216, 320, 1, 4096]
    - [142, 0.0]
  - - [1344, 320, 1, 4096]
    - [134, 0.0]
  - - [1472, 320, 1, 4096]
    - [134, 0.0]
  - - [1600, 320, 1, 4096]
    - [161, 0.0]
  - - [1728, 320, 1, 4096]
    - [134, 0.0]
  - - [1856, 320, 1, 4096]
    - [115, 0.0]
  - - [1984, 320, 1, 4096]
    - [115, 0.0]
  - - [1088, 448, 1, 4096]
    - [139, 0.0]
  - - [1216, 448, 1, 4096]
    - [74, 0.0]
  - - [1344, 448, 1, 4096]
    - [61, 0.0]
  - - [1472, 448, 1, 4096]
    - [79, 0.0]
  - - [1600, 448, 1, 4096]
    - [72, 0.0]
  - - [1728, 448, 1, 4096]
    - [149, 0.0]
  - - [1856, 448, 1, 4096]
    - [149, 0.0]
  - - [1984, 448, 1, 4096]
    - [149, 0.0]
  - - [1088, 576, 1, 4096]
    - [74, 0.0]
  - - [1216, 576, 1, 4096]
    - [74, 0.0]
  - - [1344, 576, 1, 4096]
    - [72, 0.0]
  - - [1472, 576, 1, 4096]
    - [149, 0.0]
  - - [1600, 576, 1, 4096]
    - [74, 0.0]
  - - [1728, 576, 1, 4096]
    - [72, 0.0]
  - - [1856, 576, 1, 4096]
    - [171, 0.0]
  - - [1984, 576, 1, 4096]
    - [72, 0.0]
  - - [1088, 704, 1, 4096]
    - [79, 0.0]
  - - [1216, 704, 1, 4096]
    - [149, 0.0]
  - - [1344, 704, 1, 4096]
    - [79, 0.0]
  - - [1472, 704, 1, 4096]
    - [72, 0.0]
  - - [1600, 704, 1, 4096]
    - [148, 0.0]
  - - [1728, 704, 1, 4096]
    - [195, 0.0]
  - - [1856, 704, 1, 4096]
    - [195, 0.0]
  - - [1984, 704, 1, 4096]
    - [201, 0.0]
  - - [1088, 832, 1, 4096]
    - [79, 0.0]
  - - [1216, 832, 1, 4096]
    - [72, 0.0]
  - - [1344, 832, 1, 4096]
    - [79, 0.0]
  - - [1472, 832, 1, 4096]
    - [171, 0.0]
  - - [1600, 832, 1, 4096]
    - [163, 0.0]
  - - [1728, 832, 1, 4096]
    - [148, 0.0]
  - - [1856, 832, 1, 4096]
    - [74, 0.0]
  - - [1984, 832, 1, 4096]
    - [198, 0.0]
  - - [1088, 960, 1, 4096]
    - [171, 0.0]
  - - [1216, 960, 1, 4096]
    - [79, 0.0]
  - - [1344, 960, 1, 4096]
    - [196, 0.0]
  - - [1472, 960, 1, 4096]
    - [201, 0.0]
  - - [1600, 960, 1, 4096]
    - [148, 0.0]
  - - [1728, 960, 1, 4096]
    - [202, 0.0]
  - - [1856, 960, 1, 4096]
    - [203, 0.0]
  - - [1984, 960, 1, 4096]
    - [149, 0.0]
  - - [64, 1088, 1, 4096]
    - [160, 0.0]
  - - [192, 1088, 1, 4096]
    - [134, 0.0]
  - - [320, 1088, 1, 4096]
    - [139, 0.0]
  - - [448, 1088, 1, 4096]
    - [134, 0.0]
  - - [576, 1088, 1, 4096]
    - [74, 0.0]
  - - [704, 1088, 1, 4096]
    - [149, 0.0]
  - - [832, 1088, 1, 4096]
    - [185, 0.0]
  - - [960, 1088, 1, 4096]
    - [148, 0.0]
  - - [1088, 1088, 1, 4096]
    - [200, 0.0]
  - - [1216, 1088, 1, 4096]
    - [163, 0.0]
  - - [1344, 1088, 1, 4096]
    - [119, 0.0]
  - - [1472, 1088, 1, 4096]
    - [198, 0.0]
  - - [1600, 1088, 1, 4096]
    - [148, 0.0]
  - - [1728, 1088, 1, 4096]
    - [203, 0.0]
  - - [1856, 1088, 1, 4096]
    - [148, 0.0]
  - - [1984, 1088, 1, 4096]
    - [186, 0.0]
  - - [64, 1216, 1, 4096]
    - [160, 0.0]
  - - [192, 1216, 1, 4096]
    - [38, 0.0]
  - - [320, 1216, 1, 4096]
    - [161, 0.0]
  - - [448, 1216, 1, 4096]
    - [109, 0.0]
  - - [576, 1216, 1, 4096]
    - [74, 0.0]
  - - [704, 1216, 1, 4096]
    - [186, 0.0]
  - - [832, 1216, 1, 4096]
    - [72, 0.0]
  - - [960, 1216, 1, 4096]
    - [147, 0.0]
  - - [1088, 1216, 1, 4096]
    - [163, 0.0]
  - - [1216, 1216, 1, 4096]
    - [148, 0.0]
  - - [1344, 1216, 1, 4096]
    - [199, 0.0]
  - - [1472, 1216, 1, 4096]
    - [204, 0.0]
  - - [1600, 1216, 1, 4096]
    - [198, 0.0]
  - - [1728, 1216, 1, 4096]
    - [149, 0.0]
  - - [1856, 1216, 1, 4096]
    - [186, 0.0]
  - - [1984, 1216, 1, 4096]
    - [163, 0.0]
  - - [64, 1344, 1, 4096]
    - [170, 0.0]
  - - [192, 1344, 1, 4096]
    - [38, 0.0]
  - - [320, 1344, 1, 4096]
    - [74, 0.0]
  - - [448, 1344, 1, 4096]
    - [74, 0.0]
  - - [576, 1344, 1, 4096]
    - [75, 0.0]
  - - [704, 1344, 1, 4096]
    - [74, 0.0]
  - - [832, 1344, 1, 4096]
    - [148, 0.0]
  - - [960, 1344, 1, 4096]
    - [195, 0.0]
  - - [1088, 1344, 1, 4096]
    - [148, 0.0]
  - - [1216, 1344, 1, 4096]
    - [119, 0.0]
  - - [1344, 1344, 1, 4096]
    - [120, 0.0]
  - - [1472, 1344, 1, 4096]
    - [149, 0.0]
  - - [1600, 1344, 1, 4096]
    - [185, 0.0]
  - - [1728, 1344, 1, 4096]
    - [179, 0.0]
  - - [1856, 1344, 1, 4096]
    - [72, 0.0]
  - - [1984, 1344, 1, 4096]
    - [163, 0.0]
  - - [64, 1472, 1, 4096]
    - [170, 0.0]
  - - [192, 1472, 1, 4096]
    - [134, 0.0]
  - - [320, 1472, 1, 4096]
    - [74, 0.0]
  - - [448, 1472, 1, 4096]
    - [75, 0.0]
  - - [576, 1472, 1, 4096]
    - [72, 0.0]
  - - [704, 1472, 1, 4096]
    - [148, 0.0]
  - - [832, 1472, 1, 4096]
    - [195, 0.0]
  - - [960, 1472, 1, 4096]
    - [195, 0.0]
  - - [1088, 1472, 1, 4096]
    - [194, 0.0]
  - - [1216, 1472, 1, 4096]
    - [194, 0.0]
  - - [1344, 1472, 1, 4096]
    - [198, 0.0]
  - - [1472, 1472, 1, 4096]
    - [149, 0.0]
  - - [1600, 1472, 1, 4096]
    - [149, 0.0]
  - - [1728, 1472, 1, 4096]
    - [163, 0.0]
  - - [1856, 1472, 1, 4096]
    - [205, 0.0]
  - - [1984, 1472, 1, 4096]
    - [205, 0.0]
  - - [64, 1600, 1, 4096]
    - [134, 0.0]
  - - [192, 1600, 1, 4096]
    - [139, 0.0]
  - - [320, 1600, 1, 4096]
    - [134, 0.0]
  - - [448, 1600, 1, 4096]
    - [115, 0.0]
  - - [576, 1600, 1, 4096]
    - [79, 0.0]
  - - [704, 1600, 1, 4096]
    - [79, 0.0]
  - - [832, 1600, 1, 4096]
    - [205, 0.0]
  - - [960, 1600, 1, 4096]
    - [117, 0.0]
  - - [1088, 1600, 1, 4096]
    - [147, 0.0]
  - - [1216, 1600, 1, 4096]
    - [199, 0.0]
  - - [1344, 1600, 1, 4096]
    - [149, 0.0]
  - - [1472, 1600, 1, 4096]
    - [185, 0.0]
  - - [1600, 1600, 1, 4096]
    - [161, 0.0]
  - - [1728, 1600, 1, 4096]
    - [163, 0.0]
  - - [1856, 1600, 1, 4096]
    - [163, 0.0]
  - - [1984, 1600, 1, 4096]
    - [163, 0.0]
  - - [64, 1728, 1, 4096]
    - [43, 0.0]
  - - [192, 1728, 1, 4096]
    - [134, 0.0]
  - - [320, 1728, 1, 4096]
    - [142, 0.0]
  - - [448, 1728, 1, 4096]
    - [149, 0.0]
  - - [576, 1728, 1, 4096]
    - [115, 0.0]
  - - [704, 1728, 1, 4096]
    - [147, 0.0]
  - - [832, 1728, 1, 4096]
    - [198, 0.0]
  - - [960, 1728, 1, 4096]
    - [117, 0.0]
  - - [1088, 1728, 1, 4096]
    - [120, 0.0]
  - - [1216, 1728, 1, 4096]
    - [148, 0.0]
  - - [1344, 1728, 1, 4096]
    - [148, 0.0]
  - - [1472, 1728, 1, 4096]
    - [134, 0.0]
  - - [1600, 1728, 1, 4096]
    - [205, 0.0]
  - - [1728, 1728, 1, 4096]
    - [163, 0.0]
  - - [1856, 1728, 1, 4096]
    - [163, 0.0]
  - - [1984, 1728, 1, 4096]
    - [185, 0.0]
  - - [64, 1856, 1, 4096]
    - [161, 0.0]
  - - [192, 1856, 1, 4096]
    - [134, 0.0]
  - - [320, 1856, 1, 4096]
    - [74, 0.0]
  - - [448, 1856, 1, 4096]
    - [149, 0.0]
  - - [576, 1856, 1, 4096]
    - [171, 0.0]
  - - [704, 1856, 1, 4096]
    - [163, 0.0]
  - - [832, 1856, 1, 4096]
    - [119, 0.0]
  - - [960, 1856, 1, 4096]
    - [147, 0.0]
  - - [1088, 1856, 1, 4096]
    - [198, 0.0]
  - - [1216, 1856, 1, 4096]
    - [149, 0.0]
  - - [1344, 1856, 1, 4096]
    - [79, 0.0]
  - - [1472, 1856, 1, 4096]
    - [74, 0.0]
  - - [1600, 1856, 1, 4096]
    - [163, 0.0]
  - - [1728, 1856, 1, 4096]
    - [163, 0.0]
  - - [1856, 1856, 1, 4096]
    - [185, 0.0]
  - - [1984, 1856, 1, 4096]
    - [149, 0.0]
  - - [64, 1984, 1, 4096]
    - [43, 0.0]
  - - [192, 1984, 1, 4096]
    - [142, 0.0]
  - - [320, 1984, 1, 4096]
    - [134, 0.0]
  - - [448, 1984, 1, 4096]
    - [185, 0.0]
  - - [576, 1984, 1, 4096]
    - [147, 0.0]
  - - [704, 1984, 1, 4096]
    - [195, 0.0]
  - - [832, 1984, 1, 4096]
    - [199, 0.0]
  - - [960, 1984, 1, 4096]
    - [117, 0.0]
  - - [1088, 1984, 1, 4096]
    - [186, 0.0]
  - - [1216, 1984, 1, 4096]
    - [186, 0.0]
  - - [1344, 1984, 1, 4096]
    - [163, 0.0]
  - - [1472, 1984, 1, 4096]
    - [163, 0.0]
  - - [1600, 1984, 1, 4096]
    - [186, 0.0]
  - - [1728, 1984, 1, 4096]
    - [163, 0.0]
  - - [1856, 1984, 1, 4096]
    - [186, 0.0]
  - - [1984, 1984, 1, 4096]
    - [185, 0.0]
  - - [4096, 4096, 1, 4096]
    - [148, 79.35]
  - - [4096, 64, 1, 64]
    - [206, 0.0]
  - - [4096, 320, 1, 64]
    - [119, 0.0]
  - - [4096, 576, 1, 64]
    - [120, 0.0]
  - - [4096, 832, 1, 64]
    - [195, 0.0]
  - - [4096, 1088, 1, 64]
    - [119, 0.0]
  - - [4096, 1344, 1, 64]
    - [200, 0.0]
  - - [4096, 1600, 1, 64]
    - [120, 0.0]
  - - [4096, 1856, 1, 64]
    - [120, 0.0]
  - - [4096, 2112, 1, 64]
    - [196, 0.0]
  - - [4096, 2368, 1, 64]
    - [196, 0.0]
  - - [4096, 2624, 1, 64]
    - [120, 0.0]
  - - [4096, 2880, 1, 64]
    - [120, 0.0]
  - - [4096, 3136, 1, 64]
    - [120, 0.0]
  - - [4096, 3392, 1, 64]
    - [119, 0.0]
  - - [4096, 3648, 1, 64]
    - [196, 0.0]
  - - [4096, 3904, 1, 64]
    - [120, 0.0]
  - - [4096, 64, 1, 256]
    - [38, 0.0]
  - - [4096, 320, 1, 256]
    - [72, 0.0]
  - - [4096, 576, 1, 256]
    - [119, 0.0]
  - - [4096, 832, 1, 256]
    - [119, 0.0]
  - - [4096, 1088, 1, 256]
    - [149, 0.0]
  - - [4096, 1344, 1, 256]
    - [149, 0.0]
  - - [4096, 1600, 1, 256]
    - [120, 0.0]
  - - [4096, 1856, 1, 256]
    - [119, 0.0]
  - - [4096, 2112, 1, 256]
    - [120, 0.0]
  - - [4096, 2368, 1, 256]
    - [120, 0.0]
  - - [4096, 2624, 1, 256]
    - [119, 0.0]
  - - [4096, 2880, 1, 256]
    - [119, 0.0]
  - - [4096, 3136, 1, 256]
    - [119, 0.0]
  - - [4096, 3392, 1, 256]
    - [119, 0.0]
  - - [4096, 3648, 1, 256]
    - [119, 0.0]
  - - [4096, 3904, 1, 256]
    - [119, 0.0]
  - - [4096, 64, 1, 512]
    - [38, 0.0]
  - - [4096, 320, 1, 512]
    - [195, 0.0]
  - - [4096, 576, 1, 512]
    - [149, 0.0]
  - - [4096, 832, 1, 512]
    - [163, 0.0]
  - - [4096, 1088, 1, 512]
    - [120, 0.0]
  - - [4096, 1344, 1, 512]
    - [196, 0.0]
  - - [4096, 1600, 1, 512]
    - [119, 0.0]
  - - [4096, 1856, 1, 512]
    - [149, 0.0]
  - - [4096, 2112, 1, 512]
    - [148, 0.0]
  - - [4096, 2368, 1, 512]
    - [119, 0.0]
  - - [4096, 2624, 1, 512]
    - [148, 0.0]
  - - [4096, 2880, 1, 512]
    - [148, 0.0]
  - - [4096, 3136, 1, 512]
    - [148, 0.0]
  - - [4096, 3392, 1, 512]
    - [119, 0.0]
  - - [4096, 3648, 1, 512]
    - [148, 0.0]
  - - [4096, 3904, 1, 512]
    - [119, 0.0]
  - - [4096, 64, 1, 1024]
    - [161, 0.0]
  - - [4096, 320, 1, 1024]
    - [149, 0.0]
  - - [4096, 576, 1, 1024]
    - [163, 0.0]
  - - [4096, 832, 1, 1024]
    - [149, 0.0]
  - - [4096, 1088, 1, 1024]
    - [186, 0.0]
  - - [4096, 1344, 1, 1024]
    - [149, 0.0]
  - - [4096, 1600, 1, 1024]
    - [149, 0.0]
  - - [4096, 1856, 1, 1024]
    - [186, 0.0]
  - - [4096, 2112, 1, 1024]
    - [163, 0.0]
  - - [4096, 2368, 1, 1024]
    - [149, 0.0]
  - - [4096, 2624, 1, 1024]
    - [163, 0.0]
  - - [4096, 2880, 1, 1024]
    - [186, 0.0]
  - - [4096, 3136, 1, 1024]
    - [186, 0.0]
  - - [4096, 3392, 1, 1024]
    - [186, 0.0]
  - - [4096, 3648, 1, 1024]
    - [163, 0.0]
  - - [4096, 3904, 1, 1024]
    - [186, 0.0]
  - - [4096, 64, 1, 2048]
    - [134, 0.0]
  - - [4096, 320, 1, 2048]
    - [148, 0.0]
  - - [4096, 576, 1, 2048]
    - [147, 0.0]
  - - [4096, 832, 1, 2048]
    - [186, 0.0]
  - - [4096, 1088, 1, 2048]
    - [120, 0.0]
  - - [4096, 1344, 1, 2048]
    - [186, 0.0]
  - - [4096, 1600, 1, 2048]
    - [186, 0.0]
  - - [4096, 1856, 1, 2048]
    - [149, 0.0]
  - - [4096, 2112, 1, 2048]
    - [149, 0.0]
  - - [4096, 2368, 1, 2048]
    - [186, 0.0]
  - - [4096, 2624, 1, 2048]
    - [119, 0.0]
  - - [4096, 2880, 1, 2048]
    - [163, 0.0]
  - - [4096, 3136, 1, 2048]
    - [148, 0.0]
  - - [4096, 3392, 1, 2048]
    - [186, 0.0]
  - - [4096, 3648, 1, 2048]
    - [186, 0.0]
  - - [4096, 3904, 1, 2048]
    - [148, 0.0]
  - - [4096, 64, 1, 4096]
    - [139, 0.0]
  - - [4096, 320, 1, 4096]
    - [163, 0.0]
  - - [4096, 576, 1, 4096]
    - [186, 0.0]
  - - [4096, 832, 1, 4096]
    - [149, 0.0]
  - - [4096, 1088, 1, 4096]
    - [149, 0.0]
  - - [4096, 1344, 1, 4096]
    - [149, 0.0]
  - - [4096, 1600, 1, 4096]
    - [185, 0.0]
  - - [4096, 1856, 1, 4096]
    - [163, 0.0]
  - - [4096, 2112, 1, 4096]
    - [149, 0.0]
  - - [4096, 2368, 1, 4096]
    - [148, 0.0]
  - - [4096, 2624, 1, 4096]
    - [185, 0.0]
  - - [4096, 2880, 1, 4096]
    - [147, 0.0]
  - - [4096, 3136, 1, 4096]
    - [148, 0.0]
  - - [4096, 3392, 1, 4096]
    - [148, 0.0]
  - - [4096, 3648, 1, 4096]
    - [147, 0.0]
  - - [4096, 3904, 1, 4096]
    - [148, 0.0]
  - - [64, 4096, 1, 64]
    - [184, 0.0]
  - - [320, 4096, 1, 64]
    - [118, 0.0]
  - - [576, 4096, 1, 64]
    - [95, 0.0]
  - - [832, 4096, 1, 64]
    - [118, 0.0]
  - - [1088, 4096, 1, 64]
    - [96, 0.0]
  - - [1344, 4096, 1, 64]
    - [95, 0.0]
  - - [1600, 4096, 1, 64]
    - [96, 0.0]
  - - [1856, 4096, 1, 64]
    - [96, 0.0]
  - - [2112, 4096, 1, 64]
    - [95, 0.0]
  - - [2368, 4096, 1, 64]
    - [119, 0.0]
  - - [2624, 4096, 1, 64]
    - [96, 0.0]
  - - [2880, 4096, 1, 64]
    - [119, 0.0]
  - - [3136, 4096, 1, 64]
    - [120, 0.0]
  - - [3392, 4096, 1, 64]
    - [119, 0.0]
  - - [3648, 4096, 1, 64]
    - [200, 0.0]
  - - [3904, 4096, 1, 64]
    - [120, 0.0]
  - - [64, 4096, 1, 256]
    - [140, 0.0]
  - - [320, 4096, 1, 256]
    - [73, 0.0]
  - - [576, 4096, 1, 256]
    - [67, 0.0]
  - - [832, 4096, 1, 256]
    - [75, 0.0]
  - - [1088, 4096, 1, 256]
    - [75, 0.0]
  - - [1344, 4096, 1, 256]
    - [109, 0.0]
  - - [1600, 4096, 1, 256]
    - [75, 0.0]
  - - [1856, 4096, 1, 256]
    - [75, 0.0]
  - - [2112, 4096, 1, 256]
    - [73, 0.0]
  - - [2368, 4096, 1, 256]
    - [75, 0.0]
  - - [2624, 4096, 1, 256]
    - [94, 0.0]
  - - [2880, 4096, 1, 256]
    - [148, 0.0]
  - - [3136, 4096, 1, 256]
    - [147, 0.0]
  - - [3392, 4096, 1, 256]
    - [119, 0.0]
  - - [3648, 4096, 1, 256]
    - [119, 0.0]
  - - [3904, 4096, 1, 256]
    - [119, 0.0]
  - - [64, 4096, 1, 512]
    - [38, 0.0]
  - - [320, 4096, 1, 512]
    - [74, 0.0]
  - - [576, 4096, 1, 512]
    - [74, 0.0]
  - - [832, 4096, 1, 512]
    - [74, 0.0]
  - - [1088, 4096, 1, 512]
    - [75, 0.0]
  - - [1344, 4096, 1, 512]
    - [75, 0.0]
  - - [1600, 4096, 1, 512]
    - [75, 0.0]
  - - [1856, 4096, 1, 512]
    - [75, 0.0]
  - - [2112, 4096, 1, 512]
    - [75, 0.0]
  - - [2368, 4096, 1, 512]
    - [119, 0.0]
  - - [2624, 4096, 1, 512]
    - [148, 0.0]
  - - [2880, 4096, 1, 512]
    - [119, 0.0]
  - - [3136, 4096, 1, 512]
    - [119, 0.0]
  - - [3392, 4096, 1, 512]
    - [119, 0.0]
  - - [3648, 4096, 1, 512]
    - [148, 0.0]
  - - [3904, 4096, 1, 512]
    - [147, 0.0]
  - - [64, 4096, 1, 1024]
    - [43, 0.0]
  - - [320, 4096, 1, 1024]
    - [94, 0.0]
  - - [576, 4096, 1, 1024]
    - [115, 0.0]
  - - [832, 4096, 1, 1024]
    - [74, 0.0]
  - - [1088, 4096, 1, 1024]
    - [74, 0.0]
  - - [1344, 4096, 1, 1024]
    - [74, 0.0]
  - - [1600, 4096, 1, 1024]
    - [148, 0.0]
  - - [1856, 4096, 1, 1024]
    - [147, 0.0]
  - - [2112, 4096, 1, 1024]
    - [194, 0.0]
  - - [2368, 4096, 1, 1024]
    - [148, 0.0]
  - - [2624, 4096, 1, 1024]
    - [148, 0.0]
  - - [2880, 4096, 1, 1024]
    - [148, 0.0]
  - - [3136, 4096, 1, 1024]
    - [148, 0.0]
  - - [3392, 4096, 1, 1024]
    - [148, 0.0]
  - - [3648, 4096, 1, 1024]
    - [148, 0.0]
  - - [3904, 4096, 1, 1024]
    - [119, 0.0]
  - - [64, 4096, 1, 2048]
    - [43, 0.0]
  - - [320, 4096, 1, 2048]
    - [115, 0.0]
  - - [576, 4096, 1, 2048]
    - [115, 0.0]
  - - [832, 4096, 1, 2048]
    - [147, 0.0]
  - - [1088, 4096, 1, 2048]
    - [115, 0.0]
  - - [1344, 4096, 1, 2048]
    - [194, 0.0]
  - - [1600, 4096, 1, 2048]
    - [148, 0.0]
  - - [1856, 4096, 1, 2048]
    - [148, 0.0]
  - - [2112, 4096, 1, 2048]
    - [119, 0.0]
  - - [2368, 4096, 1, 2048]
    - [147, 0.0]
  - - [2624, 4096, 1, 2048]
    - [120, 0.0]
  - - [2880, 4096, 1, 2048]
    - [148, 0.0]
  - - [3136, 4096, 1, 2048]
    - [148, 0.0]
  - - [3392, 4096, 1, 2048]
    - [194, 0.0]
  - - [3648, 4096, 1, 2048]
    - [148, 0.0]
  - - [3904, 4096, 1, 2048]
    - [148, 0.0]
  - - [64, 4096, 1, 4096]
    - [45, 0.0]
  - - [320, 4096, 1, 4096]
    - [75, 0.0]
  - - [576, 4096, 1, 4096]
    - [147, 0.0]
  - - [832, 4096, 1, 4096]
    - [74, 0.0]
  - - [1088, 4096, 1, 4096]
    - [147, 0.0]
  - - [1344, 4096, 1, 4096]
    - [148, 0.0]
  - - [1600, 4096, 1, 4096]
    - [148, 0.0]
  - - [1856, 4096, 1, 4096]
    - [149, 0.0]
  - - [2112, 4096, 1, 4096]
    - [147, 0.0]
  - - [2368, 4096, 1, 4096]
    - [149, 0.0]
  - - [2624, 4096, 1, 4096]
    - [119, 0.0]
  - - [2880, 4096, 1, 4096]
    - [119, 0.0]
  - - [3136, 4096, 1, 4096]
    - [148, 0.0]
  - - [3392, 4096, 1, 4096]
    - [148, 0.0]
  - - [3648, 4096, 1, 4096]
    - [148, 0.0]
  - - [3904, 4096, 1, 4096]
    - [148, 0.0]
  - - [1088, 1024, 1, 64]
    - [95, 0.0]
  - - [1152, 1024, 1, 64]
    - [198, 0.0]
  - - [1216, 1024, 1, 64]
    - [61, 0.0]
  - - [1280, 1024, 1, 64]
    - [207, 0.0]
  - - [1344, 1024, 1, 64]
    - [95, 0.0]
  - - [1408, 1024, 1, 64]
    - [120, 0.0]
  - - [1472, 1024, 1, 64]
    - [75, 0.0]
  - - [1600, 1024, 1, 64]
    - [96, 0.0]
  - - [1664, 1024, 1, 64]
    - [120, 0.0]
  - - [1728, 1024, 1, 64]
    - [59, 0.0]
  - - [1792, 1024, 1, 64]
    - [120, 0.0]
  - - [1856, 1024, 1, 64]
    - [96, 0.0]
  - - [1920, 1024, 1, 64]
    - [119, 0.0]
