projects/hipblaslt/library/src/amd_detail/rocblaslt/src/Tensile/Logic/asm_full/gfx1201/GridBased/gfx1201_Cijk_Ailk_Bjlk_HSS_BH_Bias_SHB_HA_S_SAB_SCD_SAV_UserArgs.yaml
- {MinimumRequiredVersion: 5.0.0}
- gfx1201
- gfx1201
- [Device 73f0]
    SolutionIndex: 0
    SolutionNameMin: Cijk_Ailk_Bjlk_HSS_BH_Bias_HAS_SAV_UserArgs_MT64x32x32_MI16x16x1_SN_CLR1_GSU1_LBSPPA1024_LBSPPB512_MIWT2_1_PGR1_PLR1_SS0_SU32_SUM1_SUS256_SVW8_WG32_4_1_WGM8
    SolutionIndex: 1
    SolutionNameMin: Cijk_Ailk_Bjlk_HSS_BH_Bias_HAS_SAV_UserArgs_MT64x32x32_MI16x16x1_SN_CLR1_GSU1_LBSPPA1024_LBSPPB512_MIWT2_1_PGR2_PLR1_SS0_SU32_SUM1_SUS256_SVW8_WG32_4_1_WGM8
    SolutionIndex: 2
    SolutionNameMin: Cijk_Ailk_Bjlk_HSS_BH_Bias_HAS_SAV_UserArgs_MT64x32x32_MI16x16x1_SN_CLR0_GSU1_LBSPPA1024_LBSPPB512_MIWT2_1_PGR1_PLR0_SS0_SU32_SUM1_SUS256_SVW8_WG32_4_1_WGM8
    SolutionIndex: 3
    SolutionNameMin: Cijk_Ailk_Bjlk_HSS_BH_Bias_HAS_SAV_UserArgs_MT64x32x32_MI16x16x1_SN_CLR0_GSU1_LBSPPA1024_LBSPPB512_MIWT2_1_PGR2_PLR0_SS0_SU32_SUM1_SUS256_SVW8_WG32_4_1_WGM8
    SolutionIndex: 4
    SolutionNameMin: Cijk_Ailk_Bjlk_HSS_BH_Bias_HAS_SAV_UserArgs_MT32x64x32_MI16x16x1_SN_CLR1_GSU1_LBSPPA512_LBSPPB1024_MIWT2_1_PGR1_PLR1_SS0_SU32_SUM1_SUS256_SVW8_WG16_8_1_WGM8
    SolutionIndex: 5
    SolutionNameMin: Cijk_Ailk_Bjlk_HSS_BH_Bias_HAS_SAV_UserArgs_MT32x64x32_MI16x16x1_SN_CLR1_GSU1_LBSPPA512_LBSPPB1024_MIWT2_1_PGR2_PLR1_SS0_SU32_SUM1_SUS256_SVW8_WG16_8_1_WGM8
    SolutionIndex: 6
    SolutionNameMin: Cijk_Ailk_Bjlk_HSS_BH_Bias_HAS_SAV_UserArgs_MT32x64x32_MI16x16x1_SN_CLR0_GSU1_LBSPPA512_LBSPPB1024_MIWT2_1_PGR1_PLR0_SS0_SU32_SUM1_SUS256_SVW8_WG16_8_1_WGM8
    SolutionIndex: 7
    SolutionNameMin: Cijk_Ailk_Bjlk_HSS_BH_Bias_HAS_SAV_UserArgs_MT32x64x32_MI16x16x1_SN_CLR0_GSU1_LBSPPA512_LBSPPB1024_MIWT2_1_PGR2_PLR0_SS0_SU32_SUM1_SUS256_SVW8_WG16_8_1_WGM8
    SolutionIndex: 8
    SolutionNameMin: Cijk_Ailk_Bjlk_HSS_BH_Bias_HAS_SAV_UserArgs_MT32x32x64_MI16x16x1_SN_CLR1_GSU1_LBSPPA512_LBSPPB512_MIWT1_1_PGR1_PLR1_SS0_SU32_SUM1_SUS256_SVW8_WG32_4_1_WGM8
    SolutionIndex: 9
    SolutionNameMin: Cijk_Ailk_Bjlk_HSS_BH_Bias_HAS_SAV_UserArgs_MT64x32x64_MI16x16x1_SN_CLR1_GSU1_LBSPPA1024_LBSPPB512_MIWT2_1_PGR1_PLR3_SS0_SU32_SUM1_SUS256_SVW8_WG32_4_1_WGM8
    SolutionIndex: 10
    SolutionNameMin: Cijk_Ailk_Bjlk_HSS_BH_Bias_HAS_SAV_UserArgs_MT64x16x32_MI16x16x1_SN_CLR1_GSU1_LBSPPA1024_LBSPPB256_MIWT1_1_PGR2_PLR1_SS1_SU32_SUM1_SUS256_SVW1_WG64_2_1_WGM8
    SolutionIndex: 11
    SolutionNameMin: Cijk_Ailk_Bjlk_HSS_BH_Bias_HAS_SAV_UserArgs_MT64x16x32_MI16x16x1_SN_CLR0_GSU1_LBSPPA1024_LBSPPB256_MIWT1_1_PGR2_PLR0_SS1_SU32_SUM1_SUS256_SVW1_WG64_2_1_WGM8
    SolutionIndex: 12
    SolutionNameMin: Cijk_Ailk_Bjlk_HSS_BH_Bias_HAS_SAV_UserArgs_MT32x32x32_MI16x16x1_SN_CLR0_GSU1_LBSPPA512_LBSPPB512_MIWT1_1_PGR2_PLR0_SS1_SU32_SUM1_SUS256_SVW1_WG32_4_1_WGM8
    SolutionIndex: 13
    SolutionNameMin: Cijk_Ailk_Bjlk_HSS_BH_Bias_HAS_SAV_UserArgs_MT64x32x32_MI16x16x1_SN_CLR1_GSU1_LBSPPA1024_LBSPPB512_MIWT2_1_PGR1_PLR1_SS1_SU32_SUM1_SUS256_SVW1_WG32_4_1_WGM8
    SolutionIndex: 14
    SolutionNameMin: Cijk_Ailk_Bjlk_HSS_BH_Bias_HAS_SAV_UserArgs_MT64x32x32_MI16x16x1_SN_CLR1_GSU1_LBSPPA1024_LBSPPB512_MIWT2_1_PGR2_PLR1_SS1_SU32_SUM1_SUS256_SVW1_WG32_4_1_WGM8
    SolutionIndex: 15
    SolutionNameMin: Cijk_Ailk_Bjlk_HSS_BH_Bias_HAS_SAV_UserArgs_MT32x64x32_MI16x16x1_SN_CLR1_GSU1_LBSPPA512_LBSPPB1024_MIWT2_1_PGR1_PLR1_SS1_SU32_SUM1_SUS256_SVW1_WG16_8_1_WGM8
    SolutionIndex: 16
    SolutionNameMin: Cijk_Ailk_Bjlk_HSS_BH_Bias_HAS_SAV_UserArgs_MT32x64x32_MI16x16x1_SN_CLR0_GSU1_LBSPPA512_LBSPPB1024_MIWT2_1_PGR1_PLR0_SS1_SU32_SUM1_SUS256_SVW1_WG16_8_1_WGM8
    SolutionIndex: 17
    SolutionNameMin: Cijk_Ailk_Bjlk_HSS_BH_Bias_HAS_SAV_UserArgs_MT64x32x64_MI16x16x1_SN_CLR1_GSU1_LBSPPA1024_LBSPPB512_MIWT2_1_PGR1_PLR1_SS1_SU32_SUM1_SUS256_SVW1_WG32_4_1_WGM8
    SolutionIndex: 114
    SolutionNameMin: Cijk_Ailk_Bjlk_HSS_BH_Bias_SHB_HA_S_SAB_SCD_SAV_UserArgs_MT32x32x64_MI16x16x1_SN_LDSB1_AFC1_AFEM1_AFEM1_ASEM1_CLR1_CADS0_DTLA0_DTLB0_DTVA0_DTVB0_EPS1_FDSI0_GRPM1_GRVWA1_GRVWB1_GSU1_GSUAMB_GSUC0_GSUWGMRR0_GLS0_ISA1201_IU4_K1_LBSPPA512_LBSPPB512_LBSPPM0_LPA16_LPB16_LPM0_LRVW8_LWPMn1_MIAV1_MIWT1_1_MO40_NTn1_NTA0_NTB0_NTC0_NTD0_NTM0_NEPBS0_NLCA1_NLCB1_ONLL0_PGR1_PLR1_PKA0_SIA2_SS0_SU32_SUM1_SUS256_SPO0_SRVW0_SSO0_SVW8_SK0_SKXCCM0_TLDS0_ULSGRO0_USL1_UIOFGRO0_USFGROn1_VSn1_VWA1_VWB1_WSGRA0_WSGRB0_WS32_WG32_4_1_WGM8_WGMXCC1_WGMXCCGn1
    SolutionIndex: 115
    SolutionNameMin: Cijk_Ailk_Bjlk_HSS_BH_Bias_SHB_HA_S_SAB_SCD_SAV_UserArgs_MT16x32x32_MI16x16x1_SN_LDSB1_AFC1_AFEM1_AFEM1_ASEM1_CLR1_CADS0_DTLA0_DTLB0_DTVA0_DTVB0_EPS0_FDSI0_GRPM1_GRVWA4_GRVWB4_GSU1_GSUAMB_GSUC0_GSUWGMRR0_GLS0_ISA1201_IU2_K1_LBSPPA256_LBSPPB512_LBSPPM0_LPA16_LPB16_LPM0_LRVW8_LWPMn1_MIAV1_MIWT1_1_MO40_NTn1_NTA0_NTB0_NTC0_NTD0_NTM0_NEPBS0_NLCA1_NLCB1_ONLL0_PGR2_PLR1_PKA0_SIA2_SS0_SU32_SUM1_SUS256_SPO0_SRVW0_SSO0_SVW8_SK0_SKXCCM0_TLDS0_ULSGRO0_USL1_UIOFGRO0_USFGROn1_VSn1_VWA1_VWB1_WSGRA0_WSGRB0_WS32_WG16_4_1_WGM8_WGMXCC1_WGMXCCGn1
    SolutionIndex: 116
    SolutionNameMin: Cijk_Ailk_Bjlk_HSS_BH_Bias_SHB_HA_S_SAB_SCD_SAV_UserArgs_MT32x32x64_MI16x16x1_SN_LDSB1_AFC1_AFEM1_AFEM1_ASEM1_CLR1_CADS0_DTLA0_DTLB0_DTVA0_DTVB0_EPS0_FDSI0_GRPM1_GRVWA1_GRVWB8_GSU1_GSUAMB_GSUC0_GSUWGMRR0_GLS0_ISA1201_IU4_K1_LBSPPA512_LBSPPB512_LBSPPM0_LPA16_LPB16_LPM0_LRVW8_LWPMn1_MIAV1_MIWT1_1_MO40_NTn1_NTA0_NTB0_NTC0_NTD0_NTM0_NEPBS0_NLCA1_NLCB1_ONLL0_PGR2_PLR1_PKA0_SIA2_SS0_SU32_SUM1_SUS256_SPO0_SRVW0_SSO0_SVW8_SK0_SKXCCM0_TLDS0_ULSGRO0_USL1_UIOFGRO0_USFGROn1_VSn1_VWA1_VWB1_WSGRA0_WSGRB0_WS32_WG32_4_1_WGM8_WGMXCC1_WGMXCCGn1
    SolutionIndex: 117
    SolutionNameMin: Cijk_Ailk_Bjlk_HSS_BH_Bias_SHB_HA_S_SAB_SCD_SAV_UserArgs_MT32x32x32_MI16x16x1_SN_LDSB1_AFC1_AFEM1_AFEM1_ASEM1_CLR1_CADS0_DTLA0_DTLB0_DTVA0_DTVB0_EPS1_FDSI0_GRPM1_GRVWA4_GRVWB4_GSU1_GSUAMB_GSUC0_GSUWGMRR0_GLS0_ISA1201_IU2_K1_LBSPPA512_LBSPPB512_LBSPPM0_LPA16_LPB16_LPM0_LRVW8_LWPMn1_MIAV1_MIWT1_1_MO40_NTn1_NTA0_NTB0_NTC0_NTD0_NTM0_NEPBS0_NLCA1_NLCB1_ONLL0_PGR1_PLR1_PKA0_SIA2_SS0_SU32_SUM1_SUS256_SPO0_SRVW0_SSO0_SVW8_SK0_SKXCCM0_TLDS0_ULSGRO0_USL1_UIOFGRO0_USFGROn1_VSn1_VWA1_VWB1_WSGRA0_WSGRB0_WS32_WG32_4_1_WGM8_WGMXCC1_WGMXCCGn1
    SolutionIndex: 118
    SolutionNameMin: Cijk_Ailk_Bjlk_HSS_BH_Bias_SHB_HA_S_SAB_SCD_SAV_UserArgs_MT32x32x64_MI16x16x1_SN_LDSB1_AFC1_AFEM1_AFEM1_ASEM1_CLR1_CADS0_DTLA0_DTLB0_DTVA0_DTVB0_EPS0_FDSI0_GRPM1_GRVWA4_GRVWB8_GSU1_GSUAMB_GSUC0_GSUWGMRR0_GLS0_ISA1201_IU4_K1_LBSPPA512_LBSPPB512_LBSPPM0_LPA16_LPB16_LPM0_LRVW8_LWPMn1_MIAV1_MIWT1_1_MO40_NTn1_NTA0_NTB0_NTC0_NTD0_NTM0_NEPBS0_NLCA1_NLCB1_ONLL0_PGR2_PLR1_PKA0_SIA2_SS1_SU32_SUM1_SUS256_SPO0_SRVW0_SSO0_SVW1_SK0_SKXCCM0_TLDS0_ULSGRO1_USL1_UIOFGRO0_USFGROn1_VSn1_VWA1_VWB1_WSGRA0_WSGRB0_WS32_WG32_4_1_WGM8_WGMXCC1_WGMXCCGn1
    SolutionIndex: 119
    SolutionNameMin: Cijk_Ailk_Bjlk_HSS_BH_Bias_SHB_HA_S_SAB_SCD_SAV_UserArgs_MT32x32x32_MI16x16x1_SN_LDSB0_AFC1_AFEM1_AFEM1_ASEM1_CLR1_CADS0_DTLA0_DTLB0_DTVA0_DTVB0_EPS0_FDSI0_GRPM1_GRVWA1_GRVWB1_GSU1_GSUAMB_GSUC0_GSUWGMRR0_GLS0_ISA1201_IU1_K1_LBSPPA512_LBSPPB512_LBSPPM0_LPA16_LPB16_LPM0_LRVW8_LWPMn1_MIAV1_MIWT1_1_MO40_NTn1_NTA0_NTB0_NTC0_NTD0_NTM0_NEPBS0_NLCA1_NLCB1_ONLL0_PGR2_PLR1_PKA0_SIA3_SS0_SU32_SUM1_SUS256_SPO0_SRVW0_SSO0_SVW8_SK0_SKXCCM0_TLDS0_ULSGRO1_USL1_UIOFGRO0_USFGROn1_VSn1_VWA1_VWB1_WSGRA0_WSGRB0_WS32_WG32_4_1_WGM8_WGMXCC1_WGMXCCGn1
    SolutionIndex: 120
    SolutionNameMin: Cijk_Ailk_Bjlk_HSS_BH_Bias_SHB_HA_S_SAB_SCD_SAV_UserArgs_MT32x32x32_MI16x16x1_SN_LDSB0_AFC1_AFEM1_AFEM1_ASEM1_CLR1_CADS0_DTLA0_DTLB0_DTVA0_DTVB0_EPS0_FDSI0_GRPM1_GRVWA1_GRVWB4_GSU1_GSUAMB_GSUC0_GSUWGMRR0_GLS0_ISA1201_IU1_K1_LBSPPA512_LBSPPB512_LBSPPM0_LPA16_LPB16_LPM0_LRVW8_LWPMn1_MIAV1_MIWT1_1_MO40_NTn1_NTA0_NTB0_NTC0_NTD0_NTM0_NEPBS0_NLCA1_NLCB1_ONLL0_PGR2_PLR1_PKA0_SIA3_SS0_SU32_SUM1_SUS256_SPO0_SRVW0_SSO0_SVW8_SK0_SKXCCM0_TLDS0_ULSGRO1_USL1_UIOFGRO0_USFGROn1_VSn1_VWA1_VWB1_WSGRA0_WSGRB0_WS32_WG32_4_1_WGM8_WGMXCC1_WGMXCCGn1
    SolutionIndex: 121
    SolutionNameMin: Cijk_Ailk_Bjlk_HSS_BH_Bias_SHB_HA_S_SAB_SCD_SAV_UserArgs_MT32x32x64_MI16x16x1_SN_LDSB0_AFC1_AFEM1_AFEM1_ASEM1_CLR1_CADS0_DTLA0_DTLB0_DTVA0_DTVB0_EPS1_FDSI0_GRPM1_GRVWA1_GRVWB1_GSU1_GSUAMB_GSUC0_GSUWGMRR0_GLS0_ISA1201_IU1_K1_LBSPPA512_LBSPPB512_LBSPPM0_LPA16_LPB16_LPM0_LRVW8_LWPMn1_MIAV1_MIWT1_1_MO40_NTn1_NTA0_NTB0_NTC0_NTD0_NTM0_NEPBS0_NLCA1_NLCB1_ONLL0_PGR1_PLR1_PKA0_SIA3_SS0_SU32_SUM1_SUS256_SPO0_SRVW0_SSO0_SVW8_SK0_SKXCCM0_TLDS0_ULSGRO0_USL1_UIOFGRO0_USFGROn1_VSn1_VWA1_VWB1_WSGRA0_WSGRB0_WS32_WG32_4_1_WGM8_WGMXCC1_WGMXCCGn1
    SolutionIndex: 122
    SolutionNameMin: Cijk_Ailk_Bjlk_HSS_BH_Bias_SHB_HA_S_SAB_SCD_SAV_UserArgs_MT16x32x32_MI16x16x1_SN_LDSB0_AFC1_AFEM1_AFEM1_ASEM1_CLR1_CADS0_DTLA0_DTLB0_DTVA0_DTVB0_EPS0_FDSI0_GRPM1_GRVWA1_GRVWB1_GSU1_GSUAMB_GSUC0_GSUWGMRR0_GLS0_ISA1201_IU1_K1_LBSPPA256_LBSPPB512_LBSPPM0_LPA16_LPB16_LPM0_LRVW8_LWPMn1_MIAV1_MIWT1_1_MO40_NTn1_NTA0_NTB0_NTC0_NTD0_NTM0_NEPBS0_NLCA1_NLCB1_ONLL0_PGR2_PLR1_PKA0_SIA3_SS0_SU32_SUM1_SUS256_SPO0_SRVW0_SSO0_SVW8_SK0_SKXCCM0_TLDS0_ULSGRO1_USL1_UIOFGRO0_USFGROn1_VSn1_VWA1_VWB1_WSGRA0_WSGRB0_WS32_WG16_4_1_WGM8_WGMXCC1_WGMXCCGn1
    SolutionIndex: 123
    SolutionNameMin: Cijk_Ailk_Bjlk_HSS_BH_Bias_SHB_HA_S_SAB_SCD_SAV_UserArgs_MT32x32x64_MI16x16x1_SN_LDSB0_AFC1_AFEM1_AFEM1_ASEM1_CLR1_CADS0_DTLA0_DTLB0_DTVA0_DTVB0_EPS0_FDSI0_GRPM1_GRVWA1_GRVWB1_GSU1_GSUAMB_GSUC0_GSUWGMRR0_GLS0_ISA1201_IU1_K1_LBSPPA512_LBSPPB512_LBSPPM0_LPA16_LPB16_LPM0_LRVW8_LWPMn1_MIAV1_MIWT1_1_MO40_NTn1_NTA0_NTB0_NTC0_NTD0_NTM0_NEPBS0_NLCA1_NLCB1_ONLL0_PGR2_PLR1_PKA0_SIA3_SS0_SU32_SUM1_SUS256_SPO0_SRVW0_SSO0_SVW8_SK0_SKXCCM0_TLDS0_ULSGRO0_USL1_UIOFGRO0_USFGROn1_VSn1_VWA1_VWB1_WSGRA0_WSGRB0_WS32_WG32_4_1_WGM8_WGMXCC1_WGMXCCGn1
    SolutionIndex: 124
    SolutionNameMin: Cijk_Ailk_Bjlk_HSS_BH_Bias_SHB_HA_S_SAB_SCD_SAV_UserArgs_MT32x32x64_MI16x16x1_SN_LDSB0_AFC1_AFEM1_AFEM1_ASEM1_CLR1_CADS0_DTLA0_DTLB0_DTVA0_DTVB0_EPS0_FDSI0_GRPM1_GRVWA1_GRVWB1_GSU1_GSUAMB_GSUC0_GSUWGMRR0_GLS0_ISA1201_IU1_K1_LBSPPA512_LBSPPB512_LBSPPM0_LPA16_LPB16_LPM0_LRVW8_LWPMn1_MIAV1_MIWT1_1_MO40_NTn1_NTA0_NTB0_NTC0_NTD0_NTM0_NEPBS0_NLCA1_NLCB1_ONLL0_PGR2_PLR1_PKA0_SIA3_SS0_SU32_SUM1_SUS256_SPO0_SRVW0_SSO0_SVW8_SK0_SKXCCM0_TLDS0_ULSGRO1_USL1_UIOFGRO0_USFGROn1_VSn1_VWA1_VWB1_WSGRA0_WSGRB0_WS32_WG32_4_1_WGM8_WGMXCC1_WGMXCCGn1
    SolutionIndex: 125
    SolutionNameMin: Cijk_Ailk_Bjlk_HSS_BH_Bias_SHB_HA_S_SAB_SCD_SAV_UserArgs_MT32x32x64_MI16x16x1_SN_LDSB0_AFC1_AFEM1_AFEM1_ASEM1_CLR1_CADS0_DTLA0_DTLB0_DTVA1_DTVB1_EPS0_FDSI0_GRPM1_GRVWA8_GRVWB8_GSU1_GSUAMB_GSUC0_GSUWGMRR0_GLS0_ISA1201_IU1_K1_LBSPPA0_LBSPPB0_LBSPPM0_LPA0_LPB0_LPM0_LRVW8_LWPMn1_MIAV1_MIWT1_1_MO40_NTn1_NTA0_NTB0_NTC0_NTD0_NTM0_NEPBS0_NLCA1_NLCB1_ONLL0_PGR1_PLR0_PKA0_SIA3_SS0_SU32_SUM1_SUS256_SPO0_SRVW0_SSO0_SVW8_SK0_SKXCCM0_TLDS0_ULSGRO0_USL1_UIOFGRO0_USFGROn1_VSn1_VWA1_VWB1_WSGRA0_WSGRB0_WS32_WG32_4_1_WGM8_WGMXCC1_WGMXCCGn1
    SolutionIndex: 126
    SolutionNameMin: Cijk_Ailk_Bjlk_HSS_BH_Bias_SHB_HA_S_SAB_SCD_SAV_UserArgs_MT32x16x32_MI16x16x1_SN_LDSB0_AFC1_AFEM1_AFEM1_ASEM1_CLR1_CADS0_DTLA0_DTLB0_DTVA1_DTVB0_EPS0_FDSI0_GRPM1_GRVWA8_GRVWB4_GSU1_GSUAMB_GSUC0_GSUWGMRR0_GLS0_ISA1201_IU1_K1_LBSPPA0_LBSPPB256_LBSPPM0_LPA0_LPB16_LPM0_LRVW8_LWPMn1_MIAV1_MIWT1_1_MO40_NTn1_NTA0_NTB0_NTC0_NTD0_NTM0_NEPBS0_NLCA1_NLCB1_ONLL0_PGR2_PLR1_PKA0_SIA3_SS0_SU32_SUM1_SUS256_SPO0_SRVW0_SSO0_SVW8_SK0_SKXCCM0_TLDS0_ULSGRO0_USL1_UIOFGRO0_USFGROn1_VSn1_VWA1_VWB1_WSGRA0_WSGRB0_WS32_WG32_2_1_WGM8_WGMXCC1_WGMXCCGn1
    SolutionIndex: 127
    SolutionNameMin: Cijk_Ailk_Bjlk_HSS_BH_Bias_SHB_HA_S_SAB_SCD_SAV_UserArgs_MT32x32x32_MI16x16x1_SN_LDSB0_AFC1_AFEM1_AFEM1_ASEM1_CLR1_CADS0_DTLA0_DTLB0_DTVA0_DTVB0_EPS0_FDSI0_GRPM1_GRVWA1_GRVWB1_GSU1_GSUAMB_GSUC0_GSUWGMRR0_GLS0_ISA1201_IU1_K1_LBSPPA512_LBSPPB512_LBSPPM0_LPA16_LPB16_LPM0_LRVW8_LWPMn1_MIAV1_MIWT1_1_MO40_NTn1_NTA0_NTB0_NTC0_NTD0_NTM0_NEPBS0_NLCA1_NLCB1_ONLL0_PGR2_PLR1_PKA0_SIA3_SS1_SU32_SUM1_SUS256_SPO0_SRVW0_SSO0_SVW1_SK0_SKXCCM0_TLDS0_ULSGRO0_USL1_UIOFGRO0_USFGROn1_VSn1_VWA1_VWB1_WSGRA0_WSGRB0_WS32_WG32_4_1_WGM8_WGMXCC1_WGMXCCGn1
    SolutionIndex: 128
    SolutionNameMin: Cijk_Ailk_Bjlk_HSS_BH_Bias_SHB_HA_S_SAB_SCD_SAV_UserArgs_MT16x32x64_MI16x16x1_SN_LDSB1_AFC1_AFEM1_AFEM1_ASEM1_CLR1_CADS0_DTLA0_DTLB0_DTVA0_DTVB0_EPS1_FDSI0_GRPM1_GRVWA4_GRVWB8_GSU1_GSUAMB_GSUC0_GSUWGMRR0_GLS0_ISA1201_IU4_K1_LBSPPA256_LBSPPB512_LBSPPM0_LPA16_LPB16_LPM0_LRVW8_LWPMn1_MIAV1_MIWT1_1_MO40_NTn1_NTA0_NTB0_NTC0_NTD0_NTM0_NEPBS0_NLCA1_NLCB1_ONLL0_PGR1_PLR1_PKA0_SIA2_SS0_SU32_SUM1_SUS256_SPO0_SRVW0_SSO0_SVW8_SK0_SKXCCM0_TLDS0_ULSGRO0_USL1_UIOFGRO0_USFGROn1_VSn1_VWA1_VWB1_WSGRA0_WSGRB0_WS32_WG16_4_1_WGM8_WGMXCC1_WGMXCCGn1
    SolutionIndex: 129
    SolutionNameMin: Cijk_Ailk_Bjlk_HSS_BH_Bias_SHB_HA_S_SAB_SCD_SAV_UserArgs_MT32x32x64_MI16x16x1_SN_LDSB1_AFC1_AFEM1_AFEM1_ASEM1_CLR1_CADS0_DTLA0_DTLB0_DTVA0_DTVB0_EPS0_FDSI0_GRPM1_GRVWA1_GRVWB1_GSU1_GSUAMB_GSUC0_GSUWGMRR0_GLS0_ISA1201_IU4_K1_LBSPPA512_LBSPPB512_LBSPPM0_LPA16_LPB16_LPM0_LRVW8_LWPMn1_MIAV1_MIWT1_1_MO40_NTn1_NTA0_NTB0_NTC0_NTD0_NTM0_NEPBS0_NLCA1_NLCB1_ONLL0_PGR2_PLR1_PKA0_SIA2_SS0_SU32_SUM1_SUS256_SPO0_SRVW0_SSO0_SVW8_SK0_SKXCCM0_TLDS0_ULSGRO1_USL1_UIOFGRO0_USFGROn1_VSn1_VWA1_VWB1_WSGRA0_WSGRB0_WS32_WG32_4_1_WGM8_WGMXCC1_WGMXCCGn1
    SolutionIndex: 130
    SolutionNameMin: Cijk_Ailk_Bjlk_HSS_BH_Bias_SHB_HA_S_SAB_SCD_SAV_UserArgs_MT16x32x32_MI16x16x1_SN_LDSB1_AFC1_AFEM1_AFEM1_ASEM1_CLR1_CADS0_DTLA0_DTLB0_DTVA0_DTVB0_EPS1_FDSI0_GRPM1_GRVWA1_GRVWB1_GSU1_GSUAMB_GSUC0_GSUWGMRR0_GLS0_ISA1201_IU2_K1_LBSPPA256_LBSPPB512_LBSPPM0_LPA16_LPB16_LPM0_LRVW8_LWPMn1_MIAV1_MIWT1_1_MO40_NTn1_NTA0_NTB0_NTC0_NTD0_NTM0_NEPBS0_NLCA1_NLCB1_ONLL0_PGR1_PLR1_PKA0_SIA2_SS0_SU32_SUM1_SUS256_SPO0_SRVW0_SSO0_SVW8_SK0_SKXCCM0_TLDS0_ULSGRO0_USL1_UIOFGRO0_USFGROn1_VSn1_VWA1_VWB1_WSGRA0_WSGRB0_WS32_WG16_4_1_WGM8_WGMXCC1_WGMXCCGn1
    SolutionIndex: 131
    SolutionNameMin: Cijk_Ailk_Bjlk_HSS_BH_Bias_SHB_HA_S_SAB_SCD_SAV_UserArgs_MT32x32x32_MI16x16x1_SN_LDSB1_AFC1_AFEM1_AFEM1_ASEM1_CLR1_CADS0_DTLA0_DTLB0_DTVA0_DTVB0_EPS0_FDSI0_GRPM1_GRVWA1_GRVWB1_GSU1_GSUAMB_GSUC0_GSUWGMRR0_GLS0_ISA1201_IU2_K1_LBSPPA512_LBSPPB512_LBSPPM0_LPA16_LPB16_LPM0_LRVW8_LWPMn1_MIAV1_MIWT1_1_MO40_NTn1_NTA0_NTB0_NTC0_NTD0_NTM0_NEPBS0_NLCA1_NLCB1_ONLL0_PGR2_PLR1_PKA0_SIA2_SS0_SU32_SUM1_SUS256_SPO0_SRVW0_SSO0_SVW8_SK0_SKXCCM0_TLDS0_ULSGRO0_USL1_UIOFGRO0_USFGROn1_VSn1_VWA1_VWB1_WSGRA0_WSGRB0_WS32_WG32_4_1_WGM8_WGMXCC1_WGMXCCGn1
    SolutionIndex: 132
    SolutionNameMin: Cijk_Ailk_Bjlk_HSS_BH_Bias_SHB_HA_S_SAB_SCD_SAV_UserArgs_MT32x32x32_MI16x16x1_SN_LDSB0_AFC1_AFEM1_AFEM1_ASEM1_CLR1_CADS0_DTLA0_DTLB0_DTVA0_DTVB0_EPS0_FDSI0_GRPM1_GRVWA1_GRVWB1_GSU1_GSUAMB_GSUC0_GSUWGMRR0_GLS0_ISA1201_IU1_K1_LBSPPA512_LBSPPB512_LBSPPM0_LPA16_LPB16_LPM0_LRVW8_LWPMn1_MIAV1_MIWT1_1_MO40_NTn1_NTA0_NTB0_NTC0_NTD0_NTM0_NEPBS0_NLCA1_NLCB1_ONLL0_PGR2_PLR1_PKA0_SIA3_SS1_SU32_SUM1_SUS256_SPO0_SRVW0_SSO0_SVW1_SK0_SKXCCM0_TLDS0_ULSGRO1_USL1_UIOFGRO0_USFGROn1_VSn1_VWA1_VWB1_WSGRA0_WSGRB0_WS32_WG32_4_1_WGM8_WGMXCC1_WGMXCCGn1
    SolutionIndex: 133
    SolutionNameMin: Cijk_Ailk_Bjlk_HSS_BH_Bias_SHB_HA_S_SAB_SCD_SAV_UserArgs_MT32x32x32_MI16x16x1_SN_LDSB1_AFC1_AFEM1_AFEM1_ASEM1_CLR1_CADS0_DTLA0_DTLB0_DTVA0_DTVB0_EPS1_FDSI0_GRPM1_GRVWA1_GRVWB1_GSU1_GSUAMB_GSUC0_GSUWGMRR0_GLS0_ISA1201_IU2_K1_LBSPPA512_LBSPPB512_LBSPPM0_LPA16_LPB16_LPM0_LRVW8_LWPMn1_MIAV1_MIWT1_1_MO40_NTn1_NTA0_NTB0_NTC0_NTD0_NTM0_NEPBS0_NLCA1_NLCB1_ONLL0_PGR1_PLR1_PKA0_SIA2_SS0_SU32_SUM1_SUS256_SPO0_SRVW0_SSO0_SVW8_SK0_SKXCCM0_TLDS0_ULSGRO0_USL1_UIOFGRO0_USFGROn1_VSn1_VWA1_VWB1_WSGRA0_WSGRB0_WS32_WG32_4_1_WGM8_WGMXCC1_WGMXCCGn1
    SolutionIndex: 134
    SolutionNameMin: Cijk_Ailk_Bjlk_HSS_BH_Bias_SHB_HA_S_SAB_SCD_SAV_UserArgs_MT32x32x32_MI16x16x1_SN_LDSB0_AFC1_AFEM1_AFEM1_ASEM1_CLR1_CADS0_DTLA0_DTLB0_DTVA0_DTVB0_EPS0_FDSI0_GRPM1_GRVWA1_GRVWB1_GSU1_GSUAMB_GSUC0_GSUWGMRR0_GLS0_ISA1201_IU1_K1_LBSPPA512_LBSPPB512_LBSPPM0_LPA16_LPB16_LPM0_LRVW8_LWPMn1_MIAV1_MIWT1_1_MO40_NTn1_NTA0_NTB0_NTC0_NTD0_NTM0_NEPBS0_NLCA1_NLCB1_ONLL0_PGR2_PLR1_PKA0_SIA3_SS0_SU32_SUM1_SUS256_SPO0_SRVW0_SSO0_SVW8_SK0_SKXCCM0_TLDS0_ULSGRO0_USL1_UIOFGRO0_USFGROn1_VSn1_VWA1_VWB1_WSGRA0_WSGRB0_WS32_WG32_4_1_WGM8_WGMXCC1_WGMXCCGn1
    SolutionIndex: 135
    SolutionNameMin: Cijk_Ailk_Bjlk_HSS_BH_Bias_SHB_HA_S_SAB_SCD_SAV_UserArgs_MT16x32x64_MI16x16x1_SN_LDSB0_AFC1_AFEM1_AFEM1_ASEM1_CLR1_CADS0_DTLA0_DTLB0_DTVA1_DTVB1_EPS0_FDSI0_GRPM1_GRVWA8_GRVWB8_GSU1_GSUAMB_GSUC0_GSUWGMRR0_GLS0_ISA1201_IU1_K1_LBSPPA0_LBSPPB0_LBSPPM0_LPA0_LPB0_LPM0_LRVW8_LWPMn1_MIAV1_MIWT1_1_MO40_NTn1_NTA0_NTB0_NTC0_NTD0_NTM0_NEPBS0_NLCA1_NLCB1_ONLL0_PGR1_PLR0_PKA0_SIA3_SS0_SU32_SUM1_SUS256_SPO0_SRVW0_SSO0_SVW8_SK0_SKXCCM0_TLDS0_ULSGRO0_USL1_UIOFGRO0_USFGROn1_VSn1_VWA1_VWB1_WSGRA0_WSGRB0_WS32_WG16_4_1_WGM8_WGMXCC1_WGMXCCGn1
    SolutionIndex: 136
    SolutionNameMin: Cijk_Ailk_Bjlk_HSS_BH_Bias_SHB_HA_S_SAB_SCD_SAV_UserArgs_MT128x32x32_MI16x16x1_SN_LDSB1_AFC1_AFEM1_AFEM1_ASEM1_CLR1_CADS0_DTLA0_DTLB0_DTVA0_DTVB0_EPS0_FDSI0_GRPM1_GRVWA8_GRVWB1_GSU1_GSUAMB_GSUC0_GSUWGMRR0_GLS0_ISA1201_IU2_K1_LBSPPA2048_LBSPPB512_LBSPPM0_LPA0_LPB16_LPM0_LRVW8_LWPMn1_MIAV1_MIWT4_1_MO40_NTn1_NTA0_NTB0_NTC0_NTD0_NTM0_NEPBS0_NLCA1_NLCB1_ONLL0_PGR2_PLR1_PKA0_SIA2_SS1_SU32_SUM1_SUS256_SPO0_SRVW0_SSO0_SVW4_SK0_SKXCCM0_TLDS0_ULSGRO1_USL1_UIOFGRO0_USFGROn1_VSn1_VWA4_VWB1_WSGRA0_WSGRB0_WS32_WG32_4_1_WGM8_WGMXCC1_WGMXCCGn1
    SolutionIndex: 137
    SolutionNameMin: Cijk_Ailk_Bjlk_HSS_BH_Bias_SHB_HA_S_SAB_SCD_SAV_UserArgs_MT64x64x64_MI16x16x1_SN_LDSB0_AFC1_AFEM1_AFEM1_ASEM1_CLR1_CADS0_DTLA0_DTLB0_DTVA1_DTVB1_EPS0_FDSI0_GRPM1_GRVWA8_GRVWB8_GSU1_GSUAMB_GSUC0_GSUWGMRR0_GLS0_ISA1201_IU1_K1_LBSPPA0_LBSPPB0_LBSPPM0_LPA0_LPB0_LPM0_LRVW8_LWPMn1_MIAV1_MIWT2_2_MO40_NTn1_NTA0_NTB0_NTC0_NTD0_NTM0_NEPBS0_NLCA4_NLCB4_ONLL0_PGR1_PLR0_PKA0_SIA3_SS0_SU32_SUM1_SUS256_SPO0_SRVW0_SSO0_SVW8_SK0_SKXCCM0_TLDS0_ULSGRO0_USL1_UIOFGRO0_USFGROn1_VSn1_VWA1_VWB1_WSGRA0_WSGRB0_WS32_WG32_4_1_WGM8_WGMXCC1_WGMXCCGn1
    SolutionIndex: 138
    SolutionNameMin: Cijk_Ailk_Bjlk_HSS_BH_Bias_SHB_HA_S_SAB_SCD_SAV_UserArgs_MT128x32x32_MI16x16x1_SN_LDSB1_AFC1_AFEM1_AFEM1_ASEM1_CLR1_CADS0_DTLA0_DTLB0_DTVA0_DTVB0_EPS1_FDSI0_GRPM1_GRVWA8_GRVWB4_GSU1_GSUAMB_GSUC0_GSUWGMRR0_GLS0_ISA1201_IU2_K1_LBSPPA2048_LBSPPB512_LBSPPM0_LPA0_LPB16_LPM0_LRVW8_LWPMn1_MIAV1_MIWT4_1_MO40_NTn1_NTA0_NTB0_NTC0_NTD0_NTM0_NEPBS0_NLCA1_NLCB1_ONLL0_PGR1_PLR1_PKA0_SIA2_SS1_SU32_SUM1_SUS256_SPO0_SRVW0_SSO0_SVW4_SK0_SKXCCM0_TLDS0_ULSGRO0_USL1_UIOFGRO0_USFGROn1_VSn1_VWA4_VWB1_WSGRA0_WSGRB0_WS32_WG32_4_1_WGM8_WGMXCC1_WGMXCCGn1
    SolutionIndex: 139
    SolutionNameMin: Cijk_Ailk_Bjlk_HSS_BH_Bias_SHB_HA_S_SAB_SCD_SAV_UserArgs_MT64x64x32_MI16x16x1_SN_LDSB1_AFC1_AFEM1_AFEM1_ASEM1_CLR1_CADS0_DTLA0_DTLB0_DTVA0_DTVB0_EPS0_FDSI0_GRPM1_GRVWA1_GRVWB1_GSU1_GSUAMB_GSUC0_GSUWGMRR0_GLS0_ISA1201_IU2_K1_LBSPPA1024_LBSPPB1024_LBSPPM0_LPA32_LPB32_LPM0_LRVW8_LWPMn1_MIAV1_MIWT2_2_MO40_NTn1_NTA0_NTB0_NTC0_NTD0_NTM0_NEPBS0_NLCA1_NLCB1_ONLL0_PGR2_PLR1_PKA0_SIA2_SS1_SU32_SUM1_SUS256_SPO0_SRVW0_SSO0_SVW2_SK0_SKXCCM0_TLDS0_ULSGRO1_USL1_UIOFGRO0_USFGROn1_VSn1_VWA2_VWB2_WSGRA0_WSGRB0_WS32_WG32_4_1_WGM8_WGMXCC1_WGMXCCGn1
    SolutionIndex: 140
    SolutionNameMin: Cijk_Ailk_Bjlk_HSS_BH_Bias_SHB_HA_S_SAB_SCD_SAV_UserArgs_MT128x32x32_MI16x16x1_SN_LDSB1_AFC1_AFEM1_AFEM1_ASEM1_CLR1_CADS0_DTLA0_DTLB0_DTVA0_DTVB0_EPS0_FDSI0_GRPM1_GRVWA4_GRVWB1_GSU1_GSUAMB_GSUC0_GSUWGMRR0_GLS0_ISA1201_IU2_K1_LBSPPA2048_LBSPPB512_LBSPPM0_LPA0_LPB16_LPM0_LRVW8_LWPMn1_MIAV1_MIWT4_1_MO40_NTn1_NTA0_NTB0_NTC0_NTD0_NTM0_NEPBS0_NLCA1_NLCB1_ONLL0_PGR2_PLR1_PKA0_SIA2_SS1_SU32_SUM1_SUS256_SPO0_SRVW0_SSO0_SVW4_SK0_SKXCCM0_TLDS0_ULSGRO0_USL1_UIOFGRO0_USFGROn1_VSn1_VWA4_VWB1_WSGRA0_WSGRB0_WS32_WG32_4_1_WGM8_WGMXCC1_WGMXCCGn1
    SolutionIndex: 141
    SolutionNameMin: Cijk_Ailk_Bjlk_HSS_BH_Bias_SHB_HA_S_SAB_SCD_SAV_UserArgs_MT32x32x64_MI16x16x1_SN_LDSB0_AFC1_AFEM1_AFEM1_ASEM1_CLR1_CADS0_DTLA0_DTLB0_DTVA0_DTVB0_EPS0_FDSI0_GRPM1_GRVWA1_GRVWB1_GSU1_GSUAMB_GSUC0_GSUWGMRR0_GLS0_ISA1201_IU1_K1_LBSPPA512_LBSPPB512_LBSPPM0_LPA16_LPB16_LPM0_LRVW8_LWPMn1_MIAV1_MIWT1_1_MO40_NTn1_NTA0_NTB0_NTC0_NTD0_NTM0_NEPBS0_NLCA1_NLCB1_ONLL0_PGR2_PLR1_PKA0_SIA3_SS1_SU32_SUM1_SUS256_SPO0_SRVW0_SSO0_SVW1_SK0_SKXCCM0_TLDS0_ULSGRO1_USL1_UIOFGRO0_USFGROn1_VSn1_VWA1_VWB1_WSGRA0_WSGRB0_WS32_WG32_4_1_WGM8_WGMXCC1_WGMXCCGn1
    SolutionIndex: 142
    SolutionNameMin: Cijk_Ailk_Bjlk_HSS_BH_Bias_SHB_HA_S_SAB_SCD_SAV_UserArgs_MT32x16x32_MI16x16x1_SN_LDSB1_AFC1_AFEM1_AFEM1_ASEM1_CLR1_CADS0_DTLA0_DTLB0_DTVA0_DTVB0_EPS1_FDSI0_GRPM1_GRVWA4_GRVWB4_GSU1_GSUAMB_GSUC0_GSUWGMRR0_GLS0_ISA1201_IU2_K1_LBSPPA512_LBSPPB256_LBSPPM0_LPA16_LPB16_LPM0_LRVW8_LWPMn1_MIAV1_MIWT1_1_MO40_NTn1_NTA0_NTB0_NTC0_NTD0_NTM0_NEPBS0_NLCA1_NLCB1_ONLL0_PGR1_PLR1_PKA0_SIA2_SS0_SU32_SUM1_SUS256_SPO0_SRVW0_SSO0_SVW8_SK0_SKXCCM0_TLDS0_ULSGRO0_USL1_UIOFGRO0_USFGROn1_VSn1_VWA1_VWB1_WSGRA0_WSGRB0_WS32_WG32_2_1_WGM8_WGMXCC1_WGMXCCGn1
    SolutionIndex: 143
    SolutionNameMin: Cijk_Ailk_Bjlk_HSS_BH_Bias_SHB_HA_S_SAB_SCD_SAV_UserArgs_MT32x16x32_MI16x16x1_SN_LDSB1_AFC1_AFEM1_AFEM1_ASEM1_CLR1_CADS0_DTLA0_DTLB0_DTVA0_DTVB0_EPS0_FDSI0_GRPM1_GRVWA1_GRVWB1_GSU1_GSUAMB_GSUC0_GSUWGMRR0_GLS0_ISA1201_IU2_K1_LBSPPA512_LBSPPB256_LBSPPM0_LPA16_LPB16_LPM0_LRVW8_LWPMn1_MIAV1_MIWT1_1_MO40_NTn1_NTA0_NTB0_NTC0_NTD0_NTM0_NEPBS0_NLCA1_NLCB1_ONLL0_PGR2_PLR1_PKA0_SIA2_SS0_SU32_SUM1_SUS256_SPO0_SRVW0_SSO0_SVW8_SK0_SKXCCM0_TLDS0_ULSGRO1_USL1_UIOFGRO0_USFGROn1_VSn1_VWA1_VWB1_WSGRA0_WSGRB0_WS32_WG32_2_1_WGM8_WGMXCC1_WGMXCCGn1
    SolutionIndex: 144
    SolutionNameMin: Cijk_Ailk_Bjlk_HSS_BH_Bias_SHB_HA_S_SAB_SCD_SAV_UserArgs_MT128x32x32_MI16x16x1_SN_LDSB1_AFC1_AFEM1_AFEM1_ASEM1_CLR1_CADS0_DTLA0_DTLB0_DTVA0_DTVB0_EPS0_FDSI0_GRPM1_GRVWA8_GRVWB4_GSU1_GSUAMB_GSUC0_GSUWGMRR0_GLS0_ISA1201_IU2_K1_LBSPPA2048_LBSPPB512_LBSPPM0_LPA0_LPB16_LPM0_LRVW8_LWPMn1_MIAV1_MIWT4_1_MO40_NTn1_NTA0_NTB0_NTC0_NTD0_NTM0_NEPBS0_NLCA1_NLCB1_ONLL0_PGR2_PLR1_PKA0_SIA2_SS1_SU32_SUM1_SUS256_SPO0_SRVW0_SSO0_SVW4_SK0_SKXCCM0_TLDS0_ULSGRO1_USL1_UIOFGRO0_USFGROn1_VSn1_VWA4_VWB1_WSGRA0_WSGRB0_WS32_WG32_4_1_WGM8_WGMXCC1_WGMXCCGn1
    SolutionIndex: 145
    SolutionNameMin: Cijk_Ailk_Bjlk_HSS_BH_Bias_SHB_HA_S_SAB_SCD_SAV_UserArgs_MT128x32x32_MI16x16x1_SN_LDSB1_AFC1_AFEM1_AFEM1_ASEM1_CLR1_CADS0_DTLA0_DTLB0_DTVA0_DTVB0_EPS1_FDSI0_GRPM1_GRVWA4_GRVWB4_GSU1_GSUAMB_GSUC0_GSUWGMRR0_GLS0_ISA1201_IU2_K1_LBSPPA2048_LBSPPB512_LBSPPM0_LPA0_LPB16_LPM0_LRVW8_LWPMn1_MIAV1_MIWT4_1_MO40_NTn1_NTA0_NTB0_NTC0_NTD0_NTM0_NEPBS0_NLCA1_NLCB1_ONLL0_PGR1_PLR1_PKA0_SIA2_SS1_SU32_SUM1_SUS256_SPO0_SRVW0_SSO0_SVW4_SK0_SKXCCM0_TLDS0_ULSGRO0_USL1_UIOFGRO0_USFGROn1_VSn1_VWA4_VWB1_WSGRA0_WSGRB0_WS32_WG32_4_1_WGM8_WGMXCC1_WGMXCCGn1
    SolutionIndex: 146
    SolutionNameMin: Cijk_Ailk_Bjlk_HSS_BH_Bias_SHB_HA_S_SAB_SCD_SAV_UserArgs_MT64x64x32_MI16x16x1_SN_LDSB0_AFC1_AFEM1_AFEM1_ASEM1_CLR1_CADS0_DTLA0_DTLB0_DTVA0_DTVB0_EPS0_FDSI0_GRPM1_GRVWA4_GRVWB8_GSU1_GSUAMB_GSUC0_GSUWGMRR0_GLS0_ISA1201_IU1_K1_LBSPPA1024_LBSPPB1024_LBSPPM0_LPA32_LPB32_LPM0_LRVW8_LWPMn1_MIAV1_MIWT2_2_MO40_NTn1_NTA0_NTB0_NTC0_NTD0_NTM0_NEPBS0_NLCA1_NLCB1_ONLL0_PGR2_PLR1_PKA0_SIA3_SS0_SU32_SUM1_SUS256_SPO0_SRVW0_SSO0_SVW8_SK0_SKXCCM0_TLDS0_ULSGRO1_USL1_UIOFGRO0_USFGROn1_VSn1_VWA2_VWB2_WSGRA0_WSGRB0_WS32_WG32_4_1_WGM8_WGMXCC1_WGMXCCGn1
    SolutionIndex: 147
    SolutionNameMin: Cijk_Ailk_Bjlk_HSS_BH_Bias_SHB_HA_S_SAB_SCD_SAV_UserArgs_MT128x32x32_MI16x16x1_SN_LDSB1_AFC1_AFEM1_AFEM1_ASEM1_CLR1_CADS0_DTLA0_DTLB0_DTVA0_DTVB0_EPS0_FDSI0_GRPM1_GRVWA8_GRVWB1_GSU1_GSUAMB_GSUC0_GSUWGMRR0_GLS0_ISA1201_IU2_K1_LBSPPA2048_LBSPPB512_LBSPPM0_LPA0_LPB16_LPM0_LRVW8_LWPMn1_MIAV1_MIWT4_1_MO40_NTn1_NTA0_NTB0_NTC0_NTD0_NTM0_NEPBS0_NLCA1_NLCB1_ONLL0_PGR2_PLR1_PKA0_SIA2_SS1_SU32_SUM1_SUS256_SPO0_SRVW0_SSO0_SVW4_SK0_SKXCCM0_TLDS0_ULSGRO0_USL1_UIOFGRO0_USFGROn1_VSn1_VWA4_VWB1_WSGRA0_WSGRB0_WS32_WG32_4_1_WGM8_WGMXCC1_WGMXCCGn1
    SolutionIndex: 148
    SolutionNameMin: Cijk_Ailk_Bjlk_HSS_BH_Bias_SHB_HA_S_SAB_SCD_SAV_UserArgs_MT64x64x32_MI16x16x1_SN_LDSB1_AFC1_AFEM1_AFEM1_ASEM1_CLR1_CADS0_DTLA0_DTLB0_DTVA0_DTVB0_EPS1_FDSI0_GRPM1_GRVWA4_GRVWB4_GSU1_GSUAMB_GSUC0_GSUWGMRR0_GLS0_ISA1201_IU2_K1_LBSPPA1024_LBSPPB1024_LBSPPM0_LPA32_LPB32_LPM0_LRVW8_LWPMn1_MIAV1_MIWT2_2_MO40_NTn1_NTA0_NTB0_NTC0_NTD0_NTM0_NEPBS0_NLCA1_NLCB1_ONLL0_PGR1_PLR1_PKA0_SIA2_SS1_SU32_SUM1_SUS256_SPO0_SRVW0_SSO0_SVW2_SK0_SKXCCM0_TLDS0_ULSGRO0_USL1_UIOFGRO0_USFGROn1_VSn1_VWA2_VWB2_WSGRA0_WSGRB0_WS32_WG32_4_1_WGM8_WGMXCC1_WGMXCCGn1
    SolutionIndex: 149
    SolutionNameMin: Cijk_Ailk_Bjlk_HSS_BH_Bias_SHB_HA_S_SAB_SCD_SAV_UserArgs_MT128x32x32_MI16x16x1_SN_LDSB0_AFC1_AFEM1_AFEM1_ASEM1_CLR1_CADS0_DTLA0_DTLB0_DTVA0_DTVB1_EPS0_FDSI0_GRPM1_GRVWA8_GRVWB8_GSU1_GSUAMB_GSUC0_GSUWGMRR0_GLS0_ISA1201_IU1_K1_LBSPPA2048_LBSPPB0_LBSPPM0_LPA0_LPB0_LPM0_LRVW8_LWPMn1_MIAV1_MIWT4_1_MO40_NTn1_NTA0_NTB0_NTC0_NTD0_NTM0_NEPBS0_NLCA1_NLCB1_ONLL0_PGR2_PLR1_PKA0_SIA3_SS1_SU32_SUM1_SUS256_SPO0_SRVW0_SSO0_SVW4_SK0_SKXCCM0_TLDS0_ULSGRO0_USL1_UIOFGRO0_USFGROn1_VSn1_VWA4_VWB1_WSGRA0_WSGRB0_WS32_WG32_4_1_WGM8_WGMXCC1_WGMXCCGn1
    SolutionIndex: 150
    SolutionNameMin: Cijk_Ailk_Bjlk_HSS_BH_Bias_SHB_HA_S_SAB_SCD_SAV_UserArgs_MT64x64x64_MI16x16x1_SN_LDSB0_AFC1_AFEM1_AFEM1_ASEM1_CLR1_CADS0_DTLA0_DTLB0_DTVA1_DTVB0_EPS0_FDSI0_GRPM1_GRVWA8_GRVWB4_GSU1_GSUAMB_GSUC0_GSUWGMRR0_GLS0_ISA1201_IU1_K1_LBSPPA0_LBSPPB1024_LBSPPM0_LPA0_LPB32_LPM0_LRVW8_LWPMn1_MIAV1_MIWT2_2_MO40_NTn1_NTA0_NTB0_NTC0_NTD0_NTM0_NEPBS0_NLCA4_NLCB1_ONLL0_PGR2_PLR1_PKA0_SIA3_SS0_SU32_SUM1_SUS256_SPO0_SRVW0_SSO0_SVW8_SK0_SKXCCM0_TLDS0_ULSGRO0_USL1_UIOFGRO0_USFGROn1_VSn1_VWA1_VWB2_WSGRA0_WSGRB0_WS32_WG32_4_1_WGM8_WGMXCC1_WGMXCCGn1
    SolutionIndex: 151
    SolutionNameMin: Cijk_Ailk_Bjlk_HSS_BH_Bias_SHB_HA_S_SAB_SCD_SAV_UserArgs_MT64x64x32_MI16x16x1_SN_LDSB1_AFC1_AFEM1_AFEM1_ASEM1_CLR1_CADS0_DTLA0_DTLB0_DTVA0_DTVB0_EPS0_FDSI0_GRPM1_GRVWA4_GRVWB8_GSU1_GSUAMB_GSUC0_GSUWGMRR0_GLS0_ISA1201_IU2_K1_LBSPPA1024_LBSPPB1024_LBSPPM0_LPA32_LPB32_LPM0_LRVW8_LWPMn1_MIAV1_MIWT2_2_MO40_NTn1_NTA0_NTB0_NTC0_NTD0_NTM0_NEPBS0_NLCA1_NLCB1_ONLL0_PGR2_PLR1_PKA0_SIA2_SS1_SU32_SUM1_SUS256_SPO0_SRVW0_SSO0_SVW2_SK0_SKXCCM0_TLDS0_ULSGRO0_USL1_UIOFGRO0_USFGROn1_VSn1_VWA2_VWB2_WSGRA0_WSGRB0_WS32_WG32_4_1_WGM8_WGMXCC1_WGMXCCGn1
    SolutionIndex: 152
    SolutionNameMin: Cijk_Ailk_Bjlk_HSS_BH_Bias_SHB_HA_S_SAB_SCD_SAV_UserArgs_MT128x32x16_MI16x16x1_SN_LDSB0_AFC1_AFEM1_AFEM1_ASEM1_CLR0_CADS0_DTLA0_DTLB0_DTVA0_DTVB0_EPS0_FDSI0_GRPM1_GRVWA8_GRVWB1_GSU1_GSUAMB_GSUC0_GSUWGMRR0_GLS0_ISA1201_IU1_K1_LBSPPA2048_LBSPPB512_LBSPPM0_LPA0_LPB16_LPM0_LRVW8_LWPMn1_MIAV1_MIWT4_1_MO40_NTn1_NTA0_NTB0_NTC0_NTD0_NTM0_NEPBS0_NLCA1_NLCB1_ONLL0_PGR2_PLR0_PKA0_SIA3_SS1_SU32_SUM1_SUS256_SPO0_SRVW0_SSO0_SVW4_SK0_SKXCCM0_TLDS0_ULSGRO1_USL1_UIOFGRO0_USFGROn1_VSn1_VWA4_VWB1_WSGRA0_WSGRB0_WS32_WG32_4_1_WGM8_WGMXCC1_WGMXCCGn1
    SolutionIndex: 153
    SolutionNameMin: Cijk_Ailk_Bjlk_HSS_BH_Bias_SHB_HA_S_SAB_SCD_SAV_UserArgs_MT16x32x64_MI16x16x1_SN_LDSB0_AFC1_AFEM1_AFEM1_ASEM1_CLR1_CADS0_DTLA0_DTLB0_DTVA0_DTVB0_EPS0_FDSI0_GRPM1_GRVWA4_GRVWB8_GSU1_GSUAMB_GSUC0_GSUWGMRR0_GLS0_ISA1201_IU1_K1_LBSPPA256_LBSPPB512_LBSPPM0_LPA16_LPB16_LPM0_LRVW8_LWPMn1_MIAV1_MIWT1_1_MO40_NTn1_NTA0_NTB0_NTC0_NTD0_NTM0_NEPBS0_NLCA1_NLCB1_ONLL0_PGR2_PLR1_PKA0_SIA3_SS0_SU32_SUM1_SUS256_SPO0_SRVW0_SSO0_SVW8_SK0_SKXCCM0_TLDS0_ULSGRO0_USL1_UIOFGRO0_USFGROn1_VSn1_VWA1_VWB1_WSGRA0_WSGRB0_WS32_WG16_4_1_WGM8_WGMXCC1_WGMXCCGn1
    SolutionIndex: 154
    SolutionNameMin: Cijk_Ailk_Bjlk_HSS_BH_Bias_SHB_HA_S_SAB_SCD_SAV_UserArgs_MT16x32x32_MI16x16x1_SN_LDSB1_AFC1_AFEM1_AFEM1_ASEM1_CLR1_CADS0_DTLA0_DTLB0_DTVA0_DTVB0_EPS0_FDSI0_GRPM1_GRVWA1_GRVWB1_GSU1_GSUAMB_GSUC0_GSUWGMRR0_GLS0_ISA1201_IU2_K1_LBSPPA256_LBSPPB512_LBSPPM0_LPA16_LPB16_LPM0_LRVW8_LWPMn1_MIAV1_MIWT1_1_MO40_NTn1_NTA0_NTB0_NTC0_NTD0_NTM0_NEPBS0_NLCA1_NLCB1_ONLL0_PGR2_PLR1_PKA0_SIA2_SS0_SU32_SUM1_SUS256_SPO0_SRVW0_SSO0_SVW8_SK0_SKXCCM0_TLDS0_ULSGRO1_USL1_UIOFGRO0_USFGROn1_VSn1_VWA1_VWB1_WSGRA0_WSGRB0_WS32_WG16_4_1_WGM8_WGMXCC1_WGMXCCGn1
    SolutionIndex: 155
    SolutionNameMin: Cijk_Ailk_Bjlk_HSS_BH_Bias_SHB_HA_S_SAB_SCD_SAV_UserArgs_MT128x32x64_MI16x16x1_SN_LDSB1_AFC1_AFEM1_AFEM1_ASEM1_CLR1_CADS0_DTLA0_DTLB0_DTVA0_DTVB0_EPS0_FDSI0_GRPM1_GRVWA8_GRVWB8_GSU1_GSUAMB_GSUC0_GSUWGMRR0_GLS0_ISA1201_IU4_K1_LBSPPA2048_LBSPPB512_LBSPPM0_LPA0_LPB16_LPM0_LRVW8_LWPMn1_MIAV1_MIWT4_1_MO40_NTn1_NTA0_NTB0_NTC0_NTD0_NTM0_NEPBS0_NLCA1_NLCB1_ONLL0_PGR2_PLR1_PKA0_SIA2_SS1_SU32_SUM1_SUS256_SPO0_SRVW0_SSO0_SVW4_SK0_SKXCCM0_TLDS0_ULSGRO0_USL1_UIOFGRO0_USFGROn1_VSn1_VWA4_VWB1_WSGRA0_WSGRB0_WS32_WG32_4_1_WGM8_WGMXCC1_WGMXCCGn1
    SolutionIndex: 156
    SolutionNameMin: Cijk_Ailk_Bjlk_HSS_BH_Bias_SHB_HA_S_SAB_SCD_SAV_UserArgs_MT32x128x32_MI16x16x1_SN_LDSB1_AFC1_AFEM1_AFEM1_ASEM1_CLR1_CADS0_DTLA0_DTLB0_DTVA0_DTVB0_EPS0_FDSI0_GRPM1_GRVWA4_GRVWB8_GSU1_GSUAMB_GSUC0_GSUWGMRR0_GLS0_ISA1201_IU2_K1_LBSPPA512_LBSPPB2048_LBSPPM0_LPA16_LPB0_LPM0_LRVW8_LWPMn1_MIAV1_MIWT1_4_MO40_NTn1_NTA0_NTB0_NTC0_NTD0_NTM0_NEPBS0_NLCA1_NLCB1_ONLL0_PGR2_PLR1_PKA0_SIA2_SS0_SU32_SUM1_SUS256_SPO0_SRVW0_SSO0_SVW8_SK0_SKXCCM0_TLDS0_ULSGRO0_USL1_UIOFGRO0_USFGROn1_VSn1_VWA1_VWB4_WSGRA0_WSGRB0_WS32_WG32_4_1_WGM8_WGMXCC1_WGMXCCGn1
    SolutionIndex: 157
    SolutionNameMin: Cijk_Ailk_Bjlk_HSS_BH_Bias_SHB_HA_S_SAB_SCD_SAV_UserArgs_MT64x64x64_MI16x16x1_SN_LDSB0_AFC1_AFEM1_AFEM1_ASEM1_CLR1_CADS0_DTLA0_DTLB0_DTVA1_DTVB0_EPS0_FDSI0_GRPM1_GRVWA8_GRVWB8_GSU1_GSUAMB_GSUC0_GSUWGMRR0_GLS0_ISA1201_IU1_K1_LBSPPA0_LBSPPB1024_LBSPPM0_LPA0_LPB32_LPM0_LRVW8_LWPMn1_MIAV1_MIWT2_2_MO40_NTn1_NTA0_NTB0_NTC0_NTD0_NTM0_NEPBS0_NLCA4_NLCB1_ONLL0_PGR2_PLR1_PKA0_SIA3_SS0_SU32_SUM1_SUS256_SPO0_SRVW0_SSO0_SVW8_SK0_SKXCCM0_TLDS0_ULSGRO0_USL1_UIOFGRO0_USFGROn1_VSn1_VWA1_VWB2_WSGRA0_WSGRB0_WS32_WG32_4_1_WGM8_WGMXCC1_WGMXCCGn1
    SolutionIndex: 158
    SolutionNameMin: Cijk_Ailk_Bjlk_HSS_BH_Bias_SHB_HA_S_SAB_SCD_SAV_UserArgs_MT128x32x32_MI16x16x1_SN_LDSB0_AFC1_AFEM1_AFEM1_ASEM1_CLR1_CADS0_DTLA0_DTLB0_DTVA1_DTVB0_EPS1_FDSI0_GRPM1_GRVWA8_GRVWB8_GSU1_GSUAMB_GSUC0_GSUWGMRR0_GLS0_ISA1201_IU1_K1_LBSPPA0_LBSPPB512_LBSPPM0_LPA0_LPB16_LPM0_LRVW8_LWPMn1_MIAV1_MIWT4_1_MO40_NTn1_NTA0_NTB0_NTC0_NTD0_NTM0_NEPBS0_NLCA2_NLCB1_ONLL0_PGR1_PLR1_PKA0_SIA3_SS0_SU32_SUM1_SUS256_SPO0_SRVW0_SSO0_SVW8_SK0_SKXCCM0_TLDS0_ULSGRO0_USL1_UIOFGRO0_USFGROn1_VSn1_VWA1_VWB1_WSGRA0_WSGRB0_WS32_WG32_4_1_WGM8_WGMXCC1_WGMXCCGn1
    SolutionIndex: 159
    SolutionNameMin: Cijk_Ailk_Bjlk_HSS_BH_Bias_SHB_HA_S_SAB_SCD_SAV_UserArgs_MT64x64x32_MI16x16x1_SN_LDSB1_AFC1_AFEM1_AFEM1_ASEM1_CLR1_CADS0_DTLA0_DTLB0_DTVA0_DTVB0_EPS1_FDSI0_GRPM1_GRVWA1_GRVWB1_GSU1_GSUAMB_GSUC0_GSUWGMRR0_GLS0_ISA1201_IU2_K1_LBSPPA1024_LBSPPB1024_LBSPPM0_LPA32_LPB32_LPM0_LRVW8_LWPMn1_MIAV1_MIWT2_2_MO40_NTn1_NTA0_NTB0_NTC0_NTD0_NTM0_NEPBS0_NLCA1_NLCB1_ONLL0_PGR1_PLR1_PKA0_SIA2_SS1_SU32_SUM1_SUS256_SPO0_SRVW0_SSO0_SVW2_SK0_SKXCCM0_TLDS0_ULSGRO0_USL1_UIOFGRO0_USFGROn1_VSn1_VWA2_VWB2_WSGRA0_WSGRB0_WS32_WG32_4_1_WGM8_WGMXCC1_WGMXCCGn1
    SolutionIndex: 160
    SolutionNameMin: Cijk_Ailk_Bjlk_HSS_BH_Bias_SHB_HA_S_SAB_SCD_SAV_UserArgs_MT64x64x32_MI16x16x1_SN_LDSB1_AFC1_AFEM1_AFEM1_ASEM1_CLR1_CADS0_DTLA0_DTLB0_DTVA0_DTVB0_EPS0_FDSI0_GRPM1_GRVWA4_GRVWB4_GSU1_GSUAMB_GSUC0_GSUWGMRR0_GLS0_ISA1201_IU2_K1_LBSPPA1024_LBSPPB1024_LBSPPM0_LPA32_LPB32_LPM0_LRVW8_LWPMn1_MIAV1_MIWT2_2_MO40_NTn1_NTA0_NTB0_NTC0_NTD0_NTM0_NEPBS0_NLCA1_NLCB1_ONLL0_PGR2_PLR1_PKA0_SIA2_SS1_SU32_SUM1_SUS256_SPO0_SRVW0_SSO0_SVW2_SK0_SKXCCM0_TLDS0_ULSGRO1_USL1_UIOFGRO0_USFGROn1_VSn1_VWA2_VWB2_WSGRA0_WSGRB0_WS32_WG32_4_1_WGM8_WGMXCC1_WGMXCCGn1
    SolutionIndex: 161
    SolutionNameMin: Cijk_Ailk_Bjlk_HSS_BH_Bias_SHB_HA_S_SAB_SCD_SAV_UserArgs_MT128x32x16_MI16x16x1_SN_LDSB1_AFC1_AFEM1_AFEM1_ASEM1_CLR1_CADS0_DTLA0_DTLB0_DTVA0_DTVB0_EPS1_FDSI0_GRPM1_GRVWA8_GRVWB1_GSU1_GSUAMB_GSUC0_GSUWGMRR0_GLS0_ISA1201_IU1_K1_LBSPPA2048_LBSPPB512_LBSPPM0_LPA0_LPB16_LPM0_LRVW8_LWPMn1_MIAV1_MIWT4_1_MO40_NTn1_NTA0_NTB0_NTC0_NTD0_NTM0_NEPBS0_NLCA1_NLCB1_ONLL0_PGR1_PLR1_PKA0_SIA2_SS1_SU32_SUM1_SUS256_SPO0_SRVW0_SSO0_SVW4_SK0_SKXCCM0_TLDS0_ULSGRO0_USL1_UIOFGRO0_USFGROn1_VSn1_VWA4_VWB1_WSGRA0_WSGRB0_WS32_WG32_4_1_WGM8_WGMXCC1_WGMXCCGn1
    SolutionIndex: 162
    SolutionNameMin: Cijk_Ailk_Bjlk_HSS_BH_Bias_SHB_HA_S_SAB_SCD_SAV_UserArgs_MT16x32x16_MI16x16x1_SN_LDSB0_AFC1_AFEM1_AFEM1_ASEM1_CLR0_CADS0_DTLA0_DTLB0_DTVA0_DTVB0_EPS0_FDSI0_GRPM1_GRVWA1_GRVWB8_GSU1_GSUAMB_GSUC0_GSUWGMRR0_GLS0_ISA1201_IU1_K1_LBSPPA256_LBSPPB512_LBSPPM0_LPA16_LPB16_LPM0_LRVW8_LWPMn1_MIAV1_MIWT1_1_MO40_NTn1_NTA0_NTB0_NTC0_NTD0_NTM0_NEPBS0_NLCA1_NLCB1_ONLL0_PGR2_PLR0_PKA0_SIA3_SS0_SU32_SUM1_SUS256_SPO0_SRVW0_SSO0_SVW8_SK0_SKXCCM0_TLDS0_ULSGRO1_USL1_UIOFGRO0_USFGROn1_VSn1_VWA1_VWB1_WSGRA0_WSGRB0_WS32_WG16_4_1_WGM8_WGMXCC1_WGMXCCGn1
    SolutionIndex: 163
    SolutionNameMin: Cijk_Ailk_Bjlk_HSS_BH_Bias_SHB_HA_S_SAB_SCD_SAV_UserArgs_MT32x32x64_MI16x16x1_SN_LDSB0_AFC1_AFEM1_AFEM1_ASEM1_CLR1_CADS0_DTLA0_DTLB0_DTVA0_DTVB1_EPS1_FDSI0_GRPM1_GRVWA4_GRVWB8_GSU1_GSUAMB_GSUC0_GSUWGMRR0_GLS0_ISA1201_IU1_K1_LBSPPA512_LBSPPB0_LBSPPM0_LPA16_LPB0_LPM0_LRVW8_LWPMn1_MIAV1_MIWT1_1_MO40_NTn1_NTA0_NTB0_NTC0_NTD0_NTM0_NEPBS0_NLCA1_NLCB1_ONLL0_PGR1_PLR1_PKA0_SIA3_SS0_SU32_SUM1_SUS256_SPO0_SRVW0_SSO0_SVW8_SK0_SKXCCM0_TLDS0_ULSGRO0_USL1_UIOFGRO0_USFGROn1_VSn1_VWA1_VWB1_WSGRA0_WSGRB0_WS32_WG32_4_1_WGM8_WGMXCC1_WGMXCCGn1
    SolutionIndex: 164
    SolutionNameMin: Cijk_Ailk_Bjlk_HSS_BH_Bias_SHB_HA_S_SAB_SCD_SAV_UserArgs_MT64x64x64_MI16x16x1_SN_LDSB1_AFC1_AFEM1_AFEM1_ASEM1_CLR1_CADS0_DTLA0_DTLB0_DTVA0_DTVB0_EPS1_FDSI0_GRPM1_GRVWA8_GRVWB4_GSU1_GSUAMB_GSUC0_GSUWGMRR0_GLS0_ISA1201_IU4_K1_LBSPPA1024_LBSPPB1024_LBSPPM0_LPA32_LPB32_LPM0_LRVW8_LWPMn1_MIAV1_MIWT2_2_MO40_NTn1_NTA0_NTB0_NTC0_NTD0_NTM0_NEPBS0_NLCA1_NLCB1_ONLL0_PGR1_PLR1_PKA0_SIA2_SS1_SU32_SUM1_SUS256_SPO0_SRVW0_SSO0_SVW2_SK0_SKXCCM0_TLDS0_ULSGRO0_USL1_UIOFGRO0_USFGROn1_VSn1_VWA2_VWB2_WSGRA0_WSGRB0_WS32_WG32_4_1_WGM8_WGMXCC1_WGMXCCGn1
    SolutionIndex: 165
    SolutionNameMin: Cijk_Ailk_Bjlk_HSS_BH_Bias_SHB_HA_S_SAB_SCD_SAV_UserArgs_MT64x64x64_MI16x16x1_SN_LDSB1_AFC1_AFEM1_AFEM1_ASEM1_CLR1_CADS0_DTLA0_DTLB0_DTVA0_DTVB0_EPS0_FDSI0_GRPM1_GRVWA4_GRVWB8_GSU1_GSUAMB_GSUC0_GSUWGMRR0_GLS0_ISA1201_IU4_K1_LBSPPA1024_LBSPPB1024_LBSPPM0_LPA32_LPB32_LPM0_LRVW8_LWPMn1_MIAV1_MIWT2_2_MO40_NTn1_NTA0_NTB0_NTC0_NTD0_NTM0_NEPBS0_NLCA1_NLCB1_ONLL0_PGR2_PLR1_PKA0_SIA2_SS1_SU32_SUM1_SUS256_SPO0_SRVW0_SSO0_SVW2_SK0_SKXCCM0_TLDS0_ULSGRO1_USL1_UIOFGRO0_USFGROn1_VSn1_VWA2_VWB2_WSGRA0_WSGRB0_WS32_WG32_4_1_WGM8_WGMXCC1_WGMXCCGn1
    SolutionIndex: 166
    SolutionNameMin: Cijk_Ailk_Bjlk_HSS_BH_Bias_SHB_HA_S_SAB_SCD_SAV_UserArgs_MT64x64x64_MI16x16x1_SN_LDSB1_AFC1_AFEM1_AFEM1_ASEM1_CLR1_CADS0_DTLA0_DTLB0_DTVA0_DTVB0_EPS1_FDSI0_GRPM1_GRVWA8_GRVWB8_GSU1_GSUAMB_GSUC0_GSUWGMRR0_GLS0_ISA1201_IU4_K1_LBSPPA1024_LBSPPB1024_LBSPPM0_LPA32_LPB32_LPM0_LRVW8_LWPMn1_MIAV1_MIWT2_2_MO40_NTn1_NTA0_NTB0_NTC0_NTD0_NTM0_NEPBS0_NLCA1_NLCB1_ONLL0_PGR1_PLR1_PKA0_SIA2_SS1_SU32_SUM1_SUS256_SPO0_SRVW0_SSO0_SVW2_SK0_SKXCCM0_TLDS0_ULSGRO0_USL1_UIOFGRO0_USFGROn1_VSn1_VWA2_VWB2_WSGRA0_WSGRB0_WS32_WG32_4_1_WGM8_WGMXCC1_WGMXCCGn1
    SolutionIndex: 167
    SolutionNameMin: Cijk_Ailk_Bjlk_HSS_BH_Bias_SHB_HA_S_SAB_SCD_SAV_UserArgs_MT128x32x32_MI16x16x1_SN_LDSB0_AFC1_AFEM1_AFEM1_ASEM1_CLR1_CADS0_DTLA0_DTLB0_DTVA0_DTVB0_EPS0_FDSI0_GRPM1_GRVWA8_GRVWB4_GSU1_GSUAMB_GSUC0_GSUWGMRR0_GLS0_ISA1201_IU1_K1_LBSPPA2048_LBSPPB512_LBSPPM0_LPA0_LPB16_LPM0_LRVW8_LWPMn1_MIAV1_MIWT4_1_MO40_NTn1_NTA0_NTB0_NTC0_NTD0_NTM0_NEPBS0_NLCA1_NLCB1_ONLL0_PGR2_PLR1_PKA0_SIA3_SS1_SU32_SUM1_SUS256_SPO0_SRVW0_SSO0_SVW4_SK0_SKXCCM0_TLDS0_ULSGRO1_USL1_UIOFGRO0_USFGROn1_VSn1_VWA4_VWB1_WSGRA0_WSGRB0_WS32_WG32_4_1_WGM8_WGMXCC1_WGMXCCGn1
    SolutionIndex: 168
    SolutionNameMin: Cijk_Ailk_Bjlk_HSS_BH_Bias_SHB_HA_S_SAB_SCD_SAV_UserArgs_MT64x64x16_MI16x16x1_SN_LDSB0_AFC1_AFEM1_AFEM1_ASEM1_CLR0_CADS0_DTLA0_DTLB0_DTVA0_DTVB0_EPS0_FDSI0_GRPM1_GRVWA1_GRVWB1_GSU1_GSUAMB_GSUC0_GSUWGMRR0_GLS0_ISA1201_IU1_K1_LBSPPA1024_LBSPPB1024_LBSPPM0_LPA32_LPB32_LPM0_LRVW8_LWPMn1_MIAV1_MIWT2_2_MO40_NTn1_NTA0_NTB0_NTC0_NTD0_NTM0_NEPBS0_NLCA1_NLCB1_ONLL0_PGR2_PLR0_PKA0_SIA3_SS1_SU32_SUM1_SUS256_SPO0_SRVW0_SSO0_SVW2_SK0_SKXCCM0_TLDS0_ULSGRO1_USL1_UIOFGRO0_USFGROn1_VSn1_VWA2_VWB2_WSGRA0_WSGRB0_WS32_WG32_4_1_WGM8_WGMXCC1_WGMXCCGn1
    SolutionIndex: 169
    SolutionNameMin: Cijk_Ailk_Bjlk_HSS_BH_Bias_SHB_HA_S_SAB_SCD_SAV_UserArgs_MT128x32x32_MI16x16x1_SN_LDSB1_AFC1_AFEM1_AFEM1_ASEM1_CLR1_CADS0_DTLA0_DTLB0_DTVA0_DTVB0_EPS0_FDSI0_GRPM1_GRVWA8_GRVWB8_GSU1_GSUAMB_GSUC0_GSUWGMRR0_GLS0_ISA1201_IU2_K1_LBSPPA2048_LBSPPB512_LBSPPM0_LPA0_LPB16_LPM0_LRVW8_LWPMn1_MIAV1_MIWT4_1_MO40_NTn1_NTA0_NTB0_NTC0_NTD0_NTM0_NEPBS0_NLCA1_NLCB1_ONLL0_PGR2_PLR1_PKA0_SIA2_SS1_SU32_SUM1_SUS256_SPO0_SRVW0_SSO0_SVW4_SK0_SKXCCM0_TLDS0_ULSGRO0_USL1_UIOFGRO0_USFGROn1_VSn1_VWA4_VWB1_WSGRA0_WSGRB0_WS32_WG32_4_1_WGM8_WGMXCC1_WGMXCCGn1
    SolutionIndex: 170
    SolutionNameMin: Cijk_Ailk_Bjlk_HSS_BH_Bias_SHB_HA_S_SAB_SCD_SAV_UserArgs_MT64x64x16_MI16x16x1_SN_LDSB1_AFC1_AFEM1_AFEM1_ASEM1_CLR1_CADS0_DTLA0_DTLB0_DTVA0_DTVB0_EPS1_FDSI0_GRPM1_GRVWA4_GRVWB4_GSU1_GSUAMB_GSUC0_GSUWGMRR0_GLS0_ISA1201_IU1_K1_LBSPPA1024_LBSPPB1024_LBSPPM0_LPA32_LPB32_LPM0_LRVW8_LWPMn1_MIAV1_MIWT2_2_MO40_NTn1_NTA0_NTB0_NTC0_NTD0_NTM0_NEPBS0_NLCA1_NLCB1_ONLL0_PGR1_PLR1_PKA0_SIA2_SS1_SU32_SUM1_SUS256_SPO0_SRVW0_SSO0_SVW2_SK0_SKXCCM0_TLDS0_ULSGRO0_USL1_UIOFGRO0_USFGROn1_VSn1_VWA2_VWB2_WSGRA0_WSGRB0_WS32_WG32_4_1_WGM8_WGMXCC1_WGMXCCGn1
    SolutionIndex: 171
    SolutionNameMin: Cijk_Ailk_Bjlk_HSS_BH_Bias_SHB_HA_S_SAB_SCD_SAV_UserArgs_MT64x64x16_MI16x16x1_SN_LDSB1_AFC1_AFEM1_AFEM1_ASEM1_CLR1_CADS0_DTLA0_DTLB0_DTVA0_DTVB0_EPS0_FDSI0_GRPM1_GRVWA4_GRVWB8_GSU1_GSUAMB_GSUC0_GSUWGMRR0_GLS0_ISA1201_IU1_K1_LBSPPA1024_LBSPPB1024_LBSPPM0_LPA32_LPB32_LPM0_LRVW8_LWPMn1_MIAV1_MIWT2_2_MO40_NTn1_NTA0_NTB0_NTC0_NTD0_NTM0_NEPBS0_NLCA1_NLCB1_ONLL0_PGR2_PLR1_PKA0_SIA2_SS1_SU32_SUM1_SUS256_SPO0_SRVW0_SSO0_SVW2_SK0_SKXCCM0_TLDS0_ULSGRO1_USL1_UIOFGRO0_USFGROn1_VSn1_VWA2_VWB2_WSGRA0_WSGRB0_WS32_WG32_4_1_WGM8_WGMXCC1_WGMXCCGn1
    SolutionIndex: 172
    SolutionNameMin: Cijk_Ailk_Bjlk_HSS_BH_Bias_SHB_HA_S_SAB_SCD_SAV_UserArgs_MT16x16x32_MI16x16x1_SN_LDSB1_AFC1_AFEM1_AFEM1_ASEM1_CLR1_CADS0_DTLA0_DTLB0_DTVA0_DTVB0_EPS1_FDSI0_GRPM1_GRVWA1_GRVWB1_GSU1_GSUAMB_GSUC0_GSUWGMRR0_GLS0_ISA1201_IU2_K1_LBSPPA256_LBSPPB256_LBSPPM0_LPA16_LPB16_LPM0_LRVW8_LWPMn1_MIAV1_MIWT1_1_MO40_NTn1_NTA0_NTB0_NTC0_NTD0_NTM0_NEPBS0_NLCA1_NLCB1_ONLL0_PGR1_PLR1_PKA0_SIA2_SS0_SU32_SUM1_SUS256_SPO0_SRVW0_SSO0_SVW8_SK0_SKXCCM0_TLDS0_ULSGRO0_USL1_UIOFGRO0_USFGROn1_VSn1_VWA1_VWB1_WSGRA0_WSGRB0_WS32_WG16_2_1_WGM8_WGMXCC1_WGMXCCGn1
    SolutionIndex: 176
    SolutionNameMin: Cijk_Ailk_Bjlk_HSS_BH_Bias_SHB_HA_S_SAB_SCD_SAV_UserArgs_MT64x64x64_MI16x16x1_SN_LDSB0_AFC1_AFEM1_AFEM1_ASEM1_CLR1_CADS0_DTLA0_DTLB0_DTVA1_DTVB0_EPS1_FDSI0_GRPM1_GRVWA8_GRVWB8_GSU1_GSUAMB_GSUC0_GSUWGMRR0_GLS0_ISA1201_IU1_K1_LBSPPA0_LBSPPB1024_LBSPPM0_LPA0_LPB32_LPM0_LRVW8_LWPMn1_MIAV1_MIWT2_2_MO40_NTn1_NTA0_NTB0_NTC0_NTD0_NTM0_NEPBS0_NLCA4_NLCB1_ONLL0_PGR1_PLR1_PKA0_SIA3_SS0_SU32_SUM1_SUS256_SPO0_SRVW0_SSO0_SVW8_SK0_SKXCCM0_TLDS0_ULSGRO0_USL1_UIOFGRO0_USFGROn1_VSn1_VWA1_VWB2_WSGRA0_WSGRB0_WS32_WG32_4_1_WGM8_WGMXCC1_WGMXCCGn1
    SolutionIndex: 177
    SolutionNameMin: Cijk_Ailk_Bjlk_HSS_BH_Bias_SHB_HA_S_SAB_SCD_SAV_UserArgs_MT64x64x16_MI16x16x1_SN_LDSB1_AFC1_AFEM1_AFEM1_ASEM1_CLR1_CADS0_DTLA0_DTLB0_DTVA0_DTVB0_EPS1_FDSI0_GRPM1_GRVWA1_GRVWB1_GSU1_GSUAMB_GSUC0_GSUWGMRR0_GLS0_ISA1201_IU1_K1_LBSPPA1024_LBSPPB1024_LBSPPM0_LPA32_LPB32_LPM0_LRVW8_LWPMn1_MIAV1_MIWT2_2_MO40_NTn1_NTA0_NTB0_NTC0_NTD0_NTM0_NEPBS0_NLCA1_NLCB1_ONLL0_PGR1_PLR1_PKA0_SIA2_SS1_SU32_SUM1_SUS256_SPO0_SRVW0_SSO0_SVW2_SK0_SKXCCM0_TLDS0_ULSGRO0_USL1_UIOFGRO0_USFGROn1_VSn1_VWA2_VWB2_WSGRA0_WSGRB0_WS32_WG32_4_1_WGM8_WGMXCC1_WGMXCCGn1
    SolutionIndex: 178
    SolutionNameMin: Cijk_Ailk_Bjlk_HSS_BH_Bias_SHB_HA_S_SAB_SCD_SAV_UserArgs_MT64x64x16_MI16x16x1_SN_LDSB1_AFC1_AFEM1_AFEM1_ASEM1_CLR1_CADS0_DTLA0_DTLB0_DTVA0_DTVB0_EPS0_FDSI0_GRPM1_GRVWA4_GRVWB8_GSU1_GSUAMB_GSUC0_GSUWGMRR0_GLS0_ISA1201_IU1_K1_LBSPPA1024_LBSPPB1024_LBSPPM0_LPA32_LPB32_LPM0_LRVW8_LWPMn1_MIAV1_MIWT2_2_MO40_NTn1_NTA0_NTB0_NTC0_NTD0_NTM0_NEPBS0_NLCA1_NLCB1_ONLL0_PGR2_PLR1_PKA0_SIA2_SS1_SU32_SUM1_SUS256_SPO0_SRVW0_SSO0_SVW2_SK0_SKXCCM0_TLDS0_ULSGRO0_USL1_UIOFGRO0_USFGROn1_VSn1_VWA2_VWB2_WSGRA0_WSGRB0_WS32_WG32_4_1_WGM8_WGMXCC1_WGMXCCGn1
    SolutionIndex: 180
    SolutionNameMin: Cijk_Ailk_Bjlk_HSS_BH_Bias_SHB_HA_S_SAB_SCD_SAV_UserArgs_MT64x64x16_MI16x16x1_SN_LDSB1_AFC1_AFEM1_AFEM1_ASEM1_CLR1_CADS0_DTLA0_DTLB0_DTVA0_DTVB0_EPS0_FDSI0_GRPM1_GRVWA4_GRVWB4_GSU1_GSUAMB_GSUC0_GSUWGMRR0_GLS0_ISA1201_IU1_K1_LBSPPA1024_LBSPPB1024_LBSPPM0_LPA32_LPB32_LPM0_LRVW8_LWPMn1_MIAV1_MIWT2_2_MO40_NTn1_NTA0_NTB0_NTC0_NTD0_NTM0_NEPBS0_NLCA1_NLCB1_ONLL0_PGR2_PLR1_PKA0_SIA2_SS1_SU32_SUM1_SUS256_SPO0_SRVW0_SSO0_SVW2_SK0_SKXCCM0_TLDS0_ULSGRO1_USL1_UIOFGRO0_USFGROn1_VSn1_VWA2_VWB2_WSGRA0_WSGRB0_WS32_WG32_4_1_WGM8_WGMXCC1_WGMXCCGn1
    SolutionIndex: 182
    SolutionNameMin: Cijk_Ailk_Bjlk_HSS_BH_Bias_SHB_HA_S_SAB_SCD_SAV_UserArgs_MT64x64x64_MI16x16x1_SN_LDSB0_AFC1_AFEM1_AFEM1_ASEM1_CLR1_CADS0_DTLA0_DTLB0_DTVA0_DTVB1_EPS1_FDSI0_GRPM1_GRVWA4_GRVWB8_GSU1_GSUAMB_GSUC0_GSUWGMRR0_GLS0_ISA1201_IU1_K1_LBSPPA1024_LBSPPB0_LBSPPM0_LPA32_LPB0_LPM0_LRVW8_LWPMn1_MIAV1_MIWT2_2_MO40_NTn1_NTA0_NTB0_NTC0_NTD0_NTM0_NEPBS0_NLCA1_NLCB4_ONLL0_PGR1_PLR1_PKA0_SIA3_SS1_SU32_SUM1_SUS256_SPO0_SRVW0_SSO0_SVW2_SK0_SKXCCM0_TLDS0_ULSGRO0_USL1_UIOFGRO0_USFGROn1_VSn1_VWA2_VWB1_WSGRA0_WSGRB0_WS32_WG32_4_1_WGM8_WGMXCC1_WGMXCCGn1
    SolutionIndex: 184
    SolutionNameMin: Cijk_Ailk_Bjlk_HSS_BH_Bias_SHB_HA_S_SAB_SCD_SAV_UserArgs_MT32x32x32_MI16x16x1_SN_LDSB1_AFC1_AFEM1_AFEM1_ASEM1_CLR1_CADS0_DTLA0_DTLB0_DTVA0_DTVB0_EPS0_FDSI0_GRPM1_GRVWA1_GRVWB1_GSU1_GSUAMB_GSUC0_GSUWGMRR0_GLS0_ISA1201_IU2_K1_LBSPPA512_LBSPPB512_LBSPPM0_LPA16_LPB16_LPM0_LRVW8_LWPMn1_MIAV1_MIWT1_1_MO40_NTn1_NTA0_NTB0_NTC0_NTD0_NTM0_NEPBS0_NLCA1_NLCB1_ONLL0_PGR2_PLR1_PKA0_SIA2_SS0_SU32_SUM1_SUS256_SPO0_SRVW0_SSO0_SVW8_SK0_SKXCCM0_TLDS0_ULSGRO1_USL1_UIOFGRO0_USFGROn1_VSn1_VWA1_VWB1_WSGRA0_WSGRB0_WS32_WG32_4_1_WGM8_WGMXCC1_WGMXCCGn1
    SolutionIndex: 185
    SolutionNameMin: Cijk_Ailk_Bjlk_HSS_BH_Bias_SHB_HA_S_SAB_SCD_SAV_UserArgs_MT64x64x32_MI16x16x1_SN_LDSB0_AFC1_AFEM1_AFEM1_ASEM1_CLR1_CADS0_DTLA0_DTLB0_DTVA1_DTVB0_EPS0_FDSI0_GRPM1_GRVWA8_GRVWB8_GSU1_GSUAMB_GSUC0_GSUWGMRR0_GLS0_ISA1201_IU1_K1_LBSPPA0_LBSPPB1024_LBSPPM0_LPA0_LPB32_LPM0_LRVW8_LWPMn1_MIAV1_MIWT2_2_MO40_NTn1_NTA0_NTB0_NTC0_NTD0_NTM0_NEPBS0_NLCA2_NLCB1_ONLL0_PGR2_PLR1_PKA0_SIA3_SS0_SU32_SUM1_SUS256_SPO0_SRVW0_SSO0_SVW8_SK0_SKXCCM0_TLDS0_ULSGRO0_USL1_UIOFGRO0_USFGROn1_VSn1_VWA1_VWB2_WSGRA0_WSGRB0_WS32_WG32_4_1_WGM8_WGMXCC1_WGMXCCGn1
    SolutionIndex: 188
    SolutionNameMin: Cijk_Ailk_Bjlk_HSS_BH_Bias_SHB_HA_S_SAB_SCD_SAV_UserArgs_MT64x64x32_MI16x16x1_SN_LDSB1_AFC1_AFEM1_AFEM1_ASEM1_CLR1_CADS0_DTLA0_DTLB0_DTVA0_DTVB0_EPS1_FDSI0_GRPM1_GRVWA8_GRVWB4_GSU1_GSUAMB_GSUC0_GSUWGMRR0_GLS0_ISA1201_IU2_K1_LBSPPA1024_LBSPPB1024_LBSPPM0_LPA32_LPB32_LPM0_LRVW8_LWPMn1_MIAV1_MIWT2_2_MO40_NTn1_NTA0_NTB0_NTC0_NTD0_NTM0_NEPBS0_NLCA1_NLCB1_ONLL0_PGR1_PLR1_PKA0_SIA2_SS1_SU32_SUM1_SUS256_SPO0_SRVW0_SSO0_SVW2_SK0_SKXCCM0_TLDS0_ULSGRO0_USL1_UIOFGRO0_USFGROn1_VSn1_VWA2_VWB2_WSGRA0_WSGRB0_WS32_WG32_4_1_WGM8_WGMXCC1_WGMXCCGn1
    SolutionIndex: 189
    SolutionNameMin: Cijk_Ailk_Bjlk_HSS_BH_Bias_SHB_HA_S_SAB_SCD_SAV_UserArgs_MT64x64x16_MI16x16x1_SN_LDSB1_AFC1_AFEM1_AFEM1_ASEM1_CLR1_CADS0_DTLA0_DTLB0_DTVA0_DTVB0_EPS0_FDSI0_GRPM1_GRVWA4_GRVWB1_GSU1_GSUAMB_GSUC0_GSUWGMRR0_GLS0_ISA1201_IU1_K1_LBSPPA1024_LBSPPB1024_LBSPPM0_LPA32_LPB32_LPM0_LRVW8_LWPMn1_MIAV1_MIWT2_2_MO40_NTn1_NTA0_NTB0_NTC0_NTD0_NTM0_NEPBS0_NLCA1_NLCB1_ONLL0_PGR2_PLR1_PKA0_SIA2_SS1_SU32_SUM1_SUS256_SPO0_SRVW0_SSO0_SVW2_SK0_SKXCCM0_TLDS0_ULSGRO1_USL1_UIOFGRO0_USFGROn1_VSn1_VWA2_VWB2_WSGRA0_WSGRB0_WS32_WG32_4_1_WGM8_WGMXCC1_WGMXCCGn1
    SolutionIndex: 191
    SolutionNameMin: Cijk_Ailk_Bjlk_HSS_BH_Bias_SHB_HA_S_SAB_SCD_SAV_UserArgs_MT64x64x32_MI16x16x1_SN_LDSB1_AFC1_AFEM1_AFEM1_ASEM1_CLR1_CADS0_DTLA0_DTLB0_DTVA0_DTVB0_EPS0_FDSI0_GRPM1_GRVWA1_GRVWB1_GSU1_GSUAMB_GSUC0_GSUWGMRR0_GLS0_ISA1201_IU2_K1_LBSPPA1024_LBSPPB1024_LBSPPM0_LPA32_LPB32_LPM0_LRVW8_LWPMn1_MIAV1_MIWT2_2_MO40_NTn1_NTA0_NTB0_NTC0_NTD0_NTM0_NEPBS0_NLCA1_NLCB1_ONLL0_PGR2_PLR1_PKA0_SIA2_SS1_SU32_SUM1_SUS256_SPO0_SRVW0_SSO0_SVW2_SK0_SKXCCM0_TLDS0_ULSGRO0_USL1_UIOFGRO0_USFGROn1_VSn1_VWA2_VWB2_WSGRA0_WSGRB0_WS32_WG32_4_1_WGM8_WGMXCC1_WGMXCCGn1
    SolutionIndex: 198
    SolutionNameMin: Cijk_Ailk_Bjlk_HSS_BH_Bias_SHB_HA_S_SAB_SCD_SAV_UserArgs_MT128x32x64_MI16x16x1_SN_LDSB1_AFC1_AFEM1_AFEM1_ASEM1_CLR1_CADS0_DTLA0_DTLB0_DTVA0_DTVB0_EPS1_FDSI0_GRPM1_GRVWA8_GRVWB4_GSU1_GSUAMB_GSUC0_GSUWGMRR0_GLS0_ISA1201_IU4_K1_LBSPPA2048_LBSPPB512_LBSPPM0_LPA0_LPB16_LPM0_LRVW8_LWPMn1_MIAV1_MIWT4_1_MO40_NTn1_NTA0_NTB0_NTC0_NTD0_NTM0_NEPBS0_NLCA1_NLCB1_ONLL0_PGR1_PLR1_PKA0_SIA2_SS1_SU32_SUM1_SUS256_SPO0_SRVW0_SSO0_SVW4_SK0_SKXCCM0_TLDS0_ULSGRO0_USL1_UIOFGRO0_USFGROn1_VSn1_VWA4_VWB1_WSGRA0_WSGRB0_WS32_WG32_4_1_WGM8_WGMXCC1_WGMXCCGn1
    SolutionIndex: 199
    SolutionNameMin: Cijk_Ailk_Bjlk_HSS_BH_Bias_SHB_HA_S_SAB_SCD_SAV_UserArgs_MT64x64x16_MI16x16x1_SN_LDSB1_AFC1_AFEM1_AFEM1_ASEM1_CLR1_CADS0_DTLA0_DTLB0_DTVA0_DTVB0_EPS0_FDSI0_GRPM1_GRVWA4_GRVWB4_GSU1_GSUAMB_GSUC0_GSUWGMRR0_GLS0_ISA1201_IU1_K1_LBSPPA1024_LBSPPB1024_LBSPPM0_LPA32_LPB32_LPM0_LRVW8_LWPMn1_MIAV1_MIWT2_2_MO40_NTn1_NTA0_NTB0_NTC0_NTD0_NTM0_NEPBS0_NLCA1_NLCB1_ONLL0_PGR2_PLR1_PKA0_SIA2_SS1_SU32_SUM1_SUS256_SPO0_SRVW0_SSO0_SVW2_SK0_SKXCCM0_TLDS0_ULSGRO0_USL1_UIOFGRO0_USFGROn1_VSn1_VWA2_VWB2_WSGRA0_WSGRB0_WS32_WG32_4_1_WGM8_WGMXCC1_WGMXCCGn1
    SolutionIndex: 200
    SolutionNameMin: Cijk_Ailk_Bjlk_HSS_BH_Bias_SHB_HA_S_SAB_SCD_SAV_UserArgs_MT64x64x16_MI16x16x1_SN_LDSB1_AFC1_AFEM1_AFEM1_ASEM1_CLR1_CADS0_DTLA0_DTLB0_DTVA0_DTVB0_EPS0_FDSI0_GRPM1_GRVWA8_GRVWB4_GSU1_GSUAMB_GSUC0_GSUWGMRR0_GLS0_ISA1201_IU1_K1_LBSPPA1024_LBSPPB1024_LBSPPM0_LPA32_LPB32_LPM0_LRVW8_LWPMn1_MIAV1_MIWT2_2_MO40_NTn1_NTA0_NTB0_NTC0_NTD0_NTM0_NEPBS0_NLCA1_NLCB1_ONLL0_PGR2_PLR1_PKA0_SIA2_SS1_SU32_SUM1_SUS256_SPO0_SRVW0_SSO0_SVW2_SK0_SKXCCM0_TLDS0_ULSGRO0_USL1_UIOFGRO0_USFGROn1_VSn1_VWA2_VWB2_WSGRA0_WSGRB0_WS32_WG32_4_1_WGM8_WGMXCC1_WGMXCCGn1
    SolutionIndex: 201
    SolutionNameMin: Cijk_Ailk_Bjlk_HSS_BH_Bias_SHB_HA_S_SAB_SCD_SAV_UserArgs_MT64x64x16_MI16x16x1_SN_LDSB0_AFC1_AFEM1_AFEM1_ASEM1_CLR0_CADS0_DTLA0_DTLB0_DTVA0_DTVB0_EPS0_FDSI0_GRPM1_GRVWA8_GRVWB8_GSU1_GSUAMB_GSUC0_GSUWGMRR0_GLS0_ISA1201_IU1_K1_LBSPPA1024_LBSPPB1024_LBSPPM0_LPA32_LPB32_LPM0_LRVW8_LWPMn1_MIAV1_MIWT2_2_MO40_NTn1_NTA0_NTB0_NTC0_NTD0_NTM0_NEPBS0_NLCA1_NLCB1_ONLL0_PGR2_PLR0_PKA0_SIA3_SS1_SU32_SUM1_SUS256_SPO0_SRVW0_SSO0_SVW2_SK0_SKXCCM0_TLDS0_ULSGRO1_USL1_UIOFGRO0_USFGROn1_VSn1_VWA2_VWB2_WSGRA0_WSGRB0_WS32_WG32_4_1_WGM8_WGMXCC1_WGMXCCGn1
    SolutionIndex: 202
    SolutionNameMin: Cijk_Ailk_Bjlk_HSS_BH_Bias_SHB_HA_S_SAB_SCD_SAV_UserArgs_MT64x64x32_MI16x16x1_SN_LDSB0_AFC1_AFEM1_AFEM1_ASEM1_CLR1_CADS0_DTLA0_DTLB0_DTVA0_DTVB1_EPS1_FDSI0_GRPM1_GRVWA4_GRVWB8_GSU1_GSUAMB_GSUC0_GSUWGMRR0_GLS0_ISA1201_IU1_K1_LBSPPA1024_LBSPPB0_LBSPPM0_LPA32_LPB0_LPM0_LRVW8_LWPMn1_MIAV1_MIWT2_2_MO40_NTn1_NTA0_NTB0_NTC0_NTD0_NTM0_NEPBS0_NLCA1_NLCB2_ONLL0_PGR1_PLR1_PKA0_SIA3_SS1_SU32_SUM1_SUS256_SPO0_SRVW0_SSO0_SVW2_SK0_SKXCCM0_TLDS0_ULSGRO0_USL1_UIOFGRO0_USFGROn1_VSn1_VWA2_VWB1_WSGRA0_WSGRB0_WS32_WG32_4_1_WGM8_WGMXCC1_WGMXCCGn1
    SolutionIndex: 204
    SolutionNameMin: Cijk_Ailk_Bjlk_HSS_BH_Bias_SHB_HA_S_SAB_SCD_SAV_UserArgs_MT128x32x16_MI16x16x1_SN_LDSB1_AFC1_AFEM1_AFEM1_ASEM1_CLR1_CADS0_DTLA0_DTLB0_DTVA0_DTVB0_EPS1_FDSI0_GRPM1_GRVWA4_GRVWB4_GSU1_GSUAMB_GSUC0_GSUWGMRR0_GLS0_ISA1201_IU1_K1_LBSPPA2048_LBSPPB512_LBSPPM0_LPA0_LPB16_LPM0_LRVW8_LWPMn1_MIAV1_MIWT4_1_MO40_NTn1_NTA0_NTB0_NTC0_NTD0_NTM0_NEPBS0_NLCA1_NLCB1_ONLL0_PGR1_PLR1_PKA0_SIA2_SS1_SU32_SUM1_SUS256_SPO0_SRVW0_SSO0_SVW4_SK0_SKXCCM0_TLDS0_ULSGRO0_USL1_UIOFGRO0_USFGROn1_VSn1_VWA4_VWB1_WSGRA0_WSGRB0_WS32_WG32_4_1_WGM8_WGMXCC1_WGMXCCGn1
    SolutionIndex: 205
    SolutionNameMin: Cijk_Ailk_Bjlk_HSS_BH_Bias_SHB_HA_S_SAB_SCD_SAV_UserArgs_MT64x64x32_MI16x16x1_SN_LDSB1_AFC1_AFEM1_AFEM1_ASEM1_CLR1_CADS0_DTLA0_DTLB0_DTVA0_DTVB0_EPS0_FDSI0_GRPM1_GRVWA4_GRVWB8_GSU1_GSUAMB_GSUC0_GSUWGMRR0_GLS0_ISA1201_IU2_K1_LBSPPA1024_LBSPPB1024_LBSPPM0_LPA32_LPB32_LPM0_LRVW8_LWPMn1_MIAV1_MIWT2_2_MO40_NTn1_NTA0_NTB0_NTC0_NTD0_NTM0_NEPBS0_NLCA1_NLCB1_ONLL0_PGR2_PLR1_PKA0_SIA2_SS1_SU32_SUM1_SUS256_SPO0_SRVW0_SSO0_SVW2_SK0_SKXCCM0_TLDS0_ULSGRO1_USL1_UIOFGRO0_USFGROn1_VSn1_VWA2_VWB2_WSGRA0_WSGRB0_WS32_WG32_4_1_WGM8_WGMXCC1_WGMXCCGn1
    SolutionIndex: 207
    SolutionNameMin: Cijk_Ailk_Bjlk_HSS_BH_Bias_SHB_HA_S_SAB_SCD_SAV_UserArgs_MT64x64x16_MI16x16x1_SN_LDSB1_AFC1_AFEM1_AFEM1_ASEM1_CLR1_CADS0_DTLA0_DTLB0_DTVA0_DTVB0_EPS1_FDSI0_GRPM1_GRVWA8_GRVWB1_GSU1_GSUAMB_GSUC0_GSUWGMRR0_GLS0_ISA1201_IU1_K1_LBSPPA1024_LBSPPB1024_LBSPPM0_LPA32_LPB32_LPM0_LRVW8_LWPMn1_MIAV1_MIWT2_2_MO40_NTn1_NTA0_NTB0_NTC0_NTD0_NTM0_NEPBS0_NLCA1_NLCB1_ONLL0_PGR1_PLR1_PKA0_SIA2_SS1_SU32_SUM1_SUS256_SPO0_SRVW0_SSO0_SVW2_SK0_SKXCCM0_TLDS0_ULSGRO0_USL1_UIOFGRO0_USFGROn1_VSn1_VWA2_VWB2_WSGRA0_WSGRB0_WS32_WG32_4_1_WGM8_WGMXCC1_WGMXCCGn1
    SolutionIndex: 208
    SolutionNameMin: Cijk_Ailk_Bjlk_HSS_BH_Bias_SHB_HA_S_SAB_SCD_SAV_UserArgs_MT64x64x16_MI16x16x1_SN_LDSB1_AFC1_AFEM1_AFEM1_ASEM1_CLR1_CADS0_DTLA0_DTLB0_DTVA0_DTVB0_EPS1_FDSI0_GRPM1_GRVWA4_GRVWB1_GSU1_GSUAMB_GSUC0_GSUWGMRR0_GLS0_ISA1201_IU1_K1_LBSPPA1024_LBSPPB1024_LBSPPM0_LPA32_LPB32_LPM0_LRVW8_LWPMn1_MIAV1_MIWT2_2_MO40_NTn1_NTA0_NTB0_NTC0_NTD0_NTM0_NEPBS0_NLCA1_NLCB1_ONLL0_PGR1_PLR1_PKA0_SIA2_SS1_SU32_SUM1_SUS256_SPO0_SRVW0_SSO0_SVW2_SK0_SKXCCM0_TLDS0_ULSGRO0_USL1_UIOFGRO0_USFGROn1_VSn1_VWA2_VWB2_WSGRA0_WSGRB0_WS32_WG32_4_1_WGM8_WGMXCC1_WGMXCCGn1
    SolutionIndex: 209
    SolutionNameMin: Cijk_Ailk_Bjlk_HSS_BH_Bias_SHB_HA_S_SAB_SCD_SAV_UserArgs_MT64x64x16_MI16x16x1_SN_LDSB1_AFC1_AFEM1_AFEM1_ASEM1_CLR1_CADS0_DTLA0_DTLB0_DTVA0_DTVB0_EPS0_FDSI0_GRPM1_GRVWA1_GRVWB1_GSU1_GSUAMB_GSUC0_GSUWGMRR0_GLS0_ISA1201_IU1_K1_LBSPPA1024_LBSPPB1024_LBSPPM0_LPA32_LPB32_LPM0_LRVW8_LWPMn1_MIAV1_MIWT2_2_MO40_NTn1_NTA0_NTB0_NTC0_NTD0_NTM0_NEPBS0_NLCA1_NLCB1_ONLL0_PGR2_PLR1_PKA0_SIA2_SS1_SU32_SUM1_SUS256_SPO0_SRVW0_SSO0_SVW2_SK0_SKXCCM0_TLDS0_ULSGRO1_USL1_UIOFGRO0_USFGROn1_VSn1_VWA2_VWB2_WSGRA0_WSGRB0_WS32_WG32_4_1_WGM8_WGMXCC1_WGMXCCGn1
    SolutionIndex: 210
    SolutionNameMin: Cijk_Ailk_Bjlk_HSS_BH_Bias_SHB_HA_S_SAB_SCD_SAV_UserArgs_MT64x64x16_MI16x16x1_SN_LDSB1_AFC1_AFEM1_AFEM1_ASEM1_CLR1_CADS0_DTLA0_DTLB0_DTVA0_DTVB0_EPS0_FDSI0_GRPM1_GRVWA8_GRVWB1_GSU1_GSUAMB_GSUC0_GSUWGMRR0_GLS0_ISA1201_IU1_K1_LBSPPA1024_LBSPPB1024_LBSPPM0_LPA32_LPB32_LPM0_LRVW8_LWPMn1_MIAV1_MIWT2_2_MO40_NTn1_NTA0_NTB0_NTC0_NTD0_NTM0_NEPBS0_NLCA1_NLCB1_ONLL0_PGR2_PLR1_PKA0_SIA2_SS1_SU32_SUM1_SUS256_SPO0_SRVW0_SSO0_SVW2_SK0_SKXCCM0_TLDS0_ULSGRO0_USL1_UIOFGRO0_USFGROn1_VSn1_VWA2_VWB2_WSGRA0_WSGRB0_WS32_WG32_4_1_WGM8_WGMXCC1_WGMXCCGn1
    SolutionIndex: 211
    SolutionNameMin: Cijk_Ailk_Bjlk_HSS_BH_Bias_SHB_HA_S_SAB_SCD_SAV_UserArgs_MT64x64x32_MI16x16x1_SN_LDSB1_AFC1_AFEM1_AFEM1_ASEM1_CLR1_CADS0_DTLA0_DTLB0_DTVA0_DTVB0_EPS0_FDSI0_GRPM1_GRVWA4_GRVWB4_GSU1_GSUAMB_GSUC0_GSUWGMRR0_GLS0_ISA1201_IU2_K1_LBSPPA1024_LBSPPB1024_LBSPPM0_LPA32_LPB32_LPM0_LRVW8_LWPMn1_MIAV1_MIWT2_2_MO40_NTn1_NTA0_NTB0_NTC0_NTD0_NTM0_NEPBS0_NLCA1_NLCB1_ONLL0_PGR2_PLR1_PKA0_SIA2_SS1_SU32_SUM1_SUS256_SPO0_SRVW0_SSO0_SVW2_SK0_SKXCCM0_TLDS0_ULSGRO0_USL1_UIOFGRO0_USFGROn1_VSn1_VWA2_VWB2_WSGRA0_WSGRB0_WS32_WG32_4_1_WGM8_WGMXCC1_WGMXCCGn1
    SolutionIndex: 212
    SolutionNameMin: Cijk_Ailk_Bjlk_HSS_BH_Bias_SHB_HA_S_SAB_SCD_SAV_UserArgs_MT64x64x32_MI16x16x1_SN_LDSB0_AFC1_AFEM1_AFEM1_ASEM1_CLR1_CADS0_DTLA0_DTLB0_DTVA0_DTVB0_EPS1_FDSI0_GRPM1_GRVWA1_GRVWB1_GSU1_GSUAMB_GSUC0_GSUWGMRR0_GLS0_ISA1201_IU1_K1_LBSPPA1024_LBSPPB1024_LBSPPM0_LPA32_LPB32_LPM0_LRVW8_LWPMn1_MIAV1_MIWT2_2_MO40_NTn1_NTA0_NTB0_NTC0_NTD0_NTM0_NEPBS0_NLCA1_NLCB1_ONLL0_PGR1_PLR1_PKA0_SIA3_SS1_SU32_SUM1_SUS256_SPO0_SRVW0_SSO0_SVW2_SK0_SKXCCM0_TLDS0_ULSGRO0_USL1_UIOFGRO0_USFGROn1_VSn1_VWA2_VWB2_WSGRA0_WSGRB0_WS32_WG32_4_1_WGM8_WGMXCC1_WGMXCCGn1
    SolutionIndex: 219
    SolutionNameMin: Cijk_Ailk_Bjlk_HSS_BH_Bias_SHB_HA_S_SAB_SCD_SAV_UserArgs_MT128x128x16_MI16x16x1_SN_LDSB1_AFC1_AFEM1_AFEM1_ASEM1_CLR1_CADS0_DTLA0_DTLB0_DTVA0_DTVB0_EPS0_FDSI0_GRPM1_GRVWA8_GRVWB8_GSU1_GSUAMB_GSUC0_GSUWGMRR0_GLS0_ISA1201_IU1_K1_LBSPPA2048_LBSPPB2048_LBSPPM0_LPA0_LPB0_LPM0_LRVW8_LWPMn1_MIAV1_MIWT4_4_MO40_NTn1_NTA0_NTB0_NTC0_NTD0_NTM0_NEPBS0_NLCA1_NLCB1_ONLL0_PGR2_PLR1_PKA0_SIA2_SS1_SU32_SUM1_SUS256_SPO0_SRVW0_SSO0_SVW4_SK0_SKXCCM0_TLDS0_ULSGRO1_USL1_UIOFGRO0_USFGROn1_VSn1_VWA4_VWB4_WSGRA0_WSGRB0_WS32_WG32_4_1_WGM8_WGMXCC1_WGMXCCGn1
    SolutionIndex: 220
    SolutionNameMin: Cijk_Ailk_Bjlk_HSS_BH_Bias_SHB_HA_S_SAB_SCD_SAV_UserArgs_MT16x32x32_MI16x16x1_SN_LDSB1_AFC1_AFEM1_AFEM1_ASEM1_CLR1_CADS0_DTLA0_DTLB0_DTVA0_DTVB0_EPS0_FDSI0_GRPM1_GRVWA4_GRVWB8_GSU1_GSUAMB_GSUC0_GSUWGMRR0_GLS0_ISA1201_IU2_K1_LBSPPA256_LBSPPB512_LBSPPM0_LPA16_LPB16_LPM0_LRVW8_LWPMn1_MIAV1_MIWT1_1_MO40_NTn1_NTA0_NTB0_NTC0_NTD0_NTM0_NEPBS0_NLCA1_NLCB1_ONLL0_PGR2_PLR1_PKA0_SIA2_SS0_SU32_SUM1_SUS256_SPO0_SRVW0_SSO0_SVW8_SK0_SKXCCM0_TLDS0_ULSGRO0_USL1_UIOFGRO0_USFGROn1_VSn1_VWA1_VWB1_WSGRA0_WSGRB0_WS32_WG16_4_1_WGM8_WGMXCC1_WGMXCCGn1
    SolutionIndex: 223
    SolutionNameMin: Cijk_Ailk_Bjlk_HSS_BH_Bias_SHB_HA_S_SAB_SCD_SAV_UserArgs_MT64x64x32_MI16x16x1_SN_LDSB1_AFC1_AFEM1_AFEM1_ASEM1_CLR1_CADS0_DTLA0_DTLB0_DTVA0_DTVB0_EPS1_FDSI0_GRPM1_GRVWA4_GRVWB8_GSU1_GSUAMB_GSUC0_GSUWGMRR0_GLS0_ISA1201_IU2_K1_LBSPPA1024_LBSPPB1024_LBSPPM0_LPA32_LPB32_LPM0_LRVW8_LWPMn1_MIAV1_MIWT2_2_MO40_NTn1_NTA0_NTB0_NTC0_NTD0_NTM0_NEPBS0_NLCA1_NLCB1_ONLL0_PGR1_PLR1_PKA0_SIA2_SS1_SU32_SUM1_SUS256_SPO0_SRVW0_SSO0_SVW2_SK0_SKXCCM0_TLDS0_ULSGRO0_USL1_UIOFGRO0_USFGROn1_VSn1_VWA2_VWB2_WSGRA0_WSGRB0_WS32_WG32_4_1_WGM8_WGMXCC1_WGMXCCGn1
    SolutionIndex: 225
    SolutionNameMin: Cijk_Ailk_Bjlk_HSS_BH_Bias_SHB_HA_S_SAB_SCD_SAV_UserArgs_MT64x64x64_MI16x16x1_SN_LDSB0_AFC1_AFEM1_AFEM1_ASEM1_CLR1_CADS0_DTLA0_DTLB0_DTVA0_DTVB1_EPS0_FDSI0_GRPM1_GRVWA8_GRVWB8_GSU1_GSUAMB_GSUC0_GSUWGMRR0_GLS0_ISA1201_IU1_K1_LBSPPA1024_LBSPPB0_LBSPPM0_LPA32_LPB0_LPM0_LRVW8_LWPMn1_MIAV1_MIWT2_2_MO40_NTn1_NTA0_NTB0_NTC0_NTD0_NTM0_NEPBS0_NLCA1_NLCB4_ONLL0_PGR2_PLR1_PKA0_SIA3_SS1_SU32_SUM1_SUS256_SPO0_SRVW0_SSO0_SVW2_SK0_SKXCCM0_TLDS0_ULSGRO0_USL1_UIOFGRO0_USFGROn1_VSn1_VWA2_VWB1_WSGRA0_WSGRB0_WS32_WG32_4_1_WGM8_WGMXCC1_WGMXCCGn1
    SolutionIndex: 229
    SolutionNameMin: Cijk_Ailk_Bjlk_HSS_BH_Bias_SHB_HA_S_SAB_SCD_SAV_UserArgs_MT64x64x16_MI16x16x1_SN_LDSB0_AFC1_AFEM1_AFEM1_ASEM1_CLR0_CADS0_DTLA0_DTLB0_DTVA0_DTVB0_EPS0_FDSI0_GRPM1_GRVWA4_GRVWB8_GSU1_GSUAMB_GSUC0_GSUWGMRR0_GLS0_ISA1201_IU1_K1_LBSPPA1024_LBSPPB1024_LBSPPM0_LPA32_LPB32_LPM0_LRVW8_LWPMn1_MIAV1_MIWT2_2_MO40_NTn1_NTA0_NTB0_NTC0_NTD0_NTM0_NEPBS0_NLCA1_NLCB1_ONLL0_PGR2_PLR0_PKA0_SIA3_SS1_SU32_SUM1_SUS256_SPO0_SRVW0_SSO0_SVW2_SK0_SKXCCM0_TLDS0_ULSGRO1_USL1_UIOFGRO0_USFGROn1_VSn1_VWA2_VWB2_WSGRA0_WSGRB0_WS32_WG32_4_1_WGM8_WGMXCC1_WGMXCCGn1
    SolutionIndex: 233
    SolutionNameMin: Cijk_Ailk_Bjlk_HSS_BH_Bias_SHB_HA_S_SAB_SCD_SAV_UserArgs_MT128x128x16_MI16x16x1_SN_LDSB1_AFC1_AFEM1_AFEM1_ASEM1_CLR1_CADS0_DTLA0_DTLB0_DTVA0_DTVB0_EPS1_FDSI0_GRPM1_GRVWA8_GRVWB8_GSU1_GSUAMB_GSUC0_GSUWGMRR0_GLS0_ISA1201_IU1_K1_LBSPPA2048_LBSPPB2048_LBSPPM0_LPA0_LPB0_LPM0_LRVW8_LWPMn1_MIAV1_MIWT4_4_MO40_NTn1_NTA0_NTB0_NTC0_NTD0_NTM0_NEPBS0_NLCA1_NLCB1_ONLL0_PGR1_PLR1_PKA0_SIA2_SS1_SU32_SUM1_SUS256_SPO0_SRVW0_SSO0_SVW4_SK0_SKXCCM0_TLDS0_ULSGRO0_USL1_UIOFGRO0_USFGROn1_VSn1_VWA4_VWB4_WSGRA0_WSGRB0_WS32_WG32_4_1_WGM8_WGMXCC1_WGMXCCGn1
    SolutionIndex: 234
    SolutionNameMin: Cijk_Ailk_Bjlk_HSS_BH_Bias_SHB_HA_S_SAB_SCD_SAV_UserArgs_MT32x16x32_MI16x16x1_SN_LDSB1_AFC1_AFEM1_AFEM1_ASEM1_CLR1_CADS0_DTLA0_DTLB0_DTVA0_DTVB0_EPS0_FDSI0_GRPM1_GRVWA4_GRVWB8_GSU1_GSUAMB_GSUC0_GSUWGMRR0_GLS0_ISA1201_IU2_K1_LBSPPA512_LBSPPB256_LBSPPM0_LPA16_LPB16_LPM0_LRVW8_LWPMn1_MIAV1_MIWT1_1_MO40_NTn1_NTA0_NTB0_NTC0_NTD0_NTM0_NEPBS0_NLCA1_NLCB1_ONLL0_PGR2_PLR1_PKA0_SIA2_SS0_SU32_SUM1_SUS256_SPO0_SRVW0_SSO0_SVW8_SK0_SKXCCM0_TLDS0_ULSGRO0_USL1_UIOFGRO0_USFGROn1_VSn1_VWA1_VWB1_WSGRA0_WSGRB0_WS32_WG32_2_1_WGM8_WGMXCC1_WGMXCCGn1
    SolutionIndex: 237
    SolutionNameMin: Cijk_Ailk_Bjlk_HSS_BH_Bias_SHB_HA_S_SAB_SCD_SAV_UserArgs_MT16x128x16_MI16x16x1_SN_LDSB0_AFC1_AFEM1_AFEM1_ASEM1_CLR1_CADS0_DTLA0_DTLB0_DTVA1_DTVB1_EPS0_FDSI0_GRPM1_GRVWA8_GRVWB8_GSU1_GSUAMB_GSUC0_GSUWGMRR0_GLS0_ISA1201_IU1_K1_LBSPPA0_LBSPPB0_LBSPPM0_LPA0_LPB0_LPM0_LRVW8_LWPMn1_MIAV1_MIWT1_8_MO40_NTn1_NTA0_NTB0_NTC0_NTD0_NTM0_NEPBS0_NLCA1_NLCB1_ONLL0_PGR1_PLR0_PKA0_SIA3_SS0_SU32_SUM1_SUS256_SPO0_SRVW0_SSO0_SVW8_SK0_SKXCCM0_TLDS0_ULSGRO0_USL1_UIOFGRO0_USFGROn1_VSn1_VWA1_VWB1_WSGRA0_WSGRB0_WS32_WG16_2_1_WGM8_WGMXCC1_WGMXCCGn1
    SolutionIndex: 238
    SolutionNameMin: Cijk_Ailk_Bjlk_HSS_BH_Bias_SHB_HA_S_SAB_SCD_SAV_UserArgs_MT32x128x32_MI16x16x1_SN_LDSB0_AFC1_AFEM1_AFEM1_ASEM1_CLR1_CADS0_DTLA0_DTLB0_DTVA0_DTVB1_EPS1_FDSI0_GRPM1_GRVWA4_GRVWB8_GSU1_GSUAMB_GSUC0_GSUWGMRR0_GLS0_ISA1201_IU1_K1_LBSPPA512_LBSPPB0_LBSPPM0_LPA16_LPB0_LPM0_LRVW8_LWPMn1_MIAV1_MIWT1_4_MO40_NTn1_NTA0_NTB0_NTC0_NTD0_NTM0_NEPBS0_NLCA1_NLCB2_ONLL0_PGR1_PLR1_PKA0_SIA3_SS0_SU32_SUM1_SUS256_SPO0_SRVW0_SSO0_SVW8_SK0_SKXCCM0_TLDS0_ULSGRO0_USL1_UIOFGRO0_USFGROn1_VSn1_VWA1_VWB1_WSGRA0_WSGRB0_WS32_WG32_4_1_WGM8_WGMXCC1_WGMXCCGn1
    SolutionIndex: 239
    SolutionNameMin: Cijk_Ailk_Bjlk_HSS_BH_Bias_SHB_HA_S_SAB_SCD_SAV_UserArgs_MT128x128x16_MI16x16x1_SN_LDSB1_AFC1_AFEM1_AFEM1_ASEM1_CLR1_CADS0_DTLA0_DTLB0_DTVA0_DTVB0_EPS1_FDSI0_GRPM1_GRVWA4_GRVWB4_GSU1_GSUAMB_GSUC0_GSUWGMRR0_GLS0_ISA1201_IU1_K1_LBSPPA2048_LBSPPB2048_LBSPPM0_LPA0_LPB0_LPM0_LRVW8_LWPMn1_MIAV1_MIWT4_4_MO40_NTn1_NTA0_NTB0_NTC0_NTD0_NTM0_NEPBS0_NLCA1_NLCB1_ONLL0_PGR1_PLR1_PKA0_SIA2_SS1_SU32_SUM1_SUS256_SPO0_SRVW0_SSO0_SVW4_SK0_SKXCCM0_TLDS0_ULSGRO0_USL1_UIOFGRO0_USFGROn1_VSn1_VWA4_VWB4_WSGRA0_WSGRB0_WS32_WG32_4_1_WGM8_WGMXCC1_WGMXCCGn1
    SolutionIndex: 240
    SolutionNameMin: Cijk_Ailk_Bjlk_HSS_BH_Bias_SHB_HA_S_SAB_SCD_SAV_UserArgs_MT64x64x32_MI16x16x1_SN_LDSB1_AFC1_AFEM1_AFEM1_ASEM1_CLR1_CADS0_DTLA0_DTLB0_DTVA0_DTVB0_EPS1_FDSI0_GRPM1_GRVWA8_GRVWB8_GSU1_GSUAMB_GSUC0_GSUWGMRR0_GLS0_ISA1201_IU2_K1_LBSPPA1024_LBSPPB1024_LBSPPM0_LPA32_LPB32_LPM0_LRVW8_LWPMn1_MIAV1_MIWT2_2_MO40_NTn1_NTA0_NTB0_NTC0_NTD0_NTM0_NEPBS0_NLCA1_NLCB1_ONLL0_PGR1_PLR1_PKA0_SIA2_SS1_SU32_SUM1_SUS256_SPO0_SRVW0_SSO0_SVW2_SK0_SKXCCM0_TLDS0_ULSGRO0_USL1_UIOFGRO0_USFGROn1_VSn1_VWA2_VWB2_WSGRA0_WSGRB0_WS32_WG32_4_1_WGM8_WGMXCC1_WGMXCCGn1
    SolutionIndex: 243
    SolutionNameMin: Cijk_Ailk_Bjlk_HSS_BH_Bias_SHB_HA_S_SAB_SCD_SAV_UserArgs_MT64x64x64_MI16x16x1_SN_LDSB1_AFC1_AFEM1_AFEM1_ASEM1_CLR1_CADS0_DTLA0_DTLB0_DTVA0_DTVB0_EPS0_FDSI0_GRPM1_GRVWA4_GRVWB8_GSU1_GSUAMB_GSUC0_GSUWGMRR0_GLS0_ISA1201_IU4_K1_LBSPPA1024_LBSPPB1024_LBSPPM0_LPA32_LPB32_LPM0_LRVW8_LWPMn1_MIAV1_MIWT2_2_MO40_NTn1_NTA0_NTB0_NTC0_NTD0_NTM0_NEPBS0_NLCA1_NLCB1_ONLL0_PGR2_PLR1_PKA0_SIA2_SS1_SU32_SUM1_SUS256_SPO0_SRVW0_SSO0_SVW2_SK0_SKXCCM0_TLDS0_ULSGRO0_USL1_UIOFGRO0_USFGROn1_VSn1_VWA2_VWB2_WSGRA0_WSGRB0_WS32_WG32_4_1_WGM8_WGMXCC1_WGMXCCGn1
    SolutionIndex: 245
    SolutionNameMin: Cijk_Ailk_Bjlk_HSS_BH_Bias_SHB_HA_S_SAB_SCD_SAV_UserArgs_MT128x128x16_MI16x16x1_SN_LDSB1_AFC1_AFEM1_AFEM1_ASEM1_CLR1_CADS0_DTLA0_DTLB0_DTVA0_DTVB0_EPS1_FDSI0_GRPM1_GRVWA8_GRVWB4_GSU1_GSUAMB_GSUC0_GSUWGMRR0_GLS0_ISA1201_IU1_K1_LBSPPA2048_LBSPPB2048_LBSPPM0_LPA0_LPB0_LPM0_LRVW8_LWPMn1_MIAV1_MIWT4_4_MO40_NTn1_NTA0_NTB0_NTC0_NTD0_NTM0_NEPBS0_NLCA1_NLCB1_ONLL0_PGR1_PLR1_PKA0_SIA2_SS1_SU32_SUM1_SUS256_SPO0_SRVW0_SSO0_SVW4_SK0_SKXCCM0_TLDS0_ULSGRO0_USL1_UIOFGRO0_USFGROn1_VSn1_VWA4_VWB4_WSGRA0_WSGRB0_WS32_WG32_4_1_WGM8_WGMXCC1_WGMXCCGn1
    SolutionIndex: 246
    SolutionNameMin: Cijk_Ailk_Bjlk_HSS_BH_Bias_SHB_HA_S_SAB_SCD_SAV_UserArgs_MT128x128x16_MI16x16x1_SN_LDSB1_AFC1_AFEM1_AFEM1_ASEM1_CLR1_CADS0_DTLA0_DTLB0_DTVA0_DTVB0_EPS1_FDSI0_GRPM1_GRVWA4_GRVWB8_GSU1_GSUAMB_GSUC0_GSUWGMRR0_GLS0_ISA1201_IU1_K1_LBSPPA2048_LBSPPB2048_LBSPPM0_LPA0_LPB0_LPM0_LRVW8_LWPMn1_MIAV1_MIWT4_4_MO40_NTn1_NTA0_NTB0_NTC0_NTD0_NTM0_NEPBS0_NLCA1_NLCB1_ONLL0_PGR1_PLR1_PKA0_SIA2_SS1_SU32_SUM1_SUS256_SPO0_SRVW0_SSO0_SVW4_SK0_SKXCCM0_TLDS0_ULSGRO0_USL1_UIOFGRO0_USFGROn1_VSn1_VWA4_VWB4_WSGRA0_WSGRB0_WS32_WG32_4_1_WGM8_WGMXCC1_WGMXCCGn1
    SolutionIndex: 247
    SolutionNameMin: Cijk_Ailk_Bjlk_HSS_BH_Bias_SHB_HA_S_SAB_SCD_SAV_UserArgs_MT128x128x16_MI16x16x1_SN_LDSB1_AFC1_AFEM1_AFEM1_ASEM1_CLR1_CADS0_DTLA0_DTLB0_DTVA0_DTVB0_EPS1_FDSI0_GRPM1_GRVWA1_GRVWB1_GSU1_GSUAMB_GSUC0_GSUWGMRR0_GLS0_ISA1201_IU1_K1_LBSPPA2048_LBSPPB2048_LBSPPM0_LPA0_LPB0_LPM0_LRVW8_LWPMn1_MIAV1_MIWT4_4_MO40_NTn1_NTA0_NTB0_NTC0_NTD0_NTM0_NEPBS0_NLCA1_NLCB1_ONLL0_PGR1_PLR1_PKA0_SIA2_SS1_SU32_SUM1_SUS256_SPO0_SRVW0_SSO0_SVW4_SK0_SKXCCM0_TLDS0_ULSGRO0_USL1_UIOFGRO0_USFGROn1_VSn1_VWA4_VWB4_WSGRA0_WSGRB0_WS32_WG32_4_1_WGM8_WGMXCC1_WGMXCCGn1
    SolutionIndex: 248
    SolutionNameMin: Cijk_Ailk_Bjlk_HSS_BH_Bias_SHB_HA_S_SAB_SCD_SAV_UserArgs_MT32x32x32_MI16x16x1_SN_LDSB1_AFC1_AFEM1_AFEM1_ASEM1_CLR1_CADS0_DTLA0_DTLB0_DTVA0_DTVB0_EPS0_FDSI0_GRPM1_GRVWA4_GRVWB1_GSU1_GSUAMB_GSUC0_GSUWGMRR0_GLS0_ISA1201_IU2_K1_LBSPPA512_LBSPPB512_LBSPPM0_LPA16_LPB16_LPM0_LRVW8_LWPMn1_MIAV1_MIWT1_1_MO40_NTn1_NTA0_NTB0_NTC0_NTD0_NTM0_NEPBS0_NLCA1_NLCB1_ONLL0_PGR2_PLR1_PKA0_SIA2_SS0_SU32_SUM1_SUS256_SPO0_SRVW0_SSO0_SVW8_SK0_SKXCCM0_TLDS0_ULSGRO0_USL1_UIOFGRO0_USFGROn1_VSn1_VWA1_VWB1_WSGRA0_WSGRB0_WS32_WG32_4_1_WGM8_WGMXCC1_WGMXCCGn1
    SolutionIndex: 249
    SolutionNameMin: Cijk_Ailk_Bjlk_HSS_BH_Bias_SHB_HA_S_SAB_SCD_SAV_UserArgs_MT64x64x64_MI16x16x1_SN_LDSB0_AFC1_AFEM1_AFEM1_ASEM1_CLR1_CADS0_DTLA0_DTLB0_DTVA1_DTVB0_EPS1_FDSI0_GRPM1_GRVWA8_GRVWB4_GSU1_GSUAMB_GSUC0_GSUWGMRR0_GLS0_ISA1201_IU1_K1_LBSPPA0_LBSPPB1024_LBSPPM0_LPA0_LPB32_LPM0_LRVW8_LWPMn1_MIAV1_MIWT2_2_MO40_NTn1_NTA0_NTB0_NTC0_NTD0_NTM0_NEPBS0_NLCA4_NLCB1_ONLL0_PGR1_PLR1_PKA0_SIA3_SS0_SU32_SUM1_SUS256_SPO0_SRVW0_SSO0_SVW8_SK0_SKXCCM0_TLDS0_ULSGRO0_USL1_UIOFGRO0_USFGROn1_VSn1_VWA1_VWB2_WSGRA0_WSGRB0_WS32_WG32_4_1_WGM8_WGMXCC1_WGMXCCGn1
    SolutionIndex: 251
    SolutionNameMin: Cijk_Ailk_Bjlk_HSS_BH_Bias_SHB_HA_S_SAB_SCD_SAV_UserArgs_MT64x64x16_MI16x16x1_SN_LDSB0_AFC1_AFEM1_AFEM1_ASEM1_CLR1_CADS0_DTLA0_DTLB0_DTVA1_DTVB1_EPS0_FDSI0_GRPM1_GRVWA8_GRVWB8_GSU1_GSUAMB_GSUC0_GSUWGMRR0_GLS0_ISA1201_IU1_K1_LBSPPA0_LBSPPB0_LBSPPM0_LPA0_LPB0_LPM0_LRVW8_LWPMn1_MIAV1_MIWT2_2_MO40_NTn1_NTA0_NTB0_NTC0_NTD0_NTM0_NEPBS0_NLCA1_NLCB1_ONLL0_PGR1_PLR0_PKA0_SIA3_SS0_SU32_SUM1_SUS256_SPO0_SRVW0_SSO0_SVW8_SK0_SKXCCM0_TLDS0_ULSGRO0_USL1_UIOFGRO0_USFGROn1_VSn1_VWA1_VWB1_WSGRA0_WSGRB0_WS32_WG32_4_1_WGM8_WGMXCC1_WGMXCCGn1
    SolutionIndex: 252
    SolutionNameMin: Cijk_Ailk_Bjlk_HSS_BH_Bias_SHB_HA_S_SAB_SCD_SAV_UserArgs_MT128x32x16_MI16x16x1_SN_LDSB1_AFC1_AFEM1_AFEM1_ASEM1_CLR1_CADS0_DTLA0_DTLB0_DTVA0_DTVB0_EPS1_FDSI0_GRPM1_GRVWA4_GRVWB1_GSU1_GSUAMB_GSUC0_GSUWGMRR0_GLS0_ISA1201_IU1_K1_LBSPPA2048_LBSPPB512_LBSPPM0_LPA0_LPB16_LPM0_LRVW8_LWPMn1_MIAV1_MIWT4_1_MO40_NTn1_NTA0_NTB0_NTC0_NTD0_NTM0_NEPBS0_NLCA1_NLCB1_ONLL0_PGR1_PLR1_PKA0_SIA2_SS1_SU32_SUM1_SUS256_SPO0_SRVW0_SSO0_SVW4_SK0_SKXCCM0_TLDS0_ULSGRO0_USL1_UIOFGRO0_USFGROn1_VSn1_VWA4_VWB1_WSGRA0_WSGRB0_WS32_WG32_4_1_WGM8_WGMXCC1_WGMXCCGn1
    SolutionIndex: 254
    SolutionNameMin: Cijk_Ailk_Bjlk_HSS_BH_Bias_SHB_HA_S_SAB_SCD_SAV_UserArgs_MT128x128x16_MI16x16x1_SN_LDSB1_AFC1_AFEM1_AFEM1_ASEM1_CLR1_CADS0_DTLA0_DTLB0_DTVA0_DTVB0_EPS0_FDSI0_GRPM1_GRVWA8_GRVWB8_GSU1_GSUAMB_GSUC0_GSUWGMRR0_GLS0_ISA1201_IU1_K1_LBSPPA2048_LBSPPB2048_LBSPPM0_LPA0_LPB0_LPM0_LRVW8_LWPMn1_MIAV1_MIWT4_4_MO40_NTn1_NTA0_NTB0_NTC0_NTD0_NTM0_NEPBS0_NLCA1_NLCB1_ONLL0_PGR2_PLR1_PKA0_SIA2_SS1_SU32_SUM1_SUS256_SPO0_SRVW0_SSO0_SVW4_SK0_SKXCCM0_TLDS0_ULSGRO0_USL1_UIOFGRO0_USFGROn1_VSn1_VWA4_VWB4_WSGRA0_WSGRB0_WS32_WG32_4_1_WGM8_WGMXCC1_WGMXCCGn1
    SolutionIndex: 257
    SolutionNameMin: Cijk_Ailk_Bjlk_HSS_BH_Bias_SHB_HA_S_SAB_SCD_SAV_UserArgs_MT16x16x64_MI16x16x1_SN_LDSB0_AFC1_AFEM1_AFEM1_ASEM1_CLR1_CADS0_DTLA0_DTLB0_DTVA0_DTVB1_EPS0_FDSI0_GRPM1_GRVWA4_GRVWB8_GSU1_GSUAMB_GSUC0_GSUWGMRR0_GLS0_ISA1201_IU1_K1_LBSPPA256_LBSPPB0_LBSPPM0_LPA16_LPB0_LPM0_LRVW8_LWPMn1_MIAV1_MIWT1_1_MO40_NTn1_NTA0_NTB0_NTC0_NTD0_NTM0_NEPBS0_NLCA1_NLCB1_ONLL0_PGR2_PLR1_PKA0_SIA3_SS0_SU32_SUM1_SUS256_SPO0_SRVW0_SSO0_SVW8_SK0_SKXCCM0_TLDS0_ULSGRO0_USL1_UIOFGRO0_USFGROn1_VSn1_VWA1_VWB1_WSGRA0_WSGRB0_WS32_WG16_2_1_WGM8_WGMXCC1_WGMXCCGn1
    SolutionIndex: 259
    SolutionNameMin: Cijk_Ailk_Bjlk_HSS_BH_Bias_SHB_HA_S_SAB_SCD_SAV_UserArgs_MT16x32x64_MI16x16x1_SN_LDSB1_AFC1_AFEM1_AFEM1_ASEM1_CLR1_CADS0_DTLA0_DTLB0_DTVA0_DTVB0_EPS1_FDSI0_GRPM1_GRVWA4_GRVWB4_GSU1_GSUAMB_GSUC0_GSUWGMRR0_GLS0_ISA1201_IU4_K1_LBSPPA256_LBSPPB512_LBSPPM0_LPA16_LPB16_LPM0_LRVW8_LWPMn1_MIAV1_MIWT1_1_MO40_NTn1_NTA0_NTB0_NTC0_NTD0_NTM0_NEPBS0_NLCA1_NLCB1_ONLL0_PGR1_PLR1_PKA0_SIA2_SS0_SU32_SUM1_SUS256_SPO0_SRVW0_SSO0_SVW8_SK0_SKXCCM0_TLDS0_ULSGRO0_USL1_UIOFGRO0_USFGROn1_VSn1_VWA1_VWB1_WSGRA0_WSGRB0_WS32_WG16_4_1_WGM8_WGMXCC1_WGMXCCGn1
    SolutionIndex: 260
    SolutionNameMin: Cijk_Ailk_Bjlk_HSS_BH_Bias_SHB_HA_S_SAB_SCD_SAV_UserArgs_MT32x32x64_MI16x16x1_SN_LDSB0_AFC1_AFEM1_AFEM1_ASEM1_CLR1_CADS0_DTLA0_DTLB0_DTVA1_DTVB0_EPS0_FDSI0_GRPM1_GRVWA8_GRVWB8_GSU1_GSUAMB_GSUC0_GSUWGMRR0_GLS0_ISA1201_IU1_K1_LBSPPA0_LBSPPB512_LBSPPM0_LPA0_LPB16_LPM0_LRVW8_LWPMn1_MIAV1_MIWT1_1_MO40_NTn1_NTA0_NTB0_NTC0_NTD0_NTM0_NEPBS0_NLCA1_NLCB1_ONLL0_PGR2_PLR1_PKA0_SIA3_SS0_SU32_SUM1_SUS256_SPO0_SRVW0_SSO0_SVW8_SK0_SKXCCM0_TLDS0_ULSGRO0_USL1_UIOFGRO0_USFGROn1_VSn1_VWA1_VWB1_WSGRA0_WSGRB0_WS32_WG32_4_1_WGM8_WGMXCC1_WGMXCCGn1
    SolutionIndex: 261
    SolutionNameMin: Cijk_Ailk_Bjlk_HSS_BH_Bias_SHB_HA_S_SAB_SCD_SAV_UserArgs_MT32x16x128_MI16x16x1_SN_LDSB0_AFC1_AFEM1_AFEM1_ASEM1_CLR1_CADS0_DTLA0_DTLB0_DTVA0_DTVB1_EPS0_FDSI0_GRPM1_GRVWA8_GRVWB8_GSU1_GSUAMB_GSUC0_GSUWGMRR0_GLS0_ISA1201_IU1_K1_LBSPPA512_LBSPPB0_LBSPPM0_LPA16_LPB0_LPM0_LRVW8_LWPMn1_MIAV1_MIWT1_1_MO40_NTn1_NTA0_NTB0_NTC0_NTD0_NTM0_NEPBS0_NLCA1_NLCB1_ONLL0_PGR2_PLR1_PKA0_SIA3_SS0_SU32_SUM1_SUS256_SPO0_SRVW0_SSO0_SVW8_SK0_SKXCCM0_TLDS0_ULSGRO0_USL1_UIOFGRO0_USFGROn1_VSn1_VWA1_VWB1_WSGRA0_WSGRB0_WS32_WG32_2_1_WGM8_WGMXCC1_WGMXCCGn1
    SolutionIndex: 263
    SolutionNameMin: Cijk_Ailk_Bjlk_HSS_BH_Bias_SHB_HA_S_SAB_SCD_SAV_UserArgs_MT32x32x64_MI16x16x1_SN_LDSB0_AFC1_AFEM1_AFEM1_ASEM1_CLR1_CADS0_DTLA0_DTLB0_DTVA0_DTVB0_EPS0_FDSI0_GRPM1_GRVWA8_GRVWB8_GSU1_GSUAMB_GSUC0_GSUWGMRR0_GLS0_ISA1201_IU1_K1_LBSPPA512_LBSPPB512_LBSPPM0_LPA16_LPB16_LPM0_LRVW8_LWPMn1_MIAV1_MIWT1_1_MO40_NTn1_NTA0_NTB0_NTC0_NTD0_NTM0_NEPBS0_NLCA1_NLCB1_ONLL0_PGR2_PLR1_PKA0_SIA3_SS0_SU32_SUM1_SUS256_SPO0_SRVW0_SSO0_SVW8_SK0_SKXCCM0_TLDS0_ULSGRO1_USL1_UIOFGRO0_USFGROn1_VSn1_VWA1_VWB1_WSGRA0_WSGRB0_WS32_WG32_4_1_WGM8_WGMXCC1_WGMXCCGn1
    SolutionIndex: 264
    SolutionNameMin: Cijk_Ailk_Bjlk_HSS_BH_Bias_SHB_HA_S_SAB_SCD_SAV_UserArgs_MT32x32x64_MI16x16x1_SN_LDSB0_AFC1_AFEM1_AFEM1_ASEM1_CLR1_CADS0_DTLA0_DTLB0_DTVA0_DTVB1_EPS0_FDSI0_GRPM1_GRVWA4_GRVWB8_GSU1_GSUAMB_GSUC0_GSUWGMRR0_GLS0_ISA1201_IU1_K1_LBSPPA512_LBSPPB0_LBSPPM0_LPA16_LPB0_LPM0_LRVW8_LWPMn1_MIAV1_MIWT1_1_MO40_NTn1_NTA0_NTB0_NTC0_NTD0_NTM0_NEPBS0_NLCA1_NLCB1_ONLL0_PGR2_PLR1_PKA0_SIA3_SS0_SU32_SUM1_SUS256_SPO0_SRVW0_SSO0_SVW8_SK0_SKXCCM0_TLDS0_ULSGRO0_USL1_UIOFGRO0_USFGROn1_VSn1_VWA1_VWB1_WSGRA0_WSGRB0_WS32_WG32_4_1_WGM8_WGMXCC1_WGMXCCGn1
    SolutionIndex: 265
    SolutionNameMin: Cijk_Ailk_Bjlk_HSS_BH_Bias_SHB_HA_S_SAB_SCD_SAV_UserArgs_MT32x32x64_MI16x16x1_SN_LDSB0_AFC1_AFEM1_AFEM1_ASEM1_CLR1_CADS0_DTLA0_DTLB0_DTVA1_DTVB0_EPS0_FDSI0_GRPM1_GRVWA8_GRVWB4_GSU1_GSUAMB_GSUC0_GSUWGMRR0_GLS0_ISA1201_IU1_K1_LBSPPA0_LBSPPB512_LBSPPM0_LPA0_LPB16_LPM0_LRVW8_LWPMn1_MIAV1_MIWT1_1_MO40_NTn1_NTA0_NTB0_NTC0_NTD0_NTM0_NEPBS0_NLCA1_NLCB1_ONLL0_PGR2_PLR1_PKA0_SIA3_SS0_SU32_SUM1_SUS256_SPO0_SRVW0_SSO0_SVW8_SK0_SKXCCM0_TLDS0_ULSGRO0_USL1_UIOFGRO0_USFGROn1_VSn1_VWA1_VWB1_WSGRA0_WSGRB0_WS32_WG32_4_1_WGM8_WGMXCC1_WGMXCCGn1
    SolutionIndex: 266
    SolutionNameMin: Cijk_Ailk_Bjlk_HSS_BH_Bias_SHB_HA_S_SAB_SCD_SAV_UserArgs_MT32x32x64_MI16x16x1_SN_LDSB0_AFC1_AFEM1_AFEM1_ASEM1_CLR1_CADS0_DTLA0_DTLB0_DTVA1_DTVB0_EPS0_FDSI0_GRPM1_GRVWA8_GRVWB8_GSU1_GSUAMB_GSUC0_GSUWGMRR0_GLS0_ISA1201_IU1_K1_LBSPPA0_LBSPPB512_LBSPPM0_LPA0_LPB16_LPM0_LRVW8_LWPMn1_MIAV1_MIWT1_1_MO40_NTn1_NTA0_NTB0_NTC0_NTD0_NTM0_NEPBS0_NLCA1_NLCB1_ONLL0_PGR2_PLR1_PKA0_SIA3_SS1_SU32_SUM1_SUS256_SPO0_SRVW0_SSO0_SVW1_SK0_SKXCCM0_TLDS0_ULSGRO0_USL1_UIOFGRO0_USFGROn1_VSn1_VWA1_VWB1_WSGRA0_WSGRB0_WS32_WG32_4_1_WGM8_WGMXCC1_WGMXCCGn1
    SolutionIndex: 267
    SolutionNameMin: Cijk_Ailk_Bjlk_HSS_BH_Bias_SHB_HA_S_SAB_SCD_SAV_UserArgs_MT32x32x64_MI16x16x1_SN_LDSB0_AFC1_AFEM1_AFEM1_ASEM1_CLR1_CADS0_DTLA0_DTLB0_DTVA0_DTVB1_EPS0_FDSI0_GRPM1_GRVWA8_GRVWB8_GSU1_GSUAMB_GSUC0_GSUWGMRR0_GLS0_ISA1201_IU1_K1_LBSPPA512_LBSPPB0_LBSPPM0_LPA16_LPB0_LPM0_LRVW8_LWPMn1_MIAV1_MIWT1_1_MO40_NTn1_NTA0_NTB0_NTC0_NTD0_NTM0_NEPBS0_NLCA1_NLCB1_ONLL0_PGR2_PLR1_PKA0_SIA3_SS0_SU32_SUM1_SUS256_SPO0_SRVW0_SSO0_SVW8_SK0_SKXCCM0_TLDS0_ULSGRO0_USL1_UIOFGRO0_USFGROn1_VSn1_VWA1_VWB1_WSGRA0_WSGRB0_WS32_WG32_4_1_WGM8_WGMXCC1_WGMXCCGn1
    SolutionIndex: 268
    SolutionNameMin: Cijk_Ailk_Bjlk_HSS_BH_Bias_SHB_HA_S_SAB_SCD_SAV_UserArgs_MT32x32x128_MI16x16x1_SN_LDSB0_AFC1_AFEM1_AFEM1_ASEM1_CLR1_CADS0_DTLA0_DTLB0_DTVA0_DTVB1_EPS0_FDSI0_GRPM1_GRVWA8_GRVWB8_GSU1_GSUAMB_GSUC0_GSUWGMRR0_GLS0_ISA1201_IU1_K1_LBSPPA512_LBSPPB0_LBSPPM0_LPA16_LPB0_LPM0_LRVW8_LWPMn1_MIAV1_MIWT1_1_MO40_NTn1_NTA0_NTB0_NTC0_NTD0_NTM0_NEPBS0_NLCA1_NLCB1_ONLL0_PGR2_PLR1_PKA0_SIA3_SS0_SU32_SUM1_SUS256_SPO0_SRVW0_SSO0_SVW8_SK0_SKXCCM0_TLDS0_ULSGRO0_USL1_UIOFGRO0_USFGROn1_VSn1_VWA1_VWB1_WSGRA0_WSGRB0_WS32_WG32_4_1_WGM8_WGMXCC1_WGMXCCGn1
    SolutionIndex: 269
    SolutionNameMin: Cijk_Ailk_Bjlk_HSS_BH_Bias_SHB_HA_S_SAB_SCD_SAV_UserArgs_MT32x32x128_MI16x16x1_SN_LDSB0_AFC1_AFEM1_AFEM1_ASEM1_CLR1_CADS0_DTLA0_DTLB0_DTVA1_DTVB0_EPS1_FDSI0_GRPM1_GRVWA8_GRVWB8_GSU1_GSUAMB_GSUC0_GSUWGMRR0_GLS0_ISA1201_IU1_K1_LBSPPA0_LBSPPB512_LBSPPM0_LPA0_LPB16_LPM0_LRVW8_LWPMn1_MIAV1_MIWT1_1_MO40_NTn1_NTA0_NTB0_NTC0_NTD0_NTM0_NEPBS0_NLCA1_NLCB1_ONLL0_PGR1_PLR1_PKA0_SIA3_SS0_SU32_SUM1_SUS256_SPO0_SRVW0_SSO0_SVW8_SK0_SKXCCM0_TLDS0_ULSGRO0_USL1_UIOFGRO0_USFGROn1_VSn1_VWA1_VWB1_WSGRA0_WSGRB0_WS32_WG32_4_1_WGM8_WGMXCC1_WGMXCCGn1
    SolutionIndex: 271
    SolutionNameMin: Cijk_Ailk_Bjlk_HSS_BH_Bias_SHB_HA_S_SAB_SCD_SAV_UserArgs_MT32x32x128_MI16x16x1_SN_LDSB0_AFC1_AFEM1_AFEM1_ASEM1_CLR1_CADS0_DTLA0_DTLB0_DTVA0_DTVB1_EPS0_FDSI0_GRPM1_GRVWA4_GRVWB8_GSU1_GSUAMB_GSUC0_GSUWGMRR0_GLS0_ISA1201_IU1_K1_LBSPPA512_LBSPPB0_LBSPPM0_LPA16_LPB0_LPM0_LRVW8_LWPMn1_MIAV1_MIWT1_1_MO40_NTn1_NTA0_NTB0_NTC0_NTD0_NTM0_NEPBS0_NLCA1_NLCB1_ONLL0_PGR2_PLR1_PKA0_SIA3_SS0_SU32_SUM1_SUS256_SPO0_SRVW0_SSO0_SVW8_SK0_SKXCCM0_TLDS0_ULSGRO0_USL1_UIOFGRO0_USFGROn1_VSn1_VWA1_VWB1_WSGRA0_WSGRB0_WS32_WG32_4_1_WGM8_WGMXCC1_WGMXCCGn1
    SolutionIndex: 272
    SolutionNameMin: Cijk_Ailk_Bjlk_HSS_BH_Bias_SHB_HA_S_SAB_SCD_SAV_UserArgs_MT32x32x64_MI16x16x1_SN_LDSB0_AFC1_AFEM1_AFEM1_ASEM1_CLR1_CADS0_DTLA0_DTLB0_DTVA1_DTVB0_EPS0_FDSI0_GRPM1_GRVWA8_GRVWB4_GSU1_GSUAMB_GSUC0_GSUWGMRR0_GLS0_ISA1201_IU1_K1_LBSPPA0_LBSPPB512_LBSPPM0_LPA0_LPB16_LPM0_LRVW8_LWPMn1_MIAV1_MIWT1_1_MO40_NTn1_NTA0_NTB0_NTC0_NTD0_NTM0_NEPBS0_NLCA1_NLCB1_ONLL0_PGR2_PLR1_PKA0_SIA3_SS1_SU32_SUM1_SUS256_SPO0_SRVW0_SSO0_SVW1_SK0_SKXCCM0_TLDS0_ULSGRO0_USL1_UIOFGRO0_USFGROn1_VSn1_VWA1_VWB1_WSGRA0_WSGRB0_WS32_WG32_4_1_WGM8_WGMXCC1_WGMXCCGn1
    SolutionIndex: 273
    SolutionNameMin: Cijk_Ailk_Bjlk_HSS_BH_Bias_SHB_HA_S_SAB_SCD_SAV_UserArgs_MT32x32x64_MI16x16x1_SN_LDSB0_AFC1_AFEM1_AFEM1_ASEM1_CLR1_CADS0_DTLA0_DTLB0_DTVA0_DTVB1_EPS0_FDSI0_GRPM1_GRVWA4_GRVWB8_GSU1_GSUAMB_GSUC0_GSUWGMRR0_GLS0_ISA1201_IU1_K1_LBSPPA512_LBSPPB0_LBSPPM0_LPA16_LPB0_LPM0_LRVW8_LWPMn1_MIAV1_MIWT1_1_MO40_NTn1_NTA0_NTB0_NTC0_NTD0_NTM0_NEPBS0_NLCA1_NLCB1_ONLL0_PGR2_PLR1_PKA0_SIA3_SS1_SU32_SUM1_SUS256_SPO0_SRVW0_SSO0_SVW1_SK0_SKXCCM0_TLDS0_ULSGRO0_USL1_UIOFGRO0_USFGROn1_VSn1_VWA1_VWB1_WSGRA0_WSGRB0_WS32_WG32_4_1_WGM8_WGMXCC1_WGMXCCGn1
    SolutionIndex: 275
    SolutionNameMin: Cijk_Ailk_Bjlk_HSS_BH_Bias_SHB_HA_S_SAB_SCD_SAV_UserArgs_MT32x128x64_MI16x16x1_SN_LDSB0_AFC1_AFEM1_AFEM1_ASEM1_CLR1_CADS0_DTLA0_DTLB0_DTVA0_DTVB1_EPS1_FDSI0_GRPM1_GRVWA4_GRVWB8_GSU1_GSUAMB_GSUC0_GSUWGMRR0_GLS0_ISA1201_IU1_K1_LBSPPA512_LBSPPB0_LBSPPM0_LPA16_LPB0_LPM0_LRVW8_LWPMn1_MIAV1_MIWT1_4_MO40_NTn1_NTA0_NTB0_NTC0_NTD0_NTM0_NEPBS0_NLCA1_NLCB4_ONLL0_PGR1_PLR1_PKA0_SIA3_SS0_SU32_SUM1_SUS256_SPO0_SRVW0_SSO0_SVW8_SK0_SKXCCM0_TLDS0_ULSGRO0_USL1_UIOFGRO0_USFGROn1_VSn1_VWA1_VWB1_WSGRA0_WSGRB0_WS32_WG32_4_1_WGM8_WGMXCC1_WGMXCCGn1
    SolutionIndex: 276
    SolutionNameMin: Cijk_Ailk_Bjlk_HSS_BH_Bias_SHB_HA_S_SAB_SCD_SAV_UserArgs_MT32x128x64_MI16x16x1_SN_LDSB0_AFC1_AFEM1_AFEM1_ASEM1_CLR1_CADS0_DTLA0_DTLB0_DTVA0_DTVB1_EPS1_FDSI0_GRPM1_GRVWA8_GRVWB8_GSU1_GSUAMB_GSUC0_GSUWGMRR0_GLS0_ISA1201_IU1_K1_LBSPPA512_LBSPPB0_LBSPPM0_LPA16_LPB0_LPM0_LRVW8_LWPMn1_MIAV1_MIWT1_4_MO40_NTn1_NTA0_NTB0_NTC0_NTD0_NTM0_NEPBS0_NLCA1_NLCB4_ONLL0_PGR1_PLR1_PKA0_SIA3_SS0_SU32_SUM1_SUS256_SPO0_SRVW0_SSO0_SVW8_SK0_SKXCCM0_TLDS0_ULSGRO0_USL1_UIOFGRO0_USFGROn1_VSn1_VWA1_VWB1_WSGRA0_WSGRB0_WS32_WG32_4_1_WGM8_WGMXCC1_WGMXCCGn1
    SolutionIndex: 278
    SolutionNameMin: Cijk_Ailk_Bjlk_HSS_BH_Bias_SHB_HA_S_SAB_SCD_SAV_UserArgs_MT32x32x128_MI16x16x1_SN_LDSB0_AFC1_AFEM1_AFEM1_ASEM1_CLR1_CADS0_DTLA0_DTLB0_DTVA1_DTVB0_EPS0_FDSI0_GRPM1_GRVWA8_GRVWB8_GSU1_GSUAMB_GSUC0_GSUWGMRR0_GLS0_ISA1201_IU1_K1_LBSPPA0_LBSPPB512_LBSPPM0_LPA0_LPB16_LPM0_LRVW8_LWPMn1_MIAV1_MIWT1_1_MO40_NTn1_NTA0_NTB0_NTC0_NTD0_NTM0_NEPBS0_NLCA1_NLCB1_ONLL0_PGR2_PLR1_PKA0_SIA3_SS0_SU32_SUM1_SUS256_SPO0_SRVW0_SSO0_SVW8_SK0_SKXCCM0_TLDS0_ULSGRO0_USL1_UIOFGRO0_USFGROn1_VSn1_VWA1_VWB1_WSGRA0_WSGRB0_WS32_WG32_4_1_WGM8_WGMXCC1_WGMXCCGn1
    SolutionIndex: 279
    SolutionNameMin: Cijk_Ailk_Bjlk_HSS_BH_Bias_SHB_HA_S_SAB_SCD_SAV_UserArgs_MT64x64x64_MI16x16x1_SN_LDSB0_AFC1_AFEM1_AFEM1_ASEM1_CLR1_CADS0_DTLA0_DTLB0_DTVA0_DTVB1_EPS1_FDSI0_GRPM1_GRVWA8_GRVWB8_GSU1_GSUAMB_GSUC0_GSUWGMRR0_GLS0_ISA1201_IU1_K1_LBSPPA1024_LBSPPB0_LBSPPM0_LPA32_LPB0_LPM0_LRVW8_LWPMn1_MIAV1_MIWT2_2_MO40_NTn1_NTA0_NTB0_NTC0_NTD0_NTM0_NEPBS0_NLCA1_NLCB4_ONLL0_PGR1_PLR1_PKA0_SIA3_SS1_SU32_SUM1_SUS256_SPO0_SRVW0_SSO0_SVW2_SK0_SKXCCM0_TLDS0_ULSGRO0_USL1_UIOFGRO0_USFGROn1_VSn1_VWA2_VWB1_WSGRA0_WSGRB0_WS32_WG32_4_1_WGM8_WGMXCC1_WGMXCCGn1
    SolutionIndex: 281
    SolutionNameMin: Cijk_Ailk_Bjlk_HSS_BH_Bias_SHB_HA_S_SAB_SCD_SAV_UserArgs_MT32x32x128_MI16x16x1_SN_LDSB0_AFC1_AFEM1_AFEM1_ASEM1_CLR1_CADS0_DTLA0_DTLB0_DTVA1_DTVB0_EPS0_FDSI0_GRPM1_GRVWA8_GRVWB4_GSU1_GSUAMB_GSUC0_GSUWGMRR0_GLS0_ISA1201_IU1_K1_LBSPPA0_LBSPPB512_LBSPPM0_LPA0_LPB16_LPM0_LRVW8_LWPMn1_MIAV1_MIWT1_1_MO40_NTn1_NTA0_NTB0_NTC0_NTD0_NTM0_NEPBS0_NLCA1_NLCB1_ONLL0_PGR2_PLR1_PKA0_SIA3_SS1_SU32_SUM1_SUS256_SPO0_SRVW0_SSO0_SVW1_SK0_SKXCCM0_TLDS0_ULSGRO0_USL1_UIOFGRO0_USFGROn1_VSn1_VWA1_VWB1_WSGRA0_WSGRB0_WS32_WG32_4_1_WGM8_WGMXCC1_WGMXCCGn1
    SolutionIndex: 282
    SolutionNameMin: Cijk_Ailk_Bjlk_HSS_BH_Bias_SHB_HA_S_SAB_SCD_SAV_UserArgs_MT64x64x32_MI16x16x1_SN_LDSB0_AFC1_AFEM1_AFEM1_ASEM1_CLR1_CADS0_DTLA0_DTLB0_DTVA1_DTVB0_EPS0_FDSI0_GRPM1_GRVWA8_GRVWB4_GSU1_GSUAMB_GSUC0_GSUWGMRR0_GLS0_ISA1201_IU1_K1_LBSPPA0_LBSPPB1024_LBSPPM0_LPA0_LPB32_LPM0_LRVW8_LWPMn1_MIAV1_MIWT2_2_MO40_NTn1_NTA0_NTB0_NTC0_NTD0_NTM0_NEPBS0_NLCA2_NLCB1_ONLL0_PGR2_PLR1_PKA0_SIA3_SS0_SU32_SUM1_SUS256_SPO0_SRVW0_SSO0_SVW8_SK0_SKXCCM0_TLDS0_ULSGRO0_USL1_UIOFGRO0_USFGROn1_VSn1_VWA1_VWB2_WSGRA0_WSGRB0_WS32_WG32_4_1_WGM8_WGMXCC1_WGMXCCGn1
    SolutionIndex: 283
    SolutionNameMin: Cijk_Ailk_Bjlk_HSS_BH_Bias_SHB_HA_S_SAB_SCD_SAV_UserArgs_MT64x64x64_MI16x16x1_SN_LDSB1_AFC1_AFEM1_AFEM1_ASEM1_CLR1_CADS0_DTLA0_DTLB0_DTVA0_DTVB0_EPS1_FDSI0_GRPM1_GRVWA4_GRVWB8_GSU1_GSUAMB_GSUC0_GSUWGMRR0_GLS0_ISA1201_IU4_K1_LBSPPA1024_LBSPPB1024_LBSPPM0_LPA32_LPB32_LPM0_LRVW8_LWPMn1_MIAV1_MIWT2_2_MO40_NTn1_NTA0_NTB0_NTC0_NTD0_NTM0_NEPBS0_NLCA1_NLCB1_ONLL0_PGR1_PLR1_PKA0_SIA2_SS1_SU32_SUM1_SUS256_SPO0_SRVW0_SSO0_SVW2_SK0_SKXCCM0_TLDS0_ULSGRO0_USL1_UIOFGRO0_USFGROn1_VSn1_VWA2_VWB2_WSGRA0_WSGRB0_WS32_WG32_4_1_WGM8_WGMXCC1_WGMXCCGn1
    SolutionIndex: 284
    SolutionNameMin: Cijk_Ailk_Bjlk_HSS_BH_Bias_SHB_HA_S_SAB_SCD_SAV_UserArgs_MT64x64x32_MI16x16x1_SN_LDSB0_AFC1_AFEM1_AFEM1_ASEM1_CLR1_CADS0_DTLA0_DTLB0_DTVA0_DTVB1_EPS0_FDSI0_GRPM1_GRVWA4_GRVWB8_GSU1_GSUAMB_GSUC0_GSUWGMRR0_GLS0_ISA1201_IU1_K1_LBSPPA1024_LBSPPB0_LBSPPM0_LPA32_LPB0_LPM0_LRVW8_LWPMn1_MIAV1_MIWT2_2_MO40_NTn1_NTA0_NTB0_NTC0_NTD0_NTM0_NEPBS0_NLCA1_NLCB2_ONLL0_PGR2_PLR1_PKA0_SIA3_SS1_SU32_SUM1_SUS256_SPO0_SRVW0_SSO0_SVW2_SK0_SKXCCM0_TLDS0_ULSGRO0_USL1_UIOFGRO0_USFGROn1_VSn1_VWA2_VWB1_WSGRA0_WSGRB0_WS32_WG32_4_1_WGM8_WGMXCC1_WGMXCCGn1
    SolutionIndex: 286
    SolutionNameMin: Cijk_Ailk_Bjlk_HSS_BH_Bias_SHB_HA_S_SAB_SCD_SAV_UserArgs_MT64x64x32_MI16x16x1_SN_LDSB0_AFC1_AFEM1_AFEM1_ASEM1_CLR1_CADS0_DTLA0_DTLB0_DTVA0_DTVB1_EPS0_FDSI0_GRPM1_GRVWA8_GRVWB8_GSU1_GSUAMB_GSUC0_GSUWGMRR0_GLS0_ISA1201_IU1_K1_LBSPPA1024_LBSPPB0_LBSPPM0_LPA32_LPB0_LPM0_LRVW8_LWPMn1_MIAV1_MIWT2_2_MO40_NTn1_NTA0_NTB0_NTC0_NTD0_NTM0_NEPBS0_NLCA1_NLCB2_ONLL0_PGR2_PLR1_PKA0_SIA3_SS1_SU32_SUM1_SUS256_SPO0_SRVW0_SSO0_SVW2_SK0_SKXCCM0_TLDS0_ULSGRO0_USL1_UIOFGRO0_USFGROn1_VSn1_VWA2_VWB1_WSGRA0_WSGRB0_WS32_WG32_4_1_WGM8_WGMXCC1_WGMXCCGn1
    SolutionIndex: 287
    SolutionNameMin: Cijk_Ailk_Bjlk_HSS_BH_Bias_SHB_HA_S_SAB_SCD_SAV_UserArgs_MT64x64x16_MI16x16x1_SN_LDSB0_AFC1_AFEM1_AFEM1_ASEM1_CLR1_CADS0_DTLA0_DTLB0_DTVA1_DTVB1_EPS0_FDSI0_GRPM1_GRVWA8_GRVWB8_GSU1_GSUAMB_GSUC0_GSUWGMRR0_GLS0_ISA1201_IU1_K1_LBSPPA0_LBSPPB0_LBSPPM0_LPA0_LPB0_LPM0_LRVW8_LWPMn1_MIAV1_MIWT2_2_MO40_NTn1_NTA0_NTB0_NTC0_NTD0_NTM0_NEPBS0_NLCA1_NLCB1_ONLL0_PGR1_PLR0_PKA0_SIA3_SS1_SU32_SUM1_SUS256_SPO0_SRVW0_SSO0_SVW1_SK0_SKXCCM0_TLDS0_ULSGRO0_USL1_UIOFGRO0_USFGROn1_VSn1_VWA1_VWB1_WSGRA0_WSGRB0_WS32_WG32_4_1_WGM8_WGMXCC1_WGMXCCGn1
    SolutionIndex: 288
    SolutionNameMin: Cijk_Ailk_Bjlk_HSS_BH_Bias_SHB_HA_S_SAB_SCD_SAV_UserArgs_MT32x32x128_MI16x16x1_SN_LDSB0_AFC1_AFEM1_AFEM1_ASEM1_CLR1_CADS0_DTLA0_DTLB0_DTVA1_DTVB0_EPS0_FDSI0_GRPM1_GRVWA8_GRVWB4_GSU1_GSUAMB_GSUC0_GSUWGMRR0_GLS0_ISA1201_IU1_K1_LBSPPA0_LBSPPB512_LBSPPM0_LPA0_LPB16_LPM0_LRVW8_LWPMn1_MIAV1_MIWT1_1_MO40_NTn1_NTA0_NTB0_NTC0_NTD0_NTM0_NEPBS0_NLCA1_NLCB1_ONLL0_PGR2_PLR1_PKA0_SIA3_SS0_SU32_SUM1_SUS256_SPO0_SRVW0_SSO0_SVW8_SK0_SKXCCM0_TLDS0_ULSGRO0_USL1_UIOFGRO0_USFGROn1_VSn1_VWA1_VWB1_WSGRA0_WSGRB0_WS32_WG32_4_1_WGM8_WGMXCC1_WGMXCCGn1
    SolutionIndex: 289
    SolutionNameMin: Cijk_Ailk_Bjlk_HSS_BH_Bias_SHB_HA_S_SAB_SCD_SAV_UserArgs_MT64x64x32_MI16x16x1_SN_LDSB0_AFC1_AFEM1_AFEM1_ASEM1_CLR1_CADS0_DTLA0_DTLB0_DTVA1_DTVB1_EPS0_FDSI0_GRPM1_GRVWA8_GRVWB8_GSU1_GSUAMB_GSUC0_GSUWGMRR0_GLS0_ISA1201_IU1_K1_LBSPPA0_LBSPPB0_LBSPPM0_LPA0_LPB0_LPM0_LRVW8_LWPMn1_MIAV1_MIWT2_2_MO40_NTn1_NTA0_NTB0_NTC0_NTD0_NTM0_NEPBS0_NLCA2_NLCB2_ONLL0_PGR1_PLR0_PKA0_SIA3_SS1_SU32_SUM1_SUS256_SPO0_SRVW0_SSO0_SVW1_SK0_SKXCCM0_TLDS0_ULSGRO0_USL1_UIOFGRO0_USFGROn1_VSn1_VWA1_VWB1_WSGRA0_WSGRB0_WS32_WG32_4_1_WGM8_WGMXCC1_WGMXCCGn1
    SolutionIndex: 290
    SolutionNameMin: Cijk_Ailk_Bjlk_HSS_BH_Bias_SHB_HA_S_SAB_SCD_SAV_UserArgs_MT64x64x32_MI16x16x1_SN_LDSB0_AFC1_AFEM1_AFEM1_ASEM1_CLR1_CADS0_DTLA0_DTLB0_DTVA1_DTVB1_EPS0_FDSI0_GRPM1_GRVWA8_GRVWB8_GSU1_GSUAMB_GSUC0_GSUWGMRR0_GLS0_ISA1201_IU1_K1_LBSPPA0_LBSPPB0_LBSPPM0_LPA0_LPB0_LPM0_LRVW8_LWPMn1_MIAV1_MIWT2_2_MO40_NTn1_NTA0_NTB0_NTC0_NTD0_NTM0_NEPBS0_NLCA2_NLCB2_ONLL0_PGR1_PLR0_PKA0_SIA3_SS0_SU32_SUM1_SUS256_SPO0_SRVW0_SSO0_SVW8_SK0_SKXCCM0_TLDS0_ULSGRO0_USL1_UIOFGRO0_USFGROn1_VSn1_VWA1_VWB1_WSGRA0_WSGRB0_WS32_WG32_4_1_WGM8_WGMXCC1_WGMXCCGn1
    SolutionIndex: 292
    SolutionNameMin: Cijk_Ailk_Bjlk_HSS_BH_Bias_SHB_HA_S_SAB_SCD_SAV_UserArgs_MT64x64x64_MI16x16x1_SN_LDSB0_AFC1_AFEM1_AFEM1_ASEM1_CLR1_CADS0_DTLA0_DTLB0_DTVA0_DTVB1_EPS0_FDSI0_GRPM1_GRVWA4_GRVWB8_GSU1_GSUAMB_GSUC0_GSUWGMRR0_GLS0_ISA1201_IU1_K1_LBSPPA1024_LBSPPB0_LBSPPM0_LPA32_LPB0_LPM0_LRVW8_LWPMn1_MIAV1_MIWT2_2_MO40_NTn1_NTA0_NTB0_NTC0_NTD0_NTM0_NEPBS0_NLCA1_NLCB4_ONLL0_PGR2_PLR1_PKA0_SIA3_SS1_SU32_SUM1_SUS256_SPO0_SRVW0_SSO0_SVW2_SK0_SKXCCM0_TLDS0_ULSGRO0_USL1_UIOFGRO0_USFGROn1_VSn1_VWA2_VWB1_WSGRA0_WSGRB0_WS32_WG32_4_1_WGM8_WGMXCC1_WGMXCCGn1
    SolutionIndex: 293
    SolutionNameMin: Cijk_Ailk_Bjlk_HSS_BH_Bias_SHB_HA_S_SAB_SCD_SAV_UserArgs_MT64x64x32_MI16x16x1_SN_LDSB0_AFC1_AFEM1_AFEM1_ASEM1_CLR1_CADS0_DTLA0_DTLB0_DTVA0_DTVB1_EPS1_FDSI0_GRPM1_GRVWA8_GRVWB8_GSU1_GSUAMB_GSUC0_GSUWGMRR0_GLS0_ISA1201_IU1_K1_LBSPPA1024_LBSPPB0_LBSPPM0_LPA32_LPB0_LPM0_LRVW8_LWPMn1_MIAV1_MIWT2_2_MO40_NTn1_NTA0_NTB0_NTC0_NTD0_NTM0_NEPBS0_NLCA1_NLCB2_ONLL0_PGR1_PLR1_PKA0_SIA3_SS1_SU32_SUM1_SUS256_SPO0_SRVW0_SSO0_SVW2_SK0_SKXCCM0_TLDS0_ULSGRO0_USL1_UIOFGRO0_USFGROn1_VSn1_VWA2_VWB1_WSGRA0_WSGRB0_WS32_WG32_4_1_WGM8_WGMXCC1_WGMXCCGn1
    SolutionIndex: 294
    SolutionNameMin: Cijk_Ailk_Bjlk_HSS_BH_Bias_SHB_HA_S_SAB_SCD_SAV_UserArgs_MT16x256x16_MI16x16x1_SN_LDSB0_AFC1_AFEM1_AFEM1_ASEM1_CLR1_CADS0_DTLA0_DTLB0_DTVA1_DTVB1_EPS0_FDSI0_GRPM1_GRVWA8_GRVWB8_GSU1_GSUAMB_GSUC0_GSUWGMRR0_GLS0_ISA1201_IU1_K1_LBSPPA0_LBSPPB0_LBSPPM0_LPA0_LPB0_LPM0_LRVW8_LWPMn1_MIAV1_MIWT1_8_MO40_NTn1_NTA0_NTB0_NTC0_NTD0_NTM0_NEPBS0_NLCA1_NLCB1_ONLL0_PGR1_PLR0_PKA0_SIA3_SS0_SU32_SUM1_SUS256_SPO0_SRVW0_SSO0_SVW8_SK0_SKXCCM0_TLDS0_ULSGRO0_USL1_UIOFGRO0_USFGROn1_VSn1_VWA1_VWB1_WSGRA0_WSGRB0_WS32_WG16_4_1_WGM8_WGMXCC1_WGMXCCGn1
    SolutionIndex: 296
    SolutionNameMin: Cijk_Ailk_Bjlk_HSS_BH_Bias_SHB_HA_S_SAB_SCD_SAV_UserArgs_MT64x128x32_MI16x16x1_SN_LDSB0_AFC1_AFEM1_AFEM1_ASEM1_CLR1_CADS0_DTLA0_DTLB0_DTVA0_DTVB1_EPS0_FDSI0_GRPM1_GRVWA4_GRVWB8_GSU1_GSUAMB_GSUC0_GSUWGMRR0_GLS0_ISA1201_IU1_K1_LBSPPA1024_LBSPPB0_LBSPPM0_LPA16_LPB0_LPM0_LRVW8_LWPMn1_MIAV1_MIWT1_8_MO40_NTn1_NTA0_NTB0_NTC0_NTD0_NTM0_NEPBS0_NLCA1_NLCB2_ONLL0_PGR2_PLR1_PKA0_SIA3_SS0_SU32_SUM1_SUS256_SPO0_SRVW0_SSO0_SVW8_SK0_SKXCCM0_TLDS0_ULSGRO0_USL1_UIOFGRO0_USFGROn1_VSn1_VWA1_VWB1_WSGRA0_WSGRB0_WS32_WG64_2_1_WGM8_WGMXCC1_WGMXCCGn1
    SolutionIndex: 297
    SolutionNameMin: Cijk_Ailk_Bjlk_HSS_BH_Bias_SHB_HA_S_SAB_SCD_SAV_UserArgs_MT16x32x128_MI16x16x1_SN_LDSB0_AFC1_AFEM1_AFEM1_ASEM1_CLR1_CADS0_DTLA0_DTLB0_DTVA0_DTVB1_EPS0_FDSI0_GRPM1_GRVWA4_GRVWB8_GSU1_GSUAMB_GSUC0_GSUWGMRR0_GLS0_ISA1201_IU1_K1_LBSPPA256_LBSPPB0_LBSPPM0_LPA16_LPB0_LPM0_LRVW8_LWPMn1_MIAV1_MIWT1_1_MO40_NTn1_NTA0_NTB0_NTC0_NTD0_NTM0_NEPBS0_NLCA1_NLCB1_ONLL0_PGR2_PLR1_PKA0_SIA3_SS0_SU32_SUM1_SUS256_SPO0_SRVW0_SSO0_SVW8_SK0_SKXCCM0_TLDS0_ULSGRO0_USL1_UIOFGRO0_USFGROn1_VSn1_VWA1_VWB1_WSGRA0_WSGRB0_WS32_WG16_4_1_WGM8_WGMXCC1_WGMXCCGn1
    SolutionIndex: 298
    SolutionNameMin: Cijk_Ailk_Bjlk_HSS_BH_Bias_SHB_HA_S_SAB_SCD_SAV_UserArgs_MT16x32x128_MI16x16x1_SN_LDSB0_AFC1_AFEM1_AFEM1_ASEM1_CLR1_CADS0_DTLA0_DTLB0_DTVA0_DTVB1_EPS0_FDSI0_GRPM1_GRVWA8_GRVWB8_GSU1_GSUAMB_GSUC0_GSUWGMRR0_GLS0_ISA1201_IU1_K1_LBSPPA256_LBSPPB0_LBSPPM0_LPA16_LPB0_LPM0_LRVW8_LWPMn1_MIAV1_MIWT1_1_MO40_NTn1_NTA0_NTB0_NTC0_NTD0_NTM0_NEPBS0_NLCA1_NLCB1_ONLL0_PGR2_PLR1_PKA0_SIA3_SS0_SU32_SUM1_SUS256_SPO0_SRVW0_SSO0_SVW8_SK0_SKXCCM0_TLDS0_ULSGRO0_USL1_UIOFGRO0_USFGROn1_VSn1_VWA1_VWB1_WSGRA0_WSGRB0_WS32_WG16_4_1_WGM8_WGMXCC1_WGMXCCGn1
    SolutionIndex: 299
    SolutionNameMin: Cijk_Ailk_Bjlk_HSS_BH_Bias_SHB_HA_S_SAB_SCD_SAV_UserArgs_MT32x16x128_MI16x16x1_SN_LDSB0_AFC1_AFEM1_AFEM1_ASEM1_CLR1_CADS0_DTLA0_DTLB0_DTVA1_DTVB0_EPS0_FDSI0_GRPM1_GRVWA8_GRVWB8_GSU1_GSUAMB_GSUC0_GSUWGMRR0_GLS0_ISA1201_IU1_K1_LBSPPA0_LBSPPB256_LBSPPM0_LPA0_LPB16_LPM0_LRVW8_LWPMn1_MIAV1_MIWT1_1_MO40_NTn1_NTA0_NTB0_NTC0_NTD0_NTM0_NEPBS0_NLCA1_NLCB1_ONLL0_PGR2_PLR1_PKA0_SIA3_SS0_SU32_SUM1_SUS256_SPO0_SRVW0_SSO0_SVW8_SK0_SKXCCM0_TLDS0_ULSGRO0_USL1_UIOFGRO0_USFGROn1_VSn1_VWA1_VWB1_WSGRA0_WSGRB0_WS32_WG32_2_1_WGM8_WGMXCC1_WGMXCCGn1
    SolutionIndex: 301
    SolutionNameMin: Cijk_Ailk_Bjlk_HSS_BH_Bias_SHB_HA_S_SAB_SCD_SAV_UserArgs_MT32x32x128_MI16x16x1_SN_LDSB0_AFC1_AFEM1_AFEM1_ASEM1_CLR1_CADS0_DTLA0_DTLB0_DTVA0_DTVB1_EPS1_FDSI0_GRPM1_GRVWA8_GRVWB8_GSU1_GSUAMB_GSUC0_GSUWGMRR0_GLS0_ISA1201_IU1_K1_LBSPPA512_LBSPPB0_LBSPPM0_LPA16_LPB0_LPM0_LRVW8_LWPMn1_MIAV1_MIWT1_1_MO40_NTn1_NTA0_NTB0_NTC0_NTD0_NTM0_NEPBS0_NLCA1_NLCB1_ONLL0_PGR1_PLR1_PKA0_SIA3_SS0_SU32_SUM1_SUS256_SPO0_SRVW0_SSO0_SVW8_SK0_SKXCCM0_TLDS0_ULSGRO0_USL1_UIOFGRO0_USFGROn1_VSn1_VWA1_VWB1_WSGRA0_WSGRB0_WS32_WG32_4_1_WGM8_WGMXCC1_WGMXCCGn1
    SolutionIndex: 302
    SolutionNameMin: Cijk_Ailk_Bjlk_HSS_BH_Bias_SHB_HA_S_SAB_SCD_SAV_UserArgs_MT32x32x128_MI16x16x1_SN_LDSB0_AFC1_AFEM1_AFEM1_ASEM1_CLR1_CADS0_DTLA0_DTLB0_DTVA1_DTVB0_EPS1_FDSI0_GRPM1_GRVWA8_GRVWB4_GSU1_GSUAMB_GSUC0_GSUWGMRR0_GLS0_ISA1201_IU1_K1_LBSPPA0_LBSPPB512_LBSPPM0_LPA0_LPB16_LPM0_LRVW8_LWPMn1_MIAV1_MIWT1_1_MO40_NTn1_NTA0_NTB0_NTC0_NTD0_NTM0_NEPBS0_NLCA1_NLCB1_ONLL0_PGR1_PLR1_PKA0_SIA3_SS0_SU32_SUM1_SUS256_SPO0_SRVW0_SSO0_SVW8_SK0_SKXCCM0_TLDS0_ULSGRO0_USL1_UIOFGRO0_USFGROn1_VSn1_VWA1_VWB1_WSGRA0_WSGRB0_WS32_WG32_4_1_WGM8_WGMXCC1_WGMXCCGn1
    SolutionIndex: 305
    SolutionNameMin: Cijk_Ailk_Bjlk_HSS_BH_Bias_SHB_HA_S_SAB_SCD_SAV_UserArgs_MT128x64x32_MI16x16x1_SN_LDSB0_AFC1_AFEM1_AFEM1_ASEM1_CLR1_CADS0_DTLA0_DTLB0_DTVA1_DTVB0_EPS0_FDSI0_GRPM1_GRVWA8_GRVWB8_GSU1_GSUAMB_GSUC0_GSUWGMRR0_GLS0_ISA1201_IU1_K1_LBSPPA0_LBSPPB1024_LBSPPM0_LPA0_LPB16_LPM0_LRVW8_LWPMn1_MIAV1_MIWT8_1_MO40_NTn1_NTA0_NTB0_NTC0_NTD0_NTM0_NEPBS0_NLCA2_NLCB1_ONLL0_PGR2_PLR1_PKA0_SIA3_SS0_SU32_SUM1_SUS256_SPO0_SRVW0_SSO0_SVW8_SK0_SKXCCM0_TLDS0_ULSGRO0_USL1_UIOFGRO0_USFGROn1_VSn1_VWA1_VWB1_WSGRA0_WSGRB0_WS32_WG16_8_1_WGM8_WGMXCC1_WGMXCCGn1
    SolutionIndex: 306
    SolutionNameMin: Cijk_Ailk_Bjlk_HSS_BH_Bias_SHB_HA_S_SAB_SCD_SAV_UserArgs_MT128x128x16_MI16x16x1_SN_LDSB0_AFC1_AFEM1_AFEM1_ASEM1_CLR1_CADS0_DTLA0_DTLB0_DTVA1_DTVB1_EPS0_FDSI0_GRPM1_GRVWA8_GRVWB8_GSU1_GSUAMB_GSUC0_GSUWGMRR0_GLS0_ISA1201_IU1_K1_LBSPPA0_LBSPPB0_LBSPPM0_LPA0_LPB0_LPM0_LRVW8_LWPMn1_MIAV1_MIWT4_4_MO40_NTn1_NTA0_NTB0_NTC0_NTD0_NTM0_NEPBS0_NLCA1_NLCB1_ONLL0_PGR1_PLR0_PKA0_SIA3_SS0_SU32_SUM1_SUS256_SPO0_SRVW0_SSO0_SVW8_SK0_SKXCCM0_TLDS0_ULSGRO0_USL1_UIOFGRO0_USFGROn1_VSn1_VWA1_VWB1_WSGRA0_WSGRB0_WS32_WG32_4_1_WGM8_WGMXCC1_WGMXCCGn1
    SolutionIndex: 309
    SolutionNameMin: Cijk_Ailk_Bjlk_HSS_BH_Bias_SHB_HA_S_SAB_SCD_SAV_UserArgs_MT64x128x32_MI16x16x1_SN_LDSB0_AFC1_AFEM1_AFEM1_ASEM1_CLR1_CADS0_DTLA0_DTLB0_DTVA0_DTVB1_EPS1_FDSI0_GRPM1_GRVWA4_GRVWB8_GSU1_GSUAMB_GSUC0_GSUWGMRR0_GLS0_ISA1201_IU1_K1_LBSPPA1024_LBSPPB0_LBSPPM0_LPA16_LPB0_LPM0_LRVW8_LWPMn1_MIAV1_MIWT1_8_MO40_NTn1_NTA0_NTB0_NTC0_NTD0_NTM0_NEPBS0_NLCA1_NLCB2_ONLL0_PGR1_PLR1_PKA0_SIA3_SS0_SU32_SUM1_SUS256_SPO0_SRVW0_SSO0_SVW8_SK0_SKXCCM0_TLDS0_ULSGRO0_USL1_UIOFGRO0_USFGROn1_VSn1_VWA1_VWB1_WSGRA0_WSGRB0_WS32_WG64_2_1_WGM8_WGMXCC1_WGMXCCGn1
    SolutionIndex: 310
    SolutionNameMin: Cijk_Ailk_Bjlk_HSS_BH_Bias_SHB_HA_S_SAB_SCD_SAV_UserArgs_MT32x32x128_MI16x16x1_SN_LDSB0_AFC1_AFEM1_AFEM1_ASEM1_CLR1_CADS0_DTLA0_DTLB0_DTVA0_DTVB1_EPS0_FDSI0_GRPM1_GRVWA8_GRVWB8_GSU1_GSUAMB_GSUC0_GSUWGMRR0_GLS0_ISA1201_IU1_K1_LBSPPA512_LBSPPB0_LBSPPM0_LPA16_LPB0_LPM0_LRVW8_LWPMn1_MIAV1_MIWT1_1_MO40_NTn1_NTA0_NTB0_NTC0_NTD0_NTM0_NEPBS0_NLCA1_NLCB1_ONLL0_PGR2_PLR1_PKA0_SIA3_SS1_SU32_SUM1_SUS256_SPO0_SRVW0_SSO0_SVW1_SK0_SKXCCM0_TLDS0_ULSGRO0_USL1_UIOFGRO0_USFGROn1_VSn1_VWA1_VWB1_WSGRA0_WSGRB0_WS32_WG32_4_1_WGM8_WGMXCC1_WGMXCCGn1
    SolutionIndex: 313
    SolutionNameMin: Cijk_Ailk_Bjlk_HSS_BH_Bias_SHB_HA_S_SAB_SCD_SAV_UserArgs_MT64x64x64_MI16x16x1_SN_LDSB0_AFC1_AFEM1_AFEM1_ASEM1_CLR1_CADS0_DTLA0_DTLB0_DTVA0_DTVB1_EPS1_FDSI0_GRPM1_GRVWA8_GRVWB8_GSU1_GSUAMB_GSUC0_GSUWGMRR0_GLS0_ISA1201_IU1_K1_LBSPPA1024_LBSPPB0_LBSPPM0_LPA32_LPB0_LPM0_LRVW8_LWPMn1_MIAV1_MIWT2_2_MO40_NTn1_NTA0_NTB0_NTC0_NTD0_NTM0_NEPBS0_NLCA1_NLCB4_ONLL0_PGR1_PLR1_PKA0_SIA3_SS0_SU32_SUM1_SUS256_SPO0_SRVW0_SSO0_SVW8_SK0_SKXCCM0_TLDS0_ULSGRO0_USL1_UIOFGRO0_USFGROn1_VSn1_VWA2_VWB1_WSGRA0_WSGRB0_WS32_WG32_4_1_WGM8_WGMXCC1_WGMXCCGn1
    SolutionIndex: 314
    SolutionNameMin: Cijk_Ailk_Bjlk_HSS_BH_Bias_SHB_HA_S_SAB_SCD_SAV_UserArgs_MT128x64x32_MI16x16x1_SN_LDSB0_AFC1_AFEM1_AFEM1_ASEM1_CLR1_CADS0_DTLA0_DTLB0_DTVA1_DTVB0_EPS0_FDSI0_GRPM1_GRVWA8_GRVWB4_GSU1_GSUAMB_GSUC0_GSUWGMRR0_GLS0_ISA1201_IU1_K1_LBSPPA0_LBSPPB1024_LBSPPM0_LPA0_LPB16_LPM0_LRVW8_LWPMn1_MIAV1_MIWT8_1_MO40_NTn1_NTA0_NTB0_NTC0_NTD0_NTM0_NEPBS0_NLCA2_NLCB1_ONLL0_PGR2_PLR1_PKA0_SIA3_SS0_SU32_SUM1_SUS256_SPO0_SRVW0_SSO0_SVW8_SK0_SKXCCM0_TLDS0_ULSGRO0_USL1_UIOFGRO0_USFGROn1_VSn1_VWA1_VWB1_WSGRA0_WSGRB0_WS32_WG16_8_1_WGM8_WGMXCC1_WGMXCCGn1
    SolutionIndex: 315
    SolutionNameMin: Cijk_Ailk_Bjlk_HSS_BH_Bias_SHB_HA_S_SAB_SCD_SAV_UserArgs_MT64x64x64_MI16x16x1_SN_LDSB0_AFC1_AFEM1_AFEM1_ASEM1_CLR1_CADS0_DTLA0_DTLB0_DTVA0_DTVB1_EPS1_FDSI0_GRPM1_GRVWA4_GRVWB8_GSU1_GSUAMB_GSUC0_GSUWGMRR0_GLS0_ISA1201_IU1_K1_LBSPPA1024_LBSPPB0_LBSPPM0_LPA32_LPB0_LPM0_LRVW8_LWPMn1_MIAV1_MIWT2_2_MO40_NTn1_NTA0_NTB0_NTC0_NTD0_NTM0_NEPBS0_NLCA1_NLCB4_ONLL0_PGR1_PLR1_PKA0_SIA3_SS0_SU32_SUM1_SUS256_SPO0_SRVW0_SSO0_SVW8_SK0_SKXCCM0_TLDS0_ULSGRO0_USL1_UIOFGRO0_USFGROn1_VSn1_VWA2_VWB1_WSGRA0_WSGRB0_WS32_WG32_4_1_WGM8_WGMXCC1_WGMXCCGn1
    SolutionIndex: 316
    SolutionNameMin: Cijk_Ailk_Bjlk_HSS_BH_Bias_SHB_HA_S_SAB_SCD_SAV_UserArgs_MT64x64x64_MI16x16x1_SN_LDSB0_AFC1_AFEM1_AFEM1_ASEM1_CLR1_CADS0_DTLA0_DTLB0_DTVA0_DTVB1_EPS0_FDSI0_GRPM1_GRVWA4_GRVWB8_GSU1_GSUAMB_GSUC0_GSUWGMRR0_GLS0_ISA1201_IU1_K1_LBSPPA1024_LBSPPB0_LBSPPM0_LPA32_LPB0_LPM0_LRVW8_LWPMn1_MIAV1_MIWT2_2_MO40_NTn1_NTA0_NTB0_NTC0_NTD0_NTM0_NEPBS0_NLCA1_NLCB4_ONLL0_PGR2_PLR1_PKA0_SIA3_SS0_SU32_SUM1_SUS256_SPO0_SRVW0_SSO0_SVW8_SK0_SKXCCM0_TLDS0_ULSGRO0_USL1_UIOFGRO0_USFGROn1_VSn1_VWA2_VWB1_WSGRA0_WSGRB0_WS32_WG32_4_1_WGM8_WGMXCC1_WGMXCCGn1
    SolutionIndex: 318
    SolutionNameMin: Cijk_Ailk_Bjlk_HSS_BH_Bias_SHB_HA_S_SAB_SCD_SAV_UserArgs_MT128x128x16_MI16x16x1_SN_LDSB0_AFC1_AFEM1_AFEM1_ASEM1_CLR1_CADS0_DTLA0_DTLB0_DTVA1_DTVB1_EPS0_FDSI0_GRPM1_GRVWA8_GRVWB8_GSU1_GSUAMB_GSUC0_GSUWGMRR0_GLS0_ISA1201_IU1_K1_LBSPPA0_LBSPPB0_LBSPPM0_LPA0_LPB0_LPM0_LRVW8_LWPMn1_MIAV1_MIWT8_2_MO40_NTn1_NTA0_NTB0_NTC0_NTD0_NTM0_NEPBS0_NLCA1_NLCB1_ONLL0_PGR1_PLR0_PKA0_SIA3_SS0_SU32_SUM1_SUS256_SPO0_SRVW0_SSO0_SVW8_SK0_SKXCCM0_TLDS0_ULSGRO0_USL1_UIOFGRO0_USFGROn1_VSn1_VWA1_VWB1_WSGRA0_WSGRB0_WS32_WG16_8_1_WGM8_WGMXCC1_WGMXCCGn1
    SolutionIndex: 319
    SolutionNameMin: Cijk_Ailk_Bjlk_HSS_BH_Bias_SHB_HA_S_SAB_SCD_SAV_UserArgs_MT64x128x32_MI16x16x1_SN_LDSB0_AFC1_AFEM1_AFEM1_ASEM1_CLR1_CADS0_DTLA0_DTLB0_DTVA0_DTVB1_EPS1_FDSI0_GRPM1_GRVWA8_GRVWB8_GSU1_GSUAMB_GSUC0_GSUWGMRR0_GLS0_ISA1201_IU1_K1_LBSPPA1024_LBSPPB0_LBSPPM0_LPA16_LPB0_LPM0_LRVW8_LWPMn1_MIAV1_MIWT1_8_MO40_NTn1_NTA0_NTB0_NTC0_NTD0_NTM0_NEPBS0_NLCA1_NLCB2_ONLL0_PGR1_PLR1_PKA0_SIA3_SS0_SU32_SUM1_SUS256_SPO0_SRVW0_SSO0_SVW8_SK0_SKXCCM0_TLDS0_ULSGRO0_USL1_UIOFGRO0_USFGROn1_VSn1_VWA1_VWB1_WSGRA0_WSGRB0_WS32_WG64_2_1_WGM8_WGMXCC1_WGMXCCGn1
    SolutionIndex: 320
    SolutionNameMin: Cijk_Ailk_Bjlk_HSS_BH_Bias_SHB_HA_S_SAB_SCD_SAV_UserArgs_MT64x128x32_MI16x16x1_SN_LDSB0_AFC1_AFEM1_AFEM1_ASEM1_CLR1_CADS0_DTLA0_DTLB0_DTVA0_DTVB1_EPS0_FDSI0_GRPM1_GRVWA8_GRVWB8_GSU1_GSUAMB_GSUC0_GSUWGMRR0_GLS0_ISA1201_IU1_K1_LBSPPA1024_LBSPPB0_LBSPPM0_LPA16_LPB0_LPM0_LRVW8_LWPMn1_MIAV1_MIWT1_8_MO40_NTn1_NTA0_NTB0_NTC0_NTD0_NTM0_NEPBS0_NLCA1_NLCB2_ONLL0_PGR2_PLR1_PKA0_SIA3_SS0_SU32_SUM1_SUS256_SPO0_SRVW0_SSO0_SVW8_SK0_SKXCCM0_TLDS0_ULSGRO0_USL1_UIOFGRO0_USFGROn1_VSn1_VWA1_VWB1_WSGRA0_WSGRB0_WS32_WG64_2_1_WGM8_WGMXCC1_WGMXCCGn1
    SolutionIndex: 322
    SolutionNameMin: Cijk_Ailk_Bjlk_HSS_BH_Bias_SHB_HA_S_SAB_SCD_SAV_UserArgs_MT16x16x128_MI16x16x1_SN_LDSB1_AFC1_AFEM1_AFEM1_ASEM1_CLR1_CADS0_DTLA0_DTLB0_DTVA0_DTVB0_EPS1_FDSI0_GRPM1_GRVWA8_GRVWB8_GSU1_GSUAMB_GSUC0_GSUWGMRR0_GLS0_ISA1201_IU8_K1_LBSPPA256_LBSPPB256_LBSPPM0_LPA16_LPB16_LPM0_LRVW8_LWPMn1_MIAV1_MIWT1_1_MO40_NTn1_NTA0_NTB0_NTC0_NTD0_NTM0_NEPBS0_NLCA1_NLCB1_ONLL0_PGR1_PLR1_PKA0_SIA2_SS1_SU32_SUM1_SUS256_SPO0_SRVW0_SSO0_SVW1_SK0_SKXCCM0_TLDS0_ULSGRO0_USL1_UIOFGRO0_USFGROn1_VSn1_VWA1_VWB1_WSGRA0_WSGRB0_WS32_WG16_2_1_WGM8_WGMXCC1_WGMXCCGn1
    SolutionIndex: 325
    SolutionNameMin: Cijk_Ailk_Bjlk_HSS_BH_Bias_SHB_HA_S_SAB_SCD_SAV_UserArgs_MT32x128x64_MI16x16x1_SN_LDSB0_AFC1_AFEM1_AFEM1_ASEM1_CLR1_CADS0_DTLA0_DTLB0_DTVA0_DTVB1_EPS0_FDSI0_GRPM1_GRVWA8_GRVWB8_GSU1_GSUAMB_GSUC0_GSUWGMRR0_GLS0_ISA1201_IU1_K1_LBSPPA512_LBSPPB0_LBSPPM0_LPA16_LPB0_LPM0_LRVW8_LWPMn1_MIAV1_MIWT1_4_MO40_NTn1_NTA0_NTB0_NTC0_NTD0_NTM0_NEPBS0_NLCA1_NLCB4_ONLL0_PGR2_PLR1_PKA0_SIA3_SS0_SU32_SUM1_SUS256_SPO0_SRVW0_SSO0_SVW8_SK0_SKXCCM0_TLDS0_ULSGRO0_USL1_UIOFGRO0_USFGROn1_VSn1_VWA1_VWB1_WSGRA0_WSGRB0_WS32_WG32_4_1_WGM8_WGMXCC1_WGMXCCGn1
    SolutionIndex: 326
    SolutionNameMin: Cijk_Ailk_Bjlk_HSS_BH_Bias_SHB_HA_S_SAB_SCD_SAV_UserArgs_MT16x32x128_MI16x16x1_SN_LDSB0_AFC1_AFEM1_AFEM1_ASEM1_CLR1_CADS0_DTLA0_DTLB0_DTVA0_DTVB1_EPS0_FDSI0_GRPM1_GRVWA8_GRVWB8_GSU1_GSUAMB_GSUC0_GSUWGMRR0_GLS0_ISA1201_IU1_K1_LBSPPA256_LBSPPB0_LBSPPM0_LPA16_LPB0_LPM0_LRVW8_LWPMn1_MIAV1_MIWT1_1_MO40_NTn1_NTA0_NTB0_NTC0_NTD0_NTM0_NEPBS0_NLCA1_NLCB1_ONLL0_PGR2_PLR1_PKA0_SIA3_SS1_SU32_SUM1_SUS256_SPO0_SRVW0_SSO0_SVW1_SK0_SKXCCM0_TLDS0_ULSGRO0_USL1_UIOFGRO0_USFGROn1_VSn1_VWA1_VWB1_WSGRA0_WSGRB0_WS32_WG16_4_1_WGM8_WGMXCC1_WGMXCCGn1
    SolutionIndex: 327
    SolutionNameMin: Cijk_Ailk_Bjlk_HSS_BH_Bias_SHB_HA_S_SAB_SCD_SAV_UserArgs_MT32x32x128_MI16x16x1_SN_LDSB0_AFC1_AFEM1_AFEM1_ASEM1_CLR1_CADS0_DTLA0_DTLB0_DTVA0_DTVB1_EPS1_FDSI0_GRPM1_GRVWA4_GRVWB8_GSU1_GSUAMB_GSUC0_GSUWGMRR0_GLS0_ISA1201_IU1_K1_LBSPPA512_LBSPPB0_LBSPPM0_LPA16_LPB0_LPM0_LRVW8_LWPMn1_MIAV1_MIWT1_1_MO40_NTn1_NTA0_NTB0_NTC0_NTD0_NTM0_NEPBS0_NLCA1_NLCB1_ONLL0_PGR1_PLR1_PKA0_SIA3_SS0_SU32_SUM1_SUS256_SPO0_SRVW0_SSO0_SVW8_SK0_SKXCCM0_TLDS0_ULSGRO0_USL1_UIOFGRO0_USFGROn1_VSn1_VWA1_VWB1_WSGRA0_WSGRB0_WS32_WG32_4_1_WGM8_WGMXCC1_WGMXCCGn1
    SolutionIndex: 328
    SolutionNameMin: Cijk_Ailk_Bjlk_HSS_BH_Bias_SHB_HA_S_SAB_SCD_SAV_UserArgs_MT64x64x64_MI16x16x1_SN_LDSB0_AFC1_AFEM1_AFEM1_ASEM1_CLR1_CADS0_DTLA0_DTLB0_DTVA0_DTVB1_EPS0_FDSI0_GRPM1_GRVWA8_GRVWB8_GSU1_GSUAMB_GSUC0_GSUWGMRR0_GLS0_ISA1201_IU1_K1_LBSPPA1024_LBSPPB0_LBSPPM0_LPA32_LPB0_LPM0_LRVW8_LWPMn1_MIAV1_MIWT2_2_MO40_NTn1_NTA0_NTB0_NTC0_NTD0_NTM0_NEPBS0_NLCA1_NLCB4_ONLL0_PGR2_PLR1_PKA0_SIA3_SS0_SU32_SUM1_SUS256_SPO0_SRVW0_SSO0_SVW8_SK0_SKXCCM0_TLDS0_ULSGRO0_USL1_UIOFGRO0_USFGROn1_VSn1_VWA2_VWB1_WSGRA0_WSGRB0_WS32_WG32_4_1_WGM8_WGMXCC1_WGMXCCGn1
    SolutionIndex: 329
    SolutionNameMin: Cijk_Ailk_Bjlk_HSS_BH_Bias_SHB_HA_S_SAB_SCD_SAV_UserArgs_MT128x64x32_MI16x16x1_SN_LDSB0_AFC1_AFEM1_AFEM1_ASEM1_CLR1_CADS0_DTLA0_DTLB0_DTVA1_DTVB0_EPS1_FDSI0_GRPM1_GRVWA8_GRVWB8_GSU1_GSUAMB_GSUC0_GSUWGMRR0_GLS0_ISA1201_IU1_K1_LBSPPA0_LBSPPB1024_LBSPPM0_LPA0_LPB16_LPM0_LRVW8_LWPMn1_MIAV1_MIWT8_1_MO40_NTn1_NTA0_NTB0_NTC0_NTD0_NTM0_NEPBS0_NLCA2_NLCB1_ONLL0_PGR1_PLR1_PKA0_SIA3_SS1_SU32_SUM1_SUS256_SPO0_SRVW0_SSO0_SVW1_SK0_SKXCCM0_TLDS0_ULSGRO0_USL1_UIOFGRO0_USFGROn1_VSn1_VWA1_VWB1_WSGRA0_WSGRB0_WS32_WG16_8_1_WGM8_WGMXCC1_WGMXCCGn1
    SolutionIndex: 330
    SolutionNameMin: Cijk_Ailk_Bjlk_HSS_BH_Bias_SHB_HA_S_SAB_SCD_SAV_UserArgs_MT128x128x16_MI16x16x1_SN_LDSB0_AFC1_AFEM1_AFEM1_ASEM1_CLR1_CADS0_DTLA0_DTLB0_DTVA1_DTVB1_EPS0_FDSI0_GRPM1_GRVWA8_GRVWB8_GSU1_GSUAMB_GSUC0_GSUWGMRR0_GLS0_ISA1201_IU1_K1_LBSPPA0_LBSPPB0_LBSPPM0_LPA0_LPB0_LPM0_LRVW8_LWPMn1_MIAV1_MIWT4_4_MO40_NTn1_NTA0_NTB0_NTC0_NTD0_NTM0_NEPBS0_NLCA1_NLCB1_ONLL0_PGR1_PLR0_PKA0_SIA3_SS1_SU32_SUM1_SUS256_SPO0_SRVW0_SSO0_SVW1_SK0_SKXCCM0_TLDS0_ULSGRO0_USL1_UIOFGRO0_USFGROn1_VSn1_VWA1_VWB1_WSGRA0_WSGRB0_WS32_WG32_4_1_WGM8_WGMXCC1_WGMXCCGn1
    SolutionIndex: 331
    SolutionNameMin: Cijk_Ailk_Bjlk_HSS_BH_Bias_SHB_HA_S_SAB_SCD_SAV_UserArgs_MT16x16x128_MI16x16x1_SN_LDSB1_AFC1_AFEM1_AFEM1_ASEM1_CLR1_CADS0_DTLA0_DTLB0_DTVA0_DTVB0_EPS1_FDSI0_GRPM1_GRVWA4_GRVWB8_GSU1_GSUAMB_GSUC0_GSUWGMRR0_GLS0_ISA1201_IU8_K1_LBSPPA256_LBSPPB256_LBSPPM0_LPA16_LPB16_LPM0_LRVW8_LWPMn1_MIAV1_MIWT1_1_MO40_NTn1_NTA0_NTB0_NTC0_NTD0_NTM0_NEPBS0_NLCA1_NLCB1_ONLL0_PGR1_PLR1_PKA0_SIA2_SS1_SU32_SUM1_SUS256_SPO0_SRVW0_SSO0_SVW1_SK0_SKXCCM0_TLDS0_ULSGRO0_USL1_UIOFGRO0_USFGROn1_VSn1_VWA1_VWB1_WSGRA0_WSGRB0_WS32_WG16_2_1_WGM8_WGMXCC1_WGMXCCGn1
    SolutionIndex: 332
    SolutionNameMin: Cijk_Ailk_Bjlk_HSS_BH_Bias_SHB_HA_S_SAB_SCD_SAV_UserArgs_MT64x64x64_MI16x16x1_SN_LDSB0_AFC1_AFEM1_AFEM1_ASEM1_CLR1_CADS0_DTLA0_DTLB0_DTVA1_DTVB0_EPS0_FDSI0_GRPM1_GRVWA8_GRVWB8_GSU1_GSUAMB_GSUC0_GSUWGMRR0_GLS0_ISA1201_IU1_K1_LBSPPA0_LBSPPB1024_LBSPPM0_LPA0_LPB32_LPM0_LRVW8_LWPMn1_MIAV1_MIWT2_2_MO40_NTn1_NTA0_NTB0_NTC0_NTD0_NTM0_NEPBS0_NLCA4_NLCB1_ONLL0_PGR2_PLR1_PKA0_SIA3_SS1_SU32_SUM1_SUS256_SPO0_SRVW0_SSO0_SVW1_SK0_SKXCCM0_TLDS0_ULSGRO0_USL1_UIOFGRO0_USFGROn1_VSn1_VWA1_VWB2_WSGRA0_WSGRB0_WS32_WG32_4_1_WGM8_WGMXCC1_WGMXCCGn1
    SolutionIndex: 335
    SolutionNameMin: Cijk_Ailk_Bjlk_HSS_BH_Bias_SHB_HA_S_SAB_SCD_SAV_UserArgs_MT128x64x32_MI16x16x1_SN_LDSB0_AFC1_AFEM1_AFEM1_ASEM1_CLR1_CADS0_DTLA0_DTLB0_DTVA1_DTVB0_EPS0_FDSI0_GRPM1_GRVWA8_GRVWB4_GSU1_GSUAMB_GSUC0_GSUWGMRR0_GLS0_ISA1201_IU1_K1_LBSPPA0_LBSPPB1024_LBSPPM0_LPA0_LPB16_LPM0_LRVW8_LWPMn1_MIAV1_MIWT8_1_MO40_NTn1_NTA0_NTB0_NTC0_NTD0_NTM0_NEPBS0_NLCA2_NLCB1_ONLL0_PGR2_PLR1_PKA0_SIA3_SS1_SU32_SUM1_SUS256_SPO0_SRVW0_SSO0_SVW1_SK0_SKXCCM0_TLDS0_ULSGRO0_USL1_UIOFGRO0_USFGROn1_VSn1_VWA1_VWB1_WSGRA0_WSGRB0_WS32_WG16_8_1_WGM8_WGMXCC1_WGMXCCGn1
    SolutionIndex: 337
    SolutionNameMin: Cijk_Ailk_Bjlk_HSS_BH_Bias_SHB_HA_S_SAB_SCD_SAV_UserArgs_MT64x64x64_MI16x16x1_SN_LDSB1_AFC1_AFEM1_AFEM1_ASEM1_CLR1_CADS0_DTLA0_DTLB0_DTVA0_DTVB0_EPS1_FDSI0_GRPM1_GRVWA4_GRVWB4_GSU1_GSUAMB_GSUC0_GSUWGMRR0_GLS0_ISA1201_IU4_K1_LBSPPA1024_LBSPPB1024_LBSPPM0_LPA32_LPB32_LPM0_LRVW8_LWPMn1_MIAV1_MIWT2_2_MO40_NTn1_NTA0_NTB0_NTC0_NTD0_NTM0_NEPBS0_NLCA1_NLCB1_ONLL0_PGR1_PLR1_PKA0_SIA2_SS1_SU32_SUM1_SUS256_SPO0_SRVW0_SSO0_SVW2_SK0_SKXCCM0_TLDS0_ULSGRO0_USL1_UIOFGRO0_USFGROn1_VSn1_VWA2_VWB2_WSGRA0_WSGRB0_WS32_WG32_4_1_WGM8_WGMXCC1_WGMXCCGn1
    SolutionIndex: 338
    SolutionNameMin: Cijk_Ailk_Bjlk_HSS_BH_Bias_SHB_HA_S_SAB_SCD_SAV_UserArgs_MT64x64x32_MI16x16x1_SN_LDSB1_AFC1_AFEM1_AFEM1_ASEM1_CLR1_CADS0_DTLA0_DTLB0_DTVA0_DTVB0_EPS0_FDSI0_GRPM1_GRVWA8_GRVWB4_GSU1_GSUAMB_GSUC0_GSUWGMRR0_GLS0_ISA1201_IU2_K1_LBSPPA1024_LBSPPB1024_LBSPPM0_LPA32_LPB32_LPM0_LRVW8_LWPMn1_MIAV1_MIWT2_2_MO40_NTn1_NTA0_NTB0_NTC0_NTD0_NTM0_NEPBS0_NLCA1_NLCB1_ONLL0_PGR2_PLR1_PKA0_SIA2_SS1_SU32_SUM1_SUS256_SPO0_SRVW0_SSO0_SVW2_SK0_SKXCCM0_TLDS0_ULSGRO0_USL1_UIOFGRO0_USFGROn1_VSn1_VWA2_VWB2_WSGRA0_WSGRB0_WS32_WG32_4_1_WGM8_WGMXCC1_WGMXCCGn1
    SolutionIndex: 339
    SolutionNameMin: Cijk_Ailk_Bjlk_HSS_BH_Bias_SHB_HA_S_SAB_SCD_SAV_UserArgs_MT64x64x64_MI16x16x1_SN_LDSB1_AFC1_AFEM1_AFEM1_ASEM1_CLR1_CADS0_DTLA0_DTLB0_DTVA0_DTVB0_EPS0_FDSI0_GRPM1_GRVWA8_GRVWB8_GSU1_GSUAMB_GSUC0_GSUWGMRR0_GLS0_ISA1201_IU4_K1_LBSPPA1024_LBSPPB1024_LBSPPM0_LPA32_LPB32_LPM0_LRVW8_LWPMn1_MIAV1_MIWT2_2_MO40_NTn1_NTA0_NTB0_NTC0_NTD0_NTM0_NEPBS0_NLCA1_NLCB1_ONLL0_PGR2_PLR1_PKA0_SIA2_SS1_SU32_SUM1_SUS256_SPO0_SRVW0_SSO0_SVW2_SK0_SKXCCM0_TLDS0_ULSGRO1_USL1_UIOFGRO0_USFGROn1_VSn1_VWA2_VWB2_WSGRA0_WSGRB0_WS32_WG32_4_1_WGM8_WGMXCC1_WGMXCCGn1
    SolutionIndex: 340
    SolutionNameMin: Cijk_Ailk_Bjlk_HSS_BH_Bias_SHB_HA_S_SAB_SCD_SAV_UserArgs_MT64x64x32_MI16x16x1_SN_LDSB1_AFC1_AFEM1_AFEM1_ASEM1_CLR1_CADS0_DTLA0_DTLB0_DTVA0_DTVB0_EPS0_FDSI0_GRPM1_GRVWA8_GRVWB8_GSU1_GSUAMB_GSUC0_GSUWGMRR0_GLS0_ISA1201_IU2_K1_LBSPPA1024_LBSPPB1024_LBSPPM0_LPA32_LPB32_LPM0_LRVW8_LWPMn1_MIAV1_MIWT2_2_MO40_NTn1_NTA0_NTB0_NTC0_NTD0_NTM0_NEPBS0_NLCA1_NLCB1_ONLL0_PGR2_PLR1_PKA0_SIA2_SS1_SU32_SUM1_SUS256_SPO0_SRVW0_SSO0_SVW2_SK0_SKXCCM0_TLDS0_ULSGRO0_USL1_UIOFGRO0_USFGROn1_VSn1_VWA2_VWB2_WSGRA0_WSGRB0_WS32_WG32_4_1_WGM8_WGMXCC1_WGMXCCGn1
    SolutionIndex: 341
    SolutionNameMin: Cijk_Ailk_Bjlk_HSS_BH_Bias_SHB_HA_S_SAB_SCD_SAV_UserArgs_MT64x64x32_MI16x16x1_SN_LDSB1_AFC1_AFEM1_AFEM1_ASEM1_CLR1_CADS0_DTLA0_DTLB0_DTVA0_DTVB0_EPS0_FDSI0_GRPM1_GRVWA8_GRVWB4_GSU1_GSUAMB_GSUC0_GSUWGMRR0_GLS0_ISA1201_IU2_K1_LBSPPA1024_LBSPPB1024_LBSPPM0_LPA32_LPB32_LPM0_LRVW8_LWPMn1_MIAV1_MIWT2_2_MO40_NTn1_NTA0_NTB0_NTC0_NTD0_NTM0_NEPBS0_NLCA1_NLCB1_ONLL0_PGR2_PLR1_PKA0_SIA2_SS1_SU32_SUM1_SUS256_SPO0_SRVW0_SSO0_SVW2_SK0_SKXCCM0_TLDS0_ULSGRO1_USL1_UIOFGRO0_USFGROn1_VSn1_VWA2_VWB2_WSGRA0_WSGRB0_WS32_WG32_4_1_WGM8_WGMXCC1_WGMXCCGn1
    SolutionIndex: 342
    SolutionNameMin: Cijk_Ailk_Bjlk_HSS_BH_Bias_SHB_HA_S_SAB_SCD_SAV_UserArgs_MT64x64x16_MI16x16x1_SN_LDSB0_AFC1_AFEM1_AFEM1_ASEM1_CLR0_CADS0_DTLA0_DTLB0_DTVA0_DTVB0_EPS0_FDSI0_GRPM1_GRVWA1_GRVWB1_GSU1_GSUAMB_GSUC0_GSUWGMRR0_GLS0_ISA1201_IU1_K1_LBSPPA1024_LBSPPB1024_LBSPPM0_LPA32_LPB32_LPM0_LRVW8_LWPMn1_MIAV1_MIWT2_2_MO40_NTn1_NTA0_NTB0_NTC0_NTD0_NTM0_NEPBS0_NLCA1_NLCB1_ONLL0_PGR2_PLR0_PKA0_SIA3_SS1_SU32_SUM1_SUS256_SPO0_SRVW0_SSO0_SVW2_SK0_SKXCCM0_TLDS0_ULSGRO0_USL1_UIOFGRO0_USFGROn1_VSn1_VWA2_VWB2_WSGRA0_WSGRB0_WS32_WG32_4_1_WGM8_WGMXCC1_WGMXCCGn1
    SolutionIndex: 343
    SolutionNameMin: Cijk_Ailk_Bjlk_HSS_BH_Bias_SHB_HA_S_SAB_SCD_SAV_UserArgs_MT64x64x16_MI16x16x1_SN_LDSB1_AFC1_AFEM1_AFEM1_ASEM1_CLR1_CADS0_DTLA0_DTLB0_DTVA0_DTVB0_EPS0_FDSI0_GRPM1_GRVWA1_GRVWB1_GSU1_GSUAMB_GSUC0_GSUWGMRR0_GLS0_ISA1201_IU1_K1_LBSPPA1024_LBSPPB1024_LBSPPM0_LPA32_LPB32_LPM0_LRVW8_LWPMn1_MIAV1_MIWT2_2_MO40_NTn1_NTA0_NTB0_NTC0_NTD0_NTM0_NEPBS0_NLCA1_NLCB1_ONLL0_PGR2_PLR1_PKA0_SIA2_SS1_SU32_SUM1_SUS256_SPO0_SRVW0_SSO0_SVW2_SK0_SKXCCM0_TLDS0_ULSGRO0_USL1_UIOFGRO0_USFGROn1_VSn1_VWA2_VWB2_WSGRA0_WSGRB0_WS32_WG32_4_1_WGM8_WGMXCC1_WGMXCCGn1
    SolutionIndex: 344
    SolutionNameMin: Cijk_Ailk_Bjlk_HSS_BH_Bias_SHB_HA_S_SAB_SCD_SAV_UserArgs_MT16x32x64_MI16x16x1_SN_LDSB0_AFC1_AFEM1_AFEM1_ASEM1_CLR1_CADS0_DTLA0_DTLB0_DTVA1_DTVB1_EPS0_FDSI0_GRPM1_GRVWA8_GRVWB8_GSU1_GSUAMB_GSUC0_GSUWGMRR0_GLS0_ISA1201_IU1_K1_LBSPPA0_LBSPPB0_LBSPPM0_LPA0_LPB0_LPM0_LRVW8_LWPMn1_MIAV1_MIWT1_1_MO40_NTn1_NTA0_NTB0_NTC0_NTD0_NTM0_NEPBS0_NLCA1_NLCB1_ONLL0_PGR1_PLR0_PKA0_SIA3_SS1_SU32_SUM1_SUS256_SPO0_SRVW0_SSO0_SVW1_SK0_SKXCCM0_TLDS0_ULSGRO0_USL1_UIOFGRO0_USFGROn1_VSn1_VWA1_VWB1_WSGRA0_WSGRB0_WS32_WG16_4_1_WGM8_WGMXCC1_WGMXCCGn1
    SolutionIndex: 345
    SolutionNameMin: Cijk_Ailk_Bjlk_HSS_BH_Bias_SHB_HA_S_SAB_SCD_SAV_UserArgs_MT32x32x64_MI16x16x1_SN_LDSB1_AFC1_AFEM1_AFEM1_ASEM1_CLR1_CADS0_DTLA0_DTLB0_DTVA0_DTVB0_EPS0_FDSI0_GRPM1_GRVWA1_GRVWB1_GSU1_GSUAMB_GSUC0_GSUWGMRR0_GLS0_ISA1201_IU4_K1_LBSPPA512_LBSPPB512_LBSPPM0_LPA16_LPB16_LPM0_LRVW8_LWPMn1_MIAV1_MIWT1_1_MO40_NTn1_NTA0_NTB0_NTC0_NTD0_NTM0_NEPBS0_NLCA1_NLCB1_ONLL0_PGR2_PLR1_PKA0_SIA2_SS0_SU32_SUM1_SUS256_SPO0_SRVW0_SSO0_SVW8_SK0_SKXCCM0_TLDS0_ULSGRO0_USL1_UIOFGRO0_USFGROn1_VSn1_VWA1_VWB1_WSGRA0_WSGRB0_WS32_WG32_4_1_WGM8_WGMXCC1_WGMXCCGn1
    SolutionIndex: 346
    SolutionNameMin: Cijk_Ailk_Bjlk_HSS_BH_Bias_SHB_HA_S_SAB_SCD_SAV_UserArgs_MT32x16x32_MI16x16x1_SN_LDSB0_AFC1_AFEM1_AFEM1_ASEM1_CLR1_CADS0_DTLA0_DTLB0_DTVA0_DTVB0_EPS0_FDSI0_GRPM1_GRVWA1_GRVWB1_GSU1_GSUAMB_GSUC0_GSUWGMRR0_GLS0_ISA1201_IU1_K1_LBSPPA512_LBSPPB256_LBSPPM0_LPA16_LPB16_LPM0_LRVW8_LWPMn1_MIAV1_MIWT1_1_MO40_NTn1_NTA0_NTB0_NTC0_NTD0_NTM0_NEPBS0_NLCA1_NLCB1_ONLL0_PGR2_PLR1_PKA0_SIA3_SS0_SU32_SUM1_SUS256_SPO0_SRVW0_SSO0_SVW8_SK0_SKXCCM0_TLDS0_ULSGRO1_USL1_UIOFGRO0_USFGROn1_VSn1_VWA1_VWB1_WSGRA0_WSGRB0_WS32_WG32_2_1_WGM8_WGMXCC1_WGMXCCGn1
    SolutionIndex: 347
    SolutionNameMin: Cijk_Ailk_Bjlk_HSS_BH_Bias_SHB_HA_S_SAB_SCD_SAV_UserArgs_MT64x64x16_MI16x16x1_SN_LDSB1_AFC1_AFEM1_AFEM1_ASEM1_CLR1_CADS0_DTLA0_DTLB0_DTVA0_DTVB0_EPS1_FDSI0_GRPM1_GRVWA1_GRVWB4_GSU1_GSUAMB_GSUC0_GSUWGMRR0_GLS0_ISA1201_IU1_K1_LBSPPA1024_LBSPPB1024_LBSPPM0_LPA32_LPB32_LPM0_LRVW8_LWPMn1_MIAV1_MIWT2_2_MO40_NTn1_NTA0_NTB0_NTC0_NTD0_NTM0_NEPBS0_NLCA1_NLCB1_ONLL0_PGR1_PLR1_PKA0_SIA2_SS1_SU32_SUM1_SUS256_SPO0_SRVW0_SSO0_SVW2_SK0_SKXCCM0_TLDS0_ULSGRO0_USL1_UIOFGRO0_USFGROn1_VSn1_VWA2_VWB2_WSGRA0_WSGRB0_WS32_WG32_4_1_WGM8_WGMXCC1_WGMXCCGn1
    SolutionIndex: 348
    SolutionNameMin: Cijk_Ailk_Bjlk_HSS_BH_Bias_SHB_HA_S_SAB_SCD_SAV_UserArgs_MT64x128x16_MI16x16x1_SN_LDSB0_AFC1_AFEM1_AFEM1_ASEM1_CLR0_CADS0_DTLA0_DTLB0_DTVA0_DTVB0_EPS0_FDSI0_GRPM1_GRVWA8_GRVWB8_GSU1_GSUAMB_GSUC0_GSUWGMRR0_GLS0_ISA1201_IU1_K1_LBSPPA1024_LBSPPB2048_LBSPPM0_LPA16_LPB0_LPM0_LRVW8_LWPMn1_MIAV1_MIWT1_8_MO40_NTn1_NTA0_NTB0_NTC0_NTD0_NTM0_NEPBS0_NLCA1_NLCB1_ONLL0_PGR2_PLR0_PKA0_SIA3_SS0_SU32_SUM1_SUS256_SPO0_SRVW0_SSO0_SVW8_SK0_SKXCCM0_TLDS0_ULSGRO1_USL1_UIOFGRO0_USFGROn1_VSn1_VWA1_VWB8_WSGRA0_WSGRB0_WS32_WG64_2_1_WGM8_WGMXCC1_WGMXCCGn1
    SolutionIndex: 349
    SolutionNameMin: Cijk_Ailk_Bjlk_HSS_BH_Bias_SHB_HA_S_SAB_SCD_SAV_UserArgs_MT64x128x16_MI16x16x1_SN_LDSB0_AFC1_AFEM1_AFEM1_ASEM1_CLR1_CADS0_DTLA0_DTLB0_DTVA1_DTVB1_EPS0_FDSI0_GRPM1_GRVWA8_GRVWB8_GSU1_GSUAMB_GSUC0_GSUWGMRR0_GLS0_ISA1201_IU1_K1_LBSPPA0_LBSPPB0_LBSPPM0_LPA0_LPB0_LPM0_LRVW8_LWPMn1_MIAV1_MIWT1_8_MO40_NTn1_NTA0_NTB0_NTC0_NTD0_NTM0_NEPBS0_NLCA1_NLCB1_ONLL0_PGR1_PLR0_PKA0_SIA3_SS0_SU32_SUM1_SUS256_SPO0_SRVW0_SSO0_SVW8_SK0_SKXCCM0_TLDS0_ULSGRO0_USL1_UIOFGRO0_USFGROn1_VSn1_VWA1_VWB1_WSGRA0_WSGRB0_WS32_WG64_2_1_WGM8_WGMXCC1_WGMXCCGn1
    SolutionIndex: 350
    SolutionNameMin: Cijk_Ailk_Bjlk_HSS_BH_Bias_SHB_HA_S_SAB_SCD_SAV_UserArgs_MT32x128x64_MI16x16x1_SN_LDSB0_AFC1_AFEM1_AFEM1_ASEM1_CLR1_CADS0_DTLA0_DTLB0_DTVA0_DTVB1_EPS1_FDSI0_GRPM1_GRVWA1_GRVWB8_GSU1_GSUAMB_GSUC0_GSUWGMRR0_GLS0_ISA1201_IU1_K1_LBSPPA512_LBSPPB0_LBSPPM0_LPA16_LPB0_LPM0_LRVW8_LWPMn1_MIAV1_MIWT1_4_MO40_NTn1_NTA0_NTB0_NTC0_NTD0_NTM0_NEPBS0_NLCA1_NLCB4_ONLL0_PGR1_PLR1_PKA0_SIA3_SS0_SU32_SUM1_SUS256_SPO0_SRVW0_SSO0_SVW8_SK0_SKXCCM0_TLDS0_ULSGRO0_USL1_UIOFGRO0_USFGROn1_VSn1_VWA1_VWB1_WSGRA0_WSGRB0_WS32_WG32_4_1_WGM8_WGMXCC1_WGMXCCGn1
    SolutionIndex: 351
    SolutionNameMin: Cijk_Ailk_Bjlk_HSS_BH_Bias_SHB_HA_S_SAB_SCD_SAV_UserArgs_MT64x128x16_MI16x16x1_SN_LDSB0_AFC1_AFEM1_AFEM1_ASEM1_CLR1_CADS0_DTLA0_DTLB0_DTVA1_DTVB1_EPS0_FDSI0_GRPM1_GRVWA8_GRVWB8_GSU1_GSUAMB_GSUC0_GSUWGMRR0_GLS0_ISA1201_IU1_K1_LBSPPA0_LBSPPB0_LBSPPM0_LPA0_LPB0_LPM0_LRVW8_LWPMn1_MIAV1_MIWT1_8_MO40_NTn1_NTA0_NTB0_NTC0_NTD0_NTM0_NEPBS0_NLCA1_NLCB1_ONLL0_PGR1_PLR0_PKA0_SIA3_SS1_SU32_SUM1_SUS256_SPO0_SRVW0_SSO0_SVW1_SK0_SKXCCM0_TLDS0_ULSGRO0_USL1_UIOFGRO0_USFGROn1_VSn1_VWA1_VWB1_WSGRA0_WSGRB0_WS32_WG64_2_1_WGM8_WGMXCC1_WGMXCCGn1
    SolutionIndex: 352
    SolutionNameMin: Cijk_Ailk_Bjlk_HSS_BH_Bias_SHB_HA_S_SAB_SCD_SAV_UserArgs_MT32x32x128_MI16x16x1_SN_LDSB0_AFC1_AFEM1_AFEM1_ASEM1_CLR1_CADS0_DTLA0_DTLB0_DTVA0_DTVB1_EPS1_FDSI0_GRPM1_GRVWA8_GRVWB8_GSU1_GSUAMB_GSUC0_GSUWGMRR0_GLS0_ISA1201_IU1_K1_LBSPPA512_LBSPPB0_LBSPPM0_LPA16_LPB0_LPM0_LRVW8_LWPMn1_MIAV1_MIWT1_1_MO40_NTn1_NTA0_NTB0_NTC0_NTD0_NTM0_NEPBS0_NLCA1_NLCB1_ONLL0_PGR1_PLR1_PKA0_SIA3_SS1_SU32_SUM1_SUS256_SPO0_SRVW0_SSO0_SVW1_SK0_SKXCCM0_TLDS0_ULSGRO0_USL1_UIOFGRO0_USFGROn1_VSn1_VWA1_VWB1_WSGRA0_WSGRB0_WS32_WG32_4_1_WGM8_WGMXCC1_WGMXCCGn1
    SolutionIndex: 353
    SolutionNameMin: Cijk_Ailk_Bjlk_HSS_BH_Bias_SHB_HA_S_SAB_SCD_SAV_UserArgs_MT32x32x128_MI16x16x1_SN_LDSB0_AFC1_AFEM1_AFEM1_ASEM1_CLR1_CADS0_DTLA0_DTLB0_DTVA1_DTVB0_EPS1_FDSI0_GRPM1_GRVWA8_GRVWB8_GSU1_GSUAMB_GSUC0_GSUWGMRR0_GLS0_ISA1201_IU1_K1_LBSPPA0_LBSPPB512_LBSPPM0_LPA0_LPB16_LPM0_LRVW8_LWPMn1_MIAV1_MIWT1_1_MO40_NTn1_NTA0_NTB0_NTC0_NTD0_NTM0_NEPBS0_NLCA1_NLCB1_ONLL0_PGR1_PLR1_PKA0_SIA3_SS1_SU32_SUM1_SUS256_SPO0_SRVW0_SSO0_SVW1_SK0_SKXCCM0_TLDS0_ULSGRO0_USL1_UIOFGRO0_USFGROn1_VSn1_VWA1_VWB1_WSGRA0_WSGRB0_WS32_WG32_4_1_WGM8_WGMXCC1_WGMXCCGn1
    SolutionIndex: 354
    SolutionNameMin: Cijk_Ailk_Bjlk_HSS_BH_Bias_SHB_HA_S_SAB_SCD_SAV_UserArgs_MT128x64x32_MI16x16x1_SN_LDSB0_AFC1_AFEM1_AFEM1_ASEM1_CLR1_CADS0_DTLA0_DTLB0_DTVA1_DTVB0_EPS0_FDSI0_GRPM1_GRVWA8_GRVWB8_GSU1_GSUAMB_GSUC0_GSUWGMRR0_GLS0_ISA1201_IU1_K1_LBSPPA0_LBSPPB1024_LBSPPM0_LPA0_LPB16_LPM0_LRVW8_LWPMn1_MIAV1_MIWT8_1_MO40_NTn1_NTA0_NTB0_NTC0_NTD0_NTM0_NEPBS0_NLCA2_NLCB1_ONLL0_PGR2_PLR1_PKA0_SIA3_SS1_SU32_SUM1_SUS256_SPO0_SRVW0_SSO0_SVW1_SK0_SKXCCM0_TLDS0_ULSGRO0_USL1_UIOFGRO0_USFGROn1_VSn1_VWA1_VWB1_WSGRA0_WSGRB0_WS32_WG16_8_1_WGM8_WGMXCC1_WGMXCCGn1
    SolutionIndex: 355
    SolutionNameMin: Cijk_Ailk_Bjlk_HSS_BH_Bias_SHB_HA_S_SAB_SCD_SAV_UserArgs_MT64x64x64_MI16x16x1_SN_LDSB0_AFC1_AFEM1_AFEM1_ASEM1_CLR1_CADS0_DTLA0_DTLB0_DTVA1_DTVB0_EPS1_FDSI0_GRPM1_GRVWA8_GRVWB8_GSU1_GSUAMB_GSUC0_GSUWGMRR0_GLS0_ISA1201_IU1_K1_LBSPPA0_LBSPPB1024_LBSPPM0_LPA0_LPB32_LPM0_LRVW8_LWPMn1_MIAV1_MIWT2_2_MO40_NTn1_NTA0_NTB0_NTC0_NTD0_NTM0_NEPBS0_NLCA4_NLCB1_ONLL0_PGR1_PLR1_PKA0_SIA3_SS1_SU32_SUM1_SUS256_SPO0_SRVW0_SSO0_SVW1_SK0_SKXCCM0_TLDS0_ULSGRO0_USL1_UIOFGRO0_USFGROn1_VSn1_VWA1_VWB2_WSGRA0_WSGRB0_WS32_WG32_4_1_WGM8_WGMXCC1_WGMXCCGn1
    SolutionIndex: 356
    SolutionNameMin: Cijk_Ailk_Bjlk_HSS_BH_Bias_SHB_HA_S_SAB_SCD_SAV_UserArgs_MT64x128x32_MI16x16x1_SN_LDSB0_AFC1_AFEM1_AFEM1_ASEM1_CLR1_CADS0_DTLA0_DTLB0_DTVA0_DTVB1_EPS0_FDSI0_GRPM1_GRVWA8_GRVWB8_GSU1_GSUAMB_GSUC0_GSUWGMRR0_GLS0_ISA1201_IU1_K1_LBSPPA1024_LBSPPB0_LBSPPM0_LPA16_LPB0_LPM0_LRVW8_LWPMn1_MIAV1_MIWT1_8_MO40_NTn1_NTA0_NTB0_NTC0_NTD0_NTM0_NEPBS0_NLCA1_NLCB2_ONLL0_PGR2_PLR1_PKA0_SIA3_SS1_SU32_SUM1_SUS256_SPO0_SRVW0_SSO0_SVW1_SK0_SKXCCM0_TLDS0_ULSGRO0_USL1_UIOFGRO0_USFGROn1_VSn1_VWA1_VWB1_WSGRA0_WSGRB0_WS32_WG64_2_1_WGM8_WGMXCC1_WGMXCCGn1
    SolutionIndex: 357
    SolutionNameMin: Cijk_Ailk_Bjlk_HSS_BH_Bias_SHB_HA_S_SAB_SCD_SAV_UserArgs_MT32x32x32_MI16x16x1_SN_LDSB1_AFC1_AFEM1_AFEM1_ASEM1_CLR1_CADS0_DTLA0_DTLB0_DTVA0_DTVB0_EPS0_FDSI0_GRPM1_GRVWA1_GRVWB1_GSU1_GSUAMB_GSUC0_GSUWGMRR0_GLS0_ISA1201_IU2_K1_LBSPPA512_LBSPPB512_LBSPPM0_LPA16_LPB16_LPM0_LRVW8_LWPMn1_MIAV1_MIWT1_1_MO40_NTn1_NTA0_NTB0_NTC0_NTD0_NTM0_NEPBS0_NLCA1_NLCB1_ONLL0_PGR2_PLR1_PKA0_SIA2_SS1_SU32_SUM1_SUS256_SPO0_SRVW0_SSO0_SVW1_SK0_SKXCCM0_TLDS0_ULSGRO0_USL1_UIOFGRO0_USFGROn1_VSn1_VWA1_VWB1_WSGRA0_WSGRB0_WS32_WG32_4_1_WGM8_WGMXCC1_WGMXCCGn1
    SolutionIndex: 358
    SolutionNameMin: Cijk_Ailk_Bjlk_HSS_BH_Bias_SHB_HA_S_SAB_SCD_SAV_UserArgs_MT128x128x16_MI16x16x1_SN_LDSB1_AFC1_AFEM1_AFEM1_ASEM1_CLR1_CADS0_DTLA0_DTLB0_DTVA0_DTVB0_EPS0_FDSI0_GRPM1_GRVWA4_GRVWB8_GSU1_GSUAMB_GSUC0_GSUWGMRR0_GLS0_ISA1201_IU1_K1_LBSPPA2048_LBSPPB2048_LBSPPM0_LPA0_LPB0_LPM0_LRVW8_LWPMn1_MIAV1_MIWT4_4_MO40_NTn1_NTA0_NTB0_NTC0_NTD0_NTM0_NEPBS0_NLCA1_NLCB1_ONLL0_PGR2_PLR1_PKA0_SIA2_SS1_SU32_SUM1_SUS256_SPO0_SRVW0_SSO0_SVW4_SK0_SKXCCM0_TLDS0_ULSGRO1_USL1_UIOFGRO0_USFGROn1_VSn1_VWA4_VWB4_WSGRA0_WSGRB0_WS32_WG32_4_1_WGM8_WGMXCC1_WGMXCCGn1
    SolutionIndex: 359
    SolutionNameMin: Cijk_Ailk_Bjlk_HSS_BH_Bias_SHB_HA_S_SAB_SCD_SAV_UserArgs_MT128x128x16_MI16x16x1_SN_LDSB0_AFC1_AFEM1_AFEM1_ASEM1_CLR1_CADS0_DTLA0_DTLB0_DTVA1_DTVB1_EPS0_FDSI0_GRPM1_GRVWA8_GRVWB8_GSU1_GSUAMB_GSUC0_GSUWGMRR0_GLS0_ISA1201_IU1_K1_LBSPPA0_LBSPPB0_LBSPPM0_LPA0_LPB0_LPM0_LRVW8_LWPMn1_MIAV1_MIWT8_2_MO40_NTn1_NTA0_NTB0_NTC0_NTD0_NTM0_NEPBS0_NLCA1_NLCB1_ONLL0_PGR1_PLR0_PKA0_SIA3_SS1_SU32_SUM1_SUS256_SPO0_SRVW0_SSO0_SVW1_SK0_SKXCCM0_TLDS0_ULSGRO0_USL1_UIOFGRO0_USFGROn1_VSn1_VWA1_VWB1_WSGRA0_WSGRB0_WS32_WG16_8_1_WGM8_WGMXCC1_WGMXCCGn1
    SolutionIndex: 360
    SolutionNameMin: Cijk_Ailk_Bjlk_HSS_BH_Bias_SHB_HA_S_SAB_SCD_SAV_UserArgs_MT128x128x16_MI16x16x1_SN_LDSB1_AFC1_AFEM1_AFEM1_ASEM1_CLR1_CADS0_DTLA0_DTLB0_DTVA0_DTVB0_EPS0_FDSI0_GRPM1_GRVWA4_GRVWB4_GSU1_GSUAMB_GSUC0_GSUWGMRR0_GLS0_ISA1201_IU1_K1_LBSPPA2048_LBSPPB2048_LBSPPM0_LPA0_LPB0_LPM0_LRVW8_LWPMn1_MIAV1_MIWT4_4_MO40_NTn1_NTA0_NTB0_NTC0_NTD0_NTM0_NEPBS0_NLCA1_NLCB1_ONLL0_PGR2_PLR1_PKA0_SIA2_SS1_SU32_SUM1_SUS256_SPO0_SRVW0_SSO0_SVW4_SK0_SKXCCM0_TLDS0_ULSGRO1_USL1_UIOFGRO0_USFGROn1_VSn1_VWA4_VWB4_WSGRA0_WSGRB0_WS32_WG32_4_1_WGM8_WGMXCC1_WGMXCCGn1
    SolutionIndex: 364
    SolutionNameMin: Cijk_Ailk_Bjlk_HSS_BH_Bias_SHB_HA_S_SAB_SCD_SAV_UserArgs_MT128x128x16_MI16x16x1_SN_LDSB1_AFC1_AFEM1_AFEM1_ASEM1_CLR1_CADS0_DTLA0_DTLB0_DTVA0_DTVB0_EPS0_FDSI0_GRPM1_GRVWA8_GRVWB4_GSU1_GSUAMB_GSUC0_GSUWGMRR0_GLS0_ISA1201_IU1_K1_LBSPPA2048_LBSPPB2048_LBSPPM0_LPA0_LPB0_LPM0_LRVW8_LWPMn1_MIAV1_MIWT4_4_MO40_NTn1_NTA0_NTB0_NTC0_NTD0_NTM0_NEPBS0_NLCA1_NLCB1_ONLL0_PGR2_PLR1_PKA0_SIA2_SS1_SU32_SUM1_SUS256_SPO0_SRVW0_SSO0_SVW4_SK0_SKXCCM0_TLDS0_ULSGRO0_USL1_UIOFGRO0_USFGROn1_VSn1_VWA4_VWB4_WSGRA0_WSGRB0_WS32_WG32_4_1_WGM8_WGMXCC1_WGMXCCGn1
    SolutionIndex: 365
    SolutionNameMin: Cijk_Ailk_Bjlk_HSS_BH_Bias_SHB_HA_S_SAB_SCD_SAV_UserArgs_MT128x128x16_MI16x16x1_SN_LDSB1_AFC1_AFEM1_AFEM1_ASEM1_CLR1_CADS0_DTLA0_DTLB0_DTVA0_DTVB0_EPS1_FDSI0_GRPM1_GRVWA1_GRVWB4_GSU1_GSUAMB_GSUC0_GSUWGMRR0_GLS0_ISA1201_IU1_K1_LBSPPA2048_LBSPPB2048_LBSPPM0_LPA0_LPB0_LPM0_LRVW8_LWPMn1_MIAV1_MIWT4_4_MO40_NTn1_NTA0_NTB0_NTC0_NTD0_NTM0_NEPBS0_NLCA1_NLCB1_ONLL0_PGR1_PLR1_PKA0_SIA2_SS1_SU32_SUM1_SUS256_SPO0_SRVW0_SSO0_SVW4_SK0_SKXCCM0_TLDS0_ULSGRO0_USL1_UIOFGRO0_USFGROn1_VSn1_VWA4_VWB4_WSGRA0_WSGRB0_WS32_WG32_4_1_WGM8_WGMXCC1_WGMXCCGn1
    SolutionIndex: 366
    SolutionNameMin: Cijk_Ailk_Bjlk_HSS_BH_Bias_SHB_HA_S_SAB_SCD_SAV_UserArgs_MT128x64x16_MI16x16x1_SN_LDSB0_AFC1_AFEM1_AFEM1_ASEM1_CLR1_CADS0_DTLA0_DTLB0_DTVA1_DTVB1_EPS0_FDSI0_GRPM1_GRVWA8_GRVWB8_GSU1_GSUAMB_GSUC0_GSUWGMRR0_GLS0_ISA1201_IU1_K1_LBSPPA0_LBSPPB0_LBSPPM0_LPA0_LPB0_LPM0_LRVW8_LWPMn1_MIAV1_MIWT8_1_MO40_NTn1_NTA0_NTB0_NTC0_NTD0_NTM0_NEPBS0_NLCA1_NLCB1_ONLL0_PGR1_PLR0_PKA0_SIA3_SS1_SU32_SUM1_SUS256_SPO0_SRVW0_SSO0_SVW1_SK0_SKXCCM0_TLDS0_ULSGRO0_USL1_UIOFGRO0_USFGROn1_VSn1_VWA1_VWB1_WSGRA0_WSGRB0_WS32_WG16_8_1_WGM8_WGMXCC1_WGMXCCGn1
    SolutionIndex: 367
    SolutionNameMin: Cijk_Ailk_Bjlk_HSS_BH_Bias_SHB_HA_S_SAB_SCD_SAV_UserArgs_MT128x128x16_MI16x16x1_SN_LDSB1_AFC1_AFEM1_AFEM1_ASEM1_CLR1_CADS0_DTLA0_DTLB0_DTVA0_DTVB0_EPS0_FDSI0_GRPM1_GRVWA4_GRVWB8_GSU1_GSUAMB_GSUC0_GSUWGMRR0_GLS0_ISA1201_IU1_K1_LBSPPA2048_LBSPPB2048_LBSPPM0_LPA0_LPB0_LPM0_LRVW8_LWPMn1_MIAV1_MIWT4_4_MO40_NTn1_NTA0_NTB0_NTC0_NTD0_NTM0_NEPBS0_NLCA1_NLCB1_ONLL0_PGR2_PLR1_PKA0_SIA2_SS1_SU32_SUM1_SUS256_SPO0_SRVW0_SSO0_SVW4_SK0_SKXCCM0_TLDS0_ULSGRO0_USL1_UIOFGRO0_USFGROn1_VSn1_VWA4_VWB4_WSGRA0_WSGRB0_WS32_WG32_4_1_WGM8_WGMXCC1_WGMXCCGn1
    SolutionIndex: 368
    SolutionNameMin: Cijk_Ailk_Bjlk_HSS_BH_Bias_SHB_HA_S_SAB_SCD_SAV_UserArgs_MT128x128x16_MI16x16x1_SN_LDSB0_AFC1_AFEM1_AFEM1_ASEM1_CLR0_CADS0_DTLA0_DTLB0_DTVA0_DTVB0_EPS0_FDSI0_GRPM1_GRVWA8_GRVWB4_GSU1_GSUAMB_GSUC0_GSUWGMRR0_GLS0_ISA1201_IU1_K1_LBSPPA2048_LBSPPB2048_LBSPPM0_LPA0_LPB0_LPM0_LRVW8_LWPMn1_MIAV1_MIWT4_4_MO40_NTn1_NTA0_NTB0_NTC0_NTD0_NTM0_NEPBS0_NLCA1_NLCB1_ONLL0_PGR2_PLR0_PKA0_SIA3_SS1_SU32_SUM1_SUS256_SPO0_SRVW0_SSO0_SVW4_SK0_SKXCCM0_TLDS0_ULSGRO0_USL1_UIOFGRO0_USFGROn1_VSn1_VWA4_VWB4_WSGRA0_WSGRB0_WS32_WG32_4_1_WGM8_WGMXCC1_WGMXCCGn1
    SolutionIndex: 369
    SolutionNameMin: Cijk_Ailk_Bjlk_HSS_BH_Bias_SHB_HA_S_SAB_SCD_SAV_UserArgs_MT128x128x16_MI16x16x1_SN_LDSB0_AFC1_AFEM1_AFEM1_ASEM1_CLR0_CADS0_DTLA0_DTLB0_DTVA0_DTVB0_EPS1_FDSI0_GRPM1_GRVWA8_GRVWB8_GSU1_GSUAMB_GSUC0_GSUWGMRR0_GLS0_ISA1201_IU1_K1_LBSPPA2048_LBSPPB2048_LBSPPM0_LPA0_LPB0_LPM0_LRVW8_LWPMn1_MIAV1_MIWT4_4_MO40_NTn1_NTA0_NTB0_NTC0_NTD0_NTM0_NEPBS0_NLCA1_NLCB1_ONLL0_PGR1_PLR0_PKA0_SIA3_SS1_SU32_SUM1_SUS256_SPO0_SRVW0_SSO0_SVW4_SK0_SKXCCM0_TLDS0_ULSGRO0_USL1_UIOFGRO0_USFGROn1_VSn1_VWA4_VWB4_WSGRA0_WSGRB0_WS32_WG32_4_1_WGM8_WGMXCC1_WGMXCCGn1
    SolutionIndex: 370
    SolutionNameMin: Cijk_Ailk_Bjlk_HSS_BH_Bias_SHB_HA_S_SAB_SCD_SAV_UserArgs_MT128x128x16_MI16x16x1_SN_LDSB0_AFC1_AFEM1_AFEM1_ASEM1_CLR0_CADS0_DTLA0_DTLB0_DTVA0_DTVB0_EPS0_FDSI0_GRPM1_GRVWA8_GRVWB8_GSU1_GSUAMB_GSUC0_GSUWGMRR0_GLS0_ISA1201_IU1_K1_LBSPPA2048_LBSPPB2048_LBSPPM0_LPA0_LPB0_LPM0_LRVW8_LWPMn1_MIAV1_MIWT4_4_MO40_NTn1_NTA0_NTB0_NTC0_NTD0_NTM0_NEPBS0_NLCA1_NLCB1_ONLL0_PGR2_PLR0_PKA0_SIA3_SS1_SU32_SUM1_SUS256_SPO0_SRVW0_SSO0_SVW4_SK0_SKXCCM0_TLDS0_ULSGRO0_USL1_UIOFGRO0_USFGROn1_VSn1_VWA4_VWB4_WSGRA0_WSGRB0_WS32_WG32_4_1_WGM8_WGMXCC1_WGMXCCGn1
    SolutionIndex: 374
    SolutionNameMin: Cijk_Ailk_Bjlk_HSS_BH_Bias_SHB_HA_S_SAB_SCD_SAV_UserArgs_MT128x128x16_MI16x16x1_SN_LDSB0_AFC1_AFEM1_AFEM1_ASEM1_CLR0_CADS0_DTLA0_DTLB0_DTVA0_DTVB0_EPS1_FDSI0_GRPM1_GRVWA4_GRVWB4_GSU1_GSUAMB_GSUC0_GSUWGMRR0_GLS0_ISA1201_IU1_K1_LBSPPA2048_LBSPPB2048_LBSPPM0_LPA0_LPB0_LPM0_LRVW8_LWPMn1_MIAV1_MIWT4_4_MO40_NTn1_NTA0_NTB0_NTC0_NTD0_NTM0_NEPBS0_NLCA1_NLCB1_ONLL0_PGR1_PLR0_PKA0_SIA3_SS1_SU32_SUM1_SUS256_SPO0_SRVW0_SSO0_SVW4_SK0_SKXCCM0_TLDS0_ULSGRO0_USL1_UIOFGRO0_USFGROn1_VSn1_VWA4_VWB4_WSGRA0_WSGRB0_WS32_WG32_4_1_WGM8_WGMXCC1_WGMXCCGn1
    SolutionIndex: 375
    SolutionNameMin: Cijk_Ailk_Bjlk_HSS_BH_Bias_SHB_HA_S_SAB_SCD_SAV_UserArgs_MT128x128x16_MI16x16x1_SN_LDSB0_AFC1_AFEM1_AFEM1_ASEM1_CLR0_CADS0_DTLA0_DTLB0_DTVA0_DTVB0_EPS1_FDSI0_GRPM1_GRVWA8_GRVWB4_GSU1_GSUAMB_GSUC0_GSUWGMRR0_GLS0_ISA1201_IU1_K1_LBSPPA2048_LBSPPB2048_LBSPPM0_LPA0_LPB0_LPM0_LRVW8_LWPMn1_MIAV1_MIWT4_4_MO40_NTn1_NTA0_NTB0_NTC0_NTD0_NTM0_NEPBS0_NLCA1_NLCB1_ONLL0_PGR1_PLR0_PKA0_SIA3_SS1_SU32_SUM1_SUS256_SPO0_SRVW0_SSO0_SVW4_SK0_SKXCCM0_TLDS0_ULSGRO0_USL1_UIOFGRO0_USFGROn1_VSn1_VWA4_VWB4_WSGRA0_WSGRB0_WS32_WG32_4_1_WGM8_WGMXCC1_WGMXCCGn1
    SolutionIndex: 376
    SolutionNameMin: Cijk_Ailk_Bjlk_HSS_BH_Bias_SHB_HA_S_SAB_SCD_SAV_UserArgs_MT128x128x16_MI16x16x1_SN_LDSB1_AFC1_AFEM1_AFEM1_ASEM1_CLR1_CADS0_DTLA0_DTLB0_DTVA0_DTVB0_EPS0_FDSI0_GRPM1_GRVWA4_GRVWB4_GSU1_GSUAMB_GSUC0_GSUWGMRR0_GLS0_ISA1201_IU1_K1_LBSPPA2048_LBSPPB2048_LBSPPM0_LPA0_LPB0_LPM0_LRVW8_LWPMn1_MIAV1_MIWT4_4_MO40_NTn1_NTA0_NTB0_NTC0_NTD0_NTM0_NEPBS0_NLCA1_NLCB1_ONLL0_PGR2_PLR1_PKA0_SIA2_SS1_SU32_SUM1_SUS256_SPO0_SRVW0_SSO0_SVW4_SK0_SKXCCM0_TLDS0_ULSGRO0_USL1_UIOFGRO0_USFGROn1_VSn1_VWA4_VWB4_WSGRA0_WSGRB0_WS32_WG32_4_1_WGM8_WGMXCC1_WGMXCCGn1
    SolutionIndex: 381
    SolutionNameMin: Cijk_Ailk_Bjlk_HSS_BH_Bias_SHB_HA_S_SAB_SCD_SAV_UserArgs_MT128x128x16_MI16x16x1_SN_LDSB0_AFC1_AFEM1_AFEM1_ASEM1_CLR0_CADS0_DTLA0_DTLB0_DTVA0_DTVB0_EPS0_FDSI0_GRPM1_GRVWA1_GRVWB1_GSU1_GSUAMB_GSUC0_GSUWGMRR0_GLS0_ISA1201_IU1_K1_LBSPPA2048_LBSPPB2048_LBSPPM0_LPA0_LPB0_LPM0_LRVW8_LWPMn1_MIAV1_MIWT4_4_MO40_NTn1_NTA0_NTB0_NTC0_NTD0_NTM0_NEPBS0_NLCA1_NLCB1_ONLL0_PGR2_PLR0_PKA0_SIA3_SS1_SU32_SUM1_SUS256_SPO0_SRVW0_SSO0_SVW4_SK0_SKXCCM0_TLDS0_ULSGRO0_USL1_UIOFGRO0_USFGROn1_VSn1_VWA4_VWB4_WSGRA0_WSGRB0_WS32_WG32_4_1_WGM8_WGMXCC1_WGMXCCGn1
    SolutionIndex: 383
    SolutionNameMin: Cijk_Ailk_Bjlk_HSS_BH_Bias_SHB_HA_S_SAB_SCD_SAV_UserArgs_MT128x128x16_MI16x16x1_SN_LDSB0_AFC1_AFEM1_AFEM1_ASEM1_CLR0_CADS0_DTLA0_DTLB0_DTVA0_DTVB0_EPS0_FDSI0_GRPM1_GRVWA4_GRVWB4_GSU1_GSUAMB_GSUC0_GSUWGMRR0_GLS0_ISA1201_IU1_K1_LBSPPA2048_LBSPPB2048_LBSPPM0_LPA0_LPB0_LPM0_LRVW8_LWPMn1_MIAV1_MIWT4_4_MO40_NTn1_NTA0_NTB0_NTC0_NTD0_NTM0_NEPBS0_NLCA1_NLCB1_ONLL0_PGR2_PLR0_PKA0_SIA3_SS1_SU32_SUM1_SUS256_SPO0_SRVW0_SSO0_SVW4_SK0_SKXCCM0_TLDS0_ULSGRO0_USL1_UIOFGRO0_USFGROn1_VSn1_VWA4_VWB4_WSGRA0_WSGRB0_WS32_WG32_4_1_WGM8_WGMXCC1_WGMXCCGn1
    SolutionIndex: 385
    SolutionNameMin: Cijk_Ailk_Bjlk_HSS_BH_Bias_SHB_HA_S_SAB_SCD_SAV_UserArgs_MT128x128x16_MI16x16x1_SN_LDSB0_AFC1_AFEM1_AFEM1_ASEM1_CLR0_CADS0_DTLA0_DTLB0_DTVA0_DTVB0_EPS0_FDSI0_GRPM1_GRVWA8_GRVWB8_GSU1_GSUAMB_GSUC0_GSUWGMRR0_GLS0_ISA1201_IU1_K1_LBSPPA2048_LBSPPB2048_LBSPPM0_LPA0_LPB0_LPM0_LRVW8_LWPMn1_MIAV1_MIWT4_4_MO40_NTn1_NTA0_NTB0_NTC0_NTD0_NTM0_NEPBS0_NLCA1_NLCB1_ONLL0_PGR2_PLR0_PKA0_SIA3_SS1_SU32_SUM1_SUS256_SPO0_SRVW0_SSO0_SVW4_SK0_SKXCCM0_TLDS0_ULSGRO1_USL1_UIOFGRO0_USFGROn1_VSn1_VWA4_VWB4_WSGRA0_WSGRB0_WS32_WG32_4_1_WGM8_WGMXCC1_WGMXCCGn1
    SolutionIndex: 386
    SolutionNameMin: Cijk_Ailk_Bjlk_HSS_BH_Bias_SHB_HA_S_SAB_SCD_SAV_UserArgs_MT128x128x16_MI16x16x1_SN_LDSB0_AFC1_AFEM1_AFEM1_ASEM1_CLR0_CADS0_DTLA0_DTLB0_DTVA0_DTVB0_EPS1_FDSI0_GRPM1_GRVWA4_GRVWB8_GSU1_GSUAMB_GSUC0_GSUWGMRR0_GLS0_ISA1201_IU1_K1_LBSPPA2048_LBSPPB2048_LBSPPM0_LPA0_LPB0_LPM0_LRVW8_LWPMn1_MIAV1_MIWT4_4_MO40_NTn1_NTA0_NTB0_NTC0_NTD0_NTM0_NEPBS0_NLCA1_NLCB1_ONLL0_PGR1_PLR0_PKA0_SIA3_SS1_SU32_SUM1_SUS256_SPO0_SRVW0_SSO0_SVW4_SK0_SKXCCM0_TLDS0_ULSGRO0_USL1_UIOFGRO0_USFGROn1_VSn1_VWA4_VWB4_WSGRA0_WSGRB0_WS32_WG32_4_1_WGM8_WGMXCC1_WGMXCCGn1
    SolutionIndex: 388
    SolutionNameMin: Cijk_Ailk_Bjlk_HSS_BH_Bias_SHB_HA_S_SAB_SCD_SAV_UserArgs_MT128x128x16_MI16x16x1_SN_LDSB1_AFC1_AFEM1_AFEM1_ASEM1_CLR1_CADS0_DTLA0_DTLB0_DTVA0_DTVB0_EPS0_FDSI0_GRPM1_GRVWA1_GRVWB1_GSU1_GSUAMB_GSUC0_GSUWGMRR0_GLS0_ISA1201_IU1_K1_LBSPPA2048_LBSPPB2048_LBSPPM0_LPA0_LPB0_LPM0_LRVW8_LWPMn1_MIAV1_MIWT4_4_MO40_NTn1_NTA0_NTB0_NTC0_NTD0_NTM0_NEPBS0_NLCA1_NLCB1_ONLL0_PGR2_PLR1_PKA0_SIA2_SS1_SU32_SUM1_SUS256_SPO0_SRVW0_SSO0_SVW4_SK0_SKXCCM0_TLDS0_ULSGRO0_USL1_UIOFGRO0_USFGROn1_VSn1_VWA4_VWB4_WSGRA0_WSGRB0_WS32_WG32_4_1_WGM8_WGMXCC1_WGMXCCGn1
    SolutionIndex: 393
    SolutionNameMin: Cijk_Ailk_Bjlk_HSS_BH_Bias_SHB_HA_S_SAB_SCD_SAV_UserArgs_MT64x128x32_MI16x16x1_SN_LDSB0_AFC1_AFEM1_AFEM1_ASEM1_CLR1_CADS0_DTLA0_DTLB0_DTVA0_DTVB1_EPS0_FDSI0_GRPM1_GRVWA4_GRVWB8_GSU1_GSUAMB_GSUC0_GSUWGMRR0_GLS0_ISA1201_IU1_K1_LBSPPA1024_LBSPPB0_LBSPPM0_LPA16_LPB0_LPM0_LRVW8_LWPMn1_MIAV1_MIWT1_8_MO40_NTn1_NTA0_NTB0_NTC0_NTD0_NTM0_NEPBS0_NLCA1_NLCB2_ONLL0_PGR2_PLR1_PKA0_SIA3_SS1_SU32_SUM1_SUS256_SPO0_SRVW0_SSO0_SVW1_SK0_SKXCCM0_TLDS0_ULSGRO0_USL1_UIOFGRO0_USFGROn1_VSn1_VWA1_VWB1_WSGRA0_WSGRB0_WS32_WG64_2_1_WGM8_WGMXCC1_WGMXCCGn1
    SolutionIndex: 395
    SolutionNameMin: Cijk_Ailk_Bjlk_HSS_BH_Bias_SHB_HA_S_SAB_SCD_SAV_UserArgs_MT64x64x32_MI16x16x1_SN_LDSB0_AFC1_AFEM1_AFEM1_ASEM1_CLR1_CADS0_DTLA0_DTLB0_DTVA1_DTVB0_EPS0_FDSI0_GRPM1_GRVWA8_GRVWB1_GSU1_GSUAMB_GSUC0_GSUWGMRR0_GLS0_ISA1201_IU1_K1_LBSPPA0_LBSPPB1024_LBSPPM0_LPA0_LPB32_LPM0_LRVW8_LWPMn1_MIAV1_MIWT2_2_MO40_NTn1_NTA0_NTB0_NTC0_NTD0_NTM0_NEPBS0_NLCA2_NLCB1_ONLL0_PGR2_PLR1_PKA0_SIA3_SS0_SU32_SUM1_SUS256_SPO0_SRVW0_SSO0_SVW8_SK0_SKXCCM0_TLDS0_ULSGRO0_USL1_UIOFGRO0_USFGROn1_VSn1_VWA1_VWB2_WSGRA0_WSGRB0_WS32_WG32_4_1_WGM8_WGMXCC1_WGMXCCGn1
    SolutionIndex: 396
    SolutionNameMin: Cijk_Ailk_Bjlk_HSS_BH_Bias_SHB_HA_S_SAB_SCD_SAV_UserArgs_MT64x64x32_MI16x16x1_SN_LDSB0_AFC1_AFEM1_AFEM1_ASEM1_CLR1_CADS0_DTLA0_DTLB0_DTVA0_DTVB0_EPS0_FDSI0_GRPM1_GRVWA4_GRVWB8_GSU1_GSUAMB_GSUC0_GSUWGMRR0_GLS0_ISA1201_IU1_K1_LBSPPA1024_LBSPPB1024_LBSPPM0_LPA32_LPB32_LPM0_LRVW8_LWPMn1_MIAV1_MIWT2_2_MO40_NTn1_NTA0_NTB0_NTC0_NTD0_NTM0_NEPBS0_NLCA1_NLCB1_ONLL0_PGR2_PLR1_PKA0_SIA3_SS1_SU32_SUM1_SUS256_SPO0_SRVW0_SSO0_SVW2_SK0_SKXCCM0_TLDS0_ULSGRO1_USL1_UIOFGRO0_USFGROn1_VSn1_VWA2_VWB2_WSGRA0_WSGRB0_WS32_WG32_4_1_WGM8_WGMXCC1_WGMXCCGn1
    SolutionIndex: 397
    SolutionNameMin: Cijk_Ailk_Bjlk_HSS_BH_Bias_SHB_HA_S_SAB_SCD_SAV_UserArgs_MT64x64x32_MI16x16x1_SN_LDSB0_AFC1_AFEM1_AFEM1_ASEM1_CLR1_CADS0_DTLA0_DTLB0_DTVA0_DTVB0_EPS0_FDSI0_GRPM1_GRVWA1_GRVWB4_GSU1_GSUAMB_GSUC0_GSUWGMRR0_GLS0_ISA1201_IU1_K1_LBSPPA1024_LBSPPB1024_LBSPPM0_LPA32_LPB32_LPM0_LRVW8_LWPMn1_MIAV1_MIWT2_2_MO40_NTn1_NTA0_NTB0_NTC0_NTD0_NTM0_NEPBS0_NLCA1_NLCB1_ONLL0_PGR2_PLR1_PKA0_SIA3_SS1_SU32_SUM1_SUS256_SPO0_SRVW0_SSO0_SVW2_SK0_SKXCCM0_TLDS0_ULSGRO1_USL1_UIOFGRO0_USFGROn1_VSn1_VWA2_VWB2_WSGRA0_WSGRB0_WS32_WG32_4_1_WGM8_WGMXCC1_WGMXCCGn1
    SolutionIndex: 398
    SolutionNameMin: Cijk_Ailk_Bjlk_HSS_BH_Bias_SHB_HA_S_SAB_SCD_SAV_UserArgs_MT128x128x16_MI16x16x1_SN_LDSB0_AFC1_AFEM1_AFEM1_ASEM1_CLR0_CADS0_DTLA0_DTLB0_DTVA0_DTVB0_EPS0_FDSI0_GRPM1_GRVWA4_GRVWB8_GSU1_GSUAMB_GSUC0_GSUWGMRR0_GLS0_ISA1201_IU1_K1_LBSPPA2048_LBSPPB2048_LBSPPM0_LPA0_LPB0_LPM0_LRVW8_LWPMn1_MIAV1_MIWT4_4_MO40_NTn1_NTA0_NTB0_NTC0_NTD0_NTM0_NEPBS0_NLCA1_NLCB1_ONLL0_PGR2_PLR0_PKA0_SIA3_SS1_SU32_SUM1_SUS256_SPO0_SRVW0_SSO0_SVW4_SK0_SKXCCM0_TLDS0_ULSGRO1_USL1_UIOFGRO0_USFGROn1_VSn1_VWA4_VWB4_WSGRA0_WSGRB0_WS32_WG32_4_1_WGM8_WGMXCC1_WGMXCCGn1
    SolutionIndex: 399
    SolutionNameMin: Cijk_Ailk_Bjlk_HSS_BH_Bias_SHB_HA_S_SAB_SCD_SAV_UserArgs_MT64x64x64_MI16x16x1_SN_LDSB1_AFC1_AFEM1_AFEM1_ASEM1_CLR1_CADS0_DTLA0_DTLB0_DTVA0_DTVB0_EPS0_FDSI0_GRPM1_GRVWA4_GRVWB8_GSU1_GSUAMB_GSUC0_GSUWGMRR0_GLS0_ISA1201_IU1_K1_LBSPPA1024_LBSPPB1024_LBSPPM0_LPA32_LPB32_LPM0_LRVW8_LWPMn1_MIAV1_MIWT2_2_MO40_NTn1_NTA0_NTB0_NTC0_NTD0_NTM0_NEPBS0_NLCA1_NLCB1_ONLL0_PGR2_PLR1_PKA0_SIA3_SS1_SU32_SUM1_SUS256_SPO0_SRVW0_SSO0_SVW2_SK0_SKXCCM0_TLDS0_ULSGRO0_USL1_UIOFGRO0_USFGROn1_VSn1_VWA2_VWB2_WSGRA0_WSGRB0_WS32_WG32_4_1_WGM8_WGMXCC1_WGMXCCGn1
    SolutionIndex: 400
    SolutionNameMin: Cijk_Ailk_Bjlk_HSS_BH_Bias_SHB_HA_S_SAB_SCD_SAV_UserArgs_MT16x128x32_MI16x16x1_SN_LDSB0_AFC1_AFEM1_AFEM1_ASEM1_CLR1_CADS0_DTLA0_DTLB0_DTVA0_DTVB1_EPS1_FDSI0_GRPM1_GRVWA8_GRVWB8_GSU1_GSUAMB_GSUC0_GSUWGMRR0_GLS0_ISA1201_IU1_K1_LBSPPA256_LBSPPB0_LBSPPM0_LPA16_LPB0_LPM0_LRVW8_LWPMn1_MIAV1_MIWT1_8_MO40_NTn1_NTA0_NTB0_NTC0_NTD0_NTM0_NEPBS0_NLCA1_NLCB2_ONLL0_PGR1_PLR1_PKA0_SIA3_SS0_SU32_SUM1_SUS256_SPO0_SRVW0_SSO0_SVW8_SK0_SKXCCM0_TLDS0_ULSGRO0_USL1_UIOFGRO0_USFGROn1_VSn1_VWA1_VWB1_WSGRA0_WSGRB0_WS32_WG16_2_1_WGM8_WGMXCC1_WGMXCCGn1
- - - [512, 512, 1, 64]
    - [198, 1.33]
  - - [1024, 512, 1, 64]
    - [204, 2.21]
  - - [1536, 512, 1, 64]
    - [6, 2764.79]
  - - [2048, 512, 1, 64]
    - [15, 3519.82]
  - - [2560, 512, 1, 64]
    - [7, 4377.96]
  - - [3072, 512, 1, 64]
    - [5, 5057.82]
  - - [512, 1024, 1, 64]
    - [252, 2.23]
  - - [1024, 1024, 1, 64]
    - [247, 4.79]
  - - [1536, 1024, 1, 64]
    - [360, 6.67]
  - - [2048, 1024, 1, 64]
    - [358, 8.12]
  - - [2560, 1024, 1, 64]
    - [4, 7148.67]
  - - [3072, 1024, 1, 64]
    - [4, 7922.19]
  - - [512, 1536, 1, 64]
    - [4, 2895.54]
  - - [1024, 1536, 1, 64]
    - [376, 6.93]
  - - [1536, 1536, 1, 64]
    - [360, 8.36]
  - - [2048, 1536, 1, 64]
    - [233, 9.48]
  - - [2560, 1536, 1, 64]
    - [7, 9019.2]
  - - [3072, 1536, 1, 64]
    - [5, 9848.67]
  - - [512, 2048, 1, 64]
    - [4, 3739.91]
  - - [1024, 2048, 1, 64]
    - [360, 8.02]
  - - [1536, 2048, 1, 64]
    - [239, 9.28]
  - - [2048, 2048, 1, 64]
    - [374, 11.28]
  - - [2560, 2048, 1, 64]
    - [2, 10608.8]
  - - [3072, 2048, 1, 64]
    - [4, 12018.4]
  - - [512, 2560, 1, 64]
    - [5, 4229.73]
  - - [1024, 2560, 1, 64]
    - [4, 7224.09]
  - - [1536, 2560, 1, 64]
    - [5, 8998.24]
  - - [2048, 2560, 1, 64]
    - [1, 10791.5]
  - - [2560, 2560, 1, 64]
    - [5, 12205.3]
  - - [3072, 2560, 1, 64]
    - [3, 12526.4]
  - - [512, 3072, 1, 64]
    - [17, 3995.76]
  - - [1024, 3072, 1, 64]
    - [7, 7679.97]
  - - [1536, 3072, 1, 64]
    - [1, 10270.0]
  - - [2048, 3072, 1, 64]
    - [4, 11815.3]
  - - [2560, 3072, 1, 64]
    - [5, 12965.9]
  - - [3072, 3072, 1, 64]
    - [7, 13879.2]
  - - [512, 512, 1, 256]
    - [279, 4.28]
  - - [1024, 512, 1, 256]
    - [279, 6.45]
  - - [1536, 512, 1, 256]
    - [6, 8778.71]
  - - [2048, 512, 1, 256]
    - [4, 10953.9]
  - - [2560, 512, 1, 256]
    - [15, 12527.3]
  - - [3072, 512, 1, 256]
    - [0, 9610.21]
  - - [512, 1024, 1, 256]
    - [292, 6.38]
  - - [1024, 1024, 1, 256]
    - [239, 15.84]
  - - [1536, 1024, 1, 256]
    - [364, 19.1]
  - - [2048, 1024, 1, 256]
    - [239, 21.74]
  - - [2560, 1024, 1, 256]
    - [4, 18361.3]
  - - [3072, 1024, 1, 256]
    - [13, 19686.5]
  - - [512, 1536, 1, 256]
    - [4, 8780.82]
  - - [1024, 1536, 1, 256]
    - [376, 19.56]
  - - [1536, 1536, 1, 256]
    - [376, 21.58]
  - - [2048, 1536, 1, 256]
    - [369, 24.01]
  - - [2560, 1536, 1, 256]
    - [4, 21248.4]
  - - [3072, 1536, 1, 256]
    - [4, 22807.0]
  - - [512, 2048, 1, 256]
    - [14, 7492.55]
  - - [1024, 2048, 1, 256]
    - [245, 22.03]
  - - [1536, 2048, 1, 256]
    - [370, 23.47]
  - - [2048, 2048, 1, 256]
    - [360, 27.11]
  - - [2560, 2048, 1, 256]
    - [4, 23864.7]
  - - [3072, 2048, 1, 256]
    - [4, 25187.5]
  - - [512, 2560, 1, 256]
    - [4, 12600.2]
  - - [1024, 2560, 1, 256]
    - [15, 18341.3]
  - - [1536, 2560, 1, 256]
    - [4, 21642.2]
  - - [2048, 2560, 1, 256]
    - [4, 23746.5]
  - - [2560, 2560, 1, 256]
    - [4, 25374.1]
  - - [3072, 2560, 1, 256]
    - [4, 26900.8]
  - - [512, 3072, 1, 256]
    - [13, 14040.0]
  - - [1024, 3072, 1, 256]
    - [4, 20017.3]
  - - [1536, 3072, 1, 256]
    - [4, 22886.9]
  - - [2048, 3072, 1, 256]
    - [4, 25132.2]
  - - [2560, 3072, 1, 256]
    - [0, 26647.4]
  - - [3072, 3072, 1, 256]
    - [15, 27327.5]
  - - [512, 512, 1, 512]
    - [292, 9.59]
  - - [1024, 512, 1, 512]
    - [286, 9.29]
  - - [1536, 512, 1, 512]
    - [15, 14221.5]
  - - [2048, 512, 1, 512]
    - [13, 17068.4]
  - - [2560, 512, 1, 512]
    - [15, 18650.2]
  - - [3072, 512, 1, 512]
    - [4, 20663.2]
  - - [512, 1024, 1, 512]
    - [182, 9.26]
  - - [1024, 1024, 1, 512]
    - [219, 11.31]
  - - [1536, 1024, 1, 512]
    - [4, 20655.0]
  - - [2048, 1024, 1, 512]
    - [15, 22773.6]
  - - [2560, 1024, 1, 512]
    - [13, 24229.7]
  - - [3072, 1024, 1, 512]
    - [15, 25706.9]
  - - [512, 1536, 1, 512]
    - [4, 14320.4]
  - - [1024, 1536, 1, 512]
    - [4, 20400.7]
  - - [1536, 1536, 1, 512]
    - [4, 23523.4]
  - - [2048, 1536, 1, 512]
    - [13, 26308.4]
  - - [2560, 1536, 1, 512]
    - [15, 27021.9]
  - - [3072, 1536, 1, 512]
    - [4, 29369.5]
  - - [512, 2048, 1, 512]
    - [4, 16680.5]
  - - [1024, 2048, 1, 512]
    - [15, 22463.2]
  - - [1536, 2048, 1, 512]
    - [13, 25764.7]
  - - [2048, 2048, 1, 512]
    - [4, 27882.2]
  - - [2560, 2048, 1, 512]
    - [4, 29294.8]
  - - [3072, 2048, 1, 512]
    - [13, 30521.8]
  - - [512, 2560, 1, 512]
    - [15, 18251.5]
  - - [1024, 2560, 1, 512]
    - [13, 19232.6]
  - - [1536, 2560, 1, 512]
    - [13, 27498.9]
  - - [2048, 2560, 1, 512]
    - [15, 29866.3]
  - - [2560, 2560, 1, 512]
    - [15, 30820.6]
  - - [3072, 2560, 1, 512]
    - [4, 32075.9]
  - - [512, 3072, 1, 512]
    - [17, 15962.5]
  - - [1024, 3072, 1, 512]
    - [13, 25657.7]
  - - [1536, 3072, 1, 512]
    - [13, 28584.3]
  - - [2048, 3072, 1, 512]
    - [4, 30594.4]
  - - [2560, 3072, 1, 512]
    - [0, 30950.8]
  - - [3072, 3072, 1, 512]
    - [13, 32420.7]
  - - [512, 512, 1, 1024]
    - [225, 10.17]
  - - [1024, 512, 1, 1024]
    - [314, 13.4]
  - - [1536, 512, 1, 1024]
    - [4, 20059.7]
  - - [2048, 512, 1, 1024]
    - [15, 22638.7]
  - - [2560, 512, 1, 1024]
    - [16, 23365.2]
  - - [3072, 512, 1, 1024]
    - [4, 26126.8]
  - - [512, 1024, 1, 1024]
    - [296, 13.71]
  - - [1024, 1024, 1, 1024]
    - [254, 32.69]
  - - [1536, 1024, 1, 1024]
    - [376, 35.66]
  - - [2048, 1024, 1, 1024]
    - [388, 36.68]
  - - [2560, 1024, 1, 1024]
    - [4, 29343.0]
  - - [3072, 1024, 1, 1024]
    - [15, 30870.5]
  - - [512, 1536, 1, 1024]
    - [15, 19795.4]
  - - [1024, 1536, 1, 1024]
    - [376, 36.96]
  - - [1536, 1536, 1, 1024]
    - [254, 36.37]
  - - [2048, 1536, 1, 1024]
    - [383, 39.01]
  - - [2560, 1536, 1, 1024]
    - [15, 32041.5]
  - - [3072, 1536, 1, 1024]
    - [4, 32160.4]
  - - [512, 2048, 1, 1024]
    - [15, 23000.9]
  - - [1024, 2048, 1, 1024]
    - [388, 37.82]
  - - [1536, 2048, 1, 1024]
    - [368, 38.66]
  - - [2048, 2048, 1, 1024]
    - [365, 41.84]
  - - [2560, 2048, 1, 1024]
    - [0, 33207.0]
  - - [3072, 2048, 1, 1024]
    - [0, 34410.8]
  - - [512, 2560, 1, 1024]
    - [15, 19293.7]
  - - [1024, 2560, 1, 1024]
    - [16, 28586.9]
  - - [1536, 2560, 1, 1024]
    - [4, 31516.4]
  - - [2048, 2560, 1, 1024]
    - [4, 32695.5]
  - - [2560, 2560, 1, 1024]
    - [13, 33584.5]
  - - [3072, 2560, 1, 1024]
    - [4, 34444.3]
  - - [512, 3072, 1, 1024]
    - [4, 26250.5]
  - - [1024, 3072, 1, 1024]
    - [13, 30288.9]
  - - [1536, 3072, 1, 1024]
    - [15, 32653.5]
  - - [2048, 3072, 1, 1024]
    - [15, 34049.1]
  - - [2560, 3072, 1, 1024]
    - [13, 34721.0]
  - - [3072, 3072, 1, 1024]
    - [4, 34981.8]
  - - [512, 512, 1, 2048]
    - [225, 12.74]
  - - [1024, 512, 1, 2048]
    - [314, 15.62]
  - - [1536, 512, 1, 2048]
    - [15, 24494.7]
  - - [2048, 512, 1, 2048]
    - [4, 27958.6]
  - - [2560, 512, 1, 2048]
    - [13, 28495.7]
  - - [3072, 512, 1, 2048]
    - [15, 29965.7]
  - - [512, 1024, 1, 2048]
    - [296, 15.7]
  - - [1024, 1024, 1, 2048]
    - [306, 18.33]
  - - [1536, 1024, 1, 2048]
    - [15, 30559.4]
  - - [2048, 1024, 1, 2048]
    - [15, 31352.9]
  - - [2560, 1024, 1, 2048]
    - [13, 32903.2]
  - - [3072, 1024, 1, 2048]
    - [15, 34230.3]
  - - [512, 1536, 1, 2048]
    - [15, 24394.2]
  - - [1024, 1536, 1, 2048]
    - [4, 29957.4]
  - - [1536, 1536, 1, 2048]
    - [4, 32132.4]
  - - [2048, 1536, 1, 2048]
    - [4, 32967.6]
  - - [2560, 1536, 1, 2048]
    - [15, 34108.8]
  - - [3072, 1536, 1, 2048]
    - [4, 35303.1]
  - - [512, 2048, 1, 2048]
    - [15, 27543.7]
  - - [1024, 2048, 1, 2048]
    - [15, 31852.7]
  - - [1536, 2048, 1, 2048]
    - [4, 33429.5]
  - - [2048, 2048, 1, 2048]
    - [358, 46.0]
  - - [2560, 2048, 1, 2048]
    - [15, 35012.8]
  - - [3072, 2048, 1, 2048]
    - [4, 34927.5]
  - - [512, 2560, 1, 2048]
    - [15, 28473.1]
  - - [1024, 2560, 1, 2048]
    - [13, 32443.1]
  - - [1536, 2560, 1, 2048]
    - [15, 33703.4]
  - - [2048, 2560, 1, 2048]
    - [15, 34952.8]
  - - [2560, 2560, 1, 2048]
    - [15, 35427.5]
  - - [3072, 2560, 1, 2048]
    - [15, 35568.4]
  - - [512, 3072, 1, 2048]
    - [0, 30643.9]
  - - [1024, 3072, 1, 2048]
    - [4, 33135.0]
  - - [1536, 3072, 1, 2048]
    - [15, 35086.0]
  - - [2048, 3072, 1, 2048]
    - [13, 35286.5]
  - - [2560, 3072, 1, 2048]
    - [4, 35540.8]
  - - [3072, 3072, 1, 2048]
    - [15, 35994.4]
  - - [512, 512, 1, 3072]
    - [9, 17907.8]
  - - [1024, 512, 1, 3072]
    - [13, 25523.4]
  - - [1536, 512, 1, 3072]
    - [15, 26395.7]
  - - [2048, 512, 1, 3072]
    - [13, 29236.7]
  - - [2560, 512, 1, 3072]
    - [4, 30260.9]
  - - [3072, 512, 1, 3072]
    - [15, 31219.3]
  - - [512, 1024, 1, 3072]
    - [2, 24676.9]
  - - [1024, 1024, 1, 3072]
    - [15, 29555.2]
  - - [1536, 1024, 1, 3072]
    - [4, 31553.2]
  - - [2048, 1024, 1, 3072]
    - [4, 32571.0]
  - - [2560, 1024, 1, 3072]
    - [13, 33635.7]
  - - [3072, 1024, 1, 3072]
    - [0, 34003.7]
  - - [512, 1536, 1, 3072]
    - [4, 26965.3]
  - - [1024, 1536, 1, 3072]
    - [13, 31697.3]
  - - [1536, 1536, 1, 3072]
    - [15, 33471.2]
  - - [2048, 1536, 1, 3072]
    - [15, 34142.1]
  - - [2560, 1536, 1, 3072]
    - [4, 34520.7]
  - - [3072, 1536, 1, 3072]
    - [0, 35005.5]
  - - [512, 2048, 1, 3072]
    - [0, 30031.5]
  - - [1024, 2048, 1, 3072]
    - [15, 33287.7]
  - - [1536, 2048, 1, 3072]
    - [13, 34538.9]
  - - [2048, 2048, 1, 3072]
    - [4, 34890.2]
  - - [2560, 2048, 1, 3072]
    - [15, 35540.9]
  - - [3072, 2048, 1, 3072]
    - [15, 35493.7]
  - - [512, 2560, 1, 3072]
    - [15, 30412.2]
  - - [1024, 2560, 1, 3072]
    - [13, 34182.2]
  - - [1536, 2560, 1, 3072]
    - [4, 34612.4]
  - - [2048, 2560, 1, 3072]
    - [4, 34945.9]
  - - [2560, 2560, 1, 3072]
    - [15, 35803.3]
  - - [3072, 2560, 1, 3072]
    - [0, 35815.1]
  - - [512, 3072, 1, 3072]
    - [0, 32031.1]
  - - [1024, 3072, 1, 3072]
    - [15, 33794.0]
  - - [1536, 3072, 1, 3072]
    - [0, 34947.1]
  - - [2048, 3072, 1, 3072]
    - [15, 35799.6]
  - - [2560, 3072, 1, 3072]
    - [0, 35674.7]
  - - [3072, 3072, 1, 3072]
    - [330, 52.78]
  - - [1, 1, 1, 1]
    - [357, 0.0]
  - - [1, 1, 1, 64]
    - [12, 0.004]
  - - [1, 64, 1, 1]
    - [11, 0.00423883]
  - - [64, 1, 1, 1]
    - [11, 0.00425858]
  - - [64, 64, 1, 1]
    - [8, 0.269323]
  - - [64, 1, 1, 64]
    - [10, 0.267914]
  - - [1, 64, 1, 64]
    - [12, 0.266945]
  - - [64, 64, 1, 64]
    - [114, 0.02]
  - - [64, 64, 1, 256]
    - [257, 0.1]
  - - [64, 64, 1, 512]
    - [297, 0.19]
  - - [64, 64, 1, 1024]
    - [278, 0.33]
  - - [64, 64, 1, 2048]
    - [322, 0.57]
  - - [64, 64, 1, 4096]
    - [331, 0.84]
  - - [256, 256, 1, 256]
    - [264, 1.52]
  - - [4096, 4096, 1, 4096]
    - [359, 53.63]
  - - [320, 64, 1, 64]
    - [118, 0.13]
  - - [576, 64, 1, 64]
    - [122, 0.23]
  - - [832, 64, 1, 64]
    - [124, 0.33]
  - - [1088, 64, 1, 64]
    - [133, 0.42]
  - - [1344, 64, 1, 64]
    - [135, 0.53]
  - - [1600, 64, 1, 64]
    - [166, 0.62]
  - - [1856, 64, 1, 64]
    - [337, 0.71]
  - - [2112, 64, 1, 64]
    - [395, 0.8]
  - - [2368, 64, 1, 64]
    - [290, 0.89]
  - - [2624, 64, 1, 64]
    - [170, 0.98]
  - - [2880, 64, 1, 64]
    - [180, 1.08]
  - - [3136, 64, 1, 64]
    - [341, 1.16]
  - - [3392, 64, 1, 64]
    - [137, 1.24]
  - - [3648, 64, 1, 64]
    - [177, 1.36]
  - - [3904, 64, 1, 64]
    - [139, 1.48]
  - - [64, 320, 1, 64]
    - [130, 0.13]
  - - [320, 320, 1, 64]
    - [164, 0.61]
  - - [576, 320, 1, 64]
    - [165, 1.08]
  - - [832, 320, 1, 64]
    - [168, 1.49]
  - - [1088, 320, 1, 64]
    - [139, 1.93]
  - - [1344, 320, 1, 64]
    - [199, 2.29]
  - - [1600, 320, 1, 64]
    - [240, 2.7]
  - - [1856, 320, 1, 64]
    - [159, 3.08]
  - - [2112, 320, 1, 64]
    - [168, 3.27]
  - - [2368, 320, 1, 64]
    - [191, 3.67]
  - - [2624, 320, 1, 64]
    - [177, 3.94]
  - - [2880, 320, 1, 64]
    - [159, 4.21]
  - - [3136, 320, 1, 64]
    - [159, 4.47]
  - - [3392, 320, 1, 64]
    - [209, 4.59]
  - - [3648, 320, 1, 64]
    - [159, 4.93]
  - - [3904, 320, 1, 64]
    - [343, 5.17]
  - - [64, 576, 1, 64]
    - [172, 0.24]
  - - [320, 576, 1, 64]
    - [177, 1.1]
  - - [576, 576, 1, 64]
    - [208, 1.87]
  - - [832, 576, 1, 64]
    - [210, 2.49]
  - - [1088, 576, 1, 64]
    - [225, 3.16]
  - - [1344, 576, 1, 64]
    - [177, 3.76]
  - - [1600, 576, 1, 64]
    - [177, 4.26]
  - - [1856, 576, 1, 64]
    - [177, 4.63]
  - - [2112, 576, 1, 64]
    - [177, 5.1]
  - - [2368, 576, 1, 64]
    - [191, 5.16]
  - - [2624, 576, 1, 64]
    - [343, 5.81]
  - - [2880, 576, 1, 64]
    - [200, 5.89]
  - - [3136, 576, 1, 64]
    - [343, 6.52]
  - - [3392, 576, 1, 64]
    - [343, 6.56]
  - - [3648, 576, 1, 64]
    - [343, 6.96]
  - - [3904, 576, 1, 64]
    - [177, 7.17]
  - - [64, 832, 1, 64]
    - [234, 0.32]
  - - [320, 832, 1, 64]
    - [205, 1.5]
  - - [576, 832, 1, 64]
    - [164, 2.52]
  - - [832, 832, 1, 64]
    - [168, 3.34]
  - - [1088, 832, 1, 64]
    - [209, 4.18]
  - - [1344, 832, 1, 64]
    - [168, 4.75]
  - - [1600, 832, 1, 64]
    - [343, 5.34]
  - - [1856, 832, 1, 64]
    - [343, 5.93]
  - - [2112, 832, 1, 64]
    - [159, 6.03]
  - - [2368, 832, 1, 64]
    - [343, 6.65]
  - - [2624, 832, 1, 64]
    - [177, 7.12]
  - - [2880, 832, 1, 64]
    - [343, 7.29]
  - - [3136, 832, 1, 64]
    - [209, 7.67]
  - - [3392, 832, 1, 64]
    - [177, 8.18]
  - - [3648, 832, 1, 64]
    - [343, 8.31]
  - - [3904, 832, 1, 64]
    - [177, 8.16]
  - - [64, 1088, 1, 64]
    - [135, 0.43]
  - - [320, 1088, 1, 64]
    - [240, 1.92]
  - - [576, 1088, 1, 64]
    - [159, 3.25]
  - - [832, 1088, 1, 64]
    - [177, 4.27]
  - - [1088, 1088, 1, 64]
    - [177, 5.03]
  - - [1344, 1088, 1, 64]
    - [343, 5.67]
  - - [1600, 1088, 1, 64]
    - [177, 5.91]
  - - [1856, 1088, 1, 64]
    - [343, 6.8]
  - - [2112, 1088, 1, 64]
    - [343, 7.34]
  - - [2368, 1088, 1, 64]
    - [177, 7.61]
  - - [2624, 1088, 1, 64]
    - [177, 7.69]
  - - [2880, 1088, 1, 64]
    - [348, 7.98]
  - - [3136, 1088, 1, 64]
    - [343, 8.27]
  - - [3392, 1088, 1, 64]
    - [177, 9.1]
  - - [3648, 1088, 1, 64]
    - [177, 9.46]
  - - [3904, 1088, 1, 64]
    - [177, 9.61]
  - - [64, 1344, 1, 64]
    - [344, 0.53]
  - - [320, 1344, 1, 64]
    - [171, 2.34]
  - - [576, 1344, 1, 64]
    - [343, 3.73]
  - - [832, 1344, 1, 64]
    - [191, 4.8]
  - - [1088, 1344, 1, 64]
    - [343, 5.64]
  - - [1344, 1344, 1, 64]
    - [177, 6.48]
  - - [1600, 1344, 1, 64]
    - [177, 7.13]
  - - [1856, 1344, 1, 64]
    - [177, 7.71]
  - - [2112, 1344, 1, 64]
    - [343, 8.0]
  - - [2368, 1344, 1, 64]
    - [177, 8.62]
  - - [2624, 1344, 1, 64]
    - [177, 8.99]
  - - [2880, 1344, 1, 64]
    - [343, 8.81]
  - - [3136, 1344, 1, 64]
    - [177, 9.5]
  - - [3392, 1344, 1, 64]
    - [343, 9.9]
  - - [3648, 1344, 1, 64]
    - [343, 10.23]
  - - [3904, 1344, 1, 64]
    - [177, 10.39]
  - - [64, 1600, 1, 64]
    - [346, 0.6]
  - - [320, 1600, 1, 64]
    - [180, 2.75]
  - - [576, 1600, 1, 64]
    - [177, 4.23]
  - - [832, 1600, 1, 64]
    - [177, 5.38]
  - - [1088, 1600, 1, 64]
    - [343, 6.31]
  - - [1344, 1600, 1, 64]
    - [177, 7.12]
  - - [1600, 1600, 1, 64]
    - [177, 7.76]
  - - [1856, 1600, 1, 64]
    - [343, 8.26]
  - - [2112, 1600, 1, 64]
    - [177, 8.91]
  - - [2368, 1600, 1, 64]
    - [209, 8.87]
  - - [2624, 1600, 1, 64]
    - [343, 9.62]
  - - [2880, 1600, 1, 64]
    - [177, 9.92]
  - - [3136, 1600, 1, 64]
    - [177, 10.33]
  - - [3392, 1600, 1, 64]
    - [343, 10.47]
  - - [3648, 1600, 1, 64]
    - [343, 10.59]
  - - [3904, 1600, 1, 64]
    - [177, 10.77]
  - - [64, 1856, 1, 64]
    - [139, 0.72]
  - - [320, 1856, 1, 64]
    - [159, 3.07]
  - - [576, 1856, 1, 64]
    - [168, 4.6]
  - - [832, 1856, 1, 64]
    - [177, 5.94]
  - - [1088, 1856, 1, 64]
    - [343, 6.75]
  - - [1344, 1856, 1, 64]
    - [343, 7.55]
  - - [1600, 1856, 1, 64]
    - [177, 8.4]
  - - [1856, 1856, 1, 64]
    - [177, 8.81]
  - - [2112, 1856, 1, 64]
    - [343, 9.41]
  - - [2368, 1856, 1, 64]
    - [177, 9.24]
  - - [2624, 1856, 1, 64]
    - [177, 10.11]
  - - [2880, 1856, 1, 64]
    - [177, 10.44]
  - - [3136, 1856, 1, 64]
    - [343, 10.48]
  - - [3392, 1856, 1, 64]
    - [177, 10.94]
  - - [3648, 1856, 1, 64]
    - [177, 11.18]
  - - [3904, 1856, 1, 64]
    - [343, 11.1]
  - - [64, 2112, 1, 64]
    - [396, 0.8]
  - - [320, 2112, 1, 64]
    - [159, 3.31]
  - - [576, 2112, 1, 64]
    - [177, 5.09]
  - - [832, 2112, 1, 64]
    - [177, 6.39]
  - - [1088, 2112, 1, 64]
    - [343, 7.28]
  - - [1344, 2112, 1, 64]
    - [177, 8.14]
  - - [1600, 2112, 1, 64]
    - [177, 8.81]
  - - [1856, 2112, 1, 64]
    - [177, 8.52]
  - - [2112, 2112, 1, 64]
    - [343, 9.7]
  - - [2368, 2112, 1, 64]
    - [177, 10.2]
  - - [2624, 2112, 1, 64]
    - [343, 10.6]
  - - [2880, 2112, 1, 64]
    - [177, 10.83]
  - - [3136, 2112, 1, 64]
    - [177, 11.1]
  - - [3392, 2112, 1, 64]
    - [233, 11.06]
  - - [3648, 2112, 1, 64]
    - [364, 11.57]
  - - [3904, 2112, 1, 64]
    - [247, 11.89]
  - - [64, 2368, 1, 64]
    - [347, 0.89]
  - - [320, 2368, 1, 64]
    - [159, 3.68]
  - - [576, 2368, 1, 64]
    - [177, 5.41]
  - - [832, 2368, 1, 64]
    - [177, 6.79]
  - - [1088, 2368, 1, 64]
    - [177, 7.81]
  - - [1344, 2368, 1, 64]
    - [177, 8.59]
  - - [1600, 2368, 1, 64]
    - [343, 9.03]
  - - [1856, 2368, 1, 64]
    - [177, 9.69]
  - - [2112, 2368, 1, 64]
    - [343, 10.2]
  - - [2368, 2368, 1, 64]
    - [177, 10.69]
  - - [2624, 2368, 1, 64]
    - [343, 10.72]
  - - [2880, 2368, 1, 64]
    - [343, 10.97]
  - - [3136, 2368, 1, 64]
    - [177, 11.32]
  - - [3392, 2368, 1, 64]
    - [343, 11.62]
  - - [3648, 2368, 1, 64]
    - [247, 12.07]
  - - [3904, 2368, 1, 64]
    - [374, 12.19]
  - - [64, 2624, 1, 64]
    - [397, 0.97]
  - - [320, 2624, 1, 64]
    - [343, 3.88]
  - - [576, 2624, 1, 64]
    - [177, 5.83]
  - - [832, 2624, 1, 64]
    - [343, 7.21]
  - - [1088, 2624, 1, 64]
    - [343, 8.17]
  - - [1344, 2624, 1, 64]
    - [177, 8.43]
  - - [1600, 2624, 1, 64]
    - [177, 9.55]
  - - [1856, 2624, 1, 64]
    - [343, 9.92]
  - - [2112, 2624, 1, 64]
    - [343, 10.42]
  - - [2368, 2624, 1, 64]
    - [343, 10.84]
  - - [2624, 2624, 1, 64]
    - [177, 10.84]
  - - [2880, 2624, 1, 64]
    - [398, 11.18]
  - - [3136, 2624, 1, 64]
    - [177, 11.27]
  - - [3392, 2624, 1, 64]
    - [369, 12.19]
  - - [3648, 2624, 1, 64]
    - [247, 12.69]
  - - [3904, 2624, 1, 64]
    - [247, 12.91]
  - - [64, 2880, 1, 64]
    - [399, 1.07]
  - - [320, 2880, 1, 64]
    - [168, 4.23]
  - - [576, 2880, 1, 64]
    - [343, 6.19]
  - - [832, 2880, 1, 64]
    - [177, 7.57]
  - - [1088, 2880, 1, 64]
    - [177, 7.7]
  - - [1344, 2880, 1, 64]
    - [177, 9.38]
  - - [1600, 2880, 1, 64]
    - [343, 9.8]
  - - [1856, 2880, 1, 64]
    - [177, 10.59]
  - - [2112, 2880, 1, 64]
    - [177, 10.77]
  - - [2368, 2880, 1, 64]
    - [343, 11.01]
  - - [2624, 2880, 1, 64]
    - [343, 11.4]
  - - [2880, 2880, 1, 64]
    - [343, 11.66]
  - - [3136, 2880, 1, 64]
    - [364, 12.03]
  - - [3392, 2880, 1, 64]
    - [364, 12.28]
  - - [3648, 2880, 1, 64]
    - [247, 12.8]
  - - [3904, 2880, 1, 64]
    - [386, 13.39]
  - - [64, 3136, 1, 64]
    - [148, 1.2]
  - - [320, 3136, 1, 64]
    - [191, 4.48]
  - - [576, 3136, 1, 64]
    - [177, 6.51]
  - - [832, 3136, 1, 64]
    - [159, 7.53]
  - - [1088, 3136, 1, 64]
    - [177, 8.92]
  - - [1344, 3136, 1, 64]
    - [177, 9.61]
  - - [1600, 3136, 1, 64]
    - [177, 10.06]
  - - [1856, 3136, 1, 64]
    - [177, 10.6]
  - - [2112, 3136, 1, 64]
    - [177, 11.17]
  - - [2368, 3136, 1, 64]
    - [177, 11.65]
  - - [2624, 3136, 1, 64]
    - [367, 11.59]
  - - [2880, 3136, 1, 64]
    - [233, 12.57]
  - - [3136, 3136, 1, 64]
    - [247, 12.43]
  - - [3392, 3136, 1, 64]
    - [369, 12.92]
  - - [3648, 3136, 1, 64]
    - [247, 13.51]
  - - [3904, 3136, 1, 64]
    - [233, 13.69]
  - - [64, 3392, 1, 64]
    - [205, 1.29]
  - - [320, 3392, 1, 64]
    - [400, 4.53]
  - - [576, 3392, 1, 64]
    - [343, 6.81]
  - - [832, 3392, 1, 64]
    - [343, 8.01]
  - - [1088, 3392, 1, 64]
    - [177, 9.21]
  - - [1344, 3392, 1, 64]
    - [177, 9.4]
  - - [1600, 3392, 1, 64]
    - [177, 10.61]
  - - [1856, 3392, 1, 64]
    - [343, 10.86]
  - - [2112, 3392, 1, 64]
    - [343, 11.01]
  - - [2368, 3392, 1, 64]
    - [375, 11.51]
  - - [2624, 3392, 1, 64]
    - [385, 12.31]
  - - [2880, 3392, 1, 64]
    - [385, 12.56]
  - - [3136, 3392, 1, 64]
    - [386, 12.99]
  - - [3392, 3392, 1, 64]
    - [374, 13.28]
  - - [3648, 3392, 1, 64]
    - [369, 13.47]
  - - [3904, 3392, 1, 64]
    - [247, 13.88]
  - - [64, 3648, 1, 64]
    - [151, 1.39]
  - - [320, 3648, 1, 64]
    - [177, 5.02]
  - - [576, 3648, 1, 64]
    - [177, 7.05]
  - - [832, 3648, 1, 64]
    - [343, 8.37]
  - - [1088, 3648, 1, 64]
    - [177, 9.48]
  - - [1344, 3648, 1, 64]
    - [177, 9.98]
  - - [1600, 3648, 1, 64]
    - [177, 10.76]
  - - [1856, 3648, 1, 64]
    - [343, 11.13]
  - - [2112, 3648, 1, 64]
    - [177, 11.18]
  - - [2368, 3648, 1, 64]
    - [233, 11.99]
  - - [2624, 3648, 1, 64]
    - [369, 12.67]
  - - [2880, 3648, 1, 64]
    - [375, 12.9]
  - - [3136, 3648, 1, 64]
    - [247, 13.29]
  - - [3392, 3648, 1, 64]
    - [369, 13.77]
  - - [3648, 3648, 1, 64]
    - [370, 13.79]
  - - [3904, 3648, 1, 64]
    - [247, 14.23]
  - - [64, 3904, 1, 64]
    - [191, 1.48]
  - - [320, 3904, 1, 64]
    - [177, 5.13]
  - - [576, 3904, 1, 64]
    - [177, 7.4]
  - - [832, 3904, 1, 64]
    - [177, 8.61]
  - - [1088, 3904, 1, 64]
    - [177, 9.65]
  - - [1344, 3904, 1, 64]
    - [177, 10.34]
  - - [1600, 3904, 1, 64]
    - [177, 10.79]
  - - [1856, 3904, 1, 64]
    - [177, 11.31]
  - - [2112, 3904, 1, 64]
    - [343, 11.4]
  - - [2368, 3904, 1, 64]
    - [233, 12.32]
  - - [2624, 3904, 1, 64]
    - [386, 12.69]
  - - [2880, 3904, 1, 64]
    - [369, 13.14]
  - - [3136, 3904, 1, 64]
    - [375, 13.37]
  - - [3392, 3904, 1, 64]
    - [246, 13.6]
  - - [3648, 3904, 1, 64]
    - [247, 14.33]
  - - [3904, 3904, 1, 64]
    - [381, 14.22]
  - - [320, 64, 1, 256]
    - [261, 0.5]
  - - [576, 64, 1, 256]
    - [264, 0.88]
  - - [832, 64, 1, 256]
    - [268, 1.27]
  - - [1088, 64, 1, 256]
    - [264, 1.57]
  - - [1344, 64, 1, 256]
    - [267, 1.91]
  - - [1600, 64, 1, 256]
    - [249, 2.3]
  - - [1856, 64, 1, 256]
    - [249, 2.66]
  - - [2112, 64, 1, 256]
    - [249, 2.94]
  - - [2368, 64, 1, 256]
    - [157, 3.24]
  - - [2624, 64, 1, 256]
    - [249, 3.66]
  - - [2880, 64, 1, 256]
    - [249, 4.0]
  - - [3136, 64, 1, 256]
    - [249, 4.31]
  - - [3392, 64, 1, 256]
    - [182, 4.54]
  - - [3648, 64, 1, 256]
    - [182, 4.95]
  - - [3904, 64, 1, 256]
    - [225, 5.31]
  - - [64, 320, 1, 256]
    - [264, 0.49]
  - - [320, 320, 1, 256]
    - [249, 2.3]
  - - [576, 320, 1, 256]
    - [182, 3.94]
  - - [832, 320, 1, 256]
    - [157, 5.34]
  - - [1088, 320, 1, 256]
    - [157, 6.8]
  - - [1344, 320, 1, 256]
    - [157, 7.95]
  - - [1600, 320, 1, 256]
    - [182, 9.07]
  - - [1856, 320, 1, 256]
    - [279, 9.9]
  - - [2112, 320, 1, 256]
    - [202, 10.41]
  - - [2368, 320, 1, 256]
    - [284, 11.62]
  - - [2624, 320, 1, 256]
    - [293, 12.07]
  - - [2880, 320, 1, 256]
    - [202, 12.43]
  - - [3136, 320, 1, 256]
    - [284, 13.56]
  - - [3392, 320, 1, 256]
    - [284, 13.12]
  - - [3648, 320, 1, 256]
    - [286, 14.84]
  - - [3904, 320, 1, 256]
    - [185, 14.71]
  - - [64, 576, 1, 256]
    - [268, 0.87]
  - - [320, 576, 1, 256]
    - [157, 3.93]
  - - [576, 576, 1, 256]
    - [157, 6.5]
  - - [832, 576, 1, 256]
    - [225, 8.66]
  - - [1088, 576, 1, 256]
    - [202, 10.48]
  - - [1344, 576, 1, 256]
    - [287, 12.07]
  - - [1600, 576, 1, 256]
    - [286, 12.59]
  - - [1856, 576, 1, 256]
    - [286, 13.8]
  - - [2112, 576, 1, 256]
    - [286, 14.65]
  - - [2368, 576, 1, 256]
    - [287, 15.29]
  - - [2624, 576, 1, 256]
    - [287, 16.52]
  - - [2880, 576, 1, 256]
    - [286, 17.45]
  - - [3136, 576, 1, 256]
    - [286, 17.78]
  - - [3392, 576, 1, 256]
    - [284, 18.45]
  - - [3648, 576, 1, 256]
    - [293, 18.4]
  - - [3904, 576, 1, 256]
    - [185, 18.83]
  - - [64, 832, 1, 256]
    - [278, 1.26]
  - - [320, 832, 1, 256]
    - [249, 5.41]
  - - [576, 832, 1, 256]
    - [286, 8.7]
  - - [832, 832, 1, 256]
    - [289, 10.75]
  - - [1088, 832, 1, 256]
    - [286, 12.92]
  - - [1344, 832, 1, 256]
    - [286, 14.42]
  - - [1600, 832, 1, 256]
    - [287, 15.37]
  - - [1856, 832, 1, 256]
    - [293, 16.53]
  - - [2112, 832, 1, 256]
    - [286, 17.62]
  - - [2368, 832, 1, 256]
    - [287, 17.97]
  - - [2624, 832, 1, 256]
    - [366, 18.92]
  - - [2880, 832, 1, 256]
    - [286, 19.25]
  - - [3136, 832, 1, 256]
    - [286, 20.51]
  - - [3392, 832, 1, 256]
    - [202, 20.24]
  - - [3648, 832, 1, 256]
    - [185, 20.17]
  - - [3904, 832, 1, 256]
    - [287, 21.67]
  - - [64, 1088, 1, 256]
    - [126, 1.56]
  - - [320, 1088, 1, 256]
    - [225, 6.79]
  - - [576, 1088, 1, 256]
    - [284, 10.45]
  - - [832, 1088, 1, 256]
    - [287, 13.04]
  - - [1088, 1088, 1, 256]
    - [185, 14.47]
  - - [1344, 1088, 1, 256]
    - [349, 15.92]
  - - [1600, 1088, 1, 256]
    - [286, 17.33]
  - - [1856, 1088, 1, 256]
    - [286, 18.35]
  - - [2112, 1088, 1, 256]
    - [202, 18.94]
  - - [2368, 1088, 1, 256]
    - [185, 19.8]
  - - [2624, 1088, 1, 256]
    - [286, 20.68]
  - - [2880, 1088, 1, 256]
    - [293, 21.06]
  - - [3136, 1088, 1, 256]
    - [286, 21.33]
  - - [3392, 1088, 1, 256]
    - [185, 21.84]
  - - [3648, 1088, 1, 256]
    - [296, 22.11]
  - - [3904, 1088, 1, 256]
    - [286, 22.75]
  - - [64, 1344, 1, 256]
    - [265, 1.96]
  - - [320, 1344, 1, 256]
    - [279, 7.92]
  - - [576, 1344, 1, 256]
    - [287, 11.86]
  - - [832, 1344, 1, 256]
    - [286, 14.42]
  - - [1088, 1344, 1, 256]
    - [349, 16.08]
  - - [1344, 1344, 1, 256]
    - [286, 17.79]
  - - [1600, 1344, 1, 256]
    - [286, 18.91]
  - - [1856, 1344, 1, 256]
    - [296, 19.16]
  - - [2112, 1344, 1, 256]
    - [286, 20.65]
  - - [2368, 1344, 1, 256]
    - [286, 20.92]
  - - [2624, 1344, 1, 256]
    - [366, 22.51]
  - - [2880, 1344, 1, 256]
    - [296, 22.24]
  - - [3136, 1344, 1, 256]
    - [287, 22.65]
  - - [3392, 1344, 1, 256]
    - [286, 23.14]
  - - [3648, 1344, 1, 256]
    - [286, 23.23]
  - - [3904, 1344, 1, 256]
    - [287, 24.13]
  - - [64, 1600, 1, 256]
    - [275, 2.26]
  - - [320, 1600, 1, 256]
    - [279, 9.36]
  - - [576, 1600, 1, 256]
    - [286, 12.75]
  - - [832, 1600, 1, 256]
    - [287, 15.26]
  - - [1088, 1600, 1, 256]
    - [286, 17.3]
  - - [1344, 1600, 1, 256]
    - [287, 18.62]
  - - [1600, 1600, 1, 256]
    - [286, 19.66]
  - - [1856, 1600, 1, 256]
    - [286, 21.24]
  - - [2112, 1600, 1, 256]
    - [286, 21.39]
  - - [2368, 1600, 1, 256]
    - [185, 22.17]
  - - [2624, 1600, 1, 256]
    - [366, 23.11]
  - - [2880, 1600, 1, 256]
    - [185, 22.74]
  - - [3136, 1600, 1, 256]
    - [284, 23.18]
  - - [3392, 1600, 1, 256]
    - [330, 23.92]
  - - [3648, 1600, 1, 256]
    - [330, 24.21]
  - - [3904, 1600, 1, 256]
    - [296, 24.53]
  - - [64, 1856, 1, 256]
    - [276, 2.65]
  - - [320, 1856, 1, 256]
    - [286, 9.89]
  - - [576, 1856, 1, 256]
    - [286, 13.7]
  - - [832, 1856, 1, 256]
    - [286, 16.33]
  - - [1088, 1856, 1, 256]
    - [287, 18.22]
  - - [1344, 1856, 1, 256]
    - [293, 19.33]
  - - [1600, 1856, 1, 256]
    - [286, 21.09]
  - - [1856, 1856, 1, 256]
    - [293, 20.95]
  - - [2112, 1856, 1, 256]
    - [286, 21.69]
  - - [2368, 1856, 1, 256]
    - [286, 22.76]
  - - [2624, 1856, 1, 256]
    - [366, 22.91]
  - - [2880, 1856, 1, 256]
    - [286, 24.26]
  - - [3136, 1856, 1, 256]
    - [185, 23.83]
  - - [3392, 1856, 1, 256]
    - [320, 24.55]
  - - [3648, 1856, 1, 256]
    - [233, 25.19]
  - - [3904, 1856, 1, 256]
    - [366, 25.79]
  - - [64, 2112, 1, 256]
    - [182, 2.9]
  - - [320, 2112, 1, 256]
    - [293, 10.49]
  - - [576, 2112, 1, 256]
    - [287, 14.72]
  - - [832, 2112, 1, 256]
    - [286, 17.3]
  - - [1088, 2112, 1, 256]
    - [286, 19.32]
  - - [1344, 2112, 1, 256]
    - [282, 20.37]
  - - [1600, 2112, 1, 256]
    - [286, 21.82]
  - - [1856, 2112, 1, 256]
    - [286, 22.61]
  - - [2112, 2112, 1, 256]
    - [293, 22.9]
  - - [2368, 2112, 1, 256]
    - [284, 22.85]
  - - [2624, 2112, 1, 256]
    - [366, 24.55]
  - - [2880, 2112, 1, 256]
    - [245, 24.25]
  - - [3136, 2112, 1, 256]
    - [239, 25.45]
  - - [3392, 2112, 1, 256]
    - [254, 25.63]
  - - [3648, 2112, 1, 256]
    - [254, 26.85]
  - - [3904, 2112, 1, 256]
    - [367, 27.02]
  - - [64, 2368, 1, 256]
    - [279, 3.26]
  - - [320, 2368, 1, 256]
    - [284, 11.63]
  - - [576, 2368, 1, 256]
    - [286, 15.64]
  - - [832, 2368, 1, 256]
    - [282, 18.02]
  - - [1088, 2368, 1, 256]
    - [282, 19.52]
  - - [1344, 2368, 1, 256]
    - [293, 20.87]
  - - [1600, 2368, 1, 256]
    - [286, 22.41]
  - - [1856, 2368, 1, 256]
    - [286, 22.69]
  - - [2112, 2368, 1, 256]
    - [284, 23.42]
  - - [2368, 2368, 1, 256]
    - [293, 23.68]
  - - [2624, 2368, 1, 256]
    - [366, 24.49]
  - - [2880, 2368, 1, 256]
    - [358, 25.37]
  - - [3136, 2368, 1, 256]
    - [330, 26.19]
  - - [3392, 2368, 1, 256]
    - [364, 26.58]
  - - [3648, 2368, 1, 256]
    - [254, 26.99]
  - - [3904, 2368, 1, 256]
    - [233, 27.55]
  - - [64, 2624, 1, 256]
    - [148, 3.58]
  - - [320, 2624, 1, 256]
    - [309, 12.0]
  - - [576, 2624, 1, 256]
    - [351, 16.4]
  - - [832, 2624, 1, 256]
    - [309, 19.18]
  - - [1088, 2624, 1, 256]
    - [287, 20.52]
  - - [1344, 2624, 1, 256]
    - [351, 22.31]
  - - [1600, 2624, 1, 256]
    - [320, 22.93]
  - - [1856, 2624, 1, 256]
    - [287, 22.73]
  - - [2112, 2624, 1, 256]
    - [351, 24.49]
  - - [2368, 2624, 1, 256]
    - [351, 24.68]
  - - [2624, 2624, 1, 256]
    - [366, 26.23]
  - - [2880, 2624, 1, 256]
    - [320, 25.61]
  - - [3136, 2624, 1, 256]
    - [254, 26.91]
  - - [3392, 2624, 1, 256]
    - [254, 26.63]
  - - [3648, 2624, 1, 256]
    - [254, 27.83]
  - - [3904, 2624, 1, 256]
    - [367, 27.99]
  - - [64, 2880, 1, 256]
    - [225, 3.93]
  - - [320, 2880, 1, 256]
    - [202, 12.34]
  - - [576, 2880, 1, 256]
    - [287, 17.09]
  - - [832, 2880, 1, 256]
    - [286, 19.32]
  - - [1088, 2880, 1, 256]
    - [286, 21.6]
  - - [1344, 2880, 1, 256]
    - [286, 22.21]
  - - [1600, 2880, 1, 256]
    - [286, 23.18]
  - - [1856, 2880, 1, 256]
    - [286, 23.73]
  - - [2112, 2880, 1, 256]
    - [233, 24.24]
  - - [2368, 2880, 1, 256]
    - [246, 25.4]
  - - [2624, 2880, 1, 256]
    - [233, 25.97]
  - - [2880, 2880, 1, 256]
    - [369, 26.37]
  - - [3136, 2880, 1, 256]
    - [367, 26.69]
  - - [3392, 2880, 1, 256]
    - [245, 27.59]
  - - [3648, 2880, 1, 256]
    - [254, 27.95]
  - - [3904, 2880, 1, 256]
    - [254, 28.52]
  - - [64, 3136, 1, 256]
    - [292, 4.27]
  - - [320, 3136, 1, 256]
    - [296, 13.4]
  - - [576, 3136, 1, 256]
    - [284, 17.78]
  - - [832, 3136, 1, 256]
    - [286, 20.37]
  - - [1088, 3136, 1, 256]
    - [286, 21.7]
  - - [1344, 3136, 1, 256]
    - [287, 22.75]
  - - [1600, 3136, 1, 256]
    - [296, 23.73]
  - - [1856, 3136, 1, 256]
    - [254, 24.67]
  - - [2112, 3136, 1, 256]
    - [364, 25.85]
  - - [2368, 3136, 1, 256]
    - [239, 25.83]
  - - [2624, 3136, 1, 256]
    - [233, 26.63]
  - - [2880, 3136, 1, 256]
    - [219, 27.51]
  - - [3136, 3136, 1, 256]
    - [364, 27.23]
  - - [3392, 3136, 1, 256]
    - [364, 28.47]
  - - [3648, 3136, 1, 256]
    - [364, 28.76]
  - - [3904, 3136, 1, 256]
    - [219, 28.87]
  - - [64, 3392, 1, 256]
    - [337, 4.57]
  - - [320, 3392, 1, 256]
    - [286, 13.95]
  - - [576, 3392, 1, 256]
    - [286, 18.39]
  - - [832, 3392, 1, 256]
    - [282, 20.02]
  - - [1088, 3392, 1, 256]
    - [293, 21.82]
  - - [1344, 3392, 1, 256]
    - [286, 23.47]
  - - [1600, 3392, 1, 256]
    - [282, 23.39]
  - - [1856, 3392, 1, 256]
    - [254, 24.79]
  - - [2112, 3392, 1, 256]
    - [219, 25.66]
  - - [2368, 3392, 1, 256]
    - [360, 25.88]
  - - [2624, 3392, 1, 256]
    - [219, 27.22]
  - - [2880, 3392, 1, 256]
    - [370, 27.86]
  - - [3136, 3392, 1, 256]
    - [219, 28.31]
  - - [3392, 3392, 1, 256]
    - [367, 28.21]
  - - [3648, 3392, 1, 256]
    - [254, 29.12]
  - - [3904, 3392, 1, 256]
    - [254, 29.64]
  - - [64, 3648, 1, 256]
    - [182, 4.96]
  - - [320, 3648, 1, 256]
    - [284, 14.72]
  - - [576, 3648, 1, 256]
    - [293, 18.39]
  - - [832, 3648, 1, 256]
    - [185, 20.2]
  - - [1088, 3648, 1, 256]
    - [185, 21.46]
  - - [1344, 3648, 1, 256]
    - [330, 23.7]
  - - [1600, 3648, 1, 256]
    - [286, 23.74]
  - - [1856, 3648, 1, 256]
    - [330, 24.92]
  - - [2112, 3648, 1, 256]
    - [364, 26.31]
  - - [2368, 3648, 1, 256]
    - [254, 27.31]
  - - [2624, 3648, 1, 256]
    - [366, 27.39]
  - - [2880, 3648, 1, 256]
    - [367, 27.55]
  - - [3136, 3648, 1, 256]
    - [364, 28.5]
  - - [3392, 3648, 1, 256]
    - [219, 29.64]
  - - [3648, 3648, 1, 256]
    - [254, 29.5]
  - - [3904, 3648, 1, 256]
    - [246, 29.54]
  - - [64, 3904, 1, 256]
    - [243, 5.16]
  - - [320, 3904, 1, 256]
    - [309, 15.38]
  - - [576, 3904, 1, 256]
    - [296, 18.88]
  - - [832, 3904, 1, 256]
    - [286, 21.29]
  - - [1088, 3904, 1, 256]
    - [309, 22.84]
  - - [1344, 3904, 1, 256]
    - [351, 23.74]
  - - [1600, 3904, 1, 256]
    - [351, 25.15]
  - - [1856, 3904, 1, 256]
    - [351, 25.52]
  - - [2112, 3904, 1, 256]
    - [254, 26.25]
  - - [2368, 3904, 1, 256]
    - [367, 27.25]
  - - [2624, 3904, 1, 256]
    - [233, 27.98]
  - - [2880, 3904, 1, 256]
    - [367, 28.29]
  - - [3136, 3904, 1, 256]
    - [364, 27.84]
  - - [3392, 3904, 1, 256]
    - [367, 28.98]
  - - [3648, 3904, 1, 256]
    - [254, 29.63]
  - - [3904, 3904, 1, 256]
    - [364, 29.31]
  - - [320, 64, 1, 512]
    - [297, 0.93]
  - - [576, 64, 1, 512]
    - [268, 1.62]
  - - [832, 64, 1, 512]
    - [264, 2.32]
  - - [1088, 64, 1, 512]
    - [273, 2.87]
  - - [1344, 64, 1, 512]
    - [267, 3.61]
  - - [1600, 64, 1, 512]
    - [176, 4.2]
  - - [1856, 64, 1, 512]
    - [225, 4.76]
  - - [2112, 64, 1, 512]
    - [249, 5.23]
  - - [2368, 64, 1, 512]
    - [157, 5.84]
  - - [2624, 64, 1, 512]
    - [249, 6.55]
  - - [2880, 64, 1, 512]
    - [157, 7.01]
  - - [3136, 64, 1, 512]
    - [279, 7.44]
  - - [3392, 64, 1, 512]
    - [279, 8.21]
  - - [3648, 64, 1, 512]
    - [182, 8.68]
  - - [3904, 64, 1, 512]
    - [225, 9.34]
  - - [64, 320, 1, 512]
    - [299, 0.94]
  - - [320, 320, 1, 512]
    - [275, 4.24]
  - - [576, 320, 1, 512]
    - [182, 6.96]
  - - [832, 320, 1, 512]
    - [157, 9.22]
  - - [1088, 320, 1, 512]
    - [157, 11.65]
  - - [1344, 320, 1, 512]
    - [296, 13.11]
  - - [1600, 320, 1, 512]
    - [292, 14.94]
  - - [1856, 320, 1, 512]
    - [182, 16.17]
  - - [2112, 320, 1, 512]
    - [202, 16.49]
  - - [2368, 320, 1, 512]
    - [293, 18.27]
  - - [2624, 320, 1, 512]
    - [319, 18.9]
  - - [2880, 320, 1, 512]
    - [286, 19.18]
  - - [3136, 320, 1, 512]
    - [286, 20.77]
  - - [3392, 320, 1, 512]
    - [286, 20.66]
  - - [3648, 320, 1, 512]
    - [286, 22.22]
  - - [3904, 320, 1, 512]
    - [329, 21.78]
  - - [64, 576, 1, 512]
    - [271, 1.63]
  - - [320, 576, 1, 512]
    - [249, 7.11]
  - - [576, 576, 1, 512]
    - [182, 11.15]
  - - [832, 576, 1, 512]
    - [157, 14.6]
  - - [1088, 576, 1, 512]
    - [176, 16.49]
  - - [1344, 576, 1, 512]
    - [287, 19.02]
  - - [1600, 576, 1, 512]
    - [287, 19.89]
  - - [1856, 576, 1, 512]
    - [286, 20.95]
  - - [2112, 576, 1, 512]
    - [185, 21.79]
  - - [2368, 576, 1, 512]
    - [284, 22.62]
  - - [2624, 576, 1, 512]
    - [286, 24.55]
  - - [2880, 576, 1, 512]
    - [286, 24.61]
  - - [3136, 576, 1, 512]
    - [293, 25.64]
  - - [3392, 576, 1, 512]
    - [286, 26.55]
  - - [3648, 576, 1, 512]
    - [282, 26.17]
  - - [3904, 576, 1, 512]
    - [366, 26.83]
  - - [64, 832, 1, 512]
    - [288, 2.34]
  - - [320, 832, 1, 512]
    - [249, 9.33]
  - - [576, 832, 1, 512]
    - [157, 14.39]
  - - [832, 832, 1, 512]
    - [290, 17.56]
  - - [1088, 832, 1, 512]
    - [287, 19.6]
  - - [1344, 832, 1, 512]
    - [286, 21.79]
  - - [1600, 832, 1, 512]
    - [286, 22.89]
  - - [1856, 832, 1, 512]
    - [293, 23.88]
  - - [2112, 832, 1, 512]
    - [286, 25.32]
  - - [2368, 832, 1, 512]
    - [282, 25.71]
  - - [2624, 832, 1, 512]
    - [286, 27.41]
  - - [2880, 832, 1, 512]
    - [185, 26.82]
  - - [3136, 832, 1, 512]
    - [293, 28.02]
  - - [3392, 832, 1, 512]
    - [286, 28.49]
  - - [3648, 832, 1, 512]
    - [185, 28.28]
  - - [3904, 832, 1, 512]
    - [185, 28.61]
  - - [64, 1088, 1, 512]
    - [264, 2.87]
  - - [320, 1088, 1, 512]
    - [279, 11.75]
  - - [576, 1088, 1, 512]
    - [290, 16.82]
  - - [832, 1088, 1, 512]
    - [287, 19.97]
  - - [1088, 1088, 1, 512]
    - [319, 21.99]
  - - [1344, 1088, 1, 512]
    - [349, 23.6]
  - - [1600, 1088, 1, 512]
    - [286, 24.94]
  - - [1856, 1088, 1, 512]
    - [286, 26.41]
  - - [2112, 1088, 1, 512]
    - [286, 27.23]
  - - [2368, 1088, 1, 512]
    - [282, 27.7]
  - - [2624, 1088, 1, 512]
    - [293, 28.91]
  - - [2880, 1088, 1, 512]
    - [293, 28.57]
  - - [3136, 1088, 1, 512]
    - [185, 29.69]
  - - [3392, 1088, 1, 512]
    - [286, 30.12]
  - - [3648, 1088, 1, 512]
    - [286, 29.94]
  - - [3904, 1088, 1, 512]
    - [286, 31.21]
  - - [64, 1344, 1, 512]
    - [260, 3.59]
  - - [320, 1344, 1, 512]
    - [290, 12.92]
  - - [576, 1344, 1, 512]
    - [290, 18.33]
  - - [832, 1344, 1, 512]
    - [319, 21.42]
  - - [1088, 1344, 1, 512]
    - [349, 23.75]
  - - [1344, 1344, 1, 512]
    - [286, 25.21]
  - - [1600, 1344, 1, 512]
    - [320, 26.13]
  - - [1856, 1344, 1, 512]
    - [286, 27.43]
  - - [2112, 1344, 1, 512]
    - [286, 29.14]
  - - [2368, 1344, 1, 512]
    - [284, 28.41]
  - - [2624, 1344, 1, 512]
    - [282, 29.57]
  - - [2880, 1344, 1, 512]
    - [286, 30.23]
  - - [3136, 1344, 1, 512]
    - [286, 30.46]
  - - [3392, 1344, 1, 512]
    - [286, 31.1]
  - - [3648, 1344, 1, 512]
    - [185, 31.2]
  - - [3904, 1344, 1, 512]
    - [286, 31.66]
  - - [64, 1600, 1, 512]
    - [276, 4.1]
  - - [320, 1600, 1, 512]
    - [157, 15.09]
  - - [576, 1600, 1, 512]
    - [290, 18.96]
  - - [832, 1600, 1, 512]
    - [185, 22.66]
  - - [1088, 1600, 1, 512]
    - [286, 25.0]
  - - [1344, 1600, 1, 512]
    - [185, 26.74]
  - - [1600, 1600, 1, 512]
    - [293, 28.11]
  - - [1856, 1600, 1, 512]
    - [286, 29.28]
  - - [2112, 1600, 1, 512]
    - [286, 29.77]
  - - [2368, 1600, 1, 512]
    - [282, 30.1]
  - - [2624, 1600, 1, 512]
    - [293, 29.7]
  - - [2880, 1600, 1, 512]
    - [185, 30.1]
  - - [3136, 1600, 1, 512]
    - [293, 31.16]
  - - [3392, 1600, 1, 512]
    - [286, 31.79]
  - - [3648, 1600, 1, 512]
    - [330, 33.27]
  - - [3904, 1600, 1, 512]
    - [286, 32.41]
  - - [64, 1856, 1, 512]
    - [276, 4.85]
  - - [320, 1856, 1, 512]
    - [225, 16.11]
  - - [576, 1856, 1, 512]
    - [282, 20.81]
  - - [832, 1856, 1, 512]
    - [293, 23.91]
  - - [1088, 1856, 1, 512]
    - [185, 25.67]
  - - [1344, 1856, 1, 512]
    - [185, 27.09]
  - - [1600, 1856, 1, 512]
    - [293, 28.65]
  - - [1856, 1856, 1, 512]
    - [286, 29.76]
  - - [2112, 1856, 1, 512]
    - [286, 30.85]
  - - [2368, 1856, 1, 512]
    - [330, 31.19]
  - - [2624, 1856, 1, 512]
    - [330, 32.31]
  - - [2880, 1856, 1, 512]
    - [284, 31.84]
  - - [3136, 1856, 1, 512]
    - [306, 31.73]
  - - [3392, 1856, 1, 512]
    - [330, 33.34]
  - - [3648, 1856, 1, 512]
    - [306, 33.29]
  - - [3904, 1856, 1, 512]
    - [306, 33.83]
  - - [64, 2112, 1, 512]
    - [279, 5.23]
  - - [320, 2112, 1, 512]
    - [251, 16.55]
  - - [576, 2112, 1, 512]
    - [185, 21.47]
  - - [832, 2112, 1, 512]
    - [202, 24.21]
  - - [1088, 2112, 1, 512]
    - [286, 27.03]
  - - [1344, 2112, 1, 512]
    - [185, 28.47]
  - - [1600, 2112, 1, 512]
    - [284, 29.03]
  - - [1856, 2112, 1, 512]
    - [293, 29.96]
  - - [2112, 2112, 1, 512]
    - [286, 30.96]
  - - [2368, 2112, 1, 512]
    - [293, 31.53]
  - - [2624, 2112, 1, 512]
    - [286, 32.26]
  - - [2880, 2112, 1, 512]
    - [286, 31.82]
  - - [3136, 2112, 1, 512]
    - [306, 33.37]
  - - [3392, 2112, 1, 512]
    - [306, 34.28]
  - - [3648, 2112, 1, 512]
    - [306, 34.34]
  - - [3904, 2112, 1, 512]
    - [306, 36.11]
  - - [64, 2368, 1, 512]
    - [279, 5.82]
  - - [320, 2368, 1, 512]
    - [284, 18.31]
  - - [576, 2368, 1, 512]
    - [284, 22.6]
  - - [832, 2368, 1, 512]
    - [282, 25.82]
  - - [1088, 2368, 1, 512]
    - [286, 28.38]
  - - [1344, 2368, 1, 512]
    - [286, 29.32]
  - - [1600, 2368, 1, 512]
    - [286, 30.44]
  - - [1856, 2368, 1, 512]
    - [286, 31.24]
  - - [2112, 2368, 1, 512]
    - [286, 31.19]
  - - [2368, 2368, 1, 512]
    - [293, 30.91]
  - - [2624, 2368, 1, 512]
    - [306, 32.97]
  - - [2880, 2368, 1, 512]
    - [306, 34.14]
  - - [3136, 2368, 1, 512]
    - [330, 34.66]
  - - [3392, 2368, 1, 512]
    - [306, 34.48]
  - - [3648, 2368, 1, 512]
    - [306, 34.44]
  - - [3904, 2368, 1, 512]
    - [306, 35.39]
  - - [64, 2624, 1, 512]
    - [275, 6.36]
  - - [320, 2624, 1, 512]
    - [309, 19.33]
  - - [576, 2624, 1, 512]
    - [286, 24.0]
  - - [832, 2624, 1, 512]
    - [309, 27.04]
  - - [1088, 2624, 1, 512]
    - [286, 28.62]
  - - [1344, 2624, 1, 512]
    - [351, 30.27]
  - - [1600, 2624, 1, 512]
    - [320, 31.37]
  - - [1856, 2624, 1, 512]
    - [185, 30.57]
  - - [2112, 2624, 1, 512]
    - [320, 32.31]
  - - [2368, 2624, 1, 512]
    - [330, 33.48]
  - - [2624, 2624, 1, 512]
    - [330, 33.55]
  - - [2880, 2624, 1, 512]
    - [320, 33.89]
  - - [3136, 2624, 1, 512]
    - [306, 34.93]
  - - [3392, 2624, 1, 512]
    - [330, 36.18]
  - - [3648, 2624, 1, 512]
    - [320, 34.43]
  - - [3904, 2624, 1, 512]
    - [306, 37.07]
  - - [64, 2880, 1, 512]
    - [176, 6.78]
  - - [320, 2880, 1, 512]
    - [286, 19.38]
  - - [576, 2880, 1, 512]
    - [286, 24.86]
  - - [832, 2880, 1, 512]
    - [286, 27.48]
  - - [1088, 2880, 1, 512]
    - [286, 29.07]
  - - [1344, 2880, 1, 512]
    - [202, 30.02]
  - - [1600, 2880, 1, 512]
    - [286, 31.1]
  - - [1856, 2880, 1, 512]
    - [330, 32.87]
  - - [2112, 2880, 1, 512]
    - [286, 32.11]
  - - [2368, 2880, 1, 512]
    - [286, 32.1]
  - - [2624, 2880, 1, 512]
    - [306, 33.75]
  - - [2880, 2880, 1, 512]
    - [330, 34.77]
  - - [3136, 2880, 1, 512]
    - [306, 35.08]
  - - [3392, 2880, 1, 512]
    - [306, 35.69]
  - - [3648, 2880, 1, 512]
    - [306, 36.79]
  - - [3904, 2880, 1, 512]
    - [306, 37.1]
  - - [64, 3136, 1, 512]
    - [157, 7.42]
  - - [320, 3136, 1, 512]
    - [286, 20.7]
  - - [576, 3136, 1, 512]
    - [286, 25.92]
  - - [832, 3136, 1, 512]
    - [185, 28.4]
  - - [1088, 3136, 1, 512]
    - [286, 29.32]
  - - [1344, 3136, 1, 512]
    - [293, 30.2]
  - - [1600, 3136, 1, 512]
    - [286, 31.12]
  - - [1856, 3136, 1, 512]
    - [284, 32.29]
  - - [2112, 3136, 1, 512]
    - [306, 32.41]
  - - [2368, 3136, 1, 512]
    - [306, 34.77]
  - - [2624, 3136, 1, 512]
    - [306, 35.4]
  - - [2880, 3136, 1, 512]
    - [318, 34.51]
  - - [3136, 3136, 1, 512]
    - [306, 36.48]
  - - [3392, 3136, 1, 512]
    - [306, 37.56]
  - - [3648, 3136, 1, 512]
    - [306, 37.71]
  - - [3904, 3136, 1, 512]
    - [306, 38.66]
  - - [64, 3392, 1, 512]
    - [249, 8.01]
  - - [320, 3392, 1, 512]
    - [286, 20.88]
  - - [576, 3392, 1, 512]
    - [293, 25.81]
  - - [832, 3392, 1, 512]
    - [286, 28.79]
  - - [1088, 3392, 1, 512]
    - [284, 29.51]
  - - [1344, 3392, 1, 512]
    - [286, 30.63]
  - - [1600, 3392, 1, 512]
    - [330, 33.01]
  - - [1856, 3392, 1, 512]
    - [185, 32.16]
  - - [2112, 3392, 1, 512]
    - [306, 33.29]
  - - [2368, 3392, 1, 512]
    - [318, 33.91]
  - - [2624, 3392, 1, 512]
    - [330, 35.63]
  - - [2880, 3392, 1, 512]
    - [306, 36.17]
  - - [3136, 3392, 1, 512]
    - [306, 36.85]
  - - [3392, 3392, 1, 512]
    - [330, 37.13]
  - - [3648, 3392, 1, 512]
    - [306, 37.52]
  - - [3904, 3392, 1, 512]
    - [306, 37.86]
  - - [64, 3648, 1, 512]
    - [279, 8.85]
  - - [320, 3648, 1, 512]
    - [286, 22.35]
  - - [576, 3648, 1, 512]
    - [185, 25.81]
  - - [832, 3648, 1, 512]
    - [284, 28.4]
  - - [1088, 3648, 1, 512]
    - [282, 29.56]
  - - [1344, 3648, 1, 512]
    - [286, 31.71]
  - - [1600, 3648, 1, 512]
    - [286, 32.17]
  - - [1856, 3648, 1, 512]
    - [330, 33.43]
  - - [2112, 3648, 1, 512]
    - [330, 34.85]
  - - [2368, 3648, 1, 512]
    - [306, 34.64]
  - - [2624, 3648, 1, 512]
    - [306, 36.0]
  - - [2880, 3648, 1, 512]
    - [306, 36.41]
  - - [3136, 3648, 1, 512]
    - [306, 37.27]
  - - [3392, 3648, 1, 512]
    - [306, 37.73]
  - - [3648, 3648, 1, 512]
    - [306, 37.88]
  - - [3904, 3648, 1, 512]
    - [306, 38.69]
  - - [64, 3904, 1, 512]
    - [176, 9.04]
  - - [320, 3904, 1, 512]
    - [309, 23.13]
  - - [576, 3904, 1, 512]
    - [296, 27.17]
  - - [832, 3904, 1, 512]
    - [296, 28.9]
  - - [1088, 3904, 1, 512]
    - [296, 30.94]
  - - [1344, 3904, 1, 512]
    - [320, 31.45]
  - - [1600, 3904, 1, 512]
    - [296, 33.04]
  - - [1856, 3904, 1, 512]
    - [330, 33.71]
  - - [2112, 3904, 1, 512]
    - [306, 34.61]
  - - [2368, 3904, 1, 512]
    - [306, 36.35]
  - - [2624, 3904, 1, 512]
    - [330, 35.41]
  - - [2880, 3904, 1, 512]
    - [306, 36.3]
  - - [3136, 3904, 1, 512]
    - [306, 37.31]
  - - [3392, 3904, 1, 512]
    - [318, 37.39]
  - - [3648, 3904, 1, 512]
    - [306, 38.14]
  - - [3904, 3904, 1, 512]
    - [306, 38.67]
  - - [320, 64, 1, 1024]
    - [298, 1.66]
  - - [576, 64, 1, 1024]
    - [268, 2.9]
  - - [832, 64, 1, 1024]
    - [268, 4.17]
  - - [1088, 64, 1, 1024]
    - [301, 5.02]
  - - [1344, 64, 1, 1024]
    - [352, 6.11]
  - - [1600, 64, 1, 1024]
    - [249, 7.13]
  - - [1856, 64, 1, 1024]
    - [249, 8.11]
  - - [2112, 64, 1, 1024]
    - [249, 8.62]
  - - [2368, 64, 1, 1024]
    - [249, 9.81]
  - - [2624, 64, 1, 1024]
    - [249, 10.55]
  - - [2880, 64, 1, 1024]
    - [157, 11.69]
  - - [3136, 64, 1, 1024]
    - [225, 12.59]
  - - [3392, 64, 1, 1024]
    - [249, 13.64]
  - - [3648, 64, 1, 1024]
    - [225, 14.36]
  - - [3904, 64, 1, 1024]
    - [249, 14.8]
  - - [64, 320, 1, 1024]
    - [299, 1.65]
  - - [320, 320, 1, 1024]
    - [276, 7.11]
  - - [576, 320, 1, 1024]
    - [157, 11.57]
  - - [832, 320, 1, 1024]
    - [157, 14.04]
  - - [1088, 320, 1, 1024]
    - [176, 18.4]
  - - [1344, 320, 1, 1024]
    - [296, 20.27]
  - - [1600, 320, 1, 1024]
    - [279, 23.06]
  - - [1856, 320, 1, 1024]
    - [225, 23.05]
  - - [2112, 320, 1, 1024]
    - [293, 22.72]
  - - [2368, 320, 1, 1024]
    - [293, 25.0]
  - - [2624, 320, 1, 1024]
    - [309, 25.85]
  - - [2880, 320, 1, 1024]
    - [176, 25.74]
  - - [3136, 320, 1, 1024]
    - [284, 27.99]
  - - [3392, 320, 1, 1024]
    - [185, 27.7]
  - - [3648, 320, 1, 1024]
    - [157, 29.45]
  - - [3904, 320, 1, 1024]
    - [176, 29.34]
  - - [64, 576, 1, 1024]
    - [310, 2.88]
  - - [320, 576, 1, 1024]
    - [279, 11.55]
  - - [576, 576, 1, 1024]
    - [225, 17.51]
  - - [832, 576, 1, 1024]
    - [157, 21.26]
  - - [1088, 576, 1, 1024]
    - [290, 24.71]
  - - [1344, 576, 1, 1024]
    - [290, 26.69]
  - - [1600, 576, 1, 1024]
    - [251, 26.55]
  - - [1856, 576, 1, 1024]
    - [286, 27.64]
  - - [2112, 576, 1, 1024]
    - [279, 29.19]
  - - [2368, 576, 1, 1024]
    - [157, 29.68]
  - - [2624, 576, 1, 1024]
    - [225, 30.82]
  - - [2880, 576, 1, 1024]
    - [157, 31.51]
  - - [3136, 576, 1, 1024]
    - [284, 32.73]
  - - [3392, 576, 1, 1024]
    - [284, 33.46]
  - - [3648, 576, 1, 1024]
    - [293, 32.96]
  - - [3904, 576, 1, 1024]
    - [225, 33.08]
  - - [64, 832, 1, 1024]
    - [278, 4.13]
  - - [320, 832, 1, 1024]
    - [282, 14.1]
  - - [576, 832, 1, 1024]
    - [279, 21.53]
  - - [832, 832, 1, 1024]
    - [251, 24.84]
  - - [1088, 832, 1, 1024]
    - [286, 27.25]
  - - [1344, 832, 1, 1024]
    - [249, 28.34]
  - - [1600, 832, 1, 1024]
    - [284, 29.51]
  - - [1856, 832, 1, 1024]
    - [286, 32.05]
  - - [2112, 832, 1, 1024]
    - [286, 32.59]
  - - [2368, 832, 1, 1024]
    - [293, 32.34]
  - - [2624, 832, 1, 1024]
    - [286, 34.38]
  - - [2880, 832, 1, 1024]
    - [279, 33.37]
  - - [3136, 832, 1, 1024]
    - [286, 34.68]
  - - [3392, 832, 1, 1024]
    - [286, 35.62]
  - - [3648, 832, 1, 1024]
    - [286, 35.24]
  - - [3904, 832, 1, 1024]
    - [286, 35.44]
  - - [64, 1088, 1, 1024]
    - [265, 5.0]
  - - [320, 1088, 1, 1024]
    - [157, 18.34]
  - - [576, 1088, 1, 1024]
    - [290, 24.82]
  - - [832, 1088, 1, 1024]
    - [251, 27.86]
  - - [1088, 1088, 1, 1024]
    - [319, 29.4]
  - - [1344, 1088, 1, 1024]
    - [286, 30.38]
  - - [1600, 1088, 1, 1024]
    - [284, 31.5]
  - - [1856, 1088, 1, 1024]
    - [284, 32.51]
  - - [2112, 1088, 1, 1024]
    - [284, 34.03]
  - - [2368, 1088, 1, 1024]
    - [279, 34.0]
  - - [2624, 1088, 1, 1024]
    - [286, 35.53]
  - - [2880, 1088, 1, 1024]
    - [286, 36.13]
  - - [3136, 1088, 1, 1024]
    - [286, 36.33]
  - - [3392, 1088, 1, 1024]
    - [286, 35.91]
  - - [3648, 1088, 1, 1024]
    - [286, 35.94]
  - - [3904, 1088, 1, 1024]
    - [286, 36.93]
  - - [64, 1344, 1, 1024]
    - [276, 6.06]
  - - [320, 1344, 1, 1024]
    - [320, 19.51]
  - - [576, 1344, 1, 1024]
    - [286, 26.07]
  - - [832, 1344, 1, 1024]
    - [284, 28.95]
  - - [1088, 1344, 1, 1024]
    - [293, 30.17]
  - - [1344, 1344, 1, 1024]
    - [293, 32.63]
  - - [1600, 1344, 1, 1024]
    - [279, 33.14]
  - - [1856, 1344, 1, 1024]
    - [320, 34.43]
  - - [2112, 1344, 1, 1024]
    - [284, 35.61]
  - - [2368, 1344, 1, 1024]
    - [286, 34.94]
  - - [2624, 1344, 1, 1024]
    - [286, 36.34]
  - - [2880, 1344, 1, 1024]
    - [286, 37.22]
  - - [3136, 1344, 1, 1024]
    - [286, 36.78]
  - - [3392, 1344, 1, 1024]
    - [286, 37.86]
  - - [3648, 1344, 1, 1024]
    - [306, 38.14]
  - - [3904, 1344, 1, 1024]
    - [306, 38.18]
  - - [64, 1600, 1, 1024]
    - [276, 7.0]
  - - [320, 1600, 1, 1024]
    - [150, 22.12]
  - - [576, 1600, 1, 1024]
    - [309, 26.5]
  - - [832, 1600, 1, 1024]
    - [185, 29.02]
  - - [1088, 1600, 1, 1024]
    - [286, 31.53]
  - - [1344, 1600, 1, 1024]
    - [185, 33.67]
  - - [1600, 1600, 1, 1024]
    - [286, 34.24]
  - - [1856, 1600, 1, 1024]
    - [286, 35.36]
  - - [2112, 1600, 1, 1024]
    - [284, 36.16]
  - - [2368, 1600, 1, 1024]
    - [284, 37.08]
  - - [2624, 1600, 1, 1024]
    - [293, 36.2]
  - - [2880, 1600, 1, 1024]
    - [284, 36.56]
  - - [3136, 1600, 1, 1024]
    - [284, 36.93]
  - - [3392, 1600, 1, 1024]
    - [306, 39.44]
  - - [3648, 1600, 1, 1024]
    - [306, 39.37]
  - - [3904, 1600, 1, 1024]
    - [306, 39.93]
  - - [64, 1856, 1, 1024]
    - [276, 8.1]
  - - [320, 1856, 1, 1024]
    - [279, 23.14]
  - - [576, 1856, 1, 1024]
    - [279, 28.02]
  - - [832, 1856, 1, 1024]
    - [286, 30.95]
  - - [1088, 1856, 1, 1024]
    - [286, 33.75]
  - - [1344, 1856, 1, 1024]
    - [185, 33.64]
  - - [1600, 1856, 1, 1024]
    - [286, 35.69]
  - - [1856, 1856, 1, 1024]
    - [286, 35.64]
  - - [2112, 1856, 1, 1024]
    - [202, 36.68]
  - - [2368, 1856, 1, 1024]
    - [330, 38.61]
  - - [2624, 1856, 1, 1024]
    - [306, 38.87]
  - - [2880, 1856, 1, 1024]
    - [286, 38.2]
  - - [3136, 1856, 1, 1024]
    - [306, 38.44]
  - - [3392, 1856, 1, 1024]
    - [330, 39.49]
  - - [3648, 1856, 1, 1024]
    - [306, 40.45]
  - - [3904, 1856, 1, 1024]
    - [306, 41.45]
  - - [64, 2112, 1, 1024]
    - [225, 8.47]
  - - [320, 2112, 1, 1024]
    - [251, 23.42]
  - - [576, 2112, 1, 1024]
    - [225, 28.41]
  - - [832, 2112, 1, 1024]
    - [225, 31.41]
  - - [1088, 2112, 1, 1024]
    - [286, 33.75]
  - - [1344, 2112, 1, 1024]
    - [202, 35.32]
  - - [1600, 2112, 1, 1024]
    - [286, 36.25]
  - - [1856, 2112, 1, 1024]
    - [286, 37.23]
  - - [2112, 2112, 1, 1024]
    - [286, 36.91]
  - - [2368, 2112, 1, 1024]
    - [306, 37.43]
  - - [2624, 2112, 1, 1024]
    - [306, 38.18]
  - - [2880, 2112, 1, 1024]
    - [306, 39.29]
  - - [3136, 2112, 1, 1024]
    - [306, 40.3]
  - - [3392, 2112, 1, 1024]
    - [306, 40.49]
  - - [3648, 2112, 1, 1024]
    - [306, 40.95]
  - - [3904, 2112, 1, 1024]
    - [306, 41.3]
  - - [64, 2368, 1, 1024]
    - [313, 9.68]
  - - [320, 2368, 1, 1024]
    - [185, 25.58]
  - - [576, 2368, 1, 1024]
    - [185, 29.47]
  - - [832, 2368, 1, 1024]
    - [286, 32.79]
  - - [1088, 2368, 1, 1024]
    - [279, 34.34]
  - - [1344, 2368, 1, 1024]
    - [279, 35.98]
  - - [1600, 2368, 1, 1024]
    - [286, 36.3]
  - - [1856, 2368, 1, 1024]
    - [286, 37.54]
  - - [2112, 2368, 1, 1024]
    - [284, 37.46]
  - - [2368, 2368, 1, 1024]
    - [286, 37.8]
  - - [2624, 2368, 1, 1024]
    - [306, 39.07]
  - - [2880, 2368, 1, 1024]
    - [306, 40.43]
  - - [3136, 2368, 1, 1024]
    - [306, 41.39]
  - - [3392, 2368, 1, 1024]
    - [306, 40.64]
  - - [3648, 2368, 1, 1024]
    - [306, 41.07]
  - - [3904, 2368, 1, 1024]
    - [306, 42.8]
  - - [64, 2624, 1, 1024]
    - [182, 10.63]
  - - [320, 2624, 1, 1024]
    - [286, 25.79]
  - - [576, 2624, 1, 1024]
    - [286, 31.64]
  - - [832, 2624, 1, 1024]
    - [296, 34.19]
  - - [1088, 2624, 1, 1024]
    - [286, 35.68]
  - - [1344, 2624, 1, 1024]
    - [319, 37.96]
  - - [1600, 2624, 1, 1024]
    - [320, 36.82]
  - - [1856, 2624, 1, 1024]
    - [330, 39.28]
  - - [2112, 2624, 1, 1024]
    - [320, 37.63]
  - - [2368, 2624, 1, 1024]
    - [330, 39.12]
  - - [2624, 2624, 1, 1024]
    - [306, 40.92]
  - - [2880, 2624, 1, 1024]
    - [356, 39.67]
  - - [3136, 2624, 1, 1024]
    - [306, 41.51]
  - - [3392, 2624, 1, 1024]
    - [306, 42.37]
  - - [3648, 2624, 1, 1024]
    - [306, 41.53]
  - - [3904, 2624, 1, 1024]
    - [318, 42.24]
  - - [64, 2880, 1, 1024]
    - [182, 11.59]
  - - [320, 2880, 1, 1024]
    - [286, 26.06]
  - - [576, 2880, 1, 1024]
    - [286, 32.24]
  - - [832, 2880, 1, 1024]
    - [286, 34.02]
  - - [1088, 2880, 1, 1024]
    - [286, 36.16]
  - - [1344, 2880, 1, 1024]
    - [293, 36.8]
  - - [1600, 2880, 1, 1024]
    - [286, 37.58]
  - - [1856, 2880, 1, 1024]
    - [286, 38.0]
  - - [2112, 2880, 1, 1024]
    - [286, 37.81]
  - - [2368, 2880, 1, 1024]
    - [306, 40.75]
  - - [2624, 2880, 1, 1024]
    - [306, 40.89]
  - - [2880, 2880, 1, 1024]
    - [306, 40.84]
  - - [3136, 2880, 1, 1024]
    - [306, 41.87]
  - - [3392, 2880, 1, 1024]
    - [306, 42.88]
  - - [3648, 2880, 1, 1024]
    - [306, 41.89]
  - - [3904, 2880, 1, 1024]
    - [306, 42.93]
  - - [64, 3136, 1, 1024]
    - [279, 12.58]
  - - [320, 3136, 1, 1024]
    - [176, 28.12]
  - - [576, 3136, 1, 1024]
    - [279, 32.55]
  - - [832, 3136, 1, 1024]
    - [279, 35.65]
  - - [1088, 3136, 1, 1024]
    - [286, 35.85]
  - - [1344, 3136, 1, 1024]
    - [284, 36.83]
  - - [1600, 3136, 1, 1024]
    - [306, 37.4]
  - - [1856, 3136, 1, 1024]
    - [306, 39.43]
  - - [2112, 3136, 1, 1024]
    - [306, 39.66]
  - - [2368, 3136, 1, 1024]
    - [318, 39.94]
  - - [2624, 3136, 1, 1024]
    - [306, 41.63]
  - - [2880, 3136, 1, 1024]
    - [306, 42.18]
  - - [3136, 3136, 1, 1024]
    - [306, 43.17]
  - - [3392, 3136, 1, 1024]
    - [306, 43.27]
  - - [3648, 3136, 1, 1024]
    - [306, 43.47]
  - - [3904, 3136, 1, 1024]
    - [306, 43.85]
  - - [64, 3392, 1, 1024]
    - [225, 13.51]
  - - [320, 3392, 1, 1024]
    - [286, 28.04]
  - - [576, 3392, 1, 1024]
    - [286, 34.15]
  - - [832, 3392, 1, 1024]
    - [286, 35.25]
  - - [1088, 3392, 1, 1024]
    - [185, 36.32]
  - - [1344, 3392, 1, 1024]
    - [286, 37.47]
  - - [1600, 3392, 1, 1024]
    - [306, 38.76]
  - - [1856, 3392, 1, 1024]
    - [293, 38.05]
  - - [2112, 3392, 1, 1024]
    - [330, 39.9]
  - - [2368, 3392, 1, 1024]
    - [306, 40.86]
  - - [2624, 3392, 1, 1024]
    - [306, 42.18]
  - - [2880, 3392, 1, 1024]
    - [306, 42.11]
  - - [3136, 3392, 1, 1024]
    - [306, 42.45]
  - - [3392, 3392, 1, 1024]
    - [306, 43.71]
  - - [3648, 3392, 1, 1024]
    - [306, 43.85]
  - - [3904, 3392, 1, 1024]
    - [318, 43.47]
  - - [64, 3648, 1, 1024]
    - [292, 14.08]
  - - [320, 3648, 1, 1024]
    - [279, 29.7]
  - - [576, 3648, 1, 1024]
    - [286, 32.95]
  - - [832, 3648, 1, 1024]
    - [293, 35.52]
  - - [1088, 3648, 1, 1024]
    - [185, 35.84]
  - - [1344, 3648, 1, 1024]
    - [330, 38.08]
  - - [1600, 3648, 1, 1024]
    - [284, 38.51]
  - - [1856, 3648, 1, 1024]
    - [330, 40.02]
  - - [2112, 3648, 1, 1024]
    - [306, 40.73]
  - - [2368, 3648, 1, 1024]
    - [306, 41.36]
  - - [2624, 3648, 1, 1024]
    - [306, 42.07]
  - - [2880, 3648, 1, 1024]
    - [306, 43.38]
  - - [3136, 3648, 1, 1024]
    - [306, 43.94]
  - - [3392, 3648, 1, 1024]
    - [306, 44.05]
  - - [3648, 3648, 1, 1024]
    - [306, 44.07]
  - - [3904, 3648, 1, 1024]
    - [318, 43.86]
  - - [64, 3904, 1, 1024]
    - [182, 15.2]
  - - [320, 3904, 1, 1024]
    - [319, 30.4]
  - - [576, 3904, 1, 1024]
    - [296, 34.61]
  - - [832, 3904, 1, 1024]
    - [286, 36.18]
  - - [1088, 3904, 1, 1024]
    - [284, 37.35]
  - - [1344, 3904, 1, 1024]
    - [320, 38.24]
  - - [1600, 3904, 1, 1024]
    - [306, 39.62]
  - - [1856, 3904, 1, 1024]
    - [306, 40.52]
  - - [2112, 3904, 1, 1024]
    - [306, 41.17]
  - - [2368, 3904, 1, 1024]
    - [306, 42.04]
  - - [2624, 3904, 1, 1024]
    - [306, 43.1]
  - - [2880, 3904, 1, 1024]
    - [306, 43.86]
  - - [3136, 3904, 1, 1024]
    - [306, 43.6]
  - - [3392, 3904, 1, 1024]
    - [306, 43.96]
  - - [3648, 3904, 1, 1024]
    - [306, 45.11]
  - - [3904, 3904, 1, 1024]
    - [306, 44.82]
  - - [320, 64, 1, 2048]
    - [310, 2.78]
  - - [576, 64, 1, 2048]
    - [310, 4.77]
  - - [832, 64, 1, 2048]
    - [310, 6.81]
  - - [1088, 64, 1, 2048]
    - [301, 7.79]
  - - [1344, 64, 1, 2048]
    - [352, 9.53]
  - - [1600, 64, 1, 2048]
    - [225, 11.08]
  - - [1856, 64, 1, 2048]
    - [225, 12.74]
  - - [2112, 64, 1, 2048]
    - [157, 12.72]
  - - [2368, 64, 1, 2048]
    - [249, 14.09]
  - - [2624, 64, 1, 2048]
    - [328, 15.29]
  - - [2880, 64, 1, 2048]
    - [157, 16.85]
  - - [3136, 64, 1, 2048]
    - [157, 18.36]
  - - [3392, 64, 1, 2048]
    - [225, 19.52]
  - - [3648, 64, 1, 2048]
    - [157, 20.86]
  - - [3904, 64, 1, 2048]
    - [157, 22.06]
  - - [64, 320, 1, 2048]
    - [268, 2.82]
  - - [320, 320, 1, 2048]
    - [225, 11.0]
  - - [576, 320, 1, 2048]
    - [157, 17.19]
  - - [832, 320, 1, 2048]
    - [313, 19.61]
  - - [1088, 320, 1, 2048]
    - [182, 25.53]
  - - [1344, 320, 1, 2048]
    - [296, 27.6]
  - - [1600, 320, 1, 2048]
    - [225, 30.28]
  - - [1856, 320, 1, 2048]
    - [225, 30.29]
  - - [2112, 320, 1, 2048]
    - [284, 28.67]
  - - [2368, 320, 1, 2048]
    - [284, 31.71]
  - - [2624, 320, 1, 2048]
    - [176, 31.98]
  - - [2880, 320, 1, 2048]
    - [225, 32.27]
  - - [3136, 320, 1, 2048]
    - [279, 33.52]
  - - [3392, 320, 1, 2048]
    - [279, 33.38]
  - - [3648, 320, 1, 2048]
    - [292, 36.15]
  - - [3904, 320, 1, 2048]
    - [329, 36.42]
  - - [64, 576, 1, 2048]
    - [268, 4.75]
  - - [320, 576, 1, 2048]
    - [157, 17.07]
  - - [576, 576, 1, 2048]
    - [182, 24.06]
  - - [832, 576, 1, 2048]
    - [176, 28.41]
  - - [1088, 576, 1, 2048]
    - [279, 31.98]
  - - [1344, 576, 1, 2048]
    - [290, 33.73]
  - - [1600, 576, 1, 2048]
    - [287, 34.26]
  - - [1856, 576, 1, 2048]
    - [225, 34.04]
  - - [2112, 576, 1, 2048]
    - [176, 34.09]
  - - [2368, 576, 1, 2048]
    - [225, 36.18]
  - - [2624, 576, 1, 2048]
    - [225, 36.79]
  - - [2880, 576, 1, 2048]
    - [279, 37.16]
  - - [3136, 576, 1, 2048]
    - [286, 38.47]
  - - [3392, 576, 1, 2048]
    - [182, 38.81]
  - - [3648, 576, 1, 2048]
    - [279, 38.26]
  - - [3904, 576, 1, 2048]
    - [305, 38.45]
  - - [64, 832, 1, 2048]
    - [278, 6.6]
  - - [320, 832, 1, 2048]
    - [282, 19.66]
  - - [576, 832, 1, 2048]
    - [279, 28.78]
  - - [832, 832, 1, 2048]
    - [289, 31.0]
  - - [1088, 832, 1, 2048]
    - [225, 34.45]
  - - [1344, 832, 1, 2048]
    - [279, 34.94]
  - - [1600, 832, 1, 2048]
    - [279, 35.33]
  - - [1856, 832, 1, 2048]
    - [284, 36.98]
  - - [2112, 832, 1, 2048]
    - [286, 36.61]
  - - [2368, 832, 1, 2048]
    - [279, 37.75]
  - - [2624, 832, 1, 2048]
    - [279, 39.65]
  - - [2880, 832, 1, 2048]
    - [292, 39.21]
  - - [3136, 832, 1, 2048]
    - [286, 39.63]
  - - [3392, 832, 1, 2048]
    - [225, 40.16]
  - - [3648, 832, 1, 2048]
    - [225, 39.84]
  - - [3904, 832, 1, 2048]
    - [286, 40.98]
  - - [64, 1088, 1, 2048]
    - [269, 7.84]
  - - [320, 1088, 1, 2048]
    - [182, 25.22]
  - - [576, 1088, 1, 2048]
    - [290, 32.21]
  - - [832, 1088, 1, 2048]
    - [287, 36.05]
  - - [1088, 1088, 1, 2048]
    - [287, 34.42]
  - - [1344, 1088, 1, 2048]
    - [279, 35.9]
  - - [1600, 1088, 1, 2048]
    - [286, 37.11]
  - - [1856, 1088, 1, 2048]
    - [279, 38.14]
  - - [2112, 1088, 1, 2048]
    - [279, 38.45]
  - - [2368, 1088, 1, 2048]
    - [225, 40.54]
  - - [2624, 1088, 1, 2048]
    - [279, 40.38]
  - - [2880, 1088, 1, 2048]
    - [279, 40.74]
  - - [3136, 1088, 1, 2048]
    - [279, 40.57]
  - - [3392, 1088, 1, 2048]
    - [279, 40.59]
  - - [3648, 1088, 1, 2048]
    - [293, 40.59]
  - - [3904, 1088, 1, 2048]
    - [225, 42.16]
  - - [64, 1344, 1, 2048]
    - [269, 9.52]
  - - [320, 1344, 1, 2048]
    - [279, 26.22]
  - - [576, 1344, 1, 2048]
    - [287, 32.63]
  - - [832, 1344, 1, 2048]
    - [284, 34.74]
  - - [1088, 1344, 1, 2048]
    - [225, 36.39]
  - - [1344, 1344, 1, 2048]
    - [225, 38.27]
  - - [1600, 1344, 1, 2048]
    - [225, 38.94]
  - - [1856, 1344, 1, 2048]
    - [279, 38.53]
  - - [2112, 1344, 1, 2048]
    - [286, 39.91]
  - - [2368, 1344, 1, 2048]
    - [279, 40.01]
  - - [2624, 1344, 1, 2048]
    - [225, 40.78]
  - - [2880, 1344, 1, 2048]
    - [225, 40.93]
  - - [3136, 1344, 1, 2048]
    - [286, 40.88]
  - - [3392, 1344, 1, 2048]
    - [284, 41.26]
  - - [3648, 1344, 1, 2048]
    - [306, 43.9]
  - - [3904, 1344, 1, 2048]
    - [306, 43.43]
  - - [64, 1600, 1, 2048]
    - [279, 10.67]
  - - [320, 1600, 1, 2048]
    - [182, 30.05]
  - - [576, 1600, 1, 2048]
    - [251, 33.52]
  - - [832, 1600, 1, 2048]
    - [225, 35.71]
  - - [1088, 1600, 1, 2048]
    - [286, 36.98]
  - - [1344, 1600, 1, 2048]
    - [279, 38.93]
  - - [1600, 1600, 1, 2048]
    - [225, 39.9]
  - - [1856, 1600, 1, 2048]
    - [279, 40.88]
  - - [2112, 1600, 1, 2048]
    - [182, 40.87]
  - - [2368, 1600, 1, 2048]
    - [284, 41.6]
  - - [2624, 1600, 1, 2048]
    - [284, 40.72]
  - - [2880, 1600, 1, 2048]
    - [225, 41.9]
  - - [3136, 1600, 1, 2048]
    - [279, 42.01]
  - - [3392, 1600, 1, 2048]
    - [306, 43.93]
  - - [3648, 1600, 1, 2048]
    - [330, 43.88]
  - - [3904, 1600, 1, 2048]
    - [335, 42.83]
  - - [64, 1856, 1, 2048]
    - [157, 12.72]
  - - [320, 1856, 1, 2048]
    - [290, 29.55]
  - - [576, 1856, 1, 2048]
    - [279, 34.19]
  - - [832, 1856, 1, 2048]
    - [225, 37.39]
  - - [1088, 1856, 1, 2048]
    - [279, 38.4]
  - - [1344, 1856, 1, 2048]
    - [284, 38.13]
  - - [1600, 1856, 1, 2048]
    - [225, 40.01]
  - - [1856, 1856, 1, 2048]
    - [279, 40.67]
  - - [2112, 1856, 1, 2048]
    - [279, 40.99]
  - - [2368, 1856, 1, 2048]
    - [225, 42.31]
  - - [2624, 1856, 1, 2048]
    - [306, 42.95]
  - - [2880, 1856, 1, 2048]
    - [330, 43.9]
  - - [3136, 1856, 1, 2048]
    - [359, 42.98]
  - - [3392, 1856, 1, 2048]
    - [306, 44.01]
  - - [3648, 1856, 1, 2048]
    - [306, 45.27]
  - - [3904, 1856, 1, 2048]
    - [306, 44.84]
  - - [64, 2112, 1, 2048]
    - [182, 12.67]
  - - [320, 2112, 1, 2048]
    - [287, 29.96]
  - - [576, 2112, 1, 2048]
    - [279, 35.28]
  - - [832, 2112, 1, 2048]
    - [279, 37.35]
  - - [1088, 2112, 1, 2048]
    - [225, 38.79]
  - - [1344, 2112, 1, 2048]
    - [284, 39.98]
  - - [1600, 2112, 1, 2048]
    - [279, 40.4]
  - - [1856, 2112, 1, 2048]
    - [286, 41.75]
  - - [2112, 2112, 1, 2048]
    - [225, 41.39]
  - - [2368, 2112, 1, 2048]
    - [286, 41.73]
  - - [2624, 2112, 1, 2048]
    - [354, 43.94]
  - - [2880, 2112, 1, 2048]
    - [293, 41.59]
  - - [3136, 2112, 1, 2048]
    - [306, 43.58]
  - - [3392, 2112, 1, 2048]
    - [306, 45.24]
  - - [3648, 2112, 1, 2048]
    - [306, 45.89]
  - - [3904, 2112, 1, 2048]
    - [306, 46.3]
  - - [64, 2368, 1, 2048]
    - [182, 14.04]
  - - [320, 2368, 1, 2048]
    - [293, 31.56]
  - - [576, 2368, 1, 2048]
    - [279, 35.66]
  - - [832, 2368, 1, 2048]
    - [279, 37.67]
  - - [1088, 2368, 1, 2048]
    - [279, 40.19]
  - - [1344, 2368, 1, 2048]
    - [279, 40.41]
  - - [1600, 2368, 1, 2048]
    - [286, 41.21]
  - - [1856, 2368, 1, 2048]
    - [284, 42.01]
  - - [2112, 2368, 1, 2048]
    - [225, 41.51]
  - - [2368, 2368, 1, 2048]
    - [176, 41.7]
  - - [2624, 2368, 1, 2048]
    - [354, 42.1]
  - - [2880, 2368, 1, 2048]
    - [306, 44.72]
  - - [3136, 2368, 1, 2048]
    - [330, 46.03]
  - - [3392, 2368, 1, 2048]
    - [318, 44.81]
  - - [3648, 2368, 1, 2048]
    - [306, 45.88]
  - - [3904, 2368, 1, 2048]
    - [306, 47.03]
  - - [64, 2624, 1, 2048]
    - [225, 15.24]
  - - [320, 2624, 1, 2048]
    - [292, 32.0]
  - - [576, 2624, 1, 2048]
    - [225, 37.23]
  - - [832, 2624, 1, 2048]
    - [319, 39.24]
  - - [1088, 2624, 1, 2048]
    - [225, 41.02]
  - - [1344, 2624, 1, 2048]
    - [296, 42.58]
  - - [1600, 2624, 1, 2048]
    - [393, 42.12]
  - - [1856, 2624, 1, 2048]
    - [330, 43.86]
  - - [2112, 2624, 1, 2048]
    - [356, 43.17]
  - - [2368, 2624, 1, 2048]
    - [320, 43.45]
  - - [2624, 2624, 1, 2048]
    - [356, 45.05]
  - - [2880, 2624, 1, 2048]
    - [393, 45.01]
  - - [3136, 2624, 1, 2048]
    - [306, 45.7]
  - - [3392, 2624, 1, 2048]
    - [306, 46.79]
  - - [3648, 2624, 1, 2048]
    - [330, 45.72]
  - - [3904, 2624, 1, 2048]
    - [318, 46.45]
  - - [64, 2880, 1, 2048]
    - [182, 16.52]
  - - [320, 2880, 1, 2048]
    - [225, 31.8]
  - - [576, 2880, 1, 2048]
    - [279, 38.51]
  - - [832, 2880, 1, 2048]
    - [225, 38.85]
  - - [1088, 2880, 1, 2048]
    - [279, 41.2]
  - - [1344, 2880, 1, 2048]
    - [225, 40.69]
  - - [1600, 2880, 1, 2048]
    - [225, 41.03]
  - - [1856, 2880, 1, 2048]
    - [306, 43.6]
  - - [2112, 2880, 1, 2048]
    - [279, 42.7]
  - - [2368, 2880, 1, 2048]
    - [306, 44.59]
  - - [2624, 2880, 1, 2048]
    - [335, 44.57]
  - - [2880, 2880, 1, 2048]
    - [330, 45.36]
  - - [3136, 2880, 1, 2048]
    - [330, 46.53]
  - - [3392, 2880, 1, 2048]
    - [318, 46.85]
  - - [3648, 2880, 1, 2048]
    - [306, 47.39]
  - - [3904, 2880, 1, 2048]
    - [318, 47.66]
  - - [64, 3136, 1, 2048]
    - [279, 17.85]
  - - [320, 3136, 1, 2048]
    - [279, 34.55]
  - - [576, 3136, 1, 2048]
    - [182, 38.38]
  - - [832, 3136, 1, 2048]
    - [286, 39.47]
  - - [1088, 3136, 1, 2048]
    - [279, 40.08]
  - - [1344, 3136, 1, 2048]
    - [202, 40.45]
  - - [1600, 3136, 1, 2048]
    - [279, 42.06]
  - - [1856, 3136, 1, 2048]
    - [306, 44.26]
  - - [2112, 3136, 1, 2048]
    - [306, 44.45]
  - - [2368, 3136, 1, 2048]
    - [330, 45.64]
  - - [2624, 3136, 1, 2048]
    - [306, 46.0]
  - - [2880, 3136, 1, 2048]
    - [306, 47.75]
  - - [3136, 3136, 1, 2048]
    - [306, 47.28]
  - - [3392, 3136, 1, 2048]
    - [318, 46.66]
  - - [3648, 3136, 1, 2048]
    - [306, 49.01]
  - - [3904, 3136, 1, 2048]
    - [318, 47.5]
  - - [64, 3392, 1, 2048]
    - [279, 19.69]
  - - [320, 3392, 1, 2048]
    - [225, 34.11]
  - - [576, 3392, 1, 2048]
    - [225, 39.05]
  - - [832, 3392, 1, 2048]
    - [279, 40.06]
  - - [1088, 3392, 1, 2048]
    - [279, 41.36]
  - - [1344, 3392, 1, 2048]
    - [286, 41.01]
  - - [1600, 3392, 1, 2048]
    - [318, 44.46]
  - - [1856, 3392, 1, 2048]
    - [330, 43.76]
  - - [2112, 3392, 1, 2048]
    - [318, 43.95]
  - - [2368, 3392, 1, 2048]
    - [306, 45.11]
  - - [2624, 3392, 1, 2048]
    - [306, 47.25]
  - - [2880, 3392, 1, 2048]
    - [306, 46.12]
  - - [3136, 3392, 1, 2048]
    - [306, 47.21]
  - - [3392, 3392, 1, 2048]
    - [318, 47.45]
  - - [3648, 3392, 1, 2048]
    - [318, 47.94]
  - - [3904, 3392, 1, 2048]
    - [359, 46.85]
  - - [64, 3648, 1, 2048]
    - [279, 20.99]
  - - [320, 3648, 1, 2048]
    - [279, 36.83]
  - - [576, 3648, 1, 2048]
    - [279, 38.38]
  - - [832, 3648, 1, 2048]
    - [279, 40.63]
  - - [1088, 3648, 1, 2048]
    - [279, 41.54]
  - - [1344, 3648, 1, 2048]
    - [306, 42.76]
  - - [1600, 3648, 1, 2048]
    - [330, 44.06]
  - - [1856, 3648, 1, 2048]
    - [306, 45.29]
  - - [2112, 3648, 1, 2048]
    - [306, 45.64]
  - - [2368, 3648, 1, 2048]
    - [330, 45.27]
  - - [2624, 3648, 1, 2048]
    - [306, 46.24]
  - - [2880, 3648, 1, 2048]
    - [330, 47.6]
  - - [3136, 3648, 1, 2048]
    - [318, 47.24]
  - - [3392, 3648, 1, 2048]
    - [318, 46.87]
  - - [3648, 3648, 1, 2048]
    - [318, 47.66]
  - - [3904, 3648, 1, 2048]
    - [318, 48.53]
  - - [64, 3904, 1, 2048]
    - [182, 22.44]
  - - [320, 3904, 1, 2048]
    - [320, 36.51]
  - - [576, 3904, 1, 2048]
    - [286, 38.22]
  - - [832, 3904, 1, 2048]
    - [286, 41.56]
  - - [1088, 3904, 1, 2048]
    - [225, 41.82]
  - - [1344, 3904, 1, 2048]
    - [279, 42.05]
  - - [1600, 3904, 1, 2048]
    - [306, 43.87]
  - - [1856, 3904, 1, 2048]
    - [306, 44.59]
  - - [2112, 3904, 1, 2048]
    - [306, 45.11]
  - - [2368, 3904, 1, 2048]
    - [318, 45.58]
  - - [2624, 3904, 1, 2048]
    - [306, 47.43]
  - - [2880, 3904, 1, 2048]
    - [306, 47.83]
  - - [3136, 3904, 1, 2048]
    - [318, 46.83]
  - - [3392, 3904, 1, 2048]
    - [306, 49.1]
  - - [3648, 3904, 1, 2048]
    - [318, 47.78]
  - - [3904, 3904, 1, 2048]
    - [318, 48.74]
  - - [320, 64, 1, 4096]
    - [268, 4.16]
  - - [576, 64, 1, 4096]
    - [278, 6.82]
  - - [832, 64, 1, 4096]
    - [268, 9.4]
  - - [1088, 64, 1, 4096]
    - [301, 10.99]
  - - [1344, 64, 1, 4096]
    - [352, 12.73]
  - - [1600, 64, 1, 4096]
    - [225, 14.15]
  - - [1856, 64, 1, 4096]
    - [316, 16.04]
  - - [2112, 64, 1, 4096]
    - [328, 16.42]
  - - [2368, 64, 1, 4096]
    - [328, 18.23]
  - - [2624, 64, 1, 4096]
    - [225, 20.4]
  - - [2880, 64, 1, 4096]
    - [249, 22.28]
  - - [3136, 64, 1, 4096]
    - [225, 23.94]
  - - [3392, 64, 1, 4096]
    - [225, 25.55]
  - - [3648, 64, 1, 4096]
    - [225, 27.59]
  - - [3904, 64, 1, 4096]
    - [157, 28.84]
  - - [64, 320, 1, 4096]
    - [278, 4.16]
  - - [320, 320, 1, 4096]
    - [157, 15.08]
  - - [576, 320, 1, 4096]
    - [225, 22.11]
  - - [832, 320, 1, 4096]
    - [279, 24.95]
  - - [1088, 320, 1, 4096]
    - [225, 31.7]
  - - [1344, 320, 1, 4096]
    - [296, 33.08]
  - - [1600, 320, 1, 4096]
    - [225, 36.4]
  - - [1856, 320, 1, 4096]
    - [328, 34.83]
  - - [2112, 320, 1, 4096]
    - [286, 32.85]
  - - [2368, 320, 1, 4096]
    - [286, 37.15]
  - - [2624, 320, 1, 4096]
    - [176, 36.17]
  - - [2880, 320, 1, 4096]
    - [279, 36.45]
  - - [3136, 320, 1, 4096]
    - [279, 38.69]
  - - [3392, 320, 1, 4096]
    - [225, 37.96]
  - - [3648, 320, 1, 4096]
    - [225, 41.42]
  - - [3904, 320, 1, 4096]
    - [329, 41.7]
  - - [64, 576, 1, 4096]
    - [268, 6.95]
  - - [320, 576, 1, 4096]
    - [313, 22.36]
  - - [576, 576, 1, 4096]
    - [182, 29.9]
  - - [832, 576, 1, 4096]
    - [157, 33.8]
  - - [1088, 576, 1, 4096]
    - [289, 36.27]
  - - [1344, 576, 1, 4096]
    - [251, 37.66]
  - - [1600, 576, 1, 4096]
    - [251, 39.97]
  - - [1856, 576, 1, 4096]
    - [225, 37.4]
  - - [2112, 576, 1, 4096]
    - [225, 38.2]
  - - [2368, 576, 1, 4096]
    - [176, 38.36]
  - - [2624, 576, 1, 4096]
    - [182, 39.86]
  - - [2880, 576, 1, 4096]
    - [182, 41.5]
  - - [3136, 576, 1, 4096]
    - [225, 41.81]
  - - [3392, 576, 1, 4096]
    - [279, 43.12]
  - - [3648, 576, 1, 4096]
    - [279, 42.03]
  - - [3904, 576, 1, 4096]
    - [335, 42.57]
  - - [64, 832, 1, 4096]
    - [281, 8.27]
  - - [320, 832, 1, 4096]
    - [225, 24.76]
  - - [576, 832, 1, 4096]
    - [279, 33.71]
  - - [832, 832, 1, 4096]
    - [290, 35.74]
  - - [1088, 832, 1, 4096]
    - [279, 40.08]
  - - [1344, 832, 1, 4096]
    - [225, 39.99]
  - - [1600, 832, 1, 4096]
    - [292, 38.64]
  - - [1856, 832, 1, 4096]
    - [225, 41.92]
  - - [2112, 832, 1, 4096]
    - [225, 41.79]
  - - [2368, 832, 1, 4096]
    - [182, 41.87]
  - - [2624, 832, 1, 4096]
    - [225, 42.57]
  - - [2880, 832, 1, 4096]
    - [279, 42.42]
  - - [3136, 832, 1, 4096]
    - [279, 43.61]
  - - [3392, 832, 1, 4096]
    - [225, 43.45]
  - - [3648, 832, 1, 4096]
    - [328, 42.47]
  - - [3904, 832, 1, 4096]
    - [279, 44.85]
  - - [64, 1088, 1, 4096]
    - [157, 10.22]
  - - [320, 1088, 1, 4096]
    - [325, 31.73]
  - - [576, 1088, 1, 4096]
    - [290, 37.39]
  - - [832, 1088, 1, 4096]
    - [251, 39.36]
  - - [1088, 1088, 1, 4096]
    - [319, 39.65]
  - - [1344, 1088, 1, 4096]
    - [279, 39.69]
  - - [1600, 1088, 1, 4096]
    - [225, 40.38]
  - - [1856, 1088, 1, 4096]
    - [225, 42.25]
  - - [2112, 1088, 1, 4096]
    - [279, 43.24]
  - - [2368, 1088, 1, 4096]
    - [225, 43.81]
  - - [2624, 1088, 1, 4096]
    - [225, 43.5]
  - - [2880, 1088, 1, 4096]
    - [176, 42.85]
  - - [3136, 1088, 1, 4096]
    - [293, 43.19]
  - - [3392, 1088, 1, 4096]
    - [306, 44.2]
  - - [3648, 1088, 1, 4096]
    - [279, 45.11]
  - - [3904, 1088, 1, 4096]
    - [306, 45.07]
  - - [64, 1344, 1, 4096]
    - [157, 12.67]
  - - [320, 1344, 1, 4096]
    - [335, 31.57]
  - - [576, 1344, 1, 4096]
    - [290, 37.1]
  - - [832, 1344, 1, 4096]
    - [225, 40.24]
  - - [1088, 1344, 1, 4096]
    - [279, 38.95]
  - - [1344, 1344, 1, 4096]
    - [182, 42.39]
  - - [1600, 1344, 1, 4096]
    - [292, 42.46]
  - - [1856, 1344, 1, 4096]
    - [279, 42.51]
  - - [2112, 1344, 1, 4096]
    - [286, 43.04]
  - - [2368, 1344, 1, 4096]
    - [279, 44.81]
  - - [2624, 1344, 1, 4096]
    - [305, 44.07]
  - - [2880, 1344, 1, 4096]
    - [306, 46.35]
  - - [3136, 1344, 1, 4096]
    - [306, 44.56]
  - - [3392, 1344, 1, 4096]
    - [330, 44.69]
  - - [3648, 1344, 1, 4096]
    - [306, 47.77]
  - - [3904, 1344, 1, 4096]
    - [306, 46.1]
  - - [64, 1600, 1, 4096]
    - [157, 15.06]
  - - [320, 1600, 1, 4096]
    - [279, 35.5]
  - - [576, 1600, 1, 4096]
    - [251, 38.33]
  - - [832, 1600, 1, 4096]
    - [225, 39.4]
  - - [1088, 1600, 1, 4096]
    - [225, 40.49]
  - - [1344, 1600, 1, 4096]
    - [225, 42.18]
  - - [1600, 1600, 1, 4096]
    - [225, 43.13]
  - - [1856, 1600, 1, 4096]
    - [225, 44.84]
  - - [2112, 1600, 1, 4096]
    - [306, 44.75]
  - - [2368, 1600, 1, 4096]
    - [330, 45.13]
  - - [2624, 1600, 1, 4096]
    - [354, 44.6]
  - - [2880, 1600, 1, 4096]
    - [306, 45.06]
  - - [3136, 1600, 1, 4096]
    - [330, 44.37]
  - - [3392, 1600, 1, 4096]
    - [306, 47.94]
  - - [3648, 1600, 1, 4096]
    - [306, 48.2]
  - - [3904, 1600, 1, 4096]
    - [306, 47.72]
  - - [64, 1856, 1, 4096]
    - [157, 17.29]
  - - [320, 1856, 1, 4096]
    - [279, 35.21]
  - - [576, 1856, 1, 4096]
    - [225, 37.63]
  - - [832, 1856, 1, 4096]
    - [225, 41.84]
  - - [1088, 1856, 1, 4096]
    - [279, 41.04]
  - - [1344, 1856, 1, 4096]
    - [279, 42.38]
  - - [1600, 1856, 1, 4096]
    - [279, 44.34]
  - - [1856, 1856, 1, 4096]
    - [225, 43.98]
  - - [2112, 1856, 1, 4096]
    - [306, 46.16]
  - - [2368, 1856, 1, 4096]
    - [330, 45.78]
  - - [2624, 1856, 1, 4096]
    - [306, 47.1]
  - - [2880, 1856, 1, 4096]
    - [330, 46.4]
  - - [3136, 1856, 1, 4096]
    - [306, 47.59]
  - - [3392, 1856, 1, 4096]
    - [330, 47.13]
  - - [3648, 1856, 1, 4096]
    - [306, 48.15]
  - - [3904, 1856, 1, 4096]
    - [330, 47.18]
  - - [64, 2112, 1, 4096]
    - [313, 16.56]
  - - [320, 2112, 1, 4096]
    - [251, 33.21]
  - - [576, 2112, 1, 4096]
    - [279, 38.36]
  - - [832, 2112, 1, 4096]
    - [225, 41.92]
  - - [1088, 2112, 1, 4096]
    - [225, 42.09]
  - - [1344, 2112, 1, 4096]
    - [279, 43.55]
  - - [1600, 2112, 1, 4096]
    - [225, 44.45]
  - - [1856, 2112, 1, 4096]
    - [306, 45.7]
  - - [2112, 2112, 1, 4096]
    - [355, 43.84]
  - - [2368, 2112, 1, 4096]
    - [306, 44.38]
  - - [2624, 2112, 1, 4096]
    - [354, 46.97]
  - - [2880, 2112, 1, 4096]
    - [330, 45.63]
  - - [3136, 2112, 1, 4096]
    - [306, 47.47]
  - - [3392, 2112, 1, 4096]
    - [318, 47.62]
  - - [3648, 2112, 1, 4096]
    - [306, 49.35]
  - - [3904, 2112, 1, 4096]
    - [330, 49.35]
  - - [64, 2368, 1, 4096]
    - [279, 18.56]
  - - [320, 2368, 1, 4096]
    - [176, 36.28]
  - - [576, 2368, 1, 4096]
    - [225, 39.95]
  - - [832, 2368, 1, 4096]
    - [225, 42.04]
  - - [1088, 2368, 1, 4096]
    - [225, 43.95]
  - - [1344, 2368, 1, 4096]
    - [313, 43.76]
  - - [1600, 2368, 1, 4096]
    - [306, 45.28]
  - - [1856, 2368, 1, 4096]
    - [330, 46.96]
  - - [2112, 2368, 1, 4096]
    - [330, 44.49]
  - - [2368, 2368, 1, 4096]
    - [306, 46.39]
  - - [2624, 2368, 1, 4096]
    - [306, 47.66]
  - - [2880, 2368, 1, 4096]
    - [318, 47.38]
  - - [3136, 2368, 1, 4096]
    - [306, 49.06]
  - - [3392, 2368, 1, 4096]
    - [318, 48.03]
  - - [3648, 2368, 1, 4096]
    - [306, 48.44]
  - - [3904, 2368, 1, 4096]
    - [318, 49.62]
  - - [64, 2624, 1, 4096]
    - [225, 20.43]
  - - [320, 2624, 1, 4096]
    - [225, 35.33]
  - - [576, 2624, 1, 4096]
    - [292, 41.17]
  - - [832, 2624, 1, 4096]
    - [319, 43.85]
  - - [1088, 2624, 1, 4096]
    - [225, 45.03]
  - - [1344, 2624, 1, 4096]
    - [393, 46.0]
  - - [1600, 2624, 1, 4096]
    - [320, 45.98]
  - - [1856, 2624, 1, 4096]
    - [330, 46.3]
  - - [2112, 2624, 1, 4096]
    - [356, 47.81]
  - - [2368, 2624, 1, 4096]
    - [330, 47.31]
  - - [2624, 2624, 1, 4096]
    - [330, 48.69]
  - - [2880, 2624, 1, 4096]
    - [306, 48.21]
  - - [3136, 2624, 1, 4096]
    - [330, 48.47]
  - - [3392, 2624, 1, 4096]
    - [318, 50.72]
  - - [3648, 2624, 1, 4096]
    - [330, 48.65]
  - - [3904, 2624, 1, 4096]
    - [330, 49.77]
  - - [64, 2880, 1, 4096]
    - [313, 22.02]
  - - [320, 2880, 1, 4096]
    - [292, 36.35]
  - - [576, 2880, 1, 4096]
    - [182, 41.2]
  - - [832, 2880, 1, 4096]
    - [225, 42.87]
  - - [1088, 2880, 1, 4096]
    - [293, 44.22]
  - - [1344, 2880, 1, 4096]
    - [306, 44.94]
  - - [1600, 2880, 1, 4096]
    - [306, 44.55]
  - - [1856, 2880, 1, 4096]
    - [330, 46.64]
  - - [2112, 2880, 1, 4096]
    - [306, 46.07]
  - - [2368, 2880, 1, 4096]
    - [306, 48.7]
  - - [2624, 2880, 1, 4096]
    - [330, 47.75]
  - - [2880, 2880, 1, 4096]
    - [318, 49.11]
  - - [3136, 2880, 1, 4096]
    - [359, 50.55]
  - - [3392, 2880, 1, 4096]
    - [318, 49.81]
  - - [3648, 2880, 1, 4096]
    - [318, 50.46]
  - - [3904, 2880, 1, 4096]
    - [318, 49.84]
  - - [64, 3136, 1, 4096]
    - [279, 23.98]
  - - [320, 3136, 1, 4096]
    - [279, 38.48]
  - - [576, 3136, 1, 4096]
    - [279, 41.73]
  - - [832, 3136, 1, 4096]
    - [225, 44.0]
  - - [1088, 3136, 1, 4096]
    - [284, 42.65]
  - - [1344, 3136, 1, 4096]
    - [330, 44.64]
  - - [1600, 3136, 1, 4096]
    - [306, 45.3]
  - - [1856, 3136, 1, 4096]
    - [306, 48.02]
  - - [2112, 3136, 1, 4096]
    - [306, 48.34]
  - - [2368, 3136, 1, 4096]
    - [330, 49.52]
  - - [2624, 3136, 1, 4096]
    - [306, 49.21]
  - - [2880, 3136, 1, 4096]
    - [318, 51.1]
  - - [3136, 3136, 1, 4096]
    - [306, 50.23]
  - - [3392, 3136, 1, 4096]
    - [306, 50.29]
  - - [3648, 3136, 1, 4096]
    - [318, 50.87]
  - - [3904, 3136, 1, 4096]
    - [359, 50.19]
  - - [64, 3392, 1, 4096]
    - [279, 25.93]
  - - [320, 3392, 1, 4096]
    - [225, 38.34]
  - - [576, 3392, 1, 4096]
    - [279, 43.15]
  - - [832, 3392, 1, 4096]
    - [225, 44.09]
  - - [1088, 3392, 1, 4096]
    - [293, 43.15]
  - - [1344, 3392, 1, 4096]
    - [306, 44.25]
  - - [1600, 3392, 1, 4096]
    - [306, 47.93]
  - - [1856, 3392, 1, 4096]
    - [306, 47.87]
  - - [2112, 3392, 1, 4096]
    - [306, 48.13]
  - - [2368, 3392, 1, 4096]
    - [306, 48.13]
  - - [2624, 3392, 1, 4096]
    - [330, 49.94]
  - - [2880, 3392, 1, 4096]
    - [330, 49.35]
  - - [3136, 3392, 1, 4096]
    - [306, 50.09]
  - - [3392, 3392, 1, 4096]
    - [318, 51.03]
  - - [3648, 3392, 1, 4096]
    - [359, 50.56]
  - - [3904, 3392, 1, 4096]
    - [318, 50.98]
  - - [64, 3648, 1, 4096]
    - [332, 27.28]
  - - [320, 3648, 1, 4096]
    - [225, 41.59]
  - - [576, 3648, 1, 4096]
    - [225, 42.37]
  - - [832, 3648, 1, 4096]
    - [284, 42.46]
  - - [1088, 3648, 1, 4096]
    - [279, 45.12]
  - - [1344, 3648, 1, 4096]
    - [306, 47.46]
  - - [1600, 3648, 1, 4096]
    - [306, 47.84]
  - - [1856, 3648, 1, 4096]
    - [306, 48.74]
  - - [2112, 3648, 1, 4096]
    - [330, 48.91]
  - - [2368, 3648, 1, 4096]
    - [306, 48.73]
  - - [2624, 3648, 1, 4096]
    - [330, 49.27]
  - - [2880, 3648, 1, 4096]
    - [318, 50.18]
  - - [3136, 3648, 1, 4096]
    - [359, 50.66]
  - - [3392, 3648, 1, 4096]
    - [359, 50.68]
  - - [3648, 3648, 1, 4096]
    - [359, 50.97]
  - - [3904, 3648, 1, 4096]
    - [318, 50.75]
  - - [64, 3904, 1, 4096]
    - [279, 30.02]
  - - [320, 3904, 1, 4096]
    - [309, 42.79]
  - - [576, 3904, 1, 4096]
    - [225, 44.66]
  - - [832, 3904, 1, 4096]
    - [320, 46.1]
  - - [1088, 3904, 1, 4096]
    - [306, 47.01]
  - - [1344, 3904, 1, 4096]
    - [330, 48.65]
  - - [1600, 3904, 1, 4096]
    - [306, 49.2]
  - - [1856, 3904, 1, 4096]
    - [306, 49.83]
  - - [2112, 3904, 1, 4096]
    - [306, 49.95]
  - - [2368, 3904, 1, 4096]
    - [306, 49.87]
  - - [2624, 3904, 1, 4096]
    - [359, 50.63]
  - - [2880, 3904, 1, 4096]
    - [318, 50.96]
  - - [3136, 3904, 1, 4096]
    - [359, 50.19]
  - - [3392, 3904, 1, 4096]
    - [330, 50.41]
  - - [3648, 3904, 1, 4096]
    - [306, 51.04]
  - - [3904, 3904, 1, 4096]
    - [306, 50.92]
  - - [192, 64, 1, 64]
    - [116, 0.08]
  - - [448, 64, 1, 64]
    - [120, 0.19]
  - - [704, 64, 1, 64]
    - [124, 0.29]
  - - [960, 64, 1, 64]
    - [117, 0.38]
  - - [1216, 64, 1, 64]
    - [133, 0.49]
  - - [1472, 64, 1, 64]
    - [119, 0.59]
  - - [1728, 64, 1, 64]
    - [337, 0.68]
  - - [1984, 64, 1, 64]
    - [338, 0.78]
  - - [64, 192, 1, 64]
    - [124, 0.08]
  - - [192, 192, 1, 64]
    - [122, 0.23]
  - - [320, 192, 1, 64]
    - [143, 0.39]
  - - [448, 192, 1, 64]
    - [119, 0.51]
  - - [576, 192, 1, 64]
    - [146, 0.64]
  - - [704, 192, 1, 64]
    - [148, 0.79]
  - - [832, 192, 1, 64]
    - [150, 0.95]
  - - [960, 192, 1, 64]
    - [151, 1.1]
  - - [1088, 192, 1, 64]
    - [211, 1.25]
  - - [1216, 192, 1, 64]
    - [339, 1.38]
  - - [1344, 192, 1, 64]
    - [340, 1.54]
  - - [1472, 192, 1, 64]
    - [191, 1.62]
  - - [1600, 192, 1, 64]
    - [191, 1.75]
  - - [1728, 192, 1, 64]
    - [139, 1.86]
  - - [1856, 192, 1, 64]
    - [223, 2.0]
  - - [1984, 192, 1, 64]
    - [166, 2.15]
  - - [192, 320, 1, 64]
    - [141, 0.39]
  - - [448, 320, 1, 64]
    - [159, 0.86]
  - - [704, 320, 1, 64]
    - [166, 1.26]
  - - [960, 320, 1, 64]
    - [170, 1.76]
  - - [1216, 320, 1, 64]
    - [170, 2.21]
  - - [1472, 320, 1, 64]
    - [341, 2.44]
  - - [1728, 320, 1, 64]
    - [177, 2.88]
  - - [1984, 320, 1, 64]
    - [284, 3.27]
  - - [64, 448, 1, 64]
    - [133, 0.19]
  - - [192, 448, 1, 64]
    - [184, 0.53]
  - - [320, 448, 1, 64]
    - [157, 0.85]
  - - [448, 448, 1, 64]
    - [177, 1.16]
  - - [576, 448, 1, 64]
    - [188, 1.5]
  - - [704, 448, 1, 64]
    - [189, 1.75]
  - - [832, 448, 1, 64]
    - [191, 2.1]
  - - [960, 448, 1, 64]
    - [191, 2.33]
  - - [1088, 448, 1, 64]
    - [177, 2.65]
  - - [1216, 448, 1, 64]
    - [177, 2.82]
  - - [1344, 448, 1, 64]
    - [177, 3.1]
  - - [1472, 448, 1, 64]
    - [177, 3.27]
  - - [1600, 448, 1, 64]
    - [177, 3.52]
  - - [1728, 448, 1, 64]
    - [177, 3.56]
  - - [1856, 448, 1, 64]
    - [342, 3.65]
  - - [1984, 448, 1, 64]
    - [177, 4.09]
  - - [192, 576, 1, 64]
    - [139, 0.68]
  - - [448, 576, 1, 64]
    - [150, 1.47]
  - - [704, 576, 1, 64]
    - [148, 2.23]
  - - [960, 576, 1, 64]
    - [212, 2.86]
  - - [1216, 576, 1, 64]
    - [177, 3.21]
  - - [1472, 576, 1, 64]
    - [209, 3.71]
  - - [1728, 576, 1, 64]
    - [177, 4.3]
  - - [1984, 576, 1, 64]
    - [177, 4.69]
  - - [64, 704, 1, 64]
    - [220, 0.28]
  - - [192, 704, 1, 64]
    - [125, 0.77]
  - - [320, 704, 1, 64]
    - [223, 1.35]
  - - [448, 704, 1, 64]
    - [139, 1.81]
  - - [576, 704, 1, 64]
    - [177, 2.22]
  - - [704, 704, 1, 64]
    - [139, 2.55]
  - - [832, 704, 1, 64]
    - [225, 2.99]
  - - [960, 704, 1, 64]
    - [209, 3.32]
  - - [1088, 704, 1, 64]
    - [177, 3.77]
  - - [1216, 704, 1, 64]
    - [177, 4.01]
  - - [1344, 704, 1, 64]
    - [177, 4.27]
  - - [1472, 704, 1, 64]
    - [177, 4.64]
  - - [1600, 704, 1, 64]
    - [177, 4.77]
  - - [1728, 704, 1, 64]
    - [343, 4.86]
  - - [1856, 704, 1, 64]
    - [177, 5.28]
  - - [1984, 704, 1, 64]
    - [293, 5.18]
  - - [192, 832, 1, 64]
    - [151, 0.95]
  - - [448, 832, 1, 64]
    - [207, 2.09]
  - - [704, 832, 1, 64]
    - [238, 2.89]
  - - [960, 832, 1, 64]
    - [191, 3.76]
  - - [1216, 832, 1, 64]
    - [159, 4.5]
  - - [1472, 832, 1, 64]
    - [177, 4.9]
  - - [1728, 832, 1, 64]
    - [343, 5.48]
  - - [1984, 832, 1, 64]
    - [177, 5.99]
  - - [64, 960, 1, 64]
    - [248, 0.39]
  - - [192, 960, 1, 64]
    - [249, 1.07]
  - - [320, 960, 1, 64]
    - [251, 1.69]
  - - [448, 960, 1, 64]
    - [211, 2.35]
  - - [576, 960, 1, 64]
    - [225, 2.85]
  - - [704, 960, 1, 64]
    - [177, 3.26]
  - - [832, 960, 1, 64]
    - [168, 3.72]
  - - [960, 960, 1, 64]
    - [177, 4.01]
  - - [1088, 960, 1, 64]
    - [168, 4.65]
  - - [1216, 960, 1, 64]
    - [191, 5.04]
  - - [1344, 960, 1, 64]
    - [343, 5.06]
  - - [1472, 960, 1, 64]
    - [177, 5.33]
  - - [1600, 960, 1, 64]
    - [177, 5.75]
  - - [1728, 960, 1, 64]
    - [177, 5.97]
  - - [1856, 960, 1, 64]
    - [177, 6.37]
  - - [1984, 960, 1, 64]
    - [191, 6.48]
  - - [192, 1088, 1, 64]
    - [240, 1.23]
  - - [448, 1088, 1, 64]
    - [293, 2.61]
  - - [704, 1088, 1, 64]
    - [159, 3.68]
  - - [960, 1088, 1, 64]
    - [177, 4.56]
  - - [1216, 1088, 1, 64]
    - [177, 5.41]
  - - [1472, 1088, 1, 64]
    - [177, 6.04]
  - - [1728, 1088, 1, 64]
    - [343, 6.6]
  - - [1984, 1088, 1, 64]
    - [177, 7.12]
  - - [64, 1216, 1, 64]
    - [135, 0.48]
  - - [192, 1216, 1, 64]
    - [168, 1.35]
  - - [320, 1216, 1, 64]
    - [205, 2.14]
  - - [448, 1216, 1, 64]
    - [212, 2.78]
  - - [576, 1216, 1, 64]
    - [177, 3.39]
  - - [704, 1216, 1, 64]
    - [284, 3.81]
  - - [832, 1216, 1, 64]
    - [343, 4.45]
  - - [960, 1216, 1, 64]
    - [177, 4.92]
  - - [1088, 1216, 1, 64]
    - [177, 5.27]
  - - [1216, 1216, 1, 64]
    - [177, 5.69]
  - - [1344, 1216, 1, 64]
    - [177, 6.15]
  - - [1472, 1216, 1, 64]
    - [177, 6.52]
  - - [1600, 1216, 1, 64]
    - [177, 6.79]
  - - [1728, 1216, 1, 64]
    - [343, 6.92]
  - - [1856, 1216, 1, 64]
    - [177, 7.13]
  - - [1984, 1216, 1, 64]
    - [177, 7.51]
  - - [192, 1344, 1, 64]
    - [177, 1.5]
  - - [448, 1344, 1, 64]
    - [284, 3.05]
  - - [704, 1344, 1, 64]
    - [159, 4.18]
  - - [960, 1344, 1, 64]
    - [177, 5.13]
  - - [1216, 1344, 1, 64]
    - [177, 6.08]
  - - [1472, 1344, 1, 64]
    - [343, 6.77]
  - - [1728, 1344, 1, 64]
    - [177, 7.47]
  - - [1984, 1344, 1, 64]
    - [177, 7.83]
  - - [64, 1472, 1, 64]
    - [345, 0.56]
  - - [192, 1472, 1, 64]
    - [178, 1.54]
  - - [320, 1472, 1, 64]
    - [177, 2.56]
  - - [448, 1472, 1, 64]
    - [159, 3.27]
  - - [576, 1472, 1, 64]
    - [343, 3.98]
  - - [704, 1472, 1, 64]
    - [159, 4.5]
  - - [832, 1472, 1, 64]
    - [177, 5.07]
  - - [960, 1472, 1, 64]
    - [343, 5.6]
  - - [1088, 1472, 1, 64]
    - [177, 6.03]
  - - [1216, 1472, 1, 64]
    - [343, 6.46]
  - - [1344, 1472, 1, 64]
    - [177, 6.82]
  - - [1472, 1472, 1, 64]
    - [177, 7.25]
  - - [1600, 1472, 1, 64]
    - [168, 7.17]
  - - [1728, 1472, 1, 64]
    - [177, 7.71]
  - - [1856, 1472, 1, 64]
    - [343, 8.01]
  - - [1984, 1472, 1, 64]
    - [177, 8.28]
  - - [192, 1600, 1, 64]
    - [148, 1.74]
  - - [448, 1600, 1, 64]
    - [191, 3.49]
  - - [704, 1600, 1, 64]
    - [343, 4.83]
  - - [960, 1600, 1, 64]
    - [177, 5.72]
  - - [1216, 1600, 1, 64]
    - [177, 6.81]
  - - [1472, 1600, 1, 64]
    - [159, 7.3]
  - - [1728, 1600, 1, 64]
    - [177, 8.06]
  - - [1984, 1600, 1, 64]
    - [177, 8.52]
  - - [64, 1728, 1, 64]
    - [151, 0.67]
  - - [192, 1728, 1, 64]
    - [347, 1.88]
  - - [320, 1728, 1, 64]
    - [159, 2.88]
  - - [448, 1728, 1, 64]
    - [177, 3.73]
  - - [576, 1728, 1, 64]
    - [177, 4.49]
  - - [704, 1728, 1, 64]
    - [177, 5.07]
  - - [832, 1728, 1, 64]
    - [343, 5.59]
  - - [960, 1728, 1, 64]
    - [177, 6.05]
  - - [1088, 1728, 1, 64]
    - [177, 6.57]
  - - [1216, 1728, 1, 64]
    - [191, 6.76]
  - - [1344, 1728, 1, 64]
    - [343, 7.0]
  - - [1472, 1728, 1, 64]
    - [343, 7.32]
  - - [1600, 1728, 1, 64]
    - [343, 7.93]
  - - [1728, 1728, 1, 64]
    - [343, 8.37]
  - - [1856, 1728, 1, 64]
    - [343, 8.71]
  - - [1984, 1728, 1, 64]
    - [177, 8.87]
  - - [192, 1856, 1, 64]
    - [139, 2.01]
  - - [448, 1856, 1, 64]
    - [159, 3.75]
  - - [704, 1856, 1, 64]
    - [343, 5.4]
  - - [960, 1856, 1, 64]
    - [343, 6.28]
  - - [1216, 1856, 1, 64]
    - [177, 7.23]
  - - [1472, 1856, 1, 64]
    - [343, 8.01]
  - - [1728, 1856, 1, 64]
    - [177, 8.44]
  - - [1984, 1856, 1, 64]
    - [177, 9.08]
  - - [64, 1984, 1, 64]
    - [229, 0.78]
  - - [192, 1984, 1, 64]
    - [188, 2.17]
  - - [320, 1984, 1, 64]
    - [225, 3.14]
  - - [448, 1984, 1, 64]
    - [343, 3.91]
  - - [576, 1984, 1, 64]
    - [159, 4.97]
  - - [704, 1984, 1, 64]
    - [177, 5.35]
  - - [832, 1984, 1, 64]
    - [177, 6.12]
  - - [960, 1984, 1, 64]
    - [343, 6.41]
  - - [1088, 1984, 1, 64]
    - [177, 7.14]
  - - [1216, 1984, 1, 64]
    - [348, 7.19]
  - - [1344, 1984, 1, 64]
    - [343, 7.74]
  - - [1472, 1984, 1, 64]
    - [177, 8.41]
  - - [1600, 1984, 1, 64]
    - [177, 8.65]
  - - [1728, 1984, 1, 64]
    - [343, 8.96]
  - - [1856, 1984, 1, 64]
    - [177, 9.08]
  - - [1984, 1984, 1, 64]
    - [177, 9.41]
  - - [192, 64, 1, 256]
    - [259, 0.29]
  - - [448, 64, 1, 256]
    - [263, 0.68]
  - - [704, 64, 1, 256]
    - [266, 1.06]
  - - [960, 64, 1, 256]
    - [265, 1.44]
  - - [1216, 64, 1, 256]
    - [176, 1.68]
  - - [1472, 64, 1, 256]
    - [176, 2.04]
  - - [1728, 64, 1, 256]
    - [249, 2.37]
  - - [1984, 64, 1, 256]
    - [176, 2.83]
  - - [64, 192, 1, 256]
    - [128, 0.3]
  - - [192, 192, 1, 256]
    - [265, 0.87]
  - - [320, 192, 1, 256]
    - [267, 1.43]
  - - [448, 192, 1, 256]
    - [249, 1.94]
  - - [576, 192, 1, 256]
    - [182, 2.43]
  - - [704, 192, 1, 256]
    - [249, 2.92]
  - - [832, 192, 1, 256]
    - [176, 3.29]
  - - [960, 192, 1, 256]
    - [185, 3.92]
  - - [1088, 192, 1, 256]
    - [176, 4.44]
  - - [1216, 192, 1, 256]
    - [157, 4.87]
  - - [1344, 192, 1, 256]
    - [176, 5.37]
  - - [1472, 192, 1, 256]
    - [176, 5.43]
  - - [1600, 192, 1, 256]
    - [176, 6.13]
  - - [1728, 192, 1, 256]
    - [182, 6.47]
  - - [1856, 192, 1, 256]
    - [279, 6.98]
  - - [1984, 192, 1, 256]
    - [284, 7.44]
  - - [192, 320, 1, 256]
    - [281, 1.38]
  - - [448, 320, 1, 256]
    - [249, 3.08]
  - - [704, 320, 1, 256]
    - [166, 4.67]
  - - [960, 320, 1, 256]
    - [249, 6.1]
  - - [1216, 320, 1, 256]
    - [279, 7.57]
  - - [1472, 320, 1, 256]
    - [279, 8.18]
  - - [1728, 320, 1, 256]
    - [185, 8.93]
  - - [1984, 320, 1, 256]
    - [286, 10.55]
  - - [64, 448, 1, 256]
    - [260, 0.7]
  - - [192, 448, 1, 256]
    - [276, 1.95]
  - - [320, 448, 1, 256]
    - [249, 3.09]
  - - [448, 448, 1, 256]
    - [279, 4.03]
  - - [576, 448, 1, 256]
    - [283, 5.13]
  - - [704, 448, 1, 256]
    - [284, 6.18]
  - - [832, 448, 1, 256]
    - [225, 7.2]
  - - [960, 448, 1, 256]
    - [157, 7.8]
  - - [1088, 448, 1, 256]
    - [157, 8.72]
  - - [1216, 448, 1, 256]
    - [157, 9.16]
  - - [1344, 448, 1, 256]
    - [157, 10.12]
  - - [1472, 448, 1, 256]
    - [296, 10.31]
  - - [1600, 448, 1, 256]
    - [282, 10.75]
  - - [1728, 448, 1, 256]
    - [286, 11.38]
  - - [1856, 448, 1, 256]
    - [286, 11.89]
  - - [1984, 448, 1, 256]
    - [293, 12.75]
  - - [192, 576, 1, 256]
    - [176, 2.45]
  - - [448, 576, 1, 256]
    - [249, 5.36]
  - - [704, 576, 1, 256]
    - [182, 7.41]
  - - [960, 576, 1, 256]
    - [225, 9.31]
  - - [1216, 576, 1, 256]
    - [287, 10.94]
  - - [1472, 576, 1, 256]
    - [290, 12.25]
  - - [1728, 576, 1, 256]
    - [290, 13.26]
  - - [1984, 576, 1, 256]
    - [286, 14.31]
  - - [64, 704, 1, 256]
    - [260, 1.07]
  - - [192, 704, 1, 256]
    - [176, 2.9]
  - - [320, 704, 1, 256]
    - [279, 4.75]
  - - [448, 704, 1, 256]
    - [182, 6.21]
  - - [576, 704, 1, 256]
    - [157, 7.49]
  - - [704, 704, 1, 256]
    - [284, 8.9]
  - - [832, 704, 1, 256]
    - [286, 9.82]
  - - [960, 704, 1, 256]
    - [290, 10.68]
  - - [1088, 704, 1, 256]
    - [287, 11.85]
  - - [1216, 704, 1, 256]
    - [290, 12.31]
  - - [1344, 704, 1, 256]
    - [287, 12.79]
  - - [1472, 704, 1, 256]
    - [286, 13.89]
  - - [1600, 704, 1, 256]
    - [286, 14.46]
  - - [1728, 704, 1, 256]
    - [287, 14.77]
  - - [1856, 704, 1, 256]
    - [287, 15.45]
  - - [1984, 704, 1, 256]
    - [287, 15.93]
  - - [192, 832, 1, 256]
    - [279, 3.36]
  - - [448, 832, 1, 256]
    - [284, 7.19]
  - - [704, 832, 1, 256]
    - [279, 9.74]
  - - [960, 832, 1, 256]
    - [287, 11.77]
  - - [1216, 832, 1, 256]
    - [287, 13.61]
  - - [1472, 832, 1, 256]
    - [287, 14.28]
  - - [1728, 832, 1, 256]
    - [185, 15.73]
  - - [1984, 832, 1, 256]
    - [286, 16.76]
  - - [64, 960, 1, 256]
    - [266, 1.38]
  - - [192, 960, 1, 256]
    - [249, 3.74]
  - - [320, 960, 1, 256]
    - [157, 5.98]
  - - [448, 960, 1, 256]
    - [225, 7.85]
  - - [576, 960, 1, 256]
    - [279, 9.34]
  - - [704, 960, 1, 256]
    - [202, 10.61]
  - - [832, 960, 1, 256]
    - [287, 11.74]
  - - [960, 960, 1, 256]
    - [294, 12.7]
  - - [1088, 960, 1, 256]
    - [290, 13.64]
  - - [1216, 960, 1, 256]
    - [286, 14.68]
  - - [1344, 960, 1, 256]
    - [287, 15.5]
  - - [1472, 960, 1, 256]
    - [287, 16.0]
  - - [1600, 960, 1, 256]
    - [287, 16.51]
  - - [1728, 960, 1, 256]
    - [287, 16.87]
  - - [1856, 960, 1, 256]
    - [286, 17.25]
  - - [1984, 960, 1, 256]
    - [286, 18.03]
  - - [192, 1088, 1, 256]
    - [157, 4.42]
  - - [448, 1088, 1, 256]
    - [279, 8.46]
  - - [704, 1088, 1, 256]
    - [293, 11.83]
  - - [960, 1088, 1, 256]
    - [287, 14.05]
  - - [1216, 1088, 1, 256]
    - [287, 15.3]
  - - [1472, 1088, 1, 256]
    - [286, 16.27]
  - - [1728, 1088, 1, 256]
    - [293, 17.84]
  - - [1984, 1088, 1, 256]
    - [293, 18.23]
  - - [64, 1216, 1, 256]
    - [272, 1.73]
  - - [192, 1216, 1, 256]
    - [166, 4.87]
  - - [320, 1216, 1, 256]
    - [249, 7.32]
  - - [448, 1216, 1, 256]
    - [289, 8.82]
  - - [576, 1216, 1, 256]
    - [293, 10.95]
  - - [704, 1216, 1, 256]
    - [202, 12.21]
  - - [832, 1216, 1, 256]
    - [286, 13.62]
  - - [960, 1216, 1, 256]
    - [286, 14.74]
  - - [1088, 1216, 1, 256]
    - [287, 15.29]
  - - [1216, 1216, 1, 256]
    - [349, 16.04]
  - - [1344, 1216, 1, 256]
    - [320, 16.67]
  - - [1472, 1216, 1, 256]
    - [286, 17.65]
  - - [1600, 1216, 1, 256]
    - [320, 18.02]
  - - [1728, 1216, 1, 256]
    - [309, 18.66]
  - - [1856, 1216, 1, 256]
    - [286, 18.62]
  - - [1984, 1216, 1, 256]
    - [286, 19.49]
  - - [192, 1344, 1, 256]
    - [337, 5.18]
  - - [448, 1344, 1, 256]
    - [284, 9.66]
  - - [704, 1344, 1, 256]
    - [296, 13.03]
  - - [960, 1344, 1, 256]
    - [287, 14.99]
  - - [1216, 1344, 1, 256]
    - [286, 16.9]
  - - [1472, 1344, 1, 256]
    - [296, 17.76]
  - - [1728, 1344, 1, 256]
    - [286, 19.61]
  - - [1984, 1344, 1, 256]
    - [286, 19.84]
  - - [64, 1472, 1, 256]
    - [302, 2.11]
  - - [192, 1472, 1, 256]
    - [176, 5.55]
  - - [320, 1472, 1, 256]
    - [284, 8.47]
  - - [448, 1472, 1, 256]
    - [293, 9.99]
  - - [576, 1472, 1, 256]
    - [349, 11.73]
  - - [704, 1472, 1, 256]
    - [293, 13.4]
  - - [832, 1472, 1, 256]
    - [309, 14.54]
  - - [960, 1472, 1, 256]
    - [287, 15.65]
  - - [1088, 1472, 1, 256]
    - [293, 16.36]
  - - [1216, 1472, 1, 256]
    - [287, 17.45]
  - - [1344, 1472, 1, 256]
    - [296, 18.13]
  - - [1472, 1472, 1, 256]
    - [286, 18.82]
  - - [1600, 1472, 1, 256]
    - [284, 19.74]
  - - [1728, 1472, 1, 256]
    - [286, 19.78]
  - - [1856, 1472, 1, 256]
    - [293, 20.53]
  - - [1984, 1472, 1, 256]
    - [286, 20.13]
  - - [192, 1600, 1, 256]
    - [176, 5.78]
  - - [448, 1600, 1, 256]
    - [284, 10.7]
  - - [704, 1600, 1, 256]
    - [286, 14.26]
  - - [960, 1600, 1, 256]
    - [287, 16.4]
  - - [1216, 1600, 1, 256]
    - [293, 18.22]
  - - [1472, 1600, 1, 256]
    - [286, 19.67]
  - - [1728, 1600, 1, 256]
    - [286, 20.2]
  - - [1984, 1600, 1, 256]
    - [185, 20.75]
  - - [64, 1728, 1, 256]
    - [276, 2.46]
  - - [192, 1728, 1, 256]
    - [225, 6.54]
  - - [320, 1728, 1, 256]
    - [176, 9.36]
  - - [448, 1728, 1, 256]
    - [287, 11.78]
  - - [576, 1728, 1, 256]
    - [251, 12.97]
  - - [704, 1728, 1, 256]
    - [296, 14.25]
  - - [832, 1728, 1, 256]
    - [287, 16.1]
  - - [960, 1728, 1, 256]
    - [286, 17.28]
  - - [1088, 1728, 1, 256]
    - [282, 16.71]
  - - [1216, 1728, 1, 256]
    - [286, 18.3]
  - - [1344, 1728, 1, 256]
    - [286, 19.64]
  - - [1472, 1728, 1, 256]
    - [286, 19.65]
  - - [1600, 1728, 1, 256]
    - [286, 20.1]
  - - [1728, 1728, 1, 256]
    - [293, 20.73]
  - - [1856, 1728, 1, 256]
    - [286, 21.08]
  - - [1984, 1728, 1, 256]
    - [202, 21.34]
  - - [192, 1856, 1, 256]
    - [201, 6.66]
  - - [448, 1856, 1, 256]
    - [287, 12.02]
  - - [704, 1856, 1, 256]
    - [287, 15.35]
  - - [960, 1856, 1, 256]
    - [286, 17.29]
  - - [1216, 1856, 1, 256]
    - [185, 18.44]
  - - [1472, 1856, 1, 256]
    - [293, 20.21]
  - - [1728, 1856, 1, 256]
    - [286, 21.48]
  - - [1984, 1856, 1, 256]
    - [287, 22.12]
  - - [64, 1984, 1, 256]
    - [350, 2.78]
  - - [192, 1984, 1, 256]
    - [176, 7.35]
  - - [320, 1984, 1, 256]
    - [157, 10.49]
  - - [448, 1984, 1, 256]
    - [287, 12.59]
  - - [576, 1984, 1, 256]
    - [286, 14.2]
  - - [704, 1984, 1, 256]
    - [287, 15.69]
  - - [832, 1984, 1, 256]
    - [282, 16.72]
  - - [960, 1984, 1, 256]
    - [293, 17.57]
  - - [1088, 1984, 1, 256]
    - [284, 18.55]
  - - [1216, 1984, 1, 256]
    - [286, 19.4]
  - - [1344, 1984, 1, 256]
    - [286, 20.32]
  - - [1472, 1984, 1, 256]
    - [286, 20.85]
  - - [1600, 1984, 1, 256]
    - [287, 20.64]
  - - [1728, 1984, 1, 256]
    - [287, 20.66]
  - - [1856, 1984, 1, 256]
    - [287, 21.97]
  - - [1984, 1984, 1, 256]
    - [293, 21.76]
  - - [192, 64, 1, 512]
    - [299, 0.57]
  - - [448, 64, 1, 512]
    - [260, 1.3]
  - - [704, 64, 1, 512]
    - [268, 2.02]
  - - [960, 64, 1, 512]
    - [260, 2.53]
  - - [1216, 64, 1, 512]
    - [301, 3.19]
  - - [1472, 64, 1, 512]
    - [267, 3.86]
  - - [1728, 64, 1, 512]
    - [157, 4.26]
  - - [1984, 64, 1, 512]
    - [225, 5.02]
  - - [64, 192, 1, 512]
    - [299, 0.56]
  - - [192, 192, 1, 512]
    - [264, 1.61]
  - - [320, 192, 1, 512]
    - [176, 2.54]
  - - [448, 192, 1, 512]
    - [176, 3.47]
  - - [576, 192, 1, 512]
    - [157, 4.53]
  - - [704, 192, 1, 512]
    - [176, 5.2]
  - - [832, 192, 1, 512]
    - [249, 6.13]
  - - [960, 192, 1, 512]
    - [176, 7.02]
  - - [1088, 192, 1, 512]
    - [249, 7.75]
  - - [1216, 192, 1, 512]
    - [157, 8.6]
  - - [1344, 192, 1, 512]
    - [279, 9.11]
  - - [1472, 192, 1, 512]
    - [286, 9.68]
  - - [1600, 192, 1, 512]
    - [176, 10.4]
  - - [1728, 192, 1, 512]
    - [249, 11.17]
  - - [1856, 192, 1, 512]
    - [286, 11.88]
  - - [1984, 192, 1, 512]
    - [225, 12.51]
  - - [192, 320, 1, 512]
    - [273, 2.58]
  - - [448, 320, 1, 512]
    - [279, 5.54]
  - - [704, 320, 1, 512]
    - [182, 8.42]
  - - [960, 320, 1, 512]
    - [185, 10.48]
  - - [1216, 320, 1, 512]
    - [225, 12.97]
  - - [1472, 320, 1, 512]
    - [279, 14.04]
  - - [1728, 320, 1, 512]
    - [176, 15.07]
  - - [1984, 320, 1, 512]
    - [279, 16.99]
  - - [64, 448, 1, 512]
    - [271, 1.29]
  - - [192, 448, 1, 512]
    - [157, 3.4]
  - - [320, 448, 1, 512]
    - [157, 5.3]
  - - [448, 448, 1, 512]
    - [182, 7.49]
  - - [576, 448, 1, 512]
    - [292, 9.64]
  - - [704, 448, 1, 512]
    - [282, 10.6]
  - - [832, 448, 1, 512]
    - [225, 11.79]
  - - [960, 448, 1, 512]
    - [157, 12.99]
  - - [1088, 448, 1, 512]
    - [157, 14.62]
  - - [1216, 448, 1, 512]
    - [225, 14.73]
  - - [1344, 448, 1, 512]
    - [157, 16.17]
  - - [1472, 448, 1, 512]
    - [309, 16.62]
  - - [1600, 448, 1, 512]
    - [293, 17.31]
  - - [1728, 448, 1, 512]
    - [286, 18.58]
  - - [1856, 448, 1, 512]
    - [284, 18.51]
  - - [1984, 448, 1, 512]
    - [202, 19.52]
  - - [192, 576, 1, 512]
    - [249, 4.44]
  - - [448, 576, 1, 512]
    - [279, 9.6]
  - - [704, 576, 1, 512]
    - [279, 12.43]
  - - [960, 576, 1, 512]
    - [290, 15.5]
  - - [1216, 576, 1, 512]
    - [251, 17.94]
  - - [1472, 576, 1, 512]
    - [290, 19.28]
  - - [1728, 576, 1, 512]
    - [185, 20.62]
  - - [1984, 576, 1, 512]
    - [286, 21.78]
  - - [64, 704, 1, 512]
    - [281, 1.95]
  - - [192, 704, 1, 512]
    - [249, 5.22]
  - - [320, 704, 1, 512]
    - [225, 8.48]
  - - [448, 704, 1, 512]
    - [225, 10.73]
  - - [576, 704, 1, 512]
    - [157, 12.49]
  - - [704, 704, 1, 512]
    - [182, 14.82]
  - - [832, 704, 1, 512]
    - [182, 15.77]
  - - [960, 704, 1, 512]
    - [289, 16.92]
  - - [1088, 704, 1, 512]
    - [290, 18.68]
  - - [1216, 704, 1, 512]
    - [287, 18.92]
  - - [1344, 704, 1, 512]
    - [282, 19.26]
  - - [1472, 704, 1, 512]
    - [279, 20.66]
  - - [1600, 704, 1, 512]
    - [284, 21.36]
  - - [1728, 704, 1, 512]
    - [185, 22.13]
  - - [1856, 704, 1, 512]
    - [282, 23.27]
  - - [1984, 704, 1, 512]
    - [286, 23.63]
  - - [192, 832, 1, 512]
    - [176, 6.03]
  - - [448, 832, 1, 512]
    - [182, 12.5]
  - - [704, 832, 1, 512]
    - [182, 15.83]
  - - [960, 832, 1, 512]
    - [290, 17.77]
  - - [1216, 832, 1, 512]
    - [284, 21.02]
  - - [1472, 832, 1, 512]
    - [282, 22.0]
  - - [1728, 832, 1, 512]
    - [286, 24.01]
  - - [1984, 832, 1, 512]
    - [286, 24.76]
  - - [64, 960, 1, 512]
    - [260, 2.52]
  - - [192, 960, 1, 512]
    - [249, 6.98]
  - - [320, 960, 1, 512]
    - [176, 10.54]
  - - [448, 960, 1, 512]
    - [290, 13.11]
  - - [576, 960, 1, 512]
    - [289, 15.38]
  - - [704, 960, 1, 512]
    - [296, 16.68]
  - - [832, 960, 1, 512]
    - [237, 17.79]
  - - [960, 960, 1, 512]
    - [294, 19.23]
  - - [1088, 960, 1, 512]
    - [286, 21.59]
  - - [1216, 960, 1, 512]
    - [286, 22.55]
  - - [1344, 960, 1, 512]
    - [279, 22.79]
  - - [1472, 960, 1, 512]
    - [284, 23.49]
  - - [1600, 960, 1, 512]
    - [286, 24.47]
  - - [1728, 960, 1, 512]
    - [286, 24.8]
  - - [1856, 960, 1, 512]
    - [286, 25.69]
  - - [1984, 960, 1, 512]
    - [286, 26.57]
  - - [192, 1088, 1, 512]
    - [275, 7.81]
  - - [448, 1088, 1, 512]
    - [249, 14.49]
  - - [704, 1088, 1, 512]
    - [287, 18.67]
  - - [960, 1088, 1, 512]
    - [185, 21.46]
  - - [1216, 1088, 1, 512]
    - [282, 22.16]
  - - [1472, 1088, 1, 512]
    - [185, 24.07]
  - - [1728, 1088, 1, 512]
    - [286, 26.41]
  - - [1984, 1088, 1, 512]
    - [293, 27.45]
  - - [64, 1216, 1, 512]
    - [266, 3.2]
  - - [192, 1216, 1, 512]
    - [182, 8.74]
  - - [320, 1216, 1, 512]
    - [279, 13.03]
  - - [448, 1216, 1, 512]
    - [290, 15.51]
  - - [576, 1216, 1, 512]
    - [320, 17.95]
  - - [704, 1216, 1, 512]
    - [319, 19.58]
  - - [832, 1216, 1, 512]
    - [286, 20.95]
  - - [960, 1216, 1, 512]
    - [286, 21.99]
  - - [1088, 1216, 1, 512]
    - [349, 22.43]
  - - [1216, 1216, 1, 512]
    - [351, 24.25]
  - - [1344, 1216, 1, 512]
    - [320, 24.93]
  - - [1472, 1216, 1, 512]
    - [286, 25.52]
  - - [1600, 1216, 1, 512]
    - [319, 26.78]
  - - [1728, 1216, 1, 512]
    - [286, 27.15]
  - - [1856, 1216, 1, 512]
    - [286, 27.33]
  - - [1984, 1216, 1, 512]
    - [293, 28.26]
  - - [192, 1344, 1, 512]
    - [185, 9.27]
  - - [448, 1344, 1, 512]
    - [290, 16.4]
  - - [704, 1344, 1, 512]
    - [296, 20.19]
  - - [960, 1344, 1, 512]
    - [185, 23.38]
  - - [1216, 1344, 1, 512]
    - [185, 24.93]
  - - [1472, 1344, 1, 512]
    - [185, 25.96]
  - - [1728, 1344, 1, 512]
    - [185, 27.89]
  - - [1984, 1344, 1, 512]
    - [286, 28.36]
  - - [64, 1472, 1, 512]
    - [278, 3.81]
  - - [192, 1472, 1, 512]
    - [249, 9.62]
  - - [320, 1472, 1, 512]
    - [249, 14.21]
  - - [448, 1472, 1, 512]
    - [319, 16.64]
  - - [576, 1472, 1, 512]
    - [286, 19.09]
  - - [704, 1472, 1, 512]
    - [225, 20.76]
  - - [832, 1472, 1, 512]
    - [319, 22.42]
  - - [960, 1472, 1, 512]
    - [286, 23.68]
  - - [1088, 1472, 1, 512]
    - [293, 24.18]
  - - [1216, 1472, 1, 512]
    - [185, 25.49]
  - - [1344, 1472, 1, 512]
    - [286, 26.19]
  - - [1472, 1472, 1, 512]
    - [309, 27.15]
  - - [1600, 1472, 1, 512]
    - [185, 27.91]
  - - [1728, 1472, 1, 512]
    - [185, 28.76]
  - - [1856, 1472, 1, 512]
    - [286, 30.03]
  - - [1984, 1472, 1, 512]
    - [185, 29.46]
  - - [192, 1600, 1, 512]
    - [249, 10.12]
  - - [448, 1600, 1, 512]
    - [309, 17.14]
  - - [704, 1600, 1, 512]
    - [284, 21.27]
  - - [960, 1600, 1, 512]
    - [286, 24.16]
  - - [1216, 1600, 1, 512]
    - [286, 26.41]
  - - [1472, 1600, 1, 512]
    - [185, 28.11]
  - - [1728, 1600, 1, 512]
    - [185, 28.92]
  - - [1984, 1600, 1, 512]
    - [286, 30.46]
  - - [64, 1728, 1, 512]
    - [275, 4.51]
  - - [192, 1728, 1, 512]
    - [225, 11.16]
  - - [320, 1728, 1, 512]
    - [290, 15.06]
  - - [448, 1728, 1, 512]
    - [287, 18.66]
  - - [576, 1728, 1, 512]
    - [286, 20.57]
  - - [704, 1728, 1, 512]
    - [286, 21.87]
  - - [832, 1728, 1, 512]
    - [286, 23.89]
  - - [960, 1728, 1, 512]
    - [286, 25.12]
  - - [1088, 1728, 1, 512]
    - [293, 25.73]
  - - [1216, 1728, 1, 512]
    - [185, 26.84]
  - - [1344, 1728, 1, 512]
    - [286, 28.03]
  - - [1472, 1728, 1, 512]
    - [286, 28.97]
  - - [1600, 1728, 1, 512]
    - [286, 28.86]
  - - [1728, 1728, 1, 512]
    - [286, 30.1]
  - - [1856, 1728, 1, 512]
    - [185, 29.99]
  - - [1984, 1728, 1, 512]
    - [282, 30.38]
  - - [192, 1856, 1, 512]
    - [225, 11.88]
  - - [448, 1856, 1, 512]
    - [251, 18.63]
  - - [704, 1856, 1, 512]
    - [286, 23.48]
  - - [960, 1856, 1, 512]
    - [286, 25.91]
  - - [1216, 1856, 1, 512]
    - [286, 27.13]
  - - [1472, 1856, 1, 512]
    - [286, 29.31]
  - - [1728, 1856, 1, 512]
    - [286, 30.07]
  - - [1984, 1856, 1, 512]
    - [202, 30.69]
  - - [64, 1984, 1, 512]
    - [279, 5.11]
  - - [192, 1984, 1, 512]
    - [279, 12.75]
  - - [320, 1984, 1, 512]
    - [279, 16.6]
  - - [448, 1984, 1, 512]
    - [284, 19.26]
  - - [576, 1984, 1, 512]
    - [284, 21.48]
  - - [704, 1984, 1, 512]
    - [286, 23.15]
  - - [832, 1984, 1, 512]
    - [286, 24.42]
  - - [960, 1984, 1, 512]
    - [286, 26.4]
  - - [1088, 1984, 1, 512]
    - [185, 26.9]
  - - [1216, 1984, 1, 512]
    - [286, 27.84]
  - - [1344, 1984, 1, 512]
    - [185, 28.98]
  - - [1472, 1984, 1, 512]
    - [286, 29.57]
  - - [1600, 1984, 1, 512]
    - [286, 29.77]
  - - [1728, 1984, 1, 512]
    - [286, 30.48]
  - - [1856, 1984, 1, 512]
    - [286, 30.93]
  - - [1984, 1984, 1, 512]
    - [293, 31.42]
  - - [192, 64, 1, 1024]
    - [299, 1.02]
  - - [448, 64, 1, 1024]
    - [278, 2.35]
  - - [704, 64, 1, 1024]
    - [268, 3.5]
  - - [960, 64, 1, 1024]
    - [268, 4.7]
  - - [1216, 64, 1, 1024]
    - [301, 5.6]
  - - [1472, 64, 1, 1024]
    - [301, 6.57]
  - - [1728, 64, 1, 1024]
    - [225, 7.55]
  - - [1984, 64, 1, 1024]
    - [225, 8.54]
  - - [64, 192, 1, 1024]
    - [288, 1.03]
  - - [192, 192, 1, 1024]
    - [260, 2.81]
  - - [320, 192, 1, 1024]
    - [249, 4.36]
  - - [448, 192, 1, 1024]
    - [157, 6.0]
  - - [576, 192, 1, 1024]
    - [157, 7.63]
  - - [704, 192, 1, 1024]
    - [176, 8.35]
  - - [832, 192, 1, 1024]
    - [276, 9.67]
  - - [960, 192, 1, 1024]
    - [157, 11.18]
  - - [1088, 192, 1, 1024]
    - [249, 12.64]
  - - [1216, 192, 1, 1024]
    - [176, 13.9]
  - - [1344, 192, 1, 1024]
    - [157, 15.77]
  - - [1472, 192, 1, 1024]
    - [176, 14.69]
  - - [1600, 192, 1, 1024]
    - [157, 15.74]
  - - [1728, 192, 1, 1024]
    - [157, 17.01]
  - - [1856, 192, 1, 1024]
    - [182, 18.68]
  - - [1984, 192, 1, 1024]
    - [279, 19.84]
  - - [192, 320, 1, 1024]
    - [267, 4.25]
  - - [448, 320, 1, 1024]
    - [249, 9.23]
  - - [704, 320, 1, 1024]
    - [182, 13.91]
  - - [960, 320, 1, 1024]
    - [157, 16.27]
  - - [1216, 320, 1, 1024]
    - [279, 20.21]
  - - [1472, 320, 1, 1024]
    - [182, 21.15]
  - - [1728, 320, 1, 1024]
    - [279, 22.14]
  - - [1984, 320, 1, 1024]
    - [225, 24.1]
  - - [64, 448, 1, 1024]
    - [278, 2.2]
  - - [192, 448, 1, 1024]
    - [275, 5.71]
  - - [320, 448, 1, 1024]
    - [157, 8.8]
  - - [448, 448, 1, 1024]
    - [249, 12.09]
  - - [576, 448, 1, 1024]
    - [225, 15.2]
  - - [704, 448, 1, 1024]
    - [150, 16.15]
  - - [832, 448, 1, 1024]
    - [176, 19.42]
  - - [960, 448, 1, 1024]
    - [290, 19.66]
  - - [1088, 448, 1, 1024]
    - [176, 21.71]
  - - [1216, 448, 1, 1024]
    - [290, 21.73]
  - - [1344, 448, 1, 1024]
    - [157, 23.71]
  - - [1472, 448, 1, 1024]
    - [309, 23.5]
  - - [1600, 448, 1, 1024]
    - [286, 24.69]
  - - [1728, 448, 1, 1024]
    - [202, 26.36]
  - - [1856, 448, 1, 1024]
    - [176, 26.0]
  - - [1984, 448, 1, 1024]
    - [286, 27.48]
  - - [192, 576, 1, 1024]
    - [157, 7.67]
  - - [448, 576, 1, 1024]
    - [225, 15.76]
  - - [704, 576, 1, 1024]
    - [182, 18.03]
  - - [960, 576, 1, 1024]
    - [290, 22.32]
  - - [1216, 576, 1, 1024]
    - [290, 25.81]
  - - [1472, 576, 1, 1024]
    - [251, 27.2]
  - - [1728, 576, 1, 1024]
    - [225, 28.38]
  - - [1984, 576, 1, 1024]
    - [182, 30.17]
  - - [64, 704, 1, 1024]
    - [288, 3.5]
  - - [192, 704, 1, 1024]
    - [176, 8.66]
  - - [320, 704, 1, 1024]
    - [225, 13.91]
  - - [448, 704, 1, 1024]
    - [157, 16.81]
  - - [576, 704, 1, 1024]
    - [279, 18.47]
  - - [704, 704, 1, 1024]
    - [279, 22.32]
  - - [832, 704, 1, 1024]
    - [290, 23.67]
  - - [960, 704, 1, 1024]
    - [290, 24.85]
  - - [1088, 704, 1, 1024]
    - [251, 26.8]
  - - [1216, 704, 1, 1024]
    - [251, 27.16]
  - - [1344, 704, 1, 1024]
    - [182, 27.0]
  - - [1472, 704, 1, 1024]
    - [279, 29.78]
  - - [1600, 704, 1, 1024]
    - [279, 30.03]
  - - [1728, 704, 1, 1024]
    - [176, 29.95]
  - - [1856, 704, 1, 1024]
    - [185, 31.68]
  - - [1984, 704, 1, 1024]
    - [279, 31.72]
  - - [192, 832, 1, 1024]
    - [157, 10.06]
  - - [448, 832, 1, 1024]
    - [185, 19.2]
  - - [704, 832, 1, 1024]
    - [182, 23.21]
  - - [960, 832, 1, 1024]
    - [287, 25.79]
  - - [1216, 832, 1, 1024]
    - [225, 28.93]
  - - [1472, 832, 1, 1024]
    - [176, 30.14]
  - - [1728, 832, 1, 1024]
    - [286, 32.46]
  - - [1984, 832, 1, 1024]
    - [286, 33.07]
  - - [64, 960, 1, 1024]
    - [265, 4.45]
  - - [192, 960, 1, 1024]
    - [249, 11.13]
  - - [320, 960, 1, 1024]
    - [286, 16.16]
  - - [448, 960, 1, 1024]
    - [284, 19.42]
  - - [576, 960, 1, 1024]
    - [290, 22.7]
  - - [704, 960, 1, 1024]
    - [309, 23.66]
  - - [832, 960, 1, 1024]
    - [251, 25.93]
  - - [960, 960, 1, 1024]
    - [320, 27.67]
  - - [1088, 960, 1, 1024]
    - [286, 29.71]
  - - [1216, 960, 1, 1024]
    - [279, 30.5]
  - - [1344, 960, 1, 1024]
    - [279, 31.53]
  - - [1472, 960, 1, 1024]
    - [279, 31.76]
  - - [1600, 960, 1, 1024]
    - [279, 32.7]
  - - [1728, 960, 1, 1024]
    - [286, 33.26]
  - - [1856, 960, 1, 1024]
    - [284, 33.55]
  - - [1984, 960, 1, 1024]
    - [202, 33.73]
  - - [192, 1088, 1, 1024]
    - [185, 12.44]
  - - [448, 1088, 1, 1024]
    - [225, 21.31]
  - - [704, 1088, 1, 1024]
    - [289, 26.98]
  - - [960, 1088, 1, 1024]
    - [279, 29.83]
  - - [1216, 1088, 1, 1024]
    - [286, 29.56]
  - - [1472, 1088, 1, 1024]
    - [286, 30.57]
  - - [1728, 1088, 1, 1024]
    - [225, 32.74]
  - - [1984, 1088, 1, 1024]
    - [286, 35.0]
  - - [64, 1216, 1, 1024]
    - [260, 5.46]
  - - [192, 1216, 1, 1024]
    - [182, 14.36]
  - - [320, 1216, 1, 1024]
    - [279, 19.73]
  - - [448, 1216, 1, 1024]
    - [290, 23.09]
  - - [576, 1216, 1, 1024]
    - [320, 25.51]
  - - [704, 1216, 1, 1024]
    - [309, 26.96]
  - - [832, 1216, 1, 1024]
    - [279, 28.8]
  - - [960, 1216, 1, 1024]
    - [309, 31.05]
  - - [1088, 1216, 1, 1024]
    - [349, 31.31]
  - - [1216, 1216, 1, 1024]
    - [349, 33.41]
  - - [1344, 1216, 1, 1024]
    - [296, 33.6]
  - - [1472, 1216, 1, 1024]
    - [286, 34.53]
  - - [1600, 1216, 1, 1024]
    - [320, 35.55]
  - - [1728, 1216, 1, 1024]
    - [319, 35.1]
  - - [1856, 1216, 1, 1024]
    - [286, 35.4]
  - - [1984, 1216, 1, 1024]
    - [320, 36.2]
  - - [192, 1344, 1, 1024]
    - [182, 15.82]
  - - [448, 1344, 1, 1024]
    - [289, 24.26]
  - - [704, 1344, 1, 1024]
    - [182, 27.61]
  - - [960, 1344, 1, 1024]
    - [279, 31.92]
  - - [1216, 1344, 1, 1024]
    - [293, 32.61]
  - - [1472, 1344, 1, 1024]
    - [286, 34.11]
  - - [1728, 1344, 1, 1024]
    - [284, 35.82]
  - - [1984, 1344, 1, 1024]
    - [279, 36.39]
  - - [64, 1472, 1, 1024]
    - [182, 6.37]
  - - [192, 1472, 1, 1024]
    - [182, 15.12]
  - - [320, 1472, 1, 1024]
    - [320, 21.28]
  - - [448, 1472, 1, 1024]
    - [320, 23.85]
  - - [576, 1472, 1, 1024]
    - [279, 26.92]
  - - [704, 1472, 1, 1024]
    - [225, 29.86]
  - - [832, 1472, 1, 1024]
    - [309, 30.54]
  - - [960, 1472, 1, 1024]
    - [284, 31.96]
  - - [1088, 1472, 1, 1024]
    - [286, 32.7]
  - - [1216, 1472, 1, 1024]
    - [286, 34.13]
  - - [1344, 1472, 1, 1024]
    - [284, 34.06]
  - - [1472, 1472, 1, 1024]
    - [279, 35.15]
  - - [1600, 1472, 1, 1024]
    - [286, 36.54]
  - - [1728, 1472, 1, 1024]
    - [279, 36.08]
  - - [1856, 1472, 1, 1024]
    - [286, 37.24]
  - - [1984, 1472, 1, 1024]
    - [286, 36.72]
  - - [192, 1600, 1, 1024]
    - [176, 16.2]
  - - [448, 1600, 1, 1024]
    - [287, 24.65]
  - - [704, 1600, 1, 1024]
    - [279, 29.82]
  - - [960, 1600, 1, 1024]
    - [286, 32.6]
  - - [1216, 1600, 1, 1024]
    - [286, 34.82]
  - - [1472, 1600, 1, 1024]
    - [286, 36.19]
  - - [1728, 1600, 1, 1024]
    - [286, 36.63]
  - - [1984, 1600, 1, 1024]
    - [293, 37.68]
  - - [64, 1728, 1, 1024]
    - [157, 7.61]
  - - [192, 1728, 1, 1024]
    - [279, 17.6]
  - - [320, 1728, 1, 1024]
    - [290, 22.22]
  - - [448, 1728, 1, 1024]
    - [284, 26.53]
  - - [576, 1728, 1, 1024]
    - [279, 28.91]
  - - [704, 1728, 1, 1024]
    - [185, 29.65]
  - - [832, 1728, 1, 1024]
    - [286, 32.74]
  - - [960, 1728, 1, 1024]
    - [185, 33.34]
  - - [1088, 1728, 1, 1024]
    - [185, 34.07]
  - - [1216, 1728, 1, 1024]
    - [279, 34.47]
  - - [1344, 1728, 1, 1024]
    - [202, 35.8]
  - - [1472, 1728, 1, 1024]
    - [286, 36.24]
  - - [1600, 1728, 1, 1024]
    - [293, 36.67]
  - - [1728, 1728, 1, 1024]
    - [279, 37.13]
  - - [1856, 1728, 1, 1024]
    - [293, 37.72]
  - - [1984, 1728, 1, 1024]
    - [330, 38.66]
  - - [192, 1856, 1, 1024]
    - [182, 18.53]
  - - [448, 1856, 1, 1024]
    - [279, 25.9]
  - - [704, 1856, 1, 1024]
    - [279, 31.81]
  - - [960, 1856, 1, 1024]
    - [284, 33.74]
  - - [1216, 1856, 1, 1024]
    - [286, 35.28]
  - - [1472, 1856, 1, 1024]
    - [293, 37.13]
  - - [1728, 1856, 1, 1024]
    - [293, 37.71]
  - - [1984, 1856, 1, 1024]
    - [286, 38.24]
  - - [64, 1984, 1, 1024]
    - [157, 8.38]
  - - [192, 1984, 1, 1024]
    - [185, 18.84]
  - - [320, 1984, 1, 1024]
    - [279, 24.48]
  - - [448, 1984, 1, 1024]
    - [286, 28.12]
  - - [576, 1984, 1, 1024]
    - [284, 29.81]
  - - [704, 1984, 1, 1024]
    - [225, 31.87]
  - - [832, 1984, 1, 1024]
    - [279, 33.1]
  - - [960, 1984, 1, 1024]
    - [286, 34.06]
  - - [1088, 1984, 1, 1024]
    - [185, 35.33]
  - - [1216, 1984, 1, 1024]
    - [286, 35.67]
  - - [1344, 1984, 1, 1024]
    - [286, 36.65]
  - - [1472, 1984, 1, 1024]
    - [279, 37.09]
  - - [1600, 1984, 1, 1024]
    - [279, 37.93]
  - - [1728, 1984, 1, 1024]
    - [286, 38.19]
  - - [1856, 1984, 1, 1024]
    - [286, 38.67]
  - - [1984, 1984, 1, 1024]
    - [330, 39.63]
  - - [192, 64, 1, 2048]
    - [278, 1.71]
  - - [448, 64, 1, 2048]
    - [268, 3.89]
  - - [704, 64, 1, 2048]
    - [268, 5.52]
  - - [960, 64, 1, 2048]
    - [267, 7.28]
  - - [1216, 64, 1, 2048]
    - [301, 8.41]
  - - [1472, 64, 1, 2048]
    - [225, 10.1]
  - - [1728, 64, 1, 2048]
    - [328, 11.78]
  - - [1984, 64, 1, 2048]
    - [157, 12.84]
  - - [64, 192, 1, 2048]
    - [326, 1.7]
  - - [192, 192, 1, 2048]
    - [327, 4.5]
  - - [320, 192, 1, 2048]
    - [157, 6.73]
  - - [448, 192, 1, 2048]
    - [225, 9.23]
  - - [576, 192, 1, 2048]
    - [157, 11.83]
  - - [704, 192, 1, 2048]
    - [313, 12.8]
  - - [832, 192, 1, 2048]
    - [157, 14.59]
  - - [960, 192, 1, 2048]
    - [325, 17.07]
  - - [1088, 192, 1, 2048]
    - [176, 19.27]
  - - [1216, 192, 1, 2048]
    - [176, 21.28]
  - - [1344, 192, 1, 2048]
    - [279, 23.08]
  - - [1472, 192, 1, 2048]
    - [313, 20.72]
  - - [1600, 192, 1, 2048]
    - [225, 22.81]
  - - [1728, 192, 1, 2048]
    - [225, 24.14]
  - - [1856, 192, 1, 2048]
    - [182, 26.04]
  - - [1984, 192, 1, 2048]
    - [279, 27.06]
  - - [192, 320, 1, 2048]
    - [264, 6.72]
  - - [448, 320, 1, 2048]
    - [176, 13.41]
  - - [704, 320, 1, 2048]
    - [249, 19.93]
  - - [960, 320, 1, 2048]
    - [176, 22.81]
  - - [1216, 320, 1, 2048]
    - [313, 28.08]
  - - [1472, 320, 1, 2048]
    - [182, 27.76]
  - - [1728, 320, 1, 2048]
    - [225, 28.38]
  - - [1984, 320, 1, 2048]
    - [182, 32.32]
  - - [64, 448, 1, 2048]
    - [310, 3.67]
  - - [192, 448, 1, 2048]
    - [157, 8.94]
  - - [320, 448, 1, 2048]
    - [315, 13.11]
  - - [448, 448, 1, 2048]
    - [157, 18.14]
  - - [576, 448, 1, 2048]
    - [182, 22.58]
  - - [704, 448, 1, 2048]
    - [182, 23.01]
  - - [832, 448, 1, 2048]
    - [279, 27.49]
  - - [960, 448, 1, 2048]
    - [279, 26.43]
  - - [1088, 448, 1, 2048]
    - [225, 29.57]
  - - [1216, 448, 1, 2048]
    - [290, 29.08]
  - - [1344, 448, 1, 2048]
    - [249, 30.89]
  - - [1472, 448, 1, 2048]
    - [319, 30.47]
  - - [1600, 448, 1, 2048]
    - [329, 31.18]
  - - [1728, 448, 1, 2048]
    - [286, 33.08]
  - - [1856, 448, 1, 2048]
    - [286, 32.44]
  - - [1984, 448, 1, 2048]
    - [157, 34.4]
  - - [192, 576, 1, 2048]
    - [157, 11.57]
  - - [448, 576, 1, 2048]
    - [225, 23.48]
  - - [704, 576, 1, 2048]
    - [182, 24.87]
  - - [960, 576, 1, 2048]
    - [290, 28.53]
  - - [1216, 576, 1, 2048]
    - [290, 32.57]
  - - [1472, 576, 1, 2048]
    - [287, 34.39]
  - - [1728, 576, 1, 2048]
    - [292, 35.63]
  - - [1984, 576, 1, 2048]
    - [225, 37.12]
  - - [64, 704, 1, 2048]
    - [288, 5.57]
  - - [192, 704, 1, 2048]
    - [249, 12.84]
  - - [320, 704, 1, 2048]
    - [225, 20.64]
  - - [448, 704, 1, 2048]
    - [328, 23.29]
  - - [576, 704, 1, 2048]
    - [290, 25.16]
  - - [704, 704, 1, 2048]
    - [225, 30.05]
  - - [832, 704, 1, 2048]
    - [290, 31.02]
  - - [960, 704, 1, 2048]
    - [290, 31.76]
  - - [1088, 704, 1, 2048]
    - [290, 34.91]
  - - [1216, 704, 1, 2048]
    - [251, 35.46]
  - - [1344, 704, 1, 2048]
    - [287, 34.79]
  - - [1472, 704, 1, 2048]
    - [225, 36.99]
  - - [1600, 704, 1, 2048]
    - [279, 36.68]
  - - [1728, 704, 1, 2048]
    - [225, 36.47]
  - - [1856, 704, 1, 2048]
    - [225, 38.8]
  - - [1984, 704, 1, 2048]
    - [286, 38.49]
  - - [192, 832, 1, 2048]
    - [313, 14.57]
  - - [448, 832, 1, 2048]
    - [279, 27.56]
  - - [704, 832, 1, 2048]
    - [290, 30.02]
  - - [960, 832, 1, 2048]
    - [251, 32.54]
  - - [1216, 832, 1, 2048]
    - [182, 35.97]
  - - [1472, 832, 1, 2048]
    - [225, 36.59]
  - - [1728, 832, 1, 2048]
    - [225, 39.36]
  - - [1984, 832, 1, 2048]
    - [286, 39.65]
  - - [64, 960, 1, 2048]
    - [278, 7.07]
  - - [192, 960, 1, 2048]
    - [279, 16.56]
  - - [320, 960, 1, 2048]
    - [279, 23.0]
  - - [448, 960, 1, 2048]
    - [290, 26.63]
  - - [576, 960, 1, 2048]
    - [289, 31.07]
  - - [704, 960, 1, 2048]
    - [287, 31.14]
  - - [832, 960, 1, 2048]
    - [251, 32.97]
  - - [960, 960, 1, 2048]
    - [330, 33.93]
  - - [1088, 960, 1, 2048]
    - [279, 37.87]
  - - [1216, 960, 1, 2048]
    - [225, 38.18]
  - - [1344, 960, 1, 2048]
    - [225, 39.01]
  - - [1472, 960, 1, 2048]
    - [225, 38.51]
  - - [1600, 960, 1, 2048]
    - [225, 39.75]
  - - [1728, 960, 1, 2048]
    - [279, 39.75]
  - - [1856, 960, 1, 2048]
    - [286, 40.18]
  - - [1984, 960, 1, 2048]
    - [225, 40.58]
  - - [192, 1088, 1, 2048]
    - [279, 18.85]
  - - [448, 1088, 1, 2048]
    - [290, 29.37]
  - - [704, 1088, 1, 2048]
    - [251, 34.6]
  - - [960, 1088, 1, 2048]
    - [287, 37.51]
  - - [1216, 1088, 1, 2048]
    - [182, 36.96]
  - - [1472, 1088, 1, 2048]
    - [279, 38.56]
  - - [1728, 1088, 1, 2048]
    - [225, 39.95]
  - - [1984, 1088, 1, 2048]
    - [279, 40.94]
  - - [64, 1216, 1, 2048]
    - [353, 8.4]
  - - [192, 1216, 1, 2048]
    - [225, 21.44]
  - - [320, 1216, 1, 2048]
    - [157, 28.2]
  - - [448, 1216, 1, 2048]
    - [290, 30.77]
  - - [576, 1216, 1, 2048]
    - [319, 33.94]
  - - [704, 1216, 1, 2048]
    - [251, 34.23]
  - - [832, 1216, 1, 2048]
    - [279, 36.7]
  - - [960, 1216, 1, 2048]
    - [279, 37.94]
  - - [1088, 1216, 1, 2048]
    - [349, 37.15]
  - - [1216, 1216, 1, 2048]
    - [349, 40.15]
  - - [1344, 1216, 1, 2048]
    - [279, 39.72]
  - - [1472, 1216, 1, 2048]
    - [225, 40.68]
  - - [1600, 1216, 1, 2048]
    - [320, 42.06]
  - - [1728, 1216, 1, 2048]
    - [309, 41.52]
  - - [1856, 1216, 1, 2048]
    - [284, 41.02]
  - - [1984, 1216, 1, 2048]
    - [319, 42.83]
  - - [192, 1344, 1, 2048]
    - [157, 23.14]
  - - [448, 1344, 1, 2048]
    - [290, 32.34]
  - - [704, 1344, 1, 2048]
    - [320, 35.26]
  - - [960, 1344, 1, 2048]
    - [279, 38.85]
  - - [1216, 1344, 1, 2048]
    - [279, 39.47]
  - - [1472, 1344, 1, 2048]
    - [279, 39.99]
  - - [1728, 1344, 1, 2048]
    - [279, 41.86]
  - - [1984, 1344, 1, 2048]
    - [225, 42.4]
  - - [64, 1472, 1, 2048]
    - [157, 10.1]
  - - [192, 1472, 1, 2048]
    - [279, 21.12]
  - - [320, 1472, 1, 2048]
    - [182, 28.56]
  - - [448, 1472, 1, 2048]
    - [289, 31.4]
  - - [576, 1472, 1, 2048]
    - [182, 34.56]
  - - [704, 1472, 1, 2048]
    - [225, 37.4]
  - - [832, 1472, 1, 2048]
    - [309, 37.01]
  - - [960, 1472, 1, 2048]
    - [185, 38.27]
  - - [1088, 1472, 1, 2048]
    - [286, 38.86]
  - - [1216, 1472, 1, 2048]
    - [279, 40.52]
  - - [1344, 1472, 1, 2048]
    - [225, 40.33]
  - - [1472, 1472, 1, 2048]
    - [279, 41.2]
  - - [1600, 1472, 1, 2048]
    - [279, 42.08]
  - - [1728, 1472, 1, 2048]
    - [279, 42.18]
  - - [1856, 1472, 1, 2048]
    - [182, 42.72]
  - - [1984, 1472, 1, 2048]
    - [286, 42.93]
  - - [192, 1600, 1, 2048]
    - [279, 22.3]
  - - [448, 1600, 1, 2048]
    - [287, 32.41]
  - - [704, 1600, 1, 2048]
    - [279, 37.0]
  - - [960, 1600, 1, 2048]
    - [279, 39.36]
  - - [1216, 1600, 1, 2048]
    - [182, 41.78]
  - - [1472, 1600, 1, 2048]
    - [286, 42.26]
  - - [1728, 1600, 1, 2048]
    - [279, 42.47]
  - - [1984, 1600, 1, 2048]
    - [225, 43.26]
  - - [64, 1728, 1, 2048]
    - [157, 11.9]
  - - [192, 1728, 1, 2048]
    - [279, 24.8]
  - - [320, 1728, 1, 2048]
    - [290, 28.37]
  - - [448, 1728, 1, 2048]
    - [157, 34.12]
  - - [576, 1728, 1, 2048]
    - [225, 35.89]
  - - [704, 1728, 1, 2048]
    - [225, 36.56]
  - - [832, 1728, 1, 2048]
    - [279, 39.79]
  - - [960, 1728, 1, 2048]
    - [279, 40.12]
  - - [1088, 1728, 1, 2048]
    - [279, 40.62]
  - - [1216, 1728, 1, 2048]
    - [279, 40.55]
  - - [1344, 1728, 1, 2048]
    - [292, 42.08]
  - - [1472, 1728, 1, 2048]
    - [279, 42.05]
  - - [1600, 1728, 1, 2048]
    - [225, 42.72]
  - - [1728, 1728, 1, 2048]
    - [279, 43.74]
  - - [1856, 1728, 1, 2048]
    - [279, 43.59]
  - - [1984, 1728, 1, 2048]
    - [306, 43.2]
  - - [192, 1856, 1, 2048]
    - [279, 25.97]
  - - [448, 1856, 1, 2048]
    - [182, 33.21]
  - - [704, 1856, 1, 2048]
    - [182, 38.98]
  - - [960, 1856, 1, 2048]
    - [225, 40.22]
  - - [1216, 1856, 1, 2048]
    - [279, 41.89]
  - - [1472, 1856, 1, 2048]
    - [225, 42.79]
  - - [1728, 1856, 1, 2048]
    - [225, 43.23]
  - - [1984, 1856, 1, 2048]
    - [225, 43.51]
  - - [64, 1984, 1, 2048]
    - [182, 12.94]
  - - [192, 1984, 1, 2048]
    - [279, 27.5]
  - - [320, 1984, 1, 2048]
    - [279, 32.77]
  - - [448, 1984, 1, 2048]
    - [225, 34.98]
  - - [576, 1984, 1, 2048]
    - [279, 37.01]
  - - [704, 1984, 1, 2048]
    - [225, 38.78]
  - - [832, 1984, 1, 2048]
    - [225, 40.1]
  - - [960, 1984, 1, 2048]
    - [279, 41.03]
  - - [1088, 1984, 1, 2048]
    - [279, 41.74]
  - - [1216, 1984, 1, 2048]
    - [279, 42.23]
  - - [1344, 1984, 1, 2048]
    - [182, 41.93]
  - - [1472, 1984, 1, 2048]
    - [225, 42.73]
  - - [1600, 1984, 1, 2048]
    - [225, 42.98]
  - - [1728, 1984, 1, 2048]
    - [306, 43.93]
  - - [1856, 1984, 1, 2048]
    - [225, 43.43]
  - - [1984, 1984, 1, 2048]
    - [306, 44.79]
  - - [192, 64, 1, 4096]
    - [268, 2.54]
  - - [448, 64, 1, 4096]
    - [278, 5.82]
  - - [704, 64, 1, 4096]
    - [310, 8.43]
  - - [960, 64, 1, 4096]
    - [268, 11.22]
  - - [1216, 64, 1, 4096]
    - [327, 11.88]
  - - [1472, 64, 1, 4096]
    - [301, 13.81]
  - - [1728, 64, 1, 4096]
    - [157, 15.34]
  - - [1984, 64, 1, 4096]
    - [225, 17.44]
  - - [64, 192, 1, 4096]
    - [299, 2.5]
  - - [192, 192, 1, 4096]
    - [260, 6.38]
  - - [320, 192, 1, 4096]
    - [328, 9.1]
  - - [448, 192, 1, 4096]
    - [225, 12.68]
  - - [576, 192, 1, 4096]
    - [225, 16.64]
  - - [704, 192, 1, 4096]
    - [157, 17.01]
  - - [832, 192, 1, 4096]
    - [249, 19.51]
  - - [960, 192, 1, 4096]
    - [157, 22.52]
  - - [1088, 192, 1, 4096]
    - [157, 25.18]
  - - [1216, 192, 1, 4096]
    - [176, 28.12]
  - - [1344, 192, 1, 4096]
    - [225, 31.0]
  - - [1472, 192, 1, 4096]
    - [157, 26.1]
  - - [1600, 192, 1, 4096]
    - [279, 28.39]
  - - [1728, 192, 1, 4096]
    - [292, 30.75]
  - - [1856, 192, 1, 4096]
    - [313, 33.24]
  - - [1984, 192, 1, 4096]
    - [279, 34.82]
  - - [192, 320, 1, 4096]
    - [273, 9.09]
  - - [448, 320, 1, 4096]
    - [157, 17.85]
  - - [704, 320, 1, 4096]
    - [225, 26.97]
  - - [960, 320, 1, 4096]
    - [279, 28.34]
  - - [1216, 320, 1, 4096]
    - [225, 35.64]
  - - [1472, 320, 1, 4096]
    - [225, 34.66]
  - - [1728, 320, 1, 4096]
    - [225, 34.28]
  - - [1984, 320, 1, 4096]
    - [225, 39.26]
  - - [64, 448, 1, 4096]
    - [327, 5.57]
  - - [192, 448, 1, 4096]
    - [328, 12.6]
  - - [320, 448, 1, 4096]
    - [157, 17.72]
  - - [448, 448, 1, 4096]
    - [157, 24.1]
  - - [576, 448, 1, 4096]
    - [225, 30.61]
  - - [704, 448, 1, 4096]
    - [225, 29.0]
  - - [832, 448, 1, 4096]
    - [225, 34.32]
  - - [960, 448, 1, 4096]
    - [320, 31.8]
  - - [1088, 448, 1, 4096]
    - [225, 35.63]
  - - [1216, 448, 1, 4096]
    - [238, 33.49]
  - - [1344, 448, 1, 4096]
    - [279, 36.84]
  - - [1472, 448, 1, 4096]
    - [320, 36.25]
  - - [1600, 448, 1, 4096]
    - [354, 36.91]
  - - [1728, 448, 1, 4096]
    - [284, 39.21]
  - - [1856, 448, 1, 4096]
    - [157, 38.01]
  - - [1984, 448, 1, 4096]
    - [176, 40.29]
  - - [192, 576, 1, 4096]
    - [332, 15.98]
  - - [448, 576, 1, 4096]
    - [157, 30.73]
  - - [704, 576, 1, 4096]
    - [279, 30.15]
  - - [960, 576, 1, 4096]
    - [279, 34.12]
  - - [1216, 576, 1, 4096]
    - [290, 39.08]
  - - [1472, 576, 1, 4096]
    - [290, 39.85]
  - - [1728, 576, 1, 4096]
    - [225, 41.35]
  - - [1984, 576, 1, 4096]
    - [225, 42.72]
  - - [64, 704, 1, 4096]
    - [302, 7.66]
  - - [192, 704, 1, 4096]
    - [315, 16.95]
  - - [320, 704, 1, 4096]
    - [225, 26.75]
  - - [448, 704, 1, 4096]
    - [182, 29.58]
  - - [576, 704, 1, 4096]
    - [328, 30.15]
  - - [704, 704, 1, 4096]
    - [225, 36.54]
  - - [832, 704, 1, 4096]
    - [225, 36.53]
  - - [960, 704, 1, 4096]
    - [290, 36.76]
  - - [1088, 704, 1, 4096]
    - [290, 41.32]
  - - [1216, 704, 1, 4096]
    - [287, 40.7]
  - - [1344, 704, 1, 4096]
    - [225, 39.96]
  - - [1472, 704, 1, 4096]
    - [292, 42.38]
  - - [1600, 704, 1, 4096]
    - [225, 42.14]
  - - [1728, 704, 1, 4096]
    - [279, 41.73]
  - - [1856, 704, 1, 4096]
    - [225, 44.11]
  - - [1984, 704, 1, 4096]
    - [225, 43.9]
  - - [192, 832, 1, 4096]
    - [225, 19.47]
  - - [448, 832, 1, 4096]
    - [225, 33.94]
  - - [704, 832, 1, 4096]
    - [225, 36.04]
  - - [960, 832, 1, 4096]
    - [251, 38.24]
  - - [1216, 832, 1, 4096]
    - [279, 41.84]
  - - [1472, 832, 1, 4096]
    - [279, 42.12]
  - - [1728, 832, 1, 4096]
    - [279, 44.06]
  - - [1984, 832, 1, 4096]
    - [292, 44.55]
  - - [64, 960, 1, 4096]
    - [278, 9.31]
  - - [192, 960, 1, 4096]
    - [157, 22.39]
  - - [320, 960, 1, 4096]
    - [325, 28.81]
  - - [448, 960, 1, 4096]
    - [225, 31.65]
  - - [576, 960, 1, 4096]
    - [290, 36.5]
  - - [704, 960, 1, 4096]
    - [289, 36.35]
  - - [832, 960, 1, 4096]
    - [251, 38.32]
  - - [960, 960, 1, 4096]
    - [330, 40.41]
  - - [1088, 960, 1, 4096]
    - [182, 42.35]
  - - [1216, 960, 1, 4096]
    - [225, 43.07]
  - - [1344, 960, 1, 4096]
    - [225, 43.57]
  - - [1472, 960, 1, 4096]
    - [355, 42.9]
  - - [1600, 960, 1, 4096]
    - [225, 44.18]
  - - [1728, 960, 1, 4096]
    - [292, 44.63]
  - - [1856, 960, 1, 4096]
    - [225, 44.59]
  - - [1984, 960, 1, 4096]
    - [279, 44.67]
  - - [192, 1088, 1, 4096]
    - [157, 25.23]
  - - [448, 1088, 1, 4096]
    - [225, 36.08]
  - - [704, 1088, 1, 4096]
    - [289, 40.87]
  - - [960, 1088, 1, 4096]
    - [279, 42.5]
  - - [1216, 1088, 1, 4096]
    - [279, 41.68]
  - - [1472, 1088, 1, 4096]
    - [225, 42.84]
  - - [1728, 1088, 1, 4096]
    - [286, 43.26]
  - - [1984, 1088, 1, 4096]
    - [225, 44.62]
  - - [64, 1216, 1, 4096]
    - [157, 11.44]
  - - [192, 1216, 1, 4096]
    - [225, 27.68]
  - - [320, 1216, 1, 4096]
    - [225, 36.34]
  - - [448, 1216, 1, 4096]
    - [290, 36.11]
  - - [576, 1216, 1, 4096]
    - [320, 39.68]
  - - [704, 1216, 1, 4096]
    - [225, 40.09]
  - - [832, 1216, 1, 4096]
    - [279, 42.09]
  - - [960, 1216, 1, 4096]
    - [309, 43.43]
  - - [1088, 1216, 1, 4096]
    - [349, 41.51]
  - - [1216, 1216, 1, 4096]
    - [349, 45.6]
  - - [1344, 1216, 1, 4096]
    - [279, 44.12]
  - - [1472, 1216, 1, 4096]
    - [279, 44.49]
  - - [1600, 1216, 1, 4096]
    - [309, 46.81]
  - - [1728, 1216, 1, 4096]
    - [319, 45.14]
  - - [1856, 1216, 1, 4096]
    - [279, 45.18]
  - - [1984, 1216, 1, 4096]
    - [309, 46.5]
  - - [192, 1344, 1, 4096]
    - [225, 30.89]
  - - [448, 1344, 1, 4096]
    - [290, 38.16]
  - - [704, 1344, 1, 4096]
    - [320, 40.47]
  - - [960, 1344, 1, 4096]
    - [279, 44.12]
  - - [1216, 1344, 1, 4096]
    - [225, 44.41]
  - - [1472, 1344, 1, 4096]
    - [225, 43.93]
  - - [1728, 1344, 1, 4096]
    - [279, 44.95]
  - - [1984, 1344, 1, 4096]
    - [279, 45.14]
  - - [64, 1472, 1, 4096]
    - [157, 13.53]
  - - [192, 1472, 1, 4096]
    - [225, 26.5]
  - - [320, 1472, 1, 4096]
    - [157, 34.34]
  - - [448, 1472, 1, 4096]
    - [289, 37.8]
  - - [576, 1472, 1, 4096]
    - [182, 39.5]
  - - [704, 1472, 1, 4096]
    - [225, 42.52]
  - - [832, 1472, 1, 4096]
    - [279, 41.83]
  - - [960, 1472, 1, 4096]
    - [176, 42.97]
  - - [1088, 1472, 1, 4096]
    - [182, 42.93]
  - - [1216, 1472, 1, 4096]
    - [284, 43.67]
  - - [1344, 1472, 1, 4096]
    - [356, 43.77]
  - - [1472, 1472, 1, 4096]
    - [182, 44.39]
  - - [1600, 1472, 1, 4096]
    - [225, 45.8]
  - - [1728, 1472, 1, 4096]
    - [279, 45.65]
  - - [1856, 1472, 1, 4096]
    - [225, 45.54]
  - - [1984, 1472, 1, 4096]
    - [306, 46.42]
  - - [192, 1600, 1, 4096]
    - [225, 28.9]
  - - [448, 1600, 1, 4096]
    - [287, 37.84]
  - - [704, 1600, 1, 4096]
    - [225, 42.0]
  - - [960, 1600, 1, 4096]
    - [225, 44.69]
  - - [1216, 1600, 1, 4096]
    - [279, 45.18]
  - - [1472, 1600, 1, 4096]
    - [284, 45.1]
  - - [1728, 1600, 1, 4096]
    - [279, 44.84]
  - - [1984, 1600, 1, 4096]
    - [182, 45.35]
  - - [64, 1728, 1, 4096]
    - [157, 16.31]
  - - [192, 1728, 1, 4096]
    - [279, 30.87]
  - - [320, 1728, 1, 4096]
    - [279, 34.17]
  - - [448, 1728, 1, 4096]
    - [225, 40.06]
  - - [576, 1728, 1, 4096]
    - [225, 41.55]
  - - [704, 1728, 1, 4096]
    - [182, 41.76]
  - - [832, 1728, 1, 4096]
    - [292, 44.1]
  - - [960, 1728, 1, 4096]
    - [279, 44.21]
  - - [1088, 1728, 1, 4096]
    - [292, 43.8]
  - - [1216, 1728, 1, 4096]
    - [279, 44.38]
  - - [1344, 1728, 1, 4096]
    - [279, 45.28]
  - - [1472, 1728, 1, 4096]
    - [225, 45.58]
  - - [1600, 1728, 1, 4096]
    - [292, 45.08]
  - - [1728, 1728, 1, 4096]
    - [225, 45.94]
  - - [1856, 1728, 1, 4096]
    - [279, 44.99]
  - - [1984, 1728, 1, 4096]
    - [306, 46.55]
  - - [192, 1856, 1, 4096]
    - [313, 32.59]
  - - [448, 1856, 1, 4096]
    - [225, 39.48]
  - - [704, 1856, 1, 4096]
    - [225, 44.07]
  - - [960, 1856, 1, 4096]
    - [292, 44.68]
  - - [1216, 1856, 1, 4096]
    - [225, 44.87]
  - - [1472, 1856, 1, 4096]
    - [225, 46.1]
  - - [1728, 1856, 1, 4096]
    - [355, 44.96]
  - - [1984, 1856, 1, 4096]
    - [330, 45.28]
  - - [64, 1984, 1, 4096]
    - [157, 18.63]
  - - [192, 1984, 1, 4096]
    - [225, 34.97]
  - - [320, 1984, 1, 4096]
    - [225, 38.79]
  - - [448, 1984, 1, 4096]
    - [225, 40.87]
  - - [576, 1984, 1, 4096]
    - [225, 42.81]
  - - [704, 1984, 1, 4096]
    - [225, 42.87]
  - - [832, 1984, 1, 4096]
    - [182, 44.48]
  - - [960, 1984, 1, 4096]
    - [279, 44.99]
  - - [1088, 1984, 1, 4096]
    - [286, 44.41]
  - - [1216, 1984, 1, 4096]
    - [330, 44.96]
  - - [1344, 1984, 1, 4096]
    - [292, 45.37]
  - - [1472, 1984, 1, 4096]
    - [330, 45.63]
  - - [1600, 1984, 1, 4096]
    - [225, 46.15]
  - - [1728, 1984, 1, 4096]
    - [330, 46.64]
  - - [1856, 1984, 1, 4096]
    - [306, 45.18]
  - - [1984, 1984, 1, 4096]
    - [306, 48.54]
  - - [128, 64, 1, 64]
    - [115, 0.05]
  - - [256, 64, 1, 64]
    - [117, 0.1]
  - - [384, 64, 1, 64]
    - [119, 0.15]
  - - [512, 64, 1, 64]
    - [121, 0.2]
  - - [640, 64, 1, 64]
    - [123, 0.24]
  - - [768, 64, 1, 64]
    - [125, 0.29]
  - - [896, 64, 1, 64]
    - [126, 0.33]
  - - [1024, 64, 1, 64]
    - [127, 0.36]
  - - [64, 128, 1, 64]
    - [121, 0.05]
  - - [128, 128, 1, 64]
    - [128, 0.1]
  - - [192, 128, 1, 64]
    - [119, 0.15]
  - - [256, 128, 1, 64]
    - [129, 0.19]
  - - [320, 128, 1, 64]
    - [130, 0.24]
  - - [384, 128, 1, 64]
    - [122, 0.27]
  - - [448, 128, 1, 64]
    - [131, 0.33]
  - - [512, 128, 1, 64]
    - [132, 0.37]
  - - [576, 128, 1, 64]
    - [133, 0.41]
  - - [640, 128, 1, 64]
    - [134, 0.45]
  - - [704, 128, 1, 64]
    - [135, 0.5]
  - - [768, 128, 1, 64]
    - [136, 0.55]
  - - [832, 128, 1, 64]
    - [137, 0.59]
  - - [896, 128, 1, 64]
    - [138, 0.62]
  - - [960, 128, 1, 64]
    - [139, 0.68]
  - - [1024, 128, 1, 64]
    - [140, 0.72]
  - - [128, 192, 1, 64]
    - [141, 0.14]
  - - [256, 192, 1, 64]
    - [142, 0.29]
  - - [384, 192, 1, 64]
    - [144, 0.39]
  - - [512, 192, 1, 64]
    - [145, 0.54]
  - - [640, 192, 1, 64]
    - [147, 0.69]
  - - [768, 192, 1, 64]
    - [149, 0.79]
  - - [896, 192, 1, 64]
    - [149, 0.9]
  - - [1024, 192, 1, 64]
    - [152, 0.98]
  - - [64, 256, 1, 64]
    - [135, 0.1]
  - - [128, 256, 1, 64]
    - [153, 0.2]
  - - [192, 256, 1, 64]
    - [154, 0.28]
  - - [256, 256, 1, 64]
    - [155, 0.37]
  - - [320, 256, 1, 64]
    - [133, 0.45]
  - - [384, 256, 1, 64]
    - [156, 0.55]
  - - [448, 256, 1, 64]
    - [124, 0.58]
  - - [512, 256, 1, 64]
    - [157, 0.74]
  - - [576, 256, 1, 64]
    - [139, 0.77]
  - - [640, 256, 1, 64]
    - [158, 0.85]
  - - [704, 256, 1, 64]
    - [159, 0.9]
  - - [768, 256, 1, 64]
    - [147, 1.0]
  - - [832, 256, 1, 64]
    - [159, 1.07]
  - - [896, 256, 1, 64]
    - [138, 1.18]
  - - [960, 256, 1, 64]
    - [160, 1.27]
  - - [1024, 256, 1, 64]
    - [161, 1.36]
  - - [128, 320, 1, 64]
    - [162, 0.23]
  - - [256, 320, 1, 64]
    - [163, 0.45]
  - - [384, 320, 1, 64]
    - [155, 0.69]
  - - [512, 320, 1, 64]
    - [145, 0.84]
  - - [640, 320, 1, 64]
    - [147, 1.05]
  - - [768, 320, 1, 64]
    - [167, 1.27]
  - - [896, 320, 1, 64]
    - [169, 1.37]
  - - [1024, 320, 1, 64]
    - [171, 1.56]
  - - [64, 384, 1, 64]
    - [172, 0.14]
