projects/hipblaslt/library/src/amd_detail/rocblaslt/src/Tensile/Logic/asm_full/gfx1201/GridBased/gfx1201_Cijk_Alik_Bjlk_F8B8S_BH_Bias_SHB_HA_S_SAB_SCD_SAV_UserArgs.yaml
- {MinimumRequiredVersion: 5.0.0}
- gfx1201
- gfx1201
- [Device 73f0]
    SolutionIndex: 0
    SolutionNameMin: Cijk_Alik_Bjlk_F8B8S_BH_Bias_SHB_HA_S_SAB_SCD_SAV_UserArgs_MT32x32x64_MI16x16x1_CMS_SN_LDSB0_AFC1_AG0_AFEM1_AFEM1_ASEM1_CLR1_CADS0_DTLA0_DTLB0_DTVA0_DTVB0_DTVSM0_DPLBn1_EPS0_ELFLR0_EMLLn1_FDSI0_GRPM1_GRVWA8_GRVWB16_GSU1_GSUAMB_GSUC0_GSUWGMRR0_GLS0_ISA1201_IU1_LDSTI0_LBSPPA128_LBSPPB256_LBSPPM0_LPA8_LPB16_LPM0_LRVW8_LWPMn1_MIAV1_MIWT1_1_MO40_MGRIPMn1_NTn1_NTA0_NTB0_NTC0_NTD0_NTM0_NEPBS0_NLCA1_NLCB1_ONLL0_PGR1_PLR1_PKA0_SGROBn1_SIA3_SS1_SU32_SUM1_SUS256_SPO0_SRVW0_SSO0_SVW1_SK0_SKFTR0_SKXCCM0_SGRO0_TIN0_TLDS1_TLDSM1_ULSGRO0_USL1_UIOFGRO0_USFGROn1_VSn1_VWA1_VWB1_WSGRA0_WSGRB0_WS32_WG32_4_1_WGM8_WGMXCC1_WGMXCCG0
    SolutionIndex: 1
    SolutionNameMin: Cijk_Alik_Bjlk_F8B8S_BH_Bias_SHB_HA_S_SAB_SCD_SAV_UserArgs_MT64x16x64_MI16x16x1_CMS_SN_LDSB0_AFC1_AG0_AFEM1_AFEM1_ASEM1_CLR0_CADS0_DTLA0_DTLB0_DTVA0_DTVB0_DTVSM0_DPLBn1_EPS0_ELFLR0_EMLLn1_FDSI0_GRPM1_GRVWA8_GRVWB8_GSU1_GSUAMB_GSUC0_GSUWGMRR0_GLS0_ISA1201_IU1_LDSTI0_LBSPPA128_LBSPPB128_LBSPPM0_LPA8_LPB16_LPM0_LRVW8_LWPMn1_MIAV1_MIWT1_1_MO40_MGRIPMn1_NTn1_NTA0_NTB0_NTC0_NTD0_NTM0_NEPBS0_NLCA1_NLCB1_ONLL0_PGR2_PLR0_PKA0_SGROBn1_SIA3_SS1_SU32_SUM1_SUS256_SPO0_SRVW0_SSO0_SVW1_SK0_SKFTR0_SKXCCM0_SGRO0_TIN0_TLDS1_TLDSM1_ULSGRO0_USL1_UIOFGRO0_USFGROn1_VSn1_VWA1_VWB1_WSGRA0_WSGRB0_WS32_WG64_2_1_WGM8_WGMXCC1_WGMXCCG0
    SolutionIndex: 2
    SolutionNameMin: Cijk_Alik_Bjlk_F8B8S_BH_Bias_SHB_HA_S_SAB_SCD_SAV_UserArgs_MT16x64x32_MI16x16x1_CMS_SN_LDSB0_AFC1_AG0_AFEM1_AFEM1_ASEM1_CLR0_CADS0_DTLA0_DTLB0_DTVA0_DTVB0_DTVSM0_DPLBn1_EPS0_ELFLR0_EMLLn1_FDSI0_GRPM1_GRVWA4_GRVWB16_GSU1_GSUAMB_GSUC0_GSUWGMRR0_GLS0_ISA1201_IU1_LDSTI0_LBSPPA128_LBSPPB512_LBSPPM0_LPA8_LPB16_LPM0_LRVW8_LWPMn1_MIAV1_MIWT1_1_MO40_MGRIPMn1_NTn1_NTA0_NTB0_NTC0_NTD0_NTM0_NEPBS0_NLCA1_NLCB1_ONLL0_PGR1_PLR0_PKA0_SGROBn1_SIA3_SS1_SU32_SUM1_SUS256_SPO0_SRVW0_SSO0_SVW1_SK0_SKFTR0_SKXCCM0_SGRO0_TIN0_TLDS1_TLDSM1_ULSGRO0_USL1_UIOFGRO0_USFGROn1_VSn1_VWA1_VWB1_WSGRA0_WSGRB0_WS32_WG16_8_1_WGM8_WGMXCC1_WGMXCCG0
    SolutionIndex: 3
    SolutionNameMin: Cijk_Alik_Bjlk_F8B8S_BH_Bias_SHB_HA_S_SAB_SCD_SAV_UserArgs_MT64x16x32_MI16x16x1_CMS_SN_LDSB0_AFC1_AG0_AFEM1_AFEM1_ASEM1_CLR1_CADS0_DTLA0_DTLB0_DTVA0_DTVB0_DTVSM0_DPLBn1_EPS0_ELFLR0_EMLLn1_FDSI0_GRPM1_GRVWA1_GRVWB1_GSU1_GSUAMB_GSUC0_GSUWGMRR0_GLS0_ISA1201_IU1_K1_LDSTI0_LBSPPA512_LBSPPB128_LBSPPM0_LPA16_LPB16_LPM0_LRVW8_LWPMn1_MIAV1_MIWT1_1_MO40_MGRIPMn1_NTn1_NTA0_NTB0_NTC0_NTD0_NTM0_NEPBS0_NLCA1_NLCB1_ONLL0_PGR0_PLR0_PKA0_SGROBn1_SIA3_SS1_SU0_SUM0_SUS0_SPO0_SRVW0_SSO0_SVW1_SK0_SKFTR0_SKXCCM0_SGRO0_TIN0_TLDS0_TLDSM1_ULSGRO0_USL1_UIOFGRO0_USFGROn1_VSn1_VWA1_VWB1_WSGRA0_WSGRB0_WS32_WG64_2_1_WGM8_WGMXCC1_WGMXCCGn1
    SolutionIndex: 4
    SolutionNameMin: Cijk_Alik_Bjlk_F8B8S_BH_Bias_SHB_HA_S_SAB_SCD_SAV_UserArgs_MT16x32x64_MI16x16x1_SN_LDSB0_AFC1_AG0_AFEM1_AFEM1_ASEM1_CLR1_CADS0_DTLA0_DTLB0_DTVA0_DTVB1_DTVSM0_DPLBn1_EPS0_ELFLR0_EMLLn1_FDSI0_GRPM1_GRVWA8_GRVWB8_GSUn1_GSUAMB_GSUC0_GSUWGMRR0_GLS0_ISA1201_IU1_K1_LDSTI0_LBSPPA128_LBSPPB0_LBSPPM0_LPA8_LPB0_LPM0_LRVW8_LWPMn1_MIAV1_MIWT1_1_MO40_MGRIPMn1_NTn1_NTA0_NTB0_NTC0_NTD0_NTM0_NEPBS0_NLCA1_NLCB1_ONLL0_PGR2_PLR1_PKA0_SGROBn1_SIA3_SS0_SU32_SUM0_SUS256_SPO0_SRVW0_SSO0_SVW8_SK0_SKFTR0_SKXCCM0_SGRO0_TIN0_TLDS1_TLDSM1_ULSGRO0_USL1_UIOFGRO0_USFGROn1_VSn1_VWA1_VWB1_WSGRA0_WSGRB0_WS32_WG16_4_1_WGM8_WGMXCC1_WGMXCCGn1
    SolutionIndex: 5
    SolutionNameMin: Cijk_Alik_Bjlk_F8B8S_BH_Bias_SHB_HA_S_SAB_SCD_SAV_UserArgs_MT16x16x64_MI16x16x1_SN_LDSB0_AFC1_AG0_AFEM1_AFEM1_ASEM1_CLR1_CADS0_DTLA0_DTLB0_DTVA0_DTVB1_DTVSM0_DPLBn1_EPS0_ELFLR0_EMLLn1_FDSI0_GRPM1_GRVWA8_GRVWB8_GSUn1_GSUAMB_GSUC0_GSUWGMRR0_GLS0_ISA1201_IU1_K1_LDSTI0_LBSPPA128_LBSPPB0_LBSPPM0_LPA8_LPB0_LPM0_LRVW8_LWPMn1_MIAV1_MIWT1_1_MO40_MGRIPMn1_NTn1_NTA0_NTB0_NTC0_NTD0_NTM0_NEPBS0_NLCA1_NLCB1_ONLL0_PGR2_PLR1_PKA0_SGROBn1_SIA3_SS0_SU32_SUM0_SUS256_SPO0_SRVW0_SSO0_SVW8_SK0_SKFTR0_SKXCCM0_SGRO0_TIN0_TLDS1_TLDSM1_ULSGRO0_USL1_UIOFGRO0_USFGROn1_VSn1_VWA1_VWB1_WSGRA0_WSGRB0_WS32_WG16_2_1_WGM8_WGMXCC1_WGMXCCGn1
    SolutionIndex: 6
    SolutionNameMin: Cijk_Alik_Bjlk_F8B8S_BH_Bias_SHB_HA_S_SAB_SCD_SAV_UserArgs_MT32x16x64_MI16x16x1_SN_LDSB0_AFC1_AG0_AFEM1_AFEM1_ASEM1_CLR1_CADS0_DTLA0_DTLB0_DTVA0_DTVB1_DTVSM0_DPLBn1_EPS1_ELFLR0_EMLLn1_FDSI0_GRPM1_GRVWA8_GRVWB8_GSUn1_GSUAMB_GSUC0_GSUWGMRR0_GLS0_ISA1201_IU1_K1_LDSTI0_LBSPPA128_LBSPPB0_LBSPPM0_LPA8_LPB0_LPM0_LRVW8_LWPMn1_MIAV1_MIWT1_1_MO40_MGRIPMn1_NTn1_NTA0_NTB0_NTC0_NTD0_NTM0_NEPBS0_NLCA1_NLCB1_ONLL0_PGR1_PLR1_PKA0_SGROBn1_SIA3_SS1_SU32_SUM0_SUS256_SPO0_SRVW0_SSO0_SVW1_SK0_SKFTR0_SKXCCM0_SGRO0_TIN0_TLDS1_TLDSM1_ULSGRO0_USL1_UIOFGRO0_USFGROn1_VSn1_VWA1_VWB1_WSGRA0_WSGRB0_WS32_WG32_2_1_WGM8_WGMXCC1_WGMXCCGn1
    SolutionIndex: 7
    SolutionNameMin: Cijk_Alik_Bjlk_F8B8S_BH_Bias_SHB_HA_S_SAB_SCD_SAV_UserArgs_MT32x16x64_MI16x16x1_SN_LDSB0_AFC1_AG0_AFEM1_AFEM1_ASEM64_CLR1_CADS0_DTLA0_DTLB0_DTVA1_DTVB1_DTVSM0_DPLBn1_EPS0_ELFLR0_EMLLn1_FDSI0_GRPM1_GRVWA8_GRVWB8_GSUn1_GSUAMB_GSUC0_GSUWGMRR0_GLS0_ISA1201_IU1_K1_LDSTI0_LBSPPA0_LBSPPB0_LBSPPM0_LPA0_LPB0_LPM0_LRVW8_LWPMn1_MIAV1_MIWT1_1_MO40_MGRIPMn1_NTn1_NTA0_NTB0_NTC0_NTD0_NTM0_NEPBS0_NLCA4_NLCB1_ONLL0_PGR1_PLR0_PKA0_SGROBn1_SIA3_SS0_SU32_SUM0_SUS256_SPO0_SRVW0_SSO0_SVW8_SK0_SKFTR0_SKXCCM0_SGRO0_TIN0_TLDS1_TLDSM1_ULSGRO0_USL1_UIOFGRO0_USFGROn1_VSn1_VWA1_VWB1_WSGRA0_WSGRB0_WS32_WG32_2_1_WGM8_WGMXCC1_WGMXCCGn1
    SolutionIndex: 8
    SolutionNameMin: Cijk_Alik_Bjlk_F8B8S_BH_Bias_SHB_HA_S_SAB_SCD_SAV_UserArgs_MT16x32x64_MI16x16x1_SN_LDSB0_AFC1_AG0_AFEM1_AFEM1_ASEM64_CLR1_CADS0_DTLA0_DTLB0_DTVA1_DTVB1_DTVSM0_DPLBn1_EPS0_ELFLR0_EMLLn1_FDSI0_GRPM1_GRVWA8_GRVWB8_GSUn1_GSUAMB_GSUC0_GSUWGMRR0_GLS0_ISA1201_IU1_K1_LDSTI0_LBSPPA0_LBSPPB0_LBSPPM0_LPA0_LPB0_LPM0_LRVW8_LWPMn1_MIAV1_MIWT1_1_MO40_MGRIPMn1_NTn1_NTA0_NTB0_NTC0_NTD0_NTM0_NEPBS0_NLCA4_NLCB1_ONLL0_PGR1_PLR0_PKA0_SGROBn1_SIA3_SS0_SU32_SUM0_SUS256_SPO0_SRVW0_SSO0_SVW8_SK0_SKFTR0_SKXCCM0_SGRO0_TIN0_TLDS1_TLDSM1_ULSGRO0_USL1_UIOFGRO0_USFGROn1_VSn1_VWA1_VWB1_WSGRA0_WSGRB0_WS32_WG16_4_1_WGM8_WGMXCC1_WGMXCCGn1
    SolutionIndex: 9
    SolutionNameMin: Cijk_Alik_Bjlk_F8B8S_BH_Bias_SHB_HA_S_SAB_SCD_SAV_UserArgs_MT32x32x64_MI16x16x1_SN_LDSB0_AFC1_AG0_AFEM1_AFEM1_ASEM64_CLR1_CADS0_DTLA0_DTLB0_DTVA1_DTVB1_DTVSM0_DPLBn1_EPS0_ELFLR0_EMLLn1_FDSI0_GRPM1_GRVWA8_GRVWB8_GSUn1_GSUAMB_GSUC0_GSUWGMRR0_GLS0_ISA1201_IU1_K1_LDSTI0_LBSPPA0_LBSPPB0_LBSPPM0_LPA0_LPB0_LPM0_LRVW8_LWPMn1_MIAV1_MIWT1_1_MO40_MGRIPMn1_NTn1_NTA0_NTB0_NTC0_NTD0_NTM0_NEPBS0_NLCA4_NLCB1_ONLL0_PGR1_PLR0_PKA0_SGROBn1_SIA3_SS1_SU32_SUM0_SUS256_SPO0_SRVW0_SSO0_SVW1_SK0_SKFTR0_SKXCCM0_SGRO0_TIN0_TLDS1_TLDSM1_ULSGRO0_USL1_UIOFGRO0_USFGROn1_VSn1_VWA1_VWB1_WSGRA0_WSGRB0_WS32_WG32_4_1_WGM8_WGMXCC1_WGMXCCGn1
    SolutionIndex: 10
    SolutionNameMin: Cijk_Alik_Bjlk_F8B8S_BH_Bias_SHB_HA_S_SAB_SCD_SAV_UserArgs_MT32x32x64_MI16x16x1_SN_LDSB0_AFC1_AG0_AFEM1_AFEM1_ASEM64_CLR1_CADS0_DTLA0_DTLB0_DTVA1_DTVB1_DTVSM0_DPLBn1_EPS0_ELFLR0_EMLLn1_FDSI0_GRPM1_GRVWA8_GRVWB8_GSUn1_GSUAMB_GSUC0_GSUWGMRR0_GLS0_ISA1201_IU1_K1_LDSTI0_LBSPPA0_LBSPPB0_LBSPPM0_LPA0_LPB0_LPM0_LRVW8_LWPMn1_MIAV1_MIWT1_1_MO40_MGRIPMn1_NTn1_NTA0_NTB0_NTC0_NTD0_NTM0_NEPBS0_NLCA4_NLCB1_ONLL0_PGR1_PLR0_PKA0_SGROBn1_SIA3_SS0_SU32_SUM0_SUS256_SPO0_SRVW0_SSO0_SVW8_SK0_SKFTR0_SKXCCM0_SGRO0_TIN0_TLDS1_TLDSM1_ULSGRO0_USL1_UIOFGRO0_USFGROn1_VSn1_VWA1_VWB1_WSGRA0_WSGRB0_WS32_WG32_4_1_WGM8_WGMXCC1_WGMXCCGn1
    SolutionIndex: 11
    SolutionNameMin: Cijk_Alik_Bjlk_F8B8S_BH_Bias_SHB_HA_S_SAB_SCD_SAV_UserArgs_MT16x16x32_MI16x16x1_SN_LDSB0_AFC1_AG0_AFEM1_AFEM1_ASEM32_CLR1_CADS0_DTLA0_DTLB0_DTVA1_DTVB1_DTVSM0_DPLBn1_EPS0_ELFLR0_EMLLn1_FDSI0_GRPM1_GRVWA8_GRVWB8_GSUn1_GSUAMB_GSUC0_GSUWGMRR0_GLS0_ISA1201_IU1_K1_LDSTI0_LBSPPA0_LBSPPB0_LBSPPM0_LPA0_LPB0_LPM0_LRVW8_LWPMn1_MIAV1_MIWT1_1_MO40_MGRIPMn1_NTn1_NTA0_NTB0_NTC0_NTD0_NTM0_NEPBS0_NLCA2_NLCB1_ONLL0_PGR1_PLR0_PKA0_SGROBn1_SIA3_SS0_SU32_SUM0_SUS256_SPO0_SRVW0_SSO0_SVW8_SK0_SKFTR0_SKXCCM0_SGRO0_TIN0_TLDS1_TLDSM1_ULSGRO0_USL1_UIOFGRO0_USFGROn1_VSn1_VWA1_VWB1_WSGRA0_WSGRB0_WS32_WG16_2_1_WGM8_WGMXCC1_WGMXCCGn1
    SolutionIndex: 12
    SolutionNameMin: Cijk_Alik_Bjlk_F8B8S_BH_Bias_SHB_HA_S_SAB_SCD_SAV_UserArgs_MT64x64x64_MI16x16x1_SN_LDSB0_AFC1_AG0_AFEM1_AFEM1_ASEM1_CLR1_CADS0_DTLA0_DTLB0_DTVA0_DTVB1_DTVSM0_DPLBn1_EPS0_ELFLR0_EMLLn1_FDSI0_GRPM1_GRVWA8_GRVWB8_GSUn1_GSUAMB_GSUC0_GSUWGMRR0_GLS0_ISA1201_IU1_K1_LDSTI0_LBSPPA128_LBSPPB0_LBSPPM0_LPA8_LPB0_LPM0_LRVW8_LWPMn1_MIAV1_MIWT2_2_MO40_MGRIPMn1_NTn1_NTA0_NTB0_NTC0_NTD0_NTM0_NEPBS0_NLCA1_NLCB4_ONLL0_PGR2_PLR1_PKA0_SGROBn1_SIA3_SS0_SU32_SUM0_SUS256_SPO0_SRVW0_SSO0_SVW16_SK0_SKFTR0_SKXCCM0_SGRO0_TIN0_TLDS1_TLDSM1_ULSGRO0_USL1_UIOFGRO0_USFGROn1_VSn1_VWA2_VWB1_WSGRA0_WSGRB0_WS32_WG32_4_1_WGM8_WGMXCC1_WGMXCCGn1
    SolutionIndex: 13
    SolutionNameMin: Cijk_Alik_Bjlk_F8B8S_BH_Bias_SHB_HA_S_SAB_SCD_SAV_UserArgs_MT64x64x64_MI16x16x1_SN_LDSB0_AFC1_AG0_AFEM1_AFEM1_ASEM64_CLR1_CADS0_DTLA0_DTLB0_DTVA1_DTVB1_DTVSM0_DPLBn1_EPS0_ELFLR0_EMLLn1_FDSI0_GRPM1_GRVWA8_GRVWB8_GSUn1_GSUAMB_GSUC0_GSUWGMRR0_GLS0_ISA1201_IU1_K1_LDSTI0_LBSPPA0_LBSPPB0_LBSPPM0_LPA0_LPB0_LPM0_LRVW8_LWPMn1_MIAV1_MIWT2_2_MO40_MGRIPMn1_NTn1_NTA0_NTB0_NTC0_NTD0_NTM0_NEPBS0_NLCA4_NLCB4_ONLL0_PGR1_PLR0_PKA0_SGROBn1_SIA3_SS0_SU32_SUM0_SUS256_SPO0_SRVW0_SSO0_SVW16_SK0_SKFTR0_SKXCCM0_SGRO0_TIN0_TLDS1_TLDSM1_ULSGRO0_USL1_UIOFGRO0_USFGROn1_VSn1_VWA2_VWB1_WSGRA0_WSGRB0_WS32_WG32_4_1_WGM8_WGMXCC1_WGMXCCGn1
    SolutionIndex: 14
    SolutionNameMin: Cijk_Alik_Bjlk_F8B8S_BH_Bias_SHB_HA_S_SAB_SCD_SAV_UserArgs_MT16x32x64_MI16x16x1_SN_LDSB0_AFC1_AG0_AFEM1_AFEM1_ASEM64_CLR1_CADS0_DTLA0_DTLB0_DTVA1_DTVB1_DTVSM0_DPLBn1_EPS0_ELFLR0_EMLLn1_FDSI0_GRPM1_GRVWA8_GRVWB8_GSUn1_GSUAMB_GSUC0_GSUWGMRR0_GLS0_ISA1201_IU1_K1_LDSTI0_LBSPPA0_LBSPPB0_LBSPPM0_LPA0_LPB0_LPM0_LRVW8_LWPMn1_MIAV1_MIWT1_1_MO40_MGRIPMn1_NTn1_NTA0_NTB0_NTC0_NTD0_NTM0_NEPBS0_NLCA4_NLCB1_ONLL0_PGR1_PLR0_PKA0_SGROBn1_SIA3_SS1_SU32_SUM0_SUS256_SPO0_SRVW0_SSO0_SVW1_SK0_SKFTR0_SKXCCM0_SGRO0_TIN0_TLDS1_TLDSM1_ULSGRO0_USL1_UIOFGRO0_USFGROn1_VSn1_VWA1_VWB1_WSGRA0_WSGRB0_WS32_WG16_4_1_WGM8_WGMXCC1_WGMXCCGn1
    SolutionIndex: 15
    SolutionNameMin: Cijk_Alik_Bjlk_F8B8S_BH_Bias_SHB_HA_S_SAB_SCD_SAV_UserArgs_MT32x32x64_MI16x16x1_SN_LDSB0_AFC1_AG0_AFEM1_AFEM1_ASEM1_CLR1_CADS0_DTLA0_DTLB0_DTVA0_DTVB1_DTVSM0_DPLBn1_EPS0_ELFLR0_EMLLn1_FDSI0_GRPM1_GRVWA8_GRVWB8_GSUn1_GSUAMB_GSUC0_GSUWGMRR0_GLS0_ISA1201_IU1_K1_LDSTI0_LBSPPA128_LBSPPB0_LBSPPM0_LPA8_LPB0_LPM0_LRVW8_LWPMn1_MIAV1_MIWT1_1_MO40_MGRIPMn1_NTn1_NTA0_NTB0_NTC0_NTD0_NTM0_NEPBS0_NLCA1_NLCB1_ONLL0_PGR2_PLR1_PKA0_SGROBn1_SIA3_SS0_SU32_SUM0_SUS256_SPO0_SRVW0_SSO0_SVW8_SK0_SKFTR0_SKXCCM0_SGRO0_TIN0_TLDS1_TLDSM1_ULSGRO0_USL1_UIOFGRO0_USFGROn1_VSn1_VWA1_VWB1_WSGRA0_WSGRB0_WS32_WG32_4_1_WGM8_WGMXCC1_WGMXCCGn1
    SolutionIndex: 16
    SolutionNameMin: Cijk_Alik_Bjlk_F8B8S_BH_Bias_SHB_HA_S_SAB_SCD_SAV_UserArgs_MT32x16x32_MI16x16x1_SN_LDSB0_AFC1_AG0_AFEM1_AFEM1_ASEM32_CLR1_CADS0_DTLA0_DTLB0_DTVA1_DTVB1_DTVSM0_DPLBn1_EPS0_ELFLR0_EMLLn1_FDSI0_GRPM1_GRVWA8_GRVWB8_GSUn1_GSUAMB_GSUC0_GSUWGMRR0_GLS0_ISA1201_IU1_K1_LDSTI0_LBSPPA0_LBSPPB0_LBSPPM0_LPA0_LPB0_LPM0_LRVW8_LWPMn1_MIAV1_MIWT1_1_MO40_MGRIPMn1_NTn1_NTA0_NTB0_NTC0_NTD0_NTM0_NEPBS0_NLCA2_NLCB1_ONLL0_PGR1_PLR0_PKA0_SGROBn1_SIA3_SS0_SU32_SUM0_SUS256_SPO0_SRVW0_SSO0_SVW8_SK0_SKFTR0_SKXCCM0_SGRO0_TIN0_TLDS1_TLDSM1_ULSGRO0_USL1_UIOFGRO0_USFGROn1_VSn1_VWA1_VWB1_WSGRA0_WSGRB0_WS32_WG32_2_1_WGM8_WGMXCC1_WGMXCCGn1
    SolutionIndex: 17
    SolutionNameMin: Cijk_Alik_Bjlk_F8B8S_BH_Bias_SHB_HA_S_SAB_SCD_SAV_UserArgs_MT32x128x64_MI16x16x1_SN_LDSB0_AFC1_AG0_AFEM1_AFEM1_ASEM1_CLR1_CADS0_DTLA0_DTLB0_DTVA0_DTVB1_DTVSM0_DPLBn1_EPS1_ELFLR0_EMLLn1_FDSI0_GRPM1_GRVWA8_GRVWB8_GSUn1_GSUAMB_GSUC0_GSUWGMRR0_GLS0_ISA1201_IU1_K1_LDSTI0_LBSPPA128_LBSPPB0_LBSPPM0_LPA8_LPB0_LPM0_LRVW8_LWPMn1_MIAV1_MIWT1_4_MO40_MGRIPMn1_NTn1_NTA0_NTB0_NTC0_NTD0_NTM0_NEPBS0_NLCA1_NLCB4_ONLL0_PGR1_PLR1_PKA0_SGROBn1_SIA3_SS0_SU32_SUM0_SUS256_SPO0_SRVW0_SSO0_SVW8_SK0_SKFTR0_SKXCCM0_SGRO0_TIN0_TLDS1_TLDSM1_ULSGRO0_USL1_UIOFGRO0_USFGROn1_VSn1_VWA1_VWB1_WSGRA0_WSGRB0_WS32_WG32_4_1_WGM8_WGMXCC1_WGMXCCGn1
    SolutionIndex: 18
    SolutionNameMin: Cijk_Alik_Bjlk_F8B8S_BH_Bias_SHB_HA_S_SAB_SCD_SAV_UserArgs_MT64x64x32_MI16x16x1_SN_LDSB0_AFC1_AG0_AFEM1_AFEM1_ASEM1_CLR1_CADS0_DTLA0_DTLB0_DTVA0_DTVB1_DTVSM0_DPLBn1_EPS1_ELFLR0_EMLLn1_FDSI0_GRPM1_GRVWA8_GRVWB8_GSUn1_GSUAMB_GSUC0_GSUWGMRR0_GLS0_ISA1201_IU1_K1_LDSTI0_LBSPPA128_LBSPPB0_LBSPPM0_LPA8_LPB0_LPM0_LRVW8_LWPMn1_MIAV1_MIWT2_2_MO40_MGRIPMn1_NTn1_NTA0_NTB0_NTC0_NTD0_NTM0_NEPBS0_NLCA1_NLCB2_ONLL0_PGR1_PLR1_PKA0_SGROBn1_SIA3_SS0_SU32_SUM0_SUS256_SPO0_SRVW0_SSO0_SVW16_SK0_SKFTR0_SKXCCM0_SGRO0_TIN0_TLDS1_TLDSM1_ULSGRO0_USL1_UIOFGRO0_USFGROn1_VSn1_VWA2_VWB1_WSGRA0_WSGRB0_WS32_WG32_4_1_WGM8_WGMXCC1_WGMXCCGn1
    SolutionIndex: 19
    SolutionNameMin: Cijk_Alik_Bjlk_F8B8S_BH_Bias_SHB_HA_S_SAB_SCD_SAV_UserArgs_MT32x128x64_MI16x16x1_SN_LDSB0_AFC1_AG0_AFEM1_AFEM1_ASEM1_CLR1_CADS0_DTLA0_DTLB0_DTVA0_DTVB1_DTVSM0_DPLBn1_EPS0_ELFLR0_EMLLn1_FDSI0_GRPM1_GRVWA8_GRVWB8_GSUn1_GSUAMB_GSUC0_GSUWGMRR0_GLS0_ISA1201_IU1_K1_LDSTI0_LBSPPA128_LBSPPB0_LBSPPM0_LPA8_LPB0_LPM0_LRVW8_LWPMn1_MIAV1_MIWT1_4_MO40_MGRIPMn1_NTn1_NTA0_NTB0_NTC0_NTD0_NTM0_NEPBS0_NLCA1_NLCB4_ONLL0_PGR2_PLR1_PKA0_SGROBn1_SIA3_SS0_SU32_SUM0_SUS256_SPO0_SRVW0_SSO0_SVW8_SK0_SKFTR0_SKXCCM0_SGRO0_TIN0_TLDS1_TLDSM1_ULSGRO0_USL1_UIOFGRO0_USFGROn1_VSn1_VWA1_VWB1_WSGRA0_WSGRB0_WS32_WG32_4_1_WGM8_WGMXCC1_WGMXCCGn1
    SolutionIndex: 20
    SolutionNameMin: Cijk_Alik_Bjlk_F8B8S_BH_Bias_SHB_HA_S_SAB_SCD_SAV_UserArgs_MT32x16x64_MI16x16x1_SN_LDSB0_AFC1_AG0_AFEM1_AFEM1_ASEM1_CLR1_CADS0_DTLA0_DTLB0_DTVA0_DTVB1_DTVSM0_DPLBn1_EPS0_ELFLR0_EMLLn1_FDSI0_GRPM1_GRVWA8_GRVWB8_GSUn1_GSUAMB_GSUC0_GSUWGMRR0_GLS0_ISA1201_IU1_K1_LDSTI0_LBSPPA128_LBSPPB0_LBSPPM0_LPA8_LPB0_LPM0_LRVW8_LWPMn1_MIAV1_MIWT1_1_MO40_MGRIPMn1_NTn1_NTA0_NTB0_NTC0_NTD0_NTM0_NEPBS0_NLCA1_NLCB1_ONLL0_PGR2_PLR1_PKA0_SGROBn1_SIA3_SS0_SU32_SUM0_SUS256_SPO0_SRVW0_SSO0_SVW8_SK0_SKFTR0_SKXCCM0_SGRO0_TIN0_TLDS1_TLDSM1_ULSGRO0_USL1_UIOFGRO0_USFGROn1_VSn1_VWA1_VWB1_WSGRA0_WSGRB0_WS32_WG32_2_1_WGM8_WGMXCC1_WGMXCCGn1
    SolutionIndex: 21
    SolutionNameMin: Cijk_Alik_Bjlk_F8B8S_BH_Bias_SHB_HA_S_SAB_SCD_SAV_UserArgs_MT16x16x64_MI16x16x1_SN_LDSB0_AFC1_AG0_AFEM1_AFEM1_ASEM64_CLR1_CADS0_DTLA0_DTLB0_DTVA1_DTVB1_DTVSM0_DPLBn1_EPS0_ELFLR0_EMLLn1_FDSI0_GRPM1_GRVWA8_GRVWB8_GSUn1_GSUAMB_GSUC0_GSUWGMRR0_GLS0_ISA1201_IU1_K1_LDSTI0_LBSPPA0_LBSPPB0_LBSPPM0_LPA0_LPB0_LPM0_LRVW8_LWPMn1_MIAV1_MIWT1_1_MO40_MGRIPMn1_NTn1_NTA0_NTB0_NTC0_NTD0_NTM0_NEPBS0_NLCA4_NLCB1_ONLL0_PGR1_PLR0_PKA0_SGROBn1_SIA3_SS1_SU32_SUM0_SUS256_SPO0_SRVW0_SSO0_SVW1_SK0_SKFTR0_SKXCCM0_SGRO0_TIN0_TLDS1_TLDSM1_ULSGRO0_USL1_UIOFGRO0_USFGROn1_VSn1_VWA1_VWB1_WSGRA0_WSGRB0_WS32_WG16_2_1_WGM8_WGMXCC1_WGMXCCGn1
    SolutionIndex: 22
    SolutionNameMin: Cijk_Alik_Bjlk_F8B8S_BH_Bias_SHB_HA_S_SAB_SCD_SAV_UserArgs_MT64x64x32_MI16x16x1_SN_LDSB0_AFC1_AG0_AFEM1_AFEM1_ASEM1_CLR1_CADS0_DTLA0_DTLB0_DTVA0_DTVB1_DTVSM0_DPLBn1_EPS0_ELFLR0_EMLLn1_FDSI0_GRPM1_GRVWA8_GRVWB8_GSUn1_GSUAMB_GSUC0_GSUWGMRR0_GLS0_ISA1201_IU1_K1_LDSTI0_LBSPPA128_LBSPPB0_LBSPPM0_LPA8_LPB0_LPM0_LRVW8_LWPMn1_MIAV1_MIWT2_2_MO40_MGRIPMn1_NTn1_NTA0_NTB0_NTC0_NTD0_NTM0_NEPBS0_NLCA1_NLCB2_ONLL0_PGR2_PLR1_PKA0_SGROBn1_SIA3_SS0_SU32_SUM0_SUS256_SPO0_SRVW0_SSO0_SVW16_SK0_SKFTR0_SKXCCM0_SGRO0_TIN0_TLDS1_TLDSM1_ULSGRO0_USL1_UIOFGRO0_USFGROn1_VSn1_VWA2_VWB1_WSGRA0_WSGRB0_WS32_WG32_4_1_WGM8_WGMXCC1_WGMXCCGn1
    SolutionIndex: 23
    SolutionNameMin: Cijk_Alik_Bjlk_F8B8S_BH_Bias_SHB_HA_S_SAB_SCD_SAV_UserArgs_MT64x64x32_MI16x16x1_SN_LDSB1_AFC1_AG0_AFEM1_AFEM1_ASEM1_CLR1_CADS0_DTLA0_DTLB0_DTVA0_DTVB0_DTVSM0_DPLBn1_EPS0_ELFLR0_EMLLn1_FDSI0_GRPM1_GRVWA8_GRVWB8_GSUn1_GSUAMB_GSUC0_GSUWGMRR0_GLS0_ISA1201_IU2_K1_LDSTI0_LBSPPA128_LBSPPB512_LBSPPM0_LPA8_LPB32_LPM0_LRVW8_LWPMn1_MIAV1_MIWT2_2_MO40_MGRIPMn1_NTn1_NTA0_NTB0_NTC0_NTD0_NTM0_NEPBS0_NLCA1_NLCB1_ONLL0_PGR2_PLR1_PKA0_SGROBn1_SIA2_SS0_SU32_SUM0_SUS256_SPO0_SRVW0_SSO0_SVW16_SK0_SKFTR0_SKXCCM0_SGRO0_TIN0_TLDS1_TLDSM1_ULSGRO1_USL1_UIOFGRO0_USFGROn1_VSn1_VWA2_VWB2_WSGRA0_WSGRB0_WS32_WG32_4_1_WGM8_WGMXCC1_WGMXCCGn1
    SolutionIndex: 24
    SolutionNameMin: Cijk_Alik_Bjlk_F8B8S_BH_Bias_SHB_HA_S_SAB_SCD_SAV_UserArgs_MT64x64x16_MI16x16x1_SN_LDSB0_AFC1_AG0_AFEM1_AFEM1_ASEM1_CLR0_CADS0_DTLA0_DTLB0_DTVA0_DTVB0_DTVSM0_DPLBn1_EPS0_ELFLR0_EMLLn1_FDSI0_GRPM1_GRVWA8_GRVWB8_GSUn1_GSUAMB_GSUC0_GSUWGMRR0_GLS0_ISA1201_IU1_K1_LDSTI0_LBSPPA128_LBSPPB512_LBSPPM0_LPA8_LPB32_LPM0_LRVW8_LWPMn1_MIAV1_MIWT2_2_MO40_MGRIPMn1_NTn1_NTA0_NTB0_NTC0_NTD0_NTM0_NEPBS0_NLCA1_NLCB1_ONLL0_PGR2_PLR0_PKA0_SGROBn1_SIA3_SS0_SU32_SUM0_SUS256_SPO0_SRVW0_SSO0_SVW16_SK0_SKFTR0_SKXCCM0_SGRO0_TIN0_TLDS1_TLDSM1_ULSGRO1_USL1_UIOFGRO0_USFGROn1_VSn1_VWA2_VWB2_WSGRA0_WSGRB0_WS32_WG32_4_1_WGM8_WGMXCC1_WGMXCCGn1
    SolutionIndex: 25
    SolutionNameMin: Cijk_Alik_Bjlk_F8B8S_BH_Bias_SHB_HA_S_SAB_SCD_SAV_UserArgs_MT64x64x32_MI16x16x1_SN_LDSB0_AFC1_AG0_AFEM1_AFEM1_ASEM32_CLR1_CADS0_DTLA0_DTLB0_DTVA1_DTVB1_DTVSM0_DPLBn1_EPS0_ELFLR0_EMLLn1_FDSI0_GRPM1_GRVWA8_GRVWB8_GSUn1_GSUAMB_GSUC0_GSUWGMRR0_GLS0_ISA1201_IU1_K1_LDSTI0_LBSPPA0_LBSPPB0_LBSPPM0_LPA0_LPB0_LPM0_LRVW8_LWPMn1_MIAV1_MIWT2_2_MO40_MGRIPMn1_NTn1_NTA0_NTB0_NTC0_NTD0_NTM0_NEPBS0_NLCA2_NLCB2_ONLL0_PGR1_PLR0_PKA0_SGROBn1_SIA3_SS0_SU32_SUM0_SUS256_SPO0_SRVW0_SSO0_SVW16_SK0_SKFTR0_SKXCCM0_SGRO0_TIN0_TLDS1_TLDSM1_ULSGRO0_USL1_UIOFGRO0_USFGROn1_VSn1_VWA2_VWB1_WSGRA0_WSGRB0_WS32_WG32_4_1_WGM8_WGMXCC1_WGMXCCGn1
    SolutionIndex: 26
    SolutionNameMin: Cijk_Alik_Bjlk_F8B8S_BH_Bias_SHB_HA_S_SAB_SCD_SAV_UserArgs_MT64x64x64_MI16x16x1_SN_LDSB0_AFC1_AG0_AFEM1_AFEM1_ASEM1_CLR1_CADS0_DTLA0_DTLB0_DTVA0_DTVB1_DTVSM0_DPLBn1_EPS1_ELFLR0_EMLLn1_FDSI0_GRPM1_GRVWA8_GRVWB8_GSUn1_GSUAMB_GSUC0_GSUWGMRR0_GLS0_ISA1201_IU1_K1_LDSTI0_LBSPPA128_LBSPPB0_LBSPPM0_LPA8_LPB0_LPM0_LRVW8_LWPMn1_MIAV1_MIWT2_2_MO40_MGRIPMn1_NTn1_NTA0_NTB0_NTC0_NTD0_NTM0_NEPBS0_NLCA1_NLCB4_ONLL0_PGR1_PLR1_PKA0_SGROBn1_SIA3_SS1_SU32_SUM0_SUS256_SPO0_SRVW0_SSO0_SVW2_SK0_SKFTR0_SKXCCM0_SGRO0_TIN0_TLDS1_TLDSM1_ULSGRO0_USL1_UIOFGRO0_USFGROn1_VSn1_VWA2_VWB1_WSGRA0_WSGRB0_WS32_WG32_4_1_WGM8_WGMXCC1_WGMXCCGn1
    SolutionIndex: 27
    SolutionNameMin: Cijk_Alik_Bjlk_F8B8S_BH_Bias_SHB_HA_S_SAB_SCD_SAV_UserArgs_MT128x64x16_MI16x16x1_SN_LDSB0_AFC1_AG0_AFEM1_AFEM1_ASEM1_CLR0_CADS0_DTLA0_DTLB0_DTVA0_DTVB0_DTVSM0_DPLBn1_EPS0_ELFLR0_EMLLn1_FDSI0_GRPM1_GRVWA8_GRVWB8_GSUn1_GSUAMB_GSUC0_GSUWGMRR0_GLS0_ISA1201_IU1_K1_LDSTI0_LBSPPA128_LBSPPB512_LBSPPM0_LPA8_LPB16_LPM0_LRVW8_LWPMn1_MIAV1_MIWT8_1_MO40_MGRIPMn1_NTn1_NTA0_NTB0_NTC0_NTD0_NTM0_NEPBS0_NLCA1_NLCB1_ONLL0_PGR2_PLR0_PKA0_SGROBn1_SIA3_SS1_SU32_SUM0_SUS256_SPO0_SRVW0_SSO0_SVW8_SK0_SKFTR0_SKXCCM0_SGRO0_TIN0_TLDS1_TLDSM1_ULSGRO0_USL1_UIOFGRO0_USFGROn1_VSn1_VWA8_VWB1_WSGRA0_WSGRB0_WS32_WG16_8_1_WGM8_WGMXCC1_WGMXCCGn1
    SolutionIndex: 28
    SolutionNameMin: Cijk_Alik_Bjlk_F8B8S_BH_Bias_SHB_HA_S_SAB_SCD_SAV_UserArgs_MT16x16x64_MI16x16x1_SN_LDSB0_AFC1_AG0_AFEM1_AFEM1_ASEM64_CLR1_CADS0_DTLA0_DTLB0_DTVA1_DTVB1_DTVSM0_DPLBn1_EPS0_ELFLR0_EMLLn1_FDSI0_GRPM1_GRVWA8_GRVWB8_GSUn1_GSUAMB_GSUC0_GSUWGMRR0_GLS0_ISA1201_IU1_K1_LDSTI0_LBSPPA0_LBSPPB0_LBSPPM0_LPA0_LPB0_LPM0_LRVW8_LWPMn1_MIAV1_MIWT1_1_MO40_MGRIPMn1_NTn1_NTA0_NTB0_NTC0_NTD0_NTM0_NEPBS0_NLCA4_NLCB1_ONLL0_PGR1_PLR0_PKA0_SGROBn1_SIA3_SS0_SU32_SUM0_SUS256_SPO0_SRVW0_SSO0_SVW8_SK0_SKFTR0_SKXCCM0_SGRO0_TIN0_TLDS1_TLDSM1_ULSGRO0_USL1_UIOFGRO0_USFGROn1_VSn1_VWA1_VWB1_WSGRA0_WSGRB0_WS32_WG16_2_1_WGM8_WGMXCC1_WGMXCCGn1
    SolutionIndex: 29
    SolutionNameMin: Cijk_Alik_Bjlk_F8B8S_BH_Bias_SHB_HA_S_SAB_SCD_SAV_UserArgs_MT16x32x32_MI16x16x1_SN_LDSB0_AFC1_AG0_AFEM1_AFEM1_ASEM32_CLR1_CADS0_DTLA0_DTLB0_DTVA1_DTVB1_DTVSM0_DPLBn1_EPS0_ELFLR0_EMLLn1_FDSI0_GRPM1_GRVWA8_GRVWB8_GSUn1_GSUAMB_GSUC0_GSUWGMRR0_GLS0_ISA1201_IU1_K1_LDSTI0_LBSPPA0_LBSPPB0_LBSPPM0_LPA0_LPB0_LPM0_LRVW8_LWPMn1_MIAV1_MIWT1_1_MO40_MGRIPMn1_NTn1_NTA0_NTB0_NTC0_NTD0_NTM0_NEPBS0_NLCA2_NLCB1_ONLL0_PGR1_PLR0_PKA0_SGROBn1_SIA3_SS0_SU32_SUM0_SUS256_SPO0_SRVW0_SSO0_SVW8_SK0_SKFTR0_SKXCCM0_SGRO0_TIN0_TLDS1_TLDSM1_ULSGRO0_USL1_UIOFGRO0_USFGROn1_VSn1_VWA1_VWB1_WSGRA0_WSGRB0_WS32_WG16_4_1_WGM8_WGMXCC1_WGMXCCGn1
    SolutionIndex: 30
    SolutionNameMin: Cijk_Alik_Bjlk_F8B8S_BH_Bias_SHB_HA_S_SAB_SCD_SAV_UserArgs_MT32x128x32_MI16x16x1_SN_LDSB0_AFC1_AG0_AFEM1_AFEM1_ASEM1_CLR1_CADS0_DTLA0_DTLB0_DTVA0_DTVB1_DTVSM0_DPLBn1_EPS1_ELFLR0_EMLLn1_FDSI0_GRPM1_GRVWA8_GRVWB8_GSUn1_GSUAMB_GSUC0_GSUWGMRR0_GLS0_ISA1201_IU1_K1_LDSTI0_LBSPPA128_LBSPPB0_LBSPPM0_LPA8_LPB0_LPM0_LRVW8_LWPMn1_MIAV1_MIWT1_4_MO40_MGRIPMn1_NTn1_NTA0_NTB0_NTC0_NTD0_NTM0_NEPBS0_NLCA1_NLCB2_ONLL0_PGR1_PLR1_PKA0_SGROBn1_SIA3_SS0_SU32_SUM0_SUS256_SPO0_SRVW0_SSO0_SVW8_SK0_SKFTR0_SKXCCM0_SGRO0_TIN0_TLDS1_TLDSM1_ULSGRO0_USL1_UIOFGRO0_USFGROn1_VSn1_VWA1_VWB1_WSGRA0_WSGRB0_WS32_WG32_4_1_WGM8_WGMXCC1_WGMXCCGn1
    SolutionIndex: 31
    SolutionNameMin: Cijk_Alik_Bjlk_F8B8S_BH_Bias_SHB_HA_S_SAB_SCD_SAV_UserArgs_MT16x256x64_MI16x16x1_SN_LDSB0_AFC1_AG0_AFEM1_AFEM1_ASEM64_CLR1_CADS0_DTLA0_DTLB0_DTVA1_DTVB1_DTVSM0_DPLBn1_EPS0_ELFLR0_EMLLn1_FDSI0_GRPM1_GRVWA8_GRVWB8_GSUn1_GSUAMB_GSUC0_GSUWGMRR0_GLS0_ISA1201_IU1_K1_LDSTI0_LBSPPA0_LBSPPB0_LBSPPM0_LPA0_LPB0_LPM0_LRVW8_LWPMn1_MIAV1_MIWT1_8_MO40_MGRIPMn1_NTn1_NTA0_NTB0_NTC0_NTD0_NTM0_NEPBS0_NLCA4_NLCB4_ONLL0_PGR1_PLR0_PKA0_SGROBn1_SIA3_SS0_SU32_SUM0_SUS256_SPO0_SRVW0_SSO0_SVW8_SK0_SKFTR0_SKXCCM0_SGRO0_TIN0_TLDS1_TLDSM1_ULSGRO0_USL1_UIOFGRO0_USFGROn1_VSn1_VWA1_VWB1_WSGRA0_WSGRB0_WS32_WG16_4_1_WGM8_WGMXCC1_WGMXCCGn1
    SolutionIndex: 32
    SolutionNameMin: Cijk_Alik_Bjlk_F8B8S_BH_Bias_SHB_HA_S_SAB_SCD_SAV_UserArgs_MT128x32x64_MI16x16x1_SN_LDSB0_AFC1_AG0_AFEM1_AFEM1_ASEM1_CLR1_CADS0_DTLA0_DTLB0_DTVA0_DTVB1_DTVSM0_DPLBn1_EPS0_ELFLR0_EMLLn1_FDSI0_GRPM1_GRVWA8_GRVWB8_GSUn1_GSUAMB_GSUC0_GSUWGMRR0_GLS0_ISA1201_IU1_K1_LDSTI0_LBSPPA256_LBSPPB0_LBSPPM0_LPA8_LPB0_LPM0_LRVW8_LWPMn1_MIAV1_MIWT4_1_MO40_MGRIPMn1_NTn1_NTA0_NTB0_NTC0_NTD0_NTM0_NEPBS0_NLCA1_NLCB1_ONLL0_PGR2_PLR1_PKA0_SGROBn1_SIA3_SS0_SU32_SUM0_SUS256_SPO0_SRVW0_SSO0_SVW8_SK0_SKFTR0_SKXCCM0_SGRO0_TIN0_TLDS1_TLDSM1_ULSGRO0_USL1_UIOFGRO0_USFGROn1_VSn1_VWA4_VWB1_WSGRA0_WSGRB0_WS32_WG32_4_1_WGM8_WGMXCC1_WGMXCCGn1
    SolutionIndex: 33
    SolutionNameMin: Cijk_Alik_Bjlk_F8B8S_BH_Bias_SHB_HA_S_SAB_SCD_SAV_UserArgs_MT16x256x32_MI16x16x1_SN_LDSB0_AFC1_AG0_AFEM1_AFEM1_ASEM1_CLR1_CADS0_DTLA0_DTLB0_DTVA0_DTVB1_DTVSM0_DPLBn1_EPS1_ELFLR0_EMLLn1_FDSI0_GRPM1_GRVWA8_GRVWB8_GSUn1_GSUAMB_GSUC0_GSUWGMRR0_GLS0_ISA1201_IU1_K1_LDSTI0_LBSPPA128_LBSPPB0_LBSPPM0_LPA8_LPB0_LPM0_LRVW8_LWPMn1_MIAV1_MIWT1_8_MO40_MGRIPMn1_NTn1_NTA0_NTB0_NTC0_NTD0_NTM0_NEPBS0_NLCA1_NLCB2_ONLL0_PGR1_PLR1_PKA0_SGROBn1_SIA3_SS0_SU32_SUM0_SUS256_SPO0_SRVW0_SSO0_SVW8_SK0_SKFTR0_SKXCCM0_SGRO0_TIN0_TLDS1_TLDSM1_ULSGRO0_USL1_UIOFGRO0_USFGROn1_VSn1_VWA1_VWB1_WSGRA0_WSGRB0_WS32_WG16_4_1_WGM8_WGMXCC1_WGMXCCGn1
    SolutionIndex: 34
    SolutionNameMin: Cijk_Alik_Bjlk_F8B8S_BH_Bias_SHB_HA_S_SAB_SCD_SAV_UserArgs_MT128x32x64_MI16x16x1_SN_LDSB0_AFC1_AG0_AFEM1_AFEM1_ASEM1_CLR1_CADS0_DTLA0_DTLB0_DTVA0_DTVB1_DTVSM0_DPLBn1_EPS1_ELFLR0_EMLLn1_FDSI0_GRPM1_GRVWA8_GRVWB8_GSUn1_GSUAMB_GSUC0_GSUWGMRR0_GLS0_ISA1201_IU1_K1_LDSTI0_LBSPPA256_LBSPPB0_LBSPPM0_LPA8_LPB0_LPM0_LRVW8_LWPMn1_MIAV1_MIWT4_1_MO40_MGRIPMn1_NTn1_NTA0_NTB0_NTC0_NTD0_NTM0_NEPBS0_NLCA1_NLCB1_ONLL0_PGR1_PLR1_PKA0_SGROBn1_SIA3_SS0_SU32_SUM0_SUS256_SPO0_SRVW0_SSO0_SVW8_SK0_SKFTR0_SKXCCM0_SGRO0_TIN0_TLDS1_TLDSM1_ULSGRO0_USL1_UIOFGRO0_USFGROn1_VSn1_VWA4_VWB1_WSGRA0_WSGRB0_WS32_WG32_4_1_WGM8_WGMXCC1_WGMXCCGn1
    SolutionIndex: 35
    SolutionNameMin: Cijk_Alik_Bjlk_F8B8S_BH_Bias_SHB_HA_S_SAB_SCD_SAV_UserArgs_MT16x256x32_MI16x16x1_SN_LDSB0_AFC1_AG0_AFEM1_AFEM1_ASEM1_CLR1_CADS0_DTLA0_DTLB0_DTVA0_DTVB1_DTVSM0_DPLBn1_EPS0_ELFLR0_EMLLn1_FDSI0_GRPM1_GRVWA8_GRVWB8_GSUn1_GSUAMB_GSUC0_GSUWGMRR0_GLS0_ISA1201_IU1_K1_LDSTI0_LBSPPA128_LBSPPB0_LBSPPM0_LPA8_LPB0_LPM0_LRVW8_LWPMn1_MIAV1_MIWT1_8_MO40_MGRIPMn1_NTn1_NTA0_NTB0_NTC0_NTD0_NTM0_NEPBS0_NLCA1_NLCB2_ONLL0_PGR2_PLR1_PKA0_SGROBn1_SIA3_SS0_SU32_SUM0_SUS256_SPO0_SRVW0_SSO0_SVW8_SK0_SKFTR0_SKXCCM0_SGRO0_TIN0_TLDS1_TLDSM1_ULSGRO0_USL1_UIOFGRO0_USFGROn1_VSn1_VWA1_VWB1_WSGRA0_WSGRB0_WS32_WG16_4_1_WGM8_WGMXCC1_WGMXCCGn1
    SolutionIndex: 36
    SolutionNameMin: Cijk_Alik_Bjlk_F8B8S_BH_Bias_SHB_HA_S_SAB_SCD_SAV_UserArgs_MT64x64x16_MI16x16x1_SN_LDSB0_AFC1_AG0_AFEM1_AFEM1_ASEM16_CLR1_CADS0_DTLA0_DTLB0_DTVA1_DTVB1_DTVSM0_DPLBn1_EPS0_ELFLR0_EMLLn1_FDSI0_GRPM1_GRVWA8_GRVWB8_GSUn1_GSUAMB_GSUC0_GSUWGMRR0_GLS0_ISA1201_IU1_K1_LDSTI0_LBSPPA0_LBSPPB0_LBSPPM0_LPA0_LPB0_LPM0_LRVW8_LWPMn1_MIAV1_MIWT2_2_MO40_MGRIPMn1_NTn1_NTA0_NTB0_NTC0_NTD0_NTM0_NEPBS0_NLCA1_NLCB1_ONLL0_PGR1_PLR0_PKA0_SGROBn1_SIA3_SS0_SU32_SUM0_SUS256_SPO0_SRVW0_SSO0_SVW16_SK0_SKFTR0_SKXCCM0_SGRO0_TIN0_TLDS1_TLDSM1_ULSGRO0_USL1_UIOFGRO0_USFGROn1_VSn1_VWA2_VWB1_WSGRA0_WSGRB0_WS32_WG32_4_1_WGM8_WGMXCC1_WGMXCCGn1
    SolutionIndex: 37
    SolutionNameMin: Cijk_Alik_Bjlk_F8B8S_BH_Bias_SHB_HA_S_SAB_SCD_SAV_UserArgs_MT32x16x64_MI16x16x1_SN_LDSB0_AFC1_AG0_AFEM1_AFEM1_ASEM1_CLR1_CADS0_DTLA0_DTLB0_DTVA0_DTVB0_DTVSM0_DPLBn1_EPS1_ELFLR0_EMLLn1_FDSI0_GRPM1_GRVWA16_GRVWB16_GSUn1_GSUAMB_GSUC0_GSUWGMRR0_GLS0_ISA1201_IU1_K1_LDSTI0_LBSPPA128_LBSPPB256_LBSPPM0_LPA32_LPB16_LPM0_LRVW16_LWPMn1_MIAV1_MIWT1_1_MO40_MGRIPMn1_NTn1_NTA0_NTB0_NTC0_NTD0_NTM0_NEPBS0_NLCA1_NLCB1_ONLL0_PGR1_PLR1_PKA0_SGROBn1_SIA3_SS0_SU32_SUM0_SUS256_SPO0_SRVW0_SSO0_SVW8_SK0_SKFTR0_SKXCCM0_SGRO0_TIN0_TLDS1_TLDSM1_ULSGRO0_USL1_UIOFGRO0_USFGROn1_VSn1_VWA1_VWB1_WSGRA0_WSGRB0_WS32_WG32_2_1_WGM8_WGMXCC1_WGMXCCGn1
    SolutionIndex: 38
    SolutionNameMin: Cijk_Alik_Bjlk_F8B8S_BH_Bias_SHB_HA_S_SAB_SCD_SAV_UserArgs_MT16x512x64_MI16x16x1_SN_LDSB0_AFC1_AG0_AFEM1_AFEM1_ASEM1_CLR1_CADS0_DTLA0_DTLB0_DTVA0_DTVB1_DTVSM0_DPLBn1_EPS1_ELFLR0_EMLLn1_FDSI0_GRPM1_GRVWA8_GRVWB8_GSUn1_GSUAMB_GSUC0_GSUWGMRR0_GLS0_ISA1201_IU1_K1_LDSTI0_LBSPPA128_LBSPPB0_LBSPPM0_LPA8_LPB0_LPM0_LRVW8_LWPMn1_MIAV1_MIWT1_8_MO40_MGRIPMn1_NTn1_NTA0_NTB0_NTC0_NTD0_NTM0_NEPBS0_NLCA1_NLCB4_ONLL0_PGR1_PLR1_PKA0_SGROBn1_SIA3_SS0_SU32_SUM0_SUS256_SPO0_SRVW0_SSO0_SVW8_SK0_SKFTR0_SKXCCM0_SGRO0_TIN0_TLDS1_TLDSM1_ULSGRO0_USL1_UIOFGRO0_USFGROn1_VSn1_VWA1_VWB1_WSGRA0_WSGRB0_WS32_WG16_8_1_WGM8_WGMXCC1_WGMXCCGn1
    SolutionIndex: 39
    SolutionNameMin: Cijk_Alik_Bjlk_F8B8S_BH_Bias_SHB_HA_S_SAB_SCD_SAV_UserArgs_MT64x64x64_MI16x16x1_SN_LDSB0_AFC1_AG0_AFEM1_AFEM1_ASEM64_CLR1_CADS0_DTLA0_DTLB0_DTVA1_DTVB1_DTVSM0_DPLBn1_EPS0_ELFLR0_EMLLn1_FDSI0_GRPM1_GRVWA8_GRVWB8_GSUn1_GSUAMB_GSUC0_GSUWGMRR0_GLS0_ISA1201_IU1_K1_LDSTI0_LBSPPA0_LBSPPB0_LBSPPM0_LPA0_LPB0_LPM0_LRVW8_LWPMn1_MIAV1_MIWT2_2_MO40_MGRIPMn1_NTn1_NTA0_NTB0_NTC0_NTD0_NTM0_NEPBS0_NLCA4_NLCB4_ONLL0_PGR1_PLR0_PKA0_SGROBn1_SIA3_SS1_SU32_SUM0_SUS256_SPO0_SRVW0_SSO0_SVW2_SK0_SKFTR0_SKXCCM0_SGRO0_TIN0_TLDS1_TLDSM1_ULSGRO0_USL1_UIOFGRO0_USFGROn1_VSn1_VWA2_VWB1_WSGRA0_WSGRB0_WS32_WG32_4_1_WGM8_WGMXCC1_WGMXCCGn1
    SolutionIndex: 40
    SolutionNameMin: Cijk_Alik_Bjlk_F8B8S_BH_Bias_SHB_HA_S_SAB_SCD_SAV_UserArgs_MT64x64x64_MI16x16x1_SN_LDSB0_AFC1_AG0_AFEM1_AFEM1_ASEM64_CLR1_CADS0_DTLA0_DTLB0_DTVA1_DTVB0_DTVSM0_DPLBn1_EPS1_ELFLR0_EMLLn1_FDSI0_GRPM1_GRVWA16_GRVWB16_GSUn1_GSUAMB_GSUC0_GSUWGMRR0_GLS0_ISA1201_IU1_K1_LDSTI0_LBSPPA0_LBSPPB1024_LBSPPM0_LPA0_LPB32_LPM0_LRVW16_LWPMn1_MIAV1_MIWT2_2_MO40_MGRIPMn1_NTn1_NTA0_NTB0_NTC0_NTD0_NTM0_NEPBS0_NLCA2_NLCB1_ONLL0_PGR1_PLR1_PKA0_SGROBn1_SIA3_SS0_SU32_SUM0_SUS256_SPO0_SRVW0_SSO0_SVW16_SK0_SKFTR0_SKXCCM0_SGRO0_TIN0_TLDS1_TLDSM1_ULSGRO0_USL1_UIOFGRO0_USFGROn1_VSn1_VWA2_VWB2_WSGRA0_WSGRB0_WS32_WG32_4_1_WGM8_WGMXCC1_WGMXCCGn1
    SolutionIndex: 41
    SolutionNameMin: Cijk_Alik_Bjlk_F8B8S_BH_Bias_SHB_HA_S_SAB_SCD_SAV_UserArgs_MT16x128x32_MI16x16x1_SN_LDSB0_AFC1_AG0_AFEM1_AFEM1_ASEM1_CLR1_CADS0_DTLA0_DTLB0_DTVA0_DTVB1_DTVSM0_DPLBn1_EPS1_ELFLR0_EMLLn1_FDSI0_GRPM1_GRVWA8_GRVWB8_GSUn1_GSUAMB_GSUC0_GSUWGMRR0_GLS0_ISA1201_IU1_K1_LDSTI0_LBSPPA128_LBSPPB0_LBSPPM0_LPA8_LPB0_LPM0_LRVW8_LWPMn1_MIAV1_MIWT1_8_MO40_MGRIPMn1_NTn1_NTA0_NTB0_NTC0_NTD0_NTM0_NEPBS0_NLCA1_NLCB2_ONLL0_PGR1_PLR1_PKA0_SGROBn1_SIA3_SS0_SU32_SUM0_SUS256_SPO0_SRVW0_SSO0_SVW8_SK0_SKFTR0_SKXCCM0_SGRO0_TIN0_TLDS1_TLDSM1_ULSGRO0_USL1_UIOFGRO0_USFGROn1_VSn1_VWA1_VWB1_WSGRA0_WSGRB0_WS32_WG16_2_1_WGM8_WGMXCC1_WGMXCCGn1
    SolutionIndex: 42
    SolutionNameMin: Cijk_Alik_Bjlk_F8B8S_BH_Bias_SHB_HA_S_SAB_SCD_SAV_UserArgs_MT128x64x32_MI16x16x1_SN_LDSB1_AFC1_AG0_AFEM1_AFEM1_ASEM1_CLR1_CADS0_DTLA0_DTLB0_DTVA0_DTVB0_DTVSM0_DPLBn1_EPS0_ELFLR0_EMLLn1_FDSI0_GRPM1_GRVWA8_GRVWB8_GSUn1_GSUAMB_GSUC0_GSUWGMRR0_GLS0_ISA1201_IU2_K1_LDSTI0_LBSPPA256_LBSPPB512_LBSPPM0_LPA8_LPB16_LPM0_LRVW8_LWPMn1_MIAV1_MIWT8_1_MO40_MGRIPMn1_NTn1_NTA0_NTB0_NTC0_NTD0_NTM0_NEPBS0_NLCA1_NLCB1_ONLL0_PGR2_PLR1_PKA0_SGROBn1_SIA2_SS1_SU32_SUM0_SUS256_SPO0_SRVW0_SSO0_SVW8_SK0_SKFTR0_SKXCCM0_SGRO0_TIN0_TLDS1_TLDSM1_ULSGRO1_USL1_UIOFGRO0_USFGROn1_VSn1_VWA8_VWB1_WSGRA0_WSGRB0_WS32_WG16_8_1_WGM8_WGMXCC1_WGMXCCGn1
    SolutionIndex: 43
    SolutionNameMin: Cijk_Alik_Bjlk_F8B8S_BH_Bias_SHB_HA_S_SAB_SCD_SAV_UserArgs_MT128x32x32_MI16x16x1_SN_LDSB0_AFC1_AG0_AFEM1_AFEM1_ASEM32_CLR1_CADS0_DTLA0_DTLB0_DTVA1_DTVB0_DTVSM0_DPLBn1_EPS0_ELFLR0_EMLLn1_FDSI0_GRPM1_GRVWA8_GRVWB8_GSUn1_GSUAMB_GSUC0_GSUWGMRR0_GLS0_ISA1201_IU1_K1_LDSTI0_LBSPPA0_LBSPPB256_LBSPPM0_LPA0_LPB16_LPM0_LRVW8_LWPMn1_MIAV1_MIWT4_1_MO40_MGRIPMn1_NTn1_NTA0_NTB0_NTC0_NTD0_NTM0_NEPBS0_NLCA2_NLCB1_ONLL0_PGR2_PLR1_PKA0_SGROBn1_SIA3_SS0_SU32_SUM0_SUS256_SPO0_SRVW0_SSO0_SVW8_SK0_SKFTR0_SKXCCM0_SGRO0_TIN0_TLDS1_TLDSM1_ULSGRO0_USL1_UIOFGRO0_USFGROn1_VSn1_VWA4_VWB1_WSGRA0_WSGRB0_WS32_WG32_4_1_WGM8_WGMXCC1_WGMXCCGn1
    SolutionIndex: 44
    SolutionNameMin: Cijk_Alik_Bjlk_F8B8S_BH_Bias_SHB_HA_S_SAB_SCD_SAV_UserArgs_MT32x128x64_MI16x16x1_SN_LDSB0_AFC1_AG0_AFEM1_AFEM1_ASEM64_CLR1_CADS0_DTLA0_DTLB0_DTVA1_DTVB1_DTVSM0_DPLBn1_EPS0_ELFLR0_EMLLn1_FDSI0_GRPM1_GRVWA8_GRVWB8_GSUn1_GSUAMB_GSUC0_GSUWGMRR0_GLS0_ISA1201_IU1_K1_LDSTI0_LBSPPA0_LBSPPB0_LBSPPM0_LPA0_LPB0_LPM0_LRVW8_LWPMn1_MIAV1_MIWT1_4_MO40_MGRIPMn1_NTn1_NTA0_NTB0_NTC0_NTD0_NTM0_NEPBS0_NLCA4_NLCB4_ONLL0_PGR1_PLR0_PKA0_SGROBn1_SIA3_SS0_SU32_SUM0_SUS256_SPO0_SRVW0_SSO0_SVW8_SK0_SKFTR0_SKXCCM0_SGRO0_TIN0_TLDS1_TLDSM1_ULSGRO0_USL1_UIOFGRO0_USFGROn1_VSn1_VWA1_VWB1_WSGRA0_WSGRB0_WS32_WG32_4_1_WGM8_WGMXCC1_WGMXCCGn1
    SolutionIndex: 45
    SolutionNameMin: Cijk_Alik_Bjlk_F8B8S_BH_Bias_SHB_HA_S_SAB_SCD_SAV_UserArgs_MT128x32x64_MI16x16x1_SN_LDSB0_AFC1_AG0_AFEM1_AFEM1_ASEM1_CLR1_CADS0_DTLA0_DTLB0_DTVA0_DTVB1_DTVSM0_DPLBn1_EPS0_ELFLR0_EMLLn1_FDSI0_GRPM1_GRVWA8_GRVWB8_GSUn1_GSUAMB_GSUC0_GSUWGMRR0_GLS0_ISA1201_IU1_K1_LDSTI0_LBSPPA256_LBSPPB0_LBSPPM0_LPA8_LPB0_LPM0_LRVW8_LWPMn1_MIAV1_MIWT4_1_MO40_MGRIPMn1_NTn1_NTA0_NTB0_NTC0_NTD0_NTM0_NEPBS0_NLCA1_NLCB1_ONLL0_PGR2_PLR1_PKA0_SGROBn1_SIA3_SS1_SU32_SUM0_SUS256_SPO0_SRVW0_SSO0_SVW4_SK0_SKFTR0_SKXCCM0_SGRO0_TIN0_TLDS1_TLDSM1_ULSGRO0_USL1_UIOFGRO0_USFGROn1_VSn1_VWA4_VWB1_WSGRA0_WSGRB0_WS32_WG32_4_1_WGM8_WGMXCC1_WGMXCCGn1
    SolutionIndex: 46
    SolutionNameMin: Cijk_Alik_Bjlk_F8B8S_BH_Bias_SHB_HA_S_SAB_SCD_SAV_UserArgs_MT128x64x64_MI16x16x1_SN_LDSB0_AFC1_AG0_AFEM1_AFEM1_ASEM1_CLR1_CADS0_DTLA0_DTLB0_DTVA0_DTVB1_DTVSM0_DPLBn1_EPS0_ELFLR0_EMLLn1_FDSI0_GRPM1_GRVWA8_GRVWB8_GSUn1_GSUAMB_GSUC0_GSUWGMRR0_GLS0_ISA1201_IU1_K1_LDSTI0_LBSPPA512_LBSPPB0_LBSPPM0_LPA8_LPB0_LPM0_LRVW8_LWPMn1_MIAV1_MIWT8_1_MO40_MGRIPMn1_NTn1_NTA0_NTB0_NTC0_NTD0_NTM0_NEPBS0_NLCA1_NLCB1_ONLL0_PGR2_PLR1_PKA0_SGROBn1_SIA3_SS1_SU32_SUM0_SUS256_SPO0_SRVW0_SSO0_SVW8_SK0_SKFTR0_SKXCCM0_SGRO0_TIN0_TLDS1_TLDSM1_ULSGRO0_USL1_UIOFGRO0_USFGROn1_VSn1_VWA8_VWB1_WSGRA0_WSGRB0_WS32_WG16_8_1_WGM8_WGMXCC1_WGMXCCGn1
    SolutionIndex: 47
    SolutionNameMin: Cijk_Alik_Bjlk_F8B8S_BH_Bias_SHB_HA_S_SAB_SCD_SAV_UserArgs_MT64x128x32_MI16x16x1_SN_LDSB0_AFC1_AG0_AFEM1_AFEM1_ASEM1_CLR1_CADS0_DTLA0_DTLB0_DTVA0_DTVB1_DTVSM0_DPLBn1_EPS1_ELFLR0_EMLLn1_FDSI0_GRPM1_GRVWA8_GRVWB8_GSUn1_GSUAMB_GSUC0_GSUWGMRR0_GLS0_ISA1201_IU1_K1_LDSTI0_LBSPPA128_LBSPPB0_LBSPPM0_LPA8_LPB0_LPM0_LRVW8_LWPMn1_MIAV1_MIWT1_8_MO40_MGRIPMn1_NTn1_NTA0_NTB0_NTC0_NTD0_NTM0_NEPBS0_NLCA1_NLCB2_ONLL0_PGR1_PLR1_PKA0_SGROBn1_SIA3_SS0_SU32_SUM0_SUS256_SPO0_SRVW0_SSO0_SVW8_SK0_SKFTR0_SKXCCM0_SGRO0_TIN0_TLDS1_TLDSM1_ULSGRO0_USL1_UIOFGRO0_USFGROn1_VSn1_VWA1_VWB1_WSGRA0_WSGRB0_WS32_WG64_2_1_WGM8_WGMXCC1_WGMXCCGn1
    SolutionIndex: 48
    SolutionNameMin: Cijk_Alik_Bjlk_F8B8S_BH_Bias_SHB_HA_S_SAB_SCD_SAV_UserArgs_MT64x128x64_MI16x16x1_SN_LDSB0_AFC1_AG0_AFEM1_AFEM1_ASEM1_CLR1_CADS0_DTLA0_DTLB0_DTVA0_DTVB1_DTVSM0_DPLBn1_EPS0_ELFLR0_EMLLn1_FDSI0_GRPM1_GRVWA8_GRVWB8_GSUn1_GSUAMB_GSUC0_GSUWGMRR0_GLS0_ISA1201_IU1_K1_LDSTI0_LBSPPA128_LBSPPB0_LBSPPM0_LPA8_LPB0_LPM0_LRVW8_LWPMn1_MIAV1_MIWT1_8_MO40_MGRIPMn1_NTn1_NTA0_NTB0_NTC0_NTD0_NTM0_NEPBS0_NLCA1_NLCB4_ONLL0_PGR2_PLR1_PKA0_SGROBn1_SIA3_SS0_SU32_SUM0_SUS256_SPO0_SRVW0_SSO0_SVW8_SK0_SKFTR0_SKXCCM0_SGRO0_TIN0_TLDS1_TLDSM1_ULSGRO0_USL1_UIOFGRO0_USFGROn1_VSn1_VWA1_VWB1_WSGRA0_WSGRB0_WS32_WG64_2_1_WGM8_WGMXCC1_WGMXCCGn1
    SolutionIndex: 49
    SolutionNameMin: Cijk_Alik_Bjlk_F8B8S_BH_Bias_SHB_HA_S_SAB_SCD_SAV_UserArgs_MT64x128x32_MI16x16x1_SN_LDSB0_AFC1_AG0_AFEM1_AFEM1_ASEM1_CLR1_CADS0_DTLA0_DTLB0_DTVA0_DTVB1_DTVSM0_DPLBn1_EPS0_ELFLR0_EMLLn1_FDSI0_GRPM1_GRVWA8_GRVWB8_GSUn1_GSUAMB_GSUC0_GSUWGMRR0_GLS0_ISA1201_IU1_K1_LDSTI0_LBSPPA128_LBSPPB0_LBSPPM0_LPA8_LPB0_LPM0_LRVW8_LWPMn1_MIAV1_MIWT1_8_MO40_MGRIPMn1_NTn1_NTA0_NTB0_NTC0_NTD0_NTM0_NEPBS0_NLCA1_NLCB2_ONLL0_PGR2_PLR1_PKA0_SGROBn1_SIA3_SS0_SU32_SUM0_SUS256_SPO0_SRVW0_SSO0_SVW8_SK0_SKFTR0_SKXCCM0_SGRO0_TIN0_TLDS1_TLDSM1_ULSGRO0_USL1_UIOFGRO0_USFGROn1_VSn1_VWA1_VWB1_WSGRA0_WSGRB0_WS32_WG64_2_1_WGM8_WGMXCC1_WGMXCCGn1
    SolutionIndex: 50
    SolutionNameMin: Cijk_Alik_Bjlk_F8B8S_BH_Bias_SHB_HA_S_SAB_SCD_SAV_UserArgs_MT32x128x32_MI16x16x1_SN_LDSB0_AFC1_AG0_AFEM1_AFEM1_ASEM32_CLR1_CADS0_DTLA0_DTLB0_DTVA1_DTVB1_DTVSM0_DPLBn1_EPS0_ELFLR0_EMLLn1_FDSI0_GRPM1_GRVWA8_GRVWB8_GSUn1_GSUAMB_GSUC0_GSUWGMRR0_GLS0_ISA1201_IU1_K1_LDSTI0_LBSPPA0_LBSPPB0_LBSPPM0_LPA0_LPB0_LPM0_LRVW8_LWPMn1_MIAV1_MIWT1_4_MO40_MGRIPMn1_NTn1_NTA0_NTB0_NTC0_NTD0_NTM0_NEPBS0_NLCA2_NLCB2_ONLL0_PGR1_PLR0_PKA0_SGROBn1_SIA3_SS0_SU32_SUM0_SUS256_SPO0_SRVW0_SSO0_SVW8_SK0_SKFTR0_SKXCCM0_SGRO0_TIN0_TLDS1_TLDSM1_ULSGRO0_USL1_UIOFGRO0_USFGROn1_VSn1_VWA1_VWB1_WSGRA0_WSGRB0_WS32_WG32_4_1_WGM8_WGMXCC1_WGMXCCGn1
    SolutionIndex: 51
    SolutionNameMin: Cijk_Alik_Bjlk_F8B8S_BH_Bias_SHB_HA_S_SAB_SCD_SAV_UserArgs_MT128x16x16_MI16x16x1_SN_LDSB1_AFC1_AG0_AFEM1_AFEM1_ASEM1_CLR1_CADS0_DTLA0_DTLB0_DTVA0_DTVB0_DTVSM0_DPLBn1_EPS1_ELFLR0_EMLLn1_FDSI0_GRPM1_GRVWA8_GRVWB8_GSUn1_GSUAMB_GSUC0_GSUWGMRR0_GLS0_ISA1201_IU1_K1_LDSTI0_LBSPPA128_LBSPPB128_LBSPPM0_LPA8_LPB16_LPM0_LRVW8_LWPMn1_MIAV1_MIWT8_1_MO40_MGRIPMn1_NTn1_NTA0_NTB0_NTC0_NTD0_NTM0_NEPBS0_NLCA1_NLCB1_ONLL0_PGR1_PLR1_PKA0_SGROBn1_SIA2_SS0_SU32_SUM0_SUS256_SPO0_SRVW0_SSO0_SVW8_SK0_SKFTR0_SKXCCM0_SGRO0_TIN0_TLDS1_TLDSM1_ULSGRO0_USL1_UIOFGRO0_USFGROn1_VSn1_VWA8_VWB1_WSGRA0_WSGRB0_WS32_WG16_2_1_WGM8_WGMXCC1_WGMXCCGn1
    SolutionIndex: 52
    SolutionNameMin: Cijk_Alik_Bjlk_F8B8S_BH_Bias_SHB_HA_S_SAB_SCD_SAV_UserArgs_MT128x32x64_MI16x16x1_SN_LDSB0_AFC1_AG0_AFEM1_AFEM1_ASEM1_CLR1_CADS0_DTLA0_DTLB0_DTVA0_DTVB1_DTVSM0_DPLBn1_EPS1_ELFLR0_EMLLn1_FDSI0_GRPM1_GRVWA8_GRVWB8_GSUn1_GSUAMB_GSUC0_GSUWGMRR0_GLS0_ISA1201_IU1_K1_LDSTI0_LBSPPA256_LBSPPB0_LBSPPM0_LPA8_LPB0_LPM0_LRVW8_LWPMn1_MIAV1_MIWT4_1_MO40_MGRIPMn1_NTn1_NTA0_NTB0_NTC0_NTD0_NTM0_NEPBS0_NLCA1_NLCB1_ONLL0_PGR1_PLR1_PKA0_SGROBn1_SIA3_SS1_SU32_SUM0_SUS256_SPO0_SRVW0_SSO0_SVW4_SK0_SKFTR0_SKXCCM0_SGRO0_TIN0_TLDS1_TLDSM1_ULSGRO0_USL1_UIOFGRO0_USFGROn1_VSn1_VWA4_VWB1_WSGRA0_WSGRB0_WS32_WG32_4_1_WGM8_WGMXCC1_WGMXCCGn1
    SolutionIndex: 53
    SolutionNameMin: Cijk_Alik_Bjlk_F8B8S_BH_Bias_SHB_HA_S_SAB_SCD_SAV_UserArgs_MT128x64x64_MI16x16x1_SN_LDSB0_AFC1_AG0_AFEM1_AFEM1_ASEM1_CLR1_CADS0_DTLA0_DTLB0_DTVA0_DTVB1_DTVSM0_DPLBn1_EPS1_ELFLR0_EMLLn1_FDSI0_GRPM1_GRVWA8_GRVWB8_GSUn1_GSUAMB_GSUC0_GSUWGMRR0_GLS0_ISA1201_IU1_K1_LDSTI0_LBSPPA512_LBSPPB0_LBSPPM0_LPA8_LPB0_LPM0_LRVW8_LWPMn1_MIAV1_MIWT8_1_MO40_MGRIPMn1_NTn1_NTA0_NTB0_NTC0_NTD0_NTM0_NEPBS0_NLCA1_NLCB1_ONLL0_PGR1_PLR1_PKA0_SGROBn1_SIA3_SS1_SU32_SUM0_SUS256_SPO0_SRVW0_SSO0_SVW8_SK0_SKFTR0_SKXCCM0_SGRO0_TIN0_TLDS1_TLDSM1_ULSGRO0_USL1_UIOFGRO0_USFGROn1_VSn1_VWA8_VWB1_WSGRA0_WSGRB0_WS32_WG16_8_1_WGM8_WGMXCC1_WGMXCCGn1
    SolutionIndex: 54
    SolutionNameMin: Cijk_Alik_Bjlk_F8B8S_BH_Bias_SHB_HA_S_SAB_SCD_SAV_UserArgs_MT128x64x32_MI16x16x1_SN_LDSB1_AFC1_AG0_AFEM1_AFEM1_ASEM1_CLR1_CADS0_DTLA0_DTLB0_DTVA0_DTVB0_DTVSM0_DPLBn1_EPS1_ELFLR0_EMLLn1_FDSI0_GRPM1_GRVWA8_GRVWB16_GSUn1_GSUAMB_GSUC0_GSUWGMRR0_GLS0_ISA1201_IU2_K1_LDSTI0_LBSPPA256_LBSPPB512_LBSPPM0_LPA8_LPB16_LPM0_LRVW8_LWPMn1_MIAV1_MIWT8_1_MO40_MGRIPMn1_NTn1_NTA0_NTB0_NTC0_NTD0_NTM0_NEPBS0_NLCA1_NLCB1_ONLL0_PGR1_PLR1_PKA0_SGROBn1_SIA2_SS0_SU32_SUM0_SUS256_SPO0_SRVW0_SSO0_SVW8_SK0_SKFTR0_SKXCCM0_SGRO0_TIN0_TLDS1_TLDSM1_ULSGRO0_USL1_UIOFGRO0_USFGROn1_VSn1_VWA8_VWB1_WSGRA0_WSGRB0_WS32_WG16_8_1_WGM8_WGMXCC1_WGMXCCGn1
    SolutionIndex: 55
    SolutionNameMin: Cijk_Alik_Bjlk_F8B8S_BH_Bias_SHB_HA_S_SAB_SCD_SAV_UserArgs_MT16x512x64_MI16x16x1_SN_LDSB0_AFC1_AG0_AFEM1_AFEM1_ASEM64_CLR1_CADS0_DTLA0_DTLB0_DTVA1_DTVB1_DTVSM0_DPLBn1_EPS0_ELFLR0_EMLLn1_FDSI0_GRPM1_GRVWA8_GRVWB8_GSUn1_GSUAMB_GSUC0_GSUWGMRR0_GLS0_ISA1201_IU1_K1_LDSTI0_LBSPPA0_LBSPPB0_LBSPPM0_LPA0_LPB0_LPM0_LRVW8_LWPMn1_MIAV1_MIWT1_8_MO40_MGRIPMn1_NTn1_NTA0_NTB0_NTC0_NTD0_NTM0_NEPBS0_NLCA4_NLCB4_ONLL0_PGR1_PLR0_PKA0_SGROBn1_SIA3_SS0_SU32_SUM0_SUS256_SPO0_SRVW0_SSO0_SVW8_SK0_SKFTR0_SKXCCM0_SGRO0_TIN0_TLDS1_TLDSM1_ULSGRO0_USL1_UIOFGRO0_USFGROn1_VSn1_VWA1_VWB1_WSGRA0_WSGRB0_WS32_WG16_8_1_WGM8_WGMXCC1_WGMXCCGn1
    SolutionIndex: 56
    SolutionNameMin: Cijk_Alik_Bjlk_F8B8S_BH_Bias_SHB_HA_S_SAB_SCD_SAV_UserArgs_MT128x64x64_MI16x16x1_SN_LDSB0_AFC1_AG0_AFEM1_AFEM1_ASEM1_CLR1_CADS0_DTLA0_DTLB0_DTVA0_DTVB1_DTVSM0_DPLBn1_EPS1_ELFLR0_EMLLn1_FDSI0_GRPM1_GRVWA8_GRVWB8_GSUn1_GSUAMB_GSUC0_GSUWGMRR0_GLS0_ISA1201_IU1_K1_LDSTI0_LBSPPA512_LBSPPB0_LBSPPM0_LPA8_LPB0_LPM0_LRVW8_LWPMn1_MIAV1_MIWT8_1_MO40_MGRIPMn1_NTn1_NTA0_NTB0_NTC0_NTD0_NTM0_NEPBS0_NLCA1_NLCB1_ONLL0_PGR1_PLR1_PKA0_SGROBn1_SIA3_SS0_SU32_SUM0_SUS256_SPO0_SRVW0_SSO0_SVW8_SK0_SKFTR0_SKXCCM0_SGRO0_TIN0_TLDS1_TLDSM1_ULSGRO0_USL1_UIOFGRO0_USFGROn1_VSn1_VWA8_VWB1_WSGRA0_WSGRB0_WS32_WG16_8_1_WGM8_WGMXCC1_WGMXCCGn1
    SolutionIndex: 57
    SolutionNameMin: Cijk_Alik_Bjlk_F8B8S_BH_Bias_SHB_HA_S_SAB_SCD_SAV_UserArgs_MT128x64x16_MI16x16x1_SN_LDSB1_AFC1_AG0_AFEM1_AFEM1_ASEM1_CLR1_CADS0_DTLA0_DTLB0_DTVA0_DTVB0_DTVSM0_DPLBn1_EPS0_ELFLR0_EMLLn1_FDSI0_GRPM1_GRVWA8_GRVWB8_GSUn1_GSUAMB_GSUC0_GSUWGMRR0_GLS0_ISA1201_IU1_K1_LDSTI0_LBSPPA128_LBSPPB512_LBSPPM0_LPA8_LPB16_LPM0_LRVW8_LWPMn1_MIAV1_MIWT8_1_MO40_MGRIPMn1_NTn1_NTA0_NTB0_NTC0_NTD0_NTM0_NEPBS0_NLCA1_NLCB1_ONLL0_PGR2_PLR1_PKA0_SGROBn1_SIA2_SS0_SU32_SUM0_SUS256_SPO0_SRVW0_SSO0_SVW8_SK0_SKFTR0_SKXCCM0_SGRO0_TIN0_TLDS1_TLDSM1_ULSGRO1_USL1_UIOFGRO0_USFGROn1_VSn1_VWA8_VWB1_WSGRA0_WSGRB0_WS32_WG16_8_1_WGM8_WGMXCC1_WGMXCCGn1
    SolutionIndex: 58
    SolutionNameMin: Cijk_Alik_Bjlk_F8B8S_BH_Bias_SHB_HA_S_SAB_SCD_SAV_UserArgs_MT32x32x64_MI16x16x1_SN_LDSB0_AFC1_AG0_AFEM1_AFEM1_ASEM1_CLR1_CADS0_DTLA0_DTLB0_DTVA0_DTVB1_DTVSM0_DPLBn1_EPS0_ELFLR0_EMLLn1_FDSI0_GRPM1_GRVWA8_GRVWB8_GSUn1_GSUAMB_GSUC0_GSUWGMRR0_GLS0_ISA1201_IU1_K1_LDSTI0_LBSPPA128_LBSPPB0_LBSPPM0_LPA8_LPB0_LPM0_LRVW8_LWPMn1_MIAV1_MIWT1_1_MO40_MGRIPMn1_NTn1_NTA0_NTB0_NTC0_NTD0_NTM0_NEPBS0_NLCA1_NLCB1_ONLL0_PGR2_PLR1_PKA0_SGROBn1_SIA3_SS1_SU32_SUM0_SUS256_SPO0_SRVW0_SSO0_SVW1_SK0_SKFTR0_SKXCCM0_SGRO0_TIN0_TLDS1_TLDSM1_ULSGRO0_USL1_UIOFGRO0_USFGROn1_VSn1_VWA1_VWB1_WSGRA0_WSGRB0_WS32_WG32_4_1_WGM8_WGMXCC1_WGMXCCGn1
    SolutionIndex: 59
    SolutionNameMin: Cijk_Alik_Bjlk_F8B8S_BH_Bias_SHB_HA_S_SAB_SCD_SAV_UserArgs_MT16x512x32_MI16x16x1_SN_LDSB0_AFC1_AG0_AFEM1_AFEM1_ASEM1_CLR1_CADS0_DTLA0_DTLB0_DTVA0_DTVB1_DTVSM0_DPLBn1_EPS1_ELFLR0_EMLLn1_FDSI0_GRPM1_GRVWA4_GRVWB8_GSUn1_GSUAMB_GSUC0_GSUWGMRR0_GLS0_ISA1201_IU1_K1_LDSTI0_LBSPPA128_LBSPPB0_LBSPPM0_LPA8_LPB0_LPM0_LRVW8_LWPMn1_MIAV1_MIWT1_8_MO40_MGRIPMn1_NTn1_NTA0_NTB0_NTC0_NTD0_NTM0_NEPBS0_NLCA1_NLCB2_ONLL0_PGR1_PLR1_PKA0_SGROBn1_SIA3_SS0_SU32_SUM0_SUS256_SPO0_SRVW0_SSO0_SVW8_SK0_SKFTR0_SKXCCM0_SGRO0_TIN0_TLDS1_TLDSM1_ULSGRO0_USL1_UIOFGRO0_USFGROn1_VSn1_VWA1_VWB1_WSGRA0_WSGRB0_WS32_WG16_8_1_WGM8_WGMXCC1_WGMXCCGn1
    SolutionIndex: 60
    SolutionNameMin: Cijk_Alik_Bjlk_F8B8S_BH_Bias_SHB_HA_S_SAB_SCD_SAV_UserArgs_MT128x64x16_MI16x16x1_SN_LDSB1_AFC1_AG0_AFEM1_AFEM1_ASEM1_CLR1_CADS0_DTLA0_DTLB0_DTVA0_DTVB0_DTVSM0_DPLBn1_EPS1_ELFLR0_EMLLn1_FDSI0_GRPM1_GRVWA8_GRVWB8_GSUn1_GSUAMB_GSUC0_GSUWGMRR0_GLS0_ISA1201_IU1_K1_LDSTI0_LBSPPA128_LBSPPB512_LBSPPM0_LPA8_LPB16_LPM0_LRVW8_LWPMn1_MIAV1_MIWT8_1_MO40_MGRIPMn1_NTn1_NTA0_NTB0_NTC0_NTD0_NTM0_NEPBS0_NLCA1_NLCB1_ONLL0_PGR1_PLR1_PKA0_SGROBn1_SIA2_SS1_SU32_SUM0_SUS256_SPO0_SRVW0_SSO0_SVW8_SK0_SKFTR0_SKXCCM0_SGRO0_TIN0_TLDS1_TLDSM1_ULSGRO0_USL1_UIOFGRO0_USFGROn1_VSn1_VWA8_VWB1_WSGRA0_WSGRB0_WS32_WG16_8_1_WGM8_WGMXCC1_WGMXCCGn1
    SolutionIndex: 61
    SolutionNameMin: Cijk_Alik_Bjlk_F8B8S_BH_Bias_SHB_HA_S_SAB_SCD_SAV_UserArgs_MT128x32x32_MI16x16x1_SN_LDSB1_AFC1_AG0_AFEM1_AFEM1_ASEM1_CLR1_CADS0_DTLA0_DTLB0_DTVA0_DTVB0_DTVSM0_DPLBn1_EPS0_ELFLR0_EMLLn1_FDSI0_GRPM1_GRVWA8_GRVWB8_GSUn1_GSUAMB_GSUC0_GSUWGMRR0_GLS0_ISA1201_IU2_K1_LDSTI0_LBSPPA128_LBSPPB256_LBSPPM0_LPA8_LPB16_LPM0_LRVW8_LWPMn1_MIAV1_MIWT4_1_MO40_MGRIPMn1_NTn1_NTA0_NTB0_NTC0_NTD0_NTM0_NEPBS0_NLCA1_NLCB1_ONLL0_PGR2_PLR1_PKA0_SGROBn1_SIA2_SS1_SU32_SUM0_SUS256_SPO0_SRVW0_SSO0_SVW4_SK0_SKFTR0_SKXCCM0_SGRO0_TIN0_TLDS1_TLDSM1_ULSGRO0_USL1_UIOFGRO0_USFGROn1_VSn1_VWA4_VWB1_WSGRA0_WSGRB0_WS32_WG32_4_1_WGM8_WGMXCC1_WGMXCCGn1
    SolutionIndex: 62
    SolutionNameMin: Cijk_Alik_Bjlk_F8B8S_BH_Bias_SHB_HA_S_SAB_SCD_SAV_UserArgs_MT16x512x32_MI16x16x1_SN_LDSB0_AFC1_AG0_AFEM1_AFEM1_ASEM1_CLR1_CADS0_DTLA0_DTLB0_DTVA0_DTVB1_DTVSM0_DPLBn1_EPS0_ELFLR0_EMLLn1_FDSI0_GRPM1_GRVWA4_GRVWB8_GSUn1_GSUAMB_GSUC0_GSUWGMRR0_GLS0_ISA1201_IU1_K1_LDSTI0_LBSPPA128_LBSPPB0_LBSPPM0_LPA8_LPB0_LPM0_LRVW8_LWPMn1_MIAV1_MIWT1_8_MO40_MGRIPMn1_NTn1_NTA0_NTB0_NTC0_NTD0_NTM0_NEPBS0_NLCA1_NLCB2_ONLL0_PGR2_PLR1_PKA0_SGROBn1_SIA3_SS0_SU32_SUM0_SUS256_SPO0_SRVW0_SSO0_SVW8_SK0_SKFTR0_SKXCCM0_SGRO0_TIN0_TLDS1_TLDSM1_ULSGRO0_USL1_UIOFGRO0_USFGROn1_VSn1_VWA1_VWB1_WSGRA0_WSGRB0_WS32_WG16_8_1_WGM8_WGMXCC1_WGMXCCGn1
    SolutionIndex: 63
    SolutionNameMin: Cijk_Alik_Bjlk_F8B8S_BH_Bias_SHB_HA_S_SAB_SCD_SAV_UserArgs_MT128x32x32_MI16x16x1_SN_LDSB0_AFC1_AG0_AFEM1_AFEM1_ASEM1_CLR1_CADS0_DTLA0_DTLB0_DTVA0_DTVB1_DTVSM0_DPLBn1_EPS1_ELFLR0_EMLLn1_FDSI0_GRPM1_GRVWA8_GRVWB8_GSUn1_GSUAMB_GSUC0_GSUWGMRR0_GLS0_ISA1201_IU1_K1_LDSTI0_LBSPPA128_LBSPPB0_LBSPPM0_LPA8_LPB0_LPM0_LRVW8_LWPMn1_MIAV1_MIWT4_1_MO40_MGRIPMn1_NTn1_NTA0_NTB0_NTC0_NTD0_NTM0_NEPBS0_NLCA1_NLCB1_ONLL0_PGR1_PLR1_PKA0_SGROBn1_SIA3_SS0_SU32_SUM0_SUS256_SPO0_SRVW0_SSO0_SVW8_SK0_SKFTR0_SKXCCM0_SGRO0_TIN0_TLDS1_TLDSM1_ULSGRO0_USL1_UIOFGRO0_USFGROn1_VSn1_VWA4_VWB1_WSGRA0_WSGRB0_WS32_WG32_4_1_WGM8_WGMXCC1_WGMXCCGn1
    SolutionIndex: 64
    SolutionNameMin: Cijk_Alik_Bjlk_F8B8S_BH_Bias_SHB_HA_S_SAB_SCD_SAV_UserArgs_MT128x64x16_MI16x16x1_SN_LDSB0_AFC1_AG0_AFEM1_AFEM1_ASEM1_CLR0_CADS0_DTLA0_DTLB0_DTVA0_DTVB0_DTVSM0_DPLBn1_EPS0_ELFLR0_EMLLn1_FDSI0_GRPM1_GRVWA8_GRVWB8_GSUn1_GSUAMB_GSUC0_GSUWGMRR0_GLS0_ISA1201_IU1_K1_LDSTI0_LBSPPA128_LBSPPB512_LBSPPM0_LPA8_LPB16_LPM0_LRVW8_LWPMn1_MIAV1_MIWT8_1_MO40_MGRIPMn1_NTn1_NTA0_NTB0_NTC0_NTD0_NTM0_NEPBS0_NLCA1_NLCB1_ONLL0_PGR2_PLR0_PKA0_SGROBn1_SIA3_SS0_SU32_SUM0_SUS256_SPO0_SRVW0_SSO0_SVW8_SK0_SKFTR0_SKXCCM0_SGRO0_TIN0_TLDS1_TLDSM1_ULSGRO0_USL1_UIOFGRO0_USFGROn1_VSn1_VWA8_VWB1_WSGRA0_WSGRB0_WS32_WG16_8_1_WGM8_WGMXCC1_WGMXCCGn1
    SolutionIndex: 65
    SolutionNameMin: Cijk_Alik_Bjlk_F8B8S_BH_Bias_SHB_HA_S_SAB_SCD_SAV_UserArgs_MT128x32x32_MI16x16x1_SN_LDSB0_AFC1_AG0_AFEM1_AFEM1_ASEM1_CLR1_CADS0_DTLA0_DTLB0_DTVA0_DTVB1_DTVSM0_DPLBn1_EPS0_ELFLR0_EMLLn1_FDSI0_GRPM1_GRVWA8_GRVWB8_GSUn1_GSUAMB_GSUC0_GSUWGMRR0_GLS0_ISA1201_IU1_K1_LDSTI0_LBSPPA128_LBSPPB0_LBSPPM0_LPA8_LPB0_LPM0_LRVW8_LWPMn1_MIAV1_MIWT4_1_MO40_MGRIPMn1_NTn1_NTA0_NTB0_NTC0_NTD0_NTM0_NEPBS0_NLCA1_NLCB1_ONLL0_PGR2_PLR1_PKA0_SGROBn1_SIA3_SS0_SU32_SUM0_SUS256_SPO0_SRVW0_SSO0_SVW8_SK0_SKFTR0_SKXCCM0_SGRO0_TIN0_TLDS1_TLDSM1_ULSGRO0_USL1_UIOFGRO0_USFGROn1_VSn1_VWA4_VWB1_WSGRA0_WSGRB0_WS32_WG32_4_1_WGM8_WGMXCC1_WGMXCCGn1
    SolutionIndex: 66
    SolutionNameMin: Cijk_Alik_Bjlk_F8B8S_BH_Bias_SHB_HA_S_SAB_SCD_SAV_UserArgs_MT128x64x32_MI16x16x1_SN_LDSB0_AFC1_AG0_AFEM1_AFEM1_ASEM1_CLR1_CADS0_DTLA0_DTLB0_DTVA0_DTVB1_DTVSM0_DPLBn1_EPS1_ELFLR0_EMLLn1_FDSI0_GRPM1_GRVWA8_GRVWB8_GSUn1_GSUAMB_GSUC0_GSUWGMRR0_GLS0_ISA1201_IU1_K1_LDSTI0_LBSPPA256_LBSPPB0_LBSPPM0_LPA8_LPB0_LPM0_LRVW8_LWPMn1_MIAV1_MIWT8_1_MO40_MGRIPMn1_NTn1_NTA0_NTB0_NTC0_NTD0_NTM0_NEPBS0_NLCA1_NLCB1_ONLL0_PGR1_PLR1_PKA0_SGROBn1_SIA3_SS0_SU32_SUM0_SUS256_SPO0_SRVW0_SSO0_SVW8_SK0_SKFTR0_SKXCCM0_SGRO0_TIN0_TLDS1_TLDSM1_ULSGRO0_USL1_UIOFGRO0_USFGROn1_VSn1_VWA8_VWB1_WSGRA0_WSGRB0_WS32_WG16_8_1_WGM8_WGMXCC1_WGMXCCGn1
    SolutionIndex: 67
    SolutionNameMin: Cijk_Alik_Bjlk_F8B8S_BH_Bias_SHB_HA_S_SAB_SCD_SAV_UserArgs_MT64x128x64_MI16x16x1_SN_LDSB0_AFC1_AG0_AFEM1_AFEM1_ASEM64_CLR1_CADS0_DTLA0_DTLB0_DTVA1_DTVB1_DTVSM0_DPLBn1_EPS0_ELFLR0_EMLLn1_FDSI0_GRPM1_GRVWA8_GRVWB8_GSUn1_GSUAMB_GSUC0_GSUWGMRR0_GLS0_ISA1201_IU1_K1_LDSTI0_LBSPPA0_LBSPPB0_LBSPPM0_LPA0_LPB0_LPM0_LRVW8_LWPMn1_MIAV1_MIWT1_8_MO40_MGRIPMn1_NTn1_NTA0_NTB0_NTC0_NTD0_NTM0_NEPBS0_NLCA4_NLCB4_ONLL0_PGR1_PLR0_PKA0_SGROBn1_SIA3_SS0_SU32_SUM0_SUS256_SPO0_SRVW0_SSO0_SVW8_SK0_SKFTR0_SKXCCM0_SGRO0_TIN0_TLDS1_TLDSM1_ULSGRO0_USL1_UIOFGRO0_USFGROn1_VSn1_VWA1_VWB1_WSGRA0_WSGRB0_WS32_WG64_2_1_WGM8_WGMXCC1_WGMXCCGn1
    SolutionIndex: 68
    SolutionNameMin: Cijk_Alik_Bjlk_F8B8S_BH_Bias_SHB_HA_S_SAB_SCD_SAV_UserArgs_MT64x128x32_MI16x16x1_SN_LDSB0_AFC1_AG0_AFEM1_AFEM1_ASEM32_CLR1_CADS0_DTLA0_DTLB0_DTVA1_DTVB1_DTVSM0_DPLBn1_EPS0_ELFLR0_EMLLn1_FDSI0_GRPM1_GRVWA8_GRVWB8_GSUn1_GSUAMB_GSUC0_GSUWGMRR0_GLS0_ISA1201_IU1_K1_LDSTI0_LBSPPA0_LBSPPB0_LBSPPM0_LPA0_LPB0_LPM0_LRVW8_LWPMn1_MIAV1_MIWT1_8_MO40_MGRIPMn1_NTn1_NTA0_NTB0_NTC0_NTD0_NTM0_NEPBS0_NLCA2_NLCB2_ONLL0_PGR1_PLR0_PKA0_SGROBn1_SIA3_SS0_SU32_SUM0_SUS256_SPO0_SRVW0_SSO0_SVW8_SK0_SKFTR0_SKXCCM0_SGRO0_TIN0_TLDS1_TLDSM1_ULSGRO0_USL1_UIOFGRO0_USFGROn1_VSn1_VWA1_VWB1_WSGRA0_WSGRB0_WS32_WG64_2_1_WGM8_WGMXCC1_WGMXCCGn1
    SolutionIndex: 69
    SolutionNameMin: Cijk_Alik_Bjlk_F8B8S_BH_Bias_SHB_HA_S_SAB_SCD_SAV_UserArgs_MT64x128x16_MI16x16x1_SN_LDSB0_AFC1_AG0_AFEM1_AFEM1_ASEM16_CLR1_CADS0_DTLA0_DTLB0_DTVA1_DTVB1_DTVSM0_DPLBn1_EPS0_ELFLR0_EMLLn1_FDSI0_GRPM1_GRVWA8_GRVWB8_GSUn1_GSUAMB_GSUC0_GSUWGMRR0_GLS0_ISA1201_IU1_K1_LDSTI0_LBSPPA0_LBSPPB0_LBSPPM0_LPA0_LPB0_LPM0_LRVW8_LWPMn1_MIAV1_MIWT1_8_MO40_MGRIPMn1_NTn1_NTA0_NTB0_NTC0_NTD0_NTM0_NEPBS0_NLCA1_NLCB1_ONLL0_PGR1_PLR0_PKA0_SGROBn1_SIA3_SS0_SU32_SUM0_SUS256_SPO0_SRVW0_SSO0_SVW8_SK0_SKFTR0_SKXCCM0_SGRO0_TIN0_TLDS1_TLDSM1_ULSGRO0_USL1_UIOFGRO0_USFGROn1_VSn1_VWA1_VWB1_WSGRA0_WSGRB0_WS32_WG64_2_1_WGM8_WGMXCC1_WGMXCCGn1
    SolutionIndex: 70
    SolutionNameMin: Cijk_Alik_Bjlk_F8B8S_BH_Bias_SHB_HA_S_SAB_SCD_SAV_UserArgs_MT16x128x16_MI16x16x1_SN_LDSB0_AFC1_AG0_AFEM1_AFEM1_ASEM16_CLR1_CADS0_DTLA0_DTLB0_DTVA1_DTVB1_DTVSM0_DPLBn1_EPS0_ELFLR0_EMLLn1_FDSI0_GRPM1_GRVWA8_GRVWB8_GSUn1_GSUAMB_GSUC0_GSUWGMRR0_GLS0_ISA1201_IU1_K1_LDSTI0_LBSPPA0_LBSPPB0_LBSPPM0_LPA0_LPB0_LPM0_LRVW8_LWPMn1_MIAV1_MIWT1_8_MO40_MGRIPMn1_NTn1_NTA0_NTB0_NTC0_NTD0_NTM0_NEPBS0_NLCA1_NLCB1_ONLL0_PGR1_PLR0_PKA0_SGROBn1_SIA3_SS0_SU32_SUM0_SUS256_SPO0_SRVW0_SSO0_SVW8_SK0_SKFTR0_SKXCCM0_SGRO0_TIN0_TLDS1_TLDSM1_ULSGRO0_USL1_UIOFGRO0_USFGROn1_VSn1_VWA1_VWB1_WSGRA0_WSGRB0_WS32_WG16_2_1_WGM8_WGMXCC1_WGMXCCGn1
    SolutionIndex: 71
    SolutionNameMin: Cijk_Alik_Bjlk_F8B8S_BH_Bias_SHB_HA_S_SAB_SCD_SAV_UserArgs_MT128x128x32_MI16x16x1_SN_LDSB0_AFC1_AG0_AFEM1_AFEM1_ASEM32_CLR1_CADS0_DTLA0_DTLB0_DTVA1_DTVB1_DTVSM0_DPLBn1_EPS0_ELFLR0_EMLLn1_FDSI0_GRPM1_GRVWA8_GRVWB8_GSUn1_GSUAMB_GSUC0_GSUWGMRR0_GLS0_ISA1201_IU1_K1_LDSTI0_LBSPPA0_LBSPPB0_LBSPPM0_LPA0_LPB0_LPM0_LRVW8_LWPMn1_MIAV1_MIWT4_4_MO40_MGRIPMn1_NTn1_NTA0_NTB0_NTC0_NTD0_NTM0_NEPBS0_NLCA2_NLCB2_ONLL0_PGR1_PLR0_PKA0_SGROBn1_SIA3_SS0_SU32_SUM0_SUS256_SPO0_SRVW0_SSO0_SVW8_SK0_SKFTR0_SKXCCM0_SGRO0_TIN0_TLDS1_TLDSM1_ULSGRO0_USL1_UIOFGRO0_USFGROn1_VSn1_VWA4_VWB1_WSGRA0_WSGRB0_WS32_WG32_4_1_WGM8_WGMXCC1_WGMXCCGn1
    SolutionIndex: 72
    SolutionNameMin: Cijk_Alik_Bjlk_F8B8S_BH_Bias_SHB_HA_S_SAB_SCD_SAV_UserArgs_MT16x16x32_MI16x16x1_SN_LDSB1_AFC1_AG0_AFEM1_AFEM1_ASEM1_CLR1_CADS0_DTLA0_DTLB0_DTVA0_DTVB0_DTVSM0_DPLBn1_EPS0_ELFLR0_EMLLn1_FDSI0_GRPM1_GRVWA8_GRVWB8_GSUn1_GSUAMB_GSUC0_GSUWGMRR0_GLS0_ISA1201_IU2_K1_LDSTI0_LBSPPA128_LBSPPB128_LBSPPM0_LPA8_LPB16_LPM0_LRVW8_LWPMn1_MIAV1_MIWT1_1_MO40_MGRIPMn1_NTn1_NTA0_NTB0_NTC0_NTD0_NTM0_NEPBS0_NLCA1_NLCB1_ONLL0_PGR2_PLR1_PKA0_SGROBn1_SIA2_SS0_SU32_SUM0_SUS256_SPO0_SRVW0_SSO0_SVW8_SK0_SKFTR0_SKXCCM0_SGRO0_TIN0_TLDS1_TLDSM1_ULSGRO1_USL1_UIOFGRO0_USFGROn1_VSn1_VWA1_VWB1_WSGRA0_WSGRB0_WS32_WG16_2_1_WGM8_WGMXCC1_WGMXCCGn1
    SolutionIndex: 73
    SolutionNameMin: Cijk_Alik_Bjlk_F8B8S_BH_Bias_SHB_HA_S_SAB_SCD_SAV_UserArgs_MT128x64x32_MI16x16x1_SN_LDSB1_AFC1_AG0_AFEM1_AFEM1_ASEM1_CLR1_CADS0_DTLA0_DTLB0_DTVA0_DTVB0_DTVSM0_DPLBn1_EPS0_ELFLR0_EMLLn1_FDSI0_GRPM1_GRVWA8_GRVWB8_GSUn1_GSUAMB_GSUC0_GSUWGMRR0_GLS0_ISA1201_IU2_K1_LDSTI0_LBSPPA256_LBSPPB512_LBSPPM0_LPA8_LPB16_LPM0_LRVW8_LWPMn1_MIAV1_MIWT8_1_MO40_MGRIPMn1_NTn1_NTA0_NTB0_NTC0_NTD0_NTM0_NEPBS0_NLCA1_NLCB1_ONLL0_PGR2_PLR1_PKA0_SGROBn1_SIA2_SS0_SU32_SUM0_SUS256_SPO0_SRVW0_SSO0_SVW8_SK0_SKFTR0_SKXCCM0_SGRO0_TIN0_TLDS1_TLDSM1_ULSGRO1_USL1_UIOFGRO0_USFGROn1_VSn1_VWA8_VWB1_WSGRA0_WSGRB0_WS32_WG16_8_1_WGM8_WGMXCC1_WGMXCCGn1
    SolutionIndex: 74
    SolutionNameMin: Cijk_Alik_Bjlk_F8B8S_BH_Bias_SHB_HA_S_SAB_SCD_SAV_UserArgs_MT128x32x32_MI16x16x1_SN_LDSB0_AFC1_AG0_AFEM1_AFEM1_ASEM32_CLR1_CADS0_DTLA0_DTLB0_DTVA1_DTVB1_DTVSM0_DPLBn1_EPS0_ELFLR0_EMLLn1_FDSI0_GRPM1_GRVWA8_GRVWB8_GSUn1_GSUAMB_GSUC0_GSUWGMRR0_GLS0_ISA1201_IU1_K1_LDSTI0_LBSPPA0_LBSPPB0_LBSPPM0_LPA0_LPB0_LPM0_LRVW8_LWPMn1_MIAV1_MIWT4_1_MO40_MGRIPMn1_NTn1_NTA0_NTB0_NTC0_NTD0_NTM0_NEPBS0_NLCA2_NLCB1_ONLL0_PGR1_PLR0_PKA0_SGROBn1_SIA3_SS0_SU32_SUM0_SUS256_SPO0_SRVW0_SSO0_SVW8_SK0_SKFTR0_SKXCCM0_SGRO0_TIN0_TLDS1_TLDSM1_ULSGRO0_USL1_UIOFGRO0_USFGROn1_VSn1_VWA4_VWB1_WSGRA0_WSGRB0_WS32_WG32_4_1_WGM8_WGMXCC1_WGMXCCGn1
    SolutionIndex: 75
    SolutionNameMin: Cijk_Alik_Bjlk_F8B8S_BH_Bias_SHB_HA_S_SAB_SCD_SAV_UserArgs_MT128x64x32_MI16x16x1_SN_LDSB0_AFC1_AG0_AFEM1_AFEM1_ASEM1_CLR1_CADS0_DTLA0_DTLB0_DTVA0_DTVB0_DTVSM0_DPLBn1_EPS0_ELFLR0_EMLLn1_FDSI0_GRPM1_GRVWA8_GRVWB8_GSUn1_GSUAMB_GSUC0_GSUWGMRR0_GLS0_ISA1201_IU1_K1_LDSTI0_LBSPPA256_LBSPPB512_LBSPPM0_LPA8_LPB16_LPM0_LRVW8_LWPMn1_MIAV1_MIWT8_1_MO40_MGRIPMn1_NTn1_NTA0_NTB0_NTC0_NTD0_NTM0_NEPBS0_NLCA1_NLCB1_ONLL0_PGR2_PLR1_PKA0_SGROBn1_SIA3_SS1_SU32_SUM0_SUS256_SPO0_SRVW0_SSO0_SVW8_SK0_SKFTR0_SKXCCM0_SGRO0_TIN0_TLDS1_TLDSM1_ULSGRO1_USL1_UIOFGRO0_USFGROn1_VSn1_VWA8_VWB1_WSGRA0_WSGRB0_WS32_WG16_8_1_WGM8_WGMXCC1_WGMXCCGn1
    SolutionIndex: 76
    SolutionNameMin: Cijk_Alik_Bjlk_F8B8S_BH_Bias_SHB_HA_S_SAB_SCD_SAV_UserArgs_MT16x256x64_MI16x16x1_SN_LDSB0_AFC1_AG0_AFEM1_AFEM1_ASEM1_CLR1_CADS0_DTLA0_DTLB0_DTVA0_DTVB1_DTVSM0_DPLBn1_EPS1_ELFLR0_EMLLn1_FDSI0_GRPM1_GRVWA8_GRVWB8_GSUn1_GSUAMB_GSUC0_GSUWGMRR0_GLS0_ISA1201_IU1_K1_LDSTI0_LBSPPA128_LBSPPB0_LBSPPM0_LPA8_LPB0_LPM0_LRVW8_LWPMn1_MIAV1_MIWT1_8_MO40_MGRIPMn1_NTn1_NTA0_NTB0_NTC0_NTD0_NTM0_NEPBS0_NLCA1_NLCB4_ONLL0_PGR1_PLR1_PKA0_SGROBn1_SIA3_SS0_SU32_SUM0_SUS256_SPO0_SRVW0_SSO0_SVW8_SK0_SKFTR0_SKXCCM0_SGRO0_TIN0_TLDS1_TLDSM1_ULSGRO0_USL1_UIOFGRO0_USFGROn1_VSn1_VWA1_VWB1_WSGRA0_WSGRB0_WS32_WG16_4_1_WGM8_WGMXCC1_WGMXCCGn1
    SolutionIndex: 77
    SolutionNameMin: Cijk_Alik_Bjlk_F8B8S_BH_Bias_SHB_HA_S_SAB_SCD_SAV_UserArgs_MT64x64x32_MI16x16x1_SN_LDSB0_AFC1_AG0_AFEM1_AFEM1_ASEM32_CLR1_CADS0_DTLA0_DTLB0_DTVA1_DTVB1_DTVSM0_DPLBn1_EPS0_ELFLR0_EMLLn1_FDSI0_GRPM1_GRVWA8_GRVWB8_GSUn1_GSUAMB_GSUC0_GSUWGMRR0_GLS0_ISA1201_IU1_K1_LDSTI0_LBSPPA0_LBSPPB0_LBSPPM0_LPA0_LPB0_LPM0_LRVW8_LWPMn1_MIAV1_MIWT2_2_MO40_MGRIPMn1_NTn1_NTA0_NTB0_NTC0_NTD0_NTM0_NEPBS0_NLCA2_NLCB2_ONLL0_PGR1_PLR0_PKA0_SGROBn1_SIA3_SS1_SU32_SUM0_SUS256_SPO0_SRVW0_SSO0_SVW2_SK0_SKFTR0_SKXCCM0_SGRO0_TIN0_TLDS1_TLDSM1_ULSGRO0_USL1_UIOFGRO0_USFGROn1_VSn1_VWA2_VWB1_WSGRA0_WSGRB0_WS32_WG32_4_1_WGM8_WGMXCC1_WGMXCCGn1
    SolutionIndex: 78
    SolutionNameMin: Cijk_Alik_Bjlk_F8B8S_BH_Bias_SHB_HA_S_SAB_SCD_SAV_UserArgs_MT128x32x32_MI16x16x1_SN_LDSB0_AFC1_AG0_AFEM1_AFEM1_ASEM32_CLR1_CADS0_DTLA0_DTLB0_DTVA1_DTVB1_DTVSM0_DPLBn1_EPS0_ELFLR0_EMLLn1_FDSI0_GRPM1_GRVWA8_GRVWB8_GSUn1_GSUAMB_GSUC0_GSUWGMRR0_GLS0_ISA1201_IU1_K1_LDSTI0_LBSPPA0_LBSPPB0_LBSPPM0_LPA0_LPB0_LPM0_LRVW8_LWPMn1_MIAV1_MIWT4_1_MO40_MGRIPMn1_NTn1_NTA0_NTB0_NTC0_NTD0_NTM0_NEPBS0_NLCA2_NLCB1_ONLL0_PGR1_PLR0_PKA0_SGROBn1_SIA3_SS1_SU32_SUM0_SUS256_SPO0_SRVW0_SSO0_SVW4_SK0_SKFTR0_SKXCCM0_SGRO0_TIN0_TLDS1_TLDSM1_ULSGRO0_USL1_UIOFGRO0_USFGROn1_VSn1_VWA4_VWB1_WSGRA0_WSGRB0_WS32_WG32_4_1_WGM8_WGMXCC1_WGMXCCGn1
    SolutionIndex: 79
    SolutionNameMin: Cijk_Alik_Bjlk_F8B8S_BH_Bias_SHB_HA_S_SAB_SCD_SAV_UserArgs_MT128x128x64_MI16x16x1_SN_LDSB1_AFC1_AG0_AFEM1_AFEM1_ASEM1_CLR1_CADS0_DTLA0_DTLB0_DTVA0_DTVB0_DTVSM0_DPLBn1_EPS1_ELFLR0_EMLLn1_FDSI0_GRPM1_GRVWA16_GRVWB16_GSUn1_GSUAMB_GSUC0_GSUWGMRR0_GLS0_ISA1201_IU1_K1_LDSTI0_LBSPPA256_LBSPPB2048_LBSPPM0_LPA32_LPB64_LPM0_LRVW16_LWPMn1_MIAV1_MIWT4_4_MO40_MGRIPMn1_NTn1_NTA0_NTB0_NTC0_NTD0_NTM0_NEPBS0_NLCA1_NLCB1_ONLL0_PGR1_PLR1_PKA0_SGROBn1_SIA3_SS0_SU32_SUM0_SUS256_SPO0_SRVW0_SSO0_SVW8_SK0_SKFTR0_SKXCCM0_SGRO0_TIN0_TLDS1_TLDSM1_ULSGRO0_USL1_UIOFGRO0_USFGROn1_VSn1_VWA4_VWB4_WSGRA0_WSGRB0_WS32_WG32_4_1_WGM8_WGMXCC1_WGMXCCGn1
    SolutionIndex: 80
    SolutionNameMin: Cijk_Alik_Bjlk_F8B8S_BH_Bias_SHB_HA_S_SAB_SCD_SAV_UserArgs_MT128x64x32_MI16x16x1_SN_LDSB0_AFC1_AG0_AFEM1_AFEM1_ASEM1_CLR1_CADS0_DTLA0_DTLB0_DTVA0_DTVB1_DTVSM0_DPLBn1_EPS0_ELFLR0_EMLLn1_FDSI0_GRPM1_GRVWA8_GRVWB8_GSUn1_GSUAMB_GSUC0_GSUWGMRR0_GLS0_ISA1201_IU1_K1_LDSTI0_LBSPPA256_LBSPPB0_LBSPPM0_LPA8_LPB0_LPM0_LRVW8_LWPMn1_MIAV1_MIWT8_1_MO40_MGRIPMn1_NTn1_NTA0_NTB0_NTC0_NTD0_NTM0_NEPBS0_NLCA1_NLCB1_ONLL0_PGR2_PLR1_PKA0_SGROBn1_SIA3_SS0_SU32_SUM0_SUS256_SPO0_SRVW0_SSO0_SVW8_SK0_SKFTR0_SKXCCM0_SGRO0_TIN0_TLDS1_TLDSM1_ULSGRO0_USL1_UIOFGRO0_USFGROn1_VSn1_VWA8_VWB1_WSGRA0_WSGRB0_WS32_WG16_8_1_WGM8_WGMXCC1_WGMXCCGn1
    SolutionIndex: 81
    SolutionNameMin: Cijk_Alik_Bjlk_F8B8S_BH_Bias_SHB_HA_S_SAB_SCD_SAV_UserArgs_MT128x64x16_MI16x16x1_SN_LDSB1_AFC1_AG0_AFEM1_AFEM1_ASEM1_CLR1_CADS0_DTLA0_DTLB0_DTVA0_DTVB0_DTVSM0_DPLBn1_EPS1_ELFLR0_EMLLn1_FDSI0_GRPM1_GRVWA8_GRVWB8_GSUn1_GSUAMB_GSUC0_GSUWGMRR0_GLS0_ISA1201_IU1_K1_LDSTI0_LBSPPA128_LBSPPB512_LBSPPM0_LPA8_LPB16_LPM0_LRVW8_LWPMn1_MIAV1_MIWT8_1_MO40_MGRIPMn1_NTn1_NTA0_NTB0_NTC0_NTD0_NTM0_NEPBS0_NLCA1_NLCB1_ONLL0_PGR1_PLR1_PKA0_SGROBn1_SIA2_SS0_SU32_SUM0_SUS256_SPO0_SRVW0_SSO0_SVW8_SK0_SKFTR0_SKXCCM0_SGRO0_TIN0_TLDS1_TLDSM1_ULSGRO0_USL1_UIOFGRO0_USFGROn1_VSn1_VWA8_VWB1_WSGRA0_WSGRB0_WS32_WG16_8_1_WGM8_WGMXCC1_WGMXCCGn1
    SolutionIndex: 82
    SolutionNameMin: Cijk_Alik_Bjlk_F8B8S_BH_Bias_SHB_HA_S_SAB_SCD_SAV_UserArgs_MT128x64x16_MI16x16x1_SN_LDSB0_AFC1_AG0_AFEM1_AFEM1_ASEM1_CLR0_CADS0_DTLA0_DTLB0_DTVA0_DTVB0_DTVSM0_DPLBn1_EPS1_ELFLR0_EMLLn1_FDSI0_GRPM1_GRVWA8_GRVWB8_GSUn1_GSUAMB_GSUC0_GSUWGMRR0_GLS0_ISA1201_IU1_K1_LDSTI0_LBSPPA128_LBSPPB512_LBSPPM0_LPA8_LPB16_LPM0_LRVW8_LWPMn1_MIAV1_MIWT8_1_MO40_MGRIPMn1_NTn1_NTA0_NTB0_NTC0_NTD0_NTM0_NEPBS0_NLCA1_NLCB1_ONLL0_PGR1_PLR0_PKA0_SGROBn1_SIA3_SS1_SU32_SUM0_SUS256_SPO0_SRVW0_SSO0_SVW8_SK0_SKFTR0_SKXCCM0_SGRO0_TIN0_TLDS1_TLDSM1_ULSGRO0_USL1_UIOFGRO0_USFGROn1_VSn1_VWA8_VWB1_WSGRA0_WSGRB0_WS32_WG16_8_1_WGM8_WGMXCC1_WGMXCCGn1
    SolutionIndex: 83
    SolutionNameMin: Cijk_Alik_Bjlk_F8B8S_BH_Bias_SHB_HA_S_SAB_SCD_SAV_UserArgs_MT16x128x32_MI16x16x1_SN_LDSB0_AFC1_AG0_AFEM1_AFEM1_ASEM1_CLR1_CADS0_DTLA0_DTLB0_DTVA0_DTVB1_DTVSM0_DPLBn1_EPS0_ELFLR0_EMLLn1_FDSI0_GRPM1_GRVWA8_GRVWB8_GSUn1_GSUAMB_GSUC0_GSUWGMRR0_GLS0_ISA1201_IU1_K1_LDSTI0_LBSPPA128_LBSPPB0_LBSPPM0_LPA8_LPB0_LPM0_LRVW8_LWPMn1_MIAV1_MIWT1_8_MO40_MGRIPMn1_NTn1_NTA0_NTB0_NTC0_NTD0_NTM0_NEPBS0_NLCA1_NLCB2_ONLL0_PGR2_PLR1_PKA0_SGROBn1_SIA3_SS0_SU32_SUM0_SUS256_SPO0_SRVW0_SSO0_SVW8_SK0_SKFTR0_SKXCCM0_SGRO0_TIN0_TLDS1_TLDSM1_ULSGRO0_USL1_UIOFGRO0_USFGROn1_VSn1_VWA1_VWB1_WSGRA0_WSGRB0_WS32_WG16_2_1_WGM8_WGMXCC1_WGMXCCGn1
    SolutionIndex: 84
    SolutionNameMin: Cijk_Alik_Bjlk_F8B8S_BH_Bias_SHB_HA_S_SAB_SCD_SAV_UserArgs_MT512x16x64_MI16x16x1_SN_LDSB1_AFC1_AG0_AFEM1_AFEM1_ASEM1_CLR1_CADS0_DTLA0_DTLB0_DTVA0_DTVB0_DTVSM0_DPLBn1_EPS1_ELFLR0_EMLLn1_FDSI0_GRPM1_GRVWA16_GRVWB8_GSUn1_GSUAMB_GSUC0_GSUWGMRR0_GLS0_ISA1201_IU1_K1_LDSTI0_LBSPPA512_LBSPPB256_LBSPPM0_LPA32_LPB16_LPM0_LRVW16_LWPMn1_MIAV1_MIWT8_1_MO40_MGRIPMn1_NTn1_NTA0_NTB0_NTC0_NTD0_NTM0_NEPBS0_NLCA1_NLCB1_ONLL0_PGR1_PLR1_PKA0_SGROBn1_SIA3_SS1_SU32_SUM0_SUS256_SPO0_SRVW0_SSO0_SVW8_SK0_SKFTR0_SKXCCM0_SGRO0_TIN0_TLDS1_TLDSM1_ULSGRO0_USL1_UIOFGRO0_USFGROn1_VSn1_VWA8_VWB1_WSGRA0_WSGRB0_WS32_WG64_2_1_WGM8_WGMXCC1_WGMXCCGn1
    SolutionIndex: 85
    SolutionNameMin: Cijk_Alik_Bjlk_F8B8S_BH_Bias_SHB_HA_S_SAB_SCD_SAV_UserArgs_MT128x128x16_MI16x16x1_SN_LDSB0_AFC1_AG0_AFEM1_AFEM1_ASEM1_CLR0_CADS0_DTLA0_DTLB0_DTVA0_DTVB0_DTVSM0_DPLBn1_EPS1_ELFLR0_EMLLn1_FDSI0_GRPM1_GRVWA8_GRVWB16_GSUn1_GSUAMB_GSUC0_GSUWGMRR0_GLS0_ISA1201_IU1_K1_LDSTI0_LBSPPA128_LBSPPB1024_LBSPPM0_LPA8_LPB32_LPM0_LRVW8_LWPMn1_MIAV1_MIWT8_2_MO40_MGRIPMn1_NTn1_NTA0_NTB0_NTC0_NTD0_NTM0_NEPBS0_NLCA1_NLCB1_ONLL0_PGR1_PLR0_PKA0_SGROBn1_SIA3_SS1_SU32_SUM0_SUS256_SPO0_SRVW0_SSO0_SVW8_SK0_SKFTR0_SKXCCM0_SGRO0_TIN0_TLDS1_TLDSM1_ULSGRO0_USL1_UIOFGRO0_USFGROn1_VSn1_VWA8_VWB2_WSGRA0_WSGRB0_WS32_WG16_8_1_WGM8_WGMXCC1_WGMXCCGn1
    SolutionIndex: 86
    SolutionNameMin: Cijk_Alik_Bjlk_F8B8S_BH_Bias_SHB_HA_S_SAB_SCD_SAV_UserArgs_MT512x16x64_MI16x16x1_SN_LDSB1_AFC1_AG0_AFEM1_AFEM1_ASEM1_CLR1_CADS0_DTLA0_DTLB0_DTVA0_DTVB1_DTVSM0_DPLBn1_EPS1_ELFLR0_EMLLn1_FDSI0_GRPM1_GRVWA8_GRVWB8_GSUn1_GSUAMB_GSUC0_GSUWGMRR0_GLS0_ISA1201_IU1_K1_LDSTI0_LBSPPA512_LBSPPB0_LBSPPM0_LPA8_LPB0_LPM0_LRVW8_LWPMn1_MIAV1_MIWT8_1_MO40_MGRIPMn1_NTn1_NTA0_NTB0_NTC0_NTD0_NTM0_NEPBS0_NLCA1_NLCB1_ONLL0_PGR1_PLR1_PKA0_SGROBn1_SIA3_SS1_SU32_SUM0_SUS256_SPO0_SRVW0_SSO0_SVW8_SK0_SKFTR0_SKXCCM0_SGRO0_TIN0_TLDS1_TLDSM1_ULSGRO0_USL1_UIOFGRO0_USFGROn1_VSn1_VWA8_VWB1_WSGRA0_WSGRB0_WS32_WG64_2_1_WGM8_WGMXCC1_WGMXCCGn1
    SolutionIndex: 87
    SolutionNameMin: Cijk_Alik_Bjlk_F8B8S_BH_Bias_SHB_HA_S_SAB_SCD_SAV_UserArgs_MT32x16x64_MI16x16x1_SN_LDSB0_AFC1_AG0_AFEM1_AFEM1_ASEM1_CLR1_CADS0_DTLA0_DTLB0_DTVA0_DTVB1_DTVSM0_DPLBn1_EPS0_ELFLR0_EMLLn1_FDSI0_GRPM1_GRVWA8_GRVWB8_GSUn1_GSUAMB_GSUC0_GSUWGMRR0_GLS0_ISA1201_IU1_K1_LDSTI0_LBSPPA128_LBSPPB0_LBSPPM0_LPA8_LPB0_LPM0_LRVW8_LWPMn1_MIAV1_MIWT1_1_MO40_MGRIPMn1_NTn1_NTA0_NTB0_NTC0_NTD0_NTM0_NEPBS0_NLCA1_NLCB1_ONLL0_PGR2_PLR1_PKA0_SGROBn1_SIA3_SS1_SU32_SUM0_SUS256_SPO0_SRVW0_SSO0_SVW1_SK0_SKFTR0_SKXCCM0_SGRO0_TIN0_TLDS1_TLDSM1_ULSGRO0_USL1_UIOFGRO0_USFGROn1_VSn1_VWA1_VWB1_WSGRA0_WSGRB0_WS32_WG32_2_1_WGM8_WGMXCC1_WGMXCCGn1
    SolutionIndex: 88
    SolutionNameMin: Cijk_Alik_Bjlk_F8B8S_BH_Bias_SHB_HA_S_SAB_SCD_SAV_UserArgs_MT128x32x32_MI16x16x1_SN_LDSB1_AFC1_AG0_AFEM1_AFEM1_ASEM1_CLR1_CADS0_DTLA0_DTLB0_DTVA0_DTVB0_DTVSM0_DPLBn1_EPS0_ELFLR0_EMLLn1_FDSI0_GRPM1_GRVWA8_GRVWB8_GSUn1_GSUAMB_GSUC0_GSUWGMRR0_GLS0_ISA1201_IU2_K1_LDSTI0_LBSPPA128_LBSPPB256_LBSPPM0_LPA8_LPB16_LPM0_LRVW8_LWPMn1_MIAV1_MIWT4_1_MO40_MGRIPMn1_NTn1_NTA0_NTB0_NTC0_NTD0_NTM0_NEPBS0_NLCA1_NLCB1_ONLL0_PGR2_PLR1_PKA0_SGROBn1_SIA2_SS0_SU32_SUM0_SUS256_SPO0_SRVW0_SSO0_SVW8_SK0_SKFTR0_SKXCCM0_SGRO0_TIN0_TLDS1_TLDSM1_ULSGRO1_USL1_UIOFGRO0_USFGROn1_VSn1_VWA4_VWB1_WSGRA0_WSGRB0_WS32_WG32_4_1_WGM8_WGMXCC1_WGMXCCGn1
    SolutionIndex: 89
    SolutionNameMin: Cijk_Alik_Bjlk_F8B8S_BH_Bias_SHB_HA_S_SAB_SCD_SAV_UserArgs_MT64x128x64_MI16x16x1_SN_LDSB0_AFC1_AG0_AFEM1_AFEM1_ASEM1_CLR1_CADS0_DTLA0_DTLB0_DTVA0_DTVB1_DTVSM0_DPLBn1_EPS1_ELFLR0_EMLLn1_FDSI0_GRPM1_GRVWA8_GRVWB8_GSUn1_GSUAMB_GSUC0_GSUWGMRR0_GLS0_ISA1201_IU1_K1_LDSTI0_LBSPPA128_LBSPPB0_LBSPPM0_LPA8_LPB0_LPM0_LRVW8_LWPMn1_MIAV1_MIWT1_8_MO40_MGRIPMn1_NTn1_NTA0_NTB0_NTC0_NTD0_NTM0_NEPBS0_NLCA1_NLCB4_ONLL0_PGR1_PLR1_PKA0_SGROBn1_SIA3_SS0_SU32_SUM0_SUS256_SPO0_SRVW0_SSO0_SVW8_SK0_SKFTR0_SKXCCM0_SGRO0_TIN0_TLDS1_TLDSM1_ULSGRO0_USL1_UIOFGRO0_USFGROn1_VSn1_VWA1_VWB1_WSGRA0_WSGRB0_WS32_WG64_2_1_WGM8_WGMXCC1_WGMXCCGn1
    SolutionIndex: 90
    SolutionNameMin: Cijk_Alik_Bjlk_F8B8S_BH_Bias_SHB_HA_S_SAB_SCD_SAV_UserArgs_MT128x32x64_MI16x16x1_SN_LDSB0_AFC1_AG0_AFEM1_AFEM1_ASEM1_CLR1_CADS0_DTLA0_DTLB0_DTVA0_DTVB0_DTVSM0_DPLBn1_EPS0_ELFLR0_EMLLn1_FDSI0_GRPM1_GRVWA16_GRVWB16_GSUn1_GSUAMB_GSUC0_GSUWGMRR0_GLS0_ISA1201_IU1_K1_LDSTI0_LBSPPA256_LBSPPB512_LBSPPM0_LPA32_LPB16_LPM0_LRVW16_LWPMn1_MIAV1_MIWT4_1_MO40_MGRIPMn1_NTn1_NTA0_NTB0_NTC0_NTD0_NTM0_NEPBS0_NLCA1_NLCB1_ONLL0_PGR2_PLR1_PKA0_SGROBn1_SIA3_SS1_SU32_SUM0_SUS256_SPO0_SRVW0_SSO0_SVW4_SK0_SKFTR0_SKXCCM0_SGRO0_TIN0_TLDS1_TLDSM1_ULSGRO1_USL1_UIOFGRO0_USFGROn1_VSn1_VWA4_VWB1_WSGRA0_WSGRB0_WS32_WG32_4_1_WGM8_WGMXCC1_WGMXCCGn1
    SolutionIndex: 91
    SolutionNameMin: Cijk_Alik_Bjlk_F8B8S_BH_Bias_SHB_HA_S_SAB_SCD_SAV_UserArgs_MT128x128x32_MI16x16x1_SN_LDSB0_AFC1_AG0_AFEM1_AFEM1_ASEM1_CLR1_CADS0_DTLA0_DTLB0_DTVA0_DTVB1_DTVSM0_DPLBn1_EPS0_ELFLR0_EMLLn1_FDSI0_GRPM1_GRVWA8_GRVWB8_GSUn1_GSUAMB_GSUC0_GSUWGMRR0_GLS0_ISA1201_IU1_K1_LDSTI0_LBSPPA256_LBSPPB0_LBSPPM0_LPA8_LPB0_LPM0_LRVW8_LWPMn1_MIAV1_MIWT8_2_MO40_MGRIPMn1_NTn1_NTA0_NTB0_NTC0_NTD0_NTM0_NEPBS0_NLCA1_NLCB2_ONLL0_PGR2_PLR1_PKA0_SGROBn1_SIA3_SS0_SU32_SUM0_SUS256_SPO0_SRVW0_SSO0_SVW8_SK0_SKFTR0_SKXCCM0_SGRO0_TIN0_TLDS1_TLDSM1_ULSGRO0_USL1_UIOFGRO0_USFGROn1_VSn1_VWA8_VWB1_WSGRA0_WSGRB0_WS32_WG16_8_1_WGM8_WGMXCC1_WGMXCCGn1
    SolutionIndex: 92
    SolutionNameMin: Cijk_Alik_Bjlk_F8B8S_BH_Bias_SHB_HA_S_SAB_SCD_SAV_UserArgs_MT16x256x32_MI16x16x1_SN_LDSB0_AFC1_AG0_AFEM1_AFEM1_ASEM32_CLR1_CADS0_DTLA0_DTLB0_DTVA1_DTVB1_DTVSM0_DPLBn1_EPS0_ELFLR0_EMLLn1_FDSI0_GRPM1_GRVWA8_GRVWB8_GSUn1_GSUAMB_GSUC0_GSUWGMRR0_GLS0_ISA1201_IU1_K1_LDSTI0_LBSPPA0_LBSPPB0_LBSPPM0_LPA0_LPB0_LPM0_LRVW8_LWPMn1_MIAV1_MIWT1_8_MO40_MGRIPMn1_NTn1_NTA0_NTB0_NTC0_NTD0_NTM0_NEPBS0_NLCA2_NLCB2_ONLL0_PGR1_PLR0_PKA0_SGROBn1_SIA3_SS0_SU32_SUM0_SUS256_SPO0_SRVW0_SSO0_SVW8_SK0_SKFTR0_SKXCCM0_SGRO0_TIN0_TLDS1_TLDSM1_ULSGRO0_USL1_UIOFGRO0_USFGROn1_VSn1_VWA1_VWB1_WSGRA0_WSGRB0_WS32_WG16_4_1_WGM8_WGMXCC1_WGMXCCGn1
    SolutionIndex: 93
    SolutionNameMin: Cijk_Alik_Bjlk_F8B8S_BH_Bias_SHB_HA_S_SAB_SCD_SAV_UserArgs_MT128x128x32_MI16x16x1_SN_LDSB0_AFC1_AG0_AFEM1_AFEM1_ASEM1_CLR1_CADS0_DTLA0_DTLB0_DTVA0_DTVB1_DTVSM0_DPLBn1_EPS1_ELFLR0_EMLLn1_FDSI0_GRPM1_GRVWA8_GRVWB8_GSUn1_GSUAMB_GSUC0_GSUWGMRR0_GLS0_ISA1201_IU1_K1_LDSTI0_LBSPPA256_LBSPPB0_LBSPPM0_LPA8_LPB0_LPM0_LRVW8_LWPMn1_MIAV1_MIWT8_2_MO40_MGRIPMn1_NTn1_NTA0_NTB0_NTC0_NTD0_NTM0_NEPBS0_NLCA1_NLCB2_ONLL0_PGR1_PLR1_PKA0_SGROBn1_SIA3_SS1_SU32_SUM0_SUS256_SPO0_SRVW0_SSO0_SVW8_SK0_SKFTR0_SKXCCM0_SGRO0_TIN0_TLDS1_TLDSM1_ULSGRO0_USL1_UIOFGRO0_USFGROn1_VSn1_VWA8_VWB1_WSGRA0_WSGRB0_WS32_WG16_8_1_WGM8_WGMXCC1_WGMXCCGn1
    SolutionIndex: 94
    SolutionNameMin: Cijk_Alik_Bjlk_F8B8S_BH_Bias_SHB_HA_S_SAB_SCD_SAV_UserArgs_MT128x128x32_MI16x16x1_SN_LDSB0_AFC1_AG0_AFEM1_AFEM1_ASEM1_CLR1_CADS0_DTLA0_DTLB0_DTVA0_DTVB1_DTVSM0_DPLBn1_EPS0_ELFLR0_EMLLn1_FDSI0_GRPM1_GRVWA8_GRVWB8_GSUn1_GSUAMB_GSUC0_GSUWGMRR0_GLS0_ISA1201_IU1_K1_LDSTI0_LBSPPA256_LBSPPB0_LBSPPM0_LPA8_LPB0_LPM0_LRVW8_LWPMn1_MIAV1_MIWT8_2_MO40_MGRIPMn1_NTn1_NTA0_NTB0_NTC0_NTD0_NTM0_NEPBS0_NLCA1_NLCB2_ONLL0_PGR2_PLR1_PKA0_SGROBn1_SIA3_SS1_SU32_SUM0_SUS256_SPO0_SRVW0_SSO0_SVW8_SK0_SKFTR0_SKXCCM0_SGRO0_TIN0_TLDS1_TLDSM1_ULSGRO0_USL1_UIOFGRO0_USFGROn1_VSn1_VWA8_VWB1_WSGRA0_WSGRB0_WS32_WG16_8_1_WGM8_WGMXCC1_WGMXCCGn1
    SolutionIndex: 95
    SolutionNameMin: Cijk_Alik_Bjlk_F8B8S_BH_Bias_SHB_HA_S_SAB_SCD_SAV_UserArgs_MT16x32x128_MI16x16x1_SN_LDSB0_AFC1_AG0_AFEM1_AFEM1_ASEM1_CLR1_CADS0_DTLA0_DTLB0_DTVA0_DTVB1_DTVSM0_DPLBn1_EPS0_ELFLR0_EMLLn1_FDSI0_GRPM1_GRVWA8_GRVWB8_GSUn1_GSUAMB_GSUC0_GSUWGMRR0_GLS0_ISA1201_IU1_K1_LDSTI0_LBSPPA128_LBSPPB0_LBSPPM0_LPA8_LPB0_LPM0_LRVW8_LWPMn1_MIAV1_MIWT1_1_MO40_MGRIPMn1_NTn1_NTA0_NTB0_NTC0_NTD0_NTM0_NEPBS0_NLCA1_NLCB1_ONLL0_PGR2_PLR1_PKA0_SGROBn1_SIA3_SS0_SU32_SUM0_SUS256_SPO0_SRVW0_SSO0_SVW8_SK0_SKFTR0_SKXCCM0_SGRO0_TIN0_TLDS1_TLDSM1_ULSGRO0_USL1_UIOFGRO0_USFGROn1_VSn1_VWA1_VWB1_WSGRA0_WSGRB0_WS32_WG16_4_1_WGM8_WGMXCC1_WGMXCCGn1
    SolutionIndex: 96
    SolutionNameMin: Cijk_Alik_Bjlk_F8B8S_BH_Bias_SHB_HA_S_SAB_SCD_SAV_UserArgs_MT16x16x256_MI16x16x1_SN_LDSB0_AFC1_AG0_AFEM1_AFEM1_ASEM256_CLR1_CADS0_DTLA0_DTLB0_DTVA1_DTVB1_DTVSM0_DPLBn1_EPS0_ELFLR0_EMLLn1_FDSI0_GRPM1_GRVWA8_GRVWB8_GSUn1_GSUAMB_GSUC0_GSUWGMRR0_GLS0_ISA1201_IU1_K1_LDSTI0_LBSPPA0_LBSPPB0_LBSPPM0_LPA0_LPB0_LPM0_LRVW8_LWPMn1_MIAV1_MIWT1_1_MO40_MGRIPMn1_NTn1_NTA0_NTB0_NTC0_NTD0_NTM0_NEPBS0_NLCA16_NLCB1_ONLL0_PGR1_PLR0_PKA0_SGROBn1_SIA3_SS0_SU32_SUM0_SUS256_SPO0_SRVW0_SSO0_SVW8_SK0_SKFTR0_SKXCCM0_SGRO0_TIN0_TLDS1_TLDSM1_ULSGRO0_USL1_UIOFGRO0_USFGROn1_VSn1_VWA1_VWB1_WSGRA0_WSGRB0_WS32_WG16_2_1_WGM8_WGMXCC1_WGMXCCGn1
    SolutionIndex: 97
    SolutionNameMin: Cijk_Alik_Bjlk_F8B8S_BH_Bias_SHB_HA_S_SAB_SCD_SAV_UserArgs_MT32x32x128_MI16x16x1_SN_LDSB0_AFC1_AG0_AFEM1_AFEM1_ASEM1_CLR1_CADS0_DTLA0_DTLB0_DTVA0_DTVB1_DTVSM0_DPLBn1_EPS1_ELFLR0_EMLLn1_FDSI0_GRPM1_GRVWA8_GRVWB8_GSUn1_GSUAMB_GSUC0_GSUWGMRR0_GLS0_ISA1201_IU1_K1_LDSTI0_LBSPPA128_LBSPPB0_LBSPPM0_LPA8_LPB0_LPM0_LRVW8_LWPMn1_MIAV1_MIWT1_1_MO40_MGRIPMn1_NTn1_NTA0_NTB0_NTC0_NTD0_NTM0_NEPBS0_NLCA1_NLCB1_ONLL0_PGR1_PLR1_PKA0_SGROBn1_SIA3_SS0_SU32_SUM0_SUS256_SPO0_SRVW0_SSO0_SVW8_SK0_SKFTR0_SKXCCM0_SGRO0_TIN0_TLDS1_TLDSM1_ULSGRO0_USL1_UIOFGRO0_USFGROn1_VSn1_VWA1_VWB1_WSGRA0_WSGRB0_WS32_WG32_4_1_WGM8_WGMXCC1_WGMXCCGn1
    SolutionIndex: 98
    SolutionNameMin: Cijk_Alik_Bjlk_F8B8S_BH_Bias_SHB_HA_S_SAB_SCD_SAV_UserArgs_MT16x32x256_MI16x16x1_SN_LDSB0_AFC1_AG0_AFEM1_AFEM1_ASEM1_CLR1_CADS0_DTLA0_DTLB0_DTVA0_DTVB1_DTVSM0_DPLBn1_EPS1_ELFLR0_EMLLn1_FDSI0_GRPM1_GRVWA8_GRVWB8_GSUn1_GSUAMB_GSUC0_GSUWGMRR0_GLS0_ISA1201_IU1_K1_LDSTI0_LBSPPA256_LBSPPB0_LBSPPM0_LPA8_LPB0_LPM0_LRVW8_LWPMn1_MIAV1_MIWT1_1_MO40_MGRIPMn1_NTn1_NTA0_NTB0_NTC0_NTD0_NTM0_NEPBS0_NLCA1_NLCB1_ONLL0_PGR1_PLR1_PKA0_SGROBn1_SIA3_SS0_SU32_SUM0_SUS256_SPO0_SRVW0_SSO0_SVW8_SK0_SKFTR0_SKXCCM0_SGRO0_TIN0_TLDS1_TLDSM1_ULSGRO0_USL1_UIOFGRO0_USFGROn1_VSn1_VWA1_VWB1_WSGRA0_WSGRB0_WS32_WG16_4_1_WGM8_WGMXCC1_WGMXCCGn1
    SolutionIndex: 99
    SolutionNameMin: Cijk_Alik_Bjlk_F8B8S_BH_Bias_SHB_HA_S_SAB_SCD_SAV_UserArgs_MT16x32x128_MI16x16x1_SN_LDSB0_AFC1_AG0_AFEM1_AFEM1_ASEM1_CLR1_CADS0_DTLA0_DTLB0_DTVA0_DTVB1_DTVSM0_DPLBn1_EPS1_ELFLR0_EMLLn1_FDSI0_GRPM1_GRVWA8_GRVWB8_GSUn1_GSUAMB_GSUC0_GSUWGMRR0_GLS0_ISA1201_IU1_K1_LDSTI0_LBSPPA128_LBSPPB0_LBSPPM0_LPA8_LPB0_LPM0_LRVW8_LWPMn1_MIAV1_MIWT1_1_MO40_MGRIPMn1_NTn1_NTA0_NTB0_NTC0_NTD0_NTM0_NEPBS0_NLCA1_NLCB1_ONLL0_PGR1_PLR1_PKA0_SGROBn1_SIA3_SS0_SU32_SUM0_SUS256_SPO0_SRVW0_SSO0_SVW8_SK0_SKFTR0_SKXCCM0_SGRO0_TIN0_TLDS1_TLDSM1_ULSGRO0_USL1_UIOFGRO0_USFGROn1_VSn1_VWA1_VWB1_WSGRA0_WSGRB0_WS32_WG16_4_1_WGM8_WGMXCC1_WGMXCCGn1
    SolutionIndex: 100
    SolutionNameMin: Cijk_Alik_Bjlk_F8B8S_BH_Bias_SHB_HA_S_SAB_SCD_SAV_UserArgs_MT16x32x128_MI16x16x1_SN_LDSB0_AFC1_AG0_AFEM1_AFEM1_ASEM128_CLR1_CADS0_DTLA0_DTLB0_DTVA1_DTVB1_DTVSM0_DPLBn1_EPS0_ELFLR0_EMLLn1_FDSI0_GRPM1_GRVWA8_GRVWB8_GSUn1_GSUAMB_GSUC0_GSUWGMRR0_GLS0_ISA1201_IU1_K1_LDSTI0_LBSPPA0_LBSPPB0_LBSPPM0_LPA0_LPB0_LPM0_LRVW8_LWPMn1_MIAV1_MIWT1_1_MO40_MGRIPMn1_NTn1_NTA0_NTB0_NTC0_NTD0_NTM0_NEPBS0_NLCA8_NLCB1_ONLL0_PGR1_PLR0_PKA0_SGROBn1_SIA3_SS0_SU32_SUM0_SUS256_SPO0_SRVW0_SSO0_SVW8_SK0_SKFTR0_SKXCCM0_SGRO0_TIN0_TLDS1_TLDSM1_ULSGRO0_USL1_UIOFGRO0_USFGROn1_VSn1_VWA1_VWB1_WSGRA0_WSGRB0_WS32_WG16_4_1_WGM8_WGMXCC1_WGMXCCGn1
    SolutionIndex: 101
    SolutionNameMin: Cijk_Alik_Bjlk_F8B8S_BH_Bias_SHB_HA_S_SAB_SCD_SAV_UserArgs_MT16x16x128_MI16x16x1_SN_LDSB0_AFC1_AG0_AFEM1_AFEM1_ASEM128_CLR1_CADS0_DTLA0_DTLB0_DTVA1_DTVB1_DTVSM0_DPLBn1_EPS0_ELFLR0_EMLLn1_FDSI0_GRPM1_GRVWA8_GRVWB8_GSUn1_GSUAMB_GSUC0_GSUWGMRR0_GLS0_ISA1201_IU1_K1_LDSTI0_LBSPPA0_LBSPPB0_LBSPPM0_LPA0_LPB0_LPM0_LRVW8_LWPMn1_MIAV1_MIWT1_1_MO40_MGRIPMn1_NTn1_NTA0_NTB0_NTC0_NTD0_NTM0_NEPBS0_NLCA8_NLCB1_ONLL0_PGR1_PLR0_PKA0_SGROBn1_SIA3_SS0_SU32_SUM0_SUS256_SPO0_SRVW0_SSO0_SVW8_SK0_SKFTR0_SKXCCM0_SGRO0_TIN0_TLDS1_TLDSM1_ULSGRO0_USL1_UIOFGRO0_USFGROn1_VSn1_VWA1_VWB1_WSGRA0_WSGRB0_WS32_WG16_2_1_WGM8_WGMXCC1_WGMXCCGn1
    SolutionIndex: 102
    SolutionNameMin: Cijk_Alik_Bjlk_F8B8S_BH_Bias_SHB_HA_S_SAB_SCD_SAV_UserArgs_MT16x32x128_MI16x16x1_SN_LDSB0_AFC1_AG0_AFEM1_AFEM1_ASEM1_CLR1_CADS0_DTLA0_DTLB0_DTVA0_DTVB1_DTVSM0_DPLBn1_EPS1_ELFLR0_EMLLn1_FDSI0_GRPM1_GRVWA8_GRVWB8_GSUn1_GSUAMB_GSUC0_GSUWGMRR0_GLS0_ISA1201_IU1_K1_LDSTI0_LBSPPA128_LBSPPB0_LBSPPM0_LPA8_LPB0_LPM0_LRVW8_LWPMn1_MIAV1_MIWT1_1_MO40_MGRIPMn1_NTn1_NTA0_NTB0_NTC0_NTD0_NTM0_NEPBS0_NLCA1_NLCB1_ONLL0_PGR1_PLR1_PKA0_SGROBn1_SIA3_SS1_SU32_SUM0_SUS256_SPO0_SRVW0_SSO0_SVW1_SK0_SKFTR0_SKXCCM0_SGRO0_TIN0_TLDS1_TLDSM1_ULSGRO0_USL1_UIOFGRO0_USFGROn1_VSn1_VWA1_VWB1_WSGRA0_WSGRB0_WS32_WG16_4_1_WGM8_WGMXCC1_WGMXCCGn1
    SolutionIndex: 103
    SolutionNameMin: Cijk_Alik_Bjlk_F8B8S_BH_Bias_SHB_HA_S_SAB_SCD_SAV_UserArgs_MT32x16x128_MI16x16x1_SN_LDSB0_AFC1_AG0_AFEM1_AFEM1_ASEM128_CLR1_CADS0_DTLA0_DTLB0_DTVA1_DTVB1_DTVSM0_DPLBn1_EPS0_ELFLR0_EMLLn1_FDSI0_GRPM1_GRVWA8_GRVWB8_GSUn1_GSUAMB_GSUC0_GSUWGMRR0_GLS0_ISA1201_IU1_K1_LDSTI0_LBSPPA0_LBSPPB0_LBSPPM0_LPA0_LPB0_LPM0_LRVW8_LWPMn1_MIAV1_MIWT1_1_MO40_MGRIPMn1_NTn1_NTA0_NTB0_NTC0_NTD0_NTM0_NEPBS0_NLCA8_NLCB1_ONLL0_PGR1_PLR0_PKA0_SGROBn1_SIA3_SS0_SU32_SUM0_SUS256_SPO0_SRVW0_SSO0_SVW8_SK0_SKFTR0_SKXCCM0_SGRO0_TIN0_TLDS1_TLDSM1_ULSGRO0_USL1_UIOFGRO0_USFGROn1_VSn1_VWA1_VWB1_WSGRA0_WSGRB0_WS32_WG32_2_1_WGM8_WGMXCC1_WGMXCCGn1
    SolutionIndex: 104
    SolutionNameMin: Cijk_Alik_Bjlk_F8B8S_BH_Bias_SHB_HA_S_SAB_SCD_SAV_UserArgs_MT16x32x256_MI16x16x1_SN_LDSB0_AFC1_AG0_AFEM1_AFEM1_ASEM1_CLR1_CADS0_DTLA0_DTLB0_DTVA0_DTVB1_DTVSM0_DPLBn1_EPS0_ELFLR0_EMLLn1_FDSI0_GRPM1_GRVWA8_GRVWB8_GSUn1_GSUAMB_GSUC0_GSUWGMRR0_GLS0_ISA1201_IU1_K1_LDSTI0_LBSPPA256_LBSPPB0_LBSPPM0_LPA8_LPB0_LPM0_LRVW8_LWPMn1_MIAV1_MIWT1_1_MO40_MGRIPMn1_NTn1_NTA0_NTB0_NTC0_NTD0_NTM0_NEPBS0_NLCA1_NLCB1_ONLL0_PGR2_PLR1_PKA0_SGROBn1_SIA3_SS0_SU32_SUM0_SUS256_SPO0_SRVW0_SSO0_SVW8_SK0_SKFTR0_SKXCCM0_SGRO0_TIN0_TLDS1_TLDSM1_ULSGRO0_USL1_UIOFGRO0_USFGROn1_VSn1_VWA1_VWB1_WSGRA0_WSGRB0_WS32_WG16_4_1_WGM8_WGMXCC1_WGMXCCGn1
    SolutionIndex: 105
    SolutionNameMin: Cijk_Alik_Bjlk_F8B8S_BH_Bias_SHB_HA_S_SAB_SCD_SAV_UserArgs_MT16x32x256_MI16x16x1_SN_LDSB0_AFC1_AG0_AFEM1_AFEM1_ASEM256_CLR1_CADS0_DTLA0_DTLB0_DTVA1_DTVB1_DTVSM0_DPLBn1_EPS0_ELFLR0_EMLLn1_FDSI0_GRPM1_GRVWA8_GRVWB8_GSUn1_GSUAMB_GSUC0_GSUWGMRR0_GLS0_ISA1201_IU1_K1_LDSTI0_LBSPPA0_LBSPPB0_LBSPPM0_LPA0_LPB0_LPM0_LRVW8_LWPMn1_MIAV1_MIWT1_1_MO40_MGRIPMn1_NTn1_NTA0_NTB0_NTC0_NTD0_NTM0_NEPBS0_NLCA16_NLCB1_ONLL0_PGR1_PLR0_PKA0_SGROBn1_SIA3_SS0_SU32_SUM0_SUS256_SPO0_SRVW0_SSO0_SVW8_SK0_SKFTR0_SKXCCM0_SGRO0_TIN0_TLDS1_TLDSM1_ULSGRO0_USL1_UIOFGRO0_USFGROn1_VSn1_VWA1_VWB1_WSGRA0_WSGRB0_WS32_WG16_4_1_WGM8_WGMXCC1_WGMXCCGn1
    SolutionIndex: 106
    SolutionNameMin: Cijk_Alik_Bjlk_F8B8S_BH_Bias_SHB_HA_S_SAB_SCD_SAV_UserArgs_MT32x32x128_MI16x16x1_SN_LDSB0_AFC1_AG0_AFEM1_AFEM1_ASEM1_CLR1_CADS0_DTLA0_DTLB0_DTVA0_DTVB1_DTVSM0_DPLBn1_EPS1_ELFLR0_EMLLn1_FDSI0_GRPM1_GRVWA8_GRVWB8_GSUn1_GSUAMB_GSUC0_GSUWGMRR0_GLS0_ISA1201_IU1_K1_LDSTI0_LBSPPA128_LBSPPB0_LBSPPM0_LPA8_LPB0_LPM0_LRVW8_LWPMn1_MIAV1_MIWT1_1_MO40_MGRIPMn1_NTn1_NTA0_NTB0_NTC0_NTD0_NTM0_NEPBS0_NLCA1_NLCB1_ONLL0_PGR1_PLR1_PKA0_SGROBn1_SIA3_SS1_SU32_SUM0_SUS256_SPO0_SRVW0_SSO0_SVW1_SK0_SKFTR0_SKXCCM0_SGRO0_TIN0_TLDS1_TLDSM1_ULSGRO0_USL1_UIOFGRO0_USFGROn1_VSn1_VWA1_VWB1_WSGRA0_WSGRB0_WS32_WG32_4_1_WGM8_WGMXCC1_WGMXCCGn1
    SolutionIndex: 107
    SolutionNameMin: Cijk_Alik_Bjlk_F8B8S_BH_Bias_SHB_HA_S_SAB_SCD_SAV_UserArgs_MT64x64x64_MI16x16x1_SN_LDSB0_AFC1_AG0_AFEM1_AFEM1_ASEM1_CLR1_CADS0_DTLA0_DTLB0_DTVA0_DTVB1_DTVSM0_DPLBn1_EPS1_ELFLR0_EMLLn1_FDSI0_GRPM1_GRVWA8_GRVWB8_GSUn1_GSUAMB_GSUC0_GSUWGMRR0_GLS0_ISA1201_IU1_K1_LDSTI0_LBSPPA128_LBSPPB0_LBSPPM0_LPA8_LPB0_LPM0_LRVW8_LWPMn1_MIAV1_MIWT2_2_MO40_MGRIPMn1_NTn1_NTA0_NTB0_NTC0_NTD0_NTM0_NEPBS0_NLCA1_NLCB4_ONLL0_PGR1_PLR1_PKA0_SGROBn1_SIA3_SS0_SU32_SUM0_SUS256_SPO0_SRVW0_SSO0_SVW16_SK0_SKFTR0_SKXCCM0_SGRO0_TIN0_TLDS1_TLDSM1_ULSGRO0_USL1_UIOFGRO0_USFGROn1_VSn1_VWA2_VWB1_WSGRA0_WSGRB0_WS32_WG32_4_1_WGM8_WGMXCC1_WGMXCCGn1
    SolutionIndex: 108
    SolutionNameMin: Cijk_Alik_Bjlk_F8B8S_BH_Bias_SHB_HA_S_SAB_SCD_SAV_UserArgs_MT64x64x128_MI16x16x1_SN_LDSB0_AFC1_AG0_AFEM1_AFEM1_ASEM1_CLR1_CADS0_DTLA0_DTLB0_DTVA0_DTVB1_DTVSM0_DPLBn1_EPS0_ELFLR0_EMLLn1_FDSI0_GRPM1_GRVWA8_GRVWB8_GSUn1_GSUAMB_GSUC0_GSUWGMRR0_GLS0_ISA1201_IU1_K1_LDSTI0_LBSPPA256_LBSPPB0_LBSPPM0_LPA8_LPB0_LPM0_LRVW8_LWPMn1_MIAV1_MIWT2_2_MO40_MGRIPMn1_NTn1_NTA0_NTB0_NTC0_NTD0_NTM0_NEPBS0_NLCA1_NLCB8_ONLL0_PGR2_PLR1_PKA0_SGROBn1_SIA3_SS0_SU32_SUM0_SUS256_SPO0_SRVW0_SSO0_SVW16_SK0_SKFTR0_SKXCCM0_SGRO0_TIN0_TLDS1_TLDSM1_ULSGRO0_USL1_UIOFGRO0_USFGROn1_VSn1_VWA2_VWB1_WSGRA0_WSGRB0_WS32_WG32_4_1_WGM8_WGMXCC1_WGMXCCGn1
    SolutionIndex: 109
    SolutionNameMin: Cijk_Alik_Bjlk_F8B8S_BH_Bias_SHB_HA_S_SAB_SCD_SAV_UserArgs_MT32x16x256_MI16x16x1_SN_LDSB0_AFC1_AG0_AFEM1_AFEM1_ASEM256_CLR1_CADS0_DTLA0_DTLB0_DTVA1_DTVB1_DTVSM0_DPLBn1_EPS0_ELFLR0_EMLLn1_FDSI0_GRPM1_GRVWA8_GRVWB8_GSUn1_GSUAMB_GSUC0_GSUWGMRR0_GLS0_ISA1201_IU1_K1_LDSTI0_LBSPPA0_LBSPPB0_LBSPPM0_LPA0_LPB0_LPM0_LRVW8_LWPMn1_MIAV1_MIWT1_1_MO40_MGRIPMn1_NTn1_NTA0_NTB0_NTC0_NTD0_NTM0_NEPBS0_NLCA16_NLCB1_ONLL0_PGR1_PLR0_PKA0_SGROBn1_SIA3_SS0_SU32_SUM0_SUS256_SPO0_SRVW0_SSO0_SVW8_SK0_SKFTR0_SKXCCM0_SGRO0_TIN0_TLDS1_TLDSM1_ULSGRO0_USL1_UIOFGRO0_USFGROn1_VSn1_VWA1_VWB1_WSGRA0_WSGRB0_WS32_WG32_2_1_WGM8_WGMXCC1_WGMXCCGn1
    SolutionIndex: 110
    SolutionNameMin: Cijk_Alik_Bjlk_F8B8S_BH_Bias_SHB_HA_S_SAB_SCD_SAV_UserArgs_MT16x16x128_MI16x16x1_SN_LDSB0_AFC1_AG0_AFEM1_AFEM1_ASEM1_CLR1_CADS0_DTLA0_DTLB0_DTVA0_DTVB1_DTVSM0_DPLBn1_EPS1_ELFLR0_EMLLn1_FDSI0_GRPM1_GRVWA8_GRVWB8_GSUn1_GSUAMB_GSUC0_GSUWGMRR0_GLS0_ISA1201_IU1_K1_LDSTI0_LBSPPA128_LBSPPB0_LBSPPM0_LPA8_LPB0_LPM0_LRVW8_LWPMn1_MIAV1_MIWT1_1_MO40_MGRIPMn1_NTn1_NTA0_NTB0_NTC0_NTD0_NTM0_NEPBS0_NLCA1_NLCB1_ONLL0_PGR1_PLR1_PKA0_SGROBn1_SIA3_SS0_SU32_SUM0_SUS256_SPO0_SRVW0_SSO0_SVW8_SK0_SKFTR0_SKXCCM0_SGRO0_TIN0_TLDS1_TLDSM1_ULSGRO0_USL1_UIOFGRO0_USFGROn1_VSn1_VWA1_VWB1_WSGRA0_WSGRB0_WS32_WG16_2_1_WGM8_WGMXCC1_WGMXCCGn1
    SolutionIndex: 111
    SolutionNameMin: Cijk_Alik_Bjlk_F8B8S_BH_Bias_SHB_HA_S_SAB_SCD_SAV_UserArgs_MT32x128x128_MI16x16x1_SN_LDSB0_AFC1_AG0_AFEM1_AFEM1_ASEM1_CLR1_CADS0_DTLA0_DTLB0_DTVA0_DTVB1_DTVSM0_DPLBn1_EPS0_ELFLR0_EMLLn1_FDSI0_GRPM1_GRVWA8_GRVWB8_GSUn1_GSUAMB_GSUC0_GSUWGMRR0_GLS0_ISA1201_IU1_K1_LDSTI0_LBSPPA128_LBSPPB0_LBSPPM0_LPA8_LPB0_LPM0_LRVW8_LWPMn1_MIAV1_MIWT1_4_MO40_MGRIPMn1_NTn1_NTA0_NTB0_NTC0_NTD0_NTM0_NEPBS0_NLCA1_NLCB8_ONLL0_PGR2_PLR1_PKA0_SGROBn1_SIA3_SS0_SU32_SUM0_SUS256_SPO0_SRVW0_SSO0_SVW8_SK0_SKFTR0_SKXCCM0_SGRO0_TIN0_TLDS1_TLDSM1_ULSGRO0_USL1_UIOFGRO0_USFGROn1_VSn1_VWA1_VWB1_WSGRA0_WSGRB0_WS32_WG32_4_1_WGM8_WGMXCC1_WGMXCCGn1
    SolutionIndex: 112
    SolutionNameMin: Cijk_Alik_Bjlk_F8B8S_BH_Bias_SHB_HA_S_SAB_SCD_SAV_UserArgs_MT32x128x128_MI16x16x1_SN_LDSB0_AFC1_AG0_AFEM1_AFEM1_ASEM1_CLR1_CADS0_DTLA0_DTLB0_DTVA0_DTVB1_DTVSM0_DPLBn1_EPS1_ELFLR0_EMLLn1_FDSI0_GRPM1_GRVWA8_GRVWB8_GSUn1_GSUAMB_GSUC0_GSUWGMRR0_GLS0_ISA1201_IU1_K1_LDSTI0_LBSPPA128_LBSPPB0_LBSPPM0_LPA8_LPB0_LPM0_LRVW8_LWPMn1_MIAV1_MIWT1_4_MO40_MGRIPMn1_NTn1_NTA0_NTB0_NTC0_NTD0_NTM0_NEPBS0_NLCA1_NLCB8_ONLL0_PGR1_PLR1_PKA0_SGROBn1_SIA3_SS0_SU32_SUM0_SUS256_SPO0_SRVW0_SSO0_SVW8_SK0_SKFTR0_SKXCCM0_SGRO0_TIN0_TLDS1_TLDSM1_ULSGRO0_USL1_UIOFGRO0_USFGROn1_VSn1_VWA1_VWB1_WSGRA0_WSGRB0_WS32_WG32_4_1_WGM8_WGMXCC1_WGMXCCGn1
    SolutionIndex: 113
    SolutionNameMin: Cijk_Alik_Bjlk_F8B8S_BH_Bias_SHB_HA_S_SAB_SCD_SAV_UserArgs_MT64x64x128_MI16x16x1_SN_LDSB0_AFC1_AG0_AFEM1_AFEM1_ASEM1_CLR1_CADS0_DTLA0_DTLB0_DTVA0_DTVB1_DTVSM0_DPLBn1_EPS1_ELFLR0_EMLLn1_FDSI0_GRPM1_GRVWA8_GRVWB8_GSUn1_GSUAMB_GSUC0_GSUWGMRR0_GLS0_ISA1201_IU1_K1_LDSTI0_LBSPPA256_LBSPPB0_LBSPPM0_LPA8_LPB0_LPM0_LRVW8_LWPMn1_MIAV1_MIWT2_2_MO40_MGRIPMn1_NTn1_NTA0_NTB0_NTC0_NTD0_NTM0_NEPBS0_NLCA1_NLCB8_ONLL0_PGR1_PLR1_PKA0_SGROBn1_SIA3_SS0_SU32_SUM0_SUS256_SPO0_SRVW0_SSO0_SVW16_SK0_SKFTR0_SKXCCM0_SGRO0_TIN0_TLDS1_TLDSM1_ULSGRO0_USL1_UIOFGRO0_USFGROn1_VSn1_VWA2_VWB1_WSGRA0_WSGRB0_WS32_WG32_4_1_WGM8_WGMXCC1_WGMXCCGn1
    SolutionIndex: 114
    SolutionNameMin: Cijk_Alik_Bjlk_F8B8S_BH_Bias_SHB_HA_S_SAB_SCD_SAV_UserArgs_MT64x64x64_MI16x16x1_SN_LDSB0_AFC1_AG0_AFEM1_AFEM1_ASEM1_CLR1_CADS0_DTLA0_DTLB0_DTVA0_DTVB1_DTVSM0_DPLBn1_EPS0_ELFLR0_EMLLn1_FDSI0_GRPM1_GRVWA8_GRVWB8_GSUn1_GSUAMB_GSUC0_GSUWGMRR0_GLS0_ISA1201_IU1_K1_LDSTI0_LBSPPA128_LBSPPB0_LBSPPM0_LPA8_LPB0_LPM0_LRVW8_LWPMn1_MIAV1_MIWT2_2_MO40_MGRIPMn1_NTn1_NTA0_NTB0_NTC0_NTD0_NTM0_NEPBS0_NLCA1_NLCB4_ONLL0_PGR2_PLR1_PKA0_SGROBn1_SIA3_SS1_SU32_SUM0_SUS256_SPO0_SRVW0_SSO0_SVW2_SK0_SKFTR0_SKXCCM0_SGRO0_TIN0_TLDS1_TLDSM1_ULSGRO0_USL1_UIOFGRO0_USFGROn1_VSn1_VWA2_VWB1_WSGRA0_WSGRB0_WS32_WG32_4_1_WGM8_WGMXCC1_WGMXCCGn1
    SolutionIndex: 115
    SolutionNameMin: Cijk_Alik_Bjlk_F8B8S_BH_Bias_SHB_HA_S_SAB_SCD_SAV_UserArgs_MT32x32x256_MI16x16x1_SN_LDSB0_AFC1_AG0_AFEM1_AFEM1_ASEM1_CLR1_CADS0_DTLA0_DTLB0_DTVA0_DTVB1_DTVSM0_DPLBn1_EPS0_ELFLR0_EMLLn1_FDSI0_GRPM1_GRVWA8_GRVWB8_GSUn1_GSUAMB_GSUC0_GSUWGMRR0_GLS0_ISA1201_IU1_K1_LDSTI0_LBSPPA256_LBSPPB0_LBSPPM0_LPA8_LPB0_LPM0_LRVW8_LWPMn1_MIAV1_MIWT1_1_MO40_MGRIPMn1_NTn1_NTA0_NTB0_NTC0_NTD0_NTM0_NEPBS0_NLCA1_NLCB1_ONLL0_PGR2_PLR1_PKA0_SGROBn1_SIA3_SS0_SU32_SUM0_SUS256_SPO0_SRVW0_SSO0_SVW8_SK0_SKFTR0_SKXCCM0_SGRO0_TIN0_TLDS1_TLDSM1_ULSGRO0_USL1_UIOFGRO0_USFGROn1_VSn1_VWA1_VWB1_WSGRA0_WSGRB0_WS32_WG32_4_1_WGM8_WGMXCC1_WGMXCCGn1
    SolutionIndex: 116
    SolutionNameMin: Cijk_Alik_Bjlk_F8B8S_BH_Bias_SHB_HA_S_SAB_SCD_SAV_UserArgs_MT64x64x128_MI16x16x1_SN_LDSB0_AFC1_AG0_AFEM1_AFEM1_ASEM1_CLR1_CADS0_DTLA0_DTLB0_DTVA0_DTVB1_DTVSM0_DPLBn1_EPS1_ELFLR0_EMLLn1_FDSI0_GRPM1_GRVWA8_GRVWB8_GSUn1_GSUAMB_GSUC0_GSUWGMRR0_GLS0_ISA1201_IU1_K1_LDSTI0_LBSPPA256_LBSPPB0_LBSPPM0_LPA8_LPB0_LPM0_LRVW8_LWPMn1_MIAV1_MIWT2_2_MO40_MGRIPMn1_NTn1_NTA0_NTB0_NTC0_NTD0_NTM0_NEPBS0_NLCA1_NLCB8_ONLL0_PGR1_PLR1_PKA0_SGROBn1_SIA3_SS1_SU32_SUM0_SUS256_SPO0_SRVW0_SSO0_SVW2_SK0_SKFTR0_SKXCCM0_SGRO0_TIN0_TLDS1_TLDSM1_ULSGRO0_USL1_UIOFGRO0_USFGROn1_VSn1_VWA2_VWB1_WSGRA0_WSGRB0_WS32_WG32_4_1_WGM8_WGMXCC1_WGMXCCGn1
    SolutionIndex: 117
    SolutionNameMin: Cijk_Alik_Bjlk_F8B8S_BH_Bias_SHB_HA_S_SAB_SCD_SAV_UserArgs_MT128x64x32_MI16x16x1_SN_LDSB0_AFC1_AG0_AFEM1_AFEM1_ASEM1_CLR1_CADS0_DTLA0_DTLB0_DTVA0_DTVB1_DTVSM0_DPLBn1_EPS0_ELFLR0_EMLLn1_FDSI0_GRPM1_GRVWA8_GRVWB8_GSUn1_GSUAMB_GSUC0_GSUWGMRR0_GLS0_ISA1201_IU1_K1_LDSTI0_LBSPPA256_LBSPPB0_LBSPPM0_LPA8_LPB0_LPM0_LRVW8_LWPMn1_MIAV1_MIWT8_1_MO40_MGRIPMn1_NTn1_NTA0_NTB0_NTC0_NTD0_NTM0_NEPBS0_NLCA1_NLCB1_ONLL0_PGR2_PLR1_PKA0_SGROBn1_SIA3_SS1_SU32_SUM0_SUS256_SPO0_SRVW0_SSO0_SVW8_SK0_SKFTR0_SKXCCM0_SGRO0_TIN0_TLDS1_TLDSM1_ULSGRO0_USL1_UIOFGRO0_USFGROn1_VSn1_VWA8_VWB1_WSGRA0_WSGRB0_WS32_WG16_8_1_WGM8_WGMXCC1_WGMXCCGn1
    SolutionIndex: 118
    SolutionNameMin: Cijk_Alik_Bjlk_F8B8S_BH_Bias_SHB_HA_S_SAB_SCD_SAV_UserArgs_MT128x64x32_MI16x16x1_SN_LDSB1_AFC1_AG0_AFEM1_AFEM1_ASEM1_CLR1_CADS0_DTLA0_DTLB0_DTVA0_DTVB0_DTVSM0_DPLBn1_EPS1_ELFLR0_EMLLn1_FDSI0_GRPM1_GRVWA8_GRVWB16_GSUn1_GSUAMB_GSUC0_GSUWGMRR0_GLS0_ISA1201_IU2_K1_LDSTI0_LBSPPA256_LBSPPB512_LBSPPM0_LPA8_LPB16_LPM0_LRVW8_LWPMn1_MIAV1_MIWT8_1_MO40_MGRIPMn1_NTn1_NTA0_NTB0_NTC0_NTD0_NTM0_NEPBS0_NLCA1_NLCB1_ONLL0_PGR1_PLR1_PKA0_SGROBn1_SIA2_SS1_SU32_SUM0_SUS256_SPO0_SRVW0_SSO0_SVW8_SK0_SKFTR0_SKXCCM0_SGRO0_TIN0_TLDS1_TLDSM1_ULSGRO0_USL1_UIOFGRO0_USFGROn1_VSn1_VWA8_VWB1_WSGRA0_WSGRB0_WS32_WG16_8_1_WGM8_WGMXCC1_WGMXCCGn1
    SolutionIndex: 119
    SolutionNameMin: Cijk_Alik_Bjlk_F8B8S_BH_Bias_SHB_HA_S_SAB_SCD_SAV_UserArgs_MT16x256x64_MI16x16x1_SN_LDSB0_AFC1_AG0_AFEM1_AFEM1_ASEM1_CLR1_CADS0_DTLA0_DTLB0_DTVA0_DTVB1_DTVSM0_DPLBn1_EPS0_ELFLR0_EMLLn1_FDSI0_GRPM1_GRVWA8_GRVWB8_GSUn1_GSUAMB_GSUC0_GSUWGMRR0_GLS0_ISA1201_IU1_K1_LDSTI0_LBSPPA128_LBSPPB0_LBSPPM0_LPA8_LPB0_LPM0_LRVW8_LWPMn1_MIAV1_MIWT1_8_MO40_MGRIPMn1_NTn1_NTA0_NTB0_NTC0_NTD0_NTM0_NEPBS0_NLCA1_NLCB4_ONLL0_PGR2_PLR1_PKA0_SGROBn1_SIA3_SS0_SU32_SUM0_SUS256_SPO0_SRVW0_SSO0_SVW8_SK0_SKFTR0_SKXCCM0_SGRO0_TIN0_TLDS1_TLDSM1_ULSGRO0_USL1_UIOFGRO0_USFGROn1_VSn1_VWA1_VWB1_WSGRA0_WSGRB0_WS32_WG16_4_1_WGM8_WGMXCC1_WGMXCCGn1
    SolutionIndex: 120
    SolutionNameMin: Cijk_Alik_Bjlk_F8B8S_BH_Bias_SHB_HA_S_SAB_SCD_SAV_UserArgs_MT32x32x128_MI16x16x1_SN_LDSB0_AFC1_AG0_AFEM1_AFEM1_ASEM1_CLR1_CADS0_DTLA0_DTLB0_DTVA0_DTVB1_DTVSM0_DPLBn1_EPS0_ELFLR0_EMLLn1_FDSI0_GRPM1_GRVWA8_GRVWB8_GSUn1_GSUAMB_GSUC0_GSUWGMRR0_GLS0_ISA1201_IU1_K1_LDSTI0_LBSPPA128_LBSPPB0_LBSPPM0_LPA8_LPB0_LPM0_LRVW8_LWPMn1_MIAV1_MIWT1_1_MO40_MGRIPMn1_NTn1_NTA0_NTB0_NTC0_NTD0_NTM0_NEPBS0_NLCA1_NLCB1_ONLL0_PGR2_PLR1_PKA0_SGROBn1_SIA3_SS0_SU32_SUM0_SUS256_SPO0_SRVW0_SSO0_SVW8_SK0_SKFTR0_SKXCCM0_SGRO0_TIN0_TLDS1_TLDSM1_ULSGRO0_USL1_UIOFGRO0_USFGROn1_VSn1_VWA1_VWB1_WSGRA0_WSGRB0_WS32_WG32_4_1_WGM8_WGMXCC1_WGMXCCGn1
    SolutionIndex: 121
    SolutionNameMin: Cijk_Alik_Bjlk_F8B8S_BH_Bias_SHB_HA_S_SAB_SCD_SAV_UserArgs_MT128x128x32_MI16x16x1_SN_LDSB0_AFC1_AG0_AFEM1_AFEM1_ASEM1_CLR1_CADS0_DTLA0_DTLB0_DTVA0_DTVB1_DTVSM0_DPLBn1_EPS0_ELFLR0_EMLLn1_FDSI0_GRPM1_GRVWA8_GRVWB8_GSUn1_GSUAMB_GSUC0_GSUWGMRR0_GLS0_ISA1201_IU1_K1_LDSTI0_LBSPPA128_LBSPPB0_LBSPPM0_LPA8_LPB0_LPM0_LRVW8_LWPMn1_MIAV1_MIWT4_4_MO40_MGRIPMn1_NTn1_NTA0_NTB0_NTC0_NTD0_NTM0_NEPBS0_NLCA1_NLCB2_ONLL0_PGR2_PLR1_PKA0_SGROBn1_SIA3_SS0_SU32_SUM0_SUS256_SPO0_SRVW0_SSO0_SVW8_SK0_SKFTR0_SKXCCM0_SGRO0_TIN0_TLDS1_TLDSM1_ULSGRO0_USL1_UIOFGRO0_USFGROn1_VSn1_VWA4_VWB1_WSGRA0_WSGRB0_WS32_WG32_4_1_WGM8_WGMXCC1_WGMXCCGn1
    SolutionIndex: 122
    SolutionNameMin: Cijk_Alik_Bjlk_F8B8S_BH_Bias_SHB_HA_S_SAB_SCD_SAV_UserArgs_MT128x128x32_MI16x16x1_SN_LDSB0_AFC1_AG0_AFEM1_AFEM1_ASEM1_CLR1_CADS0_DTLA0_DTLB0_DTVA0_DTVB1_DTVSM0_DPLBn1_EPS0_ELFLR0_EMLLn1_FDSI0_GRPM1_GRVWA8_GRVWB8_GSUn1_GSUAMB_GSUC0_GSUWGMRR0_GLS0_ISA1201_IU1_K1_LDSTI0_LBSPPA128_LBSPPB0_LBSPPM0_LPA8_LPB0_LPM0_LRVW8_LWPMn1_MIAV1_MIWT4_4_MO40_MGRIPMn1_NTn1_NTA0_NTB0_NTC0_NTD0_NTM0_NEPBS0_NLCA1_NLCB2_ONLL0_PGR2_PLR1_PKA0_SGROBn1_SIA3_SS1_SU32_SUM0_SUS256_SPO0_SRVW0_SSO0_SVW4_SK0_SKFTR0_SKXCCM0_SGRO0_TIN0_TLDS1_TLDSM1_ULSGRO0_USL1_UIOFGRO0_USFGROn1_VSn1_VWA4_VWB1_WSGRA0_WSGRB0_WS32_WG32_4_1_WGM8_WGMXCC1_WGMXCCGn1
    SolutionIndex: 123
    SolutionNameMin: Cijk_Alik_Bjlk_F8B8S_BH_Bias_SHB_HA_S_SAB_SCD_SAV_UserArgs_MT128x128x32_MI16x16x1_SN_LDSB1_AFC1_AG0_AFEM1_AFEM1_ASEM1_CLR1_CADS0_DTLA0_DTLB0_DTVA0_DTVB0_DTVSM0_DPLBn1_EPS1_ELFLR0_EMLLn1_FDSI0_GRPM1_GRVWA8_GRVWB16_GSUn1_GSUAMB_GSUC0_GSUWGMRR0_GLS0_ISA1201_IU2_K1_LDSTI0_LBSPPA256_LBSPPB1024_LBSPPM0_LPA8_LPB32_LPM0_LRVW8_LWPMn1_MIAV1_MIWT8_2_MO40_MGRIPMn1_NTn1_NTA0_NTB0_NTC0_NTD0_NTM0_NEPBS0_NLCA1_NLCB1_ONLL0_PGR1_PLR1_PKA0_SGROBn1_SIA2_SS1_SU32_SUM0_SUS256_SPO0_SRVW0_SSO0_SVW8_SK0_SKFTR0_SKXCCM0_SGRO0_TIN0_TLDS1_TLDSM1_ULSGRO0_USL1_UIOFGRO0_USFGROn1_VSn1_VWA8_VWB2_WSGRA0_WSGRB0_WS32_WG16_8_1_WGM8_WGMXCC1_WGMXCCGn1
    SolutionIndex: 124
    SolutionNameMin: Cijk_Alik_Bjlk_F8B8S_BH_Bias_SHB_HA_S_SAB_SCD_SAV_UserArgs_MT32x16x128_MI16x16x1_SN_LDSB0_AFC1_AG0_AFEM1_AFEM1_ASEM1_CLR1_CADS0_DTLA0_DTLB0_DTVA0_DTVB1_DTVSM0_DPLBn1_EPS1_ELFLR0_EMLLn1_FDSI0_GRPM1_GRVWA8_GRVWB8_GSUn1_GSUAMB_GSUC0_GSUWGMRR0_GLS0_ISA1201_IU1_K1_LDSTI0_LBSPPA128_LBSPPB0_LBSPPM0_LPA8_LPB0_LPM0_LRVW8_LWPMn1_MIAV1_MIWT1_1_MO40_MGRIPMn1_NTn1_NTA0_NTB0_NTC0_NTD0_NTM0_NEPBS0_NLCA1_NLCB1_ONLL0_PGR1_PLR1_PKA0_SGROBn1_SIA3_SS0_SU32_SUM0_SUS256_SPO0_SRVW0_SSO0_SVW8_SK0_SKFTR0_SKXCCM0_SGRO0_TIN0_TLDS1_TLDSM1_ULSGRO0_USL1_UIOFGRO0_USFGROn1_VSn1_VWA1_VWB1_WSGRA0_WSGRB0_WS32_WG32_2_1_WGM8_WGMXCC1_WGMXCCGn1
    SolutionIndex: 125
    SolutionNameMin: Cijk_Alik_Bjlk_F8B8S_BH_Bias_SHB_HA_S_SAB_SCD_SAV_UserArgs_MT16x32x128_MI16x16x1_SN_LDSB0_AFC1_AG0_AFEM1_AFEM1_ASEM1_CLR1_CADS0_DTLA0_DTLB0_DTVA0_DTVB1_DTVSM0_DPLBn1_EPS0_ELFLR0_EMLLn1_FDSI0_GRPM1_GRVWA8_GRVWB8_GSUn1_GSUAMB_GSUC0_GSUWGMRR0_GLS0_ISA1201_IU1_K1_LDSTI0_LBSPPA128_LBSPPB0_LBSPPM0_LPA8_LPB0_LPM0_LRVW8_LWPMn1_MIAV1_MIWT1_1_MO40_MGRIPMn1_NTn1_NTA0_NTB0_NTC0_NTD0_NTM0_NEPBS0_NLCA1_NLCB1_ONLL0_PGR2_PLR1_PKA0_SGROBn1_SIA3_SS1_SU32_SUM0_SUS256_SPO0_SRVW0_SSO0_SVW1_SK0_SKFTR0_SKXCCM0_SGRO0_TIN0_TLDS1_TLDSM1_ULSGRO0_USL1_UIOFGRO0_USFGROn1_VSn1_VWA1_VWB1_WSGRA0_WSGRB0_WS32_WG16_4_1_WGM8_WGMXCC1_WGMXCCGn1
    SolutionIndex: 126
    SolutionNameMin: Cijk_Alik_Bjlk_F8B8S_BH_Bias_SHB_HA_S_SAB_SCD_SAV_UserArgs_MT16x32x256_MI16x16x1_SN_LDSB0_AFC1_AG0_AFEM1_AFEM1_ASEM1_CLR1_CADS0_DTLA0_DTLB0_DTVA0_DTVB1_DTVSM0_DPLBn1_EPS1_ELFLR0_EMLLn1_FDSI0_GRPM1_GRVWA8_GRVWB8_GSUn1_GSUAMB_GSUC0_GSUWGMRR0_GLS0_ISA1201_IU1_K1_LDSTI0_LBSPPA256_LBSPPB0_LBSPPM0_LPA8_LPB0_LPM0_LRVW8_LWPMn1_MIAV1_MIWT1_1_MO40_MGRIPMn1_NTn1_NTA0_NTB0_NTC0_NTD0_NTM0_NEPBS0_NLCA1_NLCB1_ONLL0_PGR1_PLR1_PKA0_SGROBn1_SIA3_SS1_SU32_SUM0_SUS256_SPO0_SRVW0_SSO0_SVW1_SK0_SKFTR0_SKXCCM0_SGRO0_TIN0_TLDS1_TLDSM1_ULSGRO0_USL1_UIOFGRO0_USFGROn1_VSn1_VWA1_VWB1_WSGRA0_WSGRB0_WS32_WG16_4_1_WGM8_WGMXCC1_WGMXCCGn1
    SolutionIndex: 127
    SolutionNameMin: Cijk_Alik_Bjlk_F8B8S_BH_Bias_SHB_HA_S_SAB_SCD_SAV_UserArgs_MT32x32x128_MI16x16x1_SN_LDSB0_AFC1_AG0_AFEM1_AFEM1_ASEM1_CLR1_CADS0_DTLA0_DTLB0_DTVA0_DTVB1_DTVSM0_DPLBn1_EPS0_ELFLR0_EMLLn1_FDSI0_GRPM1_GRVWA8_GRVWB8_GSUn1_GSUAMB_GSUC0_GSUWGMRR0_GLS0_ISA1201_IU1_K1_LDSTI0_LBSPPA128_LBSPPB0_LBSPPM0_LPA8_LPB0_LPM0_LRVW8_LWPMn1_MIAV1_MIWT1_1_MO40_MGRIPMn1_NTn1_NTA0_NTB0_NTC0_NTD0_NTM0_NEPBS0_NLCA1_NLCB1_ONLL0_PGR2_PLR1_PKA0_SGROBn1_SIA3_SS1_SU32_SUM0_SUS256_SPO0_SRVW0_SSO0_SVW1_SK0_SKFTR0_SKXCCM0_SGRO0_TIN0_TLDS1_TLDSM1_ULSGRO0_USL1_UIOFGRO0_USFGROn1_VSn1_VWA1_VWB1_WSGRA0_WSGRB0_WS32_WG32_4_1_WGM8_WGMXCC1_WGMXCCGn1
    SolutionIndex: 128
    SolutionNameMin: Cijk_Alik_Bjlk_F8B8S_BH_Bias_SHB_HA_S_SAB_SCD_SAV_UserArgs_MT16x32x256_MI16x16x1_SN_LDSB0_AFC1_AG0_AFEM1_AFEM1_ASEM1_CLR1_CADS0_DTLA0_DTLB0_DTVA0_DTVB1_DTVSM0_DPLBn1_EPS0_ELFLR0_EMLLn1_FDSI0_GRPM1_GRVWA8_GRVWB8_GSUn1_GSUAMB_GSUC0_GSUWGMRR0_GLS0_ISA1201_IU1_K1_LDSTI0_LBSPPA256_LBSPPB0_LBSPPM0_LPA8_LPB0_LPM0_LRVW8_LWPMn1_MIAV1_MIWT1_1_MO40_MGRIPMn1_NTn1_NTA0_NTB0_NTC0_NTD0_NTM0_NEPBS0_NLCA1_NLCB1_ONLL0_PGR2_PLR1_PKA0_SGROBn1_SIA3_SS1_SU32_SUM0_SUS256_SPO0_SRVW0_SSO0_SVW1_SK0_SKFTR0_SKXCCM0_SGRO0_TIN0_TLDS1_TLDSM1_ULSGRO0_USL1_UIOFGRO0_USFGROn1_VSn1_VWA1_VWB1_WSGRA0_WSGRB0_WS32_WG16_4_1_WGM8_WGMXCC1_WGMXCCGn1
    SolutionIndex: 129
    SolutionNameMin: Cijk_Alik_Bjlk_F8B8S_BH_Bias_SHB_HA_S_SAB_SCD_SAV_UserArgs_MT32x32x256_MI16x16x1_SN_LDSB0_AFC1_AG0_AFEM1_AFEM1_ASEM1_CLR1_CADS0_DTLA0_DTLB0_DTVA0_DTVB1_DTVSM0_DPLBn1_EPS1_ELFLR0_EMLLn1_FDSI0_GRPM1_GRVWA8_GRVWB8_GSUn1_GSUAMB_GSUC0_GSUWGMRR0_GLS0_ISA1201_IU1_K1_LDSTI0_LBSPPA256_LBSPPB0_LBSPPM0_LPA8_LPB0_LPM0_LRVW8_LWPMn1_MIAV1_MIWT1_1_MO40_MGRIPMn1_NTn1_NTA0_NTB0_NTC0_NTD0_NTM0_NEPBS0_NLCA1_NLCB1_ONLL0_PGR1_PLR1_PKA0_SGROBn1_SIA3_SS0_SU32_SUM0_SUS256_SPO0_SRVW0_SSO0_SVW8_SK0_SKFTR0_SKXCCM0_SGRO0_TIN0_TLDS1_TLDSM1_ULSGRO0_USL1_UIOFGRO0_USFGROn1_VSn1_VWA1_VWB1_WSGRA0_WSGRB0_WS32_WG32_4_1_WGM8_WGMXCC1_WGMXCCGn1
    SolutionIndex: 130
    SolutionNameMin: Cijk_Alik_Bjlk_F8B8S_BH_Bias_SHB_HA_S_SAB_SCD_SAV_UserArgs_MT32x32x64_MI16x16x1_SN_LDSB0_AFC1_AG0_AFEM1_AFEM1_ASEM64_CLR1_CADS0_DTLA0_DTLB0_DTVA1_DTVB0_DTVSM0_DPLBn1_EPS0_ELFLR0_EMLLn1_FDSI0_GRPM1_GRVWA16_GRVWB16_GSUn1_GSUAMB_GSUC0_GSUWGMRR0_GLS0_ISA1201_IU1_K1_LDSTI0_LBSPPA0_LBSPPB512_LBSPPM0_LPA0_LPB16_LPM0_LRVW16_LWPMn1_MIAV1_MIWT1_1_MO40_MGRIPMn1_NTn1_NTA0_NTB0_NTC0_NTD0_NTM0_NEPBS0_NLCA2_NLCB1_ONLL0_PGR2_PLR1_PKA0_SGROBn1_SIA3_SS0_SU32_SUM0_SUS256_SPO0_SRVW0_SSO0_SVW8_SK0_SKFTR0_SKXCCM0_SGRO0_TIN0_TLDS1_TLDSM1_ULSGRO0_USL1_UIOFGRO0_USFGROn1_VSn1_VWA1_VWB1_WSGRA0_WSGRB0_WS32_WG32_4_1_WGM8_WGMXCC1_WGMXCCGn1
    SolutionIndex: 131
    SolutionNameMin: Cijk_Alik_Bjlk_F8B8S_BH_Bias_SHB_HA_S_SAB_SCD_SAV_UserArgs_MT32x32x256_MI16x16x1_SN_LDSB0_AFC1_AG0_AFEM1_AFEM1_ASEM256_CLR1_CADS0_DTLA0_DTLB0_DTVA1_DTVB0_DTVSM0_DPLBn1_EPS1_ELFLR0_EMLLn1_FDSI0_GRPM1_GRVWA16_GRVWB16_GSUn1_GSUAMB_GSUC0_GSUWGMRR0_GLS0_ISA1201_IU1_K1_LDSTI0_LBSPPA0_LBSPPB512_LBSPPM0_LPA0_LPB16_LPM0_LRVW16_LWPMn1_MIAV1_MIWT1_1_MO40_MGRIPMn1_NTn1_NTA0_NTB0_NTC0_NTD0_NTM0_NEPBS0_NLCA8_NLCB1_ONLL0_PGR1_PLR1_PKA0_SGROBn1_SIA3_SS0_SU32_SUM0_SUS256_SPO0_SRVW0_SSO0_SVW8_SK0_SKFTR0_SKXCCM0_SGRO0_TIN0_TLDS1_TLDSM1_ULSGRO0_USL1_UIOFGRO0_USFGROn1_VSn1_VWA1_VWB1_WSGRA0_WSGRB0_WS32_WG32_4_1_WGM8_WGMXCC1_WGMXCCGn1
    SolutionIndex: 132
    SolutionNameMin: Cijk_Alik_Bjlk_F8B8S_BH_Bias_SHB_HA_S_SAB_SCD_SAV_UserArgs_MT128x32x128_MI16x16x1_SN_LDSB1_AFC1_AG0_AFEM1_AFEM1_ASEM1_CLR1_CADS0_DTLA0_DTLB0_DTVA0_DTVB1_DTVSM0_DPLBn1_EPS0_ELFLR0_EMLLn1_FDSI0_GRPM1_GRVWA8_GRVWB8_GSUn1_GSUAMB_GSUC0_GSUWGMRR0_GLS0_ISA1201_IU1_K1_LDSTI0_LBSPPA512_LBSPPB0_LBSPPM0_LPA8_LPB0_LPM0_LRVW8_LWPMn1_MIAV1_MIWT4_1_MO40_MGRIPMn1_NTn1_NTA0_NTB0_NTC0_NTD0_NTM0_NEPBS0_NLCA1_NLCB1_ONLL0_PGR2_PLR1_PKA0_SGROBn1_SIA3_SS1_SU32_SUM0_SUS256_SPO0_SRVW0_SSO0_SVW4_SK0_SKFTR0_SKXCCM0_SGRO0_TIN0_TLDS1_TLDSM1_ULSGRO0_USL1_UIOFGRO0_USFGROn1_VSn1_VWA4_VWB1_WSGRA0_WSGRB0_WS32_WG32_4_1_WGM8_WGMXCC1_WGMXCCGn1
    SolutionIndex: 133
    SolutionNameMin: Cijk_Alik_Bjlk_F8B8S_BH_Bias_SHB_HA_S_SAB_SCD_SAV_UserArgs_MT32x16x256_MI16x16x1_SN_LDSB0_AFC1_AG0_AFEM1_AFEM1_ASEM1_CLR1_CADS0_DTLA0_DTLB0_DTVA0_DTVB1_DTVSM0_DPLBn1_EPS1_ELFLR0_EMLLn1_FDSI0_GRPM1_GRVWA8_GRVWB8_GSUn1_GSUAMB_GSUC0_GSUWGMRR0_GLS0_ISA1201_IU1_K1_LDSTI0_LBSPPA256_LBSPPB0_LBSPPM0_LPA8_LPB0_LPM0_LRVW8_LWPMn1_MIAV1_MIWT1_1_MO40_MGRIPMn1_NTn1_NTA0_NTB0_NTC0_NTD0_NTM0_NEPBS0_NLCA1_NLCB1_ONLL0_PGR1_PLR1_PKA0_SGROBn1_SIA3_SS0_SU32_SUM0_SUS256_SPO0_SRVW0_SSO0_SVW8_SK0_SKFTR0_SKXCCM0_SGRO0_TIN0_TLDS1_TLDSM1_ULSGRO0_USL1_UIOFGRO0_USFGROn1_VSn1_VWA1_VWB1_WSGRA0_WSGRB0_WS32_WG32_2_1_WGM8_WGMXCC1_WGMXCCGn1
    SolutionIndex: 134
    SolutionNameMin: Cijk_Alik_Bjlk_F8B8S_BH_Bias_SHB_HA_S_SAB_SCD_SAV_UserArgs_MT32x32x128_MI16x16x1_SN_LDSB0_AFC1_AG0_AFEM1_AFEM1_ASEM128_CLR1_CADS0_DTLA0_DTLB0_DTVA1_DTVB0_DTVSM0_DPLBn1_EPS0_ELFLR0_EMLLn1_FDSI0_GRPM1_GRVWA16_GRVWB16_GSUn1_GSUAMB_GSUC0_GSUWGMRR0_GLS0_ISA1201_IU1_K1_LDSTI0_LBSPPA0_LBSPPB512_LBSPPM0_LPA0_LPB16_LPM0_LRVW16_LWPMn1_MIAV1_MIWT1_1_MO40_MGRIPMn1_NTn1_NTA0_NTB0_NTC0_NTD0_NTM0_NEPBS0_NLCA4_NLCB1_ONLL0_PGR2_PLR1_PKA0_SGROBn1_SIA3_SS1_SU32_SUM0_SUS256_SPO0_SRVW0_SSO0_SVW1_SK0_SKFTR0_SKXCCM0_SGRO0_TIN0_TLDS1_TLDSM1_ULSGRO0_USL1_UIOFGRO0_USFGROn1_VSn1_VWA1_VWB1_WSGRA0_WSGRB0_WS32_WG32_4_1_WGM8_WGMXCC1_WGMXCCGn1
    SolutionIndex: 135
    SolutionNameMin: Cijk_Alik_Bjlk_F8B8S_BH_Bias_SHB_HA_S_SAB_SCD_SAV_UserArgs_MT64x64x128_MI16x16x1_SN_LDSB0_AFC1_AG0_AFEM1_AFEM1_ASEM1_CLR1_CADS0_DTLA0_DTLB0_DTVA0_DTVB1_DTVSM0_DPLBn1_EPS0_ELFLR0_EMLLn1_FDSI0_GRPM1_GRVWA8_GRVWB8_GSUn1_GSUAMB_GSUC0_GSUWGMRR0_GLS0_ISA1201_IU1_K1_LDSTI0_LBSPPA256_LBSPPB0_LBSPPM0_LPA8_LPB0_LPM0_LRVW8_LWPMn1_MIAV1_MIWT2_2_MO40_MGRIPMn1_NTn1_NTA0_NTB0_NTC0_NTD0_NTM0_NEPBS0_NLCA1_NLCB8_ONLL0_PGR2_PLR1_PKA0_SGROBn1_SIA3_SS1_SU32_SUM0_SUS256_SPO0_SRVW0_SSO0_SVW2_SK0_SKFTR0_SKXCCM0_SGRO0_TIN0_TLDS1_TLDSM1_ULSGRO0_USL1_UIOFGRO0_USFGROn1_VSn1_VWA2_VWB1_WSGRA0_WSGRB0_WS32_WG32_4_1_WGM8_WGMXCC1_WGMXCCGn1
    SolutionIndex: 136
    SolutionNameMin: Cijk_Alik_Bjlk_F8B8S_BH_Bias_SHB_HA_S_SAB_SCD_SAV_UserArgs_MT16x32x64_MI16x16x1_SN_LDSB0_AFC1_AG0_AFEM1_AFEM1_ASEM1_CLR1_CADS0_DTLA0_DTLB0_DTVA0_DTVB1_DTVSM0_DPLBn1_EPS1_ELFLR0_EMLLn1_FDSI0_GRPM1_GRVWA8_GRVWB8_GSUn1_GSUAMB_GSUC0_GSUWGMRR0_GLS0_ISA1201_IU1_K1_LDSTI0_LBSPPA128_LBSPPB0_LBSPPM0_LPA8_LPB0_LPM0_LRVW8_LWPMn1_MIAV1_MIWT1_1_MO40_MGRIPMn1_NTn1_NTA0_NTB0_NTC0_NTD0_NTM0_NEPBS0_NLCA1_NLCB1_ONLL0_PGR1_PLR1_PKA0_SGROBn1_SIA3_SS0_SU32_SUM0_SUS256_SPO0_SRVW0_SSO0_SVW8_SK0_SKFTR0_SKXCCM0_SGRO0_TIN0_TLDS1_TLDSM1_ULSGRO0_USL1_UIOFGRO0_USFGROn1_VSn1_VWA1_VWB1_WSGRA0_WSGRB0_WS32_WG16_4_1_WGM8_WGMXCC1_WGMXCCGn1
    SolutionIndex: 137
    SolutionNameMin: Cijk_Alik_Bjlk_F8B8S_BH_Bias_SHB_HA_S_SAB_SCD_SAV_UserArgs_MT128x128x32_MI16x16x1_SN_LDSB1_AFC1_AG0_AFEM1_AFEM1_ASEM1_CLR1_CADS0_DTLA0_DTLB0_DTVA0_DTVB0_DTVSM0_DPLBn1_EPS0_ELFLR0_EMLLn1_FDSI0_GRPM1_GRVWA8_GRVWB8_GSUn1_GSUAMB_GSUC0_GSUWGMRR0_GLS0_ISA1201_IU2_K1_LDSTI0_LBSPPA256_LBSPPB1024_LBSPPM0_LPA8_LPB32_LPM0_LRVW8_LWPMn1_MIAV1_MIWT8_2_MO40_MGRIPMn1_NTn1_NTA0_NTB0_NTC0_NTD0_NTM0_NEPBS0_NLCA1_NLCB1_ONLL0_PGR2_PLR1_PKA0_SGROBn1_SIA2_SS1_SU32_SUM0_SUS256_SPO0_SRVW0_SSO0_SVW8_SK0_SKFTR0_SKXCCM0_SGRO0_TIN0_TLDS1_TLDSM1_ULSGRO1_USL1_UIOFGRO0_USFGROn1_VSn1_VWA8_VWB2_WSGRA0_WSGRB0_WS32_WG16_8_1_WGM8_WGMXCC1_WGMXCCGn1
    SolutionIndex: 138
    SolutionNameMin: Cijk_Alik_Bjlk_F8B8S_BH_Bias_SHB_HA_S_SAB_SCD_SAV_UserArgs_MT16x16x128_MI16x16x1_SN_LDSB0_AFC1_AG0_AFEM1_AFEM1_ASEM1_CLR1_CADS0_DTLA0_DTLB0_DTVA0_DTVB1_DTVSM0_DPLBn1_EPS1_ELFLR0_EMLLn1_FDSI0_GRPM1_GRVWA8_GRVWB8_GSUn1_GSUAMB_GSUC0_GSUWGMRR0_GLS0_ISA1201_IU1_K1_LDSTI0_LBSPPA128_LBSPPB0_LBSPPM0_LPA8_LPB0_LPM0_LRVW8_LWPMn1_MIAV1_MIWT1_1_MO40_MGRIPMn1_NTn1_NTA0_NTB0_NTC0_NTD0_NTM0_NEPBS0_NLCA1_NLCB1_ONLL0_PGR1_PLR1_PKA0_SGROBn1_SIA3_SS1_SU32_SUM0_SUS256_SPO0_SRVW0_SSO0_SVW1_SK0_SKFTR0_SKXCCM0_SGRO0_TIN0_TLDS1_TLDSM1_ULSGRO0_USL1_UIOFGRO0_USFGROn1_VSn1_VWA1_VWB1_WSGRA0_WSGRB0_WS32_WG16_2_1_WGM8_WGMXCC1_WGMXCCGn1
    SolutionIndex: 139
    SolutionNameMin: Cijk_Alik_Bjlk_F8B8S_BH_Bias_SHB_HA_S_SAB_SCD_SAV_UserArgs_MT32x16x128_MI16x16x1_SN_LDSB0_AFC1_AG0_AFEM1_AFEM1_ASEM1_CLR1_CADS0_DTLA0_DTLB0_DTVA0_DTVB1_DTVSM0_DPLBn1_EPS0_ELFLR0_EMLLn1_FDSI0_GRPM1_GRVWA8_GRVWB8_GSUn1_GSUAMB_GSUC0_GSUWGMRR0_GLS0_ISA1201_IU1_K1_LDSTI0_LBSPPA128_LBSPPB0_LBSPPM0_LPA8_LPB0_LPM0_LRVW8_LWPMn1_MIAV1_MIWT1_1_MO40_MGRIPMn1_NTn1_NTA0_NTB0_NTC0_NTD0_NTM0_NEPBS0_NLCA1_NLCB1_ONLL0_PGR2_PLR1_PKA0_SGROBn1_SIA3_SS0_SU32_SUM0_SUS256_SPO0_SRVW0_SSO0_SVW8_SK0_SKFTR0_SKXCCM0_SGRO0_TIN0_TLDS1_TLDSM1_ULSGRO0_USL1_UIOFGRO0_USFGROn1_VSn1_VWA1_VWB1_WSGRA0_WSGRB0_WS32_WG32_2_1_WGM8_WGMXCC1_WGMXCCGn1
    SolutionIndex: 140
    SolutionNameMin: Cijk_Alik_Bjlk_F8B8S_BH_Bias_SHB_HA_S_SAB_SCD_SAV_UserArgs_MT32x16x256_MI16x16x1_SN_LDSB0_AFC1_AG0_AFEM1_AFEM1_ASEM1_CLR1_CADS0_DTLA0_DTLB0_DTVA0_DTVB1_DTVSM0_DPLBn1_EPS1_ELFLR0_EMLLn1_FDSI0_GRPM1_GRVWA8_GRVWB8_GSUn1_GSUAMB_GSUC0_GSUWGMRR0_GLS0_ISA1201_IU1_K1_LDSTI0_LBSPPA256_LBSPPB0_LBSPPM0_LPA8_LPB0_LPM0_LRVW8_LWPMn1_MIAV1_MIWT1_1_MO40_MGRIPMn1_NTn1_NTA0_NTB0_NTC0_NTD0_NTM0_NEPBS0_NLCA1_NLCB1_ONLL0_PGR1_PLR1_PKA0_SGROBn1_SIA3_SS1_SU32_SUM0_SUS256_SPO0_SRVW0_SSO0_SVW1_SK0_SKFTR0_SKXCCM0_SGRO0_TIN0_TLDS1_TLDSM1_ULSGRO0_USL1_UIOFGRO0_USFGROn1_VSn1_VWA1_VWB1_WSGRA0_WSGRB0_WS32_WG32_2_1_WGM8_WGMXCC1_WGMXCCGn1
    SolutionIndex: 141
    SolutionNameMin: Cijk_Alik_Bjlk_F8B8S_BH_Bias_SHB_HA_S_SAB_SCD_SAV_UserArgs_MT32x32x128_MI16x16x1_SN_LDSB0_AFC1_AG0_AFEM1_AFEM1_ASEM128_CLR1_CADS0_DTLA0_DTLB0_DTVA1_DTVB0_DTVSM0_DPLBn1_EPS1_ELFLR0_EMLLn1_FDSI0_GRPM1_GRVWA16_GRVWB16_GSUn1_GSUAMB_GSUC0_GSUWGMRR0_GLS0_ISA1201_IU1_K1_LDSTI0_LBSPPA0_LBSPPB512_LBSPPM0_LPA0_LPB16_LPM0_LRVW16_LWPMn1_MIAV1_MIWT1_1_MO40_MGRIPMn1_NTn1_NTA0_NTB0_NTC0_NTD0_NTM0_NEPBS0_NLCA4_NLCB1_ONLL0_PGR1_PLR1_PKA0_SGROBn1_SIA3_SS1_SU32_SUM0_SUS256_SPO0_SRVW0_SSO0_SVW1_SK0_SKFTR0_SKXCCM0_SGRO0_TIN0_TLDS1_TLDSM1_ULSGRO0_USL1_UIOFGRO0_USFGROn1_VSn1_VWA1_VWB1_WSGRA0_WSGRB0_WS32_WG32_4_1_WGM8_WGMXCC1_WGMXCCGn1
    SolutionIndex: 142
    SolutionNameMin: Cijk_Alik_Bjlk_F8B8S_BH_Bias_SHB_HA_S_SAB_SCD_SAV_UserArgs_MT32x32x128_MI16x16x1_SN_LDSB0_AFC1_AG0_AFEM1_AFEM1_ASEM128_CLR1_CADS0_DTLA0_DTLB0_DTVA1_DTVB0_DTVSM0_DPLBn1_EPS1_ELFLR0_EMLLn1_FDSI0_GRPM1_GRVWA16_GRVWB16_GSUn1_GSUAMB_GSUC0_GSUWGMRR0_GLS0_ISA1201_IU1_K1_LDSTI0_LBSPPA0_LBSPPB512_LBSPPM0_LPA0_LPB16_LPM0_LRVW16_LWPMn1_MIAV1_MIWT1_1_MO40_MGRIPMn1_NTn1_NTA0_NTB0_NTC0_NTD0_NTM0_NEPBS0_NLCA4_NLCB1_ONLL0_PGR1_PLR1_PKA0_SGROBn1_SIA3_SS0_SU32_SUM0_SUS256_SPO0_SRVW0_SSO0_SVW8_SK0_SKFTR0_SKXCCM0_SGRO0_TIN0_TLDS1_TLDSM1_ULSGRO0_USL1_UIOFGRO0_USFGROn1_VSn1_VWA1_VWB1_WSGRA0_WSGRB0_WS32_WG32_4_1_WGM8_WGMXCC1_WGMXCCGn1
    SolutionIndex: 143
    SolutionNameMin: Cijk_Alik_Bjlk_F8B8S_BH_Bias_SHB_HA_S_SAB_SCD_SAV_UserArgs_MT32x128x64_MI16x16x1_SN_LDSB0_AFC1_AG0_AFEM1_AFEM1_ASEM1_CLR1_CADS0_DTLA0_DTLB0_DTVA0_DTVB1_DTVSM0_DPLBn1_EPS1_ELFLR0_EMLLn1_FDSI0_GRPM1_GRVWA8_GRVWB8_GSUn1_GSUAMB_GSUC0_GSUWGMRR0_GLS0_ISA1201_IU1_K1_LDSTI0_LBSPPA128_LBSPPB0_LBSPPM0_LPA8_LPB0_LPM0_LRVW8_LWPMn1_MIAV1_MIWT1_4_MO40_MGRIPMn1_NTn1_NTA0_NTB0_NTC0_NTD0_NTM0_NEPBS0_NLCA1_NLCB4_ONLL0_PGR1_PLR1_PKA0_SGROBn1_SIA3_SS1_SU32_SUM0_SUS256_SPO0_SRVW0_SSO0_SVW1_SK0_SKFTR0_SKXCCM0_SGRO0_TIN0_TLDS1_TLDSM1_ULSGRO0_USL1_UIOFGRO0_USFGROn1_VSn1_VWA1_VWB1_WSGRA0_WSGRB0_WS32_WG32_4_1_WGM8_WGMXCC1_WGMXCCGn1
    SolutionIndex: 144
    SolutionNameMin: Cijk_Alik_Bjlk_F8B8S_BH_Bias_SHB_HA_S_SAB_SCD_SAV_UserArgs_MT32x32x128_MI16x16x1_SN_LDSB0_AFC1_AG0_AFEM1_AFEM1_ASEM128_CLR1_CADS0_DTLA0_DTLB0_DTVA1_DTVB0_DTVSM0_DPLBn1_EPS0_ELFLR0_EMLLn1_FDSI0_GRPM1_GRVWA16_GRVWB16_GSUn1_GSUAMB_GSUC0_GSUWGMRR0_GLS0_ISA1201_IU1_K1_LDSTI0_LBSPPA0_LBSPPB512_LBSPPM0_LPA0_LPB16_LPM0_LRVW16_LWPMn1_MIAV1_MIWT1_1_MO40_MGRIPMn1_NTn1_NTA0_NTB0_NTC0_NTD0_NTM0_NEPBS0_NLCA4_NLCB1_ONLL0_PGR2_PLR1_PKA0_SGROBn1_SIA3_SS0_SU32_SUM0_SUS256_SPO0_SRVW0_SSO0_SVW8_SK0_SKFTR0_SKXCCM0_SGRO0_TIN0_TLDS1_TLDSM1_ULSGRO0_USL1_UIOFGRO0_USFGROn1_VSn1_VWA1_VWB1_WSGRA0_WSGRB0_WS32_WG32_4_1_WGM8_WGMXCC1_WGMXCCGn1
    SolutionIndex: 145
    SolutionNameMin: Cijk_Alik_Bjlk_F8B8S_BH_Bias_SHB_HA_S_SAB_SCD_SAV_UserArgs_MT128x64x64_MI16x16x1_SN_LDSB0_AFC1_AG0_AFEM1_AFEM1_ASEM1_CLR1_CADS0_DTLA0_DTLB0_DTVA0_DTVB1_DTVSM0_DPLBn1_EPS0_ELFLR0_EMLLn1_FDSI0_GRPM1_GRVWA8_GRVWB8_GSUn1_GSUAMB_GSUC0_GSUWGMRR0_GLS0_ISA1201_IU1_K1_LDSTI0_LBSPPA512_LBSPPB0_LBSPPM0_LPA8_LPB0_LPM0_LRVW8_LWPMn1_MIAV1_MIWT8_1_MO40_MGRIPMn1_NTn1_NTA0_NTB0_NTC0_NTD0_NTM0_NEPBS0_NLCA1_NLCB1_ONLL0_PGR2_PLR1_PKA0_SGROBn1_SIA3_SS0_SU32_SUM0_SUS256_SPO0_SRVW0_SSO0_SVW8_SK0_SKFTR0_SKXCCM0_SGRO0_TIN0_TLDS1_TLDSM1_ULSGRO0_USL1_UIOFGRO0_USFGROn1_VSn1_VWA8_VWB1_WSGRA0_WSGRB0_WS32_WG16_8_1_WGM8_WGMXCC1_WGMXCCGn1
    SolutionIndex: 146
    SolutionNameMin: Cijk_Alik_Bjlk_F8B8S_BH_Bias_SHB_HA_S_SAB_SCD_SAV_UserArgs_MT16x16x256_MI16x16x1_SN_LDSB0_AFC1_AG0_AFEM1_AFEM1_ASEM1_CLR1_CADS0_DTLA0_DTLB0_DTVA0_DTVB1_DTVSM0_DPLBn1_EPS1_ELFLR0_EMLLn1_FDSI0_GRPM1_GRVWA8_GRVWB8_GSUn1_GSUAMB_GSUC0_GSUWGMRR0_GLS0_ISA1201_IU1_K1_LDSTI0_LBSPPA256_LBSPPB0_LBSPPM0_LPA8_LPB0_LPM0_LRVW8_LWPMn1_MIAV1_MIWT1_1_MO40_MGRIPMn1_NTn1_NTA0_NTB0_NTC0_NTD0_NTM0_NEPBS0_NLCA1_NLCB1_ONLL0_PGR1_PLR1_PKA0_SGROBn1_SIA3_SS1_SU32_SUM0_SUS256_SPO0_SRVW0_SSO0_SVW1_SK0_SKFTR0_SKXCCM0_SGRO0_TIN0_TLDS1_TLDSM1_ULSGRO0_USL1_UIOFGRO0_USFGROn1_VSn1_VWA1_VWB1_WSGRA0_WSGRB0_WS32_WG16_2_1_WGM8_WGMXCC1_WGMXCCGn1
    SolutionIndex: 147
    SolutionNameMin: Cijk_Alik_Bjlk_F8B8S_BH_Bias_SHB_HA_S_SAB_SCD_SAV_UserArgs_MT32x16x128_MI16x16x1_SN_LDSB0_AFC1_AG0_AFEM1_AFEM1_ASEM1_CLR1_CADS0_DTLA0_DTLB0_DTVA0_DTVB1_DTVSM0_DPLBn1_EPS0_ELFLR0_EMLLn1_FDSI0_GRPM1_GRVWA8_GRVWB8_GSUn1_GSUAMB_GSUC0_GSUWGMRR0_GLS0_ISA1201_IU1_K1_LDSTI0_LBSPPA128_LBSPPB0_LBSPPM0_LPA8_LPB0_LPM0_LRVW8_LWPMn1_MIAV1_MIWT1_1_MO40_MGRIPMn1_NTn1_NTA0_NTB0_NTC0_NTD0_NTM0_NEPBS0_NLCA1_NLCB1_ONLL0_PGR2_PLR1_PKA0_SGROBn1_SIA3_SS1_SU32_SUM0_SUS256_SPO0_SRVW0_SSO0_SVW1_SK0_SKFTR0_SKXCCM0_SGRO0_TIN0_TLDS1_TLDSM1_ULSGRO0_USL1_UIOFGRO0_USFGROn1_VSn1_VWA1_VWB1_WSGRA0_WSGRB0_WS32_WG32_2_1_WGM8_WGMXCC1_WGMXCCGn1
    SolutionIndex: 148
    SolutionNameMin: Cijk_Alik_Bjlk_F8B8S_BH_Bias_SHB_HA_S_SAB_SCD_SAV_UserArgs_MT16x16x256_MI16x16x1_SN_LDSB0_AFC1_AG0_AFEM1_AFEM1_ASEM1_CLR1_CADS0_DTLA0_DTLB0_DTVA0_DTVB1_DTVSM0_DPLBn1_EPS1_ELFLR0_EMLLn1_FDSI0_GRPM1_GRVWA8_GRVWB8_GSUn1_GSUAMB_GSUC0_GSUWGMRR0_GLS0_ISA1201_IU1_K1_LDSTI0_LBSPPA256_LBSPPB0_LBSPPM0_LPA8_LPB0_LPM0_LRVW8_LWPMn1_MIAV1_MIWT1_1_MO40_MGRIPMn1_NTn1_NTA0_NTB0_NTC0_NTD0_NTM0_NEPBS0_NLCA1_NLCB1_ONLL0_PGR1_PLR1_PKA0_SGROBn1_SIA3_SS0_SU32_SUM0_SUS256_SPO0_SRVW0_SSO0_SVW8_SK0_SKFTR0_SKXCCM0_SGRO0_TIN0_TLDS1_TLDSM1_ULSGRO0_USL1_UIOFGRO0_USFGROn1_VSn1_VWA1_VWB1_WSGRA0_WSGRB0_WS32_WG16_2_1_WGM8_WGMXCC1_WGMXCCGn1
    SolutionIndex: 149
    SolutionNameMin: Cijk_Alik_Bjlk_F8B8S_BH_Bias_SHB_HA_S_SAB_SCD_SAV_UserArgs_MT32x32x256_MI16x16x1_SN_LDSB0_AFC1_AG0_AFEM1_AFEM1_ASEM256_CLR1_CADS0_DTLA0_DTLB0_DTVA1_DTVB0_DTVSM0_DPLBn1_EPS0_ELFLR0_EMLLn1_FDSI0_GRPM1_GRVWA16_GRVWB16_GSUn1_GSUAMB_GSUC0_GSUWGMRR0_GLS0_ISA1201_IU1_K1_LDSTI0_LBSPPA0_LBSPPB512_LBSPPM0_LPA0_LPB16_LPM0_LRVW16_LWPMn1_MIAV1_MIWT1_1_MO40_MGRIPMn1_NTn1_NTA0_NTB0_NTC0_NTD0_NTM0_NEPBS0_NLCA8_NLCB1_ONLL0_PGR2_PLR1_PKA0_SGROBn1_SIA3_SS0_SU32_SUM0_SUS256_SPO0_SRVW0_SSO0_SVW8_SK0_SKFTR0_SKXCCM0_SGRO0_TIN0_TLDS1_TLDSM1_ULSGRO0_USL1_UIOFGRO0_USFGROn1_VSn1_VWA1_VWB1_WSGRA0_WSGRB0_WS32_WG32_4_1_WGM8_WGMXCC1_WGMXCCGn1
    SolutionIndex: 150
    SolutionNameMin: Cijk_Alik_Bjlk_F8B8S_BH_Bias_SHB_HA_S_SAB_SCD_SAV_UserArgs_MT32x32x256_MI16x16x1_SN_LDSB0_AFC1_AG0_AFEM1_AFEM1_ASEM256_CLR1_CADS0_DTLA0_DTLB0_DTVA1_DTVB0_DTVSM0_DPLBn1_EPS1_ELFLR0_EMLLn1_FDSI0_GRPM1_GRVWA16_GRVWB16_GSUn1_GSUAMB_GSUC0_GSUWGMRR0_GLS0_ISA1201_IU1_K1_LDSTI0_LBSPPA0_LBSPPB512_LBSPPM0_LPA0_LPB16_LPM0_LRVW16_LWPMn1_MIAV1_MIWT1_1_MO40_MGRIPMn1_NTn1_NTA0_NTB0_NTC0_NTD0_NTM0_NEPBS0_NLCA8_NLCB1_ONLL0_PGR1_PLR1_PKA0_SGROBn1_SIA3_SS1_SU32_SUM0_SUS256_SPO0_SRVW0_SSO0_SVW1_SK0_SKFTR0_SKXCCM0_SGRO0_TIN0_TLDS1_TLDSM1_ULSGRO0_USL1_UIOFGRO0_USFGROn1_VSn1_VWA1_VWB1_WSGRA0_WSGRB0_WS32_WG32_4_1_WGM8_WGMXCC1_WGMXCCGn1
    SolutionIndex: 151
    SolutionNameMin: Cijk_Alik_Bjlk_F8B8S_BH_Bias_SHB_HA_S_SAB_SCD_SAV_UserArgs_MT32x32x256_MI16x16x1_SN_LDSB0_AFC1_AG0_AFEM1_AFEM1_ASEM1_CLR1_CADS0_DTLA0_DTLB0_DTVA0_DTVB1_DTVSM0_DPLBn1_EPS1_ELFLR0_EMLLn1_FDSI0_GRPM1_GRVWA8_GRVWB8_GSUn1_GSUAMB_GSUC0_GSUWGMRR0_GLS0_ISA1201_IU1_K1_LDSTI0_LBSPPA256_LBSPPB0_LBSPPM0_LPA8_LPB0_LPM0_LRVW8_LWPMn1_MIAV1_MIWT1_1_MO40_MGRIPMn1_NTn1_NTA0_NTB0_NTC0_NTD0_NTM0_NEPBS0_NLCA1_NLCB1_ONLL0_PGR1_PLR1_PKA0_SGROBn1_SIA3_SS1_SU32_SUM0_SUS256_SPO0_SRVW0_SSO0_SVW1_SK0_SKFTR0_SKXCCM0_SGRO0_TIN0_TLDS1_TLDSM1_ULSGRO0_USL1_UIOFGRO0_USFGROn1_VSn1_VWA1_VWB1_WSGRA0_WSGRB0_WS32_WG32_4_1_WGM8_WGMXCC1_WGMXCCGn1
    SolutionIndex: 152
    SolutionNameMin: Cijk_Alik_Bjlk_F8B8S_BH_Bias_SHB_HA_S_SAB_SCD_SAV_UserArgs_MT32x128x32_MI16x16x1_SN_LDSB0_AFC1_AG0_AFEM1_AFEM1_ASEM1_CLR1_CADS0_DTLA0_DTLB0_DTVA0_DTVB1_DTVSM0_DPLBn1_EPS0_ELFLR0_EMLLn1_FDSI0_GRPM1_GRVWA8_GRVWB8_GSUn1_GSUAMB_GSUC0_GSUWGMRR0_GLS0_ISA1201_IU1_K1_LDSTI0_LBSPPA128_LBSPPB0_LBSPPM0_LPA8_LPB0_LPM0_LRVW8_LWPMn1_MIAV1_MIWT1_4_MO40_MGRIPMn1_NTn1_NTA0_NTB0_NTC0_NTD0_NTM0_NEPBS0_NLCA1_NLCB2_ONLL0_PGR2_PLR1_PKA0_SGROBn1_SIA3_SS0_SU32_SUM0_SUS256_SPO0_SRVW0_SSO0_SVW8_SK0_SKFTR0_SKXCCM0_SGRO0_TIN0_TLDS1_TLDSM1_ULSGRO0_USL1_UIOFGRO0_USFGROn1_VSn1_VWA1_VWB1_WSGRA0_WSGRB0_WS32_WG32_4_1_WGM8_WGMXCC1_WGMXCCGn1
    SolutionIndex: 153
    SolutionNameMin: Cijk_Alik_Bjlk_F8B8S_BH_Bias_SHB_HA_S_SAB_SCD_SAV_UserArgs_MT128x128x32_MI16x16x1_SN_LDSB1_AFC1_AG0_AFEM1_AFEM1_ASEM1_CLR1_CADS0_DTLA0_DTLB0_DTVA0_DTVB0_DTVSM0_DPLBn1_EPS0_ELFLR0_EMLLn1_FDSI0_GRPM1_GRVWA8_GRVWB16_GSUn1_GSUAMB_GSUC0_GSUWGMRR0_GLS0_ISA1201_IU2_K1_LDSTI0_LBSPPA256_LBSPPB1024_LBSPPM0_LPA8_LPB32_LPM0_LRVW8_LWPMn1_MIAV1_MIWT8_2_MO40_MGRIPMn1_NTn1_NTA0_NTB0_NTC0_NTD0_NTM0_NEPBS0_NLCA1_NLCB1_ONLL0_PGR2_PLR1_PKA0_SGROBn1_SIA2_SS0_SU32_SUM0_SUS256_SPO0_SRVW0_SSO0_SVW8_SK0_SKFTR0_SKXCCM0_SGRO0_TIN0_TLDS1_TLDSM1_ULSGRO0_USL1_UIOFGRO0_USFGROn1_VSn1_VWA8_VWB2_WSGRA0_WSGRB0_WS32_WG16_8_1_WGM8_WGMXCC1_WGMXCCGn1
    SolutionIndex: 154
    SolutionNameMin: Cijk_Alik_Bjlk_F8B8S_BH_Bias_SHB_HA_S_SAB_SCD_SAV_UserArgs_MT64x128x64_MI16x16x1_SN_LDSB0_AFC1_AG0_AFEM1_AFEM1_ASEM1_CLR1_CADS0_DTLA0_DTLB0_DTVA0_DTVB1_DTVSM0_DPLBn1_EPS0_ELFLR0_EMLLn1_FDSI0_GRPM1_GRVWA8_GRVWB8_GSUn1_GSUAMB_GSUC0_GSUWGMRR0_GLS0_ISA1201_IU1_K1_LDSTI0_LBSPPA128_LBSPPB0_LBSPPM0_LPA8_LPB0_LPM0_LRVW8_LWPMn1_MIAV1_MIWT1_8_MO40_MGRIPMn1_NTn1_NTA0_NTB0_NTC0_NTD0_NTM0_NEPBS0_NLCA1_NLCB4_ONLL0_PGR2_PLR1_PKA0_SGROBn1_SIA3_SS1_SU32_SUM0_SUS256_SPO0_SRVW0_SSO0_SVW1_SK0_SKFTR0_SKXCCM0_SGRO0_TIN0_TLDS1_TLDSM1_ULSGRO0_USL1_UIOFGRO0_USFGROn1_VSn1_VWA1_VWB1_WSGRA0_WSGRB0_WS32_WG64_2_1_WGM8_WGMXCC1_WGMXCCGn1
    SolutionIndex: 155
    SolutionNameMin: Cijk_Alik_Bjlk_F8B8S_BH_Bias_SHB_HA_S_SAB_SCD_SAV_UserArgs_MT16x32x64_MI16x16x1_SN_LDSB0_AFC1_AG0_AFEM1_AFEM1_ASEM1_CLR1_CADS0_DTLA0_DTLB0_DTVA0_DTVB1_DTVSM0_DPLBn1_EPS0_ELFLR0_EMLLn1_FDSI0_GRPM1_GRVWA8_GRVWB8_GSUn1_GSUAMB_GSUC0_GSUWGMRR0_GLS0_ISA1201_IU1_K1_LDSTI0_LBSPPA128_LBSPPB0_LBSPPM0_LPA8_LPB0_LPM0_LRVW8_LWPMn1_MIAV1_MIWT1_1_MO40_MGRIPMn1_NTn1_NTA0_NTB0_NTC0_NTD0_NTM0_NEPBS0_NLCA1_NLCB1_ONLL0_PGR2_PLR1_PKA0_SGROBn1_SIA3_SS1_SU32_SUM0_SUS256_SPO0_SRVW0_SSO0_SVW1_SK0_SKFTR0_SKXCCM0_SGRO0_TIN0_TLDS1_TLDSM1_ULSGRO0_USL1_UIOFGRO0_USFGROn1_VSn1_VWA1_VWB1_WSGRA0_WSGRB0_WS32_WG16_4_1_WGM8_WGMXCC1_WGMXCCGn1
    SolutionIndex: 156
    SolutionNameMin: Cijk_Alik_Bjlk_F8B8S_BH_Bias_SHB_HA_S_SAB_SCD_SAV_UserArgs_MT32x32x256_MI16x16x1_SN_LDSB0_AFC1_AG0_AFEM1_AFEM1_ASEM1_CLR1_CADS0_DTLA0_DTLB0_DTVA0_DTVB1_DTVSM0_DPLBn1_EPS0_ELFLR0_EMLLn1_FDSI0_GRPM1_GRVWA8_GRVWB8_GSUn1_GSUAMB_GSUC0_GSUWGMRR0_GLS0_ISA1201_IU1_K1_LDSTI0_LBSPPA256_LBSPPB0_LBSPPM0_LPA8_LPB0_LPM0_LRVW8_LWPMn1_MIAV1_MIWT1_1_MO40_MGRIPMn1_NTn1_NTA0_NTB0_NTC0_NTD0_NTM0_NEPBS0_NLCA1_NLCB1_ONLL0_PGR2_PLR1_PKA0_SGROBn1_SIA3_SS1_SU32_SUM0_SUS256_SPO0_SRVW0_SSO0_SVW1_SK0_SKFTR0_SKXCCM0_SGRO0_TIN0_TLDS1_TLDSM1_ULSGRO0_USL1_UIOFGRO0_USFGROn1_VSn1_VWA1_VWB1_WSGRA0_WSGRB0_WS32_WG32_4_1_WGM8_WGMXCC1_WGMXCCGn1
    SolutionIndex: 157
    SolutionNameMin: Cijk_Alik_Bjlk_F8B8S_BH_Bias_SHB_HA_S_SAB_SCD_SAV_UserArgs_MT32x128x128_MI16x16x1_SN_LDSB0_AFC1_AG0_AFEM1_AFEM1_ASEM1_CLR1_CADS0_DTLA0_DTLB0_DTVA0_DTVB1_DTVSM0_DPLBn1_EPS1_ELFLR0_EMLLn1_FDSI0_GRPM1_GRVWA8_GRVWB8_GSUn1_GSUAMB_GSUC0_GSUWGMRR0_GLS0_ISA1201_IU1_K1_LDSTI0_LBSPPA128_LBSPPB0_LBSPPM0_LPA8_LPB0_LPM0_LRVW8_LWPMn1_MIAV1_MIWT1_4_MO40_MGRIPMn1_NTn1_NTA0_NTB0_NTC0_NTD0_NTM0_NEPBS0_NLCA1_NLCB8_ONLL0_PGR1_PLR1_PKA0_SGROBn1_SIA3_SS1_SU32_SUM0_SUS256_SPO0_SRVW0_SSO0_SVW1_SK0_SKFTR0_SKXCCM0_SGRO0_TIN0_TLDS1_TLDSM1_ULSGRO0_USL1_UIOFGRO0_USFGROn1_VSn1_VWA1_VWB1_WSGRA0_WSGRB0_WS32_WG32_4_1_WGM8_WGMXCC1_WGMXCCGn1
    SolutionIndex: 158
    SolutionNameMin: Cijk_Alik_Bjlk_F8B8S_BH_Bias_SHB_HA_S_SAB_SCD_SAV_UserArgs_MT64x64x32_MI16x16x1_SN_LDSB1_AFC1_AG0_AFEM1_AFEM1_ASEM1_CLR1_CADS0_DTLA0_DTLB0_DTVA0_DTVB0_DTVSM0_DPLBn1_EPS1_ELFLR0_EMLLn1_FDSI0_GRPM1_GRVWA8_GRVWB16_GSUn1_GSUAMB_GSUC0_GSUWGMRR0_GLS0_ISA1201_IU2_K1_LDSTI0_LBSPPA128_LBSPPB512_LBSPPM0_LPA8_LPB32_LPM0_LRVW8_LWPMn1_MIAV1_MIWT2_2_MO40_MGRIPMn1_NTn1_NTA0_NTB0_NTC0_NTD0_NTM0_NEPBS0_NLCA1_NLCB1_ONLL0_PGR1_PLR1_PKA0_SGROBn1_SIA2_SS0_SU32_SUM0_SUS256_SPO0_SRVW0_SSO0_SVW16_SK0_SKFTR0_SKXCCM0_SGRO0_TIN0_TLDS1_TLDSM1_ULSGRO0_USL1_UIOFGRO0_USFGROn1_VSn1_VWA2_VWB2_WSGRA0_WSGRB0_WS32_WG32_4_1_WGM8_WGMXCC1_WGMXCCGn1
    SolutionIndex: 159
    SolutionNameMin: Cijk_Alik_Bjlk_F8B8S_BH_Bias_SHB_HA_S_SAB_SCD_SAV_UserArgs_MT128x128x32_MI16x16x1_SN_LDSB1_AFC1_AG0_AFEM1_AFEM1_ASEM1_CLR1_CADS0_DTLA0_DTLB0_DTVA0_DTVB0_DTVSM0_DPLBn1_EPS1_ELFLR0_EMLLn1_FDSI0_GRPM1_GRVWA8_GRVWB16_GSUn1_GSUAMB_GSUC0_GSUWGMRR0_GLS0_ISA1201_IU2_K1_LDSTI0_LBSPPA256_LBSPPB1024_LBSPPM0_LPA8_LPB32_LPM0_LRVW8_LWPMn1_MIAV1_MIWT8_2_MO40_MGRIPMn1_NTn1_NTA0_NTB0_NTC0_NTD0_NTM0_NEPBS0_NLCA1_NLCB1_ONLL0_PGR1_PLR1_PKA0_SGROBn1_SIA2_SS0_SU32_SUM0_SUS256_SPO0_SRVW0_SSO0_SVW8_SK0_SKFTR0_SKXCCM0_SGRO0_TIN0_TLDS1_TLDSM1_ULSGRO0_USL1_UIOFGRO0_USFGROn1_VSn1_VWA8_VWB2_WSGRA0_WSGRB0_WS32_WG16_8_1_WGM8_WGMXCC1_WGMXCCGn1
    SolutionIndex: 160
    SolutionNameMin: Cijk_Alik_Bjlk_F8B8S_BH_Bias_SHB_HA_S_SAB_SCD_SAV_UserArgs_MT128x128x32_MI16x16x1_SN_LDSB1_AFC1_AG0_AFEM1_AFEM1_ASEM1_CLR1_CADS0_DTLA0_DTLB0_DTVA0_DTVB0_DTVSM0_DPLBn1_EPS0_ELFLR0_EMLLn1_FDSI0_GRPM1_GRVWA8_GRVWB16_GSUn1_GSUAMB_GSUC0_GSUWGMRR0_GLS0_ISA1201_IU2_K1_LDSTI0_LBSPPA256_LBSPPB1024_LBSPPM0_LPA8_LPB32_LPM0_LRVW8_LWPMn1_MIAV1_MIWT8_2_MO40_MGRIPMn1_NTn1_NTA0_NTB0_NTC0_NTD0_NTM0_NEPBS0_NLCA1_NLCB1_ONLL0_PGR2_PLR1_PKA0_SGROBn1_SIA2_SS1_SU32_SUM0_SUS256_SPO0_SRVW0_SSO0_SVW8_SK0_SKFTR0_SKXCCM0_SGRO0_TIN0_TLDS1_TLDSM1_ULSGRO0_USL1_UIOFGRO0_USFGROn1_VSn1_VWA8_VWB2_WSGRA0_WSGRB0_WS32_WG16_8_1_WGM8_WGMXCC1_WGMXCCGn1
    SolutionIndex: 161
    SolutionNameMin: Cijk_Alik_Bjlk_F8B8S_BH_Bias_SHB_HA_S_SAB_SCD_SAV_UserArgs_MT64x128x64_MI16x16x1_SN_LDSB0_AFC1_AG0_AFEM1_AFEM1_ASEM1_CLR1_CADS0_DTLA0_DTLB0_DTVA0_DTVB0_DTVSM0_DPLBn1_EPS0_ELFLR0_EMLLn1_FDSI0_GRPM1_GRVWA16_GRVWB16_GSUn1_GSUAMB_GSUC0_GSUWGMRR0_GLS0_ISA1201_IU1_K1_LDSTI0_LBSPPA128_LBSPPB0_LBSPPM0_LPA32_LPB0_LPM0_LRVW16_LWPMn1_MIAV1_MIWT1_8_MO40_MGRIPMn1_NTn1_NTA0_NTB0_NTC0_NTD0_NTM0_NEPBS0_NLCA1_NLCB1_ONLL0_PGR2_PLR1_PKA0_SGROBn1_SIA3_SS0_SU32_SUM0_SUS256_SPO0_SRVW0_SSO0_SVW8_SK0_SKFTR0_SKXCCM0_SGRO0_TIN0_TLDS1_TLDSM1_ULSGRO1_USL1_UIOFGRO0_USFGROn1_VSn1_VWA1_VWB8_WSGRA0_WSGRB0_WS32_WG64_2_1_WGM8_WGMXCC1_WGMXCCGn1
    SolutionIndex: 162
    SolutionNameMin: Cijk_Alik_Bjlk_F8B8S_BH_Bias_SHB_HA_S_SAB_SCD_SAV_UserArgs_MT16x128x32_MI16x16x1_SN_LDSB0_AFC1_AG0_AFEM1_AFEM1_ASEM32_CLR1_CADS0_DTLA0_DTLB0_DTVA1_DTVB1_DTVSM0_DPLBn1_EPS0_ELFLR0_EMLLn1_FDSI0_GRPM1_GRVWA8_GRVWB8_GSUn1_GSUAMB_GSUC0_GSUWGMRR0_GLS0_ISA1201_IU1_K1_LDSTI0_LBSPPA0_LBSPPB0_LBSPPM0_LPA0_LPB0_LPM0_LRVW8_LWPMn1_MIAV1_MIWT1_8_MO40_MGRIPMn1_NTn1_NTA0_NTB0_NTC0_NTD0_NTM0_NEPBS0_NLCA2_NLCB2_ONLL0_PGR1_PLR0_PKA0_SGROBn1_SIA3_SS0_SU32_SUM0_SUS256_SPO0_SRVW0_SSO0_SVW8_SK0_SKFTR0_SKXCCM0_SGRO0_TIN0_TLDS1_TLDSM1_ULSGRO0_USL1_UIOFGRO0_USFGROn1_VSn1_VWA1_VWB1_WSGRA0_WSGRB0_WS32_WG16_2_1_WGM8_WGMXCC1_WGMXCCGn1
    SolutionIndex: 163
    SolutionNameMin: Cijk_Alik_Bjlk_F8B8S_BH_Bias_SHB_HA_S_SAB_SCD_SAV_UserArgs_MT16x512x64_MI16x16x1_SN_LDSB0_AFC1_AG0_AFEM1_AFEM1_ASEM1_CLR1_CADS0_DTLA0_DTLB0_DTVA0_DTVB1_DTVSM0_DPLBn1_EPS0_ELFLR0_EMLLn1_FDSI0_GRPM1_GRVWA8_GRVWB8_GSUn1_GSUAMB_GSUC0_GSUWGMRR0_GLS0_ISA1201_IU1_K1_LDSTI0_LBSPPA128_LBSPPB0_LBSPPM0_LPA8_LPB0_LPM0_LRVW8_LWPMn1_MIAV1_MIWT1_8_MO40_MGRIPMn1_NTn1_NTA0_NTB0_NTC0_NTD0_NTM0_NEPBS0_NLCA1_NLCB4_ONLL0_PGR2_PLR1_PKA0_SGROBn1_SIA3_SS0_SU32_SUM0_SUS256_SPO0_SRVW0_SSO0_SVW8_SK0_SKFTR0_SKXCCM0_SGRO0_TIN0_TLDS1_TLDSM1_ULSGRO0_USL1_UIOFGRO0_USFGROn1_VSn1_VWA1_VWB1_WSGRA0_WSGRB0_WS32_WG16_8_1_WGM8_WGMXCC1_WGMXCCGn1
    SolutionIndex: 164
    SolutionNameMin: Cijk_Alik_Bjlk_F8B8S_BH_Bias_SHB_HA_S_SAB_SCD_SAV_UserArgs_MT64x64x32_MI16x16x1_SN_LDSB0_AFC1_AG0_AFEM1_AFEM1_ASEM1_CLR1_CADS0_DTLA0_DTLB0_DTVA0_DTVB1_DTVSM0_DPLBn1_EPS0_ELFLR0_EMLLn1_FDSI0_GRPM1_GRVWA8_GRVWB8_GSUn1_GSUAMB_GSUC0_GSUWGMRR0_GLS0_ISA1201_IU1_K1_LDSTI0_LBSPPA128_LBSPPB0_LBSPPM0_LPA8_LPB0_LPM0_LRVW8_LWPMn1_MIAV1_MIWT2_2_MO40_MGRIPMn1_NTn1_NTA0_NTB0_NTC0_NTD0_NTM0_NEPBS0_NLCA1_NLCB2_ONLL0_PGR2_PLR1_PKA0_SGROBn1_SIA3_SS1_SU32_SUM0_SUS256_SPO0_SRVW0_SSO0_SVW2_SK0_SKFTR0_SKXCCM0_SGRO0_TIN0_TLDS1_TLDSM1_ULSGRO0_USL1_UIOFGRO0_USFGROn1_VSn1_VWA2_VWB1_WSGRA0_WSGRB0_WS32_WG32_4_1_WGM8_WGMXCC1_WGMXCCGn1
    SolutionIndex: 165
    SolutionNameMin: Cijk_Alik_Bjlk_F8B8S_BH_Bias_SHB_HA_S_SAB_SCD_SAV_UserArgs_MT16x128x64_MI16x16x1_SN_LDSB0_AFC1_AG0_AFEM1_AFEM1_ASEM1_CLR1_CADS0_DTLA0_DTLB0_DTVA0_DTVB1_DTVSM0_DPLBn1_EPS1_ELFLR0_EMLLn1_FDSI0_GRPM1_GRVWA8_GRVWB8_GSUn1_GSUAMB_GSUC0_GSUWGMRR0_GLS0_ISA1201_IU1_K1_LDSTI0_LBSPPA128_LBSPPB0_LBSPPM0_LPA8_LPB0_LPM0_LRVW8_LWPMn1_MIAV1_MIWT1_8_MO40_MGRIPMn1_NTn1_NTA0_NTB0_NTC0_NTD0_NTM0_NEPBS0_NLCA1_NLCB4_ONLL0_PGR1_PLR1_PKA0_SGROBn1_SIA3_SS0_SU32_SUM0_SUS256_SPO0_SRVW0_SSO0_SVW8_SK0_SKFTR0_SKXCCM0_SGRO0_TIN0_TLDS1_TLDSM1_ULSGRO0_USL1_UIOFGRO0_USFGROn1_VSn1_VWA1_VWB1_WSGRA0_WSGRB0_WS32_WG16_2_1_WGM8_WGMXCC1_WGMXCCGn1
    SolutionIndex: 166
    SolutionNameMin: Cijk_Alik_Bjlk_F8B8S_BH_Bias_SHB_HA_S_SAB_SCD_SAV_UserArgs_MT16x16x128_MI16x16x1_SN_LDSB0_AFC1_AG0_AFEM1_AFEM1_ASEM1_CLR1_CADS0_DTLA0_DTLB0_DTVA0_DTVB1_DTVSM0_DPLBn1_EPS0_ELFLR0_EMLLn1_FDSI0_GRPM1_GRVWA8_GRVWB8_GSUn1_GSUAMB_GSUC0_GSUWGMRR0_GLS0_ISA1201_IU1_K1_LDSTI0_LBSPPA128_LBSPPB0_LBSPPM0_LPA8_LPB0_LPM0_LRVW8_LWPMn1_MIAV1_MIWT1_1_MO40_MGRIPMn1_NTn1_NTA0_NTB0_NTC0_NTD0_NTM0_NEPBS0_NLCA1_NLCB1_ONLL0_PGR2_PLR1_PKA0_SGROBn1_SIA3_SS0_SU32_SUM0_SUS256_SPO0_SRVW0_SSO0_SVW8_SK0_SKFTR0_SKXCCM0_SGRO0_TIN0_TLDS1_TLDSM1_ULSGRO0_USL1_UIOFGRO0_USFGROn1_VSn1_VWA1_VWB1_WSGRA0_WSGRB0_WS32_WG16_2_1_WGM8_WGMXCC1_WGMXCCGn1
    SolutionIndex: 167
    SolutionNameMin: Cijk_Alik_Bjlk_F8B8S_BH_Bias_SHB_HA_S_SAB_SCD_SAV_UserArgs_MT64x64x32_MI16x16x1_SN_LDSB1_AFC1_AG0_AFEM1_AFEM1_ASEM1_CLR1_CADS0_DTLA0_DTLB0_DTVA0_DTVB0_DTVSM0_DPLBn1_EPS0_ELFLR0_EMLLn1_FDSI0_GRPM1_GRVWA8_GRVWB16_GSUn1_GSUAMB_GSUC0_GSUWGMRR0_GLS0_ISA1201_IU2_K1_LDSTI0_LBSPPA128_LBSPPB512_LBSPPM0_LPA8_LPB32_LPM0_LRVW8_LWPMn1_MIAV1_MIWT2_2_MO40_MGRIPMn1_NTn1_NTA0_NTB0_NTC0_NTD0_NTM0_NEPBS0_NLCA1_NLCB1_ONLL0_PGR2_PLR1_PKA0_SGROBn1_SIA2_SS0_SU32_SUM0_SUS256_SPO0_SRVW0_SSO0_SVW16_SK0_SKFTR0_SKXCCM0_SGRO0_TIN0_TLDS1_TLDSM1_ULSGRO0_USL1_UIOFGRO0_USFGROn1_VSn1_VWA2_VWB2_WSGRA0_WSGRB0_WS32_WG32_4_1_WGM8_WGMXCC1_WGMXCCGn1
    SolutionIndex: 168
    SolutionNameMin: Cijk_Alik_Bjlk_F8B8S_BH_Bias_SHB_HA_S_SAB_SCD_SAV_UserArgs_MT128x128x32_MI16x16x1_SN_LDSB0_AFC1_AG0_AFEM1_AFEM1_ASEM1_CLR1_CADS0_DTLA0_DTLB0_DTVA0_DTVB1_DTVSM0_DPLBn1_EPS1_ELFLR0_EMLLn1_FDSI0_GRPM1_GRVWA8_GRVWB8_GSUn1_GSUAMB_GSUC0_GSUWGMRR0_GLS0_ISA1201_IU1_K1_LDSTI0_LBSPPA128_LBSPPB0_LBSPPM0_LPA8_LPB0_LPM0_LRVW8_LWPMn1_MIAV1_MIWT4_4_MO40_MGRIPMn1_NTn1_NTA0_NTB0_NTC0_NTD0_NTM0_NEPBS0_NLCA1_NLCB2_ONLL0_PGR1_PLR1_PKA0_SGROBn1_SIA3_SS1_SU32_SUM0_SUS256_SPO0_SRVW0_SSO0_SVW4_SK0_SKFTR0_SKXCCM0_SGRO0_TIN0_TLDS1_TLDSM1_ULSGRO0_USL1_UIOFGRO0_USFGROn1_VSn1_VWA4_VWB1_WSGRA0_WSGRB0_WS32_WG32_4_1_WGM8_WGMXCC1_WGMXCCGn1
    SolutionIndex: 169
    SolutionNameMin: Cijk_Alik_Bjlk_F8B8S_BH_Bias_SHB_HA_S_SAB_SCD_SAV_UserArgs_MT128x128x16_MI16x16x1_SN_LDSB1_AFC1_AG0_AFEM1_AFEM1_ASEM1_CLR1_CADS0_DTLA0_DTLB0_DTVA0_DTVB0_DTVSM0_DPLBn1_EPS0_ELFLR0_EMLLn1_FDSI0_GRPM1_GRVWA8_GRVWB16_GSUn1_GSUAMB_GSUC0_GSUWGMRR0_GLS0_ISA1201_IU1_K1_LDSTI0_LBSPPA128_LBSPPB1024_LBSPPM0_LPA8_LPB32_LPM0_LRVW8_LWPMn1_MIAV1_MIWT8_2_MO40_MGRIPMn1_NTn1_NTA0_NTB0_NTC0_NTD0_NTM0_NEPBS0_NLCA1_NLCB1_ONLL0_PGR2_PLR1_PKA0_SGROBn1_SIA2_SS1_SU32_SUM0_SUS256_SPO0_SRVW0_SSO0_SVW8_SK0_SKFTR0_SKXCCM0_SGRO0_TIN0_TLDS1_TLDSM1_ULSGRO0_USL1_UIOFGRO0_USFGROn1_VSn1_VWA8_VWB2_WSGRA0_WSGRB0_WS32_WG16_8_1_WGM8_WGMXCC1_WGMXCCGn1
    SolutionIndex: 170
    SolutionNameMin: Cijk_Alik_Bjlk_F8B8S_BH_Bias_SHB_HA_S_SAB_SCD_SAV_UserArgs_MT128x128x16_MI16x16x1_SN_LDSB1_AFC1_AG0_AFEM1_AFEM1_ASEM1_CLR1_CADS0_DTLA0_DTLB0_DTVA0_DTVB0_DTVSM0_DPLBn1_EPS1_ELFLR0_EMLLn1_FDSI0_GRPM1_GRVWA8_GRVWB16_GSUn1_GSUAMB_GSUC0_GSUWGMRR0_GLS0_ISA1201_IU1_K1_LDSTI0_LBSPPA128_LBSPPB1024_LBSPPM0_LPA8_LPB32_LPM0_LRVW8_LWPMn1_MIAV1_MIWT8_2_MO40_MGRIPMn1_NTn1_NTA0_NTB0_NTC0_NTD0_NTM0_NEPBS0_NLCA1_NLCB1_ONLL0_PGR1_PLR1_PKA0_SGROBn1_SIA2_SS1_SU32_SUM0_SUS256_SPO0_SRVW0_SSO0_SVW8_SK0_SKFTR0_SKXCCM0_SGRO0_TIN0_TLDS1_TLDSM1_ULSGRO0_USL1_UIOFGRO0_USFGROn1_VSn1_VWA8_VWB2_WSGRA0_WSGRB0_WS32_WG16_8_1_WGM8_WGMXCC1_WGMXCCGn1
    SolutionIndex: 171
    SolutionNameMin: Cijk_Alik_Bjlk_F8B8S_BH_Bias_SHB_HA_S_SAB_SCD_SAV_UserArgs_MT128x64x32_MI16x16x1_SN_LDSB0_AFC1_AG0_AFEM1_AFEM1_ASEM1_CLR1_CADS0_DTLA0_DTLB0_DTVA0_DTVB1_DTVSM0_DPLBn1_EPS1_ELFLR0_EMLLn1_FDSI0_GRPM1_GRVWA8_GRVWB8_GSUn1_GSUAMB_GSUC0_GSUWGMRR0_GLS0_ISA1201_IU1_K1_LDSTI0_LBSPPA256_LBSPPB0_LBSPPM0_LPA8_LPB0_LPM0_LRVW8_LWPMn1_MIAV1_MIWT8_1_MO40_MGRIPMn1_NTn1_NTA0_NTB0_NTC0_NTD0_NTM0_NEPBS0_NLCA1_NLCB1_ONLL0_PGR1_PLR1_PKA0_SGROBn1_SIA3_SS1_SU32_SUM0_SUS256_SPO0_SRVW0_SSO0_SVW8_SK0_SKFTR0_SKXCCM0_SGRO0_TIN0_TLDS1_TLDSM1_ULSGRO0_USL1_UIOFGRO0_USFGROn1_VSn1_VWA8_VWB1_WSGRA0_WSGRB0_WS32_WG16_8_1_WGM8_WGMXCC1_WGMXCCGn1
    SolutionIndex: 172
    SolutionNameMin: Cijk_Alik_Bjlk_F8B8S_BH_Bias_SHB_HA_S_SAB_SCD_SAV_UserArgs_MT128x128x32_MI16x16x1_SN_LDSB0_AFC1_AG0_AFEM1_AFEM1_ASEM1_CLR1_CADS0_DTLA0_DTLB0_DTVA0_DTVB1_DTVSM0_DPLBn1_EPS1_ELFLR0_EMLLn1_FDSI0_GRPM1_GRVWA8_GRVWB8_GSUn1_GSUAMB_GSUC0_GSUWGMRR0_GLS0_ISA1201_IU1_K1_LDSTI0_LBSPPA128_LBSPPB0_LBSPPM0_LPA8_LPB0_LPM0_LRVW8_LWPMn1_MIAV1_MIWT4_4_MO40_MGRIPMn1_NTn1_NTA0_NTB0_NTC0_NTD0_NTM0_NEPBS0_NLCA1_NLCB2_ONLL0_PGR1_PLR1_PKA0_SGROBn1_SIA3_SS0_SU32_SUM0_SUS256_SPO0_SRVW0_SSO0_SVW8_SK0_SKFTR0_SKXCCM0_SGRO0_TIN0_TLDS1_TLDSM1_ULSGRO0_USL1_UIOFGRO0_USFGROn1_VSn1_VWA4_VWB1_WSGRA0_WSGRB0_WS32_WG32_4_1_WGM8_WGMXCC1_WGMXCCGn1
    SolutionIndex: 173
    SolutionNameMin: Cijk_Alik_Bjlk_F8B8S_BH_Bias_SHB_HA_S_SAB_SCD_SAV_UserArgs_MT128x128x32_MI16x16x1_SN_LDSB0_AFC1_AG0_AFEM1_AFEM1_ASEM1_CLR1_CADS0_DTLA0_DTLB0_DTVA0_DTVB1_DTVSM0_DPLBn1_EPS1_ELFLR0_EMLLn1_FDSI0_GRPM1_GRVWA8_GRVWB8_GSUn1_GSUAMB_GSUC0_GSUWGMRR0_GLS0_ISA1201_IU1_K1_LDSTI0_LBSPPA256_LBSPPB0_LBSPPM0_LPA8_LPB0_LPM0_LRVW8_LWPMn1_MIAV1_MIWT8_2_MO40_MGRIPMn1_NTn1_NTA0_NTB0_NTC0_NTD0_NTM0_NEPBS0_NLCA1_NLCB2_ONLL0_PGR1_PLR1_PKA0_SGROBn1_SIA3_SS0_SU32_SUM0_SUS256_SPO0_SRVW0_SSO0_SVW8_SK0_SKFTR0_SKXCCM0_SGRO0_TIN0_TLDS1_TLDSM1_ULSGRO0_USL1_UIOFGRO0_USFGROn1_VSn1_VWA8_VWB1_WSGRA0_WSGRB0_WS32_WG16_8_1_WGM8_WGMXCC1_WGMXCCGn1
    SolutionIndex: 174
    SolutionNameMin: Cijk_Alik_Bjlk_F8B8S_BH_Bias_SHB_HA_S_SAB_SCD_SAV_UserArgs_MT128x128x16_MI16x16x1_SN_LDSB1_AFC1_AG0_AFEM1_AFEM1_ASEM1_CLR1_CADS0_DTLA0_DTLB0_DTVA0_DTVB0_DTVSM0_DPLBn1_EPS0_ELFLR0_EMLLn1_FDSI0_GRPM1_GRVWA8_GRVWB8_GSUn1_GSUAMB_GSUC0_GSUWGMRR0_GLS0_ISA1201_IU1_K1_LDSTI0_LBSPPA128_LBSPPB1024_LBSPPM0_LPA8_LPB32_LPM0_LRVW8_LWPMn1_MIAV1_MIWT8_2_MO40_MGRIPMn1_NTn1_NTA0_NTB0_NTC0_NTD0_NTM0_NEPBS0_NLCA1_NLCB1_ONLL0_PGR2_PLR1_PKA0_SGROBn1_SIA2_SS1_SU32_SUM0_SUS256_SPO0_SRVW0_SSO0_SVW8_SK0_SKFTR0_SKXCCM0_SGRO0_TIN0_TLDS1_TLDSM1_ULSGRO1_USL1_UIOFGRO0_USFGROn1_VSn1_VWA8_VWB2_WSGRA0_WSGRB0_WS32_WG16_8_1_WGM8_WGMXCC1_WGMXCCGn1
    SolutionIndex: 175
    SolutionNameMin: Cijk_Alik_Bjlk_F8B8S_BH_Bias_SHB_HA_S_SAB_SCD_SAV_UserArgs_MT128x128x16_MI16x16x1_SN_LDSB1_AFC1_AG0_AFEM1_AFEM1_ASEM1_CLR1_CADS0_DTLA0_DTLB0_DTVA0_DTVB0_DTVSM0_DPLBn1_EPS0_ELFLR0_EMLLn1_FDSI0_GRPM1_GRVWA8_GRVWB16_GSUn1_GSUAMB_GSUC0_GSUWGMRR0_GLS0_ISA1201_IU1_K1_LDSTI0_LBSPPA128_LBSPPB1024_LBSPPM0_LPA8_LPB32_LPM0_LRVW8_LWPMn1_MIAV1_MIWT8_2_MO40_MGRIPMn1_NTn1_NTA0_NTB0_NTC0_NTD0_NTM0_NEPBS0_NLCA1_NLCB1_ONLL0_PGR2_PLR1_PKA0_SGROBn1_SIA2_SS0_SU32_SUM0_SUS256_SPO0_SRVW0_SSO0_SVW8_SK0_SKFTR0_SKXCCM0_SGRO0_TIN0_TLDS1_TLDSM1_ULSGRO0_USL1_UIOFGRO0_USFGROn1_VSn1_VWA8_VWB2_WSGRA0_WSGRB0_WS32_WG16_8_1_WGM8_WGMXCC1_WGMXCCGn1
    SolutionIndex: 176
    SolutionNameMin: Cijk_Alik_Bjlk_F8B8S_BH_Bias_SHB_HA_S_SAB_SCD_SAV_UserArgs_MT128x128x16_MI16x16x1_SN_LDSB1_AFC1_AG0_AFEM1_AFEM1_ASEM1_CLR1_CADS0_DTLA0_DTLB0_DTVA0_DTVB0_DTVSM0_DPLBn1_EPS0_ELFLR0_EMLLn1_FDSI0_GRPM1_GRVWA8_GRVWB8_GSUn1_GSUAMB_GSUC0_GSUWGMRR0_GLS0_ISA1201_IU1_K1_LDSTI0_LBSPPA128_LBSPPB1024_LBSPPM0_LPA8_LPB32_LPM0_LRVW8_LWPMn1_MIAV1_MIWT8_2_MO40_MGRIPMn1_NTn1_NTA0_NTB0_NTC0_NTD0_NTM0_NEPBS0_NLCA1_NLCB1_ONLL0_PGR2_PLR1_PKA0_SGROBn1_SIA2_SS0_SU32_SUM0_SUS256_SPO0_SRVW0_SSO0_SVW8_SK0_SKFTR0_SKXCCM0_SGRO0_TIN0_TLDS1_TLDSM1_ULSGRO1_USL1_UIOFGRO0_USFGROn1_VSn1_VWA8_VWB2_WSGRA0_WSGRB0_WS32_WG16_8_1_WGM8_WGMXCC1_WGMXCCGn1
    SolutionIndex: 177
    SolutionNameMin: Cijk_Alik_Bjlk_F8B8S_BH_Bias_SHB_HA_S_SAB_SCD_SAV_UserArgs_MT128x128x32_MI16x16x1_SN_LDSB1_AFC1_AG0_AFEM1_AFEM1_ASEM1_CLR1_CADS0_DTLA0_DTLB0_DTVA0_DTVB0_DTVSM0_DPLBn1_EPS1_ELFLR0_EMLLn1_FDSI0_GRPM1_GRVWA8_GRVWB16_GSUn1_GSUAMB_GSUC0_GSUWGMRR0_GLS0_ISA1201_IU2_K1_LDSTI0_LBSPPA128_LBSPPB1024_LBSPPM0_LPA8_LPB64_LPM0_LRVW8_LWPMn1_MIAV1_MIWT4_4_MO40_MGRIPMn1_NTn1_NTA0_NTB0_NTC0_NTD0_NTM0_NEPBS0_NLCA1_NLCB1_ONLL0_PGR1_PLR1_PKA0_SGROBn1_SIA2_SS0_SU32_SUM0_SUS256_SPO0_SRVW0_SSO0_SVW8_SK0_SKFTR0_SKXCCM0_SGRO0_TIN0_TLDS1_TLDSM1_ULSGRO0_USL1_UIOFGRO0_USFGROn1_VSn1_VWA4_VWB4_WSGRA0_WSGRB0_WS32_WG32_4_1_WGM8_WGMXCC1_WGMXCCGn1
    SolutionIndex: 178
    SolutionNameMin: Cijk_Alik_Bjlk_F8B8S_BH_Bias_SHB_HA_S_SAB_SCD_SAV_UserArgs_MT128x128x32_MI16x16x1_SN_LDSB1_AFC1_AG0_AFEM1_AFEM1_ASEM1_CLR1_CADS0_DTLA0_DTLB0_DTVA0_DTVB0_DTVSM0_DPLBn1_EPS1_ELFLR0_EMLLn1_FDSI0_GRPM1_GRVWA8_GRVWB16_GSUn1_GSUAMB_GSUC0_GSUWGMRR0_GLS0_ISA1201_IU2_K1_LDSTI0_LBSPPA128_LBSPPB1024_LBSPPM0_LPA8_LPB64_LPM0_LRVW8_LWPMn1_MIAV1_MIWT4_4_MO40_MGRIPMn1_NTn1_NTA0_NTB0_NTC0_NTD0_NTM0_NEPBS0_NLCA1_NLCB1_ONLL0_PGR1_PLR1_PKA0_SGROBn1_SIA2_SS1_SU32_SUM0_SUS256_SPO0_SRVW0_SSO0_SVW4_SK0_SKFTR0_SKXCCM0_SGRO0_TIN0_TLDS1_TLDSM1_ULSGRO0_USL1_UIOFGRO0_USFGROn1_VSn1_VWA4_VWB4_WSGRA0_WSGRB0_WS32_WG32_4_1_WGM8_WGMXCC1_WGMXCCGn1
    SolutionIndex: 179
    SolutionNameMin: Cijk_Alik_Bjlk_F8B8S_BH_Bias_SHB_HA_S_SAB_SCD_SAV_UserArgs_MT128x128x32_MI16x16x1_SN_LDSB1_AFC1_AG0_AFEM1_AFEM1_ASEM1_CLR1_CADS0_DTLA0_DTLB0_DTVA0_DTVB0_DTVSM0_DPLBn1_EPS0_ELFLR0_EMLLn1_FDSI0_GRPM1_GRVWA8_GRVWB8_GSUn1_GSUAMB_GSUC0_GSUWGMRR0_GLS0_ISA1201_IU2_K1_LDSTI0_LBSPPA256_LBSPPB1024_LBSPPM0_LPA8_LPB32_LPM0_LRVW8_LWPMn1_MIAV1_MIWT8_2_MO40_MGRIPMn1_NTn1_NTA0_NTB0_NTC0_NTD0_NTM0_NEPBS0_NLCA1_NLCB1_ONLL0_PGR2_PLR1_PKA0_SGROBn1_SIA2_SS0_SU32_SUM0_SUS256_SPO0_SRVW0_SSO0_SVW8_SK0_SKFTR0_SKXCCM0_SGRO0_TIN0_TLDS1_TLDSM1_ULSGRO1_USL1_UIOFGRO0_USFGROn1_VSn1_VWA8_VWB2_WSGRA0_WSGRB0_WS32_WG16_8_1_WGM8_WGMXCC1_WGMXCCGn1
    SolutionIndex: 180
    SolutionNameMin: Cijk_Alik_Bjlk_F8B8S_BH_Bias_SHB_HA_S_SAB_SCD_SAV_UserArgs_MT128x32x64_MI16x16x1_SN_LDSB0_AFC1_AG0_AFEM1_AFEM1_ASEM64_CLR1_CADS0_DTLA0_DTLB0_DTVA1_DTVB1_DTVSM0_DPLBn1_EPS0_ELFLR0_EMLLn1_FDSI0_GRPM1_GRVWA8_GRVWB8_GSUn1_GSUAMB_GSUC0_GSUWGMRR0_GLS0_ISA1201_IU1_K1_LDSTI0_LBSPPA0_LBSPPB0_LBSPPM0_LPA0_LPB0_LPM0_LRVW8_LWPMn1_MIAV1_MIWT4_1_MO40_MGRIPMn1_NTn1_NTA0_NTB0_NTC0_NTD0_NTM0_NEPBS0_NLCA4_NLCB1_ONLL0_PGR1_PLR0_PKA0_SGROBn1_SIA3_SS1_SU32_SUM0_SUS256_SPO0_SRVW0_SSO0_SVW4_SK0_SKFTR0_SKXCCM0_SGRO0_TIN0_TLDS1_TLDSM1_ULSGRO0_USL1_UIOFGRO0_USFGROn1_VSn1_VWA4_VWB1_WSGRA0_WSGRB0_WS32_WG32_4_1_WGM8_WGMXCC1_WGMXCCGn1
    SolutionIndex: 181
    SolutionNameMin: Cijk_Alik_Bjlk_F8B8S_BH_Bias_SHB_HA_S_SAB_SCD_SAV_UserArgs_MT128x128x16_MI16x16x1_SN_LDSB0_AFC1_AG0_AFEM1_AFEM1_ASEM16_CLR1_CADS0_DTLA0_DTLB0_DTVA1_DTVB1_DTVSM0_DPLBn1_EPS0_ELFLR0_EMLLn1_FDSI0_GRPM1_GRVWA8_GRVWB8_GSUn1_GSUAMB_GSUC0_GSUWGMRR0_GLS0_ISA1201_IU1_K1_LDSTI0_LBSPPA0_LBSPPB0_LBSPPM0_LPA0_LPB0_LPM0_LRVW8_LWPMn1_MIAV1_MIWT8_2_MO40_MGRIPMn1_NTn1_NTA0_NTB0_NTC0_NTD0_NTM0_NEPBS0_NLCA1_NLCB1_ONLL0_PGR1_PLR0_PKA0_SGROBn1_SIA3_SS1_SU32_SUM0_SUS256_SPO0_SRVW0_SSO0_SVW8_SK0_SKFTR0_SKXCCM0_SGRO0_TIN0_TLDS1_TLDSM1_ULSGRO0_USL1_UIOFGRO0_USFGROn1_VSn1_VWA8_VWB1_WSGRA0_WSGRB0_WS32_WG16_8_1_WGM8_WGMXCC1_WGMXCCGn1
    SolutionIndex: 182
    SolutionNameMin: Cijk_Alik_Bjlk_F8B8S_BH_Bias_SHB_HA_S_SAB_SCD_SAV_UserArgs_MT128x128x16_MI16x16x1_SN_LDSB0_AFC1_AG0_AFEM1_AFEM1_ASEM16_CLR1_CADS0_DTLA0_DTLB0_DTVA1_DTVB1_DTVSM0_DPLBn1_EPS0_ELFLR0_EMLLn1_FDSI0_GRPM1_GRVWA8_GRVWB8_GSUn1_GSUAMB_GSUC0_GSUWGMRR0_GLS0_ISA1201_IU1_K1_LDSTI0_LBSPPA0_LBSPPB0_LBSPPM0_LPA0_LPB0_LPM0_LRVW8_LWPMn1_MIAV1_MIWT4_4_MO40_MGRIPMn1_NTn1_NTA0_NTB0_NTC0_NTD0_NTM0_NEPBS0_NLCA1_NLCB1_ONLL0_PGR1_PLR0_PKA0_SGROBn1_SIA3_SS0_SU32_SUM0_SUS256_SPO0_SRVW0_SSO0_SVW8_SK0_SKFTR0_SKXCCM0_SGRO0_TIN0_TLDS1_TLDSM1_ULSGRO0_USL1_UIOFGRO0_USFGROn1_VSn1_VWA4_VWB1_WSGRA0_WSGRB0_WS32_WG32_4_1_WGM8_WGMXCC1_WGMXCCGn1
    SolutionIndex: 183
    SolutionNameMin: Cijk_Alik_Bjlk_F8B8S_BH_Bias_SHB_HA_S_SAB_SCD_SAV_UserArgs_MT128x64x16_MI16x16x1_SN_LDSB1_AFC1_AG0_AFEM1_AFEM1_ASEM1_CLR1_CADS0_DTLA0_DTLB0_DTVA0_DTVB0_DTVSM0_DPLBn1_EPS0_ELFLR0_EMLLn1_FDSI0_GRPM1_GRVWA8_GRVWB8_GSUn1_GSUAMB_GSUC0_GSUWGMRR0_GLS0_ISA1201_IU1_K1_LDSTI0_LBSPPA128_LBSPPB512_LBSPPM0_LPA8_LPB16_LPM0_LRVW8_LWPMn1_MIAV1_MIWT8_1_MO40_MGRIPMn1_NTn1_NTA0_NTB0_NTC0_NTD0_NTM0_NEPBS0_NLCA1_NLCB1_ONLL0_PGR2_PLR1_PKA0_SGROBn1_SIA2_SS1_SU32_SUM0_SUS256_SPO0_SRVW0_SSO0_SVW8_SK0_SKFTR0_SKXCCM0_SGRO0_TIN0_TLDS1_TLDSM1_ULSGRO0_USL1_UIOFGRO0_USFGROn1_VSn1_VWA8_VWB1_WSGRA0_WSGRB0_WS32_WG16_8_1_WGM8_WGMXCC1_WGMXCCGn1
    SolutionIndex: 184
    SolutionNameMin: Cijk_Alik_Bjlk_F8B8S_BH_Bias_SHB_HA_S_SAB_SCD_SAV_UserArgs_MT128x128x16_MI16x16x1_SN_LDSB0_AFC1_AG0_AFEM1_AFEM1_ASEM16_CLR1_CADS0_DTLA0_DTLB0_DTVA1_DTVB1_DTVSM0_DPLBn1_EPS0_ELFLR0_EMLLn1_FDSI0_GRPM1_GRVWA8_GRVWB8_GSUn1_GSUAMB_GSUC0_GSUWGMRR0_GLS0_ISA1201_IU1_K1_LDSTI0_LBSPPA0_LBSPPB0_LBSPPM0_LPA0_LPB0_LPM0_LRVW8_LWPMn1_MIAV1_MIWT4_4_MO40_MGRIPMn1_NTn1_NTA0_NTB0_NTC0_NTD0_NTM0_NEPBS0_NLCA1_NLCB1_ONLL0_PGR1_PLR0_PKA0_SGROBn1_SIA3_SS1_SU32_SUM0_SUS256_SPO0_SRVW0_SSO0_SVW4_SK0_SKFTR0_SKXCCM0_SGRO0_TIN0_TLDS1_TLDSM1_ULSGRO0_USL1_UIOFGRO0_USFGROn1_VSn1_VWA4_VWB1_WSGRA0_WSGRB0_WS32_WG32_4_1_WGM8_WGMXCC1_WGMXCCGn1
    SolutionIndex: 185
    SolutionNameMin: Cijk_Alik_Bjlk_F8B8S_BH_Bias_SHB_HA_S_SAB_SCD_SAV_UserArgs_MT128x128x16_MI16x16x1_SN_LDSB0_AFC1_AG0_AFEM1_AFEM1_ASEM1_CLR0_CADS0_DTLA0_DTLB0_DTVA0_DTVB0_DTVSM0_DPLBn1_EPS0_ELFLR0_EMLLn1_FDSI0_GRPM1_GRVWA8_GRVWB16_GSUn1_GSUAMB_GSUC0_GSUWGMRR0_GLS0_ISA1201_IU1_K1_LDSTI0_LBSPPA128_LBSPPB1024_LBSPPM0_LPA8_LPB32_LPM0_LRVW8_LWPMn1_MIAV1_MIWT8_2_MO40_MGRIPMn1_NTn1_NTA0_NTB0_NTC0_NTD0_NTM0_NEPBS0_NLCA1_NLCB1_ONLL0_PGR2_PLR0_PKA0_SGROBn1_SIA3_SS1_SU32_SUM0_SUS256_SPO0_SRVW0_SSO0_SVW8_SK0_SKFTR0_SKXCCM0_SGRO0_TIN0_TLDS1_TLDSM1_ULSGRO0_USL1_UIOFGRO0_USFGROn1_VSn1_VWA8_VWB2_WSGRA0_WSGRB0_WS32_WG16_8_1_WGM8_WGMXCC1_WGMXCCGn1
    SolutionIndex: 186
    SolutionNameMin: Cijk_Alik_Bjlk_F8B8S_BH_Bias_SHB_HA_S_SAB_SCD_SAV_UserArgs_MT128x128x32_MI16x16x1_SN_LDSB0_AFC1_AG0_AFEM1_AFEM1_ASEM32_CLR1_CADS0_DTLA0_DTLB0_DTVA1_DTVB1_DTVSM0_DPLBn1_EPS0_ELFLR0_EMLLn1_FDSI0_GRPM1_GRVWA8_GRVWB8_GSUn1_GSUAMB_GSUC0_GSUWGMRR0_GLS0_ISA1201_IU1_K1_LDSTI0_LBSPPA0_LBSPPB0_LBSPPM0_LPA0_LPB0_LPM0_LRVW8_LWPMn1_MIAV1_MIWT8_2_MO40_MGRIPMn1_NTn1_NTA0_NTB0_NTC0_NTD0_NTM0_NEPBS0_NLCA2_NLCB2_ONLL0_PGR1_PLR0_PKA0_SGROBn1_SIA3_SS1_SU32_SUM0_SUS256_SPO0_SRVW0_SSO0_SVW8_SK0_SKFTR0_SKXCCM0_SGRO0_TIN0_TLDS1_TLDSM1_ULSGRO0_USL1_UIOFGRO0_USFGROn1_VSn1_VWA8_VWB1_WSGRA0_WSGRB0_WS32_WG16_8_1_WGM8_WGMXCC1_WGMXCCGn1
- - - [1, 1, 1, 1]
    - [3, 0.0]
  - - [64, 64, 1, 64]
    - [4, 0.0]
  - - [64, 64, 1, 512]
    - [124, 0.0]
  - - [64, 64, 1, 1024]
    - [99, 0.0]
  - - [64, 64, 1, 2048]
    - [99, 0.0]
  - - [64, 64, 1, 4096]
    - [106, 0.0]
  - - [127, 127, 1, 127]
    - [0, 0.0]
  - - [128, 128, 1, 128]
    - [1, 0.0]
  - - [129, 129, 1, 129]
    - [2, 0.0]
  - - [128, 64, 1, 64]
    - [5, 0.0]
  - - [192, 64, 1, 64]
    - [5, 0.0]
  - - [256, 64, 1, 64]
    - [6, 0.0]
  - - [320, 64, 1, 64]
    - [7, 0.0]
  - - [384, 64, 1, 64]
    - [8, 0.0]
  - - [448, 64, 1, 64]
    - [9, 0.0]
  - - [512, 64, 1, 64]
    - [10, 0.0]
  - - [576, 64, 1, 64]
    - [7, 0.0]
  - - [640, 64, 1, 64]
    - [11, 0.0]
  - - [704, 64, 1, 64]
    - [12, 0.0]
  - - [768, 64, 1, 64]
    - [11, 0.0]
  - - [832, 64, 1, 64]
    - [10, 0.0]
  - - [896, 64, 1, 64]
    - [13, 0.0]
  - - [960, 64, 1, 64]
    - [4, 0.0]
  - - [1024, 64, 1, 64]
    - [14, 0.0]
  - - [64, 128, 1, 64]
    - [10, 0.0]
  - - [128, 128, 1, 64]
    - [8, 0.0]
  - - [192, 128, 1, 64]
    - [15, 0.0]
  - - [256, 128, 1, 64]
    - [7, 0.0]
  - - [320, 128, 1, 64]
    - [15, 0.0]
  - - [384, 128, 1, 64]
    - [16, 0.0]
  - - [448, 128, 1, 64]
    - [13, 0.0]
  - - [512, 128, 1, 64]
    - [13, 0.0]
  - - [576, 128, 1, 64]
    - [13, 0.0]
  - - [640, 128, 1, 64]
    - [17, 0.0]
  - - [704, 128, 1, 64]
    - [18, 0.0]
  - - [768, 128, 1, 64]
    - [17, 0.0]
  - - [832, 128, 1, 64]
    - [13, 0.0]
  - - [896, 128, 1, 64]
    - [18, 0.0]
  - - [960, 128, 1, 64]
    - [19, 0.0]
  - - [1024, 128, 1, 64]
    - [13, 0.0]
  - - [64, 192, 1, 64]
    - [20, 0.0]
  - - [128, 192, 1, 64]
    - [7, 0.0]
  - - [192, 192, 1, 64]
    - [21, 0.0]
  - - [256, 192, 1, 64]
    - [13, 0.0]
  - - [320, 192, 1, 64]
    - [13, 0.0]
  - - [384, 192, 1, 64]
    - [22, 0.0]
  - - [448, 192, 1, 64]
    - [13, 0.0]
  - - [512, 192, 1, 64]
    - [13, 0.0]
  - - [576, 192, 1, 64]
    - [12, 0.0]
  - - [640, 192, 1, 64]
    - [13, 0.0]
  - - [704, 192, 1, 64]
    - [13, 0.0]
  - - [768, 192, 1, 64]
    - [23, 0.0]
  - - [832, 192, 1, 64]
    - [24, 0.0]
  - - [896, 192, 1, 64]
    - [25, 0.0]
  - - [960, 192, 1, 64]
    - [26, 0.0]
  - - [1024, 192, 1, 64]
    - [27, 0.0]
  - - [64, 256, 1, 64]
    - [28, 0.0]
  - - [128, 256, 1, 64]
    - [7, 0.0]
  - - [192, 256, 1, 64]
    - [29, 0.0]
  - - [256, 256, 1, 64]
    - [12, 0.0]
  - - [320, 256, 1, 64]
    - [13, 0.0]
  - - [384, 256, 1, 64]
    - [13, 0.0]
  - - [448, 256, 1, 64]
    - [13, 0.0]
  - - [512, 256, 1, 64]
    - [13, 0.0]
  - - [576, 256, 1, 64]
    - [25, 0.0]
  - - [640, 256, 1, 64]
    - [30, 0.0]
  - - [704, 256, 1, 64]
    - [31, 0.0]
  - - [768, 256, 1, 64]
    - [32, 0.0]
  - - [832, 256, 1, 64]
    - [33, 0.0]
  - - [896, 256, 1, 64]
    - [34, 0.0]
  - - [960, 256, 1, 64]
    - [35, 0.0]
  - - [1024, 256, 1, 64]
    - [36, 0.0]
  - - [64, 320, 1, 64]
    - [37, 0.0]
  - - [128, 320, 1, 64]
    - [13, 0.0]
  - - [192, 320, 1, 64]
    - [7, 0.0]
  - - [256, 320, 1, 64]
    - [19, 0.0]
  - - [320, 320, 1, 64]
    - [17, 0.0]
  - - [384, 320, 1, 64]
    - [13, 0.0]
  - - [448, 320, 1, 64]
    - [38, 0.0]
  - - [512, 320, 1, 64]
    - [25, 0.0]
  - - [576, 320, 1, 64]
    - [39, 0.0]
  - - [640, 320, 1, 64]
    - [32, 0.0]
  - - [704, 320, 1, 64]
    - [40, 0.0]
  - - [768, 320, 1, 64]
    - [34, 0.0]
  - - [832, 320, 1, 64]
    - [41, 0.0]
  - - [896, 320, 1, 64]
    - [42, 0.0]
  - - [960, 320, 1, 64]
    - [41, 0.0]
  - - [1024, 320, 1, 64]
    - [43, 0.0]
  - - [64, 384, 1, 64]
    - [8, 0.0]
  - - [128, 384, 1, 64]
    - [43, 0.0]
  - - [192, 384, 1, 64]
    - [12, 0.0]
  - - [256, 384, 1, 64]
    - [13, 0.0]
  - - [320, 384, 1, 64]
    - [44, 0.0]
  - - [384, 384, 1, 64]
    - [45, 0.0]
  - - [448, 384, 1, 64]
    - [18, 0.0]
  - - [512, 384, 1, 64]
    - [46, 0.0]
  - - [576, 384, 1, 64]
    - [47, 0.0]
  - - [640, 384, 1, 64]
    - [34, 0.0]
  - - [704, 384, 1, 64]
    - [48, 0.0]
  - - [768, 384, 1, 64]
    - [45, 0.0]
  - - [832, 384, 1, 64]
    - [49, 0.0]
  - - [896, 384, 1, 64]
    - [46, 0.0]
  - - [960, 384, 1, 64]
    - [50, 0.0]
  - - [1024, 384, 1, 64]
    - [51, 0.0]
  - - [64, 448, 1, 64]
    - [10, 0.0]
  - - [128, 448, 1, 64]
    - [13, 0.0]
  - - [192, 448, 1, 64]
    - [39, 0.0]
  - - [256, 448, 1, 64]
    - [13, 0.0]
  - - [320, 448, 1, 64]
    - [13, 0.0]
  - - [384, 448, 1, 64]
    - [52, 0.0]
  - - [448, 448, 1, 64]
    - [13, 0.0]
  - - [512, 448, 1, 64]
    - [53, 0.0]
  - - [576, 448, 1, 64]
    - [22, 0.0]
  - - [640, 448, 1, 64]
    - [45, 0.0]
  - - [704, 448, 1, 64]
    - [31, 0.0]
  - - [768, 448, 1, 64]
    - [54, 0.0]
  - - [832, 448, 1, 64]
    - [55, 0.0]
  - - [896, 448, 1, 64]
    - [56, 0.0]
  - - [960, 448, 1, 64]
    - [49, 0.0]
  - - [1024, 448, 1, 64]
    - [57, 0.0]
  - - [64, 512, 1, 64]
    - [10, 0.0]
  - - [128, 512, 1, 64]
    - [58, 0.0]
  - - [192, 512, 1, 64]
    - [26, 0.0]
  - - [256, 512, 1, 64]
    - [13, 0.0]
  - - [320, 512, 1, 64]
    - [12, 0.0]
  - - [384, 512, 1, 64]
    - [46, 0.0]
  - - [448, 512, 1, 64]
    - [33, 0.0]
  - - [512, 512, 1, 64]
    - [59, 0.0]
  - - [576, 512, 1, 64]
    - [50, 0.0]
  - - [640, 512, 1, 64]
    - [60, 0.0]
  - - [704, 512, 1, 64]
    - [30, 0.0]
  - - [768, 512, 1, 64]
    - [61, 0.0]
  - - [832, 512, 1, 64]
    - [35, 0.0]
  - - [896, 512, 1, 64]
    - [35, 0.0]
  - - [960, 512, 1, 64]
    - [62, 0.0]
  - - [1024, 512, 1, 64]
    - [47, 0.0]
  - - [64, 576, 1, 64]
    - [8, 0.0]
  - - [128, 576, 1, 64]
    - [26, 0.0]
  - - [192, 576, 1, 64]
    - [44, 0.0]
  - - [256, 576, 1, 64]
    - [63, 0.0]
  - - [320, 576, 1, 64]
    - [13, 0.0]
  - - [384, 576, 1, 64]
    - [53, 0.0]
  - - [448, 576, 1, 64]
    - [13, 0.0]
  - - [512, 576, 1, 64]
    - [64, 0.0]
  - - [576, 576, 1, 64]
    - [50, 0.0]
  - - [640, 576, 1, 64]
    - [65, 0.0]
  - - [704, 576, 1, 64]
    - [48, 0.0]
  - - [768, 576, 1, 64]
    - [66, 0.0]
  - - [832, 576, 1, 64]
    - [36, 0.0]
  - - [896, 576, 1, 64]
    - [66, 0.0]
  - - [960, 576, 1, 64]
    - [41, 0.0]
  - - [1024, 576, 1, 64]
    - [66, 0.0]
  - - [64, 640, 1, 64]
    - [58, 0.0]
  - - [128, 640, 1, 64]
    - [13, 0.0]
  - - [192, 640, 1, 64]
    - [18, 0.0]
  - - [256, 640, 1, 64]
    - [27, 0.0]
  - - [320, 640, 1, 64]
    - [67, 0.0]
  - - [384, 640, 1, 64]
    - [48, 0.0]
  - - [448, 640, 1, 64]
    - [68, 0.0]
  - - [512, 640, 1, 64]
    - [42, 0.0]
  - - [576, 640, 1, 64]
    - [22, 0.0]
  - - [640, 640, 1, 64]
    - [47, 0.0]
  - - [704, 640, 1, 64]
    - [47, 0.0]
  - - [768, 640, 1, 64]
    - [46, 0.0]
  - - [832, 640, 1, 64]
    - [69, 0.0]
  - - [896, 640, 1, 64]
    - [53, 0.0]
  - - [960, 640, 1, 64]
    - [70, 0.0]
  - - [1024, 640, 1, 64]
    - [71, 0.0]
  - - [64, 704, 1, 64]
    - [72, 0.0]
  - - [128, 704, 1, 64]
    - [65, 0.0]
  - - [192, 704, 1, 64]
    - [19, 0.0]
  - - [256, 704, 1, 64]
    - [73, 0.0]
  - - [320, 704, 1, 64]
    - [12, 0.0]
  - - [384, 704, 1, 64]
    - [54, 0.0]
  - - [448, 704, 1, 64]
    - [47, 0.0]
  - - [512, 704, 1, 64]
    - [74, 0.0]
  - - [576, 704, 1, 64]
    - [49, 0.0]
  - - [640, 704, 1, 64]
    - [46, 0.0]
  - - [704, 704, 1, 64]
    - [12, 0.0]
  - - [768, 704, 1, 64]
    - [53, 0.0]
  - - [832, 704, 1, 64]
    - [41, 0.0]
  - - [896, 704, 1, 64]
    - [75, 0.0]
  - - [960, 704, 1, 64]
    - [47, 0.0]
  - - [1024, 704, 1, 64]
    - [46, 0.0]
  - - [64, 768, 1, 64]
    - [17, 0.0]
  - - [128, 768, 1, 64]
    - [13, 0.0]
  - - [192, 768, 1, 64]
    - [50, 0.0]
  - - [256, 768, 1, 64]
    - [46, 0.0]
  - - [320, 768, 1, 64]
    - [76, 0.0]
  - - [384, 768, 1, 64]
    - [49, 0.0]
  - - [448, 768, 1, 64]
    - [77, 0.0]
  - - [512, 768, 1, 64]
    - [78, 0.0]
  - - [576, 768, 1, 64]
    - [47, 0.0]
  - - [640, 768, 1, 64]
    - [33, 0.0]
  - - [704, 768, 1, 64]
    - [47, 0.0]
  - - [768, 768, 1, 64]
    - [79, 0.0]
  - - [832, 768, 1, 64]
    - [41, 0.0]
  - - [896, 768, 1, 64]
    - [80, 0.0]
  - - [960, 768, 1, 64]
    - [33, 0.0]
  - - [1024, 768, 1, 64]
    - [47, 0.0]
  - - [64, 832, 1, 64]
    - [15, 0.0]
  - - [128, 832, 1, 64]
    - [13, 0.0]
  - - [192, 832, 1, 64]
    - [31, 0.0]
  - - [256, 832, 1, 64]
    - [52, 0.0]
  - - [320, 832, 1, 64]
    - [18, 0.0]
  - - [384, 832, 1, 64]
    - [64, 0.0]
  - - [448, 832, 1, 64]
    - [31, 0.0]
  - - [512, 832, 1, 64]
    - [53, 0.0]
  - - [576, 832, 1, 64]
    - [48, 0.0]
  - - [640, 832, 1, 64]
    - [81, 0.0]
  - - [704, 832, 1, 64]
    - [41, 0.0]
  - - [768, 832, 1, 64]
    - [82, 0.0]
  - - [832, 832, 1, 64]
    - [69, 0.0]
  - - [896, 832, 1, 64]
    - [81, 0.0]
  - - [960, 832, 1, 64]
    - [83, 0.0]
  - - [1024, 832, 1, 64]
    - [84, 0.0]
  - - [64, 896, 1, 64]
    - [13, 0.0]
  - - [128, 896, 1, 64]
    - [44, 0.0]
  - - [192, 896, 1, 64]
    - [49, 0.0]
  - - [256, 896, 1, 64]
    - [30, 0.0]
  - - [320, 896, 1, 64]
    - [49, 0.0]
  - - [384, 896, 1, 64]
    - [80, 0.0]
  - - [448, 896, 1, 64]
    - [35, 0.0]
  - - [512, 896, 1, 64]
    - [46, 0.0]
  - - [576, 896, 1, 64]
    - [47, 0.0]
  - - [640, 896, 1, 64]
    - [85, 0.0]
  - - [704, 896, 1, 64]
    - [69, 0.0]
  - - [768, 896, 1, 64]
    - [46, 0.0]
  - - [832, 896, 1, 64]
    - [47, 0.0]
  - - [896, 896, 1, 64]
    - [64, 0.0]
  - - [960, 896, 1, 64]
    - [68, 0.0]
  - - [1024, 896, 1, 64]
    - [86, 0.0]
  - - [64, 960, 1, 64]
    - [87, 0.0]
  - - [128, 960, 1, 64]
    - [18, 0.0]
  - - [192, 960, 1, 64]
    - [76, 0.0]
  - - [256, 960, 1, 64]
    - [34, 0.0]
  - - [320, 960, 1, 64]
    - [31, 0.0]
  - - [384, 960, 1, 64]
    - [88, 0.0]
  - - [448, 960, 1, 64]
    - [89, 0.0]
  - - [512, 960, 1, 64]
    - [46, 0.0]
  - - [576, 960, 1, 64]
    - [41, 0.0]
  - - [640, 960, 1, 64]
    - [90, 0.0]
  - - [704, 960, 1, 64]
    - [68, 0.0]
  - - [768, 960, 1, 64]
    - [46, 0.0]
  - - [832, 960, 1, 64]
    - [59, 0.0]
  - - [896, 960, 1, 64]
    - [91, 0.0]
  - - [960, 960, 1, 64]
    - [92, 0.0]
  - - [1024, 960, 1, 64]
    - [93, 0.0]
  - - [64, 1024, 1, 64]
    - [10, 0.0]
  - - [128, 1024, 1, 64]
    - [13, 0.0]
  - - [192, 1024, 1, 64]
    - [62, 0.0]
  - - [256, 1024, 1, 64]
    - [33, 0.0]
  - - [320, 1024, 1, 64]
    - [68, 0.0]
  - - [384, 1024, 1, 64]
    - [35, 0.0]
  - - [448, 1024, 1, 64]
    - [59, 0.0]
  - - [512, 1024, 1, 64]
    - [53, 0.0]
  - - [576, 1024, 1, 64]
    - [67, 0.0]
  - - [640, 1024, 1, 64]
    - [59, 0.0]
  - - [704, 1024, 1, 64]
    - [33, 0.0]
  - - [768, 1024, 1, 64]
    - [59, 0.0]
  - - [832, 1024, 1, 64]
    - [47, 0.0]
  - - [896, 1024, 1, 64]
    - [94, 0.0]
  - - [960, 1024, 1, 64]
    - [46, 0.0]
  - - [1024, 1024, 1, 64]
    - [94, 0.0]
  - - [64, 64, 1, 256]
    - [95, 0.0]
  - - [128, 64, 1, 256]
    - [96, 0.0]
  - - [192, 64, 1, 256]
    - [97, 0.0]
  - - [256, 64, 1, 256]
    - [98, 0.0]
  - - [320, 64, 1, 256]
    - [99, 0.0]
  - - [384, 64, 1, 256]
    - [97, 0.0]
  - - [448, 64, 1, 256]
    - [99, 0.0]
  - - [512, 64, 1, 256]
    - [95, 0.0]
  - - [576, 64, 1, 256]
    - [99, 0.0]
  - - [640, 64, 1, 256]
    - [9, 0.0]
  - - [704, 64, 1, 256]
    - [100, 0.0]
  - - [768, 64, 1, 256]
    - [101, 0.0]
  - - [832, 64, 1, 256]
    - [95, 0.0]
  - - [896, 64, 1, 256]
    - [102, 0.0]
  - - [960, 64, 1, 256]
    - [102, 0.0]
  - - [1024, 64, 1, 256]
    - [103, 0.0]
  - - [64, 128, 1, 256]
    - [95, 0.0]
  - - [128, 128, 1, 256]
    - [104, 0.0]
  - - [192, 128, 1, 256]
    - [105, 0.0]
  - - [256, 128, 1, 256]
    - [99, 0.0]
  - - [320, 128, 1, 256]
    - [106, 0.0]
  - - [384, 128, 1, 256]
    - [103, 0.0]
  - - [448, 128, 1, 256]
    - [95, 0.0]
  - - [512, 128, 1, 256]
    - [103, 0.0]
  - - [576, 128, 1, 256]
    - [107, 0.0]
  - - [640, 128, 1, 256]
    - [12, 0.0]
  - - [704, 128, 1, 256]
    - [19, 0.0]
  - - [768, 128, 1, 256]
    - [108, 0.0]
  - - [832, 128, 1, 256]
    - [17, 0.0]
  - - [896, 128, 1, 256]
    - [19, 0.0]
  - - [960, 128, 1, 256]
    - [19, 0.0]
  - - [1024, 128, 1, 256]
    - [12, 0.0]
  - - [64, 192, 1, 256]
    - [106, 0.0]
  - - [128, 192, 1, 256]
    - [109, 0.0]
  - - [192, 192, 1, 256]
    - [110, 0.0]
  - - [256, 192, 1, 256]
    - [95, 0.0]
  - - [320, 192, 1, 256]
    - [97, 0.0]
  - - [384, 192, 1, 256]
    - [97, 0.0]
  - - [448, 192, 1, 256]
    - [111, 0.0]
  - - [512, 192, 1, 256]
    - [112, 0.0]
  - - [576, 192, 1, 256]
    - [113, 0.0]
  - - [640, 192, 1, 256]
    - [22, 0.0]
  - - [704, 192, 1, 256]
    - [19, 0.0]
  - - [768, 192, 1, 256]
    - [12, 0.0]
  - - [832, 192, 1, 256]
    - [12, 0.0]
  - - [896, 192, 1, 256]
    - [114, 0.0]
  - - [960, 192, 1, 256]
    - [17, 0.0]
  - - [1024, 192, 1, 256]
    - [107, 0.0]
  - - [64, 256, 1, 256]
    - [104, 0.0]
  - - [128, 256, 1, 256]
    - [115, 0.0]
  - - [192, 256, 1, 256]
    - [102, 0.0]
  - - [256, 256, 1, 256]
    - [4, 0.0]
  - - [320, 256, 1, 256]
    - [19, 0.0]
  - - [384, 256, 1, 256]
    - [12, 0.0]
  - - [448, 256, 1, 256]
    - [113, 0.0]
  - - [512, 256, 1, 256]
    - [19, 0.0]
  - - [576, 256, 1, 256]
    - [22, 0.0]
  - - [640, 256, 1, 256]
    - [22, 0.0]
  - - [704, 256, 1, 256]
    - [107, 0.0]
  - - [768, 256, 1, 256]
    - [30, 0.0]
  - - [832, 256, 1, 256]
    - [49, 0.0]
  - - [896, 256, 1, 256]
    - [22, 0.0]
  - - [960, 256, 1, 256]
    - [35, 0.0]
  - - [1024, 256, 1, 256]
    - [107, 0.0]
  - - [64, 320, 1, 256]
    - [97, 0.0]
  - - [128, 320, 1, 256]
    - [97, 0.0]
  - - [192, 320, 1, 256]
    - [95, 0.0]
  - - [256, 320, 1, 256]
    - [19, 0.0]
  - - [320, 320, 1, 256]
    - [113, 0.0]
  - - [384, 320, 1, 256]
    - [116, 0.0]
  - - [448, 320, 1, 256]
    - [12, 0.0]
  - - [512, 320, 1, 256]
    - [52, 0.0]
  - - [576, 320, 1, 256]
    - [19, 0.0]
  - - [640, 320, 1, 256]
    - [19, 0.0]
  - - [704, 320, 1, 256]
    - [12, 0.0]
  - - [768, 320, 1, 256]
    - [107, 0.0]
  - - [832, 320, 1, 256]
    - [108, 0.0]
  - - [896, 320, 1, 256]
    - [12, 0.0]
  - - [960, 320, 1, 256]
    - [114, 0.0]
  - - [1024, 320, 1, 256]
    - [117, 0.0]
  - - [64, 384, 1, 256]
    - [95, 0.0]
  - - [128, 384, 1, 256]
    - [99, 0.0]
  - - [192, 384, 1, 256]
    - [19, 0.0]
  - - [256, 384, 1, 256]
    - [12, 0.0]
  - - [320, 384, 1, 256]
    - [108, 0.0]
  - - [384, 384, 1, 256]
    - [17, 0.0]
  - - [448, 384, 1, 256]
    - [107, 0.0]
  - - [512, 384, 1, 256]
    - [26, 0.0]
  - - [576, 384, 1, 256]
    - [19, 0.0]
  - - [640, 384, 1, 256]
    - [22, 0.0]
  - - [704, 384, 1, 256]
    - [30, 0.0]
  - - [768, 384, 1, 256]
    - [17, 0.0]
  - - [832, 384, 1, 256]
    - [114, 0.0]
  - - [896, 384, 1, 256]
    - [26, 0.0]
  - - [960, 384, 1, 256]
    - [17, 0.0]
  - - [1024, 384, 1, 256]
    - [52, 0.0]
  - - [64, 448, 1, 256]
    - [99, 0.0]
  - - [128, 448, 1, 256]
    - [97, 0.0]
  - - [192, 448, 1, 256]
    - [113, 0.0]
  - - [256, 448, 1, 256]
    - [19, 0.0]
  - - [320, 448, 1, 256]
    - [108, 0.0]
  - - [384, 448, 1, 256]
    - [22, 0.0]
  - - [448, 448, 1, 256]
    - [12, 0.0]
  - - [512, 448, 1, 256]
    - [26, 0.0]
  - - [576, 448, 1, 256]
    - [12, 0.0]
  - - [640, 448, 1, 256]
    - [107, 0.0]
  - - [704, 448, 1, 256]
    - [12, 0.0]
  - - [768, 448, 1, 256]
    - [52, 0.0]
  - - [832, 448, 1, 256]
    - [12, 0.0]
  - - [896, 448, 1, 256]
    - [26, 0.0]
  - - [960, 448, 1, 256]
    - [35, 0.0]
  - - [1024, 448, 1, 256]
    - [117, 0.0]
  - - [64, 512, 1, 256]
    - [99, 0.0]
  - - [128, 512, 1, 256]
    - [97, 0.0]
  - - [192, 512, 1, 256]
    - [107, 0.0]
  - - [256, 512, 1, 256]
    - [19, 0.0]
  - - [320, 512, 1, 256]
    - [26, 0.0]
  - - [384, 512, 1, 256]
    - [12, 0.0]
  - - [448, 512, 1, 256]
    - [30, 0.0]
  - - [512, 512, 1, 256]
    - [26, 0.0]
  - - [576, 512, 1, 256]
    - [114, 0.0]
  - - [640, 512, 1, 256]
    - [22, 0.0]
  - - [704, 512, 1, 256]
    - [26, 0.0]
  - - [768, 512, 1, 256]
    - [53, 0.0]
  - - [832, 512, 1, 256]
    - [18, 0.0]
  - - [896, 512, 1, 256]
    - [12, 0.0]
  - - [960, 512, 1, 256]
    - [35, 0.0]
  - - [1024, 512, 1, 256]
    - [117, 0.0]
  - - [64, 576, 1, 256]
    - [99, 0.0]
  - - [128, 576, 1, 256]
    - [34, 0.0]
  - - [192, 576, 1, 256]
    - [112, 0.0]
  - - [256, 576, 1, 256]
    - [26, 0.0]
  - - [320, 576, 1, 256]
    - [12, 0.0]
  - - [384, 576, 1, 256]
    - [12, 0.0]
  - - [448, 576, 1, 256]
    - [108, 0.0]
  - - [512, 576, 1, 256]
    - [108, 0.0]
  - - [576, 576, 1, 256]
    - [12, 0.0]
  - - [640, 576, 1, 256]
    - [114, 0.0]
  - - [704, 576, 1, 256]
    - [48, 0.0]
  - - [768, 576, 1, 256]
    - [53, 0.0]
  - - [832, 576, 1, 256]
    - [12, 0.0]
  - - [896, 576, 1, 256]
    - [46, 0.0]
  - - [960, 576, 1, 256]
    - [22, 0.0]
  - - [1024, 576, 1, 256]
    - [49, 0.0]
  - - [64, 640, 1, 256]
    - [98, 0.0]
  - - [128, 640, 1, 256]
    - [113, 0.0]
  - - [192, 640, 1, 256]
    - [112, 0.0]
  - - [256, 640, 1, 256]
    - [19, 0.0]
  - - [320, 640, 1, 256]
    - [22, 0.0]
  - - [384, 640, 1, 256]
    - [19, 0.0]
  - - [448, 640, 1, 256]
    - [114, 0.0]
  - - [512, 640, 1, 256]
    - [116, 0.0]
  - - [576, 640, 1, 256]
    - [108, 0.0]
  - - [640, 640, 1, 256]
    - [118, 0.0]
  - - [704, 640, 1, 256]
    - [48, 0.0]
  - - [768, 640, 1, 256]
    - [49, 0.0]
  - - [832, 640, 1, 256]
    - [49, 0.0]
  - - [896, 640, 1, 256]
    - [83, 0.0]
  - - [960, 640, 1, 256]
    - [83, 0.0]
  - - [1024, 640, 1, 256]
    - [49, 0.0]
  - - [64, 704, 1, 256]
    - [95, 0.0]
  - - [128, 704, 1, 256]
    - [113, 0.0]
  - - [192, 704, 1, 256]
    - [19, 0.0]
  - - [256, 704, 1, 256]
    - [12, 0.0]
  - - [320, 704, 1, 256]
    - [107, 0.0]
  - - [384, 704, 1, 256]
    - [12, 0.0]
  - - [448, 704, 1, 256]
    - [114, 0.0]
  - - [512, 704, 1, 256]
    - [12, 0.0]
  - - [576, 704, 1, 256]
    - [119, 0.0]
  - - [640, 704, 1, 256]
    - [35, 0.0]
  - - [704, 704, 1, 256]
    - [12, 0.0]
  - - [768, 704, 1, 256]
    - [53, 0.0]
  - - [832, 704, 1, 256]
    - [49, 0.0]
  - - [896, 704, 1, 256]
    - [117, 0.0]
  - - [960, 704, 1, 256]
    - [47, 0.0]
  - - [1024, 704, 1, 256]
    - [53, 0.0]
  - - [64, 768, 1, 256]
    - [120, 0.0]
  - - [128, 768, 1, 256]
    - [112, 0.0]
  - - [192, 768, 1, 256]
    - [12, 0.0]
  - - [256, 768, 1, 256]
    - [34, 0.0]
  - - [320, 768, 1, 256]
    - [114, 0.0]
  - - [384, 768, 1, 256]
    - [107, 0.0]
  - - [448, 768, 1, 256]
    - [17, 0.0]
  - - [512, 768, 1, 256]
    - [45, 0.0]
  - - [576, 768, 1, 256]
    - [76, 0.0]
  - - [640, 768, 1, 256]
    - [46, 0.0]
  - - [704, 768, 1, 256]
    - [22, 0.0]
  - - [768, 768, 1, 256]
    - [83, 0.0]
  - - [832, 768, 1, 256]
    - [26, 0.0]
  - - [896, 768, 1, 256]
    - [117, 0.0]
  - - [960, 768, 1, 256]
    - [49, 0.0]
  - - [1024, 768, 1, 256]
    - [46, 0.0]
  - - [64, 832, 1, 256]
    - [95, 0.0]
  - - [128, 832, 1, 256]
    - [112, 0.0]
  - - [192, 832, 1, 256]
    - [107, 0.0]
  - - [256, 832, 1, 256]
    - [19, 0.0]
  - - [320, 832, 1, 256]
    - [26, 0.0]
  - - [384, 832, 1, 256]
    - [107, 0.0]
  - - [448, 832, 1, 256]
    - [22, 0.0]
  - - [512, 832, 1, 256]
    - [117, 0.0]
  - - [576, 832, 1, 256]
    - [48, 0.0]
  - - [640, 832, 1, 256]
    - [80, 0.0]
  - - [704, 832, 1, 256]
    - [49, 0.0]
  - - [768, 832, 1, 256]
    - [46, 0.0]
  - - [832, 832, 1, 256]
    - [49, 0.0]
  - - [896, 832, 1, 256]
    - [53, 0.0]
  - - [960, 832, 1, 256]
    - [33, 0.0]
  - - [1024, 832, 1, 256]
    - [53, 0.0]
  - - [64, 896, 1, 256]
    - [95, 0.0]
  - - [128, 896, 1, 256]
    - [112, 0.0]
  - - [192, 896, 1, 256]
    - [12, 0.0]
  - - [256, 896, 1, 256]
    - [19, 0.0]
  - - [320, 896, 1, 256]
    - [107, 0.0]
  - - [384, 896, 1, 256]
    - [12, 0.0]
  - - [448, 896, 1, 256]
    - [33, 0.0]
  - - [512, 896, 1, 256]
    - [47, 0.0]
  - - [576, 896, 1, 256]
    - [48, 0.0]
  - - [640, 896, 1, 256]
    - [53, 0.0]
  - - [704, 896, 1, 256]
    - [35, 0.0]
  - - [768, 896, 1, 256]
    - [49, 0.0]
  - - [832, 896, 1, 256]
    - [49, 0.0]
  - - [896, 896, 1, 256]
    - [121, 0.0]
  - - [960, 896, 1, 256]
    - [49, 0.0]
  - - [1024, 896, 1, 256]
    - [122, 0.0]
  - - [64, 960, 1, 256]
    - [120, 0.0]
  - - [128, 960, 1, 256]
    - [111, 0.0]
  - - [192, 960, 1, 256]
    - [12, 0.0]
  - - [256, 960, 1, 256]
    - [19, 0.0]
  - - [320, 960, 1, 256]
    - [12, 0.0]
  - - [384, 960, 1, 256]
    - [114, 0.0]
  - - [448, 960, 1, 256]
    - [48, 0.0]
  - - [512, 960, 1, 256]
    - [53, 0.0]
  - - [576, 960, 1, 256]
    - [83, 0.0]
  - - [640, 960, 1, 256]
    - [83, 0.0]
  - - [704, 960, 1, 256]
    - [48, 0.0]
  - - [768, 960, 1, 256]
    - [48, 0.0]
  - - [832, 960, 1, 256]
    - [83, 0.0]
  - - [896, 960, 1, 256]
    - [123, 0.0]
  - - [960, 960, 1, 256]
    - [49, 0.0]
  - - [1024, 960, 1, 256]
    - [123, 0.0]
  - - [64, 1024, 1, 256]
    - [12, 0.0]
  - - [128, 1024, 1, 256]
    - [17, 0.0]
  - - [192, 1024, 1, 256]
    - [107, 0.0]
  - - [256, 1024, 1, 256]
    - [12, 0.0]
  - - [320, 1024, 1, 256]
    - [19, 0.0]
  - - [384, 1024, 1, 256]
    - [107, 0.0]
  - - [448, 1024, 1, 256]
    - [76, 0.0]
  - - [512, 1024, 1, 256]
    - [76, 0.0]
  - - [576, 1024, 1, 256]
    - [12, 0.0]
  - - [640, 1024, 1, 256]
    - [53, 0.0]
  - - [704, 1024, 1, 256]
    - [35, 0.0]
  - - [768, 1024, 1, 256]
    - [53, 0.0]
  - - [832, 1024, 1, 256]
    - [83, 0.0]
  - - [896, 1024, 1, 256]
    - [123, 0.0]
  - - [960, 1024, 1, 256]
    - [49, 0.0]
  - - [1024, 1024, 1, 256]
    - [93, 0.0]
  - - [128, 64, 1, 512]
    - [115, 0.0]
  - - [192, 64, 1, 512]
    - [99, 0.0]
  - - [256, 64, 1, 512]
    - [104, 0.0]
  - - [320, 64, 1, 512]
    - [125, 0.0]
  - - [384, 64, 1, 512]
    - [126, 0.0]
  - - [448, 64, 1, 512]
    - [102, 0.0]
  - - [512, 64, 1, 512]
    - [126, 0.0]
  - - [576, 64, 1, 512]
    - [97, 0.0]
  - - [640, 64, 1, 512]
    - [98, 0.0]
  - - [704, 64, 1, 512]
    - [120, 0.0]
  - - [768, 64, 1, 512]
    - [95, 0.0]
  - - [832, 64, 1, 512]
    - [127, 0.0]
  - - [896, 64, 1, 512]
    - [128, 0.0]
  - - [960, 64, 1, 512]
    - [120, 0.0]
  - - [1024, 64, 1, 512]
    - [95, 0.0]
  - - [64, 128, 1, 512]
    - [129, 0.0]
  - - [128, 128, 1, 512]
    - [104, 0.0]
  - - [192, 128, 1, 512]
    - [115, 0.0]
  - - [256, 128, 1, 512]
    - [99, 0.0]
  - - [320, 128, 1, 512]
    - [95, 0.0]
  - - [384, 128, 1, 512]
    - [102, 0.0]
  - - [448, 128, 1, 512]
    - [4, 0.0]
  - - [512, 128, 1, 512]
    - [106, 0.0]
  - - [576, 128, 1, 512]
    - [95, 0.0]
  - - [640, 128, 1, 512]
    - [112, 0.0]
  - - [704, 128, 1, 512]
    - [112, 0.0]
  - - [768, 128, 1, 512]
    - [17, 0.0]
  - - [832, 128, 1, 512]
    - [111, 0.0]
  - - [896, 128, 1, 512]
    - [111, 0.0]
  - - [960, 128, 1, 512]
    - [19, 0.0]
  - - [1024, 128, 1, 512]
    - [111, 0.0]
  - - [64, 192, 1, 512]
    - [110, 0.0]
  - - [128, 192, 1, 512]
    - [98, 0.0]
  - - [192, 192, 1, 512]
    - [106, 0.0]
  - - [256, 192, 1, 512]
    - [95, 0.0]
  - - [320, 192, 1, 512]
    - [130, 0.0]
  - - [384, 192, 1, 512]
    - [17, 0.0]
  - - [448, 192, 1, 512]
    - [112, 0.0]
  - - [512, 192, 1, 512]
    - [108, 0.0]
  - - [576, 192, 1, 512]
    - [12, 0.0]
  - - [640, 192, 1, 512]
    - [108, 0.0]
  - - [704, 192, 1, 512]
    - [114, 0.0]
  - - [768, 192, 1, 512]
    - [19, 0.0]
  - - [832, 192, 1, 512]
    - [114, 0.0]
  - - [896, 192, 1, 512]
    - [12, 0.0]
  - - [960, 192, 1, 512]
    - [19, 0.0]
  - - [1024, 192, 1, 512]
    - [12, 0.0]
  - - [64, 256, 1, 512]
    - [126, 0.0]
  - - [128, 256, 1, 512]
    - [129, 0.0]
  - - [192, 256, 1, 512]
    - [95, 0.0]
  - - [256, 256, 1, 512]
    - [131, 0.0]
  - - [320, 256, 1, 512]
    - [19, 0.0]
  - - [384, 256, 1, 512]
    - [12, 0.0]
  - - [448, 256, 1, 512]
    - [108, 0.0]
  - - [512, 256, 1, 512]
    - [19, 0.0]
  - - [576, 256, 1, 512]
    - [107, 0.0]
  - - [640, 256, 1, 512]
    - [12, 0.0]
  - - [704, 256, 1, 512]
    - [12, 0.0]
  - - [768, 256, 1, 512]
    - [12, 0.0]
  - - [832, 256, 1, 512]
    - [114, 0.0]
  - - [896, 256, 1, 512]
    - [19, 0.0]
  - - [960, 256, 1, 512]
    - [114, 0.0]
  - - [1024, 256, 1, 512]
    - [107, 0.0]
  - - [64, 320, 1, 512]
    - [99, 0.0]
  - - [128, 320, 1, 512]
    - [125, 0.0]
  - - [192, 320, 1, 512]
    - [95, 0.0]
  - - [256, 320, 1, 512]
    - [108, 0.0]
  - - [320, 320, 1, 512]
    - [108, 0.0]
  - - [384, 320, 1, 512]
    - [12, 0.0]
  - - [448, 320, 1, 512]
    - [12, 0.0]
  - - [512, 320, 1, 512]
    - [12, 0.0]
  - - [576, 320, 1, 512]
    - [12, 0.0]
  - - [640, 320, 1, 512]
    - [19, 0.0]
  - - [704, 320, 1, 512]
    - [108, 0.0]
  - - [768, 320, 1, 512]
    - [12, 0.0]
  - - [832, 320, 1, 512]
    - [114, 0.0]
  - - [896, 320, 1, 512]
    - [132, 0.0]
  - - [960, 320, 1, 512]
    - [12, 0.0]
  - - [1024, 320, 1, 512]
    - [114, 0.0]
  - - [64, 384, 1, 512]
    - [133, 0.0]
  - - [128, 384, 1, 512]
    - [95, 0.0]
  - - [192, 384, 1, 512]
    - [17, 0.0]
  - - [256, 384, 1, 512]
    - [112, 0.0]
  - - [320, 384, 1, 512]
    - [17, 0.0]
  - - [384, 384, 1, 512]
    - [17, 0.0]
  - - [448, 384, 1, 512]
    - [19, 0.0]
  - - [512, 384, 1, 512]
    - [19, 0.0]
  - - [576, 384, 1, 512]
    - [19, 0.0]
  - - [640, 384, 1, 512]
    - [19, 0.0]
  - - [704, 384, 1, 512]
    - [19, 0.0]
  - - [768, 384, 1, 512]
    - [17, 0.0]
  - - [832, 384, 1, 512]
    - [19, 0.0]
  - - [896, 384, 1, 512]
    - [112, 0.0]
  - - [960, 384, 1, 512]
    - [111, 0.0]
  - - [1024, 384, 1, 512]
    - [19, 0.0]
  - - [64, 448, 1, 512]
    - [97, 0.0]
  - - [128, 448, 1, 512]
    - [15, 0.0]
  - - [192, 448, 1, 512]
    - [108, 0.0]
  - - [256, 448, 1, 512]
    - [108, 0.0]
  - - [320, 448, 1, 512]
    - [19, 0.0]
  - - [384, 448, 1, 512]
    - [19, 0.0]
  - - [448, 448, 1, 512]
    - [12, 0.0]
  - - [512, 448, 1, 512]
    - [19, 0.0]
  - - [576, 448, 1, 512]
    - [12, 0.0]
  - - [640, 448, 1, 512]
    - [107, 0.0]
  - - [704, 448, 1, 512]
    - [113, 0.0]
  - - [768, 448, 1, 512]
    - [19, 0.0]
  - - [832, 448, 1, 512]
    - [108, 0.0]
  - - [896, 448, 1, 512]
    - [119, 0.0]
  - - [960, 448, 1, 512]
    - [48, 0.0]
  - - [1024, 448, 1, 512]
    - [48, 0.0]
  - - [64, 512, 1, 512]
    - [125, 0.0]
  - - [128, 512, 1, 512]
    - [134, 0.0]
  - - [192, 512, 1, 512]
    - [113, 0.0]
  - - [256, 512, 1, 512]
    - [12, 0.0]
  - - [320, 512, 1, 512]
    - [108, 0.0]
  - - [384, 512, 1, 512]
    - [108, 0.0]
  - - [448, 512, 1, 512]
    - [108, 0.0]
  - - [512, 512, 1, 512]
    - [108, 0.0]
  - - [576, 512, 1, 512]
    - [12, 0.0]
  - - [640, 512, 1, 512]
    - [113, 0.0]
  - - [704, 512, 1, 512]
    - [108, 0.0]
  - - [768, 512, 1, 512]
    - [114, 0.0]
  - - [832, 512, 1, 512]
    - [108, 0.0]
  - - [896, 512, 1, 512]
    - [53, 0.0]
  - - [960, 512, 1, 512]
    - [108, 0.0]
  - - [1024, 512, 1, 512]
    - [80, 0.0]
  - - [64, 576, 1, 512]
    - [102, 0.0]
  - - [128, 576, 1, 512]
    - [19, 0.0]
  - - [192, 576, 1, 512]
    - [19, 0.0]
  - - [256, 576, 1, 512]
    - [107, 0.0]
  - - [320, 576, 1, 512]
    - [114, 0.0]
  - - [384, 576, 1, 512]
    - [12, 0.0]
  - - [448, 576, 1, 512]
    - [107, 0.0]
  - - [512, 576, 1, 512]
    - [114, 0.0]
  - - [576, 576, 1, 512]
    - [12, 0.0]
  - - [640, 576, 1, 512]
    - [107, 0.0]
  - - [704, 576, 1, 512]
    - [22, 0.0]
  - - [768, 576, 1, 512]
    - [48, 0.0]
  - - [832, 576, 1, 512]
    - [26, 0.0]
  - - [896, 576, 1, 512]
    - [46, 0.0]
  - - [960, 576, 1, 512]
    - [49, 0.0]
  - - [1024, 576, 1, 512]
    - [26, 0.0]
  - - [64, 640, 1, 512]
    - [120, 0.0]
  - - [128, 640, 1, 512]
    - [17, 0.0]
  - - [192, 640, 1, 512]
    - [111, 0.0]
  - - [256, 640, 1, 512]
    - [12, 0.0]
  - - [320, 640, 1, 512]
    - [12, 0.0]
  - - [384, 640, 1, 512]
    - [19, 0.0]
  - - [448, 640, 1, 512]
    - [17, 0.0]
  - - [512, 640, 1, 512]
    - [19, 0.0]
  - - [576, 640, 1, 512]
    - [26, 0.0]
  - - [640, 640, 1, 512]
    - [48, 0.0]
  - - [704, 640, 1, 512]
    - [48, 0.0]
  - - [768, 640, 1, 512]
    - [118, 0.0]
  - - [832, 640, 1, 512]
    - [83, 0.0]
  - - [896, 640, 1, 512]
    - [119, 0.0]
  - - [960, 640, 1, 512]
    - [35, 0.0]
  - - [1024, 640, 1, 512]
    - [35, 0.0]
  - - [64, 704, 1, 512]
    - [95, 0.0]
  - - [128, 704, 1, 512]
    - [12, 0.0]
  - - [192, 704, 1, 512]
    - [19, 0.0]
  - - [256, 704, 1, 512]
    - [19, 0.0]
  - - [320, 704, 1, 512]
    - [12, 0.0]
  - - [384, 704, 1, 512]
    - [107, 0.0]
  - - [448, 704, 1, 512]
    - [114, 0.0]
  - - [512, 704, 1, 512]
    - [135, 0.0]
  - - [576, 704, 1, 512]
    - [26, 0.0]
  - - [640, 704, 1, 512]
    - [35, 0.0]
  - - [704, 704, 1, 512]
    - [108, 0.0]
  - - [768, 704, 1, 512]
    - [53, 0.0]
  - - [832, 704, 1, 512]
    - [26, 0.0]
  - - [896, 704, 1, 512]
    - [49, 0.0]
  - - [960, 704, 1, 512]
    - [49, 0.0]
  - - [1024, 704, 1, 512]
    - [53, 0.0]
  - - [64, 768, 1, 512]
    - [136, 0.0]
  - - [128, 768, 1, 512]
    - [111, 0.0]
  - - [192, 768, 1, 512]
    - [12, 0.0]
  - - [256, 768, 1, 512]
    - [17, 0.0]
  - - [320, 768, 1, 512]
    - [19, 0.0]
  - - [384, 768, 1, 512]
    - [12, 0.0]
  - - [448, 768, 1, 512]
    - [107, 0.0]
  - - [512, 768, 1, 512]
    - [107, 0.0]
  - - [576, 768, 1, 512]
    - [119, 0.0]
  - - [640, 768, 1, 512]
    - [76, 0.0]
  - - [704, 768, 1, 512]
    - [19, 0.0]
  - - [768, 768, 1, 512]
    - [46, 0.0]
  - - [832, 768, 1, 512]
    - [19, 0.0]
  - - [896, 768, 1, 512]
    - [46, 0.0]
  - - [960, 768, 1, 512]
    - [48, 0.0]
  - - [1024, 768, 1, 512]
    - [46, 0.0]
  - - [64, 832, 1, 512]
    - [125, 0.0]
  - - [128, 832, 1, 512]
    - [111, 0.0]
  - - [192, 832, 1, 512]
    - [19, 0.0]
  - - [256, 832, 1, 512]
    - [12, 0.0]
  - - [320, 832, 1, 512]
    - [22, 0.0]
  - - [384, 832, 1, 512]
    - [107, 0.0]
  - - [448, 832, 1, 512]
    - [108, 0.0]
  - - [512, 832, 1, 512]
    - [48, 0.0]
  - - [576, 832, 1, 512]
    - [48, 0.0]
  - - [640, 832, 1, 512]
    - [53, 0.0]
  - - [704, 832, 1, 512]
    - [33, 0.0]
  - - [768, 832, 1, 512]
    - [35, 0.0]
  - - [832, 832, 1, 512]
    - [49, 0.0]
  - - [896, 832, 1, 512]
    - [54, 0.0]
  - - [960, 832, 1, 512]
    - [49, 0.0]
  - - [1024, 832, 1, 512]
    - [123, 0.0]
  - - [64, 896, 1, 512]
    - [125, 0.0]
  - - [128, 896, 1, 512]
    - [108, 0.0]
  - - [192, 896, 1, 512]
    - [17, 0.0]
  - - [256, 896, 1, 512]
    - [19, 0.0]
  - - [320, 896, 1, 512]
    - [12, 0.0]
  - - [384, 896, 1, 512]
    - [107, 0.0]
  - - [448, 896, 1, 512]
    - [48, 0.0]
  - - [512, 896, 1, 512]
    - [48, 0.0]
  - - [576, 896, 1, 512]
    - [48, 0.0]
  - - [640, 896, 1, 512]
    - [49, 0.0]
  - - [704, 896, 1, 512]
    - [49, 0.0]
  - - [768, 896, 1, 512]
    - [53, 0.0]
  - - [832, 896, 1, 512]
    - [89, 0.0]
  - - [896, 896, 1, 512]
    - [123, 0.0]
  - - [960, 896, 1, 512]
    - [35, 0.0]
  - - [1024, 896, 1, 512]
    - [123, 0.0]
  - - [64, 960, 1, 512]
    - [95, 0.0]
  - - [128, 960, 1, 512]
    - [111, 0.0]
  - - [192, 960, 1, 512]
    - [19, 0.0]
  - - [256, 960, 1, 512]
    - [12, 0.0]
  - - [320, 960, 1, 512]
    - [108, 0.0]
  - - [384, 960, 1, 512]
    - [19, 0.0]
  - - [448, 960, 1, 512]
    - [49, 0.0]
  - - [512, 960, 1, 512]
    - [48, 0.0]
  - - [576, 960, 1, 512]
    - [83, 0.0]
  - - [640, 960, 1, 512]
    - [46, 0.0]
  - - [704, 960, 1, 512]
    - [49, 0.0]
  - - [768, 960, 1, 512]
    - [46, 0.0]
  - - [832, 960, 1, 512]
    - [83, 0.0]
  - - [896, 960, 1, 512]
    - [123, 0.0]
  - - [960, 960, 1, 512]
    - [49, 0.0]
  - - [1024, 960, 1, 512]
    - [123, 0.0]
  - - [64, 1024, 1, 512]
    - [95, 0.0]
  - - [128, 1024, 1, 512]
    - [17, 0.0]
  - - [192, 1024, 1, 512]
    - [17, 0.0]
  - - [256, 1024, 1, 512]
    - [114, 0.0]
  - - [320, 1024, 1, 512]
    - [12, 0.0]
  - - [384, 1024, 1, 512]
    - [12, 0.0]
  - - [448, 1024, 1, 512]
    - [76, 0.0]
  - - [512, 1024, 1, 512]
    - [48, 0.0]
  - - [576, 1024, 1, 512]
    - [108, 0.0]
  - - [640, 1024, 1, 512]
    - [19, 0.0]
  - - [704, 1024, 1, 512]
    - [76, 0.0]
  - - [768, 1024, 1, 512]
    - [117, 0.0]
  - - [832, 1024, 1, 512]
    - [12, 0.0]
  - - [896, 1024, 1, 512]
    - [137, 0.0]
  - - [960, 1024, 1, 512]
    - [35, 0.0]
  - - [1024, 1024, 1, 512]
    - [93, 0.0]
  - - [128, 64, 1, 1024]
    - [98, 0.0]
  - - [192, 64, 1, 1024]
    - [138, 0.0]
  - - [256, 64, 1, 1024]
    - [104, 0.0]
  - - [320, 64, 1, 1024]
    - [139, 0.0]
  - - [384, 64, 1, 1024]
    - [98, 0.0]
  - - [448, 64, 1, 1024]
    - [95, 0.0]
  - - [512, 64, 1, 1024]
    - [129, 0.0]
  - - [576, 64, 1, 1024]
    - [125, 0.0]
  - - [640, 64, 1, 1024]
    - [129, 0.0]
  - - [704, 64, 1, 1024]
    - [120, 0.0]
  - - [768, 64, 1, 1024]
    - [104, 0.0]
  - - [832, 64, 1, 1024]
    - [120, 0.0]
  - - [896, 64, 1, 1024]
    - [104, 0.0]
  - - [960, 64, 1, 1024]
    - [97, 0.0]
  - - [1024, 64, 1, 1024]
    - [98, 0.0]
  - - [64, 128, 1, 1024]
    - [140, 0.0]
  - - [128, 128, 1, 1024]
    - [98, 0.0]
  - - [192, 128, 1, 1024]
    - [98, 0.0]
  - - [256, 128, 1, 1024]
    - [104, 0.0]
  - - [320, 128, 1, 1024]
    - [98, 0.0]
  - - [384, 128, 1, 1024]
    - [104, 0.0]
  - - [448, 128, 1, 1024]
    - [99, 0.0]
  - - [512, 128, 1, 1024]
    - [97, 0.0]
  - - [576, 128, 1, 1024]
    - [99, 0.0]
  - - [640, 128, 1, 1024]
    - [95, 0.0]
  - - [704, 128, 1, 1024]
    - [134, 0.0]
  - - [768, 128, 1, 1024]
    - [111, 0.0]
  - - [832, 128, 1, 1024]
    - [111, 0.0]
  - - [896, 128, 1, 1024]
    - [12, 0.0]
  - - [960, 128, 1, 1024]
    - [114, 0.0]
  - - [1024, 128, 1, 1024]
    - [19, 0.0]
  - - [64, 192, 1, 1024]
    - [139, 0.0]
  - - [128, 192, 1, 1024]
    - [129, 0.0]
  - - [192, 192, 1, 1024]
    - [95, 0.0]
  - - [256, 192, 1, 1024]
    - [128, 0.0]
  - - [320, 192, 1, 1024]
    - [141, 0.0]
  - - [384, 192, 1, 1024]
    - [19, 0.0]
  - - [448, 192, 1, 1024]
    - [12, 0.0]
  - - [512, 192, 1, 1024]
    - [12, 0.0]
  - - [576, 192, 1, 1024]
    - [12, 0.0]
  - - [640, 192, 1, 1024]
    - [108, 0.0]
  - - [704, 192, 1, 1024]
    - [111, 0.0]
  - - [768, 192, 1, 1024]
    - [114, 0.0]
  - - [832, 192, 1, 1024]
    - [19, 0.0]
  - - [896, 192, 1, 1024]
    - [12, 0.0]
  - - [960, 192, 1, 1024]
    - [12, 0.0]
  - - [1024, 192, 1, 1024]
    - [19, 0.0]
  - - [64, 256, 1, 1024]
    - [98, 0.0]
  - - [128, 256, 1, 1024]
    - [115, 0.0]
  - - [192, 256, 1, 1024]
    - [131, 0.0]
  - - [256, 256, 1, 1024]
    - [131, 0.0]
  - - [320, 256, 1, 1024]
    - [12, 0.0]
  - - [384, 256, 1, 1024]
    - [19, 0.0]
  - - [448, 256, 1, 1024]
    - [19, 0.0]
  - - [512, 256, 1, 1024]
    - [12, 0.0]
  - - [576, 256, 1, 1024]
    - [12, 0.0]
  - - [640, 256, 1, 1024]
    - [12, 0.0]
  - - [704, 256, 1, 1024]
    - [12, 0.0]
  - - [768, 256, 1, 1024]
    - [12, 0.0]
  - - [832, 256, 1, 1024]
    - [12, 0.0]
  - - [896, 256, 1, 1024]
    - [12, 0.0]
  - - [960, 256, 1, 1024]
    - [19, 0.0]
  - - [1024, 256, 1, 1024]
    - [114, 0.0]
  - - [64, 320, 1, 1024]
    - [95, 0.0]
  - - [128, 320, 1, 1024]
    - [115, 0.0]
  - - [192, 320, 1, 1024]
    - [99, 0.0]
  - - [256, 320, 1, 1024]
    - [142, 0.0]
  - - [320, 320, 1, 1024]
    - [113, 0.0]
  - - [384, 320, 1, 1024]
    - [108, 0.0]
  - - [448, 320, 1, 1024]
    - [12, 0.0]
  - - [512, 320, 1, 1024]
    - [19, 0.0]
  - - [576, 320, 1, 1024]
    - [114, 0.0]
  - - [640, 320, 1, 1024]
    - [12, 0.0]
  - - [704, 320, 1, 1024]
    - [12, 0.0]
  - - [768, 320, 1, 1024]
    - [114, 0.0]
  - - [832, 320, 1, 1024]
    - [12, 0.0]
  - - [896, 320, 1, 1024]
    - [26, 0.0]
  - - [960, 320, 1, 1024]
    - [113, 0.0]
  - - [1024, 320, 1, 1024]
    - [113, 0.0]
  - - [64, 384, 1, 1024]
    - [115, 0.0]
  - - [128, 384, 1, 1024]
    - [104, 0.0]
  - - [192, 384, 1, 1024]
    - [19, 0.0]
  - - [256, 384, 1, 1024]
    - [19, 0.0]
  - - [320, 384, 1, 1024]
    - [19, 0.0]
  - - [384, 384, 1, 1024]
    - [19, 0.0]
  - - [448, 384, 1, 1024]
    - [19, 0.0]
  - - [512, 384, 1, 1024]
    - [19, 0.0]
  - - [576, 384, 1, 1024]
    - [19, 0.0]
  - - [640, 384, 1, 1024]
    - [17, 0.0]
  - - [704, 384, 1, 1024]
    - [17, 0.0]
  - - [768, 384, 1, 1024]
    - [111, 0.0]
  - - [832, 384, 1, 1024]
    - [143, 0.0]
  - - [896, 384, 1, 1024]
    - [111, 0.0]
  - - [960, 384, 1, 1024]
    - [111, 0.0]
  - - [1024, 384, 1, 1024]
    - [112, 0.0]
  - - [64, 448, 1, 1024]
    - [99, 0.0]
  - - [128, 448, 1, 1024]
    - [144, 0.0]
  - - [192, 448, 1, 1024]
    - [17, 0.0]
  - - [256, 448, 1, 1024]
    - [108, 0.0]
  - - [320, 448, 1, 1024]
    - [19, 0.0]
  - - [384, 448, 1, 1024]
    - [12, 0.0]
  - - [448, 448, 1, 1024]
    - [12, 0.0]
  - - [512, 448, 1, 1024]
    - [12, 0.0]
  - - [576, 448, 1, 1024]
    - [107, 0.0]
  - - [640, 448, 1, 1024]
    - [113, 0.0]
  - - [704, 448, 1, 1024]
    - [113, 0.0]
  - - [768, 448, 1, 1024]
    - [108, 0.0]
  - - [832, 448, 1, 1024]
    - [135, 0.0]
  - - [896, 448, 1, 1024]
    - [119, 0.0]
  - - [960, 448, 1, 1024]
    - [48, 0.0]
  - - [1024, 448, 1, 1024]
    - [48, 0.0]
  - - [64, 512, 1, 1024]
    - [129, 0.0]
  - - [128, 512, 1, 1024]
    - [131, 0.0]
  - - [192, 512, 1, 1024]
    - [12, 0.0]
  - - [256, 512, 1, 1024]
    - [12, 0.0]
  - - [320, 512, 1, 1024]
    - [108, 0.0]
  - - [384, 512, 1, 1024]
    - [108, 0.0]
  - - [448, 512, 1, 1024]
    - [108, 0.0]
  - - [512, 512, 1, 1024]
    - [108, 0.0]
  - - [576, 512, 1, 1024]
    - [113, 0.0]
  - - [640, 512, 1, 1024]
    - [113, 0.0]
  - - [704, 512, 1, 1024]
    - [135, 0.0]
  - - [768, 512, 1, 1024]
    - [135, 0.0]
  - - [832, 512, 1, 1024]
    - [135, 0.0]
  - - [896, 512, 1, 1024]
    - [56, 0.0]
  - - [960, 512, 1, 1024]
    - [135, 0.0]
  - - [1024, 512, 1, 1024]
    - [117, 0.0]
  - - [64, 576, 1, 1024]
    - [120, 0.0]
  - - [128, 576, 1, 1024]
    - [17, 0.0]
  - - [192, 576, 1, 1024]
    - [19, 0.0]
  - - [256, 576, 1, 1024]
    - [12, 0.0]
  - - [320, 576, 1, 1024]
    - [114, 0.0]
  - - [384, 576, 1, 1024]
    - [108, 0.0]
  - - [448, 576, 1, 1024]
    - [135, 0.0]
  - - [512, 576, 1, 1024]
    - [113, 0.0]
  - - [576, 576, 1, 1024]
    - [108, 0.0]
  - - [640, 576, 1, 1024]
    - [135, 0.0]
  - - [704, 576, 1, 1024]
    - [48, 0.0]
  - - [768, 576, 1, 1024]
    - [48, 0.0]
  - - [832, 576, 1, 1024]
    - [108, 0.0]
  - - [896, 576, 1, 1024]
    - [117, 0.0]
  - - [960, 576, 1, 1024]
    - [49, 0.0]
  - - [1024, 576, 1, 1024]
    - [49, 0.0]
  - - [64, 640, 1, 1024]
    - [97, 0.0]
  - - [128, 640, 1, 1024]
    - [108, 0.0]
  - - [192, 640, 1, 1024]
    - [108, 0.0]
  - - [256, 640, 1, 1024]
    - [19, 0.0]
  - - [320, 640, 1, 1024]
    - [19, 0.0]
  - - [384, 640, 1, 1024]
    - [108, 0.0]
  - - [448, 640, 1, 1024]
    - [19, 0.0]
  - - [512, 640, 1, 1024]
    - [113, 0.0]
  - - [576, 640, 1, 1024]
    - [113, 0.0]
  - - [640, 640, 1, 1024]
    - [48, 0.0]
  - - [704, 640, 1, 1024]
    - [48, 0.0]
  - - [768, 640, 1, 1024]
    - [48, 0.0]
  - - [832, 640, 1, 1024]
    - [49, 0.0]
  - - [896, 640, 1, 1024]
    - [49, 0.0]
  - - [960, 640, 1, 1024]
    - [47, 0.0]
  - - [1024, 640, 1, 1024]
    - [47, 0.0]
  - - [64, 704, 1, 1024]
    - [95, 0.0]
  - - [128, 704, 1, 1024]
    - [108, 0.0]
  - - [192, 704, 1, 1024]
    - [12, 0.0]
  - - [256, 704, 1, 1024]
    - [12, 0.0]
  - - [320, 704, 1, 1024]
    - [12, 0.0]
  - - [384, 704, 1, 1024]
    - [12, 0.0]
  - - [448, 704, 1, 1024]
    - [135, 0.0]
  - - [512, 704, 1, 1024]
    - [135, 0.0]
  - - [576, 704, 1, 1024]
    - [48, 0.0]
  - - [640, 704, 1, 1024]
    - [48, 0.0]
  - - [704, 704, 1, 1024]
    - [108, 0.0]
  - - [768, 704, 1, 1024]
    - [117, 0.0]
  - - [832, 704, 1, 1024]
    - [113, 0.0]
  - - [896, 704, 1, 1024]
    - [117, 0.0]
  - - [960, 704, 1, 1024]
    - [49, 0.0]
  - - [1024, 704, 1, 1024]
    - [46, 0.0]
  - - [64, 768, 1, 1024]
    - [99, 0.0]
  - - [128, 768, 1, 1024]
    - [107, 0.0]
  - - [192, 768, 1, 1024]
    - [107, 0.0]
  - - [256, 768, 1, 1024]
    - [17, 0.0]
  - - [320, 768, 1, 1024]
    - [17, 0.0]
  - - [384, 768, 1, 1024]
    - [116, 0.0]
  - - [448, 768, 1, 1024]
    - [135, 0.0]
  - - [512, 768, 1, 1024]
    - [113, 0.0]
  - - [576, 768, 1, 1024]
    - [113, 0.0]
  - - [640, 768, 1, 1024]
    - [117, 0.0]
  - - [704, 768, 1, 1024]
    - [108, 0.0]
  - - [768, 768, 1, 1024]
    - [123, 0.0]
  - - [832, 768, 1, 1024]
    - [135, 0.0]
  - - [896, 768, 1, 1024]
    - [145, 0.0]
  - - [960, 768, 1, 1024]
    - [33, 0.0]
  - - [1024, 768, 1, 1024]
    - [123, 0.0]
  - - [64, 832, 1, 1024]
    - [95, 0.0]
  - - [128, 832, 1, 1024]
    - [114, 0.0]
  - - [192, 832, 1, 1024]
    - [114, 0.0]
  - - [256, 832, 1, 1024]
    - [12, 0.0]
  - - [320, 832, 1, 1024]
    - [108, 0.0]
  - - [384, 832, 1, 1024]
    - [108, 0.0]
  - - [448, 832, 1, 1024]
    - [108, 0.0]
  - - [512, 832, 1, 1024]
    - [22, 0.0]
  - - [576, 832, 1, 1024]
    - [48, 0.0]
  - - [640, 832, 1, 1024]
    - [117, 0.0]
  - - [704, 832, 1, 1024]
    - [116, 0.0]
  - - [768, 832, 1, 1024]
    - [53, 0.0]
  - - [832, 832, 1, 1024]
    - [49, 0.0]
  - - [896, 832, 1, 1024]
    - [53, 0.0]
  - - [960, 832, 1, 1024]
    - [47, 0.0]
  - - [1024, 832, 1, 1024]
    - [123, 0.0]
  - - [64, 896, 1, 1024]
    - [131, 0.0]
  - - [128, 896, 1, 1024]
    - [17, 0.0]
  - - [192, 896, 1, 1024]
    - [19, 0.0]
  - - [256, 896, 1, 1024]
    - [19, 0.0]
  - - [320, 896, 1, 1024]
    - [108, 0.0]
  - - [384, 896, 1, 1024]
    - [116, 0.0]
  - - [448, 896, 1, 1024]
    - [48, 0.0]
  - - [512, 896, 1, 1024]
    - [48, 0.0]
  - - [576, 896, 1, 1024]
    - [48, 0.0]
  - - [640, 896, 1, 1024]
    - [35, 0.0]
  - - [704, 896, 1, 1024]
    - [49, 0.0]
  - - [768, 896, 1, 1024]
    - [89, 0.0]
  - - [832, 896, 1, 1024]
    - [89, 0.0]
  - - [896, 896, 1, 1024]
    - [123, 0.0]
  - - [960, 896, 1, 1024]
    - [33, 0.0]
  - - [1024, 896, 1, 1024]
    - [123, 0.0]
  - - [64, 960, 1, 1024]
    - [144, 0.0]
  - - [128, 960, 1, 1024]
    - [12, 0.0]
  - - [192, 960, 1, 1024]
    - [12, 0.0]
  - - [256, 960, 1, 1024]
    - [19, 0.0]
  - - [320, 960, 1, 1024]
    - [108, 0.0]
  - - [384, 960, 1, 1024]
    - [108, 0.0]
  - - [448, 960, 1, 1024]
    - [48, 0.0]
  - - [512, 960, 1, 1024]
    - [119, 0.0]
  - - [576, 960, 1, 1024]
    - [49, 0.0]
  - - [640, 960, 1, 1024]
    - [33, 0.0]
  - - [704, 960, 1, 1024]
    - [49, 0.0]
  - - [768, 960, 1, 1024]
    - [123, 0.0]
  - - [832, 960, 1, 1024]
    - [47, 0.0]
  - - [896, 960, 1, 1024]
    - [123, 0.0]
  - - [960, 960, 1, 1024]
    - [48, 0.0]
  - - [1024, 960, 1, 1024]
    - [123, 0.0]
  - - [64, 1024, 1, 1024]
    - [125, 0.0]
  - - [128, 1024, 1, 1024]
    - [17, 0.0]
  - - [192, 1024, 1, 1024]
    - [114, 0.0]
  - - [256, 1024, 1, 1024]
    - [12, 0.0]
  - - [320, 1024, 1, 1024]
    - [107, 0.0]
  - - [384, 1024, 1, 1024]
    - [12, 0.0]
  - - [448, 1024, 1, 1024]
    - [135, 0.0]
  - - [512, 1024, 1, 1024]
    - [117, 0.0]
  - - [576, 1024, 1, 1024]
    - [135, 0.0]
  - - [640, 1024, 1, 1024]
    - [116, 0.0]
  - - [704, 1024, 1, 1024]
    - [119, 0.0]
  - - [768, 1024, 1, 1024]
    - [123, 0.0]
  - - [832, 1024, 1, 1024]
    - [19, 0.0]
  - - [896, 1024, 1, 1024]
    - [123, 0.0]
  - - [960, 1024, 1, 1024]
    - [56, 0.0]
  - - [1024, 1024, 1, 1024]
    - [123, 0.0]
  - - [128, 64, 1, 2048]
    - [146, 0.0]
  - - [192, 64, 1, 2048]
    - [110, 0.0]
  - - [256, 64, 1, 2048]
    - [128, 0.0]
  - - [320, 64, 1, 2048]
    - [147, 0.0]
  - - [384, 64, 1, 2048]
    - [98, 0.0]
  - - [448, 64, 1, 2048]
    - [95, 0.0]
  - - [512, 64, 1, 2048]
    - [98, 0.0]
  - - [576, 64, 1, 2048]
    - [99, 0.0]
  - - [640, 64, 1, 2048]
    - [126, 0.0]
  - - [704, 64, 1, 2048]
    - [95, 0.0]
  - - [768, 64, 1, 2048]
    - [129, 0.0]
  - - [832, 64, 1, 2048]
    - [125, 0.0]
  - - [896, 64, 1, 2048]
    - [104, 0.0]
  - - [960, 64, 1, 2048]
    - [120, 0.0]
  - - [1024, 64, 1, 2048]
    - [104, 0.0]
  - - [64, 128, 1, 2048]
    - [148, 0.0]
  - - [128, 128, 1, 2048]
    - [104, 0.0]
  - - [192, 128, 1, 2048]
    - [104, 0.0]
  - - [256, 128, 1, 2048]
    - [104, 0.0]
  - - [320, 128, 1, 2048]
    - [95, 0.0]
  - - [384, 128, 1, 2048]
    - [102, 0.0]
  - - [448, 128, 1, 2048]
    - [99, 0.0]
  - - [512, 128, 1, 2048]
    - [97, 0.0]
  - - [576, 128, 1, 2048]
    - [99, 0.0]
  - - [640, 128, 1, 2048]
    - [144, 0.0]
  - - [704, 128, 1, 2048]
    - [144, 0.0]
  - - [768, 128, 1, 2048]
    - [149, 0.0]
  - - [832, 128, 1, 2048]
    - [135, 0.0]
  - - [896, 128, 1, 2048]
    - [135, 0.0]
  - - [960, 128, 1, 2048]
    - [111, 0.0]
  - - [1024, 128, 1, 2048]
    - [135, 0.0]
  - - [64, 192, 1, 2048]
    - [95, 0.0]
  - - [128, 192, 1, 2048]
    - [115, 0.0]
  - - [192, 192, 1, 2048]
    - [99, 0.0]
  - - [256, 192, 1, 2048]
    - [98, 0.0]
  - - [320, 192, 1, 2048]
    - [134, 0.0]
  - - [384, 192, 1, 2048]
    - [142, 0.0]
  - - [448, 192, 1, 2048]
    - [144, 0.0]
  - - [512, 192, 1, 2048]
    - [144, 0.0]
  - - [576, 192, 1, 2048]
    - [108, 0.0]
  - - [640, 192, 1, 2048]
    - [135, 0.0]
  - - [704, 192, 1, 2048]
    - [108, 0.0]
  - - [768, 192, 1, 2048]
    - [114, 0.0]
  - - [832, 192, 1, 2048]
    - [114, 0.0]
  - - [896, 192, 1, 2048]
    - [12, 0.0]
  - - [960, 192, 1, 2048]
    - [12, 0.0]
  - - [1024, 192, 1, 2048]
    - [114, 0.0]
  - - [64, 256, 1, 2048]
    - [140, 0.0]
  - - [128, 256, 1, 2048]
    - [126, 0.0]
  - - [192, 256, 1, 2048]
    - [131, 0.0]
  - - [256, 256, 1, 2048]
    - [150, 0.0]
  - - [320, 256, 1, 2048]
    - [141, 0.0]
  - - [384, 256, 1, 2048]
    - [131, 0.0]
  - - [448, 256, 1, 2048]
    - [108, 0.0]
  - - [512, 256, 1, 2048]
    - [108, 0.0]
  - - [576, 256, 1, 2048]
    - [12, 0.0]
  - - [640, 256, 1, 2048]
    - [12, 0.0]
  - - [704, 256, 1, 2048]
    - [12, 0.0]
  - - [768, 256, 1, 2048]
    - [12, 0.0]
  - - [832, 256, 1, 2048]
    - [12, 0.0]
  - - [896, 256, 1, 2048]
    - [12, 0.0]
  - - [960, 256, 1, 2048]
    - [12, 0.0]
  - - [1024, 256, 1, 2048]
    - [19, 0.0]
  - - [64, 320, 1, 2048]
    - [147, 0.0]
  - - [128, 320, 1, 2048]
    - [95, 0.0]
  - - [192, 320, 1, 2048]
    - [144, 0.0]
  - - [256, 320, 1, 2048]
    - [142, 0.0]
  - - [320, 320, 1, 2048]
    - [17, 0.0]
  - - [384, 320, 1, 2048]
    - [135, 0.0]
  - - [448, 320, 1, 2048]
    - [114, 0.0]
  - - [512, 320, 1, 2048]
    - [12, 0.0]
  - - [576, 320, 1, 2048]
    - [114, 0.0]
  - - [640, 320, 1, 2048]
    - [12, 0.0]
  - - [704, 320, 1, 2048]
    - [12, 0.0]
  - - [768, 320, 1, 2048]
    - [12, 0.0]
  - - [832, 320, 1, 2048]
    - [135, 0.0]
  - - [896, 320, 1, 2048]
    - [114, 0.0]
  - - [960, 320, 1, 2048]
    - [116, 0.0]
  - - [1024, 320, 1, 2048]
    - [26, 0.0]
  - - [64, 384, 1, 2048]
    - [98, 0.0]
  - - [128, 384, 1, 2048]
    - [131, 0.0]
  - - [192, 384, 1, 2048]
    - [144, 0.0]
  - - [256, 384, 1, 2048]
    - [149, 0.0]
  - - [320, 384, 1, 2048]
    - [114, 0.0]
  - - [384, 384, 1, 2048]
    - [12, 0.0]
  - - [448, 384, 1, 2048]
    - [19, 0.0]
  - - [512, 384, 1, 2048]
    - [19, 0.0]
  - - [576, 384, 1, 2048]
    - [19, 0.0]
  - - [640, 384, 1, 2048]
    - [114, 0.0]
  - - [704, 384, 1, 2048]
    - [19, 0.0]
  - - [768, 384, 1, 2048]
    - [19, 0.0]
  - - [832, 384, 1, 2048]
    - [111, 0.0]
  - - [896, 384, 1, 2048]
    - [108, 0.0]
  - - [960, 384, 1, 2048]
    - [17, 0.0]
  - - [1024, 384, 1, 2048]
    - [17, 0.0]
  - - [64, 448, 1, 2048]
    - [95, 0.0]
  - - [128, 448, 1, 2048]
    - [149, 0.0]
  - - [192, 448, 1, 2048]
    - [144, 0.0]
  - - [256, 448, 1, 2048]
    - [12, 0.0]
  - - [320, 448, 1, 2048]
    - [108, 0.0]
  - - [384, 448, 1, 2048]
    - [12, 0.0]
  - - [448, 448, 1, 2048]
    - [12, 0.0]
  - - [512, 448, 1, 2048]
    - [114, 0.0]
  - - [576, 448, 1, 2048]
    - [114, 0.0]
  - - [640, 448, 1, 2048]
    - [12, 0.0]
  - - [704, 448, 1, 2048]
    - [116, 0.0]
  - - [768, 448, 1, 2048]
    - [108, 0.0]
  - - [832, 448, 1, 2048]
    - [135, 0.0]
  - - [896, 448, 1, 2048]
    - [113, 0.0]
  - - [960, 448, 1, 2048]
    - [48, 0.0]
  - - [1024, 448, 1, 2048]
    - [119, 0.0]
  - - [64, 512, 1, 2048]
    - [151, 0.0]
  - - [128, 512, 1, 2048]
    - [150, 0.0]
  - - [192, 512, 1, 2048]
    - [142, 0.0]
  - - [256, 512, 1, 2048]
    - [135, 0.0]
  - - [320, 512, 1, 2048]
    - [108, 0.0]
  - - [384, 512, 1, 2048]
    - [108, 0.0]
  - - [448, 512, 1, 2048]
    - [135, 0.0]
  - - [512, 512, 1, 2048]
    - [108, 0.0]
  - - [576, 512, 1, 2048]
    - [108, 0.0]
  - - [640, 512, 1, 2048]
    - [108, 0.0]
  - - [704, 512, 1, 2048]
    - [135, 0.0]
  - - [768, 512, 1, 2048]
    - [108, 0.0]
  - - [832, 512, 1, 2048]
    - [108, 0.0]
  - - [896, 512, 1, 2048]
    - [56, 0.0]
  - - [960, 512, 1, 2048]
    - [135, 0.0]
  - - [1024, 512, 1, 2048]
    - [80, 0.0]
  - - [64, 576, 1, 2048]
    - [127, 0.0]
  - - [128, 576, 1, 2048]
    - [142, 0.0]
  - - [192, 576, 1, 2048]
    - [111, 0.0]
  - - [256, 576, 1, 2048]
    - [19, 0.0]
  - - [320, 576, 1, 2048]
    - [114, 0.0]
  - - [384, 576, 1, 2048]
    - [12, 0.0]
  - - [448, 576, 1, 2048]
    - [12, 0.0]
  - - [512, 576, 1, 2048]
    - [108, 0.0]
  - - [576, 576, 1, 2048]
    - [108, 0.0]
  - - [640, 576, 1, 2048]
    - [108, 0.0]
  - - [704, 576, 1, 2048]
    - [135, 0.0]
  - - [768, 576, 1, 2048]
    - [116, 0.0]
  - - [832, 576, 1, 2048]
    - [116, 0.0]
  - - [896, 576, 1, 2048]
    - [108, 0.0]
  - - [960, 576, 1, 2048]
    - [135, 0.0]
  - - [1024, 576, 1, 2048]
    - [56, 0.0]
  - - [64, 640, 1, 2048]
    - [131, 0.0]
  - - [128, 640, 1, 2048]
    - [142, 0.0]
  - - [192, 640, 1, 2048]
    - [135, 0.0]
  - - [256, 640, 1, 2048]
    - [19, 0.0]
  - - [320, 640, 1, 2048]
    - [19, 0.0]
  - - [384, 640, 1, 2048]
    - [135, 0.0]
  - - [448, 640, 1, 2048]
    - [19, 0.0]
  - - [512, 640, 1, 2048]
    - [108, 0.0]
  - - [576, 640, 1, 2048]
    - [17, 0.0]
  - - [640, 640, 1, 2048]
    - [113, 0.0]
  - - [704, 640, 1, 2048]
    - [152, 0.0]
  - - [768, 640, 1, 2048]
    - [48, 0.0]
  - - [832, 640, 1, 2048]
    - [152, 0.0]
  - - [896, 640, 1, 2048]
    - [49, 0.0]
  - - [960, 640, 1, 2048]
    - [49, 0.0]
  - - [1024, 640, 1, 2048]
    - [35, 0.0]
  - - [64, 704, 1, 2048]
    - [120, 0.0]
  - - [128, 704, 1, 2048]
    - [142, 0.0]
  - - [192, 704, 1, 2048]
    - [114, 0.0]
  - - [256, 704, 1, 2048]
    - [135, 0.0]
  - - [320, 704, 1, 2048]
    - [114, 0.0]
  - - [384, 704, 1, 2048]
    - [26, 0.0]
  - - [448, 704, 1, 2048]
    - [113, 0.0]
  - - [512, 704, 1, 2048]
    - [135, 0.0]
  - - [576, 704, 1, 2048]
    - [108, 0.0]
  - - [640, 704, 1, 2048]
    - [108, 0.0]
  - - [704, 704, 1, 2048]
    - [116, 0.0]
  - - [768, 704, 1, 2048]
    - [48, 0.0]
  - - [832, 704, 1, 2048]
    - [116, 0.0]
  - - [896, 704, 1, 2048]
    - [46, 0.0]
  - - [960, 704, 1, 2048]
    - [53, 0.0]
  - - [1024, 704, 1, 2048]
    - [53, 0.0]
  - - [64, 768, 1, 2048]
    - [131, 0.0]
  - - [128, 768, 1, 2048]
    - [134, 0.0]
  - - [192, 768, 1, 2048]
    - [12, 0.0]
  - - [256, 768, 1, 2048]
    - [19, 0.0]
  - - [320, 768, 1, 2048]
    - [12, 0.0]
  - - [384, 768, 1, 2048]
    - [108, 0.0]
  - - [448, 768, 1, 2048]
    - [108, 0.0]
  - - [512, 768, 1, 2048]
    - [108, 0.0]
  - - [576, 768, 1, 2048]
    - [135, 0.0]
  - - [640, 768, 1, 2048]
    - [113, 0.0]
  - - [704, 768, 1, 2048]
    - [135, 0.0]
  - - [768, 768, 1, 2048]
    - [53, 0.0]
  - - [832, 768, 1, 2048]
    - [135, 0.0]
  - - [896, 768, 1, 2048]
    - [145, 0.0]
  - - [960, 768, 1, 2048]
    - [46, 0.0]
  - - [1024, 768, 1, 2048]
    - [123, 0.0]
  - - [64, 832, 1, 2048]
    - [144, 0.0]
  - - [128, 832, 1, 2048]
    - [17, 0.0]
  - - [192, 832, 1, 2048]
    - [12, 0.0]
  - - [256, 832, 1, 2048]
    - [108, 0.0]
  - - [320, 832, 1, 2048]
    - [12, 0.0]
  - - [384, 832, 1, 2048]
    - [108, 0.0]
  - - [448, 832, 1, 2048]
    - [135, 0.0]
  - - [512, 832, 1, 2048]
    - [116, 0.0]
  - - [576, 832, 1, 2048]
    - [48, 0.0]
  - - [640, 832, 1, 2048]
    - [49, 0.0]
  - - [704, 832, 1, 2048]
    - [89, 0.0]
  - - [768, 832, 1, 2048]
    - [145, 0.0]
  - - [832, 832, 1, 2048]
    - [47, 0.0]
  - - [896, 832, 1, 2048]
    - [56, 0.0]
  - - [960, 832, 1, 2048]
    - [48, 0.0]
  - - [1024, 832, 1, 2048]
    - [153, 0.0]
  - - [64, 896, 1, 2048]
    - [131, 0.0]
  - - [128, 896, 1, 2048]
    - [17, 0.0]
  - - [192, 896, 1, 2048]
    - [19, 0.0]
  - - [256, 896, 1, 2048]
    - [19, 0.0]
  - - [320, 896, 1, 2048]
    - [19, 0.0]
  - - [384, 896, 1, 2048]
    - [19, 0.0]
  - - [448, 896, 1, 2048]
    - [22, 0.0]
  - - [512, 896, 1, 2048]
    - [48, 0.0]
  - - [576, 896, 1, 2048]
    - [48, 0.0]
  - - [640, 896, 1, 2048]
    - [48, 0.0]
  - - [704, 896, 1, 2048]
    - [48, 0.0]
  - - [768, 896, 1, 2048]
    - [48, 0.0]
  - - [832, 896, 1, 2048]
    - [154, 0.0]
  - - [896, 896, 1, 2048]
    - [123, 0.0]
  - - [960, 896, 1, 2048]
    - [49, 0.0]
  - - [1024, 896, 1, 2048]
    - [123, 0.0]
  - - [64, 960, 1, 2048]
    - [134, 0.0]
  - - [128, 960, 1, 2048]
    - [17, 0.0]
  - - [192, 960, 1, 2048]
    - [135, 0.0]
  - - [256, 960, 1, 2048]
    - [17, 0.0]
  - - [320, 960, 1, 2048]
    - [113, 0.0]
  - - [384, 960, 1, 2048]
    - [113, 0.0]
  - - [448, 960, 1, 2048]
    - [135, 0.0]
  - - [512, 960, 1, 2048]
    - [48, 0.0]
  - - [576, 960, 1, 2048]
    - [83, 0.0]
  - - [640, 960, 1, 2048]
    - [89, 0.0]
  - - [704, 960, 1, 2048]
    - [47, 0.0]
  - - [768, 960, 1, 2048]
    - [48, 0.0]
  - - [832, 960, 1, 2048]
    - [47, 0.0]
  - - [896, 960, 1, 2048]
    - [123, 0.0]
  - - [960, 960, 1, 2048]
    - [89, 0.0]
  - - [1024, 960, 1, 2048]
    - [123, 0.0]
  - - [64, 1024, 1, 2048]
    - [131, 0.0]
  - - [128, 1024, 1, 2048]
    - [108, 0.0]
  - - [192, 1024, 1, 2048]
    - [17, 0.0]
  - - [256, 1024, 1, 2048]
    - [26, 0.0]
  - - [320, 1024, 1, 2048]
    - [116, 0.0]
  - - [384, 1024, 1, 2048]
    - [12, 0.0]
  - - [448, 1024, 1, 2048]
    - [113, 0.0]
  - - [512, 1024, 1, 2048]
    - [113, 0.0]
  - - [576, 1024, 1, 2048]
    - [113, 0.0]
  - - [640, 1024, 1, 2048]
    - [116, 0.0]
  - - [704, 1024, 1, 2048]
    - [53, 0.0]
  - - [768, 1024, 1, 2048]
    - [145, 0.0]
  - - [832, 1024, 1, 2048]
    - [53, 0.0]
  - - [896, 1024, 1, 2048]
    - [123, 0.0]
  - - [960, 1024, 1, 2048]
    - [53, 0.0]
  - - [1024, 1024, 1, 2048]
    - [123, 0.0]
  - - [128, 64, 1, 4096]
    - [148, 0.0]
  - - [192, 64, 1, 4096]
    - [110, 0.0]
  - - [256, 64, 1, 4096]
    - [126, 0.0]
  - - [320, 64, 1, 4096]
    - [110, 0.0]
  - - [384, 64, 1, 4096]
    - [98, 0.0]
  - - [448, 64, 1, 4096]
    - [139, 0.0]
  - - [512, 64, 1, 4096]
    - [126, 0.0]
  - - [576, 64, 1, 4096]
    - [95, 0.0]
  - - [640, 64, 1, 4096]
    - [126, 0.0]
  - - [704, 64, 1, 4096]
    - [95, 0.0]
  - - [768, 64, 1, 4096]
    - [128, 0.0]
  - - [832, 64, 1, 4096]
    - [120, 0.0]
  - - [896, 64, 1, 4096]
    - [126, 0.0]
  - - [960, 64, 1, 4096]
    - [95, 0.0]
  - - [1024, 64, 1, 4096]
    - [128, 0.0]
  - - [64, 128, 1, 4096]
    - [148, 0.0]
  - - [128, 128, 1, 4096]
    - [98, 0.0]
  - - [192, 128, 1, 4096]
    - [115, 0.0]
  - - [256, 128, 1, 4096]
    - [104, 0.0]
  - - [320, 128, 1, 4096]
    - [115, 0.0]
  - - [384, 128, 1, 4096]
    - [104, 0.0]
  - - [448, 128, 1, 4096]
    - [99, 0.0]
  - - [512, 128, 1, 4096]
    - [102, 0.0]
  - - [576, 128, 1, 4096]
    - [97, 0.0]
  - - [640, 128, 1, 4096]
    - [155, 0.0]
  - - [704, 128, 1, 4096]
    - [155, 0.0]
  - - [768, 128, 1, 4096]
    - [134, 0.0]
  - - [832, 128, 1, 4096]
    - [135, 0.0]
  - - [896, 128, 1, 4096]
    - [108, 0.0]
  - - [960, 128, 1, 4096]
    - [111, 0.0]
  - - [1024, 128, 1, 4096]
    - [108, 0.0]
  - - [64, 192, 1, 4096]
    - [147, 0.0]
  - - [128, 192, 1, 4096]
    - [156, 0.0]
  - - [192, 192, 1, 4096]
    - [125, 0.0]
  - - [256, 192, 1, 4096]
    - [98, 0.0]
  - - [320, 192, 1, 4096]
    - [142, 0.0]
  - - [384, 192, 1, 4096]
    - [149, 0.0]
  - - [448, 192, 1, 4096]
    - [142, 0.0]
  - - [512, 192, 1, 4096]
    - [135, 0.0]
  - - [576, 192, 1, 4096]
    - [108, 0.0]
  - - [640, 192, 1, 4096]
    - [108, 0.0]
  - - [704, 192, 1, 4096]
    - [108, 0.0]
  - - [768, 192, 1, 4096]
    - [108, 0.0]
  - - [832, 192, 1, 4096]
    - [108, 0.0]
  - - [896, 192, 1, 4096]
    - [12, 0.0]
  - - [960, 192, 1, 4096]
    - [12, 0.0]
  - - [1024, 192, 1, 4096]
    - [12, 0.0]
  - - [64, 256, 1, 4096]
    - [104, 0.0]
  - - [128, 256, 1, 4096]
    - [98, 0.0]
  - - [192, 256, 1, 4096]
    - [149, 0.0]
  - - [256, 256, 1, 4096]
    - [131, 0.0]
  - - [320, 256, 1, 4096]
    - [154, 0.0]
  - - [384, 256, 1, 4096]
    - [142, 0.0]
  - - [448, 256, 1, 4096]
    - [111, 0.0]
  - - [512, 256, 1, 4096]
    - [111, 0.0]
  - - [576, 256, 1, 4096]
    - [12, 0.0]
  - - [640, 256, 1, 4096]
    - [12, 0.0]
  - - [704, 256, 1, 4096]
    - [114, 0.0]
  - - [768, 256, 1, 4096]
    - [135, 0.0]
  - - [832, 256, 1, 4096]
    - [108, 0.0]
  - - [896, 256, 1, 4096]
    - [12, 0.0]
  - - [960, 256, 1, 4096]
    - [111, 0.0]
  - - [1024, 256, 1, 4096]
    - [114, 0.0]
  - - [64, 320, 1, 4096]
    - [95, 0.0]
  - - [128, 320, 1, 4096]
    - [115, 0.0]
  - - [192, 320, 1, 4096]
    - [114, 0.0]
  - - [256, 320, 1, 4096]
    - [4, 0.0]
  - - [320, 320, 1, 4096]
    - [135, 0.0]
  - - [384, 320, 1, 4096]
    - [108, 0.0]
  - - [448, 320, 1, 4096]
    - [19, 0.0]
  - - [512, 320, 1, 4096]
    - [19, 0.0]
  - - [576, 320, 1, 4096]
    - [12, 0.0]
  - - [640, 320, 1, 4096]
    - [12, 0.0]
  - - [704, 320, 1, 4096]
    - [12, 0.0]
  - - [768, 320, 1, 4096]
    - [135, 0.0]
  - - [832, 320, 1, 4096]
    - [12, 0.0]
  - - [896, 320, 1, 4096]
    - [116, 0.0]
  - - [960, 320, 1, 4096]
    - [116, 0.0]
  - - [1024, 320, 1, 4096]
    - [113, 0.0]
  - - [64, 384, 1, 4096]
    - [98, 0.0]
  - - [128, 384, 1, 4096]
    - [154, 0.0]
  - - [192, 384, 1, 4096]
    - [154, 0.0]
  - - [256, 384, 1, 4096]
    - [135, 0.0]
  - - [320, 384, 1, 4096]
    - [111, 0.0]
  - - [384, 384, 1, 4096]
    - [19, 0.0]
  - - [448, 384, 1, 4096]
    - [19, 0.0]
  - - [512, 384, 1, 4096]
    - [19, 0.0]
  - - [576, 384, 1, 4096]
    - [19, 0.0]
  - - [640, 384, 1, 4096]
    - [19, 0.0]
  - - [704, 384, 1, 4096]
    - [19, 0.0]
  - - [768, 384, 1, 4096]
    - [112, 0.0]
  - - [832, 384, 1, 4096]
    - [112, 0.0]
  - - [896, 384, 1, 4096]
    - [112, 0.0]
  - - [960, 384, 1, 4096]
    - [19, 0.0]
  - - [1024, 384, 1, 4096]
    - [112, 0.0]
  - - [64, 448, 1, 4096]
    - [95, 0.0]
  - - [128, 448, 1, 4096]
    - [144, 0.0]
  - - [192, 448, 1, 4096]
    - [134, 0.0]
  - - [256, 448, 1, 4096]
    - [135, 0.0]
  - - [320, 448, 1, 4096]
    - [135, 0.0]
  - - [384, 448, 1, 4096]
    - [135, 0.0]
  - - [448, 448, 1, 4096]
    - [114, 0.0]
  - - [512, 448, 1, 4096]
    - [19, 0.0]
  - - [576, 448, 1, 4096]
    - [108, 0.0]
  - - [640, 448, 1, 4096]
    - [113, 0.0]
  - - [704, 448, 1, 4096]
    - [113, 0.0]
  - - [768, 448, 1, 4096]
    - [108, 0.0]
  - - [832, 448, 1, 4096]
    - [116, 0.0]
  - - [896, 448, 1, 4096]
    - [119, 0.0]
  - - [960, 448, 1, 4096]
    - [48, 0.0]
  - - [1024, 448, 1, 4096]
    - [48, 0.0]
  - - [64, 512, 1, 4096]
    - [115, 0.0]
  - - [128, 512, 1, 4096]
    - [157, 0.0]
  - - [192, 512, 1, 4096]
    - [135, 0.0]
  - - [256, 512, 1, 4096]
    - [111, 0.0]
  - - [320, 512, 1, 4096]
    - [135, 0.0]
  - - [384, 512, 1, 4096]
    - [108, 0.0]
  - - [448, 512, 1, 4096]
    - [108, 0.0]
  - - [512, 512, 1, 4096]
    - [108, 0.0]
  - - [576, 512, 1, 4096]
    - [108, 0.0]
  - - [640, 512, 1, 4096]
    - [108, 0.0]
  - - [704, 512, 1, 4096]
    - [107, 0.0]
  - - [768, 512, 1, 4096]
    - [108, 0.0]
  - - [832, 512, 1, 4096]
    - [108, 0.0]
  - - [896, 512, 1, 4096]
    - [54, 0.0]
  - - [960, 512, 1, 4096]
    - [135, 0.0]
  - - [1024, 512, 1, 4096]
    - [158, 0.0]
  - - [64, 576, 1, 4096]
    - [120, 0.0]
  - - [128, 576, 1, 4096]
    - [144, 0.0]
  - - [192, 576, 1, 4096]
    - [108, 0.0]
  - - [256, 576, 1, 4096]
    - [12, 0.0]
  - - [320, 576, 1, 4096]
    - [114, 0.0]
  - - [384, 576, 1, 4096]
    - [114, 0.0]
  - - [448, 576, 1, 4096]
    - [114, 0.0]
  - - [512, 576, 1, 4096]
    - [135, 0.0]
  - - [576, 576, 1, 4096]
    - [135, 0.0]
  - - [640, 576, 1, 4096]
    - [135, 0.0]
  - - [704, 576, 1, 4096]
    - [108, 0.0]
  - - [768, 576, 1, 4096]
    - [135, 0.0]
  - - [832, 576, 1, 4096]
    - [135, 0.0]
  - - [896, 576, 1, 4096]
    - [108, 0.0]
  - - [960, 576, 1, 4096]
    - [108, 0.0]
  - - [1024, 576, 1, 4096]
    - [48, 0.0]
  - - [64, 640, 1, 4096]
    - [143, 0.0]
  - - [128, 640, 1, 4096]
    - [154, 0.0]
  - - [192, 640, 1, 4096]
    - [108, 0.0]
  - - [256, 640, 1, 4096]
    - [19, 0.0]
  - - [320, 640, 1, 4096]
    - [19, 0.0]
  - - [384, 640, 1, 4096]
    - [108, 0.0]
  - - [448, 640, 1, 4096]
    - [135, 0.0]
  - - [512, 640, 1, 4096]
    - [108, 0.0]
  - - [576, 640, 1, 4096]
    - [135, 0.0]
  - - [640, 640, 1, 4096]
    - [107, 0.0]
  - - [704, 640, 1, 4096]
    - [48, 0.0]
  - - [768, 640, 1, 4096]
    - [48, 0.0]
  - - [832, 640, 1, 4096]
    - [48, 0.0]
  - - [896, 640, 1, 4096]
    - [49, 0.0]
  - - [960, 640, 1, 4096]
    - [49, 0.0]
  - - [1024, 640, 1, 4096]
    - [49, 0.0]
  - - [64, 704, 1, 4096]
    - [144, 0.0]
  - - [128, 704, 1, 4096]
    - [142, 0.0]
  - - [192, 704, 1, 4096]
    - [19, 0.0]
  - - [256, 704, 1, 4096]
    - [135, 0.0]
  - - [320, 704, 1, 4096]
    - [114, 0.0]
  - - [384, 704, 1, 4096]
    - [135, 0.0]
  - - [448, 704, 1, 4096]
    - [135, 0.0]
  - - [512, 704, 1, 4096]
    - [135, 0.0]
  - - [576, 704, 1, 4096]
    - [107, 0.0]
  - - [640, 704, 1, 4096]
    - [48, 0.0]
  - - [704, 704, 1, 4096]
    - [108, 0.0]
  - - [768, 704, 1, 4096]
    - [48, 0.0]
  - - [832, 704, 1, 4096]
    - [48, 0.0]
  - - [896, 704, 1, 4096]
    - [53, 0.0]
  - - [960, 704, 1, 4096]
    - [48, 0.0]
  - - [1024, 704, 1, 4096]
    - [159, 0.0]
  - - [64, 768, 1, 4096]
    - [131, 0.0]
  - - [128, 768, 1, 4096]
    - [122, 0.0]
  - - [192, 768, 1, 4096]
    - [108, 0.0]
  - - [256, 768, 1, 4096]
    - [19, 0.0]
  - - [320, 768, 1, 4096]
    - [135, 0.0]
  - - [384, 768, 1, 4096]
    - [114, 0.0]
  - - [448, 768, 1, 4096]
    - [116, 0.0]
  - - [512, 768, 1, 4096]
    - [108, 0.0]
  - - [576, 768, 1, 4096]
    - [135, 0.0]
  - - [640, 768, 1, 4096]
    - [48, 0.0]
  - - [704, 768, 1, 4096]
    - [113, 0.0]
  - - [768, 768, 1, 4096]
    - [53, 0.0]
  - - [832, 768, 1, 4096]
    - [108, 0.0]
  - - [896, 768, 1, 4096]
    - [159, 0.0]
  - - [960, 768, 1, 4096]
    - [46, 0.0]
  - - [1024, 768, 1, 4096]
    - [159, 0.0]
  - - [64, 832, 1, 4096]
    - [144, 0.0]
  - - [128, 832, 1, 4096]
    - [135, 0.0]
  - - [192, 832, 1, 4096]
    - [19, 0.0]
  - - [256, 832, 1, 4096]
    - [114, 0.0]
  - - [320, 832, 1, 4096]
    - [108, 0.0]
  - - [384, 832, 1, 4096]
    - [113, 0.0]
  - - [448, 832, 1, 4096]
    - [113, 0.0]
  - - [512, 832, 1, 4096]
    - [135, 0.0]
  - - [576, 832, 1, 4096]
    - [154, 0.0]
  - - [640, 832, 1, 4096]
    - [48, 0.0]
  - - [704, 832, 1, 4096]
    - [154, 0.0]
  - - [768, 832, 1, 4096]
    - [48, 0.0]
  - - [832, 832, 1, 4096]
    - [89, 0.0]
  - - [896, 832, 1, 4096]
    - [123, 0.0]
  - - [960, 832, 1, 4096]
    - [46, 0.0]
  - - [1024, 832, 1, 4096]
    - [153, 0.0]
  - - [64, 896, 1, 4096]
    - [150, 0.0]
  - - [128, 896, 1, 4096]
    - [111, 0.0]
  - - [192, 896, 1, 4096]
    - [19, 0.0]
  - - [256, 896, 1, 4096]
    - [19, 0.0]
  - - [320, 896, 1, 4096]
    - [19, 0.0]
  - - [384, 896, 1, 4096]
    - [112, 0.0]
  - - [448, 896, 1, 4096]
    - [143, 0.0]
  - - [512, 896, 1, 4096]
    - [143, 0.0]
  - - [576, 896, 1, 4096]
    - [48, 0.0]
  - - [640, 896, 1, 4096]
    - [48, 0.0]
  - - [704, 896, 1, 4096]
    - [48, 0.0]
  - - [768, 896, 1, 4096]
    - [154, 0.0]
  - - [832, 896, 1, 4096]
    - [49, 0.0]
  - - [896, 896, 1, 4096]
    - [123, 0.0]
  - - [960, 896, 1, 4096]
    - [49, 0.0]
  - - [1024, 896, 1, 4096]
    - [159, 0.0]
  - - [64, 960, 1, 4096]
    - [144, 0.0]
  - - [128, 960, 1, 4096]
    - [12, 0.0]
  - - [192, 960, 1, 4096]
    - [12, 0.0]
  - - [256, 960, 1, 4096]
    - [108, 0.0]
  - - [320, 960, 1, 4096]
    - [108, 0.0]
  - - [384, 960, 1, 4096]
    - [116, 0.0]
  - - [448, 960, 1, 4096]
    - [48, 0.0]
  - - [512, 960, 1, 4096]
    - [119, 0.0]
  - - [576, 960, 1, 4096]
    - [48, 0.0]
  - - [640, 960, 1, 4096]
    - [48, 0.0]
  - - [704, 960, 1, 4096]
    - [35, 0.0]
  - - [768, 960, 1, 4096]
    - [123, 0.0]
  - - [832, 960, 1, 4096]
    - [123, 0.0]
  - - [896, 960, 1, 4096]
    - [159, 0.0]
  - - [960, 960, 1, 4096]
    - [159, 0.0]
  - - [1024, 960, 1, 4096]
    - [160, 0.0]
  - - [64, 1024, 1, 4096]
    - [149, 0.0]
  - - [128, 1024, 1, 4096]
    - [111, 0.0]
  - - [192, 1024, 1, 4096]
    - [111, 0.0]
  - - [256, 1024, 1, 4096]
    - [108, 0.0]
  - - [320, 1024, 1, 4096]
    - [12, 0.0]
  - - [384, 1024, 1, 4096]
    - [113, 0.0]
  - - [448, 1024, 1, 4096]
    - [113, 0.0]
  - - [512, 1024, 1, 4096]
    - [135, 0.0]
  - - [576, 1024, 1, 4096]
    - [113, 0.0]
  - - [640, 1024, 1, 4096]
    - [135, 0.0]
  - - [704, 1024, 1, 4096]
    - [46, 0.0]
  - - [768, 1024, 1, 4096]
    - [123, 0.0]
  - - [832, 1024, 1, 4096]
    - [123, 0.0]
  - - [896, 1024, 1, 4096]
    - [159, 0.0]
  - - [960, 1024, 1, 4096]
    - [159, 0.0]
  - - [1024, 1024, 1, 4096]
    - [153, 0.0]
  - - [1088, 64, 1, 64]
    - [13, 0.0]
  - - [1216, 64, 1, 64]
    - [22, 0.0]
  - - [1344, 64, 1, 64]
    - [13, 0.0]
  - - [1472, 64, 1, 64]
    - [13, 0.0]
  - - [1600, 64, 1, 64]
    - [13, 0.0]
  - - [1728, 64, 1, 64]
    - [13, 0.0]
  - - [1856, 64, 1, 64]
    - [13, 0.0]
  - - [1984, 64, 1, 64]
    - [13, 0.0]
  - - [1088, 192, 1, 64]
    - [13, 0.0]
  - - [1216, 192, 1, 64]
    - [13, 0.0]
  - - [1344, 192, 1, 64]
    - [13, 0.0]
  - - [1472, 192, 1, 64]
    - [76, 0.0]
  - - [1600, 192, 1, 64]
    - [36, 0.0]
  - - [1728, 192, 1, 64]
    - [26, 0.0]
  - - [1856, 192, 1, 64]
    - [23, 0.0]
  - - [1984, 192, 1, 64]
    - [22, 0.0]
  - - [1088, 320, 1, 64]
    - [13, 0.0]
  - - [1216, 320, 1, 64]
    - [25, 0.0]
  - - [1344, 320, 1, 64]
    - [89, 0.0]
  - - [1472, 320, 1, 64]
    - [49, 0.0]
  - - [1600, 320, 1, 64]
    - [13, 0.0]
  - - [1728, 320, 1, 64]
    - [48, 0.0]
  - - [1856, 320, 1, 64]
    - [47, 0.0]
  - - [1984, 320, 1, 64]
    - [68, 0.0]
  - - [1088, 448, 1, 64]
    - [25, 0.0]
  - - [1216, 448, 1, 64]
    - [92, 0.0]
  - - [1344, 448, 1, 64]
    - [47, 0.0]
  - - [1472, 448, 1, 64]
    - [59, 0.0]
  - - [1600, 448, 1, 64]
    - [33, 0.0]
  - - [1728, 448, 1, 64]
    - [68, 0.0]
  - - [1856, 448, 1, 64]
    - [47, 0.0]
  - - [1984, 448, 1, 64]
    - [68, 0.0]
  - - [1088, 576, 1, 64]
    - [161, 0.0]
  - - [1216, 576, 1, 64]
    - [68, 0.0]
  - - [1344, 576, 1, 64]
    - [49, 0.0]
  - - [1472, 576, 1, 64]
    - [68, 0.0]
  - - [1600, 576, 1, 64]
    - [68, 0.0]
  - - [1728, 576, 1, 64]
    - [41, 0.0]
  - - [1856, 576, 1, 64]
    - [69, 0.0]
  - - [1984, 576, 1, 64]
    - [47, 0.0]
  - - [1088, 704, 1, 64]
    - [49, 0.0]
  - - [1216, 704, 1, 64]
    - [68, 0.0]
  - - [1344, 704, 1, 64]
    - [35, 0.0]
  - - [1472, 704, 1, 64]
    - [33, 0.0]
  - - [1600, 704, 1, 64]
    - [33, 0.0]
  - - [1728, 704, 1, 64]
    - [68, 0.0]
  - - [1856, 704, 1, 64]
    - [162, 0.0]
  - - [1984, 704, 1, 64]
    - [92, 0.0]
  - - [1088, 832, 1, 64]
    - [68, 0.0]
  - - [1216, 832, 1, 64]
    - [70, 0.0]
  - - [1344, 832, 1, 64]
    - [67, 0.0]
  - - [1472, 832, 1, 64]
    - [68, 0.0]
  - - [1600, 832, 1, 64]
    - [68, 0.0]
  - - [1728, 832, 1, 64]
    - [69, 0.0]
  - - [1856, 832, 1, 64]
    - [70, 0.0]
  - - [1984, 832, 1, 64]
    - [68, 0.0]
  - - [1088, 960, 1, 64]
    - [162, 0.0]
  - - [1216, 960, 1, 64]
    - [69, 0.0]
  - - [1344, 960, 1, 64]
    - [162, 0.0]
  - - [1472, 960, 1, 64]
    - [33, 0.0]
  - - [1600, 960, 1, 64]
    - [83, 0.0]
  - - [1728, 960, 1, 64]
    - [59, 0.0]
  - - [1856, 960, 1, 64]
    - [69, 0.0]
  - - [1984, 960, 1, 64]
    - [59, 0.0]
  - - [64, 1088, 1, 64]
    - [13, 0.0]
  - - [192, 1088, 1, 64]
    - [31, 0.0]
  - - [320, 1088, 1, 64]
    - [41, 0.0]
  - - [448, 1088, 1, 64]
    - [107, 0.0]
  - - [576, 1088, 1, 64]
    - [92, 0.0]
  - - [704, 1088, 1, 64]
    - [162, 0.0]
  - - [832, 1088, 1, 64]
    - [68, 0.0]
  - - [960, 1088, 1, 64]
    - [70, 0.0]
  - - [1088, 1088, 1, 64]
    - [69, 0.0]
  - - [1216, 1088, 1, 64]
    - [70, 0.0]
  - - [1344, 1088, 1, 64]
    - [68, 0.0]
  - - [1472, 1088, 1, 64]
    - [68, 0.0]
  - - [1600, 1088, 1, 64]
    - [69, 0.0]
  - - [1728, 1088, 1, 64]
    - [68, 0.0]
  - - [1856, 1088, 1, 64]
    - [69, 0.0]
  - - [1984, 1088, 1, 64]
    - [47, 0.0]
  - - [64, 1216, 1, 64]
    - [107, 0.0]
  - - [192, 1216, 1, 64]
    - [13, 0.0]
  - - [320, 1216, 1, 64]
    - [26, 0.0]
  - - [448, 1216, 1, 64]
    - [67, 0.0]
  - - [576, 1216, 1, 64]
    - [92, 0.0]
  - - [704, 1216, 1, 64]
    - [47, 0.0]
  - - [832, 1216, 1, 64]
    - [33, 0.0]
  - - [960, 1216, 1, 64]
    - [68, 0.0]
  - - [1088, 1216, 1, 64]
    - [68, 0.0]
  - - [1216, 1216, 1, 64]
    - [33, 0.0]
  - - [1344, 1216, 1, 64]
    - [68, 0.0]
  - - [1472, 1216, 1, 64]
    - [70, 0.0]
  - - [1600, 1216, 1, 64]
    - [69, 0.0]
  - - [1728, 1216, 1, 64]
    - [70, 0.0]
  - - [1856, 1216, 1, 64]
    - [70, 0.0]
  - - [1984, 1216, 1, 64]
    - [68, 0.0]
  - - [64, 1344, 1, 64]
    - [23, 0.0]
  - - [192, 1344, 1, 64]
    - [107, 0.0]
  - - [320, 1344, 1, 64]
    - [35, 0.0]
  - - [448, 1344, 1, 64]
    - [162, 0.0]
  - - [576, 1344, 1, 64]
    - [59, 0.0]
  - - [704, 1344, 1, 64]
    - [47, 0.0]
  - - [832, 1344, 1, 64]
    - [92, 0.0]
  - - [960, 1344, 1, 64]
    - [69, 0.0]
  - - [1088, 1344, 1, 64]
    - [47, 0.0]
  - - [1216, 1344, 1, 64]
    - [68, 0.0]
  - - [1344, 1344, 1, 64]
    - [83, 0.0]
  - - [1472, 1344, 1, 64]
    - [162, 0.0]
  - - [1600, 1344, 1, 64]
    - [162, 0.0]
  - - [1728, 1344, 1, 64]
    - [70, 0.0]
  - - [1856, 1344, 1, 64]
    - [70, 0.0]
  - - [1984, 1344, 1, 64]
    - [70, 0.0]
  - - [64, 1472, 1, 64]
    - [13, 0.0]
  - - [192, 1472, 1, 64]
    - [48, 0.0]
  - - [320, 1472, 1, 64]
    - [119, 0.0]
  - - [448, 1472, 1, 64]
    - [92, 0.0]
  - - [576, 1472, 1, 64]
    - [62, 0.0]
  - - [704, 1472, 1, 64]
    - [62, 0.0]
  - - [832, 1472, 1, 64]
    - [47, 0.0]
  - - [960, 1472, 1, 64]
    - [33, 0.0]
  - - [1088, 1472, 1, 64]
    - [68, 0.0]
  - - [1216, 1472, 1, 64]
    - [70, 0.0]
  - - [1344, 1472, 1, 64]
    - [83, 0.0]
  - - [1472, 1472, 1, 64]
    - [83, 0.0]
  - - [1600, 1472, 1, 64]
    - [92, 0.0]
  - - [1728, 1472, 1, 64]
    - [68, 0.0]
  - - [1856, 1472, 1, 64]
    - [70, 0.0]
  - - [1984, 1472, 1, 64]
    - [69, 0.0]
  - - [64, 1600, 1, 64]
    - [39, 0.0]
  - - [192, 1600, 1, 64]
    - [83, 0.0]
  - - [320, 1600, 1, 64]
    - [22, 0.0]
  - - [448, 1600, 1, 64]
    - [89, 0.0]
  - - [576, 1600, 1, 64]
    - [68, 0.0]
  - - [704, 1600, 1, 64]
    - [162, 0.0]
  - - [832, 1600, 1, 64]
    - [68, 0.0]
  - - [960, 1600, 1, 64]
    - [49, 0.0]
  - - [1088, 1600, 1, 64]
    - [47, 0.0]
  - - [1216, 1600, 1, 64]
    - [69, 0.0]
  - - [1344, 1600, 1, 64]
    - [69, 0.0]
  - - [1472, 1600, 1, 64]
    - [41, 0.0]
  - - [1600, 1600, 1, 64]
    - [70, 0.0]
  - - [1728, 1600, 1, 64]
    - [70, 0.0]
  - - [1856, 1600, 1, 64]
    - [162, 0.0]
  - - [1984, 1600, 1, 64]
    - [69, 0.0]
  - - [64, 1728, 1, 64]
    - [13, 0.0]
  - - [192, 1728, 1, 64]
    - [163, 0.0]
  - - [320, 1728, 1, 64]
    - [41, 0.0]
  - - [448, 1728, 1, 64]
    - [92, 0.0]
  - - [576, 1728, 1, 64]
    - [68, 0.0]
  - - [704, 1728, 1, 64]
    - [49, 0.0]
  - - [832, 1728, 1, 64]
    - [68, 0.0]
  - - [960, 1728, 1, 64]
    - [68, 0.0]
  - - [1088, 1728, 1, 64]
    - [69, 0.0]
  - - [1216, 1728, 1, 64]
    - [69, 0.0]
  - - [1344, 1728, 1, 64]
    - [70, 0.0]
  - - [1472, 1728, 1, 64]
    - [70, 0.0]
  - - [1600, 1728, 1, 64]
    - [69, 0.0]
  - - [1728, 1728, 1, 64]
    - [70, 0.0]
  - - [1856, 1728, 1, 64]
    - [70, 0.0]
  - - [1984, 1728, 1, 64]
    - [69, 0.0]
  - - [64, 1856, 1, 64]
    - [25, 0.0]
  - - [192, 1856, 1, 64]
    - [83, 0.0]
  - - [320, 1856, 1, 64]
    - [41, 0.0]
  - - [448, 1856, 1, 64]
    - [83, 0.0]
  - - [576, 1856, 1, 64]
    - [83, 0.0]
  - - [704, 1856, 1, 64]
    - [162, 0.0]
  - - [832, 1856, 1, 64]
    - [68, 0.0]
  - - [960, 1856, 1, 64]
    - [70, 0.0]
  - - [1088, 1856, 1, 64]
    - [69, 0.0]
  - - [1216, 1856, 1, 64]
    - [83, 0.0]
  - - [1344, 1856, 1, 64]
    - [41, 0.0]
  - - [1472, 1856, 1, 64]
    - [70, 0.0]
  - - [1600, 1856, 1, 64]
    - [70, 0.0]
  - - [1728, 1856, 1, 64]
    - [69, 0.0]
  - - [1856, 1856, 1, 64]
    - [70, 0.0]
  - - [1984, 1856, 1, 64]
    - [70, 0.0]
  - - [64, 1984, 1, 64]
    - [107, 0.0]
  - - [192, 1984, 1, 64]
    - [68, 0.0]
  - - [320, 1984, 1, 64]
    - [33, 0.0]
  - - [448, 1984, 1, 64]
    - [162, 0.0]
  - - [576, 1984, 1, 64]
    - [162, 0.0]
  - - [704, 1984, 1, 64]
    - [68, 0.0]
  - - [832, 1984, 1, 64]
    - [68, 0.0]
  - - [960, 1984, 1, 64]
    - [69, 0.0]
  - - [1088, 1984, 1, 64]
    - [41, 0.0]
  - - [1216, 1984, 1, 64]
    - [70, 0.0]
  - - [1344, 1984, 1, 64]
    - [41, 0.0]
  - - [1472, 1984, 1, 64]
    - [68, 0.0]
  - - [1600, 1984, 1, 64]
    - [69, 0.0]
  - - [1728, 1984, 1, 64]
    - [69, 0.0]
  - - [1856, 1984, 1, 64]
    - [70, 0.0]
  - - [1984, 1984, 1, 64]
    - [68, 0.0]
  - - [1088, 64, 1, 256]
    - [12, 0.0]
  - - [1216, 64, 1, 256]
    - [108, 0.0]
  - - [1344, 64, 1, 256]
    - [113, 0.0]
  - - [1472, 64, 1, 256]
    - [108, 0.0]
  - - [1600, 64, 1, 256]
    - [108, 0.0]
  - - [1728, 64, 1, 256]
    - [12, 0.0]
  - - [1856, 64, 1, 256]
    - [108, 0.0]
  - - [1984, 64, 1, 256]
    - [113, 0.0]
  - - [1088, 192, 1, 256]
    - [12, 0.0]
  - - [1216, 192, 1, 256]
    - [12, 0.0]
  - - [1344, 192, 1, 256]
    - [12, 0.0]
  - - [1472, 192, 1, 256]
    - [114, 0.0]
  - - [1600, 192, 1, 256]
    - [113, 0.0]
  - - [1728, 192, 1, 256]
    - [114, 0.0]
  - - [1856, 192, 1, 256]
    - [114, 0.0]
  - - [1984, 192, 1, 256]
    - [114, 0.0]
  - - [1088, 320, 1, 256]
    - [12, 0.0]
  - - [1216, 320, 1, 256]
    - [12, 0.0]
  - - [1344, 320, 1, 256]
    - [48, 0.0]
  - - [1472, 320, 1, 256]
    - [108, 0.0]
  - - [1600, 320, 1, 256]
    - [12, 0.0]
  - - [1728, 320, 1, 256]
    - [49, 0.0]
  - - [1856, 320, 1, 256]
    - [49, 0.0]
  - - [1984, 320, 1, 256]
    - [26, 0.0]
  - - [1088, 448, 1, 256]
    - [113, 0.0]
  - - [1216, 448, 1, 256]
    - [83, 0.0]
  - - [1344, 448, 1, 256]
    - [49, 0.0]
  - - [1472, 448, 1, 256]
    - [47, 0.0]
  - - [1600, 448, 1, 256]
    - [22, 0.0]
  - - [1728, 448, 1, 256]
    - [83, 0.0]
  - - [1856, 448, 1, 256]
    - [33, 0.0]
  - - [1984, 448, 1, 256]
    - [49, 0.0]
  - - [1088, 576, 1, 256]
    - [12, 0.0]
  - - [1216, 576, 1, 256]
    - [48, 0.0]
  - - [1344, 576, 1, 256]
    - [49, 0.0]
  - - [1472, 576, 1, 256]
    - [48, 0.0]
  - - [1600, 576, 1, 256]
    - [49, 0.0]
  - - [1728, 576, 1, 256]
    - [49, 0.0]
  - - [1856, 576, 1, 256]
    - [47, 0.0]
  - - [1984, 576, 1, 256]
    - [47, 0.0]
  - - [1088, 704, 1, 256]
    - [164, 0.0]
  - - [1216, 704, 1, 256]
    - [49, 0.0]
  - - [1344, 704, 1, 256]
    - [49, 0.0]
  - - [1472, 704, 1, 256]
    - [47, 0.0]
  - - [1600, 704, 1, 256]
    - [47, 0.0]
  - - [1728, 704, 1, 256]
    - [49, 0.0]
  - - [1856, 704, 1, 256]
    - [35, 0.0]
  - - [1984, 704, 1, 256]
    - [49, 0.0]
  - - [1088, 832, 1, 256]
    - [49, 0.0]
  - - [1216, 832, 1, 256]
    - [35, 0.0]
  - - [1344, 832, 1, 256]
    - [48, 0.0]
  - - [1472, 832, 1, 256]
    - [47, 0.0]
  - - [1600, 832, 1, 256]
    - [47, 0.0]
  - - [1728, 832, 1, 256]
    - [47, 0.0]
  - - [1856, 832, 1, 256]
    - [68, 0.0]
  - - [1984, 832, 1, 256]
    - [49, 0.0]
  - - [1088, 960, 1, 256]
    - [22, 0.0]
  - - [1216, 960, 1, 256]
    - [165, 0.0]
  - - [1344, 960, 1, 256]
    - [83, 0.0]
  - - [1472, 960, 1, 256]
    - [47, 0.0]
  - - [1600, 960, 1, 256]
    - [83, 0.0]
  - - [1728, 960, 1, 256]
    - [35, 0.0]
  - - [1856, 960, 1, 256]
    - [47, 0.0]
  - - [1984, 960, 1, 256]
    - [83, 0.0]
  - - [64, 1088, 1, 256]
    - [113, 0.0]
  - - [192, 1088, 1, 256]
    - [19, 0.0]
  - - [320, 1088, 1, 256]
    - [108, 0.0]
  - - [448, 1088, 1, 256]
    - [12, 0.0]
  - - [576, 1088, 1, 256]
    - [12, 0.0]
  - - [704, 1088, 1, 256]
    - [47, 0.0]
  - - [832, 1088, 1, 256]
    - [49, 0.0]
  - - [960, 1088, 1, 256]
    - [49, 0.0]
  - - [1088, 1088, 1, 256]
    - [49, 0.0]
  - - [1216, 1088, 1, 256]
    - [83, 0.0]
  - - [1344, 1088, 1, 256]
    - [49, 0.0]
  - - [1472, 1088, 1, 256]
    - [47, 0.0]
  - - [1600, 1088, 1, 256]
    - [49, 0.0]
  - - [1728, 1088, 1, 256]
    - [83, 0.0]
  - - [1856, 1088, 1, 256]
    - [41, 0.0]
  - - [1984, 1088, 1, 256]
    - [49, 0.0]
  - - [64, 1216, 1, 256]
    - [113, 0.0]
  - - [192, 1216, 1, 256]
    - [107, 0.0]
  - - [320, 1216, 1, 256]
    - [108, 0.0]
  - - [448, 1216, 1, 256]
    - [47, 0.0]
  - - [576, 1216, 1, 256]
    - [49, 0.0]
  - - [704, 1216, 1, 256]
    - [83, 0.0]
  - - [832, 1216, 1, 256]
    - [49, 0.0]
  - - [960, 1216, 1, 256]
    - [48, 0.0]
  - - [1088, 1216, 1, 256]
    - [83, 0.0]
  - - [1216, 1216, 1, 256]
    - [47, 0.0]
  - - [1344, 1216, 1, 256]
    - [47, 0.0]
  - - [1472, 1216, 1, 256]
    - [83, 0.0]
  - - [1600, 1216, 1, 256]
    - [83, 0.0]
  - - [1728, 1216, 1, 256]
    - [49, 0.0]
  - - [1856, 1216, 1, 256]
    - [49, 0.0]
  - - [1984, 1216, 1, 256]
    - [83, 0.0]
  - - [64, 1344, 1, 256]
    - [114, 0.0]
  - - [192, 1344, 1, 256]
    - [12, 0.0]
  - - [320, 1344, 1, 256]
    - [48, 0.0]
  - - [448, 1344, 1, 256]
    - [83, 0.0]
  - - [576, 1344, 1, 256]
    - [12, 0.0]
  - - [704, 1344, 1, 256]
    - [49, 0.0]
  - - [832, 1344, 1, 256]
    - [48, 0.0]
  - - [960, 1344, 1, 256]
    - [47, 0.0]
  - - [1088, 1344, 1, 256]
    - [49, 0.0]
  - - [1216, 1344, 1, 256]
    - [68, 0.0]
  - - [1344, 1344, 1, 256]
    - [49, 0.0]
  - - [1472, 1344, 1, 256]
    - [49, 0.0]
  - - [1600, 1344, 1, 256]
    - [49, 0.0]
  - - [1728, 1344, 1, 256]
    - [49, 0.0]
  - - [1856, 1344, 1, 256]
    - [83, 0.0]
  - - [1984, 1344, 1, 256]
    - [49, 0.0]
  - - [64, 1472, 1, 256]
    - [19, 0.0]
  - - [192, 1472, 1, 256]
    - [19, 0.0]
  - - [320, 1472, 1, 256]
    - [48, 0.0]
  - - [448, 1472, 1, 256]
    - [48, 0.0]
  - - [576, 1472, 1, 256]
    - [49, 0.0]
  - - [704, 1472, 1, 256]
    - [41, 0.0]
  - - [832, 1472, 1, 256]
    - [49, 0.0]
  - - [960, 1472, 1, 256]
    - [49, 0.0]
  - - [1088, 1472, 1, 256]
    - [47, 0.0]
  - - [1216, 1472, 1, 256]
    - [47, 0.0]
  - - [1344, 1472, 1, 256]
    - [83, 0.0]
  - - [1472, 1472, 1, 256]
    - [49, 0.0]
  - - [1600, 1472, 1, 256]
    - [49, 0.0]
  - - [1728, 1472, 1, 256]
    - [41, 0.0]
  - - [1856, 1472, 1, 256]
    - [49, 0.0]
  - - [1984, 1472, 1, 256]
    - [49, 0.0]
  - - [64, 1600, 1, 256]
    - [113, 0.0]
  - - [192, 1600, 1, 256]
    - [113, 0.0]
  - - [320, 1600, 1, 256]
    - [135, 0.0]
  - - [448, 1600, 1, 256]
    - [48, 0.0]
  - - [576, 1600, 1, 256]
    - [49, 0.0]
  - - [704, 1600, 1, 256]
    - [49, 0.0]
  - - [832, 1600, 1, 256]
    - [47, 0.0]
  - - [960, 1600, 1, 256]
    - [49, 0.0]
  - - [1088, 1600, 1, 256]
    - [49, 0.0]
  - - [1216, 1600, 1, 256]
    - [49, 0.0]
  - - [1344, 1600, 1, 256]
    - [89, 0.0]
  - - [1472, 1600, 1, 256]
    - [49, 0.0]
  - - [1600, 1600, 1, 256]
    - [49, 0.0]
  - - [1728, 1600, 1, 256]
    - [47, 0.0]
  - - [1856, 1600, 1, 256]
    - [49, 0.0]
  - - [1984, 1600, 1, 256]
    - [47, 0.0]
  - - [64, 1728, 1, 256]
    - [108, 0.0]
  - - [192, 1728, 1, 256]
    - [26, 0.0]
  - - [320, 1728, 1, 256]
    - [83, 0.0]
  - - [448, 1728, 1, 256]
    - [107, 0.0]
  - - [576, 1728, 1, 256]
    - [49, 0.0]
  - - [704, 1728, 1, 256]
    - [48, 0.0]
  - - [832, 1728, 1, 256]
    - [49, 0.0]
  - - [960, 1728, 1, 256]
    - [49, 0.0]
  - - [1088, 1728, 1, 256]
    - [49, 0.0]
  - - [1216, 1728, 1, 256]
    - [49, 0.0]
  - - [1344, 1728, 1, 256]
    - [47, 0.0]
  - - [1472, 1728, 1, 256]
    - [35, 0.0]
  - - [1600, 1728, 1, 256]
    - [47, 0.0]
  - - [1728, 1728, 1, 256]
    - [49, 0.0]
  - - [1856, 1728, 1, 256]
    - [49, 0.0]
  - - [1984, 1728, 1, 256]
    - [49, 0.0]
  - - [64, 1856, 1, 256]
    - [108, 0.0]
  - - [192, 1856, 1, 256]
    - [19, 0.0]
  - - [320, 1856, 1, 256]
    - [83, 0.0]
  - - [448, 1856, 1, 256]
    - [47, 0.0]
  - - [576, 1856, 1, 256]
    - [41, 0.0]
  - - [704, 1856, 1, 256]
    - [47, 0.0]
  - - [832, 1856, 1, 256]
    - [49, 0.0]
  - - [960, 1856, 1, 256]
    - [49, 0.0]
  - - [1088, 1856, 1, 256]
    - [49, 0.0]
  - - [1216, 1856, 1, 256]
    - [49, 0.0]
  - - [1344, 1856, 1, 256]
    - [49, 0.0]
  - - [1472, 1856, 1, 256]
    - [49, 0.0]
  - - [1600, 1856, 1, 256]
    - [49, 0.0]
  - - [1728, 1856, 1, 256]
    - [49, 0.0]
  - - [1856, 1856, 1, 256]
    - [49, 0.0]
  - - [1984, 1856, 1, 256]
    - [49, 0.0]
  - - [64, 1984, 1, 256]
    - [108, 0.0]
  - - [192, 1984, 1, 256]
    - [12, 0.0]
  - - [320, 1984, 1, 256]
    - [83, 0.0]
  - - [448, 1984, 1, 256]
    - [49, 0.0]
  - - [576, 1984, 1, 256]
    - [35, 0.0]
  - - [704, 1984, 1, 256]
    - [35, 0.0]
  - - [832, 1984, 1, 256]
    - [49, 0.0]
  - - [960, 1984, 1, 256]
    - [49, 0.0]
  - - [1088, 1984, 1, 256]
    - [49, 0.0]
  - - [1216, 1984, 1, 256]
    - [83, 0.0]
  - - [1344, 1984, 1, 256]
    - [35, 0.0]
  - - [1472, 1984, 1, 256]
    - [47, 0.0]
  - - [1600, 1984, 1, 256]
    - [83, 0.0]
  - - [1728, 1984, 1, 256]
    - [49, 0.0]
  - - [1856, 1984, 1, 256]
    - [49, 0.0]
  - - [1984, 1984, 1, 256]
    - [35, 0.0]
  - - [1088, 64, 1, 512]
    - [166, 0.0]
  - - [1216, 64, 1, 512]
    - [120, 0.0]
  - - [1344, 64, 1, 512]
    - [95, 0.0]
  - - [1472, 64, 1, 512]
    - [102, 0.0]
  - - [1600, 64, 1, 512]
    - [113, 0.0]
  - - [1728, 64, 1, 512]
    - [108, 0.0]
  - - [1856, 64, 1, 512]
    - [113, 0.0]
  - - [1984, 64, 1, 512]
    - [108, 0.0]
  - - [1088, 192, 1, 512]
    - [12, 0.0]
  - - [1216, 192, 1, 512]
    - [113, 0.0]
  - - [1344, 192, 1, 512]
    - [12, 0.0]
  - - [1472, 192, 1, 512]
    - [114, 0.0]
  - - [1600, 192, 1, 512]
    - [12, 0.0]
  - - [1728, 192, 1, 512]
    - [108, 0.0]
  - - [1856, 192, 1, 512]
    - [113, 0.0]
  - - [1984, 192, 1, 512]
    - [108, 0.0]
  - - [1088, 320, 1, 512]
    - [113, 0.0]
  - - [1216, 320, 1, 512]
    - [108, 0.0]
  - - [1344, 320, 1, 512]
    - [49, 0.0]
  - - [1472, 320, 1, 512]
    - [135, 0.0]
  - - [1600, 320, 1, 512]
    - [113, 0.0]
  - - [1728, 320, 1, 512]
    - [108, 0.0]
  - - [1856, 320, 1, 512]
    - [26, 0.0]
  - - [1984, 320, 1, 512]
    - [116, 0.0]
  - - [1088, 448, 1, 512]
    - [108, 0.0]
  - - [1216, 448, 1, 512]
    - [41, 0.0]
  - - [1344, 448, 1, 512]
    - [33, 0.0]
  - - [1472, 448, 1, 512]
    - [49, 0.0]
  - - [1600, 448, 1, 512]
    - [33, 0.0]
  - - [1728, 448, 1, 512]
    - [12, 0.0]
  - - [1856, 448, 1, 512]
    - [48, 0.0]
  - - [1984, 448, 1, 512]
    - [47, 0.0]
  - - [1088, 576, 1, 512]
    - [108, 0.0]
  - - [1216, 576, 1, 512]
    - [48, 0.0]
  - - [1344, 576, 1, 512]
    - [107, 0.0]
  - - [1472, 576, 1, 512]
    - [114, 0.0]
  - - [1600, 576, 1, 512]
    - [89, 0.0]
  - - [1728, 576, 1, 512]
    - [107, 0.0]
  - - [1856, 576, 1, 512]
    - [48, 0.0]
  - - [1984, 576, 1, 512]
    - [48, 0.0]
  - - [1088, 704, 1, 512]
    - [107, 0.0]
  - - [1216, 704, 1, 512]
    - [48, 0.0]
  - - [1344, 704, 1, 512]
    - [48, 0.0]
  - - [1472, 704, 1, 512]
    - [107, 0.0]
  - - [1600, 704, 1, 512]
    - [49, 0.0]
  - - [1728, 704, 1, 512]
    - [46, 0.0]
  - - [1856, 704, 1, 512]
    - [12, 0.0]
  - - [1984, 704, 1, 512]
    - [49, 0.0]
  - - [1088, 832, 1, 512]
    - [48, 0.0]
  - - [1216, 832, 1, 512]
    - [107, 0.0]
  - - [1344, 832, 1, 512]
    - [48, 0.0]
  - - [1472, 832, 1, 512]
    - [107, 0.0]
  - - [1600, 832, 1, 512]
    - [48, 0.0]
  - - [1728, 832, 1, 512]
    - [49, 0.0]
  - - [1856, 832, 1, 512]
    - [48, 0.0]
  - - [1984, 832, 1, 512]
    - [49, 0.0]
  - - [1088, 960, 1, 512]
    - [107, 0.0]
  - - [1216, 960, 1, 512]
    - [49, 0.0]
  - - [1344, 960, 1, 512]
    - [12, 0.0]
  - - [1472, 960, 1, 512]
    - [12, 0.0]
  - - [1600, 960, 1, 512]
    - [48, 0.0]
  - - [1728, 960, 1, 512]
    - [49, 0.0]
  - - [1856, 960, 1, 512]
    - [12, 0.0]
  - - [1984, 960, 1, 512]
    - [48, 0.0]
  - - [64, 1088, 1, 512]
    - [108, 0.0]
  - - [192, 1088, 1, 512]
    - [19, 0.0]
  - - [320, 1088, 1, 512]
    - [116, 0.0]
  - - [448, 1088, 1, 512]
    - [113, 0.0]
  - - [576, 1088, 1, 512]
    - [26, 0.0]
  - - [704, 1088, 1, 512]
    - [12, 0.0]
  - - [832, 1088, 1, 512]
    - [89, 0.0]
  - - [960, 1088, 1, 512]
    - [26, 0.0]
  - - [1088, 1088, 1, 512]
    - [47, 0.0]
  - - [1216, 1088, 1, 512]
    - [47, 0.0]
  - - [1344, 1088, 1, 512]
    - [49, 0.0]
  - - [1472, 1088, 1, 512]
    - [12, 0.0]
  - - [1600, 1088, 1, 512]
    - [49, 0.0]
  - - [1728, 1088, 1, 512]
    - [49, 0.0]
  - - [1856, 1088, 1, 512]
    - [49, 0.0]
  - - [1984, 1088, 1, 512]
    - [49, 0.0]
  - - [64, 1216, 1, 512]
    - [111, 0.0]
  - - [192, 1216, 1, 512]
    - [12, 0.0]
  - - [320, 1216, 1, 512]
    - [108, 0.0]
  - - [448, 1216, 1, 512]
    - [83, 0.0]
  - - [576, 1216, 1, 512]
    - [49, 0.0]
  - - [704, 1216, 1, 512]
    - [48, 0.0]
  - - [832, 1216, 1, 512]
    - [107, 0.0]
  - - [960, 1216, 1, 512]
    - [49, 0.0]
  - - [1088, 1216, 1, 512]
    - [12, 0.0]
  - - [1216, 1216, 1, 512]
    - [48, 0.0]
  - - [1344, 1216, 1, 512]
    - [48, 0.0]
  - - [1472, 1216, 1, 512]
    - [12, 0.0]
  - - [1600, 1216, 1, 512]
    - [48, 0.0]
  - - [1728, 1216, 1, 512]
    - [49, 0.0]
  - - [1856, 1216, 1, 512]
    - [49, 0.0]
  - - [1984, 1216, 1, 512]
    - [49, 0.0]
  - - [64, 1344, 1, 512]
    - [108, 0.0]
  - - [192, 1344, 1, 512]
    - [12, 0.0]
  - - [320, 1344, 1, 512]
    - [48, 0.0]
  - - [448, 1344, 1, 512]
    - [108, 0.0]
  - - [576, 1344, 1, 512]
    - [107, 0.0]
  - - [704, 1344, 1, 512]
    - [49, 0.0]
  - - [832, 1344, 1, 512]
    - [114, 0.0]
  - - [960, 1344, 1, 512]
    - [49, 0.0]
  - - [1088, 1344, 1, 512]
    - [48, 0.0]
  - - [1216, 1344, 1, 512]
    - [48, 0.0]
  - - [1344, 1344, 1, 512]
    - [12, 0.0]
  - - [1472, 1344, 1, 512]
    - [89, 0.0]
  - - [1600, 1344, 1, 512]
    - [89, 0.0]
  - - [1728, 1344, 1, 512]
    - [48, 0.0]
  - - [1856, 1344, 1, 512]
    - [89, 0.0]
  - - [1984, 1344, 1, 512]
    - [49, 0.0]
  - - [64, 1472, 1, 512]
    - [112, 0.0]
  - - [192, 1472, 1, 512]
    - [12, 0.0]
  - - [320, 1472, 1, 512]
    - [48, 0.0]
  - - [448, 1472, 1, 512]
    - [49, 0.0]
  - - [576, 1472, 1, 512]
    - [107, 0.0]
  - - [704, 1472, 1, 512]
    - [26, 0.0]
  - - [832, 1472, 1, 512]
    - [89, 0.0]
  - - [960, 1472, 1, 512]
    - [47, 0.0]
  - - [1088, 1472, 1, 512]
    - [49, 0.0]
  - - [1216, 1472, 1, 512]
    - [107, 0.0]
  - - [1344, 1472, 1, 512]
    - [89, 0.0]
  - - [1472, 1472, 1, 512]
    - [49, 0.0]
  - - [1600, 1472, 1, 512]
    - [49, 0.0]
  - - [1728, 1472, 1, 512]
    - [49, 0.0]
  - - [1856, 1472, 1, 512]
    - [49, 0.0]
  - - [1984, 1472, 1, 512]
    - [49, 0.0]
  - - [64, 1600, 1, 512]
    - [108, 0.0]
  - - [192, 1600, 1, 512]
    - [12, 0.0]
  - - [320, 1600, 1, 512]
    - [108, 0.0]
  - - [448, 1600, 1, 512]
    - [89, 0.0]
  - - [576, 1600, 1, 512]
    - [48, 0.0]
  - - [704, 1600, 1, 512]
    - [48, 0.0]
  - - [832, 1600, 1, 512]
    - [107, 0.0]
  - - [960, 1600, 1, 512]
    - [107, 0.0]
  - - [1088, 1600, 1, 512]
    - [49, 0.0]
  - - [1216, 1600, 1, 512]
    - [49, 0.0]
  - - [1344, 1600, 1, 512]
    - [49, 0.0]
  - - [1472, 1600, 1, 512]
    - [49, 0.0]
  - - [1600, 1600, 1, 512]
    - [12, 0.0]
  - - [1728, 1600, 1, 512]
    - [49, 0.0]
  - - [1856, 1600, 1, 512]
    - [48, 0.0]
  - - [1984, 1600, 1, 512]
    - [48, 0.0]
  - - [64, 1728, 1, 512]
    - [12, 0.0]
  - - [192, 1728, 1, 512]
    - [108, 0.0]
  - - [320, 1728, 1, 512]
    - [108, 0.0]
  - - [448, 1728, 1, 512]
    - [12, 0.0]
  - - [576, 1728, 1, 512]
    - [47, 0.0]
  - - [704, 1728, 1, 512]
    - [47, 0.0]
  - - [832, 1728, 1, 512]
    - [107, 0.0]
  - - [960, 1728, 1, 512]
    - [48, 0.0]
  - - [1088, 1728, 1, 512]
    - [48, 0.0]
  - - [1216, 1728, 1, 512]
    - [49, 0.0]
  - - [1344, 1728, 1, 512]
    - [48, 0.0]
  - - [1472, 1728, 1, 512]
    - [12, 0.0]
  - - [1600, 1728, 1, 512]
    - [48, 0.0]
  - - [1728, 1728, 1, 512]
    - [48, 0.0]
  - - [1856, 1728, 1, 512]
    - [48, 0.0]
  - - [1984, 1728, 1, 512]
    - [48, 0.0]
  - - [64, 1856, 1, 512]
    - [26, 0.0]
  - - [192, 1856, 1, 512]
    - [116, 0.0]
  - - [320, 1856, 1, 512]
    - [49, 0.0]
  - - [448, 1856, 1, 512]
    - [48, 0.0]
  - - [576, 1856, 1, 512]
    - [114, 0.0]
  - - [704, 1856, 1, 512]
    - [49, 0.0]
  - - [832, 1856, 1, 512]
    - [49, 0.0]
  - - [960, 1856, 1, 512]
    - [49, 0.0]
  - - [1088, 1856, 1, 512]
    - [49, 0.0]
  - - [1216, 1856, 1, 512]
    - [48, 0.0]
  - - [1344, 1856, 1, 512]
    - [48, 0.0]
  - - [1472, 1856, 1, 512]
    - [48, 0.0]
  - - [1600, 1856, 1, 512]
    - [49, 0.0]
  - - [1728, 1856, 1, 512]
    - [49, 0.0]
  - - [1856, 1856, 1, 512]
    - [48, 0.0]
  - - [1984, 1856, 1, 512]
    - [49, 0.0]
  - - [64, 1984, 1, 512]
    - [112, 0.0]
  - - [192, 1984, 1, 512]
    - [116, 0.0]
  - - [320, 1984, 1, 512]
    - [135, 0.0]
  - - [448, 1984, 1, 512]
    - [107, 0.0]
  - - [576, 1984, 1, 512]
    - [48, 0.0]
  - - [704, 1984, 1, 512]
    - [35, 0.0]
  - - [832, 1984, 1, 512]
    - [49, 0.0]
  - - [960, 1984, 1, 512]
    - [49, 0.0]
  - - [1088, 1984, 1, 512]
    - [49, 0.0]
  - - [1216, 1984, 1, 512]
    - [107, 0.0]
  - - [1344, 1984, 1, 512]
    - [49, 0.0]
  - - [1472, 1984, 1, 512]
    - [107, 0.0]
  - - [1600, 1984, 1, 512]
    - [46, 0.0]
  - - [1728, 1984, 1, 512]
    - [118, 0.0]
  - - [1856, 1984, 1, 512]
    - [118, 0.0]
  - - [1984, 1984, 1, 512]
    - [121, 0.0]
  - - [1088, 64, 1, 1024]
    - [95, 0.0]
  - - [1216, 64, 1, 1024]
    - [95, 0.0]
  - - [1344, 64, 1, 1024]
    - [95, 0.0]
  - - [1472, 64, 1, 1024]
    - [95, 0.0]
  - - [1600, 64, 1, 1024]
    - [125, 0.0]
  - - [1728, 64, 1, 1024]
    - [95, 0.0]
  - - [1856, 64, 1, 1024]
    - [99, 0.0]
  - - [1984, 64, 1, 1024]
    - [95, 0.0]
  - - [1088, 192, 1, 1024]
    - [12, 0.0]
  - - [1216, 192, 1, 1024]
    - [12, 0.0]
  - - [1344, 192, 1, 1024]
    - [12, 0.0]
  - - [1472, 192, 1, 1024]
    - [108, 0.0]
  - - [1600, 192, 1, 1024]
    - [135, 0.0]
  - - [1728, 192, 1, 1024]
    - [135, 0.0]
  - - [1856, 192, 1, 1024]
    - [108, 0.0]
  - - [1984, 192, 1, 1024]
    - [116, 0.0]
  - - [1088, 320, 1, 1024]
    - [113, 0.0]
  - - [1216, 320, 1, 1024]
    - [167, 0.0]
  - - [1344, 320, 1, 1024]
    - [48, 0.0]
  - - [1472, 320, 1, 1024]
    - [108, 0.0]
  - - [1600, 320, 1, 1024]
    - [108, 0.0]
  - - [1728, 320, 1, 1024]
    - [116, 0.0]
  - - [1856, 320, 1, 1024]
    - [113, 0.0]
  - - [1984, 320, 1, 1024]
    - [48, 0.0]
  - - [1088, 448, 1, 1024]
    - [116, 0.0]
  - - [1216, 448, 1, 1024]
    - [83, 0.0]
  - - [1344, 448, 1, 1024]
    - [113, 0.0]
  - - [1472, 448, 1, 1024]
    - [49, 0.0]
  - - [1600, 448, 1, 1024]
    - [48, 0.0]
  - - [1728, 448, 1, 1024]
    - [48, 0.0]
  - - [1856, 448, 1, 1024]
    - [89, 0.0]
  - - [1984, 448, 1, 1024]
    - [48, 0.0]
  - - [1088, 576, 1, 1024]
    - [49, 0.0]
  - - [1216, 576, 1, 1024]
    - [47, 0.0]
  - - [1344, 576, 1, 1024]
    - [89, 0.0]
  - - [1472, 576, 1, 1024]
    - [48, 0.0]
  - - [1600, 576, 1, 1024]
    - [48, 0.0]
  - - [1728, 576, 1, 1024]
    - [113, 0.0]
  - - [1856, 576, 1, 1024]
    - [48, 0.0]
  - - [1984, 576, 1, 1024]
    - [48, 0.0]
  - - [1088, 704, 1, 1024]
    - [48, 0.0]
  - - [1216, 704, 1, 1024]
    - [89, 0.0]
  - - [1344, 704, 1, 1024]
    - [48, 0.0]
  - - [1472, 704, 1, 1024]
    - [113, 0.0]
  - - [1600, 704, 1, 1024]
    - [67, 0.0]
  - - [1728, 704, 1, 1024]
    - [46, 0.0]
  - - [1856, 704, 1, 1024]
    - [113, 0.0]
  - - [1984, 704, 1, 1024]
    - [160, 0.0]
  - - [1088, 832, 1, 1024]
    - [48, 0.0]
  - - [1216, 832, 1, 1024]
    - [113, 0.0]
  - - [1344, 832, 1, 1024]
    - [48, 0.0]
  - - [1472, 832, 1, 1024]
    - [46, 0.0]
  - - [1600, 832, 1, 1024]
    - [48, 0.0]
  - - [1728, 832, 1, 1024]
    - [48, 0.0]
  - - [1856, 832, 1, 1024]
    - [48, 0.0]
  - - [1984, 832, 1, 1024]
    - [113, 0.0]
  - - [1088, 960, 1, 1024]
    - [113, 0.0]
  - - [1216, 960, 1, 1024]
    - [67, 0.0]
  - - [1344, 960, 1, 1024]
    - [135, 0.0]
  - - [1472, 960, 1, 1024]
    - [122, 0.0]
  - - [1600, 960, 1, 1024]
    - [113, 0.0]
  - - [1728, 960, 1, 1024]
    - [48, 0.0]
  - - [1856, 960, 1, 1024]
    - [168, 0.0]
  - - [1984, 960, 1, 1024]
    - [122, 0.0]
  - - [64, 1088, 1, 1024]
    - [142, 0.0]
  - - [192, 1088, 1, 1024]
    - [12, 0.0]
  - - [320, 1088, 1, 1024]
    - [22, 0.0]
  - - [448, 1088, 1, 1024]
    - [108, 0.0]
  - - [576, 1088, 1, 1024]
    - [89, 0.0]
  - - [704, 1088, 1, 1024]
    - [47, 0.0]
  - - [832, 1088, 1, 1024]
    - [116, 0.0]
  - - [960, 1088, 1, 1024]
    - [48, 0.0]
  - - [1088, 1088, 1, 1024]
    - [89, 0.0]
  - - [1216, 1088, 1, 1024]
    - [169, 0.0]
  - - [1344, 1088, 1, 1024]
    - [48, 0.0]
  - - [1472, 1088, 1, 1024]
    - [48, 0.0]
  - - [1600, 1088, 1, 1024]
    - [48, 0.0]
  - - [1728, 1088, 1, 1024]
    - [48, 0.0]
  - - [1856, 1088, 1, 1024]
    - [93, 0.0]
  - - [1984, 1088, 1, 1024]
    - [93, 0.0]
  - - [64, 1216, 1, 1024]
    - [134, 0.0]
  - - [192, 1216, 1, 1024]
    - [114, 0.0]
  - - [320, 1216, 1, 1024]
    - [108, 0.0]
  - - [448, 1216, 1, 1024]
    - [41, 0.0]
  - - [576, 1216, 1, 1024]
    - [49, 0.0]
  - - [704, 1216, 1, 1024]
    - [47, 0.0]
  - - [832, 1216, 1, 1024]
    - [108, 0.0]
  - - [960, 1216, 1, 1024]
    - [89, 0.0]
  - - [1088, 1216, 1, 1024]
    - [49, 0.0]
  - - [1216, 1216, 1, 1024]
    - [49, 0.0]
  - - [1344, 1216, 1, 1024]
    - [48, 0.0]
  - - [1472, 1216, 1, 1024]
    - [93, 0.0]
  - - [1600, 1216, 1, 1024]
    - [48, 0.0]
  - - [1728, 1216, 1, 1024]
    - [48, 0.0]
  - - [1856, 1216, 1, 1024]
    - [160, 0.0]
  - - [1984, 1216, 1, 1024]
    - [123, 0.0]
  - - [64, 1344, 1, 1024]
    - [142, 0.0]
  - - [192, 1344, 1, 1024]
    - [108, 0.0]
  - - [320, 1344, 1, 1024]
    - [48, 0.0]
  - - [448, 1344, 1, 1024]
    - [49, 0.0]
  - - [576, 1344, 1, 1024]
    - [47, 0.0]
  - - [704, 1344, 1, 1024]
    - [48, 0.0]
  - - [832, 1344, 1, 1024]
    - [89, 0.0]
  - - [960, 1344, 1, 1024]
    - [113, 0.0]
  - - [1088, 1344, 1, 1024]
    - [49, 0.0]
  - - [1216, 1344, 1, 1024]
    - [48, 0.0]
  - - [1344, 1344, 1, 1024]
    - [48, 0.0]
  - - [1472, 1344, 1, 1024]
    - [89, 0.0]
  - - [1600, 1344, 1, 1024]
    - [48, 0.0]
  - - [1728, 1344, 1, 1024]
    - [48, 0.0]
  - - [1856, 1344, 1, 1024]
    - [153, 0.0]
  - - [1984, 1344, 1, 1024]
    - [48, 0.0]
  - - [64, 1472, 1, 1024]
    - [144, 0.0]
  - - [192, 1472, 1, 1024]
    - [26, 0.0]
  - - [320, 1472, 1, 1024]
    - [89, 0.0]
  - - [448, 1472, 1, 1024]
    - [49, 0.0]
  - - [576, 1472, 1, 1024]
    - [48, 0.0]
  - - [704, 1472, 1, 1024]
    - [113, 0.0]
  - - [832, 1472, 1, 1024]
    - [49, 0.0]
  - - [960, 1472, 1, 1024]
    - [49, 0.0]
  - - [1088, 1472, 1, 1024]
    - [48, 0.0]
  - - [1216, 1472, 1, 1024]
    - [48, 0.0]
  - - [1344, 1472, 1, 1024]
    - [48, 0.0]
  - - [1472, 1472, 1, 1024]
    - [48, 0.0]
  - - [1600, 1472, 1, 1024]
    - [160, 0.0]
  - - [1728, 1472, 1, 1024]
    - [48, 0.0]
  - - [1856, 1472, 1, 1024]
    - [48, 0.0]
  - - [1984, 1472, 1, 1024]
    - [48, 0.0]
  - - [64, 1600, 1, 1024]
    - [12, 0.0]
  - - [192, 1600, 1, 1024]
    - [108, 0.0]
  - - [320, 1600, 1, 1024]
    - [113, 0.0]
  - - [448, 1600, 1, 1024]
    - [89, 0.0]
  - - [576, 1600, 1, 1024]
    - [48, 0.0]
  - - [704, 1600, 1, 1024]
    - [108, 0.0]
  - - [832, 1600, 1, 1024]
    - [48, 0.0]
  - - [960, 1600, 1, 1024]
    - [113, 0.0]
  - - [1088, 1600, 1, 1024]
    - [48, 0.0]
  - - [1216, 1600, 1, 1024]
    - [48, 0.0]
  - - [1344, 1600, 1, 1024]
    - [46, 0.0]
  - - [1472, 1600, 1, 1024]
    - [168, 0.0]
  - - [1600, 1600, 1, 1024]
    - [123, 0.0]
  - - [1728, 1600, 1, 1024]
    - [48, 0.0]
  - - [1856, 1600, 1, 1024]
    - [48, 0.0]
  - - [1984, 1600, 1, 1024]
    - [48, 0.0]
  - - [64, 1728, 1, 1024]
    - [135, 0.0]
  - - [192, 1728, 1, 1024]
    - [108, 0.0]
  - - [320, 1728, 1, 1024]
    - [35, 0.0]
  - - [448, 1728, 1, 1024]
    - [89, 0.0]
  - - [576, 1728, 1, 1024]
    - [49, 0.0]
  - - [704, 1728, 1, 1024]
    - [47, 0.0]
  - - [832, 1728, 1, 1024]
    - [49, 0.0]
  - - [960, 1728, 1, 1024]
    - [48, 0.0]
  - - [1088, 1728, 1, 1024]
    - [48, 0.0]
  - - [1216, 1728, 1, 1024]
    - [48, 0.0]
  - - [1344, 1728, 1, 1024]
    - [48, 0.0]
  - - [1472, 1728, 1, 1024]
    - [48, 0.0]
  - - [1600, 1728, 1, 1024]
    - [49, 0.0]
  - - [1728, 1728, 1, 1024]
    - [48, 0.0]
  - - [1856, 1728, 1, 1024]
    - [46, 0.0]
  - - [1984, 1728, 1, 1024]
    - [48, 0.0]
  - - [64, 1856, 1, 1024]
    - [108, 0.0]
  - - [192, 1856, 1, 1024]
    - [108, 0.0]
  - - [320, 1856, 1, 1024]
    - [33, 0.0]
  - - [448, 1856, 1, 1024]
    - [47, 0.0]
  - - [576, 1856, 1, 1024]
    - [116, 0.0]
  - - [704, 1856, 1, 1024]
    - [23, 0.0]
  - - [832, 1856, 1, 1024]
    - [49, 0.0]
  - - [960, 1856, 1, 1024]
    - [122, 0.0]
  - - [1088, 1856, 1, 1024]
    - [48, 0.0]
  - - [1216, 1856, 1, 1024]
    - [48, 0.0]
  - - [1344, 1856, 1, 1024]
    - [48, 0.0]
  - - [1472, 1856, 1, 1024]
    - [48, 0.0]
  - - [1600, 1856, 1, 1024]
    - [48, 0.0]
  - - [1728, 1856, 1, 1024]
    - [48, 0.0]
  - - [1856, 1856, 1, 1024]
    - [48, 0.0]
  - - [1984, 1856, 1, 1024]
    - [123, 0.0]
  - - [64, 1984, 1, 1024]
    - [114, 0.0]
  - - [192, 1984, 1, 1024]
    - [135, 0.0]
  - - [320, 1984, 1, 1024]
    - [108, 0.0]
  - - [448, 1984, 1, 1024]
    - [53, 0.0]
  - - [576, 1984, 1, 1024]
    - [49, 0.0]
  - - [704, 1984, 1, 1024]
    - [122, 0.0]
  - - [832, 1984, 1, 1024]
    - [113, 0.0]
  - - [960, 1984, 1, 1024]
    - [122, 0.0]
  - - [1088, 1984, 1, 1024]
    - [46, 0.0]
  - - [1216, 1984, 1, 1024]
    - [160, 0.0]
  - - [1344, 1984, 1, 1024]
    - [160, 0.0]
  - - [1472, 1984, 1, 1024]
    - [46, 0.0]
  - - [1600, 1984, 1, 1024]
    - [46, 0.0]
  - - [1728, 1984, 1, 1024]
    - [46, 0.0]
  - - [1856, 1984, 1, 1024]
    - [160, 0.0]
  - - [1984, 1984, 1, 1024]
    - [123, 0.0]
  - - [1088, 64, 1, 2048]
    - [95, 0.0]
  - - [1216, 64, 1, 2048]
    - [95, 0.0]
  - - [1344, 64, 1, 2048]
    - [102, 0.0]
  - - [1472, 64, 1, 2048]
    - [125, 0.0]
  - - [1600, 64, 1, 2048]
    - [120, 0.0]
  - - [1728, 64, 1, 2048]
    - [95, 0.0]
  - - [1856, 64, 1, 2048]
    - [99, 0.0]
  - - [1984, 64, 1, 2048]
    - [120, 0.0]
  - - [1088, 192, 1, 2048]
    - [12, 0.0]
  - - [1216, 192, 1, 2048]
    - [12, 0.0]
  - - [1344, 192, 1, 2048]
    - [114, 0.0]
  - - [1472, 192, 1, 2048]
    - [108, 0.0]
  - - [1600, 192, 1, 2048]
    - [113, 0.0]
  - - [1728, 192, 1, 2048]
    - [108, 0.0]
  - - [1856, 192, 1, 2048]
    - [108, 0.0]
  - - [1984, 192, 1, 2048]
    - [116, 0.0]
  - - [1088, 320, 1, 2048]
    - [108, 0.0]
  - - [1216, 320, 1, 2048]
    - [108, 0.0]
  - - [1344, 320, 1, 2048]
    - [48, 0.0]
  - - [1472, 320, 1, 2048]
    - [135, 0.0]
  - - [1600, 320, 1, 2048]
    - [113, 0.0]
  - - [1728, 320, 1, 2048]
    - [116, 0.0]
  - - [1856, 320, 1, 2048]
    - [135, 0.0]
  - - [1984, 320, 1, 2048]
    - [116, 0.0]
  - - [1088, 448, 1, 2048]
    - [108, 0.0]
  - - [1216, 448, 1, 2048]
    - [35, 0.0]
  - - [1344, 448, 1, 2048]
    - [48, 0.0]
  - - [1472, 448, 1, 2048]
    - [53, 0.0]
  - - [1600, 448, 1, 2048]
    - [47, 0.0]
  - - [1728, 448, 1, 2048]
    - [33, 0.0]
  - - [1856, 448, 1, 2048]
    - [123, 0.0]
  - - [1984, 448, 1, 2048]
    - [89, 0.0]
  - - [1088, 576, 1, 2048]
    - [89, 0.0]
  - - [1216, 576, 1, 2048]
    - [49, 0.0]
  - - [1344, 576, 1, 2048]
    - [53, 0.0]
  - - [1472, 576, 1, 2048]
    - [46, 0.0]
  - - [1600, 576, 1, 2048]
    - [48, 0.0]
  - - [1728, 576, 1, 2048]
    - [46, 0.0]
  - - [1856, 576, 1, 2048]
    - [56, 0.0]
  - - [1984, 576, 1, 2048]
    - [46, 0.0]
  - - [1088, 704, 1, 2048]
    - [46, 0.0]
  - - [1216, 704, 1, 2048]
    - [89, 0.0]
  - - [1344, 704, 1, 2048]
    - [46, 0.0]
  - - [1472, 704, 1, 2048]
    - [56, 0.0]
  - - [1600, 704, 1, 2048]
    - [46, 0.0]
  - - [1728, 704, 1, 2048]
    - [46, 0.0]
  - - [1856, 704, 1, 2048]
    - [122, 0.0]
  - - [1984, 704, 1, 2048]
    - [170, 0.0]
  - - [1088, 832, 1, 2048]
    - [48, 0.0]
  - - [1216, 832, 1, 2048]
    - [46, 0.0]
  - - [1344, 832, 1, 2048]
    - [46, 0.0]
  - - [1472, 832, 1, 2048]
    - [46, 0.0]
  - - [1600, 832, 1, 2048]
    - [122, 0.0]
  - - [1728, 832, 1, 2048]
    - [48, 0.0]
  - - [1856, 832, 1, 2048]
    - [48, 0.0]
  - - [1984, 832, 1, 2048]
    - [93, 0.0]
  - - [1088, 960, 1, 2048]
    - [46, 0.0]
  - - [1216, 960, 1, 2048]
    - [53, 0.0]
  - - [1344, 960, 1, 2048]
    - [160, 0.0]
  - - [1472, 960, 1, 2048]
    - [170, 0.0]
  - - [1600, 960, 1, 2048]
    - [94, 0.0]
  - - [1728, 960, 1, 2048]
    - [168, 0.0]
  - - [1856, 960, 1, 2048]
    - [93, 0.0]
  - - [1984, 960, 1, 2048]
    - [93, 0.0]
  - - [64, 1088, 1, 2048]
    - [142, 0.0]
  - - [192, 1088, 1, 2048]
    - [114, 0.0]
  - - [320, 1088, 1, 2048]
    - [108, 0.0]
  - - [448, 1088, 1, 2048]
    - [113, 0.0]
  - - [576, 1088, 1, 2048]
    - [135, 0.0]
  - - [704, 1088, 1, 2048]
    - [47, 0.0]
  - - [832, 1088, 1, 2048]
    - [89, 0.0]
  - - [960, 1088, 1, 2048]
    - [171, 0.0]
  - - [1088, 1088, 1, 2048]
    - [48, 0.0]
  - - [1216, 1088, 1, 2048]
    - [169, 0.0]
  - - [1344, 1088, 1, 2048]
    - [49, 0.0]
  - - [1472, 1088, 1, 2048]
    - [168, 0.0]
  - - [1600, 1088, 1, 2048]
    - [122, 0.0]
  - - [1728, 1088, 1, 2048]
    - [122, 0.0]
  - - [1856, 1088, 1, 2048]
    - [172, 0.0]
  - - [1984, 1088, 1, 2048]
    - [173, 0.0]
  - - [64, 1216, 1, 2048]
    - [144, 0.0]
  - - [192, 1216, 1, 2048]
    - [12, 0.0]
  - - [320, 1216, 1, 2048]
    - [116, 0.0]
  - - [448, 1216, 1, 2048]
    - [83, 0.0]
  - - [576, 1216, 1, 2048]
    - [47, 0.0]
  - - [704, 1216, 1, 2048]
    - [89, 0.0]
  - - [832, 1216, 1, 2048]
    - [46, 0.0]
  - - [960, 1216, 1, 2048]
    - [169, 0.0]
  - - [1088, 1216, 1, 2048]
    - [122, 0.0]
  - - [1216, 1216, 1, 2048]
    - [49, 0.0]
  - - [1344, 1216, 1, 2048]
    - [172, 0.0]
  - - [1472, 1216, 1, 2048]
    - [94, 0.0]
  - - [1600, 1216, 1, 2048]
    - [172, 0.0]
  - - [1728, 1216, 1, 2048]
    - [122, 0.0]
  - - [1856, 1216, 1, 2048]
    - [94, 0.0]
  - - [1984, 1216, 1, 2048]
    - [94, 0.0]
  - - [64, 1344, 1, 2048]
    - [142, 0.0]
  - - [192, 1344, 1, 2048]
    - [114, 0.0]
  - - [320, 1344, 1, 2048]
    - [48, 0.0]
  - - [448, 1344, 1, 2048]
    - [135, 0.0]
  - - [576, 1344, 1, 2048]
    - [47, 0.0]
  - - [704, 1344, 1, 2048]
    - [47, 0.0]
  - - [832, 1344, 1, 2048]
    - [89, 0.0]
  - - [960, 1344, 1, 2048]
    - [122, 0.0]
  - - [1088, 1344, 1, 2048]
    - [68, 0.0]
  - - [1216, 1344, 1, 2048]
    - [93, 0.0]
  - - [1344, 1344, 1, 2048]
    - [122, 0.0]
  - - [1472, 1344, 1, 2048]
    - [172, 0.0]
  - - [1600, 1344, 1, 2048]
    - [46, 0.0]
  - - [1728, 1344, 1, 2048]
    - [91, 0.0]
  - - [1856, 1344, 1, 2048]
    - [160, 0.0]
  - - [1984, 1344, 1, 2048]
    - [137, 0.0]
  - - [64, 1472, 1, 2048]
    - [142, 0.0]
  - - [192, 1472, 1, 2048]
    - [114, 0.0]
  - - [320, 1472, 1, 2048]
    - [48, 0.0]
  - - [448, 1472, 1, 2048]
    - [49, 0.0]
  - - [576, 1472, 1, 2048]
    - [89, 0.0]
  - - [704, 1472, 1, 2048]
    - [135, 0.0]
  - - [832, 1472, 1, 2048]
    - [122, 0.0]
  - - [960, 1472, 1, 2048]
    - [169, 0.0]
  - - [1088, 1472, 1, 2048]
    - [122, 0.0]
  - - [1216, 1472, 1, 2048]
    - [173, 0.0]
  - - [1344, 1472, 1, 2048]
    - [48, 0.0]
  - - [1472, 1472, 1, 2048]
    - [93, 0.0]
  - - [1600, 1472, 1, 2048]
    - [93, 0.0]
  - - [1728, 1472, 1, 2048]
    - [159, 0.0]
  - - [1856, 1472, 1, 2048]
    - [49, 0.0]
  - - [1984, 1472, 1, 2048]
    - [48, 0.0]
  - - [64, 1600, 1, 2048]
    - [114, 0.0]
  - - [192, 1600, 1, 2048]
    - [108, 0.0]
  - - [320, 1600, 1, 2048]
    - [135, 0.0]
  - - [448, 1600, 1, 2048]
    - [89, 0.0]
  - - [576, 1600, 1, 2048]
    - [49, 0.0]
  - - [704, 1600, 1, 2048]
    - [49, 0.0]
  - - [832, 1600, 1, 2048]
    - [169, 0.0]
  - - [960, 1600, 1, 2048]
    - [108, 0.0]
  - - [1088, 1600, 1, 2048]
    - [94, 0.0]
  - - [1216, 1600, 1, 2048]
    - [168, 0.0]
  - - [1344, 1600, 1, 2048]
    - [93, 0.0]
  - - [1472, 1600, 1, 2048]
    - [168, 0.0]
  - - [1600, 1600, 1, 2048]
    - [160, 0.0]
  - - [1728, 1600, 1, 2048]
    - [48, 0.0]
  - - [1856, 1600, 1, 2048]
    - [168, 0.0]
  - - [1984, 1600, 1, 2048]
    - [122, 0.0]
  - - [64, 1728, 1, 2048]
    - [17, 0.0]
  - - [192, 1728, 1, 2048]
    - [135, 0.0]
  - - [320, 1728, 1, 2048]
    - [108, 0.0]
  - - [448, 1728, 1, 2048]
    - [46, 0.0]
  - - [576, 1728, 1, 2048]
    - [48, 0.0]
  - - [704, 1728, 1, 2048]
    - [89, 0.0]
  - - [832, 1728, 1, 2048]
    - [49, 0.0]
  - - [960, 1728, 1, 2048]
    - [91, 0.0]
  - - [1088, 1728, 1, 2048]
    - [94, 0.0]
  - - [1216, 1728, 1, 2048]
    - [172, 0.0]
  - - [1344, 1728, 1, 2048]
    - [121, 0.0]
  - - [1472, 1728, 1, 2048]
    - [108, 0.0]
  - - [1600, 1728, 1, 2048]
    - [48, 0.0]
  - - [1728, 1728, 1, 2048]
    - [89, 0.0]
  - - [1856, 1728, 1, 2048]
    - [46, 0.0]
  - - [1984, 1728, 1, 2048]
    - [160, 0.0]
  - - [64, 1856, 1, 2048]
    - [108, 0.0]
  - - [192, 1856, 1, 2048]
    - [108, 0.0]
  - - [320, 1856, 1, 2048]
    - [49, 0.0]
  - - [448, 1856, 1, 2048]
    - [145, 0.0]
  - - [576, 1856, 1, 2048]
    - [47, 0.0]
  - - [704, 1856, 1, 2048]
    - [174, 0.0]
  - - [832, 1856, 1, 2048]
    - [168, 0.0]
  - - [960, 1856, 1, 2048]
    - [173, 0.0]
  - - [1088, 1856, 1, 2048]
    - [49, 0.0]
  - - [1216, 1856, 1, 2048]
    - [173, 0.0]
  - - [1344, 1856, 1, 2048]
    - [46, 0.0]
  - - [1472, 1856, 1, 2048]
    - [48, 0.0]
  - - [1600, 1856, 1, 2048]
    - [122, 0.0]
  - - [1728, 1856, 1, 2048]
    - [93, 0.0]
  - - [1856, 1856, 1, 2048]
    - [160, 0.0]
  - - [1984, 1856, 1, 2048]
    - [160, 0.0]
  - - [64, 1984, 1, 2048]
    - [135, 0.0]
  - - [192, 1984, 1, 2048]
    - [135, 0.0]
  - - [320, 1984, 1, 2048]
    - [116, 0.0]
  - - [448, 1984, 1, 2048]
    - [117, 0.0]
  - - [576, 1984, 1, 2048]
    - [108, 0.0]
  - - [704, 1984, 1, 2048]
    - [121, 0.0]
  - - [832, 1984, 1, 2048]
    - [93, 0.0]
  - - [960, 1984, 1, 2048]
    - [174, 0.0]
  - - [1088, 1984, 1, 2048]
    - [159, 0.0]
  - - [1216, 1984, 1, 2048]
    - [122, 0.0]
  - - [1344, 1984, 1, 2048]
    - [137, 0.0]
  - - [1472, 1984, 1, 2048]
    - [137, 0.0]
  - - [1600, 1984, 1, 2048]
    - [46, 0.0]
  - - [1728, 1984, 1, 2048]
    - [160, 0.0]
  - - [1856, 1984, 1, 2048]
    - [93, 0.0]
  - - [1984, 1984, 1, 2048]
    - [93, 0.0]
  - - [1088, 64, 1, 4096]
    - [95, 0.0]
  - - [1216, 64, 1, 4096]
    - [127, 0.0]
  - - [1344, 64, 1, 4096]
    - [125, 0.0]
  - - [1472, 64, 1, 4096]
    - [102, 0.0]
  - - [1600, 64, 1, 4096]
    - [95, 0.0]
  - - [1728, 64, 1, 4096]
    - [99, 0.0]
  - - [1856, 64, 1, 4096]
    - [95, 0.0]
  - - [1984, 64, 1, 4096]
    - [125, 0.0]
  - - [1088, 192, 1, 4096]
    - [108, 0.0]
  - - [1216, 192, 1, 4096]
    - [108, 0.0]
  - - [1344, 192, 1, 4096]
    - [108, 0.0]
  - - [1472, 192, 1, 4096]
    - [108, 0.0]
  - - [1600, 192, 1, 4096]
    - [12, 0.0]
  - - [1728, 192, 1, 4096]
    - [113, 0.0]
  - - [1856, 192, 1, 4096]
    - [116, 0.0]
  - - [1984, 192, 1, 4096]
    - [113, 0.0]
  - - [1088, 320, 1, 4096]
    - [108, 0.0]
  - - [1216, 320, 1, 4096]
    - [116, 0.0]
  - - [1344, 320, 1, 4096]
    - [108, 0.0]
  - - [1472, 320, 1, 4096]
    - [108, 0.0]
  - - [1600, 320, 1, 4096]
    - [135, 0.0]
  - - [1728, 320, 1, 4096]
    - [108, 0.0]
  - - [1856, 320, 1, 4096]
    - [89, 0.0]
  - - [1984, 320, 1, 4096]
    - [89, 0.0]
  - - [1088, 448, 1, 4096]
    - [113, 0.0]
  - - [1216, 448, 1, 4096]
    - [48, 0.0]
  - - [1344, 448, 1, 4096]
    - [35, 0.0]
  - - [1472, 448, 1, 4096]
    - [53, 0.0]
  - - [1600, 448, 1, 4096]
    - [46, 0.0]
  - - [1728, 448, 1, 4096]
    - [123, 0.0]
  - - [1856, 448, 1, 4096]
    - [123, 0.0]
  - - [1984, 448, 1, 4096]
    - [123, 0.0]
  - - [1088, 576, 1, 4096]
    - [48, 0.0]
  - - [1216, 576, 1, 4096]
    - [48, 0.0]
  - - [1344, 576, 1, 4096]
    - [46, 0.0]
  - - [1472, 576, 1, 4096]
    - [123, 0.0]
  - - [1600, 576, 1, 4096]
    - [48, 0.0]
  - - [1728, 576, 1, 4096]
    - [46, 0.0]
  - - [1856, 576, 1, 4096]
    - [145, 0.0]
  - - [1984, 576, 1, 4096]
    - [46, 0.0]
  - - [1088, 704, 1, 4096]
    - [53, 0.0]
  - - [1216, 704, 1, 4096]
    - [123, 0.0]
  - - [1344, 704, 1, 4096]
    - [53, 0.0]
  - - [1472, 704, 1, 4096]
    - [46, 0.0]
  - - [1600, 704, 1, 4096]
    - [122, 0.0]
  - - [1728, 704, 1, 4096]
    - [169, 0.0]
  - - [1856, 704, 1, 4096]
    - [169, 0.0]
  - - [1984, 704, 1, 4096]
    - [175, 0.0]
  - - [1088, 832, 1, 4096]
    - [53, 0.0]
  - - [1216, 832, 1, 4096]
    - [46, 0.0]
  - - [1344, 832, 1, 4096]
    - [53, 0.0]
  - - [1472, 832, 1, 4096]
    - [145, 0.0]
  - - [1600, 832, 1, 4096]
    - [137, 0.0]
  - - [1728, 832, 1, 4096]
    - [122, 0.0]
  - - [1856, 832, 1, 4096]
    - [48, 0.0]
  - - [1984, 832, 1, 4096]
    - [172, 0.0]
  - - [1088, 960, 1, 4096]
    - [145, 0.0]
  - - [1216, 960, 1, 4096]
    - [53, 0.0]
  - - [1344, 960, 1, 4096]
    - [170, 0.0]
  - - [1472, 960, 1, 4096]
    - [175, 0.0]
  - - [1600, 960, 1, 4096]
    - [122, 0.0]
  - - [1728, 960, 1, 4096]
    - [176, 0.0]
  - - [1856, 960, 1, 4096]
    - [177, 0.0]
  - - [1984, 960, 1, 4096]
    - [123, 0.0]
  - - [64, 1088, 1, 4096]
    - [134, 0.0]
  - - [192, 1088, 1, 4096]
    - [108, 0.0]
  - - [320, 1088, 1, 4096]
    - [113, 0.0]
  - - [448, 1088, 1, 4096]
    - [108, 0.0]
  - - [576, 1088, 1, 4096]
    - [48, 0.0]
  - - [704, 1088, 1, 4096]
    - [123, 0.0]
  - - [832, 1088, 1, 4096]
    - [159, 0.0]
  - - [960, 1088, 1, 4096]
    - [122, 0.0]
  - - [1088, 1088, 1, 4096]
    - [174, 0.0]
  - - [1216, 1088, 1, 4096]
    - [137, 0.0]
  - - [1344, 1088, 1, 4096]
    - [93, 0.0]
  - - [1472, 1088, 1, 4096]
    - [172, 0.0]
  - - [1600, 1088, 1, 4096]
    - [122, 0.0]
  - - [1728, 1088, 1, 4096]
    - [177, 0.0]
  - - [1856, 1088, 1, 4096]
    - [122, 0.0]
  - - [1984, 1088, 1, 4096]
    - [160, 0.0]
  - - [64, 1216, 1, 4096]
    - [134, 0.0]
  - - [192, 1216, 1, 4096]
    - [12, 0.0]
  - - [320, 1216, 1, 4096]
    - [135, 0.0]
  - - [448, 1216, 1, 4096]
    - [83, 0.0]
  - - [576, 1216, 1, 4096]
    - [48, 0.0]
  - - [704, 1216, 1, 4096]
    - [160, 0.0]
  - - [832, 1216, 1, 4096]
    - [46, 0.0]
  - - [960, 1216, 1, 4096]
    - [121, 0.0]
  - - [1088, 1216, 1, 4096]
    - [137, 0.0]
  - - [1216, 1216, 1, 4096]
    - [122, 0.0]
  - - [1344, 1216, 1, 4096]
    - [173, 0.0]
  - - [1472, 1216, 1, 4096]
    - [178, 0.0]
  - - [1600, 1216, 1, 4096]
    - [172, 0.0]
  - - [1728, 1216, 1, 4096]
    - [123, 0.0]
  - - [1856, 1216, 1, 4096]
    - [160, 0.0]
  - - [1984, 1216, 1, 4096]
    - [137, 0.0]
  - - [64, 1344, 1, 4096]
    - [144, 0.0]
  - - [192, 1344, 1, 4096]
    - [12, 0.0]
  - - [320, 1344, 1, 4096]
    - [48, 0.0]
  - - [448, 1344, 1, 4096]
    - [48, 0.0]
  - - [576, 1344, 1, 4096]
    - [49, 0.0]
  - - [704, 1344, 1, 4096]
    - [48, 0.0]
  - - [832, 1344, 1, 4096]
    - [122, 0.0]
  - - [960, 1344, 1, 4096]
    - [169, 0.0]
  - - [1088, 1344, 1, 4096]
    - [122, 0.0]
  - - [1216, 1344, 1, 4096]
    - [93, 0.0]
  - - [1344, 1344, 1, 4096]
    - [94, 0.0]
  - - [1472, 1344, 1, 4096]
    - [123, 0.0]
  - - [1600, 1344, 1, 4096]
    - [159, 0.0]
  - - [1728, 1344, 1, 4096]
    - [153, 0.0]
  - - [1856, 1344, 1, 4096]
    - [46, 0.0]
  - - [1984, 1344, 1, 4096]
    - [137, 0.0]
  - - [64, 1472, 1, 4096]
    - [144, 0.0]
  - - [192, 1472, 1, 4096]
    - [108, 0.0]
  - - [320, 1472, 1, 4096]
    - [48, 0.0]
  - - [448, 1472, 1, 4096]
    - [49, 0.0]
  - - [576, 1472, 1, 4096]
    - [46, 0.0]
  - - [704, 1472, 1, 4096]
    - [122, 0.0]
  - - [832, 1472, 1, 4096]
    - [169, 0.0]
  - - [960, 1472, 1, 4096]
    - [169, 0.0]
  - - [1088, 1472, 1, 4096]
    - [168, 0.0]
  - - [1216, 1472, 1, 4096]
    - [168, 0.0]
  - - [1344, 1472, 1, 4096]
    - [172, 0.0]
  - - [1472, 1472, 1, 4096]
    - [123, 0.0]
  - - [1600, 1472, 1, 4096]
    - [123, 0.0]
  - - [1728, 1472, 1, 4096]
    - [137, 0.0]
  - - [1856, 1472, 1, 4096]
    - [179, 0.0]
  - - [1984, 1472, 1, 4096]
    - [179, 0.0]
  - - [64, 1600, 1, 4096]
    - [108, 0.0]
  - - [192, 1600, 1, 4096]
    - [113, 0.0]
  - - [320, 1600, 1, 4096]
    - [108, 0.0]
  - - [448, 1600, 1, 4096]
    - [89, 0.0]
  - - [576, 1600, 1, 4096]
    - [53, 0.0]
  - - [704, 1600, 1, 4096]
    - [53, 0.0]
  - - [832, 1600, 1, 4096]
    - [179, 0.0]
  - - [960, 1600, 1, 4096]
    - [91, 0.0]
  - - [1088, 1600, 1, 4096]
    - [121, 0.0]
  - - [1216, 1600, 1, 4096]
    - [173, 0.0]
  - - [1344, 1600, 1, 4096]
    - [123, 0.0]
  - - [1472, 1600, 1, 4096]
    - [159, 0.0]
  - - [1600, 1600, 1, 4096]
    - [135, 0.0]
  - - [1728, 1600, 1, 4096]
    - [137, 0.0]
  - - [1856, 1600, 1, 4096]
    - [137, 0.0]
  - - [1984, 1600, 1, 4096]
    - [137, 0.0]
  - - [64, 1728, 1, 4096]
    - [17, 0.0]
  - - [192, 1728, 1, 4096]
    - [108, 0.0]
  - - [320, 1728, 1, 4096]
    - [116, 0.0]
  - - [448, 1728, 1, 4096]
    - [123, 0.0]
  - - [576, 1728, 1, 4096]
    - [89, 0.0]
  - - [704, 1728, 1, 4096]
    - [121, 0.0]
  - - [832, 1728, 1, 4096]
    - [172, 0.0]
  - - [960, 1728, 1, 4096]
    - [91, 0.0]
  - - [1088, 1728, 1, 4096]
    - [94, 0.0]
  - - [1216, 1728, 1, 4096]
    - [122, 0.0]
  - - [1344, 1728, 1, 4096]
    - [122, 0.0]
  - - [1472, 1728, 1, 4096]
    - [108, 0.0]
  - - [1600, 1728, 1, 4096]
    - [179, 0.0]
  - - [1728, 1728, 1, 4096]
    - [137, 0.0]
  - - [1856, 1728, 1, 4096]
    - [137, 0.0]
  - - [1984, 1728, 1, 4096]
    - [159, 0.0]
  - - [64, 1856, 1, 4096]
    - [135, 0.0]
  - - [192, 1856, 1, 4096]
    - [108, 0.0]
  - - [320, 1856, 1, 4096]
    - [48, 0.0]
  - - [448, 1856, 1, 4096]
    - [123, 0.0]
  - - [576, 1856, 1, 4096]
    - [145, 0.0]
  - - [704, 1856, 1, 4096]
    - [137, 0.0]
  - - [832, 1856, 1, 4096]
    - [93, 0.0]
  - - [960, 1856, 1, 4096]
    - [121, 0.0]
  - - [1088, 1856, 1, 4096]
    - [172, 0.0]
  - - [1216, 1856, 1, 4096]
    - [123, 0.0]
  - - [1344, 1856, 1, 4096]
    - [53, 0.0]
  - - [1472, 1856, 1, 4096]
    - [48, 0.0]
  - - [1600, 1856, 1, 4096]
    - [137, 0.0]
  - - [1728, 1856, 1, 4096]
    - [137, 0.0]
  - - [1856, 1856, 1, 4096]
    - [159, 0.0]
  - - [1984, 1856, 1, 4096]
    - [123, 0.0]
  - - [64, 1984, 1, 4096]
    - [17, 0.0]
  - - [192, 1984, 1, 4096]
    - [116, 0.0]
  - - [320, 1984, 1, 4096]
    - [108, 0.0]
  - - [448, 1984, 1, 4096]
    - [159, 0.0]
  - - [576, 1984, 1, 4096]
    - [121, 0.0]
  - - [704, 1984, 1, 4096]
    - [169, 0.0]
  - - [832, 1984, 1, 4096]
    - [173, 0.0]
  - - [960, 1984, 1, 4096]
    - [91, 0.0]
  - - [1088, 1984, 1, 4096]
    - [160, 0.0]
  - - [1216, 1984, 1, 4096]
    - [160, 0.0]
  - - [1344, 1984, 1, 4096]
    - [137, 0.0]
  - - [1472, 1984, 1, 4096]
    - [137, 0.0]
  - - [1600, 1984, 1, 4096]
    - [160, 0.0]
  - - [1728, 1984, 1, 4096]
    - [137, 0.0]
  - - [1856, 1984, 1, 4096]
    - [160, 0.0]
  - - [1984, 1984, 1, 4096]
    - [159, 0.0]
  - - [2048, 2048, 1, 2048]
    - [122, 0.0]
  - - [3072, 3072, 1, 3072]
    - [159, 0.0]
  - - [4096, 4096, 1, 4096]
    - [122, 0.0]
  - - [4096, 64, 1, 64]
    - [180, 0.0]
  - - [4096, 320, 1, 64]
    - [93, 0.0]
  - - [4096, 576, 1, 64]
    - [94, 0.0]
  - - [4096, 832, 1, 64]
    - [169, 0.0]
  - - [4096, 1088, 1, 64]
    - [93, 0.0]
  - - [4096, 1344, 1, 64]
    - [174, 0.0]
  - - [4096, 1600, 1, 64]
    - [94, 0.0]
  - - [4096, 1856, 1, 64]
    - [94, 0.0]
  - - [4096, 2112, 1, 64]
    - [170, 0.0]
  - - [4096, 2368, 1, 64]
    - [170, 0.0]
  - - [4096, 2624, 1, 64]
    - [94, 0.0]
  - - [4096, 2880, 1, 64]
    - [94, 0.0]
  - - [4096, 3136, 1, 64]
    - [94, 0.0]
  - - [4096, 3392, 1, 64]
    - [93, 0.0]
  - - [4096, 3648, 1, 64]
    - [170, 0.0]
  - - [4096, 3904, 1, 64]
    - [94, 0.0]
  - - [4096, 64, 1, 256]
    - [12, 0.0]
  - - [4096, 320, 1, 256]
    - [46, 0.0]
  - - [4096, 576, 1, 256]
    - [93, 0.0]
  - - [4096, 832, 1, 256]
    - [93, 0.0]
  - - [4096, 1088, 1, 256]
    - [123, 0.0]
  - - [4096, 1344, 1, 256]
    - [123, 0.0]
  - - [4096, 1600, 1, 256]
    - [94, 0.0]
  - - [4096, 1856, 1, 256]
    - [93, 0.0]
  - - [4096, 2112, 1, 256]
    - [94, 0.0]
  - - [4096, 2368, 1, 256]
    - [94, 0.0]
  - - [4096, 2624, 1, 256]
    - [93, 0.0]
  - - [4096, 2880, 1, 256]
    - [93, 0.0]
  - - [4096, 3136, 1, 256]
    - [93, 0.0]
  - - [4096, 3392, 1, 256]
    - [93, 0.0]
  - - [4096, 3648, 1, 256]
    - [93, 0.0]
  - - [4096, 3904, 1, 256]
    - [93, 0.0]
  - - [4096, 64, 1, 512]
    - [12, 0.0]
  - - [4096, 320, 1, 512]
    - [169, 0.0]
  - - [4096, 576, 1, 512]
    - [123, 0.0]
  - - [4096, 832, 1, 512]
    - [137, 0.0]
  - - [4096, 1088, 1, 512]
    - [94, 0.0]
  - - [4096, 1344, 1, 512]
    - [170, 0.0]
  - - [4096, 1600, 1, 512]
    - [93, 0.0]
  - - [4096, 1856, 1, 512]
    - [123, 0.0]
  - - [4096, 2112, 1, 512]
    - [122, 0.0]
  - - [4096, 2368, 1, 512]
    - [93, 0.0]
  - - [4096, 2624, 1, 512]
    - [122, 0.0]
  - - [4096, 2880, 1, 512]
    - [122, 0.0]
  - - [4096, 3136, 1, 512]
    - [122, 0.0]
  - - [4096, 3392, 1, 512]
    - [93, 0.0]
  - - [4096, 3648, 1, 512]
    - [122, 0.0]
  - - [4096, 3904, 1, 512]
    - [93, 0.0]
  - - [4096, 64, 1, 1024]
    - [135, 0.0]
  - - [4096, 320, 1, 1024]
    - [123, 0.0]
  - - [4096, 576, 1, 1024]
    - [137, 0.0]
  - - [4096, 832, 1, 1024]
    - [123, 0.0]
  - - [4096, 1088, 1, 1024]
    - [160, 0.0]
  - - [4096, 1344, 1, 1024]
    - [123, 0.0]
  - - [4096, 1600, 1, 1024]
    - [123, 0.0]
  - - [4096, 1856, 1, 1024]
    - [160, 0.0]
  - - [4096, 2112, 1, 1024]
    - [137, 0.0]
  - - [4096, 2368, 1, 1024]
    - [123, 0.0]
  - - [4096, 2624, 1, 1024]
    - [137, 0.0]
  - - [4096, 2880, 1, 1024]
    - [160, 0.0]
  - - [4096, 3136, 1, 1024]
    - [160, 0.0]
  - - [4096, 3392, 1, 1024]
    - [160, 0.0]
  - - [4096, 3648, 1, 1024]
    - [137, 0.0]
  - - [4096, 3904, 1, 1024]
    - [160, 0.0]
  - - [4096, 64, 1, 2048]
    - [108, 0.0]
  - - [4096, 320, 1, 2048]
    - [122, 0.0]
  - - [4096, 576, 1, 2048]
    - [121, 0.0]
  - - [4096, 832, 1, 2048]
    - [160, 0.0]
  - - [4096, 1088, 1, 2048]
    - [94, 0.0]
  - - [4096, 1344, 1, 2048]
    - [160, 0.0]
  - - [4096, 1600, 1, 2048]
    - [160, 0.0]
  - - [4096, 1856, 1, 2048]
    - [123, 0.0]
  - - [4096, 2112, 1, 2048]
    - [123, 0.0]
  - - [4096, 2368, 1, 2048]
    - [160, 0.0]
  - - [4096, 2624, 1, 2048]
    - [93, 0.0]
  - - [4096, 2880, 1, 2048]
    - [137, 0.0]
  - - [4096, 3136, 1, 2048]
    - [122, 0.0]
  - - [4096, 3392, 1, 2048]
    - [160, 0.0]
  - - [4096, 3648, 1, 2048]
    - [160, 0.0]
  - - [4096, 3904, 1, 2048]
    - [122, 0.0]
  - - [4096, 64, 1, 4096]
    - [113, 0.0]
  - - [4096, 320, 1, 4096]
    - [137, 0.0]
  - - [4096, 576, 1, 4096]
    - [160, 0.0]
  - - [4096, 832, 1, 4096]
    - [123, 0.0]
  - - [4096, 1088, 1, 4096]
    - [123, 0.0]
  - - [4096, 1344, 1, 4096]
    - [123, 0.0]
  - - [4096, 1600, 1, 4096]
    - [159, 0.0]
  - - [4096, 1856, 1, 4096]
    - [137, 0.0]
  - - [4096, 2112, 1, 4096]
    - [123, 0.0]
  - - [4096, 2368, 1, 4096]
    - [122, 0.0]
  - - [4096, 2624, 1, 4096]
    - [159, 0.0]
  - - [4096, 2880, 1, 4096]
    - [121, 0.0]
  - - [4096, 3136, 1, 4096]
    - [122, 0.0]
  - - [4096, 3392, 1, 4096]
    - [122, 0.0]
  - - [4096, 3648, 1, 4096]
    - [121, 0.0]
  - - [4096, 3904, 1, 4096]
    - [122, 0.0]
  - - [64, 4096, 1, 64]
    - [158, 0.0]
  - - [320, 4096, 1, 64]
    - [92, 0.0]
  - - [576, 4096, 1, 64]
    - [69, 0.0]
  - - [832, 4096, 1, 64]
    - [92, 0.0]
  - - [1088, 4096, 1, 64]
    - [70, 0.0]
  - - [1344, 4096, 1, 64]
    - [69, 0.0]
  - - [1600, 4096, 1, 64]
    - [70, 0.0]
  - - [1856, 4096, 1, 64]
    - [70, 0.0]
  - - [2112, 4096, 1, 64]
    - [69, 0.0]
  - - [2368, 4096, 1, 64]
    - [93, 0.0]
  - - [2624, 4096, 1, 64]
    - [70, 0.0]
  - - [2880, 4096, 1, 64]
    - [93, 0.0]
  - - [3136, 4096, 1, 64]
    - [94, 0.0]
  - - [3392, 4096, 1, 64]
    - [93, 0.0]
  - - [3648, 4096, 1, 64]
    - [174, 0.0]
  - - [3904, 4096, 1, 64]
    - [94, 0.0]
  - - [64, 4096, 1, 256]
    - [114, 0.0]
  - - [320, 4096, 1, 256]
    - [47, 0.0]
  - - [576, 4096, 1, 256]
    - [41, 0.0]
  - - [832, 4096, 1, 256]
    - [49, 0.0]
  - - [1088, 4096, 1, 256]
    - [49, 0.0]
  - - [1344, 4096, 1, 256]
    - [83, 0.0]
  - - [1600, 4096, 1, 256]
    - [49, 0.0]
  - - [1856, 4096, 1, 256]
    - [49, 0.0]
  - - [2112, 4096, 1, 256]
    - [47, 0.0]
  - - [2368, 4096, 1, 256]
    - [49, 0.0]
  - - [2624, 4096, 1, 256]
    - [68, 0.0]
  - - [2880, 4096, 1, 256]
    - [122, 0.0]
  - - [3136, 4096, 1, 256]
    - [121, 0.0]
  - - [3392, 4096, 1, 256]
    - [93, 0.0]
  - - [3648, 4096, 1, 256]
    - [93, 0.0]
  - - [3904, 4096, 1, 256]
    - [93, 0.0]
  - - [64, 4096, 1, 512]
    - [12, 0.0]
  - - [320, 4096, 1, 512]
    - [48, 0.0]
  - - [576, 4096, 1, 512]
    - [48, 0.0]
  - - [832, 4096, 1, 512]
    - [48, 0.0]
  - - [1088, 4096, 1, 512]
    - [49, 0.0]
  - - [1344, 4096, 1, 512]
    - [49, 0.0]
  - - [1600, 4096, 1, 512]
    - [49, 0.0]
  - - [1856, 4096, 1, 512]
    - [49, 0.0]
  - - [2112, 4096, 1, 512]
    - [49, 0.0]
  - - [2368, 4096, 1, 512]
    - [93, 0.0]
  - - [2624, 4096, 1, 512]
    - [122, 0.0]
  - - [2880, 4096, 1, 512]
    - [93, 0.0]
  - - [3136, 4096, 1, 512]
    - [93, 0.0]
  - - [3392, 4096, 1, 512]
    - [93, 0.0]
  - - [3648, 4096, 1, 512]
    - [122, 0.0]
  - - [3904, 4096, 1, 512]
    - [121, 0.0]
  - - [64, 4096, 1, 1024]
    - [17, 0.0]
  - - [320, 4096, 1, 1024]
    - [68, 0.0]
  - - [576, 4096, 1, 1024]
    - [89, 0.0]
  - - [832, 4096, 1, 1024]
    - [48, 0.0]
  - - [1088, 4096, 1, 1024]
    - [48, 0.0]
  - - [1344, 4096, 1, 1024]
    - [48, 0.0]
  - - [1600, 4096, 1, 1024]
    - [122, 0.0]
  - - [1856, 4096, 1, 1024]
    - [121, 0.0]
  - - [2112, 4096, 1, 1024]
    - [168, 0.0]
  - - [2368, 4096, 1, 1024]
    - [122, 0.0]
  - - [2624, 4096, 1, 1024]
    - [122, 0.0]
  - - [2880, 4096, 1, 1024]
    - [122, 0.0]
  - - [3136, 4096, 1, 1024]
    - [122, 0.0]
  - - [3392, 4096, 1, 1024]
    - [122, 0.0]
  - - [3648, 4096, 1, 1024]
    - [122, 0.0]
  - - [3904, 4096, 1, 1024]
    - [93, 0.0]
  - - [64, 4096, 1, 2048]
    - [17, 0.0]
  - - [320, 4096, 1, 2048]
    - [89, 0.0]
  - - [576, 4096, 1, 2048]
    - [89, 0.0]
  - - [832, 4096, 1, 2048]
    - [121, 0.0]
  - - [1088, 4096, 1, 2048]
    - [89, 0.0]
  - - [1344, 4096, 1, 2048]
    - [168, 0.0]
  - - [1600, 4096, 1, 2048]
    - [122, 0.0]
  - - [1856, 4096, 1, 2048]
    - [122, 0.0]
  - - [2112, 4096, 1, 2048]
    - [93, 0.0]
  - - [2368, 4096, 1, 2048]
    - [121, 0.0]
  - - [2624, 4096, 1, 2048]
    - [94, 0.0]
  - - [2880, 4096, 1, 2048]
    - [122, 0.0]
  - - [3136, 4096, 1, 2048]
    - [122, 0.0]
  - - [3392, 4096, 1, 2048]
    - [168, 0.0]
  - - [3648, 4096, 1, 2048]
    - [122, 0.0]
  - - [3904, 4096, 1, 2048]
    - [122, 0.0]
  - - [64, 4096, 1, 4096]
    - [19, 0.0]
  - - [320, 4096, 1, 4096]
    - [49, 0.0]
  - - [576, 4096, 1, 4096]
    - [121, 0.0]
  - - [832, 4096, 1, 4096]
    - [48, 0.0]
  - - [1088, 4096, 1, 4096]
    - [121, 0.0]
  - - [1344, 4096, 1, 4096]
    - [122, 0.0]
  - - [1600, 4096, 1, 4096]
    - [122, 0.0]
  - - [1856, 4096, 1, 4096]
    - [123, 0.0]
  - - [2112, 4096, 1, 4096]
    - [121, 0.0]
  - - [2368, 4096, 1, 4096]
    - [123, 0.0]
  - - [2624, 4096, 1, 4096]
    - [93, 0.0]
  - - [2880, 4096, 1, 4096]
    - [93, 0.0]
  - - [3136, 4096, 1, 4096]
    - [122, 0.0]
  - - [3392, 4096, 1, 4096]
    - [122, 0.0]
  - - [3648, 4096, 1, 4096]
    - [122, 0.0]
  - - [3904, 4096, 1, 4096]
    - [122, 0.0]
  - - [1088, 1024, 1, 64]
    - [69, 0.0]
  - - [1152, 1024, 1, 64]
    - [172, 0.0]
  - - [1216, 1024, 1, 64]
    - [35, 0.0]
  - - [1280, 1024, 1, 64]
    - [181, 0.0]
  - - [1344, 1024, 1, 64]
    - [69, 0.0]
  - - [1408, 1024, 1, 64]
    - [94, 0.0]
  - - [1472, 1024, 1, 64]
    - [49, 0.0]
  - - [1536, 1024, 1, 64]
    - [168, 0.0]
  - - [1600, 1024, 1, 64]
    - [70, 0.0]
  - - [1664, 1024, 1, 64]
    - [94, 0.0]
  - - [1728, 1024, 1, 64]
    - [33, 0.0]
  - - [1792, 1024, 1, 64]
    - [94, 0.0]
  - - [1856, 1024, 1, 64]
    - [70, 0.0]
  - - [1920, 1024, 1, 64]
    - [93, 0.0]
  - - [1984, 1024, 1, 64]
    - [35, 0.0]
  - - [2048, 1024, 1, 64]
    - [93, 0.0]
  - - [1024, 1088, 1, 64]
    - [94, 0.0]
  - - [1152, 1088, 1, 64]
    - [93, 0.0]
  - - [1280, 1088, 1, 64]
    - [182, 0.0]
  - - [1408, 1088, 1, 64]
    - [183, 0.0]
  - - [1536, 1088, 1, 64]
    - [93, 0.0]
  - - [1664, 1088, 1, 64]
    - [93, 0.0]
  - - [1792, 1088, 1, 64]
    - [93, 0.0]
  - - [1920, 1088, 1, 64]
    - [94, 0.0]
  - - [2048, 1088, 1, 64]
    - [93, 0.0]
  - - [1024, 1152, 1, 64]
    - [184, 0.0]
  - - [1088, 1152, 1, 64]
    - [69, 0.0]
  - - [1152, 1152, 1, 64]
    - [93, 0.0]
  - - [1216, 1152, 1, 64]
    - [70, 0.0]
  - - [1280, 1152, 1, 64]
    - [93, 0.0]
  - - [1344, 1152, 1, 64]
    - [69, 0.0]
  - - [1408, 1152, 1, 64]
    - [181, 0.0]
  - - [1472, 1152, 1, 64]
    - [70, 0.0]
  - - [1536, 1152, 1, 64]
    - [94, 0.0]
  - - [1600, 1152, 1, 64]
    - [68, 0.0]
  - - [1664, 1152, 1, 64]
    - [181, 0.0]
  - - [1728, 1152, 1, 64]
    - [68, 0.0]
  - - [1792, 1152, 1, 64]
    - [93, 0.0]
  - - [1856, 1152, 1, 64]
    - [162, 0.0]
  - - [1920, 1152, 1, 64]
    - [94, 0.0]
  - - [1984, 1152, 1, 64]
    - [69, 0.0]
  - - [2048, 1152, 1, 64]
    - [94, 0.0]
  - - [1024, 1216, 1, 64]
    - [93, 0.0]
  - - [1152, 1216, 1, 64]
    - [94, 0.0]
  - - [1280, 1216, 1, 64]
    - [60, 0.0]
  - - [1408, 1216, 1, 64]
    - [182, 0.0]
  - - [1536, 1216, 1, 64]
    - [123, 0.0]
  - - [1664, 1216, 1, 64]
    - [117, 0.0]
  - - [1792, 1216, 1, 64]
    - [93, 0.0]
  - - [1920, 1216, 1, 64]
    - [181, 0.0]
  - - [2048, 1216, 1, 64]
    - [93, 0.0]
  - - [1024, 1280, 1, 64]
    - [94, 0.0]
  - - [1088, 1280, 1, 64]
    - [162, 0.0]
  - - [1152, 1280, 1, 64]
    - [94, 0.0]
  - - [1216, 1280, 1, 64]
    - [69, 0.0]
  - - [1280, 1280, 1, 64]
    - [93, 0.0]
  - - [1344, 1280, 1, 64]
    - [69, 0.0]
  - - [1408, 1280, 1, 64]
    - [121, 0.0]
  - - [1472, 1280, 1, 64]
    - [70, 0.0]
  - - [1536, 1280, 1, 64]
    - [121, 0.0]
  - - [1600, 1280, 1, 64]
    - [69, 0.0]
  - - [1664, 1280, 1, 64]
    - [94, 0.0]
  - - [1728, 1280, 1, 64]
    - [68, 0.0]
  - - [1792, 1280, 1, 64]
    - [174, 0.0]
  - - [1856, 1280, 1, 64]
    - [35, 0.0]
  - - [1920, 1280, 1, 64]
    - [93, 0.0]
  - - [1984, 1280, 1, 64]
    - [70, 0.0]
  - - [2048, 1280, 1, 64]
    - [182, 0.0]
  - - [1024, 1344, 1, 64]
    - [123, 0.0]
  - - [1152, 1344, 1, 64]
    - [60, 0.0]
  - - [1280, 1344, 1, 64]
    - [93, 0.0]
  - - [1408, 1344, 1, 64]
    - [85, 0.0]
  - - [1536, 1344, 1, 64]
    - [182, 0.0]
  - - [1664, 1344, 1, 64]
    - [94, 0.0]
  - - [1792, 1344, 1, 64]
    - [93, 0.0]
  - - [1920, 1344, 1, 64]
    - [93, 0.0]
  - - [2048, 1344, 1, 64]
    - [93, 0.0]
  - - [1024, 1408, 1, 64]
    - [182, 0.0]
  - - [1088, 1408, 1, 64]
    - [69, 0.0]
  - - [1152, 1408, 1, 64]
    - [93, 0.0]
  - - [1216, 1408, 1, 64]
    - [47, 0.0]
  - - [1280, 1408, 1, 64]
    - [170, 0.0]
  - - [1344, 1408, 1, 64]
    - [70, 0.0]
  - - [1408, 1408, 1, 64]
    - [93, 0.0]
  - - [1472, 1408, 1, 64]
    - [68, 0.0]
  - - [1536, 1408, 1, 64]
    - [94, 0.0]
  - - [1600, 1408, 1, 64]
    - [162, 0.0]
  - - [1664, 1408, 1, 64]
    - [94, 0.0]
  - - [1728, 1408, 1, 64]
    - [70, 0.0]
  - - [1792, 1408, 1, 64]
    - [93, 0.0]
  - - [1856, 1408, 1, 64]
    - [69, 0.0]
  - - [1920, 1408, 1, 64]
    - [137, 0.0]
  - - [1984, 1408, 1, 64]
    - [70, 0.0]
  - - [2048, 1408, 1, 64]
    - [182, 0.0]
  - - [1024, 1472, 1, 64]
    - [93, 0.0]
  - - [1152, 1472, 1, 64]
    - [93, 0.0]
  - - [1280, 1472, 1, 64]
    - [93, 0.0]
  - - [1408, 1472, 1, 64]
    - [182, 0.0]
  - - [1536, 1472, 1, 64]
    - [94, 0.0]
  - - [1664, 1472, 1, 64]
    - [185, 0.0]
  - - [1792, 1472, 1, 64]
    - [123, 0.0]
  - - [1920, 1472, 1, 64]
    - [123, 0.0]
  - - [2048, 1472, 1, 64]
    - [170, 0.0]
  - - [1024, 1536, 1, 64]
    - [94, 0.0]
  - - [1088, 1536, 1, 64]
    - [70, 0.0]
  - - [1152, 1536, 1, 64]
    - [94, 0.0]
  - - [1216, 1536, 1, 64]
    - [70, 0.0]
  - - [1280, 1536, 1, 64]
    - [93, 0.0]
  - - [1344, 1536, 1, 64]
    - [92, 0.0]
  - - [1408, 1536, 1, 64]
    - [182, 0.0]
  - - [1472, 1536, 1, 64]
    - [35, 0.0]
  - - [1536, 1536, 1, 64]
    - [182, 0.0]
  - - [1600, 1536, 1, 64]
    - [162, 0.0]
  - - [1664, 1536, 1, 64]
    - [181, 0.0]
  - - [1728, 1536, 1, 64]
    - [33, 0.0]
  - - [1792, 1536, 1, 64]
    - [94, 0.0]
  - - [1856, 1536, 1, 64]
    - [69, 0.0]
  - - [1920, 1536, 1, 64]
    - [94, 0.0]
  - - [1984, 1536, 1, 64]
    - [70, 0.0]
  - - [2048, 1536, 1, 64]
    - [94, 0.0]
  - - [1024, 1600, 1, 64]
    - [182, 0.0]
  - - [1152, 1600, 1, 64]
    - [93, 0.0]
  - - [1280, 1600, 1, 64]
    - [182, 0.0]
  - - [1408, 1600, 1, 64]
    - [170, 0.0]
  - - [1536, 1600, 1, 64]
    - [169, 0.0]
  - - [1664, 1600, 1, 64]
    - [182, 0.0]
  - - [1792, 1600, 1, 64]
    - [93, 0.0]
  - - [1920, 1600, 1, 64]
    - [170, 0.0]
  - - [2048, 1600, 1, 64]
    - [174, 0.0]
  - - [1024, 1664, 1, 64]
    - [93, 0.0]
  - - [1088, 1664, 1, 64]
    - [69, 0.0]
  - - [1152, 1664, 1, 64]
    - [93, 0.0]
  - - [1216, 1664, 1, 64]
    - [83, 0.0]
  - - [1280, 1664, 1, 64]
    - [71, 0.0]
  - - [1344, 1664, 1, 64]
    - [41, 0.0]
  - - [1408, 1664, 1, 64]
    - [168, 0.0]
  - - [1472, 1664, 1, 64]
    - [70, 0.0]
  - - [1536, 1664, 1, 64]
    - [182, 0.0]
  - - [1600, 1664, 1, 64]
    - [70, 0.0]
  - - [1664, 1664, 1, 64]
    - [94, 0.0]
  - - [1728, 1664, 1, 64]
    - [70, 0.0]
  - - [1792, 1664, 1, 64]
    - [94, 0.0]
  - - [1856, 1664, 1, 64]
    - [162, 0.0]
  - - [1920, 1664, 1, 64]
    - [94, 0.0]
  - - [1984, 1664, 1, 64]
    - [70, 0.0]
  - - [2048, 1664, 1, 64]
    - [93, 0.0]
  - - [1024, 1728, 1, 64]
    - [93, 0.0]
  - - [1152, 1728, 1, 64]
    - [93, 0.0]
  - - [1280, 1728, 1, 64]
    - [182, 0.0]
  - - [1408, 1728, 1, 64]
    - [93, 0.0]
  - - [1536, 1728, 1, 64]
    - [94, 0.0]
  - - [1664, 1728, 1, 64]
    - [93, 0.0]
  - - [1792, 1728, 1, 64]
    - [93, 0.0]
  - - [1920, 1728, 1, 64]
    - [182, 0.0]
  - - [2048, 1728, 1, 64]
    - [93, 0.0]
  - - [1024, 1792, 1, 64]
    - [182, 0.0]
  - - [1088, 1792, 1, 64]
    - [69, 0.0]
  - - [1152, 1792, 1, 64]
    - [172, 0.0]
  - - [1216, 1792, 1, 64]
    - [70, 0.0]
  - - [1280, 1792, 1, 64]
    - [94, 0.0]
  - - [1344, 1792, 1, 64]
    - [92, 0.0]
  - - [1408, 1792, 1, 64]
    - [93, 0.0]
  - - [1472, 1792, 1, 64]
    - [70, 0.0]
  - - [1536, 1792, 1, 64]
    - [94, 0.0]
  - - [1600, 1792, 1, 64]
    - [69, 0.0]
  - - [1664, 1792, 1, 64]
    - [93, 0.0]
  - - [1728, 1792, 1, 64]
    - [69, 0.0]
  - - [1792, 1792, 1, 64]
    - [94, 0.0]
  - - [1856, 1792, 1, 64]
    - [69, 0.0]
  - - [1920, 1792, 1, 64]
    - [93, 0.0]
  - - [1984, 1792, 1, 64]
    - [70, 0.0]
  - - [2048, 1792, 1, 64]
    - [93, 0.0]
  - - [1024, 1856, 1, 64]
    - [172, 0.0]
  - - [1152, 1856, 1, 64]
    - [183, 0.0]
  - - [1280, 1856, 1, 64]
    - [93, 0.0]
  - - [1408, 1856, 1, 64]
    - [93, 0.0]
  - - [1536, 1856, 1, 64]
    - [94, 0.0]
  - - [1664, 1856, 1, 64]
    - [93, 0.0]
  - - [1792, 1856, 1, 64]
    - [94, 0.0]
  - - [1920, 1856, 1, 64]
    - [182, 0.0]
  - - [2048, 1856, 1, 64]
    - [181, 0.0]
  - - [1024, 1920, 1, 64]
    - [93, 0.0]
  - - [1088, 1920, 1, 64]
    - [69, 0.0]
  - - [1152, 1920, 1, 64]
    - [185, 0.0]
  - - [1216, 1920, 1, 64]
    - [69, 0.0]
  - - [1280, 1920, 1, 64]
    - [71, 0.0]
  - - [1344, 1920, 1, 64]
    - [70, 0.0]
  - - [1408, 1920, 1, 64]
    - [121, 0.0]
  - - [1472, 1920, 1, 64]
    - [70, 0.0]
  - - [1536, 1920, 1, 64]
    - [181, 0.0]
  - - [1600, 1920, 1, 64]
    - [70, 0.0]
  - - [1664, 1920, 1, 64]
    - [71, 0.0]
  - - [1728, 1920, 1, 64]
    - [69, 0.0]
  - - [1792, 1920, 1, 64]
    - [94, 0.0]
  - - [1856, 1920, 1, 64]
    - [70, 0.0]
  - - [1920, 1920, 1, 64]
    - [160, 0.0]
  - - [1984, 1920, 1, 64]
    - [70, 0.0]
  - - [2048, 1920, 1, 64]
    - [121, 0.0]
  - - [1024, 1984, 1, 64]
    - [94, 0.0]
  - - [1152, 1984, 1, 64]
    - [93, 0.0]
  - - [1280, 1984, 1, 64]
    - [93, 0.0]
  - - [1408, 1984, 1, 64]
    - [186, 0.0]
  - - [1536, 1984, 1, 64]
    - [137, 0.0]
  - - [1664, 1984, 1, 64]
    - [93, 0.0]
  - - [1792, 1984, 1, 64]
    - [182, 0.0]
  - - [1920, 1984, 1, 64]
    - [94, 0.0]
  - - [2048, 1984, 1, 64]
    - [169, 0.0]
  - - [1024, 2048, 1, 64]
    - [94, 0.0]
  - - [1088, 2048, 1, 64]
    - [33, 0.0]
  - - [1152, 2048, 1, 64]
    - [174, 0.0]
  - - [1216, 2048, 1, 64]
    - [92, 0.0]
  - - [1280, 2048, 1, 64]
    - [93, 0.0]
  - - [1344, 2048, 1, 64]
    - [92, 0.0]
  - - [1408, 2048, 1, 64]
    - [182, 0.0]
  - - [1472, 2048, 1, 64]
    - [69, 0.0]
  - - [1536, 2048, 1, 64]
    - [94, 0.0]
  - - [1600, 2048, 1, 64]
    - [92, 0.0]
  - - [1664, 2048, 1, 64]
    - [94, 0.0]
  - - [1728, 2048, 1, 64]
    - [70, 0.0]
  - - [1792, 2048, 1, 64]
    - [94, 0.0]
  - - [1856, 2048, 1, 64]
    - [162, 0.0]
  - - [1920, 2048, 1, 64]
    - [121, 0.0]
  - - [1984, 2048, 1, 64]
    - [70, 0.0]
  - - [2048, 2048, 1, 64]
    - [93, 0.0]
  - - [1088, 1024, 1, 256]
    - [83, 0.0]
  - - [1152, 1024, 1, 256]
    - [121, 0.0]
  - - [1216, 1024, 1, 256]
    - [49, 0.0]
  - - [1280, 1024, 1, 256]
    - [122, 0.0]
  - - [1344, 1024, 1, 256]
    - [41, 0.0]
  - - [1408, 1024, 1, 256]
    - [93, 0.0]
  - - [1472, 1024, 1, 256]
    - [35, 0.0]
  - - [1536, 1024, 1, 256]
    - [121, 0.0]
  - - [1600, 1024, 1, 256]
    - [41, 0.0]
  - - [1664, 1024, 1, 256]
    - [94, 0.0]
  - - [1728, 1024, 1, 256]
    - [49, 0.0]
  - - [1792, 1024, 1, 256]
    - [94, 0.0]
  - - [1856, 1024, 1, 256]
    - [47, 0.0]
  - - [1920, 1024, 1, 256]
    - [93, 0.0]
  - - [1984, 1024, 1, 256]
    - [49, 0.0]
  - - [2048, 1024, 1, 256]
    - [93, 0.0]
  - - [1024, 1088, 1, 256]
    - [46, 0.0]
  - - [1152, 1088, 1, 256]
    - [53, 0.0]
  - - [1280, 1088, 1, 256]
    - [93, 0.0]
  - - [1408, 1088, 1, 256]
    - [42, 0.0]
  - - [1536, 1088, 1, 256]
    - [93, 0.0]
  - - [1664, 1088, 1, 256]
    - [94, 0.0]
  - - [1792, 1088, 1, 256]
    - [93, 0.0]
  - - [1920, 1088, 1, 256]
    - [93, 0.0]
  - - [2048, 1088, 1, 256]
    - [93, 0.0]
