projects/hipblaslt/library/src/amd_detail/rocblaslt/src/Tensile/Logic/asm_full/gfx1201/GridBased/gfx1201_Cijk_Ailk_Bjlk_HHS_BH_Bias_SHB_HA_S_SAB_SCD_SAV_UserArgs.yaml
- {MinimumRequiredVersion: 5.0.0}
- gfx1201
- gfx1201
- [Device 73f0]
    SolutionIndex: 0
    SolutionNameMin: Cijk_Ailk_Bjlk_HHS_BH_Bias_HAS_SAV_UserArgs_MT64x32x32_MI16x16x1_SN_CLR1_GSU1_LBSPPA1024_LBSPPB512_MIWT2_1_PGR1_PLR1_SS0_SU32_SUM1_SUS256_SVW8_WG32_4_1_WGM8
    SolutionIndex: 1
    SolutionNameMin: Cijk_Ailk_Bjlk_HHS_BH_Bias_HAS_SAV_UserArgs_MT64x32x32_MI16x16x1_SN_CLR1_GSU1_LBSPPA1024_LBSPPB512_MIWT2_1_PGR2_PLR1_SS0_SU32_SUM1_SUS256_SVW8_WG32_4_1_WGM8
    SolutionIndex: 2
    SolutionNameMin: Cijk_Ailk_Bjlk_HHS_BH_Bias_HAS_SAV_UserArgs_MT64x32x32_MI16x16x1_SN_CLR0_GSU1_LBSPPA1024_LBSPPB512_MIWT2_1_PGR1_PLR0_SS0_SU32_SUM1_SUS256_SVW8_WG32_4_1_WGM8
    SolutionIndex: 3
    SolutionNameMin: Cijk_Ailk_Bjlk_HHS_BH_Bias_HAS_SAV_UserArgs_MT64x32x32_MI16x16x1_SN_CLR0_GSU1_LBSPPA1024_LBSPPB512_MIWT2_1_PGR2_PLR0_SS0_SU32_SUM1_SUS256_SVW8_WG32_4_1_WGM8
    SolutionIndex: 4
    SolutionNameMin: Cijk_Ailk_Bjlk_HHS_BH_Bias_HAS_SAV_UserArgs_MT32x64x32_MI16x16x1_SN_CLR1_GSU1_LBSPPA512_LBSPPB1024_MIWT2_1_PGR1_PLR1_SS0_SU32_SUM1_SUS256_SVW8_WG16_8_1_WGM8
    SolutionIndex: 5
    SolutionNameMin: Cijk_Ailk_Bjlk_HHS_BH_Bias_HAS_SAV_UserArgs_MT32x64x32_MI16x16x1_SN_CLR1_GSU1_LBSPPA512_LBSPPB1024_MIWT2_1_PGR2_PLR1_SS0_SU32_SUM1_SUS256_SVW8_WG16_8_1_WGM8
    SolutionIndex: 6
    SolutionNameMin: Cijk_Ailk_Bjlk_HHS_BH_Bias_HAS_SAV_UserArgs_MT32x64x32_MI16x16x1_SN_CLR0_GSU1_LBSPPA512_LBSPPB1024_MIWT2_1_PGR1_PLR0_SS0_SU32_SUM1_SUS256_SVW8_WG16_8_1_WGM8
    SolutionIndex: 7
    SolutionNameMin: Cijk_Ailk_Bjlk_HHS_BH_Bias_HAS_SAV_UserArgs_MT32x64x32_MI16x16x1_SN_CLR0_GSU1_LBSPPA512_LBSPPB1024_MIWT2_1_PGR2_PLR0_SS0_SU32_SUM1_SUS256_SVW8_WG16_8_1_WGM8
    SolutionIndex: 8
    SolutionNameMin: Cijk_Ailk_Bjlk_HHS_BH_Bias_HAS_SAV_UserArgs_MT32x32x64_MI16x16x1_SN_CLR1_GSU1_LBSPPA512_LBSPPB512_MIWT1_1_PGR1_PLR1_SS0_SU32_SUM1_SUS256_SVW8_WG32_4_1_WGM8
    SolutionIndex: 9
    SolutionNameMin: Cijk_Ailk_Bjlk_HHS_BH_Bias_HAS_SAV_UserArgs_MT64x32x64_MI16x16x1_SN_CLR1_GSU1_LBSPPA1024_LBSPPB512_MIWT2_1_PGR1_PLR3_SS0_SU32_SUM1_SUS256_SVW8_WG32_4_1_WGM8
    SolutionIndex: 10
    SolutionNameMin: Cijk_Ailk_Bjlk_HHS_BH_Bias_HAS_SAV_UserArgs_MT64x16x32_MI16x16x1_SN_CLR1_GSU1_LBSPPA1024_LBSPPB256_MIWT1_1_PGR2_PLR1_SS1_SU32_SUM1_SUS256_SVW1_WG64_2_1_WGM8
    SolutionIndex: 11
    SolutionNameMin: Cijk_Ailk_Bjlk_HHS_BH_Bias_HAS_SAV_UserArgs_MT64x16x32_MI16x16x1_SN_CLR0_GSU1_LBSPPA1024_LBSPPB256_MIWT1_1_PGR2_PLR0_SS1_SU32_SUM1_SUS256_SVW1_WG64_2_1_WGM8
    SolutionIndex: 12
    SolutionNameMin: Cijk_Ailk_Bjlk_HHS_BH_Bias_HAS_SAV_UserArgs_MT32x32x32_MI16x16x1_SN_CLR0_GSU1_LBSPPA512_LBSPPB512_MIWT1_1_PGR2_PLR0_SS1_SU32_SUM1_SUS256_SVW1_WG32_4_1_WGM8
    SolutionIndex: 13
    SolutionNameMin: Cijk_Ailk_Bjlk_HHS_BH_Bias_HAS_SAV_UserArgs_MT64x32x32_MI16x16x1_SN_CLR1_GSU1_LBSPPA1024_LBSPPB512_MIWT2_1_PGR1_PLR1_SS1_SU32_SUM1_SUS256_SVW1_WG32_4_1_WGM8
    SolutionIndex: 14
    SolutionNameMin: Cijk_Ailk_Bjlk_HHS_BH_Bias_HAS_SAV_UserArgs_MT64x32x32_MI16x16x1_SN_CLR1_GSU1_LBSPPA1024_LBSPPB512_MIWT2_1_PGR2_PLR1_SS1_SU32_SUM1_SUS256_SVW1_WG32_4_1_WGM8
    SolutionIndex: 15
    SolutionNameMin: Cijk_Ailk_Bjlk_HHS_BH_Bias_HAS_SAV_UserArgs_MT32x64x32_MI16x16x1_SN_CLR1_GSU1_LBSPPA512_LBSPPB1024_MIWT2_1_PGR1_PLR1_SS1_SU32_SUM1_SUS256_SVW1_WG16_8_1_WGM8
    SolutionIndex: 16
    SolutionNameMin: Cijk_Ailk_Bjlk_HHS_BH_Bias_HAS_SAV_UserArgs_MT32x64x32_MI16x16x1_SN_CLR0_GSU1_LBSPPA512_LBSPPB1024_MIWT2_1_PGR1_PLR0_SS1_SU32_SUM1_SUS256_SVW1_WG16_8_1_WGM8
    SolutionIndex: 17
    SolutionNameMin: Cijk_Ailk_Bjlk_HHS_BH_Bias_HAS_SAV_UserArgs_MT64x32x64_MI16x16x1_SN_CLR1_GSU1_LBSPPA1024_LBSPPB512_MIWT2_1_PGR1_PLR1_SS1_SU32_SUM1_SUS256_SVW1_WG32_4_1_WGM8
    SolutionIndex: 114
    SolutionNameMin: Cijk_Ailk_Bjlk_HHS_BH_Bias_SHB_HA_S_SAB_SCD_SAV_UserArgs_MT32x32x64_MI16x16x1_SN_LDSB1_AFC1_AFEM1_AFEM1_ASEM1_CLR1_CADS0_DTLA0_DTLB0_DTVA0_DTVB0_EPS0_FDSI0_GRPM1_GRVWA1_GRVWB1_GSU1_GSUAMB_GSUC0_GSUWGMRR0_GLS0_ISA1201_IU4_K1_LBSPPA512_LBSPPB512_LBSPPM0_LPA16_LPB16_LPM0_LRVW8_LWPMn1_MIAV1_MIWT1_1_MO40_NTn1_NTA0_NTB0_NTC0_NTD0_NTM0_NEPBS0_NLCA1_NLCB1_ONLL0_PGR2_PLR1_PKA0_SIA2_SS0_SU32_SUM1_SUS256_SPO0_SRVW0_SSO0_SVW8_SK0_SKXCCM0_TLDS0_ULSGRO0_USL1_UIOFGRO0_USFGROn1_VSn1_VWA1_VWB1_WSGRA0_WSGRB0_WS32_WG32_4_1_WGM8_WGMXCC1_WGMXCCGn1
    SolutionIndex: 115
    SolutionNameMin: Cijk_Ailk_Bjlk_HHS_BH_Bias_SHB_HA_S_SAB_SCD_SAV_UserArgs_MT32x16x32_MI16x16x1_SN_LDSB1_AFC1_AFEM1_AFEM1_ASEM1_CLR1_CADS0_DTLA0_DTLB0_DTVA0_DTVB0_EPS0_FDSI0_GRPM1_GRVWA1_GRVWB1_GSU1_GSUAMB_GSUC0_GSUWGMRR0_GLS0_ISA1201_IU2_K1_LBSPPA512_LBSPPB256_LBSPPM0_LPA16_LPB16_LPM0_LRVW8_LWPMn1_MIAV1_MIWT1_1_MO40_NTn1_NTA0_NTB0_NTC0_NTD0_NTM0_NEPBS0_NLCA1_NLCB1_ONLL0_PGR2_PLR1_PKA0_SIA2_SS1_SU32_SUM1_SUS256_SPO0_SRVW0_SSO0_SVW1_SK0_SKXCCM0_TLDS0_ULSGRO1_USL1_UIOFGRO0_USFGROn1_VSn1_VWA1_VWB1_WSGRA0_WSGRB0_WS32_WG32_2_1_WGM8_WGMXCC1_WGMXCCGn1
    SolutionIndex: 116
    SolutionNameMin: Cijk_Ailk_Bjlk_HHS_BH_Bias_SHB_HA_S_SAB_SCD_SAV_UserArgs_MT32x16x32_MI16x16x1_SN_LDSB1_AFC1_AFEM1_AFEM1_ASEM1_CLR1_CADS0_DTLA0_DTLB0_DTVA0_DTVB0_EPS0_FDSI0_GRPM1_GRVWA1_GRVWB1_GSU1_GSUAMB_GSUC0_GSUWGMRR0_GLS0_ISA1201_IU2_K1_LBSPPA512_LBSPPB256_LBSPPM0_LPA16_LPB16_LPM0_LRVW8_LWPMn1_MIAV1_MIWT1_1_MO40_NTn1_NTA0_NTB0_NTC0_NTD0_NTM0_NEPBS0_NLCA1_NLCB1_ONLL0_PGR2_PLR1_PKA0_SIA2_SS0_SU32_SUM1_SUS256_SPO0_SRVW0_SSO0_SVW8_SK0_SKXCCM0_TLDS0_ULSGRO0_USL1_UIOFGRO0_USFGROn1_VSn1_VWA1_VWB1_WSGRA0_WSGRB0_WS32_WG32_2_1_WGM8_WGMXCC1_WGMXCCGn1
    SolutionIndex: 117
    SolutionNameMin: Cijk_Ailk_Bjlk_HHS_BH_Bias_SHB_HA_S_SAB_SCD_SAV_UserArgs_MT16x32x64_MI16x16x1_SN_LDSB1_AFC1_AFEM1_AFEM1_ASEM1_CLR1_CADS0_DTLA0_DTLB0_DTVA0_DTVB0_EPS0_FDSI0_GRPM1_GRVWA8_GRVWB8_GSU1_GSUAMB_GSUC0_GSUWGMRR0_GLS0_ISA1201_IU4_K1_LBSPPA256_LBSPPB512_LBSPPM0_LPA16_LPB16_LPM0_LRVW8_LWPMn1_MIAV1_MIWT1_1_MO40_NTn1_NTA0_NTB0_NTC0_NTD0_NTM0_NEPBS0_NLCA1_NLCB1_ONLL0_PGR2_PLR1_PKA0_SIA2_SS1_SU32_SUM1_SUS256_SPO0_SRVW0_SSO0_SVW1_SK0_SKXCCM0_TLDS0_ULSGRO0_USL1_UIOFGRO0_USFGROn1_VSn1_VWA1_VWB1_WSGRA0_WSGRB0_WS32_WG16_4_1_WGM8_WGMXCC1_WGMXCCGn1
    SolutionIndex: 118
    SolutionNameMin: Cijk_Ailk_Bjlk_HHS_BH_Bias_SHB_HA_S_SAB_SCD_SAV_UserArgs_MT32x32x64_MI16x16x1_SN_LDSB0_AFC1_AFEM1_AFEM1_ASEM1_CLR1_CADS0_DTLA0_DTLB0_DTVA1_DTVB1_EPS0_FDSI0_GRPM1_GRVWA8_GRVWB8_GSU1_GSUAMB_GSUC0_GSUWGMRR0_GLS0_ISA1201_IU1_K1_LBSPPA0_LBSPPB0_LBSPPM0_LPA0_LPB0_LPM0_LRVW8_LWPMn1_MIAV1_MIWT1_1_MO40_NTn1_NTA0_NTB0_NTC0_NTD0_NTM0_NEPBS0_NLCA1_NLCB1_ONLL0_PGR1_PLR0_PKA0_SIA3_SS0_SU32_SUM1_SUS256_SPO0_SRVW0_SSO0_SVW8_SK0_SKXCCM0_TLDS0_ULSGRO0_USL1_UIOFGRO0_USFGROn1_VSn1_VWA1_VWB1_WSGRA0_WSGRB0_WS32_WG32_4_1_WGM8_WGMXCC1_WGMXCCGn1
    SolutionIndex: 119
    SolutionNameMin: Cijk_Ailk_Bjlk_HHS_BH_Bias_SHB_HA_S_SAB_SCD_SAV_UserArgs_MT32x32x32_MI16x16x1_SN_LDSB1_AFC1_AFEM1_AFEM1_ASEM1_CLR1_CADS0_DTLA0_DTLB0_DTVA0_DTVB0_EPS1_FDSI0_GRPM1_GRVWA1_GRVWB1_GSU1_GSUAMB_GSUC0_GSUWGMRR0_GLS0_ISA1201_IU2_K1_LBSPPA512_LBSPPB512_LBSPPM0_LPA16_LPB16_LPM0_LRVW8_LWPMn1_MIAV1_MIWT1_1_MO40_NTn1_NTA0_NTB0_NTC0_NTD0_NTM0_NEPBS0_NLCA1_NLCB1_ONLL0_PGR1_PLR1_PKA0_SIA2_SS0_SU32_SUM1_SUS256_SPO0_SRVW0_SSO0_SVW8_SK0_SKXCCM0_TLDS0_ULSGRO0_USL1_UIOFGRO0_USFGROn1_VSn1_VWA1_VWB1_WSGRA0_WSGRB0_WS32_WG32_4_1_WGM8_WGMXCC1_WGMXCCGn1
    SolutionIndex: 120
    SolutionNameMin: Cijk_Ailk_Bjlk_HHS_BH_Bias_SHB_HA_S_SAB_SCD_SAV_UserArgs_MT32x32x32_MI16x16x1_SN_LDSB0_AFC1_AFEM1_AFEM1_ASEM1_CLR1_CADS0_DTLA0_DTLB0_DTVA0_DTVB0_EPS0_FDSI0_GRPM1_GRVWA1_GRVWB4_GSU1_GSUAMB_GSUC0_GSUWGMRR0_GLS0_ISA1201_IU1_K1_LBSPPA512_LBSPPB512_LBSPPM0_LPA16_LPB16_LPM0_LRVW8_LWPMn1_MIAV1_MIWT1_1_MO40_NTn1_NTA0_NTB0_NTC0_NTD0_NTM0_NEPBS0_NLCA1_NLCB1_ONLL0_PGR2_PLR1_PKA0_SIA3_SS0_SU32_SUM1_SUS256_SPO0_SRVW0_SSO0_SVW8_SK0_SKXCCM0_TLDS0_ULSGRO1_USL1_UIOFGRO0_USFGROn1_VSn1_VWA1_VWB1_WSGRA0_WSGRB0_WS32_WG32_4_1_WGM8_WGMXCC1_WGMXCCGn1
    SolutionIndex: 121
    SolutionNameMin: Cijk_Ailk_Bjlk_HHS_BH_Bias_SHB_HA_S_SAB_SCD_SAV_UserArgs_MT32x32x64_MI16x16x1_SN_LDSB0_AFC1_AFEM1_AFEM1_ASEM1_CLR1_CADS0_DTLA0_DTLB0_DTVA0_DTVB0_EPS1_FDSI0_GRPM1_GRVWA4_GRVWB8_GSU1_GSUAMB_GSUC0_GSUWGMRR0_GLS0_ISA1201_IU1_K1_LBSPPA512_LBSPPB512_LBSPPM0_LPA16_LPB16_LPM0_LRVW8_LWPMn1_MIAV1_MIWT1_1_MO40_NTn1_NTA0_NTB0_NTC0_NTD0_NTM0_NEPBS0_NLCA1_NLCB1_ONLL0_PGR1_PLR1_PKA0_SIA3_SS0_SU32_SUM1_SUS256_SPO0_SRVW0_SSO0_SVW8_SK0_SKXCCM0_TLDS0_ULSGRO0_USL1_UIOFGRO0_USFGROn1_VSn1_VWA1_VWB1_WSGRA0_WSGRB0_WS32_WG32_4_1_WGM8_WGMXCC1_WGMXCCGn1
    SolutionIndex: 122
    SolutionNameMin: Cijk_Ailk_Bjlk_HHS_BH_Bias_SHB_HA_S_SAB_SCD_SAV_UserArgs_MT32x32x64_MI16x16x1_SN_LDSB0_AFC1_AFEM1_AFEM1_ASEM1_CLR1_CADS0_DTLA0_DTLB0_DTVA0_DTVB1_EPS0_FDSI0_GRPM1_GRVWA4_GRVWB8_GSU1_GSUAMB_GSUC0_GSUWGMRR0_GLS0_ISA1201_IU1_K1_LBSPPA512_LBSPPB0_LBSPPM0_LPA16_LPB0_LPM0_LRVW8_LWPMn1_MIAV1_MIWT1_1_MO40_NTn1_NTA0_NTB0_NTC0_NTD0_NTM0_NEPBS0_NLCA1_NLCB1_ONLL0_PGR2_PLR1_PKA0_SIA3_SS0_SU32_SUM1_SUS256_SPO0_SRVW0_SSO0_SVW8_SK0_SKXCCM0_TLDS0_ULSGRO0_USL1_UIOFGRO0_USFGROn1_VSn1_VWA1_VWB1_WSGRA0_WSGRB0_WS32_WG32_4_1_WGM8_WGMXCC1_WGMXCCGn1
    SolutionIndex: 123
    SolutionNameMin: Cijk_Ailk_Bjlk_HHS_BH_Bias_SHB_HA_S_SAB_SCD_SAV_UserArgs_MT32x32x64_MI16x16x1_SN_LDSB1_AFC1_AFEM1_AFEM1_ASEM1_CLR1_CADS0_DTLA0_DTLB0_DTVA0_DTVB0_EPS1_FDSI0_GRPM1_GRVWA1_GRVWB1_GSU1_GSUAMB_GSUC0_GSUWGMRR0_GLS0_ISA1201_IU4_K1_LBSPPA512_LBSPPB512_LBSPPM0_LPA16_LPB16_LPM0_LRVW8_LWPMn1_MIAV1_MIWT1_1_MO40_NTn1_NTA0_NTB0_NTC0_NTD0_NTM0_NEPBS0_NLCA1_NLCB1_ONLL0_PGR1_PLR1_PKA0_SIA2_SS0_SU32_SUM1_SUS256_SPO0_SRVW0_SSO0_SVW8_SK0_SKXCCM0_TLDS0_ULSGRO0_USL1_UIOFGRO0_USFGROn1_VSn1_VWA1_VWB1_WSGRA0_WSGRB0_WS32_WG32_4_1_WGM8_WGMXCC1_WGMXCCGn1
    SolutionIndex: 124
    SolutionNameMin: Cijk_Ailk_Bjlk_HHS_BH_Bias_SHB_HA_S_SAB_SCD_SAV_UserArgs_MT32x32x32_MI16x16x1_SN_LDSB0_AFC1_AFEM1_AFEM1_ASEM1_CLR1_CADS0_DTLA0_DTLB0_DTVA0_DTVB0_EPS0_FDSI0_GRPM1_GRVWA4_GRVWB4_GSU1_GSUAMB_GSUC0_GSUWGMRR0_GLS0_ISA1201_IU1_K1_LBSPPA512_LBSPPB512_LBSPPM0_LPA16_LPB16_LPM0_LRVW8_LWPMn1_MIAV1_MIWT1_1_MO40_NTn1_NTA0_NTB0_NTC0_NTD0_NTM0_NEPBS0_NLCA1_NLCB1_ONLL0_PGR2_PLR1_PKA0_SIA3_SS0_SU32_SUM1_SUS256_SPO0_SRVW0_SSO0_SVW8_SK0_SKXCCM0_TLDS0_ULSGRO0_USL1_UIOFGRO0_USFGROn1_VSn1_VWA1_VWB1_WSGRA0_WSGRB0_WS32_WG32_4_1_WGM8_WGMXCC1_WGMXCCGn1
    SolutionIndex: 125
    SolutionNameMin: Cijk_Ailk_Bjlk_HHS_BH_Bias_SHB_HA_S_SAB_SCD_SAV_UserArgs_MT16x32x64_MI16x16x1_SN_LDSB0_AFC1_AFEM1_AFEM1_ASEM1_CLR1_CADS0_DTLA0_DTLB0_DTVA0_DTVB1_EPS1_FDSI0_GRPM1_GRVWA4_GRVWB8_GSU1_GSUAMB_GSUC0_GSUWGMRR0_GLS0_ISA1201_IU1_K1_LBSPPA256_LBSPPB0_LBSPPM0_LPA16_LPB0_LPM0_LRVW8_LWPMn1_MIAV1_MIWT1_1_MO40_NTn1_NTA0_NTB0_NTC0_NTD0_NTM0_NEPBS0_NLCA1_NLCB1_ONLL0_PGR1_PLR1_PKA0_SIA3_SS0_SU32_SUM1_SUS256_SPO0_SRVW0_SSO0_SVW8_SK0_SKXCCM0_TLDS0_ULSGRO0_USL1_UIOFGRO0_USFGROn1_VSn1_VWA1_VWB1_WSGRA0_WSGRB0_WS32_WG16_4_1_WGM8_WGMXCC1_WGMXCCGn1
    SolutionIndex: 126
    SolutionNameMin: Cijk_Ailk_Bjlk_HHS_BH_Bias_SHB_HA_S_SAB_SCD_SAV_UserArgs_MT32x16x32_MI16x16x1_SN_LDSB0_AFC1_AFEM1_AFEM1_ASEM1_CLR1_CADS0_DTLA0_DTLB0_DTVA0_DTVB0_EPS0_FDSI0_GRPM1_GRVWA1_GRVWB1_GSU1_GSUAMB_GSUC0_GSUWGMRR0_GLS0_ISA1201_IU1_K1_LBSPPA512_LBSPPB256_LBSPPM0_LPA16_LPB16_LPM0_LRVW8_LWPMn1_MIAV1_MIWT1_1_MO40_NTn1_NTA0_NTB0_NTC0_NTD0_NTM0_NEPBS0_NLCA1_NLCB1_ONLL0_PGR2_PLR1_PKA0_SIA3_SS0_SU32_SUM1_SUS256_SPO0_SRVW0_SSO0_SVW8_SK0_SKXCCM0_TLDS0_ULSGRO1_USL1_UIOFGRO0_USFGROn1_VSn1_VWA1_VWB1_WSGRA0_WSGRB0_WS32_WG32_2_1_WGM8_WGMXCC1_WGMXCCGn1
    SolutionIndex: 127
    SolutionNameMin: Cijk_Ailk_Bjlk_HHS_BH_Bias_SHB_HA_S_SAB_SCD_SAV_UserArgs_MT32x32x64_MI16x16x1_SN_LDSB0_AFC1_AFEM1_AFEM1_ASEM1_CLR1_CADS0_DTLA0_DTLB0_DTVA0_DTVB0_EPS1_FDSI0_GRPM1_GRVWA1_GRVWB1_GSU1_GSUAMB_GSUC0_GSUWGMRR0_GLS0_ISA1201_IU1_K1_LBSPPA512_LBSPPB512_LBSPPM0_LPA16_LPB16_LPM0_LRVW8_LWPMn1_MIAV1_MIWT1_1_MO40_NTn1_NTA0_NTB0_NTC0_NTD0_NTM0_NEPBS0_NLCA1_NLCB1_ONLL0_PGR1_PLR1_PKA0_SIA3_SS0_SU32_SUM1_SUS256_SPO0_SRVW0_SSO0_SVW8_SK0_SKXCCM0_TLDS0_ULSGRO0_USL1_UIOFGRO0_USFGROn1_VSn1_VWA1_VWB1_WSGRA0_WSGRB0_WS32_WG32_4_1_WGM8_WGMXCC1_WGMXCCGn1
    SolutionIndex: 128
    SolutionNameMin: Cijk_Ailk_Bjlk_HHS_BH_Bias_SHB_HA_S_SAB_SCD_SAV_UserArgs_MT32x32x32_MI16x16x1_SN_LDSB1_AFC1_AFEM1_AFEM1_ASEM1_CLR1_CADS0_DTLA0_DTLB0_DTVA0_DTVB0_EPS0_FDSI0_GRPM1_GRVWA1_GRVWB4_GSU1_GSUAMB_GSUC0_GSUWGMRR0_GLS0_ISA1201_IU2_K1_LBSPPA512_LBSPPB512_LBSPPM0_LPA16_LPB16_LPM0_LRVW8_LWPMn1_MIAV1_MIWT1_1_MO40_NTn1_NTA0_NTB0_NTC0_NTD0_NTM0_NEPBS0_NLCA1_NLCB1_ONLL0_PGR2_PLR1_PKA0_SIA2_SS0_SU32_SUM1_SUS256_SPO0_SRVW0_SSO0_SVW8_SK0_SKXCCM0_TLDS0_ULSGRO1_USL1_UIOFGRO0_USFGROn1_VSn1_VWA1_VWB1_WSGRA0_WSGRB0_WS32_WG32_4_1_WGM8_WGMXCC1_WGMXCCGn1
    SolutionIndex: 129
    SolutionNameMin: Cijk_Ailk_Bjlk_HHS_BH_Bias_SHB_HA_S_SAB_SCD_SAV_UserArgs_MT32x32x64_MI16x16x1_SN_LDSB0_AFC1_AFEM1_AFEM1_ASEM1_CLR1_CADS0_DTLA0_DTLB0_DTVA0_DTVB0_EPS0_FDSI0_GRPM1_GRVWA1_GRVWB1_GSU1_GSUAMB_GSUC0_GSUWGMRR0_GLS0_ISA1201_IU1_K1_LBSPPA512_LBSPPB512_LBSPPM0_LPA16_LPB16_LPM0_LRVW8_LWPMn1_MIAV1_MIWT1_1_MO40_NTn1_NTA0_NTB0_NTC0_NTD0_NTM0_NEPBS0_NLCA1_NLCB1_ONLL0_PGR2_PLR1_PKA0_SIA3_SS0_SU32_SUM1_SUS256_SPO0_SRVW0_SSO0_SVW8_SK0_SKXCCM0_TLDS0_ULSGRO1_USL1_UIOFGRO0_USFGROn1_VSn1_VWA1_VWB1_WSGRA0_WSGRB0_WS32_WG32_4_1_WGM8_WGMXCC1_WGMXCCGn1
    SolutionIndex: 130
    SolutionNameMin: Cijk_Ailk_Bjlk_HHS_BH_Bias_SHB_HA_S_SAB_SCD_SAV_UserArgs_MT16x16x32_MI16x16x1_SN_LDSB0_AFC1_AFEM1_AFEM1_ASEM1_CLR1_CADS0_DTLA0_DTLB0_DTVA0_DTVB0_EPS0_FDSI0_GRPM1_GRVWA8_GRVWB8_GSU1_GSUAMB_GSUC0_GSUWGMRR0_GLS0_ISA1201_IU1_K1_LBSPPA256_LBSPPB256_LBSPPM0_LPA16_LPB16_LPM0_LRVW8_LWPMn1_MIAV1_MIWT1_1_MO40_NTn1_NTA0_NTB0_NTC0_NTD0_NTM0_NEPBS0_NLCA1_NLCB1_ONLL0_PGR2_PLR1_PKA0_SIA3_SS0_SU32_SUM1_SUS256_SPO0_SRVW0_SSO0_SVW8_SK0_SKXCCM0_TLDS0_ULSGRO1_USL1_UIOFGRO0_USFGROn1_VSn1_VWA1_VWB1_WSGRA0_WSGRB0_WS32_WG16_2_1_WGM8_WGMXCC1_WGMXCCGn1
    SolutionIndex: 131
    SolutionNameMin: Cijk_Ailk_Bjlk_HHS_BH_Bias_SHB_HA_S_SAB_SCD_SAV_UserArgs_MT16x32x32_MI16x16x1_SN_LDSB0_AFC1_AFEM1_AFEM1_ASEM1_CLR1_CADS0_DTLA0_DTLB0_DTVA0_DTVB0_EPS0_FDSI0_GRPM1_GRVWA1_GRVWB1_GSU1_GSUAMB_GSUC0_GSUWGMRR0_GLS0_ISA1201_IU1_K1_LBSPPA256_LBSPPB512_LBSPPM0_LPA16_LPB16_LPM0_LRVW8_LWPMn1_MIAV1_MIWT1_1_MO40_NTn1_NTA0_NTB0_NTC0_NTD0_NTM0_NEPBS0_NLCA1_NLCB1_ONLL0_PGR2_PLR1_PKA0_SIA3_SS0_SU32_SUM1_SUS256_SPO0_SRVW0_SSO0_SVW8_SK0_SKXCCM0_TLDS0_ULSGRO1_USL1_UIOFGRO0_USFGROn1_VSn1_VWA1_VWB1_WSGRA0_WSGRB0_WS32_WG16_4_1_WGM8_WGMXCC1_WGMXCCGn1
    SolutionIndex: 132
    SolutionNameMin: Cijk_Ailk_Bjlk_HHS_BH_Bias_SHB_HA_S_SAB_SCD_SAV_UserArgs_MT16x32x64_MI16x16x1_SN_LDSB0_AFC1_AFEM1_AFEM1_ASEM1_CLR1_CADS0_DTLA0_DTLB0_DTVA0_DTVB1_EPS0_FDSI0_GRPM1_GRVWA1_GRVWB8_GSU1_GSUAMB_GSUC0_GSUWGMRR0_GLS0_ISA1201_IU1_K1_LBSPPA256_LBSPPB0_LBSPPM0_LPA16_LPB0_LPM0_LRVW8_LWPMn1_MIAV1_MIWT1_1_MO40_NTn1_NTA0_NTB0_NTC0_NTD0_NTM0_NEPBS0_NLCA1_NLCB1_ONLL0_PGR2_PLR1_PKA0_SIA3_SS0_SU32_SUM1_SUS256_SPO0_SRVW0_SSO0_SVW8_SK0_SKXCCM0_TLDS0_ULSGRO0_USL1_UIOFGRO0_USFGROn1_VSn1_VWA1_VWB1_WSGRA0_WSGRB0_WS32_WG16_4_1_WGM8_WGMXCC1_WGMXCCGn1
    SolutionIndex: 133
    SolutionNameMin: Cijk_Ailk_Bjlk_HHS_BH_Bias_SHB_HA_S_SAB_SCD_SAV_UserArgs_MT64x64x64_MI16x16x1_SN_LDSB1_AFC1_AFEM1_AFEM1_ASEM1_CLR1_CADS0_DTLA0_DTLB0_DTVA0_DTVB0_EPS0_FDSI0_GRPM1_GRVWA4_GRVWB4_GSU1_GSUAMB_GSUC0_GSUWGMRR0_GLS0_ISA1201_IU4_K1_LBSPPA1024_LBSPPB1024_LBSPPM0_LPA32_LPB32_LPM0_LRVW8_LWPMn1_MIAV1_MIWT2_2_MO40_NTn1_NTA0_NTB0_NTC0_NTD0_NTM0_NEPBS0_NLCA1_NLCB1_ONLL0_PGR2_PLR1_PKA0_SIA2_SS0_SU32_SUM1_SUS256_SPO0_SRVW0_SSO0_SVW8_SK0_SKXCCM0_TLDS0_ULSGRO0_USL1_UIOFGRO0_USFGROn1_VSn1_VWA2_VWB2_WSGRA0_WSGRB0_WS32_WG32_4_1_WGM8_WGMXCC1_WGMXCCGn1
    SolutionIndex: 134
    SolutionNameMin: Cijk_Ailk_Bjlk_HHS_BH_Bias_SHB_HA_S_SAB_SCD_SAV_UserArgs_MT32x32x64_MI16x16x1_SN_LDSB1_AFC1_AFEM1_AFEM1_ASEM1_CLR1_CADS0_DTLA0_DTLB0_DTVA0_DTVB0_EPS0_FDSI0_GRPM1_GRVWA4_GRVWB4_GSU1_GSUAMB_GSUC0_GSUWGMRR0_GLS0_ISA1201_IU4_K1_LBSPPA512_LBSPPB512_LBSPPM0_LPA16_LPB16_LPM0_LRVW8_LWPMn1_MIAV1_MIWT1_1_MO40_NTn1_NTA0_NTB0_NTC0_NTD0_NTM0_NEPBS0_NLCA1_NLCB1_ONLL0_PGR2_PLR1_PKA0_SIA2_SS0_SU32_SUM1_SUS256_SPO0_SRVW0_SSO0_SVW8_SK0_SKXCCM0_TLDS0_ULSGRO1_USL1_UIOFGRO0_USFGROn1_VSn1_VWA1_VWB1_WSGRA0_WSGRB0_WS32_WG32_4_1_WGM8_WGMXCC1_WGMXCCGn1
    SolutionIndex: 135
    SolutionNameMin: Cijk_Ailk_Bjlk_HHS_BH_Bias_SHB_HA_S_SAB_SCD_SAV_UserArgs_MT64x64x32_MI16x16x1_SN_LDSB1_AFC1_AFEM1_AFEM1_ASEM1_CLR1_CADS0_DTLA0_DTLB0_DTVA0_DTVB0_EPS0_FDSI0_GRPM1_GRVWA8_GRVWB4_GSU1_GSUAMB_GSUC0_GSUWGMRR0_GLS0_ISA1201_IU2_K1_LBSPPA1024_LBSPPB1024_LBSPPM0_LPA32_LPB32_LPM0_LRVW8_LWPMn1_MIAV1_MIWT2_2_MO40_NTn1_NTA0_NTB0_NTC0_NTD0_NTM0_NEPBS0_NLCA1_NLCB1_ONLL0_PGR2_PLR1_PKA0_SIA2_SS0_SU32_SUM1_SUS256_SPO0_SRVW0_SSO0_SVW8_SK0_SKXCCM0_TLDS0_ULSGRO1_USL1_UIOFGRO0_USFGROn1_VSn1_VWA2_VWB2_WSGRA0_WSGRB0_WS32_WG32_4_1_WGM8_WGMXCC1_WGMXCCGn1
    SolutionIndex: 136
    SolutionNameMin: Cijk_Ailk_Bjlk_HHS_BH_Bias_SHB_HA_S_SAB_SCD_SAV_UserArgs_MT128x32x32_MI16x16x1_SN_LDSB1_AFC1_AFEM1_AFEM1_ASEM1_CLR1_CADS0_DTLA0_DTLB0_DTVA0_DTVB0_EPS1_FDSI0_GRPM1_GRVWA4_GRVWB8_GSU1_GSUAMB_GSUC0_GSUWGMRR0_GLS0_ISA1201_IU2_K1_LBSPPA2048_LBSPPB512_LBSPPM0_LPA0_LPB16_LPM0_LRVW8_LWPMn1_MIAV1_MIWT4_1_MO40_NTn1_NTA0_NTB0_NTC0_NTD0_NTM0_NEPBS0_NLCA1_NLCB1_ONLL0_PGR1_PLR1_PKA0_SIA2_SS1_SU32_SUM1_SUS256_SPO0_SRVW0_SSO0_SVW4_SK0_SKXCCM0_TLDS0_ULSGRO0_USL1_UIOFGRO0_USFGROn1_VSn1_VWA4_VWB1_WSGRA0_WSGRB0_WS32_WG32_4_1_WGM8_WGMXCC1_WGMXCCGn1
    SolutionIndex: 137
    SolutionNameMin: Cijk_Ailk_Bjlk_HHS_BH_Bias_SHB_HA_S_SAB_SCD_SAV_UserArgs_MT64x64x32_MI16x16x1_SN_LDSB0_AFC1_AFEM1_AFEM1_ASEM1_CLR1_CADS0_DTLA0_DTLB0_DTVA0_DTVB0_EPS0_FDSI0_GRPM1_GRVWA8_GRVWB4_GSU1_GSUAMB_GSUC0_GSUWGMRR0_GLS0_ISA1201_IU1_K1_LBSPPA1024_LBSPPB1024_LBSPPM0_LPA32_LPB32_LPM0_LRVW8_LWPMn1_MIAV1_MIWT2_2_MO40_NTn1_NTA0_NTB0_NTC0_NTD0_NTM0_NEPBS0_NLCA1_NLCB1_ONLL0_PGR2_PLR1_PKA0_SIA3_SS0_SU32_SUM1_SUS256_SPO0_SRVW0_SSO0_SVW8_SK0_SKXCCM0_TLDS0_ULSGRO0_USL1_UIOFGRO0_USFGROn1_VSn1_VWA2_VWB2_WSGRA0_WSGRB0_WS32_WG32_4_1_WGM8_WGMXCC1_WGMXCCGn1
    SolutionIndex: 138
    SolutionNameMin: Cijk_Ailk_Bjlk_HHS_BH_Bias_SHB_HA_S_SAB_SCD_SAV_UserArgs_MT64x64x32_MI16x16x1_SN_LDSB0_AFC1_AFEM1_AFEM1_ASEM1_CLR1_CADS0_DTLA0_DTLB0_DTVA0_DTVB0_EPS0_FDSI0_GRPM1_GRVWA4_GRVWB8_GSU1_GSUAMB_GSUC0_GSUWGMRR0_GLS0_ISA1201_IU1_K1_LBSPPA1024_LBSPPB1024_LBSPPM0_LPA32_LPB32_LPM0_LRVW8_LWPMn1_MIAV1_MIWT2_2_MO40_NTn1_NTA0_NTB0_NTC0_NTD0_NTM0_NEPBS0_NLCA1_NLCB1_ONLL0_PGR2_PLR1_PKA0_SIA3_SS0_SU32_SUM1_SUS256_SPO0_SRVW0_SSO0_SVW8_SK0_SKXCCM0_TLDS0_ULSGRO1_USL1_UIOFGRO0_USFGROn1_VSn1_VWA2_VWB2_WSGRA0_WSGRB0_WS32_WG32_4_1_WGM8_WGMXCC1_WGMXCCGn1
    SolutionIndex: 139
    SolutionNameMin: Cijk_Ailk_Bjlk_HHS_BH_Bias_SHB_HA_S_SAB_SCD_SAV_UserArgs_MT32x32x64_MI16x16x1_SN_LDSB1_AFC1_AFEM1_AFEM1_ASEM1_CLR1_CADS0_DTLA0_DTLB0_DTVA0_DTVB0_EPS0_FDSI0_GRPM1_GRVWA1_GRVWB1_GSU1_GSUAMB_GSUC0_GSUWGMRR0_GLS0_ISA1201_IU4_K1_LBSPPA512_LBSPPB512_LBSPPM0_LPA16_LPB16_LPM0_LRVW8_LWPMn1_MIAV1_MIWT1_1_MO40_NTn1_NTA0_NTB0_NTC0_NTD0_NTM0_NEPBS0_NLCA1_NLCB1_ONLL0_PGR2_PLR1_PKA0_SIA2_SS0_SU32_SUM1_SUS256_SPO0_SRVW0_SSO0_SVW8_SK0_SKXCCM0_TLDS0_ULSGRO1_USL1_UIOFGRO0_USFGROn1_VSn1_VWA1_VWB1_WSGRA0_WSGRB0_WS32_WG32_4_1_WGM8_WGMXCC1_WGMXCCGn1
    SolutionIndex: 140
    SolutionNameMin: Cijk_Ailk_Bjlk_HHS_BH_Bias_SHB_HA_S_SAB_SCD_SAV_UserArgs_MT32x32x32_MI16x16x1_SN_LDSB1_AFC1_AFEM1_AFEM1_ASEM1_CLR1_CADS0_DTLA0_DTLB0_DTVA0_DTVB0_EPS0_FDSI0_GRPM1_GRVWA4_GRVWB4_GSU1_GSUAMB_GSUC0_GSUWGMRR0_GLS0_ISA1201_IU2_K1_LBSPPA512_LBSPPB512_LBSPPM0_LPA16_LPB16_LPM0_LRVW8_LWPMn1_MIAV1_MIWT1_1_MO40_NTn1_NTA0_NTB0_NTC0_NTD0_NTM0_NEPBS0_NLCA1_NLCB1_ONLL0_PGR2_PLR1_PKA0_SIA2_SS0_SU32_SUM1_SUS256_SPO0_SRVW0_SSO0_SVW8_SK0_SKXCCM0_TLDS0_ULSGRO0_USL1_UIOFGRO0_USFGROn1_VSn1_VWA1_VWB1_WSGRA0_WSGRB0_WS32_WG32_4_1_WGM8_WGMXCC1_WGMXCCGn1
    SolutionIndex: 141
    SolutionNameMin: Cijk_Ailk_Bjlk_HHS_BH_Bias_SHB_HA_S_SAB_SCD_SAV_UserArgs_MT16x32x64_MI16x16x1_SN_LDSB0_AFC1_AFEM1_AFEM1_ASEM1_CLR1_CADS0_DTLA0_DTLB0_DTVA0_DTVB1_EPS1_FDSI0_GRPM1_GRVWA4_GRVWB8_GSU1_GSUAMB_GSUC0_GSUWGMRR0_GLS0_ISA1201_IU1_K1_LBSPPA256_LBSPPB0_LBSPPM0_LPA16_LPB0_LPM0_LRVW8_LWPMn1_MIAV1_MIWT1_1_MO40_NTn1_NTA0_NTB0_NTC0_NTD0_NTM0_NEPBS0_NLCA1_NLCB1_ONLL0_PGR1_PLR1_PKA0_SIA3_SS1_SU32_SUM1_SUS256_SPO0_SRVW0_SSO0_SVW1_SK0_SKXCCM0_TLDS0_ULSGRO0_USL1_UIOFGRO0_USFGROn1_VSn1_VWA1_VWB1_WSGRA0_WSGRB0_WS32_WG16_4_1_WGM8_WGMXCC1_WGMXCCGn1
    SolutionIndex: 142
    SolutionNameMin: Cijk_Ailk_Bjlk_HHS_BH_Bias_SHB_HA_S_SAB_SCD_SAV_UserArgs_MT32x32x32_MI16x16x1_SN_LDSB1_AFC1_AFEM1_AFEM1_ASEM1_CLR1_CADS0_DTLA0_DTLB0_DTVA0_DTVB0_EPS0_FDSI0_GRPM1_GRVWA1_GRVWB1_GSU1_GSUAMB_GSUC0_GSUWGMRR0_GLS0_ISA1201_IU2_K1_LBSPPA512_LBSPPB512_LBSPPM0_LPA16_LPB16_LPM0_LRVW8_LWPMn1_MIAV1_MIWT1_1_MO40_NTn1_NTA0_NTB0_NTC0_NTD0_NTM0_NEPBS0_NLCA1_NLCB1_ONLL0_PGR2_PLR1_PKA0_SIA2_SS0_SU32_SUM1_SUS256_SPO0_SRVW0_SSO0_SVW8_SK0_SKXCCM0_TLDS0_ULSGRO1_USL1_UIOFGRO0_USFGROn1_VSn1_VWA1_VWB1_WSGRA0_WSGRB0_WS32_WG32_4_1_WGM8_WGMXCC1_WGMXCCGn1
    SolutionIndex: 143
    SolutionNameMin: Cijk_Ailk_Bjlk_HHS_BH_Bias_SHB_HA_S_SAB_SCD_SAV_UserArgs_MT64x64x32_MI16x16x1_SN_LDSB0_AFC1_AFEM1_AFEM1_ASEM1_CLR1_CADS0_DTLA0_DTLB0_DTVA0_DTVB0_EPS0_FDSI0_GRPM1_GRVWA8_GRVWB4_GSU1_GSUAMB_GSUC0_GSUWGMRR0_GLS0_ISA1201_IU1_K1_LBSPPA1024_LBSPPB1024_LBSPPM0_LPA32_LPB32_LPM0_LRVW8_LWPMn1_MIAV1_MIWT2_2_MO40_NTn1_NTA0_NTB0_NTC0_NTD0_NTM0_NEPBS0_NLCA1_NLCB1_ONLL0_PGR2_PLR1_PKA0_SIA3_SS0_SU32_SUM1_SUS256_SPO0_SRVW0_SSO0_SVW8_SK0_SKXCCM0_TLDS0_ULSGRO1_USL1_UIOFGRO0_USFGROn1_VSn1_VWA2_VWB2_WSGRA0_WSGRB0_WS32_WG32_4_1_WGM8_WGMXCC1_WGMXCCGn1
    SolutionIndex: 144
    SolutionNameMin: Cijk_Ailk_Bjlk_HHS_BH_Bias_SHB_HA_S_SAB_SCD_SAV_UserArgs_MT64x64x32_MI16x16x1_SN_LDSB0_AFC1_AFEM1_AFEM1_ASEM1_CLR1_CADS0_DTLA0_DTLB0_DTVA0_DTVB0_EPS0_FDSI0_GRPM1_GRVWA1_GRVWB1_GSU1_GSUAMB_GSUC0_GSUWGMRR0_GLS0_ISA1201_IU1_K1_LBSPPA1024_LBSPPB1024_LBSPPM0_LPA32_LPB32_LPM0_LRVW8_LWPMn1_MIAV1_MIWT2_2_MO40_NTn1_NTA0_NTB0_NTC0_NTD0_NTM0_NEPBS0_NLCA1_NLCB1_ONLL0_PGR2_PLR1_PKA0_SIA3_SS0_SU32_SUM1_SUS256_SPO0_SRVW0_SSO0_SVW8_SK0_SKXCCM0_TLDS0_ULSGRO0_USL1_UIOFGRO0_USFGROn1_VSn1_VWA2_VWB2_WSGRA0_WSGRB0_WS32_WG32_4_1_WGM8_WGMXCC1_WGMXCCGn1
    SolutionIndex: 145
    SolutionNameMin: Cijk_Ailk_Bjlk_HHS_BH_Bias_SHB_HA_S_SAB_SCD_SAV_UserArgs_MT64x64x64_MI16x16x1_SN_LDSB1_AFC1_AFEM1_AFEM1_ASEM1_CLR1_CADS0_DTLA0_DTLB0_DTVA0_DTVB0_EPS1_FDSI0_GRPM1_GRVWA4_GRVWB8_GSU1_GSUAMB_GSUC0_GSUWGMRR0_GLS0_ISA1201_IU4_K1_LBSPPA1024_LBSPPB1024_LBSPPM0_LPA32_LPB32_LPM0_LRVW8_LWPMn1_MIAV1_MIWT2_2_MO40_NTn1_NTA0_NTB0_NTC0_NTD0_NTM0_NEPBS0_NLCA1_NLCB1_ONLL0_PGR1_PLR1_PKA0_SIA2_SS0_SU32_SUM1_SUS256_SPO0_SRVW0_SSO0_SVW8_SK0_SKXCCM0_TLDS0_ULSGRO0_USL1_UIOFGRO0_USFGROn1_VSn1_VWA2_VWB2_WSGRA0_WSGRB0_WS32_WG32_4_1_WGM8_WGMXCC1_WGMXCCGn1
    SolutionIndex: 146
    SolutionNameMin: Cijk_Ailk_Bjlk_HHS_BH_Bias_SHB_HA_S_SAB_SCD_SAV_UserArgs_MT64x64x32_MI16x16x1_SN_LDSB1_AFC1_AFEM1_AFEM1_ASEM1_CLR1_CADS0_DTLA0_DTLB0_DTVA0_DTVB0_EPS0_FDSI0_GRPM1_GRVWA1_GRVWB1_GSU1_GSUAMB_GSUC0_GSUWGMRR0_GLS0_ISA1201_IU2_K1_LBSPPA1024_LBSPPB1024_LBSPPM0_LPA32_LPB32_LPM0_LRVW8_LWPMn1_MIAV1_MIWT2_2_MO40_NTn1_NTA0_NTB0_NTC0_NTD0_NTM0_NEPBS0_NLCA1_NLCB1_ONLL0_PGR2_PLR1_PKA0_SIA2_SS0_SU32_SUM1_SUS256_SPO0_SRVW0_SSO0_SVW8_SK0_SKXCCM0_TLDS0_ULSGRO0_USL1_UIOFGRO0_USFGROn1_VSn1_VWA2_VWB2_WSGRA0_WSGRB0_WS32_WG32_4_1_WGM8_WGMXCC1_WGMXCCGn1
    SolutionIndex: 147
    SolutionNameMin: Cijk_Ailk_Bjlk_HHS_BH_Bias_SHB_HA_S_SAB_SCD_SAV_UserArgs_MT64x64x32_MI16x16x1_SN_LDSB1_AFC1_AFEM1_AFEM1_ASEM1_CLR1_CADS0_DTLA0_DTLB0_DTVA0_DTVB0_EPS0_FDSI0_GRPM1_GRVWA4_GRVWB4_GSU1_GSUAMB_GSUC0_GSUWGMRR0_GLS0_ISA1201_IU2_K1_LBSPPA1024_LBSPPB1024_LBSPPM0_LPA32_LPB32_LPM0_LRVW8_LWPMn1_MIAV1_MIWT2_2_MO40_NTn1_NTA0_NTB0_NTC0_NTD0_NTM0_NEPBS0_NLCA1_NLCB1_ONLL0_PGR2_PLR1_PKA0_SIA2_SS1_SU32_SUM1_SUS256_SPO0_SRVW0_SSO0_SVW2_SK0_SKXCCM0_TLDS0_ULSGRO0_USL1_UIOFGRO0_USFGROn1_VSn1_VWA2_VWB2_WSGRA0_WSGRB0_WS32_WG32_4_1_WGM8_WGMXCC1_WGMXCCGn1
    SolutionIndex: 148
    SolutionNameMin: Cijk_Ailk_Bjlk_HHS_BH_Bias_SHB_HA_S_SAB_SCD_SAV_UserArgs_MT32x16x64_MI16x16x1_SN_LDSB0_AFC1_AFEM1_AFEM1_ASEM1_CLR1_CADS0_DTLA0_DTLB0_DTVA1_DTVB1_EPS0_FDSI0_GRPM1_GRVWA8_GRVWB8_GSU1_GSUAMB_GSUC0_GSUWGMRR0_GLS0_ISA1201_IU1_K1_LBSPPA0_LBSPPB0_LBSPPM0_LPA0_LPB0_LPM0_LRVW8_LWPMn1_MIAV1_MIWT1_1_MO40_NTn1_NTA0_NTB0_NTC0_NTD0_NTM0_NEPBS0_NLCA1_NLCB1_ONLL0_PGR1_PLR0_PKA0_SIA3_SS0_SU32_SUM1_SUS256_SPO0_SRVW0_SSO0_SVW8_SK0_SKXCCM0_TLDS0_ULSGRO0_USL1_UIOFGRO0_USFGROn1_VSn1_VWA1_VWB1_WSGRA0_WSGRB0_WS32_WG32_2_1_WGM8_WGMXCC1_WGMXCCGn1
    SolutionIndex: 149
    SolutionNameMin: Cijk_Ailk_Bjlk_HHS_BH_Bias_SHB_HA_S_SAB_SCD_SAV_UserArgs_MT64x64x32_MI16x16x1_SN_LDSB1_AFC1_AFEM1_AFEM1_ASEM1_CLR1_CADS0_DTLA0_DTLB0_DTVA0_DTVB0_EPS1_FDSI0_GRPM1_GRVWA1_GRVWB1_GSU1_GSUAMB_GSUC0_GSUWGMRR0_GLS0_ISA1201_IU2_K1_LBSPPA1024_LBSPPB1024_LBSPPM0_LPA32_LPB32_LPM0_LRVW8_LWPMn1_MIAV1_MIWT2_2_MO40_NTn1_NTA0_NTB0_NTC0_NTD0_NTM0_NEPBS0_NLCA1_NLCB1_ONLL0_PGR1_PLR1_PKA0_SIA2_SS0_SU32_SUM1_SUS256_SPO0_SRVW0_SSO0_SVW8_SK0_SKXCCM0_TLDS0_ULSGRO0_USL1_UIOFGRO0_USFGROn1_VSn1_VWA2_VWB2_WSGRA0_WSGRB0_WS32_WG32_4_1_WGM8_WGMXCC1_WGMXCCGn1
    SolutionIndex: 150
    SolutionNameMin: Cijk_Ailk_Bjlk_HHS_BH_Bias_SHB_HA_S_SAB_SCD_SAV_UserArgs_MT64x64x16_MI16x16x1_SN_LDSB1_AFC1_AFEM1_AFEM1_ASEM1_CLR1_CADS0_DTLA0_DTLB0_DTVA0_DTVB0_EPS0_FDSI0_GRPM1_GRVWA4_GRVWB4_GSU1_GSUAMB_GSUC0_GSUWGMRR0_GLS0_ISA1201_IU1_K1_LBSPPA1024_LBSPPB1024_LBSPPM0_LPA32_LPB32_LPM0_LRVW8_LWPMn1_MIAV1_MIWT2_2_MO40_NTn1_NTA0_NTB0_NTC0_NTD0_NTM0_NEPBS0_NLCA1_NLCB1_ONLL0_PGR2_PLR1_PKA0_SIA2_SS0_SU32_SUM1_SUS256_SPO0_SRVW0_SSO0_SVW8_SK0_SKXCCM0_TLDS0_ULSGRO0_USL1_UIOFGRO0_USFGROn1_VSn1_VWA2_VWB2_WSGRA0_WSGRB0_WS32_WG32_4_1_WGM8_WGMXCC1_WGMXCCGn1
    SolutionIndex: 151
    SolutionNameMin: Cijk_Ailk_Bjlk_HHS_BH_Bias_SHB_HA_S_SAB_SCD_SAV_UserArgs_MT16x16x32_MI16x16x1_SN_LDSB1_AFC1_AFEM1_AFEM1_ASEM1_CLR1_CADS0_DTLA0_DTLB0_DTVA0_DTVB0_EPS0_FDSI0_GRPM1_GRVWA1_GRVWB1_GSU1_GSUAMB_GSUC0_GSUWGMRR0_GLS0_ISA1201_IU2_K1_LBSPPA256_LBSPPB256_LBSPPM0_LPA16_LPB16_LPM0_LRVW8_LWPMn1_MIAV1_MIWT1_1_MO40_NTn1_NTA0_NTB0_NTC0_NTD0_NTM0_NEPBS0_NLCA1_NLCB1_ONLL0_PGR2_PLR1_PKA0_SIA2_SS0_SU32_SUM1_SUS256_SPO0_SRVW0_SSO0_SVW8_SK0_SKXCCM0_TLDS0_ULSGRO0_USL1_UIOFGRO0_USFGROn1_VSn1_VWA1_VWB1_WSGRA0_WSGRB0_WS32_WG16_2_1_WGM8_WGMXCC1_WGMXCCGn1
    SolutionIndex: 152
    SolutionNameMin: Cijk_Ailk_Bjlk_HHS_BH_Bias_SHB_HA_S_SAB_SCD_SAV_UserArgs_MT32x32x32_MI16x16x1_SN_LDSB0_AFC1_AFEM1_AFEM1_ASEM1_CLR1_CADS0_DTLA0_DTLB0_DTVA0_DTVB0_EPS0_FDSI0_GRPM1_GRVWA4_GRVWB8_GSU1_GSUAMB_GSUC0_GSUWGMRR0_GLS0_ISA1201_IU1_K1_LBSPPA512_LBSPPB512_LBSPPM0_LPA16_LPB16_LPM0_LRVW8_LWPMn1_MIAV1_MIWT1_1_MO40_NTn1_NTA0_NTB0_NTC0_NTD0_NTM0_NEPBS0_NLCA1_NLCB1_ONLL0_PGR2_PLR1_PKA0_SIA3_SS0_SU32_SUM1_SUS256_SPO0_SRVW0_SSO0_SVW8_SK0_SKXCCM0_TLDS0_ULSGRO1_USL1_UIOFGRO0_USFGROn1_VSn1_VWA1_VWB1_WSGRA0_WSGRB0_WS32_WG32_4_1_WGM8_WGMXCC1_WGMXCCGn1
    SolutionIndex: 153
    SolutionNameMin: Cijk_Ailk_Bjlk_HHS_BH_Bias_SHB_HA_S_SAB_SCD_SAV_UserArgs_MT32x32x64_MI16x16x1_SN_LDSB0_AFC1_AFEM1_AFEM1_ASEM1_CLR1_CADS0_DTLA0_DTLB0_DTVA0_DTVB1_EPS1_FDSI0_GRPM1_GRVWA4_GRVWB8_GSU1_GSUAMB_GSUC0_GSUWGMRR0_GLS0_ISA1201_IU1_K1_LBSPPA512_LBSPPB0_LBSPPM0_LPA16_LPB0_LPM0_LRVW8_LWPMn1_MIAV1_MIWT1_1_MO40_NTn1_NTA0_NTB0_NTC0_NTD0_NTM0_NEPBS0_NLCA1_NLCB1_ONLL0_PGR1_PLR1_PKA0_SIA3_SS1_SU32_SUM1_SUS256_SPO0_SRVW0_SSO0_SVW1_SK0_SKXCCM0_TLDS0_ULSGRO0_USL1_UIOFGRO0_USFGROn1_VSn1_VWA1_VWB1_WSGRA0_WSGRB0_WS32_WG32_4_1_WGM8_WGMXCC1_WGMXCCGn1
    SolutionIndex: 154
    SolutionNameMin: Cijk_Ailk_Bjlk_HHS_BH_Bias_SHB_HA_S_SAB_SCD_SAV_UserArgs_MT32x32x64_MI16x16x1_SN_LDSB0_AFC1_AFEM1_AFEM1_ASEM1_CLR1_CADS0_DTLA0_DTLB0_DTVA0_DTVB0_EPS1_FDSI0_GRPM1_GRVWA8_GRVWB4_GSU1_GSUAMB_GSUC0_GSUWGMRR0_GLS0_ISA1201_IU1_K1_LBSPPA512_LBSPPB512_LBSPPM0_LPA16_LPB16_LPM0_LRVW8_LWPMn1_MIAV1_MIWT1_1_MO40_NTn1_NTA0_NTB0_NTC0_NTD0_NTM0_NEPBS0_NLCA1_NLCB1_ONLL0_PGR1_PLR1_PKA0_SIA3_SS0_SU32_SUM1_SUS256_SPO0_SRVW0_SSO0_SVW8_SK0_SKXCCM0_TLDS0_ULSGRO0_USL1_UIOFGRO0_USFGROn1_VSn1_VWA1_VWB1_WSGRA0_WSGRB0_WS32_WG32_4_1_WGM8_WGMXCC1_WGMXCCGn1
    SolutionIndex: 155
    SolutionNameMin: Cijk_Ailk_Bjlk_HHS_BH_Bias_SHB_HA_S_SAB_SCD_SAV_UserArgs_MT64x64x32_MI16x16x1_SN_LDSB0_AFC1_AFEM1_AFEM1_ASEM1_CLR1_CADS0_DTLA0_DTLB0_DTVA0_DTVB0_EPS0_FDSI0_GRPM1_GRVWA4_GRVWB4_GSU1_GSUAMB_GSUC0_GSUWGMRR0_GLS0_ISA1201_IU1_K1_LBSPPA1024_LBSPPB1024_LBSPPM0_LPA32_LPB32_LPM0_LRVW8_LWPMn1_MIAV1_MIWT2_2_MO40_NTn1_NTA0_NTB0_NTC0_NTD0_NTM0_NEPBS0_NLCA1_NLCB1_ONLL0_PGR2_PLR1_PKA0_SIA3_SS0_SU32_SUM1_SUS256_SPO0_SRVW0_SSO0_SVW8_SK0_SKXCCM0_TLDS0_ULSGRO1_USL1_UIOFGRO0_USFGROn1_VSn1_VWA2_VWB2_WSGRA0_WSGRB0_WS32_WG32_4_1_WGM8_WGMXCC1_WGMXCCGn1
    SolutionIndex: 156
    SolutionNameMin: Cijk_Ailk_Bjlk_HHS_BH_Bias_SHB_HA_S_SAB_SCD_SAV_UserArgs_MT32x128x16_MI16x16x1_SN_LDSB0_AFC1_AFEM1_AFEM1_ASEM1_CLR0_CADS0_DTLA0_DTLB0_DTVA0_DTVB0_EPS0_FDSI0_GRPM1_GRVWA1_GRVWB4_GSU1_GSUAMB_GSUC0_GSUWGMRR0_GLS0_ISA1201_IU1_K1_LBSPPA512_LBSPPB2048_LBSPPM0_LPA16_LPB0_LPM0_LRVW8_LWPMn1_MIAV1_MIWT1_4_MO40_NTn1_NTA0_NTB0_NTC0_NTD0_NTM0_NEPBS0_NLCA1_NLCB1_ONLL0_PGR2_PLR0_PKA0_SIA3_SS0_SU32_SUM1_SUS256_SPO0_SRVW0_SSO0_SVW8_SK0_SKXCCM0_TLDS0_ULSGRO0_USL1_UIOFGRO0_USFGROn1_VSn1_VWA1_VWB4_WSGRA0_WSGRB0_WS32_WG32_4_1_WGM8_WGMXCC1_WGMXCCGn1
    SolutionIndex: 157
    SolutionNameMin: Cijk_Ailk_Bjlk_HHS_BH_Bias_SHB_HA_S_SAB_SCD_SAV_UserArgs_MT64x64x64_MI16x16x1_SN_LDSB1_AFC1_AFEM1_AFEM1_ASEM1_CLR1_CADS0_DTLA0_DTLB0_DTVA0_DTVB0_EPS0_FDSI0_GRPM1_GRVWA8_GRVWB8_GSU1_GSUAMB_GSUC0_GSUWGMRR0_GLS0_ISA1201_IU1_K1_LBSPPA1024_LBSPPB1024_LBSPPM0_LPA32_LPB32_LPM0_LRVW8_LWPMn1_MIAV1_MIWT2_2_MO40_NTn1_NTA0_NTB0_NTC0_NTD0_NTM0_NEPBS0_NLCA1_NLCB1_ONLL0_PGR2_PLR1_PKA0_SIA3_SS0_SU32_SUM1_SUS256_SPO0_SRVW0_SSO0_SVW8_SK0_SKXCCM0_TLDS0_ULSGRO1_USL1_UIOFGRO0_USFGROn1_VSn1_VWA2_VWB2_WSGRA0_WSGRB0_WS32_WG32_4_1_WGM8_WGMXCC1_WGMXCCGn1
    SolutionIndex: 158
    SolutionNameMin: Cijk_Ailk_Bjlk_HHS_BH_Bias_SHB_HA_S_SAB_SCD_SAV_UserArgs_MT64x64x32_MI16x16x1_SN_LDSB0_AFC1_AFEM1_AFEM1_ASEM1_CLR1_CADS0_DTLA0_DTLB0_DTVA0_DTVB0_EPS0_FDSI0_GRPM1_GRVWA8_GRVWB8_GSU1_GSUAMB_GSUC0_GSUWGMRR0_GLS0_ISA1201_IU1_K1_LBSPPA1024_LBSPPB1024_LBSPPM0_LPA32_LPB32_LPM0_LRVW8_LWPMn1_MIAV1_MIWT2_2_MO40_NTn1_NTA0_NTB0_NTC0_NTD0_NTM0_NEPBS0_NLCA1_NLCB1_ONLL0_PGR2_PLR1_PKA0_SIA3_SS1_SU32_SUM1_SUS256_SPO0_SRVW0_SSO0_SVW2_SK0_SKXCCM0_TLDS0_ULSGRO1_USL1_UIOFGRO0_USFGROn1_VSn1_VWA2_VWB2_WSGRA0_WSGRB0_WS32_WG32_4_1_WGM8_WGMXCC1_WGMXCCGn1
    SolutionIndex: 159
    SolutionNameMin: Cijk_Ailk_Bjlk_HHS_BH_Bias_SHB_HA_S_SAB_SCD_SAV_UserArgs_MT32x128x64_MI16x16x1_SN_LDSB0_AFC1_AFEM1_AFEM1_ASEM1_CLR1_CADS0_DTLA0_DTLB0_DTVA1_DTVB0_EPS1_FDSI0_GRPM1_GRVWA8_GRVWB8_GSU1_GSUAMB_GSUC0_GSUWGMRR0_GLS0_ISA1201_IU1_K1_LBSPPA0_LBSPPB2048_LBSPPM0_LPA0_LPB0_LPM0_LRVW8_LWPMn1_MIAV1_MIWT1_4_MO40_NTn1_NTA0_NTB0_NTC0_NTD0_NTM0_NEPBS0_NLCA1_NLCB1_ONLL0_PGR1_PLR1_PKA0_SIA3_SS0_SU32_SUM1_SUS256_SPO0_SRVW0_SSO0_SVW8_SK0_SKXCCM0_TLDS0_ULSGRO0_USL1_UIOFGRO0_USFGROn1_VSn1_VWA1_VWB4_WSGRA0_WSGRB0_WS32_WG32_4_1_WGM8_WGMXCC1_WGMXCCGn1
    SolutionIndex: 160
    SolutionNameMin: Cijk_Ailk_Bjlk_HHS_BH_Bias_SHB_HA_S_SAB_SCD_SAV_UserArgs_MT32x128x32_MI16x16x1_SN_LDSB0_AFC1_AFEM1_AFEM1_ASEM1_CLR1_CADS0_DTLA0_DTLB0_DTVA1_DTVB0_EPS0_FDSI0_GRPM1_GRVWA8_GRVWB4_GSU1_GSUAMB_GSUC0_GSUWGMRR0_GLS0_ISA1201_IU1_K1_LBSPPA0_LBSPPB2048_LBSPPM0_LPA0_LPB0_LPM0_LRVW8_LWPMn1_MIAV1_MIWT1_4_MO40_NTn1_NTA0_NTB0_NTC0_NTD0_NTM0_NEPBS0_NLCA1_NLCB1_ONLL0_PGR2_PLR1_PKA0_SIA3_SS0_SU32_SUM1_SUS256_SPO0_SRVW0_SSO0_SVW8_SK0_SKXCCM0_TLDS0_ULSGRO0_USL1_UIOFGRO0_USFGROn1_VSn1_VWA1_VWB4_WSGRA0_WSGRB0_WS32_WG32_4_1_WGM8_WGMXCC1_WGMXCCGn1
    SolutionIndex: 161
    SolutionNameMin: Cijk_Ailk_Bjlk_HHS_BH_Bias_SHB_HA_S_SAB_SCD_SAV_UserArgs_MT32x128x32_MI16x16x1_SN_LDSB1_AFC1_AFEM1_AFEM1_ASEM1_CLR1_CADS0_DTLA0_DTLB0_DTVA0_DTVB0_EPS0_FDSI0_GRPM1_GRVWA8_GRVWB8_GSU1_GSUAMB_GSUC0_GSUWGMRR0_GLS0_ISA1201_IU2_K1_LBSPPA512_LBSPPB2048_LBSPPM0_LPA16_LPB0_LPM0_LRVW8_LWPMn1_MIAV1_MIWT1_4_MO40_NTn1_NTA0_NTB0_NTC0_NTD0_NTM0_NEPBS0_NLCA1_NLCB1_ONLL0_PGR2_PLR1_PKA0_SIA2_SS0_SU32_SUM1_SUS256_SPO0_SRVW0_SSO0_SVW8_SK0_SKXCCM0_TLDS0_ULSGRO1_USL1_UIOFGRO0_USFGROn1_VSn1_VWA1_VWB4_WSGRA0_WSGRB0_WS32_WG32_4_1_WGM8_WGMXCC1_WGMXCCGn1
    SolutionIndex: 162
    SolutionNameMin: Cijk_Ailk_Bjlk_HHS_BH_Bias_SHB_HA_S_SAB_SCD_SAV_UserArgs_MT32x128x32_MI16x16x1_SN_LDSB0_AFC1_AFEM1_AFEM1_ASEM1_CLR1_CADS0_DTLA0_DTLB0_DTVA1_DTVB0_EPS0_FDSI0_GRPM1_GRVWA8_GRVWB8_GSU1_GSUAMB_GSUC0_GSUWGMRR0_GLS0_ISA1201_IU1_K1_LBSPPA0_LBSPPB2048_LBSPPM0_LPA0_LPB0_LPM0_LRVW8_LWPMn1_MIAV1_MIWT1_4_MO40_NTn1_NTA0_NTB0_NTC0_NTD0_NTM0_NEPBS0_NLCA1_NLCB1_ONLL0_PGR2_PLR1_PKA0_SIA3_SS0_SU32_SUM1_SUS256_SPO0_SRVW0_SSO0_SVW8_SK0_SKXCCM0_TLDS0_ULSGRO0_USL1_UIOFGRO0_USFGROn1_VSn1_VWA1_VWB4_WSGRA0_WSGRB0_WS32_WG32_4_1_WGM8_WGMXCC1_WGMXCCGn1
    SolutionIndex: 163
    SolutionNameMin: Cijk_Ailk_Bjlk_HHS_BH_Bias_SHB_HA_S_SAB_SCD_SAV_UserArgs_MT32x128x32_MI16x16x1_SN_LDSB1_AFC1_AFEM1_AFEM1_ASEM1_CLR1_CADS0_DTLA0_DTLB0_DTVA0_DTVB0_EPS0_FDSI0_GRPM1_GRVWA1_GRVWB4_GSU1_GSUAMB_GSUC0_GSUWGMRR0_GLS0_ISA1201_IU2_K1_LBSPPA512_LBSPPB2048_LBSPPM0_LPA16_LPB0_LPM0_LRVW8_LWPMn1_MIAV1_MIWT1_4_MO40_NTn1_NTA0_NTB0_NTC0_NTD0_NTM0_NEPBS0_NLCA1_NLCB1_ONLL0_PGR2_PLR1_PKA0_SIA2_SS0_SU32_SUM1_SUS256_SPO0_SRVW0_SSO0_SVW8_SK0_SKXCCM0_TLDS0_ULSGRO1_USL1_UIOFGRO0_USFGROn1_VSn1_VWA1_VWB4_WSGRA0_WSGRB0_WS32_WG32_4_1_WGM8_WGMXCC1_WGMXCCGn1
    SolutionIndex: 164
    SolutionNameMin: Cijk_Ailk_Bjlk_HHS_BH_Bias_SHB_HA_S_SAB_SCD_SAV_UserArgs_MT64x64x16_MI16x16x1_SN_LDSB1_AFC1_AFEM1_AFEM1_ASEM1_CLR1_CADS0_DTLA0_DTLB0_DTVA0_DTVB0_EPS1_FDSI0_GRPM1_GRVWA1_GRVWB1_GSU1_GSUAMB_GSUC0_GSUWGMRR0_GLS0_ISA1201_IU1_K1_LBSPPA1024_LBSPPB1024_LBSPPM0_LPA32_LPB32_LPM0_LRVW8_LWPMn1_MIAV1_MIWT2_2_MO40_NTn1_NTA0_NTB0_NTC0_NTD0_NTM0_NEPBS0_NLCA1_NLCB1_ONLL0_PGR1_PLR1_PKA0_SIA2_SS0_SU32_SUM1_SUS256_SPO0_SRVW0_SSO0_SVW8_SK0_SKXCCM0_TLDS0_ULSGRO0_USL1_UIOFGRO0_USFGROn1_VSn1_VWA2_VWB2_WSGRA0_WSGRB0_WS32_WG32_4_1_WGM8_WGMXCC1_WGMXCCGn1
    SolutionIndex: 165
    SolutionNameMin: Cijk_Ailk_Bjlk_HHS_BH_Bias_SHB_HA_S_SAB_SCD_SAV_UserArgs_MT64x64x32_MI16x16x1_SN_LDSB1_AFC1_AFEM1_AFEM1_ASEM1_CLR1_CADS0_DTLA0_DTLB0_DTVA0_DTVB0_EPS1_FDSI0_GRPM1_GRVWA8_GRVWB8_GSU1_GSUAMB_GSUC0_GSUWGMRR0_GLS0_ISA1201_IU2_K1_LBSPPA1024_LBSPPB1024_LBSPPM0_LPA32_LPB32_LPM0_LRVW8_LWPMn1_MIAV1_MIWT2_2_MO40_NTn1_NTA0_NTB0_NTC0_NTD0_NTM0_NEPBS0_NLCA1_NLCB1_ONLL0_PGR1_PLR1_PKA0_SIA2_SS1_SU32_SUM1_SUS256_SPO0_SRVW0_SSO0_SVW2_SK0_SKXCCM0_TLDS0_ULSGRO0_USL1_UIOFGRO0_USFGROn1_VSn1_VWA2_VWB2_WSGRA0_WSGRB0_WS32_WG32_4_1_WGM8_WGMXCC1_WGMXCCGn1
    SolutionIndex: 166
    SolutionNameMin: Cijk_Ailk_Bjlk_HHS_BH_Bias_SHB_HA_S_SAB_SCD_SAV_UserArgs_MT32x32x32_MI16x16x1_SN_LDSB0_AFC1_AFEM1_AFEM1_ASEM1_CLR1_CADS0_DTLA0_DTLB0_DTVA0_DTVB0_EPS0_FDSI0_GRPM1_GRVWA4_GRVWB4_GSU1_GSUAMB_GSUC0_GSUWGMRR0_GLS0_ISA1201_IU1_K1_LBSPPA512_LBSPPB512_LBSPPM0_LPA16_LPB16_LPM0_LRVW8_LWPMn1_MIAV1_MIWT1_1_MO40_NTn1_NTA0_NTB0_NTC0_NTD0_NTM0_NEPBS0_NLCA1_NLCB1_ONLL0_PGR2_PLR1_PKA0_SIA3_SS0_SU32_SUM1_SUS256_SPO0_SRVW0_SSO0_SVW8_SK0_SKXCCM0_TLDS0_ULSGRO1_USL1_UIOFGRO0_USFGROn1_VSn1_VWA1_VWB1_WSGRA0_WSGRB0_WS32_WG32_4_1_WGM8_WGMXCC1_WGMXCCGn1
    SolutionIndex: 167
    SolutionNameMin: Cijk_Ailk_Bjlk_HHS_BH_Bias_SHB_HA_S_SAB_SCD_SAV_UserArgs_MT32x32x32_MI16x16x1_SN_LDSB1_AFC1_AFEM1_AFEM1_ASEM1_CLR1_CADS0_DTLA0_DTLB0_DTVA0_DTVB0_EPS1_FDSI0_GRPM1_GRVWA1_GRVWB1_GSU1_GSUAMB_GSUC0_GSUWGMRR0_GLS0_ISA1201_IU2_K1_LBSPPA512_LBSPPB512_LBSPPM0_LPA16_LPB16_LPM0_LRVW8_LWPMn1_MIAV1_MIWT1_1_MO40_NTn1_NTA0_NTB0_NTC0_NTD0_NTM0_NEPBS0_NLCA1_NLCB1_ONLL0_PGR1_PLR1_PKA0_SIA2_SS1_SU32_SUM1_SUS256_SPO0_SRVW0_SSO0_SVW1_SK0_SKXCCM0_TLDS0_ULSGRO0_USL1_UIOFGRO0_USFGROn1_VSn1_VWA1_VWB1_WSGRA0_WSGRB0_WS32_WG32_4_1_WGM8_WGMXCC1_WGMXCCGn1
    SolutionIndex: 168
    SolutionNameMin: Cijk_Ailk_Bjlk_HHS_BH_Bias_SHB_HA_S_SAB_SCD_SAV_UserArgs_MT64x64x32_MI16x16x1_SN_LDSB0_AFC1_AFEM1_AFEM1_ASEM1_CLR1_CADS0_DTLA0_DTLB0_DTVA0_DTVB0_EPS0_FDSI0_GRPM1_GRVWA1_GRVWB1_GSU1_GSUAMB_GSUC0_GSUWGMRR0_GLS0_ISA1201_IU1_K1_LBSPPA1024_LBSPPB1024_LBSPPM0_LPA32_LPB32_LPM0_LRVW8_LWPMn1_MIAV1_MIWT2_2_MO40_NTn1_NTA0_NTB0_NTC0_NTD0_NTM0_NEPBS0_NLCA1_NLCB1_ONLL0_PGR2_PLR1_PKA0_SIA3_SS0_SU32_SUM1_SUS256_SPO0_SRVW0_SSO0_SVW8_SK0_SKXCCM0_TLDS0_ULSGRO1_USL1_UIOFGRO0_USFGROn1_VSn1_VWA2_VWB2_WSGRA0_WSGRB0_WS32_WG32_4_1_WGM8_WGMXCC1_WGMXCCGn1
    SolutionIndex: 169
    SolutionNameMin: Cijk_Ailk_Bjlk_HHS_BH_Bias_SHB_HA_S_SAB_SCD_SAV_UserArgs_MT64x64x32_MI16x16x1_SN_LDSB1_AFC1_AFEM1_AFEM1_ASEM1_CLR1_CADS0_DTLA0_DTLB0_DTVA0_DTVB0_EPS0_FDSI0_GRPM1_GRVWA4_GRVWB4_GSU1_GSUAMB_GSUC0_GSUWGMRR0_GLS0_ISA1201_IU2_K1_LBSPPA1024_LBSPPB1024_LBSPPM0_LPA32_LPB32_LPM0_LRVW8_LWPMn1_MIAV1_MIWT2_2_MO40_NTn1_NTA0_NTB0_NTC0_NTD0_NTM0_NEPBS0_NLCA1_NLCB1_ONLL0_PGR2_PLR1_PKA0_SIA2_SS0_SU32_SUM1_SUS256_SPO0_SRVW0_SSO0_SVW8_SK0_SKXCCM0_TLDS0_ULSGRO0_USL1_UIOFGRO0_USFGROn1_VSn1_VWA2_VWB2_WSGRA0_WSGRB0_WS32_WG32_4_1_WGM8_WGMXCC1_WGMXCCGn1
    SolutionIndex: 170
    SolutionNameMin: Cijk_Ailk_Bjlk_HHS_BH_Bias_SHB_HA_S_SAB_SCD_SAV_UserArgs_MT64x64x32_MI16x16x1_SN_LDSB1_AFC1_AFEM1_AFEM1_ASEM1_CLR1_CADS0_DTLA0_DTLB0_DTVA0_DTVB0_EPS0_FDSI0_GRPM1_GRVWA4_GRVWB8_GSU1_GSUAMB_GSUC0_GSUWGMRR0_GLS0_ISA1201_IU2_K1_LBSPPA1024_LBSPPB1024_LBSPPM0_LPA32_LPB32_LPM0_LRVW8_LWPMn1_MIAV1_MIWT2_2_MO40_NTn1_NTA0_NTB0_NTC0_NTD0_NTM0_NEPBS0_NLCA1_NLCB1_ONLL0_PGR2_PLR1_PKA0_SIA2_SS0_SU32_SUM1_SUS256_SPO0_SRVW0_SSO0_SVW8_SK0_SKXCCM0_TLDS0_ULSGRO0_USL1_UIOFGRO0_USFGROn1_VSn1_VWA2_VWB2_WSGRA0_WSGRB0_WS32_WG32_4_1_WGM8_WGMXCC1_WGMXCCGn1
    SolutionIndex: 171
    SolutionNameMin: Cijk_Ailk_Bjlk_HHS_BH_Bias_SHB_HA_S_SAB_SCD_SAV_UserArgs_MT64x64x32_MI16x16x1_SN_LDSB1_AFC1_AFEM1_AFEM1_ASEM1_CLR1_CADS0_DTLA0_DTLB0_DTVA0_DTVB0_EPS1_FDSI0_GRPM1_GRVWA4_GRVWB8_GSU1_GSUAMB_GSUC0_GSUWGMRR0_GLS0_ISA1201_IU2_K1_LBSPPA1024_LBSPPB1024_LBSPPM0_LPA32_LPB32_LPM0_LRVW8_LWPMn1_MIAV1_MIWT2_2_MO40_NTn1_NTA0_NTB0_NTC0_NTD0_NTM0_NEPBS0_NLCA1_NLCB1_ONLL0_PGR1_PLR1_PKA0_SIA2_SS1_SU32_SUM1_SUS256_SPO0_SRVW0_SSO0_SVW2_SK0_SKXCCM0_TLDS0_ULSGRO0_USL1_UIOFGRO0_USFGROn1_VSn1_VWA2_VWB2_WSGRA0_WSGRB0_WS32_WG32_4_1_WGM8_WGMXCC1_WGMXCCGn1
    SolutionIndex: 172
    SolutionNameMin: Cijk_Ailk_Bjlk_HHS_BH_Bias_SHB_HA_S_SAB_SCD_SAV_UserArgs_MT32x128x32_MI16x16x1_SN_LDSB1_AFC1_AFEM1_AFEM1_ASEM1_CLR1_CADS0_DTLA0_DTLB0_DTVA0_DTVB0_EPS1_FDSI0_GRPM1_GRVWA8_GRVWB8_GSU1_GSUAMB_GSUC0_GSUWGMRR0_GLS0_ISA1201_IU2_K1_LBSPPA512_LBSPPB2048_LBSPPM0_LPA16_LPB0_LPM0_LRVW8_LWPMn1_MIAV1_MIWT1_4_MO40_NTn1_NTA0_NTB0_NTC0_NTD0_NTM0_NEPBS0_NLCA1_NLCB1_ONLL0_PGR1_PLR1_PKA0_SIA2_SS0_SU32_SUM1_SUS256_SPO0_SRVW0_SSO0_SVW8_SK0_SKXCCM0_TLDS0_ULSGRO0_USL1_UIOFGRO0_USFGROn1_VSn1_VWA1_VWB4_WSGRA0_WSGRB0_WS32_WG32_4_1_WGM8_WGMXCC1_WGMXCCGn1
    SolutionIndex: 173
    SolutionNameMin: Cijk_Ailk_Bjlk_HHS_BH_Bias_SHB_HA_S_SAB_SCD_SAV_UserArgs_MT32x128x64_MI16x16x1_SN_LDSB0_AFC1_AFEM1_AFEM1_ASEM1_CLR1_CADS0_DTLA0_DTLB0_DTVA1_DTVB1_EPS0_FDSI0_GRPM1_GRVWA8_GRVWB8_GSU1_GSUAMB_GSUC0_GSUWGMRR0_GLS0_ISA1201_IU1_K1_LBSPPA0_LBSPPB0_LBSPPM0_LPA0_LPB0_LPM0_LRVW8_LWPMn1_MIAV1_MIWT1_4_MO40_NTn1_NTA0_NTB0_NTC0_NTD0_NTM0_NEPBS0_NLCA1_NLCB4_ONLL0_PGR1_PLR0_PKA0_SIA3_SS0_SU32_SUM1_SUS256_SPO0_SRVW0_SSO0_SVW8_SK0_SKXCCM0_TLDS0_ULSGRO0_USL1_UIOFGRO0_USFGROn1_VSn1_VWA1_VWB1_WSGRA0_WSGRB0_WS32_WG32_4_1_WGM8_WGMXCC1_WGMXCCGn1
    SolutionIndex: 174
    SolutionNameMin: Cijk_Ailk_Bjlk_HHS_BH_Bias_SHB_HA_S_SAB_SCD_SAV_UserArgs_MT64x64x32_MI16x16x1_SN_LDSB0_AFC1_AFEM1_AFEM1_ASEM1_CLR1_CADS0_DTLA0_DTLB0_DTVA1_DTVB1_EPS0_FDSI0_GRPM1_GRVWA8_GRVWB8_GSU1_GSUAMB_GSUC0_GSUWGMRR0_GLS0_ISA1201_IU1_K1_LBSPPA0_LBSPPB0_LBSPPM0_LPA0_LPB0_LPM0_LRVW8_LWPMn1_MIAV1_MIWT2_2_MO40_NTn1_NTA0_NTB0_NTC0_NTD0_NTM0_NEPBS0_NLCA2_NLCB2_ONLL0_PGR1_PLR0_PKA0_SIA3_SS0_SU32_SUM1_SUS256_SPO0_SRVW0_SSO0_SVW8_SK0_SKXCCM0_TLDS0_ULSGRO0_USL1_UIOFGRO0_USFGROn1_VSn1_VWA1_VWB1_WSGRA0_WSGRB0_WS32_WG32_4_1_WGM8_WGMXCC1_WGMXCCGn1
    SolutionIndex: 175
    SolutionNameMin: Cijk_Ailk_Bjlk_HHS_BH_Bias_SHB_HA_S_SAB_SCD_SAV_UserArgs_MT64x64x32_MI16x16x1_SN_LDSB1_AFC1_AFEM1_AFEM1_ASEM1_CLR1_CADS0_DTLA0_DTLB0_DTVA0_DTVB0_EPS0_FDSI0_GRPM1_GRVWA1_GRVWB1_GSU1_GSUAMB_GSUC0_GSUWGMRR0_GLS0_ISA1201_IU2_K1_LBSPPA1024_LBSPPB1024_LBSPPM0_LPA32_LPB32_LPM0_LRVW8_LWPMn1_MIAV1_MIWT2_2_MO40_NTn1_NTA0_NTB0_NTC0_NTD0_NTM0_NEPBS0_NLCA1_NLCB1_ONLL0_PGR2_PLR1_PKA0_SIA2_SS0_SU32_SUM1_SUS256_SPO0_SRVW0_SSO0_SVW8_SK0_SKXCCM0_TLDS0_ULSGRO1_USL1_UIOFGRO0_USFGROn1_VSn1_VWA2_VWB2_WSGRA0_WSGRB0_WS32_WG32_4_1_WGM8_WGMXCC1_WGMXCCGn1
    SolutionIndex: 176
    SolutionNameMin: Cijk_Ailk_Bjlk_HHS_BH_Bias_SHB_HA_S_SAB_SCD_SAV_UserArgs_MT64x64x16_MI16x16x1_SN_LDSB0_AFC1_AFEM1_AFEM1_ASEM1_CLR1_CADS0_DTLA0_DTLB0_DTVA1_DTVB1_EPS0_FDSI0_GRPM1_GRVWA8_GRVWB8_GSU1_GSUAMB_GSUC0_GSUWGMRR0_GLS0_ISA1201_IU1_K1_LBSPPA0_LBSPPB0_LBSPPM0_LPA0_LPB0_LPM0_LRVW8_LWPMn1_MIAV1_MIWT2_2_MO40_NTn1_NTA0_NTB0_NTC0_NTD0_NTM0_NEPBS0_NLCA1_NLCB1_ONLL0_PGR1_PLR0_PKA0_SIA3_SS0_SU32_SUM1_SUS256_SPO0_SRVW0_SSO0_SVW8_SK0_SKXCCM0_TLDS0_ULSGRO0_USL1_UIOFGRO0_USFGROn1_VSn1_VWA1_VWB1_WSGRA0_WSGRB0_WS32_WG32_4_1_WGM8_WGMXCC1_WGMXCCGn1
    SolutionIndex: 177
    SolutionNameMin: Cijk_Ailk_Bjlk_HHS_BH_Bias_SHB_HA_S_SAB_SCD_SAV_UserArgs_MT32x32x32_MI16x16x1_SN_LDSB0_AFC1_AFEM1_AFEM1_ASEM1_CLR1_CADS0_DTLA0_DTLB0_DTVA0_DTVB0_EPS0_FDSI0_GRPM1_GRVWA1_GRVWB1_GSU1_GSUAMB_GSUC0_GSUWGMRR0_GLS0_ISA1201_IU1_K1_LBSPPA512_LBSPPB512_LBSPPM0_LPA16_LPB16_LPM0_LRVW8_LWPMn1_MIAV1_MIWT1_1_MO40_NTn1_NTA0_NTB0_NTC0_NTD0_NTM0_NEPBS0_NLCA1_NLCB1_ONLL0_PGR2_PLR1_PKA0_SIA3_SS0_SU32_SUM1_SUS256_SPO0_SRVW0_SSO0_SVW8_SK0_SKXCCM0_TLDS0_ULSGRO1_USL1_UIOFGRO0_USFGROn1_VSn1_VWA1_VWB1_WSGRA0_WSGRB0_WS32_WG32_4_1_WGM8_WGMXCC1_WGMXCCGn1
    SolutionIndex: 178
    SolutionNameMin: Cijk_Ailk_Bjlk_HHS_BH_Bias_SHB_HA_S_SAB_SCD_SAV_UserArgs_MT32x16x32_MI16x16x1_SN_LDSB1_AFC1_AFEM1_AFEM1_ASEM1_CLR1_CADS0_DTLA0_DTLB0_DTVA0_DTVB0_EPS1_FDSI0_GRPM1_GRVWA1_GRVWB1_GSU1_GSUAMB_GSUC0_GSUWGMRR0_GLS0_ISA1201_IU2_K1_LBSPPA512_LBSPPB256_LBSPPM0_LPA16_LPB16_LPM0_LRVW8_LWPMn1_MIAV1_MIWT1_1_MO40_NTn1_NTA0_NTB0_NTC0_NTD0_NTM0_NEPBS0_NLCA1_NLCB1_ONLL0_PGR1_PLR1_PKA0_SIA2_SS0_SU32_SUM1_SUS256_SPO0_SRVW0_SSO0_SVW8_SK0_SKXCCM0_TLDS0_ULSGRO0_USL1_UIOFGRO0_USFGROn1_VSn1_VWA1_VWB1_WSGRA0_WSGRB0_WS32_WG32_2_1_WGM8_WGMXCC1_WGMXCCGn1
    SolutionIndex: 179
    SolutionNameMin: Cijk_Ailk_Bjlk_HHS_BH_Bias_SHB_HA_S_SAB_SCD_SAV_UserArgs_MT32x32x64_MI16x16x1_SN_LDSB0_AFC1_AFEM1_AFEM1_ASEM1_CLR1_CADS0_DTLA0_DTLB0_DTVA0_DTVB1_EPS1_FDSI0_GRPM1_GRVWA8_GRVWB8_GSU1_GSUAMB_GSUC0_GSUWGMRR0_GLS0_ISA1201_IU1_K1_LBSPPA512_LBSPPB0_LBSPPM0_LPA16_LPB0_LPM0_LRVW8_LWPMn1_MIAV1_MIWT1_1_MO40_NTn1_NTA0_NTB0_NTC0_NTD0_NTM0_NEPBS0_NLCA1_NLCB1_ONLL0_PGR1_PLR1_PKA0_SIA3_SS0_SU32_SUM1_SUS256_SPO0_SRVW0_SSO0_SVW8_SK0_SKXCCM0_TLDS0_ULSGRO0_USL1_UIOFGRO0_USFGROn1_VSn1_VWA1_VWB1_WSGRA0_WSGRB0_WS32_WG32_4_1_WGM8_WGMXCC1_WGMXCCGn1
    SolutionIndex: 180
    SolutionNameMin: Cijk_Ailk_Bjlk_HHS_BH_Bias_SHB_HA_S_SAB_SCD_SAV_UserArgs_MT32x128x32_MI16x16x1_SN_LDSB1_AFC1_AFEM1_AFEM1_ASEM1_CLR1_CADS0_DTLA0_DTLB0_DTVA0_DTVB0_EPS0_FDSI0_GRPM1_GRVWA4_GRVWB4_GSU1_GSUAMB_GSUC0_GSUWGMRR0_GLS0_ISA1201_IU2_K1_LBSPPA512_LBSPPB2048_LBSPPM0_LPA16_LPB0_LPM0_LRVW8_LWPMn1_MIAV1_MIWT1_4_MO40_NTn1_NTA0_NTB0_NTC0_NTD0_NTM0_NEPBS0_NLCA1_NLCB1_ONLL0_PGR2_PLR1_PKA0_SIA2_SS0_SU32_SUM1_SUS256_SPO0_SRVW0_SSO0_SVW8_SK0_SKXCCM0_TLDS0_ULSGRO0_USL1_UIOFGRO0_USFGROn1_VSn1_VWA1_VWB4_WSGRA0_WSGRB0_WS32_WG32_4_1_WGM8_WGMXCC1_WGMXCCGn1
    SolutionIndex: 181
    SolutionNameMin: Cijk_Ailk_Bjlk_HHS_BH_Bias_SHB_HA_S_SAB_SCD_SAV_UserArgs_MT128x32x32_MI16x16x1_SN_LDSB1_AFC1_AFEM1_AFEM1_ASEM1_CLR1_CADS0_DTLA0_DTLB0_DTVA0_DTVB0_EPS1_FDSI0_GRPM1_GRVWA4_GRVWB4_GSU1_GSUAMB_GSUC0_GSUWGMRR0_GLS0_ISA1201_IU2_K1_LBSPPA2048_LBSPPB512_LBSPPM0_LPA0_LPB16_LPM0_LRVW8_LWPMn1_MIAV1_MIWT4_1_MO40_NTn1_NTA0_NTB0_NTC0_NTD0_NTM0_NEPBS0_NLCA1_NLCB1_ONLL0_PGR1_PLR1_PKA0_SIA2_SS1_SU32_SUM1_SUS256_SPO0_SRVW0_SSO0_SVW4_SK0_SKXCCM0_TLDS0_ULSGRO0_USL1_UIOFGRO0_USFGROn1_VSn1_VWA4_VWB1_WSGRA0_WSGRB0_WS32_WG32_4_1_WGM8_WGMXCC1_WGMXCCGn1
    SolutionIndex: 182
    SolutionNameMin: Cijk_Ailk_Bjlk_HHS_BH_Bias_SHB_HA_S_SAB_SCD_SAV_UserArgs_MT64x64x32_MI16x16x1_SN_LDSB1_AFC1_AFEM1_AFEM1_ASEM1_CLR1_CADS0_DTLA0_DTLB0_DTVA0_DTVB0_EPS0_FDSI0_GRPM1_GRVWA8_GRVWB8_GSU1_GSUAMB_GSUC0_GSUWGMRR0_GLS0_ISA1201_IU2_K1_LBSPPA1024_LBSPPB1024_LBSPPM0_LPA32_LPB32_LPM0_LRVW8_LWPMn1_MIAV1_MIWT2_2_MO40_NTn1_NTA0_NTB0_NTC0_NTD0_NTM0_NEPBS0_NLCA1_NLCB1_ONLL0_PGR2_PLR1_PKA0_SIA2_SS0_SU32_SUM1_SUS256_SPO0_SRVW0_SSO0_SVW8_SK0_SKXCCM0_TLDS0_ULSGRO0_USL1_UIOFGRO0_USFGROn1_VSn1_VWA2_VWB2_WSGRA0_WSGRB0_WS32_WG32_4_1_WGM8_WGMXCC1_WGMXCCGn1
    SolutionIndex: 183
    SolutionNameMin: Cijk_Ailk_Bjlk_HHS_BH_Bias_SHB_HA_S_SAB_SCD_SAV_UserArgs_MT64x64x32_MI16x16x1_SN_LDSB1_AFC1_AFEM1_AFEM1_ASEM1_CLR1_CADS0_DTLA0_DTLB0_DTVA0_DTVB0_EPS0_FDSI0_GRPM1_GRVWA4_GRVWB4_GSU1_GSUAMB_GSUC0_GSUWGMRR0_GLS0_ISA1201_IU2_K1_LBSPPA1024_LBSPPB1024_LBSPPM0_LPA32_LPB32_LPM0_LRVW8_LWPMn1_MIAV1_MIWT2_2_MO40_NTn1_NTA0_NTB0_NTC0_NTD0_NTM0_NEPBS0_NLCA1_NLCB1_ONLL0_PGR2_PLR1_PKA0_SIA2_SS0_SU32_SUM1_SUS256_SPO0_SRVW0_SSO0_SVW8_SK0_SKXCCM0_TLDS0_ULSGRO1_USL1_UIOFGRO0_USFGROn1_VSn1_VWA2_VWB2_WSGRA0_WSGRB0_WS32_WG32_4_1_WGM8_WGMXCC1_WGMXCCGn1
    SolutionIndex: 184
    SolutionNameMin: Cijk_Ailk_Bjlk_HHS_BH_Bias_SHB_HA_S_SAB_SCD_SAV_UserArgs_MT32x128x32_MI16x16x1_SN_LDSB0_AFC1_AFEM1_AFEM1_ASEM1_CLR1_CADS0_DTLA0_DTLB0_DTVA0_DTVB1_EPS1_FDSI0_GRPM1_GRVWA4_GRVWB8_GSU1_GSUAMB_GSUC0_GSUWGMRR0_GLS0_ISA1201_IU1_K1_LBSPPA512_LBSPPB0_LBSPPM0_LPA16_LPB0_LPM0_LRVW8_LWPMn1_MIAV1_MIWT1_4_MO40_NTn1_NTA0_NTB0_NTC0_NTD0_NTM0_NEPBS0_NLCA1_NLCB2_ONLL0_PGR1_PLR1_PKA0_SIA3_SS0_SU32_SUM1_SUS256_SPO0_SRVW0_SSO0_SVW8_SK0_SKXCCM0_TLDS0_ULSGRO0_USL1_UIOFGRO0_USFGROn1_VSn1_VWA1_VWB1_WSGRA0_WSGRB0_WS32_WG32_4_1_WGM8_WGMXCC1_WGMXCCGn1
    SolutionIndex: 185
    SolutionNameMin: Cijk_Ailk_Bjlk_HHS_BH_Bias_SHB_HA_S_SAB_SCD_SAV_UserArgs_MT64x64x32_MI16x16x1_SN_LDSB1_AFC1_AFEM1_AFEM1_ASEM1_CLR1_CADS0_DTLA0_DTLB0_DTVA0_DTVB0_EPS0_FDSI0_GRPM1_GRVWA4_GRVWB8_GSU1_GSUAMB_GSUC0_GSUWGMRR0_GLS0_ISA1201_IU2_K1_LBSPPA1024_LBSPPB1024_LBSPPM0_LPA32_LPB32_LPM0_LRVW8_LWPMn1_MIAV1_MIWT2_2_MO40_NTn1_NTA0_NTB0_NTC0_NTD0_NTM0_NEPBS0_NLCA1_NLCB1_ONLL0_PGR2_PLR1_PKA0_SIA2_SS0_SU32_SUM1_SUS256_SPO0_SRVW0_SSO0_SVW8_SK0_SKXCCM0_TLDS0_ULSGRO1_USL1_UIOFGRO0_USFGROn1_VSn1_VWA2_VWB2_WSGRA0_WSGRB0_WS32_WG32_4_1_WGM8_WGMXCC1_WGMXCCGn1
    SolutionIndex: 186
    SolutionNameMin: Cijk_Ailk_Bjlk_HHS_BH_Bias_SHB_HA_S_SAB_SCD_SAV_UserArgs_MT64x64x64_MI16x16x1_SN_LDSB0_AFC1_AFEM1_AFEM1_ASEM1_CLR1_CADS0_DTLA0_DTLB0_DTVA0_DTVB1_EPS0_FDSI0_GRPM1_GRVWA4_GRVWB8_GSU1_GSUAMB_GSUC0_GSUWGMRR0_GLS0_ISA1201_IU1_K1_LBSPPA1024_LBSPPB0_LBSPPM0_LPA32_LPB0_LPM0_LRVW8_LWPMn1_MIAV1_MIWT2_2_MO40_NTn1_NTA0_NTB0_NTC0_NTD0_NTM0_NEPBS0_NLCA1_NLCB4_ONLL0_PGR2_PLR1_PKA0_SIA3_SS0_SU32_SUM1_SUS256_SPO0_SRVW0_SSO0_SVW8_SK0_SKXCCM0_TLDS0_ULSGRO0_USL1_UIOFGRO0_USFGROn1_VSn1_VWA2_VWB1_WSGRA0_WSGRB0_WS32_WG32_4_1_WGM8_WGMXCC1_WGMXCCGn1
    SolutionIndex: 187
    SolutionNameMin: Cijk_Ailk_Bjlk_HHS_BH_Bias_SHB_HA_S_SAB_SCD_SAV_UserArgs_MT64x64x64_MI16x16x1_SN_LDSB0_AFC1_AFEM1_AFEM1_ASEM1_CLR1_CADS0_DTLA0_DTLB0_DTVA1_DTVB0_EPS0_FDSI0_GRPM1_GRVWA8_GRVWB4_GSU1_GSUAMB_GSUC0_GSUWGMRR0_GLS0_ISA1201_IU1_K1_LBSPPA0_LBSPPB1024_LBSPPM0_LPA0_LPB32_LPM0_LRVW8_LWPMn1_MIAV1_MIWT2_2_MO40_NTn1_NTA0_NTB0_NTC0_NTD0_NTM0_NEPBS0_NLCA4_NLCB1_ONLL0_PGR2_PLR1_PKA0_SIA3_SS0_SU32_SUM1_SUS256_SPO0_SRVW0_SSO0_SVW8_SK0_SKXCCM0_TLDS0_ULSGRO0_USL1_UIOFGRO0_USFGROn1_VSn1_VWA1_VWB2_WSGRA0_WSGRB0_WS32_WG32_4_1_WGM8_WGMXCC1_WGMXCCGn1
    SolutionIndex: 188
    SolutionNameMin: Cijk_Ailk_Bjlk_HHS_BH_Bias_SHB_HA_S_SAB_SCD_SAV_UserArgs_MT32x32x64_MI16x16x1_SN_LDSB0_AFC1_AFEM1_AFEM1_ASEM1_CLR1_CADS0_DTLA0_DTLB0_DTVA0_DTVB0_EPS0_FDSI0_GRPM1_GRVWA1_GRVWB1_GSU1_GSUAMB_GSUC0_GSUWGMRR0_GLS0_ISA1201_IU1_K1_LBSPPA512_LBSPPB512_LBSPPM0_LPA16_LPB16_LPM0_LRVW8_LWPMn1_MIAV1_MIWT1_1_MO40_NTn1_NTA0_NTB0_NTC0_NTD0_NTM0_NEPBS0_NLCA1_NLCB1_ONLL0_PGR2_PLR1_PKA0_SIA3_SS0_SU32_SUM1_SUS256_SPO0_SRVW0_SSO0_SVW8_SK0_SKXCCM0_TLDS0_ULSGRO0_USL1_UIOFGRO0_USFGROn1_VSn1_VWA1_VWB1_WSGRA0_WSGRB0_WS32_WG32_4_1_WGM8_WGMXCC1_WGMXCCGn1
    SolutionIndex: 192
    SolutionNameMin: Cijk_Ailk_Bjlk_HHS_BH_Bias_SHB_HA_S_SAB_SCD_SAV_UserArgs_MT32x128x32_MI16x16x1_SN_LDSB1_AFC1_AFEM1_AFEM1_ASEM1_CLR1_CADS0_DTLA0_DTLB0_DTVA0_DTVB0_EPS1_FDSI0_GRPM1_GRVWA1_GRVWB8_GSU1_GSUAMB_GSUC0_GSUWGMRR0_GLS0_ISA1201_IU2_K1_LBSPPA512_LBSPPB2048_LBSPPM0_LPA16_LPB0_LPM0_LRVW8_LWPMn1_MIAV1_MIWT1_4_MO40_NTn1_NTA0_NTB0_NTC0_NTD0_NTM0_NEPBS0_NLCA1_NLCB1_ONLL0_PGR1_PLR1_PKA0_SIA2_SS0_SU32_SUM1_SUS256_SPO0_SRVW0_SSO0_SVW8_SK0_SKXCCM0_TLDS0_ULSGRO0_USL1_UIOFGRO0_USFGROn1_VSn1_VWA1_VWB4_WSGRA0_WSGRB0_WS32_WG32_4_1_WGM8_WGMXCC1_WGMXCCGn1
    SolutionIndex: 193
    SolutionNameMin: Cijk_Ailk_Bjlk_HHS_BH_Bias_SHB_HA_S_SAB_SCD_SAV_UserArgs_MT64x64x32_MI16x16x1_SN_LDSB0_AFC1_AFEM1_AFEM1_ASEM1_CLR1_CADS0_DTLA0_DTLB0_DTVA0_DTVB0_EPS0_FDSI0_GRPM1_GRVWA8_GRVWB8_GSU1_GSUAMB_GSUC0_GSUWGMRR0_GLS0_ISA1201_IU1_K1_LBSPPA1024_LBSPPB1024_LBSPPM0_LPA32_LPB32_LPM0_LRVW8_LWPMn1_MIAV1_MIWT2_2_MO40_NTn1_NTA0_NTB0_NTC0_NTD0_NTM0_NEPBS0_NLCA1_NLCB1_ONLL0_PGR2_PLR1_PKA0_SIA3_SS0_SU32_SUM1_SUS256_SPO0_SRVW0_SSO0_SVW8_SK0_SKXCCM0_TLDS0_ULSGRO1_USL1_UIOFGRO0_USFGROn1_VSn1_VWA2_VWB2_WSGRA0_WSGRB0_WS32_WG32_4_1_WGM8_WGMXCC1_WGMXCCGn1
    SolutionIndex: 195
    SolutionNameMin: Cijk_Ailk_Bjlk_HHS_BH_Bias_SHB_HA_S_SAB_SCD_SAV_UserArgs_MT64x64x64_MI16x16x1_SN_LDSB1_AFC1_AFEM1_AFEM1_ASEM1_CLR1_CADS0_DTLA0_DTLB0_DTVA0_DTVB0_EPS1_FDSI0_GRPM1_GRVWA8_GRVWB8_GSU1_GSUAMB_GSUC0_GSUWGMRR0_GLS0_ISA1201_IU4_K1_LBSPPA1024_LBSPPB1024_LBSPPM0_LPA32_LPB32_LPM0_LRVW8_LWPMn1_MIAV1_MIWT2_2_MO40_NTn1_NTA0_NTB0_NTC0_NTD0_NTM0_NEPBS0_NLCA1_NLCB1_ONLL0_PGR1_PLR1_PKA0_SIA2_SS0_SU32_SUM1_SUS256_SPO0_SRVW0_SSO0_SVW8_SK0_SKXCCM0_TLDS0_ULSGRO0_USL1_UIOFGRO0_USFGROn1_VSn1_VWA2_VWB2_WSGRA0_WSGRB0_WS32_WG32_4_1_WGM8_WGMXCC1_WGMXCCGn1
    SolutionIndex: 196
    SolutionNameMin: Cijk_Ailk_Bjlk_HHS_BH_Bias_SHB_HA_S_SAB_SCD_SAV_UserArgs_MT64x64x16_MI16x16x1_SN_LDSB1_AFC1_AFEM1_AFEM1_ASEM1_CLR1_CADS0_DTLA0_DTLB0_DTVA0_DTVB0_EPS1_FDSI0_GRPM1_GRVWA1_GRVWB1_GSU1_GSUAMB_GSUC0_GSUWGMRR0_GLS0_ISA1201_IU1_K1_LBSPPA1024_LBSPPB1024_LBSPPM0_LPA32_LPB32_LPM0_LRVW8_LWPMn1_MIAV1_MIWT2_2_MO40_NTn1_NTA0_NTB0_NTC0_NTD0_NTM0_NEPBS0_NLCA1_NLCB1_ONLL0_PGR1_PLR1_PKA0_SIA2_SS1_SU32_SUM1_SUS256_SPO0_SRVW0_SSO0_SVW2_SK0_SKXCCM0_TLDS0_ULSGRO0_USL1_UIOFGRO0_USFGROn1_VSn1_VWA2_VWB2_WSGRA0_WSGRB0_WS32_WG32_4_1_WGM8_WGMXCC1_WGMXCCGn1
    SolutionIndex: 201
    SolutionNameMin: Cijk_Ailk_Bjlk_HHS_BH_Bias_SHB_HA_S_SAB_SCD_SAV_UserArgs_MT64x64x64_MI16x16x1_SN_LDSB1_AFC1_AFEM1_AFEM1_ASEM1_CLR1_CADS0_DTLA0_DTLB0_DTVA0_DTVB0_EPS0_FDSI0_GRPM1_GRVWA8_GRVWB4_GSU1_GSUAMB_GSUC0_GSUWGMRR0_GLS0_ISA1201_IU4_K1_LBSPPA1024_LBSPPB1024_LBSPPM0_LPA32_LPB32_LPM0_LRVW8_LWPMn1_MIAV1_MIWT2_2_MO40_NTn1_NTA0_NTB0_NTC0_NTD0_NTM0_NEPBS0_NLCA1_NLCB1_ONLL0_PGR2_PLR1_PKA0_SIA2_SS0_SU32_SUM1_SUS256_SPO0_SRVW0_SSO0_SVW8_SK0_SKXCCM0_TLDS0_ULSGRO1_USL1_UIOFGRO0_USFGROn1_VSn1_VWA2_VWB2_WSGRA0_WSGRB0_WS32_WG32_4_1_WGM8_WGMXCC1_WGMXCCGn1
    SolutionIndex: 203
    SolutionNameMin: Cijk_Ailk_Bjlk_HHS_BH_Bias_SHB_HA_S_SAB_SCD_SAV_UserArgs_MT64x64x32_MI16x16x1_SN_LDSB1_AFC1_AFEM1_AFEM1_ASEM1_CLR1_CADS0_DTLA0_DTLB0_DTVA0_DTVB0_EPS1_FDSI0_GRPM1_GRVWA4_GRVWB4_GSU1_GSUAMB_GSUC0_GSUWGMRR0_GLS0_ISA1201_IU2_K1_LBSPPA1024_LBSPPB1024_LBSPPM0_LPA32_LPB32_LPM0_LRVW8_LWPMn1_MIAV1_MIWT2_2_MO40_NTn1_NTA0_NTB0_NTC0_NTD0_NTM0_NEPBS0_NLCA1_NLCB1_ONLL0_PGR1_PLR1_PKA0_SIA2_SS0_SU32_SUM1_SUS256_SPO0_SRVW0_SSO0_SVW8_SK0_SKXCCM0_TLDS0_ULSGRO0_USL1_UIOFGRO0_USFGROn1_VSn1_VWA2_VWB2_WSGRA0_WSGRB0_WS32_WG32_4_1_WGM8_WGMXCC1_WGMXCCGn1
    SolutionIndex: 205
    SolutionNameMin: Cijk_Ailk_Bjlk_HHS_BH_Bias_SHB_HA_S_SAB_SCD_SAV_UserArgs_MT128x32x32_MI16x16x1_SN_LDSB1_AFC1_AFEM1_AFEM1_ASEM1_CLR1_CADS0_DTLA0_DTLB0_DTVA0_DTVB0_EPS0_FDSI0_GRPM1_GRVWA4_GRVWB8_GSU1_GSUAMB_GSUC0_GSUWGMRR0_GLS0_ISA1201_IU2_K1_LBSPPA2048_LBSPPB512_LBSPPM0_LPA0_LPB16_LPM0_LRVW8_LWPMn1_MIAV1_MIWT4_1_MO40_NTn1_NTA0_NTB0_NTC0_NTD0_NTM0_NEPBS0_NLCA1_NLCB1_ONLL0_PGR2_PLR1_PKA0_SIA2_SS1_SU32_SUM1_SUS256_SPO0_SRVW0_SSO0_SVW4_SK0_SKXCCM0_TLDS0_ULSGRO1_USL1_UIOFGRO0_USFGROn1_VSn1_VWA4_VWB1_WSGRA0_WSGRB0_WS32_WG32_4_1_WGM8_WGMXCC1_WGMXCCGn1
    SolutionIndex: 206
    SolutionNameMin: Cijk_Ailk_Bjlk_HHS_BH_Bias_SHB_HA_S_SAB_SCD_SAV_UserArgs_MT64x64x32_MI16x16x1_SN_LDSB0_AFC1_AFEM1_AFEM1_ASEM1_CLR1_CADS0_DTLA0_DTLB0_DTVA1_DTVB0_EPS0_FDSI0_GRPM1_GRVWA8_GRVWB4_GSU1_GSUAMB_GSUC0_GSUWGMRR0_GLS0_ISA1201_IU1_K1_LBSPPA0_LBSPPB1024_LBSPPM0_LPA0_LPB32_LPM0_LRVW8_LWPMn1_MIAV1_MIWT2_2_MO40_NTn1_NTA0_NTB0_NTC0_NTD0_NTM0_NEPBS0_NLCA2_NLCB1_ONLL0_PGR2_PLR1_PKA0_SIA3_SS0_SU32_SUM1_SUS256_SPO0_SRVW0_SSO0_SVW8_SK0_SKXCCM0_TLDS0_ULSGRO0_USL1_UIOFGRO0_USFGROn1_VSn1_VWA1_VWB2_WSGRA0_WSGRB0_WS32_WG32_4_1_WGM8_WGMXCC1_WGMXCCGn1
    SolutionIndex: 207
    SolutionNameMin: Cijk_Ailk_Bjlk_HHS_BH_Bias_SHB_HA_S_SAB_SCD_SAV_UserArgs_MT64x64x64_MI16x16x1_SN_LDSB0_AFC1_AFEM1_AFEM1_ASEM1_CLR1_CADS0_DTLA0_DTLB0_DTVA0_DTVB1_EPS0_FDSI0_GRPM1_GRVWA8_GRVWB8_GSU1_GSUAMB_GSUC0_GSUWGMRR0_GLS0_ISA1201_IU1_K1_LBSPPA1024_LBSPPB0_LBSPPM0_LPA32_LPB0_LPM0_LRVW8_LWPMn1_MIAV1_MIWT2_2_MO40_NTn1_NTA0_NTB0_NTC0_NTD0_NTM0_NEPBS0_NLCA1_NLCB4_ONLL0_PGR2_PLR1_PKA0_SIA3_SS0_SU32_SUM1_SUS256_SPO0_SRVW0_SSO0_SVW8_SK0_SKXCCM0_TLDS0_ULSGRO0_USL1_UIOFGRO0_USFGROn1_VSn1_VWA2_VWB1_WSGRA0_WSGRB0_WS32_WG32_4_1_WGM8_WGMXCC1_WGMXCCGn1
    SolutionIndex: 210
    SolutionNameMin: Cijk_Ailk_Bjlk_HHS_BH_Bias_SHB_HA_S_SAB_SCD_SAV_UserArgs_MT64x64x32_MI16x16x1_SN_LDSB1_AFC1_AFEM1_AFEM1_ASEM1_CLR1_CADS0_DTLA0_DTLB0_DTVA0_DTVB0_EPS1_FDSI0_GRPM1_GRVWA8_GRVWB4_GSU1_GSUAMB_GSUC0_GSUWGMRR0_GLS0_ISA1201_IU2_K1_LBSPPA1024_LBSPPB1024_LBSPPM0_LPA32_LPB32_LPM0_LRVW8_LWPMn1_MIAV1_MIWT2_2_MO40_NTn1_NTA0_NTB0_NTC0_NTD0_NTM0_NEPBS0_NLCA1_NLCB1_ONLL0_PGR1_PLR1_PKA0_SIA2_SS0_SU32_SUM1_SUS256_SPO0_SRVW0_SSO0_SVW8_SK0_SKXCCM0_TLDS0_ULSGRO0_USL1_UIOFGRO0_USFGROn1_VSn1_VWA2_VWB2_WSGRA0_WSGRB0_WS32_WG32_4_1_WGM8_WGMXCC1_WGMXCCGn1
    SolutionIndex: 211
    SolutionNameMin: Cijk_Ailk_Bjlk_HHS_BH_Bias_SHB_HA_S_SAB_SCD_SAV_UserArgs_MT32x16x64_MI16x16x1_SN_LDSB0_AFC1_AFEM1_AFEM1_ASEM1_CLR1_CADS0_DTLA0_DTLB0_DTVA1_DTVB0_EPS1_FDSI0_GRPM1_GRVWA8_GRVWB8_GSU1_GSUAMB_GSUC0_GSUWGMRR0_GLS0_ISA1201_IU1_K1_LBSPPA0_LBSPPB256_LBSPPM0_LPA0_LPB16_LPM0_LRVW8_LWPMn1_MIAV1_MIWT1_1_MO40_NTn1_NTA0_NTB0_NTC0_NTD0_NTM0_NEPBS0_NLCA1_NLCB1_ONLL0_PGR1_PLR1_PKA0_SIA3_SS0_SU32_SUM1_SUS256_SPO0_SRVW0_SSO0_SVW8_SK0_SKXCCM0_TLDS0_ULSGRO0_USL1_UIOFGRO0_USFGROn1_VSn1_VWA1_VWB1_WSGRA0_WSGRB0_WS32_WG32_2_1_WGM8_WGMXCC1_WGMXCCGn1
    SolutionIndex: 215
    SolutionNameMin: Cijk_Ailk_Bjlk_HHS_BH_Bias_SHB_HA_S_SAB_SCD_SAV_UserArgs_MT64x64x32_MI16x16x1_SN_LDSB0_AFC1_AFEM1_AFEM1_ASEM1_CLR1_CADS0_DTLA0_DTLB0_DTVA0_DTVB1_EPS1_FDSI0_GRPM1_GRVWA8_GRVWB8_GSU1_GSUAMB_GSUC0_GSUWGMRR0_GLS0_ISA1201_IU1_K1_LBSPPA1024_LBSPPB0_LBSPPM0_LPA32_LPB0_LPM0_LRVW8_LWPMn1_MIAV1_MIWT2_2_MO40_NTn1_NTA0_NTB0_NTC0_NTD0_NTM0_NEPBS0_NLCA1_NLCB2_ONLL0_PGR1_PLR1_PKA0_SIA3_SS0_SU32_SUM1_SUS256_SPO0_SRVW0_SSO0_SVW8_SK0_SKXCCM0_TLDS0_ULSGRO0_USL1_UIOFGRO0_USFGROn1_VSn1_VWA2_VWB1_WSGRA0_WSGRB0_WS32_WG32_4_1_WGM8_WGMXCC1_WGMXCCGn1
    SolutionIndex: 216
    SolutionNameMin: Cijk_Ailk_Bjlk_HHS_BH_Bias_SHB_HA_S_SAB_SCD_SAV_UserArgs_MT64x64x32_MI16x16x1_SN_LDSB0_AFC1_AFEM1_AFEM1_ASEM1_CLR1_CADS0_DTLA0_DTLB0_DTVA0_DTVB0_EPS1_FDSI0_GRPM1_GRVWA8_GRVWB4_GSU1_GSUAMB_GSUC0_GSUWGMRR0_GLS0_ISA1201_IU1_K1_LBSPPA1024_LBSPPB1024_LBSPPM0_LPA32_LPB32_LPM0_LRVW8_LWPMn1_MIAV1_MIWT2_2_MO40_NTn1_NTA0_NTB0_NTC0_NTD0_NTM0_NEPBS0_NLCA1_NLCB1_ONLL0_PGR1_PLR1_PKA0_SIA3_SS0_SU32_SUM1_SUS256_SPO0_SRVW0_SSO0_SVW8_SK0_SKXCCM0_TLDS0_ULSGRO0_USL1_UIOFGRO0_USFGROn1_VSn1_VWA2_VWB2_WSGRA0_WSGRB0_WS32_WG32_4_1_WGM8_WGMXCC1_WGMXCCGn1
    SolutionIndex: 217
    SolutionNameMin: Cijk_Ailk_Bjlk_HHS_BH_Bias_SHB_HA_S_SAB_SCD_SAV_UserArgs_MT64x128x32_MI16x16x1_SN_LDSB1_AFC1_AFEM1_AFEM1_ASEM1_CLR1_CADS0_DTLA0_DTLB0_DTVA0_DTVB0_EPS0_FDSI0_GRPM1_GRVWA8_GRVWB4_GSU1_GSUAMB_GSUC0_GSUWGMRR0_GLS0_ISA1201_IU2_K1_LBSPPA1024_LBSPPB2048_LBSPPM0_LPA16_LPB0_LPM0_LRVW8_LWPMn1_MIAV1_MIWT1_8_MO40_NTn1_NTA0_NTB0_NTC0_NTD0_NTM0_NEPBS0_NLCA1_NLCB1_ONLL0_PGR2_PLR1_PKA0_SIA2_SS0_SU32_SUM1_SUS256_SPO0_SRVW0_SSO0_SVW8_SK0_SKXCCM0_TLDS0_ULSGRO0_USL1_UIOFGRO0_USFGROn1_VSn1_VWA1_VWB8_WSGRA0_WSGRB0_WS32_WG64_2_1_WGM8_WGMXCC1_WGMXCCGn1
    SolutionIndex: 225
    SolutionNameMin: Cijk_Ailk_Bjlk_HHS_BH_Bias_SHB_HA_S_SAB_SCD_SAV_UserArgs_MT64x64x64_MI16x16x1_SN_LDSB1_AFC1_AFEM1_AFEM1_ASEM1_CLR1_CADS0_DTLA0_DTLB0_DTVA0_DTVB0_EPS0_FDSI0_GRPM1_GRVWA8_GRVWB8_GSU1_GSUAMB_GSUC0_GSUWGMRR0_GLS0_ISA1201_IU4_K1_LBSPPA1024_LBSPPB1024_LBSPPM0_LPA32_LPB32_LPM0_LRVW8_LWPMn1_MIAV1_MIWT2_2_MO40_NTn1_NTA0_NTB0_NTC0_NTD0_NTM0_NEPBS0_NLCA1_NLCB1_ONLL0_PGR2_PLR1_PKA0_SIA2_SS1_SU32_SUM1_SUS256_SPO0_SRVW0_SSO0_SVW2_SK0_SKXCCM0_TLDS0_ULSGRO1_USL1_UIOFGRO0_USFGROn1_VSn1_VWA2_VWB2_WSGRA0_WSGRB0_WS32_WG32_4_1_WGM8_WGMXCC1_WGMXCCGn1
    SolutionIndex: 226
    SolutionNameMin: Cijk_Ailk_Bjlk_HHS_BH_Bias_SHB_HA_S_SAB_SCD_SAV_UserArgs_MT64x128x16_MI16x16x1_SN_LDSB0_AFC1_AFEM1_AFEM1_ASEM1_CLR1_CADS0_DTLA0_DTLB0_DTVA1_DTVB1_EPS0_FDSI0_GRPM1_GRVWA8_GRVWB8_GSU1_GSUAMB_GSUC0_GSUWGMRR0_GLS0_ISA1201_IU1_K1_LBSPPA0_LBSPPB0_LBSPPM0_LPA0_LPB0_LPM0_LRVW8_LWPMn1_MIAV1_MIWT1_8_MO40_NTn1_NTA0_NTB0_NTC0_NTD0_NTM0_NEPBS0_NLCA1_NLCB1_ONLL0_PGR1_PLR0_PKA0_SIA3_SS0_SU32_SUM1_SUS256_SPO0_SRVW0_SSO0_SVW8_SK0_SKXCCM0_TLDS0_ULSGRO0_USL1_UIOFGRO0_USFGROn1_VSn1_VWA1_VWB1_WSGRA0_WSGRB0_WS32_WG64_2_1_WGM8_WGMXCC1_WGMXCCGn1
    SolutionIndex: 228
    SolutionNameMin: Cijk_Ailk_Bjlk_HHS_BH_Bias_SHB_HA_S_SAB_SCD_SAV_UserArgs_MT32x128x32_MI16x16x1_SN_LDSB1_AFC1_AFEM1_AFEM1_ASEM1_CLR1_CADS0_DTLA0_DTLB0_DTVA0_DTVB0_EPS0_FDSI0_GRPM1_GRVWA1_GRVWB8_GSU1_GSUAMB_GSUC0_GSUWGMRR0_GLS0_ISA1201_IU2_K1_LBSPPA512_LBSPPB2048_LBSPPM0_LPA16_LPB0_LPM0_LRVW8_LWPMn1_MIAV1_MIWT1_4_MO40_NTn1_NTA0_NTB0_NTC0_NTD0_NTM0_NEPBS0_NLCA1_NLCB1_ONLL0_PGR2_PLR1_PKA0_SIA2_SS0_SU32_SUM1_SUS256_SPO0_SRVW0_SSO0_SVW8_SK0_SKXCCM0_TLDS0_ULSGRO0_USL1_UIOFGRO0_USFGROn1_VSn1_VWA1_VWB4_WSGRA0_WSGRB0_WS32_WG32_4_1_WGM8_WGMXCC1_WGMXCCGn1
    SolutionIndex: 230
    SolutionNameMin: Cijk_Ailk_Bjlk_HHS_BH_Bias_SHB_HA_S_SAB_SCD_SAV_UserArgs_MT64x128x32_MI16x16x1_SN_LDSB0_AFC1_AFEM1_AFEM1_ASEM1_CLR1_CADS0_DTLA0_DTLB0_DTVA0_DTVB1_EPS0_FDSI0_GRPM1_GRVWA4_GRVWB8_GSU1_GSUAMB_GSUC0_GSUWGMRR0_GLS0_ISA1201_IU1_K1_LBSPPA1024_LBSPPB0_LBSPPM0_LPA16_LPB0_LPM0_LRVW8_LWPMn1_MIAV1_MIWT1_8_MO40_NTn1_NTA0_NTB0_NTC0_NTD0_NTM0_NEPBS0_NLCA1_NLCB2_ONLL0_PGR2_PLR1_PKA0_SIA3_SS0_SU32_SUM1_SUS256_SPO0_SRVW0_SSO0_SVW8_SK0_SKXCCM0_TLDS0_ULSGRO0_USL1_UIOFGRO0_USFGROn1_VSn1_VWA1_VWB1_WSGRA0_WSGRB0_WS32_WG64_2_1_WGM8_WGMXCC1_WGMXCCGn1
    SolutionIndex: 231
    SolutionNameMin: Cijk_Ailk_Bjlk_HHS_BH_Bias_SHB_HA_S_SAB_SCD_SAV_UserArgs_MT64x64x32_MI16x16x1_SN_LDSB0_AFC1_AFEM1_AFEM1_ASEM1_CLR1_CADS0_DTLA0_DTLB0_DTVA0_DTVB0_EPS1_FDSI0_GRPM1_GRVWA1_GRVWB1_GSU1_GSUAMB_GSUC0_GSUWGMRR0_GLS0_ISA1201_IU1_K1_LBSPPA1024_LBSPPB1024_LBSPPM0_LPA32_LPB32_LPM0_LRVW8_LWPMn1_MIAV1_MIWT2_2_MO40_NTn1_NTA0_NTB0_NTC0_NTD0_NTM0_NEPBS0_NLCA1_NLCB1_ONLL0_PGR1_PLR1_PKA0_SIA3_SS0_SU32_SUM1_SUS256_SPO0_SRVW0_SSO0_SVW8_SK0_SKXCCM0_TLDS0_ULSGRO0_USL1_UIOFGRO0_USFGROn1_VSn1_VWA2_VWB2_WSGRA0_WSGRB0_WS32_WG32_4_1_WGM8_WGMXCC1_WGMXCCGn1
    SolutionIndex: 235
    SolutionNameMin: Cijk_Ailk_Bjlk_HHS_BH_Bias_SHB_HA_S_SAB_SCD_SAV_UserArgs_MT32x32x64_MI16x16x1_SN_LDSB0_AFC1_AFEM1_AFEM1_ASEM1_CLR1_CADS0_DTLA0_DTLB0_DTVA0_DTVB0_EPS0_FDSI0_GRPM1_GRVWA1_GRVWB1_GSU1_GSUAMB_GSUC0_GSUWGMRR0_GLS0_ISA1201_IU1_K1_LBSPPA512_LBSPPB512_LBSPPM0_LPA16_LPB16_LPM0_LRVW8_LWPMn1_MIAV1_MIWT1_1_MO40_NTn1_NTA0_NTB0_NTC0_NTD0_NTM0_NEPBS0_NLCA1_NLCB1_ONLL0_PGR2_PLR1_PKA0_SIA3_SS1_SU32_SUM1_SUS256_SPO0_SRVW0_SSO0_SVW1_SK0_SKXCCM0_TLDS0_ULSGRO1_USL1_UIOFGRO0_USFGROn1_VSn1_VWA1_VWB1_WSGRA0_WSGRB0_WS32_WG32_4_1_WGM8_WGMXCC1_WGMXCCGn1
    SolutionIndex: 239
    SolutionNameMin: Cijk_Ailk_Bjlk_HHS_BH_Bias_SHB_HA_S_SAB_SCD_SAV_UserArgs_MT64x64x64_MI16x16x1_SN_LDSB0_AFC1_AFEM1_AFEM1_ASEM1_CLR1_CADS0_DTLA0_DTLB0_DTVA1_DTVB1_EPS0_FDSI0_GRPM1_GRVWA8_GRVWB8_GSU1_GSUAMB_GSUC0_GSUWGMRR0_GLS0_ISA1201_IU1_K1_LBSPPA0_LBSPPB0_LBSPPM0_LPA0_LPB0_LPM0_LRVW8_LWPMn1_MIAV1_MIWT2_2_MO40_NTn1_NTA0_NTB0_NTC0_NTD0_NTM0_NEPBS0_NLCA4_NLCB4_ONLL0_PGR1_PLR0_PKA0_SIA3_SS0_SU32_SUM1_SUS256_SPO0_SRVW0_SSO0_SVW8_SK0_SKXCCM0_TLDS0_ULSGRO0_USL1_UIOFGRO0_USFGROn1_VSn1_VWA1_VWB1_WSGRA0_WSGRB0_WS32_WG32_4_1_WGM8_WGMXCC1_WGMXCCGn1
    SolutionIndex: 243
    SolutionNameMin: Cijk_Ailk_Bjlk_HHS_BH_Bias_SHB_HA_S_SAB_SCD_SAV_UserArgs_MT64x64x32_MI16x16x1_SN_LDSB0_AFC1_AFEM1_AFEM1_ASEM1_CLR1_CADS0_DTLA0_DTLB0_DTVA0_DTVB1_EPS0_FDSI0_GRPM1_GRVWA8_GRVWB8_GSU1_GSUAMB_GSUC0_GSUWGMRR0_GLS0_ISA1201_IU1_K1_LBSPPA1024_LBSPPB0_LBSPPM0_LPA32_LPB0_LPM0_LRVW8_LWPMn1_MIAV1_MIWT2_2_MO40_NTn1_NTA0_NTB0_NTC0_NTD0_NTM0_NEPBS0_NLCA1_NLCB2_ONLL0_PGR2_PLR1_PKA0_SIA3_SS0_SU32_SUM1_SUS256_SPO0_SRVW0_SSO0_SVW8_SK0_SKXCCM0_TLDS0_ULSGRO0_USL1_UIOFGRO0_USFGROn1_VSn1_VWA2_VWB1_WSGRA0_WSGRB0_WS32_WG32_4_1_WGM8_WGMXCC1_WGMXCCGn1
    SolutionIndex: 247
    SolutionNameMin: Cijk_Ailk_Bjlk_HHS_BH_Bias_SHB_HA_S_SAB_SCD_SAV_UserArgs_MT32x16x64_MI16x16x1_SN_LDSB0_AFC1_AFEM1_AFEM1_ASEM1_CLR1_CADS0_DTLA0_DTLB0_DTVA1_DTVB0_EPS1_FDSI0_GRPM1_GRVWA8_GRVWB4_GSU1_GSUAMB_GSUC0_GSUWGMRR0_GLS0_ISA1201_IU1_K1_LBSPPA0_LBSPPB256_LBSPPM0_LPA0_LPB16_LPM0_LRVW8_LWPMn1_MIAV1_MIWT1_1_MO40_NTn1_NTA0_NTB0_NTC0_NTD0_NTM0_NEPBS0_NLCA1_NLCB1_ONLL0_PGR1_PLR1_PKA0_SIA3_SS0_SU32_SUM1_SUS256_SPO0_SRVW0_SSO0_SVW8_SK0_SKXCCM0_TLDS0_ULSGRO0_USL1_UIOFGRO0_USFGROn1_VSn1_VWA1_VWB1_WSGRA0_WSGRB0_WS32_WG32_2_1_WGM8_WGMXCC1_WGMXCCGn1
    SolutionIndex: 248
    SolutionNameMin: Cijk_Ailk_Bjlk_HHS_BH_Bias_SHB_HA_S_SAB_SCD_SAV_UserArgs_MT64x64x32_MI16x16x1_SN_LDSB1_AFC1_AFEM1_AFEM1_ASEM1_CLR1_CADS0_DTLA0_DTLB0_DTVA0_DTVB0_EPS0_FDSI0_GRPM1_GRVWA8_GRVWB4_GSU1_GSUAMB_GSUC0_GSUWGMRR0_GLS0_ISA1201_IU2_K1_LBSPPA1024_LBSPPB1024_LBSPPM0_LPA32_LPB32_LPM0_LRVW8_LWPMn1_MIAV1_MIWT2_2_MO40_NTn1_NTA0_NTB0_NTC0_NTD0_NTM0_NEPBS0_NLCA1_NLCB1_ONLL0_PGR2_PLR1_PKA0_SIA2_SS0_SU32_SUM1_SUS256_SPO0_SRVW0_SSO0_SVW8_SK0_SKXCCM0_TLDS0_ULSGRO0_USL1_UIOFGRO0_USFGROn1_VSn1_VWA2_VWB2_WSGRA0_WSGRB0_WS32_WG32_4_1_WGM8_WGMXCC1_WGMXCCGn1
    SolutionIndex: 250
    SolutionNameMin: Cijk_Ailk_Bjlk_HHS_BH_Bias_SHB_HA_S_SAB_SCD_SAV_UserArgs_MT64x64x32_MI16x16x1_SN_LDSB0_AFC1_AFEM1_AFEM1_ASEM1_CLR1_CADS0_DTLA0_DTLB0_DTVA1_DTVB0_EPS1_FDSI0_GRPM1_GRVWA8_GRVWB8_GSU1_GSUAMB_GSUC0_GSUWGMRR0_GLS0_ISA1201_IU1_K1_LBSPPA0_LBSPPB1024_LBSPPM0_LPA0_LPB32_LPM0_LRVW8_LWPMn1_MIAV1_MIWT2_2_MO40_NTn1_NTA0_NTB0_NTC0_NTD0_NTM0_NEPBS0_NLCA2_NLCB1_ONLL0_PGR1_PLR1_PKA0_SIA3_SS0_SU32_SUM1_SUS256_SPO0_SRVW0_SSO0_SVW8_SK0_SKXCCM0_TLDS0_ULSGRO0_USL1_UIOFGRO0_USFGROn1_VSn1_VWA1_VWB2_WSGRA0_WSGRB0_WS32_WG32_4_1_WGM8_WGMXCC1_WGMXCCGn1
    SolutionIndex: 251
    SolutionNameMin: Cijk_Ailk_Bjlk_HHS_BH_Bias_SHB_HA_S_SAB_SCD_SAV_UserArgs_MT64x64x16_MI16x16x1_SN_LDSB1_AFC1_AFEM1_AFEM1_ASEM1_CLR1_CADS0_DTLA0_DTLB0_DTVA0_DTVB0_EPS1_FDSI0_GRPM1_GRVWA1_GRVWB4_GSU1_GSUAMB_GSUC0_GSUWGMRR0_GLS0_ISA1201_IU1_K1_LBSPPA1024_LBSPPB1024_LBSPPM0_LPA32_LPB32_LPM0_LRVW8_LWPMn1_MIAV1_MIWT2_2_MO40_NTn1_NTA0_NTB0_NTC0_NTD0_NTM0_NEPBS0_NLCA1_NLCB1_ONLL0_PGR1_PLR1_PKA0_SIA2_SS0_SU32_SUM1_SUS256_SPO0_SRVW0_SSO0_SVW8_SK0_SKXCCM0_TLDS0_ULSGRO0_USL1_UIOFGRO0_USFGROn1_VSn1_VWA2_VWB2_WSGRA0_WSGRB0_WS32_WG32_4_1_WGM8_WGMXCC1_WGMXCCGn1
    SolutionIndex: 252
    SolutionNameMin: Cijk_Ailk_Bjlk_HHS_BH_Bias_SHB_HA_S_SAB_SCD_SAV_UserArgs_MT64x128x16_MI16x16x1_SN_LDSB0_AFC1_AFEM1_AFEM1_ASEM1_CLR0_CADS0_DTLA0_DTLB0_DTVA0_DTVB0_EPS0_FDSI0_GRPM1_GRVWA8_GRVWB8_GSU1_GSUAMB_GSUC0_GSUWGMRR0_GLS0_ISA1201_IU1_K1_LBSPPA1024_LBSPPB2048_LBSPPM0_LPA16_LPB0_LPM0_LRVW8_LWPMn1_MIAV1_MIWT1_8_MO40_NTn1_NTA0_NTB0_NTC0_NTD0_NTM0_NEPBS0_NLCA1_NLCB1_ONLL0_PGR2_PLR0_PKA0_SIA3_SS0_SU32_SUM1_SUS256_SPO0_SRVW0_SSO0_SVW8_SK0_SKXCCM0_TLDS0_ULSGRO1_USL1_UIOFGRO0_USFGROn1_VSn1_VWA1_VWB8_WSGRA0_WSGRB0_WS32_WG64_2_1_WGM8_WGMXCC1_WGMXCCGn1
    SolutionIndex: 253
    SolutionNameMin: Cijk_Ailk_Bjlk_HHS_BH_Bias_SHB_HA_S_SAB_SCD_SAV_UserArgs_MT128x64x32_MI16x16x1_SN_LDSB0_AFC1_AFEM1_AFEM1_ASEM1_CLR1_CADS0_DTLA0_DTLB0_DTVA1_DTVB0_EPS0_FDSI0_GRPM1_GRVWA8_GRVWB4_GSU1_GSUAMB_GSUC0_GSUWGMRR0_GLS0_ISA1201_IU1_K1_LBSPPA0_LBSPPB1024_LBSPPM0_LPA0_LPB16_LPM0_LRVW8_LWPMn1_MIAV1_MIWT8_1_MO40_NTn1_NTA0_NTB0_NTC0_NTD0_NTM0_NEPBS0_NLCA2_NLCB1_ONLL0_PGR2_PLR1_PKA0_SIA3_SS0_SU32_SUM1_SUS256_SPO0_SRVW0_SSO0_SVW8_SK0_SKXCCM0_TLDS0_ULSGRO0_USL1_UIOFGRO0_USFGROn1_VSn1_VWA1_VWB1_WSGRA0_WSGRB0_WS32_WG16_8_1_WGM8_WGMXCC1_WGMXCCGn1
    SolutionIndex: 254
    SolutionNameMin: Cijk_Ailk_Bjlk_HHS_BH_Bias_SHB_HA_S_SAB_SCD_SAV_UserArgs_MT128x64x16_MI16x16x1_SN_LDSB0_AFC1_AFEM1_AFEM1_ASEM1_CLR1_CADS0_DTLA0_DTLB0_DTVA1_DTVB1_EPS0_FDSI0_GRPM1_GRVWA8_GRVWB8_GSU1_GSUAMB_GSUC0_GSUWGMRR0_GLS0_ISA1201_IU1_K1_LBSPPA0_LBSPPB0_LBSPPM0_LPA0_LPB0_LPM0_LRVW8_LWPMn1_MIAV1_MIWT8_1_MO40_NTn1_NTA0_NTB0_NTC0_NTD0_NTM0_NEPBS0_NLCA1_NLCB1_ONLL0_PGR1_PLR0_PKA0_SIA3_SS0_SU32_SUM1_SUS256_SPO0_SRVW0_SSO0_SVW8_SK0_SKXCCM0_TLDS0_ULSGRO0_USL1_UIOFGRO0_USFGROn1_VSn1_VWA1_VWB1_WSGRA0_WSGRB0_WS32_WG16_8_1_WGM8_WGMXCC1_WGMXCCGn1
    SolutionIndex: 260
    SolutionNameMin: Cijk_Ailk_Bjlk_HHS_BH_Bias_SHB_HA_S_SAB_SCD_SAV_UserArgs_MT16x256x16_MI16x16x1_SN_LDSB0_AFC1_AFEM1_AFEM1_ASEM1_CLR1_CADS0_DTLA0_DTLB0_DTVA1_DTVB1_EPS0_FDSI0_GRPM1_GRVWA8_GRVWB8_GSU1_GSUAMB_GSUC0_GSUWGMRR0_GLS0_ISA1201_IU1_K1_LBSPPA0_LBSPPB0_LBSPPM0_LPA0_LPB0_LPM0_LRVW8_LWPMn1_MIAV1_MIWT1_8_MO40_NTn1_NTA0_NTB0_NTC0_NTD0_NTM0_NEPBS0_NLCA1_NLCB1_ONLL0_PGR1_PLR0_PKA0_SIA3_SS0_SU32_SUM1_SUS256_SPO0_SRVW0_SSO0_SVW8_SK0_SKXCCM0_TLDS0_ULSGRO0_USL1_UIOFGRO0_USFGROn1_VSn1_VWA1_VWB1_WSGRA0_WSGRB0_WS32_WG16_4_1_WGM8_WGMXCC1_WGMXCCGn1
    SolutionIndex: 262
    SolutionNameMin: Cijk_Ailk_Bjlk_HHS_BH_Bias_SHB_HA_S_SAB_SCD_SAV_UserArgs_MT128x128x16_MI16x16x1_SN_LDSB1_AFC1_AFEM1_AFEM1_ASEM1_CLR1_CADS0_DTLA0_DTLB0_DTVA0_DTVB0_EPS1_FDSI0_GRPM1_GRVWA8_GRVWB4_GSU1_GSUAMB_GSUC0_GSUWGMRR0_GLS0_ISA1201_IU1_K1_LBSPPA2048_LBSPPB2048_LBSPPM0_LPA0_LPB0_LPM0_LRVW8_LWPMn1_MIAV1_MIWT4_4_MO40_NTn1_NTA0_NTB0_NTC0_NTD0_NTM0_NEPBS0_NLCA1_NLCB1_ONLL0_PGR1_PLR1_PKA0_SIA2_SS1_SU32_SUM1_SUS256_SPO0_SRVW0_SSO0_SVW4_SK0_SKXCCM0_TLDS0_ULSGRO0_USL1_UIOFGRO0_USFGROn1_VSn1_VWA4_VWB4_WSGRA0_WSGRB0_WS32_WG32_4_1_WGM8_WGMXCC1_WGMXCCGn1
    SolutionIndex: 263
    SolutionNameMin: Cijk_Ailk_Bjlk_HHS_BH_Bias_SHB_HA_S_SAB_SCD_SAV_UserArgs_MT128x128x16_MI16x16x1_SN_LDSB1_AFC1_AFEM1_AFEM1_ASEM1_CLR1_CADS0_DTLA0_DTLB0_DTVA0_DTVB0_EPS0_FDSI0_GRPM1_GRVWA8_GRVWB4_GSU1_GSUAMB_GSUC0_GSUWGMRR0_GLS0_ISA1201_IU1_K1_LBSPPA2048_LBSPPB2048_LBSPPM0_LPA0_LPB0_LPM0_LRVW8_LWPMn1_MIAV1_MIWT4_4_MO40_NTn1_NTA0_NTB0_NTC0_NTD0_NTM0_NEPBS0_NLCA1_NLCB1_ONLL0_PGR2_PLR1_PKA0_SIA2_SS1_SU32_SUM1_SUS256_SPO0_SRVW0_SSO0_SVW4_SK0_SKXCCM0_TLDS0_ULSGRO1_USL1_UIOFGRO0_USFGROn1_VSn1_VWA4_VWB4_WSGRA0_WSGRB0_WS32_WG32_4_1_WGM8_WGMXCC1_WGMXCCGn1
    SolutionIndex: 265
    SolutionNameMin: Cijk_Ailk_Bjlk_HHS_BH_Bias_SHB_HA_S_SAB_SCD_SAV_UserArgs_MT64x64x32_MI16x16x1_SN_LDSB0_AFC1_AFEM1_AFEM1_ASEM1_CLR1_CADS0_DTLA0_DTLB0_DTVA0_DTVB1_EPS1_FDSI0_GRPM1_GRVWA4_GRVWB8_GSU1_GSUAMB_GSUC0_GSUWGMRR0_GLS0_ISA1201_IU1_K1_LBSPPA1024_LBSPPB0_LBSPPM0_LPA32_LPB0_LPM0_LRVW8_LWPMn1_MIAV1_MIWT2_2_MO40_NTn1_NTA0_NTB0_NTC0_NTD0_NTM0_NEPBS0_NLCA1_NLCB2_ONLL0_PGR1_PLR1_PKA0_SIA3_SS0_SU32_SUM1_SUS256_SPO0_SRVW0_SSO0_SVW8_SK0_SKXCCM0_TLDS0_ULSGRO0_USL1_UIOFGRO0_USFGROn1_VSn1_VWA2_VWB1_WSGRA0_WSGRB0_WS32_WG32_4_1_WGM8_WGMXCC1_WGMXCCGn1
    SolutionIndex: 267
    SolutionNameMin: Cijk_Ailk_Bjlk_HHS_BH_Bias_SHB_HA_S_SAB_SCD_SAV_UserArgs_MT16x128x16_MI16x16x1_SN_LDSB0_AFC1_AFEM1_AFEM1_ASEM1_CLR1_CADS0_DTLA0_DTLB0_DTVA1_DTVB1_EPS0_FDSI0_GRPM1_GRVWA8_GRVWB8_GSU1_GSUAMB_GSUC0_GSUWGMRR0_GLS0_ISA1201_IU1_K1_LBSPPA0_LBSPPB0_LBSPPM0_LPA0_LPB0_LPM0_LRVW8_LWPMn1_MIAV1_MIWT1_8_MO40_NTn1_NTA0_NTB0_NTC0_NTD0_NTM0_NEPBS0_NLCA1_NLCB1_ONLL0_PGR1_PLR0_PKA0_SIA3_SS0_SU32_SUM1_SUS256_SPO0_SRVW0_SSO0_SVW8_SK0_SKXCCM0_TLDS0_ULSGRO0_USL1_UIOFGRO0_USFGROn1_VSn1_VWA1_VWB1_WSGRA0_WSGRB0_WS32_WG16_2_1_WGM8_WGMXCC1_WGMXCCGn1
    SolutionIndex: 273
    SolutionNameMin: Cijk_Ailk_Bjlk_HHS_BH_Bias_SHB_HA_S_SAB_SCD_SAV_UserArgs_MT64x128x32_MI16x16x1_SN_LDSB0_AFC1_AFEM1_AFEM1_ASEM1_CLR1_CADS0_DTLA0_DTLB0_DTVA0_DTVB1_EPS1_FDSI0_GRPM1_GRVWA8_GRVWB8_GSU1_GSUAMB_GSUC0_GSUWGMRR0_GLS0_ISA1201_IU1_K1_LBSPPA1024_LBSPPB0_LBSPPM0_LPA16_LPB0_LPM0_LRVW8_LWPMn1_MIAV1_MIWT1_8_MO40_NTn1_NTA0_NTB0_NTC0_NTD0_NTM0_NEPBS0_NLCA1_NLCB2_ONLL0_PGR1_PLR1_PKA0_SIA3_SS0_SU32_SUM1_SUS256_SPO0_SRVW0_SSO0_SVW8_SK0_SKXCCM0_TLDS0_ULSGRO0_USL1_UIOFGRO0_USFGROn1_VSn1_VWA1_VWB1_WSGRA0_WSGRB0_WS32_WG64_2_1_WGM8_WGMXCC1_WGMXCCGn1
    SolutionIndex: 276
    SolutionNameMin: Cijk_Ailk_Bjlk_HHS_BH_Bias_SHB_HA_S_SAB_SCD_SAV_UserArgs_MT64x128x32_MI16x16x1_SN_LDSB0_AFC1_AFEM1_AFEM1_ASEM1_CLR1_CADS0_DTLA0_DTLB0_DTVA0_DTVB1_EPS1_FDSI0_GRPM1_GRVWA4_GRVWB8_GSU1_GSUAMB_GSUC0_GSUWGMRR0_GLS0_ISA1201_IU1_K1_LBSPPA1024_LBSPPB0_LBSPPM0_LPA16_LPB0_LPM0_LRVW8_LWPMn1_MIAV1_MIWT1_8_MO40_NTn1_NTA0_NTB0_NTC0_NTD0_NTM0_NEPBS0_NLCA1_NLCB2_ONLL0_PGR1_PLR1_PKA0_SIA3_SS0_SU32_SUM1_SUS256_SPO0_SRVW0_SSO0_SVW8_SK0_SKXCCM0_TLDS0_ULSGRO0_USL1_UIOFGRO0_USFGROn1_VSn1_VWA1_VWB1_WSGRA0_WSGRB0_WS32_WG64_2_1_WGM8_WGMXCC1_WGMXCCGn1
    SolutionIndex: 278
    SolutionNameMin: Cijk_Ailk_Bjlk_HHS_BH_Bias_SHB_HA_S_SAB_SCD_SAV_UserArgs_MT128x128x16_MI16x16x1_SN_LDSB1_AFC1_AFEM1_AFEM1_ASEM1_CLR1_CADS0_DTLA0_DTLB0_DTVA0_DTVB0_EPS1_FDSI0_GRPM1_GRVWA4_GRVWB8_GSU1_GSUAMB_GSUC0_GSUWGMRR0_GLS0_ISA1201_IU1_K1_LBSPPA2048_LBSPPB2048_LBSPPM0_LPA0_LPB0_LPM0_LRVW8_LWPMn1_MIAV1_MIWT4_4_MO40_NTn1_NTA0_NTB0_NTC0_NTD0_NTM0_NEPBS0_NLCA1_NLCB1_ONLL0_PGR1_PLR1_PKA0_SIA2_SS1_SU32_SUM1_SUS256_SPO0_SRVW0_SSO0_SVW4_SK0_SKXCCM0_TLDS0_ULSGRO0_USL1_UIOFGRO0_USFGROn1_VSn1_VWA4_VWB4_WSGRA0_WSGRB0_WS32_WG32_4_1_WGM8_WGMXCC1_WGMXCCGn1
    SolutionIndex: 279
    SolutionNameMin: Cijk_Ailk_Bjlk_HHS_BH_Bias_SHB_HA_S_SAB_SCD_SAV_UserArgs_MT128x128x16_MI16x16x1_SN_LDSB1_AFC1_AFEM1_AFEM1_ASEM1_CLR1_CADS0_DTLA0_DTLB0_DTVA0_DTVB0_EPS0_FDSI0_GRPM1_GRVWA4_GRVWB8_GSU1_GSUAMB_GSUC0_GSUWGMRR0_GLS0_ISA1201_IU1_K1_LBSPPA2048_LBSPPB2048_LBSPPM0_LPA0_LPB32_LPM0_LRVW8_LWPMn1_MIAV1_MIWT8_2_MO40_NTn1_NTA0_NTB0_NTC0_NTD0_NTM0_NEPBS0_NLCA1_NLCB1_ONLL0_PGR2_PLR1_PKA0_SIA2_SS1_SU32_SUM1_SUS256_SPO0_SRVW0_SSO0_SVW8_SK0_SKXCCM0_TLDS0_ULSGRO1_USL1_UIOFGRO0_USFGROn1_VSn1_VWA8_VWB2_WSGRA0_WSGRB0_WS32_WG16_8_1_WGM8_WGMXCC1_WGMXCCGn1
    SolutionIndex: 280
    SolutionNameMin: Cijk_Ailk_Bjlk_HHS_BH_Bias_SHB_HA_S_SAB_SCD_SAV_UserArgs_MT32x32x128_MI16x16x1_SN_LDSB0_AFC1_AFEM1_AFEM1_ASEM1_CLR1_CADS0_DTLA0_DTLB0_DTVA0_DTVB1_EPS0_FDSI0_GRPM1_GRVWA8_GRVWB8_GSU1_GSUAMB_GSUC0_GSUWGMRR0_GLS0_ISA1201_IU1_K1_LBSPPA512_LBSPPB0_LBSPPM0_LPA16_LPB0_LPM0_LRVW8_LWPMn1_MIAV1_MIWT1_1_MO40_NTn1_NTA0_NTB0_NTC0_NTD0_NTM0_NEPBS0_NLCA1_NLCB1_ONLL0_PGR2_PLR1_PKA0_SIA3_SS0_SU32_SUM1_SUS256_SPO0_SRVW0_SSO0_SVW8_SK0_SKXCCM0_TLDS0_ULSGRO0_USL1_UIOFGRO0_USFGROn1_VSn1_VWA1_VWB1_WSGRA0_WSGRB0_WS32_WG32_4_1_WGM8_WGMXCC1_WGMXCCGn1
    SolutionIndex: 282
    SolutionNameMin: Cijk_Ailk_Bjlk_HHS_BH_Bias_SHB_HA_S_SAB_SCD_SAV_UserArgs_MT32x32x128_MI16x16x1_SN_LDSB0_AFC1_AFEM1_AFEM1_ASEM1_CLR1_CADS0_DTLA0_DTLB0_DTVA1_DTVB0_EPS0_FDSI0_GRPM1_GRVWA8_GRVWB4_GSU1_GSUAMB_GSUC0_GSUWGMRR0_GLS0_ISA1201_IU1_K1_LBSPPA0_LBSPPB512_LBSPPM0_LPA0_LPB16_LPM0_LRVW8_LWPMn1_MIAV1_MIWT1_1_MO40_NTn1_NTA0_NTB0_NTC0_NTD0_NTM0_NEPBS0_NLCA1_NLCB1_ONLL0_PGR2_PLR1_PKA0_SIA3_SS0_SU32_SUM1_SUS256_SPO0_SRVW0_SSO0_SVW8_SK0_SKXCCM0_TLDS0_ULSGRO0_USL1_UIOFGRO0_USFGROn1_VSn1_VWA1_VWB1_WSGRA0_WSGRB0_WS32_WG32_4_1_WGM8_WGMXCC1_WGMXCCGn1
    SolutionIndex: 284
    SolutionNameMin: Cijk_Ailk_Bjlk_HHS_BH_Bias_SHB_HA_S_SAB_SCD_SAV_UserArgs_MT32x32x128_MI16x16x1_SN_LDSB0_AFC1_AFEM1_AFEM1_ASEM1_CLR1_CADS0_DTLA0_DTLB0_DTVA0_DTVB1_EPS0_FDSI0_GRPM1_GRVWA8_GRVWB8_GSU1_GSUAMB_GSUC0_GSUWGMRR0_GLS0_ISA1201_IU1_K1_LBSPPA512_LBSPPB0_LBSPPM0_LPA16_LPB0_LPM0_LRVW8_LWPMn1_MIAV1_MIWT1_1_MO40_NTn1_NTA0_NTB0_NTC0_NTD0_NTM0_NEPBS0_NLCA1_NLCB1_ONLL0_PGR2_PLR1_PKA0_SIA3_SS1_SU32_SUM1_SUS256_SPO0_SRVW0_SSO0_SVW1_SK0_SKXCCM0_TLDS0_ULSGRO0_USL1_UIOFGRO0_USFGROn1_VSn1_VWA1_VWB1_WSGRA0_WSGRB0_WS32_WG32_4_1_WGM8_WGMXCC1_WGMXCCGn1
    SolutionIndex: 285
    SolutionNameMin: Cijk_Ailk_Bjlk_HHS_BH_Bias_SHB_HA_S_SAB_SCD_SAV_UserArgs_MT32x16x64_MI16x16x1_SN_LDSB0_AFC1_AFEM1_AFEM1_ASEM1_CLR1_CADS0_DTLA0_DTLB0_DTVA1_DTVB0_EPS0_FDSI0_GRPM1_GRVWA8_GRVWB8_GSU1_GSUAMB_GSUC0_GSUWGMRR0_GLS0_ISA1201_IU1_K1_LBSPPA0_LBSPPB256_LBSPPM0_LPA0_LPB16_LPM0_LRVW8_LWPMn1_MIAV1_MIWT1_1_MO40_NTn1_NTA0_NTB0_NTC0_NTD0_NTM0_NEPBS0_NLCA1_NLCB1_ONLL0_PGR2_PLR1_PKA0_SIA3_SS0_SU32_SUM1_SUS256_SPO0_SRVW0_SSO0_SVW8_SK0_SKXCCM0_TLDS0_ULSGRO0_USL1_UIOFGRO0_USFGROn1_VSn1_VWA1_VWB1_WSGRA0_WSGRB0_WS32_WG32_2_1_WGM8_WGMXCC1_WGMXCCGn1
    SolutionIndex: 288
    SolutionNameMin: Cijk_Ailk_Bjlk_HHS_BH_Bias_SHB_HA_S_SAB_SCD_SAV_UserArgs_MT32x32x128_MI16x16x1_SN_LDSB0_AFC1_AFEM1_AFEM1_ASEM1_CLR1_CADS0_DTLA0_DTLB0_DTVA0_DTVB1_EPS0_FDSI0_GRPM1_GRVWA4_GRVWB8_GSU1_GSUAMB_GSUC0_GSUWGMRR0_GLS0_ISA1201_IU1_K1_LBSPPA512_LBSPPB0_LBSPPM0_LPA16_LPB0_LPM0_LRVW8_LWPMn1_MIAV1_MIWT1_1_MO40_NTn1_NTA0_NTB0_NTC0_NTD0_NTM0_NEPBS0_NLCA1_NLCB1_ONLL0_PGR2_PLR1_PKA0_SIA3_SS0_SU32_SUM1_SUS256_SPO0_SRVW0_SSO0_SVW8_SK0_SKXCCM0_TLDS0_ULSGRO0_USL1_UIOFGRO0_USFGROn1_VSn1_VWA1_VWB1_WSGRA0_WSGRB0_WS32_WG32_4_1_WGM8_WGMXCC1_WGMXCCGn1
    SolutionIndex: 290
    SolutionNameMin: Cijk_Ailk_Bjlk_HHS_BH_Bias_SHB_HA_S_SAB_SCD_SAV_UserArgs_MT32x32x128_MI16x16x1_SN_LDSB0_AFC1_AFEM1_AFEM1_ASEM1_CLR1_CADS0_DTLA0_DTLB0_DTVA1_DTVB0_EPS1_FDSI0_GRPM1_GRVWA8_GRVWB8_GSU1_GSUAMB_GSUC0_GSUWGMRR0_GLS0_ISA1201_IU1_K1_LBSPPA0_LBSPPB512_LBSPPM0_LPA0_LPB16_LPM0_LRVW8_LWPMn1_MIAV1_MIWT1_1_MO40_NTn1_NTA0_NTB0_NTC0_NTD0_NTM0_NEPBS0_NLCA1_NLCB1_ONLL0_PGR1_PLR1_PKA0_SIA3_SS0_SU32_SUM1_SUS256_SPO0_SRVW0_SSO0_SVW8_SK0_SKXCCM0_TLDS0_ULSGRO0_USL1_UIOFGRO0_USFGROn1_VSn1_VWA1_VWB1_WSGRA0_WSGRB0_WS32_WG32_4_1_WGM8_WGMXCC1_WGMXCCGn1
    SolutionIndex: 294
    SolutionNameMin: Cijk_Ailk_Bjlk_HHS_BH_Bias_SHB_HA_S_SAB_SCD_SAV_UserArgs_MT32x32x64_MI16x16x1_SN_LDSB0_AFC1_AFEM1_AFEM1_ASEM1_CLR1_CADS0_DTLA0_DTLB0_DTVA0_DTVB1_EPS0_FDSI0_GRPM1_GRVWA8_GRVWB8_GSU1_GSUAMB_GSUC0_GSUWGMRR0_GLS0_ISA1201_IU1_K1_LBSPPA512_LBSPPB0_LBSPPM0_LPA16_LPB0_LPM0_LRVW8_LWPMn1_MIAV1_MIWT1_1_MO40_NTn1_NTA0_NTB0_NTC0_NTD0_NTM0_NEPBS0_NLCA1_NLCB1_ONLL0_PGR2_PLR1_PKA0_SIA3_SS0_SU32_SUM1_SUS256_SPO0_SRVW0_SSO0_SVW8_SK0_SKXCCM0_TLDS0_ULSGRO0_USL1_UIOFGRO0_USFGROn1_VSn1_VWA1_VWB1_WSGRA0_WSGRB0_WS32_WG32_4_1_WGM8_WGMXCC1_WGMXCCGn1
    SolutionIndex: 296
    SolutionNameMin: Cijk_Ailk_Bjlk_HHS_BH_Bias_SHB_HA_S_SAB_SCD_SAV_UserArgs_MT32x32x128_MI16x16x1_SN_LDSB0_AFC1_AFEM1_AFEM1_ASEM1_CLR1_CADS0_DTLA0_DTLB0_DTVA1_DTVB0_EPS0_FDSI0_GRPM1_GRVWA8_GRVWB8_GSU1_GSUAMB_GSUC0_GSUWGMRR0_GLS0_ISA1201_IU1_K1_LBSPPA0_LBSPPB512_LBSPPM0_LPA0_LPB16_LPM0_LRVW8_LWPMn1_MIAV1_MIWT1_1_MO40_NTn1_NTA0_NTB0_NTC0_NTD0_NTM0_NEPBS0_NLCA1_NLCB1_ONLL0_PGR2_PLR1_PKA0_SIA3_SS1_SU32_SUM1_SUS256_SPO0_SRVW0_SSO0_SVW1_SK0_SKXCCM0_TLDS0_ULSGRO0_USL1_UIOFGRO0_USFGROn1_VSn1_VWA1_VWB1_WSGRA0_WSGRB0_WS32_WG32_4_1_WGM8_WGMXCC1_WGMXCCGn1
    SolutionIndex: 297
    SolutionNameMin: Cijk_Ailk_Bjlk_HHS_BH_Bias_SHB_HA_S_SAB_SCD_SAV_UserArgs_MT64x64x64_MI16x16x1_SN_LDSB0_AFC1_AFEM1_AFEM1_ASEM1_CLR1_CADS0_DTLA0_DTLB0_DTVA0_DTVB1_EPS1_FDSI0_GRPM1_GRVWA4_GRVWB8_GSU1_GSUAMB_GSUC0_GSUWGMRR0_GLS0_ISA1201_IU1_K1_LBSPPA1024_LBSPPB0_LBSPPM0_LPA32_LPB0_LPM0_LRVW8_LWPMn1_MIAV1_MIWT2_2_MO40_NTn1_NTA0_NTB0_NTC0_NTD0_NTM0_NEPBS0_NLCA1_NLCB4_ONLL0_PGR1_PLR1_PKA0_SIA3_SS0_SU32_SUM1_SUS256_SPO0_SRVW0_SSO0_SVW8_SK0_SKXCCM0_TLDS0_ULSGRO0_USL1_UIOFGRO0_USFGROn1_VSn1_VWA2_VWB1_WSGRA0_WSGRB0_WS32_WG32_4_1_WGM8_WGMXCC1_WGMXCCGn1
    SolutionIndex: 298
    SolutionNameMin: Cijk_Ailk_Bjlk_HHS_BH_Bias_SHB_HA_S_SAB_SCD_SAV_UserArgs_MT32x128x64_MI16x16x1_SN_LDSB0_AFC1_AFEM1_AFEM1_ASEM1_CLR1_CADS0_DTLA0_DTLB0_DTVA0_DTVB1_EPS1_FDSI0_GRPM1_GRVWA8_GRVWB8_GSU1_GSUAMB_GSUC0_GSUWGMRR0_GLS0_ISA1201_IU1_K1_LBSPPA512_LBSPPB0_LBSPPM0_LPA16_LPB0_LPM0_LRVW8_LWPMn1_MIAV1_MIWT1_4_MO40_NTn1_NTA0_NTB0_NTC0_NTD0_NTM0_NEPBS0_NLCA1_NLCB4_ONLL0_PGR1_PLR1_PKA0_SIA3_SS0_SU32_SUM1_SUS256_SPO0_SRVW0_SSO0_SVW8_SK0_SKXCCM0_TLDS0_ULSGRO0_USL1_UIOFGRO0_USFGROn1_VSn1_VWA1_VWB1_WSGRA0_WSGRB0_WS32_WG32_4_1_WGM8_WGMXCC1_WGMXCCGn1
    SolutionIndex: 300
    SolutionNameMin: Cijk_Ailk_Bjlk_HHS_BH_Bias_SHB_HA_S_SAB_SCD_SAV_UserArgs_MT64x64x64_MI16x16x1_SN_LDSB0_AFC1_AFEM1_AFEM1_ASEM1_CLR1_CADS0_DTLA0_DTLB0_DTVA1_DTVB0_EPS1_FDSI0_GRPM1_GRVWA8_GRVWB8_GSU1_GSUAMB_GSUC0_GSUWGMRR0_GLS0_ISA1201_IU1_K1_LBSPPA0_LBSPPB1024_LBSPPM0_LPA0_LPB32_LPM0_LRVW8_LWPMn1_MIAV1_MIWT2_2_MO40_NTn1_NTA0_NTB0_NTC0_NTD0_NTM0_NEPBS0_NLCA4_NLCB1_ONLL0_PGR1_PLR1_PKA0_SIA3_SS0_SU32_SUM1_SUS256_SPO0_SRVW0_SSO0_SVW8_SK0_SKXCCM0_TLDS0_ULSGRO0_USL1_UIOFGRO0_USFGROn1_VSn1_VWA1_VWB2_WSGRA0_WSGRB0_WS32_WG32_4_1_WGM8_WGMXCC1_WGMXCCGn1
    SolutionIndex: 301
    SolutionNameMin: Cijk_Ailk_Bjlk_HHS_BH_Bias_SHB_HA_S_SAB_SCD_SAV_UserArgs_MT32x32x128_MI16x16x1_SN_LDSB0_AFC1_AFEM1_AFEM1_ASEM1_CLR1_CADS0_DTLA0_DTLB0_DTVA0_DTVB1_EPS1_FDSI0_GRPM1_GRVWA4_GRVWB8_GSU1_GSUAMB_GSUC0_GSUWGMRR0_GLS0_ISA1201_IU1_K1_LBSPPA512_LBSPPB0_LBSPPM0_LPA16_LPB0_LPM0_LRVW8_LWPMn1_MIAV1_MIWT1_1_MO40_NTn1_NTA0_NTB0_NTC0_NTD0_NTM0_NEPBS0_NLCA1_NLCB1_ONLL0_PGR1_PLR1_PKA0_SIA3_SS0_SU32_SUM1_SUS256_SPO0_SRVW0_SSO0_SVW8_SK0_SKXCCM0_TLDS0_ULSGRO0_USL1_UIOFGRO0_USFGROn1_VSn1_VWA1_VWB1_WSGRA0_WSGRB0_WS32_WG32_4_1_WGM8_WGMXCC1_WGMXCCGn1
    SolutionIndex: 303
    SolutionNameMin: Cijk_Ailk_Bjlk_HHS_BH_Bias_SHB_HA_S_SAB_SCD_SAV_UserArgs_MT64x64x64_MI16x16x1_SN_LDSB0_AFC1_AFEM1_AFEM1_ASEM1_CLR1_CADS0_DTLA0_DTLB0_DTVA0_DTVB1_EPS1_FDSI0_GRPM1_GRVWA8_GRVWB8_GSU1_GSUAMB_GSUC0_GSUWGMRR0_GLS0_ISA1201_IU1_K1_LBSPPA1024_LBSPPB0_LBSPPM0_LPA32_LPB0_LPM0_LRVW8_LWPMn1_MIAV1_MIWT2_2_MO40_NTn1_NTA0_NTB0_NTC0_NTD0_NTM0_NEPBS0_NLCA1_NLCB4_ONLL0_PGR1_PLR1_PKA0_SIA3_SS0_SU32_SUM1_SUS256_SPO0_SRVW0_SSO0_SVW8_SK0_SKXCCM0_TLDS0_ULSGRO0_USL1_UIOFGRO0_USFGROn1_VSn1_VWA2_VWB1_WSGRA0_WSGRB0_WS32_WG32_4_1_WGM8_WGMXCC1_WGMXCCGn1
    SolutionIndex: 304
    SolutionNameMin: Cijk_Ailk_Bjlk_HHS_BH_Bias_SHB_HA_S_SAB_SCD_SAV_UserArgs_MT64x64x64_MI16x16x1_SN_LDSB1_AFC1_AFEM1_AFEM1_ASEM1_CLR1_CADS0_DTLA0_DTLB0_DTVA0_DTVB0_EPS1_FDSI0_GRPM1_GRVWA8_GRVWB8_GSU1_GSUAMB_GSUC0_GSUWGMRR0_GLS0_ISA1201_IU1_K1_LBSPPA1024_LBSPPB1024_LBSPPM0_LPA32_LPB32_LPM0_LRVW8_LWPMn1_MIAV1_MIWT2_2_MO40_NTn1_NTA0_NTB0_NTC0_NTD0_NTM0_NEPBS0_NLCA1_NLCB1_ONLL0_PGR1_PLR1_PKA0_SIA3_SS0_SU32_SUM1_SUS256_SPO0_SRVW0_SSO0_SVW8_SK0_SKXCCM0_TLDS0_ULSGRO0_USL1_UIOFGRO0_USFGROn1_VSn1_VWA2_VWB2_WSGRA0_WSGRB0_WS32_WG32_4_1_WGM8_WGMXCC1_WGMXCCGn1
    SolutionIndex: 305
    SolutionNameMin: Cijk_Ailk_Bjlk_HHS_BH_Bias_SHB_HA_S_SAB_SCD_SAV_UserArgs_MT64x64x32_MI16x16x1_SN_LDSB0_AFC1_AFEM1_AFEM1_ASEM1_CLR1_CADS0_DTLA0_DTLB0_DTVA0_DTVB0_EPS0_FDSI0_GRPM1_GRVWA8_GRVWB8_GSU1_GSUAMB_GSUC0_GSUWGMRR0_GLS0_ISA1201_IU1_K1_LBSPPA1024_LBSPPB1024_LBSPPM0_LPA32_LPB32_LPM0_LRVW8_LWPMn1_MIAV1_MIWT2_2_MO40_NTn1_NTA0_NTB0_NTC0_NTD0_NTM0_NEPBS0_NLCA1_NLCB1_ONLL0_PGR2_PLR1_PKA0_SIA3_SS0_SU32_SUM1_SUS256_SPO0_SRVW0_SSO0_SVW8_SK0_SKXCCM0_TLDS0_ULSGRO0_USL1_UIOFGRO0_USFGROn1_VSn1_VWA2_VWB2_WSGRA0_WSGRB0_WS32_WG32_4_1_WGM8_WGMXCC1_WGMXCCGn1
    SolutionIndex: 307
    SolutionNameMin: Cijk_Ailk_Bjlk_HHS_BH_Bias_SHB_HA_S_SAB_SCD_SAV_UserArgs_MT32x32x128_MI16x16x1_SN_LDSB0_AFC1_AFEM1_AFEM1_ASEM1_CLR1_CADS0_DTLA0_DTLB0_DTVA1_DTVB0_EPS0_FDSI0_GRPM1_GRVWA8_GRVWB8_GSU1_GSUAMB_GSUC0_GSUWGMRR0_GLS0_ISA1201_IU1_K1_LBSPPA0_LBSPPB512_LBSPPM0_LPA0_LPB16_LPM0_LRVW8_LWPMn1_MIAV1_MIWT1_1_MO40_NTn1_NTA0_NTB0_NTC0_NTD0_NTM0_NEPBS0_NLCA1_NLCB1_ONLL0_PGR2_PLR1_PKA0_SIA3_SS0_SU32_SUM1_SUS256_SPO0_SRVW0_SSO0_SVW8_SK0_SKXCCM0_TLDS0_ULSGRO0_USL1_UIOFGRO0_USFGROn1_VSn1_VWA1_VWB1_WSGRA0_WSGRB0_WS32_WG32_4_1_WGM8_WGMXCC1_WGMXCCGn1
    SolutionIndex: 311
    SolutionNameMin: Cijk_Ailk_Bjlk_HHS_BH_Bias_SHB_HA_S_SAB_SCD_SAV_UserArgs_MT64x64x64_MI16x16x1_SN_LDSB1_AFC1_AFEM1_AFEM1_ASEM1_CLR1_CADS0_DTLA0_DTLB0_DTVA0_DTVB0_EPS1_FDSI0_GRPM1_GRVWA8_GRVWB4_GSU1_GSUAMB_GSUC0_GSUWGMRR0_GLS0_ISA1201_IU4_K1_LBSPPA1024_LBSPPB1024_LBSPPM0_LPA32_LPB32_LPM0_LRVW8_LWPMn1_MIAV1_MIWT2_2_MO40_NTn1_NTA0_NTB0_NTC0_NTD0_NTM0_NEPBS0_NLCA1_NLCB1_ONLL0_PGR1_PLR1_PKA0_SIA2_SS0_SU32_SUM1_SUS256_SPO0_SRVW0_SSO0_SVW8_SK0_SKXCCM0_TLDS0_ULSGRO0_USL1_UIOFGRO0_USFGROn1_VSn1_VWA2_VWB2_WSGRA0_WSGRB0_WS32_WG32_4_1_WGM8_WGMXCC1_WGMXCCGn1
    SolutionIndex: 312
    SolutionNameMin: Cijk_Ailk_Bjlk_HHS_BH_Bias_SHB_HA_S_SAB_SCD_SAV_UserArgs_MT16x32x64_MI16x16x1_SN_LDSB0_AFC1_AFEM1_AFEM1_ASEM1_CLR1_CADS0_DTLA0_DTLB0_DTVA1_DTVB0_EPS0_FDSI0_GRPM1_GRVWA8_GRVWB4_GSU1_GSUAMB_GSUC0_GSUWGMRR0_GLS0_ISA1201_IU1_K1_LBSPPA0_LBSPPB512_LBSPPM0_LPA0_LPB16_LPM0_LRVW8_LWPMn1_MIAV1_MIWT1_1_MO40_NTn1_NTA0_NTB0_NTC0_NTD0_NTM0_NEPBS0_NLCA1_NLCB1_ONLL0_PGR2_PLR1_PKA0_SIA3_SS0_SU32_SUM1_SUS256_SPO0_SRVW0_SSO0_SVW8_SK0_SKXCCM0_TLDS0_ULSGRO0_USL1_UIOFGRO0_USFGROn1_VSn1_VWA1_VWB1_WSGRA0_WSGRB0_WS32_WG16_4_1_WGM8_WGMXCC1_WGMXCCGn1
    SolutionIndex: 313
    SolutionNameMin: Cijk_Ailk_Bjlk_HHS_BH_Bias_SHB_HA_S_SAB_SCD_SAV_UserArgs_MT32x32x64_MI16x16x1_SN_LDSB0_AFC1_AFEM1_AFEM1_ASEM1_CLR1_CADS0_DTLA0_DTLB0_DTVA1_DTVB0_EPS0_FDSI0_GRPM1_GRVWA8_GRVWB4_GSU1_GSUAMB_GSUC0_GSUWGMRR0_GLS0_ISA1201_IU1_K1_LBSPPA0_LBSPPB512_LBSPPM0_LPA0_LPB16_LPM0_LRVW8_LWPMn1_MIAV1_MIWT1_1_MO40_NTn1_NTA0_NTB0_NTC0_NTD0_NTM0_NEPBS0_NLCA1_NLCB1_ONLL0_PGR2_PLR1_PKA0_SIA3_SS0_SU32_SUM1_SUS256_SPO0_SRVW0_SSO0_SVW8_SK0_SKXCCM0_TLDS0_ULSGRO0_USL1_UIOFGRO0_USFGROn1_VSn1_VWA1_VWB1_WSGRA0_WSGRB0_WS32_WG32_4_1_WGM8_WGMXCC1_WGMXCCGn1
    SolutionIndex: 315
    SolutionNameMin: Cijk_Ailk_Bjlk_HHS_BH_Bias_SHB_HA_S_SAB_SCD_SAV_UserArgs_MT64x64x64_MI16x16x1_SN_LDSB0_AFC1_AFEM1_AFEM1_ASEM1_CLR1_CADS0_DTLA0_DTLB0_DTVA1_DTVB0_EPS0_FDSI0_GRPM1_GRVWA8_GRVWB8_GSU1_GSUAMB_GSUC0_GSUWGMRR0_GLS0_ISA1201_IU1_K1_LBSPPA0_LBSPPB1024_LBSPPM0_LPA0_LPB32_LPM0_LRVW8_LWPMn1_MIAV1_MIWT2_2_MO40_NTn1_NTA0_NTB0_NTC0_NTD0_NTM0_NEPBS0_NLCA4_NLCB1_ONLL0_PGR2_PLR1_PKA0_SIA3_SS0_SU32_SUM1_SUS256_SPO0_SRVW0_SSO0_SVW8_SK0_SKXCCM0_TLDS0_ULSGRO0_USL1_UIOFGRO0_USFGROn1_VSn1_VWA1_VWB2_WSGRA0_WSGRB0_WS32_WG32_4_1_WGM8_WGMXCC1_WGMXCCGn1
    SolutionIndex: 318
    SolutionNameMin: Cijk_Ailk_Bjlk_HHS_BH_Bias_SHB_HA_S_SAB_SCD_SAV_UserArgs_MT32x128x64_MI16x16x1_SN_LDSB0_AFC1_AFEM1_AFEM1_ASEM1_CLR1_CADS0_DTLA0_DTLB0_DTVA0_DTVB1_EPS0_FDSI0_GRPM1_GRVWA8_GRVWB8_GSU1_GSUAMB_GSUC0_GSUWGMRR0_GLS0_ISA1201_IU1_K1_LBSPPA512_LBSPPB0_LBSPPM0_LPA16_LPB0_LPM0_LRVW8_LWPMn1_MIAV1_MIWT1_4_MO40_NTn1_NTA0_NTB0_NTC0_NTD0_NTM0_NEPBS0_NLCA1_NLCB4_ONLL0_PGR2_PLR1_PKA0_SIA3_SS0_SU32_SUM1_SUS256_SPO0_SRVW0_SSO0_SVW8_SK0_SKXCCM0_TLDS0_ULSGRO0_USL1_UIOFGRO0_USFGROn1_VSn1_VWA1_VWB1_WSGRA0_WSGRB0_WS32_WG32_4_1_WGM8_WGMXCC1_WGMXCCGn1
    SolutionIndex: 320
    SolutionNameMin: Cijk_Ailk_Bjlk_HHS_BH_Bias_SHB_HA_S_SAB_SCD_SAV_UserArgs_MT64x64x64_MI16x16x1_SN_LDSB0_AFC1_AFEM1_AFEM1_ASEM1_CLR1_CADS0_DTLA0_DTLB0_DTVA0_DTVB1_EPS1_FDSI0_GRPM1_GRVWA8_GRVWB8_GSU1_GSUAMB_GSUC0_GSUWGMRR0_GLS0_ISA1201_IU1_K1_LBSPPA1024_LBSPPB0_LBSPPM0_LPA32_LPB0_LPM0_LRVW8_LWPMn1_MIAV1_MIWT2_2_MO40_NTn1_NTA0_NTB0_NTC0_NTD0_NTM0_NEPBS0_NLCA1_NLCB4_ONLL0_PGR1_PLR1_PKA0_SIA3_SS1_SU32_SUM1_SUS256_SPO0_SRVW0_SSO0_SVW2_SK0_SKXCCM0_TLDS0_ULSGRO0_USL1_UIOFGRO0_USFGROn1_VSn1_VWA2_VWB1_WSGRA0_WSGRB0_WS32_WG32_4_1_WGM8_WGMXCC1_WGMXCCGn1
    SolutionIndex: 322
    SolutionNameMin: Cijk_Ailk_Bjlk_HHS_BH_Bias_SHB_HA_S_SAB_SCD_SAV_UserArgs_MT64x64x32_MI16x16x1_SN_LDSB0_AFC1_AFEM1_AFEM1_ASEM1_CLR1_CADS0_DTLA0_DTLB0_DTVA0_DTVB1_EPS0_FDSI0_GRPM1_GRVWA4_GRVWB8_GSU1_GSUAMB_GSUC0_GSUWGMRR0_GLS0_ISA1201_IU1_K1_LBSPPA1024_LBSPPB0_LBSPPM0_LPA32_LPB0_LPM0_LRVW8_LWPMn1_MIAV1_MIWT2_2_MO40_NTn1_NTA0_NTB0_NTC0_NTD0_NTM0_NEPBS0_NLCA1_NLCB2_ONLL0_PGR2_PLR1_PKA0_SIA3_SS0_SU32_SUM1_SUS256_SPO0_SRVW0_SSO0_SVW8_SK0_SKXCCM0_TLDS0_ULSGRO0_USL1_UIOFGRO0_USFGROn1_VSn1_VWA2_VWB1_WSGRA0_WSGRB0_WS32_WG32_4_1_WGM8_WGMXCC1_WGMXCCGn1
    SolutionIndex: 328
    SolutionNameMin: Cijk_Ailk_Bjlk_HHS_BH_Bias_SHB_HA_S_SAB_SCD_SAV_UserArgs_MT32x128x64_MI16x16x1_SN_LDSB0_AFC1_AFEM1_AFEM1_ASEM1_CLR1_CADS0_DTLA0_DTLB0_DTVA0_DTVB1_EPS1_FDSI0_GRPM1_GRVWA4_GRVWB8_GSU1_GSUAMB_GSUC0_GSUWGMRR0_GLS0_ISA1201_IU1_K1_LBSPPA512_LBSPPB0_LBSPPM0_LPA16_LPB0_LPM0_LRVW8_LWPMn1_MIAV1_MIWT1_4_MO40_NTn1_NTA0_NTB0_NTC0_NTD0_NTM0_NEPBS0_NLCA1_NLCB4_ONLL0_PGR1_PLR1_PKA0_SIA3_SS0_SU32_SUM1_SUS256_SPO0_SRVW0_SSO0_SVW8_SK0_SKXCCM0_TLDS0_ULSGRO0_USL1_UIOFGRO0_USFGROn1_VSn1_VWA1_VWB1_WSGRA0_WSGRB0_WS32_WG32_4_1_WGM8_WGMXCC1_WGMXCCGn1
    SolutionIndex: 330
    SolutionNameMin: Cijk_Ailk_Bjlk_HHS_BH_Bias_SHB_HA_S_SAB_SCD_SAV_UserArgs_MT64x64x64_MI16x16x1_SN_LDSB0_AFC1_AFEM1_AFEM1_ASEM1_CLR1_CADS0_DTLA0_DTLB0_DTVA0_DTVB1_EPS1_FDSI0_GRPM1_GRVWA4_GRVWB8_GSU1_GSUAMB_GSUC0_GSUWGMRR0_GLS0_ISA1201_IU1_K1_LBSPPA1024_LBSPPB0_LBSPPM0_LPA32_LPB0_LPM0_LRVW8_LWPMn1_MIAV1_MIWT2_2_MO40_NTn1_NTA0_NTB0_NTC0_NTD0_NTM0_NEPBS0_NLCA1_NLCB4_ONLL0_PGR1_PLR1_PKA0_SIA3_SS1_SU32_SUM1_SUS256_SPO0_SRVW0_SSO0_SVW2_SK0_SKXCCM0_TLDS0_ULSGRO0_USL1_UIOFGRO0_USFGROn1_VSn1_VWA2_VWB1_WSGRA0_WSGRB0_WS32_WG32_4_1_WGM8_WGMXCC1_WGMXCCGn1
    SolutionIndex: 331
    SolutionNameMin: Cijk_Ailk_Bjlk_HHS_BH_Bias_SHB_HA_S_SAB_SCD_SAV_UserArgs_MT32x32x128_MI16x16x1_SN_LDSB0_AFC1_AFEM1_AFEM1_ASEM1_CLR1_CADS0_DTLA0_DTLB0_DTVA1_DTVB0_EPS1_FDSI0_GRPM1_GRVWA8_GRVWB4_GSU1_GSUAMB_GSUC0_GSUWGMRR0_GLS0_ISA1201_IU1_K1_LBSPPA0_LBSPPB512_LBSPPM0_LPA0_LPB16_LPM0_LRVW8_LWPMn1_MIAV1_MIWT1_1_MO40_NTn1_NTA0_NTB0_NTC0_NTD0_NTM0_NEPBS0_NLCA1_NLCB1_ONLL0_PGR1_PLR1_PKA0_SIA3_SS0_SU32_SUM1_SUS256_SPO0_SRVW0_SSO0_SVW8_SK0_SKXCCM0_TLDS0_ULSGRO0_USL1_UIOFGRO0_USFGROn1_VSn1_VWA1_VWB1_WSGRA0_WSGRB0_WS32_WG32_4_1_WGM8_WGMXCC1_WGMXCCGn1
    SolutionIndex: 332
    SolutionNameMin: Cijk_Ailk_Bjlk_HHS_BH_Bias_SHB_HA_S_SAB_SCD_SAV_UserArgs_MT64x128x32_MI16x16x1_SN_LDSB0_AFC1_AFEM1_AFEM1_ASEM1_CLR1_CADS0_DTLA0_DTLB0_DTVA0_DTVB1_EPS0_FDSI0_GRPM1_GRVWA8_GRVWB8_GSU1_GSUAMB_GSUC0_GSUWGMRR0_GLS0_ISA1201_IU1_K1_LBSPPA1024_LBSPPB0_LBSPPM0_LPA16_LPB0_LPM0_LRVW8_LWPMn1_MIAV1_MIWT1_8_MO40_NTn1_NTA0_NTB0_NTC0_NTD0_NTM0_NEPBS0_NLCA1_NLCB2_ONLL0_PGR2_PLR1_PKA0_SIA3_SS0_SU32_SUM1_SUS256_SPO0_SRVW0_SSO0_SVW8_SK0_SKXCCM0_TLDS0_ULSGRO0_USL1_UIOFGRO0_USFGROn1_VSn1_VWA1_VWB1_WSGRA0_WSGRB0_WS32_WG64_2_1_WGM8_WGMXCC1_WGMXCCGn1
    SolutionIndex: 333
    SolutionNameMin: Cijk_Ailk_Bjlk_HHS_BH_Bias_SHB_HA_S_SAB_SCD_SAV_UserArgs_MT32x32x64_MI16x16x1_SN_LDSB0_AFC1_AFEM1_AFEM1_ASEM1_CLR1_CADS0_DTLA0_DTLB0_DTVA1_DTVB0_EPS0_FDSI0_GRPM1_GRVWA8_GRVWB8_GSU1_GSUAMB_GSUC0_GSUWGMRR0_GLS0_ISA1201_IU1_K1_LBSPPA0_LBSPPB512_LBSPPM0_LPA0_LPB16_LPM0_LRVW8_LWPMn1_MIAV1_MIWT1_1_MO40_NTn1_NTA0_NTB0_NTC0_NTD0_NTM0_NEPBS0_NLCA1_NLCB1_ONLL0_PGR2_PLR1_PKA0_SIA3_SS0_SU32_SUM1_SUS256_SPO0_SRVW0_SSO0_SVW8_SK0_SKXCCM0_TLDS0_ULSGRO0_USL1_UIOFGRO0_USFGROn1_VSn1_VWA1_VWB1_WSGRA0_WSGRB0_WS32_WG32_4_1_WGM8_WGMXCC1_WGMXCCGn1
    SolutionIndex: 334
    SolutionNameMin: Cijk_Ailk_Bjlk_HHS_BH_Bias_SHB_HA_S_SAB_SCD_SAV_UserArgs_MT64x64x64_MI16x16x1_SN_LDSB1_AFC1_AFEM1_AFEM1_ASEM1_CLR1_CADS0_DTLA0_DTLB0_DTVA0_DTVB0_EPS1_FDSI0_GRPM1_GRVWA4_GRVWB4_GSU1_GSUAMB_GSUC0_GSUWGMRR0_GLS0_ISA1201_IU4_K1_LBSPPA1024_LBSPPB1024_LBSPPM0_LPA32_LPB32_LPM0_LRVW8_LWPMn1_MIAV1_MIWT2_2_MO40_NTn1_NTA0_NTB0_NTC0_NTD0_NTM0_NEPBS0_NLCA1_NLCB1_ONLL0_PGR1_PLR1_PKA0_SIA2_SS0_SU32_SUM1_SUS256_SPO0_SRVW0_SSO0_SVW8_SK0_SKXCCM0_TLDS0_ULSGRO0_USL1_UIOFGRO0_USFGROn1_VSn1_VWA2_VWB2_WSGRA0_WSGRB0_WS32_WG32_4_1_WGM8_WGMXCC1_WGMXCCGn1
    SolutionIndex: 336
    SolutionNameMin: Cijk_Ailk_Bjlk_HHS_BH_Bias_SHB_HA_S_SAB_SCD_SAV_UserArgs_MT64x64x64_MI16x16x1_SN_LDSB0_AFC1_AFEM1_AFEM1_ASEM1_CLR1_CADS0_DTLA0_DTLB0_DTVA1_DTVB0_EPS1_FDSI0_GRPM1_GRVWA8_GRVWB4_GSU1_GSUAMB_GSUC0_GSUWGMRR0_GLS0_ISA1201_IU1_K1_LBSPPA0_LBSPPB1024_LBSPPM0_LPA0_LPB32_LPM0_LRVW8_LWPMn1_MIAV1_MIWT2_2_MO40_NTn1_NTA0_NTB0_NTC0_NTD0_NTM0_NEPBS0_NLCA4_NLCB1_ONLL0_PGR1_PLR1_PKA0_SIA3_SS0_SU32_SUM1_SUS256_SPO0_SRVW0_SSO0_SVW8_SK0_SKXCCM0_TLDS0_ULSGRO0_USL1_UIOFGRO0_USFGROn1_VSn1_VWA1_VWB2_WSGRA0_WSGRB0_WS32_WG32_4_1_WGM8_WGMXCC1_WGMXCCGn1
    SolutionIndex: 338
    SolutionNameMin: Cijk_Ailk_Bjlk_HHS_BH_Bias_SHB_HA_S_SAB_SCD_SAV_UserArgs_MT64x64x32_MI16x16x1_SN_LDSB0_AFC1_AFEM1_AFEM1_ASEM1_CLR1_CADS0_DTLA0_DTLB0_DTVA1_DTVB0_EPS0_FDSI0_GRPM1_GRVWA8_GRVWB8_GSU1_GSUAMB_GSUC0_GSUWGMRR0_GLS0_ISA1201_IU1_K1_LBSPPA0_LBSPPB1024_LBSPPM0_LPA0_LPB32_LPM0_LRVW8_LWPMn1_MIAV1_MIWT2_2_MO40_NTn1_NTA0_NTB0_NTC0_NTD0_NTM0_NEPBS0_NLCA2_NLCB1_ONLL0_PGR2_PLR1_PKA0_SIA3_SS0_SU32_SUM1_SUS256_SPO0_SRVW0_SSO0_SVW8_SK0_SKXCCM0_TLDS0_ULSGRO0_USL1_UIOFGRO0_USFGROn1_VSn1_VWA1_VWB2_WSGRA0_WSGRB0_WS32_WG32_4_1_WGM8_WGMXCC1_WGMXCCGn1
    SolutionIndex: 339
    SolutionNameMin: Cijk_Ailk_Bjlk_HHS_BH_Bias_SHB_HA_S_SAB_SCD_SAV_UserArgs_MT128x128x16_MI16x16x1_SN_LDSB0_AFC1_AFEM1_AFEM1_ASEM1_CLR1_CADS0_DTLA0_DTLB0_DTVA1_DTVB1_EPS0_FDSI0_GRPM1_GRVWA8_GRVWB8_GSU1_GSUAMB_GSUC0_GSUWGMRR0_GLS0_ISA1201_IU1_K1_LBSPPA0_LBSPPB0_LBSPPM0_LPA0_LPB0_LPM0_LRVW8_LWPMn1_MIAV1_MIWT4_4_MO40_NTn1_NTA0_NTB0_NTC0_NTD0_NTM0_NEPBS0_NLCA1_NLCB1_ONLL0_PGR1_PLR0_PKA0_SIA3_SS0_SU32_SUM1_SUS256_SPO0_SRVW0_SSO0_SVW8_SK0_SKXCCM0_TLDS0_ULSGRO0_USL1_UIOFGRO0_USFGROn1_VSn1_VWA1_VWB1_WSGRA0_WSGRB0_WS32_WG32_4_1_WGM8_WGMXCC1_WGMXCCGn1
    SolutionIndex: 341
    SolutionNameMin: Cijk_Ailk_Bjlk_HHS_BH_Bias_SHB_HA_S_SAB_SCD_SAV_UserArgs_MT128x128x16_MI16x16x1_SN_LDSB0_AFC1_AFEM1_AFEM1_ASEM1_CLR1_CADS0_DTLA0_DTLB0_DTVA1_DTVB1_EPS0_FDSI0_GRPM1_GRVWA8_GRVWB8_GSU1_GSUAMB_GSUC0_GSUWGMRR0_GLS0_ISA1201_IU1_K1_LBSPPA0_LBSPPB0_LBSPPM0_LPA0_LPB0_LPM0_LRVW8_LWPMn1_MIAV1_MIWT8_2_MO40_NTn1_NTA0_NTB0_NTC0_NTD0_NTM0_NEPBS0_NLCA1_NLCB1_ONLL0_PGR1_PLR0_PKA0_SIA3_SS0_SU32_SUM1_SUS256_SPO0_SRVW0_SSO0_SVW8_SK0_SKXCCM0_TLDS0_ULSGRO0_USL1_UIOFGRO0_USFGROn1_VSn1_VWA1_VWB1_WSGRA0_WSGRB0_WS32_WG16_8_1_WGM8_WGMXCC1_WGMXCCGn1
    SolutionIndex: 345
    SolutionNameMin: Cijk_Ailk_Bjlk_HHS_BH_Bias_SHB_HA_S_SAB_SCD_SAV_UserArgs_MT128x128x16_MI16x16x1_SN_LDSB1_AFC1_AFEM1_AFEM1_ASEM1_CLR1_CADS0_DTLA0_DTLB0_DTVA0_DTVB0_EPS1_FDSI0_GRPM1_GRVWA8_GRVWB8_GSU1_GSUAMB_GSUC0_GSUWGMRR0_GLS0_ISA1201_IU1_K1_LBSPPA2048_LBSPPB2048_LBSPPM0_LPA0_LPB0_LPM0_LRVW8_LWPMn1_MIAV1_MIWT4_4_MO40_NTn1_NTA0_NTB0_NTC0_NTD0_NTM0_NEPBS0_NLCA1_NLCB1_ONLL0_PGR1_PLR1_PKA0_SIA2_SS1_SU32_SUM1_SUS256_SPO0_SRVW0_SSO0_SVW4_SK0_SKXCCM0_TLDS0_ULSGRO0_USL1_UIOFGRO0_USFGROn1_VSn1_VWA4_VWB4_WSGRA0_WSGRB0_WS32_WG32_4_1_WGM8_WGMXCC1_WGMXCCGn1
    SolutionIndex: 346
    SolutionNameMin: Cijk_Ailk_Bjlk_HHS_BH_Bias_SHB_HA_S_SAB_SCD_SAV_UserArgs_MT16x16x128_MI16x16x1_SN_LDSB1_AFC1_AFEM1_AFEM1_ASEM1_CLR1_CADS0_DTLA0_DTLB0_DTVA0_DTVB0_EPS1_FDSI0_GRPM1_GRVWA4_GRVWB8_GSU1_GSUAMB_GSUC0_GSUWGMRR0_GLS0_ISA1201_IU8_K1_LBSPPA256_LBSPPB256_LBSPPM0_LPA16_LPB16_LPM0_LRVW8_LWPMn1_MIAV1_MIWT1_1_MO40_NTn1_NTA0_NTB0_NTC0_NTD0_NTM0_NEPBS0_NLCA1_NLCB1_ONLL0_PGR1_PLR1_PKA0_SIA2_SS0_SU32_SUM1_SUS256_SPO0_SRVW0_SSO0_SVW8_SK0_SKXCCM0_TLDS0_ULSGRO0_USL1_UIOFGRO0_USFGROn1_VSn1_VWA1_VWB1_WSGRA0_WSGRB0_WS32_WG16_2_1_WGM8_WGMXCC1_WGMXCCGn1
    SolutionIndex: 348
    SolutionNameMin: Cijk_Ailk_Bjlk_HHS_BH_Bias_SHB_HA_S_SAB_SCD_SAV_UserArgs_MT16x32x128_MI16x16x1_SN_LDSB0_AFC1_AFEM1_AFEM1_ASEM1_CLR1_CADS0_DTLA0_DTLB0_DTVA0_DTVB1_EPS0_FDSI0_GRPM1_GRVWA8_GRVWB8_GSU1_GSUAMB_GSUC0_GSUWGMRR0_GLS0_ISA1201_IU1_K1_LBSPPA256_LBSPPB0_LBSPPM0_LPA16_LPB0_LPM0_LRVW8_LWPMn1_MIAV1_MIWT1_1_MO40_NTn1_NTA0_NTB0_NTC0_NTD0_NTM0_NEPBS0_NLCA1_NLCB1_ONLL0_PGR2_PLR1_PKA0_SIA3_SS0_SU32_SUM1_SUS256_SPO0_SRVW0_SSO0_SVW8_SK0_SKXCCM0_TLDS0_ULSGRO0_USL1_UIOFGRO0_USFGROn1_VSn1_VWA1_VWB1_WSGRA0_WSGRB0_WS32_WG16_4_1_WGM8_WGMXCC1_WGMXCCGn1
    SolutionIndex: 349
    SolutionNameMin: Cijk_Ailk_Bjlk_HHS_BH_Bias_SHB_HA_S_SAB_SCD_SAV_UserArgs_MT32x32x128_MI16x16x1_SN_LDSB0_AFC1_AFEM1_AFEM1_ASEM1_CLR1_CADS0_DTLA0_DTLB0_DTVA0_DTVB1_EPS1_FDSI0_GRPM1_GRVWA8_GRVWB8_GSU1_GSUAMB_GSUC0_GSUWGMRR0_GLS0_ISA1201_IU1_K1_LBSPPA512_LBSPPB0_LBSPPM0_LPA16_LPB0_LPM0_LRVW8_LWPMn1_MIAV1_MIWT1_1_MO40_NTn1_NTA0_NTB0_NTC0_NTD0_NTM0_NEPBS0_NLCA1_NLCB1_ONLL0_PGR1_PLR1_PKA0_SIA3_SS1_SU32_SUM1_SUS256_SPO0_SRVW0_SSO0_SVW1_SK0_SKXCCM0_TLDS0_ULSGRO0_USL1_UIOFGRO0_USFGROn1_VSn1_VWA1_VWB1_WSGRA0_WSGRB0_WS32_WG32_4_1_WGM8_WGMXCC1_WGMXCCGn1
    SolutionIndex: 351
    SolutionNameMin: Cijk_Ailk_Bjlk_HHS_BH_Bias_SHB_HA_S_SAB_SCD_SAV_UserArgs_MT32x32x128_MI16x16x1_SN_LDSB0_AFC1_AFEM1_AFEM1_ASEM1_CLR1_CADS0_DTLA0_DTLB0_DTVA0_DTVB1_EPS0_FDSI0_GRPM1_GRVWA4_GRVWB8_GSU1_GSUAMB_GSUC0_GSUWGMRR0_GLS0_ISA1201_IU1_K1_LBSPPA512_LBSPPB0_LBSPPM0_LPA16_LPB0_LPM0_LRVW8_LWPMn1_MIAV1_MIWT1_1_MO40_NTn1_NTA0_NTB0_NTC0_NTD0_NTM0_NEPBS0_NLCA1_NLCB1_ONLL0_PGR2_PLR1_PKA0_SIA3_SS1_SU32_SUM1_SUS256_SPO0_SRVW0_SSO0_SVW1_SK0_SKXCCM0_TLDS0_ULSGRO0_USL1_UIOFGRO0_USFGROn1_VSn1_VWA1_VWB1_WSGRA0_WSGRB0_WS32_WG32_4_1_WGM8_WGMXCC1_WGMXCCGn1
    SolutionIndex: 352
    SolutionNameMin: Cijk_Ailk_Bjlk_HHS_BH_Bias_SHB_HA_S_SAB_SCD_SAV_UserArgs_MT32x32x64_MI16x16x1_SN_LDSB0_AFC1_AFEM1_AFEM1_ASEM1_CLR1_CADS0_DTLA0_DTLB0_DTVA1_DTVB0_EPS0_FDSI0_GRPM1_GRVWA8_GRVWB8_GSU1_GSUAMB_GSUC0_GSUWGMRR0_GLS0_ISA1201_IU1_K1_LBSPPA0_LBSPPB512_LBSPPM0_LPA0_LPB16_LPM0_LRVW8_LWPMn1_MIAV1_MIWT1_1_MO40_NTn1_NTA0_NTB0_NTC0_NTD0_NTM0_NEPBS0_NLCA1_NLCB1_ONLL0_PGR2_PLR1_PKA0_SIA3_SS1_SU32_SUM1_SUS256_SPO0_SRVW0_SSO0_SVW1_SK0_SKXCCM0_TLDS0_ULSGRO0_USL1_UIOFGRO0_USFGROn1_VSn1_VWA1_VWB1_WSGRA0_WSGRB0_WS32_WG32_4_1_WGM8_WGMXCC1_WGMXCCGn1
    SolutionIndex: 353
    SolutionNameMin: Cijk_Ailk_Bjlk_HHS_BH_Bias_SHB_HA_S_SAB_SCD_SAV_UserArgs_MT64x64x64_MI16x16x1_SN_LDSB0_AFC1_AFEM1_AFEM1_ASEM1_CLR1_CADS0_DTLA0_DTLB0_DTVA0_DTVB1_EPS0_FDSI0_GRPM1_GRVWA8_GRVWB8_GSU1_GSUAMB_GSUC0_GSUWGMRR0_GLS0_ISA1201_IU1_K1_LBSPPA1024_LBSPPB0_LBSPPM0_LPA32_LPB0_LPM0_LRVW8_LWPMn1_MIAV1_MIWT2_2_MO40_NTn1_NTA0_NTB0_NTC0_NTD0_NTM0_NEPBS0_NLCA1_NLCB4_ONLL0_PGR2_PLR1_PKA0_SIA3_SS1_SU32_SUM1_SUS256_SPO0_SRVW0_SSO0_SVW2_SK0_SKXCCM0_TLDS0_ULSGRO0_USL1_UIOFGRO0_USFGROn1_VSn1_VWA2_VWB1_WSGRA0_WSGRB0_WS32_WG32_4_1_WGM8_WGMXCC1_WGMXCCGn1
    SolutionIndex: 354
    SolutionNameMin: Cijk_Ailk_Bjlk_HHS_BH_Bias_SHB_HA_S_SAB_SCD_SAV_UserArgs_MT32x16x128_MI16x16x1_SN_LDSB0_AFC1_AFEM1_AFEM1_ASEM1_CLR1_CADS0_DTLA0_DTLB0_DTVA1_DTVB0_EPS0_FDSI0_GRPM1_GRVWA8_GRVWB4_GSU1_GSUAMB_GSUC0_GSUWGMRR0_GLS0_ISA1201_IU1_K1_LBSPPA0_LBSPPB256_LBSPPM0_LPA0_LPB16_LPM0_LRVW8_LWPMn1_MIAV1_MIWT1_1_MO40_NTn1_NTA0_NTB0_NTC0_NTD0_NTM0_NEPBS0_NLCA1_NLCB1_ONLL0_PGR2_PLR1_PKA0_SIA3_SS1_SU32_SUM1_SUS256_SPO0_SRVW0_SSO0_SVW1_SK0_SKXCCM0_TLDS0_ULSGRO0_USL1_UIOFGRO0_USFGROn1_VSn1_VWA1_VWB1_WSGRA0_WSGRB0_WS32_WG32_2_1_WGM8_WGMXCC1_WGMXCCGn1
    SolutionIndex: 355
    SolutionNameMin: Cijk_Ailk_Bjlk_HHS_BH_Bias_SHB_HA_S_SAB_SCD_SAV_UserArgs_MT32x16x128_MI16x16x1_SN_LDSB0_AFC1_AFEM1_AFEM1_ASEM1_CLR1_CADS0_DTLA0_DTLB0_DTVA1_DTVB0_EPS0_FDSI0_GRPM1_GRVWA8_GRVWB8_GSU1_GSUAMB_GSUC0_GSUWGMRR0_GLS0_ISA1201_IU1_K1_LBSPPA0_LBSPPB256_LBSPPM0_LPA0_LPB16_LPM0_LRVW8_LWPMn1_MIAV1_MIWT1_1_MO40_NTn1_NTA0_NTB0_NTC0_NTD0_NTM0_NEPBS0_NLCA1_NLCB1_ONLL0_PGR2_PLR1_PKA0_SIA3_SS0_SU32_SUM1_SUS256_SPO0_SRVW0_SSO0_SVW8_SK0_SKXCCM0_TLDS0_ULSGRO0_USL1_UIOFGRO0_USFGROn1_VSn1_VWA1_VWB1_WSGRA0_WSGRB0_WS32_WG32_2_1_WGM8_WGMXCC1_WGMXCCGn1
    SolutionIndex: 356
    SolutionNameMin: Cijk_Ailk_Bjlk_HHS_BH_Bias_SHB_HA_S_SAB_SCD_SAV_UserArgs_MT32x32x64_MI16x16x1_SN_LDSB0_AFC1_AFEM1_AFEM1_ASEM1_CLR1_CADS0_DTLA0_DTLB0_DTVA0_DTVB1_EPS0_FDSI0_GRPM1_GRVWA4_GRVWB8_GSU1_GSUAMB_GSUC0_GSUWGMRR0_GLS0_ISA1201_IU1_K1_LBSPPA512_LBSPPB0_LBSPPM0_LPA16_LPB0_LPM0_LRVW8_LWPMn1_MIAV1_MIWT1_1_MO40_NTn1_NTA0_NTB0_NTC0_NTD0_NTM0_NEPBS0_NLCA1_NLCB1_ONLL0_PGR2_PLR1_PKA0_SIA3_SS1_SU32_SUM1_SUS256_SPO0_SRVW0_SSO0_SVW1_SK0_SKXCCM0_TLDS0_ULSGRO0_USL1_UIOFGRO0_USFGROn1_VSn1_VWA1_VWB1_WSGRA0_WSGRB0_WS32_WG32_4_1_WGM8_WGMXCC1_WGMXCCGn1
    SolutionIndex: 360
    SolutionNameMin: Cijk_Ailk_Bjlk_HHS_BH_Bias_SHB_HA_S_SAB_SCD_SAV_UserArgs_MT128x128x16_MI16x16x1_SN_LDSB1_AFC1_AFEM1_AFEM1_ASEM1_CLR1_CADS0_DTLA0_DTLB0_DTVA0_DTVB0_EPS0_FDSI0_GRPM1_GRVWA8_GRVWB8_GSU1_GSUAMB_GSUC0_GSUWGMRR0_GLS0_ISA1201_IU1_K1_LBSPPA2048_LBSPPB2048_LBSPPM0_LPA0_LPB0_LPM0_LRVW8_LWPMn1_MIAV1_MIWT4_4_MO40_NTn1_NTA0_NTB0_NTC0_NTD0_NTM0_NEPBS0_NLCA1_NLCB1_ONLL0_PGR2_PLR1_PKA0_SIA2_SS1_SU32_SUM1_SUS256_SPO0_SRVW0_SSO0_SVW4_SK0_SKXCCM0_TLDS0_ULSGRO0_USL1_UIOFGRO0_USFGROn1_VSn1_VWA4_VWB4_WSGRA0_WSGRB0_WS32_WG32_4_1_WGM8_WGMXCC1_WGMXCCGn1
    SolutionIndex: 361
    SolutionNameMin: Cijk_Ailk_Bjlk_HHS_BH_Bias_SHB_HA_S_SAB_SCD_SAV_UserArgs_MT32x32x128_MI16x16x1_SN_LDSB0_AFC1_AFEM1_AFEM1_ASEM1_CLR1_CADS0_DTLA0_DTLB0_DTVA1_DTVB0_EPS0_FDSI0_GRPM1_GRVWA8_GRVWB4_GSU1_GSUAMB_GSUC0_GSUWGMRR0_GLS0_ISA1201_IU1_K1_LBSPPA0_LBSPPB512_LBSPPM0_LPA0_LPB16_LPM0_LRVW8_LWPMn1_MIAV1_MIWT1_1_MO40_NTn1_NTA0_NTB0_NTC0_NTD0_NTM0_NEPBS0_NLCA1_NLCB1_ONLL0_PGR2_PLR1_PKA0_SIA3_SS1_SU32_SUM1_SUS256_SPO0_SRVW0_SSO0_SVW1_SK0_SKXCCM0_TLDS0_ULSGRO0_USL1_UIOFGRO0_USFGROn1_VSn1_VWA1_VWB1_WSGRA0_WSGRB0_WS32_WG32_4_1_WGM8_WGMXCC1_WGMXCCGn1
    SolutionIndex: 363
    SolutionNameMin: Cijk_Ailk_Bjlk_HHS_BH_Bias_SHB_HA_S_SAB_SCD_SAV_UserArgs_MT16x16x128_MI16x16x1_SN_LDSB1_AFC1_AFEM1_AFEM1_ASEM1_CLR1_CADS0_DTLA0_DTLB0_DTVA0_DTVB0_EPS1_FDSI0_GRPM1_GRVWA8_GRVWB8_GSU1_GSUAMB_GSUC0_GSUWGMRR0_GLS0_ISA1201_IU8_K1_LBSPPA256_LBSPPB256_LBSPPM0_LPA16_LPB16_LPM0_LRVW8_LWPMn1_MIAV1_MIWT1_1_MO40_NTn1_NTA0_NTB0_NTC0_NTD0_NTM0_NEPBS0_NLCA1_NLCB1_ONLL0_PGR1_PLR1_PKA0_SIA2_SS0_SU32_SUM1_SUS256_SPO0_SRVW0_SSO0_SVW8_SK0_SKXCCM0_TLDS0_ULSGRO0_USL1_UIOFGRO0_USFGROn1_VSn1_VWA1_VWB1_WSGRA0_WSGRB0_WS32_WG16_2_1_WGM8_WGMXCC1_WGMXCCGn1
    SolutionIndex: 368
    SolutionNameMin: Cijk_Ailk_Bjlk_HHS_BH_Bias_SHB_HA_S_SAB_SCD_SAV_UserArgs_MT128x64x32_MI16x16x1_SN_LDSB0_AFC1_AFEM1_AFEM1_ASEM1_CLR1_CADS0_DTLA0_DTLB0_DTVA1_DTVB0_EPS0_FDSI0_GRPM1_GRVWA8_GRVWB8_GSU1_GSUAMB_GSUC0_GSUWGMRR0_GLS0_ISA1201_IU1_K1_LBSPPA0_LBSPPB1024_LBSPPM0_LPA0_LPB16_LPM0_LRVW8_LWPMn1_MIAV1_MIWT8_1_MO40_NTn1_NTA0_NTB0_NTC0_NTD0_NTM0_NEPBS0_NLCA2_NLCB1_ONLL0_PGR2_PLR1_PKA0_SIA3_SS0_SU32_SUM1_SUS256_SPO0_SRVW0_SSO0_SVW8_SK0_SKXCCM0_TLDS0_ULSGRO0_USL1_UIOFGRO0_USFGROn1_VSn1_VWA1_VWB1_WSGRA0_WSGRB0_WS32_WG16_8_1_WGM8_WGMXCC1_WGMXCCGn1
    SolutionIndex: 369
    SolutionNameMin: Cijk_Ailk_Bjlk_HHS_BH_Bias_SHB_HA_S_SAB_SCD_SAV_UserArgs_MT64x64x32_MI16x16x1_SN_LDSB0_AFC1_AFEM1_AFEM1_ASEM1_CLR1_CADS0_DTLA0_DTLB0_DTVA1_DTVB1_EPS0_FDSI0_GRPM1_GRVWA8_GRVWB8_GSU1_GSUAMB_GSUC0_GSUWGMRR0_GLS0_ISA1201_IU1_K1_LBSPPA0_LBSPPB0_LBSPPM0_LPA0_LPB0_LPM0_LRVW8_LWPMn1_MIAV1_MIWT2_2_MO40_NTn1_NTA0_NTB0_NTC0_NTD0_NTM0_NEPBS0_NLCA2_NLCB2_ONLL0_PGR1_PLR0_PKA0_SIA3_SS1_SU32_SUM1_SUS256_SPO0_SRVW0_SSO0_SVW1_SK0_SKXCCM0_TLDS0_ULSGRO0_USL1_UIOFGRO0_USFGROn1_VSn1_VWA1_VWB1_WSGRA0_WSGRB0_WS32_WG32_4_1_WGM8_WGMXCC1_WGMXCCGn1
    SolutionIndex: 370
    SolutionNameMin: Cijk_Ailk_Bjlk_HHS_BH_Bias_SHB_HA_S_SAB_SCD_SAV_UserArgs_MT128x64x32_MI16x16x1_SN_LDSB0_AFC1_AFEM1_AFEM1_ASEM1_CLR1_CADS0_DTLA0_DTLB0_DTVA1_DTVB0_EPS1_FDSI0_GRPM1_GRVWA8_GRVWB8_GSU1_GSUAMB_GSUC0_GSUWGMRR0_GLS0_ISA1201_IU1_K1_LBSPPA0_LBSPPB1024_LBSPPM0_LPA0_LPB16_LPM0_LRVW8_LWPMn1_MIAV1_MIWT8_1_MO40_NTn1_NTA0_NTB0_NTC0_NTD0_NTM0_NEPBS0_NLCA2_NLCB1_ONLL0_PGR1_PLR1_PKA0_SIA3_SS0_SU32_SUM1_SUS256_SPO0_SRVW0_SSO0_SVW8_SK0_SKXCCM0_TLDS0_ULSGRO0_USL1_UIOFGRO0_USFGROn1_VSn1_VWA1_VWB1_WSGRA0_WSGRB0_WS32_WG16_8_1_WGM8_WGMXCC1_WGMXCCGn1
    SolutionIndex: 373
    SolutionNameMin: Cijk_Ailk_Bjlk_HHS_BH_Bias_SHB_HA_S_SAB_SCD_SAV_UserArgs_MT128x64x32_MI16x16x1_SN_LDSB0_AFC1_AFEM1_AFEM1_ASEM1_CLR1_CADS0_DTLA0_DTLB0_DTVA1_DTVB0_EPS0_FDSI0_GRPM1_GRVWA8_GRVWB8_GSU1_GSUAMB_GSUC0_GSUWGMRR0_GLS0_ISA1201_IU1_K1_LBSPPA0_LBSPPB1024_LBSPPM0_LPA0_LPB16_LPM0_LRVW8_LWPMn1_MIAV1_MIWT8_1_MO40_NTn1_NTA0_NTB0_NTC0_NTD0_NTM0_NEPBS0_NLCA2_NLCB1_ONLL0_PGR2_PLR1_PKA0_SIA3_SS1_SU32_SUM1_SUS256_SPO0_SRVW0_SSO0_SVW1_SK0_SKXCCM0_TLDS0_ULSGRO0_USL1_UIOFGRO0_USFGROn1_VSn1_VWA1_VWB1_WSGRA0_WSGRB0_WS32_WG16_8_1_WGM8_WGMXCC1_WGMXCCGn1
    SolutionIndex: 374
    SolutionNameMin: Cijk_Ailk_Bjlk_HHS_BH_Bias_SHB_HA_S_SAB_SCD_SAV_UserArgs_MT32x32x128_MI16x16x1_SN_LDSB0_AFC1_AFEM1_AFEM1_ASEM1_CLR1_CADS0_DTLA0_DTLB0_DTVA1_DTVB0_EPS1_FDSI0_GRPM1_GRVWA8_GRVWB4_GSU1_GSUAMB_GSUC0_GSUWGMRR0_GLS0_ISA1201_IU1_K1_LBSPPA0_LBSPPB512_LBSPPM0_LPA0_LPB16_LPM0_LRVW8_LWPMn1_MIAV1_MIWT1_1_MO40_NTn1_NTA0_NTB0_NTC0_NTD0_NTM0_NEPBS0_NLCA1_NLCB1_ONLL0_PGR1_PLR1_PKA0_SIA3_SS1_SU32_SUM1_SUS256_SPO0_SRVW0_SSO0_SVW1_SK0_SKXCCM0_TLDS0_ULSGRO0_USL1_UIOFGRO0_USFGROn1_VSn1_VWA1_VWB1_WSGRA0_WSGRB0_WS32_WG32_4_1_WGM8_WGMXCC1_WGMXCCGn1
    SolutionIndex: 375
    SolutionNameMin: Cijk_Ailk_Bjlk_HHS_BH_Bias_SHB_HA_S_SAB_SCD_SAV_UserArgs_MT64x64x32_MI16x16x1_SN_LDSB0_AFC1_AFEM1_AFEM1_ASEM1_CLR1_CADS0_DTLA0_DTLB0_DTVA0_DTVB1_EPS0_FDSI0_GRPM1_GRVWA8_GRVWB8_GSU1_GSUAMB_GSUC0_GSUWGMRR0_GLS0_ISA1201_IU1_K1_LBSPPA1024_LBSPPB0_LBSPPM0_LPA32_LPB0_LPM0_LRVW8_LWPMn1_MIAV1_MIWT2_2_MO40_NTn1_NTA0_NTB0_NTC0_NTD0_NTM0_NEPBS0_NLCA1_NLCB2_ONLL0_PGR2_PLR1_PKA0_SIA3_SS1_SU32_SUM1_SUS256_SPO0_SRVW0_SSO0_SVW2_SK0_SKXCCM0_TLDS0_ULSGRO0_USL1_UIOFGRO0_USFGROn1_VSn1_VWA2_VWB1_WSGRA0_WSGRB0_WS32_WG32_4_1_WGM8_WGMXCC1_WGMXCCGn1
    SolutionIndex: 376
    SolutionNameMin: Cijk_Ailk_Bjlk_HHS_BH_Bias_SHB_HA_S_SAB_SCD_SAV_UserArgs_MT64x64x16_MI16x16x1_SN_LDSB0_AFC1_AFEM1_AFEM1_ASEM1_CLR1_CADS0_DTLA0_DTLB0_DTVA1_DTVB1_EPS0_FDSI0_GRPM1_GRVWA8_GRVWB8_GSU1_GSUAMB_GSUC0_GSUWGMRR0_GLS0_ISA1201_IU1_K1_LBSPPA0_LBSPPB0_LBSPPM0_LPA0_LPB0_LPM0_LRVW8_LWPMn1_MIAV1_MIWT2_2_MO40_NTn1_NTA0_NTB0_NTC0_NTD0_NTM0_NEPBS0_NLCA1_NLCB1_ONLL0_PGR1_PLR0_PKA0_SIA3_SS1_SU32_SUM1_SUS256_SPO0_SRVW0_SSO0_SVW1_SK0_SKXCCM0_TLDS0_ULSGRO0_USL1_UIOFGRO0_USFGROn1_VSn1_VWA1_VWB1_WSGRA0_WSGRB0_WS32_WG32_4_1_WGM8_WGMXCC1_WGMXCCGn1
    SolutionIndex: 377
    SolutionNameMin: Cijk_Ailk_Bjlk_HHS_BH_Bias_SHB_HA_S_SAB_SCD_SAV_UserArgs_MT32x32x128_MI16x16x1_SN_LDSB0_AFC1_AFEM1_AFEM1_ASEM1_CLR1_CADS0_DTLA0_DTLB0_DTVA1_DTVB0_EPS1_FDSI0_GRPM1_GRVWA8_GRVWB8_GSU1_GSUAMB_GSUC0_GSUWGMRR0_GLS0_ISA1201_IU1_K1_LBSPPA0_LBSPPB512_LBSPPM0_LPA0_LPB16_LPM0_LRVW8_LWPMn1_MIAV1_MIWT1_1_MO40_NTn1_NTA0_NTB0_NTC0_NTD0_NTM0_NEPBS0_NLCA1_NLCB1_ONLL0_PGR1_PLR1_PKA0_SIA3_SS1_SU32_SUM1_SUS256_SPO0_SRVW0_SSO0_SVW1_SK0_SKXCCM0_TLDS0_ULSGRO0_USL1_UIOFGRO0_USFGROn1_VSn1_VWA1_VWB1_WSGRA0_WSGRB0_WS32_WG32_4_1_WGM8_WGMXCC1_WGMXCCGn1
    SolutionIndex: 378
    SolutionNameMin: Cijk_Ailk_Bjlk_HHS_BH_Bias_SHB_HA_S_SAB_SCD_SAV_UserArgs_MT128x128x16_MI16x16x1_SN_LDSB0_AFC1_AFEM1_AFEM1_ASEM1_CLR1_CADS0_DTLA0_DTLB0_DTVA1_DTVB1_EPS0_FDSI0_GRPM1_GRVWA8_GRVWB8_GSU1_GSUAMB_GSUC0_GSUWGMRR0_GLS0_ISA1201_IU1_K1_LBSPPA0_LBSPPB0_LBSPPM0_LPA0_LPB0_LPM0_LRVW8_LWPMn1_MIAV1_MIWT4_4_MO40_NTn1_NTA0_NTB0_NTC0_NTD0_NTM0_NEPBS0_NLCA1_NLCB1_ONLL0_PGR1_PLR0_PKA0_SIA3_SS1_SU32_SUM1_SUS256_SPO0_SRVW0_SSO0_SVW1_SK0_SKXCCM0_TLDS0_ULSGRO0_USL1_UIOFGRO0_USFGROn1_VSn1_VWA1_VWB1_WSGRA0_WSGRB0_WS32_WG32_4_1_WGM8_WGMXCC1_WGMXCCGn1
    SolutionIndex: 380
    SolutionNameMin: Cijk_Ailk_Bjlk_HHS_BH_Bias_SHB_HA_S_SAB_SCD_SAV_UserArgs_MT64x64x64_MI16x16x1_SN_LDSB1_AFC1_AFEM1_AFEM1_ASEM1_CLR1_CADS0_DTLA0_DTLB0_DTVA0_DTVB0_EPS0_FDSI0_GRPM1_GRVWA8_GRVWB8_GSU1_GSUAMB_GSUC0_GSUWGMRR0_GLS0_ISA1201_IU4_K1_LBSPPA1024_LBSPPB1024_LBSPPM0_LPA32_LPB32_LPM0_LRVW8_LWPMn1_MIAV1_MIWT2_2_MO40_NTn1_NTA0_NTB0_NTC0_NTD0_NTM0_NEPBS0_NLCA1_NLCB1_ONLL0_PGR2_PLR1_PKA0_SIA2_SS0_SU32_SUM1_SUS256_SPO0_SRVW0_SSO0_SVW8_SK0_SKXCCM0_TLDS0_ULSGRO0_USL1_UIOFGRO0_USFGROn1_VSn1_VWA2_VWB2_WSGRA0_WSGRB0_WS32_WG32_4_1_WGM8_WGMXCC1_WGMXCCGn1
    SolutionIndex: 381
    SolutionNameMin: Cijk_Ailk_Bjlk_HHS_BH_Bias_SHB_HA_S_SAB_SCD_SAV_UserArgs_MT64x64x32_MI16x16x1_SN_LDSB1_AFC1_AFEM1_AFEM1_ASEM1_CLR1_CADS0_DTLA0_DTLB0_DTVA0_DTVB0_EPS0_FDSI0_GRPM1_GRVWA8_GRVWB4_GSU1_GSUAMB_GSUC0_GSUWGMRR0_GLS0_ISA1201_IU2_K1_LBSPPA1024_LBSPPB1024_LBSPPM0_LPA32_LPB32_LPM0_LRVW8_LWPMn1_MIAV1_MIWT2_2_MO40_NTn1_NTA0_NTB0_NTC0_NTD0_NTM0_NEPBS0_NLCA1_NLCB1_ONLL0_PGR2_PLR1_PKA0_SIA2_SS1_SU32_SUM1_SUS256_SPO0_SRVW0_SSO0_SVW2_SK0_SKXCCM0_TLDS0_ULSGRO0_USL1_UIOFGRO0_USFGROn1_VSn1_VWA2_VWB2_WSGRA0_WSGRB0_WS32_WG32_4_1_WGM8_WGMXCC1_WGMXCCGn1
    SolutionIndex: 382
    SolutionNameMin: Cijk_Ailk_Bjlk_HHS_BH_Bias_SHB_HA_S_SAB_SCD_SAV_UserArgs_MT64x64x32_MI16x16x1_SN_LDSB0_AFC1_AFEM1_AFEM1_ASEM1_CLR1_CADS0_DTLA0_DTLB0_DTVA0_DTVB0_EPS0_FDSI0_GRPM1_GRVWA4_GRVWB8_GSU1_GSUAMB_GSUC0_GSUWGMRR0_GLS0_ISA1201_IU1_K1_LBSPPA1024_LBSPPB1024_LBSPPM0_LPA32_LPB32_LPM0_LRVW8_LWPMn1_MIAV1_MIWT2_2_MO40_NTn1_NTA0_NTB0_NTC0_NTD0_NTM0_NEPBS0_NLCA1_NLCB1_ONLL0_PGR2_PLR1_PKA0_SIA3_SS0_SU32_SUM1_SUS256_SPO0_SRVW0_SSO0_SVW8_SK0_SKXCCM0_TLDS0_ULSGRO0_USL1_UIOFGRO0_USFGROn1_VSn1_VWA2_VWB2_WSGRA0_WSGRB0_WS32_WG32_4_1_WGM8_WGMXCC1_WGMXCCGn1
    SolutionIndex: 383
    SolutionNameMin: Cijk_Ailk_Bjlk_HHS_BH_Bias_SHB_HA_S_SAB_SCD_SAV_UserArgs_MT32x128x16_MI16x16x1_SN_LDSB0_AFC1_AFEM1_AFEM1_ASEM1_CLR1_CADS0_DTLA0_DTLB0_DTVA1_DTVB1_EPS0_FDSI0_GRPM1_GRVWA8_GRVWB8_GSU1_GSUAMB_GSUC0_GSUWGMRR0_GLS0_ISA1201_IU1_K1_LBSPPA0_LBSPPB0_LBSPPM0_LPA0_LPB0_LPM0_LRVW8_LWPMn1_MIAV1_MIWT1_4_MO40_NTn1_NTA0_NTB0_NTC0_NTD0_NTM0_NEPBS0_NLCA1_NLCB1_ONLL0_PGR1_PLR0_PKA0_SIA3_SS0_SU32_SUM1_SUS256_SPO0_SRVW0_SSO0_SVW8_SK0_SKXCCM0_TLDS0_ULSGRO0_USL1_UIOFGRO0_USFGROn1_VSn1_VWA1_VWB1_WSGRA0_WSGRB0_WS32_WG32_4_1_WGM8_WGMXCC1_WGMXCCGn1
    SolutionIndex: 384
    SolutionNameMin: Cijk_Ailk_Bjlk_HHS_BH_Bias_SHB_HA_S_SAB_SCD_SAV_UserArgs_MT64x64x16_MI16x16x1_SN_LDSB0_AFC1_AFEM1_AFEM1_ASEM1_CLR0_CADS0_DTLA0_DTLB0_DTVA0_DTVB0_EPS0_FDSI0_GRPM1_GRVWA1_GRVWB1_GSU1_GSUAMB_GSUC0_GSUWGMRR0_GLS0_ISA1201_IU1_K1_LBSPPA1024_LBSPPB1024_LBSPPM0_LPA32_LPB32_LPM0_LRVW8_LWPMn1_MIAV1_MIWT2_2_MO40_NTn1_NTA0_NTB0_NTC0_NTD0_NTM0_NEPBS0_NLCA1_NLCB1_ONLL0_PGR2_PLR0_PKA0_SIA3_SS0_SU32_SUM1_SUS256_SPO0_SRVW0_SSO0_SVW8_SK0_SKXCCM0_TLDS0_ULSGRO0_USL1_UIOFGRO0_USFGROn1_VSn1_VWA2_VWB2_WSGRA0_WSGRB0_WS32_WG32_4_1_WGM8_WGMXCC1_WGMXCCGn1
    SolutionIndex: 385
    SolutionNameMin: Cijk_Ailk_Bjlk_HHS_BH_Bias_SHB_HA_S_SAB_SCD_SAV_UserArgs_MT16x128x32_MI16x16x1_SN_LDSB0_AFC1_AFEM1_AFEM1_ASEM1_CLR1_CADS0_DTLA0_DTLB0_DTVA0_DTVB1_EPS0_FDSI0_GRPM1_GRVWA4_GRVWB8_GSU1_GSUAMB_GSUC0_GSUWGMRR0_GLS0_ISA1201_IU1_K1_LBSPPA256_LBSPPB0_LBSPPM0_LPA16_LPB0_LPM0_LRVW8_LWPMn1_MIAV1_MIWT1_8_MO40_NTn1_NTA0_NTB0_NTC0_NTD0_NTM0_NEPBS0_NLCA1_NLCB2_ONLL0_PGR2_PLR1_PKA0_SIA3_SS0_SU32_SUM1_SUS256_SPO0_SRVW0_SSO0_SVW8_SK0_SKXCCM0_TLDS0_ULSGRO0_USL1_UIOFGRO0_USFGROn1_VSn1_VWA1_VWB1_WSGRA0_WSGRB0_WS32_WG16_2_1_WGM8_WGMXCC1_WGMXCCGn1
    SolutionIndex: 386
    SolutionNameMin: Cijk_Ailk_Bjlk_HHS_BH_Bias_SHB_HA_S_SAB_SCD_SAV_UserArgs_MT64x64x16_MI16x16x1_SN_LDSB1_AFC1_AFEM1_AFEM1_ASEM1_CLR1_CADS0_DTLA0_DTLB0_DTVA0_DTVB0_EPS0_FDSI0_GRPM1_GRVWA1_GRVWB1_GSU1_GSUAMB_GSUC0_GSUWGMRR0_GLS0_ISA1201_IU1_K1_LBSPPA1024_LBSPPB1024_LBSPPM0_LPA32_LPB32_LPM0_LRVW8_LWPMn1_MIAV1_MIWT2_2_MO40_NTn1_NTA0_NTB0_NTC0_NTD0_NTM0_NEPBS0_NLCA1_NLCB1_ONLL0_PGR2_PLR1_PKA0_SIA2_SS0_SU32_SUM1_SUS256_SPO0_SRVW0_SSO0_SVW8_SK0_SKXCCM0_TLDS0_ULSGRO1_USL1_UIOFGRO0_USFGROn1_VSn1_VWA2_VWB2_WSGRA0_WSGRB0_WS32_WG32_4_1_WGM8_WGMXCC1_WGMXCCGn1
    SolutionIndex: 387
    SolutionNameMin: Cijk_Ailk_Bjlk_HHS_BH_Bias_SHB_HA_S_SAB_SCD_SAV_UserArgs_MT64x128x16_MI16x16x1_SN_LDSB0_AFC1_AFEM1_AFEM1_ASEM1_CLR0_CADS0_DTLA0_DTLB0_DTVA0_DTVB0_EPS0_FDSI0_GRPM1_GRVWA4_GRVWB4_GSU1_GSUAMB_GSUC0_GSUWGMRR0_GLS0_ISA1201_IU1_K1_LBSPPA1024_LBSPPB2048_LBSPPM0_LPA16_LPB0_LPM0_LRVW8_LWPMn1_MIAV1_MIWT1_8_MO40_NTn1_NTA0_NTB0_NTC0_NTD0_NTM0_NEPBS0_NLCA1_NLCB1_ONLL0_PGR2_PLR0_PKA0_SIA3_SS0_SU32_SUM1_SUS256_SPO0_SRVW0_SSO0_SVW8_SK0_SKXCCM0_TLDS0_ULSGRO0_USL1_UIOFGRO0_USFGROn1_VSn1_VWA1_VWB8_WSGRA0_WSGRB0_WS32_WG64_2_1_WGM8_WGMXCC1_WGMXCCGn1
    SolutionIndex: 388
    SolutionNameMin: Cijk_Ailk_Bjlk_HHS_BH_Bias_SHB_HA_S_SAB_SCD_SAV_UserArgs_MT64x64x16_MI16x16x1_SN_LDSB1_AFC1_AFEM1_AFEM1_ASEM1_CLR1_CADS0_DTLA0_DTLB0_DTVA0_DTVB0_EPS1_FDSI0_GRPM1_GRVWA1_GRVWB4_GSU1_GSUAMB_GSUC0_GSUWGMRR0_GLS0_ISA1201_IU1_K1_LBSPPA1024_LBSPPB1024_LBSPPM0_LPA32_LPB32_LPM0_LRVW8_LWPMn1_MIAV1_MIWT2_2_MO40_NTn1_NTA0_NTB0_NTC0_NTD0_NTM0_NEPBS0_NLCA1_NLCB1_ONLL0_PGR1_PLR1_PKA0_SIA2_SS1_SU32_SUM1_SUS256_SPO0_SRVW0_SSO0_SVW2_SK0_SKXCCM0_TLDS0_ULSGRO0_USL1_UIOFGRO0_USFGROn1_VSn1_VWA2_VWB2_WSGRA0_WSGRB0_WS32_WG32_4_1_WGM8_WGMXCC1_WGMXCCGn1
    SolutionIndex: 389
    SolutionNameMin: Cijk_Ailk_Bjlk_HHS_BH_Bias_SHB_HA_S_SAB_SCD_SAV_UserArgs_MT64x128x32_MI16x16x1_SN_LDSB0_AFC1_AFEM1_AFEM1_ASEM1_CLR1_CADS0_DTLA0_DTLB0_DTVA1_DTVB1_EPS0_FDSI0_GRPM1_GRVWA8_GRVWB8_GSU1_GSUAMB_GSUC0_GSUWGMRR0_GLS0_ISA1201_IU1_K1_LBSPPA0_LBSPPB0_LBSPPM0_LPA0_LPB0_LPM0_LRVW8_LWPMn1_MIAV1_MIWT1_8_MO40_NTn1_NTA0_NTB0_NTC0_NTD0_NTM0_NEPBS0_NLCA1_NLCB2_ONLL0_PGR1_PLR0_PKA0_SIA3_SS0_SU32_SUM1_SUS256_SPO0_SRVW0_SSO0_SVW8_SK0_SKXCCM0_TLDS0_ULSGRO0_USL1_UIOFGRO0_USFGROn1_VSn1_VWA1_VWB1_WSGRA0_WSGRB0_WS32_WG64_2_1_WGM8_WGMXCC1_WGMXCCGn1
    SolutionIndex: 390
    SolutionNameMin: Cijk_Ailk_Bjlk_HHS_BH_Bias_SHB_HA_S_SAB_SCD_SAV_UserArgs_MT64x128x16_MI16x16x1_SN_LDSB1_AFC1_AFEM1_AFEM1_ASEM1_CLR1_CADS0_DTLA0_DTLB0_DTVA0_DTVB0_EPS1_FDSI0_GRPM1_GRVWA4_GRVWB4_GSU1_GSUAMB_GSUC0_GSUWGMRR0_GLS0_ISA1201_IU1_K1_LBSPPA1024_LBSPPB2048_LBSPPM0_LPA16_LPB0_LPM0_LRVW8_LWPMn1_MIAV1_MIWT1_8_MO40_NTn1_NTA0_NTB0_NTC0_NTD0_NTM0_NEPBS0_NLCA1_NLCB1_ONLL0_PGR1_PLR1_PKA0_SIA2_SS0_SU32_SUM1_SUS256_SPO0_SRVW0_SSO0_SVW8_SK0_SKXCCM0_TLDS0_ULSGRO0_USL1_UIOFGRO0_USFGROn1_VSn1_VWA1_VWB8_WSGRA0_WSGRB0_WS32_WG64_2_1_WGM8_WGMXCC1_WGMXCCGn1
    SolutionIndex: 391
    SolutionNameMin: Cijk_Ailk_Bjlk_HHS_BH_Bias_SHB_HA_S_SAB_SCD_SAV_UserArgs_MT64x128x16_MI16x16x1_SN_LDSB1_AFC1_AFEM1_AFEM1_ASEM1_CLR1_CADS0_DTLA0_DTLB0_DTVA0_DTVB0_EPS1_FDSI0_GRPM1_GRVWA8_GRVWB8_GSU1_GSUAMB_GSUC0_GSUWGMRR0_GLS0_ISA1201_IU1_K1_LBSPPA1024_LBSPPB2048_LBSPPM0_LPA16_LPB0_LPM0_LRVW8_LWPMn1_MIAV1_MIWT1_8_MO40_NTn1_NTA0_NTB0_NTC0_NTD0_NTM0_NEPBS0_NLCA1_NLCB1_ONLL0_PGR1_PLR1_PKA0_SIA2_SS0_SU32_SUM1_SUS256_SPO0_SRVW0_SSO0_SVW8_SK0_SKXCCM0_TLDS0_ULSGRO0_USL1_UIOFGRO0_USFGROn1_VSn1_VWA1_VWB8_WSGRA0_WSGRB0_WS32_WG64_2_1_WGM8_WGMXCC1_WGMXCCGn1
    SolutionIndex: 392
    SolutionNameMin: Cijk_Ailk_Bjlk_HHS_BH_Bias_SHB_HA_S_SAB_SCD_SAV_UserArgs_MT32x32x32_MI16x16x1_SN_LDSB0_AFC1_AFEM1_AFEM1_ASEM1_CLR1_CADS0_DTLA0_DTLB0_DTVA1_DTVB0_EPS0_FDSI0_GRPM1_GRVWA8_GRVWB4_GSU1_GSUAMB_GSUC0_GSUWGMRR0_GLS0_ISA1201_IU1_K1_LBSPPA0_LBSPPB512_LBSPPM0_LPA0_LPB16_LPM0_LRVW8_LWPMn1_MIAV1_MIWT1_1_MO40_NTn1_NTA0_NTB0_NTC0_NTD0_NTM0_NEPBS0_NLCA1_NLCB1_ONLL0_PGR2_PLR1_PKA0_SIA3_SS0_SU32_SUM1_SUS256_SPO0_SRVW0_SSO0_SVW8_SK0_SKXCCM0_TLDS0_ULSGRO0_USL1_UIOFGRO0_USFGROn1_VSn1_VWA1_VWB1_WSGRA0_WSGRB0_WS32_WG32_4_1_WGM8_WGMXCC1_WGMXCCGn1
    SolutionIndex: 393
    SolutionNameMin: Cijk_Ailk_Bjlk_HHS_BH_Bias_SHB_HA_S_SAB_SCD_SAV_UserArgs_MT64x64x64_MI16x16x1_SN_LDSB1_AFC1_AFEM1_AFEM1_ASEM1_CLR1_CADS0_DTLA0_DTLB0_DTVA0_DTVB0_EPS0_FDSI0_GRPM1_GRVWA4_GRVWB8_GSU1_GSUAMB_GSUC0_GSUWGMRR0_GLS0_ISA1201_IU1_K1_LBSPPA1024_LBSPPB1024_LBSPPM0_LPA32_LPB32_LPM0_LRVW8_LWPMn1_MIAV1_MIWT2_2_MO40_NTn1_NTA0_NTB0_NTC0_NTD0_NTM0_NEPBS0_NLCA1_NLCB1_ONLL0_PGR2_PLR1_PKA0_SIA3_SS0_SU32_SUM1_SUS256_SPO0_SRVW0_SSO0_SVW8_SK0_SKXCCM0_TLDS0_ULSGRO0_USL1_UIOFGRO0_USFGROn1_VSn1_VWA2_VWB2_WSGRA0_WSGRB0_WS32_WG32_4_1_WGM8_WGMXCC1_WGMXCCGn1
    SolutionIndex: 394
    SolutionNameMin: Cijk_Ailk_Bjlk_HHS_BH_Bias_SHB_HA_S_SAB_SCD_SAV_UserArgs_MT32x32x128_MI16x16x1_SN_LDSB0_AFC1_AFEM1_AFEM1_ASEM1_CLR1_CADS0_DTLA0_DTLB0_DTVA0_DTVB1_EPS1_FDSI0_GRPM1_GRVWA8_GRVWB8_GSU1_GSUAMB_GSUC0_GSUWGMRR0_GLS0_ISA1201_IU1_K1_LBSPPA512_LBSPPB0_LBSPPM0_LPA16_LPB0_LPM0_LRVW8_LWPMn1_MIAV1_MIWT1_1_MO40_NTn1_NTA0_NTB0_NTC0_NTD0_NTM0_NEPBS0_NLCA1_NLCB1_ONLL0_PGR1_PLR1_PKA0_SIA3_SS0_SU32_SUM1_SUS256_SPO0_SRVW0_SSO0_SVW8_SK0_SKXCCM0_TLDS0_ULSGRO0_USL1_UIOFGRO0_USFGROn1_VSn1_VWA1_VWB1_WSGRA0_WSGRB0_WS32_WG32_4_1_WGM8_WGMXCC1_WGMXCCGn1
    SolutionIndex: 395
    SolutionNameMin: Cijk_Ailk_Bjlk_HHS_BH_Bias_SHB_HA_S_SAB_SCD_SAV_UserArgs_MT64x64x32_MI16x16x1_SN_LDSB0_AFC1_AFEM1_AFEM1_ASEM1_CLR1_CADS0_DTLA0_DTLB0_DTVA0_DTVB1_EPS0_FDSI0_GRPM1_GRVWA4_GRVWB8_GSU1_GSUAMB_GSUC0_GSUWGMRR0_GLS0_ISA1201_IU1_K1_LBSPPA1024_LBSPPB0_LBSPPM0_LPA32_LPB0_LPM0_LRVW8_LWPMn1_MIAV1_MIWT2_2_MO40_NTn1_NTA0_NTB0_NTC0_NTD0_NTM0_NEPBS0_NLCA1_NLCB2_ONLL0_PGR2_PLR1_PKA0_SIA3_SS1_SU32_SUM1_SUS256_SPO0_SRVW0_SSO0_SVW2_SK0_SKXCCM0_TLDS0_ULSGRO0_USL1_UIOFGRO0_USFGROn1_VSn1_VWA2_VWB1_WSGRA0_WSGRB0_WS32_WG32_4_1_WGM8_WGMXCC1_WGMXCCGn1
    SolutionIndex: 396
    SolutionNameMin: Cijk_Ailk_Bjlk_HHS_BH_Bias_SHB_HA_S_SAB_SCD_SAV_UserArgs_MT64x64x64_MI16x16x1_SN_LDSB0_AFC1_AFEM1_AFEM1_ASEM1_CLR1_CADS0_DTLA0_DTLB0_DTVA0_DTVB1_EPS0_FDSI0_GRPM1_GRVWA4_GRVWB8_GSU1_GSUAMB_GSUC0_GSUWGMRR0_GLS0_ISA1201_IU1_K1_LBSPPA1024_LBSPPB0_LBSPPM0_LPA32_LPB0_LPM0_LRVW8_LWPMn1_MIAV1_MIWT2_2_MO40_NTn1_NTA0_NTB0_NTC0_NTD0_NTM0_NEPBS0_NLCA1_NLCB4_ONLL0_PGR2_PLR1_PKA0_SIA3_SS1_SU32_SUM1_SUS256_SPO0_SRVW0_SSO0_SVW2_SK0_SKXCCM0_TLDS0_ULSGRO0_USL1_UIOFGRO0_USFGROn1_VSn1_VWA2_VWB1_WSGRA0_WSGRB0_WS32_WG32_4_1_WGM8_WGMXCC1_WGMXCCGn1
    SolutionIndex: 397
    SolutionNameMin: Cijk_Ailk_Bjlk_HHS_BH_Bias_SHB_HA_S_SAB_SCD_SAV_UserArgs_MT128x64x32_MI16x16x1_SN_LDSB0_AFC1_AFEM1_AFEM1_ASEM1_CLR1_CADS0_DTLA0_DTLB0_DTVA1_DTVB0_EPS0_FDSI0_GRPM1_GRVWA8_GRVWB4_GSU1_GSUAMB_GSUC0_GSUWGMRR0_GLS0_ISA1201_IU1_K1_LBSPPA0_LBSPPB1024_LBSPPM0_LPA0_LPB16_LPM0_LRVW8_LWPMn1_MIAV1_MIWT8_1_MO40_NTn1_NTA0_NTB0_NTC0_NTD0_NTM0_NEPBS0_NLCA2_NLCB1_ONLL0_PGR2_PLR1_PKA0_SIA3_SS1_SU32_SUM1_SUS256_SPO0_SRVW0_SSO0_SVW1_SK0_SKXCCM0_TLDS0_ULSGRO0_USL1_UIOFGRO0_USFGROn1_VSn1_VWA1_VWB1_WSGRA0_WSGRB0_WS32_WG16_8_1_WGM8_WGMXCC1_WGMXCCGn1
    SolutionIndex: 398
    SolutionNameMin: Cijk_Ailk_Bjlk_HHS_BH_Bias_SHB_HA_S_SAB_SCD_SAV_UserArgs_MT64x64x32_MI16x16x1_SN_LDSB0_AFC1_AFEM1_AFEM1_ASEM1_CLR1_CADS0_DTLA0_DTLB0_DTVA0_DTVB1_EPS1_FDSI0_GRPM1_GRVWA8_GRVWB8_GSU1_GSUAMB_GSUC0_GSUWGMRR0_GLS0_ISA1201_IU1_K1_LBSPPA1024_LBSPPB0_LBSPPM0_LPA32_LPB0_LPM0_LRVW8_LWPMn1_MIAV1_MIWT2_2_MO40_NTn1_NTA0_NTB0_NTC0_NTD0_NTM0_NEPBS0_NLCA1_NLCB2_ONLL0_PGR1_PLR1_PKA0_SIA3_SS1_SU32_SUM1_SUS256_SPO0_SRVW0_SSO0_SVW2_SK0_SKXCCM0_TLDS0_ULSGRO0_USL1_UIOFGRO0_USFGROn1_VSn1_VWA2_VWB1_WSGRA0_WSGRB0_WS32_WG32_4_1_WGM8_WGMXCC1_WGMXCCGn1
    SolutionIndex: 399
    SolutionNameMin: Cijk_Ailk_Bjlk_HHS_BH_Bias_SHB_HA_S_SAB_SCD_SAV_UserArgs_MT32x32x16_MI16x16x1_SN_LDSB1_AFC1_AFEM1_AFEM1_ASEM1_CLR1_CADS0_DTLA0_DTLB0_DTVA0_DTVB0_EPS1_FDSI0_GRPM1_GRVWA1_GRVWB1_GSU1_GSUAMB_GSUC0_GSUWGMRR0_GLS0_ISA1201_IU1_K1_LBSPPA512_LBSPPB512_LBSPPM0_LPA16_LPB16_LPM0_LRVW8_LWPMn1_MIAV1_MIWT1_1_MO40_NTn1_NTA0_NTB0_NTC0_NTD0_NTM0_NEPBS0_NLCA1_NLCB1_ONLL0_PGR1_PLR1_PKA0_SIA2_SS1_SU32_SUM1_SUS256_SPO0_SRVW0_SSO0_SVW1_SK0_SKXCCM0_TLDS0_ULSGRO0_USL1_UIOFGRO0_USFGROn1_VSn1_VWA1_VWB1_WSGRA0_WSGRB0_WS32_WG32_4_1_WGM8_WGMXCC1_WGMXCCGn1
    SolutionIndex: 404
    SolutionNameMin: Cijk_Ailk_Bjlk_HHS_BH_Bias_SHB_HA_S_SAB_SCD_SAV_UserArgs_MT128x128x16_MI16x16x1_SN_LDSB1_AFC1_AFEM1_AFEM1_ASEM1_CLR1_CADS0_DTLA0_DTLB0_DTVA0_DTVB0_EPS1_FDSI0_GRPM1_GRVWA1_GRVWB1_GSU1_GSUAMB_GSUC0_GSUWGMRR0_GLS0_ISA1201_IU1_K1_LBSPPA2048_LBSPPB2048_LBSPPM0_LPA0_LPB0_LPM0_LRVW8_LWPMn1_MIAV1_MIWT4_4_MO40_NTn1_NTA0_NTB0_NTC0_NTD0_NTM0_NEPBS0_NLCA1_NLCB1_ONLL0_PGR1_PLR1_PKA0_SIA2_SS1_SU32_SUM1_SUS256_SPO0_SRVW0_SSO0_SVW4_SK0_SKXCCM0_TLDS0_ULSGRO0_USL1_UIOFGRO0_USFGROn1_VSn1_VWA4_VWB4_WSGRA0_WSGRB0_WS32_WG32_4_1_WGM8_WGMXCC1_WGMXCCGn1
    SolutionIndex: 408
    SolutionNameMin: Cijk_Ailk_Bjlk_HHS_BH_Bias_SHB_HA_S_SAB_SCD_SAV_UserArgs_MT128x128x16_MI16x16x1_SN_LDSB0_AFC1_AFEM1_AFEM1_ASEM1_CLR1_CADS0_DTLA0_DTLB0_DTVA1_DTVB1_EPS0_FDSI0_GRPM1_GRVWA8_GRVWB8_GSU1_GSUAMB_GSUC0_GSUWGMRR0_GLS0_ISA1201_IU1_K1_LBSPPA0_LBSPPB0_LBSPPM0_LPA0_LPB0_LPM0_LRVW8_LWPMn1_MIAV1_MIWT8_2_MO40_NTn1_NTA0_NTB0_NTC0_NTD0_NTM0_NEPBS0_NLCA1_NLCB1_ONLL0_PGR1_PLR0_PKA0_SIA3_SS1_SU32_SUM1_SUS256_SPO0_SRVW0_SSO0_SVW1_SK0_SKXCCM0_TLDS0_ULSGRO0_USL1_UIOFGRO0_USFGROn1_VSn1_VWA1_VWB1_WSGRA0_WSGRB0_WS32_WG16_8_1_WGM8_WGMXCC1_WGMXCCGn1
    SolutionIndex: 410
    SolutionNameMin: Cijk_Ailk_Bjlk_HHS_BH_Bias_SHB_HA_S_SAB_SCD_SAV_UserArgs_MT128x128x16_MI16x16x1_SN_LDSB1_AFC1_AFEM1_AFEM1_ASEM1_CLR1_CADS0_DTLA0_DTLB0_DTVA0_DTVB0_EPS0_FDSI0_GRPM1_GRVWA8_GRVWB1_GSU1_GSUAMB_GSUC0_GSUWGMRR0_GLS0_ISA1201_IU1_K1_LBSPPA2048_LBSPPB2048_LBSPPM0_LPA0_LPB0_LPM0_LRVW8_LWPMn1_MIAV1_MIWT4_4_MO40_NTn1_NTA0_NTB0_NTC0_NTD0_NTM0_NEPBS0_NLCA1_NLCB1_ONLL0_PGR2_PLR1_PKA0_SIA2_SS1_SU32_SUM1_SUS256_SPO0_SRVW0_SSO0_SVW4_SK0_SKXCCM0_TLDS0_ULSGRO0_USL1_UIOFGRO0_USFGROn1_VSn1_VWA4_VWB4_WSGRA0_WSGRB0_WS32_WG32_4_1_WGM8_WGMXCC1_WGMXCCGn1
    SolutionIndex: 417
    SolutionNameMin: Cijk_Ailk_Bjlk_HHS_BH_Bias_SHB_HA_S_SAB_SCD_SAV_UserArgs_MT128x128x16_MI16x16x1_SN_LDSB1_AFC1_AFEM1_AFEM1_ASEM1_CLR1_CADS0_DTLA0_DTLB0_DTVA0_DTVB0_EPS0_FDSI0_GRPM1_GRVWA1_GRVWB1_GSU1_GSUAMB_GSUC0_GSUWGMRR0_GLS0_ISA1201_IU1_K1_LBSPPA2048_LBSPPB2048_LBSPPM0_LPA0_LPB0_LPM0_LRVW8_LWPMn1_MIAV1_MIWT4_4_MO40_NTn1_NTA0_NTB0_NTC0_NTD0_NTM0_NEPBS0_NLCA1_NLCB1_ONLL0_PGR2_PLR1_PKA0_SIA2_SS1_SU32_SUM1_SUS256_SPO0_SRVW0_SSO0_SVW4_SK0_SKXCCM0_TLDS0_ULSGRO0_USL1_UIOFGRO0_USFGROn1_VSn1_VWA4_VWB4_WSGRA0_WSGRB0_WS32_WG32_4_1_WGM8_WGMXCC1_WGMXCCGn1
    SolutionIndex: 422
    SolutionNameMin: Cijk_Ailk_Bjlk_HHS_BH_Bias_SHB_HA_S_SAB_SCD_SAV_UserArgs_MT64x128x16_MI16x16x1_SN_LDSB1_AFC1_AFEM1_AFEM1_ASEM1_CLR1_CADS0_DTLA0_DTLB0_DTVA0_DTVB0_EPS0_FDSI0_GRPM1_GRVWA8_GRVWB8_GSU1_GSUAMB_GSUC0_GSUWGMRR0_GLS0_ISA1201_IU1_K1_LBSPPA1024_LBSPPB2048_LBSPPM0_LPA16_LPB0_LPM0_LRVW8_LWPMn1_MIAV1_MIWT1_8_MO40_NTn1_NTA0_NTB0_NTC0_NTD0_NTM0_NEPBS0_NLCA1_NLCB1_ONLL0_PGR2_PLR1_PKA0_SIA2_SS0_SU32_SUM1_SUS256_SPO0_SRVW0_SSO0_SVW8_SK0_SKXCCM0_TLDS0_ULSGRO0_USL1_UIOFGRO0_USFGROn1_VSn1_VWA1_VWB8_WSGRA0_WSGRB0_WS32_WG64_2_1_WGM8_WGMXCC1_WGMXCCGn1
    SolutionIndex: 425
    SolutionNameMin: Cijk_Ailk_Bjlk_HHS_BH_Bias_SHB_HA_S_SAB_SCD_SAV_UserArgs_MT128x128x16_MI16x16x1_SN_LDSB0_AFC1_AFEM1_AFEM1_ASEM1_CLR0_CADS0_DTLA0_DTLB0_DTVA0_DTVB0_EPS1_FDSI0_GRPM1_GRVWA8_GRVWB8_GSU1_GSUAMB_GSUC0_GSUWGMRR0_GLS0_ISA1201_IU1_K1_LBSPPA2048_LBSPPB2048_LBSPPM0_LPA0_LPB0_LPM0_LRVW8_LWPMn1_MIAV1_MIWT4_4_MO40_NTn1_NTA0_NTB0_NTC0_NTD0_NTM0_NEPBS0_NLCA1_NLCB1_ONLL0_PGR1_PLR0_PKA0_SIA3_SS1_SU32_SUM1_SUS256_SPO0_SRVW0_SSO0_SVW4_SK0_SKXCCM0_TLDS0_ULSGRO0_USL1_UIOFGRO0_USFGROn1_VSn1_VWA4_VWB4_WSGRA0_WSGRB0_WS32_WG32_4_1_WGM8_WGMXCC1_WGMXCCGn1
    SolutionIndex: 427
    SolutionNameMin: Cijk_Ailk_Bjlk_HHS_BH_Bias_SHB_HA_S_SAB_SCD_SAV_UserArgs_MT128x128x16_MI16x16x1_SN_LDSB0_AFC1_AFEM1_AFEM1_ASEM1_CLR0_CADS0_DTLA0_DTLB0_DTVA0_DTVB0_EPS0_FDSI0_GRPM1_GRVWA8_GRVWB8_GSU1_GSUAMB_GSUC0_GSUWGMRR0_GLS0_ISA1201_IU1_K1_LBSPPA2048_LBSPPB2048_LBSPPM0_LPA0_LPB0_LPM0_LRVW8_LWPMn1_MIAV1_MIWT4_4_MO40_NTn1_NTA0_NTB0_NTC0_NTD0_NTM0_NEPBS0_NLCA1_NLCB1_ONLL0_PGR2_PLR0_PKA0_SIA3_SS1_SU32_SUM1_SUS256_SPO0_SRVW0_SSO0_SVW4_SK0_SKXCCM0_TLDS0_ULSGRO0_USL1_UIOFGRO0_USFGROn1_VSn1_VWA4_VWB4_WSGRA0_WSGRB0_WS32_WG32_4_1_WGM8_WGMXCC1_WGMXCCGn1
    SolutionIndex: 439
    SolutionNameMin: Cijk_Ailk_Bjlk_HHS_BH_Bias_SHB_HA_S_SAB_SCD_SAV_UserArgs_MT64x64x16_MI16x16x1_SN_LDSB1_AFC1_AFEM1_AFEM1_ASEM1_CLR1_CADS0_DTLA0_DTLB0_DTVA0_DTVB0_EPS0_FDSI0_GRPM1_GRVWA1_GRVWB1_GSU1_GSUAMB_GSUC0_GSUWGMRR0_GLS0_ISA1201_IU1_K1_LBSPPA1024_LBSPPB1024_LBSPPM0_LPA32_LPB32_LPM0_LRVW8_LWPMn1_MIAV1_MIWT2_2_MO40_NTn1_NTA0_NTB0_NTC0_NTD0_NTM0_NEPBS0_NLCA1_NLCB1_ONLL0_PGR2_PLR1_PKA0_SIA2_SS0_SU32_SUM1_SUS256_SPO0_SRVW0_SSO0_SVW8_SK0_SKXCCM0_TLDS0_ULSGRO0_USL1_UIOFGRO0_USFGROn1_VSn1_VWA2_VWB2_WSGRA0_WSGRB0_WS32_WG32_4_1_WGM8_WGMXCC1_WGMXCCGn1
    SolutionIndex: 440
    SolutionNameMin: Cijk_Ailk_Bjlk_HHS_BH_Bias_SHB_HA_S_SAB_SCD_SAV_UserArgs_MT64x128x16_MI16x16x1_SN_LDSB1_AFC1_AFEM1_AFEM1_ASEM1_CLR1_CADS0_DTLA0_DTLB0_DTVA0_DTVB0_EPS1_FDSI0_GRPM1_GRVWA4_GRVWB8_GSU1_GSUAMB_GSUC0_GSUWGMRR0_GLS0_ISA1201_IU1_K1_LBSPPA1024_LBSPPB2048_LBSPPM0_LPA16_LPB0_LPM0_LRVW8_LWPMn1_MIAV1_MIWT1_8_MO40_NTn1_NTA0_NTB0_NTC0_NTD0_NTM0_NEPBS0_NLCA1_NLCB1_ONLL0_PGR1_PLR1_PKA0_SIA2_SS0_SU32_SUM1_SUS256_SPO0_SRVW0_SSO0_SVW8_SK0_SKXCCM0_TLDS0_ULSGRO0_USL1_UIOFGRO0_USFGROn1_VSn1_VWA1_VWB8_WSGRA0_WSGRB0_WS32_WG64_2_1_WGM8_WGMXCC1_WGMXCCGn1
    SolutionIndex: 441
    SolutionNameMin: Cijk_Ailk_Bjlk_HHS_BH_Bias_SHB_HA_S_SAB_SCD_SAV_UserArgs_MT16x256x32_MI16x16x1_SN_LDSB0_AFC1_AFEM1_AFEM1_ASEM1_CLR1_CADS0_DTLA0_DTLB0_DTVA0_DTVB1_EPS0_FDSI0_GRPM1_GRVWA4_GRVWB8_GSU1_GSUAMB_GSUC0_GSUWGMRR0_GLS0_ISA1201_IU1_K1_LBSPPA256_LBSPPB0_LBSPPM0_LPA16_LPB0_LPM0_LRVW8_LWPMn1_MIAV1_MIWT1_8_MO40_NTn1_NTA0_NTB0_NTC0_NTD0_NTM0_NEPBS0_NLCA1_NLCB2_ONLL0_PGR2_PLR1_PKA0_SIA3_SS0_SU32_SUM1_SUS256_SPO0_SRVW0_SSO0_SVW8_SK0_SKXCCM0_TLDS0_ULSGRO0_USL1_UIOFGRO0_USFGROn1_VSn1_VWA1_VWB1_WSGRA0_WSGRB0_WS32_WG16_4_1_WGM8_WGMXCC1_WGMXCCGn1
    SolutionIndex: 442
    SolutionNameMin: Cijk_Ailk_Bjlk_HHS_BH_Bias_SHB_HA_S_SAB_SCD_SAV_UserArgs_MT64x128x16_MI16x16x1_SN_LDSB1_AFC1_AFEM1_AFEM1_ASEM1_CLR1_CADS0_DTLA0_DTLB0_DTVA0_DTVB0_EPS0_FDSI0_GRPM1_GRVWA8_GRVWB8_GSU1_GSUAMB_GSUC0_GSUWGMRR0_GLS0_ISA1201_IU1_K1_LBSPPA1024_LBSPPB2048_LBSPPM0_LPA16_LPB0_LPM0_LRVW8_LWPMn1_MIAV1_MIWT1_8_MO40_NTn1_NTA0_NTB0_NTC0_NTD0_NTM0_NEPBS0_NLCA1_NLCB1_ONLL0_PGR2_PLR1_PKA0_SIA2_SS0_SU32_SUM1_SUS256_SPO0_SRVW0_SSO0_SVW8_SK0_SKXCCM0_TLDS0_ULSGRO1_USL1_UIOFGRO0_USFGROn1_VSn1_VWA1_VWB8_WSGRA0_WSGRB0_WS32_WG64_2_1_WGM8_WGMXCC1_WGMXCCGn1
    SolutionIndex: 443
    SolutionNameMin: Cijk_Ailk_Bjlk_HHS_BH_Bias_SHB_HA_S_SAB_SCD_SAV_UserArgs_MT64x128x16_MI16x16x1_SN_LDSB1_AFC1_AFEM1_AFEM1_ASEM1_CLR1_CADS0_DTLA0_DTLB0_DTVA0_DTVB0_EPS0_FDSI0_GRPM1_GRVWA8_GRVWB4_GSU1_GSUAMB_GSUC0_GSUWGMRR0_GLS0_ISA1201_IU1_K1_LBSPPA1024_LBSPPB2048_LBSPPM0_LPA16_LPB0_LPM0_LRVW8_LWPMn1_MIAV1_MIWT1_8_MO40_NTn1_NTA0_NTB0_NTC0_NTD0_NTM0_NEPBS0_NLCA1_NLCB1_ONLL0_PGR2_PLR1_PKA0_SIA2_SS0_SU32_SUM1_SUS256_SPO0_SRVW0_SSO0_SVW8_SK0_SKXCCM0_TLDS0_ULSGRO0_USL1_UIOFGRO0_USFGROn1_VSn1_VWA1_VWB8_WSGRA0_WSGRB0_WS32_WG64_2_1_WGM8_WGMXCC1_WGMXCCGn1
    SolutionIndex: 444
    SolutionNameMin: Cijk_Ailk_Bjlk_HHS_BH_Bias_SHB_HA_S_SAB_SCD_SAV_UserArgs_MT64x128x16_MI16x16x1_SN_LDSB0_AFC1_AFEM1_AFEM1_ASEM1_CLR0_CADS0_DTLA0_DTLB0_DTVA0_DTVB0_EPS0_FDSI0_GRPM1_GRVWA8_GRVWB4_GSU1_GSUAMB_GSUC0_GSUWGMRR0_GLS0_ISA1201_IU1_K1_LBSPPA1024_LBSPPB2048_LBSPPM0_LPA16_LPB0_LPM0_LRVW8_LWPMn1_MIAV1_MIWT1_8_MO40_NTn1_NTA0_NTB0_NTC0_NTD0_NTM0_NEPBS0_NLCA1_NLCB1_ONLL0_PGR2_PLR0_PKA0_SIA3_SS0_SU32_SUM1_SUS256_SPO0_SRVW0_SSO0_SVW8_SK0_SKXCCM0_TLDS0_ULSGRO0_USL1_UIOFGRO0_USFGROn1_VSn1_VWA1_VWB8_WSGRA0_WSGRB0_WS32_WG64_2_1_WGM8_WGMXCC1_WGMXCCGn1
    SolutionIndex: 445
    SolutionNameMin: Cijk_Ailk_Bjlk_HHS_BH_Bias_SHB_HA_S_SAB_SCD_SAV_UserArgs_MT64x64x32_MI16x16x1_SN_LDSB1_AFC1_AFEM1_AFEM1_ASEM1_CLR1_CADS0_DTLA0_DTLB0_DTVA0_DTVB0_EPS1_FDSI0_GRPM1_GRVWA4_GRVWB8_GSU1_GSUAMB_GSUC0_GSUWGMRR0_GLS0_ISA1201_IU2_K1_LBSPPA1024_LBSPPB1024_LBSPPM0_LPA32_LPB32_LPM0_LRVW8_LWPMn1_MIAV1_MIWT2_2_MO40_NTn1_NTA0_NTB0_NTC0_NTD0_NTM0_NEPBS0_NLCA1_NLCB1_ONLL0_PGR1_PLR1_PKA0_SIA2_SS0_SU32_SUM1_SUS256_SPO0_SRVW0_SSO0_SVW8_SK0_SKXCCM0_TLDS0_ULSGRO0_USL1_UIOFGRO0_USFGROn1_VSn1_VWA2_VWB2_WSGRA0_WSGRB0_WS32_WG32_4_1_WGM8_WGMXCC1_WGMXCCGn1
    SolutionIndex: 446
    SolutionNameMin: Cijk_Ailk_Bjlk_HHS_BH_Bias_SHB_HA_S_SAB_SCD_SAV_UserArgs_MT64x64x64_MI16x16x1_SN_LDSB0_AFC1_AFEM1_AFEM1_ASEM1_CLR1_CADS0_DTLA0_DTLB0_DTVA1_DTVB0_EPS1_FDSI0_GRPM1_GRVWA8_GRVWB4_GSU1_GSUAMB_GSUC0_GSUWGMRR0_GLS0_ISA1201_IU1_K1_LBSPPA0_LBSPPB1024_LBSPPM0_LPA0_LPB32_LPM0_LRVW8_LWPMn1_MIAV1_MIWT2_2_MO40_NTn1_NTA0_NTB0_NTC0_NTD0_NTM0_NEPBS0_NLCA4_NLCB1_ONLL0_PGR1_PLR1_PKA0_SIA3_SS1_SU32_SUM1_SUS256_SPO0_SRVW0_SSO0_SVW1_SK0_SKXCCM0_TLDS0_ULSGRO0_USL1_UIOFGRO0_USFGROn1_VSn1_VWA1_VWB2_WSGRA0_WSGRB0_WS32_WG32_4_1_WGM8_WGMXCC1_WGMXCCGn1
- - - [512, 512, 1, 64]
    - [205, 1.59]
  - - [1024, 512, 1, 64]
    - [176, 2.94]
  - - [1536, 512, 1, 64]
    - [6, 2764.79]
  - - [2048, 512, 1, 64]
    - [15, 3519.82]
  - - [2560, 512, 1, 64]
    - [7, 4377.96]
  - - [3072, 512, 1, 64]
    - [5, 5057.82]
  - - [512, 1024, 1, 64]
    - [273, 2.78]
  - - [1024, 1024, 1, 64]
    - [279, 3.62]
  - - [1536, 1024, 1, 64]
    - [410, 6.9]
  - - [2048, 1024, 1, 64]
    - [262, 8.18]
  - - [2560, 1024, 1, 64]
    - [4, 7148.67]
  - - [3072, 1024, 1, 64]
    - [4, 7922.19]
  - - [512, 1536, 1, 64]
    - [4, 2895.54]
  - - [1024, 1536, 1, 64]
    - [341, 6.67]
  - - [1536, 1536, 1, 64]
    - [360, 8.38]
  - - [2048, 1536, 1, 64]
    - [278, 9.5]
  - - [2560, 1536, 1, 64]
    - [7, 9019.2]
  - - [3072, 1536, 1, 64]
    - [5, 9848.67]
  - - [512, 2048, 1, 64]
    - [4, 3739.91]
  - - [1024, 2048, 1, 64]
    - [360, 8.26]
  - - [1536, 2048, 1, 64]
    - [425, 9.66]
  - - [2048, 2048, 1, 64]
    - [404, 11.46]
  - - [2560, 2048, 1, 64]
    - [2, 10608.8]
  - - [3072, 2048, 1, 64]
    - [4, 12018.4]
  - - [512, 2560, 1, 64]
    - [5, 4229.73]
  - - [1024, 2560, 1, 64]
    - [4, 7224.09]
  - - [1536, 2560, 1, 64]
    - [5, 8998.24]
  - - [2048, 2560, 1, 64]
    - [1, 10791.5]
  - - [2560, 2560, 1, 64]
    - [5, 12205.3]
  - - [3072, 2560, 1, 64]
    - [3, 12526.4]
  - - [512, 3072, 1, 64]
    - [17, 3995.76]
  - - [1024, 3072, 1, 64]
    - [7, 7679.97]
  - - [1536, 3072, 1, 64]
    - [1, 10270.0]
  - - [2048, 3072, 1, 64]
    - [4, 11815.3]
  - - [2560, 3072, 1, 64]
    - [5, 12965.9]
  - - [3072, 3072, 1, 64]
    - [7, 13879.2]
  - - [512, 512, 1, 256]
    - [303, 5.54]
  - - [1024, 512, 1, 256]
    - [253, 9.79]
  - - [1536, 512, 1, 256]
    - [6, 8778.71]
  - - [2048, 512, 1, 256]
    - [4, 10953.9]
  - - [2560, 512, 1, 256]
    - [15, 12527.3]
  - - [3072, 512, 1, 256]
    - [0, 9610.21]
  - - [512, 1024, 1, 256]
    - [273, 9.34]
  - - [1024, 1024, 1, 256]
    - [345, 15.76]
  - - [1536, 1024, 1, 256]
    - [404, 18.96]
  - - [2048, 1024, 1, 256]
    - [417, 21.75]
  - - [2560, 1024, 1, 256]
    - [4, 18361.3]
  - - [3072, 1024, 1, 256]
    - [13, 19686.5]
  - - [512, 1536, 1, 256]
    - [4, 8780.82]
  - - [1024, 1536, 1, 256]
    - [339, 19.36]
  - - [1536, 1536, 1, 256]
    - [339, 21.17]
  - - [2048, 1536, 1, 256]
    - [339, 23.29]
  - - [2560, 1536, 1, 256]
    - [4, 21248.4]
  - - [3072, 1536, 1, 256]
    - [4, 22807.0]
  - - [512, 2048, 1, 256]
    - [14, 7492.55]
  - - [1024, 2048, 1, 256]
    - [417, 21.61]
  - - [1536, 2048, 1, 256]
    - [427, 23.75]
  - - [2048, 2048, 1, 256]
    - [425, 25.77]
  - - [2560, 2048, 1, 256]
    - [4, 23864.7]
  - - [3072, 2048, 1, 256]
    - [4, 25187.5]
  - - [512, 2560, 1, 256]
    - [4, 12600.2]
  - - [1024, 2560, 1, 256]
    - [15, 18341.3]
  - - [1536, 2560, 1, 256]
    - [4, 21642.2]
  - - [2048, 2560, 1, 256]
    - [4, 23746.5]
  - - [2560, 2560, 1, 256]
    - [4, 25374.1]
  - - [3072, 2560, 1, 256]
    - [4, 26900.8]
  - - [512, 3072, 1, 256]
    - [13, 14040.0]
  - - [1024, 3072, 1, 256]
    - [4, 20017.3]
  - - [1536, 3072, 1, 256]
    - [4, 22886.9]
  - - [2048, 3072, 1, 256]
    - [4, 25132.2]
  - - [2560, 3072, 1, 256]
    - [0, 26647.4]
  - - [3072, 3072, 1, 256]
    - [15, 27327.5]
  - - [512, 512, 1, 512]
    - [300, 9.88]
  - - [1024, 512, 1, 512]
    - [253, 16.04]
  - - [1536, 512, 1, 512]
    - [15, 14221.5]
  - - [2048, 512, 1, 512]
    - [13, 17068.4]
  - - [2560, 512, 1, 512]
    - [15, 18650.2]
  - - [3072, 512, 1, 512]
    - [4, 20663.2]
  - - [512, 1024, 1, 512]
    - [303, 16.21]
  - - [1024, 1024, 1, 512]
    - [339, 24.04]
  - - [1536, 1024, 1, 512]
    - [4, 20655.0]
  - - [2048, 1024, 1, 512]
    - [15, 22773.6]
  - - [2560, 1024, 1, 512]
    - [13, 24229.7]
  - - [3072, 1024, 1, 512]
    - [15, 25706.9]
  - - [512, 1536, 1, 512]
    - [4, 14320.4]
  - - [1024, 1536, 1, 512]
    - [4, 20400.7]
  - - [1536, 1536, 1, 512]
    - [4, 23523.4]
  - - [2048, 1536, 1, 512]
    - [13, 26308.4]
  - - [2560, 1536, 1, 512]
    - [15, 27021.9]
  - - [3072, 1536, 1, 512]
    - [4, 29369.5]
  - - [512, 2048, 1, 512]
    - [4, 16680.5]
  - - [1024, 2048, 1, 512]
    - [15, 22463.2]
  - - [1536, 2048, 1, 512]
    - [13, 25764.7]
  - - [2048, 2048, 1, 512]
    - [4, 27882.2]
  - - [2560, 2048, 1, 512]
    - [4, 29294.8]
  - - [3072, 2048, 1, 512]
    - [13, 30521.8]
  - - [512, 2560, 1, 512]
    - [15, 18251.5]
  - - [1024, 2560, 1, 512]
    - [13, 19232.6]
  - - [1536, 2560, 1, 512]
    - [13, 27498.9]
  - - [2048, 2560, 1, 512]
    - [15, 29866.3]
  - - [2560, 2560, 1, 512]
    - [15, 30820.6]
  - - [3072, 2560, 1, 512]
    - [4, 32075.9]
  - - [512, 3072, 1, 512]
    - [17, 15962.5]
  - - [1024, 3072, 1, 512]
    - [13, 25657.7]
  - - [1536, 3072, 1, 512]
    - [13, 28584.3]
  - - [2048, 3072, 1, 512]
    - [4, 30594.4]
  - - [2560, 3072, 1, 512]
    - [0, 30950.8]
  - - [3072, 3072, 1, 512]
    - [13, 32420.7]
  - - [512, 512, 1, 1024]
    - [297, 16.32]
  - - [1024, 512, 1, 1024]
    - [368, 23.75]
  - - [1536, 512, 1, 1024]
    - [4, 20059.7]
  - - [2048, 512, 1, 1024]
    - [15, 22638.7]
  - - [2560, 512, 1, 1024]
    - [16, 23365.2]
  - - [3072, 512, 1, 1024]
    - [4, 26126.8]
  - - [512, 1024, 1, 1024]
    - [230, 24.3]
  - - [1024, 1024, 1, 1024]
    - [339, 33.81]
  - - [1536, 1024, 1, 1024]
    - [339, 36.18]
  - - [2048, 1024, 1, 1024]
    - [341, 37.32]
  - - [2560, 1024, 1, 1024]
    - [4, 29343.0]
  - - [3072, 1024, 1, 1024]
    - [15, 30870.5]
  - - [512, 1536, 1, 1024]
    - [15, 19795.4]
  - - [1024, 1536, 1, 1024]
    - [339, 36.0]
  - - [1536, 1536, 1, 1024]
    - [253, 32.63]
  - - [2048, 1536, 1, 1024]
    - [339, 36.27]
  - - [2560, 1536, 1, 1024]
    - [15, 32041.5]
  - - [3072, 1536, 1, 1024]
    - [4, 32160.4]
  - - [512, 2048, 1, 1024]
    - [15, 23000.9]
  - - [1024, 2048, 1, 1024]
    - [417, 36.16]
  - - [1536, 2048, 1, 1024]
    - [427, 36.13]
  - - [2048, 2048, 1, 1024]
    - [263, 39.42]
  - - [2560, 2048, 1, 1024]
    - [0, 33207.0]
  - - [3072, 2048, 1, 1024]
    - [0, 34410.8]
  - - [512, 2560, 1, 1024]
    - [15, 19293.7]
  - - [1024, 2560, 1, 1024]
    - [16, 28586.9]
  - - [1536, 2560, 1, 1024]
    - [4, 31516.4]
  - - [2048, 2560, 1, 1024]
    - [4, 32695.5]
  - - [2560, 2560, 1, 1024]
    - [13, 33584.5]
  - - [3072, 2560, 1, 1024]
    - [4, 34444.3]
  - - [512, 3072, 1, 1024]
    - [4, 26250.5]
  - - [1024, 3072, 1, 1024]
    - [13, 30288.9]
  - - [1536, 3072, 1, 1024]
    - [15, 32653.5]
  - - [2048, 3072, 1, 1024]
    - [15, 34049.1]
  - - [2560, 3072, 1, 1024]
    - [13, 34721.0]
  - - [3072, 3072, 1, 1024]
    - [4, 34981.8]
  - - [512, 512, 1, 2048]
    - [303, 23.4]
  - - [1024, 512, 1, 2048]
    - [253, 32.71]
  - - [1536, 512, 1, 2048]
    - [15, 24494.7]
  - - [2048, 512, 1, 2048]
    - [4, 27958.6]
  - - [2560, 512, 1, 2048]
    - [13, 28495.7]
  - - [3072, 512, 1, 2048]
    - [15, 29965.7]
  - - [512, 1024, 1, 2048]
    - [230, 32.54]
  - - [1024, 1024, 1, 2048]
    - [339, 42.99]
  - - [1536, 1024, 1, 2048]
    - [15, 30559.4]
  - - [2048, 1024, 1, 2048]
    - [15, 31352.9]
  - - [2560, 1024, 1, 2048]
    - [13, 32903.2]
  - - [3072, 1024, 1, 2048]
    - [15, 34230.3]
  - - [512, 1536, 1, 2048]
    - [15, 24394.2]
  - - [1024, 1536, 1, 2048]
    - [4, 29957.4]
  - - [1536, 1536, 1, 2048]
    - [4, 32132.4]
  - - [2048, 1536, 1, 2048]
    - [4, 32967.6]
  - - [2560, 1536, 1, 2048]
    - [15, 34108.8]
  - - [3072, 1536, 1, 2048]
    - [4, 35303.1]
  - - [512, 2048, 1, 2048]
    - [15, 27543.7]
  - - [1024, 2048, 1, 2048]
    - [15, 31852.7]
  - - [1536, 2048, 1, 2048]
    - [4, 33429.5]
  - - [2048, 2048, 1, 2048]
    - [360, 46.71]
  - - [2560, 2048, 1, 2048]
    - [15, 35012.8]
  - - [3072, 2048, 1, 2048]
    - [4, 34927.5]
  - - [512, 2560, 1, 2048]
    - [15, 28473.1]
  - - [1024, 2560, 1, 2048]
    - [13, 32443.1]
  - - [1536, 2560, 1, 2048]
    - [15, 33703.4]
  - - [2048, 2560, 1, 2048]
    - [15, 34952.8]
  - - [2560, 2560, 1, 2048]
    - [15, 35427.5]
  - - [3072, 2560, 1, 2048]
    - [15, 35568.4]
  - - [512, 3072, 1, 2048]
    - [0, 30643.9]
  - - [1024, 3072, 1, 2048]
    - [4, 33135.0]
  - - [1536, 3072, 1, 2048]
    - [15, 35086.0]
  - - [2048, 3072, 1, 2048]
    - [13, 35286.5]
  - - [2560, 3072, 1, 2048]
    - [4, 35540.8]
  - - [3072, 3072, 1, 2048]
    - [15, 35994.4]
  - - [512, 512, 1, 3072]
    - [9, 17907.8]
  - - [1024, 512, 1, 3072]
    - [13, 25523.4]
  - - [1536, 512, 1, 3072]
    - [15, 26395.7]
  - - [2048, 512, 1, 3072]
    - [13, 29236.7]
  - - [2560, 512, 1, 3072]
    - [4, 30260.9]
  - - [3072, 512, 1, 3072]
    - [15, 31219.3]
  - - [512, 1024, 1, 3072]
    - [2, 24676.9]
  - - [1024, 1024, 1, 3072]
    - [15, 29555.2]
  - - [1536, 1024, 1, 3072]
    - [4, 31553.2]
  - - [2048, 1024, 1, 3072]
    - [4, 32571.0]
  - - [2560, 1024, 1, 3072]
    - [13, 33635.7]
  - - [3072, 1024, 1, 3072]
    - [0, 34003.7]
  - - [512, 1536, 1, 3072]
    - [4, 26965.3]
  - - [1024, 1536, 1, 3072]
    - [13, 31697.3]
  - - [1536, 1536, 1, 3072]
    - [15, 33471.2]
  - - [2048, 1536, 1, 3072]
    - [15, 34142.1]
  - - [2560, 1536, 1, 3072]
    - [4, 34520.7]
  - - [3072, 1536, 1, 3072]
    - [0, 35005.5]
  - - [512, 2048, 1, 3072]
    - [0, 30031.5]
  - - [1024, 2048, 1, 3072]
    - [15, 33287.7]
  - - [1536, 2048, 1, 3072]
    - [13, 34538.9]
  - - [2048, 2048, 1, 3072]
    - [4, 34890.2]
  - - [2560, 2048, 1, 3072]
    - [15, 35540.9]
  - - [3072, 2048, 1, 3072]
    - [15, 35493.7]
  - - [512, 2560, 1, 3072]
    - [15, 30412.2]
  - - [1024, 2560, 1, 3072]
    - [13, 34182.2]
  - - [1536, 2560, 1, 3072]
    - [4, 34612.4]
  - - [2048, 2560, 1, 3072]
    - [4, 34945.9]
  - - [2560, 2560, 1, 3072]
    - [15, 35803.3]
  - - [3072, 2560, 1, 3072]
    - [0, 35815.1]
  - - [512, 3072, 1, 3072]
    - [0, 32031.1]
  - - [1024, 3072, 1, 3072]
    - [15, 33794.0]
  - - [1536, 3072, 1, 3072]
    - [0, 34947.1]
  - - [2048, 3072, 1, 3072]
    - [15, 35799.6]
  - - [2560, 3072, 1, 3072]
    - [0, 35674.7]
  - - [3072, 3072, 1, 3072]
    - [341, 52.64]
  - - [1, 1, 1, 1]
    - [399, 0.0]
  - - [1, 1, 1, 64]
    - [12, 0.004]
  - - [1, 64, 1, 1]
    - [11, 0.00423883]
  - - [64, 1, 1, 1]
    - [11, 0.00425858]
  - - [64, 64, 1, 1]
    - [8, 0.269323]
  - - [64, 1, 1, 64]
    - [10, 0.267914]
  - - [1, 64, 1, 64]
    - [12, 0.266945]
  - - [64, 64, 1, 64]
    - [114, 0.02]
  - - [64, 64, 1, 256]
    - [280, 0.1]
  - - [64, 64, 1, 512]
    - [346, 0.19]
  - - [64, 64, 1, 1024]
    - [363, 0.35]
  - - [64, 64, 1, 2048]
    - [363, 0.58]
  - - [64, 64, 1, 4096]
    - [363, 0.89]
  - - [256, 256, 1, 256]
    - [307, 1.53]
  - - [4096, 4096, 1, 4096]
    - [341, 52.89]
  - - [320, 64, 1, 64]
    - [118, 0.13]
  - - [576, 64, 1, 64]
    - [122, 0.22]
  - - [832, 64, 1, 64]
    - [125, 0.33]
  - - [1088, 64, 1, 64]
    - [145, 0.42]
  - - [1344, 64, 1, 64]
    - [138, 0.53]
  - - [1600, 64, 1, 64]
    - [155, 0.62]
  - - [1856, 64, 1, 64]
    - [143, 0.72]
  - - [2112, 64, 1, 64]
    - [382, 0.78]
  - - [2368, 64, 1, 64]
    - [203, 0.89]
  - - [2624, 64, 1, 64]
    - [174, 1.0]
  - - [2880, 64, 1, 64]
    - [185, 1.09]
  - - [3136, 64, 1, 64]
    - [170, 1.19]
  - - [3392, 64, 1, 64]
    - [303, 1.27]
  - - [3648, 64, 1, 64]
    - [210, 1.38]
  - - [3904, 64, 1, 64]
    - [149, 1.49]
  - - [64, 320, 1, 64]
    - [166, 0.13]
  - - [320, 320, 1, 64]
    - [169, 0.63]
  - - [576, 320, 1, 64]
    - [172, 1.08]
  - - [832, 320, 1, 64]
    - [164, 1.53]
  - - [1088, 320, 1, 64]
    - [174, 1.94]
  - - [1344, 320, 1, 64]
    - [303, 2.34]
  - - [1600, 320, 1, 64]
    - [300, 2.73]
  - - [1856, 320, 1, 64]
    - [226, 3.09]
  - - [2112, 320, 1, 64]
    - [176, 3.42]
  - - [2368, 320, 1, 64]
    - [322, 3.72]
  - - [2624, 320, 1, 64]
    - [226, 4.15]
  - - [2880, 320, 1, 64]
    - [226, 4.29]
  - - [3136, 320, 1, 64]
    - [146, 4.59]
  - - [3392, 320, 1, 64]
    - [226, 4.94]
  - - [3648, 320, 1, 64]
    - [146, 5.17]
  - - [3904, 320, 1, 64]
    - [226, 5.28]
  - - [64, 576, 1, 64]
    - [211, 0.23]
  - - [320, 576, 1, 64]
    - [149, 1.1]
  - - [576, 576, 1, 64]
    - [216, 1.89]
  - - [832, 576, 1, 64]
    - [176, 2.62]
  - - [1088, 576, 1, 64]
    - [149, 3.28]
  - - [1344, 576, 1, 64]
    - [182, 3.71]
  - - [1600, 576, 1, 64]
    - [273, 4.45]
  - - [1856, 576, 1, 64]
    - [226, 4.89]
  - - [2112, 576, 1, 64]
    - [226, 5.27]
  - - [2368, 576, 1, 64]
    - [226, 5.77]
  - - [2624, 576, 1, 64]
    - [149, 5.76]
  - - [2880, 576, 1, 64]
    - [226, 6.32]
  - - [3136, 576, 1, 64]
    - [226, 6.55]
  - - [3392, 576, 1, 64]
    - [267, 6.78]
  - - [3648, 576, 1, 64]
    - [226, 7.41]
  - - [3904, 576, 1, 64]
    - [226, 7.57]
  - - [64, 832, 1, 64]
    - [247, 0.33]
  - - [320, 832, 1, 64]
    - [250, 1.54]
  - - [576, 832, 1, 64]
    - [215, 2.62]
  - - [832, 832, 1, 64]
    - [252, 3.53]
  - - [1088, 832, 1, 64]
    - [226, 4.38]
  - - [1344, 832, 1, 64]
    - [226, 5.11]
  - - [1600, 832, 1, 64]
    - [226, 5.71]
  - - [1856, 832, 1, 64]
    - [267, 5.93]
  - - [2112, 832, 1, 64]
    - [164, 6.3]
  - - [2368, 832, 1, 64]
    - [391, 6.74]
  - - [2624, 832, 1, 64]
    - [226, 7.68]
  - - [2880, 832, 1, 64]
    - [252, 7.49]
  - - [3136, 832, 1, 64]
    - [226, 8.33]
  - - [3392, 832, 1, 64]
    - [226, 8.7]
  - - [3648, 832, 1, 64]
    - [267, 8.35]
  - - [3904, 832, 1, 64]
    - [164, 8.74]
  - - [64, 1088, 1, 64]
    - [195, 0.43]
  - - [320, 1088, 1, 64]
    - [328, 1.97]
  - - [576, 1088, 1, 64]
    - [176, 3.27]
  - - [832, 1088, 1, 64]
    - [276, 4.4]
  - - [1088, 1088, 1, 64]
    - [230, 5.3]
  - - [1344, 1088, 1, 64]
    - [260, 5.98]
  - - [1600, 1088, 1, 64]
    - [226, 6.53]
  - - [1856, 1088, 1, 64]
    - [226, 7.22]
  - - [2112, 1088, 1, 64]
    - [267, 7.55]
  - - [2368, 1088, 1, 64]
    - [267, 8.11]
  - - [2624, 1088, 1, 64]
    - [226, 8.78]
  - - [2880, 1088, 1, 64]
    - [439, 8.35]
  - - [3136, 1088, 1, 64]
    - [422, 8.68]
  - - [3392, 1088, 1, 64]
    - [267, 9.58]
  - - [3648, 1088, 1, 64]
    - [267, 9.76]
  - - [3904, 1088, 1, 64]
    - [267, 10.23]
  - - [64, 1344, 1, 64]
    - [175, 0.53]
  - - [320, 1344, 1, 64]
    - [230, 2.36]
  - - [576, 1344, 1, 64]
    - [174, 3.82]
  - - [832, 1344, 1, 64]
    - [267, 5.1]
  - - [1088, 1344, 1, 64]
    - [387, 5.87]
  - - [1344, 1344, 1, 64]
    - [386, 6.51]
  - - [1600, 1344, 1, 64]
    - [226, 7.69]
  - - [1856, 1344, 1, 64]
    - [267, 8.05]
  - - [2112, 1344, 1, 64]
    - [267, 8.51]
  - - [2368, 1344, 1, 64]
    - [226, 9.32]
  - - [2624, 1344, 1, 64]
    - [226, 9.78]
  - - [2880, 1344, 1, 64]
    - [226, 9.97]
  - - [3136, 1344, 1, 64]
    - [226, 10.35]
  - - [3392, 1344, 1, 64]
    - [267, 10.45]
  - - [3648, 1344, 1, 64]
    - [226, 10.99]
  - - [3904, 1344, 1, 64]
    - [226, 11.62]
  - - [64, 1600, 1, 64]
    - [149, 0.63]
  - - [320, 1600, 1, 64]
    - [322, 2.73]
  - - [576, 1600, 1, 64]
    - [276, 4.53]
  - - [832, 1600, 1, 64]
    - [260, 5.64]
  - - [1088, 1600, 1, 64]
    - [260, 6.56]
  - - [1344, 1600, 1, 64]
    - [226, 7.6]
  - - [1600, 1600, 1, 64]
    - [226, 8.28]
  - - [1856, 1600, 1, 64]
    - [390, 8.31]
  - - [2112, 1600, 1, 64]
    - [267, 9.27]
  - - [2368, 1600, 1, 64]
    - [226, 9.86]
  - - [2624, 1600, 1, 64]
    - [226, 10.45]
  - - [2880, 1600, 1, 64]
    - [226, 11.05]
  - - [3136, 1600, 1, 64]
    - [226, 11.43]
  - - [3392, 1600, 1, 64]
    - [226, 11.73]
  - - [3648, 1600, 1, 64]
    - [226, 11.56]
  - - [3904, 1600, 1, 64]
    - [267, 11.3]
  - - [64, 1856, 1, 64]
    - [311, 0.73]
  - - [320, 1856, 1, 64]
    - [231, 3.09]
  - - [576, 1856, 1, 64]
    - [260, 4.83]
  - - [832, 1856, 1, 64]
    - [226, 6.12]
  - - [1088, 1856, 1, 64]
    - [226, 7.27]
  - - [1344, 1856, 1, 64]
    - [226, 8.1]
  - - [1600, 1856, 1, 64]
    - [226, 9.07]
  - - [1856, 1856, 1, 64]
    - [391, 8.99]
  - - [2112, 1856, 1, 64]
    - [226, 10.2]
  - - [2368, 1856, 1, 64]
    - [226, 10.28]
  - - [2624, 1856, 1, 64]
    - [226, 11.1]
  - - [2880, 1856, 1, 64]
    - [267, 11.07]
  - - [3136, 1856, 1, 64]
    - [226, 12.12]
  - - [3392, 1856, 1, 64]
    - [226, 12.31]
  - - [3648, 1856, 1, 64]
    - [440, 11.39]
  - - [3904, 1856, 1, 64]
    - [267, 11.87]
  - - [64, 2112, 1, 64]
    - [155, 0.81]
  - - [320, 2112, 1, 64]
    - [441, 3.49]
  - - [576, 2112, 1, 64]
    - [226, 5.42]
  - - [832, 2112, 1, 64]
    - [226, 6.89]
  - - [1088, 2112, 1, 64]
    - [226, 7.8]
  - - [1344, 2112, 1, 64]
    - [260, 8.37]
  - - [1600, 2112, 1, 64]
    - [226, 9.64]
  - - [1856, 2112, 1, 64]
    - [226, 10.28]
  - - [2112, 2112, 1, 64]
    - [226, 10.86]
  - - [2368, 2112, 1, 64]
    - [226, 11.3]
  - - [2624, 2112, 1, 64]
    - [226, 11.75]
  - - [2880, 2112, 1, 64]
    - [226, 12.2]
  - - [3136, 2112, 1, 64]
    - [226, 12.14]
  - - [3392, 2112, 1, 64]
    - [226, 12.61]
  - - [3648, 2112, 1, 64]
    - [226, 12.91]
  - - [3904, 2112, 1, 64]
    - [226, 13.31]
  - - [64, 2368, 1, 64]
    - [248, 0.9]
  - - [320, 2368, 1, 64]
    - [176, 3.81]
  - - [576, 2368, 1, 64]
    - [226, 5.81]
  - - [832, 2368, 1, 64]
    - [422, 7.02]
  - - [1088, 2368, 1, 64]
    - [226, 8.29]
  - - [1344, 2368, 1, 64]
    - [226, 9.2]
  - - [1600, 2368, 1, 64]
    - [226, 10.1]
  - - [1856, 2368, 1, 64]
    - [442, 9.83]
  - - [2112, 2368, 1, 64]
    - [226, 11.26]
  - - [2368, 2368, 1, 64]
    - [226, 11.81]
  - - [2624, 2368, 1, 64]
    - [226, 12.12]
  - - [2880, 2368, 1, 64]
    - [226, 12.62]
  - - [3136, 2368, 1, 64]
    - [226, 12.82]
  - - [3392, 2368, 1, 64]
    - [226, 12.95]
  - - [3648, 2368, 1, 64]
    - [226, 12.95]
  - - [3904, 2368, 1, 64]
    - [226, 13.63]
  - - [64, 2624, 1, 64]
    - [155, 0.99]
  - - [320, 2624, 1, 64]
    - [260, 4.2]
  - - [576, 2624, 1, 64]
    - [443, 5.93]
  - - [832, 2624, 1, 64]
    - [260, 7.42]
  - - [1088, 2624, 1, 64]
    - [267, 8.62]
  - - [1344, 2624, 1, 64]
    - [260, 9.37]
  - - [1600, 2624, 1, 64]
    - [226, 10.52]
  - - [1856, 2624, 1, 64]
    - [267, 10.57]
  - - [2112, 2624, 1, 64]
    - [444, 10.6]
  - - [2368, 2624, 1, 64]
    - [226, 12.18]
  - - [2624, 2624, 1, 64]
    - [226, 12.53]
  - - [2880, 2624, 1, 64]
    - [226, 13.02]
  - - [3136, 2624, 1, 64]
    - [226, 13.18]
  - - [3392, 2624, 1, 64]
    - [226, 12.95]
  - - [3648, 2624, 1, 64]
    - [226, 13.21]
  - - [3904, 2624, 1, 64]
    - [226, 14.14]
  - - [64, 2880, 1, 64]
    - [445, 1.09]
  - - [320, 2880, 1, 64]
    - [226, 4.49]
  - - [576, 2880, 1, 64]
    - [226, 6.43]
  - - [832, 2880, 1, 64]
    - [260, 7.68]
  - - [1088, 2880, 1, 64]
    - [226, 9.15]
  - - [1344, 2880, 1, 64]
    - [226, 10.22]
  - - [1600, 2880, 1, 64]
    - [226, 10.89]
  - - [1856, 2880, 1, 64]
    - [226, 11.65]
  - - [2112, 2880, 1, 64]
    - [226, 12.08]
  - - [2368, 2880, 1, 64]
    - [226, 12.49]
  - - [2624, 2880, 1, 64]
    - [226, 12.86]
  - - [2880, 2880, 1, 64]
    - [226, 13.26]
  - - [3136, 2880, 1, 64]
    - [226, 13.42]
  - - [3392, 2880, 1, 64]
    - [226, 13.9]
  - - [3648, 2880, 1, 64]
    - [226, 13.88]
  - - [3904, 2880, 1, 64]
    - [226, 13.98]
  - - [64, 3136, 1, 64]
    - [149, 1.21]
  - - [320, 3136, 1, 64]
    - [226, 4.85]
  - - [576, 3136, 1, 64]
    - [260, 6.58]
  - - [832, 3136, 1, 64]
    - [226, 8.6]
  - - [1088, 3136, 1, 64]
    - [260, 9.17]
  - - [1344, 3136, 1, 64]
    - [226, 10.61]
  - - [1600, 3136, 1, 64]
    - [226, 11.32]
  - - [1856, 3136, 1, 64]
    - [226, 12.02]
  - - [2112, 3136, 1, 64]
    - [226, 12.44]
  - - [2368, 3136, 1, 64]
    - [226, 12.77]
  - - [2624, 3136, 1, 64]
    - [226, 13.1]
  - - [2880, 3136, 1, 64]
    - [226, 13.27]
  - - [3136, 3136, 1, 64]
    - [226, 13.41]
  - - [3392, 3136, 1, 64]
    - [226, 13.87]
  - - [3648, 3136, 1, 64]
    - [226, 14.33]
  - - [3904, 3136, 1, 64]
    - [226, 14.61]
  - - [64, 3392, 1, 64]
    - [207, 1.3]
  - - [320, 3392, 1, 64]
    - [260, 5.02]
  - - [576, 3392, 1, 64]
    - [226, 7.01]
  - - [832, 3392, 1, 64]
    - [267, 8.74]
  - - [1088, 3392, 1, 64]
    - [226, 9.98]
  - - [1344, 3392, 1, 64]
    - [267, 10.58]
  - - [1600, 3392, 1, 64]
    - [226, 11.49]
  - - [1856, 3392, 1, 64]
    - [226, 12.26]
  - - [2112, 3392, 1, 64]
    - [226, 12.78]
  - - [2368, 3392, 1, 64]
    - [226, 13.09]
  - - [2624, 3392, 1, 64]
    - [226, 13.49]
  - - [2880, 3392, 1, 64]
    - [226, 13.78]
  - - [3136, 3392, 1, 64]
    - [226, 13.97]
  - - [3392, 3392, 1, 64]
    - [226, 14.49]
  - - [3648, 3392, 1, 64]
    - [226, 14.29]
  - - [3904, 3392, 1, 64]
    - [226, 14.55]
  - - [64, 3648, 1, 64]
    - [186, 1.39]
  - - [320, 3648, 1, 64]
    - [260, 5.36]
  - - [576, 3648, 1, 64]
    - [252, 6.95]
  - - [832, 3648, 1, 64]
    - [267, 8.85]
  - - [1088, 3648, 1, 64]
    - [226, 10.19]
  - - [1344, 3648, 1, 64]
    - [226, 11.09]
  - - [1600, 3648, 1, 64]
    - [226, 11.87]
  - - [1856, 3648, 1, 64]
    - [226, 12.43]
  - - [2112, 3648, 1, 64]
    - [226, 12.81]
  - - [2368, 3648, 1, 64]
    - [267, 12.39]
  - - [2624, 3648, 1, 64]
    - [260, 12.6]
  - - [2880, 3648, 1, 64]
    - [226, 13.83]
  - - [3136, 3648, 1, 64]
    - [226, 14.36]
  - - [3392, 3648, 1, 64]
    - [226, 14.37]
  - - [3648, 3648, 1, 64]
    - [226, 14.62]
  - - [3904, 3648, 1, 64]
    - [226, 15.03]
  - - [64, 3904, 1, 64]
    - [186, 1.48]
  - - [320, 3904, 1, 64]
    - [260, 5.63]
  - - [576, 3904, 1, 64]
    - [226, 8.01]
  - - [832, 3904, 1, 64]
    - [267, 9.14]
  - - [1088, 3904, 1, 64]
    - [226, 10.47]
  - - [1344, 3904, 1, 64]
    - [226, 11.47]
  - - [1600, 3904, 1, 64]
    - [226, 12.24]
  - - [1856, 3904, 1, 64]
    - [391, 11.79]
  - - [2112, 3904, 1, 64]
    - [226, 13.55]
  - - [2368, 3904, 1, 64]
    - [226, 13.62]
  - - [2624, 3904, 1, 64]
    - [260, 12.79]
  - - [2880, 3904, 1, 64]
    - [226, 14.21]
  - - [3136, 3904, 1, 64]
    - [226, 14.74]
  - - [3392, 3904, 1, 64]
    - [226, 14.52]
  - - [3648, 3904, 1, 64]
    - [226, 14.6]
  - - [3904, 3904, 1, 64]
    - [226, 15.18]
  - - [320, 64, 1, 256]
    - [280, 0.49]
  - - [576, 64, 1, 256]
    - [285, 0.86]
  - - [832, 64, 1, 256]
    - [288, 1.25]
  - - [1088, 64, 1, 256]
    - [313, 1.54]
  - - [1344, 64, 1, 256]
    - [303, 1.96]
  - - [1600, 64, 1, 256]
    - [303, 2.23]
  - - [1856, 64, 1, 256]
    - [305, 2.59]
  - - [2112, 64, 1, 256]
    - [300, 2.92]
  - - [2368, 64, 1, 256]
    - [187, 3.25]
  - - [2624, 64, 1, 256]
    - [303, 3.6]
  - - [2880, 64, 1, 256]
    - [297, 3.94]
  - - [3136, 64, 1, 256]
    - [300, 4.32]
  - - [3392, 64, 1, 256]
    - [187, 4.64]
  - - [3648, 64, 1, 256]
    - [207, 4.96]
  - - [3904, 64, 1, 256]
    - [300, 5.36]
  - - [64, 320, 1, 256]
    - [312, 0.49]
  - - [320, 320, 1, 256]
    - [187, 2.25]
  - - [576, 320, 1, 256]
    - [303, 3.95]
  - - [832, 320, 1, 256]
    - [315, 5.33]
  - - [1088, 320, 1, 256]
    - [207, 6.96]
  - - [1344, 320, 1, 256]
    - [332, 7.96]
  - - [1600, 320, 1, 256]
    - [243, 9.32]
  - - [1856, 320, 1, 256]
    - [336, 9.81]
  - - [2112, 320, 1, 256]
    - [176, 10.79]
  - - [2368, 320, 1, 256]
    - [338, 11.73]
  - - [2624, 320, 1, 256]
    - [226, 12.85]
  - - [2880, 320, 1, 256]
    - [243, 12.87]
  - - [3136, 320, 1, 256]
    - [250, 13.44]
  - - [3392, 320, 1, 256]
    - [226, 14.62]
  - - [3648, 320, 1, 256]
    - [215, 15.09]
  - - [3904, 320, 1, 256]
    - [226, 15.57]
  - - [64, 576, 1, 256]
    - [280, 0.87]
  - - [320, 576, 1, 256]
    - [300, 3.97]
  - - [576, 576, 1, 256]
    - [243, 6.64]
  - - [832, 576, 1, 256]
    - [186, 8.88]
  - - [1088, 576, 1, 256]
    - [174, 10.82]
  - - [1344, 576, 1, 256]
    - [215, 12.11]
  - - [1600, 576, 1, 256]
    - [176, 13.58]
  - - [1856, 576, 1, 256]
    - [176, 14.15]
  - - [2112, 576, 1, 256]
    - [243, 14.92]
  - - [2368, 576, 1, 256]
    - [226, 15.9]
  - - [2624, 576, 1, 256]
    - [250, 16.41]
  - - [2880, 576, 1, 256]
    - [215, 17.31]
  - - [3136, 576, 1, 256]
    - [226, 18.22]
  - - [3392, 576, 1, 256]
    - [243, 18.81]
  - - [3648, 576, 1, 256]
    - [226, 19.43]
  - - [3904, 576, 1, 256]
    - [176, 19.56]
  - - [64, 832, 1, 256]
    - [333, 1.25]
  - - [320, 832, 1, 256]
    - [186, 5.44]
  - - [576, 832, 1, 256]
    - [332, 8.81]
  - - [832, 832, 1, 256]
    - [276, 9.65]
  - - [1088, 832, 1, 256]
    - [176, 13.78]
  - - [1344, 832, 1, 256]
    - [176, 15.01]
  - - [1600, 832, 1, 256]
    - [226, 15.82]
  - - [1856, 832, 1, 256]
    - [243, 17.09]
  - - [2112, 832, 1, 256]
    - [338, 17.45]
  - - [2368, 832, 1, 256]
    - [176, 18.5]
  - - [2624, 832, 1, 256]
    - [226, 19.58]
  - - [2880, 832, 1, 256]
    - [230, 19.83]
  - - [3136, 832, 1, 256]
    - [322, 20.58]
  - - [3392, 832, 1, 256]
    - [226, 21.0]
  - - [3648, 832, 1, 256]
    - [243, 20.79]
  - - [3904, 832, 1, 256]
    - [226, 22.49]
  - - [64, 1088, 1, 256]
    - [313, 1.59]
  - - [320, 1088, 1, 256]
    - [243, 6.94]
  - - [576, 1088, 1, 256]
    - [303, 10.82]
  - - [832, 1088, 1, 256]
    - [176, 13.93]
  - - [1088, 1088, 1, 256]
    - [226, 16.04]
  - - [1344, 1088, 1, 256]
    - [226, 17.68]
  - - [1600, 1088, 1, 256]
    - [176, 17.72]
  - - [1856, 1088, 1, 256]
    - [226, 19.05]
  - - [2112, 1088, 1, 256]
    - [176, 19.79]
  - - [2368, 1088, 1, 256]
    - [338, 20.47]
  - - [2624, 1088, 1, 256]
    - [226, 22.17]
  - - [2880, 1088, 1, 256]
    - [276, 21.56]
  - - [3136, 1088, 1, 256]
    - [226, 23.58]
  - - [3392, 1088, 1, 256]
    - [226, 24.06]
  - - [3648, 1088, 1, 256]
    - [226, 24.12]
  - - [3904, 1088, 1, 256]
    - [226, 24.28]
  - - [64, 1344, 1, 256]
    - [331, 1.97]
  - - [320, 1344, 1, 256]
    - [315, 7.96]
  - - [576, 1344, 1, 256]
    - [215, 12.21]
  - - [832, 1344, 1, 256]
    - [332, 15.06]
  - - [1088, 1344, 1, 256]
    - [322, 16.1]
  - - [1344, 1344, 1, 256]
    - [226, 18.71]
  - - [1600, 1344, 1, 256]
    - [226, 19.71]
  - - [1856, 1344, 1, 256]
    - [276, 20.59]
  - - [2112, 1344, 1, 256]
    - [226, 22.31]
  - - [2368, 1344, 1, 256]
    - [276, 22.26]
  - - [2624, 1344, 1, 256]
    - [243, 22.54]
  - - [2880, 1344, 1, 256]
    - [226, 24.52]
  - - [3136, 1344, 1, 256]
    - [276, 23.58]
  - - [3392, 1344, 1, 256]
    - [226, 24.65]
  - - [3648, 1344, 1, 256]
    - [226, 25.08]
  - - [3904, 1344, 1, 256]
    - [226, 26.02]
  - - [64, 1600, 1, 256]
    - [297, 2.32]
  - - [320, 1600, 1, 256]
    - [174, 9.49]
  - - [576, 1600, 1, 256]
    - [273, 13.22]
  - - [832, 1600, 1, 256]
    - [226, 16.21]
  - - [1088, 1600, 1, 256]
    - [332, 17.85]
  - - [1344, 1600, 1, 256]
    - [226, 20.14]
  - - [1600, 1600, 1, 256]
    - [226, 20.26]
  - - [1856, 1600, 1, 256]
    - [226, 22.06]
  - - [2112, 1600, 1, 256]
    - [226, 23.0]
  - - [2368, 1600, 1, 256]
    - [332, 22.82]
  - - [2624, 1600, 1, 256]
    - [226, 25.01]
  - - [2880, 1600, 1, 256]
    - [332, 24.27]
  - - [3136, 1600, 1, 256]
    - [226, 25.43]
  - - [3392, 1600, 1, 256]
    - [226, 25.83]
  - - [3648, 1600, 1, 256]
    - [226, 25.24]
  - - [3904, 1600, 1, 256]
    - [254, 26.24]
  - - [64, 1856, 1, 256]
    - [187, 2.67]
  - - [320, 1856, 1, 256]
    - [215, 10.21]
  - - [576, 1856, 1, 256]
    - [174, 14.22]
  - - [832, 1856, 1, 256]
    - [243, 16.72]
  - - [1088, 1856, 1, 256]
    - [226, 19.71]
  - - [1344, 1856, 1, 256]
    - [273, 20.47]
  - - [1600, 1856, 1, 256]
    - [226, 22.09]
  - - [1856, 1856, 1, 256]
    - [226, 23.1]
  - - [2112, 1856, 1, 256]
    - [226, 24.22]
  - - [2368, 1856, 1, 256]
    - [226, 24.23]
  - - [2624, 1856, 1, 256]
    - [230, 23.95]
  - - [2880, 1856, 1, 256]
    - [226, 25.08]
  - - [3136, 1856, 1, 256]
    - [226, 26.32]
  - - [3392, 1856, 1, 256]
    - [332, 25.33]
  - - [3648, 1856, 1, 256]
    - [226, 26.81]
  - - [3904, 1856, 1, 256]
    - [339, 27.02]
  - - [64, 2112, 1, 256]
    - [303, 3.0]
  - - [320, 2112, 1, 256]
    - [260, 10.99]
  - - [576, 2112, 1, 256]
    - [276, 15.47]
  - - [832, 2112, 1, 256]
    - [226, 18.72]
  - - [1088, 2112, 1, 256]
    - [176, 19.94]
  - - [1344, 2112, 1, 256]
    - [226, 21.17]
  - - [1600, 2112, 1, 256]
    - [332, 22.19]
  - - [1856, 2112, 1, 256]
    - [215, 22.77]
  - - [2112, 2112, 1, 256]
    - [226, 24.2]
  - - [2368, 2112, 1, 256]
    - [332, 24.64]
  - - [2624, 2112, 1, 256]
    - [226, 25.99]
  - - [2880, 2112, 1, 256]
    - [226, 25.42]
  - - [3136, 2112, 1, 256]
    - [226, 25.57]
  - - [3392, 2112, 1, 256]
    - [339, 26.98]
  - - [3648, 2112, 1, 256]
    - [339, 27.23]
  - - [3904, 2112, 1, 256]
    - [341, 27.78]
  - - [64, 2368, 1, 256]
    - [243, 3.23]
  - - [320, 2368, 1, 256]
    - [174, 12.07]
  - - [576, 2368, 1, 256]
    - [243, 15.73]
  - - [832, 2368, 1, 256]
    - [226, 18.92]
  - - [1088, 2368, 1, 256]
    - [322, 19.99]
  - - [1344, 2368, 1, 256]
    - [174, 20.94]
  - - [1600, 2368, 1, 256]
    - [230, 22.35]
  - - [1856, 2368, 1, 256]
    - [243, 23.12]
  - - [2112, 2368, 1, 256]
    - [332, 23.84]
  - - [2368, 2368, 1, 256]
    - [341, 24.21]
  - - [2624, 2368, 1, 256]
    - [254, 25.74]
  - - [2880, 2368, 1, 256]
    - [339, 25.99]
  - - [3136, 2368, 1, 256]
    - [339, 26.36]
  - - [3392, 2368, 1, 256]
    - [341, 27.13]
  - - [3648, 2368, 1, 256]
    - [339, 27.92]
  - - [3904, 2368, 1, 256]
    - [339, 28.79]
  - - [64, 2624, 1, 256]
    - [300, 3.69]
  - - [320, 2624, 1, 256]
    - [226, 12.83]
  - - [576, 2624, 1, 256]
    - [226, 18.47]
  - - [832, 2624, 1, 256]
    - [226, 20.49]
  - - [1088, 2624, 1, 256]
    - [226, 22.23]
  - - [1344, 2624, 1, 256]
    - [226, 24.22]
  - - [1600, 2624, 1, 256]
    - [226, 25.48]
  - - [1856, 2624, 1, 256]
    - [226, 26.53]
  - - [2112, 2624, 1, 256]
    - [332, 25.53]
  - - [2368, 2624, 1, 256]
    - [226, 27.99]
  - - [2624, 2624, 1, 256]
    - [226, 27.99]
  - - [2880, 2624, 1, 256]
    - [226, 28.86]
  - - [3136, 2624, 1, 256]
    - [226, 29.17]
  - - [3392, 2624, 1, 256]
    - [226, 29.56]
  - - [3648, 2624, 1, 256]
    - [226, 29.4]
  - - [3904, 2624, 1, 256]
    - [226, 30.18]
  - - [64, 2880, 1, 256]
    - [338, 4.01]
  - - [320, 2880, 1, 256]
    - [260, 13.24]
  - - [576, 2880, 1, 256]
    - [338, 17.37]
  - - [832, 2880, 1, 256]
    - [243, 19.92]
  - - [1088, 2880, 1, 256]
    - [243, 21.54]
  - - [1344, 2880, 1, 256]
    - [338, 22.56]
  - - [1600, 2880, 1, 256]
    - [226, 25.03]
  - - [1856, 2880, 1, 256]
    - [226, 24.83]
  - - [2112, 2880, 1, 256]
    - [332, 25.22]
  - - [2368, 2880, 1, 256]
    - [339, 25.87]
  - - [2624, 2880, 1, 256]
    - [254, 26.6]
  - - [2880, 2880, 1, 256]
    - [339, 26.7]
  - - [3136, 2880, 1, 256]
    - [339, 28.1]
  - - [3392, 2880, 1, 256]
    - [341, 28.83]
  - - [3648, 2880, 1, 256]
    - [339, 29.03]
  - - [3904, 2880, 1, 256]
    - [339, 30.15]
  - - [64, 3136, 1, 256]
    - [206, 4.3]
  - - [320, 3136, 1, 256]
    - [226, 14.38]
  - - [576, 3136, 1, 256]
    - [322, 18.09]
  - - [832, 3136, 1, 256]
    - [243, 20.69]
  - - [1088, 3136, 1, 256]
    - [226, 23.11]
  - - [1344, 3136, 1, 256]
    - [226, 25.01]
  - - [1600, 3136, 1, 256]
    - [332, 25.25]
  - - [1856, 3136, 1, 256]
    - [226, 25.84]
  - - [2112, 3136, 1, 256]
    - [226, 27.53]
  - - [2368, 3136, 1, 256]
    - [226, 27.72]
  - - [2624, 3136, 1, 256]
    - [226, 28.54]
  - - [2880, 3136, 1, 256]
    - [339, 28.7]
  - - [3136, 3136, 1, 256]
    - [339, 28.98]
  - - [3392, 3136, 1, 256]
    - [339, 29.55]
  - - [3648, 3136, 1, 256]
    - [339, 29.94]
  - - [3904, 3136, 1, 256]
    - [341, 30.44]
  - - [64, 3392, 1, 256]
    - [300, 4.75]
  - - [320, 3392, 1, 256]
    - [230, 13.75]
  - - [576, 3392, 1, 256]
    - [243, 18.96]
  - - [832, 3392, 1, 256]
    - [338, 20.83]
  - - [1088, 3392, 1, 256]
    - [332, 22.26]
  - - [1344, 3392, 1, 256]
    - [226, 24.29]
  - - [1600, 3392, 1, 256]
    - [230, 24.44]
  - - [1856, 3392, 1, 256]
    - [226, 25.65]
  - - [2112, 3392, 1, 256]
    - [332, 26.77]
  - - [2368, 3392, 1, 256]
    - [339, 27.4]
  - - [2624, 3392, 1, 256]
    - [226, 27.85]
  - - [2880, 3392, 1, 256]
    - [339, 28.93]
  - - [3136, 3392, 1, 256]
    - [339, 28.68]
  - - [3392, 3392, 1, 256]
    - [339, 29.9]
  - - [3648, 3392, 1, 256]
    - [339, 30.21]
  - - [3904, 3392, 1, 256]
    - [339, 31.39]
  - - [64, 3648, 1, 256]
    - [303, 5.05]
  - - [320, 3648, 1, 256]
    - [322, 15.15]
  - - [576, 3648, 1, 256]
    - [176, 19.08]
  - - [832, 3648, 1, 256]
    - [338, 21.22]
  - - [1088, 3648, 1, 256]
    - [226, 23.18]
  - - [1344, 3648, 1, 256]
    - [338, 23.23]
  - - [1600, 3648, 1, 256]
    - [243, 24.62]
  - - [1856, 3648, 1, 256]
    - [226, 25.14]
  - - [2112, 3648, 1, 256]
    - [339, 27.4]
  - - [2368, 3648, 1, 256]
    - [339, 28.08]
  - - [2624, 3648, 1, 256]
    - [341, 28.57]
  - - [2880, 3648, 1, 256]
    - [339, 29.22]
  - - [3136, 3648, 1, 256]
    - [339, 29.9]
  - - [3392, 3648, 1, 256]
    - [339, 30.41]
  - - [3648, 3648, 1, 256]
    - [339, 30.6]
  - - [3904, 3648, 1, 256]
    - [339, 30.95]
  - - [64, 3904, 1, 256]
    - [225, 5.15]
  - - [320, 3904, 1, 256]
    - [226, 16.23]
  - - [576, 3904, 1, 256]
    - [226, 21.1]
  - - [832, 3904, 1, 256]
    - [226, 23.59]
  - - [1088, 3904, 1, 256]
    - [226, 25.59]
  - - [1344, 3904, 1, 256]
    - [226, 26.94]
  - - [1600, 3904, 1, 256]
    - [226, 27.91]
  - - [1856, 3904, 1, 256]
    - [226, 28.62]
  - - [2112, 3904, 1, 256]
    - [226, 28.59]
  - - [2368, 3904, 1, 256]
    - [226, 28.9]
  - - [2624, 3904, 1, 256]
    - [226, 30.67]
  - - [2880, 3904, 1, 256]
    - [226, 30.5]
  - - [3136, 3904, 1, 256]
    - [226, 30.99]
  - - [3392, 3904, 1, 256]
    - [226, 30.87]
  - - [3648, 3904, 1, 256]
    - [339, 31.15]
  - - [3904, 3904, 1, 256]
    - [226, 31.7]
  - - [320, 64, 1, 512]
    - [348, 0.95]
  - - [576, 64, 1, 512]
    - [280, 1.64]
  - - [832, 64, 1, 512]
    - [280, 2.36]
  - - [1088, 64, 1, 512]
    - [301, 2.92]
  - - [1344, 64, 1, 512]
    - [394, 3.56]
  - - [1600, 64, 1, 512]
    - [207, 4.28]
  - - [1856, 64, 1, 512]
    - [207, 4.85]
  - - [2112, 64, 1, 512]
    - [297, 5.26]
  - - [2368, 64, 1, 512]
    - [303, 5.94]
  - - [2624, 64, 1, 512]
    - [207, 6.51]
  - - [2880, 64, 1, 512]
    - [300, 7.11]
  - - [3136, 64, 1, 512]
    - [207, 7.81]
  - - [3392, 64, 1, 512]
    - [207, 8.43]
  - - [3648, 64, 1, 512]
    - [300, 8.95]
  - - [3904, 64, 1, 512]
    - [330, 9.28]
  - - [64, 320, 1, 512]
    - [296, 0.93]
  - - [320, 320, 1, 512]
    - [303, 4.26]
  - - [576, 320, 1, 512]
    - [303, 7.16]
  - - [832, 320, 1, 512]
    - [303, 9.33]
  - - [1088, 320, 1, 512]
    - [207, 11.98]
  - - [1344, 320, 1, 512]
    - [174, 13.19]
  - - [1600, 320, 1, 512]
    - [303, 15.81]
  - - [1856, 320, 1, 512]
    - [300, 15.81]
  - - [2112, 320, 1, 512]
    - [243, 16.92]
  - - [2368, 320, 1, 512]
    - [215, 18.29]
  - - [2624, 320, 1, 512]
    - [226, 19.39]
  - - [2880, 320, 1, 512]
    - [243, 19.23]
  - - [3136, 320, 1, 512]
    - [322, 20.74]
  - - [3392, 320, 1, 512]
    - [389, 21.06]
  - - [3648, 320, 1, 512]
    - [243, 22.91]
  - - [3904, 320, 1, 512]
    - [226, 22.77]
  - - [64, 576, 1, 512]
    - [294, 1.63]
  - - [320, 576, 1, 512]
    - [207, 6.97]
  - - [576, 576, 1, 512]
    - [315, 10.62]
  - - [832, 576, 1, 512]
    - [243, 14.22]
  - - [1088, 576, 1, 512]
    - [176, 17.2]
  - - [1344, 576, 1, 512]
    - [176, 19.21]
  - - [1600, 576, 1, 512]
    - [176, 20.22]
  - - [1856, 576, 1, 512]
    - [338, 20.16]
  - - [2112, 576, 1, 512]
    - [243, 21.38]
  - - [2368, 576, 1, 512]
    - [322, 22.85]
  - - [2624, 576, 1, 512]
    - [243, 24.43]
  - - [2880, 576, 1, 512]
    - [243, 24.98]
  - - [3136, 576, 1, 512]
    - [215, 26.11]
  - - [3392, 576, 1, 512]
    - [338, 26.57]
  - - [3648, 576, 1, 512]
    - [215, 26.04]
  - - [3904, 576, 1, 512]
    - [215, 26.7]
  - - [64, 832, 1, 512]
    - [307, 2.27]
  - - [320, 832, 1, 512]
    - [297, 9.19]
  - - [576, 832, 1, 512]
    - [300, 14.37]
  - - [832, 832, 1, 512]
    - [176, 17.71]
  - - [1088, 832, 1, 512]
    - [176, 20.47]
  - - [1344, 832, 1, 512]
    - [243, 21.87]
  - - [1600, 832, 1, 512]
    - [322, 22.43]
  - - [1856, 832, 1, 512]
    - [243, 24.7]
  - - [2112, 832, 1, 512]
    - [215, 25.27]
  - - [2368, 832, 1, 512]
    - [243, 25.93]
  - - [2624, 832, 1, 512]
    - [243, 27.45]
  - - [2880, 832, 1, 512]
    - [243, 27.56]
  - - [3136, 832, 1, 512]
    - [243, 28.45]
  - - [3392, 832, 1, 512]
    - [243, 28.49]
  - - [3648, 832, 1, 512]
    - [338, 28.7]
  - - [3904, 832, 1, 512]
    - [243, 30.15]
  - - [64, 1088, 1, 512]
    - [352, 2.79]
  - - [320, 1088, 1, 512]
    - [297, 11.83]
  - - [576, 1088, 1, 512]
    - [174, 17.41]
  - - [832, 1088, 1, 512]
    - [176, 20.64]
  - - [1088, 1088, 1, 512]
    - [226, 22.59]
  - - [1344, 1088, 1, 512]
    - [226, 24.76]
  - - [1600, 1088, 1, 512]
    - [243, 25.39]
  - - [1856, 1088, 1, 512]
    - [243, 26.63]
  - - [2112, 1088, 1, 512]
    - [243, 27.8]
  - - [2368, 1088, 1, 512]
    - [215, 27.16]
  - - [2624, 1088, 1, 512]
    - [215, 28.99]
  - - [2880, 1088, 1, 512]
    - [332, 29.47]
  - - [3136, 1088, 1, 512]
    - [332, 30.27]
  - - [3392, 1088, 1, 512]
    - [332, 31.21]
  - - [3648, 1088, 1, 512]
    - [215, 30.53]
  - - [3904, 1088, 1, 512]
    - [215, 30.67]
  - - [64, 1344, 1, 512]
    - [313, 3.48]
  - - [320, 1344, 1, 512]
    - [332, 13.44]
  - - [576, 1344, 1, 512]
    - [174, 18.8]
  - - [832, 1344, 1, 512]
    - [338, 21.42]
  - - [1088, 1344, 1, 512]
    - [226, 24.99]
  - - [1344, 1344, 1, 512]
    - [243, 25.94]
  - - [1600, 1344, 1, 512]
    - [332, 27.1]
  - - [1856, 1344, 1, 512]
    - [332, 28.21]
  - - [2112, 1344, 1, 512]
    - [243, 29.12]
  - - [2368, 1344, 1, 512]
    - [332, 29.24]
  - - [2624, 1344, 1, 512]
    - [338, 29.55]
  - - [2880, 1344, 1, 512]
    - [215, 30.83]
  - - [3136, 1344, 1, 512]
    - [226, 31.53]
  - - [3392, 1344, 1, 512]
    - [243, 31.88]
  - - [3648, 1344, 1, 512]
    - [332, 32.41]
  - - [3904, 1344, 1, 512]
    - [332, 33.19]
  - - [64, 1600, 1, 512]
    - [187, 4.13]
  - - [320, 1600, 1, 512]
    - [336, 14.94]
  - - [576, 1600, 1, 512]
    - [276, 20.0]
  - - [832, 1600, 1, 512]
    - [243, 22.95]
  - - [1088, 1600, 1, 512]
    - [226, 26.26]
  - - [1344, 1600, 1, 512]
    - [243, 26.95]
  - - [1600, 1600, 1, 512]
    - [243, 28.5]
  - - [1856, 1600, 1, 512]
    - [215, 28.66]
  - - [2112, 1600, 1, 512]
    - [243, 29.99]
  - - [2368, 1600, 1, 512]
    - [243, 30.69]
  - - [2624, 1600, 1, 512]
    - [226, 31.4]
  - - [2880, 1600, 1, 512]
    - [215, 30.61]
  - - [3136, 1600, 1, 512]
    - [230, 32.01]
  - - [3392, 1600, 1, 512]
    - [339, 32.89]
  - - [3648, 1600, 1, 512]
    - [339, 33.6]
  - - [3904, 1600, 1, 512]
    - [332, 33.32]
  - - [64, 1856, 1, 512]
    - [297, 4.85]
  - - [320, 1856, 1, 512]
    - [207, 16.25]
  - - [576, 1856, 1, 512]
    - [338, 20.86]
  - - [832, 1856, 1, 512]
    - [322, 24.19]
  - - [1088, 1856, 1, 512]
    - [226, 26.09]
  - - [1344, 1856, 1, 512]
    - [243, 27.85]
  - - [1600, 1856, 1, 512]
    - [265, 28.43]
  - - [1856, 1856, 1, 512]
    - [243, 29.77]
  - - [2112, 1856, 1, 512]
    - [243, 31.14]
  - - [2368, 1856, 1, 512]
    - [243, 30.71]
  - - [2624, 1856, 1, 512]
    - [339, 31.92]
  - - [2880, 1856, 1, 512]
    - [322, 31.52]
  - - [3136, 1856, 1, 512]
    - [243, 32.57]
  - - [3392, 1856, 1, 512]
    - [332, 33.22]
  - - [3648, 1856, 1, 512]
    - [322, 32.6]
  - - [3904, 1856, 1, 512]
    - [339, 35.17]
  - - [64, 2112, 1, 512]
    - [303, 5.25]
  - - [320, 2112, 1, 512]
    - [215, 16.49]
  - - [576, 2112, 1, 512]
    - [230, 22.21]
  - - [832, 2112, 1, 512]
    - [226, 25.57]
  - - [1088, 2112, 1, 512]
    - [215, 26.62]
  - - [1344, 2112, 1, 512]
    - [215, 28.11]
  - - [1600, 2112, 1, 512]
    - [243, 30.0]
  - - [1856, 2112, 1, 512]
    - [243, 30.72]
  - - [2112, 2112, 1, 512]
    - [243, 31.55]
  - - [2368, 2112, 1, 512]
    - [243, 31.33]
  - - [2624, 2112, 1, 512]
    - [243, 31.91]
  - - [2880, 2112, 1, 512]
    - [339, 31.88]
  - - [3136, 2112, 1, 512]
    - [339, 33.47]
  - - [3392, 2112, 1, 512]
    - [339, 34.58]
  - - [3648, 2112, 1, 512]
    - [339, 35.73]
  - - [3904, 2112, 1, 512]
    - [339, 35.79]
  - - [64, 2368, 1, 512]
    - [303, 5.87]
  - - [320, 2368, 1, 512]
    - [243, 18.29]
  - - [576, 2368, 1, 512]
    - [338, 22.88]
  - - [832, 2368, 1, 512]
    - [243, 25.92]
  - - [1088, 2368, 1, 512]
    - [215, 28.39]
  - - [1344, 2368, 1, 512]
    - [215, 29.01]
  - - [1600, 2368, 1, 512]
    - [243, 30.42]
  - - [1856, 2368, 1, 512]
    - [243, 30.91]
  - - [2112, 2368, 1, 512]
    - [243, 31.77]
  - - [2368, 2368, 1, 512]
    - [243, 32.57]
  - - [2624, 2368, 1, 512]
    - [215, 32.3]
  - - [2880, 2368, 1, 512]
    - [339, 33.4]
  - - [3136, 2368, 1, 512]
    - [341, 34.72]
  - - [3392, 2368, 1, 512]
    - [339, 35.59]
  - - [3648, 2368, 1, 512]
    - [339, 35.73]
  - - [3904, 2368, 1, 512]
    - [339, 36.5]
  - - [64, 2624, 1, 512]
    - [303, 6.44]
  - - [320, 2624, 1, 512]
    - [226, 18.88]
  - - [576, 2624, 1, 512]
    - [226, 26.11]
  - - [832, 2624, 1, 512]
    - [273, 27.96]
  - - [1088, 2624, 1, 512]
    - [273, 29.02]
  - - [1344, 2624, 1, 512]
    - [226, 31.64]
  - - [1600, 2624, 1, 512]
    - [332, 32.61]
  - - [1856, 2624, 1, 512]
    - [332, 33.09]
  - - [2112, 2624, 1, 512]
    - [332, 34.37]
  - - [2368, 2624, 1, 512]
    - [332, 33.65]
  - - [2624, 2624, 1, 512]
    - [332, 34.97]
  - - [2880, 2624, 1, 512]
    - [332, 35.22]
  - - [3136, 2624, 1, 512]
    - [332, 34.78]
  - - [3392, 2624, 1, 512]
    - [332, 35.19]
  - - [3648, 2624, 1, 512]
    - [332, 35.79]
  - - [3904, 2624, 1, 512]
    - [339, 37.65]
  - - [64, 2880, 1, 512]
    - [207, 6.93]
  - - [320, 2880, 1, 512]
    - [243, 19.5]
  - - [576, 2880, 1, 512]
    - [243, 25.19]
  - - [832, 2880, 1, 512]
    - [243, 27.86]
  - - [1088, 2880, 1, 512]
    - [215, 28.87]
  - - [1344, 2880, 1, 512]
    - [243, 30.81]
  - - [1600, 2880, 1, 512]
    - [243, 31.63]
  - - [1856, 2880, 1, 512]
    - [215, 31.57]
  - - [2112, 2880, 1, 512]
    - [243, 32.17]
  - - [2368, 2880, 1, 512]
    - [339, 34.4]
  - - [2624, 2880, 1, 512]
    - [339, 33.99]
  - - [2880, 2880, 1, 512]
    - [339, 35.83]
  - - [3136, 2880, 1, 512]
    - [339, 35.36]
  - - [3392, 2880, 1, 512]
    - [339, 36.74]
  - - [3648, 2880, 1, 512]
    - [339, 36.64]
  - - [3904, 2880, 1, 512]
    - [339, 37.86]
  - - [64, 3136, 1, 512]
    - [300, 7.58]
  - - [320, 3136, 1, 512]
    - [276, 21.58]
  - - [576, 3136, 1, 512]
    - [338, 25.96]
  - - [832, 3136, 1, 512]
    - [243, 28.85]
  - - [1088, 3136, 1, 512]
    - [243, 29.99]
  - - [1344, 3136, 1, 512]
    - [243, 30.75]
  - - [1600, 3136, 1, 512]
    - [332, 32.43]
  - - [1856, 3136, 1, 512]
    - [332, 32.62]
  - - [2112, 3136, 1, 512]
    - [332, 33.48]
  - - [2368, 3136, 1, 512]
    - [339, 35.24]
  - - [2624, 3136, 1, 512]
    - [339, 35.53]
  - - [2880, 3136, 1, 512]
    - [339, 35.25]
  - - [3136, 3136, 1, 512]
    - [339, 36.93]
  - - [3392, 3136, 1, 512]
    - [339, 38.03]
  - - [3648, 3136, 1, 512]
    - [339, 38.22]
  - - [3904, 3136, 1, 512]
    - [339, 38.52]
  - - [64, 3392, 1, 512]
    - [300, 8.25]
  - - [320, 3392, 1, 512]
    - [338, 21.34]
  - - [576, 3392, 1, 512]
    - [243, 26.21]
  - - [832, 3392, 1, 512]
    - [243, 28.73]
  - - [1088, 3392, 1, 512]
    - [338, 29.4]
  - - [1344, 3392, 1, 512]
    - [322, 30.93]
  - - [1600, 3392, 1, 512]
    - [243, 31.76]
  - - [1856, 3392, 1, 512]
    - [339, 32.81]
  - - [2112, 3392, 1, 512]
    - [339, 34.9]
  - - [2368, 3392, 1, 512]
    - [339, 35.43]
  - - [2624, 3392, 1, 512]
    - [341, 35.44]
  - - [2880, 3392, 1, 512]
    - [339, 37.08]
  - - [3136, 3392, 1, 512]
    - [339, 36.7]
  - - [3392, 3392, 1, 512]
    - [339, 38.17]
  - - [3648, 3392, 1, 512]
    - [339, 38.6]
  - - [3904, 3392, 1, 512]
    - [339, 39.47]
  - - [64, 3648, 1, 512]
    - [303, 8.98]
  - - [320, 3648, 1, 512]
    - [243, 22.96]
  - - [576, 3648, 1, 512]
    - [215, 26.22]
  - - [832, 3648, 1, 512]
    - [215, 28.0]
  - - [1088, 3648, 1, 512]
    - [215, 29.57]
  - - [1344, 3648, 1, 512]
    - [243, 31.4]
  - - [1600, 3648, 1, 512]
    - [243, 32.74]
  - - [1856, 3648, 1, 512]
    - [339, 33.2]
  - - [2112, 3648, 1, 512]
    - [339, 34.6]
  - - [2368, 3648, 1, 512]
    - [339, 35.42]
  - - [2624, 3648, 1, 512]
    - [339, 36.97]
  - - [2880, 3648, 1, 512]
    - [339, 37.52]
  - - [3136, 3648, 1, 512]
    - [339, 36.83]
  - - [3392, 3648, 1, 512]
    - [339, 38.5]
  - - [3648, 3648, 1, 512]
    - [339, 37.91]
  - - [3904, 3648, 1, 512]
    - [339, 38.67]
  - - [64, 3904, 1, 512]
    - [207, 9.6]
  - - [320, 3904, 1, 512]
    - [276, 23.88]
  - - [576, 3904, 1, 512]
    - [332, 28.48]
  - - [832, 3904, 1, 512]
    - [332, 31.13]
  - - [1088, 3904, 1, 512]
    - [332, 31.91]
  - - [1344, 3904, 1, 512]
    - [332, 33.76]
  - - [1600, 3904, 1, 512]
    - [332, 34.0]
  - - [1856, 3904, 1, 512]
    - [332, 33.94]
  - - [2112, 3904, 1, 512]
    - [332, 36.29]
  - - [2368, 3904, 1, 512]
    - [230, 35.78]
  - - [2624, 3904, 1, 512]
    - [332, 37.28]
  - - [2880, 3904, 1, 512]
    - [339, 37.8]
  - - [3136, 3904, 1, 512]
    - [339, 38.19]
  - - [3392, 3904, 1, 512]
    - [339, 38.06]
  - - [3648, 3904, 1, 512]
    - [339, 38.58]
  - - [3904, 3904, 1, 512]
    - [339, 39.46]
  - - [320, 64, 1, 1024]
    - [282, 1.7]
  - - [576, 64, 1, 1024]
    - [280, 2.94]
  - - [832, 64, 1, 1024]
    - [288, 4.17]
  - - [1088, 64, 1, 1024]
    - [349, 4.92]
  - - [1344, 64, 1, 1024]
    - [207, 6.09]
  - - [1600, 64, 1, 1024]
    - [300, 6.91]
  - - [1856, 64, 1, 1024]
    - [207, 8.23]
  - - [2112, 64, 1, 1024]
    - [396, 8.42]
  - - [2368, 64, 1, 1024]
    - [303, 9.65]
  - - [2624, 64, 1, 1024]
    - [303, 10.61]
  - - [2880, 64, 1, 1024]
    - [300, 11.77]
  - - [3136, 64, 1, 1024]
    - [297, 12.62]
  - - [3392, 64, 1, 1024]
    - [320, 13.32]
  - - [3648, 64, 1, 1024]
    - [207, 14.75]
  - - [3904, 64, 1, 1024]
    - [353, 14.99]
  - - [64, 320, 1, 1024]
    - [280, 1.69]
  - - [320, 320, 1, 1024]
    - [186, 7.04]
  - - [576, 320, 1, 1024]
    - [315, 11.53]
  - - [832, 320, 1, 1024]
    - [207, 14.47]
  - - [1088, 320, 1, 1024]
    - [300, 18.13]
  - - [1344, 320, 1, 1024]
    - [230, 20.48]
  - - [1600, 320, 1, 1024]
    - [297, 23.07]
  - - [1856, 320, 1, 1024]
    - [207, 23.21]
  - - [2112, 320, 1, 1024]
    - [243, 23.41]
  - - [2368, 320, 1, 1024]
    - [215, 26.05]
  - - [2624, 320, 1, 1024]
    - [276, 26.39]
  - - [2880, 320, 1, 1024]
    - [207, 26.55]
  - - [3136, 320, 1, 1024]
    - [243, 28.67]
  - - [3392, 320, 1, 1024]
    - [230, 27.77]
  - - [3648, 320, 1, 1024]
    - [303, 29.81]
  - - [3904, 320, 1, 1024]
    - [338, 29.59]
  - - [64, 576, 1, 1024]
    - [282, 2.92]
  - - [320, 576, 1, 1024]
    - [297, 11.72]
  - - [576, 576, 1, 1024]
    - [303, 17.58]
  - - [832, 576, 1, 1024]
    - [303, 21.87]
  - - [1088, 576, 1, 1024]
    - [176, 25.1]
  - - [1344, 576, 1, 1024]
    - [176, 27.48]
  - - [1600, 576, 1, 1024]
    - [176, 27.09]
  - - [1856, 576, 1, 1024]
    - [243, 28.17]
  - - [2112, 576, 1, 1024]
    - [243, 28.88]
  - - [2368, 576, 1, 1024]
    - [303, 29.91]
  - - [2624, 576, 1, 1024]
    - [303, 31.55]
  - - [2880, 576, 1, 1024]
    - [243, 32.81]
  - - [3136, 576, 1, 1024]
    - [303, 32.95]
  - - [3392, 576, 1, 1024]
    - [303, 33.46]
  - - [3648, 576, 1, 1024]
    - [243, 33.68]
  - - [3904, 576, 1, 1024]
    - [243, 34.39]
  - - [64, 832, 1, 1024]
    - [282, 4.11]
  - - [320, 832, 1, 1024]
    - [186, 14.42]
  - - [576, 832, 1, 1024]
    - [297, 21.45]
  - - [832, 832, 1, 1024]
    - [176, 24.97]
  - - [1088, 832, 1, 1024]
    - [303, 28.45]
  - - [1344, 832, 1, 1024]
    - [207, 29.25]
  - - [1600, 832, 1, 1024]
    - [322, 29.72]
  - - [1856, 832, 1, 1024]
    - [207, 32.41]
  - - [2112, 832, 1, 1024]
    - [207, 31.94]
  - - [2368, 832, 1, 1024]
    - [243, 33.29]
  - - [2624, 832, 1, 1024]
    - [243, 34.62]
  - - [2880, 832, 1, 1024]
    - [243, 33.41]
  - - [3136, 832, 1, 1024]
    - [303, 34.6]
  - - [3392, 832, 1, 1024]
    - [243, 34.97]
  - - [3648, 832, 1, 1024]
    - [303, 34.87]
  - - [3904, 832, 1, 1024]
    - [303, 35.47]
  - - [64, 1088, 1, 1024]
    - [313, 4.95]
  - - [320, 1088, 1, 1024]
    - [186, 18.43]
  - - [576, 1088, 1, 1024]
    - [174, 25.02]
  - - [832, 1088, 1, 1024]
    - [176, 28.88]
  - - [1088, 1088, 1, 1024]
    - [273, 30.21]
  - - [1344, 1088, 1, 1024]
    - [243, 30.33]
  - - [1600, 1088, 1, 1024]
    - [322, 32.33]
  - - [1856, 1088, 1, 1024]
    - [243, 33.8]
  - - [2112, 1088, 1, 1024]
    - [243, 34.22]
  - - [2368, 1088, 1, 1024]
    - [215, 34.66]
  - - [2624, 1088, 1, 1024]
    - [215, 35.14]
  - - [2880, 1088, 1, 1024]
    - [322, 36.37]
  - - [3136, 1088, 1, 1024]
    - [243, 35.39]
  - - [3392, 1088, 1, 1024]
    - [215, 36.23]
  - - [3648, 1088, 1, 1024]
    - [243, 37.17]
  - - [3904, 1088, 1, 1024]
    - [322, 36.57]
  - - [64, 1344, 1, 1024]
    - [313, 5.91]
  - - [320, 1344, 1, 1024]
    - [300, 19.03]
  - - [576, 1344, 1, 1024]
    - [174, 26.59]
  - - [832, 1344, 1, 1024]
    - [243, 29.47]
  - - [1088, 1344, 1, 1024]
    - [226, 31.49]
  - - [1344, 1344, 1, 1024]
    - [207, 33.48]
  - - [1600, 1344, 1, 1024]
    - [243, 33.93]
  - - [1856, 1344, 1, 1024]
    - [332, 35.09]
  - - [2112, 1344, 1, 1024]
    - [322, 35.49]
  - - [2368, 1344, 1, 1024]
    - [332, 36.53]
  - - [2624, 1344, 1, 1024]
    - [243, 36.81]
  - - [2880, 1344, 1, 1024]
    - [243, 37.67]
  - - [3136, 1344, 1, 1024]
    - [332, 37.38]
  - - [3392, 1344, 1, 1024]
    - [243, 37.49]
  - - [3648, 1344, 1, 1024]
    - [339, 38.99]
  - - [3904, 1344, 1, 1024]
    - [215, 37.63]
  - - [64, 1600, 1, 1024]
    - [207, 7.08]
  - - [320, 1600, 1, 1024]
    - [297, 23.11]
  - - [576, 1600, 1, 1024]
    - [276, 26.68]
  - - [832, 1600, 1, 1024]
    - [243, 29.96]
  - - [1088, 1600, 1, 1024]
    - [215, 31.08]
  - - [1344, 1600, 1, 1024]
    - [243, 34.47]
  - - [1600, 1600, 1, 1024]
    - [243, 34.67]
  - - [1856, 1600, 1, 1024]
    - [215, 35.93]
  - - [2112, 1600, 1, 1024]
    - [322, 36.59]
  - - [2368, 1600, 1, 1024]
    - [243, 36.63]
  - - [2624, 1600, 1, 1024]
    - [243, 37.57]
  - - [2880, 1600, 1, 1024]
    - [265, 37.42]
  - - [3136, 1600, 1, 1024]
    - [215, 36.92]
  - - [3392, 1600, 1, 1024]
    - [339, 39.58]
  - - [3648, 1600, 1, 1024]
    - [339, 40.0]
  - - [3904, 1600, 1, 1024]
    - [368, 38.94]
  - - [64, 1856, 1, 1024]
    - [298, 8.1]
  - - [320, 1856, 1, 1024]
    - [174, 23.13]
  - - [576, 1856, 1, 1024]
    - [303, 27.81]
  - - [832, 1856, 1, 1024]
    - [207, 31.6]
  - - [1088, 1856, 1, 1024]
    - [243, 33.4]
  - - [1344, 1856, 1, 1024]
    - [243, 33.84]
  - - [1600, 1856, 1, 1024]
    - [215, 35.59]
  - - [1856, 1856, 1, 1024]
    - [243, 36.54]
  - - [2112, 1856, 1, 1024]
    - [215, 37.01]
  - - [2368, 1856, 1, 1024]
    - [215, 37.85]
  - - [2624, 1856, 1, 1024]
    - [322, 36.78]
  - - [2880, 1856, 1, 1024]
    - [243, 38.03]
  - - [3136, 1856, 1, 1024]
    - [303, 38.08]
  - - [3392, 1856, 1, 1024]
    - [322, 38.64]
  - - [3648, 1856, 1, 1024]
    - [322, 38.51]
  - - [3904, 1856, 1, 1024]
    - [339, 40.99]
  - - [64, 2112, 1, 1024]
    - [303, 8.7]
  - - [320, 2112, 1, 1024]
    - [243, 23.46]
  - - [576, 2112, 1, 1024]
    - [243, 28.81]
  - - [832, 2112, 1, 1024]
    - [207, 32.37]
  - - [1088, 2112, 1, 1024]
    - [303, 34.67]
  - - [1344, 2112, 1, 1024]
    - [215, 35.56]
  - - [1600, 2112, 1, 1024]
    - [243, 36.62]
  - - [1856, 2112, 1, 1024]
    - [243, 36.39]
  - - [2112, 2112, 1, 1024]
    - [243, 36.88]
  - - [2368, 2112, 1, 1024]
    - [243, 37.35]
  - - [2624, 2112, 1, 1024]
    - [253, 37.89]
  - - [2880, 2112, 1, 1024]
    - [339, 39.37]
  - - [3136, 2112, 1, 1024]
    - [339, 40.25]
  - - [3392, 2112, 1, 1024]
    - [339, 40.81]
  - - [3648, 2112, 1, 1024]
    - [339, 41.38]
  - - [3904, 2112, 1, 1024]
    - [339, 42.05]
  - - [64, 2368, 1, 1024]
    - [320, 9.54]
  - - [320, 2368, 1, 1024]
    - [265, 24.96]
  - - [576, 2368, 1, 1024]
    - [303, 29.88]
  - - [832, 2368, 1, 1024]
    - [243, 33.15]
  - - [1088, 2368, 1, 1024]
    - [303, 34.39]
  - - [1344, 2368, 1, 1024]
    - [243, 35.3]
  - - [1600, 2368, 1, 1024]
    - [243, 37.62]
  - - [1856, 2368, 1, 1024]
    - [243, 37.56]
  - - [2112, 2368, 1, 1024]
    - [243, 38.28]
  - - [2368, 2368, 1, 1024]
    - [243, 37.13]
  - - [2624, 2368, 1, 1024]
    - [339, 39.5]
  - - [2880, 2368, 1, 1024]
    - [341, 39.83]
  - - [3136, 2368, 1, 1024]
    - [339, 40.79]
  - - [3392, 2368, 1, 1024]
    - [339, 41.38]
  - - [3648, 2368, 1, 1024]
    - [339, 41.58]
  - - [3904, 2368, 1, 1024]
    - [339, 42.31]
  - - [64, 2624, 1, 1024]
    - [303, 10.86]
  - - [320, 2624, 1, 1024]
    - [303, 25.97]
  - - [576, 2624, 1, 1024]
    - [226, 32.79]
  - - [832, 2624, 1, 1024]
    - [332, 35.06]
  - - [1088, 2624, 1, 1024]
    - [332, 36.18]
  - - [1344, 2624, 1, 1024]
    - [332, 38.5]
  - - [1600, 2624, 1, 1024]
    - [332, 38.07]
  - - [1856, 2624, 1, 1024]
    - [332, 38.37]
  - - [2112, 2624, 1, 1024]
    - [332, 40.73]
  - - [2368, 2624, 1, 1024]
    - [332, 40.35]
  - - [2624, 2624, 1, 1024]
    - [332, 41.7]
  - - [2880, 2624, 1, 1024]
    - [332, 41.65]
  - - [3136, 2624, 1, 1024]
    - [332, 41.28]
  - - [3392, 2624, 1, 1024]
    - [332, 42.74]
  - - [3648, 2624, 1, 1024]
    - [332, 42.29]
  - - [3904, 2624, 1, 1024]
    - [339, 43.03]
  - - [64, 2880, 1, 1024]
    - [187, 11.65]
  - - [320, 2880, 1, 1024]
    - [243, 26.44]
  - - [576, 2880, 1, 1024]
    - [243, 32.83]
  - - [832, 2880, 1, 1024]
    - [243, 34.38]
  - - [1088, 2880, 1, 1024]
    - [243, 35.87]
  - - [1344, 2880, 1, 1024]
    - [243, 36.75]
  - - [1600, 2880, 1, 1024]
    - [243, 37.09]
  - - [1856, 2880, 1, 1024]
    - [339, 39.03]
  - - [2112, 2880, 1, 1024]
    - [243, 38.11]
  - - [2368, 2880, 1, 1024]
    - [339, 41.14]
  - - [2624, 2880, 1, 1024]
    - [322, 39.33]
  - - [2880, 2880, 1, 1024]
    - [339, 41.52]
  - - [3136, 2880, 1, 1024]
    - [339, 41.5]
  - - [3392, 2880, 1, 1024]
    - [339, 42.68]
  - - [3648, 2880, 1, 1024]
    - [339, 42.43]
  - - [3904, 2880, 1, 1024]
    - [339, 44.04]
  - - [64, 3136, 1, 1024]
    - [297, 12.81]
  - - [320, 3136, 1, 1024]
    - [207, 27.97]
  - - [576, 3136, 1, 1024]
    - [243, 32.55]
  - - [832, 3136, 1, 1024]
    - [322, 35.17]
  - - [1088, 3136, 1, 1024]
    - [215, 36.15]
  - - [1344, 3136, 1, 1024]
    - [243, 37.06]
  - - [1600, 3136, 1, 1024]
    - [243, 38.46]
  - - [1856, 3136, 1, 1024]
    - [339, 40.18]
  - - [2112, 3136, 1, 1024]
    - [339, 40.76]
  - - [2368, 3136, 1, 1024]
    - [339, 40.96]
  - - [2624, 3136, 1, 1024]
    - [339, 42.08]
  - - [2880, 3136, 1, 1024]
    - [339, 41.67]
  - - [3136, 3136, 1, 1024]
    - [339, 43.06]
  - - [3392, 3136, 1, 1024]
    - [339, 43.42]
  - - [3648, 3136, 1, 1024]
    - [339, 44.55]
  - - [3904, 3136, 1, 1024]
    - [339, 44.42]
  - - [64, 3392, 1, 1024]
    - [297, 13.75]
  - - [320, 3392, 1, 1024]
    - [243, 28.67]
  - - [576, 3392, 1, 1024]
    - [243, 33.64]
  - - [832, 3392, 1, 1024]
    - [243, 35.83]
  - - [1088, 3392, 1, 1024]
    - [215, 35.62]
  - - [1344, 3392, 1, 1024]
    - [243, 38.1]
  - - [1600, 3392, 1, 1024]
    - [339, 38.8]
  - - [1856, 3392, 1, 1024]
    - [339, 40.77]
  - - [2112, 3392, 1, 1024]
    - [339, 41.18]
  - - [2368, 3392, 1, 1024]
    - [339, 41.78]
  - - [2624, 3392, 1, 1024]
    - [339, 42.93]
  - - [2880, 3392, 1, 1024]
    - [339, 42.72]
  - - [3136, 3392, 1, 1024]
    - [339, 42.29]
  - - [3392, 3392, 1, 1024]
    - [339, 42.63]
  - - [3648, 3392, 1, 1024]
    - [339, 44.0]
  - - [3904, 3392, 1, 1024]
    - [341, 43.77]
  - - [64, 3648, 1, 1024]
    - [303, 14.46]
  - - [320, 3648, 1, 1024]
    - [243, 30.01]
  - - [576, 3648, 1, 1024]
    - [215, 32.81]
  - - [832, 3648, 1, 1024]
    - [243, 36.02]
  - - [1088, 3648, 1, 1024]
    - [215, 36.99]
  - - [1344, 3648, 1, 1024]
    - [243, 38.14]
  - - [1600, 3648, 1, 1024]
    - [243, 38.07]
  - - [1856, 3648, 1, 1024]
    - [243, 39.25]
  - - [2112, 3648, 1, 1024]
    - [243, 39.23]
  - - [2368, 3648, 1, 1024]
    - [339, 40.94]
  - - [2624, 3648, 1, 1024]
    - [339, 42.06]
  - - [2880, 3648, 1, 1024]
    - [339, 43.02]
  - - [3136, 3648, 1, 1024]
    - [339, 44.02]
  - - [3392, 3648, 1, 1024]
    - [339, 44.92]
  - - [3648, 3648, 1, 1024]
    - [339, 43.77]
  - - [3904, 3648, 1, 1024]
    - [341, 43.54]
  - - [64, 3904, 1, 1024]
    - [207, 15.29]
  - - [320, 3904, 1, 1024]
    - [332, 31.12]
  - - [576, 3904, 1, 1024]
    - [276, 35.1]
  - - [832, 3904, 1, 1024]
    - [243, 36.78]
  - - [1088, 3904, 1, 1024]
    - [230, 37.61]
  - - [1344, 3904, 1, 1024]
    - [332, 39.52]
  - - [1600, 3904, 1, 1024]
    - [332, 39.99]
  - - [1856, 3904, 1, 1024]
    - [339, 40.71]
  - - [2112, 3904, 1, 1024]
    - [230, 41.59]
  - - [2368, 3904, 1, 1024]
    - [332, 42.36]
  - - [2624, 3904, 1, 1024]
    - [339, 43.31]
  - - [2880, 3904, 1, 1024]
    - [332, 43.18]
  - - [3136, 3904, 1, 1024]
    - [332, 42.31]
  - - [3392, 3904, 1, 1024]
    - [332, 42.75]
  - - [3648, 3904, 1, 1024]
    - [332, 42.76]
  - - [3904, 3904, 1, 1024]
    - [339, 44.47]
  - - [320, 64, 1, 2048]
    - [348, 2.79]
  - - [576, 64, 1, 2048]
    - [280, 4.75]
  - - [832, 64, 1, 2048]
    - [280, 6.58]
  - - [1088, 64, 1, 2048]
    - [301, 7.76]
  - - [1344, 64, 1, 2048]
    - [207, 9.29]
  - - [1600, 64, 1, 2048]
    - [315, 10.74]
  - - [1856, 64, 1, 2048]
    - [207, 12.1]
  - - [2112, 64, 1, 2048]
    - [207, 12.63]
  - - [2368, 64, 1, 2048]
    - [186, 14.01]
  - - [2624, 64, 1, 2048]
    - [353, 15.22]
  - - [2880, 64, 1, 2048]
    - [207, 16.94]
  - - [3136, 64, 1, 2048]
    - [186, 18.01]
  - - [3392, 64, 1, 2048]
    - [300, 19.75]
  - - [3648, 64, 1, 2048]
    - [315, 21.05]
  - - [3904, 64, 1, 2048]
    - [207, 22.92]
  - - [64, 320, 1, 2048]
    - [307, 2.83]
  - - [320, 320, 1, 2048]
    - [315, 11.16]
  - - [576, 320, 1, 2048]
    - [207, 17.44]
  - - [832, 320, 1, 2048]
    - [330, 19.84]
  - - [1088, 320, 1, 2048]
    - [207, 25.44]
  - - [1344, 320, 1, 2048]
    - [230, 27.94]
  - - [1600, 320, 1, 2048]
    - [207, 30.47]
  - - [1856, 320, 1, 2048]
    - [207, 30.4]
  - - [2112, 320, 1, 2048]
    - [243, 29.38]
  - - [2368, 320, 1, 2048]
    - [315, 32.19]
  - - [2624, 320, 1, 2048]
    - [315, 32.24]
  - - [2880, 320, 1, 2048]
    - [320, 32.23]
  - - [3136, 320, 1, 2048]
    - [315, 33.87]
  - - [3392, 320, 1, 2048]
    - [300, 34.28]
  - - [3648, 320, 1, 2048]
    - [207, 35.86]
  - - [3904, 320, 1, 2048]
    - [303, 34.98]
  - - [64, 576, 1, 2048]
    - [280, 4.72]
  - - [320, 576, 1, 2048]
    - [353, 17.17]
  - - [576, 576, 1, 2048]
    - [303, 24.48]
  - - [832, 576, 1, 2048]
    - [297, 28.96]
  - - [1088, 576, 1, 2048]
    - [174, 32.43]
  - - [1344, 576, 1, 2048]
    - [174, 34.37]
  - - [1600, 576, 1, 2048]
    - [176, 35.05]
  - - [1856, 576, 1, 2048]
    - [207, 34.13]
  - - [2112, 576, 1, 2048]
    - [303, 35.57]
  - - [2368, 576, 1, 2048]
    - [207, 35.99]
  - - [2624, 576, 1, 2048]
    - [303, 36.22]
  - - [2880, 576, 1, 2048]
    - [303, 38.5]
  - - [3136, 576, 1, 2048]
    - [243, 38.42]
  - - [3392, 576, 1, 2048]
    - [207, 38.92]
  - - [3648, 576, 1, 2048]
    - [207, 38.76]
  - - [3904, 576, 1, 2048]
    - [370, 39.61]
  - - [64, 832, 1, 2048]
    - [296, 6.47]
  - - [320, 832, 1, 2048]
    - [297, 19.97]
  - - [576, 832, 1, 2048]
    - [303, 28.99]
  - - [832, 832, 1, 2048]
    - [174, 31.34]
  - - [1088, 832, 1, 2048]
    - [207, 35.38]
  - - [1344, 832, 1, 2048]
    - [297, 34.76]
  - - [1600, 832, 1, 2048]
    - [207, 36.02]
  - - [1856, 832, 1, 2048]
    - [207, 38.01]
  - - [2112, 832, 1, 2048]
    - [297, 37.68]
  - - [2368, 832, 1, 2048]
    - [207, 37.39]
  - - [2624, 832, 1, 2048]
    - [303, 39.27]
  - - [2880, 832, 1, 2048]
    - [207, 38.78]
  - - [3136, 832, 1, 2048]
    - [297, 39.58]
  - - [3392, 832, 1, 2048]
    - [303, 40.35]
  - - [3648, 832, 1, 2048]
    - [207, 40.02]
  - - [3904, 832, 1, 2048]
    - [303, 41.16]
  - - [64, 1088, 1, 2048]
    - [290, 7.83]
  - - [320, 1088, 1, 2048]
    - [318, 25.46]
  - - [576, 1088, 1, 2048]
    - [174, 32.38]
  - - [832, 1088, 1, 2048]
    - [176, 34.73]
  - - [1088, 1088, 1, 2048]
    - [332, 35.92]
  - - [1344, 1088, 1, 2048]
    - [303, 35.71]
  - - [1600, 1088, 1, 2048]
    - [207, 37.12]
  - - [1856, 1088, 1, 2048]
    - [243, 38.82]
  - - [2112, 1088, 1, 2048]
    - [303, 39.73]
  - - [2368, 1088, 1, 2048]
    - [303, 39.94]
  - - [2624, 1088, 1, 2048]
    - [243, 39.01]
  - - [2880, 1088, 1, 2048]
    - [303, 40.47]
  - - [3136, 1088, 1, 2048]
    - [395, 39.59]
  - - [3392, 1088, 1, 2048]
    - [322, 40.66]
  - - [3648, 1088, 1, 2048]
    - [303, 40.9]
  - - [3904, 1088, 1, 2048]
    - [303, 42.19]
  - - [64, 1344, 1, 2048]
    - [290, 9.57]
  - - [320, 1344, 1, 2048]
    - [174, 26.23]
  - - [576, 1344, 1, 2048]
    - [207, 33.61]
  - - [832, 1344, 1, 2048]
    - [207, 35.88]
  - - [1088, 1344, 1, 2048]
    - [303, 36.54]
  - - [1344, 1344, 1, 2048]
    - [303, 38.67]
  - - [1600, 1344, 1, 2048]
    - [303, 39.56]
  - - [1856, 1344, 1, 2048]
    - [332, 39.16]
  - - [2112, 1344, 1, 2048]
    - [320, 40.56]
  - - [2368, 1344, 1, 2048]
    - [243, 40.3]
  - - [2624, 1344, 1, 2048]
    - [243, 41.89]
  - - [2880, 1344, 1, 2048]
    - [207, 41.88]
  - - [3136, 1344, 1, 2048]
    - [320, 40.81]
  - - [3392, 1344, 1, 2048]
    - [243, 42.96]
  - - [3648, 1344, 1, 2048]
    - [339, 43.46]
  - - [3904, 1344, 1, 2048]
    - [398, 41.82]
  - - [64, 1600, 1, 2048]
    - [207, 11.19]
  - - [320, 1600, 1, 2048]
    - [303, 31.19]
  - - [576, 1600, 1, 2048]
    - [176, 33.73]
  - - [832, 1600, 1, 2048]
    - [303, 35.27]
  - - [1088, 1600, 1, 2048]
    - [303, 37.98]
  - - [1344, 1600, 1, 2048]
    - [243, 39.13]
  - - [1600, 1600, 1, 2048]
    - [243, 39.14]
  - - [1856, 1600, 1, 2048]
    - [243, 40.25]
  - - [2112, 1600, 1, 2048]
    - [243, 40.94]
  - - [2368, 1600, 1, 2048]
    - [243, 41.59]
  - - [2624, 1600, 1, 2048]
    - [368, 42.0]
  - - [2880, 1600, 1, 2048]
    - [207, 42.27]
  - - [3136, 1600, 1, 2048]
    - [215, 41.64]
  - - [3392, 1600, 1, 2048]
    - [339, 44.27]
  - - [3648, 1600, 1, 2048]
    - [339, 44.31]
  - - [3904, 1600, 1, 2048]
    - [368, 44.04]
  - - [64, 1856, 1, 2048]
    - [303, 12.84]
  - - [320, 1856, 1, 2048]
    - [303, 30.95]
  - - [576, 1856, 1, 2048]
    - [297, 33.14]
  - - [832, 1856, 1, 2048]
    - [207, 37.04]
  - - [1088, 1856, 1, 2048]
    - [303, 38.57]
  - - [1344, 1856, 1, 2048]
    - [207, 39.38]
  - - [1600, 1856, 1, 2048]
    - [243, 39.7]
  - - [1856, 1856, 1, 2048]
    - [322, 39.38]
  - - [2112, 1856, 1, 2048]
    - [322, 41.45]
  - - [2368, 1856, 1, 2048]
    - [207, 41.46]
  - - [2624, 1856, 1, 2048]
    - [303, 41.09]
  - - [2880, 1856, 1, 2048]
    - [322, 42.91]
  - - [3136, 1856, 1, 2048]
    - [303, 41.96]
  - - [3392, 1856, 1, 2048]
    - [339, 44.89]
  - - [3648, 1856, 1, 2048]
    - [339, 45.14]
  - - [3904, 1856, 1, 2048]
    - [339, 44.6]
  - - [64, 2112, 1, 2048]
    - [303, 13.03]
  - - [320, 2112, 1, 2048]
    - [176, 30.4]
  - - [576, 2112, 1, 2048]
    - [303, 34.83]
  - - [832, 2112, 1, 2048]
    - [207, 37.75]
  - - [1088, 2112, 1, 2048]
    - [303, 38.08]
  - - [1344, 2112, 1, 2048]
    - [243, 40.24]
  - - [1600, 2112, 1, 2048]
    - [303, 41.83]
  - - [1856, 2112, 1, 2048]
    - [243, 42.41]
  - - [2112, 2112, 1, 2048]
    - [207, 41.34]
  - - [2368, 2112, 1, 2048]
    - [303, 42.08]
  - - [2624, 2112, 1, 2048]
    - [368, 43.73]
  - - [2880, 2112, 1, 2048]
    - [339, 44.28]
  - - [3136, 2112, 1, 2048]
    - [322, 42.94]
  - - [3392, 2112, 1, 2048]
    - [339, 43.27]
  - - [3648, 2112, 1, 2048]
    - [339, 45.36]
  - - [3904, 2112, 1, 2048]
    - [339, 46.31]
  - - [64, 2368, 1, 2048]
    - [207, 14.07]
  - - [320, 2368, 1, 2048]
    - [315, 31.35]
  - - [576, 2368, 1, 2048]
    - [303, 36.8]
  - - [832, 2368, 1, 2048]
    - [303, 38.36]
  - - [1088, 2368, 1, 2048]
    - [303, 39.78]
  - - [1344, 2368, 1, 2048]
    - [243, 40.36]
  - - [1600, 2368, 1, 2048]
    - [320, 41.21]
  - - [1856, 2368, 1, 2048]
    - [353, 41.71]
  - - [2112, 2368, 1, 2048]
    - [243, 41.92]
  - - [2368, 2368, 1, 2048]
    - [243, 42.79]
  - - [2624, 2368, 1, 2048]
    - [303, 43.05]
  - - [2880, 2368, 1, 2048]
    - [378, 43.71]
  - - [3136, 2368, 1, 2048]
    - [339, 44.59]
  - - [3392, 2368, 1, 2048]
    - [339, 44.24]
  - - [3648, 2368, 1, 2048]
    - [339, 45.49]
  - - [3904, 2368, 1, 2048]
    - [339, 46.7]
  - - [64, 2624, 1, 2048]
    - [186, 15.76]
  - - [320, 2624, 1, 2048]
    - [207, 32.63]
  - - [576, 2624, 1, 2048]
    - [226, 38.35]
  - - [832, 2624, 1, 2048]
    - [332, 40.22]
  - - [1088, 2624, 1, 2048]
    - [243, 40.59]
  - - [1344, 2624, 1, 2048]
    - [332, 43.71]
  - - [1600, 2624, 1, 2048]
    - [332, 43.27]
  - - [1856, 2624, 1, 2048]
    - [332, 42.81]
  - - [2112, 2624, 1, 2048]
    - [332, 44.18]
  - - [2368, 2624, 1, 2048]
    - [332, 45.38]
  - - [2624, 2624, 1, 2048]
    - [230, 45.84]
  - - [2880, 2624, 1, 2048]
    - [332, 45.73]
  - - [3136, 2624, 1, 2048]
    - [230, 45.79]
  - - [3392, 2624, 1, 2048]
    - [332, 47.0]
  - - [3648, 2624, 1, 2048]
    - [332, 46.26]
  - - [3904, 2624, 1, 2048]
    - [339, 47.39]
  - - [64, 2880, 1, 2048]
    - [207, 17.03]
  - - [320, 2880, 1, 2048]
    - [207, 33.05]
  - - [576, 2880, 1, 2048]
    - [303, 38.01]
  - - [832, 2880, 1, 2048]
    - [303, 38.59]
  - - [1088, 2880, 1, 2048]
    - [243, 40.99]
  - - [1344, 2880, 1, 2048]
    - [243, 42.32]
  - - [1600, 2880, 1, 2048]
    - [303, 41.93]
  - - [1856, 2880, 1, 2048]
    - [207, 42.82]
  - - [2112, 2880, 1, 2048]
    - [207, 42.56]
  - - [2368, 2880, 1, 2048]
    - [339, 45.23]
  - - [2624, 2880, 1, 2048]
    - [339, 43.92]
  - - [2880, 2880, 1, 2048]
    - [339, 46.03]
  - - [3136, 2880, 1, 2048]
    - [339, 45.46]
  - - [3392, 2880, 1, 2048]
    - [339, 47.24]
  - - [3648, 2880, 1, 2048]
    - [339, 48.79]
  - - [3904, 2880, 1, 2048]
    - [339, 47.63]
  - - [64, 3136, 1, 2048]
    - [297, 18.68]
  - - [320, 3136, 1, 2048]
    - [207, 34.78]
  - - [576, 3136, 1, 2048]
    - [207, 38.02]
  - - [832, 3136, 1, 2048]
    - [297, 40.82]
  - - [1088, 3136, 1, 2048]
    - [243, 40.06]
  - - [1344, 3136, 1, 2048]
    - [243, 41.49]
  - - [1600, 3136, 1, 2048]
    - [243, 41.69]
  - - [1856, 3136, 1, 2048]
    - [339, 44.49]
  - - [2112, 3136, 1, 2048]
    - [243, 43.76]
  - - [2368, 3136, 1, 2048]
    - [378, 44.18]
  - - [2624, 3136, 1, 2048]
    - [339, 47.07]
  - - [2880, 3136, 1, 2048]
    - [339, 48.18]
  - - [3136, 3136, 1, 2048]
    - [339, 47.95]
  - - [3392, 3136, 1, 2048]
    - [339, 47.04]
  - - [3648, 3136, 1, 2048]
    - [339, 47.87]
  - - [3904, 3136, 1, 2048]
    - [341, 48.36]
  - - [64, 3392, 1, 2048]
    - [303, 20.16]
  - - [320, 3392, 1, 2048]
    - [207, 34.68]
  - - [576, 3392, 1, 2048]
    - [303, 39.24]
  - - [832, 3392, 1, 2048]
    - [297, 39.97]
  - - [1088, 3392, 1, 2048]
    - [207, 40.8]
  - - [1344, 3392, 1, 2048]
    - [243, 42.68]
  - - [1600, 3392, 1, 2048]
    - [339, 44.46]
  - - [1856, 3392, 1, 2048]
    - [243, 43.48]
  - - [2112, 3392, 1, 2048]
    - [339, 44.34]
  - - [2368, 3392, 1, 2048]
    - [339, 44.45]
  - - [2624, 3392, 1, 2048]
    - [339, 47.04]
  - - [2880, 3392, 1, 2048]
    - [339, 45.98]
  - - [3136, 3392, 1, 2048]
    - [339, 45.85]
  - - [3392, 3392, 1, 2048]
    - [339, 48.16]
  - - [3648, 3392, 1, 2048]
    - [339, 48.27]
  - - [3904, 3392, 1, 2048]
    - [339, 48.4]
  - - [64, 3648, 1, 2048]
    - [303, 21.66]
  - - [320, 3648, 1, 2048]
    - [207, 36.99]
  - - [576, 3648, 1, 2048]
    - [303, 38.68]
  - - [832, 3648, 1, 2048]
    - [243, 39.98]
  - - [1088, 3648, 1, 2048]
    - [243, 40.69]
  - - [1344, 3648, 1, 2048]
    - [339, 43.03]
  - - [1600, 3648, 1, 2048]
    - [215, 43.2]
  - - [1856, 3648, 1, 2048]
    - [303, 43.67]
  - - [2112, 3648, 1, 2048]
    - [339, 45.84]
  - - [2368, 3648, 1, 2048]
    - [339, 46.17]
  - - [2624, 3648, 1, 2048]
    - [368, 45.41]
  - - [2880, 3648, 1, 2048]
    - [339, 47.74]
  - - [3136, 3648, 1, 2048]
    - [339, 48.35]
  - - [3392, 3648, 1, 2048]
    - [339, 48.35]
  - - [3648, 3648, 1, 2048]
    - [339, 49.15]
  - - [3904, 3648, 1, 2048]
    - [339, 48.72]
  - - [64, 3904, 1, 2048]
    - [330, 22.64]
  - - [320, 3904, 1, 2048]
    - [332, 37.19]
  - - [576, 3904, 1, 2048]
    - [332, 39.28]
  - - [832, 3904, 1, 2048]
    - [303, 41.3]
  - - [1088, 3904, 1, 2048]
    - [303, 41.75]
  - - [1344, 3904, 1, 2048]
    - [230, 42.2]
  - - [1600, 3904, 1, 2048]
    - [339, 43.9]
  - - [1856, 3904, 1, 2048]
    - [332, 44.56]
  - - [2112, 3904, 1, 2048]
    - [339, 46.2]
  - - [2368, 3904, 1, 2048]
    - [339, 46.21]
  - - [2624, 3904, 1, 2048]
    - [230, 46.98]
  - - [2880, 3904, 1, 2048]
    - [332, 47.39]
  - - [3136, 3904, 1, 2048]
    - [230, 46.86]
  - - [3392, 3904, 1, 2048]
    - [339, 48.9]
  - - [3648, 3904, 1, 2048]
    - [332, 46.85]
  - - [3904, 3904, 1, 2048]
    - [341, 48.9]
  - - [320, 64, 1, 4096]
    - [280, 4.24]
  - - [576, 64, 1, 4096]
    - [307, 6.86]
  - - [832, 64, 1, 4096]
    - [280, 9.53]
  - - [1088, 64, 1, 4096]
    - [294, 10.89]
  - - [1344, 64, 1, 4096]
    - [394, 13.04]
  - - [1600, 64, 1, 4096]
    - [207, 14.62]
  - - [1856, 64, 1, 4096]
    - [353, 16.38]
  - - [2112, 64, 1, 4096]
    - [207, 16.94]
  - - [2368, 64, 1, 4096]
    - [300, 18.75]
  - - [2624, 64, 1, 4096]
    - [315, 20.5]
  - - [2880, 64, 1, 4096]
    - [207, 22.88]
  - - [3136, 64, 1, 4096]
    - [207, 23.9]
  - - [3392, 64, 1, 4096]
    - [353, 25.78]
  - - [3648, 64, 1, 4096]
    - [207, 28.45]
  - - [3904, 64, 1, 4096]
    - [207, 29.97]
  - - [64, 320, 1, 4096]
    - [307, 4.25]
  - - [320, 320, 1, 4096]
    - [207, 15.39]
  - - [576, 320, 1, 4096]
    - [207, 22.42]
  - - [832, 320, 1, 4096]
    - [207, 23.98]
  - - [1088, 320, 1, 4096]
    - [207, 31.66]
  - - [1344, 320, 1, 4096]
    - [230, 33.8]
  - - [1600, 320, 1, 4096]
    - [353, 36.24]
  - - [1856, 320, 1, 4096]
    - [207, 35.29]
  - - [2112, 320, 1, 4096]
    - [375, 33.42]
  - - [2368, 320, 1, 4096]
    - [243, 36.49]
  - - [2624, 320, 1, 4096]
    - [300, 36.91]
  - - [2880, 320, 1, 4096]
    - [303, 37.36]
  - - [3136, 320, 1, 4096]
    - [207, 39.43]
  - - [3392, 320, 1, 4096]
    - [207, 38.82]
  - - [3648, 320, 1, 4096]
    - [353, 40.54]
  - - [3904, 320, 1, 4096]
    - [373, 39.59]
  - - [64, 576, 1, 4096]
    - [280, 6.85]
  - - [320, 576, 1, 4096]
    - [315, 22.15]
  - - [576, 576, 1, 4096]
    - [207, 30.57]
  - - [832, 576, 1, 4096]
    - [207, 34.36]
  - - [1088, 576, 1, 4096]
    - [174, 37.09]
  - - [1344, 576, 1, 4096]
    - [176, 38.13]
  - - [1600, 576, 1, 4096]
    - [176, 39.96]
  - - [1856, 576, 1, 4096]
    - [207, 38.14]
  - - [2112, 576, 1, 4096]
    - [297, 38.39]
  - - [2368, 576, 1, 4096]
    - [353, 39.46]
  - - [2624, 576, 1, 4096]
    - [353, 40.78]
  - - [2880, 576, 1, 4096]
    - [353, 40.86]
  - - [3136, 576, 1, 4096]
    - [186, 41.75]
  - - [3392, 576, 1, 4096]
    - [303, 42.54]
  - - [3648, 576, 1, 4096]
    - [243, 41.59]
  - - [3904, 576, 1, 4096]
    - [253, 43.33]
  - - [64, 832, 1, 4096]
    - [374, 8.2]
  - - [320, 832, 1, 4096]
    - [303, 25.13]
  - - [576, 832, 1, 4096]
    - [303, 33.3]
  - - [832, 832, 1, 4096]
    - [174, 36.64]
  - - [1088, 832, 1, 4096]
    - [207, 39.96]
  - - [1344, 832, 1, 4096]
    - [353, 39.42]
  - - [1600, 832, 1, 4096]
    - [207, 39.36]
  - - [1856, 832, 1, 4096]
    - [297, 41.16]
  - - [2112, 832, 1, 4096]
    - [353, 41.24]
  - - [2368, 832, 1, 4096]
    - [303, 40.4]
  - - [2624, 832, 1, 4096]
    - [303, 43.4]
  - - [2880, 832, 1, 4096]
    - [353, 42.53]
  - - [3136, 832, 1, 4096]
    - [303, 44.52]
  - - [3392, 832, 1, 4096]
    - [303, 43.49]
  - - [3648, 832, 1, 4096]
    - [303, 43.57]
  - - [3904, 832, 1, 4096]
    - [207, 44.53]
  - - [64, 1088, 1, 4096]
    - [303, 10.31]
  - - [320, 1088, 1, 4096]
    - [303, 31.23]
  - - [576, 1088, 1, 4096]
    - [207, 37.59]
  - - [832, 1088, 1, 4096]
    - [176, 40.81]
  - - [1088, 1088, 1, 4096]
    - [332, 38.5]
  - - [1344, 1088, 1, 4096]
    - [353, 40.21]
  - - [1600, 1088, 1, 4096]
    - [207, 39.78]
  - - [1856, 1088, 1, 4096]
    - [207, 42.03]
  - - [2112, 1088, 1, 4096]
    - [303, 42.65]
  - - [2368, 1088, 1, 4096]
    - [320, 43.56]
  - - [2624, 1088, 1, 4096]
    - [303, 43.0]
  - - [2880, 1088, 1, 4096]
    - [207, 44.58]
  - - [3136, 1088, 1, 4096]
    - [303, 44.29]
  - - [3392, 1088, 1, 4096]
    - [320, 43.49]
  - - [3648, 1088, 1, 4096]
    - [297, 44.66]
  - - [3904, 1088, 1, 4096]
    - [368, 44.41]
  - - [64, 1344, 1, 4096]
    - [315, 12.69]
  - - [320, 1344, 1, 4096]
    - [397, 31.67]
  - - [576, 1344, 1, 4096]
    - [207, 37.49]
  - - [832, 1344, 1, 4096]
    - [207, 39.26]
  - - [1088, 1344, 1, 4096]
    - [303, 39.85]
  - - [1344, 1344, 1, 4096]
    - [320, 42.82]
  - - [1600, 1344, 1, 4096]
    - [207, 43.29]
  - - [1856, 1344, 1, 4096]
    - [332, 42.48]
  - - [2112, 1344, 1, 4096]
    - [353, 43.97]
  - - [2368, 1344, 1, 4096]
    - [207, 44.68]
  - - [2624, 1344, 1, 4096]
    - [368, 44.18]
  - - [2880, 1344, 1, 4096]
    - [339, 45.76]
  - - [3136, 1344, 1, 4096]
    - [320, 45.07]
  - - [3392, 1344, 1, 4096]
    - [303, 46.73]
  - - [3648, 1344, 1, 4096]
    - [339, 45.9]
  - - [3904, 1344, 1, 4096]
    - [253, 45.46]
  - - [64, 1600, 1, 4096]
    - [315, 14.99]
  - - [320, 1600, 1, 4096]
    - [207, 35.35]
  - - [576, 1600, 1, 4096]
    - [176, 37.09]
  - - [832, 1600, 1, 4096]
    - [207, 39.6]
  - - [1088, 1600, 1, 4096]
    - [186, 41.14]
  - - [1344, 1600, 1, 4096]
    - [207, 42.14]
  - - [1600, 1600, 1, 4096]
    - [353, 43.02]
  - - [1856, 1600, 1, 4096]
    - [207, 43.44]
  - - [2112, 1600, 1, 4096]
    - [207, 43.11]
  - - [2368, 1600, 1, 4096]
    - [297, 44.69]
  - - [2624, 1600, 1, 4096]
    - [253, 44.47]
  - - [2880, 1600, 1, 4096]
    - [336, 43.99]
  - - [3136, 1600, 1, 4096]
    - [332, 43.12]
  - - [3392, 1600, 1, 4096]
    - [341, 47.38]
  - - [3648, 1600, 1, 4096]
    - [339, 47.66]
  - - [3904, 1600, 1, 4096]
    - [368, 46.88]
  - - [64, 1856, 1, 4096]
    - [315, 17.49]
  - - [320, 1856, 1, 4096]
    - [207, 35.32]
  - - [576, 1856, 1, 4096]
    - [303, 38.03]
  - - [832, 1856, 1, 4096]
    - [297, 41.54]
  - - [1088, 1856, 1, 4096]
    - [207, 42.08]
  - - [1344, 1856, 1, 4096]
    - [303, 42.68]
  - - [1600, 1856, 1, 4096]
    - [207, 44.69]
  - - [1856, 1856, 1, 4096]
    - [303, 45.18]
  - - [2112, 1856, 1, 4096]
    - [320, 45.22]
  - - [2368, 1856, 1, 4096]
    - [207, 44.46]
  - - [2624, 1856, 1, 4096]
    - [339, 47.45]
  - - [2880, 1856, 1, 4096]
    - [339, 47.81]
  - - [3136, 1856, 1, 4096]
    - [339, 47.18]
  - - [3392, 1856, 1, 4096]
    - [339, 47.37]
  - - [3648, 1856, 1, 4096]
    - [339, 48.15]
  - - [3904, 1856, 1, 4096]
    - [339, 48.65]
  - - [64, 2112, 1, 4096]
    - [207, 16.61]
  - - [320, 2112, 1, 4096]
    - [176, 34.34]
  - - [576, 2112, 1, 4096]
    - [303, 39.15]
  - - [832, 2112, 1, 4096]
    - [186, 40.52]
  - - [1088, 2112, 1, 4096]
    - [207, 43.26]
  - - [1344, 2112, 1, 4096]
    - [207, 44.69]
  - - [1600, 2112, 1, 4096]
    - [207, 44.73]
  - - [1856, 2112, 1, 4096]
    - [339, 46.37]
  - - [2112, 2112, 1, 4096]
    - [330, 43.63]
  - - [2368, 2112, 1, 4096]
    - [339, 45.44]
  - - [2624, 2112, 1, 4096]
    - [368, 47.17]
  - - [2880, 2112, 1, 4096]
    - [339, 47.35]
  - - [3136, 2112, 1, 4096]
    - [339, 47.72]
  - - [3392, 2112, 1, 4096]
    - [339, 48.72]
  - - [3648, 2112, 1, 4096]
    - [339, 48.94]
  - - [3904, 2112, 1, 4096]
    - [339, 49.28]
  - - [64, 2368, 1, 4096]
    - [207, 18.59]
  - - [320, 2368, 1, 4096]
    - [315, 37.07]
  - - [576, 2368, 1, 4096]
    - [207, 39.96]
  - - [832, 2368, 1, 4096]
    - [303, 42.28]
  - - [1088, 2368, 1, 4096]
    - [353, 43.41]
  - - [1344, 2368, 1, 4096]
    - [207, 43.68]
  - - [1600, 2368, 1, 4096]
    - [320, 45.62]
  - - [1856, 2368, 1, 4096]
    - [339, 46.98]
  - - [2112, 2368, 1, 4096]
    - [303, 45.77]
  - - [2368, 2368, 1, 4096]
    - [339, 46.13]
  - - [2624, 2368, 1, 4096]
    - [368, 46.69]
  - - [2880, 2368, 1, 4096]
    - [339, 48.33]
  - - [3136, 2368, 1, 4096]
    - [339, 49.49]
  - - [3392, 2368, 1, 4096]
    - [339, 47.7]
  - - [3648, 2368, 1, 4096]
    - [339, 49.41]
  - - [3904, 2368, 1, 4096]
    - [339, 49.09]
  - - [64, 2624, 1, 4096]
    - [320, 20.58]
  - - [320, 2624, 1, 4096]
    - [207, 36.26]
  - - [576, 2624, 1, 4096]
    - [226, 41.87]
  - - [832, 2624, 1, 4096]
    - [273, 43.83]
  - - [1088, 2624, 1, 4096]
    - [303, 43.04]
  - - [1344, 2624, 1, 4096]
    - [332, 46.09]
  - - [1600, 2624, 1, 4096]
    - [332, 45.73]
  - - [1856, 2624, 1, 4096]
    - [339, 46.96]
  - - [2112, 2624, 1, 4096]
    - [332, 46.92]
  - - [2368, 2624, 1, 4096]
    - [332, 48.08]
  - - [2624, 2624, 1, 4096]
    - [332, 48.68]
  - - [2880, 2624, 1, 4096]
    - [332, 48.81]
  - - [3136, 2624, 1, 4096]
    - [273, 48.71]
  - - [3392, 2624, 1, 4096]
    - [339, 49.32]
  - - [3648, 2624, 1, 4096]
    - [332, 48.61]
  - - [3904, 2624, 1, 4096]
    - [339, 49.77]
  - - [64, 2880, 1, 4096]
    - [303, 22.84]
  - - [320, 2880, 1, 4096]
    - [207, 35.97]
  - - [576, 2880, 1, 4096]
    - [297, 42.11]
  - - [832, 2880, 1, 4096]
    - [303, 42.89]
  - - [1088, 2880, 1, 4096]
    - [320, 44.15]
  - - [1344, 2880, 1, 4096]
    - [339, 45.78]
  - - [1600, 2880, 1, 4096]
    - [446, 43.13]
  - - [1856, 2880, 1, 4096]
    - [339, 46.65]
  - - [2112, 2880, 1, 4096]
    - [339, 45.96]
  - - [2368, 2880, 1, 4096]
    - [339, 47.45]
  - - [2624, 2880, 1, 4096]
    - [368, 48.35]
  - - [2880, 2880, 1, 4096]
    - [339, 49.26]
  - - [3136, 2880, 1, 4096]
    - [339, 50.63]
  - - [3392, 2880, 1, 4096]
    - [339, 49.85]
  - - [3648, 2880, 1, 4096]
    - [339, 50.86]
  - - [3904, 2880, 1, 4096]
    - [378, 50.5]
  - - [64, 3136, 1, 4096]
    - [303, 24.16]
  - - [320, 3136, 1, 4096]
    - [303, 40.06]
  - - [576, 3136, 1, 4096]
    - [320, 44.62]
  - - [832, 3136, 1, 4096]
    - [330, 45.73]
  - - [1088, 3136, 1, 4096]
    - [322, 45.29]
  - - [1344, 3136, 1, 4096]
    - [339, 46.69]
  - - [1600, 3136, 1, 4096]
    - [339, 47.58]
  - - [1856, 3136, 1, 4096]
    - [339, 49.19]
  - - [2112, 3136, 1, 4096]
    - [339, 48.97]
  - - [2368, 3136, 1, 4096]
    - [378, 50.36]
  - - [2624, 3136, 1, 4096]
    - [341, 50.57]
  - - [2880, 3136, 1, 4096]
    - [339, 51.53]
  - - [3136, 3136, 1, 4096]
    - [339, 51.35]
  - - [3392, 3136, 1, 4096]
    - [339, 50.33]
  - - [3648, 3136, 1, 4096]
    - [339, 51.5]
  - - [3904, 3136, 1, 4096]
    - [339, 51.66]
  - - [64, 3392, 1, 4096]
    - [207, 26.26]
  - - [320, 3392, 1, 4096]
    - [297, 40.52]
  - - [576, 3392, 1, 4096]
    - [243, 45.0]
  - - [832, 3392, 1, 4096]
    - [320, 45.86]
  - - [1088, 3392, 1, 4096]
    - [339, 46.4]
  - - [1344, 3392, 1, 4096]
    - [341, 46.23]
  - - [1600, 3392, 1, 4096]
    - [339, 50.25]
  - - [1856, 3392, 1, 4096]
    - [339, 50.14]
  - - [2112, 3392, 1, 4096]
    - [339, 49.91]
  - - [2368, 3392, 1, 4096]
    - [339, 49.56]
  - - [2624, 3392, 1, 4096]
    - [339, 51.78]
  - - [2880, 3392, 1, 4096]
    - [339, 51.26]
  - - [3136, 3392, 1, 4096]
    - [339, 51.09]
  - - [3392, 3392, 1, 4096]
    - [339, 51.81]
  - - [3648, 3392, 1, 4096]
    - [341, 51.68]
  - - [3904, 3392, 1, 4096]
    - [341, 51.26]
  - - [64, 3648, 1, 4096]
    - [315, 28.1]
  - - [320, 3648, 1, 4096]
    - [320, 43.08]
  - - [576, 3648, 1, 4096]
    - [375, 43.91]
  - - [832, 3648, 1, 4096]
    - [207, 46.12]
  - - [1088, 3648, 1, 4096]
    - [320, 45.09]
  - - [1344, 3648, 1, 4096]
    - [339, 49.75]
  - - [1600, 3648, 1, 4096]
    - [341, 49.14]
  - - [1856, 3648, 1, 4096]
    - [339, 49.9]
  - - [2112, 3648, 1, 4096]
    - [339, 49.97]
  - - [2368, 3648, 1, 4096]
    - [378, 50.24]
  - - [2624, 3648, 1, 4096]
    - [339, 50.75]
  - - [2880, 3648, 1, 4096]
    - [339, 51.39]
  - - [3136, 3648, 1, 4096]
    - [341, 51.44]
  - - [3392, 3648, 1, 4096]
    - [341, 50.82]
  - - [3648, 3648, 1, 4096]
    - [341, 51.79]
  - - [3904, 3648, 1, 4096]
    - [408, 51.13]
  - - [64, 3904, 1, 4096]
    - [353, 30.52]
  - - [320, 3904, 1, 4096]
    - [303, 43.06]
  - - [576, 3904, 1, 4096]
    - [303, 44.67]
  - - [832, 3904, 1, 4096]
    - [332, 46.71]
  - - [1088, 3904, 1, 4096]
    - [339, 46.75]
  - - [1344, 3904, 1, 4096]
    - [378, 48.38]
  - - [1600, 3904, 1, 4096]
    - [339, 49.2]
  - - [1856, 3904, 1, 4096]
    - [339, 50.27]
  - - [2112, 3904, 1, 4096]
    - [378, 50.39]
  - - [2368, 3904, 1, 4096]
    - [339, 50.91]
  - - [2624, 3904, 1, 4096]
    - [339, 51.32]
  - - [2880, 3904, 1, 4096]
    - [341, 50.73]
  - - [3136, 3904, 1, 4096]
    - [341, 51.68]
  - - [3392, 3904, 1, 4096]
    - [408, 51.58]
  - - [3648, 3904, 1, 4096]
    - [341, 51.19]
  - - [3904, 3904, 1, 4096]
    - [341, 51.48]
  - - [192, 64, 1, 64]
    - [116, 0.08]
  - - [448, 64, 1, 64]
    - [120, 0.19]
  - - [704, 64, 1, 64]
    - [116, 0.27]
  - - [960, 64, 1, 64]
    - [120, 0.38]
  - - [1216, 64, 1, 64]
    - [195, 0.47]
  - - [1472, 64, 1, 64]
    - [380, 0.58]
  - - [1728, 64, 1, 64]
    - [195, 0.68]
  - - [1984, 64, 1, 64]
    - [381, 0.75]
  - - [64, 192, 1, 64]
    - [139, 0.08]
  - - [192, 192, 1, 64]
    - [141, 0.22]
  - - [320, 192, 1, 64]
    - [142, 0.39]
  - - [448, 192, 1, 64]
    - [133, 0.52]
  - - [576, 192, 1, 64]
    - [145, 0.67]
  - - [704, 192, 1, 64]
    - [147, 0.78]
  - - [832, 192, 1, 64]
    - [149, 0.95]
  - - [960, 192, 1, 64]
    - [135, 1.09]
  - - [1088, 192, 1, 64]
    - [304, 1.21]
  - - [1216, 192, 1, 64]
    - [175, 1.38]
  - - [1344, 192, 1, 64]
    - [334, 1.5]
  - - [1472, 192, 1, 64]
    - [175, 1.59]
  - - [1600, 192, 1, 64]
    - [382, 1.73]
  - - [1728, 192, 1, 64]
    - [175, 1.85]
  - - [1856, 192, 1, 64]
    - [149, 2.04]
  - - [1984, 192, 1, 64]
    - [146, 2.14]
  - - [192, 320, 1, 64]
    - [142, 0.38]
  - - [448, 320, 1, 64]
    - [170, 0.84]
  - - [704, 320, 1, 64]
    - [149, 1.34]
  - - [960, 320, 1, 64]
    - [175, 1.73]
  - - [1216, 320, 1, 64]
    - [149, 2.2]
  - - [1472, 320, 1, 64]
    - [239, 2.56]
  - - [1728, 320, 1, 64]
    - [174, 2.89]
  - - [1984, 320, 1, 64]
    - [196, 3.21]
  - - [64, 448, 1, 64]
    - [188, 0.18]
  - - [192, 448, 1, 64]
    - [133, 0.53]
  - - [320, 448, 1, 64]
    - [162, 0.85]
  - - [448, 448, 1, 64]
    - [192, 1.17]
  - - [576, 448, 1, 64]
    - [193, 1.48]
  - - [704, 448, 1, 64]
    - [149, 1.79]
  - - [832, 448, 1, 64]
    - [196, 2.04]
  - - [960, 448, 1, 64]
    - [176, 2.35]
  - - [1088, 448, 1, 64]
    - [176, 2.66]
  - - [1216, 448, 1, 64]
    - [383, 2.85]
  - - [1344, 448, 1, 64]
    - [226, 3.19]
  - - [1472, 448, 1, 64]
    - [226, 3.37]
  - - [1600, 448, 1, 64]
    - [267, 3.57]
  - - [1728, 448, 1, 64]
    - [176, 3.86]
  - - [1856, 448, 1, 64]
    - [196, 3.81]
  - - [1984, 448, 1, 64]
    - [226, 4.33]
  - - [192, 576, 1, 64]
    - [149, 0.68]
  - - [448, 576, 1, 64]
    - [164, 1.51]
  - - [704, 576, 1, 64]
    - [217, 2.15]
  - - [960, 576, 1, 64]
    - [149, 2.93]
  - - [1216, 576, 1, 64]
    - [276, 3.53]
  - - [1472, 576, 1, 64]
    - [226, 4.15]
  - - [1728, 576, 1, 64]
    - [226, 4.61]
  - - [1984, 576, 1, 64]
    - [226, 5.16]
  - - [64, 704, 1, 64]
    - [178, 0.29]
  - - [192, 704, 1, 64]
    - [228, 0.8]
  - - [320, 704, 1, 64]
    - [143, 1.33]
  - - [448, 704, 1, 64]
    - [207, 1.75]
  - - [576, 704, 1, 64]
    - [230, 2.22]
  - - [704, 704, 1, 64]
    - [183, 2.69]
  - - [832, 704, 1, 64]
    - [176, 3.01]
  - - [960, 704, 1, 64]
    - [226, 3.48]
  - - [1088, 704, 1, 64]
    - [176, 3.81]
  - - [1216, 704, 1, 64]
    - [226, 4.13]
  - - [1344, 704, 1, 64]
    - [273, 4.53]
  - - [1472, 704, 1, 64]
    - [149, 4.7]
  - - [1600, 704, 1, 64]
    - [226, 5.11]
  - - [1728, 704, 1, 64]
    - [267, 5.1]
  - - [1856, 704, 1, 64]
    - [164, 5.51]
  - - [1984, 704, 1, 64]
    - [260, 5.82]
  - - [192, 832, 1, 64]
    - [248, 0.94]
  - - [448, 832, 1, 64]
    - [251, 2.1]
  - - [704, 832, 1, 64]
    - [174, 3.07]
  - - [960, 832, 1, 64]
    - [226, 3.89]
  - - [1216, 832, 1, 64]
    - [164, 4.56]
  - - [1472, 832, 1, 64]
    - [260, 5.1]
  - - [1728, 832, 1, 64]
    - [226, 6.02]
  - - [1984, 832, 1, 64]
    - [226, 6.34]
  - - [64, 960, 1, 64]
    - [188, 0.39]
  - - [192, 960, 1, 64]
    - [248, 1.11]
  - - [320, 960, 1, 64]
    - [201, 1.71]
  - - [448, 960, 1, 64]
    - [239, 2.38]
  - - [576, 960, 1, 64]
    - [267, 2.89]
  - - [704, 960, 1, 64]
    - [260, 3.45]
  - - [832, 960, 1, 64]
    - [267, 3.93]
  - - [960, 960, 1, 64]
    - [226, 4.46]
  - - [1088, 960, 1, 64]
    - [226, 4.84]
  - - [1216, 960, 1, 64]
    - [230, 5.15]
  - - [1344, 960, 1, 64]
    - [164, 5.37]
  - - [1472, 960, 1, 64]
    - [226, 5.77]
  - - [1600, 960, 1, 64]
    - [267, 5.91]
  - - [1728, 960, 1, 64]
    - [226, 6.39]
  - - [1856, 960, 1, 64]
    - [226, 6.58]
  - - [1984, 960, 1, 64]
    - [226, 6.88]
  - - [192, 1088, 1, 64]
    - [164, 1.23]
  - - [448, 1088, 1, 64]
    - [176, 2.64]
  - - [704, 1088, 1, 64]
    - [226, 3.81]
  - - [960, 1088, 1, 64]
    - [226, 4.81]
  - - [1216, 1088, 1, 64]
    - [260, 5.62]
  - - [1472, 1088, 1, 64]
    - [226, 6.22]
  - - [1728, 1088, 1, 64]
    - [226, 7.0]
  - - [1984, 1088, 1, 64]
    - [226, 7.67]
  - - [64, 1216, 1, 64]
    - [177, 0.49]
  - - [192, 1216, 1, 64]
    - [384, 1.38]
  - - [320, 1216, 1, 64]
    - [207, 2.22]
  - - [448, 1216, 1, 64]
    - [267, 2.92]
  - - [576, 1216, 1, 64]
    - [226, 3.62]
  - - [704, 1216, 1, 64]
    - [267, 4.32]
  - - [832, 1216, 1, 64]
    - [149, 4.67]
  - - [960, 1216, 1, 64]
    - [385, 5.19]
  - - [1088, 1216, 1, 64]
    - [226, 5.52]
  - - [1216, 1216, 1, 64]
    - [260, 6.07]
  - - [1344, 1216, 1, 64]
    - [260, 6.5]
  - - [1472, 1216, 1, 64]
    - [226, 6.72]
  - - [1600, 1216, 1, 64]
    - [226, 7.16]
  - - [1728, 1216, 1, 64]
    - [226, 7.43]
  - - [1856, 1216, 1, 64]
    - [267, 7.79]
  - - [1984, 1216, 1, 64]
    - [267, 7.91]
  - - [192, 1344, 1, 64]
    - [149, 1.54]
  - - [448, 1344, 1, 64]
    - [239, 3.09]
  - - [704, 1344, 1, 64]
    - [226, 4.64]
  - - [960, 1344, 1, 64]
    - [386, 5.48]
  - - [1216, 1344, 1, 64]
    - [226, 6.29]
  - - [1472, 1344, 1, 64]
    - [226, 7.29]
  - - [1728, 1344, 1, 64]
    - [226, 7.82]
  - - [1984, 1344, 1, 64]
    - [267, 8.29]
  - - [64, 1472, 1, 64]
    - [235, 0.57]
  - - [192, 1472, 1, 64]
    - [388, 1.59]
  - - [320, 1472, 1, 64]
    - [383, 2.59]
  - - [448, 1472, 1, 64]
    - [273, 3.39]
  - - [576, 1472, 1, 64]
    - [267, 4.21]
  - - [704, 1472, 1, 64]
    - [226, 4.79]
  - - [832, 1472, 1, 64]
    - [389, 5.42]
  - - [960, 1472, 1, 64]
    - [260, 5.93]
  - - [1088, 1472, 1, 64]
    - [164, 6.04]
  - - [1216, 1472, 1, 64]
    - [260, 6.64]
  - - [1344, 1472, 1, 64]
    - [260, 7.05]
  - - [1472, 1472, 1, 64]
    - [226, 7.83]
  - - [1600, 1472, 1, 64]
    - [226, 7.81]
  - - [1728, 1472, 1, 64]
    - [226, 8.24]
  - - [1856, 1472, 1, 64]
    - [226, 8.5]
  - - [1984, 1472, 1, 64]
    - [226, 8.63]
  - - [192, 1600, 1, 64]
    - [149, 1.75]
  - - [448, 1600, 1, 64]
    - [226, 3.69]
  - - [704, 1600, 1, 64]
    - [226, 5.1]
  - - [960, 1600, 1, 64]
    - [260, 6.12]
  - - [1216, 1600, 1, 64]
    - [276, 6.63]
  - - [1472, 1600, 1, 64]
    - [226, 8.07]
  - - [1728, 1600, 1, 64]
    - [226, 8.53]
  - - [1984, 1600, 1, 64]
    - [267, 9.03]
  - - [64, 1728, 1, 64]
    - [175, 0.68]
  - - [192, 1728, 1, 64]
    - [187, 1.9]
  - - [320, 1728, 1, 64]
    - [144, 2.86]
  - - [448, 1728, 1, 64]
    - [176, 3.87]
  - - [576, 1728, 1, 64]
    - [226, 4.82]
  - - [704, 1728, 1, 64]
    - [226, 5.48]
  - - [832, 1728, 1, 64]
    - [226, 6.03]
  - - [960, 1728, 1, 64]
    - [260, 6.54]
  - - [1088, 1728, 1, 64]
    - [390, 6.67]
  - - [1216, 1728, 1, 64]
    - [226, 7.32]
  - - [1344, 1728, 1, 64]
    - [226, 7.81]
  - - [1472, 1728, 1, 64]
    - [226, 8.22]
  - - [1600, 1728, 1, 64]
    - [226, 8.67]
  - - [1728, 1728, 1, 64]
    - [226, 8.7]
  - - [1856, 1728, 1, 64]
    - [226, 9.1]
  - - [1984, 1728, 1, 64]
    - [226, 9.48]
  - - [192, 1856, 1, 64]
    - [338, 2.01]
  - - [448, 1856, 1, 64]
    - [226, 4.09]
  - - [704, 1856, 1, 64]
    - [267, 5.63]
  - - [960, 1856, 1, 64]
    - [226, 6.55]
  - - [1216, 1856, 1, 64]
    - [226, 7.84]
  - - [1472, 1856, 1, 64]
    - [226, 8.61]
  - - [1728, 1856, 1, 64]
    - [226, 9.22]
  - - [1984, 1856, 1, 64]
    - [226, 9.85]
  - - [64, 1984, 1, 64]
    - [195, 0.78]
  - - [192, 1984, 1, 64]
    - [303, 2.18]
  - - [320, 1984, 1, 64]
    - [243, 3.3]
  - - [448, 1984, 1, 64]
    - [226, 4.43]
  - - [576, 1984, 1, 64]
    - [226, 5.17]
  - - [704, 1984, 1, 64]
    - [226, 5.81]
  - - [832, 1984, 1, 64]
    - [267, 6.33]
  - - [960, 1984, 1, 64]
    - [226, 7.0]
  - - [1088, 1984, 1, 64]
    - [226, 7.59]
  - - [1216, 1984, 1, 64]
    - [226, 7.98]
  - - [1344, 1984, 1, 64]
    - [260, 8.23]
  - - [1472, 1984, 1, 64]
    - [260, 8.62]
  - - [1600, 1984, 1, 64]
    - [226, 9.36]
  - - [1728, 1984, 1, 64]
    - [226, 9.65]
  - - [1856, 1984, 1, 64]
    - [226, 9.78]
  - - [1984, 1984, 1, 64]
    - [226, 10.23]
  - - [192, 64, 1, 256]
    - [282, 0.3]
  - - [448, 64, 1, 256]
    - [280, 0.69]
  - - [704, 64, 1, 256]
    - [122, 1.06]
  - - [960, 64, 1, 256]
    - [122, 1.42]
  - - [1216, 64, 1, 256]
    - [392, 1.74]
  - - [1472, 64, 1, 256]
    - [303, 2.1]
  - - [1728, 64, 1, 256]
    - [303, 2.45]
  - - [1984, 64, 1, 256]
    - [297, 2.83]
  - - [64, 192, 1, 256]
    - [301, 0.29]
  - - [192, 192, 1, 256]
    - [294, 0.87]
  - - [320, 192, 1, 256]
    - [303, 1.37]
  - - [448, 192, 1, 256]
    - [297, 1.94]
  - - [576, 192, 1, 256]
    - [305, 2.46]
  - - [704, 192, 1, 256]
    - [298, 2.86]
  - - [832, 192, 1, 256]
    - [297, 3.46]
  - - [960, 192, 1, 256]
    - [303, 4.0]
  - - [1088, 192, 1, 256]
    - [300, 4.45]
  - - [1216, 192, 1, 256]
    - [300, 5.0]
  - - [1344, 192, 1, 256]
    - [353, 5.14]
  - - [1472, 192, 1, 256]
    - [300, 5.67]
  - - [1600, 192, 1, 256]
    - [297, 6.21]
  - - [1728, 192, 1, 256]
    - [303, 6.63]
  - - [1856, 192, 1, 256]
    - [303, 7.07]
  - - [1984, 192, 1, 256]
    - [207, 7.42]
  - - [192, 320, 1, 256]
    - [313, 1.44]
  - - [448, 320, 1, 256]
    - [303, 3.16]
  - - [704, 320, 1, 256]
    - [303, 4.91]
  - - [960, 320, 1, 256]
    - [297, 6.12]
  - - [1216, 320, 1, 256]
    - [297, 7.54]
  - - [1472, 320, 1, 256]
    - [174, 8.57]
  - - [1728, 320, 1, 256]
    - [174, 9.46]
  - - [1984, 320, 1, 256]
    - [303, 10.66]
  - - [64, 448, 1, 256]
    - [285, 0.68]
  - - [192, 448, 1, 256]
    - [303, 1.92]
  - - [320, 448, 1, 256]
    - [300, 3.09]
  - - [448, 448, 1, 256]
    - [297, 4.31]
  - - [576, 448, 1, 256]
    - [207, 5.4]
  - - [704, 448, 1, 256]
    - [303, 6.37]
  - - [832, 448, 1, 256]
    - [320, 7.14]
  - - [960, 448, 1, 256]
    - [230, 8.08]
  - - [1088, 448, 1, 256]
    - [174, 8.89]
  - - [1216, 448, 1, 256]
    - [267, 9.44]
  - - [1344, 448, 1, 256]
    - [206, 10.07]
  - - [1472, 448, 1, 256]
    - [226, 10.84]
  - - [1600, 448, 1, 256]
    - [206, 11.09]
  - - [1728, 448, 1, 256]
    - [206, 11.74]
  - - [1856, 448, 1, 256]
    - [260, 12.24]
  - - [1984, 448, 1, 256]
    - [332, 13.05]
  - - [192, 576, 1, 256]
    - [328, 2.44]
  - - [448, 576, 1, 256]
    - [303, 5.49]
  - - [704, 576, 1, 256]
    - [303, 7.44]
  - - [960, 576, 1, 256]
    - [176, 9.59]
  - - [1216, 576, 1, 256]
    - [176, 11.48]
  - - [1472, 576, 1, 256]
    - [176, 13.05]
  - - [1728, 576, 1, 256]
    - [174, 13.81]
  - - [1984, 576, 1, 256]
    - [332, 14.91]
  - - [64, 704, 1, 256]
    - [282, 1.07]
  - - [192, 704, 1, 256]
    - [206, 2.9]
  - - [320, 704, 1, 256]
    - [206, 4.76]
  - - [448, 704, 1, 256]
    - [297, 6.06]
  - - [576, 704, 1, 256]
    - [207, 7.6]
  - - [704, 704, 1, 256]
    - [207, 9.01]
  - - [832, 704, 1, 256]
    - [174, 10.06]
  - - [960, 704, 1, 256]
    - [226, 10.95]
  - - [1088, 704, 1, 256]
    - [174, 12.32]
  - - [1216, 704, 1, 256]
    - [176, 12.98]
  - - [1344, 704, 1, 256]
    - [332, 13.5]
  - - [1472, 704, 1, 256]
    - [176, 14.51]
  - - [1600, 704, 1, 256]
    - [176, 14.55]
  - - [1728, 704, 1, 256]
    - [243, 14.8]
  - - [1856, 704, 1, 256]
    - [243, 15.51]
  - - [1984, 704, 1, 256]
    - [226, 16.48]
  - - [192, 832, 1, 256]
    - [297, 3.42]
  - - [448, 832, 1, 256]
    - [300, 7.23]
  - - [704, 832, 1, 256]
    - [176, 10.28]
  - - [960, 832, 1, 256]
    - [174, 11.97]
  - - [1216, 832, 1, 256]
    - [174, 13.87]
  - - [1472, 832, 1, 256]
    - [322, 14.78]
  - - [1728, 832, 1, 256]
    - [226, 16.53]
  - - [1984, 832, 1, 256]
    - [226, 17.81]
  - - [64, 960, 1, 256]
    - [333, 1.43]
  - - [192, 960, 1, 256]
    - [303, 3.95]
  - - [320, 960, 1, 256]
    - [187, 6.05]
  - - [448, 960, 1, 256]
    - [297, 7.93]
  - - [576, 960, 1, 256]
    - [174, 9.66]
  - - [704, 960, 1, 256]
    - [276, 11.05]
  - - [832, 960, 1, 256]
    - [176, 12.36]
  - - [960, 960, 1, 256]
    - [226, 13.34]
  - - [1088, 960, 1, 256]
    - [338, 14.34]
  - - [1216, 960, 1, 256]
    - [273, 15.21]
  - - [1344, 960, 1, 256]
    - [267, 15.59]
  - - [1472, 960, 1, 256]
    - [226, 16.74]
  - - [1600, 960, 1, 256]
    - [226, 17.06]
  - - [1728, 960, 1, 256]
    - [226, 17.93]
  - - [1856, 960, 1, 256]
    - [176, 17.95]
  - - [1984, 960, 1, 256]
    - [226, 19.22]
  - - [192, 1088, 1, 256]
    - [207, 4.5]
  - - [448, 1088, 1, 256]
    - [207, 8.97]
  - - [704, 1088, 1, 256]
    - [174, 12.26]
  - - [960, 1088, 1, 256]
    - [176, 14.75]
  - - [1216, 1088, 1, 256]
    - [226, 16.29]
  - - [1472, 1088, 1, 256]
    - [226, 17.93]
  - - [1728, 1088, 1, 256]
    - [226, 18.79]
  - - [1984, 1088, 1, 256]
    - [226, 19.68]
  - - [64, 1216, 1, 256]
    - [282, 1.77]
  - - [192, 1216, 1, 256]
    - [303, 5.0]
  - - [320, 1216, 1, 256]
    - [303, 7.75]
  - - [448, 1216, 1, 256]
    - [174, 9.74]
  - - [576, 1216, 1, 256]
    - [273, 11.75]
  - - [704, 1216, 1, 256]
    - [226, 13.02]
  - - [832, 1216, 1, 256]
    - [176, 14.11]
  - - [960, 1216, 1, 256]
    - [226, 15.59]
  - - [1088, 1216, 1, 256]
    - [226, 16.16]
  - - [1216, 1216, 1, 256]
    - [226, 17.41]
  - - [1344, 1216, 1, 256]
    - [226, 17.96]
  - - [1472, 1216, 1, 256]
    - [176, 18.12]
  - - [1600, 1216, 1, 256]
    - [226, 19.43]
  - - [1728, 1216, 1, 256]
    - [226, 19.78]
  - - [1856, 1216, 1, 256]
    - [226, 20.13]
  - - [1984, 1216, 1, 256]
    - [226, 20.41]
  - - [192, 1344, 1, 256]
    - [297, 5.44]
  - - [448, 1344, 1, 256]
    - [174, 10.45]
  - - [704, 1344, 1, 256]
    - [332, 13.88]
  - - [960, 1344, 1, 256]
    - [243, 15.7]
  - - [1216, 1344, 1, 256]
    - [226, 18.12]
  - - [1472, 1344, 1, 256]
    - [226, 19.89]
  - - [1728, 1344, 1, 256]
    - [176, 20.03]
  - - [1984, 1344, 1, 256]
    - [332, 20.75]
  - - [64, 1472, 1, 256]
    - [382, 2.08]
  - - [192, 1472, 1, 256]
    - [300, 5.71]
  - - [320, 1472, 1, 256]
    - [174, 8.8]
  - - [448, 1472, 1, 256]
    - [176, 10.83]
  - - [576, 1472, 1, 256]
    - [267, 12.49]
  - - [704, 1472, 1, 256]
    - [176, 14.29]
  - - [832, 1472, 1, 256]
    - [332, 15.79]
  - - [960, 1472, 1, 256]
    - [226, 17.06]
  - - [1088, 1472, 1, 256]
    - [226, 17.38]
  - - [1216, 1472, 1, 256]
    - [226, 17.93]
  - - [1344, 1472, 1, 256]
    - [226, 19.67]
  - - [1472, 1472, 1, 256]
    - [226, 19.87]
  - - [1600, 1472, 1, 256]
    - [176, 20.0]
  - - [1728, 1472, 1, 256]
    - [226, 20.06]
  - - [1856, 1472, 1, 256]
    - [230, 20.96]
  - - [1984, 1472, 1, 256]
    - [226, 22.07]
  - - [192, 1600, 1, 256]
    - [206, 6.14]
  - - [448, 1600, 1, 256]
    - [273, 11.63]
  - - [704, 1600, 1, 256]
    - [226, 14.94]
  - - [960, 1600, 1, 256]
    - [176, 16.37]
  - - [1216, 1600, 1, 256]
    - [226, 19.22]
  - - [1472, 1600, 1, 256]
    - [176, 20.08]
  - - [1728, 1600, 1, 256]
    - [230, 20.97]
  - - [1984, 1600, 1, 256]
    - [226, 22.43]
  - - [64, 1728, 1, 256]
    - [353, 2.38]
  - - [192, 1728, 1, 256]
    - [207, 6.62]
  - - [320, 1728, 1, 256]
    - [174, 9.68]
  - - [448, 1728, 1, 256]
    - [176, 12.24]
  - - [576, 1728, 1, 256]
    - [273, 13.94]
  - - [704, 1728, 1, 256]
    - [230, 15.13]
  - - [832, 1728, 1, 256]
    - [226, 16.37]
  - - [960, 1728, 1, 256]
    - [243, 17.49]
  - - [1088, 1728, 1, 256]
    - [176, 17.15]
  - - [1216, 1728, 1, 256]
    - [176, 18.86]
  - - [1344, 1728, 1, 256]
    - [176, 19.89]
  - - [1472, 1728, 1, 256]
    - [243, 19.57]
  - - [1600, 1728, 1, 256]
    - [215, 20.12]
  - - [1728, 1728, 1, 256]
    - [338, 20.95]
  - - [1856, 1728, 1, 256]
    - [226, 21.5]
  - - [1984, 1728, 1, 256]
    - [243, 21.38]
  - - [192, 1856, 1, 256]
    - [303, 7.02]
  - - [448, 1856, 1, 256]
    - [176, 12.47]
  - - [704, 1856, 1, 256]
    - [243, 15.37]
  - - [960, 1856, 1, 256]
    - [226, 17.94]
  - - [1216, 1856, 1, 256]
    - [226, 20.88]
  - - [1472, 1856, 1, 256]
    - [243, 20.75]
  - - [1728, 1856, 1, 256]
    - [226, 21.9]
  - - [1984, 1856, 1, 256]
    - [226, 23.37]
  - - [64, 1984, 1, 256]
    - [393, 2.8]
  - - [192, 1984, 1, 256]
    - [207, 7.52]
  - - [320, 1984, 1, 256]
    - [243, 10.48]
  - - [448, 1984, 1, 256]
    - [176, 13.26]
  - - [576, 1984, 1, 256]
    - [273, 14.6]
  - - [704, 1984, 1, 256]
    - [243, 16.1]
  - - [832, 1984, 1, 256]
    - [226, 18.07]
  - - [960, 1984, 1, 256]
    - [226, 18.87]
  - - [1088, 1984, 1, 256]
    - [226, 19.49]
  - - [1216, 1984, 1, 256]
    - [273, 20.0]
  - - [1344, 1984, 1, 256]
    - [226, 20.43]
  - - [1472, 1984, 1, 256]
    - [226, 21.75]
  - - [1600, 1984, 1, 256]
    - [226, 22.49]
  - - [1728, 1984, 1, 256]
    - [273, 22.32]
  - - [1856, 1984, 1, 256]
    - [226, 23.61]
  - - [1984, 1984, 1, 256]
    - [226, 24.01]
  - - [192, 64, 1, 512]
    - [294, 0.56]
  - - [448, 64, 1, 512]
    - [349, 1.26]
  - - [704, 64, 1, 512]
    - [351, 1.94]
  - - [960, 64, 1, 512]
    - [280, 2.65]
  - - [1216, 64, 1, 512]
    - [394, 3.16]
  - - [1472, 64, 1, 512]
    - [300, 3.83]
  - - [1728, 64, 1, 512]
    - [207, 4.59]
  - - [1984, 64, 1, 512]
    - [300, 5.08]
  - - [64, 192, 1, 512]
    - [354, 0.55]
  - - [192, 192, 1, 512]
    - [333, 1.64]
  - - [320, 192, 1, 512]
    - [313, 2.51]
  - - [448, 192, 1, 512]
    - [297, 3.52]
  - - [576, 192, 1, 512]
    - [297, 4.56]
  - - [704, 192, 1, 512]
    - [320, 5.08]
  - - [832, 192, 1, 512]
    - [303, 6.22]
  - - [960, 192, 1, 512]
    - [303, 7.05]
  - - [1088, 192, 1, 512]
    - [300, 8.0]
  - - [1216, 192, 1, 512]
    - [297, 8.88]
  - - [1344, 192, 1, 512]
    - [207, 9.7]
  - - [1472, 192, 1, 512]
    - [303, 9.73]
  - - [1600, 192, 1, 512]
    - [330, 10.25]
  - - [1728, 192, 1, 512]
    - [297, 11.29]
  - - [1856, 192, 1, 512]
    - [303, 12.14]
  - - [1984, 192, 1, 512]
    - [243, 12.06]
  - - [192, 320, 1, 512]
    - [356, 2.58]
  - - [448, 320, 1, 512]
    - [336, 5.41]
  - - [704, 320, 1, 512]
    - [207, 8.61]
  - - [960, 320, 1, 512]
    - [207, 10.45]
  - - [1216, 320, 1, 512]
    - [303, 13.14]
  - - [1472, 320, 1, 512]
    - [207, 14.07]
  - - [1728, 320, 1, 512]
    - [174, 15.19]
  - - [1984, 320, 1, 512]
    - [297, 17.29]
  - - [64, 448, 1, 512]
    - [282, 1.3]
  - - [192, 448, 1, 512]
    - [207, 3.55]
  - - [320, 448, 1, 512]
    - [303, 5.56]
  - - [448, 448, 1, 512]
    - [297, 7.63]
  - - [576, 448, 1, 512]
    - [303, 9.71]
  - - [704, 448, 1, 512]
    - [303, 10.86]
  - - [832, 448, 1, 512]
    - [187, 12.35]
  - - [960, 448, 1, 512]
    - [332, 13.16]
  - - [1088, 448, 1, 512]
    - [300, 14.6]
  - - [1216, 448, 1, 512]
    - [174, 14.91]
  - - [1344, 448, 1, 512]
    - [303, 16.51]
  - - [1472, 448, 1, 512]
    - [260, 16.78]
  - - [1600, 448, 1, 512]
    - [215, 17.68]
  - - [1728, 448, 1, 512]
    - [375, 18.43]
  - - [1856, 448, 1, 512]
    - [332, 18.49]
  - - [1984, 448, 1, 512]
    - [276, 19.45]
  - - [192, 576, 1, 512]
    - [303, 4.54]
  - - [448, 576, 1, 512]
    - [207, 9.62]
  - - [704, 576, 1, 512]
    - [174, 12.49]
  - - [960, 576, 1, 512]
    - [176, 15.62]
  - - [1216, 576, 1, 512]
    - [176, 18.28]
  - - [1472, 576, 1, 512]
    - [176, 20.25]
  - - [1728, 576, 1, 512]
    - [243, 20.64]
  - - [1984, 576, 1, 512]
    - [375, 21.49]
  - - [64, 704, 1, 512]
    - [333, 1.97]
  - - [192, 704, 1, 512]
    - [300, 5.27]
  - - [320, 704, 1, 512]
    - [303, 8.63]
  - - [448, 704, 1, 512]
    - [207, 10.58]
  - - [576, 704, 1, 512]
    - [174, 12.53]
  - - [704, 704, 1, 512]
    - [186, 14.83]
  - - [832, 704, 1, 512]
    - [174, 16.2]
  - - [960, 704, 1, 512]
    - [176, 17.45]
  - - [1088, 704, 1, 512]
    - [176, 19.01]
  - - [1216, 704, 1, 512]
    - [176, 20.0]
  - - [1344, 704, 1, 512]
    - [273, 20.06]
  - - [1472, 704, 1, 512]
    - [206, 21.24]
  - - [1600, 704, 1, 512]
    - [395, 20.89]
  - - [1728, 704, 1, 512]
    - [243, 21.87]
  - - [1856, 704, 1, 512]
    - [243, 23.73]
  - - [1984, 704, 1, 512]
    - [338, 23.83]
  - - [192, 832, 1, 512]
    - [320, 6.03]
  - - [448, 832, 1, 512]
    - [297, 12.4]
  - - [704, 832, 1, 512]
    - [174, 16.33]
  - - [960, 832, 1, 512]
    - [176, 18.81]
  - - [1216, 832, 1, 512]
    - [176, 21.17]
  - - [1472, 832, 1, 512]
    - [243, 22.38]
  - - [1728, 832, 1, 512]
    - [243, 24.32]
  - - [1984, 832, 1, 512]
    - [243, 25.05]
  - - [64, 960, 1, 512]
    - [361, 2.57]
  - - [192, 960, 1, 512]
    - [300, 7.21]
  - - [320, 960, 1, 512]
    - [303, 10.53]
  - - [448, 960, 1, 512]
    - [174, 13.28]
  - - [576, 960, 1, 512]
    - [174, 15.88]
  - - [704, 960, 1, 512]
    - [276, 17.64]
  - - [832, 960, 1, 512]
    - [176, 18.99]
  - - [960, 960, 1, 512]
    - [273, 20.45]
  - - [1088, 960, 1, 512]
    - [322, 21.63]
  - - [1216, 960, 1, 512]
    - [243, 22.61]
  - - [1344, 960, 1, 512]
    - [243, 23.49]
  - - [1472, 960, 1, 512]
    - [243, 23.91]
  - - [1600, 960, 1, 512]
    - [338, 24.02]
  - - [1728, 960, 1, 512]
    - [243, 25.19]
  - - [1856, 960, 1, 512]
    - [243, 26.02]
  - - [1984, 960, 1, 512]
    - [243, 26.47]
  - - [192, 1088, 1, 512]
    - [303, 7.92]
  - - [448, 1088, 1, 512]
    - [174, 14.86]
  - - [704, 1088, 1, 512]
    - [174, 19.39]
  - - [960, 1088, 1, 512]
    - [303, 20.9]
  - - [1216, 1088, 1, 512]
    - [226, 22.74]
  - - [1472, 1088, 1, 512]
    - [226, 24.56]
  - - [1728, 1088, 1, 512]
    - [230, 25.79]
  - - [1984, 1088, 1, 512]
    - [276, 27.2]
  - - [64, 1216, 1, 512]
    - [313, 3.21]
  - - [192, 1216, 1, 512]
    - [300, 8.84]
  - - [320, 1216, 1, 512]
    - [243, 12.94]
  - - [448, 1216, 1, 512]
    - [174, 15.51]
  - - [576, 1216, 1, 512]
    - [273, 18.65]
  - - [704, 1216, 1, 512]
    - [176, 19.66]
  - - [832, 1216, 1, 512]
    - [176, 21.58]
  - - [960, 1216, 1, 512]
    - [226, 23.95]
  - - [1088, 1216, 1, 512]
    - [226, 23.47]
  - - [1216, 1216, 1, 512]
    - [226, 26.21]
  - - [1344, 1216, 1, 512]
    - [226, 25.77]
  - - [1472, 1216, 1, 512]
    - [243, 25.71]
  - - [1600, 1216, 1, 512]
    - [276, 27.71]
  - - [1728, 1216, 1, 512]
    - [332, 27.15]
  - - [1856, 1216, 1, 512]
    - [332, 27.15]
  - - [1984, 1216, 1, 512]
    - [243, 27.34]
  - - [192, 1344, 1, 512]
    - [207, 9.72]
  - - [448, 1344, 1, 512]
    - [174, 17.04]
  - - [704, 1344, 1, 512]
    - [230, 21.18]
  - - [960, 1344, 1, 512]
    - [243, 23.52]
  - - [1216, 1344, 1, 512]
    - [226, 25.06]
  - - [1472, 1344, 1, 512]
    - [226, 27.33]
  - - [1728, 1344, 1, 512]
    - [332, 27.2]
  - - [1984, 1344, 1, 512]
    - [243, 27.87]
  - - [64, 1472, 1, 512]
    - [333, 3.8]
  - - [192, 1472, 1, 512]
    - [303, 9.72]
  - - [320, 1472, 1, 512]
    - [174, 14.34]
  - - [448, 1472, 1, 512]
    - [273, 17.16]
  - - [576, 1472, 1, 512]
    - [176, 19.28]
  - - [704, 1472, 1, 512]
    - [176, 21.71]
  - - [832, 1472, 1, 512]
    - [226, 22.95]
  - - [960, 1472, 1, 512]
    - [322, 24.1]
  - - [1088, 1472, 1, 512]
    - [338, 24.24]
  - - [1216, 1472, 1, 512]
    - [215, 25.6]
  - - [1344, 1472, 1, 512]
    - [226, 26.9]
  - - [1472, 1472, 1, 512]
    - [332, 27.09]
  - - [1600, 1472, 1, 512]
    - [243, 27.51]
  - - [1728, 1472, 1, 512]
    - [215, 27.86]
  - - [1856, 1472, 1, 512]
    - [243, 28.36]
  - - [1984, 1472, 1, 512]
    - [276, 29.01]
  - - [192, 1600, 1, 512]
    - [243, 10.45]
  - - [448, 1600, 1, 512]
    - [332, 18.23]
  - - [704, 1600, 1, 512]
    - [338, 22.04]
  - - [960, 1600, 1, 512]
    - [338, 24.6]
  - - [1216, 1600, 1, 512]
    - [243, 26.43]
  - - [1472, 1600, 1, 512]
    - [243, 28.29]
  - - [1728, 1600, 1, 512]
    - [243, 27.98]
  - - [1984, 1600, 1, 512]
    - [243, 28.63]
  - - [64, 1728, 1, 512]
    - [328, 4.42]
  - - [192, 1728, 1, 512]
    - [303, 11.36]
  - - [320, 1728, 1, 512]
    - [215, 15.18]
  - - [448, 1728, 1, 512]
    - [265, 18.59]
  - - [576, 1728, 1, 512]
    - [176, 20.82]
  - - [704, 1728, 1, 512]
    - [338, 21.78]
  - - [832, 1728, 1, 512]
    - [243, 24.31]
  - - [960, 1728, 1, 512]
    - [243, 24.87]
  - - [1088, 1728, 1, 512]
    - [243, 25.61]
  - - [1216, 1728, 1, 512]
    - [215, 25.8]
  - - [1344, 1728, 1, 512]
    - [215, 27.57]
  - - [1472, 1728, 1, 512]
    - [243, 27.62]
  - - [1600, 1728, 1, 512]
    - [243, 28.44]
  - - [1728, 1728, 1, 512]
    - [243, 28.91]
  - - [1856, 1728, 1, 512]
    - [243, 29.84]
  - - [1984, 1728, 1, 512]
    - [243, 29.92]
  - - [192, 1856, 1, 512]
    - [303, 12.24]
  - - [448, 1856, 1, 512]
    - [176, 19.26]
  - - [704, 1856, 1, 512]
    - [243, 23.16]
  - - [960, 1856, 1, 512]
    - [265, 25.41]
  - - [1216, 1856, 1, 512]
    - [226, 27.49]
  - - [1472, 1856, 1, 512]
    - [243, 29.09]
  - - [1728, 1856, 1, 512]
    - [243, 29.47]
  - - [1984, 1856, 1, 512]
    - [215, 30.03]
  - - [64, 1984, 1, 512]
    - [330, 5.02]
  - - [192, 1984, 1, 512]
    - [303, 13.05]
  - - [320, 1984, 1, 512]
    - [303, 17.44]
  - - [448, 1984, 1, 512]
    - [243, 19.68]
  - - [576, 1984, 1, 512]
    - [243, 22.41]
  - - [704, 1984, 1, 512]
    - [243, 23.68]
  - - [832, 1984, 1, 512]
    - [243, 24.56]
  - - [960, 1984, 1, 512]
    - [243, 25.84]
  - - [1088, 1984, 1, 512]
    - [243, 26.64]
  - - [1216, 1984, 1, 512]
    - [243, 27.61]
  - - [1344, 1984, 1, 512]
    - [243, 27.66]
  - - [1472, 1984, 1, 512]
    - [243, 28.45]
  - - [1600, 1984, 1, 512]
    - [215, 29.25]
  - - [1728, 1984, 1, 512]
    - [243, 28.69]
  - - [1856, 1984, 1, 512]
    - [243, 29.8]
  - - [1984, 1984, 1, 512]
    - [322, 29.6]
  - - [192, 64, 1, 1024]
    - [348, 1.02]
  - - [448, 64, 1, 1024]
    - [288, 2.31]
  - - [704, 64, 1, 1024]
    - [284, 3.46]
  - - [960, 64, 1, 1024]
    - [280, 4.67]
  - - [1216, 64, 1, 1024]
    - [394, 5.51]
  - - [1472, 64, 1, 1024]
    - [394, 6.51]
  - - [1728, 64, 1, 1024]
    - [207, 7.63]
  - - [1984, 64, 1, 1024]
    - [207, 8.8]
  - - [64, 192, 1, 1024]
    - [355, 0.99]
  - - [192, 192, 1, 1024]
    - [313, 2.81]
  - - [320, 192, 1, 1024]
    - [303, 4.3]
  - - [448, 192, 1, 1024]
    - [297, 5.92]
  - - [576, 192, 1, 1024]
    - [315, 7.66]
  - - [704, 192, 1, 1024]
    - [298, 8.65]
  - - [832, 192, 1, 1024]
    - [300, 10.1]
  - - [960, 192, 1, 1024]
    - [303, 11.66]
  - - [1088, 192, 1, 1024]
    - [303, 12.95]
  - - [1216, 192, 1, 1024]
    - [303, 14.51]
  - - [1344, 192, 1, 1024]
    - [297, 15.9]
  - - [1472, 192, 1, 1024]
    - [303, 15.18]
  - - [1600, 192, 1, 1024]
    - [315, 15.94]
  - - [1728, 192, 1, 1024]
    - [297, 17.32]
  - - [1856, 192, 1, 1024]
    - [297, 18.55]
  - - [1984, 192, 1, 1024]
    - [303, 19.89]
  - - [192, 320, 1, 1024]
    - [122, 4.39]
  - - [448, 320, 1, 1024]
    - [300, 9.14]
  - - [704, 320, 1, 1024]
    - [303, 14.14]
  - - [960, 320, 1, 1024]
    - [207, 16.3]
  - - [1216, 320, 1, 1024]
    - [303, 20.51]
  - - [1472, 320, 1, 1024]
    - [303, 21.42]
  - - [1728, 320, 1, 1024]
    - [174, 21.64]
  - - [1984, 320, 1, 1024]
    - [303, 25.02]
  - - [64, 448, 1, 1024]
    - [280, 2.3]
  - - [192, 448, 1, 1024]
    - [207, 6.07]
  - - [320, 448, 1, 1024]
    - [303, 9.12]
  - - [448, 448, 1, 1024]
    - [303, 12.65]
  - - [576, 448, 1, 1024]
    - [303, 15.89]
  - - [704, 448, 1, 1024]
    - [320, 16.35]
  - - [832, 448, 1, 1024]
    - [303, 19.58]
  - - [960, 448, 1, 1024]
    - [330, 19.13]
  - - [1088, 448, 1, 1024]
    - [300, 21.77]
  - - [1216, 448, 1, 1024]
    - [174, 21.58]
  - - [1344, 448, 1, 1024]
    - [303, 23.24]
  - - [1472, 448, 1, 1024]
    - [332, 24.2]
  - - [1600, 448, 1, 1024]
    - [375, 24.0]
  - - [1728, 448, 1, 1024]
    - [243, 26.26]
  - - [1856, 448, 1, 1024]
    - [243, 25.66]
  - - [1984, 448, 1, 1024]
    - [243, 27.16]
  - - [192, 576, 1, 1024]
    - [297, 7.68]
  - - [448, 576, 1, 1024]
    - [303, 15.79]
  - - [704, 576, 1, 1024]
    - [297, 18.33]
  - - [960, 576, 1, 1024]
    - [174, 22.45]
  - - [1216, 576, 1, 1024]
    - [176, 25.62]
  - - [1472, 576, 1, 1024]
    - [174, 26.66]
  - - [1728, 576, 1, 1024]
    - [330, 27.29]
  - - [1984, 576, 1, 1024]
    - [243, 29.69]
  - - [64, 704, 1, 1024]
    - [282, 3.48]
  - - [192, 704, 1, 1024]
    - [303, 8.79]
  - - [320, 704, 1, 1024]
    - [300, 13.9]
  - - [448, 704, 1, 1024]
    - [297, 16.95]
  - - [576, 704, 1, 1024]
    - [303, 18.85]
  - - [704, 704, 1, 1024]
    - [297, 22.36]
  - - [832, 704, 1, 1024]
    - [297, 22.76]
  - - [960, 704, 1, 1024]
    - [174, 24.42]
  - - [1088, 704, 1, 1024]
    - [176, 26.91]
  - - [1216, 704, 1, 1024]
    - [176, 27.05]
  - - [1344, 704, 1, 1024]
    - [176, 27.33]
  - - [1472, 704, 1, 1024]
    - [207, 29.28]
  - - [1600, 704, 1, 1024]
    - [243, 29.52]
  - - [1728, 704, 1, 1024]
    - [303, 29.04]
  - - [1856, 704, 1, 1024]
    - [243, 30.92]
  - - [1984, 704, 1, 1024]
    - [243, 30.96]
  - - [192, 832, 1, 1024]
    - [303, 10.22]
  - - [448, 832, 1, 1024]
    - [186, 19.51]
  - - [704, 832, 1, 1024]
    - [174, 23.72]
  - - [960, 832, 1, 1024]
    - [176, 25.75]
  - - [1216, 832, 1, 1024]
    - [207, 28.79]
  - - [1472, 832, 1, 1024]
    - [243, 28.68]
  - - [1728, 832, 1, 1024]
    - [243, 31.48]
  - - [1984, 832, 1, 1024]
    - [243, 32.18]
  - - [64, 960, 1, 1024]
    - [282, 4.59]
  - - [192, 960, 1, 1024]
    - [303, 11.68]
  - - [320, 960, 1, 1024]
    - [297, 16.04]
  - - [448, 960, 1, 1024]
    - [174, 19.79]
  - - [576, 960, 1, 1024]
    - [174, 23.52]
  - - [704, 960, 1, 1024]
    - [273, 24.33]
  - - [832, 960, 1, 1024]
    - [303, 25.4]
  - - [960, 960, 1, 1024]
    - [276, 26.94]
  - - [1088, 960, 1, 1024]
    - [243, 29.51]
  - - [1216, 960, 1, 1024]
    - [303, 30.07]
  - - [1344, 960, 1, 1024]
    - [243, 30.21]
  - - [1472, 960, 1, 1024]
    - [243, 30.92]
  - - [1600, 960, 1, 1024]
    - [303, 31.96]
  - - [1728, 960, 1, 1024]
    - [243, 31.77]
  - - [1856, 960, 1, 1024]
    - [303, 32.74]
  - - [1984, 960, 1, 1024]
    - [322, 32.71]
  - - [192, 1088, 1, 1024]
    - [303, 13.14]
  - - [448, 1088, 1, 1024]
    - [297, 22.14]
  - - [704, 1088, 1, 1024]
    - [176, 27.2]
  - - [960, 1088, 1, 1024]
    - [300, 28.92]
  - - [1216, 1088, 1, 1024]
    - [375, 28.8]
  - - [1472, 1088, 1, 1024]
    - [303, 30.93]
  - - [1728, 1088, 1, 1024]
    - [322, 32.34]
  - - [1984, 1088, 1, 1024]
    - [273, 33.96]
  - - [64, 1216, 1, 1024]
    - [303, 5.48]
  - - [192, 1216, 1, 1024]
    - [338, 14.01]
  - - [320, 1216, 1, 1024]
    - [243, 20.4]
  - - [448, 1216, 1, 1024]
    - [174, 23.28]
  - - [576, 1216, 1, 1024]
    - [273, 26.78]
  - - [704, 1216, 1, 1024]
    - [176, 26.98]
  - - [832, 1216, 1, 1024]
    - [243, 28.53]
  - - [960, 1216, 1, 1024]
    - [276, 31.1]
  - - [1088, 1216, 1, 1024]
    - [243, 30.07]
  - - [1216, 1216, 1, 1024]
    - [226, 33.52]
  - - [1344, 1216, 1, 1024]
    - [276, 31.43]
  - - [1472, 1216, 1, 1024]
    - [265, 32.58]
  - - [1600, 1216, 1, 1024]
    - [332, 34.46]
  - - [1728, 1216, 1, 1024]
    - [332, 33.69]
  - - [1856, 1216, 1, 1024]
    - [273, 33.41]
  - - [1984, 1216, 1, 1024]
    - [230, 35.45]
  - - [192, 1344, 1, 1024]
    - [320, 15.38]
  - - [448, 1344, 1, 1024]
    - [174, 24.92]
  - - [704, 1344, 1, 1024]
    - [332, 28.75]
  - - [960, 1344, 1, 1024]
    - [243, 30.52]
  - - [1216, 1344, 1, 1024]
    - [243, 32.13]
  - - [1472, 1344, 1, 1024]
    - [276, 33.81]
  - - [1728, 1344, 1, 1024]
    - [243, 35.1]
  - - [1984, 1344, 1, 1024]
    - [265, 34.52]
  - - [64, 1472, 1, 1024]
    - [298, 6.55]
  - - [192, 1472, 1, 1024]
    - [297, 15.3]
  - - [320, 1472, 1, 1024]
    - [332, 20.9]
  - - [448, 1472, 1, 1024]
    - [332, 23.67]
  - - [576, 1472, 1, 1024]
    - [300, 26.09]
  - - [704, 1472, 1, 1024]
    - [207, 28.72]
  - - [832, 1472, 1, 1024]
    - [273, 30.46]
  - - [960, 1472, 1, 1024]
    - [303, 30.62]
  - - [1088, 1472, 1, 1024]
    - [303, 30.6]
  - - [1216, 1472, 1, 1024]
    - [207, 32.09]
  - - [1344, 1472, 1, 1024]
    - [273, 33.92]
  - - [1472, 1472, 1, 1024]
    - [322, 33.8]
  - - [1600, 1472, 1, 1024]
    - [322, 34.19]
  - - [1728, 1472, 1, 1024]
    - [303, 34.5]
  - - [1856, 1472, 1, 1024]
    - [243, 36.15]
  - - [1984, 1472, 1, 1024]
    - [243, 35.46]
  - - [192, 1600, 1, 1024]
    - [207, 16.2]
  - - [448, 1600, 1, 1024]
    - [273, 25.06]
  - - [704, 1600, 1, 1024]
    - [322, 29.17]
  - - [960, 1600, 1, 1024]
    - [303, 31.24]
  - - [1216, 1600, 1, 1024]
    - [322, 32.49]
  - - [1472, 1600, 1, 1024]
    - [322, 35.1]
  - - [1728, 1600, 1, 1024]
    - [243, 35.06]
  - - [1984, 1600, 1, 1024]
    - [303, 35.48]
  - - [64, 1728, 1, 1024]
    - [303, 7.59]
  - - [192, 1728, 1, 1024]
    - [187, 17.01]
  - - [320, 1728, 1, 1024]
    - [174, 22.16]
  - - [448, 1728, 1, 1024]
    - [207, 25.55]
  - - [576, 1728, 1, 1024]
    - [303, 28.29]
  - - [704, 1728, 1, 1024]
    - [303, 28.84]
  - - [832, 1728, 1, 1024]
    - [243, 31.18]
  - - [960, 1728, 1, 1024]
    - [215, 32.01]
  - - [1088, 1728, 1, 1024]
    - [215, 32.25]
  - - [1216, 1728, 1, 1024]
    - [243, 32.7]
  - - [1344, 1728, 1, 1024]
    - [243, 34.21]
  - - [1472, 1728, 1, 1024]
    - [243, 34.87]
  - - [1600, 1728, 1, 1024]
    - [243, 34.97]
  - - [1728, 1728, 1, 1024]
    - [243, 36.43]
  - - [1856, 1728, 1, 1024]
    - [243, 35.54]
  - - [1984, 1728, 1, 1024]
    - [215, 36.07]
  - - [192, 1856, 1, 1024]
    - [303, 18.78]
  - - [448, 1856, 1, 1024]
    - [297, 25.43]
  - - [704, 1856, 1, 1024]
    - [243, 30.5]
  - - [960, 1856, 1, 1024]
    - [243, 32.68]
  - - [1216, 1856, 1, 1024]
    - [243, 33.32]
  - - [1472, 1856, 1, 1024]
    - [322, 34.87]
  - - [1728, 1856, 1, 1024]
    - [303, 36.12]
  - - [1984, 1856, 1, 1024]
    - [303, 35.64]
  - - [64, 1984, 1, 1024]
    - [207, 8.7]
  - - [192, 1984, 1, 1024]
    - [303, 20.19]
  - - [320, 1984, 1, 1024]
    - [303, 25.06]
  - - [448, 1984, 1, 1024]
    - [207, 27.35]
  - - [576, 1984, 1, 1024]
    - [303, 29.55]
  - - [704, 1984, 1, 1024]
    - [303, 30.54]
  - - [832, 1984, 1, 1024]
    - [243, 31.83]
  - - [960, 1984, 1, 1024]
    - [303, 32.76]
  - - [1088, 1984, 1, 1024]
    - [243, 33.95]
  - - [1216, 1984, 1, 1024]
    - [375, 32.35]
  - - [1344, 1984, 1, 1024]
    - [322, 34.71]
  - - [1472, 1984, 1, 1024]
    - [243, 35.02]
  - - [1600, 1984, 1, 1024]
    - [215, 35.07]
  - - [1728, 1984, 1, 1024]
    - [215, 35.13]
  - - [1856, 1984, 1, 1024]
    - [215, 35.42]
  - - [1984, 1984, 1, 1024]
    - [303, 36.29]
  - - [192, 64, 1, 2048]
    - [348, 1.69]
  - - [448, 64, 1, 2048]
    - [307, 3.85]
  - - [704, 64, 1, 2048]
    - [288, 5.61]
  - - [960, 64, 1, 2048]
    - [280, 7.51]
  - - [1216, 64, 1, 2048]
    - [394, 8.64]
  - - [1472, 64, 1, 2048]
    - [394, 10.24]
  - - [1728, 64, 1, 2048]
    - [315, 11.42]
  - - [1984, 64, 1, 2048]
    - [207, 13.08]
  - - [64, 192, 1, 2048]
    - [348, 1.68]
  - - [192, 192, 1, 2048]
    - [333, 4.43]
  - - [320, 192, 1, 2048]
    - [207, 6.76]
  - - [448, 192, 1, 2048]
    - [353, 9.13]
  - - [576, 192, 1, 2048]
    - [207, 11.94]
  - - [704, 192, 1, 2048]
    - [298, 12.8]
  - - [832, 192, 1, 2048]
    - [298, 14.61]
  - - [960, 192, 1, 2048]
    - [298, 17.17]
  - - [1088, 192, 1, 2048]
    - [207, 19.41]
  - - [1216, 192, 1, 2048]
    - [297, 21.21]
  - - [1344, 192, 1, 2048]
    - [303, 22.77]
  - - [1472, 192, 1, 2048]
    - [303, 20.96]
  - - [1600, 192, 1, 2048]
    - [303, 22.56]
  - - [1728, 192, 1, 2048]
    - [353, 23.62]
  - - [1856, 192, 1, 2048]
    - [396, 25.11]
  - - [1984, 192, 1, 2048]
    - [186, 27.1]
  - - [192, 320, 1, 2048]
    - [207, 6.73]
  - - [448, 320, 1, 2048]
    - [336, 13.18]
  - - [704, 320, 1, 2048]
    - [320, 19.92]
  - - [960, 320, 1, 2048]
    - [207, 22.57]
  - - [1216, 320, 1, 2048]
    - [303, 27.94]
  - - [1472, 320, 1, 2048]
    - [353, 27.61]
  - - [1728, 320, 1, 2048]
    - [174, 28.28]
  - - [1984, 320, 1, 2048]
    - [320, 31.18]
  - - [64, 448, 1, 2048]
    - [307, 3.87]
  - - [192, 448, 1, 2048]
    - [207, 9.24]
  - - [320, 448, 1, 2048]
    - [303, 13.34]
  - - [448, 448, 1, 2048]
    - [320, 17.93]
  - - [576, 448, 1, 2048]
    - [303, 22.9]
  - - [704, 448, 1, 2048]
    - [303, 23.13]
  - - [832, 448, 1, 2048]
    - [303, 26.63]
  - - [960, 448, 1, 2048]
    - [332, 26.07]
  - - [1088, 448, 1, 2048]
    - [303, 28.57]
  - - [1216, 448, 1, 2048]
    - [303, 27.44]
  - - [1344, 448, 1, 2048]
    - [207, 29.91]
  - - [1472, 448, 1, 2048]
    - [273, 30.41]
  - - [1600, 448, 1, 2048]
    - [243, 30.66]
  - - [1728, 448, 1, 2048]
    - [315, 31.62]
  - - [1856, 448, 1, 2048]
    - [315, 31.82]
  - - [1984, 448, 1, 2048]
    - [300, 33.07]
  - - [192, 576, 1, 2048]
    - [207, 12.07]
  - - [448, 576, 1, 2048]
    - [207, 23.38]
  - - [704, 576, 1, 2048]
    - [297, 24.56]
  - - [960, 576, 1, 2048]
    - [174, 28.45]
  - - [1216, 576, 1, 2048]
    - [174, 32.29]
  - - [1472, 576, 1, 2048]
    - [176, 33.38]
  - - [1728, 576, 1, 2048]
    - [207, 34.63]
  - - [1984, 576, 1, 2048]
    - [207, 35.05]
  - - [64, 704, 1, 2048]
    - [282, 5.6]
  - - [192, 704, 1, 2048]
    - [297, 12.75]
  - - [320, 704, 1, 2048]
    - [303, 20.66]
  - - [448, 704, 1, 2048]
    - [207, 22.93]
  - - [576, 704, 1, 2048]
    - [174, 25.26]
  - - [704, 704, 1, 2048]
    - [297, 29.33]
  - - [832, 704, 1, 2048]
    - [174, 30.45]
  - - [960, 704, 1, 2048]
    - [174, 30.79]
  - - [1088, 704, 1, 2048]
    - [174, 33.72]
  - - [1216, 704, 1, 2048]
    - [176, 33.85]
  - - [1344, 704, 1, 2048]
    - [176, 33.63]
  - - [1472, 704, 1, 2048]
    - [207, 35.72]
  - - [1600, 704, 1, 2048]
    - [207, 35.83]
  - - [1728, 704, 1, 2048]
    - [207, 34.59]
  - - [1856, 704, 1, 2048]
    - [207, 36.47]
  - - [1984, 704, 1, 2048]
    - [243, 36.58]
  - - [192, 832, 1, 2048]
    - [353, 14.51]
  - - [448, 832, 1, 2048]
    - [297, 27.43]
  - - [704, 832, 1, 2048]
    - [174, 29.79]
  - - [960, 832, 1, 2048]
    - [176, 31.92]
  - - [1216, 832, 1, 2048]
    - [176, 34.78]
  - - [1472, 832, 1, 2048]
    - [303, 34.44]
  - - [1728, 832, 1, 2048]
    - [303, 37.33]
  - - [1984, 832, 1, 2048]
    - [303, 37.29]
  - - [64, 960, 1, 2048]
    - [282, 7.21]
  - - [192, 960, 1, 2048]
    - [297, 17.2]
  - - [320, 960, 1, 2048]
    - [303, 22.76]
  - - [448, 960, 1, 2048]
    - [174, 26.4]
  - - [576, 960, 1, 2048]
    - [369, 29.28]
  - - [704, 960, 1, 2048]
    - [332, 30.31]
  - - [832, 960, 1, 2048]
    - [176, 32.18]
  - - [960, 960, 1, 2048]
    - [303, 32.73]
  - - [1088, 960, 1, 2048]
    - [320, 35.56]
  - - [1216, 960, 1, 2048]
    - [243, 36.21]
  - - [1344, 960, 1, 2048]
    - [303, 36.34]
  - - [1472, 960, 1, 2048]
    - [353, 35.69]
  - - [1600, 960, 1, 2048]
    - [207, 38.06]
  - - [1728, 960, 1, 2048]
    - [353, 37.44]
  - - [1856, 960, 1, 2048]
    - [207, 37.18]
  - - [1984, 960, 1, 2048]
    - [320, 37.92]
  - - [192, 1088, 1, 2048]
    - [303, 19.34]
  - - [448, 1088, 1, 2048]
    - [174, 29.06]
  - - [704, 1088, 1, 2048]
    - [174, 33.79]
  - - [960, 1088, 1, 2048]
    - [303, 36.14]
  - - [1216, 1088, 1, 2048]
    - [300, 34.34]
  - - [1472, 1088, 1, 2048]
    - [303, 36.85]
  - - [1728, 1088, 1, 2048]
    - [207, 37.65]
  - - [1984, 1088, 1, 2048]
    - [332, 38.47]
  - - [64, 1216, 1, 2048]
    - [207, 8.41]
  - - [192, 1216, 1, 2048]
    - [303, 21.38]
  - - [320, 1216, 1, 2048]
    - [303, 28.11]
  - - [448, 1216, 1, 2048]
    - [174, 30.53]
  - - [576, 1216, 1, 2048]
    - [273, 34.05]
  - - [704, 1216, 1, 2048]
    - [176, 33.49]
  - - [832, 1216, 1, 2048]
    - [320, 34.84]
  - - [960, 1216, 1, 2048]
    - [226, 36.18]
  - - [1088, 1216, 1, 2048]
    - [207, 34.74]
  - - [1216, 1216, 1, 2048]
    - [226, 39.97]
  - - [1344, 1216, 1, 2048]
    - [332, 37.53]
  - - [1472, 1216, 1, 2048]
    - [243, 37.53]
  - - [1600, 1216, 1, 2048]
    - [332, 41.02]
  - - [1728, 1216, 1, 2048]
    - [276, 38.7]
  - - [1856, 1216, 1, 2048]
    - [332, 38.77]
  - - [1984, 1216, 1, 2048]
    - [332, 41.2]
  - - [192, 1344, 1, 2048]
    - [320, 22.6]
  - - [448, 1344, 1, 2048]
    - [174, 32.72]
  - - [704, 1344, 1, 2048]
    - [273, 34.31]
  - - [960, 1344, 1, 2048]
    - [353, 36.42]
  - - [1216, 1344, 1, 2048]
    - [207, 37.97]
  - - [1472, 1344, 1, 2048]
    - [332, 38.97]
  - - [1728, 1344, 1, 2048]
    - [303, 40.08]
  - - [1984, 1344, 1, 2048]
    - [297, 39.33]
  - - [64, 1472, 1, 2048]
    - [297, 10.14]
  - - [192, 1472, 1, 2048]
    - [297, 20.64]
  - - [320, 1472, 1, 2048]
    - [273, 27.91]
  - - [448, 1472, 1, 2048]
    - [369, 29.9]
  - - [576, 1472, 1, 2048]
    - [207, 33.08]
  - - [704, 1472, 1, 2048]
    - [303, 36.53]
  - - [832, 1472, 1, 2048]
    - [273, 36.24]
  - - [960, 1472, 1, 2048]
    - [338, 36.58]
  - - [1088, 1472, 1, 2048]
    - [297, 36.92]
  - - [1216, 1472, 1, 2048]
    - [303, 37.75]
  - - [1344, 1472, 1, 2048]
    - [332, 38.39]
  - - [1472, 1472, 1, 2048]
    - [297, 38.72]
  - - [1600, 1472, 1, 2048]
    - [375, 39.67]
  - - [1728, 1472, 1, 2048]
    - [207, 39.23]
  - - [1856, 1472, 1, 2048]
    - [375, 40.02]
  - - [1984, 1472, 1, 2048]
    - [207, 39.17]
  - - [192, 1600, 1, 2048]
    - [297, 22.55]
  - - [448, 1600, 1, 2048]
    - [273, 31.72]
  - - [704, 1600, 1, 2048]
    - [303, 35.42]
  - - [960, 1600, 1, 2048]
    - [300, 37.15]
  - - [1216, 1600, 1, 2048]
    - [207, 39.09]
  - - [1472, 1600, 1, 2048]
    - [303, 40.16]
  - - [1728, 1600, 1, 2048]
    - [207, 39.15]
  - - [1984, 1600, 1, 2048]
    - [320, 39.63]
  - - [64, 1728, 1, 2048]
    - [315, 11.92]
  - - [192, 1728, 1, 2048]
    - [207, 24.44]
  - - [320, 1728, 1, 2048]
    - [215, 27.19]
  - - [448, 1728, 1, 2048]
    - [207, 32.68]
  - - [576, 1728, 1, 2048]
    - [207, 33.93]
  - - [704, 1728, 1, 2048]
    - [320, 34.03]
  - - [832, 1728, 1, 2048]
    - [338, 36.31]
  - - [960, 1728, 1, 2048]
    - [186, 37.28]
  - - [1088, 1728, 1, 2048]
    - [303, 36.86]
  - - [1216, 1728, 1, 2048]
    - [303, 38.63]
  - - [1344, 1728, 1, 2048]
    - [243, 39.37]
  - - [1472, 1728, 1, 2048]
    - [207, 40.0]
  - - [1600, 1728, 1, 2048]
    - [215, 39.43]
  - - [1728, 1728, 1, 2048]
    - [265, 39.62]
  - - [1856, 1728, 1, 2048]
    - [215, 40.15]
  - - [1984, 1728, 1, 2048]
    - [339, 40.92]
  - - [192, 1856, 1, 2048]
    - [303, 25.74]
  - - [448, 1856, 1, 2048]
    - [303, 32.59]
  - - [704, 1856, 1, 2048]
    - [297, 36.4]
  - - [960, 1856, 1, 2048]
    - [207, 38.19]
  - - [1216, 1856, 1, 2048]
    - [303, 38.47]
  - - [1472, 1856, 1, 2048]
    - [303, 40.0]
  - - [1728, 1856, 1, 2048]
    - [375, 39.31]
  - - [1984, 1856, 1, 2048]
    - [353, 40.85]
  - - [64, 1984, 1, 2048]
    - [303, 13.57]
  - - [192, 1984, 1, 2048]
    - [303, 27.57]
  - - [320, 1984, 1, 2048]
    - [300, 31.51]
  - - [448, 1984, 1, 2048]
    - [207, 33.98]
  - - [576, 1984, 1, 2048]
    - [303, 35.87]
  - - [704, 1984, 1, 2048]
    - [303, 36.6]
  - - [832, 1984, 1, 2048]
    - [303, 37.87]
  - - [960, 1984, 1, 2048]
    - [303, 37.77]
  - - [1088, 1984, 1, 2048]
    - [303, 38.35]
  - - [1216, 1984, 1, 2048]
    - [303, 39.45]
  - - [1344, 1984, 1, 2048]
    - [303, 38.34]
  - - [1472, 1984, 1, 2048]
    - [207, 39.64]
  - - [1600, 1984, 1, 2048]
    - [303, 39.89]
  - - [1728, 1984, 1, 2048]
    - [339, 41.82]
  - - [1856, 1984, 1, 2048]
    - [297, 40.42]
  - - [1984, 1984, 1, 2048]
    - [339, 42.08]
  - - [192, 64, 1, 4096]
    - [355, 2.55]
  - - [448, 64, 1, 4096]
    - [284, 5.78]
  - - [704, 64, 1, 4096]
    - [280, 8.4]
  - - [960, 64, 1, 4096]
    - [280, 11.1]
  - - [1216, 64, 1, 4096]
    - [394, 11.95]
  - - [1472, 64, 1, 4096]
    - [394, 14.12]
  - - [1728, 64, 1, 4096]
    - [207, 15.39]
  - - [1984, 64, 1, 4096]
    - [207, 17.86]
  - - [64, 192, 1, 4096]
    - [307, 2.57]
  - - [192, 192, 1, 4096]
    - [294, 6.36]
  - - [320, 192, 1, 4096]
    - [207, 9.22]
  - - [448, 192, 1, 4096]
    - [207, 13.03]
  - - [576, 192, 1, 4096]
    - [353, 15.95]
  - - [704, 192, 1, 4096]
    - [298, 16.75]
  - - [832, 192, 1, 4096]
    - [318, 19.57]
  - - [960, 192, 1, 4096]
    - [315, 21.95]
  - - [1088, 192, 1, 4096]
    - [207, 24.32]
  - - [1216, 192, 1, 4096]
    - [207, 27.99]
  - - [1344, 192, 1, 4096]
    - [207, 30.33]
  - - [1472, 192, 1, 4096]
    - [207, 25.48]
  - - [1600, 192, 1, 4096]
    - [353, 28.08]
  - - [1728, 192, 1, 4096]
    - [303, 29.25]
  - - [1856, 192, 1, 4096]
    - [207, 31.57]
  - - [1984, 192, 1, 4096]
    - [303, 33.44]
  - - [192, 320, 1, 4096]
    - [207, 9.37]
  - - [448, 320, 1, 4096]
    - [303, 17.63]
  - - [704, 320, 1, 4096]
    - [207, 27.11]
  - - [960, 320, 1, 4096]
    - [300, 27.0]
  - - [1216, 320, 1, 4096]
    - [297, 34.04]
  - - [1472, 320, 1, 4096]
    - [186, 33.16]
  - - [1728, 320, 1, 4096]
    - [207, 32.52]
  - - [1984, 320, 1, 4096]
    - [353, 37.15]
  - - [64, 448, 1, 4096]
    - [280, 5.8]
  - - [192, 448, 1, 4096]
    - [315, 12.75]
  - - [320, 448, 1, 4096]
    - [207, 17.76]
  - - [448, 448, 1, 4096]
    - [303, 23.61]
  - - [576, 448, 1, 4096]
    - [207, 30.19]
  - - [704, 448, 1, 4096]
    - [207, 28.64]
  - - [832, 448, 1, 4096]
    - [207, 33.82]
  - - [960, 448, 1, 4096]
    - [207, 30.89]
  - - [1088, 448, 1, 4096]
    - [207, 34.47]
  - - [1216, 448, 1, 4096]
    - [369, 32.44]
  - - [1344, 448, 1, 4096]
    - [320, 35.35]
  - - [1472, 448, 1, 4096]
    - [332, 34.68]
  - - [1600, 448, 1, 4096]
    - [368, 35.08]
  - - [1728, 448, 1, 4096]
    - [300, 37.28]
  - - [1856, 448, 1, 4096]
    - [300, 36.0]
  - - [1984, 448, 1, 4096]
    - [315, 38.44]
  - - [192, 576, 1, 4096]
    - [315, 16.24]
  - - [448, 576, 1, 4096]
    - [207, 30.52]
  - - [704, 576, 1, 4096]
    - [297, 29.41]
  - - [960, 576, 1, 4096]
    - [174, 32.96]
  - - [1216, 576, 1, 4096]
    - [174, 36.92]
  - - [1472, 576, 1, 4096]
    - [376, 37.18]
  - - [1728, 576, 1, 4096]
    - [353, 38.91]
  - - [1984, 576, 1, 4096]
    - [207, 39.37]
  - - [64, 704, 1, 4096]
    - [313, 7.61]
  - - [192, 704, 1, 4096]
    - [207, 16.88]
  - - [320, 704, 1, 4096]
    - [315, 26.79]
  - - [448, 704, 1, 4096]
    - [320, 28.21]
  - - [576, 704, 1, 4096]
    - [207, 29.89]
  - - [704, 704, 1, 4096]
    - [353, 34.87]
  - - [832, 704, 1, 4096]
    - [174, 34.67]
  - - [960, 704, 1, 4096]
    - [174, 35.21]
  - - [1088, 704, 1, 4096]
    - [174, 38.53]
  - - [1216, 704, 1, 4096]
    - [376, 38.77]
  - - [1344, 704, 1, 4096]
    - [176, 38.21]
  - - [1472, 704, 1, 4096]
    - [186, 39.89]
  - - [1600, 704, 1, 4096]
    - [353, 38.99]
  - - [1728, 704, 1, 4096]
    - [207, 39.65]
  - - [1856, 704, 1, 4096]
    - [336, 39.95]
  - - [1984, 704, 1, 4096]
    - [303, 40.48]
  - - [192, 832, 1, 4096]
    - [207, 19.56]
  - - [448, 832, 1, 4096]
    - [303, 32.37]
  - - [704, 832, 1, 4096]
    - [174, 34.36]
  - - [960, 832, 1, 4096]
    - [303, 36.05]
  - - [1216, 832, 1, 4096]
    - [207, 39.54]
  - - [1472, 832, 1, 4096]
    - [207, 38.82]
  - - [1728, 832, 1, 4096]
    - [353, 41.61]
  - - [1984, 832, 1, 4096]
    - [303, 41.93]
  - - [64, 960, 1, 4096]
    - [377, 9.21]
  - - [192, 960, 1, 4096]
    - [207, 22.39]
  - - [320, 960, 1, 4096]
    - [318, 27.96]
  - - [448, 960, 1, 4096]
    - [207, 30.41]
  - - [576, 960, 1, 4096]
    - [174, 35.49]
  - - [704, 960, 1, 4096]
    - [276, 34.92]
  - - [832, 960, 1, 4096]
    - [176, 36.94]
  - - [960, 960, 1, 4096]
    - [378, 38.61]
  - - [1088, 960, 1, 4096]
    - [303, 40.01]
  - - [1216, 960, 1, 4096]
    - [353, 40.13]
  - - [1344, 960, 1, 4096]
    - [186, 40.98]
  - - [1472, 960, 1, 4096]
    - [336, 39.92]
  - - [1600, 960, 1, 4096]
    - [303, 40.8]
  - - [1728, 960, 1, 4096]
    - [353, 40.21]
  - - [1856, 960, 1, 4096]
    - [303, 40.8]
  - - [1984, 960, 1, 4096]
    - [186, 41.33]
  - - [192, 1088, 1, 4096]
    - [207, 24.58]
  - - [448, 1088, 1, 4096]
    - [207, 34.83]
  - - [704, 1088, 1, 4096]
    - [174, 39.72]
  - - [960, 1088, 1, 4096]
    - [320, 39.71]
  - - [1216, 1088, 1, 4096]
    - [207, 38.46]
  - - [1472, 1088, 1, 4096]
    - [186, 40.37]
  - - [1728, 1088, 1, 4096]
    - [320, 40.39]
  - - [1984, 1088, 1, 4096]
    - [330, 44.72]
  - - [64, 1216, 1, 4096]
    - [315, 11.66]
  - - [192, 1216, 1, 4096]
    - [315, 27.46]
  - - [320, 1216, 1, 4096]
    - [303, 34.7]
  - - [448, 1216, 1, 4096]
    - [174, 34.36]
  - - [576, 1216, 1, 4096]
    - [332, 38.13]
  - - [704, 1216, 1, 4096]
    - [176, 37.15]
  - - [832, 1216, 1, 4096]
    - [303, 39.84]
  - - [960, 1216, 1, 4096]
    - [276, 41.5]
  - - [1088, 1216, 1, 4096]
    - [226, 41.58]
  - - [1216, 1216, 1, 4096]
    - [226, 45.83]
  - - [1344, 1216, 1, 4096]
    - [332, 44.01]
  - - [1472, 1216, 1, 4096]
    - [320, 44.22]
  - - [1600, 1216, 1, 4096]
    - [273, 45.7]
  - - [1728, 1216, 1, 4096]
    - [332, 45.95]
  - - [1856, 1216, 1, 4096]
    - [207, 44.69]
  - - [1984, 1216, 1, 4096]
    - [276, 46.66]
  - - [192, 1344, 1, 4096]
    - [315, 30.02]
  - - [448, 1344, 1, 4096]
    - [174, 37.47]
  - - [704, 1344, 1, 4096]
    - [332, 38.31]
  - - [960, 1344, 1, 4096]
    - [330, 40.96]
  - - [1216, 1344, 1, 4096]
    - [353, 43.98]
  - - [1472, 1344, 1, 4096]
    - [273, 44.28]
  - - [1728, 1344, 1, 4096]
    - [303, 45.94]
  - - [1984, 1344, 1, 4096]
    - [303, 45.06]
  - - [64, 1472, 1, 4096]
    - [315, 13.93]
  - - [192, 1472, 1, 4096]
    - [207, 26.22]
  - - [320, 1472, 1, 4096]
    - [207, 34.99]
  - - [448, 1472, 1, 4096]
    - [174, 37.21]
  - - [576, 1472, 1, 4096]
    - [297, 39.62]
  - - [704, 1472, 1, 4096]
    - [353, 42.51]
  - - [832, 1472, 1, 4096]
    - [273, 42.2]
  - - [960, 1472, 1, 4096]
    - [336, 42.39]
  - - [1088, 1472, 1, 4096]
    - [297, 42.97]
  - - [1216, 1472, 1, 4096]
    - [320, 44.64]
  - - [1344, 1472, 1, 4096]
    - [303, 43.77]
  - - [1472, 1472, 1, 4096]
    - [396, 44.91]
  - - [1600, 1472, 1, 4096]
    - [207, 45.76]
  - - [1728, 1472, 1, 4096]
    - [303, 45.44]
  - - [1856, 1472, 1, 4096]
    - [207, 46.36]
  - - [1984, 1472, 1, 4096]
    - [303, 45.64]
  - - [192, 1600, 1, 4096]
    - [297, 28.68]
  - - [448, 1600, 1, 4096]
    - [176, 38.56]
  - - [704, 1600, 1, 4096]
    - [207, 42.09]
  - - [960, 1600, 1, 4096]
    - [396, 43.86]
  - - [1216, 1600, 1, 4096]
    - [207, 45.3]
  - - [1472, 1600, 1, 4096]
    - [320, 45.92]
  - - [1728, 1600, 1, 4096]
    - [353, 45.5]
  - - [1984, 1600, 1, 4096]
    - [398, 44.31]
  - - [64, 1728, 1, 4096]
    - [303, 16.62]
  - - [192, 1728, 1, 4096]
    - [297, 31.1]
  - - [320, 1728, 1, 4096]
    - [174, 34.7]
  - - [448, 1728, 1, 4096]
    - [207, 39.96]
  - - [576, 1728, 1, 4096]
    - [207, 41.84]
  - - [704, 1728, 1, 4096]
    - [303, 42.07]
  - - [832, 1728, 1, 4096]
    - [187, 43.14]
  - - [960, 1728, 1, 4096]
    - [207, 44.81]
  - - [1088, 1728, 1, 4096]
    - [320, 44.12]
  - - [1216, 1728, 1, 4096]
    - [207, 43.94]
  - - [1344, 1728, 1, 4096]
    - [353, 45.42]
  - - [1472, 1728, 1, 4096]
    - [303, 45.69]
  - - [1600, 1728, 1, 4096]
    - [320, 44.84]
  - - [1728, 1728, 1, 4096]
    - [375, 45.6]
  - - [1856, 1728, 1, 4096]
    - [297, 44.77]
  - - [1984, 1728, 1, 4096]
    - [339, 46.87]
  - - [192, 1856, 1, 4096]
    - [396, 33.03]
  - - [448, 1856, 1, 4096]
    - [207, 39.42]
  - - [704, 1856, 1, 4096]
    - [320, 43.55]
  - - [960, 1856, 1, 4096]
    - [353, 44.69]
  - - [1216, 1856, 1, 4096]
    - [297, 44.79]
  - - [1472, 1856, 1, 4096]
    - [320, 45.33]
  - - [1728, 1856, 1, 4096]
    - [243, 44.31]
  - - [1984, 1856, 1, 4096]
    - [330, 44.45]
  - - [64, 1984, 1, 4096]
    - [297, 18.37]
  - - [192, 1984, 1, 4096]
    - [207, 34.88]
  - - [320, 1984, 1, 4096]
    - [353, 39.0]
  - - [448, 1984, 1, 4096]
    - [297, 40.99]
  - - [576, 1984, 1, 4096]
    - [353, 42.4]
  - - [704, 1984, 1, 4096]
    - [207, 43.59]
  - - [832, 1984, 1, 4096]
    - [186, 44.15]
  - - [960, 1984, 1, 4096]
    - [353, 44.68]
  - - [1088, 1984, 1, 4096]
    - [353, 45.29]
  - - [1216, 1984, 1, 4096]
    - [339, 45.25]
  - - [1344, 1984, 1, 4096]
    - [303, 45.7]
  - - [1472, 1984, 1, 4096]
    - [339, 46.03]
  - - [1600, 1984, 1, 4096]
    - [320, 44.42]
  - - [1728, 1984, 1, 4096]
    - [339, 47.76]
  - - [1856, 1984, 1, 4096]
    - [303, 45.29]
  - - [1984, 1984, 1, 4096]
    - [339, 48.04]
  - - [128, 64, 1, 64]
    - [115, 0.05]
  - - [256, 64, 1, 64]
    - [117, 0.11]
  - - [384, 64, 1, 64]
    - [119, 0.16]
  - - [512, 64, 1, 64]
    - [121, 0.21]
  - - [640, 64, 1, 64]
    - [123, 0.26]
  - - [768, 64, 1, 64]
    - [124, 0.31]
  - - [896, 64, 1, 64]
    - [126, 0.37]
  - - [1024, 64, 1, 64]
    - [126, 0.41]
  - - [64, 128, 1, 64]
    - [114, 0.05]
  - - [128, 128, 1, 64]
    - [127, 0.11]
  - - [192, 128, 1, 64]
    - [128, 0.16]
  - - [256, 128, 1, 64]
    - [129, 0.21]
  - - [320, 128, 1, 64]
    - [130, 0.27]
  - - [384, 128, 1, 64]
    - [131, 0.33]
  - - [448, 128, 1, 64]
    - [132, 0.36]
  - - [512, 128, 1, 64]
    - [114, 0.43]
  - - [576, 128, 1, 64]
    - [118, 0.48]
  - - [640, 128, 1, 64]
    - [133, 0.52]
  - - [704, 128, 1, 64]
    - [129, 0.58]
  - - [768, 128, 1, 64]
    - [134, 0.62]
  - - [832, 128, 1, 64]
    - [135, 0.68]
  - - [896, 128, 1, 64]
    - [136, 0.69]
  - - [960, 128, 1, 64]
    - [137, 0.74]
  - - [1024, 128, 1, 64]
    - [138, 0.83]
  - - [128, 192, 1, 64]
    - [140, 0.16]
  - - [256, 192, 1, 64]
    - [126, 0.32]
  - - [384, 192, 1, 64]
    - [143, 0.48]
  - - [512, 192, 1, 64]
    - [144, 0.62]
  - - [640, 192, 1, 64]
    - [146, 0.77]
  - - [768, 192, 1, 64]
    - [148, 0.86]
  - - [896, 192, 1, 64]
    - [149, 1.07]
  - - [1024, 192, 1, 64]
    - [150, 1.16]
  - - [64, 256, 1, 64]
    - [151, 0.11]
  - - [128, 256, 1, 64]
    - [152, 0.21]
  - - [192, 256, 1, 64]
    - [153, 0.31]
  - - [256, 256, 1, 64]
    - [154, 0.4]
  - - [320, 256, 1, 64]
    - [155, 0.51]
  - - [384, 256, 1, 64]
    - [156, 0.61]
  - - [448, 256, 1, 64]
    - [157, 0.72]
  - - [512, 256, 1, 64]
    - [158, 0.8]
  - - [576, 256, 1, 64]
    - [159, 0.89]
  - - [640, 256, 1, 64]
    - [160, 1.0]
  - - [704, 256, 1, 64]
    - [161, 1.09]
  - - [768, 256, 1, 64]
    - [162, 1.19]
  - - [832, 256, 1, 64]
    - [163, 1.28]
  - - [896, 256, 1, 64]
    - [138, 1.36]
  - - [960, 256, 1, 64]
    - [164, 1.49]
  - - [1024, 256, 1, 64]
    - [165, 1.54]
  - - [128, 320, 1, 64]
    - [167, 0.27]
  - - [256, 320, 1, 64]
    - [168, 0.53]
  - - [384, 320, 1, 64]
    - [144, 0.76]
  - - [512, 320, 1, 64]
    - [171, 1.0]
  - - [640, 320, 1, 64]
    - [173, 1.23]
  - - [768, 320, 1, 64]
    - [149, 1.5]
  - - [896, 320, 1, 64]
    - [174, 1.62]
  - - [1024, 320, 1, 64]
    - [176, 1.92]
  - - [64, 384, 1, 64]
    - [177, 0.16]
  - - [128, 384, 1, 64]
    - [178, 0.32]
  - - [192, 384, 1, 64]
    - [179, 0.48]
  - - [256, 384, 1, 64]
    - [180, 0.63]
  - - [320, 384, 1, 64]
    - [135, 0.78]
  - - [384, 384, 1, 64]
    - [181, 0.91]
  - - [448, 384, 1, 64]
    - [149, 1.07]
  - - [512, 384, 1, 64]
    - [182, 1.22]
  - - [576, 384, 1, 64]
    - [149, 1.37]
  - - [640, 384, 1, 64]
    - [183, 1.52]
  - - [704, 384, 1, 64]
    - [184, 1.61]
  - - [768, 384, 1, 64]
    - [185, 1.76]
  - - [832, 384, 1, 64]
    - [150, 1.9]
  - - [896, 384, 1, 64]
    - [186, 2.05]
  - - [960, 384, 1, 64]
    - [187, 2.12]
  - - [1024, 384, 1, 64]
    - [155, 2.27]
