projects/hipblaslt/library/src/amd_detail/rocblaslt/src/Tensile/Logic/asm_full/gfx1201/GridBased/gfx1201_Cijk_Ailk_Bjlk_B8F8B8S_BH_Bias_SHB_HA_S_SAB_SCD_SAV_UserArgs.yaml
- {MinimumRequiredVersion: 5.0.0}
- gfx1201
- gfx1201
- [Device 73f0]
    SolutionIndex: 0
    SolutionNameMin: Cijk_Ailk_Bjlk_B8F8B8S_BH_Bias_SHB_HA_S_SAB_SCD_SAV_UserArgs_MT16x64x64_MI16x16x1_CMS_SN_LDSB0_AFC1_AG0_AFEM1_AFEM1_ASEM1_CLR1_CADS0_DTLA0_DTLB0_DTVA0_DTVB0_DTVSM0_DPLBn1_EPS0_ELFLR0_EMLLn1_FDSI0_GRPM1_GRVWA8_GRVWB16_GSU1_GSUAMB_GSUC0_GSUWGMRR0_GLS0_ISA1201_IU1_LDSTI0_LBSPPA128_LBSPPB512_LBSPPM0_LPA16_LPB16_LPM0_LRVW8_LWPMn1_MIAV1_MIWT1_1_MO40_MGRIPMn1_NTn1_NTA0_NTB0_NTC0_NTD0_NTM0_NEPBS0_NLCA1_NLCB1_ONLL0_PGR1_PLR3_PKA0_SGROBn1_SIA3_SS1_SU32_SUM0_SUS256_SPO0_SRVW0_SSO0_SVW1_SK0_SKFTR0_SKXCCM0_SGRO0_TIN0_TLDS0_TLDSM1_ULSGRO0_USL1_UIOFGRO0_USFGROn1_VSn1_VWA1_VWB1_WSGRA0_WSGRB0_WS32_WG16_8_1_WGM8_WGMXCC1_WGMXCCG0
    SolutionIndex: 1
    SolutionNameMin: Cijk_Ailk_Bjlk_B8F8B8S_BH_Bias_SHB_HA_S_SAB_SCD_SAV_UserArgs_MT32x32x32_MI16x16x1_SN_LDSB1_AFC1_AG0_AFEM1_AFEM1_ASEM1_CLR1_CADS0_DTLA0_DTLB0_DTVA0_DTVB0_DTVSM0_DPLBn1_EPS1_ELFLR0_EMLLn1_FDSI0_GRPM1_GRVWA4_GRVWB1_GSU1_GSUAMB_GSUC0_GSUWGMRR0_GLS0_ISA1201_IU2_K1_LDSTI0_LBSPPA256_LBSPPB256_LBSPPM0_LPA16_LPB16_LPM0_LRVW8_LWPMn1_MIAV1_MIWT1_1_MO40_MGRIPMn1_NTn1_NTA0_NTB0_NTC0_NTD0_NTM0_NEPBS0_NLCA1_NLCB1_ONLL0_PGR1_PLR1_PKA0_SGROBn1_SIA2_SS1_SU32_SUM0_SUS256_SPO0_SRVW0_SSO0_SVW1_SK0_SKFTR0_SKXCCM0_SGRO0_TIN0_TLDS0_TLDSM1_ULSGRO0_USL1_UIOFGRO0_USFGROn1_VSn1_VWA1_VWB1_WSGRA0_WSGRB0_WS32_WG32_4_1_WGM8_WGMXCC1_WGMXCCGn1
    SolutionIndex: 2
    SolutionNameMin: Cijk_Ailk_Bjlk_B8F8B8S_BH_Bias_SHB_HA_S_SAB_SCD_SAV_UserArgs_MT32x32x32_MI16x16x1_SN_LDSB1_AFC1_AG0_AFEM1_AFEM1_ASEM1_CLR1_CADS0_DTLA0_DTLB0_DTVA0_DTVB0_DTVSM0_DPLBn1_EPS1_ELFLR0_EMLLn1_FDSI0_GRPM1_GRVWA4_GRVWB8_GSU1_GSUAMB_GSUC0_GSUWGMRR0_GLS0_ISA1201_IU2_K1_LDSTI0_LBSPPA256_LBSPPB256_LBSPPM0_LPA16_LPB16_LPM0_LRVW8_LWPMn1_MIAV1_MIWT1_1_MO40_MGRIPMn1_NTn1_NTA0_NTB0_NTC0_NTD0_NTM0_NEPBS0_NLCA1_NLCB1_ONLL0_PGR1_PLR1_PKA0_SGROBn1_SIA2_SS0_SU32_SUM0_SUS256_SPO0_SRVW0_SSO0_SVW8_SK0_SKFTR0_SKXCCM0_SGRO0_TIN0_TLDS0_TLDSM1_ULSGRO0_USL1_UIOFGRO0_USFGROn1_VSn1_VWA1_VWB1_WSGRA0_WSGRB0_WS32_WG32_4_1_WGM8_WGMXCC1_WGMXCCGn1
    SolutionIndex: 3
    SolutionNameMin: Cijk_Ailk_Bjlk_B8F8B8S_BH_Bias_SHB_HA_S_SAB_SCD_SAV_UserArgs_MT32x32x64_MI16x16x1_SN_LDSB1_AFC1_AG0_AFEM1_AFEM1_ASEM1_CLR1_CADS0_DTLA0_DTLB0_DTVA0_DTVB0_DTVSM0_DPLBn1_EPS1_ELFLR0_EMLLn1_FDSI0_GRPM1_GRVWA1_GRVWB1_GSU1_GSUAMB_GSUC0_GSUWGMRR0_GLS0_ISA1201_IU4_K1_LDSTI0_LBSPPA256_LBSPPB256_LBSPPM0_LPA16_LPB16_LPM0_LRVW8_LWPMn1_MIAV1_MIWT1_1_MO40_MGRIPMn1_NTn1_NTA0_NTB0_NTC0_NTD0_NTM0_NEPBS0_NLCA1_NLCB1_ONLL0_PGR1_PLR1_PKA0_SGROBn1_SIA2_SS0_SU32_SUM0_SUS256_SPO0_SRVW0_SSO0_SVW8_SK0_SKFTR0_SKXCCM0_SGRO0_TIN0_TLDS0_TLDSM1_ULSGRO0_USL1_UIOFGRO0_USFGROn1_VSn1_VWA1_VWB1_WSGRA0_WSGRB0_WS32_WG32_4_1_WGM8_WGMXCC1_WGMXCCGn1
    SolutionIndex: 4
    SolutionNameMin: Cijk_Ailk_Bjlk_B8F8B8S_BH_Bias_SHB_HA_S_SAB_SCD_SAV_UserArgs_MT32x16x16_MI16x16x1_SN_LDSB1_AFC1_AG0_AFEM1_AFEM1_ASEM1_CLR1_CADS0_DTLA0_DTLB0_DTVA0_DTVB0_DTVSM0_DPLBn1_EPS1_ELFLR0_EMLLn1_FDSI0_GRPM1_GRVWA1_GRVWB1_GSU1_GSUAMB_GSUC0_GSUWGMRR0_GLS0_ISA1201_IU1_K1_LDSTI0_LBSPPA256_LBSPPB128_LBSPPM0_LPA16_LPB16_LPM0_LRVW8_LWPMn1_MIAV1_MIWT1_1_MO40_MGRIPMn1_NTn1_NTA0_NTB0_NTC0_NTD0_NTM0_NEPBS0_NLCA1_NLCB1_ONLL0_PGR1_PLR1_PKA0_SGROBn1_SIA2_SS0_SU32_SUM0_SUS256_SPO0_SRVW0_SSO0_SVW8_SK0_SKFTR0_SKXCCM0_SGRO0_TIN0_TLDS0_TLDSM1_ULSGRO0_USL1_UIOFGRO0_USFGROn1_VSn1_VWA1_VWB1_WSGRA0_WSGRB0_WS32_WG32_2_1_WGM8_WGMXCC1_WGMXCCGn1
    SolutionIndex: 5
    SolutionNameMin: Cijk_Ailk_Bjlk_B8F8B8S_BH_Bias_SHB_HA_S_SAB_SCD_SAV_UserArgs_MT32x32x32_MI16x16x1_SN_LDSB0_AFC1_AG0_AFEM1_AFEM1_ASEM1_CLR1_CADS0_DTLA0_DTLB0_DTVA0_DTVB0_DTVSM0_DPLBn1_EPS0_ELFLR0_EMLLn1_FDSI0_GRPM1_GRVWA1_GRVWB1_GSU1_GSUAMB_GSUC0_GSUWGMRR0_GLS0_ISA1201_IU1_K1_LDSTI0_LBSPPA256_LBSPPB256_LBSPPM0_LPA16_LPB16_LPM0_LRVW8_LWPMn1_MIAV1_MIWT1_1_MO40_MGRIPMn1_NTn1_NTA0_NTB0_NTC0_NTD0_NTM0_NEPBS0_NLCA1_NLCB1_ONLL0_PGR2_PLR1_PKA0_SGROBn1_SIA3_SS0_SU32_SUM0_SUS256_SPO0_SRVW0_SSO0_SVW8_SK0_SKFTR0_SKXCCM0_SGRO0_TIN0_TLDS0_TLDSM1_ULSGRO1_USL1_UIOFGRO0_USFGROn1_VSn1_VWA1_VWB1_WSGRA0_WSGRB0_WS32_WG32_4_1_WGM8_WGMXCC1_WGMXCCGn1
    SolutionIndex: 6
    SolutionNameMin: Cijk_Ailk_Bjlk_B8F8B8S_BH_Bias_SHB_HA_S_SAB_SCD_SAV_UserArgs_MT32x16x64_MI16x16x1_SN_LDSB0_AFC1_AG0_AFEM1_AFEM1_ASEM1_CLR1_CADS0_DTLA0_DTLB0_DTVA1_DTVB0_DTVSM0_DPLBn1_EPS1_ELFLR0_EMLLn1_FDSI0_GRPM1_GRVWA8_GRVWB1_GSU1_GSUAMB_GSUC0_GSUWGMRR0_GLS0_ISA1201_IU1_K1_LDSTI0_LBSPPA0_LBSPPB128_LBSPPM0_LPA0_LPB16_LPM0_LRVW8_LWPMn1_MIAV1_MIWT1_1_MO40_MGRIPMn1_NTn1_NTA0_NTB0_NTC0_NTD0_NTM0_NEPBS0_NLCA1_NLCB1_ONLL0_PGR1_PLR1_PKA0_SGROBn1_SIA3_SS0_SU32_SUM0_SUS256_SPO0_SRVW0_SSO0_SVW8_SK0_SKFTR0_SKXCCM0_SGRO0_TIN0_TLDS0_TLDSM1_ULSGRO0_USL1_UIOFGRO0_USFGROn1_VSn1_VWA1_VWB1_WSGRA0_WSGRB0_WS32_WG32_2_1_WGM8_WGMXCC1_WGMXCCGn1
    SolutionIndex: 7
    SolutionNameMin: Cijk_Ailk_Bjlk_B8F8B8S_BH_Bias_SHB_HA_S_SAB_SCD_SAV_UserArgs_MT32x16x32_MI16x16x1_SN_LDSB0_AFC1_AG0_AFEM1_AFEM1_ASEM1_CLR1_CADS0_DTLA0_DTLB0_DTVA0_DTVB0_DTVSM0_DPLBn1_EPS0_ELFLR0_EMLLn1_FDSI0_GRPM1_GRVWA4_GRVWB1_GSU1_GSUAMB_GSUC0_GSUWGMRR0_GLS0_ISA1201_IU1_K1_LDSTI0_LBSPPA256_LBSPPB128_LBSPPM0_LPA16_LPB16_LPM0_LRVW8_LWPMn1_MIAV1_MIWT1_1_MO40_MGRIPMn1_NTn1_NTA0_NTB0_NTC0_NTD0_NTM0_NEPBS0_NLCA1_NLCB1_ONLL0_PGR2_PLR1_PKA0_SGROBn1_SIA3_SS0_SU32_SUM0_SUS256_SPO0_SRVW0_SSO0_SVW8_SK0_SKFTR0_SKXCCM0_SGRO0_TIN0_TLDS0_TLDSM1_ULSGRO1_USL1_UIOFGRO0_USFGROn1_VSn1_VWA1_VWB1_WSGRA0_WSGRB0_WS32_WG32_2_1_WGM8_WGMXCC1_WGMXCCGn1
    SolutionIndex: 8
    SolutionNameMin: Cijk_Ailk_Bjlk_B8F8B8S_BH_Bias_SHB_HA_S_SAB_SCD_SAV_UserArgs_MT32x32x32_MI16x16x1_SN_LDSB1_AFC1_AG0_AFEM1_AFEM1_ASEM1_CLR1_CADS0_DTLA0_DTLB0_DTVA0_DTVB0_DTVSM0_DPLBn1_EPS0_ELFLR0_EMLLn1_FDSI0_GRPM1_GRVWA1_GRVWB1_GSU1_GSUAMB_GSUC0_GSUWGMRR0_GLS0_ISA1201_IU2_K1_LDSTI0_LBSPPA256_LBSPPB256_LBSPPM0_LPA16_LPB16_LPM0_LRVW8_LWPMn1_MIAV1_MIWT1_1_MO40_MGRIPMn1_NTn1_NTA0_NTB0_NTC0_NTD0_NTM0_NEPBS0_NLCA1_NLCB1_ONLL0_PGR2_PLR1_PKA0_SGROBn1_SIA2_SS0_SU32_SUM0_SUS256_SPO0_SRVW0_SSO0_SVW8_SK0_SKFTR0_SKXCCM0_SGRO0_TIN0_TLDS0_TLDSM1_ULSGRO1_USL1_UIOFGRO0_USFGROn1_VSn1_VWA1_VWB1_WSGRA0_WSGRB0_WS32_WG32_4_1_WGM8_WGMXCC1_WGMXCCGn1
    SolutionIndex: 9
    SolutionNameMin: Cijk_Ailk_Bjlk_B8F8B8S_BH_Bias_SHB_HA_S_SAB_SCD_SAV_UserArgs_MT32x32x32_MI16x16x1_SN_LDSB1_AFC1_AG0_AFEM1_AFEM1_ASEM1_CLR1_CADS0_DTLA0_DTLB0_DTVA0_DTVB0_DTVSM0_DPLBn1_EPS1_ELFLR0_EMLLn1_FDSI0_GRPM1_GRVWA1_GRVWB1_GSU1_GSUAMB_GSUC0_GSUWGMRR0_GLS0_ISA1201_IU2_K1_LDSTI0_LBSPPA256_LBSPPB256_LBSPPM0_LPA16_LPB16_LPM0_LRVW8_LWPMn1_MIAV1_MIWT1_1_MO40_MGRIPMn1_NTn1_NTA0_NTB0_NTC0_NTD0_NTM0_NEPBS0_NLCA1_NLCB1_ONLL0_PGR1_PLR1_PKA0_SGROBn1_SIA2_SS0_SU32_SUM0_SUS256_SPO0_SRVW0_SSO0_SVW8_SK0_SKFTR0_SKXCCM0_SGRO0_TIN0_TLDS0_TLDSM1_ULSGRO0_USL1_UIOFGRO0_USFGROn1_VSn1_VWA1_VWB1_WSGRA0_WSGRB0_WS32_WG32_4_1_WGM8_WGMXCC1_WGMXCCGn1
    SolutionIndex: 10
    SolutionNameMin: Cijk_Ailk_Bjlk_B8F8B8S_BH_Bias_SHB_HA_S_SAB_SCD_SAV_UserArgs_MT16x16x64_MI16x16x1_SN_LDSB0_AFC1_AG0_AFEM1_AFEM1_ASEM1_CLR1_CADS0_DTLA0_DTLB0_DTVA1_DTVB1_DTVSM0_DPLBn1_EPS0_ELFLR0_EMLLn1_FDSI0_GRPM1_GRVWA8_GRVWB8_GSU1_GSUAMB_GSUC0_GSUWGMRR0_GLS0_ISA1201_IU1_K1_LDSTI0_LBSPPA0_LBSPPB0_LBSPPM0_LPA0_LPB0_LPM0_LRVW8_LWPMn1_MIAV1_MIWT1_1_MO40_MGRIPMn1_NTn1_NTA0_NTB0_NTC0_NTD0_NTM0_NEPBS0_NLCA1_NLCB1_ONLL0_PGR1_PLR0_PKA0_SGROBn1_SIA3_SS0_SU32_SUM0_SUS256_SPO0_SRVW0_SSO0_SVW8_SK0_SKFTR0_SKXCCM0_SGRO0_TIN0_TLDS0_TLDSM1_ULSGRO0_USL1_UIOFGRO0_USFGROn1_VSn1_VWA1_VWB1_WSGRA0_WSGRB0_WS32_WG16_2_1_WGM8_WGMXCC1_WGMXCCGn1
    SolutionIndex: 11
    SolutionNameMin: Cijk_Ailk_Bjlk_B8F8B8S_BH_Bias_SHB_HA_S_SAB_SCD_SAV_UserArgs_MT32x32x64_MI16x16x1_SN_LDSB0_AFC1_AG0_AFEM1_AFEM1_ASEM1_CLR1_CADS0_DTLA0_DTLB0_DTVA1_DTVB1_DTVSM0_DPLBn1_EPS0_ELFLR0_EMLLn1_FDSI0_GRPM1_GRVWA8_GRVWB8_GSU1_GSUAMB_GSUC0_GSUWGMRR0_GLS0_ISA1201_IU1_K1_LDSTI0_LBSPPA0_LBSPPB0_LBSPPM0_LPA0_LPB0_LPM0_LRVW8_LWPMn1_MIAV1_MIWT1_1_MO40_MGRIPMn1_NTn1_NTA0_NTB0_NTC0_NTD0_NTM0_NEPBS0_NLCA1_NLCB1_ONLL0_PGR1_PLR0_PKA0_SGROBn1_SIA3_SS0_SU32_SUM0_SUS256_SPO0_SRVW0_SSO0_SVW8_SK0_SKFTR0_SKXCCM0_SGRO0_TIN0_TLDS0_TLDSM1_ULSGRO0_USL1_UIOFGRO0_USFGROn1_VSn1_VWA1_VWB1_WSGRA0_WSGRB0_WS32_WG32_4_1_WGM8_WGMXCC1_WGMXCCGn1
    SolutionIndex: 12
    SolutionNameMin: Cijk_Ailk_Bjlk_B8F8B8S_BH_Bias_SHB_HA_S_SAB_SCD_SAV_UserArgs_MT32x16x64_MI16x16x1_SN_LDSB0_AFC1_AG0_AFEM1_AFEM1_ASEM1_CLR1_CADS0_DTLA0_DTLB0_DTVA1_DTVB1_DTVSM0_DPLBn1_EPS0_ELFLR0_EMLLn1_FDSI0_GRPM1_GRVWA8_GRVWB8_GSU1_GSUAMB_GSUC0_GSUWGMRR0_GLS0_ISA1201_IU1_K1_LDSTI0_LBSPPA0_LBSPPB0_LBSPPM0_LPA0_LPB0_LPM0_LRVW8_LWPMn1_MIAV1_MIWT1_1_MO40_MGRIPMn1_NTn1_NTA0_NTB0_NTC0_NTD0_NTM0_NEPBS0_NLCA1_NLCB1_ONLL0_PGR1_PLR0_PKA0_SGROBn1_SIA3_SS1_SU32_SUM0_SUS256_SPO0_SRVW0_SSO0_SVW1_SK0_SKFTR0_SKXCCM0_SGRO0_TIN0_TLDS0_TLDSM1_ULSGRO0_USL1_UIOFGRO0_USFGROn1_VSn1_VWA1_VWB1_WSGRA0_WSGRB0_WS32_WG32_2_1_WGM8_WGMXCC1_WGMXCCGn1
    SolutionIndex: 13
    SolutionNameMin: Cijk_Ailk_Bjlk_B8F8B8S_BH_Bias_SHB_HA_S_SAB_SCD_SAV_UserArgs_MT32x32x64_MI16x16x1_SN_LDSB1_AFC1_AG0_AFEM1_AFEM1_ASEM1_CLR1_CADS0_DTLA0_DTLB0_DTVA0_DTVB0_DTVSM0_DPLBn1_EPS0_ELFLR0_EMLLn1_FDSI0_GRPM1_GRVWA1_GRVWB1_GSU1_GSUAMB_GSUC0_GSUWGMRR0_GLS0_ISA1201_IU4_K1_LDSTI0_LBSPPA256_LBSPPB256_LBSPPM0_LPA16_LPB16_LPM0_LRVW8_LWPMn1_MIAV1_MIWT1_1_MO40_MGRIPMn1_NTn1_NTA0_NTB0_NTC0_NTD0_NTM0_NEPBS0_NLCA1_NLCB1_ONLL0_PGR2_PLR1_PKA0_SGROBn1_SIA2_SS0_SU32_SUM0_SUS256_SPO0_SRVW0_SSO0_SVW8_SK0_SKFTR0_SKXCCM0_SGRO0_TIN0_TLDS0_TLDSM1_ULSGRO0_USL1_UIOFGRO0_USFGROn1_VSn1_VWA1_VWB1_WSGRA0_WSGRB0_WS32_WG32_4_1_WGM8_WGMXCC1_WGMXCCGn1
    SolutionIndex: 14
    SolutionNameMin: Cijk_Ailk_Bjlk_B8F8B8S_BH_Bias_SHB_HA_S_SAB_SCD_SAV_UserArgs_MT32x32x64_MI16x16x1_SN_LDSB0_AFC1_AG0_AFEM1_AFEM1_ASEM1_CLR1_CADS0_DTLA0_DTLB0_DTVA1_DTVB1_DTVSM0_DPLBn1_EPS0_ELFLR0_EMLLn1_FDSI0_GRPM1_GRVWA8_GRVWB8_GSU1_GSUAMB_GSUC0_GSUWGMRR0_GLS0_ISA1201_IU1_K1_LDSTI0_LBSPPA0_LBSPPB0_LBSPPM0_LPA0_LPB0_LPM0_LRVW8_LWPMn1_MIAV1_MIWT1_1_MO40_MGRIPMn1_NTn1_NTA0_NTB0_NTC0_NTD0_NTM0_NEPBS0_NLCA1_NLCB1_ONLL0_PGR1_PLR0_PKA0_SGROBn1_SIA3_SS1_SU32_SUM0_SUS256_SPO0_SRVW0_SSO0_SVW1_SK0_SKFTR0_SKXCCM0_SGRO0_TIN0_TLDS0_TLDSM1_ULSGRO0_USL1_UIOFGRO0_USFGROn1_VSn1_VWA1_VWB1_WSGRA0_WSGRB0_WS32_WG32_4_1_WGM8_WGMXCC1_WGMXCCGn1
    SolutionIndex: 15
    SolutionNameMin: Cijk_Ailk_Bjlk_B8F8B8S_BH_Bias_SHB_HA_S_SAB_SCD_SAV_UserArgs_MT16x32x64_MI16x16x1_SN_LDSB0_AFC1_AG0_AFEM1_AFEM1_ASEM1_CLR1_CADS0_DTLA0_DTLB0_DTVA1_DTVB1_DTVSM0_DPLBn1_EPS0_ELFLR0_EMLLn1_FDSI0_GRPM1_GRVWA8_GRVWB8_GSU1_GSUAMB_GSUC0_GSUWGMRR0_GLS0_ISA1201_IU1_K1_LDSTI0_LBSPPA0_LBSPPB0_LBSPPM0_LPA0_LPB0_LPM0_LRVW8_LWPMn1_MIAV1_MIWT1_1_MO40_MGRIPMn1_NTn1_NTA0_NTB0_NTC0_NTD0_NTM0_NEPBS0_NLCA1_NLCB1_ONLL0_PGR1_PLR0_PKA0_SGROBn1_SIA3_SS0_SU32_SUM0_SUS256_SPO0_SRVW0_SSO0_SVW8_SK0_SKFTR0_SKXCCM0_SGRO0_TIN0_TLDS0_TLDSM1_ULSGRO0_USL1_UIOFGRO0_USFGROn1_VSn1_VWA1_VWB1_WSGRA0_WSGRB0_WS32_WG16_4_1_WGM8_WGMXCC1_WGMXCCGn1
    SolutionIndex: 16
    SolutionNameMin: Cijk_Ailk_Bjlk_B8F8B8S_BH_Bias_SHB_HA_S_SAB_SCD_SAV_UserArgs_MT32x32x16_MI16x16x1_SN_LDSB0_AFC1_AG0_AFEM1_AFEM1_ASEM1_CLR0_CADS0_DTLA0_DTLB0_DTVA0_DTVB0_DTVSM0_DPLBn1_EPS0_ELFLR0_EMLLn1_FDSI0_GRPM1_GRVWA1_GRVWB1_GSU1_GSUAMB_GSUC0_GSUWGMRR0_GLS0_ISA1201_IU1_K1_LDSTI0_LBSPPA256_LBSPPB256_LBSPPM0_LPA16_LPB16_LPM0_LRVW8_LWPMn1_MIAV1_MIWT1_1_MO40_MGRIPMn1_NTn1_NTA0_NTB0_NTC0_NTD0_NTM0_NEPBS0_NLCA1_NLCB1_ONLL0_PGR2_PLR0_PKA0_SGROBn1_SIA3_SS0_SU32_SUM0_SUS256_SPO0_SRVW0_SSO0_SVW8_SK0_SKFTR0_SKXCCM0_SGRO0_TIN0_TLDS0_TLDSM1_ULSGRO0_USL1_UIOFGRO0_USFGROn1_VSn1_VWA1_VWB1_WSGRA0_WSGRB0_WS32_WG32_4_1_WGM8_WGMXCC1_WGMXCCGn1
    SolutionIndex: 17
    SolutionNameMin: Cijk_Ailk_Bjlk_B8F8B8S_BH_Bias_SHB_HA_S_SAB_SCD_SAV_UserArgs_MT16x32x32_MI16x16x1_SN_LDSB0_AFC1_AG0_AFEM1_AFEM1_ASEM1_CLR1_CADS0_DTLA0_DTLB0_DTVA0_DTVB0_DTVSM0_DPLBn1_EPS0_ELFLR0_EMLLn1_FDSI0_GRPM1_GRVWA1_GRVWB1_GSU1_GSUAMB_GSUC0_GSUWGMRR0_GLS0_ISA1201_IU1_K1_LDSTI0_LBSPPA128_LBSPPB256_LBSPPM0_LPA16_LPB16_LPM0_LRVW8_LWPMn1_MIAV1_MIWT1_1_MO40_MGRIPMn1_NTn1_NTA0_NTB0_NTC0_NTD0_NTM0_NEPBS0_NLCA1_NLCB1_ONLL0_PGR2_PLR1_PKA0_SGROBn1_SIA3_SS0_SU32_SUM0_SUS256_SPO0_SRVW0_SSO0_SVW8_SK0_SKFTR0_SKXCCM0_SGRO0_TIN0_TLDS0_TLDSM1_ULSGRO1_USL1_UIOFGRO0_USFGROn1_VSn1_VWA1_VWB1_WSGRA0_WSGRB0_WS32_WG16_4_1_WGM8_WGMXCC1_WGMXCCGn1
    SolutionIndex: 18
    SolutionNameMin: Cijk_Ailk_Bjlk_B8F8B8S_BH_Bias_SHB_HA_S_SAB_SCD_SAV_UserArgs_MT32x32x32_MI16x16x1_SN_LDSB1_AFC1_AG0_AFEM1_AFEM1_ASEM1_CLR1_CADS0_DTLA0_DTLB0_DTVA0_DTVB0_DTVSM0_DPLBn1_EPS0_ELFLR0_EMLLn1_FDSI0_GRPM1_GRVWA1_GRVWB1_GSU1_GSUAMB_GSUC0_GSUWGMRR0_GLS0_ISA1201_IU2_K1_LDSTI0_LBSPPA256_LBSPPB256_LBSPPM0_LPA16_LPB16_LPM0_LRVW8_LWPMn1_MIAV1_MIWT1_1_MO40_MGRIPMn1_NTn1_NTA0_NTB0_NTC0_NTD0_NTM0_NEPBS0_NLCA1_NLCB1_ONLL0_PGR2_PLR1_PKA0_SGROBn1_SIA2_SS0_SU32_SUM0_SUS256_SPO0_SRVW0_SSO0_SVW8_SK0_SKFTR0_SKXCCM0_SGRO0_TIN0_TLDS0_TLDSM1_ULSGRO0_USL1_UIOFGRO0_USFGROn1_VSn1_VWA1_VWB1_WSGRA0_WSGRB0_WS32_WG32_4_1_WGM8_WGMXCC1_WGMXCCGn1
    SolutionIndex: 19
    SolutionNameMin: Cijk_Ailk_Bjlk_B8F8B8S_BH_Bias_SHB_HA_S_SAB_SCD_SAV_UserArgs_MT32x128x64_MI16x16x1_SN_LDSB0_AFC1_AG0_AFEM1_AFEM1_ASEM1_CLR1_CADS0_DTLA0_DTLB0_DTVA1_DTVB1_DTVSM0_DPLBn1_EPS0_ELFLR0_EMLLn1_FDSI0_GRPM1_GRVWA8_GRVWB8_GSU1_GSUAMB_GSUC0_GSUWGMRR0_GLS0_ISA1201_IU1_K1_LDSTI0_LBSPPA0_LBSPPB0_LBSPPM0_LPA0_LPB0_LPM0_LRVW8_LWPMn1_MIAV1_MIWT1_4_MO40_MGRIPMn1_NTn1_NTA0_NTB0_NTC0_NTD0_NTM0_NEPBS0_NLCA1_NLCB4_ONLL0_PGR1_PLR0_PKA0_SGROBn1_SIA3_SS0_SU32_SUM0_SUS256_SPO0_SRVW0_SSO0_SVW8_SK0_SKFTR0_SKXCCM0_SGRO0_TIN0_TLDS0_TLDSM1_ULSGRO0_USL1_UIOFGRO0_USFGROn1_VSn1_VWA1_VWB1_WSGRA0_WSGRB0_WS32_WG32_4_1_WGM8_WGMXCC1_WGMXCCGn1
    SolutionIndex: 20
    SolutionNameMin: Cijk_Ailk_Bjlk_B8F8B8S_BH_Bias_SHB_HA_S_SAB_SCD_SAV_UserArgs_MT64x64x32_MI16x16x1_SN_LDSB0_AFC1_AG0_AFEM1_AFEM1_ASEM1_CLR1_CADS0_DTLA0_DTLB0_DTVA1_DTVB1_DTVSM0_DPLBn1_EPS0_ELFLR0_EMLLn1_FDSI0_GRPM1_GRVWA8_GRVWB8_GSU1_GSUAMB_GSUC0_GSUWGMRR0_GLS0_ISA1201_IU1_K1_LDSTI0_LBSPPA0_LBSPPB0_LBSPPM0_LPA0_LPB0_LPM0_LRVW8_LWPMn1_MIAV1_MIWT2_2_MO40_MGRIPMn1_NTn1_NTA0_NTB0_NTC0_NTD0_NTM0_NEPBS0_NLCA2_NLCB2_ONLL0_PGR1_PLR0_PKA0_SGROBn1_SIA3_SS0_SU32_SUM0_SUS256_SPO0_SRVW0_SSO0_SVW8_SK0_SKFTR0_SKXCCM0_SGRO0_TIN0_TLDS0_TLDSM1_ULSGRO0_USL1_UIOFGRO0_USFGROn1_VSn1_VWA1_VWB1_WSGRA0_WSGRB0_WS32_WG32_4_1_WGM8_WGMXCC1_WGMXCCGn1
    SolutionIndex: 21
    SolutionNameMin: Cijk_Ailk_Bjlk_B8F8B8S_BH_Bias_SHB_HA_S_SAB_SCD_SAV_UserArgs_MT64x64x64_MI16x16x1_SN_LDSB0_AFC1_AG0_AFEM1_AFEM1_ASEM1_CLR1_CADS0_DTLA0_DTLB0_DTVA1_DTVB1_DTVSM0_DPLBn1_EPS0_ELFLR0_EMLLn1_FDSI0_GRPM1_GRVWA8_GRVWB8_GSU1_GSUAMB_GSUC0_GSUWGMRR0_GLS0_ISA1201_IU1_K1_LDSTI0_LBSPPA0_LBSPPB0_LBSPPM0_LPA0_LPB0_LPM0_LRVW8_LWPMn1_MIAV1_MIWT2_2_MO40_MGRIPMn1_NTn1_NTA0_NTB0_NTC0_NTD0_NTM0_NEPBS0_NLCA4_NLCB4_ONLL0_PGR1_PLR0_PKA0_SGROBn1_SIA3_SS0_SU32_SUM0_SUS256_SPO0_SRVW0_SSO0_SVW8_SK0_SKFTR0_SKXCCM0_SGRO0_TIN0_TLDS0_TLDSM1_ULSGRO0_USL1_UIOFGRO0_USFGROn1_VSn1_VWA1_VWB1_WSGRA0_WSGRB0_WS32_WG32_4_1_WGM8_WGMXCC1_WGMXCCGn1
    SolutionIndex: 22
    SolutionNameMin: Cijk_Ailk_Bjlk_B8F8B8S_BH_Bias_SHB_HA_S_SAB_SCD_SAV_UserArgs_MT64x64x32_MI16x16x1_SN_LDSB1_AFC1_AG0_AFEM1_AFEM1_ASEM1_CLR1_CADS0_DTLA0_DTLB0_DTVA0_DTVB0_DTVSM0_DPLBn1_EPS0_ELFLR0_EMLLn1_FDSI0_GRPM1_GRVWA1_GRVWB1_GSU1_GSUAMB_GSUC0_GSUWGMRR0_GLS0_ISA1201_IU2_K1_LDSTI0_LBSPPA512_LBSPPB512_LBSPPM0_LPA32_LPB32_LPM0_LRVW8_LWPMn1_MIAV1_MIWT2_2_MO40_MGRIPMn1_NTn1_NTA0_NTB0_NTC0_NTD0_NTM0_NEPBS0_NLCA1_NLCB1_ONLL0_PGR2_PLR1_PKA0_SGROBn1_SIA2_SS0_SU32_SUM0_SUS256_SPO0_SRVW0_SSO0_SVW16_SK0_SKFTR0_SKXCCM0_SGRO0_TIN0_TLDS0_TLDSM1_ULSGRO1_USL1_UIOFGRO0_USFGROn1_VSn1_VWA2_VWB2_WSGRA0_WSGRB0_WS32_WG32_4_1_WGM8_WGMXCC1_WGMXCCGn1
    SolutionIndex: 23
    SolutionNameMin: Cijk_Ailk_Bjlk_B8F8B8S_BH_Bias_SHB_HA_S_SAB_SCD_SAV_UserArgs_MT128x32x64_MI16x16x1_SN_LDSB0_AFC1_AG0_AFEM1_AFEM1_ASEM1_CLR1_CADS0_DTLA0_DTLB0_DTVA1_DTVB1_DTVSM0_DPLBn1_EPS0_ELFLR0_EMLLn1_FDSI0_GRPM1_GRVWA8_GRVWB8_GSU1_GSUAMB_GSUC0_GSUWGMRR0_GLS0_ISA1201_IU1_K1_LDSTI0_LBSPPA0_LBSPPB0_LBSPPM0_LPA0_LPB0_LPM0_LRVW8_LWPMn1_MIAV1_MIWT4_1_MO40_MGRIPMn1_NTn1_NTA0_NTB0_NTC0_NTD0_NTM0_NEPBS0_NLCA4_NLCB1_ONLL0_PGR1_PLR0_PKA0_SGROBn1_SIA3_SS0_SU32_SUM0_SUS256_SPO0_SRVW0_SSO0_SVW8_SK0_SKFTR0_SKXCCM0_SGRO0_TIN0_TLDS0_TLDSM1_ULSGRO0_USL1_UIOFGRO0_USFGROn1_VSn1_VWA1_VWB1_WSGRA0_WSGRB0_WS32_WG32_4_1_WGM8_WGMXCC1_WGMXCCGn1
    SolutionIndex: 24
    SolutionNameMin: Cijk_Ailk_Bjlk_B8F8B8S_BH_Bias_SHB_HA_S_SAB_SCD_SAV_UserArgs_MT64x64x64_MI16x16x1_SN_LDSB1_AFC1_AG0_AFEM1_AFEM1_ASEM1_CLR1_CADS0_DTLA0_DTLB0_DTVA0_DTVB0_DTVSM0_DPLBn1_EPS1_ELFLR0_EMLLn1_FDSI0_GRPM1_GRVWA8_GRVWB4_GSU1_GSUAMB_GSUC0_GSUWGMRR0_GLS0_ISA1201_IU4_K1_LDSTI0_LBSPPA512_LBSPPB512_LBSPPM0_LPA32_LPB32_LPM0_LRVW8_LWPMn1_MIAV1_MIWT2_2_MO40_MGRIPMn1_NTn1_NTA0_NTB0_NTC0_NTD0_NTM0_NEPBS0_NLCA1_NLCB1_ONLL0_PGR1_PLR1_PKA0_SGROBn1_SIA2_SS0_SU32_SUM0_SUS256_SPO0_SRVW0_SSO0_SVW16_SK0_SKFTR0_SKXCCM0_SGRO0_TIN0_TLDS0_TLDSM1_ULSGRO0_USL1_UIOFGRO0_USFGROn1_VSn1_VWA2_VWB2_WSGRA0_WSGRB0_WS32_WG32_4_1_WGM8_WGMXCC1_WGMXCCGn1
    SolutionIndex: 25
    SolutionNameMin: Cijk_Ailk_Bjlk_B8F8B8S_BH_Bias_SHB_HA_S_SAB_SCD_SAV_UserArgs_MT32x32x64_MI16x16x1_SN_LDSB1_AFC1_AG0_AFEM1_AFEM1_ASEM1_CLR1_CADS0_DTLA0_DTLB0_DTVA0_DTVB0_DTVSM0_DPLBn1_EPS0_ELFLR0_EMLLn1_FDSI0_GRPM1_GRVWA4_GRVWB8_GSU1_GSUAMB_GSUC0_GSUWGMRR0_GLS0_ISA1201_IU4_K1_LDSTI0_LBSPPA256_LBSPPB256_LBSPPM0_LPA16_LPB16_LPM0_LRVW8_LWPMn1_MIAV1_MIWT1_1_MO40_MGRIPMn1_NTn1_NTA0_NTB0_NTC0_NTD0_NTM0_NEPBS0_NLCA1_NLCB1_ONLL0_PGR2_PLR1_PKA0_SGROBn1_SIA2_SS1_SU32_SUM0_SUS256_SPO0_SRVW0_SSO0_SVW1_SK0_SKFTR0_SKXCCM0_SGRO0_TIN0_TLDS0_TLDSM1_ULSGRO1_USL1_UIOFGRO0_USFGROn1_VSn1_VWA1_VWB1_WSGRA0_WSGRB0_WS32_WG32_4_1_WGM8_WGMXCC1_WGMXCCGn1
    SolutionIndex: 26
    SolutionNameMin: Cijk_Ailk_Bjlk_B8F8B8S_BH_Bias_SHB_HA_S_SAB_SCD_SAV_UserArgs_MT32x16x64_MI16x16x1_SN_LDSB0_AFC1_AG0_AFEM1_AFEM1_ASEM1_CLR1_CADS0_DTLA0_DTLB0_DTVA1_DTVB1_DTVSM0_DPLBn1_EPS0_ELFLR0_EMLLn1_FDSI0_GRPM1_GRVWA8_GRVWB8_GSU1_GSUAMB_GSUC0_GSUWGMRR0_GLS0_ISA1201_IU1_K1_LDSTI0_LBSPPA0_LBSPPB0_LBSPPM0_LPA0_LPB0_LPM0_LRVW8_LWPMn1_MIAV1_MIWT1_1_MO40_MGRIPMn1_NTn1_NTA0_NTB0_NTC0_NTD0_NTM0_NEPBS0_NLCA1_NLCB1_ONLL0_PGR1_PLR0_PKA0_SGROBn1_SIA3_SS0_SU32_SUM0_SUS256_SPO0_SRVW0_SSO0_SVW8_SK0_SKFTR0_SKXCCM0_SGRO0_TIN0_TLDS0_TLDSM1_ULSGRO0_USL1_UIOFGRO0_USFGROn1_VSn1_VWA1_VWB1_WSGRA0_WSGRB0_WS32_WG32_2_1_WGM8_WGMXCC1_WGMXCCGn1
    SolutionIndex: 27
    SolutionNameMin: Cijk_Ailk_Bjlk_B8F8B8S_BH_Bias_SHB_HA_S_SAB_SCD_SAV_UserArgs_MT64x64x64_MI16x16x1_SN_LDSB1_AFC1_AG0_AFEM1_AFEM1_ASEM1_CLR1_CADS0_DTLA0_DTLB0_DTVA0_DTVB0_DTVSM0_DPLBn1_EPS0_ELFLR0_EMLLn1_FDSI0_GRPM1_GRVWA4_GRVWB4_GSU1_GSUAMB_GSUC0_GSUWGMRR0_GLS0_ISA1201_IU4_K1_LDSTI0_LBSPPA512_LBSPPB512_LBSPPM0_LPA32_LPB32_LPM0_LRVW8_LWPMn1_MIAV1_MIWT2_2_MO40_MGRIPMn1_NTn1_NTA0_NTB0_NTC0_NTD0_NTM0_NEPBS0_NLCA1_NLCB1_ONLL0_PGR2_PLR1_PKA0_SGROBn1_SIA2_SS0_SU32_SUM0_SUS256_SPO0_SRVW0_SSO0_SVW16_SK0_SKFTR0_SKXCCM0_SGRO0_TIN0_TLDS0_TLDSM1_ULSGRO0_USL1_UIOFGRO0_USFGROn1_VSn1_VWA2_VWB2_WSGRA0_WSGRB0_WS32_WG32_4_1_WGM8_WGMXCC1_WGMXCCGn1
    SolutionIndex: 28
    SolutionNameMin: Cijk_Ailk_Bjlk_B8F8B8S_BH_Bias_SHB_HA_S_SAB_SCD_SAV_UserArgs_MT64x64x64_MI16x16x1_SN_LDSB1_AFC1_AG0_AFEM1_AFEM1_ASEM1_CLR1_CADS0_DTLA0_DTLB0_DTVA0_DTVB0_DTVSM0_DPLBn1_EPS0_ELFLR0_EMLLn1_FDSI0_GRPM1_GRVWA8_GRVWB4_GSU1_GSUAMB_GSUC0_GSUWGMRR0_GLS0_ISA1201_IU4_K1_LDSTI0_LBSPPA512_LBSPPB512_LBSPPM0_LPA32_LPB32_LPM0_LRVW8_LWPMn1_MIAV1_MIWT2_2_MO40_MGRIPMn1_NTn1_NTA0_NTB0_NTC0_NTD0_NTM0_NEPBS0_NLCA1_NLCB1_ONLL0_PGR2_PLR1_PKA0_SGROBn1_SIA2_SS1_SU32_SUM0_SUS256_SPO0_SRVW0_SSO0_SVW2_SK0_SKFTR0_SKXCCM0_SGRO0_TIN0_TLDS0_TLDSM1_ULSGRO1_USL1_UIOFGRO0_USFGROn1_VSn1_VWA2_VWB2_WSGRA0_WSGRB0_WS32_WG32_4_1_WGM8_WGMXCC1_WGMXCCGn1
    SolutionIndex: 29
    SolutionNameMin: Cijk_Ailk_Bjlk_B8F8B8S_BH_Bias_SHB_HA_S_SAB_SCD_SAV_UserArgs_MT128x32x32_MI16x16x1_SN_LDSB0_AFC1_AG0_AFEM1_AFEM1_ASEM1_CLR1_CADS0_DTLA0_DTLB0_DTVA1_DTVB0_DTVSM0_DPLBn1_EPS1_ELFLR0_EMLLn1_FDSI0_GRPM1_GRVWA8_GRVWB4_GSU1_GSUAMB_GSUC0_GSUWGMRR0_GLS0_ISA1201_IU1_K1_LDSTI0_LBSPPA0_LBSPPB256_LBSPPM0_LPA0_LPB16_LPM0_LRVW8_LWPMn1_MIAV1_MIWT4_1_MO40_MGRIPMn1_NTn1_NTA0_NTB0_NTC0_NTD0_NTM0_NEPBS0_NLCA2_NLCB1_ONLL0_PGR1_PLR1_PKA0_SGROBn1_SIA3_SS0_SU32_SUM0_SUS256_SPO0_SRVW0_SSO0_SVW8_SK0_SKFTR0_SKXCCM0_SGRO0_TIN0_TLDS0_TLDSM1_ULSGRO0_USL1_UIOFGRO0_USFGROn1_VSn1_VWA1_VWB1_WSGRA0_WSGRB0_WS32_WG32_4_1_WGM8_WGMXCC1_WGMXCCGn1
    SolutionIndex: 30
    SolutionNameMin: Cijk_Ailk_Bjlk_B8F8B8S_BH_Bias_SHB_HA_S_SAB_SCD_SAV_UserArgs_MT64x64x64_MI16x16x1_SN_LDSB1_AFC1_AG0_AFEM1_AFEM1_ASEM1_CLR1_CADS0_DTLA0_DTLB0_DTVA0_DTVB0_DTVSM0_DPLBn1_EPS1_ELFLR0_EMLLn1_FDSI0_GRPM1_GRVWA16_GRVWB4_GSU1_GSUAMB_GSUC0_GSUWGMRR0_GLS0_ISA1201_IU4_K1_LDSTI0_LBSPPA512_LBSPPB512_LBSPPM0_LPA32_LPB32_LPM0_LRVW8_LWPMn1_MIAV1_MIWT2_2_MO40_MGRIPMn1_NTn1_NTA0_NTB0_NTC0_NTD0_NTM0_NEPBS0_NLCA1_NLCB1_ONLL0_PGR1_PLR1_PKA0_SGROBn1_SIA2_SS0_SU32_SUM0_SUS256_SPO0_SRVW0_SSO0_SVW16_SK0_SKFTR0_SKXCCM0_SGRO0_TIN0_TLDS0_TLDSM1_ULSGRO0_USL1_UIOFGRO0_USFGROn1_VSn1_VWA2_VWB2_WSGRA0_WSGRB0_WS32_WG32_4_1_WGM8_WGMXCC1_WGMXCCGn1
    SolutionIndex: 31
    SolutionNameMin: Cijk_Ailk_Bjlk_B8F8B8S_BH_Bias_SHB_HA_S_SAB_SCD_SAV_UserArgs_MT64x64x16_MI16x16x1_SN_LDSB0_AFC1_AG0_AFEM1_AFEM1_ASEM1_CLR1_CADS0_DTLA0_DTLB0_DTVA1_DTVB1_DTVSM0_DPLBn1_EPS0_ELFLR0_EMLLn1_FDSI0_GRPM1_GRVWA8_GRVWB8_GSU1_GSUAMB_GSUC0_GSUWGMRR0_GLS0_ISA1201_IU1_K1_LDSTI0_LBSPPA0_LBSPPB0_LBSPPM0_LPA0_LPB0_LPM0_LRVW8_LWPMn1_MIAV1_MIWT2_2_MO40_MGRIPMn1_NTn1_NTA0_NTB0_NTC0_NTD0_NTM0_NEPBS0_NLCA1_NLCB1_ONLL0_PGR1_PLR0_PKA0_SGROBn1_SIA3_SS0_SU32_SUM0_SUS256_SPO0_SRVW0_SSO0_SVW8_SK0_SKFTR0_SKXCCM0_SGRO0_TIN0_TLDS0_TLDSM1_ULSGRO0_USL1_UIOFGRO0_USFGROn1_VSn1_VWA1_VWB1_WSGRA0_WSGRB0_WS32_WG32_4_1_WGM8_WGMXCC1_WGMXCCGn1
    SolutionIndex: 32
    SolutionNameMin: Cijk_Ailk_Bjlk_B8F8B8S_BH_Bias_SHB_HA_S_SAB_SCD_SAV_UserArgs_MT32x16x32_MI16x16x1_SN_LDSB0_AFC1_AG0_AFEM1_AFEM1_ASEM1_CLR1_CADS0_DTLA0_DTLB0_DTVA0_DTVB0_DTVSM0_DPLBn1_EPS0_ELFLR0_EMLLn1_FDSI0_GRPM1_GRVWA4_GRVWB8_GSU1_GSUAMB_GSUC0_GSUWGMRR0_GLS0_ISA1201_IU1_K1_LDSTI0_LBSPPA256_LBSPPB128_LBSPPM0_LPA16_LPB16_LPM0_LRVW8_LWPMn1_MIAV1_MIWT1_1_MO40_MGRIPMn1_NTn1_NTA0_NTB0_NTC0_NTD0_NTM0_NEPBS0_NLCA1_NLCB1_ONLL0_PGR2_PLR1_PKA0_SGROBn1_SIA3_SS0_SU32_SUM0_SUS256_SPO0_SRVW0_SSO0_SVW8_SK0_SKFTR0_SKXCCM0_SGRO0_TIN0_TLDS0_TLDSM1_ULSGRO1_USL1_UIOFGRO0_USFGROn1_VSn1_VWA1_VWB1_WSGRA0_WSGRB0_WS32_WG32_2_1_WGM8_WGMXCC1_WGMXCCGn1
    SolutionIndex: 33
    SolutionNameMin: Cijk_Ailk_Bjlk_B8F8B8S_BH_Bias_SHB_HA_S_SAB_SCD_SAV_UserArgs_MT32x128x32_MI16x16x1_SN_LDSB0_AFC1_AG0_AFEM1_AFEM1_ASEM1_CLR1_CADS0_DTLA0_DTLB0_DTVA0_DTVB1_DTVSM0_DPLBn1_EPS1_ELFLR0_EMLLn1_FDSI0_GRPM1_GRVWA4_GRVWB8_GSU1_GSUAMB_GSUC0_GSUWGMRR0_GLS0_ISA1201_IU1_K1_LDSTI0_LBSPPA256_LBSPPB0_LBSPPM0_LPA16_LPB0_LPM0_LRVW8_LWPMn1_MIAV1_MIWT1_4_MO40_MGRIPMn1_NTn1_NTA0_NTB0_NTC0_NTD0_NTM0_NEPBS0_NLCA1_NLCB2_ONLL0_PGR1_PLR1_PKA0_SGROBn1_SIA3_SS0_SU32_SUM0_SUS256_SPO0_SRVW0_SSO0_SVW8_SK0_SKFTR0_SKXCCM0_SGRO0_TIN0_TLDS0_TLDSM1_ULSGRO0_USL1_UIOFGRO0_USFGROn1_VSn1_VWA1_VWB1_WSGRA0_WSGRB0_WS32_WG32_4_1_WGM8_WGMXCC1_WGMXCCGn1
    SolutionIndex: 34
    SolutionNameMin: Cijk_Ailk_Bjlk_B8F8B8S_BH_Bias_SHB_HA_S_SAB_SCD_SAV_UserArgs_MT64x64x64_MI16x16x1_SN_LDSB1_AFC1_AG0_AFEM1_AFEM1_ASEM1_CLR1_CADS0_DTLA0_DTLB0_DTVA0_DTVB0_DTVSM0_DPLBn1_EPS0_ELFLR0_EMLLn1_FDSI0_GRPM1_GRVWA16_GRVWB4_GSU1_GSUAMB_GSUC0_GSUWGMRR0_GLS0_ISA1201_IU4_K1_LDSTI0_LBSPPA512_LBSPPB512_LBSPPM0_LPA32_LPB32_LPM0_LRVW8_LWPMn1_MIAV1_MIWT2_2_MO40_MGRIPMn1_NTn1_NTA0_NTB0_NTC0_NTD0_NTM0_NEPBS0_NLCA1_NLCB1_ONLL0_PGR2_PLR1_PKA0_SGROBn1_SIA2_SS0_SU32_SUM0_SUS256_SPO0_SRVW0_SSO0_SVW16_SK0_SKFTR0_SKXCCM0_SGRO0_TIN0_TLDS0_TLDSM1_ULSGRO1_USL1_UIOFGRO0_USFGROn1_VSn1_VWA2_VWB2_WSGRA0_WSGRB0_WS32_WG32_4_1_WGM8_WGMXCC1_WGMXCCGn1
    SolutionIndex: 35
    SolutionNameMin: Cijk_Ailk_Bjlk_B8F8B8S_BH_Bias_SHB_HA_S_SAB_SCD_SAV_UserArgs_MT64x64x64_MI16x16x1_SN_LDSB1_AFC1_AG0_AFEM1_AFEM1_ASEM1_CLR1_CADS0_DTLA0_DTLB0_DTVA0_DTVB0_DTVSM0_DPLBn1_EPS0_ELFLR0_EMLLn1_FDSI0_GRPM1_GRVWA8_GRVWB4_GSU1_GSUAMB_GSUC0_GSUWGMRR0_GLS0_ISA1201_IU4_K1_LDSTI0_LBSPPA512_LBSPPB512_LBSPPM0_LPA32_LPB32_LPM0_LRVW8_LWPMn1_MIAV1_MIWT2_2_MO40_MGRIPMn1_NTn1_NTA0_NTB0_NTC0_NTD0_NTM0_NEPBS0_NLCA1_NLCB1_ONLL0_PGR2_PLR1_PKA0_SGROBn1_SIA2_SS0_SU32_SUM0_SUS256_SPO0_SRVW0_SSO0_SVW16_SK0_SKFTR0_SKXCCM0_SGRO0_TIN0_TLDS0_TLDSM1_ULSGRO1_USL1_UIOFGRO0_USFGROn1_VSn1_VWA2_VWB2_WSGRA0_WSGRB0_WS32_WG32_4_1_WGM8_WGMXCC1_WGMXCCGn1
    SolutionIndex: 36
    SolutionNameMin: Cijk_Ailk_Bjlk_B8F8B8S_BH_Bias_SHB_HA_S_SAB_SCD_SAV_UserArgs_MT128x32x32_MI16x16x1_SN_LDSB1_AFC1_AG0_AFEM1_AFEM1_ASEM1_CLR1_CADS0_DTLA0_DTLB0_DTVA0_DTVB0_DTVSM0_DPLBn1_EPS0_ELFLR0_EMLLn1_FDSI0_GRPM1_GRVWA8_GRVWB4_GSU1_GSUAMB_GSUC0_GSUWGMRR0_GLS0_ISA1201_IU2_K1_LDSTI0_LBSPPA1024_LBSPPB256_LBSPPM0_LPA64_LPB16_LPM0_LRVW8_LWPMn1_MIAV1_MIWT4_1_MO40_MGRIPMn1_NTn1_NTA0_NTB0_NTC0_NTD0_NTM0_NEPBS0_NLCA1_NLCB1_ONLL0_PGR2_PLR1_PKA0_SGROBn1_SIA2_SS1_SU32_SUM0_SUS256_SPO0_SRVW0_SSO0_SVW4_SK0_SKFTR0_SKXCCM0_SGRO0_TIN0_TLDS0_TLDSM1_ULSGRO1_USL1_UIOFGRO0_USFGROn1_VSn1_VWA4_VWB1_WSGRA0_WSGRB0_WS32_WG32_4_1_WGM8_WGMXCC1_WGMXCCGn1
    SolutionIndex: 37
    SolutionNameMin: Cijk_Ailk_Bjlk_B8F8B8S_BH_Bias_SHB_HA_S_SAB_SCD_SAV_UserArgs_MT32x32x64_MI16x16x1_SN_LDSB1_AFC1_AG0_AFEM1_AFEM1_ASEM1_CLR1_CADS0_DTLA0_DTLB0_DTVA0_DTVB0_DTVSM0_DPLBn1_EPS0_ELFLR0_EMLLn1_FDSI0_GRPM1_GRVWA1_GRVWB1_GSU1_GSUAMB_GSUC0_GSUWGMRR0_GLS0_ISA1201_IU4_K1_LDSTI0_LBSPPA256_LBSPPB256_LBSPPM0_LPA16_LPB16_LPM0_LRVW8_LWPMn1_MIAV1_MIWT1_1_MO40_MGRIPMn1_NTn1_NTA0_NTB0_NTC0_NTD0_NTM0_NEPBS0_NLCA1_NLCB1_ONLL0_PGR2_PLR1_PKA0_SGROBn1_SIA2_SS0_SU32_SUM0_SUS256_SPO0_SRVW0_SSO0_SVW8_SK0_SKFTR0_SKXCCM0_SGRO0_TIN0_TLDS0_TLDSM1_ULSGRO1_USL1_UIOFGRO0_USFGROn1_VSn1_VWA1_VWB1_WSGRA0_WSGRB0_WS32_WG32_4_1_WGM8_WGMXCC1_WGMXCCGn1
    SolutionIndex: 38
    SolutionNameMin: Cijk_Ailk_Bjlk_B8F8B8S_BH_Bias_SHB_HA_S_SAB_SCD_SAV_UserArgs_MT64x64x64_MI16x16x1_SN_LDSB1_AFC1_AG0_AFEM1_AFEM1_ASEM1_CLR1_CADS0_DTLA0_DTLB0_DTVA0_DTVB0_DTVSM0_DPLBn1_EPS0_ELFLR0_EMLLn1_FDSI0_GRPM1_GRVWA4_GRVWB8_GSU1_GSUAMB_GSUC0_GSUWGMRR0_GLS0_ISA1201_IU4_K1_LDSTI0_LBSPPA512_LBSPPB512_LBSPPM0_LPA32_LPB32_LPM0_LRVW8_LWPMn1_MIAV1_MIWT2_2_MO40_MGRIPMn1_NTn1_NTA0_NTB0_NTC0_NTD0_NTM0_NEPBS0_NLCA1_NLCB1_ONLL0_PGR2_PLR1_PKA0_SGROBn1_SIA2_SS0_SU32_SUM0_SUS256_SPO0_SRVW0_SSO0_SVW16_SK0_SKFTR0_SKXCCM0_SGRO0_TIN0_TLDS0_TLDSM1_ULSGRO1_USL1_UIOFGRO0_USFGROn1_VSn1_VWA2_VWB2_WSGRA0_WSGRB0_WS32_WG32_4_1_WGM8_WGMXCC1_WGMXCCGn1
    SolutionIndex: 39
    SolutionNameMin: Cijk_Ailk_Bjlk_B8F8B8S_BH_Bias_SHB_HA_S_SAB_SCD_SAV_UserArgs_MT64x64x64_MI16x16x1_SN_LDSB1_AFC1_AG0_AFEM1_AFEM1_ASEM1_CLR1_CADS0_DTLA0_DTLB0_DTVA0_DTVB0_DTVSM0_DPLBn1_EPS1_ELFLR0_EMLLn1_FDSI0_GRPM1_GRVWA4_GRVWB4_GSU1_GSUAMB_GSUC0_GSUWGMRR0_GLS0_ISA1201_IU4_K1_LDSTI0_LBSPPA512_LBSPPB512_LBSPPM0_LPA32_LPB32_LPM0_LRVW8_LWPMn1_MIAV1_MIWT2_2_MO40_MGRIPMn1_NTn1_NTA0_NTB0_NTC0_NTD0_NTM0_NEPBS0_NLCA1_NLCB1_ONLL0_PGR1_PLR1_PKA0_SGROBn1_SIA2_SS0_SU32_SUM0_SUS256_SPO0_SRVW0_SSO0_SVW16_SK0_SKFTR0_SKXCCM0_SGRO0_TIN0_TLDS0_TLDSM1_ULSGRO0_USL1_UIOFGRO0_USFGROn1_VSn1_VWA2_VWB2_WSGRA0_WSGRB0_WS32_WG32_4_1_WGM8_WGMXCC1_WGMXCCGn1
    SolutionIndex: 40
    SolutionNameMin: Cijk_Ailk_Bjlk_B8F8B8S_BH_Bias_SHB_HA_S_SAB_SCD_SAV_UserArgs_MT64x64x32_MI16x16x1_SN_LDSB1_AFC1_AG0_AFEM1_AFEM1_ASEM1_CLR1_CADS0_DTLA0_DTLB0_DTVA0_DTVB0_DTVSM0_DPLBn1_EPS0_ELFLR0_EMLLn1_FDSI0_GRPM1_GRVWA4_GRVWB4_GSU1_GSUAMB_GSUC0_GSUWGMRR0_GLS0_ISA1201_IU2_K1_LDSTI0_LBSPPA512_LBSPPB512_LBSPPM0_LPA32_LPB32_LPM0_LRVW8_LWPMn1_MIAV1_MIWT2_2_MO40_MGRIPMn1_NTn1_NTA0_NTB0_NTC0_NTD0_NTM0_NEPBS0_NLCA1_NLCB1_ONLL0_PGR2_PLR1_PKA0_SGROBn1_SIA2_SS0_SU32_SUM0_SUS256_SPO0_SRVW0_SSO0_SVW16_SK0_SKFTR0_SKXCCM0_SGRO0_TIN0_TLDS0_TLDSM1_ULSGRO0_USL1_UIOFGRO0_USFGROn1_VSn1_VWA2_VWB2_WSGRA0_WSGRB0_WS32_WG32_4_1_WGM8_WGMXCC1_WGMXCCGn1
    SolutionIndex: 41
    SolutionNameMin: Cijk_Ailk_Bjlk_B8F8B8S_BH_Bias_SHB_HA_S_SAB_SCD_SAV_UserArgs_MT64x64x64_MI16x16x1_SN_LDSB0_AFC1_AG0_AFEM1_AFEM1_ASEM1_CLR1_CADS0_DTLA0_DTLB0_DTVA0_DTVB1_DTVSM0_DPLBn1_EPS0_ELFLR0_EMLLn1_FDSI0_GRPM1_GRVWA8_GRVWB8_GSU1_GSUAMB_GSUC0_GSUWGMRR0_GLS0_ISA1201_IU1_K1_LDSTI0_LBSPPA512_LBSPPB0_LBSPPM0_LPA32_LPB0_LPM0_LRVW8_LWPMn1_MIAV1_MIWT2_2_MO40_MGRIPMn1_NTn1_NTA0_NTB0_NTC0_NTD0_NTM0_NEPBS0_NLCA1_NLCB4_ONLL0_PGR2_PLR1_PKA0_SGROBn1_SIA3_SS0_SU32_SUM0_SUS256_SPO0_SRVW0_SSO0_SVW16_SK0_SKFTR0_SKXCCM0_SGRO0_TIN0_TLDS0_TLDSM1_ULSGRO0_USL1_UIOFGRO0_USFGROn1_VSn1_VWA2_VWB1_WSGRA0_WSGRB0_WS32_WG32_4_1_WGM8_WGMXCC1_WGMXCCGn1
    SolutionIndex: 42
    SolutionNameMin: Cijk_Ailk_Bjlk_B8F8B8S_BH_Bias_SHB_HA_S_SAB_SCD_SAV_UserArgs_MT16x32x32_MI16x16x1_SN_LDSB0_AFC1_AG0_AFEM1_AFEM1_ASEM1_CLR1_CADS0_DTLA0_DTLB0_DTVA0_DTVB1_DTVSM0_DPLBn1_EPS0_ELFLR0_EMLLn1_FDSI0_GRPM1_GRVWA1_GRVWB8_GSU1_GSUAMB_GSUC0_GSUWGMRR0_GLS0_ISA1201_IU1_K1_LDSTI0_LBSPPA128_LBSPPB0_LBSPPM0_LPA16_LPB0_LPM0_LRVW8_LWPMn1_MIAV1_MIWT1_1_MO40_MGRIPMn1_NTn1_NTA0_NTB0_NTC0_NTD0_NTM0_NEPBS0_NLCA1_NLCB1_ONLL0_PGR2_PLR1_PKA0_SGROBn1_SIA3_SS0_SU32_SUM0_SUS256_SPO0_SRVW0_SSO0_SVW8_SK0_SKFTR0_SKXCCM0_SGRO0_TIN0_TLDS0_TLDSM1_ULSGRO0_USL1_UIOFGRO0_USFGROn1_VSn1_VWA1_VWB1_WSGRA0_WSGRB0_WS32_WG16_4_1_WGM8_WGMXCC1_WGMXCCGn1
    SolutionIndex: 43
    SolutionNameMin: Cijk_Ailk_Bjlk_B8F8B8S_BH_Bias_SHB_HA_S_SAB_SCD_SAV_UserArgs_MT16x32x32_MI16x16x1_SN_LDSB0_AFC1_AG0_AFEM1_AFEM1_ASEM1_CLR1_CADS0_DTLA0_DTLB0_DTVA1_DTVB1_DTVSM0_DPLBn1_EPS0_ELFLR0_EMLLn1_FDSI0_GRPM1_GRVWA8_GRVWB8_GSU1_GSUAMB_GSUC0_GSUWGMRR0_GLS0_ISA1201_IU1_K1_LDSTI0_LBSPPA0_LBSPPB0_LBSPPM0_LPA0_LPB0_LPM0_LRVW8_LWPMn1_MIAV1_MIWT1_1_MO40_MGRIPMn1_NTn1_NTA0_NTB0_NTC0_NTD0_NTM0_NEPBS0_NLCA1_NLCB1_ONLL0_PGR1_PLR0_PKA0_SGROBn1_SIA3_SS0_SU32_SUM0_SUS256_SPO0_SRVW0_SSO0_SVW8_SK0_SKFTR0_SKXCCM0_SGRO0_TIN0_TLDS0_TLDSM1_ULSGRO0_USL1_UIOFGRO0_USFGROn1_VSn1_VWA1_VWB1_WSGRA0_WSGRB0_WS32_WG16_4_1_WGM8_WGMXCC1_WGMXCCGn1
    SolutionIndex: 44
    SolutionNameMin: Cijk_Ailk_Bjlk_B8F8B8S_BH_Bias_SHB_HA_S_SAB_SCD_SAV_UserArgs_MT32x128x32_MI16x16x1_SN_LDSB0_AFC1_AG0_AFEM1_AFEM1_ASEM1_CLR1_CADS0_DTLA0_DTLB0_DTVA1_DTVB1_DTVSM0_DPLBn1_EPS0_ELFLR0_EMLLn1_FDSI0_GRPM1_GRVWA8_GRVWB8_GSU1_GSUAMB_GSUC0_GSUWGMRR0_GLS0_ISA1201_IU1_K1_LDSTI0_LBSPPA0_LBSPPB0_LBSPPM0_LPA0_LPB0_LPM0_LRVW8_LWPMn1_MIAV1_MIWT1_4_MO40_MGRIPMn1_NTn1_NTA0_NTB0_NTC0_NTD0_NTM0_NEPBS0_NLCA1_NLCB2_ONLL0_PGR1_PLR0_PKA0_SGROBn1_SIA3_SS0_SU32_SUM0_SUS256_SPO0_SRVW0_SSO0_SVW8_SK0_SKFTR0_SKXCCM0_SGRO0_TIN0_TLDS0_TLDSM1_ULSGRO0_USL1_UIOFGRO0_USFGROn1_VSn1_VWA1_VWB1_WSGRA0_WSGRB0_WS32_WG32_4_1_WGM8_WGMXCC1_WGMXCCGn1
    SolutionIndex: 45
    SolutionNameMin: Cijk_Ailk_Bjlk_B8F8B8S_BH_Bias_SHB_HA_S_SAB_SCD_SAV_UserArgs_MT64x64x32_MI16x16x1_SN_LDSB0_AFC1_AG0_AFEM1_AFEM1_ASEM1_CLR1_CADS0_DTLA0_DTLB0_DTVA0_DTVB1_DTVSM0_DPLBn1_EPS0_ELFLR0_EMLLn1_FDSI0_GRPM1_GRVWA4_GRVWB8_GSU1_GSUAMB_GSUC0_GSUWGMRR0_GLS0_ISA1201_IU1_K1_LDSTI0_LBSPPA512_LBSPPB0_LBSPPM0_LPA32_LPB0_LPM0_LRVW8_LWPMn1_MIAV1_MIWT2_2_MO40_MGRIPMn1_NTn1_NTA0_NTB0_NTC0_NTD0_NTM0_NEPBS0_NLCA1_NLCB2_ONLL0_PGR2_PLR1_PKA0_SGROBn1_SIA3_SS0_SU32_SUM0_SUS256_SPO0_SRVW0_SSO0_SVW16_SK0_SKFTR0_SKXCCM0_SGRO0_TIN0_TLDS0_TLDSM1_ULSGRO0_USL1_UIOFGRO0_USFGROn1_VSn1_VWA2_VWB1_WSGRA0_WSGRB0_WS32_WG32_4_1_WGM8_WGMXCC1_WGMXCCGn1
    SolutionIndex: 46
    SolutionNameMin: Cijk_Ailk_Bjlk_B8F8B8S_BH_Bias_SHB_HA_S_SAB_SCD_SAV_UserArgs_MT128x32x32_MI16x16x1_SN_LDSB0_AFC1_AG0_AFEM1_AFEM1_ASEM1_CLR1_CADS0_DTLA0_DTLB0_DTVA1_DTVB0_DTVSM0_DPLBn1_EPS1_ELFLR0_EMLLn1_FDSI0_GRPM1_GRVWA8_GRVWB1_GSU1_GSUAMB_GSUC0_GSUWGMRR0_GLS0_ISA1201_IU1_K1_LDSTI0_LBSPPA0_LBSPPB256_LBSPPM0_LPA0_LPB16_LPM0_LRVW8_LWPMn1_MIAV1_MIWT4_1_MO40_MGRIPMn1_NTn1_NTA0_NTB0_NTC0_NTD0_NTM0_NEPBS0_NLCA2_NLCB1_ONLL0_PGR1_PLR1_PKA0_SGROBn1_SIA3_SS0_SU32_SUM0_SUS256_SPO0_SRVW0_SSO0_SVW8_SK0_SKFTR0_SKXCCM0_SGRO0_TIN0_TLDS0_TLDSM1_ULSGRO0_USL1_UIOFGRO0_USFGROn1_VSn1_VWA1_VWB1_WSGRA0_WSGRB0_WS32_WG32_4_1_WGM8_WGMXCC1_WGMXCCGn1
    SolutionIndex: 47
    SolutionNameMin: Cijk_Ailk_Bjlk_B8F8B8S_BH_Bias_SHB_HA_S_SAB_SCD_SAV_UserArgs_MT64x64x32_MI16x16x1_SN_LDSB0_AFC1_AG0_AFEM1_AFEM1_ASEM1_CLR1_CADS0_DTLA0_DTLB0_DTVA0_DTVB0_DTVSM0_DPLBn1_EPS0_ELFLR0_EMLLn1_FDSI0_GRPM1_GRVWA16_GRVWB8_GSU1_GSUAMB_GSUC0_GSUWGMRR0_GLS0_ISA1201_IU1_K1_LDSTI0_LBSPPA512_LBSPPB512_LBSPPM0_LPA32_LPB32_LPM0_LRVW8_LWPMn1_MIAV1_MIWT2_2_MO40_MGRIPMn1_NTn1_NTA0_NTB0_NTC0_NTD0_NTM0_NEPBS0_NLCA1_NLCB1_ONLL0_PGR2_PLR1_PKA0_SGROBn1_SIA3_SS0_SU32_SUM0_SUS256_SPO0_SRVW0_SSO0_SVW16_SK0_SKFTR0_SKXCCM0_SGRO0_TIN0_TLDS0_TLDSM1_ULSGRO1_USL1_UIOFGRO0_USFGROn1_VSn1_VWA2_VWB2_WSGRA0_WSGRB0_WS32_WG32_4_1_WGM8_WGMXCC1_WGMXCCGn1
    SolutionIndex: 48
    SolutionNameMin: Cijk_Ailk_Bjlk_B8F8B8S_BH_Bias_SHB_HA_S_SAB_SCD_SAV_UserArgs_MT128x32x32_MI16x16x1_SN_LDSB0_AFC1_AG0_AFEM1_AFEM1_ASEM1_CLR1_CADS0_DTLA0_DTLB0_DTVA1_DTVB1_DTVSM0_DPLBn1_EPS0_ELFLR0_EMLLn1_FDSI0_GRPM1_GRVWA8_GRVWB8_GSU1_GSUAMB_GSUC0_GSUWGMRR0_GLS0_ISA1201_IU1_K1_LDSTI0_LBSPPA0_LBSPPB0_LBSPPM0_LPA0_LPB0_LPM0_LRVW8_LWPMn1_MIAV1_MIWT4_1_MO40_MGRIPMn1_NTn1_NTA0_NTB0_NTC0_NTD0_NTM0_NEPBS0_NLCA2_NLCB1_ONLL0_PGR1_PLR0_PKA0_SGROBn1_SIA3_SS0_SU32_SUM0_SUS256_SPO0_SRVW0_SSO0_SVW8_SK0_SKFTR0_SKXCCM0_SGRO0_TIN0_TLDS0_TLDSM1_ULSGRO0_USL1_UIOFGRO0_USFGROn1_VSn1_VWA1_VWB1_WSGRA0_WSGRB0_WS32_WG32_4_1_WGM8_WGMXCC1_WGMXCCGn1
    SolutionIndex: 49
    SolutionNameMin: Cijk_Ailk_Bjlk_B8F8B8S_BH_Bias_SHB_HA_S_SAB_SCD_SAV_UserArgs_MT64x128x32_MI16x16x1_SN_LDSB0_AFC1_AG0_AFEM1_AFEM1_ASEM1_CLR1_CADS0_DTLA0_DTLB0_DTVA0_DTVB1_DTVSM0_DPLBn1_EPS1_ELFLR0_EMLLn1_FDSI0_GRPM1_GRVWA1_GRVWB8_GSU1_GSUAMB_GSUC0_GSUWGMRR0_GLS0_ISA1201_IU1_K1_LDSTI0_LBSPPA512_LBSPPB0_LBSPPM0_LPA16_LPB0_LPM0_LRVW8_LWPMn1_MIAV1_MIWT1_8_MO40_MGRIPMn1_NTn1_NTA0_NTB0_NTC0_NTD0_NTM0_NEPBS0_NLCA1_NLCB2_ONLL0_PGR1_PLR1_PKA0_SGROBn1_SIA3_SS0_SU32_SUM0_SUS256_SPO0_SRVW0_SSO0_SVW8_SK0_SKFTR0_SKXCCM0_SGRO0_TIN0_TLDS0_TLDSM1_ULSGRO0_USL1_UIOFGRO0_USFGROn1_VSn1_VWA1_VWB1_WSGRA0_WSGRB0_WS32_WG64_2_1_WGM8_WGMXCC1_WGMXCCGn1
    SolutionIndex: 50
    SolutionNameMin: Cijk_Ailk_Bjlk_B8F8B8S_BH_Bias_SHB_HA_S_SAB_SCD_SAV_UserArgs_MT32x32x16_MI16x16x1_SN_LDSB0_AFC1_AG0_AFEM1_AFEM1_ASEM1_CLR1_CADS0_DTLA0_DTLB0_DTVA1_DTVB1_DTVSM0_DPLBn1_EPS0_ELFLR0_EMLLn1_FDSI0_GRPM1_GRVWA8_GRVWB8_GSU1_GSUAMB_GSUC0_GSUWGMRR0_GLS0_ISA1201_IU1_K1_LDSTI0_LBSPPA0_LBSPPB0_LBSPPM0_LPA0_LPB0_LPM0_LRVW8_LWPMn1_MIAV1_MIWT1_1_MO40_MGRIPMn1_NTn1_NTA0_NTB0_NTC0_NTD0_NTM0_NEPBS0_NLCA1_NLCB1_ONLL0_PGR1_PLR0_PKA0_SGROBn1_SIA3_SS0_SU32_SUM0_SUS256_SPO0_SRVW0_SSO0_SVW8_SK0_SKFTR0_SKXCCM0_SGRO0_TIN0_TLDS0_TLDSM1_ULSGRO0_USL1_UIOFGRO0_USFGROn1_VSn1_VWA1_VWB1_WSGRA0_WSGRB0_WS32_WG32_4_1_WGM8_WGMXCC1_WGMXCCGn1
    SolutionIndex: 51
    SolutionNameMin: Cijk_Ailk_Bjlk_B8F8B8S_BH_Bias_SHB_HA_S_SAB_SCD_SAV_UserArgs_MT64x64x64_MI16x16x1_SN_LDSB1_AFC1_AG0_AFEM1_AFEM1_ASEM1_CLR1_CADS0_DTLA0_DTLB0_DTVA0_DTVB0_DTVSM0_DPLBn1_EPS1_ELFLR0_EMLLn1_FDSI0_GRPM1_GRVWA4_GRVWB8_GSU1_GSUAMB_GSUC0_GSUWGMRR0_GLS0_ISA1201_IU4_K1_LDSTI0_LBSPPA512_LBSPPB512_LBSPPM0_LPA32_LPB32_LPM0_LRVW8_LWPMn1_MIAV1_MIWT2_2_MO40_MGRIPMn1_NTn1_NTA0_NTB0_NTC0_NTD0_NTM0_NEPBS0_NLCA1_NLCB1_ONLL0_PGR1_PLR1_PKA0_SGROBn1_SIA2_SS0_SU32_SUM0_SUS256_SPO0_SRVW0_SSO0_SVW16_SK0_SKFTR0_SKXCCM0_SGRO0_TIN0_TLDS0_TLDSM1_ULSGRO0_USL1_UIOFGRO0_USFGROn1_VSn1_VWA2_VWB2_WSGRA0_WSGRB0_WS32_WG32_4_1_WGM8_WGMXCC1_WGMXCCGn1
    SolutionIndex: 52
    SolutionNameMin: Cijk_Ailk_Bjlk_B8F8B8S_BH_Bias_SHB_HA_S_SAB_SCD_SAV_UserArgs_MT64x64x32_MI16x16x1_SN_LDSB1_AFC1_AG0_AFEM1_AFEM1_ASEM1_CLR1_CADS0_DTLA0_DTLB0_DTVA0_DTVB0_DTVSM0_DPLBn1_EPS1_ELFLR0_EMLLn1_FDSI0_GRPM1_GRVWA4_GRVWB4_GSU1_GSUAMB_GSUC0_GSUWGMRR0_GLS0_ISA1201_IU2_K1_LDSTI0_LBSPPA512_LBSPPB512_LBSPPM0_LPA32_LPB32_LPM0_LRVW8_LWPMn1_MIAV1_MIWT2_2_MO40_MGRIPMn1_NTn1_NTA0_NTB0_NTC0_NTD0_NTM0_NEPBS0_NLCA1_NLCB1_ONLL0_PGR1_PLR1_PKA0_SGROBn1_SIA2_SS0_SU32_SUM0_SUS256_SPO0_SRVW0_SSO0_SVW16_SK0_SKFTR0_SKXCCM0_SGRO0_TIN0_TLDS0_TLDSM1_ULSGRO0_USL1_UIOFGRO0_USFGROn1_VSn1_VWA2_VWB2_WSGRA0_WSGRB0_WS32_WG32_4_1_WGM8_WGMXCC1_WGMXCCGn1
    SolutionIndex: 53
    SolutionNameMin: Cijk_Ailk_Bjlk_B8F8B8S_BH_Bias_SHB_HA_S_SAB_SCD_SAV_UserArgs_MT64x64x32_MI16x16x1_SN_LDSB1_AFC1_AG0_AFEM1_AFEM1_ASEM1_CLR1_CADS0_DTLA0_DTLB0_DTVA0_DTVB0_DTVSM0_DPLBn1_EPS0_ELFLR0_EMLLn1_FDSI0_GRPM1_GRVWA4_GRVWB4_GSU1_GSUAMB_GSUC0_GSUWGMRR0_GLS0_ISA1201_IU2_K1_LDSTI0_LBSPPA512_LBSPPB512_LBSPPM0_LPA32_LPB32_LPM0_LRVW8_LWPMn1_MIAV1_MIWT2_2_MO40_MGRIPMn1_NTn1_NTA0_NTB0_NTC0_NTD0_NTM0_NEPBS0_NLCA1_NLCB1_ONLL0_PGR2_PLR1_PKA0_SGROBn1_SIA2_SS0_SU32_SUM0_SUS256_SPO0_SRVW0_SSO0_SVW16_SK0_SKFTR0_SKXCCM0_SGRO0_TIN0_TLDS0_TLDSM1_ULSGRO1_USL1_UIOFGRO0_USFGROn1_VSn1_VWA2_VWB2_WSGRA0_WSGRB0_WS32_WG32_4_1_WGM8_WGMXCC1_WGMXCCGn1
    SolutionIndex: 54
    SolutionNameMin: Cijk_Ailk_Bjlk_B8F8B8S_BH_Bias_SHB_HA_S_SAB_SCD_SAV_UserArgs_MT128x32x32_MI16x16x1_SN_LDSB0_AFC1_AG0_AFEM1_AFEM1_ASEM1_CLR1_CADS0_DTLA0_DTLB0_DTVA1_DTVB0_DTVSM0_DPLBn1_EPS0_ELFLR0_EMLLn1_FDSI0_GRPM1_GRVWA8_GRVWB1_GSU1_GSUAMB_GSUC0_GSUWGMRR0_GLS0_ISA1201_IU1_K1_LDSTI0_LBSPPA0_LBSPPB256_LBSPPM0_LPA0_LPB16_LPM0_LRVW8_LWPMn1_MIAV1_MIWT4_1_MO40_MGRIPMn1_NTn1_NTA0_NTB0_NTC0_NTD0_NTM0_NEPBS0_NLCA2_NLCB1_ONLL0_PGR2_PLR1_PKA0_SGROBn1_SIA3_SS0_SU32_SUM0_SUS256_SPO0_SRVW0_SSO0_SVW8_SK0_SKFTR0_SKXCCM0_SGRO0_TIN0_TLDS0_TLDSM1_ULSGRO0_USL1_UIOFGRO0_USFGROn1_VSn1_VWA1_VWB1_WSGRA0_WSGRB0_WS32_WG32_4_1_WGM8_WGMXCC1_WGMXCCGn1
    SolutionIndex: 55
    SolutionNameMin: Cijk_Ailk_Bjlk_B8F8B8S_BH_Bias_SHB_HA_S_SAB_SCD_SAV_UserArgs_MT64x64x16_MI16x16x1_SN_LDSB1_AFC1_AG0_AFEM1_AFEM1_ASEM1_CLR1_CADS0_DTLA0_DTLB0_DTVA0_DTVB0_DTVSM0_DPLBn1_EPS1_ELFLR0_EMLLn1_FDSI0_GRPM1_GRVWA4_GRVWB4_GSU1_GSUAMB_GSUC0_GSUWGMRR0_GLS0_ISA1201_IU1_K1_LDSTI0_LBSPPA512_LBSPPB512_LBSPPM0_LPA32_LPB32_LPM0_LRVW8_LWPMn1_MIAV1_MIWT2_2_MO40_MGRIPMn1_NTn1_NTA0_NTB0_NTC0_NTD0_NTM0_NEPBS0_NLCA1_NLCB1_ONLL0_PGR1_PLR1_PKA0_SGROBn1_SIA2_SS0_SU32_SUM0_SUS256_SPO0_SRVW0_SSO0_SVW16_SK0_SKFTR0_SKXCCM0_SGRO0_TIN0_TLDS0_TLDSM1_ULSGRO0_USL1_UIOFGRO0_USFGROn1_VSn1_VWA2_VWB2_WSGRA0_WSGRB0_WS32_WG32_4_1_WGM8_WGMXCC1_WGMXCCGn1
    SolutionIndex: 56
    SolutionNameMin: Cijk_Ailk_Bjlk_B8F8B8S_BH_Bias_SHB_HA_S_SAB_SCD_SAV_UserArgs_MT16x512x32_MI16x16x1_SN_LDSB0_AFC1_AG0_AFEM1_AFEM1_ASEM1_CLR1_CADS0_DTLA0_DTLB0_DTVA0_DTVB1_DTVSM0_DPLBn1_EPS0_ELFLR0_EMLLn1_FDSI0_GRPM1_GRVWA4_GRVWB8_GSU1_GSUAMB_GSUC0_GSUWGMRR0_GLS0_ISA1201_IU1_K1_LDSTI0_LBSPPA128_LBSPPB0_LBSPPM0_LPA16_LPB0_LPM0_LRVW8_LWPMn1_MIAV1_MIWT1_8_MO40_MGRIPMn1_NTn1_NTA0_NTB0_NTC0_NTD0_NTM0_NEPBS0_NLCA1_NLCB2_ONLL0_PGR2_PLR1_PKA0_SGROBn1_SIA3_SS0_SU32_SUM0_SUS256_SPO0_SRVW0_SSO0_SVW8_SK0_SKFTR0_SKXCCM0_SGRO0_TIN0_TLDS0_TLDSM1_ULSGRO0_USL1_UIOFGRO0_USFGROn1_VSn1_VWA1_VWB1_WSGRA0_WSGRB0_WS32_WG16_8_1_WGM8_WGMXCC1_WGMXCCGn1
    SolutionIndex: 57
    SolutionNameMin: Cijk_Ailk_Bjlk_B8F8B8S_BH_Bias_SHB_HA_S_SAB_SCD_SAV_UserArgs_MT128x64x16_MI16x16x1_SN_LDSB0_AFC1_AG0_AFEM1_AFEM1_ASEM1_CLR1_CADS0_DTLA0_DTLB0_DTVA1_DTVB1_DTVSM0_DPLBn1_EPS0_ELFLR0_EMLLn1_FDSI0_GRPM1_GRVWA8_GRVWB8_GSU1_GSUAMB_GSUC0_GSUWGMRR0_GLS0_ISA1201_IU1_K1_LDSTI0_LBSPPA0_LBSPPB0_LBSPPM0_LPA0_LPB0_LPM0_LRVW8_LWPMn1_MIAV1_MIWT8_1_MO40_MGRIPMn1_NTn1_NTA0_NTB0_NTC0_NTD0_NTM0_NEPBS0_NLCA1_NLCB1_ONLL0_PGR1_PLR0_PKA0_SGROBn1_SIA3_SS0_SU32_SUM0_SUS256_SPO0_SRVW0_SSO0_SVW8_SK0_SKFTR0_SKXCCM0_SGRO0_TIN0_TLDS0_TLDSM1_ULSGRO0_USL1_UIOFGRO0_USFGROn1_VSn1_VWA1_VWB1_WSGRA0_WSGRB0_WS32_WG16_8_1_WGM8_WGMXCC1_WGMXCCGn1
    SolutionIndex: 58
    SolutionNameMin: Cijk_Ailk_Bjlk_B8F8B8S_BH_Bias_SHB_HA_S_SAB_SCD_SAV_UserArgs_MT16x32x64_MI16x16x1_SN_LDSB0_AFC1_AG0_AFEM1_AFEM1_ASEM1_CLR1_CADS0_DTLA0_DTLB0_DTVA1_DTVB1_DTVSM0_DPLBn1_EPS0_ELFLR0_EMLLn1_FDSI0_GRPM1_GRVWA8_GRVWB8_GSU1_GSUAMB_GSUC0_GSUWGMRR0_GLS0_ISA1201_IU1_K1_LDSTI0_LBSPPA0_LBSPPB0_LBSPPM0_LPA0_LPB0_LPM0_LRVW8_LWPMn1_MIAV1_MIWT1_1_MO40_MGRIPMn1_NTn1_NTA0_NTB0_NTC0_NTD0_NTM0_NEPBS0_NLCA1_NLCB1_ONLL0_PGR1_PLR0_PKA0_SGROBn1_SIA3_SS1_SU32_SUM0_SUS256_SPO0_SRVW0_SSO0_SVW1_SK0_SKFTR0_SKXCCM0_SGRO0_TIN0_TLDS0_TLDSM1_ULSGRO0_USL1_UIOFGRO0_USFGROn1_VSn1_VWA1_VWB1_WSGRA0_WSGRB0_WS32_WG16_4_1_WGM8_WGMXCC1_WGMXCCGn1
    SolutionIndex: 59
    SolutionNameMin: Cijk_Ailk_Bjlk_B8F8B8S_BH_Bias_SHB_HA_S_SAB_SCD_SAV_UserArgs_MT64x64x64_MI16x16x1_SN_LDSB1_AFC1_AG0_AFEM1_AFEM1_ASEM1_CLR1_CADS0_DTLA0_DTLB0_DTVA0_DTVB0_DTVSM0_DPLBn1_EPS0_ELFLR0_EMLLn1_FDSI0_GRPM1_GRVWA8_GRVWB4_GSU1_GSUAMB_GSUC0_GSUWGMRR0_GLS0_ISA1201_IU4_K1_LDSTI0_LBSPPA512_LBSPPB512_LBSPPM0_LPA32_LPB32_LPM0_LRVW8_LWPMn1_MIAV1_MIWT2_2_MO40_MGRIPMn1_NTn1_NTA0_NTB0_NTC0_NTD0_NTM0_NEPBS0_NLCA1_NLCB1_ONLL0_PGR2_PLR1_PKA0_SGROBn1_SIA2_SS0_SU32_SUM0_SUS256_SPO0_SRVW0_SSO0_SVW16_SK0_SKFTR0_SKXCCM0_SGRO0_TIN0_TLDS0_TLDSM1_ULSGRO0_USL1_UIOFGRO0_USFGROn1_VSn1_VWA2_VWB2_WSGRA0_WSGRB0_WS32_WG32_4_1_WGM8_WGMXCC1_WGMXCCGn1
    SolutionIndex: 60
    SolutionNameMin: Cijk_Ailk_Bjlk_B8F8B8S_BH_Bias_SHB_HA_S_SAB_SCD_SAV_UserArgs_MT64x64x16_MI16x16x1_SN_LDSB1_AFC1_AG0_AFEM1_AFEM1_ASEM1_CLR1_CADS0_DTLA0_DTLB0_DTVA0_DTVB0_DTVSM0_DPLBn1_EPS1_ELFLR0_EMLLn1_FDSI0_GRPM1_GRVWA8_GRVWB4_GSU1_GSUAMB_GSUC0_GSUWGMRR0_GLS0_ISA1201_IU1_K1_LDSTI0_LBSPPA512_LBSPPB512_LBSPPM0_LPA32_LPB32_LPM0_LRVW8_LWPMn1_MIAV1_MIWT2_2_MO40_MGRIPMn1_NTn1_NTA0_NTB0_NTC0_NTD0_NTM0_NEPBS0_NLCA1_NLCB1_ONLL0_PGR1_PLR1_PKA0_SGROBn1_SIA2_SS0_SU32_SUM0_SUS256_SPO0_SRVW0_SSO0_SVW16_SK0_SKFTR0_SKXCCM0_SGRO0_TIN0_TLDS0_TLDSM1_ULSGRO0_USL1_UIOFGRO0_USFGROn1_VSn1_VWA2_VWB2_WSGRA0_WSGRB0_WS32_WG32_4_1_WGM8_WGMXCC1_WGMXCCGn1
    SolutionIndex: 61
    SolutionNameMin: Cijk_Ailk_Bjlk_B8F8B8S_BH_Bias_SHB_HA_S_SAB_SCD_SAV_UserArgs_MT64x64x64_MI16x16x1_SN_LDSB0_AFC1_AG0_AFEM1_AFEM1_ASEM1_CLR1_CADS0_DTLA0_DTLB0_DTVA0_DTVB1_DTVSM0_DPLBn1_EPS1_ELFLR0_EMLLn1_FDSI0_GRPM1_GRVWA4_GRVWB8_GSU1_GSUAMB_GSUC0_GSUWGMRR0_GLS0_ISA1201_IU1_K1_LDSTI0_LBSPPA512_LBSPPB0_LBSPPM0_LPA32_LPB0_LPM0_LRVW8_LWPMn1_MIAV1_MIWT2_2_MO40_MGRIPMn1_NTn1_NTA0_NTB0_NTC0_NTD0_NTM0_NEPBS0_NLCA1_NLCB4_ONLL0_PGR1_PLR1_PKA0_SGROBn1_SIA3_SS0_SU32_SUM0_SUS256_SPO0_SRVW0_SSO0_SVW16_SK0_SKFTR0_SKXCCM0_SGRO0_TIN0_TLDS0_TLDSM1_ULSGRO0_USL1_UIOFGRO0_USFGROn1_VSn1_VWA2_VWB1_WSGRA0_WSGRB0_WS32_WG32_4_1_WGM8_WGMXCC1_WGMXCCGn1
    SolutionIndex: 62
    SolutionNameMin: Cijk_Ailk_Bjlk_B8F8B8S_BH_Bias_SHB_HA_S_SAB_SCD_SAV_UserArgs_MT64x64x64_MI16x16x1_SN_LDSB0_AFC1_AG0_AFEM1_AFEM1_ASEM1_CLR1_CADS0_DTLA0_DTLB0_DTVA0_DTVB1_DTVSM0_DPLBn1_EPS1_ELFLR0_EMLLn1_FDSI0_GRPM1_GRVWA8_GRVWB8_GSU1_GSUAMB_GSUC0_GSUWGMRR0_GLS0_ISA1201_IU1_K1_LDSTI0_LBSPPA512_LBSPPB0_LBSPPM0_LPA32_LPB0_LPM0_LRVW8_LWPMn1_MIAV1_MIWT2_2_MO40_MGRIPMn1_NTn1_NTA0_NTB0_NTC0_NTD0_NTM0_NEPBS0_NLCA1_NLCB4_ONLL0_PGR1_PLR1_PKA0_SGROBn1_SIA3_SS0_SU32_SUM0_SUS256_SPO0_SRVW0_SSO0_SVW16_SK0_SKFTR0_SKXCCM0_SGRO0_TIN0_TLDS0_TLDSM1_ULSGRO0_USL1_UIOFGRO0_USFGROn1_VSn1_VWA2_VWB1_WSGRA0_WSGRB0_WS32_WG32_4_1_WGM8_WGMXCC1_WGMXCCGn1
    SolutionIndex: 63
    SolutionNameMin: Cijk_Ailk_Bjlk_B8F8B8S_BH_Bias_SHB_HA_S_SAB_SCD_SAV_UserArgs_MT64x64x32_MI16x16x1_SN_LDSB1_AFC1_AG0_AFEM1_AFEM1_ASEM1_CLR1_CADS0_DTLA0_DTLB0_DTVA0_DTVB0_DTVSM0_DPLBn1_EPS1_ELFLR0_EMLLn1_FDSI0_GRPM1_GRVWA1_GRVWB4_GSU1_GSUAMB_GSUC0_GSUWGMRR0_GLS0_ISA1201_IU2_K1_LDSTI0_LBSPPA512_LBSPPB512_LBSPPM0_LPA32_LPB32_LPM0_LRVW8_LWPMn1_MIAV1_MIWT2_2_MO40_MGRIPMn1_NTn1_NTA0_NTB0_NTC0_NTD0_NTM0_NEPBS0_NLCA1_NLCB1_ONLL0_PGR1_PLR1_PKA0_SGROBn1_SIA2_SS1_SU32_SUM0_SUS256_SPO0_SRVW0_SSO0_SVW2_SK0_SKFTR0_SKXCCM0_SGRO0_TIN0_TLDS0_TLDSM1_ULSGRO0_USL1_UIOFGRO0_USFGROn1_VSn1_VWA2_VWB2_WSGRA0_WSGRB0_WS32_WG32_4_1_WGM8_WGMXCC1_WGMXCCGn1
    SolutionIndex: 64
    SolutionNameMin: Cijk_Ailk_Bjlk_B8F8B8S_BH_Bias_SHB_HA_S_SAB_SCD_SAV_UserArgs_MT16x512x32_MI16x16x1_SN_LDSB0_AFC1_AG0_AFEM1_AFEM1_ASEM1_CLR1_CADS0_DTLA0_DTLB0_DTVA0_DTVB1_DTVSM0_DPLBn1_EPS1_ELFLR0_EMLLn1_FDSI0_GRPM1_GRVWA1_GRVWB8_GSU1_GSUAMB_GSUC0_GSUWGMRR0_GLS0_ISA1201_IU1_K1_LDSTI0_LBSPPA128_LBSPPB0_LBSPPM0_LPA16_LPB0_LPM0_LRVW8_LWPMn1_MIAV1_MIWT1_8_MO40_MGRIPMn1_NTn1_NTA0_NTB0_NTC0_NTD0_NTM0_NEPBS0_NLCA1_NLCB2_ONLL0_PGR1_PLR1_PKA0_SGROBn1_SIA3_SS0_SU32_SUM0_SUS256_SPO0_SRVW0_SSO0_SVW8_SK0_SKFTR0_SKXCCM0_SGRO0_TIN0_TLDS0_TLDSM1_ULSGRO0_USL1_UIOFGRO0_USFGROn1_VSn1_VWA1_VWB1_WSGRA0_WSGRB0_WS32_WG16_8_1_WGM8_WGMXCC1_WGMXCCGn1
    SolutionIndex: 65
    SolutionNameMin: Cijk_Ailk_Bjlk_B8F8B8S_BH_Bias_SHB_HA_S_SAB_SCD_SAV_UserArgs_MT32x128x16_MI16x16x1_SN_LDSB0_AFC1_AG0_AFEM1_AFEM1_ASEM1_CLR1_CADS0_DTLA0_DTLB0_DTVA1_DTVB1_DTVSM0_DPLBn1_EPS0_ELFLR0_EMLLn1_FDSI0_GRPM1_GRVWA8_GRVWB8_GSU1_GSUAMB_GSUC0_GSUWGMRR0_GLS0_ISA1201_IU1_K1_LDSTI0_LBSPPA0_LBSPPB0_LBSPPM0_LPA0_LPB0_LPM0_LRVW8_LWPMn1_MIAV1_MIWT1_4_MO40_MGRIPMn1_NTn1_NTA0_NTB0_NTC0_NTD0_NTM0_NEPBS0_NLCA1_NLCB1_ONLL0_PGR1_PLR0_PKA0_SGROBn1_SIA3_SS0_SU32_SUM0_SUS256_SPO0_SRVW0_SSO0_SVW8_SK0_SKFTR0_SKXCCM0_SGRO0_TIN0_TLDS0_TLDSM1_ULSGRO0_USL1_UIOFGRO0_USFGROn1_VSn1_VWA1_VWB1_WSGRA0_WSGRB0_WS32_WG32_4_1_WGM8_WGMXCC1_WGMXCCGn1
    SolutionIndex: 66
    SolutionNameMin: Cijk_Ailk_Bjlk_B8F8B8S_BH_Bias_SHB_HA_S_SAB_SCD_SAV_UserArgs_MT16x512x32_MI16x16x1_SN_LDSB0_AFC1_AG0_AFEM1_AFEM1_ASEM1_CLR1_CADS0_DTLA0_DTLB0_DTVA0_DTVB1_DTVSM0_DPLBn1_EPS1_ELFLR0_EMLLn1_FDSI0_GRPM1_GRVWA4_GRVWB8_GSU1_GSUAMB_GSUC0_GSUWGMRR0_GLS0_ISA1201_IU1_K1_LDSTI0_LBSPPA128_LBSPPB0_LBSPPM0_LPA16_LPB0_LPM0_LRVW8_LWPMn1_MIAV1_MIWT1_8_MO40_MGRIPMn1_NTn1_NTA0_NTB0_NTC0_NTD0_NTM0_NEPBS0_NLCA1_NLCB2_ONLL0_PGR1_PLR1_PKA0_SGROBn1_SIA3_SS0_SU32_SUM0_SUS256_SPO0_SRVW0_SSO0_SVW8_SK0_SKFTR0_SKXCCM0_SGRO0_TIN0_TLDS0_TLDSM1_ULSGRO0_USL1_UIOFGRO0_USFGROn1_VSn1_VWA1_VWB1_WSGRA0_WSGRB0_WS32_WG16_8_1_WGM8_WGMXCC1_WGMXCCGn1
    SolutionIndex: 67
    SolutionNameMin: Cijk_Ailk_Bjlk_B8F8B8S_BH_Bias_SHB_HA_S_SAB_SCD_SAV_UserArgs_MT64x128x16_MI16x16x1_SN_LDSB0_AFC1_AG0_AFEM1_AFEM1_ASEM1_CLR1_CADS0_DTLA0_DTLB0_DTVA1_DTVB1_DTVSM0_DPLBn1_EPS0_ELFLR0_EMLLn1_FDSI0_GRPM1_GRVWA8_GRVWB8_GSU1_GSUAMB_GSUC0_GSUWGMRR0_GLS0_ISA1201_IU1_K1_LDSTI0_LBSPPA0_LBSPPB0_LBSPPM0_LPA0_LPB0_LPM0_LRVW8_LWPMn1_MIAV1_MIWT1_8_MO40_MGRIPMn1_NTn1_NTA0_NTB0_NTC0_NTD0_NTM0_NEPBS0_NLCA1_NLCB1_ONLL0_PGR1_PLR0_PKA0_SGROBn1_SIA3_SS0_SU32_SUM0_SUS256_SPO0_SRVW0_SSO0_SVW8_SK0_SKFTR0_SKXCCM0_SGRO0_TIN0_TLDS0_TLDSM1_ULSGRO0_USL1_UIOFGRO0_USFGROn1_VSn1_VWA1_VWB1_WSGRA0_WSGRB0_WS32_WG64_2_1_WGM8_WGMXCC1_WGMXCCGn1
    SolutionIndex: 68
    SolutionNameMin: Cijk_Ailk_Bjlk_B8F8B8S_BH_Bias_SHB_HA_S_SAB_SCD_SAV_UserArgs_MT512x16x32_MI16x16x1_SN_LDSB0_AFC1_AG0_AFEM1_AFEM1_ASEM1_CLR1_CADS0_DTLA0_DTLB0_DTVA1_DTVB0_DTVSM0_DPLBn1_EPS1_ELFLR0_EMLLn1_FDSI0_GRPM1_GRVWA8_GRVWB1_GSU1_GSUAMB_GSUC0_GSUWGMRR0_GLS0_ISA1201_IU1_K1_LDSTI0_LBSPPA0_LBSPPB128_LBSPPM0_LPA0_LPB16_LPM0_LRVW8_LWPMn1_MIAV1_MIWT8_1_MO40_MGRIPMn1_NTn1_NTA0_NTB0_NTC0_NTD0_NTM0_NEPBS0_NLCA2_NLCB1_ONLL0_PGR1_PLR1_PKA0_SGROBn1_SIA3_SS0_SU32_SUM0_SUS256_SPO0_SRVW0_SSO0_SVW8_SK0_SKFTR0_SKXCCM0_SGRO0_TIN0_TLDS0_TLDSM1_ULSGRO0_USL1_UIOFGRO0_USFGROn1_VSn1_VWA1_VWB1_WSGRA0_WSGRB0_WS32_WG64_2_1_WGM8_WGMXCC1_WGMXCCGn1
    SolutionIndex: 69
    SolutionNameMin: Cijk_Ailk_Bjlk_B8F8B8S_BH_Bias_SHB_HA_S_SAB_SCD_SAV_UserArgs_MT128x32x64_MI16x16x1_SN_LDSB1_AFC1_AG0_AFEM1_AFEM1_ASEM1_CLR1_CADS0_DTLA0_DTLB0_DTVA0_DTVB0_DTVSM0_DPLBn1_EPS1_ELFLR0_EMLLn1_FDSI0_GRPM1_GRVWA8_GRVWB4_GSU1_GSUAMB_GSUC0_GSUWGMRR0_GLS0_ISA1201_IU4_K1_LDSTI0_LBSPPA1024_LBSPPB256_LBSPPM0_LPA64_LPB16_LPM0_LRVW8_LWPMn1_MIAV1_MIWT4_1_MO40_MGRIPMn1_NTn1_NTA0_NTB0_NTC0_NTD0_NTM0_NEPBS0_NLCA1_NLCB1_ONLL0_PGR1_PLR1_PKA0_SGROBn1_SIA2_SS1_SU32_SUM0_SUS256_SPO0_SRVW0_SSO0_SVW4_SK0_SKFTR0_SKXCCM0_SGRO0_TIN0_TLDS0_TLDSM1_ULSGRO0_USL1_UIOFGRO0_USFGROn1_VSn1_VWA4_VWB1_WSGRA0_WSGRB0_WS32_WG32_4_1_WGM8_WGMXCC1_WGMXCCGn1
    SolutionIndex: 70
    SolutionNameMin: Cijk_Ailk_Bjlk_B8F8B8S_BH_Bias_SHB_HA_S_SAB_SCD_SAV_UserArgs_MT64x64x32_MI16x16x1_SN_LDSB1_AFC1_AG0_AFEM1_AFEM1_ASEM1_CLR1_CADS0_DTLA0_DTLB0_DTVA0_DTVB0_DTVSM0_DPLBn1_EPS0_ELFLR0_EMLLn1_FDSI0_GRPM1_GRVWA4_GRVWB8_GSU1_GSUAMB_GSUC0_GSUWGMRR0_GLS0_ISA1201_IU2_K1_LDSTI0_LBSPPA512_LBSPPB512_LBSPPM0_LPA32_LPB32_LPM0_LRVW8_LWPMn1_MIAV1_MIWT2_2_MO40_MGRIPMn1_NTn1_NTA0_NTB0_NTC0_NTD0_NTM0_NEPBS0_NLCA1_NLCB1_ONLL0_PGR2_PLR1_PKA0_SGROBn1_SIA2_SS0_SU32_SUM0_SUS256_SPO0_SRVW0_SSO0_SVW16_SK0_SKFTR0_SKXCCM0_SGRO0_TIN0_TLDS0_TLDSM1_ULSGRO0_USL1_UIOFGRO0_USFGROn1_VSn1_VWA2_VWB2_WSGRA0_WSGRB0_WS32_WG32_4_1_WGM8_WGMXCC1_WGMXCCGn1
    SolutionIndex: 71
    SolutionNameMin: Cijk_Ailk_Bjlk_B8F8B8S_BH_Bias_SHB_HA_S_SAB_SCD_SAV_UserArgs_MT64x64x32_MI16x16x1_SN_LDSB1_AFC1_AG0_AFEM1_AFEM1_ASEM1_CLR1_CADS0_DTLA0_DTLB0_DTVA0_DTVB0_DTVSM0_DPLBn1_EPS0_ELFLR0_EMLLn1_FDSI0_GRPM1_GRVWA4_GRVWB16_GSU1_GSUAMB_GSUC0_GSUWGMRR0_GLS0_ISA1201_IU2_K1_LDSTI0_LBSPPA512_LBSPPB512_LBSPPM0_LPA32_LPB32_LPM0_LRVW8_LWPMn1_MIAV1_MIWT2_2_MO40_MGRIPMn1_NTn1_NTA0_NTB0_NTC0_NTD0_NTM0_NEPBS0_NLCA1_NLCB1_ONLL0_PGR2_PLR1_PKA0_SGROBn1_SIA2_SS0_SU32_SUM0_SUS256_SPO0_SRVW0_SSO0_SVW16_SK0_SKFTR0_SKXCCM0_SGRO0_TIN0_TLDS0_TLDSM1_ULSGRO0_USL1_UIOFGRO0_USFGROn1_VSn1_VWA2_VWB2_WSGRA0_WSGRB0_WS32_WG32_4_1_WGM8_WGMXCC1_WGMXCCGn1
    SolutionIndex: 72
    SolutionNameMin: Cijk_Ailk_Bjlk_B8F8B8S_BH_Bias_SHB_HA_S_SAB_SCD_SAV_UserArgs_MT64x64x64_MI16x16x1_SN_LDSB1_AFC1_AG0_AFEM1_AFEM1_ASEM1_CLR1_CADS0_DTLA0_DTLB0_DTVA0_DTVB0_DTVSM0_DPLBn1_EPS0_ELFLR0_EMLLn1_FDSI0_GRPM1_GRVWA4_GRVWB8_GSU1_GSUAMB_GSUC0_GSUWGMRR0_GLS0_ISA1201_IU4_K1_LDSTI0_LBSPPA512_LBSPPB512_LBSPPM0_LPA32_LPB32_LPM0_LRVW8_LWPMn1_MIAV1_MIWT2_2_MO40_MGRIPMn1_NTn1_NTA0_NTB0_NTC0_NTD0_NTM0_NEPBS0_NLCA1_NLCB1_ONLL0_PGR2_PLR1_PKA0_SGROBn1_SIA2_SS1_SU32_SUM0_SUS256_SPO0_SRVW0_SSO0_SVW2_SK0_SKFTR0_SKXCCM0_SGRO0_TIN0_TLDS0_TLDSM1_ULSGRO0_USL1_UIOFGRO0_USFGROn1_VSn1_VWA2_VWB2_WSGRA0_WSGRB0_WS32_WG32_4_1_WGM8_WGMXCC1_WGMXCCGn1
    SolutionIndex: 73
    SolutionNameMin: Cijk_Ailk_Bjlk_B8F8B8S_BH_Bias_SHB_HA_S_SAB_SCD_SAV_UserArgs_MT64x128x32_MI16x16x1_SN_LDSB0_AFC1_AG0_AFEM1_AFEM1_ASEM1_CLR1_CADS0_DTLA0_DTLB0_DTVA1_DTVB1_DTVSM0_DPLBn1_EPS0_ELFLR0_EMLLn1_FDSI0_GRPM1_GRVWA8_GRVWB8_GSU1_GSUAMB_GSUC0_GSUWGMRR0_GLS0_ISA1201_IU1_K1_LDSTI0_LBSPPA0_LBSPPB0_LBSPPM0_LPA0_LPB0_LPM0_LRVW8_LWPMn1_MIAV1_MIWT1_8_MO40_MGRIPMn1_NTn1_NTA0_NTB0_NTC0_NTD0_NTM0_NEPBS0_NLCA1_NLCB2_ONLL0_PGR1_PLR0_PKA0_SGROBn1_SIA3_SS0_SU32_SUM0_SUS256_SPO0_SRVW0_SSO0_SVW8_SK0_SKFTR0_SKXCCM0_SGRO0_TIN0_TLDS0_TLDSM1_ULSGRO0_USL1_UIOFGRO0_USFGROn1_VSn1_VWA1_VWB1_WSGRA0_WSGRB0_WS32_WG64_2_1_WGM8_WGMXCC1_WGMXCCGn1
    SolutionIndex: 74
    SolutionNameMin: Cijk_Ailk_Bjlk_B8F8B8S_BH_Bias_SHB_HA_S_SAB_SCD_SAV_UserArgs_MT128x64x32_MI16x16x1_SN_LDSB0_AFC1_AG0_AFEM1_AFEM1_ASEM1_CLR1_CADS0_DTLA0_DTLB0_DTVA1_DTVB1_DTVSM0_DPLBn1_EPS0_ELFLR0_EMLLn1_FDSI0_GRPM1_GRVWA8_GRVWB8_GSU1_GSUAMB_GSUC0_GSUWGMRR0_GLS0_ISA1201_IU1_K1_LDSTI0_LBSPPA0_LBSPPB0_LBSPPM0_LPA0_LPB0_LPM0_LRVW8_LWPMn1_MIAV1_MIWT8_1_MO40_MGRIPMn1_NTn1_NTA0_NTB0_NTC0_NTD0_NTM0_NEPBS0_NLCA2_NLCB1_ONLL0_PGR1_PLR0_PKA0_SGROBn1_SIA3_SS0_SU32_SUM0_SUS256_SPO0_SRVW0_SSO0_SVW8_SK0_SKFTR0_SKXCCM0_SGRO0_TIN0_TLDS0_TLDSM1_ULSGRO0_USL1_UIOFGRO0_USFGROn1_VSn1_VWA1_VWB1_WSGRA0_WSGRB0_WS32_WG16_8_1_WGM8_WGMXCC1_WGMXCCGn1
    SolutionIndex: 75
    SolutionNameMin: Cijk_Ailk_Bjlk_B8F8B8S_BH_Bias_SHB_HA_S_SAB_SCD_SAV_UserArgs_MT32x32x16_MI16x16x1_SN_LDSB1_AFC1_AG0_AFEM1_AFEM1_ASEM1_CLR1_CADS0_DTLA0_DTLB0_DTVA0_DTVB0_DTVSM0_DPLBn1_EPS1_ELFLR0_EMLLn1_FDSI0_GRPM1_GRVWA1_GRVWB1_GSU1_GSUAMB_GSUC0_GSUWGMRR0_GLS0_ISA1201_IU1_K1_LDSTI0_LBSPPA256_LBSPPB256_LBSPPM0_LPA16_LPB16_LPM0_LRVW8_LWPMn1_MIAV1_MIWT1_1_MO40_MGRIPMn1_NTn1_NTA0_NTB0_NTC0_NTD0_NTM0_NEPBS0_NLCA1_NLCB1_ONLL0_PGR1_PLR1_PKA0_SGROBn1_SIA2_SS0_SU32_SUM0_SUS256_SPO0_SRVW0_SSO0_SVW8_SK0_SKFTR0_SKXCCM0_SGRO0_TIN0_TLDS0_TLDSM1_ULSGRO0_USL1_UIOFGRO0_USFGROn1_VSn1_VWA1_VWB1_WSGRA0_WSGRB0_WS32_WG32_4_1_WGM8_WGMXCC1_WGMXCCGn1
    SolutionIndex: 76
    SolutionNameMin: Cijk_Ailk_Bjlk_B8F8B8S_BH_Bias_SHB_HA_S_SAB_SCD_SAV_UserArgs_MT64x64x64_MI16x16x1_SN_LDSB1_AFC1_AG0_AFEM1_AFEM1_ASEM1_CLR1_CADS0_DTLA0_DTLB0_DTVA0_DTVB0_DTVSM0_DPLBn1_EPS1_ELFLR0_EMLLn1_FDSI0_GRPM1_GRVWA8_GRVWB8_GSU1_GSUAMB_GSUC0_GSUWGMRR0_GLS0_ISA1201_IU4_K1_LDSTI0_LBSPPA512_LBSPPB512_LBSPPM0_LPA32_LPB32_LPM0_LRVW8_LWPMn1_MIAV1_MIWT2_2_MO40_MGRIPMn1_NTn1_NTA0_NTB0_NTC0_NTD0_NTM0_NEPBS0_NLCA1_NLCB1_ONLL0_PGR1_PLR1_PKA0_SGROBn1_SIA2_SS0_SU32_SUM0_SUS256_SPO0_SRVW0_SSO0_SVW16_SK0_SKFTR0_SKXCCM0_SGRO0_TIN0_TLDS0_TLDSM1_ULSGRO0_USL1_UIOFGRO0_USFGROn1_VSn1_VWA2_VWB2_WSGRA0_WSGRB0_WS32_WG32_4_1_WGM8_WGMXCC1_WGMXCCGn1
    SolutionIndex: 77
    SolutionNameMin: Cijk_Ailk_Bjlk_B8F8B8S_BH_Bias_SHB_HA_S_SAB_SCD_SAV_UserArgs_MT32x128x64_MI16x16x1_SN_LDSB1_AFC1_AG0_AFEM1_AFEM1_ASEM1_CLR1_CADS0_DTLA0_DTLB0_DTVA0_DTVB0_DTVSM0_DPLBn1_EPS0_ELFLR0_EMLLn1_FDSI0_GRPM1_GRVWA4_GRVWB16_GSU1_GSUAMB_GSUC0_GSUWGMRR0_GLS0_ISA1201_IU4_K1_LDSTI0_LBSPPA256_LBSPPB1024_LBSPPM0_LPA16_LPB64_LPM0_LRVW8_LWPMn1_MIAV1_MIWT1_4_MO40_MGRIPMn1_NTn1_NTA0_NTB0_NTC0_NTD0_NTM0_NEPBS0_NLCA1_NLCB1_ONLL0_PGR2_PLR1_PKA0_SGROBn1_SIA2_SS0_SU32_SUM0_SUS256_SPO0_SRVW0_SSO0_SVW8_SK0_SKFTR0_SKXCCM0_SGRO0_TIN0_TLDS0_TLDSM1_ULSGRO0_USL1_UIOFGRO0_USFGROn1_VSn1_VWA1_VWB4_WSGRA0_WSGRB0_WS32_WG32_4_1_WGM8_WGMXCC1_WGMXCCGn1
    SolutionIndex: 78
    SolutionNameMin: Cijk_Ailk_Bjlk_B8F8B8S_BH_Bias_SHB_HA_S_SAB_SCD_SAV_UserArgs_MT128x32x64_MI16x16x1_SN_LDSB0_AFC1_AG0_AFEM1_AFEM1_ASEM1_CLR1_CADS0_DTLA0_DTLB0_DTVA1_DTVB0_DTVSM0_DPLBn1_EPS0_ELFLR0_EMLLn1_FDSI0_GRPM1_GRVWA8_GRVWB4_GSU1_GSUAMB_GSUC0_GSUWGMRR0_GLS0_ISA1201_IU1_K1_LDSTI0_LBSPPA0_LBSPPB256_LBSPPM0_LPA0_LPB16_LPM0_LRVW8_LWPMn1_MIAV1_MIWT4_1_MO40_MGRIPMn1_NTn1_NTA0_NTB0_NTC0_NTD0_NTM0_NEPBS0_NLCA4_NLCB1_ONLL0_PGR2_PLR1_PKA0_SGROBn1_SIA3_SS0_SU32_SUM0_SUS256_SPO0_SRVW0_SSO0_SVW8_SK0_SKFTR0_SKXCCM0_SGRO0_TIN0_TLDS0_TLDSM1_ULSGRO0_USL1_UIOFGRO0_USFGROn1_VSn1_VWA1_VWB1_WSGRA0_WSGRB0_WS32_WG32_4_1_WGM8_WGMXCC1_WGMXCCGn1
    SolutionIndex: 79
    SolutionNameMin: Cijk_Ailk_Bjlk_B8F8B8S_BH_Bias_SHB_HA_S_SAB_SCD_SAV_UserArgs_MT128x64x32_MI16x16x1_SN_LDSB0_AFC1_AG0_AFEM1_AFEM1_ASEM1_CLR1_CADS0_DTLA0_DTLB0_DTVA1_DTVB0_DTVSM0_DPLBn1_EPS1_ELFLR0_EMLLn1_FDSI0_GRPM1_GRVWA8_GRVWB4_GSU1_GSUAMB_GSUC0_GSUWGMRR0_GLS0_ISA1201_IU1_K1_LDSTI0_LBSPPA0_LBSPPB512_LBSPPM0_LPA0_LPB16_LPM0_LRVW8_LWPMn1_MIAV1_MIWT8_1_MO40_MGRIPMn1_NTn1_NTA0_NTB0_NTC0_NTD0_NTM0_NEPBS0_NLCA2_NLCB1_ONLL0_PGR1_PLR1_PKA0_SGROBn1_SIA3_SS0_SU32_SUM0_SUS256_SPO0_SRVW0_SSO0_SVW8_SK0_SKFTR0_SKXCCM0_SGRO0_TIN0_TLDS0_TLDSM1_ULSGRO0_USL1_UIOFGRO0_USFGROn1_VSn1_VWA1_VWB1_WSGRA0_WSGRB0_WS32_WG16_8_1_WGM8_WGMXCC1_WGMXCCGn1
    SolutionIndex: 80
    SolutionNameMin: Cijk_Ailk_Bjlk_B8F8B8S_BH_Bias_SHB_HA_S_SAB_SCD_SAV_UserArgs_MT128x128x16_MI16x16x1_SN_LDSB0_AFC1_AG0_AFEM1_AFEM1_ASEM1_CLR1_CADS0_DTLA0_DTLB0_DTVA1_DTVB1_DTVSM0_DPLBn1_EPS0_ELFLR0_EMLLn1_FDSI0_GRPM1_GRVWA8_GRVWB8_GSU1_GSUAMB_GSUC0_GSUWGMRR0_GLS0_ISA1201_IU1_K1_LDSTI0_LBSPPA0_LBSPPB0_LBSPPM0_LPA0_LPB0_LPM0_LRVW8_LWPMn1_MIAV1_MIWT8_2_MO40_MGRIPMn1_NTn1_NTA0_NTB0_NTC0_NTD0_NTM0_NEPBS0_NLCA1_NLCB1_ONLL0_PGR1_PLR0_PKA0_SGROBn1_SIA3_SS0_SU32_SUM0_SUS256_SPO0_SRVW0_SSO0_SVW8_SK0_SKFTR0_SKXCCM0_SGRO0_TIN0_TLDS0_TLDSM1_ULSGRO0_USL1_UIOFGRO0_USFGROn1_VSn1_VWA1_VWB1_WSGRA0_WSGRB0_WS32_WG16_8_1_WGM8_WGMXCC1_WGMXCCGn1
    SolutionIndex: 81
    SolutionNameMin: Cijk_Ailk_Bjlk_B8F8B8S_BH_Bias_SHB_HA_S_SAB_SCD_SAV_UserArgs_MT128x64x64_MI16x16x1_SN_LDSB0_AFC1_AG0_AFEM1_AFEM1_ASEM1_CLR1_CADS0_DTLA0_DTLB0_DTVA0_DTVB1_DTVSM0_DPLBn1_EPS1_ELFLR0_EMLLn1_FDSI0_GRPM1_GRVWA8_GRVWB8_GSU1_GSUAMB_GSUC0_GSUWGMRR0_GLS0_ISA1201_IU1_K1_LDSTI0_LBSPPA1024_LBSPPB0_LBSPPM0_LPA0_LPB0_LPM0_LRVW8_LWPMn1_MIAV1_MIWT8_1_MO40_MGRIPMn1_NTn1_NTA0_NTB0_NTC0_NTD0_NTM0_NEPBS0_NLCA1_NLCB1_ONLL0_PGR1_PLR1_PKA0_SGROBn1_SIA3_SS1_SU32_SUM0_SUS256_SPO0_SRVW0_SSO0_SVW8_SK0_SKFTR0_SKXCCM0_SGRO0_TIN0_TLDS0_TLDSM1_ULSGRO0_USL1_UIOFGRO0_USFGROn1_VSn1_VWA8_VWB1_WSGRA0_WSGRB0_WS32_WG16_8_1_WGM8_WGMXCC1_WGMXCCGn1
    SolutionIndex: 82
    SolutionNameMin: Cijk_Ailk_Bjlk_B8F8B8S_BH_Bias_SHB_HA_S_SAB_SCD_SAV_UserArgs_MT64x128x64_MI16x16x1_SN_LDSB0_AFC1_AG0_AFEM1_AFEM1_ASEM1_CLR1_CADS0_DTLA0_DTLB0_DTVA1_DTVB1_DTVSM0_DPLBn1_EPS0_ELFLR0_EMLLn1_FDSI0_GRPM1_GRVWA8_GRVWB8_GSU1_GSUAMB_GSUC0_GSUWGMRR0_GLS0_ISA1201_IU1_K1_LDSTI0_LBSPPA0_LBSPPB0_LBSPPM0_LPA0_LPB0_LPM0_LRVW8_LWPMn1_MIAV1_MIWT1_8_MO40_MGRIPMn1_NTn1_NTA0_NTB0_NTC0_NTD0_NTM0_NEPBS0_NLCA1_NLCB4_ONLL0_PGR1_PLR0_PKA0_SGROBn1_SIA3_SS0_SU32_SUM0_SUS256_SPO0_SRVW0_SSO0_SVW8_SK0_SKFTR0_SKXCCM0_SGRO0_TIN0_TLDS0_TLDSM1_ULSGRO0_USL1_UIOFGRO0_USFGROn1_VSn1_VWA1_VWB1_WSGRA0_WSGRB0_WS32_WG64_2_1_WGM8_WGMXCC1_WGMXCCGn1
    SolutionIndex: 83
    SolutionNameMin: Cijk_Ailk_Bjlk_B8F8B8S_BH_Bias_SHB_HA_S_SAB_SCD_SAV_UserArgs_MT128x128x32_MI16x16x1_SN_LDSB0_AFC1_AG0_AFEM1_AFEM1_ASEM1_CLR1_CADS0_DTLA0_DTLB0_DTVA1_DTVB1_DTVSM0_DPLBn1_EPS0_ELFLR0_EMLLn1_FDSI0_GRPM1_GRVWA8_GRVWB8_GSU1_GSUAMB_GSUC0_GSUWGMRR0_GLS0_ISA1201_IU1_K1_LDSTI0_LBSPPA0_LBSPPB0_LBSPPM0_LPA0_LPB0_LPM0_LRVW8_LWPMn1_MIAV1_MIWT4_4_MO40_MGRIPMn1_NTn1_NTA0_NTB0_NTC0_NTD0_NTM0_NEPBS0_NLCA2_NLCB2_ONLL0_PGR1_PLR0_PKA0_SGROBn1_SIA3_SS0_SU32_SUM0_SUS256_SPO0_SRVW0_SSO0_SVW8_SK0_SKFTR0_SKXCCM0_SGRO0_TIN0_TLDS0_TLDSM1_ULSGRO0_USL1_UIOFGRO0_USFGROn1_VSn1_VWA1_VWB1_WSGRA0_WSGRB0_WS32_WG32_4_1_WGM8_WGMXCC1_WGMXCCGn1
    SolutionIndex: 84
    SolutionNameMin: Cijk_Ailk_Bjlk_B8F8B8S_BH_Bias_SHB_HA_S_SAB_SCD_SAV_UserArgs_MT32x16x32_MI16x16x1_SN_LDSB0_AFC1_AG0_AFEM1_AFEM1_ASEM1_CLR1_CADS0_DTLA0_DTLB0_DTVA1_DTVB0_DTVSM0_DPLBn1_EPS0_ELFLR0_EMLLn1_FDSI0_GRPM1_GRVWA8_GRVWB8_GSU1_GSUAMB_GSUC0_GSUWGMRR0_GLS0_ISA1201_IU1_K1_LDSTI0_LBSPPA0_LBSPPB128_LBSPPM0_LPA0_LPB16_LPM0_LRVW8_LWPMn1_MIAV1_MIWT1_1_MO40_MGRIPMn1_NTn1_NTA0_NTB0_NTC0_NTD0_NTM0_NEPBS0_NLCA1_NLCB1_ONLL0_PGR2_PLR1_PKA0_SGROBn1_SIA3_SS0_SU32_SUM0_SUS256_SPO0_SRVW0_SSO0_SVW8_SK0_SKFTR0_SKXCCM0_SGRO0_TIN0_TLDS0_TLDSM1_ULSGRO0_USL1_UIOFGRO0_USFGROn1_VSn1_VWA1_VWB1_WSGRA0_WSGRB0_WS32_WG32_2_1_WGM8_WGMXCC1_WGMXCCGn1
    SolutionIndex: 85
    SolutionNameMin: Cijk_Ailk_Bjlk_B8F8B8S_BH_Bias_SHB_HA_S_SAB_SCD_SAV_UserArgs_MT128x32x16_MI16x16x1_SN_LDSB0_AFC1_AG0_AFEM1_AFEM1_ASEM1_CLR1_CADS0_DTLA0_DTLB0_DTVA1_DTVB1_DTVSM0_DPLBn1_EPS0_ELFLR0_EMLLn1_FDSI0_GRPM1_GRVWA8_GRVWB8_GSU1_GSUAMB_GSUC0_GSUWGMRR0_GLS0_ISA1201_IU1_K1_LDSTI0_LBSPPA0_LBSPPB0_LBSPPM0_LPA0_LPB0_LPM0_LRVW8_LWPMn1_MIAV1_MIWT4_1_MO40_MGRIPMn1_NTn1_NTA0_NTB0_NTC0_NTD0_NTM0_NEPBS0_NLCA1_NLCB1_ONLL0_PGR1_PLR0_PKA0_SGROBn1_SIA3_SS0_SU32_SUM0_SUS256_SPO0_SRVW0_SSO0_SVW8_SK0_SKFTR0_SKXCCM0_SGRO0_TIN0_TLDS0_TLDSM1_ULSGRO0_USL1_UIOFGRO0_USFGROn1_VSn1_VWA1_VWB1_WSGRA0_WSGRB0_WS32_WG32_4_1_WGM8_WGMXCC1_WGMXCCGn1
    SolutionIndex: 86
    SolutionNameMin: Cijk_Ailk_Bjlk_B8F8B8S_BH_Bias_SHB_HA_S_SAB_SCD_SAV_UserArgs_MT64x128x32_MI16x16x1_SN_LDSB0_AFC1_AG0_AFEM1_AFEM1_ASEM1_CLR1_CADS0_DTLA0_DTLB0_DTVA0_DTVB1_DTVSM0_DPLBn1_EPS1_ELFLR0_EMLLn1_FDSI0_GRPM1_GRVWA4_GRVWB8_GSU1_GSUAMB_GSUC0_GSUWGMRR0_GLS0_ISA1201_IU1_K1_LDSTI0_LBSPPA512_LBSPPB0_LBSPPM0_LPA16_LPB0_LPM0_LRVW8_LWPMn1_MIAV1_MIWT1_8_MO40_MGRIPMn1_NTn1_NTA0_NTB0_NTC0_NTD0_NTM0_NEPBS0_NLCA1_NLCB2_ONLL0_PGR1_PLR1_PKA0_SGROBn1_SIA3_SS0_SU32_SUM0_SUS256_SPO0_SRVW0_SSO0_SVW8_SK0_SKFTR0_SKXCCM0_SGRO0_TIN0_TLDS0_TLDSM1_ULSGRO0_USL1_UIOFGRO0_USFGROn1_VSn1_VWA1_VWB1_WSGRA0_WSGRB0_WS32_WG64_2_1_WGM8_WGMXCC1_WGMXCCGn1
    SolutionIndex: 87
    SolutionNameMin: Cijk_Ailk_Bjlk_B8F8B8S_BH_Bias_SHB_HA_S_SAB_SCD_SAV_UserArgs_MT128x64x64_MI16x16x1_SN_LDSB0_AFC1_AG0_AFEM1_AFEM1_ASEM1_CLR1_CADS0_DTLA0_DTLB0_DTVA0_DTVB1_DTVSM0_DPLBn1_EPS0_ELFLR0_EMLLn1_FDSI0_GRPM1_GRVWA8_GRVWB8_GSU1_GSUAMB_GSUC0_GSUWGMRR0_GLS0_ISA1201_IU1_K1_LDSTI0_LBSPPA1024_LBSPPB0_LBSPPM0_LPA0_LPB0_LPM0_LRVW8_LWPMn1_MIAV1_MIWT8_1_MO40_MGRIPMn1_NTn1_NTA0_NTB0_NTC0_NTD0_NTM0_NEPBS0_NLCA1_NLCB1_ONLL0_PGR2_PLR1_PKA0_SGROBn1_SIA3_SS1_SU32_SUM0_SUS256_SPO0_SRVW0_SSO0_SVW8_SK0_SKFTR0_SKXCCM0_SGRO0_TIN0_TLDS0_TLDSM1_ULSGRO0_USL1_UIOFGRO0_USFGROn1_VSn1_VWA8_VWB1_WSGRA0_WSGRB0_WS32_WG16_8_1_WGM8_WGMXCC1_WGMXCCGn1
    SolutionIndex: 88
    SolutionNameMin: Cijk_Ailk_Bjlk_B8F8B8S_BH_Bias_SHB_HA_S_SAB_SCD_SAV_UserArgs_MT32x128x64_MI16x16x1_SN_LDSB0_AFC1_AG0_AFEM1_AFEM1_ASEM1_CLR1_CADS0_DTLA0_DTLB0_DTVA0_DTVB0_DTVSM0_DPLBn1_EPS0_ELFLR0_EMLLn1_FDSI0_GRPM1_GRVWA4_GRVWB16_GSU1_GSUAMB_GSUC0_GSUWGMRR0_GLS0_ISA1201_IU1_K1_LDSTI0_LBSPPA256_LBSPPB1024_LBSPPM0_LPA16_LPB64_LPM0_LRVW8_LWPMn1_MIAV1_MIWT1_4_MO40_MGRIPMn1_NTn1_NTA0_NTB0_NTC0_NTD0_NTM0_NEPBS0_NLCA1_NLCB1_ONLL0_PGR2_PLR1_PKA0_SGROBn1_SIA3_SS0_SU32_SUM0_SUS256_SPO0_SRVW0_SSO0_SVW8_SK0_SKFTR0_SKXCCM0_SGRO0_TIN0_TLDS0_TLDSM1_ULSGRO1_USL1_UIOFGRO0_USFGROn1_VSn1_VWA1_VWB4_WSGRA0_WSGRB0_WS32_WG32_4_1_WGM8_WGMXCC1_WGMXCCGn1
    SolutionIndex: 89
    SolutionNameMin: Cijk_Ailk_Bjlk_B8F8B8S_BH_Bias_SHB_HA_S_SAB_SCD_SAV_UserArgs_MT128x32x64_MI16x16x1_SN_LDSB0_AFC1_AG0_AFEM1_AFEM1_ASEM1_CLR1_CADS0_DTLA0_DTLB0_DTVA0_DTVB0_DTVSM0_DPLBn1_EPS0_ELFLR0_EMLLn1_FDSI0_GRPM1_GRVWA16_GRVWB16_GSU1_GSUAMB_GSUC0_GSUWGMRR0_GLS0_ISA1201_IU1_K1_LDSTI0_LBSPPA1024_LBSPPB256_LBSPPM0_LPA64_LPB16_LPM0_LRVW8_LWPMn1_MIAV1_MIWT4_1_MO40_MGRIPMn1_NTn1_NTA0_NTB0_NTC0_NTD0_NTM0_NEPBS0_NLCA1_NLCB1_ONLL0_PGR2_PLR1_PKA0_SGROBn1_SIA3_SS1_SU32_SUM0_SUS256_SPO0_SRVW0_SSO0_SVW4_SK0_SKFTR0_SKXCCM0_SGRO0_TIN0_TLDS0_TLDSM1_ULSGRO1_USL1_UIOFGRO0_USFGROn1_VSn1_VWA4_VWB1_WSGRA0_WSGRB0_WS32_WG32_4_1_WGM8_WGMXCC1_WGMXCCGn1
    SolutionIndex: 90
    SolutionNameMin: Cijk_Ailk_Bjlk_B8F8B8S_BH_Bias_SHB_HA_S_SAB_SCD_SAV_UserArgs_MT16x256x32_MI16x16x1_SN_LDSB0_AFC1_AG0_AFEM1_AFEM1_ASEM1_CLR1_CADS0_DTLA0_DTLB0_DTVA0_DTVB1_DTVSM0_DPLBn1_EPS0_ELFLR0_EMLLn1_FDSI0_GRPM1_GRVWA8_GRVWB8_GSU1_GSUAMB_GSUC0_GSUWGMRR0_GLS0_ISA1201_IU1_K1_LDSTI0_LBSPPA128_LBSPPB0_LBSPPM0_LPA16_LPB0_LPM0_LRVW8_LWPMn1_MIAV1_MIWT1_8_MO40_MGRIPMn1_NTn1_NTA0_NTB0_NTC0_NTD0_NTM0_NEPBS0_NLCA1_NLCB2_ONLL0_PGR2_PLR1_PKA0_SGROBn1_SIA3_SS0_SU32_SUM0_SUS256_SPO0_SRVW0_SSO0_SVW8_SK0_SKFTR0_SKXCCM0_SGRO0_TIN0_TLDS0_TLDSM1_ULSGRO0_USL1_UIOFGRO0_USFGROn1_VSn1_VWA1_VWB1_WSGRA0_WSGRB0_WS32_WG16_4_1_WGM8_WGMXCC1_WGMXCCGn1
    SolutionIndex: 91
    SolutionNameMin: Cijk_Ailk_Bjlk_B8F8B8S_BH_Bias_SHB_HA_S_SAB_SCD_SAV_UserArgs_MT128x32x64_MI16x16x1_SN_LDSB0_AFC1_AG0_AFEM1_AFEM1_ASEM1_CLR1_CADS0_DTLA0_DTLB0_DTVA0_DTVB0_DTVSM0_DPLBn1_EPS0_ELFLR0_EMLLn1_FDSI0_GRPM1_GRVWA8_GRVWB16_GSU1_GSUAMB_GSUC0_GSUWGMRR0_GLS0_ISA1201_IU1_K1_LDSTI0_LBSPPA1024_LBSPPB256_LBSPPM0_LPA64_LPB16_LPM0_LRVW8_LWPMn1_MIAV1_MIWT4_1_MO40_MGRIPMn1_NTn1_NTA0_NTB0_NTC0_NTD0_NTM0_NEPBS0_NLCA1_NLCB1_ONLL0_PGR2_PLR1_PKA0_SGROBn1_SIA3_SS1_SU32_SUM0_SUS256_SPO0_SRVW0_SSO0_SVW4_SK0_SKFTR0_SKXCCM0_SGRO0_TIN0_TLDS0_TLDSM1_ULSGRO1_USL1_UIOFGRO0_USFGROn1_VSn1_VWA4_VWB1_WSGRA0_WSGRB0_WS32_WG32_4_1_WGM8_WGMXCC1_WGMXCCGn1
    SolutionIndex: 92
    SolutionNameMin: Cijk_Ailk_Bjlk_B8F8B8S_BH_Bias_SHB_HA_S_SAB_SCD_SAV_UserArgs_MT32x16x32_MI16x16x1_SN_LDSB1_AFC1_AG0_AFEM1_AFEM1_ASEM1_CLR1_CADS0_DTLA0_DTLB0_DTVA0_DTVB0_DTVSM0_DPLBn1_EPS1_ELFLR0_EMLLn1_FDSI0_GRPM1_GRVWA1_GRVWB1_GSU1_GSUAMB_GSUC0_GSUWGMRR0_GLS0_ISA1201_IU2_K1_LDSTI0_LBSPPA256_LBSPPB128_LBSPPM0_LPA16_LPB16_LPM0_LRVW8_LWPMn1_MIAV1_MIWT1_1_MO40_MGRIPMn1_NTn1_NTA0_NTB0_NTC0_NTD0_NTM0_NEPBS0_NLCA1_NLCB1_ONLL0_PGR1_PLR1_PKA0_SGROBn1_SIA2_SS0_SU32_SUM0_SUS256_SPO0_SRVW0_SSO0_SVW8_SK0_SKFTR0_SKXCCM0_SGRO0_TIN0_TLDS0_TLDSM1_ULSGRO0_USL1_UIOFGRO0_USFGROn1_VSn1_VWA1_VWB1_WSGRA0_WSGRB0_WS32_WG32_2_1_WGM8_WGMXCC1_WGMXCCGn1
    SolutionIndex: 93
    SolutionNameMin: Cijk_Ailk_Bjlk_B8F8B8S_BH_Bias_SHB_HA_S_SAB_SCD_SAV_UserArgs_MT128x32x64_MI16x16x1_SN_LDSB1_AFC1_AG0_AFEM1_AFEM1_ASEM1_CLR1_CADS0_DTLA0_DTLB0_DTVA0_DTVB0_DTVSM0_DPLBn1_EPS0_ELFLR0_EMLLn1_FDSI0_GRPM1_GRVWA8_GRVWB4_GSU1_GSUAMB_GSUC0_GSUWGMRR0_GLS0_ISA1201_IU4_K1_LDSTI0_LBSPPA1024_LBSPPB256_LBSPPM0_LPA64_LPB16_LPM0_LRVW8_LWPMn1_MIAV1_MIWT4_1_MO40_MGRIPMn1_NTn1_NTA0_NTB0_NTC0_NTD0_NTM0_NEPBS0_NLCA1_NLCB1_ONLL0_PGR2_PLR1_PKA0_SGROBn1_SIA2_SS1_SU32_SUM0_SUS256_SPO0_SRVW0_SSO0_SVW4_SK0_SKFTR0_SKXCCM0_SGRO0_TIN0_TLDS0_TLDSM1_ULSGRO0_USL1_UIOFGRO0_USFGROn1_VSn1_VWA4_VWB1_WSGRA0_WSGRB0_WS32_WG32_4_1_WGM8_WGMXCC1_WGMXCCGn1
    SolutionIndex: 94
    SolutionNameMin: Cijk_Ailk_Bjlk_B8F8B8S_BH_Bias_SHB_HA_S_SAB_SCD_SAV_UserArgs_MT128x32x32_MI16x16x1_SN_LDSB1_AFC1_AG0_AFEM1_AFEM1_ASEM1_CLR1_CADS0_DTLA0_DTLB0_DTVA0_DTVB0_DTVSM0_DPLBn1_EPS1_ELFLR0_EMLLn1_FDSI0_GRPM1_GRVWA8_GRVWB8_GSU1_GSUAMB_GSUC0_GSUWGMRR0_GLS0_ISA1201_IU2_K1_LDSTI0_LBSPPA1024_LBSPPB256_LBSPPM0_LPA64_LPB16_LPM0_LRVW8_LWPMn1_MIAV1_MIWT4_1_MO40_MGRIPMn1_NTn1_NTA0_NTB0_NTC0_NTD0_NTM0_NEPBS0_NLCA1_NLCB1_ONLL0_PGR1_PLR1_PKA0_SGROBn1_SIA2_SS1_SU32_SUM0_SUS256_SPO0_SRVW0_SSO0_SVW4_SK0_SKFTR0_SKXCCM0_SGRO0_TIN0_TLDS0_TLDSM1_ULSGRO0_USL1_UIOFGRO0_USFGROn1_VSn1_VWA4_VWB1_WSGRA0_WSGRB0_WS32_WG32_4_1_WGM8_WGMXCC1_WGMXCCGn1
    SolutionIndex: 95
    SolutionNameMin: Cijk_Ailk_Bjlk_B8F8B8S_BH_Bias_SHB_HA_S_SAB_SCD_SAV_UserArgs_MT32x128x64_MI16x16x1_SN_LDSB1_AFC1_AG0_AFEM1_AFEM1_ASEM1_CLR1_CADS0_DTLA0_DTLB0_DTVA0_DTVB0_DTVSM0_DPLBn1_EPS1_ELFLR0_EMLLn1_FDSI0_GRPM1_GRVWA8_GRVWB16_GSU1_GSUAMB_GSUC0_GSUWGMRR0_GLS0_ISA1201_IU4_K1_LDSTI0_LBSPPA256_LBSPPB1024_LBSPPM0_LPA16_LPB64_LPM0_LRVW8_LWPMn1_MIAV1_MIWT1_4_MO40_MGRIPMn1_NTn1_NTA0_NTB0_NTC0_NTD0_NTM0_NEPBS0_NLCA1_NLCB1_ONLL0_PGR1_PLR1_PKA0_SGROBn1_SIA2_SS0_SU32_SUM0_SUS256_SPO0_SRVW0_SSO0_SVW8_SK0_SKFTR0_SKXCCM0_SGRO0_TIN0_TLDS0_TLDSM1_ULSGRO0_USL1_UIOFGRO0_USFGROn1_VSn1_VWA1_VWB4_WSGRA0_WSGRB0_WS32_WG32_4_1_WGM8_WGMXCC1_WGMXCCGn1
    SolutionIndex: 96
    SolutionNameMin: Cijk_Ailk_Bjlk_B8F8B8S_BH_Bias_SHB_HA_S_SAB_SCD_SAV_UserArgs_MT64x64x16_MI16x16x1_SN_LDSB1_AFC1_AG0_AFEM1_AFEM1_ASEM1_CLR1_CADS0_DTLA0_DTLB0_DTVA0_DTVB0_DTVSM0_DPLBn1_EPS1_ELFLR0_EMLLn1_FDSI0_GRPM1_GRVWA8_GRVWB1_GSU1_GSUAMB_GSUC0_GSUWGMRR0_GLS0_ISA1201_IU1_K1_LDSTI0_LBSPPA512_LBSPPB512_LBSPPM0_LPA32_LPB32_LPM0_LRVW8_LWPMn1_MIAV1_MIWT2_2_MO40_MGRIPMn1_NTn1_NTA0_NTB0_NTC0_NTD0_NTM0_NEPBS0_NLCA1_NLCB1_ONLL0_PGR1_PLR1_PKA0_SGROBn1_SIA2_SS0_SU32_SUM0_SUS256_SPO0_SRVW0_SSO0_SVW16_SK0_SKFTR0_SKXCCM0_SGRO0_TIN0_TLDS0_TLDSM1_ULSGRO0_USL1_UIOFGRO0_USFGROn1_VSn1_VWA2_VWB2_WSGRA0_WSGRB0_WS32_WG32_4_1_WGM8_WGMXCC1_WGMXCCGn1
    SolutionIndex: 97
    SolutionNameMin: Cijk_Ailk_Bjlk_B8F8B8S_BH_Bias_SHB_HA_S_SAB_SCD_SAV_UserArgs_MT64x64x32_MI16x16x1_SN_LDSB1_AFC1_AG0_AFEM1_AFEM1_ASEM1_CLR1_CADS0_DTLA0_DTLB0_DTVA0_DTVB0_DTVSM0_DPLBn1_EPS1_ELFLR0_EMLLn1_FDSI0_GRPM1_GRVWA1_GRVWB1_GSU1_GSUAMB_GSUC0_GSUWGMRR0_GLS0_ISA1201_IU2_K1_LDSTI0_LBSPPA512_LBSPPB512_LBSPPM0_LPA32_LPB32_LPM0_LRVW8_LWPMn1_MIAV1_MIWT2_2_MO40_MGRIPMn1_NTn1_NTA0_NTB0_NTC0_NTD0_NTM0_NEPBS0_NLCA1_NLCB1_ONLL0_PGR1_PLR1_PKA0_SGROBn1_SIA2_SS0_SU32_SUM0_SUS256_SPO0_SRVW0_SSO0_SVW16_SK0_SKFTR0_SKXCCM0_SGRO0_TIN0_TLDS0_TLDSM1_ULSGRO0_USL1_UIOFGRO0_USFGROn1_VSn1_VWA2_VWB2_WSGRA0_WSGRB0_WS32_WG32_4_1_WGM8_WGMXCC1_WGMXCCGn1
    SolutionIndex: 98
    SolutionNameMin: Cijk_Ailk_Bjlk_B8F8B8S_BH_Bias_SHB_HA_S_SAB_SCD_SAV_UserArgs_MT16x256x32_MI16x16x1_SN_LDSB0_AFC1_AG0_AFEM1_AFEM1_ASEM1_CLR1_CADS0_DTLA0_DTLB0_DTVA1_DTVB1_DTVSM0_DPLBn1_EPS0_ELFLR0_EMLLn1_FDSI0_GRPM1_GRVWA8_GRVWB8_GSU1_GSUAMB_GSUC0_GSUWGMRR0_GLS0_ISA1201_IU1_K1_LDSTI0_LBSPPA0_LBSPPB0_LBSPPM0_LPA0_LPB0_LPM0_LRVW8_LWPMn1_MIAV1_MIWT1_8_MO40_MGRIPMn1_NTn1_NTA0_NTB0_NTC0_NTD0_NTM0_NEPBS0_NLCA1_NLCB2_ONLL0_PGR1_PLR0_PKA0_SGROBn1_SIA3_SS0_SU32_SUM0_SUS256_SPO0_SRVW0_SSO0_SVW8_SK0_SKFTR0_SKXCCM0_SGRO0_TIN0_TLDS0_TLDSM1_ULSGRO0_USL1_UIOFGRO0_USFGROn1_VSn1_VWA1_VWB1_WSGRA0_WSGRB0_WS32_WG16_4_1_WGM8_WGMXCC1_WGMXCCGn1
    SolutionIndex: 99
    SolutionNameMin: Cijk_Ailk_Bjlk_B8F8B8S_BH_Bias_SHB_HA_S_SAB_SCD_SAV_UserArgs_MT32x128x64_MI16x16x1_SN_LDSB0_AFC1_AG0_AFEM1_AFEM1_ASEM1_CLR1_CADS0_DTLA0_DTLB0_DTVA0_DTVB0_DTVSM0_DPLBn1_EPS0_ELFLR0_EMLLn1_FDSI0_GRPM1_GRVWA8_GRVWB16_GSU1_GSUAMB_GSUC0_GSUWGMRR0_GLS0_ISA1201_IU1_K1_LDSTI0_LBSPPA256_LBSPPB1024_LBSPPM0_LPA16_LPB64_LPM0_LRVW8_LWPMn1_MIAV1_MIWT1_4_MO40_MGRIPMn1_NTn1_NTA0_NTB0_NTC0_NTD0_NTM0_NEPBS0_NLCA1_NLCB1_ONLL0_PGR2_PLR1_PKA0_SGROBn1_SIA3_SS0_SU32_SUM0_SUS256_SPO0_SRVW0_SSO0_SVW8_SK0_SKFTR0_SKXCCM0_SGRO0_TIN0_TLDS0_TLDSM1_ULSGRO0_USL1_UIOFGRO0_USFGROn1_VSn1_VWA1_VWB4_WSGRA0_WSGRB0_WS32_WG32_4_1_WGM8_WGMXCC1_WGMXCCGn1
    SolutionIndex: 100
    SolutionNameMin: Cijk_Ailk_Bjlk_B8F8B8S_BH_Bias_SHB_HA_S_SAB_SCD_SAV_UserArgs_MT32x128x32_MI16x16x1_SN_LDSB0_AFC1_AG0_AFEM1_AFEM1_ASEM1_CLR1_CADS0_DTLA0_DTLB0_DTVA0_DTVB1_DTVSM0_DPLBn1_EPS1_ELFLR0_EMLLn1_FDSI0_GRPM1_GRVWA1_GRVWB8_GSU1_GSUAMB_GSUC0_GSUWGMRR0_GLS0_ISA1201_IU1_K1_LDSTI0_LBSPPA256_LBSPPB0_LBSPPM0_LPA16_LPB0_LPM0_LRVW8_LWPMn1_MIAV1_MIWT1_4_MO40_MGRIPMn1_NTn1_NTA0_NTB0_NTC0_NTD0_NTM0_NEPBS0_NLCA1_NLCB2_ONLL0_PGR1_PLR1_PKA0_SGROBn1_SIA3_SS0_SU32_SUM0_SUS256_SPO0_SRVW0_SSO0_SVW8_SK0_SKFTR0_SKXCCM0_SGRO0_TIN0_TLDS0_TLDSM1_ULSGRO0_USL1_UIOFGRO0_USFGROn1_VSn1_VWA1_VWB1_WSGRA0_WSGRB0_WS32_WG32_4_1_WGM8_WGMXCC1_WGMXCCGn1
    SolutionIndex: 101
    SolutionNameMin: Cijk_Ailk_Bjlk_B8F8B8S_BH_Bias_SHB_HA_S_SAB_SCD_SAV_UserArgs_MT128x64x16_MI16x16x1_SN_LDSB1_AFC1_AG0_AFEM1_AFEM1_ASEM1_CLR1_CADS0_DTLA0_DTLB0_DTVA0_DTVB0_DTVSM0_DPLBn1_EPS1_ELFLR0_EMLLn1_FDSI0_GRPM1_GRVWA8_GRVWB1_GSU1_GSUAMB_GSUC0_GSUWGMRR0_GLS0_ISA1201_IU1_K1_LDSTI0_LBSPPA1024_LBSPPB512_LBSPPM0_LPA0_LPB16_LPM0_LRVW8_LWPMn1_MIAV1_MIWT8_1_MO40_MGRIPMn1_NTn1_NTA0_NTB0_NTC0_NTD0_NTM0_NEPBS0_NLCA1_NLCB1_ONLL0_PGR1_PLR1_PKA0_SGROBn1_SIA2_SS1_SU32_SUM0_SUS256_SPO0_SRVW0_SSO0_SVW8_SK0_SKFTR0_SKXCCM0_SGRO0_TIN0_TLDS0_TLDSM1_ULSGRO0_USL1_UIOFGRO0_USFGROn1_VSn1_VWA8_VWB1_WSGRA0_WSGRB0_WS32_WG16_8_1_WGM8_WGMXCC1_WGMXCCGn1
    SolutionIndex: 102
    SolutionNameMin: Cijk_Ailk_Bjlk_B8F8B8S_BH_Bias_SHB_HA_S_SAB_SCD_SAV_UserArgs_MT32x128x64_MI16x16x1_SN_LDSB0_AFC1_AG0_AFEM1_AFEM1_ASEM1_CLR1_CADS0_DTLA0_DTLB0_DTVA0_DTVB0_DTVSM0_DPLBn1_EPS0_ELFLR0_EMLLn1_FDSI0_GRPM1_GRVWA16_GRVWB16_GSU1_GSUAMB_GSUC0_GSUWGMRR0_GLS0_ISA1201_IU1_K1_LDSTI0_LBSPPA256_LBSPPB1024_LBSPPM0_LPA16_LPB64_LPM0_LRVW8_LWPMn1_MIAV1_MIWT1_4_MO40_MGRIPMn1_NTn1_NTA0_NTB0_NTC0_NTD0_NTM0_NEPBS0_NLCA1_NLCB1_ONLL0_PGR2_PLR1_PKA0_SGROBn1_SIA3_SS0_SU32_SUM0_SUS256_SPO0_SRVW0_SSO0_SVW8_SK0_SKFTR0_SKXCCM0_SGRO0_TIN0_TLDS0_TLDSM1_ULSGRO1_USL1_UIOFGRO0_USFGROn1_VSn1_VWA1_VWB4_WSGRA0_WSGRB0_WS32_WG32_4_1_WGM8_WGMXCC1_WGMXCCGn1
    SolutionIndex: 103
    SolutionNameMin: Cijk_Ailk_Bjlk_B8F8B8S_BH_Bias_SHB_HA_S_SAB_SCD_SAV_UserArgs_MT128x32x64_MI16x16x1_SN_LDSB0_AFC1_AG0_AFEM1_AFEM1_ASEM1_CLR1_CADS0_DTLA0_DTLB0_DTVA0_DTVB0_DTVSM0_DPLBn1_EPS0_ELFLR0_EMLLn1_FDSI0_GRPM1_GRVWA16_GRVWB4_GSU1_GSUAMB_GSUC0_GSUWGMRR0_GLS0_ISA1201_IU1_K1_LDSTI0_LBSPPA1024_LBSPPB256_LBSPPM0_LPA64_LPB16_LPM0_LRVW8_LWPMn1_MIAV1_MIWT4_1_MO40_MGRIPMn1_NTn1_NTA0_NTB0_NTC0_NTD0_NTM0_NEPBS0_NLCA1_NLCB1_ONLL0_PGR2_PLR1_PKA0_SGROBn1_SIA3_SS1_SU32_SUM0_SUS256_SPO0_SRVW0_SSO0_SVW4_SK0_SKFTR0_SKXCCM0_SGRO0_TIN0_TLDS0_TLDSM1_ULSGRO1_USL1_UIOFGRO0_USFGROn1_VSn1_VWA4_VWB1_WSGRA0_WSGRB0_WS32_WG32_4_1_WGM8_WGMXCC1_WGMXCCGn1
    SolutionIndex: 104
    SolutionNameMin: Cijk_Ailk_Bjlk_B8F8B8S_BH_Bias_SHB_HA_S_SAB_SCD_SAV_UserArgs_MT128x64x16_MI16x16x1_SN_LDSB1_AFC1_AG0_AFEM1_AFEM1_ASEM1_CLR1_CADS0_DTLA0_DTLB0_DTVA0_DTVB0_DTVSM0_DPLBn1_EPS1_ELFLR0_EMLLn1_FDSI0_GRPM1_GRVWA1_GRVWB1_GSU1_GSUAMB_GSUC0_GSUWGMRR0_GLS0_ISA1201_IU1_K1_LDSTI0_LBSPPA1024_LBSPPB512_LBSPPM0_LPA0_LPB16_LPM0_LRVW8_LWPMn1_MIAV1_MIWT8_1_MO40_MGRIPMn1_NTn1_NTA0_NTB0_NTC0_NTD0_NTM0_NEPBS0_NLCA1_NLCB1_ONLL0_PGR1_PLR1_PKA0_SGROBn1_SIA2_SS1_SU32_SUM0_SUS256_SPO0_SRVW0_SSO0_SVW8_SK0_SKFTR0_SKXCCM0_SGRO0_TIN0_TLDS0_TLDSM1_ULSGRO0_USL1_UIOFGRO0_USFGROn1_VSn1_VWA8_VWB1_WSGRA0_WSGRB0_WS32_WG16_8_1_WGM8_WGMXCC1_WGMXCCGn1
    SolutionIndex: 105
    SolutionNameMin: Cijk_Ailk_Bjlk_B8F8B8S_BH_Bias_SHB_HA_S_SAB_SCD_SAV_UserArgs_MT64x64x32_MI16x16x1_SN_LDSB0_AFC1_AG0_AFEM1_AFEM1_ASEM1_CLR1_CADS0_DTLA0_DTLB0_DTVA0_DTVB0_DTVSM0_DPLBn1_EPS0_ELFLR0_EMLLn1_FDSI0_GRPM1_GRVWA1_GRVWB1_GSU1_GSUAMB_GSUC0_GSUWGMRR0_GLS0_ISA1201_IU1_K1_LDSTI0_LBSPPA512_LBSPPB512_LBSPPM0_LPA32_LPB32_LPM0_LRVW8_LWPMn1_MIAV1_MIWT2_2_MO40_MGRIPMn1_NTn1_NTA0_NTB0_NTC0_NTD0_NTM0_NEPBS0_NLCA1_NLCB1_ONLL0_PGR2_PLR1_PKA0_SGROBn1_SIA3_SS1_SU32_SUM0_SUS256_SPO0_SRVW0_SSO0_SVW2_SK0_SKFTR0_SKXCCM0_SGRO0_TIN0_TLDS0_TLDSM1_ULSGRO1_USL1_UIOFGRO0_USFGROn1_VSn1_VWA2_VWB2_WSGRA0_WSGRB0_WS32_WG32_4_1_WGM8_WGMXCC1_WGMXCCGn1
    SolutionIndex: 106
    SolutionNameMin: Cijk_Ailk_Bjlk_B8F8B8S_BH_Bias_SHB_HA_S_SAB_SCD_SAV_UserArgs_MT128x32x64_MI16x16x1_SN_LDSB0_AFC1_AG0_AFEM1_AFEM1_ASEM1_CLR1_CADS0_DTLA0_DTLB0_DTVA0_DTVB1_DTVSM0_DPLBn1_EPS1_ELFLR0_EMLLn1_FDSI0_GRPM1_GRVWA16_GRVWB8_GSU1_GSUAMB_GSUC0_GSUWGMRR0_GLS0_ISA1201_IU1_K1_LDSTI0_LBSPPA1024_LBSPPB0_LBSPPM0_LPA64_LPB0_LPM0_LRVW8_LWPMn1_MIAV1_MIWT4_1_MO40_MGRIPMn1_NTn1_NTA0_NTB0_NTC0_NTD0_NTM0_NEPBS0_NLCA1_NLCB1_ONLL0_PGR1_PLR1_PKA0_SGROBn1_SIA3_SS1_SU32_SUM0_SUS256_SPO0_SRVW0_SSO0_SVW4_SK0_SKFTR0_SKXCCM0_SGRO0_TIN0_TLDS0_TLDSM1_ULSGRO0_USL1_UIOFGRO0_USFGROn1_VSn1_VWA4_VWB1_WSGRA0_WSGRB0_WS32_WG32_4_1_WGM8_WGMXCC1_WGMXCCGn1
    SolutionIndex: 107
    SolutionNameMin: Cijk_Ailk_Bjlk_B8F8B8S_BH_Bias_SHB_HA_S_SAB_SCD_SAV_UserArgs_MT128x32x32_MI16x16x1_SN_LDSB1_AFC1_AG0_AFEM1_AFEM1_ASEM1_CLR1_CADS0_DTLA0_DTLB0_DTVA0_DTVB0_DTVSM0_DPLBn1_EPS0_ELFLR0_EMLLn1_FDSI0_GRPM1_GRVWA4_GRVWB1_GSU1_GSUAMB_GSUC0_GSUWGMRR0_GLS0_ISA1201_IU2_K1_LDSTI0_LBSPPA1024_LBSPPB256_LBSPPM0_LPA64_LPB16_LPM0_LRVW8_LWPMn1_MIAV1_MIWT4_1_MO40_MGRIPMn1_NTn1_NTA0_NTB0_NTC0_NTD0_NTM0_NEPBS0_NLCA1_NLCB1_ONLL0_PGR2_PLR1_PKA0_SGROBn1_SIA2_SS1_SU32_SUM0_SUS256_SPO0_SRVW0_SSO0_SVW4_SK0_SKFTR0_SKXCCM0_SGRO0_TIN0_TLDS0_TLDSM1_ULSGRO0_USL1_UIOFGRO0_USFGROn1_VSn1_VWA4_VWB1_WSGRA0_WSGRB0_WS32_WG32_4_1_WGM8_WGMXCC1_WGMXCCGn1
    SolutionIndex: 108
    SolutionNameMin: Cijk_Ailk_Bjlk_B8F8B8S_BH_Bias_SHB_HA_S_SAB_SCD_SAV_UserArgs_MT256x16x32_MI16x16x1_SN_LDSB0_AFC1_AG0_AFEM1_AFEM1_ASEM1_CLR1_CADS0_DTLA0_DTLB0_DTVA1_DTVB1_DTVSM0_DPLBn1_EPS0_ELFLR0_EMLLn1_FDSI0_GRPM1_GRVWA8_GRVWB8_GSU1_GSUAMB_GSUC0_GSUWGMRR0_GLS0_ISA1201_IU1_K1_LDSTI0_LBSPPA0_LBSPPB0_LBSPPM0_LPA0_LPB0_LPM0_LRVW8_LWPMn1_MIAV1_MIWT8_1_MO40_MGRIPMn1_NTn1_NTA0_NTB0_NTC0_NTD0_NTM0_NEPBS0_NLCA2_NLCB1_ONLL0_PGR1_PLR0_PKA0_SGROBn1_SIA3_SS0_SU32_SUM0_SUS256_SPO0_SRVW0_SSO0_SVW8_SK0_SKFTR0_SKXCCM0_SGRO0_TIN0_TLDS0_TLDSM1_ULSGRO0_USL1_UIOFGRO0_USFGROn1_VSn1_VWA1_VWB1_WSGRA0_WSGRB0_WS32_WG32_2_1_WGM8_WGMXCC1_WGMXCCGn1
    SolutionIndex: 109
    SolutionNameMin: Cijk_Ailk_Bjlk_B8F8B8S_BH_Bias_SHB_HA_S_SAB_SCD_SAV_UserArgs_MT128x64x32_MI16x16x1_SN_LDSB0_AFC1_AG0_AFEM1_AFEM1_ASEM1_CLR1_CADS0_DTLA0_DTLB0_DTVA0_DTVB1_DTVSM0_DPLBn1_EPS1_ELFLR0_EMLLn1_FDSI0_GRPM1_GRVWA8_GRVWB8_GSU1_GSUAMB_GSUC0_GSUWGMRR0_GLS0_ISA1201_IU1_K1_LDSTI0_LBSPPA1024_LBSPPB0_LBSPPM0_LPA0_LPB0_LPM0_LRVW8_LWPMn1_MIAV1_MIWT8_1_MO40_MGRIPMn1_NTn1_NTA0_NTB0_NTC0_NTD0_NTM0_NEPBS0_NLCA1_NLCB1_ONLL0_PGR1_PLR1_PKA0_SGROBn1_SIA3_SS1_SU32_SUM0_SUS256_SPO0_SRVW0_SSO0_SVW8_SK0_SKFTR0_SKXCCM0_SGRO0_TIN0_TLDS0_TLDSM1_ULSGRO0_USL1_UIOFGRO0_USFGROn1_VSn1_VWA8_VWB1_WSGRA0_WSGRB0_WS32_WG16_8_1_WGM8_WGMXCC1_WGMXCCGn1
    SolutionIndex: 110
    SolutionNameMin: Cijk_Ailk_Bjlk_B8F8B8S_BH_Bias_SHB_HA_S_SAB_SCD_SAV_UserArgs_MT64x64x64_MI16x16x1_SN_LDSB0_AFC1_AG0_AFEM1_AFEM1_ASEM1_CLR1_CADS0_DTLA0_DTLB0_DTVA0_DTVB1_DTVSM0_DPLBn1_EPS0_ELFLR0_EMLLn1_FDSI0_GRPM1_GRVWA16_GRVWB8_GSU1_GSUAMB_GSUC0_GSUWGMRR0_GLS0_ISA1201_IU1_K1_LDSTI0_LBSPPA512_LBSPPB0_LBSPPM0_LPA32_LPB0_LPM0_LRVW8_LWPMn1_MIAV1_MIWT2_2_MO40_MGRIPMn1_NTn1_NTA0_NTB0_NTC0_NTD0_NTM0_NEPBS0_NLCA1_NLCB4_ONLL0_PGR2_PLR1_PKA0_SGROBn1_SIA3_SS0_SU32_SUM0_SUS256_SPO0_SRVW0_SSO0_SVW16_SK0_SKFTR0_SKXCCM0_SGRO0_TIN0_TLDS0_TLDSM1_ULSGRO0_USL1_UIOFGRO0_USFGROn1_VSn1_VWA2_VWB1_WSGRA0_WSGRB0_WS32_WG32_4_1_WGM8_WGMXCC1_WGMXCCGn1
    SolutionIndex: 111
    SolutionNameMin: Cijk_Ailk_Bjlk_B8F8B8S_BH_Bias_SHB_HA_S_SAB_SCD_SAV_UserArgs_MT16x512x32_MI16x16x1_SN_LDSB0_AFC1_AG0_AFEM1_AFEM1_ASEM1_CLR1_CADS0_DTLA0_DTLB0_DTVA1_DTVB1_DTVSM0_DPLBn1_EPS0_ELFLR0_EMLLn1_FDSI0_GRPM1_GRVWA8_GRVWB8_GSU1_GSUAMB_GSUC0_GSUWGMRR0_GLS0_ISA1201_IU1_K1_LDSTI0_LBSPPA0_LBSPPB0_LBSPPM0_LPA0_LPB0_LPM0_LRVW8_LWPMn1_MIAV1_MIWT1_8_MO40_MGRIPMn1_NTn1_NTA0_NTB0_NTC0_NTD0_NTM0_NEPBS0_NLCA1_NLCB2_ONLL0_PGR1_PLR0_PKA0_SGROBn1_SIA3_SS0_SU32_SUM0_SUS256_SPO0_SRVW0_SSO0_SVW8_SK0_SKFTR0_SKXCCM0_SGRO0_TIN0_TLDS0_TLDSM1_ULSGRO0_USL1_UIOFGRO0_USFGROn1_VSn1_VWA1_VWB1_WSGRA0_WSGRB0_WS32_WG16_8_1_WGM8_WGMXCC1_WGMXCCGn1
    SolutionIndex: 112
    SolutionNameMin: Cijk_Ailk_Bjlk_B8F8B8S_BH_Bias_SHB_HA_S_SAB_SCD_SAV_UserArgs_MT64x128x32_MI16x16x1_SN_LDSB0_AFC1_AG0_AFEM1_AFEM1_ASEM1_CLR1_CADS0_DTLA0_DTLB0_DTVA0_DTVB1_DTVSM0_DPLBn1_EPS1_ELFLR0_EMLLn1_FDSI0_GRPM1_GRVWA16_GRVWB8_GSU1_GSUAMB_GSUC0_GSUWGMRR0_GLS0_ISA1201_IU1_K1_LDSTI0_LBSPPA512_LBSPPB0_LBSPPM0_LPA16_LPB0_LPM0_LRVW8_LWPMn1_MIAV1_MIWT1_8_MO40_MGRIPMn1_NTn1_NTA0_NTB0_NTC0_NTD0_NTM0_NEPBS0_NLCA1_NLCB2_ONLL0_PGR1_PLR1_PKA0_SGROBn1_SIA3_SS0_SU32_SUM0_SUS256_SPO0_SRVW0_SSO0_SVW8_SK0_SKFTR0_SKXCCM0_SGRO0_TIN0_TLDS0_TLDSM1_ULSGRO0_USL1_UIOFGRO0_USFGROn1_VSn1_VWA1_VWB1_WSGRA0_WSGRB0_WS32_WG64_2_1_WGM8_WGMXCC1_WGMXCCGn1
    SolutionIndex: 113
    SolutionNameMin: Cijk_Ailk_Bjlk_B8F8B8S_BH_Bias_SHB_HA_S_SAB_SCD_SAV_UserArgs_MT128x32x64_MI16x16x1_SN_LDSB0_AFC1_AG0_AFEM1_AFEM1_ASEM1_CLR1_CADS0_DTLA0_DTLB0_DTVA0_DTVB0_DTVSM0_DPLBn1_EPS1_ELFLR0_EMLLn1_FDSI0_GRPM1_GRVWA16_GRVWB4_GSU1_GSUAMB_GSUC0_GSUWGMRR0_GLS0_ISA1201_IU1_K1_LDSTI0_LBSPPA1024_LBSPPB256_LBSPPM0_LPA64_LPB16_LPM0_LRVW8_LWPMn1_MIAV1_MIWT4_1_MO40_MGRIPMn1_NTn1_NTA0_NTB0_NTC0_NTD0_NTM0_NEPBS0_NLCA1_NLCB1_ONLL0_PGR1_PLR1_PKA0_SGROBn1_SIA3_SS1_SU32_SUM0_SUS256_SPO0_SRVW0_SSO0_SVW4_SK0_SKFTR0_SKXCCM0_SGRO0_TIN0_TLDS0_TLDSM1_ULSGRO0_USL1_UIOFGRO0_USFGROn1_VSn1_VWA4_VWB1_WSGRA0_WSGRB0_WS32_WG32_4_1_WGM8_WGMXCC1_WGMXCCGn1
    SolutionIndex: 114
    SolutionNameMin: Cijk_Ailk_Bjlk_B8F8B8S_BH_Bias_SHB_HA_S_SAB_SCD_SAV_UserArgs_MT64x128x32_MI16x16x1_SN_LDSB0_AFC1_AG0_AFEM1_AFEM1_ASEM1_CLR1_CADS0_DTLA0_DTLB0_DTVA0_DTVB1_DTVSM0_DPLBn1_EPS0_ELFLR0_EMLLn1_FDSI0_GRPM1_GRVWA8_GRVWB8_GSU1_GSUAMB_GSUC0_GSUWGMRR0_GLS0_ISA1201_IU1_K1_LDSTI0_LBSPPA512_LBSPPB0_LBSPPM0_LPA16_LPB0_LPM0_LRVW8_LWPMn1_MIAV1_MIWT1_8_MO40_MGRIPMn1_NTn1_NTA0_NTB0_NTC0_NTD0_NTM0_NEPBS0_NLCA1_NLCB2_ONLL0_PGR2_PLR1_PKA0_SGROBn1_SIA3_SS0_SU32_SUM0_SUS256_SPO0_SRVW0_SSO0_SVW8_SK0_SKFTR0_SKXCCM0_SGRO0_TIN0_TLDS0_TLDSM1_ULSGRO0_USL1_UIOFGRO0_USFGROn1_VSn1_VWA1_VWB1_WSGRA0_WSGRB0_WS32_WG64_2_1_WGM8_WGMXCC1_WGMXCCGn1
    SolutionIndex: 115
    SolutionNameMin: Cijk_Ailk_Bjlk_B8F8B8S_BH_Bias_SHB_HA_S_SAB_SCD_SAV_UserArgs_MT64x64x32_MI16x16x1_SN_LDSB0_AFC1_AG0_AFEM1_AFEM1_ASEM1_CLR1_CADS0_DTLA0_DTLB0_DTVA0_DTVB0_DTVSM0_DPLBn1_EPS0_ELFLR0_EMLLn1_FDSI0_GRPM1_GRVWA1_GRVWB1_GSU1_GSUAMB_GSUC0_GSUWGMRR0_GLS0_ISA1201_IU1_K1_LDSTI0_LBSPPA512_LBSPPB512_LBSPPM0_LPA32_LPB32_LPM0_LRVW8_LWPMn1_MIAV1_MIWT2_2_MO40_MGRIPMn1_NTn1_NTA0_NTB0_NTC0_NTD0_NTM0_NEPBS0_NLCA1_NLCB1_ONLL0_PGR2_PLR1_PKA0_SGROBn1_SIA3_SS0_SU32_SUM0_SUS256_SPO0_SRVW0_SSO0_SVW16_SK0_SKFTR0_SKXCCM0_SGRO0_TIN0_TLDS0_TLDSM1_ULSGRO1_USL1_UIOFGRO0_USFGROn1_VSn1_VWA2_VWB2_WSGRA0_WSGRB0_WS32_WG32_4_1_WGM8_WGMXCC1_WGMXCCGn1
    SolutionIndex: 116
    SolutionNameMin: Cijk_Ailk_Bjlk_B8F8B8S_BH_Bias_SHB_HA_S_SAB_SCD_SAV_UserArgs_MT64x64x64_MI16x16x1_SN_LDSB0_AFC1_AG0_AFEM1_AFEM1_ASEM1_CLR1_CADS0_DTLA0_DTLB0_DTVA0_DTVB1_DTVSM0_DPLBn1_EPS1_ELFLR0_EMLLn1_FDSI0_GRPM1_GRVWA16_GRVWB8_GSU1_GSUAMB_GSUC0_GSUWGMRR0_GLS0_ISA1201_IU1_K1_LDSTI0_LBSPPA512_LBSPPB0_LBSPPM0_LPA32_LPB0_LPM0_LRVW8_LWPMn1_MIAV1_MIWT2_2_MO40_MGRIPMn1_NTn1_NTA0_NTB0_NTC0_NTD0_NTM0_NEPBS0_NLCA1_NLCB4_ONLL0_PGR1_PLR1_PKA0_SGROBn1_SIA3_SS0_SU32_SUM0_SUS256_SPO0_SRVW0_SSO0_SVW16_SK0_SKFTR0_SKXCCM0_SGRO0_TIN0_TLDS0_TLDSM1_ULSGRO0_USL1_UIOFGRO0_USFGROn1_VSn1_VWA2_VWB1_WSGRA0_WSGRB0_WS32_WG32_4_1_WGM8_WGMXCC1_WGMXCCGn1
    SolutionIndex: 117
    SolutionNameMin: Cijk_Ailk_Bjlk_B8F8B8S_BH_Bias_SHB_HA_S_SAB_SCD_SAV_UserArgs_MT64x64x16_MI16x16x1_SN_LDSB1_AFC1_AG0_AFEM1_AFEM1_ASEM1_CLR1_CADS0_DTLA0_DTLB0_DTVA0_DTVB0_DTVSM0_DPLBn1_EPS0_ELFLR0_EMLLn1_FDSI0_GRPM1_GRVWA4_GRVWB4_GSU1_GSUAMB_GSUC0_GSUWGMRR0_GLS0_ISA1201_IU1_K1_LDSTI0_LBSPPA512_LBSPPB512_LBSPPM0_LPA32_LPB32_LPM0_LRVW8_LWPMn1_MIAV1_MIWT2_2_MO40_MGRIPMn1_NTn1_NTA0_NTB0_NTC0_NTD0_NTM0_NEPBS0_NLCA1_NLCB1_ONLL0_PGR2_PLR1_PKA0_SGROBn1_SIA2_SS0_SU32_SUM0_SUS256_SPO0_SRVW0_SSO0_SVW16_SK0_SKFTR0_SKXCCM0_SGRO0_TIN0_TLDS0_TLDSM1_ULSGRO0_USL1_UIOFGRO0_USFGROn1_VSn1_VWA2_VWB2_WSGRA0_WSGRB0_WS32_WG32_4_1_WGM8_WGMXCC1_WGMXCCGn1
    SolutionIndex: 118
    SolutionNameMin: Cijk_Ailk_Bjlk_B8F8B8S_BH_Bias_SHB_HA_S_SAB_SCD_SAV_UserArgs_MT32x128x64_MI16x16x1_SN_LDSB0_AFC1_AG0_AFEM1_AFEM1_ASEM1_CLR1_CADS0_DTLA0_DTLB0_DTVA0_DTVB0_DTVSM0_DPLBn1_EPS0_ELFLR0_EMLLn1_FDSI0_GRPM1_GRVWA8_GRVWB16_GSU1_GSUAMB_GSUC0_GSUWGMRR0_GLS0_ISA1201_IU1_K1_LDSTI0_LBSPPA256_LBSPPB1024_LBSPPM0_LPA16_LPB64_LPM0_LRVW8_LWPMn1_MIAV1_MIWT1_4_MO40_MGRIPMn1_NTn1_NTA0_NTB0_NTC0_NTD0_NTM0_NEPBS0_NLCA1_NLCB1_ONLL0_PGR2_PLR1_PKA0_SGROBn1_SIA3_SS0_SU32_SUM0_SUS256_SPO0_SRVW0_SSO0_SVW8_SK0_SKFTR0_SKXCCM0_SGRO0_TIN0_TLDS0_TLDSM1_ULSGRO1_USL1_UIOFGRO0_USFGROn1_VSn1_VWA1_VWB4_WSGRA0_WSGRB0_WS32_WG32_4_1_WGM8_WGMXCC1_WGMXCCGn1
    SolutionIndex: 119
    SolutionNameMin: Cijk_Ailk_Bjlk_B8F8B8S_BH_Bias_SHB_HA_S_SAB_SCD_SAV_UserArgs_MT128x32x64_MI16x16x1_SN_LDSB0_AFC1_AG0_AFEM1_AFEM1_ASEM1_CLR1_CADS0_DTLA0_DTLB0_DTVA0_DTVB1_DTVSM0_DPLBn1_EPS1_ELFLR0_EMLLn1_FDSI0_GRPM1_GRVWA8_GRVWB8_GSU1_GSUAMB_GSUC0_GSUWGMRR0_GLS0_ISA1201_IU1_K1_LDSTI0_LBSPPA1024_LBSPPB0_LBSPPM0_LPA64_LPB0_LPM0_LRVW8_LWPMn1_MIAV1_MIWT4_1_MO40_MGRIPMn1_NTn1_NTA0_NTB0_NTC0_NTD0_NTM0_NEPBS0_NLCA1_NLCB1_ONLL0_PGR1_PLR1_PKA0_SGROBn1_SIA3_SS1_SU32_SUM0_SUS256_SPO0_SRVW0_SSO0_SVW4_SK0_SKFTR0_SKXCCM0_SGRO0_TIN0_TLDS0_TLDSM1_ULSGRO0_USL1_UIOFGRO0_USFGROn1_VSn1_VWA4_VWB1_WSGRA0_WSGRB0_WS32_WG32_4_1_WGM8_WGMXCC1_WGMXCCGn1
    SolutionIndex: 120
    SolutionNameMin: Cijk_Ailk_Bjlk_B8F8B8S_BH_Bias_SHB_HA_S_SAB_SCD_SAV_UserArgs_MT16x32x128_MI16x16x1_SN_LDSB0_AFC1_AG0_AFEM1_AFEM1_ASEM1_CLR1_CADS0_DTLA0_DTLB0_DTVA0_DTVB1_DTVSM0_DPLBn1_EPS1_ELFLR0_EMLLn1_FDSI0_GRPM1_GRVWA4_GRVWB8_GSU1_GSUAMB_GSUC0_GSUWGMRR0_GLS0_ISA1201_IU1_K1_LDSTI0_LBSPPA128_LBSPPB0_LBSPPM0_LPA16_LPB0_LPM0_LRVW8_LWPMn1_MIAV1_MIWT1_1_MO40_MGRIPMn1_NTn1_NTA0_NTB0_NTC0_NTD0_NTM0_NEPBS0_NLCA1_NLCB1_ONLL0_PGR1_PLR1_PKA0_SGROBn1_SIA3_SS0_SU32_SUM0_SUS256_SPO0_SRVW0_SSO0_SVW8_SK0_SKFTR0_SKXCCM0_SGRO0_TIN0_TLDS0_TLDSM1_ULSGRO0_USL1_UIOFGRO0_USFGROn1_VSn1_VWA1_VWB1_WSGRA0_WSGRB0_WS32_WG16_4_1_WGM8_WGMXCC1_WGMXCCGn1
    SolutionIndex: 121
    SolutionNameMin: Cijk_Ailk_Bjlk_B8F8B8S_BH_Bias_SHB_HA_S_SAB_SCD_SAV_UserArgs_MT32x16x128_MI16x16x1_SN_LDSB0_AFC1_AG0_AFEM1_AFEM1_ASEM1_CLR1_CADS0_DTLA0_DTLB0_DTVA1_DTVB1_DTVSM0_DPLBn1_EPS0_ELFLR0_EMLLn1_FDSI0_GRPM1_GRVWA8_GRVWB8_GSU1_GSUAMB_GSUC0_GSUWGMRR0_GLS0_ISA1201_IU1_K1_LDSTI0_LBSPPA0_LBSPPB0_LBSPPM0_LPA0_LPB0_LPM0_LRVW8_LWPMn1_MIAV1_MIWT1_1_MO40_MGRIPMn1_NTn1_NTA0_NTB0_NTC0_NTD0_NTM0_NEPBS0_NLCA1_NLCB1_ONLL0_PGR1_PLR0_PKA0_SGROBn1_SIA3_SS0_SU32_SUM0_SUS256_SPO0_SRVW0_SSO0_SVW8_SK0_SKFTR0_SKXCCM0_SGRO0_TIN0_TLDS0_TLDSM1_ULSGRO0_USL1_UIOFGRO0_USFGROn1_VSn1_VWA1_VWB1_WSGRA0_WSGRB0_WS32_WG32_2_1_WGM8_WGMXCC1_WGMXCCGn1
    SolutionIndex: 122
    SolutionNameMin: Cijk_Ailk_Bjlk_B8F8B8S_BH_Bias_SHB_HA_S_SAB_SCD_SAV_UserArgs_MT16x32x128_MI16x16x1_SN_LDSB0_AFC1_AG0_AFEM1_AFEM1_ASEM1_CLR1_CADS0_DTLA0_DTLB0_DTVA1_DTVB1_DTVSM0_DPLBn1_EPS0_ELFLR0_EMLLn1_FDSI0_GRPM1_GRVWA8_GRVWB8_GSU1_GSUAMB_GSUC0_GSUWGMRR0_GLS0_ISA1201_IU1_K1_LDSTI0_LBSPPA0_LBSPPB0_LBSPPM0_LPA0_LPB0_LPM0_LRVW8_LWPMn1_MIAV1_MIWT1_1_MO40_MGRIPMn1_NTn1_NTA0_NTB0_NTC0_NTD0_NTM0_NEPBS0_NLCA1_NLCB1_ONLL0_PGR1_PLR0_PKA0_SGROBn1_SIA3_SS0_SU32_SUM0_SUS256_SPO0_SRVW0_SSO0_SVW8_SK0_SKFTR0_SKXCCM0_SGRO0_TIN0_TLDS0_TLDSM1_ULSGRO0_USL1_UIOFGRO0_USFGROn1_VSn1_VWA1_VWB1_WSGRA0_WSGRB0_WS32_WG16_4_1_WGM8_WGMXCC1_WGMXCCGn1
    SolutionIndex: 123
    SolutionNameMin: Cijk_Ailk_Bjlk_B8F8B8S_BH_Bias_SHB_HA_S_SAB_SCD_SAV_UserArgs_MT32x16x128_MI16x16x1_SN_LDSB0_AFC1_AG0_AFEM1_AFEM1_ASEM1_CLR1_CADS0_DTLA0_DTLB0_DTVA1_DTVB0_DTVSM0_DPLBn1_EPS1_ELFLR0_EMLLn1_FDSI0_GRPM1_GRVWA8_GRVWB4_GSU1_GSUAMB_GSUC0_GSUWGMRR0_GLS0_ISA1201_IU1_K1_LDSTI0_LBSPPA0_LBSPPB128_LBSPPM0_LPA0_LPB16_LPM0_LRVW8_LWPMn1_MIAV1_MIWT1_1_MO40_MGRIPMn1_NTn1_NTA0_NTB0_NTC0_NTD0_NTM0_NEPBS0_NLCA1_NLCB1_ONLL0_PGR1_PLR1_PKA0_SGROBn1_SIA3_SS0_SU32_SUM0_SUS256_SPO0_SRVW0_SSO0_SVW8_SK0_SKFTR0_SKXCCM0_SGRO0_TIN0_TLDS0_TLDSM1_ULSGRO0_USL1_UIOFGRO0_USFGROn1_VSn1_VWA1_VWB1_WSGRA0_WSGRB0_WS32_WG32_2_1_WGM8_WGMXCC1_WGMXCCGn1
    SolutionIndex: 124
    SolutionNameMin: Cijk_Ailk_Bjlk_B8F8B8S_BH_Bias_SHB_HA_S_SAB_SCD_SAV_UserArgs_MT32x16x128_MI16x16x1_SN_LDSB0_AFC1_AG0_AFEM1_AFEM1_ASEM1_CLR1_CADS0_DTLA0_DTLB0_DTVA1_DTVB0_DTVSM0_DPLBn1_EPS1_ELFLR0_EMLLn1_FDSI0_GRPM1_GRVWA8_GRVWB16_GSU1_GSUAMB_GSUC0_GSUWGMRR0_GLS0_ISA1201_IU1_K1_LDSTI0_LBSPPA0_LBSPPB128_LBSPPM0_LPA0_LPB16_LPM0_LRVW8_LWPMn1_MIAV1_MIWT1_1_MO40_MGRIPMn1_NTn1_NTA0_NTB0_NTC0_NTD0_NTM0_NEPBS0_NLCA1_NLCB1_ONLL0_PGR1_PLR1_PKA0_SGROBn1_SIA3_SS0_SU32_SUM0_SUS256_SPO0_SRVW0_SSO0_SVW8_SK0_SKFTR0_SKXCCM0_SGRO0_TIN0_TLDS0_TLDSM1_ULSGRO0_USL1_UIOFGRO0_USFGROn1_VSn1_VWA1_VWB1_WSGRA0_WSGRB0_WS32_WG32_2_1_WGM8_WGMXCC1_WGMXCCGn1
    SolutionIndex: 125
    SolutionNameMin: Cijk_Ailk_Bjlk_B8F8B8S_BH_Bias_SHB_HA_S_SAB_SCD_SAV_UserArgs_MT16x32x128_MI16x16x1_SN_LDSB0_AFC1_AG0_AFEM1_AFEM1_ASEM1_CLR1_CADS0_DTLA0_DTLB0_DTVA0_DTVB1_DTVSM0_DPLBn1_EPS1_ELFLR0_EMLLn1_FDSI0_GRPM1_GRVWA16_GRVWB8_GSU1_GSUAMB_GSUC0_GSUWGMRR0_GLS0_ISA1201_IU1_K1_LDSTI0_LBSPPA128_LBSPPB0_LBSPPM0_LPA16_LPB0_LPM0_LRVW8_LWPMn1_MIAV1_MIWT1_1_MO40_MGRIPMn1_NTn1_NTA0_NTB0_NTC0_NTD0_NTM0_NEPBS0_NLCA1_NLCB1_ONLL0_PGR1_PLR1_PKA0_SGROBn1_SIA3_SS0_SU32_SUM0_SUS256_SPO0_SRVW0_SSO0_SVW8_SK0_SKFTR0_SKXCCM0_SGRO0_TIN0_TLDS0_TLDSM1_ULSGRO0_USL1_UIOFGRO0_USFGROn1_VSn1_VWA1_VWB1_WSGRA0_WSGRB0_WS32_WG16_4_1_WGM8_WGMXCC1_WGMXCCGn1
    SolutionIndex: 126
    SolutionNameMin: Cijk_Ailk_Bjlk_B8F8B8S_BH_Bias_SHB_HA_S_SAB_SCD_SAV_UserArgs_MT32x32x128_MI16x16x1_SN_LDSB0_AFC1_AG0_AFEM1_AFEM1_ASEM1_CLR1_CADS0_DTLA0_DTLB0_DTVA1_DTVB1_DTVSM0_DPLBn1_EPS0_ELFLR0_EMLLn1_FDSI0_GRPM1_GRVWA8_GRVWB8_GSU1_GSUAMB_GSUC0_GSUWGMRR0_GLS0_ISA1201_IU1_K1_LDSTI0_LBSPPA0_LBSPPB0_LBSPPM0_LPA0_LPB0_LPM0_LRVW8_LWPMn1_MIAV1_MIWT1_1_MO40_MGRIPMn1_NTn1_NTA0_NTB0_NTC0_NTD0_NTM0_NEPBS0_NLCA1_NLCB1_ONLL0_PGR1_PLR0_PKA0_SGROBn1_SIA3_SS0_SU32_SUM0_SUS256_SPO0_SRVW0_SSO0_SVW8_SK0_SKFTR0_SKXCCM0_SGRO0_TIN0_TLDS0_TLDSM1_ULSGRO0_USL1_UIOFGRO0_USFGROn1_VSn1_VWA1_VWB1_WSGRA0_WSGRB0_WS32_WG32_4_1_WGM8_WGMXCC1_WGMXCCGn1
    SolutionIndex: 127
    SolutionNameMin: Cijk_Ailk_Bjlk_B8F8B8S_BH_Bias_SHB_HA_S_SAB_SCD_SAV_UserArgs_MT32x32x128_MI16x16x1_SN_LDSB0_AFC1_AG0_AFEM1_AFEM1_ASEM1_CLR1_CADS0_DTLA0_DTLB0_DTVA1_DTVB0_DTVSM0_DPLBn1_EPS0_ELFLR0_EMLLn1_FDSI0_GRPM1_GRVWA8_GRVWB4_GSU1_GSUAMB_GSUC0_GSUWGMRR0_GLS0_ISA1201_IU1_K1_LDSTI0_LBSPPA0_LBSPPB256_LBSPPM0_LPA0_LPB16_LPM0_LRVW8_LWPMn1_MIAV1_MIWT1_1_MO40_MGRIPMn1_NTn1_NTA0_NTB0_NTC0_NTD0_NTM0_NEPBS0_NLCA1_NLCB1_ONLL0_PGR2_PLR1_PKA0_SGROBn1_SIA3_SS0_SU32_SUM0_SUS256_SPO0_SRVW0_SSO0_SVW8_SK0_SKFTR0_SKXCCM0_SGRO0_TIN0_TLDS0_TLDSM1_ULSGRO0_USL1_UIOFGRO0_USFGROn1_VSn1_VWA1_VWB1_WSGRA0_WSGRB0_WS32_WG32_4_1_WGM8_WGMXCC1_WGMXCCGn1
    SolutionIndex: 128
    SolutionNameMin: Cijk_Ailk_Bjlk_B8F8B8S_BH_Bias_SHB_HA_S_SAB_SCD_SAV_UserArgs_MT32x32x128_MI16x16x1_SN_LDSB0_AFC1_AG0_AFEM1_AFEM1_ASEM1_CLR1_CADS0_DTLA0_DTLB0_DTVA1_DTVB0_DTVSM0_DPLBn1_EPS1_ELFLR0_EMLLn1_FDSI0_GRPM1_GRVWA8_GRVWB8_GSU1_GSUAMB_GSUC0_GSUWGMRR0_GLS0_ISA1201_IU1_K1_LDSTI0_LBSPPA0_LBSPPB256_LBSPPM0_LPA0_LPB16_LPM0_LRVW8_LWPMn1_MIAV1_MIWT1_1_MO40_MGRIPMn1_NTn1_NTA0_NTB0_NTC0_NTD0_NTM0_NEPBS0_NLCA1_NLCB1_ONLL0_PGR1_PLR1_PKA0_SGROBn1_SIA3_SS0_SU32_SUM0_SUS256_SPO0_SRVW0_SSO0_SVW8_SK0_SKFTR0_SKXCCM0_SGRO0_TIN0_TLDS0_TLDSM1_ULSGRO0_USL1_UIOFGRO0_USFGROn1_VSn1_VWA1_VWB1_WSGRA0_WSGRB0_WS32_WG32_4_1_WGM8_WGMXCC1_WGMXCCGn1
    SolutionIndex: 129
    SolutionNameMin: Cijk_Ailk_Bjlk_B8F8B8S_BH_Bias_SHB_HA_S_SAB_SCD_SAV_UserArgs_MT32x32x128_MI16x16x1_SN_LDSB0_AFC1_AG0_AFEM1_AFEM1_ASEM1_CLR1_CADS0_DTLA0_DTLB0_DTVA0_DTVB1_DTVSM0_DPLBn1_EPS1_ELFLR0_EMLLn1_FDSI0_GRPM1_GRVWA8_GRVWB8_GSU1_GSUAMB_GSUC0_GSUWGMRR0_GLS0_ISA1201_IU1_K1_LDSTI0_LBSPPA256_LBSPPB0_LBSPPM0_LPA16_LPB0_LPM0_LRVW8_LWPMn1_MIAV1_MIWT1_1_MO40_MGRIPMn1_NTn1_NTA0_NTB0_NTC0_NTD0_NTM0_NEPBS0_NLCA1_NLCB1_ONLL0_PGR1_PLR1_PKA0_SGROBn1_SIA3_SS1_SU32_SUM0_SUS256_SPO0_SRVW0_SSO0_SVW1_SK0_SKFTR0_SKXCCM0_SGRO0_TIN0_TLDS0_TLDSM1_ULSGRO0_USL1_UIOFGRO0_USFGROn1_VSn1_VWA1_VWB1_WSGRA0_WSGRB0_WS32_WG32_4_1_WGM8_WGMXCC1_WGMXCCGn1
    SolutionIndex: 130
    SolutionNameMin: Cijk_Ailk_Bjlk_B8F8B8S_BH_Bias_SHB_HA_S_SAB_SCD_SAV_UserArgs_MT32x32x128_MI16x16x1_SN_LDSB0_AFC1_AG0_AFEM1_AFEM1_ASEM1_CLR1_CADS0_DTLA0_DTLB0_DTVA1_DTVB0_DTVSM0_DPLBn1_EPS1_ELFLR0_EMLLn1_FDSI0_GRPM1_GRVWA8_GRVWB16_GSU1_GSUAMB_GSUC0_GSUWGMRR0_GLS0_ISA1201_IU1_K1_LDSTI0_LBSPPA0_LBSPPB256_LBSPPM0_LPA0_LPB16_LPM0_LRVW8_LWPMn1_MIAV1_MIWT1_1_MO40_MGRIPMn1_NTn1_NTA0_NTB0_NTC0_NTD0_NTM0_NEPBS0_NLCA1_NLCB1_ONLL0_PGR1_PLR1_PKA0_SGROBn1_SIA3_SS0_SU32_SUM0_SUS256_SPO0_SRVW0_SSO0_SVW8_SK0_SKFTR0_SKXCCM0_SGRO0_TIN0_TLDS0_TLDSM1_ULSGRO0_USL1_UIOFGRO0_USFGROn1_VSn1_VWA1_VWB1_WSGRA0_WSGRB0_WS32_WG32_4_1_WGM8_WGMXCC1_WGMXCCGn1
    SolutionIndex: 131
    SolutionNameMin: Cijk_Ailk_Bjlk_B8F8B8S_BH_Bias_SHB_HA_S_SAB_SCD_SAV_UserArgs_MT16x32x128_MI16x16x1_SN_LDSB0_AFC1_AG0_AFEM1_AFEM1_ASEM1_CLR1_CADS0_DTLA0_DTLB0_DTVA0_DTVB1_DTVSM0_DPLBn1_EPS1_ELFLR0_EMLLn1_FDSI0_GRPM1_GRVWA8_GRVWB8_GSU1_GSUAMB_GSUC0_GSUWGMRR0_GLS0_ISA1201_IU1_K1_LDSTI0_LBSPPA128_LBSPPB0_LBSPPM0_LPA16_LPB0_LPM0_LRVW8_LWPMn1_MIAV1_MIWT1_1_MO40_MGRIPMn1_NTn1_NTA0_NTB0_NTC0_NTD0_NTM0_NEPBS0_NLCA1_NLCB1_ONLL0_PGR1_PLR1_PKA0_SGROBn1_SIA3_SS0_SU32_SUM0_SUS256_SPO0_SRVW0_SSO0_SVW8_SK0_SKFTR0_SKXCCM0_SGRO0_TIN0_TLDS0_TLDSM1_ULSGRO0_USL1_UIOFGRO0_USFGROn1_VSn1_VWA1_VWB1_WSGRA0_WSGRB0_WS32_WG16_4_1_WGM8_WGMXCC1_WGMXCCGn1
    SolutionIndex: 132
    SolutionNameMin: Cijk_Ailk_Bjlk_B8F8B8S_BH_Bias_SHB_HA_S_SAB_SCD_SAV_UserArgs_MT32x128x64_MI16x16x1_SN_LDSB0_AFC1_AG0_AFEM1_AFEM1_ASEM1_CLR1_CADS0_DTLA0_DTLB0_DTVA0_DTVB1_DTVSM0_DPLBn1_EPS1_ELFLR0_EMLLn1_FDSI0_GRPM1_GRVWA16_GRVWB8_GSU1_GSUAMB_GSUC0_GSUWGMRR0_GLS0_ISA1201_IU1_K1_LDSTI0_LBSPPA256_LBSPPB0_LBSPPM0_LPA16_LPB0_LPM0_LRVW8_LWPMn1_MIAV1_MIWT1_4_MO40_MGRIPMn1_NTn1_NTA0_NTB0_NTC0_NTD0_NTM0_NEPBS0_NLCA1_NLCB4_ONLL0_PGR1_PLR1_PKA0_SGROBn1_SIA3_SS0_SU32_SUM0_SUS256_SPO0_SRVW0_SSO0_SVW8_SK0_SKFTR0_SKXCCM0_SGRO0_TIN0_TLDS0_TLDSM1_ULSGRO0_USL1_UIOFGRO0_USFGROn1_VSn1_VWA1_VWB1_WSGRA0_WSGRB0_WS32_WG32_4_1_WGM8_WGMXCC1_WGMXCCGn1
    SolutionIndex: 133
    SolutionNameMin: Cijk_Ailk_Bjlk_B8F8B8S_BH_Bias_SHB_HA_S_SAB_SCD_SAV_UserArgs_MT32x128x64_MI16x16x1_SN_LDSB0_AFC1_AG0_AFEM1_AFEM1_ASEM1_CLR1_CADS0_DTLA0_DTLB0_DTVA0_DTVB1_DTVSM0_DPLBn1_EPS1_ELFLR0_EMLLn1_FDSI0_GRPM1_GRVWA4_GRVWB8_GSU1_GSUAMB_GSUC0_GSUWGMRR0_GLS0_ISA1201_IU1_K1_LDSTI0_LBSPPA256_LBSPPB0_LBSPPM0_LPA16_LPB0_LPM0_LRVW8_LWPMn1_MIAV1_MIWT1_4_MO40_MGRIPMn1_NTn1_NTA0_NTB0_NTC0_NTD0_NTM0_NEPBS0_NLCA1_NLCB4_ONLL0_PGR1_PLR1_PKA0_SGROBn1_SIA3_SS0_SU32_SUM0_SUS256_SPO0_SRVW0_SSO0_SVW8_SK0_SKFTR0_SKXCCM0_SGRO0_TIN0_TLDS0_TLDSM1_ULSGRO0_USL1_UIOFGRO0_USFGROn1_VSn1_VWA1_VWB1_WSGRA0_WSGRB0_WS32_WG32_4_1_WGM8_WGMXCC1_WGMXCCGn1
    SolutionIndex: 134
    SolutionNameMin: Cijk_Ailk_Bjlk_B8F8B8S_BH_Bias_SHB_HA_S_SAB_SCD_SAV_UserArgs_MT128x32x64_MI16x16x1_SN_LDSB0_AFC1_AG0_AFEM1_AFEM1_ASEM1_CLR1_CADS0_DTLA0_DTLB0_DTVA1_DTVB0_DTVSM0_DPLBn1_EPS1_ELFLR0_EMLLn1_FDSI0_GRPM1_GRVWA8_GRVWB8_GSU1_GSUAMB_GSUC0_GSUWGMRR0_GLS0_ISA1201_IU1_K1_LDSTI0_LBSPPA0_LBSPPB256_LBSPPM0_LPA0_LPB16_LPM0_LRVW8_LWPMn1_MIAV1_MIWT4_1_MO40_MGRIPMn1_NTn1_NTA0_NTB0_NTC0_NTD0_NTM0_NEPBS0_NLCA4_NLCB1_ONLL0_PGR1_PLR1_PKA0_SGROBn1_SIA3_SS0_SU32_SUM0_SUS256_SPO0_SRVW0_SSO0_SVW8_SK0_SKFTR0_SKXCCM0_SGRO0_TIN0_TLDS0_TLDSM1_ULSGRO0_USL1_UIOFGRO0_USFGROn1_VSn1_VWA1_VWB1_WSGRA0_WSGRB0_WS32_WG32_4_1_WGM8_WGMXCC1_WGMXCCGn1
    SolutionIndex: 135
    SolutionNameMin: Cijk_Ailk_Bjlk_B8F8B8S_BH_Bias_SHB_HA_S_SAB_SCD_SAV_UserArgs_MT64x64x64_MI16x16x1_SN_LDSB0_AFC1_AG0_AFEM1_AFEM1_ASEM1_CLR1_CADS0_DTLA0_DTLB0_DTVA0_DTVB1_DTVSM0_DPLBn1_EPS1_ELFLR0_EMLLn1_FDSI0_GRPM1_GRVWA4_GRVWB8_GSU1_GSUAMB_GSUC0_GSUWGMRR0_GLS0_ISA1201_IU1_K1_LDSTI0_LBSPPA512_LBSPPB0_LBSPPM0_LPA32_LPB0_LPM0_LRVW8_LWPMn1_MIAV1_MIWT2_2_MO40_MGRIPMn1_NTn1_NTA0_NTB0_NTC0_NTD0_NTM0_NEPBS0_NLCA1_NLCB4_ONLL0_PGR1_PLR1_PKA0_SGROBn1_SIA3_SS1_SU32_SUM0_SUS256_SPO0_SRVW0_SSO0_SVW2_SK0_SKFTR0_SKXCCM0_SGRO0_TIN0_TLDS0_TLDSM1_ULSGRO0_USL1_UIOFGRO0_USFGROn1_VSn1_VWA2_VWB1_WSGRA0_WSGRB0_WS32_WG32_4_1_WGM8_WGMXCC1_WGMXCCGn1
    SolutionIndex: 136
    SolutionNameMin: Cijk_Ailk_Bjlk_B8F8B8S_BH_Bias_SHB_HA_S_SAB_SCD_SAV_UserArgs_MT32x128x64_MI16x16x1_SN_LDSB0_AFC1_AG0_AFEM1_AFEM1_ASEM1_CLR1_CADS0_DTLA0_DTLB0_DTVA0_DTVB1_DTVSM0_DPLBn1_EPS1_ELFLR0_EMLLn1_FDSI0_GRPM1_GRVWA8_GRVWB8_GSU1_GSUAMB_GSUC0_GSUWGMRR0_GLS0_ISA1201_IU1_K1_LDSTI0_LBSPPA256_LBSPPB0_LBSPPM0_LPA16_LPB0_LPM0_LRVW8_LWPMn1_MIAV1_MIWT1_4_MO40_MGRIPMn1_NTn1_NTA0_NTB0_NTC0_NTD0_NTM0_NEPBS0_NLCA1_NLCB4_ONLL0_PGR1_PLR1_PKA0_SGROBn1_SIA3_SS0_SU32_SUM0_SUS256_SPO0_SRVW0_SSO0_SVW8_SK0_SKFTR0_SKXCCM0_SGRO0_TIN0_TLDS0_TLDSM1_ULSGRO0_USL1_UIOFGRO0_USFGROn1_VSn1_VWA1_VWB1_WSGRA0_WSGRB0_WS32_WG32_4_1_WGM8_WGMXCC1_WGMXCCGn1
    SolutionIndex: 137
    SolutionNameMin: Cijk_Ailk_Bjlk_B8F8B8S_BH_Bias_SHB_HA_S_SAB_SCD_SAV_UserArgs_MT32x128x32_MI16x16x1_SN_LDSB0_AFC1_AG0_AFEM1_AFEM1_ASEM1_CLR1_CADS0_DTLA0_DTLB0_DTVA0_DTVB1_DTVSM0_DPLBn1_EPS0_ELFLR0_EMLLn1_FDSI0_GRPM1_GRVWA4_GRVWB8_GSU1_GSUAMB_GSUC0_GSUWGMRR0_GLS0_ISA1201_IU1_K1_LDSTI0_LBSPPA256_LBSPPB0_LBSPPM0_LPA16_LPB0_LPM0_LRVW8_LWPMn1_MIAV1_MIWT1_4_MO40_MGRIPMn1_NTn1_NTA0_NTB0_NTC0_NTD0_NTM0_NEPBS0_NLCA1_NLCB2_ONLL0_PGR2_PLR1_PKA0_SGROBn1_SIA3_SS0_SU32_SUM0_SUS256_SPO0_SRVW0_SSO0_SVW8_SK0_SKFTR0_SKXCCM0_SGRO0_TIN0_TLDS0_TLDSM1_ULSGRO0_USL1_UIOFGRO0_USFGROn1_VSn1_VWA1_VWB1_WSGRA0_WSGRB0_WS32_WG32_4_1_WGM8_WGMXCC1_WGMXCCGn1
    SolutionIndex: 138
    SolutionNameMin: Cijk_Ailk_Bjlk_B8F8B8S_BH_Bias_SHB_HA_S_SAB_SCD_SAV_UserArgs_MT128x32x64_MI16x16x1_SN_LDSB0_AFC1_AG0_AFEM1_AFEM1_ASEM1_CLR1_CADS0_DTLA0_DTLB0_DTVA1_DTVB0_DTVSM0_DPLBn1_EPS1_ELFLR0_EMLLn1_FDSI0_GRPM1_GRVWA8_GRVWB4_GSU1_GSUAMB_GSUC0_GSUWGMRR0_GLS0_ISA1201_IU1_K1_LDSTI0_LBSPPA0_LBSPPB256_LBSPPM0_LPA0_LPB16_LPM0_LRVW8_LWPMn1_MIAV1_MIWT4_1_MO40_MGRIPMn1_NTn1_NTA0_NTB0_NTC0_NTD0_NTM0_NEPBS0_NLCA4_NLCB1_ONLL0_PGR1_PLR1_PKA0_SGROBn1_SIA3_SS0_SU32_SUM0_SUS256_SPO0_SRVW0_SSO0_SVW8_SK0_SKFTR0_SKXCCM0_SGRO0_TIN0_TLDS0_TLDSM1_ULSGRO0_USL1_UIOFGRO0_USFGROn1_VSn1_VWA1_VWB1_WSGRA0_WSGRB0_WS32_WG32_4_1_WGM8_WGMXCC1_WGMXCCGn1
    SolutionIndex: 139
    SolutionNameMin: Cijk_Ailk_Bjlk_B8F8B8S_BH_Bias_SHB_HA_S_SAB_SCD_SAV_UserArgs_MT32x32x128_MI16x16x1_SN_LDSB0_AFC1_AG0_AFEM1_AFEM1_ASEM1_CLR1_CADS0_DTLA0_DTLB0_DTVA0_DTVB1_DTVSM0_DPLBn1_EPS1_ELFLR0_EMLLn1_FDSI0_GRPM1_GRVWA8_GRVWB8_GSU1_GSUAMB_GSUC0_GSUWGMRR0_GLS0_ISA1201_IU1_K1_LDSTI0_LBSPPA256_LBSPPB0_LBSPPM0_LPA16_LPB0_LPM0_LRVW8_LWPMn1_MIAV1_MIWT1_1_MO40_MGRIPMn1_NTn1_NTA0_NTB0_NTC0_NTD0_NTM0_NEPBS0_NLCA1_NLCB1_ONLL0_PGR1_PLR1_PKA0_SGROBn1_SIA3_SS0_SU32_SUM0_SUS256_SPO0_SRVW0_SSO0_SVW8_SK0_SKFTR0_SKXCCM0_SGRO0_TIN0_TLDS0_TLDSM1_ULSGRO0_USL1_UIOFGRO0_USFGROn1_VSn1_VWA1_VWB1_WSGRA0_WSGRB0_WS32_WG32_4_1_WGM8_WGMXCC1_WGMXCCGn1
    SolutionIndex: 140
    SolutionNameMin: Cijk_Ailk_Bjlk_B8F8B8S_BH_Bias_SHB_HA_S_SAB_SCD_SAV_UserArgs_MT32x16x64_MI16x16x1_SN_LDSB0_AFC1_AG0_AFEM1_AFEM1_ASEM1_CLR1_CADS0_DTLA0_DTLB0_DTVA1_DTVB0_DTVSM0_DPLBn1_EPS0_ELFLR0_EMLLn1_FDSI0_GRPM1_GRVWA8_GRVWB8_GSU1_GSUAMB_GSUC0_GSUWGMRR0_GLS0_ISA1201_IU1_K1_LDSTI0_LBSPPA0_LBSPPB128_LBSPPM0_LPA0_LPB16_LPM0_LRVW8_LWPMn1_MIAV1_MIWT1_1_MO40_MGRIPMn1_NTn1_NTA0_NTB0_NTC0_NTD0_NTM0_NEPBS0_NLCA1_NLCB1_ONLL0_PGR2_PLR1_PKA0_SGROBn1_SIA3_SS0_SU32_SUM0_SUS256_SPO0_SRVW0_SSO0_SVW8_SK0_SKFTR0_SKXCCM0_SGRO0_TIN0_TLDS0_TLDSM1_ULSGRO0_USL1_UIOFGRO0_USFGROn1_VSn1_VWA1_VWB1_WSGRA0_WSGRB0_WS32_WG32_2_1_WGM8_WGMXCC1_WGMXCCGn1
    SolutionIndex: 141
    SolutionNameMin: Cijk_Ailk_Bjlk_B8F8B8S_BH_Bias_SHB_HA_S_SAB_SCD_SAV_UserArgs_MT32x32x32_MI16x16x1_SN_LDSB0_AFC1_AG0_AFEM1_AFEM1_ASEM1_CLR1_CADS0_DTLA0_DTLB0_DTVA1_DTVB0_DTVSM0_DPLBn1_EPS0_ELFLR0_EMLLn1_FDSI0_GRPM1_GRVWA8_GRVWB8_GSU1_GSUAMB_GSUC0_GSUWGMRR0_GLS0_ISA1201_IU1_K1_LDSTI0_LBSPPA0_LBSPPB256_LBSPPM0_LPA0_LPB16_LPM0_LRVW8_LWPMn1_MIAV1_MIWT1_1_MO40_MGRIPMn1_NTn1_NTA0_NTB0_NTC0_NTD0_NTM0_NEPBS0_NLCA1_NLCB1_ONLL0_PGR2_PLR1_PKA0_SGROBn1_SIA3_SS0_SU32_SUM0_SUS256_SPO0_SRVW0_SSO0_SVW8_SK0_SKFTR0_SKXCCM0_SGRO0_TIN0_TLDS0_TLDSM1_ULSGRO0_USL1_UIOFGRO0_USFGROn1_VSn1_VWA1_VWB1_WSGRA0_WSGRB0_WS32_WG32_4_1_WGM8_WGMXCC1_WGMXCCGn1
    SolutionIndex: 142
    SolutionNameMin: Cijk_Ailk_Bjlk_B8F8B8S_BH_Bias_SHB_HA_S_SAB_SCD_SAV_UserArgs_MT128x32x64_MI16x16x1_SN_LDSB0_AFC1_AG0_AFEM1_AFEM1_ASEM1_CLR1_CADS0_DTLA0_DTLB0_DTVA1_DTVB0_DTVSM0_DPLBn1_EPS1_ELFLR0_EMLLn1_FDSI0_GRPM1_GRVWA8_GRVWB16_GSU1_GSUAMB_GSUC0_GSUWGMRR0_GLS0_ISA1201_IU1_K1_LDSTI0_LBSPPA0_LBSPPB256_LBSPPM0_LPA0_LPB16_LPM0_LRVW8_LWPMn1_MIAV1_MIWT4_1_MO40_MGRIPMn1_NTn1_NTA0_NTB0_NTC0_NTD0_NTM0_NEPBS0_NLCA4_NLCB1_ONLL0_PGR1_PLR1_PKA0_SGROBn1_SIA3_SS0_SU32_SUM0_SUS256_SPO0_SRVW0_SSO0_SVW8_SK0_SKFTR0_SKXCCM0_SGRO0_TIN0_TLDS0_TLDSM1_ULSGRO0_USL1_UIOFGRO0_USFGROn1_VSn1_VWA1_VWB1_WSGRA0_WSGRB0_WS32_WG32_4_1_WGM8_WGMXCC1_WGMXCCGn1
    SolutionIndex: 143
    SolutionNameMin: Cijk_Ailk_Bjlk_B8F8B8S_BH_Bias_SHB_HA_S_SAB_SCD_SAV_UserArgs_MT64x64x128_MI16x16x1_SN_LDSB0_AFC1_AG0_AFEM1_AFEM1_ASEM1_CLR1_CADS0_DTLA0_DTLB0_DTVA1_DTVB1_DTVSM0_DPLBn1_EPS0_ELFLR0_EMLLn1_FDSI0_GRPM1_GRVWA8_GRVWB8_GSU1_GSUAMB_GSUC0_GSUWGMRR0_GLS0_ISA1201_IU1_K1_LDSTI0_LBSPPA0_LBSPPB0_LBSPPM0_LPA0_LPB0_LPM0_LRVW8_LWPMn1_MIAV1_MIWT2_2_MO40_MGRIPMn1_NTn1_NTA0_NTB0_NTC0_NTD0_NTM0_NEPBS0_NLCA8_NLCB8_ONLL0_PGR1_PLR0_PKA0_SGROBn1_SIA3_SS0_SU32_SUM0_SUS256_SPO0_SRVW0_SSO0_SVW8_SK0_SKFTR0_SKXCCM0_SGRO0_TIN0_TLDS0_TLDSM1_ULSGRO0_USL1_UIOFGRO0_USFGROn1_VSn1_VWA1_VWB1_WSGRA0_WSGRB0_WS32_WG32_4_1_WGM8_WGMXCC1_WGMXCCGn1
    SolutionIndex: 144
    SolutionNameMin: Cijk_Ailk_Bjlk_B8F8B8S_BH_Bias_SHB_HA_S_SAB_SCD_SAV_UserArgs_MT32x32x64_MI16x16x1_SN_LDSB0_AFC1_AG0_AFEM1_AFEM1_ASEM1_CLR1_CADS0_DTLA0_DTLB0_DTVA1_DTVB0_DTVSM0_DPLBn1_EPS0_ELFLR0_EMLLn1_FDSI0_GRPM1_GRVWA8_GRVWB16_GSU1_GSUAMB_GSUC0_GSUWGMRR0_GLS0_ISA1201_IU1_K1_LDSTI0_LBSPPA0_LBSPPB256_LBSPPM0_LPA0_LPB16_LPM0_LRVW8_LWPMn1_MIAV1_MIWT1_1_MO40_MGRIPMn1_NTn1_NTA0_NTB0_NTC0_NTD0_NTM0_NEPBS0_NLCA1_NLCB1_ONLL0_PGR2_PLR1_PKA0_SGROBn1_SIA3_SS1_SU32_SUM0_SUS256_SPO0_SRVW0_SSO0_SVW1_SK0_SKFTR0_SKXCCM0_SGRO0_TIN0_TLDS0_TLDSM1_ULSGRO0_USL1_UIOFGRO0_USFGROn1_VSn1_VWA1_VWB1_WSGRA0_WSGRB0_WS32_WG32_4_1_WGM8_WGMXCC1_WGMXCCGn1
    SolutionIndex: 145
    SolutionNameMin: Cijk_Ailk_Bjlk_B8F8B8S_BH_Bias_SHB_HA_S_SAB_SCD_SAV_UserArgs_MT64x64x128_MI16x16x1_SN_LDSB0_AFC1_AG0_AFEM1_AFEM1_ASEM1_CLR1_CADS0_DTLA0_DTLB0_DTVA0_DTVB1_DTVSM0_DPLBn1_EPS1_ELFLR0_EMLLn1_FDSI0_GRPM1_GRVWA16_GRVWB8_GSU1_GSUAMB_GSUC0_GSUWGMRR0_GLS0_ISA1201_IU1_K1_LDSTI0_LBSPPA512_LBSPPB0_LBSPPM0_LPA32_LPB0_LPM0_LRVW8_LWPMn1_MIAV1_MIWT2_2_MO40_MGRIPMn1_NTn1_NTA0_NTB0_NTC0_NTD0_NTM0_NEPBS0_NLCA1_NLCB8_ONLL0_PGR1_PLR1_PKA0_SGROBn1_SIA3_SS0_SU32_SUM0_SUS256_SPO0_SRVW0_SSO0_SVW16_SK0_SKFTR0_SKXCCM0_SGRO0_TIN0_TLDS0_TLDSM1_ULSGRO0_USL1_UIOFGRO0_USFGROn1_VSn1_VWA2_VWB1_WSGRA0_WSGRB0_WS32_WG32_4_1_WGM8_WGMXCC1_WGMXCCGn1
    SolutionIndex: 146
    SolutionNameMin: Cijk_Ailk_Bjlk_B8F8B8S_BH_Bias_SHB_HA_S_SAB_SCD_SAV_UserArgs_MT32x32x128_MI16x16x1_SN_LDSB0_AFC1_AG0_AFEM1_AFEM1_ASEM1_CLR1_CADS0_DTLA0_DTLB0_DTVA1_DTVB0_DTVSM0_DPLBn1_EPS0_ELFLR0_EMLLn1_FDSI0_GRPM1_GRVWA8_GRVWB8_GSU1_GSUAMB_GSUC0_GSUWGMRR0_GLS0_ISA1201_IU1_K1_LDSTI0_LBSPPA0_LBSPPB256_LBSPPM0_LPA0_LPB16_LPM0_LRVW8_LWPMn1_MIAV1_MIWT1_1_MO40_MGRIPMn1_NTn1_NTA0_NTB0_NTC0_NTD0_NTM0_NEPBS0_NLCA1_NLCB1_ONLL0_PGR2_PLR1_PKA0_SGROBn1_SIA3_SS0_SU32_SUM0_SUS256_SPO0_SRVW0_SSO0_SVW8_SK0_SKFTR0_SKXCCM0_SGRO0_TIN0_TLDS0_TLDSM1_ULSGRO0_USL1_UIOFGRO0_USFGROn1_VSn1_VWA1_VWB1_WSGRA0_WSGRB0_WS32_WG32_4_1_WGM8_WGMXCC1_WGMXCCGn1
    SolutionIndex: 147
    SolutionNameMin: Cijk_Ailk_Bjlk_B8F8B8S_BH_Bias_SHB_HA_S_SAB_SCD_SAV_UserArgs_MT128x32x128_MI16x16x1_SN_LDSB1_AFC1_AG0_AFEM1_AFEM1_ASEM1_CLR1_CADS0_DTLA0_DTLB0_DTVA0_DTVB1_DTVSM0_DPLBn1_EPS1_ELFLR0_EMLLn1_FDSI0_GRPM1_GRVWA8_GRVWB8_GSU1_GSUAMB_GSUC0_GSUWGMRR0_GLS0_ISA1201_IU1_K1_LDSTI0_LBSPPA1024_LBSPPB0_LBSPPM0_LPA64_LPB0_LPM0_LRVW8_LWPMn1_MIAV1_MIWT4_1_MO40_MGRIPMn1_NTn1_NTA0_NTB0_NTC0_NTD0_NTM0_NEPBS0_NLCA1_NLCB1_ONLL0_PGR1_PLR1_PKA0_SGROBn1_SIA3_SS1_SU32_SUM0_SUS256_SPO0_SRVW0_SSO0_SVW4_SK0_SKFTR0_SKXCCM0_SGRO0_TIN0_TLDS0_TLDSM1_ULSGRO0_USL1_UIOFGRO0_USFGROn1_VSn1_VWA4_VWB1_WSGRA0_WSGRB0_WS32_WG32_4_1_WGM8_WGMXCC1_WGMXCCGn1
    SolutionIndex: 148
    SolutionNameMin: Cijk_Ailk_Bjlk_B8F8B8S_BH_Bias_SHB_HA_S_SAB_SCD_SAV_UserArgs_MT32x128x32_MI16x16x1_SN_LDSB0_AFC1_AG0_AFEM1_AFEM1_ASEM1_CLR1_CADS0_DTLA0_DTLB0_DTVA0_DTVB1_DTVSM0_DPLBn1_EPS0_ELFLR0_EMLLn1_FDSI0_GRPM1_GRVWA8_GRVWB8_GSU1_GSUAMB_GSUC0_GSUWGMRR0_GLS0_ISA1201_IU1_K1_LDSTI0_LBSPPA256_LBSPPB0_LBSPPM0_LPA16_LPB0_LPM0_LRVW8_LWPMn1_MIAV1_MIWT1_4_MO40_MGRIPMn1_NTn1_NTA0_NTB0_NTC0_NTD0_NTM0_NEPBS0_NLCA1_NLCB2_ONLL0_PGR2_PLR1_PKA0_SGROBn1_SIA3_SS0_SU32_SUM0_SUS256_SPO0_SRVW0_SSO0_SVW8_SK0_SKFTR0_SKXCCM0_SGRO0_TIN0_TLDS0_TLDSM1_ULSGRO0_USL1_UIOFGRO0_USFGROn1_VSn1_VWA1_VWB1_WSGRA0_WSGRB0_WS32_WG32_4_1_WGM8_WGMXCC1_WGMXCCGn1
    SolutionIndex: 149
    SolutionNameMin: Cijk_Ailk_Bjlk_B8F8B8S_BH_Bias_SHB_HA_S_SAB_SCD_SAV_UserArgs_MT64x64x64_MI16x16x1_SN_LDSB0_AFC1_AG0_AFEM1_AFEM1_ASEM1_CLR1_CADS0_DTLA0_DTLB0_DTVA1_DTVB0_DTVSM0_DPLBn1_EPS1_ELFLR0_EMLLn1_FDSI0_GRPM1_GRVWA8_GRVWB16_GSU1_GSUAMB_GSUC0_GSUWGMRR0_GLS0_ISA1201_IU1_K1_LDSTI0_LBSPPA0_LBSPPB512_LBSPPM0_LPA0_LPB32_LPM0_LRVW8_LWPMn1_MIAV1_MIWT2_2_MO40_MGRIPMn1_NTn1_NTA0_NTB0_NTC0_NTD0_NTM0_NEPBS0_NLCA4_NLCB1_ONLL0_PGR1_PLR1_PKA0_SGROBn1_SIA3_SS0_SU32_SUM0_SUS256_SPO0_SRVW0_SSO0_SVW8_SK0_SKFTR0_SKXCCM0_SGRO0_TIN0_TLDS0_TLDSM1_ULSGRO0_USL1_UIOFGRO0_USFGROn1_VSn1_VWA1_VWB2_WSGRA0_WSGRB0_WS32_WG32_4_1_WGM8_WGMXCC1_WGMXCCGn1
    SolutionIndex: 150
    SolutionNameMin: Cijk_Ailk_Bjlk_B8F8B8S_BH_Bias_SHB_HA_S_SAB_SCD_SAV_UserArgs_MT16x256x16_MI16x16x1_SN_LDSB0_AFC1_AG0_AFEM1_AFEM1_ASEM1_CLR1_CADS0_DTLA0_DTLB0_DTVA1_DTVB1_DTVSM0_DPLBn1_EPS0_ELFLR0_EMLLn1_FDSI0_GRPM1_GRVWA8_GRVWB8_GSU1_GSUAMB_GSUC0_GSUWGMRR0_GLS0_ISA1201_IU1_K1_LDSTI0_LBSPPA0_LBSPPB0_LBSPPM0_LPA0_LPB0_LPM0_LRVW8_LWPMn1_MIAV1_MIWT1_8_MO40_MGRIPMn1_NTn1_NTA0_NTB0_NTC0_NTD0_NTM0_NEPBS0_NLCA1_NLCB1_ONLL0_PGR1_PLR0_PKA0_SGROBn1_SIA3_SS0_SU32_SUM0_SUS256_SPO0_SRVW0_SSO0_SVW8_SK0_SKFTR0_SKXCCM0_SGRO0_TIN0_TLDS0_TLDSM1_ULSGRO0_USL1_UIOFGRO0_USFGROn1_VSn1_VWA1_VWB1_WSGRA0_WSGRB0_WS32_WG16_4_1_WGM8_WGMXCC1_WGMXCCGn1
    SolutionIndex: 151
    SolutionNameMin: Cijk_Ailk_Bjlk_B8F8B8S_BH_Bias_SHB_HA_S_SAB_SCD_SAV_UserArgs_MT64x64x64_MI16x16x1_SN_LDSB0_AFC1_AG0_AFEM1_AFEM1_ASEM1_CLR1_CADS0_DTLA0_DTLB0_DTVA1_DTVB0_DTVSM0_DPLBn1_EPS1_ELFLR0_EMLLn1_FDSI0_GRPM1_GRVWA8_GRVWB8_GSU1_GSUAMB_GSUC0_GSUWGMRR0_GLS0_ISA1201_IU1_K1_LDSTI0_LBSPPA0_LBSPPB512_LBSPPM0_LPA0_LPB32_LPM0_LRVW8_LWPMn1_MIAV1_MIWT2_2_MO40_MGRIPMn1_NTn1_NTA0_NTB0_NTC0_NTD0_NTM0_NEPBS0_NLCA4_NLCB1_ONLL0_PGR1_PLR1_PKA0_SGROBn1_SIA3_SS0_SU32_SUM0_SUS256_SPO0_SRVW0_SSO0_SVW8_SK0_SKFTR0_SKXCCM0_SGRO0_TIN0_TLDS0_TLDSM1_ULSGRO0_USL1_UIOFGRO0_USFGROn1_VSn1_VWA1_VWB2_WSGRA0_WSGRB0_WS32_WG32_4_1_WGM8_WGMXCC1_WGMXCCGn1
    SolutionIndex: 152
    SolutionNameMin: Cijk_Ailk_Bjlk_B8F8B8S_BH_Bias_SHB_HA_S_SAB_SCD_SAV_UserArgs_MT128x64x32_MI16x16x1_SN_LDSB0_AFC1_AG0_AFEM1_AFEM1_ASEM1_CLR1_CADS0_DTLA0_DTLB0_DTVA1_DTVB0_DTVSM0_DPLBn1_EPS1_ELFLR0_EMLLn1_FDSI0_GRPM1_GRVWA8_GRVWB8_GSU1_GSUAMB_GSUC0_GSUWGMRR0_GLS0_ISA1201_IU1_K1_LDSTI0_LBSPPA0_LBSPPB512_LBSPPM0_LPA0_LPB16_LPM0_LRVW8_LWPMn1_MIAV1_MIWT8_1_MO40_MGRIPMn1_NTn1_NTA0_NTB0_NTC0_NTD0_NTM0_NEPBS0_NLCA2_NLCB1_ONLL0_PGR1_PLR1_PKA0_SGROBn1_SIA3_SS0_SU32_SUM0_SUS256_SPO0_SRVW0_SSO0_SVW8_SK0_SKFTR0_SKXCCM0_SGRO0_TIN0_TLDS0_TLDSM1_ULSGRO0_USL1_UIOFGRO0_USFGROn1_VSn1_VWA1_VWB1_WSGRA0_WSGRB0_WS32_WG16_8_1_WGM8_WGMXCC1_WGMXCCGn1
    SolutionIndex: 153
    SolutionNameMin: Cijk_Ailk_Bjlk_B8F8B8S_BH_Bias_SHB_HA_S_SAB_SCD_SAV_UserArgs_MT32x32x32_MI16x16x1_SN_LDSB0_AFC1_AG0_AFEM1_AFEM1_ASEM1_CLR1_CADS0_DTLA0_DTLB0_DTVA0_DTVB1_DTVSM0_DPLBn1_EPS0_ELFLR0_EMLLn1_FDSI0_GRPM1_GRVWA8_GRVWB8_GSU1_GSUAMB_GSUC0_GSUWGMRR0_GLS0_ISA1201_IU1_K1_LDSTI0_LBSPPA256_LBSPPB0_LBSPPM0_LPA16_LPB0_LPM0_LRVW8_LWPMn1_MIAV1_MIWT1_1_MO40_MGRIPMn1_NTn1_NTA0_NTB0_NTC0_NTD0_NTM0_NEPBS0_NLCA1_NLCB1_ONLL0_PGR2_PLR1_PKA0_SGROBn1_SIA3_SS0_SU32_SUM0_SUS256_SPO0_SRVW0_SSO0_SVW8_SK0_SKFTR0_SKXCCM0_SGRO0_TIN0_TLDS0_TLDSM1_ULSGRO0_USL1_UIOFGRO0_USFGROn1_VSn1_VWA1_VWB1_WSGRA0_WSGRB0_WS32_WG32_4_1_WGM8_WGMXCC1_WGMXCCGn1
    SolutionIndex: 154
    SolutionNameMin: Cijk_Ailk_Bjlk_B8F8B8S_BH_Bias_SHB_HA_S_SAB_SCD_SAV_UserArgs_MT128x64x32_MI16x16x1_SN_LDSB0_AFC1_AG0_AFEM1_AFEM1_ASEM1_CLR1_CADS0_DTLA0_DTLB0_DTVA1_DTVB0_DTVSM0_DPLBn1_EPS1_ELFLR0_EMLLn1_FDSI0_GRPM1_GRVWA8_GRVWB1_GSU1_GSUAMB_GSUC0_GSUWGMRR0_GLS0_ISA1201_IU1_K1_LDSTI0_LBSPPA0_LBSPPB512_LBSPPM0_LPA0_LPB16_LPM0_LRVW8_LWPMn1_MIAV1_MIWT8_1_MO40_MGRIPMn1_NTn1_NTA0_NTB0_NTC0_NTD0_NTM0_NEPBS0_NLCA2_NLCB1_ONLL0_PGR1_PLR1_PKA0_SGROBn1_SIA3_SS0_SU32_SUM0_SUS256_SPO0_SRVW0_SSO0_SVW8_SK0_SKFTR0_SKXCCM0_SGRO0_TIN0_TLDS0_TLDSM1_ULSGRO0_USL1_UIOFGRO0_USFGROn1_VSn1_VWA1_VWB1_WSGRA0_WSGRB0_WS32_WG16_8_1_WGM8_WGMXCC1_WGMXCCGn1
    SolutionIndex: 155
    SolutionNameMin: Cijk_Ailk_Bjlk_B8F8B8S_BH_Bias_SHB_HA_S_SAB_SCD_SAV_UserArgs_MT32x32x128_MI16x16x1_SN_LDSB0_AFC1_AG0_AFEM1_AFEM1_ASEM1_CLR1_CADS0_DTLA0_DTLB0_DTVA1_DTVB1_DTVSM0_DPLBn1_EPS0_ELFLR0_EMLLn1_FDSI0_GRPM1_GRVWA8_GRVWB8_GSU1_GSUAMB_GSUC0_GSUWGMRR0_GLS0_ISA1201_IU1_K1_LDSTI0_LBSPPA0_LBSPPB0_LBSPPM0_LPA0_LPB0_LPM0_LRVW8_LWPMn1_MIAV1_MIWT1_1_MO40_MGRIPMn1_NTn1_NTA0_NTB0_NTC0_NTD0_NTM0_NEPBS0_NLCA1_NLCB1_ONLL0_PGR1_PLR0_PKA0_SGROBn1_SIA3_SS1_SU32_SUM0_SUS256_SPO0_SRVW0_SSO0_SVW1_SK0_SKFTR0_SKXCCM0_SGRO0_TIN0_TLDS0_TLDSM1_ULSGRO0_USL1_UIOFGRO0_USFGROn1_VSn1_VWA1_VWB1_WSGRA0_WSGRB0_WS32_WG32_4_1_WGM8_WGMXCC1_WGMXCCGn1
    SolutionIndex: 156
    SolutionNameMin: Cijk_Ailk_Bjlk_B8F8B8S_BH_Bias_SHB_HA_S_SAB_SCD_SAV_UserArgs_MT64x64x128_MI16x16x1_SN_LDSB0_AFC1_AG0_AFEM1_AFEM1_ASEM1_CLR1_CADS0_DTLA0_DTLB0_DTVA0_DTVB1_DTVSM0_DPLBn1_EPS1_ELFLR0_EMLLn1_FDSI0_GRPM1_GRVWA4_GRVWB8_GSU1_GSUAMB_GSUC0_GSUWGMRR0_GLS0_ISA1201_IU1_K1_LDSTI0_LBSPPA512_LBSPPB0_LBSPPM0_LPA32_LPB0_LPM0_LRVW8_LWPMn1_MIAV1_MIWT2_2_MO40_MGRIPMn1_NTn1_NTA0_NTB0_NTC0_NTD0_NTM0_NEPBS0_NLCA1_NLCB8_ONLL0_PGR1_PLR1_PKA0_SGROBn1_SIA3_SS0_SU32_SUM0_SUS256_SPO0_SRVW0_SSO0_SVW16_SK0_SKFTR0_SKXCCM0_SGRO0_TIN0_TLDS0_TLDSM1_ULSGRO0_USL1_UIOFGRO0_USFGROn1_VSn1_VWA2_VWB1_WSGRA0_WSGRB0_WS32_WG32_4_1_WGM8_WGMXCC1_WGMXCCGn1
    SolutionIndex: 157
    SolutionNameMin: Cijk_Ailk_Bjlk_B8F8B8S_BH_Bias_SHB_HA_S_SAB_SCD_SAV_UserArgs_MT128x128x32_MI16x16x1_SN_LDSB0_AFC1_AG0_AFEM1_AFEM1_ASEM1_CLR1_CADS0_DTLA0_DTLB0_DTVA1_DTVB1_DTVSM0_DPLBn1_EPS0_ELFLR0_EMLLn1_FDSI0_GRPM1_GRVWA8_GRVWB8_GSU1_GSUAMB_GSUC0_GSUWGMRR0_GLS0_ISA1201_IU1_K1_LDSTI0_LBSPPA0_LBSPPB0_LBSPPM0_LPA0_LPB0_LPM0_LRVW8_LWPMn1_MIAV1_MIWT8_2_MO40_MGRIPMn1_NTn1_NTA0_NTB0_NTC0_NTD0_NTM0_NEPBS0_NLCA2_NLCB2_ONLL0_PGR1_PLR0_PKA0_SGROBn1_SIA3_SS0_SU32_SUM0_SUS256_SPO0_SRVW0_SSO0_SVW8_SK0_SKFTR0_SKXCCM0_SGRO0_TIN0_TLDS0_TLDSM1_ULSGRO0_USL1_UIOFGRO0_USFGROn1_VSn1_VWA1_VWB1_WSGRA0_WSGRB0_WS32_WG16_8_1_WGM8_WGMXCC1_WGMXCCGn1
    SolutionIndex: 158
    SolutionNameMin: Cijk_Ailk_Bjlk_B8F8B8S_BH_Bias_SHB_HA_S_SAB_SCD_SAV_UserArgs_MT64x128x32_MI16x16x1_SN_LDSB0_AFC1_AG0_AFEM1_AFEM1_ASEM1_CLR1_CADS0_DTLA0_DTLB0_DTVA0_DTVB1_DTVSM0_DPLBn1_EPS0_ELFLR0_EMLLn1_FDSI0_GRPM1_GRVWA16_GRVWB8_GSU1_GSUAMB_GSUC0_GSUWGMRR0_GLS0_ISA1201_IU1_K1_LDSTI0_LBSPPA512_LBSPPB0_LBSPPM0_LPA16_LPB0_LPM0_LRVW8_LWPMn1_MIAV1_MIWT1_8_MO40_MGRIPMn1_NTn1_NTA0_NTB0_NTC0_NTD0_NTM0_NEPBS0_NLCA1_NLCB2_ONLL0_PGR2_PLR1_PKA0_SGROBn1_SIA3_SS0_SU32_SUM0_SUS256_SPO0_SRVW0_SSO0_SVW8_SK0_SKFTR0_SKXCCM0_SGRO0_TIN0_TLDS0_TLDSM1_ULSGRO0_USL1_UIOFGRO0_USFGROn1_VSn1_VWA1_VWB1_WSGRA0_WSGRB0_WS32_WG64_2_1_WGM8_WGMXCC1_WGMXCCGn1
    SolutionIndex: 159
    SolutionNameMin: Cijk_Ailk_Bjlk_B8F8B8S_BH_Bias_SHB_HA_S_SAB_SCD_SAV_UserArgs_MT256x16x32_MI16x16x1_SN_LDSB0_AFC1_AG0_AFEM1_AFEM1_ASEM1_CLR1_CADS0_DTLA0_DTLB0_DTVA1_DTVB0_DTVSM0_DPLBn1_EPS1_ELFLR0_EMLLn1_FDSI0_GRPM1_GRVWA8_GRVWB4_GSU1_GSUAMB_GSUC0_GSUWGMRR0_GLS0_ISA1201_IU1_K1_LDSTI0_LBSPPA0_LBSPPB128_LBSPPM0_LPA0_LPB16_LPM0_LRVW8_LWPMn1_MIAV1_MIWT8_1_MO40_MGRIPMn1_NTn1_NTA0_NTB0_NTC0_NTD0_NTM0_NEPBS0_NLCA2_NLCB1_ONLL0_PGR1_PLR1_PKA0_SGROBn1_SIA3_SS0_SU32_SUM0_SUS256_SPO0_SRVW0_SSO0_SVW8_SK0_SKFTR0_SKXCCM0_SGRO0_TIN0_TLDS0_TLDSM1_ULSGRO0_USL1_UIOFGRO0_USFGROn1_VSn1_VWA1_VWB1_WSGRA0_WSGRB0_WS32_WG32_2_1_WGM8_WGMXCC1_WGMXCCGn1
    SolutionIndex: 160
    SolutionNameMin: Cijk_Ailk_Bjlk_B8F8B8S_BH_Bias_SHB_HA_S_SAB_SCD_SAV_UserArgs_MT64x64x64_MI16x16x1_SN_LDSB0_AFC1_AG0_AFEM1_AFEM1_ASEM1_CLR1_CADS0_DTLA0_DTLB0_DTVA0_DTVB1_DTVSM0_DPLBn1_EPS1_ELFLR0_EMLLn1_FDSI0_GRPM1_GRVWA16_GRVWB8_GSU1_GSUAMB_GSUC0_GSUWGMRR0_GLS0_ISA1201_IU1_K1_LDSTI0_LBSPPA512_LBSPPB0_LBSPPM0_LPA32_LPB0_LPM0_LRVW8_LWPMn1_MIAV1_MIWT2_2_MO40_MGRIPMn1_NTn1_NTA0_NTB0_NTC0_NTD0_NTM0_NEPBS0_NLCA1_NLCB4_ONLL0_PGR1_PLR1_PKA0_SGROBn1_SIA3_SS1_SU32_SUM0_SUS256_SPO0_SRVW0_SSO0_SVW2_SK0_SKFTR0_SKXCCM0_SGRO0_TIN0_TLDS0_TLDSM1_ULSGRO0_USL1_UIOFGRO0_USFGROn1_VSn1_VWA2_VWB1_WSGRA0_WSGRB0_WS32_WG32_4_1_WGM8_WGMXCC1_WGMXCCGn1
    SolutionIndex: 161
    SolutionNameMin: Cijk_Ailk_Bjlk_B8F8B8S_BH_Bias_SHB_HA_S_SAB_SCD_SAV_UserArgs_MT64x64x64_MI16x16x1_SN_LDSB0_AFC1_AG0_AFEM1_AFEM1_ASEM1_CLR1_CADS0_DTLA0_DTLB0_DTVA0_DTVB1_DTVSM0_DPLBn1_EPS1_ELFLR0_EMLLn1_FDSI0_GRPM1_GRVWA8_GRVWB8_GSU1_GSUAMB_GSUC0_GSUWGMRR0_GLS0_ISA1201_IU1_K1_LDSTI0_LBSPPA512_LBSPPB0_LBSPPM0_LPA32_LPB0_LPM0_LRVW8_LWPMn1_MIAV1_MIWT2_2_MO40_MGRIPMn1_NTn1_NTA0_NTB0_NTC0_NTD0_NTM0_NEPBS0_NLCA1_NLCB4_ONLL0_PGR1_PLR1_PKA0_SGROBn1_SIA3_SS1_SU32_SUM0_SUS256_SPO0_SRVW0_SSO0_SVW2_SK0_SKFTR0_SKXCCM0_SGRO0_TIN0_TLDS0_TLDSM1_ULSGRO0_USL1_UIOFGRO0_USFGROn1_VSn1_VWA2_VWB1_WSGRA0_WSGRB0_WS32_WG32_4_1_WGM8_WGMXCC1_WGMXCCGn1
    SolutionIndex: 162
    SolutionNameMin: Cijk_Ailk_Bjlk_B8F8B8S_BH_Bias_SHB_HA_S_SAB_SCD_SAV_UserArgs_MT128x64x32_MI16x16x1_SN_LDSB0_AFC1_AG0_AFEM1_AFEM1_ASEM1_CLR1_CADS0_DTLA0_DTLB0_DTVA1_DTVB0_DTVSM0_DPLBn1_EPS0_ELFLR0_EMLLn1_FDSI0_GRPM1_GRVWA8_GRVWB8_GSU1_GSUAMB_GSUC0_GSUWGMRR0_GLS0_ISA1201_IU1_K1_LDSTI0_LBSPPA0_LBSPPB512_LBSPPM0_LPA0_LPB16_LPM0_LRVW8_LWPMn1_MIAV1_MIWT8_1_MO40_MGRIPMn1_NTn1_NTA0_NTB0_NTC0_NTD0_NTM0_NEPBS0_NLCA2_NLCB1_ONLL0_PGR2_PLR1_PKA0_SGROBn1_SIA3_SS0_SU32_SUM0_SUS256_SPO0_SRVW0_SSO0_SVW8_SK0_SKFTR0_SKXCCM0_SGRO0_TIN0_TLDS0_TLDSM1_ULSGRO0_USL1_UIOFGRO0_USFGROn1_VSn1_VWA1_VWB1_WSGRA0_WSGRB0_WS32_WG16_8_1_WGM8_WGMXCC1_WGMXCCGn1
    SolutionIndex: 163
    SolutionNameMin: Cijk_Ailk_Bjlk_B8F8B8S_BH_Bias_SHB_HA_S_SAB_SCD_SAV_UserArgs_MT32x128x64_MI16x16x1_SN_LDSB0_AFC1_AG0_AFEM1_AFEM1_ASEM1_CLR1_CADS0_DTLA0_DTLB0_DTVA0_DTVB1_DTVSM0_DPLBn1_EPS1_ELFLR0_EMLLn1_FDSI0_GRPM1_GRVWA1_GRVWB8_GSU1_GSUAMB_GSUC0_GSUWGMRR0_GLS0_ISA1201_IU1_K1_LDSTI0_LBSPPA256_LBSPPB0_LBSPPM0_LPA16_LPB0_LPM0_LRVW8_LWPMn1_MIAV1_MIWT1_4_MO40_MGRIPMn1_NTn1_NTA0_NTB0_NTC0_NTD0_NTM0_NEPBS0_NLCA1_NLCB4_ONLL0_PGR1_PLR1_PKA0_SGROBn1_SIA3_SS0_SU32_SUM0_SUS256_SPO0_SRVW0_SSO0_SVW8_SK0_SKFTR0_SKXCCM0_SGRO0_TIN0_TLDS0_TLDSM1_ULSGRO0_USL1_UIOFGRO0_USFGROn1_VSn1_VWA1_VWB1_WSGRA0_WSGRB0_WS32_WG32_4_1_WGM8_WGMXCC1_WGMXCCGn1
    SolutionIndex: 164
    SolutionNameMin: Cijk_Ailk_Bjlk_B8F8B8S_BH_Bias_SHB_HA_S_SAB_SCD_SAV_UserArgs_MT16x256x32_MI16x16x1_SN_LDSB0_AFC1_AG0_AFEM1_AFEM1_ASEM1_CLR1_CADS0_DTLA0_DTLB0_DTVA0_DTVB1_DTVSM0_DPLBn1_EPS1_ELFLR0_EMLLn1_FDSI0_GRPM1_GRVWA8_GRVWB8_GSU1_GSUAMB_GSUC0_GSUWGMRR0_GLS0_ISA1201_IU1_K1_LDSTI0_LBSPPA128_LBSPPB0_LBSPPM0_LPA16_LPB0_LPM0_LRVW8_LWPMn1_MIAV1_MIWT1_8_MO40_MGRIPMn1_NTn1_NTA0_NTB0_NTC0_NTD0_NTM0_NEPBS0_NLCA1_NLCB2_ONLL0_PGR1_PLR1_PKA0_SGROBn1_SIA3_SS0_SU32_SUM0_SUS256_SPO0_SRVW0_SSO0_SVW8_SK0_SKFTR0_SKXCCM0_SGRO0_TIN0_TLDS0_TLDSM1_ULSGRO0_USL1_UIOFGRO0_USFGROn1_VSn1_VWA1_VWB1_WSGRA0_WSGRB0_WS32_WG16_4_1_WGM8_WGMXCC1_WGMXCCGn1
    SolutionIndex: 165
    SolutionNameMin: Cijk_Ailk_Bjlk_B8F8B8S_BH_Bias_SHB_HA_S_SAB_SCD_SAV_UserArgs_MT16x512x16_MI16x16x1_SN_LDSB0_AFC1_AG0_AFEM1_AFEM1_ASEM1_CLR1_CADS0_DTLA0_DTLB0_DTVA1_DTVB1_DTVSM0_DPLBn1_EPS0_ELFLR0_EMLLn1_FDSI0_GRPM1_GRVWA8_GRVWB8_GSU1_GSUAMB_GSUC0_GSUWGMRR0_GLS0_ISA1201_IU1_K1_LDSTI0_LBSPPA0_LBSPPB0_LBSPPM0_LPA0_LPB0_LPM0_LRVW8_LWPMn1_MIAV1_MIWT1_8_MO40_MGRIPMn1_NTn1_NTA0_NTB0_NTC0_NTD0_NTM0_NEPBS0_NLCA1_NLCB1_ONLL0_PGR1_PLR0_PKA0_SGROBn1_SIA3_SS0_SU32_SUM0_SUS256_SPO0_SRVW0_SSO0_SVW8_SK0_SKFTR0_SKXCCM0_SGRO0_TIN0_TLDS0_TLDSM1_ULSGRO0_USL1_UIOFGRO0_USFGROn1_VSn1_VWA1_VWB1_WSGRA0_WSGRB0_WS32_WG16_8_1_WGM8_WGMXCC1_WGMXCCGn1
    SolutionIndex: 166
    SolutionNameMin: Cijk_Ailk_Bjlk_B8F8B8S_BH_Bias_SHB_HA_S_SAB_SCD_SAV_UserArgs_MT128x64x64_MI16x16x1_SN_LDSB0_AFC1_AG0_AFEM1_AFEM1_ASEM1_CLR1_CADS0_DTLA0_DTLB0_DTVA1_DTVB1_DTVSM0_DPLBn1_EPS0_ELFLR0_EMLLn1_FDSI0_GRPM1_GRVWA8_GRVWB8_GSU1_GSUAMB_GSUC0_GSUWGMRR0_GLS0_ISA1201_IU1_K1_LDSTI0_LBSPPA0_LBSPPB0_LBSPPM0_LPA0_LPB0_LPM0_LRVW8_LWPMn1_MIAV1_MIWT8_1_MO40_MGRIPMn1_NTn1_NTA0_NTB0_NTC0_NTD0_NTM0_NEPBS0_NLCA4_NLCB1_ONLL0_PGR1_PLR0_PKA0_SGROBn1_SIA3_SS0_SU32_SUM0_SUS256_SPO0_SRVW0_SSO0_SVW8_SK0_SKFTR0_SKXCCM0_SGRO0_TIN0_TLDS0_TLDSM1_ULSGRO0_USL1_UIOFGRO0_USFGROn1_VSn1_VWA1_VWB1_WSGRA0_WSGRB0_WS32_WG16_8_1_WGM8_WGMXCC1_WGMXCCGn1
    SolutionIndex: 167
    SolutionNameMin: Cijk_Ailk_Bjlk_B8F8B8S_BH_Bias_SHB_HA_S_SAB_SCD_SAV_UserArgs_MT32x128x64_MI16x16x1_SN_LDSB0_AFC1_AG0_AFEM1_AFEM1_ASEM1_CLR1_CADS0_DTLA0_DTLB0_DTVA0_DTVB1_DTVSM0_DPLBn1_EPS0_ELFLR0_EMLLn1_FDSI0_GRPM1_GRVWA1_GRVWB8_GSU1_GSUAMB_GSUC0_GSUWGMRR0_GLS0_ISA1201_IU1_K1_LDSTI0_LBSPPA256_LBSPPB0_LBSPPM0_LPA16_LPB0_LPM0_LRVW8_LWPMn1_MIAV1_MIWT1_4_MO40_MGRIPMn1_NTn1_NTA0_NTB0_NTC0_NTD0_NTM0_NEPBS0_NLCA1_NLCB4_ONLL0_PGR2_PLR1_PKA0_SGROBn1_SIA3_SS0_SU32_SUM0_SUS256_SPO0_SRVW0_SSO0_SVW8_SK0_SKFTR0_SKXCCM0_SGRO0_TIN0_TLDS0_TLDSM1_ULSGRO0_USL1_UIOFGRO0_USFGROn1_VSn1_VWA1_VWB1_WSGRA0_WSGRB0_WS32_WG32_4_1_WGM8_WGMXCC1_WGMXCCGn1
    SolutionIndex: 168
    SolutionNameMin: Cijk_Ailk_Bjlk_B8F8B8S_BH_Bias_SHB_HA_S_SAB_SCD_SAV_UserArgs_MT32x32x128_MI16x16x1_SN_LDSB0_AFC1_AG0_AFEM1_AFEM1_ASEM1_CLR1_CADS0_DTLA0_DTLB0_DTVA0_DTVB1_DTVSM0_DPLBn1_EPS1_ELFLR0_EMLLn1_FDSI0_GRPM1_GRVWA4_GRVWB8_GSU1_GSUAMB_GSUC0_GSUWGMRR0_GLS0_ISA1201_IU1_K1_LDSTI0_LBSPPA256_LBSPPB0_LBSPPM0_LPA16_LPB0_LPM0_LRVW8_LWPMn1_MIAV1_MIWT1_1_MO40_MGRIPMn1_NTn1_NTA0_NTB0_NTC0_NTD0_NTM0_NEPBS0_NLCA1_NLCB1_ONLL0_PGR1_PLR1_PKA0_SGROBn1_SIA3_SS0_SU32_SUM0_SUS256_SPO0_SRVW0_SSO0_SVW8_SK0_SKFTR0_SKXCCM0_SGRO0_TIN0_TLDS0_TLDSM1_ULSGRO0_USL1_UIOFGRO0_USFGROn1_VSn1_VWA1_VWB1_WSGRA0_WSGRB0_WS32_WG32_4_1_WGM8_WGMXCC1_WGMXCCGn1
    SolutionIndex: 169
    SolutionNameMin: Cijk_Ailk_Bjlk_B8F8B8S_BH_Bias_SHB_HA_S_SAB_SCD_SAV_UserArgs_MT32x32x128_MI16x16x1_SN_LDSB0_AFC1_AG0_AFEM1_AFEM1_ASEM1_CLR1_CADS0_DTLA0_DTLB0_DTVA0_DTVB1_DTVSM0_DPLBn1_EPS1_ELFLR0_EMLLn1_FDSI0_GRPM1_GRVWA16_GRVWB8_GSU1_GSUAMB_GSUC0_GSUWGMRR0_GLS0_ISA1201_IU1_K1_LDSTI0_LBSPPA256_LBSPPB0_LBSPPM0_LPA16_LPB0_LPM0_LRVW8_LWPMn1_MIAV1_MIWT1_1_MO40_MGRIPMn1_NTn1_NTA0_NTB0_NTC0_NTD0_NTM0_NEPBS0_NLCA1_NLCB1_ONLL0_PGR1_PLR1_PKA0_SGROBn1_SIA3_SS1_SU32_SUM0_SUS256_SPO0_SRVW0_SSO0_SVW1_SK0_SKFTR0_SKXCCM0_SGRO0_TIN0_TLDS0_TLDSM1_ULSGRO0_USL1_UIOFGRO0_USFGROn1_VSn1_VWA1_VWB1_WSGRA0_WSGRB0_WS32_WG32_4_1_WGM8_WGMXCC1_WGMXCCGn1
    SolutionIndex: 170
    SolutionNameMin: Cijk_Ailk_Bjlk_B8F8B8S_BH_Bias_SHB_HA_S_SAB_SCD_SAV_UserArgs_MT32x32x128_MI16x16x1_SN_LDSB0_AFC1_AG0_AFEM1_AFEM1_ASEM1_CLR1_CADS0_DTLA0_DTLB0_DTVA0_DTVB1_DTVSM0_DPLBn1_EPS1_ELFLR0_EMLLn1_FDSI0_GRPM1_GRVWA16_GRVWB8_GSU1_GSUAMB_GSUC0_GSUWGMRR0_GLS0_ISA1201_IU1_K1_LDSTI0_LBSPPA256_LBSPPB0_LBSPPM0_LPA16_LPB0_LPM0_LRVW8_LWPMn1_MIAV1_MIWT1_1_MO40_MGRIPMn1_NTn1_NTA0_NTB0_NTC0_NTD0_NTM0_NEPBS0_NLCA1_NLCB1_ONLL0_PGR1_PLR1_PKA0_SGROBn1_SIA3_SS0_SU32_SUM0_SUS256_SPO0_SRVW0_SSO0_SVW8_SK0_SKFTR0_SKXCCM0_SGRO0_TIN0_TLDS0_TLDSM1_ULSGRO0_USL1_UIOFGRO0_USFGROn1_VSn1_VWA1_VWB1_WSGRA0_WSGRB0_WS32_WG32_4_1_WGM8_WGMXCC1_WGMXCCGn1
    SolutionIndex: 171
    SolutionNameMin: Cijk_Ailk_Bjlk_B8F8B8S_BH_Bias_SHB_HA_S_SAB_SCD_SAV_UserArgs_MT32x32x64_MI16x16x1_SN_LDSB0_AFC1_AG0_AFEM1_AFEM1_ASEM1_CLR1_CADS0_DTLA0_DTLB0_DTVA1_DTVB0_DTVSM0_DPLBn1_EPS0_ELFLR0_EMLLn1_FDSI0_GRPM1_GRVWA8_GRVWB4_GSU1_GSUAMB_GSUC0_GSUWGMRR0_GLS0_ISA1201_IU1_K1_LDSTI0_LBSPPA0_LBSPPB256_LBSPPM0_LPA0_LPB16_LPM0_LRVW8_LWPMn1_MIAV1_MIWT1_1_MO40_MGRIPMn1_NTn1_NTA0_NTB0_NTC0_NTD0_NTM0_NEPBS0_NLCA1_NLCB1_ONLL0_PGR2_PLR1_PKA0_SGROBn1_SIA3_SS0_SU32_SUM0_SUS256_SPO0_SRVW0_SSO0_SVW8_SK0_SKFTR0_SKXCCM0_SGRO0_TIN0_TLDS0_TLDSM1_ULSGRO0_USL1_UIOFGRO0_USFGROn1_VSn1_VWA1_VWB1_WSGRA0_WSGRB0_WS32_WG32_4_1_WGM8_WGMXCC1_WGMXCCGn1
    SolutionIndex: 172
    SolutionNameMin: Cijk_Ailk_Bjlk_B8F8B8S_BH_Bias_SHB_HA_S_SAB_SCD_SAV_UserArgs_MT32x32x64_MI16x16x1_SN_LDSB0_AFC1_AG0_AFEM1_AFEM1_ASEM1_CLR1_CADS0_DTLA0_DTLB0_DTVA1_DTVB0_DTVSM0_DPLBn1_EPS0_ELFLR0_EMLLn1_FDSI0_GRPM1_GRVWA8_GRVWB8_GSU1_GSUAMB_GSUC0_GSUWGMRR0_GLS0_ISA1201_IU1_K1_LDSTI0_LBSPPA0_LBSPPB256_LBSPPM0_LPA0_LPB16_LPM0_LRVW8_LWPMn1_MIAV1_MIWT1_1_MO40_MGRIPMn1_NTn1_NTA0_NTB0_NTC0_NTD0_NTM0_NEPBS0_NLCA1_NLCB1_ONLL0_PGR2_PLR1_PKA0_SGROBn1_SIA3_SS0_SU32_SUM0_SUS256_SPO0_SRVW0_SSO0_SVW8_SK0_SKFTR0_SKXCCM0_SGRO0_TIN0_TLDS0_TLDSM1_ULSGRO0_USL1_UIOFGRO0_USFGROn1_VSn1_VWA1_VWB1_WSGRA0_WSGRB0_WS32_WG32_4_1_WGM8_WGMXCC1_WGMXCCGn1
    SolutionIndex: 173
    SolutionNameMin: Cijk_Ailk_Bjlk_B8F8B8S_BH_Bias_SHB_HA_S_SAB_SCD_SAV_UserArgs_MT32x32x128_MI16x16x1_SN_LDSB0_AFC1_AG0_AFEM1_AFEM1_ASEM1_CLR1_CADS0_DTLA0_DTLB0_DTVA0_DTVB1_DTVSM0_DPLBn1_EPS0_ELFLR0_EMLLn1_FDSI0_GRPM1_GRVWA4_GRVWB8_GSU1_GSUAMB_GSUC0_GSUWGMRR0_GLS0_ISA1201_IU1_K1_LDSTI0_LBSPPA256_LBSPPB0_LBSPPM0_LPA16_LPB0_LPM0_LRVW8_LWPMn1_MIAV1_MIWT1_1_MO40_MGRIPMn1_NTn1_NTA0_NTB0_NTC0_NTD0_NTM0_NEPBS0_NLCA1_NLCB1_ONLL0_PGR2_PLR1_PKA0_SGROBn1_SIA3_SS0_SU32_SUM0_SUS256_SPO0_SRVW0_SSO0_SVW8_SK0_SKFTR0_SKXCCM0_SGRO0_TIN0_TLDS0_TLDSM1_ULSGRO0_USL1_UIOFGRO0_USFGROn1_VSn1_VWA1_VWB1_WSGRA0_WSGRB0_WS32_WG32_4_1_WGM8_WGMXCC1_WGMXCCGn1
    SolutionIndex: 174
    SolutionNameMin: Cijk_Ailk_Bjlk_B8F8B8S_BH_Bias_SHB_HA_S_SAB_SCD_SAV_UserArgs_MT32x32x64_MI16x16x1_SN_LDSB0_AFC1_AG0_AFEM1_AFEM1_ASEM1_CLR1_CADS0_DTLA0_DTLB0_DTVA0_DTVB1_DTVSM0_DPLBn1_EPS0_ELFLR0_EMLLn1_FDSI0_GRPM1_GRVWA16_GRVWB8_GSU1_GSUAMB_GSUC0_GSUWGMRR0_GLS0_ISA1201_IU1_K1_LDSTI0_LBSPPA256_LBSPPB0_LBSPPM0_LPA16_LPB0_LPM0_LRVW8_LWPMn1_MIAV1_MIWT1_1_MO40_MGRIPMn1_NTn1_NTA0_NTB0_NTC0_NTD0_NTM0_NEPBS0_NLCA1_NLCB1_ONLL0_PGR2_PLR1_PKA0_SGROBn1_SIA3_SS1_SU32_SUM0_SUS256_SPO0_SRVW0_SSO0_SVW1_SK0_SKFTR0_SKXCCM0_SGRO0_TIN0_TLDS0_TLDSM1_ULSGRO0_USL1_UIOFGRO0_USFGROn1_VSn1_VWA1_VWB1_WSGRA0_WSGRB0_WS32_WG32_4_1_WGM8_WGMXCC1_WGMXCCGn1
    SolutionIndex: 175
    SolutionNameMin: Cijk_Ailk_Bjlk_B8F8B8S_BH_Bias_SHB_HA_S_SAB_SCD_SAV_UserArgs_MT32x32x128_MI16x16x1_SN_LDSB0_AFC1_AG0_AFEM1_AFEM1_ASEM1_CLR1_CADS0_DTLA0_DTLB0_DTVA0_DTVB1_DTVSM0_DPLBn1_EPS0_ELFLR0_EMLLn1_FDSI0_GRPM1_GRVWA8_GRVWB8_GSU1_GSUAMB_GSUC0_GSUWGMRR0_GLS0_ISA1201_IU1_K1_LDSTI0_LBSPPA256_LBSPPB0_LBSPPM0_LPA16_LPB0_LPM0_LRVW8_LWPMn1_MIAV1_MIWT1_1_MO40_MGRIPMn1_NTn1_NTA0_NTB0_NTC0_NTD0_NTM0_NEPBS0_NLCA1_NLCB1_ONLL0_PGR2_PLR1_PKA0_SGROBn1_SIA3_SS0_SU32_SUM0_SUS256_SPO0_SRVW0_SSO0_SVW8_SK0_SKFTR0_SKXCCM0_SGRO0_TIN0_TLDS0_TLDSM1_ULSGRO0_USL1_UIOFGRO0_USFGROn1_VSn1_VWA1_VWB1_WSGRA0_WSGRB0_WS32_WG32_4_1_WGM8_WGMXCC1_WGMXCCGn1
    SolutionIndex: 176
    SolutionNameMin: Cijk_Ailk_Bjlk_B8F8B8S_BH_Bias_SHB_HA_S_SAB_SCD_SAV_UserArgs_MT32x32x64_MI16x16x1_SN_LDSB0_AFC1_AG0_AFEM1_AFEM1_ASEM1_CLR1_CADS0_DTLA0_DTLB0_DTVA1_DTVB0_DTVSM0_DPLBn1_EPS0_ELFLR0_EMLLn1_FDSI0_GRPM1_GRVWA8_GRVWB16_GSU1_GSUAMB_GSUC0_GSUWGMRR0_GLS0_ISA1201_IU1_K1_LDSTI0_LBSPPA0_LBSPPB256_LBSPPM0_LPA0_LPB16_LPM0_LRVW8_LWPMn1_MIAV1_MIWT1_1_MO40_MGRIPMn1_NTn1_NTA0_NTB0_NTC0_NTD0_NTM0_NEPBS0_NLCA1_NLCB1_ONLL0_PGR2_PLR1_PKA0_SGROBn1_SIA3_SS0_SU32_SUM0_SUS256_SPO0_SRVW0_SSO0_SVW8_SK0_SKFTR0_SKXCCM0_SGRO0_TIN0_TLDS0_TLDSM1_ULSGRO0_USL1_UIOFGRO0_USFGROn1_VSn1_VWA1_VWB1_WSGRA0_WSGRB0_WS32_WG32_4_1_WGM8_WGMXCC1_WGMXCCGn1
    SolutionIndex: 177
    SolutionNameMin: Cijk_Ailk_Bjlk_B8F8B8S_BH_Bias_SHB_HA_S_SAB_SCD_SAV_UserArgs_MT32x32x128_MI16x16x1_SN_LDSB0_AFC1_AG0_AFEM1_AFEM1_ASEM1_CLR1_CADS0_DTLA0_DTLB0_DTVA1_DTVB0_DTVSM0_DPLBn1_EPS1_ELFLR0_EMLLn1_FDSI0_GRPM1_GRVWA8_GRVWB4_GSU1_GSUAMB_GSUC0_GSUWGMRR0_GLS0_ISA1201_IU1_K1_LDSTI0_LBSPPA0_LBSPPB256_LBSPPM0_LPA0_LPB16_LPM0_LRVW8_LWPMn1_MIAV1_MIWT1_1_MO40_MGRIPMn1_NTn1_NTA0_NTB0_NTC0_NTD0_NTM0_NEPBS0_NLCA1_NLCB1_ONLL0_PGR1_PLR1_PKA0_SGROBn1_SIA3_SS0_SU32_SUM0_SUS256_SPO0_SRVW0_SSO0_SVW8_SK0_SKFTR0_SKXCCM0_SGRO0_TIN0_TLDS0_TLDSM1_ULSGRO0_USL1_UIOFGRO0_USFGROn1_VSn1_VWA1_VWB1_WSGRA0_WSGRB0_WS32_WG32_4_1_WGM8_WGMXCC1_WGMXCCGn1
    SolutionIndex: 178
    SolutionNameMin: Cijk_Ailk_Bjlk_B8F8B8S_BH_Bias_SHB_HA_S_SAB_SCD_SAV_UserArgs_MT32x32x128_MI16x16x1_SN_LDSB0_AFC1_AG0_AFEM1_AFEM1_ASEM1_CLR1_CADS0_DTLA0_DTLB0_DTVA0_DTVB1_DTVSM0_DPLBn1_EPS0_ELFLR0_EMLLn1_FDSI0_GRPM1_GRVWA8_GRVWB8_GSU1_GSUAMB_GSUC0_GSUWGMRR0_GLS0_ISA1201_IU1_K1_LDSTI0_LBSPPA256_LBSPPB0_LBSPPM0_LPA16_LPB0_LPM0_LRVW8_LWPMn1_MIAV1_MIWT1_1_MO40_MGRIPMn1_NTn1_NTA0_NTB0_NTC0_NTD0_NTM0_NEPBS0_NLCA1_NLCB1_ONLL0_PGR2_PLR1_PKA0_SGROBn1_SIA3_SS1_SU32_SUM0_SUS256_SPO0_SRVW0_SSO0_SVW1_SK0_SKFTR0_SKXCCM0_SGRO0_TIN0_TLDS0_TLDSM1_ULSGRO0_USL1_UIOFGRO0_USFGROn1_VSn1_VWA1_VWB1_WSGRA0_WSGRB0_WS32_WG32_4_1_WGM8_WGMXCC1_WGMXCCGn1
    SolutionIndex: 179
    SolutionNameMin: Cijk_Ailk_Bjlk_B8F8B8S_BH_Bias_SHB_HA_S_SAB_SCD_SAV_UserArgs_MT32x32x128_MI16x16x1_SN_LDSB0_AFC1_AG0_AFEM1_AFEM1_ASEM1_CLR1_CADS0_DTLA0_DTLB0_DTVA0_DTVB1_DTVSM0_DPLBn1_EPS0_ELFLR0_EMLLn1_FDSI0_GRPM1_GRVWA16_GRVWB8_GSU1_GSUAMB_GSUC0_GSUWGMRR0_GLS0_ISA1201_IU1_K1_LDSTI0_LBSPPA256_LBSPPB0_LBSPPM0_LPA16_LPB0_LPM0_LRVW8_LWPMn1_MIAV1_MIWT1_1_MO40_MGRIPMn1_NTn1_NTA0_NTB0_NTC0_NTD0_NTM0_NEPBS0_NLCA1_NLCB1_ONLL0_PGR2_PLR1_PKA0_SGROBn1_SIA3_SS0_SU32_SUM0_SUS256_SPO0_SRVW0_SSO0_SVW8_SK0_SKFTR0_SKXCCM0_SGRO0_TIN0_TLDS0_TLDSM1_ULSGRO0_USL1_UIOFGRO0_USFGROn1_VSn1_VWA1_VWB1_WSGRA0_WSGRB0_WS32_WG32_4_1_WGM8_WGMXCC1_WGMXCCGn1
    SolutionIndex: 180
    SolutionNameMin: Cijk_Ailk_Bjlk_B8F8B8S_BH_Bias_SHB_HA_S_SAB_SCD_SAV_UserArgs_MT32x32x128_MI16x16x1_SN_LDSB0_AFC1_AG0_AFEM1_AFEM1_ASEM1_CLR1_CADS0_DTLA0_DTLB0_DTVA1_DTVB0_DTVSM0_DPLBn1_EPS1_ELFLR0_EMLLn1_FDSI0_GRPM1_GRVWA8_GRVWB16_GSU1_GSUAMB_GSUC0_GSUWGMRR0_GLS0_ISA1201_IU1_K1_LDSTI0_LBSPPA0_LBSPPB256_LBSPPM0_LPA0_LPB16_LPM0_LRVW8_LWPMn1_MIAV1_MIWT1_1_MO40_MGRIPMn1_NTn1_NTA0_NTB0_NTC0_NTD0_NTM0_NEPBS0_NLCA1_NLCB1_ONLL0_PGR1_PLR1_PKA0_SGROBn1_SIA3_SS1_SU32_SUM0_SUS256_SPO0_SRVW0_SSO0_SVW1_SK0_SKFTR0_SKXCCM0_SGRO0_TIN0_TLDS0_TLDSM1_ULSGRO0_USL1_UIOFGRO0_USFGROn1_VSn1_VWA1_VWB1_WSGRA0_WSGRB0_WS32_WG32_4_1_WGM8_WGMXCC1_WGMXCCGn1
    SolutionIndex: 181
    SolutionNameMin: Cijk_Ailk_Bjlk_B8F8B8S_BH_Bias_SHB_HA_S_SAB_SCD_SAV_UserArgs_MT64x64x32_MI16x16x1_SN_LDSB0_AFC1_AG0_AFEM1_AFEM1_ASEM1_CLR1_CADS0_DTLA0_DTLB0_DTVA1_DTVB1_DTVSM0_DPLBn1_EPS0_ELFLR0_EMLLn1_FDSI0_GRPM1_GRVWA8_GRVWB8_GSU1_GSUAMB_GSUC0_GSUWGMRR0_GLS0_ISA1201_IU1_K1_LDSTI0_LBSPPA0_LBSPPB0_LBSPPM0_LPA0_LPB0_LPM0_LRVW8_LWPMn1_MIAV1_MIWT2_2_MO40_MGRIPMn1_NTn1_NTA0_NTB0_NTC0_NTD0_NTM0_NEPBS0_NLCA2_NLCB2_ONLL0_PGR1_PLR0_PKA0_SGROBn1_SIA3_SS1_SU32_SUM0_SUS256_SPO0_SRVW0_SSO0_SVW1_SK0_SKFTR0_SKXCCM0_SGRO0_TIN0_TLDS0_TLDSM1_ULSGRO0_USL1_UIOFGRO0_USFGROn1_VSn1_VWA1_VWB1_WSGRA0_WSGRB0_WS32_WG32_4_1_WGM8_WGMXCC1_WGMXCCGn1
    SolutionIndex: 182
    SolutionNameMin: Cijk_Ailk_Bjlk_B8F8B8S_BH_Bias_SHB_HA_S_SAB_SCD_SAV_UserArgs_MT256x16x32_MI16x16x1_SN_LDSB0_AFC1_AG0_AFEM1_AFEM1_ASEM1_CLR1_CADS0_DTLA0_DTLB0_DTVA1_DTVB0_DTVSM0_DPLBn1_EPS1_ELFLR0_EMLLn1_FDSI0_GRPM1_GRVWA8_GRVWB8_GSU1_GSUAMB_GSUC0_GSUWGMRR0_GLS0_ISA1201_IU1_K1_LDSTI0_LBSPPA0_LBSPPB128_LBSPPM0_LPA0_LPB16_LPM0_LRVW8_LWPMn1_MIAV1_MIWT8_1_MO40_MGRIPMn1_NTn1_NTA0_NTB0_NTC0_NTD0_NTM0_NEPBS0_NLCA2_NLCB1_ONLL0_PGR1_PLR1_PKA0_SGROBn1_SIA3_SS0_SU32_SUM0_SUS256_SPO0_SRVW0_SSO0_SVW8_SK0_SKFTR0_SKXCCM0_SGRO0_TIN0_TLDS0_TLDSM1_ULSGRO0_USL1_UIOFGRO0_USFGROn1_VSn1_VWA1_VWB1_WSGRA0_WSGRB0_WS32_WG32_2_1_WGM8_WGMXCC1_WGMXCCGn1
    SolutionIndex: 183
    SolutionNameMin: Cijk_Ailk_Bjlk_B8F8B8S_BH_Bias_SHB_HA_S_SAB_SCD_SAV_UserArgs_MT512x16x32_MI16x16x1_SN_LDSB0_AFC1_AG0_AFEM1_AFEM1_ASEM1_CLR1_CADS0_DTLA0_DTLB0_DTVA1_DTVB0_DTVSM0_DPLBn1_EPS1_ELFLR0_EMLLn1_FDSI0_GRPM1_GRVWA8_GRVWB4_GSU1_GSUAMB_GSUC0_GSUWGMRR0_GLS0_ISA1201_IU1_K1_LDSTI0_LBSPPA0_LBSPPB128_LBSPPM0_LPA0_LPB16_LPM0_LRVW8_LWPMn1_MIAV1_MIWT8_1_MO40_MGRIPMn1_NTn1_NTA0_NTB0_NTC0_NTD0_NTM0_NEPBS0_NLCA2_NLCB1_ONLL0_PGR1_PLR1_PKA0_SGROBn1_SIA3_SS0_SU32_SUM0_SUS256_SPO0_SRVW0_SSO0_SVW8_SK0_SKFTR0_SKXCCM0_SGRO0_TIN0_TLDS0_TLDSM1_ULSGRO0_USL1_UIOFGRO0_USFGROn1_VSn1_VWA1_VWB1_WSGRA0_WSGRB0_WS32_WG64_2_1_WGM8_WGMXCC1_WGMXCCGn1
    SolutionIndex: 184
    SolutionNameMin: Cijk_Ailk_Bjlk_B8F8B8S_BH_Bias_SHB_HA_S_SAB_SCD_SAV_UserArgs_MT128x32x32_MI16x16x1_SN_LDSB0_AFC1_AG0_AFEM1_AFEM1_ASEM1_CLR1_CADS0_DTLA0_DTLB0_DTVA1_DTVB0_DTVSM0_DPLBn1_EPS0_ELFLR0_EMLLn1_FDSI0_GRPM1_GRVWA8_GRVWB8_GSU1_GSUAMB_GSUC0_GSUWGMRR0_GLS0_ISA1201_IU1_K1_LDSTI0_LBSPPA0_LBSPPB256_LBSPPM0_LPA0_LPB16_LPM0_LRVW8_LWPMn1_MIAV1_MIWT4_1_MO40_MGRIPMn1_NTn1_NTA0_NTB0_NTC0_NTD0_NTM0_NEPBS0_NLCA2_NLCB1_ONLL0_PGR2_PLR1_PKA0_SGROBn1_SIA3_SS0_SU32_SUM0_SUS256_SPO0_SRVW0_SSO0_SVW8_SK0_SKFTR0_SKXCCM0_SGRO0_TIN0_TLDS0_TLDSM1_ULSGRO0_USL1_UIOFGRO0_USFGROn1_VSn1_VWA1_VWB1_WSGRA0_WSGRB0_WS32_WG32_4_1_WGM8_WGMXCC1_WGMXCCGn1
    SolutionIndex: 185
    SolutionNameMin: Cijk_Ailk_Bjlk_B8F8B8S_BH_Bias_SHB_HA_S_SAB_SCD_SAV_UserArgs_MT32x32x128_MI16x16x1_SN_LDSB0_AFC1_AG0_AFEM1_AFEM1_ASEM1_CLR1_CADS0_DTLA0_DTLB0_DTVA1_DTVB0_DTVSM0_DPLBn1_EPS0_ELFLR0_EMLLn1_FDSI0_GRPM1_GRVWA8_GRVWB16_GSU1_GSUAMB_GSUC0_GSUWGMRR0_GLS0_ISA1201_IU1_K1_LDSTI0_LBSPPA0_LBSPPB256_LBSPPM0_LPA0_LPB16_LPM0_LRVW8_LWPMn1_MIAV1_MIWT1_1_MO40_MGRIPMn1_NTn1_NTA0_NTB0_NTC0_NTD0_NTM0_NEPBS0_NLCA1_NLCB1_ONLL0_PGR2_PLR1_PKA0_SGROBn1_SIA3_SS0_SU32_SUM0_SUS256_SPO0_SRVW0_SSO0_SVW8_SK0_SKFTR0_SKXCCM0_SGRO0_TIN0_TLDS0_TLDSM1_ULSGRO0_USL1_UIOFGRO0_USFGROn1_VSn1_VWA1_VWB1_WSGRA0_WSGRB0_WS32_WG32_4_1_WGM8_WGMXCC1_WGMXCCGn1
    SolutionIndex: 186
    SolutionNameMin: Cijk_Ailk_Bjlk_B8F8B8S_BH_Bias_SHB_HA_S_SAB_SCD_SAV_UserArgs_MT128x32x64_MI16x16x1_SN_LDSB0_AFC1_AG0_AFEM1_AFEM1_ASEM1_CLR1_CADS0_DTLA0_DTLB0_DTVA1_DTVB0_DTVSM0_DPLBn1_EPS0_ELFLR0_EMLLn1_FDSI0_GRPM1_GRVWA8_GRVWB8_GSU1_GSUAMB_GSUC0_GSUWGMRR0_GLS0_ISA1201_IU1_K1_LDSTI0_LBSPPA0_LBSPPB256_LBSPPM0_LPA0_LPB16_LPM0_LRVW8_LWPMn1_MIAV1_MIWT4_1_MO40_MGRIPMn1_NTn1_NTA0_NTB0_NTC0_NTD0_NTM0_NEPBS0_NLCA4_NLCB1_ONLL0_PGR2_PLR1_PKA0_SGROBn1_SIA3_SS0_SU32_SUM0_SUS256_SPO0_SRVW0_SSO0_SVW8_SK0_SKFTR0_SKXCCM0_SGRO0_TIN0_TLDS0_TLDSM1_ULSGRO0_USL1_UIOFGRO0_USFGROn1_VSn1_VWA1_VWB1_WSGRA0_WSGRB0_WS32_WG32_4_1_WGM8_WGMXCC1_WGMXCCGn1
    SolutionIndex: 187
    SolutionNameMin: Cijk_Ailk_Bjlk_B8F8B8S_BH_Bias_SHB_HA_S_SAB_SCD_SAV_UserArgs_MT64x128x32_MI16x16x1_SN_LDSB0_AFC1_AG0_AFEM1_AFEM1_ASEM1_CLR1_CADS0_DTLA0_DTLB0_DTVA0_DTVB1_DTVSM0_DPLBn1_EPS1_ELFLR0_EMLLn1_FDSI0_GRPM1_GRVWA8_GRVWB8_GSU1_GSUAMB_GSUC0_GSUWGMRR0_GLS0_ISA1201_IU1_K1_LDSTI0_LBSPPA512_LBSPPB0_LBSPPM0_LPA16_LPB0_LPM0_LRVW8_LWPMn1_MIAV1_MIWT1_8_MO40_MGRIPMn1_NTn1_NTA0_NTB0_NTC0_NTD0_NTM0_NEPBS0_NLCA1_NLCB2_ONLL0_PGR1_PLR1_PKA0_SGROBn1_SIA3_SS0_SU32_SUM0_SUS256_SPO0_SRVW0_SSO0_SVW8_SK0_SKFTR0_SKXCCM0_SGRO0_TIN0_TLDS0_TLDSM1_ULSGRO0_USL1_UIOFGRO0_USFGROn1_VSn1_VWA1_VWB1_WSGRA0_WSGRB0_WS32_WG64_2_1_WGM8_WGMXCC1_WGMXCCGn1
    SolutionIndex: 188
    SolutionNameMin: Cijk_Ailk_Bjlk_B8F8B8S_BH_Bias_SHB_HA_S_SAB_SCD_SAV_UserArgs_MT128x32x64_MI16x16x1_SN_LDSB0_AFC1_AG0_AFEM1_AFEM1_ASEM1_CLR1_CADS0_DTLA0_DTLB0_DTVA1_DTVB0_DTVSM0_DPLBn1_EPS1_ELFLR0_EMLLn1_FDSI0_GRPM1_GRVWA8_GRVWB1_GSU1_GSUAMB_GSUC0_GSUWGMRR0_GLS0_ISA1201_IU1_K1_LDSTI0_LBSPPA0_LBSPPB256_LBSPPM0_LPA0_LPB16_LPM0_LRVW8_LWPMn1_MIAV1_MIWT4_1_MO40_MGRIPMn1_NTn1_NTA0_NTB0_NTC0_NTD0_NTM0_NEPBS0_NLCA4_NLCB1_ONLL0_PGR1_PLR1_PKA0_SGROBn1_SIA3_SS0_SU32_SUM0_SUS256_SPO0_SRVW0_SSO0_SVW8_SK0_SKFTR0_SKXCCM0_SGRO0_TIN0_TLDS0_TLDSM1_ULSGRO0_USL1_UIOFGRO0_USFGROn1_VSn1_VWA1_VWB1_WSGRA0_WSGRB0_WS32_WG32_4_1_WGM8_WGMXCC1_WGMXCCGn1
    SolutionIndex: 189
    SolutionNameMin: Cijk_Ailk_Bjlk_B8F8B8S_BH_Bias_SHB_HA_S_SAB_SCD_SAV_UserArgs_MT64x64x64_MI16x16x1_SN_LDSB0_AFC1_AG0_AFEM1_AFEM1_ASEM1_CLR1_CADS0_DTLA0_DTLB0_DTVA1_DTVB0_DTVSM0_DPLBn1_EPS1_ELFLR0_EMLLn1_FDSI0_GRPM1_GRVWA8_GRVWB4_GSU1_GSUAMB_GSUC0_GSUWGMRR0_GLS0_ISA1201_IU1_K1_LDSTI0_LBSPPA0_LBSPPB512_LBSPPM0_LPA0_LPB32_LPM0_LRVW8_LWPMn1_MIAV1_MIWT2_2_MO40_MGRIPMn1_NTn1_NTA0_NTB0_NTC0_NTD0_NTM0_NEPBS0_NLCA4_NLCB1_ONLL0_PGR1_PLR1_PKA0_SGROBn1_SIA3_SS0_SU32_SUM0_SUS256_SPO0_SRVW0_SSO0_SVW8_SK0_SKFTR0_SKXCCM0_SGRO0_TIN0_TLDS0_TLDSM1_ULSGRO0_USL1_UIOFGRO0_USFGROn1_VSn1_VWA1_VWB2_WSGRA0_WSGRB0_WS32_WG32_4_1_WGM8_WGMXCC1_WGMXCCGn1
    SolutionIndex: 190
    SolutionNameMin: Cijk_Ailk_Bjlk_B8F8B8S_BH_Bias_SHB_HA_S_SAB_SCD_SAV_UserArgs_MT128x128x16_MI16x16x1_SN_LDSB0_AFC1_AG0_AFEM1_AFEM1_ASEM1_CLR1_CADS0_DTLA0_DTLB0_DTVA1_DTVB1_DTVSM0_DPLBn1_EPS0_ELFLR0_EMLLn1_FDSI0_GRPM1_GRVWA8_GRVWB8_GSU1_GSUAMB_GSUC0_GSUWGMRR0_GLS0_ISA1201_IU1_K1_LDSTI0_LBSPPA0_LBSPPB0_LBSPPM0_LPA0_LPB0_LPM0_LRVW8_LWPMn1_MIAV1_MIWT4_4_MO40_MGRIPMn1_NTn1_NTA0_NTB0_NTC0_NTD0_NTM0_NEPBS0_NLCA1_NLCB1_ONLL0_PGR1_PLR0_PKA0_SGROBn1_SIA3_SS0_SU32_SUM0_SUS256_SPO0_SRVW0_SSO0_SVW8_SK0_SKFTR0_SKXCCM0_SGRO0_TIN0_TLDS0_TLDSM1_ULSGRO0_USL1_UIOFGRO0_USFGROn1_VSn1_VWA1_VWB1_WSGRA0_WSGRB0_WS32_WG32_4_1_WGM8_WGMXCC1_WGMXCCGn1
    SolutionIndex: 191
    SolutionNameMin: Cijk_Ailk_Bjlk_B8F8B8S_BH_Bias_SHB_HA_S_SAB_SCD_SAV_UserArgs_MT128x16x16_MI16x16x1_SN_LDSB0_AFC1_AG0_AFEM1_AFEM1_ASEM1_CLR1_CADS0_DTLA0_DTLB0_DTVA1_DTVB1_DTVSM0_DPLBn1_EPS0_ELFLR0_EMLLn1_FDSI0_GRPM1_GRVWA8_GRVWB8_GSU1_GSUAMB_GSUC0_GSUWGMRR0_GLS0_ISA1201_IU1_K1_LDSTI0_LBSPPA0_LBSPPB0_LBSPPM0_LPA0_LPB0_LPM0_LRVW8_LWPMn1_MIAV1_MIWT8_1_MO40_MGRIPMn1_NTn1_NTA0_NTB0_NTC0_NTD0_NTM0_NEPBS0_NLCA1_NLCB1_ONLL0_PGR1_PLR0_PKA0_SGROBn1_SIA3_SS0_SU32_SUM0_SUS256_SPO0_SRVW0_SSO0_SVW8_SK0_SKFTR0_SKXCCM0_SGRO0_TIN0_TLDS0_TLDSM1_ULSGRO0_USL1_UIOFGRO0_USFGROn1_VSn1_VWA1_VWB1_WSGRA0_WSGRB0_WS32_WG16_2_1_WGM8_WGMXCC1_WGMXCCGn1
    SolutionIndex: 192
    SolutionNameMin: Cijk_Ailk_Bjlk_B8F8B8S_BH_Bias_SHB_HA_S_SAB_SCD_SAV_UserArgs_MT128x32x64_MI16x16x1_SN_LDSB0_AFC1_AG0_AFEM1_AFEM1_ASEM1_CLR1_CADS0_DTLA0_DTLB0_DTVA1_DTVB0_DTVSM0_DPLBn1_EPS0_ELFLR0_EMLLn1_FDSI0_GRPM1_GRVWA8_GRVWB1_GSU1_GSUAMB_GSUC0_GSUWGMRR0_GLS0_ISA1201_IU1_K1_LDSTI0_LBSPPA0_LBSPPB256_LBSPPM0_LPA0_LPB16_LPM0_LRVW8_LWPMn1_MIAV1_MIWT4_1_MO40_MGRIPMn1_NTn1_NTA0_NTB0_NTC0_NTD0_NTM0_NEPBS0_NLCA4_NLCB1_ONLL0_PGR2_PLR1_PKA0_SGROBn1_SIA3_SS0_SU32_SUM0_SUS256_SPO0_SRVW0_SSO0_SVW8_SK0_SKFTR0_SKXCCM0_SGRO0_TIN0_TLDS0_TLDSM1_ULSGRO0_USL1_UIOFGRO0_USFGROn1_VSn1_VWA1_VWB1_WSGRA0_WSGRB0_WS32_WG32_4_1_WGM8_WGMXCC1_WGMXCCGn1
    SolutionIndex: 193
    SolutionNameMin: Cijk_Ailk_Bjlk_B8F8B8S_BH_Bias_SHB_HA_S_SAB_SCD_SAV_UserArgs_MT32x32x128_MI16x16x1_SN_LDSB0_AFC1_AG0_AFEM1_AFEM1_ASEM1_CLR1_CADS0_DTLA0_DTLB0_DTVA1_DTVB0_DTVSM0_DPLBn1_EPS1_ELFLR0_EMLLn1_FDSI0_GRPM1_GRVWA8_GRVWB8_GSU1_GSUAMB_GSUC0_GSUWGMRR0_GLS0_ISA1201_IU1_K1_LDSTI0_LBSPPA0_LBSPPB256_LBSPPM0_LPA0_LPB16_LPM0_LRVW8_LWPMn1_MIAV1_MIWT1_1_MO40_MGRIPMn1_NTn1_NTA0_NTB0_NTC0_NTD0_NTM0_NEPBS0_NLCA1_NLCB1_ONLL0_PGR1_PLR1_PKA0_SGROBn1_SIA3_SS1_SU32_SUM0_SUS256_SPO0_SRVW0_SSO0_SVW1_SK0_SKFTR0_SKXCCM0_SGRO0_TIN0_TLDS0_TLDSM1_ULSGRO0_USL1_UIOFGRO0_USFGROn1_VSn1_VWA1_VWB1_WSGRA0_WSGRB0_WS32_WG32_4_1_WGM8_WGMXCC1_WGMXCCGn1
    SolutionIndex: 194
    SolutionNameMin: Cijk_Ailk_Bjlk_B8F8B8S_BH_Bias_SHB_HA_S_SAB_SCD_SAV_UserArgs_MT64x64x128_MI16x16x1_SN_LDSB0_AFC1_AG0_AFEM1_AFEM1_ASEM1_CLR1_CADS0_DTLA0_DTLB0_DTVA1_DTVB0_DTVSM0_DPLBn1_EPS1_ELFLR0_EMLLn1_FDSI0_GRPM1_GRVWA8_GRVWB16_GSU1_GSUAMB_GSUC0_GSUWGMRR0_GLS0_ISA1201_IU1_K1_LDSTI0_LBSPPA0_LBSPPB512_LBSPPM0_LPA0_LPB32_LPM0_LRVW8_LWPMn1_MIAV1_MIWT2_2_MO40_MGRIPMn1_NTn1_NTA0_NTB0_NTC0_NTD0_NTM0_NEPBS0_NLCA8_NLCB1_ONLL0_PGR1_PLR1_PKA0_SGROBn1_SIA3_SS0_SU32_SUM0_SUS256_SPO0_SRVW0_SSO0_SVW8_SK0_SKFTR0_SKXCCM0_SGRO0_TIN0_TLDS0_TLDSM1_ULSGRO0_USL1_UIOFGRO0_USFGROn1_VSn1_VWA1_VWB2_WSGRA0_WSGRB0_WS32_WG32_4_1_WGM8_WGMXCC1_WGMXCCGn1
    SolutionIndex: 195
    SolutionNameMin: Cijk_Ailk_Bjlk_B8F8B8S_BH_Bias_SHB_HA_S_SAB_SCD_SAV_UserArgs_MT32x32x64_MI16x16x1_SN_LDSB0_AFC1_AG0_AFEM1_AFEM1_ASEM1_CLR1_CADS0_DTLA0_DTLB0_DTVA0_DTVB1_DTVSM0_DPLBn1_EPS0_ELFLR0_EMLLn1_FDSI0_GRPM1_GRVWA16_GRVWB8_GSU1_GSUAMB_GSUC0_GSUWGMRR0_GLS0_ISA1201_IU1_K1_LDSTI0_LBSPPA256_LBSPPB0_LBSPPM0_LPA16_LPB0_LPM0_LRVW8_LWPMn1_MIAV1_MIWT1_1_MO40_MGRIPMn1_NTn1_NTA0_NTB0_NTC0_NTD0_NTM0_NEPBS0_NLCA1_NLCB1_ONLL0_PGR2_PLR1_PKA0_SGROBn1_SIA3_SS0_SU32_SUM0_SUS256_SPO0_SRVW0_SSO0_SVW8_SK0_SKFTR0_SKXCCM0_SGRO0_TIN0_TLDS0_TLDSM1_ULSGRO0_USL1_UIOFGRO0_USFGROn1_VSn1_VWA1_VWB1_WSGRA0_WSGRB0_WS32_WG32_4_1_WGM8_WGMXCC1_WGMXCCGn1
    SolutionIndex: 196
    SolutionNameMin: Cijk_Ailk_Bjlk_B8F8B8S_BH_Bias_SHB_HA_S_SAB_SCD_SAV_UserArgs_MT128x32x64_MI16x16x1_SN_LDSB0_AFC1_AG0_AFEM1_AFEM1_ASEM1_CLR1_CADS0_DTLA0_DTLB0_DTVA1_DTVB0_DTVSM0_DPLBn1_EPS1_ELFLR0_EMLLn1_FDSI0_GRPM1_GRVWA8_GRVWB4_GSU1_GSUAMB_GSUC0_GSUWGMRR0_GLS0_ISA1201_IU1_K1_LDSTI0_LBSPPA0_LBSPPB256_LBSPPM0_LPA0_LPB16_LPM0_LRVW8_LWPMn1_MIAV1_MIWT4_1_MO40_MGRIPMn1_NTn1_NTA0_NTB0_NTC0_NTD0_NTM0_NEPBS0_NLCA4_NLCB1_ONLL0_PGR1_PLR1_PKA0_SGROBn1_SIA3_SS1_SU32_SUM0_SUS256_SPO0_SRVW0_SSO0_SVW1_SK0_SKFTR0_SKXCCM0_SGRO0_TIN0_TLDS0_TLDSM1_ULSGRO0_USL1_UIOFGRO0_USFGROn1_VSn1_VWA1_VWB1_WSGRA0_WSGRB0_WS32_WG32_4_1_WGM8_WGMXCC1_WGMXCCGn1
    SolutionIndex: 197
    SolutionNameMin: Cijk_Ailk_Bjlk_B8F8B8S_BH_Bias_SHB_HA_S_SAB_SCD_SAV_UserArgs_MT64x64x128_MI16x16x1_SN_LDSB0_AFC1_AG0_AFEM1_AFEM1_ASEM1_CLR1_CADS0_DTLA0_DTLB0_DTVA0_DTVB1_DTVSM0_DPLBn1_EPS1_ELFLR0_EMLLn1_FDSI0_GRPM1_GRVWA8_GRVWB8_GSU1_GSUAMB_GSUC0_GSUWGMRR0_GLS0_ISA1201_IU1_K1_LDSTI0_LBSPPA512_LBSPPB0_LBSPPM0_LPA32_LPB0_LPM0_LRVW8_LWPMn1_MIAV1_MIWT2_2_MO40_MGRIPMn1_NTn1_NTA0_NTB0_NTC0_NTD0_NTM0_NEPBS0_NLCA1_NLCB8_ONLL0_PGR1_PLR1_PKA0_SGROBn1_SIA3_SS1_SU32_SUM0_SUS256_SPO0_SRVW0_SSO0_SVW2_SK0_SKFTR0_SKXCCM0_SGRO0_TIN0_TLDS0_TLDSM1_ULSGRO0_USL1_UIOFGRO0_USFGROn1_VSn1_VWA2_VWB1_WSGRA0_WSGRB0_WS32_WG32_4_1_WGM8_WGMXCC1_WGMXCCGn1
    SolutionIndex: 198
    SolutionNameMin: Cijk_Ailk_Bjlk_B8F8B8S_BH_Bias_SHB_HA_S_SAB_SCD_SAV_UserArgs_MT64x64x128_MI16x16x1_SN_LDSB0_AFC1_AG0_AFEM1_AFEM1_ASEM1_CLR1_CADS0_DTLA0_DTLB0_DTVA0_DTVB1_DTVSM0_DPLBn1_EPS1_ELFLR0_EMLLn1_FDSI0_GRPM1_GRVWA8_GRVWB8_GSU1_GSUAMB_GSUC0_GSUWGMRR0_GLS0_ISA1201_IU1_K1_LDSTI0_LBSPPA512_LBSPPB0_LBSPPM0_LPA32_LPB0_LPM0_LRVW8_LWPMn1_MIAV1_MIWT2_2_MO40_MGRIPMn1_NTn1_NTA0_NTB0_NTC0_NTD0_NTM0_NEPBS0_NLCA1_NLCB8_ONLL0_PGR1_PLR1_PKA0_SGROBn1_SIA3_SS0_SU32_SUM0_SUS256_SPO0_SRVW0_SSO0_SVW16_SK0_SKFTR0_SKXCCM0_SGRO0_TIN0_TLDS0_TLDSM1_ULSGRO0_USL1_UIOFGRO0_USFGROn1_VSn1_VWA2_VWB1_WSGRA0_WSGRB0_WS32_WG32_4_1_WGM8_WGMXCC1_WGMXCCGn1
    SolutionIndex: 199
    SolutionNameMin: Cijk_Ailk_Bjlk_B8F8B8S_BH_Bias_SHB_HA_S_SAB_SCD_SAV_UserArgs_MT32x128x64_MI16x16x1_SN_LDSB0_AFC1_AG0_AFEM1_AFEM1_ASEM1_CLR1_CADS0_DTLA0_DTLB0_DTVA0_DTVB1_DTVSM0_DPLBn1_EPS0_ELFLR0_EMLLn1_FDSI0_GRPM1_GRVWA16_GRVWB8_GSU1_GSUAMB_GSUC0_GSUWGMRR0_GLS0_ISA1201_IU1_K1_LDSTI0_LBSPPA256_LBSPPB0_LBSPPM0_LPA16_LPB0_LPM0_LRVW8_LWPMn1_MIAV1_MIWT1_4_MO40_MGRIPMn1_NTn1_NTA0_NTB0_NTC0_NTD0_NTM0_NEPBS0_NLCA1_NLCB4_ONLL0_PGR2_PLR1_PKA0_SGROBn1_SIA3_SS0_SU32_SUM0_SUS256_SPO0_SRVW0_SSO0_SVW8_SK0_SKFTR0_SKXCCM0_SGRO0_TIN0_TLDS0_TLDSM1_ULSGRO0_USL1_UIOFGRO0_USFGROn1_VSn1_VWA1_VWB1_WSGRA0_WSGRB0_WS32_WG32_4_1_WGM8_WGMXCC1_WGMXCCGn1
    SolutionIndex: 200
    SolutionNameMin: Cijk_Ailk_Bjlk_B8F8B8S_BH_Bias_SHB_HA_S_SAB_SCD_SAV_UserArgs_MT128x32x32_MI16x16x1_SN_LDSB0_AFC1_AG0_AFEM1_AFEM1_ASEM1_CLR1_CADS0_DTLA0_DTLB0_DTVA1_DTVB0_DTVSM0_DPLBn1_EPS0_ELFLR0_EMLLn1_FDSI0_GRPM1_GRVWA8_GRVWB4_GSU1_GSUAMB_GSUC0_GSUWGMRR0_GLS0_ISA1201_IU1_K1_LDSTI0_LBSPPA0_LBSPPB256_LBSPPM0_LPA0_LPB16_LPM0_LRVW8_LWPMn1_MIAV1_MIWT4_1_MO40_MGRIPMn1_NTn1_NTA0_NTB0_NTC0_NTD0_NTM0_NEPBS0_NLCA2_NLCB1_ONLL0_PGR2_PLR1_PKA0_SGROBn1_SIA3_SS0_SU32_SUM0_SUS256_SPO0_SRVW0_SSO0_SVW8_SK0_SKFTR0_SKXCCM0_SGRO0_TIN0_TLDS0_TLDSM1_ULSGRO0_USL1_UIOFGRO0_USFGROn1_VSn1_VWA1_VWB1_WSGRA0_WSGRB0_WS32_WG32_4_1_WGM8_WGMXCC1_WGMXCCGn1
    SolutionIndex: 201
    SolutionNameMin: Cijk_Ailk_Bjlk_B8F8B8S_BH_Bias_SHB_HA_S_SAB_SCD_SAV_UserArgs_MT128x32x64_MI16x16x1_SN_LDSB0_AFC1_AG0_AFEM1_AFEM1_ASEM1_CLR1_CADS0_DTLA0_DTLB0_DTVA1_DTVB0_DTVSM0_DPLBn1_EPS1_ELFLR0_EMLLn1_FDSI0_GRPM1_GRVWA8_GRVWB16_GSU1_GSUAMB_GSUC0_GSUWGMRR0_GLS0_ISA1201_IU1_K1_LDSTI0_LBSPPA0_LBSPPB256_LBSPPM0_LPA0_LPB16_LPM0_LRVW8_LWPMn1_MIAV1_MIWT4_1_MO40_MGRIPMn1_NTn1_NTA0_NTB0_NTC0_NTD0_NTM0_NEPBS0_NLCA4_NLCB1_ONLL0_PGR1_PLR1_PKA0_SGROBn1_SIA3_SS1_SU32_SUM0_SUS256_SPO0_SRVW0_SSO0_SVW1_SK0_SKFTR0_SKXCCM0_SGRO0_TIN0_TLDS0_TLDSM1_ULSGRO0_USL1_UIOFGRO0_USFGROn1_VSn1_VWA1_VWB1_WSGRA0_WSGRB0_WS32_WG32_4_1_WGM8_WGMXCC1_WGMXCCGn1
    SolutionIndex: 202
    SolutionNameMin: Cijk_Ailk_Bjlk_B8F8B8S_BH_Bias_SHB_HA_S_SAB_SCD_SAV_UserArgs_MT64x64x128_MI16x16x1_SN_LDSB0_AFC1_AG0_AFEM1_AFEM1_ASEM1_CLR1_CADS0_DTLA0_DTLB0_DTVA1_DTVB0_DTVSM0_DPLBn1_EPS1_ELFLR0_EMLLn1_FDSI0_GRPM1_GRVWA8_GRVWB8_GSU1_GSUAMB_GSUC0_GSUWGMRR0_GLS0_ISA1201_IU1_K1_LDSTI0_LBSPPA0_LBSPPB512_LBSPPM0_LPA0_LPB32_LPM0_LRVW8_LWPMn1_MIAV1_MIWT2_2_MO40_MGRIPMn1_NTn1_NTA0_NTB0_NTC0_NTD0_NTM0_NEPBS0_NLCA8_NLCB1_ONLL0_PGR1_PLR1_PKA0_SGROBn1_SIA3_SS0_SU32_SUM0_SUS256_SPO0_SRVW0_SSO0_SVW8_SK0_SKFTR0_SKXCCM0_SGRO0_TIN0_TLDS0_TLDSM1_ULSGRO0_USL1_UIOFGRO0_USFGROn1_VSn1_VWA1_VWB2_WSGRA0_WSGRB0_WS32_WG32_4_1_WGM8_WGMXCC1_WGMXCCGn1
    SolutionIndex: 203
    SolutionNameMin: Cijk_Ailk_Bjlk_B8F8B8S_BH_Bias_SHB_HA_S_SAB_SCD_SAV_UserArgs_MT128x128x32_MI16x16x1_SN_LDSB0_AFC1_AG0_AFEM1_AFEM1_ASEM1_CLR1_CADS0_DTLA0_DTLB0_DTVA0_DTVB1_DTVSM0_DPLBn1_EPS0_ELFLR0_EMLLn1_FDSI0_GRPM1_GRVWA8_GRVWB8_GSU1_GSUAMB_GSUC0_GSUWGMRR0_GLS0_ISA1201_IU1_K1_LDSTI0_LBSPPA1024_LBSPPB0_LBSPPM0_LPA64_LPB0_LPM0_LRVW8_LWPMn1_MIAV1_MIWT4_4_MO40_MGRIPMn1_NTn1_NTA0_NTB0_NTC0_NTD0_NTM0_NEPBS0_NLCA1_NLCB2_ONLL0_PGR2_PLR1_PKA0_SGROBn1_SIA3_SS0_SU32_SUM0_SUS256_SPO0_SRVW0_SSO0_SVW8_SK0_SKFTR0_SKXCCM0_SGRO0_TIN0_TLDS0_TLDSM1_ULSGRO0_USL1_UIOFGRO0_USFGROn1_VSn1_VWA4_VWB1_WSGRA0_WSGRB0_WS32_WG32_4_1_WGM8_WGMXCC1_WGMXCCGn1
    SolutionIndex: 204
    SolutionNameMin: Cijk_Ailk_Bjlk_B8F8B8S_BH_Bias_SHB_HA_S_SAB_SCD_SAV_UserArgs_MT64x64x32_MI16x16x1_SN_LDSB0_AFC1_AG0_AFEM1_AFEM1_ASEM1_CLR1_CADS0_DTLA0_DTLB0_DTVA0_DTVB1_DTVSM0_DPLBn1_EPS1_ELFLR0_EMLLn1_FDSI0_GRPM1_GRVWA16_GRVWB8_GSU1_GSUAMB_GSUC0_GSUWGMRR0_GLS0_ISA1201_IU1_K1_LDSTI0_LBSPPA512_LBSPPB0_LBSPPM0_LPA32_LPB0_LPM0_LRVW8_LWPMn1_MIAV1_MIWT2_2_MO40_MGRIPMn1_NTn1_NTA0_NTB0_NTC0_NTD0_NTM0_NEPBS0_NLCA1_NLCB2_ONLL0_PGR1_PLR1_PKA0_SGROBn1_SIA3_SS0_SU32_SUM0_SUS256_SPO0_SRVW0_SSO0_SVW16_SK0_SKFTR0_SKXCCM0_SGRO0_TIN0_TLDS0_TLDSM1_ULSGRO0_USL1_UIOFGRO0_USFGROn1_VSn1_VWA2_VWB1_WSGRA0_WSGRB0_WS32_WG32_4_1_WGM8_WGMXCC1_WGMXCCGn1
    SolutionIndex: 205
    SolutionNameMin: Cijk_Ailk_Bjlk_B8F8B8S_BH_Bias_SHB_HA_S_SAB_SCD_SAV_UserArgs_MT64x64x128_MI16x16x1_SN_LDSB0_AFC1_AG0_AFEM1_AFEM1_ASEM1_CLR1_CADS0_DTLA0_DTLB0_DTVA0_DTVB1_DTVSM0_DPLBn1_EPS1_ELFLR0_EMLLn1_FDSI0_GRPM1_GRVWA16_GRVWB8_GSU1_GSUAMB_GSUC0_GSUWGMRR0_GLS0_ISA1201_IU1_K1_LDSTI0_LBSPPA512_LBSPPB0_LBSPPM0_LPA32_LPB0_LPM0_LRVW8_LWPMn1_MIAV1_MIWT2_2_MO40_MGRIPMn1_NTn1_NTA0_NTB0_NTC0_NTD0_NTM0_NEPBS0_NLCA1_NLCB8_ONLL0_PGR1_PLR1_PKA0_SGROBn1_SIA3_SS1_SU32_SUM0_SUS256_SPO0_SRVW0_SSO0_SVW2_SK0_SKFTR0_SKXCCM0_SGRO0_TIN0_TLDS0_TLDSM1_ULSGRO0_USL1_UIOFGRO0_USFGROn1_VSn1_VWA2_VWB1_WSGRA0_WSGRB0_WS32_WG32_4_1_WGM8_WGMXCC1_WGMXCCGn1
    SolutionIndex: 206
    SolutionNameMin: Cijk_Ailk_Bjlk_B8F8B8S_BH_Bias_SHB_HA_S_SAB_SCD_SAV_UserArgs_MT64x64x64_MI16x16x1_SN_LDSB0_AFC1_AG0_AFEM1_AFEM1_ASEM1_CLR1_CADS0_DTLA0_DTLB0_DTVA0_DTVB1_DTVSM0_DPLBn1_EPS0_ELFLR0_EMLLn1_FDSI0_GRPM1_GRVWA16_GRVWB8_GSU1_GSUAMB_GSUC0_GSUWGMRR0_GLS0_ISA1201_IU1_K1_LDSTI0_LBSPPA512_LBSPPB0_LBSPPM0_LPA32_LPB0_LPM0_LRVW8_LWPMn1_MIAV1_MIWT2_2_MO40_MGRIPMn1_NTn1_NTA0_NTB0_NTC0_NTD0_NTM0_NEPBS0_NLCA1_NLCB4_ONLL0_PGR2_PLR1_PKA0_SGROBn1_SIA3_SS1_SU32_SUM0_SUS256_SPO0_SRVW0_SSO0_SVW2_SK0_SKFTR0_SKXCCM0_SGRO0_TIN0_TLDS0_TLDSM1_ULSGRO0_USL1_UIOFGRO0_USFGROn1_VSn1_VWA2_VWB1_WSGRA0_WSGRB0_WS32_WG32_4_1_WGM8_WGMXCC1_WGMXCCGn1
    SolutionIndex: 207
    SolutionNameMin: Cijk_Ailk_Bjlk_B8F8B8S_BH_Bias_SHB_HA_S_SAB_SCD_SAV_UserArgs_MT128x64x32_MI16x16x1_SN_LDSB0_AFC1_AG0_AFEM1_AFEM1_ASEM1_CLR1_CADS0_DTLA0_DTLB0_DTVA1_DTVB0_DTVSM0_DPLBn1_EPS0_ELFLR0_EMLLn1_FDSI0_GRPM1_GRVWA8_GRVWB16_GSU1_GSUAMB_GSUC0_GSUWGMRR0_GLS0_ISA1201_IU1_K1_LDSTI0_LBSPPA0_LBSPPB512_LBSPPM0_LPA0_LPB16_LPM0_LRVW8_LWPMn1_MIAV1_MIWT8_1_MO40_MGRIPMn1_NTn1_NTA0_NTB0_NTC0_NTD0_NTM0_NEPBS0_NLCA2_NLCB1_ONLL0_PGR2_PLR1_PKA0_SGROBn1_SIA3_SS0_SU32_SUM0_SUS256_SPO0_SRVW0_SSO0_SVW8_SK0_SKFTR0_SKXCCM0_SGRO0_TIN0_TLDS0_TLDSM1_ULSGRO0_USL1_UIOFGRO0_USFGROn1_VSn1_VWA1_VWB1_WSGRA0_WSGRB0_WS32_WG16_8_1_WGM8_WGMXCC1_WGMXCCGn1
    SolutionIndex: 208
    SolutionNameMin: Cijk_Ailk_Bjlk_B8F8B8S_BH_Bias_SHB_HA_S_SAB_SCD_SAV_UserArgs_MT128x64x32_MI16x16x1_SN_LDSB0_AFC1_AG0_AFEM1_AFEM1_ASEM1_CLR1_CADS0_DTLA0_DTLB0_DTVA1_DTVB0_DTVSM0_DPLBn1_EPS0_ELFLR0_EMLLn1_FDSI0_GRPM1_GRVWA8_GRVWB4_GSU1_GSUAMB_GSUC0_GSUWGMRR0_GLS0_ISA1201_IU1_K1_LDSTI0_LBSPPA0_LBSPPB512_LBSPPM0_LPA0_LPB16_LPM0_LRVW8_LWPMn1_MIAV1_MIWT8_1_MO40_MGRIPMn1_NTn1_NTA0_NTB0_NTC0_NTD0_NTM0_NEPBS0_NLCA2_NLCB1_ONLL0_PGR2_PLR1_PKA0_SGROBn1_SIA3_SS0_SU32_SUM0_SUS256_SPO0_SRVW0_SSO0_SVW8_SK0_SKFTR0_SKXCCM0_SGRO0_TIN0_TLDS0_TLDSM1_ULSGRO0_USL1_UIOFGRO0_USFGROn1_VSn1_VWA1_VWB1_WSGRA0_WSGRB0_WS32_WG16_8_1_WGM8_WGMXCC1_WGMXCCGn1
    SolutionIndex: 209
    SolutionNameMin: Cijk_Ailk_Bjlk_B8F8B8S_BH_Bias_SHB_HA_S_SAB_SCD_SAV_UserArgs_MT128x128x32_MI16x16x1_SN_LDSB0_AFC1_AG0_AFEM1_AFEM1_ASEM1_CLR1_CADS0_DTLA0_DTLB0_DTVA1_DTVB0_DTVSM0_DPLBn1_EPS1_ELFLR0_EMLLn1_FDSI0_GRPM1_GRVWA8_GRVWB16_GSU1_GSUAMB_GSUC0_GSUWGMRR0_GLS0_ISA1201_IU1_K1_LDSTI0_LBSPPA0_LBSPPB1024_LBSPPM0_LPA0_LPB32_LPM0_LRVW8_LWPMn1_MIAV1_MIWT8_2_MO40_MGRIPMn1_NTn1_NTA0_NTB0_NTC0_NTD0_NTM0_NEPBS0_NLCA2_NLCB1_ONLL0_PGR1_PLR1_PKA0_SGROBn1_SIA3_SS0_SU32_SUM0_SUS256_SPO0_SRVW0_SSO0_SVW8_SK0_SKFTR0_SKXCCM0_SGRO0_TIN0_TLDS0_TLDSM1_ULSGRO0_USL1_UIOFGRO0_USFGROn1_VSn1_VWA1_VWB2_WSGRA0_WSGRB0_WS32_WG16_8_1_WGM8_WGMXCC1_WGMXCCGn1
    SolutionIndex: 210
    SolutionNameMin: Cijk_Ailk_Bjlk_B8F8B8S_BH_Bias_SHB_HA_S_SAB_SCD_SAV_UserArgs_MT32x32x128_MI16x16x1_SN_LDSB0_AFC1_AG0_AFEM1_AFEM1_ASEM1_CLR1_CADS0_DTLA0_DTLB0_DTVA1_DTVB0_DTVSM0_DPLBn1_EPS1_ELFLR0_EMLLn1_FDSI0_GRPM1_GRVWA8_GRVWB4_GSU1_GSUAMB_GSUC0_GSUWGMRR0_GLS0_ISA1201_IU1_K1_LDSTI0_LBSPPA0_LBSPPB256_LBSPPM0_LPA0_LPB16_LPM0_LRVW8_LWPMn1_MIAV1_MIWT1_1_MO40_MGRIPMn1_NTn1_NTA0_NTB0_NTC0_NTD0_NTM0_NEPBS0_NLCA1_NLCB1_ONLL0_PGR1_PLR1_PKA0_SGROBn1_SIA3_SS1_SU32_SUM0_SUS256_SPO0_SRVW0_SSO0_SVW1_SK0_SKFTR0_SKXCCM0_SGRO0_TIN0_TLDS0_TLDSM1_ULSGRO0_USL1_UIOFGRO0_USFGROn1_VSn1_VWA1_VWB1_WSGRA0_WSGRB0_WS32_WG32_4_1_WGM8_WGMXCC1_WGMXCCGn1
    SolutionIndex: 211
    SolutionNameMin: Cijk_Ailk_Bjlk_B8F8B8S_BH_Bias_SHB_HA_S_SAB_SCD_SAV_UserArgs_MT64x64x64_MI16x16x1_SN_LDSB0_AFC1_AG0_AFEM1_AFEM1_ASEM1_CLR1_CADS0_DTLA0_DTLB0_DTVA1_DTVB1_DTVSM0_DPLBn1_EPS0_ELFLR0_EMLLn1_FDSI0_GRPM1_GRVWA8_GRVWB8_GSU1_GSUAMB_GSUC0_GSUWGMRR0_GLS0_ISA1201_IU1_K1_LDSTI0_LBSPPA0_LBSPPB0_LBSPPM0_LPA0_LPB0_LPM0_LRVW8_LWPMn1_MIAV1_MIWT2_2_MO40_MGRIPMn1_NTn1_NTA0_NTB0_NTC0_NTD0_NTM0_NEPBS0_NLCA4_NLCB4_ONLL0_PGR1_PLR0_PKA0_SGROBn1_SIA3_SS1_SU32_SUM0_SUS256_SPO0_SRVW0_SSO0_SVW1_SK0_SKFTR0_SKXCCM0_SGRO0_TIN0_TLDS0_TLDSM1_ULSGRO0_USL1_UIOFGRO0_USFGROn1_VSn1_VWA1_VWB1_WSGRA0_WSGRB0_WS32_WG32_4_1_WGM8_WGMXCC1_WGMXCCGn1
    SolutionIndex: 212
    SolutionNameMin: Cijk_Ailk_Bjlk_B8F8B8S_BH_Bias_SHB_HA_S_SAB_SCD_SAV_UserArgs_MT64x64x32_MI16x16x1_SN_LDSB0_AFC1_AG0_AFEM1_AFEM1_ASEM1_CLR1_CADS0_DTLA0_DTLB0_DTVA0_DTVB1_DTVSM0_DPLBn1_EPS0_ELFLR0_EMLLn1_FDSI0_GRPM1_GRVWA16_GRVWB8_GSU1_GSUAMB_GSUC0_GSUWGMRR0_GLS0_ISA1201_IU1_K1_LDSTI0_LBSPPA512_LBSPPB0_LBSPPM0_LPA32_LPB0_LPM0_LRVW8_LWPMn1_MIAV1_MIWT2_2_MO40_MGRIPMn1_NTn1_NTA0_NTB0_NTC0_NTD0_NTM0_NEPBS0_NLCA1_NLCB2_ONLL0_PGR2_PLR1_PKA0_SGROBn1_SIA3_SS0_SU32_SUM0_SUS256_SPO0_SRVW0_SSO0_SVW16_SK0_SKFTR0_SKXCCM0_SGRO0_TIN0_TLDS0_TLDSM1_ULSGRO0_USL1_UIOFGRO0_USFGROn1_VSn1_VWA2_VWB1_WSGRA0_WSGRB0_WS32_WG32_4_1_WGM8_WGMXCC1_WGMXCCGn1
    SolutionIndex: 213
    SolutionNameMin: Cijk_Ailk_Bjlk_B8F8B8S_BH_Bias_SHB_HA_S_SAB_SCD_SAV_UserArgs_MT32x32x128_MI16x16x1_SN_LDSB0_AFC1_AG0_AFEM1_AFEM1_ASEM1_CLR1_CADS0_DTLA0_DTLB0_DTVA1_DTVB0_DTVSM0_DPLBn1_EPS0_ELFLR0_EMLLn1_FDSI0_GRPM1_GRVWA8_GRVWB16_GSU1_GSUAMB_GSUC0_GSUWGMRR0_GLS0_ISA1201_IU1_K1_LDSTI0_LBSPPA0_LBSPPB256_LBSPPM0_LPA0_LPB16_LPM0_LRVW8_LWPMn1_MIAV1_MIWT1_1_MO40_MGRIPMn1_NTn1_NTA0_NTB0_NTC0_NTD0_NTM0_NEPBS0_NLCA1_NLCB1_ONLL0_PGR2_PLR1_PKA0_SGROBn1_SIA3_SS1_SU32_SUM0_SUS256_SPO0_SRVW0_SSO0_SVW1_SK0_SKFTR0_SKXCCM0_SGRO0_TIN0_TLDS0_TLDSM1_ULSGRO0_USL1_UIOFGRO0_USFGROn1_VSn1_VWA1_VWB1_WSGRA0_WSGRB0_WS32_WG32_4_1_WGM8_WGMXCC1_WGMXCCGn1
    SolutionIndex: 214
    SolutionNameMin: Cijk_Ailk_Bjlk_B8F8B8S_BH_Bias_SHB_HA_S_SAB_SCD_SAV_UserArgs_MT128x128x32_MI16x16x1_SN_LDSB0_AFC1_AG0_AFEM1_AFEM1_ASEM1_CLR1_CADS0_DTLA0_DTLB0_DTVA1_DTVB0_DTVSM0_DPLBn1_EPS0_ELFLR0_EMLLn1_FDSI0_GRPM1_GRVWA8_GRVWB16_GSU1_GSUAMB_GSUC0_GSUWGMRR0_GLS0_ISA1201_IU1_K1_LDSTI0_LBSPPA0_LBSPPB1024_LBSPPM0_LPA0_LPB64_LPM0_LRVW8_LWPMn1_MIAV1_MIWT4_4_MO40_MGRIPMn1_NTn1_NTA0_NTB0_NTC0_NTD0_NTM0_NEPBS0_NLCA2_NLCB1_ONLL0_PGR2_PLR1_PKA0_SGROBn1_SIA3_SS0_SU32_SUM0_SUS256_SPO0_SRVW0_SSO0_SVW8_SK0_SKFTR0_SKXCCM0_SGRO0_TIN0_TLDS0_TLDSM1_ULSGRO0_USL1_UIOFGRO0_USFGROn1_VSn1_VWA1_VWB4_WSGRA0_WSGRB0_WS32_WG32_4_1_WGM8_WGMXCC1_WGMXCCGn1
    SolutionIndex: 215
    SolutionNameMin: Cijk_Ailk_Bjlk_B8F8B8S_BH_Bias_SHB_HA_S_SAB_SCD_SAV_UserArgs_MT128x128x32_MI16x16x1_SN_LDSB0_AFC1_AG0_AFEM1_AFEM1_ASEM1_CLR1_CADS0_DTLA0_DTLB0_DTVA1_DTVB0_DTVSM0_DPLBn1_EPS0_ELFLR0_EMLLn1_FDSI0_GRPM1_GRVWA8_GRVWB16_GSU1_GSUAMB_GSUC0_GSUWGMRR0_GLS0_ISA1201_IU1_K1_LDSTI0_LBSPPA0_LBSPPB1024_LBSPPM0_LPA0_LPB32_LPM0_LRVW8_LWPMn1_MIAV1_MIWT8_2_MO40_MGRIPMn1_NTn1_NTA0_NTB0_NTC0_NTD0_NTM0_NEPBS0_NLCA2_NLCB1_ONLL0_PGR2_PLR1_PKA0_SGROBn1_SIA3_SS0_SU32_SUM0_SUS256_SPO0_SRVW0_SSO0_SVW8_SK0_SKFTR0_SKXCCM0_SGRO0_TIN0_TLDS0_TLDSM1_ULSGRO0_USL1_UIOFGRO0_USFGROn1_VSn1_VWA1_VWB2_WSGRA0_WSGRB0_WS32_WG16_8_1_WGM8_WGMXCC1_WGMXCCGn1
    SolutionIndex: 216
    SolutionNameMin: Cijk_Ailk_Bjlk_B8F8B8S_BH_Bias_SHB_HA_S_SAB_SCD_SAV_UserArgs_MT128x128x32_MI16x16x1_SN_LDSB0_AFC1_AG0_AFEM1_AFEM1_ASEM1_CLR1_CADS0_DTLA0_DTLB0_DTVA1_DTVB0_DTVSM0_DPLBn1_EPS1_ELFLR0_EMLLn1_FDSI0_GRPM1_GRVWA8_GRVWB4_GSU1_GSUAMB_GSUC0_GSUWGMRR0_GLS0_ISA1201_IU1_K1_LDSTI0_LBSPPA0_LBSPPB1024_LBSPPM0_LPA0_LPB32_LPM0_LRVW8_LWPMn1_MIAV1_MIWT8_2_MO40_MGRIPMn1_NTn1_NTA0_NTB0_NTC0_NTD0_NTM0_NEPBS0_NLCA2_NLCB1_ONLL0_PGR1_PLR1_PKA0_SGROBn1_SIA3_SS0_SU32_SUM0_SUS256_SPO0_SRVW0_SSO0_SVW8_SK0_SKFTR0_SKXCCM0_SGRO0_TIN0_TLDS0_TLDSM1_ULSGRO0_USL1_UIOFGRO0_USFGROn1_VSn1_VWA1_VWB2_WSGRA0_WSGRB0_WS32_WG16_8_1_WGM8_WGMXCC1_WGMXCCGn1
    SolutionIndex: 217
    SolutionNameMin: Cijk_Ailk_Bjlk_B8F8B8S_BH_Bias_SHB_HA_S_SAB_SCD_SAV_UserArgs_MT16x16x128_MI16x16x1_SN_LDSB0_AFC1_AG0_AFEM1_AFEM1_ASEM1_CLR1_CADS0_DTLA0_DTLB0_DTVA0_DTVB1_DTVSM0_DPLBn1_EPS0_ELFLR0_EMLLn1_FDSI0_GRPM1_GRVWA16_GRVWB8_GSU1_GSUAMB_GSUC0_GSUWGMRR0_GLS0_ISA1201_IU1_K1_LDSTI0_LBSPPA128_LBSPPB0_LBSPPM0_LPA16_LPB0_LPM0_LRVW8_LWPMn1_MIAV1_MIWT1_1_MO40_MGRIPMn1_NTn1_NTA0_NTB0_NTC0_NTD0_NTM0_NEPBS0_NLCA1_NLCB1_ONLL0_PGR2_PLR1_PKA0_SGROBn1_SIA3_SS0_SU32_SUM0_SUS256_SPO0_SRVW0_SSO0_SVW8_SK0_SKFTR0_SKXCCM0_SGRO0_TIN0_TLDS0_TLDSM1_ULSGRO0_USL1_UIOFGRO0_USFGROn1_VSn1_VWA1_VWB1_WSGRA0_WSGRB0_WS32_WG16_2_1_WGM8_WGMXCC1_WGMXCCGn1
    SolutionIndex: 218
    SolutionNameMin: Cijk_Ailk_Bjlk_B8F8B8S_BH_Bias_SHB_HA_S_SAB_SCD_SAV_UserArgs_MT32x32x128_MI16x16x1_SN_LDSB0_AFC1_AG0_AFEM1_AFEM1_ASEM1_CLR1_CADS0_DTLA0_DTLB0_DTVA0_DTVB1_DTVSM0_DPLBn1_EPS0_ELFLR0_EMLLn1_FDSI0_GRPM1_GRVWA16_GRVWB8_GSU1_GSUAMB_GSUC0_GSUWGMRR0_GLS0_ISA1201_IU1_K1_LDSTI0_LBSPPA256_LBSPPB0_LBSPPM0_LPA16_LPB0_LPM0_LRVW8_LWPMn1_MIAV1_MIWT1_1_MO40_MGRIPMn1_NTn1_NTA0_NTB0_NTC0_NTD0_NTM0_NEPBS0_NLCA1_NLCB1_ONLL0_PGR2_PLR1_PKA0_SGROBn1_SIA3_SS1_SU32_SUM0_SUS256_SPO0_SRVW0_SSO0_SVW1_SK0_SKFTR0_SKXCCM0_SGRO0_TIN0_TLDS0_TLDSM1_ULSGRO0_USL1_UIOFGRO0_USFGROn1_VSn1_VWA1_VWB1_WSGRA0_WSGRB0_WS32_WG32_4_1_WGM8_WGMXCC1_WGMXCCGn1
    SolutionIndex: 219
    SolutionNameMin: Cijk_Ailk_Bjlk_B8F8B8S_BH_Bias_SHB_HA_S_SAB_SCD_SAV_UserArgs_MT32x32x128_MI16x16x1_SN_LDSB0_AFC1_AG0_AFEM1_AFEM1_ASEM1_CLR1_CADS0_DTLA0_DTLB0_DTVA0_DTVB1_DTVSM0_DPLBn1_EPS1_ELFLR0_EMLLn1_FDSI0_GRPM1_GRVWA4_GRVWB8_GSU1_GSUAMB_GSUC0_GSUWGMRR0_GLS0_ISA1201_IU1_K1_LDSTI0_LBSPPA256_LBSPPB0_LBSPPM0_LPA16_LPB0_LPM0_LRVW8_LWPMn1_MIAV1_MIWT1_1_MO40_MGRIPMn1_NTn1_NTA0_NTB0_NTC0_NTD0_NTM0_NEPBS0_NLCA1_NLCB1_ONLL0_PGR1_PLR1_PKA0_SGROBn1_SIA3_SS1_SU32_SUM0_SUS256_SPO0_SRVW0_SSO0_SVW1_SK0_SKFTR0_SKXCCM0_SGRO0_TIN0_TLDS0_TLDSM1_ULSGRO0_USL1_UIOFGRO0_USFGROn1_VSn1_VWA1_VWB1_WSGRA0_WSGRB0_WS32_WG32_4_1_WGM8_WGMXCC1_WGMXCCGn1
    SolutionIndex: 220
    SolutionNameMin: Cijk_Ailk_Bjlk_B8F8B8S_BH_Bias_SHB_HA_S_SAB_SCD_SAV_UserArgs_MT16x16x128_MI16x16x1_SN_LDSB1_AFC1_AG0_AFEM1_AFEM1_ASEM1_CLR1_CADS0_DTLA0_DTLB0_DTVA0_DTVB0_DTVSM0_DPLBn1_EPS1_ELFLR0_EMLLn1_FDSI0_GRPM1_GRVWA16_GRVWB8_GSU1_GSUAMB_GSUC0_GSUWGMRR0_GLS0_ISA1201_IU8_K1_LDSTI0_LBSPPA128_LBSPPB128_LBSPPM0_LPA16_LPB16_LPM0_LRVW8_LWPMn1_MIAV1_MIWT1_1_MO40_MGRIPMn1_NTn1_NTA0_NTB0_NTC0_NTD0_NTM0_NEPBS0_NLCA1_NLCB1_ONLL0_PGR1_PLR1_PKA0_SGROBn1_SIA2_SS0_SU32_SUM0_SUS256_SPO0_SRVW0_SSO0_SVW8_SK0_SKFTR0_SKXCCM0_SGRO0_TIN0_TLDS0_TLDSM1_ULSGRO0_USL1_UIOFGRO0_USFGROn1_VSn1_VWA1_VWB1_WSGRA0_WSGRB0_WS32_WG16_2_1_WGM8_WGMXCC1_WGMXCCGn1
    SolutionIndex: 221
    SolutionNameMin: Cijk_Ailk_Bjlk_B8F8B8S_BH_Bias_SHB_HA_S_SAB_SCD_SAV_UserArgs_MT32x32x64_MI16x16x1_SN_LDSB0_AFC1_AG0_AFEM1_AFEM1_ASEM1_CLR1_CADS0_DTLA0_DTLB0_DTVA0_DTVB1_DTVSM0_DPLBn1_EPS0_ELFLR0_EMLLn1_FDSI0_GRPM1_GRVWA8_GRVWB8_GSU1_GSUAMB_GSUC0_GSUWGMRR0_GLS0_ISA1201_IU1_K1_LDSTI0_LBSPPA256_LBSPPB0_LBSPPM0_LPA16_LPB0_LPM0_LRVW8_LWPMn1_MIAV1_MIWT1_1_MO40_MGRIPMn1_NTn1_NTA0_NTB0_NTC0_NTD0_NTM0_NEPBS0_NLCA1_NLCB1_ONLL0_PGR2_PLR1_PKA0_SGROBn1_SIA3_SS0_SU32_SUM0_SUS256_SPO0_SRVW0_SSO0_SVW8_SK0_SKFTR0_SKXCCM0_SGRO0_TIN0_TLDS0_TLDSM1_ULSGRO0_USL1_UIOFGRO0_USFGROn1_VSn1_VWA1_VWB1_WSGRA0_WSGRB0_WS32_WG32_4_1_WGM8_WGMXCC1_WGMXCCGn1
    SolutionIndex: 222
    SolutionNameMin: Cijk_Ailk_Bjlk_B8F8B8S_BH_Bias_SHB_HA_S_SAB_SCD_SAV_UserArgs_MT32x32x128_MI16x16x1_SN_LDSB0_AFC1_AG0_AFEM1_AFEM1_ASEM1_CLR1_CADS0_DTLA0_DTLB0_DTVA1_DTVB0_DTVSM0_DPLBn1_EPS0_ELFLR0_EMLLn1_FDSI0_GRPM1_GRVWA8_GRVWB8_GSU1_GSUAMB_GSUC0_GSUWGMRR0_GLS0_ISA1201_IU1_K1_LDSTI0_LBSPPA0_LBSPPB256_LBSPPM0_LPA0_LPB16_LPM0_LRVW8_LWPMn1_MIAV1_MIWT1_1_MO40_MGRIPMn1_NTn1_NTA0_NTB0_NTC0_NTD0_NTM0_NEPBS0_NLCA1_NLCB1_ONLL0_PGR2_PLR1_PKA0_SGROBn1_SIA3_SS1_SU32_SUM0_SUS256_SPO0_SRVW0_SSO0_SVW1_SK0_SKFTR0_SKXCCM0_SGRO0_TIN0_TLDS0_TLDSM1_ULSGRO0_USL1_UIOFGRO0_USFGROn1_VSn1_VWA1_VWB1_WSGRA0_WSGRB0_WS32_WG32_4_1_WGM8_WGMXCC1_WGMXCCGn1
    SolutionIndex: 223
    SolutionNameMin: Cijk_Ailk_Bjlk_B8F8B8S_BH_Bias_SHB_HA_S_SAB_SCD_SAV_UserArgs_MT64x64x128_MI16x16x1_SN_LDSB0_AFC1_AG0_AFEM1_AFEM1_ASEM1_CLR1_CADS0_DTLA0_DTLB0_DTVA1_DTVB0_DTVSM0_DPLBn1_EPS1_ELFLR0_EMLLn1_FDSI0_GRPM1_GRVWA8_GRVWB4_GSU1_GSUAMB_GSUC0_GSUWGMRR0_GLS0_ISA1201_IU1_K1_LDSTI0_LBSPPA0_LBSPPB512_LBSPPM0_LPA0_LPB32_LPM0_LRVW8_LWPMn1_MIAV1_MIWT2_2_MO40_MGRIPMn1_NTn1_NTA0_NTB0_NTC0_NTD0_NTM0_NEPBS0_NLCA8_NLCB1_ONLL0_PGR1_PLR1_PKA0_SGROBn1_SIA3_SS0_SU32_SUM0_SUS256_SPO0_SRVW0_SSO0_SVW8_SK0_SKFTR0_SKXCCM0_SGRO0_TIN0_TLDS0_TLDSM1_ULSGRO0_USL1_UIOFGRO0_USFGROn1_VSn1_VWA1_VWB2_WSGRA0_WSGRB0_WS32_WG32_4_1_WGM8_WGMXCC1_WGMXCCGn1
    SolutionIndex: 224
    SolutionNameMin: Cijk_Ailk_Bjlk_B8F8B8S_BH_Bias_SHB_HA_S_SAB_SCD_SAV_UserArgs_MT64x64x64_MI16x16x1_SN_LDSB0_AFC1_AG0_AFEM1_AFEM1_ASEM1_CLR1_CADS0_DTLA0_DTLB0_DTVA1_DTVB0_DTVSM0_DPLBn1_EPS0_ELFLR0_EMLLn1_FDSI0_GRPM1_GRVWA8_GRVWB16_GSU1_GSUAMB_GSUC0_GSUWGMRR0_GLS0_ISA1201_IU1_K1_LDSTI0_LBSPPA0_LBSPPB512_LBSPPM0_LPA0_LPB32_LPM0_LRVW8_LWPMn1_MIAV1_MIWT2_2_MO40_MGRIPMn1_NTn1_NTA0_NTB0_NTC0_NTD0_NTM0_NEPBS0_NLCA4_NLCB1_ONLL0_PGR2_PLR1_PKA0_SGROBn1_SIA3_SS0_SU32_SUM0_SUS256_SPO0_SRVW0_SSO0_SVW8_SK0_SKFTR0_SKXCCM0_SGRO0_TIN0_TLDS0_TLDSM1_ULSGRO0_USL1_UIOFGRO0_USFGROn1_VSn1_VWA1_VWB2_WSGRA0_WSGRB0_WS32_WG32_4_1_WGM8_WGMXCC1_WGMXCCGn1
    SolutionIndex: 225
    SolutionNameMin: Cijk_Ailk_Bjlk_B8F8B8S_BH_Bias_SHB_HA_S_SAB_SCD_SAV_UserArgs_MT32x16x128_MI16x16x1_SN_LDSB0_AFC1_AG0_AFEM1_AFEM1_ASEM1_CLR1_CADS0_DTLA0_DTLB0_DTVA1_DTVB0_DTVSM0_DPLBn1_EPS0_ELFLR0_EMLLn1_FDSI0_GRPM1_GRVWA8_GRVWB16_GSU1_GSUAMB_GSUC0_GSUWGMRR0_GLS0_ISA1201_IU1_K1_LDSTI0_LBSPPA0_LBSPPB128_LBSPPM0_LPA0_LPB16_LPM0_LRVW8_LWPMn1_MIAV1_MIWT1_1_MO40_MGRIPMn1_NTn1_NTA0_NTB0_NTC0_NTD0_NTM0_NEPBS0_NLCA1_NLCB1_ONLL0_PGR2_PLR1_PKA0_SGROBn1_SIA3_SS0_SU32_SUM0_SUS256_SPO0_SRVW0_SSO0_SVW8_SK0_SKFTR0_SKXCCM0_SGRO0_TIN0_TLDS0_TLDSM1_ULSGRO0_USL1_UIOFGRO0_USFGROn1_VSn1_VWA1_VWB1_WSGRA0_WSGRB0_WS32_WG32_2_1_WGM8_WGMXCC1_WGMXCCGn1
    SolutionIndex: 226
    SolutionNameMin: Cijk_Ailk_Bjlk_B8F8B8S_BH_Bias_SHB_HA_S_SAB_SCD_SAV_UserArgs_MT32x128x64_MI16x16x1_SN_LDSB0_AFC1_AG0_AFEM1_AFEM1_ASEM1_CLR1_CADS0_DTLA0_DTLB0_DTVA0_DTVB1_DTVSM0_DPLBn1_EPS0_ELFLR0_EMLLn1_FDSI0_GRPM1_GRVWA8_GRVWB8_GSU1_GSUAMB_GSUC0_GSUWGMRR0_GLS0_ISA1201_IU1_K1_LDSTI0_LBSPPA256_LBSPPB0_LBSPPM0_LPA16_LPB0_LPM0_LRVW8_LWPMn1_MIAV1_MIWT1_4_MO40_MGRIPMn1_NTn1_NTA0_NTB0_NTC0_NTD0_NTM0_NEPBS0_NLCA1_NLCB4_ONLL0_PGR2_PLR1_PKA0_SGROBn1_SIA3_SS0_SU32_SUM0_SUS256_SPO0_SRVW0_SSO0_SVW8_SK0_SKFTR0_SKXCCM0_SGRO0_TIN0_TLDS0_TLDSM1_ULSGRO0_USL1_UIOFGRO0_USFGROn1_VSn1_VWA1_VWB1_WSGRA0_WSGRB0_WS32_WG32_4_1_WGM8_WGMXCC1_WGMXCCGn1
    SolutionIndex: 227
    SolutionNameMin: Cijk_Ailk_Bjlk_B8F8B8S_BH_Bias_SHB_HA_S_SAB_SCD_SAV_UserArgs_MT128x32x64_MI16x16x1_SN_LDSB0_AFC1_AG0_AFEM1_AFEM1_ASEM1_CLR1_CADS0_DTLA0_DTLB0_DTVA1_DTVB0_DTVSM0_DPLBn1_EPS0_ELFLR0_EMLLn1_FDSI0_GRPM1_GRVWA8_GRVWB16_GSU1_GSUAMB_GSUC0_GSUWGMRR0_GLS0_ISA1201_IU1_K1_LDSTI0_LBSPPA0_LBSPPB256_LBSPPM0_LPA0_LPB16_LPM0_LRVW8_LWPMn1_MIAV1_MIWT4_1_MO40_MGRIPMn1_NTn1_NTA0_NTB0_NTC0_NTD0_NTM0_NEPBS0_NLCA4_NLCB1_ONLL0_PGR2_PLR1_PKA0_SGROBn1_SIA3_SS0_SU32_SUM0_SUS256_SPO0_SRVW0_SSO0_SVW8_SK0_SKFTR0_SKXCCM0_SGRO0_TIN0_TLDS0_TLDSM1_ULSGRO0_USL1_UIOFGRO0_USFGROn1_VSn1_VWA1_VWB1_WSGRA0_WSGRB0_WS32_WG32_4_1_WGM8_WGMXCC1_WGMXCCGn1
    SolutionIndex: 228
    SolutionNameMin: Cijk_Ailk_Bjlk_B8F8B8S_BH_Bias_SHB_HA_S_SAB_SCD_SAV_UserArgs_MT128x128x32_MI16x16x1_SN_LDSB0_AFC1_AG0_AFEM1_AFEM1_ASEM1_CLR1_CADS0_DTLA0_DTLB0_DTVA1_DTVB0_DTVSM0_DPLBn1_EPS0_ELFLR0_EMLLn1_FDSI0_GRPM1_GRVWA8_GRVWB4_GSU1_GSUAMB_GSUC0_GSUWGMRR0_GLS0_ISA1201_IU1_K1_LDSTI0_LBSPPA0_LBSPPB1024_LBSPPM0_LPA0_LPB64_LPM0_LRVW8_LWPMn1_MIAV1_MIWT4_4_MO40_MGRIPMn1_NTn1_NTA0_NTB0_NTC0_NTD0_NTM0_NEPBS0_NLCA2_NLCB1_ONLL0_PGR2_PLR1_PKA0_SGROBn1_SIA3_SS0_SU32_SUM0_SUS256_SPO0_SRVW0_SSO0_SVW8_SK0_SKFTR0_SKXCCM0_SGRO0_TIN0_TLDS0_TLDSM1_ULSGRO0_USL1_UIOFGRO0_USFGROn1_VSn1_VWA1_VWB4_WSGRA0_WSGRB0_WS32_WG32_4_1_WGM8_WGMXCC1_WGMXCCGn1
    SolutionIndex: 229
    SolutionNameMin: Cijk_Ailk_Bjlk_B8F8B8S_BH_Bias_SHB_HA_S_SAB_SCD_SAV_UserArgs_MT128x64x32_MI16x16x1_SN_LDSB0_AFC1_AG0_AFEM1_AFEM1_ASEM1_CLR1_CADS0_DTLA0_DTLB0_DTVA1_DTVB0_DTVSM0_DPLBn1_EPS1_ELFLR0_EMLLn1_FDSI0_GRPM1_GRVWA8_GRVWB16_GSU1_GSUAMB_GSUC0_GSUWGMRR0_GLS0_ISA1201_IU1_K1_LDSTI0_LBSPPA0_LBSPPB512_LBSPPM0_LPA0_LPB16_LPM0_LRVW8_LWPMn1_MIAV1_MIWT8_1_MO40_MGRIPMn1_NTn1_NTA0_NTB0_NTC0_NTD0_NTM0_NEPBS0_NLCA2_NLCB1_ONLL0_PGR1_PLR1_PKA0_SGROBn1_SIA3_SS0_SU32_SUM0_SUS256_SPO0_SRVW0_SSO0_SVW8_SK0_SKFTR0_SKXCCM0_SGRO0_TIN0_TLDS0_TLDSM1_ULSGRO0_USL1_UIOFGRO0_USFGROn1_VSn1_VWA1_VWB1_WSGRA0_WSGRB0_WS32_WG16_8_1_WGM8_WGMXCC1_WGMXCCGn1
    SolutionIndex: 230
    SolutionNameMin: Cijk_Ailk_Bjlk_B8F8B8S_BH_Bias_SHB_HA_S_SAB_SCD_SAV_UserArgs_MT128x64x32_MI16x16x1_SN_LDSB0_AFC1_AG0_AFEM1_AFEM1_ASEM1_CLR1_CADS0_DTLA0_DTLB0_DTVA1_DTVB0_DTVSM0_DPLBn1_EPS0_ELFLR0_EMLLn1_FDSI0_GRPM1_GRVWA8_GRVWB16_GSU1_GSUAMB_GSUC0_GSUWGMRR0_GLS0_ISA1201_IU1_K1_LDSTI0_LBSPPA0_LBSPPB512_LBSPPM0_LPA0_LPB16_LPM0_LRVW8_LWPMn1_MIAV1_MIWT8_1_MO40_MGRIPMn1_NTn1_NTA0_NTB0_NTC0_NTD0_NTM0_NEPBS0_NLCA2_NLCB1_ONLL0_PGR2_PLR1_PKA0_SGROBn1_SIA3_SS1_SU32_SUM0_SUS256_SPO0_SRVW0_SSO0_SVW1_SK0_SKFTR0_SKXCCM0_SGRO0_TIN0_TLDS0_TLDSM1_ULSGRO0_USL1_UIOFGRO0_USFGROn1_VSn1_VWA1_VWB1_WSGRA0_WSGRB0_WS32_WG16_8_1_WGM8_WGMXCC1_WGMXCCGn1
    SolutionIndex: 231
    SolutionNameMin: Cijk_Ailk_Bjlk_B8F8B8S_BH_Bias_SHB_HA_S_SAB_SCD_SAV_UserArgs_MT128x128x32_MI16x16x1_SN_LDSB0_AFC1_AG0_AFEM1_AFEM1_ASEM1_CLR1_CADS0_DTLA0_DTLB0_DTVA0_DTVB1_DTVSM0_DPLBn1_EPS1_ELFLR0_EMLLn1_FDSI0_GRPM1_GRVWA16_GRVWB8_GSU1_GSUAMB_GSUC0_GSUWGMRR0_GLS0_ISA1201_IU1_K1_LDSTI0_LBSPPA1024_LBSPPB0_LBSPPM0_LPA64_LPB0_LPM0_LRVW8_LWPMn1_MIAV1_MIWT4_4_MO40_MGRIPMn1_NTn1_NTA0_NTB0_NTC0_NTD0_NTM0_NEPBS0_NLCA1_NLCB2_ONLL0_PGR1_PLR1_PKA0_SGROBn1_SIA3_SS0_SU32_SUM0_SUS256_SPO0_SRVW0_SSO0_SVW8_SK0_SKFTR0_SKXCCM0_SGRO0_TIN0_TLDS0_TLDSM1_ULSGRO0_USL1_UIOFGRO0_USFGROn1_VSn1_VWA4_VWB1_WSGRA0_WSGRB0_WS32_WG32_4_1_WGM8_WGMXCC1_WGMXCCGn1
    SolutionIndex: 232
    SolutionNameMin: Cijk_Ailk_Bjlk_B8F8B8S_BH_Bias_SHB_HA_S_SAB_SCD_SAV_UserArgs_MT128x128x32_MI16x16x1_SN_LDSB0_AFC1_AG0_AFEM1_AFEM1_ASEM1_CLR1_CADS0_DTLA0_DTLB0_DTVA1_DTVB0_DTVSM0_DPLBn1_EPS0_ELFLR0_EMLLn1_FDSI0_GRPM1_GRVWA8_GRVWB8_GSU1_GSUAMB_GSUC0_GSUWGMRR0_GLS0_ISA1201_IU1_K1_LDSTI0_LBSPPA0_LBSPPB1024_LBSPPM0_LPA0_LPB32_LPM0_LRVW8_LWPMn1_MIAV1_MIWT8_2_MO40_MGRIPMn1_NTn1_NTA0_NTB0_NTC0_NTD0_NTM0_NEPBS0_NLCA2_NLCB1_ONLL0_PGR2_PLR1_PKA0_SGROBn1_SIA3_SS0_SU32_SUM0_SUS256_SPO0_SRVW0_SSO0_SVW8_SK0_SKFTR0_SKXCCM0_SGRO0_TIN0_TLDS0_TLDSM1_ULSGRO0_USL1_UIOFGRO0_USFGROn1_VSn1_VWA1_VWB2_WSGRA0_WSGRB0_WS32_WG16_8_1_WGM8_WGMXCC1_WGMXCCGn1
    SolutionIndex: 233
    SolutionNameMin: Cijk_Ailk_Bjlk_B8F8B8S_BH_Bias_SHB_HA_S_SAB_SCD_SAV_UserArgs_MT64x64x32_MI16x16x1_SN_LDSB0_AFC1_AG0_AFEM1_AFEM1_ASEM1_CLR1_CADS0_DTLA0_DTLB0_DTVA0_DTVB1_DTVSM0_DPLBn1_EPS1_ELFLR0_EMLLn1_FDSI0_GRPM1_GRVWA8_GRVWB8_GSU1_GSUAMB_GSUC0_GSUWGMRR0_GLS0_ISA1201_IU1_K1_LDSTI0_LBSPPA512_LBSPPB0_LBSPPM0_LPA32_LPB0_LPM0_LRVW8_LWPMn1_MIAV1_MIWT2_2_MO40_MGRIPMn1_NTn1_NTA0_NTB0_NTC0_NTD0_NTM0_NEPBS0_NLCA1_NLCB2_ONLL0_PGR1_PLR1_PKA0_SGROBn1_SIA3_SS0_SU32_SUM0_SUS256_SPO0_SRVW0_SSO0_SVW16_SK0_SKFTR0_SKXCCM0_SGRO0_TIN0_TLDS0_TLDSM1_ULSGRO0_USL1_UIOFGRO0_USFGROn1_VSn1_VWA2_VWB1_WSGRA0_WSGRB0_WS32_WG32_4_1_WGM8_WGMXCC1_WGMXCCGn1
    SolutionIndex: 234
    SolutionNameMin: Cijk_Ailk_Bjlk_B8F8B8S_BH_Bias_SHB_HA_S_SAB_SCD_SAV_UserArgs_MT128x128x32_MI16x16x1_SN_LDSB0_AFC1_AG0_AFEM1_AFEM1_ASEM1_CLR1_CADS0_DTLA0_DTLB0_DTVA1_DTVB0_DTVSM0_DPLBn1_EPS0_ELFLR0_EMLLn1_FDSI0_GRPM1_GRVWA8_GRVWB4_GSU1_GSUAMB_GSUC0_GSUWGMRR0_GLS0_ISA1201_IU1_K1_LDSTI0_LBSPPA0_LBSPPB1024_LBSPPM0_LPA0_LPB32_LPM0_LRVW8_LWPMn1_MIAV1_MIWT8_2_MO40_MGRIPMn1_NTn1_NTA0_NTB0_NTC0_NTD0_NTM0_NEPBS0_NLCA2_NLCB1_ONLL0_PGR2_PLR1_PKA0_SGROBn1_SIA3_SS0_SU32_SUM0_SUS256_SPO0_SRVW0_SSO0_SVW8_SK0_SKFTR0_SKXCCM0_SGRO0_TIN0_TLDS0_TLDSM1_ULSGRO0_USL1_UIOFGRO0_USFGROn1_VSn1_VWA1_VWB2_WSGRA0_WSGRB0_WS32_WG16_8_1_WGM8_WGMXCC1_WGMXCCGn1
    SolutionIndex: 235
    SolutionNameMin: Cijk_Ailk_Bjlk_B8F8B8S_BH_Bias_SHB_HA_S_SAB_SCD_SAV_UserArgs_MT16x16x128_MI16x16x1_SN_LDSB0_AFC1_AG0_AFEM1_AFEM1_ASEM1_CLR1_CADS0_DTLA0_DTLB0_DTVA0_DTVB1_DTVSM0_DPLBn1_EPS1_ELFLR0_EMLLn1_FDSI0_GRPM1_GRVWA4_GRVWB8_GSU1_GSUAMB_GSUC0_GSUWGMRR0_GLS0_ISA1201_IU1_K1_LDSTI0_LBSPPA128_LBSPPB0_LBSPPM0_LPA16_LPB0_LPM0_LRVW8_LWPMn1_MIAV1_MIWT1_1_MO40_MGRIPMn1_NTn1_NTA0_NTB0_NTC0_NTD0_NTM0_NEPBS0_NLCA1_NLCB1_ONLL0_PGR1_PLR1_PKA0_SGROBn1_SIA3_SS0_SU32_SUM0_SUS256_SPO0_SRVW0_SSO0_SVW8_SK0_SKFTR0_SKXCCM0_SGRO0_TIN0_TLDS0_TLDSM1_ULSGRO0_USL1_UIOFGRO0_USFGROn1_VSn1_VWA1_VWB1_WSGRA0_WSGRB0_WS32_WG16_2_1_WGM8_WGMXCC1_WGMXCCGn1
    SolutionIndex: 236
    SolutionNameMin: Cijk_Ailk_Bjlk_B8F8B8S_BH_Bias_SHB_HA_S_SAB_SCD_SAV_UserArgs_MT32x16x128_MI16x16x1_SN_LDSB0_AFC1_AG0_AFEM1_AFEM1_ASEM1_CLR1_CADS0_DTLA0_DTLB0_DTVA0_DTVB1_DTVSM0_DPLBn1_EPS0_ELFLR0_EMLLn1_FDSI0_GRPM1_GRVWA16_GRVWB8_GSU1_GSUAMB_GSUC0_GSUWGMRR0_GLS0_ISA1201_IU1_K1_LDSTI0_LBSPPA256_LBSPPB0_LBSPPM0_LPA16_LPB0_LPM0_LRVW8_LWPMn1_MIAV1_MIWT1_1_MO40_MGRIPMn1_NTn1_NTA0_NTB0_NTC0_NTD0_NTM0_NEPBS0_NLCA1_NLCB1_ONLL0_PGR2_PLR1_PKA0_SGROBn1_SIA3_SS0_SU32_SUM0_SUS256_SPO0_SRVW0_SSO0_SVW8_SK0_SKFTR0_SKXCCM0_SGRO0_TIN0_TLDS0_TLDSM1_ULSGRO0_USL1_UIOFGRO0_USFGROn1_VSn1_VWA1_VWB1_WSGRA0_WSGRB0_WS32_WG32_2_1_WGM8_WGMXCC1_WGMXCCGn1
    SolutionIndex: 237
    SolutionNameMin: Cijk_Ailk_Bjlk_B8F8B8S_BH_Bias_SHB_HA_S_SAB_SCD_SAV_UserArgs_MT128x32x64_MI16x16x1_SN_LDSB0_AFC1_AG0_AFEM1_AFEM1_ASEM1_CLR1_CADS0_DTLA0_DTLB0_DTVA1_DTVB0_DTVSM0_DPLBn1_EPS1_ELFLR0_EMLLn1_FDSI0_GRPM1_GRVWA8_GRVWB8_GSU1_GSUAMB_GSUC0_GSUWGMRR0_GLS0_ISA1201_IU1_K1_LDSTI0_LBSPPA0_LBSPPB256_LBSPPM0_LPA0_LPB16_LPM0_LRVW8_LWPMn1_MIAV1_MIWT4_1_MO40_MGRIPMn1_NTn1_NTA0_NTB0_NTC0_NTD0_NTM0_NEPBS0_NLCA4_NLCB1_ONLL0_PGR1_PLR1_PKA0_SGROBn1_SIA3_SS1_SU32_SUM0_SUS256_SPO0_SRVW0_SSO0_SVW1_SK0_SKFTR0_SKXCCM0_SGRO0_TIN0_TLDS0_TLDSM1_ULSGRO0_USL1_UIOFGRO0_USFGROn1_VSn1_VWA1_VWB1_WSGRA0_WSGRB0_WS32_WG32_4_1_WGM8_WGMXCC1_WGMXCCGn1
    SolutionIndex: 238
    SolutionNameMin: Cijk_Ailk_Bjlk_B8F8B8S_BH_Bias_SHB_HA_S_SAB_SCD_SAV_UserArgs_MT64x64x128_MI16x16x1_SN_LDSB0_AFC1_AG0_AFEM1_AFEM1_ASEM1_CLR1_CADS0_DTLA0_DTLB0_DTVA1_DTVB0_DTVSM0_DPLBn1_EPS0_ELFLR0_EMLLn1_FDSI0_GRPM1_GRVWA8_GRVWB16_GSU1_GSUAMB_GSUC0_GSUWGMRR0_GLS0_ISA1201_IU1_K1_LDSTI0_LBSPPA0_LBSPPB512_LBSPPM0_LPA0_LPB32_LPM0_LRVW8_LWPMn1_MIAV1_MIWT2_2_MO40_MGRIPMn1_NTn1_NTA0_NTB0_NTC0_NTD0_NTM0_NEPBS0_NLCA8_NLCB1_ONLL0_PGR2_PLR1_PKA0_SGROBn1_SIA3_SS0_SU32_SUM0_SUS256_SPO0_SRVW0_SSO0_SVW8_SK0_SKFTR0_SKXCCM0_SGRO0_TIN0_TLDS0_TLDSM1_ULSGRO0_USL1_UIOFGRO0_USFGROn1_VSn1_VWA1_VWB2_WSGRA0_WSGRB0_WS32_WG32_4_1_WGM8_WGMXCC1_WGMXCCGn1
    SolutionIndex: 239
    SolutionNameMin: Cijk_Ailk_Bjlk_B8F8B8S_BH_Bias_SHB_HA_S_SAB_SCD_SAV_UserArgs_MT16x32x128_MI16x16x1_SN_LDSB0_AFC1_AG0_AFEM1_AFEM1_ASEM1_CLR1_CADS0_DTLA0_DTLB0_DTVA0_DTVB1_DTVSM0_DPLBn1_EPS1_ELFLR0_EMLLn1_FDSI0_GRPM1_GRVWA16_GRVWB8_GSU1_GSUAMB_GSUC0_GSUWGMRR0_GLS0_ISA1201_IU1_K1_LDSTI0_LBSPPA128_LBSPPB0_LBSPPM0_LPA16_LPB0_LPM0_LRVW8_LWPMn1_MIAV1_MIWT1_1_MO40_MGRIPMn1_NTn1_NTA0_NTB0_NTC0_NTD0_NTM0_NEPBS0_NLCA1_NLCB1_ONLL0_PGR1_PLR1_PKA0_SGROBn1_SIA3_SS1_SU32_SUM0_SUS256_SPO0_SRVW0_SSO0_SVW1_SK0_SKFTR0_SKXCCM0_SGRO0_TIN0_TLDS0_TLDSM1_ULSGRO0_USL1_UIOFGRO0_USFGROn1_VSn1_VWA1_VWB1_WSGRA0_WSGRB0_WS32_WG16_4_1_WGM8_WGMXCC1_WGMXCCGn1
    SolutionIndex: 240
    SolutionNameMin: Cijk_Ailk_Bjlk_B8F8B8S_BH_Bias_SHB_HA_S_SAB_SCD_SAV_UserArgs_MT128x128x32_MI16x16x1_SN_LDSB0_AFC1_AG0_AFEM1_AFEM1_ASEM1_CLR1_CADS0_DTLA0_DTLB0_DTVA0_DTVB1_DTVSM0_DPLBn1_EPS0_ELFLR0_EMLLn1_FDSI0_GRPM1_GRVWA4_GRVWB8_GSU1_GSUAMB_GSUC0_GSUWGMRR0_GLS0_ISA1201_IU1_K1_LDSTI0_LBSPPA1024_LBSPPB0_LBSPPM0_LPA64_LPB0_LPM0_LRVW8_LWPMn1_MIAV1_MIWT4_4_MO40_MGRIPMn1_NTn1_NTA0_NTB0_NTC0_NTD0_NTM0_NEPBS0_NLCA1_NLCB2_ONLL0_PGR2_PLR1_PKA0_SGROBn1_SIA3_SS0_SU32_SUM0_SUS256_SPO0_SRVW0_SSO0_SVW8_SK0_SKFTR0_SKXCCM0_SGRO0_TIN0_TLDS0_TLDSM1_ULSGRO0_USL1_UIOFGRO0_USFGROn1_VSn1_VWA4_VWB1_WSGRA0_WSGRB0_WS32_WG32_4_1_WGM8_WGMXCC1_WGMXCCGn1
    SolutionIndex: 241
    SolutionNameMin: Cijk_Ailk_Bjlk_B8F8B8S_BH_Bias_SHB_HA_S_SAB_SCD_SAV_UserArgs_MT64x64x32_MI16x16x1_SN_LDSB0_AFC1_AG0_AFEM1_AFEM1_ASEM1_CLR1_CADS0_DTLA0_DTLB0_DTVA0_DTVB1_DTVSM0_DPLBn1_EPS0_ELFLR0_EMLLn1_FDSI0_GRPM1_GRVWA16_GRVWB8_GSU1_GSUAMB_GSUC0_GSUWGMRR0_GLS0_ISA1201_IU1_K1_LDSTI0_LBSPPA512_LBSPPB0_LBSPPM0_LPA32_LPB0_LPM0_LRVW8_LWPMn1_MIAV1_MIWT2_2_MO40_MGRIPMn1_NTn1_NTA0_NTB0_NTC0_NTD0_NTM0_NEPBS0_NLCA1_NLCB2_ONLL0_PGR2_PLR1_PKA0_SGROBn1_SIA3_SS1_SU32_SUM0_SUS256_SPO0_SRVW0_SSO0_SVW2_SK0_SKFTR0_SKXCCM0_SGRO0_TIN0_TLDS0_TLDSM1_ULSGRO0_USL1_UIOFGRO0_USFGROn1_VSn1_VWA2_VWB1_WSGRA0_WSGRB0_WS32_WG32_4_1_WGM8_WGMXCC1_WGMXCCGn1
    SolutionIndex: 242
    SolutionNameMin: Cijk_Ailk_Bjlk_B8F8B8S_BH_Bias_SHB_HA_S_SAB_SCD_SAV_UserArgs_MT64x128x32_MI16x16x1_SN_LDSB0_AFC1_AG0_AFEM1_AFEM1_ASEM1_CLR1_CADS0_DTLA0_DTLB0_DTVA0_DTVB1_DTVSM0_DPLBn1_EPS0_ELFLR0_EMLLn1_FDSI0_GRPM1_GRVWA4_GRVWB8_GSU1_GSUAMB_GSUC0_GSUWGMRR0_GLS0_ISA1201_IU1_K1_LDSTI0_LBSPPA512_LBSPPB0_LBSPPM0_LPA16_LPB0_LPM0_LRVW8_LWPMn1_MIAV1_MIWT1_8_MO40_MGRIPMn1_NTn1_NTA0_NTB0_NTC0_NTD0_NTM0_NEPBS0_NLCA1_NLCB2_ONLL0_PGR2_PLR1_PKA0_SGROBn1_SIA3_SS0_SU32_SUM0_SUS256_SPO0_SRVW0_SSO0_SVW8_SK0_SKFTR0_SKXCCM0_SGRO0_TIN0_TLDS0_TLDSM1_ULSGRO0_USL1_UIOFGRO0_USFGROn1_VSn1_VWA1_VWB1_WSGRA0_WSGRB0_WS32_WG64_2_1_WGM8_WGMXCC1_WGMXCCGn1
    SolutionIndex: 243
    SolutionNameMin: Cijk_Ailk_Bjlk_B8F8B8S_BH_Bias_SHB_HA_S_SAB_SCD_SAV_UserArgs_MT128x64x32_MI16x16x1_SN_LDSB0_AFC1_AG0_AFEM1_AFEM1_ASEM1_CLR1_CADS0_DTLA0_DTLB0_DTVA1_DTVB0_DTVSM0_DPLBn1_EPS0_ELFLR0_EMLLn1_FDSI0_GRPM1_GRVWA8_GRVWB8_GSU1_GSUAMB_GSUC0_GSUWGMRR0_GLS0_ISA1201_IU1_K1_LDSTI0_LBSPPA0_LBSPPB512_LBSPPM0_LPA0_LPB16_LPM0_LRVW8_LWPMn1_MIAV1_MIWT8_1_MO40_MGRIPMn1_NTn1_NTA0_NTB0_NTC0_NTD0_NTM0_NEPBS0_NLCA2_NLCB1_ONLL0_PGR2_PLR1_PKA0_SGROBn1_SIA3_SS1_SU32_SUM0_SUS256_SPO0_SRVW0_SSO0_SVW1_SK0_SKFTR0_SKXCCM0_SGRO0_TIN0_TLDS0_TLDSM1_ULSGRO0_USL1_UIOFGRO0_USFGROn1_VSn1_VWA1_VWB1_WSGRA0_WSGRB0_WS32_WG16_8_1_WGM8_WGMXCC1_WGMXCCGn1
    SolutionIndex: 244
    SolutionNameMin: Cijk_Ailk_Bjlk_B8F8B8S_BH_Bias_SHB_HA_S_SAB_SCD_SAV_UserArgs_MT128x64x32_MI16x16x1_SN_LDSB0_AFC1_AG0_AFEM1_AFEM1_ASEM1_CLR1_CADS0_DTLA0_DTLB0_DTVA1_DTVB0_DTVSM0_DPLBn1_EPS1_ELFLR0_EMLLn1_FDSI0_GRPM1_GRVWA8_GRVWB8_GSU1_GSUAMB_GSUC0_GSUWGMRR0_GLS0_ISA1201_IU1_K1_LDSTI0_LBSPPA0_LBSPPB512_LBSPPM0_LPA0_LPB16_LPM0_LRVW8_LWPMn1_MIAV1_MIWT8_1_MO40_MGRIPMn1_NTn1_NTA0_NTB0_NTC0_NTD0_NTM0_NEPBS0_NLCA2_NLCB1_ONLL0_PGR1_PLR1_PKA0_SGROBn1_SIA3_SS1_SU32_SUM0_SUS256_SPO0_SRVW0_SSO0_SVW1_SK0_SKFTR0_SKXCCM0_SGRO0_TIN0_TLDS0_TLDSM1_ULSGRO0_USL1_UIOFGRO0_USFGROn1_VSn1_VWA1_VWB1_WSGRA0_WSGRB0_WS32_WG16_8_1_WGM8_WGMXCC1_WGMXCCGn1
    SolutionIndex: 245
    SolutionNameMin: Cijk_Ailk_Bjlk_B8F8B8S_BH_Bias_SHB_HA_S_SAB_SCD_SAV_UserArgs_MT64x64x64_MI16x16x1_SN_LDSB1_AFC1_AG0_AFEM1_AFEM1_ASEM1_CLR1_CADS0_DTLA0_DTLB0_DTVA0_DTVB0_DTVSM0_DPLBn1_EPS0_ELFLR0_EMLLn1_FDSI0_GRPM1_GRVWA4_GRVWB16_GSU1_GSUAMB_GSUC0_GSUWGMRR0_GLS0_ISA1201_IU4_K1_LDSTI0_LBSPPA512_LBSPPB512_LBSPPM0_LPA32_LPB32_LPM0_LRVW8_LWPMn1_MIAV1_MIWT2_2_MO40_MGRIPMn1_NTn1_NTA0_NTB0_NTC0_NTD0_NTM0_NEPBS0_NLCA1_NLCB1_ONLL0_PGR2_PLR1_PKA0_SGROBn1_SIA2_SS0_SU32_SUM0_SUS256_SPO0_SRVW0_SSO0_SVW16_SK0_SKFTR0_SKXCCM0_SGRO0_TIN0_TLDS0_TLDSM1_ULSGRO0_USL1_UIOFGRO0_USFGROn1_VSn1_VWA2_VWB2_WSGRA0_WSGRB0_WS32_WG32_4_1_WGM8_WGMXCC1_WGMXCCGn1
    SolutionIndex: 246
    SolutionNameMin: Cijk_Ailk_Bjlk_B8F8B8S_BH_Bias_SHB_HA_S_SAB_SCD_SAV_UserArgs_MT64x64x64_MI16x16x1_SN_LDSB1_AFC1_AG0_AFEM1_AFEM1_ASEM1_CLR1_CADS0_DTLA0_DTLB0_DTVA0_DTVB0_DTVSM0_DPLBn1_EPS1_ELFLR0_EMLLn1_FDSI0_GRPM1_GRVWA8_GRVWB8_GSU1_GSUAMB_GSUC0_GSUWGMRR0_GLS0_ISA1201_IU4_K1_LDSTI0_LBSPPA512_LBSPPB512_LBSPPM0_LPA32_LPB32_LPM0_LRVW8_LWPMn1_MIAV1_MIWT2_2_MO40_MGRIPMn1_NTn1_NTA0_NTB0_NTC0_NTD0_NTM0_NEPBS0_NLCA1_NLCB1_ONLL0_PGR1_PLR1_PKA0_SGROBn1_SIA2_SS1_SU32_SUM0_SUS256_SPO0_SRVW0_SSO0_SVW2_SK0_SKFTR0_SKXCCM0_SGRO0_TIN0_TLDS0_TLDSM1_ULSGRO0_USL1_UIOFGRO0_USFGROn1_VSn1_VWA2_VWB2_WSGRA0_WSGRB0_WS32_WG32_4_1_WGM8_WGMXCC1_WGMXCCGn1
    SolutionIndex: 247
    SolutionNameMin: Cijk_Ailk_Bjlk_B8F8B8S_BH_Bias_SHB_HA_S_SAB_SCD_SAV_UserArgs_MT64x64x32_MI16x16x1_SN_LDSB1_AFC1_AG0_AFEM1_AFEM1_ASEM1_CLR1_CADS0_DTLA0_DTLB0_DTVA0_DTVB0_DTVSM0_DPLBn1_EPS0_ELFLR0_EMLLn1_FDSI0_GRPM1_GRVWA4_GRVWB4_GSU1_GSUAMB_GSUC0_GSUWGMRR0_GLS0_ISA1201_IU2_K1_LDSTI0_LBSPPA512_LBSPPB512_LBSPPM0_LPA32_LPB32_LPM0_LRVW8_LWPMn1_MIAV1_MIWT2_2_MO40_MGRIPMn1_NTn1_NTA0_NTB0_NTC0_NTD0_NTM0_NEPBS0_NLCA1_NLCB1_ONLL0_PGR2_PLR1_PKA0_SGROBn1_SIA2_SS1_SU32_SUM0_SUS256_SPO0_SRVW0_SSO0_SVW2_SK0_SKFTR0_SKXCCM0_SGRO0_TIN0_TLDS0_TLDSM1_ULSGRO0_USL1_UIOFGRO0_USFGROn1_VSn1_VWA2_VWB2_WSGRA0_WSGRB0_WS32_WG32_4_1_WGM8_WGMXCC1_WGMXCCGn1
    SolutionIndex: 248
    SolutionNameMin: Cijk_Ailk_Bjlk_B8F8B8S_BH_Bias_SHB_HA_S_SAB_SCD_SAV_UserArgs_MT64x64x64_MI16x16x1_SN_LDSB1_AFC1_AG0_AFEM1_AFEM1_ASEM1_CLR1_CADS0_DTLA0_DTLB0_DTVA0_DTVB0_DTVSM0_DPLBn1_EPS0_ELFLR0_EMLLn1_FDSI0_GRPM1_GRVWA16_GRVWB8_GSU1_GSUAMB_GSUC0_GSUWGMRR0_GLS0_ISA1201_IU4_K1_LDSTI0_LBSPPA512_LBSPPB512_LBSPPM0_LPA32_LPB32_LPM0_LRVW8_LWPMn1_MIAV1_MIWT2_2_MO40_MGRIPMn1_NTn1_NTA0_NTB0_NTC0_NTD0_NTM0_NEPBS0_NLCA1_NLCB1_ONLL0_PGR2_PLR1_PKA0_SGROBn1_SIA2_SS1_SU32_SUM0_SUS256_SPO0_SRVW0_SSO0_SVW2_SK0_SKFTR0_SKXCCM0_SGRO0_TIN0_TLDS0_TLDSM1_ULSGRO0_USL1_UIOFGRO0_USFGROn1_VSn1_VWA2_VWB2_WSGRA0_WSGRB0_WS32_WG32_4_1_WGM8_WGMXCC1_WGMXCCGn1
    SolutionIndex: 249
    SolutionNameMin: Cijk_Ailk_Bjlk_B8F8B8S_BH_Bias_SHB_HA_S_SAB_SCD_SAV_UserArgs_MT64x64x16_MI16x16x1_SN_LDSB1_AFC1_AG0_AFEM1_AFEM1_ASEM1_CLR1_CADS0_DTLA0_DTLB0_DTVA0_DTVB0_DTVSM0_DPLBn1_EPS1_ELFLR0_EMLLn1_FDSI0_GRPM1_GRVWA1_GRVWB1_GSU1_GSUAMB_GSUC0_GSUWGMRR0_GLS0_ISA1201_IU1_K1_LDSTI0_LBSPPA512_LBSPPB512_LBSPPM0_LPA32_LPB32_LPM0_LRVW8_LWPMn1_MIAV1_MIWT2_2_MO40_MGRIPMn1_NTn1_NTA0_NTB0_NTC0_NTD0_NTM0_NEPBS0_NLCA1_NLCB1_ONLL0_PGR1_PLR1_PKA0_SGROBn1_SIA2_SS1_SU32_SUM0_SUS256_SPO0_SRVW0_SSO0_SVW2_SK0_SKFTR0_SKXCCM0_SGRO0_TIN0_TLDS0_TLDSM1_ULSGRO0_USL1_UIOFGRO0_USFGROn1_VSn1_VWA2_VWB2_WSGRA0_WSGRB0_WS32_WG32_4_1_WGM8_WGMXCC1_WGMXCCGn1
    SolutionIndex: 250
    SolutionNameMin: Cijk_Ailk_Bjlk_B8F8B8S_BH_Bias_SHB_HA_S_SAB_SCD_SAV_UserArgs_MT32x128x64_MI16x16x1_SN_LDSB0_AFC1_AG0_AFEM1_AFEM1_ASEM1_CLR1_CADS0_DTLA0_DTLB0_DTVA0_DTVB0_DTVSM0_DPLBn1_EPS1_ELFLR0_EMLLn1_FDSI0_GRPM1_GRVWA4_GRVWB16_GSU1_GSUAMB_GSUC0_GSUWGMRR0_GLS0_ISA1201_IU1_K1_LDSTI0_LBSPPA256_LBSPPB1024_LBSPPM0_LPA16_LPB64_LPM0_LRVW8_LWPMn1_MIAV1_MIWT1_4_MO40_MGRIPMn1_NTn1_NTA0_NTB0_NTC0_NTD0_NTM0_NEPBS0_NLCA1_NLCB1_ONLL0_PGR1_PLR1_PKA0_SGROBn1_SIA3_SS0_SU32_SUM0_SUS256_SPO0_SRVW0_SSO0_SVW8_SK0_SKFTR0_SKXCCM0_SGRO0_TIN0_TLDS0_TLDSM1_ULSGRO0_USL1_UIOFGRO0_USFGROn1_VSn1_VWA1_VWB4_WSGRA0_WSGRB0_WS32_WG32_4_1_WGM8_WGMXCC1_WGMXCCGn1
    SolutionIndex: 251
    SolutionNameMin: Cijk_Ailk_Bjlk_B8F8B8S_BH_Bias_SHB_HA_S_SAB_SCD_SAV_UserArgs_MT64x128x32_MI16x16x1_SN_LDSB0_AFC1_AG0_AFEM1_AFEM1_ASEM1_CLR1_CADS0_DTLA0_DTLB0_DTVA0_DTVB1_DTVSM0_DPLBn1_EPS0_ELFLR0_EMLLn1_FDSI0_GRPM1_GRVWA1_GRVWB8_GSU1_GSUAMB_GSUC0_GSUWGMRR0_GLS0_ISA1201_IU1_K1_LDSTI0_LBSPPA512_LBSPPB0_LBSPPM0_LPA16_LPB0_LPM0_LRVW8_LWPMn1_MIAV1_MIWT1_8_MO40_MGRIPMn1_NTn1_NTA0_NTB0_NTC0_NTD0_NTM0_NEPBS0_NLCA1_NLCB2_ONLL0_PGR2_PLR1_PKA0_SGROBn1_SIA3_SS0_SU32_SUM0_SUS256_SPO0_SRVW0_SSO0_SVW8_SK0_SKFTR0_SKXCCM0_SGRO0_TIN0_TLDS0_TLDSM1_ULSGRO0_USL1_UIOFGRO0_USFGROn1_VSn1_VWA1_VWB1_WSGRA0_WSGRB0_WS32_WG64_2_1_WGM8_WGMXCC1_WGMXCCGn1
    SolutionIndex: 252
    SolutionNameMin: Cijk_Ailk_Bjlk_B8F8B8S_BH_Bias_SHB_HA_S_SAB_SCD_SAV_UserArgs_MT64x64x64_MI16x16x1_SN_LDSB0_AFC1_AG0_AFEM1_AFEM1_ASEM1_CLR1_CADS0_DTLA0_DTLB0_DTVA1_DTVB0_DTVSM0_DPLBn1_EPS0_ELFLR0_EMLLn1_FDSI0_GRPM1_GRVWA8_GRVWB8_GSU1_GSUAMB_GSUC0_GSUWGMRR0_GLS0_ISA1201_IU1_K1_LDSTI0_LBSPPA0_LBSPPB512_LBSPPM0_LPA0_LPB32_LPM0_LRVW8_LWPMn1_MIAV1_MIWT2_2_MO40_MGRIPMn1_NTn1_NTA0_NTB0_NTC0_NTD0_NTM0_NEPBS0_NLCA4_NLCB1_ONLL0_PGR2_PLR1_PKA0_SGROBn1_SIA3_SS0_SU32_SUM0_SUS256_SPO0_SRVW0_SSO0_SVW8_SK0_SKFTR0_SKXCCM0_SGRO0_TIN0_TLDS0_TLDSM1_ULSGRO0_USL1_UIOFGRO0_USFGROn1_VSn1_VWA1_VWB2_WSGRA0_WSGRB0_WS32_WG32_4_1_WGM8_WGMXCC1_WGMXCCGn1
    SolutionIndex: 253
    SolutionNameMin: Cijk_Ailk_Bjlk_B8F8B8S_BH_Bias_SHB_HA_S_SAB_SCD_SAV_UserArgs_MT64x64x64_MI16x16x1_SN_LDSB0_AFC1_AG0_AFEM1_AFEM1_ASEM1_CLR1_CADS0_DTLA0_DTLB0_DTVA0_DTVB0_DTVSM0_DPLBn1_EPS0_ELFLR0_EMLLn1_FDSI0_GRPM1_GRVWA16_GRVWB8_GSU1_GSUAMB_GSUC0_GSUWGMRR0_GLS0_ISA1201_IU1_K1_LDSTI0_LBSPPA512_LBSPPB512_LBSPPM0_LPA32_LPB32_LPM0_LRVW8_LWPMn1_MIAV1_MIWT2_2_MO40_MGRIPMn1_NTn1_NTA0_NTB0_NTC0_NTD0_NTM0_NEPBS0_NLCA1_NLCB1_ONLL0_PGR2_PLR1_PKA0_SGROBn1_SIA3_SS1_SU32_SUM0_SUS256_SPO0_SRVW0_SSO0_SVW2_SK0_SKFTR0_SKXCCM0_SGRO0_TIN0_TLDS0_TLDSM1_ULSGRO1_USL1_UIOFGRO0_USFGROn1_VSn1_VWA2_VWB2_WSGRA0_WSGRB0_WS32_WG32_4_1_WGM8_WGMXCC1_WGMXCCGn1
    SolutionIndex: 254
    SolutionNameMin: Cijk_Ailk_Bjlk_B8F8B8S_BH_Bias_SHB_HA_S_SAB_SCD_SAV_UserArgs_MT64x64x32_MI16x16x1_SN_LDSB1_AFC1_AG0_AFEM1_AFEM1_ASEM1_CLR1_CADS0_DTLA0_DTLB0_DTVA0_DTVB0_DTVSM0_DPLBn1_EPS0_ELFLR0_EMLLn1_FDSI0_GRPM1_GRVWA1_GRVWB1_GSU1_GSUAMB_GSUC0_GSUWGMRR0_GLS0_ISA1201_IU2_K1_LDSTI0_LBSPPA512_LBSPPB512_LBSPPM0_LPA32_LPB32_LPM0_LRVW8_LWPMn1_MIAV1_MIWT2_2_MO40_MGRIPMn1_NTn1_NTA0_NTB0_NTC0_NTD0_NTM0_NEPBS0_NLCA1_NLCB1_ONLL0_PGR2_PLR1_PKA0_SGROBn1_SIA2_SS1_SU32_SUM0_SUS256_SPO0_SRVW0_SSO0_SVW2_SK0_SKFTR0_SKXCCM0_SGRO0_TIN0_TLDS0_TLDSM1_ULSGRO1_USL1_UIOFGRO0_USFGROn1_VSn1_VWA2_VWB2_WSGRA0_WSGRB0_WS32_WG32_4_1_WGM8_WGMXCC1_WGMXCCGn1
    SolutionIndex: 255
    SolutionNameMin: Cijk_Ailk_Bjlk_B8F8B8S_BH_Bias_SHB_HA_S_SAB_SCD_SAV_UserArgs_MT32x128x64_MI16x16x1_SN_LDSB0_AFC1_AG0_AFEM1_AFEM1_ASEM1_CLR1_CADS0_DTLA0_DTLB0_DTVA0_DTVB0_DTVSM0_DPLBn1_EPS0_ELFLR0_EMLLn1_FDSI0_GRPM1_GRVWA16_GRVWB8_GSU1_GSUAMB_GSUC0_GSUWGMRR0_GLS0_ISA1201_IU1_K1_LDSTI0_LBSPPA256_LBSPPB1024_LBSPPM0_LPA16_LPB64_LPM0_LRVW8_LWPMn1_MIAV1_MIWT1_4_MO40_MGRIPMn1_NTn1_NTA0_NTB0_NTC0_NTD0_NTM0_NEPBS0_NLCA1_NLCB1_ONLL0_PGR2_PLR1_PKA0_SGROBn1_SIA3_SS0_SU32_SUM0_SUS256_SPO0_SRVW0_SSO0_SVW8_SK0_SKFTR0_SKXCCM0_SGRO0_TIN0_TLDS0_TLDSM1_ULSGRO0_USL1_UIOFGRO0_USFGROn1_VSn1_VWA1_VWB4_WSGRA0_WSGRB0_WS32_WG32_4_1_WGM8_WGMXCC1_WGMXCCGn1
    SolutionIndex: 256
    SolutionNameMin: Cijk_Ailk_Bjlk_B8F8B8S_BH_Bias_SHB_HA_S_SAB_SCD_SAV_UserArgs_MT64x64x32_MI16x16x1_SN_LDSB0_AFC1_AG0_AFEM1_AFEM1_ASEM1_CLR1_CADS0_DTLA0_DTLB0_DTVA0_DTVB1_DTVSM0_DPLBn1_EPS0_ELFLR0_EMLLn1_FDSI0_GRPM1_GRVWA1_GRVWB8_GSU1_GSUAMB_GSUC0_GSUWGMRR0_GLS0_ISA1201_IU1_K1_LDSTI0_LBSPPA512_LBSPPB0_LBSPPM0_LPA32_LPB0_LPM0_LRVW8_LWPMn1_MIAV1_MIWT2_2_MO40_MGRIPMn1_NTn1_NTA0_NTB0_NTC0_NTD0_NTM0_NEPBS0_NLCA1_NLCB2_ONLL0_PGR2_PLR1_PKA0_SGROBn1_SIA3_SS0_SU32_SUM0_SUS256_SPO0_SRVW0_SSO0_SVW16_SK0_SKFTR0_SKXCCM0_SGRO0_TIN0_TLDS0_TLDSM1_ULSGRO0_USL1_UIOFGRO0_USFGROn1_VSn1_VWA2_VWB1_WSGRA0_WSGRB0_WS32_WG32_4_1_WGM8_WGMXCC1_WGMXCCGn1
    SolutionIndex: 257
    SolutionNameMin: Cijk_Ailk_Bjlk_B8F8B8S_BH_Bias_SHB_HA_S_SAB_SCD_SAV_UserArgs_MT16x256x32_MI16x16x1_SN_LDSB0_AFC1_AG0_AFEM1_AFEM1_ASEM1_CLR1_CADS0_DTLA0_DTLB0_DTVA1_DTVB0_DTVSM0_DPLBn1_EPS1_ELFLR0_EMLLn1_FDSI0_GRPM1_GRVWA8_GRVWB16_GSU1_GSUAMB_GSUC0_GSUWGMRR0_GLS0_ISA1201_IU1_K1_LDSTI0_LBSPPA0_LBSPPB2048_LBSPPM0_LPA0_LPB0_LPM0_LRVW8_LWPMn1_MIAV1_MIWT1_8_MO40_MGRIPMn1_NTn1_NTA0_NTB0_NTC0_NTD0_NTM0_NEPBS0_NLCA1_NLCB1_ONLL0_PGR1_PLR1_PKA0_SGROBn1_SIA3_SS0_SU32_SUM0_SUS256_SPO0_SRVW0_SSO0_SVW8_SK0_SKFTR0_SKXCCM0_SGRO0_TIN0_TLDS0_TLDSM1_ULSGRO0_USL1_UIOFGRO0_USFGROn1_VSn1_VWA1_VWB8_WSGRA0_WSGRB0_WS32_WG16_4_1_WGM8_WGMXCC1_WGMXCCGn1
    SolutionIndex: 258
    SolutionNameMin: Cijk_Ailk_Bjlk_B8F8B8S_BH_Bias_SHB_HA_S_SAB_SCD_SAV_UserArgs_MT64x128x64_MI16x16x1_SN_LDSB0_AFC1_AG0_AFEM1_AFEM1_ASEM1_CLR1_CADS0_DTLA0_DTLB0_DTVA0_DTVB0_DTVSM0_DPLBn1_EPS0_ELFLR0_EMLLn1_FDSI0_GRPM1_GRVWA8_GRVWB8_GSU1_GSUAMB_GSUC0_GSUWGMRR0_GLS0_ISA1201_IU1_K1_LDSTI0_LBSPPA512_LBSPPB1024_LBSPPM0_LPA16_LPB0_LPM0_LRVW8_LWPMn1_MIAV1_MIWT1_8_MO40_MGRIPMn1_NTn1_NTA0_NTB0_NTC0_NTD0_NTM0_NEPBS0_NLCA1_NLCB1_ONLL0_PGR2_PLR1_PKA0_SGROBn1_SIA3_SS0_SU32_SUM0_SUS256_SPO0_SRVW0_SSO0_SVW8_SK0_SKFTR0_SKXCCM0_SGRO0_TIN0_TLDS0_TLDSM1_ULSGRO1_USL1_UIOFGRO0_USFGROn1_VSn1_VWA1_VWB8_WSGRA0_WSGRB0_WS32_WG64_2_1_WGM8_WGMXCC1_WGMXCCGn1
    SolutionIndex: 259
    SolutionNameMin: Cijk_Ailk_Bjlk_B8F8B8S_BH_Bias_SHB_HA_S_SAB_SCD_SAV_UserArgs_MT64x128x64_MI16x16x1_SN_LDSB0_AFC1_AG0_AFEM1_AFEM1_ASEM1_CLR1_CADS0_DTLA0_DTLB0_DTVA0_DTVB0_DTVSM0_DPLBn1_EPS0_ELFLR0_EMLLn1_FDSI0_GRPM1_GRVWA8_GRVWB8_GSU1_GSUAMB_GSUC0_GSUWGMRR0_GLS0_ISA1201_IU1_K1_LDSTI0_LBSPPA512_LBSPPB1024_LBSPPM0_LPA16_LPB0_LPM0_LRVW8_LWPMn1_MIAV1_MIWT1_8_MO40_MGRIPMn1_NTn1_NTA0_NTB0_NTC0_NTD0_NTM0_NEPBS0_NLCA1_NLCB1_ONLL0_PGR2_PLR1_PKA0_SGROBn1_SIA3_SS0_SU32_SUM0_SUS256_SPO0_SRVW0_SSO0_SVW8_SK0_SKFTR0_SKXCCM0_SGRO0_TIN0_TLDS0_TLDSM1_ULSGRO0_USL1_UIOFGRO0_USFGROn1_VSn1_VWA1_VWB8_WSGRA0_WSGRB0_WS32_WG64_2_1_WGM8_WGMXCC1_WGMXCCGn1
    SolutionIndex: 260
    SolutionNameMin: Cijk_Ailk_Bjlk_B8F8B8S_BH_Bias_SHB_HA_S_SAB_SCD_SAV_UserArgs_MT64x128x64_MI16x16x1_SN_LDSB0_AFC1_AG0_AFEM1_AFEM1_ASEM1_CLR1_CADS0_DTLA0_DTLB0_DTVA0_DTVB0_DTVSM0_DPLBn1_EPS0_ELFLR0_EMLLn1_FDSI0_GRPM1_GRVWA8_GRVWB16_GSU1_GSUAMB_GSUC0_GSUWGMRR0_GLS0_ISA1201_IU1_K1_LDSTI0_LBSPPA512_LBSPPB1024_LBSPPM0_LPA16_LPB0_LPM0_LRVW8_LWPMn1_MIAV1_MIWT1_8_MO40_MGRIPMn1_NTn1_NTA0_NTB0_NTC0_NTD0_NTM0_NEPBS0_NLCA1_NLCB1_ONLL0_PGR2_PLR1_PKA0_SGROBn1_SIA3_SS0_SU32_SUM0_SUS256_SPO0_SRVW0_SSO0_SVW8_SK0_SKFTR0_SKXCCM0_SGRO0_TIN0_TLDS0_TLDSM1_ULSGRO1_USL1_UIOFGRO0_USFGROn1_VSn1_VWA1_VWB8_WSGRA0_WSGRB0_WS32_WG64_2_1_WGM8_WGMXCC1_WGMXCCGn1
    SolutionIndex: 261
    SolutionNameMin: Cijk_Ailk_Bjlk_B8F8B8S_BH_Bias_SHB_HA_S_SAB_SCD_SAV_UserArgs_MT64x128x64_MI16x16x1_SN_LDSB0_AFC1_AG0_AFEM1_AFEM1_ASEM1_CLR1_CADS0_DTLA0_DTLB0_DTVA0_DTVB0_DTVSM0_DPLBn1_EPS1_ELFLR0_EMLLn1_FDSI0_GRPM1_GRVWA16_GRVWB8_GSU1_GSUAMB_GSUC0_GSUWGMRR0_GLS0_ISA1201_IU1_K1_LDSTI0_LBSPPA512_LBSPPB1024_LBSPPM0_LPA16_LPB0_LPM0_LRVW8_LWPMn1_MIAV1_MIWT1_8_MO40_MGRIPMn1_NTn1_NTA0_NTB0_NTC0_NTD0_NTM0_NEPBS0_NLCA1_NLCB1_ONLL0_PGR1_PLR1_PKA0_SGROBn1_SIA3_SS0_SU32_SUM0_SUS256_SPO0_SRVW0_SSO0_SVW8_SK0_SKFTR0_SKXCCM0_SGRO0_TIN0_TLDS0_TLDSM1_ULSGRO0_USL1_UIOFGRO0_USFGROn1_VSn1_VWA1_VWB8_WSGRA0_WSGRB0_WS32_WG64_2_1_WGM8_WGMXCC1_WGMXCCGn1
    SolutionIndex: 262
    SolutionNameMin: Cijk_Ailk_Bjlk_B8F8B8S_BH_Bias_SHB_HA_S_SAB_SCD_SAV_UserArgs_MT64x128x64_MI16x16x1_SN_LDSB0_AFC1_AG0_AFEM1_AFEM1_ASEM1_CLR1_CADS0_DTLA0_DTLB0_DTVA0_DTVB0_DTVSM0_DPLBn1_EPS1_ELFLR0_EMLLn1_FDSI0_GRPM1_GRVWA8_GRVWB16_GSU1_GSUAMB_GSUC0_GSUWGMRR0_GLS0_ISA1201_IU1_K1_LDSTI0_LBSPPA512_LBSPPB1024_LBSPPM0_LPA16_LPB0_LPM0_LRVW8_LWPMn1_MIAV1_MIWT1_8_MO40_MGRIPMn1_NTn1_NTA0_NTB0_NTC0_NTD0_NTM0_NEPBS0_NLCA1_NLCB1_ONLL0_PGR1_PLR1_PKA0_SGROBn1_SIA3_SS0_SU32_SUM0_SUS256_SPO0_SRVW0_SSO0_SVW8_SK0_SKFTR0_SKXCCM0_SGRO0_TIN0_TLDS0_TLDSM1_ULSGRO0_USL1_UIOFGRO0_USFGROn1_VSn1_VWA1_VWB8_WSGRA0_WSGRB0_WS32_WG64_2_1_WGM8_WGMXCC1_WGMXCCGn1
    SolutionIndex: 263
    SolutionNameMin: Cijk_Ailk_Bjlk_B8F8B8S_BH_Bias_SHB_HA_S_SAB_SCD_SAV_UserArgs_MT64x128x64_MI16x16x1_SN_LDSB0_AFC1_AG0_AFEM1_AFEM1_ASEM1_CLR1_CADS0_DTLA0_DTLB0_DTVA0_DTVB0_DTVSM0_DPLBn1_EPS0_ELFLR0_EMLLn1_FDSI0_GRPM1_GRVWA8_GRVWB16_GSU1_GSUAMB_GSUC0_GSUWGMRR0_GLS0_ISA1201_IU1_K1_LDSTI0_LBSPPA512_LBSPPB1024_LBSPPM0_LPA16_LPB0_LPM0_LRVW8_LWPMn1_MIAV1_MIWT1_8_MO40_MGRIPMn1_NTn1_NTA0_NTB0_NTC0_NTD0_NTM0_NEPBS0_NLCA1_NLCB1_ONLL0_PGR2_PLR1_PKA0_SGROBn1_SIA3_SS0_SU32_SUM0_SUS256_SPO0_SRVW0_SSO0_SVW8_SK0_SKFTR0_SKXCCM0_SGRO0_TIN0_TLDS0_TLDSM1_ULSGRO0_USL1_UIOFGRO0_USFGROn1_VSn1_VWA1_VWB8_WSGRA0_WSGRB0_WS32_WG64_2_1_WGM8_WGMXCC1_WGMXCCGn1
    SolutionIndex: 264
    SolutionNameMin: Cijk_Ailk_Bjlk_B8F8B8S_BH_Bias_SHB_HA_S_SAB_SCD_SAV_UserArgs_MT16x512x32_MI16x16x1_SN_LDSB0_AFC1_AG0_AFEM1_AFEM1_ASEM1_CLR1_CADS0_DTLA0_DTLB0_DTVA0_DTVB1_DTVSM0_DPLBn1_EPS0_ELFLR0_EMLLn1_FDSI0_GRPM1_GRVWA1_GRVWB8_GSU1_GSUAMB_GSUC0_GSUWGMRR0_GLS0_ISA1201_IU1_K1_LDSTI0_LBSPPA128_LBSPPB0_LBSPPM0_LPA16_LPB0_LPM0_LRVW8_LWPMn1_MIAV1_MIWT1_8_MO40_MGRIPMn1_NTn1_NTA0_NTB0_NTC0_NTD0_NTM0_NEPBS0_NLCA1_NLCB2_ONLL0_PGR2_PLR1_PKA0_SGROBn1_SIA3_SS0_SU32_SUM0_SUS256_SPO0_SRVW0_SSO0_SVW8_SK0_SKFTR0_SKXCCM0_SGRO0_TIN0_TLDS0_TLDSM1_ULSGRO0_USL1_UIOFGRO0_USFGROn1_VSn1_VWA1_VWB1_WSGRA0_WSGRB0_WS32_WG16_8_1_WGM8_WGMXCC1_WGMXCCGn1
    SolutionIndex: 265
    SolutionNameMin: Cijk_Ailk_Bjlk_B8F8B8S_BH_Bias_SHB_HA_S_SAB_SCD_SAV_UserArgs_MT64x128x32_MI16x16x1_SN_LDSB1_AFC1_AG0_AFEM1_AFEM1_ASEM1_CLR1_CADS0_DTLA0_DTLB0_DTVA0_DTVB0_DTVSM0_DPLBn1_EPS0_ELFLR0_EMLLn1_FDSI0_GRPM1_GRVWA4_GRVWB16_GSU1_GSUAMB_GSUC0_GSUWGMRR0_GLS0_ISA1201_IU2_K1_LDSTI0_LBSPPA512_LBSPPB1024_LBSPPM0_LPA16_LPB0_LPM0_LRVW8_LWPMn1_MIAV1_MIWT1_8_MO40_MGRIPMn1_NTn1_NTA0_NTB0_NTC0_NTD0_NTM0_NEPBS0_NLCA1_NLCB1_ONLL0_PGR2_PLR1_PKA0_SGROBn1_SIA2_SS0_SU32_SUM0_SUS256_SPO0_SRVW0_SSO0_SVW8_SK0_SKFTR0_SKXCCM0_SGRO0_TIN0_TLDS0_TLDSM1_ULSGRO1_USL1_UIOFGRO0_USFGROn1_VSn1_VWA1_VWB8_WSGRA0_WSGRB0_WS32_WG64_2_1_WGM8_WGMXCC1_WGMXCCGn1
    SolutionIndex: 266
    SolutionNameMin: Cijk_Ailk_Bjlk_B8F8B8S_BH_Bias_SHB_HA_S_SAB_SCD_SAV_UserArgs_MT64x128x64_MI16x16x1_SN_LDSB0_AFC1_AG0_AFEM1_AFEM1_ASEM1_CLR1_CADS0_DTLA0_DTLB0_DTVA0_DTVB0_DTVSM0_DPLBn1_EPS1_ELFLR0_EMLLn1_FDSI0_GRPM1_GRVWA4_GRVWB16_GSU1_GSUAMB_GSUC0_GSUWGMRR0_GLS0_ISA1201_IU1_K1_LDSTI0_LBSPPA512_LBSPPB1024_LBSPPM0_LPA16_LPB0_LPM0_LRVW8_LWPMn1_MIAV1_MIWT1_8_MO40_MGRIPMn1_NTn1_NTA0_NTB0_NTC0_NTD0_NTM0_NEPBS0_NLCA1_NLCB1_ONLL0_PGR1_PLR1_PKA0_SGROBn1_SIA3_SS0_SU32_SUM0_SUS256_SPO0_SRVW0_SSO0_SVW8_SK0_SKFTR0_SKXCCM0_SGRO0_TIN0_TLDS0_TLDSM1_ULSGRO0_USL1_UIOFGRO0_USFGROn1_VSn1_VWA1_VWB8_WSGRA0_WSGRB0_WS32_WG64_2_1_WGM8_WGMXCC1_WGMXCCGn1
    SolutionIndex: 267
    SolutionNameMin: Cijk_Ailk_Bjlk_B8F8B8S_BH_Bias_SHB_HA_S_SAB_SCD_SAV_UserArgs_MT64x128x64_MI16x16x1_SN_LDSB0_AFC1_AG0_AFEM1_AFEM1_ASEM1_CLR1_CADS0_DTLA0_DTLB0_DTVA0_DTVB0_DTVSM0_DPLBn1_EPS1_ELFLR0_EMLLn1_FDSI0_GRPM1_GRVWA4_GRVWB8_GSU1_GSUAMB_GSUC0_GSUWGMRR0_GLS0_ISA1201_IU1_K1_LDSTI0_LBSPPA512_LBSPPB1024_LBSPPM0_LPA16_LPB0_LPM0_LRVW8_LWPMn1_MIAV1_MIWT1_8_MO40_MGRIPMn1_NTn1_NTA0_NTB0_NTC0_NTD0_NTM0_NEPBS0_NLCA1_NLCB1_ONLL0_PGR1_PLR1_PKA0_SGROBn1_SIA3_SS0_SU32_SUM0_SUS256_SPO0_SRVW0_SSO0_SVW8_SK0_SKFTR0_SKXCCM0_SGRO0_TIN0_TLDS0_TLDSM1_ULSGRO0_USL1_UIOFGRO0_USFGROn1_VSn1_VWA1_VWB8_WSGRA0_WSGRB0_WS32_WG64_2_1_WGM8_WGMXCC1_WGMXCCGn1
    SolutionIndex: 268
    SolutionNameMin: Cijk_Ailk_Bjlk_B8F8B8S_BH_Bias_SHB_HA_S_SAB_SCD_SAV_UserArgs_MT16x128x32_MI16x16x1_SN_LDSB0_AFC1_AG0_AFEM1_AFEM1_ASEM1_CLR1_CADS0_DTLA0_DTLB0_DTVA0_DTVB1_DTVSM0_DPLBn1_EPS0_ELFLR0_EMLLn1_FDSI0_GRPM1_GRVWA8_GRVWB8_GSU1_GSUAMB_GSUC0_GSUWGMRR0_GLS0_ISA1201_IU1_K1_LDSTI0_LBSPPA128_LBSPPB0_LBSPPM0_LPA16_LPB0_LPM0_LRVW8_LWPMn1_MIAV1_MIWT1_8_MO40_MGRIPMn1_NTn1_NTA0_NTB0_NTC0_NTD0_NTM0_NEPBS0_NLCA1_NLCB2_ONLL0_PGR2_PLR1_PKA0_SGROBn1_SIA3_SS0_SU32_SUM0_SUS256_SPO0_SRVW0_SSO0_SVW8_SK0_SKFTR0_SKXCCM0_SGRO0_TIN0_TLDS0_TLDSM1_ULSGRO0_USL1_UIOFGRO0_USFGROn1_VSn1_VWA1_VWB1_WSGRA0_WSGRB0_WS32_WG16_2_1_WGM8_WGMXCC1_WGMXCCGn1
    SolutionIndex: 269
    SolutionNameMin: Cijk_Ailk_Bjlk_B8F8B8S_BH_Bias_SHB_HA_S_SAB_SCD_SAV_UserArgs_MT64x128x32_MI16x16x1_SN_LDSB1_AFC1_AG0_AFEM1_AFEM1_ASEM1_CLR1_CADS0_DTLA0_DTLB0_DTVA0_DTVB0_DTVSM0_DPLBn1_EPS0_ELFLR0_EMLLn1_FDSI0_GRPM1_GRVWA8_GRVWB16_GSU1_GSUAMB_GSUC0_GSUWGMRR0_GLS0_ISA1201_IU2_K1_LDSTI0_LBSPPA512_LBSPPB1024_LBSPPM0_LPA16_LPB0_LPM0_LRVW8_LWPMn1_MIAV1_MIWT1_8_MO40_MGRIPMn1_NTn1_NTA0_NTB0_NTC0_NTD0_NTM0_NEPBS0_NLCA1_NLCB1_ONLL0_PGR2_PLR1_PKA0_SGROBn1_SIA2_SS0_SU32_SUM0_SUS256_SPO0_SRVW0_SSO0_SVW8_SK0_SKFTR0_SKXCCM0_SGRO0_TIN0_TLDS0_TLDSM1_ULSGRO1_USL1_UIOFGRO0_USFGROn1_VSn1_VWA1_VWB8_WSGRA0_WSGRB0_WS32_WG64_2_1_WGM8_WGMXCC1_WGMXCCGn1
    SolutionIndex: 270
    SolutionNameMin: Cijk_Ailk_Bjlk_B8F8B8S_BH_Bias_SHB_HA_S_SAB_SCD_SAV_UserArgs_MT64x64x32_MI16x16x1_SN_LDSB0_AFC1_AG0_AFEM1_AFEM1_ASEM1_CLR1_CADS0_DTLA0_DTLB0_DTVA0_DTVB0_DTVSM0_DPLBn1_EPS0_ELFLR0_EMLLn1_FDSI0_GRPM1_GRVWA4_GRVWB16_GSU1_GSUAMB_GSUC0_GSUWGMRR0_GLS0_ISA1201_IU1_K1_LDSTI0_LBSPPA512_LBSPPB512_LBSPPM0_LPA32_LPB32_LPM0_LRVW8_LWPMn1_MIAV1_MIWT2_2_MO40_MGRIPMn1_NTn1_NTA0_NTB0_NTC0_NTD0_NTM0_NEPBS0_NLCA1_NLCB1_ONLL0_PGR2_PLR1_PKA0_SGROBn1_SIA3_SS0_SU32_SUM0_SUS256_SPO0_SRVW0_SSO0_SVW16_SK0_SKFTR0_SKXCCM0_SGRO0_TIN0_TLDS0_TLDSM1_ULSGRO1_USL1_UIOFGRO0_USFGROn1_VSn1_VWA2_VWB2_WSGRA0_WSGRB0_WS32_WG32_4_1_WGM8_WGMXCC1_WGMXCCGn1
    SolutionIndex: 271
    SolutionNameMin: Cijk_Ailk_Bjlk_B8F8B8S_BH_Bias_SHB_HA_S_SAB_SCD_SAV_UserArgs_MT32x128x64_MI16x16x1_SN_LDSB0_AFC1_AG0_AFEM1_AFEM1_ASEM1_CLR1_CADS0_DTLA0_DTLB0_DTVA1_DTVB0_DTVSM0_DPLBn1_EPS1_ELFLR0_EMLLn1_FDSI0_GRPM1_GRVWA8_GRVWB16_GSU1_GSUAMB_GSUC0_GSUWGMRR0_GLS0_ISA1201_IU1_K1_LDSTI0_LBSPPA0_LBSPPB1024_LBSPPM0_LPA0_LPB64_LPM0_LRVW8_LWPMn1_MIAV1_MIWT1_4_MO40_MGRIPMn1_NTn1_NTA0_NTB0_NTC0_NTD0_NTM0_NEPBS0_NLCA1_NLCB1_ONLL0_PGR1_PLR1_PKA0_SGROBn1_SIA3_SS0_SU32_SUM0_SUS256_SPO0_SRVW0_SSO0_SVW8_SK0_SKFTR0_SKXCCM0_SGRO0_TIN0_TLDS0_TLDSM1_ULSGRO0_USL1_UIOFGRO0_USFGROn1_VSn1_VWA1_VWB4_WSGRA0_WSGRB0_WS32_WG32_4_1_WGM8_WGMXCC1_WGMXCCGn1
    SolutionIndex: 272
    SolutionNameMin: Cijk_Ailk_Bjlk_B8F8B8S_BH_Bias_SHB_HA_S_SAB_SCD_SAV_UserArgs_MT64x128x64_MI16x16x1_SN_LDSB0_AFC1_AG0_AFEM1_AFEM1_ASEM1_CLR1_CADS0_DTLA0_DTLB0_DTVA0_DTVB0_DTVSM0_DPLBn1_EPS0_ELFLR0_EMLLn1_FDSI0_GRPM1_GRVWA4_GRVWB8_GSU1_GSUAMB_GSUC0_GSUWGMRR0_GLS0_ISA1201_IU1_K1_LDSTI0_LBSPPA512_LBSPPB1024_LBSPPM0_LPA16_LPB0_LPM0_LRVW8_LWPMn1_MIAV1_MIWT1_8_MO40_MGRIPMn1_NTn1_NTA0_NTB0_NTC0_NTD0_NTM0_NEPBS0_NLCA1_NLCB1_ONLL0_PGR2_PLR1_PKA0_SGROBn1_SIA3_SS0_SU32_SUM0_SUS256_SPO0_SRVW0_SSO0_SVW8_SK0_SKFTR0_SKXCCM0_SGRO0_TIN0_TLDS0_TLDSM1_ULSGRO0_USL1_UIOFGRO0_USFGROn1_VSn1_VWA1_VWB8_WSGRA0_WSGRB0_WS32_WG64_2_1_WGM8_WGMXCC1_WGMXCCGn1
    SolutionIndex: 314
    SolutionNameMin: Cijk_Ailk_Bjlk_B8F8B8S_BH_Bias_SHB_HA_S_SAB_SCD_SAV_UserArgs_MT32x32x16_MI16x16x1_SN_LDSB0_AFC1_AG0_AFEM1_AFEM1_ASEM1_CLR0_CADS0_DTLA0_DTLB0_DTVA0_DTVB0_DTVSM0_DPLBn1_EPS1_ELFLR0_EMLLn1_FDSI0_GRPM1_GRVWA1_GRVWB1_GSU1_GSUAMB_GSUC0_GSUWGMRR0_GLS0_ISA1201_IU1_K1_LDSTI0_LBSPPA256_LBSPPB256_LBSPPM0_LPA16_LPB16_LPM0_LRVW8_LWPMn1_MIAV1_MIWT1_1_MO40_MGRIPMn1_NTn1_NTA0_NTB0_NTC0_NTD0_NTM0_NEPBS0_NLCA1_NLCB1_ONLL0_PGR1_PLR0_PKA0_SGROBn1_SIA3_SS1_SU32_SUM0_SUS256_SPO0_SRVW0_SSO0_SVW1_SK0_SKFTR0_SKXCCM0_SGRO0_TIN0_TLDS0_TLDSM1_ULSGRO0_USL1_UIOFGRO0_USFGROn1_VSn1_VWA1_VWB1_WSGRA0_WSGRB0_WS32_WG32_4_1_WGM8_WGMXCC1_WGMXCCGn1
    SolutionIndex: 403
    SolutionNameMin: Cijk_Ailk_Bjlk_B8F8B8S_BH_Bias_SHB_HA_S_SAB_SCD_SAV_UserArgs_MT16x16x128_MI16x16x1_SN_LDSB0_AFC1_AG0_AFEM1_AFEM1_ASEM1_CLR1_CADS0_DTLA0_DTLB0_DTVA1_DTVB0_DTVSM0_DPLBn1_EPS1_ELFLR0_EMLLn1_FDSI0_GRPM1_GRVWA8_GRVWB8_GSUn1_GSUAMB_GSUC0_GSUWGMRR0_GLS0_ISA1201_IU1_K1_LDSTI0_LBSPPA0_LBSPPB128_LBSPPM0_LPA0_LPB16_LPM0_LRVW8_LWPMn1_MIAV1_MIWT1_1_MO40_MGRIPMn1_NTn1_NTA0_NTB0_NTC0_NTD0_NTM0_NEPBS0_NLCA1_NLCB1_ONLL0_PGR1_PLR1_PKA0_SGROBn1_SIA3_SS0_SU32_SUM0_SUS256_SPO0_SRVW0_SSO0_SVW8_SK0_SKFTR0_SKXCCM0_SGRO0_TIN0_TLDS0_TLDSM1_ULSGRO0_USL1_UIOFGRO0_USFGROn1_VSn1_VWA1_VWB1_WSGRA0_WSGRB0_WS32_WG16_2_1_WGM8_WGMXCC1_WGMXCCGn1
    SolutionIndex: 404
    SolutionNameMin: Cijk_Ailk_Bjlk_B8F8B8S_BH_Bias_SHB_HA_S_SAB_SCD_SAV_UserArgs_MT64x64x32_MI16x16x1_SN_LDSB0_AFC1_AG0_AFEM1_AFEM1_ASEM1_CLR1_CADS0_DTLA0_DTLB0_DTVA1_DTVB1_DTVSM0_DPLBn1_EPS0_ELFLR0_EMLLn1_FDSI0_GRPM1_GRVWA8_GRVWB8_GSUn1_GSUAMB_GSUC0_GSUWGMRR0_GLS0_ISA1201_IU1_K1_LDSTI0_LBSPPA0_LBSPPB0_LBSPPM0_LPA0_LPB0_LPM0_LRVW8_LWPMn1_MIAV1_MIWT2_2_MO40_MGRIPMn1_NTn1_NTA0_NTB0_NTC0_NTD0_NTM0_NEPBS0_NLCA2_NLCB2_ONLL0_PGR1_PLR0_PKA0_SGROBn1_SIA3_SS1_SU32_SUM0_SUS256_SPO0_SRVW0_SSO0_SVW1_SK0_SKFTR0_SKXCCM0_SGRO0_TIN0_TLDS0_TLDSM1_ULSGRO0_USL1_UIOFGRO0_USFGROn1_VSn1_VWA1_VWB1_WSGRA0_WSGRB0_WS32_WG32_4_1_WGM8_WGMXCC1_WGMXCCGn1
    SolutionIndex: 405
    SolutionNameMin: Cijk_Ailk_Bjlk_B8F8B8S_BH_Bias_SHB_HA_S_SAB_SCD_SAV_UserArgs_MT32x32x64_MI16x16x1_CMS_SN_LDSB0_AFC1_AG0_AFEM1_AFEM1_ASEM1_CLR1_CADS0_DTLA0_DTLB0_DTVA0_DTVB0_DTVSM0_DPLBn1_EPS0_ELFLR0_EMLLn1_FDSI0_GRPM1_GRVWA16_GRVWB16_GSU1_GSUAMB_GSUC0_GSUWGMRR0_GLS0_ISA1201_IU1_LDSTI0_LBSPPA256_LBSPPB256_LBSPPM0_LPA16_LPB16_LPM0_LRVW8_LWPMn1_MIAV1_MIWT1_1_MO40_MGRIPMn1_NTn1_NTA0_NTB0_NTC0_NTD0_NTM0_NEPBS0_NLCA1_NLCB1_ONLL0_PGR1_PLR1_PKA0_SGROBn1_SIA3_SS1_SU32_SUM0_SUS256_SPO0_SRVW0_SSO0_SVW1_SK0_SKFTR0_SKXCCM0_SGRO0_TIN0_TLDS0_TLDSM1_ULSGRO0_USL1_UIOFGRO0_USFGROn1_VSn1_VWA1_VWB1_WSGRA0_WSGRB0_WS32_WG32_4_1_WGM8_WGMXCC1_WGMXCCG0
    SolutionIndex: 406
    SolutionNameMin: Cijk_Ailk_Bjlk_B8F8B8S_BH_Bias_SHB_HA_S_SAB_SCD_SAV_UserArgs_MT16x64x64_MI16x16x1_CMS_SN_LDSB0_AFC1_AG0_AFEM1_AFEM1_ASEM1_CLR1_CADS0_DTLA0_DTLB0_DTVA0_DTVB0_DTVSM0_DPLBn1_EPS0_ELFLR0_EMLLn1_FDSI0_GRPM1_GRVWA8_GRVWB16_GSU1_GSUAMB_GSUC0_GSUWGMRR0_GLS0_ISA1201_IU1_LDSTI0_LBSPPA128_LBSPPB512_LBSPPM0_LPA16_LPB16_LPM0_LRVW8_LWPMn1_MIAV1_MIWT1_1_MO40_MGRIPMn1_NTn1_NTA0_NTB0_NTC0_NTD0_NTM0_NEPBS0_NLCA1_NLCB1_ONLL0_PGR2_PLR3_PKA0_SGROBn1_SIA3_SS1_SU32_SUM0_SUS256_SPO0_SRVW0_SSO0_SVW1_SK0_SKFTR0_SKXCCM0_SGRO0_TIN0_TLDS0_TLDSM1_ULSGRO0_USL1_UIOFGRO0_USFGROn1_VSn1_VWA1_VWB1_WSGRA0_WSGRB0_WS32_WG16_8_1_WGM8_WGMXCC1_WGMXCCG0
    SolutionIndex: 407
    SolutionNameMin: Cijk_Ailk_Bjlk_B8F8B8S_BH_Bias_SHB_HA_S_SAB_SCD_SAV_UserArgs_MT32x16x128_MI16x16x1_SN_LDSB0_AFC1_AG0_AFEM1_AFEM1_ASEM1_CLR1_CADS0_DTLA0_DTLB0_DTVA1_DTVB0_DTVSM0_DPLBn1_EPS1_ELFLR0_EMLLn1_FDSI0_GRPM1_GRVWA8_GRVWB8_GSUn1_GSUAMB_GSUC0_GSUWGMRR0_GLS0_ISA1201_IU1_K1_LDSTI0_LBSPPA0_LBSPPB128_LBSPPM0_LPA0_LPB16_LPM0_LRVW8_LWPMn1_MIAV1_MIWT1_1_MO40_MGRIPMn1_NTn1_NTA0_NTB0_NTC0_NTD0_NTM0_NEPBS0_NLCA1_NLCB1_ONLL0_PGR1_PLR1_PKA0_SGROBn1_SIA3_SS0_SU32_SUM0_SUS256_SPO0_SRVW0_SSO0_SVW8_SK0_SKFTR0_SKXCCM0_SGRO0_TIN0_TLDS0_TLDSM1_ULSGRO0_USL1_UIOFGRO0_USFGROn1_VSn1_VWA1_VWB1_WSGRA0_WSGRB0_WS32_WG32_2_1_WGM8_WGMXCC1_WGMXCCGn1
    SolutionIndex: 408
    SolutionNameMin: Cijk_Ailk_Bjlk_B8F8B8S_BH_Bias_SHB_HA_S_SAB_SCD_SAV_UserArgs_MT32x32x128_MI16x16x1_SN_LDSB0_AFC1_AG0_AFEM1_AFEM1_ASEM1_CLR1_CADS0_DTLA0_DTLB0_DTVA1_DTVB0_DTVSM0_DPLBn1_EPS0_ELFLR0_EMLLn1_FDSI0_GRPM1_GRVWA8_GRVWB16_GSUn1_GSUAMB_GSUC0_GSUWGMRR0_GLS0_ISA1201_IU1_K1_LDSTI0_LBSPPA0_LBSPPB256_LBSPPM0_LPA0_LPB16_LPM0_LRVW8_LWPMn1_MIAV1_MIWT1_1_MO40_MGRIPMn1_NTn1_NTA0_NTB0_NTC0_NTD0_NTM0_NEPBS0_NLCA1_NLCB1_ONLL0_PGR2_PLR1_PKA0_SGROBn1_SIA3_SS0_SU32_SUM0_SUS256_SPO0_SRVW0_SSO0_SVW8_SK0_SKFTR0_SKXCCM0_SGRO0_TIN0_TLDS0_TLDSM1_ULSGRO0_USL1_UIOFGRO0_USFGROn1_VSn1_VWA1_VWB1_WSGRA0_WSGRB0_WS32_WG32_4_1_WGM8_WGMXCC1_WGMXCCGn1
    SolutionIndex: 409
    SolutionNameMin: Cijk_Ailk_Bjlk_B8F8B8S_BH_Bias_SHB_HA_S_SAB_SCD_SAV_UserArgs_MT64x64x64_MI16x16x1_SN_LDSB0_AFC1_AG0_AFEM1_AFEM1_ASEM1_CLR1_CADS0_DTLA0_DTLB0_DTVA0_DTVB1_DTVSM0_DPLBn1_EPS1_ELFLR0_EMLLn1_FDSI0_GRPM1_GRVWA16_GRVWB8_GSUn1_GSUAMB_GSUC0_GSUWGMRR0_GLS0_ISA1201_IU1_K1_LDSTI0_LBSPPA512_LBSPPB0_LBSPPM0_LPA32_LPB0_LPM0_LRVW8_LWPMn1_MIAV1_MIWT2_2_MO40_MGRIPMn1_NTn1_NTA0_NTB0_NTC0_NTD0_NTM0_NEPBS0_NLCA1_NLCB4_ONLL0_PGR1_PLR1_PKA0_SGROBn1_SIA3_SS1_SU32_SUM0_SUS256_SPO0_SRVW0_SSO0_SVW2_SK0_SKFTR0_SKXCCM0_SGRO0_TIN0_TLDS0_TLDSM1_ULSGRO0_USL1_UIOFGRO0_USFGROn1_VSn1_VWA2_VWB1_WSGRA0_WSGRB0_WS32_WG32_4_1_WGM8_WGMXCC1_WGMXCCGn1
    SolutionIndex: 410
    SolutionNameMin: Cijk_Ailk_Bjlk_B8F8B8S_BH_Bias_SHB_HA_S_SAB_SCD_SAV_UserArgs_MT32x32x128_MI16x16x1_SN_LDSB0_AFC1_AG0_AFEM1_AFEM1_ASEM1_CLR1_CADS0_DTLA0_DTLB0_DTVA0_DTVB1_DTVSM0_DPLBn1_EPS1_ELFLR0_EMLLn1_FDSI0_GRPM1_GRVWA4_GRVWB8_GSUn1_GSUAMB_GSUC0_GSUWGMRR0_GLS0_ISA1201_IU1_K1_LDSTI0_LBSPPA256_LBSPPB0_LBSPPM0_LPA16_LPB0_LPM0_LRVW8_LWPMn1_MIAV1_MIWT1_1_MO40_MGRIPMn1_NTn1_NTA0_NTB0_NTC0_NTD0_NTM0_NEPBS0_NLCA1_NLCB1_ONLL0_PGR1_PLR1_PKA0_SGROBn1_SIA3_SS0_SU32_SUM0_SUS256_SPO0_SRVW0_SSO0_SVW8_SK0_SKFTR0_SKXCCM0_SGRO0_TIN0_TLDS0_TLDSM1_ULSGRO0_USL1_UIOFGRO0_USFGROn1_VSn1_VWA1_VWB1_WSGRA0_WSGRB0_WS32_WG32_4_1_WGM8_WGMXCC1_WGMXCCGn1
    SolutionIndex: 411
    SolutionNameMin: Cijk_Ailk_Bjlk_B8F8B8S_BH_Bias_SHB_HA_S_SAB_SCD_SAV_UserArgs_MT64x64x64_MI16x16x1_SN_LDSB0_AFC1_AG0_AFEM1_AFEM1_ASEM1_CLR1_CADS0_DTLA0_DTLB0_DTVA0_DTVB1_DTVSM0_DPLBn1_EPS1_ELFLR0_EMLLn1_FDSI0_GRPM1_GRVWA8_GRVWB8_GSUn1_GSUAMB_GSUC0_GSUWGMRR0_GLS0_ISA1201_IU1_K1_LDSTI0_LBSPPA512_LBSPPB0_LBSPPM0_LPA32_LPB0_LPM0_LRVW8_LWPMn1_MIAV1_MIWT2_2_MO40_MGRIPMn1_NTn1_NTA0_NTB0_NTC0_NTD0_NTM0_NEPBS0_NLCA1_NLCB4_ONLL0_PGR1_PLR1_PKA0_SGROBn1_SIA3_SS0_SU32_SUM0_SUS256_SPO0_SRVW0_SSO0_SVW16_SK0_SKFTR0_SKXCCM0_SGRO0_TIN0_TLDS0_TLDSM1_ULSGRO0_USL1_UIOFGRO0_USFGROn1_VSn1_VWA2_VWB1_WSGRA0_WSGRB0_WS32_WG32_4_1_WGM8_WGMXCC1_WGMXCCGn1
- - - [1, 1, 1, 1]
    - [314, 0.0]
  - - [64, 64, 1, 64]
    - [1, 0.0]
  - - [64, 64, 1, 512]
    - [403, 0.0]
  - - [64, 64, 1, 1024]
    - [169, 0.0]
  - - [64, 64, 1, 2048]
    - [404, 0.0]
  - - [64, 64, 1, 4096]
    - [128, 0.0]
  - - [127, 127, 1, 127]
    - [405, 0.0]
  - - [128, 128, 1, 128]
    - [0, 0.0]
  - - [129, 129, 1, 129]
    - [406, 0.0]
  - - [128, 64, 1, 64]
    - [2, 0.0]
  - - [192, 64, 1, 64]
    - [3, 0.0]
  - - [256, 64, 1, 64]
    - [4, 0.0]
  - - [320, 64, 1, 64]
    - [5, 0.0]
  - - [384, 64, 1, 64]
    - [5, 0.0]
  - - [448, 64, 1, 64]
    - [3, 0.0]
  - - [512, 64, 1, 64]
    - [6, 0.0]
  - - [576, 64, 1, 64]
    - [7, 0.0]
  - - [640, 64, 1, 64]
    - [8, 0.0]
  - - [704, 64, 1, 64]
    - [9, 0.0]
  - - [768, 64, 1, 64]
    - [10, 0.0]
  - - [832, 64, 1, 64]
    - [11, 0.0]
  - - [896, 64, 1, 64]
    - [12, 0.0]
  - - [960, 64, 1, 64]
    - [3, 0.0]
  - - [1024, 64, 1, 64]
    - [13, 0.0]
  - - [64, 128, 1, 64]
    - [14, 0.0]
  - - [128, 128, 1, 64]
    - [13, 0.0]
  - - [192, 128, 1, 64]
    - [15, 0.0]
  - - [256, 128, 1, 64]
    - [15, 0.0]
  - - [320, 128, 1, 64]
    - [16, 0.0]
  - - [384, 128, 1, 64]
    - [15, 0.0]
  - - [448, 128, 1, 64]
    - [17, 0.0]
  - - [512, 128, 1, 64]
    - [18, 0.0]
  - - [576, 128, 1, 64]
    - [19, 0.0]
  - - [640, 128, 1, 64]
    - [20, 0.0]
  - - [704, 128, 1, 64]
    - [21, 0.0]
  - - [768, 128, 1, 64]
    - [20, 0.0]
  - - [832, 128, 1, 64]
    - [22, 0.0]
  - - [896, 128, 1, 64]
    - [23, 0.0]
  - - [960, 128, 1, 64]
    - [24, 0.0]
  - - [1024, 128, 1, 64]
    - [23, 0.0]
  - - [64, 192, 1, 64]
    - [25, 0.0]
  - - [128, 192, 1, 64]
    - [26, 0.0]
  - - [192, 192, 1, 64]
    - [3, 0.0]
  - - [256, 192, 1, 64]
    - [3, 0.0]
  - - [320, 192, 1, 64]
    - [26, 0.0]
  - - [384, 192, 1, 64]
    - [27, 0.0]
  - - [448, 192, 1, 64]
    - [24, 0.0]
  - - [512, 192, 1, 64]
    - [19, 0.0]
  - - [576, 192, 1, 64]
    - [21, 0.0]
  - - [640, 192, 1, 64]
    - [24, 0.0]
  - - [704, 192, 1, 64]
    - [28, 0.0]
  - - [768, 192, 1, 64]
    - [29, 0.0]
  - - [832, 192, 1, 64]
    - [30, 0.0]
  - - [896, 192, 1, 64]
    - [23, 0.0]
  - - [960, 192, 1, 64]
    - [31, 0.0]
  - - [1024, 192, 1, 64]
    - [27, 0.0]
  - - [64, 256, 1, 64]
    - [32, 0.0]
  - - [128, 256, 1, 64]
    - [15, 0.0]
  - - [192, 256, 1, 64]
    - [11, 0.0]
  - - [256, 256, 1, 64]
    - [3, 0.0]
  - - [320, 256, 1, 64]
    - [33, 0.0]
  - - [384, 256, 1, 64]
    - [21, 0.0]
  - - [448, 256, 1, 64]
    - [34, 0.0]
  - - [512, 256, 1, 64]
    - [35, 0.0]
  - - [576, 256, 1, 64]
    - [20, 0.0]
  - - [640, 256, 1, 64]
    - [33, 0.0]
  - - [704, 256, 1, 64]
    - [31, 0.0]
  - - [768, 256, 1, 64]
    - [21, 0.0]
  - - [832, 256, 1, 64]
    - [21, 0.0]
  - - [896, 256, 1, 64]
    - [36, 0.0]
  - - [960, 256, 1, 64]
    - [19, 0.0]
  - - [1024, 256, 1, 64]
    - [20, 0.0]
  - - [64, 320, 1, 64]
    - [15, 0.0]
  - - [128, 320, 1, 64]
    - [37, 0.0]
  - - [192, 320, 1, 64]
    - [26, 0.0]
  - - [256, 320, 1, 64]
    - [38, 0.0]
  - - [320, 320, 1, 64]
    - [19, 0.0]
  - - [384, 320, 1, 64]
    - [39, 0.0]
  - - [448, 320, 1, 64]
    - [40, 0.0]
  - - [512, 320, 1, 64]
    - [21, 0.0]
  - - [576, 320, 1, 64]
    - [21, 0.0]
  - - [640, 320, 1, 64]
    - [21, 0.0]
  - - [704, 320, 1, 64]
    - [21, 0.0]
  - - [768, 320, 1, 64]
    - [23, 0.0]
  - - [832, 320, 1, 64]
    - [41, 0.0]
  - - [896, 320, 1, 64]
    - [31, 0.0]
  - - [960, 320, 1, 64]
    - [34, 0.0]
  - - [1024, 320, 1, 64]
    - [20, 0.0]
  - - [64, 384, 1, 64]
    - [42, 0.0]
  - - [128, 384, 1, 64]
    - [43, 0.0]
  - - [192, 384, 1, 64]
    - [39, 0.0]
  - - [256, 384, 1, 64]
    - [39, 0.0]
  - - [320, 384, 1, 64]
    - [21, 0.0]
  - - [384, 384, 1, 64]
    - [44, 0.0]
  - - [448, 384, 1, 64]
    - [45, 0.0]
  - - [512, 384, 1, 64]
    - [19, 0.0]
  - - [576, 384, 1, 64]
    - [19, 0.0]
  - - [640, 384, 1, 64]
    - [46, 0.0]
  - - [704, 384, 1, 64]
    - [47, 0.0]
  - - [768, 384, 1, 64]
    - [48, 0.0]
  - - [832, 384, 1, 64]
    - [49, 0.0]
  - - [896, 384, 1, 64]
    - [22, 0.0]
  - - [960, 384, 1, 64]
    - [20, 0.0]
  - - [1024, 384, 1, 64]
    - [20, 0.0]
  - - [64, 448, 1, 64]
    - [37, 0.0]
  - - [128, 448, 1, 64]
    - [50, 0.0]
  - - [192, 448, 1, 64]
    - [51, 0.0]
  - - [256, 448, 1, 64]
    - [21, 0.0]
  - - [320, 448, 1, 64]
    - [51, 0.0]
  - - [384, 448, 1, 64]
    - [21, 0.0]
  - - [448, 448, 1, 64]
    - [52, 0.0]
  - - [512, 448, 1, 64]
    - [21, 0.0]
  - - [576, 448, 1, 64]
    - [53, 0.0]
  - - [640, 448, 1, 64]
    - [54, 0.0]
  - - [704, 448, 1, 64]
    - [22, 0.0]
  - - [768, 448, 1, 64]
    - [48, 0.0]
  - - [832, 448, 1, 64]
    - [20, 0.0]
  - - [896, 448, 1, 64]
    - [55, 0.0]
  - - [960, 448, 1, 64]
    - [56, 0.0]
  - - [1024, 448, 1, 64]
    - [57, 0.0]
  - - [64, 512, 1, 64]
    - [3, 0.0]
  - - [128, 512, 1, 64]
    - [58, 0.0]
  - - [192, 512, 1, 64]
    - [24, 0.0]
  - - [256, 512, 1, 64]
    - [59, 0.0]
  - - [320, 512, 1, 64]
    - [60, 0.0]
  - - [384, 512, 1, 64]
    - [61, 0.0]
  - - [448, 512, 1, 64]
    - [20, 0.0]
  - - [512, 512, 1, 64]
    - [62, 0.0]
  - - [576, 512, 1, 64]
    - [63, 0.0]
  - - [640, 512, 1, 64]
    - [64, 0.0]
  - - [704, 512, 1, 64]
    - [65, 0.0]
  - - [768, 512, 1, 64]
    - [20, 0.0]
  - - [832, 512, 1, 64]
    - [66, 0.0]
  - - [896, 512, 1, 64]
    - [57, 0.0]
  - - [960, 512, 1, 64]
    - [67, 0.0]
  - - [1024, 512, 1, 64]
    - [68, 0.0]
  - - [64, 576, 1, 64]
    - [3, 0.0]
  - - [128, 576, 1, 64]
    - [21, 0.0]
  - - [192, 576, 1, 64]
    - [34, 0.0]
  - - [256, 576, 1, 64]
    - [69, 0.0]
  - - [320, 576, 1, 64]
    - [34, 0.0]
  - - [384, 576, 1, 64]
    - [21, 0.0]
  - - [448, 576, 1, 64]
    - [70, 0.0]
  - - [512, 576, 1, 64]
    - [71, 0.0]
  - - [576, 576, 1, 64]
    - [19, 0.0]
  - - [640, 576, 1, 64]
    - [20, 0.0]
  - - [704, 576, 1, 64]
    - [72, 0.0]
  - - [768, 576, 1, 64]
    - [73, 0.0]
  - - [832, 576, 1, 64]
    - [73, 0.0]
  - - [896, 576, 1, 64]
    - [57, 0.0]
  - - [960, 576, 1, 64]
    - [21, 0.0]
  - - [1024, 576, 1, 64]
    - [74, 0.0]
  - - [64, 640, 1, 64]
    - [75, 0.0]
  - - [128, 640, 1, 64]
    - [76, 0.0]
  - - [192, 640, 1, 64]
    - [77, 0.0]
  - - [256, 640, 1, 64]
    - [78, 0.0]
  - - [320, 640, 1, 64]
    - [20, 0.0]
  - - [384, 640, 1, 64]
    - [48, 0.0]
  - - [448, 640, 1, 64]
    - [20, 0.0]
  - - [512, 640, 1, 64]
    - [79, 0.0]
  - - [576, 640, 1, 64]
    - [20, 0.0]
  - - [640, 640, 1, 64]
    - [80, 0.0]
  - - [704, 640, 1, 64]
    - [67, 0.0]
  - - [768, 640, 1, 64]
    - [81, 0.0]
  - - [832, 640, 1, 64]
    - [82, 0.0]
  - - [896, 640, 1, 64]
    - [67, 0.0]
  - - [960, 640, 1, 64]
    - [31, 0.0]
  - - [1024, 640, 1, 64]
    - [83, 0.0]
  - - [64, 704, 1, 64]
    - [84, 0.0]
  - - [128, 704, 1, 64]
    - [39, 0.0]
  - - [192, 704, 1, 64]
    - [21, 0.0]
  - - [256, 704, 1, 64]
    - [78, 0.0]
  - - [320, 704, 1, 64]
    - [21, 0.0]
  - - [384, 704, 1, 64]
    - [85, 0.0]
  - - [448, 704, 1, 64]
    - [22, 0.0]
  - - [512, 704, 1, 64]
    - [44, 0.0]
  - - [576, 704, 1, 64]
    - [22, 0.0]
  - - [640, 704, 1, 64]
    - [74, 0.0]
  - - [704, 704, 1, 64]
    - [86, 0.0]
  - - [768, 704, 1, 64]
    - [87, 0.0]
  - - [832, 704, 1, 64]
    - [88, 0.0]
  - - [896, 704, 1, 64]
    - [89, 0.0]
  - - [960, 704, 1, 64]
    - [90, 0.0]
  - - [1024, 704, 1, 64]
    - [91, 0.0]
  - - [64, 768, 1, 64]
    - [92, 0.0]
  - - [128, 768, 1, 64]
    - [93, 0.0]
  - - [192, 768, 1, 64]
    - [53, 0.0]
  - - [256, 768, 1, 64]
    - [94, 0.0]
  - - [320, 768, 1, 64]
    - [95, 0.0]
  - - [384, 768, 1, 64]
    - [20, 0.0]
  - - [448, 768, 1, 64]
    - [96, 0.0]
  - - [512, 768, 1, 64]
    - [97, 0.0]
  - - [576, 768, 1, 64]
    - [98, 0.0]
  - - [640, 768, 1, 64]
    - [57, 0.0]
  - - [704, 768, 1, 64]
    - [86, 0.0]
  - - [768, 768, 1, 64]
    - [73, 0.0]
  - - [832, 768, 1, 64]
    - [99, 0.0]
  - - [896, 768, 1, 64]
    - [57, 0.0]
  - - [960, 768, 1, 64]
    - [98, 0.0]
  - - [1024, 768, 1, 64]
    - [98, 0.0]
  - - [64, 832, 1, 64]
    - [5, 0.0]
  - - [128, 832, 1, 64]
    - [21, 0.0]
  - - [192, 832, 1, 64]
    - [21, 0.0]
  - - [256, 832, 1, 64]
    - [100, 0.0]
  - - [320, 832, 1, 64]
    - [21, 0.0]
  - - [384, 832, 1, 64]
    - [20, 0.0]
  - - [448, 832, 1, 64]
    - [20, 0.0]
  - - [512, 832, 1, 64]
    - [67, 0.0]
  - - [576, 832, 1, 64]
    - [82, 0.0]
  - - [640, 832, 1, 64]
    - [101, 0.0]
  - - [704, 832, 1, 64]
    - [102, 0.0]
  - - [768, 832, 1, 64]
    - [103, 0.0]
  - - [832, 832, 1, 64]
    - [73, 0.0]
  - - [896, 832, 1, 64]
    - [104, 0.0]
  - - [960, 832, 1, 64]
    - [105, 0.0]
  - - [1024, 832, 1, 64]
    - [106, 0.0]
  - - [64, 896, 1, 64]
    - [26, 0.0]
  - - [128, 896, 1, 64]
    - [107, 0.0]
  - - [192, 896, 1, 64]
    - [21, 0.0]
  - - [256, 896, 1, 64]
    - [23, 0.0]
  - - [320, 896, 1, 64]
    - [44, 0.0]
  - - [384, 896, 1, 64]
    - [21, 0.0]
  - - [448, 896, 1, 64]
    - [20, 0.0]
  - - [512, 896, 1, 64]
    - [73, 0.0]
  - - [576, 896, 1, 64]
    - [86, 0.0]
  - - [640, 896, 1, 64]
    - [74, 0.0]
  - - [704, 896, 1, 64]
    - [73, 0.0]
  - - [768, 896, 1, 64]
    - [108, 0.0]
  - - [832, 896, 1, 64]
    - [67, 0.0]
  - - [896, 896, 1, 64]
    - [109, 0.0]
  - - [960, 896, 1, 64]
    - [110, 0.0]
  - - [1024, 896, 1, 64]
    - [110, 0.0]
  - - [64, 960, 1, 64]
    - [26, 0.0]
  - - [128, 960, 1, 64]
    - [21, 0.0]
  - - [192, 960, 1, 64]
    - [21, 0.0]
  - - [256, 960, 1, 64]
    - [40, 0.0]
  - - [320, 960, 1, 64]
    - [111, 0.0]
  - - [384, 960, 1, 64]
    - [20, 0.0]
  - - [448, 960, 1, 64]
    - [111, 0.0]
  - - [512, 960, 1, 64]
    - [73, 0.0]
  - - [576, 960, 1, 64]
    - [112, 0.0]
  - - [640, 960, 1, 64]
    - [113, 0.0]
  - - [704, 960, 1, 64]
    - [114, 0.0]
  - - [768, 960, 1, 64]
    - [74, 0.0]
  - - [832, 960, 1, 64]
    - [115, 0.0]
  - - [896, 960, 1, 64]
    - [116, 0.0]
  - - [960, 960, 1, 64]
    - [41, 0.0]
  - - [1024, 960, 1, 64]
    - [83, 0.0]
  - - [64, 1024, 1, 64]
    - [42, 0.0]
  - - [128, 1024, 1, 64]
    - [30, 0.0]
  - - [192, 1024, 1, 64]
    - [31, 0.0]
  - - [256, 1024, 1, 64]
    - [29, 0.0]
  - - [320, 1024, 1, 64]
    - [20, 0.0]
  - - [384, 1024, 1, 64]
    - [117, 0.0]
  - - [448, 1024, 1, 64]
    - [64, 0.0]
  - - [512, 1024, 1, 64]
    - [98, 0.0]
  - - [576, 1024, 1, 64]
    - [67, 0.0]
  - - [640, 1024, 1, 64]
    - [118, 0.0]
  - - [704, 1024, 1, 64]
    - [111, 0.0]
  - - [768, 1024, 1, 64]
    - [90, 0.0]
  - - [832, 1024, 1, 64]
    - [41, 0.0]
  - - [896, 1024, 1, 64]
    - [119, 0.0]
  - - [960, 1024, 1, 64]
    - [57, 0.0]
  - - [1024, 1024, 1, 64]
    - [83, 0.0]
  - - [64, 64, 1, 256]
    - [120, 0.0]
  - - [128, 64, 1, 256]
    - [121, 0.0]
  - - [192, 64, 1, 256]
    - [122, 0.0]
  - - [256, 64, 1, 256]
    - [123, 0.0]
  - - [320, 64, 1, 256]
    - [124, 0.0]
  - - [384, 64, 1, 256]
    - [121, 0.0]
  - - [448, 64, 1, 256]
    - [125, 0.0]
  - - [512, 64, 1, 256]
    - [125, 0.0]
  - - [576, 64, 1, 256]
    - [26, 0.0]
  - - [640, 64, 1, 256]
    - [126, 0.0]
  - - [704, 64, 1, 256]
    - [11, 0.0]
  - - [768, 64, 1, 256]
    - [122, 0.0]
  - - [832, 64, 1, 256]
    - [12, 0.0]
  - - [896, 64, 1, 256]
    - [121, 0.0]
  - - [960, 64, 1, 256]
    - [14, 0.0]
  - - [1024, 64, 1, 256]
    - [126, 0.0]
  - - [64, 128, 1, 256]
    - [127, 0.0]
  - - [128, 128, 1, 256]
    - [128, 0.0]
  - - [192, 128, 1, 256]
    - [129, 0.0]
  - - [256, 128, 1, 256]
    - [127, 0.0]
  - - [320, 128, 1, 256]
    - [130, 0.0]
  - - [384, 128, 1, 256]
    - [131, 0.0]
  - - [448, 128, 1, 256]
    - [131, 0.0]
  - - [512, 128, 1, 256]
    - [124, 0.0]
  - - [576, 128, 1, 256]
    - [26, 0.0]
  - - [640, 128, 1, 256]
    - [132, 0.0]
  - - [704, 128, 1, 256]
    - [133, 0.0]
  - - [768, 128, 1, 256]
    - [134, 0.0]
  - - [832, 128, 1, 256]
    - [135, 0.0]
  - - [896, 128, 1, 256]
    - [136, 0.0]
  - - [960, 128, 1, 256]
    - [137, 0.0]
  - - [1024, 128, 1, 256]
    - [138, 0.0]
  - - [64, 192, 1, 256]
    - [139, 0.0]
  - - [128, 192, 1, 256]
    - [140, 0.0]
  - - [192, 192, 1, 256]
    - [128, 0.0]
  - - [256, 192, 1, 256]
    - [141, 0.0]
  - - [320, 192, 1, 256]
    - [12, 0.0]
  - - [384, 192, 1, 256]
    - [136, 0.0]
  - - [448, 192, 1, 256]
    - [133, 0.0]
  - - [512, 192, 1, 256]
    - [142, 0.0]
  - - [576, 192, 1, 256]
    - [61, 0.0]
  - - [640, 192, 1, 256]
    - [142, 0.0]
  - - [704, 192, 1, 256]
    - [62, 0.0]
  - - [768, 192, 1, 256]
    - [62, 0.0]
  - - [832, 192, 1, 256]
    - [116, 0.0]
  - - [896, 192, 1, 256]
    - [142, 0.0]
  - - [960, 192, 1, 256]
    - [143, 0.0]
  - - [1024, 192, 1, 256]
    - [134, 0.0]
  - - [64, 256, 1, 256]
    - [131, 0.0]
  - - [128, 256, 1, 256]
    - [127, 0.0]
  - - [192, 256, 1, 256]
    - [128, 0.0]
  - - [256, 256, 1, 256]
    - [144, 0.0]
  - - [320, 256, 1, 256]
    - [133, 0.0]
  - - [384, 256, 1, 256]
    - [138, 0.0]
  - - [448, 256, 1, 256]
    - [136, 0.0]
  - - [512, 256, 1, 256]
    - [133, 0.0]
  - - [576, 256, 1, 256]
    - [132, 0.0]
  - - [640, 256, 1, 256]
    - [48, 0.0]
  - - [704, 256, 1, 256]
    - [145, 0.0]
  - - [768, 256, 1, 256]
    - [21, 0.0]
  - - [832, 256, 1, 256]
    - [20, 0.0]
  - - [896, 256, 1, 256]
    - [20, 0.0]
  - - [960, 256, 1, 256]
    - [21, 0.0]
  - - [1024, 256, 1, 256]
    - [133, 0.0]
  - - [64, 320, 1, 256]
    - [123, 0.0]
  - - [128, 320, 1, 256]
    - [146, 0.0]
  - - [192, 320, 1, 256]
    - [146, 0.0]
  - - [256, 320, 1, 256]
    - [133, 0.0]
  - - [320, 320, 1, 256]
    - [20, 0.0]
  - - [384, 320, 1, 256]
    - [138, 0.0]
  - - [448, 320, 1, 256]
    - [62, 0.0]
  - - [512, 320, 1, 256]
    - [45, 0.0]
  - - [576, 320, 1, 256]
    - [116, 0.0]
  - - [640, 320, 1, 256]
    - [134, 0.0]
  - - [704, 320, 1, 256]
    - [116, 0.0]
  - - [768, 320, 1, 256]
    - [142, 0.0]
  - - [832, 320, 1, 256]
    - [31, 0.0]
  - - [896, 320, 1, 256]
    - [20, 0.0]
  - - [960, 320, 1, 256]
    - [20, 0.0]
  - - [1024, 320, 1, 256]
    - [138, 0.0]
  - - [64, 384, 1, 256]
    - [146, 0.0]
  - - [128, 384, 1, 256]
    - [26, 0.0]
  - - [192, 384, 1, 256]
    - [61, 0.0]
  - - [256, 384, 1, 256]
    - [116, 0.0]
  - - [320, 384, 1, 256]
    - [116, 0.0]
  - - [384, 384, 1, 256]
    - [147, 0.0]
  - - [448, 384, 1, 256]
    - [148, 0.0]
  - - [512, 384, 1, 256]
    - [133, 0.0]
  - - [576, 384, 1, 256]
    - [110, 0.0]
  - - [640, 384, 1, 256]
    - [142, 0.0]
  - - [704, 384, 1, 256]
    - [132, 0.0]
  - - [768, 384, 1, 256]
    - [138, 0.0]
  - - [832, 384, 1, 256]
    - [20, 0.0]
  - - [896, 384, 1, 256]
    - [31, 0.0]
  - - [960, 384, 1, 256]
    - [20, 0.0]
  - - [1024, 384, 1, 256]
    - [31, 0.0]
  - - [64, 448, 1, 256]
    - [128, 0.0]
  - - [128, 448, 1, 256]
    - [15, 0.0]
  - - [192, 448, 1, 256]
    - [61, 0.0]
  - - [256, 448, 1, 256]
    - [136, 0.0]
  - - [320, 448, 1, 256]
    - [149, 0.0]
  - - [384, 448, 1, 256]
    - [20, 0.0]
  - - [448, 448, 1, 256]
    - [61, 0.0]
  - - [512, 448, 1, 256]
    - [133, 0.0]
  - - [576, 448, 1, 256]
    - [31, 0.0]
  - - [640, 448, 1, 256]
    - [20, 0.0]
  - - [704, 448, 1, 256]
    - [20, 0.0]
  - - [768, 448, 1, 256]
    - [20, 0.0]
  - - [832, 448, 1, 256]
    - [20, 0.0]
  - - [896, 448, 1, 256]
    - [23, 0.0]
  - - [960, 448, 1, 256]
    - [150, 0.0]
  - - [1024, 448, 1, 256]
    - [150, 0.0]
  - - [64, 512, 1, 256]
    - [84, 0.0]
  - - [128, 512, 1, 256]
    - [124, 0.0]
  - - [192, 512, 1, 256]
    - [133, 0.0]
  - - [256, 512, 1, 256]
    - [142, 0.0]
  - - [320, 512, 1, 256]
    - [20, 0.0]
  - - [384, 512, 1, 256]
    - [20, 0.0]
  - - [448, 512, 1, 256]
    - [151, 0.0]
  - - [512, 512, 1, 256]
    - [61, 0.0]
  - - [576, 512, 1, 256]
    - [31, 0.0]
  - - [640, 512, 1, 256]
    - [48, 0.0]
  - - [704, 512, 1, 256]
    - [21, 0.0]
  - - [768, 512, 1, 256]
    - [21, 0.0]
  - - [832, 512, 1, 256]
    - [20, 0.0]
  - - [896, 512, 1, 256]
    - [57, 0.0]
  - - [960, 512, 1, 256]
    - [20, 0.0]
  - - [1024, 512, 1, 256]
    - [152, 0.0]
  - - [64, 576, 1, 256]
    - [120, 0.0]
  - - [128, 576, 1, 256]
    - [153, 0.0]
  - - [192, 576, 1, 256]
    - [133, 0.0]
  - - [256, 576, 1, 256]
    - [145, 0.0]
  - - [320, 576, 1, 256]
    - [20, 0.0]
  - - [384, 576, 1, 256]
    - [138, 0.0]
  - - [448, 576, 1, 256]
    - [110, 0.0]
  - - [512, 576, 1, 256]
    - [20, 0.0]
  - - [576, 576, 1, 256]
    - [31, 0.0]
  - - [640, 576, 1, 256]
    - [21, 0.0]
  - - [704, 576, 1, 256]
    - [20, 0.0]
  - - [768, 576, 1, 256]
    - [86, 0.0]
  - - [832, 576, 1, 256]
    - [67, 0.0]
  - - [896, 576, 1, 256]
    - [57, 0.0]
  - - [960, 576, 1, 256]
    - [20, 0.0]
  - - [1024, 576, 1, 256]
    - [154, 0.0]
  - - [64, 640, 1, 256]
    - [155, 0.0]
  - - [128, 640, 1, 256]
    - [12, 0.0]
  - - [192, 640, 1, 256]
    - [156, 0.0]
  - - [256, 640, 1, 256]
    - [134, 0.0]
  - - [320, 640, 1, 256]
    - [133, 0.0]
  - - [384, 640, 1, 256]
    - [138, 0.0]
  - - [448, 640, 1, 256]
    - [44, 0.0]
  - - [512, 640, 1, 256]
    - [20, 0.0]
  - - [576, 640, 1, 256]
    - [20, 0.0]
  - - [640, 640, 1, 256]
    - [20, 0.0]
  - - [704, 640, 1, 256]
    - [73, 0.0]
  - - [768, 640, 1, 256]
    - [73, 0.0]
  - - [832, 640, 1, 256]
    - [67, 0.0]
  - - [896, 640, 1, 256]
    - [157, 0.0]
  - - [960, 640, 1, 256]
    - [158, 0.0]
  - - [1024, 640, 1, 256]
    - [20, 0.0]
  - - [64, 704, 1, 256]
    - [126, 0.0]
  - - [128, 704, 1, 256]
    - [134, 0.0]
  - - [192, 704, 1, 256]
    - [61, 0.0]
  - - [256, 704, 1, 256]
    - [62, 0.0]
  - - [320, 704, 1, 256]
    - [20, 0.0]
  - - [384, 704, 1, 256]
    - [20, 0.0]
  - - [448, 704, 1, 256]
    - [20, 0.0]
  - - [512, 704, 1, 256]
    - [20, 0.0]
  - - [576, 704, 1, 256]
    - [31, 0.0]
  - - [640, 704, 1, 256]
    - [74, 0.0]
  - - [704, 704, 1, 256]
    - [112, 0.0]
  - - [768, 704, 1, 256]
    - [159, 0.0]
  - - [832, 704, 1, 256]
    - [21, 0.0]
  - - [896, 704, 1, 256]
    - [20, 0.0]
  - - [960, 704, 1, 256]
    - [31, 0.0]
  - - [1024, 704, 1, 256]
    - [98, 0.0]
  - - [64, 768, 1, 256]
    - [26, 0.0]
  - - [128, 768, 1, 256]
    - [62, 0.0]
  - - [192, 768, 1, 256]
    - [136, 0.0]
  - - [256, 768, 1, 256]
    - [160, 0.0]
  - - [320, 768, 1, 256]
    - [41, 0.0]
  - - [384, 768, 1, 256]
    - [21, 0.0]
  - - [448, 768, 1, 256]
    - [20, 0.0]
  - - [512, 768, 1, 256]
    - [20, 0.0]
  - - [576, 768, 1, 256]
    - [67, 0.0]
  - - [640, 768, 1, 256]
    - [57, 0.0]
  - - [704, 768, 1, 256]
    - [67, 0.0]
  - - [768, 768, 1, 256]
    - [73, 0.0]
  - - [832, 768, 1, 256]
    - [21, 0.0]
  - - [896, 768, 1, 256]
    - [150, 0.0]
  - - [960, 768, 1, 256]
    - [98, 0.0]
  - - [1024, 768, 1, 256]
    - [73, 0.0]
  - - [64, 832, 1, 256]
    - [122, 0.0]
  - - [128, 832, 1, 256]
    - [138, 0.0]
  - - [192, 832, 1, 256]
    - [133, 0.0]
  - - [256, 832, 1, 256]
    - [161, 0.0]
  - - [320, 832, 1, 256]
    - [20, 0.0]
  - - [384, 832, 1, 256]
    - [20, 0.0]
  - - [448, 832, 1, 256]
    - [31, 0.0]
  - - [512, 832, 1, 256]
    - [150, 0.0]
  - - [576, 832, 1, 256]
    - [67, 0.0]
  - - [640, 832, 1, 256]
    - [57, 0.0]
  - - [704, 832, 1, 256]
    - [20, 0.0]
  - - [768, 832, 1, 256]
    - [21, 0.0]
  - - [832, 832, 1, 256]
    - [67, 0.0]
  - - [896, 832, 1, 256]
    - [74, 0.0]
  - - [960, 832, 1, 256]
    - [62, 0.0]
  - - [1024, 832, 1, 256]
    - [41, 0.0]
  - - [64, 896, 1, 256]
    - [26, 0.0]
  - - [128, 896, 1, 256]
    - [134, 0.0]
  - - [192, 896, 1, 256]
    - [62, 0.0]
  - - [256, 896, 1, 256]
    - [142, 0.0]
  - - [320, 896, 1, 256]
    - [136, 0.0]
  - - [384, 896, 1, 256]
    - [20, 0.0]
  - - [448, 896, 1, 256]
    - [65, 0.0]
  - - [512, 896, 1, 256]
    - [67, 0.0]
  - - [576, 896, 1, 256]
    - [73, 0.0]
  - - [640, 896, 1, 256]
    - [157, 0.0]
  - - [704, 896, 1, 256]
    - [73, 0.0]
  - - [768, 896, 1, 256]
    - [73, 0.0]
  - - [832, 896, 1, 256]
    - [73, 0.0]
  - - [896, 896, 1, 256]
    - [162, 0.0]
  - - [960, 896, 1, 256]
    - [163, 0.0]
  - - [1024, 896, 1, 256]
    - [116, 0.0]
  - - [64, 960, 1, 256]
    - [15, 0.0]
  - - [128, 960, 1, 256]
    - [133, 0.0]
  - - [192, 960, 1, 256]
    - [133, 0.0]
  - - [256, 960, 1, 256]
    - [133, 0.0]
  - - [320, 960, 1, 256]
    - [20, 0.0]
  - - [384, 960, 1, 256]
    - [21, 0.0]
  - - [448, 960, 1, 256]
    - [20, 0.0]
  - - [512, 960, 1, 256]
    - [150, 0.0]
  - - [576, 960, 1, 256]
    - [73, 0.0]
  - - [640, 960, 1, 256]
    - [57, 0.0]
  - - [704, 960, 1, 256]
    - [31, 0.0]
  - - [768, 960, 1, 256]
    - [108, 0.0]
  - - [832, 960, 1, 256]
    - [163, 0.0]
  - - [896, 960, 1, 256]
    - [62, 0.0]
  - - [960, 960, 1, 256]
    - [62, 0.0]
  - - [1024, 960, 1, 256]
    - [61, 0.0]
  - - [64, 1024, 1, 256]
    - [126, 0.0]
  - - [128, 1024, 1, 256]
    - [133, 0.0]
  - - [192, 1024, 1, 256]
    - [62, 0.0]
  - - [256, 1024, 1, 256]
    - [116, 0.0]
  - - [320, 1024, 1, 256]
    - [20, 0.0]
  - - [384, 1024, 1, 256]
    - [20, 0.0]
  - - [448, 1024, 1, 256]
    - [82, 0.0]
  - - [512, 1024, 1, 256]
    - [164, 0.0]
  - - [576, 1024, 1, 256]
    - [165, 0.0]
  - - [640, 1024, 1, 256]
    - [20, 0.0]
  - - [704, 1024, 1, 256]
    - [150, 0.0]
  - - [768, 1024, 1, 256]
    - [166, 0.0]
  - - [832, 1024, 1, 256]
    - [163, 0.0]
  - - [896, 1024, 1, 256]
    - [62, 0.0]
  - - [960, 1024, 1, 256]
    - [167, 0.0]
  - - [1024, 1024, 1, 256]
    - [61, 0.0]
  - - [128, 64, 1, 512]
    - [124, 0.0]
  - - [192, 64, 1, 512]
    - [126, 0.0]
  - - [256, 64, 1, 512]
    - [128, 0.0]
  - - [320, 64, 1, 512]
    - [124, 0.0]
  - - [384, 64, 1, 512]
    - [131, 0.0]
  - - [448, 64, 1, 512]
    - [131, 0.0]
  - - [512, 64, 1, 512]
    - [168, 0.0]
  - - [576, 64, 1, 512]
    - [407, 0.0]
  - - [640, 64, 1, 512]
    - [169, 0.0]
  - - [704, 64, 1, 512]
    - [139, 0.0]
  - - [768, 64, 1, 512]
    - [126, 0.0]
  - - [832, 64, 1, 512]
    - [139, 0.0]
  - - [896, 64, 1, 512]
    - [12, 0.0]
  - - [960, 64, 1, 512]
    - [170, 0.0]
  - - [1024, 64, 1, 512]
    - [139, 0.0]
  - - [64, 128, 1, 512]
    - [171, 0.0]
  - - [128, 128, 1, 512]
    - [131, 0.0]
  - - [192, 128, 1, 512]
    - [172, 0.0]
  - - [256, 128, 1, 512]
    - [139, 0.0]
  - - [320, 128, 1, 512]
    - [139, 0.0]
  - - [384, 128, 1, 512]
    - [168, 0.0]
  - - [448, 128, 1, 512]
    - [173, 0.0]
  - - [512, 128, 1, 512]
    - [174, 0.0]
  - - [576, 128, 1, 512]
    - [133, 0.0]
  - - [640, 128, 1, 512]
    - [138, 0.0]
  - - [704, 128, 1, 512]
    - [136, 0.0]
  - - [768, 128, 1, 512]
    - [136, 0.0]
  - - [832, 128, 1, 512]
    - [116, 0.0]
  - - [896, 128, 1, 512]
    - [138, 0.0]
  - - [960, 128, 1, 512]
    - [133, 0.0]
  - - [1024, 128, 1, 512]
    - [138, 0.0]
  - - [64, 192, 1, 512]
    - [175, 0.0]
  - - [128, 192, 1, 512]
    - [124, 0.0]
  - - [192, 192, 1, 512]
    - [130, 0.0]
  - - [256, 192, 1, 512]
    - [138, 0.0]
  - - [320, 192, 1, 512]
    - [26, 0.0]
  - - [384, 192, 1, 512]
    - [138, 0.0]
  - - [448, 192, 1, 512]
    - [133, 0.0]
  - - [512, 192, 1, 512]
    - [134, 0.0]
  - - [576, 192, 1, 512]
    - [62, 0.0]
  - - [640, 192, 1, 512]
    - [138, 0.0]
  - - [704, 192, 1, 512]
    - [145, 0.0]
  - - [768, 192, 1, 512]
    - [134, 0.0]
  - - [832, 192, 1, 512]
    - [20, 0.0]
  - - [896, 192, 1, 512]
    - [134, 0.0]
  - - [960, 192, 1, 512]
    - [136, 0.0]
  - - [1024, 192, 1, 512]
    - [138, 0.0]
  - - [64, 256, 1, 512]
    - [125, 0.0]
  - - [128, 256, 1, 512]
    - [128, 0.0]
  - - [192, 256, 1, 512]
    - [163, 0.0]
  - - [256, 256, 1, 512]
    - [176, 0.0]
  - - [320, 256, 1, 512]
    - [133, 0.0]
  - - [384, 256, 1, 512]
    - [133, 0.0]
  - - [448, 256, 1, 512]
    - [132, 0.0]
  - - [512, 256, 1, 512]
    - [142, 0.0]
  - - [576, 256, 1, 512]
    - [136, 0.0]
  - - [640, 256, 1, 512]
    - [133, 0.0]
  - - [704, 256, 1, 512]
    - [133, 0.0]
  - - [768, 256, 1, 512]
    - [116, 0.0]
  - - [832, 256, 1, 512]
    - [61, 0.0]
  - - [896, 256, 1, 512]
    - [138, 0.0]
  - - [960, 256, 1, 512]
    - [44, 0.0]
  - - [1024, 256, 1, 512]
    - [133, 0.0]
  - - [64, 320, 1, 512]
    - [177, 0.0]
  - - [128, 320, 1, 512]
    - [178, 0.0]
  - - [192, 320, 1, 512]
    - [179, 0.0]
  - - [256, 320, 1, 512]
    - [138, 0.0]
  - - [320, 320, 1, 512]
    - [136, 0.0]
  - - [384, 320, 1, 512]
    - [134, 0.0]
  - - [448, 320, 1, 512]
    - [62, 0.0]
  - - [512, 320, 1, 512]
    - [116, 0.0]
  - - [576, 320, 1, 512]
    - [20, 0.0]
  - - [640, 320, 1, 512]
    - [138, 0.0]
  - - [704, 320, 1, 512]
    - [20, 0.0]
  - - [768, 320, 1, 512]
    - [134, 0.0]
  - - [832, 320, 1, 512]
    - [116, 0.0]
  - - [896, 320, 1, 512]
    - [48, 0.0]
  - - [960, 320, 1, 512]
    - [20, 0.0]
  - - [1024, 320, 1, 512]
    - [48, 0.0]
  - - [64, 384, 1, 512]
    - [120, 0.0]
  - - [128, 384, 1, 512]
    - [146, 0.0]
  - - [192, 384, 1, 512]
    - [180, 0.0]
  - - [256, 384, 1, 512]
    - [134, 0.0]
  - - [320, 384, 1, 512]
    - [133, 0.0]
  - - [384, 384, 1, 512]
    - [138, 0.0]
  - - [448, 384, 1, 512]
    - [149, 0.0]
  - - [512, 384, 1, 512]
    - [133, 0.0]
  - - [576, 384, 1, 512]
    - [133, 0.0]
  - - [640, 384, 1, 512]
    - [138, 0.0]
  - - [704, 384, 1, 512]
    - [136, 0.0]
  - - [768, 384, 1, 512]
    - [19, 0.0]
  - - [832, 384, 1, 512]
    - [20, 0.0]
  - - [896, 384, 1, 512]
    - [19, 0.0]
  - - [960, 384, 1, 512]
    - [20, 0.0]
  - - [1024, 384, 1, 512]
    - [181, 0.0]
  - - [64, 448, 1, 512]
    - [146, 0.0]
  - - [128, 448, 1, 512]
    - [130, 0.0]
  - - [192, 448, 1, 512]
    - [136, 0.0]
  - - [256, 448, 1, 512]
    - [138, 0.0]
  - - [320, 448, 1, 512]
    - [62, 0.0]
  - - [384, 448, 1, 512]
    - [20, 0.0]
  - - [448, 448, 1, 512]
    - [44, 0.0]
  - - [512, 448, 1, 512]
    - [136, 0.0]
  - - [576, 448, 1, 512]
    - [20, 0.0]
  - - [640, 448, 1, 512]
    - [78, 0.0]
  - - [704, 448, 1, 512]
    - [20, 0.0]
  - - [768, 448, 1, 512]
    - [20, 0.0]
  - - [832, 448, 1, 512]
    - [21, 0.0]
  - - [896, 448, 1, 512]
    - [20, 0.0]
  - - [960, 448, 1, 512]
    - [150, 0.0]
  - - [1024, 448, 1, 512]
    - [112, 0.0]
  - - [64, 512, 1, 512]
    - [128, 0.0]
  - - [128, 512, 1, 512]
    - [178, 0.0]
  - - [192, 512, 1, 512]
    - [132, 0.0]
  - - [256, 512, 1, 512]
    - [134, 0.0]
  - - [320, 512, 1, 512]
    - [161, 0.0]
  - - [384, 512, 1, 512]
    - [134, 0.0]
  - - [448, 512, 1, 512]
    - [138, 0.0]
  - - [512, 512, 1, 512]
    - [61, 0.0]
  - - [576, 512, 1, 512]
    - [20, 0.0]
  - - [640, 512, 1, 512]
    - [48, 0.0]
  - - [704, 512, 1, 512]
    - [31, 0.0]
  - - [768, 512, 1, 512]
    - [31, 0.0]
  - - [832, 512, 1, 512]
    - [21, 0.0]
  - - [896, 512, 1, 512]
    - [57, 0.0]
  - - [960, 512, 1, 512]
    - [182, 0.0]
  - - [1024, 512, 1, 512]
    - [183, 0.0]
  - - [64, 576, 1, 512]
    - [408, 0.0]
  - - [128, 576, 1, 512]
    - [134, 0.0]
  - - [192, 576, 1, 512]
    - [133, 0.0]
  - - [256, 576, 1, 512]
    - [156, 0.0]
  - - [320, 576, 1, 512]
    - [20, 0.0]
  - - [384, 576, 1, 512]
    - [184, 0.0]
  - - [448, 576, 1, 512]
    - [21, 0.0]
  - - [512, 576, 1, 512]
    - [20, 0.0]
  - - [576, 576, 1, 512]
    - [409, 0.0]
  - - [640, 576, 1, 512]
    - [20, 0.0]
  - - [704, 576, 1, 512]
    - [31, 0.0]
  - - [768, 576, 1, 512]
    - [20, 0.0]
  - - [832, 576, 1, 512]
    - [20, 0.0]
  - - [896, 576, 1, 512]
    - [57, 0.0]
  - - [960, 576, 1, 512]
    - [31, 0.0]
  - - [1024, 576, 1, 512]
    - [166, 0.0]
  - - [64, 640, 1, 512]
    - [177, 0.0]
  - - [128, 640, 1, 512]
    - [134, 0.0]
  - - [192, 640, 1, 512]
    - [133, 0.0]
  - - [256, 640, 1, 512]
    - [44, 0.0]
  - - [320, 640, 1, 512]
    - [20, 0.0]
  - - [384, 640, 1, 512]
    - [133, 0.0]
  - - [448, 640, 1, 512]
    - [133, 0.0]
  - - [512, 640, 1, 512]
    - [44, 0.0]
  - - [576, 640, 1, 512]
    - [21, 0.0]
  - - [640, 640, 1, 512]
    - [20, 0.0]
  - - [704, 640, 1, 512]
    - [44, 0.0]
  - - [768, 640, 1, 512]
    - [48, 0.0]
  - - [832, 640, 1, 512]
    - [82, 0.0]
  - - [896, 640, 1, 512]
    - [73, 0.0]
  - - [960, 640, 1, 512]
    - [21, 0.0]
  - - [1024, 640, 1, 512]
    - [48, 0.0]
  - - [64, 704, 1, 512]
    - [185, 0.0]
  - - [128, 704, 1, 512]
    - [136, 0.0]
  - - [192, 704, 1, 512]
    - [133, 0.0]
  - - [256, 704, 1, 512]
    - [134, 0.0]
  - - [320, 704, 1, 512]
    - [136, 0.0]
  - - [384, 704, 1, 512]
    - [186, 0.0]
  - - [448, 704, 1, 512]
    - [20, 0.0]
  - - [512, 704, 1, 512]
    - [20, 0.0]
  - - [576, 704, 1, 512]
    - [31, 0.0]
  - - [640, 704, 1, 512]
    - [57, 0.0]
  - - [704, 704, 1, 512]
    - [21, 0.0]
  - - [768, 704, 1, 512]
    - [74, 0.0]
  - - [832, 704, 1, 512]
    - [20, 0.0]
  - - [896, 704, 1, 512]
    - [31, 0.0]
  - - [960, 704, 1, 512]
    - [31, 0.0]
  - - [1024, 704, 1, 512]
    - [73, 0.0]
  - - [64, 768, 1, 512]
    - [130, 0.0]
  - - [128, 768, 1, 512]
    - [134, 0.0]
  - - [192, 768, 1, 512]
    - [149, 0.0]
  - - [256, 768, 1, 512]
    - [163, 0.0]
  - - [320, 768, 1, 512]
    - [133, 0.0]
  - - [384, 768, 1, 512]
    - [20, 0.0]
  - - [448, 768, 1, 512]
    - [20, 0.0]
  - - [512, 768, 1, 512]
    - [20, 0.0]
  - - [576, 768, 1, 512]
    - [67, 0.0]
  - - [640, 768, 1, 512]
    - [187, 0.0]
  - - [704, 768, 1, 512]
    - [67, 0.0]
  - - [768, 768, 1, 512]
    - [21, 0.0]
  - - [832, 768, 1, 512]
    - [44, 0.0]
  - - [896, 768, 1, 512]
    - [98, 0.0]
  - - [960, 768, 1, 512]
    - [74, 0.0]
  - - [1024, 768, 1, 512]
    - [74, 0.0]
  - - [64, 832, 1, 512]
    - [130, 0.0]
  - - [128, 832, 1, 512]
    - [138, 0.0]
  - - [192, 832, 1, 512]
    - [20, 0.0]
  - - [256, 832, 1, 512]
    - [138, 0.0]
  - - [320, 832, 1, 512]
    - [20, 0.0]
  - - [384, 832, 1, 512]
    - [20, 0.0]
  - - [448, 832, 1, 512]
    - [21, 0.0]
  - - [512, 832, 1, 512]
    - [20, 0.0]
  - - [576, 832, 1, 512]
    - [67, 0.0]
  - - [640, 832, 1, 512]
    - [152, 0.0]
  - - [704, 832, 1, 512]
    - [31, 0.0]
  - - [768, 832, 1, 512]
    - [20, 0.0]
  - - [832, 832, 1, 512]
    - [73, 0.0]
  - - [896, 832, 1, 512]
    - [74, 0.0]
  - - [960, 832, 1, 512]
    - [163, 0.0]
  - - [1024, 832, 1, 512]
    - [188, 0.0]
  - - [64, 896, 1, 512]
    - [180, 0.0]
  - - [128, 896, 1, 512]
    - [133, 0.0]
  - - [192, 896, 1, 512]
    - [189, 0.0]
  - - [256, 896, 1, 512]
    - [138, 0.0]
  - - [320, 896, 1, 512]
    - [21, 0.0]
  - - [384, 896, 1, 512]
    - [21, 0.0]
  - - [448, 896, 1, 512]
    - [31, 0.0]
  - - [512, 896, 1, 512]
    - [187, 0.0]
  - - [576, 896, 1, 512]
    - [67, 0.0]
  - - [640, 896, 1, 512]
    - [190, 0.0]
  - - [704, 896, 1, 512]
    - [20, 0.0]
  - - [768, 896, 1, 512]
    - [191, 0.0]
  - - [832, 896, 1, 512]
    - [82, 0.0]
  - - [896, 896, 1, 512]
    - [67, 0.0]
  - - [960, 896, 1, 512]
    - [163, 0.0]
  - - [1024, 896, 1, 512]
    - [192, 0.0]
  - - [64, 960, 1, 512]
    - [128, 0.0]
  - - [128, 960, 1, 512]
    - [133, 0.0]
  - - [192, 960, 1, 512]
    - [133, 0.0]
  - - [256, 960, 1, 512]
    - [138, 0.0]
  - - [320, 960, 1, 512]
    - [20, 0.0]
  - - [384, 960, 1, 512]
    - [20, 0.0]
  - - [448, 960, 1, 512]
    - [20, 0.0]
  - - [512, 960, 1, 512]
    - [150, 0.0]
  - - [576, 960, 1, 512]
    - [21, 0.0]
  - - [640, 960, 1, 512]
    - [31, 0.0]
  - - [704, 960, 1, 512]
    - [21, 0.0]
  - - [768, 960, 1, 512]
    - [67, 0.0]
  - - [832, 960, 1, 512]
    - [163, 0.0]
  - - [896, 960, 1, 512]
    - [188, 0.0]
  - - [960, 960, 1, 512]
    - [167, 0.0]
  - - [1024, 960, 1, 512]
    - [188, 0.0]
  - - [64, 1024, 1, 512]
    - [131, 0.0]
  - - [128, 1024, 1, 512]
    - [142, 0.0]
  - - [192, 1024, 1, 512]
    - [148, 0.0]
  - - [256, 1024, 1, 512]
    - [134, 0.0]
  - - [320, 1024, 1, 512]
    - [20, 0.0]
  - - [384, 1024, 1, 512]
    - [20, 0.0]
  - - [448, 1024, 1, 512]
    - [67, 0.0]
  - - [512, 1024, 1, 512]
    - [67, 0.0]
  - - [576, 1024, 1, 512]
    - [112, 0.0]
  - - [640, 1024, 1, 512]
    - [44, 0.0]
  - - [704, 1024, 1, 512]
    - [73, 0.0]
  - - [768, 1024, 1, 512]
    - [98, 0.0]
  - - [832, 1024, 1, 512]
    - [163, 0.0]
  - - [896, 1024, 1, 512]
    - [163, 0.0]
  - - [960, 1024, 1, 512]
    - [62, 0.0]
  - - [1024, 1024, 1, 512]
    - [61, 0.0]
  - - [128, 64, 1, 1024]
    - [128, 0.0]
  - - [192, 64, 1, 1024]
    - [193, 0.0]
  - - [256, 64, 1, 1024]
    - [125, 0.0]
  - - [320, 64, 1, 1024]
    - [131, 0.0]
  - - [384, 64, 1, 1024]
    - [169, 0.0]
  - - [448, 64, 1, 1024]
    - [170, 0.0]
  - - [512, 64, 1, 1024]
    - [123, 0.0]
  - - [576, 64, 1, 1024]
    - [193, 0.0]
  - - [640, 64, 1, 1024]
    - [169, 0.0]
  - - [704, 64, 1, 1024]
    - [169, 0.0]
  - - [768, 64, 1, 1024]
    - [170, 0.0]
  - - [832, 64, 1, 1024]
    - [139, 0.0]
  - - [896, 64, 1, 1024]
    - [170, 0.0]
  - - [960, 64, 1, 1024]
    - [139, 0.0]
  - - [1024, 64, 1, 1024]
    - [170, 0.0]
  - - [64, 128, 1, 1024]
    - [128, 0.0]
  - - [128, 128, 1, 1024]
    - [125, 0.0]
  - - [192, 128, 1, 1024]
    - [130, 0.0]
  - - [256, 128, 1, 1024]
    - [128, 0.0]
  - - [320, 128, 1, 1024]
    - [128, 0.0]
  - - [384, 128, 1, 1024]
    - [170, 0.0]
  - - [448, 128, 1, 1024]
    - [170, 0.0]
  - - [512, 128, 1, 1024]
    - [179, 0.0]
  - - [576, 128, 1, 1024]
    - [11, 0.0]
  - - [640, 128, 1, 1024]
    - [138, 0.0]
  - - [704, 128, 1, 1024]
    - [133, 0.0]
  - - [768, 128, 1, 1024]
    - [142, 0.0]
  - - [832, 128, 1, 1024]
    - [133, 0.0]
  - - [896, 128, 1, 1024]
    - [134, 0.0]
  - - [960, 128, 1, 1024]
    - [133, 0.0]
  - - [1024, 128, 1, 1024]
    - [142, 0.0]
  - - [64, 192, 1, 1024]
    - [129, 0.0]
  - - [128, 192, 1, 1024]
    - [169, 0.0]
  - - [192, 192, 1, 1024]
    - [170, 0.0]
  - - [256, 192, 1, 1024]
    - [170, 0.0]
  - - [320, 192, 1, 1024]
    - [175, 0.0]
  - - [384, 192, 1, 1024]
    - [134, 0.0]
  - - [448, 192, 1, 1024]
    - [133, 0.0]
  - - [512, 192, 1, 1024]
    - [134, 0.0]
  - - [576, 192, 1, 1024]
    - [62, 0.0]
  - - [640, 192, 1, 1024]
    - [142, 0.0]
  - - [704, 192, 1, 1024]
    - [145, 0.0]
  - - [768, 192, 1, 1024]
    - [134, 0.0]
  - - [832, 192, 1, 1024]
    - [145, 0.0]
  - - [896, 192, 1, 1024]
    - [149, 0.0]
  - - [960, 192, 1, 1024]
    - [148, 0.0]
  - - [1024, 192, 1, 1024]
    - [136, 0.0]
  - - [64, 256, 1, 1024]
    - [194, 0.0]
  - - [128, 256, 1, 1024]
    - [170, 0.0]
  - - [192, 256, 1, 1024]
    - [176, 0.0]
  - - [256, 256, 1, 1024]
    - [195, 0.0]
  - - [320, 256, 1, 1024]
    - [132, 0.0]
  - - [384, 256, 1, 1024]
    - [142, 0.0]
  - - [448, 256, 1, 1024]
    - [136, 0.0]
  - - [512, 256, 1, 1024]
    - [133, 0.0]
  - - [576, 256, 1, 1024]
    - [136, 0.0]
  - - [640, 256, 1, 1024]
    - [196, 0.0]
  - - [704, 256, 1, 1024]
    - [133, 0.0]
  - - [768, 256, 1, 1024]
    - [133, 0.0]
  - - [832, 256, 1, 1024]
    - [136, 0.0]
  - - [896, 256, 1, 1024]
    - [134, 0.0]
  - - [960, 256, 1, 1024]
    - [136, 0.0]
  - - [1024, 256, 1, 1024]
    - [136, 0.0]
  - - [64, 320, 1, 1024]
    - [129, 0.0]
  - - [128, 320, 1, 1024]
    - [180, 0.0]
  - - [192, 320, 1, 1024]
    - [128, 0.0]
  - - [256, 320, 1, 1024]
    - [142, 0.0]
  - - [320, 320, 1, 1024]
    - [133, 0.0]
  - - [384, 320, 1, 1024]
    - [138, 0.0]
  - - [448, 320, 1, 1024]
    - [197, 0.0]
  - - [512, 320, 1, 1024]
    - [198, 0.0]
  - - [576, 320, 1, 1024]
    - [132, 0.0]
  - - [640, 320, 1, 1024]
    - [134, 0.0]
  - - [704, 320, 1, 1024]
    - [199, 0.0]
  - - [768, 320, 1, 1024]
    - [138, 0.0]
  - - [832, 320, 1, 1024]
    - [116, 0.0]
  - - [896, 320, 1, 1024]
    - [20, 0.0]
  - - [960, 320, 1, 1024]
    - [20, 0.0]
  - - [1024, 320, 1, 1024]
    - [20, 0.0]
  - - [64, 384, 1, 1024]
    - [128, 0.0]
  - - [128, 384, 1, 1024]
    - [168, 0.0]
  - - [192, 384, 1, 1024]
    - [132, 0.0]
  - - [256, 384, 1, 1024]
    - [133, 0.0]
  - - [320, 384, 1, 1024]
    - [132, 0.0]
  - - [384, 384, 1, 1024]
    - [196, 0.0]
  - - [448, 384, 1, 1024]
    - [132, 0.0]
  - - [512, 384, 1, 1024]
    - [136, 0.0]
  - - [576, 384, 1, 1024]
    - [136, 0.0]
  - - [640, 384, 1, 1024]
    - [136, 0.0]
  - - [704, 384, 1, 1024]
    - [20, 0.0]
  - - [768, 384, 1, 1024]
    - [200, 0.0]
  - - [832, 384, 1, 1024]
    - [20, 0.0]
  - - [896, 384, 1, 1024]
    - [20, 0.0]
  - - [960, 384, 1, 1024]
    - [20, 0.0]
  - - [1024, 384, 1, 1024]
    - [20, 0.0]
  - - [64, 448, 1, 1024]
    - [128, 0.0]
  - - [128, 448, 1, 1024]
    - [130, 0.0]
  - - [192, 448, 1, 1024]
    - [133, 0.0]
  - - [256, 448, 1, 1024]
    - [138, 0.0]
  - - [320, 448, 1, 1024]
    - [62, 0.0]
  - - [384, 448, 1, 1024]
    - [201, 0.0]
  - - [448, 448, 1, 1024]
    - [136, 0.0]
  - - [512, 448, 1, 1024]
    - [132, 0.0]
  - - [576, 448, 1, 1024]
    - [135, 0.0]
  - - [640, 448, 1, 1024]
    - [20, 0.0]
  - - [704, 448, 1, 1024]
    - [20, 0.0]
  - - [768, 448, 1, 1024]
    - [44, 0.0]
  - - [832, 448, 1, 1024]
    - [20, 0.0]
  - - [896, 448, 1, 1024]
    - [85, 0.0]
  - - [960, 448, 1, 1024]
    - [21, 0.0]
  - - [1024, 448, 1, 1024]
    - [20, 0.0]
  - - [64, 512, 1, 1024]
    - [128, 0.0]
  - - [128, 512, 1, 1024]
    - [130, 0.0]
  - - [192, 512, 1, 1024]
    - [62, 0.0]
  - - [256, 512, 1, 1024]
    - [142, 0.0]
  - - [320, 512, 1, 1024]
    - [202, 0.0]
  - - [384, 512, 1, 1024]
    - [134, 0.0]
  - - [448, 512, 1, 1024]
    - [184, 0.0]
  - - [512, 512, 1, 1024]
    - [61, 0.0]
  - - [576, 512, 1, 1024]
    - [181, 0.0]
  - - [640, 512, 1, 1024]
    - [20, 0.0]
  - - [704, 512, 1, 1024]
    - [31, 0.0]
  - - [768, 512, 1, 1024]
    - [20, 0.0]
  - - [832, 512, 1, 1024]
    - [20, 0.0]
  - - [896, 512, 1, 1024]
    - [48, 0.0]
  - - [960, 512, 1, 1024]
    - [57, 0.0]
  - - [1024, 512, 1, 1024]
    - [203, 0.0]
  - - [64, 576, 1, 1024]
    - [177, 0.0]
  - - [128, 576, 1, 1024]
    - [198, 0.0]
  - - [192, 576, 1, 1024]
    - [132, 0.0]
  - - [256, 576, 1, 1024]
    - [145, 0.0]
  - - [320, 576, 1, 1024]
    - [20, 0.0]
  - - [384, 576, 1, 1024]
    - [110, 0.0]
  - - [448, 576, 1, 1024]
    - [116, 0.0]
  - - [512, 576, 1, 1024]
    - [116, 0.0]
  - - [576, 576, 1, 1024]
    - [20, 0.0]
  - - [640, 576, 1, 1024]
    - [116, 0.0]
  - - [704, 576, 1, 1024]
    - [21, 0.0]
  - - [768, 576, 1, 1024]
    - [116, 0.0]
  - - [832, 576, 1, 1024]
    - [21, 0.0]
  - - [896, 576, 1, 1024]
    - [116, 0.0]
  - - [960, 576, 1, 1024]
    - [20, 0.0]
  - - [1024, 576, 1, 1024]
    - [204, 0.0]
  - - [64, 640, 1, 1024]
    - [185, 0.0]
  - - [128, 640, 1, 1024]
    - [145, 0.0]
  - - [192, 640, 1, 1024]
    - [145, 0.0]
  - - [256, 640, 1, 1024]
    - [132, 0.0]
  - - [320, 640, 1, 1024]
    - [205, 0.0]
  - - [384, 640, 1, 1024]
    - [198, 0.0]
  - - [448, 640, 1, 1024]
    - [116, 0.0]
  - - [512, 640, 1, 1024]
    - [116, 0.0]
  - - [576, 640, 1, 1024]
    - [161, 0.0]
  - - [640, 640, 1, 1024]
    - [158, 0.0]
  - - [704, 640, 1, 1024]
    - [116, 0.0]
  - - [768, 640, 1, 1024]
    - [158, 0.0]
  - - [832, 640, 1, 1024]
    - [62, 0.0]
  - - [896, 640, 1, 1024]
    - [114, 0.0]
  - - [960, 640, 1, 1024]
    - [158, 0.0]
  - - [1024, 640, 1, 1024]
    - [158, 0.0]
  - - [64, 704, 1, 1024]
    - [128, 0.0]
  - - [128, 704, 1, 1024]
    - [198, 0.0]
  - - [192, 704, 1, 1024]
    - [116, 0.0]
  - - [256, 704, 1, 1024]
    - [206, 0.0]
  - - [320, 704, 1, 1024]
    - [133, 0.0]
  - - [384, 704, 1, 1024]
    - [161, 0.0]
  - - [448, 704, 1, 1024]
    - [20, 0.0]
  - - [512, 704, 1, 1024]
    - [62, 0.0]
  - - [576, 704, 1, 1024]
    - [20, 0.0]
  - - [640, 704, 1, 1024]
    - [207, 0.0]
  - - [704, 704, 1, 1024]
    - [20, 0.0]
  - - [768, 704, 1, 1024]
    - [114, 0.0]
  - - [832, 704, 1, 1024]
    - [181, 0.0]
  - - [896, 704, 1, 1024]
    - [204, 0.0]
  - - [960, 704, 1, 1024]
    - [20, 0.0]
  - - [1024, 704, 1, 1024]
    - [112, 0.0]
  - - [64, 768, 1, 1024]
    - [146, 0.0]
  - - [128, 768, 1, 1024]
    - [198, 0.0]
  - - [192, 768, 1, 1024]
    - [136, 0.0]
  - - [256, 768, 1, 1024]
    - [198, 0.0]
  - - [320, 768, 1, 1024]
    - [194, 0.0]
  - - [384, 768, 1, 1024]
    - [161, 0.0]
  - - [448, 768, 1, 1024]
    - [62, 0.0]
  - - [512, 768, 1, 1024]
    - [161, 0.0]
  - - [576, 768, 1, 1024]
    - [116, 0.0]
  - - [640, 768, 1, 1024]
    - [208, 0.0]
  - - [704, 768, 1, 1024]
    - [204, 0.0]
  - - [768, 768, 1, 1024]
    - [116, 0.0]
  - - [832, 768, 1, 1024]
    - [204, 0.0]
  - - [896, 768, 1, 1024]
    - [79, 0.0]
  - - [960, 768, 1, 1024]
    - [204, 0.0]
  - - [1024, 768, 1, 1024]
    - [209, 0.0]
  - - [64, 832, 1, 1024]
    - [210, 0.0]
  - - [128, 832, 1, 1024]
    - [198, 0.0]
  - - [192, 832, 1, 1024]
    - [149, 0.0]
  - - [256, 832, 1, 1024]
    - [62, 0.0]
  - - [320, 832, 1, 1024]
    - [20, 0.0]
  - - [384, 832, 1, 1024]
    - [61, 0.0]
  - - [448, 832, 1, 1024]
    - [20, 0.0]
  - - [512, 832, 1, 1024]
    - [161, 0.0]
  - - [576, 832, 1, 1024]
    - [20, 0.0]
  - - [640, 832, 1, 1024]
    - [207, 0.0]
  - - [704, 832, 1, 1024]
    - [211, 0.0]
  - - [768, 832, 1, 1024]
    - [114, 0.0]
  - - [832, 832, 1, 1024]
    - [181, 0.0]
  - - [896, 832, 1, 1024]
    - [207, 0.0]
  - - [960, 832, 1, 1024]
    - [20, 0.0]
  - - [1024, 832, 1, 1024]
    - [83, 0.0]
  - - [64, 896, 1, 1024]
    - [128, 0.0]
  - - [128, 896, 1, 1024]
    - [198, 0.0]
  - - [192, 896, 1, 1024]
    - [135, 0.0]
  - - [256, 896, 1, 1024]
    - [116, 0.0]
  - - [320, 896, 1, 1024]
    - [116, 0.0]
  - - [384, 896, 1, 1024]
    - [116, 0.0]
  - - [448, 896, 1, 1024]
    - [158, 0.0]
  - - [512, 896, 1, 1024]
    - [158, 0.0]
  - - [576, 896, 1, 1024]
    - [158, 0.0]
  - - [640, 896, 1, 1024]
    - [114, 0.0]
  - - [704, 896, 1, 1024]
    - [158, 0.0]
  - - [768, 896, 1, 1024]
    - [112, 0.0]
  - - [832, 896, 1, 1024]
    - [112, 0.0]
  - - [896, 896, 1, 1024]
    - [83, 0.0]
  - - [960, 896, 1, 1024]
    - [112, 0.0]
  - - [1024, 896, 1, 1024]
    - [209, 0.0]
  - - [64, 960, 1, 1024]
    - [180, 0.0]
  - - [128, 960, 1, 1024]
    - [198, 0.0]
  - - [192, 960, 1, 1024]
    - [133, 0.0]
  - - [256, 960, 1, 1024]
    - [136, 0.0]
  - - [320, 960, 1, 1024]
    - [20, 0.0]
  - - [384, 960, 1, 1024]
    - [136, 0.0]
  - - [448, 960, 1, 1024]
    - [31, 0.0]
  - - [512, 960, 1, 1024]
    - [212, 0.0]
  - - [576, 960, 1, 1024]
    - [20, 0.0]
  - - [640, 960, 1, 1024]
    - [112, 0.0]
  - - [704, 960, 1, 1024]
    - [21, 0.0]
  - - [768, 960, 1, 1024]
    - [187, 0.0]
  - - [832, 960, 1, 1024]
    - [20, 0.0]
  - - [896, 960, 1, 1024]
    - [83, 0.0]
  - - [960, 960, 1, 1024]
    - [62, 0.0]
  - - [1024, 960, 1, 1024]
    - [209, 0.0]
  - - [64, 1024, 1, 1024]
    - [213, 0.0]
  - - [128, 1024, 1, 1024]
    - [194, 0.0]
  - - [192, 1024, 1, 1024]
    - [133, 0.0]
  - - [256, 1024, 1, 1024]
    - [110, 0.0]
  - - [320, 1024, 1, 1024]
    - [62, 0.0]
  - - [384, 1024, 1, 1024]
    - [62, 0.0]
  - - [448, 1024, 1, 1024]
    - [161, 0.0]
  - - [512, 1024, 1, 1024]
    - [214, 0.0]
  - - [576, 1024, 1, 1024]
    - [61, 0.0]
  - - [640, 1024, 1, 1024]
    - [61, 0.0]
  - - [704, 1024, 1, 1024]
    - [204, 0.0]
  - - [768, 1024, 1, 1024]
    - [215, 0.0]
  - - [832, 1024, 1, 1024]
    - [204, 0.0]
  - - [896, 1024, 1, 1024]
    - [216, 0.0]
  - - [960, 1024, 1, 1024]
    - [152, 0.0]
  - - [1024, 1024, 1, 1024]
    - [116, 0.0]
  - - [128, 64, 1, 2048]
    - [217, 0.0]
  - - [192, 64, 1, 2048]
    - [175, 0.0]
  - - [256, 64, 1, 2048]
    - [177, 0.0]
  - - [320, 64, 1, 2048]
    - [169, 0.0]
  - - [384, 64, 1, 2048]
    - [185, 0.0]
  - - [448, 64, 1, 2048]
    - [124, 0.0]
  - - [512, 64, 1, 2048]
    - [179, 0.0]
  - - [576, 64, 1, 2048]
    - [410, 0.0]
  - - [640, 64, 1, 2048]
    - [179, 0.0]
  - - [704, 64, 1, 2048]
    - [170, 0.0]
  - - [768, 64, 1, 2048]
    - [218, 0.0]
  - - [832, 64, 1, 2048]
    - [219, 0.0]
  - - [896, 64, 1, 2048]
    - [179, 0.0]
  - - [960, 64, 1, 2048]
    - [139, 0.0]
  - - [1024, 64, 1, 2048]
    - [218, 0.0]
  - - [64, 128, 1, 2048]
    - [220, 0.0]
  - - [128, 128, 1, 2048]
    - [179, 0.0]
  - - [192, 128, 1, 2048]
    - [146, 0.0]
  - - [256, 128, 1, 2048]
    - [179, 0.0]
  - - [320, 128, 1, 2048]
    - [179, 0.0]
  - - [384, 128, 1, 2048]
    - [218, 0.0]
  - - [448, 128, 1, 2048]
    - [221, 0.0]
  - - [512, 128, 1, 2048]
    - [179, 0.0]
  - - [576, 128, 1, 2048]
    - [145, 0.0]
  - - [640, 128, 1, 2048]
    - [205, 0.0]
  - - [704, 128, 1, 2048]
    - [198, 0.0]
  - - [768, 128, 1, 2048]
    - [194, 0.0]
  - - [832, 128, 1, 2048]
    - [198, 0.0]
  - - [896, 128, 1, 2048]
    - [194, 0.0]
  - - [960, 128, 1, 2048]
    - [145, 0.0]
  - - [1024, 128, 1, 2048]
    - [194, 0.0]
  - - [64, 192, 1, 2048]
    - [168, 0.0]
  - - [128, 192, 1, 2048]
    - [185, 0.0]
  - - [192, 192, 1, 2048]
    - [128, 0.0]
  - - [256, 192, 1, 2048]
    - [145, 0.0]
  - - [320, 192, 1, 2048]
    - [218, 0.0]
  - - [384, 192, 1, 2048]
    - [156, 0.0]
  - - [448, 192, 1, 2048]
    - [132, 0.0]
  - - [512, 192, 1, 2048]
    - [194, 0.0]
  - - [576, 192, 1, 2048]
    - [138, 0.0]
  - - [640, 192, 1, 2048]
    - [194, 0.0]
  - - [704, 192, 1, 2048]
    - [149, 0.0]
  - - [768, 192, 1, 2048]
    - [145, 0.0]
  - - [832, 192, 1, 2048]
    - [160, 0.0]
  - - [896, 192, 1, 2048]
    - [194, 0.0]
  - - [960, 192, 1, 2048]
    - [134, 0.0]
  - - [1024, 192, 1, 2048]
    - [198, 0.0]
  - - [64, 256, 1, 2048]
    - [219, 0.0]
  - - [128, 256, 1, 2048]
    - [127, 0.0]
  - - [192, 256, 1, 2048]
    - [176, 0.0]
  - - [256, 256, 1, 2048]
    - [198, 0.0]
  - - [320, 256, 1, 2048]
    - [194, 0.0]
  - - [384, 256, 1, 2048]
    - [145, 0.0]
  - - [448, 256, 1, 2048]
    - [145, 0.0]
  - - [512, 256, 1, 2048]
    - [194, 0.0]
  - - [576, 256, 1, 2048]
    - [194, 0.0]
  - - [640, 256, 1, 2048]
    - [142, 0.0]
  - - [704, 256, 1, 2048]
    - [202, 0.0]
  - - [768, 256, 1, 2048]
    - [110, 0.0]
  - - [832, 256, 1, 2048]
    - [202, 0.0]
  - - [896, 256, 1, 2048]
    - [110, 0.0]
  - - [960, 256, 1, 2048]
    - [110, 0.0]
  - - [1024, 256, 1, 2048]
    - [194, 0.0]
  - - [64, 320, 1, 2048]
    - [131, 0.0]
  - - [128, 320, 1, 2048]
    - [222, 0.0]
  - - [192, 320, 1, 2048]
    - [169, 0.0]
  - - [256, 320, 1, 2048]
    - [145, 0.0]
  - - [320, 320, 1, 2048]
    - [133, 0.0]
  - - [384, 320, 1, 2048]
    - [223, 0.0]
  - - [448, 320, 1, 2048]
    - [116, 0.0]
  - - [512, 320, 1, 2048]
    - [110, 0.0]
  - - [576, 320, 1, 2048]
    - [136, 0.0]
  - - [640, 320, 1, 2048]
    - [186, 0.0]
  - - [704, 320, 1, 2048]
    - [136, 0.0]
  - - [768, 320, 1, 2048]
    - [142, 0.0]
  - - [832, 320, 1, 2048]
    - [116, 0.0]
  - - [896, 320, 1, 2048]
    - [134, 0.0]
  - - [960, 320, 1, 2048]
    - [20, 0.0]
  - - [1024, 320, 1, 2048]
    - [224, 0.0]
  - - [64, 384, 1, 2048]
    - [225, 0.0]
  - - [128, 384, 1, 2048]
    - [222, 0.0]
  - - [192, 384, 1, 2048]
    - [194, 0.0]
  - - [256, 384, 1, 2048]
    - [145, 0.0]
  - - [320, 384, 1, 2048]
    - [145, 0.0]
  - - [384, 384, 1, 2048]
    - [145, 0.0]
  - - [448, 384, 1, 2048]
    - [226, 0.0]
  - - [512, 384, 1, 2048]
    - [199, 0.0]
  - - [576, 384, 1, 2048]
    - [110, 0.0]
  - - [640, 384, 1, 2048]
    - [227, 0.0]
  - - [704, 384, 1, 2048]
    - [132, 0.0]
  - - [768, 384, 1, 2048]
    - [62, 0.0]
  - - [832, 384, 1, 2048]
    - [151, 0.0]
  - - [896, 384, 1, 2048]
    - [142, 0.0]
  - - [960, 384, 1, 2048]
    - [151, 0.0]
  - - [1024, 384, 1, 2048]
    - [134, 0.0]
  - - [64, 448, 1, 2048]
    - [170, 0.0]
  - - [128, 448, 1, 2048]
    - [202, 0.0]
  - - [192, 448, 1, 2048]
    - [132, 0.0]
  - - [256, 448, 1, 2048]
    - [198, 0.0]
  - - [320, 448, 1, 2048]
    - [194, 0.0]
  - - [384, 448, 1, 2048]
    - [198, 0.0]
  - - [448, 448, 1, 2048]
    - [136, 0.0]
  - - [512, 448, 1, 2048]
    - [226, 0.0]
  - - [576, 448, 1, 2048]
    - [20, 0.0]
  - - [640, 448, 1, 2048]
    - [136, 0.0]
  - - [704, 448, 1, 2048]
    - [20, 0.0]
  - - [768, 448, 1, 2048]
    - [132, 0.0]
  - - [832, 448, 1, 2048]
    - [20, 0.0]
  - - [896, 448, 1, 2048]
    - [162, 0.0]
  - - [960, 448, 1, 2048]
    - [20, 0.0]
  - - [1024, 448, 1, 2048]
    - [114, 0.0]
  - - [64, 512, 1, 2048]
    - [213, 0.0]
  - - [128, 512, 1, 2048]
    - [222, 0.0]
  - - [192, 512, 1, 2048]
    - [198, 0.0]
  - - [256, 512, 1, 2048]
    - [205, 0.0]
  - - [320, 512, 1, 2048]
    - [202, 0.0]
  - - [384, 512, 1, 2048]
    - [202, 0.0]
  - - [448, 512, 1, 2048]
    - [202, 0.0]
  - - [512, 512, 1, 2048]
    - [62, 0.0]
  - - [576, 512, 1, 2048]
    - [149, 0.0]
  - - [640, 512, 1, 2048]
    - [138, 0.0]
  - - [704, 512, 1, 2048]
    - [149, 0.0]
  - - [768, 512, 1, 2048]
    - [149, 0.0]
  - - [832, 512, 1, 2048]
    - [151, 0.0]
  - - [896, 512, 1, 2048]
    - [208, 0.0]
  - - [960, 512, 1, 2048]
    - [151, 0.0]
  - - [1024, 512, 1, 2048]
    - [228, 0.0]
  - - [64, 576, 1, 2048]
    - [408, 0.0]
  - - [128, 576, 1, 2048]
    - [145, 0.0]
  - - [192, 576, 1, 2048]
    - [136, 0.0]
  - - [256, 576, 1, 2048]
    - [205, 0.0]
  - - [320, 576, 1, 2048]
    - [116, 0.0]
  - - [384, 576, 1, 2048]
    - [145, 0.0]
  - - [448, 576, 1, 2048]
    - [116, 0.0]
  - - [512, 576, 1, 2048]
    - [116, 0.0]
  - - [576, 576, 1, 2048]
    - [411, 0.0]
  - - [640, 576, 1, 2048]
    - [62, 0.0]
  - - [704, 576, 1, 2048]
    - [21, 0.0]
  - - [768, 576, 1, 2048]
    - [114, 0.0]
  - - [832, 576, 1, 2048]
    - [211, 0.0]
  - - [896, 576, 1, 2048]
    - [207, 0.0]
  - - [960, 576, 1, 2048]
    - [20, 0.0]
  - - [1024, 576, 1, 2048]
    - [204, 0.0]
  - - [64, 640, 1, 2048]
    - [213, 0.0]
  - - [128, 640, 1, 2048]
    - [194, 0.0]
  - - [192, 640, 1, 2048]
    - [198, 0.0]
  - - [256, 640, 1, 2048]
    - [198, 0.0]
  - - [320, 640, 1, 2048]
    - [145, 0.0]
  - - [384, 640, 1, 2048]
    - [198, 0.0]
  - - [448, 640, 1, 2048]
    - [116, 0.0]
  - - [512, 640, 1, 2048]
    - [62, 0.0]
  - - [576, 640, 1, 2048]
    - [110, 0.0]
  - - [640, 640, 1, 2048]
    - [207, 0.0]
  - - [704, 640, 1, 2048]
    - [158, 0.0]
  - - [768, 640, 1, 2048]
    - [158, 0.0]
  - - [832, 640, 1, 2048]
    - [158, 0.0]
  - - [896, 640, 1, 2048]
    - [207, 0.0]
  - - [960, 640, 1, 2048]
    - [204, 0.0]
  - - [1024, 640, 1, 2048]
    - [158, 0.0]
  - - [64, 704, 1, 2048]
    - [180, 0.0]
  - - [128, 704, 1, 2048]
    - [198, 0.0]
  - - [192, 704, 1, 2048]
    - [149, 0.0]
  - - [256, 704, 1, 2048]
    - [116, 0.0]
  - - [320, 704, 1, 2048]
    - [199, 0.0]
  - - [384, 704, 1, 2048]
    - [62, 0.0]
  - - [448, 704, 1, 2048]
    - [20, 0.0]
  - - [512, 704, 1, 2048]
    - [62, 0.0]
  - - [576, 704, 1, 2048]
    - [181, 0.0]
  - - [640, 704, 1, 2048]
    - [162, 0.0]
  - - [704, 704, 1, 2048]
    - [20, 0.0]
  - - [768, 704, 1, 2048]
    - [204, 0.0]
  - - [832, 704, 1, 2048]
    - [20, 0.0]
  - - [896, 704, 1, 2048]
    - [162, 0.0]
  - - [960, 704, 1, 2048]
    - [181, 0.0]
  - - [1024, 704, 1, 2048]
    - [158, 0.0]
  - - [64, 768, 1, 2048]
    - [213, 0.0]
  - - [128, 768, 1, 2048]
    - [145, 0.0]
  - - [192, 768, 1, 2048]
    - [145, 0.0]
  - - [256, 768, 1, 2048]
    - [134, 0.0]
  - - [320, 768, 1, 2048]
    - [110, 0.0]
  - - [384, 768, 1, 2048]
    - [62, 0.0]
  - - [448, 768, 1, 2048]
    - [116, 0.0]
  - - [512, 768, 1, 2048]
    - [62, 0.0]
  - - [576, 768, 1, 2048]
    - [212, 0.0]
  - - [640, 768, 1, 2048]
    - [228, 0.0]
  - - [704, 768, 1, 2048]
    - [204, 0.0]
  - - [768, 768, 1, 2048]
    - [204, 0.0]
  - - [832, 768, 1, 2048]
    - [204, 0.0]
  - - [896, 768, 1, 2048]
    - [229, 0.0]
  - - [960, 768, 1, 2048]
    - [230, 0.0]
  - - [1024, 768, 1, 2048]
    - [209, 0.0]
  - - [64, 832, 1, 2048]
    - [130, 0.0]
  - - [128, 832, 1, 2048]
    - [145, 0.0]
  - - [192, 832, 1, 2048]
    - [133, 0.0]
  - - [256, 832, 1, 2048]
    - [186, 0.0]
  - - [320, 832, 1, 2048]
    - [116, 0.0]
  - - [384, 832, 1, 2048]
    - [116, 0.0]
  - - [448, 832, 1, 2048]
    - [20, 0.0]
  - - [512, 832, 1, 2048]
    - [114, 0.0]
  - - [576, 832, 1, 2048]
    - [20, 0.0]
  - - [640, 832, 1, 2048]
    - [204, 0.0]
  - - [704, 832, 1, 2048]
    - [31, 0.0]
  - - [768, 832, 1, 2048]
    - [112, 0.0]
  - - [832, 832, 1, 2048]
    - [181, 0.0]
  - - [896, 832, 1, 2048]
    - [207, 0.0]
  - - [960, 832, 1, 2048]
    - [20, 0.0]
  - - [1024, 832, 1, 2048]
    - [215, 0.0]
  - - [64, 896, 1, 2048]
    - [222, 0.0]
  - - [128, 896, 1, 2048]
    - [145, 0.0]
  - - [192, 896, 1, 2048]
    - [198, 0.0]
  - - [256, 896, 1, 2048]
    - [186, 0.0]
  - - [320, 896, 1, 2048]
    - [62, 0.0]
  - - [384, 896, 1, 2048]
    - [160, 0.0]
  - - [448, 896, 1, 2048]
    - [114, 0.0]
  - - [512, 896, 1, 2048]
    - [114, 0.0]
  - - [576, 896, 1, 2048]
    - [114, 0.0]
  - - [640, 896, 1, 2048]
    - [229, 0.0]
  - - [704, 896, 1, 2048]
    - [112, 0.0]
  - - [768, 896, 1, 2048]
    - [114, 0.0]
  - - [832, 896, 1, 2048]
    - [114, 0.0]
  - - [896, 896, 1, 2048]
    - [83, 0.0]
  - - [960, 896, 1, 2048]
    - [112, 0.0]
  - - [1024, 896, 1, 2048]
    - [209, 0.0]
  - - [64, 960, 1, 2048]
    - [130, 0.0]
  - - [128, 960, 1, 2048]
    - [145, 0.0]
  - - [192, 960, 1, 2048]
    - [136, 0.0]
  - - [256, 960, 1, 2048]
    - [138, 0.0]
  - - [320, 960, 1, 2048]
    - [20, 0.0]
  - - [384, 960, 1, 2048]
    - [136, 0.0]
  - - [448, 960, 1, 2048]
    - [20, 0.0]
  - - [512, 960, 1, 2048]
    - [231, 0.0]
  - - [576, 960, 1, 2048]
    - [20, 0.0]
  - - [640, 960, 1, 2048]
    - [207, 0.0]
  - - [704, 960, 1, 2048]
    - [20, 0.0]
  - - [768, 960, 1, 2048]
    - [112, 0.0]
  - - [832, 960, 1, 2048]
    - [163, 0.0]
  - - [896, 960, 1, 2048]
    - [83, 0.0]
  - - [960, 960, 1, 2048]
    - [62, 0.0]
  - - [1024, 960, 1, 2048]
    - [232, 0.0]
  - - [64, 1024, 1, 2048]
    - [185, 0.0]
  - - [128, 1024, 1, 2048]
    - [194, 0.0]
  - - [192, 1024, 1, 2048]
    - [110, 0.0]
  - - [256, 1024, 1, 2048]
    - [145, 0.0]
  - - [320, 1024, 1, 2048]
    - [160, 0.0]
  - - [384, 1024, 1, 2048]
    - [116, 0.0]
  - - [448, 1024, 1, 2048]
    - [61, 0.0]
  - - [512, 1024, 1, 2048]
    - [214, 0.0]
  - - [576, 1024, 1, 2048]
    - [204, 0.0]
  - - [640, 1024, 1, 2048]
    - [207, 0.0]
  - - [704, 1024, 1, 2048]
    - [230, 0.0]
  - - [768, 1024, 1, 2048]
    - [215, 0.0]
  - - [832, 1024, 1, 2048]
    - [233, 0.0]
  - - [896, 1024, 1, 2048]
    - [215, 0.0]
  - - [960, 1024, 1, 2048]
    - [152, 0.0]
  - - [1024, 1024, 1, 2048]
    - [234, 0.0]
  - - [128, 64, 1, 4096]
    - [193, 0.0]
  - - [192, 64, 1, 4096]
    - [219, 0.0]
  - - [256, 64, 1, 4096]
    - [177, 0.0]
  - - [320, 64, 1, 4096]
    - [179, 0.0]
  - - [384, 64, 1, 4096]
    - [177, 0.0]
  - - [448, 64, 1, 4096]
    - [129, 0.0]
  - - [512, 64, 1, 4096]
    - [179, 0.0]
  - - [576, 64, 1, 4096]
    - [179, 0.0]
  - - [640, 64, 1, 4096]
    - [218, 0.0]
  - - [704, 64, 1, 4096]
    - [170, 0.0]
  - - [768, 64, 1, 4096]
    - [179, 0.0]
  - - [832, 64, 1, 4096]
    - [179, 0.0]
  - - [896, 64, 1, 4096]
    - [218, 0.0]
  - - [960, 64, 1, 4096]
    - [169, 0.0]
  - - [1024, 64, 1, 4096]
    - [218, 0.0]
  - - [64, 128, 1, 4096]
    - [235, 0.0]
  - - [128, 128, 1, 4096]
    - [218, 0.0]
  - - [192, 128, 1, 4096]
    - [213, 0.0]
  - - [256, 128, 1, 4096]
    - [218, 0.0]
  - - [320, 128, 1, 4096]
    - [218, 0.0]
  - - [384, 128, 1, 4096]
    - [218, 0.0]
  - - [448, 128, 1, 4096]
    - [218, 0.0]
  - - [512, 128, 1, 4096]
    - [175, 0.0]
  - - [576, 128, 1, 4096]
    - [145, 0.0]
  - - [640, 128, 1, 4096]
    - [194, 0.0]
  - - [704, 128, 1, 4096]
    - [194, 0.0]
  - - [768, 128, 1, 4096]
    - [145, 0.0]
  - - [832, 128, 1, 4096]
    - [145, 0.0]
  - - [896, 128, 1, 4096]
    - [145, 0.0]
  - - [960, 128, 1, 4096]
    - [194, 0.0]
  - - [1024, 128, 1, 4096]
    - [194, 0.0]
  - - [64, 192, 1, 4096]
    - [168, 0.0]
  - - [128, 192, 1, 4096]
    - [236, 0.0]
  - - [192, 192, 1, 4096]
    - [139, 0.0]
  - - [256, 192, 1, 4096]
    - [194, 0.0]
  - - [320, 192, 1, 4096]
    - [218, 0.0]
  - - [384, 192, 1, 4096]
    - [145, 0.0]
  - - [448, 192, 1, 4096]
    - [132, 0.0]
  - - [512, 192, 1, 4096]
    - [145, 0.0]
  - - [576, 192, 1, 4096]
    - [138, 0.0]
  - - [640, 192, 1, 4096]
    - [205, 0.0]
  - - [704, 192, 1, 4096]
    - [145, 0.0]
  - - [768, 192, 1, 4096]
    - [145, 0.0]
  - - [832, 192, 1, 4096]
    - [237, 0.0]
  - - [896, 192, 1, 4096]
    - [194, 0.0]
  - - [960, 192, 1, 4096]
    - [142, 0.0]
  - - [1024, 192, 1, 4096]
    - [194, 0.0]
  - - [64, 256, 1, 4096]
    - [225, 0.0]
  - - [128, 256, 1, 4096]
    - [185, 0.0]
  - - [192, 256, 1, 4096]
    - [195, 0.0]
  - - [256, 256, 1, 4096]
    - [194, 0.0]
  - - [320, 256, 1, 4096]
    - [194, 0.0]
  - - [384, 256, 1, 4096]
    - [194, 0.0]
  - - [448, 256, 1, 4096]
    - [194, 0.0]
  - - [512, 256, 1, 4096]
    - [194, 0.0]
  - - [576, 256, 1, 4096]
    - [194, 0.0]
  - - [640, 256, 1, 4096]
    - [194, 0.0]
  - - [704, 256, 1, 4096]
    - [226, 0.0]
  - - [768, 256, 1, 4096]
    - [110, 0.0]
  - - [832, 256, 1, 4096]
    - [194, 0.0]
  - - [896, 256, 1, 4096]
    - [238, 0.0]
  - - [960, 256, 1, 4096]
    - [226, 0.0]
  - - [1024, 256, 1, 4096]
    - [194, 0.0]
  - - [64, 320, 1, 4096]
    - [139, 0.0]
  - - [128, 320, 1, 4096]
    - [146, 0.0]
  - - [192, 320, 1, 4096]
    - [139, 0.0]
  - - [256, 320, 1, 4096]
    - [205, 0.0]
  - - [320, 320, 1, 4096]
    - [194, 0.0]
  - - [384, 320, 1, 4096]
    - [194, 0.0]
  - - [448, 320, 1, 4096]
    - [151, 0.0]
  - - [512, 320, 1, 4096]
    - [145, 0.0]
  - - [576, 320, 1, 4096]
    - [194, 0.0]
  - - [640, 320, 1, 4096]
    - [194, 0.0]
  - - [704, 320, 1, 4096]
    - [132, 0.0]
  - - [768, 320, 1, 4096]
    - [142, 0.0]
  - - [832, 320, 1, 4096]
    - [62, 0.0]
  - - [896, 320, 1, 4096]
    - [142, 0.0]
  - - [960, 320, 1, 4096]
    - [181, 0.0]
  - - [1024, 320, 1, 4096]
    - [151, 0.0]
  - - [64, 384, 1, 4096]
    - [185, 0.0]
  - - [128, 384, 1, 4096]
    - [194, 0.0]
  - - [192, 384, 1, 4096]
    - [145, 0.0]
  - - [256, 384, 1, 4096]
    - [194, 0.0]
  - - [320, 384, 1, 4096]
    - [194, 0.0]
  - - [384, 384, 1, 4096]
    - [194, 0.0]
  - - [448, 384, 1, 4096]
    - [145, 0.0]
  - - [512, 384, 1, 4096]
    - [226, 0.0]
  - - [576, 384, 1, 4096]
    - [62, 0.0]
  - - [640, 384, 1, 4096]
    - [78, 0.0]
  - - [704, 384, 1, 4096]
    - [132, 0.0]
  - - [768, 384, 1, 4096]
    - [151, 0.0]
  - - [832, 384, 1, 4096]
    - [135, 0.0]
  - - [896, 384, 1, 4096]
    - [138, 0.0]
  - - [960, 384, 1, 4096]
    - [116, 0.0]
  - - [1024, 384, 1, 4096]
    - [134, 0.0]
  - - [64, 448, 1, 4096]
    - [239, 0.0]
  - - [128, 448, 1, 4096]
    - [145, 0.0]
  - - [192, 448, 1, 4096]
    - [132, 0.0]
  - - [256, 448, 1, 4096]
    - [194, 0.0]
  - - [320, 448, 1, 4096]
    - [161, 0.0]
  - - [384, 448, 1, 4096]
    - [198, 0.0]
  - - [448, 448, 1, 4096]
    - [148, 0.0]
  - - [512, 448, 1, 4096]
    - [226, 0.0]
  - - [576, 448, 1, 4096]
    - [20, 0.0]
  - - [640, 448, 1, 4096]
    - [136, 0.0]
  - - [704, 448, 1, 4096]
    - [20, 0.0]
  - - [768, 448, 1, 4096]
    - [136, 0.0]
  - - [832, 448, 1, 4096]
    - [20, 0.0]
  - - [896, 448, 1, 4096]
    - [162, 0.0]
  - - [960, 448, 1, 4096]
    - [20, 0.0]
  - - [1024, 448, 1, 4096]
    - [240, 0.0]
  - - [64, 512, 1, 4096]
    - [185, 0.0]
  - - [128, 512, 1, 4096]
    - [194, 0.0]
  - - [192, 512, 1, 4096]
    - [145, 0.0]
  - - [256, 512, 1, 4096]
    - [198, 0.0]
  - - [320, 512, 1, 4096]
    - [194, 0.0]
  - - [384, 512, 1, 4096]
    - [202, 0.0]
  - - [448, 512, 1, 4096]
    - [194, 0.0]
  - - [512, 512, 1, 4096]
    - [62, 0.0]
  - - [576, 512, 1, 4096]
    - [149, 0.0]
  - - [640, 512, 1, 4096]
    - [151, 0.0]
  - - [704, 512, 1, 4096]
    - [149, 0.0]
  - - [768, 512, 1, 4096]
    - [151, 0.0]
  - - [832, 512, 1, 4096]
    - [230, 0.0]
  - - [896, 512, 1, 4096]
    - [207, 0.0]
  - - [960, 512, 1, 4096]
    - [207, 0.0]
  - - [1024, 512, 1, 4096]
    - [214, 0.0]
  - - [64, 576, 1, 4096]
    - [218, 0.0]
  - - [128, 576, 1, 4096]
    - [145, 0.0]
  - - [192, 576, 1, 4096]
    - [132, 0.0]
  - - [256, 576, 1, 4096]
    - [145, 0.0]
  - - [320, 576, 1, 4096]
    - [205, 0.0]
  - - [384, 576, 1, 4096]
    - [198, 0.0]
  - - [448, 576, 1, 4096]
    - [116, 0.0]
  - - [512, 576, 1, 4096]
    - [61, 0.0]
  - - [576, 576, 1, 4096]
    - [62, 0.0]
  - - [640, 576, 1, 4096]
    - [116, 0.0]
  - - [704, 576, 1, 4096]
    - [20, 0.0]
  - - [768, 576, 1, 4096]
    - [241, 0.0]
  - - [832, 576, 1, 4096]
    - [116, 0.0]
  - - [896, 576, 1, 4096]
    - [207, 0.0]
  - - [960, 576, 1, 4096]
    - [211, 0.0]
  - - [1024, 576, 1, 4096]
    - [114, 0.0]
  - - [64, 640, 1, 4096]
    - [213, 0.0]
  - - [128, 640, 1, 4096]
    - [145, 0.0]
  - - [192, 640, 1, 4096]
    - [145, 0.0]
  - - [256, 640, 1, 4096]
    - [145, 0.0]
  - - [320, 640, 1, 4096]
    - [197, 0.0]
  - - [384, 640, 1, 4096]
    - [198, 0.0]
  - - [448, 640, 1, 4096]
    - [160, 0.0]
  - - [512, 640, 1, 4096]
    - [62, 0.0]
  - - [576, 640, 1, 4096]
    - [160, 0.0]
  - - [640, 640, 1, 4096]
    - [158, 0.0]
  - - [704, 640, 1, 4096]
    - [158, 0.0]
  - - [768, 640, 1, 4096]
    - [158, 0.0]
  - - [832, 640, 1, 4096]
    - [114, 0.0]
  - - [896, 640, 1, 4096]
    - [114, 0.0]
  - - [960, 640, 1, 4096]
    - [158, 0.0]
  - - [1024, 640, 1, 4096]
    - [158, 0.0]
  - - [64, 704, 1, 4096]
    - [129, 0.0]
  - - [128, 704, 1, 4096]
    - [205, 0.0]
  - - [192, 704, 1, 4096]
    - [194, 0.0]
  - - [256, 704, 1, 4096]
    - [197, 0.0]
  - - [320, 704, 1, 4096]
    - [136, 0.0]
  - - [384, 704, 1, 4096]
    - [142, 0.0]
  - - [448, 704, 1, 4096]
    - [20, 0.0]
  - - [512, 704, 1, 4096]
    - [161, 0.0]
  - - [576, 704, 1, 4096]
    - [20, 0.0]
  - - [640, 704, 1, 4096]
    - [162, 0.0]
  - - [704, 704, 1, 4096]
    - [20, 0.0]
  - - [768, 704, 1, 4096]
    - [204, 0.0]
  - - [832, 704, 1, 4096]
    - [20, 0.0]
  - - [896, 704, 1, 4096]
    - [207, 0.0]
  - - [960, 704, 1, 4096]
    - [20, 0.0]
  - - [1024, 704, 1, 4096]
    - [242, 0.0]
  - - [64, 768, 1, 4096]
    - [185, 0.0]
  - - [128, 768, 1, 4096]
    - [145, 0.0]
  - - [192, 768, 1, 4096]
    - [194, 0.0]
  - - [256, 768, 1, 4096]
    - [110, 0.0]
  - - [320, 768, 1, 4096]
    - [110, 0.0]
  - - [384, 768, 1, 4096]
    - [161, 0.0]
  - - [448, 768, 1, 4096]
    - [116, 0.0]
  - - [512, 768, 1, 4096]
    - [116, 0.0]
  - - [576, 768, 1, 4096]
    - [243, 0.0]
  - - [640, 768, 1, 4096]
    - [207, 0.0]
  - - [704, 768, 1, 4096]
    - [204, 0.0]
  - - [768, 768, 1, 4096]
    - [204, 0.0]
  - - [832, 768, 1, 4096]
    - [204, 0.0]
  - - [896, 768, 1, 4096]
    - [162, 0.0]
  - - [960, 768, 1, 4096]
    - [243, 0.0]
  - - [1024, 768, 1, 4096]
    - [209, 0.0]
  - - [64, 832, 1, 4096]
    - [213, 0.0]
  - - [128, 832, 1, 4096]
    - [145, 0.0]
  - - [192, 832, 1, 4096]
    - [145, 0.0]
  - - [256, 832, 1, 4096]
    - [134, 0.0]
  - - [320, 832, 1, 4096]
    - [161, 0.0]
  - - [384, 832, 1, 4096]
    - [62, 0.0]
  - - [448, 832, 1, 4096]
    - [20, 0.0]
  - - [512, 832, 1, 4096]
    - [114, 0.0]
  - - [576, 832, 1, 4096]
    - [242, 0.0]
  - - [640, 832, 1, 4096]
    - [162, 0.0]
  - - [704, 832, 1, 4096]
    - [20, 0.0]
  - - [768, 832, 1, 4096]
    - [114, 0.0]
  - - [832, 832, 1, 4096]
    - [158, 0.0]
  - - [896, 832, 1, 4096]
    - [208, 0.0]
  - - [960, 832, 1, 4096]
    - [20, 0.0]
  - - [1024, 832, 1, 4096]
    - [209, 0.0]
  - - [64, 896, 1, 4096]
    - [213, 0.0]
  - - [128, 896, 1, 4096]
    - [194, 0.0]
  - - [192, 896, 1, 4096]
    - [145, 0.0]
  - - [256, 896, 1, 4096]
    - [132, 0.0]
  - - [320, 896, 1, 4096]
    - [62, 0.0]
  - - [384, 896, 1, 4096]
    - [62, 0.0]
  - - [448, 896, 1, 4096]
    - [158, 0.0]
  - - [512, 896, 1, 4096]
    - [114, 0.0]
  - - [576, 896, 1, 4096]
    - [114, 0.0]
  - - [640, 896, 1, 4096]
    - [158, 0.0]
  - - [704, 896, 1, 4096]
    - [158, 0.0]
  - - [768, 896, 1, 4096]
    - [158, 0.0]
  - - [832, 896, 1, 4096]
    - [112, 0.0]
  - - [896, 896, 1, 4096]
    - [83, 0.0]
  - - [960, 896, 1, 4096]
    - [158, 0.0]
  - - [1024, 896, 1, 4096]
    - [209, 0.0]
  - - [64, 960, 1, 4096]
    - [180, 0.0]
  - - [128, 960, 1, 4096]
    - [145, 0.0]
  - - [192, 960, 1, 4096]
    - [132, 0.0]
  - - [256, 960, 1, 4096]
    - [227, 0.0]
  - - [320, 960, 1, 4096]
    - [20, 0.0]
  - - [384, 960, 1, 4096]
    - [136, 0.0]
  - - [448, 960, 1, 4096]
    - [20, 0.0]
  - - [512, 960, 1, 4096]
    - [240, 0.0]
  - - [576, 960, 1, 4096]
    - [21, 0.0]
  - - [640, 960, 1, 4096]
    - [114, 0.0]
  - - [704, 960, 1, 4096]
    - [21, 0.0]
  - - [768, 960, 1, 4096]
    - [187, 0.0]
  - - [832, 960, 1, 4096]
    - [181, 0.0]
  - - [896, 960, 1, 4096]
    - [215, 0.0]
  - - [960, 960, 1, 4096]
    - [143, 0.0]
  - - [1024, 960, 1, 4096]
    - [209, 0.0]
  - - [64, 1024, 1, 4096]
    - [213, 0.0]
  - - [128, 1024, 1, 4096]
    - [205, 0.0]
  - - [192, 1024, 1, 4096]
    - [145, 0.0]
  - - [256, 1024, 1, 4096]
    - [145, 0.0]
  - - [320, 1024, 1, 4096]
    - [116, 0.0]
  - - [384, 1024, 1, 4096]
    - [160, 0.0]
  - - [448, 1024, 1, 4096]
    - [243, 0.0]
  - - [512, 1024, 1, 4096]
    - [214, 0.0]
  - - [576, 1024, 1, 4096]
    - [204, 0.0]
  - - [640, 1024, 1, 4096]
    - [207, 0.0]
  - - [704, 1024, 1, 4096]
    - [208, 0.0]
  - - [768, 1024, 1, 4096]
    - [209, 0.0]
  - - [832, 1024, 1, 4096]
    - [244, 0.0]
  - - [896, 1024, 1, 4096]
    - [216, 0.0]
  - - [960, 1024, 1, 4096]
    - [244, 0.0]
  - - [1024, 1024, 1, 4096]
    - [62, 0.0]
  - - [1088, 64, 1, 64]
    - [18, 0.0]
  - - [1216, 64, 1, 64]
    - [34, 0.0]
  - - [1344, 64, 1, 64]
    - [21, 0.0]
  - - [1472, 64, 1, 64]
    - [245, 0.0]
  - - [1600, 64, 1, 64]
    - [34, 0.0]
  - - [1728, 64, 1, 64]
    - [21, 0.0]
  - - [1856, 64, 1, 64]
    - [246, 0.0]
  - - [1984, 64, 1, 64]
    - [35, 0.0]
  - - [1088, 192, 1, 64]
    - [21, 0.0]
  - - [1216, 192, 1, 64]
    - [31, 0.0]
  - - [1344, 192, 1, 64]
    - [247, 0.0]
  - - [1472, 192, 1, 64]
    - [31, 0.0]
  - - [1600, 192, 1, 64]
    - [40, 0.0]
  - - [1728, 192, 1, 64]
    - [20, 0.0]
  - - [1856, 192, 1, 64]
    - [20, 0.0]
  - - [1984, 192, 1, 64]
    - [23, 0.0]
  - - [1088, 320, 1, 64]
    - [21, 0.0]
  - - [1216, 320, 1, 64]
    - [248, 0.0]
  - - [1344, 320, 1, 64]
    - [20, 0.0]
  - - [1472, 320, 1, 64]
    - [20, 0.0]
  - - [1600, 320, 1, 64]
    - [110, 0.0]
  - - [1728, 320, 1, 64]
    - [249, 0.0]
  - - [1856, 320, 1, 64]
    - [250, 0.0]
  - - [1984, 320, 1, 64]
    - [20, 0.0]
  - - [1088, 448, 1, 64]
    - [251, 0.0]
  - - [1216, 448, 1, 64]
    - [252, 0.0]
  - - [1344, 448, 1, 64]
    - [164, 0.0]
  - - [1472, 448, 1, 64]
    - [31, 0.0]
  - - [1600, 448, 1, 64]
    - [253, 0.0]
  - - [1728, 448, 1, 64]
    - [115, 0.0]
  - - [1856, 448, 1, 64]
    - [254, 0.0]
  - - [1984, 448, 1, 64]
    - [116, 0.0]
  - - [1088, 576, 1, 64]
    - [255, 0.0]
  - - [1216, 576, 1, 64]
    - [73, 0.0]
  - - [1344, 576, 1, 64]
    - [110, 0.0]
  - - [1472, 576, 1, 64]
    - [41, 0.0]
  - - [1600, 576, 1, 64]
    - [256, 0.0]
  - - [1728, 576, 1, 64]
    - [116, 0.0]
  - - [1856, 576, 1, 64]
    - [115, 0.0]
  - - [1984, 576, 1, 64]
    - [254, 0.0]
  - - [1088, 704, 1, 64]
    - [22, 0.0]
  - - [1216, 704, 1, 64]
    - [116, 0.0]
  - - [1344, 704, 1, 64]
    - [62, 0.0]
  - - [1472, 704, 1, 64]
    - [62, 0.0]
  - - [1600, 704, 1, 64]
    - [41, 0.0]
  - - [1728, 704, 1, 64]
    - [257, 0.0]
  - - [1856, 704, 1, 64]
    - [257, 0.0]
  - - [1984, 704, 1, 64]
    - [258, 0.0]
  - - [1088, 832, 1, 64]
    - [110, 0.0]
  - - [1216, 832, 1, 64]
    - [62, 0.0]
  - - [1344, 832, 1, 64]
    - [22, 0.0]
  - - [1472, 832, 1, 64]
    - [259, 0.0]
  - - [1600, 832, 1, 64]
    - [260, 0.0]
  - - [1728, 832, 1, 64]
    - [261, 0.0]
  - - [1856, 832, 1, 64]
    - [262, 0.0]
  - - [1984, 832, 1, 64]
    - [114, 0.0]
  - - [1088, 960, 1, 64]
    - [115, 0.0]
  - - [1216, 960, 1, 64]
    - [260, 0.0]
  - - [1344, 960, 1, 64]
    - [263, 0.0]
  - - [1472, 960, 1, 64]
    - [260, 0.0]
  - - [1600, 960, 1, 64]
    - [262, 0.0]
  - - [1728, 960, 1, 64]
    - [56, 0.0]
  - - [1856, 960, 1, 64]
    - [264, 0.0]
  - - [1984, 960, 1, 64]
    - [265, 0.0]
  - - [64, 1088, 1, 64]
    - [25, 0.0]
  - - [192, 1088, 1, 64]
    - [21, 0.0]
  - - [320, 1088, 1, 64]
    - [20, 0.0]
  - - [448, 1088, 1, 64]
    - [73, 0.0]
  - - [576, 1088, 1, 64]
    - [250, 0.0]
  - - [704, 1088, 1, 64]
    - [22, 0.0]
  - - [832, 1088, 1, 64]
    - [41, 0.0]
  - - [960, 1088, 1, 64]
    - [115, 0.0]
  - - [1088, 1088, 1, 64]
    - [110, 0.0]
  - - [1216, 1088, 1, 64]
    - [266, 0.0]
  - - [1344, 1088, 1, 64]
    - [262, 0.0]
  - - [1472, 1088, 1, 64]
    - [267, 0.0]
  - - [1600, 1088, 1, 64]
    - [268, 0.0]
  - - [1728, 1088, 1, 64]
    - [158, 0.0]
  - - [1856, 1088, 1, 64]
    - [269, 0.0]
  - - [1984, 1088, 1, 64]
    - [268, 0.0]
  - - [64, 1216, 1, 64]
    - [270, 0.0]
  - - [192, 1216, 1, 64]
    - [41, 0.0]
  - - [320, 1216, 1, 64]
    - [20, 0.0]
  - - [448, 1216, 1, 64]
    - [187, 0.0]
  - - [576, 1216, 1, 64]
    - [67, 0.0]
  - - [704, 1216, 1, 64]
    - [271, 0.0]
  - - [832, 1216, 1, 64]
    - [73, 0.0]
  - - [960, 1216, 1, 64]
    - [260, 0.0]
  - - [1088, 1216, 1, 64]
    - [272, 0.0]
  - - [1216, 1216, 1, 64]
    - [258, 0.0]
  - - [1344, 1216, 1, 64]
    - [242, 0.0]
